{
    "html_file": "offer_50_6.html",
    "name": "MSI PRO MP243XWDE, 23.8\"",
    "offer_link": "https://www.ditech.at/details.php?artnr=373243",
    "price": 203.9,
    "raw_specifications": {
        "AMD FreeSync": "Ja",
        "Abmessungen - Breite": "541.93mm",
        "Abmessungen - H\u00f6he": "182.16mm",
        "Abmessungen - Tiefe": "421.79 (mit standfu\u00df),  keine angabe (ohne standfu\u00df)mm",
        "Adaptive Sync": "Ja",
        "Anschl\u00fcsse - DisplayPort 1.2a 100Hz@1920x1080": "1",
        "Anschl\u00fcsse - HDMI 1.4 100Hz@1920x1080": "1",
        "Anwendung": "station\u00e4r",
        "Audio": "Lautsprecher (2x 3W),  1x Line-Out",
        "Aufl\u00f6sung": "1920x1080",
        "Beschichtung": "matt (non-glare)",
        "Besonderheiten": "Slim Bezel,  mechanische Tasten,  Sicherheitsschloss (Kensington)",
        "Bildwiederholfrequenz": "100Hz",
        "Blickwinkel": "178\u00b0/178\u00b0",
        "Diagonale": "23.8\"/60.5cm",
        "Ergonomie": "N/A (h\u00f6henverstellbar),  N/A (Pivot),  N/A (drehbar),  +20\u00b0/-5\u00b0 (neigbar),  keine Angabe (Schr\u00e4glage)",
        "FRC": "ja (6bit+2bit)",
        "Farbe": "schwarz",
        "Farbraum - DCI-P3": "89%",
        "Farbraum - sRGB": "119%",
        "Farbtiefe": "8bit (16.7 Mio. Farben)",
        "Form": "gerade (flat)",
        "Gewicht": "2.95kg (mit Standfu\u00df),  keine Angabe (ohne Standfu\u00df)",
        "HDR": "N/A",
        "Helligkeit": "300cd/m\u00b2",
        "Herstellergarantie": "zwei Jahre (Pickup&Return)",
        "Hintergrundbeleuchtung": "White-LED,  flicker-free,  Blaulichtfilter",
        "Kontrast - statisch": "1.000:1",
        "Lautsprecher": "Ja",
        "Leistungsaufnahme": "keine Angabe (maximal),  keine Angabe (typisch),  keine Angabe (Energielabel alt A+++ bis G),  keine Angabe (Standby)",
        "Panel": "IPS",
        "Reaktionszeit - GtG": "4ms",
        "Reaktionszeit - MPRT": "1ms",
        "Screen-to-Body-Ratio": "keine Angabe (berechnet)",
        "Seitenverh\u00e4ltnis": "16:9",
        "Signalfrequenz": "keine Angabe (horizontal),  keine Angabe (vertikal)",
        "Stromversorgung": "DC-In (externes Netzteil)",
        "USB-Hub In": "N/A",
        "USB-Hub Out": "N/A",
        "USB-Schreibweise": "Link",
        "VESA": "75x75 (frei)",
        "Weitere Anschl\u00fcsse": "N/A"
    },
    "raw_specifications_text": "Abmessungen - Breite: 541.93mm\nAbmessungen - H\u00f6he: 182.16mm\nAbmessungen - Tiefe: 421.79 (mit standfu\u00df),  keine angabe (ohne standfu\u00df)mm\nAdaptive Sync: Ja\nAMD FreeSync: Ja\nAnschl\u00fcsse - DisplayPort 1.2a 100Hz@1920x1080: 1\nAnschl\u00fcsse - HDMI 1.4 100Hz@1920x1080: 1\nAnwendung: station\u00e4r\nAudio: Lautsprecher (2x 3W),  1x Line-Out\nAufl\u00f6sung: 1920x1080\nBeschichtung: matt (non-glare)\nBesonderheiten: Slim Bezel,  mechanische Tasten,  Sicherheitsschloss (Kensington)\nBildwiederholfrequenz: 100Hz\nBlickwinkel: 178\u00b0/178\u00b0\nDiagonale: 23.8\"/60.5cm\nErgonomie: N/A (h\u00f6henverstellbar),  N/A (Pivot),  N/A (drehbar),  +20\u00b0/-5\u00b0 (neigbar),  keine Angabe (Schr\u00e4glage)\nFarbe: schwarz\nFarbraum - DCI-P3: 89%\nFarbraum - sRGB: 119%\nFarbtiefe: 8bit (16.7 Mio. Farben)\nForm: gerade (flat)\nFRC: ja (6bit+2bit)\nGewicht: 2.95kg (mit Standfu\u00df),  keine Angabe (ohne Standfu\u00df)\nHDR: N/A\nHelligkeit: 300cd/m\u00b2\nHerstellergarantie: zwei Jahre (Pickup&Return)\nHintergrundbeleuchtung: White-LED,  flicker-free,  Blaulichtfilter\nKontrast - statisch: 1.000:1\nLautsprecher: Ja\nLeistungsaufnahme: keine Angabe (maximal),  keine Angabe (typisch),  keine Angabe (Energielabel alt A+++ bis G),  keine Angabe (Standby)\nPanel: IPS\nReaktionszeit - GtG: 4ms\nReaktionszeit - MPRT: 1ms\nScreen-to-Body-Ratio: keine Angabe (berechnet)\nSeitenverh\u00e4ltnis: 16:9\nSignalfrequenz: keine Angabe (horizontal),  keine Angabe (vertikal)\nStromversorgung: DC-In (externes Netzteil)\nUSB-Hub In: N/A\nUSB-Hub Out: N/A\nUSB-Schreibweise: Link\nVESA: 75x75 (frei)\nWeitere Anschl\u00fcsse: N/A",
    "reference_file": "offer_reference_50.json",
    "shop_name": "DiTech.at"
}