{
    "html_file": "offer_1462_3.html",
    "name": "Samsung SA650, 34\"",
    "offer_link": "https://www.proshop.at/Bildschirm/Samsung-34-Bildschirm-S34A650UXU-3440x1440-100Hz-VA-90W-USB-HUB-HDR10-Curved-Black-5-ms-AMD-FreeSync/2922289?utm_source=geizhals&utm_medium=cpc&utm_campaign=pricesite",
    "price": 479.77,
    "raw_specifications": {
        "Abmessungen (Breite x Tiefe x H\u00f6he)": "80.66 cm x 23.49 cm x 55.33 cm - mit Fu\u00df",
        "Abmessungen (Breite x Tiefe x H\u00f6he) - mit Fu\u00df": "80.66 cm x 23.49 cm x 55.33 cm",
        "Adaptive-Sync Technologie": "AMD FreeSync",
        "Besonderheiten": "Bild f\u00fcr Bild, Spielmodus, Mega Dynamic Contrast Ratio, Eco Light Sensor, flimmerfreie Technologie, Image Size, Eco Saving Plus, Eye Saver Mode, Picture-in-Picture, Off Timer, Adaptive Picture, Auto Source Switch",
        "Bildschirmtyp": "VA",
        "Details zu Abmessungen & Gewicht": "Mit Fu\u00df - Breite: 80.66 cm - Tiefe: 23.49 cm - H\u00f6he: 55.33 cm - Gewicht: 7.6 kg  Ohne Fu\u00df - Breite: 80.66 cm - Tiefe: 12.81 cm - H\u00f6he: 36.94 cm - Gewicht: 5.1 kg",
        "Diagonalabmessung": "86.4 cm (34\")",
        "Display-Typ": "LED-hintergrundbeleuchteter LCD-Monitor / TFT-Aktivmatrix",
        "EAN": "8806090952654",
        "ENERGY STAR zertifiziert": "Ja",
        "Eingangsanschl\u00fcsse": "HDMI, DisplayPort, USB-C",
        "Eingangsspannung": "Wechselstrom 120/230 V",
        "Einstellungen der Anzeigeposition": "H\u00f6he, Pivot (Rotation), Drehung, Neigung",
        "Energie Effizienzklasse": "Klasse G",
        "Energieklasse (HDR)": "Klasse G",
        "Enthaltene Kabel": "1 x HDMI-Kabel  1 x USB-C Kabel",
        "Farbe": "Schwarz",
        "Farbunterst\u00fctzung": "1,07 Mrd. Farben",
        "Ger\u00e4tetyp": "LED-hintergrundbeleuchteter LCD-Monitor - 86.4 cm (34\")",
        "Geschwungener Bildschirm": "Ja (1000R)",
        "Gewicht": "7.6 kg",
        "HDR-Format": "HDR10",
        "HDR-f\u00e4hig": "HDR10",
        "Helligkeit": "300 cd/m\u00b2",
        "Hersteller": "Samsung",
        "Hintergrundbeleuchtungs-Technologie": "LED-Hintergrundbeleuchtung",
        "Horizontaler Betrachtungswinkel": "178",
        "H\u00f6heneinstellung": "120 mm",
        "Integrierte Peripherieger\u00e4te": "USB 3.0-Hub",
        "Kennzeichnung": "TUV",
        "Kontrast": "4000:1",
        "Leistungsaufnahme im Ein-Zustand": "35 W",
        "Leistungsmerkmale": "Slot f\u00fcr Sicherheitsschloss (Kabelschloss getrennt erh\u00e4ltlich)",
        "Modell": "LS34A650UXUXEN",
        "Native Aufl\u00f6sung": "UWQHD 3440 x 1440 bei 100 Hz",
        "Neigungswinkel": "-2/+25",
        "Produktbeschreibung": "Samsung S34A650UXU - S65UA Series - LED-Monitor - gebogen - 86.4 cm (34\") - HDR",
        "Reaktionszeit": "5 ms",
        "Rotationswinkel": "-2/+2",
        "Schlosstyp zur Diebstahlsicherung": "Kensington Slot",
        "Schnittstellen": "DisplayPort  HDMI  Kopfh\u00f6rer  3 x USB 3.0  USB-C (bis zu 90 W)  Netzwerk",
        "Schwenkwinkel": "60",
        "Seitenverh\u00e4ltnis": "21:9",
        "Spannung": "Wechselstrom 120/230 V",
        "Stromverbrauch (typisch)": "35 Watt",
        "Stromverbrauch HDR (eingeschaltet)": "38 kWh/1.000 h",
        "Stromverbrauch SDR (eingeschaltet)": "35 kWh/1.000 h",
        "TCO-zertifiziert": "TCO Certified Displays 8, TCO Certified Displays 9",
        "Transportbreite": "89.5 cm",
        "Transportgewicht": "9.7 kg",
        "Transporth\u00f6he": "47.1 cm",
        "Transporttiefe": "21.6 cm",
        "USB-Spannungsversorgung": "90 Watt",
        "Umweltschutzstandards": "TCO Certified Displays 8, TCO Certified Displays 9, ENERGY STAR-qualifiziert",
        "VESA-Halterung": "100 x 100 mm",
        "Vertikaler Betrachtungswinkel": "178",
        "Waren-Nr.": "2922289",
        "Zum Hersteller": "www.samsung.com"
    },
    "raw_specifications_text": "Hersteller: Samsung\nWaren-Nr.: 2922289\nModell: LS34A650UXUXEN\nEAN: 8806090952654\nZum Hersteller: www.samsung.com\nProduktbeschreibung: Samsung S34A650UXU - S65UA Series - LED-Monitor - gebogen - 86.4 cm (34\") - HDR\nGer\u00e4tetyp: LED-hintergrundbeleuchteter LCD-Monitor - 86.4 cm (34\")\nEnergie Effizienzklasse: Klasse G\nLeistungsaufnahme im Ein-Zustand: 35 W\nGeschwungener Bildschirm: Ja (1000R)\nAdaptive-Sync Technologie: AMD FreeSync\nLeistungsmerkmale: Slot f\u00fcr Sicherheitsschloss (Kabelschloss getrennt erh\u00e4ltlich)\nBildschirmtyp: VA\nSeitenverh\u00e4ltnis: 21:9\nNative Aufl\u00f6sung: UWQHD 3440 x 1440 bei 100 Hz\nHelligkeit: 300 cd/m\u00b2\nKontrast: 4000:1\nHDR-f\u00e4hig: HDR10\nReaktionszeit: 5 ms\nFarbunterst\u00fctzung: 1,07 Mrd. Farben\nEingangsanschl\u00fcsse: HDMI, DisplayPort, USB-C\nEinstellungen der Anzeigeposition: H\u00f6he, Pivot (Rotation), Drehung, Neigung\nSpannung: Wechselstrom 120/230 V\nFarbe: Schwarz\nAbmessungen (Breite x Tiefe x H\u00f6he) - mit Fu\u00df: 80.66 cm x 23.49 cm x 55.33 cm\nGewicht: 7.6 kg\nUmweltschutzstandards: TCO Certified Displays 8, TCO Certified Displays 9, ENERGY STAR-qualifiziert\nKennzeichnung: TUV\nDisplay-Typ: LED-hintergrundbeleuchteter LCD-Monitor / TFT-Aktivmatrix\nEnergieklasse (HDR): Klasse G\nDiagonalabmessung: 86.4 cm (34\")\nIntegrierte Peripherieger\u00e4te: USB 3.0-Hub\nUSB-Spannungsversorgung: 90 Watt\nHDR-Format: HDR10\nHorizontaler Betrachtungswinkel: 178\nVertikaler Betrachtungswinkel: 178\nHintergrundbeleuchtungs-Technologie: LED-Hintergrundbeleuchtung\nBesonderheiten: Bild f\u00fcr Bild, Spielmodus, Mega Dynamic Contrast Ratio, Eco Light Sensor, flimmerfreie Technologie, Image Size, Eco Saving Plus, Eye Saver Mode, Picture-in-Picture, Off Timer, Adaptive Picture, Auto Source Switch\nAbmessungen (Breite x Tiefe x H\u00f6he): 80.66 cm x 23.49 cm x 55.33 cm - mit Fu\u00df\nSchnittstellen: DisplayPort  HDMI  Kopfh\u00f6rer  3 x USB 3.0  USB-C (bis zu 90 W)  Netzwerk\nNeigungswinkel: -2/+25\nSchwenkwinkel: 60\nRotationswinkel: -2/+2\nH\u00f6heneinstellung: 120 mm\nVESA-Halterung: 100 x 100 mm\nEnthaltene Kabel: 1 x HDMI-Kabel  1 x USB-C Kabel\nSchlosstyp zur Diebstahlsicherung: Kensington Slot\nEingangsspannung: Wechselstrom 120/230 V\nStromverbrauch SDR (eingeschaltet): 35 kWh/1.000 h\nStromverbrauch HDR (eingeschaltet): 38 kWh/1.000 h\nStromverbrauch (typisch): 35 Watt\nDetails zu Abmessungen & Gewicht: Mit Fu\u00df - Breite: 80.66 cm - Tiefe: 23.49 cm - H\u00f6he: 55.33 cm - Gewicht: 7.6 kg  Ohne Fu\u00df - Breite: 80.66 cm - Tiefe: 12.81 cm - H\u00f6he: 36.94 cm - Gewicht: 5.1 kg\nTransportbreite: 89.5 cm\nTransporttiefe: 21.6 cm\nTransporth\u00f6he: 47.1 cm\nTransportgewicht: 9.7 kg\nTCO-zertifiziert: TCO Certified Displays 8, TCO Certified Displays 9\nENERGY STAR zertifiziert: Ja",
    "reference_file": "offer_reference_1462.json",
    "shop_name": "Proshop.at"
}