{
    "html_file": "offer_688_15.html",
    "name": "Cooler Master Tempest GP27U, 27\"",
    "offer_link": "https://www.taufnaus.de/product/12846531",
    "price": 1073.03,
    "raw_specifications": {
        "Abmessungen (Breite x Tiefe x H\u00f6he)": "61.8 cm x 27.4 cm x 41.6 cm - mit Standfu\u00df (niedrigste Position)",
        "Adaptive-Sync Technologie": "AMD FreeSync Premium",
        "Ausgangsleistung/Kanal": "2 Watt",
        "Besonderheiten": "Low Blue Light-Technologie, Monitorkalibrierung Delta E<2, hintere Beleuchtung",
        "Bildschirmtyp": "AHVA",
        "Diagonalabmessung": "68.6 cm (27\")",
        "Display-Typ": "LED-hintergrundbeleuchteter LCD-Monitor / TFT-Aktivmatrix",
        "Einstellungen der Anzeigeposition": "H\u00f6he, Drehung, Neigung",
        "Energie Effizienzklasse": "Klasse G",
        "Farbraum": "97% DCI-P3, 99% Adobe RGB, 83% BT.2020",
        "Farbunterst\u00fctzung": "16,7 Millionen Farben (8-Bit)",
        "Gaming": "Ja",
        "Gewicht": "5.1 kg",
        "HDR-Format": "HDR1000",
        "Helligkeit": "600 cd/m\u00b2",
        "Hintergrundbeleuchtungs-Technologie": "LED-Hintergrundbeleuchtung",
        "Kontrast": "1000:1 / 10000:1 (dynamisch)",
        "Native Aufl\u00f6sung": "4K 3840 x 2160 bei 160 Hz",
        "Reaktionszeit": "1 ms (Gray-to-Gray)",
        "Schnittstellen": "2 x HDMI \u00a6 DisplayPort \u00a6 USB-C",
        "Seitenverh\u00e4ltnis": "16:9",
        "Service und Support": "Begrenzte Garantie - 3 Jahre",
        "Stromverbrauch SDR (eingeschaltet)": "55 kWh/1.000 h",
        "Typ": "Lautsprecher - Stereo",
        "VESA-Halterung": "100 x 100 mm"
    },
    "raw_specifications_text": "Display-Typ: LED-hintergrundbeleuchteter LCD-Monitor / TFT-Aktivmatrix\nEnergie Effizienzklasse: Klasse G\nDiagonalabmessung: 68.6 cm (27\")\nAdaptive-Sync Technologie: AMD FreeSync Premium\nBildschirmtyp: AHVA\nSeitenverh\u00e4ltnis: 16:9\nNative Aufl\u00f6sung: 4K 3840 x 2160 bei 160 Hz\nHelligkeit: 600 cd/m\u00b2\nKontrast: 1000:1 / 10000:1 (dynamisch)\nHDR-Format: HDR1000\nFarbunterst\u00fctzung: 16,7 Millionen Farben (8-Bit)\nFarbraum: 97% DCI-P3, 99% Adobe RGB, 83% BT.2020\nReaktionszeit: 1 ms (Gray-to-Gray)\nGaming: Ja\nHintergrundbeleuchtungs-Technologie: LED-Hintergrundbeleuchtung\nBesonderheiten: Low Blue Light-Technologie, Monitorkalibrierung Delta E<2, hintere Beleuchtung\nAbmessungen (Breite x Tiefe x H\u00f6he): 61.8 cm x 27.4 cm x 41.6 cm - mit Standfu\u00df (niedrigste Position)\nGewicht: 5.1 kg\nTyp: Lautsprecher - Stereo\nAusgangsleistung/Kanal: 2 Watt\nSchnittstellen: 2 x HDMI \u00a6 DisplayPort \u00a6 USB-C\nEinstellungen der Anzeigeposition: H\u00f6he, Drehung, Neigung\nVESA-Halterung: 100 x 100 mm\nStromverbrauch SDR (eingeschaltet): 55 kWh/1.000 h\nService und Support: Begrenzte Garantie - 3 Jahre",
    "reference_file": "offer_reference_688.json",
    "shop_name": "TaufNaus"
}