{
    "html_file": "offer_1514_3.html",
    "name": "ViewSonic VG2440V, 23.8\"",
    "offer_link": "https://direkt.jacob.de/produkte/viewsonic-vg-series-vg2440v-artnr-6944939.html?utm_source=geizhals&utm_medium=cpc&utm_campaign=Preisvergleich&ref=103",
    "price": 185.62,
    "raw_specifications": {
        "Abmessungen (Breite x Tiefe x H\u00f6he)": "54.9 cm x 5 cm x 35.2 cm - ohne Fu\u00df",
        "Abmessungen (Breite x Tiefe x H\u00f6he) - ohne Fu\u00df": "54.9 cm x 5 cm x 35.2 cm",
        "Ausgangsleistung/Kanal": "2 Watt",
        "Bildschirmbeschichtung": "Blendfrei, 3H Hard Coating",
        "Bildschirmtyp": "IPS",
        "Details zu Abmessungen & Gewicht": "Ohne Fu\u00df - Breite: 54.9 cm - Tiefe: 5 cm - H\u00f6he: 35.2 cm - Gewicht: 3.6 kg  Mit Fu\u00df - Gewicht: 6 kg",
        "Diagonalabmessung": "61 cm (24\")",
        "Display-Typ": "LED-hintergrundbeleuchteter LCD-Monitor / TFT-Aktivmatrix",
        "ENERGY STAR zertifiziert": "Ja",
        "Eingangsanschl\u00fcsse": "HDMI, VGA, DisplayPort",
        "Energie Effizienzklasse": "Klasse F",
        "Enthaltene Kabel": "1 x HDMI-Kabel  1 x USB Upstream-Kabel  1 x Audiokabel",
        "Erforderliche Netzspannung": "Wechselstrom 120/230 V (50/60 Hz)",
        "Farbunterst\u00fctzung": "16,7 Millionen Farben",
        "Ger\u00e4tetyp": "LED-hintergrundbeleuchteter LCD-Monitor - 61 cm (24\")",
        "Gewicht": "3.6 kg",
        "Helligkeit": "250 cd/m\u00b2",
        "Hintergrundbeleuchtungs-Technologie": "LED-Hintergrundbeleuchtung",
        "Horizontaler Betrachtungswinkel": "178",
        "Integrierte Peripherieger\u00e4te": "USB Hub",
        "Kennzeichnung": "FCC Klasse B bescheinigt, ICES-003, cTUVus, Mexico Energy label, Mexico CoC",
        "Kontrast": "1000:1 / 50000000:1 (dynamisch)",
        "Leistungsaufnahme im Ein-Zustand": "21.8 W",
        "Leistungsmerkmale": "Slot f\u00fcr Sicherheitsschloss (Kabelschloss getrennt erh\u00e4ltlich)",
        "Native Aufl\u00f6sung": "Full HD (1080p) 1920 x 1080",
        "Produktbeschreibung": "ViewSonic VG2440V - LED-Monitor - Full HD (1080p) - 61 cm (24\")",
        "Reaktionszeit": "5 ms (Gray-to-Gray)",
        "Schlosstyp zur Diebstahlsicherung": "Kensington Slot",
        "Schnittstellen": "USB (Typ A)  2 x USB (Typ B)  Audio Line-In  Audio Line-Out  VGA  HDMI  DisplayPort",
        "Seitenverh\u00e4ltnis": "16:9",
        "Sichtbare Bildfl\u00e4che": "60.5 cm (23.8\")",
        "Stromverbrauch (typisch)": "13.7 Watt",
        "Stromverbrauch SDR (eingeschaltet)": "21.8 kWh/1.000 h",
        "Stromverbrauch im Standby-Modus": "0.5 Watt",
        "TCO-zertifiziert": "TCO Certified Displays 8",
        "Transportbreite": "60.9 cm",
        "Transportgewicht": "8.7 kg",
        "Transporth\u00f6he": "40.5 cm",
        "Transporttiefe": "21 cm",
        "Typ": "Lautsprecher - Stereo",
        "Umweltschutzstandards": "TCO Certified Displays 8, ENERGY STAR-qualifiziert",
        "VESA-Halterung": "100 x 100 mm",
        "Vertikaler Betrachtungswinkel": "178"
    },
    "raw_specifications_text": "Produktbeschreibung: ViewSonic VG2440V - LED-Monitor - Full HD (1080p) - 61 cm (24\")\nGer\u00e4tetyp: LED-hintergrundbeleuchteter LCD-Monitor - 61 cm (24\")\nEnergie Effizienzklasse: Klasse F\nLeistungsaufnahme im Ein-Zustand: 21.8 W\nLeistungsmerkmale: Slot f\u00fcr Sicherheitsschloss (Kabelschloss getrennt erh\u00e4ltlich)\nBildschirmtyp: IPS\nSeitenverh\u00e4ltnis: 16:9\nNative Aufl\u00f6sung: Full HD (1080p) 1920 x 1080\nHelligkeit: 250 cd/m\u00b2\nKontrast: 1000:1 / 50000000:1 (dynamisch)\nReaktionszeit: 5 ms (Gray-to-Gray)\nFarbunterst\u00fctzung: 16,7 Millionen Farben\nEingangsanschl\u00fcsse: HDMI, VGA, DisplayPort\nBildschirmbeschichtung: Blendfrei, 3H Hard Coating\nAbmessungen (Breite x Tiefe x H\u00f6he) - ohne Fu\u00df: 54.9 cm x 5 cm x 35.2 cm\nGewicht: 3.6 kg\nUmweltschutzstandards: TCO Certified Displays 8, ENERGY STAR-qualifiziert\nKennzeichnung: FCC Klasse B bescheinigt, ICES-003, cTUVus, Mexico Energy label, Mexico CoC\nDisplay-Typ: LED-hintergrundbeleuchteter LCD-Monitor / TFT-Aktivmatrix\nDiagonalabmessung: 61 cm (24\")\nSichtbare Bildfl\u00e4che: 60.5 cm (23.8\")\nIntegrierte Peripherieger\u00e4te: USB Hub\nHorizontaler Betrachtungswinkel: 178\nVertikaler Betrachtungswinkel: 178\nHintergrundbeleuchtungs-Technologie: LED-Hintergrundbeleuchtung\nAbmessungen (Breite x Tiefe x H\u00f6he): 54.9 cm x 5 cm x 35.2 cm - ohne Fu\u00df\nTyp: Lautsprecher - Stereo\nAusgangsleistung/Kanal: 2 Watt\nSchnittstellen: USB (Typ A)  2 x USB (Typ B)  Audio Line-In  Audio Line-Out  VGA  HDMI  DisplayPort\nVESA-Halterung: 100 x 100 mm\nEnthaltene Kabel: 1 x HDMI-Kabel  1 x USB Upstream-Kabel  1 x Audiokabel\nSchlosstyp zur Diebstahlsicherung: Kensington Slot\nErforderliche Netzspannung: Wechselstrom 120/230 V (50/60 Hz)\nStromverbrauch SDR (eingeschaltet): 21.8 kWh/1.000 h\nStromverbrauch (typisch): 13.7 Watt\nStromverbrauch im Standby-Modus: 0.5 Watt\nDetails zu Abmessungen & Gewicht: Ohne Fu\u00df - Breite: 54.9 cm - Tiefe: 5 cm - H\u00f6he: 35.2 cm - Gewicht: 3.6 kg  Mit Fu\u00df - Gewicht: 6 kg\nTransportbreite: 60.9 cm\nTransporttiefe: 21 cm\nTransporth\u00f6he: 40.5 cm\nTransportgewicht: 8.7 kg\nTCO-zertifiziert: TCO Certified Displays 8\nENERGY STAR zertifiziert: Ja",
    "reference_file": "offer_reference_1514.json",
    "shop_name": "Jacob Elektronik direkt (AT)"
}