{
    "html_file": "offer_189_1.html",
    "name": "Dell UltraSharp U3224KBA, 31.5\"",
    "offer_link": "https://click.cptrack.de/?rd=true&k=H2jZOPSoNfIohcnyCFLwA1yhrCevxah1w9_dmVdjY5fv0fFABzbwJBfVpj0_0iQIGy_yTbYED5SeNM2e6jUszA~~&rdlink=https%3A%2F%2Fwww.cyberport.at%2F%3FDEEP%3D6136-1AV%26APID%3D66",
    "price": 2399.0,
    "raw_specifications": {
        "Aufl\u00f6sung": "6.144 x 3456 6K",
        "Betrachtungswinkel h/v": "178\u00b0/178\u00b0",
        "Bildformat": "16:9",
        "Bildwiederholfrequenz": "60 Hz",
        "Breite in mm": "717mm",
        "DVI": "kein",
        "Displaygr\u00f6\u00dfe in Zoll": "31,5 Zoll",
        "Displaygr\u00f6\u00dfe in cm": "80,0 cm",
        "Displayport": "1x DP",
        "Farbraumabdeckung": "100% sRGB",
        "Farbtiefe": "10 Bit / 1,07 Mrd Farben",
        "Gewicht in kg": "13,0 kg",
        "HDMI": "1x HDMI",
        "Helligkeit": "450 cd/m\u00b2",
        "H\u00f6he in mm": "680mm",
        "H\u00f6henverstellbar": "160mm",
        "Jahresverbrauch": "68 kWh",
        "Kontrast dynamisch": "2.000:1",
        "Kontrast typisch": "2.000:1",
        "Lautsprecher": "2x",
        "Leistung": "28W",
        "Leistungsaufnahme": "68 Watt",
        "Oberfl\u00e4che": "entspiegelt",
        "Reaktionszeit": "5 ms",
        "Technologie": "IPS",
        "Tiefe in mm": "237mm",
        "USB-C": "3x",
        "Wandmontage": "VESA100x100"
    },
    "raw_specifications_text": "Jahresverbrauch: 68 kWh\nLeistungsaufnahme: 68 Watt\nDisplaygr\u00f6\u00dfe in cm: 80,0 cm\nDisplaygr\u00f6\u00dfe in Zoll: 31,5 Zoll\nTechnologie: IPS\nAufl\u00f6sung: 6.144 x 3456 6K\nBildformat: 16:9\nOberfl\u00e4che: entspiegelt\nFarbraumabdeckung: 100% sRGB\nFarbtiefe: 10 Bit / 1,07 Mrd Farben\nHelligkeit: 450 cd/m\u00b2\nKontrast typisch: 2.000:1\nKontrast dynamisch: 2.000:1\nReaktionszeit: 5 ms\nBetrachtungswinkel h/v: 178\u00b0/178\u00b0\nBildwiederholfrequenz: 60 Hz\nHDMI: 1x HDMI\nDVI: kein\nDisplayport: 1x DP\nUSB-C: 3x\nLautsprecher: 2x\nLeistung: 28W\nH\u00f6henverstellbar: 160mm\nWandmontage: VESA100x100\nBreite in mm: 717mm\nH\u00f6he in mm: 680mm\nTiefe in mm: 237mm\nGewicht in kg: 13,0 kg",
    "reference_file": "offer_reference_189.json",
    "shop_name": "Cyberport.at"
}