{
    "html_file": "offer_1709_24.html",
    "name": "Philips P-line 329P1H, 31.5\"",
    "offer_link": "https://www.electronicshop24.at/product_info.php?products_id=20000001392456225&ano=I1392456225&mno=329P1H%2F00&ean=8712581768058&utm_medium=cpc&utm_campaign=preisvergleich&utm_content=item&utm_source=geizhals&ref=geizhals",
    "price": 689.0,
    "raw_specifications": {
        "Abmessungen (Breite x Tiefe x H\u00f6he)": "71.4 cm x 28 cm x 64.9 cm - mit Fu\u00df",
        "Ausgangsleistung/Kanal": "5 Watt",
        "Besonderheiten": "Bleifrei, SmartImage, Low Blue Light Mode, flimmerfreie Technologie, BFR/PVC-frei, ohne Quecksilber, Adaptive-Sync-Technologie, EasyRead, Monitorkalibrierung Delta E<2, Windows 10 Hello, SmartControl",
        "Bildschirmbeschichtung": "Blendfrei, 3H Hard Coating, Haze 25 %",
        "Bildschirmtyp": "IPS",
        "Details zu Abmessungen & Gewicht": "Mit Standfu\u00df (h\u00f6chste Position) - Breite: 71.4 cm - Tiefe: 28 cm - H\u00f6he: 64.9 cm - Gewicht: 12.2 kg \u00a6 Ohne Fu\u00df - Breite: 71.4 cm - Tiefe: 6.2 cm - H\u00f6he: 42.2 cm - Gewicht: 8.19 kg",
        "Diagonalabmessung": "81.3 cm (32\")",
        "Display-Typ": "LED-hintergrundbeleuchteter LCD-Monitor / TFT-Aktivmatrix",
        "ENERGY STAR zertifiziert": "Ja",
        "ENERGY STAR-Version": "8.0",
        "Ein-/Aus-Schalter": "Ja",
        "Eingangsspannung": "Wechselstrom 120/230 V (50/60 Hz)",
        "Einstellungen der Anzeigeposition": "H\u00f6he, Pivot (Rotation), Drehung, Neigung",
        "Energie Effizienzklasse": "Klasse G",
        "Energieverbrauch pro Jahr": "57 kWh",
        "Enthaltene Kabel": "1 x HDMI-Kabel \u00a6 1 x DisplayPort-Kabel \u00a6 1 x USB-C-Kabel mit USB-C auf USB-A-Dongle",
        "Farbe": "Black Texture",
        "Farbraum": "117% NTSC (CIE 1976), 128% sRGB (CIE 1931), 89% Adobe RGB (CIE 1976)",
        "Farbunterst\u00fctzung": "1,07 Mrd. Farben",
        "Gewicht": "12.2 kg",
        "Helligkeit": "350 cd/m\u00b2",
        "Hintergrundbeleuchtungs-Technologie": "WLED",
        "Horizontale Bildwiederholrate": "30 - 140 kHz",
        "Horizontaler Betrachtungswinkel": "178",
        "H\u00f6heneinstellung": "180 mm",
        "Integrierte Peripherieger\u00e4te": "2,0-Megapixel-Kamera, Gigabit Ethernet-Netzwerkadapter, USB 3.2 Gen 2 hub",
        "Kennzeichnung": "Plug and Play, FCC Klasse B bescheinigt, TUV GS, ICES-003, SEMKO, CB, TUV Ergo, DDC/CI, RoHS, EPA, cETLus, CU-EAC, TUV Eye Comfort certified, EAEU RoHS",
        "Kontrast": "1000:1 / 50000000:1 (dynamisch)",
        "Leistungsaufnahme im Ein-Zustand": "40 W",
        "Leistungsmerkmale": "Slot f\u00fcr Sicherheitsschloss (Kabelschloss getrennt erh\u00e4ltlich)",
        "MTBF": "70,000 Stunde(n)",
        "Max. Betriebstemperatur": "40 \u00b0C",
        "Min Betriebstemperatur": "0 \u00b0C",
        "Mitgelieferte Software": "Philips SmartControl",
        "Native Aufl\u00f6sung": "4K 3840 x 2160 bei 60 Hz",
        "Neigungswinkel": "-5/+25",
        "OSD-Sprachen": "Ungarisch, Tschechisch, Chinesisch (tradionell), Chinesisch (vereinfacht), Ukrainisch, Brasilianisches Portugiesisch, Englisch, Deutsch, Franz\u00f6sisch, Italienisch, Portugiesisch, Polnisch, Finnisch, Schwedisch, Russisch, Spanisch, Holl\u00e4ndisch, Griechisch, T\u00fcrkisch, Japanisch, Koreanisch",
        "Pixelpitch": "0.18159 mm",
        "Ppi": "140",
        "Reaktionszeit": "4 ms (gray-to-gray)",
        "Rotationswinkel": "180",
        "Schlosstyp zur Diebstahlsicherung": "Kensington Slot",
        "Schnittstellen": "DisplayPort 1.4 (HDCP 2.2) \u00a6 2 x HDMI (HDCP 2.2) \u00a6 USB-C 3.2 Gen 2 Upstream/DisplayPort Alt Mode (HDCP 2.2) \u00a6 Audio Line-Out \u00a6 Netzwerk \u00a6 3 x USB 3.2 Gen 1 Downstream \u00a6 USB 3.2 Gen 1 Downstream (Schnellladung)",
        "Schwenkwinkel": "360",
        "Seitenverh\u00e4ltnis": "16:9",
        "Sichtbare Bildfl\u00e4che": "80 cm (31.5\")",
        "Stromverbrauch (Aus-Modus)": "0 Watt",
        "Stromverbrauch (typisch)": "31.8 Watt",
        "Stromverbrauch SDR (eingeschaltet)": "40 kWh/1.000 h",
        "Stromverbrauch im Standby-Modus": "0.3 Watt",
        "TCO-zertifiziert": "TCO Certified Displays 8",
        "Transportbreite": "93 cm",
        "Transportgewicht": "15.51 kg",
        "Transporth\u00f6he": "56.3 cm",
        "Transporttiefe": "18.6 cm",
        "Typ": "Lautsprecher - Stereo",
        "USB-Spannungsversorgung": "90 Watt",
        "VESA-Halterung": "100 x 100 mm",
        "Vertikale Bildwiederholrate": "23 - 75 Hz",
        "Vertikaler Betrachtungswinkel": "178",
        "Zul\u00e4ssige Luftfeuchtigkeit im Betrieb": "20 - 80%"
    },
    "raw_specifications_text": "Display-Typ: LED-hintergrundbeleuchteter LCD-Monitor / TFT-Aktivmatrix\nEnergie Effizienzklasse: Klasse G\nEnergieverbrauch pro Jahr: 57 kWh\nDiagonalabmessung: 81.3 cm (32\")\nSichtbare Bildfl\u00e4che: 80 cm (31.5\")\nIntegrierte Peripherieger\u00e4te: 2,0-Megapixel-Kamera, Gigabit Ethernet-Netzwerkadapter, USB 3.2 Gen 2 hub\nUSB-Spannungsversorgung: 90 Watt\nBildschirmtyp: IPS\nSeitenverh\u00e4ltnis: 16:9\nNative Aufl\u00f6sung: 4K 3840 x 2160 bei 60 Hz\nPixelpitch: 0.18159 mm\nPpi: 140\nHelligkeit: 350 cd/m\u00b2\nKontrast: 1000:1 / 50000000:1 (dynamisch)\nFarbunterst\u00fctzung: 1,07 Mrd. Farben\nFarbraum: 117% NTSC (CIE 1976), 128% sRGB (CIE 1931), 89% Adobe RGB (CIE 1976)\nReaktionszeit: 4 ms (gray-to-gray)\nVertikale Bildwiederholrate: 23 - 75 Hz\nHorizontale Bildwiederholrate: 30 - 140 kHz\nHorizontaler Betrachtungswinkel: 178\nVertikaler Betrachtungswinkel: 178\nBildschirmbeschichtung: Blendfrei, 3H Hard Coating, Haze 25 %\nHintergrundbeleuchtungs-Technologie: WLED\nOSD-Sprachen: Ungarisch, Tschechisch, Chinesisch (tradionell), Chinesisch (vereinfacht), Ukrainisch, Brasilianisches Portugiesisch, Englisch, Deutsch, Franz\u00f6sisch, Italienisch, Portugiesisch, Polnisch, Finnisch, Schwedisch, Russisch, Spanisch, Holl\u00e4ndisch, Griechisch, T\u00fcrkisch, Japanisch, Koreanisch\nBesonderheiten: Bleifrei, SmartImage, Low Blue Light Mode, flimmerfreie Technologie, BFR/PVC-frei, ohne Quecksilber, Adaptive-Sync-Technologie, EasyRead, Monitorkalibrierung Delta E<2, Windows 10 Hello, SmartControl\nFarbe: Black Texture\nAbmessungen (Breite x Tiefe x H\u00f6he): 71.4 cm x 28 cm x 64.9 cm - mit Fu\u00df\nGewicht: 12.2 kg\nTyp: Lautsprecher - Stereo\nAusgangsleistung/Kanal: 5 Watt\nSchnittstellen: DisplayPort 1.4 (HDCP 2.2) \u00a6 2 x HDMI (HDCP 2.2) \u00a6 USB-C 3.2 Gen 2 Upstream/DisplayPort Alt Mode (HDCP 2.2) \u00a6 Audio Line-Out \u00a6 Netzwerk \u00a6 3 x USB 3.2 Gen 1 Downstream \u00a6 USB 3.2 Gen 1 Downstream (Schnellladung)\nEinstellungen der Anzeigeposition: H\u00f6he, Pivot (Rotation), Drehung, Neigung\nNeigungswinkel: -5/+25\nSchwenkwinkel: 360\nRotationswinkel: 180\nH\u00f6heneinstellung: 180 mm\nVESA-Halterung: 100 x 100 mm\nLeistungsmerkmale: Slot f\u00fcr Sicherheitsschloss (Kabelschloss getrennt erh\u00e4ltlich)\nEnthaltene Kabel: 1 x HDMI-Kabel \u00a6 1 x DisplayPort-Kabel \u00a6 1 x USB-C-Kabel mit USB-C auf USB-A-Dongle\nMTBF: 70,000 Stunde(n)\nKennzeichnung: Plug and Play, FCC Klasse B bescheinigt, TUV GS, ICES-003, SEMKO, CB, TUV Ergo, DDC/CI, RoHS, EPA, cETLus, CU-EAC, TUV Eye Comfort certified, EAEU RoHS\nSchlosstyp zur Diebstahlsicherung: Kensington Slot\nEingangsspannung: Wechselstrom 120/230 V (50/60 Hz)\nLeistungsaufnahme im Ein-Zustand: 40 W\nStromverbrauch SDR (eingeschaltet): 40 kWh/1.000 h\nStromverbrauch (typisch): 31.8 Watt\nStromverbrauch im Standby-Modus: 0.3 Watt\nStromverbrauch (Aus-Modus): 0 Watt\nEin-/Aus-Schalter: Ja\nMitgelieferte Software: Philips SmartControl\nDetails zu Abmessungen & Gewicht: Mit Standfu\u00df (h\u00f6chste Position) - Breite: 71.4 cm - Tiefe: 28 cm - H\u00f6he: 64.9 cm - Gewicht: 12.2 kg \u00a6 Ohne Fu\u00df - Breite: 71.4 cm - Tiefe: 6.2 cm - H\u00f6he: 42.2 cm - Gewicht: 8.19 kg\nTransportbreite: 93 cm\nTransporttiefe: 18.6 cm\nTransporth\u00f6he: 56.3 cm\nTransportgewicht: 15.51 kg\nTCO-zertifiziert: TCO Certified Displays 8\nENERGY STAR zertifiziert: Ja\nENERGY STAR-Version: 8.0\nMin Betriebstemperatur: 0 \u00b0C\nMax. Betriebstemperatur: 40 \u00b0C\nZul\u00e4ssige Luftfeuchtigkeit im Betrieb: 20 - 80%",
    "reference_file": "offer_reference_1709.json",
    "shop_name": "ElectronicShop24"
}