{
    "html_file": "offer_676_27.html",
    "name": "Philips Evnia 5000 32M1C5500VL, 31.5\"",
    "offer_link": "https://syswork.at/sw/index.html?open&mid=Artikel&artid=mon-1297&from=geizhals.at",
    "price": 325.0,
    "raw_specifications": {
        "AC Eingangsfrequenz": "50/60 Hz",
        "AC Eingangsspannung": "100 - 240 V",
        "AMD FreeSync": "Nein",
        "Anzahl DisplayPort Anschl\u00fcsse": "1",
        "Anzahl HDMI-Anschl\u00fcsse": "2",
        "Anzahl der Farben des Displays": "16,7 Millionen Farben",
        "Audioausgang": "Ja",
        "Au\u00dfenverkleidungstyp": "Texturiert",
        "Beh\u00f6rdliche Zulassung": "CB; CE Mark; FCC Class B; ICES-003; CU-EAC; EAEU RoHS; TUV/ISO9241-307; TUV-BAUART",
        "Betriebsanleitung": "Ja",
        "Betriebstemperatur": "0 - 40 \u00b0C",
        "Bewertung der Bildschirmkr\u00fcmmung": "1500R",
        "Bild-Verbesserung": "SmartImage game",
        "Bildschirmdiagonale": "80 cm (31.5 Zoll)",
        "Bildschirmdiagonale (cm)": "80 cm",
        "Bildschirmform": "Gebogen",
        "Bildschirmtechnologie": "LCD",
        "Bildwinkel, horizontal": "178\u00b0",
        "Bildwinkel, vertikal": "178\u00b0",
        "Blendfreier Bildschirm": "Ja",
        "Breite (ohne Standfu\u00df)": "70,9 cm",
        "DDC/CI": "Ja",
        "Datenblatt": "Kein Datenblatt verf\u00fcgbar",
        "Display-Aufl\u00f6sung": "2560 x 1440 Pixel",
        "DisplayPorts-Version": "1.4",
        "Dynamisches Kontrastverh\u00e4ltnis Marketingbezeichnung": "Mega Infinity DCR",
        "Einfach zu lesen Modus": "Ja",
        "Eingebaute Lautsprecher": "Nein",
        "Energieeffizienzklasse (HDR)": "G",
        "Energieeffizienzklasse (SDR)": "F",
        "Energieeffizienzskala": "A bis G",
        "Energieverbrauch (HDR) pro 1.000 Stunden": "57 kWh",
        "Energieverbrauch (SDR) pro 1.000 Stunden": "32 kWh",
        "Enth\u00e4lt nicht": "Quecksilber, PVC/BFR",
        "Farbtiefe": "8 Bit",
        "Flimmerfreie Technologie": "Ja",
        "Fu\u00dffarbe": "Schwarz",
        "Geringe Eingabeverz\u00f6gerung": "Ja",
        "Ger\u00e4tebreite (inkl. Fu\u00df)": "709 mm",
        "Ger\u00e4teh\u00f6he (inkl. Fu\u00df)": "527 mm",
        "Ger\u00e4tetiefe (inkl. Fu\u00df)": "239 mm",
        "Gewicht (mit St\u00e4nder)": "7,83 kg",
        "Gewicht (ohne St\u00e4nder)": "6,37 kg",
        "HD-Typ": "4K Ultra HD",
        "HDCP": "Ja",
        "HDCP-Version": "1.4/2.2",
        "HDMI": "Ja",
        "HDMI-Version": "2.0",
        "Helligkeit (typisch)": "250 cd/m\u00b2",
        "Herstellerlink": "Philips",
        "H\u00f6he (ohne Standfu\u00df)": "42,3 cm",
        "H\u00f6he bei Betrieb": "0 - 3658 m",
        "H\u00f6he bei Lagerung": "3658 - 12192 m",
        "H\u00f6henverstellung": "Nein",
        "Integrierte Kamera": "Nein",
        "Integrierter USB-Hub": "Nein",
        "Kabelsperre-Slot": "Ja",
        "Kompatible Betriebssysteme": "Mac OS X\\nWindows 11 / 10 / 8.1 / 8 / 7",
        "Komponentenvideo-Synchronisation": "Separate sync",
        "Kontrastverh\u00e4ltnis": "3000:1",
        "LED-Anzeigen": "T\u00e4tigkeit, Stand-by",
        "Low-Blue-Light-Technologie": "Ja",
        "LowBlue-Modus": "Ja",
        "Marktpositionierung": "Gaming",
        "Maximale Bildwiederholrate": "144 Hz",
        "Men\u00fcsprachen": "Vereinfachtes Chinesisch, Traditionelles Chinesisch, Tschechisch, Deutsch, Niederl\u00e4ndisch, Englisch, Spanisch, Finnisch, Franz\u00f6sisch, Griechisch, Ungarisch, Italienisch, Japanisch, Koreanisch, Polnisch, Portugiesisch, Russisch, Schwedisch, T\u00fcrkisch, Ukrainisch",
        "Mitgelieferte Kabel": "HDMI, DisplayPort, AC",
        "Mittlere Betriebsdauer zwischen Ausf\u00e4llen (MTBF)": "50000 h",
        "NTSC Abdeckung (typisch)": "102,1%",
        "NVIDIA G-SYNC": "Nein",
        "Nachhaltigkeitskonformit\u00e4t": "Ja",
        "Nachhaltigkeitszertifikate": "RoHS",
        "Natives Seitenverh\u00e4ltnis": "16:9",
        "Neigungsverstellung": "Ja",
        "Neigungswinkelbereich": "-5 - 20\u00b0",
        "Netzteiltyp": "Intern",
        "Oberfl\u00e4chenh\u00e4rte": "3H",
        "Paketgewicht": "10,4 kg",
        "Panel-Montage-Schnittstelle": "100 x 100 mm",
        "Panel-Typ": "VA",
        "Pixel Abstand": "0,2724 x 0,2724 mm",
        "Pixeldichte": "93,24 ppi",
        "Plug & Play": "Ja",
        "Produktfarbe": "Schwarz",
        "Produktlink": "Link",
        "RGB-Farbraum": "sRGB",
        "Reaktionszeit": "4 ms",
        "Reaktionszeit (schnell)": "1 ms",
        "Recycelbares Verpackungsmaterial": "100%",
        "Relative Luftfeuchtigkeit in Betrieb": "20 - 80%",
        "Sichtbare Gr\u00f6\u00dfe (horizontal)": "69,7 cm",
        "Sichtbare Gr\u00f6\u00dfe (vertikal)": "39,2 cm",
        "Slot-Typ Kabelsperre": "Kensington",
        "Stromverbrauch (Standardbetrieb)": "45,1 W",
        "Stromverbrauch (Standby)": "0,5 W",
        "Stromverbrauch (aus)": "0,3 W",
        "St\u00e4nder enthalten": "Ja",
        "Technologie mit hohem Dynamikbereich (HDR)": "High Dynamic Range 10 (HDR10)",
        "Temperaturbereich bei Lagerung": "-20 - 60 \u00b0C",
        "Tiefe (ohne Standfu\u00df)": "9,5 cm",
        "Touchscreen": "Nein",
        "Tr\u00fcbungsrate": "25%",
        "Typ der Hintergrundbeleuchtung": "W-LED",
        "VESA Adaptive Sync unterst\u00fctzt": "Ja",
        "VESA-Halterung": "Ja",
        "Verpackungsbreite": "782 mm",
        "Verpackungsh\u00f6he": "523 mm",
        "Verpackungstiefe": "227 mm",
        "sRGB": "Ja",
        "sRGB Abdeckung (klassisch)": "121,6%"
    },
    "raw_specifications_text": "Bildschirmdiagonale: 80 cm (31.5 Zoll)\nDisplay-Aufl\u00f6sung: 2560 x 1440 Pixel\nNatives Seitenverh\u00e4ltnis: 16:9\nBildschirmtechnologie: LCD\nTouchscreen: Nein\nHD-Typ: 4K Ultra HD\nPanel-Typ: VA\nBildschirmform: Gebogen\nKontrastverh\u00e4ltnis: 3000:1\nMaximale Bildwiederholrate: 144 Hz\nAnzahl der Farben des Displays: 16,7 Millionen Farben\nTyp der Hintergrundbeleuchtung: W-LED\nHelligkeit (typisch): 250 cd/m\u00b2\nReaktionszeit: 4 ms\nBlendfreier Bildschirm: Ja\nBewertung der Bildschirmkr\u00fcmmung: 1500R\nDynamisches Kontrastverh\u00e4ltnis Marketingbezeichnung: Mega Infinity DCR\nBildwinkel, horizontal: 178\u00b0\nBildwinkel, vertikal: 178\u00b0\nReaktionszeit (schnell): 1 ms\nPixel Abstand: 0,2724 x 0,2724 mm\nPixeldichte: 93,24 ppi\nSichtbare Gr\u00f6\u00dfe (horizontal): 69,7 cm\nSichtbare Gr\u00f6\u00dfe (vertikal): 39,2 cm\nBildschirmdiagonale (cm): 80 cm\nTechnologie mit hohem Dynamikbereich (HDR): High Dynamic Range 10 (HDR10)\nDDC/CI: Ja\nTr\u00fcbungsrate: 25%\nOberfl\u00e4chenh\u00e4rte: 3H\nFarbtiefe: 8 Bit\nRGB-Farbraum: sRGB\nsRGB Abdeckung (klassisch): 121,6%\nNTSC Abdeckung (typisch): 102,1%\nsRGB: Ja\nNVIDIA G-SYNC: Nein\nAMD FreeSync: Nein\nVESA Adaptive Sync unterst\u00fctzt: Ja\nKomponentenvideo-Synchronisation: Separate sync\nFlimmerfreie Technologie: Ja\nLow-Blue-Light-Technologie: Ja\nGeringe Eingabeverz\u00f6gerung: Ja\nKompatible Betriebssysteme: Mac OS X\\nWindows 11 / 10 / 8.1 / 8 / 7\nEingebaute Lautsprecher: Nein\nIntegrierte Kamera: Nein\nMarktpositionierung: Gaming\nProduktfarbe: Schwarz\nFu\u00dffarbe: Schwarz\nIntegrierter USB-Hub: Nein\nHDMI: Ja\nAnzahl HDMI-Anschl\u00fcsse: 2\nHDMI-Version: 2.0\nAnzahl DisplayPort Anschl\u00fcsse: 1\nDisplayPorts-Version: 1.4\nAudioausgang: Ja\nHDCP: Ja\nHDCP-Version: 1.4/2.2\nVESA-Halterung: Ja\nKabelsperre-Slot: Ja\nH\u00f6henverstellung: Nein\nPanel-Montage-Schnittstelle: 100 x 100 mm\nSlot-Typ Kabelsperre: Kensington\nNeigungswinkelbereich: -5 - 20\u00b0\nMen\u00fcsprachen: Vereinfachtes Chinesisch, Traditionelles Chinesisch, Tschechisch, Deutsch, Niederl\u00e4ndisch, Englisch, Spanisch, Finnisch, Franz\u00f6sisch, Griechisch, Ungarisch, Italienisch, Japanisch, Koreanisch, Polnisch, Portugiesisch, Russisch, Schwedisch, T\u00fcrkisch, Ukrainisch\nPlug & Play: Ja\nLED-Anzeigen: T\u00e4tigkeit, Stand-by\nNeigungsverstellung: Ja\nEnergieeffizienzklasse (SDR): F\nEnergieeffizienzklasse (HDR): G\nEnergieverbrauch (SDR) pro 1.000 Stunden: 32 kWh\nEnergieverbrauch (HDR) pro 1.000 Stunden: 57 kWh\nStromverbrauch (Standardbetrieb): 45,1 W\nStromverbrauch (Standby): 0,5 W\nStromverbrauch (aus): 0,3 W\nAC Eingangsspannung: 100 - 240 V\nAC Eingangsfrequenz: 50/60 Hz\nNetzteiltyp: Intern\nEnergieeffizienzskala: A bis G\nBetriebstemperatur: 0 - 40 \u00b0C\nTemperaturbereich bei Lagerung: -20 - 60 \u00b0C\nRelative Luftfeuchtigkeit in Betrieb: 20 - 80%\nH\u00f6he bei Betrieb: 0 - 3658 m\nH\u00f6he bei Lagerung: 3658 - 12192 m\nSt\u00e4nder enthalten: Ja\nMitgelieferte Kabel: HDMI, DisplayPort, AC\nBetriebsanleitung: Ja\nGer\u00e4tebreite (inkl. Fu\u00df): 709 mm\nGer\u00e4tetiefe (inkl. Fu\u00df): 239 mm\nGer\u00e4teh\u00f6he (inkl. Fu\u00df): 527 mm\nGewicht (mit St\u00e4nder): 7,83 kg\nBreite (ohne Standfu\u00df): 70,9 cm\nTiefe (ohne Standfu\u00df): 9,5 cm\nH\u00f6he (ohne Standfu\u00df): 42,3 cm\nGewicht (ohne St\u00e4nder): 6,37 kg\nVerpackungsbreite: 782 mm\nVerpackungstiefe: 227 mm\nVerpackungsh\u00f6he: 523 mm\nPaketgewicht: 10,4 kg\nNachhaltigkeitskonformit\u00e4t: Ja\nNachhaltigkeitszertifikate: RoHS\nEnth\u00e4lt nicht: Quecksilber, PVC/BFR\nAu\u00dfenverkleidungstyp: Texturiert\nRecycelbares Verpackungsmaterial: 100%\nEinfach zu lesen Modus: Ja\nLowBlue-Modus: Ja\nMittlere Betriebsdauer zwischen Ausf\u00e4llen (MTBF): 50000 h\nBild-Verbesserung: SmartImage game\nBeh\u00f6rdliche Zulassung: CB; CE Mark; FCC Class B; ICES-003; CU-EAC; EAEU RoHS; TUV/ISO9241-307; TUV-BAUART\nDatenblatt: Kein Datenblatt verf\u00fcgbar\nProduktlink: Link\nHerstellerlink: Philips",
    "reference_file": "offer_reference_676.json",
    "shop_name": "Syswork"
}