{
    "html_file": "offer_1719_1.html",
    "name": "Dell P3421W, 34\"",
    "offer_link": "https://www.taufnaus.de/product/10605317",
    "price": 923.54,
    "raw_specifications": {
        "Abmessungen (Breite x Tiefe x H\u00f6he)": "81.57 cm x 23.74 cm x 39.11 cm - mit Fu\u00df",
        "Besonderheiten": "Flimmerfreie Technologie, Dell Easy Arrange, Dell ComfortView, an 3 Seiten ohne Blende, 99 % sRGB Farbraum",
        "Bildschirmbeschichtung": "Blendfrei, 3H Hard Coating",
        "Bildschirmtyp": "IPS",
        "Details zu Abmessungen & Gewicht": "Mit Fu\u00df - Breite: 81.57 cm - Tiefe: 23.74 cm - H\u00f6he: 39.11 cm - Gewicht: 10.8 kg \u00a6 Ohne Fu\u00df - Breite: 81.57 cm - Tiefe: 5.84 cm - H\u00f6he: 36.6 cm - Gewicht: 6.7 kg",
        "Diagonalabmessung": "86.72 cm (34.14\")",
        "Display-Typ": "LED-hintergrundbeleuchteter LCD-Monitor / TFT-Aktivmatrix",
        "ENERGY STAR zertifiziert": "Ja",
        "ENERGY STAR-Version": "8.0",
        "EPEAT-kompatibel": "EPEAT Gold",
        "Ein-/Aus-Schalter": "Ja",
        "Eingangsspannung": "Wechselstrom 120/230 V (50/60 Hz)",
        "Einstellungen der Anzeigeposition": "H\u00f6he, Drehung, Neigung",
        "Energie Effizienzklasse": "Klasse F",
        "Energierverbrauch Sleep": "0.3 Watt",
        "Entwickelt f\u00fcr": "Dell Latitude 5320, 5520 \u00a6 Dell XPS 13 9310, 15 9510",
        "Farbe": "Schwarz",
        "Farbraum": "99% sRGB",
        "Farbunterst\u00fctzung": "1,07 Mrd. Farben",
        "Geschwungener Bildschirm": "Ja (3800R)",
        "Gewicht": "10.8 kg",
        "Helligkeit": "300 cd/m\u00b2",
        "Hintergrundbeleuchtungs-Technologie": "WLED",
        "Horizontale Bildwiederholrate": "30 - 85 kHz",
        "Horizontaler Betrachtungswinkel": "178",
        "H\u00f6heneinstellung": "150 mm",
        "Integrierte Peripherieger\u00e4te": "USB 3.2 Gen 1 Hub",
        "Kennzeichnung": "DisplayPort 1.2",
        "Kontrast": "1000:1 / 1000:1 (dynamisch)",
        "Leistungsaufnahme im Ein-Zustand": "31.5 W",
        "Leistungsmerkmale": "Unterst\u00fctzung f\u00fcr VESA-Schnittstelle, Sicherheitsschloss",
        "Max. Betriebstemperatur": "40 \u00b0C",
        "Min Betriebstemperatur": "0 \u00b0C",
        "Mitgelieferte Software": "Dell Display Manager",
        "Native Aufl\u00f6sung": "WQHD 3440 x 1440 bei 60 Hz",
        "Neigungswinkel": "-5/+21",
        "Pixelpitch": "0.2325 mm",
        "Ppi": "109",
        "Reaktionszeit": "5 ms (Grau-zu-Grau schnell), 8 ms (Grau-zu-Grau normal)",
        "Schnittstellen": "HDMI \u00a6 DisplayPort 1.2 \u00a6 USB-C Upstream/DisplayPort mit Spannungsversorgung (bis zu 65 W) \u00a6 USB 3.2 Gen 1 Upstream \u00a6 2 x USB 3.2 Gen 1 Downstream \u00a6 2 x USB 2.0 Downstream",
        "Schwenkwinkel": "60",
        "Seitenverh\u00e4ltnis": "21:9",
        "Services im Bundle": "3 Jahre erweiterte Basisaustauschgew\u00e4hrleistung",
        "Stromverbrauch (Aus-Modus)": "0.3 Watt",
        "Stromverbrauch (typisch)": "32.75 Watt",
        "Stromverbrauch SDR (eingeschaltet)": "31.5 kWh/1.000 h",
        "Stromverbrauch im Standby-Modus": "0.3 Watt",
        "TCO-zertifiziert": "TCO Certified Displays 8",
        "Transportgewicht": "14.9 kg",
        "USB-Spannungsversorgung": "65 Watt",
        "Vertikale Bildwiederholrate": "48 - 85 Hz",
        "Vertikaler Betrachtungswinkel": "178",
        "Zul\u00e4ssige Luftfeuchtigkeit im Betrieb": "10 - 90 % (nicht-kondensierend)"
    },
    "raw_specifications_text": "Display-Typ: LED-hintergrundbeleuchteter LCD-Monitor / TFT-Aktivmatrix\nEnergie Effizienzklasse: Klasse F\nDiagonalabmessung: 86.72 cm (34.14\")\nGeschwungener Bildschirm: Ja (3800R)\nIntegrierte Peripherieger\u00e4te: USB 3.2 Gen 1 Hub\nUSB-Spannungsversorgung: 65 Watt\nBildschirmtyp: IPS\nSeitenverh\u00e4ltnis: 21:9\nNative Aufl\u00f6sung: WQHD 3440 x 1440 bei 60 Hz\nPixelpitch: 0.2325 mm\nPpi: 109\nHelligkeit: 300 cd/m\u00b2\nKontrast: 1000:1 / 1000:1 (dynamisch)\nFarbunterst\u00fctzung: 1,07 Mrd. Farben\nFarbraum: 99% sRGB\nReaktionszeit: 5 ms (Grau-zu-Grau schnell), 8 ms (Grau-zu-Grau normal)\nVertikale Bildwiederholrate: 48 - 85 Hz\nHorizontale Bildwiederholrate: 30 - 85 kHz\nHorizontaler Betrachtungswinkel: 178\nVertikaler Betrachtungswinkel: 178\nBildschirmbeschichtung: Blendfrei, 3H Hard Coating\nHintergrundbeleuchtungs-Technologie: WLED\nBesonderheiten: Flimmerfreie Technologie, Dell Easy Arrange, Dell ComfortView, an 3 Seiten ohne Blende, 99 % sRGB Farbraum\nFarbe: Schwarz\nAbmessungen (Breite x Tiefe x H\u00f6he): 81.57 cm x 23.74 cm x 39.11 cm - mit Fu\u00df\nGewicht: 10.8 kg\nSchnittstellen: HDMI \u00a6 DisplayPort 1.2 \u00a6 USB-C Upstream/DisplayPort mit Spannungsversorgung (bis zu 65 W) \u00a6 USB 3.2 Gen 1 Upstream \u00a6 2 x USB 3.2 Gen 1 Downstream \u00a6 2 x USB 2.0 Downstream\nEinstellungen der Anzeigeposition: H\u00f6he, Drehung, Neigung\nNeigungswinkel: -5/+21\nSchwenkwinkel: 60\nH\u00f6heneinstellung: 150 mm\nLeistungsmerkmale: Unterst\u00fctzung f\u00fcr VESA-Schnittstelle, Sicherheitsschloss\nKennzeichnung: DisplayPort 1.2\nEingangsspannung: Wechselstrom 120/230 V (50/60 Hz)\nLeistungsaufnahme im Ein-Zustand: 31.5 W\nStromverbrauch SDR (eingeschaltet): 31.5 kWh/1.000 h\nStromverbrauch (typisch): 32.75 Watt\nStromverbrauch im Standby-Modus: 0.3 Watt\nEnergierverbrauch Sleep: 0.3 Watt\nStromverbrauch (Aus-Modus): 0.3 Watt\nEin-/Aus-Schalter: Ja\nMitgelieferte Software: Dell Display Manager\nDetails zu Abmessungen & Gewicht: Mit Fu\u00df - Breite: 81.57 cm - Tiefe: 23.74 cm - H\u00f6he: 39.11 cm - Gewicht: 10.8 kg \u00a6 Ohne Fu\u00df - Breite: 81.57 cm - Tiefe: 5.84 cm - H\u00f6he: 36.6 cm - Gewicht: 6.7 kg\nTransportgewicht: 14.9 kg\nTCO-zertifiziert: TCO Certified Displays 8\nEPEAT-kompatibel: EPEAT Gold\nENERGY STAR zertifiziert: Ja\nENERGY STAR-Version: 8.0\nServices im Bundle: 3 Jahre erweiterte Basisaustauschgew\u00e4hrleistung\nMin Betriebstemperatur: 0 \u00b0C\nMax. Betriebstemperatur: 40 \u00b0C\nZul\u00e4ssige Luftfeuchtigkeit im Betrieb: 10 - 90 % (nicht-kondensierend)\nEntwickelt f\u00fcr: Dell Latitude 5320, 5520 \u00a6 Dell XPS 13 9310, 15 9510",
    "reference_file": "offer_reference_1719.json",
    "shop_name": "TaufNaus"
}