{
    "html_file": "offer_1443_8.html",
    "name": "HP E24u G4, 23.8\"",
    "offer_link": "https://www.electronicshop24.at/product_info.php?products_id=320000000091699146&ano=A-I91699146&mno=189T0AA&ean=195122123987&utm_medium=cpc&utm_campaign=preisvergleich&utm_content=item&utm_source=geizhals&ref=geizhals",
    "price": 313.0,
    "raw_specifications": {
        "Abmessungen (Breite x Tiefe x H\u00f6he)": "53.94 cm x 20.7 cm x 49.49 cm - mit Fu\u00df",
        "Besonderheiten": "On-screen Digital Controls, Low Blue Light Mode, flimmerfreie Technologie, ohne Quecksilber, arsenfreies Glas, extrem schmale Blende an drei Seiten, 8-bit (6-bit + FRC) Farbtiefe, HP Eye Ease",
        "Bildschirmbeschichtung": "Anti-glare 3H hardness",
        "Bildschirmtyp": "IPS",
        "Details zu Abmessungen & Gewicht": "Mit Fu\u00df - Breite: 53.94 cm - Tiefe: 20.7 cm - H\u00f6he: 49.49 cm - Gewicht: 6.3 kg \u00a6 Ohne Fu\u00df - Breite: 53.94 cm - Tiefe: 4.7 cm",
        "Diagonalabmessung": "61 cm (24\")",
        "Display-Typ": "LED-hintergrundbeleuchteter LCD-Monitor / TFT-Aktivmatrix",
        "ENERGY STAR zertifiziert": "Ja",
        "Eingangsspannung": "Wechselstrom 120/230 V (50/60 Hz)",
        "Einstellungen der Anzeigeposition": "H\u00f6he, Pivot (Rotation), Drehung, Neigung",
        "Energie Effizienzklasse": "Klasse D",
        "Enthaltene Kabel": "1 x USB-C Kabel",
        "Entwickelt f\u00fcr": "HP Elite Mobile Thin Client mt645 G7 \u00a6 HP EliteBook 745 G5, 830 G5, 830 G6, 840 G5, 840 G6 \u00a6 HP EliteDesk 800 G6 \u00a6 HP Fortis 11 G9 Q Chromebook \u00a6 HP Pro Mobile Thin Client mt440 G3 \u00a6 HP ZBook Firefly 14 G9 Mobile Workstation",
        "Farbe": "Sparkling Black",
        "Gewicht": "6.3 kg",
        "Helligkeit": "250 cd/m\u00b2",
        "Hintergrundbeleuchtungs-Technologie": "LED-Hintergrundbeleuchtung",
        "Horizontale Bildwiederholrate": "30 - 80 kHz",
        "Horizontaler Betrachtungswinkel": "178",
        "H\u00f6heneinstellung": "150 mm",
        "Integrierte Peripherieger\u00e4te": "USB 3.2 Gen 1 Hub",
        "Kennzeichnung": "CSA, UL, VCCI, BSMI, GS, NOM, TUV S, CB, CCC, PSB, FCC, ISO 9241-307, KCC, WEEE, cTUVus, KC, CECP, CEL, EAC, ISC, SEPA, BIS, halogenarm, ICE, UAE, Australien-Neuseeland MEPS, Vietnam MEPS",
        "Kontrast": "1000:1 / 5000000:1 (dynamisch)",
        "Leistungsaufnahme im Ein-Zustand": "13.7 W",
        "Leistungsmerkmale": "Slot f\u00fcr Sicherheitsschloss (Kabelschloss getrennt erh\u00e4ltlich), abnehmbarer St\u00e4nder, Unterst\u00fctzung f\u00fcr VESA-Schnittstelle",
        "Max. Betriebstemperatur": "35 \u00b0C",
        "Min Betriebstemperatur": "5 \u00b0C",
        "Mitgelieferte Software": "HP Display Center",
        "Native Aufl\u00f6sung": "Full HD (1080p) 1920 x 1080 bei 60 Hz",
        "Neigungswinkel": "-5/+23",
        "Pixelpitch": "0.274 mm",
        "Reaktionszeit": "5 ms (grau zu grau mit \u00dcbersteuerung)",
        "Rotationswinkel": "180",
        "Schlosstyp zur Diebstahlsicherung": "Kensington Slot",
        "Schnittstellen": "DisplayPort 1.2 (HDCP) \u00a6 DisplayPort 1.2 Ausgang (HDCP) \u00a6 HDMI (HDCP) \u00a6 4 x USB 3.2 Gen 1 Downstream \u00a6 USB-C 3.2 Gen 1 Upstream/DisplayPort 1.2 Alt Mode mit Spannungsversorgung (bis zu 65 W)",
        "Schwenkwinkel": "90",
        "Seitenverh\u00e4ltnis": "16:9",
        "Sichtbare Bildfl\u00e4che": "60.45 cm (23.8\")",
        "Stromverbrauch (typisch)": "22 Watt",
        "Stromverbrauch SDR (eingeschaltet)": "13.7 kWh/1.000 h",
        "Stromverbrauch im Standby-Modus": "0.5 Watt",
        "TCO-zertifiziert": "TCO Certified Displays 8, TCO Certified Edge Displays",
        "Transportbreite": "61.1 cm",
        "Transportgewicht": "8.89 kg",
        "Transporttiefe": "22.3 cm",
        "VESA-Halterung": "100 x 100 mm",
        "Vertikale Bildwiederholrate": "50 - 60 Hz",
        "Vertikaler Betrachtungswinkel": "178",
        "Zul\u00e4ssige Luftfeuchtigkeit im Betrieb": "20 - 80% (nicht kondensierend)"
    },
    "raw_specifications_text": "Display-Typ: LED-hintergrundbeleuchteter LCD-Monitor / TFT-Aktivmatrix\nEnergie Effizienzklasse: Klasse D\nDiagonalabmessung: 61 cm (24\")\nSichtbare Bildfl\u00e4che: 60.45 cm (23.8\")\nIntegrierte Peripherieger\u00e4te: USB 3.2 Gen 1 Hub\nBildschirmtyp: IPS\nSeitenverh\u00e4ltnis: 16:9\nNative Aufl\u00f6sung: Full HD (1080p) 1920 x 1080 bei 60 Hz\nPixelpitch: 0.274 mm\nHelligkeit: 250 cd/m\u00b2\nKontrast: 1000:1 / 5000000:1 (dynamisch)\nReaktionszeit: 5 ms (grau zu grau mit \u00dcbersteuerung)\nVertikale Bildwiederholrate: 50 - 60 Hz\nHorizontale Bildwiederholrate: 30 - 80 kHz\nHorizontaler Betrachtungswinkel: 178\nVertikaler Betrachtungswinkel: 178\nBildschirmbeschichtung: Anti-glare 3H hardness\nHintergrundbeleuchtungs-Technologie: LED-Hintergrundbeleuchtung\nBesonderheiten: On-screen Digital Controls, Low Blue Light Mode, flimmerfreie Technologie, ohne Quecksilber, arsenfreies Glas, extrem schmale Blende an drei Seiten, 8-bit (6-bit + FRC) Farbtiefe, HP Eye Ease\nFarbe: Sparkling Black\nAbmessungen (Breite x Tiefe x H\u00f6he): 53.94 cm x 20.7 cm x 49.49 cm - mit Fu\u00df\nGewicht: 6.3 kg\nSchnittstellen: DisplayPort 1.2 (HDCP) \u00a6 DisplayPort 1.2 Ausgang (HDCP) \u00a6 HDMI (HDCP) \u00a6 4 x USB 3.2 Gen 1 Downstream \u00a6 USB-C 3.2 Gen 1 Upstream/DisplayPort 1.2 Alt Mode mit Spannungsversorgung (bis zu 65 W)\nEinstellungen der Anzeigeposition: H\u00f6he, Pivot (Rotation), Drehung, Neigung\nNeigungswinkel: -5/+23\nSchwenkwinkel: 90\nRotationswinkel: 180\nH\u00f6heneinstellung: 150 mm\nVESA-Halterung: 100 x 100 mm\nLeistungsmerkmale: Slot f\u00fcr Sicherheitsschloss (Kabelschloss getrennt erh\u00e4ltlich), abnehmbarer St\u00e4nder, Unterst\u00fctzung f\u00fcr VESA-Schnittstelle\nEnthaltene Kabel: 1 x USB-C Kabel\nKennzeichnung: CSA, UL, VCCI, BSMI, GS, NOM, TUV S, CB, CCC, PSB, FCC, ISO 9241-307, KCC, WEEE, cTUVus, KC, CECP, CEL, EAC, ISC, SEPA, BIS, halogenarm, ICE, UAE, Australien-Neuseeland MEPS, Vietnam MEPS\nSchlosstyp zur Diebstahlsicherung: Kensington Slot\nEingangsspannung: Wechselstrom 120/230 V (50/60 Hz)\nLeistungsaufnahme im Ein-Zustand: 13.7 W\nStromverbrauch SDR (eingeschaltet): 13.7 kWh/1.000 h\nStromverbrauch (typisch): 22 Watt\nStromverbrauch im Standby-Modus: 0.5 Watt\nMitgelieferte Software: HP Display Center\nDetails zu Abmessungen & Gewicht: Mit Fu\u00df - Breite: 53.94 cm - Tiefe: 20.7 cm - H\u00f6he: 49.49 cm - Gewicht: 6.3 kg \u00a6 Ohne Fu\u00df - Breite: 53.94 cm - Tiefe: 4.7 cm\nTransportbreite: 61.1 cm\nTransporttiefe: 22.3 cm\nTransportgewicht: 8.89 kg\nTCO-zertifiziert: TCO Certified Displays 8, TCO Certified Edge Displays\nENERGY STAR zertifiziert: Ja\nMin Betriebstemperatur: 5 \u00b0C\nMax. Betriebstemperatur: 35 \u00b0C\nZul\u00e4ssige Luftfeuchtigkeit im Betrieb: 20 - 80% (nicht kondensierend)\nEntwickelt f\u00fcr: HP Elite Mobile Thin Client mt645 G7 \u00a6 HP EliteBook 745 G5, 830 G5, 830 G6, 840 G5, 840 G6 \u00a6 HP EliteDesk 800 G6 \u00a6 HP Fortis 11 G9 Q Chromebook \u00a6 HP Pro Mobile Thin Client mt440 G3 \u00a6 HP ZBook Firefly 14 G9 Mobile Workstation",
    "reference_file": "offer_reference_1443.json",
    "shop_name": "ElectronicShop24"
}