{
    "html_file": "offer_2449_0.html",
    "name": "Acer Value V6 V196LBbmd schwarz, 19\"",
    "offer_link": "https://www.alternate.at/Acer/V196LBbmd-LED-Monitor/html/product/1505331?partner=AtGeizhalsat&campaign=Monitor/Acer/1505331",
    "price": 142.9,
    "raw_specifications": {
        "": "Ausgangsleistung",
        "Abmessungen": "Breite: 40,64 cm x H\u00f6he: 42,27 cm x Tiefe/L\u00e4nge: 19,1 cm",
        "Anschl\u00fcsse": "1x DVI-D-Eingang, 1x VGA-Eingang",
        "Bild": "Format",
        "Bildschirmaufl\u00f6sung": "1.280 x 1.024 Pixel",
        "Bildschirmdiagonale": "48,3 cm (19 Zoll)",
        "EAN": "4713392857973",
        "Energieeffizienzklasse (SDR)": "E (A - G)",
        "Energieverbauch pro 1000 Stunden (SDR)": "14 kWh",
        "Ergonomie": "Typ",
        "Farbe": "dunkelgrau",
        "Gewicht": "3,1 kg",
        "Hersteller-Nr.": "UM.CV6EE.B08",
        "Lautsprecher": "2 Lautsprecher",
        "Leistungsaufnahme im Bereitschafts- und Aus-Zustand": "0,5 Watt",
        "Leistungsaufnahme im Ein-Zustand bei Standard-Dynamikumfang (SDR)": "14,4 Watt",
        "Serie": "V6",
        "Stromversorgung": "Eco-Off",
        "Typ": "LED-Monitor",
        "Wandhalterung": "VESA kompatibel (100 x 100 mm)"
    },
    "raw_specifications_text": "Energieeffizienzklasse (SDR): E (A - G)\nEnergieverbauch pro 1000 Stunden (SDR): 14 kWh\nLeistungsaufnahme im Ein-Zustand bei Standard-Dynamikumfang (SDR): 14,4 Watt\nLeistungsaufnahme im Bereitschafts- und Aus-Zustand: 0,5 Watt\nBildschirmdiagonale: 48,3 cm (19 Zoll)\nBildschirmaufl\u00f6sung: 1.280 x 1.024 Pixel\nTyp: LED-Monitor\nFarbe: dunkelgrau\nEAN: 4713392857973\nHersteller-Nr.: UM.CV6EE.B08\nSerie: V6\nBild: Format\n: Ausgangsleistung\nAnschl\u00fcsse: 1x DVI-D-Eingang, 1x VGA-Eingang\nErgonomie: Typ\nStromversorgung: Eco-Off\nLautsprecher: 2 Lautsprecher\nWandhalterung: VESA kompatibel (100 x 100 mm)\nAbmessungen: Breite: 40,64 cm x H\u00f6he: 42,27 cm x Tiefe/L\u00e4nge: 19,1 cm\nGewicht: 3,1 kg",
    "reference_file": "offer_reference_2449.json",
    "shop_name": "Alternate.at"
}