{
    "html_file": "offer_787_12.html",
    "name": "Fujitsu P-Line P2410 WE, 24.1\"",
    "offer_link": "https://www.mylemon.at/artikel/fujitsu/s26361_k1698_v140/display-p2410-we-eu-p.html",
    "price": 315.19,
    "raw_specifications": {
        "AC Eingangsfrequenz": "50/60 Hz",
        "AC Eingangsspannung": "100 - 240 V",
        "Anzahl DisplayPort Anschl\u00fcsse": "2",
        "Anzahl der Farben des Displays": "16,7 Millionen Farben",
        "Anzahl der nachgeschalteten Ports vom Typ USB-C": "1",
        "Artikelnummer": "M17Y57AL",
        "Aufl\u00f6sung": "1920x1200",
        "Betriebstemperatur": "5 - 35 \u00b0C",
        "Bildschirmdiagonale": "54,4 cm (21.4 Zoll)",
        "Bildschirmform": "Flach",
        "Bildschirmtechnologie": "LCD",
        "Blendfreier Bildschirm": "Ja",
        "Breite (ohne Standfu\u00df)": "53,2 cm",
        "Display-Aufl\u00f6sung": "1920 x 1200 Pixel",
        "Displaygr\u00f6\u00dfe": "24 Zoll",
        "EAN": "4065221160229",
        "Eingebaute Lautsprecher": "Ja",
        "Eingebauter Ethernet-Anschluss": "Ja",
        "Energieeffizienzklasse (HDR)": "D",
        "Energieeffizienzskala": "A bis G",
        "Energieverbrauch (HDR) pro 1.000 Stunden": "53,98 kWh",
        "Farbskala": "73%",
        "Ger\u00e4tebreite (inkl. Fu\u00df)": "532,2 mm",
        "Ger\u00e4teh\u00f6he (inkl. Fu\u00df)": "365,7 mm",
        "Ger\u00e4tetiefe (inkl. Fu\u00df)": "212,7 mm",
        "Gewicht (mit St\u00e4nder)": "6,56 kg",
        "Gewicht (ohne St\u00e4nder)": "4,54 kg",
        "HD-Typ": "WUXGA",
        "HDMI": "Ja",
        "Helligkeit": "300 cd/m\u00b2",
        "Helligkeit (typisch)": "300 cd/m\u00b2",
        "Hersteller Artikelnummer": "S26361-K1698-V140",
        "High Dynamic Range Video (HDR) Unterst\u00fctzung": "Ja",
        "H\u00f6he (ohne Standfu\u00df)": "35,1 cm",
        "Integrierte Kamera": "Nein",
        "Kontrastverh\u00e4ltnis": "1000:1",
        "Kontrastverh\u00e4ltnis (dynamisch)": "20000000:1",
        "Marktpositionierung": "Haus",
        "Nachhaltigkeitszertifikate": "ENERGY STAR, EPEAT Silver, RoHS, TCO",
        "Name der Farbe": "Marble Gray",
        "Natives Seitenverh\u00e4ltnis": "16:10",
        "Oberfl\u00e4chenh\u00e4rte": "3H",
        "Panel": "IPS",
        "Panel-Montage-Schnittstelle": "100 x 100 mm",
        "Panel-Typ": "IPS",
        "Produktfarbe": "Grau",
        "RGB-Farbraum": "NTSC",
        "Reaktionszeit": "5 ms",
        "Relative Luftfeuchtigkeit in Betrieb": "15 - 85%",
        "Stromverbrauch (Standby)": "0,26 W",
        "Stromverbrauch (max.)": "28 W",
        "Tiefe (ohne Standfu\u00df)": "5,92 cm",
        "Touchscreen": "Nein",
        "VESA-Halterung": "Ja",
        "Video Anschl\u00fcsse": "1x HDMI, 1x DisplayPort"
    },
    "raw_specifications_text": "Displaygr\u00f6\u00dfe: 24 Zoll\nAufl\u00f6sung: 1920x1200\nPanel: IPS\nReaktionszeit: 5 ms\nVideo Anschl\u00fcsse: 1x HDMI, 1x DisplayPort\nHelligkeit: 300 cd/m\u00b2\nHersteller Artikelnummer: S26361-K1698-V140\nEAN: 4065221160229\nArtikelnummer: M17Y57AL\nBildschirmdiagonale: 54,4 cm (21.4 Zoll)\nDisplay-Aufl\u00f6sung: 1920 x 1200 Pixel\nNatives Seitenverh\u00e4ltnis: 16:10\nBildschirmtechnologie: LCD\nTouchscreen: Nein\nHD-Typ: WUXGA\nPanel-Typ: IPS\nBildschirmform: Flach\nKontrastverh\u00e4ltnis: 1000:1\nAnzahl der Farben des Displays: 16,7 Millionen Farben\nHelligkeit (typisch): 300 cd/m\u00b2\nBlendfreier Bildschirm: Ja\nKontrastverh\u00e4ltnis (dynamisch): 20000000:1\nHigh Dynamic Range Video (HDR) Unterst\u00fctzung: Ja\nOberfl\u00e4chenh\u00e4rte: 3H\nRGB-Farbraum: NTSC\nFarbskala: 73%\nEingebaute Lautsprecher: Ja\nIntegrierte Kamera: Nein\nMarktpositionierung: Haus\nProduktfarbe: Grau\nName der Farbe: Marble Gray\nHDMI: Ja\nAnzahl der nachgeschalteten Ports vom Typ USB-C: 1\nAnzahl DisplayPort Anschl\u00fcsse: 2\nEingebauter Ethernet-Anschluss: Ja\nVESA-Halterung: Ja\nPanel-Montage-Schnittstelle: 100 x 100 mm\nEnergieeffizienzklasse (HDR): D\nEnergieverbrauch (HDR) pro 1.000 Stunden: 53,98 kWh\nStromverbrauch (Standby): 0,26 W\nStromverbrauch (max.): 28 W\nAC Eingangsspannung: 100 - 240 V\nAC Eingangsfrequenz: 50/60 Hz\nEnergieeffizienzskala: A bis G\nBetriebstemperatur: 5 - 35 \u00b0C\nRelative Luftfeuchtigkeit in Betrieb: 15 - 85%\nGer\u00e4tebreite (inkl. Fu\u00df): 532,2 mm\nGer\u00e4tetiefe (inkl. Fu\u00df): 212,7 mm\nGer\u00e4teh\u00f6he (inkl. Fu\u00df): 365,7 mm\nGewicht (mit St\u00e4nder): 6,56 kg\nBreite (ohne Standfu\u00df): 53,2 cm\nTiefe (ohne Standfu\u00df): 5,92 cm\nH\u00f6he (ohne Standfu\u00df): 35,1 cm\nGewicht (ohne St\u00e4nder): 4,54 kg\nNachhaltigkeitszertifikate: ENERGY STAR, EPEAT Silver, RoHS, TCO",
    "reference_file": "offer_reference_787.json",
    "shop_name": "mylemon.at"
}