{
    "html_file": "offer_1430_26.html",
    "name": "ASUS ROG Strix XG16AHP-W, 15.6\"",
    "offer_link": "https://www.electronicshop24.at/product_info.php?products_id=420000000066416485&ano=U66416485&mno=90LM06ID-B02170&ean=4718017911269&utm_medium=cpc&utm_campaign=preisvergleich&utm_content=item&utm_source=geizhals&ref=geizhals",
    "price": 525.0,
    "raw_specifications": {
        "Adaptive-Sync Technologie": "NVIDIA G-SYNC Compatible",
        "Ausgangsleistung/Kanal": "1 Watt",
        "Besonderheiten": "HDCP, Trace Free Technology, Low Blue Light Mode, flimmerfreie Technologie, Adaptive-Sync-Technologie, ASUS GameVisual Technology, klappbarer St\u00e4nder",
        "Bildschirmbeschichtung": "Blendfrei",
        "Bildschirmtyp": "IPS",
        "Diagonalabmessung": "39.6 cm (15.6\")",
        "Display-Typ": "LED-hintergrundbeleuchteter LCD-Monitor / TFT-Aktivmatrix",
        "Eingangsspannung": "Wechselstrom 120/230 V (50/60 Hz)",
        "Einstellungen der Anzeigeposition": "H\u00f6he, Drehung",
        "Energie Effizienzklasse": "Klasse E",
        "Farbunterst\u00fctzung": "16,7 Millionen Farben",
        "Gaming": "Ja",
        "Helligkeit": "300 cd/m\u00b2",
        "Hintergrundbeleuchtungs-Technologie": "LED-Hintergrundbeleuchtung",
        "Horizontaler Betrachtungswinkel": "178",
        "H\u00f6heneinstellung": "115 mm",
        "Kapazit\u00e4t": "7800 mAh",
        "Kennzeichnung": "TUV Rheinland Low Blue Light Certification, TUV Rheinland Flicker Free Certification",
        "Kontrast": "800:1",
        "Laufzeit (bis zu)": "3 Stunden",
        "Leistungsaufnahme im Ein-Zustand": "12 W",
        "Leistungsmerkmale": "ESS Technology",
        "Native Aufl\u00f6sung": "Full HD (1080p) 1920 x 1080 bei 144 Hz",
        "Pixelpitch": "0.179 mm",
        "Reaktionszeit": "3 ms (grau-zu-grau)",
        "Schnittstellen": "Micro HDMI \u00a6 USB-C \u00a6 USB-C (f\u00fcr Stromversorgung) \u00a6 Kopfh\u00f6rer",
        "Schwenkwinkel": "360",
        "Seitenverh\u00e4ltnis": "16:9",
        "Stromverbrauch (Aus-Modus)": "0 Watt",
        "Stromverbrauch (typisch)": "10 Watt",
        "Stromverbrauch SDR (eingeschaltet)": "12 kWh/1.000 h",
        "Typ": "Lautsprecher - Stereo",
        "Vertikaler Betrachtungswinkel": "178",
        "Zubeh\u00f6r im Lieferumfang": "ROG-Stativ, H\u00fclle"
    },
    "raw_specifications_text": "Display-Typ: LED-hintergrundbeleuchteter LCD-Monitor / TFT-Aktivmatrix\nEnergie Effizienzklasse: Klasse E\nDiagonalabmessung: 39.6 cm (15.6\")\nAdaptive-Sync Technologie: NVIDIA G-SYNC Compatible\nBildschirmtyp: IPS\nSeitenverh\u00e4ltnis: 16:9\nNative Aufl\u00f6sung: Full HD (1080p) 1920 x 1080 bei 144 Hz\nPixelpitch: 0.179 mm\nHelligkeit: 300 cd/m\u00b2\nKontrast: 800:1\nFarbunterst\u00fctzung: 16,7 Millionen Farben\nReaktionszeit: 3 ms (grau-zu-grau)\nGaming: Ja\nHorizontaler Betrachtungswinkel: 178\nVertikaler Betrachtungswinkel: 178\nBildschirmbeschichtung: Blendfrei\nHintergrundbeleuchtungs-Technologie: LED-Hintergrundbeleuchtung\nBesonderheiten: HDCP, Trace Free Technology, Low Blue Light Mode, flimmerfreie Technologie, Adaptive-Sync-Technologie, ASUS GameVisual Technology, klappbarer St\u00e4nder\nTyp: Lautsprecher - Stereo\nAusgangsleistung/Kanal: 1 Watt\nSchnittstellen: Micro HDMI \u00a6 USB-C \u00a6 USB-C (f\u00fcr Stromversorgung) \u00a6 Kopfh\u00f6rer\nEinstellungen der Anzeigeposition: H\u00f6he, Drehung\nSchwenkwinkel: 360\nH\u00f6heneinstellung: 115 mm\nLeistungsmerkmale: ESS Technology\nZubeh\u00f6r im Lieferumfang: ROG-Stativ, H\u00fclle\nKennzeichnung: TUV Rheinland Low Blue Light Certification, TUV Rheinland Flicker Free Certification\nEingangsspannung: Wechselstrom 120/230 V (50/60 Hz)\nLeistungsaufnahme im Ein-Zustand: 12 W\nStromverbrauch SDR (eingeschaltet): 12 kWh/1.000 h\nStromverbrauch (typisch): 10 Watt\nStromverbrauch (Aus-Modus): 0 Watt\nKapazit\u00e4t: 7800 mAh\nLaufzeit (bis zu): 3 Stunden",
    "reference_file": "offer_reference_1430.json",
    "shop_name": "ElectronicShop24"
}