{
    "html_file": "offer_1852_35.html",
    "name": "Lenovo ThinkVision p27q-20, 27\"",
    "offer_link": "https://www.alternate.at/Lenovo/P27q-20-LED-Monitor/html/product/1612963?partner=AtGeizhalsat&campaign=Monitor/Lenovo/1612963",
    "price": 387.0,
    "raw_specifications": {
        "": "Netzteil",
        "Abmessungen": "Breite: 61,38 cm x H\u00f6he: 57,65 cm x Tiefe/L\u00e4nge: 20,8 cm",
        "Anschl\u00fcsse": "1x HDMI-Eingang, (HDMI-Version: 1.4), 1x DisplayPort-Eingang, 1x DisplayPort-Ausgang, (DisplayPort-Version: 1.2), 4x USB-A-3.2 Gen 1 (5 Gbit/s), 1x USB-B-3.2 (5 Gbit/s)",
        "Bild": "Format",
        "Bildschirmaufl\u00f6sung": "2.560 x 1.440 Pixel",
        "Bildschirmdiagonale": "68,6 cm (27 Zoll)",
        "EAN": "0193638970552",
        "Energieeffizienzklasse (SDR)": "E (A - G)",
        "Energieverbauch pro 1000 Stunden (SDR)": "19 kWh",
        "Ergonomie": "Typ",
        "Farbe": "schwarz",
        "Gewicht": "7,1 kg",
        "Hersteller-Nr.": "61EAGAT6EU",
        "Leistungsaufnahme im Bereitschafts- und Aus-Zustand": "0,2 Watt",
        "Leistungsaufnahme im Ein-Zustand bei Standard-Dynamikumfang (SDR)": "18,8 Watt",
        "Standards": "Video",
        "Stromversorgung": "Eco-Off",
        "Typ": "LED-Monitor",
        "Zubeh\u00f6r": "Vorhanden"
    },
    "raw_specifications_text": "Energieeffizienzklasse (SDR): E (A - G)\nEnergieverbauch pro 1000 Stunden (SDR): 19 kWh\nLeistungsaufnahme im Ein-Zustand bei Standard-Dynamikumfang (SDR): 18,8 Watt\nLeistungsaufnahme im Bereitschafts- und Aus-Zustand: 0,2 Watt\nBildschirmdiagonale: 68,6 cm (27 Zoll)\nBildschirmaufl\u00f6sung: 2.560 x 1.440 Pixel\nTyp: LED-Monitor\nFarbe: schwarz\nEAN: 0193638970552\nHersteller-Nr.: 61EAGAT6EU\nBild: Format\n: Netzteil\nAnschl\u00fcsse: 1x HDMI-Eingang, (HDMI-Version: 1.4), 1x DisplayPort-Eingang, 1x DisplayPort-Ausgang, (DisplayPort-Version: 1.2), 4x USB-A-3.2 Gen 1 (5 Gbit/s), 1x USB-B-3.2 (5 Gbit/s)\nErgonomie: Typ\nStromversorgung: Eco-Off\nStandards: Video\nZubeh\u00f6r: Vorhanden\nAbmessungen: Breite: 61,38 cm x H\u00f6he: 57,65 cm x Tiefe/L\u00e4nge: 20,8 cm\nGewicht: 7,1 kg",
    "reference_file": "offer_reference_1852.json",
    "shop_name": "Alternate.at"
}