{
    "html_file": "offer_1542_25.html",
    "name": "Dell C2722DE, 27\"",
    "offer_link": "https://www.future-x.at/dell-c2722de-led-monitor-68-47-cm-27-sichtbar-2560-x-1440-wqhd-%40-60-hz-ips-350-cd-m%B2-1000%3A1-6-ms-hdmi-displayport-usb-c-lautsprecher-mit-3-jahre-erweiterte-p-8805186/?pv=2",
    "price": 391.3,
    "raw_specifications": {
        "AC Eingangsfrequenz": "50/60 Hz",
        "AC Eingangsspannung": "100 - 240 V",
        "AMD FreeSync": "Nein",
        "Abnehmbarer Standfu\u00df": "Ja",
        "Anzahl DisplayPort Anschl\u00fcsse": "1",
        "Anzahl Ethernet-LAN-Anschl\u00fcsse (RJ-45)": "1",
        "Anzahl HDMI-Anschl\u00fcsse": "1",
        "Anzahl der Farben des Displays": "16,78 Millionen Farben",
        "Anzahl der Lautsprecher": "2",
        "Anzahl der Upstream-Ports USB Typ-B": "1",
        "Anzahl der Upstream-Ports USB Typ-C": "2",
        "Anzahl der nachgeschalteten Steckpl\u00e4tze vom Typ USB-A": "3",
        "Audioanschl\u00fcsse": "Nein",
        "Bezel Weite (bottom)": "5,2 cm",
        "Bezel Weite (side)": "7,8 mm",
        "Bezel Weite (top)": "7,8 mm",
        "Bildschirmaufl\u00f6sung": "2560 x 1440 Pixel",
        "Bildschirmdiagonale": "68,6 cm",
        "Bildschirmdiagonale (cm)": "68,5 cm",
        "Bildschirmform": "Flach",
        "Bildschirmtechnologie": "LCD",
        "Blendfreier Bildschirm": "Ja",
        "Blickwinkel, horizontal": "178 \u00b0",
        "Blickwinkel, vertikal": "178 \u00b0",
        "Breite (ohne Standfu\u00df)": "61,2 cm",
        "DVI Anschluss": "Nein",
        "DisplayPort Kabell\u00e4nge": "1,8 m",
        "DisplayPorts-Version": "1.2",
        "Eingebaute Lautsprecher": "Ja",
        "Eingebautes Mikrofon": "Ja",
        "Energieeffizienzklasse (SDR)": "F",
        "Energieeffizienzskala": "A bis G",
        "Energieverbrauch (SDR) pro 1.000 Stunden": "23 kWh",
        "Enth\u00e4lt nicht": "PVC/BFR",
        "Flimmerfreie Technologie": "Ja",
        "Fu\u00dffarbe": "Silber",
        "Ger\u00e4tebreite (inkl. Fu\u00df)": "612,3 mm",
        "Ger\u00e4teh\u00f6he (inkl. Fu\u00df)": "565,6 mm",
        "Ger\u00e4tetiefe (inkl. Fu\u00df)": "230 mm",
        "Gewicht (mit St\u00e4nder)": "8,8 kg",
        "Gewicht (ohne St\u00e4nder)": "5,74 kg",
        "HD-Typ": "Quad HD",
        "HDCP": "Ja",
        "HDMI": "Ja",
        "HDMI-Version": "1.4",
        "Helligkeit (typisch)": "350 cd/m\u00b2",
        "Horizontaler Scanbereich": "30 - 90 kHz",
        "H\u00f6he (ohne Standfu\u00df)": "42,5 cm",
        "H\u00f6he bei Betrieb": "0 - 5000 m",
        "H\u00f6he bei Lagerung": "5000 - 12192 m",
        "H\u00f6heneinstellung": "12 cm",
        "H\u00f6henverstellung": "Ja",
        "Integrierte Kamera": "Ja",
        "Integrierter USB-Hub": "Ja",
        "Kabelsperre-Slot": "Ja",
        "Kamerabildpunkte": "5 MP",
        "Kontrastverh\u00e4ltnis": "1000:1",
        "Kopfh\u00f6rer-Konnektivit\u00e4t": "3,5 mm",
        "Kopfh\u00f6rerausgang": "Nein",
        "Kopfh\u00f6rerausg\u00e4nge": "1",
        "LED-Anzeigen": "Ja",
        "Low-Blue-Light-Technologie": "Ja",
        "Luftfeuchtigkeit bei Lagerung": "5 - 90 %",
        "Luftfeuchtigkeit in Betrieb": "10 - 80 %",
        "Marktpositionierung": "Haus",
        "Maximale Bildwiederholrate": "60 Hz",
        "Mitgelieferte Kabel": "AC, DisplayPort, USB Type-A to USB Type-B, USB Type-C to USB Type-C",
        "NVIDIA G-SYNC": "Nein",
        "Nachhaltigkeitszertifikate": "ENERGY STAR, RoHS",
        "Natives Seitenverh\u00e4ltnis": "16:9",
        "Neigungswinkelbereich": "-5 - 21 \u00b0",
        "On-Screen-Display (OSD)": "Ja",
        "Paketgewicht": "12,6 kg",
        "Panel-Montage-Schnittstelle": "100 x 100 mm",
        "Panel-Typ": "IPS",
        "Pivot": "Ja",
        "Pivot Winkel": "-90 - 90 \u00b0",
        "Pixel Abstand": "0,233 x 0,233 mm",
        "Pixeldichte": "108,79 ppi",
        "Produktfarbe": "Black, Silver",
        "RMS-Leistung": "10 W",
        "Reaktionszeit": "8 ms",
        "Reaktionszeit (schnell)": "6 ms",
        "Schnellstart\u00fcbersicht": "Ja",
        "Schwenkbar": "Ja",
        "Schwenkwinkelbereich": "-45 - 45 \u00b0",
        "Schwermetallfrei": "Hg (Quecksilber)",
        "Sichtbare Gr\u00f6\u00dfe (horizontal)": "59,7 cm",
        "Sichtbare Gr\u00f6\u00dfe (vertikal)": "33,6 cm",
        "Stromeingang": "Ja",
        "Stromverbrauch (Standby)": "0,3 W",
        "Stromverbrauch (aus)": "0,2 W",
        "Stromverbrauch (in Betrieb)": "22,8 W",
        "Stromverbrauch (max.)": "210 W",
        "St\u00e4nder enthalten": "Ja",
        "Temperaturbereich bei Lagerung": "-20 - 60 \u00b0C",
        "Temperaturbereich in Betrieb": "0 - 40 \u00b0C",
        "Tiefe (ohne Standfu\u00df)": "5,39 cm",
        "Typ der Hintergrundbeleuchtung": "LED",
        "USB Kabell\u00e4nge": "1,8 m",
        "USB-Hub-Version": "3.2 Gen 1 (3.1 Gen 1)",
        "USB-Stromversorgung bis zu": "90 W",
        "USB-Typ-C DisplayPort-Wechselmodus": "Ja",
        "USB-Upstream-Porttyp": "USB Typ-C",
        "Unterst\u00fctzte Grafik-Aufl\u00f6sungen": "2560 x 1440",
        "Unterst\u00fctzte Video-Modi": "480i,480p,576i,720p,1080i,1080p",
        "VESA-Halterung": "Ja",
        "Vertikaler Scanbereich": "56 - 76 Hz",
        "Vorderer Rahmen": "Schwarz",
        "kippbar": "Ja",
        "sRGB Abdeckung (klassisch)": "99 %"
    },
    "raw_specifications_text": "NVIDIA G-SYNC: Nein\nAMD FreeSync: Nein\nFlimmerfreie Technologie: Ja\nLow-Blue-Light-Technologie: Ja\nBildschirmdiagonale: 68,6 cm\nBildschirmaufl\u00f6sung: 2560 x 1440 Pixel\nNatives Seitenverh\u00e4ltnis: 16:9\nPanel-Typ: IPS\nHelligkeit (typisch): 350 cd/m\u00b2\nReaktionszeit: 8 ms\nHD-Typ: Quad HD\nBildschirmtechnologie: LCD\nTyp der Hintergrundbeleuchtung: LED\nBlendfreier Bildschirm: Ja\nBildschirmform: Flach\nUnterst\u00fctzte Grafik-Aufl\u00f6sungen: 2560 x 1440\nUnterst\u00fctzte Video-Modi: 480i,480p,576i,720p,1080i,1080p\nKontrastverh\u00e4ltnis: 1000:1\nMaximale Bildwiederholrate: 60 Hz\nBlickwinkel, horizontal: 178 \u00b0\nBlickwinkel, vertikal: 178 \u00b0\nAnzahl der Farben des Displays: 16,78 Millionen Farben\nReaktionszeit (schnell): 6 ms\nPixel Abstand: 0,233 x 0,233 mm\nPixeldichte: 108,79 ppi\nHorizontaler Scanbereich: 30 - 90 kHz\nVertikaler Scanbereich: 56 - 76 Hz\nSichtbare Gr\u00f6\u00dfe (horizontal): 59,7 cm\nSichtbare Gr\u00f6\u00dfe (vertikal): 33,6 cm\nBildschirmdiagonale (cm): 68,5 cm\nsRGB Abdeckung (klassisch): 99 %\nIntegrierter USB-Hub: Ja\nUSB-Hub-Version: 3.2 Gen 1 (3.1 Gen 1)\nUSB-Upstream-Porttyp: USB Typ-C\nAnzahl der Upstream-Ports USB Typ-B: 1\nAnzahl der Upstream-Ports USB Typ-C: 2\nAnzahl der nachgeschalteten Steckpl\u00e4tze vom Typ USB-A: 3\nUSB-Typ-C DisplayPort-Wechselmodus: Ja\nUSB-Stromversorgung bis zu: 90 W\nDVI Anschluss: Nein\nHDMI: Ja\nAnzahl HDMI-Anschl\u00fcsse: 1\nHDMI-Version: 1.4\nAnzahl DisplayPort Anschl\u00fcsse: 1\nDisplayPorts-Version: 1.2\nAudioanschl\u00fcsse: Nein\nKopfh\u00f6rerausgang: Nein\nKopfh\u00f6rerausg\u00e4nge: 1\nKopfh\u00f6rer-Konnektivit\u00e4t: 3,5 mm\nHDCP: Ja\nStromeingang: Ja\nVESA-Halterung: Ja\nPanel-Montage-Schnittstelle: 100 x 100 mm\nKabelsperre-Slot: Ja\nH\u00f6henverstellung: Ja\nH\u00f6heneinstellung: 12 cm\nPivot: Ja\nPivot Winkel: -90 - 90 \u00b0\nSchwenkbar: Ja\nSchwenkwinkelbereich: -45 - 45 \u00b0\nkippbar: Ja\nNeigungswinkelbereich: -5 - 21 \u00b0\nOn-Screen-Display (OSD): Ja\nLED-Anzeigen: Ja\nEingebaute Lautsprecher: Ja\nIntegrierte Kamera: Ja\nAnzahl der Lautsprecher: 2\nRMS-Leistung: 10 W\nKamerabildpunkte: 5 MP\nEingebautes Mikrofon: Ja\nMarktpositionierung: Haus\nProduktfarbe: Black, Silver\nVorderer Rahmen: Schwarz\nAbnehmbarer Standfu\u00df: Ja\nFu\u00dffarbe: Silber\nSchwermetallfrei: Hg (Quecksilber)\nSt\u00e4nder enthalten: Ja\nMitgelieferte Kabel: AC, DisplayPort, USB Type-A to USB Type-B, USB Type-C to USB Type-C\nDisplayPort Kabell\u00e4nge: 1,8 m\nUSB Kabell\u00e4nge: 1,8 m\nSchnellstart\u00fcbersicht: Ja\nPaketgewicht: 12,6 kg\nEnergieeffizienzklasse (SDR): F\nEnergieverbrauch (SDR) pro 1.000 Stunden: 23 kWh\nStromverbrauch (in Betrieb): 22,8 W\nStromverbrauch (Standby): 0,3 W\nStromverbrauch (max.): 210 W\nStromverbrauch (aus): 0,2 W\nAC Eingangsspannung: 100 - 240 V\nAC Eingangsfrequenz: 50/60 Hz\nEnergieeffizienzskala: A bis G\nTemperaturbereich in Betrieb: 0 - 40 \u00b0C\nTemperaturbereich bei Lagerung: -20 - 60 \u00b0C\nLuftfeuchtigkeit in Betrieb: 10 - 80 %\nLuftfeuchtigkeit bei Lagerung: 5 - 90 %\nH\u00f6he bei Betrieb: 0 - 5000 m\nH\u00f6he bei Lagerung: 5000 - 12192 m\nGer\u00e4tebreite (inkl. Fu\u00df): 612,3 mm\nGer\u00e4tetiefe (inkl. Fu\u00df): 230 mm\nGer\u00e4teh\u00f6he (inkl. Fu\u00df): 565,6 mm\nGewicht (mit St\u00e4nder): 8,8 kg\nBreite (ohne Standfu\u00df): 61,2 cm\nTiefe (ohne Standfu\u00df): 5,39 cm\nH\u00f6he (ohne Standfu\u00df): 42,5 cm\nGewicht (ohne St\u00e4nder): 5,74 kg\nBezel Weite (side): 7,8 mm\nBezel Weite (top): 7,8 mm\nBezel Weite (bottom): 5,2 cm\nNachhaltigkeitszertifikate: ENERGY STAR, RoHS\nEnth\u00e4lt nicht: PVC/BFR\nAnzahl Ethernet-LAN-Anschl\u00fcsse (RJ-45): 1",
    "reference_file": "offer_reference_1542.json",
    "shop_name": "Future-X.at"
}