{
    "html_file": "offer_636_33.html",
    "name": "iiyama ProLite XUB2793HS-B5, 27\"",
    "offer_link": "https://www.alternate.at/iiyama/XUB2793HS-B5-LED-Monitor/html/product/1884227?partner=AtGeizhalsat&campaign=Monitor/iiyama/1884227",
    "price": 173.9,
    "raw_specifications": {
        "": "Kensington-Schloss",
        "Abmessungen": "Breite: 61,2 cm x H\u00f6he: 54,85 cm x Tiefe/L\u00e4nge: 20,95 cm",
        "Anschl\u00fcsse": "1x HDMI-Eingang, 1x DisplayPort-Eingang, 1x Kopfh\u00f6rer-Ausgang",
        "Bild": "Format",
        "Bildschirmaufl\u00f6sung": "1.920 x 1.080 Pixel",
        "Bildschirmdiagonale": "69 cm (27 Zoll)",
        "EAN": "4948570121168",
        "Energieeffizienzklasse (SDR)": "E (A - G)",
        "Energieverbauch pro 1000 Stunden (SDR)": "20 kWh",
        "Ergonomie": "Typ",
        "Farbe": "schwarz",
        "Features": "Blaulicht Reduktion, i-style Colour, Kabelmanagement",
        "Frequenz": "Horizontal",
        "Gewicht": "6,7 kg",
        "Hersteller-Nr.": "XUB2793HS-B5",
        "Lautsprecher": "2 Lautsprecher",
        "Leistungsaufnahme im Bereitschafts- und Aus-Zustand": "0,3 Watt",
        "Leistungsaufnahme im Ein-Zustand bei Standard-Dynamikumfang (SDR)": "20,3 Watt",
        "Stromversorgung": "Eco-Off",
        "Typ": "LED-Monitor",
        "Wandhalterung": "VESA kompatibel (100 x 100 mm)",
        "Zubeh\u00f6r": "Vorhanden"
    },
    "raw_specifications_text": "Energieeffizienzklasse (SDR): E (A - G)\nEnergieverbauch pro 1000 Stunden (SDR): 20 kWh\nLeistungsaufnahme im Ein-Zustand bei Standard-Dynamikumfang (SDR): 20,3 Watt\nLeistungsaufnahme im Bereitschafts- und Aus-Zustand: 0,3 Watt\nBildschirmdiagonale: 69 cm (27 Zoll)\nBildschirmaufl\u00f6sung: 1.920 x 1.080 Pixel\nTyp: LED-Monitor\nFarbe: schwarz\nEAN: 4948570121168\nHersteller-Nr.: XUB2793HS-B5\nBild: Format\n: Kensington-Schloss\nFrequenz: Horizontal\nAnschl\u00fcsse: 1x HDMI-Eingang, 1x DisplayPort-Eingang, 1x Kopfh\u00f6rer-Ausgang\nErgonomie: Typ\nStromversorgung: Eco-Off\nLautsprecher: 2 Lautsprecher\nWandhalterung: VESA kompatibel (100 x 100 mm)\nFeatures: Blaulicht Reduktion, i-style Colour, Kabelmanagement\nZubeh\u00f6r: Vorhanden\nAbmessungen: Breite: 61,2 cm x H\u00f6he: 54,85 cm x Tiefe/L\u00e4nge: 20,95 cm\nGewicht: 6,7 kg",
    "reference_file": "offer_reference_636.json",
    "shop_name": "Alternate.at"
}