{
    "html_file": "offer_521_25.html",
    "name": "HP E45c G5, 44.5\"",
    "offer_link": "https://www.alternate.at/HP/E45c-G5-LED-Monitor/html/product/1904972?partner=AtGeizhalsat&campaign=Monitor/HP/1904972",
    "price": 1419.0,
    "raw_specifications": {
        "": "Ausgangsleistung",
        "Anschl\u00fcsse": "1x HDMI-Eingang, (HDMI-Version: 2.1), 1x DisplayPort-Eingang, (DisplayPort-Version: 1.4), 4x USB-A-3.2 Gen 1 (5 Gbit/s), 2x USB-C 3.2 Gen 1 (5 Gbit/s), 1x RJ 45",
        "Bild": "Glaretyp",
        "Bildschirmaufl\u00f6sung": "5.120 x 1.440 Pixel",
        "Bildschirmdiagonale": "113 cm (44,5 Zoll)",
        "EAN": "0196786293856",
        "Energieeffizienzklasse (SDR)": "G (A - G)",
        "Energieverbauch pro 1000 Stunden (SDR)": "38 kWh",
        "Ergonomie": "Typ",
        "Farbe": "schwarz/silber",
        "Features": "AMD FreeSync",
        "Frequenz": "Vertikal",
        "Geeignet f\u00fcr": "Business",
        "Gewicht": "14,6 kg",
        "Hersteller-Nr.": "6N4C1AA#ABB",
        "Lautsprecher": "vorhanden",
        "Leistungsaufnahme im Bereitschafts- und Aus-Zustand": "0,5 Watt",
        "Leistungsaufnahme im Ein-Zustand bei Standard-Dynamikumfang (SDR)": "38 Watt",
        "Standards": "Video",
        "Stromversorgung": "Eco-Off",
        "Typ": "LED-Monitor",
        "Wandhalterung": "VESA kompatibel (100 x 100 mm)",
        "Weitere Informationen": "HP Eye Ease, Umgebungslichtsensor | die USB-C-Anschl\u00fcsse unterst\u00fctzen Alt Mode mit DisplayPort 1.4 und bis zu 65 Watt Power Delivery | ein USB-A-Port hat eine Ladefunktion | Ma\u00dfe ohne Standfu\u00df: 108,43 x 14,81 x 33,56 cm | flimmerfreie LEDs, Low Blue Light Modus"
    },
    "raw_specifications_text": "Energieeffizienzklasse (SDR): G (A - G)\nEnergieverbauch pro 1000 Stunden (SDR): 38 kWh\nLeistungsaufnahme im Ein-Zustand bei Standard-Dynamikumfang (SDR): 38 Watt\nLeistungsaufnahme im Bereitschafts- und Aus-Zustand: 0,5 Watt\nBildschirmdiagonale: 113 cm (44,5 Zoll)\nBildschirmaufl\u00f6sung: 5.120 x 1.440 Pixel\nTyp: LED-Monitor\nFarbe: schwarz/silber\nEAN: 0196786293856\nHersteller-Nr.: 6N4C1AA#ABB\nGeeignet f\u00fcr: Business\nBild: Glaretyp\n: Ausgangsleistung\nFrequenz: Vertikal\nAnschl\u00fcsse: 1x HDMI-Eingang, (HDMI-Version: 2.1), 1x DisplayPort-Eingang, (DisplayPort-Version: 1.4), 4x USB-A-3.2 Gen 1 (5 Gbit/s), 2x USB-C 3.2 Gen 1 (5 Gbit/s), 1x RJ 45\nErgonomie: Typ\nStromversorgung: Eco-Off\nLautsprecher: vorhanden\nStandards: Video\nWandhalterung: VESA kompatibel (100 x 100 mm)\nFeatures: AMD FreeSync\nWeitere Informationen: HP Eye Ease, Umgebungslichtsensor | die USB-C-Anschl\u00fcsse unterst\u00fctzen Alt Mode mit DisplayPort 1.4 und bis zu 65 Watt Power Delivery | ein USB-A-Port hat eine Ladefunktion | Ma\u00dfe ohne Standfu\u00df: 108,43 x 14,81 x 33,56 cm | flimmerfreie LEDs, Low Blue Light Modus\nGewicht: 14,6 kg",
    "reference_file": "offer_reference_521.json",
    "shop_name": "Alternate.at"
}