{
    "html_file": "offer_296_5.html",
    "name": "iiyama G-Master GB2730QSU-B5 Silver Crow, 27\"",
    "offer_link": "https://www.amazon.de/dp/B0BQJT1J2M?linkCode=xm2&camp=2025&creative=165953&smid=A3JWKAKR8XB7XF&creativeASIN=B0BQJT1J2M&tag=geizhals1-21",
    "price": 206.61,
    "raw_specifications": {
        "ASIN": "B0BQJT1J2M",
        "Amazon Bestseller-Rang": "Nr. 96,402 in Computer & Zubeh\u00f6r (Siehe Top 100 in Computer & Zubeh\u00f6r)  Nr. 1,740 in Monitore  Nr. 12,923 in Komponenten & Ersatzteile",
        "Anzahl HDMI Schnittstellen": "\u200e1",
        "Anzahl USB 3.0 Schnittstellen": "\u200e2",
        "Artikelgewicht": "\u200e6,6 Kilograms",
        "Batterien enthalten": "\u200eNein",
        "Betriebssystem": "\u200eWindows 10",
        "Bildschirmaufl\u00f6sung": "\u200e2560 x 1440 @75Hz (3.7 megapixel WQHD, DisplayPort)",
        "Display-Gr\u00f6\u00dfe": "\u200e27 Zoll",
        "Durchschnittliche Kundenbewertung": "4,5  4,5 von 5 Sternen    \n    2 Sternebewertungen   \n\n\n 4,5 von 5 Sternen",
        "Farbe": "\u200eSchwarz",
        "Garantierte Software-Updates bis": "\u200eunbekannt",
        "Hersteller": "\u200eiiyama",
        "Im Angebot von Amazon.de seit": "31. Januar 2023",
        "L\u00f6sung": "\u200e2560 x 1440 Pixels",
        "Marke": "\u200eiiyama",
        "Modell/Serie": "\u200eG-MASTER",
        "Modellnummer": "\u200eGB2730QSU-B5",
        "Prozessortyp": "\u200eOthers",
        "Volt": "\u200e240 Volt"
    },
    "raw_specifications_text": "Marke: \u200eiiyama\nHersteller: \u200eiiyama\nModell/Serie: \u200eG-MASTER\nModellnummer: \u200eGB2730QSU-B5\nFarbe: \u200eSchwarz\nDisplay-Gr\u00f6\u00dfe: \u200e27 Zoll\nBildschirmaufl\u00f6sung: \u200e2560 x 1440 @75Hz (3.7 megapixel WQHD, DisplayPort)\nL\u00f6sung: \u200e2560 x 1440 Pixels\nProzessortyp: \u200eOthers\nAnzahl USB 3.0 Schnittstellen: \u200e2\nAnzahl HDMI Schnittstellen: \u200e1\nVolt: \u200e240 Volt\nBetriebssystem: \u200eWindows 10\nBatterien enthalten: \u200eNein\nArtikelgewicht: \u200e6,6 Kilograms\nGarantierte Software-Updates bis: \u200eunbekannt\nASIN: B0BQJT1J2M\nDurchschnittliche Kundenbewertung: 4,5  4,5 von 5 Sternen    \n    2 Sternebewertungen   \n\n\n 4,5 von 5 Sternen\nAmazon Bestseller-Rang: Nr. 96,402 in Computer & Zubeh\u00f6r (Siehe Top 100 in Computer & Zubeh\u00f6r)  Nr. 1,740 in Monitore  Nr. 12,923 in Komponenten & Ersatzteile\nIm Angebot von Amazon.de seit: 31. Januar 2023",
    "reference_file": "offer_reference_296.json",
    "shop_name": "Amazon.at"
}