{
    "html_file": "offer_518_3.html",
    "name": "iiyama ProLite XUB2492HSU-B5, 23.8\"",
    "offer_link": "https://www.csv-direct.de/artinfo.php?artnr=A1621599&KATEGORIE=162&pva=geizhals2",
    "price": 149.99,
    "raw_specifications": {
        "AC Eingangsfrequenz": "50 - 60 Hz",
        "AC Eingangsspannung": "100 - 240 V",
        "AMD FreeSync": "Nein",
        "Anzahl DisplayPort Anschl\u00fcsse": "1",
        "Anzahl HDMI-Anschl\u00fcsse": "1",
        "Anzahl OSD-Sprachen": "10",
        "Anzahl VGA D-Sub Anschl\u00fcsse": "1",
        "Anzahl der Farben des Displays": "16,7 Millionen Farben",
        "Anzahl der Lautsprecher": "2",
        "Bildschirmdiagonale": "60,5 cm 23.8\"",
        "Bildschirmdiagonale cm": "60,5 cm",
        "Bildschirmform": "Flach",
        "Bildschirmtechnologie": "LED",
        "Bildwinkel, horizontal": "178\u00b0",
        "Bildwinkel, vertikal": "178\u00b0",
        "Breite ohne Standfu\u00df": "539,5 mm",
        "Display-Aufl\u00f6sung": "1920 x 1080 Pixel",
        "Display-Oberfl\u00e4che": "Matt",
        "Energieeffizienzklasse SDR": "D",
        "Energieeffizienzskala": "A bis G",
        "Energieverbrauch SDR pro 1.000 Stunden": "15 kWh",
        "Ger\u00e4tebreite inkl. Fu\u00df": "539,5 mm",
        "Ger\u00e4teh\u00f6he inkl. Fu\u00df": "373,5 mm",
        "Ger\u00e4tetiefe inkl. Fu\u00df": "209,5 mm",
        "HD-Typ": "Full HD",
        "Helligkeit typisch": "250 cd/m\u00b2",
        "Horizontaler Scanbereich": "30 - 86 kHz",
        "H\u00f6he ohne Standfu\u00df": "323,5 mm",
        "H\u00f6heneinstellung": "15 cm",
        "Integrierte Kamera": "Nein",
        "Kontrastverh\u00e4ltnis": "1000:1",
        "Kontrastverh\u00e4ltnis dynamisch": "80000000:1",
        "Kopfh\u00f6rerausg\u00e4nge": "1",
        "Maximale Bildwiederholrate": "75 Hz",
        "Men\u00fcsprachen": "Tschechisch, Deutsch, Niederl\u00e4ndisch, Englisch, Spanisch, Franz\u00f6sisch, Italienisch, Japanisch, Polnisch, Russisch",
        "Mitgelieferte Kabel": "AC, DisplayPort, HDMI, USB",
        "NTSC Abdeckung typisch": "72",
        "NVIDIA G-SYNC": "Nein",
        "Nachhaltigkeitszertifikate": "CE, ENERGY STAR, ErP, REACH, RoHS, TCO, UKCA, WEEE",
        "Natives Seitenverh\u00e4ltnis": "16:9",
        "Neigungswinkelbereich": "-5 - 23\u00b0",
        "Netzteiltyp": "Intern",
        "Paketgewicht": "6,7 kg",
        "Panel-Montage-Schnittstelle": "100 x 100 mm",
        "Panel-Typ": "IPS",
        "Pivot Winkel": "0 - 90\u00b0",
        "Pixel Abstand": "0,275 x 0,275 mm",
        "Produktfarbe": "Schwarz",
        "RMS-Leistung": "4 W",
        "Reaktionszeit": "4 ms",
        "Schwenkwinkelbereich": "-45 - 45\u00b0",
        "Seitenverh\u00e4ltnis": "16:9",
        "Sichtbare Gr\u00f6\u00dfe horizontal": "52,7 cm",
        "Sichtbare Gr\u00f6\u00dfe vertikal": "29,6 cm",
        "Slot-Typ Kabelsperre": "Kensington",
        "Stromverbrauch Standardbetrieb": "14,5 W",
        "Stromverbrauch Standby": "0,5 W",
        "Stromverbrauch aus": "0,3 W",
        "Tiefe ohne Standfu\u00df": "52,5 mm",
        "Touchscreen": "Nein",
        "USB-Hub-Version": "2.0",
        "Ursprungsland": "Japan",
        "Verpackungsart": "Box",
        "Verpackungsbreite": "620 mm",
        "Verpackungsh\u00f6he": "415 mm",
        "Verpackungstiefe": "162 mm",
        "Vorderer Rahmen": "Schwarz",
        "sRGB Abdeckung klassisch": "99"
    },
    "raw_specifications_text": "Bildschirmdiagonale: 60,5 cm 23.8\"\nDisplay-Aufl\u00f6sung: 1920 x 1080 Pixel\nNatives Seitenverh\u00e4ltnis: 16:9\nBildschirmtechnologie: LED\nTouchscreen: Nein\nHD-Typ: Full HD\nPanel-Typ: IPS\nBildschirmform: Flach\nKontrastverh\u00e4ltnis: 1000:1\nMaximale Bildwiederholrate: 75 Hz\nAnzahl der Farben des Displays: 16,7 Millionen Farben\nHelligkeit typisch: 250 cd/m\u00b2\nReaktionszeit: 4 ms\nDisplay-Oberfl\u00e4che: Matt\nSeitenverh\u00e4ltnis: 16:9\nKontrastverh\u00e4ltnis dynamisch: 80000000:1\nBildwinkel, horizontal: 178\u00b0\nBildwinkel, vertikal: 178\u00b0\nPixel Abstand: 0,275 x 0,275 mm\nHorizontaler Scanbereich: 30 - 86 kHz\nSichtbare Gr\u00f6\u00dfe horizontal: 52,7 cm\nSichtbare Gr\u00f6\u00dfe vertikal: 29,6 cm\nBildschirmdiagonale cm: 60,5 cm\nsRGB Abdeckung klassisch: 99\nNTSC Abdeckung typisch: 72\nNVIDIA G-SYNC: Nein\nAMD FreeSync: Nein\nIntegrierte Kamera: Nein\nAnzahl der Lautsprecher: 2\nRMS-Leistung: 4 W\nProduktfarbe: Schwarz\nVorderer Rahmen: Schwarz\nUrsprungsland: Japan\nUSB-Hub-Version: 2.0\nAnzahl VGA D-Sub Anschl\u00fcsse: 1\nAnzahl HDMI-Anschl\u00fcsse: 1\nAnzahl DisplayPort Anschl\u00fcsse: 1\nKopfh\u00f6rerausg\u00e4nge: 1\nPanel-Montage-Schnittstelle: 100 x 100 mm\nSlot-Typ Kabelsperre: Kensington\nH\u00f6heneinstellung: 15 cm\nPivot Winkel: 0 - 90\u00b0\nSchwenkwinkelbereich: -45 - 45\u00b0\nNeigungswinkelbereich: -5 - 23\u00b0\nMen\u00fcsprachen: Tschechisch, Deutsch, Niederl\u00e4ndisch, Englisch, Spanisch, Franz\u00f6sisch, Italienisch, Japanisch, Polnisch, Russisch\nAnzahl OSD-Sprachen: 10\nEnergieeffizienzklasse SDR: D\nEnergieverbrauch SDR pro 1.000 Stunden: 15 kWh\nStromverbrauch Standardbetrieb: 14,5 W\nStromverbrauch Standby: 0,5 W\nStromverbrauch aus: 0,3 W\nAC Eingangsspannung: 100 - 240 V\nAC Eingangsfrequenz: 50 - 60 Hz\nNetzteiltyp: Intern\nEnergieeffizienzskala: A bis G\nMitgelieferte Kabel: AC, DisplayPort, HDMI, USB\nGer\u00e4tebreite inkl. Fu\u00df: 539,5 mm\nGer\u00e4tetiefe inkl. Fu\u00df: 209,5 mm\nGer\u00e4teh\u00f6he inkl. Fu\u00df: 373,5 mm\nBreite ohne Standfu\u00df: 539,5 mm\nTiefe ohne Standfu\u00df: 52,5 mm\nH\u00f6he ohne Standfu\u00df: 323,5 mm\nVerpackungsbreite: 620 mm\nVerpackungstiefe: 162 mm\nVerpackungsh\u00f6he: 415 mm\nPaketgewicht: 6,7 kg\nVerpackungsart: Box\nNachhaltigkeitszertifikate: CE, ENERGY STAR, ErP, REACH, RoHS, TCO, UKCA, WEEE",
    "reference_file": "offer_reference_518.json",
    "shop_name": "CSV-Direct.de"
}