{
    "html_file": "offer_65_10.html",
    "name": "Acer Vero B7 B247YEbmiprzxv, 23.8\"",
    "offer_link": "https://www.proshop.at/Bildschirm/Acer-24-Bildschirm-Vero-B247Y-Ebmiprzxv-Black-4-ms/3196643?utm_source=geizhals&utm_medium=cpc&utm_campaign=pricesite",
    "price": 165.1,
    "raw_specifications": {
        "Abmessungen (Breite x Tiefe x H\u00f6he)": "54 cm x 19.3 cm x 49.9 cm - mit Fu\u00df",
        "Abmessungen (Breite x Tiefe x H\u00f6he) - mit Fu\u00df": "54 cm x 19.3 cm x 49.9 cm",
        "Besonderheiten": "Acer Adaptive Contrast Management (ACM), ComfyView, Flimmerfrei-Technologie, Abblend-Technologie, Adaptive-Sync-Technologie, Acer BluelightShield-Technologie",
        "Bildschirmbeschichtung": "Blendfrei",
        "Bildschirmtyp": "IPS",
        "Details zu Abmessungen & Gewicht": "Ohne Fu\u00df - Gewicht: 3.64 kg",
        "Diagonalabmessung": "61 cm (24\")",
        "Display-Typ": "LED-hintergrundbeleuchteter LCD-Monitor / TFT-Aktivmatrix",
        "EAN": "4711121587856",
        "Eingangsanschl\u00fcsse": "HDMI, VGA, DisplayPort",
        "Einstellungen der Anzeigeposition": "H\u00f6he, Pivot (Rotation), Drehung, Neigung",
        "Enthaltene Kabel": "1 x DisplayPort-Kabel  1 x SuperSpeed-USB-Kabel",
        "Farbe": "Schwarz",
        "Farbunterst\u00fctzung": "16,7 Millionen Farben",
        "Ger\u00e4tetyp": "LED-hintergrundbeleuchteter LCD-Monitor - 61 cm (24\")",
        "Gewicht": "5.59 kg",
        "Helligkeit": "250 cd/m\u00b2",
        "Hersteller": "Acer",
        "Hintergrundbeleuchtungs-Technologie": "LED-Hintergrundbeleuchtung",
        "Horizontaler Betrachtungswinkel": "178",
        "H\u00f6heneinstellung": "150 mm",
        "Integrierte Peripherieger\u00e4te": "USB 3.0-Hub",
        "Kontrast": "1000:1 / 100000000:1 (dynamisch)",
        "Leistungsmerkmale": "Unterst\u00fctzung f\u00fcr VESA-Schnittstelle",
        "Modell": "UM.QB7EE.E15",
        "Native Aufl\u00f6sung": "Full HD (1080p) 1920 x 1080 bei 100 Hz",
        "Neigungswinkel": "-5/+35",
        "Pixelpitch": "0.27 mm",
        "Produktbeschreibung": "Acer Vero B247Y Ebmiprzxv - B7 Series - LED-Monitor - Full HD (1080p) - 61 cm (24\")",
        "Reaktionszeit": "4 ms (gray-to-gray)",
        "Rotationswinkel": "180",
        "Schnittstellen": "VGA  DisplayPort 1.2  HDMI 1.4  Audio Line-Out  Audio Line-In  USB 3.0 Upstream (Typ B)  4 x USB 3.2 Downstream",
        "Schwenkwinkel": "90",
        "Seitenverh\u00e4ltnis": "16:9",
        "Sichtbare Bildfl\u00e4che": "60.5 cm (23.8\")",
        "Stromverbrauch (Aus-Modus)": "0.45 Watt",
        "Stromverbrauch (max.)": "47 Watt",
        "Stromverbrauch (typisch)": "16 Watt",
        "Stromverbrauch im Standby-Modus": "0.5 Watt",
        "Typ": "Lautsprecher",
        "Umweltschutzstandards": "TCO Certified Displays 9 EPEAT Silver",
        "VESA-Halterung": "100 x 100 mm",
        "Vertikaler Betrachtungswinkel": "178",
        "Waren-Nr.": "3196643",
        "Zum Hersteller": "www.acer.com"
    },
    "raw_specifications_text": "Hersteller: Acer\nWaren-Nr.: 3196643\nModell: UM.QB7EE.E15\nEAN: 4711121587856\nZum Hersteller: www.acer.com\nProduktbeschreibung: Acer Vero B247Y Ebmiprzxv - B7 Series - LED-Monitor - Full HD (1080p) - 61 cm (24\")\nGer\u00e4tetyp: LED-hintergrundbeleuchteter LCD-Monitor - 61 cm (24\")\nLeistungsmerkmale: Unterst\u00fctzung f\u00fcr VESA-Schnittstelle\nBildschirmtyp: IPS\nSeitenverh\u00e4ltnis: 16:9\nNative Aufl\u00f6sung: Full HD (1080p) 1920 x 1080 bei 100 Hz\nPixelpitch: 0.27 mm\nHelligkeit: 250 cd/m\u00b2\nKontrast: 1000:1 / 100000000:1 (dynamisch)\nReaktionszeit: 4 ms (gray-to-gray)\nFarbunterst\u00fctzung: 16,7 Millionen Farben\nEingangsanschl\u00fcsse: HDMI, VGA, DisplayPort\nEinstellungen der Anzeigeposition: H\u00f6he, Pivot (Rotation), Drehung, Neigung\nBildschirmbeschichtung: Blendfrei\nFarbe: Schwarz\nAbmessungen (Breite x Tiefe x H\u00f6he) - mit Fu\u00df: 54 cm x 19.3 cm x 49.9 cm\nGewicht: 5.59 kg\nUmweltschutzstandards: TCO Certified Displays 9 EPEAT Silver\nDisplay-Typ: LED-hintergrundbeleuchteter LCD-Monitor / TFT-Aktivmatrix\nDiagonalabmessung: 61 cm (24\")\nSichtbare Bildfl\u00e4che: 60.5 cm (23.8\")\nIntegrierte Peripherieger\u00e4te: USB 3.0-Hub\nHorizontaler Betrachtungswinkel: 178\nVertikaler Betrachtungswinkel: 178\nHintergrundbeleuchtungs-Technologie: LED-Hintergrundbeleuchtung\nBesonderheiten: Acer Adaptive Contrast Management (ACM), ComfyView, Flimmerfrei-Technologie, Abblend-Technologie, Adaptive-Sync-Technologie, Acer BluelightShield-Technologie\nAbmessungen (Breite x Tiefe x H\u00f6he): 54 cm x 19.3 cm x 49.9 cm - mit Fu\u00df\nTyp: Lautsprecher\nSchnittstellen: VGA  DisplayPort 1.2  HDMI 1.4  Audio Line-Out  Audio Line-In  USB 3.0 Upstream (Typ B)  4 x USB 3.2 Downstream\nNeigungswinkel: -5/+35\nSchwenkwinkel: 90\nRotationswinkel: 180\nH\u00f6heneinstellung: 150 mm\nVESA-Halterung: 100 x 100 mm\nEnthaltene Kabel: 1 x DisplayPort-Kabel  1 x SuperSpeed-USB-Kabel\nStromverbrauch (typisch): 16 Watt\nStromverbrauch (max.): 47 Watt\nStromverbrauch im Standby-Modus: 0.5 Watt\nStromverbrauch (Aus-Modus): 0.45 Watt\nDetails zu Abmessungen & Gewicht: Ohne Fu\u00df - Gewicht: 3.64 kg",
    "reference_file": "offer_reference_65.json",
    "shop_name": "Proshop.at"
}