{
    "html_file": "offer_1740_13.html",
    "name": "ASUS VA27AQSB, 27\"",
    "offer_link": "https://www.e-tec.at/details.php?artnr=309116",
    "price": 255.1,
    "raw_specifications": {
        "AMD FreeSync": "Ja",
        "Abmessungen (BxHxT)": "614x367x226mm (mit Standfu\u00df),  614x366x52mm (ohne Standfu\u00df)",
        "Adaptive Sync": "Ja",
        "Anschl\u00fcsse - DisplayPort 1.2": "1",
        "Anschl\u00fcsse - HDMI 1.4": "1",
        "Anwendung": "station\u00e4r",
        "Audio": "Lautsprecher (2x 2W),  1x Line-Out",
        "Aufl\u00f6sung": "2560x1440",
        "Beschichtung": "matt (non-glare)",
        "Besonderheiten": "Slim Bezel,  mechanische Tasten,  Sicherheitsschloss (Kensington)",
        "Bildwiederholfrequenz": "75Hz",
        "Blickwinkel": "178\u00b0/178\u00b0",
        "Diagonale": "27\"/68.6cm",
        "Energieverbrauch SDR": "24kWh/1000h",
        "Ergonomie": "150mm (h\u00f6henverstellbar),  \u00b190\u00b0 (Pivot),  \u00b1180\u00b0 (drehbar),  +35\u00b0/-5\u00b0 (neigbar),  keine Angabe (Schr\u00e4glage)",
        "FRC": "unbekannt",
        "Farbe": "schwarz",
        "Farbtiefe": "8bit (16.7 Mio. Farben)",
        "Form": "gerade (flat)",
        "Gewicht": "6.69kg (mit Standfu\u00df),  4.41kg (ohne Standfu\u00df)",
        "HDR": "N/A",
        "Helligkeit": "350cd/m\u00b2",
        "Herstellergarantie": "drei Jahre",
        "Hintergrundbeleuchtung": "White-LED,  flicker-free,  Blaulichtfilter",
        "Kontrast - dynamisch": "100.000.000:1",
        "Kontrast - statisch": "1.000:1",
        "Lautsprecher": "Ja",
        "Leistungsaufnahme": "keine Angabe (maximal),  40W (typisch),  keine Angabe (Energielabel alt A+++ bis G),  0.5W (Standby)",
        "Panel": "IPS",
        "Reaktionszeit - GtG": "5ms",
        "Reaktionszeit - MPRT": "1ms",
        "Screen-to-Body-Ratio": "89.4% (berechnet)",
        "Seitenverh\u00e4ltnis": "16:9",
        "Signalfrequenz": "85-85kHz (horizontal),  48-75Hz (vertikal)",
        "Stromversorgung": "AC-In (internes Netzteil)",
        "USB-Hub In": "1x USB-B 2.0",
        "USB-Hub Out": "2x USB-A 2.0",
        "USB-Schreibweise": "Link",
        "VESA": "100x100 (belegt)",
        "VRR (Variable Refresh Rate)": "Adaptive Sync,  AMD FreeSync (48-75Hz via DisplayPort,  48-75Hz via HDMI)",
        "Weitere Anschl\u00fcsse": "N/A"
    },
    "raw_specifications_text": "Abmessungen (BxHxT): 614x367x226mm (mit Standfu\u00df),  614x366x52mm (ohne Standfu\u00df)\nAdaptive Sync: Ja\nAMD FreeSync: Ja\nAnschl\u00fcsse - DisplayPort 1.2: 1\nAnschl\u00fcsse - HDMI 1.4: 1\nAnwendung: station\u00e4r\nAudio: Lautsprecher (2x 2W),  1x Line-Out\nAufl\u00f6sung: 2560x1440\nBeschichtung: matt (non-glare)\nBesonderheiten: Slim Bezel,  mechanische Tasten,  Sicherheitsschloss (Kensington)\nBildwiederholfrequenz: 75Hz\nBlickwinkel: 178\u00b0/178\u00b0\nDiagonale: 27\"/68.6cm\nEnergieverbrauch SDR: 24kWh/1000h\nErgonomie: 150mm (h\u00f6henverstellbar),  \u00b190\u00b0 (Pivot),  \u00b1180\u00b0 (drehbar),  +35\u00b0/-5\u00b0 (neigbar),  keine Angabe (Schr\u00e4glage)\nFarbe: schwarz\nFarbtiefe: 8bit (16.7 Mio. Farben)\nForm: gerade (flat)\nFRC: unbekannt\nGewicht: 6.69kg (mit Standfu\u00df),  4.41kg (ohne Standfu\u00df)\nHDR: N/A\nHelligkeit: 350cd/m\u00b2\nHerstellergarantie: drei Jahre\nHintergrundbeleuchtung: White-LED,  flicker-free,  Blaulichtfilter\nKontrast - dynamisch: 100.000.000:1\nKontrast - statisch: 1.000:1\nLautsprecher: Ja\nLeistungsaufnahme: keine Angabe (maximal),  40W (typisch),  keine Angabe (Energielabel alt A+++ bis G),  0.5W (Standby)\nPanel: IPS\nReaktionszeit - GtG: 5ms\nReaktionszeit - MPRT: 1ms\nScreen-to-Body-Ratio: 89.4% (berechnet)\nSeitenverh\u00e4ltnis: 16:9\nSignalfrequenz: 85-85kHz (horizontal),  48-75Hz (vertikal)\nStromversorgung: AC-In (internes Netzteil)\nUSB-Hub In: 1x USB-B 2.0\nUSB-Hub Out: 2x USB-A 2.0\nUSB-Schreibweise: Link\nVESA: 100x100 (belegt)\nVRR (Variable Refresh Rate): Adaptive Sync,  AMD FreeSync (48-75Hz via DisplayPort,  48-75Hz via HDMI)\nWeitere Anschl\u00fcsse: N/A",
    "reference_file": "offer_reference_1740.json",
    "shop_name": "e-tec.at"
}