{
    "html_file": "offer_386_7.html",
    "name": "ASUS ProArt PA279CRV, 27\"",
    "offer_link": "https://www.csv-direct.de/artinfo.php?artnr=A1621521&KATEGORIE=162&pva=geizhals2",
    "price": 596.97,
    "raw_specifications": {
        "AC Eingangsfrequenz": "50 - 60 Hz",
        "AC Eingangsspannung": "100 - 240 V",
        "Adobe RGB-Abdeckung": "99",
        "Anzahl DisplayPort Anschl\u00fcsse": "2",
        "Anzahl HDMI-Anschl\u00fcsse": "2",
        "Anzahl der Farben des Displays": "1,073 Milliarden Farben",
        "Anzahl der Lautsprecher": "2",
        "Anzahl der Upstream-Ports USB Typ-C": "1",
        "Anzahl der nachgeschalteten Steckpl\u00e4tze vom Typ USB-A": "3",
        "Bildschirmdiagonale": "68,6 cm 27\"",
        "Bildschirmform": "Flach",
        "Bildschirmtechnologie": "LCD",
        "Bildwinkel, horizontal": "178\u00b0",
        "Bildwinkel, vertikal": "178\u00b0",
        "Breite ohne Standfu\u00df": "612,2 mm",
        "Digital horizontale Frequenz": "15 - 135 kHz",
        "Digital vertikale Frequenz": "48 - 60 Hz",
        "Display-Aufl\u00f6sung": "3840 x 2160 Pixel",
        "Display-Oberfl\u00e4che": "Matt",
        "DisplayPorts-Version": "1.4",
        "Energieeffizienzklasse HDR": "G",
        "Energieeffizienzklasse SDR": "E",
        "Energieeffizienzskala": "A bis G",
        "Energieverbrauch HDR pro 1.000 Stunden": "34 kWh",
        "Energieverbrauch SDR pro 1.000 Stunden": "22 kWh",
        "Farbskala": "99",
        "Fu\u00dffarbe": "Silber",
        "Ger\u00e4tebreite inkl. Fu\u00df": "612,2 mm",
        "Ger\u00e4teh\u00f6he inkl. Fu\u00df": "538,1 mm",
        "Ger\u00e4tetiefe inkl. Fu\u00df": "215 mm",
        "Gewicht mit St\u00e4nder": "5,78 kg",
        "Gewicht ohne St\u00e4nder": "4,07 kg",
        "HD-Typ": "4K Ultra HD",
        "HDCP-Version": "2.2",
        "HDMI-Version": "2.0",
        "Helligkeit peak": "400 cd/m\u00b2",
        "Helligkeit typisch": "350 cd/m\u00b2",
        "H\u00f6he ohne Standfu\u00df": "362,9 mm",
        "H\u00f6heneinstellung": "13 cm",
        "Integrierte Kamera": "Nein",
        "Kontrastverh\u00e4ltnis": "1000:1",
        "Kontrastverh\u00e4ltnis dynamisch": "3000:1",
        "Kopfh\u00f6rerausg\u00e4nge": "1",
        "Marktpositionierung": "Grafikdesign",
        "Maximale Bildwiederholrate": "60 Hz",
        "Natives Seitenverh\u00e4ltnis": "16:9",
        "Neigungswinkelbereich": "-5 - 23\u00b0",
        "Paketgewicht": "8,69 kg",
        "Panel-Montage-Schnittstelle": "100 x 100 mm",
        "Panel-Typ": "IPS",
        "Pivot Winkel": "-90 - 90\u00b0",
        "Pixel Abstand": "0,155 x 0,155 mm",
        "Pixeldichte": "163 ppi",
        "Produktfarbe": "Schwarz",
        "RGB-Farbraum": "DCI-P3",
        "RMS-Leistung": "4 W",
        "Reaktionszeit": "5 ms",
        "Schwenkwinkelbereich": "-30 - 30\u00b0",
        "Sichtbare Gr\u00f6\u00dfe horizontal": "59,7 cm",
        "Sichtbare Gr\u00f6\u00dfe vertikal": "33,6 cm",
        "Slot-Typ Kabelsperre": "Kensington",
        "Stromverbrauch PowerSave": "0,5 W",
        "Stromverbrauch Standardbetrieb": "26,14 W",
        "Technologie mit hohem Dynamikbereich HDR": "DisplayHDR 400, High Dynamic Range 10 HDR10",
        "Tiefe ohne Standfu\u00df": "44,1 mm",
        "Touchscreen": "Nein",
        "Typ der Hintergrundbeleuchtung": "LED",
        "USB-Hub-Version": "3.2 Gen 1 3.1 Gen 1",
        "USB-Stromversorgung bis zu": "96 W",
        "Verpackungsart": "Box",
        "Verpackungsbreite": "691 mm",
        "Verpackungsh\u00f6he": "427 mm",
        "Verpackungstiefe": "138 mm",
        "sRGB Abdeckung klassisch": "100"
    },
    "raw_specifications_text": "Bildschirmdiagonale: 68,6 cm 27\"\nDisplay-Aufl\u00f6sung: 3840 x 2160 Pixel\nNatives Seitenverh\u00e4ltnis: 16:9\nBildschirmtechnologie: LCD\nTouchscreen: Nein\nHD-Typ: 4K Ultra HD\nPanel-Typ: IPS\nBildschirmform: Flach\nKontrastverh\u00e4ltnis: 1000:1\nMaximale Bildwiederholrate: 60 Hz\nAnzahl der Farben des Displays: 1,073 Milliarden Farben\nTyp der Hintergrundbeleuchtung: LED\nHelligkeit peak: 400 cd/m\u00b2\nHelligkeit typisch: 350 cd/m\u00b2\nReaktionszeit: 5 ms\nDisplay-Oberfl\u00e4che: Matt\nKontrastverh\u00e4ltnis dynamisch: 3000:1\nBildwinkel, horizontal: 178\u00b0\nBildwinkel, vertikal: 178\u00b0\nPixel Abstand: 0,155 x 0,155 mm\nPixeldichte: 163 ppi\nSichtbare Gr\u00f6\u00dfe horizontal: 59,7 cm\nSichtbare Gr\u00f6\u00dfe vertikal: 33,6 cm\nDigital horizontale Frequenz: 15 - 135 kHz\nDigital vertikale Frequenz: 48 - 60 Hz\nTechnologie mit hohem Dynamikbereich HDR: DisplayHDR 400, High Dynamic Range 10 HDR10\nRGB-Farbraum: DCI-P3\nFarbskala: 99\nsRGB Abdeckung klassisch: 100\nAdobe RGB-Abdeckung: 99\nIntegrierte Kamera: Nein\nAnzahl der Lautsprecher: 2\nRMS-Leistung: 4 W\nMarktpositionierung: Grafikdesign\nProduktfarbe: Schwarz\nFu\u00dffarbe: Silber\nUSB-Hub-Version: 3.2 Gen 1 3.1 Gen 1\nAnzahl der Upstream-Ports USB Typ-C: 1\nAnzahl der nachgeschalteten Steckpl\u00e4tze vom Typ USB-A: 3\nUSB-Stromversorgung bis zu: 96 W\nAnzahl HDMI-Anschl\u00fcsse: 2\nHDMI-Version: 2.0\nAnzahl DisplayPort Anschl\u00fcsse: 2\nDisplayPorts-Version: 1.4\nKopfh\u00f6rerausg\u00e4nge: 1\nHDCP-Version: 2.2\nPanel-Montage-Schnittstelle: 100 x 100 mm\nSlot-Typ Kabelsperre: Kensington\nH\u00f6heneinstellung: 13 cm\nPivot Winkel: -90 - 90\u00b0\nSchwenkwinkelbereich: -30 - 30\u00b0\nNeigungswinkelbereich: -5 - 23\u00b0\nEnergieeffizienzklasse SDR: E\nEnergieeffizienzklasse HDR: G\nEnergieverbrauch SDR pro 1.000 Stunden: 22 kWh\nEnergieverbrauch HDR pro 1.000 Stunden: 34 kWh\nStromverbrauch Standardbetrieb: 26,14 W\nStromverbrauch PowerSave: 0,5 W\nAC Eingangsspannung: 100 - 240 V\nAC Eingangsfrequenz: 50 - 60 Hz\nEnergieeffizienzskala: A bis G\nGer\u00e4tebreite inkl. Fu\u00df: 612,2 mm\nGer\u00e4tetiefe inkl. Fu\u00df: 215 mm\nGer\u00e4teh\u00f6he inkl. Fu\u00df: 538,1 mm\nGewicht mit St\u00e4nder: 5,78 kg\nBreite ohne Standfu\u00df: 612,2 mm\nTiefe ohne Standfu\u00df: 44,1 mm\nH\u00f6he ohne Standfu\u00df: 362,9 mm\nGewicht ohne St\u00e4nder: 4,07 kg\nVerpackungsbreite: 691 mm\nVerpackungstiefe: 138 mm\nVerpackungsh\u00f6he: 427 mm\nPaketgewicht: 8,69 kg\nVerpackungsart: Box",
    "reference_file": "offer_reference_386.json",
    "shop_name": "CSV-Direct.de"
}