{
    "html_file": "offer_2012_43.html",
    "name": "Lenovo ThinkVision T25d-10, 25\"",
    "offer_link": "https://www.alternate.at/Lenovo/ThinkVision-T25d-10-LED-Monitor/html/product/1612345?partner=AtGeizhalsat&campaign=Monitor/Lenovo/1612345",
    "price": 292.0,
    "raw_specifications": {
        "": "Netzteil",
        "Abmessungen": "Breite: 54,87 cm x H\u00f6he: 50,95 cm x Tiefe/L\u00e4nge: 26,04 cm",
        "Anschl\u00fcsse": "1x HDMI-Eingang, (HDMI-Version: 1.4), 1x DisplayPort-Eingang, (DisplayPort-Version: 1.2), 1x VGA-Eingang, 1x 3,5-mm-Audio-Ausgang, 5x USB-A-3.2 Gen 1 (5 Gbit/s)",
        "Bild": "Glaretyp",
        "Bildschirmaufl\u00f6sung": "1.920 x 1.200 Pixel",
        "Bildschirmdiagonale": "63,5 cm (25 Zoll)",
        "EAN": "0193268784048",
        "Energieeffizienzklasse (SDR)": "D (A - G)",
        "Energieverbauch pro 1000 Stunden (SDR)": "16 kWh",
        "Ergonomie": "Typ",
        "Farbe": "schwarz",
        "Features": "Kensington-Schloss",
        "Gewicht": "5,5 kg",
        "Hersteller-Nr.": "61DBMAT1EU",
        "Leistungsaufnahme im Bereitschafts- und Aus-Zustand": "0,3 Watt",
        "Leistungsaufnahme im Ein-Zustand bei Standard-Dynamikumfang (SDR)": "15,8 Watt",
        "Rahmen": "Breite",
        "Serie": "ThinkVision",
        "Standards": "Video",
        "Stromversorgung": "Eco-Off",
        "Typ": "LED-Monitor",
        "Wandhalterung": "VESA kompatibel (100 x 100 mm)",
        "Zubeh\u00f6r": "Optional"
    },
    "raw_specifications_text": "Energieeffizienzklasse (SDR): D (A - G)\nEnergieverbauch pro 1000 Stunden (SDR): 16 kWh\nLeistungsaufnahme im Ein-Zustand bei Standard-Dynamikumfang (SDR): 15,8 Watt\nLeistungsaufnahme im Bereitschafts- und Aus-Zustand: 0,3 Watt\nBildschirmdiagonale: 63,5 cm (25 Zoll)\nBildschirmaufl\u00f6sung: 1.920 x 1.200 Pixel\nTyp: LED-Monitor\nFarbe: schwarz\nEAN: 0193268784048\nHersteller-Nr.: 61DBMAT1EU\nSerie: ThinkVision\nBild: Glaretyp\n: Netzteil\nRahmen: Breite\nAnschl\u00fcsse: 1x HDMI-Eingang, (HDMI-Version: 1.4), 1x DisplayPort-Eingang, (DisplayPort-Version: 1.2), 1x VGA-Eingang, 1x 3,5-mm-Audio-Ausgang, 5x USB-A-3.2 Gen 1 (5 Gbit/s)\nErgonomie: Typ\nStromversorgung: Eco-Off\nStandards: Video\nWandhalterung: VESA kompatibel (100 x 100 mm)\nFeatures: Kensington-Schloss\nZubeh\u00f6r: Optional\nAbmessungen: Breite: 54,87 cm x H\u00f6he: 50,95 cm x Tiefe/L\u00e4nge: 26,04 cm\nGewicht: 5,5 kg",
    "reference_file": "offer_reference_2012.json",
    "shop_name": "Alternate.at"
}