{
    "html_file": "offer_257_0.html",
    "name": "iiyama ProLite XUB2893UHSU-B5, 28\"",
    "offer_link": "https://www.ba-computer.at/iiyama-prolite-xub2893uhsu-b5-led-monitor-71-cm-28-xub2893uhsu-b5.html",
    "price": 313.55,
    "raw_specifications": {
        "Abmessungen (Breite x Tiefe x H\u00f6he)": "63.65 cm x 20.95 cm x 39.65 cm - mit Fu\u00df",
        "Adaptive-Sync Technologie": "AMD FreeSync",
        "Ausgangsleistung/Kanal": "2 Watt",
        "Besonderheiten": "HDCP, Advanced Contrast Ratio (ACR), flimmerfreie Technologie, Reduzierung des blauen Lichtanteils, i-Style Color, an 3 Seiten ohne Blende, 8-bit + FRC Farbtiefe, kompatibel mit Mac",
        "Bildschirmbeschichtung": "Matt, Haze 25 %",
        "Bildschirmtyp": "IPS",
        "Details zu Abmessungen & Gewicht": "Mit Fu\u00df - Breite: 63.65 cm - Tiefe: 20.95 cm - H\u00f6he: 39.65 cm - Gewicht: 6.9 kg \u00a6 Ohne Fu\u00df - Breite: 63.65 cm - Tiefe: 5.5 cm - H\u00f6he: 36.85 cm",
        "Diagonalabmessung": "71 cm (28\")",
        "Display-Typ": "LED-hintergrundbeleuchteter LCD-Monitor / TFT-Aktivmatrix",
        "ENERGY STAR zertifiziert": "Ja",
        "Eingangsspannung": "Wechselstrom 100-240 V (50/60 Hz)",
        "Einstellungen der Anzeigeposition": "H\u00f6he, Pivot (Rotation), Drehung, Neigung",
        "Energie Effizienzklasse": "Klasse F",
        "Enthaltene Kabel": "1 x DisplayPort-Kabel \u00a6 1 x HDMI-Kabel \u00a6 1 x USB-Kabel",
        "Farbe": "Mattschwarz",
        "Farbraum": "100% sRGB, 85% NTSC",
        "Farbunterst\u00fctzung": "1,07 Mrd. Farben",
        "Gewicht": "6.9 kg",
        "Helligkeit": "300 cd/m\u00b2",
        "Hintergrundbeleuchtungs-Technologie": "LED-Hintergrundbeleuchtung",
        "Horizontale Bildwiederholrate": "31 - 135 kHz",
        "Horizontaler Betrachtungswinkel": "+89 / -89",
        "H\u00f6heneinstellung": "150 mm",
        "Integrierte Peripherieger\u00e4te": "USB 3.0-Hub",
        "Kennzeichnung": "Plug and Play, VCCI, RoHS, WEEE, PSE Mark, REACH, TUV Bauart, ERP, DDC-2B/CI, EAC, REACH SvHC, UKCA",
        "Kontrast": "1000:1 / 80000000:1 (dynamisch)",
        "Leistungsmerkmale": "Slot f\u00fcr Sicherheitsschloss (Kabelschloss getrennt erh\u00e4ltlich), Kabelmanagementsystem",
        "Native Aufl\u00f6sung": "4K 3840 x 2160 bei 60 Hz",
        "Neigungswinkel": "-5/+23",
        "OSD-Sprachen": "Tschechisch, Englisch, Deutsch, Franz\u00f6sisch, Italienisch, Polnisch, Russisch, Spanisch, Holl\u00e4ndisch, Japanisch",
        "Pixelpitch": "0.16 mm",
        "Reaktionszeit": "3 ms (grau-zu-grau)",
        "Rotationswinkel": "90",
        "Schlosstyp zur Diebstahlsicherung": "Kensington Slot",
        "Schnittstellen": "HDMI \u00a6 DisplayPort \u00a6 Kopfh\u00f6rer \u00a6 USB 3.0 Upstream \u00a6 USB 3.0 Downstream \u00a6 2 x USB 2.0",
        "Schwenkwinkel": "90",
        "Seitenverh\u00e4ltnis": "16:9",
        "Stromverbrauch (Aus-Modus)": "0.3 Watt",
        "Stromverbrauch (typisch)": "39.5 Watt",
        "Stromverbrauch SDR (eingeschaltet)": "27 kWh/1.000 h",
        "Stromverbrauch im Standby-Modus": "0.5 Watt",
        "Transportbreite": "72.3 cm",
        "Transportgewicht": "8.9 kg",
        "Transporth\u00f6he": "43.6 cm",
        "Transporttiefe": "16.3 cm",
        "Typ": "Lautsprecher - Stereo",
        "VESA-Halterung": "100 x 100 mm, VESA",
        "Vertikaler Betrachtungswinkel": "+89 / -89"
    },
    "raw_specifications_text": "Display-Typ: LED-hintergrundbeleuchteter LCD-Monitor / TFT-Aktivmatrix\nEnergie Effizienzklasse: Klasse F\nDiagonalabmessung: 71 cm (28\")\nAdaptive-Sync Technologie: AMD FreeSync\nIntegrierte Peripherieger\u00e4te: USB 3.0-Hub\nBildschirmtyp: IPS\nSeitenverh\u00e4ltnis: 16:9\nNative Aufl\u00f6sung: 4K 3840 x 2160 bei 60 Hz\nPixelpitch: 0.16 mm\nHelligkeit: 300 cd/m\u00b2\nKontrast: 1000:1 / 80000000:1 (dynamisch)\nFarbunterst\u00fctzung: 1,07 Mrd. Farben\nFarbraum: 100% sRGB, 85% NTSC\nReaktionszeit: 3 ms (grau-zu-grau)\nHorizontale Bildwiederholrate: 31 - 135 kHz\nHorizontaler Betrachtungswinkel: +89 / -89\nVertikaler Betrachtungswinkel: +89 / -89\nBildschirmbeschichtung: Matt, Haze 25 %\nHintergrundbeleuchtungs-Technologie: LED-Hintergrundbeleuchtung\nOSD-Sprachen: Tschechisch, Englisch, Deutsch, Franz\u00f6sisch, Italienisch, Polnisch, Russisch, Spanisch, Holl\u00e4ndisch, Japanisch\nBesonderheiten: HDCP, Advanced Contrast Ratio (ACR), flimmerfreie Technologie, Reduzierung des blauen Lichtanteils, i-Style Color, an 3 Seiten ohne Blende, 8-bit + FRC Farbtiefe, kompatibel mit Mac\nFarbe: Mattschwarz\nAbmessungen (Breite x Tiefe x H\u00f6he): 63.65 cm x 20.95 cm x 39.65 cm - mit Fu\u00df\nGewicht: 6.9 kg\nTyp: Lautsprecher - Stereo\nAusgangsleistung/Kanal: 2 Watt\nSchnittstellen: HDMI \u00a6 DisplayPort \u00a6 Kopfh\u00f6rer \u00a6 USB 3.0 Upstream \u00a6 USB 3.0 Downstream \u00a6 2 x USB 2.0\nEinstellungen der Anzeigeposition: H\u00f6he, Pivot (Rotation), Drehung, Neigung\nNeigungswinkel: -5/+23\nSchwenkwinkel: 90\nRotationswinkel: 90\nH\u00f6heneinstellung: 150 mm\nVESA-Halterung: 100 x 100 mm, VESA\nLeistungsmerkmale: Slot f\u00fcr Sicherheitsschloss (Kabelschloss getrennt erh\u00e4ltlich), Kabelmanagementsystem\nEnthaltene Kabel: 1 x DisplayPort-Kabel \u00a6 1 x HDMI-Kabel \u00a6 1 x USB-Kabel\nKennzeichnung: Plug and Play, VCCI, RoHS, WEEE, PSE Mark, REACH, TUV Bauart, ERP, DDC-2B/CI, EAC, REACH SvHC, UKCA\nSchlosstyp zur Diebstahlsicherung: Kensington Slot\nEingangsspannung: Wechselstrom 100-240 V (50/60 Hz)\nStromverbrauch SDR (eingeschaltet): 27 kWh/1.000 h\nStromverbrauch (typisch): 39.5 Watt\nStromverbrauch im Standby-Modus: 0.5 Watt\nStromverbrauch (Aus-Modus): 0.3 Watt\nDetails zu Abmessungen & Gewicht: Mit Fu\u00df - Breite: 63.65 cm - Tiefe: 20.95 cm - H\u00f6he: 39.65 cm - Gewicht: 6.9 kg \u00a6 Ohne Fu\u00df - Breite: 63.65 cm - Tiefe: 5.5 cm - H\u00f6he: 36.85 cm\nTransportbreite: 72.3 cm\nTransporttiefe: 16.3 cm\nTransporth\u00f6he: 43.6 cm\nTransportgewicht: 8.9 kg\nENERGY STAR zertifiziert: Ja",
    "reference_file": "offer_reference_257.json",
    "shop_name": "BA-Computer"
}