{
    "html_file": "offer_187_20.html",
    "name": "iiyama G-Master GCB3280QSU-B1 Red Eagle, 31.5\"",
    "offer_link": "https://www.ditech.at/details.php?artnr=370936",
    "price": 338.9,
    "raw_specifications": {
        "AMD FreeSync": "Ja",
        "Adaptive Sync": "Ja",
        "Anschl\u00fcsse - DisplayPort 165Hz@2560x1440": "1",
        "Anschl\u00fcsse - HDMI 144Hz@2560x1440": "2",
        "Anwendung": "station\u00e4r",
        "Audio": "Lautsprecher (2x 2W),  1x Line-Out",
        "Aufl\u00f6sung": "2560x1440",
        "Beschichtung": "matt (non-glare)",
        "Besonderheiten": "Slim Bezel,  mechanische Tasten mit Steuerkreuz,  Sicherheitsschloss (Kensington)",
        "Bildwiederholfrequenz": "165Hz",
        "Blickwinkel": "178\u00b0/178\u00b0",
        "Diagonale": "31.5\"/80cm",
        "Energieeffizienzklasse HDR (A bis G)": "G",
        "Energieverbrauch HDR": "53kWh/1000h",
        "Energieverbrauch SDR": "29kWh/1000h",
        "Ergonomie": "150mm (h\u00f6henverstellbar),  N/A (Pivot),  \u00b145\u00b0 (drehbar),  +23\u00b0/-5\u00b0 (neigbar),  keine Angabe (Schr\u00e4glage)",
        "FRC": "unbekannt",
        "Farbe": "schwarz",
        "Farbtiefe": "8bit (16.7 Mio. Farben)",
        "Form": "gebogen (curved),  1500R/1.5m",
        "Gewicht": "9.00kg (mit Standfu\u00df),  keine Angabe (ohne Standfu\u00df)",
        "Helligkeit": "350cd/m\u00b2",
        "Herstellergarantie": "drei Jahre (Abwicklung \u00fcber Hersteller,  Produktregistrierung innerhalb von 60 Tagen nach dem Kauf: Link,  Garantie-Informationen: Link)",
        "Hintergrundbeleuchtung": "White-LED,  flicker-free,  Blaulichtfilter",
        "Kontrast - dynamisch": "80.000.000:1",
        "Kontrast - statisch": "3.000:1",
        "Lautsprecher": "Ja",
        "Leistungsaufnahme": "keine Angabe (maximal),  40W (typisch),  keine Angabe (Energielabel alt A+++ bis G),  0.5W (Standby)",
        "Panel": "VA",
        "Reaktionszeit - MPRT": "0.2ms",
        "Screen-to-Body-Ratio": "90.5% (berechnet)",
        "Seitenverh\u00e4ltnis": "16:9",
        "Signalfrequenz": "30-245kHz (horizontal),  48-165Hz (vertikal)",
        "Stromversorgung": "AC-In (internes Netzteil)",
        "USB-Hub In": "1x USB-B 3.0",
        "USB-Hub Out": "2x USB-A 3.0",
        "USB-Schreibweise": "Link",
        "VESA": "100x100 (belegt)",
        "Weitere Anschl\u00fcsse": "N/A"
    },
    "raw_specifications_text": "Adaptive Sync: Ja\nAMD FreeSync: Ja\nAnschl\u00fcsse - DisplayPort 165Hz@2560x1440: 1\nAnschl\u00fcsse - HDMI 144Hz@2560x1440: 2\nAnwendung: station\u00e4r\nAudio: Lautsprecher (2x 2W),  1x Line-Out\nAufl\u00f6sung: 2560x1440\nBeschichtung: matt (non-glare)\nBesonderheiten: Slim Bezel,  mechanische Tasten mit Steuerkreuz,  Sicherheitsschloss (Kensington)\nBildwiederholfrequenz: 165Hz\nBlickwinkel: 178\u00b0/178\u00b0\nDiagonale: 31.5\"/80cm\nEnergieeffizienzklasse HDR (A bis G): G\nEnergieverbrauch HDR: 53kWh/1000h\nEnergieverbrauch SDR: 29kWh/1000h\nErgonomie: 150mm (h\u00f6henverstellbar),  N/A (Pivot),  \u00b145\u00b0 (drehbar),  +23\u00b0/-5\u00b0 (neigbar),  keine Angabe (Schr\u00e4glage)\nFarbe: schwarz\nFarbtiefe: 8bit (16.7 Mio. Farben)\nForm: gebogen (curved),  1500R/1.5m\nFRC: unbekannt\nGewicht: 9.00kg (mit Standfu\u00df),  keine Angabe (ohne Standfu\u00df)\nHelligkeit: 350cd/m\u00b2\nHerstellergarantie: drei Jahre (Abwicklung \u00fcber Hersteller,  Produktregistrierung innerhalb von 60 Tagen nach dem Kauf: Link,  Garantie-Informationen: Link)\nHintergrundbeleuchtung: White-LED,  flicker-free,  Blaulichtfilter\nKontrast - dynamisch: 80.000.000:1\nKontrast - statisch: 3.000:1\nLautsprecher: Ja\nLeistungsaufnahme: keine Angabe (maximal),  40W (typisch),  keine Angabe (Energielabel alt A+++ bis G),  0.5W (Standby)\nPanel: VA\nReaktionszeit - MPRT: 0.2ms\nScreen-to-Body-Ratio: 90.5% (berechnet)\nSeitenverh\u00e4ltnis: 16:9\nSignalfrequenz: 30-245kHz (horizontal),  48-165Hz (vertikal)\nStromversorgung: AC-In (internes Netzteil)\nUSB-Hub In: 1x USB-B 3.0\nUSB-Hub Out: 2x USB-A 3.0\nUSB-Schreibweise: Link\nVESA: 100x100 (belegt)\nWeitere Anschl\u00fcsse: N/A",
    "reference_file": "offer_reference_187.json",
    "shop_name": "DiTech.at"
}