{
    "html_file": "offer_1647_0.html",
    "name": "ASUS ProArt PA247CV, 23.8\"",
    "offer_link": "https://www.csv-direct.de/artinfo.php?artnr=A1621258&KATEGORIE=162&pva=geizhals2",
    "price": 252.07,
    "raw_specifications": {
        "AC Eingangsfrequenz": "50 - 60 Hz",
        "AC Eingangsspannung": "100 - 240 V",
        "AMD FreeSync": "Nein",
        "Anzahl DisplayPort Anschl\u00fcsse": "2",
        "Anzahl HDMI-Anschl\u00fcsse": "1",
        "Anzahl der Farben des Displays": "16,78 Millionen Farben",
        "Anzahl der Lautsprecher": "2",
        "Bildschirmdiagonale": "60,5 cm 23.8\"",
        "Bildschirmform": "Flach",
        "Bildschirmtechnologie": "LED",
        "Bildwinkel, horizontal": "178\u00b0",
        "Bildwinkel, vertikal": "178\u00b0",
        "Breite ohne Standfu\u00df": "539,7 mm",
        "DVI Anschluss": "Nein",
        "Display-Aufl\u00f6sung": "1920 x 1080 Pixel",
        "Display-Oberfl\u00e4che": "Matt",
        "DisplayPorts-Version": "1.2",
        "Energieeffizienzklasse SDR": "F",
        "Energieeffizienzskala": "A bis G",
        "Energieverbrauch SDR pro 1.000 Stunden": "22 kWh",
        "Ger\u00e4tebreite inkl. Fu\u00df": "539,7 mm",
        "Ger\u00e4teh\u00f6he inkl. Fu\u00df": "471,8 mm",
        "Ger\u00e4tetiefe inkl. Fu\u00df": "211,4 mm",
        "Gewicht mit St\u00e4nder": "6,3 kg",
        "Gewicht ohne St\u00e4nder": "4,2 kg",
        "HD-Typ": "Full HD",
        "HDMI-Version": "1.4",
        "Helligkeit typisch": "300 cd/m\u00b2",
        "H\u00f6he ohne Standfu\u00df": "329,9 mm",
        "H\u00f6heneinstellung": "13 cm",
        "Integrierte Kamera": "Nein",
        "Kontrastverh\u00e4ltnis": "1000:1",
        "Marktpositionierung": "Grafikdesign",
        "Maximale Bildwiederholrate": "75 Hz",
        "NVIDIA G-SYNC": "Nein",
        "Natives Seitenverh\u00e4ltnis": "16:9",
        "Neigungswinkelbereich": "-5 - 35\u00b0",
        "Paketgewicht": "8,3 kg",
        "Panel-Montage-Schnittstelle": "100 x 100 mm",
        "Panel-Typ": "IPS",
        "Produktfarbe": "Schwarz, Silber",
        "RMS-Leistung": "4 W",
        "Reaktionszeit": "5 ms",
        "Schwenkwinkelbereich": "-90 - 90\u00b0",
        "Slot-Typ Kabelsperre": "Kensington",
        "Stromverbrauch Standardbetrieb": "18 W",
        "Tiefe ohne Standfu\u00df": "52,8 mm",
        "Touchscreen": "Nein",
        "Verpackungsbreite": "632 mm",
        "Verpackungsh\u00f6he": "216 mm",
        "Verpackungstiefe": "450 mm",
        "Warentarifnummer HS": "85285210",
        "sRGB Abdeckung klassisch": "100"
    },
    "raw_specifications_text": "Bildschirmdiagonale: 60,5 cm 23.8\"\nDisplay-Aufl\u00f6sung: 1920 x 1080 Pixel\nNatives Seitenverh\u00e4ltnis: 16:9\nBildschirmtechnologie: LED\nTouchscreen: Nein\nHD-Typ: Full HD\nPanel-Typ: IPS\nBildschirmform: Flach\nKontrastverh\u00e4ltnis: 1000:1\nMaximale Bildwiederholrate: 75 Hz\nAnzahl der Farben des Displays: 16,78 Millionen Farben\nHelligkeit typisch: 300 cd/m\u00b2\nReaktionszeit: 5 ms\nDisplay-Oberfl\u00e4che: Matt\nBildwinkel, horizontal: 178\u00b0\nBildwinkel, vertikal: 178\u00b0\nsRGB Abdeckung klassisch: 100\nNVIDIA G-SYNC: Nein\nAMD FreeSync: Nein\nIntegrierte Kamera: Nein\nAnzahl der Lautsprecher: 2\nRMS-Leistung: 4 W\nMarktpositionierung: Grafikdesign\nProduktfarbe: Schwarz, Silber\nDVI Anschluss: Nein\nAnzahl HDMI-Anschl\u00fcsse: 1\nHDMI-Version: 1.4\nAnzahl DisplayPort Anschl\u00fcsse: 2\nDisplayPorts-Version: 1.2\nPanel-Montage-Schnittstelle: 100 x 100 mm\nSlot-Typ Kabelsperre: Kensington\nH\u00f6heneinstellung: 13 cm\nSchwenkwinkelbereich: -90 - 90\u00b0\nNeigungswinkelbereich: -5 - 35\u00b0\nEnergieeffizienzklasse SDR: F\nEnergieverbrauch SDR pro 1.000 Stunden: 22 kWh\nStromverbrauch Standardbetrieb: 18 W\nAC Eingangsspannung: 100 - 240 V\nAC Eingangsfrequenz: 50 - 60 Hz\nEnergieeffizienzskala: A bis G\nGer\u00e4tebreite inkl. Fu\u00df: 539,7 mm\nGer\u00e4tetiefe inkl. Fu\u00df: 211,4 mm\nGer\u00e4teh\u00f6he inkl. Fu\u00df: 471,8 mm\nGewicht mit St\u00e4nder: 6,3 kg\nBreite ohne Standfu\u00df: 539,7 mm\nTiefe ohne Standfu\u00df: 52,8 mm\nH\u00f6he ohne Standfu\u00df: 329,9 mm\nGewicht ohne St\u00e4nder: 4,2 kg\nVerpackungsbreite: 632 mm\nVerpackungstiefe: 450 mm\nVerpackungsh\u00f6he: 216 mm\nPaketgewicht: 8,3 kg\nWarentarifnummer HS: 85285210",
    "reference_file": "offer_reference_1647.json",
    "shop_name": "CSV-Direct.de"
}