{
    "html_file": "offer_465_38.html",
    "name": "HP E27q G5, 27\"",
    "offer_link": "https://www.alternate.at/HP/E27q-G5-LED-Monitor/html/product/1904967?partner=AtGeizhalsat&campaign=Monitor/HP/1904967",
    "price": 296.0,
    "raw_specifications": {
        "": "Netzteil",
        "Abmessungen": "Breite: 613,4 mm x H\u00f6he: 364,6 mm x Tiefe/L\u00e4nge: 74,5 mm",
        "Anschl\u00fcsse": "1x HDMI-Eingang, (HDMI-Version: 1.4), 1x DisplayPort-Eingang, (DisplayPort-Version: 1.2), 4x USB-A-3.2 Gen 1 (5 Gbit/s), 1x USB-B",
        "Bild": "Glaretyp",
        "Bildschirmaufl\u00f6sung": "2.560 x 1.440 Pixel",
        "Bildschirmdiagonale": "68,6 cm (27 Zoll)",
        "EAN": "0196786301315",
        "Energieeffizienzklasse (SDR)": "E (A - G)",
        "Energieverbauch pro 1000 Stunden (SDR)": "21 kWh",
        "Ergonomie": "Typ",
        "Farbe": "schwarz/silber",
        "Features": "Kensington-Schloss",
        "Frequenz": "Vertikal",
        "Geeignet f\u00fcr": "Business",
        "Gewicht": "7,1 kg",
        "Hersteller-Nr.": "6N6F2AA#ABB",
        "Leistungsaufnahme im Bereitschafts- und Aus-Zustand": "0,5 Watt",
        "Leistungsaufnahme im Ein-Zustand bei Standard-Dynamikumfang (SDR)": "18 Watt",
        "Stromversorgung": "Stromverbrauch",
        "Typ": "LED-Monitor",
        "Wandhalterung": "VESA kompatibel (100 x 100 mm)",
        "Weitere Informationen": "Ein USB-A-Anschluss hat eine Ladefunktion.",
        "Zubeh\u00f6r": "Vorhanden"
    },
    "raw_specifications_text": "Energieeffizienzklasse (SDR): E (A - G)\nEnergieverbauch pro 1000 Stunden (SDR): 21 kWh\nLeistungsaufnahme im Ein-Zustand bei Standard-Dynamikumfang (SDR): 18 Watt\nLeistungsaufnahme im Bereitschafts- und Aus-Zustand: 0,5 Watt\nBildschirmdiagonale: 68,6 cm (27 Zoll)\nBildschirmaufl\u00f6sung: 2.560 x 1.440 Pixel\nTyp: LED-Monitor\nFarbe: schwarz/silber\nEAN: 0196786301315\nHersteller-Nr.: 6N6F2AA#ABB\nGeeignet f\u00fcr: Business\nBild: Glaretyp\n: Netzteil\nFrequenz: Vertikal\nAnschl\u00fcsse: 1x HDMI-Eingang, (HDMI-Version: 1.4), 1x DisplayPort-Eingang, (DisplayPort-Version: 1.2), 4x USB-A-3.2 Gen 1 (5 Gbit/s), 1x USB-B\nErgonomie: Typ\nStromversorgung: Stromverbrauch\nWandhalterung: VESA kompatibel (100 x 100 mm)\nFeatures: Kensington-Schloss\nWeitere Informationen: Ein USB-A-Anschluss hat eine Ladefunktion.\nZubeh\u00f6r: Vorhanden\nAbmessungen: Breite: 613,4 mm x H\u00f6he: 364,6 mm x Tiefe/L\u00e4nge: 74,5 mm\nGewicht: 7,1 kg",
    "reference_file": "offer_reference_465.json",
    "shop_name": "Alternate.at"
}