{
    "html_file": "offer_2014_8.html",
    "name": "Dell UltraSharp UP2720Q, 27\"",
    "offer_link": "https://www.mylemon.at/artikel/dell/dell_up2720q/4kmonitor-up2720q-68-47cm-27.html",
    "price": 1188.99,
    "raw_specifications": {
        "3D": "Nein",
        "AC Eingangsfrequenz": "50/60 Hz",
        "AC Eingangsspannung": "100 - 240 V",
        "AC-Netzadapter": "Ja",
        "AMD FreeSync": "Nein",
        "Adobe RGB-Abdeckung": "100%",
        "Anzahl DisplayPort Anschl\u00fcsse": "1",
        "Anzahl HDMI-Anschl\u00fcsse": "2",
        "Anzahl Thunderbolt 3 Anschl\u00fcsse": "2",
        "Anzahl der Farben des Displays": "1,073 Milliarden Farben",
        "Anzahl der nachgeschalteten Ports vom Typ USB-C": "1",
        "Anzahl der nachgeschalteten Steckpl\u00e4tze vom Typ USB-A": "4",
        "Anzahl der vorgeschalteten Steckpl\u00e4tze": "1",
        "Artikelnummer": "M10YHJCL",
        "Audioanschl\u00fcsse": "Nein",
        "Audioausgang": "Ja",
        "Aufl\u00f6sung": "3840x2160",
        "Besonderheiten": "HDCP, Lichtschutzblende, Picture-in-Picture",
        "Betriebstemperatur": "0 - 40 \u00b0C",
        "Bildschirmdiagonale": "68,6 cm (27 Zoll)",
        "Bildschirmform": "Flach",
        "Bildschirmtechnologie": "LCD",
        "Bildwinkel, horizontal": "178\u00b0",
        "Bildwinkel, vertikal": "178\u00b0",
        "Blendfreier Bildschirm": "Ja",
        "Breite (ohne Standfu\u00df)": "61,2 cm",
        "DVI Anschluss": "Nein",
        "Dell Display Manager (DDM)-kompatibel": "Ja",
        "Display-Aufl\u00f6sung": "3840 x 2160 Pixel",
        "DisplayPorts-Version": "1.4",
        "Displaygr\u00f6\u00dfe": "27 Zoll",
        "EAN": "5397184200216",
        "Ein-/Ausschalter": "Ja",
        "Eingangsstrom": "2.8 A",
        "Eingebaute Lautsprecher": "Nein",
        "Energieeffizienzklasse (HDR)": "Nicht verf\u00fcgbar",
        "Energieeffizienzklasse (SDR)": "G",
        "Energieeffizienzskala": "A bis G",
        "Energieverbrauch (SDR) pro 1.000 Stunden": "32 kWh",
        "Enth\u00e4lt nicht": "PVC",
        "Ergonomie": "H\u00f6henverstellbar, Pivot (90 Grad drehbar), Schwenkbar, Neigbar",
        "Farbpalette DCI-P3": "98%",
        "Fu\u00dffarbe": "Schwarz",
        "Ger\u00e4tebreite (inkl. Fu\u00df)": "611,9 mm",
        "Ger\u00e4teh\u00f6he (inkl. Fu\u00df)": "563,4 mm",
        "Ger\u00e4tetiefe (inkl. Fu\u00df)": "212 mm",
        "Gewicht (mit St\u00e4nder)": "9,71 kg",
        "Gewicht (ohne St\u00e4nder)": "5,55 kg",
        "HD-Typ": "4K Ultra HD",
        "HDCP": "Ja",
        "HDMI": "Ja",
        "HDMI-Version": "2.0",
        "Helligkeit": "250 cd/m\u00b2",
        "Helligkeit (typisch)": "250 cd/m\u00b2",
        "Hersteller Artikelnummer": "DELL-UP2720Q",
        "High Dynamic Range Video (HDR) Unterst\u00fctzung": "Nein",
        "Horizontaler Scanbereich": "15 - 135 kHz",
        "H\u00f6he (ohne Standfu\u00df)": "37,7 cm",
        "H\u00f6heneinstellung": "13 cm",
        "H\u00f6henverstellung": "Ja",
        "Integrierte Kamera": "Nein",
        "Integrierter USB-Hub": "Ja",
        "J\u00e4hrlicher Energieverbrauch": "45 kWh",
        "Kabelsperre-Slot": "Ja",
        "Kontrastverh\u00e4ltnis": "1300:1",
        "Kopfh\u00f6rerausgang": "Nein",
        "Luftfeuchtigkeit bei Lagerung": "10 - 90%",
        "Marktpositionierung": "Grafikdesign",
        "Maximale Bildwiederholrate": "60 Hz",
        "Mitgelieferte Kabel": "AC, DisplayPort, HDMI, Thunderbolt, USB Typ-C auf USB Typ-A",
        "NVIDIA G-SYNC": "Nein",
        "Nachhaltigkeitszertifikate": "RoHS",
        "Natives Seitenverh\u00e4ltnis": "16:9",
        "Neigungsverstellung": "Ja",
        "Neigungswinkelbereich": "-5 - 21\u00b0",
        "Netzteiltyp": "Intern",
        "On-Screen-Display (OSD)": "Ja",
        "Paketgewicht": "14,1 kg",
        "Panel": "IPS",
        "Panel-Montage-Schnittstelle": "100 x 100 mm",
        "Panel-Typ": "IPS",
        "Pivot": "Ja",
        "Pivot Winkel": "-90 - 90\u00b0",
        "Pixel Abstand": "0,1554 x 0,1554 mm",
        "Pixeldichte": "163 ppi",
        "Produktfarbe": "Schwarz",
        "Rahmenbreite (Seite)": "7,6 mm",
        "Rahmenbreite (oben)": "7,6 mm",
        "Rahmenbreite (unten)": "2,71 cm",
        "Reaktionszeit": "8 ms",
        "Reaktionszeit (schnell)": "6 ms",
        "Relative Luftfeuchtigkeit in Betrieb": "10 - 90%",
        "Schnellstart\u00fcbersicht": "Ja",
        "Schwenkbar": "Ja",
        "Schwenkwinkelbereich": "-45 - 45\u00b0",
        "Sichtbare Gr\u00f6\u00dfe (diagonal)": "68,5 cm",
        "Sichtbare Gr\u00f6\u00dfe (horizontal)": "59,7 cm",
        "Sichtbare Gr\u00f6\u00dfe (vertikal)": "33,6 cm",
        "Stromeingang": "Ja",
        "Stromverbrauch (PowerSave)": "38 W",
        "Stromverbrauch (Standardbetrieb)": "32 W",
        "Stromverbrauch (Standby)": "0,2 W",
        "Stromverbrauch (aus)": "0,2 W",
        "Stromverbrauch (max.)": "230 W",
        "St\u00e4nder enthalten": "Ja",
        "TV Tuner integriert": "Nein",
        "Temperaturbereich bei Lagerung": "-20 - 60 \u00b0C",
        "Tiefe (ohne Standfu\u00df)": "5,1 cm",
        "Touchscreen": "Nein",
        "Typ der Hintergrundbeleuchtung": "LED",
        "USB-Typ-C DisplayPort-Wechselmodus": "Ja",
        "USB-Upstream-Porttyp": "USB Typ-C",
        "Unterst\u00fctzte Grafik-Aufl\u00f6sungen": "640 x 480 (VGA), 720 x 400, 800 x 600 (SVGA), 1024 x 768 (XGA), 1152 x 864 (XGA+), 1280 x 1024 (SXGA), 1600 x 1200 (UXGA), 1920 x 1080 (HD 1080), 2048 x 1080, 2048 x 1280, 2560 x 1440, 3840 x 2160",
        "Unterst\u00fctzte Video-Modi": "480p, 576p, 720p, 1080i, 1080p, 1440p, 2160p",
        "VESA Halterung": "100x100 mm",
        "VESA-Halterung": "Ja",
        "Verpackungsbreite": "168 mm",
        "Verpackungsh\u00f6he": "520 mm",
        "Verpackungstiefe": "812 mm",
        "Vertikaler Scanbereich": "23 - 86 Hz",
        "Video Anschl\u00fcsse": "2x HDMI, 1x DisplayPort, 2x Thunderbolt",
        "Vorderer Rahmen": "Schwarz",
        "WLAN": "Nein",
        "Warentarifnummer (HS)": "85285210",
        "Zertifizierung": "TCO"
    },
    "raw_specifications_text": "Displaygr\u00f6\u00dfe: 27 Zoll\nAufl\u00f6sung: 3840x2160\nPanel: IPS\nReaktionszeit: 8 ms\nVideo Anschl\u00fcsse: 2x HDMI, 1x DisplayPort, 2x Thunderbolt\nErgonomie: H\u00f6henverstellbar, Pivot (90 Grad drehbar), Schwenkbar, Neigbar\nVESA Halterung: 100x100 mm\nHelligkeit: 250 cd/m\u00b2\nBesonderheiten: HDCP, Lichtschutzblende, Picture-in-Picture\nHersteller Artikelnummer: DELL-UP2720Q\nEAN: 5397184200216\nArtikelnummer: M10YHJCL\nBildschirmdiagonale: 68,6 cm (27 Zoll)\nDisplay-Aufl\u00f6sung: 3840 x 2160 Pixel\nNatives Seitenverh\u00e4ltnis: 16:9\nBildschirmtechnologie: LCD\nTouchscreen: Nein\nHD-Typ: 4K Ultra HD\nPanel-Typ: IPS\nBildschirmform: Flach\nKontrastverh\u00e4ltnis: 1300:1\nMaximale Bildwiederholrate: 60 Hz\nAnzahl der Farben des Displays: 1,073 Milliarden Farben\nTyp der Hintergrundbeleuchtung: LED\nHelligkeit (typisch): 250 cd/m\u00b2\nBlendfreier Bildschirm: Ja\nUnterst\u00fctzte Grafik-Aufl\u00f6sungen: 640 x 480 (VGA), 720 x 400, 800 x 600 (SVGA), 1024 x 768 (XGA), 1152 x 864 (XGA+), 1280 x 1024 (SXGA), 1600 x 1200 (UXGA), 1920 x 1080 (HD 1080), 2048 x 1080, 2048 x 1280, 2560 x 1440, 3840 x 2160\nUnterst\u00fctzte Video-Modi: 480p, 576p, 720p, 1080i, 1080p, 1440p, 2160p\nBildwinkel, horizontal: 178\u00b0\nBildwinkel, vertikal: 178\u00b0\nReaktionszeit (schnell): 6 ms\nPixel Abstand: 0,1554 x 0,1554 mm\nPixeldichte: 163 ppi\nHorizontaler Scanbereich: 15 - 135 kHz\nVertikaler Scanbereich: 23 - 86 Hz\nSichtbare Gr\u00f6\u00dfe (horizontal): 59,7 cm\nSichtbare Gr\u00f6\u00dfe (vertikal): 33,6 cm\nSichtbare Gr\u00f6\u00dfe (diagonal): 68,5 cm\nHigh Dynamic Range Video (HDR) Unterst\u00fctzung: Nein\nAdobe RGB-Abdeckung: 100%\n3D: Nein\nNVIDIA G-SYNC: Nein\nAMD FreeSync: Nein\nEingebaute Lautsprecher: Nein\nIntegrierte Kamera: Nein\nMarktpositionierung: Grafikdesign\nProduktfarbe: Schwarz\nVorderer Rahmen: Schwarz\nFu\u00dffarbe: Schwarz\nZertifizierung: TCO\nIntegrierter USB-Hub: Ja\nHDMI: Ja\nKopfh\u00f6rerausgang: Nein\nUSB-Upstream-Porttyp: USB Typ-C\nAnzahl der vorgeschalteten Steckpl\u00e4tze: 1\nAnzahl der nachgeschalteten Steckpl\u00e4tze vom Typ USB-A: 4\nAnzahl der nachgeschalteten Ports vom Typ USB-C: 1\nUSB-Typ-C DisplayPort-Wechselmodus: Ja\nDVI Anschluss: Nein\nAnzahl HDMI-Anschl\u00fcsse: 2\nHDMI-Version: 2.0\nAnzahl DisplayPort Anschl\u00fcsse: 1\nDisplayPorts-Version: 1.4\nAnzahl Thunderbolt 3 Anschl\u00fcsse: 2\nAudioanschl\u00fcsse: Nein\nAudioausgang: Ja\nHDCP: Ja\nStromeingang: Ja\nWLAN: Nein\nVESA-Halterung: Ja\nKabelsperre-Slot: Ja\nH\u00f6henverstellung: Ja\nPanel-Montage-Schnittstelle: 100 x 100 mm\nH\u00f6heneinstellung: 13 cm\nPivot: Ja\nPivot Winkel: -90 - 90\u00b0\nSchwenkbar: Ja\nSchwenkwinkelbereich: -45 - 45\u00b0\nNeigungswinkelbereich: -5 - 21\u00b0\nOn-Screen-Display (OSD): Ja\nNeigungsverstellung: Ja\nEnergieeffizienzklasse (SDR): G\nEnergieeffizienzklasse (HDR): Nicht verf\u00fcgbar\nEnergieverbrauch (SDR) pro 1.000 Stunden: 32 kWh\nStromverbrauch (Standardbetrieb): 32 W\nStromverbrauch (Standby): 0,2 W\nStromverbrauch (max.): 230 W\nStromverbrauch (aus): 0,2 W\nStromverbrauch (PowerSave): 38 W\nAC Eingangsspannung: 100 - 240 V\nAC Eingangsfrequenz: 50/60 Hz\nEingangsstrom: 2.8 A\nNetzteiltyp: Intern\nEnergieeffizienzskala: A bis G\nJ\u00e4hrlicher Energieverbrauch: 45 kWh\nBetriebstemperatur: 0 - 40 \u00b0C\nTemperaturbereich bei Lagerung: -20 - 60 \u00b0C\nRelative Luftfeuchtigkeit in Betrieb: 10 - 90%\nLuftfeuchtigkeit bei Lagerung: 10 - 90%\nSt\u00e4nder enthalten: Ja\nMitgelieferte Kabel: AC, DisplayPort, HDMI, Thunderbolt, USB Typ-C auf USB Typ-A\nSchnellstart\u00fcbersicht: Ja\nGer\u00e4tebreite (inkl. Fu\u00df): 611,9 mm\nGer\u00e4tetiefe (inkl. Fu\u00df): 212 mm\nGer\u00e4teh\u00f6he (inkl. Fu\u00df): 563,4 mm\nGewicht (mit St\u00e4nder): 9,71 kg\nBreite (ohne Standfu\u00df): 61,2 cm\nTiefe (ohne Standfu\u00df): 5,1 cm\nH\u00f6he (ohne Standfu\u00df): 37,7 cm\nGewicht (ohne St\u00e4nder): 5,55 kg\nRahmenbreite (Seite): 7,6 mm\nRahmenbreite (oben): 7,6 mm\nRahmenbreite (unten): 2,71 cm\nVerpackungsbreite: 168 mm\nVerpackungstiefe: 812 mm\nVerpackungsh\u00f6he: 520 mm\nPaketgewicht: 14,1 kg\nNachhaltigkeitszertifikate: RoHS\nEnth\u00e4lt nicht: PVC\nWarentarifnummer (HS): 85285210\nDell Display Manager (DDM)-kompatibel: Ja\nAC-Netzadapter: Ja\nEin-/Ausschalter: Ja\nFarbpalette DCI-P3: 98%\nTV Tuner integriert: Nein",
    "reference_file": "offer_reference_2014.json",
    "shop_name": "mylemon.at"
}