{
    "html_file": "offer_903_4.html",
    "name": "HP M27, 27\"",
    "offer_link": "https://www.taufnaus.de/product/10621373",
    "price": 294.89,
    "raw_specifications": {
        "Abmessungen (Breite x Tiefe x H\u00f6he)": "61.2 cm x 21.14 cm x 54.4 cm - mit Fu\u00df",
        "Adaptive-Sync Technologie": "AMD FreeSync",
        "Ausgangsleistung/Kanal": "2 Watt",
        "Besonderheiten": "HDCP, Low Blue Light Mode, flimmerfreie Technologie, extrem schmale Blende an drei Seiten, Eyesafe-Technologie, 8-bit Farbtiefe, kantenbeleuchtete LED-Hintergrundbeleuchtung",
        "Bildschirmbeschichtung": "Blendfrei, 3H Hard Coating",
        "Bildschirmtyp": "IPS",
        "Details zu Abmessungen & Gewicht": "Ohne Fu\u00df - Breite: 61.2 cm - Tiefe: 4.82 cm - H\u00f6he: 41.3 cm \u00a6 Mit Fu\u00df - Breite: 61.2 cm - Tiefe: 21.14 cm - H\u00f6he: 54.4 cm - Gewicht: 7.3 kg",
        "Diagonalabmessung": "68.58 cm (27\")",
        "Display-Typ": "LED-hintergrundbeleuchteter LCD-Monitor / TFT-Aktivmatrix",
        "ENERGY STAR zertifiziert": "Ja",
        "EU-\u00d6ko-Label": "Ja",
        "Eingangsspannung": "Wechselstrom 100-240 V (50/60 Hz)",
        "Einstellungen der Anzeigeposition": "H\u00f6he, Drehung, Neigung",
        "Energie Effizienzklasse": "Klasse E",
        "Enthaltene Kabel": "1 x HDMI-Kabel \u00a6 1 x USB-C Kabel \u00a6 1 x USB-Kabel - USB Typ-C auf A",
        "Farbraum": "99% sRGB",
        "Gewicht": "7.3 kg",
        "Helligkeit": "300 cd/m\u00b2",
        "Hintergrundbeleuchtungs-Technologie": "LED-Hintergrundbeleuchtung",
        "Horizontale Bildwiederholrate": "30 - 85 kHz",
        "Horizontaler Betrachtungswinkel": "178",
        "H\u00f6heneinstellung": "100 mm",
        "Integrierte Peripherieger\u00e4te": "5,0 Megapixel Kamera, USB 3.2 Gen 1/USB-C Hub",
        "Kennzeichnung": "CSA, UL, VCCI, C-Tick, GS, NOM, CB, CCC, FCC, ETL, ISO 9241-307, KCC, Energy-using Products (EuP) Lot 6, PSE Mark, ICES, S Mark, cTUVus, E-Standby, CEC, KC, CEL, EPA, EAC, CEL Grade 1, RCM, BIS, TUV Rheinland Low Blue Light Certification, halogenarm, Energy-using Products (EuP) Lot 5, ICE, NTRL, Energy-using Products (EuP) Lot 26, Mexico NOM, KES, South Africa Energy Label, Mexico LASE form",
        "Kontrast": "1000:1 / 10000000:1 (dynamisch)",
        "Leistungsmerkmale": "Slot f\u00fcr Sicherheitsschloss (Kabelschloss getrennt erh\u00e4ltlich)",
        "Lokalisierung": "Englisch / Europa",
        "Max. Betriebstemperatur": "35 \u00b0C",
        "Mikrofonfunktionen": "Ger\u00e4uschunterdr\u00fcckung",
        "Min Betriebstemperatur": "5 \u00b0C",
        "Mitgelieferte Software": "HP Display Center",
        "Native Aufl\u00f6sung": "Full HD (1080p) 1920 x 1080 bei 75 Hz",
        "Neigungswinkel": "-5/+23",
        "Pixelpitch": "0.3114 mm",
        "Ppi": "82",
        "Reaktionszeit": "5 ms (Gray-to-Gray)",
        "Schlosstyp zur Diebstahlsicherung": "Kensington Slot",
        "Schnittstellen": "DisplayPort 1.2 (HDCP) \u00a6 HDMI (HDCP) \u00a6 Kopfh\u00f6rer (Mini-Klinkenstecker) \u00a6 USB-C 3.2 Gen 1 upstream/DisplayPort 1.4 Alt Mode (bis zu 65 W) \u00a6 2 x USB 3.2 Gen 1 Downstream (Typ A)",
        "Schwenkwinkel": "90",
        "Seitenverh\u00e4ltnis": "16:9",
        "Service und Support": "Begrenzte Garantie - Arbeitszeit und Ersatzteile - 2 Jahre",
        "Stromverbrauch (Aus-Modus)": "0.3 Watt",
        "Stromverbrauch (max.)": "130 Watt",
        "Stromverbrauch (typisch)": "20 Watt",
        "Stromverbrauch SDR (eingeschaltet)": "20 kWh/1.000 h",
        "Stromverbrauch im Standby-Modus": "0.5 Watt",
        "Transportbreite": "69.2 cm",
        "Transportgewicht": "11.3 kg",
        "Transporth\u00f6he": "46.9 cm",
        "Transporttiefe": "22 cm",
        "Typ": "Lautsprecher - Stereo",
        "VESA-Halterung": "100 x 100 mm",
        "Vertikale Bildwiederholrate": "48 - 75 Hz",
        "Vertikaler Betrachtungswinkel": "178",
        "Zul\u00e4ssige Luftfeuchtigkeit im Betrieb": "20 - 80% (nicht kondensierend)"
    },
    "raw_specifications_text": "Display-Typ: LED-hintergrundbeleuchteter LCD-Monitor / TFT-Aktivmatrix\nEnergie Effizienzklasse: Klasse E\nDiagonalabmessung: 68.58 cm (27\")\nAdaptive-Sync Technologie: AMD FreeSync\nIntegrierte Peripherieger\u00e4te: 5,0 Megapixel Kamera, USB 3.2 Gen 1/USB-C Hub\nBildschirmtyp: IPS\nSeitenverh\u00e4ltnis: 16:9\nNative Aufl\u00f6sung: Full HD (1080p) 1920 x 1080 bei 75 Hz\nPixelpitch: 0.3114 mm\nPpi: 82\nHelligkeit: 300 cd/m\u00b2\nKontrast: 1000:1 / 10000000:1 (dynamisch)\nFarbraum: 99% sRGB\nReaktionszeit: 5 ms (Gray-to-Gray)\nVertikale Bildwiederholrate: 48 - 75 Hz\nHorizontale Bildwiederholrate: 30 - 85 kHz\nHorizontaler Betrachtungswinkel: 178\nVertikaler Betrachtungswinkel: 178\nBildschirmbeschichtung: Blendfrei, 3H Hard Coating\nHintergrundbeleuchtungs-Technologie: LED-Hintergrundbeleuchtung\nBesonderheiten: HDCP, Low Blue Light Mode, flimmerfreie Technologie, extrem schmale Blende an drei Seiten, Eyesafe-Technologie, 8-bit Farbtiefe, kantenbeleuchtete LED-Hintergrundbeleuchtung\nAbmessungen (Breite x Tiefe x H\u00f6he): 61.2 cm x 21.14 cm x 54.4 cm - mit Fu\u00df\nGewicht: 7.3 kg\nTyp: Lautsprecher - Stereo\nMikrofonfunktionen: Ger\u00e4uschunterdr\u00fcckung\nAusgangsleistung/Kanal: 2 Watt\nSchnittstellen: DisplayPort 1.2 (HDCP) \u00a6 HDMI (HDCP) \u00a6 Kopfh\u00f6rer (Mini-Klinkenstecker) \u00a6 USB-C 3.2 Gen 1 upstream/DisplayPort 1.4 Alt Mode (bis zu 65 W) \u00a6 2 x USB 3.2 Gen 1 Downstream (Typ A)\nEinstellungen der Anzeigeposition: H\u00f6he, Drehung, Neigung\nNeigungswinkel: -5/+23\nSchwenkwinkel: 90\nH\u00f6heneinstellung: 100 mm\nVESA-Halterung: 100 x 100 mm\nLeistungsmerkmale: Slot f\u00fcr Sicherheitsschloss (Kabelschloss getrennt erh\u00e4ltlich)\nEnthaltene Kabel: 1 x HDMI-Kabel \u00a6 1 x USB-C Kabel \u00a6 1 x USB-Kabel - USB Typ-C auf A\nKennzeichnung: CSA, UL, VCCI, C-Tick, GS, NOM, CB, CCC, FCC, ETL, ISO 9241-307, KCC, Energy-using Products (EuP) Lot 6, PSE Mark, ICES, S Mark, cTUVus, E-Standby, CEC, KC, CEL, EPA, EAC, CEL Grade 1, RCM, BIS, TUV Rheinland Low Blue Light Certification, halogenarm, Energy-using Products (EuP) Lot 5, ICE, NTRL, Energy-using Products (EuP) Lot 26, Mexico NOM, KES, South Africa Energy Label, Mexico LASE form\nLokalisierung: Englisch / Europa\nSchlosstyp zur Diebstahlsicherung: Kensington Slot\nEingangsspannung: Wechselstrom 100-240 V (50/60 Hz)\nStromverbrauch SDR (eingeschaltet): 20 kWh/1.000 h\nStromverbrauch (typisch): 20 Watt\nStromverbrauch (max.): 130 Watt\nStromverbrauch im Standby-Modus: 0.5 Watt\nStromverbrauch (Aus-Modus): 0.3 Watt\nMitgelieferte Software: HP Display Center\nDetails zu Abmessungen & Gewicht: Ohne Fu\u00df - Breite: 61.2 cm - Tiefe: 4.82 cm - H\u00f6he: 41.3 cm \u00a6 Mit Fu\u00df - Breite: 61.2 cm - Tiefe: 21.14 cm - H\u00f6he: 54.4 cm - Gewicht: 7.3 kg\nTransportbreite: 69.2 cm\nTransporttiefe: 22 cm\nTransporth\u00f6he: 46.9 cm\nTransportgewicht: 11.3 kg\nEU-\u00d6ko-Label: Ja\nENERGY STAR zertifiziert: Ja\nService und Support: Begrenzte Garantie - Arbeitszeit und Ersatzteile - 2 Jahre\nMin Betriebstemperatur: 5 \u00b0C\nMax. Betriebstemperatur: 35 \u00b0C\nZul\u00e4ssige Luftfeuchtigkeit im Betrieb: 20 - 80% (nicht kondensierend)",
    "reference_file": "offer_reference_903.json",
    "shop_name": "TaufNaus"
}