{
    "html_file": "offer_1826_7.html",
    "name": "Dell S2721H, 27\"",
    "offer_link": "https://www.proshop.at/Bildschirm/Dell-Bildschirm-S2721H-1920x1080-FHD-75Hz-IPS-3W-Speakers/2918035?utm_source=geizhals&utm_medium=cpc&utm_campaign=pricesite",
    "price": 159.55,
    "raw_specifications": {
        "Abmessungen (Breite x Tiefe x H\u00f6he)": "60.99 cm x 18.68 cm x 45.33 cm - mit Fu\u00df",
        "Abmessungen (Breite x Tiefe x H\u00f6he) - mit Fu\u00df": "60.99 cm x 18.68 cm x 45.33 cm",
        "Adaptive-Sync Technologie": "AMD FreeSync",
        "Ausgangsleistung/Kanal": "3 Watt",
        "Besonderheiten": "LED-Randlichtsystem, flimmerfreie Technologie, BFR/PVC-frei, ohne Quecksilber, arsenfreies Glas, Dell Easy Arrange, Dell ComfortView, Low Blue Light-Technologie, an 3 Seiten ohne Blende",
        "Bildschirmbeschichtung": "Blendfrei, 3H Hard Coating",
        "Bildschirmtyp": "IPS",
        "Details zu Abmessungen & Gewicht": "Mit Fu\u00df - Breite: 60.99 cm - Tiefe: 18.68 cm - H\u00f6he: 45.33 cm  Ohne Fu\u00df - Breite: 60.99 cm - Tiefe: 5.4 cm - H\u00f6he: 36.36 cm - Gewicht: 4.4 kg",
        "Diagonalabmessung": "68.47 cm (27\")",
        "Display-Typ": "LED-hintergrundbeleuchteter LCD-Monitor / TFT-Aktivmatrix",
        "EAN": "5397184409367",
        "ENERGY STAR zertifiziert": "Ja",
        "Ein-/Aus-Schalter": "Nein",
        "Eingangsanschl\u00fcsse": "2xHDMI",
        "Eingangsspannung": "Wechselstrom 120/230 V (50/60 Hz)",
        "Einstellungen der Anzeigeposition": "Neigung",
        "Energie Effizienzklasse": "Klasse D",
        "Energierverbrauch Sleep": "0.3 Watt",
        "Energieverbrauch pro Jahr": "27 kWh",
        "Enthaltene Kabel": "1 x HDMI-Kabel",
        "Farbraum": "72% NTSC (CIE 1931)",
        "Farbunterst\u00fctzung": "16,7 Millionen Farben",
        "Ger\u00e4tetyp": "LED-hintergrundbeleuchteter LCD-Monitor - 68.47 cm (27\")",
        "Helligkeit": "300 cd/m\u00b2",
        "Hersteller": "Dell",
        "Hintergrundbeleuchtungs-Technologie": "LED-Hintergrundbeleuchtung",
        "Horizontaler Betrachtungswinkel": "178",
        "Kennzeichnung": "RoHS, HDCP 1.4",
        "Kontrast": "1000:1",
        "Leistungsaufnahme im Ein-Zustand": "16.8 W",
        "Leistungsmerkmale": "Integrierte Kabelf\u00fchrung, Unterst\u00fctzung f\u00fcr VESA-Schnittstelle, HDCP Compliant",
        "Mitgelieferte Software": "Dell Display Manager",
        "Modell": "DELL-S2721H",
        "Native Aufl\u00f6sung": "Full HD (1080p) 1920 x 1080 bei 75 Hz",
        "Neigungswinkel": "-5/+21",
        "Pixelpitch": "0.3114 mm",
        "Ppi": "81.59",
        "Produktbeschreibung": "Dell S2721H - LED-Monitor - Full HD (1080p) - 68.47 cm (27\")",
        "Reaktionszeit": "4 ms (Grau-zu-Grau extrem)",
        "Schnittstellen": "2 x HDMI (HDCP 1.4)  Audio Line-Out",
        "Seitenverh\u00e4ltnis": "16:9",
        "Services im Bundle": "3 Jahre erweiterte Basisaustauschgew\u00e4hrleistung",
        "Spannung": "Wechselstrom 120/230 V (50/60 Hz)",
        "Stromverbrauch (typisch)": "21 Watt",
        "Stromverbrauch SDR (eingeschaltet)": "16.8 kWh/1.000 h",
        "Stromverbrauch im Standby-Modus": "0.3 Watt",
        "TCO-zertifiziert": "TCO Certified Displays 8",
        "Transportgewicht": "7.7 kg",
        "Typ": "Lautsprecher - Stereo",
        "Umweltschutzstandards": "TCO Certified Displays 8, ENERGY STAR-qualifiziert",
        "VESA-Halterung": "100 x 100 mm",
        "Vertikaler Betrachtungswinkel": "178",
        "Waren-Nr.": "2918035",
        "Zubeh\u00f6r im Lieferumfang": "Aufstellung, VESA Abdeckung, Standfu\u00df",
        "Zum Hersteller": "www.dell.com/"
    },
    "raw_specifications_text": "Hersteller: Dell\nWaren-Nr.: 2918035\nModell: DELL-S2721H\nEAN: 5397184409367\nZum Hersteller: www.dell.com/\nProduktbeschreibung: Dell S2721H - LED-Monitor - Full HD (1080p) - 68.47 cm (27\")\nGer\u00e4tetyp: LED-hintergrundbeleuchteter LCD-Monitor - 68.47 cm (27\")\nEnergie Effizienzklasse: Klasse D\nEnergieverbrauch pro Jahr: 27 kWh\nLeistungsaufnahme im Ein-Zustand: 16.8 W\nAdaptive-Sync Technologie: AMD FreeSync\nBildschirmtyp: IPS\nSeitenverh\u00e4ltnis: 16:9\nNative Aufl\u00f6sung: Full HD (1080p) 1920 x 1080 bei 75 Hz\nPixelpitch: 0.3114 mm\nHelligkeit: 300 cd/m\u00b2\nKontrast: 1000:1\nReaktionszeit: 4 ms (Grau-zu-Grau extrem)\nFarbunterst\u00fctzung: 16,7 Millionen Farben\nFarbraum: 72% NTSC (CIE 1931)\nEingangsanschl\u00fcsse: 2xHDMI\nEinstellungen der Anzeigeposition: Neigung\nBildschirmbeschichtung: Blendfrei, 3H Hard Coating\nSpannung: Wechselstrom 120/230 V (50/60 Hz)\nAbmessungen (Breite x Tiefe x H\u00f6he) - mit Fu\u00df: 60.99 cm x 18.68 cm x 45.33 cm\nUmweltschutzstandards: TCO Certified Displays 8, ENERGY STAR-qualifiziert\nKennzeichnung: RoHS, HDCP 1.4\nServices im Bundle: 3 Jahre erweiterte Basisaustauschgew\u00e4hrleistung\nDisplay-Typ: LED-hintergrundbeleuchteter LCD-Monitor / TFT-Aktivmatrix\nDiagonalabmessung: 68.47 cm (27\")\nPpi: 81.59\nHorizontaler Betrachtungswinkel: 178\nVertikaler Betrachtungswinkel: 178\nHintergrundbeleuchtungs-Technologie: LED-Hintergrundbeleuchtung\nBesonderheiten: LED-Randlichtsystem, flimmerfreie Technologie, BFR/PVC-frei, ohne Quecksilber, arsenfreies Glas, Dell Easy Arrange, Dell ComfortView, Low Blue Light-Technologie, an 3 Seiten ohne Blende\nAbmessungen (Breite x Tiefe x H\u00f6he): 60.99 cm x 18.68 cm x 45.33 cm - mit Fu\u00df\nTyp: Lautsprecher - Stereo\nAusgangsleistung/Kanal: 3 Watt\nSchnittstellen: 2 x HDMI (HDCP 1.4)  Audio Line-Out\nNeigungswinkel: -5/+21\nVESA-Halterung: 100 x 100 mm\nLeistungsmerkmale: Integrierte Kabelf\u00fchrung, Unterst\u00fctzung f\u00fcr VESA-Schnittstelle, HDCP Compliant\nZubeh\u00f6r im Lieferumfang: Aufstellung, VESA Abdeckung, Standfu\u00df\nEnthaltene Kabel: 1 x HDMI-Kabel\nEingangsspannung: Wechselstrom 120/230 V (50/60 Hz)\nStromverbrauch SDR (eingeschaltet): 16.8 kWh/1.000 h\nStromverbrauch (typisch): 21 Watt\nStromverbrauch im Standby-Modus: 0.3 Watt\nEnergierverbrauch Sleep: 0.3 Watt\nEin-/Aus-Schalter: Nein\nMitgelieferte Software: Dell Display Manager\nDetails zu Abmessungen & Gewicht: Mit Fu\u00df - Breite: 60.99 cm - Tiefe: 18.68 cm - H\u00f6he: 45.33 cm  Ohne Fu\u00df - Breite: 60.99 cm - Tiefe: 5.4 cm - H\u00f6he: 36.36 cm - Gewicht: 4.4 kg\nTransportgewicht: 7.7 kg\nTCO-zertifiziert: TCO Certified Displays 8\nENERGY STAR zertifiziert: Ja",
    "reference_file": "offer_reference_1826.json",
    "shop_name": "Proshop.at"
}