{
    "html_file": "offer_624_36.html",
    "name": "Acer Vero B7 B247Wbmiprzxv, 24\"",
    "offer_link": "https://ms-it-beratung.at/shop/details.php?art=414491&artname=ACER+61%2C0cm+%2824%22%29+++B247Wbmiprzxv+16%3A10+HDMI%2BDP%2BUSB+Hub+bl",
    "price": 271.0,
    "raw_specifications": {
        "AMD FreeSync": "Nein",
        "Anzahl DisplayPort Anschl\u00fcsse": "1",
        "Anzahl der Farben des Displays": "16,7 Millionen Farben",
        "Bildschirmdiagonale": "60,5 cm (23.8\")",
        "Bildschirmdiagonale (cm)": "60,5 cm",
        "Bildschirmform": "Flach",
        "Bildschirmtechnologie": "LCD",
        "Bildwinkel, horizontal": "178\u00b0",
        "Bildwinkel, vertikal": "178\u00b0",
        "Display-Aufl\u00f6sung": "1920 x 1200 Pixel",
        "Eingebaute Lautsprecher": "Ja",
        "Energieeffizienzklasse (SDR)": "F",
        "Energieeffizienzskala": "A bis G",
        "Energieverbrauch (SDR) pro 1.000 Stunden": "23 kWh",
        "HD-Typ": "4K Ultra HD",
        "HDMI": "Ja",
        "Helligkeit (typisch)": "300 cd/m\u00b2",
        "Integrierte Kamera": "Nein",
        "Kontrastverh\u00e4ltnis (dynamisch)": "100000000:1",
        "Kopfh\u00f6rerausgang": "Ja",
        "NVIDIA G-SYNC": "Nein",
        "Natives Seitenverh\u00e4ltnis": "16:10",
        "Produktfarbe": "Schwarz",
        "Reaktionszeit": "4 ms",
        "Seitenverh\u00e4ltnis": "16:10",
        "Stromverbrauch (Standardbetrieb)": "15 W",
        "Stromverbrauch (Standby)": "0,39 W",
        "Stromverbrauch (aus)": "0,27 W",
        "St\u00e4nder enthalten": "Ja",
        "Touchscreen": "Nein",
        "Typ der Hintergrundbeleuchtung": "LED",
        "VESA-Halterung": "Ja"
    },
    "raw_specifications_text": "Bildschirmdiagonale: 60,5 cm (23.8\")\nDisplay-Aufl\u00f6sung: 1920 x 1200 Pixel\nNatives Seitenverh\u00e4ltnis: 16:10\nBildschirmtechnologie: LCD\nTouchscreen: Nein\nHD-Typ: 4K Ultra HD\nTyp der Hintergrundbeleuchtung: LED\nHelligkeit (typisch): 300 cd/m\u00b2\nReaktionszeit: 4 ms\nBildschirmform: Flach\nSeitenverh\u00e4ltnis: 16:10\nKontrastverh\u00e4ltnis (dynamisch): 100000000:1\nBildwinkel, horizontal: 178\u00b0\nBildwinkel, vertikal: 178\u00b0\nAnzahl der Farben des Displays: 16,7 Millionen Farben\nBildschirmdiagonale (cm): 60,5 cm\nNVIDIA G-SYNC: Nein\nAMD FreeSync: Nein\nEingebaute Lautsprecher: Ja\nIntegrierte Kamera: Nein\nProduktfarbe: Schwarz\nHDMI: Ja\nAnzahl DisplayPort Anschl\u00fcsse: 1\nKopfh\u00f6rerausgang: Ja\nVESA-Halterung: Ja\nEnergieeffizienzklasse (SDR): F\nEnergieverbrauch (SDR) pro 1.000 Stunden: 23 kWh\nStromverbrauch (Standardbetrieb): 15 W\nStromverbrauch (Standby): 0,39 W\nStromverbrauch (aus): 0,27 W\nEnergieeffizienzskala: A bis G\nSt\u00e4nder enthalten: Ja",
    "reference_file": "offer_reference_624.json",
    "shop_name": "ms-it-beratung"
}