{
    "html_file": "offer_448_8.html",
    "name": "MSI Optix G27C4DE E2, 27\"",
    "offer_link": "https://www.playox.de/productredirect/index/sku/27168630?sPartner=p-geizhals-at&campaign=psm/geizhals-at/",
    "price": 281.34,
    "raw_specifications": {
        "Anschl\u00fcsse": "DisplayPort, HDMI, Kopfh\u00f6reranschluss, Audioausgang (Line-Out)",
        "Artikelnummer": "27168630",
        "Aufl\u00f6sung Kurzname": "Full HD",
        "Bezeichnung des Herstellers": "MSI G27C4DE E2",
        "Bildwiederholungsrate": "165,00 Hz",
        "Breite": "6115,00 mm",
        "Display Features": "FlickerFree, 3D ready",
        "Display Sync": "AMD FreeSync, Adaptive Sync",
        "Displaygr\u00f6\u00dfe": "68,58 cm (27 Zoll)",
        "Displayoberfl\u00e4che": "matt",
        "EEK - Energieeffizienzklasse (HDR)": "G",
        "EEK - Spektrum": "AG",
        "Einsatzort": "Innen",
        "Energieeffizienzklasse": "E",
        "Geh\u00e4usefarbe des Ger\u00e4tes": "Schwarz",
        "Gewicht": "4,50 kg",
        "Gewicht inkl. Verpackung in Kg": "9,00 kg",
        "Helligkeit Bereich": "150 - 300 cd/m\u00b2",
        "Hersteller": "MSI",
        "H\u00f6he": "4579,00 mm",
        "Kontrastverh\u00e4ltnis (typisch) Bereich": "ab 1.200:1",
        "LCD-Technologie": "VA Panel",
        "L\u00e4nge": "2254,00 mm",
        "Produktart": "Monitore",
        "Reaktionszeit": "1,00 ms",
        "Seitenverh\u00e4ltnis": "16:9",
        "Shop Herstellernummer": "9S6-3CA91T-058",
        "Standard-EAN": "4719072962500",
        "Verpackung - Breite in cm": "69,80 cm",
        "Verpackung - H\u00f6he in cm": "48,80 cm",
        "Verpackung - L\u00e4nge in cm": "17,20 cm",
        "max. Aufl\u00f6sung": "1.920 x 1.080 Pixel (16:9)"
    },
    "raw_specifications_text": "Displaygr\u00f6\u00dfe: 68,58 cm (27 Zoll)\nGeh\u00e4usefarbe des Ger\u00e4tes: Schwarz\nGewicht: 4,50 kg\nProduktart: Monitore\nKontrastverh\u00e4ltnis (typisch) Bereich: ab 1.200:1\nHelligkeit Bereich: 150 - 300 cd/m\u00b2\nAnschl\u00fcsse: DisplayPort, HDMI, Kopfh\u00f6reranschluss, Audioausgang (Line-Out)\nDisplay Features: FlickerFree, 3D ready\nHersteller: MSI\nDisplay Sync: AMD FreeSync, Adaptive Sync\nAufl\u00f6sung Kurzname: Full HD\nEEK - Spektrum: AG\nGewicht inkl. Verpackung in Kg: 9,00 kg\nEEK - Energieeffizienzklasse (HDR): G\nVerpackung - Breite in cm: 69,80 cm\nBreite: 6115,00 mm\nVerpackung - L\u00e4nge in cm: 17,20 cm\nVerpackung - H\u00f6he in cm: 48,80 cm\nH\u00f6he: 4579,00 mm\nL\u00e4nge: 2254,00 mm\nArtikelnummer: 27168630\nStandard-EAN: 4719072962500\nShop Herstellernummer: 9S6-3CA91T-058\nBezeichnung des Herstellers: MSI G27C4DE E2\nmax. Aufl\u00f6sung: 1.920 x 1.080 Pixel (16:9)\nSeitenverh\u00e4ltnis: 16:9\nLCD-Technologie: VA Panel\nReaktionszeit: 1,00 ms\nDisplayoberfl\u00e4che: matt\nBildwiederholungsrate: 165,00 Hz\nEinsatzort: Innen\nEnergieeffizienzklasse: E",
    "reference_file": "offer_reference_448.json",
    "shop_name": "playox (AT)"
}