{
    "html_file": "offer_809_1.html",
    "name": "HANNspree HP246PFB, 24\"",
    "offer_link": "https://www.taufnaus.de/product/10602708",
    "price": 188.43,
    "raw_specifications": {
        "Abmessungen (Breite x Tiefe x H\u00f6he)": "53.46 cm x 19 cm x 46.65 cm - mit Fu\u00df",
        "Ausgangsleistung/Kanal": "2 Watt",
        "Besonderheiten": "Low Blue Light Mode",
        "Bildschirmbeschichtung": "Haze 25 %, anti-glare 3H hardness",
        "Bildschirmtyp": "ADS-IPS",
        "Details zu Abmessungen & Gewicht": "Ohne Fu\u00df - Breite: 53.46 cm - Tiefe: 39.7 cm - H\u00f6he: 35.15 cm",
        "Diagonalabmessung": "61 cm (24\")",
        "Display-Typ": "LED-hintergrundbeleuchteter LCD-Monitor / TFT-Aktivmatrix",
        "Eingangsspannung": "Wechselstrom 100-240 V (50 - 65 Hz)",
        "Einstellungen der Anzeigeposition": "Pivot (Rotation), Drehung",
        "Energie Effizienzklasse": "Klasse D",
        "Enthaltene Kabel": "1 x HDMI-Kabel - 1.5 m",
        "Farbunterst\u00fctzung": "16,7 Millionen Farben",
        "Gewicht": "3.45 kg",
        "Helligkeit": "250 cd/m\u00b2",
        "Hintergrundbeleuchtungs-Technologie": "LED-Hintergrundbeleuchtung",
        "Horizontale Bildwiederholrate": "30 - 83 kHz",
        "Horizontaler Betrachtungswinkel": "178",
        "Kontrast": "1000:1 / 10000000:1 (dynamisch)",
        "Native Aufl\u00f6sung": "Full HD (1080p) 1920 x 1200 bei 60 Hz",
        "OSD-Sprachen": "Multilingual",
        "Pixelpitch": "0.27 mm",
        "Reaktionszeit": "5 ms (Overdrive)",
        "Schnittstellen": "HDMI \u00a6 DisplayPort 1.2 \u00a6 VGA",
        "Seitenverh\u00e4ltnis": "16:10",
        "Service und Support": "Begrenzte Garantie - 3 Jahre",
        "Stromverbrauch (Aus-Modus)": "0.3 Watt",
        "Stromverbrauch (typisch)": "15 Watt",
        "Stromverbrauch SDR (eingeschaltet)": "15 kWh/1.000 h",
        "Stromverbrauch im Standby-Modus": "0.5 Watt",
        "Transportbreite": "58.5 cm",
        "Transportgewicht": "4.65 kg",
        "Transporth\u00f6he": "41.5 cm",
        "Transporttiefe": "12 cm",
        "Typ": "Lautsprecher - Stereo",
        "VESA-Halterung": "75 x 75 mm",
        "Vertikale Bildwiederholrate": "56 - 75 Hz",
        "Vertikaler Betrachtungswinkel": "178",
        "Zubeh\u00f6r im Lieferumfang": "Aufstellung"
    },
    "raw_specifications_text": "Display-Typ: LED-hintergrundbeleuchteter LCD-Monitor / TFT-Aktivmatrix\nEnergie Effizienzklasse: Klasse D\nDiagonalabmessung: 61 cm (24\")\nBildschirmtyp: ADS-IPS\nSeitenverh\u00e4ltnis: 16:10\nNative Aufl\u00f6sung: Full HD (1080p) 1920 x 1200 bei 60 Hz\nPixelpitch: 0.27 mm\nHelligkeit: 250 cd/m\u00b2\nKontrast: 1000:1 / 10000000:1 (dynamisch)\nFarbunterst\u00fctzung: 16,7 Millionen Farben\nReaktionszeit: 5 ms (Overdrive)\nVertikale Bildwiederholrate: 56 - 75 Hz\nHorizontale Bildwiederholrate: 30 - 83 kHz\nHorizontaler Betrachtungswinkel: 178\nVertikaler Betrachtungswinkel: 178\nBildschirmbeschichtung: Haze 25 %, anti-glare 3H hardness\nHintergrundbeleuchtungs-Technologie: LED-Hintergrundbeleuchtung\nOSD-Sprachen: Multilingual\nBesonderheiten: Low Blue Light Mode\nAbmessungen (Breite x Tiefe x H\u00f6he): 53.46 cm x 19 cm x 46.65 cm - mit Fu\u00df\nGewicht: 3.45 kg\nTyp: Lautsprecher - Stereo\nAusgangsleistung/Kanal: 2 Watt\nSchnittstellen: HDMI \u00a6 DisplayPort 1.2 \u00a6 VGA\nEinstellungen der Anzeigeposition: Pivot (Rotation), Drehung\nVESA-Halterung: 75 x 75 mm\nZubeh\u00f6r im Lieferumfang: Aufstellung\nEnthaltene Kabel: 1 x HDMI-Kabel - 1.5 m\nEingangsspannung: Wechselstrom 100-240 V (50 - 65 Hz)\nStromverbrauch SDR (eingeschaltet): 15 kWh/1.000 h\nStromverbrauch (typisch): 15 Watt\nStromverbrauch im Standby-Modus: 0.5 Watt\nStromverbrauch (Aus-Modus): 0.3 Watt\nDetails zu Abmessungen & Gewicht: Ohne Fu\u00df - Breite: 53.46 cm - Tiefe: 39.7 cm - H\u00f6he: 35.15 cm\nTransportbreite: 58.5 cm\nTransporttiefe: 12 cm\nTransporth\u00f6he: 41.5 cm\nTransportgewicht: 4.65 kg\nService und Support: Begrenzte Garantie - 3 Jahre",
    "reference_file": "offer_reference_809.json",
    "shop_name": "TaufNaus"
}