{
    "html_file": "offer_359_18.html",
    "name": "ASUS VA32UQSB, 31.5\"",
    "offer_link": "https://www.ditech.at/details.php?artnr=368752",
    "price": 616.9,
    "raw_specifications": {
        "Anschl\u00fcsse - DisplayPort 1.2 60Hz@3840x2160": "1",
        "Anschl\u00fcsse - HDMI 2.0 60Hz@3840x2160": "2",
        "Anwendung": "station\u00e4r",
        "Audio": "Lautsprecher (2x 2W),  1x Line-Out",
        "Aufl\u00f6sung": "3840x2160",
        "Beschichtung": "matt (non-glare)",
        "Besonderheiten": "Slim Bezel,  EPEAT Silver,  mechanische Tasten mit Steuerkreuz,  Sicherheitsschloss (Kensington)",
        "Bildwiederholfrequenz": "60Hz",
        "Blickwinkel": "178\u00b0/178\u00b0",
        "Diagonale": "31.5\"/80cm",
        "Energieeffizienzklasse HDR (A bis G)": "G",
        "Energieverbrauch HDR": "41kWh/1000h",
        "Energieverbrauch SDR": "32kWh/1000h",
        "Ergonomie": "150mm (h\u00f6henverstellbar),  \u00b190\u00b0 (Pivot),  \u00b1180\u00b0 (drehbar),  +25\u00b0/-5\u00b0 (neigbar),  keine Angabe (Schr\u00e4glage)",
        "FRC": "unbekannt",
        "Farbe": "schwarz",
        "Farbtiefe": "10bit (1.07 Mrd. Farben)",
        "Form": "gerade (flat)",
        "Gewicht": "9.34kg (mit Standfu\u00df),  6.22kg (ohne Standfu\u00df)",
        "HDR": "HDR10",
        "Helligkeit": "350cd/m\u00b2",
        "Herstellergarantie": "drei Jahre",
        "Hintergrundbeleuchtung": "White-LED,  flicker-free,  Blaulichtfilter",
        "Kontrast - statisch": "1.000:1",
        "Lautsprecher": "Ja",
        "Leistungsaufnahme": "keine Angabe (maximal),  30W (typisch),  keine Angabe (Energielabel alt A+++ bis G),  0.5W (Standby)",
        "Panel": "IPS",
        "Reaktionszeit - GtG": "4ms",
        "Screen-to-Body-Ratio": "90.3% (berechnet)",
        "Seitenverh\u00e4ltnis": "16:9",
        "Signalfrequenz": "140kHz (horizontal),  24-60Hz (vertikal)",
        "Stromversorgung": "AC-In (internes Netzteil)",
        "USB-Hub In": "1x USB-B 3.0",
        "USB-Hub Out": "2x USB-A 3.0",
        "USB-Schreibweise": "Link",
        "VESA": "100x100 (belegt)",
        "Weitere Anschl\u00fcsse": "N/A"
    },
    "raw_specifications_text": "Anschl\u00fcsse - DisplayPort 1.2 60Hz@3840x2160: 1\nAnschl\u00fcsse - HDMI 2.0 60Hz@3840x2160: 2\nAnwendung: station\u00e4r\nAudio: Lautsprecher (2x 2W),  1x Line-Out\nAufl\u00f6sung: 3840x2160\nBeschichtung: matt (non-glare)\nBesonderheiten: Slim Bezel,  EPEAT Silver,  mechanische Tasten mit Steuerkreuz,  Sicherheitsschloss (Kensington)\nBildwiederholfrequenz: 60Hz\nBlickwinkel: 178\u00b0/178\u00b0\nDiagonale: 31.5\"/80cm\nEnergieeffizienzklasse HDR (A bis G): G\nEnergieverbrauch HDR: 41kWh/1000h\nEnergieverbrauch SDR: 32kWh/1000h\nErgonomie: 150mm (h\u00f6henverstellbar),  \u00b190\u00b0 (Pivot),  \u00b1180\u00b0 (drehbar),  +25\u00b0/-5\u00b0 (neigbar),  keine Angabe (Schr\u00e4glage)\nFarbe: schwarz\nFarbtiefe: 10bit (1.07 Mrd. Farben)\nForm: gerade (flat)\nFRC: unbekannt\nGewicht: 9.34kg (mit Standfu\u00df),  6.22kg (ohne Standfu\u00df)\nHDR: HDR10\nHelligkeit: 350cd/m\u00b2\nHerstellergarantie: drei Jahre\nHintergrundbeleuchtung: White-LED,  flicker-free,  Blaulichtfilter\nKontrast - statisch: 1.000:1\nLautsprecher: Ja\nLeistungsaufnahme: keine Angabe (maximal),  30W (typisch),  keine Angabe (Energielabel alt A+++ bis G),  0.5W (Standby)\nPanel: IPS\nReaktionszeit - GtG: 4ms\nScreen-to-Body-Ratio: 90.3% (berechnet)\nSeitenverh\u00e4ltnis: 16:9\nSignalfrequenz: 140kHz (horizontal),  24-60Hz (vertikal)\nStromversorgung: AC-In (internes Netzteil)\nUSB-Hub In: 1x USB-B 3.0\nUSB-Hub Out: 2x USB-A 3.0\nUSB-Schreibweise: Link\nVESA: 100x100 (belegt)\nWeitere Anschl\u00fcsse: N/A",
    "reference_file": "offer_reference_359.json",
    "shop_name": "DiTech.at"
}