{
    "html_file": "offer_1611_2.html",
    "name": "ASUS TUF Gaming VG289Q1A, 28\"",
    "offer_link": "https://direkt.jacob.de/produkte/asus-tuf-gaming-90lm05b0-b02170-artnr-6942552.html?utm_source=geizhals&utm_medium=cpc&utm_campaign=Preisvergleich&ref=103",
    "price": 279.64,
    "raw_specifications": {
        "Abmessungen (Breite x Tiefe x H\u00f6he)": "63.95 cm x 21.38 cm x 46.05 cm - mit Fu\u00df",
        "Abmessungen (Breite x Tiefe x H\u00f6he) - mit Fu\u00df": "63.95 cm x 21.38 cm x 46.05 cm",
        "Adaptive-Sync Technologie": "AMD FreeSync",
        "Ausgangsleistung/Kanal": "2 Watt",
        "Besonderheiten": "HDCP, ASUS GamePlus, flimmerfreie Technologie, FreeSync Technology, Adaptive-Sync-Technologie, ASUS GameVisual Technology, 90% DCI-P3, GameFast Input Technology, HDR10-kompatibel, Ultra-Low Blue Light Technology, Low Blue Light-Technologie, Shadow Boost-Technologie, Multiple HDR-Modus",
        "Bildschirmbeschichtung": "Blendfrei",
        "Bildschirmtyp": "IPS",
        "Blendentyp": "Flache Front",
        "Details zu Abmessungen & Gewicht": "Mit Fu\u00df - Breite: 63.95 cm - Tiefe: 21.38 cm - H\u00f6he: 46.05 cm - Gewicht: 5.7 kg  Ohne Fu\u00df - Breite: 63.95 cm - Tiefe: 6.565 cm - H\u00f6he: 36.935 cm - Gewicht: 4.73 kg",
        "Diagonalabmessung": "71.12 cm (28\")",
        "Display-Typ": "LED-hintergrundbeleuchteter LCD-Monitor / TFT-Aktivmatrix",
        "ENERGY STAR zertifiziert": "Ja",
        "Eingangsanschl\u00fcsse": "2xHDMI, DisplayPort",
        "Einstellungen der Anzeigeposition": "H\u00f6he, Pivot (Rotation), Drehung, Neigung",
        "Energie Effizienzklasse": "G",
        "Farbunterst\u00fctzung": "1,074 Milliarden Farben (10-Bit)",
        "Ger\u00e4tetyp": "LED-hintergrundbeleuchteter LCD-Monitor - 71.12 cm (28\")",
        "Gewicht": "5.7 kg",
        "Helligkeit": "350 cd/m\u00b2",
        "Hintergrundbeleuchtungs-Technologie": "LED-Hintergrundbeleuchtung",
        "Horizontale Bildwiederholrate": "30 - 160 kHz",
        "Horizontaler Betrachtungswinkel": "178",
        "Kennzeichnung": "UL, VCCI, BSMI, cUL, WHQL, CB, CCC, FCC, RoHS, WEEE, PSE Mark, EAC, RCM, CEL level 1, TUV Rheinland Low Blue Light Certification, TUV Rheinland Flicker Free Certification, DisplayPort 1.2",
        "Kontrast": "1000:1",
        "Leistungsaufnahme im Betrieb": "30 Watt",
        "Leistungsmerkmale": "Slot f\u00fcr Sicherheitsschloss (Kabelschloss getrennt erh\u00e4ltlich)",
        "Native Aufl\u00f6sung": "4K 3840 x 2160 bei 60 Hz",
        "Neigungswinkel": "-5/20",
        "Pixelpitch": "0.16 mm",
        "Produktbeschreibung": "ASUS TUF Gaming VG289Q1A - LED-Monitor - 4K - 71.12 cm (28\")",
        "Reaktionszeit": "5 ms (Gray-to-Gray)",
        "Schlosstyp zur Diebstahlsicherung": "Kensington Slot",
        "Schnittstellen": "2 x HDMI  DisplayPort  Kopfh\u00f6rer",
        "Schwenkwinkel": "30",
        "Seitenverh\u00e4ltnis": "16:9",
        "Stromverbrauch (Aus-Modus)": "0.5 Watt",
        "Transportbreite": "70.6 cm",
        "Transportgewicht": "7.8 kg",
        "Transporth\u00f6he": "53 cm",
        "Transporttiefe": "18 cm",
        "Typ": "Lautsprecher - Stereo",
        "Umweltschutzstandards": "ENERGY STAR-qualifiziert",
        "VESA-Halterung": "100 x 100 mm",
        "Vertikale Bildwiederholrate": "40 - 60 Hz",
        "Vertikaler Betrachtungswinkel": "178"
    },
    "raw_specifications_text": "Produktbeschreibung: ASUS TUF Gaming VG289Q1A - LED-Monitor - 4K - 71.12 cm (28\")\nGer\u00e4tetyp: LED-hintergrundbeleuchteter LCD-Monitor - 71.12 cm (28\")\nAdaptive-Sync Technologie: AMD FreeSync\nBildschirmtyp: IPS\nSeitenverh\u00e4ltnis: 16:9\nNative Aufl\u00f6sung: 4K 3840 x 2160 bei 60 Hz\nPixelpitch: 0.16 mm\nHelligkeit: 350 cd/m\u00b2\nKontrast: 1000:1\nReaktionszeit: 5 ms (Gray-to-Gray)\nFarbunterst\u00fctzung: 1,074 Milliarden Farben (10-Bit)\nEingangsanschl\u00fcsse: 2xHDMI, DisplayPort\nEinstellungen der Anzeigeposition: H\u00f6he, Pivot (Rotation), Drehung, Neigung\nBildschirmbeschichtung: Blendfrei\nAbmessungen (Breite x Tiefe x H\u00f6he) - mit Fu\u00df: 63.95 cm x 21.38 cm x 46.05 cm\nGewicht: 5.7 kg\nUmweltschutzstandards: ENERGY STAR-qualifiziert\nKennzeichnung: UL, VCCI, BSMI, cUL, WHQL, CB, CCC, FCC, RoHS, WEEE, PSE Mark, EAC, RCM, CEL level 1, TUV Rheinland Low Blue Light Certification, TUV Rheinland Flicker Free Certification, DisplayPort 1.2\nDisplay-Typ: LED-hintergrundbeleuchteter LCD-Monitor / TFT-Aktivmatrix\nDiagonalabmessung: 71.12 cm (28\")\nEnergie Effizienzklasse: G\nVertikale Bildwiederholrate: 40 - 60 Hz\nHorizontale Bildwiederholrate: 30 - 160 kHz\nHorizontaler Betrachtungswinkel: 178\nVertikaler Betrachtungswinkel: 178\nHintergrundbeleuchtungs-Technologie: LED-Hintergrundbeleuchtung\nBlendentyp: Flache Front\nBesonderheiten: HDCP, ASUS GamePlus, flimmerfreie Technologie, FreeSync Technology, Adaptive-Sync-Technologie, ASUS GameVisual Technology, 90% DCI-P3, GameFast Input Technology, HDR10-kompatibel, Ultra-Low Blue Light Technology, Low Blue Light-Technologie, Shadow Boost-Technologie, Multiple HDR-Modus\nAbmessungen (Breite x Tiefe x H\u00f6he): 63.95 cm x 21.38 cm x 46.05 cm - mit Fu\u00df\nTyp: Lautsprecher - Stereo\nAusgangsleistung/Kanal: 2 Watt\nSchnittstellen: 2 x HDMI  DisplayPort  Kopfh\u00f6rer\nNeigungswinkel: -5/20\nSchwenkwinkel: 30\nVESA-Halterung: 100 x 100 mm\nLeistungsmerkmale: Slot f\u00fcr Sicherheitsschloss (Kabelschloss getrennt erh\u00e4ltlich)\nSchlosstyp zur Diebstahlsicherung: Kensington Slot\nLeistungsaufnahme im Betrieb: 30 Watt\nStromverbrauch (Aus-Modus): 0.5 Watt\nDetails zu Abmessungen & Gewicht: Mit Fu\u00df - Breite: 63.95 cm - Tiefe: 21.38 cm - H\u00f6he: 46.05 cm - Gewicht: 5.7 kg  Ohne Fu\u00df - Breite: 63.95 cm - Tiefe: 6.565 cm - H\u00f6he: 36.935 cm - Gewicht: 4.73 kg\nTransportbreite: 70.6 cm\nTransporttiefe: 18 cm\nTransporth\u00f6he: 53 cm\nTransportgewicht: 7.8 kg\nENERGY STAR zertifiziert: Ja",
    "reference_file": "offer_reference_1611.json",
    "shop_name": "Jacob Elektronik direkt (AT)"
}