{
    "html_file": "offer_1548_0.html",
    "name": "Acer CB2 CB272Usmiiprx, 27\"",
    "offer_link": "https://www.1ashop.at/de/produkt/60372/acer-cb2-cb272usmiiprx-27-wqhd-hdmi-dp-hoehenverstellbar-lautsprecher.html",
    "price": 249.0,
    "raw_specifications": {
        "Abmessungen (Breite x Tiefe x H\u00f6he)": "61.2 cm x 23.4 cm x 52 cm - mit Fu\u00df",
        "Adaptive-Sync Technologie": "AMD FreeSync",
        "Ausgangsleistung/Kanal": "2 Watt",
        "Besonderheiten": "Acer Adaptive Contrast Management (ACM), ComfyView, Flimmerfrei-Technologie, Abblend-Technologie, an 3 Seiten ohne Blende, 8-bit Farbtiefe, BlueLightShield Technology, 99 % sRGB Farbraum",
        "Bildschirmbeschichtung": "Blendfrei",
        "Bildschirmtyp": "IPS",
        "Details zu Abmessungen & Gewicht": "Mit Fu\u00df - Breite: 61.2 cm - Tiefe: 23.4 cm - H\u00f6he: 52 cm - Gewicht: 5.84 kg  Ohne Fu\u00df - Breite: 61.2 cm - Tiefe: 6.8 cm - H\u00f6he: 36.6 cm - Gewicht: 4.32 kg",
        "Diagonalabmessung": "69 cm (27\")",
        "Display-Typ": "LED-hintergrundbeleuchteter LCD-Monitor / TFT-Aktivmatrix",
        "EAN/UPC": "4710180980141",
        "Eingangsspannung": "Wechselstrom 120/230 V (50/60 Hz)",
        "Einstellungen der Anzeigeposition": "H\u00f6he, Pivot (Rotation), Drehung, Neigung",
        "Energie Effizienzklasse": "Klasse G",
        "Energieklasse (HDR)": "Klasse G",
        "Energierverbrauch Sleep": "0.5 Watt",
        "Energieverbrauch pro Jahr": "40 kWh",
        "Enthaltene Kabel": "1 x HDMI-Kabel",
        "Farbe": "Silber",
        "Farbraum": "99% sRGB",
        "Farbunterst\u00fctzung": "16,7 Millionen Farben",
        "Gewicht": "5.84 kg",
        "Gruppe": "TFTs",
        "HDR-Format": "HDR10",
        "Helligkeit": "350 cd/m\u00b2",
        "Hersteller": "Acer",
        "Hersteller Art. Nr.": "UM.HB2EE.016",
        "Hintergrundbeleuchtungs-Technologie": "LED-Hintergrundbeleuchtung",
        "Horizontale Bildwiederholrate": "30 - 120 kHz",
        "Horizontaler Betrachtungswinkel": "178",
        "H\u00f6heneinstellung": "120 mm",
        "Kontrast": "1000:1 / 100000000:1 (dynamisch)",
        "Leistungsaufnahme im Ein-Zustand": "28 W",
        "Leistungsmerkmale": "Slot f\u00fcr Sicherheitsschloss (Kabelschloss getrennt erh\u00e4ltlich), Unterst\u00fctzung f\u00fcr VESA-Schnittstelle",
        "Max. Betriebstemperatur": "40 \u00b0C",
        "Min Betriebstemperatur": "0 \u00b0C",
        "Native Aufl\u00f6sung": "WQHD 2560 x 1440 bei 75 Hz",
        "Neigungswinkel": "-5/+25",
        "Pixelpitch": "0.2331 mm",
        "Reaktionszeit": "1 ms (VRB)",
        "Rotationswinkel": "180",
        "Schlosstyp zur Diebstahlsicherung": "Kensington Slot",
        "Schnittstellen": "2 x HDMI  DisplayPort  Audio Line-Out",
        "Schwenkwinkel": "360",
        "Seitenverh\u00e4ltnis": "16:9",
        "Sichtbare Bildfl\u00e4che": "68.6 cm (27\")",
        "Stromverbrauch (Aus-Modus)": "0.4 Watt",
        "Stromverbrauch (typisch)": "22 Watt",
        "Stromverbrauch HDR (eingeschaltet)": "44 kWh/1.000 h",
        "Stromverbrauch SDR (eingeschaltet)": "31 kWh/1.000 h",
        "TCO-zertifiziert": "TCO Certified Displays 8",
        "Typ": "Lautsprecher - Stereo",
        "VESA-Halterung": "100 x 100 mm",
        "Vertikale Bildwiederholrate": "48 - 75 Hz",
        "Vertikaler Betrachtungswinkel": "178",
        "Zul\u00e4ssige Luftfeuchtigkeit im Betrieb": "20 - 80%"
    },
    "raw_specifications_text": "Gruppe: TFTs\nHersteller: Acer\nHersteller Art. Nr.: UM.HB2EE.016\nEAN/UPC: 4710180980141\nDisplay-Typ: LED-hintergrundbeleuchteter LCD-Monitor / TFT-Aktivmatrix\nEnergie Effizienzklasse: Klasse G\nEnergieklasse (HDR): Klasse G\nEnergieverbrauch pro Jahr: 40 kWh\nDiagonalabmessung: 69 cm (27\")\nSichtbare Bildfl\u00e4che: 68.6 cm (27\")\nAdaptive-Sync Technologie: AMD FreeSync\nBildschirmtyp: IPS\nSeitenverh\u00e4ltnis: 16:9\nNative Aufl\u00f6sung: WQHD 2560 x 1440 bei 75 Hz\nPixelpitch: 0.2331 mm\nHelligkeit: 350 cd/m\u00b2\nKontrast: 1000:1 / 100000000:1 (dynamisch)\nHDR-Format: HDR10\nFarbunterst\u00fctzung: 16,7 Millionen Farben\nReaktionszeit: 1 ms (VRB)\nVertikale Bildwiederholrate: 48 - 75 Hz\nFarbraum: 99% sRGB\nHorizontale Bildwiederholrate: 30 - 120 kHz\nHorizontaler Betrachtungswinkel: 178\nVertikaler Betrachtungswinkel: 178\nBildschirmbeschichtung: Blendfrei\nHintergrundbeleuchtungs-Technologie: LED-Hintergrundbeleuchtung\nFarbe: Silber\nAbmessungen (Breite x Tiefe x H\u00f6he): 61.2 cm x 23.4 cm x 52 cm - mit Fu\u00df\nGewicht: 5.84 kg\nBesonderheiten: Acer Adaptive Contrast Management (ACM), ComfyView, Flimmerfrei-Technologie, Abblend-Technologie, an 3 Seiten ohne Blende, 8-bit Farbtiefe, BlueLightShield Technology, 99 % sRGB Farbraum\nMin Betriebstemperatur: 0 \u00b0C\nMax. Betriebstemperatur: 40 \u00b0C\nZul\u00e4ssige Luftfeuchtigkeit im Betrieb: 20 - 80%\nEingangsspannung: Wechselstrom 120/230 V (50/60 Hz)\nLeistungsaufnahme im Ein-Zustand: 28 W\nStromverbrauch (typisch): 22 Watt\nEnergierverbrauch Sleep: 0.5 Watt\nStromverbrauch SDR (eingeschaltet): 31 kWh/1.000 h\nStromverbrauch (Aus-Modus): 0.4 Watt\nStromverbrauch HDR (eingeschaltet): 44 kWh/1.000 h\nSchnittstellen: 2 x HDMI  DisplayPort  Audio Line-Out\nTyp: Lautsprecher - Stereo\nAusgangsleistung/Kanal: 2 Watt\nEinstellungen der Anzeigeposition: H\u00f6he, Pivot (Rotation), Drehung, Neigung\nNeigungswinkel: -5/+25\nSchwenkwinkel: 360\nRotationswinkel: 180\nH\u00f6heneinstellung: 120 mm\nVESA-Halterung: 100 x 100 mm\nLeistungsmerkmale: Slot f\u00fcr Sicherheitsschloss (Kabelschloss getrennt erh\u00e4ltlich), Unterst\u00fctzung f\u00fcr VESA-Schnittstelle\nEnthaltene Kabel: 1 x HDMI-Kabel\nSchlosstyp zur Diebstahlsicherung: Kensington Slot\nDetails zu Abmessungen & Gewicht: Mit Fu\u00df - Breite: 61.2 cm - Tiefe: 23.4 cm - H\u00f6he: 52 cm - Gewicht: 5.84 kg  Ohne Fu\u00df - Breite: 61.2 cm - Tiefe: 6.8 cm - H\u00f6he: 36.6 cm - Gewicht: 4.32 kg\nTCO-zertifiziert: TCO Certified Displays 8",
    "reference_file": "offer_reference_1548.json",
    "shop_name": "1ashop.at"
}