{
    "html_file": "offer_1596_32.html",
    "name": "HP Z24f G3, 23.8\"",
    "offer_link": "https://ms-it-beratung.at/shop/details.php?art=360622&artname=HP+Z24f+G3+IPS+FHD+1920x1080%4060Hz+DP%2FHDMI%2FVGA+300cd",
    "price": 242.0,
    "raw_specifications": {
        "AC Eingangsfrequenz": "50 - 60 Hz",
        "AC Eingangsspannung": "100 - 240 V",
        "AMD FreeSync": "Nein",
        "Anzahl DisplayPort Anschl\u00fcsse": "2",
        "Anzahl HDMI-Anschl\u00fcsse": "1",
        "Anzahl OSD-Sprachen": "10",
        "Anzahl der Upstream-Ports USB Typ-B": "1",
        "Anzahl der nachgeschalteten Steckpl\u00e4tze vom Typ USB-A": "4",
        "Audioanschl\u00fcsse": "Nein",
        "Betriebstemperatur": "5 - 35 \u00b0C",
        "Bildschirmdiagonale": "60,5 cm (23.8\")",
        "Bildschirmdiagonale (cm)": "60,45 cm",
        "Bildschirmform": "Flach",
        "Bildwinkel, horizontal": "178\u00b0",
        "Bildwinkel, vertikal": "178\u00b0",
        "Breite": "538,4 mm",
        "Breite (ohne Standfu\u00df)": "538,4 mm",
        "DVI Anschluss": "Nein",
        "Display-Aufl\u00f6sung": "1920 x 1080 Pixel",
        "DisplayPorts-Version": "1.2",
        "Eingebaute Lautsprecher": "Nein",
        "Energieeffizienzklasse (SDR)": "D",
        "Energieverbrauch (SDR) pro 1.000 Stunden": "13 kWh",
        "Ger\u00e4tebreite (inkl. Fu\u00df)": "53,8 mm",
        "Ger\u00e4teh\u00f6he (inkl. Fu\u00df)": "19,5 mm",
        "Ger\u00e4tetiefe (inkl. Fu\u00df)": "48,9 mm",
        "Gewicht": "4,7 kg",
        "Gewicht (mit St\u00e4nder)": "4,7 kg",
        "Gewicht (ohne St\u00e4nder)": "3,5 kg",
        "HD-Typ": "Full HD",
        "HDMI": "Ja",
        "HDMI-Version": "1.4",
        "Helligkeit (typisch)": "300 cd/m\u00b2",
        "Horizontaler Scanbereich": "30 - 75 kHz",
        "H\u00f6he": "313,7 mm",
        "H\u00f6he (ohne Standfu\u00df)": "31,4 mm",
        "H\u00f6heneinstellung": "15 cm",
        "H\u00f6henverstellung": "Nein",
        "Integrierte Kamera": "Nein",
        "Integrierter USB-Hub": "Ja",
        "Kabelsperre-Slot": "Ja",
        "Kontrastverh\u00e4ltnis": "1000:1",
        "Kontrastverh\u00e4ltnis (dynamisch)": "10000000:1",
        "Kopfh\u00f6rerausgang": "Nein",
        "Low-Blue-Light-Technologie": "Ja",
        "Luftfeuchtigkeit bei Lagerung": "5 - 95%",
        "Marktpositionierung": "Business",
        "Maximale Bildwiederholrate": "60 Hz",
        "Men\u00fcsprachen": "Vereinfachtes Chinesisch, Traditionelles Chinesisch, Deutsch, Niederl\u00e4ndisch, Englisch, Spanisch, Franz\u00f6sisch, Italienisch, Japanisch, Portugiesisch",
        "NVIDIA G-SYNC": "Nein",
        "Nachhaltige Technologien und Materialien": "Arsenfreies Bildschirmglas; Halogenarm; Quecksilberfreie Bildschirmhintergrundbeleuchtung; TCO Certified; TCO Certified Edge",
        "Nachhaltigkeitszertifikate": "ENERGY STAR",
        "Natives Seitenverh\u00e4ltnis": "16:9",
        "Neigungsverstellung": "Ja",
        "Neigungswinkelbereich": "-5 - 20\u00b0",
        "On-Screen-Display (OSD)": "Ja",
        "Paketgewicht": "7,2 kg",
        "Panel-Montage-Schnittstelle": "100 x 100 mm",
        "Panel-Typ": "IPS",
        "Pivot": "Ja",
        "Pivot Winkel": "-90 - 90\u00b0",
        "Pixel Abstand": "0,274 x 0,274 mm",
        "Produktfarbe": "Silber",
        "Reaktionszeit": "5 ms",
        "Relative Luftfeuchtigkeit in Betrieb": "20 - 80%",
        "Schwenkbar": "Ja",
        "Schwenkwinkelbereich": "-45 - 45\u00b0",
        "Schwermetallfrei": "Hg (Quecksilber)",
        "Sichtbare Gr\u00f6\u00dfe (diagonal)": "29,6 cm",
        "Sichtbare Gr\u00f6\u00dfe (horizontal)": "52,7 cm",
        "Stromverbrauch (Standardbetrieb)": "26 W",
        "Stromverbrauch (Standby)": "0,5 W",
        "Stromverbrauch (max.)": "58 W",
        "Tiefe": "38,5 mm",
        "Tiefe (ohne Standfu\u00df)": "3,85 mm",
        "Touchscreen": "Nein",
        "USB-Hub-Version": "3.2 Gen 1 (3.1 Gen 1)",
        "USB-Upstream-Porttyp": "USB Typ-B",
        "Unterst\u00fctzte Grafik-Aufl\u00f6sungen": "640 x 480 (VGA), 800 x 600 (SVGA), 1024 x 768 (XGA), 1280 x 1024 (SXGA), 1280 x 720 (HD 720), 1280 x 800 (WXGA), 1440 x 900 (WXGA+), 1600 x 900, 1680 x 1050 (WSXGA+), 1920 x 1080 (HD 1080)",
        "VESA-Halterung": "Ja",
        "Verpackungsbreite": "538,4 mm",
        "Verpackungsh\u00f6he": "489,3 mm",
        "Verpackungstiefe": "195 mm",
        "Vertikaler Scanbereich": "50 - 60 Hz",
        "Warentarifnummer (HS)": "85285210"
    },
    "raw_specifications_text": "Bildschirmdiagonale: 60,5 cm (23.8\")\nDisplay-Aufl\u00f6sung: 1920 x 1080 Pixel\nNatives Seitenverh\u00e4ltnis: 16:9\nTouchscreen: Nein\nHD-Typ: Full HD\nPanel-Typ: IPS\nHelligkeit (typisch): 300 cd/m\u00b2\nReaktionszeit: 5 ms\nBildschirmform: Flach\nUnterst\u00fctzte Grafik-Aufl\u00f6sungen: 640 x 480 (VGA), 800 x 600 (SVGA), 1024 x 768 (XGA), 1280 x 1024 (SXGA), 1280 x 720 (HD 720), 1280 x 800 (WXGA), 1440 x 900 (WXGA+), 1600 x 900, 1680 x 1050 (WSXGA+), 1920 x 1080 (HD 1080)\nKontrastverh\u00e4ltnis: 1000:1\nKontrastverh\u00e4ltnis (dynamisch): 10000000:1\nMaximale Bildwiederholrate: 60 Hz\nBildwinkel, horizontal: 178\u00b0\nBildwinkel, vertikal: 178\u00b0\nPixel Abstand: 0,274 x 0,274 mm\nHorizontaler Scanbereich: 30 - 75 kHz\nVertikaler Scanbereich: 50 - 60 Hz\nSichtbare Gr\u00f6\u00dfe (horizontal): 52,7 cm\nSichtbare Gr\u00f6\u00dfe (diagonal): 29,6 cm\nBildschirmdiagonale (cm): 60,45 cm\nNVIDIA G-SYNC: Nein\nAMD FreeSync: Nein\nLow-Blue-Light-Technologie: Ja\nEingebaute Lautsprecher: Nein\nIntegrierte Kamera: Nein\nMarktpositionierung: Business\nProduktfarbe: Silber\nSchwermetallfrei: Hg (Quecksilber)\nIntegrierter USB-Hub: Ja\nUSB-Hub-Version: 3.2 Gen 1 (3.1 Gen 1)\nUSB-Upstream-Porttyp: USB Typ-B\nAnzahl der Upstream-Ports USB Typ-B: 1\nAnzahl der nachgeschalteten Steckpl\u00e4tze vom Typ USB-A: 4\nDVI Anschluss: Nein\nHDMI: Ja\nAnzahl HDMI-Anschl\u00fcsse: 1\nHDMI-Version: 1.4\nAnzahl DisplayPort Anschl\u00fcsse: 2\nDisplayPorts-Version: 1.2\nAudioanschl\u00fcsse: Nein\nKopfh\u00f6rerausgang: Nein\nVESA-Halterung: Ja\nPanel-Montage-Schnittstelle: 100 x 100 mm\nKabelsperre-Slot: Ja\nH\u00f6henverstellung: Nein\nH\u00f6heneinstellung: 15 cm\nPivot: Ja\nPivot Winkel: -90 - 90\u00b0\nSchwenkbar: Ja\nSchwenkwinkelbereich: -45 - 45\u00b0\nNeigungswinkelbereich: -5 - 20\u00b0\nOn-Screen-Display (OSD): Ja\nMen\u00fcsprachen: Vereinfachtes Chinesisch, Traditionelles Chinesisch, Deutsch, Niederl\u00e4ndisch, Englisch, Spanisch, Franz\u00f6sisch, Italienisch, Japanisch, Portugiesisch\nAnzahl OSD-Sprachen: 10\nNeigungsverstellung: Ja\nEnergieeffizienzklasse (SDR): D\nEnergieverbrauch (SDR) pro 1.000 Stunden: 13 kWh\nStromverbrauch (Standardbetrieb): 26 W\nStromverbrauch (Standby): 0,5 W\nStromverbrauch (max.): 58 W\nAC Eingangsspannung: 100 - 240 V\nAC Eingangsfrequenz: 50 - 60 Hz\nBetriebstemperatur: 5 - 35 \u00b0C\nRelative Luftfeuchtigkeit in Betrieb: 20 - 80%\nLuftfeuchtigkeit bei Lagerung: 5 - 95%\nGer\u00e4tebreite (inkl. Fu\u00df): 53,8 mm\nGer\u00e4tetiefe (inkl. Fu\u00df): 48,9 mm\nGer\u00e4teh\u00f6he (inkl. Fu\u00df): 19,5 mm\nGewicht (mit St\u00e4nder): 4,7 kg\nBreite (ohne Standfu\u00df): 538,4 mm\nTiefe (ohne Standfu\u00df): 3,85 mm\nH\u00f6he (ohne Standfu\u00df): 31,4 mm\nGewicht (ohne St\u00e4nder): 3,5 kg\nVerpackungsbreite: 538,4 mm\nVerpackungstiefe: 195 mm\nVerpackungsh\u00f6he: 489,3 mm\nPaketgewicht: 7,2 kg\nNachhaltigkeitszertifikate: ENERGY STAR\nNachhaltige Technologien und Materialien: Arsenfreies Bildschirmglas; Halogenarm; Quecksilberfreie Bildschirmhintergrundbeleuchtung; TCO Certified; TCO Certified Edge\nWarentarifnummer (HS): 85285210\nBreite: 538,4 mm\nGewicht: 4,7 kg\nTiefe: 38,5 mm\nH\u00f6he: 313,7 mm",
    "reference_file": "offer_reference_1596.json",
    "shop_name": "ms-it-beratung"
}