{
    "html_file": "offer_1424_5.html",
    "name": "BenQ PD2725U, 27\"",
    "offer_link": "https://www.mylemon.at/artikel/benq/9h_ljxla_tbe/68-6cm-pd2725u-16-9.html",
    "price": 754.13,
    "raw_specifications": {
        "AC Eingangsspannung": "100 - 240 V",
        "Abnehmbarer Standfu\u00df": "Ja",
        "Anzahl DisplayPort Anschl\u00fcsse": "1",
        "Anzahl HDMI-Anschl\u00fcsse": "2",
        "Anzahl Thunderbolt 3 Anschl\u00fcsse": "1",
        "Anzahl der Farben des Displays": "1,07 Milliarden Farben",
        "Anzahl der Lautsprecher": "2",
        "Anzahl der Upstream-Ports USB Typ-B": "1",
        "Anzahl der nachgeschalteten Steckpl\u00e4tze vom Typ USB-A": "2",
        "Artikelnummer": "M15Y1RSL",
        "Aufl\u00f6sung": "3840x2160",
        "Besonderheiten": "60 Hz",
        "Bild-in-Bild": "Ja",
        "Bildschirmdiagonale": "68,6 cm (27 Zoll)",
        "Bildschirmform": "Flach",
        "Bildschirmtechnologie": "LED",
        "Bildwinkel, horizontal": "178\u00b0",
        "Bildwinkel, vertikal": "178\u00b0",
        "Blendfreier Bildschirm": "Ja",
        "Breite (ohne Standfu\u00df)": "61,5 cm",
        "DVI Anschluss": "Nein",
        "Display-Aufl\u00f6sung": "3840 x 2160 Pixel",
        "DisplayPorts-Version": "1.4",
        "Displaygr\u00f6\u00dfe": "27 Zoll",
        "EAN": "4718755084973",
        "Eingebaute Lautsprecher": "Ja",
        "Energieeffizienzklasse (HDR)": "G",
        "Energieeffizienzklasse (SDR)": "G",
        "Energieeffizienzskala": "A bis G",
        "Energieverbrauch (HDR) pro 1.000 Stunden": "44 kWh",
        "Energieverbrauch (SDR) pro 1.000 Stunden": "44 kWh",
        "Ergonomie": "H\u00f6henverstellbar, Pivot (90 Grad drehbar), Schwenkbar, Neigbar",
        "Flimmerfreie Technologie": "Ja",
        "Fu\u00dffarbe": "Grau",
        "Ger\u00e4tebreite (inkl. Fu\u00df)": "614,8 mm",
        "Ger\u00e4teh\u00f6he (inkl. Fu\u00df)": "499,8 mm",
        "Ger\u00e4tetiefe (inkl. Fu\u00df)": "188,1 mm",
        "Gewicht (mit St\u00e4nder)": "8,3 kg",
        "Gewicht (ohne St\u00e4nder)": "5,6 kg",
        "HD-Typ": "4K Ultra HD",
        "HDCP": "Ja",
        "HDCP-Version": "2.2",
        "HDMI": "Ja",
        "HDMI-Version": "2.0",
        "Helligkeit": "250 cd/m\u00b2",
        "Helligkeit (typisch)": "250 cd/m\u00b2",
        "Hersteller Artikelnummer": "9H.LJXLA.TBE",
        "High Dynamic Range Video (HDR) Unterst\u00fctzung": "Ja",
        "H\u00f6he (ohne Standfu\u00df)": "36 cm",
        "H\u00f6heneinstellung": "15 cm",
        "H\u00f6henverstellung": "Ja",
        "Integrierte Kamera": "Nein",
        "Integrierter USB-Hub": "Ja",
        "Kontrastverh\u00e4ltnis": "1200:1",
        "Low-Blue-Light-Technologie": "Ja",
        "Marktpositionierung": "Grafikdesign",
        "Maximale Bildwiederholrate": "60 Hz",
        "Natives Seitenverh\u00e4ltnis": "16:9",
        "Neigungsverstellung": "Ja",
        "Neigungswinkelbereich": "-5 - 20\u00b0",
        "Panel": "IPS",
        "Panel-Montage-Schnittstelle": "100 x 100 mm",
        "Panel-Typ": "IPS",
        "Pivot": "Ja",
        "Pivot Winkel": "0 - 90\u00b0",
        "Produktfarbe": "Schwarz",
        "RGB-Farbraum": "DCI-P3",
        "RMS-Leistung": "5 W",
        "Reaktionszeit": "5 ms",
        "Reaktionszeit (schnell)": "5 ms",
        "Schwenkbar": "Ja",
        "Schwenkwinkelbereich": "-30 - 30\u00b0",
        "Seitenverh\u00e4ltnis": "16:9",
        "Stromverbrauch (Standardbetrieb)": "44 W",
        "Stromverbrauch (Standby)": "0,5 W",
        "Stromverbrauch (max.)": "185 W",
        "Technologie mit hohem Dynamikbereich (HDR)": "DisplayHDR 400, High Dynamic Range 10 (HDR10)",
        "Tiefe (ohne Standfu\u00df)": "8,03 cm",
        "Touchscreen": "Nein",
        "USB-Hub-Version": "3.2 Gen 1 (3.1 Gen 1)",
        "USB-Upstream-Porttyp": "USB Typ-B",
        "Unterst\u00fctzte Grafik-Aufl\u00f6sungen": "3840 x 2160",
        "Ursprungsland": "China",
        "VESA-Halterung": "Ja",
        "Video Anschl\u00fcsse": "2x HDMI, 1x DisplayPort, 2x Thunderbolt",
        "Vorderer Rahmen": "Schwarz",
        "Warentarifnummer (HS)": "85285210",
        "sRGB Abdeckung (klassisch)": "100%"
    },
    "raw_specifications_text": "Displaygr\u00f6\u00dfe: 27 Zoll\nAufl\u00f6sung: 3840x2160\nPanel: IPS\nReaktionszeit: 5 ms\nVideo Anschl\u00fcsse: 2x HDMI, 1x DisplayPort, 2x Thunderbolt\nErgonomie: H\u00f6henverstellbar, Pivot (90 Grad drehbar), Schwenkbar, Neigbar\nHelligkeit: 250 cd/m\u00b2\nBesonderheiten: 60 Hz\nHersteller Artikelnummer: 9H.LJXLA.TBE\nEAN: 4718755084973\nArtikelnummer: M15Y1RSL\nBildschirmdiagonale: 68,6 cm (27 Zoll)\nDisplay-Aufl\u00f6sung: 3840 x 2160 Pixel\nNatives Seitenverh\u00e4ltnis: 16:9\nBildschirmtechnologie: LED\nTouchscreen: Nein\nHD-Typ: 4K Ultra HD\nPanel-Typ: IPS\nBildschirmform: Flach\nKontrastverh\u00e4ltnis: 1200:1\nMaximale Bildwiederholrate: 60 Hz\nAnzahl der Farben des Displays: 1,07 Milliarden Farben\nHelligkeit (typisch): 250 cd/m\u00b2\nBlendfreier Bildschirm: Ja\nUnterst\u00fctzte Grafik-Aufl\u00f6sungen: 3840 x 2160\nSeitenverh\u00e4ltnis: 16:9\nBildwinkel, horizontal: 178\u00b0\nBildwinkel, vertikal: 178\u00b0\nReaktionszeit (schnell): 5 ms\nHigh Dynamic Range Video (HDR) Unterst\u00fctzung: Ja\nTechnologie mit hohem Dynamikbereich (HDR): DisplayHDR 400, High Dynamic Range 10 (HDR10)\nRGB-Farbraum: DCI-P3\nsRGB Abdeckung (klassisch): 100%\nFlimmerfreie Technologie: Ja\nLow-Blue-Light-Technologie: Ja\nEingebaute Lautsprecher: Ja\nIntegrierte Kamera: Nein\nAnzahl der Lautsprecher: 2\nRMS-Leistung: 5 W\nMarktpositionierung: Grafikdesign\nProduktfarbe: Schwarz\nVorderer Rahmen: Schwarz\nAbnehmbarer Standfu\u00df: Ja\nFu\u00dffarbe: Grau\nUrsprungsland: China\nIntegrierter USB-Hub: Ja\nHDMI: Ja\nUSB-Hub-Version: 3.2 Gen 1 (3.1 Gen 1)\nUSB-Upstream-Porttyp: USB Typ-B\nAnzahl der Upstream-Ports USB Typ-B: 1\nAnzahl der nachgeschalteten Steckpl\u00e4tze vom Typ USB-A: 2\nDVI Anschluss: Nein\nAnzahl HDMI-Anschl\u00fcsse: 2\nHDMI-Version: 2.0\nAnzahl DisplayPort Anschl\u00fcsse: 1\nDisplayPorts-Version: 1.4\nAnzahl Thunderbolt 3 Anschl\u00fcsse: 1\nHDCP: Ja\nHDCP-Version: 2.2\nVESA-Halterung: Ja\nH\u00f6henverstellung: Ja\nPanel-Montage-Schnittstelle: 100 x 100 mm\nH\u00f6heneinstellung: 15 cm\nPivot: Ja\nPivot Winkel: 0 - 90\u00b0\nSchwenkbar: Ja\nSchwenkwinkelbereich: -30 - 30\u00b0\nNeigungswinkelbereich: -5 - 20\u00b0\nBild-in-Bild: Ja\nNeigungsverstellung: Ja\nEnergieeffizienzklasse (SDR): G\nEnergieeffizienzklasse (HDR): G\nEnergieverbrauch (SDR) pro 1.000 Stunden: 44 kWh\nEnergieverbrauch (HDR) pro 1.000 Stunden: 44 kWh\nStromverbrauch (Standardbetrieb): 44 W\nStromverbrauch (Standby): 0,5 W\nStromverbrauch (max.): 185 W\nAC Eingangsspannung: 100 - 240 V\nEnergieeffizienzskala: A bis G\nGer\u00e4tebreite (inkl. Fu\u00df): 614,8 mm\nGer\u00e4tetiefe (inkl. Fu\u00df): 188,1 mm\nGer\u00e4teh\u00f6he (inkl. Fu\u00df): 499,8 mm\nGewicht (mit St\u00e4nder): 8,3 kg\nBreite (ohne Standfu\u00df): 61,5 cm\nTiefe (ohne Standfu\u00df): 8,03 cm\nH\u00f6he (ohne Standfu\u00df): 36 cm\nGewicht (ohne St\u00e4nder): 5,6 kg\nWarentarifnummer (HS): 85285210",
    "reference_file": "offer_reference_1424.json",
    "shop_name": "mylemon.at"
}