{
    "html_file": "offer_1957_0.html",
    "name": "Samsung Odyssey G7 G73T / G74T / G75T (2020), 31.5\"",
    "offer_link": "https://direkt.jacob.de/produkte/samsung-monitor-odyssey-lc32g75tqsuxen-artnr-6499328.html?utm_source=geizhals&utm_medium=cpc&utm_campaign=Preisvergleich&ref=103",
    "price": 691.62,
    "raw_specifications": {
        "Abmessungen (Breite x Tiefe x H\u00f6he)": "71.01 cm x 30.59 cm x 59.45 cm - mit Fu\u00df",
        "Abmessungen (Breite x Tiefe x H\u00f6he) - mit Fu\u00df": "71.01 cm x 30.59 cm x 59.45 cm",
        "Adaptive-Sync Technologie": "NVIDIA G-SYNC, AMD FreeSync Premium Pro",
        "Besonderheiten": "HighBrightness, Cinema Mode, Mega Dynamic Contrast Ratio, Black eQualizer, CustomColor Mode, FPS Mode, flimmerfreie Technologie, RTS Mode, extra schnelles Aufladen \u00fcber USB, Eye Saver Mode, Werkstuning, Quantum Dot Technology, 125% sRGB-Farbskala, Screen Size Optimizer, DCI-P3 95 % Farbraum, RPG Mode, AOS Mode, sRGB Mode, Picture-in-Picture, Picture-by-Picture, Off Timer, HDR 600, Dynamic Contrast Mode, Low Input Delay Mode, Super Arena Gaming Experience, Aktualisierungsraten-Optimierer",
        "Bildschirmtyp": "VA",
        "Details zu Abmessungen & Gewicht": "Mit Fu\u00df - Breite: 71.01 cm - Tiefe: 30.59 cm - H\u00f6he: 59.45 cm - Gewicht: 8.2 kg  Ohne Fu\u00df - Breite: 71.01 cm - Tiefe: 18.71 cm - H\u00f6he: 43.91 cm - Gewicht: 6.5 kg",
        "Diagonalabmessung": "80 cm (32\")",
        "Ein-/Aus-Schalter": "Ja",
        "Eingangsanschl\u00fcsse": "HDMI, 2xDisplayPort",
        "Einstellungen der Anzeigeposition": "H\u00f6he, Pivot (Rotation), swivel, tilt",
        "Energie Effizienzklasse": "G",
        "Energieverbrauch pro Jahr": "107 kWh",
        "Enthaltene Kabel": "1 x DisplayPort-Kabel  1 x SuperSpeed-USB-Kabel",
        "Erforderliche Netzspannung": "Wechselstrom 120/230 V",
        "Farbe": "Schwarz",
        "Farbunterst\u00fctzung": "1,07 Mrd. Farben",
        "Ger\u00e4tetyp": "QLED-Monitor - 80 cm (32\")",
        "Geschwungener Bildschirm": "Ja (1000R)",
        "Gewicht": "8.2 kg",
        "Helligkeit": "600 cd/m\u00b2",
        "Hintergrundbeleuchtungs-Technologie": "LED-Hintergrundbeleuchtung",
        "Horizontaler Betrachtungswinkel": "178",
        "H\u00f6heneinstellung": "120 mm",
        "Integrierte Peripherieger\u00e4te": "USB 3.0-Hub",
        "Kennzeichnung": "DisplayPort 1.4",
        "Kontrast": "2500:1",
        "Leistungsaufnahme im Betrieb": "73 Watt",
        "Leistungsaufnahme im Ein-Zustand": "73 W",
        "Leistungsmerkmale": "Slot f\u00fcr Sicherheitsschloss (Kabelschloss getrennt erh\u00e4ltlich)",
        "Max. Betriebstemperatur": "40 \u00b0C",
        "Min Betriebstemperatur": "10 \u00b0C",
        "Native Aufl\u00f6sung": "WQHD 2560 x 1440 bei 240 Hz",
        "Neigungswinkel": "-9/+13",
        "Produktbeschreibung": "Samsung Odyssey G7 C32G75TQSU - G75T Series - QLED-Monitor - gebogen - 80 cm (32\")",
        "Reaktionszeit": "1 ms (Gray-to-Gray)",
        "Rotationswinkel": "-2/+92",
        "Schlosstyp zur Diebstahlsicherung": "Kensington Slot",
        "Schnittstellen": "2 x DisplayPort  HDMI  Kopfh\u00f6rer  2 x USB 3.0",
        "Schwenkwinkel": "30",
        "Seitenverh\u00e4ltnis": "16:9",
        "Sichtbare Bildfl\u00e4che": "80 cm (31.5\")",
        "Stromverbrauch (Aus-Modus)": "0.3 Watt",
        "Stromverbrauch im Standby-Modus": "0.5 Watt",
        "Transportbreite": "80.6 cm",
        "Transportgewicht": "13.2 kg",
        "Transporth\u00f6he": "27.2 cm",
        "Transporttiefe": "52 cm",
        "VESA-Halterung": "100 x 100 mm",
        "Vertikaler Betrachtungswinkel": "178",
        "Zul\u00e4ssige Luftfeuchtigkeit im Betrieb": "10 - 80% (nicht kondensierend)"
    },
    "raw_specifications_text": "Produktbeschreibung: Samsung Odyssey G7 C32G75TQSU - G75T Series - QLED-Monitor - gebogen - 80 cm (32\")\nGer\u00e4tetyp: QLED-Monitor - 80 cm (32\")\nEnergie Effizienzklasse: G\nEnergieverbrauch pro Jahr: 107 kWh\nLeistungsaufnahme im Ein-Zustand: 73 W\nGeschwungener Bildschirm: Ja (1000R)\nAdaptive-Sync Technologie: NVIDIA G-SYNC, AMD FreeSync Premium Pro\nLeistungsmerkmale: Slot f\u00fcr Sicherheitsschloss (Kabelschloss getrennt erh\u00e4ltlich)\nBildschirmtyp: VA\nSeitenverh\u00e4ltnis: 16:9\nNative Aufl\u00f6sung: WQHD 2560 x 1440 bei 240 Hz\nHelligkeit: 600 cd/m\u00b2\nKontrast: 2500:1\nReaktionszeit: 1 ms (Gray-to-Gray)\nFarbunterst\u00fctzung: 1,07 Mrd. Farben\nEingangsanschl\u00fcsse: HDMI, 2xDisplayPort\nEinstellungen der Anzeigeposition: H\u00f6he, Pivot (Rotation), swivel, tilt\nFarbe: Schwarz\nAbmessungen (Breite x Tiefe x H\u00f6he) - mit Fu\u00df: 71.01 cm x 30.59 cm x 59.45 cm\nGewicht: 8.2 kg\nKennzeichnung: DisplayPort 1.4\nDiagonalabmessung: 80 cm (32\")\nSichtbare Bildfl\u00e4che: 80 cm (31.5\")\nIntegrierte Peripherieger\u00e4te: USB 3.0-Hub\nHorizontaler Betrachtungswinkel: 178\nVertikaler Betrachtungswinkel: 178\nHintergrundbeleuchtungs-Technologie: LED-Hintergrundbeleuchtung\nBesonderheiten: HighBrightness, Cinema Mode, Mega Dynamic Contrast Ratio, Black eQualizer, CustomColor Mode, FPS Mode, flimmerfreie Technologie, RTS Mode, extra schnelles Aufladen \u00fcber USB, Eye Saver Mode, Werkstuning, Quantum Dot Technology, 125% sRGB-Farbskala, Screen Size Optimizer, DCI-P3 95 % Farbraum, RPG Mode, AOS Mode, sRGB Mode, Picture-in-Picture, Picture-by-Picture, Off Timer, HDR 600, Dynamic Contrast Mode, Low Input Delay Mode, Super Arena Gaming Experience, Aktualisierungsraten-Optimierer\nAbmessungen (Breite x Tiefe x H\u00f6he): 71.01 cm x 30.59 cm x 59.45 cm - mit Fu\u00df\nSchnittstellen: 2 x DisplayPort  HDMI  Kopfh\u00f6rer  2 x USB 3.0\nNeigungswinkel: -9/+13\nSchwenkwinkel: 30\nRotationswinkel: -2/+92\nH\u00f6heneinstellung: 120 mm\nVESA-Halterung: 100 x 100 mm\nEnthaltene Kabel: 1 x DisplayPort-Kabel  1 x SuperSpeed-USB-Kabel\nSchlosstyp zur Diebstahlsicherung: Kensington Slot\nErforderliche Netzspannung: Wechselstrom 120/230 V\nLeistungsaufnahme im Betrieb: 73 Watt\nStromverbrauch im Standby-Modus: 0.5 Watt\nStromverbrauch (Aus-Modus): 0.3 Watt\nEin-/Aus-Schalter: Ja\nDetails zu Abmessungen & Gewicht: Mit Fu\u00df - Breite: 71.01 cm - Tiefe: 30.59 cm - H\u00f6he: 59.45 cm - Gewicht: 8.2 kg  Ohne Fu\u00df - Breite: 71.01 cm - Tiefe: 18.71 cm - H\u00f6he: 43.91 cm - Gewicht: 6.5 kg\nTransportbreite: 80.6 cm\nTransporttiefe: 52 cm\nTransporth\u00f6he: 27.2 cm\nTransportgewicht: 13.2 kg\nMin Betriebstemperatur: 10 \u00b0C\nMax. Betriebstemperatur: 40 \u00b0C\nZul\u00e4ssige Luftfeuchtigkeit im Betrieb: 10 - 80% (nicht kondensierend)",
    "reference_file": "offer_reference_1957.json",
    "shop_name": "Jacob Elektronik direkt (AT)"
}