{
    "html_file": "offer_826_3.html",
    "name": "Lenovo Q27h-20, 27\"",
    "offer_link": "https://www.mylemon.at/artikel/lenovo/66eduac1eu/q27h-20-68-6cm-27.html",
    "price": 264.07,
    "raw_specifications": {
        "AC Eingangsfrequenz": "50/60 Hz",
        "AC Eingangsspannung": "100 - 240 V",
        "AMD FreeSync": "Ja",
        "Anzahl DisplayPort Anschl\u00fcsse": "1",
        "Anzahl HDMI-Anschl\u00fcsse": "2",
        "Anzahl der Farben des Displays": "1,07 Milliarden Farben",
        "Anzahl der Lautsprecher": "2",
        "Anzahl der Upstream-Ports USB Typ-C": "1",
        "Anzahl der nachgeschalteten Ports vom Typ USB-C": "1",
        "Anzahl der nachgeschalteten Steckpl\u00e4tze vom Typ USB-A": "3",
        "Artikelnummer": "M1DYUQGL",
        "Aufl\u00f6sung": "2560x1440",
        "Besonderheiten": "Lautsprecher, USB HUB",
        "Bezel Weite (bottom)": "2 mm",
        "Bezel Weite (side)": "2 mm",
        "Bezel Weite (top)": "2 mm",
        "Bildschirmdiagonale": "68,6 cm (27 Zoll)",
        "Bildschirmform": "Flach",
        "Bildwinkel, horizontal": "178\u00b0",
        "Bildwinkel, vertikal": "178\u00b0",
        "Blendfreier Bildschirm": "Ja",
        "Breite (ohne Standfu\u00df)": "61,3 cm",
        "Display-Aufl\u00f6sung": "2560 x 1440 Pixel",
        "DisplayPorts-Version": "1.4",
        "Displaygr\u00f6\u00dfe": "27 Zoll",
        "EAN": "0196378003245",
        "Eingebaute Lautsprecher": "Ja",
        "Ergonomie": "H\u00f6henverstellbar, Neigbar",
        "Farbskala": "95%",
        "Farbtiefe": "10 Bit",
        "Ger\u00e4tebreite (inkl. Fu\u00df)": "613,4 mm",
        "Ger\u00e4tetiefe (inkl. Fu\u00df)": "186,9 mm",
        "Gewicht (mit St\u00e4nder)": "6,3 kg",
        "Gewicht (ohne St\u00e4nder)": "4,4 kg",
        "HD-Typ": "Quad HD",
        "HDMI": "Ja",
        "HDMI-Kabell\u00e4nge": "1,8 m",
        "HDMI-Version": "2.0",
        "Helligkeit": "350 cd/m\u00b2",
        "Helligkeit (typisch)": "350 cd/m\u00b2",
        "Hersteller Artikelnummer": "66EDUAC1EU",
        "H\u00f6he (ohne Standfu\u00df)": "35,3 cm",
        "H\u00f6heneinstellung": "8 cm",
        "H\u00f6henverstellung": "Ja",
        "Integrierter USB-Hub": "Ja",
        "Kabelsperre-Slot": "Ja",
        "Kontrastverh\u00e4ltnis": "1000:1",
        "Kontrastverh\u00e4ltnis (dynamisch)": "3000000:1",
        "Kopfh\u00f6rerausgang": "Ja",
        "Low-Blue-Light-Technologie": "Ja",
        "Maximale Bildwiederholrate": "70 Hz",
        "Mitgelieferte Kabel": "AC, HDMI, USB",
        "Name der Farbe": "Cloud Grey",
        "Natives Seitenverh\u00e4ltnis": "16:9",
        "Neigungsverstellung": "Ja",
        "Neigungswinkelbereich": "-5 - 22\u00b0",
        "Paketgewicht": "9,3 kg",
        "Panel": "IPS",
        "Panel-Montage-Schnittstelle": "100 x 100 mm",
        "Panel-Typ": "IPS",
        "Pixel Abstand": "0,233 x 0,233 mm",
        "Pixeldichte": "109 ppi",
        "Produktfarbe": "Grau",
        "RGB-Farbraum": "DCI-P3",
        "RMS-Leistung": "6 W",
        "Reaktionszeit": "7 ms",
        "Reaktionszeit (schnell)": "4 ms",
        "Sichtbare Gr\u00f6\u00dfe (horizontal)": "59,7 cm",
        "Sichtbare Gr\u00f6\u00dfe (vertikal)": "33,6 cm",
        "Slot-Typ Kabelsperre": "Kensington",
        "Stromverbrauch (Standardbetrieb)": "26 W",
        "Stromverbrauch (aus)": "0,5 W",
        "Stromverbrauch (max.)": "150 W",
        "St\u00e4nder enthalten": "Ja",
        "Tiefe (ohne Standfu\u00df)": "4,18 cm",
        "Touchscreen": "Nein",
        "Typ der Hintergrundbeleuchtung": "W-LED",
        "USB Power Delivery": "Ja",
        "USB-Typ-C DisplayPort-Wechselmodus": "Ja",
        "VESA-Halterung": "Ja",
        "Verpackungsbreite": "715 mm",
        "Verpackungsh\u00f6he": "142 mm",
        "Verpackungstiefe": "470 mm",
        "Video Anschl\u00fcsse": "3x USB",
        "Zertifizierung": "CCC, RoHS, Tier 2, T\u00dcV",
        "sRGB Abdeckung (klassisch)": "99%"
    },
    "raw_specifications_text": "Displaygr\u00f6\u00dfe: 27 Zoll\nAufl\u00f6sung: 2560x1440\nPanel: IPS\nReaktionszeit: 7 ms\nVideo Anschl\u00fcsse: 3x USB\nErgonomie: H\u00f6henverstellbar, Neigbar\nHelligkeit: 350 cd/m\u00b2\nBesonderheiten: Lautsprecher, USB HUB\nHersteller Artikelnummer: 66EDUAC1EU\nEAN: 0196378003245\nArtikelnummer: M1DYUQGL\nBildschirmdiagonale: 68,6 cm (27 Zoll)\nDisplay-Aufl\u00f6sung: 2560 x 1440 Pixel\nNatives Seitenverh\u00e4ltnis: 16:9\nTouchscreen: Nein\nHD-Typ: Quad HD\nPanel-Typ: IPS\nBildschirmform: Flach\nKontrastverh\u00e4ltnis: 1000:1\nMaximale Bildwiederholrate: 70 Hz\nAnzahl der Farben des Displays: 1,07 Milliarden Farben\nTyp der Hintergrundbeleuchtung: W-LED\nHelligkeit (typisch): 350 cd/m\u00b2\nBlendfreier Bildschirm: Ja\nKontrastverh\u00e4ltnis (dynamisch): 3000000:1\nBildwinkel, horizontal: 178\u00b0\nBildwinkel, vertikal: 178\u00b0\nReaktionszeit (schnell): 4 ms\nPixel Abstand: 0,233 x 0,233 mm\nPixeldichte: 109 ppi\nSichtbare Gr\u00f6\u00dfe (horizontal): 59,7 cm\nSichtbare Gr\u00f6\u00dfe (vertikal): 33,6 cm\nFarbtiefe: 10 Bit\nRGB-Farbraum: DCI-P3\nFarbskala: 95%\nsRGB Abdeckung (klassisch): 99%\nAMD FreeSync: Ja\nLow-Blue-Light-Technologie: Ja\nEingebaute Lautsprecher: Ja\nAnzahl der Lautsprecher: 2\nRMS-Leistung: 6 W\nProduktfarbe: Grau\nName der Farbe: Cloud Grey\nZertifizierung: CCC, RoHS, Tier 2, T\u00dcV\nIntegrierter USB-Hub: Ja\nHDMI: Ja\nKopfh\u00f6rerausgang: Ja\nAnzahl der Upstream-Ports USB Typ-C: 1\nAnzahl der nachgeschalteten Steckpl\u00e4tze vom Typ USB-A: 3\nAnzahl der nachgeschalteten Ports vom Typ USB-C: 1\nUSB-Typ-C DisplayPort-Wechselmodus: Ja\nUSB Power Delivery: Ja\nAnzahl HDMI-Anschl\u00fcsse: 2\nHDMI-Version: 2.0\nAnzahl DisplayPort Anschl\u00fcsse: 1\nDisplayPorts-Version: 1.4\nVESA-Halterung: Ja\nKabelsperre-Slot: Ja\nH\u00f6henverstellung: Ja\nPanel-Montage-Schnittstelle: 100 x 100 mm\nSlot-Typ Kabelsperre: Kensington\nH\u00f6heneinstellung: 8 cm\nNeigungswinkelbereich: -5 - 22\u00b0\nNeigungsverstellung: Ja\nStromverbrauch (Standardbetrieb): 26 W\nStromverbrauch (max.): 150 W\nStromverbrauch (aus): 0,5 W\nAC Eingangsspannung: 100 - 240 V\nAC Eingangsfrequenz: 50/60 Hz\nSt\u00e4nder enthalten: Ja\nMitgelieferte Kabel: AC, HDMI, USB\nHDMI-Kabell\u00e4nge: 1,8 m\nGer\u00e4tebreite (inkl. Fu\u00df): 613,4 mm\nGer\u00e4tetiefe (inkl. Fu\u00df): 186,9 mm\nGewicht (mit St\u00e4nder): 6,3 kg\nBreite (ohne Standfu\u00df): 61,3 cm\nTiefe (ohne Standfu\u00df): 4,18 cm\nH\u00f6he (ohne Standfu\u00df): 35,3 cm\nGewicht (ohne St\u00e4nder): 4,4 kg\nBezel Weite (side): 2 mm\nBezel Weite (top): 2 mm\nBezel Weite (bottom): 2 mm\nVerpackungsbreite: 715 mm\nVerpackungstiefe: 470 mm\nVerpackungsh\u00f6he: 142 mm\nPaketgewicht: 9,3 kg",
    "reference_file": "offer_reference_826.json",
    "shop_name": "mylemon.at"
}