{
    "html_file": "offer_1003_1.html",
    "name": "Dell G3223D, 31.5\"",
    "offer_link": "https://www.proshop.at/Bildschirm/Dell-32-Bildschirm-G3223D-2560x1440-QHD-165Hz-Fast-IPS-USB-C-HUB-Black-1-ms-AMD-FreeSync/3065944?utm_source=geizhals&utm_medium=cpc&utm_campaign=pricesite",
    "price": 421.13,
    "raw_specifications": {
        "Abmessungen (Breite x Tiefe x H\u00f6he)": "71.315 cm x 24.694 cm x 55.6 cm - mit Fu\u00df",
        "Abmessungen (Breite x Tiefe x H\u00f6he) - mit Fu\u00df": "71.315 cm x 24.694 cm x 55.6 cm",
        "Adaptive-Sync Technologie": "AMD FreeSync, NVIDIA G-SYNC",
        "Besonderheiten": "8-bit + A-FRC Farbtiefe, Dell ComfortView Plus",
        "Bildschirmbeschichtung": "Blendfrei, 3H Hard Coating",
        "Bildschirmtyp": "Fast IPS",
        "Details zu Abmessungen & Gewicht": "Mit Fu\u00df - Breite: 24.694 cm - Tiefe: 6.861 cm - H\u00f6he: 55.6 cm - Gewicht: 12.9 kg  Ohne Fu\u00df - Breite: 71.315 cm - Tiefe: 6.861 cm - H\u00f6he: 42.712 cm - Gewicht: 5.72 kg",
        "Diagonalabmessung": "81.3 cm (32\")",
        "Display-Typ": "LED-hintergrundbeleuchteter LCD-Monitor / TFT-Aktivmatrix",
        "EAN": "5397184657386",
        "Ein-/Aus-Schalter": "Ja",
        "Eingangsanschl\u00fcsse": "2xHDMI, DisplayPort, USB-C",
        "Eingangsspannung": "Wechselstrom 100-240 V (50/60 Hz)",
        "Einstellungen der Anzeigeposition": "H\u00f6he, Drehung, Neigung",
        "Energie Effizienzklasse": "Klasse G",
        "Energieklasse (HDR)": "Klasse G",
        "Energierverbrauch Sleep": "0.3 Watt",
        "Enthaltene Kabel": "1 x DisplayPort-Kabel  1 x USB-C Kabel",
        "Farbraum": "95% DCI-P3 (CIE 1976)",
        "Farbunterst\u00fctzung": "1,07 Mrd. Farben",
        "Ger\u00e4tetyp": "LED-hintergrundbeleuchteter LCD-Monitor - 81.3 cm (32\")",
        "Gewicht": "12.9 kg",
        "Helligkeit": "400 cd/m\u00b2",
        "Hersteller": "Dell",
        "Hintergrundbeleuchtungs-Technologie": "Edge-LED-Beleuchtung",
        "Horizontaler Betrachtungswinkel": "178",
        "H\u00f6heneinstellung": "100 mm",
        "Integrierte Peripherieger\u00e4te": "USB 3.2 Gen 1/USB-C Hub",
        "Kontrast": "1000:1 / 1000:1 (dynamisch)",
        "Leistungsaufnahme im Ein-Zustand": "33 W",
        "Leistungsmerkmale": "USB 3.2 Gen 1/USB-C Hub",
        "Modell": "DELL-G3223D",
        "Native Aufl\u00f6sung": "QHD 2560 x 1440 bei 165 Hz",
        "Neigungswinkel": "-5/+21",
        "Pixelpitch": "0.2724 mm",
        "Ppi": "93",
        "Produktbeschreibung": "Dell G3223D - LED-Monitor - QHD - 81.3 cm (32\")",
        "Reaktionszeit": "1 ms (Gray-to-Gray)",
        "Schnittstellen": "2 x HDMI  DisplayPort 1.4  USB 3.2 Gen 1 Downstream  USB 3.2 Gen 1 Downstream mit Battery Charging 1.2  USB-C Upstream/DisplayPort 1.4 Alt Mode  Audio Line-In/-Out",
        "Schwenkwinkel": "60",
        "Seitenverh\u00e4ltnis": "16:9",
        "Services im Bundle": "3 Jahre Advanced Exchange- und Premium Panel-Garantie",
        "Sichtbare Bildfl\u00e4che": "80 cm (31.5\")",
        "Spannung": "Wechselstrom 100-240 V (50/60 Hz)",
        "Stromverbrauch (Aus-Modus)": "0.3 Watt",
        "Stromverbrauch (max.)": "97 Watt",
        "Stromverbrauch HDR (eingeschaltet)": "60 kWh/1.000 h",
        "Stromverbrauch SDR (eingeschaltet)": "33 kWh/1.000 h",
        "Stromverbrauch im Standby-Modus": "0.4 Watt",
        "Transportgewicht": "12.9 kg",
        "VESA-Halterung": "100 mm",
        "Vertikaler Betrachtungswinkel": "178",
        "Waren-Nr.": "3065944",
        "Zubeh\u00f6r im Lieferumfang": "Standfu\u00df, Stand-Riser",
        "Zum Hersteller": "www.dell.com/"
    },
    "raw_specifications_text": "Hersteller: Dell\nWaren-Nr.: 3065944\nModell: DELL-G3223D\nEAN: 5397184657386\nZum Hersteller: www.dell.com/\nProduktbeschreibung: Dell G3223D - LED-Monitor - QHD - 81.3 cm (32\")\nGer\u00e4tetyp: LED-hintergrundbeleuchteter LCD-Monitor - 81.3 cm (32\")\nEnergie Effizienzklasse: Klasse G\nLeistungsaufnahme im Ein-Zustand: 33 W\nAdaptive-Sync Technologie: AMD FreeSync, NVIDIA G-SYNC\nLeistungsmerkmale: USB 3.2 Gen 1/USB-C Hub\nBildschirmtyp: Fast IPS\nSeitenverh\u00e4ltnis: 16:9\nNative Aufl\u00f6sung: QHD 2560 x 1440 bei 165 Hz\nPixelpitch: 0.2724 mm\nHelligkeit: 400 cd/m\u00b2\nKontrast: 1000:1 / 1000:1 (dynamisch)\nReaktionszeit: 1 ms (Gray-to-Gray)\nFarbunterst\u00fctzung: 1,07 Mrd. Farben\nFarbraum: 95% DCI-P3 (CIE 1976)\nEingangsanschl\u00fcsse: 2xHDMI, DisplayPort, USB-C\nEinstellungen der Anzeigeposition: H\u00f6he, Drehung, Neigung\nBildschirmbeschichtung: Blendfrei, 3H Hard Coating\nSpannung: Wechselstrom 100-240 V (50/60 Hz)\nAbmessungen (Breite x Tiefe x H\u00f6he) - mit Fu\u00df: 71.315 cm x 24.694 cm x 55.6 cm\nGewicht: 12.9 kg\nServices im Bundle: 3 Jahre Advanced Exchange- und Premium Panel-Garantie\nDisplay-Typ: LED-hintergrundbeleuchteter LCD-Monitor / TFT-Aktivmatrix\nEnergieklasse (HDR): Klasse G\nDiagonalabmessung: 81.3 cm (32\")\nSichtbare Bildfl\u00e4che: 80 cm (31.5\")\nIntegrierte Peripherieger\u00e4te: USB 3.2 Gen 1/USB-C Hub\nPpi: 93\nHorizontaler Betrachtungswinkel: 178\nVertikaler Betrachtungswinkel: 178\nHintergrundbeleuchtungs-Technologie: Edge-LED-Beleuchtung\nBesonderheiten: 8-bit + A-FRC Farbtiefe, Dell ComfortView Plus\nAbmessungen (Breite x Tiefe x H\u00f6he): 71.315 cm x 24.694 cm x 55.6 cm - mit Fu\u00df\nSchnittstellen: 2 x HDMI  DisplayPort 1.4  USB 3.2 Gen 1 Downstream  USB 3.2 Gen 1 Downstream mit Battery Charging 1.2  USB-C Upstream/DisplayPort 1.4 Alt Mode  Audio Line-In/-Out\nNeigungswinkel: -5/+21\nSchwenkwinkel: 60\nH\u00f6heneinstellung: 100 mm\nVESA-Halterung: 100 mm\nZubeh\u00f6r im Lieferumfang: Standfu\u00df, Stand-Riser\nEnthaltene Kabel: 1 x DisplayPort-Kabel  1 x USB-C Kabel\nEingangsspannung: Wechselstrom 100-240 V (50/60 Hz)\nStromverbrauch SDR (eingeschaltet): 33 kWh/1.000 h\nStromverbrauch HDR (eingeschaltet): 60 kWh/1.000 h\nStromverbrauch (max.): 97 Watt\nStromverbrauch im Standby-Modus: 0.4 Watt\nEnergierverbrauch Sleep: 0.3 Watt\nStromverbrauch (Aus-Modus): 0.3 Watt\nEin-/Aus-Schalter: Ja\nDetails zu Abmessungen & Gewicht: Mit Fu\u00df - Breite: 24.694 cm - Tiefe: 6.861 cm - H\u00f6he: 55.6 cm - Gewicht: 12.9 kg  Ohne Fu\u00df - Breite: 71.315 cm - Tiefe: 6.861 cm - H\u00f6he: 42.712 cm - Gewicht: 5.72 kg\nTransportgewicht: 12.9 kg",
    "reference_file": "offer_reference_1003.json",
    "shop_name": "Proshop.at"
}