{
    "html_file": "offer_810_6.html",
    "name": "HANNspree HP225HFB, 21.45\"",
    "offer_link": "https://www.csv-direct.de/artinfo.php?artnr=AGX1599852&KATEGORIE=162&pva=geizhals2",
    "price": 86.3,
    "raw_specifications": {
        "AC Eingangsfrequenz": "50/65 Hz",
        "AC Eingangsspannung": "100 - 240 V",
        "AMD FreeSync": "Nein",
        "Anzahl HDMI-Anschl\u00fcsse": "1",
        "Anzahl OSD-Sprachen": "7",
        "Anzahl VGA D-Sub Anschl\u00fcsse": "1",
        "Anzahl der Farben des Displays": "16,7 Millionen Farben",
        "Anzahl der Lautsprecher": "2",
        "Bildschirmdiagonale": "54,5 cm 21.4\"",
        "Bildschirmdiagonale cm": "54,48 cm",
        "Bildschirmform": "Flach",
        "Bildschirmtechnologie": "LED",
        "Bildwinkel, horizontal": "178\u00b0",
        "Bildwinkel, vertikal": "178\u00b0",
        "Breite ohne Standfu\u00df": "494 mm",
        "Display-Aufl\u00f6sung": "1920 x 1080 Pixel",
        "Energieeffizienzklasse SDR": "D",
        "Energieverbrauch SDR pro 1.000 Stunden": "12 kWh",
        "Ger\u00e4tebreite inkl. Fu\u00df": "494 mm",
        "Ger\u00e4teh\u00f6he inkl. Fu\u00df": "379 mm",
        "Ger\u00e4tetiefe inkl. Fu\u00df": "189 mm",
        "HD-Typ": "Full HD",
        "HDMI-Kabell\u00e4nge": "1,5 m",
        "HDMI-Version": "1.4",
        "Helligkeit peak": "300 cd/m\u00b2",
        "Helligkeit typisch": "300 cd/m\u00b2",
        "Horizontaler Scanbereich": "30 - 83 kHz",
        "H\u00f6he ohne Standfu\u00df": "286 mm",
        "H\u00f6heneinstellung": "14 cm",
        "Integrierte Kamera": "Nein",
        "Integrierter USB-Hub": "Nein",
        "Kontrastverh\u00e4ltnis": "1000:1",
        "Kontrastverh\u00e4ltnis dynamisch": "10000000:1",
        "Kopfh\u00f6rerausgang": "Nein",
        "Marktpositionierung": "Business",
        "Maximale Bildwiederholrate": "60 Hz",
        "Mitgelieferte Kabel": "HDMI",
        "NVIDIA G-SYNC": "Nein",
        "Natives Seitenverh\u00e4ltnis": "16:9",
        "Neigungswinkelbereich": "-5 - 15\u00b0",
        "Netzteil Ausgangsspannung": "12 V",
        "Oberfl\u00e4chenh\u00e4rte": "3H",
        "Panel-Montage-Schnittstelle": "75 x 75 mm",
        "Panel-Typ": "VA",
        "Pivot": "Nein",
        "Pivot Winkel": "-90 - 90\u00b0",
        "Pixel Abstand": "0,2493 x 0,241 mm",
        "Produktfarbe": "Schwarz",
        "RMS-Leistung": "2 W",
        "Reaktionszeit": "5 ms",
        "Schwenkwinkelbereich": "-45 - 45\u00b0",
        "Slot-Typ Kabelsperre": "Kensington",
        "Stromverbrauch Standardbetrieb": "12 W",
        "Stromverbrauch Standby": "0,5 W",
        "Stromverbrauch aus": "0,3 W",
        "Tiefe ohne Standfu\u00df": "36 mm",
        "Touchscreen": "Nein",
        "Tr\u00fcbungsrate": "25",
        "Typ der Hintergrundbeleuchtung": "LED",
        "Vertikaler Scanbereich": "56 - 75 Hz"
    },
    "raw_specifications_text": "Bildschirmdiagonale: 54,5 cm 21.4\"\nDisplay-Aufl\u00f6sung: 1920 x 1080 Pixel\nNatives Seitenverh\u00e4ltnis: 16:9\nBildschirmtechnologie: LED\nTouchscreen: Nein\nHD-Typ: Full HD\nPanel-Typ: VA\nBildschirmform: Flach\nKontrastverh\u00e4ltnis: 1000:1\nMaximale Bildwiederholrate: 60 Hz\nAnzahl der Farben des Displays: 16,7 Millionen Farben\nTyp der Hintergrundbeleuchtung: LED\nHelligkeit peak: 300 cd/m\u00b2\nHelligkeit typisch: 300 cd/m\u00b2\nReaktionszeit: 5 ms\nKontrastverh\u00e4ltnis dynamisch: 10000000:1\nBildwinkel, horizontal: 178\u00b0\nBildwinkel, vertikal: 178\u00b0\nPixel Abstand: 0,2493 x 0,241 mm\nHorizontaler Scanbereich: 30 - 83 kHz\nVertikaler Scanbereich: 56 - 75 Hz\nBildschirmdiagonale cm: 54,48 cm\nTr\u00fcbungsrate: 25\nOberfl\u00e4chenh\u00e4rte: 3H\nNVIDIA G-SYNC: Nein\nAMD FreeSync: Nein\nIntegrierte Kamera: Nein\nAnzahl der Lautsprecher: 2\nRMS-Leistung: 2 W\nMarktpositionierung: Business\nProduktfarbe: Schwarz\nIntegrierter USB-Hub: Nein\nKopfh\u00f6rerausgang: Nein\nAnzahl VGA D-Sub Anschl\u00fcsse: 1\nAnzahl HDMI-Anschl\u00fcsse: 1\nHDMI-Version: 1.4\nPanel-Montage-Schnittstelle: 75 x 75 mm\nSlot-Typ Kabelsperre: Kensington\nH\u00f6heneinstellung: 14 cm\nPivot: Nein\nPivot Winkel: -90 - 90\u00b0\nSchwenkwinkelbereich: -45 - 45\u00b0\nNeigungswinkelbereich: -5 - 15\u00b0\nAnzahl OSD-Sprachen: 7\nEnergieeffizienzklasse SDR: D\nEnergieverbrauch SDR pro 1.000 Stunden: 12 kWh\nStromverbrauch Standardbetrieb: 12 W\nStromverbrauch Standby: 0,5 W\nStromverbrauch aus: 0,3 W\nAC Eingangsspannung: 100 - 240 V\nAC Eingangsfrequenz: 50/65 Hz\nNetzteil Ausgangsspannung: 12 V\nMitgelieferte Kabel: HDMI\nHDMI-Kabell\u00e4nge: 1,5 m\nGer\u00e4tebreite inkl. Fu\u00df: 494 mm\nGer\u00e4tetiefe inkl. Fu\u00df: 189 mm\nGer\u00e4teh\u00f6he inkl. Fu\u00df: 379 mm\nBreite ohne Standfu\u00df: 494 mm\nTiefe ohne Standfu\u00df: 36 mm\nH\u00f6he ohne Standfu\u00df: 286 mm",
    "reference_file": "offer_reference_810.json",
    "shop_name": "CSV-Direct.de"
}