{
    "html_file": "offer_1881_13.html",
    "name": "BenQ BL2483TM, 24\"",
    "offer_link": "https://www.csv-direct.de/artinfo.php?artnr=A1620501&KATEGORIE=162&pva=geizhals2",
    "price": 171.11,
    "raw_specifications": {
        "AC Eingangsspannung": "100 - 240 V",
        "AMD FreeSync": "Nein",
        "Anzahl DVI-D-Anschl\u00fcsse": "1",
        "Anzahl DisplayPort Anschl\u00fcsse": "1",
        "Anzahl OSD-Sprachen": "18",
        "Anzahl VGA D-Sub Anschl\u00fcsse": "1",
        "Anzahl der Farben des Displays": "16,78 Millionen Farben",
        "Anzahl der Lautsprecher": "2",
        "Betriebstemperatur": "0 - 40 \u00b0C",
        "Bildschirmdiagonale": "61 cm 24\"",
        "Bildschirmform": "Flach",
        "Bildschirmtechnologie": "LED",
        "Bildwinkel, horizontal": "170\u00b0",
        "Bildwinkel, vertikal": "160\u00b0",
        "Breite ohne Standfu\u00df": "565 mm",
        "Display-Aufl\u00f6sung": "1920 x 1080 Pixel",
        "Display-Oberfl\u00e4che": "Matt",
        "DisplayPorts-Version": "1.2",
        "Energieeffizienzklasse SDR": "E",
        "Energieeffizienzskala": "A bis G",
        "Energieverbrauch SDR pro 1.000 Stunden": "18 kWh",
        "Fu\u00dffarbe": "Schwarz",
        "Ger\u00e4tebreite inkl. Fu\u00df": "565 mm",
        "Ger\u00e4teh\u00f6he inkl. Fu\u00df": "534,4 mm",
        "Ger\u00e4tetiefe inkl. Fu\u00df": "238,2 mm",
        "Gewicht mit St\u00e4nder": "5,6 kg",
        "Gewicht ohne St\u00e4nder": "3 kg",
        "HD-Typ": "Full HD",
        "HDCP-Version": "1.4",
        "HDMI": "Nein",
        "Helligkeit typisch": "250 cd/m\u00b2",
        "Horizontaler Scanbereich": "30 - 83 kHz",
        "H\u00f6he ohne Standfu\u00df": "337 mm",
        "H\u00f6heneinstellung": "14 cm",
        "Integrierte Kamera": "Nein",
        "Integrierter USB-Hub": "Nein",
        "Kontrastverh\u00e4ltnis": "1000:1",
        "Kontrastverh\u00e4ltnis dynamisch": "12000000:1",
        "LED-Anzeigen": "Leistung",
        "Men\u00fcsprachen": "Arabisch, Vereinfachtes Chinesisch, Traditionelles Chinesisch, Tschechisch, Deutsch, Niederl\u00e4ndisch, Englisch, Spanisch, Franz\u00f6sisch, Ungarisch, Italienisch, Japanisch, Koreanisch, Polnisch, Portugiesisch, Rum\u00e4nisch, Russisch, Schwedisch",
        "NTSC Abdeckung typisch": "72",
        "Nachhaltigkeitszertifikate": "ENERGY STAR, EPEAT Bronze, TCO",
        "Natives Seitenverh\u00e4ltnis": "16:9",
        "Neigungswinkelbereich": "-5 - 35\u00b0",
        "Paketgewicht": "7,6 kg",
        "Panel-Typ": "TN",
        "Pivot Winkel": "0 - 90\u00b0",
        "Pixel Abstand": "0,276 x 0,276 mm",
        "Pixeldichte": "92 ppi",
        "Produktfarbe": "Schwarz",
        "RGB-Farbraum": "NTSC",
        "RMS-Leistung": "1 W",
        "Reaktionszeit": "1 ms",
        "Relative Luftfeuchtigkeit in Betrieb": "10 - 90",
        "Schwenkwinkelbereich": "-175 - 175\u00b0",
        "Seitenverh\u00e4ltnis": "16:9",
        "Stromverbrauch Standardbetrieb": "17,8 W",
        "Stromverbrauch Standby": "0,3 W",
        "Stromverbrauch aus": "0,2 W",
        "Stromverbrauch durchschnittl.": "25 W",
        "Stromverbrauch max.": "17,48 W",
        "Tiefe ohne Standfu\u00df": "50,9 mm",
        "Touchscreen": "Nein",
        "Typ der Hintergrundbeleuchtung": "LED",
        "Unterst\u00fctzte Grafik-Aufl\u00f6sungen": "1920 x 1080 HD 1080",
        "Vertikaler Scanbereich": "50 - 76 Hz",
        "Warentarifnummer HS": "85285210"
    },
    "raw_specifications_text": "Bildschirmdiagonale: 61 cm 24\"\nDisplay-Aufl\u00f6sung: 1920 x 1080 Pixel\nNatives Seitenverh\u00e4ltnis: 16:9\nBildschirmtechnologie: LED\nTouchscreen: Nein\nHD-Typ: Full HD\nPanel-Typ: TN\nBildschirmform: Flach\nKontrastverh\u00e4ltnis: 1000:1\nAnzahl der Farben des Displays: 16,78 Millionen Farben\nTyp der Hintergrundbeleuchtung: LED\nHelligkeit typisch: 250 cd/m\u00b2\nReaktionszeit: 1 ms\nDisplay-Oberfl\u00e4che: Matt\nUnterst\u00fctzte Grafik-Aufl\u00f6sungen: 1920 x 1080 HD 1080\nSeitenverh\u00e4ltnis: 16:9\nKontrastverh\u00e4ltnis dynamisch: 12000000:1\nBildwinkel, horizontal: 170\u00b0\nBildwinkel, vertikal: 160\u00b0\nPixel Abstand: 0,276 x 0,276 mm\nPixeldichte: 92 ppi\nHorizontaler Scanbereich: 30 - 83 kHz\nVertikaler Scanbereich: 50 - 76 Hz\nRGB-Farbraum: NTSC\nNTSC Abdeckung typisch: 72\nAMD FreeSync: Nein\nIntegrierte Kamera: Nein\nAnzahl der Lautsprecher: 2\nRMS-Leistung: 1 W\nProduktfarbe: Schwarz\nFu\u00dffarbe: Schwarz\nIntegrierter USB-Hub: Nein\nHDMI: Nein\nAnzahl VGA D-Sub Anschl\u00fcsse: 1\nAnzahl DVI-D-Anschl\u00fcsse: 1\nAnzahl DisplayPort Anschl\u00fcsse: 1\nDisplayPorts-Version: 1.2\nHDCP-Version: 1.4\nH\u00f6heneinstellung: 14 cm\nPivot Winkel: 0 - 90\u00b0\nSchwenkwinkelbereich: -175 - 175\u00b0\nNeigungswinkelbereich: -5 - 35\u00b0\nMen\u00fcsprachen: Arabisch, Vereinfachtes Chinesisch, Traditionelles Chinesisch, Tschechisch, Deutsch, Niederl\u00e4ndisch, Englisch, Spanisch, Franz\u00f6sisch, Ungarisch, Italienisch, Japanisch, Koreanisch, Polnisch, Portugiesisch, Rum\u00e4nisch, Russisch, Schwedisch\nAnzahl OSD-Sprachen: 18\nLED-Anzeigen: Leistung\nEnergieeffizienzklasse SDR: E\nEnergieverbrauch SDR pro 1.000 Stunden: 18 kWh\nStromverbrauch Standardbetrieb: 17,8 W\nStromverbrauch Standby: 0,3 W\nStromverbrauch max.: 17,48 W\nStromverbrauch durchschnittl.: 25 W\nStromverbrauch aus: 0,2 W\nAC Eingangsspannung: 100 - 240 V\nEnergieeffizienzskala: A bis G\nBetriebstemperatur: 0 - 40 \u00b0C\nRelative Luftfeuchtigkeit in Betrieb: 10 - 90\nGer\u00e4tebreite inkl. Fu\u00df: 565 mm\nGer\u00e4tetiefe inkl. Fu\u00df: 238,2 mm\nGer\u00e4teh\u00f6he inkl. Fu\u00df: 534,4 mm\nGewicht mit St\u00e4nder: 5,6 kg\nBreite ohne Standfu\u00df: 565 mm\nTiefe ohne Standfu\u00df: 50,9 mm\nH\u00f6he ohne Standfu\u00df: 337 mm\nGewicht ohne St\u00e4nder: 3 kg\nPaketgewicht: 7,6 kg\nNachhaltigkeitszertifikate: ENERGY STAR, EPEAT Bronze, TCO\nWarentarifnummer HS: 85285210",
    "reference_file": "offer_reference_1881.json",
    "shop_name": "CSV-Direct.de"
}