{
    "html_file": "offer_2284_1.html",
    "name": "Eizo FlexScan EV2430 schwarz, 24.1\"",
    "offer_link": "https://www.future-x.at/eizo-flexscan-ev2430-bk-monitor-241-full-hd-ips-schwarz-p-3202125/?pv=2",
    "price": 307.9,
    "raw_specifications": {
        "3D": "Nein",
        "AMD FreeSync": "Nein",
        "Anzahl DisplayPort Anschl\u00fcsse": "1",
        "Anzahl VGA (D-Sub) Anschl\u00fcsse": "1",
        "Anzahl der Farben des Displays": "16,78 Millionen Farben",
        "Anzahl der nachgeschalteten Steckpl\u00e4tze vom Typ USB-A": "2",
        "Anzahl der vorgeschalteten Steckpl\u00e4tze": "1",
        "Bildschirmaufl\u00f6sung": "1920 x 1200 Pixel",
        "Bildschirmdiagonale": "61,2 cm (24.1 Zoll)",
        "Bildschirmdiagonale (cm)": "61,1 cm",
        "Bildschirmtechnologie": "LED",
        "Blickwinkel, horizontal": "178\u00b0",
        "Blickwinkel, vertikal": "178\u00b0",
        "Breite": "553 mm",
        "DVI Anschluss": "Nein",
        "Ein-/Ausschalter": "Ja",
        "Eingebaute Lautsprecher": "Ja",
        "Fu\u00dffarbe": "Schwarz",
        "Ger\u00e4tebreite (inkl. Fu\u00df)": "553 mm",
        "Ger\u00e4teh\u00f6he (inkl. Fu\u00df)": "499 mm",
        "Ger\u00e4tetiefe (inkl. Fu\u00df)": "233 mm",
        "Gewicht": "4,3 kg",
        "Gewicht (mit Standfu\u00df)": "6,7 kg",
        "HD-Typ": "WUXGA",
        "HDCP": "Ja",
        "Helligkeit (typisch)": "300 cd/m\u00b2",
        "H\u00f6he": "368 mm",
        "H\u00f6heneinstellung": "14 cmGewicht & Abmessungen",
        "H\u00f6henverstellung": "Ja",
        "Integrierte Kamera": "Nein",
        "Integrierter USB-Hub": "Ja",
        "Kabelsperre-Slot": "Ja",
        "Kontrastverh\u00e4ltnis": "1000:1",
        "Kopfh\u00f6rer-Konnektivit\u00e4t": "3,5 mm",
        "Kopfh\u00f6rerausgang": "Ja",
        "Marktpositionierung": "Zuhause & B\u00fcro",
        "NVIDIA G-SYNC": "Nein",
        "Native Seitenverh\u00e4ltnis": "16:10",
        "Neigungsverstellung": "Ja",
        "Neigungswinkelbereich": "5 - 35\u00b0",
        "Panel-Typ": "IPS",
        "Pivot": "Ja",
        "Pivot Winkel": "90 - 90\u00b0",
        "Pixel Abstand": "0,27 x 0,27 mm",
        "Produktfarbe": "Schwarz",
        "Reaktionszeit": "14 ms",
        "Sichtbare Gr\u00f6\u00dfe (horizontal)": "51,8 cm",
        "Sichtbare Gr\u00f6\u00dfe (vertikal)": "32,4 cm",
        "TV Tuner integriert": "Nein",
        "USB-Hub-Version": "USB 2.0",
        "Unterst\u00fctzte Grafik-Aufl\u00f6sungen": "1920 x 1200 (WUXGA)",
        "VESA Montageadapter": "100 x 100 mm",
        "VESA-Halterung": "Ja",
        "sRGB": "Ja"
    },
    "raw_specifications_text": "Bildschirmdiagonale: 61,2 cm (24.1 Zoll)\nHelligkeit (typisch): 300 cd/m\u00b2\nBildschirmaufl\u00f6sung: 1920 x 1200 Pixel\nReaktionszeit: 14 ms\n3D: Nein\nHD-Typ: WUXGA\nBildschirmtechnologie: LED\nPanel-Typ: IPS\nUnterst\u00fctzte Grafik-Aufl\u00f6sungen: 1920 x 1200 (WUXGA)\nKontrastverh\u00e4ltnis: 1000:1\nBlickwinkel, horizontal: 178\u00b0\nBlickwinkel, vertikal: 178\u00b0\nAnzahl der Farben des Displays: 16,78 Millionen Farben\nNative Seitenverh\u00e4ltnis: 16:10\nBildschirmdiagonale (cm): 61,1 cm\nPixel Abstand: 0,27 x 0,27 mm\nSichtbare Gr\u00f6\u00dfe (horizontal): 51,8 cm\nSichtbare Gr\u00f6\u00dfe (vertikal): 32,4 cm\nsRGB: Ja\nHDCP: Ja\nEingebaute Lautsprecher: Ja\nIntegrierte Kamera: Nein\nTV Tuner integriert: Nein\nMarktpositionierung: Zuhause & B\u00fcro\nProduktfarbe: Schwarz\nFu\u00dffarbe: Schwarz\nNVIDIA G-SYNC: Nein\nAMD FreeSync: Nein\nIntegrierter USB-Hub: Ja\nAnzahl VGA (D-Sub) Anschl\u00fcsse: 1\nDVI Anschluss: Nein\nUSB-Hub-Version: USB 2.0\nAnzahl der vorgeschalteten Steckpl\u00e4tze: 1\nAnzahl der nachgeschalteten Steckpl\u00e4tze vom Typ USB-A: 2\nAnzahl DisplayPort Anschl\u00fcsse: 1\nKopfh\u00f6rerausgang: Ja\nKopfh\u00f6rer-Konnektivit\u00e4t: 3,5 mm\nKabelsperre-Slot: Ja\nEin-/Ausschalter: Ja\nVESA-Halterung: Ja\nH\u00f6henverstellung: Ja\nVESA Montageadapter: 100 x 100 mm\nPivot: Ja\nPivot Winkel: 90 - 90\u00b0\nNeigungsverstellung: Ja\nNeigungswinkelbereich: 5 - 35\u00b0\nH\u00f6heneinstellung: 14 cmGewicht & Abmessungen\nBreite: 553 mm\nH\u00f6he: 368 mm\nGewicht: 4,3 kg\nGer\u00e4tebreite (inkl. Fu\u00df): 553 mm\nGer\u00e4tetiefe (inkl. Fu\u00df): 233 mm\nGer\u00e4teh\u00f6he (inkl. Fu\u00df): 499 mm\nGewicht (mit Standfu\u00df): 6,7 kg",
    "reference_file": "offer_reference_2284.json",
    "shop_name": "Future-X.at"
}