{
    "html_file": "offer_1950_7.html",
    "name": "Eizo FlexScan EV2360 wei\u00df, 22.5\"",
    "offer_link": "https://www.hiq24.de/shop/artikel/275539/?sPartner=geizhals",
    "price": 265.9,
    "raw_specifications": {
        "Abmessungen (Breite x Tiefe x H\u00f6he)": "49.9 cm x 5.36 cm x 32.13 cm - ohne Fu\u00df",
        "Abmessungen (Breite x Tiefe x H\u00f6he) - ohne Fu\u00df": "49.9 cm x 5.36 cm x 32.13 cm",
        "Ausgangsleistung/Kanal": "1 Watt",
        "Besonderheiten": "Auto EcoView, blendfreie, flimmerfreie Technologie",
        "Bildschirmtyp": "IPS",
        "Details zu Abmessungen & Gewicht": "Mit Fu\u00df - Breite: 49.9 cm - Tiefe: 23.3 cm - H\u00f6he: 33.39 cm - Gewicht: 5.5 kg",
        "Diagonalabmessung": "57.2 cm (22.5\")",
        "Display-Typ": "LED-hintergrundbeleuchteter LCD-Monitor / TFT-Aktivmatrix",
        "ENERGY STAR zertifiziert": "Ja",
        "Eingangsanschl\u00fcsse": "DVI-D, VGA, DisplayPort",
        "Eingangsspannung": "Wechselstrom 120/230 V (50/60 Hz)",
        "Einstellungen der Anzeigeposition": "H\u00f6he, Pivot (Rotation), Drehung, Neigung",
        "Energie Effizienzklasse": "Klasse C",
        "Enthaltene Kabel": "1 x DisplayPort-Kabel  1 x USB-Kabel",
        "Farbe": "Wei\u00df",
        "Farbunterst\u00fctzung": "16,8 Millionen Farben",
        "Ger\u00e4tetyp": "LED-hintergrundbeleuchteter LCD-Monitor - 57.2 cm (22.5\")",
        "Gewicht": "3.4 kg",
        "Hintergrundbeleuchtungs-Technologie": "LED-Hintergrundbeleuchtung",
        "Horizontale Bildwiederholrate": "31 - 75.5 kHz",
        "Horizontaler Betrachtungswinkel": "178",
        "H\u00f6heneinstellung": "140 mm",
        "Integrierte Peripherieger\u00e4te": "Lautsprecher",
        "Kennzeichnung": "TUV GS, CB, CCC, TUV Ergo, RoHS, WEEE, PSE Mark, cTUVus, EPA, VCCI Class B, EAC, RCM, CE/EMC",
        "Kontrast": "1000:1",
        "Leistungsmerkmale": "Lautsprecher",
        "Max. Betriebstemperatur": "35 \u00b0C",
        "Min Betriebstemperatur": "5 \u00b0C",
        "Native Aufl\u00f6sung": "1920 x 1200",
        "Neigungswinkel": "-5/+35",
        "OSD-Sprachen": "Chinesisch (tradionell), Chinesisch (vereinfacht), Englisch, Deutsch, Franz\u00f6sisch, Italienisch, Schwedisch, Spanisch, Japanisch",
        "Ppi": "101",
        "Produktbeschreibung": "EIZO FlexScan EV2360-WT - LED-Monitor - 57.2 cm (22.5\")",
        "Reaktionszeit": "5 ms (Gray-to-Gray)",
        "Rotationswinkel": "180",
        "Schnittstellen": "DisplayPort (HDCP)  HDMI (HDCP)  VGA  USB 3.1 Gen 1 Upstream (Typ B)  2 x USB 3.1 Gen 1 Downstream (Typ A)  Kopfh\u00f6rer (Mini-Klinkenstecker)  Audio Line-In (Mini-Klinkenstecker)",
        "Schwenkwinkel": "344",
        "Seitenverh\u00e4ltnis": "16:10",
        "Spannung": "Wechselstrom 120/230 V (50/60 Hz)",
        "Stromverbrauch (typisch)": "11 Watt",
        "Stromverbrauch SDR (eingeschaltet)": "11 kWh/1.000 h",
        "Stromverbrauch im Standby-Modus": "0.5 Watt",
        "Typ": "Lautsprecher",
        "Umweltschutzstandards": "ENERGY STAR-qualifiziert",
        "VESA-Halterung": "100 x 100 mm",
        "Vertikale Bildwiederholrate": "59 - 61 Hz",
        "Vertikaler Betrachtungswinkel": "178",
        "Zul\u00e4ssige Luftfeuchtigkeit im Betrieb": "20 - 80% (nicht kondensierend)"
    },
    "raw_specifications_text": "Display-Typ: LED-hintergrundbeleuchteter LCD-Monitor / TFT-Aktivmatrix\nEnergie Effizienzklasse: Klasse C\nDiagonalabmessung: 57.2 cm (22.5\")\nIntegrierte Peripherieger\u00e4te: Lautsprecher\nBildschirmtyp: IPS\nSeitenverh\u00e4ltnis: 16:10\nNative Aufl\u00f6sung: 1920 x 1200\nPpi: 101\nKontrast: 1000:1\nFarbunterst\u00fctzung: 16,8 Millionen Farben\nReaktionszeit: 5 ms (Gray-to-Gray)\nVertikale Bildwiederholrate: 59 - 61 Hz\nHorizontale Bildwiederholrate: 31 - 75.5 kHz\nHorizontaler Betrachtungswinkel: 178\nVertikaler Betrachtungswinkel: 178\nHintergrundbeleuchtungs-Technologie: LED-Hintergrundbeleuchtung\nOSD-Sprachen: Chinesisch (tradionell), Chinesisch (vereinfacht), Englisch, Deutsch, Franz\u00f6sisch, Italienisch, Schwedisch, Spanisch, Japanisch\nBesonderheiten: Auto EcoView, blendfreie, flimmerfreie Technologie\nFarbe: Wei\u00df\nAbmessungen (Breite x Tiefe x H\u00f6he): 49.9 cm x 5.36 cm x 32.13 cm - ohne Fu\u00df\nGewicht: 3.4 kg\nTyp: Lautsprecher\nAusgangsleistung/Kanal: 1 Watt\nSchnittstellen: DisplayPort (HDCP)  HDMI (HDCP)  VGA  USB 3.1 Gen 1 Upstream (Typ B)  2 x USB 3.1 Gen 1 Downstream (Typ A)  Kopfh\u00f6rer (Mini-Klinkenstecker)  Audio Line-In (Mini-Klinkenstecker)\nEinstellungen der Anzeigeposition: H\u00f6he, Pivot (Rotation), Drehung, Neigung\nNeigungswinkel: -5/+35\nSchwenkwinkel: 344\nRotationswinkel: 180\nH\u00f6heneinstellung: 140 mm\nVESA-Halterung: 100 x 100 mm\nEnthaltene Kabel: 1 x DisplayPort-Kabel  1 x USB-Kabel\nKennzeichnung: TUV GS, CB, CCC, TUV Ergo, RoHS, WEEE, PSE Mark, cTUVus, EPA, VCCI Class B, EAC, RCM, CE/EMC\nEingangsspannung: Wechselstrom 120/230 V (50/60 Hz)\nStromverbrauch SDR (eingeschaltet): 11 kWh/1.000 h\nStromverbrauch (typisch): 11 Watt\nStromverbrauch im Standby-Modus: 0.5 Watt\nDetails zu Abmessungen & Gewicht: Mit Fu\u00df - Breite: 49.9 cm - Tiefe: 23.3 cm - H\u00f6he: 33.39 cm - Gewicht: 5.5 kg\nENERGY STAR zertifiziert: Ja\nMin Betriebstemperatur: 5 \u00b0C\nMax. Betriebstemperatur: 35 \u00b0C\nZul\u00e4ssige Luftfeuchtigkeit im Betrieb: 20 - 80% (nicht kondensierend)\nProduktbeschreibung: EIZO FlexScan EV2360-WT - LED-Monitor - 57.2 cm (22.5\")\nGer\u00e4tetyp: LED-hintergrundbeleuchteter LCD-Monitor - 57.2 cm (22.5\")\nLeistungsmerkmale: Lautsprecher\nEingangsanschl\u00fcsse: DVI-D, VGA, DisplayPort\nSpannung: Wechselstrom 120/230 V (50/60 Hz)\nAbmessungen (Breite x Tiefe x H\u00f6he) - ohne Fu\u00df: 49.9 cm x 5.36 cm x 32.13 cm\nUmweltschutzstandards: ENERGY STAR-qualifiziert",
    "reference_file": "offer_reference_1950.json",
    "shop_name": "HiQ24"
}