{
    "html_file": "offer_649_10.html",
    "name": "Lenovo D24-40, 23.8\"",
    "offer_link": "https://click.cptrack.de/?rd=true&k=H2jZOPSoNfIohcnyCFLwA_LR6aoYlmWcoGxPFWjt6o_KeIR8CN4ep_-BB5ojnerpGy_yTbYED5SeNM2e6jUszA~~&rdlink=https%3A%2F%2Fwww.cyberport.at%2F%3FDEEP%3D6133-120%26APID%3D66",
    "price": 117.0,
    "raw_specifications": {
        "Aufl\u00f6sung": "1.920x1.080 Full HD",
        "Betrachtungswinkel h/v": "178\u00b0/178\u00b0",
        "Bildformat": "16:9",
        "Breite in mm": "539mm",
        "DVI": "kein",
        "Displaygr\u00f6\u00dfe in Zoll": "23,8 Zoll",
        "Displaygr\u00f6\u00dfe in cm": "60,5 cm",
        "Displayport": "kein",
        "Farbraumabdeckung": "72% NTSC",
        "Farbtiefe": "8 Bit / 16,7 Mio Farben",
        "Garantie": "36 Monate",
        "Garantieart": "k.A.",
        "Gewicht in kg": "3,3 kg",
        "HDMI": "1x HDMI",
        "Helligkeit": "250 cd/m\u00b2",
        "H\u00f6he in mm": "413mm",
        "H\u00f6henverstellbar": "ohne",
        "Jahresverbrauch": "12 kWh",
        "Kontrast dynamisch": "3.000.000:1",
        "Kontrast typisch": "3.000:1",
        "Lautsprecher": "kein",
        "Leistungsaufnahme": "16 Watt",
        "Oberfl\u00e4che": "matt",
        "Reaktionszeit": "4 ms",
        "Technologie": "VA LED",
        "Tiefe in mm": "210mm",
        "USB-C": "kein",
        "Wandmontage": "VESA100x100"
    },
    "raw_specifications_text": "Jahresverbrauch: 12 kWh\nLeistungsaufnahme: 16 Watt\nLautsprecher: kein\nH\u00f6henverstellbar: ohne\nWandmontage: VESA100x100\nDisplaygr\u00f6\u00dfe in cm: 60,5 cm\nDisplaygr\u00f6\u00dfe in Zoll: 23,8 Zoll\nTechnologie: VA LED\nAufl\u00f6sung: 1.920x1.080 Full HD\nBildformat: 16:9\nOberfl\u00e4che: matt\nFarbraumabdeckung: 72% NTSC\nFarbtiefe: 8 Bit / 16,7 Mio Farben\nHelligkeit: 250 cd/m\u00b2\nKontrast typisch: 3.000:1\nKontrast dynamisch: 3.000.000:1\nReaktionszeit: 4 ms\nBetrachtungswinkel h/v: 178\u00b0/178\u00b0\nHDMI: 1x HDMI\nDVI: kein\nDisplayport: kein\nUSB-C: kein\nBreite in mm: 539mm\nH\u00f6he in mm: 413mm\nTiefe in mm: 210mm\nGewicht in kg: 3,3 kg\nGarantie: 36 Monate\nGarantieart: k.A.",
    "reference_file": "offer_reference_649.json",
    "shop_name": "Cyberport.at"
}