{
    "html_file": "offer_769_1.html",
    "name": "iiyama ProLite XUB2495WSU-B4, 24.1\"",
    "offer_link": "https://www.taufnaus.de/product/10722450",
    "price": 320.98,
    "raw_specifications": {
        "Abmessungen (Breite x Tiefe x H\u00f6he)": "53.2 cm x 21 cm x 38.7 cm",
        "Ausgangsleistung/Kanal": "2 Watt",
        "Besonderheiten": "HDCP, Eco-Mode, flimmerfreie Technologie, i-Style Color, extrem schmale Blende an drei Seiten, Blue Light Reducer Function",
        "Bildschirmbeschichtung": "Matt",
        "Bildschirmtyp": "IPS",
        "Diagonalabmessung": "61.13 cm (24.1\")",
        "Display-Typ": "LCD-Monitor / TFT-Aktivmatrix",
        "ENERGY STAR zertifiziert": "Ja",
        "Eingangsspannung": "Wechselstrom 100-240 V (50/60 Hz)",
        "Einstellungen der Anzeigeposition": "H\u00f6he, Pivot (Rotation), Drehung, Neigung",
        "Energie Effizienzklasse": "Klasse E",
        "Energieverbrauch pro Jahr": "16 kWh",
        "Enthaltene Kabel": "1 x DisplayPort-Kabel \u00a6 1 x USB-Kabel",
        "Farbe": "Mattschwarz",
        "Farbraum": "72% NTSC, 99% sRGB",
        "Farbunterst\u00fctzung": "16,7 Millionen Farben",
        "Gewicht": "5.88 kg",
        "Helligkeit": "300 cd/m\u00b2",
        "Horizontale Bildwiederholrate": "24 - 82 kHz",
        "Horizontaler Betrachtungswinkel": "+89 / -89",
        "H\u00f6heneinstellung": "130 mm",
        "Integrierte Peripherieger\u00e4te": "USB 2.0 Hub",
        "Kennzeichnung": "TUV GS, RoHS, WEEE, PSE Mark, REACH, ERP, VCCI Class B, EAC, UKCA",
        "Kontrast": "1000:1 / 5000000:1 (dynamisch)",
        "Leistungsmerkmale": "Slot f\u00fcr Sicherheitsschloss (Kabelschloss getrennt erh\u00e4ltlich), Unterst\u00fctzung f\u00fcr VESA-Schnittstelle",
        "Native Aufl\u00f6sung": "WUXGA 1920 x 1200 bei 60 Hz",
        "Neigungswinkel": "-5/+22",
        "OSD-Sprachen": "Tschechisch, Englisch, Deutsch, Franz\u00f6sisch, Italienisch, Polnisch, Russisch, Spanisch, Holl\u00e4ndisch, Japanisch",
        "Pixelpitch": "0.27 mm",
        "Reaktionszeit": "4 ms (gray-to-gray)",
        "Rotationswinkel": "180",
        "Schlosstyp zur Diebstahlsicherung": "Kensington Slot",
        "Schnittstellen": "HDMI \u00a6 VGA \u00a6 DisplayPort \u00a6 4 x USB 2.0 \u00a6 Kopfh\u00f6rer",
        "Schwenkwinkel": "90",
        "Seitenverh\u00e4ltnis": "16:10",
        "Service und Support": "Begrenzte Garantie - 3 Jahre - Vor-Ort",
        "Stromverbrauch (Aus-Modus)": "0.5 Watt",
        "Stromverbrauch (typisch)": "18 Watt",
        "Stromverbrauch SDR (eingeschaltet)": "16 kWh/1.000 h",
        "Stromverbrauch im Standby-Modus": "0.5 Watt",
        "Transportbreite": "67.5 cm",
        "Transportgewicht": "7.59 kg",
        "Transporth\u00f6he": "19 cm",
        "Transporttiefe": "42 cm",
        "Typ": "Lautsprecher - Stereo",
        "VESA-Halterung": "100 x 100 mm",
        "Vertikaler Betrachtungswinkel": "+89 / -89"
    },
    "raw_specifications_text": "Display-Typ: LCD-Monitor / TFT-Aktivmatrix\nEnergie Effizienzklasse: Klasse E\nEnergieverbrauch pro Jahr: 16 kWh\nDiagonalabmessung: 61.13 cm (24.1\")\nIntegrierte Peripherieger\u00e4te: USB 2.0 Hub\nBildschirmtyp: IPS\nSeitenverh\u00e4ltnis: 16:10\nNative Aufl\u00f6sung: WUXGA 1920 x 1200 bei 60 Hz\nPixelpitch: 0.27 mm\nHelligkeit: 300 cd/m\u00b2\nKontrast: 1000:1 / 5000000:1 (dynamisch)\nFarbunterst\u00fctzung: 16,7 Millionen Farben\nFarbraum: 72% NTSC, 99% sRGB\nReaktionszeit: 4 ms (gray-to-gray)\nHorizontale Bildwiederholrate: 24 - 82 kHz\nHorizontaler Betrachtungswinkel: +89 / -89\nVertikaler Betrachtungswinkel: +89 / -89\nBildschirmbeschichtung: Matt\nOSD-Sprachen: Tschechisch, Englisch, Deutsch, Franz\u00f6sisch, Italienisch, Polnisch, Russisch, Spanisch, Holl\u00e4ndisch, Japanisch\nBesonderheiten: HDCP, Eco-Mode, flimmerfreie Technologie, i-Style Color, extrem schmale Blende an drei Seiten, Blue Light Reducer Function\nFarbe: Mattschwarz\nAbmessungen (Breite x Tiefe x H\u00f6he): 53.2 cm x 21 cm x 38.7 cm\nGewicht: 5.88 kg\nTyp: Lautsprecher - Stereo\nAusgangsleistung/Kanal: 2 Watt\nSchnittstellen: HDMI \u00a6 VGA \u00a6 DisplayPort \u00a6 4 x USB 2.0 \u00a6 Kopfh\u00f6rer\nEinstellungen der Anzeigeposition: H\u00f6he, Pivot (Rotation), Drehung, Neigung\nNeigungswinkel: -5/+22\nSchwenkwinkel: 90\nRotationswinkel: 180\nH\u00f6heneinstellung: 130 mm\nVESA-Halterung: 100 x 100 mm\nLeistungsmerkmale: Slot f\u00fcr Sicherheitsschloss (Kabelschloss getrennt erh\u00e4ltlich), Unterst\u00fctzung f\u00fcr VESA-Schnittstelle\nEnthaltene Kabel: 1 x DisplayPort-Kabel \u00a6 1 x USB-Kabel\nKennzeichnung: TUV GS, RoHS, WEEE, PSE Mark, REACH, ERP, VCCI Class B, EAC, UKCA\nSchlosstyp zur Diebstahlsicherung: Kensington Slot\nEingangsspannung: Wechselstrom 100-240 V (50/60 Hz)\nStromverbrauch SDR (eingeschaltet): 16 kWh/1.000 h\nStromverbrauch (typisch): 18 Watt\nStromverbrauch im Standby-Modus: 0.5 Watt\nStromverbrauch (Aus-Modus): 0.5 Watt\nTransportbreite: 67.5 cm\nTransporttiefe: 42 cm\nTransporth\u00f6he: 19 cm\nTransportgewicht: 7.59 kg\nENERGY STAR zertifiziert: Ja\nService und Support: Begrenzte Garantie - 3 Jahre - Vor-Ort",
    "reference_file": "offer_reference_769.json",
    "shop_name": "TaufNaus"
}