{
    "html_file": "offer_2265_9.html",
    "name": "NEC MultiSync EA271F-BK schwarz, 27\"",
    "offer_link": "https://www.e-tec.at/details.php?artnr=266930",
    "price": 420.7,
    "raw_specifications": {
        "Abmessungen (BxHxT)": "610x527x250mm (mit Standfu\u00df),  610x360x41mm (ohne Standfu\u00df)",
        "Anschl\u00fcsse - DVI": "1",
        "Anschl\u00fcsse - DisplayPort 1.1a": "1",
        "Anschl\u00fcsse - HDMI 1.4": "1",
        "Anschl\u00fcsse - VGA": "1",
        "Anschl\u00fcsse - VGA (60Hz@1920x1080)": "1",
        "Anschl\u00fcsse - VGA 60Hz@1920x1080": "1",
        "Anwendung": "station\u00e4r",
        "Audio": "Lautsprecher (2x 1W),  1x Line-Out",
        "Aufl\u00f6sung": "1920x1080",
        "Beschichtung": "matt (non-glare)",
        "Besonderheiten": "Slim Bezel,  Anwesenheitssensor,  Lichtsensor,  Sicherheitsschloss (Kensington),  DICOM",
        "Bildwiederholfrequenz": "60Hz",
        "Blickwinkel": "178\u00b0/178\u00b0",
        "Diagonale": "27\"/68.6cm",
        "Energieverbrauch SDR": "11kWh/1000h",
        "Ergonomie": "150mm (h\u00f6henverstellbar),  90\u00b0 (Pivot),  \u00b1170\u00b0 (drehbar),  +35\u00b0/-5\u00b0 (neigbar),  keine Angabe (Schr\u00e4glage)",
        "FRC": "unbekannt",
        "Farbe": "schwarz",
        "Farbraum - Adobe RGB": "75.5%",
        "Farbraum - sRGB": "102%",
        "Farbtiefe": "8bit (16.7 Mio. Farben)",
        "Form": "gerade (flat)",
        "Gewicht": "7.60kg (mit Standfu\u00df),  5.00kg (ohne Standfu\u00df)",
        "HDR": "N/A",
        "Helligkeit": "250cd/m\u00b2",
        "Herstellergarantie": "drei Jahre",
        "Hintergrundbeleuchtung": "White-LED,  flicker-free,  Blaulichtfilter",
        "Kontrast - dynamisch": "5.000:1",
        "Kontrast - statisch": "1.000:1",
        "Lautsprecher": "Ja",
        "Leistungsaufnahme": "45W (maximal),  20W (typisch),  keine Angabe (Energielabel alt A+++ bis G),  0.5W (Standby)",
        "Panel": "IPS (AH-IPS)",
        "Panel-Hersteller": "LG Display",
        "Reaktionszeit - GtG": "6ms",
        "Screen-to-Body-Ratio": "91.5% (berechnet)",
        "Seitenverh\u00e4ltnis": "16:9",
        "Signalfrequenz": "31-83kHz (horizontal),  56-75Hz (vertikal)",
        "Stromversorgung": "AC-In (internes Netzteil)",
        "USB-Hub In": "1x USB-B 3.0",
        "USB-Hub Out": "3x USB-A 3.0",
        "USB-Schreibweise": "Link",
        "VESA": "100x100 (belegt)",
        "VRR (Variable Refresh Rate)": "N/A",
        "Weitere Anschl\u00fcsse": "1x NEC ControlSync-In,  1x NEC ControlSync-Out"
    },
    "raw_specifications_text": "Abmessungen (BxHxT): 610x527x250mm (mit Standfu\u00df),  610x360x41mm (ohne Standfu\u00df)\nAnschl\u00fcsse - DisplayPort 1.1a: 1\nAnschl\u00fcsse - DVI: 1\nAnschl\u00fcsse - HDMI 1.4: 1\nAnschl\u00fcsse - VGA: 1\nAnschl\u00fcsse - VGA (60Hz@1920x1080): 1\nAnschl\u00fcsse - VGA 60Hz@1920x1080: 1\nAnwendung: station\u00e4r\nAudio: Lautsprecher (2x 1W),  1x Line-Out\nAufl\u00f6sung: 1920x1080\nBeschichtung: matt (non-glare)\nBesonderheiten: Slim Bezel,  Anwesenheitssensor,  Lichtsensor,  Sicherheitsschloss (Kensington),  DICOM\nBildwiederholfrequenz: 60Hz\nBlickwinkel: 178\u00b0/178\u00b0\nDiagonale: 27\"/68.6cm\nEnergieverbrauch SDR: 11kWh/1000h\nErgonomie: 150mm (h\u00f6henverstellbar),  90\u00b0 (Pivot),  \u00b1170\u00b0 (drehbar),  +35\u00b0/-5\u00b0 (neigbar),  keine Angabe (Schr\u00e4glage)\nFarbe: schwarz\nFarbraum - Adobe RGB: 75.5%\nFarbraum - sRGB: 102%\nFarbtiefe: 8bit (16.7 Mio. Farben)\nForm: gerade (flat)\nFRC: unbekannt\nGewicht: 7.60kg (mit Standfu\u00df),  5.00kg (ohne Standfu\u00df)\nHDR: N/A\nHelligkeit: 250cd/m\u00b2\nHerstellergarantie: drei Jahre\nHintergrundbeleuchtung: White-LED,  flicker-free,  Blaulichtfilter\nKontrast - dynamisch: 5.000:1\nKontrast - statisch: 1.000:1\nLautsprecher: Ja\nLeistungsaufnahme: 45W (maximal),  20W (typisch),  keine Angabe (Energielabel alt A+++ bis G),  0.5W (Standby)\nPanel: IPS (AH-IPS)\nPanel-Hersteller: LG Display\nReaktionszeit - GtG: 6ms\nScreen-to-Body-Ratio: 91.5% (berechnet)\nSeitenverh\u00e4ltnis: 16:9\nSignalfrequenz: 31-83kHz (horizontal),  56-75Hz (vertikal)\nStromversorgung: AC-In (internes Netzteil)\nUSB-Hub In: 1x USB-B 3.0\nUSB-Hub Out: 3x USB-A 3.0\nUSB-Schreibweise: Link\nVESA: 100x100 (belegt)\nVRR (Variable Refresh Rate): N/A\nWeitere Anschl\u00fcsse: 1x NEC ControlSync-In,  1x NEC ControlSync-Out",
    "reference_file": "offer_reference_2265.json",
    "shop_name": "e-tec.at"
}