{
    "html_file": "offer_1822_0.html",
    "name": "Dell S2421HSX schwarz, 23.8\"",
    "offer_link": "https://www.amazon.de/dp/B0BWNG4454?linkCode=xm2&camp=2025&creative=165953&smid=A3JWKAKR8XB7XF&creativeASIN=B0BWNG4454&tag=geizhals1-21",
    "price": 151.26,
    "raw_specifications": {
        "ASIN": "B0BWNG4454",
        "Amazon Bestseller-Rang": "Nr. 81,643 in Computer & Zubeh\u00f6r (Siehe Top 100 in Computer & Zubeh\u00f6r)  Nr. 1,497 in Monitore",
        "Artikelgewicht": "\u200e3,2 Kilograms",
        "Batterien enthalten": "\u200eNein",
        "Bildschirmaufl\u00f6sung": "\u200e1920x1080",
        "Display-Gr\u00f6\u00dfe": "\u200e23,8 Zoll",
        "Durchschnittliche Kundenbewertung": "4,5  4,5 von 5 Sternen    \n    5.232 Sternebewertungen   \n\n\n 4,5 von 5 Sternen",
        "Farbe": "\u200eBlack",
        "Garantierte Software-Updates bis": "\u200eunbekannt",
        "Hersteller": "\u200eDell",
        "Im Angebot von Amazon.de seit": "9. August 2023",
        "L\u00f6sung": "\u200e1920 x 1080 Pixels",
        "Marke": "\u200eDell",
        "Modell/Serie": "\u200eDell 24 Monitor - S2421HSX",
        "Modellnummer": "\u200eS2421HSX",
        "Produktabmessungen": "\u200e15,97 x 53,78 x 34,68 cm; 3,2 Kilogramm",
        "Volt": "\u200e240 Volt (Wechselstrom)"
    },
    "raw_specifications_text": "Marke: \u200eDell\nHersteller: \u200eDell\nModell/Serie: \u200eDell 24 Monitor - S2421HSX\nProduktabmessungen: \u200e15,97 x 53,78 x 34,68 cm; 3,2 Kilogramm\nModellnummer: \u200eS2421HSX\nFarbe: \u200eBlack\nDisplay-Gr\u00f6\u00dfe: \u200e23,8 Zoll\nBildschirmaufl\u00f6sung: \u200e1920x1080\nL\u00f6sung: \u200e1920 x 1080 Pixels\nVolt: \u200e240 Volt (Wechselstrom)\nBatterien enthalten: \u200eNein\nArtikelgewicht: \u200e3,2 Kilograms\nGarantierte Software-Updates bis: \u200eunbekannt\nASIN: B0BWNG4454\nDurchschnittliche Kundenbewertung: 4,5  4,5 von 5 Sternen    \n    5.232 Sternebewertungen   \n\n\n 4,5 von 5 Sternen\nAmazon Bestseller-Rang: Nr. 81,643 in Computer & Zubeh\u00f6r (Siehe Top 100 in Computer & Zubeh\u00f6r)  Nr. 1,497 in Monitore\nIm Angebot von Amazon.de seit: 9. August 2023",
    "reference_file": "offer_reference_1822.json",
    "shop_name": "Amazon.at"
}