{
    "html_file": "offer_187_34.html",
    "name": "iiyama G-Master GCB3280QSU-B1 Red Eagle, 31.5\"",
    "offer_link": "https://ms-it-beratung.at/shop/details.php?art=435947&artname=IIYAMA+80.0cm+%2831%2C5%22%29+GCB3280QSU-B1+16%3A9+2xHDMI%2BDP%2B2xUSB+Cu.+ret",
    "price": 364.0,
    "raw_specifications": {
        "AC Eingangsfrequenz": "50/60 Hz",
        "AC Eingangsspannung": "100 - 240 V",
        "AMD FreeSync": "Ja",
        "Anzahl DisplayPort Anschl\u00fcsse": "1",
        "Anzahl HDMI-Anschl\u00fcsse": "2",
        "Anzahl der Farben des Displays": "16,7 Millionen Farben",
        "Anzahl der Lautsprecher": "2",
        "Anzahl der vorgeschalteten Steckpl\u00e4tze": "2",
        "Bewertung der Bildschirmkr\u00fcmmung": "1500R",
        "Bildschirmdiagonale": "80 cm (31.5\")",
        "Bildschirmform": "Gebogen",
        "Bildschirmtechnologie": "LED",
        "Bildwinkel, horizontal": "178\u00b0",
        "Bildwinkel, vertikal": "178\u00b0",
        "Display-Aufl\u00f6sung": "2560 x 1440 Pixel",
        "Eingebaute Lautsprecher": "Ja",
        "Energieeffizienzklasse (HDR)": "G",
        "Energieeffizienzklasse (SDR)": "F",
        "Energieeffizienzskala": "A bis G",
        "Energieverbrauch (HDR) pro 1.000 Stunden": "53 kWh",
        "Energieverbrauch (SDR) pro 1.000 Stunden": "29 kWh",
        "Flimmerfreie Technologie": "Ja",
        "Ger\u00e4tebreite (inkl. Fu\u00df)": "709,5 mm",
        "Ger\u00e4teh\u00f6he (inkl. Fu\u00df)": "623 mm",
        "Ger\u00e4tetiefe (inkl. Fu\u00df)": "290 mm",
        "Gewicht (mit St\u00e4nder)": "9 kg",
        "HDCP": "Ja",
        "HDMI": "Ja",
        "Helligkeit (typisch)": "350 cd/m\u00b2",
        "High Dynamic Range Video (HDR) Unterst\u00fctzung": "Ja",
        "Horizontaler Scanbereich": "30 - 245 kHz",
        "H\u00f6heneinstellung": "15 cm",
        "H\u00f6henverstellung": "Ja",
        "Integrierte Kamera": "Nein",
        "Integrierter USB-Hub": "Ja",
        "Kabelsperre-Slot": "Ja",
        "Kontrastverh\u00e4ltnis": "3000:1",
        "Kontrastverh\u00e4ltnis (dynamisch)": "80000000:1",
        "Kopfh\u00f6rerausgang": "Ja",
        "Marktpositionierung": "Gaming",
        "Maximale Bildwiederholrate": "165 Hz",
        "Men\u00fcsprachen": "Tschechisch, Deutsch, Niederl\u00e4ndisch, Englisch, Spanisch, Franz\u00f6sisch, Italienisch, Japanisch, Polnisch, Portugiesisch, Russisch",
        "Mitgelieferte Kabel": "AC, DisplayPort, HDMI, USB",
        "Natives Seitenverh\u00e4ltnis": "16:9",
        "Neigungswinkelbereich": "-5 - 23\u00b0",
        "On-Screen-Display (OSD)": "Ja",
        "Panel-Montage-Schnittstelle": "100 x 100 mm",
        "Panel-Typ": "VA",
        "Pixel Abstand": "0,272 x 0,272 mm",
        "Produktfarbe": "Schwarz",
        "RMS-Leistung": "4 W",
        "Reaktionszeit": "0,2 ms",
        "Schwenkbar": "Ja",
        "Sichtbare Gr\u00f6\u00dfe (horizontal)": "69,7 cm",
        "Sichtbare Gr\u00f6\u00dfe (vertikal)": "39,2 cm",
        "Slot-Typ Kabelsperre": "Kensington",
        "Stromverbrauch (Standardbetrieb)": "40 W",
        "Stromverbrauch (Standby)": "0,5 W",
        "Stromverbrauch (aus)": "0,3 W",
        "Touchscreen": "Nein",
        "VESA-Halterung": "Ja"
    },
    "raw_specifications_text": "Bildschirmdiagonale: 80 cm (31.5\")\nDisplay-Aufl\u00f6sung: 2560 x 1440 Pixel\nNatives Seitenverh\u00e4ltnis: 16:9\nBildschirmtechnologie: LED\nTouchscreen: Nein\nPanel-Typ: VA\nHelligkeit (typisch): 350 cd/m\u00b2\nReaktionszeit: 0,2 ms\nBildschirmform: Gebogen\nBewertung der Bildschirmkr\u00fcmmung: 1500R\nKontrastverh\u00e4ltnis: 3000:1\nKontrastverh\u00e4ltnis (dynamisch): 80000000:1\nMaximale Bildwiederholrate: 165 Hz\nBildwinkel, horizontal: 178\u00b0\nBildwinkel, vertikal: 178\u00b0\nAnzahl der Farben des Displays: 16,7 Millionen Farben\nPixel Abstand: 0,272 x 0,272 mm\nHorizontaler Scanbereich: 30 - 245 kHz\nSichtbare Gr\u00f6\u00dfe (horizontal): 69,7 cm\nSichtbare Gr\u00f6\u00dfe (vertikal): 39,2 cm\nHigh Dynamic Range Video (HDR) Unterst\u00fctzung: Ja\nAMD FreeSync: Ja\nFlimmerfreie Technologie: Ja\nEingebaute Lautsprecher: Ja\nIntegrierte Kamera: Nein\nAnzahl der Lautsprecher: 2\nRMS-Leistung: 4 W\nMarktpositionierung: Gaming\nProduktfarbe: Schwarz\nIntegrierter USB-Hub: Ja\nAnzahl der vorgeschalteten Steckpl\u00e4tze: 2\nHDMI: Ja\nAnzahl HDMI-Anschl\u00fcsse: 2\nAnzahl DisplayPort Anschl\u00fcsse: 1\nKopfh\u00f6rerausgang: Ja\nHDCP: Ja\nVESA-Halterung: Ja\nPanel-Montage-Schnittstelle: 100 x 100 mm\nKabelsperre-Slot: Ja\nSlot-Typ Kabelsperre: Kensington\nH\u00f6henverstellung: Ja\nH\u00f6heneinstellung: 15 cm\nSchwenkbar: Ja\nNeigungswinkelbereich: -5 - 23\u00b0\nOn-Screen-Display (OSD): Ja\nMen\u00fcsprachen: Tschechisch, Deutsch, Niederl\u00e4ndisch, Englisch, Spanisch, Franz\u00f6sisch, Italienisch, Japanisch, Polnisch, Portugiesisch, Russisch\nEnergieeffizienzklasse (SDR): F\nEnergieeffizienzklasse (HDR): G\nEnergieverbrauch (SDR) pro 1.000 Stunden: 29 kWh\nEnergieverbrauch (HDR) pro 1.000 Stunden: 53 kWh\nStromverbrauch (Standardbetrieb): 40 W\nStromverbrauch (Standby): 0,5 W\nStromverbrauch (aus): 0,3 W\nAC Eingangsspannung: 100 - 240 V\nAC Eingangsfrequenz: 50/60 Hz\nEnergieeffizienzskala: A bis G\nMitgelieferte Kabel: AC, DisplayPort, HDMI, USB\nGer\u00e4tebreite (inkl. Fu\u00df): 709,5 mm\nGer\u00e4tetiefe (inkl. Fu\u00df): 290 mm\nGer\u00e4teh\u00f6he (inkl. Fu\u00df): 623 mm\nGewicht (mit St\u00e4nder): 9 kg",
    "reference_file": "offer_reference_187.json",
    "shop_name": "ms-it-beratung"
}