{
    "html_file": "offer_673_20.html",
    "name": "LG UltraGear 24GN60R-B, 23.8\"",
    "offer_link": "https://www.electronicshop24.at/product_info.php?products_id=160000000269651185&ano=S269651185&mno=24GN60R-B&ean=8806091852267&utm_medium=cpc&utm_campaign=preisvergleich&utm_content=item&utm_source=geizhals&ref=geizhals",
    "price": 157.0,
    "raw_specifications": {
        "Abmessungen (Breite x Tiefe x H\u00f6he)": "54.08 cm x 18.05 cm x 40.89 cm - mit Fu\u00df",
        "Adaptive-Sync Technologie": "AMD FreeSync Premium",
        "Besonderheiten": "Spielmodus, On-screen Digital Controls, FPS Mode, Crosshair Display, Flicker Safe, Reader Mode, RTS Mode, Intelligente Energiespartechnologie, Color Calibrated, Black Stabilizer, DAS Mode (Dynamic Action Sync), Mega DFC, 1ms Motion Blur Reduction, Low Framerate Compensation (LFC), Vivid Mode, nahezu rahmenloses Display an 3 Seiten, 8-bit Farbtiefe, HDR Effect, Auto Input Switch, BOE module, H1B backlight array",
        "Bildschirmbeschichtung": "Blendfrei",
        "Bildschirmtyp": "IPS",
        "Details zu Abmessungen & Gewicht": "Mit Fu\u00df - Breite: 54.08 cm - Tiefe: 18.05 cm - H\u00f6he: 40.89 cm \u00a6 Ohne Fu\u00df - Breite: 54.08 cm - Tiefe: 4.28 cm - H\u00f6he: 32.38 cm",
        "Diagonalabmessung": "60 cm (24\")",
        "Display-Typ": "LED-hintergrundbeleuchteter LCD-Monitor / TFT-Aktivmatrix",
        "Eingangsspannung": "Wechselstrom 100-240 V (50/60 Hz)",
        "Einstellungen der Anzeigeposition": "Neigung",
        "Energie Effizienzklasse": "Klasse E",
        "Energieklasse (HDR)": "Klasse G",
        "Farbe": "Mattschwarz, high glossy metallic red deco",
        "Farbraum": "97% sRGB (CIE 1931), 99% sRGB (CIE 1931)",
        "Farbunterst\u00fctzung": "16,7 Millionen Farben (8-Bit)",
        "Gaming": "Ja",
        "HDR-Format": "HDR10",
        "Helligkeit": "300 cd/m\u00b2",
        "Hintergrundbeleuchtungs-Technologie": "Edge LED",
        "Horizontaler Betrachtungswinkel": "178",
        "Kennzeichnung": "UL, VCCI, cUL, CB, TUV Ergo, ERP, BIS, EPA 7.0",
        "Kontrast": "1000:1",
        "Mitgelieferte Software": "LG On-Screen Control",
        "Native Aufl\u00f6sung": "Full HD (1080p) 1920 x 1080 bei 144 Hz",
        "Neigungswinkel": "-5/+15",
        "OSD-Sprachen": "Multilingual",
        "Pixelpitch": "0.2745 mm",
        "Reaktionszeit": "1 ms (Gray-to-Gray)",
        "Schnittstellen": "2 x HDMI \u00a6 DisplayPort 1.4 \u00a6 Kopfh\u00f6rer",
        "Seitenverh\u00e4ltnis": "16:9",
        "Sichtbare Bildfl\u00e4che": "60.5 cm (23.8\")",
        "Stromverbrauch (Aus-Modus)": "0.3 Watt",
        "Stromverbrauch (max.)": "30.2 Watt",
        "Stromverbrauch (typisch)": "28 Watt",
        "Stromverbrauch HDR (eingeschaltet)": "24 kWh/1.000 h",
        "Stromverbrauch SDR (eingeschaltet)": "18 kWh/1.000 h",
        "Stromverbrauch im Standby-Modus": "0.5 Watt",
        "Transportbreite": "60.1 cm",
        "Transportgewicht": "5 kg",
        "Transporth\u00f6he": "12.9 cm",
        "Transporttiefe": "38.4 cm",
        "VESA-Halterung": "100 x 100 mm",
        "Vertikale Bildwiederholrate": "48 - 144 Hz",
        "Vertikaler Betrachtungswinkel": "178"
    },
    "raw_specifications_text": "Display-Typ: LED-hintergrundbeleuchteter LCD-Monitor / TFT-Aktivmatrix\nEnergie Effizienzklasse: Klasse E\nEnergieklasse (HDR): Klasse G\nDiagonalabmessung: 60 cm (24\")\nSichtbare Bildfl\u00e4che: 60.5 cm (23.8\")\nAdaptive-Sync Technologie: AMD FreeSync Premium\nBildschirmtyp: IPS\nSeitenverh\u00e4ltnis: 16:9\nNative Aufl\u00f6sung: Full HD (1080p) 1920 x 1080 bei 144 Hz\nPixelpitch: 0.2745 mm\nHelligkeit: 300 cd/m\u00b2\nKontrast: 1000:1\nHDR-Format: HDR10\nFarbunterst\u00fctzung: 16,7 Millionen Farben (8-Bit)\nFarbraum: 97% sRGB (CIE 1931), 99% sRGB (CIE 1931)\nReaktionszeit: 1 ms (Gray-to-Gray)\nVertikale Bildwiederholrate: 48 - 144 Hz\nGaming: Ja\nHorizontaler Betrachtungswinkel: 178\nVertikaler Betrachtungswinkel: 178\nBildschirmbeschichtung: Blendfrei\nHintergrundbeleuchtungs-Technologie: Edge LED\nOSD-Sprachen: Multilingual\nBesonderheiten: Spielmodus, On-screen Digital Controls, FPS Mode, Crosshair Display, Flicker Safe, Reader Mode, RTS Mode, Intelligente Energiespartechnologie, Color Calibrated, Black Stabilizer, DAS Mode (Dynamic Action Sync), Mega DFC, 1ms Motion Blur Reduction, Low Framerate Compensation (LFC), Vivid Mode, nahezu rahmenloses Display an 3 Seiten, 8-bit Farbtiefe, HDR Effect, Auto Input Switch, BOE module, H1B backlight array\nFarbe: Mattschwarz, high glossy metallic red deco\nAbmessungen (Breite x Tiefe x H\u00f6he): 54.08 cm x 18.05 cm x 40.89 cm - mit Fu\u00df\nSchnittstellen: 2 x HDMI \u00a6 DisplayPort 1.4 \u00a6 Kopfh\u00f6rer\nEinstellungen der Anzeigeposition: Neigung\nNeigungswinkel: -5/+15\nVESA-Halterung: 100 x 100 mm\nKennzeichnung: UL, VCCI, cUL, CB, TUV Ergo, ERP, BIS, EPA 7.0\nEingangsspannung: Wechselstrom 100-240 V (50/60 Hz)\nStromverbrauch SDR (eingeschaltet): 18 kWh/1.000 h\nStromverbrauch HDR (eingeschaltet): 24 kWh/1.000 h\nStromverbrauch (typisch): 28 Watt\nStromverbrauch (max.): 30.2 Watt\nStromverbrauch im Standby-Modus: 0.5 Watt\nStromverbrauch (Aus-Modus): 0.3 Watt\nMitgelieferte Software: LG On-Screen Control\nDetails zu Abmessungen & Gewicht: Mit Fu\u00df - Breite: 54.08 cm - Tiefe: 18.05 cm - H\u00f6he: 40.89 cm \u00a6 Ohne Fu\u00df - Breite: 54.08 cm - Tiefe: 4.28 cm - H\u00f6he: 32.38 cm\nTransportbreite: 60.1 cm\nTransporttiefe: 38.4 cm\nTransporth\u00f6he: 12.9 cm\nTransportgewicht: 5 kg",
    "reference_file": "offer_reference_673.json",
    "shop_name": "ElectronicShop24"
}