{
    "html_file": "offer_1189_8.html",
    "name": "iiyama ProLite X4373UHSU-B1, 42.5\"",
    "offer_link": "https://www.alternate.at/iiyama/X4373UHSU-B1-Public-Display/html/product/1789762?partner=AtGeizhalsat&campaign=Public+Display/iiyama/1789762",
    "price": 538.0,
    "raw_specifications": {
        "": "Kensington-Schloss",
        "Abmessungen": "Breite: 97,75 cm x H\u00f6he: 62,15 cm x Tiefe/L\u00e4nge: 25,1 cm",
        "Anschl\u00fcsse": "2x HDMI-Eingang, 1x DisplayPort-Eingang, 1x DisplayPort-Ausgang, 1x Mini-DisplayPort-Eingang, 1x Kopfh\u00f6rer-Ausgang, 2x USB-A-2.0, 2x USB-A-3.2 Gen 1 (5 Gbit/s)",
        "Bild": "Format",
        "Bildschirmaufl\u00f6sung": "3840 x 2160 Pixel",
        "Bildschirmdiagonale": "108 cm (43 Zoll)",
        "EAN": "4948570118519",
        "Energieeffizienzklasse (HDR)": "G",
        "Energieeffizienzklasse (SDR)": "G (A - G)",
        "Energieverbauch pro 1000 Stunden (HDR)": "102 kWh",
        "Energieverbauch pro 1000 Stunden (SDR)": "54 kWh",
        "Ergonomie": "Typ",
        "Farbe": "schwarz",
        "Features": "Flimmerfreie LEDs, Blaulichtfilter",
        "Frequenz": "Horizontal",
        "Gewicht": "14,5 kg",
        "Hersteller-Nr.": "X4373UHSU-B1",
        "Lautsprecher": "2 Lautsprecher",
        "Leistungsaufnahme im Bereitschafts- und Aus-Zustand": "0,5 Watt",
        "Leistungsaufnahme im Ein-Zustand bei Standard-Dynamikumfang (SDR)": "54.1 Watt",
        "Leistungsaufnahme im Ein-Zustand bei hohem Dynamikumfang (HDR)": "102 Watt",
        "Stromversorgung": "Eco-Off",
        "Typ": "Public Display",
        "Wandhalterung": "VESA kompatibel (200 x 100 mm)",
        "Zubeh\u00f6r": "Vorhanden"
    },
    "raw_specifications_text": "Energieeffizienzklasse (SDR): G (A - G)\nEnergieverbauch pro 1000 Stunden (SDR): 54 kWh\nEnergieeffizienzklasse (HDR): G\nEnergieverbauch pro 1000 Stunden (HDR): 102 kWh\nLeistungsaufnahme im Ein-Zustand bei Standard-Dynamikumfang (SDR): 54.1 Watt\nLeistungsaufnahme im Ein-Zustand bei hohem Dynamikumfang (HDR): 102 Watt\nLeistungsaufnahme im Bereitschafts- und Aus-Zustand: 0,5 Watt\nBildschirmdiagonale: 108 cm (43 Zoll)\nBildschirmaufl\u00f6sung: 3840 x 2160 Pixel\nTyp: Public Display\nFarbe: schwarz\nEAN: 4948570118519\nHersteller-Nr.: X4373UHSU-B1\nBild: Format\n: Kensington-Schloss\nAnschl\u00fcsse: 2x HDMI-Eingang, 1x DisplayPort-Eingang, 1x DisplayPort-Ausgang, 1x Mini-DisplayPort-Eingang, 1x Kopfh\u00f6rer-Ausgang, 2x USB-A-2.0, 2x USB-A-3.2 Gen 1 (5 Gbit/s)\nErgonomie: Typ\nStromversorgung: Eco-Off\nFrequenz: Horizontal\nLautsprecher: 2 Lautsprecher\nWandhalterung: VESA kompatibel (200 x 100 mm)\nFeatures: Flimmerfreie LEDs, Blaulichtfilter\nZubeh\u00f6r: Vorhanden\nAbmessungen: Breite: 97,75 cm x H\u00f6he: 62,15 cm x Tiefe/L\u00e4nge: 25,1 cm\nGewicht: 14,5 kg",
    "reference_file": "offer_reference_1189.json",
    "shop_name": "Alternate.at"
}