{
    "html_file": "offer_986_10.html",
    "name": "Samsung Smart Monitor M8 M80B Warm White, 32\"",
    "offer_link": "https://direkt.jacob.de/produkte/samsung-ls32bm801uu-81-3-ls32bm801uuxen-artnr-7556314.html?utm_source=geizhals&utm_medium=cpc&utm_campaign=Preisvergleich&ref=103",
    "price": 467.48,
    "raw_specifications": {
        "AC Eingangsspannung": "100 - 240 V",
        "AMD FreeSync": "Nein",
        "Anzahl Micro HDMI Anschl\u00fcsse": "1",
        "Anzahl der Farben des Displays": "1 Milliarden Farben",
        "Auf Ansicht tippen": "Ja",
        "Betriebstemperatur": "10 - 40 \u00b0C",
        "Bildschirmaufl\u00f6sung": "3840 x 2160 Pixel",
        "Bildschirmdiagonale": "81,3 cm (32\" )",
        "Bildschirmdiagonale (cm)": "81,3 cm",
        "Bildschirmform": "Flach",
        "Bildschirmspiegelung": "Ja",
        "Bildwinkel, horizontal": "178\u00b0",
        "Bildwinkel, vertikal": "178\u00b0",
        "Bluetooth": "Ja",
        "Bluetooth-Version": "4.2",
        "Breite (ohne Standfu\u00df)": "71,3 cm",
        "ConnectShare (USB)": "Ja",
        "DVI Anschluss": "Nein",
        "Digitales Signalformatsystem": "Nicht unterst\u00fctzt",
        "Eingebaute Lautsprecher": "Ja",
        "Energie Effizienzklasse": "G",
        "Energieeffizienzklasse (HDR)": "G",
        "Energieeffizienzklasse (SDR)": "G",
        "Energieeffizienzskala": "A bis G",
        "Energieverbrauch (HDR) pro 1.000 Stunden": "75 kWh",
        "Energieverbrauch (SDR) pro 1.000 Stunden": "40 kWh",
        "Fernbedienung enthalten": "Ja",
        "Flimmerfreie Technologie": "Ja",
        "Funktioniert mit  Samsung Bixby": "Ja",
        "Fu\u00dffarbe": "Wei\u00df",
        "Ger\u00e4tebreite (inkl. Fu\u00df)": "713,4 mm",
        "Ger\u00e4teh\u00f6he (inkl. Fu\u00df)": "575,2 mm",
        "Ger\u00e4tetiefe (inkl. Fu\u00df)": "203,8 mm",
        "Gewicht (mit St\u00e4nder)": "6,7 kg",
        "Gewicht (ohne St\u00e4nder)": "4,4 kg",
        "HD-Typ": "4K Ultra HD",
        "HDMI": "Ja",
        "HDMI-Version": "2.0",
        "Helligkeit (typisch)": "400 cd/m\u00b2",
        "High Dynamic Range Video (HDR) Unterst\u00fctzung": "Ja",
        "H\u00f6he (ohne Standfu\u00df)": "41,9 cm",
        "H\u00f6heneinstellung": "12 cm",
        "H\u00f6henverstellung": "Ja",
        "Installiertes Betriebssystem": "Tizen",
        "Integrierte Kamera": "Nein",
        "Integrierter USB-Hub": "Ja",
        "Kabelsperre-Slot": "Nein",
        "Kontrastverh\u00e4ltnis": "3000:1",
        "Kopfh\u00f6rerausgang": "Nein",
        "Low-Blue-Light-Technologie": "Ja",
        "Marktpositionierung": "Intelligent",
        "Maximale Bildwiederholrate": "60 Hz",
        "Mitgelieferte Kabel": "AC, USB Typ-C",
        "NVIDIA G-SYNC": "Nein",
        "Natives Seitenverh\u00e4ltnis": "16:9",
        "Neigungswinkelbereich": "2 - 15\u00b0",
        "Netzteiltyp": "Extern",
        "Office 365 Support": "Ja",
        "Paketgewicht": "9,4 kg",
        "Panel-Typ": "VA",
        "Produktfarbe": "Wei\u00df",
        "Reaktionszeit": "4 ms",
        "Relative Luftfeuchtigkeit in Betrieb": "10 - 80%",
        "Spiel-Modus": "Ja",
        "Stromverbrauch (Standardbetrieb)": "40 W",
        "Stromverbrauch (Standby)": "0,5 W",
        "St\u00e4nder enthalten": "Ja",
        "TV Plus": "Ja",
        "TV Tuner integriert": "Nein",
        "Technologie mit hohem Dynamikbereich (HDR)": "High Dynamic Range 10 (HDR10)",
        "Tiefe (ohne Standfu\u00df)": "2,23 cm",
        "Ton-Spiegelung": "Ja",
        "USB-Hub-Version": "3.2 Gen 1 (3.1 Gen 1)",
        "Unterst\u00fctzung der SmartThings-App": "Ja",
        "VESA-Halterung": "Nein",
        "Verpackungsbreite": "798 mm",
        "Verpackungsh\u00f6he": "124 mm",
        "Verpackungstiefe": "568 mm",
        "Virtueller Assistent": "Amazon Alexa",
        "WLAN": "Ja",
        "WLAN-Standards": "Wi-Fi 5 (802.11ac)",
        "kippbar": "Ja",
        "sRGB Abdeckung (klassisch)": "99%"
    },
    "raw_specifications_text": "Bildschirmdiagonale: 81,3 cm (32\" )\nBildschirmaufl\u00f6sung: 3840 x 2160 Pixel\nEnergie Effizienzklasse: G\nNatives Seitenverh\u00e4ltnis: 16:9\nPanel-Typ: VA\nHD-Typ: 4K Ultra HD\nBildschirmform: Flach\nKontrastverh\u00e4ltnis: 3000:1\nMaximale Bildwiederholrate: 60 Hz\nAnzahl der Farben des Displays: 1 Milliarden Farben\nHelligkeit (typisch): 400 cd/m\u00b2\nReaktionszeit: 4 ms\nBildwinkel, horizontal: 178\u00b0\nBildwinkel, vertikal: 178\u00b0\nBildschirmdiagonale (cm): 81,3 cm\nHigh Dynamic Range Video (HDR) Unterst\u00fctzung: Ja\nTechnologie mit hohem Dynamikbereich (HDR): High Dynamic Range 10 (HDR10)\nsRGB Abdeckung (klassisch): 99%\nNVIDIA G-SYNC: Nein\nAMD FreeSync: Nein\nConnectShare (USB): Ja\nFlimmerfreie Technologie: Ja\nLow-Blue-Light-Technologie: Ja\nTon-Spiegelung: Ja\nBildschirmspiegelung: Ja\nSpiel-Modus: Ja\nTV Plus: Ja\nUnterst\u00fctzung der SmartThings-App: Ja\nFunktioniert mit  Samsung Bixby: Ja\nOffice 365 Support: Ja\nAuf Ansicht tippen: Ja\nVirtueller Assistent: Amazon Alexa\nInstalliertes Betriebssystem: Tizen\nEingebaute Lautsprecher: Ja\nIntegrierte Kamera: Nein\nMarktpositionierung: Intelligent\nProduktfarbe: Wei\u00df\nFu\u00dffarbe: Wei\u00df\nIntegrierter USB-Hub: Ja\nHDMI: Ja\nKopfh\u00f6rerausgang: Nein\nUSB-Hub-Version: 3.2 Gen 1 (3.1 Gen 1)\nDVI Anschluss: Nein\nHDMI-Version: 2.0\nAnzahl Micro HDMI Anschl\u00fcsse: 1\nVESA-Halterung: Nein\nKabelsperre-Slot: Nein\nH\u00f6henverstellung: Ja\nH\u00f6heneinstellung: 12 cm\nkippbar: Ja\nNeigungswinkelbereich: 2 - 15\u00b0\nEnergieeffizienzklasse (SDR): G\nEnergieeffizienzklasse (HDR): G\nEnergieverbrauch (SDR) pro 1.000 Stunden: 40 kWh\nEnergieverbrauch (HDR) pro 1.000 Stunden: 75 kWh\nStromverbrauch (Standardbetrieb): 40 W\nStromverbrauch (Standby): 0,5 W\nAC Eingangsspannung: 100 - 240 V\nNetzteiltyp: Extern\nEnergieeffizienzskala: A bis G\nWLAN: Ja\nWLAN-Standards: Wi-Fi 5 (802.11ac)\nBluetooth: Ja\nBluetooth-Version: 4.2\nBetriebstemperatur: 10 - 40 \u00b0C\nRelative Luftfeuchtigkeit in Betrieb: 10 - 80%\nGer\u00e4tebreite (inkl. Fu\u00df): 713,4 mm\nGer\u00e4tetiefe (inkl. Fu\u00df): 203,8 mm\nGer\u00e4teh\u00f6he (inkl. Fu\u00df): 575,2 mm\nGewicht (mit St\u00e4nder): 6,7 kg\nBreite (ohne Standfu\u00df): 71,3 cm\nTiefe (ohne Standfu\u00df): 2,23 cm\nH\u00f6he (ohne Standfu\u00df): 41,9 cm\nGewicht (ohne St\u00e4nder): 4,4 kg\nSt\u00e4nder enthalten: Ja\nMitgelieferte Kabel: AC, USB Typ-C\nFernbedienung enthalten: Ja\nVerpackungsbreite: 798 mm\nVerpackungstiefe: 568 mm\nVerpackungsh\u00f6he: 124 mm\nPaketgewicht: 9,4 kg\nTV Tuner integriert: Nein\nDigitales Signalformatsystem: Nicht unterst\u00fctzt",
    "reference_file": "offer_reference_986.json",
    "shop_name": "Jacob Elektronik direkt (AT)"
}