{
    "html_file": "offer_287_12.html",
    "name": "LG 24BK55YP-B, 23.8\"",
    "offer_link": "https://www.alternate.at/LG/24BK55YP-B-LED-Monitor/html/product/1913700?partner=AtGeizhalsat&campaign=Monitor/LG/1913700",
    "price": 101.9,
    "raw_specifications": {
        "": "Ausgangsleistung",
        "Abmessungen": "Breite: 55,38 cm x H\u00f6he: 51,29 cm x Tiefe/L\u00e4nge: 24 cm",
        "Anschl\u00fcsse": "1x DVI-D-Eingang, 1x HDMI-Eingang, 1x DisplayPort-Eingang, (DisplayPort-Version: 1.2), 1x VGA-Eingang, 1x 3,5-mm-Audio-Eingang, 1x Kopfh\u00f6rer-Ausgang, 2x USB-A-2.0",
        "Bild": "Glaretyp",
        "Bildschirmaufl\u00f6sung": "1.920 x 1.080 Pixel",
        "Bildschirmdiagonale": "60,45 cm (23,8 Zoll)",
        "EAN": "8806091969156",
        "Energieeffizienzklasse (SDR)": "E (A - G)",
        "Energieverbauch pro 1000 Stunden (SDR)": "17 kWh",
        "Ergonomie": "Typ",
        "Farbe": "schwarz (matt)",
        "Frequenz": "Vertikal",
        "Geeignet f\u00fcr": "Business",
        "Gewicht": "5,7 kg",
        "Hersteller-Nr.": "24BK55YP-B.AEU",
        "Lautsprecher": "2 Lautsprecher",
        "Leistungsaufnahme im Bereitschafts- und Aus-Zustand": "0,5 Watt",
        "Leistungsaufnahme im Ein-Zustand bei Standard-Dynamikumfang (SDR)": "16,9 Watt",
        "Standards": "Video",
        "Stromversorgung": "Stromverbrauch",
        "Typ": "LED-Monitor",
        "Wandhalterung": "VESA kompatibel (100 x 100 mm)",
        "Weitere Informationen": "Ma\u00dfe ohne Standfu\u00df: 553,8 x 333,1 x 58,4 mm (BxHxT) | Gewicht ohne Standfu\u00df: 3600 Gramm",
        "Zubeh\u00f6r": "Vorhanden"
    },
    "raw_specifications_text": "Energieeffizienzklasse (SDR): E (A - G)\nEnergieverbauch pro 1000 Stunden (SDR): 17 kWh\nLeistungsaufnahme im Ein-Zustand bei Standard-Dynamikumfang (SDR): 16,9 Watt\nLeistungsaufnahme im Bereitschafts- und Aus-Zustand: 0,5 Watt\nBildschirmdiagonale: 60,45 cm (23,8 Zoll)\nBildschirmaufl\u00f6sung: 1.920 x 1.080 Pixel\nTyp: LED-Monitor\nFarbe: schwarz (matt)\nEAN: 8806091969156\nHersteller-Nr.: 24BK55YP-B.AEU\nGeeignet f\u00fcr: Business\nBild: Glaretyp\n: Ausgangsleistung\nFrequenz: Vertikal\nAnschl\u00fcsse: 1x DVI-D-Eingang, 1x HDMI-Eingang, 1x DisplayPort-Eingang, (DisplayPort-Version: 1.2), 1x VGA-Eingang, 1x 3,5-mm-Audio-Eingang, 1x Kopfh\u00f6rer-Ausgang, 2x USB-A-2.0\nErgonomie: Typ\nStromversorgung: Stromverbrauch\nLautsprecher: 2 Lautsprecher\nStandards: Video\nWandhalterung: VESA kompatibel (100 x 100 mm)\nWeitere Informationen: Ma\u00dfe ohne Standfu\u00df: 553,8 x 333,1 x 58,4 mm (BxHxT) | Gewicht ohne Standfu\u00df: 3600 Gramm\nZubeh\u00f6r: Vorhanden\nAbmessungen: Breite: 55,38 cm x H\u00f6he: 51,29 cm x Tiefe/L\u00e4nge: 24 cm\nGewicht: 5,7 kg",
    "reference_file": "offer_reference_287.json",
    "shop_name": "Alternate.at"
}