{
    "html_file": "offer_1764_14.html",
    "name": "AOC Q34E2A, 34\"",
    "offer_link": "https://www.ba-computer.at/aoc-q34e2a-led-monitor-86-cm-34-2560-x-1080-wfhd-75-hz-q34e2a.html",
    "price": 249.23,
    "raw_specifications": {
        "Abmessungen (Breite x Tiefe x H\u00f6he)": "81.74 cm x 25.38 cm x 47.5 cm - mit Fu\u00df",
        "Ausgangsleistung/Kanal": "3 Watt",
        "Besonderheiten": "Rahmenlos, Low Blue Light Mode, Adaptive-Sync-Technologie, grenzenlos",
        "Bildschirmbeschichtung": "Blendfrei, 3H Hard Coating",
        "Bildschirmtyp": "IPS",
        "Details zu Abmessungen & Gewicht": "Mit Fu\u00df - Breite: 81.74 cm - Tiefe: 25.38 cm - H\u00f6he: 47.5 cm \u00a6 Ohne Fu\u00df - Breite: 81.74 cm - Tiefe: 5.57 cm - H\u00f6he: 37.07 cm",
        "Diagonalabmessung": "86 cm (34\")",
        "Display-Typ": "LED-hintergrundbeleuchteter LCD-Monitor / TFT-Aktivmatrix",
        "Eingangsspannung": "Wechselstrom 120/230 V (50/60 Hz)",
        "Einstellungen der Anzeigeposition": "Neigung",
        "Energie Effizienzklasse": "Klasse E",
        "Energieklasse (HDR)": "Klasse F",
        "Enthaltene Kabel": "1 x HDMI-Kabel - 1.8 m",
        "Farbe": "Schwarz",
        "Farbunterst\u00fctzung": "16,7 Millionen Farben",
        "Gewicht": "8.1 kg",
        "Helligkeit": "300 cd/m\u00b2",
        "Hintergrundbeleuchtungs-Technologie": "WLED",
        "Horizontaler Betrachtungswinkel": "178",
        "Kennzeichnung": "RoHS, REACH, TUV Bauart, ISO 9241-307 Class 1",
        "Kontrast": "1000:1 / 50000000:1 (dynamisch)",
        "Leistungsaufnahme im Ein-Zustand": "26.3 W",
        "Leistungsmerkmale": "Slot f\u00fcr Sicherheitsschloss (Kabelschloss getrennt erh\u00e4ltlich)",
        "Native Aufl\u00f6sung": "WFHD 2560 x 1080 bei 75 Hz",
        "Neigungswinkel": "-5.5/+22",
        "OSD-Sprachen": "Multilingual",
        "Ppi": "81",
        "Reaktionszeit": "4 ms (gray-to-gray)",
        "Schlosstyp zur Diebstahlsicherung": "Kensington Slot",
        "Schnittstellen": "2 x HDMI \u00a6 DisplayPort 1.2 \u00a6 Kopfh\u00f6rer",
        "Seitenverh\u00e4ltnis": "21:9",
        "Service und Support": "Begrenzte Garantie - 3 Jahre",
        "Stromverbrauch (Aus-Modus)": "0.3 Watt",
        "Stromverbrauch (typisch)": "36 Watt",
        "Stromverbrauch HDR (eingeschaltet)": "28.1 kWh/1.000 h",
        "Stromverbrauch SDR (eingeschaltet)": "26.3 kWh/1.000 h",
        "Stromverbrauch im Standby-Modus": "0.3 Watt",
        "TCO-zertifiziert": "TCO Certified Displays 8",
        "Transportbreite": "94 cm",
        "Transportgewicht": "10.9 kg",
        "Transporth\u00f6he": "50.6 cm",
        "Transporttiefe": "18.7 cm",
        "Typ": "Lautsprecher - Stereo",
        "VESA-Halterung": "100 x 100 mm",
        "Vertikaler Betrachtungswinkel": "178"
    },
    "raw_specifications_text": "Display-Typ: LED-hintergrundbeleuchteter LCD-Monitor / TFT-Aktivmatrix\nEnergie Effizienzklasse: Klasse E\nEnergieklasse (HDR): Klasse F\nDiagonalabmessung: 86 cm (34\")\nBildschirmtyp: IPS\nSeitenverh\u00e4ltnis: 21:9\nNative Aufl\u00f6sung: WFHD 2560 x 1080 bei 75 Hz\nPpi: 81\nHelligkeit: 300 cd/m\u00b2\nKontrast: 1000:1 / 50000000:1 (dynamisch)\nFarbunterst\u00fctzung: 16,7 Millionen Farben\nReaktionszeit: 4 ms (gray-to-gray)\nHorizontaler Betrachtungswinkel: 178\nVertikaler Betrachtungswinkel: 178\nBildschirmbeschichtung: Blendfrei, 3H Hard Coating\nHintergrundbeleuchtungs-Technologie: WLED\nOSD-Sprachen: Multilingual\nBesonderheiten: Rahmenlos, Low Blue Light Mode, Adaptive-Sync-Technologie, grenzenlos\nFarbe: Schwarz\nAbmessungen (Breite x Tiefe x H\u00f6he): 81.74 cm x 25.38 cm x 47.5 cm - mit Fu\u00df\nGewicht: 8.1 kg\nTyp: Lautsprecher - Stereo\nAusgangsleistung/Kanal: 3 Watt\nSchnittstellen: 2 x HDMI \u00a6 DisplayPort 1.2 \u00a6 Kopfh\u00f6rer\nEinstellungen der Anzeigeposition: Neigung\nNeigungswinkel: -5.5/+22\nVESA-Halterung: 100 x 100 mm\nLeistungsmerkmale: Slot f\u00fcr Sicherheitsschloss (Kabelschloss getrennt erh\u00e4ltlich)\nEnthaltene Kabel: 1 x HDMI-Kabel - 1.8 m\nKennzeichnung: RoHS, REACH, TUV Bauart, ISO 9241-307 Class 1\nSchlosstyp zur Diebstahlsicherung: Kensington Slot\nEingangsspannung: Wechselstrom 120/230 V (50/60 Hz)\nLeistungsaufnahme im Ein-Zustand: 26.3 W\nStromverbrauch SDR (eingeschaltet): 26.3 kWh/1.000 h\nStromverbrauch HDR (eingeschaltet): 28.1 kWh/1.000 h\nStromverbrauch (typisch): 36 Watt\nStromverbrauch im Standby-Modus: 0.3 Watt\nStromverbrauch (Aus-Modus): 0.3 Watt\nDetails zu Abmessungen & Gewicht: Mit Fu\u00df - Breite: 81.74 cm - Tiefe: 25.38 cm - H\u00f6he: 47.5 cm \u00a6 Ohne Fu\u00df - Breite: 81.74 cm - Tiefe: 5.57 cm - H\u00f6he: 37.07 cm\nTransportbreite: 94 cm\nTransporttiefe: 18.7 cm\nTransporth\u00f6he: 50.6 cm\nTransportgewicht: 10.9 kg\nTCO-zertifiziert: TCO Certified Displays 8\nService und Support: Begrenzte Garantie - 3 Jahre",
    "reference_file": "offer_reference_1764.json",
    "shop_name": "BA-Computer"
}