{
    "html_file": "offer_2431_25.html",
    "name": "Philips V-line 243V7QDSB, 23.8\"",
    "offer_link": "https://www.alternate.at/Philips/243V7QDSB-00-LED-Monitor/html/product/1348410?partner=AtGeizhalsat&campaign=Monitor/Philips/1348410",
    "price": 115.9,
    "raw_specifications": {
        "": "Energy Star",
        "Abmessungen": "Breite: 54 cm x H\u00f6he: 41,5 cm x Tiefe/L\u00e4nge: 20,9 cm",
        "Anschl\u00fcsse": "1x DVI-D-Eingang, 1x HDMI-Eingang, 1x VGA-Eingang",
        "Bild": "Format",
        "Bildschirmaufl\u00f6sung": "1.920 x 1.080 Pixel",
        "Bildschirmdiagonale": "60,5 cm (23,8 Zoll)",
        "EAN": "8712581742331",
        "Energieeffizienzklasse (SDR)": "E (A - G)",
        "Energieverbauch pro 1000 Stunden (SDR)": "18 kWh",
        "Ergonomie": "Typ",
        "Features": "SmartContrast, Flimmerfrei, LowBlue-Modus, Separate Synchronisation, Plug & Play-Kompatibilit\u00e4t: DDC/CI, Mac OS X, sRGB, Windows 10/8.1/8/7, ergonomischer Standfu\u00df (neigbar)",
        "Frequenz": "Vertikal",
        "Geeignet f\u00fcr": "Multimedia",
        "Gewicht": "3,5 kg",
        "Hersteller-Nr.": "243V7QDSB/00",
        "Leistungsaufnahme im Bereitschafts- und Aus-Zustand": "0,5 Watt",
        "Leistungsaufnahme im Ein-Zustand bei Standard-Dynamikumfang (SDR)": "18,2 Watt",
        "Stromversorgung": "Eco-Off",
        "Typ": "LED-Monitor",
        "Wandhalterung": "VESA kompatibel (100 x 100 mm)",
        "Zubeh\u00f6r": "Vorhanden"
    },
    "raw_specifications_text": "Energieeffizienzklasse (SDR): E (A - G)\nEnergieverbauch pro 1000 Stunden (SDR): 18 kWh\nLeistungsaufnahme im Ein-Zustand bei Standard-Dynamikumfang (SDR): 18,2 Watt\nLeistungsaufnahme im Bereitschafts- und Aus-Zustand: 0,5 Watt\nBildschirmdiagonale: 60,5 cm (23,8 Zoll)\nBildschirmaufl\u00f6sung: 1.920 x 1.080 Pixel\nTyp: LED-Monitor\nEAN: 8712581742331\nHersteller-Nr.: 243V7QDSB/00\nGeeignet f\u00fcr: Multimedia\nBild: Format\n: Energy Star\nFrequenz: Vertikal\nAnschl\u00fcsse: 1x DVI-D-Eingang, 1x HDMI-Eingang, 1x VGA-Eingang\nErgonomie: Typ\nStromversorgung: Eco-Off\nWandhalterung: VESA kompatibel (100 x 100 mm)\nFeatures: SmartContrast, Flimmerfrei, LowBlue-Modus, Separate Synchronisation, Plug & Play-Kompatibilit\u00e4t: DDC/CI, Mac OS X, sRGB, Windows 10/8.1/8/7, ergonomischer Standfu\u00df (neigbar)\nZubeh\u00f6r: Vorhanden\nAbmessungen: Breite: 54 cm x H\u00f6he: 41,5 cm x Tiefe/L\u00e4nge: 20,9 cm\nGewicht: 3,5 kg",
    "reference_file": "offer_reference_2431.json",
    "shop_name": "Alternate.at"
}