{
    "html_file": "offer_691_11.html",
    "name": "AOC Q27B3MA, 27\"",
    "offer_link": "https://www.hiq24.de/shop/artikel/328227/?sPartner=geizhals",
    "price": 164.9,
    "raw_specifications": {
        "Abmessungen (Breite x Tiefe x H\u00f6he)": "61.4 cm x 22.98 cm x 46 cm - mit Fu\u00df",
        "Abmessungen (Breite x Tiefe x H\u00f6he) - mit Fu\u00df": "61.4 cm x 22.98 cm x 46 cm",
        "Ausgangsleistung/Kanal": "2 Watt",
        "Besonderheiten": "Low Blue Light Mode, FreeSync Technology, Adaptive-Sync-Technologie, an 3 Seiten rahmenlos, AOC Flicker-Free Technology",
        "Bildschirmbeschichtung": "Blendfrei, 6H Hard Coating",
        "Bildschirmtyp": "VA",
        "Details zu Abmessungen & Gewicht": "Mit Fu\u00df - Breite: 61.4 cm - Tiefe: 22.98 cm - H\u00f6he: 46 cm - Gewicht: 3.9 kg  Ohne Fu\u00df - Breite: 61.4 cm - Tiefe: 4.46 cm - H\u00f6he: 36.38 cm",
        "Diagonalabmessung": "68.6 cm (27\")",
        "Display-Typ": "LED-hintergrundbeleuchteter LCD-Monitor / TFT-Aktivmatrix",
        "Eingangsanschl\u00fcsse": "HDMI, DisplayPort",
        "Eingangsspannung": "Wechselstrom 100-240 V (50/60 Hz)",
        "Einstellungen der Anzeigeposition": "Neigung",
        "Enthaltene Kabel": "1 x HDMI-Kabel - 1.5 m",
        "Farbe": "Schwarz",
        "Farbraum": "102% sRGB (CIE 1931), 72% NTSC (CIE 1931), 82% Adobe RGB (CIE 1976), 83% NTSC (CIE 1976), 96% NTSC (CIE 1976), 76% Adobe RGB (CIE 1931), 75% DCI-P3 (CIE 1931), 76% DCI-P3 (CIE 1976)",
        "Farbunterst\u00fctzung": "16,7 Millionen Farben",
        "Ger\u00e4tetyp": "LED-hintergrundbeleuchteter LCD-Monitor - 68.6 cm (27\")",
        "Gewicht": "3.9 kg",
        "Helligkeit": "250 cd/m\u00b2",
        "Hintergrundbeleuchtungs-Technologie": "WLED",
        "Horizontaler Betrachtungswinkel": "178",
        "Kontrast": "4000:1 / 20000000:1 (dynamisch)",
        "Leistungsmerkmale": "Slot f\u00fcr Sicherheitsschloss (Kabelschloss getrennt erh\u00e4ltlich)",
        "MTBF": "50,000 Stunde(n)",
        "Native Aufl\u00f6sung": "QHD 2560 x 1440 bei 75 Hz",
        "Neigungswinkel": "-3.5/+21.5",
        "OSD-Sprachen": "Multilingual",
        "Pixelpitch": "0.2331 mm",
        "Ppi": "108.8",
        "Produktbeschreibung": "AOC Q27B3MA - B3 Series - LED-Monitor - QHD - 68.6 cm (27\")",
        "Reaktionszeit": "4 ms (gray-to-gray)",
        "Schlosstyp zur Diebstahlsicherung": "Kensington Slot",
        "Schnittstellen": "HDMI  DisplayPort 1.2  Kopfh\u00f6rer",
        "Seitenverh\u00e4ltnis": "16:9",
        "Spannung": "Wechselstrom 100-240 V (50/60 Hz)",
        "Stromverbrauch (Aus-Modus)": "0.3 Watt",
        "Stromverbrauch (typisch)": "25 Watt",
        "Stromverbrauch im Standby-Modus": "0.5 Watt",
        "Transportbreite": "69 cm",
        "Transportgewicht": "6.39 kg",
        "Transporth\u00f6he": "45.3 cm",
        "Transporttiefe": "14.2 cm",
        "Typ": "Lautsprecher - Stereo",
        "VESA-Halterung": "100 x 100 mm",
        "Vertikaler Betrachtungswinkel": "178"
    },
    "raw_specifications_text": "Display-Typ: LED-hintergrundbeleuchteter LCD-Monitor / TFT-Aktivmatrix\nDiagonalabmessung: 68.6 cm (27\")\nBildschirmtyp: VA\nSeitenverh\u00e4ltnis: 16:9\nNative Aufl\u00f6sung: QHD 2560 x 1440 bei 75 Hz\nPixelpitch: 0.2331 mm\nPpi: 108.8\nHelligkeit: 250 cd/m\u00b2\nKontrast: 4000:1 / 20000000:1 (dynamisch)\nFarbunterst\u00fctzung: 16,7 Millionen Farben\nFarbraum: 102% sRGB (CIE 1931), 72% NTSC (CIE 1931), 82% Adobe RGB (CIE 1976), 83% NTSC (CIE 1976), 96% NTSC (CIE 1976), 76% Adobe RGB (CIE 1931), 75% DCI-P3 (CIE 1931), 76% DCI-P3 (CIE 1976)\nReaktionszeit: 4 ms (gray-to-gray)\nHorizontaler Betrachtungswinkel: 178\nVertikaler Betrachtungswinkel: 178\nBildschirmbeschichtung: Blendfrei, 6H Hard Coating\nHintergrundbeleuchtungs-Technologie: WLED\nOSD-Sprachen: Multilingual\nBesonderheiten: Low Blue Light Mode, FreeSync Technology, Adaptive-Sync-Technologie, an 3 Seiten rahmenlos, AOC Flicker-Free Technology\nFarbe: Schwarz\nAbmessungen (Breite x Tiefe x H\u00f6he): 61.4 cm x 22.98 cm x 46 cm - mit Fu\u00df\nGewicht: 3.9 kg\nTyp: Lautsprecher - Stereo\nAusgangsleistung/Kanal: 2 Watt\nSchnittstellen: HDMI  DisplayPort 1.2  Kopfh\u00f6rer\nEinstellungen der Anzeigeposition: Neigung\nNeigungswinkel: -3.5/+21.5\nVESA-Halterung: 100 x 100 mm\nLeistungsmerkmale: Slot f\u00fcr Sicherheitsschloss (Kabelschloss getrennt erh\u00e4ltlich)\nEnthaltene Kabel: 1 x HDMI-Kabel - 1.5 m\nMTBF: 50,000 Stunde(n)\nSchlosstyp zur Diebstahlsicherung: Kensington Slot\nEingangsspannung: Wechselstrom 100-240 V (50/60 Hz)\nStromverbrauch (typisch): 25 Watt\nStromverbrauch im Standby-Modus: 0.5 Watt\nStromverbrauch (Aus-Modus): 0.3 Watt\nDetails zu Abmessungen & Gewicht: Mit Fu\u00df - Breite: 61.4 cm - Tiefe: 22.98 cm - H\u00f6he: 46 cm - Gewicht: 3.9 kg  Ohne Fu\u00df - Breite: 61.4 cm - Tiefe: 4.46 cm - H\u00f6he: 36.38 cm\nTransportbreite: 69 cm\nTransporttiefe: 14.2 cm\nTransporth\u00f6he: 45.3 cm\nTransportgewicht: 6.39 kg\nProduktbeschreibung: AOC Q27B3MA - B3 Series - LED-Monitor - QHD - 68.6 cm (27\")\nGer\u00e4tetyp: LED-hintergrundbeleuchteter LCD-Monitor - 68.6 cm (27\")\nEingangsanschl\u00fcsse: HDMI, DisplayPort\nSpannung: Wechselstrom 100-240 V (50/60 Hz)\nAbmessungen (Breite x Tiefe x H\u00f6he) - mit Fu\u00df: 61.4 cm x 22.98 cm x 46 cm",
    "reference_file": "offer_reference_691.json",
    "shop_name": "HiQ24"
}