{
    "html_file": "offer_1114_7.html",
    "name": "LG UltraWide 38WP85C-W, 38\"",
    "offer_link": "https://www.proshop.at/Bildschirm/LG-38-Bildschirm-38WP85C-W-UWQHD-HDR10-USB-C-90W-Hub-Speakers-White-5-ms-AMD-FreeSync/3054428?utm_source=geizhals&utm_medium=cpc&utm_campaign=pricesite",
    "price": 1332.55,
    "raw_specifications": {
        "Abmessungen (Breite x Tiefe x H\u00f6he)": "89.54 cm x 26 cm x 48.74 cm - mit Fu\u00df",
        "Abmessungen (Breite x Tiefe x H\u00f6he) - mit Fu\u00df": "89.54 cm x 26 cm x 48.74 cm",
        "Adaptive-Sync Technologie": "AMD FreeSync",
        "Ausgangsleistung/Kanal": "10 Watt",
        "Besonderheiten": "Umgebungslichtsensor, Bild f\u00fcr Bild, Flicker Safe, Reader Mode, Intelligente Energiespartechnologie, Farbkalibrierung, Black Stabilizer, DAS Mode (Dynamic Action Sync), Color Weakness Mode, One Click Stand, Super Resolution+, Rich Bass, nahezu rahmenloses Display an 3 Seiten, HDR Effect",
        "Bildschirmtyp": "IPS",
        "Details zu Abmessungen & Gewicht": "Mit Standfu\u00df (niedrigste Position) - Breite: 89.54 cm - Tiefe: 26 cm - H\u00f6he: 48.74 cm - Gewicht: 8.3 kg  Mit Standfu\u00df (h\u00f6chste Position) - Breite: 89.54 cm - Tiefe: 26 cm - H\u00f6he: 58.74 cm - Gewicht: 8.3 kg",
        "Diagonalabmessung": "96.29 cm (38\")",
        "Display-Typ": "LED-hintergrundbeleuchteter LCD-Monitor / TFT-Aktivmatrix",
        "EAN": "8806091374684",
        "Eingangsanschl\u00fcsse": "2xHDMI, DisplayPort, USB-C",
        "Eingangsspannung": "Wechselstrom 100-240 V (50/60 Hz)",
        "Einstellungen der Anzeigeposition": "H\u00f6he, Neigung",
        "Energie Effizienzklasse": "Klasse G",
        "Energieklasse (HDR)": "Klasse G",
        "Farbraum": "95% DCI-P3 (CIE 1976), 99% sRGB (CIE 1976)",
        "Farbunterst\u00fctzung": "1,07 Mrd. Farben",
        "Ger\u00e4tetyp": "LED-hintergrundbeleuchteter LCD-Monitor - 96.29 cm (38\")",
        "Geschwungener Bildschirm": "Ja",
        "Gewicht": "8.3 kg",
        "HDR-Format": "HDR10",
        "HDR-f\u00e4hig": "HDR10",
        "Helligkeit": "300 cd/m\u00b2",
        "Hersteller": "LG",
        "Hintergrundbeleuchtungs-Technologie": "LED-Hintergrundbeleuchtung",
        "Horizontaler Betrachtungswinkel": "178",
        "H\u00f6heneinstellung": "110 mm",
        "Integrierte Peripherieger\u00e4te": "USB 3.0/USB-C Hub",
        "Kontrast": "1000:1",
        "Leistungsmerkmale": "Slot f\u00fcr Sicherheitsschloss (Kabelschloss getrennt erh\u00e4ltlich)",
        "Mitgelieferte Software": "Dual Controller Software, LG On-Screen Control",
        "Modell": "38WP85C-W",
        "Native Aufl\u00f6sung": "UWQHD+ 3840 x 1600 bei 60 Hz",
        "Neigungswinkel": "-5/+20",
        "Pixelpitch": "0.2291 mm",
        "Produktbeschreibung": "LG 38WP85C-W - LED-Monitor - gebogen - 96.29 cm (38\") - HDR",
        "Reaktionszeit": "5 ms (Gray-to-Gray)",
        "Schlosstyp zur Diebstahlsicherung": "Kensington Slot",
        "Schnittstellen": "2 x HDMI  DisplayPort 1.4  USB-C/DisplayPort Alt Mode (bis zu 90 W)  2 x USB 3.0 Downstream  Kopfh\u00f6rer",
        "Seitenverh\u00e4ltnis": "21:9",
        "Sichtbare Bildfl\u00e4che": "95.2 cm (37.5\")",
        "Spannung": "Wechselstrom 100-240 V (50/60 Hz)",
        "Stromverbrauch (Aus-Modus)": "0.3 Watt",
        "Stromverbrauch (typisch)": "48 Watt",
        "Stromverbrauch HDR (eingeschaltet)": "47 kWh/1.000 h",
        "Stromverbrauch SDR (eingeschaltet)": "40 kWh/1.000 h",
        "Transportbreite": "105.8 cm",
        "Transportgewicht": "12.9 kg",
        "Transporth\u00f6he": "54.1 cm",
        "Transporttiefe": "23.5 cm",
        "Typ": "Lautsprecher - Stereo",
        "VESA-Halterung": "100 x 100 mm",
        "Vertikaler Betrachtungswinkel": "178",
        "Waren-Nr.": "3054428",
        "Zum Hersteller": "www.lge.com"
    },
    "raw_specifications_text": "Hersteller: LG\nWaren-Nr.: 3054428\nModell: 38WP85C-W\nEAN: 8806091374684\nZum Hersteller: www.lge.com\nProduktbeschreibung: LG 38WP85C-W - LED-Monitor - gebogen - 96.29 cm (38\") - HDR\nGer\u00e4tetyp: LED-hintergrundbeleuchteter LCD-Monitor - 96.29 cm (38\")\nEnergie Effizienzklasse: Klasse G\nGeschwungener Bildschirm: Ja\nAdaptive-Sync Technologie: AMD FreeSync\nLeistungsmerkmale: Slot f\u00fcr Sicherheitsschloss (Kabelschloss getrennt erh\u00e4ltlich)\nBildschirmtyp: IPS\nSeitenverh\u00e4ltnis: 21:9\nNative Aufl\u00f6sung: UWQHD+ 3840 x 1600 bei 60 Hz\nPixelpitch: 0.2291 mm\nHelligkeit: 300 cd/m\u00b2\nKontrast: 1000:1\nHDR-f\u00e4hig: HDR10\nReaktionszeit: 5 ms (Gray-to-Gray)\nFarbunterst\u00fctzung: 1,07 Mrd. Farben\nFarbraum: 95% DCI-P3 (CIE 1976), 99% sRGB (CIE 1976)\nEingangsanschl\u00fcsse: 2xHDMI, DisplayPort, USB-C\nEinstellungen der Anzeigeposition: H\u00f6he, Neigung\nSpannung: Wechselstrom 100-240 V (50/60 Hz)\nAbmessungen (Breite x Tiefe x H\u00f6he) - mit Fu\u00df: 89.54 cm x 26 cm x 48.74 cm\nGewicht: 8.3 kg\nDisplay-Typ: LED-hintergrundbeleuchteter LCD-Monitor / TFT-Aktivmatrix\nEnergieklasse (HDR): Klasse G\nDiagonalabmessung: 96.29 cm (38\")\nSichtbare Bildfl\u00e4che: 95.2 cm (37.5\")\nIntegrierte Peripherieger\u00e4te: USB 3.0/USB-C Hub\nHDR-Format: HDR10\nHorizontaler Betrachtungswinkel: 178\nVertikaler Betrachtungswinkel: 178\nHintergrundbeleuchtungs-Technologie: LED-Hintergrundbeleuchtung\nBesonderheiten: Umgebungslichtsensor, Bild f\u00fcr Bild, Flicker Safe, Reader Mode, Intelligente Energiespartechnologie, Farbkalibrierung, Black Stabilizer, DAS Mode (Dynamic Action Sync), Color Weakness Mode, One Click Stand, Super Resolution+, Rich Bass, nahezu rahmenloses Display an 3 Seiten, HDR Effect\nAbmessungen (Breite x Tiefe x H\u00f6he): 89.54 cm x 26 cm x 48.74 cm - mit Fu\u00df\nTyp: Lautsprecher - Stereo\nAusgangsleistung/Kanal: 10 Watt\nSchnittstellen: 2 x HDMI  DisplayPort 1.4  USB-C/DisplayPort Alt Mode (bis zu 90 W)  2 x USB 3.0 Downstream  Kopfh\u00f6rer\nNeigungswinkel: -5/+20\nH\u00f6heneinstellung: 110 mm\nVESA-Halterung: 100 x 100 mm\nSchlosstyp zur Diebstahlsicherung: Kensington Slot\nEingangsspannung: Wechselstrom 100-240 V (50/60 Hz)\nStromverbrauch SDR (eingeschaltet): 40 kWh/1.000 h\nStromverbrauch HDR (eingeschaltet): 47 kWh/1.000 h\nStromverbrauch (typisch): 48 Watt\nStromverbrauch (Aus-Modus): 0.3 Watt\nMitgelieferte Software: Dual Controller Software, LG On-Screen Control\nDetails zu Abmessungen & Gewicht: Mit Standfu\u00df (niedrigste Position) - Breite: 89.54 cm - Tiefe: 26 cm - H\u00f6he: 48.74 cm - Gewicht: 8.3 kg  Mit Standfu\u00df (h\u00f6chste Position) - Breite: 89.54 cm - Tiefe: 26 cm - H\u00f6he: 58.74 cm - Gewicht: 8.3 kg\nTransportbreite: 105.8 cm\nTransporttiefe: 23.5 cm\nTransporth\u00f6he: 54.1 cm\nTransportgewicht: 12.9 kg",
    "reference_file": "offer_reference_1114.json",
    "shop_name": "Proshop.at"
}