{
    "html_file": "offer_1292_1.html",
    "name": "AOC Agon Pro AG254FG, 24.5\"",
    "offer_link": "https://www.amazon.de/dp/B09F69YXV7?linkCode=xm2&camp=2025&creative=165953&smid=A3JWKAKR8XB7XF&creativeASIN=B09F69YXV7&tag=geizhals1-21",
    "price": 611.08,
    "raw_specifications": {
        "ASIN": "B09F69YXV7",
        "Amazon Bestseller-Rang": "Nr. 246,373 in Computer & Zubeh\u00f6r (Siehe Top 100 in Computer & Zubeh\u00f6r)  Nr. 3,500 in Monitore",
        "Anzahl HDMI Schnittstellen": "\u200e3",
        "Anzahl USB 3.0 Schnittstellen": "\u200e3",
        "Artikelgewicht": "\u200e4,42 Kilograms",
        "Batterien enthalten": "\u200eNein",
        "Bildschirmaufl\u00f6sung": "\u200e1920x1080",
        "Display-Gr\u00f6\u00dfe": "\u200e24,5 Zoll",
        "Durchschnittliche Kundenbewertung": "3,7  3,7 von 5 Sternen    \n    4 Sternebewertungen   \n\n\n 3,7 von 5 Sternen",
        "Farbe": "\u200eschwarz/rot",
        "Garantierte Software-Updates bis": "\u200eunbekannt",
        "Gewicht Lithium-Akku": "\u200e26 Kilogramm",
        "Hersteller": "\u200eAOC International",
        "Im Angebot von Amazon.de seit": "1. September 2021",
        "L\u00f6sung": "\u200e1920 x 1080 Pixels",
        "Marke": "\u200eAOC",
        "Modell/Serie": "\u200eAOC AG254FG 24.5\" FHD IPS 360HZ 1MS 400CD/M2 HDMIX2 DP USB 3.2X4",
        "Modellnummer": "\u200eAG254FG",
        "Produktabmessungen": "\u200e10 x 48 x 50 cm; 4,42 Kilogramm",
        "Prozessortyp": "\u200eOthers",
        "Volt": "\u200e220"
    },
    "raw_specifications_text": "Marke: \u200eAOC\nHersteller: \u200eAOC International\nModell/Serie: \u200eAOC AG254FG 24.5\" FHD IPS 360HZ 1MS 400CD/M2 HDMIX2 DP USB 3.2X4\nProduktabmessungen: \u200e10 x 48 x 50 cm; 4,42 Kilogramm\nModellnummer: \u200eAG254FG\nFarbe: \u200eschwarz/rot\nDisplay-Gr\u00f6\u00dfe: \u200e24,5 Zoll\nBildschirmaufl\u00f6sung: \u200e1920x1080\nL\u00f6sung: \u200e1920 x 1080 Pixels\nProzessortyp: \u200eOthers\nAnzahl USB 3.0 Schnittstellen: \u200e3\nAnzahl HDMI Schnittstellen: \u200e3\nVolt: \u200e220\nBatterien enthalten: \u200eNein\nGewicht Lithium-Akku: \u200e26 Kilogramm\nArtikelgewicht: \u200e4,42 Kilograms\nGarantierte Software-Updates bis: \u200eunbekannt\nASIN: B09F69YXV7\nDurchschnittliche Kundenbewertung: 3,7  3,7 von 5 Sternen    \n    4 Sternebewertungen   \n\n\n 3,7 von 5 Sternen\nAmazon Bestseller-Rang: Nr. 246,373 in Computer & Zubeh\u00f6r (Siehe Top 100 in Computer & Zubeh\u00f6r)  Nr. 3,500 in Monitore\nIm Angebot von Amazon.de seit: 1. September 2021",
    "reference_file": "offer_reference_1292.json",
    "shop_name": "Amazon.at"
}