{
    "html_file": "offer_780_20.html",
    "name": "ASUS BE24ECSNK, 23.8\"",
    "offer_link": "https://www.csv-direct.de/artinfo.php?artnr=AGX1601219&KATEGORIE=162&pva=geizhals2",
    "price": 402.82,
    "raw_specifications": {
        "AMD FreeSync": "Nein",
        "Anzahl HDMI-Anschl\u00fcsse": "1",
        "Anzahl RJ-45-Anschl\u00fcsse": "1",
        "Anzahl der Farben des Displays": "16,7 Millionen Farben",
        "Anzahl der Lautsprecher": "2",
        "Anzahl der Upstream-Ports USB Typ-C": "1",
        "Anzahl der nachgeschalteten Steckpl\u00e4tze vom Typ USB-A": "4",
        "Anzahl der vorgeschalteten Steckpl\u00e4tze": "1",
        "Bildschirmdiagonale": "60,5 cm 23.8\"",
        "Bildschirmform": "Flach",
        "Bildwinkel, horizontal": "178\u00b0",
        "Bildwinkel, vertikal": "178\u00b0",
        "Breite ohne Standfu\u00df": "539,7 mm",
        "Display-Aufl\u00f6sung": "1920 x 1080 Pixel",
        "Display-Oberfl\u00e4che": "Matt",
        "Dynamisches Kontrastverh\u00e4ltnis Marketingbezeichnung": "ASUS Smart Contrast Ratio ASCR",
        "Energieeffizienzklasse SDR": "E",
        "Energieeffizienzskala": "A bis G",
        "Energieverbrauch SDR pro 1.000 Stunden": "18 kWh",
        "Ger\u00e4tebreite inkl. Fu\u00df": "539,7 mm",
        "Ger\u00e4teh\u00f6he inkl. Fu\u00df": "538,9 mm",
        "Ger\u00e4tetiefe inkl. Fu\u00df": "211,4 mm",
        "Gewicht mit St\u00e4nder": "6,5 kg",
        "Gewicht ohne St\u00e4nder": "4,3 kg",
        "HD-Typ": "Full HD",
        "HDCP-Version": "1.4",
        "HDMI-Version": "1.4",
        "Helligkeit typisch": "300 cd/m\u00b2",
        "H\u00f6he ohne Standfu\u00df": "389,9 mm",
        "H\u00f6heneinstellung": "15 cm",
        "Kontrastverh\u00e4ltnis": "1000:1",
        "Kontrastverh\u00e4ltnis dynamisch": "100000000:1",
        "Kopfh\u00f6rerausg\u00e4nge": "1",
        "Marktpositionierung": "Business",
        "Maximale Bildwiederholrate": "60 Hz",
        "Megapixel ca.": "2 MP",
        "NVIDIA G-SYNC": "Nein",
        "Nachhaltigkeitszertifikate": "TCO",
        "Natives Seitenverh\u00e4ltnis": "16:9",
        "Neigungswinkelbereich": "35 - -5\u00b0",
        "Paketgewicht": "8,9 kg",
        "Panel-Montage-Schnittstelle": "100 x 100 mm",
        "Panel-Typ": "IPS",
        "Pivot Winkel": "90 - -90\u00b0",
        "Pixel Abstand": "0,2745 x 0,2745 mm",
        "Produktfarbe": "Schwarz",
        "RMS-Leistung": "2 W",
        "Reaktionszeit": "5 ms",
        "Schwenkwinkelbereich": "180 - -180\u00b0",
        "Sichtbare Gr\u00f6\u00dfe horizontal": "52,7 cm",
        "Sichtbare Gr\u00f6\u00dfe vertikal": "29,6 cm",
        "Slot-Typ Kabelsperre": "Kensington",
        "Stromverbrauch PowerSave": "0,5 W",
        "Stromverbrauch Standardbetrieb": "17,7 W",
        "Stromverbrauch aus": "0,5 W",
        "Tiefe ohne Standfu\u00df": "61 mm",
        "Touchscreen": "Nein",
        "Typ der Hintergrundbeleuchtung": "LED",
        "USB-Hub-Version": "3.2 Gen 1 3.1 Gen 1",
        "USB-Stromversorgung bis zu": "80 W",
        "USB-Upstream-Porttyp": "USB Typ-C",
        "Verpackungsart": "Box",
        "Verpackungsbreite": "722 mm",
        "Verpackungsh\u00f6he": "182 mm",
        "Verpackungstiefe": "481 mm"
    },
    "raw_specifications_text": "Bildschirmdiagonale: 60,5 cm 23.8\"\nDisplay-Aufl\u00f6sung: 1920 x 1080 Pixel\nNatives Seitenverh\u00e4ltnis: 16:9\nTouchscreen: Nein\nHD-Typ: Full HD\nPanel-Typ: IPS\nBildschirmform: Flach\nKontrastverh\u00e4ltnis: 1000:1\nMaximale Bildwiederholrate: 60 Hz\nAnzahl der Farben des Displays: 16,7 Millionen Farben\nTyp der Hintergrundbeleuchtung: LED\nHelligkeit typisch: 300 cd/m\u00b2\nReaktionszeit: 5 ms\nDisplay-Oberfl\u00e4che: Matt\nKontrastverh\u00e4ltnis dynamisch: 100000000:1\nDynamisches Kontrastverh\u00e4ltnis Marketingbezeichnung: ASUS Smart Contrast Ratio ASCR\nBildwinkel, horizontal: 178\u00b0\nBildwinkel, vertikal: 178\u00b0\nPixel Abstand: 0,2745 x 0,2745 mm\nSichtbare Gr\u00f6\u00dfe horizontal: 52,7 cm\nSichtbare Gr\u00f6\u00dfe vertikal: 29,6 cm\nNVIDIA G-SYNC: Nein\nAMD FreeSync: Nein\nAnzahl der Lautsprecher: 2\nRMS-Leistung: 2 W\nMegapixel ca.: 2 MP\nMarktpositionierung: Business\nProduktfarbe: Schwarz\nUSB-Hub-Version: 3.2 Gen 1 3.1 Gen 1\nUSB-Upstream-Porttyp: USB Typ-C\nAnzahl der vorgeschalteten Steckpl\u00e4tze: 1\nAnzahl der Upstream-Ports USB Typ-C: 1\nAnzahl der nachgeschalteten Steckpl\u00e4tze vom Typ USB-A: 4\nUSB-Stromversorgung bis zu: 80 W\nAnzahl HDMI-Anschl\u00fcsse: 1\nHDMI-Version: 1.4\nKopfh\u00f6rerausg\u00e4nge: 1\nHDCP-Version: 1.4\nPanel-Montage-Schnittstelle: 100 x 100 mm\nSlot-Typ Kabelsperre: Kensington\nH\u00f6heneinstellung: 15 cm\nPivot Winkel: 90 - -90\u00b0\nSchwenkwinkelbereich: 180 - -180\u00b0\nNeigungswinkelbereich: 35 - -5\u00b0\nEnergieeffizienzklasse SDR: E\nEnergieverbrauch SDR pro 1.000 Stunden: 18 kWh\nStromverbrauch Standardbetrieb: 17,7 W\nStromverbrauch aus: 0,5 W\nStromverbrauch PowerSave: 0,5 W\nEnergieeffizienzskala: A bis G\nGer\u00e4tebreite inkl. Fu\u00df: 539,7 mm\nGer\u00e4tetiefe inkl. Fu\u00df: 211,4 mm\nGer\u00e4teh\u00f6he inkl. Fu\u00df: 538,9 mm\nGewicht mit St\u00e4nder: 6,5 kg\nBreite ohne Standfu\u00df: 539,7 mm\nTiefe ohne Standfu\u00df: 61 mm\nH\u00f6he ohne Standfu\u00df: 389,9 mm\nGewicht ohne St\u00e4nder: 4,3 kg\nVerpackungsbreite: 722 mm\nVerpackungstiefe: 481 mm\nVerpackungsh\u00f6he: 182 mm\nPaketgewicht: 8,9 kg\nVerpackungsart: Box\nNachhaltigkeitszertifikate: TCO\nAnzahl RJ-45-Anschl\u00fcsse: 1",
    "reference_file": "offer_reference_780.json",
    "shop_name": "CSV-Direct.de"
}