{
    "html_file": "offer_1714_33.html",
    "name": "Philips V-line 241V8L, 23.8\"",
    "offer_link": "https://technikladen.at/I-Philips-V-Line-241V8L/00-605-cm-238-Zoll-1920-x-1080-Pixel-Full-HD-LED-4-ms-Schwarz?tl=gzhls",
    "price": 121.25,
    "raw_specifications": {
        "AC Eingangsfrequenz": "50/60 Hz",
        "AC Eingangsspannung": "100 - 240 V",
        "AMD FreeSync": "Nein",
        "Anzahl HDMI-Anschl\u00fcsse": "1",
        "Anzahl OSD-Sprachen": "21",
        "Anzahl VGA (D-Sub) Anschl\u00fcsse": "1",
        "Anzahl der Farben des Displays": "16,7 Millionen Farben",
        "Audioanschl\u00fcsse": "Nein",
        "Audioausgang": "Ja",
        "Betriebsanleitung": "Ja",
        "Betriebstemperatur": "0 - 40 \u00b0C",
        "Bildschirmaufl\u00f6sung": "1920 x 1080 Pixel",
        "Bildschirmdiagonale": "60,5 cm",
        "Bildschirmform": "Flach",
        "Bildschirmtechnologie": "LED",
        "Bildwinkel, horizontal": "178 \u00b0",
        "Bildwinkel, vertikal": "178 \u00b0",
        "Breite (ohne Standfu\u00df)": "54 cm",
        "DDC/CI": "Ja",
        "DVI Anschluss": "Nein",
        "Digital horizontale Frequenz": "30 - 85 kHz",
        "Display-Oberfl\u00e4che": "Matt",
        "Eingebaute Lautsprecher": "Nein",
        "Energieeffizienzklasse (SDR)": "E",
        "Energieverbrauch (SDR) pro 1.000 Stunden": "18 kWh",
        "Flimmerfreie Technologie": "Ja",
        "Ger\u00e4tebreite (inkl. Fu\u00df)": "540 mm",
        "Ger\u00e4teh\u00f6he (inkl. Fu\u00df)": "416 mm",
        "Ger\u00e4tetiefe (inkl. Fu\u00df)": "220 mm",
        "Gewicht (mit St\u00e4nder)": "3,03 kg",
        "Gewicht (ohne St\u00e4nder)": "2,64 kg",
        "HD-Typ": "Full HD",
        "HDMI": "Ja",
        "Helligkeit (typisch)": "250 cd/m\u00b2",
        "Horizontaler Scanbereich": "30 - 85 kHz",
        "H\u00f6he (ohne Standfu\u00df)": "32,2 cm",
        "H\u00f6he bei Betrieb": "0 - 3658 m",
        "H\u00f6he bei Lagerung": "0 - 12192 m",
        "H\u00f6henverstellung": "Nein",
        "Integrierte Kamera": "Nein",
        "Integrierter USB-Hub": "Nein",
        "Kabelsperre-Slot": "Ja",
        "Komponentenvideo-Synchronisation": "Separate sync,Sync-on-green (SOG)",
        "Kontrastverh\u00e4ltnis": "3000:1",
        "LED-Anzeigen": "Operation, Stand-by",
        "Low-Blue-Light-Technologie": "Ja",
        "Marktpositionierung": "Haus",
        "Maximale Bildwiederholrate": "75 Hz",
        "Mitgelieferte Kabel": "HDMI, AC",
        "Mittlere Betriebsdauer zwischen Ausf\u00e4llen (MTBF)": "50000 h",
        "NVIDIA G-SYNC": "Nein",
        "Nachhaltigkeitszertifikate": "RoHS, ENERGY STAR",
        "Natives Seitenverh\u00e4ltnis": "16:9",
        "Neigungswinkelbereich": "-5 - 20 \u00b0",
        "Oberfl\u00e4chenh\u00e4rte": "3H",
        "On-Screen-Display (OSD)": "Ja",
        "Paketgewicht": "4,25 kg",
        "Panel-Montage-Schnittstelle": "100 x 100 mm",
        "Panel-Typ": "VA",
        "Pixel Abstand": "0,275 x 0,275 mm",
        "Pixeldichte": "93 ppi",
        "Plug & Play": "Ja",
        "Produktfarbe": "Schwarz",
        "Reaktionszeit": "4 ms",
        "Relative Luftfeuchtigkeit in Betrieb": "20 - 80 %",
        "Schwermetallfrei": "Hg (mercury), Pb (lead)",
        "Seitenverh\u00e4ltnis": "16:9",
        "Sichtbare Gr\u00f6\u00dfe (horizontal)": "52,7 cm",
        "Sichtbare Gr\u00f6\u00dfe (vertikal)": "29,6 cm",
        "Slot-Typ Kabelsperre": "Kensington",
        "Stromverbrauch (Standardbetrieb)": "20,4 W",
        "Stromverbrauch (Standby)": "0,5 W",
        "Stromverbrauch (aus)": "0,3 W",
        "St\u00e4nder enthalten": "Ja",
        "Temperaturbereich bei Lagerung": "-20 - 60 \u00b0C",
        "Tiefe (ohne Standfu\u00df)": "5,1 cm",
        "Typ der Hintergrundbeleuchtung": "W-LED",
        "VESA-Halterung": "Ja",
        "Verpackungsart": "Box",
        "Verpackungsbreite": "608 mm",
        "Verpackungsh\u00f6he": "415 mm",
        "Verpackungstiefe": "121 mm",
        "Vertikaler Scanbereich": "48 - 75 Hz",
        "Zertifizierung": "UKRAINIAN, CB, TUV Ergo, TUV/GS, CU-EAC, EAEU RoHS, CE Mark",
        "kippbar": "Ja",
        "sRGB": "Ja"
    },
    "raw_specifications_text": "Bildschirmdiagonale: 60,5 cm\nBildschirmaufl\u00f6sung: 1920 x 1080 Pixel\nHD-Typ: Full HD\nBildschirmtechnologie: LED\nDisplay-Oberfl\u00e4che: Matt\nReaktionszeit: 4 ms\nNatives Seitenverh\u00e4ltnis: 16:9\nSeitenverh\u00e4ltnis: 16:9\nBildwinkel, horizontal: 178 \u00b0\nBildwinkel, vertikal: 178 \u00b0\nVESA-Halterung: Ja\nProduktfarbe: Schwarz\nNVIDIA G-SYNC: Nein\nAMD FreeSync: Nein\nKomponentenvideo-Synchronisation: Separate sync,Sync-on-green (SOG)\nFlimmerfreie Technologie: Ja\nLow-Blue-Light-Technologie: Ja\nPanel-Typ: VA\nHelligkeit (typisch): 250 cd/m\u00b2\nTyp der Hintergrundbeleuchtung: W-LED\nBildschirmform: Flach\nKontrastverh\u00e4ltnis: 3000:1\nMaximale Bildwiederholrate: 75 Hz\nAnzahl der Farben des Displays: 16,7 Millionen Farben\nPixel Abstand: 0,275 x 0,275 mm\nPixeldichte: 93 ppi\nHorizontaler Scanbereich: 30 - 85 kHz\nVertikaler Scanbereich: 48 - 75 Hz\nSichtbare Gr\u00f6\u00dfe (horizontal): 52,7 cm\nSichtbare Gr\u00f6\u00dfe (vertikal): 29,6 cm\nDigital horizontale Frequenz: 30 - 85 kHz\nsRGB: Ja\nDDC/CI: Ja\nOberfl\u00e4chenh\u00e4rte: 3H\nIntegrierter USB-Hub: Nein\nAnzahl VGA (D-Sub) Anschl\u00fcsse: 1\nDVI Anschluss: Nein\nHDMI: Ja\nAnzahl HDMI-Anschl\u00fcsse: 1\nAudioanschl\u00fcsse: Nein\nAudioausgang: Ja\nPanel-Montage-Schnittstelle: 100 x 100 mm\nKabelsperre-Slot: Ja\nSlot-Typ Kabelsperre: Kensington\nH\u00f6henverstellung: Nein\nkippbar: Ja\nNeigungswinkelbereich: -5 - 20 \u00b0\nOn-Screen-Display (OSD): Ja\nAnzahl OSD-Sprachen: 21\nPlug & Play: Ja\nLED-Anzeigen: Operation, Stand-by\nEingebaute Lautsprecher: Nein\nIntegrierte Kamera: Nein\nMarktpositionierung: Haus\nSchwermetallfrei: Hg (mercury), Pb (lead)\nZertifizierung: UKRAINIAN, CB, TUV Ergo, TUV/GS, CU-EAC, EAEU RoHS, CE Mark\nSt\u00e4nder enthalten: Ja\nMitgelieferte Kabel: HDMI, AC\nVerpackungsbreite: 608 mm\nVerpackungstiefe: 121 mm\nVerpackungsh\u00f6he: 415 mm\nPaketgewicht: 4,25 kg\nVerpackungsart: Box\nEnergieeffizienzklasse (SDR): E\nEnergieverbrauch (SDR) pro 1.000 Stunden: 18 kWh\nStromverbrauch (Standardbetrieb): 20,4 W\nStromverbrauch (Standby): 0,5 W\nStromverbrauch (aus): 0,3 W\nAC Eingangsspannung: 100 - 240 V\nAC Eingangsfrequenz: 50/60 Hz\nBetriebstemperatur: 0 - 40 \u00b0C\nTemperaturbereich bei Lagerung: -20 - 60 \u00b0C\nRelative Luftfeuchtigkeit in Betrieb: 20 - 80 %\nH\u00f6he bei Betrieb: 0 - 3658 m\nH\u00f6he bei Lagerung: 0 - 12192 m\nGer\u00e4tebreite (inkl. Fu\u00df): 540 mm\nGer\u00e4tetiefe (inkl. Fu\u00df): 220 mm\nGer\u00e4teh\u00f6he (inkl. Fu\u00df): 416 mm\nGewicht (mit St\u00e4nder): 3,03 kg\nBreite (ohne Standfu\u00df): 54 cm\nTiefe (ohne Standfu\u00df): 5,1 cm\nH\u00f6he (ohne Standfu\u00df): 32,2 cm\nGewicht (ohne St\u00e4nder): 2,64 kg\nNachhaltigkeitszertifikate: RoHS, ENERGY STAR\nBetriebsanleitung: Ja\nMittlere Betriebsdauer zwischen Ausf\u00e4llen (MTBF): 50000 h",
    "reference_file": "offer_reference_1714.json",
    "shop_name": "TechnikLaden"
}