{
    "html_file": "offer_2009_7.html",
    "name": "Lenovo ThinkVision T27q-20, 27\"",
    "offer_link": "https://restposten.bauguru.at/monitore/125355-monitor-lenovo-thinkvision-t27q-20-27-led-ips-lcd-50-60-hz-0193638970255.html",
    "price": 411.7,
    "raw_specifications": {
        "Art": "Achse",
        "Aufl\u00f6sung": "Quad HD",
        "Aufl\u00f6sung (px)": "2560 x 1440 px",
        "Bildschirm": "27\"",
        "Diagonale des Bildschirms (cm)": "68,6 cm",
        "Dreh": "-45\u00ba / 45\u00b0",
        "Empfohlene verwendung": "Unternehmen & Business",
        "Energieklassifizierung": "E",
        "Energieverbrauch": "65 kWh",
        "Farbe": "Schwarz",
        "Geschwindigkeit": "60 Hz",
        "Glanz": "350 lm ANSI",
        "Installationsart": "Wandmontage",
        "Kompatibel": "VESA 100 x 100 mm",
        "Kontrastverh\u00e4ltnis": "1000:1",
        "Montage": "VESA",
        "Neigungswinkel": "-90 / 90\u00b0",
        "Pixel-Dichte (dpi)": "109 dpi",
        "Ports": "Audio-Ausgang",
        "Reichweite": "99% sRGB",
        "Seitenverh\u00e4ltnis": "16:9",
        "Steckbares Produkt": "Ja",
        "Stecker": "Kensington",
        "Steckertyp": "EU-Stecker",
        "Verbindung": "DisplayPort 1.2",
        "Winkel": "178\u00ba"
    },
    "raw_specifications_text": "Farbe: Schwarz\nBildschirm: 27\"\nAufl\u00f6sung: Quad HD\nKompatibel: VESA 100 x 100 mm\nAufl\u00f6sung (px): 2560 x 1440 px\nSteckbares Produkt: Ja\nSteckertyp: EU-Stecker\nPixel-Dichte (dpi): 109 dpi\nEnergieklassifizierung: E\nDiagonale des Bildschirms (cm): 68,6 cm\nArt: Achse\nSeitenverh\u00e4ltnis: 16:9\nKontrastverh\u00e4ltnis: 1000:1\nPorts: Audio-Ausgang\nVerbindung: DisplayPort 1.2\nNeigungswinkel: -90 / 90\u00b0\nGlanz: 350 lm ANSI\nEnergieverbrauch: 65 kWh\nInstallationsart: Wandmontage\nWinkel: 178\u00ba\nStecker: Kensington\nMontage: VESA\nGeschwindigkeit: 60 Hz\nEmpfohlene verwendung: Unternehmen & Business\nReichweite: 99% sRGB\nDreh: -45\u00ba / 45\u00b0",
    "reference_file": "offer_reference_2009.json",
    "shop_name": "bauguru"
}