{
    "html_file": "offer_354_29.html",
    "name": "LG UltraWide 35WN75CP-B, 35\"",
    "offer_link": "https://ms-it-beratung.at/shop/details.php?art=425504&artname=LG+35%22+35WN75CP-B+Ultrawide+Curved+HDMI+DP+USB+IPS+21%3A9+blac",
    "price": 494.0,
    "raw_specifications": {
        "AC Eingangsfrequenz": "50/60 Hz",
        "AC Eingangsspannung": "100 - 240 V",
        "AMD FreeSync": "Ja",
        "AMD FreeSync-Typ": "FreeSync",
        "Anzahl DisplayPort Anschl\u00fcsse": "1",
        "Anzahl HDMI-Anschl\u00fcsse": "2",
        "Anzahl der Farben des Displays": "16,7 Millionen Farben",
        "Anzahl der Lautsprecher": "2",
        "Bewertung der Bildschirmkr\u00fcmmung": "1800R",
        "Bildschirmdiagonale": "88,9 cm (35\")",
        "Bildschirmdiagonale (cm)": "88,9 cm",
        "Bildschirmform": "Gebogen",
        "Bildschirmtechnologie": "LED",
        "Bildwinkel, horizontal": "178\u00b0",
        "Bildwinkel, vertikal": "178\u00b0",
        "Blendfreier Bildschirm": "Ja",
        "Breite (ohne Standfu\u00df)": "831,6 mm",
        "Display-Aufl\u00f6sung": "3440 x 1440 Pixel",
        "Display-Oberfl\u00e4che": "Matt",
        "DisplayPorts-Version": "1.4",
        "Eingebaute Lautsprecher": "Ja",
        "Energieeffizienzklasse (HDR)": "G",
        "Energieeffizienzklasse (SDR)": "G",
        "Energieeffizienzskala": "A bis G",
        "Energieverbrauch (HDR) pro 1.000 Stunden": "44 kWh",
        "Energieverbrauch (SDR) pro 1.000 Stunden": "34 kWh",
        "Flimmerfreie Technologie": "Ja",
        "Ger\u00e4tebreite (inkl. Fu\u00df)": "831,6 mm",
        "Ger\u00e4teh\u00f6he (inkl. Fu\u00df)": "573 mm",
        "Ger\u00e4tetiefe (inkl. Fu\u00df)": "250,9 mm",
        "Gewicht (mit St\u00e4nder)": "8,3 kg",
        "Gewicht (ohne St\u00e4nder)": "6,6 kg",
        "HD-Typ": "4K Ultra HD",
        "HDMI": "Ja",
        "Helligkeit (peak)": "300 cd/m\u00b2",
        "High Dynamic Range Video (HDR) Unterst\u00fctzung": "Ja",
        "H\u00f6he (ohne Standfu\u00df)": "372,7 mm",
        "H\u00f6henverstellung": "Ja",
        "Integrierte Kamera": "Nein",
        "Integrierter USB-Hub": "Ja",
        "Kontrastverh\u00e4ltnis": "2500:1",
        "Kopfh\u00f6rerausgang": "Ja",
        "Kopfh\u00f6rerausg\u00e4nge": "1",
        "Marktpositionierung": "B\u00fcro",
        "Maximale Bildwiederholrate": "100 Hz",
        "Mitgelieferte Kabel": "DisplayPort, HDMI, USB Typ-C",
        "NVIDIA G-SYNC": "Nein",
        "Natives Seitenverh\u00e4ltnis": "21:9",
        "Neigungsverstellung": "Ja",
        "Paketgewicht": "12,2 kg",
        "Panel-Montage-Schnittstelle": "100 x 100 mm",
        "Panel-Typ": "VA",
        "Pixel Abstand": "0,238 x 0,24 mm",
        "Produktfarbe": "Schwarz",
        "RMS-Leistung": "14 W",
        "Reaktionszeit": "5 ms",
        "Seitenverh\u00e4ltnis": "21:9",
        "Stromverbrauch (Standardbetrieb)": "45 W",
        "Stromverbrauch (Standby)": "0,5 W",
        "Stromverbrauch (max.)": "170 W",
        "St\u00e4nder enthalten": "Ja",
        "Technologie mit hohem Dynamikbereich (HDR)": "HDR Effect, High Dynamic Range 10 (HDR10)",
        "Tiefe (ohne Standfu\u00df)": "94,1 mm",
        "Touchscreen": "Nein",
        "USB Power Delivery": "Ja",
        "USB-Hub-Version": "3.2 Gen 1 (3.1 Gen 1)",
        "USB-Stromversorgung bis zu": "94 W",
        "USB-Typ-C DisplayPort-Wechselmodus": "Ja",
        "Unterst\u00fctzte Grafik-Aufl\u00f6sungen": "3440 x 1440",
        "Unterst\u00fctzte Video-Modi": "1440p",
        "VESA-Halterung": "Ja",
        "Verpackungsart": "Box",
        "Verpackungsbreite": "1001 mm",
        "Verpackungsh\u00f6he": "531 mm",
        "Verpackungstiefe": "212 mm",
        "sRGB Abdeckung (klassisch)": "99%"
    },
    "raw_specifications_text": "Bildschirmdiagonale: 88,9 cm (35\")\nDisplay-Aufl\u00f6sung: 3440 x 1440 Pixel\nNatives Seitenverh\u00e4ltnis: 21:9\nBildschirmtechnologie: LED\nTouchscreen: Nein\nHD-Typ: 4K Ultra HD\nPanel-Typ: VA\nHelligkeit (peak): 300 cd/m\u00b2\nReaktionszeit: 5 ms\nDisplay-Oberfl\u00e4che: Matt\nBlendfreier Bildschirm: Ja\nBildschirmform: Gebogen\nBewertung der Bildschirmkr\u00fcmmung: 1800R\nUnterst\u00fctzte Grafik-Aufl\u00f6sungen: 3440 x 1440\nUnterst\u00fctzte Video-Modi: 1440p\nSeitenverh\u00e4ltnis: 21:9\nKontrastverh\u00e4ltnis: 2500:1\nMaximale Bildwiederholrate: 100 Hz\nBildwinkel, horizontal: 178\u00b0\nBildwinkel, vertikal: 178\u00b0\nAnzahl der Farben des Displays: 16,7 Millionen Farben\nPixel Abstand: 0,238 x 0,24 mm\nBildschirmdiagonale (cm): 88,9 cm\nHigh Dynamic Range Video (HDR) Unterst\u00fctzung: Ja\nTechnologie mit hohem Dynamikbereich (HDR): HDR Effect, High Dynamic Range 10 (HDR10)\nsRGB Abdeckung (klassisch): 99%\nNVIDIA G-SYNC: Nein\nAMD FreeSync: Ja\nAMD FreeSync-Typ: FreeSync\nFlimmerfreie Technologie: Ja\nEingebaute Lautsprecher: Ja\nIntegrierte Kamera: Nein\nAnzahl der Lautsprecher: 2\nRMS-Leistung: 14 W\nMarktpositionierung: B\u00fcro\nProduktfarbe: Schwarz\nIntegrierter USB-Hub: Ja\nUSB-Hub-Version: 3.2 Gen 1 (3.1 Gen 1)\nUSB-Typ-C DisplayPort-Wechselmodus: Ja\nUSB Power Delivery: Ja\nUSB-Stromversorgung bis zu: 94 W\nHDMI: Ja\nAnzahl HDMI-Anschl\u00fcsse: 2\nAnzahl DisplayPort Anschl\u00fcsse: 1\nDisplayPorts-Version: 1.4\nKopfh\u00f6rerausgang: Ja\nKopfh\u00f6rerausg\u00e4nge: 1\nVESA-Halterung: Ja\nPanel-Montage-Schnittstelle: 100 x 100 mm\nH\u00f6henverstellung: Ja\nNeigungsverstellung: Ja\nEnergieeffizienzklasse (SDR): G\nEnergieeffizienzklasse (HDR): G\nEnergieverbrauch (SDR) pro 1.000 Stunden: 34 kWh\nEnergieverbrauch (HDR) pro 1.000 Stunden: 44 kWh\nStromverbrauch (Standardbetrieb): 45 W\nStromverbrauch (Standby): 0,5 W\nStromverbrauch (max.): 170 W\nAC Eingangsspannung: 100 - 240 V\nAC Eingangsfrequenz: 50/60 Hz\nEnergieeffizienzskala: A bis G\nSt\u00e4nder enthalten: Ja\nMitgelieferte Kabel: DisplayPort, HDMI, USB Typ-C\nGer\u00e4tebreite (inkl. Fu\u00df): 831,6 mm\nGer\u00e4tetiefe (inkl. Fu\u00df): 250,9 mm\nGer\u00e4teh\u00f6he (inkl. Fu\u00df): 573 mm\nGewicht (mit St\u00e4nder): 8,3 kg\nBreite (ohne Standfu\u00df): 831,6 mm\nTiefe (ohne Standfu\u00df): 94,1 mm\nH\u00f6he (ohne Standfu\u00df): 372,7 mm\nGewicht (ohne St\u00e4nder): 6,6 kg\nVerpackungsbreite: 1001 mm\nVerpackungstiefe: 212 mm\nVerpackungsh\u00f6he: 531 mm\nPaketgewicht: 12,2 kg\nVerpackungsart: Box",
    "reference_file": "offer_reference_354.json",
    "shop_name": "ms-it-beratung"
}