{
    "html_file": "offer_1815_22.html",
    "name": "AOC C24G2AE/BK, 23.6\"",
    "offer_link": "https://www.cyberport.at/?DEEP=6123-1CZ&APID=294&STOREID=7",
    "price": 167.9,
    "raw_specifications": {
        "Aufl\u00f6sung": "1.920x1.080 Full HD",
        "Betrachtungswinkel h/v": "178\u00b0/178\u00b0",
        "Bildformat": "16:9",
        "Breite in mm": "537mm",
        "DVI": "kein",
        "Displaygr\u00f6\u00dfe in Zoll": "23,6 Zoll",
        "Displaygr\u00f6\u00dfe in cm": "59,9 cm",
        "Displayport": "2x DP",
        "Farbraumabdeckung": "120% sRGB",
        "Farbtiefe": "8 Bit / 16,7 Mio Farben",
        "Gewicht in kg": "6,1 kg",
        "HDMI": "2x HDMI",
        "Helligkeit": "250 cd/m\u00b2",
        "H\u00f6he in mm": "500mm",
        "H\u00f6henverstellbar": "ohne",
        "Jahresverbrauch": "40 kWh",
        "Kontrast dynamisch": "80.000.000:1",
        "Kontrast typisch": "3.000:1",
        "Lautsprecher": "2x",
        "Leistung": "2W",
        "Leistungsaufnahme": "28 Watt",
        "Oberfl\u00e4che": "matt",
        "Reaktionszeit": "1 ms",
        "Technologie": "VA/PVA/MVA/AMVA",
        "Tiefe in mm": "230mm",
        "USB-C": "kein",
        "Wandmontage": "VESA100x100"
    },
    "raw_specifications_text": "Jahresverbrauch: 40 kWh\nLeistungsaufnahme: 28 Watt\nDisplaygr\u00f6\u00dfe in cm: 59,9 cm\nDisplaygr\u00f6\u00dfe in Zoll: 23,6 Zoll\nTechnologie: VA/PVA/MVA/AMVA\nAufl\u00f6sung: 1.920x1.080 Full HD\nBildformat: 16:9\nOberfl\u00e4che: matt\nFarbraumabdeckung: 120% sRGB\nFarbtiefe: 8 Bit / 16,7 Mio Farben\nHelligkeit: 250 cd/m\u00b2\nKontrast typisch: 3.000:1\nKontrast dynamisch: 80.000.000:1\nReaktionszeit: 1 ms\nBetrachtungswinkel h/v: 178\u00b0/178\u00b0\nLautsprecher: 2x\nLeistung: 2W\nHDMI: 2x HDMI\nDVI: kein\nDisplayport: 2x DP\nUSB-C: kein\nH\u00f6henverstellbar: ohne\nWandmontage: VESA100x100\nBreite in mm: 537mm\nH\u00f6he in mm: 500mm\nTiefe in mm: 230mm\nGewicht in kg: 6,1 kg",
    "reference_file": "offer_reference_1815.json",
    "shop_name": "Cyberport Stores \u00d6sterreich"
}