{
    "html_file": "offer_877_20.html",
    "name": "LG UltraWide 38WQ88C-W, 37.5\"",
    "offer_link": "https://www.hiq24.de/shop/artikel/328250/?sPartner=geizhals",
    "price": 1004.9,
    "raw_specifications": {
        "Abmessungen (Breite x Tiefe x H\u00f6he)": "89.54 cm x 51.33 cm x 76.36 cm - mit Standfu\u00df (h\u00f6chste Position)",
        "Abmessungen (Breite x Tiefe x H\u00f6he) - mit Standfu\u00df (h\u00f6chste Position)": "89.54 cm x 51.33 cm x 76.36 cm",
        "Adaptive-Sync Technologie": "AMD FreeSync",
        "Ausgangsleistung/Kanal": "10 Watt",
        "Besonderheiten": "Auto Brightness Control, integrierte Kabelf\u00fchrung, Flicker Safe, Reader Mode, PBP, Werkskalibrierung, Intelligente Energiespartechnologie, Dual Controller, Black Stabilizer, Color Weakness Mode, an 3 Seiten ohne Blende, HDR Effect, ergonomischer St\u00e4nder, 1-Click-Montage",
        "Bildschirmtyp": "IPS",
        "Details zu Abmessungen & Gewicht": "Mit Standfu\u00df (h\u00f6chste Position) - Breite: 89.54 cm - Tiefe: 51.33 cm - H\u00f6he: 76.36 cm - Gewicht: 11.1 kg  Mit Standfu\u00df (niedrigste Position) - Breite: 89.54 cm - Tiefe: 51.33 cm - H\u00f6he: 63.36 cm - Gewicht: 11.1 kg  Ohne Fu\u00df - Breite: 98.8 cm - Tiefe: 28.9 cm - H\u00f6he: 50.9 cm - Gewicht: 6.4 kg",
        "Diagonalabmessung": "95.29 cm (37.5\")",
        "Display-Typ": "LED-hintergrundbeleuchteter LCD-Monitor / TFT-Aktivmatrix",
        "Eingangsanschl\u00fcsse": "2xHDMI, DisplayPort, USB-C",
        "Eingangsspannung": "Wechselstrom 100-240 V (50/60 Hz)",
        "Einstellungen der Anzeigeposition": "H\u00f6he, Drehung, Neigung, ausfahren, einfahren",
        "Energie Effizienzklasse": "Klasse F",
        "Energieklasse (HDR)": "Klasse G",
        "Energierverbrauch Sleep": "0.5 Watt",
        "Enthaltene Kabel": "HDMI-Kabel  USB-C Kabel  DisplayPort-Kabel",
        "Farbraum": "95% DCI-P3 (CIE 1976)",
        "Farbunterst\u00fctzung": "1,07 Mrd. Farben",
        "Ger\u00e4tetyp": "LED-hintergrundbeleuchteter LCD-Monitor - 95.29 cm (37.5\")",
        "Geschwungener Bildschirm": "Ja",
        "Gewicht": "11.1 kg",
        "HDR-Format": "HDR10",
        "HDR-f\u00e4hig": "HDR10",
        "Helligkeit": "300 cd/m\u00b2",
        "Hintergrundbeleuchtungs-Technologie": "LED-Hintergrundbeleuchtung",
        "Horizontaler Betrachtungswinkel": "178",
        "H\u00f6heneinstellung": "130 mm",
        "Integrierte Peripherieger\u00e4te": "USB Hub",
        "Kennzeichnung": "2012/19/EU",
        "Kontrast": "1000:1",
        "Leistungsmerkmale": "USB Hub, USB PD 90 Watt",
        "Mitgelieferte Software": "LG Screen Manager",
        "Native Aufl\u00f6sung": "UWQHD+ 3840 x 1600 (DisplayPort: 75 Hz, HDMI: 75 Hz, USB-C: 60 Hz)",
        "Neigungswinkel": "-25/+25",
        "Pixelpitch": "0.2291 mm",
        "Produktbeschreibung": "LG 38WQ88C-W - LED-Monitor - gebogen - 95.29 cm (37.5\") - HDR",
        "Reaktionszeit": "5 ms (Grau-zu-Grau schnell)",
        "Schnittstellen": "2 x HDMI  DisplayPort 1.4  USB-C (bis zu 90 W)  2 x USB 3.0 Downstream  Kopfh\u00f6reranschluss",
        "Schwenkwinkel": "670",
        "Seitenverh\u00e4ltnis": "21:9",
        "Spannung": "Wechselstrom 100-240 V (50/60 Hz)",
        "Stromverbrauch (Aus-Modus)": "0.3 Watt",
        "Stromverbrauch (typisch)": "48 Watt",
        "Stromverbrauch HDR (eingeschaltet)": "48 kWh/1.000 h",
        "Stromverbrauch SDR (eingeschaltet)": "34 kWh/1.000 h",
        "Stromverbrauch im Standby-Modus": "0.5 Watt",
        "Transportbreite": "98.8 cm",
        "Transportgewicht": "16.2 kg",
        "Transporth\u00f6he": "50.9 cm",
        "Transporttiefe": "28.9 cm",
        "Typ": "Lautsprecher - Stereo",
        "USB-Spannungsversorgung": "90 Watt",
        "Vertikaler Betrachtungswinkel": "178"
    },
    "raw_specifications_text": "Display-Typ: LED-hintergrundbeleuchteter LCD-Monitor / TFT-Aktivmatrix\nEnergie Effizienzklasse: Klasse F\nEnergieklasse (HDR): Klasse G\nDiagonalabmessung: 95.29 cm (37.5\")\nGeschwungener Bildschirm: Ja\nAdaptive-Sync Technologie: AMD FreeSync\nIntegrierte Peripherieger\u00e4te: USB Hub\nUSB-Spannungsversorgung: 90 Watt\nBildschirmtyp: IPS\nSeitenverh\u00e4ltnis: 21:9\nNative Aufl\u00f6sung: UWQHD+ 3840 x 1600 (DisplayPort: 75 Hz, HDMI: 75 Hz, USB-C: 60 Hz)\nPixelpitch: 0.2291 mm\nHelligkeit: 300 cd/m\u00b2\nKontrast: 1000:1\nHDR-Format: HDR10\nFarbunterst\u00fctzung: 1,07 Mrd. Farben\nFarbraum: 95% DCI-P3 (CIE 1976)\nReaktionszeit: 5 ms (Grau-zu-Grau schnell)\nHorizontaler Betrachtungswinkel: 178\nVertikaler Betrachtungswinkel: 178\nHintergrundbeleuchtungs-Technologie: LED-Hintergrundbeleuchtung\nBesonderheiten: Auto Brightness Control, integrierte Kabelf\u00fchrung, Flicker Safe, Reader Mode, PBP, Werkskalibrierung, Intelligente Energiespartechnologie, Dual Controller, Black Stabilizer, Color Weakness Mode, an 3 Seiten ohne Blende, HDR Effect, ergonomischer St\u00e4nder, 1-Click-Montage\nAbmessungen (Breite x Tiefe x H\u00f6he): 89.54 cm x 51.33 cm x 76.36 cm - mit Standfu\u00df (h\u00f6chste Position)\nGewicht: 11.1 kg\nTyp: Lautsprecher - Stereo\nAusgangsleistung/Kanal: 10 Watt\nSchnittstellen: 2 x HDMI  DisplayPort 1.4  USB-C (bis zu 90 W)  2 x USB 3.0 Downstream  Kopfh\u00f6reranschluss\nEinstellungen der Anzeigeposition: H\u00f6he, Drehung, Neigung, ausfahren, einfahren\nNeigungswinkel: -25/+25\nSchwenkwinkel: 670\nH\u00f6heneinstellung: 130 mm\nEnthaltene Kabel: HDMI-Kabel  USB-C Kabel  DisplayPort-Kabel\nKennzeichnung: 2012/19/EU\nEingangsspannung: Wechselstrom 100-240 V (50/60 Hz)\nStromverbrauch SDR (eingeschaltet): 34 kWh/1.000 h\nStromverbrauch HDR (eingeschaltet): 48 kWh/1.000 h\nStromverbrauch (typisch): 48 Watt\nStromverbrauch im Standby-Modus: 0.5 Watt\nEnergierverbrauch Sleep: 0.5 Watt\nStromverbrauch (Aus-Modus): 0.3 Watt\nMitgelieferte Software: LG Screen Manager\nDetails zu Abmessungen & Gewicht: Mit Standfu\u00df (h\u00f6chste Position) - Breite: 89.54 cm - Tiefe: 51.33 cm - H\u00f6he: 76.36 cm - Gewicht: 11.1 kg  Mit Standfu\u00df (niedrigste Position) - Breite: 89.54 cm - Tiefe: 51.33 cm - H\u00f6he: 63.36 cm - Gewicht: 11.1 kg  Ohne Fu\u00df - Breite: 98.8 cm - Tiefe: 28.9 cm - H\u00f6he: 50.9 cm - Gewicht: 6.4 kg\nTransportbreite: 98.8 cm\nTransporttiefe: 28.9 cm\nTransporth\u00f6he: 50.9 cm\nTransportgewicht: 16.2 kg\nProduktbeschreibung: LG 38WQ88C-W - LED-Monitor - gebogen - 95.29 cm (37.5\") - HDR\nGer\u00e4tetyp: LED-hintergrundbeleuchteter LCD-Monitor - 95.29 cm (37.5\")\nLeistungsmerkmale: USB Hub, USB PD 90 Watt\nHDR-f\u00e4hig: HDR10\nEingangsanschl\u00fcsse: 2xHDMI, DisplayPort, USB-C\nSpannung: Wechselstrom 100-240 V (50/60 Hz)\nAbmessungen (Breite x Tiefe x H\u00f6he) - mit Standfu\u00df (h\u00f6chste Position): 89.54 cm x 51.33 cm x 76.36 cm",
    "reference_file": "offer_reference_877.json",
    "shop_name": "HiQ24"
}