{
    "html_file": "offer_2370_29.html",
    "name": "HP EliteDisplay E243m, 23.8\"",
    "offer_link": "https://www.electronicshop24.at/product_info.php?products_id=320000002136735971&ano=A-I2136735971&mno=1FH48AT&ean=5704174105657&utm_medium=cpc&utm_campaign=preisvergleich&utm_content=item&utm_source=geizhals&ref=geizhals",
    "price": 343.0,
    "raw_specifications": {
        "Abmessungen (Breite x Tiefe x H\u00f6he)": "53.88 cm x 21.4 cm x 51.37 cm - mit Fu\u00df",
        "Ausgangsleistung/Kanal": "2 Watt",
        "Besonderheiten": "HDCP, Frame Rate Control (FRC), Low Blue Light Mode, flimmerfreie Technologie, ohne Quecksilber, arsenfreies Glas, Bang & Olufsen audio, Micro Edge, 72 % NTSC Farbraum",
        "Bildschirmbeschichtung": "Blendfrei, 3H Hard Coating",
        "Bildschirmtyp": "IPS",
        "Details zu Abmessungen & Gewicht": "Mit Fu\u00df - Breite: 53.88 cm - Tiefe: 21.4 cm - H\u00f6he: 51.37 cm - Gewicht: 6.6 kg \u00a6 Ohne Fu\u00df - Breite: 53.88 cm - Tiefe: 4.63 cm - H\u00f6he: 34.72 cm - Gewicht: 3.9 kg",
        "Diagonalabmessung": "60.5 cm (23.8\")",
        "Display-Typ": "LED-hintergrundbeleuchteter LCD-Monitor / TFT-Aktivmatrix",
        "ENERGY STAR zertifiziert": "Ja",
        "Ein-/Aus-Schalter": "Ja",
        "Eingangsspannung": "Wechselstrom 120/230 V (50/60 Hz)",
        "Einstellungen der Anzeigeposition": "H\u00f6he, Pivot (Rotation), Drehung, Neigung",
        "Energie Effizienzklasse": "Klasse E",
        "Entwickelt f\u00fcr": "HP t240, t430, t640 \u00a6 HP Elite Slice for Meeting Rooms G2 for Intel Unite \u00a6 HP EliteBook 745 G5, 830 G5, 830 G6, 840 G5, 840 G6 \u00a6 HP ZBook Studio G4",
        "Farbe": "Schwarz (Hinterabdeckung), silber (Lautsprecher, Einfassung und Gestell)",
        "Farbraum": "72% NTSC",
        "Farbtemperatur": "6500K",
        "Farbunterst\u00fctzung": "16,7 Millionen Farben",
        "Gewicht": "6.6 kg",
        "Helligkeit": "250 cd/m\u00b2",
        "Hintergrundbeleuchtungs-Technologie": "WLED",
        "Horizontale Bildwiederholrate": "30 - 80 kHz",
        "Horizontaler Betrachtungswinkel": "178",
        "H\u00f6heneinstellung": "150 mm",
        "Integrierte Peripherieger\u00e4te": "2 Mikrofone, USB 3.0-Hub, 720p webcam",
        "Kennzeichnung": "Plug and Play, CSA, UL, VCCI, BSMI, NOM, TUV S, WHQL, CB, CCC, PSB, FCC, ISO 9241-307, KCC, WEEE, MEPS, KC, CECP, EAC, ISC, CEL Grade 2, halogenarm, ICE, SmartWay",
        "Kontrast": "1000:1 / 10000000:1 (dynamisch)",
        "Lebensdauer der Beleuchtung": "30,000 Stunden",
        "Leistungsaufnahme im Ein-Zustand": "17.5 W",
        "Leistungsmerkmale": "Slot f\u00fcr Sicherheitsschloss (Kabelschloss getrennt erh\u00e4ltlich), integrierte Kabelf\u00fchrung, abnehmbarer St\u00e4nder, Direkt montierbar, Unterst\u00fctzung f\u00fcr VESA-Schnittstelle",
        "Max. Betriebstemperatur": "35 \u00b0C",
        "Min Betriebstemperatur": "5 \u00b0C",
        "Native Aufl\u00f6sung": "Full HD (1080p) 1920 x 1080 bei 60 Hz",
        "Neigungswinkel": "-5/+22",
        "OSD-Sprachen": "Chinesisch (tradionell), Chinesisch (vereinfacht), Englisch, Deutsch, Franz\u00f6sisch, Italienisch, Portugiesisch, Spanisch, Holl\u00e4ndisch, Japanisch",
        "Pixelpitch": "0.2745 mm",
        "Ppi": "93",
        "Reaktionszeit": "5 ms (Ein/Aus)",
        "Rotationswinkel": "180",
        "Schlosstyp zur Diebstahlsicherung": "Kensington Slot",
        "Schnittstellen": "HDMI (HDCP) \u00a6 DisplayPort (HDCP) \u00a6 VGA \u00a6 USB 3.0 Upstream (Typ B) \u00a6 2 x USB 3.0 Downstream (Typ A) \u00a6 Audio Line-In \u00a6 Kopfh\u00f6rer",
        "Schwenkwinkel": "90",
        "Seitenverh\u00e4ltnis": "16:9",
        "Stromverbrauch (typisch)": "45 Watt",
        "Stromverbrauch SDR (eingeschaltet)": "17.5 kWh/1.000 h",
        "Stromverbrauch im Standby-Modus": "0.5 Watt",
        "TCO-zertifiziert": "TCO Certified Displays 8, TCO Certified Edge Displays",
        "Typ": "Lautsprecher - Stereo",
        "VESA-Halterung": "100 x 100 mm",
        "Vertikale Bildwiederholrate": "50 - 60 Hz",
        "Vertikaler Betrachtungswinkel": "178",
        "Zul\u00e4ssige Luftfeuchtigkeit im Betrieb": "20 - 80% (nicht kondensierend)"
    },
    "raw_specifications_text": "Display-Typ: LED-hintergrundbeleuchteter LCD-Monitor / TFT-Aktivmatrix\nEnergie Effizienzklasse: Klasse E\nDiagonalabmessung: 60.5 cm (23.8\")\nIntegrierte Peripherieger\u00e4te: 2 Mikrofone, USB 3.0-Hub, 720p webcam\nBildschirmtyp: IPS\nSeitenverh\u00e4ltnis: 16:9\nNative Aufl\u00f6sung: Full HD (1080p) 1920 x 1080 bei 60 Hz\nPixelpitch: 0.2745 mm\nPpi: 93\nHelligkeit: 250 cd/m\u00b2\nKontrast: 1000:1 / 10000000:1 (dynamisch)\nFarbunterst\u00fctzung: 16,7 Millionen Farben\nFarbraum: 72% NTSC\nReaktionszeit: 5 ms (Ein/Aus)\nVertikale Bildwiederholrate: 50 - 60 Hz\nHorizontale Bildwiederholrate: 30 - 80 kHz\nHorizontaler Betrachtungswinkel: 178\nVertikaler Betrachtungswinkel: 178\nBildschirmbeschichtung: Blendfrei, 3H Hard Coating\nHintergrundbeleuchtungs-Technologie: WLED\nFarbtemperatur: 6500K\nOSD-Sprachen: Chinesisch (tradionell), Chinesisch (vereinfacht), Englisch, Deutsch, Franz\u00f6sisch, Italienisch, Portugiesisch, Spanisch, Holl\u00e4ndisch, Japanisch\nBesonderheiten: HDCP, Frame Rate Control (FRC), Low Blue Light Mode, flimmerfreie Technologie, ohne Quecksilber, arsenfreies Glas, Bang & Olufsen audio, Micro Edge, 72 % NTSC Farbraum\nFarbe: Schwarz (Hinterabdeckung), silber (Lautsprecher, Einfassung und Gestell)\nAbmessungen (Breite x Tiefe x H\u00f6he): 53.88 cm x 21.4 cm x 51.37 cm - mit Fu\u00df\nGewicht: 6.6 kg\nTyp: Lautsprecher - Stereo\nAusgangsleistung/Kanal: 2 Watt\nSchnittstellen: HDMI (HDCP) \u00a6 DisplayPort (HDCP) \u00a6 VGA \u00a6 USB 3.0 Upstream (Typ B) \u00a6 2 x USB 3.0 Downstream (Typ A) \u00a6 Audio Line-In \u00a6 Kopfh\u00f6rer\nEinstellungen der Anzeigeposition: H\u00f6he, Pivot (Rotation), Drehung, Neigung\nNeigungswinkel: -5/+22\nSchwenkwinkel: 90\nRotationswinkel: 180\nH\u00f6heneinstellung: 150 mm\nVESA-Halterung: 100 x 100 mm\nLeistungsmerkmale: Slot f\u00fcr Sicherheitsschloss (Kabelschloss getrennt erh\u00e4ltlich), integrierte Kabelf\u00fchrung, abnehmbarer St\u00e4nder, Direkt montierbar, Unterst\u00fctzung f\u00fcr VESA-Schnittstelle\nLebensdauer der Beleuchtung: 30,000 Stunden\nKennzeichnung: Plug and Play, CSA, UL, VCCI, BSMI, NOM, TUV S, WHQL, CB, CCC, PSB, FCC, ISO 9241-307, KCC, WEEE, MEPS, KC, CECP, EAC, ISC, CEL Grade 2, halogenarm, ICE, SmartWay\nSchlosstyp zur Diebstahlsicherung: Kensington Slot\nEingangsspannung: Wechselstrom 120/230 V (50/60 Hz)\nLeistungsaufnahme im Ein-Zustand: 17.5 W\nStromverbrauch SDR (eingeschaltet): 17.5 kWh/1.000 h\nStromverbrauch (typisch): 45 Watt\nStromverbrauch im Standby-Modus: 0.5 Watt\nEin-/Aus-Schalter: Ja\nDetails zu Abmessungen & Gewicht: Mit Fu\u00df - Breite: 53.88 cm - Tiefe: 21.4 cm - H\u00f6he: 51.37 cm - Gewicht: 6.6 kg \u00a6 Ohne Fu\u00df - Breite: 53.88 cm - Tiefe: 4.63 cm - H\u00f6he: 34.72 cm - Gewicht: 3.9 kg\nTCO-zertifiziert: TCO Certified Displays 8, TCO Certified Edge Displays\nENERGY STAR zertifiziert: Ja\nMin Betriebstemperatur: 5 \u00b0C\nMax. Betriebstemperatur: 35 \u00b0C\nZul\u00e4ssige Luftfeuchtigkeit im Betrieb: 20 - 80% (nicht kondensierend)\nEntwickelt f\u00fcr: HP t240, t430, t640 \u00a6 HP Elite Slice for Meeting Rooms G2 for Intel Unite \u00a6 HP EliteBook 745 G5, 830 G5, 830 G6, 840 G5, 840 G6 \u00a6 HP ZBook Studio G4",
    "reference_file": "offer_reference_2370.json",
    "shop_name": "ElectronicShop24"
}