{
    "html_file": "offer_965_2.html",
    "name": "Dell S3423DWC, 34\"",
    "offer_link": "https://www.taufnaus.de/product/10620455",
    "price": 514.19,
    "raw_specifications": {
        "Abmessungen (Breite x Tiefe x H\u00f6he)": "80.816 cm x 21.705 cm x 38.936 cm - mit Standfu\u00df (niedrigste Position)",
        "Adaptive-Sync Technologie": "AMD FreeSync",
        "Besonderheiten": "Ohne Quecksilber, arsenfreies Glas, an 3 Seiten ohne Blende",
        "Bildschirmbeschichtung": "Anti-glare 3H hardness",
        "Bildschirmtyp": "VA",
        "Details zu Abmessungen & Gewicht": "Mit Standfu\u00df (niedrigste Position) - Breite: 80.816 cm - Tiefe: 21.705 cm - H\u00f6he: 38.936 cm \u00a6 Mit Standfu\u00df (h\u00f6chste Position) - Breite: 80.816 cm - Tiefe: 21.705 cm - H\u00f6he: 48.936 cm \u00a6 Ohne Fu\u00df - Breite: 80.816 cm - Tiefe: 6.403 cm - H\u00f6he: 36.45 cm - Gewicht: 6.65 kg",
        "Diagonalabmessung": "86.42 cm (34\")",
        "Display-Typ": "LED-hintergrundbeleuchteter LCD-Monitor / TFT-Aktivmatrix",
        "Ein-/Aus-Schalter": "Ja",
        "Eingangsspannung": "Wechselstrom 100-240 V (50/60 Hz)",
        "Einstellungen der Anzeigeposition": "H\u00f6he, Neigung",
        "Energie Effizienzklasse": "Klasse F",
        "Enthaltene Kabel": "1 x Kabel USB-C auf USB-C \u00a6 1 x USB 3.2 Gen 1 Upstream-Kabel",
        "Farbraum": "99% sRGB",
        "Farbunterst\u00fctzung": "16,7 Millionen Farben",
        "Geschwungener Bildschirm": "Ja (1800R)",
        "Helligkeit": "300 cd/m\u00b2",
        "Hintergrundbeleuchtungs-Technologie": "LED-Hintergrundbeleuchtung",
        "Horizontaler Betrachtungswinkel": "178",
        "H\u00f6heneinstellung": "100 mm",
        "Integrierte Peripherieger\u00e4te": "USB 3.2 Gen 1 Hub",
        "Kennzeichnung": "RoHS, weniger BFR, weniger PVC",
        "Kontrast": "3000:1 / 3000:1 (dynamisch)",
        "Leistungsaufnahme im Ein-Zustand": "31 W",
        "Leistungsmerkmale": "Unterst\u00fctzung f\u00fcr VESA-Schnittstelle",
        "Max. Betriebstemperatur": "40 \u00b0C",
        "Min Betriebstemperatur": "0 \u00b0C",
        "Native Aufl\u00f6sung": "WQHD 3440 x 1440 bei 100 Hz",
        "Neigungswinkel": "-5/+21",
        "Pixelpitch": "0.2318 mm",
        "Ppi": "109",
        "Reaktionszeit": "4 ms (Grau-zu-Grau extrem)",
        "Schnittstellen": "2 x HDMI (HDCP 2.2) \u00a6 DisplayPort \u00a6 USB-C Upstream/DisplayPort 1,4 Alt Mode mit Spannungsversorgung \u00a6 USB 3.2 Gen 1 Upstream (Typ B) \u00a6 USB 3.2 Gen 1 Downstream \u00a6 USB 3.2 Gen 1 Downstream mit Battery Charging 1.2 \u00a6 Audio Line-Out",
        "Seitenverh\u00e4ltnis": "21:9",
        "Service und Support": "Begrenzte Garantie - 3 Jahre - Reaktionszeit: am n\u00e4chsten Arbeitstag",
        "Services im Bundle": "3 Jahre Advanced Exchange Service und Premium Panel Exchange",
        "Stromverbrauch (Aus-Modus)": "0.3 Watt",
        "Stromverbrauch (typisch)": "160 Watt",
        "Stromverbrauch SDR (eingeschaltet)": "31 kWh/1.000 h",
        "Stromverbrauch im Standby-Modus": "0.4 Watt",
        "Transportgewicht": "15.21 kg",
        "VESA-Halterung": "100 x 100 mm",
        "Vertikaler Betrachtungswinkel": "178",
        "Zul\u00e4ssige Luftfeuchtigkeit im Betrieb": "10 - 80% (nicht kondensierend)"
    },
    "raw_specifications_text": "Display-Typ: LED-hintergrundbeleuchteter LCD-Monitor / TFT-Aktivmatrix\nEnergie Effizienzklasse: Klasse F\nDiagonalabmessung: 86.42 cm (34\")\nGeschwungener Bildschirm: Ja (1800R)\nAdaptive-Sync Technologie: AMD FreeSync\nIntegrierte Peripherieger\u00e4te: USB 3.2 Gen 1 Hub\nBildschirmtyp: VA\nSeitenverh\u00e4ltnis: 21:9\nNative Aufl\u00f6sung: WQHD 3440 x 1440 bei 100 Hz\nPixelpitch: 0.2318 mm\nPpi: 109\nHelligkeit: 300 cd/m\u00b2\nKontrast: 3000:1 / 3000:1 (dynamisch)\nFarbunterst\u00fctzung: 16,7 Millionen Farben\nFarbraum: 99% sRGB\nReaktionszeit: 4 ms (Grau-zu-Grau extrem)\nHorizontaler Betrachtungswinkel: 178\nVertikaler Betrachtungswinkel: 178\nBildschirmbeschichtung: Anti-glare 3H hardness\nHintergrundbeleuchtungs-Technologie: LED-Hintergrundbeleuchtung\nBesonderheiten: Ohne Quecksilber, arsenfreies Glas, an 3 Seiten ohne Blende\nAbmessungen (Breite x Tiefe x H\u00f6he): 80.816 cm x 21.705 cm x 38.936 cm - mit Standfu\u00df (niedrigste Position)\nSchnittstellen: 2 x HDMI (HDCP 2.2) \u00a6 DisplayPort \u00a6 USB-C Upstream/DisplayPort 1,4 Alt Mode mit Spannungsversorgung \u00a6 USB 3.2 Gen 1 Upstream (Typ B) \u00a6 USB 3.2 Gen 1 Downstream \u00a6 USB 3.2 Gen 1 Downstream mit Battery Charging 1.2 \u00a6 Audio Line-Out\nEinstellungen der Anzeigeposition: H\u00f6he, Neigung\nNeigungswinkel: -5/+21\nH\u00f6heneinstellung: 100 mm\nVESA-Halterung: 100 x 100 mm\nLeistungsmerkmale: Unterst\u00fctzung f\u00fcr VESA-Schnittstelle\nEnthaltene Kabel: 1 x Kabel USB-C auf USB-C \u00a6 1 x USB 3.2 Gen 1 Upstream-Kabel\nKennzeichnung: RoHS, weniger BFR, weniger PVC\nEingangsspannung: Wechselstrom 100-240 V (50/60 Hz)\nLeistungsaufnahme im Ein-Zustand: 31 W\nStromverbrauch SDR (eingeschaltet): 31 kWh/1.000 h\nStromverbrauch (typisch): 160 Watt\nStromverbrauch im Standby-Modus: 0.4 Watt\nStromverbrauch (Aus-Modus): 0.3 Watt\nEin-/Aus-Schalter: Ja\nDetails zu Abmessungen & Gewicht: Mit Standfu\u00df (niedrigste Position) - Breite: 80.816 cm - Tiefe: 21.705 cm - H\u00f6he: 38.936 cm \u00a6 Mit Standfu\u00df (h\u00f6chste Position) - Breite: 80.816 cm - Tiefe: 21.705 cm - H\u00f6he: 48.936 cm \u00a6 Ohne Fu\u00df - Breite: 80.816 cm - Tiefe: 6.403 cm - H\u00f6he: 36.45 cm - Gewicht: 6.65 kg\nTransportgewicht: 15.21 kg\nService und Support: Begrenzte Garantie - 3 Jahre - Reaktionszeit: am n\u00e4chsten Arbeitstag\nServices im Bundle: 3 Jahre Advanced Exchange Service und Premium Panel Exchange\nMin Betriebstemperatur: 0 \u00b0C\nMax. Betriebstemperatur: 40 \u00b0C\nZul\u00e4ssige Luftfeuchtigkeit im Betrieb: 10 - 80% (nicht kondensierend)",
    "reference_file": "offer_reference_965.json",
    "shop_name": "TaufNaus"
}