{
    "html_file": "offer_222_6.html",
    "name": "Dell P1424H, 14\"",
    "offer_link": "https://www.playox.de/productredirect/index/sku/27422748?sPartner=p-geizhals-at&campaign=psm/geizhals-at/",
    "price": 252.57,
    "raw_specifications": {
        "Anschl\u00fcsse": "USB",
        "Artikelnummer": "27422748",
        "Aufl\u00f6sung Kurzname": "Full HD",
        "Bezeichnung des Herstellers": "Dell P1424H",
        "Bildwiederholungsrate": "60,00 Hz",
        "Breite": "32237,00 mm",
        "Displaygr\u00f6\u00dfe": "bis 45,72 cm (18 Zoll)",
        "Displayoberfl\u00e4che": "gl\u00e4nzend",
        "EEK - Spektrum": "AG",
        "Einsatzort": "Innen",
        "Energieeffizienzklasse": "B",
        "Geh\u00e4usefarbe des Ger\u00e4tes": "Grau",
        "Gewicht": "0,59 kg",
        "Gewicht inkl. Verpackung in Kg": "0,00 kg",
        "Helligkeit Bereich": "150 - 300 cd/m\u00b2",
        "Hersteller": "Dell",
        "H\u00f6he": "20269,00 mm",
        "Kontrastverh\u00e4ltnis (typisch) Bereich": "400:1 bis 800:1",
        "LCD-Technologie": "IPS Panel",
        "L\u00e4nge": "143,00 mm",
        "Produktart": "Monitore",
        "Reaktionszeit": "6,00 ms",
        "Seitenverh\u00e4ltnis": "16:9",
        "Shop Herstellernummer": "DELL-P1424H",
        "Standard-EAN": "5397184821572",
        "max. Aufl\u00f6sung": "1.920 x 1.080 Pixel (16:9)"
    },
    "raw_specifications_text": "Geh\u00e4usefarbe des Ger\u00e4tes: Grau\nAnschl\u00fcsse: USB\nProduktart: Monitore\nHelligkeit Bereich: 150 - 300 cd/m\u00b2\nHersteller: Dell\nDisplaygr\u00f6\u00dfe: bis 45,72 cm (18 Zoll)\nKontrastverh\u00e4ltnis (typisch) Bereich: 400:1 bis 800:1\nGewicht: 0,59 kg\nGewicht inkl. Verpackung in Kg: 0,00 kg\nAufl\u00f6sung Kurzname: Full HD\nEEK - Spektrum: AG\nL\u00e4nge: 143,00 mm\nArtikelnummer: 27422748\nStandard-EAN: 5397184821572\nShop Herstellernummer: DELL-P1424H\nBezeichnung des Herstellers: Dell P1424H\nBreite: 32237,00 mm\nH\u00f6he: 20269,00 mm\nmax. Aufl\u00f6sung: 1.920 x 1.080 Pixel (16:9)\nSeitenverh\u00e4ltnis: 16:9\nLCD-Technologie: IPS Panel\nReaktionszeit: 6,00 ms\nDisplayoberfl\u00e4che: gl\u00e4nzend\nBildwiederholungsrate: 60,00 Hz\nEinsatzort: Innen\nEnergieeffizienzklasse: B",
    "reference_file": "offer_reference_222.json",
    "shop_name": "playox (AT)"
}