{
    "html_file": "offer_1638_28.html",
    "name": "GIGABYTE G27QC A, 27\"",
    "offer_link": "https://www.taufnaus.de/product/12712090",
    "price": 304.77,
    "raw_specifications": {
        "Abmessungen (Breite x Tiefe x H\u00f6he)": "61.03 cm x 20.3 cm x 53.1 cm - mit Fu\u00df",
        "Adaptive-Sync Technologie": "AMD Adaptive-Sync",
        "Ausgangsleistung/Kanal": "2 Watt",
        "Besonderheiten": "Flimmerfreie Technologie, Low Blue Light-Technologie, 8-bit Farbtiefe",
        "Bildschirmbeschichtung": "Blendfrei",
        "Bildschirmtyp": "VA",
        "Details zu Abmessungen & Gewicht": "Ohne Fu\u00df - Breite: 61.03 cm - Tiefe: 8.45 cm - H\u00f6he: 36.74 cm",
        "Diagonalabmessung": "68.6 cm (27\")",
        "Display-Typ": "LED-hintergrundbeleuchteter LCD-Monitor / TFT-Aktivmatrix",
        "Eingangsspannung": "Wechselstrom 100-240 V (50/60 Hz)",
        "Einstellungen der Anzeigeposition": "H\u00f6he, Neigung",
        "Energie Effizienzklasse": "Klasse G",
        "Energieklasse (HDR)": "Klasse G",
        "Enthaltene Kabel": "HDMI-Kabel \u00a6 DisplayPort-Kabel \u00a6 USB-Kabel",
        "Farbraum": "132% sRGB, 88% DCI-P3",
        "Farbunterst\u00fctzung": "16,7 Millionen Farben (8-Bit)",
        "Geschwungener Bildschirm": "Ja (1500R)",
        "Gewicht": "6.33 kg",
        "Helligkeit": "250 cd/m\u00b2",
        "Hintergrundbeleuchtungs-Technologie": "Edge-LED-Beleuchtung",
        "Horizontaler Betrachtungswinkel": "178",
        "H\u00f6heneinstellung": "130 mm",
        "Integrierte Peripherieger\u00e4te": "USB 3.0-Hub",
        "Kennzeichnung": "DisplayPort 1.2",
        "Kontrast": "4000:1",
        "Leistungsaufnahme im Ein-Zustand": "30 W",
        "Leistungsmerkmale": "Slot f\u00fcr Sicherheitsschloss (Kabelschloss getrennt erh\u00e4ltlich)",
        "Native Aufl\u00f6sung": "QHD 2560 x 1440 (DisplayPort: 165 Hz, HDMI: 144 Hz)",
        "Neigungswinkel": "-5/+20",
        "Pixelpitch": "0.2331 mm",
        "Reaktionszeit": "1 ms (MPRT)",
        "Schlosstyp zur Diebstahlsicherung": "Kensington Slot",
        "Schnittstellen": "2 x HDMI \u00a6 DisplayPort \u00a6 USB 3.0 Upstream (Typ B) \u00a6 2 x USB 3.0 Downstream \u00a6 Kopfh\u00f6rer",
        "Stromverbrauch (Aus-Modus)": "0.3 Watt",
        "Stromverbrauch (typisch)": "77 Watt",
        "Stromverbrauch HDR (eingeschaltet)": "44 kWh/1.000 h",
        "Stromverbrauch SDR (eingeschaltet)": "30 kWh/1.000 h",
        "Stromverbrauch im Standby-Modus": "0.5 Watt",
        "Transportbreite": "70 cm",
        "Transportgewicht": "8.75 kg",
        "Transporth\u00f6he": "48.1 cm",
        "Transporttiefe": "24.8 cm",
        "Typ": "Lautsprecher - Stereo",
        "VESA-Halterung": "100 x 100 mm",
        "Vertikale Bildwiederholrate": "48 - 165 Hz",
        "Vertikaler Betrachtungswinkel": "178"
    },
    "raw_specifications_text": "Display-Typ: LED-hintergrundbeleuchteter LCD-Monitor / TFT-Aktivmatrix\nEnergie Effizienzklasse: Klasse G\nEnergieklasse (HDR): Klasse G\nDiagonalabmessung: 68.6 cm (27\")\nGeschwungener Bildschirm: Ja (1500R)\nAdaptive-Sync Technologie: AMD Adaptive-Sync\nIntegrierte Peripherieger\u00e4te: USB 3.0-Hub\nBildschirmtyp: VA\nNative Aufl\u00f6sung: QHD 2560 x 1440 (DisplayPort: 165 Hz, HDMI: 144 Hz)\nPixelpitch: 0.2331 mm\nHelligkeit: 250 cd/m\u00b2\nKontrast: 4000:1\nFarbunterst\u00fctzung: 16,7 Millionen Farben (8-Bit)\nFarbraum: 132% sRGB, 88% DCI-P3\nReaktionszeit: 1 ms (MPRT)\nVertikale Bildwiederholrate: 48 - 165 Hz\nHorizontaler Betrachtungswinkel: 178\nVertikaler Betrachtungswinkel: 178\nBildschirmbeschichtung: Blendfrei\nHintergrundbeleuchtungs-Technologie: Edge-LED-Beleuchtung\nBesonderheiten: Flimmerfreie Technologie, Low Blue Light-Technologie, 8-bit Farbtiefe\nAbmessungen (Breite x Tiefe x H\u00f6he): 61.03 cm x 20.3 cm x 53.1 cm - mit Fu\u00df\nGewicht: 6.33 kg\nTyp: Lautsprecher - Stereo\nAusgangsleistung/Kanal: 2 Watt\nSchnittstellen: 2 x HDMI \u00a6 DisplayPort \u00a6 USB 3.0 Upstream (Typ B) \u00a6 2 x USB 3.0 Downstream \u00a6 Kopfh\u00f6rer\nEinstellungen der Anzeigeposition: H\u00f6he, Neigung\nNeigungswinkel: -5/+20\nH\u00f6heneinstellung: 130 mm\nVESA-Halterung: 100 x 100 mm\nLeistungsmerkmale: Slot f\u00fcr Sicherheitsschloss (Kabelschloss getrennt erh\u00e4ltlich)\nEnthaltene Kabel: HDMI-Kabel \u00a6 DisplayPort-Kabel \u00a6 USB-Kabel\nKennzeichnung: DisplayPort 1.2\nSchlosstyp zur Diebstahlsicherung: Kensington Slot\nEingangsspannung: Wechselstrom 100-240 V (50/60 Hz)\nLeistungsaufnahme im Ein-Zustand: 30 W\nStromverbrauch SDR (eingeschaltet): 30 kWh/1.000 h\nStromverbrauch HDR (eingeschaltet): 44 kWh/1.000 h\nStromverbrauch (typisch): 77 Watt\nStromverbrauch im Standby-Modus: 0.5 Watt\nStromverbrauch (Aus-Modus): 0.3 Watt\nDetails zu Abmessungen & Gewicht: Ohne Fu\u00df - Breite: 61.03 cm - Tiefe: 8.45 cm - H\u00f6he: 36.74 cm\nTransportbreite: 70 cm\nTransporttiefe: 24.8 cm\nTransporth\u00f6he: 48.1 cm\nTransportgewicht: 8.75 kg",
    "reference_file": "offer_reference_1638.json",
    "shop_name": "TaufNaus"
}