{
    "html_file": "offer_2047_13.html",
    "name": "Philips B-line 243B9, 23.8\"",
    "offer_link": "https://www.ba-computer.at/philips-b-line-243b9-led-monitor-61-cm-24-243b9-00.html",
    "price": 249.84,
    "raw_specifications": {
        "Abmessungen (Breite x Tiefe x H\u00f6he)": "54.1 cm x 21.6 cm x 52.2 cm - mit Fu\u00df",
        "Adaptive-Sync Technologie": "VESA Adaptive-Sync",
        "Ausgangsleistung/Kanal": "2 Watt",
        "Besonderheiten": "Sync-on-Green, sRGB-Farbmanagement, SmartImage, Low Blue Light Mode, flimmerfreie Technologie, EasyRead",
        "Bildschirmbeschichtung": "Haze 25 %, anti-glare 3H hardness",
        "Bildschirmtyp": "IPS",
        "Details zu Abmessungen & Gewicht": "Mit Fu\u00df - Breite: 54.1 cm - Tiefe: 21.6 cm - H\u00f6he: 52.2 cm - Gewicht: 5.19 kg \u00a6 Ohne Fu\u00df - Breite: 54.1 cm - Tiefe: 6.3 cm - H\u00f6he: 33.2 cm - Gewicht: 3.57 kg",
        "Diagonalabmessung": "61 cm (24\")",
        "Display-Typ": "LED-hintergrundbeleuchteter LCD-Monitor / TFT-Aktivmatrix",
        "ENERGY STAR zertifiziert": "Ja",
        "ENERGY STAR-Version": "7.0",
        "Ein-/Aus-Schalter": "Ja",
        "Eingangsspannung": "Wechselstrom 120/230 V (50/60 Hz)",
        "Einstellungen der Anzeigeposition": "H\u00f6he, Pivot (Rotation), Drehung, Neigung",
        "Energie Effizienzklasse": "Klasse D",
        "Energieverbrauch pro Jahr": "36 kWh",
        "Enthaltene Kabel": "1 x DisplayPort-Kabel \u00a6 1 x USB-C auf USB-A Kabel \u00a6 1 x HDMI-Kabel",
        "Farbe": "Black Texture",
        "Farbraum": "104% sRGB, 90% NTSC (CIE 1976)",
        "Farbunterst\u00fctzung": "16,7 Millionen Farben",
        "Gewicht": "5.19 kg",
        "Helligkeit": "250 cd/m\u00b2",
        "Hintergrundbeleuchtungs-Technologie": "WLED",
        "Horizontale Bildwiederholrate": "30 - 85 kHz",
        "Horizontaler Betrachtungswinkel": "178",
        "H\u00f6heneinstellung": "150 mm",
        "Integrierte Peripherieger\u00e4te": "USB 3.2 Hub",
        "Kennzeichnung": "Plug and Play, FCC Klasse B bescheinigt, TUV GS, VCCI, ICES-003, SASO, SEMKO, CCC, TUV Ergo, DDC/CI, RoHS, WEEE, KUCAS, EPA, cETLus, RCM, CU-EAC, DisplayPort 1.2, HDCP 1.4",
        "Kontrast": "1000:1 / 50000000:1 (dynamisch)",
        "Leistungsaufnahme im Ein-Zustand": "14.8 W",
        "Leistungsmerkmale": "Slot f\u00fcr Sicherheitsschloss (Kabelschloss getrennt erh\u00e4ltlich)",
        "MTBF": "70,000 Stunde(n)",
        "Max. Betriebstemperatur": "40 \u00b0C",
        "Min Betriebstemperatur": "0 \u00b0C",
        "Mitgelieferte Software": "Philips SmartControl",
        "Native Aufl\u00f6sung": "Full HD (1080p) 1920 x 1080 bei 75 Hz",
        "Neigungswinkel": "-5/+30",
        "OSD-Sprachen": "Multilingual",
        "Pixelpitch": "0.275 mm",
        "Ppi": "93",
        "Reaktionszeit": "4 ms (gray-to-gray)",
        "Rotationswinkel": "180",
        "Schlosstyp zur Diebstahlsicherung": "Kensington Slot",
        "Schnittstellen": "VGA \u00a6 USB-C 3.2 Gen 1 (bis zu 65 W) \u00a6 DisplayPort (HDCP) \u00a6 HDMI (HDCP) \u00a6 3 x USB-C 3.2 Gen 2 Downstream \u00a6 USB-C 3.2 Gen 2 Downstream (Schnellladung) \u00a6 Audio Line-In \u00a6 Kopfh\u00f6rer",
        "Schwenkwinkel": "350",
        "Seitenverh\u00e4ltnis": "16:9",
        "Sichtbare Bildfl\u00e4che": "60.5 cm (23.8\")",
        "Stromverbrauch (Aus-Modus)": "0 Watt",
        "Stromverbrauch (typisch)": "17.1 Watt",
        "Stromverbrauch SDR (eingeschaltet)": "14.8 kWh/1.000 h",
        "Stromverbrauch im Standby-Modus": "0.3 Watt",
        "TCO-zertifiziert": "TCO Certified Displays 8, TCO Certified Edge Displays",
        "Transportbreite": "60 cm",
        "Transportgewicht": "6.89 kg",
        "Transporth\u00f6he": "47.5 cm",
        "Transporttiefe": "19.8 cm",
        "Typ": "Lautsprecher - Stereo",
        "USB-Spannungsversorgung": "65 Watt",
        "VESA-Halterung": "100 x 100 mm",
        "Vertikale Bildwiederholrate": "48 - 75 Hz",
        "Vertikaler Betrachtungswinkel": "178",
        "Zul\u00e4ssige Luftfeuchtigkeit im Betrieb": "20 - 80%"
    },
    "raw_specifications_text": "Display-Typ: LED-hintergrundbeleuchteter LCD-Monitor / TFT-Aktivmatrix\nEnergie Effizienzklasse: Klasse D\nEnergieverbrauch pro Jahr: 36 kWh\nDiagonalabmessung: 61 cm (24\")\nSichtbare Bildfl\u00e4che: 60.5 cm (23.8\")\nAdaptive-Sync Technologie: VESA Adaptive-Sync\nIntegrierte Peripherieger\u00e4te: USB 3.2 Hub\nUSB-Spannungsversorgung: 65 Watt\nBildschirmtyp: IPS\nSeitenverh\u00e4ltnis: 16:9\nNative Aufl\u00f6sung: Full HD (1080p) 1920 x 1080 bei 75 Hz\nPixelpitch: 0.275 mm\nPpi: 93\nHelligkeit: 250 cd/m\u00b2\nKontrast: 1000:1 / 50000000:1 (dynamisch)\nFarbunterst\u00fctzung: 16,7 Millionen Farben\nFarbraum: 104% sRGB, 90% NTSC (CIE 1976)\nReaktionszeit: 4 ms (gray-to-gray)\nVertikale Bildwiederholrate: 48 - 75 Hz\nHorizontale Bildwiederholrate: 30 - 85 kHz\nHorizontaler Betrachtungswinkel: 178\nVertikaler Betrachtungswinkel: 178\nBildschirmbeschichtung: Haze 25 %, anti-glare 3H hardness\nHintergrundbeleuchtungs-Technologie: WLED\nOSD-Sprachen: Multilingual\nBesonderheiten: Sync-on-Green, sRGB-Farbmanagement, SmartImage, Low Blue Light Mode, flimmerfreie Technologie, EasyRead\nFarbe: Black Texture\nAbmessungen (Breite x Tiefe x H\u00f6he): 54.1 cm x 21.6 cm x 52.2 cm - mit Fu\u00df\nGewicht: 5.19 kg\nTyp: Lautsprecher - Stereo\nAusgangsleistung/Kanal: 2 Watt\nSchnittstellen: VGA \u00a6 USB-C 3.2 Gen 1 (bis zu 65 W) \u00a6 DisplayPort (HDCP) \u00a6 HDMI (HDCP) \u00a6 3 x USB-C 3.2 Gen 2 Downstream \u00a6 USB-C 3.2 Gen 2 Downstream (Schnellladung) \u00a6 Audio Line-In \u00a6 Kopfh\u00f6rer\nEinstellungen der Anzeigeposition: H\u00f6he, Pivot (Rotation), Drehung, Neigung\nNeigungswinkel: -5/+30\nSchwenkwinkel: 350\nRotationswinkel: 180\nH\u00f6heneinstellung: 150 mm\nVESA-Halterung: 100 x 100 mm\nLeistungsmerkmale: Slot f\u00fcr Sicherheitsschloss (Kabelschloss getrennt erh\u00e4ltlich)\nEnthaltene Kabel: 1 x DisplayPort-Kabel \u00a6 1 x USB-C auf USB-A Kabel \u00a6 1 x HDMI-Kabel\nMTBF: 70,000 Stunde(n)\nKennzeichnung: Plug and Play, FCC Klasse B bescheinigt, TUV GS, VCCI, ICES-003, SASO, SEMKO, CCC, TUV Ergo, DDC/CI, RoHS, WEEE, KUCAS, EPA, cETLus, RCM, CU-EAC, DisplayPort 1.2, HDCP 1.4\nSchlosstyp zur Diebstahlsicherung: Kensington Slot\nEingangsspannung: Wechselstrom 120/230 V (50/60 Hz)\nLeistungsaufnahme im Ein-Zustand: 14.8 W\nStromverbrauch SDR (eingeschaltet): 14.8 kWh/1.000 h\nStromverbrauch (typisch): 17.1 Watt\nStromverbrauch im Standby-Modus: 0.3 Watt\nStromverbrauch (Aus-Modus): 0 Watt\nEin-/Aus-Schalter: Ja\nMitgelieferte Software: Philips SmartControl\nDetails zu Abmessungen & Gewicht: Mit Fu\u00df - Breite: 54.1 cm - Tiefe: 21.6 cm - H\u00f6he: 52.2 cm - Gewicht: 5.19 kg \u00a6 Ohne Fu\u00df - Breite: 54.1 cm - Tiefe: 6.3 cm - H\u00f6he: 33.2 cm - Gewicht: 3.57 kg\nTransportbreite: 60 cm\nTransporttiefe: 19.8 cm\nTransporth\u00f6he: 47.5 cm\nTransportgewicht: 6.89 kg\nTCO-zertifiziert: TCO Certified Displays 8, TCO Certified Edge Displays\nENERGY STAR zertifiziert: Ja\nENERGY STAR-Version: 7.0\nMin Betriebstemperatur: 0 \u00b0C\nMax. Betriebstemperatur: 40 \u00b0C\nZul\u00e4ssige Luftfeuchtigkeit im Betrieb: 20 - 80%",
    "reference_file": "offer_reference_2047.json",
    "shop_name": "BA-Computer"
}