{
    "html_file": "offer_798_18.html",
    "name": "ASUS ROG Swift PG42UQ, 41.5\"",
    "offer_link": "https://www.ditech.at/details.php?artnr=354975",
    "price": 1666.9,
    "raw_specifications": {
        "Adaptive Sync": "Ja",
        "Anschl\u00fcsse - DisplayPort 1.4 138Hz@3840x2160": "1",
        "Anschl\u00fcsse - HDMI 2.0 60Hz@3840x2160": "2",
        "Anschl\u00fcsse - HDMI 2.1 138Hz@3840x2160": "2",
        "Anwendung": "station\u00e4r",
        "Audio": "Lautsprecher (2x 10W),  Subwoofer (15W),  1x Line-Out,  1x S/PDIF (optisch)",
        "Aufl\u00f6sung": "3840x2160",
        "Besonderheiten": "Slim Bezel,  mechanische Tasten mit Steuerkreuz,  Stativgewinde,  Picture-in-Picture,  Sicherheitsschloss (Kensington),  HDCP 2.3,  Werkskalibrierung (Delta-E <2),  Fernbedienung",
        "Bildwiederholfrequenz": "120Hz (138Hz OC)",
        "Blickwinkel": "178\u00b0/178\u00b0",
        "Diagonale": "41.5\"/105.4cm",
        "Energieeffizienzklasse HDR (A bis G)": "G",
        "Energieverbrauch HDR": "70kWh/1000h",
        "Energieverbrauch SDR": "42kWh/1000h",
        "Ergonomie": "N/A (h\u00f6henverstellbar),  N/A (Pivot),  N/A (drehbar),  +5\u00b0/-5\u00b0 (neigbar),  keine Angabe (Schr\u00e4glage)",
        "FRC": "nein (10bit nativ)",
        "Farbe": "schwarz",
        "Farbraum - DCI-P3": "98%",
        "Farbraum - sRGB": "133%",
        "Farbtiefe": "10bit (1.07 Mrd. Farben)",
        "Form": "gerade (flat)",
        "Gewicht": "14.77kg (mit Standfu\u00df),  13.60kg (ohne Standfu\u00df)",
        "HDR": "HDR10",
        "Helligkeit": "450cd/m\u00b2 (typisch)",
        "Herstellergarantie": "zwei Jahre",
        "Hintergrundbeleuchtung": "N/A",
        "Kontrast - statisch": "135.000:1",
        "Lautsprecher": "Ja",
        "Leistungsaufnahme": "300W (maximal),  42W (typisch),  keine Angabe (Energielabel alt A+++ bis G),  0.3W (Standby)",
        "Panel": "OLED",
        "Reaktionszeit - GtG": "0.1ms",
        "Screen-to-Body-Ratio": "92.3% (berechnet)",
        "Seitenverh\u00e4ltnis": "16:9",
        "Signalfrequenz": "30-311kHz (horizontal),  48-138Hz (vertikal)",
        "Stromversorgung": "AC-In (internes Netzteil)",
        "USB-Hub In": "1x USB-B 3.0",
        "USB-Hub Out": "2x USB-A 3.0,  2x USB-A 3.0 (BC 1.2)",
        "USB-Schreibweise": "Link",
        "VESA": "300x300 (frei)",
        "Weitere Anschl\u00fcsse": "N/A"
    },
    "raw_specifications_text": "Adaptive Sync: Ja\nAnschl\u00fcsse - DisplayPort 1.4 138Hz@3840x2160: 1\nAnschl\u00fcsse - HDMI 2.0 60Hz@3840x2160: 2\nAnschl\u00fcsse - HDMI 2.1 138Hz@3840x2160: 2\nAnwendung: station\u00e4r\nAudio: Lautsprecher (2x 10W),  Subwoofer (15W),  1x Line-Out,  1x S/PDIF (optisch)\nAufl\u00f6sung: 3840x2160\nBesonderheiten: Slim Bezel,  mechanische Tasten mit Steuerkreuz,  Stativgewinde,  Picture-in-Picture,  Sicherheitsschloss (Kensington),  HDCP 2.3,  Werkskalibrierung (Delta-E <2),  Fernbedienung\nBildwiederholfrequenz: 120Hz (138Hz OC)\nBlickwinkel: 178\u00b0/178\u00b0\nDiagonale: 41.5\"/105.4cm\nEnergieeffizienzklasse HDR (A bis G): G\nEnergieverbrauch HDR: 70kWh/1000h\nEnergieverbrauch SDR: 42kWh/1000h\nErgonomie: N/A (h\u00f6henverstellbar),  N/A (Pivot),  N/A (drehbar),  +5\u00b0/-5\u00b0 (neigbar),  keine Angabe (Schr\u00e4glage)\nFarbe: schwarz\nFarbraum - DCI-P3: 98%\nFarbraum - sRGB: 133%\nFarbtiefe: 10bit (1.07 Mrd. Farben)\nForm: gerade (flat)\nFRC: nein (10bit nativ)\nGewicht: 14.77kg (mit Standfu\u00df),  13.60kg (ohne Standfu\u00df)\nHDR: HDR10\nHelligkeit: 450cd/m\u00b2 (typisch)\nHerstellergarantie: zwei Jahre\nHintergrundbeleuchtung: N/A\nKontrast - statisch: 135.000:1\nLautsprecher: Ja\nLeistungsaufnahme: 300W (maximal),  42W (typisch),  keine Angabe (Energielabel alt A+++ bis G),  0.3W (Standby)\nPanel: OLED\nReaktionszeit - GtG: 0.1ms\nScreen-to-Body-Ratio: 92.3% (berechnet)\nSeitenverh\u00e4ltnis: 16:9\nSignalfrequenz: 30-311kHz (horizontal),  48-138Hz (vertikal)\nStromversorgung: AC-In (internes Netzteil)\nUSB-Hub In: 1x USB-B 3.0\nUSB-Hub Out: 2x USB-A 3.0,  2x USB-A 3.0 (BC 1.2)\nUSB-Schreibweise: Link\nVESA: 300x300 (frei)\nWeitere Anschl\u00fcsse: N/A",
    "reference_file": "offer_reference_798.json",
    "shop_name": "DiTech.at"
}