{
    "html_file": "offer_1054_7.html",
    "name": "ViewSonic VP3256-4K, 31.5\"",
    "offer_link": "https://direkt.jacob.de/produkte/viewsonic-vp56-81-3-vp3256-4k-artnr-7465446.html?utm_source=geizhals&utm_medium=cpc&utm_campaign=Preisvergleich&ref=103",
    "price": 659.32,
    "raw_specifications": {
        "AC Eingangsspannung": "100 - 240 V",
        "Anzahl DisplayPort Anschl\u00fcsse": "1",
        "Anzahl HDMI-Anschl\u00fcsse": "2",
        "Anzahl der Farben des Displays": "1,07 Milliarden Farben",
        "Anzahl der Lautsprecher": "2",
        "Anzahl der Upstream-Ports USB Typ-B": "1",
        "Anzahl der nachgeschalteten Steckpl\u00e4tze vom Typ USB-A": "2",
        "Bildschirmaufl\u00f6sung": "3840 x 2160 Pixel",
        "Bildschirmdiagonale": "81,3 cm (32\" )",
        "Bildschirmform": "Flach",
        "Bildschirmtechnologie": "LED",
        "Blendfreier Bildschirm": "Ja",
        "Blickwinkel, horizontal": "178\u00b0",
        "Blickwinkel, vertikal": "178\u00b0",
        "Breite (ohne Standfu\u00df)": "71,5 cm",
        "Eingebaute Lautsprecher": "Ja",
        "Energie Effizienzklasse": "G",
        "Farbintensit\u00e4t": "10 Bit",
        "Flimmerfreie Technologie": "Ja",
        "Ger\u00e4tebreite (inkl. Fu\u00df)": "715 mm",
        "Ger\u00e4teh\u00f6he (inkl. Fu\u00df)": "513,8 mm",
        "Ger\u00e4tetiefe (inkl. Fu\u00df)": "265 mm",
        "Gewicht (mit St\u00e4nder)": "10,9 kg",
        "Gewicht (ohne St\u00e4nder)": "7,2 kg",
        "HD-Typ": "4K Ultra HD",
        "HDMI": "Ja",
        "HDMI-Version": "2.0",
        "Helligkeit (typisch)": "350 cd/m\u00b2",
        "Horizontaler Scanbereich": "15 - 136 kHz",
        "H\u00f6he (ohne Standfu\u00df)": "42,3 cm",
        "H\u00f6heneinstellung": "13 cm",
        "H\u00f6henverstellung": "Ja",
        "Integrierter USB-Hub": "Nein",
        "Kabelsperre-Slot": "Ja",
        "Kontrastverh\u00e4ltnis": "1000:1",
        "Kontrastverh\u00e4ltnis (dynamisch)": "20000000:1",
        "Marktpositionierung": "Business",
        "Maximale Bildwiederholrate": "60 Hz",
        "Mitgelieferte Kabel": "DisplayPort, HDMI, USB Typ-A, USB Typ-C",
        "NTSC Abdeckung (typisch)": "91%",
        "Natives Seitenverh\u00e4ltnis": "16:9",
        "Neigungswinkelbereich": "5 - 21\u00b0",
        "Paketgewicht": "15,3 kg",
        "Panel-Montage-Schnittstelle": "100 x 100 mm",
        "Panel-Typ": "IPS",
        "Pivot": "Ja",
        "Pivot Winkel": "90 - 90\u00b0",
        "Pixel Abstand": "0,182 x 0,182 mm",
        "Produktfarbe": "Schwarz",
        "RGB-Farbraum": "Adobe RGB",
        "RMS-Leistung": "3 W",
        "Reaktionszeit": "5 ms",
        "Relative Luftfeuchtigkeit in Betrieb": "20 - 90%",
        "Schwenkbar": "Ja",
        "Schwenkwinkelbereich": "120 - 120\u00b0",
        "Slot-Typ Kabelsperre": "Kensington",
        "Stromverbrauch (Standardbetrieb)": "46 W",
        "Stromverbrauch (Standby)": "0,5 W",
        "Stromverbrauch (max.)": "50 W",
        "Temperaturbereich in Betrieb": "0 - 40 \u00b0C",
        "Tiefe (ohne Standfu\u00df)": "6,6 cm",
        "USB-Typ-C DisplayPort-Wechselmodus": "Ja",
        "VESA Adaptive Sync unterst\u00fctzt": "Ja",
        "VESA-Halterung": "Ja",
        "Verpackungsbreite": "840 mm",
        "Verpackungsh\u00f6he": "520 mm",
        "Verpackungstiefe": "326 mm",
        "Vertikaler Scanbereich": "24 - 75 Hz",
        "kippbar": "Ja",
        "sRGB Abdeckung (klassisch)": "128%"
    },
    "raw_specifications_text": "Bildschirmdiagonale: 81,3 cm (32\" )\nBildschirmaufl\u00f6sung: 3840 x 2160 Pixel\nEnergie Effizienzklasse: G\nNatives Seitenverh\u00e4ltnis: 16:9\nPanel-Typ: IPS\nHD-Typ: 4K Ultra HD\nBildschirmtechnologie: LED\nBildschirmform: Flach\nKontrastverh\u00e4ltnis: 1000:1\nMaximale Bildwiederholrate: 60 Hz\nAnzahl der Farben des Displays: 1,07 Milliarden Farben\nHelligkeit (typisch): 350 cd/m\u00b2\nReaktionszeit: 5 ms\nBlendfreier Bildschirm: Ja\nKontrastverh\u00e4ltnis (dynamisch): 20000000:1\nBlickwinkel, horizontal: 178\u00b0\nBlickwinkel, vertikal: 178\u00b0\nPixel Abstand: 0,182 x 0,182 mm\nHorizontaler Scanbereich: 15 - 136 kHz\nVertikaler Scanbereich: 24 - 75 Hz\nFarbintensit\u00e4t: 10 Bit\nRGB-Farbraum: Adobe RGB\nsRGB Abdeckung (klassisch): 128%\nNTSC Abdeckung (typisch): 91%\nVESA Adaptive Sync unterst\u00fctzt: Ja\nFlimmerfreie Technologie: Ja\nEingebaute Lautsprecher: Ja\nAnzahl der Lautsprecher: 2\nRMS-Leistung: 3 W\nMarktpositionierung: Business\nProduktfarbe: Schwarz\nIntegrierter USB-Hub: Nein\nHDMI: Ja\nAnzahl der Upstream-Ports USB Typ-B: 1\nAnzahl der nachgeschalteten Steckpl\u00e4tze vom Typ USB-A: 2\nUSB-Typ-C DisplayPort-Wechselmodus: Ja\nAnzahl HDMI-Anschl\u00fcsse: 2\nHDMI-Version: 2.0\nAnzahl DisplayPort Anschl\u00fcsse: 1\nVESA-Halterung: Ja\nKabelsperre-Slot: Ja\nH\u00f6henverstellung: Ja\nPanel-Montage-Schnittstelle: 100 x 100 mm\nSlot-Typ Kabelsperre: Kensington\nH\u00f6heneinstellung: 13 cm\nPivot: Ja\nPivot Winkel: 90 - 90\u00b0\nSchwenkbar: Ja\nSchwenkwinkelbereich: 120 - 120\u00b0\nkippbar: Ja\nNeigungswinkelbereich: 5 - 21\u00b0\nStromverbrauch (Standardbetrieb): 46 W\nStromverbrauch (Standby): 0,5 W\nStromverbrauch (max.): 50 W\nAC Eingangsspannung: 100 - 240 V\nTemperaturbereich in Betrieb: 0 - 40 \u00b0C\nRelative Luftfeuchtigkeit in Betrieb: 20 - 90%\nGer\u00e4tebreite (inkl. Fu\u00df): 715 mm\nGer\u00e4tetiefe (inkl. Fu\u00df): 265 mm\nGer\u00e4teh\u00f6he (inkl. Fu\u00df): 513,8 mm\nGewicht (mit St\u00e4nder): 10,9 kg\nBreite (ohne Standfu\u00df): 71,5 cm\nTiefe (ohne Standfu\u00df): 6,6 cm\nH\u00f6he (ohne Standfu\u00df): 42,3 cm\nGewicht (ohne St\u00e4nder): 7,2 kg\nMitgelieferte Kabel: DisplayPort, HDMI, USB Typ-A, USB Typ-C\nVerpackungsbreite: 840 mm\nVerpackungstiefe: 326 mm\nVerpackungsh\u00f6he: 520 mm\nPaketgewicht: 15,3 kg",
    "reference_file": "offer_reference_1054.json",
    "shop_name": "Jacob Elektronik direkt (AT)"
}