{
    "html_file": "offer_2227_2.html",
    "name": "AOC 22E1Q, 21.5\"",
    "offer_link": "https://www.proshop.at/Bildschirm/AOC-21-Bildschirm-22E1Q-Speakers-Black-5-ms/2884587?utm_source=geizhals&utm_medium=cpc&utm_campaign=pricesite",
    "price": 114.78,
    "raw_specifications": {
        "Abmessungen (Breite x Tiefe x H\u00f6he)": "50.44 cm x 19.94 cm x 39.37 cm",
        "Ausgangsleistung/Kanal": "2 Watt",
        "Besonderheiten": "Matt",
        "Bildschirmtyp": "MVA",
        "Diagonalabmessung": "54.6 cm (21.5\")",
        "Display-Typ": "LED-hintergrundbeleuchteter LCD-Monitor / TFT-Aktivmatrix",
        "EAN": "4038986126212",
        "Eingangsanschl\u00fcsse": "HDMI, VGA, DisplayPort",
        "Eingangsspannung": "Wechselstrom 120/230 V (50/60 Hz)",
        "Einstellungen der Anzeigeposition": "Neigung",
        "Energie Effizienzklasse": "Klasse E",
        "Enthaltene Kabel": "1 x HDMI-Kabel - 1.8 m  1 x VGA-Kabel - 1.8 m",
        "Farbunterst\u00fctzung": "16,7 Millionen Farben",
        "Ger\u00e4tetyp": "LED-hintergrundbeleuchteter LCD-Monitor - 54.6 cm (21.5\")",
        "Helligkeit": "250 cd/m\u00b2",
        "Hersteller": "AOC",
        "Hintergrundbeleuchtungs-Technologie": "WLED",
        "Horizontaler Betrachtungswinkel": "178",
        "Kennzeichnung": "TUV GS, GOST",
        "Kontrast": "3000:1 / 20000000:1 (dynamisch)",
        "Leistungsaufnahme im Ein-Zustand": "15.1 W",
        "MTBF": "50,000 Stunde(n)",
        "Modell": "22E1Q",
        "Native Aufl\u00f6sung": "Full HD (1080p) 1920 x 1080 bei 60 Hz",
        "Neigungswinkel": "-3.5/+21.5",
        "OSD-Sprachen": "Tschechisch, Chinesisch (tradionell), Chinesisch (vereinfacht), Englisch, Deutsch, Franz\u00f6sisch, Italienisch, Portugiesisch, Polnisch, Finnisch, Schwedisch, Russisch, Spanisch, Holl\u00e4ndisch, Japanisch, Koreanisch",
        "Pixelpitch": "0.24795 mm",
        "Produktbeschreibung": "AOC 22E1Q - LED-Monitor - Full HD (1080p) - 54.6 cm (21.5\")",
        "Reaktionszeit": "5 ms",
        "Schnittstellen": "VGA  HDMI  DisplayPort  Kopfh\u00f6rer",
        "Seitenverh\u00e4ltnis": "16:9",
        "Spannung": "Wechselstrom 120/230 V (50/60 Hz)",
        "Stromverbrauch (Aus-Modus)": "0.3 Watt",
        "Stromverbrauch (typisch)": "20 Watt",
        "Stromverbrauch SDR (eingeschaltet)": "15.1 kWh/1.000 h",
        "Stromverbrauch im Standby-Modus": "0.5 Watt",
        "TCO-zertifiziert": "TCO Certified Displays 8",
        "Transportbreite": "56.4 cm",
        "Transportgewicht": "4.3 kg",
        "Transporth\u00f6he": "40.1 cm",
        "Transporttiefe": "13.7 cm",
        "Typ": "Lautsprecher",
        "Umweltschutzstandards": "TCO Certified Displays 8",
        "Vertikaler Betrachtungswinkel": "178",
        "Waren-Nr.": "2884587",
        "Zum Hersteller": "www.aoc.com"
    },
    "raw_specifications_text": "Hersteller: AOC\nWaren-Nr.: 2884587\nModell: 22E1Q\nEAN: 4038986126212\nZum Hersteller: www.aoc.com\nProduktbeschreibung: AOC 22E1Q - LED-Monitor - Full HD (1080p) - 54.6 cm (21.5\")\nGer\u00e4tetyp: LED-hintergrundbeleuchteter LCD-Monitor - 54.6 cm (21.5\")\nEnergie Effizienzklasse: Klasse E\nLeistungsaufnahme im Ein-Zustand: 15.1 W\nBildschirmtyp: MVA\nSeitenverh\u00e4ltnis: 16:9\nNative Aufl\u00f6sung: Full HD (1080p) 1920 x 1080 bei 60 Hz\nPixelpitch: 0.24795 mm\nHelligkeit: 250 cd/m\u00b2\nKontrast: 3000:1 / 20000000:1 (dynamisch)\nReaktionszeit: 5 ms\nFarbunterst\u00fctzung: 16,7 Millionen Farben\nEingangsanschl\u00fcsse: HDMI, VGA, DisplayPort\nEinstellungen der Anzeigeposition: Neigung\nSpannung: Wechselstrom 120/230 V (50/60 Hz)\nAbmessungen (Breite x Tiefe x H\u00f6he): 50.44 cm x 19.94 cm x 39.37 cm\nUmweltschutzstandards: TCO Certified Displays 8\nKennzeichnung: TUV GS, GOST\nDisplay-Typ: LED-hintergrundbeleuchteter LCD-Monitor / TFT-Aktivmatrix\nDiagonalabmessung: 54.6 cm (21.5\")\nHorizontaler Betrachtungswinkel: 178\nVertikaler Betrachtungswinkel: 178\nHintergrundbeleuchtungs-Technologie: WLED\nOSD-Sprachen: Tschechisch, Chinesisch (tradionell), Chinesisch (vereinfacht), Englisch, Deutsch, Franz\u00f6sisch, Italienisch, Portugiesisch, Polnisch, Finnisch, Schwedisch, Russisch, Spanisch, Holl\u00e4ndisch, Japanisch, Koreanisch\nBesonderheiten: Matt\nTyp: Lautsprecher\nAusgangsleistung/Kanal: 2 Watt\nSchnittstellen: VGA  HDMI  DisplayPort  Kopfh\u00f6rer\nNeigungswinkel: -3.5/+21.5\nEnthaltene Kabel: 1 x HDMI-Kabel - 1.8 m  1 x VGA-Kabel - 1.8 m\nMTBF: 50,000 Stunde(n)\nEingangsspannung: Wechselstrom 120/230 V (50/60 Hz)\nStromverbrauch SDR (eingeschaltet): 15.1 kWh/1.000 h\nStromverbrauch (typisch): 20 Watt\nStromverbrauch im Standby-Modus: 0.5 Watt\nStromverbrauch (Aus-Modus): 0.3 Watt\nTransportbreite: 56.4 cm\nTransporttiefe: 13.7 cm\nTransporth\u00f6he: 40.1 cm\nTransportgewicht: 4.3 kg\nTCO-zertifiziert: TCO Certified Displays 8",
    "reference_file": "offer_reference_2227.json",
    "shop_name": "Proshop.at"
}