{
    "html_file": "offer_2112_20.html",
    "name": "AOC 24G2U5/BK, 23.8\"",
    "offer_link": "https://www.taufnaus.de/product/10605464",
    "price": 200.19,
    "raw_specifications": {
        "Abmessungen (Breite x Tiefe x H\u00f6he)": "53.905 cm x 22.736 cm x 50.461 cm - mit Fu\u00df",
        "Adaptive-Sync Technologie": "AMD FreeSync",
        "Ausgangsleistung/Kanal": "2 Watt",
        "Besonderheiten": "Flimmerfreie Technologie, USB 3.0 Fast Charge, Low Blue Light-Technologie",
        "Bildschirmbeschichtung": "3H Hard Coating",
        "Bildschirmtyp": "IPS",
        "Details zu Abmessungen & Gewicht": "Ohne Fu\u00df - Breite: 53.905 cm - Tiefe: 4.72 cm - H\u00f6he: 32.21 cm - Gewicht: 2.95 kg",
        "Diagonalabmessung": "60.4 cm (23.8\")",
        "Display-Typ": "LED-hintergrundbeleuchteter LCD-Monitor / TFT-Aktivmatrix",
        "ENERGY STAR zertifiziert": "Ja",
        "Eingangsspannung": "Wechselstrom 120/230 V (50/60 Hz)",
        "Einstellungen der Anzeigeposition": "H\u00f6he, Pivot (Rotation), Drehung, Neigung",
        "Energie Effizienzklasse": "Klasse E",
        "Energieverbrauch pro Jahr": "32 kWh",
        "Enthaltene Kabel": "1 x HDMI-Kabel - 1.8 m \u00a6 1 x DisplayPort-Kabel - 1.8 m",
        "Farbe": "Schwarz",
        "Farbunterst\u00fctzung": "16,7 Millionen Farben",
        "Gaming": "Ja",
        "Gewicht": "4.25 kg",
        "Helligkeit": "250 cd/m\u00b2",
        "Hintergrundbeleuchtungs-Technologie": "WLED",
        "Horizontaler Betrachtungswinkel": "178",
        "H\u00f6heneinstellung": "130 mm",
        "Integrierte Peripherieger\u00e4te": "USB 3.0-Hub",
        "Kennzeichnung": "FCC, RoHS, Bleifrei, TUV Bauart, EAC, ISO 9241-307 Class 1, quecksilberfrei",
        "Kontrast": "1000:1 / 80000000:1 (dynamisch)",
        "Leistungsaufnahme im Ein-Zustand": "18 W",
        "Native Aufl\u00f6sung": "Full HD (1080p) 1920 x 1080 bei 75 Hz",
        "Neigungswinkel": "3.5/21.5",
        "OSD-Sprachen": "Tschechisch, Chinesisch (tradionell), Chinesisch (vereinfacht), Englisch, Deutsch, Franz\u00f6sisch, Italienisch, Portugiesisch, Polnisch, Finnisch, Schwedisch, Russisch, Spanisch, Holl\u00e4ndisch, Japanisch, Koreanisch",
        "Pixelpitch": "0.2745 mm",
        "Reaktionszeit": "1 ms (MPRT)",
        "Schnittstellen": "2 x HDMI \u00a6 DisplayPort 1.2 \u00a6 VGA (HD-15) \u00a6 Kopfh\u00f6rer (Mini-Klinkenstecker) \u00a6 Audio Line-In \u00a6 4 x USB 3.0",
        "Schwenkwinkel": "60",
        "Seitenverh\u00e4ltnis": "16:9",
        "Stromverbrauch (Aus-Modus)": "0.3 Watt",
        "Stromverbrauch (typisch)": "21 Watt",
        "Stromverbrauch SDR (eingeschaltet)": "18 kWh/1.000 h",
        "Stromverbrauch im Standby-Modus": "0.3 Watt",
        "Transportbreite": "60.5 cm",
        "Transportgewicht": "6.2 kg",
        "Transporth\u00f6he": "49.2 cm",
        "Transporttiefe": "18.4 cm",
        "Typ": "Lautsprecher - Stereo",
        "VESA-Halterung": "100 x 100 mm",
        "Vertikaler Betrachtungswinkel": "178"
    },
    "raw_specifications_text": "Display-Typ: LED-hintergrundbeleuchteter LCD-Monitor / TFT-Aktivmatrix\nEnergie Effizienzklasse: Klasse E\nEnergieverbrauch pro Jahr: 32 kWh\nDiagonalabmessung: 60.4 cm (23.8\")\nAdaptive-Sync Technologie: AMD FreeSync\nIntegrierte Peripherieger\u00e4te: USB 3.0-Hub\nBildschirmtyp: IPS\nSeitenverh\u00e4ltnis: 16:9\nNative Aufl\u00f6sung: Full HD (1080p) 1920 x 1080 bei 75 Hz\nPixelpitch: 0.2745 mm\nHelligkeit: 250 cd/m\u00b2\nKontrast: 1000:1 / 80000000:1 (dynamisch)\nFarbunterst\u00fctzung: 16,7 Millionen Farben\nReaktionszeit: 1 ms (MPRT)\nGaming: Ja\nHorizontaler Betrachtungswinkel: 178\nVertikaler Betrachtungswinkel: 178\nBildschirmbeschichtung: 3H Hard Coating\nHintergrundbeleuchtungs-Technologie: WLED\nOSD-Sprachen: Tschechisch, Chinesisch (tradionell), Chinesisch (vereinfacht), Englisch, Deutsch, Franz\u00f6sisch, Italienisch, Portugiesisch, Polnisch, Finnisch, Schwedisch, Russisch, Spanisch, Holl\u00e4ndisch, Japanisch, Koreanisch\nBesonderheiten: Flimmerfreie Technologie, USB 3.0 Fast Charge, Low Blue Light-Technologie\nFarbe: Schwarz\nAbmessungen (Breite x Tiefe x H\u00f6he): 53.905 cm x 22.736 cm x 50.461 cm - mit Fu\u00df\nGewicht: 4.25 kg\nTyp: Lautsprecher - Stereo\nAusgangsleistung/Kanal: 2 Watt\nSchnittstellen: 2 x HDMI \u00a6 DisplayPort 1.2 \u00a6 VGA (HD-15) \u00a6 Kopfh\u00f6rer (Mini-Klinkenstecker) \u00a6 Audio Line-In \u00a6 4 x USB 3.0\nEinstellungen der Anzeigeposition: H\u00f6he, Pivot (Rotation), Drehung, Neigung\nNeigungswinkel: 3.5/21.5\nSchwenkwinkel: 60\nH\u00f6heneinstellung: 130 mm\nVESA-Halterung: 100 x 100 mm\nEnthaltene Kabel: 1 x HDMI-Kabel - 1.8 m \u00a6 1 x DisplayPort-Kabel - 1.8 m\nKennzeichnung: FCC, RoHS, Bleifrei, TUV Bauart, EAC, ISO 9241-307 Class 1, quecksilberfrei\nEingangsspannung: Wechselstrom 120/230 V (50/60 Hz)\nLeistungsaufnahme im Ein-Zustand: 18 W\nStromverbrauch SDR (eingeschaltet): 18 kWh/1.000 h\nStromverbrauch (typisch): 21 Watt\nStromverbrauch im Standby-Modus: 0.3 Watt\nStromverbrauch (Aus-Modus): 0.3 Watt\nDetails zu Abmessungen & Gewicht: Ohne Fu\u00df - Breite: 53.905 cm - Tiefe: 4.72 cm - H\u00f6he: 32.21 cm - Gewicht: 2.95 kg\nTransportbreite: 60.5 cm\nTransporttiefe: 18.4 cm\nTransporth\u00f6he: 49.2 cm\nTransportgewicht: 6.2 kg\nENERGY STAR zertifiziert: Ja",
    "reference_file": "offer_reference_2112.json",
    "shop_name": "TaufNaus"
}