{
    "html_file": "offer_1704_22.html",
    "name": "Philips E-line 241E1SC, 23.6\"",
    "offer_link": "https://syswork.at/sw/index.html?open&mid=Artikel&artid=mon-1385&from=geizhals.at",
    "price": 141.0,
    "raw_specifications": {
        "AC Eingangsfrequenz": "50/60 Hz",
        "AC Eingangsspannung": "100 - 240 V",
        "AMD FreeSync": "Ja",
        "Abnehmbarer Standfu\u00df": "Ja",
        "Anzahl HDMI-Anschl\u00fcsse": "1",
        "Anzahl OSD-Sprachen": "21",
        "Anzahl VGA (D-Sub) Anschl\u00fcsse": "1",
        "Anzahl der Farben des Displays": "16,7 Millionen Farben",
        "Audioanschl\u00fcsse": "Nein",
        "Audioausgang": "Ja",
        "Au\u00dfenverkleidungstyp": "Texturiert",
        "Beh\u00f6rdliche Zulassung": "CB; CE Mark; CU-EAC; EAEU RoHS; TUV/ISO9241-307; TUV-BAUART",
        "Betriebsanleitung": "Ja",
        "Betriebstemperatur": "0 - 40 \u00b0C",
        "Bewertung der Bildschirmkr\u00fcmmung": "1500R",
        "Bild-Verbesserung": "SmartImage game",
        "Bildschirmdiagonale": "59,9 cm (23.6 Zoll)",
        "Bildschirmdiagonale (cm)": "59,9 cm",
        "Bildschirmform": "Gebogen",
        "Bildschirmtechnologie": "LED",
        "Bildwinkel, horizontal": "178\u00b0",
        "Bildwinkel, vertikal": "178\u00b0",
        "Blendfreier Bildschirm": "Ja",
        "Breite (ohne Standfu\u00df)": "53,6 cm",
        "DDC/CI": "Ja",
        "DVI Anschluss": "Nein",
        "Datenblatt": "Kein Datenblatt verf\u00fcgbar",
        "Digital horizontale Frequenz": "30 - 85 kHz",
        "Digital vertikale Frequenz": "48 - 76 Hz",
        "Display-Aufl\u00f6sung": "1920 x 1080 Pixel",
        "Eingebaute Lautsprecher": "Nein",
        "Energieeffizienzklasse (SDR)": "F",
        "Energieverbrauch (SDR) pro 1.000 Stunden": "20 kWh",
        "Enth\u00e4lt nicht": "Quecksilber, PVC/BFR",
        "Farbskala": "87%",
        "Flimmerfreie Technologie": "Ja",
        "Fu\u00dffarbe": "Schwarz",
        "Ger\u00e4tebreite (inkl. Fu\u00df)": "536 mm",
        "Ger\u00e4teh\u00f6he (inkl. Fu\u00df)": "413 mm",
        "Ger\u00e4tetiefe (inkl. Fu\u00df)": "202 mm",
        "Gewicht (mit St\u00e4nder)": "3,14 kg",
        "Gewicht (ohne St\u00e4nder)": "2,46 kg",
        "Gleichstrom-Anschluss (DC)": "Ja",
        "HD-Typ": "Full HD",
        "HDMI": "Ja",
        "Helligkeit (typisch)": "250 cd/m\u00b2",
        "Herstellerlink": "Philips",
        "Horizontaler Scanbereich": "30 - 85 kHz",
        "H\u00f6he (ohne Standfu\u00df)": "32,2 cm",
        "H\u00f6he bei Betrieb": "0 - 3658 m",
        "H\u00f6he bei Lagerung": "0 - 12192 m",
        "H\u00f6henverstellung": "Nein",
        "Integrierte Kamera": "Nein",
        "Integrierter USB-Hub": "Nein",
        "Kabelsperre-Slot": "Ja",
        "Komponentenvideo-Synchronisation": "Separate sync, Sync-on-green (SOG)",
        "Kontrastverh\u00e4ltnis": "3000:1",
        "Kopfh\u00f6rerausgang": "Nein",
        "LED-Anzeigen": "T\u00e4tigkeit, Stand-by",
        "Low-Blue-Light-Technologie": "Ja",
        "LowBlue-Modus": "Ja",
        "Marktpositionierung": "Haus",
        "Maximale Bildwiederholrate": "75 Hz",
        "Men\u00fcsprachen": "Vereinfachtes Chinesisch, Traditionelles Chinesisch, Tschechisch, Deutsch, Niederl\u00e4ndisch, Englisch, Spanisch, Finnisch, Franz\u00f6sisch, Griechisch, Ungarisch, Italienisch, Japanisch, Koreanisch, Polnisch, Portugiesisch, Russisch, Schwedisch, T\u00fcrkisch, Ukrainisch",
        "Mitgelieferte Kabel": "HDMI, AC",
        "Mittlere Betriebsdauer zwischen Ausf\u00e4llen (MTBF)": "50000 h",
        "NTSC Abdeckung (typisch)": "83,87%",
        "Nachhaltigkeitszertifikate": "RoHS",
        "Natives Seitenverh\u00e4ltnis": "16:9",
        "Neigungsverstellung": "Ja",
        "Neigungswinkelbereich": "-5 - 20\u00b0",
        "Netzteiltyp": "Extern",
        "Oberfl\u00e4chenh\u00e4rte": "3H",
        "On-Screen-Display (OSD)": "Ja",
        "Paketgewicht": "4,97 kg",
        "Panel-Montage-Schnittstelle": "100 x 100 mm",
        "Panel-Typ": "VA",
        "Pixel Abstand": "0,272 x 0,272 mm",
        "Pixeldichte": "93 ppi",
        "Plug & Play": "Ja",
        "Produktfarbe": "Schwarz",
        "Produktlink": "Link",
        "RGB-Farbraum": "sRGB",
        "Reaktionszeit": "4 ms",
        "Recycelbares Verpackungsmaterial": "100%",
        "Relative Luftfeuchtigkeit in Betrieb": "20 - 80%",
        "Schwermetallfrei": "Hg (Quecksilber), Pb (Blei)",
        "Seitenverh\u00e4ltnis": "16:9",
        "Sichtbare Gr\u00f6\u00dfe (horizontal)": "52,1 cm",
        "Sichtbare Gr\u00f6\u00dfe (vertikal)": "29,3 cm",
        "Slot-Typ Kabelsperre": "Kensington",
        "Stromverbrauch (Standardbetrieb)": "27,9 W",
        "Stromverbrauch (Standby)": "0,5 W",
        "Stromverbrauch (aus)": "0,3 W",
        "St\u00e4nder enthalten": "Ja",
        "Temperaturbereich bei Lagerung": "-20 - 60 \u00b0C",
        "Tiefe (ohne Standfu\u00df)": "6,6 cm",
        "Touchscreen": "Nein",
        "Tr\u00fcbungsrate": "25%",
        "Typ der Hintergrundbeleuchtung": "W-LED",
        "Unterst\u00fctzte Grafik-Aufl\u00f6sungen": "1920 x 1080 (HD 1080)",
        "VESA-Halterung": "Ja",
        "Verpackungsart": "Box",
        "Verpackungsbreite": "595 mm",
        "Verpackungsh\u00f6he": "475 mm",
        "Verpackungstiefe": "154 mm",
        "Vertikaler Scanbereich": "48 - 76 Hz",
        "Vorderer Rahmen": "Schwarz",
        "Warentarifnummer (HS)": "85285210",
        "Zertifizierung": "CB, CE Mark, CU-EAC, EAEU RoHS, TUV/ISO9241-307, TUV-BAUART",
        "sRGB": "Ja",
        "sRGB Abdeckung (klassisch)": "100,78%"
    },
    "raw_specifications_text": "Bildschirmdiagonale: 59,9 cm (23.6 Zoll)\nDisplay-Aufl\u00f6sung: 1920 x 1080 Pixel\nNatives Seitenverh\u00e4ltnis: 16:9\nBildschirmtechnologie: LED\nTouchscreen: Nein\nHD-Typ: Full HD\nPanel-Typ: VA\nBildschirmform: Gebogen\nKontrastverh\u00e4ltnis: 3000:1\nMaximale Bildwiederholrate: 75 Hz\nAnzahl der Farben des Displays: 16,7 Millionen Farben\nTyp der Hintergrundbeleuchtung: W-LED\nHelligkeit (typisch): 250 cd/m\u00b2\nReaktionszeit: 4 ms\nBlendfreier Bildschirm: Ja\nBewertung der Bildschirmkr\u00fcmmung: 1500R\nUnterst\u00fctzte Grafik-Aufl\u00f6sungen: 1920 x 1080 (HD 1080)\nSeitenverh\u00e4ltnis: 16:9\nBildwinkel, horizontal: 178\u00b0\nBildwinkel, vertikal: 178\u00b0\nPixel Abstand: 0,272 x 0,272 mm\nPixeldichte: 93 ppi\nHorizontaler Scanbereich: 30 - 85 kHz\nVertikaler Scanbereich: 48 - 76 Hz\nSichtbare Gr\u00f6\u00dfe (horizontal): 52,1 cm\nSichtbare Gr\u00f6\u00dfe (vertikal): 29,3 cm\nDigital horizontale Frequenz: 30 - 85 kHz\nDigital vertikale Frequenz: 48 - 76 Hz\nBildschirmdiagonale (cm): 59,9 cm\nDDC/CI: Ja\nTr\u00fcbungsrate: 25%\nOberfl\u00e4chenh\u00e4rte: 3H\nRGB-Farbraum: sRGB\nFarbskala: 87%\nsRGB Abdeckung (klassisch): 100,78%\nNTSC Abdeckung (typisch): 83,87%\nsRGB: Ja\nAMD FreeSync: Ja\nKomponentenvideo-Synchronisation: Separate sync, Sync-on-green (SOG)\nFlimmerfreie Technologie: Ja\nLow-Blue-Light-Technologie: Ja\nEingebaute Lautsprecher: Nein\nIntegrierte Kamera: Nein\nMarktpositionierung: Haus\nProduktfarbe: Schwarz\nVorderer Rahmen: Schwarz\nAbnehmbarer Standfu\u00df: Ja\nFu\u00dffarbe: Schwarz\nSchwermetallfrei: Hg (Quecksilber), Pb (Blei)\nZertifizierung: CB, CE Mark, CU-EAC, EAEU RoHS, TUV/ISO9241-307, TUV-BAUART\nIntegrierter USB-Hub: Nein\nHDMI: Ja\nKopfh\u00f6rerausgang: Nein\nAnzahl VGA (D-Sub) Anschl\u00fcsse: 1\nDVI Anschluss: Nein\nAnzahl HDMI-Anschl\u00fcsse: 1\nAudioanschl\u00fcsse: Nein\nAudioausgang: Ja\nGleichstrom-Anschluss (DC): Ja\nVESA-Halterung: Ja\nKabelsperre-Slot: Ja\nH\u00f6henverstellung: Nein\nPanel-Montage-Schnittstelle: 100 x 100 mm\nSlot-Typ Kabelsperre: Kensington\nNeigungswinkelbereich: -5 - 20\u00b0\nOn-Screen-Display (OSD): Ja\nMen\u00fcsprachen: Vereinfachtes Chinesisch, Traditionelles Chinesisch, Tschechisch, Deutsch, Niederl\u00e4ndisch, Englisch, Spanisch, Finnisch, Franz\u00f6sisch, Griechisch, Ungarisch, Italienisch, Japanisch, Koreanisch, Polnisch, Portugiesisch, Russisch, Schwedisch, T\u00fcrkisch, Ukrainisch\nAnzahl OSD-Sprachen: 21\nPlug & Play: Ja\nLED-Anzeigen: T\u00e4tigkeit, Stand-by\nNeigungsverstellung: Ja\nEnergieeffizienzklasse (SDR): F\nEnergieverbrauch (SDR) pro 1.000 Stunden: 20 kWh\nStromverbrauch (Standardbetrieb): 27,9 W\nStromverbrauch (Standby): 0,5 W\nStromverbrauch (aus): 0,3 W\nAC Eingangsspannung: 100 - 240 V\nAC Eingangsfrequenz: 50/60 Hz\nNetzteiltyp: Extern\nBetriebstemperatur: 0 - 40 \u00b0C\nTemperaturbereich bei Lagerung: -20 - 60 \u00b0C\nRelative Luftfeuchtigkeit in Betrieb: 20 - 80%\nH\u00f6he bei Betrieb: 0 - 3658 m\nH\u00f6he bei Lagerung: 0 - 12192 m\nSt\u00e4nder enthalten: Ja\nMitgelieferte Kabel: HDMI, AC\nBetriebsanleitung: Ja\nGer\u00e4tebreite (inkl. Fu\u00df): 536 mm\nGer\u00e4tetiefe (inkl. Fu\u00df): 202 mm\nGer\u00e4teh\u00f6he (inkl. Fu\u00df): 413 mm\nGewicht (mit St\u00e4nder): 3,14 kg\nBreite (ohne Standfu\u00df): 53,6 cm\nTiefe (ohne Standfu\u00df): 6,6 cm\nH\u00f6he (ohne Standfu\u00df): 32,2 cm\nGewicht (ohne St\u00e4nder): 2,46 kg\nVerpackungsbreite: 595 mm\nVerpackungstiefe: 154 mm\nVerpackungsh\u00f6he: 475 mm\nPaketgewicht: 4,97 kg\nVerpackungsart: Box\nNachhaltigkeitszertifikate: RoHS\nEnth\u00e4lt nicht: Quecksilber, PVC/BFR\nWarentarifnummer (HS): 85285210\nAu\u00dfenverkleidungstyp: Texturiert\nRecycelbares Verpackungsmaterial: 100%\nLowBlue-Modus: Ja\nMittlere Betriebsdauer zwischen Ausf\u00e4llen (MTBF): 50000 h\nBild-Verbesserung: SmartImage game\nBeh\u00f6rdliche Zulassung: CB; CE Mark; CU-EAC; EAEU RoHS; TUV/ISO9241-307; TUV-BAUART\nDatenblatt: Kein Datenblatt verf\u00fcgbar\nProduktlink: Link\nHerstellerlink: Philips",
    "reference_file": "offer_reference_1704.json",
    "shop_name": "Syswork"
}