{
    "html_file": "offer_1121_13.html",
    "name": "Samsung S4U, 24\"",
    "offer_link": "https://www.e-tec.at/details.php?artnr=331980",
    "price": 164.25,
    "raw_specifications": {
        "AMD FreeSync": "Ja",
        "Abmessungen (BxHxT)": "544.5x511.4x182.9mm (mit Standfu\u00df),  544.5x324.8x42.4mm (ohne Standfu\u00df)",
        "Adaptive Sync": "Ja",
        "Anschl\u00fcsse - DisplayPort (75Hz@1920x1080)": "1",
        "Anschl\u00fcsse - DisplayPort 75Hz@1920x1080": "1",
        "Anschl\u00fcsse - HDMI (75Hz@1920x1080)": "1",
        "Anschl\u00fcsse - HDMI 75Hz@1920x1080": "1",
        "Anschl\u00fcsse - USB-C 3.0 mit DisplayPort 75Hz@1920x1080": "1",
        "Anschl\u00fcsse - USB-C mit DisplayPort (75Hz@1920x1080)": "1",
        "Anschl\u00fcsse - USB-C mit DisplayPort 75Hz@1920x1080": "1",
        "Anwendung": "station\u00e4r",
        "Audio": "1x Line-Out",
        "Aufl\u00f6sung": "1920x1080",
        "Beschichtung": "matt (non-glare)",
        "Besonderheiten": "Slim Bezel,  USB-C Power Delivery (65W),  Steuerkreuz,  Sicherheitsschloss (Kensington)",
        "Bildwiederholfrequenz": "75Hz",
        "Blickwinkel": "178\u00b0/178\u00b0",
        "Diagonale": "24\"/61cm",
        "Energieverbrauch SDR": "15kWh/1000h",
        "Ergonomie": "135mm (h\u00f6henverstellbar),  90\u00b0 (Pivot),  \u00b145\u00b0 (drehbar),  +24\u00b0/-4\u00b0 (neigbar),  keine Angabe (Schr\u00e4glage)",
        "FRC": "unbekannt",
        "Farbe": "schwarz",
        "Farbtiefe": "8bit (16.7 Mio. Farben)",
        "Form": "gerade (flat)",
        "Gewicht": "5.20kg (mit Standfu\u00df),  3.40kg (ohne Standfu\u00df)",
        "HDR": "N/A",
        "Helligkeit": "250cd/m\u00b2",
        "Herstellergarantie": "drei Jahre",
        "Hintergrundbeleuchtung": "White-LED,  flicker-free,  Blaulichtfilter",
        "Kontrast - statisch": "1.000:1",
        "Leistungsaufnahme": "keine Angabe (maximal),  15W (typisch),  keine Angabe (Energielabel alt A+++ bis G),  0.5W (Standby)",
        "Panel": "IPS",
        "Reaktionszeit - GtG": "5ms",
        "Screen-to-Body-Ratio": "89.8% (berechnet)",
        "Seitenverh\u00e4ltnis": "16:9",
        "Signalfrequenz": "keine Angabe (horizontal),  keine Angabe (vertikal)",
        "Stromversorgung": "AC-In (internes Netzteil)",
        "USB-Hub In": "1x USB-C 3.0 mit DisplayPort",
        "USB-Hub Out": "2x USB-A 3.0,  2x USB-A 2.0",
        "USB-Schreibweise": "Link",
        "VESA": "100x100 (belegt)",
        "Weitere Anschl\u00fcsse": "N/A"
    },
    "raw_specifications_text": "Abmessungen (BxHxT): 544.5x511.4x182.9mm (mit Standfu\u00df),  544.5x324.8x42.4mm (ohne Standfu\u00df)\nAdaptive Sync: Ja\nAMD FreeSync: Ja\nAnschl\u00fcsse - DisplayPort (75Hz@1920x1080): 1\nAnschl\u00fcsse - DisplayPort 75Hz@1920x1080: 1\nAnschl\u00fcsse - HDMI (75Hz@1920x1080): 1\nAnschl\u00fcsse - HDMI 75Hz@1920x1080: 1\nAnschl\u00fcsse - USB-C 3.0 mit DisplayPort 75Hz@1920x1080: 1\nAnschl\u00fcsse - USB-C mit DisplayPort (75Hz@1920x1080): 1\nAnschl\u00fcsse - USB-C mit DisplayPort 75Hz@1920x1080: 1\nAnwendung: station\u00e4r\nAudio: 1x Line-Out\nAufl\u00f6sung: 1920x1080\nBeschichtung: matt (non-glare)\nBesonderheiten: Slim Bezel,  USB-C Power Delivery (65W),  Steuerkreuz,  Sicherheitsschloss (Kensington)\nBildwiederholfrequenz: 75Hz\nBlickwinkel: 178\u00b0/178\u00b0\nDiagonale: 24\"/61cm\nEnergieverbrauch SDR: 15kWh/1000h\nErgonomie: 135mm (h\u00f6henverstellbar),  90\u00b0 (Pivot),  \u00b145\u00b0 (drehbar),  +24\u00b0/-4\u00b0 (neigbar),  keine Angabe (Schr\u00e4glage)\nFarbe: schwarz\nFarbtiefe: 8bit (16.7 Mio. Farben)\nForm: gerade (flat)\nFRC: unbekannt\nGewicht: 5.20kg (mit Standfu\u00df),  3.40kg (ohne Standfu\u00df)\nHDR: N/A\nHelligkeit: 250cd/m\u00b2\nHerstellergarantie: drei Jahre\nHintergrundbeleuchtung: White-LED,  flicker-free,  Blaulichtfilter\nKontrast - statisch: 1.000:1\nLeistungsaufnahme: keine Angabe (maximal),  15W (typisch),  keine Angabe (Energielabel alt A+++ bis G),  0.5W (Standby)\nPanel: IPS\nReaktionszeit - GtG: 5ms\nScreen-to-Body-Ratio: 89.8% (berechnet)\nSeitenverh\u00e4ltnis: 16:9\nSignalfrequenz: keine Angabe (horizontal),  keine Angabe (vertikal)\nStromversorgung: AC-In (internes Netzteil)\nUSB-Hub In: 1x USB-C 3.0 mit DisplayPort\nUSB-Hub Out: 2x USB-A 3.0,  2x USB-A 2.0\nUSB-Schreibweise: Link\nVESA: 100x100 (belegt)\nWeitere Anschl\u00fcsse: N/A",
    "reference_file": "offer_reference_1121.json",
    "shop_name": "e-tec.at"
}