{
    "html_file": "offer_1765_7.html",
    "name": "AOC U32E2N, 31.5\"",
    "offer_link": "https://direkt.jacob.de/produkte/aoc-essential-line-u32e2n-u32e2n-artnr-6793077.html?utm_source=geizhals&utm_medium=cpc&utm_campaign=Preisvergleich&ref=103",
    "price": 351.05,
    "raw_specifications": {
        "Abmessungen (Breite x Tiefe x H\u00f6he)": "71.482 cm x 25.381 cm x 52.281 cm - mit Fu\u00df",
        "Abmessungen (Breite x Tiefe x H\u00f6he) - mit Fu\u00df": "71.482 cm x 25.381 cm x 52.281 cm",
        "Ausgangsleistung/Kanal": "3 Watt",
        "Besonderheiten": "Low Blue Light Mode, flimmerfreie Technologie, Adaptive-Sync-Technologie, 77% Adobe RGB-Farbskala, grenzenlos, 3 Side Borderless Design, 104% sRGB-Farbskala",
        "Bildschirmbeschichtung": "Blendfrei, 3H Hard Coating",
        "Bildschirmtyp": "VA",
        "Blendentyp": "Flache Front",
        "Details zu Abmessungen & Gewicht": "Mit Fu\u00df - Breite: 71.482 cm - Tiefe: 25.381 cm - H\u00f6he: 52.281 cm  Ohne Fu\u00df - Breite: 71.482 cm - Tiefe: 5.571 cm - H\u00f6he: 42.524 cm",
        "Diagonalabmessung": "80 cm (32\")",
        "Display-Typ": "LED-hintergrundbeleuchteter LCD-Monitor / TFT-Aktivmatrix",
        "Eingangsanschl\u00fcsse": "2xHDMI, DisplayPort",
        "Einstellungen der Anzeigeposition": "Neigung",
        "Energie Effizienzklasse": "G",
        "Energieverbrauch pro Jahr": "80 kWh",
        "Enthaltene Kabel": "1 x HDMI-Kabel - 1.8 m  1 x DisplayPort-Kabel - 1.8 m",
        "Erforderliche Netzspannung": "Wechselstrom 120/230 V (50/60 Hz)",
        "Farbe": "Schwarz",
        "Farbunterst\u00fctzung": "16,7 Millionen Farben",
        "Ger\u00e4tetyp": "LED-hintergrundbeleuchteter LCD-Monitor - 80 cm (32\")",
        "Gewicht": "8.34 kg",
        "Helligkeit": "350 cd/m\u00b2",
        "Hintergrundbeleuchtungs-Technologie": "WLED",
        "Horizontaler Betrachtungswinkel": "178",
        "Kontrast": "2500:1 / 20000000:1 (dynamisch)",
        "Leistungsaufnahme im Betrieb": "44 Watt",
        "Leistungsaufnahme im Ein-Zustand": "55 W",
        "Leistungsmerkmale": "Slot f\u00fcr Sicherheitsschloss (Kabelschloss getrennt erh\u00e4ltlich)",
        "Native Aufl\u00f6sung": "4K 3840 x 2160 bei 60 Hz",
        "Neigungswinkel": "-5.5/+22",
        "OSD-Sprachen": "Multilingual",
        "Produktbeschreibung": "AOC U32E2N - LED-Monitor - 4K - 80 cm (32\")",
        "Reaktionszeit": "4 ms (gray-to-gray)",
        "Schlosstyp zur Diebstahlsicherung": "Kensington Slot",
        "Schnittstellen": "2 x HDMI  DisplayPort (DisplayPort 1.2 Modus)",
        "Seitenverh\u00e4ltnis": "16:9",
        "Sichtbare Bildfl\u00e4che": "80 cm (31.5\")",
        "Stromverbrauch (Aus-Modus)": "0.3 Watt",
        "Stromverbrauch im Standby-Modus": "0.5 Watt",
        "Transportbreite": "82 cm",
        "Transportgewicht": "11.2 kg",
        "Transporth\u00f6he": "54.6 cm",
        "Transporttiefe": "18.7 cm",
        "Typ": "Lautsprecher - Stereo",
        "VESA-Halterung": "100 x 100 mm",
        "Vertikaler Betrachtungswinkel": "178"
    },
    "raw_specifications_text": "Produktbeschreibung: AOC U32E2N - LED-Monitor - 4K - 80 cm (32\")\nGer\u00e4tetyp: LED-hintergrundbeleuchteter LCD-Monitor - 80 cm (32\")\nEnergie Effizienzklasse: G\nEnergieverbrauch pro Jahr: 80 kWh\nLeistungsaufnahme im Ein-Zustand: 55 W\nBildschirmtyp: VA\nSeitenverh\u00e4ltnis: 16:9\nNative Aufl\u00f6sung: 4K 3840 x 2160 bei 60 Hz\nHelligkeit: 350 cd/m\u00b2\nKontrast: 2500:1 / 20000000:1 (dynamisch)\nReaktionszeit: 4 ms (gray-to-gray)\nFarbunterst\u00fctzung: 16,7 Millionen Farben\nEingangsanschl\u00fcsse: 2xHDMI, DisplayPort\nEinstellungen der Anzeigeposition: Neigung\nBildschirmbeschichtung: Blendfrei, 3H Hard Coating\nFarbe: Schwarz\nAbmessungen (Breite x Tiefe x H\u00f6he) - mit Fu\u00df: 71.482 cm x 25.381 cm x 52.281 cm\nGewicht: 8.34 kg\nDisplay-Typ: LED-hintergrundbeleuchteter LCD-Monitor / TFT-Aktivmatrix\nDiagonalabmessung: 80 cm (32\")\nSichtbare Bildfl\u00e4che: 80 cm (31.5\")\nHorizontaler Betrachtungswinkel: 178\nVertikaler Betrachtungswinkel: 178\nHintergrundbeleuchtungs-Technologie: WLED\nOSD-Sprachen: Multilingual\nBlendentyp: Flache Front\nBesonderheiten: Low Blue Light Mode, flimmerfreie Technologie, Adaptive-Sync-Technologie, 77% Adobe RGB-Farbskala, grenzenlos, 3 Side Borderless Design, 104% sRGB-Farbskala\nAbmessungen (Breite x Tiefe x H\u00f6he): 71.482 cm x 25.381 cm x 52.281 cm - mit Fu\u00df\nTyp: Lautsprecher - Stereo\nAusgangsleistung/Kanal: 3 Watt\nSchnittstellen: 2 x HDMI  DisplayPort (DisplayPort 1.2 Modus)\nNeigungswinkel: -5.5/+22\nVESA-Halterung: 100 x 100 mm\nLeistungsmerkmale: Slot f\u00fcr Sicherheitsschloss (Kabelschloss getrennt erh\u00e4ltlich)\nEnthaltene Kabel: 1 x HDMI-Kabel - 1.8 m  1 x DisplayPort-Kabel - 1.8 m\nSchlosstyp zur Diebstahlsicherung: Kensington Slot\nErforderliche Netzspannung: Wechselstrom 120/230 V (50/60 Hz)\nLeistungsaufnahme im Betrieb: 44 Watt\nStromverbrauch im Standby-Modus: 0.5 Watt\nStromverbrauch (Aus-Modus): 0.3 Watt\nDetails zu Abmessungen & Gewicht: Mit Fu\u00df - Breite: 71.482 cm - Tiefe: 25.381 cm - H\u00f6he: 52.281 cm  Ohne Fu\u00df - Breite: 71.482 cm - Tiefe: 5.571 cm - H\u00f6he: 42.524 cm\nTransportbreite: 82 cm\nTransporttiefe: 18.7 cm\nTransporth\u00f6he: 54.6 cm\nTransportgewicht: 11.2 kg",
    "reference_file": "offer_reference_1765.json",
    "shop_name": "Jacob Elektronik direkt (AT)"
}