{
    "html_file": "offer_1979_9.html",
    "name": "Dell P2421DC, 23.8\"",
    "offer_link": "https://www.electronicshop24.at/product_info.php?products_id=320000000511883711&ano=A-I511883711&mno=DELL-P2421DC&ean=884116365341&utm_medium=cpc&utm_campaign=preisvergleich&utm_content=item&utm_source=geizhals&ref=geizhals",
    "price": 487.0,
    "raw_specifications": {
        "Abmessungen (Breite x Tiefe x H\u00f6he)": "53.78 cm x 16.6 cm x 35.61 cm - mit Fu\u00df",
        "Besonderheiten": "BFR/PVC-frei, ohne Quecksilber, arsenfreies Glas, 99 % sRGB Farbraum",
        "Bildschirmbeschichtung": "Haze 25 %, anti-glare 3H hardness",
        "Bildschirmtyp": "IPS",
        "Details zu Abmessungen & Gewicht": "Mit Fu\u00df - Breite: 53.78 cm - Tiefe: 16.6 cm - H\u00f6he: 35.61 cm \u00a6 Ohne Fu\u00df - Breite: 53.78 cm - Tiefe: 4.27 cm - H\u00f6he: 32.21 cm - Gewicht: 3.77 kg",
        "Diagonalabmessung": "60.5 cm (23.8\")",
        "Display-Typ": "LED-hintergrundbeleuchteter LCD-Monitor / TFT-Aktivmatrix",
        "ENERGY STAR zertifiziert": "Ja",
        "Eingangsspannung": "Wechselstrom 120/230 V (50/60 Hz)",
        "Einstellungen der Anzeigeposition": "H\u00f6he, Pivot (Rotation), Drehung, Neigung",
        "Energie Effizienzklasse": "Klasse E",
        "Energierverbrauch Sleep": "0.3 Watt",
        "Enthaltene Kabel": "1 x DisplayPort-Kabel - DisplayPort zu DisplayPort \u00a6 1 x SuperSpeed USB Typ-C Kabel",
        "Entwickelt f\u00fcr": "Dell Latitude 5320, 5520 \u00a6 Dell Precision 7560 \u00a6 Dell XPS 13 9310",
        "Farbraum": "99% sRGB",
        "Farbunterst\u00fctzung": "16,7 Millionen Farben",
        "Helligkeit": "300 cd/m\u00b2",
        "Hintergrundbeleuchtungs-Technologie": "LED-Hintergrundbeleuchtung",
        "Horizontaler Betrachtungswinkel": "178",
        "H\u00f6heneinstellung": "130 mm",
        "Integrierte Peripherieger\u00e4te": "USB-C-Hub",
        "Kennzeichnung": "RoHS, NFPA 99, DisplayPort 1.2, HDCP 1.2, quecksilberfrei",
        "Kontrast": "1000:1",
        "Leistungsaufnahme im Ein-Zustand": "18.5 W",
        "Leistungsmerkmale": "Slot f\u00fcr Sicherheitsschloss (Kabelschloss getrennt erh\u00e4ltlich), Unterst\u00fctzung f\u00fcr VESA-Schnittstelle",
        "Max. Betriebstemperatur": "40 \u00b0C",
        "Min Betriebstemperatur": "0 \u00b0C",
        "Mitgelieferte Software": "Dell Display Manager",
        "Native Aufl\u00f6sung": "QHD 2560 x 1440 bei 60 Hz",
        "Neigungswinkel": "-5/+21",
        "Pixelpitch": "0.2058 mm",
        "Ppi": "123",
        "Reaktionszeit": "5 ms (Fast), 8 ms (normal)",
        "Rotationswinkel": "180",
        "Schnittstellen": "HDMI \u00a6 2 x DisplayPort 1.2 \u00a6 USB 3.0 Upstream \u00a6 2 x USB 3.0 \u00a6 2 x USB 2.0 \u00a6 USB-C",
        "Schwenkwinkel": "90",
        "Seitenverh\u00e4ltnis": "16:9",
        "Services im Bundle": "3 Jahre erweiterte Basisaustauschgew\u00e4hrleistung",
        "Stromverbrauch (typisch)": "25 Watt",
        "Stromverbrauch SDR (eingeschaltet)": "18.5 kWh/1.000 h",
        "Stromverbrauch im Standby-Modus": "0.3 Watt",
        "TCO-zertifiziert": "TCO Certified Displays 8",
        "Transportgewicht": "7.69 kg",
        "VESA-Halterung": "100 x 100 mm",
        "Vertikaler Betrachtungswinkel": "178",
        "Zul\u00e4ssige Luftfeuchtigkeit im Betrieb": "10 - 90 % (nicht-kondensierend)"
    },
    "raw_specifications_text": "Display-Typ: LED-hintergrundbeleuchteter LCD-Monitor / TFT-Aktivmatrix\nEnergie Effizienzklasse: Klasse E\nDiagonalabmessung: 60.5 cm (23.8\")\nIntegrierte Peripherieger\u00e4te: USB-C-Hub\nBildschirmtyp: IPS\nSeitenverh\u00e4ltnis: 16:9\nNative Aufl\u00f6sung: QHD 2560 x 1440 bei 60 Hz\nPixelpitch: 0.2058 mm\nPpi: 123\nHelligkeit: 300 cd/m\u00b2\nKontrast: 1000:1\nFarbunterst\u00fctzung: 16,7 Millionen Farben\nFarbraum: 99% sRGB\nReaktionszeit: 5 ms (Fast), 8 ms (normal)\nHorizontaler Betrachtungswinkel: 178\nVertikaler Betrachtungswinkel: 178\nBildschirmbeschichtung: Haze 25 %, anti-glare 3H hardness\nHintergrundbeleuchtungs-Technologie: LED-Hintergrundbeleuchtung\nBesonderheiten: BFR/PVC-frei, ohne Quecksilber, arsenfreies Glas, 99 % sRGB Farbraum\nAbmessungen (Breite x Tiefe x H\u00f6he): 53.78 cm x 16.6 cm x 35.61 cm - mit Fu\u00df\nSchnittstellen: HDMI \u00a6 2 x DisplayPort 1.2 \u00a6 USB 3.0 Upstream \u00a6 2 x USB 3.0 \u00a6 2 x USB 2.0 \u00a6 USB-C\nEinstellungen der Anzeigeposition: H\u00f6he, Pivot (Rotation), Drehung, Neigung\nNeigungswinkel: -5/+21\nSchwenkwinkel: 90\nRotationswinkel: 180\nH\u00f6heneinstellung: 130 mm\nVESA-Halterung: 100 x 100 mm\nLeistungsmerkmale: Slot f\u00fcr Sicherheitsschloss (Kabelschloss getrennt erh\u00e4ltlich), Unterst\u00fctzung f\u00fcr VESA-Schnittstelle\nEnthaltene Kabel: 1 x DisplayPort-Kabel - DisplayPort zu DisplayPort \u00a6 1 x SuperSpeed USB Typ-C Kabel\nKennzeichnung: RoHS, NFPA 99, DisplayPort 1.2, HDCP 1.2, quecksilberfrei\nEingangsspannung: Wechselstrom 120/230 V (50/60 Hz)\nLeistungsaufnahme im Ein-Zustand: 18.5 W\nStromverbrauch SDR (eingeschaltet): 18.5 kWh/1.000 h\nStromverbrauch (typisch): 25 Watt\nStromverbrauch im Standby-Modus: 0.3 Watt\nEnergierverbrauch Sleep: 0.3 Watt\nMitgelieferte Software: Dell Display Manager\nDetails zu Abmessungen & Gewicht: Mit Fu\u00df - Breite: 53.78 cm - Tiefe: 16.6 cm - H\u00f6he: 35.61 cm \u00a6 Ohne Fu\u00df - Breite: 53.78 cm - Tiefe: 4.27 cm - H\u00f6he: 32.21 cm - Gewicht: 3.77 kg\nTransportgewicht: 7.69 kg\nTCO-zertifiziert: TCO Certified Displays 8\nENERGY STAR zertifiziert: Ja\nServices im Bundle: 3 Jahre erweiterte Basisaustauschgew\u00e4hrleistung\nMin Betriebstemperatur: 0 \u00b0C\nMax. Betriebstemperatur: 40 \u00b0C\nZul\u00e4ssige Luftfeuchtigkeit im Betrieb: 10 - 90 % (nicht-kondensierend)\nEntwickelt f\u00fcr: Dell Latitude 5320, 5520 \u00a6 Dell Precision 7560 \u00a6 Dell XPS 13 9310",
    "reference_file": "offer_reference_1979.json",
    "shop_name": "ElectronicShop24"
}