{
    "html_file": "offer_194_22.html",
    "name": "ASUS TUF Gaming VG328QA1A, 31.5\"",
    "offer_link": "https://ms-it-beratung.at/shop/details.php?art=433176&artname=ASUS+TUF+Gaming+VG328QA1A+80.1cm+%2816%3A9%29+FHD+HDMI+DP",
    "price": 278.0,
    "raw_specifications": {
        "AC Eingangsfrequenz": "50/60 Hz",
        "AC Eingangsspannung": "100 - 240 V",
        "AMD FreeSync": "Ja",
        "AMD FreeSync-Typ": "FreeSync Premium",
        "Abnehmbarer Standfu\u00df": "Ja",
        "Anzahl DisplayPort Anschl\u00fcsse": "1",
        "Anzahl HDMI-Anschl\u00fcsse": "2",
        "Anzahl der Farben des Displays": "16,7 Millionen Farben",
        "Anzahl der Lautsprecher": "2",
        "Anzahl der nachgeschalteten Steckpl\u00e4tze vom Typ USB-A": "1",
        "Bildschirmdiagonale": "80 cm (31.5\")",
        "Bildschirmform": "Flach",
        "Bildschirmtechnologie": "LED",
        "Bildwinkel, horizontal": "178\u00b0",
        "Bildwinkel, vertikal": "178\u00b0",
        "Blendfreier Bildschirm": "Ja",
        "Breite (ohne Standfu\u00df)": "716,2 mm",
        "Digital horizontale Frequenz": "30 - 195 kHz",
        "Digital vertikale Frequenz": "48 - 170 Hz",
        "Display-Aufl\u00f6sung": "1920 x 1080 Pixel",
        "DisplayPorts-Version": "1.2",
        "Eingebaute Lautsprecher": "Ja",
        "Energieeffizienzklasse (SDR)": "F",
        "Energieeffizienzskala": "A bis G",
        "Energieverbrauch (SDR) pro 1.000 Stunden": "32 kWh",
        "Farbskala": "100%",
        "Flimmerfreie Technologie": "Ja",
        "Fu\u00dffarbe": "Schwarz",
        "Ger\u00e4tebreite (inkl. Fu\u00df)": "716,2 mm",
        "Ger\u00e4teh\u00f6he (inkl. Fu\u00df)": "497,2 mm",
        "Ger\u00e4tetiefe (inkl. Fu\u00df)": "213,8 mm",
        "Gewicht (mit St\u00e4nder)": "6,8 kg",
        "Gewicht (ohne St\u00e4nder)": "5,9 kg",
        "HD-Typ": "Full HD",
        "HDMI": "Ja",
        "HDMI-Version": "2.0",
        "Helligkeit (typisch)": "300 cd/m\u00b2",
        "H\u00f6he (ohne Standfu\u00df)": "426,9 mm",
        "H\u00f6henverstellung": "Nein",
        "Integrierte Kamera": "Nein",
        "Integrierter USB-Hub": "Ja",
        "Kabelsperre-Slot": "Ja",
        "Kontrastverh\u00e4ltnis": "3000:1",
        "Kopfh\u00f6rerausgang": "Ja",
        "Low-Blue-Light-Technologie": "Ja",
        "Marktpositionierung": "Gaming",
        "Maximale Bildwiederholrate": "170 Hz",
        "Mitgelieferte Kabel": "AC, DisplayPort, HDMI",
        "NVIDIA G-SYNC": "Nein",
        "Natives Seitenverh\u00e4ltnis": "16:9",
        "Neigungsverstellung": "Ja",
        "Neigungswinkelbereich": "-5 - 20\u00b0",
        "Paketgewicht": "8,8 kg",
        "Panel-Montage-Schnittstelle": "100 x 100 mm",
        "Panel-Typ": "VA",
        "Pixel Abstand": "0,363 x 0,363 mm",
        "Produktfarbe": "Schwarz",
        "RGB-Farbraum": "sRGB",
        "RMS-Leistung": "4 W",
        "Reaktionszeit": "1 ms",
        "Schattensteuerung": "Ja",
        "Schnellstart\u00fcbersicht": "Ja",
        "Sichtbare Gr\u00f6\u00dfe (horizontal)": "69,8 cm",
        "Sichtbare Gr\u00f6\u00dfe (vertikal)": "39,3 cm",
        "Slot-Typ Kabelsperre": "Kensington",
        "Spiel-Modus": "Ja",
        "Stromeingang": "Ja",
        "Stromverbrauch (Standardbetrieb)": "23,5 W",
        "Stromverbrauch (Standby)": "0,5 W",
        "Stromverbrauch (aus)": "0,3 W",
        "St\u00e4nder enthalten": "Ja",
        "Tiefe (ohne Standfu\u00df)": "58 mm",
        "Touchscreen": "Nein",
        "Typ der Hintergrundbeleuchtung": "LED",
        "USB-Hub-Version": "3.2 Gen 1 (3.1 Gen 1)",
        "VESA-Halterung": "Ja",
        "Verpackungsart": "Box",
        "Verpackungsbreite": "800 mm",
        "Verpackungsh\u00f6he": "520 mm",
        "Verpackungstiefe": "185 mm",
        "Vorderer Rahmen": "Schwarz",
        "Zertifizierung": "T\u00dcV Flicker-free T\u00dcV Low Blue Light AMD FreeSync Premium",
        "sRGB Abdeckung (klassisch)": "100%"
    },
    "raw_specifications_text": "Bildschirmdiagonale: 80 cm (31.5\")\nDisplay-Aufl\u00f6sung: 1920 x 1080 Pixel\nNatives Seitenverh\u00e4ltnis: 16:9\nBildschirmtechnologie: LED\nTouchscreen: Nein\nHD-Typ: Full HD\nPanel-Typ: VA\nTyp der Hintergrundbeleuchtung: LED\nHelligkeit (typisch): 300 cd/m\u00b2\nReaktionszeit: 1 ms\nBlendfreier Bildschirm: Ja\nBildschirmform: Flach\nKontrastverh\u00e4ltnis: 3000:1\nMaximale Bildwiederholrate: 170 Hz\nBildwinkel, horizontal: 178\u00b0\nBildwinkel, vertikal: 178\u00b0\nAnzahl der Farben des Displays: 16,7 Millionen Farben\nPixel Abstand: 0,363 x 0,363 mm\nSichtbare Gr\u00f6\u00dfe (horizontal): 69,8 cm\nSichtbare Gr\u00f6\u00dfe (vertikal): 39,3 cm\nDigital horizontale Frequenz: 30 - 195 kHz\nDigital vertikale Frequenz: 48 - 170 Hz\nRGB-Farbraum: sRGB\nFarbskala: 100%\nsRGB Abdeckung (klassisch): 100%\nNVIDIA G-SYNC: Nein\nAMD FreeSync: Ja\nAMD FreeSync-Typ: FreeSync Premium\nFlimmerfreie Technologie: Ja\nLow-Blue-Light-Technologie: Ja\nSchattensteuerung: Ja\nSpiel-Modus: Ja\nEingebaute Lautsprecher: Ja\nIntegrierte Kamera: Nein\nAnzahl der Lautsprecher: 2\nRMS-Leistung: 4 W\nMarktpositionierung: Gaming\nProduktfarbe: Schwarz\nVorderer Rahmen: Schwarz\nAbnehmbarer Standfu\u00df: Ja\nFu\u00dffarbe: Schwarz\nZertifizierung: T\u00dcV Flicker-free T\u00dcV Low Blue Light AMD FreeSync Premium\nIntegrierter USB-Hub: Ja\nUSB-Hub-Version: 3.2 Gen 1 (3.1 Gen 1)\nAnzahl der nachgeschalteten Steckpl\u00e4tze vom Typ USB-A: 1\nHDMI: Ja\nAnzahl HDMI-Anschl\u00fcsse: 2\nHDMI-Version: 2.0\nAnzahl DisplayPort Anschl\u00fcsse: 1\nDisplayPorts-Version: 1.2\nKopfh\u00f6rerausgang: Ja\nStromeingang: Ja\nVESA-Halterung: Ja\nPanel-Montage-Schnittstelle: 100 x 100 mm\nKabelsperre-Slot: Ja\nSlot-Typ Kabelsperre: Kensington\nH\u00f6henverstellung: Nein\nNeigungswinkelbereich: -5 - 20\u00b0\nNeigungsverstellung: Ja\nEnergieeffizienzklasse (SDR): F\nEnergieverbrauch (SDR) pro 1.000 Stunden: 32 kWh\nStromverbrauch (Standardbetrieb): 23,5 W\nStromverbrauch (Standby): 0,5 W\nStromverbrauch (aus): 0,3 W\nAC Eingangsspannung: 100 - 240 V\nAC Eingangsfrequenz: 50/60 Hz\nEnergieeffizienzskala: A bis G\nSt\u00e4nder enthalten: Ja\nMitgelieferte Kabel: AC, DisplayPort, HDMI\nSchnellstart\u00fcbersicht: Ja\nGer\u00e4tebreite (inkl. Fu\u00df): 716,2 mm\nGer\u00e4tetiefe (inkl. Fu\u00df): 213,8 mm\nGer\u00e4teh\u00f6he (inkl. Fu\u00df): 497,2 mm\nGewicht (mit St\u00e4nder): 6,8 kg\nBreite (ohne Standfu\u00df): 716,2 mm\nTiefe (ohne Standfu\u00df): 58 mm\nH\u00f6he (ohne Standfu\u00df): 426,9 mm\nGewicht (ohne St\u00e4nder): 5,9 kg\nVerpackungsbreite: 800 mm\nVerpackungstiefe: 185 mm\nVerpackungsh\u00f6he: 520 mm\nPaketgewicht: 8,8 kg\nVerpackungsart: Box",
    "reference_file": "offer_reference_194.json",
    "shop_name": "ms-it-beratung"
}