{
    "html_file": "offer_433_2.html",
    "name": "iiyama ProLite XU2793HS-B5, 27\"",
    "offer_link": "https://www.proshop.at/Bildschirm/iiyama-27-Bildschirm-ProLite-XU2793HS-B5-LED-monitor-Full-HD-1080p-27-Black-4-ms-AMD-FreeSync/3144530?utm_source=geizhals&utm_medium=cpc&utm_campaign=pricesite",
    "price": 134.96,
    "raw_specifications": {
        "Abmessungen (Breite x Tiefe x H\u00f6he)": "61.2 cm x 23.6 cm x 47.95 cm",
        "Adaptive-Sync Technologie": "AMD FreeSync",
        "Ausgangsleistung/Kanal": "2 Watt",
        "Besonderheiten": "Advanced Contrast Ratio (ACR), X-Res Technology, i-Style Color, Adaptive-Sync-Technologie, 3 Side Borderless Design, Blue Light Reducer Function, kompatibel mit Mac",
        "Bildschirmbeschichtung": "Matt",
        "Bildschirmtyp": "IPS",
        "Diagonalabmessung": "68.6 cm (27\")",
        "Display-Typ": "LED-hintergrundbeleuchteter LCD-Monitor / TFT-Aktivmatrix",
        "EAN": "4948570121175",
        "EU-\u00d6ko-Label": "Ja",
        "Eingangsanschl\u00fcsse": "HDMI, DisplayPort",
        "Eingangsspannung": "Wechselstrom 100-240 V (50/60 Hz)",
        "Einstellungen der Anzeigeposition": "Neigung",
        "Energie Effizienzklasse": "Klasse E",
        "Enthaltene Kabel": "1 x HDMI-Kabel",
        "Farbe": "Mattschwarz",
        "Farbraum": "72% NTSC, 96% sRGB",
        "Farbunterst\u00fctzung": "16,7 Millionen Farben",
        "Ger\u00e4tetyp": "LED-hintergrundbeleuchteter LCD-Monitor - 68.6 cm (27\")",
        "Gewicht": "4.6 kg",
        "Helligkeit": "300 cd/m\u00b2",
        "Hersteller": "iiyama",
        "Hintergrundbeleuchtungs-Technologie": "LED-Hintergrundbeleuchtung",
        "Horizontale Bildwiederholrate": "30 - 83 kHz",
        "Horizontaler Betrachtungswinkel": "+89 / -89",
        "Kennzeichnung": "DDC-2B, DDC/CI, RoHS, WEEE, PSE Mark, REACH, TUV Bauart, ERP, VCCI Class B, EAC, REACH SvHC, UKCA",
        "Kontrast": "1000:1 / 80000000:1 (dynamisch)",
        "Leistungsmerkmale": "Slot f\u00fcr Sicherheitsschloss (Kabelschloss getrennt erh\u00e4ltlich)",
        "Modell": "XU2793HS-B5",
        "Native Aufl\u00f6sung": "Full HD (1080p) 1920 x 1080 bei 75 Hz",
        "Neigungswinkel": "-5/+23",
        "OSD-Sprachen": "Tschechisch, Englisch, Deutsch, Franz\u00f6sisch, Italienisch, Polnisch, Russisch, Holl\u00e4ndisch, Japanisch",
        "Pixelpitch": "0.311 mm",
        "Produktbeschreibung": "iiyama ProLite XU2793HS-B5 - LED-Monitor - Full HD (1080p) - 68.6 cm (27\")",
        "Reaktionszeit": "4 ms (gray-to-gray)",
        "Schlosstyp zur Diebstahlsicherung": "Kensington Slot",
        "Schnittstellen": "HDMI (HDCP)  DisplayPort (HDCP)  Kopfh\u00f6rer",
        "Seitenverh\u00e4ltnis": "16:9",
        "Spannung": "Wechselstrom 100-240 V (50/60 Hz)",
        "Stromverbrauch (Aus-Modus)": "0.3 Watt",
        "Stromverbrauch (typisch)": "19 Watt",
        "Stromverbrauch SDR (eingeschaltet)": "20 kWh/1.000 h",
        "Stromverbrauch im Standby-Modus": "0.5 Watt",
        "Transportbreite": "68.5 cm",
        "Transportgewicht": "6.2 kg",
        "Transporth\u00f6he": "43.5 cm",
        "Transporttiefe": "14.5 cm",
        "Typ": "Lautsprecher - Stereo",
        "VESA-Halterung": "100 x 100 mm",
        "Vertikale Bildwiederholrate": "55 - 76 Hz",
        "Vertikaler Betrachtungswinkel": "+89 / -89",
        "Waren-Nr.": "3144530",
        "Zum Hersteller": "www.iiyama.com"
    },
    "raw_specifications_text": "Hersteller: iiyama\nWaren-Nr.: 3144530\nModell: XU2793HS-B5\nEAN: 4948570121175\nZum Hersteller: www.iiyama.com\nProduktbeschreibung: iiyama ProLite XU2793HS-B5 - LED-Monitor - Full HD (1080p) - 68.6 cm (27\")\nGer\u00e4tetyp: LED-hintergrundbeleuchteter LCD-Monitor - 68.6 cm (27\")\nEnergie Effizienzklasse: Klasse E\nAdaptive-Sync Technologie: AMD FreeSync\nBildschirmtyp: IPS\nSeitenverh\u00e4ltnis: 16:9\nNative Aufl\u00f6sung: Full HD (1080p) 1920 x 1080 bei 75 Hz\nPixelpitch: 0.311 mm\nHelligkeit: 300 cd/m\u00b2\nKontrast: 1000:1 / 80000000:1 (dynamisch)\nReaktionszeit: 4 ms (gray-to-gray)\nFarbunterst\u00fctzung: 16,7 Millionen Farben\nFarbraum: 72% NTSC, 96% sRGB\nEingangsanschl\u00fcsse: HDMI, DisplayPort\nEinstellungen der Anzeigeposition: Neigung\nBildschirmbeschichtung: Matt\nSpannung: Wechselstrom 100-240 V (50/60 Hz)\nFarbe: Mattschwarz\nAbmessungen (Breite x Tiefe x H\u00f6he): 61.2 cm x 23.6 cm x 47.95 cm\nGewicht: 4.6 kg\nKennzeichnung: DDC-2B, DDC/CI, RoHS, WEEE, PSE Mark, REACH, TUV Bauart, ERP, VCCI Class B, EAC, REACH SvHC, UKCA\nDisplay-Typ: LED-hintergrundbeleuchteter LCD-Monitor / TFT-Aktivmatrix\nDiagonalabmessung: 68.6 cm (27\")\nVertikale Bildwiederholrate: 55 - 76 Hz\nHorizontale Bildwiederholrate: 30 - 83 kHz\nHorizontaler Betrachtungswinkel: +89 / -89\nVertikaler Betrachtungswinkel: +89 / -89\nHintergrundbeleuchtungs-Technologie: LED-Hintergrundbeleuchtung\nOSD-Sprachen: Tschechisch, Englisch, Deutsch, Franz\u00f6sisch, Italienisch, Polnisch, Russisch, Holl\u00e4ndisch, Japanisch\nBesonderheiten: Advanced Contrast Ratio (ACR), X-Res Technology, i-Style Color, Adaptive-Sync-Technologie, 3 Side Borderless Design, Blue Light Reducer Function, kompatibel mit Mac\nTyp: Lautsprecher - Stereo\nAusgangsleistung/Kanal: 2 Watt\nSchnittstellen: HDMI (HDCP)  DisplayPort (HDCP)  Kopfh\u00f6rer\nNeigungswinkel: -5/+23\nVESA-Halterung: 100 x 100 mm\nLeistungsmerkmale: Slot f\u00fcr Sicherheitsschloss (Kabelschloss getrennt erh\u00e4ltlich)\nEnthaltene Kabel: 1 x HDMI-Kabel\nSchlosstyp zur Diebstahlsicherung: Kensington Slot\nEingangsspannung: Wechselstrom 100-240 V (50/60 Hz)\nStromverbrauch SDR (eingeschaltet): 20 kWh/1.000 h\nStromverbrauch (typisch): 19 Watt\nStromverbrauch im Standby-Modus: 0.5 Watt\nStromverbrauch (Aus-Modus): 0.3 Watt\nTransportbreite: 68.5 cm\nTransporttiefe: 14.5 cm\nTransporth\u00f6he: 43.5 cm\nTransportgewicht: 6.2 kg\nEU-\u00d6ko-Label: Ja",
    "reference_file": "offer_reference_433.json",
    "shop_name": "Proshop.at"
}