{
    "html_file": "offer_1827_21.html",
    "name": "Dell S2721DS, 27\"",
    "offer_link": "https://www.csv-direct.de/artinfo.php?artnr=A1620950&KATEGORIE=162&pva=geizhals2",
    "price": 268.99,
    "raw_specifications": {
        "AC Eingangsfrequenz": "50 - 60 Hz",
        "AC Eingangsspannung": "100 - 240 V",
        "AMD FreeSync Bildwiederholratenbereich": "48 - 75 Hz",
        "Anzahl DisplayPort Anschl\u00fcsse": "1",
        "Anzahl HDMI-Anschl\u00fcsse": "2",
        "Anzahl der Farben des Displays": "16,78 Millionen Farben",
        "Anzahl der Lautsprecher": "2",
        "Audioanschl\u00fcsse": "Nein",
        "Betriebstemperatur": "0 - 40 \u00b0C",
        "Bildschirmdiagonale": "68,6 cm 27\"",
        "Bildschirmform": "Flach",
        "Bildschirmtechnologie": "LCD",
        "Bildwinkel, horizontal": "178\u00b0",
        "Bildwinkel, vertikal": "178\u00b0",
        "Breite ohne Standfu\u00df": "611,6 mm",
        "DVI Anschluss": "Nein",
        "Display-Aufl\u00f6sung": "2560 x 1440 Pixel",
        "DisplayPorts-Version": "1.2",
        "Eingangsstrom": "1.5 A",
        "Energieeffizienzklasse HDR": "Nicht verf\u00fcgbar",
        "Energieeffizienzklasse SDR": "E",
        "Energieeffizienzskala": "A bis G",
        "Energieverbrauch SDR pro 1.000 Stunden": "19 kWh",
        "Fu\u00dffarbe": "Grau",
        "Ger\u00e4tebreite inkl. Fu\u00df": "611,6 mm",
        "Ger\u00e4teh\u00f6he inkl. Fu\u00df": "510,1 mm",
        "Ger\u00e4tetiefe inkl. Fu\u00df": "174,7 mm",
        "Gewicht mit St\u00e4nder": "6,2 kg",
        "Gewicht ohne St\u00e4nder": "4,4 kg",
        "HD-Typ": "Quad HD",
        "HDMI-Version": "1.4",
        "Helligkeit typisch": "350 cd/m\u00b2",
        "High Dynamic Range Video HDR Unterst\u00fctzung": "Nein",
        "Horizontaler Scanbereich": "30 - 115 kHz",
        "H\u00f6he bei Betrieb": "0 - 5000 m",
        "H\u00f6he bei Lagerung": "0 - 12192 m",
        "H\u00f6he ohne Standfu\u00df": "364,6 mm",
        "H\u00f6heneinstellung": "11 cm",
        "Integrierte Kamera": "Nein",
        "Integrierter USB-Hub": "Nein",
        "J\u00e4hrlicher Energieverbrauch": "29 kWh",
        "Kontrastverh\u00e4ltnis": "1000:1",
        "Kopfh\u00f6rerausgang": "Nein",
        "LED-Anzeigen": "Leistung",
        "Luftfeuchtigkeit bei Lagerung": "5 - 90",
        "Marktpositionierung": "Business",
        "Maximale Bildwiederholrate": "75 Hz",
        "Mitgelieferte Kabel": "AC, HDMI",
        "NTSC Abdeckung typisch": "72",
        "NVIDIA G-SYNC": "Nein",
        "Nachhaltigkeitszertifikate": "RoHS, ENERGY STAR",
        "Natives Seitenverh\u00e4ltnis": "16:9",
        "Neigungswinkelbereich": "-5 - 21\u00b0",
        "Netzteiltyp": "Intern",
        "Paketgewicht": "8,9 kg",
        "Panel-Montage-Schnittstelle": "100 x 100 mm",
        "Panel-Typ": "IPS",
        "Pivot Winkel": "-90 - 90\u00b0",
        "Pixel Abstand": "0,2331 x 0,2331 mm",
        "Pixeldichte": "108,79 ppi",
        "Produktfarbe": "Grau",
        "RGB-Farbraum": "sRGB",
        "RMS-Leistung": "6 W",
        "Rahmenbreite Seite": "7,4 mm",
        "Rahmenbreite oben": "7,4 mm",
        "Rahmenbreite unten": "2,16 cm",
        "Reaktionszeit": "4 ms",
        "Reaktionszeit schnell": "5 ms",
        "Relative Luftfeuchtigkeit in Betrieb": "10 - 80",
        "Schwenkwinkelbereich": "-30 - 30\u00b0",
        "Schwermetallfrei": "Hg Quecksilber",
        "Stromverbrauch Standardbetrieb": "19 W",
        "Stromverbrauch Standby": "0,2 W",
        "Stromverbrauch aus": "0,2 W",
        "Stromverbrauch max.": "40 W",
        "Temperaturbereich bei Lagerung": "-20 - 60 \u00b0C",
        "Tiefe ohne Standfu\u00df": "55,4 mm",
        "Touchscreen": "Nein",
        "Typ der Hintergrundbeleuchtung": "W-LED",
        "Unterst\u00fctzte Grafik-Aufl\u00f6sungen": "640 x 480 VGA, 720 x 400, 800 x 600 SVGA, 1024 x 768 XGA, 1152 x 864 XGA+, 1280 x 1024 SXGA, 1600 x 900, 1920 x 1080 HD 1080, 2560 x 1440",
        "Unterst\u00fctzte Video-Modi": "480i, 480p, 576i, 576p, 720p, 1080i, 1080p",
        "Verpackungsbreite": "139,9 mm",
        "Verpackungsh\u00f6he": "446,8 mm",
        "Verpackungstiefe": "819,9 mm",
        "Vertikaler Scanbereich": "48 - 75 Hz",
        "Vorderer Rahmen": "Schwarz",
        "WLAN": "Nein",
        "Warentarifnummer HS": "85285210",
        "sRGB Abdeckung klassisch": "99"
    },
    "raw_specifications_text": "Bildschirmdiagonale: 68,6 cm 27\"\nDisplay-Aufl\u00f6sung: 2560 x 1440 Pixel\nNatives Seitenverh\u00e4ltnis: 16:9\nBildschirmtechnologie: LCD\nTouchscreen: Nein\nHD-Typ: Quad HD\nPanel-Typ: IPS\nBildschirmform: Flach\nKontrastverh\u00e4ltnis: 1000:1\nMaximale Bildwiederholrate: 75 Hz\nAnzahl der Farben des Displays: 16,78 Millionen Farben\nTyp der Hintergrundbeleuchtung: W-LED\nHelligkeit typisch: 350 cd/m\u00b2\nReaktionszeit: 4 ms\nUnterst\u00fctzte Grafik-Aufl\u00f6sungen: 640 x 480 VGA, 720 x 400, 800 x 600 SVGA, 1024 x 768 XGA, 1152 x 864 XGA+, 1280 x 1024 SXGA, 1600 x 900, 1920 x 1080 HD 1080, 2560 x 1440\nUnterst\u00fctzte Video-Modi: 480i, 480p, 576i, 576p, 720p, 1080i, 1080p\nBildwinkel, horizontal: 178\u00b0\nBildwinkel, vertikal: 178\u00b0\nReaktionszeit schnell: 5 ms\nPixel Abstand: 0,2331 x 0,2331 mm\nPixeldichte: 108,79 ppi\nHorizontaler Scanbereich: 30 - 115 kHz\nVertikaler Scanbereich: 48 - 75 Hz\nHigh Dynamic Range Video HDR Unterst\u00fctzung: Nein\nRGB-Farbraum: sRGB\nsRGB Abdeckung klassisch: 99\nNTSC Abdeckung typisch: 72\nNVIDIA G-SYNC: Nein\nAMD FreeSync Bildwiederholratenbereich: 48 - 75 Hz\nIntegrierte Kamera: Nein\nAnzahl der Lautsprecher: 2\nRMS-Leistung: 6 W\nMarktpositionierung: Business\nProduktfarbe: Grau\nVorderer Rahmen: Schwarz\nFu\u00dffarbe: Grau\nSchwermetallfrei: Hg Quecksilber\nIntegrierter USB-Hub: Nein\nKopfh\u00f6rerausgang: Nein\nDVI Anschluss: Nein\nAnzahl HDMI-Anschl\u00fcsse: 2\nHDMI-Version: 1.4\nAnzahl DisplayPort Anschl\u00fcsse: 1\nDisplayPorts-Version: 1.2\nAudioanschl\u00fcsse: Nein\nWLAN: Nein\nPanel-Montage-Schnittstelle: 100 x 100 mm\nH\u00f6heneinstellung: 11 cm\nPivot Winkel: -90 - 90\u00b0\nSchwenkwinkelbereich: -30 - 30\u00b0\nNeigungswinkelbereich: -5 - 21\u00b0\nLED-Anzeigen: Leistung\nEnergieeffizienzklasse SDR: E\nEnergieeffizienzklasse HDR: Nicht verf\u00fcgbar\nEnergieverbrauch SDR pro 1.000 Stunden: 19 kWh\nStromverbrauch Standardbetrieb: 19 W\nStromverbrauch Standby: 0,2 W\nStromverbrauch max.: 40 W\nStromverbrauch aus: 0,2 W\nAC Eingangsspannung: 100 - 240 V\nAC Eingangsfrequenz: 50 - 60 Hz\nEingangsstrom: 1.5 A\nNetzteiltyp: Intern\nEnergieeffizienzskala: A bis G\nJ\u00e4hrlicher Energieverbrauch: 29 kWh\nBetriebstemperatur: 0 - 40 \u00b0C\nTemperaturbereich bei Lagerung: -20 - 60 \u00b0C\nRelative Luftfeuchtigkeit in Betrieb: 10 - 80\nLuftfeuchtigkeit bei Lagerung: 5 - 90\nH\u00f6he bei Betrieb: 0 - 5000 m\nH\u00f6he bei Lagerung: 0 - 12192 m\nMitgelieferte Kabel: AC, HDMI\nGer\u00e4tebreite inkl. Fu\u00df: 611,6 mm\nGer\u00e4tetiefe inkl. Fu\u00df: 174,7 mm\nGer\u00e4teh\u00f6he inkl. Fu\u00df: 510,1 mm\nGewicht mit St\u00e4nder: 6,2 kg\nBreite ohne Standfu\u00df: 611,6 mm\nTiefe ohne Standfu\u00df: 55,4 mm\nH\u00f6he ohne Standfu\u00df: 364,6 mm\nGewicht ohne St\u00e4nder: 4,4 kg\nRahmenbreite Seite: 7,4 mm\nRahmenbreite oben: 7,4 mm\nRahmenbreite unten: 2,16 cm\nVerpackungsbreite: 139,9 mm\nVerpackungstiefe: 819,9 mm\nVerpackungsh\u00f6he: 446,8 mm\nPaketgewicht: 8,9 kg\nNachhaltigkeitszertifikate: RoHS, ENERGY STAR\nWarentarifnummer HS: 85285210",
    "reference_file": "offer_reference_1827.json",
    "shop_name": "CSV-Direct.de"
}