{
    "html_file": "offer_1801_6.html",
    "name": "Philips S-line 275S1AE, 27\"",
    "offer_link": "https://www.1ashop.at/de/produkt/73709/philips-s-line-275s1ae-led-monitor-68-6-cm-27.html",
    "price": 214.5,
    "raw_specifications": {
        "Abmessungen (Breite x Tiefe x H\u00f6he)": "61.3 cm x 20.5 cm x 53.7 cm - mit Fu\u00df",
        "Ausgangsleistung/Kanal": "2 Watt",
        "Besonderheiten": "Bleifrei, Low Blue Light Mode, flimmerfreie Technologie, BFR/PVC-frei, ohne Quecksilber, Adaptive-Sync-Technologie, EasyRead, SmartControl",
        "Bildschirmbeschichtung": "Blendfrei, 3H Hard Coating, Haze 25 %",
        "Bildschirmtyp": "IPS",
        "Details zu Abmessungen & Gewicht": "Mit Fu\u00df - Breite: 61.3 cm - Tiefe: 20.5 cm - H\u00f6he: 53.7 cm - Gewicht: 6.44 kg  Ohne Fu\u00df - Breite: 61.3 cm - Tiefe: 5.1 cm - H\u00f6he: 36.6 cm - Gewicht: 2.98 kg",
        "Diagonalabmessung": "68.6 cm (27\")",
        "Display-Typ": "LED-hintergrundbeleuchteter LCD-Monitor / TFT-Aktivmatrix",
        "EAN/UPC": "8712581764418",
        "ENERGY STAR zertifiziert": "Ja",
        "ENERGY STAR-Version": "8",
        "Eingangsspannung": "Wechselstrom 120/230 V (50/60 Hz)",
        "Einstellungen der Anzeigeposition": "H\u00f6he, Pivot (Rotation), Drehung, Neigung",
        "Energie Effizienzklasse": "Klasse F",
        "Enthaltene Kabel": "1 x HDMI-Kabel  1 x DisplayPort-Kabel  1 x Audiokabel",
        "Farbe": "Black Texture",
        "Farbraum": "110% NTSC, 123% sRGB",
        "Farbunterst\u00fctzung": "16,7 Millionen Farben",
        "Gewicht": "6.44 kg",
        "Gruppe": "TFTs",
        "Helligkeit": "250 cd/m\u00b2",
        "Hersteller": "Philips",
        "Hersteller Art. Nr.": "275S1AE/00",
        "Hintergrundbeleuchtungs-Technologie": "WLED",
        "Horizontale Bildwiederholrate": "30 - 114 kHz",
        "Horizontaler Betrachtungswinkel": "178",
        "H\u00f6heneinstellung": "130 mm",
        "Kennzeichnung": "Plug and Play, FCC Klasse B bescheinigt, TUV GS, ICES-003, SEMKO, CB, CCC, TUV Ergo, DDC/CI, RoHS, CECP, CEL, EPA, CU-EAC, TUV Eye Comfort certified",
        "Kontrast": "1000:1 / 50000000:1 (dynamisch)",
        "Leistungsaufnahme im Ein-Zustand": "25.1 W",
        "Leistungsmerkmale": "Slot f\u00fcr Sicherheitsschloss (Kabelschloss getrennt erh\u00e4ltlich)",
        "MTBF": "70,000 Stunde(n)",
        "Max. Betriebstemperatur": "40 \u00b0C",
        "Min Betriebstemperatur": "0 \u00b0C",
        "Native Aufl\u00f6sung": "QHD 2560 x 1440 (DisplayPort: 75 Hz, HDMI: 70 Hz, DVI: 60 Hz)",
        "Neigungswinkel": "-5/+20",
        "OSD-Sprachen": "Multilingual",
        "Pixelpitch": "0.2331 mm",
        "Ppi": "109",
        "Reaktionszeit": "4 ms (gray-to-gray)",
        "Rotationswinkel": "180",
        "Schlosstyp zur Diebstahlsicherung": "Kensington Slot",
        "Schnittstellen": "DVI-D (HDCP)  DisplayPort 1.2  HDMI (HDCP)  Audio Line-In  Kopfh\u00f6rer",
        "Schwenkwinkel": "360",
        "Seitenverh\u00e4ltnis": "16:9",
        "Stromverbrauch (Aus-Modus)": "0.3 Watt",
        "Stromverbrauch (typisch)": "17.3 Watt",
        "Stromverbrauch SDR (eingeschaltet)": "25.1 kWh/1.000 h",
        "Stromverbrauch im Standby-Modus": "0.3 Watt",
        "TCO-zertifiziert": "TCO Certified Displays 8",
        "Transportbreite": "70 cm",
        "Transportgewicht": "8.55 kg",
        "Transporth\u00f6he": "45.6 cm",
        "Transporttiefe": "21.6 cm",
        "Typ": "Lautsprecher - Stereo",
        "VESA-Halterung": "100 x 100 mm",
        "Vertikale Bildwiederholrate": "48 - 75 Hz",
        "Vertikaler Betrachtungswinkel": "178",
        "Zul\u00e4ssige Luftfeuchtigkeit im Betrieb": "20 - 80%"
    },
    "raw_specifications_text": "Gruppe: TFTs\nHersteller: Philips\nHersteller Art. Nr.: 275S1AE/00\nEAN/UPC: 8712581764418\nDisplay-Typ: LED-hintergrundbeleuchteter LCD-Monitor / TFT-Aktivmatrix\nEnergie Effizienzklasse: Klasse F\nDiagonalabmessung: 68.6 cm (27\")\nBildschirmtyp: IPS\nSeitenverh\u00e4ltnis: 16:9\nNative Aufl\u00f6sung: QHD 2560 x 1440 (DisplayPort: 75 Hz, HDMI: 70 Hz, DVI: 60 Hz)\nPixelpitch: 0.2331 mm\nPpi: 109\nHelligkeit: 250 cd/m\u00b2\nKontrast: 1000:1 / 50000000:1 (dynamisch)\nFarbunterst\u00fctzung: 16,7 Millionen Farben\nReaktionszeit: 4 ms (gray-to-gray)\nVertikale Bildwiederholrate: 48 - 75 Hz\nFarbraum: 110% NTSC, 123% sRGB\nHorizontale Bildwiederholrate: 30 - 114 kHz\nHorizontaler Betrachtungswinkel: 178\nVertikaler Betrachtungswinkel: 178\nBildschirmbeschichtung: Blendfrei, 3H Hard Coating, Haze 25 %\nHintergrundbeleuchtungs-Technologie: WLED\nOSD-Sprachen: Multilingual\nFarbe: Black Texture\nAbmessungen (Breite x Tiefe x H\u00f6he): 61.3 cm x 20.5 cm x 53.7 cm - mit Fu\u00df\nBesonderheiten: Bleifrei, Low Blue Light Mode, flimmerfreie Technologie, BFR/PVC-frei, ohne Quecksilber, Adaptive-Sync-Technologie, EasyRead, SmartControl\nGewicht: 6.44 kg\nMin Betriebstemperatur: 0 \u00b0C\nMax. Betriebstemperatur: 40 \u00b0C\nZul\u00e4ssige Luftfeuchtigkeit im Betrieb: 20 - 80%\nEingangsspannung: Wechselstrom 120/230 V (50/60 Hz)\nLeistungsaufnahme im Ein-Zustand: 25.1 W\nStromverbrauch SDR (eingeschaltet): 25.1 kWh/1.000 h\nStromverbrauch (typisch): 17.3 Watt\nStromverbrauch im Standby-Modus: 0.3 Watt\nStromverbrauch (Aus-Modus): 0.3 Watt\nSchnittstellen: DVI-D (HDCP)  DisplayPort 1.2  HDMI (HDCP)  Audio Line-In  Kopfh\u00f6rer\nTyp: Lautsprecher - Stereo\nAusgangsleistung/Kanal: 2 Watt\nEinstellungen der Anzeigeposition: H\u00f6he, Pivot (Rotation), Drehung, Neigung\nNeigungswinkel: -5/+20\nSchwenkwinkel: 360\nRotationswinkel: 180\nH\u00f6heneinstellung: 130 mm\nVESA-Halterung: 100 x 100 mm\nLeistungsmerkmale: Slot f\u00fcr Sicherheitsschloss (Kabelschloss getrennt erh\u00e4ltlich)\nEnthaltene Kabel: 1 x HDMI-Kabel  1 x DisplayPort-Kabel  1 x Audiokabel\nMTBF: 70,000 Stunde(n)\nKennzeichnung: Plug and Play, FCC Klasse B bescheinigt, TUV GS, ICES-003, SEMKO, CB, CCC, TUV Ergo, DDC/CI, RoHS, CECP, CEL, EPA, CU-EAC, TUV Eye Comfort certified\nSchlosstyp zur Diebstahlsicherung: Kensington Slot\nDetails zu Abmessungen & Gewicht: Mit Fu\u00df - Breite: 61.3 cm - Tiefe: 20.5 cm - H\u00f6he: 53.7 cm - Gewicht: 6.44 kg  Ohne Fu\u00df - Breite: 61.3 cm - Tiefe: 5.1 cm - H\u00f6he: 36.6 cm - Gewicht: 2.98 kg\nTransportbreite: 70 cm\nTransporttiefe: 21.6 cm\nTransporth\u00f6he: 45.6 cm\nTransportgewicht: 8.55 kg\nTCO-zertifiziert: TCO Certified Displays 8\nENERGY STAR zertifiziert: Ja\nENERGY STAR-Version: 8",
    "reference_file": "offer_reference_1801.json",
    "shop_name": "1ashop.at"
}