{
    "html_file": "offer_294_0.html",
    "name": "LG 32QN600P-B, 31.5\"",
    "offer_link": "https://www.proshop.at/Bildschirm/LG-32-Bildschirm-32QN600P-B-2560x1440-IPS-75Hz-Black-5-ms-AMD-FreeSync/3182438?utm_source=geizhals&utm_medium=cpc&utm_campaign=pricesite",
    "price": 316.64,
    "raw_specifications": {
        "Abmessungen (Breite x Tiefe x H\u00f6he)": "71.43 cm x 20.88 cm x 51.23 cm - mit Fu\u00df",
        "Abmessungen (Breite x Tiefe x H\u00f6he) - mit Fu\u00df": "71.43 cm x 20.88 cm x 51.23 cm",
        "Adaptive-Sync Technologie": "AMD FreeSync",
        "Besonderheiten": "Geteilter Bildschirm, Cinema Mode, CustomColor Mode, FPS Mode, Flicker Safe, Reader Mode, RTS Mode, Intelligente Energiespartechnologie, Farbkalibrierung, Black Stabilizer, DAS Mode (Dynamic Action Sync), Color Weakness Mode, Vivid Mode, HDR Effect, 10 bits (8 bits + FRC)",
        "Bildschirmbeschichtung": "Blendfrei",
        "Bildschirmtyp": "IPS",
        "Details zu Abmessungen & Gewicht": "Mit Fu\u00df - Breite: 71.43 cm - Tiefe: 20.88 cm - H\u00f6he: 51.23 cm - Gewicht: 7.2 kg  Ohne Fu\u00df - Breite: 71.43 cm - Tiefe: 4.57 cm - H\u00f6he: 42 cm - Gewicht: 6.3 kg",
        "Diagonalabmessung": "80 cm (32\")",
        "Display-Typ": "LED-hintergrundbeleuchteter LCD-Monitor / TFT-Aktivmatrix",
        "EAN": "8806091984357",
        "Eingangsanschl\u00fcsse": "2xHDMI, DisplayPort",
        "Einstellungen der Anzeigeposition": "Neigung",
        "Energie Effizienzklasse": "Klasse G",
        "Energieklasse (HDR)": "Klasse G",
        "Enthaltene Kabel": "1 x DisplayPort-Kabel  1 x HDMI-Kabel",
        "Farbraum": "99% sRGB",
        "Farbunterst\u00fctzung": "1,07 Mrd. Farben",
        "Ger\u00e4tetyp": "LED-hintergrundbeleuchteter LCD-Monitor - 80 cm (32\")",
        "Gewicht": "7.2 kg",
        "HDR-Format": "HDR10",
        "HDR-f\u00e4hig": "HDR10",
        "Helligkeit": "350 cd/m\u00b2",
        "Hersteller": "LG",
        "Hintergrundbeleuchtungs-Technologie": "LED-Hintergrundbeleuchtung",
        "Horizontaler Betrachtungswinkel": "178",
        "Kennzeichnung": "FCC Klasse B bescheinigt, TUV, CB, RoHS, REACH, ERP, UL/cUL",
        "Kontrast": "5000000:1 (dynamisch)",
        "Leistungsmerkmale": "Slot f\u00fcr Sicherheitsschloss (Kabelschloss getrennt erh\u00e4ltlich), abnehmbarer St\u00e4nder",
        "Mitgelieferte Software": "LG On-Screen Control",
        "Modell": "32QN600P-B.AEU",
        "Native Aufl\u00f6sung": "QHD 2560 x 1440 bei 75 Hz",
        "Neigungswinkel": "-5/+15",
        "Pixelpitch": "0.27 mm",
        "Produktbeschreibung": "LG 32QN600P-B - QN600P Series - LED-Monitor - QHD - 80 cm (32\") - HDR",
        "Reaktionszeit": "5 ms (Gray-to-Gray)",
        "Schlosstyp zur Diebstahlsicherung": "Kensington Slot",
        "Schnittstellen": "HDMI 1.4 (HDCP 2.2)  DisplayPort 1.4 (HDCP 2.2)  Kopfh\u00f6rer",
        "Seitenverh\u00e4ltnis": "16:9",
        "Sichtbare Bildfl\u00e4che": "80 cm (31.5\")",
        "Stromverbrauch HDR (eingeschaltet)": "41 kWh/1.000 h",
        "Stromverbrauch SDR (eingeschaltet)": "33 kWh/1.000 h",
        "VESA-Halterung": "100 x 100 mm",
        "Vertikaler Betrachtungswinkel": "178",
        "Waren-Nr.": "3182438",
        "Zum Hersteller": "www.lge.com"
    },
    "raw_specifications_text": "Hersteller: LG\nWaren-Nr.: 3182438\nModell: 32QN600P-B.AEU\nEAN: 8806091984357\nZum Hersteller: www.lge.com\nProduktbeschreibung: LG 32QN600P-B - QN600P Series - LED-Monitor - QHD - 80 cm (32\") - HDR\nGer\u00e4tetyp: LED-hintergrundbeleuchteter LCD-Monitor - 80 cm (32\")\nEnergie Effizienzklasse: Klasse G\nAdaptive-Sync Technologie: AMD FreeSync\nBildschirmtyp: IPS\nSeitenverh\u00e4ltnis: 16:9\nNative Aufl\u00f6sung: QHD 2560 x 1440 bei 75 Hz\nPixelpitch: 0.27 mm\nHelligkeit: 350 cd/m\u00b2\nKontrast: 5000000:1 (dynamisch)\nHDR-f\u00e4hig: HDR10\nReaktionszeit: 5 ms (Gray-to-Gray)\nFarbunterst\u00fctzung: 1,07 Mrd. Farben\nFarbraum: 99% sRGB\nEingangsanschl\u00fcsse: 2xHDMI, DisplayPort\nEinstellungen der Anzeigeposition: Neigung\nBildschirmbeschichtung: Blendfrei\nAbmessungen (Breite x Tiefe x H\u00f6he) - mit Fu\u00df: 71.43 cm x 20.88 cm x 51.23 cm\nGewicht: 7.2 kg\nKennzeichnung: FCC Klasse B bescheinigt, TUV, CB, RoHS, REACH, ERP, UL/cUL\nDisplay-Typ: LED-hintergrundbeleuchteter LCD-Monitor / TFT-Aktivmatrix\nEnergieklasse (HDR): Klasse G\nDiagonalabmessung: 80 cm (32\")\nSichtbare Bildfl\u00e4che: 80 cm (31.5\")\nHDR-Format: HDR10\nHorizontaler Betrachtungswinkel: 178\nVertikaler Betrachtungswinkel: 178\nHintergrundbeleuchtungs-Technologie: LED-Hintergrundbeleuchtung\nBesonderheiten: Geteilter Bildschirm, Cinema Mode, CustomColor Mode, FPS Mode, Flicker Safe, Reader Mode, RTS Mode, Intelligente Energiespartechnologie, Farbkalibrierung, Black Stabilizer, DAS Mode (Dynamic Action Sync), Color Weakness Mode, Vivid Mode, HDR Effect, 10 bits (8 bits + FRC)\nAbmessungen (Breite x Tiefe x H\u00f6he): 71.43 cm x 20.88 cm x 51.23 cm - mit Fu\u00df\nSchnittstellen: HDMI 1.4 (HDCP 2.2)  DisplayPort 1.4 (HDCP 2.2)  Kopfh\u00f6rer\nNeigungswinkel: -5/+15\nVESA-Halterung: 100 x 100 mm\nLeistungsmerkmale: Slot f\u00fcr Sicherheitsschloss (Kabelschloss getrennt erh\u00e4ltlich), abnehmbarer St\u00e4nder\nEnthaltene Kabel: 1 x DisplayPort-Kabel  1 x HDMI-Kabel\nSchlosstyp zur Diebstahlsicherung: Kensington Slot\nStromverbrauch SDR (eingeschaltet): 33 kWh/1.000 h\nStromverbrauch HDR (eingeschaltet): 41 kWh/1.000 h\nMitgelieferte Software: LG On-Screen Control\nDetails zu Abmessungen & Gewicht: Mit Fu\u00df - Breite: 71.43 cm - Tiefe: 20.88 cm - H\u00f6he: 51.23 cm - Gewicht: 7.2 kg  Ohne Fu\u00df - Breite: 71.43 cm - Tiefe: 4.57 cm - H\u00f6he: 42 cm - Gewicht: 6.3 kg",
    "reference_file": "offer_reference_294.json",
    "shop_name": "Proshop.at"
}