{
    "html_file": "offer_2114_1.html",
    "name": "Philips E-line 241E1SCA, 23.6\"",
    "offer_link": "https://www.csv-direct.de/artinfo.php?artnr=AGX1180670&KATEGORIE=162&pva=geizhals2",
    "price": 118.99,
    "raw_specifications": {
        "AC Eingangsfrequenz": "50 - 60 Hz",
        "AC Eingangsspannung": "100 - 240 V",
        "Anzahl HDMI-Anschl\u00fcsse": "1",
        "Anzahl VGA D-Sub Anschl\u00fcsse": "1",
        "Anzahl der Farben des Displays": "16,7 Millionen Farben",
        "Anzahl der Lautsprecher": "2",
        "Au\u00dfenverkleidungstyp": "Texturiert",
        "Beh\u00f6rdliche Zulassung": "CE Mark; CU-EAC; TUV-BAUART",
        "Betriebstemperatur": "0 - 40 \u00b0C",
        "Bewertung der Bildschirmkr\u00fcmmung": "1500R",
        "Bild-Verbesserung": "SmartImage game",
        "Bildschirmdiagonale": "59,9 cm 23.6\"",
        "Bildschirmdiagonale cm": "59,9 cm",
        "Bildschirmform": "Gebogen",
        "Bildschirmkr\u00fcmmung": "150 cm",
        "Bildschirmtechnologie": "LCD",
        "Bildwinkel, horizontal": "178\u00b0",
        "Bildwinkel, vertikal": "178\u00b0",
        "Breite ohne Standfu\u00df": "536 mm",
        "DVI Anschluss": "Nein",
        "Digital horizontale Frequenz": "30 - 85 kHz",
        "Digital vertikale Frequenz": "48 - 76 Hz",
        "Display-Aufl\u00f6sung": "1920 x 1080 Pixel",
        "Display-Oberfl\u00e4che": "Matt",
        "Dynamisches Kontrastverh\u00e4ltnis Marketingbezeichnung": "SmartContrast",
        "Energieeffizienzklasse SDR": "E",
        "Energieeffizienzklasse alt": "F",
        "Energieeffizienzskala": "A bis G",
        "Energieverbrauch SDR pro 1.000 Stunden": "22 kWh",
        "Enth\u00e4lt nicht": "Quecksilber, PVC/BFR",
        "Farbskala": "87",
        "Ger\u00e4tebreite inkl. Fu\u00df": "536 mm",
        "Ger\u00e4teh\u00f6he inkl. Fu\u00df": "413 mm",
        "Ger\u00e4tetiefe inkl. Fu\u00df": "202 mm",
        "Gewicht mit St\u00e4nder": "3,54 kg",
        "Gewicht ohne St\u00e4nder": "2,86 kg",
        "HD-Typ": "Full HD",
        "Helligkeit typisch": "250 cd/m\u00b2",
        "Horizontaler Scanbereich": "30 - 85 kHz",
        "H\u00f6he bei Betrieb": "0 - 3658 m",
        "H\u00f6he bei Lagerung": "0 - 12192 m",
        "H\u00f6he ohne Standfu\u00df": "322 mm",
        "H\u00f6henverstellung": "Nein",
        "Integrierte Kamera": "Nein",
        "Integrierter USB-Hub": "Nein",
        "Komponentenvideo-Synchronisation": "Separate sync, Sync-on-green SOG",
        "Kontrastverh\u00e4ltnis": "3000:1",
        "Kopfh\u00f6rerausg\u00e4nge": "1",
        "LED-Anzeigen": "T\u00e4tigkeit, Stand-by",
        "Marktpositionierung": "Haus",
        "Maximale Bildwiederholrate": "75 Hz",
        "Men\u00fcsprachen": "Vereinfachtes Chinesisch, Traditionelles Chinesisch, Tschechisch, Deutsch, Niederl\u00e4ndisch, Englisch, Spanisch, Finnisch, Franz\u00f6sisch, Griechisch, Ungarisch, Italienisch, Japanisch, Koreanisch, Polnisch, Portugiesisch, Russisch, Schwedisch, T\u00fcrkisch, Ukrainisch",
        "Mitgelieferte Kabel": "HDMI, Audio 3,5 mm, AC",
        "Mittlere Betriebsdauer zwischen Ausf\u00e4llen MTBF": "50000 h",
        "NTSC Abdeckung typisch": "83,87",
        "Nachhaltigkeitszertifikate": "RoHS",
        "Natives Seitenverh\u00e4ltnis": "16:9",
        "Neigungswinkelbereich": "-5 - 20\u00b0",
        "Netzteiltyp": "Extern",
        "Oberfl\u00e4chenh\u00e4rte": "3H",
        "Paketgewicht": "5,37 kg",
        "Panel-Montage-Schnittstelle": "100 x 100 mm",
        "Panel-Typ": "VA",
        "Pixel Abstand": "0,272 x 0,272 mm",
        "Pixeldichte": "93 ppi",
        "Produktfarbe": "Schwarz",
        "RGB-Farbraum": "sRGB",
        "RMS-Leistung": "6 W",
        "Reaktionszeit": "4 ms",
        "Recycelbares Verpackungsmaterial": "100",
        "Relative Luftfeuchtigkeit in Betrieb": "20 - 80",
        "Schwermetallfrei": "Hg Quecksilber, Pb Blei",
        "Seitenverh\u00e4ltnis": "16:9",
        "Sichtbare Gr\u00f6\u00dfe horizontal": "52,1 cm",
        "Sichtbare Gr\u00f6\u00dfe vertikal": "29,3 cm",
        "Slot-Typ Kabelsperre": "Kensington",
        "Stromverbrauch Standardbetrieb": "27,9 W",
        "Stromverbrauch Standby": "0,5 W",
        "Stromverbrauch aus": "0,3 W",
        "TV Tuner integriert": "Nein",
        "Temperaturbereich bei Lagerung": "-20 - 60 \u00b0C",
        "Tiefe ohne Standfu\u00df": "66 mm",
        "Touchscreen": "Nein",
        "Tr\u00fcbungsrate": "25",
        "Typ der Hintergrundbeleuchtung": "W-LED",
        "Unterst\u00fctzt Mac-Betriebssysteme": "Mac OS X 10.0 Cheetah, Mac OS X 10.1 Puma, Mac OS X 10.10 Yosemite, Mac OS X 10.11 El Capitan, Mac OS X 10.12 Sierra, Mac OS X 10.13 High Sierra, Mac OS X 10.14 Mojave, Mac OS X 10.2 Jaguar, Mac OS X 10.3 Panther, Mac OS X 10.4 Tiger, Mac OS X 10.5 Leopard, Mac OS X 10.6 Snow Leopard, Mac OS X 10.7 Lion, Mac OS X 10.8 Mountain Lion, Mac OS X 10.9 Mavericks",
        "Unterst\u00fctzt Windows-Betriebssysteme": "Windows 10, Windows 7, Windows 8, Windows 8.1",
        "Unterst\u00fctzte Grafik-Aufl\u00f6sungen": "1920 x 1080 HD 1080",
        "Unterst\u00fctzte Video-Modi": "1080p",
        "Verpackungsart": "Box",
        "Verpackungsbreite": "595 mm",
        "Verpackungsh\u00f6he": "475 mm",
        "Verpackungstiefe": "154 mm",
        "Vertikaler Scanbereich": "48 - 76 Hz",
        "Warentarifnummer HS": "85285210",
        "Zertifizierung": "CE Mark, CU-EAC, TUV-BAUART",
        "sRGB Abdeckung klassisch": "100,78"
    },
    "raw_specifications_text": "Bildschirmdiagonale: 59,9 cm 23.6\"\nDisplay-Aufl\u00f6sung: 1920 x 1080 Pixel\nNatives Seitenverh\u00e4ltnis: 16:9\nBildschirmtechnologie: LCD\nTouchscreen: Nein\nHD-Typ: Full HD\nPanel-Typ: VA\nBildschirmform: Gebogen\nKontrastverh\u00e4ltnis: 3000:1\nMaximale Bildwiederholrate: 75 Hz\nAnzahl der Farben des Displays: 16,7 Millionen Farben\nTyp der Hintergrundbeleuchtung: W-LED\nHelligkeit typisch: 250 cd/m\u00b2\nReaktionszeit: 4 ms\nDisplay-Oberfl\u00e4che: Matt\nBewertung der Bildschirmkr\u00fcmmung: 1500R\nUnterst\u00fctzte Grafik-Aufl\u00f6sungen: 1920 x 1080 HD 1080\nUnterst\u00fctzte Video-Modi: 1080p\nSeitenverh\u00e4ltnis: 16:9\nDynamisches Kontrastverh\u00e4ltnis Marketingbezeichnung: SmartContrast\nBildwinkel, horizontal: 178\u00b0\nBildwinkel, vertikal: 178\u00b0\nPixel Abstand: 0,272 x 0,272 mm\nPixeldichte: 93 ppi\nHorizontaler Scanbereich: 30 - 85 kHz\nVertikaler Scanbereich: 48 - 76 Hz\nSichtbare Gr\u00f6\u00dfe horizontal: 52,1 cm\nSichtbare Gr\u00f6\u00dfe vertikal: 29,3 cm\nDigital horizontale Frequenz: 30 - 85 kHz\nDigital vertikale Frequenz: 48 - 76 Hz\nBildschirmdiagonale cm: 59,9 cm\nTr\u00fcbungsrate: 25\nOberfl\u00e4chenh\u00e4rte: 3H\nRGB-Farbraum: sRGB\nFarbskala: 87\nsRGB Abdeckung klassisch: 100,78\nNTSC Abdeckung typisch: 83,87\nBildschirmkr\u00fcmmung: 150 cm\nKomponentenvideo-Synchronisation: Separate sync, Sync-on-green SOG\nUnterst\u00fctzt Windows-Betriebssysteme: Windows 10, Windows 7, Windows 8, Windows 8.1\nUnterst\u00fctzt Mac-Betriebssysteme: Mac OS X 10.0 Cheetah, Mac OS X 10.1 Puma, Mac OS X 10.10 Yosemite, Mac OS X 10.11 El Capitan, Mac OS X 10.12 Sierra, Mac OS X 10.13 High Sierra, Mac OS X 10.14 Mojave, Mac OS X 10.2 Jaguar, Mac OS X 10.3 Panther, Mac OS X 10.4 Tiger, Mac OS X 10.5 Leopard, Mac OS X 10.6 Snow Leopard, Mac OS X 10.7 Lion, Mac OS X 10.8 Mountain Lion, Mac OS X 10.9 Mavericks\nIntegrierte Kamera: Nein\nAnzahl der Lautsprecher: 2\nRMS-Leistung: 6 W\nMarktpositionierung: Haus\nProduktfarbe: Schwarz\nSchwermetallfrei: Hg Quecksilber, Pb Blei\nZertifizierung: CE Mark, CU-EAC, TUV-BAUART\nIntegrierter USB-Hub: Nein\nAnzahl VGA D-Sub Anschl\u00fcsse: 1\nDVI Anschluss: Nein\nAnzahl HDMI-Anschl\u00fcsse: 1\nKopfh\u00f6rerausg\u00e4nge: 1\nH\u00f6henverstellung: Nein\nPanel-Montage-Schnittstelle: 100 x 100 mm\nSlot-Typ Kabelsperre: Kensington\nNeigungswinkelbereich: -5 - 20\u00b0\nMen\u00fcsprachen: Vereinfachtes Chinesisch, Traditionelles Chinesisch, Tschechisch, Deutsch, Niederl\u00e4ndisch, Englisch, Spanisch, Finnisch, Franz\u00f6sisch, Griechisch, Ungarisch, Italienisch, Japanisch, Koreanisch, Polnisch, Portugiesisch, Russisch, Schwedisch, T\u00fcrkisch, Ukrainisch\nLED-Anzeigen: T\u00e4tigkeit, Stand-by\nEnergieeffizienzklasse SDR: E\nEnergieverbrauch SDR pro 1.000 Stunden: 22 kWh\nStromverbrauch Standardbetrieb: 27,9 W\nStromverbrauch Standby: 0,5 W\nStromverbrauch aus: 0,3 W\nAC Eingangsspannung: 100 - 240 V\nAC Eingangsfrequenz: 50 - 60 Hz\nNetzteiltyp: Extern\nEnergieeffizienzskala: A bis G\nBetriebstemperatur: 0 - 40 \u00b0C\nTemperaturbereich bei Lagerung: -20 - 60 \u00b0C\nRelative Luftfeuchtigkeit in Betrieb: 20 - 80\nH\u00f6he bei Betrieb: 0 - 3658 m\nH\u00f6he bei Lagerung: 0 - 12192 m\nMitgelieferte Kabel: HDMI, Audio 3,5 mm, AC\nGer\u00e4tebreite inkl. Fu\u00df: 536 mm\nGer\u00e4tetiefe inkl. Fu\u00df: 202 mm\nGer\u00e4teh\u00f6he inkl. Fu\u00df: 413 mm\nGewicht mit St\u00e4nder: 3,54 kg\nBreite ohne Standfu\u00df: 536 mm\nTiefe ohne Standfu\u00df: 66 mm\nH\u00f6he ohne Standfu\u00df: 322 mm\nGewicht ohne St\u00e4nder: 2,86 kg\nVerpackungsbreite: 595 mm\nVerpackungstiefe: 154 mm\nVerpackungsh\u00f6he: 475 mm\nPaketgewicht: 5,37 kg\nVerpackungsart: Box\nNachhaltigkeitszertifikate: RoHS\nEnth\u00e4lt nicht: Quecksilber, PVC/BFR\nWarentarifnummer HS: 85285210\nTV Tuner integriert: Nein\nAu\u00dfenverkleidungstyp: Texturiert\nRecycelbares Verpackungsmaterial: 100\nMittlere Betriebsdauer zwischen Ausf\u00e4llen MTBF: 50000 h\nBild-Verbesserung: SmartImage game\nBeh\u00f6rdliche Zulassung: CE Mark; CU-EAC; TUV-BAUART\nEnergieeffizienzklasse alt: F",
    "reference_file": "offer_reference_2114.json",
    "shop_name": "CSV-Direct.de"
}