{
    "html_file": "offer_2409_24.html",
    "name": "Philips V-line 273V7QDAB, 27\"",
    "offer_link": "https://restposten.bauguru.at/monitore/125746-monitor-philips-273v7qdab-00-27-fhd-ips-hdmi-8712581742980.html",
    "price": 157.3,
    "raw_specifications": {
        "Arbeitsbereich f\u00fcr Temperatur": "0\u00ba / 40\u00ba",
        "Art": "Full HD",
        "Aufl\u00f6sung": "Full HD",
        "Aufl\u00f6sung (px)": "1920 x 1080 px",
        "Bildschirm": "27\"",
        "Ca. Temperatur": "- 20\u00baC / 60\u00b0C",
        "Eingangsanschluss": "DVI",
        "Energieklassifizierung": "E",
        "Finish": "Mattierend",
        "Geschwindigkeit": "60 Hz",
        "Glanz": "250 ANSI",
        "Hinterleuchtet": "W-LED",
        "Installationsart": "Wandmontage",
        "Kontrastverh\u00e4ltnis": "1000:1",
        "Leistung": "4 W",
        "Montage": "VESA",
        "Neigungswinkel": "-5\u00ba / 20\u00ba",
        "Pixel-Dichte (dpi)": "82 dpi",
        "Pr\u00e4zision (relative Feuchte)": "20 % - 80 %",
        "Seitenverh\u00e4ltnis": "16:9",
        "Sound": "2 x 2 W",
        "Steckbares Produkt": "Ja",
        "Steckertyp": "EU-Stecker",
        "Umweltfreundliche Verpackung": "Zu 100 % wiederverwertbar",
        "Ungef\u00e4hres Gewicht": "4,2 Kg",
        "Unterst\u00fctzte Video-Formate": "1080p",
        "Verbindung": "DVI-D x 1",
        "Winkel": "178\u00ba"
    },
    "raw_specifications_text": "Aufl\u00f6sung: Full HD\nBildschirm: 27\"\nAufl\u00f6sung (px): 1920 x 1080 px\nSound: 2 x 2 W\nUngef\u00e4hres Gewicht: 4,2 Kg\nArt: Full HD\nSteckbares Produkt: Ja\nPixel-Dichte (dpi): 82 dpi\nSteckertyp: EU-Stecker\nSeitenverh\u00e4ltnis: 16:9\nEnergieklassifizierung: E\nKontrastverh\u00e4ltnis: 1000:1\nEingangsanschluss: DVI\nFinish: Mattierend\nVerbindung: DVI-D x 1\nGlanz: 250 ANSI\nLeistung: 4 W\nInstallationsart: Wandmontage\nUmweltfreundliche Verpackung: Zu 100 % wiederverwertbar\nWinkel: 178\u00ba\nPr\u00e4zision (relative Feuchte): 20 % - 80 %\nHinterleuchtet: W-LED\nNeigungswinkel: -5\u00ba / 20\u00ba\nCa. Temperatur: - 20\u00baC / 60\u00b0C\nMontage: VESA\nGeschwindigkeit: 60 Hz\nArbeitsbereich f\u00fcr Temperatur: 0\u00ba / 40\u00ba\nUnterst\u00fctzte Video-Formate: 1080p",
    "reference_file": "offer_reference_2409.json",
    "shop_name": "bauguru"
}