{
    "html_file": "offer_1615_2.html",
    "name": "NEC MultiSync EA242F-BK schwarz, 23.8\"",
    "offer_link": "https://direkt.jacob.de/produkte/nec-multisync-ea242f-60005032-artnr-6961451.html?utm_source=geizhals&utm_medium=cpc&utm_campaign=Preisvergleich&ref=103",
    "price": 362.22,
    "raw_specifications": {
        "Abmessungen (Breite x Tiefe x H\u00f6he)": "53.77 cm x 25 cm x 33.66 cm - mit Fu\u00df",
        "Abmessungen (Breite x Tiefe x H\u00f6he) - mit Fu\u00df": "53.77 cm x 25 cm x 33.66 cm",
        "Ausgangsleistung/Kanal": "1 Watt",
        "Besonderheiten": "Umgebungslichtsensor, Eco-Mode, Auto Brightness Control, 72 % NTSC-Farbskala, Dynamic Visual Mode, ControlSync, On-screen Digital Controls, OSD sperren, integrierte Kabelf\u00fchrung, Carbon Footprint Meter, Human Sensor, flimmerfreie Technologie, Non-Touch-Auto-Adjustment (NTAA), DICOM-Simulation, Low Blue Light-Technologie, 101.6% sRGB-Farbskala",
        "Bildschirmtyp": "IPS",
        "Diagonalabmessung": "60.47 cm (23.8\")",
        "Display-Typ": "LED-hintergrundbeleuchteter LCD-Monitor / TFT-Aktivmatrix",
        "ENERGY STAR zertifiziert": "Ja",
        "ENERGY STAR-Version": "8.0",
        "Eingangsanschl\u00fcsse": "HDMI, VGA, DisplayPort, USB-C",
        "Eingangsspannung": "Wechselstrom 120/230 V",
        "Einstellungen der Anzeigeposition": "H\u00f6he, Pivot (Rotation), Drehung, Neigung",
        "Energie Effizienzklasse": "Klasse D",
        "Enthaltene Kabel": "1 x ControlSync-Kabel  1 x DisplayPort-Kabel  1 x USB-Kabel  1 x USB-C Kabel",
        "Farbe": "Schwarz",
        "Farbunterst\u00fctzung": "16,7 Millionen Farben (6-Bit)",
        "Ger\u00e4tetyp": "LED-hintergrundbeleuchteter LCD-Monitor - 60.47 cm (23.8\")",
        "Gewicht": "7 kg",
        "Helligkeit": "250 cd/m\u00b2",
        "Hintergrundbeleuchtungs-Technologie": "WLED",
        "Horizontale Bildwiederholrate": "31.5 - 83 kHz",
        "Horizontaler Betrachtungswinkel": "178",
        "H\u00f6heneinstellung": "150 mm",
        "Integrierte Peripherieger\u00e4te": "USB 3.1 Hub",
        "Kennzeichnung": "Plug and Play, CSA, UL, TUV GS, cUL, DDC-2Bi, TUV Ergo, PSB, DDC/CI, RoHS, WEEE, ERP, EAC, DisplayPort 1.2, ISO 9241-307 Class 1, HDCP 1.4, VESA DDC 2 B",
        "Kontrast": "1000:1 / 5000:1 (dynamisch)",
        "Leistungsaufnahme im Ein-Zustand": "13.2 W",
        "Leistungsmerkmale": "Slot f\u00fcr Sicherheitsschloss (Kabelschloss getrennt erh\u00e4ltlich), integrierte Kabelf\u00fchrung",
        "Max. Betriebstemperatur": "35 \u00b0C",
        "Min Betriebstemperatur": "5 \u00b0C",
        "Native Aufl\u00f6sung": "Full HD (1080p) 1920 x 1080 bei 60 Hz",
        "Neigungswinkel": "-5/+35",
        "Pixelpitch": "0.275 mm",
        "Produktbeschreibung": "NEC MultiSync EA242F - LED-Monitor - Full HD (1080p) - 60.47 cm (23.8\")",
        "Reaktionszeit": "5 ms (Gray-to-Gray)",
        "Rotationswinkel": "90",
        "Schlosstyp zur Diebstahlsicherung": "Kensington Slot",
        "Schnittstellen": "DisplayPort  DisplayPort-Ausgang  HDMI  USB-C  3 x USB 3.1 Downstream (Typ A)  USB 3.1 Upstream (Typ B)  VGA",
        "Schwenkwinkel": "340",
        "Seitenverh\u00e4ltnis": "16:9",
        "Spannung": "Wechselstrom 120/230 V",
        "Stromverbrauch (typisch)": "21 Watt",
        "Stromverbrauch SDR (eingeschaltet)": "13.2 kWh/1.000 h",
        "Stromverbrauch im Standby-Modus": "0.3 Watt",
        "TCO-zertifiziert": "TCO Certified Displays 8, TCO Certified Edge Displays",
        "Typ": "Lautsprecher - Stereo",
        "Umweltschutzstandards": "TCO Certified Displays 8, TCO Certified Edge Displays, ENERGY STAR-qualifiziert",
        "VESA-Halterung": "100 x 100 mm",
        "Vertikale Bildwiederholrate": "50 - 75 Hz",
        "Vertikaler Betrachtungswinkel": "178",
        "Zul\u00e4ssige Luftfeuchtigkeit im Betrieb": "20 - 80%"
    },
    "raw_specifications_text": "Produktbeschreibung: NEC MultiSync EA242F - LED-Monitor - Full HD (1080p) - 60.47 cm (23.8\")\nGer\u00e4tetyp: LED-hintergrundbeleuchteter LCD-Monitor - 60.47 cm (23.8\")\nEnergie Effizienzklasse: Klasse D\nLeistungsaufnahme im Ein-Zustand: 13.2 W\nLeistungsmerkmale: Slot f\u00fcr Sicherheitsschloss (Kabelschloss getrennt erh\u00e4ltlich), integrierte Kabelf\u00fchrung\nBildschirmtyp: IPS\nSeitenverh\u00e4ltnis: 16:9\nNative Aufl\u00f6sung: Full HD (1080p) 1920 x 1080 bei 60 Hz\nPixelpitch: 0.275 mm\nHelligkeit: 250 cd/m\u00b2\nKontrast: 1000:1 / 5000:1 (dynamisch)\nReaktionszeit: 5 ms (Gray-to-Gray)\nFarbunterst\u00fctzung: 16,7 Millionen Farben (6-Bit)\nEingangsanschl\u00fcsse: HDMI, VGA, DisplayPort, USB-C\nEinstellungen der Anzeigeposition: H\u00f6he, Pivot (Rotation), Drehung, Neigung\nSpannung: Wechselstrom 120/230 V\nFarbe: Schwarz\nAbmessungen (Breite x Tiefe x H\u00f6he) - mit Fu\u00df: 53.77 cm x 25 cm x 33.66 cm\nGewicht: 7 kg\nUmweltschutzstandards: TCO Certified Displays 8, TCO Certified Edge Displays, ENERGY STAR-qualifiziert\nKennzeichnung: Plug and Play, CSA, UL, TUV GS, cUL, DDC-2Bi, TUV Ergo, PSB, DDC/CI, RoHS, WEEE, ERP, EAC, DisplayPort 1.2, ISO 9241-307 Class 1, HDCP 1.4, VESA DDC 2 B\nDisplay-Typ: LED-hintergrundbeleuchteter LCD-Monitor / TFT-Aktivmatrix\nDiagonalabmessung: 60.47 cm (23.8\")\nIntegrierte Peripherieger\u00e4te: USB 3.1 Hub\nVertikale Bildwiederholrate: 50 - 75 Hz\nHorizontale Bildwiederholrate: 31.5 - 83 kHz\nHorizontaler Betrachtungswinkel: 178\nVertikaler Betrachtungswinkel: 178\nHintergrundbeleuchtungs-Technologie: WLED\nBesonderheiten: Umgebungslichtsensor, Eco-Mode, Auto Brightness Control, 72 % NTSC-Farbskala, Dynamic Visual Mode, ControlSync, On-screen Digital Controls, OSD sperren, integrierte Kabelf\u00fchrung, Carbon Footprint Meter, Human Sensor, flimmerfreie Technologie, Non-Touch-Auto-Adjustment (NTAA), DICOM-Simulation, Low Blue Light-Technologie, 101.6% sRGB-Farbskala\nAbmessungen (Breite x Tiefe x H\u00f6he): 53.77 cm x 25 cm x 33.66 cm - mit Fu\u00df\nTyp: Lautsprecher - Stereo\nAusgangsleistung/Kanal: 1 Watt\nSchnittstellen: DisplayPort  DisplayPort-Ausgang  HDMI  USB-C  3 x USB 3.1 Downstream (Typ A)  USB 3.1 Upstream (Typ B)  VGA\nNeigungswinkel: -5/+35\nSchwenkwinkel: 340\nRotationswinkel: 90\nH\u00f6heneinstellung: 150 mm\nVESA-Halterung: 100 x 100 mm\nEnthaltene Kabel: 1 x ControlSync-Kabel  1 x DisplayPort-Kabel  1 x USB-Kabel  1 x USB-C Kabel\nSchlosstyp zur Diebstahlsicherung: Kensington Slot\nEingangsspannung: Wechselstrom 120/230 V\nStromverbrauch SDR (eingeschaltet): 13.2 kWh/1.000 h\nStromverbrauch (typisch): 21 Watt\nStromverbrauch im Standby-Modus: 0.3 Watt\nTCO-zertifiziert: TCO Certified Displays 8, TCO Certified Edge Displays\nENERGY STAR zertifiziert: Ja\nENERGY STAR-Version: 8.0\nMin Betriebstemperatur: 5 \u00b0C\nMax. Betriebstemperatur: 35 \u00b0C\nZul\u00e4ssige Luftfeuchtigkeit im Betrieb: 20 - 80%",
    "reference_file": "offer_reference_1615.json",
    "shop_name": "Jacob Elektronik direkt (AT)"
}