{
    "html_file": "offer_241_0.html",
    "name": "Samsung Odyssey G5 G55T (2023), 34\"",
    "offer_link": "https://www.amazon.de/dp/B0BRL8B5L5?linkCode=xm2&camp=2025&creative=165953&smid=A3JWKAKR8XB7XF&creativeASIN=B0BRL8B5L5&tag=geizhals1-21",
    "price": 341.85,
    "raw_specifications": {
        "ASIN": "B0BRL8B5L5",
        "Amazon Bestseller-Rang": "Nr. 2,121 in Computer & Zubeh\u00f6r (Siehe Top 100 in Computer & Zubeh\u00f6r)  Nr. 42 in Monitore",
        "Anzahl HDMI Schnittstellen": "\u200e1",
        "Artikelgewicht": "\u200e5,6 Kilograms",
        "Batterien enthalten": "\u200eNein",
        "Display-Gr\u00f6\u00dfe": "\u200e34 Zoll",
        "Durchschnittliche Kundenbewertung": "4,0  4,0 von 5 Sternen    \n    183 Sternebewertungen   \n\n\n 4,0 von 5 Sternen",
        "Farbe": "\u200eSchwarz",
        "Garantierte Software-Updates bis": "\u200eunbekannt",
        "Hersteller": "\u200eSamsung",
        "Im Angebot von Amazon.de seit": "4. Januar 2023",
        "L\u00f6sung": "\u200e3440 x 1440 Pixels",
        "Marke": "\u200eSamsung",
        "Modellnummer": "\u200eLC34G55TWWPXEN",
        "Produktabmessungen": "\u200e50 x 50 x 28 cm; 5,6 Kilogramm",
        "Volt": "\u200e240 Volt (Wechselstrom)"
    },
    "raw_specifications_text": "Marke: \u200eSamsung\nHersteller: \u200eSamsung\nProduktabmessungen: \u200e50 x 50 x 28 cm; 5,6 Kilogramm\nModellnummer: \u200eLC34G55TWWPXEN\nFarbe: \u200eSchwarz\nDisplay-Gr\u00f6\u00dfe: \u200e34 Zoll\nL\u00f6sung: \u200e3440 x 1440 Pixels\nAnzahl HDMI Schnittstellen: \u200e1\nVolt: \u200e240 Volt (Wechselstrom)\nBatterien enthalten: \u200eNein\nArtikelgewicht: \u200e5,6 Kilograms\nGarantierte Software-Updates bis: \u200eunbekannt\nASIN: B0BRL8B5L5\nDurchschnittliche Kundenbewertung: 4,0  4,0 von 5 Sternen    \n    183 Sternebewertungen   \n\n\n 4,0 von 5 Sternen\nAmazon Bestseller-Rang: Nr. 2,121 in Computer & Zubeh\u00f6r (Siehe Top 100 in Computer & Zubeh\u00f6r)  Nr. 42 in Monitore\nIm Angebot von Amazon.de seit: 4. Januar 2023",
    "reference_file": "offer_reference_241.json",
    "shop_name": "Amazon.at"
}