{
    "html_file": "offer_2510_11.html",
    "name": "HANNspree HP247HJB, 23.6\"",
    "offer_link": "https://www.taufnaus.de/product/10619989",
    "price": 193.37,
    "raw_specifications": {
        "Abmessungen (Breite x Tiefe x H\u00f6he)": "56.1 cm x 21.6 cm x 56 cm",
        "Ausgangsleistung/Kanal": "1.5 Watt",
        "Besonderheiten": "HDCP",
        "Bildschirmbeschichtung": "Blendfrei",
        "Diagonalabmessung": "59.9 cm (23.6\")",
        "Display-Typ": "LED-hintergrundbeleuchteter LCD-Monitor",
        "ENERGY STAR zertifiziert": "Ja",
        "Ein-/Aus-Schalter": "Ja",
        "Eingangsspannung": "Wechselstrom 120/230 V (50/60 Hz)",
        "Einstellungen der Anzeigeposition": "H\u00f6he, Pivot (Rotation), Drehung, Neigung",
        "Energie Effizienzklasse": "Klasse D",
        "Energierverbrauch Sleep": "0.5 Watt",
        "Energieverbrauch pro Jahr": "30.6 kWh",
        "Enthaltene Kabel": "1 x VGA-Kabel - 1.5 m \u00a6 1 x Audiokabel - 1.5 m \u00a6 1 x Stromkabel - 1.5 m",
        "Farbe": "Schwarz",
        "Farbunterst\u00fctzung": "16,7 Millionen Farben",
        "Gewicht": "7.09 kg",
        "Helligkeit": "250 cd/m\u00b2",
        "Hintergrundbeleuchtungs-Technologie": "WLED",
        "Horizontale Bildwiederholrate": "24 - 83 kHz",
        "Horizontaler Betrachtungswinkel": "178",
        "H\u00f6heneinstellung": "120 mm",
        "Kennzeichnung": "PC 99, GS, CB",
        "Kontrast": "1000:1 / 80000000:1 (dynamisch)",
        "Leistungsaufnahme im Ein-Zustand": "14.4 W",
        "Leistungsmerkmale": "Slot f\u00fcr Sicherheitsschloss (Kabelschloss getrennt erh\u00e4ltlich)",
        "Max. Betriebstemperatur": "35 \u00b0C",
        "Min Betriebstemperatur": "5 \u00b0C",
        "Native Aufl\u00f6sung": "Full HD (1080p) 1920 x 1080 bei 60 Hz",
        "Neigungswinkel": "-5/+20",
        "OSD-Sprachen": "Englisch, Deutsch, Franz\u00f6sisch, Italienisch, Portugiesisch, Russisch, Spanisch, Holl\u00e4ndisch, T\u00fcrkisch, Koreanisch",
        "Pixelpitch": "0.2715 mm",
        "Reaktionszeit": "5 ms",
        "Rotationswinkel": "90",
        "Schlosstyp zur Diebstahlsicherung": "Kensington Slot",
        "Schnittstellen": "VGA \u00a6 HDMI \u00a6 Audio Line-In",
        "Schwenkwinkel": "60",
        "Seitenverh\u00e4ltnis": "16:9",
        "Spannungsversorgung": "Intern",
        "Steuerelemente und Einstellungen": "Volumen, Helligkeit, Eingang w\u00e4hlen, Farbtemperatur",
        "Stromverbrauch (typisch)": "28 Watt",
        "Stromverbrauch SDR (eingeschaltet)": "14.4 kWh/1.000 h",
        "Stromverbrauch im Standby-Modus": "0.5 Watt",
        "Typ": "Lautsprecher - Stereo - integriert",
        "VESA-Halterung": "100 x 100 mm",
        "Vertikale Bildwiederholrate": "55 - 75 Hz",
        "Vertikaler Betrachtungswinkel": "178",
        "Zul\u00e4ssige Luftfeuchtigkeit im Betrieb": "20 - 85% (nicht kondensierend)"
    },
    "raw_specifications_text": "Display-Typ: LED-hintergrundbeleuchteter LCD-Monitor\nEnergie Effizienzklasse: Klasse D\nEnergieverbrauch pro Jahr: 30.6 kWh\nDiagonalabmessung: 59.9 cm (23.6\")\nSeitenverh\u00e4ltnis: 16:9\nNative Aufl\u00f6sung: Full HD (1080p) 1920 x 1080 bei 60 Hz\nPixelpitch: 0.2715 mm\nHelligkeit: 250 cd/m\u00b2\nKontrast: 1000:1 / 80000000:1 (dynamisch)\nFarbunterst\u00fctzung: 16,7 Millionen Farben\nReaktionszeit: 5 ms\nVertikale Bildwiederholrate: 55 - 75 Hz\nHorizontale Bildwiederholrate: 24 - 83 kHz\nHorizontaler Betrachtungswinkel: 178\nVertikaler Betrachtungswinkel: 178\nBildschirmbeschichtung: Blendfrei\nHintergrundbeleuchtungs-Technologie: WLED\nSteuerelemente und Einstellungen: Volumen, Helligkeit, Eingang w\u00e4hlen, Farbtemperatur\nOSD-Sprachen: Englisch, Deutsch, Franz\u00f6sisch, Italienisch, Portugiesisch, Russisch, Spanisch, Holl\u00e4ndisch, T\u00fcrkisch, Koreanisch\nBesonderheiten: HDCP\nFarbe: Schwarz\nAbmessungen (Breite x Tiefe x H\u00f6he): 56.1 cm x 21.6 cm x 56 cm\nGewicht: 7.09 kg\nTyp: Lautsprecher - Stereo - integriert\nAusgangsleistung/Kanal: 1.5 Watt\nSchnittstellen: VGA \u00a6 HDMI \u00a6 Audio Line-In\nEinstellungen der Anzeigeposition: H\u00f6he, Pivot (Rotation), Drehung, Neigung\nNeigungswinkel: -5/+20\nSchwenkwinkel: 60\nRotationswinkel: 90\nH\u00f6heneinstellung: 120 mm\nVESA-Halterung: 100 x 100 mm\nLeistungsmerkmale: Slot f\u00fcr Sicherheitsschloss (Kabelschloss getrennt erh\u00e4ltlich)\nEnthaltene Kabel: 1 x VGA-Kabel - 1.5 m \u00a6 1 x Audiokabel - 1.5 m \u00a6 1 x Stromkabel - 1.5 m\nKennzeichnung: PC 99, GS, CB\nSchlosstyp zur Diebstahlsicherung: Kensington Slot\nSpannungsversorgung: Intern\nEingangsspannung: Wechselstrom 120/230 V (50/60 Hz)\nLeistungsaufnahme im Ein-Zustand: 14.4 W\nStromverbrauch SDR (eingeschaltet): 14.4 kWh/1.000 h\nStromverbrauch (typisch): 28 Watt\nStromverbrauch im Standby-Modus: 0.5 Watt\nEnergierverbrauch Sleep: 0.5 Watt\nEin-/Aus-Schalter: Ja\nENERGY STAR zertifiziert: Ja\nMin Betriebstemperatur: 5 \u00b0C\nMax. Betriebstemperatur: 35 \u00b0C\nZul\u00e4ssige Luftfeuchtigkeit im Betrieb: 20 - 85% (nicht kondensierend)",
    "reference_file": "offer_reference_2510.json",
    "shop_name": "TaufNaus"
}