{
    "html_file": "offer_1672_3.html",
    "name": "ASUS TUF Gaming VG24VQE, 23.6\"",
    "offer_link": "https://direkt.jacob.de/produkte/asus-tuf-gaming-90lm0575-b01170-artnr-6942557.html?utm_source=geizhals&utm_medium=cpc&utm_campaign=Preisvergleich&ref=103",
    "price": 173.28,
    "raw_specifications": {
        "Abmessungen (Breite x Tiefe x H\u00f6he)": "53.76 cm x 20.59 cm x 40.4 cm - mit Fu\u00df",
        "Abmessungen (Breite x Tiefe x H\u00f6he) - mit Fu\u00df": "53.76 cm x 20.59 cm x 40.4 cm",
        "Adaptive-Sync Technologie": "AMD FreeSync Premium",
        "Ausgangsleistung/Kanal": "2 Watt",
        "Besonderheiten": "HDCP, Trace Free Technology, ASUS Smart Contrast Ratio (ASCR), 72 % NTSC-Farbskala, ASUS GamePlus, flimmerfreie Technologie, ASUS GameVisual Technology, Farbtemperatur Auswahl, GameFast Input Technology, ASUS Extreme Low Motion Blur technology, Low Blue Light-Technologie, an 3 Seiten ohne Blende, Shadow Boost-Technologie",
        "Bildschirmbeschichtung": "Blendfrei",
        "Bildschirmtyp": "VA",
        "Blendentyp": "Flache Front",
        "Details zu Abmessungen & Gewicht": "Mit Fu\u00df - Breite: 53.76 cm - Tiefe: 20.59 cm - H\u00f6he: 40.4 cm - Gewicht: 4.8 kg  Ohne Fu\u00df - Breite: 53.76 cm - Tiefe: 6.99 cm - H\u00f6he: 32 cm - Gewicht: 3.37 kg",
        "Diagonalabmessung": "59.9 cm (23.6\")",
        "Display-Typ": "LED-hintergrundbeleuchteter LCD-Monitor / TFT-Aktivmatrix",
        "Eingangsanschl\u00fcsse": "2xHDMI, DisplayPort",
        "Einstellungen der Anzeigeposition": "Neigung",
        "Erforderliche Netzspannung": "Wechselstrom 120/230 V (50/60 Hz)",
        "Farbe": "Schwarz",
        "Farbunterst\u00fctzung": "16,7 Millionen Farben (8-Bit)",
        "Ger\u00e4tetyp": "LED-hintergrundbeleuchteter LCD-Monitor - 59.9 cm (23.6\")",
        "Geschwungener Bildschirm": "Ja (1500R)",
        "Gewicht": "4.8 kg",
        "Helligkeit": "250 cd/m\u00b2",
        "Hintergrundbeleuchtungs-Technologie": "LED-Hintergrundbeleuchtung",
        "Horizontale Bildwiederholrate": "30 - 200 kHz",
        "Horizontaler Betrachtungswinkel": "178",
        "Kennzeichnung": "TUV Rheinland Low Blue Light Certification, TUV Rheinland Flicker Free Certification, DisplayPort 1.2",
        "Kontrast": "3000:1 / 100000000:1 (dynamisch)",
        "Leistungsaufnahme im Betrieb": "23.34 Watt",
        "Leistungsmerkmale": "Slot f\u00fcr Sicherheitsschloss (Kabelschloss getrennt erh\u00e4ltlich)",
        "Native Aufl\u00f6sung": "Full HD (1080p) 1920 x 1080 (DisplayPort: 165 Hz, HDMI: 144 Hz)",
        "Neigungswinkel": "-5/+23",
        "OSD-Sprachen": "Ungarisch, Kroatisch, Indonesisch, Thail\u00e4ndisch, Chinesisch (tradionell), Chinesisch (vereinfacht), Englisch, Deutsch, Franz\u00f6sisch, Italienisch, Portugiesisch, Polnisch, Russisch, Spanisch, Holl\u00e4ndisch, T\u00fcrkisch, Rum\u00e4nisch, Japanisch, Koreanisch, Persisch",
        "Pixelpitch": "0.272 mm",
        "Produktbeschreibung": "ASUS TUF Gaming VG24VQE - LED-Monitor - gebogen - Full HD (1080p) - 59.9 cm (23.6\")",
        "Reaktionszeit": "4 ms (Grau-zu-Grau); 1 ms (MPRT)",
        "Schlosstyp zur Diebstahlsicherung": "Kensington Slot",
        "Schnittstellen": "2 x HDMI  DisplayPort  Kopfh\u00f6rer",
        "Seitenverh\u00e4ltnis": "16:9",
        "Stromverbrauch (Aus-Modus)": "0.5 Watt",
        "Transportbreite": "62 cm",
        "Transporth\u00f6he": "19 cm",
        "Transporttiefe": "40.3 cm",
        "Typ": "Lautsprecher - Stereo",
        "VESA-Halterung": "100 x 100 mm",
        "Vertikale Bildwiederholrate": "48 - 165 Hz",
        "Vertikaler Betrachtungswinkel": "178"
    },
    "raw_specifications_text": "Produktbeschreibung: ASUS TUF Gaming VG24VQE - LED-Monitor - gebogen - Full HD (1080p) - 59.9 cm (23.6\")\nGer\u00e4tetyp: LED-hintergrundbeleuchteter LCD-Monitor - 59.9 cm (23.6\")\nGeschwungener Bildschirm: Ja (1500R)\nAdaptive-Sync Technologie: AMD FreeSync Premium\nBildschirmtyp: VA\nSeitenverh\u00e4ltnis: 16:9\nNative Aufl\u00f6sung: Full HD (1080p) 1920 x 1080 (DisplayPort: 165 Hz, HDMI: 144 Hz)\nPixelpitch: 0.272 mm\nHelligkeit: 250 cd/m\u00b2\nKontrast: 3000:1 / 100000000:1 (dynamisch)\nReaktionszeit: 4 ms (Grau-zu-Grau); 1 ms (MPRT)\nFarbunterst\u00fctzung: 16,7 Millionen Farben (8-Bit)\nEingangsanschl\u00fcsse: 2xHDMI, DisplayPort\nEinstellungen der Anzeigeposition: Neigung\nBildschirmbeschichtung: Blendfrei\nFarbe: Schwarz\nAbmessungen (Breite x Tiefe x H\u00f6he) - mit Fu\u00df: 53.76 cm x 20.59 cm x 40.4 cm\nGewicht: 4.8 kg\nKennzeichnung: TUV Rheinland Low Blue Light Certification, TUV Rheinland Flicker Free Certification, DisplayPort 1.2\nDisplay-Typ: LED-hintergrundbeleuchteter LCD-Monitor / TFT-Aktivmatrix\nDiagonalabmessung: 59.9 cm (23.6\")\nVertikale Bildwiederholrate: 48 - 165 Hz\nHorizontale Bildwiederholrate: 30 - 200 kHz\nHorizontaler Betrachtungswinkel: 178\nVertikaler Betrachtungswinkel: 178\nHintergrundbeleuchtungs-Technologie: LED-Hintergrundbeleuchtung\nOSD-Sprachen: Ungarisch, Kroatisch, Indonesisch, Thail\u00e4ndisch, Chinesisch (tradionell), Chinesisch (vereinfacht), Englisch, Deutsch, Franz\u00f6sisch, Italienisch, Portugiesisch, Polnisch, Russisch, Spanisch, Holl\u00e4ndisch, T\u00fcrkisch, Rum\u00e4nisch, Japanisch, Koreanisch, Persisch\nBlendentyp: Flache Front\nBesonderheiten: HDCP, Trace Free Technology, ASUS Smart Contrast Ratio (ASCR), 72 % NTSC-Farbskala, ASUS GamePlus, flimmerfreie Technologie, ASUS GameVisual Technology, Farbtemperatur Auswahl, GameFast Input Technology, ASUS Extreme Low Motion Blur technology, Low Blue Light-Technologie, an 3 Seiten ohne Blende, Shadow Boost-Technologie\nAbmessungen (Breite x Tiefe x H\u00f6he): 53.76 cm x 20.59 cm x 40.4 cm - mit Fu\u00df\nTyp: Lautsprecher - Stereo\nAusgangsleistung/Kanal: 2 Watt\nSchnittstellen: 2 x HDMI  DisplayPort  Kopfh\u00f6rer\nNeigungswinkel: -5/+23\nVESA-Halterung: 100 x 100 mm\nLeistungsmerkmale: Slot f\u00fcr Sicherheitsschloss (Kabelschloss getrennt erh\u00e4ltlich)\nSchlosstyp zur Diebstahlsicherung: Kensington Slot\nErforderliche Netzspannung: Wechselstrom 120/230 V (50/60 Hz)\nLeistungsaufnahme im Betrieb: 23.34 Watt\nStromverbrauch (Aus-Modus): 0.5 Watt\nDetails zu Abmessungen & Gewicht: Mit Fu\u00df - Breite: 53.76 cm - Tiefe: 20.59 cm - H\u00f6he: 40.4 cm - Gewicht: 4.8 kg  Ohne Fu\u00df - Breite: 53.76 cm - Tiefe: 6.99 cm - H\u00f6he: 32 cm - Gewicht: 3.37 kg\nTransportbreite: 62 cm\nTransporttiefe: 40.3 cm\nTransporth\u00f6he: 19 cm",
    "reference_file": "offer_reference_1672.json",
    "shop_name": "Jacob Elektronik direkt (AT)"
}