{
    "html_file": "offer_664_27.html",
    "name": "LG UltraGear 27GQ50F-B, 27\"",
    "offer_link": "https://www.future-x.at/lg-ultragear-led-monitor-gaming-68-47-cm-27-1920-x-1080-full-hd-1080p-%40-165-hz-va-250-cd-m%B2-3000%3A1-1-ms-2xhdmi-displayport-mattschwarz-p-9125779/?pv=2",
    "price": 179.2,
    "raw_specifications": {
        "Abmessungen (Breite x Tiefe x H\u00f6he)": "61,37 cm x 20,16 cm x 45,61 cm - mit Fu\u00df",
        "Adaptive-Sync Technologie": "AMD FreeSync Premium Pro",
        "Besonderheiten": "FPS Mode, Crosshair Display, Flicker Safe, Reader Mode, RTS Mode, Motion Blur Reduction, Intelligente Energiespartechnologie, Black Stabilizer, DAS Mode (Dynamic Action Sync), Sphere Lighting, nahezu rahmenloses Display an 3 Seiten, FPS-Counter, Auto Input Switch, Player Mode, local dimming backlight technology, benutzerdefinierter Schl\u00fcssel, H1B Backlight Array",
        "Bildschirmbeschichtung": "Blendfrei",
        "Bildschirmtyp": "VA",
        "Details zu Abmessungen & Gewicht": "Mit Fu\u00df - Breite: 61,37 cm - Tiefe: 20,16 cm - H\u00f6he: 45,61 cm - Gewicht: 3,87 kg \u00a6 Ohne Fu\u00df - Breite: 61,37 cm - Tiefe: 3,93 cm - H\u00f6he: 36,41 cm - Gewicht: 3,25 kg",
        "Diagonalabmessung": "68,47 cm (27\")",
        "Display-Typ": "LED-hintergrundbeleuchteter LCD-Monitor / TFT-Aktivmatrix",
        "Einstellungen der Anzeigeposition": "Neigung",
        "Energie Effizienzklasse": "Klasse E",
        "Enthaltene Kabel": "1 x DisplayPort-Kabel",
        "Farbe": "Mattschwarz",
        "Farbraum": "72% NTSC (CIE 1931)",
        "Farbunterst\u00fctzung": "16,7 Millionen Farben (8-Bit)",
        "Gaming": "Ja",
        "Gewicht": "3,87 kg",
        "Helligkeit": "250 cd/m\u00b2",
        "Hintergrundbeleuchtungs-Technologie": "Edge LED",
        "Horizontaler Betrachtungswinkel": "178",
        "Kennzeichnung": "FCC Klasse B bescheinigt, VCCI, CB, RoHS, REACH, KC, ERP, BIS, UL/cUL, TUV-TYPE",
        "Kontrast": "3000:1",
        "Mitgelieferte Software": "LG On-Screen Control",
        "Native Aufl\u00f6sung": "Full HD (1080p) 1920 x 1080 (DisplayPort: 165 Hz, HDMI: 144 Hz)",
        "Neigungswinkel": "-5/+15",
        "Pixelpitch": "0.3108 mm",
        "Reaktionszeit": "5 ms (Gray-to-Gray), 1 ms (MBR)",
        "Schnittstellen": "2 x HDMI 1.4 \u00a6 DisplayPort 1.2 \u00a6 Kopfh\u00f6rer (Mini-Klinkenstecker)",
        "Seitenverh\u00e4ltnis": "16:9",
        "Service und Support": "Begrenzte Garantie - 3 Jahre",
        "Stromverbrauch (Aus-Modus)": "0.3 Watt",
        "Stromverbrauch (max.)": "35 Watt",
        "Stromverbrauch (typisch)": "32 Watt",
        "Stromverbrauch SDR (eingeschaltet)": "21 kWh/1.000 h",
        "Stromverbrauch im Standby-Modus": "0.5 Watt",
        "Transportbreite": "77,6 cm",
        "Transportgewicht": "5,8 kg",
        "Transporth\u00f6he": "43,5 cm",
        "Transporttiefe": "15,6 cm",
        "VESA-Halterung": "100 x 100 mm",
        "Vertikale Bildwiederholrate": "48 - 165 Hz",
        "Vertikaler Betrachtungswinkel": "178"
    },
    "raw_specifications_text": "Display-Typ: LED-hintergrundbeleuchteter LCD-Monitor / TFT-Aktivmatrix\nEnergie Effizienzklasse: Klasse E\nDiagonalabmessung: 68,47 cm (27\")\nAdaptive-Sync Technologie: AMD FreeSync Premium Pro\nBildschirmtyp: VA\nSeitenverh\u00e4ltnis: 16:9\nNative Aufl\u00f6sung: Full HD (1080p) 1920 x 1080 (DisplayPort: 165 Hz, HDMI: 144 Hz)\nPixelpitch: 0.3108 mm\nHelligkeit: 250 cd/m\u00b2\nKontrast: 3000:1\nFarbunterst\u00fctzung: 16,7 Millionen Farben (8-Bit)\nFarbraum: 72% NTSC (CIE 1931)\nReaktionszeit: 5 ms (Gray-to-Gray), 1 ms (MBR)\nVertikale Bildwiederholrate: 48 - 165 Hz\nGaming: Ja\nHorizontaler Betrachtungswinkel: 178\nVertikaler Betrachtungswinkel: 178\nBildschirmbeschichtung: Blendfrei\nHintergrundbeleuchtungs-Technologie: Edge LED\nBesonderheiten: FPS Mode, Crosshair Display, Flicker Safe, Reader Mode, RTS Mode, Motion Blur Reduction, Intelligente Energiespartechnologie, Black Stabilizer, DAS Mode (Dynamic Action Sync), Sphere Lighting, nahezu rahmenloses Display an 3 Seiten, FPS-Counter, Auto Input Switch, Player Mode, local dimming backlight technology, benutzerdefinierter Schl\u00fcssel, H1B Backlight Array\nFarbe: Mattschwarz\nAbmessungen (Breite x Tiefe x H\u00f6he): 61,37 cm x 20,16 cm x 45,61 cm - mit Fu\u00df\nGewicht: 3,87 kg\nSchnittstellen: 2 x HDMI 1.4 \u00a6 DisplayPort 1.2 \u00a6 Kopfh\u00f6rer (Mini-Klinkenstecker)\nEinstellungen der Anzeigeposition: Neigung\nNeigungswinkel: -5/+15\nVESA-Halterung: 100 x 100 mm\nEnthaltene Kabel: 1 x DisplayPort-Kabel\nKennzeichnung: FCC Klasse B bescheinigt, VCCI, CB, RoHS, REACH, KC, ERP, BIS, UL/cUL, TUV-TYPE\nStromverbrauch SDR (eingeschaltet): 21 kWh/1.000 h\nStromverbrauch (typisch): 32 Watt\nStromverbrauch (max.): 35 Watt\nStromverbrauch im Standby-Modus: 0.5 Watt\nStromverbrauch (Aus-Modus): 0.3 Watt\nMitgelieferte Software: LG On-Screen Control\nDetails zu Abmessungen & Gewicht: Mit Fu\u00df - Breite: 61,37 cm - Tiefe: 20,16 cm - H\u00f6he: 45,61 cm - Gewicht: 3,87 kg \u00a6 Ohne Fu\u00df - Breite: 61,37 cm - Tiefe: 3,93 cm - H\u00f6he: 36,41 cm - Gewicht: 3,25 kg\nTransportbreite: 77,6 cm\nTransporttiefe: 15,6 cm\nTransporth\u00f6he: 43,5 cm\nTransportgewicht: 5,8 kg\nService und Support: Begrenzte Garantie - 3 Jahre",
    "reference_file": "offer_reference_664.json",
    "shop_name": "Future-X.at"
}