{
    "html_file": "offer_683_10.html",
    "name": "AOC U34G3XM/EU, 34\"",
    "offer_link": "https://www.proshop.at/Bildschirm/AOC-34-Bildschirm-Gaming-U34G3XM-UWQHD-144Hz-Red-1-ms-AMD-FreeSync-Premium/3115198?utm_source=geizhals&utm_medium=cpc&utm_campaign=pricesite",
    "price": 310.92,
    "raw_specifications": {
        "Abmessungen (Breite x Tiefe x H\u00f6he)": "81.74 cm x 33.96 cm x 39.94 cm - mit Fu\u00df",
        "Abmessungen (Breite x Tiefe x H\u00f6he) - mit Fu\u00df": "81.74 cm x 33.96 cm x 39.94 cm",
        "Adaptive-Sync Technologie": "AMD FreeSync Premium",
        "Besonderheiten": "Bild f\u00fcr Bild, MultiView, Spielmodus, FPS Mode, Low Blue Light Mode, flimmerfreie Technologie, RTS Mode, Motion Blur Reduction, Adaptive-Sync-Technologie, AOC schwache Eingangsleistung Verz\u00f6gerungsmodus, AOC Shadow Control, Game Color Mode, Rennmodus, Picture-in-Picture, Dial Point, an 3 Seiten rahmenlos, Bildz\u00e4hler",
        "Bildschirmbeschichtung": "Blendfrei",
        "Bildschirmtyp": "VA",
        "Details zu Abmessungen & Gewicht": "Mit Standfu\u00df (niedrigste Position) - Breite: 81.74 cm - Tiefe: 33.96 cm - H\u00f6he: 39.94 cm - Gewicht: 7.78 kg  Mit Standfu\u00df (h\u00f6chste Position) - Breite: 81.74 cm - Tiefe: 33.96 cm - H\u00f6he: 52.94 cm - Gewicht: 7.78 kg  Ohne Fu\u00df - Breite: 81.74 cm - Tiefe: 5.57 cm - H\u00f6he: 37.07 cm",
        "Diagonalabmessung": "86.4 cm (34\")",
        "Display-Typ": "LED-hintergrundbeleuchteter LCD-Monitor / TFT-Aktivmatrix",
        "EAN": "4038986110624",
        "Eingangsanschl\u00fcsse": "2xHDMI, DisplayPort",
        "Eingangsspannung": "Wechselstrom 100-240 V (50/60 Hz)",
        "Einstellungen der Anzeigeposition": "H\u00f6he, Drehung, Neigung",
        "Energie Effizienzklasse": "Klasse G",
        "Energieklasse (HDR)": "Klasse G",
        "Enthaltene Kabel": "1 x HDMI-Kabel - 1.8 m  1 x DisplayPort-Kabel - 1.8 m",
        "Farbe": "Schwarz, Rot",
        "Farbraum": "93 % DCI-P3 (CIE1976), 120% sRGB (CIE 1931)",
        "Farbunterst\u00fctzung": "16,7 Millionen Farben",
        "Gaming": "Ja",
        "Ger\u00e4tetyp": "LED-hintergrundbeleuchteter LCD-Monitor - 86.4 cm (34\")",
        "Gewicht": "7.78 kg",
        "HDR-Format": "HDR10",
        "HDR-f\u00e4hig": "HDR10",
        "Helligkeit": "300 cd/m\u00b2",
        "Hersteller": "AOC",
        "Hintergrundbeleuchtungs-Technologie": "WLED",
        "Horizontale Bildwiederholrate": "30 - 220 kHz",
        "H\u00f6heneinstellung": "130 mm",
        "Kontrast": "3000:1 / 80000000:1 (dynamisch)",
        "Leistungsmerkmale": "Slot f\u00fcr Sicherheitsschloss (Kabelschloss getrennt erh\u00e4ltlich)",
        "Mitgelieferte Software": "AOC G-Menu",
        "Modell": "U34G3XM/EU",
        "Native Aufl\u00f6sung": "UWQHD 3440 x 1440 bei 144 Hz",
        "Neigungswinkel": "-5/+23",
        "OSD-Sprachen": "Tschechisch, Kroatisch, Chinesisch (tradionell), Chinesisch (vereinfacht), Ukrainisch, Englisch, Deutsch, Franz\u00f6sisch, Italienisch, Portugiesisch, Polnisch, Finnisch, Schwedisch, Russisch, Spanisch, Holl\u00e4ndisch, T\u00fcrkisch, Japanisch, Koreanisch",
        "Ppi": "110",
        "Produktbeschreibung": "AOC Gaming U34G3XM - G3 Series - LED-Monitor - 86.4 cm (34\") - HDR",
        "Reaktionszeit": "4 ms (Grau-zu-Grau), 1 ms (MPRT)",
        "Schlosstyp zur Diebstahlsicherung": "Kensington Slot",
        "Schnittstellen": "2 x HDMI  DisplayPort 1.4  Kopfh\u00f6rer",
        "Schwenkwinkel": "60",
        "Seitenverh\u00e4ltnis": "21:9",
        "Spannung": "Wechselstrom 100-240 V (50/60 Hz)",
        "Stromverbrauch (Aus-Modus)": "0.5 Watt",
        "Stromverbrauch (typisch)": "35 Watt",
        "Stromverbrauch HDR (eingeschaltet)": "55 kWh/1.000 h",
        "Stromverbrauch SDR (eingeschaltet)": "33 kWh/1.000 h",
        "Stromverbrauch im Standby-Modus": "0.5 Watt",
        "Transportbreite": "52.8 cm",
        "Transportgewicht": "11.05 kg",
        "Transporth\u00f6he": "90 cm",
        "Transporttiefe": "22.4 cm",
        "VESA-Halterung": "100 x 100 mm",
        "Vertikale Bildwiederholrate": "48 - 144 Hz",
        "Vertikaler Betrachtungswinkel": "178",
        "Waren-Nr.": "3115198",
        "Zum Hersteller": "www.aoc.com"
    },
    "raw_specifications_text": "Hersteller: AOC\nWaren-Nr.: 3115198\nModell: U34G3XM/EU\nEAN: 4038986110624\nZum Hersteller: www.aoc.com\nProduktbeschreibung: AOC Gaming U34G3XM - G3 Series - LED-Monitor - 86.4 cm (34\") - HDR\nGer\u00e4tetyp: LED-hintergrundbeleuchteter LCD-Monitor - 86.4 cm (34\")\nEnergie Effizienzklasse: Klasse G\nAdaptive-Sync Technologie: AMD FreeSync Premium\nBildschirmtyp: VA\nSeitenverh\u00e4ltnis: 21:9\nNative Aufl\u00f6sung: UWQHD 3440 x 1440 bei 144 Hz\nHelligkeit: 300 cd/m\u00b2\nKontrast: 3000:1 / 80000000:1 (dynamisch)\nHDR-f\u00e4hig: HDR10\nReaktionszeit: 4 ms (Grau-zu-Grau), 1 ms (MPRT)\nGaming: Ja\nFarbunterst\u00fctzung: 16,7 Millionen Farben\nFarbraum: 93 % DCI-P3 (CIE1976), 120% sRGB (CIE 1931)\nEingangsanschl\u00fcsse: 2xHDMI, DisplayPort\nEinstellungen der Anzeigeposition: H\u00f6he, Drehung, Neigung\nBildschirmbeschichtung: Blendfrei\nSpannung: Wechselstrom 100-240 V (50/60 Hz)\nFarbe: Schwarz, Rot\nAbmessungen (Breite x Tiefe x H\u00f6he) - mit Fu\u00df: 81.74 cm x 33.96 cm x 39.94 cm\nGewicht: 7.78 kg\nDisplay-Typ: LED-hintergrundbeleuchteter LCD-Monitor / TFT-Aktivmatrix\nEnergieklasse (HDR): Klasse G\nDiagonalabmessung: 86.4 cm (34\")\nPpi: 110\nHDR-Format: HDR10\nVertikale Bildwiederholrate: 48 - 144 Hz\nHorizontale Bildwiederholrate: 30 - 220 kHz\nVertikaler Betrachtungswinkel: 178\nHintergrundbeleuchtungs-Technologie: WLED\nOSD-Sprachen: Tschechisch, Kroatisch, Chinesisch (tradionell), Chinesisch (vereinfacht), Ukrainisch, Englisch, Deutsch, Franz\u00f6sisch, Italienisch, Portugiesisch, Polnisch, Finnisch, Schwedisch, Russisch, Spanisch, Holl\u00e4ndisch, T\u00fcrkisch, Japanisch, Koreanisch\nBesonderheiten: Bild f\u00fcr Bild, MultiView, Spielmodus, FPS Mode, Low Blue Light Mode, flimmerfreie Technologie, RTS Mode, Motion Blur Reduction, Adaptive-Sync-Technologie, AOC schwache Eingangsleistung Verz\u00f6gerungsmodus, AOC Shadow Control, Game Color Mode, Rennmodus, Picture-in-Picture, Dial Point, an 3 Seiten rahmenlos, Bildz\u00e4hler\nAbmessungen (Breite x Tiefe x H\u00f6he): 81.74 cm x 33.96 cm x 39.94 cm - mit Fu\u00df\nSchnittstellen: 2 x HDMI  DisplayPort 1.4  Kopfh\u00f6rer\nNeigungswinkel: -5/+23\nSchwenkwinkel: 60\nH\u00f6heneinstellung: 130 mm\nVESA-Halterung: 100 x 100 mm\nLeistungsmerkmale: Slot f\u00fcr Sicherheitsschloss (Kabelschloss getrennt erh\u00e4ltlich)\nEnthaltene Kabel: 1 x HDMI-Kabel - 1.8 m  1 x DisplayPort-Kabel - 1.8 m\nSchlosstyp zur Diebstahlsicherung: Kensington Slot\nEingangsspannung: Wechselstrom 100-240 V (50/60 Hz)\nStromverbrauch SDR (eingeschaltet): 33 kWh/1.000 h\nStromverbrauch HDR (eingeschaltet): 55 kWh/1.000 h\nStromverbrauch (typisch): 35 Watt\nStromverbrauch im Standby-Modus: 0.5 Watt\nStromverbrauch (Aus-Modus): 0.5 Watt\nMitgelieferte Software: AOC G-Menu\nDetails zu Abmessungen & Gewicht: Mit Standfu\u00df (niedrigste Position) - Breite: 81.74 cm - Tiefe: 33.96 cm - H\u00f6he: 39.94 cm - Gewicht: 7.78 kg  Mit Standfu\u00df (h\u00f6chste Position) - Breite: 81.74 cm - Tiefe: 33.96 cm - H\u00f6he: 52.94 cm - Gewicht: 7.78 kg  Ohne Fu\u00df - Breite: 81.74 cm - Tiefe: 5.57 cm - H\u00f6he: 37.07 cm\nTransportbreite: 52.8 cm\nTransporttiefe: 22.4 cm\nTransporth\u00f6he: 90 cm\nTransportgewicht: 11.05 kg",
    "reference_file": "offer_reference_683.json",
    "shop_name": "Proshop.at"
}