{
    "html_file": "offer_1601_11.html",
    "name": "LG UltraGear 32GN550-B, 31.5\"",
    "offer_link": "https://direkt.jacob.de/produkte/lg-32gn550-b-computerbildschirm-32gn550-b-artnr-6967318.html?utm_source=geizhals&utm_medium=cpc&utm_campaign=Preisvergleich&ref=103",
    "price": 310.56,
    "raw_specifications": {
        "AC Eingangsspannung": "100 - 240 V",
        "AMD FreeSync": "Ja",
        "Anzahl DisplayPort Anschl\u00fcsse": "1",
        "Anzahl HDMI-Anschl\u00fcsse": "2",
        "Bildschirmaufl\u00f6sung": "1920 x 1080 Pixel",
        "Bildschirmdiagonale": "80 cm (31.5\" )",
        "Bildschirmform": "Flach",
        "Blickwinkel, horizontal": "178\u00b0",
        "Blickwinkel, vertikal": "178\u00b0",
        "Breite (ohne Standfu\u00df)": "71,5 cm",
        "DisplayPorts-Version": "1.4",
        "Energie Effizienzklasse": "F",
        "Energie-Effizienzklasse": "A",
        "Gewicht (ohne St\u00e4nder)": "5,1 kg",
        "HD-Typ": "Full HD",
        "HDMI": "Ja",
        "Helligkeit (typisch)": "300 cd/m\u00b2",
        "H\u00f6he (ohne Standfu\u00df)": "42,8 cm",
        "J\u00e4hrlicher Energieverbrauch": "48 kWh",
        "Kontrastverh\u00e4ltnis": "3000:1",
        "Kopfh\u00f6rerausgang": "Ja",
        "Maximale Bildwiederholrate": "165 Hz",
        "Natives Seitenverh\u00e4ltnis": "16:9",
        "Paketgewicht": "10,3 kg",
        "Panel-Montage-Schnittstelle": "100 x 100 mm",
        "Panel-Typ": "IPS",
        "Pixel Abstand": "0,36375 x 0,36375 mm",
        "Produktfarbe": "Schwarz",
        "Reaktionszeit (schnell)": "5 ms",
        "Stromverbrauch (Standby)": "0,5 W",
        "Stromverbrauch (in Betrieb)": "60 W",
        "Tiefe (ohne Standfu\u00df)": "5,09 cm",
        "VESA-Halterung": "Ja",
        "Verpackungsbreite": "793 mm",
        "Verpackungsh\u00f6he": "557 mm",
        "Verpackungstiefe": "227 mm"
    },
    "raw_specifications_text": "Bildschirmdiagonale: 80 cm (31.5\" )\nEnergie Effizienzklasse: F\nBildschirmaufl\u00f6sung: 1920 x 1080 Pixel\nNatives Seitenverh\u00e4ltnis: 16:9\nPanel-Typ: IPS\nHelligkeit (typisch): 300 cd/m\u00b2\nHD-Typ: Full HD\nBildschirmform: Flach\nKontrastverh\u00e4ltnis: 3000:1\nMaximale Bildwiederholrate: 165 Hz\nBlickwinkel, horizontal: 178\u00b0\nBlickwinkel, vertikal: 178\u00b0\nReaktionszeit (schnell): 5 ms\nPixel Abstand: 0,36375 x 0,36375 mm\nAMD FreeSync: Ja\nProduktfarbe: Schwarz\nHDMI: Ja\nAnzahl DisplayPort Anschl\u00fcsse: 1\nKopfh\u00f6rerausgang: Ja\nAnzahl HDMI-Anschl\u00fcsse: 2\nDisplayPorts-Version: 1.4\nVESA-Halterung: Ja\nPanel-Montage-Schnittstelle: 100 x 100 mm\nEnergie-Effizienzklasse: A\nJ\u00e4hrlicher Energieverbrauch: 48 kWh\nStromverbrauch (in Betrieb): 60 W\nStromverbrauch (Standby): 0,5 W\nAC Eingangsspannung: 100 - 240 V\nBreite (ohne Standfu\u00df): 71,5 cm\nTiefe (ohne Standfu\u00df): 5,09 cm\nH\u00f6he (ohne Standfu\u00df): 42,8 cm\nGewicht (ohne St\u00e4nder): 5,1 kg\nVerpackungsbreite: 793 mm\nVerpackungstiefe: 227 mm\nVerpackungsh\u00f6he: 557 mm\nPaketgewicht: 10,3 kg",
    "reference_file": "offer_reference_1601.json",
    "shop_name": "Jacob Elektronik direkt (AT)"
}