{
    "html_file": "offer_189_2.html",
    "name": "Dell UltraSharp U3224KBA, 31.5\"",
    "offer_link": "https://www.csv-direct.de/artinfo.php?artnr=A1621580&KATEGORIE=162&pva=geizhals2",
    "price": 2659.6,
    "raw_specifications": {
        "AC Eingangsfrequenz": "50/60 Hz",
        "AC Eingangsspannung": "100 - 220 V",
        "AMD FreeSync": "Nein",
        "Anzahl Ethernet-LAN-Anschl\u00fcsse RJ-45": "1",
        "Anzahl HDMI-Anschl\u00fcsse": "1",
        "Anzahl Mini DisplayPorts": "1",
        "Anzahl Thunderbolt 4-Ports": "2",
        "Anzahl der Farben des Displays": "1,07 Milliarden Farben",
        "Anzahl der Lautsprecher": "2",
        "Anzahl der nachgeschalteten Ports vom Typ USB-C": "3",
        "Anzahl der nachgeschalteten Steckpl\u00e4tze vom Typ USB-A": "5",
        "Betriebstemperatur": "0 - 40 \u00b0C",
        "Bildschirmdiagonale": "80 cm 31.5\"",
        "Bildschirmdiagonale cm": "79,94 cm",
        "Bildschirmform": "Flach",
        "Bildschirmtechnologie": "LCD",
        "Bildwinkel, horizontal": "178\u00b0",
        "Bildwinkel, vertikal": "178\u00b0",
        "Breite ohne Standfu\u00df": "717,4 mm",
        "Display-Aufl\u00f6sung": "6144 x 3456 Pixel",
        "DisplayPorts-Version": "2.1",
        "Energieeffizienzklasse HDR": "G",
        "Energieeffizienzklasse SDR": "G",
        "Energieeffizienzskala": "A bis G",
        "Energieverbrauch HDR pro 1.000 Stunden": "83 kWh",
        "Energieverbrauch SDR pro 1.000 Stunden": "68 kWh",
        "Enth\u00e4lt nicht": "PVC/BFR",
        "Farbskala": "100",
        "Fu\u00dffarbe": "Silber",
        "Ger\u00e4tebreite inkl. Fu\u00df": "717,4 mm",
        "Ger\u00e4teh\u00f6he inkl. Fu\u00df": "682,6 mm",
        "Ger\u00e4tetiefe inkl. Fu\u00df": "237 mm",
        "Gewicht mit St\u00e4nder": "13 kg",
        "Gewicht ohne St\u00e4nder": "8,61 kg",
        "HD-Typ": "6K Ultra HD",
        "HDCP-Version": "2.2",
        "HDMI-Version": "2.1",
        "Helligkeit typisch": "450 cd/m\u00b2",
        "Horizontaler Scanbereich": "30 - 220 kHz",
        "H\u00f6he bei Betrieb": "0 - 5000 m",
        "H\u00f6he bei Lagerung": "5000 - 12192 m",
        "H\u00f6he ohne Standfu\u00df": "486,6 mm",
        "H\u00f6heneinstellung": "15 cm",
        "Kontrastverh\u00e4ltnis": "2000:1",
        "Kopfh\u00f6rerausgang": "Nein",
        "Luftfeuchtigkeit bei Lagerung": "5 - 90",
        "Marktpositionierung": "Business",
        "Maximale Bildwiederholrate": "60 Hz",
        "Megapixel ca.": "8 MP",
        "Mitgelieferte Kabel": "AC, USB Typ-A auf USB Typ-C",
        "NVIDIA G-SYNC": "Nein",
        "Nachhaltigkeitszertifikate": "ENERGY STAR, RoHS",
        "Natives Seitenverh\u00e4ltnis": "16:9",
        "Neigungswinkelbereich": "-5 - 21\u00b0",
        "Netzteiltyp": "Intern",
        "Oberfl\u00e4chenh\u00e4rte": "3H",
        "Paketgewicht": "17,7 kg",
        "Panel-Montage-Schnittstelle": "100 x 100 mm",
        "Panel-Typ": "IPS",
        "Pivot Winkel": "-90 - 90\u00b0",
        "Pixel Abstand": "0,1134 x 0,1134 mm",
        "Pixeldichte": "223 ppi",
        "Produktfarbe": "Schwarz, Silber",
        "RGB-Farbraum": "DCI-P3",
        "RMS-Leistung": "28 W",
        "Rahmenbreite Seite": "1,03 cm",
        "Rahmenbreite oben": "4,29 cm",
        "Rahmenbreite unten": "2,31 cm",
        "Reaktionszeit": "8 ms",
        "Reaktionszeit schnell": "5 ms",
        "Relative Luftfeuchtigkeit in Betrieb": "10 - 80",
        "Schwenkwinkelbereich": "-30 - 30\u00b0",
        "Schwermetallfrei": "Hg Quecksilber",
        "Sichtbare Gr\u00f6\u00dfe horizontal": "69,7 cm",
        "Sichtbare Gr\u00f6\u00dfe vertikal": "39,2 cm",
        "Slot-Typ Kabelsperre": "Kensington",
        "Stromverbrauch Standardbetrieb": "68,1 W",
        "Stromverbrauch Standby": "0,5 W",
        "Stromverbrauch aus": "0,3 W",
        "Stromverbrauch max.": "420 W",
        "Technologie mit hohem Dynamikbereich HDR": "DisplayHDR 600",
        "Temperaturbereich bei Lagerung": "-20 - 60 \u00b0C",
        "Tiefe ohne Standfu\u00df": "66,3 mm",
        "Touchscreen": "Nein",
        "Typ der Hintergrundbeleuchtung": "LED",
        "USB-Hub-Version": "3.2 Gen 2 3.1 Gen 2",
        "USB-Stromversorgung bis zu": "140 W",
        "USB-Upstream-Porttyp": "USB Typ-C",
        "Unterst\u00fctzte Video-Modi": "480p, 576p, 720p, 1080i, 1080p, 2160p",
        "Vertikaler Scanbereich": "56 - 76 Hz",
        "Vorderer Rahmen": "Schwarz",
        "WLAN": "Nein",
        "sRGB Abdeckung klassisch": "100"
    },
    "raw_specifications_text": "Bildschirmdiagonale: 80 cm 31.5\"\nDisplay-Aufl\u00f6sung: 6144 x 3456 Pixel\nNatives Seitenverh\u00e4ltnis: 16:9\nBildschirmtechnologie: LCD\nTouchscreen: Nein\nHD-Typ: 6K Ultra HD\nPanel-Typ: IPS\nBildschirmform: Flach\nKontrastverh\u00e4ltnis: 2000:1\nMaximale Bildwiederholrate: 60 Hz\nAnzahl der Farben des Displays: 1,07 Milliarden Farben\nTyp der Hintergrundbeleuchtung: LED\nHelligkeit typisch: 450 cd/m\u00b2\nReaktionszeit: 8 ms\nUnterst\u00fctzte Video-Modi: 480p, 576p, 720p, 1080i, 1080p, 2160p\nBildwinkel, horizontal: 178\u00b0\nBildwinkel, vertikal: 178\u00b0\nReaktionszeit schnell: 5 ms\nPixel Abstand: 0,1134 x 0,1134 mm\nPixeldichte: 223 ppi\nHorizontaler Scanbereich: 30 - 220 kHz\nVertikaler Scanbereich: 56 - 76 Hz\nSichtbare Gr\u00f6\u00dfe horizontal: 69,7 cm\nSichtbare Gr\u00f6\u00dfe vertikal: 39,2 cm\nBildschirmdiagonale cm: 79,94 cm\nTechnologie mit hohem Dynamikbereich HDR: DisplayHDR 600\nOberfl\u00e4chenh\u00e4rte: 3H\nRGB-Farbraum: DCI-P3\nFarbskala: 100\nsRGB Abdeckung klassisch: 100\nNVIDIA G-SYNC: Nein\nAMD FreeSync: Nein\nAnzahl der Lautsprecher: 2\nRMS-Leistung: 28 W\nMegapixel ca.: 8 MP\nMarktpositionierung: Business\nProduktfarbe: Schwarz, Silber\nVorderer Rahmen: Schwarz\nFu\u00dffarbe: Silber\nSchwermetallfrei: Hg Quecksilber\nKopfh\u00f6rerausgang: Nein\nUSB-Hub-Version: 3.2 Gen 2 3.1 Gen 2\nUSB-Upstream-Porttyp: USB Typ-C\nAnzahl der nachgeschalteten Steckpl\u00e4tze vom Typ USB-A: 5\nAnzahl der nachgeschalteten Ports vom Typ USB-C: 3\nUSB-Stromversorgung bis zu: 140 W\nAnzahl HDMI-Anschl\u00fcsse: 1\nHDMI-Version: 2.1\nDisplayPorts-Version: 2.1\nAnzahl Mini DisplayPorts: 1\nAnzahl Thunderbolt 4-Ports: 2\nHDCP-Version: 2.2\nWLAN: Nein\nPanel-Montage-Schnittstelle: 100 x 100 mm\nSlot-Typ Kabelsperre: Kensington\nH\u00f6heneinstellung: 15 cm\nPivot Winkel: -90 - 90\u00b0\nSchwenkwinkelbereich: -30 - 30\u00b0\nNeigungswinkelbereich: -5 - 21\u00b0\nEnergieeffizienzklasse SDR: G\nEnergieeffizienzklasse HDR: G\nEnergieverbrauch SDR pro 1.000 Stunden: 68 kWh\nEnergieverbrauch HDR pro 1.000 Stunden: 83 kWh\nStromverbrauch Standardbetrieb: 68,1 W\nStromverbrauch Standby: 0,5 W\nStromverbrauch max.: 420 W\nStromverbrauch aus: 0,3 W\nAC Eingangsspannung: 100 - 220 V\nAC Eingangsfrequenz: 50/60 Hz\nNetzteiltyp: Intern\nEnergieeffizienzskala: A bis G\nBetriebstemperatur: 0 - 40 \u00b0C\nTemperaturbereich bei Lagerung: -20 - 60 \u00b0C\nRelative Luftfeuchtigkeit in Betrieb: 10 - 80\nLuftfeuchtigkeit bei Lagerung: 5 - 90\nH\u00f6he bei Betrieb: 0 - 5000 m\nH\u00f6he bei Lagerung: 5000 - 12192 m\nMitgelieferte Kabel: AC, USB Typ-A auf USB Typ-C\nGer\u00e4tebreite inkl. Fu\u00df: 717,4 mm\nGer\u00e4tetiefe inkl. Fu\u00df: 237 mm\nGer\u00e4teh\u00f6he inkl. Fu\u00df: 682,6 mm\nGewicht mit St\u00e4nder: 13 kg\nBreite ohne Standfu\u00df: 717,4 mm\nTiefe ohne Standfu\u00df: 66,3 mm\nH\u00f6he ohne Standfu\u00df: 486,6 mm\nGewicht ohne St\u00e4nder: 8,61 kg\nRahmenbreite Seite: 1,03 cm\nRahmenbreite oben: 4,29 cm\nRahmenbreite unten: 2,31 cm\nPaketgewicht: 17,7 kg\nNachhaltigkeitszertifikate: ENERGY STAR, RoHS\nEnth\u00e4lt nicht: PVC/BFR\nAnzahl Ethernet-LAN-Anschl\u00fcsse RJ-45: 1",
    "reference_file": "offer_reference_189.json",
    "shop_name": "CSV-Direct.de"
}