{
    "html_file": "offer_375_16.html",
    "name": "iiyama ProLite XUB2390HS-B5, 23\"",
    "offer_link": "https://www.alternate.at/iiyama/ProLite-XUB2390HS-B5-LED-Monitor/html/product/1911634?partner=AtGeizhalsat&campaign=Monitor/iiyama/1911634",
    "price": 133.9,
    "raw_specifications": {
        "": "Kensington-Schloss",
        "Abmessungen": "Breite: 53,25 cm x H\u00f6he: 50,45 cm x Tiefe/L\u00e4nge: 20,95 cm",
        "Anschl\u00fcsse": "1x DVI-I-Eingang, 1x HDMI-Eingang, 1x VGA-Eingang, 1x Kopfh\u00f6rer-Ausgang",
        "Bild": "Glaretyp",
        "Bildschirmaufl\u00f6sung": "1.920 x 1.080 Pixel",
        "Bildschirmdiagonale": "58 cm (23 Zoll)",
        "EAN": "4948570121434",
        "Energieeffizienzklasse (SDR)": "E (A - G)",
        "Energieverbauch pro 1000 Stunden (SDR)": "16 kWh",
        "Ergonomie": "Typ",
        "Farbe": "schwarz",
        "Features": "Blaulicht Reduktion, Overdrive-Funktion, ACR-Funktion (Advanced Contrast Ratio)",
        "Frequenz": "Horizontal",
        "Gewicht": "5,1 kg",
        "Hersteller-Nr.": "XUB2390HS-B5",
        "Lautsprecher": "2 Lautsprecher",
        "Leistungsaufnahme im Bereitschafts- und Aus-Zustand": "0,5 Watt",
        "Leistungsaufnahme im Ein-Zustand bei Standard-Dynamikumfang (SDR)": "16,3 Watt",
        "Stromversorgung": "Eco-Off",
        "Typ": "LED-Monitor",
        "Wandhalterung": "VESA kompatibel (100 x 100 mm)",
        "Zubeh\u00f6r": "Vorhanden"
    },
    "raw_specifications_text": "Energieeffizienzklasse (SDR): E (A - G)\nEnergieverbauch pro 1000 Stunden (SDR): 16 kWh\nLeistungsaufnahme im Ein-Zustand bei Standard-Dynamikumfang (SDR): 16,3 Watt\nLeistungsaufnahme im Bereitschafts- und Aus-Zustand: 0,5 Watt\nBildschirmdiagonale: 58 cm (23 Zoll)\nBildschirmaufl\u00f6sung: 1.920 x 1.080 Pixel\nTyp: LED-Monitor\nFarbe: schwarz\nEAN: 4948570121434\nHersteller-Nr.: XUB2390HS-B5\nBild: Glaretyp\n: Kensington-Schloss\nFrequenz: Horizontal\nAnschl\u00fcsse: 1x DVI-I-Eingang, 1x HDMI-Eingang, 1x VGA-Eingang, 1x Kopfh\u00f6rer-Ausgang\nErgonomie: Typ\nStromversorgung: Eco-Off\nLautsprecher: 2 Lautsprecher\nWandhalterung: VESA kompatibel (100 x 100 mm)\nFeatures: Blaulicht Reduktion, Overdrive-Funktion, ACR-Funktion (Advanced Contrast Ratio)\nZubeh\u00f6r: Vorhanden\nAbmessungen: Breite: 53,25 cm x H\u00f6he: 50,45 cm x Tiefe/L\u00e4nge: 20,95 cm\nGewicht: 5,1 kg",
    "reference_file": "offer_reference_375.json",
    "shop_name": "Alternate.at"
}