{
    "html_file": "offer_382_6.html",
    "name": "Dell S3221QSA, 31.5\"",
    "offer_link": "https://www.mylemon.at/artikel/dell/dell_s3221qsa/32-curved-4k-uhd-monitor.html",
    "price": 501.68,
    "raw_specifications": {
        "AC Eingangsfrequenz": "50 - 60 Hz",
        "AC Eingangsspannung": "100 - 240 V",
        "AMD FreeSync": "Ja",
        "Abnehmbarer Standfu\u00df": "Ja",
        "Anzahl DisplayPort Anschl\u00fcsse": "1",
        "Anzahl HDMI-Anschl\u00fcsse": "2",
        "Anzahl der Farben des Displays": "1,07 Milliarden Farben",
        "Anzahl der Lautsprecher": "2",
        "Anzahl der Upstream-Ports USB Typ-B": "1",
        "Anzahl der nachgeschalteten Steckpl\u00e4tze vom Typ USB-A": "2",
        "Artikelnummer": "M1IYT3EL",
        "Aufl\u00f6sung": "3840x2160",
        "Besonderheiten": "Curved, Lautsprecher, USB HUB",
        "Betriebstemperatur": "0 - 40 \u00b0C",
        "Bewertung der Bildschirmkr\u00fcmmung": "1800R",
        "Bild-in-Bild": "Ja",
        "Bildschirmdiagonale": "80 cm (31.5\")",
        "Bildschirmdiagonale (cm)": "80,01 cm",
        "Bildschirmform": "Gebogen",
        "Bildschirmtechnologie": "LCD",
        "Bildwinkel, horizontal": "178\u00b0",
        "Bildwinkel, vertikal": "178\u00b0",
        "Blendfreier Bildschirm": "Ja",
        "Breite (ohne Standfu\u00df)": "709,2 mm",
        "Digital horizontale Frequenz": "29 - 140 kHz",
        "Digital vertikale Frequenz": "40 - 60 Hz",
        "Display-Aufl\u00f6sung": "3840 x 2160 Pixel",
        "DisplayPorts-Version": "1.2",
        "Displaygr\u00f6\u00dfe": "31,5 Zoll",
        "EAN": "5397184657195",
        "Eingangsstrom": "1.6 A",
        "Eingebaute Lautsprecher": "Ja",
        "Energieeffizienzklasse (HDR)": "G",
        "Energieeffizienzklasse (SDR)": "G",
        "Energieeffizienzskala": "A bis G",
        "Energieverbrauch (HDR) pro 1.000 Stunden": "56 kWh",
        "Energieverbrauch (SDR) pro 1.000 Stunden": "33 kWh",
        "Enth\u00e4lt nicht": "PVC/BFR",
        "Ergonomie": "Neigbar",
        "Farbskala": "90%",
        "Flimmerfreie Technologie": "Ja",
        "Fu\u00dffarbe": "Silber",
        "Ger\u00e4tebreite (inkl. Fu\u00df)": "709,2 mm",
        "Ger\u00e4teh\u00f6he (inkl. Fu\u00df)": "518,1 mm",
        "Ger\u00e4tetiefe (inkl. Fu\u00df)": "207 mm",
        "Gewicht (mit St\u00e4nder)": "10,5 kg",
        "Gewicht (ohne St\u00e4nder)": "7,4 kg",
        "HD-Typ": "4K Ultra HD",
        "HDCP": "Ja",
        "HDCP-Version": "2.2",
        "HDMI": "Ja",
        "HDMI-Version": "2.0",
        "Helligkeit": "300 cd/m\u00b2",
        "Helligkeit (peak)": "300 cd/m\u00b2",
        "Helligkeit (typisch)": "300 cd/m\u00b2",
        "Hersteller Artikelnummer": "DELL-S3221QSA",
        "High Dynamic Range Video (HDR) Unterst\u00fctzung": "Nein",
        "H\u00f6he (ohne Standfu\u00df)": "424,8 mm",
        "H\u00f6he bei Betrieb": "0 - 5000 m",
        "H\u00f6he bei Lagerung": "5000 - 12192 m",
        "H\u00f6heneinstellung": "7 cm",
        "H\u00f6henverstellung": "Ja",
        "Integrierte Kamera": "Nein",
        "Integrierter USB-Hub": "Ja",
        "Kabelsperre-Slot": "Ja",
        "Kontrastverh\u00e4ltnis": "3000:1",
        "Kopfh\u00f6rerausgang": "Ja",
        "LED-Anzeigen": "Ja",
        "Luftfeuchtigkeit bei Lagerung": "10 - 90%",
        "Marktpositionierung": "B\u00fcro",
        "Maximale Bildwiederholrate": "60 Hz",
        "Mitgelieferte Kabel": "AC, HDMI, USB",
        "NVIDIA G-SYNC": "Nein",
        "Nachhaltigkeitszertifikate": "RoHS",
        "Natives Seitenverh\u00e4ltnis": "16:9",
        "Neigungsverstellung": "Ja",
        "Neigungswinkelbereich": "-5 - 21\u00b0",
        "Netzteiltyp": "Intern",
        "Oberfl\u00e4chenh\u00e4rte": "3H",
        "On-Screen-Display (OSD)": "Ja",
        "Paketgewicht": "15,2 kg",
        "Panel": "VA",
        "Panel-Montage-Schnittstelle": "100 x 100 mm",
        "Panel-Typ": "VA",
        "Pivot": "Nein",
        "Pixel Abstand": "0,18159 x 0,18159 mm",
        "Pixeldichte": "139 ppi",
        "Plug & Play": "Ja",
        "Produktfarbe": "Schwarz, Silber",
        "RGB-Farbraum": "DCI-P3",
        "RMS-Leistung": "10 W",
        "Rahmenbreite (Seite)": "8,2 mm",
        "Rahmenbreite (oben)": "8,1 mm",
        "Rahmenbreite (unten)": "2,41 cm",
        "Reaktionszeit": "8 ms",
        "Reaktionszeit (schnell)": "5 ms",
        "Relative Luftfeuchtigkeit in Betrieb": "10 - 80%",
        "Schwenkbar": "Nein",
        "Schwermetallfrei": "Hg (Quecksilber)",
        "Sichtbare Gr\u00f6\u00dfe (diagonal)": "80 cm",
        "Sichtbare Gr\u00f6\u00dfe (horizontal)": "69,7 cm",
        "Sichtbare Gr\u00f6\u00dfe (vertikal)": "39,2 cm",
        "Slot-Typ Kabelsperre": "Kensington",
        "Stromeingang": "Ja",
        "Stromverbrauch (Standardbetrieb)": "33 W",
        "Stromverbrauch (Standby)": "0,2 W",
        "Stromverbrauch (aus)": "0,2 W",
        "Stromverbrauch (max.)": "91 W",
        "St\u00e4nder enthalten": "Ja",
        "Temperaturbereich bei Lagerung": "-20 - 60 \u00b0C",
        "Tiefe (ohne Standfu\u00df)": "64 mm",
        "Touchscreen": "Nein",
        "Tr\u00fcbungsrate": "25%",
        "Typ der Hintergrundbeleuchtung": "LED",
        "USB-Hub-Version": "3.2 Gen 1 (3.1 Gen 1)",
        "USB-Upstream-Porttyp": "USB Typ-B",
        "Unterst\u00fctzte Video-Modi": "480i, 480p, 576i, 576p, 720p, 1080i, 1080p",
        "VESA Halterung": "100x100 mm",
        "VESA-Halterung": "Ja",
        "Verbessertes Kabelmanagement": "Ja",
        "Video Anschl\u00fcsse": "2x HDMI",
        "Vorderer Rahmen": "Schwarz",
        "WLAN": "Nein",
        "sRGB Abdeckung (klassisch)": "99%"
    },
    "raw_specifications_text": "Displaygr\u00f6\u00dfe: 31,5 Zoll\nAufl\u00f6sung: 3840x2160\nPanel: VA\nReaktionszeit: 8 ms\nVideo Anschl\u00fcsse: 2x HDMI\nErgonomie: Neigbar\nVESA Halterung: 100x100 mm\nHelligkeit: 300 cd/m\u00b2\nBesonderheiten: Curved, Lautsprecher, USB HUB\nHersteller Artikelnummer: DELL-S3221QSA\nEAN: 5397184657195\nArtikelnummer: M1IYT3EL\nBildschirmdiagonale: 80 cm (31.5\")\nDisplay-Aufl\u00f6sung: 3840 x 2160 Pixel\nNatives Seitenverh\u00e4ltnis: 16:9\nBildschirmtechnologie: LCD\nTouchscreen: Nein\nHD-Typ: 4K Ultra HD\nPanel-Typ: VA\nBildschirmform: Gebogen\nKontrastverh\u00e4ltnis: 3000:1\nMaximale Bildwiederholrate: 60 Hz\nAnzahl der Farben des Displays: 1,07 Milliarden Farben\nTyp der Hintergrundbeleuchtung: LED\nHelligkeit (peak): 300 cd/m\u00b2\nHelligkeit (typisch): 300 cd/m\u00b2\nBlendfreier Bildschirm: Ja\nBewertung der Bildschirmkr\u00fcmmung: 1800R\nUnterst\u00fctzte Video-Modi: 480i, 480p, 576i, 576p, 720p, 1080i, 1080p\nBildwinkel, horizontal: 178\u00b0\nBildwinkel, vertikal: 178\u00b0\nReaktionszeit (schnell): 5 ms\nPixel Abstand: 0,18159 x 0,18159 mm\nPixeldichte: 139 ppi\nSichtbare Gr\u00f6\u00dfe (horizontal): 69,7 cm\nSichtbare Gr\u00f6\u00dfe (vertikal): 39,2 cm\nSichtbare Gr\u00f6\u00dfe (diagonal): 80 cm\nDigital horizontale Frequenz: 29 - 140 kHz\nDigital vertikale Frequenz: 40 - 60 Hz\nBildschirmdiagonale (cm): 80,01 cm\nHigh Dynamic Range Video (HDR) Unterst\u00fctzung: Nein\nTr\u00fcbungsrate: 25%\nOberfl\u00e4chenh\u00e4rte: 3H\nRGB-Farbraum: DCI-P3\nFarbskala: 90%\nsRGB Abdeckung (klassisch): 99%\nNVIDIA G-SYNC: Nein\nAMD FreeSync: Ja\nFlimmerfreie Technologie: Ja\nEingebaute Lautsprecher: Ja\nIntegrierte Kamera: Nein\nAnzahl der Lautsprecher: 2\nRMS-Leistung: 10 W\nMarktpositionierung: B\u00fcro\nProduktfarbe: Schwarz, Silber\nVorderer Rahmen: Schwarz\nAbnehmbarer Standfu\u00df: Ja\nFu\u00dffarbe: Silber\nSchwermetallfrei: Hg (Quecksilber)\nIntegrierter USB-Hub: Ja\nHDMI: Ja\nKopfh\u00f6rerausgang: Ja\nUSB-Hub-Version: 3.2 Gen 1 (3.1 Gen 1)\nUSB-Upstream-Porttyp: USB Typ-B\nAnzahl der Upstream-Ports USB Typ-B: 1\nAnzahl der nachgeschalteten Steckpl\u00e4tze vom Typ USB-A: 2\nAnzahl HDMI-Anschl\u00fcsse: 2\nHDMI-Version: 2.0\nAnzahl DisplayPort Anschl\u00fcsse: 1\nDisplayPorts-Version: 1.2\nHDCP: Ja\nHDCP-Version: 2.2\nStromeingang: Ja\nWLAN: Nein\nVESA-Halterung: Ja\nKabelsperre-Slot: Ja\nH\u00f6henverstellung: Ja\nPanel-Montage-Schnittstelle: 100 x 100 mm\nVerbessertes Kabelmanagement: Ja\nSlot-Typ Kabelsperre: Kensington\nH\u00f6heneinstellung: 7 cm\nPivot: Nein\nSchwenkbar: Nein\nNeigungswinkelbereich: -5 - 21\u00b0\nBild-in-Bild: Ja\nOn-Screen-Display (OSD): Ja\nPlug & Play: Ja\nLED-Anzeigen: Ja\nNeigungsverstellung: Ja\nEnergieeffizienzklasse (SDR): G\nEnergieeffizienzklasse (HDR): G\nEnergieverbrauch (SDR) pro 1.000 Stunden: 33 kWh\nEnergieverbrauch (HDR) pro 1.000 Stunden: 56 kWh\nStromverbrauch (Standardbetrieb): 33 W\nStromverbrauch (Standby): 0,2 W\nStromverbrauch (max.): 91 W\nStromverbrauch (aus): 0,2 W\nAC Eingangsspannung: 100 - 240 V\nAC Eingangsfrequenz: 50 - 60 Hz\nEingangsstrom: 1.6 A\nNetzteiltyp: Intern\nEnergieeffizienzskala: A bis G\nBetriebstemperatur: 0 - 40 \u00b0C\nTemperaturbereich bei Lagerung: -20 - 60 \u00b0C\nRelative Luftfeuchtigkeit in Betrieb: 10 - 80%\nLuftfeuchtigkeit bei Lagerung: 10 - 90%\nH\u00f6he bei Betrieb: 0 - 5000 m\nH\u00f6he bei Lagerung: 5000 - 12192 m\nSt\u00e4nder enthalten: Ja\nMitgelieferte Kabel: AC, HDMI, USB\nGer\u00e4tebreite (inkl. Fu\u00df): 709,2 mm\nGer\u00e4tetiefe (inkl. Fu\u00df): 207 mm\nGer\u00e4teh\u00f6he (inkl. Fu\u00df): 518,1 mm\nGewicht (mit St\u00e4nder): 10,5 kg\nBreite (ohne Standfu\u00df): 709,2 mm\nTiefe (ohne Standfu\u00df): 64 mm\nH\u00f6he (ohne Standfu\u00df): 424,8 mm\nGewicht (ohne St\u00e4nder): 7,4 kg\nRahmenbreite (Seite): 8,2 mm\nRahmenbreite (oben): 8,1 mm\nRahmenbreite (unten): 2,41 cm\nPaketgewicht: 15,2 kg\nNachhaltigkeitszertifikate: RoHS\nEnth\u00e4lt nicht: PVC/BFR",
    "reference_file": "offer_reference_382.json",
    "shop_name": "mylemon.at"
}