{
    "html_file": "offer_2320_0.html",
    "name": "BenQ EW3270U, 31.5\"",
    "offer_link": "https://www.alternate.at/BenQ/EW3270U-Gaming-Monitor/html/product/1434927?partner=AtGeizhalsat&campaign=Monitor/BenQ/1434927",
    "price": 335.0,
    "raw_specifications": {
        "": "AMD FreeSync, Kensington-Schloss",
        "Abmessungen": "Breite: 73,96 cm x H\u00f6he: 52,68 cm x Tiefe/L\u00e4nge: 21,82 cm",
        "Anschl\u00fcsse": "2x HDMI-Eingang, (HDMI-Version: 2.0), 1x DisplayPort-Eingang, (DisplayPort-Version: 1.2), 1x 3,5-mm-Audio-Eingang, 1x Kopfh\u00f6rer-Ausgang, 1x USB-C 3.2 Gen 2 (10 Gbit/s)",
        "Bild": "Format",
        "Bildschirmaufl\u00f6sung": "3.840 x 2.160 Pixel",
        "Bildschirmdiagonale": "80 cm (31,5 Zoll)",
        "EAN": "4718755072666",
        "Energieeffizienzklasse (HDR)": "G (A - G)",
        "Energieeffizienzklasse (SDR)": "F (A - G)",
        "Energieverbauch pro 1000 Stunden (HDR)": "48 kWh",
        "Energieverbauch pro 1000 Stunden (SDR)": "32 kWh",
        "Ergonomie": "Typ",
        "Farbe": "grau",
        "Features": "Flimmerfreie LEDs, Blaulichtfilter, Brightness-Intelligence Plus, Smart Focus",
        "Frequenz": "Vertikal",
        "Geeignet f\u00fcr": "Gaming",
        "Gewicht": "7,5 kg",
        "Hersteller-Nr.": "9H.LGVLA.TPE",
        "Lautsprecher": "2 Lautsprecher",
        "Leistungsaufnahme im Bereitschafts- und Aus-Zustand": "0,4 Watt",
        "Leistungsaufnahme im Ein-Zustand bei Standard-Dynamikumfang (SDR)": "32 Watt",
        "Leistungsaufnahme im Ein-Zustand bei hohem Dynamikumfang (HDR)": "47.8 Watt",
        "Stromversorgung": "Eco-Off",
        "Typ": "Gaming-Monitor",
        "Wandhalterung": "VESA kompatibel",
        "Zubeh\u00f6r": "Vorhanden"
    },
    "raw_specifications_text": "Energieeffizienzklasse (SDR): F (A - G)\nEnergieverbauch pro 1000 Stunden (SDR): 32 kWh\nEnergieeffizienzklasse (HDR): G (A - G)\nEnergieverbauch pro 1000 Stunden (HDR): 48 kWh\nLeistungsaufnahme im Ein-Zustand bei Standard-Dynamikumfang (SDR): 32 Watt\nLeistungsaufnahme im Ein-Zustand bei hohem Dynamikumfang (HDR): 47.8 Watt\nLeistungsaufnahme im Bereitschafts- und Aus-Zustand: 0,4 Watt\nBildschirmdiagonale: 80 cm (31,5 Zoll)\nBildschirmaufl\u00f6sung: 3.840 x 2.160 Pixel\nTyp: Gaming-Monitor\nFarbe: grau\nEAN: 4718755072666\nHersteller-Nr.: 9H.LGVLA.TPE\nGeeignet f\u00fcr: Gaming\nBild: Format\n: AMD FreeSync, Kensington-Schloss\nFrequenz: Vertikal\nAnschl\u00fcsse: 2x HDMI-Eingang, (HDMI-Version: 2.0), 1x DisplayPort-Eingang, (DisplayPort-Version: 1.2), 1x 3,5-mm-Audio-Eingang, 1x Kopfh\u00f6rer-Ausgang, 1x USB-C 3.2 Gen 2 (10 Gbit/s)\nErgonomie: Typ\nStromversorgung: Eco-Off\nLautsprecher: 2 Lautsprecher\nWandhalterung: VESA kompatibel\nFeatures: Flimmerfreie LEDs, Blaulichtfilter, Brightness-Intelligence Plus, Smart Focus\nZubeh\u00f6r: Vorhanden\nAbmessungen: Breite: 73,96 cm x H\u00f6he: 52,68 cm x Tiefe/L\u00e4nge: 21,82 cm\nGewicht: 7,5 kg",
    "reference_file": "offer_reference_2320.json",
    "shop_name": "Alternate.at"
}