{
    "html_file": "offer_1478_4.html",
    "name": "LG UltraGear 27GN880-B, 27\"",
    "offer_link": "https://www.mylemon.at/artikel/lg/27gn880_b/27-27gn880-led-display-68.html",
    "price": 587.46,
    "raw_specifications": {
        "AC Eingangsfrequenz": "50/60 Hz",
        "AC Eingangsspannung": "100 - 240 V",
        "AMD FreeSync": "Ja",
        "Anzahl DisplayPort Anschl\u00fcsse": "1",
        "Anzahl HDMI-Anschl\u00fcsse": "2",
        "Anzahl der Farben des Displays": "1,073 Milliarden Farben",
        "Artikelnummer": "M15YAHXL",
        "Audioanschl\u00fcsse": "Ja",
        "Aufl\u00f6sung": "2560x1440",
        "Bildschirmdiagonale": "68,6 cm (27 Zoll)",
        "Bildschirmform": "Flach",
        "Bildschirmtechnologie": "LED",
        "Bildwinkel, horizontal": "178\u00b0",
        "Bildwinkel, vertikal": "178\u00b0",
        "Breite (ohne Standfu\u00df)": "61,4 cm",
        "DDC/CI": "Ja",
        "DVI Anschluss": "Nein",
        "Display-Aufl\u00f6sung": "2560 x 1440 Pixel",
        "DisplayPorts-Version": "1.4",
        "Displaygr\u00f6\u00dfe": "27 Zoll",
        "EAN": "8806091090881",
        "Eingebaute Lautsprecher": "Nein",
        "Energieeffizienzklasse (HDR)": "G",
        "Energieeffizienzklasse (SDR)": "G",
        "Energieeffizienzskala": "A bis G",
        "Energieverbrauch (HDR) pro 1.000 Stunden": "50 kWh",
        "Energieverbrauch (SDR) pro 1.000 Stunden": "30 kWh",
        "Ergonomie": "H\u00f6henverstellbar, Pivot (90 Grad drehbar), Neigbar",
        "Flimmerfreie Technologie": "Ja",
        "Ger\u00e4tebreite (inkl. Fu\u00df)": "614,2 mm",
        "Ger\u00e4teh\u00f6he (inkl. Fu\u00df)": "619,2 mm",
        "Ger\u00e4tetiefe (inkl. Fu\u00df)": "410,8 mm",
        "Gewicht (mit St\u00e4nder)": "8,1 kg",
        "Gewicht (ohne St\u00e4nder)": "4,2 kg",
        "HD-Typ": "Quad HD",
        "HDMI": "Ja",
        "Helligkeit": "350 cd/m\u00b2",
        "Helligkeit (typisch)": "350 cd/m\u00b2",
        "Hersteller Artikelnummer": "27GN880-B",
        "High Dynamic Range Video (HDR) Unterst\u00fctzung": "Ja",
        "H\u00f6he (ohne Standfu\u00df)": "36,5 cm",
        "Integrierte Kamera": "Nein",
        "Integrierter USB-Hub": "Nein",
        "Kontrastverh\u00e4ltnis": "1000:1",
        "Kopfh\u00f6rerausgang": "Ja",
        "Marktpositionierung": "Gaming",
        "Maximale Bildwiederholrate": "144 Hz",
        "NVIDIA G-SYNC": "Ja",
        "Natives Seitenverh\u00e4ltnis": "16:9",
        "Paketgewicht": "11,4 kg",
        "Panel": "IPS",
        "Panel-Typ": "IPS",
        "Pixel Abstand": "0,2331 x 0,2331 mm",
        "Produktfarbe": "Schwarz",
        "Reaktionszeit": "1 ms",
        "Stromverbrauch (Standardbetrieb)": "51 W",
        "Stromverbrauch (aus)": "0,3 W",
        "Stromverbrauch (max.)": "55 W",
        "Technologie mit hohem Dynamikbereich (HDR)": "High Dynamic Range 10 (HDR10)",
        "Tiefe (ohne Standfu\u00df)": "5,63 cm",
        "Touchscreen": "Nein",
        "VESA Halterung": "100x100 mm",
        "VESA-Halterung": "Ja",
        "Verpackungsbreite": "717 mm",
        "Verpackungsh\u00f6he": "247 mm",
        "Verpackungstiefe": "477 mm",
        "Video Anschl\u00fcsse": "2x HDMI, 1x DisplayPort",
        "Warentarifnummer (HS)": "85285210"
    },
    "raw_specifications_text": "Displaygr\u00f6\u00dfe: 27 Zoll\nAufl\u00f6sung: 2560x1440\nPanel: IPS\nReaktionszeit: 1 ms\nVideo Anschl\u00fcsse: 2x HDMI, 1x DisplayPort\nErgonomie: H\u00f6henverstellbar, Pivot (90 Grad drehbar), Neigbar\nVESA Halterung: 100x100 mm\nHelligkeit: 350 cd/m\u00b2\nHersteller Artikelnummer: 27GN880-B\nEAN: 8806091090881\nArtikelnummer: M15YAHXL\nBildschirmdiagonale: 68,6 cm (27 Zoll)\nDisplay-Aufl\u00f6sung: 2560 x 1440 Pixel\nNatives Seitenverh\u00e4ltnis: 16:9\nBildschirmtechnologie: LED\nTouchscreen: Nein\nHD-Typ: Quad HD\nPanel-Typ: IPS\nBildschirmform: Flach\nKontrastverh\u00e4ltnis: 1000:1\nMaximale Bildwiederholrate: 144 Hz\nAnzahl der Farben des Displays: 1,073 Milliarden Farben\nHelligkeit (typisch): 350 cd/m\u00b2\nBildwinkel, horizontal: 178\u00b0\nBildwinkel, vertikal: 178\u00b0\nPixel Abstand: 0,2331 x 0,2331 mm\nHigh Dynamic Range Video (HDR) Unterst\u00fctzung: Ja\nTechnologie mit hohem Dynamikbereich (HDR): High Dynamic Range 10 (HDR10)\nDDC/CI: Ja\nNVIDIA G-SYNC: Ja\nAMD FreeSync: Ja\nFlimmerfreie Technologie: Ja\nEingebaute Lautsprecher: Nein\nIntegrierte Kamera: Nein\nMarktpositionierung: Gaming\nProduktfarbe: Schwarz\nIntegrierter USB-Hub: Nein\nHDMI: Ja\nKopfh\u00f6rerausgang: Ja\nDVI Anschluss: Nein\nAnzahl HDMI-Anschl\u00fcsse: 2\nAnzahl DisplayPort Anschl\u00fcsse: 1\nDisplayPorts-Version: 1.4\nAudioanschl\u00fcsse: Ja\nVESA-Halterung: Ja\nEnergieeffizienzklasse (SDR): G\nEnergieeffizienzklasse (HDR): G\nEnergieverbrauch (SDR) pro 1.000 Stunden: 30 kWh\nEnergieverbrauch (HDR) pro 1.000 Stunden: 50 kWh\nStromverbrauch (Standardbetrieb): 51 W\nStromverbrauch (max.): 55 W\nStromverbrauch (aus): 0,3 W\nAC Eingangsspannung: 100 - 240 V\nAC Eingangsfrequenz: 50/60 Hz\nEnergieeffizienzskala: A bis G\nGer\u00e4tebreite (inkl. Fu\u00df): 614,2 mm\nGer\u00e4tetiefe (inkl. Fu\u00df): 410,8 mm\nGer\u00e4teh\u00f6he (inkl. Fu\u00df): 619,2 mm\nGewicht (mit St\u00e4nder): 8,1 kg\nBreite (ohne Standfu\u00df): 61,4 cm\nTiefe (ohne Standfu\u00df): 5,63 cm\nH\u00f6he (ohne Standfu\u00df): 36,5 cm\nGewicht (ohne St\u00e4nder): 4,2 kg\nVerpackungsbreite: 717 mm\nVerpackungstiefe: 477 mm\nVerpackungsh\u00f6he: 247 mm\nPaketgewicht: 11,4 kg\nWarentarifnummer (HS): 85285210",
    "reference_file": "offer_reference_1478.json",
    "shop_name": "mylemon.at"
}