{
    "html_file": "offer_363_26.html",
    "name": "LG 27BR550Y-C, 27\"",
    "offer_link": "https://www.alternate.at/LG/27BR550Y-C-LED-Monitor/html/product/1915294?partner=AtGeizhalsat&campaign=Monitor/LG/1915294",
    "price": 186.9,
    "raw_specifications": {
        "": "H\u00f6henverstellbar",
        "Abmessungen": "Breite: 61,17 cm x H\u00f6he: 56,75 cm x Tiefe/L\u00e4nge: 25,6 cm",
        "Anschl\u00fcsse": "1x HDMI-Eingang, (HDMI-Version: 1.4), 1x DisplayPort-Eingang, (DisplayPort-Version: 1.2), 1x Kopfh\u00f6rer-Ausgang, 2x USB-A-3.2 Gen 1 (5 Gbit/s), 1x USB-B-3.2 (5 Gbit/s)",
        "Bild": "Glaretyp",
        "Bildschirmaufl\u00f6sung": "1.920 x 1.080 Pixel",
        "Bildschirmdiagonale": "68,6 cm (27 Zoll)",
        "EAN": "8806091957252",
        "Energieeffizienzklasse (SDR)": "D (A - G)",
        "Energieverbauch pro 1000 Stunden (SDR)": "17 kWh",
        "Ergonomie": "Typ",
        "Farbe": "schwarz (matt)",
        "Geeignet f\u00fcr": "Gaming, Multimedia",
        "Gewicht": "8 kg",
        "Hersteller-Nr.": "27BR550Y-C",
        "Lautsprecher": "2 Lautsprecher",
        "Leistungsaufnahme im Bereitschafts- und Aus-Zustand": "0,5 Watt",
        "Leistungsaufnahme im Ein-Zustand bei Standard-Dynamikumfang (SDR)": "16,6 Watt",
        "Typ": "LED-Monitor",
        "Weitere Informationen": "Ma\u00dfe ohne Standfu\u00df: 611,7 x 364,1 x 50,3 mm (BxHxT) | Gewicht ohne Standfu\u00df: 5200 Gramm | Flicker Safe, Lesemodus, Farbschw\u00e4che, Super Resolution+, Black Stabilizer, Dynamic Action Sync",
        "Zubeh\u00f6r": "Vorhanden"
    },
    "raw_specifications_text": "Energieeffizienzklasse (SDR): D (A - G)\nEnergieverbauch pro 1000 Stunden (SDR): 17 kWh\nLeistungsaufnahme im Ein-Zustand bei Standard-Dynamikumfang (SDR): 16,6 Watt\nLeistungsaufnahme im Bereitschafts- und Aus-Zustand: 0,5 Watt\nBildschirmdiagonale: 68,6 cm (27 Zoll)\nBildschirmaufl\u00f6sung: 1.920 x 1.080 Pixel\nTyp: LED-Monitor\nFarbe: schwarz (matt)\nEAN: 8806091957252\nHersteller-Nr.: 27BR550Y-C\nGeeignet f\u00fcr: Gaming, Multimedia\nBild: Glaretyp\n: H\u00f6henverstellbar\nAnschl\u00fcsse: 1x HDMI-Eingang, (HDMI-Version: 1.4), 1x DisplayPort-Eingang, (DisplayPort-Version: 1.2), 1x Kopfh\u00f6rer-Ausgang, 2x USB-A-3.2 Gen 1 (5 Gbit/s), 1x USB-B-3.2 (5 Gbit/s)\nErgonomie: Typ\nLautsprecher: 2 Lautsprecher\nWeitere Informationen: Ma\u00dfe ohne Standfu\u00df: 611,7 x 364,1 x 50,3 mm (BxHxT) | Gewicht ohne Standfu\u00df: 5200 Gramm | Flicker Safe, Lesemodus, Farbschw\u00e4che, Super Resolution+, Black Stabilizer, Dynamic Action Sync\nZubeh\u00f6r: Vorhanden\nAbmessungen: Breite: 61,17 cm x H\u00f6he: 56,75 cm x Tiefe/L\u00e4nge: 25,6 cm\nGewicht: 8 kg",
    "reference_file": "offer_reference_363.json",
    "shop_name": "Alternate.at"
}