{
    "html_file": "offer_777_5.html",
    "name": "ASUS ProArt PA32DC, 31.5\"",
    "offer_link": "https://www.amazon.de/dp/B0B8SDD6S7?linkCode=xm2&camp=2025&creative=165953&smid=A3JWKAKR8XB7XF&creativeASIN=B0B8SDD6S7&tag=geizhals1-21",
    "price": 3984.1,
    "raw_specifications": {
        "ASIN": "B0B8SDD6S7",
        "Amazon Bestseller-Rang": "Nr. 403,939 in Computer & Zubeh\u00f6r (Siehe Top 100 in Computer & Zubeh\u00f6r)  Nr. 4,459 in Monitore",
        "Anzahl HDMI Schnittstellen": "\u200e3",
        "Artikelgewicht": "\u200e12,1 Kilograms",
        "Batterien enthalten": "\u200eNein",
        "Bildschirmaufl\u00f6sung": "\u200e3820 x 2160",
        "Display-Gr\u00f6\u00dfe": "\u200e31,5 Zoll",
        "Durchschnittliche Kundenbewertung": "3,6  3,6 von 5 Sternen    \n    12 Sternebewertungen   \n\n\n 3,6 von 5 Sternen",
        "Farbe": "\u200eSchwarz",
        "Garantierte Software-Updates bis": "\u200eunbekannt",
        "Hersteller": "\u200eASUS",
        "Im Angebot von Amazon.de seit": "4. August 2022",
        "L\u00f6sung": "\u200e3840 x 2160 Pixels",
        "Marke": "\u200eASUS",
        "Modell/Serie": "\u200ePA32DC",
        "Modellnummer": "\u200ePA32DC",
        "Produktabmessungen": "\u200e50 x 50 x 28 cm; 12,14 Kilogramm",
        "Prozessortyp": "\u200eOthers",
        "Speicher-Art": "\u200eDIMM",
        "Volt": "\u200e240 Volt"
    },
    "raw_specifications_text": "Marke: \u200eASUS\nHersteller: \u200eASUS\nModell/Serie: \u200ePA32DC\nProduktabmessungen: \u200e50 x 50 x 28 cm; 12,14 Kilogramm\nModellnummer: \u200ePA32DC\nFarbe: \u200eSchwarz\nDisplay-Gr\u00f6\u00dfe: \u200e31,5 Zoll\nBildschirmaufl\u00f6sung: \u200e3820 x 2160\nL\u00f6sung: \u200e3840 x 2160 Pixels\nProzessortyp: \u200eOthers\nSpeicher-Art: \u200eDIMM\nAnzahl HDMI Schnittstellen: \u200e3\nVolt: \u200e240 Volt\nBatterien enthalten: \u200eNein\nArtikelgewicht: \u200e12,1 Kilograms\nGarantierte Software-Updates bis: \u200eunbekannt\nASIN: B0B8SDD6S7\nDurchschnittliche Kundenbewertung: 3,6  3,6 von 5 Sternen    \n    12 Sternebewertungen   \n\n\n 3,6 von 5 Sternen\nAmazon Bestseller-Rang: Nr. 403,939 in Computer & Zubeh\u00f6r (Siehe Top 100 in Computer & Zubeh\u00f6r)  Nr. 4,459 in Monitore\nIm Angebot von Amazon.de seit: 4. August 2022",
    "reference_file": "offer_reference_777.json",
    "shop_name": "Amazon.at"
}