{
    "html_file": "offer_2400_5.html",
    "name": "BenQ PD2500Q, 25\"",
    "offer_link": "https://www.amazon.de/dp/B0737M9QP7?linkCode=xm2&camp=2025&creative=165953&smid=A3JWKAKR8XB7XF&creativeASIN=B0737M9QP7&tag=geizhals1-21",
    "price": 234.81,
    "raw_specifications": {
        "ASIN": "B0737M9QP7",
        "Amazon Bestseller-Rang": "Nr. 22,712 in Computer & Zubeh\u00f6r (Siehe Top 100 in Computer & Zubeh\u00f6r)  Nr. 499 in Monitore",
        "Antriebsart": "\u200eHandbetrieben",
        "Anzahl HDMI Schnittstellen": "\u200e1",
        "Anzahl der Lithium-Ionen-Zellen": "\u200e5",
        "Anzahl der Lithium-Metall-Zellen": "\u200e5",
        "Artikelgewicht": "\u200e7,2 Kilograms",
        "Auslaufartikel (Produktion durch Hersteller eingestellt)": "\u200eNein",
        "Batterien": "\u200e1 Lithium-Ionen Batterien erforderlich.",
        "Batterien enthalten": "\u200eNein",
        "Bildschirmaufl\u00f6sung": "\u200e2560 x 1440 pixels",
        "Display-Gr\u00f6\u00dfe": "\u200e25 Zoll",
        "Durchschnittliche Kundenbewertung": "4,6  4,6 von 5 Sternen    \n    7.305 Sternebewertungen   \n\n\n 4,6 von 5 Sternen",
        "Farbe": "\u200eschwarz",
        "Garantierte Software-Updates bis": "\u200eunbekannt",
        "Gewicht Lithium-Akku": "\u200e2 Gramm",
        "Hersteller": "\u200eBENQ",
        "Im Angebot von Amazon.de seit": "26. Juni 2017",
        "Kapazit\u00e4t Lithium-Akku": "\u200e2 Kilowattstunden",
        "L\u00f6sung": "\u200e2560 x 1440 Pixels",
        "Marke": "\u200eBenQ",
        "Modell/Serie": "\u200ePD2500Q",
        "Modellnummer": "\u200ePD2500Q",
        "Produktabmessungen": "\u200e9,45 x 22,44 x 20,87 cm; 7,2 Kilogramm",
        "Prozessortyp": "\u200eOthers",
        "Unterst\u00fctzte Software": "\u200eJa",
        "Volt": "\u200e220 Volt",
        "Watt": "\u200e21"
    },
    "raw_specifications_text": "Marke: \u200eBenQ\nHersteller: \u200eBENQ\nModell/Serie: \u200ePD2500Q\nProduktabmessungen: \u200e9,45 x 22,44 x 20,87 cm; 7,2 Kilogramm\nBatterien: \u200e1 Lithium-Ionen Batterien erforderlich.\nModellnummer: \u200ePD2500Q\nAuslaufartikel (Produktion durch Hersteller eingestellt): \u200eNein\nFarbe: \u200eschwarz\nDisplay-Gr\u00f6\u00dfe: \u200e25 Zoll\nBildschirmaufl\u00f6sung: \u200e2560 x 1440 pixels\nL\u00f6sung: \u200e2560 x 1440 Pixels\nProzessortyp: \u200eOthers\nAnzahl HDMI Schnittstellen: \u200e1\nVolt: \u200e220 Volt\nWatt: \u200e21\nAntriebsart: \u200eHandbetrieben\nUnterst\u00fctzte Software: \u200eJa\nBatterien enthalten: \u200eNein\nKapazit\u00e4t Lithium-Akku: \u200e2 Kilowattstunden\nGewicht Lithium-Akku: \u200e2 Gramm\nAnzahl der Lithium-Ionen-Zellen: \u200e5\nAnzahl der Lithium-Metall-Zellen: \u200e5\nArtikelgewicht: \u200e7,2 Kilograms\nGarantierte Software-Updates bis: \u200eunbekannt\nASIN: B0737M9QP7\nDurchschnittliche Kundenbewertung: 4,6  4,6 von 5 Sternen    \n    7.305 Sternebewertungen   \n\n\n 4,6 von 5 Sternen\nAmazon Bestseller-Rang: Nr. 22,712 in Computer & Zubeh\u00f6r (Siehe Top 100 in Computer & Zubeh\u00f6r)  Nr. 499 in Monitore\nIm Angebot von Amazon.de seit: 26. Juni 2017",
    "reference_file": "offer_reference_2400.json",
    "shop_name": "Amazon.at"
}