{
    "html_file": "offer_286_7.html",
    "name": "LG 27BN65YP-B, 27\"",
    "offer_link": "https://www.proshop.at/Bildschirm/LG-27-Bildschirm-27BN65YP-B-LED-monitor-Full-HD-1080p-27-Black-5-ms/3166067?utm_source=geizhals&utm_medium=cpc&utm_campaign=pricesite",
    "price": 172.78,
    "raw_specifications": {
        "Ausgangsleistung/Kanal": "2 Watt",
        "Besonderheiten": "Multiscan Support, Flicker Safe, Reader Mode, Intelligente Energiespartechnologie, Color Calibrated, Black Stabilizer, DAS Mode (Dynamic Action Sync), My Display Preset, Mega DFC, grenzenlos, Super Resolution+, 6-Achsen-Farbkontrolle",
        "Bildschirmbeschichtung": "Blendfrei, 3H Hard Coating, Haze 25 %",
        "Bildschirmtyp": "IPS",
        "Diagonalabmessung": "68.6 cm (27\")",
        "Display-Typ": "LED-hintergrundbeleuchteter LCD-Monitor / TFT-Aktivmatrix",
        "EAN": "8806091969514",
        "Eingangsanschl\u00fcsse": "HDMI, DVI, DisplayPort",
        "Eingangsspannung": "Wechselstrom 100-240 V (50 - 60 Hz)",
        "Einstellungen der Anzeigeposition": "H\u00f6he, Pivot (Rotation), Drehung, Neigung",
        "Energie Effizienzklasse": "Klasse E",
        "Enthaltene Kabel": "1 x DisplayPort-Kabel - 1.8 m",
        "Farbe": "Mattschwarz",
        "Farbraum": "72% NTSC (CIE 1931)",
        "Ger\u00e4tetyp": "LED-hintergrundbeleuchteter LCD-Monitor - 68.6 cm (27\")",
        "Helligkeit": "250 cd/m\u00b2",
        "Hersteller": "LG",
        "Hintergrundbeleuchtungs-Technologie": "WLED",
        "Horizontale Bildwiederholrate": "50 - 61 kHz",
        "Horizontaler Betrachtungswinkel": "178",
        "H\u00f6heneinstellung": "130 mm",
        "Integrierte Peripherieger\u00e4te": "USB 3.0-Hub",
        "Kennzeichnung": "FCC Klasse B bescheinigt, UL, CB, RoHS, REACH, ERP, VESA DDCCi, DIN ISO EN 9241-307, quecksilberfrei, TUV-GS, TUV-Ergo",
        "Kontrast": "1000:1",
        "Leistungsmerkmale": "Slot f\u00fcr Sicherheitsschloss (Kabelschloss getrennt erh\u00e4ltlich), abnehmbarer Standfu\u00df",
        "Mitgelieferte Software": "LG On-Screen Control",
        "Modell": "27BN65YP-B",
        "Native Aufl\u00f6sung": "Full HD (1080p) 1920 x 1080 bei 75 Hz",
        "Neigungswinkel": "-5/+35",
        "Pixelpitch": "0.3114 mm",
        "Produktbeschreibung": "LG 27BN65YP-B - LED-Monitor - Full HD (1080p) - 68.6 cm (27\")",
        "Reaktionszeit": "5 ms (Gray-to-Gray)",
        "Schlosstyp zur Diebstahlsicherung": "Kensington Slot",
        "Schnittstellen": "DVI  HDMI  USB 3.0 Upstream  USB 3.0 Upstream  Kopfh\u00f6rer  2 x USB 3.0 Downstream",
        "Schwenkwinkel": "355",
        "Seitenverh\u00e4ltnis": "16:9",
        "Spannung": "Wechselstrom 100-240 V (50 - 60 Hz)",
        "Stromverbrauch (Aus-Modus)": "0.3 Watt",
        "Stromverbrauch SDR (eingeschaltet)": "21 kWh/1.000 h",
        "Stromverbrauch im Standby-Modus": "0.3 Watt",
        "TCO-zertifiziert": "TCO Certified Displays 9",
        "Typ": "Lautsprecher - Stereo",
        "Umweltschutzstandards": "TCO Certified Displays 9",
        "VESA-Halterung": "100 x 100 mm",
        "Vertikale Bildwiederholrate": "56 - 75 Hz",
        "Vertikaler Betrachtungswinkel": "178",
        "Waren-Nr.": "3166067",
        "Zum Hersteller": "www.lge.com"
    },
    "raw_specifications_text": "Hersteller: LG\nWaren-Nr.: 3166067\nModell: 27BN65YP-B\nEAN: 8806091969514\nZum Hersteller: www.lge.com\nProduktbeschreibung: LG 27BN65YP-B - LED-Monitor - Full HD (1080p) - 68.6 cm (27\")\nGer\u00e4tetyp: LED-hintergrundbeleuchteter LCD-Monitor - 68.6 cm (27\")\nEnergie Effizienzklasse: Klasse E\nLeistungsmerkmale: Slot f\u00fcr Sicherheitsschloss (Kabelschloss getrennt erh\u00e4ltlich), abnehmbarer Standfu\u00df\nBildschirmtyp: IPS\nSeitenverh\u00e4ltnis: 16:9\nNative Aufl\u00f6sung: Full HD (1080p) 1920 x 1080 bei 75 Hz\nPixelpitch: 0.3114 mm\nHelligkeit: 250 cd/m\u00b2\nKontrast: 1000:1\nReaktionszeit: 5 ms (Gray-to-Gray)\nFarbraum: 72% NTSC (CIE 1931)\nEingangsanschl\u00fcsse: HDMI, DVI, DisplayPort\nEinstellungen der Anzeigeposition: H\u00f6he, Pivot (Rotation), Drehung, Neigung\nBildschirmbeschichtung: Blendfrei, 3H Hard Coating, Haze 25 %\nSpannung: Wechselstrom 100-240 V (50 - 60 Hz)\nFarbe: Mattschwarz\nUmweltschutzstandards: TCO Certified Displays 9\nKennzeichnung: FCC Klasse B bescheinigt, UL, CB, RoHS, REACH, ERP, VESA DDCCi, DIN ISO EN 9241-307, quecksilberfrei, TUV-GS, TUV-Ergo\nDisplay-Typ: LED-hintergrundbeleuchteter LCD-Monitor / TFT-Aktivmatrix\nDiagonalabmessung: 68.6 cm (27\")\nIntegrierte Peripherieger\u00e4te: USB 3.0-Hub\nVertikale Bildwiederholrate: 56 - 75 Hz\nHorizontale Bildwiederholrate: 50 - 61 kHz\nHorizontaler Betrachtungswinkel: 178\nVertikaler Betrachtungswinkel: 178\nHintergrundbeleuchtungs-Technologie: WLED\nBesonderheiten: Multiscan Support, Flicker Safe, Reader Mode, Intelligente Energiespartechnologie, Color Calibrated, Black Stabilizer, DAS Mode (Dynamic Action Sync), My Display Preset, Mega DFC, grenzenlos, Super Resolution+, 6-Achsen-Farbkontrolle\nTyp: Lautsprecher - Stereo\nAusgangsleistung/Kanal: 2 Watt\nSchnittstellen: DVI  HDMI  USB 3.0 Upstream  USB 3.0 Upstream  Kopfh\u00f6rer  2 x USB 3.0 Downstream\nNeigungswinkel: -5/+35\nSchwenkwinkel: 355\nH\u00f6heneinstellung: 130 mm\nVESA-Halterung: 100 x 100 mm\nEnthaltene Kabel: 1 x DisplayPort-Kabel - 1.8 m\nSchlosstyp zur Diebstahlsicherung: Kensington Slot\nEingangsspannung: Wechselstrom 100-240 V (50 - 60 Hz)\nStromverbrauch SDR (eingeschaltet): 21 kWh/1.000 h\nStromverbrauch im Standby-Modus: 0.3 Watt\nStromverbrauch (Aus-Modus): 0.3 Watt\nMitgelieferte Software: LG On-Screen Control\nTCO-zertifiziert: TCO Certified Displays 9",
    "reference_file": "offer_reference_286.json",
    "shop_name": "Proshop.at"
}