{
    "html_file": "offer_1799_3.html",
    "name": "LG 35BN77C-B, 35\"",
    "offer_link": "https://www.mylemon.at/artikel/lg/35bn77c_b/lcd-35bn77c-b-35-black.html",
    "price": 547.42,
    "raw_specifications": {
        "AC Eingangsfrequenz": "50/60 Hz",
        "AC Eingangsspannung": "100 - 240 V",
        "AMD FreeSync": "Ja",
        "Anzahl DisplayPort Anschl\u00fcsse": "1",
        "Anzahl HDMI-Anschl\u00fcsse": "2",
        "Anzahl der Farben des Displays": "1,073 Milliarden Farben",
        "Anzahl der nachgeschalteten Ports vom Typ USB-C": "2",
        "Anzahl der vorgeschalteten Steckpl\u00e4tze": "1",
        "Artikelnummer": "M11YPQOL",
        "Aufl\u00f6sung": "3440x1440",
        "Bildschirmdiagonale": "88,9 cm (35 Zoll)",
        "Bildschirmform": "Gebogen",
        "Bildschirmtechnologie": "LCD",
        "Bildwinkel, horizontal": "178\u00b0",
        "Bildwinkel, vertikal": "178\u00b0",
        "Digital vertikale Frequenz": "48 - 100 Hz",
        "Display-Aufl\u00f6sung": "3440 x 1440 Pixel",
        "Displaygr\u00f6\u00dfe": "35 Zoll",
        "EAN": "8806091075703",
        "Eingebaute Lautsprecher": "Ja",
        "Energieeffizienzklasse (HDR)": "G",
        "Energieeffizienzklasse (SDR)": "G",
        "Energieeffizienzskala": "A bis G",
        "Energieverbrauch (HDR) pro 1.000 Stunden": "45 kWh",
        "Energieverbrauch (SDR) pro 1.000 Stunden": "39 kWh",
        "HD-Typ": "Quad HD+",
        "HDMI": "Ja",
        "Helligkeit (typisch)": "300 cd/m\u00b2",
        "Hersteller Artikelnummer": "35BN77C-B",
        "H\u00f6heneinstellung": "15 cm",
        "H\u00f6henverstellung": "Ja",
        "Integrierter USB-Hub": "Ja",
        "Kontrastverh\u00e4ltnis": "2500:1",
        "Kopfh\u00f6rerausgang": "Ja",
        "Marktpositionierung": "Business",
        "Maximale Bildwiederholrate": "100 Hz",
        "Mitgelieferte Kabel": "AC, DisplayPort, USB",
        "Nachhaltigkeitszertifikate": "ENERGY STAR",
        "Natives Seitenverh\u00e4ltnis": "21:9",
        "Neigungsverstellung": "Ja",
        "Neigungswinkelbereich": "-5 - 15\u00b0",
        "On-Screen-Display (OSD)": "Ja",
        "Panel": "VA",
        "Panel-Typ": "VA",
        "Pivot": "Ja",
        "Pivot Winkel": "-45 - 45\u00b0",
        "Produktfarbe": "Schwarz",
        "RMS-Leistung": "7 W",
        "Reaktionszeit": "5 ms",
        "Stromverbrauch (Standardbetrieb)": "35 W",
        "Stromverbrauch (Standby)": "0,5 W",
        "Stromverbrauch (aus)": "0,3 W",
        "St\u00e4nder enthalten": "Ja",
        "Touchscreen": "Nein",
        "Typ der Hintergrundbeleuchtung": "W-LED",
        "USB-Upstream-Porttyp": "USB Typ-C",
        "Unterst\u00fctzte Grafik-Aufl\u00f6sungen": "3440 x 1440",
        "VESA-Halterung": "Ja",
        "Verpackungsart": "Box",
        "Video Anschl\u00fcsse": "2x HDMI, 1x DisplayPort",
        "Warentarifnummer (HS)": "85285210"
    },
    "raw_specifications_text": "Displaygr\u00f6\u00dfe: 35 Zoll\nAufl\u00f6sung: 3440x1440\nPanel: VA\nReaktionszeit: 5 ms\nVideo Anschl\u00fcsse: 2x HDMI, 1x DisplayPort\nHersteller Artikelnummer: 35BN77C-B\nEAN: 8806091075703\nArtikelnummer: M11YPQOL\nBildschirmdiagonale: 88,9 cm (35 Zoll)\nDisplay-Aufl\u00f6sung: 3440 x 1440 Pixel\nNatives Seitenverh\u00e4ltnis: 21:9\nBildschirmtechnologie: LCD\nTouchscreen: Nein\nHD-Typ: Quad HD+\nPanel-Typ: VA\nBildschirmform: Gebogen\nKontrastverh\u00e4ltnis: 2500:1\nMaximale Bildwiederholrate: 100 Hz\nAnzahl der Farben des Displays: 1,073 Milliarden Farben\nTyp der Hintergrundbeleuchtung: W-LED\nHelligkeit (typisch): 300 cd/m\u00b2\nUnterst\u00fctzte Grafik-Aufl\u00f6sungen: 3440 x 1440\nBildwinkel, horizontal: 178\u00b0\nBildwinkel, vertikal: 178\u00b0\nDigital vertikale Frequenz: 48 - 100 Hz\nAMD FreeSync: Ja\nEingebaute Lautsprecher: Ja\nRMS-Leistung: 7 W\nMarktpositionierung: Business\nProduktfarbe: Schwarz\nIntegrierter USB-Hub: Ja\nHDMI: Ja\nKopfh\u00f6rerausgang: Ja\nUSB-Upstream-Porttyp: USB Typ-C\nAnzahl der vorgeschalteten Steckpl\u00e4tze: 1\nAnzahl der nachgeschalteten Ports vom Typ USB-C: 2\nAnzahl HDMI-Anschl\u00fcsse: 2\nAnzahl DisplayPort Anschl\u00fcsse: 1\nVESA-Halterung: Ja\nH\u00f6henverstellung: Ja\nH\u00f6heneinstellung: 15 cm\nPivot: Ja\nPivot Winkel: -45 - 45\u00b0\nNeigungswinkelbereich: -5 - 15\u00b0\nOn-Screen-Display (OSD): Ja\nNeigungsverstellung: Ja\nEnergieeffizienzklasse (SDR): G\nEnergieeffizienzklasse (HDR): G\nEnergieverbrauch (SDR) pro 1.000 Stunden: 39 kWh\nEnergieverbrauch (HDR) pro 1.000 Stunden: 45 kWh\nStromverbrauch (Standardbetrieb): 35 W\nStromverbrauch (Standby): 0,5 W\nStromverbrauch (aus): 0,3 W\nAC Eingangsspannung: 100 - 240 V\nAC Eingangsfrequenz: 50/60 Hz\nEnergieeffizienzskala: A bis G\nSt\u00e4nder enthalten: Ja\nMitgelieferte Kabel: AC, DisplayPort, USB\nVerpackungsart: Box\nNachhaltigkeitszertifikate: ENERGY STAR\nWarentarifnummer (HS): 85285210",
    "reference_file": "offer_reference_1799.json",
    "shop_name": "mylemon.at"
}