{
    "html_file": "offer_775_28.html",
    "name": "Acer CB2 CBA242YAbmirx, 23.8\"",
    "offer_link": "https://www.taufnaus.de/product/10603243",
    "price": 132.46,
    "raw_specifications": {
        "Abmessungen (Breite x Tiefe x H\u00f6he)": "54.02 cm x 23.365 cm x 37.71 cm - mit Standfu\u00df (niedrigste Position)",
        "Adaptive-Sync Technologie": "AMD FreeSync",
        "Ausgangsleistung/Kanal": "2 Watt",
        "Besonderheiten": "Acer Adaptive Contrast Management (ACM), ComfyView, Zero Frame, Flimmerfrei-Technologie, Abblend-Technologie, Acer BluelightShield-Technologie, an 3 Seiten ohne Blende",
        "Bildschirmbeschichtung": "Blendfrei",
        "Bildschirmtyp": "VA",
        "Details zu Abmessungen & Gewicht": "Mit Standfu\u00df (niedrigste Position) - Breite: 54.02 cm - Tiefe: 23.365 cm - H\u00f6he: 37.71 cm - Gewicht: 4.91 kg",
        "Diagonalabmessung": "60.5 cm (23.8\")",
        "Display-Typ": "LCD-Monitor / TFT-Aktivmatrix",
        "Eingangsspannung": "Wechselstrom 100-240 V (50/60 Hz)",
        "Einstellungen der Anzeigeposition": "H\u00f6he, Pivot (Rotation), Drehung, Neigung",
        "Energie Effizienzklasse": "Klasse E",
        "Energierverbrauch Sleep": "0.5 Watt",
        "Enthaltene Kabel": "1 x HDMI-Kabel",
        "Farbe": "Schwarz",
        "Farbunterst\u00fctzung": "16,7 Millionen Farben",
        "Gewicht": "4.91 kg",
        "Helligkeit": "250 cd/m\u00b2",
        "Horizontale Bildwiederholrate": "30 - 85 kHz",
        "Horizontaler Betrachtungswinkel": "178",
        "H\u00f6heneinstellung": "120 mm",
        "Kennzeichnung": "MPR II",
        "Kontrast": "100000000:1 (dynamisch)",
        "Leistungsaufnahme im Ein-Zustand": "22 W",
        "Leistungsmerkmale": "Unterst\u00fctzung f\u00fcr VESA-Schnittstelle",
        "Max. Betriebstemperatur": "40 \u00b0C",
        "Min Betriebstemperatur": "0 \u00b0C",
        "Native Aufl\u00f6sung": "Full HD (1080p) 1920 x 1080 bei 75 Hz",
        "Neigungswinkel": "-5/+20",
        "Pixelpitch": "0.2745 mm",
        "Reaktionszeit": "1 ms (VRB)",
        "Rotationswinkel": "180",
        "Schnittstellen": "HDMI \u00a6 VGA \u00a6 Audio Line-Out \u00a6 Audio Line-In",
        "Schwenkwinkel": "360",
        "Seitenverh\u00e4ltnis": "16:9",
        "Stromverbrauch (Aus-Modus)": "0.3 Watt",
        "Stromverbrauch SDR (eingeschaltet)": "18 kWh/1.000 h",
        "Typ": "Lautsprecher - Stereo",
        "VESA-Halterung": "100 x 100 mm",
        "Vertikale Bildwiederholrate": "56 - 76 Hz",
        "Vertikaler Betrachtungswinkel": "178",
        "Zul\u00e4ssige Luftfeuchtigkeit im Betrieb": "20 - 80%"
    },
    "raw_specifications_text": "Display-Typ: LCD-Monitor / TFT-Aktivmatrix\nEnergie Effizienzklasse: Klasse E\nDiagonalabmessung: 60.5 cm (23.8\")\nAdaptive-Sync Technologie: AMD FreeSync\nBildschirmtyp: VA\nSeitenverh\u00e4ltnis: 16:9\nNative Aufl\u00f6sung: Full HD (1080p) 1920 x 1080 bei 75 Hz\nPixelpitch: 0.2745 mm\nHelligkeit: 250 cd/m\u00b2\nKontrast: 100000000:1 (dynamisch)\nFarbunterst\u00fctzung: 16,7 Millionen Farben\nReaktionszeit: 1 ms (VRB)\nVertikale Bildwiederholrate: 56 - 76 Hz\nHorizontale Bildwiederholrate: 30 - 85 kHz\nHorizontaler Betrachtungswinkel: 178\nVertikaler Betrachtungswinkel: 178\nBildschirmbeschichtung: Blendfrei\nBesonderheiten: Acer Adaptive Contrast Management (ACM), ComfyView, Zero Frame, Flimmerfrei-Technologie, Abblend-Technologie, Acer BluelightShield-Technologie, an 3 Seiten ohne Blende\nFarbe: Schwarz\nAbmessungen (Breite x Tiefe x H\u00f6he): 54.02 cm x 23.365 cm x 37.71 cm - mit Standfu\u00df (niedrigste Position)\nGewicht: 4.91 kg\nTyp: Lautsprecher - Stereo\nAusgangsleistung/Kanal: 2 Watt\nSchnittstellen: HDMI \u00a6 VGA \u00a6 Audio Line-Out \u00a6 Audio Line-In\nEinstellungen der Anzeigeposition: H\u00f6he, Pivot (Rotation), Drehung, Neigung\nNeigungswinkel: -5/+20\nSchwenkwinkel: 360\nRotationswinkel: 180\nH\u00f6heneinstellung: 120 mm\nVESA-Halterung: 100 x 100 mm\nLeistungsmerkmale: Unterst\u00fctzung f\u00fcr VESA-Schnittstelle\nEnthaltene Kabel: 1 x HDMI-Kabel\nKennzeichnung: MPR II\nEingangsspannung: Wechselstrom 100-240 V (50/60 Hz)\nLeistungsaufnahme im Ein-Zustand: 22 W\nStromverbrauch SDR (eingeschaltet): 18 kWh/1.000 h\nEnergierverbrauch Sleep: 0.5 Watt\nStromverbrauch (Aus-Modus): 0.3 Watt\nDetails zu Abmessungen & Gewicht: Mit Standfu\u00df (niedrigste Position) - Breite: 54.02 cm - Tiefe: 23.365 cm - H\u00f6he: 37.71 cm - Gewicht: 4.91 kg\nMin Betriebstemperatur: 0 \u00b0C\nMax. Betriebstemperatur: 40 \u00b0C\nZul\u00e4ssige Luftfeuchtigkeit im Betrieb: 20 - 80%",
    "reference_file": "offer_reference_775.json",
    "shop_name": "TaufNaus"
}