{
    "html_file": "offer_1455_12.html",
    "name": "Dell UltraSharp U2422H, 23.8\"",
    "offer_link": "https://www.alternate.at/Dell/UltraSharp-U2422H-LED-Monitor/html/product/1750810?partner=AtGeizhalsat&campaign=Monitor/Dell/1750810",
    "price": 222.9,
    "raw_specifications": {
        "": "TCO-Norm",
        "Anschl\u00fcsse": "1x HDMI-Eingang, (HDMI-Version: 1.4), 1x DisplayPort-Eingang, 1x DisplayPort-Ausgang, (DisplayPort-Version: 1.4), 1x 3,5-mm-Audio-Ausgang, 3x USB-A-3.2 Gen 2 (10 Gbit/s), 2x USB-C 3.2 Gen 1 (5 Gbit/s)",
        "Bild": "Format",
        "Bildschirmaufl\u00f6sung": "1.920 x 1.080 Pixel",
        "Bildschirmdiagonale": "61 cm (24 Zoll)",
        "EAN": "5397184504970",
        "Energieeffizienzklasse (SDR)": "C (A - G)",
        "Energieverbauch pro 1000 Stunden (SDR)": "12 kWh",
        "Ergonomie": "Typ",
        "Farbe": "silber",
        "Geeignet f\u00fcr": "Multimedia",
        "Hersteller-Nr.": "210-AYUI",
        "Leistungsaufnahme im Bereitschafts- und Aus-Zustand": "0,3 Watt",
        "Leistungsaufnahme im Ein-Zustand bei Standard-Dynamikumfang (SDR)": "11,6 Watt",
        "Stromversorgung": "Eco-Off",
        "Typ": "LED-Monitor"
    },
    "raw_specifications_text": "Energieeffizienzklasse (SDR): C (A - G)\nEnergieverbauch pro 1000 Stunden (SDR): 12 kWh\nLeistungsaufnahme im Ein-Zustand bei Standard-Dynamikumfang (SDR): 11,6 Watt\nLeistungsaufnahme im Bereitschafts- und Aus-Zustand: 0,3 Watt\nBildschirmdiagonale: 61 cm (24 Zoll)\nBildschirmaufl\u00f6sung: 1.920 x 1.080 Pixel\nTyp: LED-Monitor\nFarbe: silber\nEAN: 5397184504970\nHersteller-Nr.: 210-AYUI\nGeeignet f\u00fcr: Multimedia\nBild: Format\n: TCO-Norm\nAnschl\u00fcsse: 1x HDMI-Eingang, (HDMI-Version: 1.4), 1x DisplayPort-Eingang, 1x DisplayPort-Ausgang, (DisplayPort-Version: 1.4), 1x 3,5-mm-Audio-Ausgang, 3x USB-A-3.2 Gen 2 (10 Gbit/s), 2x USB-C 3.2 Gen 1 (5 Gbit/s)\nErgonomie: Typ\nStromversorgung: Eco-Off",
    "reference_file": "offer_reference_1455.json",
    "shop_name": "Alternate.at"
}