{
    "html_file": "offer_2151_33.html",
    "name": "Eizo ColorEdge CS2731, 27\"",
    "offer_link": "https://www.proshop.at/Bildschirm/EIZO-27-Bildschirm-ColorEdge-CS2731-Black-10-ms/2855600?utm_source=geizhals&utm_medium=cpc&utm_campaign=pricesite",
    "price": 1111.7,
    "raw_specifications": {
        "Abmessungen (Breite x Tiefe x H\u00f6he)": "63.8 cm x 26.5 cm x 40.41 cm - mit Fu\u00df",
        "Abmessungen (Breite x Tiefe x H\u00f6he) - mit Fu\u00df": "63.8 cm x 26.5 cm x 40.41 cm",
        "Besonderheiten": "HDCP, Digital Uniformity Equalizer (DUE), gro\u00dfe Farbskala, Farbanpassungsmodus, Custom Key, Power Saving Mode",
        "Bildschirmbeschichtung": "Blendfrei",
        "Bildschirmtyp": "IPS",
        "Details zu Abmessungen & Gewicht": "Mit Fu\u00df - Breite: 63.8 cm - Tiefe: 26.5 cm - H\u00f6he: 40.41 cm - Gewicht: 10.1 kg  Ohne Fu\u00df - Breite: 63.8 cm - Tiefe: 7.5 cm - H\u00f6he: 37.82 cm - Gewicht: 6.5 kg",
        "Diagonalabmessung": "68.5 cm (27\")",
        "Display-Typ": "LED-hintergrundbeleuchteter LCD-Monitor / TFT-Aktivmatrix",
        "EAN": "4995047055709",
        "Eingangsanschl\u00fcsse": "DisplayPort, HDMI, DVI-D, USB-C",
        "Eingangsspannung": "Wechselstrom 120/230 V (50/60 Hz)",
        "Einstellungen der Anzeigeposition": "H\u00f6he, Pivot (Rotation), Drehung, Neigung",
        "Energie Effizienzklasse": "Klasse G",
        "Enthaltene Kabel": "1 x USB-C Kabel - 2 m  1 x HDMI-Kabel - 2 m  1 x USB-Kabel",
        "Farbe": "Schwarz",
        "Farbraum": "99% Adobe RGB",
        "Farbunterst\u00fctzung": "1,07 Mrd. Farben",
        "Ger\u00e4tetyp": "LED-hintergrundbeleuchteter LCD-Monitor - 68.5 cm (27\")",
        "Gewicht": "10.1 kg",
        "Helligkeit": "350 cd/m\u00b2",
        "Hersteller": "EIZO",
        "Hintergrundbeleuchtungs-Technologie": "LED-Hintergrundbeleuchtung",
        "Horizontale Bildwiederholrate": "15 - 89 kHz",
        "Horizontaler Betrachtungswinkel": "178",
        "H\u00f6heneinstellung": "155 mm",
        "Integrierte Peripherieger\u00e4te": "USB 3.1 Gen.1 Hub",
        "Kennzeichnung": "FCC Klasse B bescheinigt, TUV GS, TUV S, CB, TUV Ergo, RoHS, WEEE, PSE Mark, cTUVus, VCCI Class B, EAC, RCM, CAN ICES-3 Class B",
        "Kontrast": "1000:1",
        "Leistungsaufnahme im Ein-Zustand": "35.7 W",
        "Leistungsmerkmale": "Hoch-/Querformatmodus, abnehmbarer St\u00e4nder",
        "Mitgelieferte Software": "EIZO Quick Color Match, EIZO ColorNavigator 7",
        "Modell": "CS2731CAL",
        "Native Aufl\u00f6sung": "WQHD 2560 x 1440 bei 61 Hz",
        "Neigungswinkel": "-5/+35",
        "OSD-Sprachen": "Chinesisch (tradionell), Chinesisch (vereinfacht), Englisch, Deutsch, Franz\u00f6sisch, Italienisch, Schwedisch, Spanisch, Japanisch",
        "Pixelpitch": "0.233 mm",
        "Ppi": "109",
        "Produktbeschreibung": "EIZO ColorEdge CS2731 - LED-Monitor - 68.5 cm (27\")",
        "Reaktionszeit": "10 ms (Gray-to-Gray)",
        "Rotationswinkel": "90",
        "Schnittstellen": "USB-C (HDCP 1.3)  DisplayPort (HDCP 1.3)  HDMI (HDCP 1.4)  USB-C 3.1 Gen 1 Upstream/DisplayPort Alt Mode mit Spannungsversorgung (bis zu 60 W)  USB 3.1 Gen 1 Upstream (Typ B)  2 x USB 3.1 Gen 1 Downstream  2 x USB 2.0 Downstream  DVI-D (HDCP 1.4)",
        "Schwenkwinkel": "344",
        "Seitenverh\u00e4ltnis": "16:9",
        "Spannung": "Wechselstrom 120/230 V (50/60 Hz)",
        "Stromverbrauch (typisch)": "34 Watt",
        "Stromverbrauch SDR (eingeschaltet)": "35.7 kWh/1.000 h",
        "Stromverbrauch im Standby-Modus": "1 Watt",
        "USB-Spannungsversorgung": "60 Watt",
        "VESA-Halterung": "100 x 100 mm",
        "Vertikale Bildwiederholrate": "23 - 61 Hz",
        "Vertikaler Betrachtungswinkel": "178",
        "Waren-Nr.": "2855600",
        "Zubeh\u00f6r im Lieferumfang": "Kalibrierungseinheit",
        "Zum Hersteller": "www.eizo.com"
    },
    "raw_specifications_text": "Hersteller: EIZO\nWaren-Nr.: 2855600\nModell: CS2731CAL\nEAN: 4995047055709\nZum Hersteller: www.eizo.com\nProduktbeschreibung: EIZO ColorEdge CS2731 - LED-Monitor - 68.5 cm (27\")\nGer\u00e4tetyp: LED-hintergrundbeleuchteter LCD-Monitor - 68.5 cm (27\")\nEnergie Effizienzklasse: Klasse G\nLeistungsaufnahme im Ein-Zustand: 35.7 W\nLeistungsmerkmale: Hoch-/Querformatmodus, abnehmbarer St\u00e4nder\nBildschirmtyp: IPS\nSeitenverh\u00e4ltnis: 16:9\nNative Aufl\u00f6sung: WQHD 2560 x 1440 bei 61 Hz\nPixelpitch: 0.233 mm\nHelligkeit: 350 cd/m\u00b2\nKontrast: 1000:1\nReaktionszeit: 10 ms (Gray-to-Gray)\nFarbunterst\u00fctzung: 1,07 Mrd. Farben\nFarbraum: 99% Adobe RGB\nEingangsanschl\u00fcsse: DisplayPort, HDMI, DVI-D, USB-C\nEinstellungen der Anzeigeposition: H\u00f6he, Pivot (Rotation), Drehung, Neigung\nBildschirmbeschichtung: Blendfrei\nSpannung: Wechselstrom 120/230 V (50/60 Hz)\nFarbe: Schwarz\nAbmessungen (Breite x Tiefe x H\u00f6he) - mit Fu\u00df: 63.8 cm x 26.5 cm x 40.41 cm\nGewicht: 10.1 kg\nKennzeichnung: FCC Klasse B bescheinigt, TUV GS, TUV S, CB, TUV Ergo, RoHS, WEEE, PSE Mark, cTUVus, VCCI Class B, EAC, RCM, CAN ICES-3 Class B\nDisplay-Typ: LED-hintergrundbeleuchteter LCD-Monitor / TFT-Aktivmatrix\nDiagonalabmessung: 68.5 cm (27\")\nIntegrierte Peripherieger\u00e4te: USB 3.1 Gen.1 Hub\nUSB-Spannungsversorgung: 60 Watt\nPpi: 109\nVertikale Bildwiederholrate: 23 - 61 Hz\nHorizontale Bildwiederholrate: 15 - 89 kHz\nHorizontaler Betrachtungswinkel: 178\nVertikaler Betrachtungswinkel: 178\nHintergrundbeleuchtungs-Technologie: LED-Hintergrundbeleuchtung\nOSD-Sprachen: Chinesisch (tradionell), Chinesisch (vereinfacht), Englisch, Deutsch, Franz\u00f6sisch, Italienisch, Schwedisch, Spanisch, Japanisch\nBesonderheiten: HDCP, Digital Uniformity Equalizer (DUE), gro\u00dfe Farbskala, Farbanpassungsmodus, Custom Key, Power Saving Mode\nAbmessungen (Breite x Tiefe x H\u00f6he): 63.8 cm x 26.5 cm x 40.41 cm - mit Fu\u00df\nSchnittstellen: USB-C (HDCP 1.3)  DisplayPort (HDCP 1.3)  HDMI (HDCP 1.4)  USB-C 3.1 Gen 1 Upstream/DisplayPort Alt Mode mit Spannungsversorgung (bis zu 60 W)  USB 3.1 Gen 1 Upstream (Typ B)  2 x USB 3.1 Gen 1 Downstream  2 x USB 2.0 Downstream  DVI-D (HDCP 1.4)\nNeigungswinkel: -5/+35\nSchwenkwinkel: 344\nRotationswinkel: 90\nH\u00f6heneinstellung: 155 mm\nVESA-Halterung: 100 x 100 mm\nZubeh\u00f6r im Lieferumfang: Kalibrierungseinheit\nEnthaltene Kabel: 1 x USB-C Kabel - 2 m  1 x HDMI-Kabel - 2 m  1 x USB-Kabel\nEingangsspannung: Wechselstrom 120/230 V (50/60 Hz)\nStromverbrauch SDR (eingeschaltet): 35.7 kWh/1.000 h\nStromverbrauch (typisch): 34 Watt\nStromverbrauch im Standby-Modus: 1 Watt\nMitgelieferte Software: EIZO Quick Color Match, EIZO ColorNavigator 7\nDetails zu Abmessungen & Gewicht: Mit Fu\u00df - Breite: 63.8 cm - Tiefe: 26.5 cm - H\u00f6he: 40.41 cm - Gewicht: 10.1 kg  Ohne Fu\u00df - Breite: 63.8 cm - Tiefe: 7.5 cm - H\u00f6he: 37.82 cm - Gewicht: 6.5 kg",
    "reference_file": "offer_reference_2151.json",
    "shop_name": "Proshop.at"
}