{
    "html_file": "offer_959_1.html",
    "name": "AOC Porsche Design Agon Pro PD32M, 32\"",
    "offer_link": "https://www.alternate.at/AOC/AGON-PD32M-Gaming-Monitor/html/product/1878879?partner=AtGeizhalsat&campaign=Monitor/AOC/1878879",
    "price": 1919.0,
    "raw_specifications": {
        "": "VESA DisplayHDR Standard",
        "Abmessungen": "Breite: 71,52 cm x H\u00f6he: 61,25 cm x Tiefe/L\u00e4nge: 29,01 cm",
        "Anschl\u00fcsse": "2x HDMI-Eingang, (HDMI-Version: 2.1), 1x DisplayPort-Eingang, (DisplayPort-Version: 1.4), 1x 3,5-mm-Audio-Ausgang, 4x USB-A-3.2 Gen 1 (5 Gbit/s)",
        "Bild": "Format",
        "Bildschirmaufl\u00f6sung": "3.840 x 2.160 Pixel",
        "Bildschirmdiagonale": "80 cm (32 Zoll)",
        "EAN": "4038986119801",
        "Energieeffizienzklasse (HDR)": "G (A - G)",
        "Energieeffizienzklasse (SDR)": "G (A - G)",
        "Energieverbauch pro 1000 Stunden (HDR)": "102 kWh",
        "Energieverbauch pro 1000 Stunden (SDR)": "82 kWh",
        "Ergonomie": "Typ",
        "Farbe": "schwarz/silber",
        "Features": "90 Watt USB Power Delivery, Low Blue Light",
        "Frequenz": "Vertikal",
        "Geeignet f\u00fcr": "Gaming",
        "Hersteller-Nr.": "PD32M",
        "Lautsprecher": "2 Lautsprecher",
        "Leistungsaufnahme im Bereitschafts- und Aus-Zustand": "0,4 Watt",
        "Leistungsaufnahme im Ein-Zustand bei Standard-Dynamikumfang (SDR)": "82 Watt",
        "Leistungsaufnahme im Ein-Zustand bei hohem Dynamikumfang (HDR)": "102 Watt",
        "Standards": "Video",
        "Stromversorgung": "Eco-Off",
        "Typ": "Gaming-Monitor",
        "Wandhalterung": "VESA kompatibel (100 x 100 mm)",
        "Zubeh\u00f6r": "Vorhanden"
    },
    "raw_specifications_text": "Energieeffizienzklasse (SDR): G (A - G)\nEnergieverbauch pro 1000 Stunden (SDR): 82 kWh\nEnergieeffizienzklasse (HDR): G (A - G)\nEnergieverbauch pro 1000 Stunden (HDR): 102 kWh\nLeistungsaufnahme im Ein-Zustand bei Standard-Dynamikumfang (SDR): 82 Watt\nLeistungsaufnahme im Ein-Zustand bei hohem Dynamikumfang (HDR): 102 Watt\nLeistungsaufnahme im Bereitschafts- und Aus-Zustand: 0,4 Watt\nBildschirmdiagonale: 80 cm (32 Zoll)\nBildschirmaufl\u00f6sung: 3.840 x 2.160 Pixel\nTyp: Gaming-Monitor\nFarbe: schwarz/silber\nEAN: 4038986119801\nHersteller-Nr.: PD32M\nGeeignet f\u00fcr: Gaming\nBild: Format\n: VESA DisplayHDR Standard\nFrequenz: Vertikal\nAnschl\u00fcsse: 2x HDMI-Eingang, (HDMI-Version: 2.1), 1x DisplayPort-Eingang, (DisplayPort-Version: 1.4), 1x 3,5-mm-Audio-Ausgang, 4x USB-A-3.2 Gen 1 (5 Gbit/s)\nErgonomie: Typ\nStromversorgung: Eco-Off\nLautsprecher: 2 Lautsprecher\nStandards: Video\nWandhalterung: VESA kompatibel (100 x 100 mm)\nFeatures: 90 Watt USB Power Delivery, Low Blue Light\nZubeh\u00f6r: Vorhanden\nAbmessungen: Breite: 71,52 cm x H\u00f6he: 61,25 cm x Tiefe/L\u00e4nge: 29,01 cm",
    "reference_file": "offer_reference_959.json",
    "shop_name": "Alternate.at"
}