{
    "html_file": "offer_1879_28.html",
    "name": "Lenovo ThinkVision T23i-20, 23\"",
    "offer_link": "https://www.ba-computer.at/lenovo-thinkvision-t23i-20-led-monitor-58-cm-23-61f6mat2eu.html",
    "price": 188.1,
    "raw_specifications": {
        "Abmessungen (Breite x Tiefe x H\u00f6he)": "52.18 cm x 20 cm x 40.434 cm - mit Standfu\u00df (niedrigste Position)",
        "Besonderheiten": "Integrierte Kabelf\u00fchrung, NearEdgeless-Design an 3 Seiten",
        "Bildschirmbeschichtung": "Blendfrei",
        "Bildschirmtyp": "IPS",
        "Details zu Abmessungen & Gewicht": "Mit Standfu\u00df (niedrigste Position) - Breite: 52.18 cm - Tiefe: 20 cm - H\u00f6he: 40.434 cm - Gewicht: 5.59 kg \u00a6 Mit Standfu\u00df (h\u00f6chste Position) - Breite: 52.18 cm - Tiefe: 20 cm - H\u00f6he: 55.434 cm - Gewicht: 5.59 kg \u00a6 Ohne Fu\u00df - Breite: 52.18 cm - Tiefe: 4.482 cm - H\u00f6he: 31.631 cm - Gewicht: 3.32 kg",
        "Diagonalabmessung": "58 cm (23\")",
        "Display-Typ": "LED-hintergrundbeleuchteter LCD-Monitor / TFT-Aktivmatrix",
        "ENERGY STAR zertifiziert": "Ja",
        "ENERGY STAR-Version": "8.0",
        "EPEAT-kompatibel": "EPEAT Silver",
        "Eingangsspannung": "Wechselstrom 120/230 V (50/60 Hz)",
        "Einstellungen der Anzeigeposition": "H\u00f6he, Pivot (Rotation), Drehung, Neigung",
        "Energie Effizienzklasse": "Klasse C",
        "Energierverbrauch Sleep": "0.5 Watt",
        "Enthaltene Kabel": "1 x DisplayPort-Kabel - 1.8 m",
        "Entwickelt f\u00fcr": "Lenovo ThinkPad P15 Gen 2 20YQ",
        "Farbe": "Raven Black",
        "Farbraum": "75% NTSC",
        "Farbunterst\u00fctzung": "16,7 Millionen Farben",
        "Gewicht": "5.59 kg",
        "Helligkeit": "250 cd/m\u00b2",
        "Hintergrundbeleuchtungs-Technologie": "WLED",
        "Horizontale Bildwiederholrate": "30 - 75 kHz",
        "Horizontaler Betrachtungswinkel": "178",
        "H\u00f6heneinstellung": "150 mm",
        "Integrierte Peripherieger\u00e4te": "USB 3.2 Gen 1 Hub",
        "Kennzeichnung": "CCC, CEE Tier 1, DisplayPort 1.2, TUV Rheinland Eye Comfort Certification, EU RoHS 2002/95/EC",
        "Kontrast": "1000:1 / 3000000:1 (dynamisch)",
        "Leistungsaufnahme im Ein-Zustand": "11.1 W",
        "Leistungsmerkmale": "Slot f\u00fcr Sicherheitsschloss (Kabelschloss getrennt erh\u00e4ltlich)",
        "Lokalisierung": "Englisch / Europa",
        "Max. Betriebstemperatur": "40 \u00b0C",
        "Min Betriebstemperatur": "0 \u00b0C",
        "Native Aufl\u00f6sung": "Full HD (1080p) 1920 x 1080 bei 60 Hz",
        "Neigungswinkel": "-5/+35",
        "Pixelpitch": "0.2652 mm",
        "Ppi": "95.78",
        "Reaktionszeit": "4 ms (extrem), 14 ms (aus), 6 ms (typisch)",
        "Rotationswinkel": "180",
        "Schlosstyp zur Diebstahlsicherung": "Kensington Slot",
        "Schnittstellen": "VGA \u00a6 HDMI \u00a6 DisplayPort \u00a6 USB 3.2 Gen 1 Downstream mit Battery Charging 1.2 \u00a6 3 x USB 3.2 Gen 1 Downstream mit Battery Charging 1.2 \u00a6 USB 3.2 Gen 1 Upstream \u00a6 Audio Line-Out",
        "Schwenkwinkel": "90",
        "Seitenverh\u00e4ltnis": "16:9",
        "Service und Support": "Begrenzte Garantie - 3 Jahre",
        "Stromverbrauch (Aus-Modus)": "0.3 Watt",
        "Stromverbrauch (typisch)": "14.5 Watt",
        "Stromverbrauch SDR (eingeschaltet)": "11.1 kWh/1.000 h",
        "Stromverbrauch im Standby-Modus": "0.5 Watt",
        "TCO-zertifiziert": "TCO Certified Displays 8, TCO Certified Edge Displays",
        "Transportbreite": "59.9 cm",
        "Transportgewicht": "7.5 kg",
        "Transporth\u00f6he": "38.7 cm",
        "Transporttiefe": "17.5 cm",
        "VESA-Halterung": "100 x 100 mm",
        "Vertikale Bildwiederholrate": "50 - 75 Hz",
        "Vertikaler Betrachtungswinkel": "178",
        "Zul\u00e4ssige Luftfeuchtigkeit im Betrieb": "8 - 80% (nicht kondensierend)"
    },
    "raw_specifications_text": "Display-Typ: LED-hintergrundbeleuchteter LCD-Monitor / TFT-Aktivmatrix\nEnergie Effizienzklasse: Klasse C\nDiagonalabmessung: 58 cm (23\")\nIntegrierte Peripherieger\u00e4te: USB 3.2 Gen 1 Hub\nBildschirmtyp: IPS\nSeitenverh\u00e4ltnis: 16:9\nNative Aufl\u00f6sung: Full HD (1080p) 1920 x 1080 bei 60 Hz\nPixelpitch: 0.2652 mm\nPpi: 95.78\nHelligkeit: 250 cd/m\u00b2\nKontrast: 1000:1 / 3000000:1 (dynamisch)\nFarbunterst\u00fctzung: 16,7 Millionen Farben\nFarbraum: 75% NTSC\nReaktionszeit: 4 ms (extrem), 14 ms (aus), 6 ms (typisch)\nVertikale Bildwiederholrate: 50 - 75 Hz\nHorizontale Bildwiederholrate: 30 - 75 kHz\nHorizontaler Betrachtungswinkel: 178\nVertikaler Betrachtungswinkel: 178\nBildschirmbeschichtung: Blendfrei\nHintergrundbeleuchtungs-Technologie: WLED\nBesonderheiten: Integrierte Kabelf\u00fchrung, NearEdgeless-Design an 3 Seiten\nFarbe: Raven Black\nAbmessungen (Breite x Tiefe x H\u00f6he): 52.18 cm x 20 cm x 40.434 cm - mit Standfu\u00df (niedrigste Position)\nGewicht: 5.59 kg\nSchnittstellen: VGA \u00a6 HDMI \u00a6 DisplayPort \u00a6 USB 3.2 Gen 1 Downstream mit Battery Charging 1.2 \u00a6 3 x USB 3.2 Gen 1 Downstream mit Battery Charging 1.2 \u00a6 USB 3.2 Gen 1 Upstream \u00a6 Audio Line-Out\nEinstellungen der Anzeigeposition: H\u00f6he, Pivot (Rotation), Drehung, Neigung\nNeigungswinkel: -5/+35\nSchwenkwinkel: 90\nRotationswinkel: 180\nH\u00f6heneinstellung: 150 mm\nVESA-Halterung: 100 x 100 mm\nLeistungsmerkmale: Slot f\u00fcr Sicherheitsschloss (Kabelschloss getrennt erh\u00e4ltlich)\nEnthaltene Kabel: 1 x DisplayPort-Kabel - 1.8 m\nKennzeichnung: CCC, CEE Tier 1, DisplayPort 1.2, TUV Rheinland Eye Comfort Certification, EU RoHS 2002/95/EC\nLokalisierung: Englisch / Europa\nSchlosstyp zur Diebstahlsicherung: Kensington Slot\nEingangsspannung: Wechselstrom 120/230 V (50/60 Hz)\nLeistungsaufnahme im Ein-Zustand: 11.1 W\nStromverbrauch SDR (eingeschaltet): 11.1 kWh/1.000 h\nStromverbrauch (typisch): 14.5 Watt\nStromverbrauch im Standby-Modus: 0.5 Watt\nEnergierverbrauch Sleep: 0.5 Watt\nStromverbrauch (Aus-Modus): 0.3 Watt\nDetails zu Abmessungen & Gewicht: Mit Standfu\u00df (niedrigste Position) - Breite: 52.18 cm - Tiefe: 20 cm - H\u00f6he: 40.434 cm - Gewicht: 5.59 kg \u00a6 Mit Standfu\u00df (h\u00f6chste Position) - Breite: 52.18 cm - Tiefe: 20 cm - H\u00f6he: 55.434 cm - Gewicht: 5.59 kg \u00a6 Ohne Fu\u00df - Breite: 52.18 cm - Tiefe: 4.482 cm - H\u00f6he: 31.631 cm - Gewicht: 3.32 kg\nTransportbreite: 59.9 cm\nTransporttiefe: 17.5 cm\nTransporth\u00f6he: 38.7 cm\nTransportgewicht: 7.5 kg\nTCO-zertifiziert: TCO Certified Displays 8, TCO Certified Edge Displays\nEPEAT-kompatibel: EPEAT Silver\nENERGY STAR zertifiziert: Ja\nENERGY STAR-Version: 8.0\nService und Support: Begrenzte Garantie - 3 Jahre\nMin Betriebstemperatur: 0 \u00b0C\nMax. Betriebstemperatur: 40 \u00b0C\nZul\u00e4ssige Luftfeuchtigkeit im Betrieb: 8 - 80% (nicht kondensierend)\nEntwickelt f\u00fcr: Lenovo ThinkPad P15 Gen 2 20YQ",
    "reference_file": "offer_reference_1879.json",
    "shop_name": "BA-Computer"
}