{
    "html_file": "offer_2044_3.html",
    "name": "ASUS TUF Gaming VG289Q, 28\"",
    "offer_link": "https://click.cptrack.de/?rd=true&k=H2jZOPSoNfIohcnyCFLwAyhA6o4q59X7bblnbja3C5n6feM7vhB5OksNJJhyYpmzGy_yTbYED5SeNM2e6jUszA~~&rdlink=https%3A%2F%2Fwww.cyberport.at%2F%3FDEEP%3D6135-0DL%26APID%3D66",
    "price": 319.9,
    "raw_specifications": {
        "Aufl\u00f6sung": "3.840x2.160 4K (Ultra HD)",
        "Betrachtungswinkel h/v": "178\u00b0/178\u00b0",
        "Bildformat": "16:9",
        "Breite in mm": "640mm",
        "Displaygr\u00f6\u00dfe in Zoll": "28 Zoll",
        "Displaygr\u00f6\u00dfe in cm": "71,1 cm",
        "Displayport": "1x DP",
        "Farbraumabdeckung": "90% DCI-P3",
        "Farbtiefe": "10 Bit / 1,07 Mrd Farben",
        "Gewicht in kg": "7,6 kg",
        "HDMI": "2x HDMI",
        "Helligkeit": "350 cd/m\u00b2",
        "H\u00f6he in mm": "560mm",
        "H\u00f6henverstellbar": "150mm",
        "Jahresverbrauch": "65 kWh",
        "Kontrast dynamisch": "k.A.",
        "Kontrast typisch": "1.000:1",
        "Lautsprecher": "2x",
        "Leistung": "2W",
        "Leistungsaufnahme": "44 Watt",
        "Oberfl\u00e4che": "entspiegelt",
        "Reaktionszeit": "5 ms",
        "Technologie": "LED-IPS",
        "Tiefe in mm": "235mm",
        "USB-C": "kein",
        "Wandmontage": "VESA100x100"
    },
    "raw_specifications_text": "Jahresverbrauch: 65 kWh\nLeistungsaufnahme: 44 Watt\nDisplaygr\u00f6\u00dfe in cm: 71,1 cm\nDisplaygr\u00f6\u00dfe in Zoll: 28 Zoll\nTechnologie: LED-IPS\nAufl\u00f6sung: 3.840x2.160 4K (Ultra HD)\nBildformat: 16:9\nOberfl\u00e4che: entspiegelt\nFarbraumabdeckung: 90% DCI-P3\nFarbtiefe: 10 Bit / 1,07 Mrd Farben\nHelligkeit: 350 cd/m\u00b2\nKontrast typisch: 1.000:1\nKontrast dynamisch: k.A.\nReaktionszeit: 5 ms\nBetrachtungswinkel h/v: 178\u00b0/178\u00b0\nHDMI: 2x HDMI\nDisplayport: 1x DP\nUSB-C: kein\nLautsprecher: 2x\nLeistung: 2W\nH\u00f6henverstellbar: 150mm\nWandmontage: VESA100x100\nBreite in mm: 640mm\nH\u00f6he in mm: 560mm\nTiefe in mm: 235mm\nGewicht in kg: 7,6 kg",
    "reference_file": "offer_reference_2044.json",
    "shop_name": "Cyberport.at"
}