{
    "html_file": "offer_1044_29.html",
    "name": "Dell UltraSharp U3023E, 30\"",
    "offer_link": "https://www.future-x.at/dell-ultrasharp-u3023e-led-monitor-75-62-cm-30-2560-x-1600-wqxga-60-hz-ips-400-cd-m%B2-1000%3A1-5-ms-hdmi-displayport-usb-c-silber-p-9016158/?pv=2",
    "price": 626.59,
    "raw_specifications": {
        "Abmessungen (Breite x Tiefe x H\u00f6he)": "65,59 cm x 23 cm x 47,27 cm - mit Standfu\u00df (niedrigste Position)",
        "Besonderheiten": "Ohne Quecksilber, arsenfreies Glas, Monitorkalibrierung Delta E<2, an 3 Seiten ohne Blende",
        "Bildschirmbeschichtung": "Blendfrei, 3H Hard Coating",
        "Bildschirmtyp": "IPS",
        "Details zu Abmessungen & Gewicht": "Mit Standfu\u00df (niedrigste Position) - Breite: 65,59 cm - Tiefe: 23 cm - H\u00f6he: 47,27 cm - Gewicht: 11,13 kg \u00a6 Ohne Fu\u00df - Breite: 65,59 cm - Tiefe: 5,3 cm - H\u00f6he: 41,86 cm - Gewicht: 6,48 kg",
        "Diagonalabmessung": "75,62 cm (30\")",
        "Display-Typ": "LED-hintergrundbeleuchteter LCD-Monitor / TFT-Aktivmatrix",
        "ENERGY STAR zertifiziert": "Ja",
        "EPEAT-kompatibel": "EPEAT Gold",
        "Ein-/Aus-Schalter": "Ja",
        "Eingangsspannung": "Wechselstrom 100-240 V (50/60 Hz)",
        "Einstellungen der Anzeigeposition": "H\u00f6he, Pivot (Rotation), Drehung, Neigung",
        "Energie Effizienzklasse": "Klasse F",
        "Enthaltene Kabel": "1 x Kabel USB-C auf USB-C - 1 m \u00a6 1 x DisplayPort-Kabel - DisplayPort zu DisplayPort - 1.8 m \u00a6 1 x SuperSpeed-USB-Kabel - USB Typ A auf B",
        "Farbraum": "100% sRGB, 95% DCI-P3",
        "Farbunterst\u00fctzung": "1,07 Mrd. Farben",
        "Gewicht": "11,13 kg",
        "Helligkeit": "400 cd/m\u00b2",
        "Hintergrundbeleuchtungs-Technologie": "LED-Hintergrundbeleuchtung",
        "Horizontaler Betrachtungswinkel": "178",
        "H\u00f6heneinstellung": "150 mm",
        "Integrierte Peripherieger\u00e4te": "USB 3.2 Gen 2/USB-C Hub",
        "Kennzeichnung": "RoHS, BFR-frei, DisplayPort 1.4, HDCP 1.4, PVC-free",
        "Kontrast": "1000:1 / 1000:1 (dynamisch)",
        "Leistungsaufnahme im Ein-Zustand": "26.6 W",
        "Leistungsmerkmale": "Slot f\u00fcr Sicherheitsschloss (Kabelschloss getrennt erh\u00e4ltlich), Unterst\u00fctzung f\u00fcr VESA-Schnittstelle",
        "Max. Betriebstemperatur": "40 \u00b0C",
        "Min Betriebstemperatur": "0 \u00b0C",
        "Native Aufl\u00f6sung": "WQXGA 2560 x 1600 bei 60 Hz",
        "Neigungswinkel": "-5/+21",
        "Pixelpitch": "0.2505 mm",
        "Ppi": "101.4",
        "Reaktionszeit": "8 ms (grau-zu-grau normal); 5 ms (grau-zu-grau schnell)",
        "Schlosstyp zur Diebstahlsicherung": "Kensington Slot",
        "Schnittstellen": "HDMI (HDCP 1.4) \u00a6 DisplayPort 1.4 (HDCP 1.4) \u00a6 DisplayPort-Ausgang \u00a6 USB-C Upstream/DisplayPort 1,4 Alt Mode mit Spannungsversorgung (bis zu 90 W) \u00a6 USB-C 3,2 Gen 2 Upstream \u00a6 USB-C 3.2 Gen 2 Downstream (bis zu 15 W) \u00a6 3 x USB 3.2 Gen 2 Downstream \u00a6 USB 3.2 Gen 2 Downstream mit Battery Charging 1.2 \u00a6 Audio Line-Out (Mini-Klinkenstecker) \u00a6 LAN (RJ-45)",
        "Schwenkwinkel": "60",
        "Seitenverh\u00e4ltnis": "16:10",
        "Services im Bundle": "3 Jahre Advanced Exchange-Service",
        "Stromverbrauch (Aus-Modus)": "0.2 Watt",
        "Stromverbrauch (max.)": "210 Watt",
        "Stromverbrauch SDR (eingeschaltet)": "26.6 kWh/1.000 h",
        "Stromverbrauch im Standby-Modus": "0.3 Watt",
        "Transportgewicht": "15,05 kg",
        "USB-Spannungsversorgung": "90 Watt",
        "VESA-Halterung": "100 x 100 mm",
        "Vertikaler Betrachtungswinkel": "178",
        "Zul\u00e4ssige Luftfeuchtigkeit im Betrieb": "10 - 80% (nicht kondensierend)"
    },
    "raw_specifications_text": "Display-Typ: LED-hintergrundbeleuchteter LCD-Monitor / TFT-Aktivmatrix\nEnergie Effizienzklasse: Klasse F\nDiagonalabmessung: 75,62 cm (30\")\nIntegrierte Peripherieger\u00e4te: USB 3.2 Gen 2/USB-C Hub\nUSB-Spannungsversorgung: 90 Watt\nBildschirmtyp: IPS\nSeitenverh\u00e4ltnis: 16:10\nNative Aufl\u00f6sung: WQXGA 2560 x 1600 bei 60 Hz\nPixelpitch: 0.2505 mm\nPpi: 101.4\nHelligkeit: 400 cd/m\u00b2\nKontrast: 1000:1 / 1000:1 (dynamisch)\nFarbunterst\u00fctzung: 1,07 Mrd. Farben\nFarbraum: 100% sRGB, 95% DCI-P3\nReaktionszeit: 8 ms (grau-zu-grau normal); 5 ms (grau-zu-grau schnell)\nHorizontaler Betrachtungswinkel: 178\nVertikaler Betrachtungswinkel: 178\nBildschirmbeschichtung: Blendfrei, 3H Hard Coating\nHintergrundbeleuchtungs-Technologie: LED-Hintergrundbeleuchtung\nBesonderheiten: Ohne Quecksilber, arsenfreies Glas, Monitorkalibrierung Delta E<2, an 3 Seiten ohne Blende\nAbmessungen (Breite x Tiefe x H\u00f6he): 65,59 cm x 23 cm x 47,27 cm - mit Standfu\u00df (niedrigste Position)\nGewicht: 11,13 kg\nSchnittstellen: HDMI (HDCP 1.4) \u00a6 DisplayPort 1.4 (HDCP 1.4) \u00a6 DisplayPort-Ausgang \u00a6 USB-C Upstream/DisplayPort 1,4 Alt Mode mit Spannungsversorgung (bis zu 90 W) \u00a6 USB-C 3,2 Gen 2 Upstream \u00a6 USB-C 3.2 Gen 2 Downstream (bis zu 15 W) \u00a6 3 x USB 3.2 Gen 2 Downstream \u00a6 USB 3.2 Gen 2 Downstream mit Battery Charging 1.2 \u00a6 Audio Line-Out (Mini-Klinkenstecker) \u00a6 LAN (RJ-45)\nEinstellungen der Anzeigeposition: H\u00f6he, Pivot (Rotation), Drehung, Neigung\nNeigungswinkel: -5/+21\nSchwenkwinkel: 60\nH\u00f6heneinstellung: 150 mm\nVESA-Halterung: 100 x 100 mm\nLeistungsmerkmale: Slot f\u00fcr Sicherheitsschloss (Kabelschloss getrennt erh\u00e4ltlich), Unterst\u00fctzung f\u00fcr VESA-Schnittstelle\nEnthaltene Kabel: 1 x Kabel USB-C auf USB-C - 1 m \u00a6 1 x DisplayPort-Kabel - DisplayPort zu DisplayPort - 1.8 m \u00a6 1 x SuperSpeed-USB-Kabel - USB Typ A auf B\nKennzeichnung: RoHS, BFR-frei, DisplayPort 1.4, HDCP 1.4, PVC-free\nSchlosstyp zur Diebstahlsicherung: Kensington Slot\nEingangsspannung: Wechselstrom 100-240 V (50/60 Hz)\nLeistungsaufnahme im Ein-Zustand: 26.6 W\nStromverbrauch SDR (eingeschaltet): 26.6 kWh/1.000 h\nStromverbrauch (max.): 210 Watt\nStromverbrauch im Standby-Modus: 0.3 Watt\nStromverbrauch (Aus-Modus): 0.2 Watt\nEin-/Aus-Schalter: Ja\nDetails zu Abmessungen & Gewicht: Mit Standfu\u00df (niedrigste Position) - Breite: 65,59 cm - Tiefe: 23 cm - H\u00f6he: 47,27 cm - Gewicht: 11,13 kg \u00a6 Ohne Fu\u00df - Breite: 65,59 cm - Tiefe: 5,3 cm - H\u00f6he: 41,86 cm - Gewicht: 6,48 kg\nTransportgewicht: 15,05 kg\nEPEAT-kompatibel: EPEAT Gold\nENERGY STAR zertifiziert: Ja\nServices im Bundle: 3 Jahre Advanced Exchange-Service\nMin Betriebstemperatur: 0 \u00b0C\nMax. Betriebstemperatur: 40 \u00b0C\nZul\u00e4ssige Luftfeuchtigkeit im Betrieb: 10 - 80% (nicht kondensierend)",
    "reference_file": "offer_reference_1044.json",
    "shop_name": "Future-X.at"
}