{
    "html_file": "offer_205_3.html",
    "name": "Samsung ViewFinity S8 S27A800UJP (2023), 26.9\"",
    "offer_link": "https://www.proshop.at/Bildschirm/Samsung-27-Bildschirm-ViewFinity-S8-S27A800UJP-Black-5-ms/3143362?utm_source=geizhals&utm_medium=cpc&utm_campaign=pricesite",
    "price": 316.8,
    "raw_specifications": {
        "Abmessungen (Breite x Tiefe x H\u00f6he)": "61.55 cm x 19.64 cm x 55.19 cm - mit Fu\u00df",
        "Abmessungen (Breite x Tiefe x H\u00f6he) - mit Fu\u00df": "61.55 cm x 19.64 cm x 55.19 cm",
        "Besonderheiten": "Bild f\u00fcr Bild, Spielmodus, Cinema Mode, Eco Light Sensor, CustomColor Mode, Mega Infinity Dynamic Contrast Ratio, flimmerfreie Technologie, Image Size, Werkskalibrierung, Eco Saving Plus, Eye Saver Mode, Off Timer Plus, breiter Betrachtungswinkel, sRGB Mode, Picture-in-Picture, Dynamic Contrast Mode, Adaptive Picture, High Bright-Modus, Auto Source Switch",
        "Bildschirmtyp": "IPS",
        "Details zu Abmessungen & Gewicht": "Mit Fu\u00df - Breite: 61.55 cm - Tiefe: 19.64 cm - H\u00f6he: 55.19 cm - Gewicht: 6.7 kg  Ohne Fu\u00df - Breite: 61.55 cm - Tiefe: 4.27 cm - H\u00f6he: 36.82 cm - Gewicht: 4.7 kg",
        "Diagonalabmessung": "68 cm (27\")",
        "Display-Typ": "LED-hintergrundbeleuchteter LCD-Monitor / TFT-Aktivmatrix",
        "EAN": "8806094770551",
        "ENERGY STAR zertifiziert": "Ja",
        "Eingangsanschl\u00fcsse": "HDMI, DisplayPort, USB-C",
        "Eingangsspannung": "Wechselstrom 100-240 V",
        "Einstellungen der Anzeigeposition": "H\u00f6he, Pivot (Rotation), Drehung, Neigung",
        "Energie Effizienzklasse": "Klasse F",
        "Energieklasse (HDR)": "Klasse G",
        "Enthaltene Kabel": "1 x HDMI-Kabel  1 x USB-C Kabel",
        "Farbe": "Schwarz",
        "Farbraum": "99% sRGB",
        "Farbunterst\u00fctzung": "1,07 Mrd. Farben",
        "Ger\u00e4tetyp": "LED-hintergrundbeleuchteter LCD-Monitor - 68 cm (27\")",
        "Gewicht": "6.7 kg",
        "HDR-Format": "HDR10",
        "HDR-f\u00e4hig": "HDR10",
        "Helligkeit": "300 cd/m\u00b2",
        "Hersteller": "Samsung",
        "Hintergrundbeleuchtungs-Technologie": "LED-Hintergrundbeleuchtung",
        "Horizontaler Betrachtungswinkel": "178",
        "H\u00f6heneinstellung": "120 mm",
        "Integrierte Peripherieger\u00e4te": "USB 3.0/USB-C Hub",
        "Kennzeichnung": "TUV Rheinland Intelligent Eye Care Certification, TCO Certified 8.0",
        "Kontrast": "1000:1",
        "Leistungsmerkmale": "Slot f\u00fcr Sicherheitsschloss (Kabelschloss getrennt erh\u00e4ltlich)",
        "Modell": "LS27A800UJPXEN",
        "Native Aufl\u00f6sung": "4K 3840 x 2160 bei 60 Hz",
        "Neigungswinkel": "-2/+25",
        "Produktbeschreibung": "Samsung ViewFinity S8 S27A800UJP - S80UA Series - LED-Monitor - 4K - 68 cm (27\") - HDR",
        "Reaktionszeit": "5 ms",
        "Rotationswinkel": "-2/+92",
        "Schlosstyp zur Diebstahlsicherung": "Kensington Slot",
        "Schnittstellen": "DisplayPort 1.2  HDMI 2.0  USB-C (bis zu 90 W)  3 x USB 3.0  Kopfh\u00f6rer (Mini-Klinkenstecker)",
        "Schwenkwinkel": "60",
        "Seitenverh\u00e4ltnis": "16:9",
        "Spannung": "Wechselstrom 100-240 V",
        "Stromverbrauch (Aus-Modus)": "0.3 Watt",
        "Stromverbrauch (typisch)": "26.1 Watt",
        "Stromverbrauch HDR (eingeschaltet)": "37 kWh/1.000 h",
        "Stromverbrauch SDR (eingeschaltet)": "26 kWh/1.000 h",
        "Stromverbrauch im Standby-Modus": "0.5 Watt",
        "TCO-zertifiziert": "TCO Certified Displays 8, TCO Certified Displays 9",
        "Transportbreite": "68.6 cm",
        "Transportgewicht": "8.4 kg",
        "Transporth\u00f6he": "45 cm",
        "Transporttiefe": "17.1 cm",
        "USB-Spannungsversorgung": "90 Watt",
        "Umweltschutzstandards": "TCO Certified Displays 8, TCO Certified Displays 9, ENERGY STAR-qualifiziert",
        "VESA-Halterung": "100 x 100 mm",
        "Vertikaler Betrachtungswinkel": "178",
        "Waren-Nr.": "3143362",
        "Zum Hersteller": "www.samsung.com"
    },
    "raw_specifications_text": "Hersteller: Samsung\nWaren-Nr.: 3143362\nModell: LS27A800UJPXEN\nEAN: 8806094770551\nZum Hersteller: www.samsung.com\nProduktbeschreibung: Samsung ViewFinity S8 S27A800UJP - S80UA Series - LED-Monitor - 4K - 68 cm (27\") - HDR\nGer\u00e4tetyp: LED-hintergrundbeleuchteter LCD-Monitor - 68 cm (27\")\nEnergie Effizienzklasse: Klasse F\nLeistungsmerkmale: Slot f\u00fcr Sicherheitsschloss (Kabelschloss getrennt erh\u00e4ltlich)\nBildschirmtyp: IPS\nSeitenverh\u00e4ltnis: 16:9\nNative Aufl\u00f6sung: 4K 3840 x 2160 bei 60 Hz\nHelligkeit: 300 cd/m\u00b2\nKontrast: 1000:1\nHDR-f\u00e4hig: HDR10\nReaktionszeit: 5 ms\nFarbunterst\u00fctzung: 1,07 Mrd. Farben\nFarbraum: 99% sRGB\nEingangsanschl\u00fcsse: HDMI, DisplayPort, USB-C\nEinstellungen der Anzeigeposition: H\u00f6he, Pivot (Rotation), Drehung, Neigung\nSpannung: Wechselstrom 100-240 V\nFarbe: Schwarz\nAbmessungen (Breite x Tiefe x H\u00f6he) - mit Fu\u00df: 61.55 cm x 19.64 cm x 55.19 cm\nGewicht: 6.7 kg\nUmweltschutzstandards: TCO Certified Displays 8, TCO Certified Displays 9, ENERGY STAR-qualifiziert\nKennzeichnung: TUV Rheinland Intelligent Eye Care Certification, TCO Certified 8.0\nDisplay-Typ: LED-hintergrundbeleuchteter LCD-Monitor / TFT-Aktivmatrix\nEnergieklasse (HDR): Klasse G\nDiagonalabmessung: 68 cm (27\")\nIntegrierte Peripherieger\u00e4te: USB 3.0/USB-C Hub\nUSB-Spannungsversorgung: 90 Watt\nHDR-Format: HDR10\nHorizontaler Betrachtungswinkel: 178\nVertikaler Betrachtungswinkel: 178\nHintergrundbeleuchtungs-Technologie: LED-Hintergrundbeleuchtung\nBesonderheiten: Bild f\u00fcr Bild, Spielmodus, Cinema Mode, Eco Light Sensor, CustomColor Mode, Mega Infinity Dynamic Contrast Ratio, flimmerfreie Technologie, Image Size, Werkskalibrierung, Eco Saving Plus, Eye Saver Mode, Off Timer Plus, breiter Betrachtungswinkel, sRGB Mode, Picture-in-Picture, Dynamic Contrast Mode, Adaptive Picture, High Bright-Modus, Auto Source Switch\nAbmessungen (Breite x Tiefe x H\u00f6he): 61.55 cm x 19.64 cm x 55.19 cm - mit Fu\u00df\nSchnittstellen: DisplayPort 1.2  HDMI 2.0  USB-C (bis zu 90 W)  3 x USB 3.0  Kopfh\u00f6rer (Mini-Klinkenstecker)\nNeigungswinkel: -2/+25\nSchwenkwinkel: 60\nRotationswinkel: -2/+92\nH\u00f6heneinstellung: 120 mm\nVESA-Halterung: 100 x 100 mm\nEnthaltene Kabel: 1 x HDMI-Kabel  1 x USB-C Kabel\nSchlosstyp zur Diebstahlsicherung: Kensington Slot\nEingangsspannung: Wechselstrom 100-240 V\nStromverbrauch SDR (eingeschaltet): 26 kWh/1.000 h\nStromverbrauch HDR (eingeschaltet): 37 kWh/1.000 h\nStromverbrauch (typisch): 26.1 Watt\nStromverbrauch im Standby-Modus: 0.5 Watt\nStromverbrauch (Aus-Modus): 0.3 Watt\nDetails zu Abmessungen & Gewicht: Mit Fu\u00df - Breite: 61.55 cm - Tiefe: 19.64 cm - H\u00f6he: 55.19 cm - Gewicht: 6.7 kg  Ohne Fu\u00df - Breite: 61.55 cm - Tiefe: 4.27 cm - H\u00f6he: 36.82 cm - Gewicht: 4.7 kg\nTransportbreite: 68.6 cm\nTransporttiefe: 17.1 cm\nTransporth\u00f6he: 45 cm\nTransportgewicht: 8.4 kg\nTCO-zertifiziert: TCO Certified Displays 8, TCO Certified Displays 9\nENERGY STAR zertifiziert: Ja",
    "reference_file": "offer_reference_205.json",
    "shop_name": "Proshop.at"
}