{
    "html_file": "offer_1280_7.html",
    "name": "Philips B-line 242B1G, 23.8\"",
    "offer_link": "https://www.proshop.at/Bildschirm/Philips-24-Bildschirm-B-Line-242B1G-1920x1080-75Hz-IPS-Speakers-USB-HUB-Black-4-ms/2932019?utm_source=geizhals&utm_medium=cpc&utm_campaign=pricesite",
    "price": 202.58,
    "raw_specifications": {
        "Abmessungen (Breite x Tiefe x H\u00f6he)": "54 cm x 20.5 cm x 50.1 cm - mit Fu\u00df",
        "Abmessungen (Breite x Tiefe x H\u00f6he) - mit Fu\u00df": "54 cm x 20.5 cm x 50.1 cm",
        "Ausgangsleistung/Kanal": "2 Watt",
        "Besonderheiten": "Sync-on-Green, PowerSensor, SmartImage, Low Blue Light Mode, flimmerfreie Technologie, Adaptive-Sync-Technologie, LightSensor, EasyRead, sRGB Mode",
        "Bildschirmbeschichtung": "Blendfrei, 3H Hard Coating, Haze 25 %",
        "Bildschirmtyp": "IPS",
        "Details zu Abmessungen & Gewicht": "Mit Standfu\u00df (h\u00f6chste Position) - Breite: 54 cm - Tiefe: 20.5 cm - H\u00f6he: 50.1 cm - Gewicht: 4.92 kg  Ohne Fu\u00df - Breite: 54 cm - Tiefe: 4.7 cm - H\u00f6he: 32.3 cm - Gewicht: 3.32 kg",
        "Diagonalabmessung": "61 cm (24\")",
        "Display-Typ": "LED-hintergrundbeleuchteter LCD-Monitor / TFT-Aktivmatrix",
        "EAN": "8712581772338",
        "ENERGY STAR zertifiziert": "Ja",
        "ENERGY STAR-Version": "8.0",
        "Ein-/Aus-Schalter": "Ja",
        "Eingangsanschl\u00fcsse": "HDMI, DVI-D, VGA, DisplayPort",
        "Eingangsspannung": "Wechselstrom 120/230 V (50/60 Hz)",
        "Einstellungen der Anzeigeposition": "H\u00f6he, Pivot (Rotation), Drehung, Neigung",
        "Energie Effizienzklasse": "Klasse C",
        "Enthaltene Kabel": "1 x HDMI-Kabel  1 x DisplayPort-Kabel",
        "Farbe": "Black Texture",
        "Farbraum": "102% sRGB (CIE 1931), 78% NTSC (CIE 1976)",
        "Farbunterst\u00fctzung": "16,7 Millionen Farben",
        "Ger\u00e4tetyp": "LED-hintergrundbeleuchteter LCD-Monitor - 61 cm (24\")",
        "Gewicht": "4.92 kg",
        "Helligkeit": "250 cd/m\u00b2",
        "Hersteller": "Philips",
        "Hintergrundbeleuchtungs-Technologie": "WLED",
        "Horizontale Bildwiederholrate": "30 - 85 kHz",
        "Horizontaler Betrachtungswinkel": "178",
        "H\u00f6heneinstellung": "150 mm",
        "Integrierte Peripherieger\u00e4te": "USB 3.2 Hub",
        "Kennzeichnung": "FCC Klasse B bescheinigt, TUV GS, ICES-003, SEMKO, CB, CCC, TUV Ergo, DDC/CI, RoHS, Bleifrei, CECP, CEL, CU-EAC, BFR-frei, Ukraine, PVC-free, quecksilberfrei, TUV Eye Comfort certified",
        "Kontrast": "1000:1 / 50000000:1 (dynamisch)",
        "Leistungsaufnahme im Ein-Zustand": "12.5 W",
        "Leistungsmerkmale": "Slot f\u00fcr Sicherheitsschloss (Kabelschloss getrennt erh\u00e4ltlich)",
        "MTBF": "70,000 Stunde(n)",
        "Mitgelieferte Software": "Philips SmartControl",
        "Modell": "242B1G/00",
        "Native Aufl\u00f6sung": "Full HD (1080p) 1920 x 1080 bei 75 Hz",
        "Neigungswinkel": "-5/+35",
        "OSD-Sprachen": "Multilingual",
        "Pixelpitch": "0.2745 mm",
        "Ppi": "93",
        "Produktbeschreibung": "Philips B Line 242B1G - LED-Monitor - Full HD (1080p) - 61 cm (24\")",
        "Reaktionszeit": "4 ms (gray-to-gray)",
        "Rotationswinkel": "180",
        "Schlosstyp zur Diebstahlsicherung": "Kensington Slot",
        "Schnittstellen": "VGA  DVI-D (HDCP 1.4)  DisplayPort 1.2 (HDCP 1.4)  HDMI (HDCP 1.4)  USB Upstream (Typ B)  3 x USB 3.2 Downstream  USB 3.2 Downstream (Schnellladung)  Audio Line-In  Kopfh\u00f6rer",
        "Schwenkwinkel": "360",
        "Seitenverh\u00e4ltnis": "16:9",
        "Sichtbare Bildfl\u00e4che": "60.5 cm (23.8\")",
        "Spannung": "Wechselstrom 120/230 V (50/60 Hz)",
        "Stromverbrauch (Aus-Modus)": "0 Watt",
        "Stromverbrauch (typisch)": "12.8 Watt",
        "Stromverbrauch SDR (eingeschaltet)": "12.5 kWh/1.000 h",
        "Stromverbrauch im Standby-Modus": "0.35 Watt",
        "TCO-zertifiziert": "TCO Certified Displays 8, TCO Certified Edge Displays",
        "Transportbreite": "73 cm",
        "Transportgewicht": "7.61 kg",
        "Transporth\u00f6he": "45 cm",
        "Transporttiefe": "13.9 cm",
        "Typ": "Lautsprecher - Stereo",
        "Umweltschutzstandards": "TCO Certified Displays 8, TCO Certified Edge Displays, ENERGY STAR-qualifiziert",
        "VESA-Halterung": "100 x 100 mm",
        "Vertikale Bildwiederholrate": "48 - 75 Hz",
        "Vertikaler Betrachtungswinkel": "178",
        "Waren-Nr.": "2932019",
        "Zum Hersteller": "www.philips.com"
    },
    "raw_specifications_text": "Hersteller: Philips\nWaren-Nr.: 2932019\nModell: 242B1G/00\nEAN: 8712581772338\nZum Hersteller: www.philips.com\nProduktbeschreibung: Philips B Line 242B1G - LED-Monitor - Full HD (1080p) - 61 cm (24\")\nGer\u00e4tetyp: LED-hintergrundbeleuchteter LCD-Monitor - 61 cm (24\")\nEnergie Effizienzklasse: Klasse C\nLeistungsaufnahme im Ein-Zustand: 12.5 W\nLeistungsmerkmale: Slot f\u00fcr Sicherheitsschloss (Kabelschloss getrennt erh\u00e4ltlich)\nBildschirmtyp: IPS\nSeitenverh\u00e4ltnis: 16:9\nNative Aufl\u00f6sung: Full HD (1080p) 1920 x 1080 bei 75 Hz\nPixelpitch: 0.2745 mm\nHelligkeit: 250 cd/m\u00b2\nKontrast: 1000:1 / 50000000:1 (dynamisch)\nReaktionszeit: 4 ms (gray-to-gray)\nFarbunterst\u00fctzung: 16,7 Millionen Farben\nFarbraum: 102% sRGB (CIE 1931), 78% NTSC (CIE 1976)\nEingangsanschl\u00fcsse: HDMI, DVI-D, VGA, DisplayPort\nEinstellungen der Anzeigeposition: H\u00f6he, Pivot (Rotation), Drehung, Neigung\nBildschirmbeschichtung: Blendfrei, 3H Hard Coating, Haze 25 %\nSpannung: Wechselstrom 120/230 V (50/60 Hz)\nFarbe: Black Texture\nAbmessungen (Breite x Tiefe x H\u00f6he) - mit Fu\u00df: 54 cm x 20.5 cm x 50.1 cm\nGewicht: 4.92 kg\nUmweltschutzstandards: TCO Certified Displays 8, TCO Certified Edge Displays, ENERGY STAR-qualifiziert\nKennzeichnung: FCC Klasse B bescheinigt, TUV GS, ICES-003, SEMKO, CB, CCC, TUV Ergo, DDC/CI, RoHS, Bleifrei, CECP, CEL, CU-EAC, BFR-frei, Ukraine, PVC-free, quecksilberfrei, TUV Eye Comfort certified\nDisplay-Typ: LED-hintergrundbeleuchteter LCD-Monitor / TFT-Aktivmatrix\nDiagonalabmessung: 61 cm (24\")\nSichtbare Bildfl\u00e4che: 60.5 cm (23.8\")\nIntegrierte Peripherieger\u00e4te: USB 3.2 Hub\nPpi: 93\nVertikale Bildwiederholrate: 48 - 75 Hz\nHorizontale Bildwiederholrate: 30 - 85 kHz\nHorizontaler Betrachtungswinkel: 178\nVertikaler Betrachtungswinkel: 178\nHintergrundbeleuchtungs-Technologie: WLED\nOSD-Sprachen: Multilingual\nBesonderheiten: Sync-on-Green, PowerSensor, SmartImage, Low Blue Light Mode, flimmerfreie Technologie, Adaptive-Sync-Technologie, LightSensor, EasyRead, sRGB Mode\nAbmessungen (Breite x Tiefe x H\u00f6he): 54 cm x 20.5 cm x 50.1 cm - mit Fu\u00df\nTyp: Lautsprecher - Stereo\nAusgangsleistung/Kanal: 2 Watt\nSchnittstellen: VGA  DVI-D (HDCP 1.4)  DisplayPort 1.2 (HDCP 1.4)  HDMI (HDCP 1.4)  USB Upstream (Typ B)  3 x USB 3.2 Downstream  USB 3.2 Downstream (Schnellladung)  Audio Line-In  Kopfh\u00f6rer\nNeigungswinkel: -5/+35\nSchwenkwinkel: 360\nRotationswinkel: 180\nH\u00f6heneinstellung: 150 mm\nVESA-Halterung: 100 x 100 mm\nEnthaltene Kabel: 1 x HDMI-Kabel  1 x DisplayPort-Kabel\nMTBF: 70,000 Stunde(n)\nSchlosstyp zur Diebstahlsicherung: Kensington Slot\nEingangsspannung: Wechselstrom 120/230 V (50/60 Hz)\nStromverbrauch SDR (eingeschaltet): 12.5 kWh/1.000 h\nStromverbrauch (typisch): 12.8 Watt\nStromverbrauch im Standby-Modus: 0.35 Watt\nStromverbrauch (Aus-Modus): 0 Watt\nEin-/Aus-Schalter: Ja\nMitgelieferte Software: Philips SmartControl\nDetails zu Abmessungen & Gewicht: Mit Standfu\u00df (h\u00f6chste Position) - Breite: 54 cm - Tiefe: 20.5 cm - H\u00f6he: 50.1 cm - Gewicht: 4.92 kg  Ohne Fu\u00df - Breite: 54 cm - Tiefe: 4.7 cm - H\u00f6he: 32.3 cm - Gewicht: 3.32 kg\nTransportbreite: 73 cm\nTransporttiefe: 13.9 cm\nTransporth\u00f6he: 45 cm\nTransportgewicht: 7.61 kg\nTCO-zertifiziert: TCO Certified Displays 8, TCO Certified Edge Displays\nENERGY STAR zertifiziert: Ja\nENERGY STAR-Version: 8.0",
    "reference_file": "offer_reference_1280.json",
    "shop_name": "Proshop.at"
}