{
    "html_file": "offer_1037_9.html",
    "name": "Samsung T45F, 24\"",
    "offer_link": "https://direkt.jacob.de/produkte/samsung-f24t450gyu-61-lf24t450gyuxen-artnr-7350103.html?utm_source=geizhals&utm_medium=cpc&utm_campaign=Preisvergleich&ref=103",
    "price": 154.09,
    "raw_specifications": {
        "AMD FreeSync": "Nein",
        "Anzahl DisplayPort Anschl\u00fcsse": "1",
        "Anzahl HDMI-Anschl\u00fcsse": "1",
        "Anzahl der Farben des Displays": "16,7 Millionen Farben",
        "Audioanschl\u00fcsse": "Ja",
        "Bildschirmaufl\u00f6sung": "1920 x 1200 Pixel",
        "Bildschirmdiagonale": "61 cm (24\" )",
        "Bildschirmdiagonale (cm)": "61 cm",
        "Bildschirmform": "Flach",
        "Bildschirmtechnologie": "LCD",
        "Blickwinkel, horizontal": "178\u00b0",
        "Blickwinkel, vertikal": "178\u00b0",
        "Breite (ohne Standfu\u00df)": "53,4 cm",
        "DVI Anschluss": "Ja",
        "Eingebaute Lautsprecher": "Ja",
        "Energieeffizienzklasse (SDR)": "D",
        "Energieverbrauch (SDR) pro 1.000 Stunden": "14 kWh",
        "Flimmerfreie Technologie": "Ja",
        "Fu\u00dffarbe": "Schwarz",
        "Ger\u00e4tebreite (inkl. Fu\u00df)": "534 mm",
        "Ger\u00e4teh\u00f6he (inkl. Fu\u00df)": "386,3 mm",
        "Ger\u00e4tetiefe (inkl. Fu\u00df)": "224 mm",
        "Gewicht (mit St\u00e4nder)": "5,5 kg",
        "HD-Typ": "WUXGA",
        "HDMI": "Ja",
        "HDMI-Kabell\u00e4nge": "1,5 m",
        "Helligkeit (typisch)": "250 cd/m\u00b2",
        "H\u00f6he (ohne Standfu\u00df)": "35,5 cm",
        "H\u00f6heneinstellung": "13 cm",
        "H\u00f6henverstellung": "Ja",
        "Integrierte Kamera": "Nein",
        "Integrierter USB-Hub": "Ja",
        "Kontrastverh\u00e4ltnis": "1000:1",
        "Kopfh\u00f6rerausgang": "Ja",
        "Marktpositionierung": "Business",
        "Maximale Bildwiederholrate": "75 Hz",
        "Mitgelieferte Kabel": "AC, HDMI, USB",
        "NVIDIA G-SYNC": "Nein",
        "Natives Seitenverh\u00e4ltnis": "16:10",
        "Neigungswinkelbereich": "3 - 25\u00b0",
        "On-Screen-Display (OSD)": "Ja",
        "Paketgewicht": "6,8 kg",
        "Panel-Montage-Schnittstelle": "100 x 100 mm",
        "Panel-Typ": "IPS",
        "Pivot": "Ja",
        "Pivot Winkel": "2 - 92\u00b0",
        "Produktfarbe": "Schwarz",
        "Reaktionszeit": "5 ms",
        "Schwenkbar": "Ja",
        "Schwenkwinkelbereich": "45 - 45\u00b0",
        "Seitenverh\u00e4ltnis": "16:10",
        "Spiel-Modus": "Ja",
        "Stromverbrauch (Standardbetrieb)": "14 W",
        "Stromverbrauch (Standby)": "0,5 W",
        "Stromverbrauch (aus)": "0,3 W",
        "St\u00e4nder enthalten": "Ja",
        "Tiefe (ohne Standfu\u00df)": "4,49 cm",
        "USB-Hub-Version": "2.0 / 3.2 Gen 1 (3.1 Gen 1)",
        "VESA-Halterung": "Ja",
        "Verpackungsart": "Box",
        "Verpackungsbreite": "611 mm",
        "Verpackungsh\u00f6he": "153 mm",
        "Verpackungstiefe": "419 mm",
        "kippbar": "Ja"
    },
    "raw_specifications_text": "Bildschirmdiagonale: 61 cm (24\" )\nBildschirmaufl\u00f6sung: 1920 x 1200 Pixel\nNatives Seitenverh\u00e4ltnis: 16:10\nPanel-Typ: IPS\nHD-Typ: WUXGA\nBildschirmtechnologie: LCD\nBildschirmform: Flach\nKontrastverh\u00e4ltnis: 1000:1\nMaximale Bildwiederholrate: 75 Hz\nAnzahl der Farben des Displays: 16,7 Millionen Farben\nHelligkeit (typisch): 250 cd/m\u00b2\nReaktionszeit: 5 ms\nSeitenverh\u00e4ltnis: 16:10\nBlickwinkel, horizontal: 178\u00b0\nBlickwinkel, vertikal: 178\u00b0\nBildschirmdiagonale (cm): 61 cm\nNVIDIA G-SYNC: Nein\nAMD FreeSync: Nein\nFlimmerfreie Technologie: Ja\nSpiel-Modus: Ja\nEingebaute Lautsprecher: Ja\nIntegrierte Kamera: Nein\nMarktpositionierung: Business\nProduktfarbe: Schwarz\nFu\u00dffarbe: Schwarz\nIntegrierter USB-Hub: Ja\nHDMI: Ja\nKopfh\u00f6rerausgang: Ja\nUSB-Hub-Version: 2.0 / 3.2 Gen 1 (3.1 Gen 1)\nDVI Anschluss: Ja\nAnzahl HDMI-Anschl\u00fcsse: 1\nAnzahl DisplayPort Anschl\u00fcsse: 1\nAudioanschl\u00fcsse: Ja\nVESA-Halterung: Ja\nH\u00f6henverstellung: Ja\nPanel-Montage-Schnittstelle: 100 x 100 mm\nH\u00f6heneinstellung: 13 cm\nPivot: Ja\nPivot Winkel: 2 - 92\u00b0\nSchwenkbar: Ja\nSchwenkwinkelbereich: 45 - 45\u00b0\nkippbar: Ja\nNeigungswinkelbereich: 3 - 25\u00b0\nOn-Screen-Display (OSD): Ja\nEnergieeffizienzklasse (SDR): D\nEnergieverbrauch (SDR) pro 1.000 Stunden: 14 kWh\nStromverbrauch (Standardbetrieb): 14 W\nStromverbrauch (Standby): 0,5 W\nStromverbrauch (aus): 0,3 W\nGer\u00e4tebreite (inkl. Fu\u00df): 534 mm\nGer\u00e4tetiefe (inkl. Fu\u00df): 224 mm\nGer\u00e4teh\u00f6he (inkl. Fu\u00df): 386,3 mm\nGewicht (mit St\u00e4nder): 5,5 kg\nBreite (ohne Standfu\u00df): 53,4 cm\nTiefe (ohne Standfu\u00df): 4,49 cm\nH\u00f6he (ohne Standfu\u00df): 35,5 cm\nSt\u00e4nder enthalten: Ja\nMitgelieferte Kabel: AC, HDMI, USB\nHDMI-Kabell\u00e4nge: 1,5 m\nVerpackungsbreite: 611 mm\nVerpackungstiefe: 419 mm\nVerpackungsh\u00f6he: 153 mm\nPaketgewicht: 6,8 kg\nVerpackungsart: Box",
    "reference_file": "offer_reference_1037.json",
    "shop_name": "Jacob Elektronik direkt (AT)"
}