{
    "html_file": "offer_1806_1.html",
    "name": "Philips E-line 345E2AE, 34\"",
    "offer_link": "https://www.amazon.de/dp/B08FDZ2XFV?linkCode=xm2&camp=2025&creative=165953&smid=A3JWKAKR8XB7XF&creativeASIN=B08FDZ2XFV&tag=geizhals1-21",
    "price": 346.89,
    "raw_specifications": {
        "ASIN": "B08FDZ2XFV",
        "Amazon Bestseller-Rang": "Nr. 49,400 in Computer & Zubeh\u00f6r (Siehe Top 100 in Computer & Zubeh\u00f6r)  Nr. 976 in Monitore",
        "Anzahl HDMI Schnittstellen": "\u200e1",
        "Anzahl der Lithium-Ionen-Zellen": "\u200e7",
        "Anzahl der Lithium-Metall-Zellen": "\u200e7",
        "Artikelgewicht": "\u200e7,61 Kilograms",
        "Batterien": "\u200e1 A Batterien erforderlich.",
        "Batterien enthalten": "\u200eNein",
        "Display-Gr\u00f6\u00dfe": "\u200e34 Zoll",
        "Durchschnittliche Kundenbewertung": "4,5  4,5 von 5 Sternen    \n    1.795 Sternebewertungen   \n\n\n 4,5 von 5 Sternen",
        "Farbe": "\u200eschwarz",
        "Formfaktor": "\u200eDRUCKER",
        "Garantierte Software-Updates bis": "\u200eunbekannt",
        "Hersteller": "\u200ePhilips",
        "Im Angebot von Amazon.de seit": "7. August 2020",
        "Kapazit\u00e4t Lithium-Akku": "\u200e2,6 Britische W\u00e4rmeeinheiten (BTU)",
        "L\u00f6sung": "\u200e3440 x 1440 Pixels",
        "Marke": "\u200ePhilips Monitors",
        "Modell/Serie": "\u200ePhilips 345E2AE - 34 Zoll WQHD Gaming Monitor, 75 Hz, 4ms, AdaptiveSync (3440x1440, HDMI, DisplayPort) schwarz",
        "Modellnummer": "\u200e345E2AE/00",
        "Produktabmessungen": "\u200e81,7 x 23,5 x 49,1 cm; 7,61 Kilogramm",
        "Prozessortyp": "\u200eOthers",
        "Volt": "\u200e240 Volt"
    },
    "raw_specifications_text": "Marke: \u200ePhilips Monitors\nHersteller: \u200ePhilips\nModell/Serie: \u200ePhilips 345E2AE - 34 Zoll WQHD Gaming Monitor, 75 Hz, 4ms, AdaptiveSync (3440x1440, HDMI, DisplayPort) schwarz\nProduktabmessungen: \u200e81,7 x 23,5 x 49,1 cm; 7,61 Kilogramm\nBatterien: \u200e1 A Batterien erforderlich.\nModellnummer: \u200e345E2AE/00\nFarbe: \u200eschwarz\nFormfaktor: \u200eDRUCKER\nDisplay-Gr\u00f6\u00dfe: \u200e34 Zoll\nL\u00f6sung: \u200e3440 x 1440 Pixels\nProzessortyp: \u200eOthers\nAnzahl HDMI Schnittstellen: \u200e1\nVolt: \u200e240 Volt\nBatterien enthalten: \u200eNein\nKapazit\u00e4t Lithium-Akku: \u200e2,6 Britische W\u00e4rmeeinheiten (BTU)\nAnzahl der Lithium-Ionen-Zellen: \u200e7\nAnzahl der Lithium-Metall-Zellen: \u200e7\nArtikelgewicht: \u200e7,61 Kilograms\nGarantierte Software-Updates bis: \u200eunbekannt\nASIN: B08FDZ2XFV\nDurchschnittliche Kundenbewertung: 4,5  4,5 von 5 Sternen    \n    1.795 Sternebewertungen   \n\n\n 4,5 von 5 Sternen\nAmazon Bestseller-Rang: Nr. 49,400 in Computer & Zubeh\u00f6r (Siehe Top 100 in Computer & Zubeh\u00f6r)  Nr. 976 in Monitore\nIm Angebot von Amazon.de seit: 7. August 2020",
    "reference_file": "offer_reference_1806.json",
    "shop_name": "Amazon.at"
}