{
    "html_file": "offer_972_0.html",
    "name": "HP E27m G4, 27\"",
    "offer_link": "https://www.csv-direct.de/artinfo.php?artnr=AGX1518907&KATEGORIE=162&pva=geizhals2",
    "price": 371.48,
    "raw_specifications": {
        "AC Eingangsfrequenz": "50 - 60 Hz",
        "AC Eingangsspannung": "100 - 240 V",
        "AMD FreeSync": "Nein",
        "Anzahl DisplayPort Anschl\u00fcsse": "2",
        "Anzahl HDMI-Anschl\u00fcsse": "1",
        "Anzahl der Farben des Displays": "16,7 Millionen Farben",
        "Anzahl der Lautsprecher": "2",
        "Anzahl der Upstream-Ports USB Typ-C": "1",
        "Anzahl der nachgeschalteten Steckpl\u00e4tze vom Typ USB-A": "4",
        "Betriebstemperatur": "5 - 35 \u00b0C",
        "Bildschirmdiagonale": "68,6 cm 27\"",
        "Bildschirmdiagonale cm": "68,6 cm",
        "Bildschirmform": "Flach",
        "Bildwinkel, horizontal": "178\u00b0",
        "Bildwinkel, vertikal": "178\u00b0",
        "Breite": "612,8 mm",
        "Breite ohne Standfu\u00df": "612,8 mm",
        "Display-Aufl\u00f6sung": "2560 x 1440 Pixel",
        "DisplayPorts-Version": "1.2",
        "Energieeffizienzklasse SDR": "F",
        "Energieeffizienzskala": "A bis G",
        "Energieverbrauch SDR pro 1.000 Stunden": "24 kWh",
        "Farbskala": "99",
        "Farbtiefe": "8 Bit",
        "Ger\u00e4tebreite inkl. Fu\u00df": "61,3 mm",
        "Ger\u00e4teh\u00f6he inkl. Fu\u00df": "21,6 mm",
        "Ger\u00e4tetiefe inkl. Fu\u00df": "55,1 mm",
        "Gewicht": "8,52 kg",
        "Gewicht mit St\u00e4nder": "8,52 kg",
        "HD-Typ": "Quad HD",
        "HDMI-Version": "1.4",
        "HP-Segment": "Business",
        "Horizontaler Scanbereich": "30 - 115 kHz",
        "H\u00f6he": "396,6 mm",
        "H\u00f6he ohne Standfu\u00df": "39,7 mm",
        "H\u00f6heneinstellung": "15 cm",
        "Kontrastverh\u00e4ltnis": "1000:1",
        "Kontrastverh\u00e4ltnis dynamisch": "10000000:1",
        "Luftfeuchtigkeit bei Lagerung": "5 - 95",
        "Marktpositionierung": "Business",
        "Maximale Bildwiederholrate": "75 Hz",
        "Megapixel ca.": "5 MP",
        "Mitgelieferte Kabel": "HDMI, USB Typ-A, USB Typ-C",
        "NVIDIA G-SYNC": "Nein",
        "Nachhaltige Technologien und Materialien": "Halogenarm; Au\u00dfenkarton und Kissen aus Wellpappe stammen zu 100\u00a0 aus nachhaltigen Quellen und sind recycelbar; Enth\u00e4lt Kunststoff, der andernfalls ins Meer gelangt w\u00e4re",
        "Natives Seitenverh\u00e4ltnis": "16:9",
        "Neigungswinkelbereich": "-5 - 23\u00b0",
        "Oberfl\u00e4chenh\u00e4rte": "3H",
        "Paketgewicht": "12 kg",
        "Panel-Montage-Schnittstelle": "100 x 100 mm",
        "Panel-Typ": "IPS",
        "Pivot Winkel": "-90 - 90\u00b0",
        "Pixel Abstand": "0,2331 x 0,2331 mm",
        "Pixeldichte": "109 ppi",
        "Produktfarbe": "Schwarz",
        "RGB-Farbraum": "sRGB",
        "RMS-Leistung": "5 W",
        "Reaktionszeit": "5 ms",
        "Relative Luftfeuchtigkeit in Betrieb": "20 - 80",
        "Schwenkwinkelbereich": "-45 - 45\u00b0",
        "Stromverbrauch Standardbetrieb": "51 W",
        "Stromverbrauch Standby": "0,5 W",
        "Stromverbrauch max.": "160 W",
        "Tiefe": "47 mm",
        "Tiefe ohne Standfu\u00df": "4,7 mm",
        "Touchscreen": "Nein",
        "USB-Stromversorgung bis zu": "65 W",
        "USB-Upstream-Porttyp": "USB Typ-C",
        "Unterst\u00fctzte Grafik-Aufl\u00f6sungen": "640 x 480 VGA, 720 x 400, 800 x 600 SVGA, 1024 x 768 XGA, 1280 x 1024 SXGA, 1280 x 720 HD 720, 1280 x 800 WXGA, 1440 x 900 WXGA+, 1600 x 1200 UXGA, 1600 x 900, 1680 x 1050 WSXGA+, 1920 x 1080 HD 1080, 1920 x 1200 WUXGA, 2560 x 1440",
        "Verpackungsart": "Box",
        "Verpackungsbreite": "612,8 mm",
        "Verpackungsh\u00f6he": "551 mm",
        "Verpackungstiefe": "216 mm",
        "Vertikaler Scanbereich": "50 - 75 Hz",
        "Warentarifnummer HS": "85285210"
    },
    "raw_specifications_text": "Bildschirmdiagonale: 68,6 cm 27\"\nDisplay-Aufl\u00f6sung: 2560 x 1440 Pixel\nNatives Seitenverh\u00e4ltnis: 16:9\nTouchscreen: Nein\nHD-Typ: Quad HD\nPanel-Typ: IPS\nBildschirmform: Flach\nKontrastverh\u00e4ltnis: 1000:1\nMaximale Bildwiederholrate: 75 Hz\nAnzahl der Farben des Displays: 16,7 Millionen Farben\nReaktionszeit: 5 ms\nUnterst\u00fctzte Grafik-Aufl\u00f6sungen: 640 x 480 VGA, 720 x 400, 800 x 600 SVGA, 1024 x 768 XGA, 1280 x 1024 SXGA, 1280 x 720 HD 720, 1280 x 800 WXGA, 1440 x 900 WXGA+, 1600 x 1200 UXGA, 1600 x 900, 1680 x 1050 WSXGA+, 1920 x 1080 HD 1080, 1920 x 1200 WUXGA, 2560 x 1440\nKontrastverh\u00e4ltnis dynamisch: 10000000:1\nBildwinkel, horizontal: 178\u00b0\nBildwinkel, vertikal: 178\u00b0\nPixel Abstand: 0,2331 x 0,2331 mm\nPixeldichte: 109 ppi\nHorizontaler Scanbereich: 30 - 115 kHz\nVertikaler Scanbereich: 50 - 75 Hz\nBildschirmdiagonale cm: 68,6 cm\nOberfl\u00e4chenh\u00e4rte: 3H\nFarbtiefe: 8 Bit\nRGB-Farbraum: sRGB\nFarbskala: 99\nNVIDIA G-SYNC: Nein\nAMD FreeSync: Nein\nHP-Segment: Business\nAnzahl der Lautsprecher: 2\nRMS-Leistung: 5 W\nMegapixel ca.: 5 MP\nMarktpositionierung: Business\nProduktfarbe: Schwarz\nUSB-Upstream-Porttyp: USB Typ-C\nAnzahl der Upstream-Ports USB Typ-C: 1\nAnzahl der nachgeschalteten Steckpl\u00e4tze vom Typ USB-A: 4\nUSB-Stromversorgung bis zu: 65 W\nAnzahl HDMI-Anschl\u00fcsse: 1\nHDMI-Version: 1.4\nAnzahl DisplayPort Anschl\u00fcsse: 2\nDisplayPorts-Version: 1.2\nPanel-Montage-Schnittstelle: 100 x 100 mm\nH\u00f6heneinstellung: 15 cm\nPivot Winkel: -90 - 90\u00b0\nSchwenkwinkelbereich: -45 - 45\u00b0\nNeigungswinkelbereich: -5 - 23\u00b0\nEnergieeffizienzklasse SDR: F\nEnergieverbrauch SDR pro 1.000 Stunden: 24 kWh\nStromverbrauch Standardbetrieb: 51 W\nStromverbrauch Standby: 0,5 W\nStromverbrauch max.: 160 W\nAC Eingangsspannung: 100 - 240 V\nAC Eingangsfrequenz: 50 - 60 Hz\nEnergieeffizienzskala: A bis G\nBetriebstemperatur: 5 - 35 \u00b0C\nRelative Luftfeuchtigkeit in Betrieb: 20 - 80\nLuftfeuchtigkeit bei Lagerung: 5 - 95\nMitgelieferte Kabel: HDMI, USB Typ-A, USB Typ-C\nGer\u00e4tebreite inkl. Fu\u00df: 61,3 mm\nGer\u00e4tetiefe inkl. Fu\u00df: 55,1 mm\nGer\u00e4teh\u00f6he inkl. Fu\u00df: 21,6 mm\nGewicht mit St\u00e4nder: 8,52 kg\nBreite ohne Standfu\u00df: 612,8 mm\nTiefe ohne Standfu\u00df: 4,7 mm\nH\u00f6he ohne Standfu\u00df: 39,7 mm\nVerpackungsbreite: 612,8 mm\nVerpackungstiefe: 216 mm\nVerpackungsh\u00f6he: 551 mm\nPaketgewicht: 12 kg\nVerpackungsart: Box\nNachhaltige Technologien und Materialien: Halogenarm; Au\u00dfenkarton und Kissen aus Wellpappe stammen zu 100\u00a0 aus nachhaltigen Quellen und sind recycelbar; Enth\u00e4lt Kunststoff, der andernfalls ins Meer gelangt w\u00e4re\nWarentarifnummer HS: 85285210\nGewicht: 8,52 kg\nH\u00f6he: 396,6 mm\nBreite: 612,8 mm\nTiefe: 47 mm",
    "reference_file": "offer_reference_972.json",
    "shop_name": "CSV-Direct.de"
}