{
    "html_file": "offer_1941_32.html",
    "name": "Dell P2421, 24.1\"",
    "offer_link": "https://ms-it-beratung.at/shop/details.php?art=343709&artname=Dell+61.2cm+%2824%2C1%22%29+P2421+++16%3A10+HDMI%2BDP%2BUSB+IPS+black",
    "price": 268.0,
    "raw_specifications": {
        "AC Eingangsfrequenz": "50 - 60 Hz",
        "AC Eingangsspannung": "120 - 230 V",
        "Anzahl DisplayPort Anschl\u00fcsse": "1",
        "Anzahl HDMI-Anschl\u00fcsse": "1",
        "Anzahl VGA (D-Sub) Anschl\u00fcsse": "1",
        "Anzahl der Farben des Displays": "16,7 Millionen Farben",
        "Anzahl der nachgeschalteten Steckpl\u00e4tze vom Typ USB-A": "4",
        "Anzahl der vorgeschalteten Steckpl\u00e4tze": "1",
        "Audioanschl\u00fcsse": "Nein",
        "Betriebstemperatur": "0 - 40 \u00b0C",
        "Bildschirmdiagonale": "61,2 cm (24.1\")",
        "Bildschirmform": "Flach",
        "Bildschirmtechnologie": "LCD",
        "Bildwinkel, horizontal": "178\u00b0",
        "Bildwinkel, vertikal": "178\u00b0",
        "Breite (ohne Standfu\u00df)": "531 mm",
        "DVI Anschluss": "Ja",
        "Display-Aufl\u00f6sung": "1920 x 1200 Pixel",
        "DisplayPorts-Version": "1.2",
        "Eingebaute Lautsprecher": "Nein",
        "Energieeffizienzklasse (SDR)": "D",
        "Energieeffizienzskala": "A bis G",
        "Energieverbrauch (SDR) pro 1.000 Stunden": "15 kWh",
        "Ger\u00e4tebreite (inkl. Fu\u00df)": "531 mm",
        "Ger\u00e4teh\u00f6he (inkl. Fu\u00df)": "500,8 mm",
        "Ger\u00e4tetiefe (inkl. Fu\u00df)": "166 mm",
        "Gewicht (mit St\u00e4nder)": "5,1 kg",
        "Gewicht (ohne St\u00e4nder)": "3,5 kg",
        "HD-Typ": "WUXGA",
        "HDMI": "Ja",
        "HDMI-Version": "1.4",
        "Helligkeit (typisch)": "300 cd/m\u00b2",
        "High Dynamic Range Video (HDR) Unterst\u00fctzung": "Nein",
        "Horizontaler Scanbereich": "30 - 83 kHz",
        "H\u00f6he (ohne Standfu\u00df)": "349,5 mm",
        "H\u00f6he bei Betrieb": "0 - 5000 m",
        "H\u00f6he bei Lagerung": "5000 - 12192 m",
        "H\u00f6heneinstellung": "13 cm",
        "H\u00f6henverstellung": "Ja",
        "Integrierte Kamera": "Nein",
        "Integrierter USB-Hub": "Ja",
        "Kabelsperre-Slot": "Ja",
        "Kontrastverh\u00e4ltnis": "1000:1",
        "Kopfh\u00f6rerausgang": "Nein",
        "Luftfeuchtigkeit bei Lagerung": "10 - 90%",
        "Marktpositionierung": "Business",
        "Maximale Bildwiederholrate": "60 Hz",
        "Mitgelieferte Kabel": "AC, DVI, DisplayPort, USB Typ-C auf USB Typ-C, VGA",
        "Nachhaltigkeitszertifikate": "RoHS, ENERGY STAR",
        "Natives Seitenverh\u00e4ltnis": "16:10",
        "Neigungsverstellung": "Ja",
        "Neigungswinkelbereich": "-5 - 21\u00b0",
        "Netzteiltyp": "Intern",
        "Paketgewicht": "7,3 kg",
        "Panel-Montage-Schnittstelle": "100 x 100 mm",
        "Panel-Typ": "IPS",
        "Pivot": "Ja",
        "Pivot Winkel": "-90 - 90\u00b0",
        "Pixel Abstand": "0,27 x 0,27 mm",
        "Pixeldichte": "94 ppi",
        "Produktfarbe": "Schwarz",
        "RGB-Farbraum": "sRGB",
        "Rahmenbreite (Seite)": "6,3 mm",
        "Rahmenbreite (oben)": "6,3 mm",
        "Rahmenbreite (unten)": "1,92 cm",
        "Reaktionszeit": "8 ms",
        "Reaktionszeit (schnell)": "5 ms",
        "Relative Luftfeuchtigkeit in Betrieb": "20 - 80%",
        "Schwenkbar": "Ja",
        "Schwenkwinkelbereich": "-45 - 45\u00b0",
        "Sichtbare Gr\u00f6\u00dfe (diagonal)": "61,1 cm",
        "Sichtbare Gr\u00f6\u00dfe (horizontal)": "51,8 cm",
        "Sichtbare Gr\u00f6\u00dfe (vertikal)": "32,4 cm",
        "Stromverbrauch (Standardbetrieb)": "14,8 W",
        "Stromverbrauch (Standby)": "0,2 W",
        "Stromverbrauch (aus)": "0,2 W",
        "Stromverbrauch (max.)": "42 W",
        "St\u00e4nder enthalten": "Ja",
        "Temperaturbereich bei Lagerung": "-20 - 60 \u00b0C",
        "Tiefe (ohne Standfu\u00df)": "44,1 mm",
        "Touchscreen": "Nein",
        "Typ der Hintergrundbeleuchtung": "LED",
        "USB-Hub-Version": "2.0 / 3.2 Gen 1 (3.1 Gen 1)",
        "Unterst\u00fctzte Grafik-Aufl\u00f6sungen": "640 x 480 (VGA), 720 x 400, 800 x 600 (SVGA), 1024 x 768 (XGA), 1152 x 864 (XGA+), 1280 x 1024 (SXGA), 1600 x 1200 (UXGA), 1920 x 1200 (WUXGA)",
        "Unterst\u00fctzte Video-Modi": "480i, 480p, 576i, 576p, 720p, 1080i, 1080p",
        "VESA-Halterung": "Ja",
        "Verpackungsbreite": "167 mm",
        "Verpackungsh\u00f6he": "420 mm",
        "Verpackungstiefe": "608 mm",
        "Vertikaler Scanbereich": "56 - 76 Hz",
        "WLAN": "Nein",
        "Warentarifnummer (HS)": "85285210",
        "sRGB Abdeckung (klassisch)": "99%"
    },
    "raw_specifications_text": "Bildschirmdiagonale: 61,2 cm (24.1\")\nDisplay-Aufl\u00f6sung: 1920 x 1200 Pixel\nNatives Seitenverh\u00e4ltnis: 16:10\nBildschirmtechnologie: LCD\nTouchscreen: Nein\nHD-Typ: WUXGA\nPanel-Typ: IPS\nTyp der Hintergrundbeleuchtung: LED\nHelligkeit (typisch): 300 cd/m\u00b2\nReaktionszeit: 8 ms\nBildschirmform: Flach\nUnterst\u00fctzte Grafik-Aufl\u00f6sungen: 640 x 480 (VGA), 720 x 400, 800 x 600 (SVGA), 1024 x 768 (XGA), 1152 x 864 (XGA+), 1280 x 1024 (SXGA), 1600 x 1200 (UXGA), 1920 x 1200 (WUXGA)\nUnterst\u00fctzte Video-Modi: 480i, 480p, 576i, 576p, 720p, 1080i, 1080p\nKontrastverh\u00e4ltnis: 1000:1\nMaximale Bildwiederholrate: 60 Hz\nBildwinkel, horizontal: 178\u00b0\nBildwinkel, vertikal: 178\u00b0\nAnzahl der Farben des Displays: 16,7 Millionen Farben\nReaktionszeit (schnell): 5 ms\nPixel Abstand: 0,27 x 0,27 mm\nPixeldichte: 94 ppi\nHorizontaler Scanbereich: 30 - 83 kHz\nVertikaler Scanbereich: 56 - 76 Hz\nSichtbare Gr\u00f6\u00dfe (horizontal): 51,8 cm\nSichtbare Gr\u00f6\u00dfe (vertikal): 32,4 cm\nSichtbare Gr\u00f6\u00dfe (diagonal): 61,1 cm\nHigh Dynamic Range Video (HDR) Unterst\u00fctzung: Nein\nRGB-Farbraum: sRGB\nsRGB Abdeckung (klassisch): 99%\nEingebaute Lautsprecher: Nein\nIntegrierte Kamera: Nein\nMarktpositionierung: Business\nProduktfarbe: Schwarz\nIntegrierter USB-Hub: Ja\nUSB-Hub-Version: 2.0 / 3.2 Gen 1 (3.1 Gen 1)\nAnzahl der vorgeschalteten Steckpl\u00e4tze: 1\nAnzahl der nachgeschalteten Steckpl\u00e4tze vom Typ USB-A: 4\nAnzahl VGA (D-Sub) Anschl\u00fcsse: 1\nDVI Anschluss: Ja\nHDMI: Ja\nAnzahl HDMI-Anschl\u00fcsse: 1\nHDMI-Version: 1.4\nAnzahl DisplayPort Anschl\u00fcsse: 1\nDisplayPorts-Version: 1.2\nAudioanschl\u00fcsse: Nein\nKopfh\u00f6rerausgang: Nein\nWLAN: Nein\nVESA-Halterung: Ja\nPanel-Montage-Schnittstelle: 100 x 100 mm\nKabelsperre-Slot: Ja\nH\u00f6henverstellung: Ja\nH\u00f6heneinstellung: 13 cm\nPivot: Ja\nPivot Winkel: -90 - 90\u00b0\nSchwenkbar: Ja\nSchwenkwinkelbereich: -45 - 45\u00b0\nNeigungswinkelbereich: -5 - 21\u00b0\nNeigungsverstellung: Ja\nEnergieeffizienzklasse (SDR): D\nEnergieverbrauch (SDR) pro 1.000 Stunden: 15 kWh\nStromverbrauch (Standardbetrieb): 14,8 W\nStromverbrauch (Standby): 0,2 W\nStromverbrauch (max.): 42 W\nStromverbrauch (aus): 0,2 W\nAC Eingangsspannung: 120 - 230 V\nAC Eingangsfrequenz: 50 - 60 Hz\nNetzteiltyp: Intern\nEnergieeffizienzskala: A bis G\nBetriebstemperatur: 0 - 40 \u00b0C\nTemperaturbereich bei Lagerung: -20 - 60 \u00b0C\nRelative Luftfeuchtigkeit in Betrieb: 20 - 80%\nLuftfeuchtigkeit bei Lagerung: 10 - 90%\nH\u00f6he bei Betrieb: 0 - 5000 m\nH\u00f6he bei Lagerung: 5000 - 12192 m\nSt\u00e4nder enthalten: Ja\nMitgelieferte Kabel: AC, DVI, DisplayPort, USB Typ-C auf USB Typ-C, VGA\nGer\u00e4tebreite (inkl. Fu\u00df): 531 mm\nGer\u00e4tetiefe (inkl. Fu\u00df): 166 mm\nGer\u00e4teh\u00f6he (inkl. Fu\u00df): 500,8 mm\nGewicht (mit St\u00e4nder): 5,1 kg\nBreite (ohne Standfu\u00df): 531 mm\nTiefe (ohne Standfu\u00df): 44,1 mm\nH\u00f6he (ohne Standfu\u00df): 349,5 mm\nGewicht (ohne St\u00e4nder): 3,5 kg\nRahmenbreite (Seite): 6,3 mm\nRahmenbreite (oben): 6,3 mm\nRahmenbreite (unten): 1,92 cm\nVerpackungsbreite: 167 mm\nVerpackungstiefe: 608 mm\nVerpackungsh\u00f6he: 420 mm\nPaketgewicht: 7,3 kg\nNachhaltigkeitszertifikate: RoHS, ENERGY STAR\nWarentarifnummer (HS): 85285210",
    "reference_file": "offer_reference_1941.json",
    "shop_name": "ms-it-beratung"
}