{
    "html_file": "offer_353_7.html",
    "name": "LG gram 16 +view 16MR70, 16\"",
    "offer_link": "https://www.alternate.at/LG/gram-plusview-16MR70-LED-Monitor/html/product/1917544?partner=AtGeizhalsat&campaign=Monitor/LG/1917544",
    "price": 282.0,
    "raw_specifications": {
        "": "Kontrast",
        "Abmessungen": "Breite: 360 mm x H\u00f6he: 245,5 mm x Tiefe/L\u00e4nge: 83 mm",
        "Anschl\u00fcsse": "2x USB-C",
        "Bild": "Glaretyp",
        "Bildschirmaufl\u00f6sung": "2.560 x 1.600 Pixel",
        "Bildschirmdiagonale": "40,6 cm (16 Zoll)",
        "EAN": "8806084054548",
        "Energieeffizienzklasse (SDR)": "D (A - G)",
        "Energieverbauch pro 1000 Stunden (SDR)": "9 kWh",
        "Ergonomie": "Typ",
        "Farbe": "silber",
        "Geeignet f\u00fcr": "Business",
        "Gewicht": "670 Gramm",
        "Hersteller-Nr.": "16MR70.ASDWU",
        "Leistungsaufnahme im Bereitschafts- und Aus-Zustand": "0,5 Watt",
        "Leistungsaufnahme im Ein-Zustand bei Standard-Dynamikumfang (SDR)": "9,2 Watt",
        "Standards": "Video",
        "Typ": "LED-Monitor",
        "Weitere Informationen": "die USB-C-Anschl\u00fcsse unterst\u00fctzen Display Alt Mode und Power Delivery bis zu 45 Watt | bei Verwendung mit einem USB-C-Ladeger\u00e4t (separat erh\u00e4ltlich) muss eine Eingangsleistung von 65 W und eine Ausgangsleistung von 45 W unterst\u00fctzt werden | das Display unterst\u00fctzt den Android Desktop Mode",
        "Zubeh\u00f6r": "Vorhanden"
    },
    "raw_specifications_text": "Energieeffizienzklasse (SDR): D (A - G)\nEnergieverbauch pro 1000 Stunden (SDR): 9 kWh\nLeistungsaufnahme im Ein-Zustand bei Standard-Dynamikumfang (SDR): 9,2 Watt\nLeistungsaufnahme im Bereitschafts- und Aus-Zustand: 0,5 Watt\nBildschirmdiagonale: 40,6 cm (16 Zoll)\nBildschirmaufl\u00f6sung: 2.560 x 1.600 Pixel\nTyp: LED-Monitor\nFarbe: silber\nEAN: 8806084054548\nHersteller-Nr.: 16MR70.ASDWU\nGeeignet f\u00fcr: Business\nBild: Glaretyp\n: Kontrast\nAnschl\u00fcsse: 2x USB-C\nErgonomie: Typ\nStandards: Video\nWeitere Informationen: die USB-C-Anschl\u00fcsse unterst\u00fctzen Display Alt Mode und Power Delivery bis zu 45 Watt | bei Verwendung mit einem USB-C-Ladeger\u00e4t (separat erh\u00e4ltlich) muss eine Eingangsleistung von 65 W und eine Ausgangsleistung von 45 W unterst\u00fctzt werden | das Display unterst\u00fctzt den Android Desktop Mode\nZubeh\u00f6r: Vorhanden\nAbmessungen: Breite: 360 mm x H\u00f6he: 245,5 mm x Tiefe/L\u00e4nge: 83 mm\nGewicht: 670 Gramm",
    "reference_file": "offer_reference_353.json",
    "shop_name": "Alternate.at"
}