{
    "html_file": "offer_1894_1.html",
    "name": "ASUS ProArt PA27UCX-K, 27\"",
    "offer_link": "https://www.amazon.de/dp/B089SRDQLW?linkCode=xm2&camp=2025&creative=165953&smid=A3JWKAKR8XB7XF&creativeASIN=B089SRDQLW&tag=geizhals1-21",
    "price": 1952.7,
    "raw_specifications": {
        "ASIN": "B089SRDQLW",
        "Amazon Bestseller-Rang": "Nr. 304,525 in Computer & Zubeh\u00f6r (Siehe Top 100 in Computer & Zubeh\u00f6r)  Nr. 3,888 in Monitore",
        "Antriebsart": "\u200eHandbetrieben",
        "Anzahl HDMI Schnittstellen": "\u200e3",
        "Anzahl USB 3.0 Schnittstellen": "\u200e3",
        "Anzahl der Lithium-Ionen-Zellen": "\u200e1",
        "Anzahl der Lithium-Metall-Zellen": "\u200e1",
        "Artikelgewicht": "\u200e3 Kilograms",
        "Batterien": "\u200e1 Lithium-Ionen Batterien erforderlich.",
        "Batterien enthalten": "\u200eNein",
        "Display-Gr\u00f6\u00dfe": "\u200e27 Zoll",
        "Durchschnittliche Kundenbewertung": "3,6  3,6 von 5 Sternen    \n    12 Sternebewertungen   \n\n\n 3,6 von 5 Sternen",
        "Farbe": "\u200eSchwarz",
        "Garantierte Software-Updates bis": "\u200eunbekannt",
        "Gewicht Lithium-Akku": "\u200e2 Gramm",
        "Hersteller": "\u200eASUS",
        "Im Angebot von Amazon.de seit": "8. Juni 2020",
        "Kapazit\u00e4t Lithium-Akku": "\u200e2 Kilowattstunden",
        "L\u00f6sung": "\u200e3840 x 2160 Pixels",
        "Marke": "\u200eASUS",
        "Modell/Serie": "\u200ePA27UCX-K",
        "Modellnummer": "\u200ePA27UCX-K",
        "Produktabmessungen": "\u200e22,88 x 62,52 x 54,45 cm; 3 Kilogramm",
        "Prozessortyp": "\u200eOthers",
        "Volt": "\u200e1 Volt"
    },
    "raw_specifications_text": "Marke: \u200eASUS\nHersteller: \u200eASUS\nModell/Serie: \u200ePA27UCX-K\nProduktabmessungen: \u200e22,88 x 62,52 x 54,45 cm; 3 Kilogramm\nBatterien: \u200e1 Lithium-Ionen Batterien erforderlich.\nModellnummer: \u200ePA27UCX-K\nFarbe: \u200eSchwarz\nDisplay-Gr\u00f6\u00dfe: \u200e27 Zoll\nL\u00f6sung: \u200e3840 x 2160 Pixels\nProzessortyp: \u200eOthers\nAnzahl USB 3.0 Schnittstellen: \u200e3\nAnzahl HDMI Schnittstellen: \u200e3\nVolt: \u200e1 Volt\nAntriebsart: \u200eHandbetrieben\nBatterien enthalten: \u200eNein\nKapazit\u00e4t Lithium-Akku: \u200e2 Kilowattstunden\nGewicht Lithium-Akku: \u200e2 Gramm\nAnzahl der Lithium-Ionen-Zellen: \u200e1\nAnzahl der Lithium-Metall-Zellen: \u200e1\nArtikelgewicht: \u200e3 Kilograms\nGarantierte Software-Updates bis: \u200eunbekannt\nASIN: B089SRDQLW\nDurchschnittliche Kundenbewertung: 3,6  3,6 von 5 Sternen    \n    12 Sternebewertungen   \n\n\n 3,6 von 5 Sternen\nAmazon Bestseller-Rang: Nr. 304,525 in Computer & Zubeh\u00f6r (Siehe Top 100 in Computer & Zubeh\u00f6r)  Nr. 3,888 in Monitore\nIm Angebot von Amazon.de seit: 8. Juni 2020",
    "reference_file": "offer_reference_1894.json",
    "shop_name": "Amazon.at"
}