{
    "html_file": "offer_1571_1.html",
    "name": "HANNspree HP248UJB, 23.8\"",
    "offer_link": "https://www.csv-direct.de/artinfo.php?artnr=AGX1380841&KATEGORIE=162&pva=geizhals2",
    "price": 124.45,
    "raw_specifications": {
        "Anzahl DisplayPort Anschl\u00fcsse": "1",
        "Anzahl HDMI-Anschl\u00fcsse": "1",
        "Anzahl OSD-Sprachen": "11",
        "Anzahl VGA D-Sub Anschl\u00fcsse": "1",
        "Anzahl der Farben des Displays": "16,7 Millionen Farben",
        "Anzahl der Lautsprecher": "2",
        "Anzahl der nachgeschalteten Steckpl\u00e4tze vom Typ USB-A": "2",
        "Anzahl der vorgeschalteten Steckpl\u00e4tze": "1",
        "Bildschirmdiagonale": "60,5 cm 23.8\"",
        "Bildschirmdiagonale cm": "60,45 cm",
        "Bildschirmform": "Flach",
        "Bildschirmtechnologie": "LED",
        "Bildwinkel, horizontal": "178\u00b0",
        "Bildwinkel, vertikal": "178\u00b0",
        "DVI Anschluss": "Nein",
        "Display-Aufl\u00f6sung": "1920 x 1080 Pixel",
        "Energieeffizienzklasse SDR": "D",
        "Energieverbrauch SDR pro 1.000 Stunden": "14 kWh",
        "Ger\u00e4tebreite inkl. Fu\u00df": "646,4 mm",
        "Ger\u00e4teh\u00f6he inkl. Fu\u00df": "540 mm",
        "Ger\u00e4tetiefe inkl. Fu\u00df": "251,4 mm",
        "Gewicht mit St\u00e4nder": "4,1 kg",
        "HD-Typ": "Full HD",
        "HDMI-Kabell\u00e4nge": "1,5 m",
        "Helligkeit typisch": "300 cd/m\u00b2",
        "Horizontaler Scanbereich": "30 - 83 kHz",
        "H\u00f6heneinstellung": "12 cm",
        "Integrierte Kamera": "Nein",
        "Kontrastverh\u00e4ltnis": "1000:1",
        "Kontrastverh\u00e4ltnis dynamisch": "80000000:1",
        "Maximale Bildwiederholrate": "60 Hz",
        "Mitgelieferte Kabel": "AC, HDMI",
        "Natives Seitenverh\u00e4ltnis": "16:9",
        "Neigungswinkelbereich": "-5 - 20\u00b0",
        "Oberfl\u00e4chenh\u00e4rte": "3H",
        "Paketgewicht": "5,2 kg",
        "Panel-Montage-Schnittstelle": "100 x 100 mm",
        "Panel-Typ": "ADS",
        "Pivot Winkel": "0 - 90\u00b0",
        "Pixel Abstand": "0,274 x 0,274 mm",
        "Produktfarbe": "Schwarz",
        "RMS-Leistung": "2 W",
        "Reaktionszeit": "4 ms",
        "Schwenkwinkelbereich": "-45 - 45\u00b0",
        "Seitenverh\u00e4ltnis": "16:9",
        "Slot-Typ Kabelsperre": "Kensington",
        "Touchscreen": "Nein",
        "USB-Hub-Version": "3.2 Gen 1 3.1 Gen 1",
        "Verpackungsbreite": "635 mm",
        "Verpackungsh\u00f6he": "402 mm",
        "Verpackungstiefe": "165 mm",
        "Vertikaler Scanbereich": "56 - 75 Hz",
        "Warentarifnummer HS": "85285210"
    },
    "raw_specifications_text": "Bildschirmdiagonale: 60,5 cm 23.8\"\nDisplay-Aufl\u00f6sung: 1920 x 1080 Pixel\nNatives Seitenverh\u00e4ltnis: 16:9\nBildschirmtechnologie: LED\nTouchscreen: Nein\nHD-Typ: Full HD\nPanel-Typ: ADS\nBildschirmform: Flach\nKontrastverh\u00e4ltnis: 1000:1\nMaximale Bildwiederholrate: 60 Hz\nAnzahl der Farben des Displays: 16,7 Millionen Farben\nHelligkeit typisch: 300 cd/m\u00b2\nReaktionszeit: 4 ms\nSeitenverh\u00e4ltnis: 16:9\nKontrastverh\u00e4ltnis dynamisch: 80000000:1\nBildwinkel, horizontal: 178\u00b0\nBildwinkel, vertikal: 178\u00b0\nPixel Abstand: 0,274 x 0,274 mm\nHorizontaler Scanbereich: 30 - 83 kHz\nVertikaler Scanbereich: 56 - 75 Hz\nBildschirmdiagonale cm: 60,45 cm\nOberfl\u00e4chenh\u00e4rte: 3H\nIntegrierte Kamera: Nein\nAnzahl der Lautsprecher: 2\nRMS-Leistung: 2 W\nProduktfarbe: Schwarz\nUSB-Hub-Version: 3.2 Gen 1 3.1 Gen 1\nAnzahl der vorgeschalteten Steckpl\u00e4tze: 1\nAnzahl der nachgeschalteten Steckpl\u00e4tze vom Typ USB-A: 2\nAnzahl VGA D-Sub Anschl\u00fcsse: 1\nDVI Anschluss: Nein\nAnzahl HDMI-Anschl\u00fcsse: 1\nAnzahl DisplayPort Anschl\u00fcsse: 1\nPanel-Montage-Schnittstelle: 100 x 100 mm\nSlot-Typ Kabelsperre: Kensington\nH\u00f6heneinstellung: 12 cm\nPivot Winkel: 0 - 90\u00b0\nSchwenkwinkelbereich: -45 - 45\u00b0\nNeigungswinkelbereich: -5 - 20\u00b0\nAnzahl OSD-Sprachen: 11\nEnergieeffizienzklasse SDR: D\nEnergieverbrauch SDR pro 1.000 Stunden: 14 kWh\nMitgelieferte Kabel: AC, HDMI\nHDMI-Kabell\u00e4nge: 1,5 m\nGer\u00e4tebreite inkl. Fu\u00df: 646,4 mm\nGer\u00e4tetiefe inkl. Fu\u00df: 251,4 mm\nGer\u00e4teh\u00f6he inkl. Fu\u00df: 540 mm\nGewicht mit St\u00e4nder: 4,1 kg\nVerpackungsbreite: 635 mm\nVerpackungstiefe: 165 mm\nVerpackungsh\u00f6he: 402 mm\nPaketgewicht: 5,2 kg\nWarentarifnummer HS: 85285210",
    "reference_file": "offer_reference_1571.json",
    "shop_name": "CSV-Direct.de"
}