{
    "html_file": "offer_1146_17.html",
    "name": "Samsung SR350 / SR354, 23.8\"",
    "offer_link": "https://www.electronicshop24.at/product_info.php?products_id=160000001208577768&ano=S1208577768&mno=LS24R350FZUXEN&ean=8806092176966&utm_medium=cpc&utm_campaign=preisvergleich&utm_content=item&utm_source=geizhals&ref=geizhals",
    "price": 112.0,
    "raw_specifications": {
        "Abmessungen (Breite x Tiefe x H\u00f6he)": "53.97 cm x 23.64 cm x 42.54 cm - mit Fu\u00df",
        "Adaptive-Sync Technologie": "AMD FreeSync",
        "Besonderheiten": "MagicBright, Spielmodus, Mega Dynamic Contrast Ratio, flimmerfreie Technologie, Image Size, Eco Saving Plus, Eye Saver Mode, FreeSync Technology",
        "Bildschirmtyp": "IPS",
        "Details zu Abmessungen & Gewicht": "Mit Fu\u00df - Breite: 53.97 cm - Tiefe: 23.64 cm - H\u00f6he: 42.54 cm - Gewicht: 3.4 kg \u00a6 Ohne Fu\u00df - Breite: 53.97 cm - Tiefe: 4.99 cm - H\u00f6he: 32.13 cm - Gewicht: 2.8 kg",
        "Diagonalabmessung": "61 cm (24\")",
        "Display-Typ": "LED-hintergrundbeleuchteter LCD-Monitor / TFT-Aktivmatrix",
        "Eingangsspannung": "Wechselstrom 100-240 V",
        "Einstellungen der Anzeigeposition": "Neigung",
        "Energie Effizienzklasse": "Klasse F",
        "Energieverbrauch pro Jahr": "32 kWh",
        "Enthaltene Kabel": "1 x HDMI-Kabel",
        "Farbe": "Dunkelgrau/blau",
        "Farbraum": "72% (CIE 1976)",
        "Farbunterst\u00fctzung": "16,7 Millionen Farben",
        "Gewicht": "3.4 kg",
        "Helligkeit": "250 cd/m\u00b2",
        "Hintergrundbeleuchtungs-Technologie": "LED-Hintergrundbeleuchtung",
        "Horizontaler Betrachtungswinkel": "178",
        "Kontrast": "1000:1",
        "Leistungsaufnahme im Ein-Zustand": "21 W",
        "Max. Betriebstemperatur": "40 \u00b0C",
        "Min Betriebstemperatur": "10 \u00b0C",
        "Native Aufl\u00f6sung": "Full HD (1080p) 1920 x 1080 bei 75 Hz",
        "Neigungswinkel": "-2/+22",
        "Reaktionszeit": "5 ms (Gray-to-Gray)",
        "Schnittstellen": "VGA \u00a6 HDMI",
        "Seitenverh\u00e4ltnis": "16:9",
        "Sichtbare Bildfl\u00e4che": "60.4 cm (23.8\")",
        "Stromverbrauch (Aus-Modus)": "0.3 Watt",
        "Stromverbrauch (max.)": "25 Watt",
        "Stromverbrauch (typisch)": "21 Watt",
        "Stromverbrauch SDR (eingeschaltet)": "21 kWh/1.000 h",
        "Stromverbrauch im Standby-Modus": "0.3 Watt",
        "Transportbreite": "61 cm",
        "Transportgewicht": "4.8 kg",
        "Transporth\u00f6he": "39 cm",
        "Transporttiefe": "15 cm",
        "VESA-Halterung": "75 x 75 mm",
        "Vertikaler Betrachtungswinkel": "178",
        "Zul\u00e4ssige Luftfeuchtigkeit im Betrieb": "10 - 80% (nicht kondensierend)"
    },
    "raw_specifications_text": "Display-Typ: LED-hintergrundbeleuchteter LCD-Monitor / TFT-Aktivmatrix\nEnergie Effizienzklasse: Klasse F\nEnergieverbrauch pro Jahr: 32 kWh\nDiagonalabmessung: 61 cm (24\")\nSichtbare Bildfl\u00e4che: 60.4 cm (23.8\")\nAdaptive-Sync Technologie: AMD FreeSync\nBildschirmtyp: IPS\nSeitenverh\u00e4ltnis: 16:9\nNative Aufl\u00f6sung: Full HD (1080p) 1920 x 1080 bei 75 Hz\nHelligkeit: 250 cd/m\u00b2\nKontrast: 1000:1\nFarbunterst\u00fctzung: 16,7 Millionen Farben\nFarbraum: 72% (CIE 1976)\nReaktionszeit: 5 ms (Gray-to-Gray)\nHorizontaler Betrachtungswinkel: 178\nVertikaler Betrachtungswinkel: 178\nHintergrundbeleuchtungs-Technologie: LED-Hintergrundbeleuchtung\nBesonderheiten: MagicBright, Spielmodus, Mega Dynamic Contrast Ratio, flimmerfreie Technologie, Image Size, Eco Saving Plus, Eye Saver Mode, FreeSync Technology\nFarbe: Dunkelgrau/blau\nAbmessungen (Breite x Tiefe x H\u00f6he): 53.97 cm x 23.64 cm x 42.54 cm - mit Fu\u00df\nGewicht: 3.4 kg\nSchnittstellen: VGA \u00a6 HDMI\nEinstellungen der Anzeigeposition: Neigung\nNeigungswinkel: -2/+22\nVESA-Halterung: 75 x 75 mm\nEnthaltene Kabel: 1 x HDMI-Kabel\nEingangsspannung: Wechselstrom 100-240 V\nLeistungsaufnahme im Ein-Zustand: 21 W\nStromverbrauch SDR (eingeschaltet): 21 kWh/1.000 h\nStromverbrauch (typisch): 21 Watt\nStromverbrauch (max.): 25 Watt\nStromverbrauch im Standby-Modus: 0.3 Watt\nStromverbrauch (Aus-Modus): 0.3 Watt\nDetails zu Abmessungen & Gewicht: Mit Fu\u00df - Breite: 53.97 cm - Tiefe: 23.64 cm - H\u00f6he: 42.54 cm - Gewicht: 3.4 kg \u00a6 Ohne Fu\u00df - Breite: 53.97 cm - Tiefe: 4.99 cm - H\u00f6he: 32.13 cm - Gewicht: 2.8 kg\nTransportbreite: 61 cm\nTransporttiefe: 15 cm\nTransporth\u00f6he: 39 cm\nTransportgewicht: 4.8 kg\nMin Betriebstemperatur: 10 \u00b0C\nMax. Betriebstemperatur: 40 \u00b0C\nZul\u00e4ssige Luftfeuchtigkeit im Betrieb: 10 - 80% (nicht kondensierend)",
    "reference_file": "offer_reference_1146.json",
    "shop_name": "ElectronicShop24"
}