{
    "html_file": "offer_2128_7.html",
    "name": "Lenovo ThinkVision T27p-10, 27\"",
    "offer_link": "https://www.taufnaus.de/product/12706984",
    "price": 839.52,
    "raw_specifications": {
        "Abmessungen (Breite x Tiefe x H\u00f6he)": "61.16 cm x 21 cm x 40.33 cm - mit Fu\u00df",
        "Bildschirmbeschichtung": "Blendfrei",
        "Bildschirmtyp": "IPS",
        "Details zu Abmessungen & Gewicht": "Mit Fu\u00df - Breite: 61.16 cm - Tiefe: 21 cm - H\u00f6he: 40.33 cm - Gewicht: 6.95 kg \u00a6 Ohne Fu\u00df - Breite: 61.16 cm - Tiefe: 4.5 cm - H\u00f6he: 36.84 cm - Gewicht: 5 kg",
        "Diagonalabmessung": "68.6 cm (27\")",
        "Display-Typ": "LED-hintergrundbeleuchteter LCD-Monitor / TFT-Aktivmatrix",
        "ENERGY STAR zertifiziert": "Ja",
        "ENERGY STAR-Version": "7.1",
        "Eingangsspannung": "Wechselstrom 120/230 V (50/60 Hz)",
        "Einstellungen der Anzeigeposition": "H\u00f6he, Pivot (Rotation), Drehung, Neigung",
        "Energie Effizienzklasse": "Klasse G",
        "Energierverbrauch Sleep": "0.5 Watt",
        "Enthaltene Kabel": "1 x USB-C Kabel - 1.8 m \u00a6 1 x HDMI-Kabel - 1.8 m",
        "Farbraum": "99%",
        "Farbunterst\u00fctzung": "1,07 Mrd. Farben",
        "Gewicht": "6.95 kg",
        "Helligkeit": "350 cd/m\u00b2",
        "Hintergrundbeleuchtungs-Technologie": "WLED",
        "Horizontaler Betrachtungswinkel": "178",
        "H\u00f6heneinstellung": "110 mm",
        "Integrierte Peripherieger\u00e4te": "USB 3.1 Gen.1 Hub",
        "Kennzeichnung": "CCC, RoHS, UL Environmental SPC Gold, China Energy standard Tier 2, TUV Rheinland Eye Comfort Certification",
        "Kontrast": "1000:1 / 3000000:1 (dynamisch)",
        "Leistungsaufnahme im Ein-Zustand": "29.7 W",
        "Leistungsmerkmale": "Slot f\u00fcr Sicherheitsschloss (Kabelschloss getrennt erh\u00e4ltlich)",
        "Lokalisierung": "Englisch / Gro\u00dfbritannien",
        "Native Aufl\u00f6sung": "4K 3840 x 2160",
        "Neigungswinkel": "-5/+30",
        "Pixelpitch": "0.1554 mm",
        "Ppi": "163",
        "Reaktionszeit": "6 ms, 14 ms (Gray-to-Gray), 4 ms (extrem)",
        "Rotationswinkel": "180",
        "Schlosstyp zur Diebstahlsicherung": "Kensington Slot",
        "Schnittstellen": "HDMI \u00a6 DisplayPort \u00a6 USB-C \u00a6 USB 3.1 Gen 1 Downstream mit Batterieladefunktion \u00a6 4 x USB 3.1 Gen 1 Downstream \u00a6 Kopfh\u00f6rer",
        "Schwenkwinkel": "90",
        "Seitenverh\u00e4ltnis": "16:9",
        "Service und Support": "Begrenzte Garantie - 3 Jahre",
        "Stromverbrauch (Aus-Modus)": "0.3 Watt",
        "Stromverbrauch (typisch)": "50 Watt",
        "Stromverbrauch SDR (eingeschaltet)": "29.7 kWh/1.000 h",
        "TCO-zertifiziert": "TCO Certified Displays 8, TCO Certified Edge Displays",
        "Transportbreite": "45.3 cm",
        "Transportgewicht": "11 kg",
        "Transporth\u00f6he": "21 cm",
        "Transporttiefe": "73.2 cm",
        "VESA-Halterung": "100 x 100 mm",
        "Vertikaler Betrachtungswinkel": "178"
    },
    "raw_specifications_text": "Display-Typ: LED-hintergrundbeleuchteter LCD-Monitor / TFT-Aktivmatrix\nEnergie Effizienzklasse: Klasse G\nDiagonalabmessung: 68.6 cm (27\")\nIntegrierte Peripherieger\u00e4te: USB 3.1 Gen.1 Hub\nBildschirmtyp: IPS\nSeitenverh\u00e4ltnis: 16:9\nNative Aufl\u00f6sung: 4K 3840 x 2160\nPixelpitch: 0.1554 mm\nPpi: 163\nHelligkeit: 350 cd/m\u00b2\nKontrast: 1000:1 / 3000000:1 (dynamisch)\nFarbunterst\u00fctzung: 1,07 Mrd. Farben\nFarbraum: 99%\nReaktionszeit: 6 ms, 14 ms (Gray-to-Gray), 4 ms (extrem)\nHorizontaler Betrachtungswinkel: 178\nVertikaler Betrachtungswinkel: 178\nBildschirmbeschichtung: Blendfrei\nHintergrundbeleuchtungs-Technologie: WLED\nAbmessungen (Breite x Tiefe x H\u00f6he): 61.16 cm x 21 cm x 40.33 cm - mit Fu\u00df\nGewicht: 6.95 kg\nSchnittstellen: HDMI \u00a6 DisplayPort \u00a6 USB-C \u00a6 USB 3.1 Gen 1 Downstream mit Batterieladefunktion \u00a6 4 x USB 3.1 Gen 1 Downstream \u00a6 Kopfh\u00f6rer\nEinstellungen der Anzeigeposition: H\u00f6he, Pivot (Rotation), Drehung, Neigung\nNeigungswinkel: -5/+30\nSchwenkwinkel: 90\nRotationswinkel: 180\nH\u00f6heneinstellung: 110 mm\nVESA-Halterung: 100 x 100 mm\nLeistungsmerkmale: Slot f\u00fcr Sicherheitsschloss (Kabelschloss getrennt erh\u00e4ltlich)\nEnthaltene Kabel: 1 x USB-C Kabel - 1.8 m \u00a6 1 x HDMI-Kabel - 1.8 m\nKennzeichnung: CCC, RoHS, UL Environmental SPC Gold, China Energy standard Tier 2, TUV Rheinland Eye Comfort Certification\nLokalisierung: Englisch / Gro\u00dfbritannien\nSchlosstyp zur Diebstahlsicherung: Kensington Slot\nEingangsspannung: Wechselstrom 120/230 V (50/60 Hz)\nLeistungsaufnahme im Ein-Zustand: 29.7 W\nStromverbrauch SDR (eingeschaltet): 29.7 kWh/1.000 h\nStromverbrauch (typisch): 50 Watt\nEnergierverbrauch Sleep: 0.5 Watt\nStromverbrauch (Aus-Modus): 0.3 Watt\nDetails zu Abmessungen & Gewicht: Mit Fu\u00df - Breite: 61.16 cm - Tiefe: 21 cm - H\u00f6he: 40.33 cm - Gewicht: 6.95 kg \u00a6 Ohne Fu\u00df - Breite: 61.16 cm - Tiefe: 4.5 cm - H\u00f6he: 36.84 cm - Gewicht: 5 kg\nTransportbreite: 45.3 cm\nTransporttiefe: 73.2 cm\nTransporth\u00f6he: 21 cm\nTransportgewicht: 11 kg\nTCO-zertifiziert: TCO Certified Displays 8, TCO Certified Edge Displays\nENERGY STAR zertifiziert: Ja\nENERGY STAR-Version: 7.1\nService und Support: Begrenzte Garantie - 3 Jahre",
    "reference_file": "offer_reference_2128.json",
    "shop_name": "TaufNaus"
}