{
    "html_file": "offer_1953_3.html",
    "name": "ViewSonic VX2776-SMH, 27\"",
    "offer_link": "https://www.mylemon.at/artikel/viewsonic/vx2776_smh/vx2776-smh-68-58cm-27zoll.html",
    "price": 164.19,
    "raw_specifications": {
        "AC Eingangsfrequenz": "50 - 60 Hz",
        "AC Eingangsspannung": "100 - 240 V",
        "AMD FreeSync": "Nein",
        "Abnehmbarer Standfu\u00df": "Ja",
        "Anzahl HDMI-Anschl\u00fcsse": "2",
        "Anzahl OSD-Sprachen": "14",
        "Anzahl VGA (D-Sub) Anschl\u00fcsse": "1",
        "Anzahl der Farben des Displays": "16,78 Millionen Farben",
        "Anzahl der Lautsprecher": "2",
        "Artikelnummer": "M11Y23HL",
        "Audioanschl\u00fcsse": "Ja",
        "Aufl\u00f6sung": "1920x1080",
        "Besonderheiten": "Lautsprecher",
        "Betriebstemperatur": "0 - 40 \u00b0C",
        "Bildschirmdiagonale": "68,6 cm (27\")",
        "Bildschirmdiagonale (cm)": "68,58 cm",
        "Bildschirmform": "Flach",
        "Bildschirmtechnologie": "LED",
        "Bildwinkel, horizontal": "178\u00b0",
        "Bildwinkel, vertikal": "178\u00b0",
        "Breite (ohne Standfu\u00df)": "614 mm",
        "DVI Anschluss": "Nein",
        "Display-Aufl\u00f6sung": "1920 x 1080 Pixel",
        "Displaygr\u00f6\u00dfe": "27 Zoll",
        "EAN": "766907006490",
        "Eingebaute Lautsprecher": "Ja",
        "Energieeffizienzklasse (SDR)": "F",
        "Energieverbrauch (SDR) pro 1.000 Stunden": "24 kWh",
        "Ergonomie": "Neigbar",
        "Farbtiefe": "8 Bit",
        "Flimmerfreie Technologie": "Ja",
        "Fu\u00dffarbe": "Silber",
        "Ger\u00e4tebreite (inkl. Fu\u00df)": "614 mm",
        "Ger\u00e4teh\u00f6he (inkl. Fu\u00df)": "443 mm",
        "Ger\u00e4tetiefe (inkl. Fu\u00df)": "184 mm",
        "Gewicht (mit St\u00e4nder)": "4 kg",
        "Gewicht (ohne St\u00e4nder)": "3,6 kg",
        "HD-Typ": "Full HD",
        "HDCP": "Ja",
        "HDMI": "Ja",
        "HDMI-Version": "1.4",
        "Helligkeit": "250 cd/m\u00b2",
        "Helligkeit (typisch)": "250 cd/m\u00b2",
        "Hersteller Artikelnummer": "VX2776-SMH",
        "Horizontaler Scanbereich": "15 - 83 kHz",
        "H\u00f6he (ohne Standfu\u00df)": "357 mm",
        "H\u00f6henverstellung": "Nein",
        "Integrierte Kamera": "Nein",
        "Integrierter USB-Hub": "Nein",
        "Kabelsperre-Slot": "Ja",
        "Kontrastverh\u00e4ltnis": "1000:1",
        "Kontrastverh\u00e4ltnis (dynamisch)": "80000000:1",
        "Kopfh\u00f6rer-Anschluss": "3,5 mm",
        "Kopfh\u00f6rerausgang": "Ja",
        "Kopfh\u00f6rerausg\u00e4nge": "1",
        "Low-Blue-Light-Technologie": "Ja",
        "Luftfeuchtigkeit bei Lagerung": "5 - 90%",
        "Marktpositionierung": "Haus",
        "Maximale Bildwiederholrate": "75 Hz",
        "Mitgelieferte Kabel": "AC, HDMI",
        "NTSC Abdeckung (typisch)": "72%",
        "NVIDIA G-SYNC": "Nein",
        "Natives Seitenverh\u00e4ltnis": "16:9",
        "Neigungsverstellung": "Ja",
        "Neigungswinkelbereich": "-3 - 21\u00b0",
        "Oberfl\u00e4chenh\u00e4rte": "3H",
        "On-Screen-Display (OSD)": "Ja",
        "Paketgewicht": "5,5 kg",
        "Panel": "IPS",
        "Panel-Montage-Schnittstelle": "75 x 75 mm",
        "Panel-Typ": "IPS",
        "Pixel Abstand": "0,311 x 0,311 mm",
        "Produktfarbe": "Silber",
        "RMS-Leistung": "4 W",
        "Rahmenloses Design": "Ja",
        "Reaktionszeit": "4 ms",
        "Relative Luftfeuchtigkeit in Betrieb": "20 - 90%",
        "Schnellstart\u00fcbersicht": "Ja",
        "Sichtbare Gr\u00f6\u00dfe (horizontal)": "59,8 cm",
        "Sichtbare Gr\u00f6\u00dfe (vertikal)": "33,6 cm",
        "Slot-Typ Kabelsperre": "Kensington",
        "Stromeingang": "Ja",
        "Stromverbrauch (PowerSave)": "18 W",
        "Stromverbrauch (Standardbetrieb)": "24 W",
        "Stromverbrauch (Standby)": "0,5 W",
        "Stromverbrauch (aus)": "0,3 W",
        "St\u00e4nder enthalten": "Ja",
        "Temperaturbereich bei Lagerung": "-20 - 60 \u00b0C",
        "Tiefe (ohne Standfu\u00df)": "49 mm",
        "Touchscreen": "Nein",
        "Unterst\u00fctzte Grafik-Aufl\u00f6sungen": "640 x 480 (VGA), 720 x 400, 800 x 600 (SVGA), 1024 x 768 (XGA), 1280 x 1024 (SXGA), 1440 x 900 (WXGA+), 1680 x 1050 (WSXGA+), 1920 x 1080 (HD 1080)",
        "Ursprungsland": "China",
        "VESA-Halterung": "Ja",
        "Verpackungsart": "Box",
        "Verpackungsbreite": "702 mm",
        "Verpackungsh\u00f6he": "462 mm",
        "Verpackungstiefe": "112 mm",
        "Vertikaler Scanbereich": "50 - 75 Hz",
        "Video Anschl\u00fcsse": "1x VGA, 2x HDMI",
        "Vorderer Rahmen": "Silber",
        "Warentarifnummer (HS)": "85285210",
        "Zertifizierung": "CE, CE EMC, CB, ErP, REACH, WEEE, EAC, UkrSEPRO, BSMI",
        "sRGB Abdeckung (klassisch)": "100%"
    },
    "raw_specifications_text": "Displaygr\u00f6\u00dfe: 27 Zoll\nAufl\u00f6sung: 1920x1080\nPanel: IPS\nReaktionszeit: 4 ms\nVideo Anschl\u00fcsse: 1x VGA, 2x HDMI\nErgonomie: Neigbar\nHelligkeit: 250 cd/m\u00b2\nBesonderheiten: Lautsprecher\nHersteller Artikelnummer: VX2776-SMH\nEAN: 766907006490\nArtikelnummer: M11Y23HL\nBildschirmdiagonale: 68,6 cm (27\")\nDisplay-Aufl\u00f6sung: 1920 x 1080 Pixel\nNatives Seitenverh\u00e4ltnis: 16:9\nBildschirmtechnologie: LED\nTouchscreen: Nein\nHD-Typ: Full HD\nPanel-Typ: IPS\nBildschirmform: Flach\nKontrastverh\u00e4ltnis: 1000:1\nMaximale Bildwiederholrate: 75 Hz\nAnzahl der Farben des Displays: 16,78 Millionen Farben\nHelligkeit (typisch): 250 cd/m\u00b2\nUnterst\u00fctzte Grafik-Aufl\u00f6sungen: 640 x 480 (VGA), 720 x 400, 800 x 600 (SVGA), 1024 x 768 (XGA), 1280 x 1024 (SXGA), 1440 x 900 (WXGA+), 1680 x 1050 (WSXGA+), 1920 x 1080 (HD 1080)\nKontrastverh\u00e4ltnis (dynamisch): 80000000:1\nBildwinkel, horizontal: 178\u00b0\nBildwinkel, vertikal: 178\u00b0\nPixel Abstand: 0,311 x 0,311 mm\nHorizontaler Scanbereich: 15 - 83 kHz\nVertikaler Scanbereich: 50 - 75 Hz\nSichtbare Gr\u00f6\u00dfe (horizontal): 59,8 cm\nSichtbare Gr\u00f6\u00dfe (vertikal): 33,6 cm\nBildschirmdiagonale (cm): 68,58 cm\nOberfl\u00e4chenh\u00e4rte: 3H\nFarbtiefe: 8 Bit\nsRGB Abdeckung (klassisch): 100%\nNTSC Abdeckung (typisch): 72%\nNVIDIA G-SYNC: Nein\nAMD FreeSync: Nein\nFlimmerfreie Technologie: Ja\nLow-Blue-Light-Technologie: Ja\nEingebaute Lautsprecher: Ja\nIntegrierte Kamera: Nein\nAnzahl der Lautsprecher: 2\nRMS-Leistung: 4 W\nMarktpositionierung: Haus\nProduktfarbe: Silber\nRahmenloses Design: Ja\nVorderer Rahmen: Silber\nAbnehmbarer Standfu\u00df: Ja\nFu\u00dffarbe: Silber\nUrsprungsland: China\nZertifizierung: CE, CE EMC, CB, ErP, REACH, WEEE, EAC, UkrSEPRO, BSMI\nIntegrierter USB-Hub: Nein\nHDMI: Ja\nKopfh\u00f6rerausgang: Ja\nAnzahl VGA (D-Sub) Anschl\u00fcsse: 1\nDVI Anschluss: Nein\nAnzahl HDMI-Anschl\u00fcsse: 2\nHDMI-Version: 1.4\nAudioanschl\u00fcsse: Ja\nKopfh\u00f6rerausg\u00e4nge: 1\nKopfh\u00f6rer-Anschluss: 3,5 mm\nHDCP: Ja\nStromeingang: Ja\nVESA-Halterung: Ja\nKabelsperre-Slot: Ja\nH\u00f6henverstellung: Nein\nPanel-Montage-Schnittstelle: 75 x 75 mm\nSlot-Typ Kabelsperre: Kensington\nNeigungswinkelbereich: -3 - 21\u00b0\nOn-Screen-Display (OSD): Ja\nAnzahl OSD-Sprachen: 14\nNeigungsverstellung: Ja\nEnergieeffizienzklasse (SDR): F\nEnergieverbrauch (SDR) pro 1.000 Stunden: 24 kWh\nStromverbrauch (Standardbetrieb): 24 W\nStromverbrauch (Standby): 0,5 W\nStromverbrauch (aus): 0,3 W\nStromverbrauch (PowerSave): 18 W\nAC Eingangsspannung: 100 - 240 V\nAC Eingangsfrequenz: 50 - 60 Hz\nBetriebstemperatur: 0 - 40 \u00b0C\nTemperaturbereich bei Lagerung: -20 - 60 \u00b0C\nRelative Luftfeuchtigkeit in Betrieb: 20 - 90%\nLuftfeuchtigkeit bei Lagerung: 5 - 90%\nSt\u00e4nder enthalten: Ja\nMitgelieferte Kabel: AC, HDMI\nSchnellstart\u00fcbersicht: Ja\nGer\u00e4tebreite (inkl. Fu\u00df): 614 mm\nGer\u00e4tetiefe (inkl. Fu\u00df): 184 mm\nGer\u00e4teh\u00f6he (inkl. Fu\u00df): 443 mm\nGewicht (mit St\u00e4nder): 4 kg\nBreite (ohne Standfu\u00df): 614 mm\nTiefe (ohne Standfu\u00df): 49 mm\nH\u00f6he (ohne Standfu\u00df): 357 mm\nGewicht (ohne St\u00e4nder): 3,6 kg\nVerpackungsbreite: 702 mm\nVerpackungstiefe: 112 mm\nVerpackungsh\u00f6he: 462 mm\nPaketgewicht: 5,5 kg\nVerpackungsart: Box\nWarentarifnummer (HS): 85285210",
    "reference_file": "offer_reference_1953.json",
    "shop_name": "mylemon.at"
}