{
    "html_file": "offer_2419_26.html",
    "name": "ASUS VZ249HE, 23.8\"",
    "offer_link": "https://technikladen.at/P-ASUS-VZ249HE-605-cm-238-Zoll-1920-x-1080-Pixel-Full-HD-LED-5-ms-Schwarz?tl=gzhls",
    "price": 174.33,
    "raw_specifications": {
        "3D": "Nein",
        "AC Eingangsfrequenz": "50 - 60 Hz",
        "AC Eingangsspannung": "100 - 240 V",
        "AMD FreeSync": "Nein",
        "Anzahl HDMI-Anschl\u00fcsse": "1",
        "Anzahl VGA (D-Sub) Anschl\u00fcsse": "1",
        "Anzahl der Farben des Displays": "16,78 Millionen Farben",
        "Anzeige": "LED",
        "Bildschirmaufl\u00f6sung": "1920 x 1080 Pixel",
        "Bildschirmdiagonale": "60,5 cm",
        "Bildschirmform": "Flach",
        "Bildschirmtechnologie": "LED",
        "Bildwinkel, horizontal": "178 \u00b0",
        "Bildwinkel, vertikal": "178 \u00b0",
        "Blickwinkel, horizontal": "178 \u00b0",
        "Blickwinkel, vertikal": "178 \u00b0",
        "Breite (ohne Standfu\u00df)": "54 cm",
        "DVI Anschluss": "Nein",
        "Digital horizontale Frequenz": "30 - 80 kHz",
        "Digital vertikale Frequenz": "56 - 76 Hz",
        "Display": "LED",
        "Display-Oberfl\u00e4che": "Matt",
        "Eingebaute Lautsprecher": "Nein",
        "Energieeffizienzklasse (SDR)": "E",
        "Energieeffizienzskala": "A bis G",
        "Energieverbrauch (SDR) pro 1.000 Stunden": "16 kWh",
        "Ger\u00e4tebreite (inkl. Fu\u00df)": "540 mm",
        "Ger\u00e4teh\u00f6he (inkl. Fu\u00df)": "391 mm",
        "Ger\u00e4tetiefe (inkl. Fu\u00df)": "211 mm",
        "Gewicht (ohne St\u00e4nder)": "2,9 kg",
        "HD-Typ": "Full HD",
        "HDCP": "Ja",
        "Helligkeit (typisch)": "250 cd/m\u00b2",
        "H\u00f6he (ohne Standfu\u00df)": "32,3 cm",
        "Integrierte Kamera": "Nein",
        "Integrierter USB-Hub": "Nein",
        "Kabelsperre-Slot": "Ja",
        "Kontrastverh\u00e4ltnis (dynamisch)": "80000000:1",
        "NVIDIA G-SYNC": "Nein",
        "Nachhaltigkeitszertifikate": "ENERGY STAR",
        "Natives Seitenverh\u00e4ltnis": "16:9",
        "Neigungswinkelbereich": "-5 - 22 \u00b0",
        "Paketgewicht": "4,4 kg",
        "Panel-Typ": "IPS",
        "Pixel Abstand": "0,265 x 0,265 mm",
        "Produktfarbe": "Schwarz",
        "Reaktionszeit": "5 ms",
        "Seitenverh\u00e4ltnis": "16:9",
        "Slot-Typ Kabelsperre": "Kensington",
        "Spiel-Modus": "Ja",
        "Stromverbrauch (Standardbetrieb)": "16,3 W",
        "Stromverbrauch (Standby)": "0,2 W",
        "Stromverbrauch (aus)": "0,2 W",
        "TV Tuner integriert": "Nein",
        "Thin Client installiert": "Nein",
        "Tiefe (ohne Standfu\u00df)": "3,7 cm",
        "Zertifizierung": "Energy Star\u00ae, BSMI, CB, CCC, CE, CEL level 1, C-Tick, CU, EPEAT () by region , ErP, FCC, RoHS, UL/cUL, VCCI, WEEE, WHQL (Windows 10, Windows 8.1, Windows 7), TUV Flicker-free , TUV Low Blue Light",
        "kippbar": "Ja"
    },
    "raw_specifications_text": "Bildschirmdiagonale: 60,5 cm\nBildschirmaufl\u00f6sung: 1920 x 1080 Pixel\nHD-Typ: Full HD\nBildschirmtechnologie: LED\nDisplay: LED\nDisplay-Oberfl\u00e4che: Matt\nReaktionszeit: 5 ms\nNatives Seitenverh\u00e4ltnis: 16:9\nSeitenverh\u00e4ltnis: 16:9\nBildwinkel, horizontal: 178 \u00b0\nBildwinkel, vertikal: 178 \u00b0\nProduktfarbe: Schwarz\nNVIDIA G-SYNC: Nein\nAMD FreeSync: Nein\nSpiel-Modus: Ja\nPanel-Typ: IPS\nHelligkeit (typisch): 250 cd/m\u00b2\nBildschirmform: Flach\nKontrastverh\u00e4ltnis (dynamisch): 80000000:1\nBlickwinkel, horizontal: 178 \u00b0\nBlickwinkel, vertikal: 178 \u00b0\nAnzahl der Farben des Displays: 16,78 Millionen Farben\n3D: Nein\nPixel Abstand: 0,265 x 0,265 mm\nDigital horizontale Frequenz: 30 - 80 kHz\nDigital vertikale Frequenz: 56 - 76 Hz\nIntegrierter USB-Hub: Nein\nAnzahl VGA (D-Sub) Anschl\u00fcsse: 1\nDVI Anschluss: Nein\nAnzahl HDMI-Anschl\u00fcsse: 1\nHDCP: Ja\nEingebaute Lautsprecher: Nein\nIntegrierte Kamera: Nein\nZertifizierung: Energy Star\u00ae, BSMI, CB, CCC, CE, CEL level 1, C-Tick, CU, EPEAT () by region , ErP, FCC, RoHS, UL/cUL, VCCI, WEEE, WHQL (Windows 10, Windows 8.1, Windows 7), TUV Flicker-free , TUV Low Blue Light\nAnzeige: LED\nTV Tuner integriert: Nein\nEnergieeffizienzklasse (SDR): E\nEnergieverbrauch (SDR) pro 1.000 Stunden: 16 kWh\nStromverbrauch (Standardbetrieb): 16,3 W\nStromverbrauch (Standby): 0,2 W\nStromverbrauch (aus): 0,2 W\nAC Eingangsspannung: 100 - 240 V\nAC Eingangsfrequenz: 50 - 60 Hz\nEnergieeffizienzskala: A bis G\nThin Client installiert: Nein\nKabelsperre-Slot: Ja\nSlot-Typ Kabelsperre: Kensington\nkippbar: Ja\nNeigungswinkelbereich: -5 - 22 \u00b0\nGer\u00e4tebreite (inkl. Fu\u00df): 540 mm\nGer\u00e4tetiefe (inkl. Fu\u00df): 211 mm\nGer\u00e4teh\u00f6he (inkl. Fu\u00df): 391 mm\nBreite (ohne Standfu\u00df): 54 cm\nTiefe (ohne Standfu\u00df): 3,7 cm\nH\u00f6he (ohne Standfu\u00df): 32,3 cm\nGewicht (ohne St\u00e4nder): 2,9 kg\nNachhaltigkeitszertifikate: ENERGY STAR\nPaketgewicht: 4,4 kg",
    "reference_file": "offer_reference_2419.json",
    "shop_name": "TechnikLaden"
}