{
    "html_file": "offer_442_3.html",
    "name": "MSI PRO MP273P, 27\"",
    "offer_link": "https://www.taufnaus.de/product/12952867",
    "price": 294.76,
    "raw_specifications": {
        "Abmessungen (Breite x Tiefe x H\u00f6he)": "61.35 cm x 20.08 cm x 41.34 cm - mit Fu\u00df",
        "Adaptive-Sync Technologie": "AMD FreeSync",
        "Ausgangsleistung/Kanal": "2 Watt",
        "Besonderheiten": "MSI Anti-Flicker, an 3 Seiten ohne Blende, Less Blue Light PRO",
        "Bildschirmbeschichtung": "Blendfrei",
        "Bildschirmtyp": "IPS",
        "Diagonalabmessung": "68.6 cm (27\")",
        "Display-Typ": "LED-hintergrundbeleuchteter LCD-Monitor / TFT-Aktivmatrix",
        "ENERGY STAR zertifiziert": "Ja",
        "Eingangsspannung": "Wechselstrom 100-240 V (50/60 Hz)",
        "Einstellungen der Anzeigeposition": "H\u00f6he, Pivot (Rotation), Drehung, Neigung",
        "Energie Effizienzklasse": "Klasse E",
        "Farbraum": "108% sRGB (CIE 1976)",
        "Farbunterst\u00fctzung": "16,7 Millionen Farben (8-Bit)",
        "Gewicht": "5.67 kg",
        "Helligkeit": "250 cd/m\u00b2",
        "Hintergrundbeleuchtungs-Technologie": "LED-Hintergrundbeleuchtung",
        "Horizontaler Betrachtungswinkel": "178",
        "H\u00f6heneinstellung": "110 mm",
        "Kennzeichnung": "BSMI, FCC Part 15 B, WEEE 2012/19/EU, TUV Rheinland Flicker Free Certification, JIS C 0950, REACH 2006/1907/EC, TUV Rheinland Low Blue Light (Hardware Solution)",
        "Kontrast": "1000:1",
        "Leistungsmerkmale": "Slot f\u00fcr Sicherheitsschloss (Kabelschloss getrennt erh\u00e4ltlich)",
        "Max. Betriebstemperatur": "40 \u00b0C",
        "Min Betriebstemperatur": "0 \u00b0C",
        "Native Aufl\u00f6sung": "Full HD (1080p) 1920 x 1080 bei 75 Hz",
        "Neigungswinkel": "-5/+20",
        "Pixelpitch": "0.3114 mm",
        "Reaktionszeit": "5 ms (Gray-to-Gray)",
        "Rotationswinkel": "-90/+90",
        "Schlosstyp zur Diebstahlsicherung": "Kensington Slot",
        "Schnittstellen": "HDMI 1.4b \u00a6 DisplayPort 1.2a \u00a6 Kopfh\u00f6rer",
        "Schwenkwinkel": "60",
        "Seitenverh\u00e4ltnis": "16:9",
        "Stromverbrauch SDR (eingeschaltet)": "21 kWh/1.000 h",
        "Transportbreite": "84.1 cm",
        "Transportgewicht": "7.6 kg",
        "Transporth\u00f6he": "44.8 cm",
        "Transporttiefe": "13.1 cm",
        "Typ": "Lautsprecher",
        "VESA-Halterung": "75 x 75 mm",
        "Vertikaler Betrachtungswinkel": "178",
        "Zul\u00e4ssige Luftfeuchtigkeit im Betrieb": "20 - 90% (nicht kondensierend)"
    },
    "raw_specifications_text": "Display-Typ: LED-hintergrundbeleuchteter LCD-Monitor / TFT-Aktivmatrix\nEnergie Effizienzklasse: Klasse E\nDiagonalabmessung: 68.6 cm (27\")\nAdaptive-Sync Technologie: AMD FreeSync\nBildschirmtyp: IPS\nSeitenverh\u00e4ltnis: 16:9\nNative Aufl\u00f6sung: Full HD (1080p) 1920 x 1080 bei 75 Hz\nPixelpitch: 0.3114 mm\nHelligkeit: 250 cd/m\u00b2\nKontrast: 1000:1\nFarbunterst\u00fctzung: 16,7 Millionen Farben (8-Bit)\nFarbraum: 108% sRGB (CIE 1976)\nReaktionszeit: 5 ms (Gray-to-Gray)\nHorizontaler Betrachtungswinkel: 178\nVertikaler Betrachtungswinkel: 178\nBildschirmbeschichtung: Blendfrei\nHintergrundbeleuchtungs-Technologie: LED-Hintergrundbeleuchtung\nBesonderheiten: MSI Anti-Flicker, an 3 Seiten ohne Blende, Less Blue Light PRO\nAbmessungen (Breite x Tiefe x H\u00f6he): 61.35 cm x 20.08 cm x 41.34 cm - mit Fu\u00df\nGewicht: 5.67 kg\nTyp: Lautsprecher\nAusgangsleistung/Kanal: 2 Watt\nSchnittstellen: HDMI 1.4b \u00a6 DisplayPort 1.2a \u00a6 Kopfh\u00f6rer\nEinstellungen der Anzeigeposition: H\u00f6he, Pivot (Rotation), Drehung, Neigung\nNeigungswinkel: -5/+20\nSchwenkwinkel: 60\nRotationswinkel: -90/+90\nH\u00f6heneinstellung: 110 mm\nVESA-Halterung: 75 x 75 mm\nLeistungsmerkmale: Slot f\u00fcr Sicherheitsschloss (Kabelschloss getrennt erh\u00e4ltlich)\nKennzeichnung: BSMI, FCC Part 15 B, WEEE 2012/19/EU, TUV Rheinland Flicker Free Certification, JIS C 0950, REACH 2006/1907/EC, TUV Rheinland Low Blue Light (Hardware Solution)\nSchlosstyp zur Diebstahlsicherung: Kensington Slot\nEingangsspannung: Wechselstrom 100-240 V (50/60 Hz)\nStromverbrauch SDR (eingeschaltet): 21 kWh/1.000 h\nTransportbreite: 84.1 cm\nTransporttiefe: 13.1 cm\nTransporth\u00f6he: 44.8 cm\nTransportgewicht: 7.6 kg\nENERGY STAR zertifiziert: Ja\nMin Betriebstemperatur: 0 \u00b0C\nMax. Betriebstemperatur: 40 \u00b0C\nZul\u00e4ssige Luftfeuchtigkeit im Betrieb: 20 - 90% (nicht kondensierend)",
    "reference_file": "offer_reference_442.json",
    "shop_name": "TaufNaus"
}