{
    "html_file": "offer_1822_1.html",
    "name": "Dell S2421HSX schwarz, 23.8\"",
    "offer_link": "https://www.taufnaus.de/product/13583527",
    "price": 236.01,
    "raw_specifications": {
        "Abmessungen (Breite x Tiefe x H\u00f6he)": "53.78 cm x 15.97 cm x 34.68 cm - mit Fu\u00df",
        "Adaptive-Sync Technologie": "AMD FreeSync",
        "Besonderheiten": "LED-Randlichtsystem, flimmerfreie Technologie, BFR/PVC-frei, ohne Quecksilber, arsenfreies Glas, Dell Easy Arrange, Dell ComfortView, Low Blue Light-Technologie, an 3 Seiten ohne Blende",
        "Bildschirmbeschichtung": "Anti-glare 3H hardness",
        "Bildschirmtyp": "IPS",
        "Details zu Abmessungen & Gewicht": "Mit Fu\u00df - Breite: 53.78 cm - Tiefe: 15.97 cm - H\u00f6he: 34.68 cm \u00a6 Ohne Fu\u00df - Gewicht: 3.2 kg",
        "Diagonalabmessung": "60.5 cm (23.8\")",
        "Display-Typ": "LED-hintergrundbeleuchteter LCD-Monitor / TFT-Aktivmatrix",
        "ENERGY STAR zertifiziert": "Ja",
        "Eingangsspannung": "Wechselstrom 100/240 V (50/60 Hz)",
        "Einstellungen der Anzeigeposition": "H\u00f6he, Pivot (Rotation), Drehung, Neigung",
        "Energie Effizienzklasse": "Klasse D",
        "Enthaltene Kabel": "1 x HDMI-Kabel",
        "Farbe": "Schwarz",
        "Farbraum": "72% NTSC (CIE 1931), 99% sRGB",
        "Farbunterst\u00fctzung": "16,7 Millionen Farben",
        "Helligkeit": "250 cd/m\u00b2",
        "Hintergrundbeleuchtungs-Technologie": "LED-Hintergrundbeleuchtung",
        "Horizontaler Betrachtungswinkel": "178",
        "H\u00f6heneinstellung": "100 mm",
        "Kennzeichnung": "RoHS, DisplayPort 1.2, HDCP 1.4",
        "Kontrast": "1000:1",
        "Leistungsaufnahme im Ein-Zustand": "11.6 W",
        "Leistungsmerkmale": "Slot f\u00fcr Sicherheitsschloss (Kabelschloss getrennt erh\u00e4ltlich)",
        "Max. Betriebstemperatur": "40 \u00b0C",
        "Min Betriebstemperatur": "0 \u00b0C",
        "Mitgelieferte Software": "Dell Display Manager",
        "Native Aufl\u00f6sung": "Full HD (1080p) 1920 x 1080 bei 75 Hz",
        "Neigungswinkel": "-5/+21",
        "Pixelpitch": "0.2745 mm",
        "Ppi": "92.56",
        "Reaktionszeit": "4 ms (Grau-zu-Grau extrem)",
        "Rotationswinkel": "180",
        "Schlosstyp zur Diebstahlsicherung": "Kensington Slot",
        "Schnittstellen": "HDMI (HDCP 1.4) \u00a6 DisplayPort 1.2 \u00a6 Audio Line-Out",
        "Schwenkwinkel": "60",
        "Seitenverh\u00e4ltnis": "16:9",
        "Services im Bundle": "3 Jahre Advanced Exchange Service und Premium Panel Exchange",
        "Stromverbrauch (Aus-Modus)": "0.2 Watt",
        "Stromverbrauch (max.)": "23 Watt",
        "Stromverbrauch (typisch)": "18 Watt",
        "Stromverbrauch SDR (eingeschaltet)": "11.6 kWh/1.000 h",
        "Stromverbrauch im Standby-Modus": "0.2 Watt",
        "TCO-zertifiziert": "TCO Certified Displays 8",
        "VESA-Halterung": "100 x 100 mm",
        "Vertikaler Betrachtungswinkel": "178",
        "Zubeh\u00f6r im Lieferumfang": "Aufstellung, Standfu\u00df"
    },
    "raw_specifications_text": "Display-Typ: LED-hintergrundbeleuchteter LCD-Monitor / TFT-Aktivmatrix\nEnergie Effizienzklasse: Klasse D\nDiagonalabmessung: 60.5 cm (23.8\")\nAdaptive-Sync Technologie: AMD FreeSync\nBildschirmtyp: IPS\nSeitenverh\u00e4ltnis: 16:9\nNative Aufl\u00f6sung: Full HD (1080p) 1920 x 1080 bei 75 Hz\nPixelpitch: 0.2745 mm\nPpi: 92.56\nHelligkeit: 250 cd/m\u00b2\nKontrast: 1000:1\nFarbunterst\u00fctzung: 16,7 Millionen Farben\nFarbraum: 72% NTSC (CIE 1931), 99% sRGB\nReaktionszeit: 4 ms (Grau-zu-Grau extrem)\nHorizontaler Betrachtungswinkel: 178\nVertikaler Betrachtungswinkel: 178\nBildschirmbeschichtung: Anti-glare 3H hardness\nHintergrundbeleuchtungs-Technologie: LED-Hintergrundbeleuchtung\nBesonderheiten: LED-Randlichtsystem, flimmerfreie Technologie, BFR/PVC-frei, ohne Quecksilber, arsenfreies Glas, Dell Easy Arrange, Dell ComfortView, Low Blue Light-Technologie, an 3 Seiten ohne Blende\nFarbe: Schwarz\nAbmessungen (Breite x Tiefe x H\u00f6he): 53.78 cm x 15.97 cm x 34.68 cm - mit Fu\u00df\nSchnittstellen: HDMI (HDCP 1.4) \u00a6 DisplayPort 1.2 \u00a6 Audio Line-Out\nEinstellungen der Anzeigeposition: H\u00f6he, Pivot (Rotation), Drehung, Neigung\nNeigungswinkel: -5/+21\nSchwenkwinkel: 60\nRotationswinkel: 180\nH\u00f6heneinstellung: 100 mm\nVESA-Halterung: 100 x 100 mm\nLeistungsmerkmale: Slot f\u00fcr Sicherheitsschloss (Kabelschloss getrennt erh\u00e4ltlich)\nZubeh\u00f6r im Lieferumfang: Aufstellung, Standfu\u00df\nEnthaltene Kabel: 1 x HDMI-Kabel\nKennzeichnung: RoHS, DisplayPort 1.2, HDCP 1.4\nSchlosstyp zur Diebstahlsicherung: Kensington Slot\nEingangsspannung: Wechselstrom 100/240 V (50/60 Hz)\nLeistungsaufnahme im Ein-Zustand: 11.6 W\nStromverbrauch SDR (eingeschaltet): 11.6 kWh/1.000 h\nStromverbrauch (typisch): 18 Watt\nStromverbrauch (max.): 23 Watt\nStromverbrauch im Standby-Modus: 0.2 Watt\nStromverbrauch (Aus-Modus): 0.2 Watt\nMitgelieferte Software: Dell Display Manager\nDetails zu Abmessungen & Gewicht: Mit Fu\u00df - Breite: 53.78 cm - Tiefe: 15.97 cm - H\u00f6he: 34.68 cm \u00a6 Ohne Fu\u00df - Gewicht: 3.2 kg\nTCO-zertifiziert: TCO Certified Displays 8\nENERGY STAR zertifiziert: Ja\nServices im Bundle: 3 Jahre Advanced Exchange Service und Premium Panel Exchange\nMin Betriebstemperatur: 0 \u00b0C\nMax. Betriebstemperatur: 40 \u00b0C",
    "reference_file": "offer_reference_1822.json",
    "shop_name": "TaufNaus"
}