{
    "html_file": "offer_1175_3.html",
    "name": "Dell E2422HN, 23.8\"",
    "offer_link": "https://www.mylemon.at/artikel/dell/dell_e2422hn/24-monitor-e2422hn-60-5.html",
    "price": 139.59,
    "raw_specifications": {
        "AC Eingangsfrequenz": "50 - 60 Hz",
        "AC Eingangsspannung": "100 - 240 V",
        "Anzahl HDMI-Anschl\u00fcsse": "1",
        "Anzahl VGA (D-Sub) Anschl\u00fcsse": "1",
        "Anzahl der Farben des Displays": "16,7 Millionen Farben",
        "Artikelnummer": "M17YSPYL",
        "Aufl\u00f6sung": "1920x1080",
        "Bildschirmdiagonale": "60,5 cm (23.8\")",
        "Bildschirmdiagonale (cm)": "60,5 cm",
        "Bildschirmform": "Flach",
        "Bildschirmtechnologie": "LCD",
        "Bildwinkel, horizontal": "178\u00b0",
        "Bildwinkel, vertikal": "178\u00b0",
        "Blendfreier Bildschirm": "Ja",
        "Breite (ohne Standfu\u00df)": "552,6 mm",
        "Display-Aufl\u00f6sung": "1920 x 1080 Pixel",
        "Displaygr\u00f6\u00dfe": "23,8 Zoll",
        "EAN": "5397184567678",
        "Eingebaute Lautsprecher": "Nein",
        "Energieeffizienzklasse (HDR)": "Nicht verf\u00fcgbar",
        "Energieeffizienzklasse (SDR)": "E",
        "Energieeffizienzskala": "A bis G",
        "Energieverbrauch (HDR) pro 1.000 Stunden": "16 kWh",
        "Energieverbrauch (SDR) pro 1.000 Stunden": "16 kWh",
        "Ergonomie": "Neigbar",
        "Farbskala": "72%",
        "Flimmerfreie Technologie": "Ja",
        "Fu\u00dffarbe": "Schwarz",
        "Ger\u00e4tebreite (inkl. Fu\u00df)": "552,6 mm",
        "Ger\u00e4teh\u00f6he (inkl. Fu\u00df)": "420,4 mm",
        "Ger\u00e4tetiefe (inkl. Fu\u00df)": "171 mm",
        "Gewicht (mit St\u00e4nder)": "3,55 kg",
        "Gewicht (ohne St\u00e4nder)": "3,2 kg",
        "HD-Typ": "Full HD",
        "HDCP": "Ja",
        "HDMI": "Ja",
        "Helligkeit": "250 cd/m\u00b2",
        "Helligkeit (typisch)": "250 cd/m\u00b2",
        "Hersteller Artikelnummer": "DELL-E2422HN",
        "High Dynamic Range Video (HDR) Unterst\u00fctzung": "Nein",
        "Horizontaler Scanbereich": "30 - 83 kHz",
        "H\u00f6he (ohne Standfu\u00df)": "331,6 mm",
        "H\u00f6henverstellung": "Nein",
        "Integrierte Kamera": "Nein",
        "Integrierter USB-Hub": "Nein",
        "Kabelsperre-Slot": "Ja",
        "Kontrastverh\u00e4ltnis": "1000:1",
        "Low-Blue-Light-Technologie": "Ja",
        "Marktpositionierung": "Business",
        "Maximale Bildwiederholrate": "60 Hz",
        "Mitgelieferte Kabel": "AC, HDMI",
        "Nachhaltigkeitszertifikate": "EPEAT Gold",
        "Natives Seitenverh\u00e4ltnis": "16:9",
        "Neigungsverstellung": "Ja",
        "Neigungswinkelbereich": "-5 - 21\u00b0",
        "Netzteiltyp": "Intern",
        "Paketgewicht": "5,5 kg",
        "Panel": "IPS",
        "Panel-Montage-Schnittstelle": "100 x 100 mm",
        "Panel-Typ": "IPS",
        "Pivot": "Nein",
        "Pixel Abstand": "0,2745 x 0,2745 mm",
        "Pixeldichte": "93 ppi",
        "Produktfarbe": "Schwarz",
        "RGB-Farbraum": "DCI-P3",
        "Rahmenbreite (Seite)": "1,28 cm",
        "Rahmenbreite (oben)": "1,28 cm",
        "Rahmenbreite (unten)": "2,23 cm",
        "Reaktionszeit": "8 ms",
        "Reaktionszeit (schnell)": "5 ms",
        "Schwenkbar": "Nein",
        "Seitenverh\u00e4ltnis": "16:9",
        "Stromverbrauch (Standardbetrieb)": "16 W",
        "Stromverbrauch (Standby)": "0,3 W",
        "Stromverbrauch (aus)": "0,3 W",
        "Stromverbrauch (max.)": "28 W",
        "St\u00e4nder enthalten": "Ja",
        "Tiefe (ohne Standfu\u00df)": "49,7 mm",
        "Touchscreen": "Nein",
        "Typ der Hintergrundbeleuchtung": "LED",
        "Unterst\u00fctzte Grafik-Aufl\u00f6sungen": "1920 x 1080 (HD 1080)",
        "Unterst\u00fctzte Video-Modi": "1080p",
        "VESA Halterung": "100x100 mm",
        "VESA-Halterung": "Ja",
        "Vertikaler Scanbereich": "50 - 75 Hz",
        "Video Anschl\u00fcsse": "1x VGA, 1x HDMI",
        "Vorderer Rahmen": "Schwarz",
        "WLAN": "Nein",
        "Warentarifnummer (HS)": "85285210"
    },
    "raw_specifications_text": "Displaygr\u00f6\u00dfe: 23,8 Zoll\nAufl\u00f6sung: 1920x1080\nPanel: IPS\nReaktionszeit: 8 ms\nVideo Anschl\u00fcsse: 1x VGA, 1x HDMI\nErgonomie: Neigbar\nVESA Halterung: 100x100 mm\nHelligkeit: 250 cd/m\u00b2\nHersteller Artikelnummer: DELL-E2422HN\nEAN: 5397184567678\nArtikelnummer: M17YSPYL\nBildschirmdiagonale: 60,5 cm (23.8\")\nDisplay-Aufl\u00f6sung: 1920 x 1080 Pixel\nNatives Seitenverh\u00e4ltnis: 16:9\nBildschirmtechnologie: LCD\nTouchscreen: Nein\nHD-Typ: Full HD\nPanel-Typ: IPS\nBildschirmform: Flach\nKontrastverh\u00e4ltnis: 1000:1\nMaximale Bildwiederholrate: 60 Hz\nAnzahl der Farben des Displays: 16,7 Millionen Farben\nTyp der Hintergrundbeleuchtung: LED\nHelligkeit (typisch): 250 cd/m\u00b2\nBlendfreier Bildschirm: Ja\nUnterst\u00fctzte Grafik-Aufl\u00f6sungen: 1920 x 1080 (HD 1080)\nUnterst\u00fctzte Video-Modi: 1080p\nSeitenverh\u00e4ltnis: 16:9\nBildwinkel, horizontal: 178\u00b0\nBildwinkel, vertikal: 178\u00b0\nReaktionszeit (schnell): 5 ms\nPixel Abstand: 0,2745 x 0,2745 mm\nPixeldichte: 93 ppi\nHorizontaler Scanbereich: 30 - 83 kHz\nVertikaler Scanbereich: 50 - 75 Hz\nBildschirmdiagonale (cm): 60,5 cm\nHigh Dynamic Range Video (HDR) Unterst\u00fctzung: Nein\nRGB-Farbraum: DCI-P3\nFarbskala: 72%\nFlimmerfreie Technologie: Ja\nLow-Blue-Light-Technologie: Ja\nEingebaute Lautsprecher: Nein\nIntegrierte Kamera: Nein\nMarktpositionierung: Business\nProduktfarbe: Schwarz\nVorderer Rahmen: Schwarz\nFu\u00dffarbe: Schwarz\nIntegrierter USB-Hub: Nein\nHDMI: Ja\nAnzahl VGA (D-Sub) Anschl\u00fcsse: 1\nAnzahl HDMI-Anschl\u00fcsse: 1\nHDCP: Ja\nWLAN: Nein\nVESA-Halterung: Ja\nKabelsperre-Slot: Ja\nH\u00f6henverstellung: Nein\nPanel-Montage-Schnittstelle: 100 x 100 mm\nPivot: Nein\nSchwenkbar: Nein\nNeigungswinkelbereich: -5 - 21\u00b0\nNeigungsverstellung: Ja\nEnergieeffizienzklasse (SDR): E\nEnergieeffizienzklasse (HDR): Nicht verf\u00fcgbar\nEnergieverbrauch (SDR) pro 1.000 Stunden: 16 kWh\nEnergieverbrauch (HDR) pro 1.000 Stunden: 16 kWh\nStromverbrauch (Standardbetrieb): 16 W\nStromverbrauch (Standby): 0,3 W\nStromverbrauch (max.): 28 W\nStromverbrauch (aus): 0,3 W\nAC Eingangsspannung: 100 - 240 V\nAC Eingangsfrequenz: 50 - 60 Hz\nNetzteiltyp: Intern\nEnergieeffizienzskala: A bis G\nSt\u00e4nder enthalten: Ja\nMitgelieferte Kabel: AC, HDMI\nGer\u00e4tebreite (inkl. Fu\u00df): 552,6 mm\nGer\u00e4tetiefe (inkl. Fu\u00df): 171 mm\nGer\u00e4teh\u00f6he (inkl. Fu\u00df): 420,4 mm\nGewicht (mit St\u00e4nder): 3,55 kg\nBreite (ohne Standfu\u00df): 552,6 mm\nTiefe (ohne Standfu\u00df): 49,7 mm\nH\u00f6he (ohne Standfu\u00df): 331,6 mm\nGewicht (ohne St\u00e4nder): 3,2 kg\nRahmenbreite (Seite): 1,28 cm\nRahmenbreite (oben): 1,28 cm\nRahmenbreite (unten): 2,23 cm\nPaketgewicht: 5,5 kg\nNachhaltigkeitszertifikate: EPEAT Gold\nWarentarifnummer (HS): 85285210",
    "reference_file": "offer_reference_1175.json",
    "shop_name": "mylemon.at"
}