{
    "html_file": "offer_1750_4.html",
    "name": "Dell P2721Q, 27\"",
    "offer_link": "https://www.future-x.at/dell-p2721q-led-monitor-68-466-cm-2696-sichtbar-3840-x-2160-4k-60-hz-ips-350-cd-m%B2-1000%3A1-5-ms-hdmi-displayport-usb-c-schwarz-silber-p-8676303/?pv=2",
    "price": 523.09,
    "raw_specifications": {
        "Abmessungen (Breite x Tiefe x H\u00f6he)": "61,16 cm x 18,5 cm x 38,52 cm - mit Fu\u00df",
        "Besonderheiten": "Integrierte Kabelf\u00fchrung, flimmerfreie Technologie, Dell ComfortView, 99 % sRGB Farbraum",
        "Bildschirmbeschichtung": "Anti-glare 3H hardness",
        "Bildschirmtyp": "IPS",
        "Details zu Abmessungen & Gewicht": "Mit Fu\u00df - Breite: 61,16 cm - Tiefe: 18,5 cm - H\u00f6he: 38,52 cm - Gewicht: 7,2 kg \u00a6 Ohne Fu\u00df - Breite: 61,16 cm - Tiefe: 5,21 cm - H\u00f6he: 36,07 cm - Gewicht: 5,1 kg",
        "Diagonalabmessung": "68,466 cm (26.96\")",
        "Display-Typ": "LED-hintergrundbeleuchteter LCD-Monitor / TFT-Aktivmatrix",
        "ENERGY STAR zertifiziert": "Ja",
        "EPEAT-kompatibel": "EPEAT Gold",
        "Ein-/Aus-Schalter": "Ja",
        "Eingangsspannung": "Wechselstrom 120/230 V (50/60 Hz)",
        "Einstellungen der Anzeigeposition": "H\u00f6he, Pivot (Rotation), Drehung, Neigung",
        "Energie Effizienzklasse": "Klasse F",
        "Energierverbrauch Sleep": "0.3 Watt",
        "Energieverbrauch pro Jahr": "66.7 kWh",
        "Enthaltene Kabel": "1 x DisplayPort-Kabel \u00a6 1 x USB-C Kabel - 1.8 m \u00a6 1 x USB-C auf USB-A Kabel - 1.8 m",
        "Farbe": "Platinum Silver",
        "Farbraum": "99% sRGB",
        "Farbunterst\u00fctzung": "1,07 Mrd. Farben",
        "Gewicht": "7,2 kg",
        "Helligkeit": "350 cd/m\u00b2",
        "Hintergrundbeleuchtungs-Technologie": "WLED",
        "Horizontale Bildwiederholrate": "15 - 135 kHz",
        "Horizontaler Betrachtungswinkel": "178",
        "H\u00f6heneinstellung": "150 mm",
        "Integrierte Peripherieger\u00e4te": "USB 3.2 Gen 1 Hub",
        "Kennzeichnung": "RoHS, NFPA 99, DisplayPort 1.2, BFR-frei, PVC-free",
        "Kontrast": "1000:1 / 1000:1 (dynamisch)",
        "Leistungsaufnahme im Ein-Zustand": "21.8 W",
        "Leistungsmerkmale": "Slot f\u00fcr Sicherheitsschloss (Kabelschloss getrennt erh\u00e4ltlich), Unterst\u00fctzung f\u00fcr VESA-Schnittstelle, Always On-USB-Port",
        "Max. Betriebstemperatur": "40 \u00b0C",
        "Min Betriebstemperatur": "0 \u00b0C",
        "Mitgelieferte Software": "Dell Display Manager",
        "Native Aufl\u00f6sung": "4K 3840 x 2160 bei 60 Hz",
        "Neigungswinkel": "-5/+21",
        "Pixelpitch": "0.1554 mm",
        "Ppi": "163",
        "Reaktionszeit": "8 ms (grau-zu-grau normal); 5 ms (grau-zu-grau schnell)",
        "Rotationswinkel": "180",
        "Schnittstellen": "HDMI \u00a6 DisplayPort 1.2 \u00a6 USB-C 3.2 Gen 1 Upstream/DisplayPort 1.2 Alt Mode mit Spannungsversorgung (bis zu 65 W) \u00a6 2 x USB 2.0 Downstream \u00a6 2 x USB 3.2 Gen 1 Downstream",
        "Schwenkwinkel": "90",
        "Seitenverh\u00e4ltnis": "16:9",
        "Services im Bundle": "3 Jahre Advanced Exchange-Service",
        "Sichtbare Bildfl\u00e4che": "68,466 cm (26.96\")",
        "Stromverbrauch (Aus-Modus)": "0.3 Watt",
        "Stromverbrauch (typisch)": "35.6 Watt",
        "Stromverbrauch SDR (eingeschaltet)": "21.8 kWh/1.000 h",
        "Stromverbrauch im Standby-Modus": "0.5 Watt",
        "TAA-kompatibel": "Ja",
        "TCO-zertifiziert": "TCO Certified Displays 8",
        "Transportgewicht": "9,7 kg",
        "USB-Spannungsversorgung": "65 Watt",
        "VESA-Halterung": "100 x 100 mm",
        "Vertikale Bildwiederholrate": "24 - 86 Hz",
        "Vertikaler Betrachtungswinkel": "178",
        "Zul\u00e4ssige Luftfeuchtigkeit im Betrieb": "10 - 80% (nicht kondensierend)"
    },
    "raw_specifications_text": "Display-Typ: LED-hintergrundbeleuchteter LCD-Monitor / TFT-Aktivmatrix\nEnergie Effizienzklasse: Klasse F\nEnergieverbrauch pro Jahr: 66.7 kWh\nDiagonalabmessung: 68,466 cm (26.96\")\nSichtbare Bildfl\u00e4che: 68,466 cm (26.96\")\nIntegrierte Peripherieger\u00e4te: USB 3.2 Gen 1 Hub\nUSB-Spannungsversorgung: 65 Watt\nBildschirmtyp: IPS\nSeitenverh\u00e4ltnis: 16:9\nNative Aufl\u00f6sung: 4K 3840 x 2160 bei 60 Hz\nPixelpitch: 0.1554 mm\nPpi: 163\nHelligkeit: 350 cd/m\u00b2\nKontrast: 1000:1 / 1000:1 (dynamisch)\nFarbunterst\u00fctzung: 1,07 Mrd. Farben\nFarbraum: 99% sRGB\nReaktionszeit: 8 ms (grau-zu-grau normal); 5 ms (grau-zu-grau schnell)\nVertikale Bildwiederholrate: 24 - 86 Hz\nHorizontale Bildwiederholrate: 15 - 135 kHz\nHorizontaler Betrachtungswinkel: 178\nVertikaler Betrachtungswinkel: 178\nBildschirmbeschichtung: Anti-glare 3H hardness\nHintergrundbeleuchtungs-Technologie: WLED\nBesonderheiten: Integrierte Kabelf\u00fchrung, flimmerfreie Technologie, Dell ComfortView, 99 % sRGB Farbraum\nFarbe: Platinum Silver\nAbmessungen (Breite x Tiefe x H\u00f6he): 61,16 cm x 18,5 cm x 38,52 cm - mit Fu\u00df\nGewicht: 7,2 kg\nSchnittstellen: HDMI \u00a6 DisplayPort 1.2 \u00a6 USB-C 3.2 Gen 1 Upstream/DisplayPort 1.2 Alt Mode mit Spannungsversorgung (bis zu 65 W) \u00a6 2 x USB 2.0 Downstream \u00a6 2 x USB 3.2 Gen 1 Downstream\nEinstellungen der Anzeigeposition: H\u00f6he, Pivot (Rotation), Drehung, Neigung\nNeigungswinkel: -5/+21\nSchwenkwinkel: 90\nRotationswinkel: 180\nH\u00f6heneinstellung: 150 mm\nVESA-Halterung: 100 x 100 mm\nLeistungsmerkmale: Slot f\u00fcr Sicherheitsschloss (Kabelschloss getrennt erh\u00e4ltlich), Unterst\u00fctzung f\u00fcr VESA-Schnittstelle, Always On-USB-Port\nEnthaltene Kabel: 1 x DisplayPort-Kabel \u00a6 1 x USB-C Kabel - 1.8 m \u00a6 1 x USB-C auf USB-A Kabel - 1.8 m\nKennzeichnung: RoHS, NFPA 99, DisplayPort 1.2, BFR-frei, PVC-free\nTAA-kompatibel: Ja\nEingangsspannung: Wechselstrom 120/230 V (50/60 Hz)\nLeistungsaufnahme im Ein-Zustand: 21.8 W\nStromverbrauch SDR (eingeschaltet): 21.8 kWh/1.000 h\nStromverbrauch (typisch): 35.6 Watt\nStromverbrauch im Standby-Modus: 0.5 Watt\nEnergierverbrauch Sleep: 0.3 Watt\nStromverbrauch (Aus-Modus): 0.3 Watt\nEin-/Aus-Schalter: Ja\nMitgelieferte Software: Dell Display Manager\nDetails zu Abmessungen & Gewicht: Mit Fu\u00df - Breite: 61,16 cm - Tiefe: 18,5 cm - H\u00f6he: 38,52 cm - Gewicht: 7,2 kg \u00a6 Ohne Fu\u00df - Breite: 61,16 cm - Tiefe: 5,21 cm - H\u00f6he: 36,07 cm - Gewicht: 5,1 kg\nTransportgewicht: 9,7 kg\nTCO-zertifiziert: TCO Certified Displays 8\nEPEAT-kompatibel: EPEAT Gold\nENERGY STAR zertifiziert: Ja\nServices im Bundle: 3 Jahre Advanced Exchange-Service\nMin Betriebstemperatur: 0 \u00b0C\nMax. Betriebstemperatur: 40 \u00b0C\nZul\u00e4ssige Luftfeuchtigkeit im Betrieb: 10 - 80% (nicht kondensierend)",
    "reference_file": "offer_reference_1750.json",
    "shop_name": "Future-X.at"
}