{
    "html_file": "offer_2096_10.html",
    "name": "ASUS CG32UQ, 31.5\"",
    "offer_link": "https://www.e-tec.at/details.php?artnr=293979",
    "price": 500.35,
    "raw_specifications": {
        "AMD FreeSync": "Ja",
        "Abmessungen (BxHxT)": "730x506x268mm (mit Standfu\u00df),  730x430x78mm (ohne Standfu\u00df)",
        "Adaptive Sync": "Ja",
        "Anschl\u00fcsse - DisplayPort 1.2": "1",
        "Anschl\u00fcsse - HDMI 2.0": "3",
        "Anwendung": "station\u00e4r",
        "Audio": "Lautsprecher (2x 12W),  1x Line-Out",
        "Aufl\u00f6sung": "3840x2160",
        "Beschichtung": "matt (non-glare)",
        "Besonderheiten": "mechanische Tasten mit Steuerkreuz,  Sicherheitsschloss (Kensington),  Beleuchtung auf R\u00fcckseite (RGB),  Fernbedienung",
        "Bildwiederholfrequenz": "60Hz",
        "Blickwinkel": "178\u00b0/178\u00b0",
        "Diagonale": "31.5\"/80cm",
        "Energieeffizienzklasse HDR (A bis G)": "G",
        "Energieeffizienzklasse alt (A+++ bis D)": "D",
        "Energieeffizienzklasse alt (A+++ bis G)": "D",
        "Energieverbrauch HDR": "138kWh/1000h",
        "Energieverbrauch SDR": "41kWh/1000h",
        "Ergonomie": "100mm (h\u00f6henverstellbar),  N/A (Pivot),  N/A (drehbar),  +22\u00b0/-5\u00b0 (neigbar),  keine Angabe (Schr\u00e4glage)",
        "FRC": "unbekannt",
        "Farbe": "schwarz",
        "Farbraum - DCI-P3": "95%",
        "Farbtiefe": "10bit (1.07 Mrd. Farben)",
        "Form": "gerade (flat)",
        "Gewicht": "9.10kg (mit Standfu\u00df),  7.10kg (ohne Standfu\u00df)",
        "HDR": "VESA DisplayHDR 600,  HDR10",
        "Helligkeit": "400cd/m\u00b2 (typisch),  600cd/m\u00b2 (HDR)",
        "Herstellergarantie": "drei Jahre",
        "Hintergrundbeleuchtung": "White-LED,  flicker-free,  Blaulichtfilter",
        "Jahresverbrauch alt (A+++ bis D)": "116.80kWh",
        "Jahresverbrauch alt (A+++ bis G)": "116.80kWh",
        "Kontrast - statisch": "3.000:1",
        "Lautsprecher": "Ja",
        "Leistungsaufnahme": "keine Angabe (maximal),  50W (typisch),  80W (Energielabel alt A+++ bis G),  0.5W (Standby)",
        "Panel": "VA",
        "Reaktionszeit - GtG": "5ms",
        "Screen-to-Body-Ratio": "87.1% (berechnet)",
        "Seitenverh\u00e4ltnis": "16:9",
        "Signalfrequenz": "24-134kHz (horizontal),  40-60Hz (vertikal)",
        "Stromversorgung": "DC-In (externes Netzteil)",
        "USB-Hub In": "1x USB-B 3.0",
        "USB-Hub Out": "2x USB-A 3.0,  2x USB-A (BC 1.2)",
        "USB-Schreibweise": "Link",
        "VESA": "100x100 (belegt)",
        "VRR (Variable Refresh Rate)": "Adaptive Sync,  AMD FreeSync (40-60Hz via DisplayPort,  40-60Hz via HDMI)",
        "Weitere Anschl\u00fcsse": "N/A"
    },
    "raw_specifications_text": "Abmessungen (BxHxT): 730x506x268mm (mit Standfu\u00df),  730x430x78mm (ohne Standfu\u00df)\nAdaptive Sync: Ja\nAMD FreeSync: Ja\nAnschl\u00fcsse - DisplayPort 1.2: 1\nAnschl\u00fcsse - HDMI 2.0: 3\nAnwendung: station\u00e4r\nAudio: Lautsprecher (2x 12W),  1x Line-Out\nAufl\u00f6sung: 3840x2160\nBeschichtung: matt (non-glare)\nBesonderheiten: mechanische Tasten mit Steuerkreuz,  Sicherheitsschloss (Kensington),  Beleuchtung auf R\u00fcckseite (RGB),  Fernbedienung\nBildwiederholfrequenz: 60Hz\nBlickwinkel: 178\u00b0/178\u00b0\nDiagonale: 31.5\"/80cm\nEnergieeffizienzklasse alt (A+++ bis D): D\nEnergieeffizienzklasse alt (A+++ bis G): D\nEnergieeffizienzklasse HDR (A bis G): G\nEnergieverbrauch HDR: 138kWh/1000h\nEnergieverbrauch SDR: 41kWh/1000h\nErgonomie: 100mm (h\u00f6henverstellbar),  N/A (Pivot),  N/A (drehbar),  +22\u00b0/-5\u00b0 (neigbar),  keine Angabe (Schr\u00e4glage)\nFarbe: schwarz\nFarbraum - DCI-P3: 95%\nFarbtiefe: 10bit (1.07 Mrd. Farben)\nForm: gerade (flat)\nFRC: unbekannt\nGewicht: 9.10kg (mit Standfu\u00df),  7.10kg (ohne Standfu\u00df)\nHDR: VESA DisplayHDR 600,  HDR10\nHelligkeit: 400cd/m\u00b2 (typisch),  600cd/m\u00b2 (HDR)\nHerstellergarantie: drei Jahre\nHintergrundbeleuchtung: White-LED,  flicker-free,  Blaulichtfilter\nJahresverbrauch alt (A+++ bis D): 116.80kWh\nJahresverbrauch alt (A+++ bis G): 116.80kWh\nKontrast - statisch: 3.000:1\nLautsprecher: Ja\nLeistungsaufnahme: keine Angabe (maximal),  50W (typisch),  80W (Energielabel alt A+++ bis G),  0.5W (Standby)\nPanel: VA\nReaktionszeit - GtG: 5ms\nScreen-to-Body-Ratio: 87.1% (berechnet)\nSeitenverh\u00e4ltnis: 16:9\nSignalfrequenz: 24-134kHz (horizontal),  40-60Hz (vertikal)\nStromversorgung: DC-In (externes Netzteil)\nUSB-Hub In: 1x USB-B 3.0\nUSB-Hub Out: 2x USB-A 3.0,  2x USB-A (BC 1.2)\nUSB-Schreibweise: Link\nVESA: 100x100 (belegt)\nVRR (Variable Refresh Rate): Adaptive Sync,  AMD FreeSync (40-60Hz via DisplayPort,  40-60Hz via HDMI)\nWeitere Anschl\u00fcsse: N/A",
    "reference_file": "offer_reference_2096.json",
    "shop_name": "e-tec.at"
}