{
    "html_file": "offer_1763_3.html",
    "name": "Dell UltraSharp U2421E, 24.1\"",
    "offer_link": "https://www.future-x.at/dell-ultrasharp-u2421e-led-monitor-61-13-cm-241-sichtbar-1920-x-1200-wuxga-60-hz-ips-350-cd-m%B2-1000%3A1-5-ms-hdmi-displayport-usb-c-silber-p-8676299/?pv=2",
    "price": 269.23,
    "raw_specifications": {
        "Abmessungen (Breite x Tiefe x H\u00f6he)": "53,08 cm x 17,3 cm x 36,4 cm - mit Fu\u00df",
        "Besonderheiten": "Ohne Quecksilber, arsenfreies Glas, Dell Easy Arrange, Monitorkalibrierung Delta E<2, Dell ComfortView Plus, 99 % sRGB Farbraum",
        "Bildschirmbeschichtung": "Blendfrei, 3H Hard Coating",
        "Bildschirmtyp": "IPS",
        "Daisy-Chaining": "Ja",
        "Details zu Abmessungen & Gewicht": "Mit Fu\u00df - Breite: 53,08 cm - Tiefe: 17,3 cm - H\u00f6he: 36,4 cm \u00a6 Ohne Fu\u00df - Breite: 53,08 cm - Tiefe: 5 cm - H\u00f6he: 33,93 cm",
        "Diagonalabmessung": "61,13 cm (24.1\")",
        "Display-Typ": "LED-hintergrundbeleuchteter LCD-Monitor / TFT-Aktivmatrix",
        "ENERGY STAR zertifiziert": "Ja",
        "Ein-/Aus-Schalter": "Nein",
        "Einstellungen der Anzeigeposition": "H\u00f6he, Pivot (Rotation), Drehung, Neigung",
        "Energie Effizienzklasse": "Klasse E",
        "Energieverbrauch pro Jahr": "24 kWh",
        "Enthaltene Kabel": "1 x DisplayPort-Kabel - DisplayPort zu DisplayPort \u00a6 1 x USB-C Kabel - USB-C \u00a6 1 x USB-C Kabel - USB Typ-C auf A",
        "Farbraum": "99% Rec 709, 99% sRGB",
        "Farbunterst\u00fctzung": "16,7 Millionen Farben",
        "Helligkeit": "350 cd/m\u00b2",
        "Hintergrundbeleuchtungs-Technologie": "LED-Hintergrundbeleuchtung",
        "Horizontaler Betrachtungswinkel": "178",
        "H\u00f6heneinstellung": "150 mm",
        "Integrierte Peripherieger\u00e4te": "USB-C-Hub",
        "Kennzeichnung": "RoHS, NFPA 99, BFR-frei, DisplayPort 1.4, HDCP 1.4, PVC-free",
        "Kontrast": "1000:1",
        "Leistungsaufnahme im Ein-Zustand": "17.2 W",
        "Leistungsmerkmale": "Slot f\u00fcr Sicherheitsschloss (Kabelschloss getrennt erh\u00e4ltlich), Unterst\u00fctzung f\u00fcr VESA-Schnittstelle, Schlitz f\u00fcr diebstahlsicheres St\u00e4nderschloss",
        "Max. Betriebstemperatur": "40 \u00b0C",
        "Min Betriebstemperatur": "0 \u00b0C",
        "Mitgelieferte Software": "Dell Display Manager",
        "Native Aufl\u00f6sung": "WUXGA 1920 x 1200 bei 60 Hz",
        "Neigungswinkel": "-5/+21",
        "Pixelpitch": "0.27 mm",
        "Ppi": "94",
        "Reaktionszeit": "8 ms (normal); 5 ms (schnell)",
        "Schlosstyp zur Diebstahlsicherung": "Kensington Slot",
        "Schnittstellen": "DisplayPort 1.4 \u00a6 HDMI (HDCP 1.4) \u00a6 USB-C 3.2 Gen 1 upstream/DisplayPort 1.4 Alt Mode (bis zu 90 W) \u00a6 USB-C 3.2 Gen 1 Downstream (bis zu 15 W) \u00a6 DisplayPort-Ausgang (MST) \u00a6 2 x USB 3.2 Gen 1 Downstream \u00a6 USB 3.2 Gen 1 Downstream mit Battery Charging 1.2 \u00a6 Audio Line-Out (Mini-Klinkenstecker) \u00a6 Netzwerk (RJ-45)",
        "Schwenkwinkel": "90",
        "Seitenverh\u00e4ltnis": "16:10",
        "Services im Bundle": "3 Jahre Advanced Exchange Service und Premium Panel Exchange",
        "Sichtbare Bildfl\u00e4che": "61,13 cm (24.1\")",
        "Stromverbrauch (Aus-Modus)": "0.2 Watt",
        "Stromverbrauch (max.)": "186 Watt",
        "Stromverbrauch SDR (eingeschaltet)": "17.2 kWh/1.000 h",
        "Stromverbrauch im Standby-Modus": "0.2 Watt",
        "TCO-zertifiziert": "TCO Certified Displays 8",
        "USB-Spannungsversorgung": "90 Watt",
        "VESA-Halterung": "100 x 100 mm",
        "Vertikaler Betrachtungswinkel": "178"
    },
    "raw_specifications_text": "Display-Typ: LED-hintergrundbeleuchteter LCD-Monitor / TFT-Aktivmatrix\nEnergie Effizienzklasse: Klasse E\nEnergieverbrauch pro Jahr: 24 kWh\nDiagonalabmessung: 61,13 cm (24.1\")\nSichtbare Bildfl\u00e4che: 61,13 cm (24.1\")\nDaisy-Chaining: Ja\nIntegrierte Peripherieger\u00e4te: USB-C-Hub\nUSB-Spannungsversorgung: 90 Watt\nBildschirmtyp: IPS\nSeitenverh\u00e4ltnis: 16:10\nNative Aufl\u00f6sung: WUXGA 1920 x 1200 bei 60 Hz\nPixelpitch: 0.27 mm\nPpi: 94\nHelligkeit: 350 cd/m\u00b2\nKontrast: 1000:1\nFarbunterst\u00fctzung: 16,7 Millionen Farben\nFarbraum: 99% Rec 709, 99% sRGB\nReaktionszeit: 8 ms (normal); 5 ms (schnell)\nHorizontaler Betrachtungswinkel: 178\nVertikaler Betrachtungswinkel: 178\nBildschirmbeschichtung: Blendfrei, 3H Hard Coating\nHintergrundbeleuchtungs-Technologie: LED-Hintergrundbeleuchtung\nBesonderheiten: Ohne Quecksilber, arsenfreies Glas, Dell Easy Arrange, Monitorkalibrierung Delta E<2, Dell ComfortView Plus, 99 % sRGB Farbraum\nAbmessungen (Breite x Tiefe x H\u00f6he): 53,08 cm x 17,3 cm x 36,4 cm - mit Fu\u00df\nSchnittstellen: DisplayPort 1.4 \u00a6 HDMI (HDCP 1.4) \u00a6 USB-C 3.2 Gen 1 upstream/DisplayPort 1.4 Alt Mode (bis zu 90 W) \u00a6 USB-C 3.2 Gen 1 Downstream (bis zu 15 W) \u00a6 DisplayPort-Ausgang (MST) \u00a6 2 x USB 3.2 Gen 1 Downstream \u00a6 USB 3.2 Gen 1 Downstream mit Battery Charging 1.2 \u00a6 Audio Line-Out (Mini-Klinkenstecker) \u00a6 Netzwerk (RJ-45)\nEinstellungen der Anzeigeposition: H\u00f6he, Pivot (Rotation), Drehung, Neigung\nNeigungswinkel: -5/+21\nSchwenkwinkel: 90\nH\u00f6heneinstellung: 150 mm\nVESA-Halterung: 100 x 100 mm\nLeistungsmerkmale: Slot f\u00fcr Sicherheitsschloss (Kabelschloss getrennt erh\u00e4ltlich), Unterst\u00fctzung f\u00fcr VESA-Schnittstelle, Schlitz f\u00fcr diebstahlsicheres St\u00e4nderschloss\nEnthaltene Kabel: 1 x DisplayPort-Kabel - DisplayPort zu DisplayPort \u00a6 1 x USB-C Kabel - USB-C \u00a6 1 x USB-C Kabel - USB Typ-C auf A\nKennzeichnung: RoHS, NFPA 99, BFR-frei, DisplayPort 1.4, HDCP 1.4, PVC-free\nSchlosstyp zur Diebstahlsicherung: Kensington Slot\nLeistungsaufnahme im Ein-Zustand: 17.2 W\nStromverbrauch SDR (eingeschaltet): 17.2 kWh/1.000 h\nStromverbrauch (max.): 186 Watt\nStromverbrauch im Standby-Modus: 0.2 Watt\nStromverbrauch (Aus-Modus): 0.2 Watt\nEin-/Aus-Schalter: Nein\nMitgelieferte Software: Dell Display Manager\nDetails zu Abmessungen & Gewicht: Mit Fu\u00df - Breite: 53,08 cm - Tiefe: 17,3 cm - H\u00f6he: 36,4 cm \u00a6 Ohne Fu\u00df - Breite: 53,08 cm - Tiefe: 5 cm - H\u00f6he: 33,93 cm\nTCO-zertifiziert: TCO Certified Displays 8\nENERGY STAR zertifiziert: Ja\nServices im Bundle: 3 Jahre Advanced Exchange Service und Premium Panel Exchange\nMin Betriebstemperatur: 0 \u00b0C\nMax. Betriebstemperatur: 40 \u00b0C",
    "reference_file": "offer_reference_1763.json",
    "shop_name": "Future-X.at"
}