{
    "html_file": "offer_1653_47.html",
    "name": "HP E27q G4, 27\"",
    "offer_link": "https://www.proshop.at/Bildschirm/HP-27-Bildschirm-E27q-G4-Silver-5-ms/2928887?utm_source=geizhals&utm_medium=cpc&utm_campaign=pricesite",
    "price": 315.98,
    "raw_specifications": {
        "Abmessungen (Breite x Tiefe x H\u00f6he)": "61.33 cm x 21.6 cm x 53.6 cm - mit Fu\u00df",
        "Abmessungen (Breite x Tiefe x H\u00f6he) - mit Fu\u00df": "61.33 cm x 21.6 cm x 53.6 cm",
        "Besonderheiten": "Flimmerfreie Technologie, Blaulichtfilter-Technologie, extrem schmale Blende an drei Seiten, 8-bit Farbtiefe, HP Eye Ease",
        "Bildschirmbeschichtung": "Blendfrei, 3H Hard Coating",
        "Bildschirmtyp": "IPS",
        "Details zu Abmessungen & Gewicht": "Mit Fu\u00df - Breite: 61.33 cm - Tiefe: 21.6 cm - H\u00f6he: 53.6 cm - Gewicht: 7 kg  Ohne Fu\u00df - Breite: 61.33 cm - Tiefe: 4.7 cm - H\u00f6he: 36.61 cm",
        "Diagonalabmessung": "68.6 cm (27\")",
        "Display-Typ": "LED-hintergrundbeleuchteter LCD-Monitor / TFT-Aktivmatrix",
        "EAN": "0194850083730",
        "ENERGY STAR zertifiziert": "Ja",
        "Eingangsanschl\u00fcsse": "HDMI, VGA, DisplayPort",
        "Eingangsspannung": "Wechselstrom 120/230 V (50/60 Hz)",
        "Einstellungen der Anzeigeposition": "H\u00f6he, Pivot (Rotation), Drehung, Neigung",
        "Energie Effizienzklasse": "Klasse E",
        "Enthaltene Kabel": "1 x DisplayPort 1.2-Kabel  1 x HDMI-Kabel  1 x USB-Kabel",
        "Farbe": "Schwarz",
        "Ger\u00e4tetyp": "LED-hintergrundbeleuchteter LCD-Monitor - 68.6 cm (27\")",
        "Gewicht": "7 kg",
        "Helligkeit": "250 cd/m\u00b2",
        "Hersteller": "HP",
        "Hintergrundbeleuchtungs-Technologie": "LED-Hintergrundbeleuchtung",
        "Horizontale Bildwiederholrate": "30 - 90 kHz",
        "Horizontaler Betrachtungswinkel": "178",
        "H\u00f6heneinstellung": "150 mm",
        "Integrierte Peripherieger\u00e4te": "USB 3.2 Gen 1 Hub",
        "Kennzeichnung": "TUV GS, VCCI, BSMI, NOM, TUV S, CB, CCC, PSB, FCC, ISO 9241-307, KCC, WEEE, CEC, KC, CECP, CEL, EAC, ISC, SEPA, BIS, halogenarm, DisplayPort 1.2, ICE, TUV LBL, TGM",
        "Kontrast": "1000:1 / 5000000:1 (dynamisch)",
        "Leistungsaufnahme im Ein-Zustand": "21.6 W",
        "Leistungsmerkmale": "Slot f\u00fcr Sicherheitsschloss (Kabelschloss getrennt erh\u00e4ltlich)",
        "Lokalisierung": "Englisch / Europa",
        "Modell": "9VG82AT#ABB",
        "Native Aufl\u00f6sung": "QHD 2560 x 1440 bei 60 Hz",
        "Neigungswinkel": "-5/+23",
        "Pixelpitch": "0.233 mm",
        "Ppi": "109",
        "Preistyp": "Sonderaktion",
        "Produktbeschreibung": "HP E27q G4 - E-Series - LED-Monitor - 68.6 cm (27\")",
        "Reaktionszeit": "5 ms (grau zu grau mit \u00dcbersteuerung)",
        "Rotationswinkel": "180",
        "Schlosstyp zur Diebstahlsicherung": "Kensington Slot",
        "Schnittstellen": "DisplayPort 1.2  HDMI  4 x USB 3.2 Gen 1 Downstream (Typ A)  USB 3.2 Gen 1 Upstream (Typ B)  VGA",
        "Schwenkwinkel": "90",
        "Seitenverh\u00e4ltnis": "16:9",
        "Spannung": "Wechselstrom 120/230 V (50/60 Hz)",
        "Stromverbrauch (typisch)": "25 Watt",
        "Stromverbrauch SDR (eingeschaltet)": "21.6 kWh/1.000 h",
        "Stromverbrauch im Standby-Modus": "0.5 Watt",
        "TCO-zertifiziert": "TCO Certified Displays 8, TCO Certified Edge Displays",
        "Transportbreite": "69.5 cm",
        "Transportgewicht": "10.5 kg",
        "Transporth\u00f6he": "22.5 cm",
        "Transporttiefe": "44.4 cm",
        "Umweltschutzstandards": "TCO Certified Displays 8, TCO Certified Edge Displays, ENERGY STAR-qualifiziert",
        "VESA-Halterung": "100 x 100 mm",
        "Vertikale Bildwiederholrate": "50 - 60 Hz",
        "Vertikaler Betrachtungswinkel": "178",
        "Waren-Nr.": "2928887",
        "Zum Hersteller": "www.hp.com"
    },
    "raw_specifications_text": "Hersteller: HP\nWaren-Nr.: 2928887\nModell: 9VG82AT#ABB\nEAN: 0194850083730\nZum Hersteller: www.hp.com\nProduktbeschreibung: HP E27q G4 - E-Series - LED-Monitor - 68.6 cm (27\")\nGer\u00e4tetyp: LED-hintergrundbeleuchteter LCD-Monitor - 68.6 cm (27\")\nEnergie Effizienzklasse: Klasse E\nLeistungsaufnahme im Ein-Zustand: 21.6 W\nLeistungsmerkmale: Slot f\u00fcr Sicherheitsschloss (Kabelschloss getrennt erh\u00e4ltlich)\nBildschirmtyp: IPS\nSeitenverh\u00e4ltnis: 16:9\nNative Aufl\u00f6sung: QHD 2560 x 1440 bei 60 Hz\nPixelpitch: 0.233 mm\nHelligkeit: 250 cd/m\u00b2\nKontrast: 1000:1 / 5000000:1 (dynamisch)\nReaktionszeit: 5 ms (grau zu grau mit \u00dcbersteuerung)\nEingangsanschl\u00fcsse: HDMI, VGA, DisplayPort\nEinstellungen der Anzeigeposition: H\u00f6he, Pivot (Rotation), Drehung, Neigung\nBildschirmbeschichtung: Blendfrei, 3H Hard Coating\nSpannung: Wechselstrom 120/230 V (50/60 Hz)\nFarbe: Schwarz\nAbmessungen (Breite x Tiefe x H\u00f6he) - mit Fu\u00df: 61.33 cm x 21.6 cm x 53.6 cm\nGewicht: 7 kg\nLokalisierung: Englisch / Europa\nPreistyp: Sonderaktion\nUmweltschutzstandards: TCO Certified Displays 8, TCO Certified Edge Displays, ENERGY STAR-qualifiziert\nKennzeichnung: TUV GS, VCCI, BSMI, NOM, TUV S, CB, CCC, PSB, FCC, ISO 9241-307, KCC, WEEE, CEC, KC, CECP, CEL, EAC, ISC, SEPA, BIS, halogenarm, DisplayPort 1.2, ICE, TUV LBL, TGM\nDisplay-Typ: LED-hintergrundbeleuchteter LCD-Monitor / TFT-Aktivmatrix\nDiagonalabmessung: 68.6 cm (27\")\nIntegrierte Peripherieger\u00e4te: USB 3.2 Gen 1 Hub\nPpi: 109\nVertikale Bildwiederholrate: 50 - 60 Hz\nHorizontale Bildwiederholrate: 30 - 90 kHz\nHorizontaler Betrachtungswinkel: 178\nVertikaler Betrachtungswinkel: 178\nHintergrundbeleuchtungs-Technologie: LED-Hintergrundbeleuchtung\nBesonderheiten: Flimmerfreie Technologie, Blaulichtfilter-Technologie, extrem schmale Blende an drei Seiten, 8-bit Farbtiefe, HP Eye Ease\nAbmessungen (Breite x Tiefe x H\u00f6he): 61.33 cm x 21.6 cm x 53.6 cm - mit Fu\u00df\nSchnittstellen: DisplayPort 1.2  HDMI  4 x USB 3.2 Gen 1 Downstream (Typ A)  USB 3.2 Gen 1 Upstream (Typ B)  VGA\nNeigungswinkel: -5/+23\nSchwenkwinkel: 90\nRotationswinkel: 180\nH\u00f6heneinstellung: 150 mm\nVESA-Halterung: 100 x 100 mm\nEnthaltene Kabel: 1 x DisplayPort 1.2-Kabel  1 x HDMI-Kabel  1 x USB-Kabel\nSchlosstyp zur Diebstahlsicherung: Kensington Slot\nEingangsspannung: Wechselstrom 120/230 V (50/60 Hz)\nStromverbrauch SDR (eingeschaltet): 21.6 kWh/1.000 h\nStromverbrauch (typisch): 25 Watt\nStromverbrauch im Standby-Modus: 0.5 Watt\nDetails zu Abmessungen & Gewicht: Mit Fu\u00df - Breite: 61.33 cm - Tiefe: 21.6 cm - H\u00f6he: 53.6 cm - Gewicht: 7 kg  Ohne Fu\u00df - Breite: 61.33 cm - Tiefe: 4.7 cm - H\u00f6he: 36.61 cm\nTransportbreite: 69.5 cm\nTransporttiefe: 44.4 cm\nTransporth\u00f6he: 22.5 cm\nTransportgewicht: 10.5 kg\nTCO-zertifiziert: TCO Certified Displays 8, TCO Certified Edge Displays\nENERGY STAR zertifiziert: Ja",
    "reference_file": "offer_reference_1653.json",
    "shop_name": "Proshop.at"
}