{
    "html_file": "offer_576_7.html",
    "name": "iiyama G-Master G2450HS-B1 Black Hawk, 23.8\"",
    "offer_link": "https://www.csv-direct.de/artinfo.php?artnr=A1621467&KATEGORIE=162&pva=geizhals2",
    "price": 117.43,
    "raw_specifications": {
        "AC Eingangsfrequenz": "50 - 60 Hz",
        "AC Eingangsspannung": "100 - 240 V",
        "Anzahl DisplayPort Anschl\u00fcsse": "1",
        "Anzahl HDMI-Anschl\u00fcsse": "1",
        "Anzahl der Farben des Displays": "16,7 Millionen Farben",
        "Anzahl der Lautsprecher": "2",
        "Bildschirmdiagonale": "60,5 cm 23.8\"",
        "Bildschirmdiagonale cm": "61 cm",
        "Bildschirmform": "Flach",
        "Bildschirmtechnologie": "LED",
        "Bildwinkel, horizontal": "178\u00b0",
        "Bildwinkel, vertikal": "178\u00b0",
        "Display-Aufl\u00f6sung": "1920 x 1080 Pixel",
        "DisplayPorts-Version": "1.2",
        "Energieeffizienzklasse HDR": "Nicht verf\u00fcgbar",
        "Energieeffizienzklasse SDR": "E",
        "Energieeffizienzskala": "A bis G",
        "Energieverbrauch SDR pro 1.000 Stunden": "16 kWh",
        "Ger\u00e4tebreite inkl. Fu\u00df": "540 mm",
        "Ger\u00e4teh\u00f6he inkl. Fu\u00df": "398,5 mm",
        "Ger\u00e4tetiefe inkl. Fu\u00df": "192,5 mm",
        "Gewicht mit St\u00e4nder": "3,1 kg",
        "HD-Typ": "Full HD",
        "HDMI-Version": "1.4",
        "Helligkeit peak": "250 cd/m\u00b2",
        "Horizontaler Scanbereich": "31 - 85 kHz",
        "Kontrastverh\u00e4ltnis": "3000:1",
        "Maximale Bildwiederholrate": "75 Hz",
        "Men\u00fcsprachen": "Tschechisch, Deutsch, Niederl\u00e4ndisch, Englisch, Spanisch, Franz\u00f6sisch, Italienisch, Japanisch, Polnisch, Russisch",
        "Mitgelieferte Kabel": "AC, HDMI",
        "Natives Seitenverh\u00e4ltnis": "16:9",
        "Neigungswinkelbereich": "4 - 22\u00b0",
        "Netzteiltyp": "Intern",
        "Paketgewicht": "4,1 kg",
        "Panel-Montage-Schnittstelle": "100 x 100 mm",
        "Panel-Typ": "VA",
        "Pixel Abstand": "0,274 x 0,274 mm",
        "RMS-Leistung": "2 W",
        "Reaktionszeit": "1 ms",
        "Seitenverh\u00e4ltnis": "16:9",
        "Slot-Typ Kabelsperre": "Kensington",
        "Stromverbrauch Standardbetrieb": "19 W",
        "Stromverbrauch Standby": "0,5 W",
        "Stromverbrauch aus": "0,3 W",
        "Touchscreen": "Nein",
        "Verpackungsart": "Box",
        "Verpackungsbreite": "613 mm",
        "Verpackungsh\u00f6he": "403 mm",
        "Verpackungstiefe": "125 mm",
        "Zertifizierung": "CE, T\u00dcV-Bauart, EAC, PSE, RoHS support, ErP, ENERGY STAR\u00ae, WEEE, VCCI, REACH, UKCA"
    },
    "raw_specifications_text": "Bildschirmdiagonale: 60,5 cm 23.8\"\nDisplay-Aufl\u00f6sung: 1920 x 1080 Pixel\nNatives Seitenverh\u00e4ltnis: 16:9\nBildschirmtechnologie: LED\nTouchscreen: Nein\nHD-Typ: Full HD\nPanel-Typ: VA\nBildschirmform: Flach\nKontrastverh\u00e4ltnis: 3000:1\nMaximale Bildwiederholrate: 75 Hz\nAnzahl der Farben des Displays: 16,7 Millionen Farben\nHelligkeit peak: 250 cd/m\u00b2\nReaktionszeit: 1 ms\nSeitenverh\u00e4ltnis: 16:9\nBildwinkel, horizontal: 178\u00b0\nBildwinkel, vertikal: 178\u00b0\nPixel Abstand: 0,274 x 0,274 mm\nHorizontaler Scanbereich: 31 - 85 kHz\nBildschirmdiagonale cm: 61 cm\nAnzahl der Lautsprecher: 2\nRMS-Leistung: 2 W\nZertifizierung: CE, T\u00dcV-Bauart, EAC, PSE, RoHS support, ErP, ENERGY STAR\u00ae, WEEE, VCCI, REACH, UKCA\nAnzahl HDMI-Anschl\u00fcsse: 1\nHDMI-Version: 1.4\nAnzahl DisplayPort Anschl\u00fcsse: 1\nDisplayPorts-Version: 1.2\nPanel-Montage-Schnittstelle: 100 x 100 mm\nSlot-Typ Kabelsperre: Kensington\nNeigungswinkelbereich: 4 - 22\u00b0\nMen\u00fcsprachen: Tschechisch, Deutsch, Niederl\u00e4ndisch, Englisch, Spanisch, Franz\u00f6sisch, Italienisch, Japanisch, Polnisch, Russisch\nEnergieeffizienzklasse SDR: E\nEnergieeffizienzklasse HDR: Nicht verf\u00fcgbar\nEnergieverbrauch SDR pro 1.000 Stunden: 16 kWh\nStromverbrauch Standardbetrieb: 19 W\nStromverbrauch Standby: 0,5 W\nStromverbrauch aus: 0,3 W\nAC Eingangsspannung: 100 - 240 V\nAC Eingangsfrequenz: 50 - 60 Hz\nNetzteiltyp: Intern\nEnergieeffizienzskala: A bis G\nMitgelieferte Kabel: AC, HDMI\nGer\u00e4tebreite inkl. Fu\u00df: 540 mm\nGer\u00e4tetiefe inkl. Fu\u00df: 192,5 mm\nGer\u00e4teh\u00f6he inkl. Fu\u00df: 398,5 mm\nGewicht mit St\u00e4nder: 3,1 kg\nVerpackungsbreite: 613 mm\nVerpackungstiefe: 125 mm\nVerpackungsh\u00f6he: 403 mm\nPaketgewicht: 4,1 kg\nVerpackungsart: Box",
    "reference_file": "offer_reference_576.json",
    "shop_name": "CSV-Direct.de"
}