{
    "html_file": "offer_848_17.html",
    "name": "Fujitsu B-Line B2410 WS, 24.1\"",
    "offer_link": "https://www.ditech.at/details.php?artnr=353490",
    "price": 365.9,
    "raw_specifications": {
        "Anschl\u00fcsse - DVI 60Hz@1920x1200": "1",
        "Anschl\u00fcsse - DisplayPort 1.2 60Hz@1920x1200": "1",
        "Anschl\u00fcsse - HDMI 1.4 60Hz@1920x1200": "1",
        "Anschl\u00fcsse - VGA 60Hz@1920x1200": "1",
        "Anwendung": "station\u00e4r",
        "Audio": "Lautsprecher (2x 2W),  1x Line-In,  1x Line-Out",
        "Aufl\u00f6sung": "1920x1200",
        "Beschichtung": "matt (non-glare),  H\u00e4rtegrad 3H",
        "Besonderheiten": "Slim Bezel,  EPEAT Silver,  mechanische Tasten,  Sicherheitsschloss (Kensington),  Werkskalibrierung (Delta-E <2),  Anwesenheitssensor,  Lichtsensor,  DICOM",
        "Bildwiederholfrequenz": "60Hz",
        "Blickwinkel": "178\u00b0/178\u00b0",
        "Diagonale": "24.1\"/61.2cm",
        "Energieverbrauch SDR": "12kWh/1000h",
        "Ergonomie": "150mm (h\u00f6henverstellbar),  \u00b190\u00b0 (Pivot),  \u00b1172\u00b0 (drehbar),  +35\u00b0/-5\u00b0 (neigbar),  keine Angabe (Schr\u00e4glage)",
        "FRC": "ja (6bit+2bit)",
        "Farbe": "schwarz",
        "Farbraum - sRGB": "99%",
        "Farbtiefe": "8bit (16.7 Mio. Farben)",
        "Form": "gerade (flat)",
        "Gewicht": "6.14kg (mit Standfu\u00df),  4.24kg (ohne Standfu\u00df)",
        "HDR": "N/A",
        "Helligkeit": "300cd/m\u00b2",
        "Herstellergarantie": "drei Jahre (Pickup&Return)",
        "Hintergrundbeleuchtung": "White-LED,  flicker-free,  Blaulichtfilter",
        "Kontrast - dynamisch": "20.000.000:1",
        "Kontrast - statisch": "1.000:1",
        "Lautsprecher": "Ja",
        "Leistungsaufnahme": "24.8W (maximal),  13.62W (typisch),  keine Angabe (Energielabel alt A+++ bis G),  0.38W (Standby)",
        "Panel": "IPS",
        "Reaktionszeit - GtG": "5ms",
        "Screen-to-Body-Ratio": "90.2% (berechnet)",
        "Seitenverh\u00e4ltnis": "16:10",
        "Signalfrequenz": "30-82kHz (horizontal),  48-76Hz (vertikal)",
        "Stromversorgung": "AC-In (internes Netzteil)",
        "USB-Hub In": "1x USB-B 2.0",
        "USB-Hub Out": "1x USB-C 3.0,  3x USB-A 3.0",
        "USB-Schreibweise": "Link",
        "VESA": "100x100 (belegt)",
        "Weitere Anschl\u00fcsse": "N/A"
    },
    "raw_specifications_text": "Anschl\u00fcsse - DisplayPort 1.2 60Hz@1920x1200: 1\nAnschl\u00fcsse - DVI 60Hz@1920x1200: 1\nAnschl\u00fcsse - HDMI 1.4 60Hz@1920x1200: 1\nAnschl\u00fcsse - VGA 60Hz@1920x1200: 1\nAnwendung: station\u00e4r\nAudio: Lautsprecher (2x 2W),  1x Line-In,  1x Line-Out\nAufl\u00f6sung: 1920x1200\nBeschichtung: matt (non-glare),  H\u00e4rtegrad 3H\nBesonderheiten: Slim Bezel,  EPEAT Silver,  mechanische Tasten,  Sicherheitsschloss (Kensington),  Werkskalibrierung (Delta-E <2),  Anwesenheitssensor,  Lichtsensor,  DICOM\nBildwiederholfrequenz: 60Hz\nBlickwinkel: 178\u00b0/178\u00b0\nDiagonale: 24.1\"/61.2cm\nEnergieverbrauch SDR: 12kWh/1000h\nErgonomie: 150mm (h\u00f6henverstellbar),  \u00b190\u00b0 (Pivot),  \u00b1172\u00b0 (drehbar),  +35\u00b0/-5\u00b0 (neigbar),  keine Angabe (Schr\u00e4glage)\nFarbe: schwarz\nFarbraum - sRGB: 99%\nFarbtiefe: 8bit (16.7 Mio. Farben)\nForm: gerade (flat)\nFRC: ja (6bit+2bit)\nGewicht: 6.14kg (mit Standfu\u00df),  4.24kg (ohne Standfu\u00df)\nHDR: N/A\nHelligkeit: 300cd/m\u00b2\nHerstellergarantie: drei Jahre (Pickup&Return)\nHintergrundbeleuchtung: White-LED,  flicker-free,  Blaulichtfilter\nKontrast - dynamisch: 20.000.000:1\nKontrast - statisch: 1.000:1\nLautsprecher: Ja\nLeistungsaufnahme: 24.8W (maximal),  13.62W (typisch),  keine Angabe (Energielabel alt A+++ bis G),  0.38W (Standby)\nPanel: IPS\nReaktionszeit - GtG: 5ms\nScreen-to-Body-Ratio: 90.2% (berechnet)\nSeitenverh\u00e4ltnis: 16:10\nSignalfrequenz: 30-82kHz (horizontal),  48-76Hz (vertikal)\nStromversorgung: AC-In (internes Netzteil)\nUSB-Hub In: 1x USB-B 2.0\nUSB-Hub Out: 1x USB-C 3.0,  3x USB-A 3.0\nUSB-Schreibweise: Link\nVESA: 100x100 (belegt)\nWeitere Anschl\u00fcsse: N/A",
    "reference_file": "offer_reference_848.json",
    "shop_name": "DiTech.at"
}