{
    "html_file": "offer_339_7.html",
    "name": "LG 24BR650B-C, 23.8\"",
    "offer_link": "https://www.ba-computer.at/lg-24br650b-c-led-monitor-60-4-cm-24-23-8-sichtbar-24br650b-c-aeu.html",
    "price": 196.78,
    "raw_specifications": {
        "Abmessungen (Breite x Tiefe x H\u00f6he)": "53.96 cm x 25.6 cm x 54.8 cm - mit Fu\u00df",
        "Besonderheiten": "Crosshair Display, Flicker Safe, Reader Mode, Werkskalibrierung, Intelligente Energiespartechnologie, Farbkalibrierung, Black Stabilizer, DAS Mode (Dynamic Action Sync), Super Resolution+",
        "Bildschirmbeschichtung": "Blendfrei, 3H Hard Coating",
        "Bildschirmtyp": "IPS",
        "Daisy-Chaining": "Ja",
        "Details zu Abmessungen & Gewicht": "Mit Fu\u00df - Breite: 53.96 cm - Tiefe: 25.6 cm - H\u00f6he: 54.8 cm - Gewicht: 6.5 kg \u00a6 Ohne Fu\u00df - Breite: 53.96 cm - Tiefe: 5 cm - H\u00f6he: 32.3 cm - Gewicht: 3.7 kg",
        "Diagonalabmessung": "60.4 cm (24\")",
        "Display-Typ": "LED-hintergrundbeleuchteter LCD-Monitor / TFT-Aktivmatrix",
        "Eingangsspannung": "Wechselstrom 220-240 V",
        "Einstellungen der Anzeigeposition": "H\u00f6he, Pivot (Rotation), Drehung, Neigung",
        "Energie Effizienzklasse": "Klasse E",
        "Enthaltene Kabel": "1 x DisplayPort-Kabel \u00a6 1 x USB-C Kabel",
        "Farbe": "Schwarz",
        "Farbunterst\u00fctzung": "16,7 Millionen Farben",
        "Gewicht": "6.5 kg",
        "Helligkeit": "250 cd/m\u00b2",
        "Hintergrundbeleuchtungs-Technologie": "LED-Hintergrundbeleuchtung",
        "Horizontaler Betrachtungswinkel": "178",
        "H\u00f6heneinstellung": "130 mm",
        "Integrierte Peripherieger\u00e4te": "USB 3.0-Hub",
        "Kennzeichnung": "FCC Klasse B bescheinigt, UL, TUV, TUV GS, cUL, CB, RoHS, REACH, ERP, EPA 8.0, TCO Certified Edge",
        "Kontrast": "1000:1",
        "Leistungsmerkmale": "Slot f\u00fcr Sicherheitsschloss (Kabelschloss getrennt erh\u00e4ltlich)",
        "Mitgelieferte Software": "Dual Controller Software, LG On-Screen Control",
        "Native Aufl\u00f6sung": "Full HD (1080p) 1920 x 1080",
        "Neigungswinkel": "-5/+25",
        "OSD-Sprachen": "Multilingual",
        "Pixelpitch": "0.2745 mm",
        "Reaktionszeit": "5 ms (Gray-to-Gray)",
        "Schlosstyp zur Diebstahlsicherung": "Kensington Slot",
        "Schnittstellen": "HDMI \u00a6 DisplayPort 1.4 \u00a6 USB-C (DisplayPort Alt Mode, Daten, Leistung bis zu 65 W) \u00a6 USB 3.0 Upstream \u00a6 3 x USB 3.0 Downstream \u00a6 Kopfh\u00f6reranschluss (Mini-Klinkenstecker) \u00a6 LAN (RJ-45) \u00a6 DisplayPort 1,4 Ausgang",
        "Schwenkwinkel": "60",
        "Seitenverh\u00e4ltnis": "16:9",
        "Sichtbare Bildfl\u00e4che": "60.4 cm (23.8\")",
        "Stromverbrauch (Aus-Modus)": "0.3 Watt",
        "Stromverbrauch (typisch)": "23 Watt",
        "Stromverbrauch SDR (eingeschaltet)": "17 kWh/1.000 h",
        "Stromverbrauch im Standby-Modus": "0.5 Watt",
        "TCO-zertifiziert": "TCO Certified Displays 9",
        "Transportbreite": "61.3 cm",
        "Transportgewicht": "8.2 kg",
        "Transporth\u00f6he": "49.1 cm",
        "Transporttiefe": "18.4 cm",
        "Typ": "Lautsprecher - Stereo",
        "USB-Spannungsversorgung": "65 Watt",
        "Vertikaler Betrachtungswinkel": "178"
    },
    "raw_specifications_text": "Display-Typ: LED-hintergrundbeleuchteter LCD-Monitor / TFT-Aktivmatrix\nEnergie Effizienzklasse: Klasse E\nDiagonalabmessung: 60.4 cm (24\")\nSichtbare Bildfl\u00e4che: 60.4 cm (23.8\")\nDaisy-Chaining: Ja\nIntegrierte Peripherieger\u00e4te: USB 3.0-Hub\nUSB-Spannungsversorgung: 65 Watt\nBildschirmtyp: IPS\nSeitenverh\u00e4ltnis: 16:9\nNative Aufl\u00f6sung: Full HD (1080p) 1920 x 1080\nPixelpitch: 0.2745 mm\nHelligkeit: 250 cd/m\u00b2\nKontrast: 1000:1\nFarbunterst\u00fctzung: 16,7 Millionen Farben\nReaktionszeit: 5 ms (Gray-to-Gray)\nHorizontaler Betrachtungswinkel: 178\nVertikaler Betrachtungswinkel: 178\nBildschirmbeschichtung: Blendfrei, 3H Hard Coating\nHintergrundbeleuchtungs-Technologie: LED-Hintergrundbeleuchtung\nOSD-Sprachen: Multilingual\nBesonderheiten: Crosshair Display, Flicker Safe, Reader Mode, Werkskalibrierung, Intelligente Energiespartechnologie, Farbkalibrierung, Black Stabilizer, DAS Mode (Dynamic Action Sync), Super Resolution+\nFarbe: Schwarz\nAbmessungen (Breite x Tiefe x H\u00f6he): 53.96 cm x 25.6 cm x 54.8 cm - mit Fu\u00df\nGewicht: 6.5 kg\nTyp: Lautsprecher - Stereo\nSchnittstellen: HDMI \u00a6 DisplayPort 1.4 \u00a6 USB-C (DisplayPort Alt Mode, Daten, Leistung bis zu 65 W) \u00a6 USB 3.0 Upstream \u00a6 3 x USB 3.0 Downstream \u00a6 Kopfh\u00f6reranschluss (Mini-Klinkenstecker) \u00a6 LAN (RJ-45) \u00a6 DisplayPort 1,4 Ausgang\nEinstellungen der Anzeigeposition: H\u00f6he, Pivot (Rotation), Drehung, Neigung\nNeigungswinkel: -5/+25\nSchwenkwinkel: 60\nH\u00f6heneinstellung: 130 mm\nLeistungsmerkmale: Slot f\u00fcr Sicherheitsschloss (Kabelschloss getrennt erh\u00e4ltlich)\nEnthaltene Kabel: 1 x DisplayPort-Kabel \u00a6 1 x USB-C Kabel\nKennzeichnung: FCC Klasse B bescheinigt, UL, TUV, TUV GS, cUL, CB, RoHS, REACH, ERP, EPA 8.0, TCO Certified Edge\nSchlosstyp zur Diebstahlsicherung: Kensington Slot\nEingangsspannung: Wechselstrom 220-240 V\nStromverbrauch SDR (eingeschaltet): 17 kWh/1.000 h\nStromverbrauch (typisch): 23 Watt\nStromverbrauch im Standby-Modus: 0.5 Watt\nStromverbrauch (Aus-Modus): 0.3 Watt\nMitgelieferte Software: Dual Controller Software, LG On-Screen Control\nDetails zu Abmessungen & Gewicht: Mit Fu\u00df - Breite: 53.96 cm - Tiefe: 25.6 cm - H\u00f6he: 54.8 cm - Gewicht: 6.5 kg \u00a6 Ohne Fu\u00df - Breite: 53.96 cm - Tiefe: 5 cm - H\u00f6he: 32.3 cm - Gewicht: 3.7 kg\nTransportbreite: 61.3 cm\nTransporttiefe: 18.4 cm\nTransporth\u00f6he: 49.1 cm\nTransportgewicht: 8.2 kg\nTCO-zertifiziert: TCO Certified Displays 9",
    "reference_file": "offer_reference_339.json",
    "shop_name": "BA-Computer"
}