{
    "html_file": "offer_431_22.html",
    "name": "Samsung Odyssey G5 G55A (2023), 27\"",
    "offer_link": "https://www.future-x.at/samsung-odyssey-g5-s27ag550ep-led-monitor-gaming-gebogen-68-cm-27-2560-x-1440-wqhd-%40-165-hz-va-300-cd-m%B2-2500%3A1-hdr10-1-ms-hdmi-displayport-schwarz-p-9171817/?pv=2",
    "price": 240.19,
    "raw_specifications": {
        "Abmessungen (Breite x Tiefe x H\u00f6he)": "61,66 cm x 27,26 cm x 47,74 cm - mit Fu\u00df",
        "Adaptive-Sync Technologie": "AMD FreeSync Premium",
        "Besonderheiten": "Cinema Mode, Black eQualizer, CustomColor Mode, FPS Mode, Mega Infinity Dynamic Contrast Ratio, flimmerfreie Technologie, RTS Mode, Eye Saver Mode, Off Timer Plus, Niedrige Eingangsverz\u00f6gerung, Super Arena Gaming UX, Screen Size Optimizer, Refresh Rate Optimizer, RPG Mode, AOS Mode, Dynamic Contrast Mode, Auto Source Switch",
        "Bildschirmtyp": "VA",
        "Details zu Abmessungen & Gewicht": "Mit Fu\u00df - Breite: 61,66 cm - Tiefe: 27,26 cm - H\u00f6he: 47,74 cm - Gewicht: 4,1 kg \u00a6 Ohne Fu\u00df - Breite: 61,46 cm - Tiefe: 12 cm - H\u00f6he: 38,28 cm - Gewicht: 3,7 kg",
        "Diagonalabmessung": "68 cm (27\")",
        "Display-Typ": "LED-hintergrundbeleuchteter LCD-Monitor / TFT-Aktivmatrix",
        "Eingangsspannung": "Wechselstrom 100-240 V",
        "Einstellungen der Anzeigeposition": "Neigung",
        "Energie Effizienzklasse": "Klasse F",
        "Energieklasse (HDR)": "Klasse G",
        "Energieverbrauch pro Jahr": "38 kWh",
        "Enthaltene Kabel": "1 x DisplayPort-Kabel",
        "Farbe": "Schwarz",
        "Farbunterst\u00fctzung": "16,7 Millionen Farben",
        "Gaming": "Ja",
        "Geschwungener Bildschirm": "Ja (1000R)",
        "Gewicht": "4,1 kg",
        "HDR-Format": "HDR10",
        "Helligkeit": "300 cd/m\u00b2",
        "Hintergrundbeleuchtungs-Technologie": "LED-Hintergrundbeleuchtung",
        "Horizontaler Betrachtungswinkel": "178",
        "Kontrast": "2500:1",
        "Leistungsmerkmale": "Slot f\u00fcr Sicherheitsschloss (Kabelschloss getrennt erh\u00e4ltlich)",
        "Max. Betriebstemperatur": "40 \u00b0C",
        "Min Betriebstemperatur": "10 \u00b0C",
        "Native Aufl\u00f6sung": "WQHD 2560 x 1440 bei 165 Hz",
        "Neigungswinkel": "-2/+18",
        "Reaktionszeit": "1 ms (MPRT)",
        "Schlosstyp zur Diebstahlsicherung": "Kensington Slot",
        "Schnittstellen": "DisplayPort 1.4 \u00a6 HDMI 2.0 \u00a6 Kopfh\u00f6rer (Mini-Klinkenstecker)",
        "Seitenverh\u00e4ltnis": "16:9",
        "Service und Support": "Begrenzte Garantie - 2 Jahre",
        "Stromverbrauch (Aus-Modus)": "0.3 Watt",
        "Stromverbrauch (max.)": "40 Watt",
        "Stromverbrauch (typisch)": "26.1 Watt",
        "Stromverbrauch HDR (eingeschaltet)": "42 kWh/1.000 h",
        "Stromverbrauch SDR (eingeschaltet)": "26 kWh/1.000 h",
        "Stromverbrauch im Standby-Modus": "0.5 Watt",
        "Transportbreite": "67,9 cm",
        "Transportgewicht": "6 kg",
        "Transporth\u00f6he": "43,8 cm",
        "Transporttiefe": "19,3 cm",
        "VESA-Halterung": "75 x 75 mm",
        "Vertikaler Betrachtungswinkel": "178",
        "Zul\u00e4ssige Luftfeuchtigkeit im Betrieb": "10 - 80% (nicht kondensierend)"
    },
    "raw_specifications_text": "Display-Typ: LED-hintergrundbeleuchteter LCD-Monitor / TFT-Aktivmatrix\nEnergie Effizienzklasse: Klasse F\nEnergieklasse (HDR): Klasse G\nEnergieverbrauch pro Jahr: 38 kWh\nDiagonalabmessung: 68 cm (27\")\nGeschwungener Bildschirm: Ja (1000R)\nAdaptive-Sync Technologie: AMD FreeSync Premium\nBildschirmtyp: VA\nSeitenverh\u00e4ltnis: 16:9\nNative Aufl\u00f6sung: WQHD 2560 x 1440 bei 165 Hz\nHelligkeit: 300 cd/m\u00b2\nKontrast: 2500:1\nHDR-Format: HDR10\nFarbunterst\u00fctzung: 16,7 Millionen Farben\nReaktionszeit: 1 ms (MPRT)\nGaming: Ja\nHorizontaler Betrachtungswinkel: 178\nVertikaler Betrachtungswinkel: 178\nHintergrundbeleuchtungs-Technologie: LED-Hintergrundbeleuchtung\nBesonderheiten: Cinema Mode, Black eQualizer, CustomColor Mode, FPS Mode, Mega Infinity Dynamic Contrast Ratio, flimmerfreie Technologie, RTS Mode, Eye Saver Mode, Off Timer Plus, Niedrige Eingangsverz\u00f6gerung, Super Arena Gaming UX, Screen Size Optimizer, Refresh Rate Optimizer, RPG Mode, AOS Mode, Dynamic Contrast Mode, Auto Source Switch\nFarbe: Schwarz\nAbmessungen (Breite x Tiefe x H\u00f6he): 61,66 cm x 27,26 cm x 47,74 cm - mit Fu\u00df\nGewicht: 4,1 kg\nSchnittstellen: DisplayPort 1.4 \u00a6 HDMI 2.0 \u00a6 Kopfh\u00f6rer (Mini-Klinkenstecker)\nEinstellungen der Anzeigeposition: Neigung\nNeigungswinkel: -2/+18\nVESA-Halterung: 75 x 75 mm\nLeistungsmerkmale: Slot f\u00fcr Sicherheitsschloss (Kabelschloss getrennt erh\u00e4ltlich)\nEnthaltene Kabel: 1 x DisplayPort-Kabel\nSchlosstyp zur Diebstahlsicherung: Kensington Slot\nEingangsspannung: Wechselstrom 100-240 V\nStromverbrauch SDR (eingeschaltet): 26 kWh/1.000 h\nStromverbrauch HDR (eingeschaltet): 42 kWh/1.000 h\nStromverbrauch (typisch): 26.1 Watt\nStromverbrauch (max.): 40 Watt\nStromverbrauch im Standby-Modus: 0.5 Watt\nStromverbrauch (Aus-Modus): 0.3 Watt\nDetails zu Abmessungen & Gewicht: Mit Fu\u00df - Breite: 61,66 cm - Tiefe: 27,26 cm - H\u00f6he: 47,74 cm - Gewicht: 4,1 kg \u00a6 Ohne Fu\u00df - Breite: 61,46 cm - Tiefe: 12 cm - H\u00f6he: 38,28 cm - Gewicht: 3,7 kg\nTransportbreite: 67,9 cm\nTransporttiefe: 19,3 cm\nTransporth\u00f6he: 43,8 cm\nTransportgewicht: 6 kg\nService und Support: Begrenzte Garantie - 2 Jahre\nMin Betriebstemperatur: 10 \u00b0C\nMax. Betriebstemperatur: 40 \u00b0C\nZul\u00e4ssige Luftfeuchtigkeit im Betrieb: 10 - 80% (nicht kondensierend)",
    "reference_file": "offer_reference_431.json",
    "shop_name": "Future-X.at"
}