{
    "html_file": "offer_224_24.html",
    "name": "Lenovo ThinkVision T24mv-30, 23.8\"",
    "offer_link": "https://www.alternate.at/Lenovo/ThinkVision-T24mv-30-LED-Monitor/html/product/1917467?partner=AtGeizhalsat&campaign=Monitor/Lenovo/1917467",
    "price": 368.0,
    "raw_specifications": {
        "": "Ausgangsleistung",
        "Abmessungen": "Breite: 53,98 cm x H\u00f6he: 54,28 cm x Tiefe/L\u00e4nge: 19,97 cm",
        "Anschl\u00fcsse": "1x HDMI-Eingang, (HDMI-Version: 2.0), 1x DisplayPort-Eingang, 1x DisplayPort-Ausgang, (DisplayPort-Version: 1.4), 4x USB-A-3.2 Gen 1 (5 Gbit/s), 1x USB-C 3.2 Gen 1 (5 Gbit/s), 1x RJ 45",
        "Bild": "Glaretyp",
        "Bildschirmaufl\u00f6sung": "1.920 x 1.080 Pixel",
        "Bildschirmdiagonale": "60,45 cm (23,8 Zoll)",
        "EAN": "0196801934177",
        "Energieeffizienzklasse (SDR)": "E (A - G)",
        "Energieverbauch pro 1000 Stunden (SDR)": "16 kWh",
        "Ergonomie": "Typ",
        "Farbe": "schwarz",
        "Features": "Mikrofon, Webcam",
        "Geeignet f\u00fcr": "Business",
        "Gewicht": "6,5 kg",
        "Hersteller-Nr.": "63D7UAT3EU",
        "Lautsprecher": "2 Lautsprecher",
        "Leistungsaufnahme im Bereitschafts- und Aus-Zustand": "0,5 Watt",
        "Leistungsaufnahme im Ein-Zustand bei Standard-Dynamikumfang (SDR)": "16 Watt",
        "Serie": "ThinkVision",
        "Standards": "Video",
        "Stromversorgung": "Netzteil",
        "Typ": "LED-Monitor",
        "Wandhalterung": "VESA kompatibel (100 x 100 mm)",
        "Weitere Informationen": "integrierte Webcam mit 5.0 Megapixel, IR + RGB, Mikrofon | der USB-C-Anschluss unterst\u00fctzt DisplayPort Alt Mode mit DisplayPort 1.4 | Low Blue Light, Umgebungslichtsensor, Bewegungserkennung"
    },
    "raw_specifications_text": "Energieeffizienzklasse (SDR): E (A - G)\nEnergieverbauch pro 1000 Stunden (SDR): 16 kWh\nLeistungsaufnahme im Ein-Zustand bei Standard-Dynamikumfang (SDR): 16 Watt\nLeistungsaufnahme im Bereitschafts- und Aus-Zustand: 0,5 Watt\nBildschirmdiagonale: 60,45 cm (23,8 Zoll)\nBildschirmaufl\u00f6sung: 1.920 x 1.080 Pixel\nTyp: LED-Monitor\nFarbe: schwarz\nEAN: 0196801934177\nHersteller-Nr.: 63D7UAT3EU\nSerie: ThinkVision\nGeeignet f\u00fcr: Business\nBild: Glaretyp\n: Ausgangsleistung\nAnschl\u00fcsse: 1x HDMI-Eingang, (HDMI-Version: 2.0), 1x DisplayPort-Eingang, 1x DisplayPort-Ausgang, (DisplayPort-Version: 1.4), 4x USB-A-3.2 Gen 1 (5 Gbit/s), 1x USB-C 3.2 Gen 1 (5 Gbit/s), 1x RJ 45\nErgonomie: Typ\nStromversorgung: Netzteil\nLautsprecher: 2 Lautsprecher\nStandards: Video\nWandhalterung: VESA kompatibel (100 x 100 mm)\nFeatures: Mikrofon, Webcam\nWeitere Informationen: integrierte Webcam mit 5.0 Megapixel, IR + RGB, Mikrofon | der USB-C-Anschluss unterst\u00fctzt DisplayPort Alt Mode mit DisplayPort 1.4 | Low Blue Light, Umgebungslichtsensor, Bewegungserkennung\nAbmessungen: Breite: 53,98 cm x H\u00f6he: 54,28 cm x Tiefe/L\u00e4nge: 19,97 cm\nGewicht: 6,5 kg",
    "reference_file": "offer_reference_224.json",
    "shop_name": "Alternate.at"
}