{
    "html_file": "offer_643_13.html",
    "name": "Samsung Odyssey G6 G65B, 32\"",
    "offer_link": "https://www.amazon.de/dp/B09RHQC61B?linkCode=xm2&camp=2025&creative=165953&smid=A3JWKAKR8XB7XF&creativeASIN=B09RHQC61B&tag=geizhals1-21",
    "price": 405.37,
    "raw_specifications": {
        "ASIN": "B09RHQC61B",
        "Amazon Bestseller-Rang": "Nr. 7,733 in Computer & Zubeh\u00f6r (Siehe Top 100 in Computer & Zubeh\u00f6r)  Nr. 162 in Monitore",
        "Anzahl HDMI Schnittstellen": "\u200e2",
        "Anzahl USB 3.0 Schnittstellen": "\u200e2",
        "Artikelgewicht": "\u200e7,4 Kilograms",
        "Auslaufartikel (Produktion durch Hersteller eingestellt)": "\u200eNein",
        "Batterien enthalten": "\u200eNein",
        "Betriebssystem": "\u200eAndroid 4.0",
        "Bildschirmaufl\u00f6sung": "\u200e2560 x 1440 pixels",
        "Display-Gr\u00f6\u00dfe": "\u200e32 Zoll",
        "Durchschnittliche Kundenbewertung": "4,3  4,3 von 5 Sternen    \n    718 Sternebewertungen   \n\n\n 4,3 von 5 Sternen",
        "Farbe": "\u200eSchwarz",
        "Formfaktor": "\u200eBlock",
        "Garantierte Software-Updates bis": "\u200eunbekannt",
        "Gr\u00f6\u00dfe des Arbeitsspeichers": "\u200e1",
        "Hersteller": "\u200eSamsung",
        "Im Angebot von Amazon.de seit": "30. Januar 2022",
        "L\u00f6sung": "\u200e2560 x 1440 Pixels",
        "Marke": "\u200eSamsung",
        "Modell/Serie": "\u200eOdyssey Smart Gaming Monitor G65B",
        "Modellnummer": "\u200eLS32BG650EUXEN",
        "Produktabmessungen": "\u200e50 x 50 x 28 cm; 7,4 Kilogramm",
        "Prozessortyp": "\u200eOthers",
        "WLAN Provider": "\u200eEntsperrt"
    },
    "raw_specifications_text": "Marke: \u200eSamsung\nHersteller: \u200eSamsung\nModell/Serie: \u200eOdyssey Smart Gaming Monitor G65B\nProduktabmessungen: \u200e50 x 50 x 28 cm; 7,4 Kilogramm\nModellnummer: \u200eLS32BG650EUXEN\nAuslaufartikel (Produktion durch Hersteller eingestellt): \u200eNein\nFarbe: \u200eSchwarz\nFormfaktor: \u200eBlock\nDisplay-Gr\u00f6\u00dfe: \u200e32 Zoll\nBildschirmaufl\u00f6sung: \u200e2560 x 1440 pixels\nL\u00f6sung: \u200e2560 x 1440 Pixels\nProzessortyp: \u200eOthers\nGr\u00f6\u00dfe des Arbeitsspeichers: \u200e1\nWLAN Provider: \u200eEntsperrt\nAnzahl USB 3.0 Schnittstellen: \u200e2\nAnzahl HDMI Schnittstellen: \u200e2\nBetriebssystem: \u200eAndroid 4.0\nBatterien enthalten: \u200eNein\nArtikelgewicht: \u200e7,4 Kilograms\nGarantierte Software-Updates bis: \u200eunbekannt\nASIN: B09RHQC61B\nDurchschnittliche Kundenbewertung: 4,3  4,3 von 5 Sternen    \n    718 Sternebewertungen   \n\n\n 4,3 von 5 Sternen\nAmazon Bestseller-Rang: Nr. 7,733 in Computer & Zubeh\u00f6r (Siehe Top 100 in Computer & Zubeh\u00f6r)  Nr. 162 in Monitore\nIm Angebot von Amazon.de seit: 30. Januar 2022",
    "reference_file": "offer_reference_643.json",
    "shop_name": "Amazon.at"
}