{
    "html_file": "offer_1589_15.html",
    "name": "ASUS BE24EQSK, 23.8\"",
    "offer_link": "https://www.ditech.at/details.php?artnr=312489",
    "price": 236.9,
    "raw_specifications": {
        "Abmessungen (BxHxT)": "540x362x211mm (mit Standfu\u00df),  540x355x53mm (ohne Standfu\u00df)",
        "Anschl\u00fcsse - DisplayPort 1.2": "1",
        "Anschl\u00fcsse - HDMI 1.4": "1",
        "Anschl\u00fcsse - VGA": "1",
        "Anwendung": "station\u00e4r",
        "Audio": "Lautsprecher (2x 2W),  1x Line-In,  1x Line-Out",
        "Aufl\u00f6sung": "1920x1080",
        "Beschichtung": "matt (non-glare)",
        "Besonderheiten": "EPEAT Bronze,  mechanische Tasten,  Webcam (2.0 Megapixel,  neigbar),  Sicherheitsschloss (Kensington),  inkl. Mini-PC-Halterung (VESA 100x100)",
        "Bildwiederholfrequenz": "75Hz",
        "Blickwinkel": "178\u00b0/178\u00b0",
        "Diagonale": "23.8\"/60.5cm",
        "Energieeffizienzklasse alt (A+++ bis D)": "A+",
        "Energieeffizienzklasse alt (A+++ bis G)": "A+",
        "Energieverbrauch SDR": "22kWh/1000h",
        "Ergonomie": "130mm (h\u00f6henverstellbar),  \u00b190\u00b0 (Pivot),  \u00b190\u00b0 (drehbar),  +35\u00b0/-5\u00b0 (neigbar),  keine Angabe (Schr\u00e4glage)",
        "FRC": "unbekannt",
        "Farbe": "schwarz",
        "Farbtiefe": "8bit (16.7 Mio. Farben)",
        "Form": "gerade (flat)",
        "Gewicht": "5.60kg (mit Standfu\u00df),  3.70kg (ohne Standfu\u00df)",
        "HDR": "N/A",
        "Helligkeit": "300cd/m\u00b2",
        "Herstellergarantie": "drei Jahre",
        "Hintergrundbeleuchtung": "White-LED,  flicker-free,  Blaulichtfilter",
        "Jahresverbrauch alt (A+++ bis D)": "21.90kWh",
        "Jahresverbrauch alt (A+++ bis G)": "21.90kWh",
        "Kontrast - dynamisch": "100.000.000:1",
        "Kontrast - statisch": "1.000:1",
        "Lautsprecher": "Ja",
        "Leistungsaufnahme": "keine Angabe (maximal),  15W (typisch),  15W (Energielabel alt A+++ bis G),  0.5W (Standby)",
        "Panel": "IPS",
        "Reaktionszeit - GtG": "5ms",
        "Screen-to-Body-Ratio": "keine Angabe (berechnet)",
        "Seitenverh\u00e4ltnis": "16:9",
        "Signalfrequenz": "30-83kHz (horizontal),  50-76Hz (vertikal)",
        "Stromversorgung": "AC-In (internes Netzteil)",
        "USB-Hub In": "N/A",
        "USB-Hub Out": "N/A",
        "USB-Schreibweise": "Link",
        "VESA": "100x100 (belegt),  100x100 (via Adapter,  inkludiert)",
        "VRR (Variable Refresh Rate)": "N/A",
        "Weitere Anschl\u00fcsse": "N/A"
    },
    "raw_specifications_text": "Abmessungen (BxHxT): 540x362x211mm (mit Standfu\u00df),  540x355x53mm (ohne Standfu\u00df)\nAnschl\u00fcsse - DisplayPort 1.2: 1\nAnschl\u00fcsse - HDMI 1.4: 1\nAnschl\u00fcsse - VGA: 1\nAnwendung: station\u00e4r\nAudio: Lautsprecher (2x 2W),  1x Line-In,  1x Line-Out\nAufl\u00f6sung: 1920x1080\nBeschichtung: matt (non-glare)\nBesonderheiten: EPEAT Bronze,  mechanische Tasten,  Webcam (2.0 Megapixel,  neigbar),  Sicherheitsschloss (Kensington),  inkl. Mini-PC-Halterung (VESA 100x100)\nBildwiederholfrequenz: 75Hz\nBlickwinkel: 178\u00b0/178\u00b0\nDiagonale: 23.8\"/60.5cm\nEnergieeffizienzklasse alt (A+++ bis D): A+\nEnergieeffizienzklasse alt (A+++ bis G): A+\nEnergieverbrauch SDR: 22kWh/1000h\nErgonomie: 130mm (h\u00f6henverstellbar),  \u00b190\u00b0 (Pivot),  \u00b190\u00b0 (drehbar),  +35\u00b0/-5\u00b0 (neigbar),  keine Angabe (Schr\u00e4glage)\nFarbe: schwarz\nFarbtiefe: 8bit (16.7 Mio. Farben)\nForm: gerade (flat)\nFRC: unbekannt\nGewicht: 5.60kg (mit Standfu\u00df),  3.70kg (ohne Standfu\u00df)\nHDR: N/A\nHelligkeit: 300cd/m\u00b2\nHerstellergarantie: drei Jahre\nHintergrundbeleuchtung: White-LED,  flicker-free,  Blaulichtfilter\nJahresverbrauch alt (A+++ bis D): 21.90kWh\nJahresverbrauch alt (A+++ bis G): 21.90kWh\nKontrast - dynamisch: 100.000.000:1\nKontrast - statisch: 1.000:1\nLautsprecher: Ja\nLeistungsaufnahme: keine Angabe (maximal),  15W (typisch),  15W (Energielabel alt A+++ bis G),  0.5W (Standby)\nPanel: IPS\nReaktionszeit - GtG: 5ms\nScreen-to-Body-Ratio: keine Angabe (berechnet)\nSeitenverh\u00e4ltnis: 16:9\nSignalfrequenz: 30-83kHz (horizontal),  50-76Hz (vertikal)\nStromversorgung: AC-In (internes Netzteil)\nUSB-Hub In: N/A\nUSB-Hub Out: N/A\nUSB-Schreibweise: Link\nVESA: 100x100 (belegt),  100x100 (via Adapter,  inkludiert)\nVRR (Variable Refresh Rate): N/A\nWeitere Anschl\u00fcsse: N/A",
    "reference_file": "offer_reference_1589.json",
    "shop_name": "DiTech.at"
}