{
    "html_file": "offer_1797_6.html",
    "name": "Lenovo C24-25, 23.8\"",
    "offer_link": "https://www.taufnaus.de/product/10608854",
    "price": 131.75,
    "raw_specifications": {
        "Abmessungen (Breite x Tiefe x H\u00f6he)": "54.01 cm x 20.62 cm x 40.39 cm - mit Fu\u00df",
        "Adaptive-Sync Technologie": "AMD FreeSync",
        "Besonderheiten": "Integrierte Kabelf\u00fchrung, Low Blue Light-Technologie, an 3 Seiten ohne Blende, 8-bit Farbtiefe, NearEdgeless-Design an 3 Seiten",
        "Bildschirmbeschichtung": "Blendfrei",
        "Bildschirmtyp": "VA",
        "Details zu Abmessungen & Gewicht": "Mit Fu\u00df - Breite: 54.01 cm - Tiefe: 20.62 cm - H\u00f6he: 40.39 cm - Gewicht: 3.01 kg \u00a6 Ohne Fu\u00df - Breite: 54.01 cm - Tiefe: 5.44 cm - H\u00f6he: 32.85 cm - Gewicht: 2.7 kg",
        "Diagonalabmessung": "60.5 cm (23.8\")",
        "Display-Typ": "LED-hintergrundbeleuchteter LCD-Monitor / TFT-Aktivmatrix",
        "Eingangsspannung": "Wechselstrom 120/230 V (50/60 Hz)",
        "Einstellungen der Anzeigeposition": "Neigung",
        "Energie Effizienzklasse": "Klasse E",
        "Energierverbrauch Sleep": "0.5 Watt",
        "Enthaltene Kabel": "1 x VGA-Kabel - 1.8 m",
        "Erforderliches Betriebssystem": "Microsoft Windows 7 / 10",
        "Farbe": "Raven Black",
        "Farbraum": "72% NTSC (CIE 1931)",
        "Farbunterst\u00fctzung": "16,7 Millionen Farben",
        "Gewicht": "3.01 kg",
        "Helligkeit": "250 cd/m\u00b2",
        "Hintergrundbeleuchtungs-Technologie": "WLED",
        "Horizontaler Betrachtungswinkel": "178",
        "Kennzeichnung": "CCC, TUV Rheinland Low Blue Light Certification, TUV Rheinland Flicker Free Certification, China Energy standard Tier 2, EU RoHS 2002/95/EC",
        "Kontrast": "1000:1 / 3000000:1 (dynamisch)",
        "Leistungsaufnahme im Ein-Zustand": "14.7 W",
        "Leistungsmerkmale": "Slot f\u00fcr Sicherheitsschloss (Kabelschloss getrennt erh\u00e4ltlich)",
        "Lokalisierung": "EMEA",
        "Native Aufl\u00f6sung": "Full HD (1080p) 1920 x 1080 bei 75 Hz",
        "Neigungswinkel": "-5/+22",
        "Pixelpitch": "0.2745 mm",
        "Ppi": "93",
        "Reaktionszeit": "4 ms (extrem), 6 ms (normal)",
        "Schlosstyp zur Diebstahlsicherung": "Kensington Slot",
        "Schnittstellen": "HDMI \u00a6 VGA \u00a6 Audio Line-Out",
        "Seitenverh\u00e4ltnis": "16:9",
        "Service und Support": "Begrenzte Garantie - 3 Jahre",
        "Stromverbrauch (Aus-Modus)": "0.3 Watt",
        "Stromverbrauch (typisch)": "18 Watt",
        "Stromverbrauch SDR (eingeschaltet)": "14.7 kWh/1.000 h",
        "Transportbreite": "63.3 cm",
        "Transportgewicht": "4.87 kg",
        "Transporth\u00f6he": "40.5 cm",
        "Transporttiefe": "12.4 cm",
        "VESA-Halterung": "100 x 100 mm",
        "Vertikaler Betrachtungswinkel": "178"
    },
    "raw_specifications_text": "Display-Typ: LED-hintergrundbeleuchteter LCD-Monitor / TFT-Aktivmatrix\nEnergie Effizienzklasse: Klasse E\nDiagonalabmessung: 60.5 cm (23.8\")\nAdaptive-Sync Technologie: AMD FreeSync\nBildschirmtyp: VA\nSeitenverh\u00e4ltnis: 16:9\nNative Aufl\u00f6sung: Full HD (1080p) 1920 x 1080 bei 75 Hz\nPixelpitch: 0.2745 mm\nPpi: 93\nHelligkeit: 250 cd/m\u00b2\nKontrast: 1000:1 / 3000000:1 (dynamisch)\nFarbunterst\u00fctzung: 16,7 Millionen Farben\nFarbraum: 72% NTSC (CIE 1931)\nReaktionszeit: 4 ms (extrem), 6 ms (normal)\nHorizontaler Betrachtungswinkel: 178\nVertikaler Betrachtungswinkel: 178\nBildschirmbeschichtung: Blendfrei\nHintergrundbeleuchtungs-Technologie: WLED\nBesonderheiten: Integrierte Kabelf\u00fchrung, Low Blue Light-Technologie, an 3 Seiten ohne Blende, 8-bit Farbtiefe, NearEdgeless-Design an 3 Seiten\nFarbe: Raven Black\nAbmessungen (Breite x Tiefe x H\u00f6he): 54.01 cm x 20.62 cm x 40.39 cm - mit Fu\u00df\nGewicht: 3.01 kg\nSchnittstellen: HDMI \u00a6 VGA \u00a6 Audio Line-Out\nEinstellungen der Anzeigeposition: Neigung\nNeigungswinkel: -5/+22\nVESA-Halterung: 100 x 100 mm\nLeistungsmerkmale: Slot f\u00fcr Sicherheitsschloss (Kabelschloss getrennt erh\u00e4ltlich)\nEnthaltene Kabel: 1 x VGA-Kabel - 1.8 m\nKennzeichnung: CCC, TUV Rheinland Low Blue Light Certification, TUV Rheinland Flicker Free Certification, China Energy standard Tier 2, EU RoHS 2002/95/EC\nLokalisierung: EMEA\nSchlosstyp zur Diebstahlsicherung: Kensington Slot\nEingangsspannung: Wechselstrom 120/230 V (50/60 Hz)\nLeistungsaufnahme im Ein-Zustand: 14.7 W\nStromverbrauch SDR (eingeschaltet): 14.7 kWh/1.000 h\nStromverbrauch (typisch): 18 Watt\nEnergierverbrauch Sleep: 0.5 Watt\nStromverbrauch (Aus-Modus): 0.3 Watt\nErforderliches Betriebssystem: Microsoft Windows 7 / 10\nDetails zu Abmessungen & Gewicht: Mit Fu\u00df - Breite: 54.01 cm - Tiefe: 20.62 cm - H\u00f6he: 40.39 cm - Gewicht: 3.01 kg \u00a6 Ohne Fu\u00df - Breite: 54.01 cm - Tiefe: 5.44 cm - H\u00f6he: 32.85 cm - Gewicht: 2.7 kg\nTransportbreite: 63.3 cm\nTransporttiefe: 12.4 cm\nTransporth\u00f6he: 40.5 cm\nTransportgewicht: 4.87 kg\nService und Support: Begrenzte Garantie - 3 Jahre",
    "reference_file": "offer_reference_1797.json",
    "shop_name": "TaufNaus"
}