{
    "html_file": "offer_2375_25.html",
    "name": "HP Z38c, 37.5\"",
    "offer_link": "https://www.future-x.at/hp-z38c-95-2-cm-375zoll-curved-display-flachbildschirm-tft-lcd-95-3-cm-37-5-14-ms-1000%3A1-ips-hdmi-p-837804/?pv=2",
    "price": 1044.19,
    "raw_specifications": {
        "3D": "Nein",
        "AMD FreeSync": "Nein",
        "Anzahl DisplayPort Anschl\u00fcsse": "1",
        "Anzahl HDMI Anschl\u00fcsse": "1",
        "Anzahl OSD-Sprachen": "10",
        "Anzahl der Farben des Displays": "1,073 Milliarden Farben",
        "Anzahl der nachgeschalteten Steckpl\u00e4tze vom Typ USB-A": "3",
        "Anzahl der vorgeschalteten Steckpl\u00e4tze": "1",
        "Anzeige": "LED",
        "Bildschirmaufl\u00f6sung": "3840 x 1600 Pixel",
        "Bildschirmdiagonale": "95,2 cm (37.5 Zoll)",
        "Bildschirmdiagonale (cm)": "95,25 cm",
        "Bildschirmdisplay (OSD)-Sprachen": "CHI (SIMPL), CHI (TR), Deutsch, Niederl\u00e4ndisch, Englisch, Spanisch, Franz\u00f6sisch, Italienisch, JPN, PortugiesischGewicht & Abmessungen",
        "Bildschirmtechnologie": "IPS",
        "Blickwinkel, horizontal": "178\u00b0",
        "Blickwinkel, vertikal": "178\u00b0",
        "Breite": "895,5 mm",
        "DVI Anschluss": "Nein",
        "Digital horizontale Frequenz": "27 - 130 kHz",
        "Digital vertikale Frequenz": "24 - 76 Hz",
        "Ein-/Ausschalter": "Ja",
        "Eingebaute Lautsprecher": "Nein",
        "Ger\u00e4tebreite (inkl. Fu\u00df)": "895,5 mm",
        "Ger\u00e4teh\u00f6he (inkl. Fu\u00df)": "558,7 mm",
        "Ger\u00e4tetiefe (inkl. Fu\u00df)": "248 mm",
        "Gewicht": "9,8 kg",
        "Gewicht mit Untersatz": "13,8 kg",
        "HD-Typ": "Ultra-Wide Quad HD+",
        "HDCP": "Ja",
        "Helligkeit": "300 cd/m\u00b2",
        "H\u00f6he": "399,5 mm",
        "H\u00f6heneinstellung": "12 cm",
        "H\u00f6henverstellung": "Ja",
        "Integrierte Kamera": "Nein",
        "Integrierter USB-Hub": "Ja",
        "Kabelsperre-Slot": "Ja",
        "Kontrastverh\u00e4ltnis": "1000:1",
        "Kontrastverh\u00e4ltnis (dynamisch)": "5000000:1",
        "NVIDIA G-SYNC": "Nein",
        "Native Seitenverh\u00e4ltnis": "21:9",
        "Neigungsverstellung": "Ja",
        "Neigungswinkelbereich": "-5 - 20\u00b0",
        "Pixel Abstand": "0,22908 x 0,22908 mm",
        "Produktfarbe": "Schwarz",
        "Reaktionszeit": "5 ms",
        "Schwenkbar": "Ja",
        "Schwenkwinkelbereich": "-45 - 45\u00b0",
        "Sichtbare Gr\u00f6\u00dfe (horizontal)": "88 cm",
        "Sichtbare Gr\u00f6\u00dfe (vertikal)": "36,6 cm",
        "TV Tuner integriert": "Nein",
        "Thin Client installiert": "Nein",
        "Tiefe": "104,2 mm",
        "USB-Hub-Version": "USB 3.0 (3.1 Gen 1)",
        "USB-Upstream-Porttyp": "USB Typ-C",
        "Unterst\u00fctzte Grafik-Aufl\u00f6sungen": "640 x 480 (VGA),720 x 400,800 x 600 (SVGA),1280 x 1024 (SXGA),1280 x 720 (HD 720),1280 x 768 (WXGA),1440 x 900 (WXGA+),1600 x 1200 (UXGA),1600 x 900,1920 x 1080 (HD 1080),1920 x 1200 (WUXGA),1920 x 1600,2560 x 1080,2560 x 1600 (WQXGA)",
        "VESA Montageadapter": "100 x 100 mm",
        "VESA-Halterung": "Ja"
    },
    "raw_specifications_text": "Bildschirmdiagonale: 95,2 cm (37.5 Zoll)\nHelligkeit: 300 cd/m\u00b2\nBildschirmaufl\u00f6sung: 3840 x 1600 Pixel\nReaktionszeit: 5 ms\nAnzeige: LED\nHD-Typ: Ultra-Wide Quad HD+\nBildschirmtechnologie: IPS\nUnterst\u00fctzte Grafik-Aufl\u00f6sungen: 640 x 480 (VGA),720 x 400,800 x 600 (SVGA),1280 x 1024 (SXGA),1280 x 720 (HD 720),1280 x 768 (WXGA),1440 x 900 (WXGA+),1600 x 1200 (UXGA),1600 x 900,1920 x 1080 (HD 1080),1920 x 1200 (WUXGA),1920 x 1600,2560 x 1080,2560 x 1600 (WQXGA)\nKontrastverh\u00e4ltnis: 1000:1\nBlickwinkel, horizontal: 178\u00b0\nBlickwinkel, vertikal: 178\u00b0\nAnzahl der Farben des Displays: 1,073 Milliarden Farben\nNative Seitenverh\u00e4ltnis: 21:9\n3D: Nein\nKontrastverh\u00e4ltnis (dynamisch): 5000000:1\nBildschirmdiagonale (cm): 95,25 cm\nPixel Abstand: 0,22908 x 0,22908 mm\nSichtbare Gr\u00f6\u00dfe (horizontal): 88 cm\nSichtbare Gr\u00f6\u00dfe (vertikal): 36,6 cm\nDigital horizontale Frequenz: 27 - 130 kHz\nDigital vertikale Frequenz: 24 - 76 Hz\nHDCP: Ja\nEingebaute Lautsprecher: Nein\nIntegrierte Kamera: Nein\nTV Tuner integriert: Nein\nProduktfarbe: Schwarz\nNVIDIA G-SYNC: Nein\nAMD FreeSync: Nein\nThin Client installiert: Nein\nIntegrierter USB-Hub: Ja\nDVI Anschluss: Nein\nAnzahl HDMI Anschl\u00fcsse: 1\nUSB-Hub-Version: USB 3.0 (3.1 Gen 1)\nUSB-Upstream-Porttyp: USB Typ-C\nAnzahl der vorgeschalteten Steckpl\u00e4tze: 1\nAnzahl der nachgeschalteten Steckpl\u00e4tze vom Typ USB-A: 3\nAnzahl DisplayPort Anschl\u00fcsse: 1\nKabelsperre-Slot: Ja\nVESA-Halterung: Ja\nH\u00f6henverstellung: Ja\nEin-/Ausschalter: Ja\nVESA Montageadapter: 100 x 100 mm\nSchwenkbar: Ja\nSchwenkwinkelbereich: -45 - 45\u00b0\nNeigungsverstellung: Ja\nNeigungswinkelbereich: -5 - 20\u00b0\nH\u00f6heneinstellung: 12 cm\nAnzahl OSD-Sprachen: 10\nBildschirmdisplay (OSD)-Sprachen: CHI (SIMPL), CHI (TR), Deutsch, Niederl\u00e4ndisch, Englisch, Spanisch, Franz\u00f6sisch, Italienisch, JPN, PortugiesischGewicht & Abmessungen\nBreite: 895,5 mm\nTiefe: 104,2 mm\nH\u00f6he: 399,5 mm\nGewicht: 9,8 kg\nGer\u00e4tebreite (inkl. Fu\u00df): 895,5 mm\nGer\u00e4tetiefe (inkl. Fu\u00df): 248 mm\nGer\u00e4teh\u00f6he (inkl. Fu\u00df): 558,7 mm\nGewicht mit Untersatz: 13,8 kg",
    "reference_file": "offer_reference_2375.json",
    "shop_name": "Future-X.at"
}