{
    "html_file": "offer_1335_14.html",
    "name": "ViewSonic VX3418-2KPC, 34\"",
    "offer_link": "https://www.taufnaus.de/product/10611320",
    "price": 499.22,
    "raw_specifications": {
        "Abmessungen (Breite x Tiefe x H\u00f6he)": "80.6 cm x 12.5 cm x 36.2 cm - ohne Fu\u00df",
        "Ausgangsleistung/Kanal": "2.5 Watt",
        "Besonderheiten": "Eco-Mode, Adaptive-Sync-Technologie, ViewMode, extrem d\u00fcnnes Blendendesign, 6-bit + FRC Color Depth",
        "Bildschirmbeschichtung": "Blendfrei, 3H Hard Coating, Haze 25 %",
        "Bildschirmtyp": "MVA",
        "Details zu Abmessungen & Gewicht": "Ohne Fu\u00df - Breite: 80.6 cm - Tiefe: 12.5 cm - H\u00f6he: 36.2 cm - Gewicht: 7.6 kg \u00a6 Mit Fu\u00df - Breite: 80.6 cm - Tiefe: 33.1 cm - H\u00f6he: 46.23 cm",
        "Diagonalabmessung": "86.4 cm (34\")",
        "Display-Typ": "LED-hintergrundbeleuchteter LCD-Monitor / TFT-Aktivmatrix",
        "Eingangsspannung": "Wechselstrom 100-240 V",
        "Einstellungen der Anzeigeposition": "H\u00f6he, Neigung",
        "Energie Effizienzklasse": "Klasse G",
        "Energieklasse (HDR)": "Klasse G",
        "Enthaltene Kabel": "1 x DisplayPort-Kabel",
        "Farbunterst\u00fctzung": "16,7 Millionen Farben",
        "Geschwungener Bildschirm": "Ja (1500R)",
        "Gewicht": "7.6 kg",
        "Helligkeit": "300 cd/m\u00b2",
        "Hintergrundbeleuchtungs-Technologie": "LED-Hintergrundbeleuchtung",
        "Horizontale Bildwiederholrate": "31.469 - 217.32 kHz",
        "Horizontaler Betrachtungswinkel": "178",
        "H\u00f6heneinstellung": "80 mm",
        "Kennzeichnung": "FCC Klasse B bescheinigt, ICES-003, cTUVus, CEC, Mexico Energy label, Mexico CoC",
        "Kontrast": "4000:1 / 80000000:1 (dynamisch)",
        "Lebensdauer der Beleuchtung": "30,000 Stunden",
        "Leistungsmerkmale": "Slot f\u00fcr Sicherheitsschloss (Kabelschloss getrennt erh\u00e4ltlich)",
        "Max. Betriebstemperatur": "40 \u00b0C",
        "Min Betriebstemperatur": "0 \u00b0C",
        "Native Aufl\u00f6sung": "WQHD 3440 x 1440 (DisplayPort: 144 Hz, HDMI: 100 Hz)",
        "Neigungswinkel": "-5/+10",
        "Reaktionszeit": "1 ms (MPRT)",
        "Schlosstyp zur Diebstahlsicherung": "Kensington Slot",
        "Schnittstellen": "2 x HDMI \u00a6 2 x DisplayPort \u00a6 Audio Line-Out",
        "Seitenverh\u00e4ltnis": "21:9",
        "Service und Support": "Begrenzte Garantie - 2 Jahre",
        "Stromverbrauch (max.)": "48 Watt",
        "Stromverbrauch (typisch)": "36 Watt",
        "Stromverbrauch HDR (eingeschaltet)": "50 kWh/1.000 h",
        "Stromverbrauch SDR (eingeschaltet)": "39 kWh/1.000 h",
        "Stromverbrauch im Standby-Modus": "0.5 Watt",
        "Transportbreite": "88.8 cm",
        "Transportgewicht": "10.2 kg",
        "Transporth\u00f6he": "52.8 cm",
        "Transporttiefe": "19 cm",
        "Typ": "Lautsprecher - Stereo",
        "VESA-Halterung": "100 x 100 mm",
        "Vertikale Bildwiederholrate": "48 - 144 Hz",
        "Vertikaler Betrachtungswinkel": "178",
        "Zul\u00e4ssige Luftfeuchtigkeit im Betrieb": "20 - 90% (nicht kondensierend)"
    },
    "raw_specifications_text": "Display-Typ: LED-hintergrundbeleuchteter LCD-Monitor / TFT-Aktivmatrix\nEnergie Effizienzklasse: Klasse G\nEnergieklasse (HDR): Klasse G\nDiagonalabmessung: 86.4 cm (34\")\nGeschwungener Bildschirm: Ja (1500R)\nBildschirmtyp: MVA\nSeitenverh\u00e4ltnis: 21:9\nNative Aufl\u00f6sung: WQHD 3440 x 1440 (DisplayPort: 144 Hz, HDMI: 100 Hz)\nHelligkeit: 300 cd/m\u00b2\nKontrast: 4000:1 / 80000000:1 (dynamisch)\nFarbunterst\u00fctzung: 16,7 Millionen Farben\nReaktionszeit: 1 ms (MPRT)\nVertikale Bildwiederholrate: 48 - 144 Hz\nHorizontale Bildwiederholrate: 31.469 - 217.32 kHz\nHorizontaler Betrachtungswinkel: 178\nVertikaler Betrachtungswinkel: 178\nBildschirmbeschichtung: Blendfrei, 3H Hard Coating, Haze 25 %\nHintergrundbeleuchtungs-Technologie: LED-Hintergrundbeleuchtung\nBesonderheiten: Eco-Mode, Adaptive-Sync-Technologie, ViewMode, extrem d\u00fcnnes Blendendesign, 6-bit + FRC Color Depth\nAbmessungen (Breite x Tiefe x H\u00f6he): 80.6 cm x 12.5 cm x 36.2 cm - ohne Fu\u00df\nGewicht: 7.6 kg\nTyp: Lautsprecher - Stereo\nAusgangsleistung/Kanal: 2.5 Watt\nSchnittstellen: 2 x HDMI \u00a6 2 x DisplayPort \u00a6 Audio Line-Out\nEinstellungen der Anzeigeposition: H\u00f6he, Neigung\nNeigungswinkel: -5/+10\nH\u00f6heneinstellung: 80 mm\nVESA-Halterung: 100 x 100 mm\nLeistungsmerkmale: Slot f\u00fcr Sicherheitsschloss (Kabelschloss getrennt erh\u00e4ltlich)\nEnthaltene Kabel: 1 x DisplayPort-Kabel\nLebensdauer der Beleuchtung: 30,000 Stunden\nKennzeichnung: FCC Klasse B bescheinigt, ICES-003, cTUVus, CEC, Mexico Energy label, Mexico CoC\nSchlosstyp zur Diebstahlsicherung: Kensington Slot\nEingangsspannung: Wechselstrom 100-240 V\nStromverbrauch SDR (eingeschaltet): 39 kWh/1.000 h\nStromverbrauch HDR (eingeschaltet): 50 kWh/1.000 h\nStromverbrauch (typisch): 36 Watt\nStromverbrauch (max.): 48 Watt\nStromverbrauch im Standby-Modus: 0.5 Watt\nDetails zu Abmessungen & Gewicht: Ohne Fu\u00df - Breite: 80.6 cm - Tiefe: 12.5 cm - H\u00f6he: 36.2 cm - Gewicht: 7.6 kg \u00a6 Mit Fu\u00df - Breite: 80.6 cm - Tiefe: 33.1 cm - H\u00f6he: 46.23 cm\nTransportbreite: 88.8 cm\nTransporttiefe: 19 cm\nTransporth\u00f6he: 52.8 cm\nTransportgewicht: 10.2 kg\nService und Support: Begrenzte Garantie - 2 Jahre\nMin Betriebstemperatur: 0 \u00b0C\nMax. Betriebstemperatur: 40 \u00b0C\nZul\u00e4ssige Luftfeuchtigkeit im Betrieb: 20 - 90% (nicht kondensierend)",
    "reference_file": "offer_reference_1335.json",
    "shop_name": "TaufNaus"
}