{
    "html_file": "offer_424_0.html",
    "name": "Wortmann Terra LED 2727W HA, 27\"",
    "offer_link": "https://www.ba-computer.at/terra-lcd-led-2727w-ha-black-hdmi-dp-greenline-plus-flachbildschirm-tft-lcd-3030204.html",
    "price": 174.16,
    "raw_specifications": {
        "AC Eingangsfrequenz": "50 - 60 Hz",
        "AC Eingangsspannung": "100 - 240 V",
        "Anzahl DisplayPort Anschl\u00fcsse": "1",
        "Anzahl der Farben des Displays": "16,7 Millionen Farben",
        "Bildschirmdiagonale": "68,6 cm",
        "Bildschirmdiagonale (cm)": "68,6 cm",
        "Bildschirmform": "Flach",
        "Bildschirmtechnologie": "LED",
        "Display-Aufl\u00f6sung": "1920 x 1080 Pixel",
        "DisplayPorts-Version": "1.2",
        "Eingebaute Lautsprecher": "Ja",
        "Energieeffizienzklasse (HDR)": "E",
        "Energieverbrauch (HDR) pro 1.000 Stunden": "20 kWh",
        "Flimmerfreie Technologie": "Ja",
        "HD-Typ": "Full HD",
        "HDCP": "Ja",
        "HDMI": "Ja",
        "Helligkeit (typisch)": "300 cd/m\u00b2",
        "H\u00f6henverstellung": "Ja",
        "Kabelsperre-Slot": "Ja",
        "Marktpositionierung": "Haus",
        "Natives Seitenverh\u00e4ltnis": "16:9",
        "Panel-Montage-Schnittstelle": "100 x 100 mm",
        "Panel-Typ": "IPS",
        "Pivot": "Nein",
        "Pixel Abstand": "0,311 x 0,311 mm",
        "Plug & Play": "Ja",
        "Produktfarbe": "Schwarz",
        "Reaktionszeit": "5 ms",
        "Slot-Typ Kabelsperre": "Kensington",
        "Stromverbrauch (Standardbetrieb)": "20 W",
        "Stromverbrauch (Standby)": "0,5 W",
        "Stromverbrauch (aus)": "0,3 W",
        "Touchscreen": "Nein",
        "Typ der Hintergrundbeleuchtung": "LED",
        "VESA-Halterung": "Ja"
    },
    "raw_specifications_text": "Bildschirmdiagonale: 68,6 cm\nDisplay-Aufl\u00f6sung: 1920 x 1080 Pixel\nNatives Seitenverh\u00e4ltnis: 16:9\nBildschirmtechnologie: LED\nTouchscreen: Nein\nHD-Typ: Full HD\nPanel-Typ: IPS\nTyp der Hintergrundbeleuchtung: LED\nHelligkeit (typisch): 300 cd/m\u00b2\nReaktionszeit: 5 ms\nBildschirmform: Flach\nAnzahl der Farben des Displays: 16,7 Millionen Farben\nPixel Abstand: 0,311 x 0,311 mm\nBildschirmdiagonale (cm): 68,6 cm\nMarktpositionierung: Haus\nProduktfarbe: Schwarz\nEingebaute Lautsprecher: Ja\nVESA-Halterung: Ja\nPanel-Montage-Schnittstelle: 100 x 100 mm\nKabelsperre-Slot: Ja\nSlot-Typ Kabelsperre: Kensington\nH\u00f6henverstellung: Ja\nPivot: Nein\nPlug & Play: Ja\nFlimmerfreie Technologie: Ja\nHDMI: Ja\nAnzahl DisplayPort Anschl\u00fcsse: 1\nDisplayPorts-Version: 1.2\nHDCP: Ja\nEnergieeffizienzklasse (HDR): E\nEnergieverbrauch (HDR) pro 1.000 Stunden: 20 kWh\nStromverbrauch (Standardbetrieb): 20 W\nStromverbrauch (Standby): 0,5 W\nStromverbrauch (aus): 0,3 W\nAC Eingangsspannung: 100 - 240 V\nAC Eingangsfrequenz: 50 - 60 Hz",
    "reference_file": "offer_reference_424.json",
    "shop_name": "BA-Computer"
}