{
    "html_file": "offer_1643_1.html",
    "name": "Dell Alienware AW2721D, 27\"",
    "offer_link": "https://www.office-partner.de/productredirect/index/sku/15458755?sPartner=p-geizhals-at&campaign=psm/geizhals-at/",
    "price": 776.37,
    "raw_specifications": {
        "Anschl\u00fcsse": "HDMI, DisplayPort, USB, Kopfh\u00f6reranschluss, Audioausgang (Line-Out)",
        "Artikelnummer": "15458755",
        "Bezeichnung des Herstellers": "Dell Alienware AW2721D",
        "Bildwiederholungsrate": "240,00 Hz",
        "Breite": "-1,00 mm",
        "Display Features": "FlickerFree",
        "Display Sync": "NVIDIA G-Sync",
        "Displaygr\u00f6\u00dfe": "68,58 cm (27 Zoll)",
        "EEK - Spektrum": "AG",
        "Einsatzort": "Innen",
        "Energieeffizienzklasse": "G",
        "Geh\u00e4usefarbe des Ger\u00e4tes": "Wei\u00df",
        "Gewicht": "10,60 kg",
        "Gewicht inkl. Verpackung in Kg": "15,50 kg",
        "Helligkeit Bereich": "ab 450 cd/m\u00b2",
        "Hersteller": "Dell",
        "H\u00f6he": "-1,00 mm",
        "Inhalt (ml oder g)": "0,00 ml",
        "Kapazit\u00e4t (Seiten)": "0",
        "Kontrastverh\u00e4ltnis (typisch) Bereich": "800:1 bis 1.200:1",
        "LCD-Technologie": "IPS Panel",
        "L\u00e4nge": "-1,00 mm",
        "Produktart": "Monitore",
        "Reaktionszeit": "1,00 ms",
        "Seitenverh\u00e4ltnis": "16:9",
        "Shop Herstellernummer": "210-AXNU",
        "Standard-EAN": "5397184200858",
        "Verpackung - Breite in cm": "74,20 cm",
        "Verpackung - H\u00f6he in cm": "52,40 cm",
        "Verpackung - L\u00e4nge in cm": "25,90 cm",
        "max. Aufl\u00f6sung": "2.560 x 1.440 Pixel (16:9)",
        "t\u00e4gliche Laufzeit Bereich": "< 14 Std."
    },
    "raw_specifications_text": "Displaygr\u00f6\u00dfe: 68,58 cm (27 Zoll)\nEnergieeffizienzklasse: G\nGeh\u00e4usefarbe des Ger\u00e4tes: Wei\u00df\nAnschl\u00fcsse: HDMI, DisplayPort, USB, Kopfh\u00f6reranschluss, Audioausgang (Line-Out)\nKontrastverh\u00e4ltnis (typisch) Bereich: 800:1 bis 1.200:1\nHelligkeit Bereich: ab 450 cd/m\u00b2\nDisplay Features: FlickerFree\nHersteller: Dell\nt\u00e4gliche Laufzeit Bereich: < 14 Std.\nGewicht: 10,60 kg\nProduktart: Monitore\nDisplay Sync: NVIDIA G-Sync\nInhalt (ml oder g): 0,00 ml\nKapazit\u00e4t (Seiten): 0\nBreite: -1,00 mm\nH\u00f6he: -1,00 mm\nL\u00e4nge: -1,00 mm\nEEK - Spektrum: AG\nVerpackung - H\u00f6he in cm: 52,40 cm\nGewicht inkl. Verpackung in Kg: 15,50 kg\nArtikelnummer: 15458755\nStandard-EAN: 5397184200858\nShop Herstellernummer: 210-AXNU\nBezeichnung des Herstellers: Dell Alienware AW2721D\nVerpackung - Breite in cm: 74,20 cm\nVerpackung - L\u00e4nge in cm: 25,90 cm\nmax. Aufl\u00f6sung: 2.560 x 1.440 Pixel (16:9)\nSeitenverh\u00e4ltnis: 16:9\nLCD-Technologie: IPS Panel\nReaktionszeit: 1,00 ms\nBildwiederholungsrate: 240,00 Hz\nEinsatzort: Innen",
    "reference_file": "offer_reference_1643.json",
    "shop_name": "office-partner (AT)"
}