{
    "html_file": "offer_1865_13.html",
    "name": "ASUS ZenScreen MB14AC, 14\"",
    "offer_link": "https://www.future-x.at/asus-zenscreen-mb14ac-led-monitor-35-6-cm-14-tragbar-1920-x-1080-full-hd-1080p-ips-220-cd-m%B2-700%3A1-5-ms-usb-dunkelgrau-p-8582318/?pv=2",
    "price": 210.29,
    "raw_specifications": {
        "AMD FreeSync": "Nein",
        "Anzahl der Farben des Displays": "16.78 million colors",
        "Anzahl der nachgeschalteten Ports vom Typ USB-C": "1",
        "Audioanschl\u00fcsse": "Nein",
        "Bildschirmaufl\u00f6sung": "1920 x 1080 Pixel",
        "Bildschirmdiagonale": "35,6 cm",
        "Bildschirmform": "Flach",
        "Blickwinkel, horizontal": "178 \u00b0",
        "Blickwinkel, vertikal": "178 \u00b0",
        "Breite": "324,9 mm",
        "DVI Anschluss": "Nein",
        "Eingebaute Lautsprecher": "Nein",
        "Energy Star-zertifiziert": "Ja",
        "Flimmerfreie Technologie": "Ja",
        "Gewicht": "590 g",
        "HD-Typ": "Full HD",
        "HDCP": "Ja",
        "HDMI": "Nein",
        "Helligkeit (typisch)": "250 cd/m\u00b2",
        "H\u00f6he": "208 mm",
        "H\u00f6henverstellung": "Nein",
        "Integrierte Kamera": "Nein",
        "Integrierter USB-Hub": "Ja",
        "Kabelsperre-Slot": "Nein",
        "Kontrastverh\u00e4ltnis": "700:1",
        "Kopfh\u00f6rerausgang": "Nein",
        "LED-Anzeigen": "Ja",
        "Low-Blue-Light-Technologie": "Ja",
        "Marktpositionierung": "Business",
        "Mitgelieferte Kabel": "USB Type-C to USB Type-C",
        "NVIDIA G-SYNC": "Nein",
        "Natives Seitenverh\u00e4ltnis": "16:9",
        "Paketgewicht": "1,3 kgGewicht und Abmessungen",
        "Panel-Typ": "IPS",
        "Pixel Abstand": "0,16 x 0,16 mm",
        "Produktfarbe": "Gray",
        "Reaktionszeit": "5 ms",
        "RoHS-Kompatibel": "Ja",
        "Sichtbare Gr\u00f6\u00dfe (diagonal)": "35,6 cm",
        "Sichtbare Gr\u00f6\u00dfe (horizontal)": "30,9 cm",
        "Sichtbare Gr\u00f6\u00dfe (vertikal)": "17,4 cm",
        "Tiefe": "11,2 mm",
        "Unterst\u00fctzte Grafik-Aufl\u00f6sungen": "640 x 480 (VGA),800 x 600 (SVGA),1024 x 768 (XGA),1280 x 1024 (SXGA),1280 x 960,1440 x 900 (WXGA+),1680 x 1050 (WSXGA+),1920 x 1080 (HD 1080)",
        "VESA-Halterung": "Nein",
        "Verpackungsbreite": "392 mm",
        "Verpackungsh\u00f6he": "257 mm",
        "Verpackungstiefe": "77 mm",
        "Zertifizierung": "BSMI, CB, CCC, CE, CU, FCC, J-MOSS, KCC, UkrSEPRO, UL/cUL, VCCI, WEEE, WHQL (Windows 10, Windows 8.1, Windows 7), TUV Flicker-free, TUV Low Blue Light, RCM"
    },
    "raw_specifications_text": "Bildschirmdiagonale: 35,6 cm\nBildschirmaufl\u00f6sung: 1920 x 1080 Pixel\nNatives Seitenverh\u00e4ltnis: 16:9\nPanel-Typ: IPS\nHelligkeit (typisch): 250 cd/m\u00b2\nReaktionszeit: 5 ms\nHD-Typ: Full HD\nBildschirmform: Flach\nUnterst\u00fctzte Grafik-Aufl\u00f6sungen: 640 x 480 (VGA),800 x 600 (SVGA),1024 x 768 (XGA),1280 x 1024 (SXGA),1280 x 960,1440 x 900 (WXGA+),1680 x 1050 (WSXGA+),1920 x 1080 (HD 1080)\nKontrastverh\u00e4ltnis: 700:1\nBlickwinkel, horizontal: 178 \u00b0\nBlickwinkel, vertikal: 178 \u00b0\nAnzahl der Farben des Displays: 16.78 million colors\nPixel Abstand: 0,16 x 0,16 mm\nSichtbare Gr\u00f6\u00dfe (horizontal): 30,9 cm\nSichtbare Gr\u00f6\u00dfe (vertikal): 17,4 cm\nSichtbare Gr\u00f6\u00dfe (diagonal): 35,6 cm\nIntegrierter USB-Hub: Ja\nAnzahl der nachgeschalteten Ports vom Typ USB-C: 1\nDVI Anschluss: Nein\nHDMI: Nein\nAudioanschl\u00fcsse: Nein\nKopfh\u00f6rerausgang: Nein\nHDCP: Ja\nVESA-Halterung: Nein\nKabelsperre-Slot: Nein\nH\u00f6henverstellung: Nein\nLED-Anzeigen: Ja\nEingebaute Lautsprecher: Nein\nIntegrierte Kamera: Nein\nMarktpositionierung: Business\nProduktfarbe: Gray\nEnergy Star-zertifiziert: Ja\nRoHS-Kompatibel: Ja\nZertifizierung: BSMI, CB, CCC, CE, CU, FCC, J-MOSS, KCC, UkrSEPRO, UL/cUL, VCCI, WEEE, WHQL (Windows 10, Windows 8.1, Windows 7), TUV Flicker-free, TUV Low Blue Light, RCM\nNVIDIA G-SYNC: Nein\nAMD FreeSync: Nein\nFlimmerfreie Technologie: Ja\nLow-Blue-Light-Technologie: Ja\nMitgelieferte Kabel: USB Type-C to USB Type-C\nVerpackungsbreite: 392 mm\nVerpackungstiefe: 77 mm\nVerpackungsh\u00f6he: 257 mm\nPaketgewicht: 1,3 kgGewicht und Abmessungen\nBreite: 324,9 mm\nTiefe: 11,2 mm\nH\u00f6he: 208 mm\nGewicht: 590 g",
    "reference_file": "offer_reference_1865.json",
    "shop_name": "Future-X.at"
}