{
    "html_file": "offer_1576_16.html",
    "name": "HP P34hc G4, 34\"",
    "offer_link": "https://www.1ashop.at/de/produkt/58590/hp-p34hc-g4-p-series-led-monitor-gebogen-86-36-cm-34.html",
    "price": 403.3,
    "raw_specifications": {
        "Abmessungen (Breite x Tiefe x H\u00f6he)": "80.94 cm x 23.49 cm x 51.8 cm - mit Fu\u00df",
        "Ausgangsleistung/Kanal": "3 Watt",
        "Besonderheiten": "Low Blue Light Mode, flimmerfreie Technologie, ohne Quecksilber, arsenfrei, extrem schmale Blende an drei Seiten, 8-bit Farbtiefe, kantenbeleuchtete LED-Hintergrundbeleuchtung",
        "Bildschirmbeschichtung": "Blendfrei, 3H Hard Coating, Haze 25 %",
        "Bildschirmtyp": "VA",
        "Details zu Abmessungen & Gewicht": "Mit Fu\u00df - Breite: 80.94 cm - Tiefe: 23.49 cm - H\u00f6he: 51.8 cm - Gewicht: 10.51 kg  Ohne Fu\u00df - Breite: 80.94 cm - Tiefe: 11.21 cm - H\u00f6he: 36.69 cm - Gewicht: 7.85 kg",
        "Diagonalabmessung": "86.36 cm (34\")",
        "Display-Typ": "LED-hintergrundbeleuchteter LCD-Monitor / TFT-Aktivmatrix",
        "EAN/UPC": "195122737191",
        "ENERGY STAR zertifiziert": "Ja",
        "Eingangsspannung": "Wechselstrom 120/230 V (50/60 Hz)",
        "Einstellungen der Anzeigeposition": "H\u00f6he, Neigung",
        "Energie Effizienzklasse": "Klasse G",
        "Enthaltene Kabel": "1 x HDMI-Kabel - 1.8 m  1 x DisplayPort-Kabel - 1.8 m  1 x Kabel USB-C auf USB-C - 1.8 m",
        "Farbe": "Schwarz",
        "Farbraum": "85% NTSC",
        "Farbtemperatur": "6500K",
        "Geschwungener Bildschirm": "Ja (1500R)",
        "Gewicht": "10.51 kg",
        "Gruppe": "TFTs",
        "Helligkeit": "250 cd/m\u00b2",
        "Hersteller": "HP",
        "Hersteller Art. Nr.": "21Y56AA#ABB",
        "Hintergrundbeleuchtungs-Technologie": "LED-Hintergrundbeleuchtung",
        "Horizontale Bildwiederholrate": "30 - 160 kHz",
        "Horizontaler Betrachtungswinkel": "178",
        "H\u00f6heneinstellung": "100 mm",
        "Integrierte Peripherieger\u00e4te": "USB 3.2 Gen 1 Hub",
        "Kennzeichnung": "TUV, VCCI, GS, NOM, WHQL, CB, CCC, FCC, ISO 9241-307, KCC, WEEE, cTUVus, KC, CEL, EPA, EAC, RCM, BIS, halogenarm, DisplayPort 1.2, ICE, KES",
        "Kontrast": "3500:1 / 50000000:1 (dynamisch)",
        "Lebensdauer der Beleuchtung": "30,000 Stunden",
        "Leistungsaufnahme im Ein-Zustand": "34 W",
        "Leistungsmerkmale": "Slot f\u00fcr Sicherheitsschloss (Kabelschloss getrennt erh\u00e4ltlich), abnehmbarer St\u00e4nder, Unterst\u00fctzung f\u00fcr VESA-Schnittstelle",
        "Lokalisierung": "Englisch / Europa",
        "Max. Betriebstemperatur": "35 \u00b0C",
        "Min Betriebstemperatur": "5 \u00b0C",
        "Mitgelieferte Software": "HP Display Center",
        "Montagekit": "Mitgeliefert",
        "Native Aufl\u00f6sung": "WQHD 3440 x 1440 bei 60 Hz",
        "Neigungswinkel": "-5/+21",
        "OSD-Sprachen": "Chinesisch (tradionell), Chinesisch (vereinfacht), Englisch, Deutsch, Franz\u00f6sisch, Italienisch, Portugiesisch, Spanisch, Holl\u00e4ndisch, Japanisch",
        "Pixelpitch": "0.23175 mm",
        "Ppi": "110",
        "Reaktionszeit": "5 ms (grau zu grau mit \u00dcbersteuerung)",
        "Schlosstyp zur Diebstahlsicherung": "Kensington Slot",
        "Schnittstellen": "HDMI (HDCP)  DisplayPort 1.2 (HDCP)  Audio Line-Out  USB-C Upstream/DisplayPort mit Spannungsversorgung (HDCP)  4 x USB 3.2 Gen 1  USB (Typ B)  KVM",
        "Seitenverh\u00e4ltnis": "21:9",
        "Service und Support": "Begrenzte Garantie - Arbeitszeit und Ersatzteile - 3 Jahre",
        "Stromverbrauch (typisch)": "48 Watt",
        "Stromverbrauch SDR (eingeschaltet)": "39 kWh/1.000 h",
        "Stromverbrauch im Standby-Modus": "0.5 Watt",
        "TCO-zertifiziert": "TCO Certified Displays 8, TCO Certified Edge Displays",
        "Transportbreite": "95 cm",
        "Transportgewicht": "16.7 kg",
        "Transporth\u00f6he": "48 cm",
        "Transporttiefe": "22.5 cm",
        "Typ": "Lautsprecher - Stereo",
        "VESA-Halterung": "100 x 100 mm",
        "Vertikale Bildwiederholrate": "48 - 100 Hz",
        "Vertikaler Betrachtungswinkel": "178",
        "Zul\u00e4ssige Luftfeuchtigkeit im Betrieb": "20 - 80% (nicht kondensierend)"
    },
    "raw_specifications_text": "Gruppe: TFTs\nHersteller: HP\nHersteller Art. Nr.: 21Y56AA#ABB\nEAN/UPC: 195122737191\nDisplay-Typ: LED-hintergrundbeleuchteter LCD-Monitor / TFT-Aktivmatrix\nDiagonalabmessung: 86.36 cm (34\")\nGeschwungener Bildschirm: Ja (1500R)\nEnergie Effizienzklasse: Klasse G\nIntegrierte Peripherieger\u00e4te: USB 3.2 Gen 1 Hub\nBildschirmtyp: VA\nSeitenverh\u00e4ltnis: 21:9\nNative Aufl\u00f6sung: WQHD 3440 x 1440 bei 60 Hz\nPixelpitch: 0.23175 mm\nPpi: 110\nHelligkeit: 250 cd/m\u00b2\nKontrast: 3500:1 / 50000000:1 (dynamisch)\nReaktionszeit: 5 ms (grau zu grau mit \u00dcbersteuerung)\nVertikale Bildwiederholrate: 48 - 100 Hz\nHorizontale Bildwiederholrate: 30 - 160 kHz\nHorizontaler Betrachtungswinkel: 178\nFarbraum: 85% NTSC\nVertikaler Betrachtungswinkel: 178\nBildschirmbeschichtung: Blendfrei, 3H Hard Coating, Haze 25 %\nHintergrundbeleuchtungs-Technologie: LED-Hintergrundbeleuchtung\nFarbtemperatur: 6500K\nOSD-Sprachen: Chinesisch (tradionell), Chinesisch (vereinfacht), Englisch, Deutsch, Franz\u00f6sisch, Italienisch, Portugiesisch, Spanisch, Holl\u00e4ndisch, Japanisch\nFarbe: Schwarz\nAbmessungen (Breite x Tiefe x H\u00f6he): 80.94 cm x 23.49 cm x 51.8 cm - mit Fu\u00df\nGewicht: 10.51 kg\nBesonderheiten: Low Blue Light Mode, flimmerfreie Technologie, ohne Quecksilber, arsenfrei, extrem schmale Blende an drei Seiten, 8-bit Farbtiefe, kantenbeleuchtete LED-Hintergrundbeleuchtung\nMin Betriebstemperatur: 5 \u00b0C\nMax. Betriebstemperatur: 35 \u00b0C\nZul\u00e4ssige Luftfeuchtigkeit im Betrieb: 20 - 80% (nicht kondensierend)\nLeistungsaufnahme im Ein-Zustand: 34 W\nEingangsspannung: Wechselstrom 120/230 V (50/60 Hz)\nStromverbrauch (typisch): 48 Watt\nStromverbrauch im Standby-Modus: 0.5 Watt\nStromverbrauch SDR (eingeschaltet): 39 kWh/1.000 h\nMitgelieferte Software: HP Display Center\nSchnittstellen: HDMI (HDCP)  DisplayPort 1.2 (HDCP)  Audio Line-Out  USB-C Upstream/DisplayPort mit Spannungsversorgung (HDCP)  4 x USB 3.2 Gen 1  USB (Typ B)  KVM\nTyp: Lautsprecher - Stereo\nAusgangsleistung/Kanal: 3 Watt\nEinstellungen der Anzeigeposition: H\u00f6he, Neigung\nNeigungswinkel: -5/+21\nH\u00f6heneinstellung: 100 mm\nVESA-Halterung: 100 x 100 mm\nLeistungsmerkmale: Slot f\u00fcr Sicherheitsschloss (Kabelschloss getrennt erh\u00e4ltlich), abnehmbarer St\u00e4nder, Unterst\u00fctzung f\u00fcr VESA-Schnittstelle\nEnthaltene Kabel: 1 x HDMI-Kabel - 1.8 m  1 x DisplayPort-Kabel - 1.8 m  1 x Kabel USB-C auf USB-C - 1.8 m\nMontagekit: Mitgeliefert\nLebensdauer der Beleuchtung: 30,000 Stunden\nKennzeichnung: TUV, VCCI, GS, NOM, WHQL, CB, CCC, FCC, ISO 9241-307, KCC, WEEE, cTUVus, KC, CEL, EPA, EAC, RCM, BIS, halogenarm, DisplayPort 1.2, ICE, KES\nLokalisierung: Englisch / Europa\nSchlosstyp zur Diebstahlsicherung: Kensington Slot\nDetails zu Abmessungen & Gewicht: Mit Fu\u00df - Breite: 80.94 cm - Tiefe: 23.49 cm - H\u00f6he: 51.8 cm - Gewicht: 10.51 kg  Ohne Fu\u00df - Breite: 80.94 cm - Tiefe: 11.21 cm - H\u00f6he: 36.69 cm - Gewicht: 7.85 kg\nTransportbreite: 95 cm\nTransporttiefe: 22.5 cm\nTransporth\u00f6he: 48 cm\nTransportgewicht: 16.7 kg\nTCO-zertifiziert: TCO Certified Displays 8, TCO Certified Edge Displays\nENERGY STAR zertifiziert: Ja\nService und Support: Begrenzte Garantie - Arbeitszeit und Ersatzteile - 3 Jahre",
    "reference_file": "offer_reference_1576.json",
    "shop_name": "1ashop.at"
}