{
    "html_file": "offer_660_4.html",
    "name": "Lenovo G34w-30, 34\"",
    "offer_link": "https://www.proshop.at/Bildschirm/Lenovo-34-Bildschirm-G34w-30-LED-monitor-curved-34-Black-1-ms-AMD-FreeSync-Premium/3150080?utm_source=geizhals&utm_medium=cpc&utm_campaign=pricesite",
    "price": 391.33,
    "raw_specifications": {
        "Abmessungen (Breite x Tiefe x H\u00f6he)": "80.93 cm x 27.87 cm x 55.65 cm - mit Standfu\u00df (h\u00f6chste Position)",
        "Abmessungen (Breite x Tiefe x H\u00f6he) - mit Standfu\u00df (h\u00f6chste Position)": "80.93 cm x 27.87 cm x 55.65 cm",
        "Adaptive-Sync Technologie": "AMD FreeSync Premium",
        "Ausgangsleistung/Kanal": "3 Watt",
        "Besonderheiten": "Integrierte Kabelf\u00fchrung, HDR10-kompatibel, 8-bit Farbtiefe, Natural Low Blue Light Technology, Modularer Kamera-Support",
        "Bildschirmbeschichtung": "Blendfrei",
        "Bildschirmtyp": "VA",
        "Details zu Abmessungen & Gewicht": "Mit Standfu\u00df (niedrigste Position) - Breite: 80.93 cm - Tiefe: 27.87 cm - H\u00f6he: 42.15 cm - Gewicht: 8.6 kg  Mit Standfu\u00df (h\u00f6chste Position) - Breite: 80.93 cm - Tiefe: 27.87 cm - H\u00f6he: 55.65 cm - Gewicht: 8.6 kg",
        "Diagonalabmessung": "86.4 cm (34\")",
        "Display-Typ": "LED-hintergrundbeleuchteter LCD-Monitor / TFT-Aktivmatrix",
        "EAN": "0196379133163",
        "Eingangsanschl\u00fcsse": "2xHDMI, DisplayPort",
        "Eingangsspannung": "Wechselstrom 100-240 V (50/60 Hz)",
        "Einstellungen der Anzeigeposition": "H\u00f6he, Neigung",
        "Energierverbrauch Sleep": "0.3 Watt",
        "Enthaltene Kabel": "1 x DisplayPort-Kabel - 1.8 m  1 x Stromkabel - 1.8 m",
        "Erforderliches Betriebssystem": "Windows 10, Windows 11",
        "Farbe": "Rave schwarz",
        "Farbraum": "93 % DCI-P3 (CIE1976), 124% sRGB (CIE 1931), 99% sRGB",
        "Farbunterst\u00fctzung": "16,7 Millionen Farben",
        "Ger\u00e4tetyp": "LED-hintergrundbeleuchteter LCD-Monitor - 86.4 cm (34\")",
        "Geschwungener Bildschirm": "Ja (1500R)",
        "Gewicht": "8.6 kg",
        "Helligkeit": "350 cd/m\u00b2",
        "Hersteller": "Lenovo",
        "Hintergrundbeleuchtungs-Technologie": "WLED",
        "Horizontaler Betrachtungswinkel": "178",
        "H\u00f6heneinstellung": "135 mm",
        "Kennzeichnung": "CCC, RoHS 2011/65/EU, China Energy standard Tier 2, TUV Rheinland Eye Comfort Certification, TUV Rheinland Eyesafe Display, TUV Rheinland Low Blue Light (Hardware Solution)",
        "Kontrast": "2500:1 / 3000000:1 (dynamisch)",
        "Leistungsmerkmale": "Slot f\u00fcr Sicherheitsschloss (Kabelschloss getrennt erh\u00e4ltlich)",
        "Lokalisierung": "Englisch / Europa",
        "Mitgelieferte Software": "Lenovo Artery, Lenovo Display Control Center",
        "Modell": "66F1GAC1EU",
        "Native Aufl\u00f6sung": "UWQHD 3440 x 1440 bei 165 Hz",
        "Neigungswinkel": "-5/+22",
        "Pixelpitch": "0.232 mm",
        "Ppi": "110",
        "Produktbeschreibung": "Lenovo G34w-30 - LED-Monitor - gebogen - 86.4 cm (34\")",
        "Reaktionszeit": "0.5 ms (MPRT), 1 ms (Level 4), 2 ms (Level 3), 3 ms (Level 2), 4 ms (Level 1), 5 ms (aus)",
        "Schlosstyp zur Diebstahlsicherung": "Kensington Slot",
        "Schnittstellen": "DisplayPort 1.4  2 x HDMI  Audio Line-Out",
        "Seitenverh\u00e4ltnis": "21:9",
        "Spannung": "Wechselstrom 100-240 V (50/60 Hz)",
        "Stromverbrauch (Aus-Modus)": "0.5 Watt",
        "Stromverbrauch (max.)": "60 Watt",
        "Stromverbrauch (typisch)": "40 Watt",
        "Transportbreite": "107 cm",
        "Transportgewicht": "12.5 kg",
        "Transporth\u00f6he": "52.5 cm",
        "Transporttiefe": "18.7 cm",
        "Typ": "Lautsprecher - Stereo",
        "VESA-Halterung": "100 x 100 mm",
        "Vertikaler Betrachtungswinkel": "178",
        "Waren-Nr.": "3150080",
        "Zubeh\u00f6r im Lieferumfang": "4 Schrauben",
        "Zum Hersteller": "lenovo.com"
    },
    "raw_specifications_text": "Hersteller: Lenovo\nWaren-Nr.: 3150080\nModell: 66F1GAC1EU\nEAN: 0196379133163\nZum Hersteller: lenovo.com\nProduktbeschreibung: Lenovo G34w-30 - LED-Monitor - gebogen - 86.4 cm (34\")\nGer\u00e4tetyp: LED-hintergrundbeleuchteter LCD-Monitor - 86.4 cm (34\")\nGeschwungener Bildschirm: Ja (1500R)\nAdaptive-Sync Technologie: AMD FreeSync Premium\nBildschirmtyp: VA\nSeitenverh\u00e4ltnis: 21:9\nNative Aufl\u00f6sung: UWQHD 3440 x 1440 bei 165 Hz\nPixelpitch: 0.232 mm\nHelligkeit: 350 cd/m\u00b2\nKontrast: 2500:1 / 3000000:1 (dynamisch)\nReaktionszeit: 0.5 ms (MPRT), 1 ms (Level 4), 2 ms (Level 3), 3 ms (Level 2), 4 ms (Level 1), 5 ms (aus)\nFarbunterst\u00fctzung: 16,7 Millionen Farben\nFarbraum: 93 % DCI-P3 (CIE1976), 124% sRGB (CIE 1931), 99% sRGB\nEingangsanschl\u00fcsse: 2xHDMI, DisplayPort\nEinstellungen der Anzeigeposition: H\u00f6he, Neigung\nBildschirmbeschichtung: Blendfrei\nSpannung: Wechselstrom 100-240 V (50/60 Hz)\nFarbe: Rave schwarz\nAbmessungen (Breite x Tiefe x H\u00f6he) - mit Standfu\u00df (h\u00f6chste Position): 80.93 cm x 27.87 cm x 55.65 cm\nGewicht: 8.6 kg\nLokalisierung: Englisch / Europa\nKennzeichnung: CCC, RoHS 2011/65/EU, China Energy standard Tier 2, TUV Rheinland Eye Comfort Certification, TUV Rheinland Eyesafe Display, TUV Rheinland Low Blue Light (Hardware Solution)\nDisplay-Typ: LED-hintergrundbeleuchteter LCD-Monitor / TFT-Aktivmatrix\nDiagonalabmessung: 86.4 cm (34\")\nPpi: 110\nHorizontaler Betrachtungswinkel: 178\nVertikaler Betrachtungswinkel: 178\nHintergrundbeleuchtungs-Technologie: WLED\nBesonderheiten: Integrierte Kabelf\u00fchrung, HDR10-kompatibel, 8-bit Farbtiefe, Natural Low Blue Light Technology, Modularer Kamera-Support\nAbmessungen (Breite x Tiefe x H\u00f6he): 80.93 cm x 27.87 cm x 55.65 cm - mit Standfu\u00df (h\u00f6chste Position)\nTyp: Lautsprecher - Stereo\nAusgangsleistung/Kanal: 3 Watt\nSchnittstellen: DisplayPort 1.4  2 x HDMI  Audio Line-Out\nNeigungswinkel: -5/+22\nH\u00f6heneinstellung: 135 mm\nVESA-Halterung: 100 x 100 mm\nLeistungsmerkmale: Slot f\u00fcr Sicherheitsschloss (Kabelschloss getrennt erh\u00e4ltlich)\nZubeh\u00f6r im Lieferumfang: 4 Schrauben\nEnthaltene Kabel: 1 x DisplayPort-Kabel - 1.8 m  1 x Stromkabel - 1.8 m\nSchlosstyp zur Diebstahlsicherung: Kensington Slot\nEingangsspannung: Wechselstrom 100-240 V (50/60 Hz)\nStromverbrauch (typisch): 40 Watt\nStromverbrauch (max.): 60 Watt\nEnergierverbrauch Sleep: 0.3 Watt\nStromverbrauch (Aus-Modus): 0.5 Watt\nMitgelieferte Software: Lenovo Artery, Lenovo Display Control Center\nErforderliches Betriebssystem: Windows 10, Windows 11\nDetails zu Abmessungen & Gewicht: Mit Standfu\u00df (niedrigste Position) - Breite: 80.93 cm - Tiefe: 27.87 cm - H\u00f6he: 42.15 cm - Gewicht: 8.6 kg  Mit Standfu\u00df (h\u00f6chste Position) - Breite: 80.93 cm - Tiefe: 27.87 cm - H\u00f6he: 55.65 cm - Gewicht: 8.6 kg\nTransportbreite: 107 cm\nTransporttiefe: 18.7 cm\nTransporth\u00f6he: 52.5 cm\nTransportgewicht: 12.5 kg",
    "reference_file": "offer_reference_660.json",
    "shop_name": "Proshop.at"
}