{
    "html_file": "offer_493_1.html",
    "name": "HP V22i G5, 21.5\"",
    "offer_link": "https://www.alternate.at/HP/V22i-G5-LED-Monitor/html/product/1868353?partner=AtGeizhalsat&campaign=Monitor/HP/1868353",
    "price": 122.9,
    "raw_specifications": {
        "": "AMD FreeSync",
        "Abmessungen": "Breite: 48,84 cm x H\u00f6he: 37,82 cm x Tiefe/L\u00e4nge: 18,05 cm",
        "Anschl\u00fcsse": "1x HDMI-Eingang, (HDMI-Version: 1.4), 1x DisplayPort-Eingang, (DisplayPort-Version: 1.2), 1x VGA-Eingang",
        "Bild": "Glaretyp",
        "Bildschirmaufl\u00f6sung": "1.920 x 1.080 Pixel",
        "Bildschirmdiagonale": "55 cm (22 Zoll)",
        "EAN": "0196548760237",
        "Energieeffizienzklasse (SDR)": "E (A - G)",
        "Energieverbauch pro 1000 Stunden (SDR)": "14 kWh",
        "Ergonomie": "Neigbar",
        "Farbe": "schwarz",
        "Features": "Low Blue Light-Modus",
        "Gewicht": "3,1 kg",
        "Hersteller-Nr.": "6D8G8E9#ABB",
        "Leistungsaufnahme im Bereitschafts- und Aus-Zustand": "0,5 Watt",
        "Leistungsaufnahme im Ein-Zustand bei Standard-Dynamikumfang (SDR)": "14 Watt",
        "Stromversorgung": "Eco-Off",
        "Typ": "LED-Monitor",
        "Wandhalterung": "VESA kompatibel (100 x 100 mm)"
    },
    "raw_specifications_text": "Energieeffizienzklasse (SDR): E (A - G)\nEnergieverbauch pro 1000 Stunden (SDR): 14 kWh\nLeistungsaufnahme im Ein-Zustand bei Standard-Dynamikumfang (SDR): 14 Watt\nLeistungsaufnahme im Bereitschafts- und Aus-Zustand: 0,5 Watt\nBildschirmdiagonale: 55 cm (22 Zoll)\nBildschirmaufl\u00f6sung: 1.920 x 1.080 Pixel\nTyp: LED-Monitor\nFarbe: schwarz\nEAN: 0196548760237\nHersteller-Nr.: 6D8G8E9#ABB\nBild: Glaretyp\n: AMD FreeSync\nAnschl\u00fcsse: 1x HDMI-Eingang, (HDMI-Version: 1.4), 1x DisplayPort-Eingang, (DisplayPort-Version: 1.2), 1x VGA-Eingang\nErgonomie: Neigbar\nStromversorgung: Eco-Off\nWandhalterung: VESA kompatibel (100 x 100 mm)\nFeatures: Low Blue Light-Modus\nAbmessungen: Breite: 48,84 cm x H\u00f6he: 37,82 cm x Tiefe/L\u00e4nge: 18,05 cm\nGewicht: 3,1 kg",
    "reference_file": "offer_reference_493.json",
    "shop_name": "Alternate.at"
}