{
    "html_file": "offer_561_3.html",
    "name": "LG UltraGear OLED 45GR95QE-B, 44.5\"",
    "offer_link": "https://www.mylemon.at/artikel/lg/45gr95qe_b/ultragear-oled-45gr95qe-113-03.html",
    "price": 1298.99,
    "raw_specifications": {
        "AMD FreeSync": "Ja",
        "AMD FreeSync-Typ": "FreeSync Premium",
        "Abnehmbarer Standfu\u00df": "Ja",
        "Anzahl DisplayPort Anschl\u00fcsse": "1",
        "Anzahl HDMI-Anschl\u00fcsse": "2",
        "Anzahl der nachgeschalteten Steckpl\u00e4tze vom Typ USB-A": "2",
        "Anzahl der vorgeschalteten Steckpl\u00e4tze": "1",
        "Artikelnummer": "M1IYW86L",
        "Aufl\u00f6sung": "3440x1440",
        "Besonderheiten": "240 Hz, USB HUB",
        "Bewertung der Bildschirmkr\u00fcmmung": "800R",
        "Bildschirmdiagonale": "113 cm (44.5\")",
        "Bildschirmform": "Gebogen",
        "Bildschirmtechnologie": "OLED",
        "Bildwinkel, horizontal": "178\u00b0",
        "Bildwinkel, vertikal": "178\u00b0",
        "Blendfreier Bildschirm": "Ja",
        "Breite (ohne Standfu\u00df)": "992,7 mm",
        "Display-Aufl\u00f6sung": "3440 x 1440 Pixel",
        "Displaygr\u00f6\u00dfe": "44,5 Zoll",
        "EAN": "8806098787081",
        "Eingebaute Audio-Decoder": "DTS:X",
        "Eingebaute Lautsprecher": "Nein",
        "Energieeffizienzklasse (HDR)": "F",
        "Energieeffizienzklasse (SDR)": "E",
        "Energieeffizienzskala": "A bis G",
        "Energieverbrauch (HDR) pro 1.000 Stunden": "41 kWh",
        "Energieverbrauch (SDR) pro 1.000 Stunden": "39 kWh",
        "Ergonomie": "H\u00f6henverstellbar, Neigbar",
        "FPS-Z\u00e4hler": "Ja",
        "Farbskala": "98,5%",
        "Fernbedienung enthalten": "Ja",
        "Ger\u00e4tebreite (inkl. Fu\u00df)": "992,7 mm",
        "Ger\u00e4teh\u00f6he (inkl. Fu\u00df)": "647,7 mm",
        "Ger\u00e4tetiefe (inkl. Fu\u00df)": "362,5 mm",
        "Gewicht (mit St\u00e4nder)": "10,9 kg",
        "Gewicht (ohne St\u00e4nder)": "8,6 kg",
        "HD-Typ": "Wide Quad HD",
        "HDMI": "Ja",
        "HDMI-Version": "2.1",
        "Helligkeit": "200 cd/m\u00b2",
        "Helligkeit (peak)": "1000 cd/m\u00b2",
        "Helligkeit (typisch)": "200 cd/m\u00b2",
        "Hersteller Artikelnummer": "45GR95QE-B",
        "High Dynamic Range Video (HDR) Unterst\u00fctzung": "Ja",
        "H\u00f6he (ohne Standfu\u00df)": "457 mm",
        "H\u00f6heneinstellung": "11 cm",
        "H\u00f6henverstellung": "Ja",
        "Integrierte Kamera": "Nein",
        "Integrierter USB-Hub": "Nein",
        "Kontrastverh\u00e4ltnis": "1500000:1",
        "Kopfh\u00f6rerausgang": "Ja",
        "Markenspezifische Technologien": "Crosshair, DAS Mode",
        "Marktpositionierung": "Gaming",
        "Maximale Bildwiederholrate": "240 Hz",
        "Mikrofon-Eingang": "Ja",
        "Mitgelieferte Kabel": "DisplayPort, HDMI, Leistung, USB Typ-A auf USB Typ-B",
        "NVIDIA G-SYNC": "Ja",
        "NVIDIA G-SYNC-Typ": "G-SYNC Compatible",
        "Natives Seitenverh\u00e4ltnis": "21:9",
        "Neigungsverstellung": "Ja",
        "Neigungswinkelbereich": "-5 - 15\u00b0",
        "Paketgewicht": "16 kg",
        "Panel": "OLED",
        "Panel-Montage-Schnittstelle": "100 x 100 mm",
        "Produktfarbe": "Schwarz",
        "RGB-Farbraum": "DCI-P3",
        "Rahmenloses Design": "Ja",
        "Reaktionszeit": "0,03 ms",
        "Schwenkbar": "Ja",
        "Schwenkwinkelbereich": "-10 - 10\u00b0",
        "Stromadapter enthalten": "Ja",
        "Stromverbrauch (Standardbetrieb)": "129 W",
        "St\u00e4nder enthalten": "Ja",
        "Technologie mit hohem Dynamikbereich (HDR)": "High Dynamic Range 10 (HDR10)",
        "Tiefe (ohne Standfu\u00df)": "218 mm",
        "Touchscreen": "Nein",
        "Typ der Hintergrundbeleuchtung": "RGB-LED",
        "VESA Halterung": "100x100 mm",
        "VESA-Halterung": "Ja",
        "Verpackungsbreite": "1100 mm",
        "Verpackungsh\u00f6he": "317 mm",
        "Verpackungstiefe": "550 mm",
        "Video Anschl\u00fcsse": "2x HDMI, 1x DisplayPort",
        "Wandmontage": "Ja"
    },
    "raw_specifications_text": "Displaygr\u00f6\u00dfe: 44,5 Zoll\nAufl\u00f6sung: 3440x1440\nPanel: OLED\nReaktionszeit: 0,03 ms\nVideo Anschl\u00fcsse: 2x HDMI, 1x DisplayPort\nErgonomie: H\u00f6henverstellbar, Neigbar\nVESA Halterung: 100x100 mm\nHelligkeit: 200 cd/m\u00b2\nBesonderheiten: 240 Hz, USB HUB\nHersteller Artikelnummer: 45GR95QE-B\nEAN: 8806098787081\nArtikelnummer: M1IYW86L\nBildschirmdiagonale: 113 cm (44.5\")\nDisplay-Aufl\u00f6sung: 3440 x 1440 Pixel\nNatives Seitenverh\u00e4ltnis: 21:9\nBildschirmtechnologie: OLED\nTouchscreen: Nein\nHD-Typ: Wide Quad HD\nBildschirmform: Gebogen\nKontrastverh\u00e4ltnis: 1500000:1\nMaximale Bildwiederholrate: 240 Hz\nTyp der Hintergrundbeleuchtung: RGB-LED\nHelligkeit (peak): 1000 cd/m\u00b2\nHelligkeit (typisch): 200 cd/m\u00b2\nBlendfreier Bildschirm: Ja\nBewertung der Bildschirmkr\u00fcmmung: 800R\nBildwinkel, horizontal: 178\u00b0\nBildwinkel, vertikal: 178\u00b0\nHigh Dynamic Range Video (HDR) Unterst\u00fctzung: Ja\nTechnologie mit hohem Dynamikbereich (HDR): High Dynamic Range 10 (HDR10)\nRGB-Farbraum: DCI-P3\nFarbskala: 98,5%\nNVIDIA G-SYNC: Ja\nAMD FreeSync: Ja\nNVIDIA G-SYNC-Typ: G-SYNC Compatible\nAMD FreeSync-Typ: FreeSync Premium\nMarkenspezifische Technologien: Crosshair, DAS Mode\nFPS-Z\u00e4hler: Ja\nEingebaute Lautsprecher: Nein\nIntegrierte Kamera: Nein\nEingebaute Audio-Decoder: DTS:X\nMarktpositionierung: Gaming\nProduktfarbe: Schwarz\nRahmenloses Design: Ja\nAbnehmbarer Standfu\u00df: Ja\nIntegrierter USB-Hub: Nein\nHDMI: Ja\nKopfh\u00f6rerausgang: Ja\nAnzahl der vorgeschalteten Steckpl\u00e4tze: 1\nAnzahl der nachgeschalteten Steckpl\u00e4tze vom Typ USB-A: 2\nAnzahl HDMI-Anschl\u00fcsse: 2\nHDMI-Version: 2.1\nAnzahl DisplayPort Anschl\u00fcsse: 1\nMikrofon-Eingang: Ja\nVESA-Halterung: Ja\nH\u00f6henverstellung: Ja\nPanel-Montage-Schnittstelle: 100 x 100 mm\nWandmontage: Ja\nH\u00f6heneinstellung: 11 cm\nSchwenkbar: Ja\nSchwenkwinkelbereich: -10 - 10\u00b0\nNeigungswinkelbereich: -5 - 15\u00b0\nNeigungsverstellung: Ja\nEnergieeffizienzklasse (SDR): E\nEnergieeffizienzklasse (HDR): F\nEnergieverbrauch (SDR) pro 1.000 Stunden: 39 kWh\nEnergieverbrauch (HDR) pro 1.000 Stunden: 41 kWh\nStromverbrauch (Standardbetrieb): 129 W\nEnergieeffizienzskala: A bis G\nSt\u00e4nder enthalten: Ja\nMitgelieferte Kabel: DisplayPort, HDMI, Leistung, USB Typ-A auf USB Typ-B\nStromadapter enthalten: Ja\nFernbedienung enthalten: Ja\nGer\u00e4tebreite (inkl. Fu\u00df): 992,7 mm\nGer\u00e4tetiefe (inkl. Fu\u00df): 362,5 mm\nGer\u00e4teh\u00f6he (inkl. Fu\u00df): 647,7 mm\nGewicht (mit St\u00e4nder): 10,9 kg\nBreite (ohne Standfu\u00df): 992,7 mm\nTiefe (ohne Standfu\u00df): 218 mm\nH\u00f6he (ohne Standfu\u00df): 457 mm\nGewicht (ohne St\u00e4nder): 8,6 kg\nVerpackungsbreite: 1100 mm\nVerpackungstiefe: 550 mm\nVerpackungsh\u00f6he: 317 mm\nPaketgewicht: 16 kg",
    "reference_file": "offer_reference_561.json",
    "shop_name": "mylemon.at"
}