{
    "html_file": "offer_2110_0.html",
    "name": "BenQ BL2483T, 24\"",
    "offer_link": "https://www.proshop.at/Bildschirm/BenQ-24-Bildschirm-BL2483T-Black-1-ms/2807192?utm_source=geizhals&utm_medium=cpc&utm_campaign=pricesite",
    "price": 199.26,
    "raw_specifications": {
        "Abmessungen (Breite x Tiefe x H\u00f6he)": "56.5 cm x 23.7 cm x 53.4 cm - mit Fu\u00df",
        "Abmessungen (Breite x Tiefe x H\u00f6he) - mit Fu\u00df": "56.5 cm x 23.7 cm x 53.4 cm",
        "Ausgangsleistung/Kanal": "1 Watt",
        "Besonderheiten": "Low Blue Light Mode, flimmerfreie Technologie, ecoFACTS Label, Color Weakness Mode, Bright Intelligence (B.I.), sRGB Mode, Eye-Care Technology, Low Blue Light-Technologie, Photo Mode, ePaper-Modus, 72 % NTSC Farbraum",
        "Bildschirmbeschichtung": "Blendfrei",
        "Bildschirmtyp": "TN",
        "Details zu Abmessungen & Gewicht": "Ohne Fu\u00df - Breite: 56.5 cm - Tiefe: 5.1 cm - H\u00f6he: 33.8 cm - Gewicht: 3 kg  Mit Standfu\u00df (niedrigste Position) - Breite: 56.5 cm - Tiefe: 23.815 cm - H\u00f6he: 43 cm - Gewicht: 5.6 kg",
        "Diagonalabmessung": "61 cm (24\")",
        "Display-Typ": "LED-hintergrundbeleuchteter LCD-Monitor / TFT-Aktivmatrix",
        "EAN": "4718755079238",
        "ENERGY STAR zertifiziert": "Ja",
        "Eingangsanschl\u00fcsse": "DVI-D, VGA, DisplayPort",
        "Eingangsspannung": "AC 100 - 240 V",
        "Einstellungen der Anzeigeposition": "H\u00f6he, Pivot (Rotation), Drehung, Neigung",
        "Energie Effizienzklasse": "Klasse E",
        "Energierverbrauch Sleep": "0.5 Watt",
        "Energieverbrauch pro Jahr": "23 kWh",
        "Enthaltene Kabel": "DisplayPort-Kabel  Stromkabel - 1.5 m",
        "Erforderliches Betriebssystem": "Microsoft Windows 7 / 8 / 8.1 / 10",
        "Farbe": "Schwarz",
        "Farbraum": "72% NTSC",
        "Farbtemperatur": "9300K, 6500K, 5700K",
        "Farbunterst\u00fctzung": "16,7 Millionen Farben",
        "Ger\u00e4tetyp": "LED-hintergrundbeleuchteter LCD-Monitor - 61 cm (24\")",
        "Gewicht": "5.5 kg",
        "Helligkeit": "250 cd/m\u00b2",
        "Hersteller": "BenQ",
        "Hintergrundbeleuchtungs-Technologie": "LED-Hintergrundbeleuchtung",
        "Horizontale Bildwiederholrate": "30 - 83 kHz",
        "Horizontaler Betrachtungswinkel": "170",
        "H\u00f6heneinstellung": "140 mm",
        "Kennzeichnung": "TUV Rheinland, DisplayPort 1.2, HDCP 1.4",
        "Kontrast": "1000:1 / 12000000:1 (dynamisch)",
        "Lebensdauer der Beleuchtung": "30,000 Stunden",
        "Leistungsaufnahme im Ein-Zustand": "17.8 W",
        "Leistungsmerkmale": "Slot f\u00fcr Sicherheitsschloss (Kabelschloss getrennt erh\u00e4ltlich)",
        "MTBF": "60,000 Stunde(n)",
        "Modell": "9H.LHYLB.QBE",
        "Native Aufl\u00f6sung": "Full HD (1080p) 1920 x 1080",
        "Neigungswinkel": "-5/+35",
        "OSD-Sprachen": "Ungarisch, Tschechisch, Chinesisch (vereinfacht), Englisch, Deutsch, Franz\u00f6sisch, Italienisch, Portugiesisch, Polnisch, Schwedisch, Russisch, Spanisch, Holl\u00e4ndisch, Arabisch, Rum\u00e4nisch, Japanisch, Chinesisch, Koreanisch",
        "Pixelpitch": "0.276 mm",
        "Ppi": "92",
        "Produktbeschreibung": "BenQ BL2483TM - Business - LED-Monitor - Full HD (1080p) - 61 cm (24\")",
        "Reaktionszeit": "1 ms (Gray-to-Gray)",
        "Rotationswinkel": "90",
        "Schlosstyp zur Diebstahlsicherung": "Kensington Slot",
        "Schnittstellen": "VGA  DisplayPort 1.2  DVI-D  Kopfh\u00f6rer  Audio Line-In",
        "Schwenkwinkel": "350",
        "Seitenverh\u00e4ltnis": "16:9",
        "Spannung": "AC 100 - 240 V",
        "Stromverbrauch (typisch)": "25 Watt",
        "Stromverbrauch SDR (eingeschaltet)": "17.8 kWh/1.000 h",
        "Stromverbrauch im Standby-Modus": "0.5 Watt",
        "TCO-zertifiziert": "TCO Certified Displays 8",
        "Transportgewicht": "7.6 kg",
        "Typ": "Lautsprecher - Stereo",
        "Umweltschutzstandards": "TCO Certified Displays 8, ENERGY STAR-qualifiziert",
        "VESA-Halterung": "100 x 100 mm",
        "Vertikale Bildwiederholrate": "50 - 76 Hz",
        "Vertikaler Betrachtungswinkel": "160",
        "Waren-Nr.": "2807192",
        "Zum Hersteller": "benq.com"
    },
    "raw_specifications_text": "Hersteller: BenQ\nWaren-Nr.: 2807192\nModell: 9H.LHYLB.QBE\nEAN: 4718755079238\nZum Hersteller: benq.com\nProduktbeschreibung: BenQ BL2483TM - Business - LED-Monitor - Full HD (1080p) - 61 cm (24\")\nGer\u00e4tetyp: LED-hintergrundbeleuchteter LCD-Monitor - 61 cm (24\")\nEnergie Effizienzklasse: Klasse E\nEnergieverbrauch pro Jahr: 23 kWh\nLeistungsaufnahme im Ein-Zustand: 17.8 W\nBildschirmtyp: TN\nSeitenverh\u00e4ltnis: 16:9\nNative Aufl\u00f6sung: Full HD (1080p) 1920 x 1080\nPixelpitch: 0.276 mm\nHelligkeit: 250 cd/m\u00b2\nKontrast: 1000:1 / 12000000:1 (dynamisch)\nReaktionszeit: 1 ms (Gray-to-Gray)\nFarbunterst\u00fctzung: 16,7 Millionen Farben\nFarbraum: 72% NTSC\nEingangsanschl\u00fcsse: DVI-D, VGA, DisplayPort\nEinstellungen der Anzeigeposition: H\u00f6he, Pivot (Rotation), Drehung, Neigung\nBildschirmbeschichtung: Blendfrei\nSpannung: AC 100 - 240 V\nFarbe: Schwarz\nAbmessungen (Breite x Tiefe x H\u00f6he) - mit Fu\u00df: 56.5 cm x 23.7 cm x 53.4 cm\nGewicht: 5.5 kg\nUmweltschutzstandards: TCO Certified Displays 8, ENERGY STAR-qualifiziert\nKennzeichnung: TUV Rheinland, DisplayPort 1.2, HDCP 1.4\nDisplay-Typ: LED-hintergrundbeleuchteter LCD-Monitor / TFT-Aktivmatrix\nDiagonalabmessung: 61 cm (24\")\nPpi: 92\nVertikale Bildwiederholrate: 50 - 76 Hz\nHorizontale Bildwiederholrate: 30 - 83 kHz\nHorizontaler Betrachtungswinkel: 170\nVertikaler Betrachtungswinkel: 160\nHintergrundbeleuchtungs-Technologie: LED-Hintergrundbeleuchtung\nFarbtemperatur: 9300K, 6500K, 5700K\nOSD-Sprachen: Ungarisch, Tschechisch, Chinesisch (vereinfacht), Englisch, Deutsch, Franz\u00f6sisch, Italienisch, Portugiesisch, Polnisch, Schwedisch, Russisch, Spanisch, Holl\u00e4ndisch, Arabisch, Rum\u00e4nisch, Japanisch, Chinesisch, Koreanisch\nBesonderheiten: Low Blue Light Mode, flimmerfreie Technologie, ecoFACTS Label, Color Weakness Mode, Bright Intelligence (B.I.), sRGB Mode, Eye-Care Technology, Low Blue Light-Technologie, Photo Mode, ePaper-Modus, 72 % NTSC Farbraum\nAbmessungen (Breite x Tiefe x H\u00f6he): 56.5 cm x 23.7 cm x 53.4 cm - mit Fu\u00df\nTyp: Lautsprecher - Stereo\nAusgangsleistung/Kanal: 1 Watt\nSchnittstellen: VGA  DisplayPort 1.2  DVI-D  Kopfh\u00f6rer  Audio Line-In\nNeigungswinkel: -5/+35\nSchwenkwinkel: 350\nRotationswinkel: 90\nH\u00f6heneinstellung: 140 mm\nVESA-Halterung: 100 x 100 mm\nLeistungsmerkmale: Slot f\u00fcr Sicherheitsschloss (Kabelschloss getrennt erh\u00e4ltlich)\nEnthaltene Kabel: DisplayPort-Kabel  Stromkabel - 1.5 m\nLebensdauer der Beleuchtung: 30,000 Stunden\nMTBF: 60,000 Stunde(n)\nSchlosstyp zur Diebstahlsicherung: Kensington Slot\nEingangsspannung: AC 100 - 240 V\nStromverbrauch SDR (eingeschaltet): 17.8 kWh/1.000 h\nStromverbrauch (typisch): 25 Watt\nStromverbrauch im Standby-Modus: 0.5 Watt\nEnergierverbrauch Sleep: 0.5 Watt\nErforderliches Betriebssystem: Microsoft Windows 7 / 8 / 8.1 / 10\nDetails zu Abmessungen & Gewicht: Ohne Fu\u00df - Breite: 56.5 cm - Tiefe: 5.1 cm - H\u00f6he: 33.8 cm - Gewicht: 3 kg  Mit Standfu\u00df (niedrigste Position) - Breite: 56.5 cm - Tiefe: 23.815 cm - H\u00f6he: 43 cm - Gewicht: 5.6 kg\nTransportgewicht: 7.6 kg\nTCO-zertifiziert: TCO Certified Displays 8\nENERGY STAR zertifiziert: Ja",
    "reference_file": "offer_reference_2110.json",
    "shop_name": "Proshop.at"
}