{
    "html_file": "offer_1291_6.html",
    "name": "ViewSonic VX2468-PC-MHD, 23.6\"",
    "offer_link": "https://www.mylemon.at/artikel/viewsonic/vx2468_pc_mhd/vx2468-pc-mhd-60-96.html",
    "price": 217.18,
    "raw_specifications": {
        "AC Eingangsfrequenz": "50/60 Hz",
        "AC Eingangsspannung": "100 - 240 V",
        "AMD FreeSync": "Ja",
        "AMD FreeSync-Typ": "FreeSync Premium",
        "Anzahl DisplayPort Anschl\u00fcsse": "1",
        "Anzahl HDMI-Anschl\u00fcsse": "2",
        "Anzahl der Farben des Displays": "16,7 Millionen Farben",
        "Anzahl der Lautsprecher": "2",
        "Artikelnummer": "M16YMBYL",
        "Audioausgang": "Ja",
        "Aufl\u00f6sung": "1920x1080",
        "Besonderheiten": "AMD FreeSync, Curved",
        "Betriebstemperatur": "0 - 40 \u00b0C",
        "Bewertung der Bildschirmkr\u00fcmmung": "1500R",
        "Bildschirmdiagonale": "61 cm (24 Zoll)",
        "Bildschirmform": "Gebogen",
        "Bildschirmtechnologie": "LED",
        "Bildwinkel, horizontal": "178\u00b0",
        "Bildwinkel, vertikal": "178\u00b0",
        "Breite (ohne Standfu\u00df)": "53,6 cm",
        "Digital horizontale Frequenz": "30 - 184 kHz",
        "Digital vertikale Frequenz": "48 - 165 Hz",
        "Display-Aufl\u00f6sung": "1920 x 1080 Pixel",
        "Displaygr\u00f6\u00dfe": "23,6 Zoll",
        "EAN": "0766907011968",
        "Eingebaute Lautsprecher": "Ja",
        "Ergonomie": "Neigbar",
        "Ger\u00e4tebreite (inkl. Fu\u00df)": "536 mm",
        "Ger\u00e4teh\u00f6he (inkl. Fu\u00df)": "408 mm",
        "Ger\u00e4tetiefe (inkl. Fu\u00df)": "188 mm",
        "Gewicht (mit St\u00e4nder)": "4 kg",
        "Gewicht (ohne St\u00e4nder)": "3,4 kg",
        "HD-Typ": "Full HD",
        "HDMI": "Ja",
        "HDMI-Version": "2.0",
        "Helligkeit": "250 cd/m\u00b2",
        "Helligkeit (typisch)": "250 cd/m\u00b2",
        "Hersteller Artikelnummer": "VX2468-PC-MHD",
        "H\u00f6he (ohne Standfu\u00df)": "32,3 cm",
        "Kabelsperre-Slot": "Ja",
        "Kontrastverh\u00e4ltnis": "3000:1",
        "Kontrastverh\u00e4ltnis (dynamisch)": "80000000:1",
        "Marktpositionierung": "Gaming",
        "Maximale Bildwiederholrate": "165 Hz",
        "Mitgelieferte Kabel": "AC",
        "Natives Seitenverh\u00e4ltnis": "16:9",
        "Neigungsverstellung": "Ja",
        "Neigungswinkelbereich": "3 - 21\u00b0",
        "Paketgewicht": "5,4 kg",
        "Panel": "VA",
        "Panel-Montage-Schnittstelle": "100 x 100 mm",
        "Panel-Typ": "MVA",
        "Produktfarbe": "Schwarz",
        "RMS-Leistung": "2 W",
        "Reaktionszeit": "2 ms",
        "Reaktionszeit (schnell)": "1 ms",
        "Relative Luftfeuchtigkeit in Betrieb": "20 - 90%",
        "Schnellstart\u00fcbersicht": "Ja",
        "Slot-Typ Kabelsperre": "Kensington",
        "Stromverbrauch (Standby)": "0,5 W",
        "Tiefe (ohne Standfu\u00df)": "7,8 cm",
        "Touchscreen": "Nein",
        "VESA Halterung": "100x100 mm",
        "VESA-Halterung": "Ja",
        "Verpackungsbreite": "612 mm",
        "Verpackungsh\u00f6he": "408 mm",
        "Verpackungstiefe": "190 mm",
        "Video Anschl\u00fcsse": "2x HDMI, 1x DisplayPort",
        "Warentarifnummer (HS)": "85285210"
    },
    "raw_specifications_text": "Displaygr\u00f6\u00dfe: 23,6 Zoll\nAufl\u00f6sung: 1920x1080\nPanel: VA\nReaktionszeit: 2 ms\nVideo Anschl\u00fcsse: 2x HDMI, 1x DisplayPort\nErgonomie: Neigbar\nVESA Halterung: 100x100 mm\nHelligkeit: 250 cd/m\u00b2\nBesonderheiten: AMD FreeSync, Curved\nHersteller Artikelnummer: VX2468-PC-MHD\nEAN: 0766907011968\nArtikelnummer: M16YMBYL\nBildschirmdiagonale: 61 cm (24 Zoll)\nDisplay-Aufl\u00f6sung: 1920 x 1080 Pixel\nNatives Seitenverh\u00e4ltnis: 16:9\nBildschirmtechnologie: LED\nTouchscreen: Nein\nHD-Typ: Full HD\nPanel-Typ: MVA\nBildschirmform: Gebogen\nKontrastverh\u00e4ltnis: 3000:1\nMaximale Bildwiederholrate: 165 Hz\nAnzahl der Farben des Displays: 16,7 Millionen Farben\nHelligkeit (typisch): 250 cd/m\u00b2\nBewertung der Bildschirmkr\u00fcmmung: 1500R\nKontrastverh\u00e4ltnis (dynamisch): 80000000:1\nBildwinkel, horizontal: 178\u00b0\nBildwinkel, vertikal: 178\u00b0\nReaktionszeit (schnell): 1 ms\nDigital horizontale Frequenz: 30 - 184 kHz\nDigital vertikale Frequenz: 48 - 165 Hz\nAMD FreeSync: Ja\nAMD FreeSync-Typ: FreeSync Premium\nEingebaute Lautsprecher: Ja\nAnzahl der Lautsprecher: 2\nRMS-Leistung: 2 W\nMarktpositionierung: Gaming\nProduktfarbe: Schwarz\nHDMI: Ja\nAnzahl HDMI-Anschl\u00fcsse: 2\nHDMI-Version: 2.0\nAnzahl DisplayPort Anschl\u00fcsse: 1\nAudioausgang: Ja\nVESA-Halterung: Ja\nKabelsperre-Slot: Ja\nPanel-Montage-Schnittstelle: 100 x 100 mm\nSlot-Typ Kabelsperre: Kensington\nNeigungswinkelbereich: 3 - 21\u00b0\nNeigungsverstellung: Ja\nStromverbrauch (Standby): 0,5 W\nAC Eingangsspannung: 100 - 240 V\nAC Eingangsfrequenz: 50/60 Hz\nBetriebstemperatur: 0 - 40 \u00b0C\nRelative Luftfeuchtigkeit in Betrieb: 20 - 90%\nMitgelieferte Kabel: AC\nSchnellstart\u00fcbersicht: Ja\nGer\u00e4tebreite (inkl. Fu\u00df): 536 mm\nGer\u00e4tetiefe (inkl. Fu\u00df): 188 mm\nGer\u00e4teh\u00f6he (inkl. Fu\u00df): 408 mm\nGewicht (mit St\u00e4nder): 4 kg\nBreite (ohne Standfu\u00df): 53,6 cm\nTiefe (ohne Standfu\u00df): 7,8 cm\nH\u00f6he (ohne Standfu\u00df): 32,3 cm\nGewicht (ohne St\u00e4nder): 3,4 kg\nVerpackungsbreite: 612 mm\nVerpackungstiefe: 190 mm\nVerpackungsh\u00f6he: 408 mm\nPaketgewicht: 5,4 kg\nWarentarifnummer (HS): 85285210",
    "reference_file": "offer_reference_1291.json",
    "shop_name": "mylemon.at"
}