{
    "html_file": "offer_789_5.html",
    "name": "Acer Vero BR7 BR277bmiprx, 27\"",
    "offer_link": "https://www.mylemon.at/artikel/acer/um_hb7ee_037/dis-27-vero-br277bmiprx-fhd.html",
    "price": 207.59,
    "raw_specifications": {
        "Anzahl DisplayPort Anschl\u00fcsse": "1",
        "Anzahl VGA (D-Sub) Anschl\u00fcsse": "1",
        "Anzahl der Farben des Displays": "16,7 Millionen Farben",
        "Artikelnummer": "M18YSLNL",
        "Aufl\u00f6sung": "1920x1080",
        "Besonderheiten": "75 Hz, Lautsprecher",
        "Bildschirmdiagonale": "68,6 cm (27 Zoll)",
        "Bildschirmdiagonale (cm)": "68,6 cm",
        "Bildschirmform": "Flach",
        "Bildwinkel, horizontal": "178\u00b0",
        "Bildwinkel, vertikal": "178\u00b0",
        "Breite (ohne Standfu\u00df)": "61,2 cm",
        "Digital horizontale Frequenz": "30 - 85 kHz",
        "Digital vertikale Frequenz": "56 - 76 Hz",
        "Display-Aufl\u00f6sung": "1920 x 1080 Pixel",
        "DisplayPorts-Version": "1.2",
        "Displaygr\u00f6\u00dfe": "27 Zoll",
        "EAN": "4710886930426",
        "Eingebaute Lautsprecher": "Ja",
        "Energieeffizienzklasse (SDR)": "E",
        "Energieeffizienzskala": "A bis G",
        "Energieverbrauch (SDR) pro 1.000 Stunden": "22 kWh",
        "Ergonomie": "H\u00f6henverstellbar, Pivot (90 Grad drehbar), Schwenkbar, Neigbar",
        "Ger\u00e4tebreite (inkl. Fu\u00df)": "612,3 mm",
        "Ger\u00e4teh\u00f6he (inkl. Fu\u00df)": "521,1 mm",
        "Ger\u00e4tetiefe (inkl. Fu\u00df)": "201 mm",
        "Gewicht (mit St\u00e4nder)": "4,9 kg",
        "HD-Typ": "Full HD",
        "HDMI": "Ja",
        "HDMI-Version": "1.4",
        "Helligkeit": "250 cd/m\u00b2",
        "Helligkeit (typisch)": "250 cd/m\u00b2",
        "Hersteller Artikelnummer": "UM.HB7EE.037",
        "H\u00f6he (ohne Standfu\u00df)": "36,6 cm",
        "H\u00f6heneinstellung": "12 cm",
        "H\u00f6henverstellung": "Ja",
        "Kontrastverh\u00e4ltnis (dynamisch)": "100000000:1",
        "Kopfh\u00f6rerausgang": "Ja",
        "Maximale Bildwiederholrate": "75 Hz",
        "Mitgelieferte Kabel": "HDMI, VGA",
        "NTSC Abdeckung (typisch)": "72%",
        "Natives Seitenverh\u00e4ltnis": "16:9",
        "Panel": "IPS",
        "Panel-Montage-Schnittstelle": "100 x 100 mm",
        "Panel-Typ": "IPS",
        "Produktfarbe": "Schwarz",
        "Reaktionszeit": "4 ms",
        "Schwenkbar": "Ja",
        "Schwenkwinkelbereich": "-45 - 45\u00b0",
        "Seitenverh\u00e4ltnis": "16:9",
        "St\u00e4nder enthalten": "Ja",
        "Tiefe (ohne Standfu\u00df)": "6,84 cm",
        "Touchscreen": "Nein",
        "Typ der Hintergrundbeleuchtung": "LED",
        "VESA Halterung": "100x100 mm",
        "VESA-Halterung": "Ja",
        "Video Anschl\u00fcsse": "1x VGA, 1x HDMI, 1x DisplayPort",
        "Warentarifnummer (HS)": "85285210"
    },
    "raw_specifications_text": "Displaygr\u00f6\u00dfe: 27 Zoll\nAufl\u00f6sung: 1920x1080\nPanel: IPS\nReaktionszeit: 4 ms\nVideo Anschl\u00fcsse: 1x VGA, 1x HDMI, 1x DisplayPort\nErgonomie: H\u00f6henverstellbar, Pivot (90 Grad drehbar), Schwenkbar, Neigbar\nVESA Halterung: 100x100 mm\nHelligkeit: 250 cd/m\u00b2\nBesonderheiten: 75 Hz, Lautsprecher\nHersteller Artikelnummer: UM.HB7EE.037\nEAN: 4710886930426\nArtikelnummer: M18YSLNL\nBildschirmdiagonale: 68,6 cm (27 Zoll)\nDisplay-Aufl\u00f6sung: 1920 x 1080 Pixel\nNatives Seitenverh\u00e4ltnis: 16:9\nTouchscreen: Nein\nHD-Typ: Full HD\nPanel-Typ: IPS\nBildschirmform: Flach\nMaximale Bildwiederholrate: 75 Hz\nAnzahl der Farben des Displays: 16,7 Millionen Farben\nTyp der Hintergrundbeleuchtung: LED\nHelligkeit (typisch): 250 cd/m\u00b2\nSeitenverh\u00e4ltnis: 16:9\nKontrastverh\u00e4ltnis (dynamisch): 100000000:1\nBildwinkel, horizontal: 178\u00b0\nBildwinkel, vertikal: 178\u00b0\nDigital horizontale Frequenz: 30 - 85 kHz\nDigital vertikale Frequenz: 56 - 76 Hz\nBildschirmdiagonale (cm): 68,6 cm\nNTSC Abdeckung (typisch): 72%\nEingebaute Lautsprecher: Ja\nProduktfarbe: Schwarz\nHDMI: Ja\nKopfh\u00f6rerausgang: Ja\nAnzahl VGA (D-Sub) Anschl\u00fcsse: 1\nHDMI-Version: 1.4\nAnzahl DisplayPort Anschl\u00fcsse: 1\nDisplayPorts-Version: 1.2\nVESA-Halterung: Ja\nH\u00f6henverstellung: Ja\nPanel-Montage-Schnittstelle: 100 x 100 mm\nH\u00f6heneinstellung: 12 cm\nSchwenkbar: Ja\nSchwenkwinkelbereich: -45 - 45\u00b0\nEnergieeffizienzklasse (SDR): E\nEnergieverbrauch (SDR) pro 1.000 Stunden: 22 kWh\nEnergieeffizienzskala: A bis G\nSt\u00e4nder enthalten: Ja\nMitgelieferte Kabel: HDMI, VGA\nGer\u00e4tebreite (inkl. Fu\u00df): 612,3 mm\nGer\u00e4tetiefe (inkl. Fu\u00df): 201 mm\nGer\u00e4teh\u00f6he (inkl. Fu\u00df): 521,1 mm\nGewicht (mit St\u00e4nder): 4,9 kg\nBreite (ohne Standfu\u00df): 61,2 cm\nTiefe (ohne Standfu\u00df): 6,84 cm\nH\u00f6he (ohne Standfu\u00df): 36,6 cm\nWarentarifnummer (HS): 85285210",
    "reference_file": "offer_reference_789.json",
    "shop_name": "mylemon.at"
}