{
    "html_file": "offer_1615_14.html",
    "name": "NEC MultiSync EA242F-BK schwarz, 23.8\"",
    "offer_link": "https://www.ditech.at/details.php?artnr=312212",
    "price": 396.9,
    "raw_specifications": {
        "Abmessungen (BxHxT)": "538x337x250mm (mit Standfu\u00df),  538x319x47mm (ohne Standfu\u00df)",
        "Anschl\u00fcsse - DisplayPort 1.2": "1",
        "Anschl\u00fcsse - DisplayPort-Out 1.2": "1",
        "Anschl\u00fcsse - DisplayPort-Out 1.2 (Daisy Chain)": "1",
        "Anschl\u00fcsse - DisplayPort-Out 1.2 Daisy Chain": "1",
        "Anschl\u00fcsse - HDMI 1.4": "1",
        "Anschl\u00fcsse - USB-C 3.0 mit DisplayPort 1.2": "1",
        "Anschl\u00fcsse - VGA": "1",
        "Anschl\u00fcsse - VGA (60Hz@1920x1080)": "1",
        "Anschl\u00fcsse - VGA 60Hz@1920x1080": "1",
        "Anwendung": "station\u00e4r",
        "Audio": "Lautsprecher (2x 1W),  1x Line-In,  1x Line-Out",
        "Aufl\u00f6sung": "1920x1080",
        "Beschichtung": "matt (non-glare)",
        "Besonderheiten": "Slim Bezel,  USB-C Power Delivery (65W),  Anwesenheitssensor,  Lichtsensor,  Sicherheitsschloss (Kensington)",
        "Bildwiederholfrequenz": "60Hz",
        "Blickwinkel": "178\u00b0/178\u00b0",
        "Diagonale": "23.8\"/60.5cm",
        "Ergonomie": "150mm (h\u00f6henverstellbar),  90\u00b0 (Pivot),  \u00b1170\u00b0 (drehbar),  +35\u00b0/-5\u00b0 (neigbar),  keine Angabe (Schr\u00e4glage)",
        "FRC": "unbekannt",
        "Farbe": "schwarz",
        "Farbraum - Adobe RGB": "75.3%",
        "Farbraum - sRGB": "101.6%",
        "Farbtiefe": "8bit (16.7 Mio. Farben)",
        "Form": "gerade (flat)",
        "Gewicht": "7.00kg (mit Standfu\u00df),  3.50kg (ohne Standfu\u00df)",
        "HDR": "N/A",
        "Helligkeit": "250cd/m\u00b2",
        "Herstellergarantie": "drei Jahre",
        "Hintergrundbeleuchtung": "White-LED,  flicker-free,  Blaulichtfilter",
        "Kontrast - dynamisch": "5.000:1",
        "Kontrast - statisch": "1.000:1",
        "Lautsprecher": "Ja",
        "Leistungsaufnahme": "keine Angabe (maximal),  21W (typisch),  keine Angabe (Energielabel alt A+++ bis G),  0.3W (Standby)",
        "Panel": "IPS",
        "Reaktionszeit - GtG": "5ms",
        "Screen-to-Body-Ratio": "91.0% (berechnet)",
        "Seitenverh\u00e4ltnis": "16:9",
        "Signalfrequenz": "31.5-83kHz (horizontal),  50-75Hz (vertikal)",
        "Stromversorgung": "AC-In (internes Netzteil)",
        "USB-Hub In": "1x USB-B 3.0,  1x USB-C 3.0 mit DisplayPort 1.2",
        "USB-Hub Out": "3x USB-A 3.0",
        "USB-Schreibweise": "Link",
        "VESA": "100x100 (belegt)",
        "VRR (Variable Refresh Rate)": "N/A",
        "Weitere Anschl\u00fcsse": "1x NEC ControlSync-In,  1x NEC ControlSync-Out"
    },
    "raw_specifications_text": "Abmessungen (BxHxT): 538x337x250mm (mit Standfu\u00df),  538x319x47mm (ohne Standfu\u00df)\nAnschl\u00fcsse - DisplayPort 1.2: 1\nAnschl\u00fcsse - DisplayPort-Out 1.2: 1\nAnschl\u00fcsse - DisplayPort-Out 1.2 (Daisy Chain): 1\nAnschl\u00fcsse - DisplayPort-Out 1.2 Daisy Chain: 1\nAnschl\u00fcsse - HDMI 1.4: 1\nAnschl\u00fcsse - USB-C 3.0 mit DisplayPort 1.2: 1\nAnschl\u00fcsse - VGA: 1\nAnschl\u00fcsse - VGA (60Hz@1920x1080): 1\nAnschl\u00fcsse - VGA 60Hz@1920x1080: 1\nAnwendung: station\u00e4r\nAudio: Lautsprecher (2x 1W),  1x Line-In,  1x Line-Out\nAufl\u00f6sung: 1920x1080\nBeschichtung: matt (non-glare)\nBesonderheiten: Slim Bezel,  USB-C Power Delivery (65W),  Anwesenheitssensor,  Lichtsensor,  Sicherheitsschloss (Kensington)\nBildwiederholfrequenz: 60Hz\nBlickwinkel: 178\u00b0/178\u00b0\nDiagonale: 23.8\"/60.5cm\nErgonomie: 150mm (h\u00f6henverstellbar),  90\u00b0 (Pivot),  \u00b1170\u00b0 (drehbar),  +35\u00b0/-5\u00b0 (neigbar),  keine Angabe (Schr\u00e4glage)\nFarbe: schwarz\nFarbraum - Adobe RGB: 75.3%\nFarbraum - sRGB: 101.6%\nFarbtiefe: 8bit (16.7 Mio. Farben)\nForm: gerade (flat)\nFRC: unbekannt\nGewicht: 7.00kg (mit Standfu\u00df),  3.50kg (ohne Standfu\u00df)\nHDR: N/A\nHelligkeit: 250cd/m\u00b2\nHerstellergarantie: drei Jahre\nHintergrundbeleuchtung: White-LED,  flicker-free,  Blaulichtfilter\nKontrast - dynamisch: 5.000:1\nKontrast - statisch: 1.000:1\nLautsprecher: Ja\nLeistungsaufnahme: keine Angabe (maximal),  21W (typisch),  keine Angabe (Energielabel alt A+++ bis G),  0.3W (Standby)\nPanel: IPS\nReaktionszeit - GtG: 5ms\nScreen-to-Body-Ratio: 91.0% (berechnet)\nSeitenverh\u00e4ltnis: 16:9\nSignalfrequenz: 31.5-83kHz (horizontal),  50-75Hz (vertikal)\nStromversorgung: AC-In (internes Netzteil)\nUSB-Hub In: 1x USB-B 3.0,  1x USB-C 3.0 mit DisplayPort 1.2\nUSB-Hub Out: 3x USB-A 3.0\nUSB-Schreibweise: Link\nVESA: 100x100 (belegt)\nVRR (Variable Refresh Rate): N/A\nWeitere Anschl\u00fcsse: 1x NEC ControlSync-In,  1x NEC ControlSync-Out",
    "reference_file": "offer_reference_1615.json",
    "shop_name": "DiTech.at"
}