{
    "html_file": "offer_889_0.html",
    "name": "ASUS ROG Swift PG329Q-W, 32\"",
    "offer_link": "https://www.taufnaus.de/product/10601530",
    "price": 1620.04,
    "raw_specifications": {
        "Abmessungen (Breite x Tiefe x H\u00f6he)": "72.818 cm x 29.256 cm x 55.183 cm - mit Fu\u00df",
        "Adaptive-Sync Technologie": "NVIDIA G-SYNC Compatible",
        "Besonderheiten": "HDCP, Trace Free Technology, ASUS GamePlus, Low Blue Light Mode, flimmerfreie Technologie, ASUS EyeCare Technology, kompatibel mit NVIDIA G-SYNC, Adaptive-Sync-Technologie, ASUS GameVisual Technology, Monitorkalibrierung Delta E<2, Shadow Boost-Technologie, ASUS Aura Sync technology, ASUS Extreme Low Motion Blur Sync, ELMB SYNC, Multiple HDR-Modus, Display Widget",
        "Bildschirmbeschichtung": "Blendfrei",
        "Bildschirmtyp": "IPS",
        "Details zu Abmessungen & Gewicht": "Ohne Fu\u00df - Breite: 72.818 cm - Tiefe: 8.712 cm - H\u00f6he: 42.852 cm - Gewicht: 5.9 kg \u00a6 Mit Fu\u00df - Breite: 72.818 cm - Tiefe: 29.256 cm - H\u00f6he: 55.183 cm - Gewicht: 9.5 kg",
        "Diagonalabmessung": "81.3 cm (32\")",
        "Display-Typ": "LED-hintergrundbeleuchteter LCD-Monitor / TFT-Aktivmatrix",
        "Eingangsspannung": "Wechselstrom 100-240 V (50/60 Hz)",
        "Einstellungen der Anzeigeposition": "H\u00f6he, Drehung, Neigung",
        "Energie Effizienzklasse": "Klasse G",
        "Energieklasse (HDR)": "Klasse G",
        "Enthaltene Kabel": "1 x DisplayPort-Kabel \u00a6 1 x USB-Kabel \u00a6 1 x HDMI-Kabel \u00a6 1 x Audiokabel",
        "Farbraum": "160% sRGB, 98% DCI-P3",
        "Farbunterst\u00fctzung": "1,074 Milliarden Farben (10-Bit)",
        "Gaming": "Ja",
        "Gewicht": "9.5 kg",
        "HDR-Format": "HDR10",
        "HDR-Zertifizierung": "DisplayHDR 600",
        "Helligkeit": "600 cd/m\u00b2",
        "Hintergrundbeleuchtungs-Technologie": "LED-Hintergrundbeleuchtung",
        "Horizontale Bildwiederholrate": "30 - 250 kHz",
        "Horizontaler Betrachtungswinkel": "178",
        "H\u00f6heneinstellung": "100 mm",
        "Integrierte Peripherieger\u00e4te": "USB 3.2 Gen 1 Hub",
        "Kennzeichnung": "TUV Rheinland Low Blue Light Certification, TUV Rheinland Flicker Free Certification, DisplayPort 1.2",
        "Kontrast": "1000:1 / 1000000:1 (dynamisch)",
        "Leistungsaufnahme im Ein-Zustand": "41.7 W",
        "Leistungsmerkmale": "Slot f\u00fcr Sicherheitsschloss (Kabelschloss getrennt erh\u00e4ltlich)",
        "Native Aufl\u00f6sung": "WQHD 2560 x 1440 (DisplayPort: 175 Hz, HDMI: 165 Hz)",
        "Neigungswinkel": "-5/+20",
        "Pixelpitch": "0.277 mm",
        "Reaktionszeit": "1 ms (Gray-to-Gray)",
        "Schlosstyp zur Diebstahlsicherung": "Kensington Slot",
        "Schnittstellen": "DisplayPort 1.2 \u00a6 USB 3.2 Gen 1 Upstream \u00a6 2 x USB 3.2 Gen 1 Downstream \u00a6 2 x HDMI \u00a6 Kopfh\u00f6rer",
        "Schwenkwinkel": "50",
        "Seitenverh\u00e4ltnis": "16:9",
        "Stromverbrauch (Aus-Modus)": "0.5 Watt",
        "Stromverbrauch (typisch)": "43 Watt",
        "Stromverbrauch HDR (eingeschaltet)": "91 kWh/1.000 h",
        "Stromverbrauch SDR (eingeschaltet)": "41.7 kWh/1.000 h",
        "Stromverbrauch im Standby-Modus": "0.5 Watt",
        "Transportbreite": "81.2 cm",
        "Transportgewicht": "14.3 kg",
        "Transporth\u00f6he": "62.6 cm",
        "Transporttiefe": "23.8 cm",
        "VESA-Halterung": "100 x 100 mm",
        "Vertikale Bildwiederholrate": "48 - 175 Hz",
        "Vertikaler Betrachtungswinkel": "178",
        "Zubeh\u00f6r im Lieferumfang": "VESA-Klammer, ROG-Sticker"
    },
    "raw_specifications_text": "Display-Typ: LED-hintergrundbeleuchteter LCD-Monitor / TFT-Aktivmatrix\nEnergie Effizienzklasse: Klasse G\nEnergieklasse (HDR): Klasse G\nDiagonalabmessung: 81.3 cm (32\")\nAdaptive-Sync Technologie: NVIDIA G-SYNC Compatible\nIntegrierte Peripherieger\u00e4te: USB 3.2 Gen 1 Hub\nBildschirmtyp: IPS\nSeitenverh\u00e4ltnis: 16:9\nNative Aufl\u00f6sung: WQHD 2560 x 1440 (DisplayPort: 175 Hz, HDMI: 165 Hz)\nPixelpitch: 0.277 mm\nHelligkeit: 600 cd/m\u00b2\nKontrast: 1000:1 / 1000000:1 (dynamisch)\nHDR-Format: HDR10\nHDR-Zertifizierung: DisplayHDR 600\nFarbunterst\u00fctzung: 1,074 Milliarden Farben (10-Bit)\nFarbraum: 160% sRGB, 98% DCI-P3\nReaktionszeit: 1 ms (Gray-to-Gray)\nVertikale Bildwiederholrate: 48 - 175 Hz\nHorizontale Bildwiederholrate: 30 - 250 kHz\nGaming: Ja\nHorizontaler Betrachtungswinkel: 178\nVertikaler Betrachtungswinkel: 178\nBildschirmbeschichtung: Blendfrei\nHintergrundbeleuchtungs-Technologie: LED-Hintergrundbeleuchtung\nBesonderheiten: HDCP, Trace Free Technology, ASUS GamePlus, Low Blue Light Mode, flimmerfreie Technologie, ASUS EyeCare Technology, kompatibel mit NVIDIA G-SYNC, Adaptive-Sync-Technologie, ASUS GameVisual Technology, Monitorkalibrierung Delta E<2, Shadow Boost-Technologie, ASUS Aura Sync technology, ASUS Extreme Low Motion Blur Sync, ELMB SYNC, Multiple HDR-Modus, Display Widget\nAbmessungen (Breite x Tiefe x H\u00f6he): 72.818 cm x 29.256 cm x 55.183 cm - mit Fu\u00df\nGewicht: 9.5 kg\nSchnittstellen: DisplayPort 1.2 \u00a6 USB 3.2 Gen 1 Upstream \u00a6 2 x USB 3.2 Gen 1 Downstream \u00a6 2 x HDMI \u00a6 Kopfh\u00f6rer\nEinstellungen der Anzeigeposition: H\u00f6he, Drehung, Neigung\nNeigungswinkel: -5/+20\nSchwenkwinkel: 50\nH\u00f6heneinstellung: 100 mm\nVESA-Halterung: 100 x 100 mm\nLeistungsmerkmale: Slot f\u00fcr Sicherheitsschloss (Kabelschloss getrennt erh\u00e4ltlich)\nZubeh\u00f6r im Lieferumfang: VESA-Klammer, ROG-Sticker\nEnthaltene Kabel: 1 x DisplayPort-Kabel \u00a6 1 x USB-Kabel \u00a6 1 x HDMI-Kabel \u00a6 1 x Audiokabel\nKennzeichnung: TUV Rheinland Low Blue Light Certification, TUV Rheinland Flicker Free Certification, DisplayPort 1.2\nSchlosstyp zur Diebstahlsicherung: Kensington Slot\nEingangsspannung: Wechselstrom 100-240 V (50/60 Hz)\nLeistungsaufnahme im Ein-Zustand: 41.7 W\nStromverbrauch SDR (eingeschaltet): 41.7 kWh/1.000 h\nStromverbrauch HDR (eingeschaltet): 91 kWh/1.000 h\nStromverbrauch (typisch): 43 Watt\nStromverbrauch im Standby-Modus: 0.5 Watt\nStromverbrauch (Aus-Modus): 0.5 Watt\nDetails zu Abmessungen & Gewicht: Ohne Fu\u00df - Breite: 72.818 cm - Tiefe: 8.712 cm - H\u00f6he: 42.852 cm - Gewicht: 5.9 kg \u00a6 Mit Fu\u00df - Breite: 72.818 cm - Tiefe: 29.256 cm - H\u00f6he: 55.183 cm - Gewicht: 9.5 kg\nTransportbreite: 81.2 cm\nTransporttiefe: 23.8 cm\nTransporth\u00f6he: 62.6 cm\nTransportgewicht: 14.3 kg",
    "reference_file": "offer_reference_889.json",
    "shop_name": "TaufNaus"
}