{
    "html_file": "offer_778_15.html",
    "name": "HP Z27xs G3, 27\"",
    "offer_link": "https://www.future-x.at/hp-z27xs-g3-led-monitor-68-6-cm-27-3840-x-2160-4k-%40-60-hz-ips-266-cd-m%B2-1300%3A1-displayhdr-600-14-ms-hdmi-displayport-usb-c-turbo-silber-p-9067184/?pv=2",
    "price": 478.69,
    "raw_specifications": {
        "Abmessungen (Breite x Tiefe x H\u00f6he)": "60,8 cm x 21,5 cm x 52,9 cm - mit Fu\u00df",
        "Besonderheiten": "DreamColor, flimmerfreie Technologie, ohne Quecksilber, Werkskalibrierung, arsenfrei, Low Blue Light-Technologie, 10-bit Farbtiefe, Pantone-zertifiziert, kantenbeleuchtete LED-Hintergrundbeleuchtung, 4-seitige Micro-Edge-Frontblende",
        "Bildschirmbeschichtung": "Blendfrei, 3H Hard Coating",
        "Bildschirmtyp": "IPS",
        "Details zu Abmessungen & Gewicht": "Mit Fu\u00df - Breite: 60,8 cm - Tiefe: 21,5 cm - H\u00f6he: 52,9 cm - Gewicht: 7,8 kg \u00a6 Ohne Fu\u00df - Breite: 60,8 cm - Tiefe: 4,6 cm - H\u00f6he: 35,5 cm",
        "Diagonalabmessung": "68,6 cm (27\")",
        "Display-Typ": "LED-hintergrundbeleuchteter LCD-Monitor / TFT-Aktivmatrix",
        "ENERGY STAR zertifiziert": "Ja",
        "Eingangsspannung": "Wechselstrom 100-240 V (50/60 Hz)",
        "Einstellungen der Anzeigeposition": "H\u00f6he, Pivot (Rotation), Drehung, Neigung",
        "Enthaltene Kabel": "1 x HDMI-Kabel \u00a6 1 x DisplayPort-Kabel \u00a6 1 x Kabel USB-C auf USB-C \u00a6 1 x USB-C auf USB-A Kabel",
        "Farbe": "Turbo Silber",
        "Gewicht": "7,8 kg",
        "HDR-Zertifizierung": "DisplayHDR 600",
        "Helligkeit": "266 cd/m\u00b2",
        "Hintergrundbeleuchtungs-Technologie": "LED-Hintergrundbeleuchtung",
        "Horizontale Bildwiederholrate": "30 - 135 kHz",
        "Horizontaler Betrachtungswinkel": "178",
        "H\u00f6heneinstellung": "150 mm",
        "Integrierte Peripherieger\u00e4te": "USB 3.2 Gen 1 Hub",
        "Kennzeichnung": "VCCI, BSMI, GS, NOM, CB, CCC, PSB, ISO 9241-307, KCC, WEEE, cTUVus, KC, ERP, CECP, CEL, EAC, ISC, SEPA, BIS, halogenarm, UAE, Ukraine Energy Label",
        "Kontrast": "1300:1",
        "Leistungsmerkmale": "Slot f\u00fcr Sicherheitsschloss (Kabelschloss getrennt erh\u00e4ltlich), abnehmbarer St\u00e4nder, Unterst\u00fctzung f\u00fcr VESA-Schnittstelle",
        "Lokalisierung": "Englisch / Europa",
        "Max. Betriebstemperatur": "35 \u00b0C",
        "Min Betriebstemperatur": "5 \u00b0C",
        "Mitgelieferte Software": "HP Display Center",
        "Montagekit": "Mitgeliefert",
        "Native Aufl\u00f6sung": "4K 3840 x 2160 bei 60 Hz",
        "Neigungswinkel": "-5/+20",
        "Pixelpitch": "0.15544 mm",
        "Ppi": "163",
        "Reaktionszeit": "14 ms (Gray-to-Gray)",
        "Rotationswinkel": "180",
        "Schlosstyp zur Diebstahlsicherung": "Kensington Slot",
        "Schnittstellen": "HDMI (HDCP) \u00a6 DisplayPort 1.4 (HDCP) \u00a6 DisplayPort-Ausgang (HDCP) \u00a6 USB-C 3.1 Gen 2 Upstream/DisplayPort 1.4 Alt Mode (bis zu 100 W) \u00a6 3 x USB 3.2 Gen 1 \u00a6 USB-C Upstream/DisplayPort mit Spannungsversorgung (bis zu 15 W)",
        "Schwenkwinkel": "90",
        "Seitenverh\u00e4ltnis": "16:9",
        "Service und Support": "Begrenzte Garantie - Arbeitszeit und Ersatzteile - 3 Jahre",
        "Stromverbrauch (typisch)": "48 Watt",
        "Stromverbrauch im Standby-Modus": "0.5 Watt",
        "TCO-zertifiziert": "TCO Certified Displays 8, TCO Certified Edge Displays",
        "Transportbreite": "69,5 cm",
        "Transportgewicht": "11,2 kg",
        "Transporth\u00f6he": "42,1 cm",
        "Transporttiefe": "16 cm",
        "USB-Spannungsversorgung": "100 Watt",
        "VESA-Halterung": "100 x 100 mm",
        "Vertikale Bildwiederholrate": "40 - 60 Hz",
        "Vertikaler Betrachtungswinkel": "178",
        "Zubeh\u00f6r im Lieferumfang": "Kabelf\u00fchrungsabdeckung, Befestigungsadapter",
        "Zul\u00e4ssige Luftfeuchtigkeit im Betrieb": "20 - 80% (nicht kondensierend)"
    },
    "raw_specifications_text": "Display-Typ: LED-hintergrundbeleuchteter LCD-Monitor / TFT-Aktivmatrix\nDiagonalabmessung: 68,6 cm (27\")\nIntegrierte Peripherieger\u00e4te: USB 3.2 Gen 1 Hub\nUSB-Spannungsversorgung: 100 Watt\nBildschirmtyp: IPS\nSeitenverh\u00e4ltnis: 16:9\nNative Aufl\u00f6sung: 4K 3840 x 2160 bei 60 Hz\nPixelpitch: 0.15544 mm\nPpi: 163\nHelligkeit: 266 cd/m\u00b2\nKontrast: 1300:1\nHDR-Zertifizierung: DisplayHDR 600\nReaktionszeit: 14 ms (Gray-to-Gray)\nVertikale Bildwiederholrate: 40 - 60 Hz\nHorizontale Bildwiederholrate: 30 - 135 kHz\nHorizontaler Betrachtungswinkel: 178\nVertikaler Betrachtungswinkel: 178\nBildschirmbeschichtung: Blendfrei, 3H Hard Coating\nHintergrundbeleuchtungs-Technologie: LED-Hintergrundbeleuchtung\nBesonderheiten: DreamColor, flimmerfreie Technologie, ohne Quecksilber, Werkskalibrierung, arsenfrei, Low Blue Light-Technologie, 10-bit Farbtiefe, Pantone-zertifiziert, kantenbeleuchtete LED-Hintergrundbeleuchtung, 4-seitige Micro-Edge-Frontblende\nFarbe: Turbo Silber\nAbmessungen (Breite x Tiefe x H\u00f6he): 60,8 cm x 21,5 cm x 52,9 cm - mit Fu\u00df\nGewicht: 7,8 kg\nSchnittstellen: HDMI (HDCP) \u00a6 DisplayPort 1.4 (HDCP) \u00a6 DisplayPort-Ausgang (HDCP) \u00a6 USB-C 3.1 Gen 2 Upstream/DisplayPort 1.4 Alt Mode (bis zu 100 W) \u00a6 3 x USB 3.2 Gen 1 \u00a6 USB-C Upstream/DisplayPort mit Spannungsversorgung (bis zu 15 W)\nEinstellungen der Anzeigeposition: H\u00f6he, Pivot (Rotation), Drehung, Neigung\nNeigungswinkel: -5/+20\nSchwenkwinkel: 90\nRotationswinkel: 180\nH\u00f6heneinstellung: 150 mm\nVESA-Halterung: 100 x 100 mm\nLeistungsmerkmale: Slot f\u00fcr Sicherheitsschloss (Kabelschloss getrennt erh\u00e4ltlich), abnehmbarer St\u00e4nder, Unterst\u00fctzung f\u00fcr VESA-Schnittstelle\nZubeh\u00f6r im Lieferumfang: Kabelf\u00fchrungsabdeckung, Befestigungsadapter\nEnthaltene Kabel: 1 x HDMI-Kabel \u00a6 1 x DisplayPort-Kabel \u00a6 1 x Kabel USB-C auf USB-C \u00a6 1 x USB-C auf USB-A Kabel\nMontagekit: Mitgeliefert\nKennzeichnung: VCCI, BSMI, GS, NOM, CB, CCC, PSB, ISO 9241-307, KCC, WEEE, cTUVus, KC, ERP, CECP, CEL, EAC, ISC, SEPA, BIS, halogenarm, UAE, Ukraine Energy Label\nLokalisierung: Englisch / Europa\nSchlosstyp zur Diebstahlsicherung: Kensington Slot\nEingangsspannung: Wechselstrom 100-240 V (50/60 Hz)\nStromverbrauch (typisch): 48 Watt\nStromverbrauch im Standby-Modus: 0.5 Watt\nMitgelieferte Software: HP Display Center\nDetails zu Abmessungen & Gewicht: Mit Fu\u00df - Breite: 60,8 cm - Tiefe: 21,5 cm - H\u00f6he: 52,9 cm - Gewicht: 7,8 kg \u00a6 Ohne Fu\u00df - Breite: 60,8 cm - Tiefe: 4,6 cm - H\u00f6he: 35,5 cm\nTransportbreite: 69,5 cm\nTransporttiefe: 16 cm\nTransporth\u00f6he: 42,1 cm\nTransportgewicht: 11,2 kg\nTCO-zertifiziert: TCO Certified Displays 8, TCO Certified Edge Displays\nENERGY STAR zertifiziert: Ja\nService und Support: Begrenzte Garantie - Arbeitszeit und Ersatzteile - 3 Jahre\nMin Betriebstemperatur: 5 \u00b0C\nMax. Betriebstemperatur: 35 \u00b0C\nZul\u00e4ssige Luftfeuchtigkeit im Betrieb: 20 - 80% (nicht kondensierend)",
    "reference_file": "offer_reference_778.json",
    "shop_name": "Future-X.at"
}