{
    "html_file": "offer_2139_20.html",
    "name": "Philips E-Line 328E1CA, 31.5\"",
    "offer_link": "https://www.electronicshop24.at/product_info.php?products_id=110000001511809134&ano=F1511809134&mno=328E1CA%2F00&ean=8712581758516&utm_medium=cpc&utm_campaign=preisvergleich&utm_content=item&utm_source=geizhals&ref=geizhals",
    "price": 408.0,
    "raw_specifications": {
        "Abmessungen (Breite x Tiefe x H\u00f6he)": "70.9 cm x 28.1 cm x 52.3 cm - mit Fu\u00df",
        "Ausgangsleistung/Kanal": "3 Watt",
        "Besonderheiten": "Sync-on-Green, Bleifrei, SmartContrast, SmartImage Game, Mega Infinity Dynamic Contrast Ratio, Low Blue Light Mode, ohne Quecksilber, SmartUniformity, Adaptive-Sync-Technologie, Ultra Wide-Color Technology, Monitorkalibrierung Delta E<2",
        "Bildschirmbeschichtung": "Blendfrei, 3H Hard Coating, Haze 25 %",
        "Bildschirmtyp": "VA",
        "Details zu Abmessungen & Gewicht": "Mit Fu\u00df - Breite: 70.9 cm - Tiefe: 28.1 cm - H\u00f6he: 52.3 cm - Gewicht: 7.71 kg \u00a6 Ohne Fu\u00df - Breite: 70.9 cm - Tiefe: 8.8 cm - H\u00f6he: 42.5 cm - Gewicht: 6.89 kg",
        "Diagonalabmessung": "81.3 cm (32\")",
        "Display-Typ": "LED-hintergrundbeleuchteter LCD-Monitor / TFT-Aktivmatrix",
        "Eingangsspannung": "Wechselstrom 120/230 V (50/60 Hz)",
        "Einstellungen der Anzeigeposition": "Neigung",
        "Energie Effizienzklasse": "Klasse G",
        "Enthaltene Kabel": "1 x DisplayPort-Kabel \u00a6 1 x HDMI-Kabel \u00a6 1 x Audiokabel",
        "Farbe": "Textured Black",
        "Farbraum": "120.5% sRGB, 97.8% NTSC",
        "Farbunterst\u00fctzung": "1,07 Mrd. Farben",
        "Geschwungener Bildschirm": "Ja (1500R)",
        "Gewicht": "7.71 kg",
        "Helligkeit": "250 cd/m\u00b2",
        "Hintergrundbeleuchtungs-Technologie": "WLED",
        "Horizontale Bildwiederholrate": "53 - 84 kHz",
        "Horizontaler Betrachtungswinkel": "178",
        "Kennzeichnung": "Plug and Play, TUV, TUV GS, SEMKO, CCC, DDC/CI, RoHS, CECP, CEL, cETLus, CU-EAC, DisplayPort 1.2",
        "Kontrast": "2500:1",
        "Leistungsaufnahme im Ein-Zustand": "38.9 W",
        "Leistungsmerkmale": "Slot f\u00fcr Sicherheitsschloss (Kabelschloss getrennt erh\u00e4ltlich)",
        "MTBF": "50,000 Stunde(n)",
        "Max. Betriebstemperatur": "40 \u00b0C",
        "Min Betriebstemperatur": "0 \u00b0C",
        "Native Aufl\u00f6sung": "4K 3840 x 2160 bei 60 Hz",
        "Neigungswinkel": "-5/+20",
        "OSD-Sprachen": "Multilingual",
        "Pixelpitch": "0.182 mm",
        "Ppi": "140",
        "Reaktionszeit": "4 ms (gray-to-gray)",
        "Schlosstyp zur Diebstahlsicherung": "Kensington Slot",
        "Schnittstellen": "DisplayPort \u00a6 2 x HDMI \u00a6 Audio Line-Out",
        "Seitenverh\u00e4ltnis": "16:9",
        "Sichtbare Bildfl\u00e4che": "80 cm (31.5\")",
        "Stromverbrauch (Aus-Modus)": "0.3 Watt",
        "Stromverbrauch SDR (eingeschaltet)": "39 kWh/1.000 h",
        "Stromverbrauch im Standby-Modus": "0.5 Watt",
        "Transportbreite": "80 cm",
        "Transportgewicht": "10.51 kg",
        "Transporth\u00f6he": "62.5 cm",
        "Transporttiefe": "23.6 cm",
        "Typ": "Lautsprecher - Stereo",
        "VESA-Halterung": "100 x 100 mm",
        "Vertikale Bildwiederholrate": "48 - 75 Hz",
        "Vertikaler Betrachtungswinkel": "178",
        "Zul\u00e4ssige Luftfeuchtigkeit im Betrieb": "20 - 80%"
    },
    "raw_specifications_text": "Display-Typ: LED-hintergrundbeleuchteter LCD-Monitor / TFT-Aktivmatrix\nEnergie Effizienzklasse: Klasse G\nDiagonalabmessung: 81.3 cm (32\")\nSichtbare Bildfl\u00e4che: 80 cm (31.5\")\nGeschwungener Bildschirm: Ja (1500R)\nBildschirmtyp: VA\nSeitenverh\u00e4ltnis: 16:9\nNative Aufl\u00f6sung: 4K 3840 x 2160 bei 60 Hz\nPixelpitch: 0.182 mm\nPpi: 140\nHelligkeit: 250 cd/m\u00b2\nKontrast: 2500:1\nFarbunterst\u00fctzung: 1,07 Mrd. Farben\nFarbraum: 120.5% sRGB, 97.8% NTSC\nReaktionszeit: 4 ms (gray-to-gray)\nVertikale Bildwiederholrate: 48 - 75 Hz\nHorizontale Bildwiederholrate: 53 - 84 kHz\nHorizontaler Betrachtungswinkel: 178\nVertikaler Betrachtungswinkel: 178\nBildschirmbeschichtung: Blendfrei, 3H Hard Coating, Haze 25 %\nHintergrundbeleuchtungs-Technologie: WLED\nOSD-Sprachen: Multilingual\nBesonderheiten: Sync-on-Green, Bleifrei, SmartContrast, SmartImage Game, Mega Infinity Dynamic Contrast Ratio, Low Blue Light Mode, ohne Quecksilber, SmartUniformity, Adaptive-Sync-Technologie, Ultra Wide-Color Technology, Monitorkalibrierung Delta E<2\nFarbe: Textured Black\nAbmessungen (Breite x Tiefe x H\u00f6he): 70.9 cm x 28.1 cm x 52.3 cm - mit Fu\u00df\nGewicht: 7.71 kg\nTyp: Lautsprecher - Stereo\nAusgangsleistung/Kanal: 3 Watt\nSchnittstellen: DisplayPort \u00a6 2 x HDMI \u00a6 Audio Line-Out\nEinstellungen der Anzeigeposition: Neigung\nNeigungswinkel: -5/+20\nVESA-Halterung: 100 x 100 mm\nLeistungsmerkmale: Slot f\u00fcr Sicherheitsschloss (Kabelschloss getrennt erh\u00e4ltlich)\nEnthaltene Kabel: 1 x DisplayPort-Kabel \u00a6 1 x HDMI-Kabel \u00a6 1 x Audiokabel\nMTBF: 50,000 Stunde(n)\nKennzeichnung: Plug and Play, TUV, TUV GS, SEMKO, CCC, DDC/CI, RoHS, CECP, CEL, cETLus, CU-EAC, DisplayPort 1.2\nSchlosstyp zur Diebstahlsicherung: Kensington Slot\nEingangsspannung: Wechselstrom 120/230 V (50/60 Hz)\nLeistungsaufnahme im Ein-Zustand: 38.9 W\nStromverbrauch SDR (eingeschaltet): 39 kWh/1.000 h\nStromverbrauch im Standby-Modus: 0.5 Watt\nStromverbrauch (Aus-Modus): 0.3 Watt\nDetails zu Abmessungen & Gewicht: Mit Fu\u00df - Breite: 70.9 cm - Tiefe: 28.1 cm - H\u00f6he: 52.3 cm - Gewicht: 7.71 kg \u00a6 Ohne Fu\u00df - Breite: 70.9 cm - Tiefe: 8.8 cm - H\u00f6he: 42.5 cm - Gewicht: 6.89 kg\nTransportbreite: 80 cm\nTransporttiefe: 23.6 cm\nTransporth\u00f6he: 62.5 cm\nTransportgewicht: 10.51 kg\nMin Betriebstemperatur: 0 \u00b0C\nMax. Betriebstemperatur: 40 \u00b0C\nZul\u00e4ssige Luftfeuchtigkeit im Betrieb: 20 - 80%",
    "reference_file": "offer_reference_2139.json",
    "shop_name": "ElectronicShop24"
}