{
    "html_file": "offer_142_2.html",
    "name": "Acer Nitro QG0 QG270H3bix, 27\"",
    "offer_link": "https://www.taufnaus.de/product/13711704",
    "price": 279.94,
    "raw_specifications": {
        "Abmessungen (Breite x Tiefe x H\u00f6he)": "61.61 cm x 17.5 cm x 45.22 cm - mit Fu\u00df",
        "Adaptive-Sync Technologie": "AMD FreeSync",
        "Besonderheiten": "Acer Adaptive Contrast Management (ACM), Zero Frame, Acer VisionCare, an 3 Seiten ohne Blende",
        "Bildschirmbeschichtung": "Blendfrei",
        "Bildschirmtyp": "VA",
        "Details zu Abmessungen & Gewicht": "Mit Fu\u00df - Breite: 61.61 cm - Tiefe: 17.5 cm - H\u00f6he: 45.22 cm - Gewicht: 3.3 kg \u00a6 Ohne Fu\u00df - Breite: 61.61 cm - Tiefe: 3.87 cm - H\u00f6he: 36.42 cm - Gewicht: 3.1 kg",
        "Diagonalabmessung": "68.6 cm (27\")",
        "Display-Typ": "LED-hintergrundbeleuchteter LCD-Monitor / TFT-Aktivmatrix",
        "Einstellungen der Anzeigeposition": "Neigung",
        "Energie Effizienzklasse": "Klasse D",
        "Energieklasse (HDR)": "Klasse F",
        "Enthaltene Kabel": "1 x HDMI-Kabel",
        "Farbe": "Schwarz",
        "Farbraum": "95% sRGB",
        "Farbunterst\u00fctzung": "1,07 Mrd. Farben",
        "Gaming": "Ja",
        "Gewicht": "3.3 kg",
        "HDR-Format": "HDR10",
        "Helligkeit": "250 cd/m\u00b2",
        "Hintergrundbeleuchtungs-Technologie": "LED-Hintergrundbeleuchtung",
        "Horizontale Bildwiederholrate": "52.7 - 110.6 kHz",
        "Horizontaler Betrachtungswinkel": "178",
        "Kennzeichnung": "MPR II",
        "Kontrast": "4000:1 / 100000000:1 (dynamisch)",
        "Leistungsmerkmale": "Slot f\u00fcr Sicherheitsschloss (Kabelschloss getrennt erh\u00e4ltlich)",
        "Mitgelieferte Software": "Acer Display Widget",
        "Native Aufl\u00f6sung": "Full HD (1080p) 1920 x 1080 (VGA: 60 Hz, HDMI: 100 Hz)",
        "Neigungswinkel": "-5/+15",
        "Reaktionszeit": "4 ms (gray-to-gray)",
        "Schlosstyp zur Diebstahlsicherung": "Kensington Slot",
        "Schnittstellen": "HDMI 2.0 \u00a6 VGA \u00a6 Audio Line-Out",
        "Seitenverh\u00e4ltnis": "16:9",
        "Stromverbrauch HDR (eingeschaltet)": "24 kWh/1.000 h",
        "Stromverbrauch SDR (eingeschaltet)": "17 kWh/1.000 h",
        "Transportbreite": "68.9 cm",
        "Transportgewicht": "4.75 kg",
        "Transporth\u00f6he": "44.8 cm",
        "Transporttiefe": "10.9 cm",
        "Vertikale Bildwiederholrate": "48 - 100 Hz",
        "Vertikaler Betrachtungswinkel": "178"
    },
    "raw_specifications_text": "Display-Typ: LED-hintergrundbeleuchteter LCD-Monitor / TFT-Aktivmatrix\nEnergie Effizienzklasse: Klasse D\nEnergieklasse (HDR): Klasse F\nDiagonalabmessung: 68.6 cm (27\")\nAdaptive-Sync Technologie: AMD FreeSync\nBildschirmtyp: VA\nSeitenverh\u00e4ltnis: 16:9\nNative Aufl\u00f6sung: Full HD (1080p) 1920 x 1080 (VGA: 60 Hz, HDMI: 100 Hz)\nHelligkeit: 250 cd/m\u00b2\nKontrast: 4000:1 / 100000000:1 (dynamisch)\nHDR-Format: HDR10\nFarbunterst\u00fctzung: 1,07 Mrd. Farben\nFarbraum: 95% sRGB\nReaktionszeit: 4 ms (gray-to-gray)\nVertikale Bildwiederholrate: 48 - 100 Hz\nHorizontale Bildwiederholrate: 52.7 - 110.6 kHz\nGaming: Ja\nHorizontaler Betrachtungswinkel: 178\nVertikaler Betrachtungswinkel: 178\nBildschirmbeschichtung: Blendfrei\nHintergrundbeleuchtungs-Technologie: LED-Hintergrundbeleuchtung\nBesonderheiten: Acer Adaptive Contrast Management (ACM), Zero Frame, Acer VisionCare, an 3 Seiten ohne Blende\nFarbe: Schwarz\nAbmessungen (Breite x Tiefe x H\u00f6he): 61.61 cm x 17.5 cm x 45.22 cm - mit Fu\u00df\nGewicht: 3.3 kg\nSchnittstellen: HDMI 2.0 \u00a6 VGA \u00a6 Audio Line-Out\nEinstellungen der Anzeigeposition: Neigung\nNeigungswinkel: -5/+15\nLeistungsmerkmale: Slot f\u00fcr Sicherheitsschloss (Kabelschloss getrennt erh\u00e4ltlich)\nEnthaltene Kabel: 1 x HDMI-Kabel\nKennzeichnung: MPR II\nSchlosstyp zur Diebstahlsicherung: Kensington Slot\nStromverbrauch SDR (eingeschaltet): 17 kWh/1.000 h\nStromverbrauch HDR (eingeschaltet): 24 kWh/1.000 h\nMitgelieferte Software: Acer Display Widget\nDetails zu Abmessungen & Gewicht: Mit Fu\u00df - Breite: 61.61 cm - Tiefe: 17.5 cm - H\u00f6he: 45.22 cm - Gewicht: 3.3 kg \u00a6 Ohne Fu\u00df - Breite: 61.61 cm - Tiefe: 3.87 cm - H\u00f6he: 36.42 cm - Gewicht: 3.1 kg\nTransportbreite: 68.9 cm\nTransporttiefe: 10.9 cm\nTransporth\u00f6he: 44.8 cm\nTransportgewicht: 4.75 kg",
    "reference_file": "offer_reference_142.json",
    "shop_name": "TaufNaus"
}