{
    "html_file": "offer_2475_15.html",
    "name": "Eizo ColorEdge CG2420, 24\"",
    "offer_link": "https://www.ditech.at/details.php?artnr=223561",
    "price": 1266.9,
    "raw_specifications": {
        "Abmessungen (BxHxT)": "554x551x245mm (mit Standfu\u00df),  keine Angabe (ohne Standfu\u00df)",
        "Abmessungen - Breite": "554mm",
        "Abmessungen - H\u00f6he": "551mm",
        "Abmessungen - Tiefe": "245 (mit standfu\u00df),  keine angabe (ohne standfu\u00df)mm",
        "Anschl\u00fcsse - DVI": "1",
        "Anschl\u00fcsse - DisplayPort 1.1": "1",
        "Anschl\u00fcsse - HDMI 1.4": "1",
        "Anwendung": "station\u00e4r",
        "Audio": "N/A",
        "Aufl\u00f6sung": "1920x1200",
        "Beschichtung": "matt (non-glare)",
        "Besonderheiten": "Blendschutzhaube,  mechanische Tasten,  Hardware-Kalibrierung (16bit LUT),  Colorimeter (Eizo SelfCalibration)",
        "Bildwiederholfrequenz": "60Hz",
        "Blickwinkel": "178\u00b0/178\u00b0",
        "Diagonale": "24\"/61cm",
        "Energieeffizienzklasse alt (A+++ bis D)": "A",
        "Energieeffizienzklasse alt (A+++ bis G)": "A",
        "Energieverbrauch SDR": "21kWh/1000h",
        "Ergonomie": "155mm (h\u00f6henverstellbar),  90\u00b0 (Pivot),  \u00b1172\u00b0 (drehbar),  +35\u00b0/-5\u00b0 (neigbar),  keine Angabe (Schr\u00e4glage)",
        "FRC": "ja (8bit+2bit)",
        "Farbe": "schwarz",
        "Farbraum - Adobe RGB": "99%",
        "Farbraum - DCI-P3": "98%",
        "Farbraum - sRGB": "100%",
        "Farbtiefe": "10bit (1.07 Mrd. Farben)",
        "Form": "gerade (flat)",
        "Gewicht": "7.80kg (mit Standfu\u00df),  keine Angabe (ohne Standfu\u00df)",
        "HDR": "N/A",
        "Helligkeit": "400cd/m\u00b2",
        "Herstellergarantie": "f\u00fcnf Jahre (Vor-Ort)",
        "Hintergrundbeleuchtung": "White-LED",
        "Jahresverbrauch alt (A+++ bis D)": "33.58kWh",
        "Jahresverbrauch alt (A+++ bis G)": "33.58kWh",
        "Kontrast - statisch": "1.500:1",
        "Leistungsaufnahme": "79W (maximal),  20W (typisch),  23W (Energielabel alt A+++ bis G),  0.6W (Standby)",
        "Panel": "IPS",
        "Panel-Hersteller": "Panasonic (VVX24F152H00)",
        "Reaktionszeit - GtG": "10ms",
        "Screen-to-Body-Ratio": "keine Angabe (berechnet)",
        "Seitenverh\u00e4ltnis": "16:10",
        "Signalfrequenz": "15-78kHz (horizontal),  24-61Hz (vertikal)",
        "Stromversorgung": "AC-In (internes Netzteil)",
        "USB-Hub In": "1x USB-B 3.0",
        "USB-Hub Out": "3x USB-A 3.0",
        "USB-Schreibweise": "Link",
        "VESA": "100x100 (belegt)",
        "VRR (Variable Refresh Rate)": "N/A",
        "Weitere Anschl\u00fcsse": "N/A"
    },
    "raw_specifications_text": "Abmessungen - Breite: 554mm\nAbmessungen - H\u00f6he: 551mm\nAbmessungen - Tiefe: 245 (mit standfu\u00df),  keine angabe (ohne standfu\u00df)mm\nAbmessungen (BxHxT): 554x551x245mm (mit Standfu\u00df),  keine Angabe (ohne Standfu\u00df)\nAnschl\u00fcsse - DisplayPort 1.1: 1\nAnschl\u00fcsse - DVI: 1\nAnschl\u00fcsse - HDMI 1.4: 1\nAnwendung: station\u00e4r\nAudio: N/A\nAufl\u00f6sung: 1920x1200\nBeschichtung: matt (non-glare)\nBesonderheiten: Blendschutzhaube,  mechanische Tasten,  Hardware-Kalibrierung (16bit LUT),  Colorimeter (Eizo SelfCalibration)\nBildwiederholfrequenz: 60Hz\nBlickwinkel: 178\u00b0/178\u00b0\nDiagonale: 24\"/61cm\nEnergieeffizienzklasse alt (A+++ bis D): A\nEnergieeffizienzklasse alt (A+++ bis G): A\nEnergieverbrauch SDR: 21kWh/1000h\nErgonomie: 155mm (h\u00f6henverstellbar),  90\u00b0 (Pivot),  \u00b1172\u00b0 (drehbar),  +35\u00b0/-5\u00b0 (neigbar),  keine Angabe (Schr\u00e4glage)\nFarbe: schwarz\nFarbraum - Adobe RGB: 99%\nFarbraum - DCI-P3: 98%\nFarbraum - sRGB: 100%\nFarbtiefe: 10bit (1.07 Mrd. Farben)\nForm: gerade (flat)\nFRC: ja (8bit+2bit)\nGewicht: 7.80kg (mit Standfu\u00df),  keine Angabe (ohne Standfu\u00df)\nHDR: N/A\nHelligkeit: 400cd/m\u00b2\nHerstellergarantie: f\u00fcnf Jahre (Vor-Ort)\nHintergrundbeleuchtung: White-LED\nJahresverbrauch alt (A+++ bis D): 33.58kWh\nJahresverbrauch alt (A+++ bis G): 33.58kWh\nKontrast - statisch: 1.500:1\nLeistungsaufnahme: 79W (maximal),  20W (typisch),  23W (Energielabel alt A+++ bis G),  0.6W (Standby)\nPanel: IPS\nPanel-Hersteller: Panasonic (VVX24F152H00)\nReaktionszeit - GtG: 10ms\nScreen-to-Body-Ratio: keine Angabe (berechnet)\nSeitenverh\u00e4ltnis: 16:10\nSignalfrequenz: 15-78kHz (horizontal),  24-61Hz (vertikal)\nStromversorgung: AC-In (internes Netzteil)\nUSB-Hub In: 1x USB-B 3.0\nUSB-Hub Out: 3x USB-A 3.0\nUSB-Schreibweise: Link\nVESA: 100x100 (belegt)\nVRR (Variable Refresh Rate): N/A\nWeitere Anschl\u00fcsse: N/A",
    "reference_file": "offer_reference_2475.json",
    "shop_name": "DiTech.at"
}