{
    "html_file": "offer_676_2.html",
    "name": "Philips Evnia 5000 32M1C5500VL, 31.5\"",
    "offer_link": "https://www.proshop.at/Bildschirm/Philips-32-Bildschirm-Momentum-5000-32M1C5500VL-LED-monitor-curved-QHD-32-HDR-Black-1-ms/3121706?utm_source=geizhals&utm_medium=cpc&utm_campaign=pricesite",
    "price": 266.92,
    "raw_specifications": {
        "Abmessungen (Breite x Tiefe x H\u00f6he)": "70.9 cm x 23.9 cm x 52.7 cm - mit Fu\u00df",
        "Abmessungen (Breite x Tiefe x H\u00f6he) - mit Fu\u00df": "70.9 cm x 23.9 cm x 52.7 cm",
        "Besonderheiten": "SmartImage Game, Mega Infinity Dynamic Contrast Ratio, flimmerfreie Technologie, Crystal Clear UltraWide QHD, Adaptive-Sync-Technologie, breiter Betrachtungswinkel, Niedrige Eingangsverz\u00f6gerung, EasyRead, SmartImage HDR, LowBlue Mode",
        "Bildschirmbeschichtung": "Blendfrei, 3H Hard Coating, Haze 25 %",
        "Bildschirmtyp": "VA",
        "Details zu Abmessungen & Gewicht": "Mit Fu\u00df - Breite: 70.9 cm - Tiefe: 23.9 cm - H\u00f6he: 52.7 cm - Gewicht: 7.83 kg  Ohne Fu\u00df - Breite: 70.9 cm - Tiefe: 9.5 cm - H\u00f6he: 42.3 cm - Gewicht: 6.37 kg",
        "Diagonalabmessung": "81.3 cm (32\")",
        "Display-Typ": "LED-hintergrundbeleuchteter LCD-Monitor / TFT-Aktivmatrix",
        "EAN": "8712581795962",
        "Eingangsanschl\u00fcsse": "2xHDMI, DisplayPort",
        "Eingangsspannung": "Wechselstrom 100-240 V (50/60 Hz)",
        "Einstellungen der Anzeigeposition": "Neigung",
        "Energie Effizienzklasse": "Klasse F",
        "Energieklasse (HDR)": "Klasse G",
        "Enthaltene Kabel": "1 x DisplayPort-Kabel  1 x HDMI-Kabel",
        "Erforderliches Betriebssystem": "Apple MacOS X, Microsoft Windows 7 / 8 / 8.1 / 10 / 11",
        "Farbe": "Textured Black",
        "Farbraum": "102.1% NTSC (CIE 1976), 121.6 % sRGB (CIE 1931)",
        "Farbunterst\u00fctzung": "16,7 Millionen Farben",
        "Gaming": "Ja",
        "Ger\u00e4tetyp": "LED-hintergrundbeleuchteter LCD-Monitor - 81.3 cm (32\")",
        "Geschwungener Bildschirm": "Ja (1500R)",
        "Gewicht": "7.83 kg",
        "HDR-Format": "HDR10",
        "HDR-f\u00e4hig": "HDR10",
        "Helligkeit": "250 cd/m\u00b2",
        "Hersteller": "Philips",
        "Hintergrundbeleuchtungs-Technologie": "WLED",
        "Horizontale Bildwiederholrate": "30 - 250 kHz",
        "Horizontaler Betrachtungswinkel": "178",
        "Kennzeichnung": "Plug and Play, FCC Klasse B bescheinigt, TUV, ICES-003, CB, ISO 9241-307, TUV Bauart, CU-EAC, BFR-frei, HDCP 2.2, HDCP 1.4, PVC-free, quecksilberfrei, EAEU RoHS",
        "Kontrast": "3000:1",
        "Leistungsmerkmale": "Slot f\u00fcr Sicherheitsschloss (Kabelschloss getrennt erh\u00e4ltlich)",
        "MTBF": "50,000 Stunde(n)",
        "Modell": "32M1C5500VL/00",
        "Native Aufl\u00f6sung": "QHD 2560 x 1440 (DisplayPort: 165 Hz, HDMI: 144 Hz)",
        "Neigungswinkel": "-5/+20",
        "OSD-Sprachen": "Ungarisch, Tschechisch, Chinesisch (tradionell), Chinesisch (vereinfacht), Ukrainisch, Brasilianisches Portugiesisch, Englisch, Deutsch, Franz\u00f6sisch, Italienisch, Portugiesisch, Polnisch, Finnisch, Schwedisch, Russisch, Spanisch, Holl\u00e4ndisch, Griechisch, T\u00fcrkisch, Japanisch, Koreanisch",
        "Pixelpitch": "0.2724 mm",
        "Ppi": "93.24",
        "Produktbeschreibung": "Philips Momentum 5000 32M1C5500VL - LED-Monitor - gebogen - QHD - 81.3 cm (32\") - HDR",
        "Reaktionszeit": "4 ms (gray-to-gray), 1 ms (MPRT)",
        "Schlosstyp zur Diebstahlsicherung": "Kensington Slot",
        "Schnittstellen": "2 x HDMI (HDCP 2.2)  DisplayPort 1.4 (HDCP 2.2)",
        "Seitenverh\u00e4ltnis": "16:9",
        "Sichtbare Bildfl\u00e4che": "80 cm (31.5\")",
        "Spannung": "Wechselstrom 100-240 V (50/60 Hz)",
        "Stromverbrauch (Aus-Modus)": "0.3 Watt",
        "Stromverbrauch (typisch)": "45.1 Watt",
        "Stromverbrauch HDR (eingeschaltet)": "57 kWh/1.000 h",
        "Stromverbrauch SDR (eingeschaltet)": "32 kWh/1.000 h",
        "Stromverbrauch im Standby-Modus": "0.5 Watt",
        "Transportbreite": "78.2 cm",
        "Transportgewicht": "10.36 kg",
        "Transporth\u00f6he": "52.3 cm",
        "Transporttiefe": "22.7 cm",
        "VESA-Halterung": "100 x 100 mm",
        "Vertikale Bildwiederholrate": "48 - 144 Hz",
        "Vertikaler Betrachtungswinkel": "178",
        "Waren-Nr.": "3121706",
        "Zum Hersteller": "www.philips.com"
    },
    "raw_specifications_text": "Hersteller: Philips\nWaren-Nr.: 3121706\nModell: 32M1C5500VL/00\nEAN: 8712581795962\nZum Hersteller: www.philips.com\nProduktbeschreibung: Philips Momentum 5000 32M1C5500VL - LED-Monitor - gebogen - QHD - 81.3 cm (32\") - HDR\nGer\u00e4tetyp: LED-hintergrundbeleuchteter LCD-Monitor - 81.3 cm (32\")\nEnergie Effizienzklasse: Klasse F\nGeschwungener Bildschirm: Ja (1500R)\nBildschirmtyp: VA\nSeitenverh\u00e4ltnis: 16:9\nNative Aufl\u00f6sung: QHD 2560 x 1440 (DisplayPort: 165 Hz, HDMI: 144 Hz)\nPixelpitch: 0.2724 mm\nHelligkeit: 250 cd/m\u00b2\nKontrast: 3000:1\nHDR-f\u00e4hig: HDR10\nReaktionszeit: 4 ms (gray-to-gray), 1 ms (MPRT)\nGaming: Ja\nFarbunterst\u00fctzung: 16,7 Millionen Farben\nFarbraum: 102.1% NTSC (CIE 1976), 121.6 % sRGB (CIE 1931)\nEingangsanschl\u00fcsse: 2xHDMI, DisplayPort\nEinstellungen der Anzeigeposition: Neigung\nBildschirmbeschichtung: Blendfrei, 3H Hard Coating, Haze 25 %\nSpannung: Wechselstrom 100-240 V (50/60 Hz)\nFarbe: Textured Black\nAbmessungen (Breite x Tiefe x H\u00f6he) - mit Fu\u00df: 70.9 cm x 23.9 cm x 52.7 cm\nGewicht: 7.83 kg\nKennzeichnung: Plug and Play, FCC Klasse B bescheinigt, TUV, ICES-003, CB, ISO 9241-307, TUV Bauart, CU-EAC, BFR-frei, HDCP 2.2, HDCP 1.4, PVC-free, quecksilberfrei, EAEU RoHS\nDisplay-Typ: LED-hintergrundbeleuchteter LCD-Monitor / TFT-Aktivmatrix\nEnergieklasse (HDR): Klasse G\nDiagonalabmessung: 81.3 cm (32\")\nSichtbare Bildfl\u00e4che: 80 cm (31.5\")\nPpi: 93.24\nHDR-Format: HDR10\nVertikale Bildwiederholrate: 48 - 144 Hz\nHorizontale Bildwiederholrate: 30 - 250 kHz\nHorizontaler Betrachtungswinkel: 178\nVertikaler Betrachtungswinkel: 178\nHintergrundbeleuchtungs-Technologie: WLED\nOSD-Sprachen: Ungarisch, Tschechisch, Chinesisch (tradionell), Chinesisch (vereinfacht), Ukrainisch, Brasilianisches Portugiesisch, Englisch, Deutsch, Franz\u00f6sisch, Italienisch, Portugiesisch, Polnisch, Finnisch, Schwedisch, Russisch, Spanisch, Holl\u00e4ndisch, Griechisch, T\u00fcrkisch, Japanisch, Koreanisch\nBesonderheiten: SmartImage Game, Mega Infinity Dynamic Contrast Ratio, flimmerfreie Technologie, Crystal Clear UltraWide QHD, Adaptive-Sync-Technologie, breiter Betrachtungswinkel, Niedrige Eingangsverz\u00f6gerung, EasyRead, SmartImage HDR, LowBlue Mode\nAbmessungen (Breite x Tiefe x H\u00f6he): 70.9 cm x 23.9 cm x 52.7 cm - mit Fu\u00df\nSchnittstellen: 2 x HDMI (HDCP 2.2)  DisplayPort 1.4 (HDCP 2.2)\nNeigungswinkel: -5/+20\nVESA-Halterung: 100 x 100 mm\nLeistungsmerkmale: Slot f\u00fcr Sicherheitsschloss (Kabelschloss getrennt erh\u00e4ltlich)\nEnthaltene Kabel: 1 x DisplayPort-Kabel  1 x HDMI-Kabel\nMTBF: 50,000 Stunde(n)\nSchlosstyp zur Diebstahlsicherung: Kensington Slot\nEingangsspannung: Wechselstrom 100-240 V (50/60 Hz)\nStromverbrauch SDR (eingeschaltet): 32 kWh/1.000 h\nStromverbrauch HDR (eingeschaltet): 57 kWh/1.000 h\nStromverbrauch (typisch): 45.1 Watt\nStromverbrauch im Standby-Modus: 0.5 Watt\nStromverbrauch (Aus-Modus): 0.3 Watt\nErforderliches Betriebssystem: Apple MacOS X, Microsoft Windows 7 / 8 / 8.1 / 10 / 11\nDetails zu Abmessungen & Gewicht: Mit Fu\u00df - Breite: 70.9 cm - Tiefe: 23.9 cm - H\u00f6he: 52.7 cm - Gewicht: 7.83 kg  Ohne Fu\u00df - Breite: 70.9 cm - Tiefe: 9.5 cm - H\u00f6he: 42.3 cm - Gewicht: 6.37 kg\nTransportbreite: 78.2 cm\nTransporttiefe: 22.7 cm\nTransporth\u00f6he: 52.3 cm\nTransportgewicht: 10.36 kg",
    "reference_file": "offer_reference_676.json",
    "shop_name": "Proshop.at"
}