{
    "html_file": "offer_164_14.html",
    "name": "Eizo ColorEdge CS2400S-LE (Limited Edition), 24.1\"",
    "offer_link": "https://www.amazon.de/dp/B0BTLSD1RX?linkCode=xm2&camp=2025&creative=165953&smid=A3JWKAKR8XB7XF&creativeASIN=B0BTLSD1RX&tag=geizhals1-21",
    "price": 592.93,
    "raw_specifications": {
        "ASIN": "B0BTLSD1RX",
        "Amazon Bestseller-Rang": "Nr. 50,715 in Computer & Zubeh\u00f6r (Siehe Top 100 in Computer & Zubeh\u00f6r)  Nr. 977 in Monitore",
        "Anzahl HDMI Schnittstellen": "\u200e1",
        "Artikelgewicht": "\u200e8,2 Kilograms",
        "Batterien enthalten": "\u200eNein",
        "Bildschirmaufl\u00f6sung": "\u200e1920 x 1200 Pixel",
        "Display-Gr\u00f6\u00dfe": "\u200e24,1 Zoll",
        "Durchschnittliche Kundenbewertung": "5,0  5,0 von 5 Sternen    \n    2 Sternebewertungen   \n\n\n 5,0 von 5 Sternen",
        "Farbe": "\u200eschwarz",
        "Garantierte Software-Updates bis": "\u200eunbekannt",
        "Hardware Plattform": "\u200eNot Machine Specific",
        "Hersteller": "\u200eEIZO",
        "Im Angebot von Amazon.de seit": "21. Juni 2023",
        "L\u00f6sung": "\u200e1921 x 1200 Pixels",
        "Marke": "\u200eEIZO",
        "Modell/Serie": "\u200eCS2400S-LE",
        "Modellnummer": "\u200eCS2400S-LE",
        "Produktabmessungen": "\u200e24,5 x 55,4 x 55,1 cm; 8,2 Kilogramm",
        "Prozessortyp": "\u200eOthers"
    },
    "raw_specifications_text": "Marke: \u200eEIZO\nHersteller: \u200eEIZO\nModell/Serie: \u200eCS2400S-LE\nProduktabmessungen: \u200e24,5 x 55,4 x 55,1 cm; 8,2 Kilogramm\nModellnummer: \u200eCS2400S-LE\nFarbe: \u200eschwarz\nDisplay-Gr\u00f6\u00dfe: \u200e24,1 Zoll\nBildschirmaufl\u00f6sung: \u200e1920 x 1200 Pixel\nL\u00f6sung: \u200e1921 x 1200 Pixels\nProzessortyp: \u200eOthers\nAnzahl HDMI Schnittstellen: \u200e1\nHardware Plattform: \u200eNot Machine Specific\nBatterien enthalten: \u200eNein\nArtikelgewicht: \u200e8,2 Kilograms\nGarantierte Software-Updates bis: \u200eunbekannt\nASIN: B0BTLSD1RX\nDurchschnittliche Kundenbewertung: 5,0  5,0 von 5 Sternen    \n    2 Sternebewertungen   \n\n\n 5,0 von 5 Sternen\nAmazon Bestseller-Rang: Nr. 50,715 in Computer & Zubeh\u00f6r (Siehe Top 100 in Computer & Zubeh\u00f6r)  Nr. 977 in Monitore\nIm Angebot von Amazon.de seit: 21. Juni 2023",
    "reference_file": "offer_reference_164.json",
    "shop_name": "Amazon.at"
}