{
    "html_file": "offer_1404_12.html",
    "name": "GIGABYTE M28U, 28\"",
    "offer_link": "https://www.csv-direct.de/artinfo.php?artnr=A1621181&KATEGORIE=162&pva=geizhals2",
    "price": 596.12,
    "raw_specifications": {
        "AC Eingangsfrequenz": "50 - 60 Hz",
        "AC Eingangsspannung": "100 - 240 V",
        "AMD FreeSync-Typ": "FreeSync Premium Pro",
        "Anzahl DisplayPort Anschl\u00fcsse": "1",
        "Anzahl HDMI-Anschl\u00fcsse": "2",
        "Anzahl der Farben des Displays": "16,7 Millionen Farben",
        "Anzahl der Lautsprecher": "2",
        "Anzahl der Upstream-Ports USB Typ-C": "1",
        "Anzahl der nachgeschalteten Steckpl\u00e4tze vom Typ USB-A": "3",
        "Anzahl der vorgeschalteten Steckpl\u00e4tze": "1",
        "Betriebstemperatur": "0 - 40 \u00b0C",
        "Bildschirmdiagonale": "71,1 cm 28\"",
        "Bildschirmform": "Flach",
        "Bildschirmtechnologie": "LED",
        "Bildwinkel, horizontal": "178\u00b0",
        "Bildwinkel, vertikal": "178\u00b0",
        "Breite ohne Standfu\u00df": "636,5 mm",
        "Display-Aufl\u00f6sung": "3840 x 2160 Pixel",
        "DisplayPorts-Version": "1.4",
        "Energieeffizienzklasse HDR": "G",
        "Energieeffizienzklasse SDR": "G",
        "Energieeffizienzskala": "A bis G",
        "Energieverbrauch HDR pro 1.000 Stunden": "53 kWh",
        "Energieverbrauch SDR pro 1.000 Stunden": "33 kWh",
        "Farbskala": "94",
        "Farbtiefe": "8 Bit",
        "Fu\u00dffarbe": "Schwarz",
        "Ger\u00e4tebreite inkl. Fu\u00df": "636,5 mm",
        "Ger\u00e4teh\u00f6he inkl. Fu\u00df": "534,2 mm",
        "Ger\u00e4tetiefe inkl. Fu\u00df": "193,6 mm",
        "Gewicht mit St\u00e4nder": "6,93 kg",
        "Gewicht ohne St\u00e4nder": "5,18 kg",
        "HD-Typ": "4K Ultra HD",
        "HDMI-Version": "2.1",
        "Helligkeit typisch": "300 cd/m\u00b2",
        "H\u00f6he ohne Standfu\u00df": "372,3 mm",
        "H\u00f6heneinstellung": "13 cm",
        "Integrierte Kamera": "Nein",
        "Kontrastverh\u00e4ltnis": "1000:1",
        "Marktpositionierung": "Gaming",
        "Maximale Bildwiederholrate": "144 Hz",
        "Mitgelieferte Kabel": "AC, DisplayPort, HDMI, USB",
        "NVIDIA G-SYNC": "Nein",
        "Natives Seitenverh\u00e4ltnis": "16:9",
        "Neigungswinkelbereich": "-5 - 20\u00b0",
        "Paketgewicht": "9,7 kg",
        "Panel-Montage-Schnittstelle": "100 x 100 mm",
        "Panel-Typ": "SS-IPS",
        "Pixel Abstand": "0,16 x 0,16 mm",
        "Produktfarbe": "Schwarz",
        "RGB-Farbraum": "DCI-P3",
        "RMS-Leistung": "6 W",
        "Reaktionszeit": "1 ms",
        "Sichtbare Gr\u00f6\u00dfe horizontal": "63,2 cm",
        "Sichtbare Gr\u00f6\u00dfe vertikal": "36 cm",
        "Slot-Typ Kabelsperre": "Kensington",
        "Stromverbrauch PowerSave": "0,5 W",
        "Stromverbrauch Standby": "0,5 W",
        "Stromverbrauch aus": "0,3 W",
        "Stromverbrauch max.": "115 W",
        "Technologie mit hohem Dynamikbereich HDR": "High Dynamic Range HDR 400",
        "Tiefe ohne Standfu\u00df": "63,1 mm",
        "Touchscreen": "Nein",
        "Typ der Hintergrundbeleuchtung": "Seiten-LED",
        "USB-Hub-Version": "3.2 Gen 1 3.1 Gen 1",
        "USB-Upstream-Porttyp": "USB Typ-B",
        "Unterst\u00fctzte Grafik-Aufl\u00f6sungen": "640 x 480 VGA, 720 x 480, 800 x 600 SVGA, 1024 x 768 XGA, 1280 x 720 HD 720, 1920 x 1080 HD 1080, 2560 x 1440, 3840 x 2160",
        "Verpackungsbreite": "890 mm",
        "Verpackungsh\u00f6he": "510 mm",
        "Verpackungstiefe": "148 mm",
        "Warentarifnummer HS": "85285210",
        "sRGB Abdeckung klassisch": "120"
    },
    "raw_specifications_text": "Bildschirmdiagonale: 71,1 cm 28\"\nDisplay-Aufl\u00f6sung: 3840 x 2160 Pixel\nNatives Seitenverh\u00e4ltnis: 16:9\nBildschirmtechnologie: LED\nTouchscreen: Nein\nHD-Typ: 4K Ultra HD\nPanel-Typ: SS-IPS\nBildschirmform: Flach\nKontrastverh\u00e4ltnis: 1000:1\nMaximale Bildwiederholrate: 144 Hz\nAnzahl der Farben des Displays: 16,7 Millionen Farben\nTyp der Hintergrundbeleuchtung: Seiten-LED\nHelligkeit typisch: 300 cd/m\u00b2\nReaktionszeit: 1 ms\nUnterst\u00fctzte Grafik-Aufl\u00f6sungen: 640 x 480 VGA, 720 x 480, 800 x 600 SVGA, 1024 x 768 XGA, 1280 x 720 HD 720, 1920 x 1080 HD 1080, 2560 x 1440, 3840 x 2160\nBildwinkel, horizontal: 178\u00b0\nBildwinkel, vertikal: 178\u00b0\nPixel Abstand: 0,16 x 0,16 mm\nSichtbare Gr\u00f6\u00dfe horizontal: 63,2 cm\nSichtbare Gr\u00f6\u00dfe vertikal: 36 cm\nTechnologie mit hohem Dynamikbereich HDR: High Dynamic Range HDR 400\nFarbtiefe: 8 Bit\nRGB-Farbraum: DCI-P3\nFarbskala: 94\nsRGB Abdeckung klassisch: 120\nNVIDIA G-SYNC: Nein\nAMD FreeSync-Typ: FreeSync Premium Pro\nIntegrierte Kamera: Nein\nAnzahl der Lautsprecher: 2\nRMS-Leistung: 6 W\nMarktpositionierung: Gaming\nProduktfarbe: Schwarz\nFu\u00dffarbe: Schwarz\nUSB-Hub-Version: 3.2 Gen 1 3.1 Gen 1\nUSB-Upstream-Porttyp: USB Typ-B\nAnzahl der vorgeschalteten Steckpl\u00e4tze: 1\nAnzahl der Upstream-Ports USB Typ-C: 1\nAnzahl der nachgeschalteten Steckpl\u00e4tze vom Typ USB-A: 3\nAnzahl HDMI-Anschl\u00fcsse: 2\nHDMI-Version: 2.1\nAnzahl DisplayPort Anschl\u00fcsse: 1\nDisplayPorts-Version: 1.4\nPanel-Montage-Schnittstelle: 100 x 100 mm\nSlot-Typ Kabelsperre: Kensington\nH\u00f6heneinstellung: 13 cm\nNeigungswinkelbereich: -5 - 20\u00b0\nEnergieeffizienzklasse SDR: G\nEnergieeffizienzklasse HDR: G\nEnergieverbrauch SDR pro 1.000 Stunden: 33 kWh\nEnergieverbrauch HDR pro 1.000 Stunden: 53 kWh\nStromverbrauch Standby: 0,5 W\nStromverbrauch max.: 115 W\nStromverbrauch aus: 0,3 W\nStromverbrauch PowerSave: 0,5 W\nAC Eingangsspannung: 100 - 240 V\nAC Eingangsfrequenz: 50 - 60 Hz\nEnergieeffizienzskala: A bis G\nBetriebstemperatur: 0 - 40 \u00b0C\nMitgelieferte Kabel: AC, DisplayPort, HDMI, USB\nGer\u00e4tebreite inkl. Fu\u00df: 636,5 mm\nGer\u00e4tetiefe inkl. Fu\u00df: 193,6 mm\nGer\u00e4teh\u00f6he inkl. Fu\u00df: 534,2 mm\nGewicht mit St\u00e4nder: 6,93 kg\nBreite ohne Standfu\u00df: 636,5 mm\nTiefe ohne Standfu\u00df: 63,1 mm\nH\u00f6he ohne Standfu\u00df: 372,3 mm\nGewicht ohne St\u00e4nder: 5,18 kg\nVerpackungsbreite: 890 mm\nVerpackungstiefe: 148 mm\nVerpackungsh\u00f6he: 510 mm\nPaketgewicht: 9,7 kg\nWarentarifnummer HS: 85285210",
    "reference_file": "offer_reference_1404.json",
    "shop_name": "CSV-Direct.de"
}