{
    "html_file": "offer_2311_0.html",
    "name": "iiyama G-Master GB2560HSU-B1 Red Eagle, 24.5\"",
    "offer_link": "https://www.mylemon.at/artikel/iiyama/gb2560hsu_b1/62-2cm-24-5-gb2560hsu.html",
    "price": 174.48,
    "raw_specifications": {
        "AC Eingangsfrequenz": "50 - 60 Hz",
        "AC Eingangsspannung": "100 - 240 V",
        "AMD FreeSync": "Ja",
        "AMD FreeSync-Typ": "FreeSync",
        "Abnehmbarer Standfu\u00df": "Ja",
        "Anzahl DisplayPort Anschl\u00fcsse": "1",
        "Anzahl HDMI-Anschl\u00fcsse": "1",
        "Anzahl OSD-Sprachen": "10",
        "Anzahl der Farben des Displays": "16,78 Millionen Farben",
        "Anzahl der Lautsprecher": "2",
        "Anzahl der nachgeschalteten Steckpl\u00e4tze vom Typ USB-A": "2",
        "Artikelnummer": "MSZYBOL",
        "Aufl\u00f6sung": "1920x1080",
        "Au\u00dfenverkleidungstyp": "Matt",
        "Besonderheiten": "144 Hz, Lautsprecher, USB HUB",
        "Bildschirmdiagonale": "62,2 cm (24.5 Zoll)",
        "Bildschirmform": "Flach",
        "Bildschirmtechnologie": "LED",
        "Bildwinkel, horizontal": "170\u00b0",
        "Bildwinkel, vertikal": "160\u00b0",
        "Breite (ohne Standfu\u00df)": "55,8 cm",
        "DVI Anschluss": "Nein",
        "Display": "LED",
        "Display-Aufl\u00f6sung": "1920 x 1080 Pixel",
        "Display-Oberfl\u00e4che": "Matt",
        "Displaygr\u00f6\u00dfe": "24,5 Zoll",
        "EAN": "4948570116294",
        "ECO-Modus": "Ja",
        "Eingebaute Lautsprecher": "Ja",
        "Eingebauter Ethernet-Anschluss": "Nein",
        "Energieeffizienzklasse (SDR)": "F",
        "Energieeffizienzskala": "A bis G",
        "Energieverbrauch (SDR) pro 1.000 Stunden": "21 kWh",
        "Ergonomie": "H\u00f6henverstellbar, Pivot (90 Grad drehbar), Schwenkbar, Neigbar",
        "Flimmerfreie Technologie": "Ja",
        "Ger\u00e4tebreite (inkl. Fu\u00df)": "557,5 mm",
        "Ger\u00e4teh\u00f6he (inkl. Fu\u00df)": "380 mm",
        "Ger\u00e4tetiefe (inkl. Fu\u00df)": "230 mm",
        "Gewicht (mit St\u00e4nder)": "5,6 kg",
        "HD-Typ": "Full HD",
        "HDCP": "Ja",
        "HDMI": "Ja",
        "Helligkeit": "400 cd/m\u00b2",
        "Helligkeit (typisch)": "400 cd/m\u00b2",
        "Hersteller Artikelnummer": "GB2560HSU-B1",
        "Horizontaler Scanbereich": "30 - 222 kHz",
        "H\u00f6heneinstellung": "13 cm",
        "H\u00f6henverstellung": "Ja",
        "Integrierte Kamera": "Nein",
        "Integrierter Kartenleser": "Nein",
        "Integrierter USB-Hub": "Ja",
        "Kabelsperre-Slot": "Ja",
        "Kein Flimmern": "Ja",
        "Kontrastverh\u00e4ltnis": "1000:1",
        "Kontrastverh\u00e4ltnis (dynamisch)": "80000000:1",
        "Kopfh\u00f6rerausgang": "Ja",
        "Kopfh\u00f6rerausg\u00e4nge": "1",
        "LED-Anzeigen": "Ja",
        "Low-Blue-Light-Technologie": "Ja",
        "Marktpositionierung": "Gaming",
        "Maximale Bildwiederholrate": "144 Hz",
        "Men\u00fcsprachen": "Tschechisch, Deutsch, Niederl\u00e4ndisch, Englisch, Spanisch, Franz\u00f6sisch, Italienisch, Japanisch, Polnisch, Russisch",
        "Mitgelieferte Kabel": "AC, HDMI, USB",
        "NTSC Abdeckung (typisch)": "72%",
        "Nachhaltigkeitskonformit\u00e4t": "Ja",
        "Nachhaltigkeitszertifikate": "CE, ErP, REACH, RoHS",
        "Natives Seitenverh\u00e4ltnis": "16:9",
        "Neigungsverstellung": "Ja",
        "Neigungswinkelbereich": "-5 - 22\u00b0",
        "On-Screen-Display (OSD)": "Ja",
        "Panel": "TN",
        "Panel-Montage-Schnittstelle": "100 x 100 mm",
        "Panel-Typ": "TN",
        "Pivot": "Ja",
        "Pivot Winkel": "0 - 90\u00b0",
        "Pixel Abstand": "0,283 x 0,283 mm",
        "Produktfarbe": "Schwarz",
        "RMS-Leistung": "4 W",
        "Reaktionszeit": "1 ms",
        "Schnellstart\u00fcbersicht": "Ja",
        "Schwenkbar": "Ja",
        "Schwenkwinkelbereich": "-45 - 45\u00b0",
        "Sichtbare Gr\u00f6\u00dfe (diagonal)": "62 cm",
        "Sichtbare Gr\u00f6\u00dfe (horizontal)": "54,4 cm",
        "Sichtbare Gr\u00f6\u00dfe (vertikal)": "30,3 cm",
        "Slot-Typ Kabelsperre": "Kensington",
        "Spiel-Modus": "Ja",
        "Stromverbrauch (Standardbetrieb)": "21 W",
        "Stromverbrauch (Standby)": "0,32 W",
        "Stromverbrauch (aus)": "0,26 W",
        "Stromversorgungsfunktionen - Beschreibung": "Ja",
        "St\u00e4nder enthalten": "Ja",
        "Thin Client installiert": "Nein",
        "Touchscreen": "Nein",
        "Typ der Hintergrundbeleuchtung": "LED",
        "USB-Hub-Version": "2.0",
        "VESA Adaptive Sync unterst\u00fctzt": "Ja",
        "VESA Halterung": "100x100 mm",
        "VESA-Halterung": "Ja",
        "Vertikaler Scanbereich": "30 - 144 Hz",
        "Video Anschl\u00fcsse": "1x HDMI, 1x DisplayPort",
        "Warentarifnummer (HS)": "85285210",
        "Zertifizierung": "CE, T\u00dcV-GS, RoHS, WEEE, CU",
        "sRGB Abdeckung (klassisch)": "99%"
    },
    "raw_specifications_text": "Displaygr\u00f6\u00dfe: 24,5 Zoll\nAufl\u00f6sung: 1920x1080\nPanel: TN\nReaktionszeit: 1 ms\nVideo Anschl\u00fcsse: 1x HDMI, 1x DisplayPort\nErgonomie: H\u00f6henverstellbar, Pivot (90 Grad drehbar), Schwenkbar, Neigbar\nVESA Halterung: 100x100 mm\nHelligkeit: 400 cd/m\u00b2\nBesonderheiten: 144 Hz, Lautsprecher, USB HUB\nHersteller Artikelnummer: GB2560HSU-B1\nEAN: 4948570116294\nArtikelnummer: MSZYBOL\nBildschirmdiagonale: 62,2 cm (24.5 Zoll)\nDisplay-Aufl\u00f6sung: 1920 x 1080 Pixel\nNatives Seitenverh\u00e4ltnis: 16:9\nBildschirmtechnologie: LED\nTouchscreen: Nein\nHD-Typ: Full HD\nPanel-Typ: TN\nBildschirmform: Flach\nKontrastverh\u00e4ltnis: 1000:1\nMaximale Bildwiederholrate: 144 Hz\nAnzahl der Farben des Displays: 16,78 Millionen Farben\nTyp der Hintergrundbeleuchtung: LED\nHelligkeit (typisch): 400 cd/m\u00b2\nDisplay-Oberfl\u00e4che: Matt\nKontrastverh\u00e4ltnis (dynamisch): 80000000:1\nBildwinkel, horizontal: 170\u00b0\nBildwinkel, vertikal: 160\u00b0\nPixel Abstand: 0,283 x 0,283 mm\nHorizontaler Scanbereich: 30 - 222 kHz\nVertikaler Scanbereich: 30 - 144 Hz\nSichtbare Gr\u00f6\u00dfe (horizontal): 54,4 cm\nSichtbare Gr\u00f6\u00dfe (vertikal): 30,3 cm\nSichtbare Gr\u00f6\u00dfe (diagonal): 62 cm\nsRGB Abdeckung (klassisch): 99%\nNTSC Abdeckung (typisch): 72%\nAMD FreeSync: Ja\nAMD FreeSync-Typ: FreeSync\nVESA Adaptive Sync unterst\u00fctzt: Ja\nFlimmerfreie Technologie: Ja\nLow-Blue-Light-Technologie: Ja\nSpiel-Modus: Ja\nEingebaute Lautsprecher: Ja\nIntegrierte Kamera: Nein\nAnzahl der Lautsprecher: 2\nRMS-Leistung: 4 W\nMarktpositionierung: Gaming\nProduktfarbe: Schwarz\nAbnehmbarer Standfu\u00df: Ja\nZertifizierung: CE, T\u00dcV-GS, RoHS, WEEE, CU\nIntegrierter USB-Hub: Ja\nHDMI: Ja\nKopfh\u00f6rerausgang: Ja\nUSB-Hub-Version: 2.0\nAnzahl der nachgeschalteten Steckpl\u00e4tze vom Typ USB-A: 2\nDVI Anschluss: Nein\nAnzahl HDMI-Anschl\u00fcsse: 1\nAnzahl DisplayPort Anschl\u00fcsse: 1\nKopfh\u00f6rerausg\u00e4nge: 1\nHDCP: Ja\nIntegrierter Kartenleser: Nein\nEingebauter Ethernet-Anschluss: Nein\nVESA-Halterung: Ja\nKabelsperre-Slot: Ja\nH\u00f6henverstellung: Ja\nPanel-Montage-Schnittstelle: 100 x 100 mm\nSlot-Typ Kabelsperre: Kensington\nH\u00f6heneinstellung: 13 cm\nPivot: Ja\nPivot Winkel: 0 - 90\u00b0\nSchwenkbar: Ja\nSchwenkwinkelbereich: -45 - 45\u00b0\nNeigungswinkelbereich: -5 - 22\u00b0\nOn-Screen-Display (OSD): Ja\nMen\u00fcsprachen: Tschechisch, Deutsch, Niederl\u00e4ndisch, Englisch, Spanisch, Franz\u00f6sisch, Italienisch, Japanisch, Polnisch, Russisch\nAnzahl OSD-Sprachen: 10\nLED-Anzeigen: Ja\nNeigungsverstellung: Ja\nEnergieeffizienzklasse (SDR): F\nEnergieverbrauch (SDR) pro 1.000 Stunden: 21 kWh\nStromverbrauch (Standardbetrieb): 21 W\nStromverbrauch (Standby): 0,32 W\nStromverbrauch (aus): 0,26 W\nAC Eingangsspannung: 100 - 240 V\nAC Eingangsfrequenz: 50 - 60 Hz\nEnergieeffizienzskala: A bis G\nSt\u00e4nder enthalten: Ja\nMitgelieferte Kabel: AC, HDMI, USB\nSchnellstart\u00fcbersicht: Ja\nGer\u00e4tebreite (inkl. Fu\u00df): 557,5 mm\nGer\u00e4tetiefe (inkl. Fu\u00df): 230 mm\nGer\u00e4teh\u00f6he (inkl. Fu\u00df): 380 mm\nGewicht (mit St\u00e4nder): 5,6 kg\nBreite (ohne Standfu\u00df): 55,8 cm\nNachhaltigkeitskonformit\u00e4t: Ja\nNachhaltigkeitszertifikate: CE, ErP, REACH, RoHS\nWarentarifnummer (HS): 85285210\nThin Client installiert: Nein\nDisplay: LED\nAu\u00dfenverkleidungstyp: Matt\nECO-Modus: Ja\nKein Flimmern: Ja\nStromversorgungsfunktionen - Beschreibung: Ja",
    "reference_file": "offer_reference_2311.json",
    "shop_name": "mylemon.at"
}