{
    "html_file": "offer_814_2.html",
    "name": "MSI MAG342CQPV, 34\"",
    "offer_link": "https://www.proshop.at/Bildschirm/MSI-34-Bildschirm-MAG342CQPV-UWQHD-100Hz-Curved-1500R-Black-1-ms/3111902?utm_source=geizhals&utm_medium=cpc&utm_campaign=pricesite",
    "price": 443.86,
    "raw_specifications": {
        "Abmessungen (Breite x Tiefe x H\u00f6he)": "81 cm x 27 cm x 51 cm",
        "Besonderheiten": "Reduzierung des blauen Lichtanteils, gro\u00dfe Farbskala, Adaptive-Sync-Technologie, MSI Anti-Flicker, rahmeloses Blendendesign, 178\u00b0 horizontaler und vertikaler Betrachtungswinkel, Nachtsichtmodus, 8-bit + FRC Farbtiefe",
        "Bildschirmbeschichtung": "Blendfrei",
        "Bildschirmtyp": "VA",
        "Diagonalabmessung": "86.36 cm (34\")",
        "Display-Typ": "LED-hintergrundbeleuchteter LCD-Monitor / TFT-Aktivmatrix",
        "EAN": "4719072948160",
        "Eingangsanschl\u00fcsse": "2xHDMI, DisplayPort",
        "Eingangsspannung": "Wechselstrom 100-240 V (50/60 Hz)",
        "Einstellungen der Anzeigeposition": "H\u00f6he, Pivot (Rotation), Drehung, Neigung",
        "Energie Effizienzklasse": "Klasse G",
        "Energieklasse (HDR)": "Klasse G",
        "Farbraum": "87% Adobe RGB, 110% sRGB (CIE 1976), 86% DCI-P3 (CIE 1976)",
        "Farbunterst\u00fctzung": "1,07 Mrd. Farben",
        "Gaming": "Ja",
        "Ger\u00e4tetyp": "LED-hintergrundbeleuchteter LCD-Monitor - 86.36 cm (34\")",
        "Geschwungener Bildschirm": "Ja (1500R)",
        "Gewicht": "6.91 kg",
        "Helligkeit": "250 cd/m\u00b2",
        "Hersteller": "MSI",
        "Hintergrundbeleuchtungs-Technologie": "LED-Hintergrundbeleuchtung",
        "Horizontale Bildwiederholrate": "58.56 - 148.1 kHz",
        "Horizontaler Betrachtungswinkel": "178",
        "H\u00f6heneinstellung": "90 mm",
        "Kennzeichnung": "DisplayPort 1.2a, CIE1976",
        "Kontrast": "3000:1 / 100000000:1 (dynamisch)",
        "Leistungsaufnahme im Ein-Zustand": "39 W",
        "Leistungsmerkmale": "Slot f\u00fcr Sicherheitsschloss (Kabelschloss getrennt erh\u00e4ltlich)",
        "Modell": "MAG342CQPV",
        "Native Aufl\u00f6sung": "UWQHD 3440 x 1440 bei 100 Hz",
        "Neigungswinkel": "-5/+20",
        "Pixelpitch": "0.23175 mm",
        "Produktbeschreibung": "MSI MAG342CQPV - LED-Monitor - gebogen - 86.36 cm (34\")",
        "Reaktionszeit": "1 ms (MPRT)",
        "Rotationswinkel": "10",
        "Schlosstyp zur Diebstahlsicherung": "Kensington Slot",
        "Schnittstellen": "DisplayPort 1.2a  2 x HDMI  Kopfh\u00f6rer",
        "Schwenkwinkel": "60",
        "Seitenverh\u00e4ltnis": "21:9",
        "Spannung": "Wechselstrom 100-240 V (50/60 Hz)",
        "Stromverbrauch (Aus-Modus)": "0.3 Watt",
        "Stromverbrauch SDR (eingeschaltet)": "39 kWh/1.000 h",
        "Stromverbrauch im Standby-Modus": "0.5 Watt",
        "Transportbreite": "91 cm",
        "Transportgewicht": "9.36 kg",
        "Transporth\u00f6he": "48.5 cm",
        "Transporttiefe": "21 cm",
        "VESA-Halterung": "75 x 75 mm",
        "Vertikale Bildwiederholrate": "48 - 100 Hz",
        "Vertikaler Betrachtungswinkel": "178",
        "Waren-Nr.": "3111902",
        "Zum Hersteller": "www.msi.com/"
    },
    "raw_specifications_text": "Hersteller: MSI\nWaren-Nr.: 3111902\nModell: MAG342CQPV\nEAN: 4719072948160\nZum Hersteller: www.msi.com/\nProduktbeschreibung: MSI MAG342CQPV - LED-Monitor - gebogen - 86.36 cm (34\")\nGer\u00e4tetyp: LED-hintergrundbeleuchteter LCD-Monitor - 86.36 cm (34\")\nEnergie Effizienzklasse: Klasse G\nLeistungsaufnahme im Ein-Zustand: 39 W\nGeschwungener Bildschirm: Ja (1500R)\nBildschirmtyp: VA\nSeitenverh\u00e4ltnis: 21:9\nNative Aufl\u00f6sung: UWQHD 3440 x 1440 bei 100 Hz\nPixelpitch: 0.23175 mm\nHelligkeit: 250 cd/m\u00b2\nKontrast: 3000:1 / 100000000:1 (dynamisch)\nReaktionszeit: 1 ms (MPRT)\nGaming: Ja\nFarbunterst\u00fctzung: 1,07 Mrd. Farben\nFarbraum: 87% Adobe RGB, 110% sRGB (CIE 1976), 86% DCI-P3 (CIE 1976)\nEingangsanschl\u00fcsse: 2xHDMI, DisplayPort\nEinstellungen der Anzeigeposition: H\u00f6he, Pivot (Rotation), Drehung, Neigung\nBildschirmbeschichtung: Blendfrei\nSpannung: Wechselstrom 100-240 V (50/60 Hz)\nAbmessungen (Breite x Tiefe x H\u00f6he): 81 cm x 27 cm x 51 cm\nGewicht: 6.91 kg\nKennzeichnung: DisplayPort 1.2a, CIE1976\nDisplay-Typ: LED-hintergrundbeleuchteter LCD-Monitor / TFT-Aktivmatrix\nEnergieklasse (HDR): Klasse G\nDiagonalabmessung: 86.36 cm (34\")\nVertikale Bildwiederholrate: 48 - 100 Hz\nHorizontale Bildwiederholrate: 58.56 - 148.1 kHz\nHorizontaler Betrachtungswinkel: 178\nVertikaler Betrachtungswinkel: 178\nHintergrundbeleuchtungs-Technologie: LED-Hintergrundbeleuchtung\nBesonderheiten: Reduzierung des blauen Lichtanteils, gro\u00dfe Farbskala, Adaptive-Sync-Technologie, MSI Anti-Flicker, rahmeloses Blendendesign, 178\u00b0 horizontaler und vertikaler Betrachtungswinkel, Nachtsichtmodus, 8-bit + FRC Farbtiefe\nSchnittstellen: DisplayPort 1.2a  2 x HDMI  Kopfh\u00f6rer\nNeigungswinkel: -5/+20\nSchwenkwinkel: 60\nRotationswinkel: 10\nH\u00f6heneinstellung: 90 mm\nVESA-Halterung: 75 x 75 mm\nLeistungsmerkmale: Slot f\u00fcr Sicherheitsschloss (Kabelschloss getrennt erh\u00e4ltlich)\nSchlosstyp zur Diebstahlsicherung: Kensington Slot\nEingangsspannung: Wechselstrom 100-240 V (50/60 Hz)\nStromverbrauch SDR (eingeschaltet): 39 kWh/1.000 h\nStromverbrauch im Standby-Modus: 0.5 Watt\nStromverbrauch (Aus-Modus): 0.3 Watt\nTransportbreite: 91 cm\nTransporttiefe: 21 cm\nTransporth\u00f6he: 48.5 cm\nTransportgewicht: 9.36 kg",
    "reference_file": "offer_reference_814.json",
    "shop_name": "Proshop.at"
}