{
    "html_file": "offer_365_8.html",
    "name": "Samsung Odyssey G5 G51C, 27\"",
    "offer_link": "https://www.mylemon.at/artikel/samsung/ls27cg510euxen/dis-27-s27cg510eu.html",
    "price": 286.99,
    "raw_specifications": {
        "AC Eingangsspannung": "100 - 240 V",
        "AMD FreeSync": "Ja",
        "AMD FreeSync-Typ": "FreeSync Premium",
        "Anzahl DisplayPort Anschl\u00fcsse": "1",
        "Anzahl HDMI-Anschl\u00fcsse": "2",
        "Anzahl der Farben des Displays": "16,7 Millionen Farben",
        "Artikelnummer": "M1FYK21L",
        "Auf Ansicht tippen": "Nein",
        "Aufl\u00f6sung": "2560x1440",
        "Besonderheiten": "165 Hz",
        "Betriebstemperatur": "10 - 40 \u00b0C",
        "Bildschirmdiagonale": "68,6 cm (27\")",
        "Bildschirmdiagonale (cm)": "68 cm",
        "Bildschirmform": "Flach",
        "Bildschirmtechnologie": "LED",
        "Bildwinkel, horizontal": "178\u00b0",
        "Bildwinkel, vertikal": "178\u00b0",
        "Bluetooth": "Nein",
        "Breite (ohne Standfu\u00df)": "618,2 mm",
        "ConnectShare (USB)": "Nein",
        "DVI Anschluss": "Nein",
        "Display-Aufl\u00f6sung": "2560 x 1440 Pixel",
        "DisplayPorts-Version": "1.4",
        "Displaygr\u00f6\u00dfe": "27 Zoll",
        "Drahtlose Dex-Unterst\u00fctzung": "Nein",
        "Dynamisches Kontrastverh\u00e4ltnis Marketingbezeichnung": "Mega-Kontrast",
        "EAN": "8806094659184",
        "Eingebaute KVM-Umschaltung": "Nein",
        "Eingebaute Lautsprecher": "Nein",
        "Energieeffizienzklasse (HDR)": "G",
        "Energieeffizienzklasse (SDR)": "F",
        "Energieeffizienzskala": "A bis G",
        "Energieverbrauch (HDR) pro 1.000 Stunden": "38 kWh",
        "Energieverbrauch (SDR) pro 1.000 Stunden": "25 kWh",
        "Ergonomie": "H\u00f6henverstellbar, Pivot (90 Grad drehbar), Schwenkbar, Neigbar",
        "Flimmerfreie Technologie": "Ja",
        "Funktioniert mit Samsung Bixby": "Nein",
        "Ger\u00e4tebreite (inkl. Fu\u00df)": "618,2 mm",
        "Ger\u00e4teh\u00f6he (inkl. Fu\u00df)": "520,6 mm",
        "Ger\u00e4tetiefe (inkl. Fu\u00df)": "234,2 mm",
        "Gewicht (mit St\u00e4nder)": "4,8 kg",
        "Gewicht (ohne St\u00e4nder)": "3,3 kg",
        "HD-Typ": "4K Ultra HD",
        "HDCP": "Ja",
        "HDCP-Version": "1.4",
        "HDMI": "Ja",
        "HDMI-Version": "2.0",
        "Helligkeit": "300 cd/m\u00b2",
        "Helligkeit (typisch)": "300 cd/m\u00b2",
        "Hersteller Artikelnummer": "LS27CG510EUXEN",
        "High Dynamic Range Video (HDR) Unterst\u00fctzung": "Ja",
        "H\u00f6he (ohne Standfu\u00df)": "376,9 mm",
        "H\u00f6heneinstellung": "12 cm",
        "H\u00f6henverstellung": "Ja",
        "Integrierte Kamera": "Nein",
        "Kontrastverh\u00e4ltnis": "3000:1",
        "Marktpositionierung": "Gaming",
        "Maximale Bildwiederholrate": "165 Hz",
        "NVIDIA G-SYNC": "Nein",
        "Natives Seitenverh\u00e4ltnis": "16:9",
        "Neigungsverstellung": "Ja",
        "Neigungswinkelbereich": "-15 - 15\u00b0",
        "Netzteiltyp": "Extern",
        "Paketgewicht": "7 kg",
        "Panel": "VA",
        "Panel-Montage-Schnittstelle": "100 x 100 mm",
        "Panel-Typ": "VA",
        "Pivot": "Ja",
        "Pivot Winkel": "-2 - 92\u00b0",
        "Produktfarbe": "Schwarz",
        "Reaktionszeit": "1 ms",
        "Relative Luftfeuchtigkeit in Betrieb": "10 - 80%",
        "Schwenkbar": "Ja",
        "Schwenkwinkelbereich": "-5 - 20\u00b0",
        "Spiel-Modus": "Ja",
        "Stromkabell\u00e4nge": "1,5 m",
        "Stromverbrauch (Standardbetrieb)": "25,2 W",
        "Stromverbrauch (Standby)": "0,3 W",
        "Stromverbrauch (aus)": "0,3 W",
        "Stromverbrauch (max.)": "48 W",
        "TV Plus": "Nein",
        "Technologie mit hohem Dynamikbereich (HDR)": "High Dynamic Range 10 (HDR10)",
        "Tiefe (ohne Standfu\u00df)": "92,4 mm",
        "VESA Halterung": "100x100 mm",
        "VESA-Halterung": "Ja",
        "Verpackungsbreite": "702 mm",
        "Verpackungsh\u00f6he": "192 mm",
        "Verpackungstiefe": "465 mm",
        "Video Anschl\u00fcsse": "2x HDMI, 1x DisplayPort",
        "WLAN": "Nein"
    },
    "raw_specifications_text": "Displaygr\u00f6\u00dfe: 27 Zoll\nAufl\u00f6sung: 2560x1440\nPanel: VA\nReaktionszeit: 1 ms\nVideo Anschl\u00fcsse: 2x HDMI, 1x DisplayPort\nErgonomie: H\u00f6henverstellbar, Pivot (90 Grad drehbar), Schwenkbar, Neigbar\nVESA Halterung: 100x100 mm\nHelligkeit: 300 cd/m\u00b2\nBesonderheiten: 165 Hz\nHersteller Artikelnummer: LS27CG510EUXEN\nEAN: 8806094659184\nArtikelnummer: M1FYK21L\nBildschirmdiagonale: 68,6 cm (27\")\nDisplay-Aufl\u00f6sung: 2560 x 1440 Pixel\nNatives Seitenverh\u00e4ltnis: 16:9\nBildschirmtechnologie: LED\nHD-Typ: 4K Ultra HD\nPanel-Typ: VA\nBildschirmform: Flach\nKontrastverh\u00e4ltnis: 3000:1\nMaximale Bildwiederholrate: 165 Hz\nAnzahl der Farben des Displays: 16,7 Millionen Farben\nHelligkeit (typisch): 300 cd/m\u00b2\nDynamisches Kontrastverh\u00e4ltnis Marketingbezeichnung: Mega-Kontrast\nBildwinkel, horizontal: 178\u00b0\nBildwinkel, vertikal: 178\u00b0\nBildschirmdiagonale (cm): 68 cm\nHigh Dynamic Range Video (HDR) Unterst\u00fctzung: Ja\nTechnologie mit hohem Dynamikbereich (HDR): High Dynamic Range 10 (HDR10)\nNVIDIA G-SYNC: Nein\nAMD FreeSync: Ja\nAMD FreeSync-Typ: FreeSync Premium\nConnectShare (USB): Nein\nFlimmerfreie Technologie: Ja\nSpiel-Modus: Ja\nTV Plus: Nein\nFunktioniert mit Samsung Bixby: Nein\nDrahtlose Dex-Unterst\u00fctzung: Nein\nAuf Ansicht tippen: Nein\nEingebaute Lautsprecher: Nein\nIntegrierte Kamera: Nein\nMarktpositionierung: Gaming\nProduktfarbe: Schwarz\nHDMI: Ja\nDVI Anschluss: Nein\nAnzahl HDMI-Anschl\u00fcsse: 2\nHDMI-Version: 2.0\nAnzahl DisplayPort Anschl\u00fcsse: 1\nDisplayPorts-Version: 1.4\nEingebaute KVM-Umschaltung: Nein\nHDCP: Ja\nHDCP-Version: 1.4\nWLAN: Nein\nBluetooth: Nein\nVESA-Halterung: Ja\nH\u00f6henverstellung: Ja\nPanel-Montage-Schnittstelle: 100 x 100 mm\nH\u00f6heneinstellung: 12 cm\nPivot: Ja\nPivot Winkel: -2 - 92\u00b0\nSchwenkbar: Ja\nSchwenkwinkelbereich: -5 - 20\u00b0\nNeigungswinkelbereich: -15 - 15\u00b0\nNeigungsverstellung: Ja\nEnergieeffizienzklasse (SDR): F\nEnergieeffizienzklasse (HDR): G\nEnergieverbrauch (SDR) pro 1.000 Stunden: 25 kWh\nEnergieverbrauch (HDR) pro 1.000 Stunden: 38 kWh\nStromverbrauch (Standardbetrieb): 25,2 W\nStromverbrauch (Standby): 0,3 W\nStromverbrauch (max.): 48 W\nStromverbrauch (aus): 0,3 W\nAC Eingangsspannung: 100 - 240 V\nNetzteiltyp: Extern\nEnergieeffizienzskala: A bis G\nBetriebstemperatur: 10 - 40 \u00b0C\nRelative Luftfeuchtigkeit in Betrieb: 10 - 80%\nStromkabell\u00e4nge: 1,5 m\nGer\u00e4tebreite (inkl. Fu\u00df): 618,2 mm\nGer\u00e4tetiefe (inkl. Fu\u00df): 234,2 mm\nGer\u00e4teh\u00f6he (inkl. Fu\u00df): 520,6 mm\nGewicht (mit St\u00e4nder): 4,8 kg\nBreite (ohne Standfu\u00df): 618,2 mm\nTiefe (ohne Standfu\u00df): 92,4 mm\nH\u00f6he (ohne Standfu\u00df): 376,9 mm\nGewicht (ohne St\u00e4nder): 3,3 kg\nVerpackungsbreite: 702 mm\nVerpackungstiefe: 465 mm\nVerpackungsh\u00f6he: 192 mm\nPaketgewicht: 7 kg",
    "reference_file": "offer_reference_365.json",
    "shop_name": "mylemon.at"
}