{
    "html_file": "offer_258_5.html",
    "name": "Samsung Smart Monitor M5 M50C, 27\"",
    "offer_link": "https://direkt.jacob.de/produkte/samsung-s27cm501eu-68-6-ls27cm501euxen-artnr-8139885.html?utm_source=geizhals&utm_medium=cpc&utm_campaign=Preisvergleich&ref=103",
    "price": 195.29,
    "raw_specifications": {
        "AC Eingangsfrequenz": "50/60 Hz",
        "AC Eingangsspannung": "100 - 240 V",
        "AMD FreeSync": "Nein",
        "Anzahl HDMI-Anschl\u00fcsse": "2",
        "Anzahl der Farben des Displays": "1 Milliarden Farben",
        "Anzahl der nachgeschalteten Steckpl\u00e4tze vom Typ USB-A": "2",
        "Auf Ansicht tippen": "Ja",
        "Betriebstemperatur": "10 - 40 \u00b0C",
        "Bildschirmdiagonale": "68,6 cm (27\" )",
        "Bildschirmdiagonale (cm)": "68 cm",
        "Bildschirmform": "Flach",
        "Bildschirmtechnologie": "LED",
        "Bildwinkel, horizontal": "178\u00b0",
        "Bildwinkel, vertikal": "178\u00b0",
        "Bluetooth": "Ja",
        "Bluetooth-Version": "5.2",
        "Breite (ohne Standfu\u00df)": "61,5 cm",
        "Display-Aufl\u00f6sung": "1920 x 1080 Pixel",
        "Eingebaute Lautsprecher": "Ja",
        "Energie Effizienzklasse": "E",
        "Energieeffizienzklasse (HDR)": "G",
        "Energieeffizienzklasse (SDR)": "E",
        "Energieverbrauch (HDR) pro 1.000 Stunden": "32 kWh",
        "Energieverbrauch (SDR) pro 1.000 Stunden": "21 kWh",
        "Fernbedienung enthalten": "Ja",
        "Flimmerfreie Technologie": "Ja",
        "Fu\u00dffarbe": "Wei\u00df",
        "Ger\u00e4tebreite (inkl. Fu\u00df)": "615,5 mm",
        "Ger\u00e4teh\u00f6he (inkl. Fu\u00df)": "455,4 mm",
        "Ger\u00e4tetiefe (inkl. Fu\u00df)": "193,5 mm",
        "Gewicht (mit St\u00e4nder)": "5 kg",
        "Gewicht (ohne St\u00e4nder)": "3,9 kg",
        "HD-Typ": "Full HD",
        "HDCP": "Ja",
        "HDCP-Version": "2.2",
        "HDMI": "Ja",
        "HDMI-Version": "1.4",
        "Helligkeit (typisch)": "250 cd/m\u00b2",
        "High Dynamic Range Video (HDR) Unterst\u00fctzung": "Ja",
        "H\u00f6he (ohne Standfu\u00df)": "36,8 cm",
        "H\u00f6henverstellung": "Nein",
        "Installiertes Betriebssystem": "Tizen",
        "Integrierte Kamera": "Nein",
        "Integrierter USB-Hub": "Ja",
        "Kontrastverh\u00e4ltnis": "3000:1",
        "Marktpositionierung": "Intelligent",
        "Maximale Bildwiederholrate": "60 Hz",
        "Mitgelieferte Kabel": "AC, HDMI",
        "NVIDIA G-SYNC": "Nein",
        "Natives Seitenverh\u00e4ltnis": "16:9",
        "Neigungsverstellung": "Ja",
        "Neigungswinkelbereich": "2 - 22\u00b0",
        "Office 365 Support": "Ja",
        "Paketgewicht": "6,4 kg",
        "Panel-Montage-Schnittstelle": "100 x 100 mm",
        "Panel-Typ": "VA",
        "Produktfarbe": "Wei\u00df",
        "Reaktionszeit": "4 ms",
        "Relative Luftfeuchtigkeit in Betrieb": "10 - 80%",
        "Sichtbare Gr\u00f6\u00dfe (horizontal)": "59,8 cm",
        "Sichtbare Gr\u00f6\u00dfe (vertikal)": "33,6 cm",
        "Spiel-Modus": "Ja",
        "Stromkabell\u00e4nge": "1,5 m",
        "Stromverbrauch (Standardbetrieb)": "21 W",
        "Stromverbrauch (Standby)": "0,5 W",
        "Stromverbrauch (max.)": "50 W",
        "Technologie mit hohem Dynamikbereich (HDR)": "High Dynamic Range 10 (HDR10)",
        "Tiefe (ohne Standfu\u00df)": "4,18 cm",
        "Touchscreen": "Nein",
        "VESA-Halterung": "Ja",
        "Verpackungsart": "Box",
        "Verpackungsbreite": "738 mm",
        "Verpackungsh\u00f6he": "428 mm",
        "Verpackungstiefe": "126 mm",
        "WLAN": "Ja",
        "WLAN-Standards": "Wi-Fi 5 (802.11ac)"
    },
    "raw_specifications_text": "Bildschirmdiagonale: 68,6 cm (27\" )\nDisplay-Aufl\u00f6sung: 1920 x 1080 Pixel\nNatives Seitenverh\u00e4ltnis: 16:9\nBildschirmtechnologie: LED\nTouchscreen: Nein\nHD-Typ: Full HD\nEnergie Effizienzklasse: E\nPanel-Typ: VA\nBildschirmform: Flach\nKontrastverh\u00e4ltnis: 3000:1\nMaximale Bildwiederholrate: 60 Hz\nAnzahl der Farben des Displays: 1 Milliarden Farben\nHelligkeit (typisch): 250 cd/m\u00b2\nReaktionszeit: 4 ms\nBildwinkel, horizontal: 178\u00b0\nBildwinkel, vertikal: 178\u00b0\nSichtbare Gr\u00f6\u00dfe (horizontal): 59,8 cm\nSichtbare Gr\u00f6\u00dfe (vertikal): 33,6 cm\nBildschirmdiagonale (cm): 68 cm\nHigh Dynamic Range Video (HDR) Unterst\u00fctzung: Ja\nTechnologie mit hohem Dynamikbereich (HDR): High Dynamic Range 10 (HDR10)\nNVIDIA G-SYNC: Nein\nAMD FreeSync: Nein\nFlimmerfreie Technologie: Ja\nSpiel-Modus: Ja\nOffice 365 Support: Ja\nAuf Ansicht tippen: Ja\nInstalliertes Betriebssystem: Tizen\nEingebaute Lautsprecher: Ja\nIntegrierte Kamera: Nein\nMarktpositionierung: Intelligent\nProduktfarbe: Wei\u00df\nFu\u00dffarbe: Wei\u00df\nIntegrierter USB-Hub: Ja\nHDMI: Ja\nAnzahl der nachgeschalteten Steckpl\u00e4tze vom Typ USB-A: 2\nAnzahl HDMI-Anschl\u00fcsse: 2\nHDMI-Version: 1.4\nHDCP: Ja\nHDCP-Version: 2.2\nWLAN: Ja\nWLAN-Standards: Wi-Fi 5 (802.11ac)\nBluetooth: Ja\nBluetooth-Version: 5.2\nVESA-Halterung: Ja\nH\u00f6henverstellung: Nein\nPanel-Montage-Schnittstelle: 100 x 100 mm\nNeigungswinkelbereich: 2 - 22\u00b0\nNeigungsverstellung: Ja\nEnergieeffizienzklasse (SDR): E\nEnergieeffizienzklasse (HDR): G\nEnergieverbrauch (SDR) pro 1.000 Stunden: 21 kWh\nEnergieverbrauch (HDR) pro 1.000 Stunden: 32 kWh\nStromverbrauch (Standardbetrieb): 21 W\nStromverbrauch (Standby): 0,5 W\nStromverbrauch (max.): 50 W\nAC Eingangsspannung: 100 - 240 V\nAC Eingangsfrequenz: 50/60 Hz\nBetriebstemperatur: 10 - 40 \u00b0C\nRelative Luftfeuchtigkeit in Betrieb: 10 - 80%\nMitgelieferte Kabel: AC, HDMI\nFernbedienung enthalten: Ja\nStromkabell\u00e4nge: 1,5 m\nGer\u00e4tebreite (inkl. Fu\u00df): 615,5 mm\nGer\u00e4tetiefe (inkl. Fu\u00df): 193,5 mm\nGer\u00e4teh\u00f6he (inkl. Fu\u00df): 455,4 mm\nGewicht (mit St\u00e4nder): 5 kg\nBreite (ohne Standfu\u00df): 61,5 cm\nTiefe (ohne Standfu\u00df): 4,18 cm\nH\u00f6he (ohne Standfu\u00df): 36,8 cm\nGewicht (ohne St\u00e4nder): 3,9 kg\nVerpackungsbreite: 738 mm\nVerpackungstiefe: 126 mm\nVerpackungsh\u00f6he: 428 mm\nPaketgewicht: 6,4 kg\nVerpackungsart: Box",
    "reference_file": "offer_reference_258.json",
    "shop_name": "Jacob Elektronik direkt (AT)"
}