{
    "html_file": "offer_119_10.html",
    "name": "Verbatim PM-14, 14\"",
    "offer_link": "https://ms-it-beratung.at/shop/details.php?art=423854&artname=Verbatim+PM-14+Portable+Monitor+14%22+Full+HD+1080p",
    "price": 161.0,
    "raw_specifications": {
        "AMD FreeSync": "Ja",
        "Anzahl HDMI-Anschl\u00fcsse": "1",
        "Anzahl der Farben des Displays": "16,7 Millionen Farben",
        "Bildschirmdiagonale": "35,6 cm (14\")",
        "Bildschirmform": "Flach",
        "Bildwinkel, horizontal": "178\u00b0",
        "Bildwinkel, vertikal": "178\u00b0",
        "Breite (ohne Standfu\u00df)": "328,9 mm",
        "Display-Aufl\u00f6sung": "1920 x 1080 Pixel",
        "Eingebaute Lautsprecher": "Ja",
        "Energieeffizienzklasse (HDR)": "A",
        "Energieeffizienzklasse (SDR)": "A",
        "Energieverbrauch (HDR) pro 1.000 Stunden": "7 kWh",
        "Energieverbrauch (SDR) pro 1.000 Stunden": "7 kWh",
        "Gewicht (ohne St\u00e4nder)": "760 g",
        "HD-Typ": "Full HD",
        "HDMI": "Ja",
        "HDMI-Version": "1.4",
        "Helligkeit (peak)": "250 cd/m\u00b2",
        "Helligkeit (typisch)": "220 cd/m\u00b2",
        "H\u00f6he (ohne Standfu\u00df)": "209,1 mm",
        "H\u00f6henverstellung": "Nein",
        "Integrierte Kamera": "Nein",
        "Integrierter USB-Hub": "Nein",
        "Kabelsperre-Slot": "Nein",
        "Low-Blue-Light-Technologie": "Ja",
        "Marktpositionierung": "B\u00fcro",
        "NVIDIA G-SYNC": "Nein",
        "Natives Seitenverh\u00e4ltnis": "16:9",
        "Neigungsverstellung": "Ja",
        "Neigungswinkelbereich": "0 - 85\u00b0",
        "Panel-Typ": "IPS",
        "Produktfarbe": "Schwarz",
        "Reaktionszeit": "6 ms",
        "Schnellstart\u00fcbersicht": "Ja",
        "Tiefe (ohne Standfu\u00df)": "12 mm",
        "VESA-Halterung": "Nein"
    },
    "raw_specifications_text": "Bildschirmdiagonale: 35,6 cm (14\")\nDisplay-Aufl\u00f6sung: 1920 x 1080 Pixel\nNatives Seitenverh\u00e4ltnis: 16:9\nHD-Typ: Full HD\nPanel-Typ: IPS\nHelligkeit (peak): 250 cd/m\u00b2\nHelligkeit (typisch): 220 cd/m\u00b2\nReaktionszeit: 6 ms\nBildschirmform: Flach\nBildwinkel, horizontal: 178\u00b0\nBildwinkel, vertikal: 178\u00b0\nAnzahl der Farben des Displays: 16,7 Millionen Farben\nNVIDIA G-SYNC: Nein\nAMD FreeSync: Ja\nLow-Blue-Light-Technologie: Ja\nEingebaute Lautsprecher: Ja\nIntegrierte Kamera: Nein\nMarktpositionierung: B\u00fcro\nProduktfarbe: Schwarz\nIntegrierter USB-Hub: Nein\nHDMI: Ja\nAnzahl HDMI-Anschl\u00fcsse: 1\nHDMI-Version: 1.4\nVESA-Halterung: Nein\nKabelsperre-Slot: Nein\nH\u00f6henverstellung: Nein\nNeigungswinkelbereich: 0 - 85\u00b0\nNeigungsverstellung: Ja\nEnergieeffizienzklasse (SDR): A\nEnergieeffizienzklasse (HDR): A\nEnergieverbrauch (SDR) pro 1.000 Stunden: 7 kWh\nEnergieverbrauch (HDR) pro 1.000 Stunden: 7 kWh\nSchnellstart\u00fcbersicht: Ja\nBreite (ohne Standfu\u00df): 328,9 mm\nTiefe (ohne Standfu\u00df): 12 mm\nH\u00f6he (ohne Standfu\u00df): 209,1 mm\nGewicht (ohne St\u00e4nder): 760 g",
    "reference_file": "offer_reference_119.json",
    "shop_name": "ms-it-beratung"
}