{
    "html_file": "offer_680_12.html",
    "name": "ASUS ROG Swift PG27AQN, 27\"",
    "offer_link": "https://click.cptrack.de/?rd=true&k=H2jZOPSoNfIohcnyCFLwAyhA6o4q59X7bblnbja3C5nJ5sTq7bvMWE-xcjmiDsgFGy_yTbYED5SeNM2e6jUszA~~&rdlink=https%3A%2F%2Fwww.cyberport.at%2F%3FDEEP%3D6135-0H3%26APID%3D66",
    "price": 1313.0,
    "raw_specifications": {
        "Anzahl DisplayPort Anschl\u00fcsse": "1",
        "Anzahl HDMI-Anschl\u00fcsse": "3",
        "Anzahl der nachgeschalteten Steckpl\u00e4tze vom Typ USB-A": "2",
        "Aufl\u00f6sung": "2.560x1.440 WQHD",
        "Betrachtungswinkel h/v": "178\u00b0/178\u00b0",
        "Bildformat": "16:9",
        "Breite (ohne Standfu\u00df)": "614 mm",
        "DisplayPorts-Version": "1.4",
        "Displaygr\u00f6\u00dfe in Zoll": "27 Zoll",
        "Displaygr\u00f6\u00dfe in cm": "68,6 cm",
        "Farbraumabdeckung": "135% sRGB",
        "Ger\u00e4tebreite (inkl. Fu\u00df)": "614 mm",
        "Ger\u00e4teh\u00f6he (inkl. Fu\u00df)": "490 mm",
        "Ger\u00e4tetiefe (inkl. Fu\u00df)": "255 mm",
        "Gewicht in kg": "8,4 kg",
        "HDCP": "Ja",
        "HDCP-Version": "2.2",
        "HDMI": "Ja",
        "HDMI-Version": "2.0",
        "Helligkeit": "400 cd/m\u00b2",
        "H\u00f6he (ohne Standfu\u00df)": "367 mm",
        "H\u00f6henverstellbar": "100mm",
        "Integrierter USB-Hub": "Ja",
        "Jahresverbrauch": "32 kWh",
        "Kontrast dynamisch": "k.A.",
        "Kontrast typisch": "1.000:1",
        "Kopfh\u00f6rerausgang": "Ja",
        "Lautsprecher": "kein",
        "Oberfl\u00e4che": "matt",
        "Reaktionszeit": "1 ms",
        "Technologie": "IPS",
        "Tiefe (ohne Standfu\u00df)": "90 mm",
        "USB-Hub-Version": "3.2 Gen 1 (3.1 Gen 1)",
        "Wandmontage": "VESA100x100"
    },
    "raw_specifications_text": "Jahresverbrauch: 32 kWh\nDisplaygr\u00f6\u00dfe in cm: 68,6 cm\nDisplaygr\u00f6\u00dfe in Zoll: 27 Zoll\nTechnologie: IPS\nAufl\u00f6sung: 2.560x1.440 WQHD\nBildformat: 16:9\nOberfl\u00e4che: matt\nFarbraumabdeckung: 135% sRGB\nHelligkeit: 400 cd/m\u00b2\nKontrast typisch: 1.000:1\nKontrast dynamisch: k.A.\nReaktionszeit: 1 ms\nBetrachtungswinkel h/v: 178\u00b0/178\u00b0\nH\u00f6henverstellbar: 100mm\nWandmontage: VESA100x100\nGer\u00e4tebreite (inkl. Fu\u00df): 614 mm\nGer\u00e4tetiefe (inkl. Fu\u00df): 255 mm\nGer\u00e4teh\u00f6he (inkl. Fu\u00df): 490 mm\nBreite (ohne Standfu\u00df): 614 mm\nTiefe (ohne Standfu\u00df): 90 mm\nH\u00f6he (ohne Standfu\u00df): 367 mm\nIntegrierter USB-Hub: Ja\nHDMI: Ja\nKopfh\u00f6rerausgang: Ja\nUSB-Hub-Version: 3.2 Gen 1 (3.1 Gen 1)\nAnzahl der nachgeschalteten Steckpl\u00e4tze vom Typ USB-A: 2\nAnzahl HDMI-Anschl\u00fcsse: 3\nHDMI-Version: 2.0\nAnzahl DisplayPort Anschl\u00fcsse: 1\nDisplayPorts-Version: 1.4\nHDCP: Ja\nHDCP-Version: 2.2\nLautsprecher: kein\nGewicht in kg: 8,4 kg",
    "reference_file": "offer_reference_680.json",
    "shop_name": "Cyberport.at"
}