{
    "html_file": "offer_2296_5.html",
    "name": "AOC 24P1, 23.8\"",
    "offer_link": "https://www.proshop.at/Bildschirm/AOC-24-Bildschirm-24P1-1920x1080-IPS-Black-5-ms/2680731?utm_source=geizhals&utm_medium=cpc&utm_campaign=pricesite",
    "price": 149.42,
    "raw_specifications": {
        "Abmessungen (Breite x Tiefe x H\u00f6he)": "53.91 cm x 20.25 cm x 51.89 cm - mit Fu\u00df",
        "Abmessungen (Breite x Tiefe x H\u00f6he) - mit Fu\u00df": "53.91 cm x 20.25 cm x 51.89 cm",
        "Ausgangsleistung/Kanal": "2 Watt",
        "Besonderheiten": "Grenzenlos",
        "Bildschirmtyp": "IPS",
        "Details zu Abmessungen & Gewicht": "Breite: 75.2 cm - Tiefe: 5.9 cm - H\u00f6he: 40.8 cm - Gewicht: 6.55 kg",
        "Diagonalabmessung": "60.5 cm (23.8\")",
        "Display-Typ": "LED-hintergrundbeleuchteter LCD-Monitor / TFT-Aktivmatrix",
        "EAN": "4038986146227",
        "Eingangsanschl\u00fcsse": "HDMI, DVI, DisplayPort, VGA",
        "Eingangsspannung": "Wechselstrom 120/230 V (50/60 Hz)",
        "Einstellungen der Anzeigeposition": "H\u00f6he, Pivot (Rotation), Drehung, Neigung",
        "Energie Effizienzklasse": "Klasse E",
        "Enthaltene Kabel": "1 x HDMI-Kabel - 1.8 m  1 x DisplayPort-Kabel - 1.8 m  1 x Audiokabel - 1.5 m",
        "Farbunterst\u00fctzung": "16,7 Millionen Farben",
        "Ger\u00e4tetyp": "LED-hintergrundbeleuchteter LCD-Monitor - 60.5 cm (23.8\")",
        "Gewicht": "4.6 kg",
        "Helligkeit": "250 cd/m\u00b2",
        "Hersteller": "AOC",
        "Hintergrundbeleuchtungs-Technologie": "WLED",
        "Horizontaler Betrachtungswinkel": "178",
        "H\u00f6heneinstellung": "150 mm",
        "Integrierte Peripherieger\u00e4te": "USB 3.0-Hub",
        "Kontrast": "1000:1 / 50000000:1 (dynamisch)",
        "Leistungsaufnahme im Ein-Zustand": "18.2 W",
        "Leistungsmerkmale": "USB 3.0-Hub",
        "MTBF": "50,000 Stunde(n)",
        "Modell": "24P1",
        "Native Aufl\u00f6sung": "Full HD (1080p) 1920 x 1080 bei 60 Hz",
        "Neigungswinkel": "-2.5/+92.5",
        "OSD-Sprachen": "Tschechisch, Chinesisch (tradionell), Chinesisch (vereinfacht), Englisch, Deutsch, Franz\u00f6sisch, Italienisch, Portugiesisch, Polnisch, Finnisch, Schwedisch, Russisch, Spanisch, Holl\u00e4ndisch, Japanisch, Koreanisch",
        "Pixelpitch": "0.2745 mm",
        "Produktbeschreibung": "AOC 24P1 - LED-Monitor - Full HD (1080p) - 60.5 cm (23.8\")",
        "Reaktionszeit": "5 ms",
        "Schnittstellen": "VGA  HDMI  DisplayPort  DVI  Kopfh\u00f6rer  4 x USB 3.0",
        "Schwenkwinkel": "350",
        "Seitenverh\u00e4ltnis": "16:9",
        "Spannung": "Wechselstrom 120/230 V (50/60 Hz)",
        "Stromverbrauch (Aus-Modus)": "0.3 Watt",
        "Stromverbrauch (typisch)": "22 Watt",
        "Stromverbrauch SDR (eingeschaltet)": "18.2 kWh/1.000 h",
        "Stromverbrauch im Standby-Modus": "0.3 Watt",
        "TCO-zertifiziert": "TCO Certified Displays 8",
        "Typ": "Lautsprecher - Stereo",
        "Umweltschutzstandards": "TCO Certified Displays 8",
        "Vertikaler Betrachtungswinkel": "178",
        "Waren-Nr.": "2680731",
        "Zubeh\u00f6r im Lieferumfang": "Aufstellung",
        "Zum Hersteller": "www.aoc.com"
    },
    "raw_specifications_text": "Hersteller: AOC\nWaren-Nr.: 2680731\nModell: 24P1\nEAN: 4038986146227\nZum Hersteller: www.aoc.com\nProduktbeschreibung: AOC 24P1 - LED-Monitor - Full HD (1080p) - 60.5 cm (23.8\")\nGer\u00e4tetyp: LED-hintergrundbeleuchteter LCD-Monitor - 60.5 cm (23.8\")\nEnergie Effizienzklasse: Klasse E\nLeistungsaufnahme im Ein-Zustand: 18.2 W\nLeistungsmerkmale: USB 3.0-Hub\nBildschirmtyp: IPS\nSeitenverh\u00e4ltnis: 16:9\nNative Aufl\u00f6sung: Full HD (1080p) 1920 x 1080 bei 60 Hz\nPixelpitch: 0.2745 mm\nHelligkeit: 250 cd/m\u00b2\nKontrast: 1000:1 / 50000000:1 (dynamisch)\nReaktionszeit: 5 ms\nFarbunterst\u00fctzung: 16,7 Millionen Farben\nEingangsanschl\u00fcsse: HDMI, DVI, DisplayPort, VGA\nEinstellungen der Anzeigeposition: H\u00f6he, Pivot (Rotation), Drehung, Neigung\nSpannung: Wechselstrom 120/230 V (50/60 Hz)\nAbmessungen (Breite x Tiefe x H\u00f6he) - mit Fu\u00df: 53.91 cm x 20.25 cm x 51.89 cm\nGewicht: 4.6 kg\nUmweltschutzstandards: TCO Certified Displays 8\nDisplay-Typ: LED-hintergrundbeleuchteter LCD-Monitor / TFT-Aktivmatrix\nDiagonalabmessung: 60.5 cm (23.8\")\nIntegrierte Peripherieger\u00e4te: USB 3.0-Hub\nHorizontaler Betrachtungswinkel: 178\nVertikaler Betrachtungswinkel: 178\nHintergrundbeleuchtungs-Technologie: WLED\nOSD-Sprachen: Tschechisch, Chinesisch (tradionell), Chinesisch (vereinfacht), Englisch, Deutsch, Franz\u00f6sisch, Italienisch, Portugiesisch, Polnisch, Finnisch, Schwedisch, Russisch, Spanisch, Holl\u00e4ndisch, Japanisch, Koreanisch\nBesonderheiten: Grenzenlos\nAbmessungen (Breite x Tiefe x H\u00f6he): 53.91 cm x 20.25 cm x 51.89 cm - mit Fu\u00df\nTyp: Lautsprecher - Stereo\nAusgangsleistung/Kanal: 2 Watt\nSchnittstellen: VGA  HDMI  DisplayPort  DVI  Kopfh\u00f6rer  4 x USB 3.0\nNeigungswinkel: -2.5/+92.5\nSchwenkwinkel: 350\nH\u00f6heneinstellung: 150 mm\nZubeh\u00f6r im Lieferumfang: Aufstellung\nEnthaltene Kabel: 1 x HDMI-Kabel - 1.8 m  1 x DisplayPort-Kabel - 1.8 m  1 x Audiokabel - 1.5 m\nMTBF: 50,000 Stunde(n)\nEingangsspannung: Wechselstrom 120/230 V (50/60 Hz)\nStromverbrauch SDR (eingeschaltet): 18.2 kWh/1.000 h\nStromverbrauch (typisch): 22 Watt\nStromverbrauch im Standby-Modus: 0.3 Watt\nStromverbrauch (Aus-Modus): 0.3 Watt\nDetails zu Abmessungen & Gewicht: Breite: 75.2 cm - Tiefe: 5.9 cm - H\u00f6he: 40.8 cm - Gewicht: 6.55 kg\nTCO-zertifiziert: TCO Certified Displays 8",
    "reference_file": "offer_reference_2296.json",
    "shop_name": "Proshop.at"
}