{
    "html_file": "offer_2105_1.html",
    "name": "Philips V-line 242V8A, 23.8\"",
    "offer_link": "https://www.csv-direct.de/artinfo.php?artnr=AGX1221313&KATEGORIE=162&pva=geizhals2",
    "price": 140.09,
    "raw_specifications": {
        "AC Eingangsfrequenz": "50 - 60 Hz",
        "AC Eingangsspannung": "100 - 240 V",
        "Anzahl DisplayPort Anschl\u00fcsse": "1.2",
        "Anzahl HDMI-Anschl\u00fcsse": "1.4",
        "Anzahl VGA D-Sub Anschl\u00fcsse": "1",
        "Anzahl der Farben des Displays": "16,7 Millionen Farben",
        "Anzahl der Lautsprecher": "2",
        "Au\u00dfenverkleidungstyp": "Texturiert",
        "Beh\u00f6rdliche Zulassung": "CB; EPA; cETLus; CE Mark; TUV/GS; TUV Ergo; SEMKO; CU-EAC",
        "Betriebstemperatur": "0 - 40 \u00b0C",
        "Bild-Verbesserung": "SmartImage",
        "Bildschirmdiagonale": "60,5 cm 23.8\"",
        "Bildschirmdiagonale cm": "60,5 cm",
        "Bildschirmform": "Flach",
        "Bildschirmtechnologie": "LCD",
        "Bildwinkel, horizontal": "178\u00b0",
        "Bildwinkel, vertikal": "178\u00b0",
        "Breite ohne Standfu\u00df": "540 mm",
        "DVI Anschluss": "Nein",
        "Digital horizontale Frequenz": "30 - 83 kHz",
        "Digital vertikale Frequenz": "56 - 76 Hz",
        "Display-Aufl\u00f6sung": "1920 x 1080 Pixel",
        "Display-Oberfl\u00e4che": "Matt",
        "DisplayPorts-Version": "1.2",
        "Dynamisches Kontrastverh\u00e4ltnis Marketingbezeichnung": "SmartContrast",
        "Energieeffizienzklasse SDR": "E",
        "Energieeffizienzklasse alt": "E",
        "Energieeffizienzskala": "A bis G",
        "Energieverbrauch SDR pro 1.000 Stunden": "17 kWh",
        "Externes Netzteil": "Nein",
        "Ger\u00e4tebreite inkl. Fu\u00df": "540 mm",
        "Ger\u00e4teh\u00f6he inkl. Fu\u00df": "416 mm",
        "Ger\u00e4tetiefe inkl. Fu\u00df": "220 mm",
        "Gewicht mit St\u00e4nder": "3,03 kg",
        "Gewicht ohne St\u00e4nder": "2,64 kg",
        "HD-Typ": "Full HD",
        "HDMI-Version": "1.4",
        "Helligkeit typisch": "250 cd/m\u00b2",
        "Horizontaler Scanbereich": "30 - 83 kHz",
        "H\u00f6he bei Betrieb": "0 - 3658 m",
        "H\u00f6he bei Lagerung": "0 - 12192 m",
        "H\u00f6he ohne Standfu\u00df": "322 mm",
        "H\u00f6henverstellung": "Nein",
        "Integrierte Kamera": "Nein",
        "Integrierter USB-Hub": "Nein",
        "Komponentenvideo-Synchronisation": "Separate sync, Sync-on-green SOG",
        "Kontrastverh\u00e4ltnis": "1000:1",
        "Kopfh\u00f6rerausg\u00e4nge": "1",
        "LED-Anzeigen": "T\u00e4tigkeit, Stand-by",
        "Marktpositionierung": "Haus",
        "Maximale Bildwiederholrate": "75 Hz",
        "Men\u00fcsprachen": "Vereinfachtes Chinesisch, Traditionelles Chinesisch, Tschechisch, Deutsch, Niederl\u00e4ndisch, Englisch, Spanisch, Finnisch, Franz\u00f6sisch, Griechisch, Ungarisch, Italienisch, Japanisch, Koreanisch, Polnisch, Portugiesisch, Russisch, Schwedisch, T\u00fcrkisch, Ukrainisch",
        "Mitgelieferte Kabel": "HDMI, AC",
        "Mittlere Betriebsdauer zwischen Ausf\u00e4llen MTBF": "50000 h",
        "Nachhaltigkeitszertifikate": "RoHS, ENERGY STAR",
        "Natives Seitenverh\u00e4ltnis": "16:9",
        "Neigungswinkelbereich": "-5 - 20\u00b0",
        "Netzteiltyp": "Intern",
        "Oberfl\u00e4chenh\u00e4rte": "3H",
        "Paketgewicht": "4,53 kg",
        "Panel-Montage-Schnittstelle": "100 x 100 mm",
        "Panel-Typ": "IPS",
        "Pixel Abstand": "0,275 x 0,275 mm",
        "Pixeldichte": "93 ppi",
        "Produktfarbe": "Schwarz",
        "RGB-Farbraum": "sRGB",
        "RMS-Leistung": "2 W",
        "Reaktionszeit": "4 ms",
        "Recycelbares Verpackungsmaterial": "100",
        "Relative Luftfeuchtigkeit in Betrieb": "20 - 80",
        "Schwermetallfrei": "Hg Quecksilber",
        "Seitenverh\u00e4ltnis": "16:9",
        "Sichtbare Gr\u00f6\u00dfe horizontal": "52,7 cm",
        "Sichtbare Gr\u00f6\u00dfe vertikal": "29,6 cm",
        "Slot-Typ Kabelsperre": "Kensington",
        "Stromverbrauch Standardbetrieb": "13,59 W",
        "Stromverbrauch Standby": "0,5 W",
        "Stromverbrauch aus": "0,5 W",
        "TV Tuner integriert": "Nein",
        "Temperaturbereich bei Lagerung": "-20 - 60 \u00b0C",
        "Tiefe ohne Standfu\u00df": "51 mm",
        "Touchscreen": "Nein",
        "Tr\u00fcbungsrate": "25",
        "Typ der Hintergrundbeleuchtung": "W-LED",
        "Unterst\u00fctzt Mac-Betriebssysteme": "Mac OS X 10.0 Cheetah, Mac OS X 10.1 Puma, Mac OS X 10.10 Yosemite, Mac OS X 10.11 El Capitan, Mac OS X 10.12 Sierra, Mac OS X 10.13 High Sierra, Mac OS X 10.14 Mojave, Mac OS X 10.2 Jaguar, Mac OS X 10.3 Panther, Mac OS X 10.4 Tiger, Mac OS X 10.5 Leopard, Mac OS X 10.6 Snow Leopard, Mac OS X 10.7 Lion, Mac OS X 10.8 Mountain Lion, Mac OS X 10.9 Mavericks",
        "Unterst\u00fctzt Windows-Betriebssysteme": "Windows 10, Windows 7, Windows 8, Windows 8.1",
        "Unterst\u00fctzte Grafik-Aufl\u00f6sungen": "1920 x 1080 HD 1080",
        "Unterst\u00fctzte Video-Modi": "1080p",
        "Verpackungsart": "Box",
        "Verpackungsbreite": "608 mm",
        "Verpackungsh\u00f6he": "415 mm",
        "Verpackungstiefe": "121 mm",
        "Vertikaler Scanbereich": "56 - 76 Hz",
        "Warentarifnummer HS": "85285210",
        "Zertifizierung": "CB, EPA, cETLus, CE Mark, TUV/GS, TUV Ergo, SEMKO, CU-EAC"
    },
    "raw_specifications_text": "Bildschirmdiagonale: 60,5 cm 23.8\"\nDisplay-Aufl\u00f6sung: 1920 x 1080 Pixel\nNatives Seitenverh\u00e4ltnis: 16:9\nBildschirmtechnologie: LCD\nTouchscreen: Nein\nHD-Typ: Full HD\nPanel-Typ: IPS\nBildschirmform: Flach\nKontrastverh\u00e4ltnis: 1000:1\nMaximale Bildwiederholrate: 75 Hz\nAnzahl der Farben des Displays: 16,7 Millionen Farben\nTyp der Hintergrundbeleuchtung: W-LED\nHelligkeit typisch: 250 cd/m\u00b2\nReaktionszeit: 4 ms\nDisplay-Oberfl\u00e4che: Matt\nUnterst\u00fctzte Grafik-Aufl\u00f6sungen: 1920 x 1080 HD 1080\nUnterst\u00fctzte Video-Modi: 1080p\nSeitenverh\u00e4ltnis: 16:9\nDynamisches Kontrastverh\u00e4ltnis Marketingbezeichnung: SmartContrast\nBildwinkel, horizontal: 178\u00b0\nBildwinkel, vertikal: 178\u00b0\nPixel Abstand: 0,275 x 0,275 mm\nPixeldichte: 93 ppi\nHorizontaler Scanbereich: 30 - 83 kHz\nVertikaler Scanbereich: 56 - 76 Hz\nSichtbare Gr\u00f6\u00dfe horizontal: 52,7 cm\nSichtbare Gr\u00f6\u00dfe vertikal: 29,6 cm\nDigital horizontale Frequenz: 30 - 83 kHz\nDigital vertikale Frequenz: 56 - 76 Hz\nBildschirmdiagonale cm: 60,5 cm\nTr\u00fcbungsrate: 25\nOberfl\u00e4chenh\u00e4rte: 3H\nRGB-Farbraum: sRGB\nKomponentenvideo-Synchronisation: Separate sync, Sync-on-green SOG\nUnterst\u00fctzt Windows-Betriebssysteme: Windows 10, Windows 7, Windows 8, Windows 8.1\nUnterst\u00fctzt Mac-Betriebssysteme: Mac OS X 10.0 Cheetah, Mac OS X 10.1 Puma, Mac OS X 10.10 Yosemite, Mac OS X 10.11 El Capitan, Mac OS X 10.12 Sierra, Mac OS X 10.13 High Sierra, Mac OS X 10.14 Mojave, Mac OS X 10.2 Jaguar, Mac OS X 10.3 Panther, Mac OS X 10.4 Tiger, Mac OS X 10.5 Leopard, Mac OS X 10.6 Snow Leopard, Mac OS X 10.7 Lion, Mac OS X 10.8 Mountain Lion, Mac OS X 10.9 Mavericks\nIntegrierte Kamera: Nein\nAnzahl der Lautsprecher: 2\nRMS-Leistung: 2 W\nMarktpositionierung: Haus\nProduktfarbe: Schwarz\nSchwermetallfrei: Hg Quecksilber\nZertifizierung: CB, EPA, cETLus, CE Mark, TUV/GS, TUV Ergo, SEMKO, CU-EAC\nIntegrierter USB-Hub: Nein\nAnzahl VGA D-Sub Anschl\u00fcsse: 1\nDVI Anschluss: Nein\nAnzahl HDMI-Anschl\u00fcsse: 1.4\nHDMI-Version: 1.4\nAnzahl DisplayPort Anschl\u00fcsse: 1.2\nDisplayPorts-Version: 1.2\nKopfh\u00f6rerausg\u00e4nge: 1\nH\u00f6henverstellung: Nein\nPanel-Montage-Schnittstelle: 100 x 100 mm\nSlot-Typ Kabelsperre: Kensington\nNeigungswinkelbereich: -5 - 20\u00b0\nMen\u00fcsprachen: Vereinfachtes Chinesisch, Traditionelles Chinesisch, Tschechisch, Deutsch, Niederl\u00e4ndisch, Englisch, Spanisch, Finnisch, Franz\u00f6sisch, Griechisch, Ungarisch, Italienisch, Japanisch, Koreanisch, Polnisch, Portugiesisch, Russisch, Schwedisch, T\u00fcrkisch, Ukrainisch\nLED-Anzeigen: T\u00e4tigkeit, Stand-by\nEnergieeffizienzklasse SDR: E\nEnergieverbrauch SDR pro 1.000 Stunden: 17 kWh\nStromverbrauch Standardbetrieb: 13,59 W\nStromverbrauch Standby: 0,5 W\nStromverbrauch aus: 0,5 W\nAC Eingangsspannung: 100 - 240 V\nAC Eingangsfrequenz: 50 - 60 Hz\nNetzteiltyp: Intern\nEnergieeffizienzskala: A bis G\nExternes Netzteil: Nein\nBetriebstemperatur: 0 - 40 \u00b0C\nTemperaturbereich bei Lagerung: -20 - 60 \u00b0C\nRelative Luftfeuchtigkeit in Betrieb: 20 - 80\nH\u00f6he bei Betrieb: 0 - 3658 m\nH\u00f6he bei Lagerung: 0 - 12192 m\nMitgelieferte Kabel: HDMI, AC\nGer\u00e4tebreite inkl. Fu\u00df: 540 mm\nGer\u00e4tetiefe inkl. Fu\u00df: 220 mm\nGer\u00e4teh\u00f6he inkl. Fu\u00df: 416 mm\nGewicht mit St\u00e4nder: 3,03 kg\nBreite ohne Standfu\u00df: 540 mm\nTiefe ohne Standfu\u00df: 51 mm\nH\u00f6he ohne Standfu\u00df: 322 mm\nGewicht ohne St\u00e4nder: 2,64 kg\nVerpackungsbreite: 608 mm\nVerpackungstiefe: 121 mm\nVerpackungsh\u00f6he: 415 mm\nPaketgewicht: 4,53 kg\nVerpackungsart: Box\nNachhaltigkeitszertifikate: RoHS, ENERGY STAR\nWarentarifnummer HS: 85285210\nTV Tuner integriert: Nein\nAu\u00dfenverkleidungstyp: Texturiert\nRecycelbares Verpackungsmaterial: 100\nMittlere Betriebsdauer zwischen Ausf\u00e4llen MTBF: 50000 h\nBild-Verbesserung: SmartImage\nBeh\u00f6rdliche Zulassung: CB; EPA; cETLus; CE Mark; TUV/GS; TUV Ergo; SEMKO; CU-EAC\nEnergieeffizienzklasse alt: E",
    "reference_file": "offer_reference_2105.json",
    "shop_name": "CSV-Direct.de"
}