{
    "html_file": "offer_1304_19.html",
    "name": "Samsung Odyssey Neo G9 G95NA (2021), 49\"",
    "offer_link": "https://www.amazon.de/dp/B096GCHVYF?linkCode=xm2&camp=2025&creative=165953&smid=A3JWKAKR8XB7XF&creativeASIN=B096GCHVYF&tag=geizhals1-21",
    "price": 1914.96,
    "raw_specifications": {
        "ASIN": "B096GCHVYF",
        "Amazon Bestseller-Rang": "Nr. 85,239 in Computer & Zubeh\u00f6r (Siehe Top 100 in Computer & Zubeh\u00f6r)  Nr. 1,569 in Monitore",
        "Anzahl HDMI Schnittstellen": "\u200e3",
        "Anzahl USB 3.0 Schnittstellen": "\u200e3",
        "Anzahl der Lithium-Ionen-Zellen": "\u200e5",
        "Anzahl der Lithium-Metall-Zellen": "\u200e5",
        "Artikelgewicht": "\u200e2 Kilograms",
        "Batterien": "\u200e1 Lithium-Ionen Batterien erforderlich.",
        "Batterien enthalten": "\u200eNein",
        "Display-Gr\u00f6\u00dfe": "\u200e49 Zoll",
        "Durchschnittliche Kundenbewertung": "4,2  4,2 von 5 Sternen    \n    162 Sternebewertungen   \n\n\n 4,2 von 5 Sternen",
        "Farbe": "\u200eSchwarz / Wei\u00df",
        "Garantierte Software-Updates bis": "\u200eunbekannt",
        "Gewicht Lithium-Akku": "\u200e2 Gramm",
        "Hersteller": "\u200eSamsung",
        "Im Angebot von Amazon.de seit": "9. August 2021",
        "Kapazit\u00e4t Lithium-Akku": "\u200e2 Kilowattstunden",
        "L\u00f6sung": "\u200e5120 x 2160",
        "Marke": "\u200eSamsung",
        "Modell/Serie": "\u200eS49AG952NU",
        "Modellnummer": "\u200eLS49AG952NUXEN",
        "Produktabmessungen": "\u200e10 x 48 x 50 cm; 2 Kilogramm",
        "Volt": "\u200e220",
        "Watt": "\u200e55 Watt"
    },
    "raw_specifications_text": "Marke: \u200eSamsung\nHersteller: \u200eSamsung\nModell/Serie: \u200eS49AG952NU\nProduktabmessungen: \u200e10 x 48 x 50 cm; 2 Kilogramm\nBatterien: \u200e1 Lithium-Ionen Batterien erforderlich.\nModellnummer: \u200eLS49AG952NUXEN\nFarbe: \u200eSchwarz / Wei\u00df\nDisplay-Gr\u00f6\u00dfe: \u200e49 Zoll\nL\u00f6sung: \u200e5120 x 2160\nAnzahl USB 3.0 Schnittstellen: \u200e3\nAnzahl HDMI Schnittstellen: \u200e3\nVolt: \u200e220\nWatt: \u200e55 Watt\nBatterien enthalten: \u200eNein\nKapazit\u00e4t Lithium-Akku: \u200e2 Kilowattstunden\nGewicht Lithium-Akku: \u200e2 Gramm\nAnzahl der Lithium-Ionen-Zellen: \u200e5\nAnzahl der Lithium-Metall-Zellen: \u200e5\nArtikelgewicht: \u200e2 Kilograms\nGarantierte Software-Updates bis: \u200eunbekannt\nASIN: B096GCHVYF\nDurchschnittliche Kundenbewertung: 4,2  4,2 von 5 Sternen    \n    162 Sternebewertungen   \n\n\n 4,2 von 5 Sternen\nAmazon Bestseller-Rang: Nr. 85,239 in Computer & Zubeh\u00f6r (Siehe Top 100 in Computer & Zubeh\u00f6r)  Nr. 1,569 in Monitore\nIm Angebot von Amazon.de seit: 9. August 2021",
    "reference_file": "offer_reference_1304.json",
    "shop_name": "Amazon.at"
}