{
    "html_file": "offer_691_12.html",
    "name": "AOC Q27B3MA, 27\"",
    "offer_link": "https://www.mylemon.at/artikel/aoc/q27b3ma/27-l-q27b3ma.html",
    "price": 165.89,
    "raw_specifications": {
        "AC Eingangsfrequenz": "50 - 60 Hz",
        "AC Eingangsspannung": "100 - 240 V",
        "Abnehmbarer Standfu\u00df": "Ja",
        "Adobe RGB-Abdeckung": "95%",
        "Anzahl DisplayPort Anschl\u00fcsse": "2",
        "Anzahl HDMI-Anschl\u00fcsse": "2",
        "Anzahl OSD-Sprachen": "19",
        "Anzahl der Farben des Displays": "16,7 Millionen Farben",
        "Anzahl der Lautsprecher": "2",
        "Artikelnummer": "M1DYJ2PL",
        "Aufl\u00f6sung": "2560x1440",
        "Au\u00dfenverkleidungstyp": "Matt",
        "Bildschirmdiagonale": "68,6 cm (27 Zoll)",
        "Bildschirmdiagonale (cm)": "68,6 cm",
        "Bildschirmform": "Flach",
        "Bildschirmtechnologie": "LED",
        "Bildwinkel, horizontal": "178\u00b0",
        "Bildwinkel, vertikal": "178\u00b0",
        "Blendfreier Bildschirm": "Ja",
        "Breite (ohne Standfu\u00df)": "61,4 cm",
        "Buchsenstecker-Typ": "C5",
        "DVI Anschluss": "Nein",
        "Display-Aufl\u00f6sung": "2560 x 1440 Pixel",
        "DisplayPorts-Version": "1.2",
        "Displaygr\u00f6\u00dfe": "27 Zoll",
        "EAN": "4038986180429",
        "Eingebaute Lautsprecher": "Ja",
        "Eingebautes Mikrofon": "Nein",
        "Farbpalette DCI-P3": "88%",
        "Flimmerfreie Technologie": "Ja",
        "Fu\u00dffarbe": "Schwarz",
        "Ger\u00e4tebreite (inkl. Fu\u00df)": "614 mm",
        "Ger\u00e4teh\u00f6he (inkl. Fu\u00df)": "460 mm",
        "Ger\u00e4tetiefe (inkl. Fu\u00df)": "229,8 mm",
        "Gewicht (mit St\u00e4nder)": "3,9 kg",
        "HD-Typ": "Quad HD",
        "HDCP": "Ja",
        "HDCP-Version": "1.4",
        "HDMI": "Ja",
        "HDMI-Kabell\u00e4nge": "1,5 m",
        "HDMI-Version": "1.4",
        "Helligkeit": "250 cd/m\u00b2",
        "Helligkeit (typisch)": "250 cd/m\u00b2",
        "Hersteller Artikelnummer": "Q27B3MA",
        "H\u00f6he (ohne Standfu\u00df)": "36,4 cm",
        "Integrierte Kamera": "Nein",
        "Integrierter USB-Hub": "Nein",
        "Kabelsperre-Slot": "Ja",
        "Kontrastverh\u00e4ltnis": "4000:1",
        "Kontrastverh\u00e4ltnis (dynamisch)": "20000000:1",
        "Kopfh\u00f6rer-Anschluss": "3,5 mm",
        "Kopfh\u00f6rerausgang": "Ja",
        "Kopfh\u00f6rerausg\u00e4nge": "1",
        "LED-Anzeigen": "Ja",
        "Lichteffekte": "Nein",
        "Low-Blue-Light-Technologie": "Ja",
        "Markenspezifische Eigenschaften": "False",
        "Marktpositionierung": "Haus",
        "Maximale Bildwiederholrate": "75 Hz",
        "Men\u00fcsprachen": "Vereinfachtes Chinesisch, Traditionelles Chinesisch, Kroatisch, Tschechisch, Deutsch, Niederl\u00e4ndisch, Englisch, Spanisch, Finnisch, Franz\u00f6sisch, Italienisch, Japanisch, Koreanisch, Polnisch, Portugiesisch, Russisch, Schwedisch, T\u00fcrkisch, Ukrainisch",
        "Mitgelieferte Kabel": "AC",
        "Mittlere Betriebsdauer zwischen Ausf\u00e4llen (MTBF)": "50000 h",
        "Mobile High-Definition Link (MHL)": "Nein",
        "NTSC Abdeckung (typisch)": "96%",
        "NVIDIA G-SYNC": "Nein",
        "Natives Seitenverh\u00e4ltnis": "16:9",
        "Neigungsverstellung": "Ja",
        "Neigungswinkelbereich": "-3,5 - 21,5\u00b0",
        "Netzteiltyp": "Intern",
        "Oberfl\u00e4chenh\u00e4rte": "6H",
        "On-Screen-Display (OSD)": "Ja",
        "Paketgewicht": "6,39 kg",
        "Panel": "VA",
        "Panel-Montage-Schnittstelle": "100 x 100 mm",
        "Panel-Typ": "VA",
        "Pivot": "Ja",
        "Pixel Abstand": "0,2331 x 0,2331 mm",
        "Pixeldichte": "108,8 ppi",
        "Produktfarbe": "Schwarz",
        "RMS-Leistung": "4 W",
        "Rahmenloses Design": "Ja",
        "Reaktionszeit": "4 ms",
        "Schnellladung": "Nein",
        "Slot-Typ Kabelsperre": "Kensington",
        "Stromadapter enthalten": "Ja",
        "Stromeingang": "Ja",
        "Stromverbrauch (Standardbetrieb)": "25 W",
        "Stromverbrauch (Standby)": "0,5 W",
        "Stromverbrauch (aus)": "0,3 W",
        "St\u00e4nder enthalten": "Ja",
        "Tiefe (ohne Standfu\u00df)": "4,47 cm",
        "Touchscreen": "Nein",
        "Typ der Hintergrundbeleuchtung": "W-LED",
        "VESA Adaptive Sync unterst\u00fctzt": "Ja",
        "VESA-Halterung": "Ja",
        "Verpackungsart": "Box",
        "Verpackungsbreite": "690 mm",
        "Verpackungsh\u00f6he": "453 mm",
        "Verpackungstiefe": "142 mm",
        "Video Anschl\u00fcsse": "2x HDMI, 1x DisplayPort",
        "Vorderer Rahmen": "Schwarz",
        "Wandmontage": "Ja",
        "W\u00e4hlscheibenpunkt": "Nein",
        "Zertifizierung": "True",
        "sRGB Abdeckung (klassisch)": "110%"
    },
    "raw_specifications_text": "Displaygr\u00f6\u00dfe: 27 Zoll\nAufl\u00f6sung: 2560x1440\nPanel: VA\nReaktionszeit: 4 ms\nVideo Anschl\u00fcsse: 2x HDMI, 1x DisplayPort\nHelligkeit: 250 cd/m\u00b2\nHersteller Artikelnummer: Q27B3MA\nEAN: 4038986180429\nArtikelnummer: M1DYJ2PL\nBildschirmdiagonale: 68,6 cm (27 Zoll)\nDisplay-Aufl\u00f6sung: 2560 x 1440 Pixel\nNatives Seitenverh\u00e4ltnis: 16:9\nBildschirmtechnologie: LED\nTouchscreen: Nein\nHD-Typ: Quad HD\nPanel-Typ: VA\nBildschirmform: Flach\nKontrastverh\u00e4ltnis: 4000:1\nMaximale Bildwiederholrate: 75 Hz\nAnzahl der Farben des Displays: 16,7 Millionen Farben\nTyp der Hintergrundbeleuchtung: W-LED\nHelligkeit (typisch): 250 cd/m\u00b2\nBlendfreier Bildschirm: Ja\nKontrastverh\u00e4ltnis (dynamisch): 20000000:1\nBildwinkel, horizontal: 178\u00b0\nBildwinkel, vertikal: 178\u00b0\nPixel Abstand: 0,2331 x 0,2331 mm\nPixeldichte: 108,8 ppi\nBildschirmdiagonale (cm): 68,6 cm\nOberfl\u00e4chenh\u00e4rte: 6H\nsRGB Abdeckung (klassisch): 110%\nNTSC Abdeckung (typisch): 96%\nAdobe RGB-Abdeckung: 95%\nNVIDIA G-SYNC: Nein\nSchnellladung: Nein\nVESA Adaptive Sync unterst\u00fctzt: Ja\nFlimmerfreie Technologie: Ja\nLow-Blue-Light-Technologie: Ja\nW\u00e4hlscheibenpunkt: Nein\nMarkenspezifische Eigenschaften: False\nEingebaute Lautsprecher: Ja\nIntegrierte Kamera: Nein\nAnzahl der Lautsprecher: 2\nRMS-Leistung: 4 W\nEingebautes Mikrofon: Nein\nMarktpositionierung: Haus\nProduktfarbe: Schwarz\nRahmenloses Design: Ja\nVorderer Rahmen: Schwarz\nAbnehmbarer Standfu\u00df: Ja\nFu\u00dffarbe: Schwarz\nZertifizierung: True\nIntegrierter USB-Hub: Nein\nHDMI: Ja\nKopfh\u00f6rerausgang: Ja\nDVI Anschluss: Nein\nAnzahl HDMI-Anschl\u00fcsse: 2\nHDMI-Version: 1.4\nAnzahl DisplayPort Anschl\u00fcsse: 2\nDisplayPorts-Version: 1.2\nKopfh\u00f6rerausg\u00e4nge: 1\nKopfh\u00f6rer-Anschluss: 3,5 mm\nHDCP: Ja\nHDCP-Version: 1.4\nStromeingang: Ja\nMobile High-Definition Link (MHL): Nein\nVESA-Halterung: Ja\nKabelsperre-Slot: Ja\nPanel-Montage-Schnittstelle: 100 x 100 mm\nWandmontage: Ja\nSlot-Typ Kabelsperre: Kensington\nPivot: Ja\nNeigungswinkelbereich: -3,5 - 21,5\u00b0\nOn-Screen-Display (OSD): Ja\nMen\u00fcsprachen: Vereinfachtes Chinesisch, Traditionelles Chinesisch, Kroatisch, Tschechisch, Deutsch, Niederl\u00e4ndisch, Englisch, Spanisch, Finnisch, Franz\u00f6sisch, Italienisch, Japanisch, Koreanisch, Polnisch, Portugiesisch, Russisch, Schwedisch, T\u00fcrkisch, Ukrainisch\nAnzahl OSD-Sprachen: 19\nLED-Anzeigen: Ja\nNeigungsverstellung: Ja\nStromverbrauch (Standardbetrieb): 25 W\nStromverbrauch (Standby): 0,5 W\nStromverbrauch (aus): 0,3 W\nAC Eingangsspannung: 100 - 240 V\nAC Eingangsfrequenz: 50 - 60 Hz\nNetzteiltyp: Intern\nBuchsenstecker-Typ: C5\nSt\u00e4nder enthalten: Ja\nMitgelieferte Kabel: AC\nStromadapter enthalten: Ja\nHDMI-Kabell\u00e4nge: 1,5 m\nGer\u00e4tebreite (inkl. Fu\u00df): 614 mm\nGer\u00e4tetiefe (inkl. Fu\u00df): 229,8 mm\nGer\u00e4teh\u00f6he (inkl. Fu\u00df): 460 mm\nGewicht (mit St\u00e4nder): 3,9 kg\nBreite (ohne Standfu\u00df): 61,4 cm\nTiefe (ohne Standfu\u00df): 4,47 cm\nH\u00f6he (ohne Standfu\u00df): 36,4 cm\nVerpackungsbreite: 690 mm\nVerpackungstiefe: 142 mm\nVerpackungsh\u00f6he: 453 mm\nPaketgewicht: 6,39 kg\nVerpackungsart: Box\nFarbpalette DCI-P3: 88%\nAu\u00dfenverkleidungstyp: Matt\nMittlere Betriebsdauer zwischen Ausf\u00e4llen (MTBF): 50000 h\nLichteffekte: Nein",
    "reference_file": "offer_reference_691.json",
    "shop_name": "mylemon.at"
}