{
    "html_file": "offer_270_3.html",
    "name": "HP E27u G5, 27\"",
    "offer_link": "https://www.mylemon.at/artikel/hewlett_packard/6n4d3aa_abb/hp-e27u-g5-ips-qhd.html",
    "price": 309.09,
    "raw_specifications": {
        "AC Eingangsfrequenz": "50/60 Hz",
        "AC Eingangsspannung": "100 - 240 V",
        "AMD FreeSync": "Nein",
        "Anzahl DisplayPort Anschl\u00fcsse": "2",
        "Anzahl HDMI-Anschl\u00fcsse": "1",
        "Anzahl RJ-45-Anschl\u00fcsse": "1",
        "Anzahl der Farben des Displays": "16,7 Millionen Farben",
        "Anzahl der Upstream-Ports USB Typ-C": "1",
        "Anzahl der nachgeschalteten Ports vom Typ USB-C": "1",
        "Anzahl der nachgeschalteten Steckpl\u00e4tze vom Typ USB-A": "3",
        "Artikelnummer": "M1GYIBZL",
        "Aufl\u00f6sung": "1920x1080",
        "Besonderheiten": "75 Hz, USB HUB",
        "Betriebstemperatur": "5 - 35 \u00b0C",
        "Bildschirmdiagonale": "68,6 cm (27\")",
        "Bildschirmdiagonale (cm)": "68,6 cm",
        "Bildschirmform": "Flach",
        "Bildschirmtechnologie": "LCD",
        "Bildwinkel, horizontal": "178\u00b0",
        "Bildwinkel, vertikal": "178\u00b0",
        "Blendfreier Bildschirm": "Ja",
        "Breite (ohne Standfu\u00df)": "613,4 mm",
        "Display-Aufl\u00f6sung": "2560 x 1440 Pixel",
        "DisplayPorts-Version": "1.2",
        "Displaygr\u00f6\u00dfe": "23,8 Zoll",
        "EAN": "0196786295973",
        "Eingebaute Lautsprecher": "Nein",
        "Eingebauter Ethernet-Anschluss": "Ja",
        "Energieeffizienzklasse (SDR)": "F",
        "Ergonomie": "H\u00f6henverstellbar, Pivot (90 Grad drehbar), Schwenkbar, Neigbar",
        "Farbskala": "99%",
        "Ger\u00e4tebreite (inkl. Fu\u00df)": "613,4 mm",
        "Ger\u00e4teh\u00f6he (inkl. Fu\u00df)": "544,7 mm",
        "Ger\u00e4tetiefe (inkl. Fu\u00df)": "168,5 mm",
        "Gewicht": "7,2 kg",
        "Gewicht (mit St\u00e4nder)": "7,2 kg",
        "HD-Typ": "Quad HD",
        "HDMI": "Ja",
        "HDMI-Version": "1.4",
        "HP-Segment": "Business",
        "Helligkeit": "250 cd/m\u00b2",
        "Helligkeit (typisch)": "350 cd/m\u00b2",
        "Hersteller Artikelnummer": "6N4D3AA#ABB",
        "Horizontaler Scanbereich": "30 - 120 kHz",
        "H\u00f6he (ohne Standfu\u00df)": "364,6 mm",
        "H\u00f6heneinstellung": "15 cm",
        "H\u00f6henverstellung": "Ja",
        "Integrierte Kamera": "Nein",
        "Integrierter USB-Hub": "Ja",
        "Kabelsperre-Slot": "Ja",
        "Kontrastverh\u00e4ltnis": "1000:1",
        "Kontrastverh\u00e4ltnis (dynamisch)": "8000000:1",
        "Kopfh\u00f6rerausgang": "Nein",
        "Luftfeuchtigkeit bei Lagerung": "5 - 95%",
        "Marktpositionierung": "Business",
        "Maximale Bildwiederholrate": "75 Hz",
        "Mitgelieferte Kabel": "USB Typ-C",
        "NVIDIA G-SYNC": "Nein",
        "Nachhaltige Technologien und Materialien": "Low Halogen; Molded paper pulp cushion inside box is 100% sustainably sourced and recyclable; Outside box and corrugated cushions are 100% sustainably sourced and recyclable; Contains ocean-bound recycled plastic; 80% ITE-derived closed loop plastic; At least 30% recycled metal",
        "Nachhaltigkeitszertifikate": "ENERGY STAR",
        "Natives Seitenverh\u00e4ltnis": "16:9",
        "Oberfl\u00e4chenh\u00e4rte": "3H",
        "Paketgewicht": "9,7 kg",
        "Panel": "IPS",
        "Panel-Montage-Schnittstelle": "100 x 100 mm",
        "Panel-Typ": "IPS",
        "Pivot": "Ja",
        "Pivot Winkel": "-90 - 90\u00b0",
        "Pixel Abstand": "0,23 x 0,23 mm",
        "Pixeldichte": "109 ppi",
        "Produktfarbe": "Schwarz",
        "RGB-Farbraum": "sRGB",
        "Reaktionszeit": "5 ms",
        "Relative Luftfeuchtigkeit in Betrieb": "20 - 80%",
        "Schwenkbar": "Ja",
        "Schwenkwinkelbereich": "-45 - 45\u00b0",
        "Stromverbrauch (Standardbetrieb)": "34,5 W",
        "Stromverbrauch (Standby)": "0,5 W",
        "Stromverbrauch (max.)": "160 W",
        "Tiefe (ohne Standfu\u00df)": "74,7 mm",
        "Touchscreen": "Nein",
        "Typ der Hintergrundbeleuchtung": "Seiten-LED",
        "USB Power Delivery": "Ja",
        "USB-Typ-C DisplayPort-Wechselmodus": "Ja",
        "USB-Upstream-Porttyp": "USB Typ-C",
        "Unterst\u00fctzte Grafik-Aufl\u00f6sungen": "640 x 480 (VGA), 720 x 400, 800 x 600 (SVGA), 1024 x 768 (XGA), 1280 x 1024 (SXGA), 1280 x 720 (HD 720), 1440 x 900 (WXGA+), 1600 x 900, 1680 x 1050 (WSXGA+), 1920 x 1080 (HD 1080), 1920 x 1200 (WUXGA), 2560 x 1440",
        "Ursprungsland": "China",
        "VESA Halterung": "100x100 mm",
        "VESA-Halterung": "Ja",
        "Verpackungsbreite": "613,4 mm",
        "Verpackungsh\u00f6he": "544,7 mm",
        "Verpackungstiefe": "168,5 mm",
        "Vertikaler Scanbereich": "50 - 75 Hz",
        "Video Anschl\u00fcsse": "1x HDMI, 1x DisplayPort, USB-C DisplayPort"
    },
    "raw_specifications_text": "Displaygr\u00f6\u00dfe: 23,8 Zoll\nAufl\u00f6sung: 1920x1080\nPanel: IPS\nReaktionszeit: 5 ms\nVideo Anschl\u00fcsse: 1x HDMI, 1x DisplayPort, USB-C DisplayPort\nErgonomie: H\u00f6henverstellbar, Pivot (90 Grad drehbar), Schwenkbar, Neigbar\nVESA Halterung: 100x100 mm\nHelligkeit: 250 cd/m\u00b2\nBesonderheiten: 75 Hz, USB HUB\nHersteller Artikelnummer: 6N4D3AA#ABB\nEAN: 0196786295973\nArtikelnummer: M1GYIBZL\nBildschirmdiagonale: 68,6 cm (27\")\nDisplay-Aufl\u00f6sung: 2560 x 1440 Pixel\nNatives Seitenverh\u00e4ltnis: 16:9\nBildschirmtechnologie: LCD\nTouchscreen: Nein\nHD-Typ: Quad HD\nPanel-Typ: IPS\nBildschirmform: Flach\nKontrastverh\u00e4ltnis: 1000:1\nMaximale Bildwiederholrate: 75 Hz\nAnzahl der Farben des Displays: 16,7 Millionen Farben\nTyp der Hintergrundbeleuchtung: Seiten-LED\nHelligkeit (typisch): 350 cd/m\u00b2\nBlendfreier Bildschirm: Ja\nUnterst\u00fctzte Grafik-Aufl\u00f6sungen: 640 x 480 (VGA), 720 x 400, 800 x 600 (SVGA), 1024 x 768 (XGA), 1280 x 1024 (SXGA), 1280 x 720 (HD 720), 1440 x 900 (WXGA+), 1600 x 900, 1680 x 1050 (WSXGA+), 1920 x 1080 (HD 1080), 1920 x 1200 (WUXGA), 2560 x 1440\nKontrastverh\u00e4ltnis (dynamisch): 8000000:1\nBildwinkel, horizontal: 178\u00b0\nBildwinkel, vertikal: 178\u00b0\nPixel Abstand: 0,23 x 0,23 mm\nPixeldichte: 109 ppi\nHorizontaler Scanbereich: 30 - 120 kHz\nVertikaler Scanbereich: 50 - 75 Hz\nBildschirmdiagonale (cm): 68,6 cm\nOberfl\u00e4chenh\u00e4rte: 3H\nRGB-Farbraum: sRGB\nFarbskala: 99%\nNVIDIA G-SYNC: Nein\nAMD FreeSync: Nein\nHP-Segment: Business\nEingebaute Lautsprecher: Nein\nIntegrierte Kamera: Nein\nMarktpositionierung: Business\nProduktfarbe: Schwarz\nUrsprungsland: China\nIntegrierter USB-Hub: Ja\nHDMI: Ja\nKopfh\u00f6rerausgang: Nein\nUSB-Upstream-Porttyp: USB Typ-C\nAnzahl der Upstream-Ports USB Typ-C: 1\nAnzahl der nachgeschalteten Steckpl\u00e4tze vom Typ USB-A: 3\nAnzahl der nachgeschalteten Ports vom Typ USB-C: 1\nUSB-Typ-C DisplayPort-Wechselmodus: Ja\nUSB Power Delivery: Ja\nAnzahl HDMI-Anschl\u00fcsse: 1\nHDMI-Version: 1.4\nAnzahl DisplayPort Anschl\u00fcsse: 2\nDisplayPorts-Version: 1.2\nEingebauter Ethernet-Anschluss: Ja\nVESA-Halterung: Ja\nKabelsperre-Slot: Ja\nH\u00f6henverstellung: Ja\nPanel-Montage-Schnittstelle: 100 x 100 mm\nH\u00f6heneinstellung: 15 cm\nPivot: Ja\nPivot Winkel: -90 - 90\u00b0\nSchwenkbar: Ja\nSchwenkwinkelbereich: -45 - 45\u00b0\nEnergieeffizienzklasse (SDR): F\nStromverbrauch (Standardbetrieb): 34,5 W\nStromverbrauch (Standby): 0,5 W\nStromverbrauch (max.): 160 W\nAC Eingangsspannung: 100 - 240 V\nAC Eingangsfrequenz: 50/60 Hz\nBetriebstemperatur: 5 - 35 \u00b0C\nRelative Luftfeuchtigkeit in Betrieb: 20 - 80%\nLuftfeuchtigkeit bei Lagerung: 5 - 95%\nMitgelieferte Kabel: USB Typ-C\nGer\u00e4tebreite (inkl. Fu\u00df): 613,4 mm\nGer\u00e4tetiefe (inkl. Fu\u00df): 168,5 mm\nGer\u00e4teh\u00f6he (inkl. Fu\u00df): 544,7 mm\nGewicht (mit St\u00e4nder): 7,2 kg\nBreite (ohne Standfu\u00df): 613,4 mm\nTiefe (ohne Standfu\u00df): 74,7 mm\nH\u00f6he (ohne Standfu\u00df): 364,6 mm\nVerpackungsbreite: 613,4 mm\nVerpackungstiefe: 168,5 mm\nVerpackungsh\u00f6he: 544,7 mm\nPaketgewicht: 9,7 kg\nNachhaltigkeitszertifikate: ENERGY STAR\nNachhaltige Technologien und Materialien: Low Halogen; Molded paper pulp cushion inside box is 100% sustainably sourced and recyclable; Outside box and corrugated cushions are 100% sustainably sourced and recyclable; Contains ocean-bound recycled plastic; 80% ITE-derived closed loop plastic; At least 30% recycled metal\nAnzahl RJ-45-Anschl\u00fcsse: 1\nGewicht: 7,2 kg",
    "reference_file": "offer_reference_270.json",
    "shop_name": "mylemon.at"
}