{
    "html_file": "offer_1106_18.html",
    "name": "BenQ PD3205U, 31.5\"",
    "offer_link": "https://www.hiq24.de/shop/artikel/316859/?sPartner=geizhals",
    "price": 622.5,
    "raw_specifications": {
        "Abmessungen (Breite x Tiefe x H\u00f6he)": "71.47 cm x 25.68 cm x 58.9 cm - mit Standfu\u00df (h\u00f6chste Position)",
        "Abmessungen (Breite x Tiefe x H\u00f6he) - mit Standfu\u00df (h\u00f6chste Position)": "71.47 cm x 25.68 cm x 58.9 cm",
        "Ausgangsleistung/Kanal": "2.5 Watt",
        "Besonderheiten": "Bild f\u00fcr Bild, AMA-Technologie (Advanced Motion Accelerator), Low Blue Light Mode, flimmerfreie Technologie, CAD/CAM Mode, M-book Mode, Auto Pivot, Dual View, Animationsmodus, FreeSync Technology, Werks-Kalibrierungsbericht, Dark Room mode, Picture-in-Picture, an 3 Seiten ohne Blende, AQCOLOR-Technologie, Pantone-zertifiziert, Monitorkalibrierung Delta E<3, Uniformity Technology, CalMAN Verified, DICOM Compliant",
        "Bildschirmbeschichtung": "Blendfrei",
        "Bildschirmtyp": "IPS",
        "Details zu Abmessungen & Gewicht": "Mit Standfu\u00df (h\u00f6chste Position) - Breite: 71.47 cm - Tiefe: 25.68 cm - H\u00f6he: 58.9 cm - Gewicht: 9.4 kg  Mit Standfu\u00df (niedrigste Position) - Breite: 71.47 cm - Tiefe: 25.68 cm - H\u00f6he: 47.9 cm - Gewicht: 9.4 kg  Ohne Fu\u00df - Breite: 71.47 cm - Tiefe: 8.524 cm - H\u00f6he: 42.2 cm - Gewicht: 6.2 kg",
        "Diagonalabmessung": "80 cm (32\")",
        "Display-Typ": "LED-hintergrundbeleuchteter LCD-Monitor / TFT-Aktivmatrix",
        "Eingangsanschl\u00fcsse": "HDMI, DisplayPort, USB-C",
        "Eingangsspannung": "Wechselstrom 100-240 V",
        "Einstellungen der Anzeigeposition": "H\u00f6he, Pivot (Rotation), Drehung, Neigung",
        "Energie Effizienzklasse": "Klasse F",
        "Energieklasse (HDR)": "Klasse G",
        "Energierverbrauch Sleep": "0.5 Watt",
        "Farbraum": "99% Rec 709, 99% sRGB",
        "Farbtemperatur": "9300K, 5000K, 6500K",
        "Farbunterst\u00fctzung": "1,07 Mrd. Farben",
        "Ger\u00e4tetyp": "LED-hintergrundbeleuchteter LCD-Monitor - 80 cm (32\")",
        "Gewicht": "9.4 kg",
        "HDR-Format": "HDR10",
        "HDR-f\u00e4hig": "HDR10",
        "Helligkeit": "250 cd/m\u00b2",
        "Hintergrundbeleuchtungs-Technologie": "LED-Hintergrundbeleuchtung",
        "Horizontaler Betrachtungswinkel": "178",
        "H\u00f6heneinstellung": "110 mm",
        "Integrierte Peripherieger\u00e4te": "KVM-Switch, USB 3.2/USB-C Hub",
        "Kennzeichnung": "TUV Rheinland, HDCP 2.2, FCC Part 15 Subpart B",
        "Kontrast": "1000:1",
        "Leistungsmerkmale": "KVM-Switch, USB 3.2/USB-C Hub, USB PD 90 Watt",
        "Mitgelieferte Software": "Display Pilot",
        "Native Aufl\u00f6sung": "4K 3840 x 2160 bei 60 Hz",
        "Neigungswinkel": "-5/+20",
        "OSD-Sprachen": "Ungarisch, Tschechisch, Chinesisch (tradionell), Chinesisch (vereinfacht), Englisch, Deutsch, Franz\u00f6sisch, Italienisch, Portugiesisch, Polnisch, Schwedisch, Russisch, Spanisch, Holl\u00e4ndisch, Arabisch, Rum\u00e4nisch, Japanisch, Koreanisch",
        "Ppi": "140",
        "Produktbeschreibung": "BenQ DesignVue PD3205U - PD Series - LED-Monitor - 4K - 80 cm (32\") - HDR",
        "Reaktionszeit": "5 ms (Gray-to-Gray)",
        "Rotationswinkel": "90",
        "Schnittstellen": "Kopfh\u00f6rer  HDMI  DisplayPort 1.4  USB-C mit Stromversorgung  2 x USB Upstream (Typ B)  USB-C Downstream  3 x USB 3.2 Downstream",
        "Schwenkwinkel": "60",
        "Seitenverh\u00e4ltnis": "16:9",
        "Spannung": "Wechselstrom 100-240 V",
        "Stromverbrauch (max.)": "168 Watt",
        "Stromverbrauch (typisch)": "31.5 Watt",
        "Stromverbrauch HDR (eingeschaltet)": "44.6 kWh/1.000 h",
        "Stromverbrauch SDR (eingeschaltet)": "30.3 kWh/1.000 h",
        "Typ": "Lautsprecher - Stereo",
        "USB-Spannungsversorgung": "90 Watt",
        "VESA-Halterung": "100 x 100 mm",
        "Vertikaler Betrachtungswinkel": "178",
        "Zubeh\u00f6r im Lieferumfang": "Hotkey Puck G2"
    },
    "raw_specifications_text": "Display-Typ: LED-hintergrundbeleuchteter LCD-Monitor / TFT-Aktivmatrix\nEnergie Effizienzklasse: Klasse F\nEnergieklasse (HDR): Klasse G\nDiagonalabmessung: 80 cm (32\")\nIntegrierte Peripherieger\u00e4te: KVM-Switch, USB 3.2/USB-C Hub\nUSB-Spannungsversorgung: 90 Watt\nBildschirmtyp: IPS\nSeitenverh\u00e4ltnis: 16:9\nNative Aufl\u00f6sung: 4K 3840 x 2160 bei 60 Hz\nPpi: 140\nHelligkeit: 250 cd/m\u00b2\nKontrast: 1000:1\nHDR-Format: HDR10\nFarbunterst\u00fctzung: 1,07 Mrd. Farben\nFarbraum: 99% Rec 709, 99% sRGB\nReaktionszeit: 5 ms (Gray-to-Gray)\nHorizontaler Betrachtungswinkel: 178\nVertikaler Betrachtungswinkel: 178\nBildschirmbeschichtung: Blendfrei\nHintergrundbeleuchtungs-Technologie: LED-Hintergrundbeleuchtung\nFarbtemperatur: 9300K, 5000K, 6500K\nOSD-Sprachen: Ungarisch, Tschechisch, Chinesisch (tradionell), Chinesisch (vereinfacht), Englisch, Deutsch, Franz\u00f6sisch, Italienisch, Portugiesisch, Polnisch, Schwedisch, Russisch, Spanisch, Holl\u00e4ndisch, Arabisch, Rum\u00e4nisch, Japanisch, Koreanisch\nBesonderheiten: Bild f\u00fcr Bild, AMA-Technologie (Advanced Motion Accelerator), Low Blue Light Mode, flimmerfreie Technologie, CAD/CAM Mode, M-book Mode, Auto Pivot, Dual View, Animationsmodus, FreeSync Technology, Werks-Kalibrierungsbericht, Dark Room mode, Picture-in-Picture, an 3 Seiten ohne Blende, AQCOLOR-Technologie, Pantone-zertifiziert, Monitorkalibrierung Delta E<3, Uniformity Technology, CalMAN Verified, DICOM Compliant\nAbmessungen (Breite x Tiefe x H\u00f6he): 71.47 cm x 25.68 cm x 58.9 cm - mit Standfu\u00df (h\u00f6chste Position)\nGewicht: 9.4 kg\nTyp: Lautsprecher - Stereo\nAusgangsleistung/Kanal: 2.5 Watt\nSchnittstellen: Kopfh\u00f6rer  HDMI  DisplayPort 1.4  USB-C mit Stromversorgung  2 x USB Upstream (Typ B)  USB-C Downstream  3 x USB 3.2 Downstream\nEinstellungen der Anzeigeposition: H\u00f6he, Pivot (Rotation), Drehung, Neigung\nNeigungswinkel: -5/+20\nSchwenkwinkel: 60\nRotationswinkel: 90\nH\u00f6heneinstellung: 110 mm\nVESA-Halterung: 100 x 100 mm\nLeistungsmerkmale: KVM-Switch, USB 3.2/USB-C Hub, USB PD 90 Watt\nZubeh\u00f6r im Lieferumfang: Hotkey Puck G2\nKennzeichnung: TUV Rheinland, HDCP 2.2, FCC Part 15 Subpart B\nEingangsspannung: Wechselstrom 100-240 V\nStromverbrauch SDR (eingeschaltet): 30.3 kWh/1.000 h\nStromverbrauch HDR (eingeschaltet): 44.6 kWh/1.000 h\nStromverbrauch (typisch): 31.5 Watt\nStromverbrauch (max.): 168 Watt\nEnergierverbrauch Sleep: 0.5 Watt\nMitgelieferte Software: Display Pilot\nDetails zu Abmessungen & Gewicht: Mit Standfu\u00df (h\u00f6chste Position) - Breite: 71.47 cm - Tiefe: 25.68 cm - H\u00f6he: 58.9 cm - Gewicht: 9.4 kg  Mit Standfu\u00df (niedrigste Position) - Breite: 71.47 cm - Tiefe: 25.68 cm - H\u00f6he: 47.9 cm - Gewicht: 9.4 kg  Ohne Fu\u00df - Breite: 71.47 cm - Tiefe: 8.524 cm - H\u00f6he: 42.2 cm - Gewicht: 6.2 kg\nProduktbeschreibung: BenQ DesignVue PD3205U - PD Series - LED-Monitor - 4K - 80 cm (32\") - HDR\nGer\u00e4tetyp: LED-hintergrundbeleuchteter LCD-Monitor - 80 cm (32\")\nHDR-f\u00e4hig: HDR10\nEingangsanschl\u00fcsse: HDMI, DisplayPort, USB-C\nSpannung: Wechselstrom 100-240 V\nAbmessungen (Breite x Tiefe x H\u00f6he) - mit Standfu\u00df (h\u00f6chste Position): 71.47 cm x 25.68 cm x 58.9 cm",
    "reference_file": "offer_reference_1106.json",
    "shop_name": "HiQ24"
}