{
    "html_file": "offer_1763_11.html",
    "name": "Dell UltraSharp U2421E, 24.1\"",
    "offer_link": "https://www.amazon.de/dp/B08KP4GFXW?linkCode=xm2&camp=2025&creative=165953&smid=A3JWKAKR8XB7XF&creativeASIN=B08KP4GFXW&tag=geizhals1-21",
    "price": 272.17,
    "raw_specifications": {
        "ASIN": "B08KP4GFXW",
        "Amazon Bestseller-Rang": "Nr. 13,008 in Computer & Zubeh\u00f6r (Siehe Top 100 in Computer & Zubeh\u00f6r)  Nr. 291 in Monitore",
        "Anzahl HDMI Schnittstellen": "\u200e1",
        "Artikelgewicht": "\u200e4 Kilograms",
        "Batterien": "\u200e1 Unbekannt Batterien erforderlich.",
        "Batterien enthalten": "\u200eNein",
        "Bildschirmaufl\u00f6sung": "\u200e1920x1080",
        "Display-Gr\u00f6\u00dfe": "\u200e24,1 Zoll",
        "Durchschnittliche Kundenbewertung": "4,1  4,1 von 5 Sternen    \n    58 Sternebewertungen   \n\n\n 4,1 von 5 Sternen",
        "Farbe": "\u200eblack",
        "Garantierte Software-Updates bis": "\u200eunbekannt",
        "Hersteller": "\u200eDell",
        "Im Angebot von Amazon.de seit": "1. Oktober 2020",
        "L\u00f6sung": "\u200e1920 x 1080 Pixels",
        "Marke": "\u200eDell",
        "Modellnummer": "\u200eU2421E",
        "Produktabmessungen": "\u200e53,08 x 17,3 x 36,4 cm; 4 Kilogramm",
        "Prozessortyp": "\u200eOthers"
    },
    "raw_specifications_text": "Marke: \u200eDell\nHersteller: \u200eDell\nProduktabmessungen: \u200e53,08 x 17,3 x 36,4 cm; 4 Kilogramm\nBatterien: \u200e1 Unbekannt Batterien erforderlich.\nModellnummer: \u200eU2421E\nFarbe: \u200eblack\nDisplay-Gr\u00f6\u00dfe: \u200e24,1 Zoll\nBildschirmaufl\u00f6sung: \u200e1920x1080\nL\u00f6sung: \u200e1920 x 1080 Pixels\nProzessortyp: \u200eOthers\nAnzahl HDMI Schnittstellen: \u200e1\nBatterien enthalten: \u200eNein\nArtikelgewicht: \u200e4 Kilograms\nGarantierte Software-Updates bis: \u200eunbekannt\nASIN: B08KP4GFXW\nDurchschnittliche Kundenbewertung: 4,1  4,1 von 5 Sternen    \n    58 Sternebewertungen   \n\n\n 4,1 von 5 Sternen\nAmazon Bestseller-Rang: Nr. 13,008 in Computer & Zubeh\u00f6r (Siehe Top 100 in Computer & Zubeh\u00f6r)  Nr. 291 in Monitore\nIm Angebot von Amazon.de seit: 1. Oktober 2020",
    "reference_file": "offer_reference_1763.json",
    "shop_name": "Amazon.at"
}