{
    "html_file": "offer_1529_4.html",
    "name": "ViewSonic VP2468a, 23.8\"",
    "offer_link": "https://www.electronicshop24.at/product_info.php?products_id=310000000865250628&ano=A-H865250628&mno=VP2468a&ean=766907009477&utm_medium=cpc&utm_campaign=preisvergleich&utm_content=item&utm_source=geizhals&ref=geizhals",
    "price": 225.0,
    "raw_specifications": {
        "Abmessungen (Breite x Tiefe x H\u00f6he)": "53.9 cm x 21.5 cm x 51.928 cm - mit Fu\u00df",
        "Besonderheiten": "ErgoDesign, SuperClear, rahmenlos, 14-Bit-3D-Lookup-Tabelle, flimmerfreie Technologie, Blaulichtfilter-Technologie, Monitorkalibrierung Delta E<2, Color Blind-Modus, Pantone-zertifiziert, 6-bit + A-FRC Color Depth",
        "Bildschirmbeschichtung": "Blendfrei, 3H Hard Coating",
        "Bildschirmtyp": "IPS",
        "Daisy-Chaining": "Ja",
        "Details zu Abmessungen & Gewicht": "Ohne Fu\u00df - Breite: 53.9 cm - Tiefe: 4.8 cm - H\u00f6he: 31.1 cm - Gewicht: 3.5 kg \u00a6 Mit Fu\u00df - Breite: 53.9 cm - Tiefe: 21.5 cm - H\u00f6he: 51.928 cm - Gewicht: 5.9 kg",
        "Diagonalabmessung": "61 cm (24\")",
        "Display-Typ": "LED-hintergrundbeleuchteter LCD-Monitor / TFT-Aktivmatrix",
        "ENERGY STAR zertifiziert": "Ja",
        "Eingangsspannung": "Wechselstrom 100-240 V",
        "Einstellungen der Anzeigeposition": "H\u00f6he, Pivot (Rotation), Drehung, Neigung",
        "Enthaltene Kabel": "1 x DisplayPort 1.2-Kabel \u00a6 1 x USB-C Kabel \u00a6 Stromkabel",
        "Erforderliches Betriebssystem": "Apple MacOS, Microsoft Windows 10 / 11",
        "Farbraum": "100% Rec 709, 100% sRGB",
        "Farbunterst\u00fctzung": "16,7 Millionen Farben",
        "Gewicht": "5.9 kg",
        "Helligkeit": "250 cd/m\u00b2",
        "Hintergrundbeleuchtungs-Technologie": "LED-Hintergrundbeleuchtung",
        "Horizontale Bildwiederholrate": "15 - 90 kHz",
        "Horizontaler Betrachtungswinkel": "178",
        "H\u00f6heneinstellung": "130 mm",
        "Integrierte Peripherieger\u00e4te": "USB 3.0/USB-C Hub",
        "Kennzeichnung": "FCC Klasse B bescheinigt, ICES-003, CB, EMC, RoHS, WEEE, cTUVus, REACH, UkrSEPRO, ERP, CECP, RCM, CoC, GEMS, UKCA, Energy Star",
        "Kontrast": "1000:1 / 20000000:1 (dynamisch)",
        "Lebensdauer der Beleuchtung": "30,000 Stunden",
        "Leistungsmerkmale": "Slot f\u00fcr Sicherheitsschloss (Kabelschloss getrennt erh\u00e4ltlich)",
        "Max. Betriebstemperatur": "40 \u00b0C",
        "Min Betriebstemperatur": "0 \u00b0C",
        "Native Aufl\u00f6sung": "Full HD (1080p) 1920 x 1080 bei 60 Hz",
        "Neigungswinkel": "-5/+21",
        "Reaktionszeit": "5 ms (Gray-to-Gray)",
        "Rotationswinkel": "90",
        "Schlosstyp zur Diebstahlsicherung": "Kensington Slot",
        "Schnittstellen": "HDMI 1.4 \u00a6 DisplayPort \u00a6 DisplayPort-Ausgang \u00a6 Audio Line-Out \u00a6 2 x USB 3.2 Downstream (Typ A) \u00a6 USB-C 3,2 Upstream \u00a6 LAN (RJ-45)",
        "Schwenkwinkel": "120",
        "Seitenverh\u00e4ltnis": "16:9",
        "Sichtbare Bildfl\u00e4che": "60.5 cm (23.8\")",
        "Stromverbrauch (max.)": "15.4 Watt",
        "Stromverbrauch (typisch)": "13.9 Watt",
        "Stromverbrauch im Standby-Modus": "0.5 Watt",
        "Transportbreite": "69 cm",
        "Transportgewicht": "8.8 kg",
        "Transporth\u00f6he": "20.5 cm",
        "Transporttiefe": "38 cm",
        "VESA-Halterung": "100 x 100 mm",
        "Vertikale Bildwiederholrate": "24 - 75 Hz",
        "Vertikaler Betrachtungswinkel": "178",
        "Zul\u00e4ssige Luftfeuchtigkeit im Betrieb": "20 - 90% (nicht kondensierend)"
    },
    "raw_specifications_text": "Display-Typ: LED-hintergrundbeleuchteter LCD-Monitor / TFT-Aktivmatrix\nDiagonalabmessung: 61 cm (24\")\nSichtbare Bildfl\u00e4che: 60.5 cm (23.8\")\nDaisy-Chaining: Ja\nIntegrierte Peripherieger\u00e4te: USB 3.0/USB-C Hub\nBildschirmtyp: IPS\nSeitenverh\u00e4ltnis: 16:9\nNative Aufl\u00f6sung: Full HD (1080p) 1920 x 1080 bei 60 Hz\nHelligkeit: 250 cd/m\u00b2\nKontrast: 1000:1 / 20000000:1 (dynamisch)\nFarbunterst\u00fctzung: 16,7 Millionen Farben\nFarbraum: 100% Rec 709, 100% sRGB\nReaktionszeit: 5 ms (Gray-to-Gray)\nVertikale Bildwiederholrate: 24 - 75 Hz\nHorizontale Bildwiederholrate: 15 - 90 kHz\nHorizontaler Betrachtungswinkel: 178\nVertikaler Betrachtungswinkel: 178\nBildschirmbeschichtung: Blendfrei, 3H Hard Coating\nHintergrundbeleuchtungs-Technologie: LED-Hintergrundbeleuchtung\nBesonderheiten: ErgoDesign, SuperClear, rahmenlos, 14-Bit-3D-Lookup-Tabelle, flimmerfreie Technologie, Blaulichtfilter-Technologie, Monitorkalibrierung Delta E<2, Color Blind-Modus, Pantone-zertifiziert, 6-bit + A-FRC Color Depth\nAbmessungen (Breite x Tiefe x H\u00f6he): 53.9 cm x 21.5 cm x 51.928 cm - mit Fu\u00df\nGewicht: 5.9 kg\nSchnittstellen: HDMI 1.4 \u00a6 DisplayPort \u00a6 DisplayPort-Ausgang \u00a6 Audio Line-Out \u00a6 2 x USB 3.2 Downstream (Typ A) \u00a6 USB-C 3,2 Upstream \u00a6 LAN (RJ-45)\nEinstellungen der Anzeigeposition: H\u00f6he, Pivot (Rotation), Drehung, Neigung\nNeigungswinkel: -5/+21\nSchwenkwinkel: 120\nRotationswinkel: 90\nH\u00f6heneinstellung: 130 mm\nVESA-Halterung: 100 x 100 mm\nLeistungsmerkmale: Slot f\u00fcr Sicherheitsschloss (Kabelschloss getrennt erh\u00e4ltlich)\nEnthaltene Kabel: 1 x DisplayPort 1.2-Kabel \u00a6 1 x USB-C Kabel \u00a6 Stromkabel\nLebensdauer der Beleuchtung: 30,000 Stunden\nKennzeichnung: FCC Klasse B bescheinigt, ICES-003, CB, EMC, RoHS, WEEE, cTUVus, REACH, UkrSEPRO, ERP, CECP, RCM, CoC, GEMS, UKCA, Energy Star\nSchlosstyp zur Diebstahlsicherung: Kensington Slot\nEingangsspannung: Wechselstrom 100-240 V\nStromverbrauch (typisch): 13.9 Watt\nStromverbrauch (max.): 15.4 Watt\nStromverbrauch im Standby-Modus: 0.5 Watt\nErforderliches Betriebssystem: Apple MacOS, Microsoft Windows 10 / 11\nDetails zu Abmessungen & Gewicht: Ohne Fu\u00df - Breite: 53.9 cm - Tiefe: 4.8 cm - H\u00f6he: 31.1 cm - Gewicht: 3.5 kg \u00a6 Mit Fu\u00df - Breite: 53.9 cm - Tiefe: 21.5 cm - H\u00f6he: 51.928 cm - Gewicht: 5.9 kg\nTransportbreite: 69 cm\nTransporttiefe: 38 cm\nTransporth\u00f6he: 20.5 cm\nTransportgewicht: 8.8 kg\nENERGY STAR zertifiziert: Ja\nMin Betriebstemperatur: 0 \u00b0C\nMax. Betriebstemperatur: 40 \u00b0C\nZul\u00e4ssige Luftfeuchtigkeit im Betrieb: 20 - 90% (nicht kondensierend)",
    "reference_file": "offer_reference_1529.json",
    "shop_name": "ElectronicShop24"
}