{
    "html_file": "offer_1101_18.html",
    "name": "BenQ EW2880U, 28\"",
    "offer_link": "https://direkt.jacob.de/produkte/benq-ew2880u-71-1-9h-lkslb-qbe-artnr-7541586.html?utm_source=geizhals&utm_medium=cpc&utm_campaign=Preisvergleich&ref=103",
    "price": 398.33,
    "raw_specifications": {
        "AC Eingangsspannung": "100 - 240 V",
        "AMD FreeSync": "Ja",
        "Anzahl DisplayPort Anschl\u00fcsse": "1",
        "Anzahl HDMI-Anschl\u00fcsse": "1",
        "Anzahl OSD-Sprachen": "18",
        "Anzahl der Farben des Displays": "1,07 Milliarden Farben",
        "Anzahl der Lautsprecher": "2",
        "Anzahl der nachgeschalteten Ports vom Typ USB-C": "1",
        "Bildschirmaufl\u00f6sung": "3840 x 2160 Pixel",
        "Bildschirmdiagonale": "71,1 cm (28\" )",
        "Bildschirmdiagonale (cm)": "71 cm",
        "Bildschirmdisplay (OSD)-Sprachen": "Arabisch, Vereinfachtes Chinesisch, Traditionelles Chinesisch, Tschechisch, Deutsch, Niederl\u00e4ndisch, Englisch, Spanisch, Franz\u00f6sisch, Ungarisch, Italienisch, Japanisch, Koreanisch, Polnisch, Portugiesisch, Rum\u00e4nisch, Russisch, Schwedisch",
        "Bildschirmform": "Flach",
        "Bildschirmtechnologie": "LED",
        "Blendfreier Bildschirm": "Ja",
        "Blickwinkel, horizontal": "178\u00b0",
        "Blickwinkel, vertikal": "178\u00b0",
        "Breite (ohne Standfu\u00df)": "63,7 cm",
        "DisplayPorts-Version": "1.4",
        "Eingebaute Lautsprecher": "Ja",
        "Energieeffizienzklasse (HDR)": "G",
        "Energieeffizienzklasse (SDR)": "G",
        "Energieeffizienzskala": "A bis G",
        "Energieverbrauch (HDR) pro 1.000 Stunden": "38 kWh",
        "Energieverbrauch (SDR) pro 1.000 Stunden": "33 kWh",
        "Farbskala": "90%",
        "Fernbedienung enthalten": "Ja",
        "Flimmerfreie Technologie": "Ja",
        "Fu\u00dffarbe": "Schwarz",
        "Ger\u00e4tebreite (inkl. Fu\u00df)": "637 mm",
        "Ger\u00e4teh\u00f6he (inkl. Fu\u00df)": "421 mm",
        "Ger\u00e4tetiefe (inkl. Fu\u00df)": "277 mm",
        "Gewicht (mit St\u00e4nder)": "7,9 kg",
        "Gewicht (ohne St\u00e4nder)": "5,29 kg",
        "HD-Typ": "4K Ultra HD",
        "HDCP": "Ja",
        "HDMI": "Ja",
        "HDMI-Version": "2.0",
        "Helligkeit (typisch)": "300 cd/m\u00b2",
        "High Dynamic Range Video Unterst\u00fctzung": "Ja",
        "H\u00f6he (ohne Standfu\u00df)": "39 cm",
        "H\u00f6heneinstellung": "10 cm",
        "H\u00f6henverstellung": "Ja",
        "Integrierte Kamera": "Nein",
        "Integrierter USB-Hub": "Ja",
        "Kontrastverh\u00e4ltnis": "1000:1",
        "Kopfh\u00f6rerausgang": "Ja",
        "Kopfh\u00f6rerausg\u00e4nge": "1",
        "Low-Blue-Light-Technologie": "Ja",
        "Marktpositionierung": "Gaming",
        "Maximale Bildwiederholrate": "60 Hz",
        "Mitgelieferte Kabel": "DisplayPort, HDMI, USB Typ-C",
        "NVIDIA G-SYNC": "Nein",
        "Natives Seitenverh\u00e4ltnis": "16:9",
        "Neigungswinkelbereich": "5 - 15\u00b0",
        "On-Screen-Display (OSD)": "Ja",
        "Panel-Montage-Schnittstelle": "100 x 100 mm",
        "Panel-Typ": "IPS",
        "Pixeldichte": "157 ppi",
        "Produktfarbe": "Schwarz",
        "RGB-Farbraum": "DCI-P3",
        "RMS-Leistung": "6 W",
        "Reaktionszeit": "5 ms",
        "Schnellstart\u00fcbersicht": "Ja",
        "Schwenkwinkelbereich": "15 - 15\u00b0",
        "Stromverbrauch (Standardbetrieb)": "37,9 W",
        "Stromverbrauch (Standby)": "0,3 W",
        "Stromverbrauch (aus)": "0,2 W",
        "Stromverbrauch (max.)": "135 W",
        "St\u00e4nder enthalten": "Ja",
        "Technologie mit hohem Dynamikbereich (HDR)": "High Dynamic Range 10 (HDR10)",
        "Tiefe (ohne Standfu\u00df)": "8,1 cm",
        "Typ der Hintergrundbeleuchtung": "LED",
        "USB-Stromversorgung bis zu": "60 W",
        "VESA-Halterung": "Ja",
        "kippbar": "Ja"
    },
    "raw_specifications_text": "Bildschirmdiagonale: 71,1 cm (28\" )\nBildschirmaufl\u00f6sung: 3840 x 2160 Pixel\nNatives Seitenverh\u00e4ltnis: 16:9\nPanel-Typ: IPS\nHD-Typ: 4K Ultra HD\nBildschirmtechnologie: LED\nBildschirmform: Flach\nKontrastverh\u00e4ltnis: 1000:1\nMaximale Bildwiederholrate: 60 Hz\nAnzahl der Farben des Displays: 1,07 Milliarden Farben\nHelligkeit (typisch): 300 cd/m\u00b2\nReaktionszeit: 5 ms\nTyp der Hintergrundbeleuchtung: LED\nBlendfreier Bildschirm: Ja\nBlickwinkel, horizontal: 178\u00b0\nBlickwinkel, vertikal: 178\u00b0\nPixeldichte: 157 ppi\nBildschirmdiagonale (cm): 71 cm\nHigh Dynamic Range Video Unterst\u00fctzung: Ja\nTechnologie mit hohem Dynamikbereich (HDR): High Dynamic Range 10 (HDR10)\nRGB-Farbraum: DCI-P3\nFarbskala: 90%\nNVIDIA G-SYNC: Nein\nAMD FreeSync: Ja\nFlimmerfreie Technologie: Ja\nLow-Blue-Light-Technologie: Ja\nEingebaute Lautsprecher: Ja\nIntegrierte Kamera: Nein\nAnzahl der Lautsprecher: 2\nRMS-Leistung: 6 W\nMarktpositionierung: Gaming\nProduktfarbe: Schwarz\nFu\u00dffarbe: Schwarz\nIntegrierter USB-Hub: Ja\nHDMI: Ja\nKopfh\u00f6rerausgang: Ja\nAnzahl der nachgeschalteten Ports vom Typ USB-C: 1\nUSB-Stromversorgung bis zu: 60 W\nAnzahl HDMI-Anschl\u00fcsse: 1\nHDMI-Version: 2.0\nAnzahl DisplayPort Anschl\u00fcsse: 1\nDisplayPorts-Version: 1.4\nKopfh\u00f6rerausg\u00e4nge: 1\nHDCP: Ja\nVESA-Halterung: Ja\nH\u00f6henverstellung: Ja\nPanel-Montage-Schnittstelle: 100 x 100 mm\nH\u00f6heneinstellung: 10 cm\nSchwenkwinkelbereich: 15 - 15\u00b0\nkippbar: Ja\nNeigungswinkelbereich: 5 - 15\u00b0\nOn-Screen-Display (OSD): Ja\nBildschirmdisplay (OSD)-Sprachen: Arabisch, Vereinfachtes Chinesisch, Traditionelles Chinesisch, Tschechisch, Deutsch, Niederl\u00e4ndisch, Englisch, Spanisch, Franz\u00f6sisch, Ungarisch, Italienisch, Japanisch, Koreanisch, Polnisch, Portugiesisch, Rum\u00e4nisch, Russisch, Schwedisch\nAnzahl OSD-Sprachen: 18\nEnergieeffizienzklasse (SDR): G\nEnergieeffizienzklasse (HDR): G\nEnergieverbrauch (SDR) pro 1.000 Stunden: 33 kWh\nEnergieverbrauch (HDR) pro 1.000 Stunden: 38 kWh\nStromverbrauch (Standardbetrieb): 37,9 W\nStromverbrauch (Standby): 0,3 W\nStromverbrauch (max.): 135 W\nStromverbrauch (aus): 0,2 W\nAC Eingangsspannung: 100 - 240 V\nEnergieeffizienzskala: A bis G\nGer\u00e4tebreite (inkl. Fu\u00df): 637 mm\nGer\u00e4tetiefe (inkl. Fu\u00df): 277 mm\nGer\u00e4teh\u00f6he (inkl. Fu\u00df): 421 mm\nGewicht (mit St\u00e4nder): 7,9 kg\nBreite (ohne Standfu\u00df): 63,7 cm\nTiefe (ohne Standfu\u00df): 8,1 cm\nH\u00f6he (ohne Standfu\u00df): 39 cm\nGewicht (ohne St\u00e4nder): 5,29 kg\nSt\u00e4nder enthalten: Ja\nMitgelieferte Kabel: DisplayPort, HDMI, USB Typ-C\nSchnellstart\u00fcbersicht: Ja\nFernbedienung enthalten: Ja",
    "reference_file": "offer_reference_1101.json",
    "shop_name": "Jacob Elektronik direkt (AT)"
}