{
    "html_file": "offer_1806_31.html",
    "name": "Philips E-line 345E2AE, 34\"",
    "offer_link": "https://syswork.at/sw/index.html?open&mid=Artikel&artid=mon-1187&from=geizhals.at",
    "price": 471.0,
    "raw_specifications": {
        "AC Eingangsfrequenz": "50/60 Hz",
        "AC Eingangsspannung": "100 - 240 V",
        "AMD FreeSync": "Ja",
        "Anzahl DisplayPort Anschl\u00fcsse": "1",
        "Anzahl HDMI-Anschl\u00fcsse": "2",
        "Anzahl OSD-Sprachen": "21",
        "Anzahl der Farben des Displays": "16,7 Millionen Farben",
        "Anzahl der Lautsprecher": "2",
        "Audioanschl\u00fcsse": "Ja",
        "Au\u00dfenverkleidungstyp": "Texturiert",
        "Beh\u00f6rdliche Zulassung": "CB; TUV/ISO9241-307; TUV-BAUART; CU-EAC; EAEU RoHS; MEPS; PSB; BSMI; CE Mark",
        "Betriebsanleitung": "Ja",
        "Betriebstemperatur": "0 - 40 \u00b0C",
        "Bild f\u00fcr Bild (PbP)": "Ja",
        "Bild-Verbesserung": "SmartImage game",
        "Bild-in-Bild": "Ja",
        "Bildschirmdiagonale": "86,4 cm (34 Zoll)",
        "Bildschirmdiagonale (cm)": "86,36 cm",
        "Bildschirmform": "Flach",
        "Bildwinkel, horizontal": "178\u00b0",
        "Bildwinkel, vertikal": "178\u00b0",
        "Blendfreier Bildschirm": "Ja",
        "Breite (ohne Standfu\u00df)": "81,7 cm",
        "DDC/CI": "Ja",
        "DVI Anschluss": "Nein",
        "Datenblatt": "Kein Datenblatt verf\u00fcgbar",
        "Digital horizontale Frequenz": "30 - 120 kHz",
        "Digital vertikale Frequenz": "48 - 75 Hz",
        "Display-Aufl\u00f6sung": "3440 x 1440 Pixel",
        "Einfach zu lesen Modus": "Ja",
        "Eingebaute Lautsprecher": "Ja",
        "Energieeffizienzklasse (SDR)": "G",
        "Energieeffizienzskala": "A bis G",
        "Energieverbrauch (SDR) pro 1.000 Stunden": "39 kWh",
        "Enth\u00e4lt nicht": "Quecksilber, PVC/BFR",
        "Farbskala": "106,8%",
        "Flimmerfreie Technologie": "Ja",
        "Ger\u00e4tebreite (inkl. Fu\u00df)": "817 mm",
        "Ger\u00e4teh\u00f6he (inkl. Fu\u00df)": "491 mm",
        "Ger\u00e4tetiefe (inkl. Fu\u00df)": "235 mm",
        "Gewicht (mit St\u00e4nder)": "7,61 kg",
        "Gewicht (ohne St\u00e4nder)": "5,65 kg",
        "HDMI": "Ja",
        "Helligkeit (peak)": "300 cd/m\u00b2",
        "Helligkeit (typisch)": "300 cd/m\u00b2",
        "Herstellerlink": "Philips",
        "Horizontaler Scanbereich": "30 - 120 kHz",
        "H\u00f6he (ohne Standfu\u00df)": "36,5 cm",
        "H\u00f6he bei Betrieb": "0 - 3658 m",
        "H\u00f6he bei Lagerung": "0 - 12192 m",
        "H\u00f6heneinstellung": "10 cm",
        "H\u00f6henverstellung": "Ja",
        "Integrierte Kamera": "Nein",
        "Integrierter USB-Hub": "Nein",
        "Kabelsperre-Slot": "Ja",
        "Komponentenvideo-Synchronisation": "Separate sync",
        "Kontrastverh\u00e4ltnis": "1000:1",
        "Kopfh\u00f6rerausgang": "Ja",
        "LED-Anzeigen": "T\u00e4tigkeit, Stand-by",
        "Low-Blue-Light-Technologie": "Ja",
        "LowBlue-Modus": "Ja",
        "Maximale Bildwiederholrate": "75 Hz",
        "Men\u00fcsprachen": "Vereinfachtes Chinesisch, Traditionelles Chinesisch, Tschechisch, Deutsch, Niederl\u00e4ndisch, Englisch, Spanisch, Finnisch, Franz\u00f6sisch, Griechisch, Ungarisch, Italienisch, Japanisch, Koreanisch, Polnisch, Portugiesisch, Russisch, Schwedisch, T\u00fcrkisch, Ukrainisch",
        "Mitgelieferte Kabel": "DisplayPort, HDMI, AC",
        "Mittlere Betriebsdauer zwischen Ausf\u00e4llen (MTBF)": "50000 h",
        "MultiView": "PIP/PBP mode, 2 x devices",
        "NTSC Abdeckung (typisch)": "106,8%",
        "NVIDIA G-SYNC": "Nein",
        "Nachhaltigkeitszertifikate": "ENERGY STAR, TCO, RoHS",
        "Natives Seitenverh\u00e4ltnis": "21:9",
        "Neigungswinkelbereich": "-5 - 20\u00b0",
        "Netzteiltyp": "Extern",
        "Oberfl\u00e4chenh\u00e4rte": "3H",
        "On-Screen-Display (OSD)": "Ja",
        "PC Audio-Eingang": "Ja",
        "Paketgewicht": "10,2 kg",
        "Panel-Montage-Schnittstelle": "100 x 100 mm",
        "Panel-Typ": "IPS",
        "Pixel Abstand": "0,2325 x 0,2325 mm",
        "Pixeldichte": "119,68 ppi",
        "Plug & Play": "Ja",
        "Produktfarbe": "Schwarz",
        "Produktlink": "Link",
        "RGB-Farbraum": "sRGB",
        "RMS-Leistung": "6 W",
        "Reaktionszeit": "4 ms",
        "Recycelbares Verpackungsmaterial": "100%",
        "Relative Luftfeuchtigkeit in Betrieb": "20 - 80%",
        "Seitenverh\u00e4ltnis": "21:9",
        "Sichtbare Gr\u00f6\u00dfe (horizontal)": "80 cm",
        "Sichtbare Gr\u00f6\u00dfe (vertikal)": "33,5 cm",
        "Slot-Typ Kabelsperre": "Kensington",
        "Stromverbrauch (Standardbetrieb)": "26,09 W",
        "Stromverbrauch (Standby)": "0,5 W",
        "Stromverbrauch (aus)": "0,3 W",
        "St\u00e4nder enthalten": "Ja",
        "Temperaturbereich bei Lagerung": "-20 - 60 \u00b0C",
        "Tiefe (ohne Standfu\u00df)": "4,9 cm",
        "Touchscreen": "Nein",
        "Tr\u00fcbungsrate": "25%",
        "Typ der Hintergrundbeleuchtung": "W-LED",
        "Unterst\u00fctzte Grafik-Aufl\u00f6sungen": "3440 x 1440",
        "VESA-Halterung": "Ja",
        "Verpackungsart": "Box",
        "Verpackungsbreite": "930 mm",
        "Verpackungsh\u00f6he": "525 mm",
        "Verpackungstiefe": "186 mm",
        "Vertikaler Scanbereich": "48 - 75 Hz",
        "Warentarifnummer (HS)": "85285210",
        "Zertifizierung": "CB, TUV/ISO9241-307, TUV-BAUART, CU-EAC, EAEU RoHS, MEPS, PSB, BSMI, CE Mark",
        "sRGB": "Ja",
        "sRGB Abdeckung (klassisch)": "120,3%"
    },
    "raw_specifications_text": "Bildschirmdiagonale: 86,4 cm (34 Zoll)\nDisplay-Aufl\u00f6sung: 3440 x 1440 Pixel\nNatives Seitenverh\u00e4ltnis: 21:9\nTouchscreen: Nein\nPanel-Typ: IPS\nBildschirmform: Flach\nKontrastverh\u00e4ltnis: 1000:1\nMaximale Bildwiederholrate: 75 Hz\nAnzahl der Farben des Displays: 16,7 Millionen Farben\nTyp der Hintergrundbeleuchtung: W-LED\nHelligkeit (peak): 300 cd/m\u00b2\nHelligkeit (typisch): 300 cd/m\u00b2\nReaktionszeit: 4 ms\nBlendfreier Bildschirm: Ja\nUnterst\u00fctzte Grafik-Aufl\u00f6sungen: 3440 x 1440\nSeitenverh\u00e4ltnis: 21:9\nBildwinkel, horizontal: 178\u00b0\nBildwinkel, vertikal: 178\u00b0\nPixel Abstand: 0,2325 x 0,2325 mm\nPixeldichte: 119,68 ppi\nHorizontaler Scanbereich: 30 - 120 kHz\nVertikaler Scanbereich: 48 - 75 Hz\nSichtbare Gr\u00f6\u00dfe (horizontal): 80 cm\nSichtbare Gr\u00f6\u00dfe (vertikal): 33,5 cm\nDigital horizontale Frequenz: 30 - 120 kHz\nDigital vertikale Frequenz: 48 - 75 Hz\nBildschirmdiagonale (cm): 86,36 cm\nDDC/CI: Ja\nTr\u00fcbungsrate: 25%\nOberfl\u00e4chenh\u00e4rte: 3H\nRGB-Farbraum: sRGB\nFarbskala: 106,8%\nsRGB Abdeckung (klassisch): 120,3%\nNTSC Abdeckung (typisch): 106,8%\nsRGB: Ja\nNVIDIA G-SYNC: Nein\nAMD FreeSync: Ja\nKomponentenvideo-Synchronisation: Separate sync\nFlimmerfreie Technologie: Ja\nLow-Blue-Light-Technologie: Ja\nEingebaute Lautsprecher: Ja\nIntegrierte Kamera: Nein\nAnzahl der Lautsprecher: 2\nRMS-Leistung: 6 W\nProduktfarbe: Schwarz\nZertifizierung: CB, TUV/ISO9241-307, TUV-BAUART, CU-EAC, EAEU RoHS, MEPS, PSB, BSMI, CE Mark\nIntegrierter USB-Hub: Nein\nHDMI: Ja\nKopfh\u00f6rerausgang: Ja\nDVI Anschluss: Nein\nAnzahl HDMI-Anschl\u00fcsse: 2\nAnzahl DisplayPort Anschl\u00fcsse: 1\nAudioanschl\u00fcsse: Ja\nPC Audio-Eingang: Ja\nVESA-Halterung: Ja\nKabelsperre-Slot: Ja\nH\u00f6henverstellung: Ja\nPanel-Montage-Schnittstelle: 100 x 100 mm\nSlot-Typ Kabelsperre: Kensington\nH\u00f6heneinstellung: 10 cm\nNeigungswinkelbereich: -5 - 20\u00b0\nBild-in-Bild: Ja\nOn-Screen-Display (OSD): Ja\nMen\u00fcsprachen: Vereinfachtes Chinesisch, Traditionelles Chinesisch, Tschechisch, Deutsch, Niederl\u00e4ndisch, Englisch, Spanisch, Finnisch, Franz\u00f6sisch, Griechisch, Ungarisch, Italienisch, Japanisch, Koreanisch, Polnisch, Portugiesisch, Russisch, Schwedisch, T\u00fcrkisch, Ukrainisch\nAnzahl OSD-Sprachen: 21\nPlug & Play: Ja\nLED-Anzeigen: T\u00e4tigkeit, Stand-by\nEnergieeffizienzklasse (SDR): G\nEnergieverbrauch (SDR) pro 1.000 Stunden: 39 kWh\nStromverbrauch (Standardbetrieb): 26,09 W\nStromverbrauch (Standby): 0,5 W\nStromverbrauch (aus): 0,3 W\nAC Eingangsspannung: 100 - 240 V\nAC Eingangsfrequenz: 50/60 Hz\nNetzteiltyp: Extern\nEnergieeffizienzskala: A bis G\nBetriebstemperatur: 0 - 40 \u00b0C\nTemperaturbereich bei Lagerung: -20 - 60 \u00b0C\nRelative Luftfeuchtigkeit in Betrieb: 20 - 80%\nH\u00f6he bei Betrieb: 0 - 3658 m\nH\u00f6he bei Lagerung: 0 - 12192 m\nSt\u00e4nder enthalten: Ja\nMitgelieferte Kabel: DisplayPort, HDMI, AC\nBetriebsanleitung: Ja\nGer\u00e4tebreite (inkl. Fu\u00df): 817 mm\nGer\u00e4tetiefe (inkl. Fu\u00df): 235 mm\nGer\u00e4teh\u00f6he (inkl. Fu\u00df): 491 mm\nGewicht (mit St\u00e4nder): 7,61 kg\nBreite (ohne Standfu\u00df): 81,7 cm\nTiefe (ohne Standfu\u00df): 4,9 cm\nH\u00f6he (ohne Standfu\u00df): 36,5 cm\nGewicht (ohne St\u00e4nder): 5,65 kg\nVerpackungsbreite: 930 mm\nVerpackungstiefe: 186 mm\nVerpackungsh\u00f6he: 525 mm\nPaketgewicht: 10,2 kg\nVerpackungsart: Box\nNachhaltigkeitszertifikate: ENERGY STAR, TCO, RoHS\nEnth\u00e4lt nicht: Quecksilber, PVC/BFR\nWarentarifnummer (HS): 85285210\nBild f\u00fcr Bild (PbP): Ja\nAu\u00dfenverkleidungstyp: Texturiert\nRecycelbares Verpackungsmaterial: 100%\nEinfach zu lesen Modus: Ja\nLowBlue-Modus: Ja\nMittlere Betriebsdauer zwischen Ausf\u00e4llen (MTBF): 50000 h\nBild-Verbesserung: SmartImage game\nMultiView: PIP/PBP mode, 2 x devices\nBeh\u00f6rdliche Zulassung: CB; TUV/ISO9241-307; TUV-BAUART; CU-EAC; EAEU RoHS; MEPS; PSB; BSMI; CE Mark\nDatenblatt: Kein Datenblatt verf\u00fcgbar\nProduktlink: Link\nHerstellerlink: Philips",
    "reference_file": "offer_reference_1806.json",
    "shop_name": "Syswork"
}