{
    "html_file": "offer_673_34.html",
    "name": "LG UltraGear 24GN60R-B, 23.8\"",
    "offer_link": "https://www.ba-computer.at/lg-ultragear-24gn60r-b-gn60r-series-led-monitor-gaming-60-cm-24-24gn60r-b-aeu.html",
    "price": 209.4,
    "raw_specifications": {
        "Abmessungen (Breite x Tiefe x H\u00f6he)": "54.08 cm x 18.05 cm x 40.89 cm - mit Fu\u00df",
        "Adaptive-Sync Technologie": "AMD FreeSync Premium",
        "Besonderheiten": "FPS Mode, Crosshair Display, Flicker Safe, Reader Mode, RTS Mode, Intelligente Energiespartechnologie, Farbkalibrierung, Black Stabilizer, DAS Mode (Dynamic Action Sync), Vivid Mode, an 3 Seiten ohne Blende, HDR Effect, Auto Input Switch",
        "Bildschirmbeschichtung": "Blendfrei",
        "Bildschirmtyp": "IPS",
        "Details zu Abmessungen & Gewicht": "Mit Fu\u00df - Breite: 54.08 cm - Tiefe: 18.05 cm - H\u00f6he: 40.89 cm - Gewicht: 3.9 kg \u00a6 Ohne Fu\u00df - Breite: 54.08 cm - Tiefe: 4.28 cm - H\u00f6he: 32.38 cm - Gewicht: 3.5 kg",
        "Diagonalabmessung": "60 cm (24\")",
        "Display-Typ": "LED-hintergrundbeleuchteter LCD-Monitor / TFT-Aktivmatrix",
        "Einstellungen der Anzeigeposition": "Neigung",
        "Energie Effizienzklasse": "Klasse E",
        "Energieklasse (HDR)": "Klasse G",
        "Enthaltene Kabel": "1 x DisplayPort-Kabel - 1.5 m",
        "Farbe": "Schwarz",
        "Farbraum": "99% sRGB",
        "Farbunterst\u00fctzung": "16,7 Millionen Farben (8-Bit)",
        "Gaming": "Ja",
        "Gewicht": "3.9 kg",
        "HDR-Format": "HDR10",
        "Helligkeit": "300 cd/m\u00b2",
        "Hintergrundbeleuchtungs-Technologie": "LED-Hintergrundbeleuchtung",
        "Horizontaler Betrachtungswinkel": "178",
        "Kennzeichnung": "FCC Klasse B bescheinigt, TUV, CB, CEC, ERP, HDCP 2.2, UL/cUL",
        "Kontrast": "1000:1",
        "Mitgelieferte Software": "LG On-Screen Control",
        "Native Aufl\u00f6sung": "Full HD (1080p) 1920 x 1080 bei 144 Hz",
        "Neigungswinkel": "-5/+15",
        "OSD-Sprachen": "Multilingual",
        "Pixelpitch": "0.27 mm",
        "Reaktionszeit": "1 ms (Gray-to-Gray)",
        "Schnittstellen": "DisplayPort 1.4 (HDCP 2.2) \u00a6 HDMI 2.0 (HDCP 2.2) \u00a6 Kopfh\u00f6rer",
        "Seitenverh\u00e4ltnis": "16:9",
        "Service und Support": "Begrenzte Garantie - 2 Jahre",
        "Sichtbare Bildfl\u00e4che": "60.5 cm (23.8\")",
        "Stromverbrauch HDR (eingeschaltet)": "24 kWh/1.000 h",
        "Stromverbrauch SDR (eingeschaltet)": "18 kWh/1.000 h",
        "Transportbreite": "60.1 cm",
        "Transportgewicht": "5.2 kg",
        "Transporth\u00f6he": "38.4 cm",
        "Transporttiefe": "12.9 cm",
        "VESA-Halterung": "100 x 100 mm",
        "Vertikaler Betrachtungswinkel": "178"
    },
    "raw_specifications_text": "Display-Typ: LED-hintergrundbeleuchteter LCD-Monitor / TFT-Aktivmatrix\nEnergie Effizienzklasse: Klasse E\nEnergieklasse (HDR): Klasse G\nDiagonalabmessung: 60 cm (24\")\nSichtbare Bildfl\u00e4che: 60.5 cm (23.8\")\nAdaptive-Sync Technologie: AMD FreeSync Premium\nBildschirmtyp: IPS\nSeitenverh\u00e4ltnis: 16:9\nNative Aufl\u00f6sung: Full HD (1080p) 1920 x 1080 bei 144 Hz\nPixelpitch: 0.27 mm\nHelligkeit: 300 cd/m\u00b2\nKontrast: 1000:1\nHDR-Format: HDR10\nFarbunterst\u00fctzung: 16,7 Millionen Farben (8-Bit)\nFarbraum: 99% sRGB\nReaktionszeit: 1 ms (Gray-to-Gray)\nGaming: Ja\nHorizontaler Betrachtungswinkel: 178\nVertikaler Betrachtungswinkel: 178\nBildschirmbeschichtung: Blendfrei\nHintergrundbeleuchtungs-Technologie: LED-Hintergrundbeleuchtung\nOSD-Sprachen: Multilingual\nBesonderheiten: FPS Mode, Crosshair Display, Flicker Safe, Reader Mode, RTS Mode, Intelligente Energiespartechnologie, Farbkalibrierung, Black Stabilizer, DAS Mode (Dynamic Action Sync), Vivid Mode, an 3 Seiten ohne Blende, HDR Effect, Auto Input Switch\nFarbe: Schwarz\nAbmessungen (Breite x Tiefe x H\u00f6he): 54.08 cm x 18.05 cm x 40.89 cm - mit Fu\u00df\nGewicht: 3.9 kg\nSchnittstellen: DisplayPort 1.4 (HDCP 2.2) \u00a6 HDMI 2.0 (HDCP 2.2) \u00a6 Kopfh\u00f6rer\nEinstellungen der Anzeigeposition: Neigung\nNeigungswinkel: -5/+15\nVESA-Halterung: 100 x 100 mm\nEnthaltene Kabel: 1 x DisplayPort-Kabel - 1.5 m\nKennzeichnung: FCC Klasse B bescheinigt, TUV, CB, CEC, ERP, HDCP 2.2, UL/cUL\nStromverbrauch SDR (eingeschaltet): 18 kWh/1.000 h\nStromverbrauch HDR (eingeschaltet): 24 kWh/1.000 h\nMitgelieferte Software: LG On-Screen Control\nDetails zu Abmessungen & Gewicht: Mit Fu\u00df - Breite: 54.08 cm - Tiefe: 18.05 cm - H\u00f6he: 40.89 cm - Gewicht: 3.9 kg \u00a6 Ohne Fu\u00df - Breite: 54.08 cm - Tiefe: 4.28 cm - H\u00f6he: 32.38 cm - Gewicht: 3.5 kg\nTransportbreite: 60.1 cm\nTransporttiefe: 12.9 cm\nTransporth\u00f6he: 38.4 cm\nTransportgewicht: 5.2 kg\nService und Support: Begrenzte Garantie - 2 Jahre",
    "reference_file": "offer_reference_673.json",
    "shop_name": "BA-Computer"
}