{
    "html_file": "offer_1304_11.html",
    "name": "Samsung Odyssey Neo G9 G95NA (2021), 49\"",
    "offer_link": "https://www.proshop.at/Bildschirm/Samsung-49-Bildschirm-Odyssey-Neo-G9-S49AG950NU-5120x1440-240Hz-USB-Hub-White-1-ms-AMD-FreeSync-2/3011162?utm_source=geizhals&utm_medium=cpc&utm_campaign=pricesite",
    "price": 1548.26,
    "raw_specifications": {
        "Abmessungen (Breite x Tiefe x H\u00f6he)": "114.95 cm x 41.83 cm x 53.72 cm - mit Fu\u00df",
        "Abmessungen (Breite x Tiefe x H\u00f6he) - mit Fu\u00df": "114.95 cm x 41.83 cm x 53.72 cm",
        "Adaptive-Sync Technologie": "AMD FreeSync Premium Pro, NVIDIA G-SYNC Compatible",
        "Besonderheiten": "HighBrightness, Bild f\u00fcr Bild, Cinema Mode, Mega Dynamic Contrast Ratio, Black eQualizer, CustomColor Mode, FPS Mode, flimmerfreie Technologie, RTS Mode, Eye Saver Mode, Werkstuning, Off Timer Plus, Niedrige Eingangsverz\u00f6gerung, Quantum Dot Technology, Super Arena Gaming UX, Screen Size Optimizer, Refresh Rate Optimizer, Custom Key, RPG Mode, AOS Mode, sRGB Mode, Picture-in-Picture, Dynamic Contrast Mode, Auto Source Switch+, CoreSync-Beleuchtungsdesign, Quantum HDR 2000",
        "Bildschirmtyp": "VA",
        "Details zu Abmessungen & Gewicht": "Mit Fu\u00df - Breite: 114.95 cm - Tiefe: 41.83 cm - H\u00f6he: 53.72 cm - Gewicht: 14.5 kg  Ohne Fu\u00df - Breite: 114.95 cm - Tiefe: 28.74 cm - H\u00f6he: 36.35 cm - Gewicht: 11.9 kg",
        "Diagonalabmessung": "124.5 cm (49\")",
        "Display-Typ": "QLED-Monitor / TFT-Aktivmatrix",
        "EAN": "8806092522398",
        "Eingangsanschl\u00fcsse": "2xHDMI, DisplayPort",
        "Eingangsspannung": "Wechselstrom 100-240 V",
        "Einstellungen der Anzeigeposition": "H\u00f6he, Drehung, Neigung",
        "Energie Effizienzklasse": "Klasse G",
        "Energieklasse (HDR)": "Klasse G",
        "Energieverbrauch pro Jahr": "80 kWh",
        "Enthaltene Kabel": "1 x DisplayPort-Kabel  1 x SuperSpeed-USB-Kabel",
        "Farbe": "Schwarz",
        "Farbraum": "125% sRGB, 88% NTSC, 92% Adobe RGB, 95% DCI-P3",
        "Farbunterst\u00fctzung": "1,07 Mrd. Farben",
        "Ger\u00e4tetyp": "QLED-Monitor - 124.5 cm (49\")",
        "Geschwungener Bildschirm": "Ja (1000R)",
        "Gewicht": "14.5 kg",
        "HDR-Format": "HDR10+",
        "HDR-f\u00e4hig": "HDR10+",
        "Helligkeit": "2000 cd/m\u00b2",
        "Hersteller": "Samsung",
        "Hintergrundbeleuchtungs-Technologie": "Mini LED-Hintergrundbeleuchtung",
        "Horizontaler Betrachtungswinkel": "178",
        "H\u00f6heneinstellung": "120 mm",
        "Integrierte Peripherieger\u00e4te": "USB 3.0-Hub",
        "Kontrast": "1000000:1",
        "Leistungsmerkmale": "USB 3.0-Hub",
        "Modell": "LS49AG950NUXEN",
        "Native Aufl\u00f6sung": "Dual Quad HD 5120 x 1440 (DisplayPort: 240 Hz, HDMI: 144 Hz)",
        "Neigungswinkel": "-3/+13",
        "Pixelpitch": "0.2328 mm",
        "Produktbeschreibung": "Samsung Odyssey Neo G9 S49AG950NU - QLED-Monitor - gebogen - 124.5 cm (49\") - HDR",
        "Reaktionszeit": "1 ms (Gray-to-Gray)",
        "Schnittstellen": "DisplayPort 1.4  2 x HDMI  Kopfh\u00f6rer  2 x USB 3.0",
        "Schwenkwinkel": "30",
        "Seitenverh\u00e4ltnis": "32:9",
        "Sichtbare Bildfl\u00e4che": "123.8 cm (48.7\")",
        "Spannung": "Wechselstrom 100-240 V",
        "Stromverbrauch (Aus-Modus)": "0.3 Watt",
        "Stromverbrauch (typisch)": "55 Watt",
        "Stromverbrauch HDR (eingeschaltet)": "95 kWh/1.000 h",
        "Stromverbrauch SDR (eingeschaltet)": "55 kWh/1.000 h",
        "Stromverbrauch im Standby-Modus": "0.5 Watt",
        "Transportbreite": "126.5 cm",
        "Transportgewicht": "20.4 kg",
        "Transporth\u00f6he": "36.6 cm",
        "Transporttiefe": "48.1 cm",
        "VESA-Halterung": "100 x 100 mm",
        "Vertikale Bildwiederholrate": "60 - 240 Hz",
        "Vertikaler Betrachtungswinkel": "178",
        "Waren-Nr.": "3011162",
        "Zum Hersteller": "www.samsung.com"
    },
    "raw_specifications_text": "Hersteller: Samsung\nWaren-Nr.: 3011162\nModell: LS49AG950NUXEN\nEAN: 8806092522398\nZum Hersteller: www.samsung.com\nProduktbeschreibung: Samsung Odyssey Neo G9 S49AG950NU - QLED-Monitor - gebogen - 124.5 cm (49\") - HDR\nGer\u00e4tetyp: QLED-Monitor - 124.5 cm (49\")\nEnergie Effizienzklasse: Klasse G\nEnergieverbrauch pro Jahr: 80 kWh\nGeschwungener Bildschirm: Ja (1000R)\nAdaptive-Sync Technologie: AMD FreeSync Premium Pro, NVIDIA G-SYNC Compatible\nLeistungsmerkmale: USB 3.0-Hub\nBildschirmtyp: VA\nSeitenverh\u00e4ltnis: 32:9\nNative Aufl\u00f6sung: Dual Quad HD 5120 x 1440 (DisplayPort: 240 Hz, HDMI: 144 Hz)\nPixelpitch: 0.2328 mm\nHelligkeit: 2000 cd/m\u00b2\nKontrast: 1000000:1\nHDR-f\u00e4hig: HDR10+\nReaktionszeit: 1 ms (Gray-to-Gray)\nFarbunterst\u00fctzung: 1,07 Mrd. Farben\nFarbraum: 125% sRGB, 88% NTSC, 92% Adobe RGB, 95% DCI-P3\nEingangsanschl\u00fcsse: 2xHDMI, DisplayPort\nEinstellungen der Anzeigeposition: H\u00f6he, Drehung, Neigung\nSpannung: Wechselstrom 100-240 V\nFarbe: Schwarz\nAbmessungen (Breite x Tiefe x H\u00f6he) - mit Fu\u00df: 114.95 cm x 41.83 cm x 53.72 cm\nGewicht: 14.5 kg\nDisplay-Typ: QLED-Monitor / TFT-Aktivmatrix\nEnergieklasse (HDR): Klasse G\nDiagonalabmessung: 124.5 cm (49\")\nSichtbare Bildfl\u00e4che: 123.8 cm (48.7\")\nIntegrierte Peripherieger\u00e4te: USB 3.0-Hub\nHDR-Format: HDR10+\nVertikale Bildwiederholrate: 60 - 240 Hz\nHorizontaler Betrachtungswinkel: 178\nVertikaler Betrachtungswinkel: 178\nHintergrundbeleuchtungs-Technologie: Mini LED-Hintergrundbeleuchtung\nBesonderheiten: HighBrightness, Bild f\u00fcr Bild, Cinema Mode, Mega Dynamic Contrast Ratio, Black eQualizer, CustomColor Mode, FPS Mode, flimmerfreie Technologie, RTS Mode, Eye Saver Mode, Werkstuning, Off Timer Plus, Niedrige Eingangsverz\u00f6gerung, Quantum Dot Technology, Super Arena Gaming UX, Screen Size Optimizer, Refresh Rate Optimizer, Custom Key, RPG Mode, AOS Mode, sRGB Mode, Picture-in-Picture, Dynamic Contrast Mode, Auto Source Switch+, CoreSync-Beleuchtungsdesign, Quantum HDR 2000\nAbmessungen (Breite x Tiefe x H\u00f6he): 114.95 cm x 41.83 cm x 53.72 cm - mit Fu\u00df\nSchnittstellen: DisplayPort 1.4  2 x HDMI  Kopfh\u00f6rer  2 x USB 3.0\nNeigungswinkel: -3/+13\nSchwenkwinkel: 30\nH\u00f6heneinstellung: 120 mm\nVESA-Halterung: 100 x 100 mm\nEnthaltene Kabel: 1 x DisplayPort-Kabel  1 x SuperSpeed-USB-Kabel\nEingangsspannung: Wechselstrom 100-240 V\nStromverbrauch SDR (eingeschaltet): 55 kWh/1.000 h\nStromverbrauch HDR (eingeschaltet): 95 kWh/1.000 h\nStromverbrauch (typisch): 55 Watt\nStromverbrauch im Standby-Modus: 0.5 Watt\nStromverbrauch (Aus-Modus): 0.3 Watt\nDetails zu Abmessungen & Gewicht: Mit Fu\u00df - Breite: 114.95 cm - Tiefe: 41.83 cm - H\u00f6he: 53.72 cm - Gewicht: 14.5 kg  Ohne Fu\u00df - Breite: 114.95 cm - Tiefe: 28.74 cm - H\u00f6he: 36.35 cm - Gewicht: 11.9 kg\nTransportbreite: 126.5 cm\nTransporttiefe: 48.1 cm\nTransporth\u00f6he: 36.6 cm\nTransportgewicht: 20.4 kg",
    "reference_file": "offer_reference_1304.json",
    "shop_name": "Proshop.at"
}