{
    "html_file": "offer_374_2.html",
    "name": "iiyama ProLite XUB2495WSU-B5, 24.1\"",
    "offer_link": "https://www.mylemon.at/artikel/iiyama/xub2495wsu_b5/xub2495wsu-b5.html",
    "price": 237.51,
    "raw_specifications": {
        "AC Eingangsfrequenz": "50/60 Hz",
        "AC Eingangsspannung": "100 - 240 V",
        "AMD FreeSync": "Nein",
        "Anzahl DisplayPort Anschl\u00fcsse": "1",
        "Anzahl HDMI-Anschl\u00fcsse": "1",
        "Anzahl VGA (D-Sub) Anschl\u00fcsse": "1",
        "Anzahl der Farben des Displays": "16,7 Millionen Farben",
        "Anzahl der Lautsprecher": "2",
        "Anzahl der nachgeschalteten Steckpl\u00e4tze vom Typ USB-A": "4",
        "Artikelnummer": "M1IYUPRL",
        "Aufl\u00f6sung": "1920x1200",
        "Besonderheiten": "Lautsprecher",
        "Bildschirmdiagonale": "61,2 cm (24.1 Zoll)",
        "Bildschirmdiagonale (cm)": "61,13 cm",
        "Bildschirmform": "Flach",
        "Bildschirmtechnologie": "LCD",
        "Bildwinkel, horizontal": "178\u00b0",
        "Bildwinkel, vertikal": "178\u00b0",
        "DDC/CI": "Ja",
        "Digital horizontale Frequenz": "24 - 82 kHz",
        "Display-Aufl\u00f6sung": "1920 x 1200 Pixel",
        "Displaygr\u00f6\u00dfe": "24 Zoll",
        "EAN": "4948570121496",
        "Eingebaute Lautsprecher": "Ja",
        "Energieeffizienzklasse (SDR)": "E",
        "Energieverbrauch (SDR) pro 1.000 Stunden": "15 kWh",
        "Flimmerfreie Technologie": "Ja",
        "Ger\u00e4tebreite (inkl. Fu\u00df)": "532 mm",
        "Ger\u00e4teh\u00f6he (inkl. Fu\u00df)": "514 mm",
        "Ger\u00e4tetiefe (inkl. Fu\u00df)": "209,5 mm",
        "Gewicht (mit St\u00e4nder)": "5,8 kg",
        "HD-Typ": "WUXGA",
        "HDCP": "Ja",
        "HDMI": "Ja",
        "Helligkeit": "300 cd/m\u00b2",
        "Helligkeit (typisch)": "300 cd/m\u00b2",
        "Hersteller Artikelnummer": "XUB2495WSU-B5",
        "H\u00f6heneinstellung": "15 cm",
        "H\u00f6henverstellung": "Ja",
        "Integrierte Kamera": "Nein",
        "Integrierter USB-Hub": "Ja",
        "Kabelsperre-Slot": "Ja",
        "Kontrastverh\u00e4ltnis": "1000:1",
        "Kontrastverh\u00e4ltnis (dynamisch)": "5000000:1",
        "Kopfh\u00f6rerausgang": "Ja",
        "Low-Blue-Light-Technologie": "Ja",
        "Maximale Bildwiederholrate": "60 Hz",
        "Men\u00fcsprachen": "Vereinfachtes Chinesisch, Deutsch, Englisch, Spanisch, Franz\u00f6sisch, Italienisch, Japanisch, Portugiesisch, Russisch",
        "Mitgelieferte Kabel": "DisplayPort, Leistung, USB",
        "NTSC Abdeckung (typisch)": "72%",
        "NVIDIA G-SYNC": "Nein",
        "Natives Seitenverh\u00e4ltnis": "16:10",
        "Neigungsverstellung": "Ja",
        "Neigungswinkelbereich": "-5 - 23\u00b0",
        "Netzteiltyp": "Intern",
        "On-Screen-Display (OSD)": "Ja",
        "Paketgewicht": "7,5 kg",
        "Panel": "IPS",
        "Panel-Montage-Schnittstelle": "100 x 100 mm",
        "Panel-Typ": "IPS",
        "Pivot": "Ja",
        "Pivot Winkel": "0 - 90\u00b0",
        "Pixel Abstand": "0,27 x 0,27 mm",
        "Produktfarbe": "Schwarz",
        "RMS-Leistung": "2 W",
        "Reaktionszeit": "5 ms",
        "Schnellstart\u00fcbersicht": "Ja",
        "Schwenkbar": "Ja",
        "Schwenkwinkelbereich": "-45 - 45\u00b0",
        "Sichtbare Gr\u00f6\u00dfe (horizontal)": "51,8 cm",
        "Sichtbare Gr\u00f6\u00dfe (vertikal)": "32,4 cm",
        "Slot-Typ Kabelsperre": "Kensington",
        "Stromverbrauch (Standardbetrieb)": "17 W",
        "Stromverbrauch (Standby)": "0,5 W",
        "Stromverbrauch (aus)": "0,3 W",
        "St\u00e4nder enthalten": "Ja",
        "Touchscreen": "Nein",
        "USB-Hub-Version": "2.0",
        "VESA-Halterung": "Ja",
        "Verbessertes Kabelmanagement": "Ja",
        "Verpackungsbreite": "606 mm",
        "Verpackungsh\u00f6he": "413 mm",
        "Verpackungstiefe": "147 mm",
        "Video Anschl\u00fcsse": "1x VGA, 1x HDMI, 1x DisplayPort",
        "sRGB Abdeckung (klassisch)": "99%"
    },
    "raw_specifications_text": "Displaygr\u00f6\u00dfe: 24 Zoll\nAufl\u00f6sung: 1920x1200\nPanel: IPS\nReaktionszeit: 5 ms\nVideo Anschl\u00fcsse: 1x VGA, 1x HDMI, 1x DisplayPort\nHelligkeit: 300 cd/m\u00b2\nBesonderheiten: Lautsprecher\nHersteller Artikelnummer: XUB2495WSU-B5\nEAN: 4948570121496\nArtikelnummer: M1IYUPRL\nBildschirmdiagonale: 61,2 cm (24.1 Zoll)\nDisplay-Aufl\u00f6sung: 1920 x 1200 Pixel\nNatives Seitenverh\u00e4ltnis: 16:10\nBildschirmtechnologie: LCD\nTouchscreen: Nein\nHD-Typ: WUXGA\nPanel-Typ: IPS\nBildschirmform: Flach\nKontrastverh\u00e4ltnis: 1000:1\nMaximale Bildwiederholrate: 60 Hz\nAnzahl der Farben des Displays: 16,7 Millionen Farben\nHelligkeit (typisch): 300 cd/m\u00b2\nKontrastverh\u00e4ltnis (dynamisch): 5000000:1\nBildwinkel, horizontal: 178\u00b0\nBildwinkel, vertikal: 178\u00b0\nPixel Abstand: 0,27 x 0,27 mm\nSichtbare Gr\u00f6\u00dfe (horizontal): 51,8 cm\nSichtbare Gr\u00f6\u00dfe (vertikal): 32,4 cm\nDigital horizontale Frequenz: 24 - 82 kHz\nBildschirmdiagonale (cm): 61,13 cm\nDDC/CI: Ja\nsRGB Abdeckung (klassisch): 99%\nNTSC Abdeckung (typisch): 72%\nNVIDIA G-SYNC: Nein\nAMD FreeSync: Nein\nFlimmerfreie Technologie: Ja\nLow-Blue-Light-Technologie: Ja\nEingebaute Lautsprecher: Ja\nIntegrierte Kamera: Nein\nAnzahl der Lautsprecher: 2\nRMS-Leistung: 2 W\nProduktfarbe: Schwarz\nIntegrierter USB-Hub: Ja\nHDMI: Ja\nKopfh\u00f6rerausgang: Ja\nUSB-Hub-Version: 2.0\nAnzahl der nachgeschalteten Steckpl\u00e4tze vom Typ USB-A: 4\nAnzahl VGA (D-Sub) Anschl\u00fcsse: 1\nAnzahl HDMI-Anschl\u00fcsse: 1\nAnzahl DisplayPort Anschl\u00fcsse: 1\nHDCP: Ja\nVESA-Halterung: Ja\nKabelsperre-Slot: Ja\nH\u00f6henverstellung: Ja\nPanel-Montage-Schnittstelle: 100 x 100 mm\nVerbessertes Kabelmanagement: Ja\nSlot-Typ Kabelsperre: Kensington\nH\u00f6heneinstellung: 15 cm\nPivot: Ja\nPivot Winkel: 0 - 90\u00b0\nSchwenkbar: Ja\nSchwenkwinkelbereich: -45 - 45\u00b0\nNeigungswinkelbereich: -5 - 23\u00b0\nOn-Screen-Display (OSD): Ja\nMen\u00fcsprachen: Vereinfachtes Chinesisch, Deutsch, Englisch, Spanisch, Franz\u00f6sisch, Italienisch, Japanisch, Portugiesisch, Russisch\nNeigungsverstellung: Ja\nEnergieeffizienzklasse (SDR): E\nEnergieverbrauch (SDR) pro 1.000 Stunden: 15 kWh\nStromverbrauch (Standardbetrieb): 17 W\nStromverbrauch (Standby): 0,5 W\nStromverbrauch (aus): 0,3 W\nAC Eingangsspannung: 100 - 240 V\nAC Eingangsfrequenz: 50/60 Hz\nNetzteiltyp: Intern\nSt\u00e4nder enthalten: Ja\nMitgelieferte Kabel: DisplayPort, Leistung, USB\nSchnellstart\u00fcbersicht: Ja\nGer\u00e4tebreite (inkl. Fu\u00df): 532 mm\nGer\u00e4tetiefe (inkl. Fu\u00df): 209,5 mm\nGer\u00e4teh\u00f6he (inkl. Fu\u00df): 514 mm\nGewicht (mit St\u00e4nder): 5,8 kg\nVerpackungsbreite: 606 mm\nVerpackungstiefe: 147 mm\nVerpackungsh\u00f6he: 413 mm\nPaketgewicht: 7,5 kg",
    "reference_file": "offer_reference_374.json",
    "shop_name": "mylemon.at"
}