{
    "html_file": "offer_2000_35.html",
    "name": "Dell UltraSharp U2520D, 25\"",
    "offer_link": "https://ms-it-beratung.at/shop/details.php?art=336726&artname=Dell+63.4cm+%2825%22%29+++U2520D++16%3A09+HDMI%2B2xDP%2BUSB-C+IPS+Lift",
    "price": 270.0,
    "raw_specifications": {
        "3D": "Nein",
        "AC Eingangsfrequenz": "50 - 60 Hz",
        "AC Eingangsspannung": "100 - 240 V",
        "AC-Netzadapter": "Ja",
        "AMD FreeSync": "Nein",
        "Anzahl DisplayPort Anschl\u00fcsse": "2",
        "Anzahl HDMI-Anschl\u00fcsse": "1",
        "Anzahl der Farben des Displays": "16,78 Millionen Farben",
        "Anzahl der nachgeschalteten Ports vom Typ USB-C": "2",
        "Anzahl der nachgeschalteten Steckpl\u00e4tze vom Typ USB-A": "3",
        "Audioanschl\u00fcsse": "Nein",
        "Audioausgang": "Ja",
        "Betriebstemperatur": "0 - 40 \u00b0C",
        "Bild f\u00fcr Bild (PbP)": "Ja",
        "Bild-in-Bild": "Ja",
        "Bildschirmdiagonale": "63,5 cm (25\")",
        "Bildschirmform": "Flach",
        "Bildschirmtechnologie": "LCD",
        "Bildwinkel, horizontal": "178\u00b0",
        "Bildwinkel, vertikal": "178\u00b0",
        "Breite (ohne Standfu\u00df)": "567,7 mm",
        "DVI Anschluss": "Nein",
        "Display-Aufl\u00f6sung": "2560 x 1440 Pixel",
        "DisplayPorts-Version": "1.4",
        "Ein-/Ausschalter": "Ja",
        "Eingangsstrom": "2.5 A",
        "Eingebaute Lautsprecher": "Nein",
        "Energieeffizienzklasse (HDR)": "E",
        "Energieeffizienzklasse (SDR)": "F",
        "Energieeffizienzskala": "A bis G",
        "Energieverbrauch (HDR) pro 1.000 Stunden": "16 kWh",
        "Energieverbrauch (SDR) pro 1.000 Stunden": "22 kWh",
        "Farbpalette DCI-P3": "95%",
        "Flimmerfreie Technologie": "Ja",
        "Fu\u00dffarbe": "Schwarz",
        "Ger\u00e4tebreite (inkl. Fu\u00df)": "567,7 mm",
        "Ger\u00e4teh\u00f6he (inkl. Fu\u00df)": "382,9 mm",
        "Ger\u00e4tetiefe (inkl. Fu\u00df)": "185 mm",
        "Gewicht (mit St\u00e4nder)": "6,4 kg",
        "Gewicht (ohne St\u00e4nder)": "4,2 kg",
        "HD-Typ": "Quad HD",
        "HDMI": "Ja",
        "HDMI-Version": "2.0",
        "Helligkeit (typisch)": "350 cd/m\u00b2",
        "High Dynamic Range Video (HDR) Unterst\u00fctzung": "Nein",
        "H\u00f6he (ohne Standfu\u00df)": "332,1 mm",
        "H\u00f6he bei Betrieb": "0 - 5000 m",
        "H\u00f6he bei Lagerung": "0 - 12192 m",
        "H\u00f6heneinstellung": "13 cm",
        "H\u00f6henverstellung": "Ja",
        "Integrierte Kamera": "Nein",
        "Integrierter USB-Hub": "Ja",
        "Kabelsperre-Slot": "Ja",
        "Kontrastverh\u00e4ltnis": "1000:1",
        "Kopfh\u00f6rerausgang": "Nein",
        "Luftfeuchtigkeit bei Lagerung": "5 - 90%",
        "Marktpositionierung": "Grafikdesign",
        "Maximale Bildwiederholrate": "60 Hz",
        "Mitgelieferte Kabel": "AC, DisplayPort, USB Typ-C, USB Typ-C auf USB Typ-A",
        "NVIDIA G-SYNC": "Nein",
        "Nachhaltigkeitszertifikate": "RoHS, ENERGY STAR",
        "Natives Seitenverh\u00e4ltnis": "16:9",
        "Neigungsverstellung": "Ja",
        "Neigungswinkelbereich": "-5 - 21\u00b0",
        "Netzteiltyp": "Intern",
        "Paketgewicht": "8,8 kg",
        "Panel-Montage-Schnittstelle": "100 x 100 mm",
        "Panel-Typ": "IPS",
        "Pivot": "Ja",
        "Pivot Winkel": "-90 - 90\u00b0",
        "Pixel Abstand": "0,216 x 0,216 mm",
        "Pixeldichte": "117,5 ppi",
        "Produktfarbe": "Schwarz",
        "RGB-Farbraum": "sRGB",
        "Reaktionszeit": "8 ms",
        "Reaktionszeit (schnell)": "5 ms",
        "Relative Luftfeuchtigkeit in Betrieb": "10 - 80%",
        "Schwenkbar": "Ja",
        "Schwenkwinkelbereich": "-45 - 45\u00b0",
        "Sichtbare Gr\u00f6\u00dfe (horizontal)": "55,3 cm",
        "Sichtbare Gr\u00f6\u00dfe (vertikal)": "31,1 cm",
        "Stromverbrauch (Standardbetrieb)": "22 W",
        "Stromverbrauch (Standby)": "0,2 W",
        "Stromverbrauch (aus)": "0,2 W",
        "Stromverbrauch (max.)": "200 W",
        "St\u00e4nder enthalten": "Ja",
        "TV Tuner integriert": "Nein",
        "Temperaturbereich bei Lagerung": "-20 - 60 \u00b0C",
        "Tiefe (ohne Standfu\u00df)": "49,9 mm",
        "Touchscreen": "Nein",
        "Typ der Hintergrundbeleuchtung": "W-LED",
        "USB-Typ-C DisplayPort-Wechselmodus": "Ja",
        "USB-Upstream-Porttyp": "USB Typ-C",
        "Unterst\u00fctzte Grafik-Aufl\u00f6sungen": "2560 x 1440",
        "VESA-Halterung": "Ja",
        "Verkettung": "Ja",
        "Verpackungsbreite": "169,9 mm",
        "Verpackungsh\u00f6he": "412 mm",
        "Verpackungstiefe": "640,1 mm",
        "Vorderer Rahmen": "Schwarz",
        "WLAN": "Nein",
        "Warentarifnummer (HS)": "85285210",
        "sRGB Abdeckung (klassisch)": "99%"
    },
    "raw_specifications_text": "Bildschirmdiagonale: 63,5 cm (25\")\nDisplay-Aufl\u00f6sung: 2560 x 1440 Pixel\nNatives Seitenverh\u00e4ltnis: 16:9\nBildschirmtechnologie: LCD\nTouchscreen: Nein\nHD-Typ: Quad HD\nPanel-Typ: IPS\nTyp der Hintergrundbeleuchtung: W-LED\nHelligkeit (typisch): 350 cd/m\u00b2\nReaktionszeit: 8 ms\nBildschirmform: Flach\nUnterst\u00fctzte Grafik-Aufl\u00f6sungen: 2560 x 1440\nKontrastverh\u00e4ltnis: 1000:1\nMaximale Bildwiederholrate: 60 Hz\nBildwinkel, horizontal: 178\u00b0\nBildwinkel, vertikal: 178\u00b0\nAnzahl der Farben des Displays: 16,78 Millionen Farben\nReaktionszeit (schnell): 5 ms\nPixel Abstand: 0,216 x 0,216 mm\nPixeldichte: 117,5 ppi\nSichtbare Gr\u00f6\u00dfe (horizontal): 55,3 cm\nSichtbare Gr\u00f6\u00dfe (vertikal): 31,1 cm\nHigh Dynamic Range Video (HDR) Unterst\u00fctzung: Nein\nRGB-Farbraum: sRGB\nsRGB Abdeckung (klassisch): 99%\n3D: Nein\nNVIDIA G-SYNC: Nein\nAMD FreeSync: Nein\nFlimmerfreie Technologie: Ja\nEingebaute Lautsprecher: Nein\nIntegrierte Kamera: Nein\nMarktpositionierung: Grafikdesign\nProduktfarbe: Schwarz\nVorderer Rahmen: Schwarz\nFu\u00dffarbe: Schwarz\nIntegrierter USB-Hub: Ja\nUSB-Upstream-Porttyp: USB Typ-C\nAnzahl der nachgeschalteten Steckpl\u00e4tze vom Typ USB-A: 3\nAnzahl der nachgeschalteten Ports vom Typ USB-C: 2\nUSB-Typ-C DisplayPort-Wechselmodus: Ja\nDVI Anschluss: Nein\nHDMI: Ja\nAnzahl HDMI-Anschl\u00fcsse: 1\nHDMI-Version: 2.0\nAnzahl DisplayPort Anschl\u00fcsse: 2\nDisplayPorts-Version: 1.4\nAudioanschl\u00fcsse: Nein\nAudioausgang: Ja\nKopfh\u00f6rerausgang: Nein\nWLAN: Nein\nVESA-Halterung: Ja\nPanel-Montage-Schnittstelle: 100 x 100 mm\nKabelsperre-Slot: Ja\nH\u00f6henverstellung: Ja\nH\u00f6heneinstellung: 13 cm\nPivot: Ja\nPivot Winkel: -90 - 90\u00b0\nSchwenkbar: Ja\nSchwenkwinkelbereich: -45 - 45\u00b0\nNeigungswinkelbereich: -5 - 21\u00b0\nBild-in-Bild: Ja\nNeigungsverstellung: Ja\nEnergieeffizienzklasse (SDR): F\nEnergieeffizienzklasse (HDR): E\nEnergieverbrauch (SDR) pro 1.000 Stunden: 22 kWh\nEnergieverbrauch (HDR) pro 1.000 Stunden: 16 kWh\nStromverbrauch (Standardbetrieb): 22 W\nStromverbrauch (Standby): 0,2 W\nStromverbrauch (max.): 200 W\nStromverbrauch (aus): 0,2 W\nAC Eingangsspannung: 100 - 240 V\nAC Eingangsfrequenz: 50 - 60 Hz\nEingangsstrom: 2.5 A\nNetzteiltyp: Intern\nEnergieeffizienzskala: A bis G\nBetriebstemperatur: 0 - 40 \u00b0C\nTemperaturbereich bei Lagerung: -20 - 60 \u00b0C\nRelative Luftfeuchtigkeit in Betrieb: 10 - 80%\nLuftfeuchtigkeit bei Lagerung: 5 - 90%\nH\u00f6he bei Betrieb: 0 - 5000 m\nH\u00f6he bei Lagerung: 0 - 12192 m\nSt\u00e4nder enthalten: Ja\nMitgelieferte Kabel: AC, DisplayPort, USB Typ-C, USB Typ-C auf USB Typ-A\nGer\u00e4tebreite (inkl. Fu\u00df): 567,7 mm\nGer\u00e4tetiefe (inkl. Fu\u00df): 185 mm\nGer\u00e4teh\u00f6he (inkl. Fu\u00df): 382,9 mm\nGewicht (mit St\u00e4nder): 6,4 kg\nBreite (ohne Standfu\u00df): 567,7 mm\nTiefe (ohne Standfu\u00df): 49,9 mm\nH\u00f6he (ohne Standfu\u00df): 332,1 mm\nGewicht (ohne St\u00e4nder): 4,2 kg\nVerpackungsbreite: 169,9 mm\nVerpackungstiefe: 640,1 mm\nVerpackungsh\u00f6he: 412 mm\nPaketgewicht: 8,8 kg\nNachhaltigkeitszertifikate: RoHS, ENERGY STAR\nWarentarifnummer (HS): 85285210\nAC-Netzadapter: Ja\nEin-/Ausschalter: Ja\nFarbpalette DCI-P3: 95%\nTV Tuner integriert: Nein\nBild f\u00fcr Bild (PbP): Ja\nVerkettung: Ja",
    "reference_file": "offer_reference_2000.json",
    "shop_name": "ms-it-beratung"
}