{
    "html_file": "offer_2328_2.html",
    "name": "Acer Vero B7 B247Ybmiprzx, 23.8\"",
    "offer_link": "https://direkt.jacob.de/produkte/60-5cm-23-8-b247ybmiprzx-um-qb7ee-004-artnr-3984716.html?utm_source=geizhals&utm_medium=cpc&utm_campaign=Preisvergleich&ref=103",
    "price": 205.01,
    "raw_specifications": {
        "Abmessungen (Breite x Tiefe x H\u00f6he)": "54.1 cm x 19.3 cm x 49.8 cm - mit Fu\u00df",
        "Abmessungen (Breite x Tiefe x H\u00f6he) - mit Fu\u00df": "54.1 cm x 19.3 cm x 49.8 cm",
        "Ausgangsleistung/Kanal": "4 Watt",
        "Besonderheiten": "Acer Adaptive Contrast Management (ACM), ComfyView, Zero Frame, Flimmerfrei-Technologie, Abblend-Technologie, Adaptive-Sync Technologie,  Acer VisionCare,  Acer BluelightShield Technologie",
        "Bildschirmbeschichtung": "Blendfrei",
        "Bildschirmtyp": "IPS",
        "Details zu Abmessungen & Gewicht": "Mit Fu\u00df - Breite: 54.1 cm - Tiefe: 19.3 cm - H\u00f6he: 49.8 cm - Gewicht: 5.58 kg  Ohne Fu\u00df - Breite: 54 cm - Tiefe: 6.5 cm - H\u00f6he: 32.3 cm - Gewicht: 3.63 kg",
        "Diagonalabmessung": "60.5 cm (23.8\")",
        "Display-Typ": "LED-hintergrundbeleuchteter LCD-Monitor / TFT-Aktivmatrix",
        "ENERGY STAR zertifiziert": "Ja",
        "Eingangsanschl\u00fcsse": "HDMI, VGA, DisplayPort",
        "Einstellungen der Anzeigeposition": "H\u00f6he, Drehelement, neigbar",
        "Energie Effizienzklasse": "Klasse A",
        "Energieverbrauch pro Jahr": "32 kWh",
        "Enthaltene Kabel": "1 x VGA-Kabel  1 x DisplayPort-Kabel  1 x SuperSpeed-USB-Kabel",
        "Erforderliche Netzspannung": "Wechselstrom 120/230 V (50 - 60 Hz)",
        "Farbe": "Schwarz",
        "Farbunterst\u00fctzung": "16,7 Millionen Farben",
        "Ger\u00e4tetyp": "LED-hintergrundbeleuchteter LCD-Monitor - 60.5 cm (23.8\")",
        "Gewicht": "5.58 kg",
        "Helligkeit": "250 cd/m\u00b2",
        "Hintergrundbeleuchtungs-Technologie": "LED-Hintergrundbeleuchtung",
        "Horizontaler Betrachtungswinkel": "178",
        "H\u00f6heneinstellung": "120 mm",
        "Integrierte Peripherieger\u00e4te": "USB 3.0-Hub",
        "Kennzeichnung": "TCO Displays",
        "Kontrast": "100000000:1 (dynamisch)",
        "Leistungsaufnahme im Betrieb": "22 Watt",
        "Leistungsaufnahme im Ein-Zustand": "22 W",
        "Leistungsmerkmale": "Unterst\u00fctzung f\u00fcr VESA-Schnittstelle",
        "Lokalisierung": "\u00d6sterreich, Deutschland",
        "Native Aufl\u00f6sung": "Full HD (1080p) 1920 x 1080 bei 75 Hz",
        "Neigungswinkel": "-5/+25",
        "Produktbeschreibung": "Acer B247Y - LED-Monitor - Full HD (1080p) - 60.5 cm (23.8\")",
        "Reaktionszeit": "4 ms (gray-to-gray)",
        "Schnittstellen": "VGA  DisplayPort  HDMI  Audio Line-Out  4 x USB 3.0 Downstream  USB 3.0 Upstream",
        "Seitenverh\u00e4ltnis": "16:9",
        "Stromverbrauch (Aus-Modus)": "0.27 Watt",
        "Stromverbrauch im Standby-Modus": "0.39 Watt",
        "Typ": "Lautsprecher - Stereo",
        "Umweltschutzstandards": "ENERGY STAR-qualifiziert",
        "Vertikaler Betrachtungswinkel": "178"
    },
    "raw_specifications_text": "Produktbeschreibung: Acer B247Y - LED-Monitor - Full HD (1080p) - 60.5 cm (23.8\")\nGer\u00e4tetyp: LED-hintergrundbeleuchteter LCD-Monitor - 60.5 cm (23.8\")\nEnergie Effizienzklasse: Klasse A\nEnergieverbrauch pro Jahr: 32 kWh\nLeistungsaufnahme im Ein-Zustand: 22 W\nLeistungsmerkmale: Unterst\u00fctzung f\u00fcr VESA-Schnittstelle\nBildschirmtyp: IPS\nSeitenverh\u00e4ltnis: 16:9\nNative Aufl\u00f6sung: Full HD (1080p) 1920 x 1080 bei 75 Hz\nHelligkeit: 250 cd/m\u00b2\nKontrast: 100000000:1 (dynamisch)\nReaktionszeit: 4 ms (gray-to-gray)\nFarbunterst\u00fctzung: 16,7 Millionen Farben\nEingangsanschl\u00fcsse: HDMI, VGA, DisplayPort\nEinstellungen der Anzeigeposition: H\u00f6he, Drehelement, neigbar\nBildschirmbeschichtung: Blendfrei\nFarbe: Schwarz\nAbmessungen (Breite x Tiefe x H\u00f6he) - mit Fu\u00df: 54.1 cm x 19.3 cm x 49.8 cm\nGewicht: 5.58 kg\nLokalisierung: \u00d6sterreich, Deutschland\nUmweltschutzstandards: ENERGY STAR-qualifiziert\nKennzeichnung: TCO Displays\nDisplay-Typ: LED-hintergrundbeleuchteter LCD-Monitor / TFT-Aktivmatrix\nDiagonalabmessung: 60.5 cm (23.8\")\nIntegrierte Peripherieger\u00e4te: USB 3.0-Hub\nHorizontaler Betrachtungswinkel: 178\nVertikaler Betrachtungswinkel: 178\nHintergrundbeleuchtungs-Technologie: LED-Hintergrundbeleuchtung\nBesonderheiten: Acer Adaptive Contrast Management (ACM), ComfyView, Zero Frame, Flimmerfrei-Technologie, Abblend-Technologie, Adaptive-Sync Technologie,  Acer VisionCare,  Acer BluelightShield Technologie\nAbmessungen (Breite x Tiefe x H\u00f6he): 54.1 cm x 19.3 cm x 49.8 cm - mit Fu\u00df\nTyp: Lautsprecher - Stereo\nAusgangsleistung/Kanal: 4 Watt\nSchnittstellen: VGA  DisplayPort  HDMI  Audio Line-Out  4 x USB 3.0 Downstream  USB 3.0 Upstream\nNeigungswinkel: -5/+25\nH\u00f6heneinstellung: 120 mm\nEnthaltene Kabel: 1 x VGA-Kabel  1 x DisplayPort-Kabel  1 x SuperSpeed-USB-Kabel\nErforderliche Netzspannung: Wechselstrom 120/230 V (50 - 60 Hz)\nLeistungsaufnahme im Betrieb: 22 Watt\nStromverbrauch im Standby-Modus: 0.39 Watt\nStromverbrauch (Aus-Modus): 0.27 Watt\nDetails zu Abmessungen & Gewicht: Mit Fu\u00df - Breite: 54.1 cm - Tiefe: 19.3 cm - H\u00f6he: 49.8 cm - Gewicht: 5.58 kg  Ohne Fu\u00df - Breite: 54 cm - Tiefe: 6.5 cm - H\u00f6he: 32.3 cm - Gewicht: 3.63 kg\nENERGY STAR zertifiziert: Ja",
    "reference_file": "offer_reference_2328.json",
    "shop_name": "Jacob Elektronik direkt (AT)"
}