{
    "html_file": "offer_993_5.html",
    "name": "AOC 24G2SPU/BK, 23.8\"",
    "offer_link": "https://direkt.jacob.de/produkte/aoc-24g2spu-bk-computerbildschirm-24g2spu-bk-artnr-7642048.html?utm_source=geizhals&utm_medium=cpc&utm_campaign=Preisvergleich&ref=103",
    "price": 159.28,
    "raw_specifications": {
        "AC Eingangsfrequenz": "50/60 Hz",
        "AC Eingangsspannung": "100 - 240 V",
        "AMD FreeSync": "Ja",
        "AMD FreeSync Bildwiederholratenbereich": "48 - 165 Hz",
        "AMD FreeSync-Typ": "FreeSync Premium",
        "Adobe RGB-Abdeckung": "94%",
        "Anzahl DisplayPort Anschl\u00fcsse": "1",
        "Anzahl HDMI-Anschl\u00fcsse": "2",
        "Anzahl OSD-Sprachen": "16",
        "Anzahl VGA (D-Sub) Anschl\u00fcsse": "1",
        "Anzahl der Farben des Displays": "16,7 Millionen Farben",
        "Anzahl der Lautsprecher": "2",
        "Audioanschl\u00fcsse": "Ja",
        "Bildschirmaufl\u00f6sung": "1920 x 1080 Pixel",
        "Bildschirmdiagonale": "60,5 cm (23.8\" )",
        "Bildschirmdiagonale (cm)": "60,5 cm",
        "Bildschirmform": "Flach",
        "Bildwinkel, horizontal": "178\u00b0",
        "Bildwinkel, vertikal": "178\u00b0",
        "Breite (ohne Standfu\u00df)": "53,9 cm",
        "DisplayPort Kabell\u00e4nge": "1,5 m",
        "DisplayPorts-Version": "1.2",
        "Eingebaute Lautsprecher": "Ja",
        "Energie Effizienzklasse": "F",
        "Ger\u00e4tebreite (inkl. Fu\u00df)": "539 mm",
        "Ger\u00e4teh\u00f6he (inkl. Fu\u00df)": "504,6 mm",
        "Ger\u00e4tetiefe (inkl. Fu\u00df)": "227,4 mm",
        "HD-Typ": "Full HD",
        "HDMI": "Ja",
        "HDMI-Kabell\u00e4nge": "1,5 m",
        "HDMI-Version": "1.4",
        "Helligkeit (typisch)": "300 cd/m\u00b2",
        "H\u00f6he (ohne Standfu\u00df)": "32,2 cm",
        "H\u00f6heneinstellung": "13 cm",
        "H\u00f6henverstellung": "Ja",
        "Integrierte Kamera": "Nein",
        "Integrierter USB-Hub": "Ja",
        "Kontrastverh\u00e4ltnis": "1000:1",
        "Kopfh\u00f6rer-Anschluss": "3,5 mm",
        "Kopfh\u00f6rerausgang": "Ja",
        "Marktpositionierung": "Gaming",
        "Maximale Bildwiederholrate": "165 Hz",
        "Mitgelieferte Kabel": "DisplayPort,HDMI",
        "Nachhaltigkeitszertifikate": "CE, RoHS",
        "Natives Seitenverh\u00e4ltnis": "16:9",
        "Neigungswinkelbereich": "5 - 23\u00b0",
        "Netzteiltyp": "Intern",
        "On-Screen-Display (OSD)": "Ja",
        "Paketgewicht": "6,31 kg",
        "Panel-Montage-Schnittstelle": "100 x 100 mm",
        "Panel-Typ": "IPS",
        "Pivot": "Ja",
        "Pixeldichte": "93 ppi",
        "Produktfarbe": "Schwarz, Rot",
        "RGB-Farbraum": "sRGB",
        "RMS-Leistung": "2 W",
        "Rahmenloses Design": "Ja",
        "Reaktionszeit": "4 ms",
        "Reaktionszeit (schnell)": "1 ms",
        "Schwenkbar": "Ja",
        "Schwenkwinkelbereich": "30 - 30\u00b0",
        "Stromverbrauch (Standardbetrieb)": "25 W",
        "Stromverbrauch (Standby)": "0,3 W",
        "Stromverbrauch (aus)": "0,3 W",
        "Tiefe (ohne Standfu\u00df)": "4,72 cm",
        "Typ der Hintergrundbeleuchtung": "W-LED",
        "USB-Hub-Version": "3.2 Gen 2 (3.1 Gen 2)",
        "VESA-Halterung": "Ja",
        "Verpackungsbreite": "605 mm",
        "Verpackungsh\u00f6he": "492 mm",
        "Verpackungstiefe": "184 mm",
        "kippbar": "Ja",
        "sRGB Abdeckung (klassisch)": "126%"
    },
    "raw_specifications_text": "Bildschirmdiagonale: 60,5 cm (23.8\" )\nBildschirmaufl\u00f6sung: 1920 x 1080 Pixel\nEnergie Effizienzklasse: F\nNatives Seitenverh\u00e4ltnis: 16:9\nPanel-Typ: IPS\nHD-Typ: Full HD\nBildschirmform: Flach\nKontrastverh\u00e4ltnis: 1000:1\nMaximale Bildwiederholrate: 165 Hz\nAnzahl der Farben des Displays: 16,7 Millionen Farben\nHelligkeit (typisch): 300 cd/m\u00b2\nReaktionszeit: 4 ms\nTyp der Hintergrundbeleuchtung: W-LED\nBildwinkel, horizontal: 178\u00b0\nBildwinkel, vertikal: 178\u00b0\nReaktionszeit (schnell): 1 ms\nPixeldichte: 93 ppi\nBildschirmdiagonale (cm): 60,5 cm\nRGB-Farbraum: sRGB\nsRGB Abdeckung (klassisch): 126%\nAdobe RGB-Abdeckung: 94%\nAMD FreeSync: Ja\nAMD FreeSync-Typ: FreeSync Premium\nAMD FreeSync Bildwiederholratenbereich: 48 - 165 Hz\nEingebaute Lautsprecher: Ja\nIntegrierte Kamera: Nein\nAnzahl der Lautsprecher: 2\nRMS-Leistung: 2 W\nMarktpositionierung: Gaming\nProduktfarbe: Schwarz, Rot\nRahmenloses Design: Ja\nIntegrierter USB-Hub: Ja\nHDMI: Ja\nKopfh\u00f6rerausgang: Ja\nUSB-Hub-Version: 3.2 Gen 2 (3.1 Gen 2)\nAnzahl VGA (D-Sub) Anschl\u00fcsse: 1\nAnzahl HDMI-Anschl\u00fcsse: 2\nHDMI-Version: 1.4\nAnzahl DisplayPort Anschl\u00fcsse: 1\nDisplayPorts-Version: 1.2\nAudioanschl\u00fcsse: Ja\nKopfh\u00f6rer-Anschluss: 3,5 mm\nVESA-Halterung: Ja\nH\u00f6henverstellung: Ja\nPanel-Montage-Schnittstelle: 100 x 100 mm\nH\u00f6heneinstellung: 13 cm\nPivot: Ja\nSchwenkbar: Ja\nSchwenkwinkelbereich: 30 - 30\u00b0\nkippbar: Ja\nNeigungswinkelbereich: 5 - 23\u00b0\nOn-Screen-Display (OSD): Ja\nAnzahl OSD-Sprachen: 16\nStromverbrauch (Standardbetrieb): 25 W\nStromverbrauch (Standby): 0,3 W\nStromverbrauch (aus): 0,3 W\nAC Eingangsspannung: 100 - 240 V\nAC Eingangsfrequenz: 50/60 Hz\nNetzteiltyp: Intern\nNachhaltigkeitszertifikate: CE, RoHS\nGer\u00e4tebreite (inkl. Fu\u00df): 539 mm\nGer\u00e4tetiefe (inkl. Fu\u00df): 227,4 mm\nGer\u00e4teh\u00f6he (inkl. Fu\u00df): 504,6 mm\nBreite (ohne Standfu\u00df): 53,9 cm\nTiefe (ohne Standfu\u00df): 4,72 cm\nH\u00f6he (ohne Standfu\u00df): 32,2 cm\nMitgelieferte Kabel: DisplayPort,HDMI\nDisplayPort Kabell\u00e4nge: 1,5 m\nHDMI-Kabell\u00e4nge: 1,5 m\nVerpackungsbreite: 605 mm\nVerpackungstiefe: 184 mm\nVerpackungsh\u00f6he: 492 mm\nPaketgewicht: 6,31 kg",
    "reference_file": "offer_reference_993.json",
    "shop_name": "Jacob Elektronik direkt (AT)"
}