{
    "html_file": "offer_987_0.html",
    "name": "ASUS ZenScreen Go MB16AWP, 15.6\"",
    "offer_link": "https://www.amazon.de/dp/B09TW8WDYP?linkCode=xm2&camp=2025&creative=165953&smid=A3JWKAKR8XB7XF&creativeASIN=B09TW8WDYP&tag=geizhals1-21",
    "price": 452.77,
    "raw_specifications": {
        "ASIN": "B09TW8WDYP",
        "Amazon Bestseller-Rang": "Nr. 59,074 in Computer & Zubeh\u00f6r (Siehe Top 100 in Computer & Zubeh\u00f6r)  Nr. 1,131 in Monitore",
        "Anzahl der Lithium-Ionen-Zellen": "\u200e1",
        "Anzahl der Lithium-Metall-Zellen": "\u200e1",
        "Artikelgewicht": "\u200e1,1 Kilograms",
        "Batterien": "\u200e1 Lithium-Polymer Batterien erforderlich.",
        "Batterien enthalten": "\u200eNein",
        "Bildschirmaufl\u00f6sung": "\u200e1920x1080",
        "Display-Gr\u00f6\u00dfe": "\u200e15,6 Zoll",
        "Durchschnittliche Kundenbewertung": "4,3  4,3 von 5 Sternen    \n    474 Sternebewertungen   \n\n\n 4,3 von 5 Sternen",
        "Farbe": "\u200eschwarz",
        "Garantierte Software-Updates bis": "\u200eunbekannt",
        "Hersteller": "\u200eAsus",
        "Im Angebot von Amazon.de seit": "2. M\u00e4rz 2022",
        "Kapazit\u00e4t Lithium-Akku": "\u200e70,2 Wattstunden",
        "L\u00f6sung": "\u200e1920 x 1080 Pixels",
        "Marke": "\u200eASUSK",
        "Modell/Serie": "\u200eMB16AWP",
        "Modellnummer": "\u200eMB16AWP",
        "Produktabmessungen": "\u200e54 x 31,7 x 21 cm; 1,1 Kilogramm",
        "Prozessortyp": "\u200eOthers"
    },
    "raw_specifications_text": "Marke: \u200eASUSK\nHersteller: \u200eAsus\nModell/Serie: \u200eMB16AWP\nProduktabmessungen: \u200e54 x 31,7 x 21 cm; 1,1 Kilogramm\nBatterien: \u200e1 Lithium-Polymer Batterien erforderlich.\nModellnummer: \u200eMB16AWP\nFarbe: \u200eschwarz\nDisplay-Gr\u00f6\u00dfe: \u200e15,6 Zoll\nBildschirmaufl\u00f6sung: \u200e1920x1080\nL\u00f6sung: \u200e1920 x 1080 Pixels\nProzessortyp: \u200eOthers\nBatterien enthalten: \u200eNein\nKapazit\u00e4t Lithium-Akku: \u200e70,2 Wattstunden\nAnzahl der Lithium-Ionen-Zellen: \u200e1\nAnzahl der Lithium-Metall-Zellen: \u200e1\nArtikelgewicht: \u200e1,1 Kilograms\nGarantierte Software-Updates bis: \u200eunbekannt\nASIN: B09TW8WDYP\nDurchschnittliche Kundenbewertung: 4,3  4,3 von 5 Sternen    \n    474 Sternebewertungen   \n\n\n 4,3 von 5 Sternen\nAmazon Bestseller-Rang: Nr. 59,074 in Computer & Zubeh\u00f6r (Siehe Top 100 in Computer & Zubeh\u00f6r)  Nr. 1,131 in Monitore\nIm Angebot von Amazon.de seit: 2. M\u00e4rz 2022",
    "reference_file": "offer_reference_987.json",
    "shop_name": "Amazon.at"
}