{
    "html_file": "offer_1180_24.html",
    "name": "Dell S2722DZ, 27\"",
    "offer_link": "https://www.alternate.at/Dell/S2722DZ-LED-Monitor/html/product/1810115?partner=AtGeizhalsat&campaign=Monitor/Dell/1810115",
    "price": 365.0,
    "raw_specifications": {
        "": "AMD FreeSync, Mikrofon, Webcam",
        "Abmessungen": "Breite: 61,16 cm x H\u00f6he: 51 cm x Tiefe/L\u00e4nge: 17,47 cm",
        "Anschl\u00fcsse": "1x HDMI-Eingang, (HDMI-Version: 1.4), 1x DisplayPort-Eingang, (DisplayPort-Version: 1.2), 1x 3,5-mm-Audio-Ausgang, 2x USB-A-3.2 Gen 1 (5 Gbit/s), 1x USB-C",
        "Bild": "Format",
        "Bildschirmaufl\u00f6sung": "2.560 x 1.440 Pixel",
        "Bildschirmdiagonale": "69 cm (27 Zoll)",
        "EAN": "5397184567630",
        "Energieeffizienzklasse (SDR)": "F (A - G)",
        "Energieverbauch pro 1000 Stunden (SDR)": "24 kWh",
        "Ergonomie": "Typ",
        "Farbe": "schwarz",
        "Features": "USB-C Power Delivery (65 Watt), Integrierte Webcam",
        "Frequenz": "Vertikal",
        "Geeignet f\u00fcr": "Multimedia",
        "Gewicht": "6,9 kg",
        "Hersteller-Nr.": "DELL-S2722DZ",
        "Lautsprecher": "2 Lautsprecher",
        "Leistungsaufnahme im Bereitschafts- und Aus-Zustand": "0,3 Watt",
        "Leistungsaufnahme im Ein-Zustand bei Standard-Dynamikumfang (SDR)": "24 Watt",
        "Stromversorgung": "Eco-Off",
        "Typ": "LED-Monitor",
        "Wandhalterung": "VESA kompatibel (100 x 100 mm)"
    },
    "raw_specifications_text": "Energieeffizienzklasse (SDR): F (A - G)\nEnergieverbauch pro 1000 Stunden (SDR): 24 kWh\nLeistungsaufnahme im Ein-Zustand bei Standard-Dynamikumfang (SDR): 24 Watt\nLeistungsaufnahme im Bereitschafts- und Aus-Zustand: 0,3 Watt\nBildschirmdiagonale: 69 cm (27 Zoll)\nBildschirmaufl\u00f6sung: 2.560 x 1.440 Pixel\nTyp: LED-Monitor\nFarbe: schwarz\nEAN: 5397184567630\nHersteller-Nr.: DELL-S2722DZ\nGeeignet f\u00fcr: Multimedia\nBild: Format\n: AMD FreeSync, Mikrofon, Webcam\nFrequenz: Vertikal\nAnschl\u00fcsse: 1x HDMI-Eingang, (HDMI-Version: 1.4), 1x DisplayPort-Eingang, (DisplayPort-Version: 1.2), 1x 3,5-mm-Audio-Ausgang, 2x USB-A-3.2 Gen 1 (5 Gbit/s), 1x USB-C\nErgonomie: Typ\nStromversorgung: Eco-Off\nLautsprecher: 2 Lautsprecher\nWandhalterung: VESA kompatibel (100 x 100 mm)\nFeatures: USB-C Power Delivery (65 Watt), Integrierte Webcam\nAbmessungen: Breite: 61,16 cm x H\u00f6he: 51 cm x Tiefe/L\u00e4nge: 17,47 cm\nGewicht: 6,9 kg",
    "reference_file": "offer_reference_1180.json",
    "shop_name": "Alternate.at"
}