{
    "html_file": "offer_167_5.html",
    "name": "ViewSonic VP3881a, 37.5\"",
    "offer_link": "https://www.taufnaus.de/product/10604552",
    "price": 1535.83,
    "raw_specifications": {
        "Abmessungen (Breite x Tiefe x H\u00f6he)": "89.6 cm x 29.9 cm x 49.924 cm - mit Fu\u00df",
        "Adaptive-Sync Technologie": "AMD FreeSync",
        "Ausgangsleistung/Kanal": "5 Watt",
        "Besonderheiten": "Bild f\u00fcr Bild, Geteilter Bildschirm, flimmerfreie Technologie, TMDS-Technologie (Transition Minimized Differential Signaling), Blaulichtfilter-Technologie, ViewMode, Picture-in-Picture, Monitorkalibrierung Delta E<2, Uniformity Compensation, Pantone-zertifiziert, 10-bit (8-bit + A-FRC) Farbtiefe",
        "Bildschirmbeschichtung": "Blendfrei, 3H Hard Coating",
        "Bildschirmtyp": "IPS",
        "Details zu Abmessungen & Gewicht": "Mit Fu\u00df - Breite: 89.6 cm - Tiefe: 29.9 cm - H\u00f6he: 49.924 cm - Gewicht: 12.6 kg \u00a6 Ohne Fu\u00df - Breite: 89.6 cm - Tiefe: 10.3 cm - H\u00f6he: 39.8 cm - Gewicht: 7.9 kg",
        "Diagonalabmessung": "96.5 cm (38\")",
        "Display-Typ": "LED-hintergrundbeleuchteter LCD-Monitor / TFT-Aktivmatrix",
        "ENERGY STAR zertifiziert": "Ja",
        "ENERGY STAR-Version": "8.0",
        "EPEAT-kompatibel": "EPEAT Bronze",
        "Eingangsspannung": "Wechselstrom 100-240 V (50 - 60 Hz)",
        "Einstellungen der Anzeigeposition": "H\u00f6he, Drehung, Neigung",
        "Energie Effizienzklasse": "Klasse G",
        "Energieklasse (HDR)": "Klasse G",
        "Enthaltene Kabel": "1 x HDMI-Kabel \u00a6 1 x DisplayPort-Kabel \u00a6 1 x USB-C 3.2 Gen 1 Kabel \u00a6 1 x USB-Kabel Typ A auf Typ B",
        "Farbraum": "100% Rec 709, 100% sRGB, 95% DCI-P3, 97% Adobe RGB",
        "Farbunterst\u00fctzung": "1,074 Milliarden Farben (10-Bit)",
        "Geschwungener Bildschirm": "Ja (2300R)",
        "Gewicht": "12.6 kg",
        "HDR-Format": "HDR10",
        "Helligkeit": "300 cd/m\u00b2",
        "Hintergrundbeleuchtungs-Technologie": "LED-Hintergrundbeleuchtung",
        "Horizontale Bildwiederholrate": "15 - 135 kHz",
        "Horizontaler Betrachtungswinkel": "178",
        "H\u00f6heneinstellung": "130 mm",
        "Integrierte Peripherieger\u00e4te": "USB 3.2/USB-C Hub",
        "Kennzeichnung": "FCC Klasse B bescheinigt, ICES-003, CB, CCC, RoHS, WEEE, cTUVus, REACH, CEC, UkrSEPRO, ERP, EAC, China Energy Label, China RoHS, NRCAN, CE/EMC, Mexico Energy label, Mexico CoC, UKCA",
        "Kontrast": "1000:1 / 20000000:1 (dynamisch)",
        "Lebensdauer der Beleuchtung": "30,000 Stunden",
        "Leistungsmerkmale": "Slot f\u00fcr Sicherheitsschloss (Kabelschloss getrennt erh\u00e4ltlich)",
        "Max. Betriebstemperatur": "40 \u00b0C",
        "Min Betriebstemperatur": "0 \u00b0C",
        "Native Aufl\u00f6sung": "WQHD+ 3840 x 1600 bei 60 Hz",
        "Neigungswinkel": "-1/+21",
        "Pixelpitch": "0.229 mm",
        "Reaktionszeit": "5 ms (grau zu grau mit \u00dcbersteuerung)",
        "Schlosstyp zur Diebstahlsicherung": "Kensington Slot",
        "Schnittstellen": "2 x HDMI \u00a6 DisplayPort 1.4 \u00a6 USB-C 3.2 Gen 1 Upstream/DisplayPort 1.2 Alt Mode mit Spannungsversorgung \u00a6 USB 3.2 Upstream (Typ B) \u00a6 2 x USB 3.2 Downstream (Typ A) \u00a6 LAN (RJ-45) \u00a6 Kopfh\u00f6rer",
        "Schwenkwinkel": "120",
        "Seitenverh\u00e4ltnis": "21:9",
        "Service und Support": "Begrenzte Garantie - Arbeitszeit und Ersatzteile - 3 Jahre \u00a6 Begrenzte Garantie - Leuchtpult - 3 Jahre",
        "Sichtbare Bildfl\u00e4che": "95.2 cm (37.5\")",
        "Stromverbrauch (max.)": "56 Watt",
        "Stromverbrauch (typisch)": "52 Watt",
        "Stromverbrauch HDR (eingeschaltet)": "48.8 kWh/1.000 h",
        "Stromverbrauch SDR (eingeschaltet)": "38.2 kWh/1.000 h",
        "Stromverbrauch im Standby-Modus": "0.5 Watt",
        "Transportbreite": "104.6 cm",
        "Transportgewicht": "18.9 kg",
        "Transporth\u00f6he": "59 cm",
        "Transporttiefe": "37.5 cm",
        "Typ": "KVM-Switch - 1 Anschl\u00fcsse",
        "VESA-Halterung": "100 x 100 mm",
        "Vertikale Bildwiederholrate": "24 - 75 Hz",
        "Vertikaler Betrachtungswinkel": "178",
        "Zul\u00e4ssige Luftfeuchtigkeit im Betrieb": "20 - 90% (nicht kondensierend)"
    },
    "raw_specifications_text": "Display-Typ: LED-hintergrundbeleuchteter LCD-Monitor / TFT-Aktivmatrix\nEnergie Effizienzklasse: Klasse G\nEnergieklasse (HDR): Klasse G\nDiagonalabmessung: 96.5 cm (38\")\nSichtbare Bildfl\u00e4che: 95.2 cm (37.5\")\nGeschwungener Bildschirm: Ja (2300R)\nAdaptive-Sync Technologie: AMD FreeSync\nIntegrierte Peripherieger\u00e4te: USB 3.2/USB-C Hub\nBildschirmtyp: IPS\nSeitenverh\u00e4ltnis: 21:9\nNative Aufl\u00f6sung: WQHD+ 3840 x 1600 bei 60 Hz\nPixelpitch: 0.229 mm\nHelligkeit: 300 cd/m\u00b2\nKontrast: 1000:1 / 20000000:1 (dynamisch)\nHDR-Format: HDR10\nFarbunterst\u00fctzung: 1,074 Milliarden Farben (10-Bit)\nFarbraum: 100% Rec 709, 100% sRGB, 95% DCI-P3, 97% Adobe RGB\nReaktionszeit: 5 ms (grau zu grau mit \u00dcbersteuerung)\nVertikale Bildwiederholrate: 24 - 75 Hz\nHorizontale Bildwiederholrate: 15 - 135 kHz\nHorizontaler Betrachtungswinkel: 178\nVertikaler Betrachtungswinkel: 178\nBildschirmbeschichtung: Blendfrei, 3H Hard Coating\nHintergrundbeleuchtungs-Technologie: LED-Hintergrundbeleuchtung\nBesonderheiten: Bild f\u00fcr Bild, Geteilter Bildschirm, flimmerfreie Technologie, TMDS-Technologie (Transition Minimized Differential Signaling), Blaulichtfilter-Technologie, ViewMode, Picture-in-Picture, Monitorkalibrierung Delta E<2, Uniformity Compensation, Pantone-zertifiziert, 10-bit (8-bit + A-FRC) Farbtiefe\nAbmessungen (Breite x Tiefe x H\u00f6he): 89.6 cm x 29.9 cm x 49.924 cm - mit Fu\u00df\nGewicht: 12.6 kg\nTyp: KVM-Switch - 1 Anschl\u00fcsse\nAusgangsleistung/Kanal: 5 Watt\nSchnittstellen: 2 x HDMI \u00a6 DisplayPort 1.4 \u00a6 USB-C 3.2 Gen 1 Upstream/DisplayPort 1.2 Alt Mode mit Spannungsversorgung \u00a6 USB 3.2 Upstream (Typ B) \u00a6 2 x USB 3.2 Downstream (Typ A) \u00a6 LAN (RJ-45) \u00a6 Kopfh\u00f6rer\nEinstellungen der Anzeigeposition: H\u00f6he, Drehung, Neigung\nNeigungswinkel: -1/+21\nSchwenkwinkel: 120\nH\u00f6heneinstellung: 130 mm\nVESA-Halterung: 100 x 100 mm\nLeistungsmerkmale: Slot f\u00fcr Sicherheitsschloss (Kabelschloss getrennt erh\u00e4ltlich)\nEnthaltene Kabel: 1 x HDMI-Kabel \u00a6 1 x DisplayPort-Kabel \u00a6 1 x USB-C 3.2 Gen 1 Kabel \u00a6 1 x USB-Kabel Typ A auf Typ B\nLebensdauer der Beleuchtung: 30,000 Stunden\nKennzeichnung: FCC Klasse B bescheinigt, ICES-003, CB, CCC, RoHS, WEEE, cTUVus, REACH, CEC, UkrSEPRO, ERP, EAC, China Energy Label, China RoHS, NRCAN, CE/EMC, Mexico Energy label, Mexico CoC, UKCA\nSchlosstyp zur Diebstahlsicherung: Kensington Slot\nEingangsspannung: Wechselstrom 100-240 V (50 - 60 Hz)\nStromverbrauch SDR (eingeschaltet): 38.2 kWh/1.000 h\nStromverbrauch HDR (eingeschaltet): 48.8 kWh/1.000 h\nStromverbrauch (typisch): 52 Watt\nStromverbrauch (max.): 56 Watt\nStromverbrauch im Standby-Modus: 0.5 Watt\nDetails zu Abmessungen & Gewicht: Mit Fu\u00df - Breite: 89.6 cm - Tiefe: 29.9 cm - H\u00f6he: 49.924 cm - Gewicht: 12.6 kg \u00a6 Ohne Fu\u00df - Breite: 89.6 cm - Tiefe: 10.3 cm - H\u00f6he: 39.8 cm - Gewicht: 7.9 kg\nTransportbreite: 104.6 cm\nTransporttiefe: 37.5 cm\nTransporth\u00f6he: 59 cm\nTransportgewicht: 18.9 kg\nEPEAT-kompatibel: EPEAT Bronze\nENERGY STAR zertifiziert: Ja\nENERGY STAR-Version: 8.0\nService und Support: Begrenzte Garantie - Arbeitszeit und Ersatzteile - 3 Jahre \u00a6 Begrenzte Garantie - Leuchtpult - 3 Jahre\nMin Betriebstemperatur: 0 \u00b0C\nMax. Betriebstemperatur: 40 \u00b0C\nZul\u00e4ssige Luftfeuchtigkeit im Betrieb: 20 - 90% (nicht kondensierend)",
    "reference_file": "offer_reference_167.json",
    "shop_name": "TaufNaus"
}