{
    "html_file": "offer_1468_4.html",
    "name": "Samsung ViewFinity S6 S60A (2021), 31.5\"",
    "offer_link": "https://www.proshop.at/Bildschirm/Samsung-32-Bildschirm-LS32A600NWU-QHD-75Hz-USB-Hub-Black-5-ms-AMD-FreeSync/2922285?utm_source=geizhals&utm_medium=cpc&utm_campaign=pricesite",
    "price": 340.56,
    "raw_specifications": {
        "Abmessungen (Breite x Tiefe x H\u00f6he)": "71.62 cm x 21.14 cm x 58.05 cm - mit Fu\u00df",
        "Abmessungen (Breite x Tiefe x H\u00f6he) - mit Fu\u00df": "71.62 cm x 21.14 cm x 58.05 cm",
        "Adaptive-Sync Technologie": "AMD FreeSync",
        "Besonderheiten": "Bild f\u00fcr Bild, Spielmodus, Mega Dynamic Contrast Ratio, Eco Light Sensor, flimmerfreie Technologie, Image Size, Eco Saving Plus, Eye Saver Mode, Picture-in-Picture, Off Timer, Adaptive Picture, Auto Source Switch",
        "Bildschirmtyp": "VA",
        "Details zu Abmessungen & Gewicht": "Mit Fu\u00df - Breite: 71.62 cm - Tiefe: 21.14 cm - H\u00f6he: 58.05 cm - Gewicht: 6.9 kg  Ohne Fu\u00df - Breite: 71.62 cm - Tiefe: 4.13 cm - H\u00f6he: 42.47 cm - Gewicht: 4.8 kg",
        "Diagonalabmessung": "80 cm (32\")",
        "Display-Typ": "LED-hintergrundbeleuchteter LCD-Monitor / TFT-Aktivmatrix",
        "EAN": "8806090952647",
        "Eingangsanschl\u00fcsse": "HDMI, DisplayPort",
        "Eingangsspannung": "Wechselstrom 120/230 V",
        "Einstellungen der Anzeigeposition": "H\u00f6he, Pivot (Rotation), Drehung, Neigung",
        "Energie Effizienzklasse": "Klasse F",
        "Energieklasse (HDR)": "Klasse G",
        "Enthaltene Kabel": "1 x HDMI-Kabel  1 x SuperSpeed-USB-Kabel",
        "Farbe": "Schwarz",
        "Farbunterst\u00fctzung": "1,07 Mrd. Farben",
        "Ger\u00e4tetyp": "LED-hintergrundbeleuchteter LCD-Monitor - 80 cm (32\")",
        "Gewicht": "6.9 kg",
        "HDR-Format": "HDR10",
        "HDR-f\u00e4hig": "HDR10",
        "Helligkeit": "300 cd/m\u00b2",
        "Hersteller": "Samsung",
        "Hintergrundbeleuchtungs-Technologie": "LED-Hintergrundbeleuchtung",
        "Horizontaler Betrachtungswinkel": "178",
        "H\u00f6heneinstellung": "120 mm",
        "Integrierte Peripherieger\u00e4te": "USB 3.0-Hub",
        "Kennzeichnung": "TUV",
        "Kontrast": "3000:1",
        "Leistungsaufnahme im Ein-Zustand": "32 W",
        "Leistungsmerkmale": "Slot f\u00fcr Sicherheitsschloss (Kabelschloss getrennt erh\u00e4ltlich)",
        "Modell": "LS32A600NWUXEN",
        "Native Aufl\u00f6sung": "QHD 2560 x 1440 bei 75 Hz",
        "Neigungswinkel": "-2/+25",
        "Produktbeschreibung": "Samsung S32A600NWU - S60A Series - LED-Monitor - QHD - 80 cm (32\") - HDR",
        "Reaktionszeit": "5 ms",
        "Rotationswinkel": "-2/+92",
        "Schlosstyp zur Diebstahlsicherung": "Kensington Slot",
        "Schnittstellen": "DisplayPort 1.2  Kopfh\u00f6rer  HDMI  3 x USB 3.0  USB 2.0",
        "Schwenkwinkel": "60",
        "Seitenverh\u00e4ltnis": "16:9",
        "Spannung": "Wechselstrom 120/230 V",
        "Stromverbrauch (Aus-Modus)": "0.3 Watt",
        "Stromverbrauch (typisch)": "32 Watt",
        "Stromverbrauch HDR (eingeschaltet)": "50 kWh/1.000 h",
        "Stromverbrauch SDR (eingeschaltet)": "32 kWh/1.000 h",
        "Stromverbrauch im Standby-Modus": "0.5 Watt",
        "Transportbreite": "80 cm",
        "Transportgewicht": "9 kg",
        "Transporth\u00f6he": "51.1 cm",
        "Transporttiefe": "17.1 cm",
        "VESA-Halterung": "100 x 100 mm",
        "Vertikaler Betrachtungswinkel": "178",
        "Waren-Nr.": "2922285",
        "Zum Hersteller": "www.samsung.com"
    },
    "raw_specifications_text": "Hersteller: Samsung\nWaren-Nr.: 2922285\nModell: LS32A600NWUXEN\nEAN: 8806090952647\nZum Hersteller: www.samsung.com\nProduktbeschreibung: Samsung S32A600NWU - S60A Series - LED-Monitor - QHD - 80 cm (32\") - HDR\nGer\u00e4tetyp: LED-hintergrundbeleuchteter LCD-Monitor - 80 cm (32\")\nEnergie Effizienzklasse: Klasse F\nLeistungsaufnahme im Ein-Zustand: 32 W\nAdaptive-Sync Technologie: AMD FreeSync\nLeistungsmerkmale: Slot f\u00fcr Sicherheitsschloss (Kabelschloss getrennt erh\u00e4ltlich)\nBildschirmtyp: VA\nSeitenverh\u00e4ltnis: 16:9\nNative Aufl\u00f6sung: QHD 2560 x 1440 bei 75 Hz\nHelligkeit: 300 cd/m\u00b2\nKontrast: 3000:1\nHDR-f\u00e4hig: HDR10\nReaktionszeit: 5 ms\nFarbunterst\u00fctzung: 1,07 Mrd. Farben\nEingangsanschl\u00fcsse: HDMI, DisplayPort\nEinstellungen der Anzeigeposition: H\u00f6he, Pivot (Rotation), Drehung, Neigung\nSpannung: Wechselstrom 120/230 V\nFarbe: Schwarz\nAbmessungen (Breite x Tiefe x H\u00f6he) - mit Fu\u00df: 71.62 cm x 21.14 cm x 58.05 cm\nGewicht: 6.9 kg\nKennzeichnung: TUV\nDisplay-Typ: LED-hintergrundbeleuchteter LCD-Monitor / TFT-Aktivmatrix\nEnergieklasse (HDR): Klasse G\nDiagonalabmessung: 80 cm (32\")\nIntegrierte Peripherieger\u00e4te: USB 3.0-Hub\nHDR-Format: HDR10\nHorizontaler Betrachtungswinkel: 178\nVertikaler Betrachtungswinkel: 178\nHintergrundbeleuchtungs-Technologie: LED-Hintergrundbeleuchtung\nBesonderheiten: Bild f\u00fcr Bild, Spielmodus, Mega Dynamic Contrast Ratio, Eco Light Sensor, flimmerfreie Technologie, Image Size, Eco Saving Plus, Eye Saver Mode, Picture-in-Picture, Off Timer, Adaptive Picture, Auto Source Switch\nAbmessungen (Breite x Tiefe x H\u00f6he): 71.62 cm x 21.14 cm x 58.05 cm - mit Fu\u00df\nSchnittstellen: DisplayPort 1.2  Kopfh\u00f6rer  HDMI  3 x USB 3.0  USB 2.0\nNeigungswinkel: -2/+25\nSchwenkwinkel: 60\nRotationswinkel: -2/+92\nH\u00f6heneinstellung: 120 mm\nVESA-Halterung: 100 x 100 mm\nEnthaltene Kabel: 1 x HDMI-Kabel  1 x SuperSpeed-USB-Kabel\nSchlosstyp zur Diebstahlsicherung: Kensington Slot\nEingangsspannung: Wechselstrom 120/230 V\nStromverbrauch SDR (eingeschaltet): 32 kWh/1.000 h\nStromverbrauch HDR (eingeschaltet): 50 kWh/1.000 h\nStromverbrauch (typisch): 32 Watt\nStromverbrauch im Standby-Modus: 0.5 Watt\nStromverbrauch (Aus-Modus): 0.3 Watt\nDetails zu Abmessungen & Gewicht: Mit Fu\u00df - Breite: 71.62 cm - Tiefe: 21.14 cm - H\u00f6he: 58.05 cm - Gewicht: 6.9 kg  Ohne Fu\u00df - Breite: 71.62 cm - Tiefe: 4.13 cm - H\u00f6he: 42.47 cm - Gewicht: 4.8 kg\nTransportbreite: 80 cm\nTransporttiefe: 17.1 cm\nTransporth\u00f6he: 51.1 cm\nTransportgewicht: 9 kg",
    "reference_file": "offer_reference_1468.json",
    "shop_name": "Proshop.at"
}