{
    "html_file": "offer_496_22.html",
    "name": "HP E24u G5, 23.8\"",
    "offer_link": "https://www.proshop.at/Bildschirm/HP-24-Bildschirm-E24u-G5-Silver-5-ms/3150674?utm_source=geizhals&utm_medium=cpc&utm_campaign=pricesite",
    "price": 250.4,
    "raw_specifications": {
        "Abmessungen (Breite x Tiefe x H\u00f6he)": "53.94 cm x 21.1 cm x 50.7 cm - mit Fu\u00df",
        "Abmessungen (Breite x Tiefe x H\u00f6he) - mit Fu\u00df": "53.94 cm x 21.1 cm x 50.7 cm",
        "Besonderheiten": "On-screen Digital Controls, Low Blue Light Mode, flimmerfreie Technologie, 3 Side Borderless Design, 8-bit (6-bit + FRC) Farbtiefe, HP Eye Ease",
        "Bildschirmbeschichtung": "Haze 25 %, anti-glare 3H hardness",
        "Bildschirmtyp": "IPS",
        "Details zu Abmessungen & Gewicht": "Mit Fu\u00df - Breite: 53.94 cm - Tiefe: 21.1 cm - H\u00f6he: 50.7 cm - Gewicht: 6 kg  Ohne Fu\u00df - Breite: 53.94 cm - Tiefe: 7.5 cm - H\u00f6he: 32.26 cm",
        "Diagonalabmessung": "61 cm (24\")",
        "Display-Typ": "LED-hintergrundbeleuchteter LCD-Monitor / TFT-Aktivmatrix",
        "ENERGY STAR zertifiziert": "Ja",
        "Eingangsanschl\u00fcsse": "HDMI, DisplayPort, USB-C",
        "Eingangsspannung": "Wechselstrom 100-240 V (50/60 Hz)",
        "Einstellungen der Anzeigeposition": "H\u00f6he, Pivot (Rotation), Drehung, Neigung",
        "Energie Effizienzklasse": "Klasse E",
        "Enthaltene Kabel": "1 x Kabel USB-C auf USB-C - 1.8 m",
        "Farbe": "Schwarzer Kopf, Schwarz und Silber (St\u00e4nder)",
        "Farbraum": "99% sRGB",
        "Farbtemperatur": "6500K",
        "Farbunterst\u00fctzung": "16,7 Millionen Farben (8-Bit)",
        "Ger\u00e4tetyp": "LED-hintergrundbeleuchteter LCD-Monitor - 61 cm (24\")",
        "Gewicht": "6 kg",
        "Helligkeit": "250 cd/m\u00b2",
        "Hersteller": "HP",
        "Hintergrundbeleuchtungs-Technologie": "Edge-LED-Beleuchtung",
        "Horizontale Bildwiederholrate": "30 - 86 kHz",
        "Horizontaler Betrachtungswinkel": "178",
        "H\u00f6heneinstellung": "150 mm",
        "Kennzeichnung": "VCCI, BSMI, GS, NOM, TUV S, CB, CCC, PSB, FCC, ISO 9241-307, KCC, WEEE, PSE Mark, cTUVus, KC, CECP, CEL, EAC, ISC, SEPA, BIS, halogenarm, ICE, NRCS, Ukraine, UAE, Australien-Neuseeland MEPS, Vietnam MEPS, TGM, Energy Star, TCO Certified Edge, Korea MEPS",
        "Kontrast": "1000:1 / 8000000:1 (dynamisch)",
        "Lebensdauer der Beleuchtung": "30,000 Stunden",
        "Leistungsaufnahme im Ein-Zustand": "15.6 W",
        "Leistungsmerkmale": "Slot f\u00fcr Sicherheitsschloss (Kabelschloss getrennt erh\u00e4ltlich), abnehmbarer St\u00e4nder, Unterst\u00fctzung f\u00fcr VESA-Schnittstelle",
        "Lokalisierung": "Englisch / Europa",
        "Mitgelieferte Software": "HP Display Center, HP Display Manager",
        "Modell": "6N4D0A5#ABB",
        "Native Aufl\u00f6sung": "Full HD (1080p) 1920 x 1080 bei 75 Hz",
        "Neigungswinkel": "-5/+23",
        "OSD-Sprachen": "Chinesisch (tradionell), Chinesisch (vereinfacht), Englisch, Deutsch, Franz\u00f6sisch, Italienisch, Portugiesisch, Russisch, Spanisch, Holl\u00e4ndisch, Japanisch",
        "Pixelpitch": "0.27 mm",
        "Ppi": "93",
        "Produktbeschreibung": "HP E24u G5 PVC Free - E-Series - LED-Monitor - Full HD (1080p) - 61 cm (24\")",
        "Reaktionszeit": "5 ms (grau zu grau mit \u00dcbersteuerung)",
        "Rotationswinkel": "90",
        "Schlosstyp zur Diebstahlsicherung": "Kensington Slot",
        "Schnittstellen": "DisplayPort 1.2 (HDCP)  DisplayPort 1.2 Ausgang (HDCP)  HDMI 1.4 (HDCP)  USB-C 3.2 Gen 1 (HDCP, DisplayPort Alt Mode, Strom bis zu 65 W)  USB-C 3.2 Gen 1 (HDCP, Strom bis zu 15 W)  2 x USB 3.2 Gen 1  USB 3.2 Gen 1 (nur Strom)  LAN (RJ-45)",
        "Schwenkwinkel": "45",
        "Seitenverh\u00e4ltnis": "16:9",
        "Sichtbare Bildfl\u00e4che": "60.5 cm (23.8\")",
        "Spannung": "Wechselstrom 100-240 V (50/60 Hz)",
        "Stromverbrauch (max.)": "160 Watt",
        "Stromverbrauch (typisch)": "23.5 Watt",
        "Stromverbrauch SDR (eingeschaltet)": "15.6 kWh/1.000 h",
        "Stromverbrauch im Standby-Modus": "0.5 Watt",
        "TCO-zertifiziert": "TCO Certified Edge Displays, TCO Certified Displays 9",
        "Transportbreite": "62.1 cm",
        "Transportgewicht": "8 kg",
        "Transporth\u00f6he": "40 cm",
        "Transporttiefe": "14 cm",
        "Umweltschutzstandards": "TCO Certified Edge Displays, TCO Certified Displays 9, ENERGY STAR-qualifiziert",
        "VESA-Halterung": "100 x 100 mm",
        "Vertikale Bildwiederholrate": "50 - 75 Hz",
        "Vertikaler Betrachtungswinkel": "178",
        "Waren-Nr.": "3150674",
        "Zum Hersteller": "www.hp.com"
    },
    "raw_specifications_text": "Hersteller: HP\nWaren-Nr.: 3150674\nModell: 6N4D0A5#ABB\nZum Hersteller: www.hp.com\nProduktbeschreibung: HP E24u G5 PVC Free - E-Series - LED-Monitor - Full HD (1080p) - 61 cm (24\")\nGer\u00e4tetyp: LED-hintergrundbeleuchteter LCD-Monitor - 61 cm (24\")\nEnergie Effizienzklasse: Klasse E\nLeistungsaufnahme im Ein-Zustand: 15.6 W\nBildschirmtyp: IPS\nSeitenverh\u00e4ltnis: 16:9\nNative Aufl\u00f6sung: Full HD (1080p) 1920 x 1080 bei 75 Hz\nPixelpitch: 0.27 mm\nHelligkeit: 250 cd/m\u00b2\nKontrast: 1000:1 / 8000000:1 (dynamisch)\nReaktionszeit: 5 ms (grau zu grau mit \u00dcbersteuerung)\nFarbunterst\u00fctzung: 16,7 Millionen Farben (8-Bit)\nFarbraum: 99% sRGB\nEingangsanschl\u00fcsse: HDMI, DisplayPort, USB-C\nEinstellungen der Anzeigeposition: H\u00f6he, Pivot (Rotation), Drehung, Neigung\nBildschirmbeschichtung: Haze 25 %, anti-glare 3H hardness\nSpannung: Wechselstrom 100-240 V (50/60 Hz)\nFarbe: Schwarzer Kopf, Schwarz und Silber (St\u00e4nder)\nAbmessungen (Breite x Tiefe x H\u00f6he) - mit Fu\u00df: 53.94 cm x 21.1 cm x 50.7 cm\nGewicht: 6 kg\nLokalisierung: Englisch / Europa\nUmweltschutzstandards: TCO Certified Edge Displays, TCO Certified Displays 9, ENERGY STAR-qualifiziert\nKennzeichnung: VCCI, BSMI, GS, NOM, TUV S, CB, CCC, PSB, FCC, ISO 9241-307, KCC, WEEE, PSE Mark, cTUVus, KC, CECP, CEL, EAC, ISC, SEPA, BIS, halogenarm, ICE, NRCS, Ukraine, UAE, Australien-Neuseeland MEPS, Vietnam MEPS, TGM, Energy Star, TCO Certified Edge, Korea MEPS\nDisplay-Typ: LED-hintergrundbeleuchteter LCD-Monitor / TFT-Aktivmatrix\nDiagonalabmessung: 61 cm (24\")\nSichtbare Bildfl\u00e4che: 60.5 cm (23.8\")\nPpi: 93\nVertikale Bildwiederholrate: 50 - 75 Hz\nHorizontale Bildwiederholrate: 30 - 86 kHz\nHorizontaler Betrachtungswinkel: 178\nVertikaler Betrachtungswinkel: 178\nHintergrundbeleuchtungs-Technologie: Edge-LED-Beleuchtung\nFarbtemperatur: 6500K\nOSD-Sprachen: Chinesisch (tradionell), Chinesisch (vereinfacht), Englisch, Deutsch, Franz\u00f6sisch, Italienisch, Portugiesisch, Russisch, Spanisch, Holl\u00e4ndisch, Japanisch\nBesonderheiten: On-screen Digital Controls, Low Blue Light Mode, flimmerfreie Technologie, 3 Side Borderless Design, 8-bit (6-bit + FRC) Farbtiefe, HP Eye Ease\nAbmessungen (Breite x Tiefe x H\u00f6he): 53.94 cm x 21.1 cm x 50.7 cm - mit Fu\u00df\nSchnittstellen: DisplayPort 1.2 (HDCP)  DisplayPort 1.2 Ausgang (HDCP)  HDMI 1.4 (HDCP)  USB-C 3.2 Gen 1 (HDCP, DisplayPort Alt Mode, Strom bis zu 65 W)  USB-C 3.2 Gen 1 (HDCP, Strom bis zu 15 W)  2 x USB 3.2 Gen 1  USB 3.2 Gen 1 (nur Strom)  LAN (RJ-45)\nNeigungswinkel: -5/+23\nSchwenkwinkel: 45\nRotationswinkel: 90\nH\u00f6heneinstellung: 150 mm\nVESA-Halterung: 100 x 100 mm\nLeistungsmerkmale: Slot f\u00fcr Sicherheitsschloss (Kabelschloss getrennt erh\u00e4ltlich), abnehmbarer St\u00e4nder, Unterst\u00fctzung f\u00fcr VESA-Schnittstelle\nEnthaltene Kabel: 1 x Kabel USB-C auf USB-C - 1.8 m\nLebensdauer der Beleuchtung: 30,000 Stunden\nSchlosstyp zur Diebstahlsicherung: Kensington Slot\nEingangsspannung: Wechselstrom 100-240 V (50/60 Hz)\nStromverbrauch SDR (eingeschaltet): 15.6 kWh/1.000 h\nStromverbrauch (typisch): 23.5 Watt\nStromverbrauch (max.): 160 Watt\nStromverbrauch im Standby-Modus: 0.5 Watt\nMitgelieferte Software: HP Display Center, HP Display Manager\nDetails zu Abmessungen & Gewicht: Mit Fu\u00df - Breite: 53.94 cm - Tiefe: 21.1 cm - H\u00f6he: 50.7 cm - Gewicht: 6 kg  Ohne Fu\u00df - Breite: 53.94 cm - Tiefe: 7.5 cm - H\u00f6he: 32.26 cm\nTransportbreite: 62.1 cm\nTransporttiefe: 14 cm\nTransporth\u00f6he: 40 cm\nTransportgewicht: 8 kg\nTCO-zertifiziert: TCO Certified Edge Displays, TCO Certified Displays 9\nENERGY STAR zertifiziert: Ja",
    "reference_file": "offer_reference_496.json",
    "shop_name": "Proshop.at"
}