{
    "html_file": "offer_1933_0.html",
    "name": "Acer Nitro ED0 ED320QRPbiipx, 31.5\"",
    "offer_link": "https://direkt.jacob.de/produkte/acer-ed320qrpbiipx-80cm-um-je0ee-p01-artnr-6458639.html?utm_source=geizhals&utm_medium=cpc&utm_campaign=Preisvergleich&ref=103",
    "price": 215.71,
    "raw_specifications": {
        "Abmessungen (Breite x Tiefe x H\u00f6he)": "71.3 cm x 51.25 cm x 19.86 cm",
        "Adaptive-Sync Technologie": "AMD FreeSync",
        "Besonderheiten": "72 % NTSC-Farbskala, ComfyView, Flimmerfrei-Technologie, Abblend-Technologie, Blaulichtfilter-Technologie,  Acer VisionCare, 0.363 mm pixel pitch",
        "Bildschirmbeschichtung": "Blendfrei",
        "Bildschirmtyp": "VA",
        "Diagonalabmessung": "80 cm (31.5\")",
        "Display-Typ": "LED-hintergrundbeleuchteter LCD-Monitor / TFT-Aktivmatrix",
        "Eingangsanschl\u00fcsse": "2xHDMI, DisplayPort",
        "Einstellungen der Anzeigeposition": "Tilt",
        "Energie Effizienzklasse": "F",
        "Enthaltene Kabel": "1 x VGA-Kabel  1 x DisplayPort-Kabel",
        "Erforderliche Netzspannung": "Wechselstrom 120/230 V (50/60 Hz)",
        "Farbe": "Schwarz",
        "Farbunterst\u00fctzung": "16,7 Millionen Farben (8-Bit)",
        "Ger\u00e4tetyp": "LED-hintergrundbeleuchteter LCD-Monitor - 80 cm (31.5\")",
        "Geschwungener Bildschirm": "Ja (1800R)",
        "Helligkeit": "300 cd/m\u00b2",
        "Hintergrundbeleuchtungs-Technologie": "LED-Hintergrundbeleuchtung",
        "Horizontale Bildwiederholrate": "53.28 - 183.15 kHz",
        "Horizontaler Betrachtungswinkel": "178",
        "Integrierte Peripherieger\u00e4te": "USB 3.0-Hub",
        "Kennzeichnung": "MPR II, TUV GS, ISO 9241-307 Class 2",
        "Kontrast": "4000:1 / 100000000:1 (dynamisch)",
        "Leistungsmerkmale": "Unterst\u00fctzung f\u00fcr VESA-Schnittstelle",
        "Native Aufl\u00f6sung": "Full HD (1080p) 1920 x 1080 (DisplayPort: 165 Hz, HDMI: 144 Hz)",
        "Neigungswinkel": "-5/+20",
        "Ppi": "70",
        "Produktbeschreibung": "Acer ED320QR Pbiipx - LED-Monitor - gebogen - Full HD (1080p) - 80 cm (31.5\")",
        "Reaktionszeit": "5 ms (Gray-to-Gray)",
        "Schnittstellen": "2 x HDMI  DisplayPort  Audio Line-Out",
        "Seitenverh\u00e4ltnis": "16:9",
        "Transportgewicht": "6.7 kg",
        "Typ": "Lautsprecher - Stereo",
        "Vertikale Bildwiederholrate": "48 - 165 Hz",
        "Vertikaler Betrachtungswinkel": "178"
    },
    "raw_specifications_text": "Produktbeschreibung: Acer ED320QR Pbiipx - LED-Monitor - gebogen - Full HD (1080p) - 80 cm (31.5\")\nEnergie Effizienzklasse: F\nGer\u00e4tetyp: LED-hintergrundbeleuchteter LCD-Monitor - 80 cm (31.5\")\nGeschwungener Bildschirm: Ja (1800R)\nAdaptive-Sync Technologie: AMD FreeSync\nLeistungsmerkmale: Unterst\u00fctzung f\u00fcr VESA-Schnittstelle\nBildschirmtyp: VA\nSeitenverh\u00e4ltnis: 16:9\nNative Aufl\u00f6sung: Full HD (1080p) 1920 x 1080 (DisplayPort: 165 Hz, HDMI: 144 Hz)\nHelligkeit: 300 cd/m\u00b2\nKontrast: 4000:1 / 100000000:1 (dynamisch)\nReaktionszeit: 5 ms (Gray-to-Gray)\nFarbunterst\u00fctzung: 16,7 Millionen Farben (8-Bit)\nEingangsanschl\u00fcsse: 2xHDMI, DisplayPort\nEinstellungen der Anzeigeposition: Tilt\nBildschirmbeschichtung: Blendfrei\nFarbe: Schwarz\nAbmessungen (Breite x Tiefe x H\u00f6he): 71.3 cm x 51.25 cm x 19.86 cm\nKennzeichnung: MPR II, TUV GS, ISO 9241-307 Class 2\nDisplay-Typ: LED-hintergrundbeleuchteter LCD-Monitor / TFT-Aktivmatrix\nDiagonalabmessung: 80 cm (31.5\")\nIntegrierte Peripherieger\u00e4te: USB 3.0-Hub\nPpi: 70\nVertikale Bildwiederholrate: 48 - 165 Hz\nHorizontale Bildwiederholrate: 53.28 - 183.15 kHz\nHorizontaler Betrachtungswinkel: 178\nVertikaler Betrachtungswinkel: 178\nHintergrundbeleuchtungs-Technologie: LED-Hintergrundbeleuchtung\nBesonderheiten: 72 % NTSC-Farbskala, ComfyView, Flimmerfrei-Technologie, Abblend-Technologie, Blaulichtfilter-Technologie,  Acer VisionCare, 0.363 mm pixel pitch\nTyp: Lautsprecher - Stereo\nSchnittstellen: 2 x HDMI  DisplayPort  Audio Line-Out\nNeigungswinkel: -5/+20\nEnthaltene Kabel: 1 x VGA-Kabel  1 x DisplayPort-Kabel\nErforderliche Netzspannung: Wechselstrom 120/230 V (50/60 Hz)\nTransportgewicht: 6.7 kg",
    "reference_file": "offer_reference_1933.json",
    "shop_name": "Jacob Elektronik direkt (AT)"
}