{
    "html_file": "offer_1709_11.html",
    "name": "Philips P-line 329P1H, 31.5\"",
    "offer_link": "https://www.alternate.at/Philips/329P1H-00-LED-Monitor/html/product/1761276?partner=AtGeizhalsat&campaign=Monitor/Philips/1761276",
    "price": 629.0,
    "raw_specifications": {
        "": "Adaptive-Sync, Kensington-Schloss",
        "Abmessungen": "Breite: 71,4 cm x H\u00f6he: 64,9 cm x Tiefe/L\u00e4nge: 28 cm",
        "Anschl\u00fcsse": "2x HDMI-Eingang, (HDMI-Version: 2.0), 1x DisplayPort-Eingang, (DisplayPort-Version: 1.4), 1x 3,5-mm-Audio-Eingang, 4x USB-A-3.2 Gen 1 (5 Gbit/s), 1x USB-C, 1x RJ 45",
        "Bild": "Technnologie",
        "Bildschirmaufl\u00f6sung": "3.840 x 2.160 Pixel",
        "Bildschirmdiagonale": "80 cm (32 Zoll)",
        "EAN": "8712581768058",
        "Energieeffizienzklasse (SDR)": "G (A - G)",
        "Energieverbauch pro 1000 Stunden (SDR)": "40 kWh",
        "Ergonomie": "Typ",
        "Farbe": "schwarz",
        "Features": "Delta E<2, Flimmerfreie LEDs, LowBlue Modus, EasyRead Modus, PowerSensor, 2 MP Webcam, Windows Hello",
        "Frequenz": "Vertikal",
        "Gewicht": "12,2 kg",
        "Hersteller-Nr.": "329P1H/00",
        "Lautsprecher": "2 Lautsprecher",
        "Leistungsaufnahme im Bereitschafts- und Aus-Zustand": "0,3 Watt",
        "Leistungsaufnahme im Ein-Zustand bei Standard-Dynamikumfang (SDR)": "40 Watt",
        "Standards": "Video",
        "Stromversorgung": "Eco-Off",
        "Typ": "LED-Monitor",
        "Wandhalterung": "VESA kompatibel (100 x 100 mm)"
    },
    "raw_specifications_text": "Energieeffizienzklasse (SDR): G (A - G)\nEnergieverbauch pro 1000 Stunden (SDR): 40 kWh\nLeistungsaufnahme im Ein-Zustand bei Standard-Dynamikumfang (SDR): 40 Watt\nLeistungsaufnahme im Bereitschafts- und Aus-Zustand: 0,3 Watt\nBildschirmdiagonale: 80 cm (32 Zoll)\nBildschirmaufl\u00f6sung: 3.840 x 2.160 Pixel\nTyp: LED-Monitor\nFarbe: schwarz\nEAN: 8712581768058\nHersteller-Nr.: 329P1H/00\nBild: Technnologie\n: Adaptive-Sync, Kensington-Schloss\nFrequenz: Vertikal\nAnschl\u00fcsse: 2x HDMI-Eingang, (HDMI-Version: 2.0), 1x DisplayPort-Eingang, (DisplayPort-Version: 1.4), 1x 3,5-mm-Audio-Eingang, 4x USB-A-3.2 Gen 1 (5 Gbit/s), 1x USB-C, 1x RJ 45\nErgonomie: Typ\nStromversorgung: Eco-Off\nLautsprecher: 2 Lautsprecher\nStandards: Video\nWandhalterung: VESA kompatibel (100 x 100 mm)\nFeatures: Delta E<2, Flimmerfreie LEDs, LowBlue Modus, EasyRead Modus, PowerSensor, 2 MP Webcam, Windows Hello\nAbmessungen: Breite: 71,4 cm x H\u00f6he: 64,9 cm x Tiefe/L\u00e4nge: 28 cm\nGewicht: 12,2 kg",
    "reference_file": "offer_reference_1709.json",
    "shop_name": "Alternate.at"
}