{
    "html_file": "offer_1722_1.html",
    "name": "Dell E2421HN, 23.8\"",
    "offer_link": "https://direkt.jacob.de/produkte/dell-e2421hn-dell-e2421hn-artnr-6797237.html?utm_source=geizhals&utm_medium=cpc&utm_campaign=Preisvergleich&ref=103",
    "price": 190.18,
    "raw_specifications": {
        "Abmessungen (Breite x Tiefe x H\u00f6he)": "55.06 cm x 17.1 cm x 41.97 cm - mit Fu\u00df",
        "Abmessungen (Breite x Tiefe x H\u00f6he) - mit Fu\u00df": "55.06 cm x 17.1 cm x 41.97 cm",
        "Besonderheiten": "Schmale Blende",
        "Bildschirmtyp": "IPS",
        "Blendentyp": "Erhoben",
        "Details zu Abmessungen & Gewicht": "Mit Fu\u00df - Breite: 55.06 cm - Tiefe: 17.1 cm - H\u00f6he: 41.97 cm  Ohne Fu\u00df - Breite: 55.06 cm - Tiefe: 5.24 cm - H\u00f6he: 32.65 cm - Gewicht: 3.25 kg",
        "Diagonalabmessung": "60.47 cm (23.8\")",
        "Display-Typ": "LED-hintergrundbeleuchteter LCD-Monitor / TFT-Aktivmatrix",
        "Eingangsanschl\u00fcsse": "HDMI, VGA",
        "Einstellungen der Anzeigeposition": "Neigung",
        "Enthaltene Kabel": "1 x HDMI-Kabel - 1.8 m",
        "Erforderliche Netzspannung": "Wechselstrom 120/230 V (50/60 Hz)",
        "Farbunterst\u00fctzung": "16,7 Millionen Farben",
        "Ger\u00e4tetyp": "LED-hintergrundbeleuchteter LCD-Monitor - 60.47 cm (23.8\")",
        "Helligkeit": "250 cd/m\u00b2",
        "Hintergrundbeleuchtungs-Technologie": "LED-Hintergrundbeleuchtung",
        "Horizontale Bildwiederholrate": "30 - 83 kHz",
        "Horizontaler Betrachtungswinkel": "178",
        "Kontrast": "1000:1",
        "Leistungsaufnahme im Betrieb": "15 Watt",
        "Max. Betriebstemperatur": "40 \u00b0C",
        "Min Betriebstemperatur": "0 \u00b0C",
        "Native Aufl\u00f6sung": "Full HD (1080p) 1920 x 1080 bei 60 Hz",
        "Neigungswinkel": "-5/+21",
        "Pixelpitch": "0.275 mm",
        "Ppi": "92",
        "Produktbeschreibung": "Dell E2421HN - LED-Monitor - Full HD (1080p) - 60.47 cm (23.8\")",
        "Reaktionszeit": "8 ms (grau-zu-grau normal); 5 ms (grau-zu-grau schnell)",
        "Schnittstellen": "VGA  HDMI",
        "Seitenverh\u00e4ltnis": "16:9",
        "Services im Bundle": "3 Jahre erweiterte Basisaustauschgew\u00e4hrleistung",
        "Sichtbare Bildfl\u00e4che": "60.47 cm (23.8\")",
        "TCO-zertifiziert": "TCO Certified Displays 8",
        "Transportgewicht": "5.95 kg",
        "Umweltschutzstandards": "TCO Certified Displays 8",
        "Vertikale Bildwiederholrate": "56 - 76 Hz",
        "Vertikaler Betrachtungswinkel": "178"
    },
    "raw_specifications_text": "Produktbeschreibung: Dell E2421HN - LED-Monitor - Full HD (1080p) - 60.47 cm (23.8\")\nGer\u00e4tetyp: LED-hintergrundbeleuchteter LCD-Monitor - 60.47 cm (23.8\")\nBildschirmtyp: IPS\nSeitenverh\u00e4ltnis: 16:9\nNative Aufl\u00f6sung: Full HD (1080p) 1920 x 1080 bei 60 Hz\nPixelpitch: 0.275 mm\nHelligkeit: 250 cd/m\u00b2\nKontrast: 1000:1\nReaktionszeit: 8 ms (grau-zu-grau normal); 5 ms (grau-zu-grau schnell)\nFarbunterst\u00fctzung: 16,7 Millionen Farben\nEingangsanschl\u00fcsse: HDMI, VGA\nEinstellungen der Anzeigeposition: Neigung\nAbmessungen (Breite x Tiefe x H\u00f6he) - mit Fu\u00df: 55.06 cm x 17.1 cm x 41.97 cm\nUmweltschutzstandards: TCO Certified Displays 8\nServices im Bundle: 3 Jahre erweiterte Basisaustauschgew\u00e4hrleistung\nDisplay-Typ: LED-hintergrundbeleuchteter LCD-Monitor / TFT-Aktivmatrix\nDiagonalabmessung: 60.47 cm (23.8\")\nSichtbare Bildfl\u00e4che: 60.47 cm (23.8\")\nPpi: 92\nVertikale Bildwiederholrate: 56 - 76 Hz\nHorizontale Bildwiederholrate: 30 - 83 kHz\nHorizontaler Betrachtungswinkel: 178\nVertikaler Betrachtungswinkel: 178\nHintergrundbeleuchtungs-Technologie: LED-Hintergrundbeleuchtung\nBlendentyp: Erhoben\nBesonderheiten: Schmale Blende\nAbmessungen (Breite x Tiefe x H\u00f6he): 55.06 cm x 17.1 cm x 41.97 cm - mit Fu\u00df\nSchnittstellen: VGA  HDMI\nNeigungswinkel: -5/+21\nEnthaltene Kabel: 1 x HDMI-Kabel - 1.8 m\nErforderliche Netzspannung: Wechselstrom 120/230 V (50/60 Hz)\nLeistungsaufnahme im Betrieb: 15 Watt\nDetails zu Abmessungen & Gewicht: Mit Fu\u00df - Breite: 55.06 cm - Tiefe: 17.1 cm - H\u00f6he: 41.97 cm  Ohne Fu\u00df - Breite: 55.06 cm - Tiefe: 5.24 cm - H\u00f6he: 32.65 cm - Gewicht: 3.25 kg\nTransportgewicht: 5.95 kg\nTCO-zertifiziert: TCO Certified Displays 8\nMin Betriebstemperatur: 0 \u00b0C\nMax. Betriebstemperatur: 40 \u00b0C",
    "reference_file": "offer_reference_1722.json",
    "shop_name": "Jacob Elektronik direkt (AT)"
}