{
    "html_file": "offer_1704_8.html",
    "name": "Philips E-line 241E1SC, 23.6\"",
    "offer_link": "https://www.alternate.at/Philips/241E1SC-00-LED-Monitor/html/product/1761256?partner=AtGeizhalsat&campaign=Monitor/Philips/1761256",
    "price": 121.9,
    "raw_specifications": {
        "": "AMD FreeSync",
        "Abmessungen": "Breite: 53,6 cm x H\u00f6he: 41,3 cm x Tiefe/L\u00e4nge: 20,2 cm",
        "Anschl\u00fcsse": "1x HDMI-Eingang, 1x VGA-Eingang",
        "Bild": "Format",
        "Bildschirmaufl\u00f6sung": "1.920 x 1.080 Pixel",
        "Bildschirmdiagonale": "60 cm (24 Zoll)",
        "EAN": "8712581758417",
        "Energieeffizienzklasse (SDR)": "F (A - G)",
        "Energieverbauch pro 1000 Stunden (SDR)": "20 kWh",
        "Ergonomie": "Neigbar",
        "Farbe": "schwarz",
        "Features": "Mega Infinity DCR, LowBlue Modus",
        "Frequenz": "Vertikal",
        "Gewicht": "3,1 kg",
        "Hersteller-Nr.": "241E1SC/00",
        "Leistungsaufnahme im Bereitschafts- und Aus-Zustand": "0,5 Watt",
        "Leistungsaufnahme im Ein-Zustand bei Standard-Dynamikumfang (SDR)": "20 Watt",
        "Stromversorgung": "Eco-Off",
        "Typ": "LED-Monitor",
        "Wandhalterung": "VESA kompatibel (100 x 100 mm)",
        "Zubeh\u00f6r": "Vorhanden"
    },
    "raw_specifications_text": "Energieeffizienzklasse (SDR): F (A - G)\nEnergieverbauch pro 1000 Stunden (SDR): 20 kWh\nLeistungsaufnahme im Ein-Zustand bei Standard-Dynamikumfang (SDR): 20 Watt\nLeistungsaufnahme im Bereitschafts- und Aus-Zustand: 0,5 Watt\nBildschirmdiagonale: 60 cm (24 Zoll)\nBildschirmaufl\u00f6sung: 1.920 x 1.080 Pixel\nTyp: LED-Monitor\nFarbe: schwarz\nEAN: 8712581758417\nHersteller-Nr.: 241E1SC/00\nBild: Format\n: AMD FreeSync\nFrequenz: Vertikal\nAnschl\u00fcsse: 1x HDMI-Eingang, 1x VGA-Eingang\nErgonomie: Neigbar\nStromversorgung: Eco-Off\nWandhalterung: VESA kompatibel (100 x 100 mm)\nFeatures: Mega Infinity DCR, LowBlue Modus\nZubeh\u00f6r: Vorhanden\nAbmessungen: Breite: 53,6 cm x H\u00f6he: 41,3 cm x Tiefe/L\u00e4nge: 20,2 cm\nGewicht: 3,1 kg",
    "reference_file": "offer_reference_1704.json",
    "shop_name": "Alternate.at"
}