{
    "html_file": "offer_390_10.html",
    "name": "HP V24ie G5, 23.8\"",
    "offer_link": "https://www.mylemon.at/artikel/hewlett_packard/6d8h0e9_abb/hp-v24ie-g5-fhd-60.html",
    "price": 223.96,
    "raw_specifications": {
        "AC Eingangsfrequenz": "50 - 60 Hz",
        "AC Eingangsspannung": "100 - 240 V",
        "AMD FreeSync": "Ja",
        "Anzahl DisplayPort Anschl\u00fcsse": "1",
        "Anzahl HDMI-Anschl\u00fcsse": "1",
        "Anzahl VGA (D-Sub) Anschl\u00fcsse": "1",
        "Anzahl der Farben des Displays": "16,7 Millionen Farben",
        "Artikelnummer": "M1IYQF2L",
        "Aufl\u00f6sung": "1920x1080",
        "Besonderheiten": "75 Hz, AMD FreeSync",
        "Betriebstemperatur": "5 - 35 \u00b0C",
        "Bildschirmdiagonale": "60,5 cm (23.8\")",
        "Bildschirmdiagonale (cm)": "60,5 cm",
        "Bildschirmform": "Flach",
        "Bildwinkel, horizontal": "178\u00b0",
        "Bildwinkel, vertikal": "178\u00b0",
        "Blendfreier Bildschirm": "Ja",
        "Breite": "538,9 mm",
        "Breite (ohne Standfu\u00df)": "538,9 mm",
        "Digital horizontale Frequenz": "30 - 86 kHz",
        "Digital vertikale Frequenz": "48 - 75 Hz",
        "Display-Aufl\u00f6sung": "1920 x 1080 Pixel",
        "Displaygr\u00f6\u00dfe": "23,8 Zoll",
        "EAN": "196548760404",
        "Eingebaute Lautsprecher": "Nein",
        "Energieeffizienzklasse (SDR)": "E",
        "Energieeffizienzskala": "A bis G",
        "Energieverbrauch (SDR) pro 1.000 Stunden": "15 kWh",
        "Farbskala": "72%",
        "Ger\u00e4tebreite (inkl. Fu\u00df)": "53,9 mm",
        "Ger\u00e4teh\u00f6he (inkl. Fu\u00df)": "18,1 mm",
        "Ger\u00e4tetiefe (inkl. Fu\u00df)": "39,8 mm",
        "Gewicht": "3,6 kg",
        "Gewicht (mit St\u00e4nder)": "3,6 kg",
        "HD-Typ": "Full HD",
        "HDCP": "Ja",
        "HDMI": "Ja",
        "HDMI-Version": "1.4",
        "Helligkeit (typisch)": "250 cd/m\u00b2",
        "Hersteller Artikelnummer": "6D8H0E9#ABB",
        "H\u00f6he": "323,6 mm",
        "H\u00f6he (ohne Standfu\u00df)": "32,4 mm",
        "H\u00f6henverstellung": "Nein",
        "Integrierte Kamera": "Nein",
        "Integrierter USB-Hub": "Nein",
        "Kontrastverh\u00e4ltnis": "1000:1",
        "Kontrastverh\u00e4ltnis (dynamisch)": "9000000:1",
        "Kopfh\u00f6rerausgang": "Nein",
        "Low-Blue-Light-Technologie": "Ja",
        "Marktpositionierung": "Haus",
        "Maximale Bildwiederholrate": "60 Hz",
        "Mitgelieferte Kabel": "HDMI",
        "NVIDIA G-SYNC": "Nein",
        "Nachhaltige Technologien und Materialien": "Das geformte Papierzellstoffpolster im Inneren der Verpackung stammt zu 100 % aus nachhaltigen Quellen und ist recycelbar; 85 % Kunststoff aus geschlossenem ITE-Kreislauf Halogenarm",
        "Nachhaltigkeitszertifikate": "ENERGY STAR",
        "Natives Seitenverh\u00e4ltnis": "16:9",
        "Neigungsverstellung": "Ja",
        "Neigungswinkelbereich": "-5 - 23\u00b0",
        "Paketgewicht": "5,5 kg",
        "Panel-Montage-Schnittstelle": "100 x 100 mm",
        "Panel-Typ": "IPS",
        "Pixel Abstand": "0,27 x 0,27 mm",
        "Produktfarbe": "Schwarz",
        "RGB-Farbraum": "NTSC",
        "Reaktionszeit": "5 ms",
        "Relative Luftfeuchtigkeit in Betrieb": "5 - 95%",
        "Seitenverh\u00e4ltnis": "16:9",
        "Stromverbrauch (Standardbetrieb)": "20 W",
        "Stromverbrauch (Standby)": "0,5 W",
        "Stromverbrauch (max.)": "30 W",
        "Tiefe": "51,5 mm",
        "Tiefe (ohne Standfu\u00df)": "5,15 mm",
        "Touchscreen": "Nein",
        "Unterst\u00fctzte Grafik-Aufl\u00f6sungen": "1680 x 1050 (WSXGA+), 1920 x 1080 (HD 1080), 1280 x 720 (HD 720), 720 x 400, 1280 x 800 (WXGA), 1280 x 1024 (SXGA), 800 x 600 (SVGA), 1440 x 900 (WXGA+), 640 x 480 (VGA), 1024 x 768 (XGA), 1600 x 900",
        "VESA-Halterung": "Ja",
        "Verpackungsbreite": "538,9 mm",
        "Verpackungsh\u00f6he": "397,9 mm",
        "Verpackungstiefe": "180,5 mm",
        "Video Anschl\u00fcsse": "1x VGA, 1x HDMI",
        "Zertifizierung": "Argentina S-Mark; Australia MEPS; CB; CE; CECP; CEL; CEL Grade 1; China CCC; cTUVus; ENERGY STAR\u00ae; ErP; EUP Lot-6; FCC; ICES; ISO 9241-307; KC (Korean) requirements; KCC (Korean) requirements; Korea e-standby; Microsoft WHQL Certification; NOM (Mexico); PSB for Singapore; RCM; RoHS; SEPA; Taiwan BSMI; TCO Certified; TCO Certified Edge; TUV Bauart; VCCI; Vietnam MEPS; Low blue light; EUP Lot-26; EU RoHS; Ukraine Energy label; California Energy Commission (CEC); South Africa Energy; Mexico Energy; UAE; Ukraine certificates; NRCS of South Africa; T\u00dcV Flicker free certified; India BIS; Cambodia ISC"
    },
    "raw_specifications_text": "Displaygr\u00f6\u00dfe: 23,8 Zoll\nAufl\u00f6sung: 1920x1080\nVideo Anschl\u00fcsse: 1x VGA, 1x HDMI\nBesonderheiten: 75 Hz, AMD FreeSync\nHersteller Artikelnummer: 6D8H0E9#ABB\nEAN: 196548760404\nArtikelnummer: M1IYQF2L\nBildschirmdiagonale: 60,5 cm (23.8\")\nDisplay-Aufl\u00f6sung: 1920 x 1080 Pixel\nNatives Seitenverh\u00e4ltnis: 16:9\nTouchscreen: Nein\nHD-Typ: Full HD\nPanel-Typ: IPS\nBildschirmform: Flach\nKontrastverh\u00e4ltnis: 1000:1\nMaximale Bildwiederholrate: 60 Hz\nAnzahl der Farben des Displays: 16,7 Millionen Farben\nHelligkeit (typisch): 250 cd/m\u00b2\nReaktionszeit: 5 ms\nBlendfreier Bildschirm: Ja\nUnterst\u00fctzte Grafik-Aufl\u00f6sungen: 1680 x 1050 (WSXGA+), 1920 x 1080 (HD 1080), 1280 x 720 (HD 720), 720 x 400, 1280 x 800 (WXGA), 1280 x 1024 (SXGA), 800 x 600 (SVGA), 1440 x 900 (WXGA+), 640 x 480 (VGA), 1024 x 768 (XGA), 1600 x 900\nSeitenverh\u00e4ltnis: 16:9\nKontrastverh\u00e4ltnis (dynamisch): 9000000:1\nBildwinkel, horizontal: 178\u00b0\nBildwinkel, vertikal: 178\u00b0\nPixel Abstand: 0,27 x 0,27 mm\nDigital horizontale Frequenz: 30 - 86 kHz\nDigital vertikale Frequenz: 48 - 75 Hz\nBildschirmdiagonale (cm): 60,5 cm\nRGB-Farbraum: NTSC\nFarbskala: 72%\nNVIDIA G-SYNC: Nein\nAMD FreeSync: Ja\nLow-Blue-Light-Technologie: Ja\nEingebaute Lautsprecher: Nein\nIntegrierte Kamera: Nein\nMarktpositionierung: Haus\nProduktfarbe: Schwarz\nZertifizierung: Argentina S-Mark; Australia MEPS; CB; CE; CECP; CEL; CEL Grade 1; China CCC; cTUVus; ENERGY STAR\u00ae; ErP; EUP Lot-6; FCC; ICES; ISO 9241-307; KC (Korean) requirements; KCC (Korean) requirements; Korea e-standby; Microsoft WHQL Certification; NOM (Mexico); PSB for Singapore; RCM; RoHS; SEPA; Taiwan BSMI; TCO Certified; TCO Certified Edge; TUV Bauart; VCCI; Vietnam MEPS; Low blue light; EUP Lot-26; EU RoHS; Ukraine Energy label; California Energy Commission (CEC); South Africa Energy; Mexico Energy; UAE; Ukraine certificates; NRCS of South Africa; T\u00dcV Flicker free certified; India BIS; Cambodia ISC\nIntegrierter USB-Hub: Nein\nHDMI: Ja\nKopfh\u00f6rerausgang: Nein\nAnzahl VGA (D-Sub) Anschl\u00fcsse: 1\nAnzahl HDMI-Anschl\u00fcsse: 1\nHDMI-Version: 1.4\nAnzahl DisplayPort Anschl\u00fcsse: 1\nHDCP: Ja\nVESA-Halterung: Ja\nH\u00f6henverstellung: Nein\nPanel-Montage-Schnittstelle: 100 x 100 mm\nNeigungswinkelbereich: -5 - 23\u00b0\nNeigungsverstellung: Ja\nEnergieeffizienzklasse (SDR): E\nEnergieverbrauch (SDR) pro 1.000 Stunden: 15 kWh\nStromverbrauch (Standardbetrieb): 20 W\nStromverbrauch (Standby): 0,5 W\nStromverbrauch (max.): 30 W\nAC Eingangsspannung: 100 - 240 V\nAC Eingangsfrequenz: 50 - 60 Hz\nEnergieeffizienzskala: A bis G\nBetriebstemperatur: 5 - 35 \u00b0C\nRelative Luftfeuchtigkeit in Betrieb: 5 - 95%\nMitgelieferte Kabel: HDMI\nGer\u00e4tebreite (inkl. Fu\u00df): 53,9 mm\nGer\u00e4tetiefe (inkl. Fu\u00df): 39,8 mm\nGer\u00e4teh\u00f6he (inkl. Fu\u00df): 18,1 mm\nGewicht (mit St\u00e4nder): 3,6 kg\nBreite (ohne Standfu\u00df): 538,9 mm\nTiefe (ohne Standfu\u00df): 5,15 mm\nH\u00f6he (ohne Standfu\u00df): 32,4 mm\nVerpackungsbreite: 538,9 mm\nVerpackungstiefe: 180,5 mm\nVerpackungsh\u00f6he: 397,9 mm\nPaketgewicht: 5,5 kg\nNachhaltigkeitszertifikate: ENERGY STAR\nNachhaltige Technologien und Materialien: Das geformte Papierzellstoffpolster im Inneren der Verpackung stammt zu 100 % aus nachhaltigen Quellen und ist recycelbar; 85 % Kunststoff aus geschlossenem ITE-Kreislauf Halogenarm\nGewicht: 3,6 kg\nH\u00f6he: 323,6 mm\nBreite: 538,9 mm\nTiefe: 51,5 mm",
    "reference_file": "offer_reference_390.json",
    "shop_name": "mylemon.at"
}