{
    "html_file": "offer_1886_23.html",
    "name": "LG UltraWide 34BN770-B, 34\"",
    "offer_link": "https://www.csv-direct.de/artinfo.php?artnr=A1621316&KATEGORIE=162&pva=geizhals2",
    "price": 520.73,
    "raw_specifications": {
        "AC Eingangsfrequenz": "50 - 60 Hz",
        "AC Eingangsspannung": "100 - 240 V",
        "Anzahl DisplayPort Anschl\u00fcsse": "1",
        "Anzahl HDMI-Anschl\u00fcsse": "2",
        "Anzahl der Farben des Displays": "16,78 Millionen Farben",
        "Anzahl der Lautsprecher": "2",
        "Anzahl der nachgeschalteten Steckpl\u00e4tze vom Typ USB-A": "2",
        "Anzahl der vorgeschalteten Steckpl\u00e4tze": "1",
        "Bildschirmdiagonale": "86,4 cm 34\"",
        "Bildschirmform": "Flach",
        "Bildschirmtechnologie": "LCD",
        "Bildwinkel, horizontal": "178\u00b0",
        "Bildwinkel, vertikal": "178\u00b0",
        "Breite ohne Standfu\u00df": "816,6 mm",
        "Display-Aufl\u00f6sung": "3440 x 1440 Pixel",
        "DisplayPorts-Version": "1.4",
        "Energieeffizienzklasse HDR": "G",
        "Energieeffizienzklasse SDR": "G",
        "Energieeffizienzskala": "A bis G",
        "Energieverbrauch HDR pro 1.000 Stunden": "48 kWh",
        "Energieverbrauch SDR pro 1.000 Stunden": "37 kWh",
        "Ger\u00e4tebreite inkl. Fu\u00df": "816,5 mm",
        "Ger\u00e4teh\u00f6he inkl. Fu\u00df": "616,9 mm",
        "Ger\u00e4tetiefe inkl. Fu\u00df": "252,9 mm",
        "Gewicht mit St\u00e4nder": "10,3 kg",
        "Gewicht ohne St\u00e4nder": "6,9 kg",
        "HD-Typ": "UltraWide Quad HD",
        "Helligkeit typisch": "300 cd/m\u00b2",
        "H\u00f6he ohne Standfu\u00df": "365,3 mm",
        "H\u00f6heneinstellung": "15 cm",
        "Kontrastverh\u00e4ltnis": "1000:1",
        "Marktpositionierung": "Business",
        "Maximale Bildwiederholrate": "75 Hz",
        "Natives Seitenverh\u00e4ltnis": "21:9",
        "Neigungswinkelbereich": "-5 - 35\u00b0",
        "Paketgewicht": "13,7 kg",
        "Panel-Typ": "IPS",
        "Pivot Winkel": "-45 - 45\u00b0",
        "Pixel Abstand": "0,2325 x 0,2325 mm",
        "Produktfarbe": "Schwarz",
        "RMS-Leistung": "7 W",
        "Reaktionszeit": "5 ms",
        "Stromverbrauch Standardbetrieb": "39 W",
        "Stromverbrauch Standby": "0,5 W",
        "Stromverbrauch aus": "0,3 W",
        "Tiefe ohne Standfu\u00df": "45,5 mm",
        "Touchscreen": "Nein",
        "Typ der Hintergrundbeleuchtung": "W-LED",
        "Unterst\u00fctzte Grafik-Aufl\u00f6sungen": "3440 x 1440",
        "Verpackungsart": "Box",
        "Verpackungsbreite": "940 mm",
        "Verpackungsh\u00f6he": "516 mm",
        "Verpackungstiefe": "219 mm"
    },
    "raw_specifications_text": "Bildschirmdiagonale: 86,4 cm 34\"\nDisplay-Aufl\u00f6sung: 3440 x 1440 Pixel\nNatives Seitenverh\u00e4ltnis: 21:9\nBildschirmtechnologie: LCD\nTouchscreen: Nein\nHD-Typ: UltraWide Quad HD\nPanel-Typ: IPS\nBildschirmform: Flach\nKontrastverh\u00e4ltnis: 1000:1\nMaximale Bildwiederholrate: 75 Hz\nAnzahl der Farben des Displays: 16,78 Millionen Farben\nTyp der Hintergrundbeleuchtung: W-LED\nHelligkeit typisch: 300 cd/m\u00b2\nReaktionszeit: 5 ms\nUnterst\u00fctzte Grafik-Aufl\u00f6sungen: 3440 x 1440\nBildwinkel, horizontal: 178\u00b0\nBildwinkel, vertikal: 178\u00b0\nPixel Abstand: 0,2325 x 0,2325 mm\nAnzahl der Lautsprecher: 2\nRMS-Leistung: 7 W\nMarktpositionierung: Business\nProduktfarbe: Schwarz\nAnzahl der vorgeschalteten Steckpl\u00e4tze: 1\nAnzahl der nachgeschalteten Steckpl\u00e4tze vom Typ USB-A: 2\nAnzahl HDMI-Anschl\u00fcsse: 2\nAnzahl DisplayPort Anschl\u00fcsse: 1\nDisplayPorts-Version: 1.4\nH\u00f6heneinstellung: 15 cm\nPivot Winkel: -45 - 45\u00b0\nNeigungswinkelbereich: -5 - 35\u00b0\nEnergieeffizienzklasse SDR: G\nEnergieeffizienzklasse HDR: G\nEnergieverbrauch SDR pro 1.000 Stunden: 37 kWh\nEnergieverbrauch HDR pro 1.000 Stunden: 48 kWh\nStromverbrauch Standardbetrieb: 39 W\nStromverbrauch Standby: 0,5 W\nStromverbrauch aus: 0,3 W\nAC Eingangsspannung: 100 - 240 V\nAC Eingangsfrequenz: 50 - 60 Hz\nEnergieeffizienzskala: A bis G\nGer\u00e4tebreite inkl. Fu\u00df: 816,5 mm\nGer\u00e4tetiefe inkl. Fu\u00df: 252,9 mm\nGer\u00e4teh\u00f6he inkl. Fu\u00df: 616,9 mm\nGewicht mit St\u00e4nder: 10,3 kg\nBreite ohne Standfu\u00df: 816,6 mm\nTiefe ohne Standfu\u00df: 45,5 mm\nH\u00f6he ohne Standfu\u00df: 365,3 mm\nGewicht ohne St\u00e4nder: 6,9 kg\nVerpackungsbreite: 940 mm\nVerpackungstiefe: 219 mm\nVerpackungsh\u00f6he: 516 mm\nPaketgewicht: 13,7 kg\nVerpackungsart: Box",
    "reference_file": "offer_reference_1886.json",
    "shop_name": "CSV-Direct.de"
}