{
    "html_file": "offer_2274_6.html",
    "name": "Dell P2419H, 23.8\"",
    "offer_link": "https://www.1ashop.at/de/produkt/10174/dell-p2419h-computerbildschirm-60-5-cm-23-8-zoll-full-hd-led-flach-matt-schwarz.html",
    "price": 378.65,
    "raw_specifications": {
        "Abmessungen (Breite x Tiefe x H\u00f6he)": "53.78 cm x 16.6 cm x 35.61 cm - mit Fu\u00df",
        "Besonderheiten": "LED-Randlichtsystem, Dell Custom Color, flimmerfreie Technologie, BFR/PVC-frei, ohne Quecksilber, Dell ComfortView, arsenfrei",
        "Bildschirmbeschichtung": "Blendfrei, 3H Hard Coating",
        "Bildschirmtyp": "IPS",
        "Details zu Abmessungen & Gewicht": "Ohne Fu\u00df - Breite: 53.78 cm - Tiefe: 4.28 cm - H\u00f6he: 32.22 cm - Gewicht: 3.26 kg  Mit Fu\u00df - Breite: 53.78 cm - Tiefe: 16.6 cm - H\u00f6he: 35.61 cm - Gewicht: 4.93 kg",
        "Diagonalabmessung": "61 cm (24\")",
        "Display-Typ": "LED-hintergrundbeleuchteter LCD-Monitor / TFT-Aktivmatrix",
        "EAN/UPC": "5397184092392",
        "ENERGY STAR zertifiziert": "Ja",
        "Eingangsspannung": "Wechselstrom 120/230 V (50/60 Hz)",
        "Einstellungen der Anzeigeposition": "H\u00f6he, Pivot (Rotation), Drehung, Neigung",
        "Energie Effizienzklasse": "Klasse D",
        "Energieverbrauch pro Jahr": "29 kWh",
        "Enthaltene Kabel": "1 x DisplayPort-Kabel - DisplayPort zu DisplayPort  1 x SuperSpeed-USB-Kabel",
        "Farbraum": "72% (CIE 1931)",
        "Farbunterst\u00fctzung": "16,7 Millionen Farben",
        "Gewicht": "4.93 kg",
        "Gruppe": "TFTs",
        "Helligkeit": "250 cd/m\u00b2",
        "Hersteller": "Dell",
        "Hersteller Art. Nr.": "DELL-P2419H",
        "Hintergrundbeleuchtungs-Technologie": "LED-Hintergrundbeleuchtung",
        "Horizontale Bildwiederholrate": "30 - 83 kHz",
        "Horizontaler Betrachtungswinkel": "178",
        "H\u00f6heneinstellung": "130 mm",
        "Integrierte Peripherieger\u00e4te": "USB 3.0-Hub",
        "Kennzeichnung": "Plug and Play, DDC/CI, RoHS, EDID-kompatibel, DisplayPort 1.2",
        "Kontrast": "1000:1",
        "Leistungsaufnahme im Ein-Zustand": "13.9 W",
        "Leistungsmerkmale": "Slot f\u00fcr Sicherheitsschloss (Kabelschloss getrennt erh\u00e4ltlich), LED-Anzeige, Unterst\u00fctzung f\u00fcr VESA-Schnittstelle",
        "Max. Betriebstemperatur": "40 \u00b0C",
        "Min Betriebstemperatur": "0 \u00b0C",
        "Mitgelieferte Software": "Dell Display Manager",
        "Native Aufl\u00f6sung": "Full HD (1080p) 1920 x 1080 bei 60 Hz",
        "Neigungswinkel": "-5/+21",
        "OSD-Sprachen": "Chinesisch (vereinfacht), Brasilianisches Portugiesisch, Englisch, Deutsch, Franz\u00f6sisch, Russisch, Spanisch, Japanisch",
        "Pixelpitch": "0.275 mm",
        "Ppi": "92",
        "Reaktionszeit": "8 ms (normal); 5 ms (schnell)",
        "Rotationswinkel": "180",
        "Schlosstyp zur Diebstahlsicherung": "Kensington Slot",
        "Schnittstellen": "DisplayPort  VGA  HDMI  USB 3.0 Upstream (Typ B)  2 x USB 3.0 Downstream (Typ A)  2 x USB 2.0 Downstream (Typ A)",
        "Schwenkwinkel": "90",
        "Seitenverh\u00e4ltnis": "16:9",
        "Services im Bundle": "3 Jahre Advanced Exchange- und Premium Panel-Garantie",
        "Sichtbare Bildfl\u00e4che": "60.5 cm (23.8\")",
        "Stromverbrauch (Aus-Modus)": "0.2 Watt",
        "Stromverbrauch (max.)": "42 Watt",
        "Stromverbrauch (typisch)": "18 Watt",
        "Stromverbrauch SDR (eingeschaltet)": "13.9 kWh/1.000 h",
        "Stromverbrauch im Standby-Modus": "0.2 Watt",
        "TCO-zertifiziert": "TCO Certified Displays 8",
        "Transportgewicht": "7.1 kg",
        "VESA-Halterung": "100 x 100 mm",
        "Vertikale Bildwiederholrate": "50 - 76 Hz",
        "Vertikaler Betrachtungswinkel": "178",
        "Zul\u00e4ssige Luftfeuchtigkeit im Betrieb": "20 - 80% (nicht kondensierend)"
    },
    "raw_specifications_text": "Gruppe: TFTs\nHersteller: Dell\nHersteller Art. Nr.: DELL-P2419H\nEAN/UPC: 5397184092392\nDisplay-Typ: LED-hintergrundbeleuchteter LCD-Monitor / TFT-Aktivmatrix\nEnergieverbrauch pro Jahr: 29 kWh\nDiagonalabmessung: 61 cm (24\")\nEnergie Effizienzklasse: Klasse D\nSichtbare Bildfl\u00e4che: 60.5 cm (23.8\")\nIntegrierte Peripherieger\u00e4te: USB 3.0-Hub\nBildschirmtyp: IPS\nSeitenverh\u00e4ltnis: 16:9\nNative Aufl\u00f6sung: Full HD (1080p) 1920 x 1080 bei 60 Hz\nPixelpitch: 0.275 mm\nPpi: 92\nHelligkeit: 250 cd/m\u00b2\nKontrast: 1000:1\nFarbunterst\u00fctzung: 16,7 Millionen Farben\nReaktionszeit: 8 ms (normal); 5 ms (schnell)\nVertikale Bildwiederholrate: 50 - 76 Hz\nHorizontale Bildwiederholrate: 30 - 83 kHz\nHorizontaler Betrachtungswinkel: 178\nVertikaler Betrachtungswinkel: 178\nFarbraum: 72% (CIE 1931)\nBildschirmbeschichtung: Blendfrei, 3H Hard Coating\nHintergrundbeleuchtungs-Technologie: LED-Hintergrundbeleuchtung\nOSD-Sprachen: Chinesisch (vereinfacht), Brasilianisches Portugiesisch, Englisch, Deutsch, Franz\u00f6sisch, Russisch, Spanisch, Japanisch\nAbmessungen (Breite x Tiefe x H\u00f6he): 53.78 cm x 16.6 cm x 35.61 cm - mit Fu\u00df\nBesonderheiten: LED-Randlichtsystem, Dell Custom Color, flimmerfreie Technologie, BFR/PVC-frei, ohne Quecksilber, Dell ComfortView, arsenfrei\nGewicht: 4.93 kg\nMin Betriebstemperatur: 0 \u00b0C\nMax. Betriebstemperatur: 40 \u00b0C\nZul\u00e4ssige Luftfeuchtigkeit im Betrieb: 20 - 80% (nicht kondensierend)\nLeistungsaufnahme im Ein-Zustand: 13.9 W\nEingangsspannung: Wechselstrom 120/230 V (50/60 Hz)\nStromverbrauch (typisch): 18 Watt\nStromverbrauch SDR (eingeschaltet): 13.9 kWh/1.000 h\nStromverbrauch (max.): 42 Watt\nStromverbrauch im Standby-Modus: 0.2 Watt\nStromverbrauch (Aus-Modus): 0.2 Watt\nMitgelieferte Software: Dell Display Manager\nSchnittstellen: DisplayPort  VGA  HDMI  USB 3.0 Upstream (Typ B)  2 x USB 3.0 Downstream (Typ A)  2 x USB 2.0 Downstream (Typ A)\nNeigungswinkel: -5/+21\nSchwenkwinkel: 90\nRotationswinkel: 180\nH\u00f6heneinstellung: 130 mm\nEinstellungen der Anzeigeposition: H\u00f6he, Pivot (Rotation), Drehung, Neigung\nVESA-Halterung: 100 x 100 mm\nLeistungsmerkmale: Slot f\u00fcr Sicherheitsschloss (Kabelschloss getrennt erh\u00e4ltlich), LED-Anzeige, Unterst\u00fctzung f\u00fcr VESA-Schnittstelle\nEnthaltene Kabel: 1 x DisplayPort-Kabel - DisplayPort zu DisplayPort  1 x SuperSpeed-USB-Kabel\nKennzeichnung: Plug and Play, DDC/CI, RoHS, EDID-kompatibel, DisplayPort 1.2\nSchlosstyp zur Diebstahlsicherung: Kensington Slot\nDetails zu Abmessungen & Gewicht: Ohne Fu\u00df - Breite: 53.78 cm - Tiefe: 4.28 cm - H\u00f6he: 32.22 cm - Gewicht: 3.26 kg  Mit Fu\u00df - Breite: 53.78 cm - Tiefe: 16.6 cm - H\u00f6he: 35.61 cm - Gewicht: 4.93 kg\nTransportgewicht: 7.1 kg\nENERGY STAR zertifiziert: Ja\nTCO-zertifiziert: TCO Certified Displays 8\nServices im Bundle: 3 Jahre Advanced Exchange- und Premium Panel-Garantie",
    "reference_file": "offer_reference_2274.json",
    "shop_name": "1ashop.at"
}