{
    "html_file": "offer_1967_5.html",
    "name": "Lenovo ThinkVision T34w-20, 34\"",
    "offer_link": "https://www.proshop.at/Bildschirm/Lenovo-Bildschirm-ThinkVision-T34w-20-3440x1440-VA-75W-USB-HUB/2830232?utm_source=geizhals&utm_medium=cpc&utm_campaign=pricesite",
    "price": 948.68,
    "raw_specifications": {
        "Abmessungen (Breite x Tiefe x H\u00f6he)": "80.86 cm x 24.05 cm x 46.24 cm - mit Standfu\u00df (niedrigste Position)",
        "Abmessungen (Breite x Tiefe x H\u00f6he) - mit Standfu\u00df (niedrigste Position)": "80.86 cm x 24.05 cm x 46.24 cm",
        "Besonderheiten": "Integrierte Kabelf\u00fchrung, NearEdgeless-Design an 3 Seiten, 99 % sRGB Farbraum",
        "Bildschirmbeschichtung": "Blendfrei",
        "Bildschirmtyp": "VA",
        "Details zu Abmessungen & Gewicht": "Mit Standfu\u00df (niedrigste Position) - Breite: 80.86 cm - Tiefe: 24.05 cm - H\u00f6he: 46.24 cm - Gewicht: 9.91 kg  Mit Standfu\u00df (h\u00f6chste Position) - Breite: 80.86 cm - Tiefe: 24.05 cm - H\u00f6he: 59.74 cm - Gewicht: 9.91 kg  Ohne Fu\u00df - Breite: 80.86 cm - Tiefe: 10.61 cm - H\u00f6he: 37.26 cm - Gewicht: 6.91 kg",
        "Diagonalabmessung": "86 cm (34\")",
        "Display-Typ": "LED-hintergrundbeleuchteter LCD-Monitor / TFT-Aktivmatrix",
        "EAN": "0193638980544",
        "ENERGY STAR zertifiziert": "Ja",
        "ENERGY STAR-Version": "8.0",
        "EPEAT-kompatibel": "EPEAT Silver",
        "Eingangsanschl\u00fcsse": "HDMI, DisplayPort, USB-C",
        "Eingangsspannung": "Wechselstrom 120/230 V (50/60 Hz)",
        "Einstellungen der Anzeigeposition": "H\u00f6he, Drehung, Neigung",
        "Energie Effizienzklasse": "Klasse G",
        "Energierverbrauch Sleep": "0.5 Watt",
        "Enthaltene Kabel": "1 x USB-C Kabel - 1.8 m",
        "Entwickelt f\u00fcr": "ThinkPad P15 Gen 2 20YQ",
        "Farbe": "Raven Black",
        "Farbraum": "99% sRGB",
        "Farbunterst\u00fctzung": "16,7 Millionen Farben",
        "Ger\u00e4tetyp": "LED-hintergrundbeleuchteter LCD-Monitor - 86 cm (34\")",
        "Geschwungener Bildschirm": "Ja (1500R)",
        "Gewicht": "9.91 kg",
        "Helligkeit": "350 cd/m\u00b2",
        "Hersteller": "Lenovo",
        "Hintergrundbeleuchtungs-Technologie": "WLED",
        "Horizontaler Betrachtungswinkel": "178",
        "H\u00f6heneinstellung": "135 mm",
        "Integrierte Peripherieger\u00e4te": "USB-C-Hub",
        "Kennzeichnung": "CCC, RoHS, China Energy standard Tier 2, TUV Rheinland Eye Comfort Certification",
        "Kontrast": "3000:1 / 3000000:1 (dynamisch)",
        "Leistungsaufnahme im Ein-Zustand": "39 W",
        "Leistungsmerkmale": "Slot f\u00fcr Sicherheitsschloss (Kabelschloss getrennt erh\u00e4ltlich)",
        "Lokalisierung": "Englisch / Europa",
        "Modell": "61F3GAT1EU",
        "Native Aufl\u00f6sung": "UWQHD 3440 x 1440",
        "Neigungswinkel": "-5/+35",
        "Pixelpitch": "0.23175 mm",
        "Ppi": "109",
        "Produktbeschreibung": "Lenovo ThinkVision T34w-20 - LED-Monitor - gebogen - 86 cm (34\")",
        "Reaktionszeit": "4 ms (extrem), 6 ms (normal)",
        "Schlosstyp zur Diebstahlsicherung": "Kensington Slot",
        "Schnittstellen": "DisplayPort  HDMI  Kopfh\u00f6rer  USB-C 3.1 Gen 1  USB-C 3.1 Gen 1 Upstream  3 x USB 3.1 Gen 1 Downstream  USB 3.1 Gen 1 Downstream mit Batterieladefunktion (bis zu 75 W)",
        "Schwenkwinkel": "90",
        "Seitenverh\u00e4ltnis": "21:9",
        "Sichtbare Bildfl\u00e4che": "86 cm",
        "Spannung": "Wechselstrom 120/230 V (50/60 Hz)",
        "Stromverbrauch (typisch)": "46 Watt",
        "Stromverbrauch SDR (eingeschaltet)": "32 kWh/1.000 h",
        "Stromverbrauch im Standby-Modus": "0.5 Watt",
        "TCO-zertifiziert": "TCO Certified Displays 8, TCO Certified Edge Displays",
        "Transportbreite": "98 cm",
        "Transportgewicht": "13.85 kg",
        "Transporth\u00f6he": "52.3 cm",
        "Transporttiefe": "25 cm",
        "USB-Spannungsversorgung": "75 Watt",
        "Umweltschutzstandards": "TCO Certified Displays 8, TCO Certified Edge Displays, ENERGY STAR-qualifiziert EPEAT Silver",
        "VESA-Halterung": "100 x 100 mm",
        "Vertikale Bildwiederholrate": "60 Hz",
        "Vertikaler Betrachtungswinkel": "178",
        "Waren-Nr.": "2830232",
        "Zum Hersteller": "lenovo.com"
    },
    "raw_specifications_text": "Hersteller: Lenovo\nWaren-Nr.: 2830232\nModell: 61F3GAT1EU\nEAN: 0193638980544\nZum Hersteller: lenovo.com\nProduktbeschreibung: Lenovo ThinkVision T34w-20 - LED-Monitor - gebogen - 86 cm (34\")\nGer\u00e4tetyp: LED-hintergrundbeleuchteter LCD-Monitor - 86 cm (34\")\nEnergie Effizienzklasse: Klasse G\nLeistungsaufnahme im Ein-Zustand: 39 W\nGeschwungener Bildschirm: Ja (1500R)\nLeistungsmerkmale: Slot f\u00fcr Sicherheitsschloss (Kabelschloss getrennt erh\u00e4ltlich)\nBildschirmtyp: VA\nSeitenverh\u00e4ltnis: 21:9\nNative Aufl\u00f6sung: UWQHD 3440 x 1440\nPixelpitch: 0.23175 mm\nHelligkeit: 350 cd/m\u00b2\nKontrast: 3000:1 / 3000000:1 (dynamisch)\nReaktionszeit: 4 ms (extrem), 6 ms (normal)\nFarbunterst\u00fctzung: 16,7 Millionen Farben\nFarbraum: 99% sRGB\nEingangsanschl\u00fcsse: HDMI, DisplayPort, USB-C\nEinstellungen der Anzeigeposition: H\u00f6he, Drehung, Neigung\nBildschirmbeschichtung: Blendfrei\nSpannung: Wechselstrom 120/230 V (50/60 Hz)\nFarbe: Raven Black\nAbmessungen (Breite x Tiefe x H\u00f6he) - mit Standfu\u00df (niedrigste Position): 80.86 cm x 24.05 cm x 46.24 cm\nGewicht: 9.91 kg\nLokalisierung: Englisch / Europa\nUmweltschutzstandards: TCO Certified Displays 8, TCO Certified Edge Displays, ENERGY STAR-qualifiziert EPEAT Silver\nKennzeichnung: CCC, RoHS, China Energy standard Tier 2, TUV Rheinland Eye Comfort Certification\nEntwickelt f\u00fcr: ThinkPad P15 Gen 2 20YQ\nDisplay-Typ: LED-hintergrundbeleuchteter LCD-Monitor / TFT-Aktivmatrix\nDiagonalabmessung: 86 cm (34\")\nSichtbare Bildfl\u00e4che: 86 cm\nIntegrierte Peripherieger\u00e4te: USB-C-Hub\nUSB-Spannungsversorgung: 75 Watt\nPpi: 109\nVertikale Bildwiederholrate: 60 Hz\nHorizontaler Betrachtungswinkel: 178\nVertikaler Betrachtungswinkel: 178\nHintergrundbeleuchtungs-Technologie: WLED\nBesonderheiten: Integrierte Kabelf\u00fchrung, NearEdgeless-Design an 3 Seiten, 99 % sRGB Farbraum\nAbmessungen (Breite x Tiefe x H\u00f6he): 80.86 cm x 24.05 cm x 46.24 cm - mit Standfu\u00df (niedrigste Position)\nSchnittstellen: DisplayPort  HDMI  Kopfh\u00f6rer  USB-C 3.1 Gen 1  USB-C 3.1 Gen 1 Upstream  3 x USB 3.1 Gen 1 Downstream  USB 3.1 Gen 1 Downstream mit Batterieladefunktion (bis zu 75 W)\nNeigungswinkel: -5/+35\nSchwenkwinkel: 90\nH\u00f6heneinstellung: 135 mm\nVESA-Halterung: 100 x 100 mm\nEnthaltene Kabel: 1 x USB-C Kabel - 1.8 m\nSchlosstyp zur Diebstahlsicherung: Kensington Slot\nEingangsspannung: Wechselstrom 120/230 V (50/60 Hz)\nStromverbrauch SDR (eingeschaltet): 32 kWh/1.000 h\nStromverbrauch (typisch): 46 Watt\nStromverbrauch im Standby-Modus: 0.5 Watt\nEnergierverbrauch Sleep: 0.5 Watt\nDetails zu Abmessungen & Gewicht: Mit Standfu\u00df (niedrigste Position) - Breite: 80.86 cm - Tiefe: 24.05 cm - H\u00f6he: 46.24 cm - Gewicht: 9.91 kg  Mit Standfu\u00df (h\u00f6chste Position) - Breite: 80.86 cm - Tiefe: 24.05 cm - H\u00f6he: 59.74 cm - Gewicht: 9.91 kg  Ohne Fu\u00df - Breite: 80.86 cm - Tiefe: 10.61 cm - H\u00f6he: 37.26 cm - Gewicht: 6.91 kg\nTransportbreite: 98 cm\nTransporttiefe: 25 cm\nTransporth\u00f6he: 52.3 cm\nTransportgewicht: 13.85 kg\nTCO-zertifiziert: TCO Certified Displays 8, TCO Certified Edge Displays\nEPEAT-kompatibel: EPEAT Silver\nENERGY STAR zertifiziert: Ja\nENERGY STAR-Version: 8.0",
    "reference_file": "offer_reference_1967.json",
    "shop_name": "Proshop.at"
}