{
    "html_file": "offer_744_16.html",
    "name": "Philips 3000 Series 24B1U5301H, 23.8\"",
    "offer_link": "https://click.cptrack.de/?rd=true&k=5QNCBYB9xMh6DJycvhgeW_vjVNkVf5nzYterv3YRUHm72A35TKiZHIT82LrnJhY-iqCdpe0PJ81gw-kNg21utg~~&rdlink=https%3A%2F%2Fwww.cw-mobile.de%2Fphilips-24b1u5301h-60-5-cm-23-8-zoll-led-monitor.html%3Futm_source%3DPSM%26utm_medium%3DGeizhals%26utm_campaign%3DPSM",
    "price": 424.49,
    "raw_specifications": {
        "Abmessungen & Gewicht (Transport)Transportbreite": "60 cmTransporttiefe: 19.8 cmTransporth\u00f6he: 40.6 cmTransportgewicht: 8.32 kg",
        "Abmessungen und GewichtDetails zu Abmessungen & Gewicht": "Mit Standfu\u00df (h\u00f6chste Position) - Breite: 54 cm - Tiefe: 20.5 cm - H\u00f6he: 50 cm - Gewicht: 5.5 kg \u00a6 Ohne Fu\u00df - Breite: 54 cm - Tiefe: 5.1 cm - H\u00f6he: 32.3 cm - Gewicht: 3.9 kg",
        "AllgemeinDisplay-Typ": "LED-hintergrundbeleuchteter LCD-Monitor / TFT-AktivmatrixEnergie Effizienzklasse: Klasse EDiagonalabmessung: 60.5 cm (23.8\")Integrierte Peripherieger\u00e4te: USB Hub, WebcamUSB-Spannungsversorgung: 90 WattBildschirmtyp: IPSSeitenverh\u00e4ltnis: 16:9Native Aufl\u00f6sung: Full HD (1080p) 1920 x 1080 bei 75 HzPixelpitch: 0.2745 mmPpi: 93Helligkeit: 300 cd/m\u00b2Kontrast: 1000:1Farbunterst\u00fctzung: 16,7 Millionen Farben (8-Bit)Farbraum: 105% sRGB (CIE 1931), 88% NTSC (CIE 1976)Reaktionszeit: 4 ms (gray-to-gray)Vertikale Bildwiederholrate: 48 - 75 HzHorizontale Bildwiederholrate: 30 - 85 kHzHorizontaler Betrachtungswinkel: 178Vertikaler Betrachtungswinkel: 178Bildschirmbeschichtung: Blendfrei, 3H Hard Coating, Haze 25 %Hintergrundbeleuchtungs-Technologie: WLEDOSD-Sprachen: Ungarisch, Tschechisch, Chinesisch (tradionell), Chinesisch (vereinfacht), Ukrainisch, Brasilianisches Portugiesisch, Englisch, Deutsch, Franz\u00f6sisch, Italienisch, Portugiesisch, Polnisch, Finnisch, Schwedisch, Russisch, Spanisch, Holl\u00e4ndisch, Griechisch, T\u00fcrkisch, Japanisch, KoreanischBesonderheiten: PowerSensor, MultiView, SmartImage, Smart ErgoBase, flimmerfreie Technologie, LightSensor, EasyRead, an 3 Seiten ohne Blende, LowBlue Mode, LED-Betriebsanzeige, MultiClient KVMFarbe: SchwarzAbmessungen (Breite x Tiefe x H\u00f6he): 54 cm x 20.5 cm x 50 cm - mit Standfu\u00df (h\u00f6chste Position)Gewicht: 5.5 kg",
        "AudioTyp": "Lautsprecher - StereoAusgangsleistung/Kanal: 5 Watt",
        "AudioeingangTyp": "MikrofonMikrofonfunktionen: Ger\u00e4uschunterdr\u00fcckung",
        "Informationen zur NachhaltigkeitTCO-zertifiziert": "TCO Certified Edge Displays, TCO Certified Displays 9ENERGY STAR zertifiziert: JaENERGY STAR-Version: 8.0",
        "Integrierte WebcamSensoraufl\u00f6sung": "5 MegapixelLeistungsmerkmale: Kompatibel mit Windows Hello",
        "KVMTastatur-/Mausschnittstelle": "USB",
        "Konnektivit\u00e4tSchnittstellen": "HDMI \u00a6 DisplayPort 1.4 \u00a6 DisplayPort-Ausgang \u00a6 USB-C Upstream (DisplayPort Alt Mode, Daten, Leistung bis zu 90 W) \u00a6 USB-C 3,2 Gen 2 Upstream \u00a6 3 x USB Downstream \u00a6 USB Downstream (BC 1.2) \u00a6 USB-C Downstream (bis zu 15 W) \u00a6 Kombinierter Kopfh\u00f6rer-/-Mikrofonstecker \u00a6 Netzwerk (RJ-45)",
        "MechanischEinstellungen der Anzeigeposition": "H\u00f6he, Pivot (Rotation), Drehung, NeigungNeigungswinkel: -5/+30Schwenkwinkel: 360Rotationswinkel: -90/+90H\u00f6heneinstellung: 150 mmVESA-Halterung: 100 x 100 mm",
        "Software / SystemanforderungenMitgelieferte Software": "Philips SmartControl",
        "StromversorgungEingangsspannung": "Wechselstrom 100-240 V (50/60 Hz)Stromverbrauch SDR (eingeschaltet): 18 kWh/1.000 hStromverbrauch (typisch): 15.3 WattStromverbrauch im Standby-Modus: 0.3 WattStromverbrauch (Aus-Modus): 0 WattEin-/Aus-Schalter: Ja",
        "UmgebungsbedingungenMin Betriebstemperatur": "0 \u00b0CMax. Betriebstemperatur: 40 \u00b0CZul\u00e4ssige Luftfeuchtigkeit im Betrieb: 20 - 80%",
        "VerschiedenesLeistungsmerkmale": "Slot f\u00fcr Sicherheitsschloss (Kabelschloss getrennt erh\u00e4ltlich), 1-Gbit-Ethernet-Port, 100 % recycelbare Verpackung, strukturierte Oberfl\u00e4che, 85 % recycelter KunststoffEnthaltene Kabel: HDMI-Kabel \u00a6 Kabel USB-C auf USB-C / USB-A \u00a6 DisplayPort-KabelMTBF: 70,000 Stunde(n)Kennzeichnung: Plug and Play, FCC Klasse B bescheinigt, TUV GS, ICES-003, SEMKO, CB, TUV Ergo, DDC/CI, cETLus, CU-EAC, TUV Rheinland Eye Comfort Certification, BFR-frei, HDCP 2.2, HDCP 1.4, USB Power Delivery 3.0, quecksilberfrei, TUV Eye Comfort certified, EAEU RoHS, TCO Certified EdgeSchlosstyp zur Diebstahlsicherung: Kensington Slot"
    },
    "raw_specifications_text": "AllgemeinDisplay-Typ: LED-hintergrundbeleuchteter LCD-Monitor / TFT-AktivmatrixEnergie Effizienzklasse: Klasse EDiagonalabmessung: 60.5 cm (23.8\")Integrierte Peripherieger\u00e4te: USB Hub, WebcamUSB-Spannungsversorgung: 90 WattBildschirmtyp: IPSSeitenverh\u00e4ltnis: 16:9Native Aufl\u00f6sung: Full HD (1080p) 1920 x 1080 bei 75 HzPixelpitch: 0.2745 mmPpi: 93Helligkeit: 300 cd/m\u00b2Kontrast: 1000:1Farbunterst\u00fctzung: 16,7 Millionen Farben (8-Bit)Farbraum: 105% sRGB (CIE 1931), 88% NTSC (CIE 1976)Reaktionszeit: 4 ms (gray-to-gray)Vertikale Bildwiederholrate: 48 - 75 HzHorizontale Bildwiederholrate: 30 - 85 kHzHorizontaler Betrachtungswinkel: 178Vertikaler Betrachtungswinkel: 178Bildschirmbeschichtung: Blendfrei, 3H Hard Coating, Haze 25 %Hintergrundbeleuchtungs-Technologie: WLEDOSD-Sprachen: Ungarisch, Tschechisch, Chinesisch (tradionell), Chinesisch (vereinfacht), Ukrainisch, Brasilianisches Portugiesisch, Englisch, Deutsch, Franz\u00f6sisch, Italienisch, Portugiesisch, Polnisch, Finnisch, Schwedisch, Russisch, Spanisch, Holl\u00e4ndisch, Griechisch, T\u00fcrkisch, Japanisch, KoreanischBesonderheiten: PowerSensor, MultiView, SmartImage, Smart ErgoBase, flimmerfreie Technologie, LightSensor, EasyRead, an 3 Seiten ohne Blende, LowBlue Mode, LED-Betriebsanzeige, MultiClient KVMFarbe: SchwarzAbmessungen (Breite x Tiefe x H\u00f6he): 54 cm x 20.5 cm x 50 cm - mit Standfu\u00df (h\u00f6chste Position)Gewicht: 5.5 kg\nIntegrierte WebcamSensoraufl\u00f6sung: 5 MegapixelLeistungsmerkmale: Kompatibel mit Windows Hello\nAudioeingangTyp: MikrofonMikrofonfunktionen: Ger\u00e4uschunterdr\u00fcckung\nAudioTyp: Lautsprecher - StereoAusgangsleistung/Kanal: 5 Watt\nKVMTastatur-/Mausschnittstelle: USB\nKonnektivit\u00e4tSchnittstellen: HDMI \u00a6 DisplayPort 1.4 \u00a6 DisplayPort-Ausgang \u00a6 USB-C Upstream (DisplayPort Alt Mode, Daten, Leistung bis zu 90 W) \u00a6 USB-C 3,2 Gen 2 Upstream \u00a6 3 x USB Downstream \u00a6 USB Downstream (BC 1.2) \u00a6 USB-C Downstream (bis zu 15 W) \u00a6 Kombinierter Kopfh\u00f6rer-/-Mikrofonstecker \u00a6 Netzwerk (RJ-45)\nMechanischEinstellungen der Anzeigeposition: H\u00f6he, Pivot (Rotation), Drehung, NeigungNeigungswinkel: -5/+30Schwenkwinkel: 360Rotationswinkel: -90/+90H\u00f6heneinstellung: 150 mmVESA-Halterung: 100 x 100 mm\nVerschiedenesLeistungsmerkmale: Slot f\u00fcr Sicherheitsschloss (Kabelschloss getrennt erh\u00e4ltlich), 1-Gbit-Ethernet-Port, 100 % recycelbare Verpackung, strukturierte Oberfl\u00e4che, 85 % recycelter KunststoffEnthaltene Kabel: HDMI-Kabel \u00a6 Kabel USB-C auf USB-C / USB-A \u00a6 DisplayPort-KabelMTBF: 70,000 Stunde(n)Kennzeichnung: Plug and Play, FCC Klasse B bescheinigt, TUV GS, ICES-003, SEMKO, CB, TUV Ergo, DDC/CI, cETLus, CU-EAC, TUV Rheinland Eye Comfort Certification, BFR-frei, HDCP 2.2, HDCP 1.4, USB Power Delivery 3.0, quecksilberfrei, TUV Eye Comfort certified, EAEU RoHS, TCO Certified EdgeSchlosstyp zur Diebstahlsicherung: Kensington Slot\nStromversorgungEingangsspannung: Wechselstrom 100-240 V (50/60 Hz)Stromverbrauch SDR (eingeschaltet): 18 kWh/1.000 hStromverbrauch (typisch): 15.3 WattStromverbrauch im Standby-Modus: 0.3 WattStromverbrauch (Aus-Modus): 0 WattEin-/Aus-Schalter: Ja\nSoftware / SystemanforderungenMitgelieferte Software: Philips SmartControl\nAbmessungen und GewichtDetails zu Abmessungen & Gewicht: Mit Standfu\u00df (h\u00f6chste Position) - Breite: 54 cm - Tiefe: 20.5 cm - H\u00f6he: 50 cm - Gewicht: 5.5 kg \u00a6 Ohne Fu\u00df - Breite: 54 cm - Tiefe: 5.1 cm - H\u00f6he: 32.3 cm - Gewicht: 3.9 kg\nAbmessungen & Gewicht (Transport)Transportbreite: 60 cmTransporttiefe: 19.8 cmTransporth\u00f6he: 40.6 cmTransportgewicht: 8.32 kg\nInformationen zur NachhaltigkeitTCO-zertifiziert: TCO Certified Edge Displays, TCO Certified Displays 9ENERGY STAR zertifiziert: JaENERGY STAR-Version: 8.0\nUmgebungsbedingungenMin Betriebstemperatur: 0 \u00b0CMax. Betriebstemperatur: 40 \u00b0CZul\u00e4ssige Luftfeuchtigkeit im Betrieb: 20 - 80%",
    "reference_file": "offer_reference_744.json",
    "shop_name": "cw-mobile.de"
}