{
    "html_file": "offer_907_0.html",
    "name": "Lenovo ThinkVision E29w-20, 29\"",
    "offer_link": "https://direkt.jacob.de/produkte/lenovo-thinkvision-e29w-20-62cegat3eu-artnr-7556769.html?utm_source=geizhals&utm_medium=cpc&utm_campaign=Preisvergleich&ref=103",
    "price": 271.25,
    "raw_specifications": {
        "AC Eingangsfrequenz": "50/60 Hz",
        "AC Eingangsspannung": "100 - 240 V",
        "AMD FreeSync": "Ja",
        "Abnehmbarer Standfu\u00df": "Ja",
        "Anzahl DisplayPort Anschl\u00fcsse": "1",
        "Anzahl HDMI-Anschl\u00fcsse": "1",
        "Anzahl der Farben des Displays": "16,7 Millionen Farben",
        "Anzahl der Lautsprecher": "2",
        "Audioausgang": "Ja",
        "Bezel Weite (bottom)": "2,64 cm",
        "Bezel Weite (side)": "1,8 mm",
        "Bezel Weite (top)": "1,8 mm",
        "Bildschirmaufl\u00f6sung": "2560 x 1080 Pixel",
        "Bildschirmdiagonale": "73,7 cm (29\" )",
        "Bildschirmform": "Flach",
        "Bildschirmtechnologie": "LED",
        "Blendfreier Bildschirm": "Ja",
        "Blickwinkel, horizontal": "178\u00b0",
        "Blickwinkel, vertikal": "178\u00b0",
        "Breite (ohne Standfu\u00df)": "68,8 cm",
        "DisplayPorts-Version": "1.2",
        "Eingebaute Lautsprecher": "Ja",
        "Eingebautes Mikrofon": "Nein",
        "Energie Effizienzklasse": "D",
        "Farbintensit\u00e4t": "8 Bit",
        "Farbskala": "99%",
        "Ger\u00e4tebreite (inkl. Fu\u00df)": "688,4 mm",
        "Ger\u00e4tetiefe (inkl. Fu\u00df)": "220 mm",
        "Gewicht (mit St\u00e4nder)": "6,6 kg",
        "Gewicht (ohne St\u00e4nder)": "4,4 kg",
        "HD-Typ": "UltraWide Full HD",
        "HDMI": "Ja",
        "HDMI-Kabell\u00e4nge": "1,8 m",
        "HDMI-Version": "1.4",
        "Helligkeit (typisch)": "300 cd/m\u00b2",
        "H\u00f6he (ohne Standfu\u00df)": "32 cm",
        "H\u00f6heneinstellung": "15,5 cm",
        "H\u00f6henverstellung": "Ja",
        "Integrierte Kamera": "Nein",
        "Integrierter USB-Hub": "Nein",
        "Kabelsperre-Slot": "Ja",
        "Kontrastverh\u00e4ltnis": "1000:1",
        "Kontrastverh\u00e4ltnis (dynamisch)": "3000000:1",
        "Maximale Bildwiederholrate": "90 Hz",
        "Mitgelieferte Kabel": "AC, HDMI",
        "Natives Seitenverh\u00e4ltnis": "21:9",
        "Neigungswinkelbereich": "5 - 22\u00b0",
        "Paketgewicht": "8,5 kg",
        "Panel-Montage-Schnittstelle": "100 x 100 mm",
        "Panel-Typ": "IPS",
        "Pixel Abstand": "0,2628 x 0,2628 mm",
        "Pixeldichte": "96 ppi",
        "Produktfarbe": "Schwarz",
        "RGB-Farbraum": "sRGB",
        "RMS-Leistung": "6 W",
        "Reaktionszeit": "6 ms",
        "Reaktionszeit (schnell)": "4 ms",
        "Schnellstart\u00fcbersicht": "Ja",
        "Schwenkbar": "Ja",
        "Schwenkwinkelbereich": "0 - 360\u00b0",
        "Sichtbare Gr\u00f6\u00dfe (horizontal)": "67,3 cm",
        "Sichtbare Gr\u00f6\u00dfe (vertikal)": "28,4 cm",
        "Slot-Typ Kabelsperre": "Kensington",
        "Stromverbrauch (Standardbetrieb)": "36 W",
        "Stromverbrauch (aus)": "0,3 W",
        "Stromverbrauch (max.)": "45 W",
        "St\u00e4nder enthalten": "Ja",
        "Tiefe (ohne Standfu\u00df)": "4,75 cm",
        "Typ der Hintergrundbeleuchtung": "W-LED",
        "VESA-Halterung": "Ja",
        "Verpackungsbreite": "395 mm",
        "Verpackungsh\u00f6he": "155 mm",
        "Verpackungstiefe": "796 mm",
        "Zertifizierung": "ENERGY STAR, CCC, TCO 8.0, TCO Edge 2.0, EPEAT Gold, RoHS (EU 2002/95/EC), Tier 1, T\u00dcV, Windows Certification",
        "kippbar": "Ja",
        "sRGB Abdeckung (klassisch)": "99%"
    },
    "raw_specifications_text": "Bildschirmdiagonale: 73,7 cm (29\" )\nBildschirmaufl\u00f6sung: 2560 x 1080 Pixel\nEnergie Effizienzklasse: D\nNatives Seitenverh\u00e4ltnis: 21:9\nPanel-Typ: IPS\nHD-Typ: UltraWide Full HD\nBildschirmtechnologie: LED\nBildschirmform: Flach\nKontrastverh\u00e4ltnis: 1000:1\nMaximale Bildwiederholrate: 90 Hz\nAnzahl der Farben des Displays: 16,7 Millionen Farben\nHelligkeit (typisch): 300 cd/m\u00b2\nReaktionszeit: 6 ms\nTyp der Hintergrundbeleuchtung: W-LED\nBlendfreier Bildschirm: Ja\nKontrastverh\u00e4ltnis (dynamisch): 3000000:1\nBlickwinkel, horizontal: 178\u00b0\nBlickwinkel, vertikal: 178\u00b0\nReaktionszeit (schnell): 4 ms\nPixel Abstand: 0,2628 x 0,2628 mm\nPixeldichte: 96 ppi\nSichtbare Gr\u00f6\u00dfe (horizontal): 67,3 cm\nSichtbare Gr\u00f6\u00dfe (vertikal): 28,4 cm\nFarbintensit\u00e4t: 8 Bit\nRGB-Farbraum: sRGB\nFarbskala: 99%\nsRGB Abdeckung (klassisch): 99%\nAMD FreeSync: Ja\nEingebaute Lautsprecher: Ja\nIntegrierte Kamera: Nein\nAnzahl der Lautsprecher: 2\nRMS-Leistung: 6 W\nEingebautes Mikrofon: Nein\nProduktfarbe: Schwarz\nAbnehmbarer Standfu\u00df: Ja\nZertifizierung: ENERGY STAR, CCC, TCO 8.0, TCO Edge 2.0, EPEAT Gold, RoHS (EU 2002/95/EC), Tier 1, T\u00dcV, Windows Certification\nIntegrierter USB-Hub: Nein\nHDMI: Ja\nAnzahl HDMI-Anschl\u00fcsse: 1\nHDMI-Version: 1.4\nAnzahl DisplayPort Anschl\u00fcsse: 1\nDisplayPorts-Version: 1.2\nAudioausgang: Ja\nVESA-Halterung: Ja\nKabelsperre-Slot: Ja\nH\u00f6henverstellung: Ja\nPanel-Montage-Schnittstelle: 100 x 100 mm\nSlot-Typ Kabelsperre: Kensington\nH\u00f6heneinstellung: 15,5 cm\nSchwenkbar: Ja\nSchwenkwinkelbereich: 0 - 360\u00b0\nkippbar: Ja\nNeigungswinkelbereich: 5 - 22\u00b0\nStromverbrauch (Standardbetrieb): 36 W\nStromverbrauch (max.): 45 W\nStromverbrauch (aus): 0,3 W\nAC Eingangsspannung: 100 - 240 V\nAC Eingangsfrequenz: 50/60 Hz\nGer\u00e4tebreite (inkl. Fu\u00df): 688,4 mm\nGer\u00e4tetiefe (inkl. Fu\u00df): 220 mm\nGewicht (mit St\u00e4nder): 6,6 kg\nBreite (ohne Standfu\u00df): 68,8 cm\nTiefe (ohne Standfu\u00df): 4,75 cm\nH\u00f6he (ohne Standfu\u00df): 32 cm\nGewicht (ohne St\u00e4nder): 4,4 kg\nBezel Weite (side): 1,8 mm\nBezel Weite (top): 1,8 mm\nBezel Weite (bottom): 2,64 cm\nSt\u00e4nder enthalten: Ja\nMitgelieferte Kabel: AC, HDMI\nHDMI-Kabell\u00e4nge: 1,8 m\nSchnellstart\u00fcbersicht: Ja\nVerpackungsbreite: 395 mm\nVerpackungstiefe: 796 mm\nVerpackungsh\u00f6he: 155 mm\nPaketgewicht: 8,5 kg",
    "reference_file": "offer_reference_907.json",
    "shop_name": "Jacob Elektronik direkt (AT)"
}