{
    "html_file": "offer_1157_4.html",
    "name": "ViewSonic VG2740V, 27\"",
    "offer_link": "https://www.mylemon.at/artikel/viewsonic/vg2740v/vg2740v-68-6cm-27zoll1920x1080-fhd.html",
    "price": 214.2,
    "raw_specifications": {
        "AC Eingangsfrequenz": "50/60 Hz",
        "AC Eingangsspannung": "100 - 240 V",
        "Anzahl DisplayPort Anschl\u00fcsse": "1",
        "Anzahl HDMI-Anschl\u00fcsse": "1",
        "Anzahl VGA (D-Sub) Anschl\u00fcsse": "1",
        "Anzahl der Farben des Displays": "16,7 Millionen Farben",
        "Anzahl der Lautsprecher": "2",
        "Anzahl der Upstream-Ports USB Typ-B": "1",
        "Anzahl der nachgeschalteten Steckpl\u00e4tze vom Typ USB-A": "3",
        "Artikelnummer": "M16Y9DCL",
        "Audioanschl\u00fcsse": "Ja",
        "Audioausgang": "Ja",
        "Aufl\u00f6sung": "1920x1080",
        "Besonderheiten": "Lautsprecher, USB HUB",
        "Betriebstemperatur": "0 - 40 \u00b0C",
        "Bildschirmdiagonale": "68,6 cm (27 Zoll)",
        "Bildschirmform": "Flach",
        "Bildschirmtechnologie": "LED",
        "Bildwinkel, horizontal": "178\u00b0",
        "Bildwinkel, vertikal": "178\u00b0",
        "Blendfreier Bildschirm": "Ja",
        "Breite (ohne Standfu\u00df)": "62,1 cm",
        "Display-Aufl\u00f6sung": "1920 x 1080 Pixel",
        "Displaygr\u00f6\u00dfe": "27 Zoll",
        "EAN": "0766907012149",
        "Eingebaute Lautsprecher": "Ja",
        "Eingebautes Mikrofon": "Ja",
        "Ergonomie": "H\u00f6henverstellbar, Pivot (90 Grad drehbar), Schwenkbar, Neigbar",
        "Farbskala": "76%",
        "Farbtiefe": "8 Bit",
        "Flimmerfreie Technologie": "Ja",
        "Ger\u00e4tebreite (inkl. Fu\u00df)": "621 mm",
        "Ger\u00e4teh\u00f6he (inkl. Fu\u00df)": "425,6 mm",
        "Ger\u00e4tetiefe (inkl. Fu\u00df)": "206 mm",
        "Gewicht (mit St\u00e4nder)": "7,2 kg",
        "Gewicht (ohne St\u00e4nder)": "4,8 kg",
        "HD-Typ": "Full HD",
        "HDMI": "Ja",
        "HDMI-Version": "1.4",
        "Helligkeit": "300 cd/m\u00b2",
        "Helligkeit (typisch)": "300 cd/m\u00b2",
        "Hersteller Artikelnummer": "VG2740V",
        "Horizontaler Scanbereich": "15 - 82 kHz",
        "H\u00f6he (ohne Standfu\u00df)": "38,9 cm",
        "H\u00f6heneinstellung": "13 cm",
        "H\u00f6henverstellung": "Ja",
        "Integrierte Kamera": "Ja",
        "Integrierter USB-Hub": "Ja",
        "Kabelsperre-Slot": "Ja",
        "Kontrastverh\u00e4ltnis": "1000:1",
        "Kontrastverh\u00e4ltnis (dynamisch)": "80000000:1",
        "Kopfh\u00f6rerausgang": "Ja",
        "Kopfh\u00f6rerausg\u00e4nge": "1",
        "Low-Blue-Light-Technologie": "Ja",
        "Maximale Bildwiederholrate": "60 Hz",
        "Megapixel (ca.)": "2 MP",
        "Mitgelieferte Kabel": "AC, Audio (3,5 mm), HDMI, USB Typ-A auf USB Typ-B",
        "NTSC Abdeckung (typisch)": "72%",
        "Nachhaltigkeitszertifikate": "CE, ENERGY STAR, EPEAT Silver, ErP, REACH, RoHS, WEEE",
        "Natives Seitenverh\u00e4ltnis": "16:9",
        "Neigungsverstellung": "Ja",
        "Neigungswinkelbereich": "-5 - 40\u00b0",
        "Paketgewicht": "10,2 kg",
        "Panel": "IPS",
        "Panel-Montage-Schnittstelle": "100 x 100 mm",
        "Panel-Typ": "IPS",
        "Pivot": "Ja",
        "Pivot Winkel": "0 - 90\u00b0",
        "Pixel Abstand": "0,311 x 0,311 mm",
        "RGB-Farbraum": "Adobe RGB",
        "RMS-Leistung": "4 W",
        "Reaktionszeit": "5 ms",
        "Relative Luftfeuchtigkeit in Betrieb": "20 - 90%",
        "Schnellstart\u00fcbersicht": "Ja",
        "Slot-Typ Kabelsperre": "Kensington",
        "Stromeingang": "Ja",
        "Stromverbrauch (Standardbetrieb)": "26,14 W",
        "Stromverbrauch (Standby)": "0,5 W",
        "Stromverbrauch (max.)": "32,5 W",
        "St\u00e4nder enthalten": "Ja",
        "Tiefe (ohne Standfu\u00df)": "5,5 cm",
        "Touchscreen": "Nein",
        "USB-Hub-Version": "3.2 Gen 2 (3.1 Gen 2)",
        "USB-Upstream-Porttyp": "USB Typ-B",
        "VESA Halterung": "100x100 mm",
        "VESA-Halterung": "Ja",
        "Vertikaler Scanbereich": "50 - 75 Hz",
        "Video Anschl\u00fcsse": "1x VGA",
        "Warentarifnummer (HS)": "85285210",
        "sRGB Abdeckung (klassisch)": "102%"
    },
    "raw_specifications_text": "Displaygr\u00f6\u00dfe: 27 Zoll\nAufl\u00f6sung: 1920x1080\nPanel: IPS\nReaktionszeit: 5 ms\nVideo Anschl\u00fcsse: 1x VGA\nErgonomie: H\u00f6henverstellbar, Pivot (90 Grad drehbar), Schwenkbar, Neigbar\nVESA Halterung: 100x100 mm\nHelligkeit: 300 cd/m\u00b2\nBesonderheiten: Lautsprecher, USB HUB\nHersteller Artikelnummer: VG2740V\nEAN: 0766907012149\nArtikelnummer: M16Y9DCL\nBildschirmdiagonale: 68,6 cm (27 Zoll)\nDisplay-Aufl\u00f6sung: 1920 x 1080 Pixel\nNatives Seitenverh\u00e4ltnis: 16:9\nBildschirmtechnologie: LED\nTouchscreen: Nein\nHD-Typ: Full HD\nPanel-Typ: IPS\nBildschirmform: Flach\nKontrastverh\u00e4ltnis: 1000:1\nMaximale Bildwiederholrate: 60 Hz\nAnzahl der Farben des Displays: 16,7 Millionen Farben\nHelligkeit (typisch): 300 cd/m\u00b2\nBlendfreier Bildschirm: Ja\nKontrastverh\u00e4ltnis (dynamisch): 80000000:1\nBildwinkel, horizontal: 178\u00b0\nBildwinkel, vertikal: 178\u00b0\nPixel Abstand: 0,311 x 0,311 mm\nHorizontaler Scanbereich: 15 - 82 kHz\nVertikaler Scanbereich: 50 - 75 Hz\nFarbtiefe: 8 Bit\nRGB-Farbraum: Adobe RGB\nFarbskala: 76%\nsRGB Abdeckung (klassisch): 102%\nNTSC Abdeckung (typisch): 72%\nFlimmerfreie Technologie: Ja\nLow-Blue-Light-Technologie: Ja\nEingebaute Lautsprecher: Ja\nIntegrierte Kamera: Ja\nAnzahl der Lautsprecher: 2\nRMS-Leistung: 4 W\nMegapixel (ca.): 2 MP\nEingebautes Mikrofon: Ja\nIntegrierter USB-Hub: Ja\nHDMI: Ja\nKopfh\u00f6rerausgang: Ja\nUSB-Hub-Version: 3.2 Gen 2 (3.1 Gen 2)\nUSB-Upstream-Porttyp: USB Typ-B\nAnzahl der Upstream-Ports USB Typ-B: 1\nAnzahl der nachgeschalteten Steckpl\u00e4tze vom Typ USB-A: 3\nAnzahl VGA (D-Sub) Anschl\u00fcsse: 1\nAnzahl HDMI-Anschl\u00fcsse: 1\nHDMI-Version: 1.4\nAnzahl DisplayPort Anschl\u00fcsse: 1\nAudioanschl\u00fcsse: Ja\nAudioausgang: Ja\nKopfh\u00f6rerausg\u00e4nge: 1\nStromeingang: Ja\nVESA-Halterung: Ja\nKabelsperre-Slot: Ja\nH\u00f6henverstellung: Ja\nPanel-Montage-Schnittstelle: 100 x 100 mm\nSlot-Typ Kabelsperre: Kensington\nH\u00f6heneinstellung: 13 cm\nPivot: Ja\nPivot Winkel: 0 - 90\u00b0\nNeigungswinkelbereich: -5 - 40\u00b0\nNeigungsverstellung: Ja\nStromverbrauch (Standardbetrieb): 26,14 W\nStromverbrauch (Standby): 0,5 W\nStromverbrauch (max.): 32,5 W\nAC Eingangsspannung: 100 - 240 V\nAC Eingangsfrequenz: 50/60 Hz\nBetriebstemperatur: 0 - 40 \u00b0C\nRelative Luftfeuchtigkeit in Betrieb: 20 - 90%\nSt\u00e4nder enthalten: Ja\nMitgelieferte Kabel: AC, Audio (3,5 mm), HDMI, USB Typ-A auf USB Typ-B\nSchnellstart\u00fcbersicht: Ja\nGer\u00e4tebreite (inkl. Fu\u00df): 621 mm\nGer\u00e4tetiefe (inkl. Fu\u00df): 206 mm\nGer\u00e4teh\u00f6he (inkl. Fu\u00df): 425,6 mm\nGewicht (mit St\u00e4nder): 7,2 kg\nBreite (ohne Standfu\u00df): 62,1 cm\nTiefe (ohne Standfu\u00df): 5,5 cm\nH\u00f6he (ohne Standfu\u00df): 38,9 cm\nGewicht (ohne St\u00e4nder): 4,8 kg\nPaketgewicht: 10,2 kg\nNachhaltigkeitszertifikate: CE, ENERGY STAR, EPEAT Silver, ErP, REACH, RoHS, WEEE\nWarentarifnummer (HS): 85285210",
    "reference_file": "offer_reference_1157.json",
    "shop_name": "mylemon.at"
}