{
    "html_file": "offer_1033_2.html",
    "name": "Philips Evnia 5000 27M1N5200PA, 27\"",
    "offer_link": "https://www.amazon.de/dp/B09PZ1M612?linkCode=xm2&camp=2025&creative=165953&smid=A3JWKAKR8XB7XF&creativeASIN=B09PZ1M612&tag=geizhals1-21",
    "price": 271.26,
    "raw_specifications": {
        "ASIN": "B09PZ1M612",
        "Amazon Bestseller-Rang": "Nr. 75,448 in Computer & Zubeh\u00f6r (Siehe Top 100 in Computer & Zubeh\u00f6r)  Nr. 1,410 in Monitore",
        "Anzahl HDMI Schnittstellen": "\u200e2",
        "Artikelgewicht": "\u200e2 Kilograms",
        "Batterien enthalten": "\u200eNein",
        "Bildschirmaufl\u00f6sung": "\u200e1920 x 1080 pixels",
        "Display-Gr\u00f6\u00dfe": "\u200e27 Zoll",
        "Durchschnittliche Kundenbewertung": "4,4  4,4 von 5 Sternen    \n    167 Sternebewertungen   \n\n\n 4,4 von 5 Sternen",
        "Farbe": "\u200eschwarz",
        "Garantierte Software-Updates bis": "\u200eunbekannt",
        "Gewicht Lithium-Akku": "\u200e22 Kilogramm",
        "Hersteller": "\u200ePhilips",
        "Im Angebot von Amazon.de seit": "7. Januar 2022",
        "L\u00f6sung": "\u200e1920 x 1080 Pixels",
        "Marke": "\u200ePhilips Monitors",
        "Modell/Serie": "\u200e27M1N5200PA/00",
        "Modellnummer": "\u200e27M1N5200PA/00",
        "Produktabmessungen": "\u200e30 x 30 x 30 cm; 2 Kilogramm",
        "Prozessortyp": "\u200eNone"
    },
    "raw_specifications_text": "Marke: \u200ePhilips Monitors\nHersteller: \u200ePhilips\nModell/Serie: \u200e27M1N5200PA/00\nProduktabmessungen: \u200e30 x 30 x 30 cm; 2 Kilogramm\nModellnummer: \u200e27M1N5200PA/00\nFarbe: \u200eschwarz\nDisplay-Gr\u00f6\u00dfe: \u200e27 Zoll\nBildschirmaufl\u00f6sung: \u200e1920 x 1080 pixels\nL\u00f6sung: \u200e1920 x 1080 Pixels\nProzessortyp: \u200eNone\nAnzahl HDMI Schnittstellen: \u200e2\nBatterien enthalten: \u200eNein\nGewicht Lithium-Akku: \u200e22 Kilogramm\nArtikelgewicht: \u200e2 Kilograms\nGarantierte Software-Updates bis: \u200eunbekannt\nASIN: B09PZ1M612\nDurchschnittliche Kundenbewertung: 4,4  4,4 von 5 Sternen    \n    167 Sternebewertungen   \n\n\n 4,4 von 5 Sternen\nAmazon Bestseller-Rang: Nr. 75,448 in Computer & Zubeh\u00f6r (Siehe Top 100 in Computer & Zubeh\u00f6r)  Nr. 1,410 in Monitore\nIm Angebot von Amazon.de seit: 7. Januar 2022",
    "reference_file": "offer_reference_1033.json",
    "shop_name": "Amazon.at"
}