{
    "html_file": "offer_788_21.html",
    "name": "Fujitsu P-Line P2410 WS, 24.1\"",
    "offer_link": "https://www.alternate.at/Fujitsu/P2410-WS-LED-Monitor/html/product/1814253?partner=AtGeizhalsat&campaign=Monitor/Fujitsu/1814253",
    "price": 445.0,
    "raw_specifications": {
        "": "Kensington-Schloss",
        "Abmessungen": "Breite: 53,23 cm x H\u00f6he: 36,573 cm x Tiefe/L\u00e4nge: 21,27 cm",
        "Anschl\u00fcsse": "1x HDMI-Eingang, (HDMI-Version: 1.4), 1x DisplayPort-Eingang, 1x DisplayPort-Ausgang, (DisplayPort-Version: 1.2), 1x 3,5-mm-Audio-Ausgang, 3x USB-A-3.2 Gen 1 (5 Gbit/s), 1x USB-C 3.2 Gen 1 (5 Gbit/s)",
        "Bild": "Format",
        "Bildschirmaufl\u00f6sung": "1.920 x 1.200 Pixel",
        "Bildschirmdiagonale": "61 cm (24 Zoll)",
        "EAN": "4065221160236",
        "Energieeffizienzklasse (SDR)": "D (A - G)",
        "Energieverbauch pro 1000 Stunden (SDR)": "15 kWh",
        "Ergonomie": "Typ",
        "Farbe": "weinrot",
        "Features": "Low Blue Light, Flimmerfreie LEDs",
        "Geeignet f\u00fcr": "Multimedia",
        "Gewicht": "6,6 kg",
        "Hersteller-Nr.": "S26361-K1698-V160",
        "Lautsprecher": "2 Lautsprecher",
        "Leistungsaufnahme im Bereitschafts- und Aus-Zustand": "0,3 Watt",
        "Leistungsaufnahme im Ein-Zustand bei Standard-Dynamikumfang (SDR)": "14,6 Watt",
        "Standards": "Video",
        "Stromversorgung": "Eco-Off",
        "Typ": "LED-Monitor",
        "Wandhalterung": "VESA kompatibel (100 x 100 mm)",
        "Zubeh\u00f6r": "Vorhanden"
    },
    "raw_specifications_text": "Energieeffizienzklasse (SDR): D (A - G)\nEnergieverbauch pro 1000 Stunden (SDR): 15 kWh\nLeistungsaufnahme im Ein-Zustand bei Standard-Dynamikumfang (SDR): 14,6 Watt\nLeistungsaufnahme im Bereitschafts- und Aus-Zustand: 0,3 Watt\nBildschirmdiagonale: 61 cm (24 Zoll)\nBildschirmaufl\u00f6sung: 1.920 x 1.200 Pixel\nTyp: LED-Monitor\nFarbe: weinrot\nEAN: 4065221160236\nHersteller-Nr.: S26361-K1698-V160\nGeeignet f\u00fcr: Multimedia\nBild: Format\n: Kensington-Schloss\nAnschl\u00fcsse: 1x HDMI-Eingang, (HDMI-Version: 1.4), 1x DisplayPort-Eingang, 1x DisplayPort-Ausgang, (DisplayPort-Version: 1.2), 1x 3,5-mm-Audio-Ausgang, 3x USB-A-3.2 Gen 1 (5 Gbit/s), 1x USB-C 3.2 Gen 1 (5 Gbit/s)\nErgonomie: Typ\nStromversorgung: Eco-Off\nLautsprecher: 2 Lautsprecher\nStandards: Video\nWandhalterung: VESA kompatibel (100 x 100 mm)\nFeatures: Low Blue Light, Flimmerfreie LEDs\nZubeh\u00f6r: Vorhanden\nAbmessungen: Breite: 53,23 cm x H\u00f6he: 36,573 cm x Tiefe/L\u00e4nge: 21,27 cm\nGewicht: 6,6 kg",
    "reference_file": "offer_reference_788.json",
    "shop_name": "Alternate.at"
}