{
    "html_file": "offer_266_5.html",
    "name": "Lenovo L27q-38, 27\"",
    "offer_link": "https://www.e-tec.at/details.php?artnr=366190",
    "price": 254.0,
    "raw_specifications": {
        "AMD FreeSync": "Ja",
        "Adaptive Sync": "Ja",
        "Anschl\u00fcsse - DisplayPort 1.2": "1",
        "Anschl\u00fcsse - HDMI 1.4": "1",
        "Anwendung": "station\u00e4r",
        "Audio": "Lautsprecher (2x 3W),  1x Line-Out",
        "Aufl\u00f6sung": "2560x1440",
        "Beschichtung": "matt (non-glare)",
        "Besonderheiten": "Slim Bezel,  EPEAT Silver,  mechanische Tasten,  Sicherheitsschloss (Kensington),  Unterst\u00fctzung f\u00fcr modulare Webcam (Lenovo LC 50)",
        "Bildwiederholfrequenz": "75Hz",
        "Blickwinkel": "178\u00b0/178\u00b0",
        "Diagonale": "27\"/68.6cm",
        "Ergonomie": "150mm (h\u00f6henverstellbar),  \u00b190\u00b0 (Pivot),  \u00b1360\u00b0 (drehbar),  +22\u00b0/-5\u00b0 (neigbar),  keine Angabe (Schr\u00e4glage)",
        "FRC": "unbekannt",
        "Farbe": "schwarz",
        "Farbraum - sRGB": "99%",
        "Farbtiefe": "8bit (16.7 Mio. Farben)",
        "Form": "gerade (flat)",
        "Gewicht": "5.90kg (mit Standfu\u00df),  3.80kg (ohne Standfu\u00df)",
        "HDR": "N/A",
        "Helligkeit": "350cd/m\u00b2",
        "Herstellergarantie": "drei Jahre (Vor-Ort)",
        "Hintergrundbeleuchtung": "White-LED,  flicker-free,  Blaulichtfilter",
        "Kontrast - dynamisch": "3.000.000:1",
        "Kontrast - statisch": "4.000:1",
        "Lautsprecher": "Ja",
        "Leistungsaufnahme": "52W (maximal),  28W (typisch),  keine Angabe (Energielabel alt A+++ bis G),  0.5W (Standby)",
        "Panel": "VA",
        "Reaktionszeit - GtG": "4ms",
        "Screen-to-Body-Ratio": "89.0% (berechnet)",
        "Seitenverh\u00e4ltnis": "16:9",
        "Signalfrequenz": "keine Angabe (horizontal),  keine Angabe (vertikal)",
        "Stromversorgung": "AC-In (internes Netzteil)",
        "USB-Hub In": "N/A",
        "USB-Hub Out": "N/A",
        "USB-Schreibweise": "Link",
        "VESA": "100x100 (belegt)",
        "Weitere Anschl\u00fcsse": "N/A"
    },
    "raw_specifications_text": "Adaptive Sync: Ja\nAMD FreeSync: Ja\nAnschl\u00fcsse - DisplayPort 1.2: 1\nAnschl\u00fcsse - HDMI 1.4: 1\nAnwendung: station\u00e4r\nAudio: Lautsprecher (2x 3W),  1x Line-Out\nAufl\u00f6sung: 2560x1440\nBeschichtung: matt (non-glare)\nBesonderheiten: Slim Bezel,  EPEAT Silver,  mechanische Tasten,  Sicherheitsschloss (Kensington),  Unterst\u00fctzung f\u00fcr modulare Webcam (Lenovo LC 50)\nBildwiederholfrequenz: 75Hz\nBlickwinkel: 178\u00b0/178\u00b0\nDiagonale: 27\"/68.6cm\nErgonomie: 150mm (h\u00f6henverstellbar),  \u00b190\u00b0 (Pivot),  \u00b1360\u00b0 (drehbar),  +22\u00b0/-5\u00b0 (neigbar),  keine Angabe (Schr\u00e4glage)\nFarbe: schwarz\nFarbraum - sRGB: 99%\nFarbtiefe: 8bit (16.7 Mio. Farben)\nForm: gerade (flat)\nFRC: unbekannt\nGewicht: 5.90kg (mit Standfu\u00df),  3.80kg (ohne Standfu\u00df)\nHDR: N/A\nHelligkeit: 350cd/m\u00b2\nHerstellergarantie: drei Jahre (Vor-Ort)\nHintergrundbeleuchtung: White-LED,  flicker-free,  Blaulichtfilter\nKontrast - dynamisch: 3.000.000:1\nKontrast - statisch: 4.000:1\nLautsprecher: Ja\nLeistungsaufnahme: 52W (maximal),  28W (typisch),  keine Angabe (Energielabel alt A+++ bis G),  0.5W (Standby)\nPanel: VA\nReaktionszeit - GtG: 4ms\nScreen-to-Body-Ratio: 89.0% (berechnet)\nSeitenverh\u00e4ltnis: 16:9\nSignalfrequenz: keine Angabe (horizontal),  keine Angabe (vertikal)\nStromversorgung: AC-In (internes Netzteil)\nUSB-Hub In: N/A\nUSB-Hub Out: N/A\nUSB-Schreibweise: Link\nVESA: 100x100 (belegt)\nWeitere Anschl\u00fcsse: N/A",
    "reference_file": "offer_reference_266.json",
    "shop_name": "e-tec.at"
}