{
    "html_file": "offer_1153_6.html",
    "name": "AOC Q27G2S/EU, 27\"",
    "offer_link": "https://www.csv-direct.de/artinfo.php?artnr=A1621160&KATEGORIE=162&pva=geizhals2",
    "price": 252.28,
    "raw_specifications": {
        "AC Eingangsfrequenz": "50 - 60 Hz",
        "AC Eingangsspannung": "100 - 240 V",
        "AMD FreeSync Bildwiederholratenbereich": "48 - 165 Hz",
        "Adobe RGB-Abdeckung": "112",
        "Anzahl DisplayPort Anschl\u00fcsse": "1",
        "Anzahl HDMI-Anschl\u00fcsse": "2",
        "Anzahl OSD-Sprachen": "18",
        "Anzahl der Farben des Displays": "1,07 Milliarden Farben",
        "Au\u00dfenverkleidungstyp": "Matt",
        "Bildschirmdiagonale": "68,6 cm 27\"",
        "Bildschirmdiagonale cm": "68,8 cm",
        "Bildschirmform": "Flach",
        "Bildschirmtechnologie": "LED",
        "Bildwinkel, horizontal": "178\u00b0",
        "Bildwinkel, vertikal": "178\u00b0",
        "Breite ohne Standfu\u00df": "611,8 mm",
        "Display-Aufl\u00f6sung": "2560 x 1440 Pixel",
        "DisplayPort Kabell\u00e4nge": "1,8 m",
        "DisplayPorts-Version": "1.4",
        "Eingebaute Lautsprecher": "Nein",
        "Energieeffizienzklasse HDR": "G",
        "Energieeffizienzklasse SDR": "F",
        "Energieeffizienzskala": "A bis G",
        "Energieverbrauch HDR pro 1.000 Stunden": "63 kWh",
        "Energieverbrauch SDR pro 1.000 Stunden": "26 kWh",
        "Externes Netzteil": "Nein",
        "Farbpalette DCI-P3": "104",
        "Farbtiefe": "10 Bit",
        "Ger\u00e4tebreite inkl. Fu\u00df": "611,8 mm",
        "Ger\u00e4teh\u00f6he inkl. Fu\u00df": "528,6 mm",
        "Ger\u00e4tetiefe inkl. Fu\u00df": "227,4 mm",
        "Gewicht mit St\u00e4nder": "5,6 kg",
        "Gewicht ohne St\u00e4nder": "4,5 kg",
        "HD-Typ": "Quad HD",
        "HDCP-Version": "2.2",
        "HDMI-Kabell\u00e4nge": "1,8 m",
        "HDMI-Version": "2.0",
        "Helligkeit typisch": "350 cd/m\u00b2",
        "Horizontaler Scanbereich": "30 - 230 kHz",
        "H\u00f6he ohne Standfu\u00df": "365,8 mm",
        "H\u00f6heneinstellung": "13 cm",
        "Integrierte Kamera": "Nein",
        "Integrierter USB-Hub": "Nein",
        "Kontrastverh\u00e4ltnis": "1000:1",
        "Kontrastverh\u00e4ltnis dynamisch": "80000000:1",
        "Kopfh\u00f6rer-Anschluss": "3,5 mm",
        "Marktpositionierung": "Gaming",
        "Maximale Bildwiederholrate": "165 Hz",
        "Men\u00fcsprachen": "Vereinfachtes Chinesisch, Traditionelles Chinesisch, Kroatisch, Tschechisch, Deutsch, Niederl\u00e4ndisch, Englisch, Spanisch, Finnisch, Franz\u00f6sisch, Italienisch, Japanisch, Koreanisch, Polnisch, Portugiesisch, Russisch, Schwedisch, T\u00fcrkisch, Ukrainisch",
        "Mitgelieferte Kabel": "AC",
        "NTSC Abdeckung typisch": "114",
        "NVIDIA G-SYNC-Typ": "G-SYNC Compatible",
        "Nachhaltigkeitszertifikate": "CE",
        "Natives Seitenverh\u00e4ltnis": "16:9",
        "Neigungswinkelbereich": "-5 - 23\u00b0",
        "Oberfl\u00e4chenh\u00e4rte": "3H",
        "Paketgewicht": "7,93 kg",
        "Panel-Montage-Schnittstelle": "100 x 100 mm",
        "Panel-Typ": "IPS",
        "Pivot Winkel": "-90 - 90\u00b0",
        "Pixel Abstand": "0,2331 x 0,2331 mm",
        "Pixeldichte": "109 ppi",
        "Produktfarbe": "Schwarz, Rot",
        "Reaktionszeit": "1 ms",
        "Reaktionszeit schnell": "1 ms",
        "Schwenkwinkelbereich": "-30 - 30\u00b0",
        "Sichtbare Gr\u00f6\u00dfe horizontal": "59,7 cm",
        "Sichtbare Gr\u00f6\u00dfe vertikal": "33,6 cm",
        "Slot-Typ Kabelsperre": "Kensington",
        "Stromverbrauch Standardbetrieb": "27 W",
        "Stromverbrauch Standby": "0,5 W",
        "Stromverbrauch aus": "0,3 W",
        "Tiefe ohne Standfu\u00df": "49,2 mm",
        "Touchscreen": "Nein",
        "Typ der Hintergrundbeleuchtung": "W-LED",
        "Verpackungsart": "Box",
        "Verpackungsbreite": "730 mm",
        "Verpackungsh\u00f6he": "520 mm",
        "Verpackungstiefe": "187 mm",
        "Vorderer Rahmen": "Schwarz",
        "Warentarifnummer HS": "85285210",
        "Zertifizierung": "ISO 9241-307",
        "sRGB Abdeckung klassisch": "131"
    },
    "raw_specifications_text": "Bildschirmdiagonale: 68,6 cm 27\"\nDisplay-Aufl\u00f6sung: 2560 x 1440 Pixel\nNatives Seitenverh\u00e4ltnis: 16:9\nBildschirmtechnologie: LED\nTouchscreen: Nein\nHD-Typ: Quad HD\nPanel-Typ: IPS\nBildschirmform: Flach\nKontrastverh\u00e4ltnis: 1000:1\nMaximale Bildwiederholrate: 165 Hz\nAnzahl der Farben des Displays: 1,07 Milliarden Farben\nTyp der Hintergrundbeleuchtung: W-LED\nHelligkeit typisch: 350 cd/m\u00b2\nReaktionszeit: 1 ms\nKontrastverh\u00e4ltnis dynamisch: 80000000:1\nBildwinkel, horizontal: 178\u00b0\nBildwinkel, vertikal: 178\u00b0\nReaktionszeit schnell: 1 ms\nPixel Abstand: 0,2331 x 0,2331 mm\nPixeldichte: 109 ppi\nHorizontaler Scanbereich: 30 - 230 kHz\nSichtbare Gr\u00f6\u00dfe horizontal: 59,7 cm\nSichtbare Gr\u00f6\u00dfe vertikal: 33,6 cm\nBildschirmdiagonale cm: 68,8 cm\nOberfl\u00e4chenh\u00e4rte: 3H\nFarbtiefe: 10 Bit\nsRGB Abdeckung klassisch: 131\nNTSC Abdeckung typisch: 114\nAdobe RGB-Abdeckung: 112\nNVIDIA G-SYNC-Typ: G-SYNC Compatible\nAMD FreeSync Bildwiederholratenbereich: 48 - 165 Hz\nEingebaute Lautsprecher: Nein\nIntegrierte Kamera: Nein\nMarktpositionierung: Gaming\nProduktfarbe: Schwarz, Rot\nVorderer Rahmen: Schwarz\nZertifizierung: ISO 9241-307\nIntegrierter USB-Hub: Nein\nAnzahl HDMI-Anschl\u00fcsse: 2\nHDMI-Version: 2.0\nAnzahl DisplayPort Anschl\u00fcsse: 1\nDisplayPorts-Version: 1.4\nKopfh\u00f6rer-Anschluss: 3,5 mm\nHDCP-Version: 2.2\nPanel-Montage-Schnittstelle: 100 x 100 mm\nSlot-Typ Kabelsperre: Kensington\nH\u00f6heneinstellung: 13 cm\nPivot Winkel: -90 - 90\u00b0\nSchwenkwinkelbereich: -30 - 30\u00b0\nNeigungswinkelbereich: -5 - 23\u00b0\nMen\u00fcsprachen: Vereinfachtes Chinesisch, Traditionelles Chinesisch, Kroatisch, Tschechisch, Deutsch, Niederl\u00e4ndisch, Englisch, Spanisch, Finnisch, Franz\u00f6sisch, Italienisch, Japanisch, Koreanisch, Polnisch, Portugiesisch, Russisch, Schwedisch, T\u00fcrkisch, Ukrainisch\nAnzahl OSD-Sprachen: 18\nEnergieeffizienzklasse SDR: F\nEnergieeffizienzklasse HDR: G\nEnergieverbrauch SDR pro 1.000 Stunden: 26 kWh\nEnergieverbrauch HDR pro 1.000 Stunden: 63 kWh\nStromverbrauch Standardbetrieb: 27 W\nStromverbrauch Standby: 0,5 W\nStromverbrauch aus: 0,3 W\nAC Eingangsspannung: 100 - 240 V\nAC Eingangsfrequenz: 50 - 60 Hz\nEnergieeffizienzskala: A bis G\nExternes Netzteil: Nein\nMitgelieferte Kabel: AC\nDisplayPort Kabell\u00e4nge: 1,8 m\nHDMI-Kabell\u00e4nge: 1,8 m\nGer\u00e4tebreite inkl. Fu\u00df: 611,8 mm\nGer\u00e4tetiefe inkl. Fu\u00df: 227,4 mm\nGer\u00e4teh\u00f6he inkl. Fu\u00df: 528,6 mm\nGewicht mit St\u00e4nder: 5,6 kg\nBreite ohne Standfu\u00df: 611,8 mm\nTiefe ohne Standfu\u00df: 49,2 mm\nH\u00f6he ohne Standfu\u00df: 365,8 mm\nGewicht ohne St\u00e4nder: 4,5 kg\nVerpackungsbreite: 730 mm\nVerpackungstiefe: 187 mm\nVerpackungsh\u00f6he: 520 mm\nPaketgewicht: 7,93 kg\nVerpackungsart: Box\nNachhaltigkeitszertifikate: CE\nWarentarifnummer HS: 85285210\nFarbpalette DCI-P3: 104\nAu\u00dfenverkleidungstyp: Matt",
    "reference_file": "offer_reference_1153.json",
    "shop_name": "CSV-Direct.de"
}