{
    "html_file": "offer_611_4.html",
    "name": "Dell Alienware AW3423DWF, 34.18\"",
    "offer_link": "https://www.playox.de/productredirect/index/sku/26034225?sPartner=p-geizhals-at&campaign=psm/geizhals-at/",
    "price": 997.3,
    "raw_specifications": {
        "Anschl\u00fcsse": "USB, DisplayPort, HDMI, Kopfh\u00f6reranschluss, Audioausgang (Line-Out)",
        "Artikelnummer": "26034225",
        "Aufl\u00f6sung Kurzname": "UHD",
        "Bezeichnung des Herstellers": "Alienware AW3423DWF",
        "Bildwiederholungsrate": "165,00",
        "Breite": "81525,00",
        "Display Features": "3D ready",
        "Display Sync": "AMD FreeSync",
        "Displaygr\u00f6\u00dfe": "86,36 cm (34 Zoll)",
        "Displayoberfl\u00e4che": "matt",
        "EEK - Spektrum": "AG",
        "Einsatzort": "Innen",
        "Energieeffizienzklasse": "G",
        "Geh\u00e4usefarbe des Ger\u00e4tes": "Schwarz",
        "Gewicht": "15,90",
        "Gewicht inkl. Verpackung in Kg": "14,57",
        "Helligkeit Bereich": "ab 450 cd/m\u00b2",
        "Hersteller": "Dell",
        "H\u00f6he": "41557,00",
        "Kapazit\u00e4t (Seiten)": "0",
        "Kontrastverh\u00e4ltnis (typisch) Bereich": "ab 1.200:1",
        "LCD-Technologie": "OLED",
        "L\u00e4nge": "30571,00",
        "Produktart": "Monitore",
        "Reaktionszeit": "1,00",
        "Seitenverh\u00e4ltnis": "21:9",
        "Shop Herstellernummer": "210-BFRQ",
        "Standard-EAN": "5397184657157",
        "max. Aufl\u00f6sung": "3.440 x 1.440 Pixel (21:9)",
        "t\u00e4gliche Laufzeit Bereich": "< 14 Std."
    },
    "raw_specifications_text": "Displaygr\u00f6\u00dfe: 86,36 cm (34 Zoll)\nGeh\u00e4usefarbe des Ger\u00e4tes: Schwarz\nAnschl\u00fcsse: USB, DisplayPort, HDMI, Kopfh\u00f6reranschluss, Audioausgang (Line-Out)\nProduktart: Monitore\nKontrastverh\u00e4ltnis (typisch) Bereich: ab 1.200:1\nHersteller: Dell\nDisplay Features: 3D ready\nHelligkeit Bereich: ab 450 cd/m\u00b2\nt\u00e4gliche Laufzeit Bereich: < 14 Std.\nDisplay Sync: AMD FreeSync\nKapazit\u00e4t (Seiten): 0\nEEK - Spektrum: AG\nAufl\u00f6sung Kurzname: UHD\nArtikelnummer: 26034225\nStandard-EAN: 5397184657157\nShop Herstellernummer: 210-BFRQ\nBezeichnung des Herstellers: Alienware AW3423DWF\nBreite: 81525,00\nH\u00f6he: 41557,00\nL\u00e4nge: 30571,00\nGewicht: 15,90\nGewicht inkl. Verpackung in Kg: 14,57\nmax. Aufl\u00f6sung: 3.440 x 1.440 Pixel (21:9)\nSeitenverh\u00e4ltnis: 21:9\nLCD-Technologie: OLED\nReaktionszeit: 1,00\nDisplayoberfl\u00e4che: matt\nBildwiederholungsrate: 165,00\nEinsatzort: Innen\nEnergieeffizienzklasse: G",
    "reference_file": "offer_reference_611.json",
    "shop_name": "playox (AT)"
}