{
    "html_file": "offer_594_38.html",
    "name": "Samsung Odyssey G7 G70B, 32\"",
    "offer_link": "https://www.proshop.at/Bildschirm/Samsung-32-Bildschirm-Odyssey-G7-3840x2160-4k-UHD-144Hz-IPS-Black-1-ms-AMD-FreeSync-2/3131713?utm_source=geizhals&utm_medium=cpc&utm_campaign=pricesite",
    "price": 806.02,
    "raw_specifications": {
        "Abmessungen (Breite x Tiefe x H\u00f6he)": "71.46 cm x 31.11 cm x 60.26 cm - mit Fu\u00df",
        "Abmessungen (Breite x Tiefe x H\u00f6he) - mit Fu\u00df": "71.46 cm x 31.11 cm x 60.26 cm",
        "Adaptive-Sync Technologie": "NVIDIA G-SYNC, AMD FreeSync Premium Pro",
        "Besonderheiten": "Spielmodus, ConnectShare, Eco Light Sensor, Smart Hub, flimmerfreie Technologie, Image Size, Eye Saver Mode, DLNA, an 3 Seiten ohne Blende, Auto Source Switch+, Adaptive Picture, Ultrawide Game View, Tap View, Sound Mirroring, CoreSync-Beleuchtungsdesign, Adaptive Sound, Game Bar 2.0, Far-Field Voice Interaction, Virtual AIM Point, Bixby Voice Assistant, Mobile to Screen Mirroring, Gaming Hub, Workspace",
        "Betriebssystem": "Tizen",
        "Bildschirmtyp": "IPS",
        "Details zu Abmessungen & Gewicht": "Mit Fu\u00df - Breite: 71.46 cm - Tiefe: 31.11 cm - H\u00f6he: 60.26 cm - Gewicht: 8.3 kg  Ohne Fu\u00df - Breite: 71.46 cm - Tiefe: 12.59 cm - H\u00f6he: 44.11 cm - Gewicht: 6.4 kg",
        "Diagonalabmessung": "80 cm (32\")",
        "Display-Typ": "LED-hintergrundbeleuchteter LCD-Monitor / TFT-Aktivmatrix - Smart Monitor",
        "EAN": "8806094138818",
        "Eingangsanschl\u00fcsse": "2xHDMI, DisplayPort",
        "Einstellungen der Anzeigeposition": "H\u00f6he, Pivot (Rotation), Drehung, Neigung",
        "Energie Effizienzklasse": "Klasse G",
        "Energieklasse (HDR)": "Klasse G",
        "Enthaltene Kabel": "1 x DisplayPort-Kabel",
        "Ethernet integriert": "Ja",
        "Farbe": "Schwarz",
        "Farbunterst\u00fctzung": "1 Milliarde Farben",
        "Gaming": "Ja",
        "Ger\u00e4tetyp": "LED-hintergrundbeleuchteter LCD-Monitor - 80 cm (32\") - Smart Monitor",
        "Gewicht": "8.3 kg",
        "HDR-Format": "HDR400",
        "HDR-Zertifizierung": "DisplayHDR 400",
        "HDR-f\u00e4hig": "HDR400 / DisplayHDR 400",
        "Helligkeit": "350 cd/m\u00b2",
        "Hersteller": "Samsung",
        "Hintergrundbeleuchtungs-Technologie": "WLED Edgelight-Hintergrundbeleuchtung",
        "Horizontaler Betrachtungswinkel": "178",
        "H\u00f6heneinstellung": "120 mm",
        "Integrierte Peripherieger\u00e4te": "Wi-Fi, USB 3.0-Hub, Bluetooth-Adapter",
        "Kennzeichnung": "CE/EMC, ISO 9241-307 Class 2, 2012/19/EU",
        "Kontrast": "1000:1",
        "Leistungsmerkmale": "Wi-Fi, USB 3.0-Hub, Bluetooth-Adapter",
        "Mitgelieferte Software": "SmartThings, Samsung TV Plus, Google Duo, Apple AirPlay 2",
        "Modell": "LS32BG700EUXEN",
        "Native Aufl\u00f6sung": "4K 3840 x 2160 bei 144 Hz",
        "Neigungswinkel": "-9.02/+13.09",
        "Produktbeschreibung": "Samsung Odyssey G7 S32BG700EU - G70B Series - LED-Monitor - 4K - 80 cm (32\") - HDR",
        "Reaktionszeit": "1 ms (Gray-to-Gray)",
        "Schnittstellen": "2 x HDMI  DisplayPort 1.4  Kopfh\u00f6rer  2 x USB 3.0  Kopfh\u00f6rer  LAN",
        "Schwenkwinkel": "30",
        "Seitenverh\u00e4ltnis": "16:9",
        "Stromverbrauch (typisch)": "33 Watt",
        "Stromverbrauch HDR (eingeschaltet)": "61 kWh/1.000 h",
        "Stromverbrauch SDR (eingeschaltet)": "33 kWh/1.000 h",
        "Stromverbrauch im Standby-Modus": "0.5 Watt",
        "Transportbreite": "79.8 cm",
        "Transportgewicht": "11 kg",
        "Transporth\u00f6he": "17.6 cm",
        "Transporttiefe": "54.5 cm",
        "Typ": "Lautsprecher",
        "VESA-Halterung": "100 x 100 mm",
        "Vertikaler Betrachtungswinkel": "178",
        "Waren-Nr.": "3131713",
        "Zubeh\u00f6r im Lieferumfang": "Fernbedienung",
        "Zum Hersteller": "www.samsung.com"
    },
    "raw_specifications_text": "Hersteller: Samsung\nWaren-Nr.: 3131713\nModell: LS32BG700EUXEN\nEAN: 8806094138818\nZum Hersteller: www.samsung.com\nProduktbeschreibung: Samsung Odyssey G7 S32BG700EU - G70B Series - LED-Monitor - 4K - 80 cm (32\") - HDR\nGer\u00e4tetyp: LED-hintergrundbeleuchteter LCD-Monitor - 80 cm (32\") - Smart Monitor\nEnergie Effizienzklasse: Klasse G\nAdaptive-Sync Technologie: NVIDIA G-SYNC, AMD FreeSync Premium Pro\nLeistungsmerkmale: Wi-Fi, USB 3.0-Hub, Bluetooth-Adapter\nBildschirmtyp: IPS\nSeitenverh\u00e4ltnis: 16:9\nNative Aufl\u00f6sung: 4K 3840 x 2160 bei 144 Hz\nHelligkeit: 350 cd/m\u00b2\nKontrast: 1000:1\nHDR-f\u00e4hig: HDR400 / DisplayHDR 400\nReaktionszeit: 1 ms (Gray-to-Gray)\nGaming: Ja\nFarbunterst\u00fctzung: 1 Milliarde Farben\nEingangsanschl\u00fcsse: 2xHDMI, DisplayPort\nEthernet integriert: Ja\nEinstellungen der Anzeigeposition: H\u00f6he, Pivot (Rotation), Drehung, Neigung\nFarbe: Schwarz\nAbmessungen (Breite x Tiefe x H\u00f6he) - mit Fu\u00df: 71.46 cm x 31.11 cm x 60.26 cm\nGewicht: 8.3 kg\nKennzeichnung: CE/EMC, ISO 9241-307 Class 2, 2012/19/EU\nDisplay-Typ: LED-hintergrundbeleuchteter LCD-Monitor / TFT-Aktivmatrix - Smart Monitor\nEnergieklasse (HDR): Klasse G\nDiagonalabmessung: 80 cm (32\")\nBetriebssystem: Tizen\nIntegrierte Peripherieger\u00e4te: Wi-Fi, USB 3.0-Hub, Bluetooth-Adapter\nHDR-Format: HDR400\nHDR-Zertifizierung: DisplayHDR 400\nHorizontaler Betrachtungswinkel: 178\nVertikaler Betrachtungswinkel: 178\nHintergrundbeleuchtungs-Technologie: WLED Edgelight-Hintergrundbeleuchtung\nBesonderheiten: Spielmodus, ConnectShare, Eco Light Sensor, Smart Hub, flimmerfreie Technologie, Image Size, Eye Saver Mode, DLNA, an 3 Seiten ohne Blende, Auto Source Switch+, Adaptive Picture, Ultrawide Game View, Tap View, Sound Mirroring, CoreSync-Beleuchtungsdesign, Adaptive Sound, Game Bar 2.0, Far-Field Voice Interaction, Virtual AIM Point, Bixby Voice Assistant, Mobile to Screen Mirroring, Gaming Hub, Workspace\nAbmessungen (Breite x Tiefe x H\u00f6he): 71.46 cm x 31.11 cm x 60.26 cm - mit Fu\u00df\nTyp: Lautsprecher\nSchnittstellen: 2 x HDMI  DisplayPort 1.4  Kopfh\u00f6rer  2 x USB 3.0  Kopfh\u00f6rer  LAN\nNeigungswinkel: -9.02/+13.09\nSchwenkwinkel: 30\nH\u00f6heneinstellung: 120 mm\nVESA-Halterung: 100 x 100 mm\nZubeh\u00f6r im Lieferumfang: Fernbedienung\nEnthaltene Kabel: 1 x DisplayPort-Kabel\nStromverbrauch SDR (eingeschaltet): 33 kWh/1.000 h\nStromverbrauch HDR (eingeschaltet): 61 kWh/1.000 h\nStromverbrauch (typisch): 33 Watt\nStromverbrauch im Standby-Modus: 0.5 Watt\nMitgelieferte Software: SmartThings, Samsung TV Plus, Google Duo, Apple AirPlay 2\nDetails zu Abmessungen & Gewicht: Mit Fu\u00df - Breite: 71.46 cm - Tiefe: 31.11 cm - H\u00f6he: 60.26 cm - Gewicht: 8.3 kg  Ohne Fu\u00df - Breite: 71.46 cm - Tiefe: 12.59 cm - H\u00f6he: 44.11 cm - Gewicht: 6.4 kg\nTransportbreite: 79.8 cm\nTransporttiefe: 54.5 cm\nTransporth\u00f6he: 17.6 cm\nTransportgewicht: 11 kg",
    "reference_file": "offer_reference_594.json",
    "shop_name": "Proshop.at"
}