{
    "html_file": "offer_850_38.html",
    "name": "Samsung Odyssey G4 G4B / G40B, 25\"",
    "offer_link": "https://www.proshop.at/Bildschirm/Samsung-25-Bildschirm-Odyssey-G4-1920x1080-FHD-240Hz-IPS-Black-1-ms-AMD-FreeSync-Premium/3093079?utm_source=geizhals&utm_medium=cpc&utm_campaign=pricesite",
    "price": 236.82,
    "raw_specifications": {
        "Abmessungen (Breite x Tiefe x H\u00f6he)": "55.85 cm x 24.48 cm x 55.29 cm - mit Fu\u00df",
        "Abmessungen (Breite x Tiefe x H\u00f6he) - mit Fu\u00df": "55.85 cm x 24.48 cm x 55.29 cm",
        "Adaptive-Sync Technologie": "NVIDIA G-SYNC Compatible, AMD FreeSync Premium",
        "Besonderheiten": "Cinema Mode, Eco Light Sensor, CustomColor Mode, FPS Mode, Mega Infinity Dynamic Contrast Ratio, RTS Mode, Eco Saving Plus, Eye Saver Mode, Sportmodus, Niedrige Eingangsverz\u00f6gerung, Refresh Rate Optimizer, RPG Mode, sRGB Mode, Off Timer, AOC Flicker-Free Technology, Dynamic Contrast Mode, Super Arena Gaming Experience, Auto Source Switch+, Adaptive Picture, Ultrawide Game View, ergonomischer St\u00e4nder, Virtual AIM Point, Darkness Compensation",
        "Bildschirmtyp": "IPS",
        "Details zu Abmessungen & Gewicht": "Mit Fu\u00df - Breite: 55.85 cm - Tiefe: 24.48 cm - H\u00f6he: 55.29 cm - Gewicht: 4.5 kg  Ohne Fu\u00df - Breite: 55.85 cm - Tiefe: 8.54 cm - H\u00f6he: 34.11 cm - Gewicht: 2.8 kg",
        "Diagonalabmessung": "62 cm (25\")",
        "Display-Typ": "LED-hintergrundbeleuchteter LCD-Monitor / TFT-Aktivmatrix",
        "EAN": "8806094341850",
        "Eingangsanschl\u00fcsse": "2xHDMI, DisplayPort",
        "Eingangsspannung": "Wechselstrom 100-240 V (50/60 Hz)",
        "Einstellungen der Anzeigeposition": "H\u00f6he, Pivot (Rotation), Drehung, Neigung",
        "Energie Effizienzklasse": "Klasse E",
        "Energieklasse (HDR)": "Klasse G",
        "Energieverbrauch pro Jahr": "26 kWh",
        "Enthaltene Kabel": "1 x HDMI-Kabel",
        "Farbe": "Schwarz",
        "Farbraum": "99% sRGB",
        "Farbunterst\u00fctzung": "16,7 Millionen Farben",
        "Ger\u00e4tetyp": "LED-hintergrundbeleuchteter LCD-Monitor - 62 cm (25\")",
        "Gewicht": "4.5 kg",
        "HDR-Format": "HDR10",
        "HDR-f\u00e4hig": "HDR10",
        "Helligkeit": "400 cd/m\u00b2",
        "Hersteller": "Samsung",
        "Hintergrundbeleuchtungs-Technologie": "LED-Hintergrundbeleuchtung",
        "Horizontaler Betrachtungswinkel": "178",
        "H\u00f6heneinstellung": "120 mm",
        "Kennzeichnung": "HDCP 2.2",
        "Kontrast": "1000:1",
        "Modell": "LS25BG400EUXEN",
        "Native Aufl\u00f6sung": "Full HD (1080p) 1920 x 1080 bei 240 Hz",
        "Neigungswinkel": "-3/+22",
        "Produktbeschreibung": "Samsung Odyssey G4 S25BG400EU - LED-Monitor - Full HD (1080p) - 62 cm (25\") - HDR",
        "Reaktionszeit": "1 ms (Gray-to-Gray)",
        "Rotationswinkel": "-92/+92",
        "Schnittstellen": "DisplayPort 1.2  2 x HDMI  Kopfh\u00f6rer",
        "Schwenkwinkel": "30",
        "Seitenverh\u00e4ltnis": "16:9",
        "Spannung": "Wechselstrom 100-240 V (50/60 Hz)",
        "Stromverbrauch (Aus-Modus)": "0.3 Watt",
        "Stromverbrauch (max.)": "35 Watt",
        "Stromverbrauch (typisch)": "18 Watt",
        "Stromverbrauch HDR (eingeschaltet)": "31 kWh/1.000 h",
        "Stromverbrauch SDR (eingeschaltet)": "18 kWh/1.000 h",
        "Stromverbrauch im Standby-Modus": "0.5 Watt",
        "Transportbreite": "62.8 cm",
        "Transportgewicht": "6 kg",
        "Transporth\u00f6he": "16.3 cm",
        "Transporttiefe": "42.9 cm",
        "VESA-Halterung": "100 x 100 mm",
        "Vertikaler Betrachtungswinkel": "178",
        "Waren-Nr.": "3093079",
        "Zum Hersteller": "www.samsung.com"
    },
    "raw_specifications_text": "Hersteller: Samsung\nWaren-Nr.: 3093079\nModell: LS25BG400EUXEN\nEAN: 8806094341850\nZum Hersteller: www.samsung.com\nProduktbeschreibung: Samsung Odyssey G4 S25BG400EU - LED-Monitor - Full HD (1080p) - 62 cm (25\") - HDR\nGer\u00e4tetyp: LED-hintergrundbeleuchteter LCD-Monitor - 62 cm (25\")\nEnergie Effizienzklasse: Klasse E\nEnergieverbrauch pro Jahr: 26 kWh\nAdaptive-Sync Technologie: NVIDIA G-SYNC Compatible, AMD FreeSync Premium\nBildschirmtyp: IPS\nSeitenverh\u00e4ltnis: 16:9\nNative Aufl\u00f6sung: Full HD (1080p) 1920 x 1080 bei 240 Hz\nHelligkeit: 400 cd/m\u00b2\nKontrast: 1000:1\nHDR-f\u00e4hig: HDR10\nReaktionszeit: 1 ms (Gray-to-Gray)\nFarbunterst\u00fctzung: 16,7 Millionen Farben\nFarbraum: 99% sRGB\nEingangsanschl\u00fcsse: 2xHDMI, DisplayPort\nEinstellungen der Anzeigeposition: H\u00f6he, Pivot (Rotation), Drehung, Neigung\nSpannung: Wechselstrom 100-240 V (50/60 Hz)\nFarbe: Schwarz\nAbmessungen (Breite x Tiefe x H\u00f6he) - mit Fu\u00df: 55.85 cm x 24.48 cm x 55.29 cm\nGewicht: 4.5 kg\nKennzeichnung: HDCP 2.2\nDisplay-Typ: LED-hintergrundbeleuchteter LCD-Monitor / TFT-Aktivmatrix\nEnergieklasse (HDR): Klasse G\nDiagonalabmessung: 62 cm (25\")\nHDR-Format: HDR10\nHorizontaler Betrachtungswinkel: 178\nVertikaler Betrachtungswinkel: 178\nHintergrundbeleuchtungs-Technologie: LED-Hintergrundbeleuchtung\nBesonderheiten: Cinema Mode, Eco Light Sensor, CustomColor Mode, FPS Mode, Mega Infinity Dynamic Contrast Ratio, RTS Mode, Eco Saving Plus, Eye Saver Mode, Sportmodus, Niedrige Eingangsverz\u00f6gerung, Refresh Rate Optimizer, RPG Mode, sRGB Mode, Off Timer, AOC Flicker-Free Technology, Dynamic Contrast Mode, Super Arena Gaming Experience, Auto Source Switch+, Adaptive Picture, Ultrawide Game View, ergonomischer St\u00e4nder, Virtual AIM Point, Darkness Compensation\nAbmessungen (Breite x Tiefe x H\u00f6he): 55.85 cm x 24.48 cm x 55.29 cm - mit Fu\u00df\nSchnittstellen: DisplayPort 1.2  2 x HDMI  Kopfh\u00f6rer\nNeigungswinkel: -3/+22\nSchwenkwinkel: 30\nRotationswinkel: -92/+92\nH\u00f6heneinstellung: 120 mm\nVESA-Halterung: 100 x 100 mm\nEnthaltene Kabel: 1 x HDMI-Kabel\nEingangsspannung: Wechselstrom 100-240 V (50/60 Hz)\nStromverbrauch SDR (eingeschaltet): 18 kWh/1.000 h\nStromverbrauch HDR (eingeschaltet): 31 kWh/1.000 h\nStromverbrauch (typisch): 18 Watt\nStromverbrauch (max.): 35 Watt\nStromverbrauch im Standby-Modus: 0.5 Watt\nStromverbrauch (Aus-Modus): 0.3 Watt\nDetails zu Abmessungen & Gewicht: Mit Fu\u00df - Breite: 55.85 cm - Tiefe: 24.48 cm - H\u00f6he: 55.29 cm - Gewicht: 4.5 kg  Ohne Fu\u00df - Breite: 55.85 cm - Tiefe: 8.54 cm - H\u00f6he: 34.11 cm - Gewicht: 2.8 kg\nTransportbreite: 62.8 cm\nTransporttiefe: 42.9 cm\nTransporth\u00f6he: 16.3 cm\nTransportgewicht: 6 kg",
    "reference_file": "offer_reference_850.json",
    "shop_name": "Proshop.at"
}