{
    "html_file": "offer_1046_18.html",
    "name": "AOC Agon Pro AG274QS, 27\"",
    "offer_link": "https://www.alternate.at/AOC/AGON-Pro-AG274QS-Gaming-Monitor/html/product/1823791?partner=AtGeizhalsat&campaign=Monitor/AOC/1823791",
    "price": 960.0,
    "raw_specifications": {
        "": "Adaptive-Sync, NVIDIA G-Sync kompatibel",
        "Abmessungen": "Breite: 61,29 cm x H\u00f6he: 54,73 cm x Tiefe/L\u00e4nge: 35,21 cm",
        "Anschl\u00fcsse": "2x HDMI-Eingang, (HDMI-Version: 2.0), 2x DisplayPort-Eingang, (DisplayPort-Version: 1.4), 1x 3,5-mm-Audio-Ausgang, 4x USB-A-3.2 Gen 1 (5 Gbit/s)",
        "Bild": "Format",
        "Bildschirmaufl\u00f6sung": "2.560 x 1.440 Pixel",
        "Bildschirmdiagonale": "69 cm (27 Zoll)",
        "EAN": "4038986120067",
        "Energieeffizienzklasse (HDR)": "G (A - G)",
        "Energieeffizienzklasse (SDR)": "G (A - G)",
        "Energieverbauch pro 1000 Stunden (HDR)": "60 kWh",
        "Energieverbauch pro 1000 Stunden (SDR)": "32 kWh",
        "Ergonomie": "Typ",
        "Farbe": "schwarz/rot",
        "Features": "Low Blue Light, Flicker-Free LED",
        "Geeignet f\u00fcr": "Gaming",
        "Gewicht": "7,6 kg",
        "Hersteller-Nr.": "AG274QS",
        "Lautsprecher": "2 Lautsprecher",
        "Leistungsaufnahme im Bereitschafts- und Aus-Zustand": "0,5 Watt",
        "Leistungsaufnahme im Ein-Zustand bei Standard-Dynamikumfang (SDR)": "32 Watt",
        "Leistungsaufnahme im Ein-Zustand bei hohem Dynamikumfang (HDR)": "60 Watt",
        "Serie": "AGON4",
        "Stromversorgung": "Eco-Off",
        "Typ": "Gaming-Monitor",
        "Wandhalterung": "VESA kompatibel (100 x 100 mm)",
        "Zubeh\u00f6r": "Vorhanden"
    },
    "raw_specifications_text": "Energieeffizienzklasse (SDR): G (A - G)\nEnergieverbauch pro 1000 Stunden (SDR): 32 kWh\nEnergieeffizienzklasse (HDR): G (A - G)\nEnergieverbauch pro 1000 Stunden (HDR): 60 kWh\nLeistungsaufnahme im Ein-Zustand bei Standard-Dynamikumfang (SDR): 32 Watt\nLeistungsaufnahme im Ein-Zustand bei hohem Dynamikumfang (HDR): 60 Watt\nLeistungsaufnahme im Bereitschafts- und Aus-Zustand: 0,5 Watt\nBildschirmdiagonale: 69 cm (27 Zoll)\nBildschirmaufl\u00f6sung: 2.560 x 1.440 Pixel\nTyp: Gaming-Monitor\nFarbe: schwarz/rot\nEAN: 4038986120067\nHersteller-Nr.: AG274QS\nSerie: AGON4\nGeeignet f\u00fcr: Gaming\nBild: Format\n: Adaptive-Sync, NVIDIA G-Sync kompatibel\nAnschl\u00fcsse: 2x HDMI-Eingang, (HDMI-Version: 2.0), 2x DisplayPort-Eingang, (DisplayPort-Version: 1.4), 1x 3,5-mm-Audio-Ausgang, 4x USB-A-3.2 Gen 1 (5 Gbit/s)\nErgonomie: Typ\nStromversorgung: Eco-Off\nLautsprecher: 2 Lautsprecher\nWandhalterung: VESA kompatibel (100 x 100 mm)\nFeatures: Low Blue Light, Flicker-Free LED\nZubeh\u00f6r: Vorhanden\nAbmessungen: Breite: 61,29 cm x H\u00f6he: 54,73 cm x Tiefe/L\u00e4nge: 35,21 cm\nGewicht: 7,6 kg",
    "reference_file": "offer_reference_1046.json",
    "shop_name": "Alternate.at"
}