{
    "html_file": "offer_715_18.html",
    "name": "MSI G321CUVDE, 31.5\"",
    "offer_link": "https://www.alternate.at/MSI/Optix-G321CUVDE-Gaming-Monitor/html/product/1856154?partner=AtGeizhalsat&campaign=Monitor/MSI/1856154",
    "price": 455.0,
    "raw_specifications": {
        "": "Kensington-Schloss",
        "Abmessungen": "Breite: 71,05 cm x H\u00f6he: 52,82 cm x Tiefe/L\u00e4nge: 24,92 cm",
        "Anschl\u00fcsse": "2x HDMI-Eingang, (HDMI-Version: 2.0), 1x DisplayPort-Eingang, (DisplayPort-Version: 1.2a), 1x Kopfh\u00f6rer-Ausgang",
        "Bild": "Glaretyp",
        "Bildschirmaufl\u00f6sung": "3.840 x 2.160 Pixel",
        "Bildschirmdiagonale": "80 cm (32 Zoll)",
        "EAN": "4719072955403",
        "Energieeffizienzklasse (HDR)": "G (A - G)",
        "Energieeffizienzklasse (SDR)": "G (A - G)",
        "Energieverbauch pro 1000 Stunden (HDR)": "61 kWh",
        "Energieverbauch pro 1000 Stunden (SDR)": "33 kWh",
        "Ergonomie": "Neigbar",
        "Farbe": "schwarz",
        "Features": "Headset-Hanger, Anti-Flicker, Less Blue Light, MSI Mystic Light, MSI Night Vision",
        "Frequenz": "Vertikal",
        "Geeignet f\u00fcr": "Gaming",
        "Gewicht": "5,9 kg",
        "Hersteller-Nr.": "9S6-3DA21A-022",
        "Leistungsaufnahme im Bereitschafts- und Aus-Zustand": "0,5 Watt",
        "Leistungsaufnahme im Ein-Zustand bei Standard-Dynamikumfang (SDR)": "33,2 Watt",
        "Leistungsaufnahme im Ein-Zustand bei hohem Dynamikumfang (HDR)": "61 Watt",
        "Standards": "Video",
        "Stromversorgung": "Eco-Off",
        "Typ": "Gaming-Monitor",
        "Wandhalterung": "VESA kompatibel (100 x 100 mm)",
        "Zubeh\u00f6r": "Vorhanden"
    },
    "raw_specifications_text": "Energieeffizienzklasse (SDR): G (A - G)\nEnergieverbauch pro 1000 Stunden (SDR): 33 kWh\nEnergieeffizienzklasse (HDR): G (A - G)\nEnergieverbauch pro 1000 Stunden (HDR): 61 kWh\nLeistungsaufnahme im Ein-Zustand bei Standard-Dynamikumfang (SDR): 33,2 Watt\nLeistungsaufnahme im Ein-Zustand bei hohem Dynamikumfang (HDR): 61 Watt\nLeistungsaufnahme im Bereitschafts- und Aus-Zustand: 0,5 Watt\nBildschirmdiagonale: 80 cm (32 Zoll)\nBildschirmaufl\u00f6sung: 3.840 x 2.160 Pixel\nTyp: Gaming-Monitor\nFarbe: schwarz\nEAN: 4719072955403\nHersteller-Nr.: 9S6-3DA21A-022\nGeeignet f\u00fcr: Gaming\nBild: Glaretyp\n: Kensington-Schloss\nFrequenz: Vertikal\nAnschl\u00fcsse: 2x HDMI-Eingang, (HDMI-Version: 2.0), 1x DisplayPort-Eingang, (DisplayPort-Version: 1.2a), 1x Kopfh\u00f6rer-Ausgang\nErgonomie: Neigbar\nStromversorgung: Eco-Off\nStandards: Video\nWandhalterung: VESA kompatibel (100 x 100 mm)\nFeatures: Headset-Hanger, Anti-Flicker, Less Blue Light, MSI Mystic Light, MSI Night Vision\nZubeh\u00f6r: Vorhanden\nAbmessungen: Breite: 71,05 cm x H\u00f6he: 52,82 cm x Tiefe/L\u00e4nge: 24,92 cm\nGewicht: 5,9 kg",
    "reference_file": "offer_reference_715.json",
    "shop_name": "Alternate.at"
}