{
    "html_file": "offer_1043_1.html",
    "name": "Dell C2723H, 27\"",
    "offer_link": "https://www.office-partner.de/productredirect/index/sku/23630110?sPartner=p-geizhals-at&campaign=psm/geizhals-at/",
    "price": 230.23,
    "raw_specifications": {
        "Anschl\u00fcsse": "HDMI, DisplayPort, USB, Kopfh\u00f6reranschluss, Audioausgang (Line-Out)",
        "Artikelnummer": "23630110",
        "Aufl\u00f6sung Kurzname": "Full HD",
        "Bezeichnung des Herstellers": "Dell C2723H",
        "Bildwiederholungsrate": "60,00 Hz",
        "Breite": "-1,00 mm",
        "Displaygr\u00f6\u00dfe": "68,58 cm (27 Zoll)",
        "Displayoberfl\u00e4che": "gl\u00e4nzend",
        "EEK - Spektrum": "AG",
        "Einsatzort": "Innen",
        "Energieeffizienzklasse": "C",
        "Geh\u00e4usefarbe des Ger\u00e4tes": "Schwarz",
        "Gewicht": "9,44 kg",
        "Gewicht inkl. Verpackung in Kg": "10,00 kg",
        "Helligkeit Bereich": "150 - 300 cd/m\u00b2",
        "Hersteller": "Dell",
        "H\u00f6he": "-1,00 mm",
        "Inhalt (ml oder g)": "0,00 ml",
        "Kapazit\u00e4t (Seiten)": "0",
        "Kontrastverh\u00e4ltnis (typisch) Bereich": "800:1 bis 1.200:1",
        "LCD-Technologie": "IPS Panel",
        "L\u00e4nge": "-1,00 mm",
        "Produktart": "Monitore",
        "Reaktionszeit": "5,00 ms",
        "Seitenverh\u00e4ltnis": "16:9",
        "Shop Herstellernummer": "DELL-C2723H",
        "Standard-EAN": "5397184567937",
        "Verpackung - Breite in cm": "81,99 cm",
        "Verpackung - H\u00f6he in cm": "45,49 cm",
        "Verpackung - L\u00e4nge in cm": "15,49 cm",
        "max. Aufl\u00f6sung": "1.920 x 1.080 Pixel (16:9)"
    },
    "raw_specifications_text": "Energieeffizienzklasse: C\nDisplaygr\u00f6\u00dfe: 68,58 cm (27 Zoll)\nGeh\u00e4usefarbe des Ger\u00e4tes: Schwarz\nAnschl\u00fcsse: HDMI, DisplayPort, USB, Kopfh\u00f6reranschluss, Audioausgang (Line-Out)\nKontrastverh\u00e4ltnis (typisch) Bereich: 800:1 bis 1.200:1\nHersteller: Dell\nHelligkeit Bereich: 150 - 300 cd/m\u00b2\nProduktart: Monitore\nGewicht: 9,44 kg\nAufl\u00f6sung Kurzname: Full HD\nInhalt (ml oder g): 0,00 ml\nKapazit\u00e4t (Seiten): 0\nBreite: -1,00 mm\nH\u00f6he: -1,00 mm\nL\u00e4nge: -1,00 mm\nEEK - Spektrum: AG\nGewicht inkl. Verpackung in Kg: 10,00 kg\nArtikelnummer: 23630110\nStandard-EAN: 5397184567937\nShop Herstellernummer: DELL-C2723H\nBezeichnung des Herstellers: Dell C2723H\nVerpackung - Breite in cm: 81,99 cm\nVerpackung - H\u00f6he in cm: 45,49 cm\nVerpackung - L\u00e4nge in cm: 15,49 cm\nmax. Aufl\u00f6sung: 1.920 x 1.080 Pixel (16:9)\nSeitenverh\u00e4ltnis: 16:9\nLCD-Technologie: IPS Panel\nReaktionszeit: 5,00 ms\nDisplayoberfl\u00e4che: gl\u00e4nzend\nBildwiederholungsrate: 60,00 Hz\nEinsatzort: Innen",
    "reference_file": "offer_reference_1043.json",
    "shop_name": "office-partner (AT)"
}