{
    "html_file": "offer_480_31.html",
    "name": "Samsung CR50 (2023), 27\"",
    "offer_link": "https://www.electronicshop24.at/product_info.php?products_id=160000001576051353&ano=S1576051353&mno=LC27R504FHPXEN&ean=8806094672176&utm_medium=cpc&utm_campaign=preisvergleich&utm_content=item&utm_source=geizhals&ref=geizhals",
    "price": 228.0,
    "raw_specifications": {
        "Abmessungen (Breite x Tiefe x H\u00f6he)": "61.42 cm x 25.12 cm x 46.62 cm - mit Fu\u00df",
        "Adaptive-Sync Technologie": "AMD FreeSync",
        "Besonderheiten": "MagicBright, Spielmodus, Mega Dynamic Contrast Ratio, flimmerfreie Technologie, Image Size, Eco Saving Plus, Eye Saver Mode, an 3 Seiten ohne Blende",
        "Bildschirmtyp": "VA",
        "Details zu Abmessungen & Gewicht": "Mit Fu\u00df - Breite: 61.42 cm - Tiefe: 25.12 cm - H\u00f6he: 46.62 cm - Gewicht: 4.3 kg \u00a6 Ohne Fu\u00df - Breite: 61.42 cm - Tiefe: 7.38 cm - H\u00f6he: 36.28 cm - Gewicht: 3.5 kg",
        "Diagonalabmessung": "68.6 cm (27\")",
        "Display-Typ": "LED-hintergrundbeleuchteter LCD-Monitor / TFT-Aktivmatrix",
        "Eingangsspannung": "Wechselstrom 100-240 V",
        "Einstellungen der Anzeigeposition": "Neigung",
        "Energie Effizienzklasse": "Klasse E",
        "Energieverbrauch pro Jahr": "31 kWh",
        "Enthaltene Kabel": "1 x HDMI-Kabel",
        "Farbe": "Dunkelblau/grau",
        "Farbraum": "72% NTSC",
        "Farbunterst\u00fctzung": "16,7 Millionen Farben",
        "Geschwungener Bildschirm": "Ja (1800R)",
        "Gewicht": "4.3 kg",
        "Helligkeit": "300 cd/m\u00b2",
        "Hintergrundbeleuchtungs-Technologie": "LED-Hintergrundbeleuchtung",
        "Horizontaler Betrachtungswinkel": "178",
        "Kontrast": "3000:1",
        "Leistungsmerkmale": "Slot f\u00fcr Sicherheitsschloss (Kabelschloss getrennt erh\u00e4ltlich)",
        "Max. Betriebstemperatur": "40 \u00b0C",
        "Min Betriebstemperatur": "10 \u00b0C",
        "Native Aufl\u00f6sung": "Full HD (1080p) 1920 x 1080 bei 60 Hz",
        "Neigungswinkel": "-2/+22",
        "Reaktionszeit": "4 ms (gray-to-gray)",
        "Schlosstyp zur Diebstahlsicherung": "Kensington Slot",
        "Schnittstellen": "VGA (HD-15) \u00a6 HDMI 1.4 \u00a6 Kopfh\u00f6rer (Mini-Klinkenstecker)",
        "Seitenverh\u00e4ltnis": "16:9",
        "Sichtbare Bildfl\u00e4che": "68.4 cm (26.9\")",
        "Stromverbrauch (Aus-Modus)": "0.3 Watt",
        "Stromverbrauch (max.)": "35 Watt",
        "Stromverbrauch (typisch)": "21 Watt",
        "Stromverbrauch SDR (eingeschaltet)": "21 kWh/1.000 h",
        "Stromverbrauch im Standby-Modus": "0.5 Watt",
        "Transportbreite": "71 cm",
        "Transportgewicht": "6.5 kg",
        "Transporth\u00f6he": "46 cm",
        "Transporttiefe": "17.7 cm",
        "VESA-Halterung": "75 x 75 mm",
        "Vertikaler Betrachtungswinkel": "178",
        "Zul\u00e4ssige Luftfeuchtigkeit im Betrieb": "10 - 80% (nicht kondensierend)"
    },
    "raw_specifications_text": "Display-Typ: LED-hintergrundbeleuchteter LCD-Monitor / TFT-Aktivmatrix\nEnergie Effizienzklasse: Klasse E\nEnergieverbrauch pro Jahr: 31 kWh\nDiagonalabmessung: 68.6 cm (27\")\nSichtbare Bildfl\u00e4che: 68.4 cm (26.9\")\nGeschwungener Bildschirm: Ja (1800R)\nAdaptive-Sync Technologie: AMD FreeSync\nBildschirmtyp: VA\nSeitenverh\u00e4ltnis: 16:9\nNative Aufl\u00f6sung: Full HD (1080p) 1920 x 1080 bei 60 Hz\nHelligkeit: 300 cd/m\u00b2\nKontrast: 3000:1\nFarbunterst\u00fctzung: 16,7 Millionen Farben\nFarbraum: 72% NTSC\nReaktionszeit: 4 ms (gray-to-gray)\nHorizontaler Betrachtungswinkel: 178\nVertikaler Betrachtungswinkel: 178\nHintergrundbeleuchtungs-Technologie: LED-Hintergrundbeleuchtung\nBesonderheiten: MagicBright, Spielmodus, Mega Dynamic Contrast Ratio, flimmerfreie Technologie, Image Size, Eco Saving Plus, Eye Saver Mode, an 3 Seiten ohne Blende\nFarbe: Dunkelblau/grau\nAbmessungen (Breite x Tiefe x H\u00f6he): 61.42 cm x 25.12 cm x 46.62 cm - mit Fu\u00df\nGewicht: 4.3 kg\nSchnittstellen: VGA (HD-15) \u00a6 HDMI 1.4 \u00a6 Kopfh\u00f6rer (Mini-Klinkenstecker)\nEinstellungen der Anzeigeposition: Neigung\nNeigungswinkel: -2/+22\nVESA-Halterung: 75 x 75 mm\nLeistungsmerkmale: Slot f\u00fcr Sicherheitsschloss (Kabelschloss getrennt erh\u00e4ltlich)\nEnthaltene Kabel: 1 x HDMI-Kabel\nSchlosstyp zur Diebstahlsicherung: Kensington Slot\nEingangsspannung: Wechselstrom 100-240 V\nStromverbrauch SDR (eingeschaltet): 21 kWh/1.000 h\nStromverbrauch (typisch): 21 Watt\nStromverbrauch (max.): 35 Watt\nStromverbrauch im Standby-Modus: 0.5 Watt\nStromverbrauch (Aus-Modus): 0.3 Watt\nDetails zu Abmessungen & Gewicht: Mit Fu\u00df - Breite: 61.42 cm - Tiefe: 25.12 cm - H\u00f6he: 46.62 cm - Gewicht: 4.3 kg \u00a6 Ohne Fu\u00df - Breite: 61.42 cm - Tiefe: 7.38 cm - H\u00f6he: 36.28 cm - Gewicht: 3.5 kg\nTransportbreite: 71 cm\nTransporttiefe: 17.7 cm\nTransporth\u00f6he: 46 cm\nTransportgewicht: 6.5 kg\nMin Betriebstemperatur: 10 \u00b0C\nMax. Betriebstemperatur: 40 \u00b0C\nZul\u00e4ssige Luftfeuchtigkeit im Betrieb: 10 - 80% (nicht kondensierend)",
    "reference_file": "offer_reference_480.json",
    "shop_name": "ElectronicShop24"
}