{
    "html_file": "offer_751_33.html",
    "name": "Dell E2423H, 23.8\"",
    "offer_link": "https://www.electronicshop24.at/product_info.php?products_id=140000000254285856&ano=R254285856&mno=E2423H&ean=5397184656907&utm_medium=cpc&utm_campaign=preisvergleich&utm_content=item&utm_source=geizhals&ref=geizhals",
    "price": 128.0,
    "raw_specifications": {
        "Abmessungen (Breite x Tiefe x H\u00f6he)": "55.264 cm x 17.1 cm x 42.035 cm - mit Fu\u00df",
        "Besonderheiten": "Breiter Betrachtungswinkel",
        "Bildschirmbeschichtung": "Blendfrei",
        "Bildschirmtyp": "VA",
        "Details zu Abmessungen & Gewicht": "Mit Fu\u00df - Breite: 55.264 cm - Tiefe: 17.1 cm - H\u00f6he: 42.035 cm - Gewicht: 3.85 kg \u00a6 Ohne Fu\u00df - Breite: 55.264 cm - Tiefe: 4.969 cm - H\u00f6he: 33.161 cm - Gewicht: 3.11 kg",
        "Diagonalabmessung": "61 cm (24\")",
        "Display-Typ": "LED-hintergrundbeleuchteter LCD-Monitor / TFT-Aktivmatrix",
        "ENERGY STAR zertifiziert": "Ja",
        "EPEAT-kompatibel": "EPEAT Gold",
        "Ein-/Aus-Schalter": "Ja",
        "Eingangsspannung": "Wechselstrom 100-240 V (50/60 Hz)",
        "Einstellungen der Anzeigeposition": "Neigung",
        "Energierverbrauch Sleep": "0.3 Watt",
        "Enthaltene Kabel": "1 x DisplayPort-Kabel",
        "Farbraum": "72% (CIE 1931), 83% (CIE 1976)",
        "Farbunterst\u00fctzung": "16,7 Millionen Farben",
        "Gewicht": "3.85 kg",
        "Helligkeit": "250 cd/m\u00b2",
        "Hintergrundbeleuchtungs-Technologie": "LED-Hintergrundbeleuchtung",
        "Horizontaler Betrachtungswinkel": "178",
        "Kontrast": "3000:1 / 3000:1 (dynamisch)",
        "Leistungsaufnahme im Ein-Zustand": "16 W",
        "Leistungsmerkmale": "Slot f\u00fcr Sicherheitsschloss (Kabelschloss getrennt erh\u00e4ltlich), Unterst\u00fctzung f\u00fcr VESA-Schnittstelle",
        "Max. Betriebstemperatur": "40 \u00b0C",
        "Min Betriebstemperatur": "0 \u00b0C",
        "Native Aufl\u00f6sung": "Full HD (1080p) 1920 x 1080 bei 60 Hz",
        "Neigungswinkel": "-5/+21",
        "Pixelpitch": "0.2745 mm",
        "Ppi": "93",
        "Preistyp": "BTO",
        "Reaktionszeit": "5 ms (Grau-zu-Grau schnell), 8 ms (Grau-zu-Grau normal)",
        "Schlosstyp zur Diebstahlsicherung": "Kensington Slot",
        "Schnittstellen": "DisplayPort 1.2 \u00a6 VGA",
        "Seitenverh\u00e4ltnis": "16:9",
        "Services im Bundle": "3 Jahre Advanced Exchange-Service",
        "Sichtbare Bildfl\u00e4che": "60.47 cm (23.8\")",
        "Stromverbrauch (Aus-Modus)": "0.3 Watt",
        "Stromverbrauch (max.)": "25 Watt",
        "Stromverbrauch im Standby-Modus": "0.3 Watt",
        "TCO-zertifiziert": "TCO Certified Edge Displays, TCO Certified Displays 9",
        "Transportgewicht": "5.29 kg",
        "VESA-Halterung": "100 x 100 mm",
        "Vertikaler Betrachtungswinkel": "178",
        "Zul\u00e4ssige Luftfeuchtigkeit im Betrieb": "10 - 80% (nicht kondensierend)"
    },
    "raw_specifications_text": "Display-Typ: LED-hintergrundbeleuchteter LCD-Monitor / TFT-Aktivmatrix\nDiagonalabmessung: 61 cm (24\")\nSichtbare Bildfl\u00e4che: 60.47 cm (23.8\")\nBildschirmtyp: VA\nSeitenverh\u00e4ltnis: 16:9\nNative Aufl\u00f6sung: Full HD (1080p) 1920 x 1080 bei 60 Hz\nPixelpitch: 0.2745 mm\nPpi: 93\nHelligkeit: 250 cd/m\u00b2\nKontrast: 3000:1 / 3000:1 (dynamisch)\nFarbunterst\u00fctzung: 16,7 Millionen Farben\nFarbraum: 72% (CIE 1931), 83% (CIE 1976)\nReaktionszeit: 5 ms (Grau-zu-Grau schnell), 8 ms (Grau-zu-Grau normal)\nHorizontaler Betrachtungswinkel: 178\nVertikaler Betrachtungswinkel: 178\nBildschirmbeschichtung: Blendfrei\nHintergrundbeleuchtungs-Technologie: LED-Hintergrundbeleuchtung\nBesonderheiten: Breiter Betrachtungswinkel\nAbmessungen (Breite x Tiefe x H\u00f6he): 55.264 cm x 17.1 cm x 42.035 cm - mit Fu\u00df\nGewicht: 3.85 kg\nSchnittstellen: DisplayPort 1.2 \u00a6 VGA\nEinstellungen der Anzeigeposition: Neigung\nNeigungswinkel: -5/+21\nVESA-Halterung: 100 x 100 mm\nLeistungsmerkmale: Slot f\u00fcr Sicherheitsschloss (Kabelschloss getrennt erh\u00e4ltlich), Unterst\u00fctzung f\u00fcr VESA-Schnittstelle\nEnthaltene Kabel: 1 x DisplayPort-Kabel\nPreistyp: BTO\nSchlosstyp zur Diebstahlsicherung: Kensington Slot\nEingangsspannung: Wechselstrom 100-240 V (50/60 Hz)\nLeistungsaufnahme im Ein-Zustand: 16 W\nStromverbrauch (max.): 25 Watt\nStromverbrauch im Standby-Modus: 0.3 Watt\nEnergierverbrauch Sleep: 0.3 Watt\nStromverbrauch (Aus-Modus): 0.3 Watt\nEin-/Aus-Schalter: Ja\nDetails zu Abmessungen & Gewicht: Mit Fu\u00df - Breite: 55.264 cm - Tiefe: 17.1 cm - H\u00f6he: 42.035 cm - Gewicht: 3.85 kg \u00a6 Ohne Fu\u00df - Breite: 55.264 cm - Tiefe: 4.969 cm - H\u00f6he: 33.161 cm - Gewicht: 3.11 kg\nTransportgewicht: 5.29 kg\nTCO-zertifiziert: TCO Certified Edge Displays, TCO Certified Displays 9\nEPEAT-kompatibel: EPEAT Gold\nENERGY STAR zertifiziert: Ja\nServices im Bundle: 3 Jahre Advanced Exchange-Service\nMin Betriebstemperatur: 0 \u00b0C\nMax. Betriebstemperatur: 40 \u00b0C\nZul\u00e4ssige Luftfeuchtigkeit im Betrieb: 10 - 80% (nicht kondensierend)",
    "reference_file": "offer_reference_751.json",
    "shop_name": "ElectronicShop24"
}