{
    "html_file": "offer_621_13.html",
    "name": "Acer Vero B7 B247Ybmiprxv, 23.8\"",
    "offer_link": "https://www.csv-direct.de/artinfo.php?artnr=AGX1611936&KATEGORIE=162&pva=geizhals2",
    "price": 152.92,
    "raw_specifications": {
        "AC Eingangsspannung": "120 - 230 V",
        "AMD FreeSync": "Nein",
        "Anzahl DisplayPort Anschl\u00fcsse": "1",
        "Anzahl VGA D-Sub Anschl\u00fcsse": "1",
        "Anzahl der Farben des Displays": "16,7 Millionen Farben",
        "Bildschirmdiagonale": "60,5 cm 23.8\"",
        "Bildschirmdiagonale cm": "60,5 cm",
        "Bildschirmform": "Flach",
        "Bildschirmtechnologie": "LCD",
        "Bildwinkel, horizontal": "178\u00b0",
        "Bildwinkel, vertikal": "178\u00b0",
        "Breite ohne Standfu\u00df": "540 mm",
        "Display-Aufl\u00f6sung": "1920 x 1080 Pixel",
        "DisplayPorts-Version": "1.2",
        "Energieeffizienzklasse SDR": "E",
        "Energieeffizienzskala": "A bis G",
        "Energieverbrauch SDR pro 1.000 Stunden": "18 kWh",
        "Ger\u00e4tebreite inkl. Fu\u00df": "540 mm",
        "Ger\u00e4teh\u00f6he inkl. Fu\u00df": "499 mm",
        "Ger\u00e4tetiefe inkl. Fu\u00df": "193 mm",
        "Gewicht mit St\u00e4nder": "5,59 kg",
        "Gewicht ohne St\u00e4nder": "3,64 kg",
        "HD-Typ": "Full HD",
        "HDMI-Version": "1.4",
        "Helligkeit typisch": "250 cd/m\u00b2",
        "H\u00f6he ohne Standfu\u00df": "323 mm",
        "H\u00f6heneinstellung": "12 cm",
        "Integrierte Kamera": "Nein",
        "Kontrastverh\u00e4ltnis": "1000:1",
        "Kontrastverh\u00e4ltnis dynamisch": "100000000:1",
        "Maximale Bildwiederholrate": "75 Hz",
        "NVIDIA G-SYNC": "Nein",
        "Natives Seitenverh\u00e4ltnis": "16:9",
        "Panel-Montage-Schnittstelle": "100 x 100 mm",
        "Panel-Typ": "IPS",
        "Pixel Abstand": "0,27 x 0,27 mm",
        "Produktfarbe": "Schwarz",
        "Reaktionszeit": "4 ms",
        "Seitenverh\u00e4ltnis": "16:9",
        "Stromverbrauch Standardbetrieb": "16 W",
        "Stromverbrauch Standby": "0,5 W",
        "Stromverbrauch aus": "0,45 W",
        "Stromverbrauch max.": "47 W",
        "Tiefe ohne Standfu\u00df": "65 mm",
        "Touchscreen": "Nein",
        "Typ der Hintergrundbeleuchtung": "LED"
    },
    "raw_specifications_text": "Bildschirmdiagonale: 60,5 cm 23.8\"\nDisplay-Aufl\u00f6sung: 1920 x 1080 Pixel\nNatives Seitenverh\u00e4ltnis: 16:9\nBildschirmtechnologie: LCD\nTouchscreen: Nein\nHD-Typ: Full HD\nPanel-Typ: IPS\nBildschirmform: Flach\nKontrastverh\u00e4ltnis: 1000:1\nMaximale Bildwiederholrate: 75 Hz\nAnzahl der Farben des Displays: 16,7 Millionen Farben\nTyp der Hintergrundbeleuchtung: LED\nHelligkeit typisch: 250 cd/m\u00b2\nReaktionszeit: 4 ms\nSeitenverh\u00e4ltnis: 16:9\nKontrastverh\u00e4ltnis dynamisch: 100000000:1\nBildwinkel, horizontal: 178\u00b0\nBildwinkel, vertikal: 178\u00b0\nPixel Abstand: 0,27 x 0,27 mm\nBildschirmdiagonale cm: 60,5 cm\nNVIDIA G-SYNC: Nein\nAMD FreeSync: Nein\nIntegrierte Kamera: Nein\nProduktfarbe: Schwarz\nAnzahl VGA D-Sub Anschl\u00fcsse: 1\nHDMI-Version: 1.4\nAnzahl DisplayPort Anschl\u00fcsse: 1\nDisplayPorts-Version: 1.2\nPanel-Montage-Schnittstelle: 100 x 100 mm\nH\u00f6heneinstellung: 12 cm\nEnergieeffizienzklasse SDR: E\nEnergieverbrauch SDR pro 1.000 Stunden: 18 kWh\nStromverbrauch Standardbetrieb: 16 W\nStromverbrauch Standby: 0,5 W\nStromverbrauch max.: 47 W\nStromverbrauch aus: 0,45 W\nAC Eingangsspannung: 120 - 230 V\nEnergieeffizienzskala: A bis G\nGer\u00e4tebreite inkl. Fu\u00df: 540 mm\nGer\u00e4tetiefe inkl. Fu\u00df: 193 mm\nGer\u00e4teh\u00f6he inkl. Fu\u00df: 499 mm\nGewicht mit St\u00e4nder: 5,59 kg\nBreite ohne Standfu\u00df: 540 mm\nTiefe ohne Standfu\u00df: 65 mm\nH\u00f6he ohne Standfu\u00df: 323 mm\nGewicht ohne St\u00e4nder: 3,64 kg",
    "reference_file": "offer_reference_621.json",
    "shop_name": "CSV-Direct.de"
}