{
    "html_file": "offer_2441_12.html",
    "name": "Fujitsu E-Line E24-8 TS Pro, 24\"",
    "offer_link": "https://www.electronicshop24.at/product_info.php?products_id=360000001411718598&ano=A-T1411718598&mno=S26361-K1598-V161&ean=4063872886802&utm_medium=cpc&utm_campaign=preisvergleich&utm_content=item&utm_source=geizhals&ref=geizhals",
    "price": 142.0,
    "raw_specifications": {
        "Abmessungen (Breite x Tiefe x H\u00f6he)": "55.3 cm x 20.9 cm x 37.2 cm - mit Fu\u00df",
        "Ausgangsleistung/Kanal": "2 Watt",
        "Besonderheiten": "HDCP, Overdrive-Technologie, ECO-Taste, High Frame Rate Control (Hi-FRC), Low Blue Light Mode",
        "Bildschirmbeschichtung": "Blendfrei, 3H Hard Coating",
        "Bildschirmtyp": "IPS",
        "Details zu Abmessungen & Gewicht": "Mit Fu\u00df - Breite: 55.3 cm - Tiefe: 20.9 cm - H\u00f6he: 37.2 cm - Gewicht: 3.6 kg \u00a6 Ohne Fu\u00df - Breite: 55.3 cm - Tiefe: 6.35 cm - H\u00f6he: 33.02 cm - Gewicht: 3.3 kg",
        "Diagonalabmessung": "60.5 cm (23.8\")",
        "Display-Typ": "LED-hintergrundbeleuchteter LCD-Monitor / TFT-Aktivmatrix",
        "ENERGY STAR zertifiziert": "Ja",
        "ENERGY STAR-Version": "8.0",
        "EPEAT-kompatibel": "EPEAT Bronze",
        "Eingangsspannung": "Wechselstrom 120/230 V (50/60 Hz)",
        "Einstellungen der Anzeigeposition": "Neigung",
        "Energie Effizienzklasse": "Klasse D",
        "Energierverbrauch Sleep": "0.11 Watt",
        "Energieverbrauch pro Jahr": "43.65 kWh",
        "Enthaltene Kabel": "1 x DVI-Kabel - 1.8 m \u00a6 1 x Audiokabel - 1.8 m",
        "Farbe": "Mattschwarz",
        "Farbtemperatur": "5000K, 6500K, 7500K",
        "Farbunterst\u00fctzung": "16,7 Millionen Farben",
        "Gewicht": "3.6 kg",
        "Helligkeit": "250 cd/m\u00b2",
        "Hintergrundbeleuchtungs-Technologie": "LED-Hintergrundbeleuchtung",
        "Horizontale Bildwiederholrate": "30 - 82 kHz",
        "Horizontaler Betrachtungswinkel": "178",
        "Kennzeichnung": "FCC Klasse B bescheinigt, TUV GS, BSMI, EN 60950, SASO, CCC, DDC/CI, RoHS, ISO 9241-307, WEEE, S Mark, cTUVus, KC, Directive 2004/108/EEC, EAC, VESA MIS-D 100 C, TUV Rheinland Low Blue Light Certification, TUV Rheinland Flicker Free Certification",
        "Kontrast": "1000:1 / 20000000:1 (dynamisch)",
        "Leistungsaufnahme im Ein-Zustand": "13.6 W",
        "Leistungsmerkmale": "Slot f\u00fcr Sicherheitsschloss (Kabelschloss getrennt erh\u00e4ltlich)",
        "Lokalisierung": "Europa",
        "Max. Betriebstemperatur": "35 \u00b0C",
        "Min Betriebstemperatur": "5 \u00b0C",
        "Native Aufl\u00f6sung": "Full HD (1080p) 1920 x 1080",
        "Neigungswinkel": "-5/+22",
        "OSD-Sprachen": "D\u00e4nisch, Hebr\u00e4isch, Tschechisch, Chinesisch (vereinfacht), Englisch, Deutsch, Franz\u00f6sisch, Italienisch, Norwegisch, Portugiesisch, Polnisch, Finnisch, Schwedisch, Russisch, Spanisch, Holl\u00e4ndisch, T\u00fcrkisch, Arabisch, Japanisch",
        "Pixelpitch": "0.2745 mm",
        "Reaktionszeit": "5 ms",
        "Schlosstyp zur Diebstahlsicherung": "Kensington Slot",
        "Schnittstellen": "VGA \u00a6 DVI-D (HDCP) \u00a6 DisplayPort \u00a6 Audio Line-In \u00a6 Audio Line-Out",
        "Seitenverh\u00e4ltnis": "16:9",
        "Service und Support": "Begrenzte Garantie - 3 Jahre - Pick-Up & Return",
        "Stromverbrauch (max.)": "13.94 Watt",
        "Stromverbrauch SDR (eingeschaltet)": "13.6 kWh/1.000 h",
        "Stromverbrauch im Standby-Modus": "0.16 Watt",
        "TCO-zertifiziert": "TCO Certified Displays 8",
        "Typ": "Lautsprecher - Stereo",
        "VESA-Halterung": "100 x 100 mm",
        "Vertikale Bildwiederholrate": "56 - 76 Hz",
        "Vertikaler Betrachtungswinkel": "178",
        "Zul\u00e4ssige Luftfeuchtigkeit im Betrieb": "10 \u2013 85% (nicht kondensierend)"
    },
    "raw_specifications_text": "Display-Typ: LED-hintergrundbeleuchteter LCD-Monitor / TFT-Aktivmatrix\nEnergie Effizienzklasse: Klasse D\nEnergieverbrauch pro Jahr: 43.65 kWh\nDiagonalabmessung: 60.5 cm (23.8\")\nBildschirmtyp: IPS\nSeitenverh\u00e4ltnis: 16:9\nNative Aufl\u00f6sung: Full HD (1080p) 1920 x 1080\nPixelpitch: 0.2745 mm\nHelligkeit: 250 cd/m\u00b2\nKontrast: 1000:1 / 20000000:1 (dynamisch)\nFarbunterst\u00fctzung: 16,7 Millionen Farben\nReaktionszeit: 5 ms\nVertikale Bildwiederholrate: 56 - 76 Hz\nHorizontale Bildwiederholrate: 30 - 82 kHz\nHorizontaler Betrachtungswinkel: 178\nVertikaler Betrachtungswinkel: 178\nBildschirmbeschichtung: Blendfrei, 3H Hard Coating\nHintergrundbeleuchtungs-Technologie: LED-Hintergrundbeleuchtung\nFarbtemperatur: 5000K, 6500K, 7500K\nOSD-Sprachen: D\u00e4nisch, Hebr\u00e4isch, Tschechisch, Chinesisch (vereinfacht), Englisch, Deutsch, Franz\u00f6sisch, Italienisch, Norwegisch, Portugiesisch, Polnisch, Finnisch, Schwedisch, Russisch, Spanisch, Holl\u00e4ndisch, T\u00fcrkisch, Arabisch, Japanisch\nBesonderheiten: HDCP, Overdrive-Technologie, ECO-Taste, High Frame Rate Control (Hi-FRC), Low Blue Light Mode\nFarbe: Mattschwarz\nAbmessungen (Breite x Tiefe x H\u00f6he): 55.3 cm x 20.9 cm x 37.2 cm - mit Fu\u00df\nGewicht: 3.6 kg\nTyp: Lautsprecher - Stereo\nAusgangsleistung/Kanal: 2 Watt\nSchnittstellen: VGA \u00a6 DVI-D (HDCP) \u00a6 DisplayPort \u00a6 Audio Line-In \u00a6 Audio Line-Out\nEinstellungen der Anzeigeposition: Neigung\nNeigungswinkel: -5/+22\nVESA-Halterung: 100 x 100 mm\nLeistungsmerkmale: Slot f\u00fcr Sicherheitsschloss (Kabelschloss getrennt erh\u00e4ltlich)\nEnthaltene Kabel: 1 x DVI-Kabel - 1.8 m \u00a6 1 x Audiokabel - 1.8 m\nKennzeichnung: FCC Klasse B bescheinigt, TUV GS, BSMI, EN 60950, SASO, CCC, DDC/CI, RoHS, ISO 9241-307, WEEE, S Mark, cTUVus, KC, Directive 2004/108/EEC, EAC, VESA MIS-D 100 C, TUV Rheinland Low Blue Light Certification, TUV Rheinland Flicker Free Certification\nLokalisierung: Europa\nSchlosstyp zur Diebstahlsicherung: Kensington Slot\nEingangsspannung: Wechselstrom 120/230 V (50/60 Hz)\nLeistungsaufnahme im Ein-Zustand: 13.6 W\nStromverbrauch SDR (eingeschaltet): 13.6 kWh/1.000 h\nStromverbrauch (max.): 13.94 Watt\nStromverbrauch im Standby-Modus: 0.16 Watt\nEnergierverbrauch Sleep: 0.11 Watt\nDetails zu Abmessungen & Gewicht: Mit Fu\u00df - Breite: 55.3 cm - Tiefe: 20.9 cm - H\u00f6he: 37.2 cm - Gewicht: 3.6 kg \u00a6 Ohne Fu\u00df - Breite: 55.3 cm - Tiefe: 6.35 cm - H\u00f6he: 33.02 cm - Gewicht: 3.3 kg\nTCO-zertifiziert: TCO Certified Displays 8\nEPEAT-kompatibel: EPEAT Bronze\nENERGY STAR zertifiziert: Ja\nENERGY STAR-Version: 8.0\nService und Support: Begrenzte Garantie - 3 Jahre - Pick-Up & Return\nMin Betriebstemperatur: 5 \u00b0C\nMax. Betriebstemperatur: 35 \u00b0C\nZul\u00e4ssige Luftfeuchtigkeit im Betrieb: 10 \u2013 85% (nicht kondensierend)",
    "reference_file": "offer_reference_2441.json",
    "shop_name": "ElectronicShop24"
}