{
    "html_file": "offer_2089_1.html",
    "name": "LG UltraWide 34WL500-B, 34\"",
    "offer_link": "https://www.e-tec.at/details.php?artnr=293964",
    "price": 385.65,
    "raw_specifications": {
        "AMD FreeSync": "Ja",
        "Abmessungen (BxHxT)": "826x487x209mm (mit Standfu\u00df),  826x370x51mm (ohne Standfu\u00df)",
        "Adaptive Sync": "Ja",
        "Anschl\u00fcsse - HDMI 2.0": "2",
        "Anwendung": "station\u00e4r",
        "Audio": "1x Line-Out",
        "Aufl\u00f6sung": "2560x1080",
        "Beschichtung": "matt (non-glare)",
        "Besonderheiten": "Steuerkreuz,  Picture-in-Picture,  Sicherheitsschloss (Kensington),  kompatibel mit LG Dual Controller Software,  HDCP 2.2",
        "Bildwiederholfrequenz": "75Hz",
        "Blickwinkel": "178\u00b0/178\u00b0",
        "Diagonale": "34\"/86.4cm",
        "Energieeffizienzklasse HDR (A bis G)": "G",
        "Energieverbrauch HDR": "38kWh/1000h",
        "Energieverbrauch SDR": "38kWh/1000h",
        "Ergonomie": "N/A (h\u00f6henverstellbar),  N/A (Pivot),  N/A (drehbar),  +20\u00b0/-5\u00b0 (neigbar),  keine Angabe (Schr\u00e4glage)",
        "FRC": "unbekannt",
        "Farbe": "schwarz",
        "Farbraum - sRGB": "99%",
        "Farbtiefe": "8bit (16.7 Mio. Farben)",
        "Form": "gerade (flat)",
        "Gewicht": "6.90kg (mit Standfu\u00df),  5.90kg (ohne Standfu\u00df)",
        "HDR": "N/A",
        "Helligkeit": "300cd/m\u00b2",
        "Herstellergarantie": "zwei Jahre (Bring-In)",
        "Hintergrundbeleuchtung": "White-LED,  flicker-free,  Blaulichtfilter",
        "Kontrast - statisch": "1.000:1",
        "Leistungsaufnahme": "40W (maximal),  30W (typisch),  keine Angabe (Energielabel alt A+++ bis G),  0.3W (Standby)",
        "Panel": "IPS (AH-IPS)",
        "Panel-Hersteller": "LG Display",
        "Reaktionszeit - GtG": "5ms",
        "Screen-to-Body-Ratio": "87.4% (berechnet)",
        "Seitenverh\u00e4ltnis": "21:9",
        "Signalfrequenz": "30-90kHz (horizontal),  56-61Hz (vertikal)",
        "Stromversorgung": "DC-In (externes Netzteil)",
        "USB-Hub In": "N/A",
        "USB-Hub Out": "N/A",
        "USB-Schreibweise": "Link",
        "VESA": "100x100 (frei)",
        "VRR (Variable Refresh Rate)": "Adaptive Sync,  AMD FreeSync (40-75Hz via HDMI,  ohne LFC-Support,  ohne HDR)",
        "Weitere Anschl\u00fcsse": "N/A"
    },
    "raw_specifications_text": "Abmessungen (BxHxT): 826x487x209mm (mit Standfu\u00df),  826x370x51mm (ohne Standfu\u00df)\nAdaptive Sync: Ja\nAMD FreeSync: Ja\nAnschl\u00fcsse - HDMI 2.0: 2\nAnwendung: station\u00e4r\nAudio: 1x Line-Out\nAufl\u00f6sung: 2560x1080\nBeschichtung: matt (non-glare)\nBesonderheiten: Steuerkreuz,  Picture-in-Picture,  Sicherheitsschloss (Kensington),  kompatibel mit LG Dual Controller Software,  HDCP 2.2\nBildwiederholfrequenz: 75Hz\nBlickwinkel: 178\u00b0/178\u00b0\nDiagonale: 34\"/86.4cm\nEnergieeffizienzklasse HDR (A bis G): G\nEnergieverbrauch HDR: 38kWh/1000h\nEnergieverbrauch SDR: 38kWh/1000h\nErgonomie: N/A (h\u00f6henverstellbar),  N/A (Pivot),  N/A (drehbar),  +20\u00b0/-5\u00b0 (neigbar),  keine Angabe (Schr\u00e4glage)\nFarbe: schwarz\nFarbraum - sRGB: 99%\nFarbtiefe: 8bit (16.7 Mio. Farben)\nForm: gerade (flat)\nFRC: unbekannt\nGewicht: 6.90kg (mit Standfu\u00df),  5.90kg (ohne Standfu\u00df)\nHDR: N/A\nHelligkeit: 300cd/m\u00b2\nHerstellergarantie: zwei Jahre (Bring-In)\nHintergrundbeleuchtung: White-LED,  flicker-free,  Blaulichtfilter\nKontrast - statisch: 1.000:1\nLeistungsaufnahme: 40W (maximal),  30W (typisch),  keine Angabe (Energielabel alt A+++ bis G),  0.3W (Standby)\nPanel: IPS (AH-IPS)\nPanel-Hersteller: LG Display\nReaktionszeit - GtG: 5ms\nScreen-to-Body-Ratio: 87.4% (berechnet)\nSeitenverh\u00e4ltnis: 21:9\nSignalfrequenz: 30-90kHz (horizontal),  56-61Hz (vertikal)\nStromversorgung: DC-In (externes Netzteil)\nUSB-Hub In: N/A\nUSB-Hub Out: N/A\nUSB-Schreibweise: Link\nVESA: 100x100 (frei)\nVRR (Variable Refresh Rate): Adaptive Sync,  AMD FreeSync (40-75Hz via HDMI,  ohne LFC-Support,  ohne HDR)\nWeitere Anschl\u00fcsse: N/A",
    "reference_file": "offer_reference_2089.json",
    "shop_name": "e-tec.at"
}