{
    "html_file": "offer_918_10.html",
    "name": "MSI Optix G271CDE, 27\"",
    "offer_link": "https://www.alternate.at/MSI/Optix-G271CDE-Gaming-Monitor/html/product/1854558?partner=AtGeizhalsat&campaign=Monitor/MSI/1854558",
    "price": 324.0,
    "raw_specifications": {
        "": "AMD FreeSync, Kensington-Schloss",
        "Abmessungen": "Breite: 60,65 cm x H\u00f6he: 48,22 cm x Tiefe/L\u00e4nge: 24,56 cm",
        "Anschl\u00fcsse": "2x HDMI-Eingang, (HDMI-Version: 2.0), 1x DisplayPort-Eingang, (DisplayPort-Version: 1.2a), 1x Kopfh\u00f6rer-Ausgang",
        "Beleuchtung": "Ja, Mehrfarbig",
        "Bild": "Glaretyp",
        "Bildschirmaufl\u00f6sung": "1.920 x 1.080 Pixel",
        "Bildschirmdiagonale": "69 cm (27 Zoll)",
        "EAN": "4719072864439",
        "Energieeffizienzklasse (SDR)": "F (A - G)",
        "Energieverbauch pro 1000 Stunden (SDR)": "26 kWh",
        "Ergonomie": "Typ",
        "Farbe": "schwarz",
        "Features": "Less Blue Light Pro, Frameless Design, MSI Night Vision",
        "Frequenz": "Vertikal",
        "Geeignet f\u00fcr": "Gaming",
        "Gewicht": "5,6 kg",
        "Hersteller-Nr.": "9S6-3CC32H-013",
        "Leistungsaufnahme im Bereitschafts- und Aus-Zustand": "0,5 Watt",
        "Leistungsaufnahme im Ein-Zustand bei Standard-Dynamikumfang (SDR)": "26 Watt",
        "Standards": "Video",
        "Stromversorgung": "Eco-Off",
        "Typ": "Gaming-Monitor",
        "Wandhalterung": "VESA kompatibel (75 x 75 mm)",
        "Zubeh\u00f6r": "Vorhanden"
    },
    "raw_specifications_text": "Energieeffizienzklasse (SDR): F (A - G)\nEnergieverbauch pro 1000 Stunden (SDR): 26 kWh\nLeistungsaufnahme im Ein-Zustand bei Standard-Dynamikumfang (SDR): 26 Watt\nLeistungsaufnahme im Bereitschafts- und Aus-Zustand: 0,5 Watt\nBildschirmdiagonale: 69 cm (27 Zoll)\nBildschirmaufl\u00f6sung: 1.920 x 1.080 Pixel\nTyp: Gaming-Monitor\nFarbe: schwarz\nEAN: 4719072864439\nHersteller-Nr.: 9S6-3CC32H-013\nGeeignet f\u00fcr: Gaming\nBild: Glaretyp\n: AMD FreeSync, Kensington-Schloss\nFrequenz: Vertikal\nBeleuchtung: Ja, Mehrfarbig\nAnschl\u00fcsse: 2x HDMI-Eingang, (HDMI-Version: 2.0), 1x DisplayPort-Eingang, (DisplayPort-Version: 1.2a), 1x Kopfh\u00f6rer-Ausgang\nErgonomie: Typ\nStromversorgung: Eco-Off\nStandards: Video\nWandhalterung: VESA kompatibel (75 x 75 mm)\nFeatures: Less Blue Light Pro, Frameless Design, MSI Night Vision\nZubeh\u00f6r: Vorhanden\nAbmessungen: Breite: 60,65 cm x H\u00f6he: 48,22 cm x Tiefe/L\u00e4nge: 24,56 cm\nGewicht: 5,6 kg",
    "reference_file": "offer_reference_918.json",
    "shop_name": "Alternate.at"
}