{
    "html_file": "offer_501_13.html",
    "name": "Samsung UR550 / UR552 / UR554 (2023), 28\"",
    "offer_link": "https://www.playox.de/productredirect/index/sku/25626265?sPartner=p-geizhals-at&campaign=psm/geizhals-at/",
    "price": 220.73,
    "raw_specifications": {
        "Anschl\u00fcsse": "DisplayPort, HDMI, Kopfh\u00f6reranschluss, Audioausgang (Line-Out)",
        "Artikelnummer": "25626265",
        "Aufl\u00f6sung Kurzname": "Full HD, UHD, 4K",
        "Bezeichnung des Herstellers": "Samsung U28R550UQP",
        "Bildwiederholungsrate": "60,00",
        "Breite": "6388,00",
        "Display Features": "FlickerFree, Bild an Bild (PbP) Funktion, Bild in Bild (PiP) Funktion",
        "Display Sync": "AMD FreeSync, Adaptive Sync",
        "Displaygr\u00f6\u00dfe": "71,12 cm (28 Zoll)",
        "EEK - Spektrum": "AG",
        "Energieeffizienzklasse": "F",
        "Geh\u00e4usefarbe des Ger\u00e4tes": "Sonstige",
        "Gewicht": "7,80",
        "Gewicht inkl. Verpackung in Kg": "7,60",
        "Helligkeit Bereich": "300 - 450 cd/m\u00b2",
        "Hersteller": "Samsung",
        "H\u00f6he": "4793,00",
        "Kapazit\u00e4t (Seiten)": "0",
        "Kontrastverh\u00e4ltnis (typisch) Bereich": "800:1 bis 1.200:1",
        "LCD-Technologie": "IPS Panel",
        "L\u00e4nge": "2505,00",
        "Produktart": "Monitore",
        "Reaktionszeit": "4,00",
        "Seitenverh\u00e4ltnis": "16:9",
        "Shop Herstellernummer": "LU28R550UQPXEN",
        "Standard-EAN": "8806094771831",
        "Verpackung - Breite in cm": "73,20",
        "Verpackung - H\u00f6he in cm": "17,60",
        "Verpackung - L\u00e4nge in cm": "46,50",
        "max. Aufl\u00f6sung": "3.840 x 2.160 Pixel (16:9)"
    },
    "raw_specifications_text": "Geh\u00e4usefarbe des Ger\u00e4tes: Sonstige\nHersteller: Samsung\nProduktart: Monitore\nAnschl\u00fcsse: DisplayPort, HDMI, Kopfh\u00f6reranschluss, Audioausgang (Line-Out)\nDisplay Features: FlickerFree, Bild an Bild (PbP) Funktion, Bild in Bild (PiP) Funktion\nKontrastverh\u00e4ltnis (typisch) Bereich: 800:1 bis 1.200:1\nHelligkeit Bereich: 300 - 450 cd/m\u00b2\nDisplaygr\u00f6\u00dfe: 71,12 cm (28 Zoll)\nDisplay Sync: AMD FreeSync, Adaptive Sync\nKapazit\u00e4t (Seiten): 0\nAufl\u00f6sung Kurzname: Full HD, UHD, 4K\nEEK - Spektrum: AG\nArtikelnummer: 25626265\nStandard-EAN: 8806094771831\nShop Herstellernummer: LU28R550UQPXEN\nBezeichnung des Herstellers: Samsung U28R550UQP\nVerpackung - L\u00e4nge in cm: 46,50\nVerpackung - Breite in cm: 73,20\nGewicht: 7,80\nGewicht inkl. Verpackung in Kg: 7,60\nL\u00e4nge: 2505,00\nVerpackung - H\u00f6he in cm: 17,60\nBreite: 6388,00\nH\u00f6he: 4793,00\nmax. Aufl\u00f6sung: 3.840 x 2.160 Pixel (16:9)\nSeitenverh\u00e4ltnis: 16:9\nLCD-Technologie: IPS Panel\nReaktionszeit: 4,00\nBildwiederholungsrate: 60,00\nEnergieeffizienzklasse: F",
    "reference_file": "offer_reference_501.json",
    "shop_name": "playox (AT)"
}