{
    "html_file": "offer_1904_21.html",
    "name": "Lenovo ThinkVision T22v-20, 21.5\"",
    "offer_link": "https://www.alternate.at/Lenovo/ThinkVision-T22v-20-LED-Monitor/html/product/1668699?partner=AtGeizhalsat&campaign=Monitor/Lenovo/1668699",
    "price": 218.9,
    "raw_specifications": {
        "": "Ausgangsleistung",
        "Abmessungen": "Breite: 56,3 cm x H\u00f6he: 48,93 cm x Tiefe/L\u00e4nge: 20,5 cm",
        "Anschl\u00fcsse": "1x HDMI-Eingang, (HDMI-Version: 1.4), 1x DisplayPort-Eingang, (DisplayPort-Version: 1.2), 1x VGA-Eingang, 1x 3,5-mm-Audio-Ausgang, 3x USB-A-3.2 Gen 1 (5 Gbit/s)",
        "Bild": "Glaretyp",
        "Bildschirmaufl\u00f6sung": "1.920 x 1.080 Pixel",
        "Bildschirmdiagonale": "54,6 cm (21,5 Zoll)",
        "EAN": "0194632369496",
        "Energieeffizienzklasse (SDR)": "D (A - G)",
        "Energieverbauch pro 1000 Stunden (SDR)": "11 kWh",
        "Ergonomie": "Typ",
        "Farbe": "schwarz",
        "Features": "Integrierte Webcam, Integrierte Mikrofone, Kabelmanagement",
        "Geeignet f\u00fcr": "Business",
        "Gewicht": "5,5 kg",
        "Hersteller-Nr.": "61FBMAT6EU",
        "Lautsprecher": "2 Lautsprecher",
        "Leistungsaufnahme im Bereitschafts- und Aus-Zustand": "0,2 Watt",
        "Leistungsaufnahme im Ein-Zustand bei Standard-Dynamikumfang (SDR)": "11,1 Watt",
        "Rahmen": "Breite",
        "Stromversorgung": "Eco-Off",
        "Typ": "LED-Monitor",
        "Wandhalterung": "VESA kompatibel (100 x 100 mm)",
        "Zubeh\u00f6r": "Vorhanden"
    },
    "raw_specifications_text": "Energieeffizienzklasse (SDR): D (A - G)\nEnergieverbauch pro 1000 Stunden (SDR): 11 kWh\nLeistungsaufnahme im Ein-Zustand bei Standard-Dynamikumfang (SDR): 11,1 Watt\nLeistungsaufnahme im Bereitschafts- und Aus-Zustand: 0,2 Watt\nBildschirmdiagonale: 54,6 cm (21,5 Zoll)\nBildschirmaufl\u00f6sung: 1.920 x 1.080 Pixel\nTyp: LED-Monitor\nFarbe: schwarz\nEAN: 0194632369496\nHersteller-Nr.: 61FBMAT6EU\nGeeignet f\u00fcr: Business\nBild: Glaretyp\n: Ausgangsleistung\nRahmen: Breite\nAnschl\u00fcsse: 1x HDMI-Eingang, (HDMI-Version: 1.4), 1x DisplayPort-Eingang, (DisplayPort-Version: 1.2), 1x VGA-Eingang, 1x 3,5-mm-Audio-Ausgang, 3x USB-A-3.2 Gen 1 (5 Gbit/s)\nErgonomie: Typ\nStromversorgung: Eco-Off\nLautsprecher: 2 Lautsprecher\nWandhalterung: VESA kompatibel (100 x 100 mm)\nFeatures: Integrierte Webcam, Integrierte Mikrofone, Kabelmanagement\nZubeh\u00f6r: Vorhanden\nAbmessungen: Breite: 56,3 cm x H\u00f6he: 48,93 cm x Tiefe/L\u00e4nge: 20,5 cm\nGewicht: 5,5 kg",
    "reference_file": "offer_reference_1904.json",
    "shop_name": "Alternate.at"
}