{
    "html_file": "offer_501_23.html",
    "name": "Samsung UR550 / UR552 / UR554 (2023), 28\"",
    "offer_link": "https://www.amazon.de/dp/B0BQWJD56P?linkCode=xm2&camp=2025&creative=165953&smid=A3JWKAKR8XB7XF&creativeASIN=B0BQWJD56P&tag=geizhals1-21",
    "price": 226.16,
    "raw_specifications": {
        "ASIN": "B0BQWJD56P",
        "Amazon Bestseller-Rang": "Nr. 2,385 in Computer & Zubeh\u00f6r (Siehe Top 100 in Computer & Zubeh\u00f6r)  Nr. 45 in Monitore",
        "Antriebsart": "\u200eAC (Wechselstrom)",
        "Anzahl HDMI Schnittstellen": "\u200e2",
        "Artikelgewicht": "\u200e5,6 Kilograms",
        "Auslaufartikel (Produktion durch Hersteller eingestellt)": "\u200eNein",
        "Batterien enthalten": "\u200eNein",
        "Bildschirmaufl\u00f6sung": "\u200e3840 x 2160",
        "Display-Gr\u00f6\u00dfe": "\u200e28",
        "Durchschnittliche Kundenbewertung": "4,5  4,5 von 5 Sternen    \n    1.059 Sternebewertungen   \n\n\n 4,5 von 5 Sternen",
        "Farbe": "\u200eDunkelblau-Grau",
        "Garantierte Software-Updates bis": "\u200eunbekannt",
        "Hersteller": "\u200eSamsung",
        "Im Angebot von Amazon.de seit": "4. Januar 2023",
        "L\u00f6sung": "\u200e3840 x 2160",
        "Marke": "\u200eSamsung",
        "Modell/Serie": "\u200eUHD Monitor UR55 (28\")",
        "Modellnummer": "\u200eLU28R550UQPXEN",
        "Produktabmessungen": "\u200e50 x 50 x 28 cm; 5,6 Kilogramm",
        "Volt": "\u200e240 Volt",
        "Watt": "\u200e27 Watt"
    },
    "raw_specifications_text": "Marke: \u200eSamsung\nHersteller: \u200eSamsung\nModell/Serie: \u200eUHD Monitor UR55 (28\")\nProduktabmessungen: \u200e50 x 50 x 28 cm; 5,6 Kilogramm\nModellnummer: \u200eLU28R550UQPXEN\nAuslaufartikel (Produktion durch Hersteller eingestellt): \u200eNein\nFarbe: \u200eDunkelblau-Grau\nDisplay-Gr\u00f6\u00dfe: \u200e28\nBildschirmaufl\u00f6sung: \u200e3840 x 2160\nL\u00f6sung: \u200e3840 x 2160\nAnzahl HDMI Schnittstellen: \u200e2\nVolt: \u200e240 Volt\nWatt: \u200e27 Watt\nAntriebsart: \u200eAC (Wechselstrom)\nBatterien enthalten: \u200eNein\nArtikelgewicht: \u200e5,6 Kilograms\nGarantierte Software-Updates bis: \u200eunbekannt\nASIN: B0BQWJD56P\nDurchschnittliche Kundenbewertung: 4,5  4,5 von 5 Sternen    \n    1.059 Sternebewertungen   \n\n\n 4,5 von 5 Sternen\nAmazon Bestseller-Rang: Nr. 2,385 in Computer & Zubeh\u00f6r (Siehe Top 100 in Computer & Zubeh\u00f6r)  Nr. 45 in Monitore\nIm Angebot von Amazon.de seit: 4. Januar 2023",
    "reference_file": "offer_reference_501.json",
    "shop_name": "Amazon.at"
}