{
    "html_file": "offer_971_2.html",
    "name": "HP E24m G4, 23.8\"",
    "offer_link": "https://www.playox.de/productredirect/index/sku/20336636?sPartner=p-geizhals-at&campaign=psm/geizhals-at/",
    "price": 271.36,
    "raw_specifications": {
        "Anschl\u00fcsse": "USB, DisplayPort, HDMI, VGA/D-Sub, Audioausgang (Line-Out), Audioeingang (Line-In)",
        "Artikelnummer": "20336636",
        "Aufl\u00f6sung Kurzname": "Full HD",
        "Bezeichnung des Herstellers": "HP E24m G4",
        "Bildwiederholungsrate": "60,00 Hz",
        "Breite": "5394,00 mm",
        "Display Features": "FlickerFree",
        "Displaygr\u00f6\u00dfe": "60,96 cm (24 Zoll)",
        "Displayoberfl\u00e4che": "matt",
        "EEK - Spektrum": "AG",
        "Einsatzort": "Innen",
        "Energieeffizienzklasse": "E",
        "Geh\u00e4usefarbe des Ger\u00e4tes": "Schwarz",
        "Gewicht": "7,39 kg",
        "Gewicht inkl. Verpackung in Kg": "0,00 kg",
        "Helligkeit Bereich": "150 - 300 cd/m\u00b2",
        "Hersteller": "HP Inc.",
        "H\u00f6he": "5307,00 mm",
        "Inhalt (ml oder g)": "0,00 ml",
        "Kapazit\u00e4t (Seiten)": "0",
        "Kontrastverh\u00e4ltnis (typisch) Bereich": "800:1 bis 1.200:1",
        "LCD-Technologie": "IPS Panel",
        "L\u00e4nge": "216,00 mm",
        "Produktart": "Monitore",
        "Reaktionszeit": "5,00 ms",
        "Seitenverh\u00e4ltnis": "16:9",
        "Shop Herstellernummer": "40Z32AA#ABB",
        "Standard-EAN": "0195908730736",
        "Verbindungen": "Netzwerk (LAN)",
        "max. Aufl\u00f6sung": "1.920 x 1.080 Pixel (16:9)"
    },
    "raw_specifications_text": "Geh\u00e4usefarbe des Ger\u00e4tes: Schwarz\nAnschl\u00fcsse: USB, DisplayPort, HDMI, VGA/D-Sub, Audioausgang (Line-Out), Audioeingang (Line-In)\nProduktart: Monitore\nDisplaygr\u00f6\u00dfe: 60,96 cm (24 Zoll)\nHelligkeit Bereich: 150 - 300 cd/m\u00b2\nDisplay Features: FlickerFree\nHersteller: HP Inc.\nKontrastverh\u00e4ltnis (typisch) Bereich: 800:1 bis 1.200:1\nVerbindungen: Netzwerk (LAN)\nGewicht: 7,39 kg\nGewicht inkl. Verpackung in Kg: 0,00 kg\nInhalt (ml oder g): 0,00 ml\nKapazit\u00e4t (Seiten): 0\nAufl\u00f6sung Kurzname: Full HD\nEEK - Spektrum: AG\nL\u00e4nge: 216,00 mm\nBreite: 5394,00 mm\nArtikelnummer: 20336636\nStandard-EAN: 0195908730736\nShop Herstellernummer: 40Z32AA#ABB\nBezeichnung des Herstellers: HP E24m G4\nH\u00f6he: 5307,00 mm\nmax. Aufl\u00f6sung: 1.920 x 1.080 Pixel (16:9)\nSeitenverh\u00e4ltnis: 16:9\nLCD-Technologie: IPS Panel\nReaktionszeit: 5,00 ms\nDisplayoberfl\u00e4che: matt\nBildwiederholungsrate: 60,00 Hz\nEinsatzort: Innen\nEnergieeffizienzklasse: E",
    "reference_file": "offer_reference_971.json",
    "shop_name": "playox (AT)"
}