{
    "html_file": "offer_1708_23.html",
    "name": "Philips P-line 326P1H, 31.5\"",
    "offer_link": "https://syswork.at/sw/index.html?open&mid=Artikel&artid=mon-1169&from=geizhals.at",
    "price": 569.0,
    "raw_specifications": {
        "AC Eingangsfrequenz": "50/60 Hz",
        "AC Eingangsspannung": "100 - 240 V",
        "Abnehmbarer Standfu\u00df": "Ja",
        "Adobe RGB-Abdeckung": "87%",
        "Anzahl DisplayPort Anschl\u00fcsse": "2",
        "Anzahl HDMI-Anschl\u00fcsse": "2",
        "Anzahl OSD-Sprachen": "21",
        "Anzahl der Farben des Displays": "1,07 Milliarden Farben",
        "Anzahl der Lautsprecher": "2",
        "Anzahl der Upstream-Ports USB Typ-C": "1",
        "Anzahl der nachgeschalteten Steckpl\u00e4tze vom Typ USB-A": "4",
        "Anzahl der vorgeschalteten Steckpl\u00e4tze": "1",
        "Audioanschl\u00fcsse": "Nein",
        "Audioausgang": "Ja",
        "Au\u00dfenverkleidungstyp": "Texturiert",
        "Beh\u00f6rdliche Zulassung": "CB; TUV/GS; TUV Ergo; SEMKO; CU-EAC; EAEU RoHS; CCC; CEL; CECP; CE Mark; FCC Class B; ICES-003; TUV Eye Comfort certified",
        "Betriebsanleitung": "Ja",
        "Betriebstemperatur": "0 - 40 \u00b0C",
        "Bild-Verbesserung": "SmartImage",
        "Bildschirmdiagonale": "80 cm (31.5 Zoll)",
        "Bildschirmdiagonale (cm)": "80 cm",
        "Bildschirmform": "Flach",
        "Bildschirmtechnologie": "LED",
        "Bildwinkel, horizontal": "178\u00b0",
        "Bildwinkel, vertikal": "178\u00b0",
        "Blendfreier Bildschirm": "Ja",
        "Breite (ohne Standfu\u00df)": "71,4 cm",
        "DDC/CI": "Ja",
        "DVI Anschluss": "Nein",
        "Datenblatt": "Kein Datenblatt verf\u00fcgbar",
        "Delta E": "2",
        "Digital horizontale Frequenz": "30 - 114 kHz",
        "Digital vertikale Frequenz": "48 - 75 Hz",
        "Display-Aufl\u00f6sung": "2560 x 1440 Pixel",
        "DisplayPorts ausgang": "Ja",
        "DisplayPorts-Version": "1.4",
        "Dynamisches Kontrastverh\u00e4ltnis Marketingbezeichnung": "SmartContrast",
        "Einfach zu lesen Modus": "Ja",
        "Eingebaute Lautsprecher": "Ja",
        "Eingebauter Ethernet-Anschluss": "Ja",
        "Eingebautes Mikrofon": "Ja",
        "Energieeffizienzklasse (SDR)": "G",
        "Energieeffizienzskala": "A bis G",
        "Energieverbrauch (SDR) pro 1.000 Stunden": "39 kWh",
        "Enth\u00e4lt nicht": "Quecksilber, PVC/BFR",
        "Ethernet LAN Datentransferraten": "10,100,1000 Mbit/s",
        "Farbskala": "89%",
        "Flimmerfreie Technologie": "Ja",
        "Fu\u00dffarbe": "Schwarz",
        "Ger\u00e4tebreite (inkl. Fu\u00df)": "714 mm",
        "Ger\u00e4teh\u00f6he (inkl. Fu\u00df)": "649 mm",
        "Ger\u00e4tetiefe (inkl. Fu\u00df)": "280 mm",
        "Gewicht (mit St\u00e4nder)": "12,2 kg",
        "Gewicht (ohne St\u00e4nder)": "8,21 kg",
        "HBR3-Unterst\u00fctzung": "Ja",
        "HD-Typ": "Quad HD",
        "HDCP": "Ja",
        "HDCP-Version": "2.2",
        "HDMI": "Ja",
        "HDMI-Version": "1.4",
        "Helligkeit (typisch)": "350 cd/m\u00b2",
        "Herstellerlink": "Philips",
        "Horizontaler Scanbereich": "30 - 114 kHz",
        "H\u00f6he (ohne Standfu\u00df)": "42,2 cm",
        "H\u00f6he bei Betrieb": "0 - 3658 m",
        "H\u00f6he bei Lagerung": "0 - 12192 m",
        "H\u00f6heneinstellung": "18 cm",
        "H\u00f6henverstellung": "Ja",
        "Integrierte Kamera": "Ja",
        "Integrierter USB-Hub": "Ja",
        "Kabelsperre-Slot": "Ja",
        "Komponentenvideo-Synchronisation": "Separate sync",
        "Kontrastverh\u00e4ltnis": "1000:1",
        "Kontrastverh\u00e4ltnis (dynamisch)": "50000000:1",
        "Kopfh\u00f6rerausgang": "Nein",
        "LED-Anzeigen": "T\u00e4tigkeit, Stand-by",
        "Lichtsensor": "Ja",
        "Low-Blue-Light-Technologie": "Ja",
        "LowBlue-Modus": "Ja",
        "Marktpositionierung": "Haus",
        "Maximale Bildwiederholrate": "75 Hz",
        "Megapixel (ca.)": "2 MP",
        "Men\u00fcsprachen": "Vereinfachtes Chinesisch, Traditionelles Chinesisch, Tschechisch, Deutsch, Niederl\u00e4ndisch, Englisch, Spanisch, Finnisch, Franz\u00f6sisch, Griechisch, Ungarisch, Italienisch, Japanisch, Koreanisch, Polnisch, Portugiesisch, Russisch, Schwedisch, T\u00fcrkisch, Ukrainisch",
        "Mitgelieferte Kabel": "HDMI, DisplayPort, USB Typ-C, AC",
        "Mitgelieferte Software": "SmartControl",
        "Mittlere Betriebsdauer zwischen Ausf\u00e4llen (MTBF)": "70000 h",
        "NTSC Abdeckung (typisch)": "106%",
        "Nach Gebrauch recycelter Kunststoff": "85%",
        "Nachhaltigkeitszertifikate": "ENERGY STAR, TCO, RoHS",
        "Natives Seitenverh\u00e4ltnis": "16:9",
        "Neigungsverstellung": "Ja",
        "Neigungswinkelbereich": "-5 - 25\u00b0",
        "Netzteiltyp": "Intern",
        "Oberfl\u00e4chenh\u00e4rte": "3H",
        "On-Screen-Display (OSD)": "Ja",
        "Paketgewicht": "15,5 kg",
        "Panel-Montage-Schnittstelle": "100 x 100 mm",
        "Panel-Typ": "IPS",
        "Philips SmartUniformity": "93 - 105%",
        "Pivot": "Ja",
        "Pivot Winkel": "-90 - 90\u00b0",
        "Pixel Abstand": "0,2727 x 0,2727 mm",
        "Pixeldichte": "93 ppi",
        "Plug & Play": "Ja",
        "Produktfarbe": "Schwarz",
        "Produktlink": "Link",
        "RGB-Farbraum": "sRGB",
        "RMS-Leistung": "10 W",
        "Reaktionszeit": "4 ms",
        "Recycelbares Verpackungsmaterial": "100%",
        "Relative Luftfeuchtigkeit in Betrieb": "20 - 80%",
        "Schwenkbar": "Ja",
        "Schwenkwinkelbereich": "-180 - 180\u00b0",
        "Schwermetallfrei": "Hg (Quecksilber), Pb (Blei)",
        "Seitenverh\u00e4ltnis": "16:9",
        "Sichtbare Gr\u00f6\u00dfe (horizontal)": "69,8 cm",
        "Sichtbare Gr\u00f6\u00dfe (vertikal)": "39,3 cm",
        "Slot-Typ Kabelsperre": "Kensington",
        "Stromeingang": "Ja",
        "Stromverbrauch (PowerSave)": "24 W",
        "Stromverbrauch (Standardbetrieb)": "25,3 W",
        "Stromverbrauch (Standby)": "0,3 W",
        "St\u00e4nder enthalten": "Ja",
        "Temperaturbereich bei Lagerung": "-20 - 60 \u00b0C",
        "Tiefe (ohne Standfu\u00df)": "6,2 cm",
        "Touchscreen": "Nein",
        "Tr\u00fcbungsrate": "25%",
        "Typ der Hintergrundbeleuchtung": "W-LED",
        "USB Power Delivery": "Ja",
        "USB-Hub-Version": "3.2 Gen 1 (3.1 Gen 1)",
        "USB-Stromversorgung Revision": "3.0",
        "USB-Stromversorgung bis zu": "90 W",
        "USB-Typ-C DisplayPort-Wechselmodus": "Ja",
        "USB-Upstream-Porttyp": "USB Typ-C",
        "Unterst\u00fctzte Grafik-Aufl\u00f6sungen": "2560 x 1440",
        "VESA-Halterung": "Ja",
        "Verpackungsart": "Box",
        "Verpackungsbreite": "930 mm",
        "Verpackungsh\u00f6he": "563 mm",
        "Verpackungstiefe": "186 mm",
        "Vertikaler Scanbereich": "48 - 75 Hz",
        "Vorderer Rahmen": "Schwarz",
        "Wake-On-LAN": "Ja",
        "Warentarifnummer (HS)": "85285210",
        "Zertifizierung": "CB, TUV/GS, TUV Ergo, SEMKO, CU-EAC, EAEU RoHS, CCC, CEL, CECP, CE Mark, FCC Class B, ICES-003, TUV Eye Comfort certified",
        "sRGB": "Ja",
        "sRGB Abdeckung (klassisch)": "118%"
    },
    "raw_specifications_text": "Bildschirmdiagonale: 80 cm (31.5 Zoll)\nDisplay-Aufl\u00f6sung: 2560 x 1440 Pixel\nNatives Seitenverh\u00e4ltnis: 16:9\nBildschirmtechnologie: LED\nTouchscreen: Nein\nHD-Typ: Quad HD\nPanel-Typ: IPS\nBildschirmform: Flach\nKontrastverh\u00e4ltnis: 1000:1\nMaximale Bildwiederholrate: 75 Hz\nAnzahl der Farben des Displays: 1,07 Milliarden Farben\nTyp der Hintergrundbeleuchtung: W-LED\nHelligkeit (typisch): 350 cd/m\u00b2\nReaktionszeit: 4 ms\nBlendfreier Bildschirm: Ja\nUnterst\u00fctzte Grafik-Aufl\u00f6sungen: 2560 x 1440\nSeitenverh\u00e4ltnis: 16:9\nKontrastverh\u00e4ltnis (dynamisch): 50000000:1\nDynamisches Kontrastverh\u00e4ltnis Marketingbezeichnung: SmartContrast\nBildwinkel, horizontal: 178\u00b0\nBildwinkel, vertikal: 178\u00b0\nPixel Abstand: 0,2727 x 0,2727 mm\nPixeldichte: 93 ppi\nHorizontaler Scanbereich: 30 - 114 kHz\nVertikaler Scanbereich: 48 - 75 Hz\nSichtbare Gr\u00f6\u00dfe (horizontal): 69,8 cm\nSichtbare Gr\u00f6\u00dfe (vertikal): 39,3 cm\nDigital horizontale Frequenz: 30 - 114 kHz\nDigital vertikale Frequenz: 48 - 75 Hz\nBildschirmdiagonale (cm): 80 cm\nDDC/CI: Ja\nTr\u00fcbungsrate: 25%\nOberfl\u00e4chenh\u00e4rte: 3H\nRGB-Farbraum: sRGB\nFarbskala: 89%\nsRGB Abdeckung (klassisch): 118%\nNTSC Abdeckung (typisch): 106%\nAdobe RGB-Abdeckung: 87%\nsRGB: Ja\nKomponentenvideo-Synchronisation: Separate sync\nFlimmerfreie Technologie: Ja\nLow-Blue-Light-Technologie: Ja\nHBR3-Unterst\u00fctzung: Ja\nEingebaute Lautsprecher: Ja\nIntegrierte Kamera: Ja\nAnzahl der Lautsprecher: 2\nRMS-Leistung: 10 W\nMegapixel (ca.): 2 MP\nEingebautes Mikrofon: Ja\nMarktpositionierung: Haus\nProduktfarbe: Schwarz\nVorderer Rahmen: Schwarz\nAbnehmbarer Standfu\u00df: Ja\nFu\u00dffarbe: Schwarz\nSchwermetallfrei: Hg (Quecksilber), Pb (Blei)\nZertifizierung: CB, TUV/GS, TUV Ergo, SEMKO, CU-EAC, EAEU RoHS, CCC, CEL, CECP, CE Mark, FCC Class B, ICES-003, TUV Eye Comfort certified\nIntegrierter USB-Hub: Ja\nHDMI: Ja\nKopfh\u00f6rerausgang: Nein\nUSB-Hub-Version: 3.2 Gen 1 (3.1 Gen 1)\nUSB-Upstream-Porttyp: USB Typ-C\nAnzahl der vorgeschalteten Steckpl\u00e4tze: 1\nAnzahl der Upstream-Ports USB Typ-C: 1\nAnzahl der nachgeschalteten Steckpl\u00e4tze vom Typ USB-A: 4\nUSB-Typ-C DisplayPort-Wechselmodus: Ja\nUSB Power Delivery: Ja\nUSB-Stromversorgung bis zu: 90 W\nDVI Anschluss: Nein\nAnzahl HDMI-Anschl\u00fcsse: 2\nHDMI-Version: 1.4\nAnzahl DisplayPort Anschl\u00fcsse: 2\nDisplayPorts-Version: 1.4\nAudioanschl\u00fcsse: Nein\nAudioausgang: Ja\nHDCP: Ja\nHDCP-Version: 2.2\nStromeingang: Ja\nDisplayPorts ausgang: Ja\nEingebauter Ethernet-Anschluss: Ja\nVESA-Halterung: Ja\nKabelsperre-Slot: Ja\nH\u00f6henverstellung: Ja\nPanel-Montage-Schnittstelle: 100 x 100 mm\nSlot-Typ Kabelsperre: Kensington\nH\u00f6heneinstellung: 18 cm\nPivot: Ja\nPivot Winkel: -90 - 90\u00b0\nSchwenkbar: Ja\nSchwenkwinkelbereich: -180 - 180\u00b0\nNeigungswinkelbereich: -5 - 25\u00b0\nOn-Screen-Display (OSD): Ja\nMen\u00fcsprachen: Vereinfachtes Chinesisch, Traditionelles Chinesisch, Tschechisch, Deutsch, Niederl\u00e4ndisch, Englisch, Spanisch, Finnisch, Franz\u00f6sisch, Griechisch, Ungarisch, Italienisch, Japanisch, Koreanisch, Polnisch, Portugiesisch, Russisch, Schwedisch, T\u00fcrkisch, Ukrainisch\nAnzahl OSD-Sprachen: 21\nPlug & Play: Ja\nLED-Anzeigen: T\u00e4tigkeit, Stand-by\nNeigungsverstellung: Ja\nEnergieeffizienzklasse (SDR): G\nEnergieverbrauch (SDR) pro 1.000 Stunden: 39 kWh\nStromverbrauch (Standardbetrieb): 25,3 W\nStromverbrauch (Standby): 0,3 W\nStromverbrauch (PowerSave): 24 W\nAC Eingangsspannung: 100 - 240 V\nAC Eingangsfrequenz: 50/60 Hz\nNetzteiltyp: Intern\nEnergieeffizienzskala: A bis G\nBetriebstemperatur: 0 - 40 \u00b0C\nTemperaturbereich bei Lagerung: -20 - 60 \u00b0C\nRelative Luftfeuchtigkeit in Betrieb: 20 - 80%\nH\u00f6he bei Betrieb: 0 - 3658 m\nH\u00f6he bei Lagerung: 0 - 12192 m\nSt\u00e4nder enthalten: Ja\nMitgelieferte Kabel: HDMI, DisplayPort, USB Typ-C, AC\nBetriebsanleitung: Ja\nMitgelieferte Software: SmartControl\nGer\u00e4tebreite (inkl. Fu\u00df): 714 mm\nGer\u00e4tetiefe (inkl. Fu\u00df): 280 mm\nGer\u00e4teh\u00f6he (inkl. Fu\u00df): 649 mm\nGewicht (mit St\u00e4nder): 12,2 kg\nBreite (ohne Standfu\u00df): 71,4 cm\nTiefe (ohne Standfu\u00df): 6,2 cm\nH\u00f6he (ohne Standfu\u00df): 42,2 cm\nGewicht (ohne St\u00e4nder): 8,21 kg\nVerpackungsbreite: 930 mm\nVerpackungstiefe: 186 mm\nVerpackungsh\u00f6he: 563 mm\nPaketgewicht: 15,5 kg\nVerpackungsart: Box\nNachhaltigkeitszertifikate: ENERGY STAR, TCO, RoHS\nEnth\u00e4lt nicht: Quecksilber, PVC/BFR\nNach Gebrauch recycelter Kunststoff: 85%\nWarentarifnummer (HS): 85285210\nUSB-Stromversorgung Revision: 3.0\nAu\u00dfenverkleidungstyp: Texturiert\nRecycelbares Verpackungsmaterial: 100%\nLichtsensor: Ja\nEinfach zu lesen Modus: Ja\nLowBlue-Modus: Ja\nPhilips SmartUniformity: 93 - 105%\nMittlere Betriebsdauer zwischen Ausf\u00e4llen (MTBF): 70000 h\nEthernet LAN Datentransferraten: 10,100,1000 Mbit/s\nBild-Verbesserung: SmartImage\nBeh\u00f6rdliche Zulassung: CB; TUV/GS; TUV Ergo; SEMKO; CU-EAC; EAEU RoHS; CCC; CEL; CECP; CE Mark; FCC Class B; ICES-003; TUV Eye Comfort certified\nDelta E: 2\nWake-On-LAN: Ja\nDatenblatt: Kein Datenblatt verf\u00fcgbar\nProduktlink: Link\nHerstellerlink: Philips",
    "reference_file": "offer_reference_1708.json",
    "shop_name": "Syswork"
}