{
    "html_file": "offer_1881_12.html",
    "name": "BenQ BL2483TM, 24\"",
    "offer_link": "https://www.ditech.at/details.php?artnr=304785",
    "price": 170.9,
    "raw_specifications": {
        "Abmessungen (BxHxT)": "565x433x238mm (mit Standfu\u00df),  565x338x51mm (ohne Standfu\u00df)",
        "Anschl\u00fcsse - DVI": "1",
        "Anschl\u00fcsse - DisplayPort": "1",
        "Anschl\u00fcsse - VGA": "1",
        "Anschl\u00fcsse - VGA (60Hz@1920x1080)": "1",
        "Anschl\u00fcsse - VGA 60Hz@1920x1080": "1",
        "Anwendung": "station\u00e4r",
        "Audio": "Lautsprecher (2x 1W),  1x Line-In,  1x Line-Out",
        "Aufl\u00f6sung": "1920x1080",
        "Beschichtung": "matt (non-glare)",
        "Besonderheiten": "EPEAT Bronze,  mechanische Tasten,  Sicherheitsschloss (Kensington)",
        "Bildwiederholfrequenz": "60Hz",
        "Blickwinkel": "170\u00b0/160\u00b0",
        "Diagonale": "24\"/61cm",
        "Energieverbrauch SDR": "18kWh/1000h",
        "Ergonomie": "140mm (h\u00f6henverstellbar),  90\u00b0 (Pivot),  N/A (drehbar),  +35\u00b0/-5\u00b0 (neigbar),  keine Angabe (Schr\u00e4glage)",
        "FRC": "unbekannt",
        "Farbe": "schwarz",
        "Farbraum - sRGB": "100%",
        "Farbtiefe": "8bit (16.7 Mio. Farben)",
        "Form": "gerade (flat)",
        "Gewicht": "5.50kg (mit Standfu\u00df),  3.00kg (ohne Standfu\u00df)",
        "HDR": "N/A",
        "Helligkeit": "250cd/m\u00b2",
        "Herstellergarantie": "drei Jahre",
        "Hintergrundbeleuchtung": "White-LED,  flicker-free,  Blaulichtfilter",
        "Kontrast - dynamisch": "12.000.000:1",
        "Kontrast - statisch": "1.000:1",
        "Lautsprecher": "Ja",
        "Leistungsaufnahme": "keine Angabe (maximal),  25W (typisch),  keine Angabe (Energielabel alt A+++ bis G),  0.5W (Standby)",
        "Panel": "TN",
        "Reaktionszeit - GtG": "1ms",
        "Screen-to-Body-Ratio": "83.1% (berechnet)",
        "Seitenverh\u00e4ltnis": "16:9",
        "Signalfrequenz": "30-83kHz (horizontal),  50-76Hz (vertikal)",
        "Stromversorgung": "AC-In (internes Netzteil)",
        "USB-Hub In": "N/A",
        "USB-Hub Out": "N/A",
        "USB-Schreibweise": "Link",
        "VESA": "100x100 (belegt)",
        "VRR (Variable Refresh Rate)": "N/A",
        "Weitere Anschl\u00fcsse": "N/A"
    },
    "raw_specifications_text": "Abmessungen (BxHxT): 565x433x238mm (mit Standfu\u00df),  565x338x51mm (ohne Standfu\u00df)\nAnschl\u00fcsse - DisplayPort: 1\nAnschl\u00fcsse - DVI: 1\nAnschl\u00fcsse - VGA: 1\nAnschl\u00fcsse - VGA (60Hz@1920x1080): 1\nAnschl\u00fcsse - VGA 60Hz@1920x1080: 1\nAnwendung: station\u00e4r\nAudio: Lautsprecher (2x 1W),  1x Line-In,  1x Line-Out\nAufl\u00f6sung: 1920x1080\nBeschichtung: matt (non-glare)\nBesonderheiten: EPEAT Bronze,  mechanische Tasten,  Sicherheitsschloss (Kensington)\nBildwiederholfrequenz: 60Hz\nBlickwinkel: 170\u00b0/160\u00b0\nDiagonale: 24\"/61cm\nEnergieverbrauch SDR: 18kWh/1000h\nErgonomie: 140mm (h\u00f6henverstellbar),  90\u00b0 (Pivot),  N/A (drehbar),  +35\u00b0/-5\u00b0 (neigbar),  keine Angabe (Schr\u00e4glage)\nFarbe: schwarz\nFarbraum - sRGB: 100%\nFarbtiefe: 8bit (16.7 Mio. Farben)\nForm: gerade (flat)\nFRC: unbekannt\nGewicht: 5.50kg (mit Standfu\u00df),  3.00kg (ohne Standfu\u00df)\nHDR: N/A\nHelligkeit: 250cd/m\u00b2\nHerstellergarantie: drei Jahre\nHintergrundbeleuchtung: White-LED,  flicker-free,  Blaulichtfilter\nKontrast - dynamisch: 12.000.000:1\nKontrast - statisch: 1.000:1\nLautsprecher: Ja\nLeistungsaufnahme: keine Angabe (maximal),  25W (typisch),  keine Angabe (Energielabel alt A+++ bis G),  0.5W (Standby)\nPanel: TN\nReaktionszeit - GtG: 1ms\nScreen-to-Body-Ratio: 83.1% (berechnet)\nSeitenverh\u00e4ltnis: 16:9\nSignalfrequenz: 30-83kHz (horizontal),  50-76Hz (vertikal)\nStromversorgung: AC-In (internes Netzteil)\nUSB-Hub In: N/A\nUSB-Hub Out: N/A\nUSB-Schreibweise: Link\nVESA: 100x100 (belegt)\nVRR (Variable Refresh Rate): N/A\nWeitere Anschl\u00fcsse: N/A",
    "reference_file": "offer_reference_1881.json",
    "shop_name": "DiTech.at"
}