{
    "html_file": "offer_2356_9.html",
    "name": "BenQ BL2480, 23.8\"",
    "offer_link": "https://www.amazon.de/dp/B076LS2TF2?linkCode=xm2&camp=2025&creative=165953&smid=A3JWKAKR8XB7XF&creativeASIN=B076LS2TF2&tag=geizhals1-21",
    "price": 99.73,
    "raw_specifications": {
        "ASIN": "B076LS2TF2",
        "Amazon Bestseller-Rang": "Nr. 62,013 in Computer & Zubeh\u00f6r (Siehe Top 100 in Computer & Zubeh\u00f6r)  Nr. 1,185 in Monitore",
        "Anzahl HDMI Schnittstellen": "\u200e1",
        "Anzahl VGA Schnittstellen": "\u200e1",
        "Artikelgewicht": "\u200e4 Kilograms",
        "Auslaufartikel (Produktion durch Hersteller eingestellt)": "\u200eNein",
        "Batterien enthalten": "\u200eNein",
        "Bildschirmaufl\u00f6sung": "\u200e1920 x 1080 pixels",
        "Display-Gr\u00f6\u00dfe": "\u200e23,8 Zentimeter",
        "Durchschnittliche Kundenbewertung": "4,6  4,6 von 5 Sternen    \n    751 Sternebewertungen   \n\n\n 4,6 von 5 Sternen",
        "Farbe": "\u200eschwarz",
        "Garantierte Software-Updates bis": "\u200eunbekannt",
        "Hersteller": "\u200eBenQ",
        "Im Angebot von Amazon.de seit": "17. Oktober 2017",
        "Kapazit\u00e4t Lithium-Akku": "\u200e17,57 Wattstunden",
        "L\u00f6sung": "\u200e1920 x 1080",
        "Marke": "\u200eBenQ",
        "Modell/Serie": "\u200eBENQ BL2480",
        "Modellnummer": "\u200eBL2480",
        "Produktabmessungen": "\u200e54 x 17,5 x 42 cm; 4 Kilogramm",
        "Prozessorkerne": "\u200e1",
        "Volt": "\u200e240 Volt",
        "Watt": "\u200e23 Watt"
    },
    "raw_specifications_text": "Marke: \u200eBenQ\nHersteller: \u200eBenQ\nModell/Serie: \u200eBENQ BL2480\nProduktabmessungen: \u200e54 x 17,5 x 42 cm; 4 Kilogramm\nModellnummer: \u200eBL2480\nAuslaufartikel (Produktion durch Hersteller eingestellt): \u200eNein\nFarbe: \u200eschwarz\nDisplay-Gr\u00f6\u00dfe: \u200e23,8 Zentimeter\nBildschirmaufl\u00f6sung: \u200e1920 x 1080 pixels\nL\u00f6sung: \u200e1920 x 1080\nProzessorkerne: \u200e1\nAnzahl HDMI Schnittstellen: \u200e1\nAnzahl VGA Schnittstellen: \u200e1\nVolt: \u200e240 Volt\nWatt: \u200e23 Watt\nBatterien enthalten: \u200eNein\nKapazit\u00e4t Lithium-Akku: \u200e17,57 Wattstunden\nArtikelgewicht: \u200e4 Kilograms\nGarantierte Software-Updates bis: \u200eunbekannt\nASIN: B076LS2TF2\nDurchschnittliche Kundenbewertung: 4,6  4,6 von 5 Sternen    \n    751 Sternebewertungen   \n\n\n 4,6 von 5 Sternen\nAmazon Bestseller-Rang: Nr. 62,013 in Computer & Zubeh\u00f6r (Siehe Top 100 in Computer & Zubeh\u00f6r)  Nr. 1,185 in Monitore\nIm Angebot von Amazon.de seit: 17. Oktober 2017",
    "reference_file": "offer_reference_2356.json",
    "shop_name": "Amazon.at"
}