{
    "html_file": "offer_146_5.html",
    "name": "Acer KA0 KA240YHbi, 23.8\"",
    "offer_link": "https://www.proshop.at/Bildschirm/Acer-24-Bildschirm-KA240Y-Hbi-KA0-Series-LED-monitor-Full-HD-1080p-24-Black-1-ms-AMD-FreeSync/3189302?utm_source=geizhals&utm_medium=cpc&utm_campaign=pricesite",
    "price": 108.44,
    "raw_specifications": {
        "Abmessungen (Breite x Tiefe x H\u00f6he)": "54 cm x 19.2 cm x 41.4 cm - mit Fu\u00df",
        "Abmessungen (Breite x Tiefe x H\u00f6he) - mit Fu\u00df": "54 cm x 19.2 cm x 41.4 cm",
        "Adaptive-Sync Technologie": "AMD FreeSync",
        "Besonderheiten": "Acer Adaptive Contrast Management (ACM), ComfyView, breiter Betrachtungswinkel, an 3 Seiten ohne Blende, 6-bit + Hi-FRC Color Depth",
        "Bildschirmbeschichtung": "Blendfrei",
        "Bildschirmtyp": "VA",
        "Details zu Abmessungen & Gewicht": "Mit Fu\u00df - Breite: 54 cm - Tiefe: 19.2 cm - H\u00f6he: 41.4 cm - Gewicht: 3.1 kg  Ohne Fu\u00df - Breite: 54 cm - Tiefe: 6.3 cm - H\u00f6he: 32.3 cm - Gewicht: 2.7 kg",
        "Diagonalabmessung": "61 cm (24\")",
        "Display-Typ": "LED-hintergrundbeleuchteter LCD-Monitor / TFT-Aktivmatrix",
        "EAN": "4711121495731",
        "Eingangsanschl\u00fcsse": "HDMI, VGA",
        "Eingangsspannung": "Wechselstrom 120/230 V",
        "Einstellungen der Anzeigeposition": "Neigung",
        "Energie Effizienzklasse": "Klasse E",
        "Enthaltene Kabel": "1 x HDMI-Kabel",
        "Farbe": "Schwarz",
        "Farbraum": "72% NTSC",
        "Farbunterst\u00fctzung": "16,7 Millionen Farben",
        "Ger\u00e4tetyp": "LED-hintergrundbeleuchteter LCD-Monitor - 61 cm (24\")",
        "Gewicht": "3.1 kg",
        "Helligkeit": "250 cd/m\u00b2",
        "Hersteller": "Acer",
        "Hintergrundbeleuchtungs-Technologie": "LED-Hintergrundbeleuchtung",
        "Horizontale Bildwiederholrate": "30 - 85 kHz",
        "Horizontaler Betrachtungswinkel": "178",
        "Kennzeichnung": "MPR II",
        "Kontrast": "100000000:1 (dynamisch)",
        "Leistungsmerkmale": "Slot f\u00fcr Sicherheitsschloss (Kabelschloss getrennt erh\u00e4ltlich), geeignet f\u00fcr Wandmontage, Unterst\u00fctzung f\u00fcr VESA-Schnittstelle",
        "Modell": "UM.QX0EE.H02",
        "Native Aufl\u00f6sung": "Full HD (1080p) 1920 x 1080 bei 75 Hz",
        "Neigungswinkel": "-5/+15",
        "Pixelpitch": "0.28 mm",
        "Produktbeschreibung": "Acer KA240Y Hbi - KA0 Series - LED-Monitor - Full HD (1080p) - 61 cm (24\")",
        "Reaktionszeit": "1 ms (VRB)",
        "Schlosstyp zur Diebstahlsicherung": "Kensington Slot",
        "Schnittstellen": "HDMI  VGA",
        "Seitenverh\u00e4ltnis": "16:9",
        "Sichtbare Bildfl\u00e4che": "60.5 cm (23.8\")",
        "Spannung": "Wechselstrom 120/230 V",
        "Stromverbrauch (max.)": "30 Watt",
        "Stromverbrauch (typisch)": "20 Watt",
        "Stromverbrauch SDR (eingeschaltet)": "18 kWh/1.000 h",
        "Umweltschutzstandards": "ENERGY STAR-qualifiziert",
        "VESA-Halterung": "100 x 100 mm",
        "Vertikale Bildwiederholrate": "48 - 75 Hz",
        "Vertikaler Betrachtungswinkel": "178",
        "Waren-Nr.": "3189302",
        "Zum Hersteller": "www.acer.com"
    },
    "raw_specifications_text": "Hersteller: Acer\nWaren-Nr.: 3189302\nModell: UM.QX0EE.H02\nEAN: 4711121495731\nZum Hersteller: www.acer.com\nProduktbeschreibung: Acer KA240Y Hbi - KA0 Series - LED-Monitor - Full HD (1080p) - 61 cm (24\")\nGer\u00e4tetyp: LED-hintergrundbeleuchteter LCD-Monitor - 61 cm (24\")\nEnergie Effizienzklasse: Klasse E\nAdaptive-Sync Technologie: AMD FreeSync\nBildschirmtyp: VA\nSeitenverh\u00e4ltnis: 16:9\nNative Aufl\u00f6sung: Full HD (1080p) 1920 x 1080 bei 75 Hz\nPixelpitch: 0.28 mm\nHelligkeit: 250 cd/m\u00b2\nKontrast: 100000000:1 (dynamisch)\nReaktionszeit: 1 ms (VRB)\nFarbunterst\u00fctzung: 16,7 Millionen Farben\nFarbraum: 72% NTSC\nEingangsanschl\u00fcsse: HDMI, VGA\nEinstellungen der Anzeigeposition: Neigung\nBildschirmbeschichtung: Blendfrei\nSpannung: Wechselstrom 120/230 V\nFarbe: Schwarz\nAbmessungen (Breite x Tiefe x H\u00f6he) - mit Fu\u00df: 54 cm x 19.2 cm x 41.4 cm\nGewicht: 3.1 kg\nUmweltschutzstandards: ENERGY STAR-qualifiziert\nKennzeichnung: MPR II\nDisplay-Typ: LED-hintergrundbeleuchteter LCD-Monitor / TFT-Aktivmatrix\nDiagonalabmessung: 61 cm (24\")\nSichtbare Bildfl\u00e4che: 60.5 cm (23.8\")\nVertikale Bildwiederholrate: 48 - 75 Hz\nHorizontale Bildwiederholrate: 30 - 85 kHz\nHorizontaler Betrachtungswinkel: 178\nVertikaler Betrachtungswinkel: 178\nHintergrundbeleuchtungs-Technologie: LED-Hintergrundbeleuchtung\nBesonderheiten: Acer Adaptive Contrast Management (ACM), ComfyView, breiter Betrachtungswinkel, an 3 Seiten ohne Blende, 6-bit + Hi-FRC Color Depth\nAbmessungen (Breite x Tiefe x H\u00f6he): 54 cm x 19.2 cm x 41.4 cm - mit Fu\u00df\nSchnittstellen: HDMI  VGA\nNeigungswinkel: -5/+15\nVESA-Halterung: 100 x 100 mm\nLeistungsmerkmale: Slot f\u00fcr Sicherheitsschloss (Kabelschloss getrennt erh\u00e4ltlich), geeignet f\u00fcr Wandmontage, Unterst\u00fctzung f\u00fcr VESA-Schnittstelle\nEnthaltene Kabel: 1 x HDMI-Kabel\nSchlosstyp zur Diebstahlsicherung: Kensington Slot\nEingangsspannung: Wechselstrom 120/230 V\nStromverbrauch SDR (eingeschaltet): 18 kWh/1.000 h\nStromverbrauch (typisch): 20 Watt\nStromverbrauch (max.): 30 Watt\nDetails zu Abmessungen & Gewicht: Mit Fu\u00df - Breite: 54 cm - Tiefe: 19.2 cm - H\u00f6he: 41.4 cm - Gewicht: 3.1 kg  Ohne Fu\u00df - Breite: 54 cm - Tiefe: 6.3 cm - H\u00f6he: 32.3 cm - Gewicht: 2.7 kg",
    "reference_file": "offer_reference_146.json",
    "shop_name": "Proshop.at"
}