{
    "html_file": "offer_2160_15.html",
    "name": "iiyama ProLite XB3288UHSU-B1, 31.5\"",
    "offer_link": "https://www.ditech.at/details.php?artnr=286617",
    "price": 433.9,
    "raw_specifications": {
        "AMD FreeSync": "Ja",
        "Abmessungen (BxHxT)": "730x458x230mm (mit Standfu\u00df),  730x428x53mm (ohne Standfu\u00df)",
        "Adaptive Sync": "Ja",
        "Anschl\u00fcsse - DisplayPort 1.2": "1",
        "Anschl\u00fcsse - HDMI 2.0": "2",
        "Anwendung": "station\u00e4r",
        "Audio": "Lautsprecher (2x 3W),  1x Line-Out",
        "Aufl\u00f6sung": "3840x2160",
        "Beschichtung": "matt (non-glare)",
        "Besonderheiten": "Steuerkreuz,  Sicherheitsschloss (Kensington),  Picture-in-Picture",
        "Bildwiederholfrequenz": "60Hz",
        "Blickwinkel": "178\u00b0/178\u00b0",
        "Diagonale": "31.5\"/80cm",
        "Energieeffizienzklasse HDR (A bis G)": "G",
        "Energieverbrauch HDR": "52kWh/1000h",
        "Energieverbrauch SDR": "40kWh/1000h",
        "Ergonomie": "130mm (h\u00f6henverstellbar),  N/A (Pivot),  \u00b145\u00b0 (drehbar),  +22\u00b0/-3\u00b0 (neigbar),  keine Angabe (Schr\u00e4glage)",
        "FRC": "unbekannt",
        "Farbe": "schwarz",
        "Farbraum - Adobe RGB": "84%",
        "Farbraum - DCI-P3": "91%",
        "Farbraum - sRGB": "99.8%",
        "Farbtiefe": "10bit (1.07 Mrd. Farben)",
        "Form": "gerade (flat)",
        "Gewicht": "8.90kg (mit Standfu\u00df),  keine Angabe (ohne Standfu\u00df)",
        "HDR": "N/A",
        "Helligkeit": "300cd/m\u00b2",
        "Herstellergarantie": "drei Jahre (Abwicklung \u00fcber Hersteller,  Produktregistrierung innerhalb von 60 Tagen nach dem Kauf: Link,  Garantie-Informationen: Link)",
        "Hintergrundbeleuchtung": "White-LED,  flicker-free,  Blaulichtfilter",
        "Kontrast - dynamisch": "80.000.000:1",
        "Kontrast - statisch": "3.000:1",
        "Lautsprecher": "Ja",
        "Leistungsaufnahme": "keine Angabe (maximal),  44W (typisch),  keine Angabe (Energielabel alt A+++ bis G),  0.5W (Standby)",
        "Panel": "VA",
        "Reaktionszeit - GtG": "3ms",
        "Screen-to-Body-Ratio": "87.5% (berechnet)",
        "Seitenverh\u00e4ltnis": "16:9",
        "Signalfrequenz": "30-135kHz (horizontal),  55-75Hz (vertikal)",
        "Stromversorgung": "AC-In (internes Netzteil)",
        "USB-Hub In": "1x USB-B 3.0",
        "USB-Hub Out": "2x USB-A 3.0",
        "USB-Schreibweise": "Link",
        "VESA": "100x100 (belegt)",
        "VRR (Variable Refresh Rate)": "Adaptive Sync,  AMD FreeSync (38-60Hz via DisplayPort,  38-60Hz via HDMI,  ohne LFC-Support,  mit HDR)",
        "Weitere Anschl\u00fcsse": "N/A"
    },
    "raw_specifications_text": "Abmessungen (BxHxT): 730x458x230mm (mit Standfu\u00df),  730x428x53mm (ohne Standfu\u00df)\nAdaptive Sync: Ja\nAMD FreeSync: Ja\nAnschl\u00fcsse - DisplayPort 1.2: 1\nAnschl\u00fcsse - HDMI 2.0: 2\nAnwendung: station\u00e4r\nAudio: Lautsprecher (2x 3W),  1x Line-Out\nAufl\u00f6sung: 3840x2160\nBeschichtung: matt (non-glare)\nBesonderheiten: Steuerkreuz,  Sicherheitsschloss (Kensington),  Picture-in-Picture\nBildwiederholfrequenz: 60Hz\nBlickwinkel: 178\u00b0/178\u00b0\nDiagonale: 31.5\"/80cm\nEnergieeffizienzklasse HDR (A bis G): G\nEnergieverbrauch HDR: 52kWh/1000h\nEnergieverbrauch SDR: 40kWh/1000h\nErgonomie: 130mm (h\u00f6henverstellbar),  N/A (Pivot),  \u00b145\u00b0 (drehbar),  +22\u00b0/-3\u00b0 (neigbar),  keine Angabe (Schr\u00e4glage)\nFarbe: schwarz\nFarbraum - Adobe RGB: 84%\nFarbraum - DCI-P3: 91%\nFarbraum - sRGB: 99.8%\nFarbtiefe: 10bit (1.07 Mrd. Farben)\nForm: gerade (flat)\nFRC: unbekannt\nGewicht: 8.90kg (mit Standfu\u00df),  keine Angabe (ohne Standfu\u00df)\nHDR: N/A\nHelligkeit: 300cd/m\u00b2\nHerstellergarantie: drei Jahre (Abwicklung \u00fcber Hersteller,  Produktregistrierung innerhalb von 60 Tagen nach dem Kauf: Link,  Garantie-Informationen: Link)\nHintergrundbeleuchtung: White-LED,  flicker-free,  Blaulichtfilter\nKontrast - dynamisch: 80.000.000:1\nKontrast - statisch: 3.000:1\nLautsprecher: Ja\nLeistungsaufnahme: keine Angabe (maximal),  44W (typisch),  keine Angabe (Energielabel alt A+++ bis G),  0.5W (Standby)\nPanel: VA\nReaktionszeit - GtG: 3ms\nScreen-to-Body-Ratio: 87.5% (berechnet)\nSeitenverh\u00e4ltnis: 16:9\nSignalfrequenz: 30-135kHz (horizontal),  55-75Hz (vertikal)\nStromversorgung: AC-In (internes Netzteil)\nUSB-Hub In: 1x USB-B 3.0\nUSB-Hub Out: 2x USB-A 3.0\nUSB-Schreibweise: Link\nVESA: 100x100 (belegt)\nVRR (Variable Refresh Rate): Adaptive Sync,  AMD FreeSync (38-60Hz via DisplayPort,  38-60Hz via HDMI,  ohne LFC-Support,  mit HDR)\nWeitere Anschl\u00fcsse: N/A",
    "reference_file": "offer_reference_2160.json",
    "shop_name": "DiTech.at"
}