{
    "html_file": "offer_1928_13.html",
    "name": "AOC Q27P2Q, 27\"",
    "offer_link": "https://www.e-tec.at/details.php?artnr=303132",
    "price": 222.65,
    "raw_specifications": {
        "Abmessungen (BxHxT)": "614x544x200mm (mit Standfu\u00df),  614x369x51mm (ohne Standfu\u00df)",
        "Anschl\u00fcsse - DisplayPort 1.2": "1",
        "Anschl\u00fcsse - HDMI 1.4": "1",
        "Anschl\u00fcsse - VGA": "1",
        "Anwendung": "station\u00e4r",
        "Audio": "Lautsprecher (2x 2W),  1x Line-In,  1x Line-Out",
        "Aufl\u00f6sung": "2560x1440",
        "Beschichtung": "matt (non-glare),  H\u00e4rtegrad 3H",
        "Besonderheiten": "Slim Bezel,  mechanische Tasten,  Sicherheitsschloss (Kensington),  TCO 9 zertifiziert",
        "Bildwiederholfrequenz": "75Hz",
        "Blickwinkel": "178\u00b0/178\u00b0",
        "Diagonale": "27\"/68.6cm",
        "Energieeffizienzklasse alt (A+++ bis D)": "B",
        "Energieeffizienzklasse alt (A+++ bis G)": "B",
        "Energieverbrauch SDR": "26kWh/1000h",
        "Ergonomie": "150mm (h\u00f6henverstellbar),  90\u00b0 (Pivot),  \u00b1180\u00b0 (drehbar),  +35\u00b0/-5\u00b0 (neigbar),  keine Angabe (Schr\u00e4glage)",
        "FRC": "unbekannt",
        "Farbe": "schwarz",
        "Farbraum - Adobe RGB": "91.4%",
        "Farbraum - DCI-P3": "90.9%",
        "Farbraum - sRGB": "123%",
        "Farbtiefe": "8bit (16.7 Mio. Farben)",
        "Form": "gerade (flat)",
        "Gewicht": "5.89kg (mit Standfu\u00df),  keine Angabe (ohne Standfu\u00df)",
        "HDR": "N/A",
        "Helligkeit": "300cd/m\u00b2",
        "Herstellergarantie": "drei Jahre",
        "Hintergrundbeleuchtung": "White-LED,  flicker-free,  Blaulichtfilter",
        "Jahresverbrauch alt (A+++ bis D)": "52.56kWh",
        "Jahresverbrauch alt (A+++ bis G)": "52.56kWh",
        "Kontrast - dynamisch": "50.000.000:1",
        "Kontrast - statisch": "1.000:1",
        "Lautsprecher": "Ja",
        "Leistungsaufnahme": "keine Angabe (maximal),  28W (typisch),  36W (Energielabel alt A+++ bis G),  0.3W (Standby)",
        "Panel": "IPS",
        "Reaktionszeit - GtG": "4ms",
        "Screen-to-Body-Ratio": "88.7% (berechnet)",
        "Seitenverh\u00e4ltnis": "16:9",
        "Signalfrequenz": "30-114kHz (horizontal),  48-75Hz (vertikal)",
        "Stromversorgung": "AC-In (internes Netzteil)",
        "USB-Hub In": "1x USB-B 3.0",
        "USB-Hub Out": "4x USB-A 3.0",
        "USB-Schreibweise": "Link",
        "VESA": "100x100 (belegt)",
        "VRR (Variable Refresh Rate)": "N/A",
        "Weitere Anschl\u00fcsse": "N/A"
    },
    "raw_specifications_text": "Abmessungen (BxHxT): 614x544x200mm (mit Standfu\u00df),  614x369x51mm (ohne Standfu\u00df)\nAnschl\u00fcsse - DisplayPort 1.2: 1\nAnschl\u00fcsse - HDMI 1.4: 1\nAnschl\u00fcsse - VGA: 1\nAnwendung: station\u00e4r\nAudio: Lautsprecher (2x 2W),  1x Line-In,  1x Line-Out\nAufl\u00f6sung: 2560x1440\nBeschichtung: matt (non-glare),  H\u00e4rtegrad 3H\nBesonderheiten: Slim Bezel,  mechanische Tasten,  Sicherheitsschloss (Kensington),  TCO 9 zertifiziert\nBildwiederholfrequenz: 75Hz\nBlickwinkel: 178\u00b0/178\u00b0\nDiagonale: 27\"/68.6cm\nEnergieeffizienzklasse alt (A+++ bis D): B\nEnergieeffizienzklasse alt (A+++ bis G): B\nEnergieverbrauch SDR: 26kWh/1000h\nErgonomie: 150mm (h\u00f6henverstellbar),  90\u00b0 (Pivot),  \u00b1180\u00b0 (drehbar),  +35\u00b0/-5\u00b0 (neigbar),  keine Angabe (Schr\u00e4glage)\nFarbe: schwarz\nFarbraum - Adobe RGB: 91.4%\nFarbraum - DCI-P3: 90.9%\nFarbraum - sRGB: 123%\nFarbtiefe: 8bit (16.7 Mio. Farben)\nForm: gerade (flat)\nFRC: unbekannt\nGewicht: 5.89kg (mit Standfu\u00df),  keine Angabe (ohne Standfu\u00df)\nHDR: N/A\nHelligkeit: 300cd/m\u00b2\nHerstellergarantie: drei Jahre\nHintergrundbeleuchtung: White-LED,  flicker-free,  Blaulichtfilter\nJahresverbrauch alt (A+++ bis D): 52.56kWh\nJahresverbrauch alt (A+++ bis G): 52.56kWh\nKontrast - dynamisch: 50.000.000:1\nKontrast - statisch: 1.000:1\nLautsprecher: Ja\nLeistungsaufnahme: keine Angabe (maximal),  28W (typisch),  36W (Energielabel alt A+++ bis G),  0.3W (Standby)\nPanel: IPS\nReaktionszeit - GtG: 4ms\nScreen-to-Body-Ratio: 88.7% (berechnet)\nSeitenverh\u00e4ltnis: 16:9\nSignalfrequenz: 30-114kHz (horizontal),  48-75Hz (vertikal)\nStromversorgung: AC-In (internes Netzteil)\nUSB-Hub In: 1x USB-B 3.0\nUSB-Hub Out: 4x USB-A 3.0\nUSB-Schreibweise: Link\nVESA: 100x100 (belegt)\nVRR (Variable Refresh Rate): N/A\nWeitere Anschl\u00fcsse: N/A",
    "reference_file": "offer_reference_1928.json",
    "shop_name": "e-tec.at"
}