{
    "html_file": "offer_1834_2.html",
    "name": "BenQ Mobiuz EX2710, 27\"",
    "offer_link": "https://www.taufnaus.de/product/10603242",
    "price": 400.86,
    "raw_specifications": {
        "Abmessungen (Breite x Tiefe x H\u00f6he)": "61.41 cm x 21.665 cm x 53.959 cm",
        "Adaptive-Sync Technologie": "AMD FreeSync Premium",
        "Ausgangsleistung/Kanal": "2.5 Watt",
        "Besonderheiten": "Flimmerfreie Technologie, Brightness Intelligence Plus Technology, Low Blue Light-Technologie, an 3 Seiten ohne Blende, 8-bit Farbtiefe",
        "Bildschirmtyp": "IPS",
        "Diagonalabmessung": "68.6 cm (27\")",
        "Display-Typ": "LED-hintergrundbeleuchteter LCD-Monitor / TFT-Aktivmatrix",
        "Ein-/Aus-Schalter": "Nein",
        "Eingangsspannung": "AC 100 - 240 V",
        "Einstellungen der Anzeigeposition": "H\u00f6he, Drehung, Neigung",
        "Energie Effizienzklasse": "Klasse F",
        "Energieklasse (HDR)": "Klasse G",
        "Energieverbrauch pro Jahr": "41 kWh",
        "Enthaltene Kabel": "1 x HDMI-Kabel - 1.5 m",
        "Farbe": "Schwarz",
        "Farbunterst\u00fctzung": "16,7 Millionen Farben",
        "Gewicht": "6.2 kg",
        "HDR-Format": "HDR10",
        "Helligkeit": "400 cd/m\u00b2",
        "Hintergrundbeleuchtungs-Technologie": "LED-Hintergrundbeleuchtung",
        "Horizontale Bildwiederholrate": "30 - 167 kHz",
        "Horizontaler Betrachtungswinkel": "178",
        "H\u00f6heneinstellung": "130 mm",
        "Kontrast": "1000:1",
        "Leistungsaufnahme im Ein-Zustand": "23.7 W",
        "Leistungsmerkmale": "Slot f\u00fcr Sicherheitsschloss (Kabelschloss getrennt erh\u00e4ltlich)",
        "Max. Betriebstemperatur": "40 \u00b0C",
        "Min Betriebstemperatur": "0 \u00b0C",
        "Native Aufl\u00f6sung": "Full HD (1080p) 1920 x 1080 bei 144 Hz",
        "Neigungswinkel": "-5/+20",
        "Pixelpitch": "0.283 mm",
        "Reaktionszeit": "2 ms (Grau-zu-Grau)",
        "Schlosstyp zur Diebstahlsicherung": "Kensington Slot",
        "Schnittstellen": "2 x HDMI \u00a6 DisplayPort 1.2 \u00a6 Kopfh\u00f6rer",
        "Schwenkwinkel": "40",
        "Seitenverh\u00e4ltnis": "16:9",
        "Service und Support": "Begrenzte Garantie - 3 Jahre",
        "Stromverbrauch (Aus-Modus)": "0.5 Watt",
        "Stromverbrauch (typisch)": "58 Watt",
        "Stromverbrauch HDR (eingeschaltet)": "36.2 kWh/1.000 h",
        "Stromverbrauch SDR (eingeschaltet)": "23.7 kWh/1.000 h",
        "Typ": "Lautsprecher - Stereo",
        "VESA-Halterung": "100 x 100 mm",
        "Vertikale Bildwiederholrate": "24 - 144 Hz",
        "Vertikaler Betrachtungswinkel": "178",
        "Zul\u00e4ssige Luftfeuchtigkeit im Betrieb": "10 - 90%"
    },
    "raw_specifications_text": "Display-Typ: LED-hintergrundbeleuchteter LCD-Monitor / TFT-Aktivmatrix\nEnergie Effizienzklasse: Klasse F\nEnergieklasse (HDR): Klasse G\nEnergieverbrauch pro Jahr: 41 kWh\nDiagonalabmessung: 68.6 cm (27\")\nAdaptive-Sync Technologie: AMD FreeSync Premium\nBildschirmtyp: IPS\nSeitenverh\u00e4ltnis: 16:9\nNative Aufl\u00f6sung: Full HD (1080p) 1920 x 1080 bei 144 Hz\nPixelpitch: 0.283 mm\nHelligkeit: 400 cd/m\u00b2\nKontrast: 1000:1\nHDR-Format: HDR10\nFarbunterst\u00fctzung: 16,7 Millionen Farben\nReaktionszeit: 2 ms (Grau-zu-Grau)\nVertikale Bildwiederholrate: 24 - 144 Hz\nHorizontale Bildwiederholrate: 30 - 167 kHz\nHorizontaler Betrachtungswinkel: 178\nVertikaler Betrachtungswinkel: 178\nHintergrundbeleuchtungs-Technologie: LED-Hintergrundbeleuchtung\nBesonderheiten: Flimmerfreie Technologie, Brightness Intelligence Plus Technology, Low Blue Light-Technologie, an 3 Seiten ohne Blende, 8-bit Farbtiefe\nFarbe: Schwarz\nAbmessungen (Breite x Tiefe x H\u00f6he): 61.41 cm x 21.665 cm x 53.959 cm\nGewicht: 6.2 kg\nTyp: Lautsprecher - Stereo\nAusgangsleistung/Kanal: 2.5 Watt\nSchnittstellen: 2 x HDMI \u00a6 DisplayPort 1.2 \u00a6 Kopfh\u00f6rer\nEinstellungen der Anzeigeposition: H\u00f6he, Drehung, Neigung\nNeigungswinkel: -5/+20\nSchwenkwinkel: 40\nH\u00f6heneinstellung: 130 mm\nVESA-Halterung: 100 x 100 mm\nLeistungsmerkmale: Slot f\u00fcr Sicherheitsschloss (Kabelschloss getrennt erh\u00e4ltlich)\nEnthaltene Kabel: 1 x HDMI-Kabel - 1.5 m\nSchlosstyp zur Diebstahlsicherung: Kensington Slot\nEingangsspannung: AC 100 - 240 V\nLeistungsaufnahme im Ein-Zustand: 23.7 W\nStromverbrauch SDR (eingeschaltet): 23.7 kWh/1.000 h\nStromverbrauch HDR (eingeschaltet): 36.2 kWh/1.000 h\nStromverbrauch (typisch): 58 Watt\nStromverbrauch (Aus-Modus): 0.5 Watt\nEin-/Aus-Schalter: Nein\nService und Support: Begrenzte Garantie - 3 Jahre\nMin Betriebstemperatur: 0 \u00b0C\nMax. Betriebstemperatur: 40 \u00b0C\nZul\u00e4ssige Luftfeuchtigkeit im Betrieb: 10 - 90%",
    "reference_file": "offer_reference_1834.json",
    "shop_name": "TaufNaus"
}