{
    "html_file": "offer_397_10.html",
    "name": "Acer Vero CB1 CB271Ubmiprux, 27\"",
    "offer_link": "https://www.mylemon.at/artikel/acer/um_hb1ee_013/68-6cm-27-cb271ubmiprux-16.html",
    "price": 308.97,
    "raw_specifications": {
        "AMD FreeSync": "Ja",
        "AMD FreeSync-Typ": "FreeSync",
        "Anzahl DisplayPort Anschl\u00fcsse": "1",
        "Anzahl HDMI-Anschl\u00fcsse": "1",
        "Anzahl der Farben des Displays": "16,7 Millionen Farben",
        "Artikelnummer": "M1FY7YTL",
        "Aufl\u00f6sung": "2560x1440",
        "Besonderheiten": "Lautsprecher",
        "Bildschirmdiagonale": "68,6 cm (27 Zoll)",
        "Bildschirmdiagonale (cm)": "68,6 cm",
        "Bildschirmform": "Flach",
        "Bildschirmtechnologie": "LCD",
        "Bildwinkel, horizontal": "178\u00b0",
        "Bildwinkel, vertikal": "178\u00b0",
        "Breite (ohne Standfu\u00df)": "61,4 cm",
        "Display-Aufl\u00f6sung": "2560 x 1440 Pixel",
        "Displaygr\u00f6\u00dfe": "27 Zoll",
        "EAN": "4711121251795",
        "Eingebaute Lautsprecher": "Ja",
        "Energieeffizienzklasse (HDR)": "Nicht verf\u00fcgbar",
        "Energieeffizienzklasse (SDR)": "Nicht verf\u00fcgbar",
        "Farbtiefe": "8 Bit",
        "Fu\u00dffarbe": "Schwarz",
        "Ger\u00e4tebreite (inkl. Fu\u00df)": "614,4 mm",
        "Gewicht (ohne St\u00e4nder)": "5,29 kg",
        "HD-Typ": "Quad HD",
        "HDMI": "Ja",
        "Helligkeit": "350 cd/m\u00b2",
        "Helligkeit (typisch)": "350 cd/m\u00b2",
        "Hersteller Artikelnummer": "UM.HB1EE.013",
        "H\u00f6he (ohne Standfu\u00df)": "36,7 cm",
        "H\u00f6heneinstellung": "15 cm",
        "H\u00f6henverstellung": "Ja",
        "Integrierter USB-Hub": "Ja",
        "Kontrastverh\u00e4ltnis (dynamisch)": "100000000:1",
        "Kopfh\u00f6rerausgang": "Ja",
        "Marktpositionierung": "Business",
        "Maximale Bildwiederholrate": "60 Hz",
        "Natives Seitenverh\u00e4ltnis": "16:9",
        "Neigungsverstellung": "Ja",
        "Neigungswinkelbereich": "-5 - 35\u00b0",
        "Panel": "IPS",
        "Panel-Typ": "IPS",
        "Pivot": "Ja",
        "Pivot Winkel": "-90 - 90\u00b0",
        "Pixel Abstand": "0,23 x 0,23 mm",
        "Produktfarbe": "Schwarz",
        "Reaktionszeit": "1 ms",
        "Schwenkbar": "Ja",
        "Schwenkwinkelbereich": "-30 - 30\u00b0",
        "Stromverbrauch (Standardbetrieb)": "22 W",
        "Stromverbrauch (Standby)": "0,3 W",
        "Stromverbrauch (aus)": "0,3 W",
        "Stromverbrauch (max.)": "145 W",
        "Tiefe (ohne Standfu\u00df)": "6,96 cm",
        "Touchscreen": "Nein",
        "Typ der Hintergrundbeleuchtung": "LED",
        "USB-Hub-Version": "3.2 Gen 1 (3.1 Gen 1)",
        "VESA-Halterung": "Ja",
        "Video Anschl\u00fcsse": "1x HDMI, 1x DisplayPort",
        "Vorderer Rahmen": "Schwarz",
        "sRGB Abdeckung (klassisch)": "99%"
    },
    "raw_specifications_text": "Displaygr\u00f6\u00dfe: 27 Zoll\nAufl\u00f6sung: 2560x1440\nPanel: IPS\nReaktionszeit: 1 ms\nVideo Anschl\u00fcsse: 1x HDMI, 1x DisplayPort\nHelligkeit: 350 cd/m\u00b2\nBesonderheiten: Lautsprecher\nHersteller Artikelnummer: UM.HB1EE.013\nEAN: 4711121251795\nArtikelnummer: M1FY7YTL\nBildschirmdiagonale: 68,6 cm (27 Zoll)\nDisplay-Aufl\u00f6sung: 2560 x 1440 Pixel\nNatives Seitenverh\u00e4ltnis: 16:9\nBildschirmtechnologie: LCD\nTouchscreen: Nein\nHD-Typ: Quad HD\nPanel-Typ: IPS\nBildschirmform: Flach\nMaximale Bildwiederholrate: 60 Hz\nAnzahl der Farben des Displays: 16,7 Millionen Farben\nTyp der Hintergrundbeleuchtung: LED\nHelligkeit (typisch): 350 cd/m\u00b2\nKontrastverh\u00e4ltnis (dynamisch): 100000000:1\nBildwinkel, horizontal: 178\u00b0\nBildwinkel, vertikal: 178\u00b0\nPixel Abstand: 0,23 x 0,23 mm\nBildschirmdiagonale (cm): 68,6 cm\nFarbtiefe: 8 Bit\nsRGB Abdeckung (klassisch): 99%\nAMD FreeSync: Ja\nAMD FreeSync-Typ: FreeSync\nEingebaute Lautsprecher: Ja\nMarktpositionierung: Business\nProduktfarbe: Schwarz\nVorderer Rahmen: Schwarz\nFu\u00dffarbe: Schwarz\nIntegrierter USB-Hub: Ja\nHDMI: Ja\nKopfh\u00f6rerausgang: Ja\nUSB-Hub-Version: 3.2 Gen 1 (3.1 Gen 1)\nAnzahl HDMI-Anschl\u00fcsse: 1\nAnzahl DisplayPort Anschl\u00fcsse: 1\nVESA-Halterung: Ja\nH\u00f6henverstellung: Ja\nH\u00f6heneinstellung: 15 cm\nPivot: Ja\nPivot Winkel: -90 - 90\u00b0\nSchwenkbar: Ja\nSchwenkwinkelbereich: -30 - 30\u00b0\nNeigungswinkelbereich: -5 - 35\u00b0\nNeigungsverstellung: Ja\nEnergieeffizienzklasse (SDR): Nicht verf\u00fcgbar\nEnergieeffizienzklasse (HDR): Nicht verf\u00fcgbar\nStromverbrauch (Standardbetrieb): 22 W\nStromverbrauch (Standby): 0,3 W\nStromverbrauch (max.): 145 W\nStromverbrauch (aus): 0,3 W\nGer\u00e4tebreite (inkl. Fu\u00df): 614,4 mm\nBreite (ohne Standfu\u00df): 61,4 cm\nTiefe (ohne Standfu\u00df): 6,96 cm\nH\u00f6he (ohne Standfu\u00df): 36,7 cm\nGewicht (ohne St\u00e4nder): 5,29 kg",
    "reference_file": "offer_reference_397.json",
    "shop_name": "mylemon.at"
}