{
    "html_file": "offer_1706_30.html",
    "name": "Eizo FlexScan EV3895 schwarz, 37.5\"",
    "offer_link": "https://technikladen.at/P-EIZO-FlexScan-EV3895-BK-952-cm-375-Zoll-3840-x-1600-Pixel-UltraWide-Quad-HD-LED-5-ms-Schwarz?tl=gzhls",
    "price": 1633.34,
    "raw_specifications": {
        "AC Eingangsfrequenz": "50/60 Hz",
        "AC Eingangsspannung": "100 - 240 V",
        "AMD FreeSync": "Nein",
        "Anzahl DisplayPort Anschl\u00fcsse": "1",
        "Anzahl Ethernet-LAN-Anschl\u00fcsse (RJ-45)": "1",
        "Anzahl HDMI-Anschl\u00fcsse": "2",
        "Anzahl der Farben des Displays": "16,78 Millionen Farben",
        "Anzahl der Lautsprecher": "2",
        "Anzahl der Upstream-Ports USB Typ-B": "2",
        "Anzahl der Upstream-Ports USB Typ-C": "1",
        "Anzahl der nachgeschalteten Steckpl\u00e4tze vom Typ USB-A": "4",
        "Bewertung der Bildschirmkr\u00fcmmung": "2300R",
        "Bild f\u00fcr Bild (PbP)": "Ja",
        "Bildschirmaufl\u00f6sung": "3840 x 1600 Pixel",
        "Bildschirmdiagonale": "95,2 cm",
        "Bildschirmdisplay (OSD)-Sprachen": "German, English, Spanish, French, Italian, Swedish",
        "Bildschirmform": "Geschwungen",
        "Bildschirmtechnologie": "LED",
        "Blickwinkel, horizontal": "178 \u00b0",
        "Blickwinkel, vertikal": "178 \u00b0",
        "Breite (ohne Standfu\u00df)": "89,4 cm",
        "DVI Anschluss": "Nein",
        "Digital horizontale Frequenz": "31 - 99 kHz",
        "Digital vertikale Frequenz": "29 - 31 Hz",
        "Eingebaute KVM-Umschaltung": "Ja",
        "Eingebaute Lautsprecher": "Ja",
        "Eingebauter Ethernet-Anschluss": "Ja",
        "Energieeffizienzklasse (SDR)": "E",
        "Energieeffizienzskala": "A bis G",
        "Energieverbrauch (SDR) pro 1.000 Stunden": "29 kWh",
        "Ethernet LAN Datentransferraten": "10,100,1000 Mbit/s",
        "Flimmerfreie Technologie": "Ja",
        "Ger\u00e4tebreite (inkl. Fu\u00df)": "893,9 mm",
        "Ger\u00e4teh\u00f6he (inkl. Fu\u00df)": "411 mm",
        "Ger\u00e4tetiefe (inkl. Fu\u00df)": "240 mm",
        "Gewicht (mit St\u00e4nder)": "13,2 kg",
        "Gewicht (ohne St\u00e4nder)": "9,5 kg",
        "HD-Typ": "UltraWide Quad HD+",
        "HDCP": "Ja",
        "HDMI": "Ja",
        "Helligkeit (typisch)": "300 cd/m\u00b2",
        "H\u00f6he (ohne Standfu\u00df)": "39,8 cm",
        "H\u00f6heneinstellung": "19,3 cm",
        "H\u00f6henverstellung": "Ja",
        "Integrierter USB-Hub": "Ja",
        "Kabelsperre-Slot": "Ja",
        "Kontrastverh\u00e4ltnis": "1000:1",
        "Kopfh\u00f6rer-Konnektivit\u00e4t": "3,5 mm",
        "Kopfh\u00f6rerausgang": "Ja",
        "Kopfh\u00f6rerausg\u00e4nge": "1",
        "Low-Blue-Light-Technologie": "Ja",
        "Luftfeuchtigkeit bei Lagerung": "10 - 90 %",
        "Marktpositionierung": "Business",
        "Maximale Bildwiederholrate": "60 Hz",
        "Mitgelieferte Kabel": "AC, DisplayPort, HDMI, USB Type-A to USB Type-B, USB Type-C to USB Type-C",
        "NVIDIA G-SYNC": "Nein",
        "Nachhaltigkeitszertifikate": "ENERGY STAR",
        "Natives Seitenverh\u00e4ltnis": "24:10",
        "Neigungswinkelbereich": "-5 - 35 \u00b0",
        "On-Screen-Display (OSD)": "Ja",
        "Panel-Montage-Schnittstelle": "100 x 100 mm",
        "Panel-Typ": "IGZO",
        "Pixel Abstand": "0,229 x 0,229 mm",
        "Pixeldichte": "111 ppi",
        "Produktfarbe": "Schwarz",
        "RGB-Farbraum": "sRGB",
        "RMS-Leistung": "2 W",
        "Reaktionszeit": "5 ms",
        "Relative Luftfeuchtigkeit in Betrieb": "20 - 80 %",
        "Schnellstart\u00fcbersicht": "Ja",
        "Schwenkbar": "Ja",
        "Schwenkwinkelbereich": "-70 - 70 \u00b0",
        "Sichtbare Gr\u00f6\u00dfe (diagonal)": "95,3 cm",
        "Sichtbare Gr\u00f6\u00dfe (horizontal)": "88 cm",
        "Sichtbare Gr\u00f6\u00dfe (vertikal)": "36,6 cm",
        "Slot-Typ Kabelsperre": "Kensington",
        "Stromverbrauch (Standardbetrieb)": "29 W",
        "Stromverbrauch (Standby)": "0,5 W",
        "Stromverbrauch (max.)": "194 W",
        "St\u00e4nder enthalten": "Ja",
        "Temperaturbereich bei Lagerung": "-20 - 60 \u00b0C",
        "Temperaturbereich in Betrieb": "5 - 35 \u00b0C",
        "Tiefe (ohne Standfu\u00df)": "11 cm",
        "Typ der Hintergrundbeleuchtung": "LED",
        "USB-Hub-Version": "3.2 Gen 1 (3.1 Gen 1)",
        "USB-Typ-C DisplayPort-Wechselmodus": "Ja",
        "USB-Upstream-Porttyp": "USB Type-B, USB Type-C",
        "Unterst\u00fctzte Grafik-Aufl\u00f6sungen": "640 x 480 (VGA),720 x 400,800 x 600 (SVGA),1024 x 768 (XGA),1280 x 1024 (SXGA),1600 x 1200 (UXGA),1680 x 1050 (WSXGA+),1920 x 1080 (HD 1080),1920 x 1200 (WUXGA),2560 x 1440,2560 x 1600 (WQXGA),3440 x 1440,3840 x 1600",
        "VESA-Halterung": "Ja",
        "Zertifizierung": "CE, CB, TCO certified 8.0, EPA Energy Star, T\u00dcV/GS, T\u00dcV/Ergonomics (including ISO 9241-307), T\u00dcV/Blue Low Light Content, T\u00dcV/Flicker Free, EPEAT 2018 (US), cT\u00dcVus, T\u00dcV/S, EAC, PSE, FCC-B, CAN ICES-3 (B), RCM, VCCI-B, CCC, RoHS, China RoHS, WEEE",
        "kippbar": "Ja"
    },
    "raw_specifications_text": "NVIDIA G-SYNC: Nein\nAMD FreeSync: Nein\nFlimmerfreie Technologie: Ja\nLow-Blue-Light-Technologie: Ja\nBildschirmdiagonale: 95,2 cm\nBildschirmaufl\u00f6sung: 3840 x 1600 Pixel\nNatives Seitenverh\u00e4ltnis: 24:10\nPanel-Typ: IGZO\nHelligkeit (typisch): 300 cd/m\u00b2\nReaktionszeit: 5 ms\nHD-Typ: UltraWide Quad HD+\nBildschirmtechnologie: LED\nTyp der Hintergrundbeleuchtung: LED\nBildschirmform: Geschwungen\nBewertung der Bildschirmkr\u00fcmmung: 2300R\nUnterst\u00fctzte Grafik-Aufl\u00f6sungen: 640 x 480 (VGA),720 x 400,800 x 600 (SVGA),1024 x 768 (XGA),1280 x 1024 (SXGA),1600 x 1200 (UXGA),1680 x 1050 (WSXGA+),1920 x 1080 (HD 1080),1920 x 1200 (WUXGA),2560 x 1440,2560 x 1600 (WQXGA),3440 x 1440,3840 x 1600\nKontrastverh\u00e4ltnis: 1000:1\nMaximale Bildwiederholrate: 60 Hz\nBlickwinkel, horizontal: 178 \u00b0\nBlickwinkel, vertikal: 178 \u00b0\nAnzahl der Farben des Displays: 16,78 Millionen Farben\nPixel Abstand: 0,229 x 0,229 mm\nPixeldichte: 111 ppi\nSichtbare Gr\u00f6\u00dfe (horizontal): 88 cm\nSichtbare Gr\u00f6\u00dfe (vertikal): 36,6 cm\nSichtbare Gr\u00f6\u00dfe (diagonal): 95,3 cm\nDigital horizontale Frequenz: 31 - 99 kHz\nDigital vertikale Frequenz: 29 - 31 Hz\nRGB-Farbraum: sRGB\nIntegrierter USB-Hub: Ja\nUSB-Hub-Version: 3.2 Gen 1 (3.1 Gen 1)\nUSB-Upstream-Porttyp: USB Type-B, USB Type-C\nAnzahl der Upstream-Ports USB Typ-B: 2\nAnzahl der Upstream-Ports USB Typ-C: 1\nAnzahl der nachgeschalteten Steckpl\u00e4tze vom Typ USB-A: 4\nUSB-Typ-C DisplayPort-Wechselmodus: Ja\nDVI Anschluss: Nein\nHDMI: Ja\nAnzahl HDMI-Anschl\u00fcsse: 2\nAnzahl DisplayPort Anschl\u00fcsse: 1\nKopfh\u00f6rerausgang: Ja\nKopfh\u00f6rerausg\u00e4nge: 1\nKopfh\u00f6rer-Konnektivit\u00e4t: 3,5 mm\nEingebaute KVM-Umschaltung: Ja\nHDCP: Ja\nVESA-Halterung: Ja\nPanel-Montage-Schnittstelle: 100 x 100 mm\nKabelsperre-Slot: Ja\nSlot-Typ Kabelsperre: Kensington\nH\u00f6henverstellung: Ja\nH\u00f6heneinstellung: 19,3 cm\nSchwenkbar: Ja\nSchwenkwinkelbereich: -70 - 70 \u00b0\nkippbar: Ja\nNeigungswinkelbereich: -5 - 35 \u00b0\nOn-Screen-Display (OSD): Ja\nBildschirmdisplay (OSD)-Sprachen: German, English, Spanish, French, Italian, Swedish\nEingebaute Lautsprecher: Ja\nAnzahl der Lautsprecher: 2\nRMS-Leistung: 2 W\nMarktpositionierung: Business\nProduktfarbe: Schwarz\nZertifizierung: CE, CB, TCO certified 8.0, EPA Energy Star, T\u00dcV/GS, T\u00dcV/Ergonomics (including ISO 9241-307), T\u00dcV/Blue Low Light Content, T\u00dcV/Flicker Free, EPEAT 2018 (US), cT\u00dcVus, T\u00dcV/S, EAC, PSE, FCC-B, CAN ICES-3 (B), RCM, VCCI-B, CCC, RoHS, China RoHS, WEEE\nSt\u00e4nder enthalten: Ja\nMitgelieferte Kabel: AC, DisplayPort, HDMI, USB Type-A to USB Type-B, USB Type-C to USB Type-C\nSchnellstart\u00fcbersicht: Ja\nEnergieeffizienzklasse (SDR): E\nEnergieverbrauch (SDR) pro 1.000 Stunden: 29 kWh\nStromverbrauch (Standardbetrieb): 29 W\nStromverbrauch (Standby): 0,5 W\nStromverbrauch (max.): 194 W\nAC Eingangsspannung: 100 - 240 V\nAC Eingangsfrequenz: 50/60 Hz\nEnergieeffizienzskala: A bis G\nTemperaturbereich in Betrieb: 5 - 35 \u00b0C\nTemperaturbereich bei Lagerung: -20 - 60 \u00b0C\nRelative Luftfeuchtigkeit in Betrieb: 20 - 80 %\nLuftfeuchtigkeit bei Lagerung: 10 - 90 %\nGer\u00e4tebreite (inkl. Fu\u00df): 893,9 mm\nGer\u00e4tetiefe (inkl. Fu\u00df): 240 mm\nGer\u00e4teh\u00f6he (inkl. Fu\u00df): 411 mm\nGewicht (mit St\u00e4nder): 13,2 kg\nBreite (ohne Standfu\u00df): 89,4 cm\nTiefe (ohne Standfu\u00df): 11 cm\nH\u00f6he (ohne Standfu\u00df): 39,8 cm\nGewicht (ohne St\u00e4nder): 9,5 kg\nBild f\u00fcr Bild (PbP): Ja\nEingebauter Ethernet-Anschluss: Ja\nEthernet LAN Datentransferraten: 10,100,1000 Mbit/s\nAnzahl Ethernet-LAN-Anschl\u00fcsse (RJ-45): 1\nNachhaltigkeitszertifikate: ENERGY STAR",
    "reference_file": "offer_reference_1706.json",
    "shop_name": "TechnikLaden"
}