{
    "html_file": "offer_287_5.html",
    "name": "LG 24BK55YP-B, 23.8\"",
    "offer_link": "https://www.proshop.at/Bildschirm/LG-24-Bildschirm-24BK55YP-I-LED-monitor-Full-HD-1080p-24-Black-5-ms/3177238?utm_source=geizhals&utm_medium=cpc&utm_campaign=pricesite",
    "price": 100.97,
    "raw_specifications": {
        "Abmessungen (Breite x Tiefe x H\u00f6he)": "55.38 cm x 24 cm x 38.29 cm - mit Fu\u00df",
        "Abmessungen (Breite x Tiefe x H\u00f6he) - mit Fu\u00df": "55.38 cm x 24 cm x 38.29 cm",
        "Besonderheiten": "Flicker Safe, Reader Mode, Color Calibrated, Super Resolution+",
        "Bildschirmbeschichtung": "Blendfrei, 3H Hard Coating",
        "Bildschirmtyp": "IPS",
        "Details zu Abmessungen & Gewicht": "Mit Fu\u00df - Breite: 55.38 cm - Tiefe: 24 cm - H\u00f6he: 38.29 cm  Ohne Fu\u00df - Breite: 55.38 cm - Tiefe: 5.84 cm - H\u00f6he: 33.31 cm",
        "Diagonalabmessung": "61 cm (24\")",
        "Display-Typ": "LED-hintergrundbeleuchteter LCD-Monitor / TFT-Aktivmatrix",
        "EAN": "8806087963533",
        "Eingangsanschl\u00fcsse": "HDMI, DisplayPort",
        "Einstellungen der Anzeigeposition": "H\u00f6he, Pivot (Rotation), Drehung, Neigung",
        "Energie Effizienzklasse": "Klasse E",
        "Farbraum": "72% NTSC",
        "Farbunterst\u00fctzung": "16,7 Millionen Farben",
        "Ger\u00e4tetyp": "LED-hintergrundbeleuchteter LCD-Monitor - 61 cm (24\")",
        "Helligkeit": "250 cd/m\u00b2",
        "Hersteller": "LG",
        "Hintergrundbeleuchtungs-Technologie": "LED-Hintergrundbeleuchtung",
        "Horizontaler Betrachtungswinkel": "178",
        "H\u00f6heneinstellung": "130 mm",
        "Integrierte Peripherieger\u00e4te": "USB Hub",
        "Kennzeichnung": "DDC/CI, TUV SUD, PVC-free, HDCP",
        "Kontrast": "1000:1 / 5000000:1 (dynamisch)",
        "Leistungsmerkmale": "USB Hub",
        "Mitgelieferte Software": "Dual Controller Software",
        "Modell": "24BK55YP-I.BEU",
        "Native Aufl\u00f6sung": "Full HD (1080p) 1920 x 1080 bei 60 Hz",
        "Neigungswinkel": "-5/+35",
        "Pixelpitch": "0.2745 mm",
        "Produktbeschreibung": "LG 24BK55YP-I - LED-Monitor - Full HD (1080p) - 61 cm (24\")",
        "Reaktionszeit": "5 ms",
        "Rotationswinkel": "90",
        "Schnittstellen": "DisplayPort 1.2  HDMI 1.4  Kopfh\u00f6rer  USB Upstream  2 x USB Downstream",
        "Schwenkwinkel": "355",
        "Seitenverh\u00e4ltnis": "16:9",
        "Sichtbare Bildfl\u00e4che": "60.4 cm (23.8\")",
        "Stromverbrauch (Aus-Modus)": "0.3 Watt",
        "Stromverbrauch (typisch)": "16.9 Watt",
        "Stromverbrauch SDR (eingeschaltet)": "17 kWh/1.000 h",
        "Stromverbrauch im Standby-Modus": "0.5 Watt",
        "Transportbreite": "62.7 cm",
        "Transporth\u00f6he": "50.5 cm",
        "Transporttiefe": "17.8 cm",
        "VESA-Halterung": "100 x 100 mm",
        "Vertikaler Betrachtungswinkel": "178",
        "Waren-Nr.": "3177238",
        "Zum Hersteller": "www.lge.com"
    },
    "raw_specifications_text": "Hersteller: LG\nWaren-Nr.: 3177238\nModell: 24BK55YP-I.BEU\nEAN: 8806087963533\nZum Hersteller: www.lge.com\nProduktbeschreibung: LG 24BK55YP-I - LED-Monitor - Full HD (1080p) - 61 cm (24\")\nGer\u00e4tetyp: LED-hintergrundbeleuchteter LCD-Monitor - 61 cm (24\")\nEnergie Effizienzklasse: Klasse E\nLeistungsmerkmale: USB Hub\nBildschirmtyp: IPS\nSeitenverh\u00e4ltnis: 16:9\nNative Aufl\u00f6sung: Full HD (1080p) 1920 x 1080 bei 60 Hz\nPixelpitch: 0.2745 mm\nHelligkeit: 250 cd/m\u00b2\nKontrast: 1000:1 / 5000000:1 (dynamisch)\nReaktionszeit: 5 ms\nFarbunterst\u00fctzung: 16,7 Millionen Farben\nFarbraum: 72% NTSC\nEingangsanschl\u00fcsse: HDMI, DisplayPort\nEinstellungen der Anzeigeposition: H\u00f6he, Pivot (Rotation), Drehung, Neigung\nBildschirmbeschichtung: Blendfrei, 3H Hard Coating\nAbmessungen (Breite x Tiefe x H\u00f6he) - mit Fu\u00df: 55.38 cm x 24 cm x 38.29 cm\nKennzeichnung: DDC/CI, TUV SUD, PVC-free, HDCP\nDisplay-Typ: LED-hintergrundbeleuchteter LCD-Monitor / TFT-Aktivmatrix\nDiagonalabmessung: 61 cm (24\")\nSichtbare Bildfl\u00e4che: 60.4 cm (23.8\")\nIntegrierte Peripherieger\u00e4te: USB Hub\nHorizontaler Betrachtungswinkel: 178\nVertikaler Betrachtungswinkel: 178\nHintergrundbeleuchtungs-Technologie: LED-Hintergrundbeleuchtung\nBesonderheiten: Flicker Safe, Reader Mode, Color Calibrated, Super Resolution+\nAbmessungen (Breite x Tiefe x H\u00f6he): 55.38 cm x 24 cm x 38.29 cm - mit Fu\u00df\nSchnittstellen: DisplayPort 1.2  HDMI 1.4  Kopfh\u00f6rer  USB Upstream  2 x USB Downstream\nNeigungswinkel: -5/+35\nSchwenkwinkel: 355\nRotationswinkel: 90\nH\u00f6heneinstellung: 130 mm\nVESA-Halterung: 100 x 100 mm\nStromverbrauch SDR (eingeschaltet): 17 kWh/1.000 h\nStromverbrauch (typisch): 16.9 Watt\nStromverbrauch im Standby-Modus: 0.5 Watt\nStromverbrauch (Aus-Modus): 0.3 Watt\nMitgelieferte Software: Dual Controller Software\nDetails zu Abmessungen & Gewicht: Mit Fu\u00df - Breite: 55.38 cm - Tiefe: 24 cm - H\u00f6he: 38.29 cm  Ohne Fu\u00df - Breite: 55.38 cm - Tiefe: 5.84 cm - H\u00f6he: 33.31 cm\nTransportbreite: 62.7 cm\nTransporttiefe: 17.8 cm\nTransporth\u00f6he: 50.5 cm",
    "reference_file": "offer_reference_287.json",
    "shop_name": "Proshop.at"
}