{
    "html_file": "offer_1248_20.html",
    "name": "AOC 27B2DM, 27\"",
    "offer_link": "https://www.office-partner.de/productredirect/index/sku/19510762?sPartner=p-geizhals-at&campaign=psm/geizhals-at/",
    "price": 130.59,
    "raw_specifications": {
        "Anschl\u00fcsse": "HDMI, VGA/D-Sub, Kopfh\u00f6reranschluss, DVI-D",
        "Artikelnummer": "19510762",
        "Aufl\u00f6sung Kurzname": "Full HD",
        "Bezeichnung des Herstellers": "AOC 27B2DM",
        "Bildwiederholungsrate": "75,00 Hz",
        "Breite": "-1,00 mm",
        "Display Features": "FlickerFree",
        "Display Sync": "Adaptive Sync",
        "Displaygr\u00f6\u00dfe": "68,58 cm (27 Zoll)",
        "EEK - Spektrum": "AG",
        "Energieeffizienzklasse": "E",
        "Geh\u00e4usefarbe des Ger\u00e4tes": "Schwarz",
        "Gewicht": "8,00 kg",
        "Gewicht inkl. Verpackung in Kg": "0,00 kg",
        "Helligkeit Bereich": "150 - 300 cd/m\u00b2",
        "Hersteller": "AOC",
        "H\u00f6he": "-1,00 mm",
        "Inhalt (ml oder g)": "0,00 ml",
        "Kapazit\u00e4t (Seiten)": "0",
        "Kontrastverh\u00e4ltnis (typisch) Bereich": "ab 1.200:1",
        "LCD-Technologie": "VA Panel",
        "L\u00e4nge": "-1,00 mm",
        "Produktart": "Monitore",
        "Reaktionszeit": "4,00 ms",
        "Seitenverh\u00e4ltnis": "16:9",
        "Shop Herstellernummer": "27B2DM",
        "Standard-EAN": "4038986189989",
        "max. Aufl\u00f6sung": "1.920 x 1.080 Pixel (16:9)"
    },
    "raw_specifications_text": "Energieeffizienzklasse: E\nDisplaygr\u00f6\u00dfe: 68,58 cm (27 Zoll)\nGeh\u00e4usefarbe des Ger\u00e4tes: Schwarz\nAnschl\u00fcsse: HDMI, VGA/D-Sub, Kopfh\u00f6reranschluss, DVI-D\nDisplay Features: FlickerFree\nKontrastverh\u00e4ltnis (typisch) Bereich: ab 1.200:1\nHelligkeit Bereich: 150 - 300 cd/m\u00b2\nHersteller: AOC\nGewicht: 8,00 kg\nProduktart: Monitore\nDisplay Sync: Adaptive Sync\nAufl\u00f6sung Kurzname: Full HD\nGewicht inkl. Verpackung in Kg: 0,00 kg\nInhalt (ml oder g): 0,00 ml\nKapazit\u00e4t (Seiten): 0\nBreite: -1,00 mm\nH\u00f6he: -1,00 mm\nL\u00e4nge: -1,00 mm\nEEK - Spektrum: AG\nArtikelnummer: 19510762\nStandard-EAN: 4038986189989\nShop Herstellernummer: 27B2DM\nBezeichnung des Herstellers: AOC 27B2DM\nmax. Aufl\u00f6sung: 1.920 x 1.080 Pixel (16:9)\nSeitenverh\u00e4ltnis: 16:9\nLCD-Technologie: VA Panel\nReaktionszeit: 4,00 ms\nBildwiederholungsrate: 75,00 Hz",
    "reference_file": "offer_reference_1248.json",
    "shop_name": "office-partner (AT)"
}