{
    "html_file": "offer_1469_6.html",
    "name": "LG 25BL55WY-B, 24.95\"",
    "offer_link": "https://www.hiq24.de/shop/artikel/297034/?sPartner=geizhals",
    "price": 153.9,
    "raw_specifications": {
        "Abmessungen (Breite x Tiefe x H\u00f6he)": "54.77 cm x 24.95 cm x 52.63 cm - mit Fu\u00df",
        "Abmessungen (Breite x Tiefe x H\u00f6he) - mit Fu\u00df": "54.77 cm x 24.95 cm x 52.63 cm",
        "Ausgangsleistung/Kanal": "1.2 Watt",
        "Besonderheiten": "Spielmodus, Cinema Mode, On-screen Digital Controls, Crosshair Display, Flicker Safe, Reader Mode, Intelligente Energiespartechnologie, Farbkalibrierung, Dual Controller, Black Stabilizer, DAS Mode (Dynamic Action Sync), Color Weakness Mode, Super Resolution+, Photo Mode",
        "Bildschirmbeschichtung": "3H Hard Coating, entspiegelt (25 %)",
        "Bildschirmtyp": "IPS",
        "Details zu Abmessungen & Gewicht": "Mit Fu\u00df - Breite: 54.77 cm - Tiefe: 24.95 cm - H\u00f6he: 52.63 cm - Gewicht: 5.9 kg  Ohne Fu\u00df - Breite: 54.77 cm - Tiefe: 5.3 cm - H\u00f6he: 36.93 cm - Gewicht: 4.1 kg",
        "Diagonalabmessung": "63.4 cm (25\")",
        "Display-Typ": "LED-hintergrundbeleuchteter LCD-Monitor / TFT-Aktivmatrix",
        "Eingangsanschl\u00fcsse": "HDMI, VGA, DisplayPort",
        "Eingangsspannung": "Wechselstrom 120/230 V (50/60 Hz)",
        "Einstellungen der Anzeigeposition": "H\u00f6he, Pivot (Rotation), Drehung, Neigung",
        "Energie Effizienzklasse": "Klasse F",
        "Energierverbrauch Sleep": "0.3 Watt",
        "Energieverbrauch pro Jahr": "37 kWh",
        "Enthaltene Kabel": "HDMI-Kabel - 1.8 m  DisplayPort-Kabel - 1.8 m",
        "Farbe": "Schwarz",
        "Farbraum": "99% sRGB (CIE 1931)",
        "Farbunterst\u00fctzung": "16,7 Millionen Farben",
        "Ger\u00e4tetyp": "LED-hintergrundbeleuchteter LCD-Monitor - 63.4 cm (25\")",
        "Gewicht": "5.9 kg",
        "Helligkeit": "300 cd/m\u00b2",
        "Hintergrundbeleuchtungs-Technologie": "LED-Hintergrundbeleuchtung",
        "Horizontaler Betrachtungswinkel": "178",
        "Integrierte Peripherieger\u00e4te": "USB 2.0 Hub",
        "Kennzeichnung": "FCC Klasse B bescheinigt, UL, BSMI, cUL, CCC, ERP, EPA 7.0",
        "Kontrast": "1000:1",
        "Leistungsaufnahme im Ein-Zustand": "25 W",
        "Leistungsmerkmale": "USB 2.0 Hub",
        "Native Aufl\u00f6sung": "WUXGA 1920 x 1200 bei 60 Hz",
        "Pixelpitch": "0.2788 mm",
        "Produktbeschreibung": "LG 25BL55WY-B - BL55WY Series - LED-Monitor - 63.4 cm (25\")",
        "Reaktionszeit": "5 ms (Gray-to-Gray)",
        "Schnittstellen": "HDMI  DisplayPort 1.2  Kopfh\u00f6rer  USB 2.0 Upstream (Typ B)  2 x USB 2.0 Downstream (Typ A)  VGA  Audio Line-In",
        "Seitenverh\u00e4ltnis": "16:10",
        "Spannung": "Wechselstrom 120/230 V (50/60 Hz)",
        "Stromverbrauch (Aus-Modus)": "0.3 Watt",
        "Stromverbrauch (typisch)": "28 Watt",
        "Stromverbrauch SDR (eingeschaltet)": "20.5 kWh/1.000 h",
        "TCO-zertifiziert": "TCO Certified Displays 9",
        "Transportbreite": "62.2 cm",
        "Transportgewicht": "8.5 kg",
        "Transporth\u00f6he": "52.8 cm",
        "Transporttiefe": "18.8 cm",
        "Typ": "Lautsprecher",
        "Umweltschutzstandards": "TCO Certified Displays 9",
        "VESA-Halterung": "100 x 100 mm",
        "Vertikale Bildwiederholrate": "56 - 75 Hz",
        "Vertikaler Betrachtungswinkel": "178"
    },
    "raw_specifications_text": "Display-Typ: LED-hintergrundbeleuchteter LCD-Monitor / TFT-Aktivmatrix\nEnergie Effizienzklasse: Klasse F\nEnergieverbrauch pro Jahr: 37 kWh\nDiagonalabmessung: 63.4 cm (25\")\nIntegrierte Peripherieger\u00e4te: USB 2.0 Hub\nBildschirmtyp: IPS\nSeitenverh\u00e4ltnis: 16:10\nNative Aufl\u00f6sung: WUXGA 1920 x 1200 bei 60 Hz\nPixelpitch: 0.2788 mm\nHelligkeit: 300 cd/m\u00b2\nKontrast: 1000:1\nFarbunterst\u00fctzung: 16,7 Millionen Farben\nFarbraum: 99% sRGB (CIE 1931)\nReaktionszeit: 5 ms (Gray-to-Gray)\nVertikale Bildwiederholrate: 56 - 75 Hz\nHorizontaler Betrachtungswinkel: 178\nVertikaler Betrachtungswinkel: 178\nBildschirmbeschichtung: 3H Hard Coating, entspiegelt (25 %)\nHintergrundbeleuchtungs-Technologie: LED-Hintergrundbeleuchtung\nBesonderheiten: Spielmodus, Cinema Mode, On-screen Digital Controls, Crosshair Display, Flicker Safe, Reader Mode, Intelligente Energiespartechnologie, Farbkalibrierung, Dual Controller, Black Stabilizer, DAS Mode (Dynamic Action Sync), Color Weakness Mode, Super Resolution+, Photo Mode\nFarbe: Schwarz\nAbmessungen (Breite x Tiefe x H\u00f6he): 54.77 cm x 24.95 cm x 52.63 cm - mit Fu\u00df\nGewicht: 5.9 kg\nTyp: Lautsprecher\nAusgangsleistung/Kanal: 1.2 Watt\nSchnittstellen: HDMI  DisplayPort 1.2  Kopfh\u00f6rer  USB 2.0 Upstream (Typ B)  2 x USB 2.0 Downstream (Typ A)  VGA  Audio Line-In\nEinstellungen der Anzeigeposition: H\u00f6he, Pivot (Rotation), Drehung, Neigung\nVESA-Halterung: 100 x 100 mm\nEnthaltene Kabel: HDMI-Kabel - 1.8 m  DisplayPort-Kabel - 1.8 m\nKennzeichnung: FCC Klasse B bescheinigt, UL, BSMI, cUL, CCC, ERP, EPA 7.0\nEingangsspannung: Wechselstrom 120/230 V (50/60 Hz)\nLeistungsaufnahme im Ein-Zustand: 25 W\nStromverbrauch SDR (eingeschaltet): 20.5 kWh/1.000 h\nStromverbrauch (typisch): 28 Watt\nEnergierverbrauch Sleep: 0.3 Watt\nStromverbrauch (Aus-Modus): 0.3 Watt\nDetails zu Abmessungen & Gewicht: Mit Fu\u00df - Breite: 54.77 cm - Tiefe: 24.95 cm - H\u00f6he: 52.63 cm - Gewicht: 5.9 kg  Ohne Fu\u00df - Breite: 54.77 cm - Tiefe: 5.3 cm - H\u00f6he: 36.93 cm - Gewicht: 4.1 kg\nTransportbreite: 62.2 cm\nTransporttiefe: 18.8 cm\nTransporth\u00f6he: 52.8 cm\nTransportgewicht: 8.5 kg\nTCO-zertifiziert: TCO Certified Displays 9\nProduktbeschreibung: LG 25BL55WY-B - BL55WY Series - LED-Monitor - 63.4 cm (25\")\nGer\u00e4tetyp: LED-hintergrundbeleuchteter LCD-Monitor - 63.4 cm (25\")\nLeistungsmerkmale: USB 2.0 Hub\nEingangsanschl\u00fcsse: HDMI, VGA, DisplayPort\nSpannung: Wechselstrom 120/230 V (50/60 Hz)\nAbmessungen (Breite x Tiefe x H\u00f6he) - mit Fu\u00df: 54.77 cm x 24.95 cm x 52.63 cm\nUmweltschutzstandards: TCO Certified Displays 9",
    "reference_file": "offer_reference_1469.json",
    "shop_name": "HiQ24"
}