{
    "html_file": "offer_2014_10.html",
    "name": "Dell UltraSharp UP2720Q, 27\"",
    "offer_link": "https://www.e-tec.at/details.php?artnr=300426",
    "price": 1189.0,
    "raw_specifications": {
        "Abmessungen (BxHxT)": "612x433x212mm (mit Standfu\u00df),  612x377x51mm (ohne Standfu\u00df)",
        "Anschl\u00fcsse - DisplayPort 1.4": "1",
        "Anschl\u00fcsse - HDMI 2.0": "2",
        "Anschl\u00fcsse - Thunderbolt 3": "2",
        "Anwendung": "station\u00e4r",
        "Audio": "1x Line-Out",
        "Aufl\u00f6sung": "3840x2160",
        "Beschichtung": "matt (non-glare),  H\u00e4rtegrad 3H",
        "Besonderheiten": "Blendschutzhaube,  USB-C Power Delivery (90W),  mechanische Tasten,  Hardware-Kalibrierung,  Colorimeter (integriert),  Picture-in-Picture,  Sicherheitsschloss (Kensington),  HDCP 2.2,  Werkskalibrierung (Delta-E <2)",
        "Bildwiederholfrequenz": "60Hz",
        "Blickwinkel": "178\u00b0/178\u00b0",
        "Diagonale": "27\"/68.6cm",
        "Ergonomie": "130mm (h\u00f6henverstellbar),  90\u00b0 (Pivot),  \u00b145\u00b0 (drehbar),  +21\u00b0/-5\u00b0 (neigbar),  keine Angabe (Schr\u00e4glage)",
        "FRC": "nein (10bit nativ)",
        "Farbe": "schwarz",
        "Farbraum - Adobe RGB": "100%",
        "Farbraum - DCI-P3": "98%",
        "Farbraum - sRGB": "100%",
        "Farbtiefe": "10bit (1.07 Mrd. Farben)",
        "Form": "gerade (flat)",
        "Gewicht": "9.71kg (mit Standfu\u00df),  5.55kg (ohne Standfu\u00df)",
        "HDR": "N/A",
        "Helligkeit": "250cd/m\u00b2 (typisch)",
        "Herstellergarantie": "drei Jahre",
        "Hintergrundbeleuchtung": "White-LED,  flicker-free,  Blaulichtfilter",
        "Kontrast - statisch": "1.300:1",
        "Leistungsaufnahme": "230W (maximal),  44W (typisch),  keine Angabe (Energielabel alt A+++ bis G),  0.5W (Standby)",
        "Panel": "IPS",
        "Reaktionszeit - GtG": "6ms",
        "Screen-to-Body-Ratio": "87.1% (berechnet)",
        "Seitenverh\u00e4ltnis": "16:9",
        "Signalfrequenz": "15-135kHz (horizontal),  23-86Hz (vertikal)",
        "Stromversorgung": "AC-In (internes Netzteil)",
        "USB-Hub In": "1x Thunderbolt 3 (shared)",
        "USB-Hub Out": "2x USB-A 3.1,  2x USB-A 3.0 (BC 1.2)",
        "USB-Schreibweise": "Link",
        "VESA": "100x100 (belegt)",
        "VRR (Variable Refresh Rate)": "N/A",
        "Weitere Anschl\u00fcsse": "N/A"
    },
    "raw_specifications_text": "Abmessungen (BxHxT): 612x433x212mm (mit Standfu\u00df),  612x377x51mm (ohne Standfu\u00df)\nAnschl\u00fcsse - DisplayPort 1.4: 1\nAnschl\u00fcsse - HDMI 2.0: 2\nAnschl\u00fcsse - Thunderbolt 3: 2\nAnwendung: station\u00e4r\nAudio: 1x Line-Out\nAufl\u00f6sung: 3840x2160\nBeschichtung: matt (non-glare),  H\u00e4rtegrad 3H\nBesonderheiten: Blendschutzhaube,  USB-C Power Delivery (90W),  mechanische Tasten,  Hardware-Kalibrierung,  Colorimeter (integriert),  Picture-in-Picture,  Sicherheitsschloss (Kensington),  HDCP 2.2,  Werkskalibrierung (Delta-E <2)\nBildwiederholfrequenz: 60Hz\nBlickwinkel: 178\u00b0/178\u00b0\nDiagonale: 27\"/68.6cm\nErgonomie: 130mm (h\u00f6henverstellbar),  90\u00b0 (Pivot),  \u00b145\u00b0 (drehbar),  +21\u00b0/-5\u00b0 (neigbar),  keine Angabe (Schr\u00e4glage)\nFarbe: schwarz\nFarbraum - Adobe RGB: 100%\nFarbraum - DCI-P3: 98%\nFarbraum - sRGB: 100%\nFarbtiefe: 10bit (1.07 Mrd. Farben)\nForm: gerade (flat)\nFRC: nein (10bit nativ)\nGewicht: 9.71kg (mit Standfu\u00df),  5.55kg (ohne Standfu\u00df)\nHDR: N/A\nHelligkeit: 250cd/m\u00b2 (typisch)\nHerstellergarantie: drei Jahre\nHintergrundbeleuchtung: White-LED,  flicker-free,  Blaulichtfilter\nKontrast - statisch: 1.300:1\nLeistungsaufnahme: 230W (maximal),  44W (typisch),  keine Angabe (Energielabel alt A+++ bis G),  0.5W (Standby)\nPanel: IPS\nReaktionszeit - GtG: 6ms\nScreen-to-Body-Ratio: 87.1% (berechnet)\nSeitenverh\u00e4ltnis: 16:9\nSignalfrequenz: 15-135kHz (horizontal),  23-86Hz (vertikal)\nStromversorgung: AC-In (internes Netzteil)\nUSB-Hub In: 1x Thunderbolt 3 (shared)\nUSB-Hub Out: 2x USB-A 3.1,  2x USB-A 3.0 (BC 1.2)\nUSB-Schreibweise: Link\nVESA: 100x100 (belegt)\nVRR (Variable Refresh Rate): N/A\nWeitere Anschl\u00fcsse: N/A",
    "reference_file": "offer_reference_2014.json",
    "shop_name": "e-tec.at"
}