{
    "html_file": "offer_351_1.html",
    "name": "Lenovo ThinkVision T32p-30, 31.5\"",
    "offer_link": "https://www.proshop.at/Bildschirm/Lenovo-31-Bildschirm-ThinkVision-T32p-30-Black-4-ms/3179135?utm_source=geizhals&utm_medium=cpc&utm_campaign=pricesite",
    "price": 640.99,
    "raw_specifications": {
        "Abmessungen (Breite x Tiefe x H\u00f6he)": "71.42 cm x 23.46 cm x 59.95 cm - mit Fu\u00df",
        "Abmessungen (Breite x Tiefe x H\u00f6he) - mit Fu\u00df": "71.42 cm x 23.46 cm x 59.95 cm",
        "Besonderheiten": "Integrierte Kabelf\u00fchrung, Augenkomfort-Modus, grenzenlos, Natural Low Blue Light Technology, Modularer Kamera-Support, modularer Soundbar-Support",
        "Bildschirmbeschichtung": "Blendfrei",
        "Bildschirmtyp": "IPS",
        "Details zu Abmessungen & Gewicht": "Mit Standfu\u00df (h\u00f6chste Position) - Breite: 71.42 cm - Tiefe: 23.46 cm - H\u00f6he: 59.95 cm - Gewicht: 9.94 kg  Mit Standfu\u00df (niedrigste Position) - Breite: 71.42 cm - Tiefe: 23.49 cm - H\u00f6he: 44.45 cm - Gewicht: 9.94 kg  Ohne Fu\u00df - Breite: 71.4 cm - Tiefe: 5.95 cm - H\u00f6he: 42.09 cm",
        "Diagonalabmessung": "80 cm (31.5\")",
        "Display-Typ": "LED-hintergrundbeleuchteter LCD-Monitor / TFT-Aktivmatrix",
        "EAN": "0196801203211",
        "ENERGY STAR zertifiziert": "Ja",
        "ENERGY STAR-Version": "8.0",
        "EPEAT-kompatibel": "EPEAT Gold",
        "Eingangsanschl\u00fcsse": "HDMI, DisplayPort, USB-C",
        "Eingangsspannung": "Wechselstrom 100-240 V (50/60 Hz)",
        "Einstellungen der Anzeigeposition": "H\u00f6he, Pivot (Rotation), Drehung, Neigung",
        "Enthaltene Kabel": "1 x Stromkabel - 1.8 m  1 x USB-C Kabel - 1.8 m",
        "Erforderliches Betriebssystem": "Windows 10, Windows 11",
        "Farbe": "Raven Black",
        "Farbraum": "95% DCI-P3 (CIE 1976), 99% sRGB",
        "Farbunterst\u00fctzung": "1,07 Mrd. Farben",
        "Ger\u00e4tetyp": "LED-hintergrundbeleuchteter LCD-Monitor - 80 cm (31.5\")",
        "Gewicht": "9.94 kg",
        "HDR-Format": "HDR10",
        "HDR-f\u00e4hig": "HDR10",
        "Helligkeit": "350 cd/m\u00b2",
        "Hersteller": "Lenovo",
        "Hintergrundbeleuchtungs-Technologie": "WLED",
        "Horizontaler Betrachtungswinkel": "178",
        "H\u00f6heneinstellung": "155 mm",
        "Integrierte Peripherieger\u00e4te": "USB 3.1 Gen.1 Hub",
        "Kennzeichnung": "CCC, RoHS 2011/65/EU, TUV Rheinland Eye Comfort Certification, China Energy standard Tier 1, TUV Eyesafe Display Certification, TUV Rheinland Low Blue Light (Hardware Solution), TCO Certified 9.0",
        "Kontrast": "1000:1 / 3000000:1 (dynamisch)",
        "Leistungsmerkmale": "Slot f\u00fcr Sicherheitsschloss (Kabelschloss getrennt erh\u00e4ltlich)",
        "Lokalisierung": "Englisch / Europa",
        "Mitgelieferte Software": "Lenovo Display Control Center",
        "Modell": "63D2GAT1EU",
        "Native Aufl\u00f6sung": "4K 3840 x 2160",
        "Neigungswinkel": "-5/+23.5",
        "Pixelpitch": "0.1812 mm",
        "Ppi": "140",
        "Produktbeschreibung": "Lenovo ThinkVision T32p-30 - LED-Monitor - 4K - 80 cm (31.5\")",
        "Reaktionszeit": "4 ms (extrem), 6 ms (normal)",
        "Rotationswinkel": "180",
        "Schlosstyp zur Diebstahlsicherung": "Kensington Slot",
        "Schnittstellen": "DisplayPort  HDMI  Kopfh\u00f6rer  USB 3.2 Gen 1 Downstream mit Battery Charging 1.2 (Typ A)  3 x USB 3.2 Gen 1 Downstream (Typ A)  USB-C 3,2 Gen 1 Upstream (Typ A)  USB-C 3,2 Gen 1 Upstream (Type C)  LAN",
        "Schwenkwinkel": "90",
        "Seitenverh\u00e4ltnis": "16:9",
        "Spannung": "Wechselstrom 100-240 V (50/60 Hz)",
        "Stromverbrauch (max.)": "161 Watt",
        "Stromverbrauch (typisch)": "32 Watt",
        "TCO-zertifiziert": "TCO Certified Edge Displays, TCO Certified Displays 9",
        "Umweltschutzstandards": "TCO Certified Edge Displays, TCO Certified Displays 9, ENERGY STAR-qualifiziert EPEAT Gold",
        "VESA-Halterung": "100 x 100 mm",
        "Vertikale Bildwiederholrate": "60 Hz",
        "Vertikaler Betrachtungswinkel": "178",
        "Waren-Nr.": "3179135",
        "Zum Hersteller": "lenovo.com"
    },
    "raw_specifications_text": "Hersteller: Lenovo\nWaren-Nr.: 3179135\nModell: 63D2GAT1EU\nEAN: 0196801203211\nZum Hersteller: lenovo.com\nProduktbeschreibung: Lenovo ThinkVision T32p-30 - LED-Monitor - 4K - 80 cm (31.5\")\nGer\u00e4tetyp: LED-hintergrundbeleuchteter LCD-Monitor - 80 cm (31.5\")\nLeistungsmerkmale: Slot f\u00fcr Sicherheitsschloss (Kabelschloss getrennt erh\u00e4ltlich)\nBildschirmtyp: IPS\nSeitenverh\u00e4ltnis: 16:9\nNative Aufl\u00f6sung: 4K 3840 x 2160\nPixelpitch: 0.1812 mm\nHelligkeit: 350 cd/m\u00b2\nKontrast: 1000:1 / 3000000:1 (dynamisch)\nHDR-f\u00e4hig: HDR10\nReaktionszeit: 4 ms (extrem), 6 ms (normal)\nFarbunterst\u00fctzung: 1,07 Mrd. Farben\nFarbraum: 95% DCI-P3 (CIE 1976), 99% sRGB\nEingangsanschl\u00fcsse: HDMI, DisplayPort, USB-C\nEinstellungen der Anzeigeposition: H\u00f6he, Pivot (Rotation), Drehung, Neigung\nBildschirmbeschichtung: Blendfrei\nSpannung: Wechselstrom 100-240 V (50/60 Hz)\nFarbe: Raven Black\nAbmessungen (Breite x Tiefe x H\u00f6he) - mit Fu\u00df: 71.42 cm x 23.46 cm x 59.95 cm\nGewicht: 9.94 kg\nLokalisierung: Englisch / Europa\nUmweltschutzstandards: TCO Certified Edge Displays, TCO Certified Displays 9, ENERGY STAR-qualifiziert EPEAT Gold\nKennzeichnung: CCC, RoHS 2011/65/EU, TUV Rheinland Eye Comfort Certification, China Energy standard Tier 1, TUV Eyesafe Display Certification, TUV Rheinland Low Blue Light (Hardware Solution), TCO Certified 9.0\nDisplay-Typ: LED-hintergrundbeleuchteter LCD-Monitor / TFT-Aktivmatrix\nDiagonalabmessung: 80 cm (31.5\")\nIntegrierte Peripherieger\u00e4te: USB 3.1 Gen.1 Hub\nPpi: 140\nHDR-Format: HDR10\nVertikale Bildwiederholrate: 60 Hz\nHorizontaler Betrachtungswinkel: 178\nVertikaler Betrachtungswinkel: 178\nHintergrundbeleuchtungs-Technologie: WLED\nBesonderheiten: Integrierte Kabelf\u00fchrung, Augenkomfort-Modus, grenzenlos, Natural Low Blue Light Technology, Modularer Kamera-Support, modularer Soundbar-Support\nAbmessungen (Breite x Tiefe x H\u00f6he): 71.42 cm x 23.46 cm x 59.95 cm - mit Fu\u00df\nSchnittstellen: DisplayPort  HDMI  Kopfh\u00f6rer  USB 3.2 Gen 1 Downstream mit Battery Charging 1.2 (Typ A)  3 x USB 3.2 Gen 1 Downstream (Typ A)  USB-C 3,2 Gen 1 Upstream (Typ A)  USB-C 3,2 Gen 1 Upstream (Type C)  LAN\nNeigungswinkel: -5/+23.5\nSchwenkwinkel: 90\nRotationswinkel: 180\nH\u00f6heneinstellung: 155 mm\nVESA-Halterung: 100 x 100 mm\nEnthaltene Kabel: 1 x Stromkabel - 1.8 m  1 x USB-C Kabel - 1.8 m\nSchlosstyp zur Diebstahlsicherung: Kensington Slot\nEingangsspannung: Wechselstrom 100-240 V (50/60 Hz)\nStromverbrauch (typisch): 32 Watt\nStromverbrauch (max.): 161 Watt\nMitgelieferte Software: Lenovo Display Control Center\nErforderliches Betriebssystem: Windows 10, Windows 11\nDetails zu Abmessungen & Gewicht: Mit Standfu\u00df (h\u00f6chste Position) - Breite: 71.42 cm - Tiefe: 23.46 cm - H\u00f6he: 59.95 cm - Gewicht: 9.94 kg  Mit Standfu\u00df (niedrigste Position) - Breite: 71.42 cm - Tiefe: 23.49 cm - H\u00f6he: 44.45 cm - Gewicht: 9.94 kg  Ohne Fu\u00df - Breite: 71.4 cm - Tiefe: 5.95 cm - H\u00f6he: 42.09 cm\nTCO-zertifiziert: TCO Certified Edge Displays, TCO Certified Displays 9\nEPEAT-kompatibel: EPEAT Gold\nENERGY STAR zertifiziert: Ja\nENERGY STAR-Version: 8.0",
    "reference_file": "offer_reference_351.json",
    "shop_name": "Proshop.at"
}