{
    "html_file": "offer_1276_3.html",
    "name": "AOC 27G2SAE/BK, 27\"",
    "offer_link": "https://www.amazon.de/dp/B09BNKF5H5?linkCode=xm2&camp=2025&creative=165953&smid=A3JWKAKR8XB7XF&creativeASIN=B09BNKF5H5&tag=geizhals1-21",
    "price": 161.24,
    "raw_specifications": {
        "ASIN": "B09BNKF5H5",
        "Amazon Bestseller-Rang": "Nr. 15,347 in Computer & Zubeh\u00f6r (Siehe Top 100 in Computer & Zubeh\u00f6r)  Nr. 348 in Monitore",
        "Anzahl HDMI Schnittstellen": "\u200e3",
        "Anzahl USB 3.0 Schnittstellen": "\u200e3",
        "Anzahl der Lithium-Ionen-Zellen": "\u200e5",
        "Anzahl der Lithium-Metall-Zellen": "\u200e5",
        "Artikelgewicht": "\u200e6,03 Kilograms",
        "Batterien": "\u200e1 Lithium-Ionen Batterien erforderlich.",
        "Batterien enthalten": "\u200eNein",
        "Bildschirmaufl\u00f6sung": "\u200e1920 x 1080 pixels",
        "Display-Gr\u00f6\u00dfe": "\u200e68 Zentimeter",
        "Durchschnittliche Kundenbewertung": "4,6  4,6 von 5 Sternen    \n    20.630 Sternebewertungen   \n\n\n 4,6 von 5 Sternen",
        "Farbe": "\u200eschwarz/rot",
        "Garantierte Software-Updates bis": "\u200eunbekannt",
        "Gewicht Lithium-Akku": "\u200e2 Gramm",
        "Hersteller": "\u200eAOC International",
        "Im Angebot von Amazon.de seit": "2. August 2021",
        "Kapazit\u00e4t Lithium-Akku": "\u200e2 Kilowattstunden",
        "L\u00f6sung": "\u200e1920 x 1080 Pixels",
        "Marke": "\u200eAOC",
        "Modell/Serie": "\u200eMONITOR 27 AOC 27G2SAE/BK GAMING 16:9 HDMI DP USB 1MS SP",
        "Modellnummer": "\u200e27G2SAE/BK",
        "Produktabmessungen": "\u200e9,91 x 60,5 x 36,75 cm; 6,03 Kilogramm",
        "Prozessortyp": "\u200eOthers",
        "Volt": "\u200e220",
        "Watt": "\u200e26 Watt"
    },
    "raw_specifications_text": "Marke: \u200eAOC\nHersteller: \u200eAOC International\nModell/Serie: \u200eMONITOR 27 AOC 27G2SAE/BK GAMING 16:9 HDMI DP USB 1MS SP\nProduktabmessungen: \u200e9,91 x 60,5 x 36,75 cm; 6,03 Kilogramm\nBatterien: \u200e1 Lithium-Ionen Batterien erforderlich.\nModellnummer: \u200e27G2SAE/BK\nFarbe: \u200eschwarz/rot\nDisplay-Gr\u00f6\u00dfe: \u200e68 Zentimeter\nBildschirmaufl\u00f6sung: \u200e1920 x 1080 pixels\nL\u00f6sung: \u200e1920 x 1080 Pixels\nProzessortyp: \u200eOthers\nAnzahl USB 3.0 Schnittstellen: \u200e3\nAnzahl HDMI Schnittstellen: \u200e3\nVolt: \u200e220\nWatt: \u200e26 Watt\nBatterien enthalten: \u200eNein\nKapazit\u00e4t Lithium-Akku: \u200e2 Kilowattstunden\nGewicht Lithium-Akku: \u200e2 Gramm\nAnzahl der Lithium-Ionen-Zellen: \u200e5\nAnzahl der Lithium-Metall-Zellen: \u200e5\nArtikelgewicht: \u200e6,03 Kilograms\nGarantierte Software-Updates bis: \u200eunbekannt\nASIN: B09BNKF5H5\nDurchschnittliche Kundenbewertung: 4,6  4,6 von 5 Sternen    \n    20.630 Sternebewertungen   \n\n\n 4,6 von 5 Sternen\nAmazon Bestseller-Rang: Nr. 15,347 in Computer & Zubeh\u00f6r (Siehe Top 100 in Computer & Zubeh\u00f6r)  Nr. 348 in Monitore\nIm Angebot von Amazon.de seit: 2. August 2021",
    "reference_file": "offer_reference_1276.json",
    "shop_name": "Amazon.at"
}