{
    "html_file": "offer_1290_5.html",
    "name": "ViewSonic VG2456, 23.8\"",
    "offer_link": "https://restposten.bauguru.at/monitore/126986-monitor-viewsonic-vg2456-ips-led-24-0766907006155.html",
    "price": 260.7,
    "raw_specifications": {
        "Arbeitsbereich f\u00fcr Temperatur": "0\u00ba / 40\u00ba",
        "Aufl\u00f6sung": "Full HD",
        "Aufl\u00f6sung (px)": "1920 x 1080 px",
        "Bildschirm": "24\"",
        "Dreh": "0\u00ba / 120\u00b0",
        "Empfohlene verwendung": "Unternehmen & Business",
        "Energieklassifizierung": "D",
        "Farbe": "Schwarz",
        "Finish": "Mattierend",
        "Geschwindigkeit": "60 Hz",
        "Glanz": "250 ANSI",
        "H\u00e4rte": "3H",
        "Kompatibel": "VESA 100 x 100 mm",
        "Kontrastverh\u00e4ltnis": "1000:1",
        "Land/Region der Herstellung": "China",
        "Maximale Anpassung": "130 mm",
        "Montage": "VESA",
        "Pr\u00e4zision (relative Feuchte)": "20 % - 90 %",
        "Seitenverh\u00e4ltnis": "16:9",
        "Spannung": "100 - 240 V",
        "Steckbares Produkt": "Ja",
        "Stecker": "Sicherheitsrille",
        "Steckertyp": "EU-Stecker",
        "Stromquelle": "Wechselstrom",
        "Touchscreen": "Kein",
        "Winkel": "178\u00ba",
        "gro\u00df": "210 cm"
    },
    "raw_specifications_text": "Bildschirm: 24\"\nAufl\u00f6sung (px): 1920 x 1080 px\nSteckbares Produkt: Ja\nSteckertyp: EU-Stecker\nLand/Region der Herstellung: China\nFarbe: Schwarz\nSeitenverh\u00e4ltnis: 16:9\nAufl\u00f6sung: Full HD\nEnergieklassifizierung: D\nKontrastverh\u00e4ltnis: 1000:1\nFinish: Mattierend\nH\u00e4rte: 3H\nGlanz: 250 ANSI\nSpannung: 100 - 240 V\nTouchscreen: Kein\nWinkel: 178\u00ba\nStecker: Sicherheitsrille\nStromquelle: Wechselstrom\ngro\u00df: 210 cm\nMontage: VESA\nGeschwindigkeit: 60 Hz\nArbeitsbereich f\u00fcr Temperatur: 0\u00ba / 40\u00ba\nMaximale Anpassung: 130 mm\nEmpfohlene verwendung: Unternehmen & Business\nKompatibel: VESA 100 x 100 mm\nDreh: 0\u00ba / 120\u00b0\nPr\u00e4zision (relative Feuchte): 20 % - 90 %",
    "reference_file": "offer_reference_1290.json",
    "shop_name": "bauguru"
}