{
    "html_file": "offer_2387_7.html",
    "name": "AG neovo X-24E, 23.6\" schwarz",
    "offer_link": "https://technikladen.at/P-AG-Neovo-X-24E-599-cm-236-Zoll-LCD/TFT-LED-1920-x-1080-Pixel-300-cd/m-Full-HD-169?tl=gzhls",
    "price": 742.38,
    "raw_specifications": {
        "AMD FreeSync": "Nein",
        "Anzahl DVI-D-Anschl\u00fcsse": "1",
        "Anzahl DisplayPort Anschl\u00fcsse": "1",
        "Anzahl HDMI-Anschl\u00fcsse": "1",
        "Anzahl HDMI-Eingangsschnittstellen": "1",
        "Anzahl VGA (D-Sub) Anschl\u00fcsse": "1",
        "Anzahl der Farben des Displays": "16,78 Millionen Farben",
        "Anzahl der Lautsprecher": "2",
        "Anzahl eingebauter Lautsprecher": "2",
        "Anzeige": "LED",
        "Audioanschl\u00fcsse": "Ja",
        "Benutzerhandbuch auf CD-ROM": "Ja",
        "Betriebstemperatur": "0 - 40 \u00b0C",
        "Bezel Weite (side)": "1,4 cm",
        "Bezel Weite (top)": "1,4 cm",
        "Bild-in-Bild": "Ja",
        "Bildschirmaufl\u00f6sung": "1920 x 1080 Pixel",
        "Bildschirmdiagonale": "59,9 cm",
        "Bildschirmtechnologie": "LCD/TFT, LED",
        "Bildwinkel, horizontal": "178 \u00b0",
        "Bildwinkel, vertikal": "178 \u00b0",
        "Blickwinkel, horizontal": "170 \u00b0",
        "Blickwinkel, vertikal": "160 \u00b0",
        "Breite": "562 mm",
        "Breite (ohne Standfu\u00df)": "56,2 cm",
        "Computersystem": "Nein",
        "DVI Anschluss": "Ja",
        "Digital horizontale Frequenz": "24 - 83 kHz",
        "Digital vertikale Frequenz": "50 - 75 Hz",
        "DisplayPorts-Version": "1.2a",
        "Eingebaute Lautsprecher": "Ja",
        "Eingebauter Ethernet-Anschluss": "Nein",
        "Energieeffizienzklasse (SDR)": "E",
        "Energieeffizienzskala": "A bis G",
        "Energieverbrauch (SDR) pro 1.000 Stunden": "18 kWh",
        "Geh\u00e4usematerial": "Metall",
        "Ger\u00e4tebreite (inkl. Fu\u00df)": "562,4 mm",
        "Ger\u00e4teh\u00f6he (inkl. Fu\u00df)": "392,8 mm",
        "Ger\u00e4tetiefe (inkl. Fu\u00df)": "196 mm",
        "Gewicht": "7,2 kg",
        "Gewicht (mit St\u00e4nder)": "7,8 kg",
        "Gewicht (ohne St\u00e4nder)": "7 kg",
        "HD-Typ": "Full HD",
        "HDMI": "Ja",
        "HDMI-Version": "1.4",
        "Helligkeit": "300 cd/m\u00b2",
        "Helligkeit (typisch)": "250 cd/m\u00b2",
        "Horizontaler Scanbereich": "24 - 82 kHz",
        "H\u00f6he": "397 mm",
        "H\u00f6he (ohne Standfu\u00df)": "35,3 cm",
        "H\u00f6henverstellung": "Nein",
        "Integrierte Kamera": "Nein",
        "Integrierter USB-Hub": "Nein",
        "Kabelsperre-Slot": "Ja",
        "Kontrastverh\u00e4ltnis": "1000:1",
        "Kontrastverh\u00e4ltnis (dynamisch)": "2000000:1",
        "Luftfeuchtigkeit bei Lagerung": "5 - 95 %",
        "Marktpositionierung": "Industriell",
        "Mitgelieferte Kabel": "AC, Audio (3.5mm), VGA",
        "NTSC Abdeckung (typisch)": "72 %",
        "NVIDIA G-SYNC": "Nein",
        "Nachhaltigkeitszertifikate": "RoHS",
        "Natives Seitenverh\u00e4ltnis": "16:9",
        "Neigungswinkelbereich": "3 - 21 \u00b0",
        "Oberfl\u00e4chenh\u00e4rte": "9H",
        "PC Audio-Eingang": "Ja",
        "Paketgewicht": "10,6 kg",
        "Panel-Montage-Schnittstelle": "75 x 75,100 x 100 mm",
        "Panel-Typ": "VA",
        "Pixel Abstand": "0,272 x 0,272 mm",
        "Produktdesign": "Digital Beschilderung Flachbildschirm",
        "Produktfarbe": "Schwarz",
        "RGB-Farbraum": "NTSC",
        "RMS-Leistung": "4 W",
        "Reaktionszeit": "3 ms",
        "Relative Luftfeuchtigkeit in Betrieb": "10 - 90 %",
        "Schnellstart\u00fcbersicht": "Ja",
        "Slot-Typ Kabelsperre": "Kensington",
        "Stromverbrauch (Standardbetrieb)": "19 W",
        "Stromverbrauch (Standby)": "0,3 W",
        "Stromverbrauch (aus)": "0,3 W",
        "St\u00e4nder enthalten": "Ja",
        "Temperaturbereich bei Lagerung": "-20 - 60 \u00b0C",
        "Temperaturbereich in Betrieb": "0 - 40 \u00b0C",
        "Tiefe": "155 mm",
        "Tiefe (ohne Standfu\u00df)": "5,62 cm",
        "Touchscreen": "Nein",
        "Typ der Hintergrundbeleuchtung": "LED",
        "USB Port": "Nein",
        "Unterst\u00fctzte Grafik-Aufl\u00f6sungen": "1920 x 1080 (HD 1080)",
        "VESA-Halterung": "Ja",
        "VGA (D-Sub)-Eingangsanschl\u00fcsse": "1",
        "Verpackungsart": "Box",
        "Verpackungsbreite": "676 mm",
        "Verpackungsh\u00f6he": "525 mm",
        "Verpackungstiefe": "213 mm",
        "Vertikaler Scanbereich": "50 - 75 Hz",
        "Warentarifnummer (HS)": "85285210",
        "Zertifizierung": "CE, WEEE, REACH, GOST-R",
        "kippbar": "Ja"
    },
    "raw_specifications_text": "Bildschirmdiagonale: 59,9 cm\nBildschirmaufl\u00f6sung: 1920 x 1080 Pixel\nNatives Seitenverh\u00e4ltnis: 16:9\nBildschirmtechnologie: LCD/TFT, LED\nTouchscreen: Nein\nHD-Typ: Full HD\nPanel-Typ: VA\nTyp der Hintergrundbeleuchtung: LED\nHelligkeit (typisch): 250 cd/m\u00b2\nReaktionszeit: 3 ms\nUnterst\u00fctzte Grafik-Aufl\u00f6sungen: 1920 x 1080 (HD 1080)\nKontrastverh\u00e4ltnis: 1000:1\nKontrastverh\u00e4ltnis (dynamisch): 2000000:1\nBildwinkel, horizontal: 178 \u00b0\nBildwinkel, vertikal: 178 \u00b0\nAnzahl der Farben des Displays: 16,78 Millionen Farben\nPixel Abstand: 0,272 x 0,272 mm\nDigital horizontale Frequenz: 24 - 83 kHz\nDigital vertikale Frequenz: 50 - 75 Hz\nOberfl\u00e4chenh\u00e4rte: 9H\nRGB-Farbraum: NTSC\nNTSC Abdeckung (typisch): 72 %\nNVIDIA G-SYNC: Nein\nAMD FreeSync: Nein\nIntegrierter USB-Hub: Nein\nAnzahl VGA (D-Sub) Anschl\u00fcsse: 1\nDVI Anschluss: Ja\nAnzahl DVI-D-Anschl\u00fcsse: 1\nHDMI: Ja\nAnzahl HDMI-Anschl\u00fcsse: 1\nHDMI-Version: 1.4\nAnzahl DisplayPort Anschl\u00fcsse: 1\nDisplayPorts-Version: 1.2a\nAudioanschl\u00fcsse: Ja\nMarktpositionierung: Industriell\nProduktfarbe: Schwarz\nGeh\u00e4usematerial: Metall\nEingebaute Lautsprecher: Ja\nIntegrierte Kamera: Nein\nAnzahl der Lautsprecher: 2\nRMS-Leistung: 4 W\nVESA-Halterung: Ja\nPanel-Montage-Schnittstelle: 75 x 75,100 x 100 mm\nKabelsperre-Slot: Ja\nSlot-Typ Kabelsperre: Kensington\nH\u00f6henverstellung: Nein\nkippbar: Ja\nNeigungswinkelbereich: 3 - 21 \u00b0\nBild-in-Bild: Ja\nSt\u00e4nder enthalten: Ja\nMitgelieferte Kabel: AC, Audio (3.5mm), VGA\nSchnellstart\u00fcbersicht: Ja\nGer\u00e4tebreite (inkl. Fu\u00df): 562,4 mm\nGer\u00e4tetiefe (inkl. Fu\u00df): 196 mm\nGer\u00e4teh\u00f6he (inkl. Fu\u00df): 392,8 mm\nGewicht (mit St\u00e4nder): 7,8 kg\nBreite (ohne Standfu\u00df): 56,2 cm\nTiefe (ohne Standfu\u00df): 5,62 cm\nH\u00f6he (ohne Standfu\u00df): 35,3 cm\nGewicht (ohne St\u00e4nder): 7 kg\nVerpackungsbreite: 676 mm\nVerpackungstiefe: 213 mm\nVerpackungsh\u00f6he: 525 mm\nPaketgewicht: 10,6 kg\nVerpackungsart: Box\nEnergieeffizienzklasse (SDR): E\nEnergieverbrauch (SDR) pro 1.000 Stunden: 18 kWh\nStromverbrauch (Standardbetrieb): 19 W\nStromverbrauch (Standby): 0,3 W\nStromverbrauch (aus): 0,3 W\nEnergieeffizienzskala: A bis G\nBetriebstemperatur: 0 - 40 \u00b0C\nTemperaturbereich bei Lagerung: -20 - 60 \u00b0C\nRelative Luftfeuchtigkeit in Betrieb: 10 - 90 %\nLuftfeuchtigkeit bei Lagerung: 5 - 95 %\nNachhaltigkeitszertifikate: RoHS\nWarentarifnummer (HS): 85285210\nAnzahl HDMI-Eingangsschnittstellen: 1\nVGA (D-Sub)-Eingangsanschl\u00fcsse: 1\nUSB Port: Nein\nEingebauter Ethernet-Anschluss: Nein\nPC Audio-Eingang: Ja\nProduktdesign: Digital Beschilderung Flachbildschirm\nBezel Weite (side): 1,4 cm\nBezel Weite (top): 1,4 cm\nHelligkeit: 300 cd/m\u00b2\nBlickwinkel, horizontal: 170 \u00b0\nBlickwinkel, vertikal: 160 \u00b0\nHorizontaler Scanbereich: 24 - 82 kHz\nVertikaler Scanbereich: 50 - 75 Hz\nAnzahl eingebauter Lautsprecher: 2\nComputersystem: Nein\nBreite: 562 mm\nTiefe: 155 mm\nH\u00f6he: 397 mm\nGewicht: 7,2 kg\nTemperaturbereich in Betrieb: 0 - 40 \u00b0C\nAnzeige: LED\nBenutzerhandbuch auf CD-ROM: Ja\nZertifizierung: CE, WEEE, REACH, GOST-R",
    "reference_file": "offer_reference_2387.json",
    "shop_name": "TechnikLaden"
}