{
    "html_file": "offer_1740_10.html",
    "name": "ASUS VA27AQSB, 27\"",
    "offer_link": "https://www.mylemon.at/artikel/asus/90lm06g0_b01170/27-l-va27dqsb.html",
    "price": 250.93,
    "raw_specifications": {
        "AC Eingangsfrequenz": "50/60 Hz",
        "AC Eingangsspannung": "100 - 240 V",
        "AMD FreeSync": "Ja",
        "Anzahl DisplayPort Anschl\u00fcsse": "1",
        "Anzahl HDMI-Anschl\u00fcsse": "1",
        "Anzahl der Farben des Displays": "16,78 Millionen Farben",
        "Anzahl der Lautsprecher": "2",
        "Artikelnummer": "M14Y6Z8L",
        "Aufl\u00f6sung": "2560x1440",
        "Besonderheiten": "75 Hz, AMD FreeSync",
        "Bildschirmdiagonale": "68,6 cm (27 Zoll)",
        "Bildschirmform": "Flach",
        "Bildwinkel, horizontal": "178\u00b0",
        "Bildwinkel, vertikal": "178\u00b0",
        "Breite (ohne Standfu\u00df)": "61,4 cm",
        "Display-Aufl\u00f6sung": "2560 x 1440 Pixel",
        "DisplayPorts-Version": "1.2",
        "Displaygr\u00f6\u00dfe": "27 Zoll",
        "EAN": "4718017802352",
        "Eingebaute Lautsprecher": "Ja",
        "Fu\u00dffarbe": "Schwarz",
        "Ger\u00e4tebreite (inkl. Fu\u00df)": "613,8 mm",
        "Ger\u00e4teh\u00f6he (inkl. Fu\u00df)": "517,2 mm",
        "Ger\u00e4tetiefe (inkl. Fu\u00df)": "226,3 mm",
        "Gewicht (mit St\u00e4nder)": "6,69 kg",
        "Gewicht (ohne St\u00e4nder)": "4,42 kg",
        "HD-Typ": "Quad HD",
        "HDMI": "Ja",
        "HDMI-Version": "1.4",
        "Helligkeit": "350 cd/m\u00b2",
        "Helligkeit (typisch)": "350 cd/m\u00b2",
        "Hersteller Artikelnummer": "90LM06G0-B01170",
        "H\u00f6he (ohne Standfu\u00df)": "36,6 cm",
        "H\u00f6heneinstellung": "15 cm",
        "H\u00f6henverstellung": "Ja",
        "Integrierte Kamera": "Nein",
        "Integrierter USB-Hub": "Nein",
        "Kabelsperre-Slot": "Ja",
        "Kontrastverh\u00e4ltnis": "1000:1",
        "Kopfh\u00f6rer-Anschluss": "3,5 mm",
        "Kopfh\u00f6rerausgang": "Ja",
        "Kopfh\u00f6rerausg\u00e4nge": "1",
        "Marktpositionierung": "Haus",
        "Maximale Bildwiederholrate": "75 Hz",
        "NVIDIA G-SYNC": "Ja",
        "Natives Seitenverh\u00e4ltnis": "16:9",
        "Neigungsverstellung": "Ja",
        "Neigungswinkelbereich": "-5 - 35\u00b0",
        "Panel": "IPS",
        "Panel-Montage-Schnittstelle": "100 x 100 mm",
        "Panel-Typ": "IPS",
        "Pivot": "Ja",
        "Pivot Winkel": "-90 - 90\u00b0",
        "Produktfarbe": "Schwarz",
        "RMS-Leistung": "2 W",
        "Rahmenloses Design": "Ja",
        "Reaktionszeit": "1 ms",
        "Schwenkbar": "Ja",
        "Schwenkwinkelbereich": "-180 - 180\u00b0",
        "Seitenverh\u00e4ltnis": "16:9",
        "Slot-Typ Kabelsperre": "Kensington",
        "Stromverbrauch (PowerSave)": "0,5 W",
        "Stromverbrauch (Standardbetrieb)": "40 W",
        "Stromverbrauch (aus)": "0,5 W",
        "Tiefe (ohne Standfu\u00df)": "5,15 cm",
        "Touchscreen": "Nein",
        "Typ der Hintergrundbeleuchtung": "LED",
        "Unterst\u00fctzte Grafik-Aufl\u00f6sungen": "2560 x 1440",
        "VESA Halterung": "100x100 mm",
        "VESA-Halterung": "Ja",
        "Video Anschl\u00fcsse": "1x HDMI, 1x DisplayPort",
        "Vorderer Rahmen": "Schwarz"
    },
    "raw_specifications_text": "Displaygr\u00f6\u00dfe: 27 Zoll\nAufl\u00f6sung: 2560x1440\nPanel: IPS\nReaktionszeit: 1 ms\nVideo Anschl\u00fcsse: 1x HDMI, 1x DisplayPort\nVESA Halterung: 100x100 mm\nHelligkeit: 350 cd/m\u00b2\nBesonderheiten: 75 Hz, AMD FreeSync\nHersteller Artikelnummer: 90LM06G0-B01170\nEAN: 4718017802352\nArtikelnummer: M14Y6Z8L\nBildschirmdiagonale: 68,6 cm (27 Zoll)\nDisplay-Aufl\u00f6sung: 2560 x 1440 Pixel\nNatives Seitenverh\u00e4ltnis: 16:9\nTouchscreen: Nein\nHD-Typ: Quad HD\nPanel-Typ: IPS\nBildschirmform: Flach\nKontrastverh\u00e4ltnis: 1000:1\nMaximale Bildwiederholrate: 75 Hz\nAnzahl der Farben des Displays: 16,78 Millionen Farben\nTyp der Hintergrundbeleuchtung: LED\nHelligkeit (typisch): 350 cd/m\u00b2\nUnterst\u00fctzte Grafik-Aufl\u00f6sungen: 2560 x 1440\nSeitenverh\u00e4ltnis: 16:9\nBildwinkel, horizontal: 178\u00b0\nBildwinkel, vertikal: 178\u00b0\nNVIDIA G-SYNC: Ja\nAMD FreeSync: Ja\nEingebaute Lautsprecher: Ja\nIntegrierte Kamera: Nein\nAnzahl der Lautsprecher: 2\nRMS-Leistung: 2 W\nMarktpositionierung: Haus\nProduktfarbe: Schwarz\nRahmenloses Design: Ja\nVorderer Rahmen: Schwarz\nFu\u00dffarbe: Schwarz\nIntegrierter USB-Hub: Nein\nHDMI: Ja\nKopfh\u00f6rerausgang: Ja\nAnzahl HDMI-Anschl\u00fcsse: 1\nHDMI-Version: 1.4\nAnzahl DisplayPort Anschl\u00fcsse: 1\nDisplayPorts-Version: 1.2\nKopfh\u00f6rerausg\u00e4nge: 1\nKopfh\u00f6rer-Anschluss: 3,5 mm\nVESA-Halterung: Ja\nKabelsperre-Slot: Ja\nH\u00f6henverstellung: Ja\nPanel-Montage-Schnittstelle: 100 x 100 mm\nSlot-Typ Kabelsperre: Kensington\nH\u00f6heneinstellung: 15 cm\nPivot: Ja\nPivot Winkel: -90 - 90\u00b0\nSchwenkbar: Ja\nSchwenkwinkelbereich: -180 - 180\u00b0\nNeigungswinkelbereich: -5 - 35\u00b0\nNeigungsverstellung: Ja\nStromverbrauch (Standardbetrieb): 40 W\nStromverbrauch (aus): 0,5 W\nStromverbrauch (PowerSave): 0,5 W\nAC Eingangsspannung: 100 - 240 V\nAC Eingangsfrequenz: 50/60 Hz\nGer\u00e4tebreite (inkl. Fu\u00df): 613,8 mm\nGer\u00e4tetiefe (inkl. Fu\u00df): 226,3 mm\nGer\u00e4teh\u00f6he (inkl. Fu\u00df): 517,2 mm\nGewicht (mit St\u00e4nder): 6,69 kg\nBreite (ohne Standfu\u00df): 61,4 cm\nTiefe (ohne Standfu\u00df): 5,15 cm\nH\u00f6he (ohne Standfu\u00df): 36,6 cm\nGewicht (ohne St\u00e4nder): 4,42 kg",
    "reference_file": "offer_reference_1740.json",
    "shop_name": "mylemon.at"
}