{
    "html_file": "offer_2193_12.html",
    "name": "ASUS ROG Strix XG49VQ, 49\"",
    "offer_link": "https://www.e-tec.at/details.php?artnr=284086",
    "price": 861.0,
    "raw_specifications": {
        "AMD FreeSync Premium": "Ja",
        "Abmessungen (BxHxT)": "1193x529x345mm (mit Standfu\u00df),  1193x370x345mm (ohne Standfu\u00df)",
        "Adaptive Sync": "Ja",
        "Anschl\u00fcsse - DisplayPort 1.2": "1",
        "Anschl\u00fcsse - HDMI 2.0": "2",
        "Anwendung": "station\u00e4r",
        "Audio": "Lautsprecher (2x 5W),  1x Line-Out",
        "Aufl\u00f6sung": "3840x1080",
        "Beschichtung": "matt (non-glare)",
        "Besonderheiten": "Slim Bezel,  mechanische Tasten mit Steuerkreuz,  Sicherheitsschloss (Kensington)",
        "Bildwiederholfrequenz": "144Hz",
        "Blickwinkel": "178\u00b0/178\u00b0",
        "Diagonale": "49\"/124.5cm",
        "Energieeffizienzklasse HDR (A bis G)": "G",
        "Energieeffizienzklasse alt (A+++ bis G)": "C",
        "Energieverbrauch HDR": "109kWh/1000h",
        "Energieverbrauch SDR": "56kWh/1000h",
        "Ergonomie": "120mm (h\u00f6henverstellbar),  N/A (Pivot),  \u00b116\u00b0 (drehbar),  +20\u00b0/-5\u00b0 (neigbar),  keine Angabe (Schr\u00e4glage)",
        "FRC": "unbekannt",
        "Farbe": "schwarz",
        "Farbraum - DCI-P3": "90%",
        "Farbraum - sRGB": "125%",
        "Farbtiefe": "8bit (16.7 Mio. Farben)",
        "Form": "gebogen (curved),  1800R/1.8m",
        "Gewicht": "13.30kg (mit Standfu\u00df),  9.70kg (ohne Standfu\u00df)",
        "HDR": "VESA DisplayHDR 400",
        "Helligkeit": "450cd/m\u00b2",
        "Herstellergarantie": "drei Jahre",
        "Hintergrundbeleuchtung": "White-LED,  flicker-free,  Blaulichtfilter",
        "Jahresverbrauch alt (A+++ bis G)": "138.70kWh",
        "Kontrast - statisch": "3.000:1",
        "Lautsprecher": "Ja",
        "Leistungsaufnahme": "keine Angabe (maximal),  47W (typisch),  95W (Energielabel alt A+++ bis G),  0.5W (Standby)",
        "Panel": "VA (SVA)",
        "Reaktionszeit - GtG": "4ms",
        "Screen-to-Body-Ratio": "91.5% (berechnet)",
        "Seitenverh\u00e4ltnis": "32:9",
        "Signalfrequenz": "30-167kHz (horizontal),  48-144Hz (vertikal)",
        "Stromversorgung": "DC-In (externes Netzteil)",
        "USB-Hub In": "1x USB-B 3.0",
        "USB-Hub Out": "2x USB-A 3.0",
        "USB-Schreibweise": "Link",
        "VESA": "100x100 (belegt)",
        "VRR (Variable Refresh Rate)": "Adaptive Sync,  AMD FreeSync Premium Pro (48-144Hz via DisplayPort,  48-120Hz via HDMI,  mit LFC-Support,  mit HDR)",
        "Weitere Anschl\u00fcsse": "N/A"
    },
    "raw_specifications_text": "Abmessungen (BxHxT): 1193x529x345mm (mit Standfu\u00df),  1193x370x345mm (ohne Standfu\u00df)\nAdaptive Sync: Ja\nAMD FreeSync Premium: Ja\nAnschl\u00fcsse - DisplayPort 1.2: 1\nAnschl\u00fcsse - HDMI 2.0: 2\nAnwendung: station\u00e4r\nAudio: Lautsprecher (2x 5W),  1x Line-Out\nAufl\u00f6sung: 3840x1080\nBeschichtung: matt (non-glare)\nBesonderheiten: Slim Bezel,  mechanische Tasten mit Steuerkreuz,  Sicherheitsschloss (Kensington)\nBildwiederholfrequenz: 144Hz\nBlickwinkel: 178\u00b0/178\u00b0\nDiagonale: 49\"/124.5cm\nEnergieeffizienzklasse alt (A+++ bis G): C\nEnergieeffizienzklasse HDR (A bis G): G\nEnergieverbrauch HDR: 109kWh/1000h\nEnergieverbrauch SDR: 56kWh/1000h\nErgonomie: 120mm (h\u00f6henverstellbar),  N/A (Pivot),  \u00b116\u00b0 (drehbar),  +20\u00b0/-5\u00b0 (neigbar),  keine Angabe (Schr\u00e4glage)\nFarbe: schwarz\nFarbraum - DCI-P3: 90%\nFarbraum - sRGB: 125%\nFarbtiefe: 8bit (16.7 Mio. Farben)\nForm: gebogen (curved),  1800R/1.8m\nFRC: unbekannt\nGewicht: 13.30kg (mit Standfu\u00df),  9.70kg (ohne Standfu\u00df)\nHDR: VESA DisplayHDR 400\nHelligkeit: 450cd/m\u00b2\nHerstellergarantie: drei Jahre\nHintergrundbeleuchtung: White-LED,  flicker-free,  Blaulichtfilter\nJahresverbrauch alt (A+++ bis G): 138.70kWh\nKontrast - statisch: 3.000:1\nLautsprecher: Ja\nLeistungsaufnahme: keine Angabe (maximal),  47W (typisch),  95W (Energielabel alt A+++ bis G),  0.5W (Standby)\nPanel: VA (SVA)\nReaktionszeit - GtG: 4ms\nScreen-to-Body-Ratio: 91.5% (berechnet)\nSeitenverh\u00e4ltnis: 32:9\nSignalfrequenz: 30-167kHz (horizontal),  48-144Hz (vertikal)\nStromversorgung: DC-In (externes Netzteil)\nUSB-Hub In: 1x USB-B 3.0\nUSB-Hub Out: 2x USB-A 3.0\nUSB-Schreibweise: Link\nVESA: 100x100 (belegt)\nVRR (Variable Refresh Rate): Adaptive Sync,  AMD FreeSync Premium Pro (48-144Hz via DisplayPort,  48-120Hz via HDMI,  mit LFC-Support,  mit HDR)\nWeitere Anschl\u00fcsse: N/A",
    "reference_file": "offer_reference_2193.json",
    "shop_name": "e-tec.at"
}