{
    "html_file": "offer_2034_9.html",
    "name": "Eizo FlexScan EV2460 wei\u00df, 23.8\"",
    "offer_link": "https://www.alternate.at/EIZO/EV2460-WT-LED-Monitor/html/product/1611003?partner=AtGeizhalsat&campaign=Monitor/EIZO/1611003",
    "price": 306.0,
    "raw_specifications": {
        "": "Optional",
        "Abmessungen": "Breite: 53,8 cm x H\u00f6he: 47,36 cm x Tiefe/L\u00e4nge: 23,3 cm",
        "Anschl\u00fcsse": "1x DVI-D-Eingang, 1x HDMI-Eingang, (HDMI-Version: 1.4), 1x DisplayPort-Eingang, (DisplayPort-Version: 1.4), 1x VGA-Eingang, 1x 3,5-mm-Audio-Eingang, 1x 3,5-mm-Audio-Ausgang, 4x USB-A-3.2 Gen 1 (5 Gbit/s), 1x USB-B-3.2 (5 Gbit/s)",
        "Bild": "Glaretyp",
        "Bildschirmaufl\u00f6sung": "1.920 x 1.080 Pixel",
        "Bildschirmdiagonale": "60,47 cm (23,8 Zoll)",
        "EAN": "4995047055303",
        "Energieeffizienzklasse (SDR)": "B (A - G)",
        "Energieverbauch pro 1000 Stunden (SDR)": "9 kWh",
        "Ergonomie": "Typ",
        "Farbe": "wei\u00df",
        "Features": "Overdrive, Flimmerfreie LEDs",
        "Frequenz": "Vertikal",
        "Geeignet f\u00fcr": "Multimedia",
        "Gewicht": "5,9 kg",
        "Hersteller-Nr.": "EV2460-WT",
        "Lautsprecher": "2 Lautsprecher",
        "Leistungsaufnahme im Bereitschafts- und Aus-Zustand": "0,5 Watt",
        "Leistungsaufnahme im Ein-Zustand bei Standard-Dynamikumfang (SDR)": "9 Watt",
        "Nachhaltigkeit": "Umweltfreundliche Produktion (TCO)Effizienter Stromverbrauch (TCO)",
        "Standards": "Video",
        "Stromversorgung": "Stromverbrauch",
        "Typ": "LED-Monitor",
        "Wandhalterung": "VESA kompatibel (100 x 100 mm)",
        "Zubeh\u00f6r": "Vorhanden"
    },
    "raw_specifications_text": "Energieeffizienzklasse (SDR): B (A - G)\nEnergieverbauch pro 1000 Stunden (SDR): 9 kWh\nLeistungsaufnahme im Ein-Zustand bei Standard-Dynamikumfang (SDR): 9 Watt\nLeistungsaufnahme im Bereitschafts- und Aus-Zustand: 0,5 Watt\nBildschirmdiagonale: 60,47 cm (23,8 Zoll)\nBildschirmaufl\u00f6sung: 1.920 x 1.080 Pixel\nTyp: LED-Monitor\nFarbe: wei\u00df\nEAN: 4995047055303\nHersteller-Nr.: EV2460-WT\nGeeignet f\u00fcr: Multimedia\nBild: Glaretyp\n: Optional\nFrequenz: Vertikal\nAnschl\u00fcsse: 1x DVI-D-Eingang, 1x HDMI-Eingang, (HDMI-Version: 1.4), 1x DisplayPort-Eingang, (DisplayPort-Version: 1.4), 1x VGA-Eingang, 1x 3,5-mm-Audio-Eingang, 1x 3,5-mm-Audio-Ausgang, 4x USB-A-3.2 Gen 1 (5 Gbit/s), 1x USB-B-3.2 (5 Gbit/s)\nErgonomie: Typ\nStromversorgung: Stromverbrauch\nLautsprecher: 2 Lautsprecher\nStandards: Video\nWandhalterung: VESA kompatibel (100 x 100 mm)\nFeatures: Overdrive, Flimmerfreie LEDs\nZubeh\u00f6r: Vorhanden\nNachhaltigkeit: Umweltfreundliche Produktion (TCO)Effizienter Stromverbrauch (TCO)\nAbmessungen: Breite: 53,8 cm x H\u00f6he: 47,36 cm x Tiefe/L\u00e4nge: 23,3 cm\nGewicht: 5,9 kg",
    "reference_file": "offer_reference_2034.json",
    "shop_name": "Alternate.at"
}