{
    "html_file": "offer_1918_24.html",
    "name": "ASUS ProArt PA248QV, 24.1\"",
    "offer_link": "https://www.alternate.at/ASUS/ProArt-PA248QV-LED-Monitor/html/product/1633342?partner=AtGeizhalsat&campaign=Monitor/ASUS/1633342",
    "price": 243.9,
    "raw_specifications": {
        "": "Adaptive-Sync, Kensington-Schloss",
        "Abmessungen": "Breite: 53,3 cm x H\u00f6he: 50,5 cm x Tiefe/L\u00e4nge: 21,1 cm",
        "Anschl\u00fcsse": "1x HDMI-Eingang, (HDMI-Version: 1.4), 1x DisplayPort-Eingang, (DisplayPort-Version: 1.2), 1x VGA-Eingang, 1x 3,5-mm-Audio-Eingang, 1x Kopfh\u00f6rer-Ausgang, 4x USB-A-3.2 Gen 1 (5 Gbit/s)",
        "Bild": "Glaretyp",
        "Bildschirmaufl\u00f6sung": "1.920 x 1.200 Pixel",
        "Bildschirmdiagonale": "61 cm (24 Zoll)",
        "EAN": "4718017603393",
        "Energieeffizienzklasse (SDR)": "G (A - G)",
        "Energieverbauch pro 1000 Stunden (SDR)": "28 kWh",
        "Ergonomie": "Typ",
        "Farbe": "schwarz",
        "Features": "Delta E< 2, Flicker Free LED, Calman-zertifiziert",
        "Frequenz": "Vertikal",
        "Geeignet f\u00fcr": "Multimedia",
        "Gewicht": "6,1 kg",
        "Hersteller-Nr.": "90LM05K1-B01370",
        "Lautsprecher": "2 Lautsprecher",
        "Leistungsaufnahme im Bereitschafts- und Aus-Zustand": "0,5 Watt",
        "Leistungsaufnahme im Ein-Zustand bei Standard-Dynamikumfang (SDR)": "28,2 Watt",
        "Serie": "ProArt",
        "Standards": "Video",
        "Stromversorgung": "Netzschalter",
        "Typ": "LED-Monitor",
        "Wandhalterung": "VESA kompatibel (100 x 100 mm)",
        "Zubeh\u00f6r": "Vorhanden"
    },
    "raw_specifications_text": "Energieeffizienzklasse (SDR): G (A - G)\nEnergieverbauch pro 1000 Stunden (SDR): 28 kWh\nLeistungsaufnahme im Ein-Zustand bei Standard-Dynamikumfang (SDR): 28,2 Watt\nLeistungsaufnahme im Bereitschafts- und Aus-Zustand: 0,5 Watt\nBildschirmdiagonale: 61 cm (24 Zoll)\nBildschirmaufl\u00f6sung: 1.920 x 1.200 Pixel\nTyp: LED-Monitor\nFarbe: schwarz\nEAN: 4718017603393\nHersteller-Nr.: 90LM05K1-B01370\nSerie: ProArt\nGeeignet f\u00fcr: Multimedia\nBild: Glaretyp\n: Adaptive-Sync, Kensington-Schloss\nFrequenz: Vertikal\nAnschl\u00fcsse: 1x HDMI-Eingang, (HDMI-Version: 1.4), 1x DisplayPort-Eingang, (DisplayPort-Version: 1.2), 1x VGA-Eingang, 1x 3,5-mm-Audio-Eingang, 1x Kopfh\u00f6rer-Ausgang, 4x USB-A-3.2 Gen 1 (5 Gbit/s)\nErgonomie: Typ\nStromversorgung: Netzschalter\nLautsprecher: 2 Lautsprecher\nStandards: Video\nWandhalterung: VESA kompatibel (100 x 100 mm)\nFeatures: Delta E< 2, Flicker Free LED, Calman-zertifiziert\nZubeh\u00f6r: Vorhanden\nAbmessungen: Breite: 53,3 cm x H\u00f6he: 50,5 cm x Tiefe/L\u00e4nge: 21,1 cm\nGewicht: 6,1 kg",
    "reference_file": "offer_reference_1918.json",
    "shop_name": "Alternate.at"
}