{
    "html_file": "offer_2347_20.html",
    "name": "ASUS VZ249HE-W, 23.8\"",
    "offer_link": "https://www.future-x.at/asus-60-5-cm-238-vz249he-w-d-sub-hdmi-ips-white%2A-flachbildschirm-tft-lcd-60-5-cm-p-976630/?pv=2",
    "price": 190.09,
    "raw_specifications": {
        "3D": "Nein",
        "AMD FreeSync": "Nein",
        "Anzahl HDMI Anschl\u00fcsse": "1",
        "Anzahl VGA (D-Sub) Anschl\u00fcsse": "1",
        "Anzahl der Farben des Displays": "1,073 Milliarden Farben",
        "Anzeige": "LED",
        "Bildschirmaufl\u00f6sung": "1920 x 1080 Pixel",
        "Bildschirmdiagonale": "60,5 cm (23.8 Zoll)",
        "Bildschirmdiagonale (cm)": "60,5 cm",
        "Bildschirmtechnologie": "IPS",
        "Blickwinkel, horizontal": "178\u00b0",
        "Blickwinkel, vertikal": "178\u00b0",
        "Breite": "540 mm",
        "DVI Anschluss": "Nein",
        "Digital horizontale Frequenz": "30 - 80 kHz",
        "Digital vertikale Frequenz": "56 - 76 Hz",
        "Display-Oberfl\u00e4che": "Matt",
        "Eingebaute Lautsprecher": "Nein",
        "Energy Star-zertifiziert": "Ja",
        "Ger\u00e4tebreite (inkl. Fu\u00df)": "540 mm",
        "Ger\u00e4teh\u00f6he (inkl. Fu\u00df)": "391 mm",
        "Ger\u00e4tetiefe (inkl. Fu\u00df)": "211 mm",
        "Gewicht": "2,9 kg",
        "HD-Typ": "Full HD",
        "HDCP": "Ja",
        "Helligkeit": "250 cd/m\u00b2",
        "H\u00f6he": "323 mm",
        "Integrierte Kamera": "Nein",
        "Integrierter USB-Hub": "Nein",
        "Kabelsperre-Slot": "Kensington",
        "Kontrastverh\u00e4ltnis (dynamisch)": "80000000:1",
        "NVIDIA G-SYNC": "Nein",
        "Native Seitenverh\u00e4ltnis": "16:9",
        "Neigungsverstellung": "Ja",
        "Neigungswinkelbereich": "22 - -5\u00b0Zertifikate",
        "Paketgewicht": "4,4 kg",
        "Pixel Abstand": "0,2652 x 0,2652 mm",
        "Produktfarbe": "Wei\u00df",
        "Reaktionszeit": "5 ms",
        "Spiel-Modus": "Ja",
        "TV Tuner integriert": "Nein",
        "Thin Client installiert": "Nein",
        "Tiefe": "37 mm",
        "Zertifizierung": "Energy Star\u00ae, BSMI, CB, CCC, CE, CEL level 1, C-Tick, CU, EPEAT () by region , ErP, FCC, RoHS, UL/cUL, VCCI, WEEE, WHQL (Windows 10, Windows 8.1, Windows 7), TUV Flicker-free , TUV Low Blue Light"
    },
    "raw_specifications_text": "Bildschirmdiagonale: 60,5 cm (23.8 Zoll)\nHelligkeit: 250 cd/m\u00b2\nBildschirmaufl\u00f6sung: 1920 x 1080 Pixel\nReaktionszeit: 5 ms\nAnzeige: LED\nHD-Typ: Full HD\nBildschirmtechnologie: IPS\nBlickwinkel, horizontal: 178\u00b0\nBlickwinkel, vertikal: 178\u00b0\nAnzahl der Farben des Displays: 1,073 Milliarden Farben\nNative Seitenverh\u00e4ltnis: 16:9\n3D: Nein\nDisplay-Oberfl\u00e4che: Matt\nKontrastverh\u00e4ltnis (dynamisch): 80000000:1\nBildschirmdiagonale (cm): 60,5 cm\nPixel Abstand: 0,2652 x 0,2652 mm\nDigital horizontale Frequenz: 30 - 80 kHz\nDigital vertikale Frequenz: 56 - 76 Hz\nHDCP: Ja\nEingebaute Lautsprecher: Nein\nIntegrierte Kamera: Nein\nTV Tuner integriert: Nein\nProduktfarbe: Wei\u00df\nNVIDIA G-SYNC: Nein\nAMD FreeSync: Nein\nThin Client installiert: Nein\nIntegrierter USB-Hub: Nein\nAnzahl VGA (D-Sub) Anschl\u00fcsse: 1\nDVI Anschluss: Nein\nAnzahl HDMI Anschl\u00fcsse: 1\nKabelsperre-Slot: Kensington\nNeigungsverstellung: Ja\nNeigungswinkelbereich: 22 - -5\u00b0Zertifikate\nEnergy Star-zertifiziert: Ja\nZertifizierung: Energy Star\u00ae, BSMI, CB, CCC, CE, CEL level 1, C-Tick, CU, EPEAT () by region , ErP, FCC, RoHS, UL/cUL, VCCI, WEEE, WHQL (Windows 10, Windows 8.1, Windows 7), TUV Flicker-free , TUV Low Blue Light\nBreite: 540 mm\nTiefe: 37 mm\nH\u00f6he: 323 mm\nGewicht: 2,9 kg\nGer\u00e4tebreite (inkl. Fu\u00df): 540 mm\nGer\u00e4tetiefe (inkl. Fu\u00df): 211 mm\nGer\u00e4teh\u00f6he (inkl. Fu\u00df): 391 mm\nPaketgewicht: 4,4 kg\nSpiel-Modus: Ja",
    "reference_file": "offer_reference_2347.json",
    "shop_name": "Future-X.at"
}