{
    "html_file": "offer_1698_3.html",
    "name": "iiyama ProLite XUB2496HSU-B1, 23.8\"",
    "offer_link": "https://www.taufnaus.de/product/13186594",
    "price": 253.78,
    "raw_specifications": {
        "Abmessungen (Breite x Tiefe x H\u00f6he)": "53.9 cm x 25.6 cm x 38.75 cm",
        "Adaptive-Sync Technologie": "AMD FreeSync",
        "Ausgangsleistung/Kanal": "2 Watt",
        "Besonderheiten": "Flimmerfreie Technologie, Reduzierung des blauen Lichtanteils, Black Tuner",
        "Bildschirmtyp": "IPS",
        "Diagonalabmessung": "61 cm (24\")",
        "Display-Typ": "LED-hintergrundbeleuchteter LCD-Monitor / TFT-Aktivmatrix",
        "ENERGY STAR zertifiziert": "Ja",
        "Eingangsspannung": "Wechselstrom 120/230 V (50/60 Hz)",
        "Einstellungen der Anzeigeposition": "H\u00f6he, Pivot (Rotation), Neigung",
        "Energie Effizienzklasse": "Klasse E",
        "Energieverbrauch pro Jahr": "26 kWh",
        "Enthaltene Kabel": "1 x HDMI-Kabel \u00a6 1 x USB-Kabel",
        "Farbunterst\u00fctzung": "16,7 Millionen Farben",
        "Gewicht": "4.7 kg",
        "Helligkeit": "250 cd/m\u00b2",
        "Hintergrundbeleuchtungs-Technologie": "LED-Hintergrundbeleuchtung",
        "Horizontale Bildwiederholrate": "31 - 85 kHz",
        "Horizontaler Betrachtungswinkel": "+89 / -89",
        "H\u00f6heneinstellung": "130 mm",
        "Integrierte Peripherieger\u00e4te": "USB 2.0 Hub",
        "Kennzeichnung": "TUV GS, VCCI, RoHS, WEEE, PSE Mark, REACH, ERP, EAC",
        "Kontrast": "1000:1 / 80000000:1 (dynamisch)",
        "Leistungsaufnahme im Ein-Zustand": "17.5 W",
        "Leistungsmerkmale": "Slot f\u00fcr Sicherheitsschloss (Kabelschloss getrennt erh\u00e4ltlich)",
        "Native Aufl\u00f6sung": "Full HD (1080p) 1920 x 1080 bei 75 Hz",
        "Neigungswinkel": "18",
        "OSD-Sprachen": "Tschechisch, Englisch, Deutsch, Franz\u00f6sisch, Italienisch, Polnisch, Russisch, Spanisch, Holl\u00e4ndisch, Japanisch",
        "Pixelpitch": "0.275 mm",
        "Reaktionszeit": "1 ms",
        "Rotationswinkel": "90",
        "Schlosstyp zur Diebstahlsicherung": "Kensington Slot",
        "Schnittstellen": "HDMI \u00a6 DisplayPort \u00a6 USB 2.0 Upstream \u00a6 2 x USB 2.0 Downstream \u00a6 Kopfh\u00f6rer",
        "Seitenverh\u00e4ltnis": "16:9",
        "Sichtbare Bildfl\u00e4che": "60.5 cm (23.8\")",
        "Stromverbrauch (typisch)": "17 Watt",
        "Stromverbrauch SDR (eingeschaltet)": "17.5 kWh/1.000 h",
        "Stromverbrauch im Standby-Modus": "0.5 Watt",
        "Transportbreite": "66.9 cm",
        "Transportgewicht": "6.5 kg",
        "Transporth\u00f6he": "47.5 cm",
        "Transporttiefe": "21.2 cm",
        "Typ": "Lautsprecher - Stereo",
        "VESA-Halterung": "100 x 100 mm",
        "Vertikale Bildwiederholrate": "48 - 75 Hz",
        "Vertikaler Betrachtungswinkel": "+89 / -89"
    },
    "raw_specifications_text": "Display-Typ: LED-hintergrundbeleuchteter LCD-Monitor / TFT-Aktivmatrix\nEnergie Effizienzklasse: Klasse E\nEnergieverbrauch pro Jahr: 26 kWh\nDiagonalabmessung: 61 cm (24\")\nSichtbare Bildfl\u00e4che: 60.5 cm (23.8\")\nAdaptive-Sync Technologie: AMD FreeSync\nIntegrierte Peripherieger\u00e4te: USB 2.0 Hub\nBildschirmtyp: IPS\nSeitenverh\u00e4ltnis: 16:9\nNative Aufl\u00f6sung: Full HD (1080p) 1920 x 1080 bei 75 Hz\nPixelpitch: 0.275 mm\nHelligkeit: 250 cd/m\u00b2\nKontrast: 1000:1 / 80000000:1 (dynamisch)\nFarbunterst\u00fctzung: 16,7 Millionen Farben\nReaktionszeit: 1 ms\nVertikale Bildwiederholrate: 48 - 75 Hz\nHorizontale Bildwiederholrate: 31 - 85 kHz\nHorizontaler Betrachtungswinkel: +89 / -89\nVertikaler Betrachtungswinkel: +89 / -89\nHintergrundbeleuchtungs-Technologie: LED-Hintergrundbeleuchtung\nOSD-Sprachen: Tschechisch, Englisch, Deutsch, Franz\u00f6sisch, Italienisch, Polnisch, Russisch, Spanisch, Holl\u00e4ndisch, Japanisch\nBesonderheiten: Flimmerfreie Technologie, Reduzierung des blauen Lichtanteils, Black Tuner\nAbmessungen (Breite x Tiefe x H\u00f6he): 53.9 cm x 25.6 cm x 38.75 cm\nGewicht: 4.7 kg\nTyp: Lautsprecher - Stereo\nAusgangsleistung/Kanal: 2 Watt\nSchnittstellen: HDMI \u00a6 DisplayPort \u00a6 USB 2.0 Upstream \u00a6 2 x USB 2.0 Downstream \u00a6 Kopfh\u00f6rer\nEinstellungen der Anzeigeposition: H\u00f6he, Pivot (Rotation), Neigung\nNeigungswinkel: 18\nRotationswinkel: 90\nH\u00f6heneinstellung: 130 mm\nVESA-Halterung: 100 x 100 mm\nLeistungsmerkmale: Slot f\u00fcr Sicherheitsschloss (Kabelschloss getrennt erh\u00e4ltlich)\nEnthaltene Kabel: 1 x HDMI-Kabel \u00a6 1 x USB-Kabel\nKennzeichnung: TUV GS, VCCI, RoHS, WEEE, PSE Mark, REACH, ERP, EAC\nSchlosstyp zur Diebstahlsicherung: Kensington Slot\nEingangsspannung: Wechselstrom 120/230 V (50/60 Hz)\nLeistungsaufnahme im Ein-Zustand: 17.5 W\nStromverbrauch SDR (eingeschaltet): 17.5 kWh/1.000 h\nStromverbrauch (typisch): 17 Watt\nStromverbrauch im Standby-Modus: 0.5 Watt\nTransportbreite: 66.9 cm\nTransporttiefe: 21.2 cm\nTransporth\u00f6he: 47.5 cm\nTransportgewicht: 6.5 kg\nENERGY STAR zertifiziert: Ja",
    "reference_file": "offer_reference_1698.json",
    "shop_name": "TaufNaus"
}