{
    "html_file": "offer_1743_8.html",
    "name": "ASUS VA229QSB, 21.5\"",
    "offer_link": "https://direkt.jacob.de/produkte/asus-54-6cm-commerc-va229qsb-90lm06c3-b01370-artnr-6945657.html?utm_source=geizhals&utm_medium=cpc&utm_campaign=Preisvergleich&ref=103",
    "price": 159.96,
    "raw_specifications": {
        "AC Eingangsspannung": "100 - 240 V",
        "AMD FreeSync": "Nein",
        "Anzahl DisplayPort Anschl\u00fcsse": "1",
        "Anzahl HDMI-Anschl\u00fcsse": "1",
        "Anzahl VGA (D-Sub) Anschl\u00fcsse": "1",
        "Anzahl der Farben des Displays": "16,7 Millionen Farben",
        "Anzahl der Lautsprecher": "2",
        "Anzahl der nachgeschalteten Steckpl\u00e4tze vom Typ USB-A": "2",
        "Bildschirmaufl\u00f6sung": "1920 x 1080 Pixel",
        "Bildschirmdiagonale": "54,6 cm (21.5\" )",
        "Bildschirmform": "Flach",
        "Bildschirmtechnologie": "LED",
        "Blendfreier Bildschirm": "Ja",
        "Blickwinkel, horizontal": "178\u00b0",
        "Blickwinkel, vertikal": "178\u00b0",
        "Breite (ohne Standfu\u00df)": "49 cm",
        "DisplayPorts-Version": "1.2",
        "Dynamisches Kontrastverh\u00e4ltnis Marketingbezeichnung": "SmartContrast",
        "Eingebaute Lautsprecher": "Ja",
        "Energie Effizienzklasse": "F",
        "Energieverbrauch (SDR) pro 1.000 Stunden": "12 kWh",
        "Flimmerfreie Technologie": "Ja",
        "Fu\u00dffarbe": "Schwarz",
        "Ger\u00e4tebreite (inkl. Fu\u00df)": "490 mm",
        "Ger\u00e4teh\u00f6he (inkl. Fu\u00df)": "293 mm",
        "Ger\u00e4tetiefe (inkl. Fu\u00df)": "211 mm",
        "Gewicht (mit St\u00e4nder)": "4,6 kg",
        "Gewicht (ohne St\u00e4nder)": "2,6 kg",
        "HD-Typ": "Full HD",
        "HDCP": "Ja",
        "HDMI": "Ja",
        "HDMI-Version": "1.4",
        "Helligkeit (typisch)": "250 cd/m\u00b2",
        "Horizontaler Scanbereich": "30 - 85 kHz",
        "H\u00f6he (ohne Standfu\u00df)": "29,8 cm",
        "H\u00f6heneinstellung": "13 cm",
        "H\u00f6henverstellung": "Ja",
        "Integrierte Kamera": "Nein",
        "Integrierter USB-Hub": "Ja",
        "Kabelsperre-Slot": "Ja",
        "Kontrastverh\u00e4ltnis": "1000:1",
        "Kontrastverh\u00e4ltnis (dynamisch)": "100000000:1",
        "Kopfh\u00f6rer-Konnektivit\u00e4t": "3,5 mm",
        "Kopfh\u00f6rerausgang": "Ja",
        "Kopfh\u00f6rerausg\u00e4nge": "1",
        "Low-Blue-Light-Technologie": "Ja",
        "Marktpositionierung": "Haus",
        "Maximale Bildwiederholrate": "75 Hz",
        "Mitgelieferte Kabel": "AC, Audio (3,5 mm), USB",
        "NVIDIA G-SYNC": "Nein",
        "Natives Seitenverh\u00e4ltnis": "16:9",
        "Neigungswinkelbereich": "5 - 35\u00b0",
        "Paketgewicht": "6,3 kg",
        "Panel-Montage-Schnittstelle": "100 x 100 mm",
        "Panel-Typ": "IPS",
        "Pivot": "Ja",
        "Pivot Winkel": "90 - 90\u00b0",
        "Pixel Abstand": "0,248 x 0,248 mm",
        "Produktfarbe": "Schwarz",
        "RMS-Leistung": "4 W",
        "Reaktionszeit": "5 ms",
        "Slot-Typ Kabelsperre": "Kensington",
        "Stromeingang": "Ja",
        "Stromverbrauch (Standardbetrieb)": "12 W",
        "Stromverbrauch (Standby)": "0,5 W",
        "Stromverbrauch (aus)": "0,3 W",
        "St\u00e4nder enthalten": "Ja",
        "Tiefe (ohne Standfu\u00df)": "5,3 cm",
        "VESA-Halterung": "Ja",
        "Verpackungsbreite": "590 mm",
        "Verpackungsh\u00f6he": "372 mm",
        "Verpackungstiefe": "210 mm",
        "Vertikaler Scanbereich": "48 - 75 Hz",
        "kippbar": "Ja"
    },
    "raw_specifications_text": "Bildschirmdiagonale: 54,6 cm (21.5\" )\nBildschirmaufl\u00f6sung: 1920 x 1080 Pixel\nNatives Seitenverh\u00e4ltnis: 16:9\nPanel-Typ: IPS\nHD-Typ: Full HD\nBildschirmtechnologie: LED\nBildschirmform: Flach\nKontrastverh\u00e4ltnis: 1000:1\nMaximale Bildwiederholrate: 75 Hz\nAnzahl der Farben des Displays: 16,7 Millionen Farben\nHelligkeit (typisch): 250 cd/m\u00b2\nReaktionszeit: 5 ms\nBlendfreier Bildschirm: Ja\nKontrastverh\u00e4ltnis (dynamisch): 100000000:1\nDynamisches Kontrastverh\u00e4ltnis Marketingbezeichnung: SmartContrast\nBlickwinkel, horizontal: 178\u00b0\nBlickwinkel, vertikal: 178\u00b0\nPixel Abstand: 0,248 x 0,248 mm\nHorizontaler Scanbereich: 30 - 85 kHz\nVertikaler Scanbereich: 48 - 75 Hz\nNVIDIA G-SYNC: Nein\nAMD FreeSync: Nein\nFlimmerfreie Technologie: Ja\nLow-Blue-Light-Technologie: Ja\nEingebaute Lautsprecher: Ja\nIntegrierte Kamera: Nein\nAnzahl der Lautsprecher: 2\nRMS-Leistung: 4 W\nMarktpositionierung: Haus\nProduktfarbe: Schwarz\nFu\u00dffarbe: Schwarz\nIntegrierter USB-Hub: Ja\nHDMI: Ja\nKopfh\u00f6rerausgang: Ja\nAnzahl der nachgeschalteten Steckpl\u00e4tze vom Typ USB-A: 2\nAnzahl VGA (D-Sub) Anschl\u00fcsse: 1\nAnzahl HDMI-Anschl\u00fcsse: 1\nHDMI-Version: 1.4\nAnzahl DisplayPort Anschl\u00fcsse: 1\nDisplayPorts-Version: 1.2\nKopfh\u00f6rerausg\u00e4nge: 1\nKopfh\u00f6rer-Konnektivit\u00e4t: 3,5 mm\nHDCP: Ja\nStromeingang: Ja\nVESA-Halterung: Ja\nKabelsperre-Slot: Ja\nH\u00f6henverstellung: Ja\nPanel-Montage-Schnittstelle: 100 x 100 mm\nSlot-Typ Kabelsperre: Kensington\nH\u00f6heneinstellung: 13 cm\nPivot: Ja\nPivot Winkel: 90 - 90\u00b0\nkippbar: Ja\nNeigungswinkelbereich: 5 - 35\u00b0\nEnergie Effizienzklasse: F\nEnergieverbrauch (SDR) pro 1.000 Stunden: 12 kWh\nStromverbrauch (Standardbetrieb): 12 W\nStromverbrauch (Standby): 0,5 W\nStromverbrauch (aus): 0,3 W\nAC Eingangsspannung: 100 - 240 V\nGer\u00e4tebreite (inkl. Fu\u00df): 490 mm\nGer\u00e4tetiefe (inkl. Fu\u00df): 211 mm\nGer\u00e4teh\u00f6he (inkl. Fu\u00df): 293 mm\nGewicht (mit St\u00e4nder): 4,6 kg\nBreite (ohne Standfu\u00df): 49 cm\nTiefe (ohne Standfu\u00df): 5,3 cm\nH\u00f6he (ohne Standfu\u00df): 29,8 cm\nGewicht (ohne St\u00e4nder): 2,6 kg\nSt\u00e4nder enthalten: Ja\nMitgelieferte Kabel: AC, Audio (3,5 mm), USB\nVerpackungsbreite: 590 mm\nVerpackungstiefe: 210 mm\nVerpackungsh\u00f6he: 372 mm\nPaketgewicht: 6,3 kg",
    "reference_file": "offer_reference_1743.json",
    "shop_name": "Jacob Elektronik direkt (AT)"
}