{
    "html_file": "offer_1934_11.html",
    "name": "Acer Nitro VG0 VG270Sbmiipx, 27\"",
    "offer_link": "https://www.proshop.at/Bildschirm/Acer-27-Bildschirm-Nitro-VG270-1920x1080-165Hz-IPS-Black-2-ms-AMD-FreeSync/2880962?utm_source=geizhals&utm_medium=cpc&utm_campaign=pricesite",
    "price": 208.31,
    "raw_specifications": {
        "Adaptive-Sync Technologie": "AMD FreeSync",
        "Ausgangsleistung/Kanal": "2 Watt",
        "Besonderheiten": "Acer Adaptive Contrast Management (ACM), HDR Ready-Technologie",
        "Bildschirmbeschichtung": "Blendfrei",
        "Bildschirmtyp": "IPS",
        "Diagonalabmessung": "69 cm (27\")",
        "Display-Typ": "LED-hintergrundbeleuchteter LCD-Monitor / TFT-Aktivmatrix",
        "EAN": "4710180695250",
        "Eingangsanschl\u00fcsse": "2xHDMI, DisplayPort",
        "Einstellungen der Anzeigeposition": "Neigung",
        "Energie Effizienzklasse": "Klasse F",
        "Energieklasse (HDR)": "Klasse G",
        "Energieverbrauch pro Jahr": "36 kWh",
        "Enthaltene Kabel": "1 x DisplayPort-Kabel",
        "Farbe": "Schwarz",
        "Farbunterst\u00fctzung": "16,7 Millionen Farben",
        "Ger\u00e4tetyp": "LED-hintergrundbeleuchteter LCD-Monitor - 69 cm (27\")",
        "Helligkeit": "250 cd/m\u00b2",
        "Hersteller": "Acer",
        "Hintergrundbeleuchtungs-Technologie": "LED-Hintergrundbeleuchtung",
        "Horizontaler Betrachtungswinkel": "178",
        "Kennzeichnung": "MPR II",
        "Kontrast": "100000000:1 (dynamisch)",
        "Leistungsaufnahme im Ein-Zustand": "26 W",
        "Leistungsmerkmale": "Unterst\u00fctzung f\u00fcr VESA-Schnittstelle",
        "Modell": "UM.HV0EE.S01",
        "Native Aufl\u00f6sung": "Full HD (1080p) 1920 x 1080 (DisplayPort(OC): 165 Hz, HDMI(OC): 165 Hz)",
        "Neigungswinkel": "-5/+20",
        "Produktbeschreibung": "Acer Nitro VG270 Sbmiipx - LED-Monitor - Full HD (1080p) - 69 cm (27\")",
        "Reaktionszeit": "2 ms",
        "Schnittstellen": "2 x HDMI  DisplayPort  Audio Line-Out",
        "Seitenverh\u00e4ltnis": "16:9",
        "Spannung": "Wechselstrom 120/230 V (50/60 Hz)",
        "Typ": "Lautsprecher - Stereo",
        "VESA-Halterung": "100 x 100 mm",
        "Vertikaler Betrachtungswinkel": "178",
        "Waren-Nr.": "2880962",
        "Zum Hersteller": "www.acer.com"
    },
    "raw_specifications_text": "Hersteller: Acer\nWaren-Nr.: 2880962\nModell: UM.HV0EE.S01\nEAN: 4710180695250\nZum Hersteller: www.acer.com\nProduktbeschreibung: Acer Nitro VG270 Sbmiipx - LED-Monitor - Full HD (1080p) - 69 cm (27\")\nGer\u00e4tetyp: LED-hintergrundbeleuchteter LCD-Monitor - 69 cm (27\")\nEnergie Effizienzklasse: Klasse F\nEnergieverbrauch pro Jahr: 36 kWh\nLeistungsaufnahme im Ein-Zustand: 26 W\nAdaptive-Sync Technologie: AMD FreeSync\nBildschirmtyp: IPS\nSeitenverh\u00e4ltnis: 16:9\nNative Aufl\u00f6sung: Full HD (1080p) 1920 x 1080 (DisplayPort(OC): 165 Hz, HDMI(OC): 165 Hz)\nHelligkeit: 250 cd/m\u00b2\nKontrast: 100000000:1 (dynamisch)\nReaktionszeit: 2 ms\nFarbunterst\u00fctzung: 16,7 Millionen Farben\nEingangsanschl\u00fcsse: 2xHDMI, DisplayPort\nEinstellungen der Anzeigeposition: Neigung\nBildschirmbeschichtung: Blendfrei\nSpannung: Wechselstrom 120/230 V (50/60 Hz)\nFarbe: Schwarz\nKennzeichnung: MPR II\nDisplay-Typ: LED-hintergrundbeleuchteter LCD-Monitor / TFT-Aktivmatrix\nEnergieklasse (HDR): Klasse G\nDiagonalabmessung: 69 cm (27\")\nHorizontaler Betrachtungswinkel: 178\nVertikaler Betrachtungswinkel: 178\nHintergrundbeleuchtungs-Technologie: LED-Hintergrundbeleuchtung\nBesonderheiten: Acer Adaptive Contrast Management (ACM), HDR Ready-Technologie\nTyp: Lautsprecher - Stereo\nAusgangsleistung/Kanal: 2 Watt\nSchnittstellen: 2 x HDMI  DisplayPort  Audio Line-Out\nNeigungswinkel: -5/+20\nVESA-Halterung: 100 x 100 mm\nLeistungsmerkmale: Unterst\u00fctzung f\u00fcr VESA-Schnittstelle\nEnthaltene Kabel: 1 x DisplayPort-Kabel",
    "reference_file": "offer_reference_1934.json",
    "shop_name": "Proshop.at"
}