{
    "html_file": "offer_2048_24.html",
    "name": "AOC Q27G2U/BK, 27\"",
    "offer_link": "https://www.alternate.at/AOC/Q27G2U-BK-Gaming-Monitor/html/product/1600672?partner=AtGeizhalsat&campaign=Monitor/AOC/1600672",
    "price": 245.9,
    "raw_specifications": {
        "": "AMD FreeSync",
        "Abmessungen": "Breite: 61,25 cm x H\u00f6he: 52,86 cm x Tiefe/L\u00e4nge: 22,74 cm",
        "Anschl\u00fcsse": "2x HDMI-Eingang, (HDMI-Version: 1.4), 1x DisplayPort-Eingang, (DisplayPort-Version: 1.2), 1x 3,5-mm-Audio-Eingang, 1x 3,5-mm-Audio-Ausgang, 4x USB-A-3.2 Gen 1 (5 Gbit/s)",
        "Bild": "Format",
        "Bildschirmaufl\u00f6sung": "2.560 x 1.440 Pixel",
        "Bildschirmdiagonale": "69 cm (27 Zoll)",
        "EAN": "4038986187121",
        "Energieeffizienzklasse (SDR)": "G (A - G)",
        "Energieverbauch pro 1000 Stunden (SDR)": "34 kWh",
        "Ergonomie": "Typ",
        "Farbe": "schwarz",
        "Features": "Flicker-Free LED",
        "Frequenz": "Vertikal",
        "Geeignet f\u00fcr": "Gaming",
        "Gewicht": "5,2 kg",
        "Hersteller-Nr.": "Q27G2U/BK",
        "Leistungsaufnahme im Bereitschafts- und Aus-Zustand": "0,5 Watt",
        "Leistungsaufnahme im Ein-Zustand bei Standard-Dynamikumfang (SDR)": "34,1 Watt",
        "Standards": "Video",
        "Stromversorgung": "Eco-Off",
        "Typ": "Gaming-Monitor",
        "Wandhalterung": "VESA kompatibel (100 x 100 mm)",
        "Zubeh\u00f6r": "Vorhanden"
    },
    "raw_specifications_text": "Energieeffizienzklasse (SDR): G (A - G)\nEnergieverbauch pro 1000 Stunden (SDR): 34 kWh\nLeistungsaufnahme im Ein-Zustand bei Standard-Dynamikumfang (SDR): 34,1 Watt\nLeistungsaufnahme im Bereitschafts- und Aus-Zustand: 0,5 Watt\nBildschirmdiagonale: 69 cm (27 Zoll)\nBildschirmaufl\u00f6sung: 2.560 x 1.440 Pixel\nTyp: Gaming-Monitor\nFarbe: schwarz\nEAN: 4038986187121\nHersteller-Nr.: Q27G2U/BK\nGeeignet f\u00fcr: Gaming\nBild: Format\n: AMD FreeSync\nFrequenz: Vertikal\nAnschl\u00fcsse: 2x HDMI-Eingang, (HDMI-Version: 1.4), 1x DisplayPort-Eingang, (DisplayPort-Version: 1.2), 1x 3,5-mm-Audio-Eingang, 1x 3,5-mm-Audio-Ausgang, 4x USB-A-3.2 Gen 1 (5 Gbit/s)\nErgonomie: Typ\nStromversorgung: Eco-Off\nStandards: Video\nWandhalterung: VESA kompatibel (100 x 100 mm)\nFeatures: Flicker-Free LED\nZubeh\u00f6r: Vorhanden\nAbmessungen: Breite: 61,25 cm x H\u00f6he: 52,86 cm x Tiefe/L\u00e4nge: 22,74 cm\nGewicht: 5,2 kg",
    "reference_file": "offer_reference_2048.json",
    "shop_name": "Alternate.at"
}