{
    "html_file": "offer_1564_3.html",
    "name": "Acer Nitro XV2 XV272Sbmiiprx, 27\"",
    "offer_link": "https://www.ditech.at/details.php?artnr=359983",
    "price": 259.95,
    "raw_specifications": {
        "AMD FreeSync Premium": "Ja",
        "Adaptive Sync": "Ja",
        "Anschl\u00fcsse - DisplayPort 1.2": "1",
        "Anschl\u00fcsse - HDMI 2.0": "2",
        "Anwendung": "station\u00e4r",
        "Audio": "Lautsprecher (2x 2W),  1x Line-Out",
        "Aufl\u00f6sung": "1920x1080",
        "Beschichtung": "matt (non-glare)",
        "Besonderheiten": "Slim Bezel,  mechanische Tasten mit Steuerkreuz,  Sicherheitsschloss (Kensington)",
        "Bildwiederholfrequenz": "165Hz",
        "Blickwinkel": "178\u00b0/178\u00b0",
        "Diagonale": "27\"/68.6cm",
        "Energieeffizienzklasse HDR (A bis G)": "G",
        "Energieverbrauch HDR": "49kWh/1000h",
        "Energieverbrauch SDR": "26kWh/1000h",
        "Ergonomie": "120mm (h\u00f6henverstellbar),  \u00b190\u00b0 (Pivot),  \u00b1180\u00b0 (drehbar),  +25\u00b0/-5\u00b0 (neigbar),  keine Angabe (Schr\u00e4glage)",
        "FRC": "unbekannt",
        "Farbe": "schwarz",
        "Farbraum - sRGB": "99%",
        "Farbtiefe": "8bit (16.7 Mio. Farben)",
        "Form": "gerade (flat)",
        "Gewicht": "6.40kg (mit Standfu\u00df),  keine Angabe (ohne Standfu\u00df)",
        "HDR": "VESA DisplayHDR 400",
        "Helligkeit": "350cd/m\u00b2",
        "Herstellergarantie": "zwei Jahre (Bring-In)",
        "Hintergrundbeleuchtung": "Blue-LED,  flicker-free,  Blaulichtfilter",
        "Kontrast - dynamisch": "100.000.000:1",
        "Kontrast - statisch": "1.000:1",
        "Lautsprecher": "Ja",
        "Leistungsaufnahme": "keine Angabe (maximal),  keine Angabe (typisch),  keine Angabe (Energielabel alt A+++ bis G),  0.35W (Standby)",
        "Panel": "IPS,  Quantum-Dot",
        "Reaktionszeit - GtG": "2ms",
        "Reaktionszeit - MPRT": "0.5ms",
        "Screen-to-Body-Ratio": "89.2% (berechnet)",
        "Seitenverh\u00e4ltnis": "16:9",
        "Signalfrequenz": "185-185kHz (horizontal),  48-165Hz (vertikal)",
        "Stromversorgung": "AC-In (internes Netzteil)",
        "USB-Hub In": "N/A",
        "USB-Hub Out": "N/A",
        "USB-Schreibweise": "Link",
        "Unsch\u00e4rfereduktionsfunktion": "Acer Visual Response Boost (VRB)",
        "VESA": "100x100 (belegt)",
        "Weitere Anschl\u00fcsse": "N/A"
    },
    "raw_specifications_text": "Adaptive Sync: Ja\nAMD FreeSync Premium: Ja\nAnschl\u00fcsse - DisplayPort 1.2: 1\nAnschl\u00fcsse - HDMI 2.0: 2\nAnwendung: station\u00e4r\nAudio: Lautsprecher (2x 2W),  1x Line-Out\nAufl\u00f6sung: 1920x1080\nBeschichtung: matt (non-glare)\nBesonderheiten: Slim Bezel,  mechanische Tasten mit Steuerkreuz,  Sicherheitsschloss (Kensington)\nBildwiederholfrequenz: 165Hz\nBlickwinkel: 178\u00b0/178\u00b0\nDiagonale: 27\"/68.6cm\nEnergieeffizienzklasse HDR (A bis G): G\nEnergieverbrauch HDR: 49kWh/1000h\nEnergieverbrauch SDR: 26kWh/1000h\nErgonomie: 120mm (h\u00f6henverstellbar),  \u00b190\u00b0 (Pivot),  \u00b1180\u00b0 (drehbar),  +25\u00b0/-5\u00b0 (neigbar),  keine Angabe (Schr\u00e4glage)\nFarbe: schwarz\nFarbraum - sRGB: 99%\nFarbtiefe: 8bit (16.7 Mio. Farben)\nForm: gerade (flat)\nFRC: unbekannt\nGewicht: 6.40kg (mit Standfu\u00df),  keine Angabe (ohne Standfu\u00df)\nHDR: VESA DisplayHDR 400\nHelligkeit: 350cd/m\u00b2\nHerstellergarantie: zwei Jahre (Bring-In)\nHintergrundbeleuchtung: Blue-LED,  flicker-free,  Blaulichtfilter\nKontrast - dynamisch: 100.000.000:1\nKontrast - statisch: 1.000:1\nLautsprecher: Ja\nLeistungsaufnahme: keine Angabe (maximal),  keine Angabe (typisch),  keine Angabe (Energielabel alt A+++ bis G),  0.35W (Standby)\nPanel: IPS,  Quantum-Dot\nReaktionszeit - GtG: 2ms\nReaktionszeit - MPRT: 0.5ms\nScreen-to-Body-Ratio: 89.2% (berechnet)\nSeitenverh\u00e4ltnis: 16:9\nSignalfrequenz: 185-185kHz (horizontal),  48-165Hz (vertikal)\nStromversorgung: AC-In (internes Netzteil)\nUnsch\u00e4rfereduktionsfunktion: Acer Visual Response Boost (VRB)\nUSB-Hub In: N/A\nUSB-Hub Out: N/A\nUSB-Schreibweise: Link\nVESA: 100x100 (belegt)\nWeitere Anschl\u00fcsse: N/A",
    "reference_file": "offer_reference_1564.json",
    "shop_name": "DiTech.at"
}