{
    "html_file": "offer_1765_19.html",
    "name": "AOC U32E2N, 31.5\"",
    "offer_link": "https://www.ditech.at/details.php?artnr=309372",
    "price": 362.9,
    "raw_specifications": {
        "Abmessungen (BxHxT)": "714.82x522.81x253.81mm (mit Standfu\u00df),  714.82x425.24x55.71mm (ohne Standfu\u00df)",
        "Adaptive Sync": "Ja",
        "Anschl\u00fcsse - DisplayPort 1.2": "1",
        "Anschl\u00fcsse - HDMI 2.0": "2",
        "Anwendung": "station\u00e4r",
        "Audio": "Lautsprecher (2x 3W),  1x Line-Out",
        "Aufl\u00f6sung": "3840x2160",
        "Beschichtung": "matt (non-glare),  H\u00e4rtegrad 3H",
        "Besonderheiten": "mechanische Tasten,  Picture-in-Picture,  Sicherheitsschloss (Kensington)",
        "Bildwiederholfrequenz": "60Hz",
        "Blickwinkel": "178\u00b0/178\u00b0",
        "Diagonale": "31.5\"/80cm",
        "Energieeffizienzklasse alt (A+++ bis D)": "B",
        "Energieeffizienzklasse alt (A+++ bis G)": "B",
        "Energieverbrauch SDR": "40kWh/1000h",
        "Ergonomie": "N/A (h\u00f6henverstellbar),  N/A (Pivot),  N/A (drehbar),  +23.5\u00b0/-6\u00b0 (neigbar),  keine Angabe (Schr\u00e4glage)",
        "FRC": "unbekannt",
        "Farbe": "schwarz",
        "Farbraum - Adobe RGB": "77%",
        "Farbraum - sRGB": "104%",
        "Farbtiefe": "8bit (16.7 Mio. Farben)",
        "Form": "gerade (flat)",
        "Gewicht": "8.34kg (mit Standfu\u00df),  keine Angabe (ohne Standfu\u00df)",
        "HDR": "N/A",
        "Helligkeit": "350cd/m\u00b2",
        "Herstellergarantie": "drei Jahre",
        "Hintergrundbeleuchtung": "White-LED,  flicker-free,  Blaulichtfilter",
        "Jahresverbrauch alt (A+++ bis D)": "80.30kWh",
        "Jahresverbrauch alt (A+++ bis G)": "80.30kWh",
        "Kontrast - dynamisch": "20.000.000:1",
        "Kontrast - statisch": "2.500:1",
        "Lautsprecher": "Ja",
        "Leistungsaufnahme": "68W (maximal),  44W (typisch),  55W (Energielabel alt A+++ bis G),  0.3W (Standby)",
        "Panel": "VA (MVA)",
        "Reaktionszeit - GtG": "4ms",
        "Screen-to-Body-Ratio": "90.0% (berechnet)",
        "Seitenverh\u00e4ltnis": "16:9",
        "Signalfrequenz": "30-140kHz (horizontal),  40-60Hz (vertikal)",
        "Stromversorgung": "AC-In (internes Netzteil)",
        "USB-Hub In": "N/A",
        "USB-Hub Out": "N/A",
        "USB-Schreibweise": "Link",
        "VESA": "100x100 (frei)",
        "VRR (Variable Refresh Rate)": "Adaptive Sync",
        "Weitere Anschl\u00fcsse": "N/A"
    },
    "raw_specifications_text": "Abmessungen (BxHxT): 714.82x522.81x253.81mm (mit Standfu\u00df),  714.82x425.24x55.71mm (ohne Standfu\u00df)\nAdaptive Sync: Ja\nAnschl\u00fcsse - DisplayPort 1.2: 1\nAnschl\u00fcsse - HDMI 2.0: 2\nAnwendung: station\u00e4r\nAudio: Lautsprecher (2x 3W),  1x Line-Out\nAufl\u00f6sung: 3840x2160\nBeschichtung: matt (non-glare),  H\u00e4rtegrad 3H\nBesonderheiten: mechanische Tasten,  Picture-in-Picture,  Sicherheitsschloss (Kensington)\nBildwiederholfrequenz: 60Hz\nBlickwinkel: 178\u00b0/178\u00b0\nDiagonale: 31.5\"/80cm\nEnergieeffizienzklasse alt (A+++ bis D): B\nEnergieeffizienzklasse alt (A+++ bis G): B\nEnergieverbrauch SDR: 40kWh/1000h\nErgonomie: N/A (h\u00f6henverstellbar),  N/A (Pivot),  N/A (drehbar),  +23.5\u00b0/-6\u00b0 (neigbar),  keine Angabe (Schr\u00e4glage)\nFarbe: schwarz\nFarbraum - Adobe RGB: 77%\nFarbraum - sRGB: 104%\nFarbtiefe: 8bit (16.7 Mio. Farben)\nForm: gerade (flat)\nFRC: unbekannt\nGewicht: 8.34kg (mit Standfu\u00df),  keine Angabe (ohne Standfu\u00df)\nHDR: N/A\nHelligkeit: 350cd/m\u00b2\nHerstellergarantie: drei Jahre\nHintergrundbeleuchtung: White-LED,  flicker-free,  Blaulichtfilter\nJahresverbrauch alt (A+++ bis D): 80.30kWh\nJahresverbrauch alt (A+++ bis G): 80.30kWh\nKontrast - dynamisch: 20.000.000:1\nKontrast - statisch: 2.500:1\nLautsprecher: Ja\nLeistungsaufnahme: 68W (maximal),  44W (typisch),  55W (Energielabel alt A+++ bis G),  0.3W (Standby)\nPanel: VA (MVA)\nReaktionszeit - GtG: 4ms\nScreen-to-Body-Ratio: 90.0% (berechnet)\nSeitenverh\u00e4ltnis: 16:9\nSignalfrequenz: 30-140kHz (horizontal),  40-60Hz (vertikal)\nStromversorgung: AC-In (internes Netzteil)\nUSB-Hub In: N/A\nUSB-Hub Out: N/A\nUSB-Schreibweise: Link\nVESA: 100x100 (frei)\nVRR (Variable Refresh Rate): Adaptive Sync\nWeitere Anschl\u00fcsse: N/A",
    "reference_file": "offer_reference_1765.json",
    "shop_name": "DiTech.at"
}