{
    "html_file": "offer_381_41.html",
    "name": "LG UltraGear 27GP850P-B, 27\"",
    "offer_link": "https://www.mylemon.at/artikel/lg/27gp850p_b/monitor-lcd-27-ips-27gp850p.html",
    "price": 402.91,
    "raw_specifications": {
        "AC Eingangsfrequenz": "50 - 60 Hz",
        "AC Eingangsspannung": "100 - 240 V",
        "AMD FreeSync": "Ja",
        "AMD FreeSync-Typ": "FreeSync Premium",
        "Anzahl DisplayPort Anschl\u00fcsse": "1",
        "Anzahl HDMI-Anschl\u00fcsse": "2",
        "Anzahl der Farben des Displays": "1,07 Milliarden Farben",
        "Anzahl der nachgeschalteten Steckpl\u00e4tze vom Typ USB-A": "2",
        "Anzahl der vorgeschalteten Steckpl\u00e4tze": "1",
        "Artikelnummer": "M1IYNWKL",
        "Aufl\u00f6sung": "2560x1440",
        "Besonderheiten": "165 Hz, USB HUB",
        "Bildschirmdiagonale": "68,6 cm (27\")",
        "Bildschirmdiagonale (cm)": "68 cm",
        "Bildschirmform": "Flach",
        "Bildschirmtechnologie": "LED",
        "Bildwinkel, horizontal": "178\u00b0",
        "Bildwinkel, vertikal": "178\u00b0",
        "Blendfreier Bildschirm": "Ja",
        "Breite (ohne Standfu\u00df)": "614,2 mm",
        "DVI Anschluss": "Nein",
        "Display-Aufl\u00f6sung": "2560 x 1440 Pixel",
        "DisplayPorts-Version": "1.4",
        "Displaygr\u00f6\u00dfe": "27 Zoll",
        "EAN": "8806087982237",
        "Eingebaute Lautsprecher": "Nein",
        "Eingebautes Mikrofon": "Nein",
        "Energieeffizienzklasse (HDR)": "G",
        "Energieeffizienzklasse (SDR)": "F",
        "Energieeffizienzskala": "A bis G",
        "Energieverbrauch (HDR) pro 1.000 Stunden": "50 kWh",
        "Energieverbrauch (SDR) pro 1.000 Stunden": "24 kWh",
        "Ergonomie": "H\u00f6henverstellbar, Pivot (90 Grad drehbar), Neigbar",
        "FPS-Z\u00e4hler": "Ja",
        "Farbskala": "98%",
        "Flimmerfreie Technologie": "Ja",
        "Ger\u00e4tebreite (inkl. Fu\u00df)": "614,2 mm",
        "Ger\u00e4teh\u00f6he (inkl. Fu\u00df)": "575,9 mm",
        "Ger\u00e4tetiefe (inkl. Fu\u00df)": "291,2 mm",
        "Gewicht (mit St\u00e4nder)": "6,3 kg",
        "Gewicht (ohne St\u00e4nder)": "4,2 kg",
        "HD-Typ": "2K",
        "HDMI": "Ja",
        "HDMI-Version": "2.0",
        "Helligkeit": "320 cd/m\u00b2",
        "Helligkeit (typisch)": "400 cd/m\u00b2",
        "Hersteller Artikelnummer": "27GP850P-B",
        "High Dynamic Range Video (HDR) Unterst\u00fctzung": "Ja",
        "H\u00f6he (ohne Standfu\u00df)": "364,8 mm",
        "H\u00f6heneinstellung": "11 cm",
        "H\u00f6henverstellung": "Ja",
        "Integrierte Kamera": "Nein",
        "Integrierter USB-Hub": "Ja",
        "Kontrastverh\u00e4ltnis": "1000:1",
        "Kopfh\u00f6rerausgang": "Ja",
        "Markenspezifische Technologien": "Crosshair",
        "Marktpositionierung": "Gaming",
        "Maximale Bildwiederholrate": "165 Hz",
        "Mitgelieferte Kabel": "DisplayPort, HDMI, USB",
        "NVIDIA G-SYNC": "Ja",
        "NVIDIA G-SYNC-Typ": "G-SYNC Compatible",
        "Natives Seitenverh\u00e4ltnis": "16:9",
        "Netzteiltyp": "Extern",
        "Paketgewicht": "9,1 kg",
        "Panel": "IPS",
        "Panel-Montage-Schnittstelle": "100 x 100 mm",
        "Panel-Typ": "Nano IPS",
        "Pivot": "Ja",
        "Pixel Abstand": "0,2331 x 0,2331 mm",
        "Produktfarbe": "Schwarz, Rot",
        "RGB-Farbraum": "DCI-P3",
        "Reaktionszeit": "1 ms",
        "Smart-Modi": "Energiesparend",
        "Stromverbrauch (Standardbetrieb)": "48 W",
        "Stromverbrauch (Standby)": "0,5 W",
        "Stromverbrauch (aus)": "0,3 W",
        "Stromverbrauch (max.)": "65 W",
        "St\u00e4nder enthalten": "Ja",
        "Technologie mit hohem Dynamikbereich (HDR)": "DisplayHDR 400, HDR Effect, High Dynamic Range 10 (HDR10)",
        "Tiefe (ohne Standfu\u00df)": "51,7 mm",
        "Touchscreen": "Nein",
        "Unterst\u00fctzte Grafik-Aufl\u00f6sungen": "2560 x 1440",
        "VESA Halterung": "100x100 mm",
        "VESA-Halterung": "Ja",
        "Verpackungsart": "Box",
        "Verpackungsbreite": "727 mm",
        "Verpackungsh\u00f6he": "205 mm",
        "Verpackungstiefe": "487 mm",
        "Video Anschl\u00fcsse": "2x HDMI, 1x DisplayPort"
    },
    "raw_specifications_text": "Displaygr\u00f6\u00dfe: 27 Zoll\nAufl\u00f6sung: 2560x1440\nPanel: IPS\nReaktionszeit: 1 ms\nVideo Anschl\u00fcsse: 2x HDMI, 1x DisplayPort\nErgonomie: H\u00f6henverstellbar, Pivot (90 Grad drehbar), Neigbar\nVESA Halterung: 100x100 mm\nHelligkeit: 320 cd/m\u00b2\nBesonderheiten: 165 Hz, USB HUB\nHersteller Artikelnummer: 27GP850P-B\nEAN: 8806087982237\nArtikelnummer: M1IYNWKL\nBildschirmdiagonale: 68,6 cm (27\")\nDisplay-Aufl\u00f6sung: 2560 x 1440 Pixel\nNatives Seitenverh\u00e4ltnis: 16:9\nBildschirmtechnologie: LED\nTouchscreen: Nein\nHD-Typ: 2K\nPanel-Typ: Nano IPS\nBildschirmform: Flach\nKontrastverh\u00e4ltnis: 1000:1\nMaximale Bildwiederholrate: 165 Hz\nAnzahl der Farben des Displays: 1,07 Milliarden Farben\nHelligkeit (typisch): 400 cd/m\u00b2\nBlendfreier Bildschirm: Ja\nUnterst\u00fctzte Grafik-Aufl\u00f6sungen: 2560 x 1440\nBildwinkel, horizontal: 178\u00b0\nBildwinkel, vertikal: 178\u00b0\nPixel Abstand: 0,2331 x 0,2331 mm\nBildschirmdiagonale (cm): 68 cm\nHigh Dynamic Range Video (HDR) Unterst\u00fctzung: Ja\nTechnologie mit hohem Dynamikbereich (HDR): DisplayHDR 400, HDR Effect, High Dynamic Range 10 (HDR10)\nRGB-Farbraum: DCI-P3\nFarbskala: 98%\nNVIDIA G-SYNC: Ja\nAMD FreeSync: Ja\nNVIDIA G-SYNC-Typ: G-SYNC Compatible\nAMD FreeSync-Typ: FreeSync Premium\nMarkenspezifische Technologien: Crosshair\nFlimmerfreie Technologie: Ja\nFPS-Z\u00e4hler: Ja\nSmart-Modi: Energiesparend\nEingebaute Lautsprecher: Nein\nIntegrierte Kamera: Nein\nEingebautes Mikrofon: Nein\nMarktpositionierung: Gaming\nProduktfarbe: Schwarz, Rot\nIntegrierter USB-Hub: Ja\nHDMI: Ja\nKopfh\u00f6rerausgang: Ja\nAnzahl der vorgeschalteten Steckpl\u00e4tze: 1\nAnzahl der nachgeschalteten Steckpl\u00e4tze vom Typ USB-A: 2\nDVI Anschluss: Nein\nAnzahl HDMI-Anschl\u00fcsse: 2\nHDMI-Version: 2.0\nAnzahl DisplayPort Anschl\u00fcsse: 1\nDisplayPorts-Version: 1.4\nVESA-Halterung: Ja\nH\u00f6henverstellung: Ja\nPanel-Montage-Schnittstelle: 100 x 100 mm\nH\u00f6heneinstellung: 11 cm\nPivot: Ja\nEnergieeffizienzklasse (SDR): F\nEnergieeffizienzklasse (HDR): G\nEnergieverbrauch (SDR) pro 1.000 Stunden: 24 kWh\nEnergieverbrauch (HDR) pro 1.000 Stunden: 50 kWh\nStromverbrauch (Standardbetrieb): 48 W\nStromverbrauch (Standby): 0,5 W\nStromverbrauch (max.): 65 W\nStromverbrauch (aus): 0,3 W\nAC Eingangsspannung: 100 - 240 V\nAC Eingangsfrequenz: 50 - 60 Hz\nNetzteiltyp: Extern\nEnergieeffizienzskala: A bis G\nSt\u00e4nder enthalten: Ja\nMitgelieferte Kabel: DisplayPort, HDMI, USB\nGer\u00e4tebreite (inkl. Fu\u00df): 614,2 mm\nGer\u00e4tetiefe (inkl. Fu\u00df): 291,2 mm\nGer\u00e4teh\u00f6he (inkl. Fu\u00df): 575,9 mm\nGewicht (mit St\u00e4nder): 6,3 kg\nBreite (ohne Standfu\u00df): 614,2 mm\nTiefe (ohne Standfu\u00df): 51,7 mm\nH\u00f6he (ohne Standfu\u00df): 364,8 mm\nGewicht (ohne St\u00e4nder): 4,2 kg\nVerpackungsbreite: 727 mm\nVerpackungstiefe: 487 mm\nVerpackungsh\u00f6he: 205 mm\nPaketgewicht: 9,1 kg\nVerpackungsart: Box",
    "reference_file": "offer_reference_381.json",
    "shop_name": "mylemon.at"
}