{
    "html_file": "offer_1640_2.html",
    "name": "iiyama G-Master G2740QSU-B1 Black Hawk, 27\"",
    "offer_link": "https://www.csv-direct.de/artinfo.php?artnr=AGX1383712&KATEGORIE=162&pva=geizhals2",
    "price": 206.54,
    "raw_specifications": {
        "AC Eingangsfrequenz": "50 - 60 Hz",
        "AC Eingangsspannung": "100 - 240 V",
        "Anzahl DisplayPort Anschl\u00fcsse": "1",
        "Anzahl HDMI-Anschl\u00fcsse": "1",
        "Anzahl OSD-Sprachen": "10",
        "Anzahl der Farben des Displays": "16,7 Millionen Farben",
        "Anzahl der Lautsprecher": "2",
        "Anzahl der nachgeschalteten Steckpl\u00e4tze vom Typ USB-A": "2",
        "Bildschirmdiagonale": "68,6 cm 27\"",
        "Bildschirmdiagonale cm": "68,6 cm",
        "Bildschirmform": "Flach",
        "Bildschirmtechnologie": "LED",
        "Bildwinkel, horizontal": "178\u00b0",
        "Bildwinkel, vertikal": "178\u00b0",
        "Digital horizontale Frequenz": "31 - 120 kHz",
        "Digital vertikale Frequenz": "48 - 75 Hz",
        "Display-Aufl\u00f6sung": "2560 x 1440 Pixel",
        "Display-Oberfl\u00e4che": "Matt",
        "DisplayPorts-Version": "1.2",
        "Energieeffizienzklasse HDR": "Nicht verf\u00fcgbar",
        "Energieeffizienzklasse SDR": "F",
        "Energieeffizienzskala": "A bis G",
        "Energieverbrauch SDR pro 1.000 Stunden": "23 kWh",
        "Ger\u00e4tebreite inkl. Fu\u00df": "611,5 mm",
        "Ger\u00e4teh\u00f6he inkl. Fu\u00df": "434 mm",
        "Ger\u00e4tetiefe inkl. Fu\u00df": "239 mm",
        "Gewicht mit St\u00e4nder": "4,6 kg",
        "HD-Typ": "Wide Quad HD",
        "HDMI-Version": "1.4",
        "Helligkeit typisch": "250 cd/m\u00b2",
        "Kontrastverh\u00e4ltnis": "1000:1",
        "Kontrastverh\u00e4ltnis dynamisch": "80000000:1",
        "Marktpositionierung": "Gaming",
        "Maximale Bildwiederholrate": "75 Hz",
        "Men\u00fcsprachen": "Tschechisch, Deutsch, Niederl\u00e4ndisch, Englisch, Spanisch, Franz\u00f6sisch, Italienisch, Japanisch, Polnisch, Russisch",
        "Mitgelieferte Kabel": "AC, DisplayPort, HDMI, USB",
        "Nachhaltigkeitszertifikate": "CE, ENERGY STAR, ErP, REACH, RoHS",
        "Natives Seitenverh\u00e4ltnis": "16:9",
        "Neigungswinkelbereich": "-4 - 22\u00b0",
        "Paketgewicht": "6,2 kg",
        "Panel-Montage-Schnittstelle": "100 x 100 mm",
        "Panel-Typ": "IPS",
        "Pixel Abstand": "0,233 x 0,233 mm",
        "Produktfarbe": "Schwarz",
        "RMS-Leistung": "4 W",
        "Reaktionszeit": "1 ms",
        "Sichtbare Gr\u00f6\u00dfe horizontal": "59,7 cm",
        "Sichtbare Gr\u00f6\u00dfe vertikal": "33,6 cm",
        "Slot-Typ Kabelsperre": "Kensington",
        "Stromverbrauch Standardbetrieb": "23 W",
        "Stromverbrauch Standby": "0,5 W",
        "Stromverbrauch aus": "0,5 W",
        "Touchscreen": "Nein",
        "Verpackungsbreite": "692 mm",
        "Verpackungsh\u00f6he": "452 mm",
        "Verpackungstiefe": "147 mm",
        "Warentarifnummer HS": "85285210"
    },
    "raw_specifications_text": "Bildschirmdiagonale: 68,6 cm 27\"\nDisplay-Aufl\u00f6sung: 2560 x 1440 Pixel\nNatives Seitenverh\u00e4ltnis: 16:9\nBildschirmtechnologie: LED\nTouchscreen: Nein\nHD-Typ: Wide Quad HD\nPanel-Typ: IPS\nBildschirmform: Flach\nKontrastverh\u00e4ltnis: 1000:1\nMaximale Bildwiederholrate: 75 Hz\nAnzahl der Farben des Displays: 16,7 Millionen Farben\nHelligkeit typisch: 250 cd/m\u00b2\nReaktionszeit: 1 ms\nDisplay-Oberfl\u00e4che: Matt\nKontrastverh\u00e4ltnis dynamisch: 80000000:1\nBildwinkel, horizontal: 178\u00b0\nBildwinkel, vertikal: 178\u00b0\nPixel Abstand: 0,233 x 0,233 mm\nSichtbare Gr\u00f6\u00dfe horizontal: 59,7 cm\nSichtbare Gr\u00f6\u00dfe vertikal: 33,6 cm\nDigital horizontale Frequenz: 31 - 120 kHz\nDigital vertikale Frequenz: 48 - 75 Hz\nBildschirmdiagonale cm: 68,6 cm\nAnzahl der Lautsprecher: 2\nRMS-Leistung: 4 W\nMarktpositionierung: Gaming\nProduktfarbe: Schwarz\nAnzahl der nachgeschalteten Steckpl\u00e4tze vom Typ USB-A: 2\nAnzahl HDMI-Anschl\u00fcsse: 1\nHDMI-Version: 1.4\nAnzahl DisplayPort Anschl\u00fcsse: 1\nDisplayPorts-Version: 1.2\nPanel-Montage-Schnittstelle: 100 x 100 mm\nSlot-Typ Kabelsperre: Kensington\nNeigungswinkelbereich: -4 - 22\u00b0\nMen\u00fcsprachen: Tschechisch, Deutsch, Niederl\u00e4ndisch, Englisch, Spanisch, Franz\u00f6sisch, Italienisch, Japanisch, Polnisch, Russisch\nAnzahl OSD-Sprachen: 10\nEnergieeffizienzklasse SDR: F\nEnergieeffizienzklasse HDR: Nicht verf\u00fcgbar\nEnergieverbrauch SDR pro 1.000 Stunden: 23 kWh\nStromverbrauch Standardbetrieb: 23 W\nStromverbrauch Standby: 0,5 W\nStromverbrauch aus: 0,5 W\nAC Eingangsspannung: 100 - 240 V\nAC Eingangsfrequenz: 50 - 60 Hz\nEnergieeffizienzskala: A bis G\nMitgelieferte Kabel: AC, DisplayPort, HDMI, USB\nGer\u00e4tebreite inkl. Fu\u00df: 611,5 mm\nGer\u00e4tetiefe inkl. Fu\u00df: 239 mm\nGer\u00e4teh\u00f6he inkl. Fu\u00df: 434 mm\nGewicht mit St\u00e4nder: 4,6 kg\nVerpackungsbreite: 692 mm\nVerpackungstiefe: 147 mm\nVerpackungsh\u00f6he: 452 mm\nPaketgewicht: 6,2 kg\nNachhaltigkeitszertifikate: CE, ENERGY STAR, ErP, REACH, RoHS\nWarentarifnummer HS: 85285210",
    "reference_file": "offer_reference_1640.json",
    "shop_name": "CSV-Direct.de"
}