{
    "html_file": "offer_937_5.html",
    "name": "GIGABYTE G34WQC A, 34\"",
    "offer_link": "https://direkt.jacob.de/produkte/gigabyte-g34wqc-a-g34wqc-a-artnr-7489164.html?utm_source=geizhals&utm_medium=cpc&utm_campaign=Preisvergleich&ref=103",
    "price": 402.33,
    "raw_specifications": {
        "AC Eingangsfrequenz": "50/60 Hz",
        "AC Eingangsspannung": "100 - 240 V",
        "AMD FreeSync": "Nein",
        "Abnehmbarer Standfu\u00df": "Ja",
        "Anzahl DisplayPort Anschl\u00fcsse": "2",
        "Anzahl HDMI-Anschl\u00fcsse": "2",
        "Anzahl der Lautsprecher": "2",
        "Bewertung der Bildschirmkr\u00fcmmung": "1500R",
        "Bildschirmaufl\u00f6sung": "3440 x 1440 Pixel",
        "Bildschirmdiagonale": "86,4 cm (34\" )",
        "Bildschirmform": "Gebogen",
        "Bildschirmtechnologie": "LCD",
        "Blendfreier Bildschirm": "Ja",
        "Blickwinkel, horizontal": "178\u00b0",
        "Blickwinkel, vertikal": "178\u00b0",
        "Breite (ohne Standfu\u00df)": "80,9 cm",
        "DisplayPorts-Version": "1.4",
        "Eingangsstrom": "2 A",
        "Eingebaute Lautsprecher": "Ja",
        "Energie Effizienzklasse": "G",
        "Farbintensit\u00e4t": "8 Bit",
        "Farbskala": "90%",
        "Flimmerfreie Technologie": "Ja",
        "Ger\u00e4tebreite (inkl. Fu\u00df)": "808,9 mm",
        "Ger\u00e4teh\u00f6he (inkl. Fu\u00df)": "488,8 mm",
        "Ger\u00e4tetiefe (inkl. Fu\u00df)": "234,8 mm",
        "HD-Typ": "UltraWide Quad HD",
        "HDMI": "Ja",
        "HDMI-Version": "2.0",
        "Helligkeit (typisch)": "350 cd/m\u00b2",
        "H\u00f6he (ohne Standfu\u00df)": "36,3 cm",
        "H\u00f6heneinstellung": "10 cm",
        "H\u00f6henverstellung": "Ja",
        "Integrierte Kamera": "Nein",
        "Integrierter USB-Hub": "Nein",
        "Kabelsperre-Slot": "Ja",
        "Kontrastverh\u00e4ltnis": "4000:1",
        "Kopfh\u00f6rerausgang": "Ja",
        "Marktpositionierung": "Gaming",
        "Maximale Bildwiederholrate": "144 Hz",
        "Mitgelieferte Kabel": "AC, DisplayPort, HDMI",
        "NVIDIA G-SYNC": "Nein",
        "Natives Seitenverh\u00e4ltnis": "21:9",
        "Neigungswinkelbereich": "5 - 20\u00b0",
        "Paketgewicht": "12,1 kg",
        "Panel-Montage-Schnittstelle": "100 x 100 mm",
        "Panel-Typ": "VA",
        "Pivot": "Nein",
        "Pixel Abstand": "0,23175 x 0,23175 mm",
        "Produktfarbe": "Schwarz",
        "RGB-Farbraum": "sRGB",
        "RMS-Leistung": "2 W",
        "Reaktionszeit": "1 ms",
        "Schwenkbar": "Nein",
        "Sichtbare Gr\u00f6\u00dfe (horizontal)": "79,7 cm",
        "Sichtbare Gr\u00f6\u00dfe (vertikal)": "33,4 cm",
        "Slot-Typ Kabelsperre": "Kensington",
        "Stromverbrauch (Standardbetrieb)": "80 W",
        "Stromverbrauch (Standby)": "0,5 W",
        "Temperaturbereich in Betrieb": "0 - 40 \u00b0C",
        "Tiefe (ohne Standfu\u00df)": "11,4 cm",
        "Typ der Hintergrundbeleuchtung": "Seiten-LED",
        "VESA-Halterung": "Ja",
        "Verpackungsart": "Box",
        "Verpackungsbreite": "938 mm",
        "Verpackungsh\u00f6he": "272 mm",
        "Verpackungstiefe": "563 mm",
        "kippbar": "Ja",
        "sRGB Abdeckung (klassisch)": "120%"
    },
    "raw_specifications_text": "Bildschirmdiagonale: 86,4 cm (34\" )\nBildschirmaufl\u00f6sung: 3440 x 1440 Pixel\nNatives Seitenverh\u00e4ltnis: 21:9\nPanel-Typ: VA\nHD-Typ: UltraWide Quad HD\nBildschirmtechnologie: LCD\nBildschirmform: Gebogen\nKontrastverh\u00e4ltnis: 4000:1\nMaximale Bildwiederholrate: 144 Hz\nHelligkeit (typisch): 350 cd/m\u00b2\nReaktionszeit: 1 ms\nTyp der Hintergrundbeleuchtung: Seiten-LED\nBlendfreier Bildschirm: Ja\nBewertung der Bildschirmkr\u00fcmmung: 1500R\nBlickwinkel, horizontal: 178\u00b0\nBlickwinkel, vertikal: 178\u00b0\nPixel Abstand: 0,23175 x 0,23175 mm\nSichtbare Gr\u00f6\u00dfe (horizontal): 79,7 cm\nSichtbare Gr\u00f6\u00dfe (vertikal): 33,4 cm\nFarbintensit\u00e4t: 8 Bit\nRGB-Farbraum: sRGB\nFarbskala: 90%\nsRGB Abdeckung (klassisch): 120%\nNVIDIA G-SYNC: Nein\nAMD FreeSync: Nein\nFlimmerfreie Technologie: Ja\nEingebaute Lautsprecher: Ja\nIntegrierte Kamera: Nein\nAnzahl der Lautsprecher: 2\nRMS-Leistung: 2 W\nMarktpositionierung: Gaming\nProduktfarbe: Schwarz\nAbnehmbarer Standfu\u00df: Ja\nIntegrierter USB-Hub: Nein\nHDMI: Ja\nKopfh\u00f6rerausgang: Ja\nAnzahl HDMI-Anschl\u00fcsse: 2\nHDMI-Version: 2.0\nAnzahl DisplayPort Anschl\u00fcsse: 2\nDisplayPorts-Version: 1.4\nVESA-Halterung: Ja\nKabelsperre-Slot: Ja\nH\u00f6henverstellung: Ja\nPanel-Montage-Schnittstelle: 100 x 100 mm\nSlot-Typ Kabelsperre: Kensington\nH\u00f6heneinstellung: 10 cm\nPivot: Nein\nSchwenkbar: Nein\nkippbar: Ja\nNeigungswinkelbereich: 5 - 20\u00b0\nEnergie Effizienzklasse: G\nStromverbrauch (Standardbetrieb): 80 W\nStromverbrauch (Standby): 0,5 W\nAC Eingangsspannung: 100 - 240 V\nAC Eingangsfrequenz: 50/60 Hz\nEingangsstrom: 2 A\nTemperaturbereich in Betrieb: 0 - 40 \u00b0C\nGer\u00e4tebreite (inkl. Fu\u00df): 808,9 mm\nGer\u00e4tetiefe (inkl. Fu\u00df): 234,8 mm\nGer\u00e4teh\u00f6he (inkl. Fu\u00df): 488,8 mm\nBreite (ohne Standfu\u00df): 80,9 cm\nTiefe (ohne Standfu\u00df): 11,4 cm\nH\u00f6he (ohne Standfu\u00df): 36,3 cm\nMitgelieferte Kabel: AC, DisplayPort, HDMI\nVerpackungsbreite: 938 mm\nVerpackungstiefe: 563 mm\nVerpackungsh\u00f6he: 272 mm\nPaketgewicht: 12,1 kg\nVerpackungsart: Box",
    "reference_file": "offer_reference_937.json",
    "shop_name": "Jacob Elektronik direkt (AT)"
}