{
    "html_file": "offer_2035_22.html",
    "name": "Eizo FlexScan EV2460 schwarz, 23.8\"",
    "offer_link": "https://www.proshop.at/Bildschirm/EIZO-24-Bildschirm-FlexScan-EV2460-USB-Hub-Speakers-Black-5-ms/2828122?utm_source=geizhals&utm_medium=cpc&utm_campaign=pricesite",
    "price": 312.38,
    "raw_specifications": {
        "Abmessungen (Breite x Tiefe x H\u00f6he)": "53.78 cm x 23.3 cm x 33.36 cm - mit Fu\u00df",
        "Abmessungen (Breite x Tiefe x H\u00f6he) - mit Fu\u00df": "53.78 cm x 23.3 cm x 33.36 cm",
        "Ausgangsleistung/Kanal": "1 Watt",
        "Besonderheiten": "HDCP, Auto EcoView, FlexStand, flimmerfreie Technologie, Movie Mode, sRGB Mode, Low Blue Light Content, Zero Bright Pixels",
        "Bildschirmtyp": "IPS",
        "Details zu Abmessungen & Gewicht": "Ohne Fu\u00df - Breite: 53.78 cm - Tiefe: 5.36 cm - H\u00f6he: 32.04 cm - Gewicht: 3.8 kg  Mit Fu\u00df - Breite: 53.78 cm - Tiefe: 23.3 cm - H\u00f6he: 33.36 cm - Gewicht: 5.9 kg",
        "Diagonalabmessung": "60.5 cm (23.8\")",
        "Display-Typ": "LED-hintergrundbeleuchteter LCD-Monitor / TFT-Aktivmatrix",
        "EAN": "4995047055297",
        "ENERGY STAR zertifiziert": "Ja",
        "Ein-/Aus-Schalter": "Ja",
        "Eingangsanschl\u00fcsse": "HDMI, DVI-D, VGA, DisplayPort",
        "Eingangsspannung": "Wechselstrom 120/230 V (50/60 Hz)",
        "Einstellungen der Anzeigeposition": "H\u00f6he, Pivot (Rotation), Drehung, Neigung",
        "Energie Effizienzklasse": "Klasse B",
        "Energieverbrauch pro Jahr": "18 kWh",
        "Enthaltene Kabel": "1 x DisplayPort-Kabel - 2 m  2 x USB-Kabel",
        "Farbe": "Schwarz",
        "Farbunterst\u00fctzung": "16,7 Millionen Farben",
        "Ger\u00e4tetyp": "LED-hintergrundbeleuchteter LCD-Monitor - 60.5 cm (23.8\")",
        "Gewicht": "5.9 kg",
        "Helligkeit": "250 cd/m\u00b2",
        "Hersteller": "EIZO",
        "Hintergrundbeleuchtungs-Technologie": "LED-Hintergrundbeleuchtung",
        "Horizontale Bildwiederholrate": "68 kHz",
        "Horizontaler Betrachtungswinkel": "178",
        "H\u00f6heneinstellung": "140 mm",
        "Integrierte Peripherieger\u00e4te": "USB 3.1 Hub",
        "Kennzeichnung": "TUV GS, TUV S, CB, CCC, TUV Ergo, RoHS, WEEE, PSE Mark, FCC CFR47 Part 15 B, cTUVus, EPA, VCCI Class B, EAC, China RoHS, RCM, CAN ICES-3 Class B, TUV LBL",
        "Kontrast": "1000:1",
        "Leistungsaufnahme im Ein-Zustand": "9 W",
        "Leistungsmerkmale": "USB 3.1 Hub",
        "Modell": "EV2460-BK",
        "Native Aufl\u00f6sung": "Full HD (1080p) 1920 x 1080",
        "Neigungswinkel": "-5/+35",
        "OSD-Sprachen": "Chinesisch (tradionell), Chinesisch (vereinfacht), Englisch, Deutsch, Franz\u00f6sisch, Italienisch, Schwedisch, Spanisch, Japanisch",
        "Pixelpitch": "0.275 mm",
        "Ppi": "93",
        "Produktbeschreibung": "EIZO FlexScan EV2460 - LED-Monitor - Full HD (1080p) - 60.5 cm (23.8\")",
        "Reaktionszeit": "5 ms (Gray-to-Gray)",
        "Rotationswinkel": "90",
        "Schnittstellen": "VGA  DVI-D (HDCP)  DisplayPort (HDCP)  HDMI (HDCP)  Kopfh\u00f6rer (Mini-Klinkenstecker)  USB 3.1 Upstream (Typ B)  4 x USB 3.1 Gen 1 Downstream (Typ A)  Audio Line-In (Mini-Klinkenstecker)",
        "Schwenkwinkel": "344",
        "Seitenverh\u00e4ltnis": "16:9",
        "Spannung": "Wechselstrom 120/230 V (50/60 Hz)",
        "Stromverbrauch (Aus-Modus)": "0.5 Watt",
        "Stromverbrauch (typisch)": "10 Watt",
        "Stromverbrauch SDR (eingeschaltet)": "9 kWh/1.000 h",
        "Stromverbrauch im Standby-Modus": "0.5 Watt",
        "TCO-zertifiziert": "TCO Certified Displays 8",
        "Typ": "Lautsprecher - Stereo",
        "Umweltschutzstandards": "TCO Certified Displays 8, ENERGY STAR-qualifiziert",
        "VESA-Halterung": "100 x 100 mm, VESA",
        "Vertikale Bildwiederholrate": "61 Hz",
        "Vertikaler Betrachtungswinkel": "178",
        "Waren-Nr.": "2828122",
        "Zubeh\u00f6r im Lieferumfang": "Schrauben",
        "Zum Hersteller": "www.eizo.com"
    },
    "raw_specifications_text": "Hersteller: EIZO\nWaren-Nr.: 2828122\nModell: EV2460-BK\nEAN: 4995047055297\nZum Hersteller: www.eizo.com\nProduktbeschreibung: EIZO FlexScan EV2460 - LED-Monitor - Full HD (1080p) - 60.5 cm (23.8\")\nGer\u00e4tetyp: LED-hintergrundbeleuchteter LCD-Monitor - 60.5 cm (23.8\")\nEnergie Effizienzklasse: Klasse B\nEnergieverbrauch pro Jahr: 18 kWh\nLeistungsaufnahme im Ein-Zustand: 9 W\nLeistungsmerkmale: USB 3.1 Hub\nBildschirmtyp: IPS\nSeitenverh\u00e4ltnis: 16:9\nNative Aufl\u00f6sung: Full HD (1080p) 1920 x 1080\nPixelpitch: 0.275 mm\nHelligkeit: 250 cd/m\u00b2\nKontrast: 1000:1\nReaktionszeit: 5 ms (Gray-to-Gray)\nFarbunterst\u00fctzung: 16,7 Millionen Farben\nEingangsanschl\u00fcsse: HDMI, DVI-D, VGA, DisplayPort\nEinstellungen der Anzeigeposition: H\u00f6he, Pivot (Rotation), Drehung, Neigung\nSpannung: Wechselstrom 120/230 V (50/60 Hz)\nFarbe: Schwarz\nAbmessungen (Breite x Tiefe x H\u00f6he) - mit Fu\u00df: 53.78 cm x 23.3 cm x 33.36 cm\nGewicht: 5.9 kg\nUmweltschutzstandards: TCO Certified Displays 8, ENERGY STAR-qualifiziert\nKennzeichnung: TUV GS, TUV S, CB, CCC, TUV Ergo, RoHS, WEEE, PSE Mark, FCC CFR47 Part 15 B, cTUVus, EPA, VCCI Class B, EAC, China RoHS, RCM, CAN ICES-3 Class B, TUV LBL\nDisplay-Typ: LED-hintergrundbeleuchteter LCD-Monitor / TFT-Aktivmatrix\nDiagonalabmessung: 60.5 cm (23.8\")\nIntegrierte Peripherieger\u00e4te: USB 3.1 Hub\nPpi: 93\nVertikale Bildwiederholrate: 61 Hz\nHorizontale Bildwiederholrate: 68 kHz\nHorizontaler Betrachtungswinkel: 178\nVertikaler Betrachtungswinkel: 178\nHintergrundbeleuchtungs-Technologie: LED-Hintergrundbeleuchtung\nOSD-Sprachen: Chinesisch (tradionell), Chinesisch (vereinfacht), Englisch, Deutsch, Franz\u00f6sisch, Italienisch, Schwedisch, Spanisch, Japanisch\nBesonderheiten: HDCP, Auto EcoView, FlexStand, flimmerfreie Technologie, Movie Mode, sRGB Mode, Low Blue Light Content, Zero Bright Pixels\nAbmessungen (Breite x Tiefe x H\u00f6he): 53.78 cm x 23.3 cm x 33.36 cm - mit Fu\u00df\nTyp: Lautsprecher - Stereo\nAusgangsleistung/Kanal: 1 Watt\nSchnittstellen: VGA  DVI-D (HDCP)  DisplayPort (HDCP)  HDMI (HDCP)  Kopfh\u00f6rer (Mini-Klinkenstecker)  USB 3.1 Upstream (Typ B)  4 x USB 3.1 Gen 1 Downstream (Typ A)  Audio Line-In (Mini-Klinkenstecker)\nNeigungswinkel: -5/+35\nSchwenkwinkel: 344\nRotationswinkel: 90\nH\u00f6heneinstellung: 140 mm\nVESA-Halterung: 100 x 100 mm, VESA\nZubeh\u00f6r im Lieferumfang: Schrauben\nEnthaltene Kabel: 1 x DisplayPort-Kabel - 2 m  2 x USB-Kabel\nEingangsspannung: Wechselstrom 120/230 V (50/60 Hz)\nStromverbrauch SDR (eingeschaltet): 9 kWh/1.000 h\nStromverbrauch (typisch): 10 Watt\nStromverbrauch im Standby-Modus: 0.5 Watt\nStromverbrauch (Aus-Modus): 0.5 Watt\nEin-/Aus-Schalter: Ja\nDetails zu Abmessungen & Gewicht: Ohne Fu\u00df - Breite: 53.78 cm - Tiefe: 5.36 cm - H\u00f6he: 32.04 cm - Gewicht: 3.8 kg  Mit Fu\u00df - Breite: 53.78 cm - Tiefe: 23.3 cm - H\u00f6he: 33.36 cm - Gewicht: 5.9 kg\nTCO-zertifiziert: TCO Certified Displays 8\nENERGY STAR zertifiziert: Ja",
    "reference_file": "offer_reference_2035.json",
    "shop_name": "Proshop.at"
}