{
    "html_file": "offer_2047_10.html",
    "name": "Philips B-line 243B9, 23.8\"",
    "offer_link": "https://www.ditech.at/details.php?artnr=298302",
    "price": 237.9,
    "raw_specifications": {
        "Abmessungen (BxHxT)": "541x522x216mm (mit Standfu\u00df),  541x332x63mm (ohne Standfu\u00df)",
        "Adaptive Sync": "Ja",
        "Anschl\u00fcsse - DisplayPort 1.2": "1",
        "Anschl\u00fcsse - HDMI 1.4": "1",
        "Anschl\u00fcsse - USB-C mit DisplayPort 1.2": "1",
        "Anschl\u00fcsse - VGA": "1",
        "Anwendung": "station\u00e4r",
        "Audio": "Lautsprecher (2x 2W),  1x Line-In,  1x Line-Out",
        "Aufl\u00f6sung": "1920x1080",
        "Beschichtung": "matt (non-glare),  H\u00e4rtegrad 3H",
        "Besonderheiten": "Slim Bezel,  USB-C Power Delivery (65W),  mechanische Tasten,  Sicherheitsschloss (Kensington),  TCO 9 zertifiziert,  Philips SmartImage",
        "Bildwiederholfrequenz": "75Hz",
        "Blickwinkel": "178\u00b0/178\u00b0",
        "Diagonale": "23.8\"/60.5cm",
        "Energieeffizienzklasse alt (A+++ bis D)": "A",
        "Energieeffizienzklasse alt (A+++ bis G)": "A",
        "Ergonomie": "150mm (h\u00f6henverstellbar),  90\u00b0 (Pivot),  \u00b1175\u00b0 (drehbar),  +30\u00b0/-5\u00b0 (neigbar),  keine Angabe (Schr\u00e4glage)",
        "FRC": "unbekannt",
        "Farbe": "schwarz",
        "Farbtiefe": "8bit (16.7 Mio. Farben)",
        "Form": "gerade (flat)",
        "Gewicht": "5.19kg (mit Standfu\u00df),  3.57kg (ohne Standfu\u00df)",
        "HDR": "N/A",
        "Helligkeit": "250cd/m\u00b2",
        "Herstellergarantie": "drei Jahre",
        "Hintergrundbeleuchtung": "White-LED,  flicker-free,  Blaulichtfilter",
        "Jahresverbrauch alt (A+++ bis D)": "35.04kWh",
        "Jahresverbrauch alt (A+++ bis G)": "35.04kWh",
        "Kontrast - dynamisch": "50.000.000:1",
        "Kontrast - statisch": "1.000:1",
        "Lautsprecher": "Ja",
        "Leistungsaufnahme": "keine Angabe (maximal),  17.1W (typisch),  24W (Energielabel alt A+++ bis G),  0.3W (Standby)",
        "Panel": "IPS",
        "Reaktionszeit - GtG": "4ms",
        "Screen-to-Body-Ratio": "86.9% (berechnet)",
        "Seitenverh\u00e4ltnis": "16:9",
        "Signalfrequenz": "30-85kHz (horizontal),  48-75Hz (vertikal)",
        "Stromversorgung": "AC-In (internes Netzteil)",
        "USB-Hub In": "1x USB-C mit DisplayPort 1.2",
        "USB-Hub Out": "4x USB-C 3.0",
        "USB-Schreibweise": "Link",
        "Unsch\u00e4rfereduktionsfunktion": "N/A",
        "VESA": "100x100 (belegt)",
        "VRR (Variable Refresh Rate)": "Adaptive Sync",
        "Weitere Anschl\u00fcsse": "N/A"
    },
    "raw_specifications_text": "Abmessungen (BxHxT): 541x522x216mm (mit Standfu\u00df),  541x332x63mm (ohne Standfu\u00df)\nAdaptive Sync: Ja\nAnschl\u00fcsse - DisplayPort 1.2: 1\nAnschl\u00fcsse - HDMI 1.4: 1\nAnschl\u00fcsse - USB-C mit DisplayPort 1.2: 1\nAnschl\u00fcsse - VGA: 1\nAnwendung: station\u00e4r\nAudio: Lautsprecher (2x 2W),  1x Line-In,  1x Line-Out\nAufl\u00f6sung: 1920x1080\nBeschichtung: matt (non-glare),  H\u00e4rtegrad 3H\nBesonderheiten: Slim Bezel,  USB-C Power Delivery (65W),  mechanische Tasten,  Sicherheitsschloss (Kensington),  TCO 9 zertifiziert,  Philips SmartImage\nBildwiederholfrequenz: 75Hz\nBlickwinkel: 178\u00b0/178\u00b0\nDiagonale: 23.8\"/60.5cm\nEnergieeffizienzklasse alt (A+++ bis D): A\nEnergieeffizienzklasse alt (A+++ bis G): A\nErgonomie: 150mm (h\u00f6henverstellbar),  90\u00b0 (Pivot),  \u00b1175\u00b0 (drehbar),  +30\u00b0/-5\u00b0 (neigbar),  keine Angabe (Schr\u00e4glage)\nFarbe: schwarz\nFarbtiefe: 8bit (16.7 Mio. Farben)\nForm: gerade (flat)\nFRC: unbekannt\nGewicht: 5.19kg (mit Standfu\u00df),  3.57kg (ohne Standfu\u00df)\nHDR: N/A\nHelligkeit: 250cd/m\u00b2\nHerstellergarantie: drei Jahre\nHintergrundbeleuchtung: White-LED,  flicker-free,  Blaulichtfilter\nJahresverbrauch alt (A+++ bis D): 35.04kWh\nJahresverbrauch alt (A+++ bis G): 35.04kWh\nKontrast - dynamisch: 50.000.000:1\nKontrast - statisch: 1.000:1\nLautsprecher: Ja\nLeistungsaufnahme: keine Angabe (maximal),  17.1W (typisch),  24W (Energielabel alt A+++ bis G),  0.3W (Standby)\nPanel: IPS\nReaktionszeit - GtG: 4ms\nScreen-to-Body-Ratio: 86.9% (berechnet)\nSeitenverh\u00e4ltnis: 16:9\nSignalfrequenz: 30-85kHz (horizontal),  48-75Hz (vertikal)\nStromversorgung: AC-In (internes Netzteil)\nUnsch\u00e4rfereduktionsfunktion: N/A\nUSB-Hub In: 1x USB-C mit DisplayPort 1.2\nUSB-Hub Out: 4x USB-C 3.0\nUSB-Schreibweise: Link\nVESA: 100x100 (belegt)\nVRR (Variable Refresh Rate): Adaptive Sync\nWeitere Anschl\u00fcsse: N/A",
    "reference_file": "offer_reference_2047.json",
    "shop_name": "DiTech.at"
}