{
    "html_file": "offer_758_21.html",
    "name": "GIGABYTE G27F 2, 27\"",
    "offer_link": "https://www.electronicshop24.at/product_info.php?products_id=50000001929191739&ano=A1929191739&mno=G27F+2&ean=4719331836306&utm_medium=cpc&utm_campaign=preisvergleich&utm_content=item&utm_source=geizhals&ref=geizhals",
    "price": 255.0,
    "raw_specifications": {
        "Abmessungen (Breite x Tiefe x H\u00f6he)": "61.511 cm x 19.363 cm x 53.566 cm - mit Fu\u00df",
        "Adaptive-Sync Technologie": "AMD FreeSync Premium",
        "Besonderheiten": "Black eQualizer, flimmerfreie Technologie, Crosshair Display, an 3 Seiten ohne Blende, OSD Sidekick, Dashboard",
        "Bildschirmbeschichtung": "Blendfrei",
        "Bildschirmtyp": "SS IPS",
        "Details zu Abmessungen & Gewicht": "Mit Fu\u00df - Breite: 61.511 cm - Tiefe: 19.363 cm - H\u00f6he: 53.566 cm - Gewicht: 5.2 kg \u00a6 Ohne Fu\u00df - Breite: 61.511 cm - Tiefe: 4.221 cm - H\u00f6he: 36.735 cm - Gewicht: 3.5 kg",
        "Diagonalabmessung": "69 cm (27\")",
        "Display-Typ": "LED-hintergrundbeleuchteter LCD-Monitor / TFT-Aktivmatrix",
        "Eingangsspannung": "Wechselstrom 100-240 V (50/60 Hz)",
        "Einstellungen der Anzeigeposition": "H\u00f6he, Neigung",
        "Energie Effizienzklasse": "Klasse E",
        "Energieklasse (HDR)": "Klasse G",
        "Enthaltene Kabel": "1 x HDMI-Kabel \u00a6 1 x USB-Kabel",
        "Farbraum": "130% sRGB, 95% DCI-P3",
        "Farbunterst\u00fctzung": "16,7 Millionen Farben (8-Bit)",
        "Gaming": "Ja",
        "Gewicht": "5.2 kg",
        "Helligkeit": "400 cd/m\u00b2",
        "Hintergrundbeleuchtungs-Technologie": "Edge-LED-Beleuchtung",
        "Horizontaler Betrachtungswinkel": "178",
        "H\u00f6heneinstellung": "130 mm",
        "Integrierte Peripherieger\u00e4te": "USB 3.2 Gen 1 Hub",
        "Kennzeichnung": "TUV Rheinland Low Blue Light Certification",
        "Kontrast": "1000:1",
        "Leistungsmerkmale": "Slot f\u00fcr Sicherheitsschloss (Kabelschloss getrennt erh\u00e4ltlich)",
        "MTBF": "30,000 Stunde(n)",
        "Max. Betriebstemperatur": "40 \u00b0C",
        "Min Betriebstemperatur": "0 \u00b0C",
        "Native Aufl\u00f6sung": "Full HD (1080p) 1920 x 1080 (DisplayPort(OC): 170 Hz, DisplayPort: 165 Hz, HDMI: 165 Hz)",
        "Neigungswinkel": "-5/+20",
        "Pixelpitch": "0.3108 mm",
        "Reaktionszeit": "1 ms (MPRT)",
        "Schlosstyp zur Diebstahlsicherung": "Kensington Slot",
        "Schnittstellen": "2 x HDMI 2.0 \u00a6 DisplayPort 1.2 \u00a6 Kopfh\u00f6rer \u00a6 USB 3.2 Gen 1 Upstream (Typ B) \u00a6 2 x USB 3.2 Gen 2 Downstream",
        "Seitenverh\u00e4ltnis": "16:9",
        "Service und Support": "Begrenzte Garantie - 3 Jahre",
        "Stromverbrauch (Aus-Modus)": "0.3 Watt",
        "Stromverbrauch (typisch)": "21 Watt",
        "Stromverbrauch HDR (eingeschaltet)": "40 kWh/1.000 h",
        "Stromverbrauch SDR (eingeschaltet)": "21 kWh/1.000 h",
        "Stromverbrauch im Standby-Modus": "0.5 Watt",
        "Transportbreite": "72 cm",
        "Transportgewicht": "7.8 kg",
        "Transporth\u00f6he": "47 cm",
        "Transporttiefe": "20 cm",
        "VESA-Halterung": "100 x 100 mm",
        "Vertikaler Betrachtungswinkel": "178"
    },
    "raw_specifications_text": "Display-Typ: LED-hintergrundbeleuchteter LCD-Monitor / TFT-Aktivmatrix\nEnergie Effizienzklasse: Klasse E\nEnergieklasse (HDR): Klasse G\nDiagonalabmessung: 69 cm (27\")\nAdaptive-Sync Technologie: AMD FreeSync Premium\nIntegrierte Peripherieger\u00e4te: USB 3.2 Gen 1 Hub\nBildschirmtyp: SS IPS\nSeitenverh\u00e4ltnis: 16:9\nNative Aufl\u00f6sung: Full HD (1080p) 1920 x 1080 (DisplayPort(OC): 170 Hz, DisplayPort: 165 Hz, HDMI: 165 Hz)\nPixelpitch: 0.3108 mm\nHelligkeit: 400 cd/m\u00b2\nKontrast: 1000:1\nFarbunterst\u00fctzung: 16,7 Millionen Farben (8-Bit)\nFarbraum: 130% sRGB, 95% DCI-P3\nReaktionszeit: 1 ms (MPRT)\nGaming: Ja\nHorizontaler Betrachtungswinkel: 178\nVertikaler Betrachtungswinkel: 178\nBildschirmbeschichtung: Blendfrei\nHintergrundbeleuchtungs-Technologie: Edge-LED-Beleuchtung\nBesonderheiten: Black eQualizer, flimmerfreie Technologie, Crosshair Display, an 3 Seiten ohne Blende, OSD Sidekick, Dashboard\nAbmessungen (Breite x Tiefe x H\u00f6he): 61.511 cm x 19.363 cm x 53.566 cm - mit Fu\u00df\nGewicht: 5.2 kg\nSchnittstellen: 2 x HDMI 2.0 \u00a6 DisplayPort 1.2 \u00a6 Kopfh\u00f6rer \u00a6 USB 3.2 Gen 1 Upstream (Typ B) \u00a6 2 x USB 3.2 Gen 2 Downstream\nEinstellungen der Anzeigeposition: H\u00f6he, Neigung\nNeigungswinkel: -5/+20\nH\u00f6heneinstellung: 130 mm\nVESA-Halterung: 100 x 100 mm\nLeistungsmerkmale: Slot f\u00fcr Sicherheitsschloss (Kabelschloss getrennt erh\u00e4ltlich)\nEnthaltene Kabel: 1 x HDMI-Kabel \u00a6 1 x USB-Kabel\nMTBF: 30,000 Stunde(n)\nKennzeichnung: TUV Rheinland Low Blue Light Certification\nSchlosstyp zur Diebstahlsicherung: Kensington Slot\nEingangsspannung: Wechselstrom 100-240 V (50/60 Hz)\nStromverbrauch SDR (eingeschaltet): 21 kWh/1.000 h\nStromverbrauch HDR (eingeschaltet): 40 kWh/1.000 h\nStromverbrauch (typisch): 21 Watt\nStromverbrauch im Standby-Modus: 0.5 Watt\nStromverbrauch (Aus-Modus): 0.3 Watt\nDetails zu Abmessungen & Gewicht: Mit Fu\u00df - Breite: 61.511 cm - Tiefe: 19.363 cm - H\u00f6he: 53.566 cm - Gewicht: 5.2 kg \u00a6 Ohne Fu\u00df - Breite: 61.511 cm - Tiefe: 4.221 cm - H\u00f6he: 36.735 cm - Gewicht: 3.5 kg\nTransportbreite: 72 cm\nTransporttiefe: 20 cm\nTransporth\u00f6he: 47 cm\nTransportgewicht: 7.8 kg\nService und Support: Begrenzte Garantie - 3 Jahre\nMin Betriebstemperatur: 0 \u00b0C\nMax. Betriebstemperatur: 40 \u00b0C",
    "reference_file": "offer_reference_758.json",
    "shop_name": "ElectronicShop24"
}