{
    "html_file": "offer_2188_10.html",
    "name": "HANNspree HP248PJB, 23.8\"",
    "offer_link": "https://technikladen.at/P-Hannspree-HP248PJB-605-cm-238-Zoll-1920-x-1080-Pixel-Full-HD-LED-5-ms-Schwarz?tl=gzhls",
    "price": 135.51,
    "raw_specifications": {
        "AC Eingangsfrequenz": "50 - 60 Hz",
        "AC Eingangsspannung": "100 - 240 V",
        "AMD FreeSync": "Nein",
        "Abnehmbarer Standfu\u00df": "Ja",
        "Anzahl DisplayPort Anschl\u00fcsse": "1",
        "Anzahl HDMI-Anschl\u00fcsse": "1",
        "Anzahl OSD-Sprachen": "11",
        "Anzahl VGA (D-Sub) Anschl\u00fcsse": "1",
        "Anzahl der Farben des Displays": "16,78 Millionen Farben",
        "Anzahl der Lautsprecher": "2",
        "Bildschirmaufl\u00f6sung": "1920 x 1080 Pixel",
        "Bildschirmdiagonale": "60,5 cm",
        "Bildschirmform": "Flach",
        "Bildschirmtechnologie": "LED",
        "Blickwinkel, horizontal": "178 \u00b0",
        "Blickwinkel, vertikal": "178 \u00b0",
        "DVI Anschluss": "Nein",
        "Ein-/Ausschalter": "Ja",
        "Eingebaute Lautsprecher": "Ja",
        "Energieeffizienzklasse (SDR)": "F",
        "Energieeffizienzskala": "A bis G",
        "Energieverbrauch (SDR) pro 1.000 Stunden": "22 kWh",
        "Flimmerfreie Technologie": "Ja",
        "Fu\u00dffarbe": "Schwarz",
        "Ger\u00e4tebreite (inkl. Fu\u00df)": "527,5 mm",
        "Ger\u00e4teh\u00f6he (inkl. Fu\u00df)": "540 mm",
        "Ger\u00e4tetiefe (inkl. Fu\u00df)": "200 mm",
        "Gewicht (mit St\u00e4nder)": "5 kg",
        "HD-Typ": "Full HD",
        "HDMI": "Ja",
        "Helligkeit (typisch)": "250 cd/m\u00b2",
        "Horizontaler Scanbereich": "30 - 83 kHz",
        "H\u00f6heneinstellung": "12 cm",
        "H\u00f6henverstellung": "Ja",
        "Integrierte Kamera": "Nein",
        "Integrierter USB-Hub": "Nein",
        "Kabelsperre-Slot": "Ja",
        "Kontrastverh\u00e4ltnis": "1000:1",
        "Kontrastverh\u00e4ltnis (dynamisch)": "80000000:1",
        "Kopfh\u00f6rer-Konnektivit\u00e4t": "3,5 mm",
        "Kopfh\u00f6rerausgang": "Ja",
        "Kopfh\u00f6rerausg\u00e4nge": "1",
        "LED-Anzeigen": "Ja",
        "Low-Blue-Light-Technologie": "Ja",
        "Maximale Bildwiederholrate": "60 Hz",
        "Menge pro Packung": "1 St\u00fcck(e)",
        "Mitgelieferte Kabel": "AC, HDMI",
        "NVIDIA G-SYNC": "Nein",
        "Nachhaltigkeitszertifikate": "RoHS, ENERGY STAR",
        "Natives Seitenverh\u00e4ltnis": "16:9",
        "Neigungswinkelbereich": "-5 - 20 \u00b0",
        "On-Screen-Display (OSD)": "Ja",
        "Paketgewicht": "6,1 kg",
        "Panel-Montage-Schnittstelle": "100 x 100 mm",
        "Panel-Typ": "TFT/PLS",
        "Pivot": "Ja",
        "Pivot Winkel": "0 - 90 \u00b0",
        "Pixel Abstand": "0,274 x 0,274 mm",
        "Plug & Play": "Ja",
        "Produktfarbe": "Schwarz",
        "RMS-Leistung": "4 W",
        "Reaktionszeit": "5 ms",
        "Schnellstart\u00fcbersicht": "Ja",
        "Schwenkbar": "Ja",
        "Schwenkwinkelbereich": "0 - 360 \u00b0",
        "Slot-Typ Kabelsperre": "Kensington",
        "Spiel-Modus": "Ja",
        "Stromverbrauch (Standardbetrieb)": "12,58 W",
        "Stromverbrauch (Standby)": "0,34 W",
        "Stromverbrauch (aus)": "0,21 W",
        "St\u00e4nder enthalten": "Ja",
        "TV Tuner integriert": "Nein",
        "Unterst\u00fctzte Video-Modi": "1080p",
        "VESA-Halterung": "Ja",
        "Verpackungsbreite": "635 mm",
        "Verpackungsh\u00f6he": "402 mm",
        "Verpackungstiefe": "165 mm",
        "Vertikaler Scanbereich": "56 - 75 Hz",
        "kippbar": "Ja"
    },
    "raw_specifications_text": "NVIDIA G-SYNC: Nein\nAMD FreeSync: Nein\nFlimmerfreie Technologie: Ja\nLow-Blue-Light-Technologie: Ja\nSpiel-Modus: Ja\nBildschirmdiagonale: 60,5 cm\nBildschirmaufl\u00f6sung: 1920 x 1080 Pixel\nNatives Seitenverh\u00e4ltnis: 16:9\nPanel-Typ: TFT/PLS\nHelligkeit (typisch): 250 cd/m\u00b2\nReaktionszeit: 5 ms\nHD-Typ: Full HD\nBildschirmtechnologie: LED\nBildschirmform: Flach\nUnterst\u00fctzte Video-Modi: 1080p\nKontrastverh\u00e4ltnis: 1000:1\nKontrastverh\u00e4ltnis (dynamisch): 80000000:1\nMaximale Bildwiederholrate: 60 Hz\nBlickwinkel, horizontal: 178 \u00b0\nBlickwinkel, vertikal: 178 \u00b0\nAnzahl der Farben des Displays: 16,78 Millionen Farben\nPixel Abstand: 0,274 x 0,274 mm\nHorizontaler Scanbereich: 30 - 83 kHz\nVertikaler Scanbereich: 56 - 75 Hz\nIntegrierter USB-Hub: Nein\nAnzahl VGA (D-Sub) Anschl\u00fcsse: 1\nDVI Anschluss: Nein\nHDMI: Ja\nAnzahl HDMI-Anschl\u00fcsse: 1\nAnzahl DisplayPort Anschl\u00fcsse: 1\nKopfh\u00f6rerausgang: Ja\nKopfh\u00f6rerausg\u00e4nge: 1\nKopfh\u00f6rer-Konnektivit\u00e4t: 3,5 mm\nVESA-Halterung: Ja\nPanel-Montage-Schnittstelle: 100 x 100 mm\nKabelsperre-Slot: Ja\nSlot-Typ Kabelsperre: Kensington\nH\u00f6henverstellung: Ja\nH\u00f6heneinstellung: 12 cm\nPivot: Ja\nPivot Winkel: 0 - 90 \u00b0\nSchwenkbar: Ja\nSchwenkwinkelbereich: 0 - 360 \u00b0\nkippbar: Ja\nNeigungswinkelbereich: -5 - 20 \u00b0\nOn-Screen-Display (OSD): Ja\nAnzahl OSD-Sprachen: 11\nPlug & Play: Ja\nLED-Anzeigen: Ja\nEingebaute Lautsprecher: Ja\nIntegrierte Kamera: Nein\nAnzahl der Lautsprecher: 2\nRMS-Leistung: 4 W\nProduktfarbe: Schwarz\nAbnehmbarer Standfu\u00df: Ja\nFu\u00dffarbe: Schwarz\nSt\u00e4nder enthalten: Ja\nMitgelieferte Kabel: AC, HDMI\nSchnellstart\u00fcbersicht: Ja\nVerpackungsbreite: 635 mm\nVerpackungstiefe: 165 mm\nVerpackungsh\u00f6he: 402 mm\nPaketgewicht: 6,1 kg\nMenge pro Packung: 1 St\u00fcck(e)\nEnergieeffizienzklasse (SDR): F\nEnergieverbrauch (SDR) pro 1.000 Stunden: 22 kWh\nStromverbrauch (Standardbetrieb): 12,58 W\nStromverbrauch (Standby): 0,34 W\nStromverbrauch (aus): 0,21 W\nAC Eingangsspannung: 100 - 240 V\nAC Eingangsfrequenz: 50 - 60 Hz\nEnergieeffizienzskala: A bis G\nEin-/Ausschalter: Ja\nTV Tuner integriert: Nein\nGer\u00e4tebreite (inkl. Fu\u00df): 527,5 mm\nGer\u00e4tetiefe (inkl. Fu\u00df): 200 mm\nGer\u00e4teh\u00f6he (inkl. Fu\u00df): 540 mm\nGewicht (mit St\u00e4nder): 5 kg\nNachhaltigkeitszertifikate: RoHS, ENERGY STAR",
    "reference_file": "offer_reference_2188.json",
    "shop_name": "TechnikLaden"
}