{
    "html_file": "offer_556_19.html",
    "name": "AOC Q27P3CV, 27\"",
    "offer_link": "https://www.electronicshop24.at/product_info.php?products_id=110000000873334498&ano=F873334498&mno=Q27P3CV&ean=4038986180740&utm_medium=cpc&utm_campaign=preisvergleich&utm_content=item&utm_source=geizhals&ref=geizhals",
    "price": 304.0,
    "raw_specifications": {
        "Ausgangsleistung/Kanal": "2 Watt",
        "Besonderheiten": "Flimmerfreie Technologie, Low Blue Light-Technologie, an 3 Seiten rahmenlos",
        "Bildschirmbeschichtung": "Blendfrei, 3H Hard Coating",
        "Bildschirmtyp": "IPS",
        "Diagonalabmessung": "68.6 cm (27\")",
        "Display-Typ": "LED-hintergrundbeleuchteter LCD-Monitor / TFT-Aktivmatrix",
        "Eingangsspannung": "Wechselstrom 100-240 V (50/60 Hz)",
        "Einstellungen der Anzeigeposition": "H\u00f6he, Pivot (Rotation), Drehung, Neigung",
        "Enthaltene Kabel": "1 x HDMI-Kabel - 1.8 m \u00a6 1 x DisplayPort-Kabel - 1.8 m \u00a6 1 x Kabel USB-C auf USB-C / USB-A - 1.2 m",
        "Farbe": "Schwarz",
        "Farbunterst\u00fctzung": "16,7 Millionen Farben",
        "Helligkeit": "350 cd/m\u00b2",
        "Hintergrundbeleuchtungs-Technologie": "WLED",
        "Horizontaler Betrachtungswinkel": "178",
        "H\u00f6heneinstellung": "150 mm",
        "Integrierte Peripherieger\u00e4te": "USB Hub, Ethernet-Netzwerkadapter",
        "Kennzeichnung": "HF",
        "Kontrast": "1000:1 / 20000000:1 (dynamisch)",
        "Leistungsmerkmale": "Slot f\u00fcr Sicherheitsschloss (Kabelschloss getrennt erh\u00e4ltlich), strukturierte Oberfl\u00e4che",
        "Native Aufl\u00f6sung": "QHD 2560 x 1080 bei 75 Hz",
        "Neigungswinkel": "-5/+35",
        "OSD-Sprachen": "Tschechisch, Kroatisch, Chinesisch (tradionell), Chinesisch (vereinfacht), Englisch, Deutsch, Franz\u00f6sisch, Italienisch, Portugiesisch, Polnisch, Finnisch, Schwedisch, Russisch, Spanisch, Holl\u00e4ndisch, Japanisch",
        "Pixelpitch": "0.2331 mm",
        "Ppi": "109",
        "Reaktionszeit": "4 ms (gray-to-gray)",
        "Rotationswinkel": "180",
        "Schlosstyp zur Diebstahlsicherung": "Kensington Slot",
        "Schnittstellen": "2 x HDMI 1.4 \u00a6 DisplayPort 1.2 \u00a6 USB-C 3.2 (DisplayPort Alt Mode, Daten, Leistung bis zu 65 W) \u00a6 4 x USB Downstream (Schnellladung) \u00a6 Kopfh\u00f6rer (Mini-Klinkenstecker) \u00a6 LAN (RJ-45)",
        "Schwenkwinkel": "360",
        "Seitenverh\u00e4ltnis": "16:9",
        "Service und Support": "Begrenzte Garantie - 3 Jahre",
        "TCO-zertifiziert": "TCO Certified Displays 9",
        "Typ": "Lautsprecher - Stereo",
        "USB-Spannungsversorgung": "65 Watt",
        "VESA-Halterung": "100 x 100 mm",
        "Vertikaler Betrachtungswinkel": "178"
    },
    "raw_specifications_text": "Display-Typ: LED-hintergrundbeleuchteter LCD-Monitor / TFT-Aktivmatrix\nDiagonalabmessung: 68.6 cm (27\")\nIntegrierte Peripherieger\u00e4te: USB Hub, Ethernet-Netzwerkadapter\nUSB-Spannungsversorgung: 65 Watt\nBildschirmtyp: IPS\nSeitenverh\u00e4ltnis: 16:9\nNative Aufl\u00f6sung: QHD 2560 x 1080 bei 75 Hz\nPixelpitch: 0.2331 mm\nPpi: 109\nHelligkeit: 350 cd/m\u00b2\nKontrast: 1000:1 / 20000000:1 (dynamisch)\nFarbunterst\u00fctzung: 16,7 Millionen Farben\nReaktionszeit: 4 ms (gray-to-gray)\nHorizontaler Betrachtungswinkel: 178\nVertikaler Betrachtungswinkel: 178\nBildschirmbeschichtung: Blendfrei, 3H Hard Coating\nHintergrundbeleuchtungs-Technologie: WLED\nOSD-Sprachen: Tschechisch, Kroatisch, Chinesisch (tradionell), Chinesisch (vereinfacht), Englisch, Deutsch, Franz\u00f6sisch, Italienisch, Portugiesisch, Polnisch, Finnisch, Schwedisch, Russisch, Spanisch, Holl\u00e4ndisch, Japanisch\nBesonderheiten: Flimmerfreie Technologie, Low Blue Light-Technologie, an 3 Seiten rahmenlos\nFarbe: Schwarz\nTyp: Lautsprecher - Stereo\nAusgangsleistung/Kanal: 2 Watt\nSchnittstellen: 2 x HDMI 1.4 \u00a6 DisplayPort 1.2 \u00a6 USB-C 3.2 (DisplayPort Alt Mode, Daten, Leistung bis zu 65 W) \u00a6 4 x USB Downstream (Schnellladung) \u00a6 Kopfh\u00f6rer (Mini-Klinkenstecker) \u00a6 LAN (RJ-45)\nEinstellungen der Anzeigeposition: H\u00f6he, Pivot (Rotation), Drehung, Neigung\nNeigungswinkel: -5/+35\nSchwenkwinkel: 360\nRotationswinkel: 180\nH\u00f6heneinstellung: 150 mm\nVESA-Halterung: 100 x 100 mm\nLeistungsmerkmale: Slot f\u00fcr Sicherheitsschloss (Kabelschloss getrennt erh\u00e4ltlich), strukturierte Oberfl\u00e4che\nEnthaltene Kabel: 1 x HDMI-Kabel - 1.8 m \u00a6 1 x DisplayPort-Kabel - 1.8 m \u00a6 1 x Kabel USB-C auf USB-C / USB-A - 1.2 m\nKennzeichnung: HF\nSchlosstyp zur Diebstahlsicherung: Kensington Slot\nEingangsspannung: Wechselstrom 100-240 V (50/60 Hz)\nTCO-zertifiziert: TCO Certified Displays 9\nService und Support: Begrenzte Garantie - 3 Jahre",
    "reference_file": "offer_reference_556.json",
    "shop_name": "ElectronicShop24"
}