{
    "html_file": "offer_1043_22.html",
    "name": "Dell C2723H, 27\"",
    "offer_link": "https://www.hiq24.de/shop/artikel/319789/?sPartner=geizhals",
    "price": 255.9,
    "raw_specifications": {
        "Abmessungen (Breite x Tiefe x H\u00f6he)": "48.93 cm x 17.31 cm x 40.51 cm - mit Fu\u00df",
        "Abmessungen (Breite x Tiefe x H\u00f6he) - mit Fu\u00df": "48.93 cm x 17.31 cm x 40.51 cm",
        "Adaptive-Sync Technologie": "AMD FreeSync",
        "Besonderheiten": "Blendfreie, an 3 Seiten ohne Blende",
        "Bildschirmtyp": "VA",
        "Details zu Abmessungen & Gewicht": "Mit Fu\u00df - Breite: 48.93 cm - Tiefe: 17.31 cm - H\u00f6he: 40.51 cm - Gewicht: 3.14 kg  Ohne Fu\u00df - Breite: 48.93 cm - Tiefe: 4.55 cm - H\u00f6he: 29.68 cm - Gewicht: 2.39 kg",
        "Diagonalabmessung": "54.6 cm (21.5\")",
        "Display-Typ": "LED-hintergrundbeleuchteter LCD-Monitor / TFT-Aktivmatrix",
        "ENERGY STAR zertifiziert": "Ja",
        "ENERGY STAR-Version": "8.0",
        "EPEAT-kompatibel": "EPEAT Gold",
        "Eingangsanschl\u00fcsse": "HDMI, VGA",
        "Eingangsspannung": "Wechselstrom 100-240 V (50/60 Hz)",
        "Einstellungen der Anzeigeposition": "Neigung",
        "Energie Effizienzklasse": "Klasse E",
        "Enthaltene Kabel": "1 x HDMI-Kabel - 1.8 m",
        "Erforderliches Betriebssystem": "Microsoft Windows 7 / 10",
        "Farbe": "Raven Black",
        "Farbraum": "72% NTSC",
        "Farbunterst\u00fctzung": "16,7 Millionen Farben",
        "Ger\u00e4tetyp": "LED-hintergrundbeleuchteter LCD-Monitor - 54.6 cm (21.5\")",
        "Gewicht": "3.14 kg",
        "Helligkeit": "250 cd/m\u00b2",
        "Hintergrundbeleuchtungs-Technologie": "WLED",
        "Horizontaler Betrachtungswinkel": "178",
        "Kennzeichnung": "RoHS, TUV Rheinland Low Blue Light Certification, TUV Rheinland Flicker Free Certification, China Energy standard Tier 2",
        "Kontrast": "3000:1 / 3000000:1 (dynamisch)",
        "Leistungsaufnahme im Ein-Zustand": "16 W",
        "Leistungsmerkmale": "Slot f\u00fcr Sicherheitsschloss (Kabelschloss getrennt erh\u00e4ltlich), integrierte Kabelf\u00fchrung",
        "Lokalisierung": "Englisch / Europa",
        "Native Aufl\u00f6sung": "Full HD (1080p) 1920 x 1080 bei 75 Hz",
        "Neigungswinkel": "-5/+22",
        "Pixelpitch": "0.248 mm",
        "Ppi": "102",
        "Produktbeschreibung": "Lenovo ThinkVision S22e-20 - LED-Monitor - Full HD (1080p) - 54.6 cm (21.5\")",
        "Reaktionszeit": "4 ms (extrem), 6 ms (typisch)",
        "Schlosstyp zur Diebstahlsicherung": "Kensington Slot",
        "Schnittstellen": "HDMI  VGA (HD-15)  Kopfh\u00f6rer",
        "Seitenverh\u00e4ltnis": "16:9",
        "Spannung": "Wechselstrom 100-240 V (50/60 Hz)",
        "Stromverbrauch (Aus-Modus)": "0.3 Watt",
        "Stromverbrauch (typisch)": "15 Watt",
        "Stromverbrauch SDR (eingeschaltet)": "16 kWh/1.000 h",
        "Stromverbrauch im Standby-Modus": "0.3 Watt",
        "TCO-zertifiziert": "TCO Certified Displays 8, TCO Certified Edge Displays",
        "Transportbreite": "58.7 cm",
        "Transportgewicht": "4.68 kg",
        "Transporth\u00f6he": "35.2 cm",
        "Transporttiefe": "14 cm",
        "Umweltschutzstandards": "TCO Certified Displays 8, TCO Certified Edge Displays, ENERGY STAR-qualifiziert EPEAT Gold",
        "VESA-Halterung": "100 x 100 mm",
        "Vertikaler Betrachtungswinkel": "178"
    },
    "raw_specifications_text": "Display-Typ: LED-hintergrundbeleuchteter LCD-Monitor / TFT-Aktivmatrix\nEnergie Effizienzklasse: Klasse E\nDiagonalabmessung: 54.6 cm (21.5\")\nAdaptive-Sync Technologie: AMD FreeSync\nBildschirmtyp: VA\nSeitenverh\u00e4ltnis: 16:9\nNative Aufl\u00f6sung: Full HD (1080p) 1920 x 1080 bei 75 Hz\nPixelpitch: 0.248 mm\nPpi: 102\nHelligkeit: 250 cd/m\u00b2\nKontrast: 3000:1 / 3000000:1 (dynamisch)\nFarbunterst\u00fctzung: 16,7 Millionen Farben\nFarbraum: 72% NTSC\nReaktionszeit: 4 ms (extrem), 6 ms (typisch)\nHorizontaler Betrachtungswinkel: 178\nVertikaler Betrachtungswinkel: 178\nHintergrundbeleuchtungs-Technologie: WLED\nBesonderheiten: Blendfreie, an 3 Seiten ohne Blende\nFarbe: Raven Black\nAbmessungen (Breite x Tiefe x H\u00f6he): 48.93 cm x 17.31 cm x 40.51 cm - mit Fu\u00df\nGewicht: 3.14 kg\nSchnittstellen: HDMI  VGA (HD-15)  Kopfh\u00f6rer\nEinstellungen der Anzeigeposition: Neigung\nNeigungswinkel: -5/+22\nVESA-Halterung: 100 x 100 mm\nLeistungsmerkmale: Slot f\u00fcr Sicherheitsschloss (Kabelschloss getrennt erh\u00e4ltlich), integrierte Kabelf\u00fchrung\nEnthaltene Kabel: 1 x HDMI-Kabel - 1.8 m\nKennzeichnung: RoHS, TUV Rheinland Low Blue Light Certification, TUV Rheinland Flicker Free Certification, China Energy standard Tier 2\nLokalisierung: Englisch / Europa\nSchlosstyp zur Diebstahlsicherung: Kensington Slot\nEingangsspannung: Wechselstrom 100-240 V (50/60 Hz)\nLeistungsaufnahme im Ein-Zustand: 16 W\nStromverbrauch SDR (eingeschaltet): 16 kWh/1.000 h\nStromverbrauch (typisch): 15 Watt\nStromverbrauch im Standby-Modus: 0.3 Watt\nStromverbrauch (Aus-Modus): 0.3 Watt\nErforderliches Betriebssystem: Microsoft Windows 7 / 10\nDetails zu Abmessungen & Gewicht: Mit Fu\u00df - Breite: 48.93 cm - Tiefe: 17.31 cm - H\u00f6he: 40.51 cm - Gewicht: 3.14 kg  Ohne Fu\u00df - Breite: 48.93 cm - Tiefe: 4.55 cm - H\u00f6he: 29.68 cm - Gewicht: 2.39 kg\nTransportbreite: 58.7 cm\nTransporttiefe: 14 cm\nTransporth\u00f6he: 35.2 cm\nTransportgewicht: 4.68 kg\nTCO-zertifiziert: TCO Certified Displays 8, TCO Certified Edge Displays\nEPEAT-kompatibel: EPEAT Gold\nENERGY STAR zertifiziert: Ja\nENERGY STAR-Version: 8.0\nProduktbeschreibung: Lenovo ThinkVision S22e-20 - LED-Monitor - Full HD (1080p) - 54.6 cm (21.5\")\nGer\u00e4tetyp: LED-hintergrundbeleuchteter LCD-Monitor - 54.6 cm (21.5\")\nEingangsanschl\u00fcsse: HDMI, VGA\nSpannung: Wechselstrom 100-240 V (50/60 Hz)\nAbmessungen (Breite x Tiefe x H\u00f6he) - mit Fu\u00df: 48.93 cm x 17.31 cm x 40.51 cm\nUmweltschutzstandards: TCO Certified Displays 8, TCO Certified Edge Displays, ENERGY STAR-qualifiziert EPEAT Gold",
    "reference_file": "offer_reference_1043.json",
    "shop_name": "HiQ24"
}