{
    "html_file": "offer_963_11.html",
    "name": "Samsung Smart Monitor M8 M80B Spring Green, 32\"",
    "offer_link": "https://www.future-x.at/samsung-s32bm80guu-m8-series-led-monitor-smart-80-cm-32-3840-x-2160-4k-%40-60-hz-va-400-cd-m%B2-3000%3A1-hdr10-hdr10%2B-4-ms-micro-hdmi-usb-c-lautsprecher-gr%FCn-p-9057258/?pv=2",
    "price": 427.69,
    "raw_specifications": {
        "Abmessungen (Breite x Tiefe x H\u00f6he)": "71,34 cm x 20,38 cm x 57,52 cm - mit Fu\u00df",
        "Besonderheiten": "Spielmodus, ConnectShare, flimmerfreie Technologie, Eye Saver Mode, Werkstuning, DLNA, Auto Source Switch+, Adaptive Picture, Ultrawide Game View, Tizen Platform, Tap View, Remote Access, Sound Mirroring, SmartThings App Support, Game Bar 2.0, Adaptive Sound+, Far-Field Voice Interaction",
        "Bildschirmtyp": "VA",
        "Details zu Abmessungen & Gewicht": "Mit Fu\u00df - Breite: 71,34 cm - Tiefe: 20,38 cm - H\u00f6he: 57,52 cm - Gewicht: 6,7 kg \u00a6 Ohne Fu\u00df - Breite: 71,34 cm - Tiefe: 2,23 cm - H\u00f6he: 41,88 cm - Gewicht: 4,4 kg",
        "Diagonalabmessung": "80 cm (32\")",
        "Display-Typ": "LED-hintergrundbeleuchteter LCD-Monitor / TFT-Aktivmatrix - Smart Monitor",
        "Eingangsspannung": "Wechselstrom 100-240 V (50/60 Hz)",
        "Einstellungen der Anzeigeposition": "H\u00f6he, Neigung",
        "Energie Effizienzklasse": "Klasse G",
        "Energieklasse (HDR)": "Klasse G",
        "Energieverbrauch pro Jahr": "58 kWh",
        "Enthaltene Kabel": "1 x Micro-HDMI-an-HDMI-Kabel \u00a6 1 x USB-C Kabel",
        "Farbe": "Gr\u00fcn",
        "Farbraum": "99% sRGB",
        "Farbunterst\u00fctzung": "1 Milliarde Farben",
        "Gewicht": "6,7 kg",
        "HDR-Format": "HDR10, HDR10+",
        "Helligkeit": "400 cd/m\u00b2",
        "Hintergrundbeleuchtungs-Technologie": "LED-Hintergrundbeleuchtung",
        "Horizontaler Betrachtungswinkel": "178",
        "H\u00f6heneinstellung": "120 mm",
        "Integrierte Peripherieger\u00e4te": "USB Hub, 802.11a/b/g/n/ac Netzwerkadapter, Bluetooth 4.2 Adapter",
        "Kennzeichnung": "ISO 9241-307 Class 2",
        "Kontrast": "3000:1",
        "Leistungsmerkmale": "Bixby Voice Assistant, AirPlay 2, Amazon Alexa Voice Assistant",
        "Max. Betriebstemperatur": "40 \u00b0C",
        "Min Betriebstemperatur": "10 \u00b0C",
        "Mitgelieferte Software": "Google Assistant",
        "Native Aufl\u00f6sung": "4K 3840 x 2160 bei 60 Hz",
        "Neigungswinkel": "-2/+15",
        "Pixelpitch": "0.1845 mm",
        "Reaktionszeit": "4 ms (gray-to-gray)",
        "Schnittstellen": "Micro HDMI (HDCP 2.2) \u00a6 USB-C 3.0 (bis zu 65 W)",
        "Seitenverh\u00e4ltnis": "16:9",
        "Service und Support": "Begrenzte Garantie - 2 Jahre",
        "Stromverbrauch (typisch)": "40 Watt",
        "Stromverbrauch HDR (eingeschaltet)": "75 kWh/1.000 h",
        "Stromverbrauch SDR (eingeschaltet)": "40 kWh/1.000 h",
        "Stromverbrauch im Standby-Modus": "0.5 Watt",
        "Transportbreite": "79,8 cm",
        "Transportgewicht": "9,4 kg",
        "Transporth\u00f6he": "56,8 cm",
        "Transporttiefe": "12,4 cm",
        "Typ": "Lautsprecher",
        "USB-Spannungsversorgung": "65 Watt",
        "Vertikaler Betrachtungswinkel": "178",
        "Zubeh\u00f6r im Lieferumfang": "Fernbedienung, SlimFit Camera",
        "Zul\u00e4ssige Luftfeuchtigkeit im Betrieb": "10 - 80% (nicht kondensierend)"
    },
    "raw_specifications_text": "Display-Typ: LED-hintergrundbeleuchteter LCD-Monitor / TFT-Aktivmatrix - Smart Monitor\nEnergie Effizienzklasse: Klasse G\nEnergieklasse (HDR): Klasse G\nEnergieverbrauch pro Jahr: 58 kWh\nDiagonalabmessung: 80 cm (32\")\nIntegrierte Peripherieger\u00e4te: USB Hub, 802.11a/b/g/n/ac Netzwerkadapter, Bluetooth 4.2 Adapter\nUSB-Spannungsversorgung: 65 Watt\nBildschirmtyp: VA\nSeitenverh\u00e4ltnis: 16:9\nNative Aufl\u00f6sung: 4K 3840 x 2160 bei 60 Hz\nPixelpitch: 0.1845 mm\nHelligkeit: 400 cd/m\u00b2\nKontrast: 3000:1\nHDR-Format: HDR10, HDR10+\nFarbunterst\u00fctzung: 1 Milliarde Farben\nFarbraum: 99% sRGB\nReaktionszeit: 4 ms (gray-to-gray)\nHorizontaler Betrachtungswinkel: 178\nVertikaler Betrachtungswinkel: 178\nHintergrundbeleuchtungs-Technologie: LED-Hintergrundbeleuchtung\nBesonderheiten: Spielmodus, ConnectShare, flimmerfreie Technologie, Eye Saver Mode, Werkstuning, DLNA, Auto Source Switch+, Adaptive Picture, Ultrawide Game View, Tizen Platform, Tap View, Remote Access, Sound Mirroring, SmartThings App Support, Game Bar 2.0, Adaptive Sound+, Far-Field Voice Interaction\nFarbe: Gr\u00fcn\nAbmessungen (Breite x Tiefe x H\u00f6he): 71,34 cm x 20,38 cm x 57,52 cm - mit Fu\u00df\nGewicht: 6,7 kg\nTyp: Lautsprecher\nSchnittstellen: Micro HDMI (HDCP 2.2) \u00a6 USB-C 3.0 (bis zu 65 W)\nEinstellungen der Anzeigeposition: H\u00f6he, Neigung\nNeigungswinkel: -2/+15\nH\u00f6heneinstellung: 120 mm\nLeistungsmerkmale: Bixby Voice Assistant, AirPlay 2, Amazon Alexa Voice Assistant\nZubeh\u00f6r im Lieferumfang: Fernbedienung, SlimFit Camera\nEnthaltene Kabel: 1 x Micro-HDMI-an-HDMI-Kabel \u00a6 1 x USB-C Kabel\nKennzeichnung: ISO 9241-307 Class 2\nEingangsspannung: Wechselstrom 100-240 V (50/60 Hz)\nStromverbrauch SDR (eingeschaltet): 40 kWh/1.000 h\nStromverbrauch HDR (eingeschaltet): 75 kWh/1.000 h\nStromverbrauch (typisch): 40 Watt\nStromverbrauch im Standby-Modus: 0.5 Watt\nMitgelieferte Software: Google Assistant\nDetails zu Abmessungen & Gewicht: Mit Fu\u00df - Breite: 71,34 cm - Tiefe: 20,38 cm - H\u00f6he: 57,52 cm - Gewicht: 6,7 kg \u00a6 Ohne Fu\u00df - Breite: 71,34 cm - Tiefe: 2,23 cm - H\u00f6he: 41,88 cm - Gewicht: 4,4 kg\nTransportbreite: 79,8 cm\nTransporttiefe: 12,4 cm\nTransporth\u00f6he: 56,8 cm\nTransportgewicht: 9,4 kg\nService und Support: Begrenzte Garantie - 2 Jahre\nMin Betriebstemperatur: 10 \u00b0C\nMax. Betriebstemperatur: 40 \u00b0C\nZul\u00e4ssige Luftfeuchtigkeit im Betrieb: 10 - 80% (nicht kondensierend)",
    "reference_file": "offer_reference_963.json",
    "shop_name": "Future-X.at"
}