{
    "html_file": "offer_880_7.html",
    "name": "ASUS VA24EQSB, 23.8\"",
    "offer_link": "https://www.playox.de/productredirect/index/sku/24044577?sPartner=p-geizhals-at&campaign=psm/geizhals-at/",
    "price": 146.11,
    "raw_specifications": {
        "Anschl\u00fcsse": "USB, DisplayPort, HDMI, Kopfh\u00f6reranschluss, VGA/D-Sub, Audioausgang (Line-Out)",
        "Artikelnummer": "24044577",
        "Aufl\u00f6sung Kurzname": "Full HD",
        "Bezeichnung des Herstellers": "ASUS VA24EQSB Eye-Care",
        "Bildwiederholungsrate": "75,00 Hz",
        "Breite": "5404,00 mm",
        "Display Features": "FlickerFree",
        "Display Sync": "Adaptive Sync",
        "Displaygr\u00f6\u00dfe": "60,96 cm (24 Zoll)",
        "EEK - Spektrum": "AG",
        "Einsatzort": "Innen",
        "Energieeffizienzklasse": "E",
        "Geh\u00e4usefarbe des Ger\u00e4tes": "Schwarz",
        "Gewicht": "5,20 kg",
        "Gewicht inkl. Verpackung in Kg": "0,00 kg",
        "Helligkeit Bereich": "300 - 450 cd/m\u00b2",
        "Hersteller": "ASUS",
        "H\u00f6he": "4508,00 mm",
        "Kapazit\u00e4t (Seiten)": "0",
        "Kontrastverh\u00e4ltnis (typisch) Bereich": "800:1 bis 1.200:1",
        "LCD-Technologie": "IPS Panel",
        "L\u00e4nge": "2114,00 mm",
        "Produktart": "Monitore",
        "Reaktionszeit": "5,00 ms",
        "Seitenverh\u00e4ltnis": "16:9",
        "Shop Herstellernummer": "90LM056F-B01170",
        "Standard-EAN": "4711081557265",
        "Verbindungen": "Netzwerk (LAN)",
        "max. Aufl\u00f6sung": "1.920 x 1.080 Pixel (16:9)"
    },
    "raw_specifications_text": "Geh\u00e4usefarbe des Ger\u00e4tes: Schwarz\nAnschl\u00fcsse: USB, DisplayPort, HDMI, Kopfh\u00f6reranschluss, VGA/D-Sub, Audioausgang (Line-Out)\nGewicht: 5,20 kg\nProduktart: Monitore\nDisplaygr\u00f6\u00dfe: 60,96 cm (24 Zoll)\nDisplay Features: FlickerFree\nKontrastverh\u00e4ltnis (typisch) Bereich: 800:1 bis 1.200:1\nHelligkeit Bereich: 300 - 450 cd/m\u00b2\nVerbindungen: Netzwerk (LAN)\nHersteller: ASUS\nDisplay Sync: Adaptive Sync\nGewicht inkl. Verpackung in Kg: 0,00 kg\nKapazit\u00e4t (Seiten): 0\nAufl\u00f6sung Kurzname: Full HD\nEEK - Spektrum: AG\nBreite: 5404,00 mm\nL\u00e4nge: 2114,00 mm\nArtikelnummer: 24044577\nStandard-EAN: 4711081557265\nShop Herstellernummer: 90LM056F-B01170\nBezeichnung des Herstellers: ASUS VA24EQSB Eye-Care\nH\u00f6he: 4508,00 mm\nmax. Aufl\u00f6sung: 1.920 x 1.080 Pixel (16:9)\nSeitenverh\u00e4ltnis: 16:9\nLCD-Technologie: IPS Panel\nReaktionszeit: 5,00 ms\nBildwiederholungsrate: 75,00 Hz\nEinsatzort: Innen\nEnergieeffizienzklasse: E",
    "reference_file": "offer_reference_880.json",
    "shop_name": "playox (AT)"
}