{
    "html_file": "offer_803_1.html",
    "name": "AOC Q27V5CW/BK, 27\"",
    "offer_link": "https://www.ba-computer.at/aoc-value-line-q27v5cw-bk-v5-series-led-monitor-68-6-cm-27-q27v5cw-bk.html",
    "price": 268.6,
    "raw_specifications": {
        "Abmessungen (Breite x Tiefe x H\u00f6he)": "61.3 cm x 20 cm x 53.07 cm - mit Standfu\u00df (h\u00f6chste Position)",
        "Adaptive-Sync Technologie": "AMD FreeSync",
        "Ausgangsleistung/Kanal": "10 Watt",
        "Besonderheiten": "Flimmerfreie Technologie, Low Blue Light-Technologie, Windows 10 Hello, an 3 Seiten rahmenlos",
        "Bildschirmbeschichtung": "Anti-glare 3H hardness",
        "Bildschirmtyp": "IPS",
        "Details zu Abmessungen & Gewicht": "Mit Standfu\u00df (h\u00f6chste Position) - Breite: 61.3 cm - Tiefe: 20 cm - H\u00f6he: 53.07 cm - Gewicht: 6.64 kg \u00a6 Mit Standfu\u00df (niedrigste Position) - Breite: 61.3 cm - Tiefe: 20 cm - H\u00f6he: 40.07 cm - Gewicht: 6.64 kg \u00a6 Ohne Fu\u00df - Breite: 61.3 cm - Tiefe: 4.46 cm - H\u00f6he: 37.75 cm",
        "Diagonalabmessung": "68.6 cm (27\")",
        "Display-Typ": "LED-hintergrundbeleuchteter LCD-Monitor / TFT-Aktivmatrix",
        "ENERGY STAR zertifiziert": "Ja",
        "Eingangsspannung": "Wechselstrom 100-240 V (50/60 Hz)",
        "Einstellungen der Anzeigeposition": "H\u00f6he, Pivot (Rotation), Drehung, Neigung",
        "Enthaltene Kabel": "1 x HDMI-Kabel - 1.5 m \u00a6 Kabel USB-C auf USB-C / USB-A",
        "Farbe": "Schwarz",
        "Farbraum": "126% sRGB (CIE 1931), 94% Adobe RGB (CIE 1931), 85% NTSC (CIE 1931)",
        "Farbunterst\u00fctzung": "16,7 Millionen Farben",
        "Gewicht": "6.64 kg",
        "Helligkeit": "300 cd/m\u00b2",
        "Hintergrundbeleuchtungs-Technologie": "WLED",
        "Horizontaler Betrachtungswinkel": "178",
        "H\u00f6heneinstellung": "130 mm",
        "Integrierte Peripherieger\u00e4te": "USB 3.1 Gen.1 Hub, Webcam",
        "Kontrast": "1000:1 / 20000000:1 (dynamisch)",
        "Leistungsmerkmale": "Slot f\u00fcr Sicherheitsschloss (Kabelschloss getrennt erh\u00e4ltlich)",
        "Native Aufl\u00f6sung": "QHD 2560 x 1440 bei 75 Hz",
        "Neigungswinkel": "3.5/21.5",
        "OSD-Sprachen": "Multilingual",
        "Pixelpitch": "0.2331 mm",
        "Ppi": "109",
        "Reaktionszeit": "4 ms (gray-to-gray), 1 ms (MPRT)",
        "Schlosstyp zur Diebstahlsicherung": "Kensington Slot",
        "Schnittstellen": "HDMI \u00a6 DisplayPort 1.2 \u00a6 USB-C/DisplayPort Alt Mode (bis zu 65 W) \u00a6 4 x USB 3.1 Gen 1 \u00a6 Kopfh\u00f6rer",
        "Schwenkwinkel": "28",
        "Seitenverh\u00e4ltnis": "16:9",
        "Service und Support": "Begrenzte Garantie - 3 Jahre",
        "Stromverbrauch (Aus-Modus)": "0.5 Watt",
        "Stromverbrauch (typisch)": "40 Watt",
        "Stromverbrauch im Standby-Modus": "0.5 Watt",
        "Transportbreite": "84 cm",
        "Transportgewicht": "9.18 kg",
        "Transporth\u00f6he": "45.6 cm",
        "Transporttiefe": "14.1 cm",
        "Typ": "Lautsprecher - Stereo",
        "USB-Spannungsversorgung": "65 Watt",
        "VESA-Halterung": "100 x 100 mm",
        "Vertikaler Betrachtungswinkel": "178"
    },
    "raw_specifications_text": "Display-Typ: LED-hintergrundbeleuchteter LCD-Monitor / TFT-Aktivmatrix\nDiagonalabmessung: 68.6 cm (27\")\nAdaptive-Sync Technologie: AMD FreeSync\nIntegrierte Peripherieger\u00e4te: USB 3.1 Gen.1 Hub, Webcam\nUSB-Spannungsversorgung: 65 Watt\nBildschirmtyp: IPS\nSeitenverh\u00e4ltnis: 16:9\nNative Aufl\u00f6sung: QHD 2560 x 1440 bei 75 Hz\nPixelpitch: 0.2331 mm\nPpi: 109\nHelligkeit: 300 cd/m\u00b2\nKontrast: 1000:1 / 20000000:1 (dynamisch)\nFarbunterst\u00fctzung: 16,7 Millionen Farben\nFarbraum: 126% sRGB (CIE 1931), 94% Adobe RGB (CIE 1931), 85% NTSC (CIE 1931)\nReaktionszeit: 4 ms (gray-to-gray), 1 ms (MPRT)\nHorizontaler Betrachtungswinkel: 178\nVertikaler Betrachtungswinkel: 178\nBildschirmbeschichtung: Anti-glare 3H hardness\nHintergrundbeleuchtungs-Technologie: WLED\nOSD-Sprachen: Multilingual\nBesonderheiten: Flimmerfreie Technologie, Low Blue Light-Technologie, Windows 10 Hello, an 3 Seiten rahmenlos\nFarbe: Schwarz\nAbmessungen (Breite x Tiefe x H\u00f6he): 61.3 cm x 20 cm x 53.07 cm - mit Standfu\u00df (h\u00f6chste Position)\nGewicht: 6.64 kg\nTyp: Lautsprecher - Stereo\nAusgangsleistung/Kanal: 10 Watt\nSchnittstellen: HDMI \u00a6 DisplayPort 1.2 \u00a6 USB-C/DisplayPort Alt Mode (bis zu 65 W) \u00a6 4 x USB 3.1 Gen 1 \u00a6 Kopfh\u00f6rer\nEinstellungen der Anzeigeposition: H\u00f6he, Pivot (Rotation), Drehung, Neigung\nNeigungswinkel: 3.5/21.5\nSchwenkwinkel: 28\nH\u00f6heneinstellung: 130 mm\nVESA-Halterung: 100 x 100 mm\nLeistungsmerkmale: Slot f\u00fcr Sicherheitsschloss (Kabelschloss getrennt erh\u00e4ltlich)\nEnthaltene Kabel: 1 x HDMI-Kabel - 1.5 m \u00a6 Kabel USB-C auf USB-C / USB-A\nSchlosstyp zur Diebstahlsicherung: Kensington Slot\nEingangsspannung: Wechselstrom 100-240 V (50/60 Hz)\nStromverbrauch (typisch): 40 Watt\nStromverbrauch im Standby-Modus: 0.5 Watt\nStromverbrauch (Aus-Modus): 0.5 Watt\nDetails zu Abmessungen & Gewicht: Mit Standfu\u00df (h\u00f6chste Position) - Breite: 61.3 cm - Tiefe: 20 cm - H\u00f6he: 53.07 cm - Gewicht: 6.64 kg \u00a6 Mit Standfu\u00df (niedrigste Position) - Breite: 61.3 cm - Tiefe: 20 cm - H\u00f6he: 40.07 cm - Gewicht: 6.64 kg \u00a6 Ohne Fu\u00df - Breite: 61.3 cm - Tiefe: 4.46 cm - H\u00f6he: 37.75 cm\nTransportbreite: 84 cm\nTransporttiefe: 14.1 cm\nTransporth\u00f6he: 45.6 cm\nTransportgewicht: 9.18 kg\nENERGY STAR zertifiziert: Ja\nService und Support: Begrenzte Garantie - 3 Jahre",
    "reference_file": "offer_reference_803.json",
    "shop_name": "BA-Computer"
}