{
    "html_file": "offer_1290_20.html",
    "name": "ViewSonic VG2456, 23.8\"",
    "offer_link": "https://www.ba-computer.at/viewsonic-vg2456-led-monitor-61-cm-24-23-8-sichtbar-vg2456.html",
    "price": 308.86,
    "raw_specifications": {
        "Abmessungen (Breite x Tiefe x H\u00f6he)": "53.9 cm x 20.2 cm x 40.619 cm - mit Fu\u00df",
        "Ausgangsleistung/Kanal": "2 Watt",
        "Besonderheiten": "Traggriff, SuperClear, integrierte Kabelf\u00fchrung, flimmerfreie Technologie, TMDS-Technologie (Transition Minimized Differential Signaling), Blaulichtfilter-Technologie, Composite Sync, ViewMode, an 3 Seiten rahmenlos",
        "Bildschirmtyp": "IPS",
        "Details zu Abmessungen & Gewicht": "Mit Fu\u00df - Breite: 53.9 cm - Tiefe: 20.2 cm - H\u00f6he: 40.619 cm - Gewicht: 6.4 kg \u00a6 Ohne Fu\u00df - Breite: 53.9 cm - Tiefe: 5.2 cm - H\u00f6he: 32 cm - Gewicht: 4 kg",
        "Diagonalabmessung": "61 cm (24\")",
        "Display-Typ": "LED-hintergrundbeleuchteter LCD-Monitor / TFT-Aktivmatrix",
        "ENERGY STAR zertifiziert": "Ja",
        "ENERGY STAR-Version": "8.0",
        "Eingangsspannung": "Wechselstrom 100-240 V (50/60 Hz)",
        "Einstellungen der Anzeigeposition": "H\u00f6he, Pivot (Rotation), Drehung, Neigung",
        "Farbraum": "102% sRGB, 72% NTSC",
        "Farbunterst\u00fctzung": "16,7 Millionen Farben",
        "Gewicht": "6.4 kg",
        "Helligkeit": "250 cd/m\u00b2",
        "Hintergrundbeleuchtungs-Technologie": "LED-Hintergrundbeleuchtung",
        "Horizontale Bildwiederholrate": "15 - 82 kHz",
        "Horizontaler Betrachtungswinkel": "178",
        "H\u00f6heneinstellung": "130 mm",
        "Integrierte Peripherieger\u00e4te": "USB 3.1 Gen.1 Hub",
        "Kennzeichnung": "FCC Klasse B bescheinigt, CB, EMC, RoHS, WEEE, cTUVus, REACH, UkrSEPRO, ERP, EAC, BIS, Mexico Energy label, Mexico CoC, UKCA",
        "Kontrast": "1000:1 / 50000000:1 (dynamisch)",
        "Lebensdauer der Beleuchtung": "30,000 Stunden",
        "Leistungsmerkmale": "Slot f\u00fcr Sicherheitsschloss (Kabelschloss getrennt erh\u00e4ltlich)",
        "Max. Betriebstemperatur": "40 \u00b0C",
        "Min Betriebstemperatur": "0 \u00b0C",
        "Native Aufl\u00f6sung": "Full HD (1080p) 1920 x 1080",
        "Neigungswinkel": "-5/+40",
        "Pixelpitch": "0.275 mm",
        "Reaktionszeit": "5 ms (Gray-to-Gray)",
        "Rotationswinkel": "180",
        "Schlosstyp zur Diebstahlsicherung": "Kensington Slot",
        "Schnittstellen": "HDMI \u00a6 DisplayPort \u00a6 DisplayPort-Ausgang \u00a6 USB-C 3.1 Gen 1 \u00a6 2 x USB 3.1 Gen 1 Downstream (Typ A) \u00a6 USB 3.1 Gen 1 Upstream (Typ B) \u00a6 LAN (RJ-45)",
        "Schwenkwinkel": "120",
        "Seitenverh\u00e4ltnis": "16:9",
        "Service und Support": "Begrenzte Garantie - Arbeitszeit und Ersatzteile - 3 Jahre \u00a6 Begrenzte Garantie - Leuchtpult - 3 Jahre",
        "Sichtbare Bildfl\u00e4che": "60.5 cm (23.8\")",
        "Stromverbrauch (max.)": "17.4 Watt",
        "Stromverbrauch (typisch)": "13.7 Watt",
        "Stromverbrauch im Standby-Modus": "0.3 Watt",
        "Transportbreite": "59.5 cm",
        "Transportgewicht": "9.4 kg",
        "Transporth\u00f6he": "39.6 cm",
        "Transporttiefe": "21 cm",
        "Typ": "Lautsprecher - Stereo",
        "VESA-Halterung": "100 x 100 mm",
        "Vertikale Bildwiederholrate": "50 - 75 Hz",
        "Vertikaler Betrachtungswinkel": "178",
        "Zul\u00e4ssige Luftfeuchtigkeit im Betrieb": "20 - 90% (nicht kondensierend)"
    },
    "raw_specifications_text": "Display-Typ: LED-hintergrundbeleuchteter LCD-Monitor / TFT-Aktivmatrix\nDiagonalabmessung: 61 cm (24\")\nSichtbare Bildfl\u00e4che: 60.5 cm (23.8\")\nIntegrierte Peripherieger\u00e4te: USB 3.1 Gen.1 Hub\nBildschirmtyp: IPS\nSeitenverh\u00e4ltnis: 16:9\nNative Aufl\u00f6sung: Full HD (1080p) 1920 x 1080\nPixelpitch: 0.275 mm\nHelligkeit: 250 cd/m\u00b2\nKontrast: 1000:1 / 50000000:1 (dynamisch)\nFarbunterst\u00fctzung: 16,7 Millionen Farben\nFarbraum: 102% sRGB, 72% NTSC\nReaktionszeit: 5 ms (Gray-to-Gray)\nVertikale Bildwiederholrate: 50 - 75 Hz\nHorizontale Bildwiederholrate: 15 - 82 kHz\nHorizontaler Betrachtungswinkel: 178\nVertikaler Betrachtungswinkel: 178\nHintergrundbeleuchtungs-Technologie: LED-Hintergrundbeleuchtung\nBesonderheiten: Traggriff, SuperClear, integrierte Kabelf\u00fchrung, flimmerfreie Technologie, TMDS-Technologie (Transition Minimized Differential Signaling), Blaulichtfilter-Technologie, Composite Sync, ViewMode, an 3 Seiten rahmenlos\nAbmessungen (Breite x Tiefe x H\u00f6he): 53.9 cm x 20.2 cm x 40.619 cm - mit Fu\u00df\nGewicht: 6.4 kg\nTyp: Lautsprecher - Stereo\nAusgangsleistung/Kanal: 2 Watt\nSchnittstellen: HDMI \u00a6 DisplayPort \u00a6 DisplayPort-Ausgang \u00a6 USB-C 3.1 Gen 1 \u00a6 2 x USB 3.1 Gen 1 Downstream (Typ A) \u00a6 USB 3.1 Gen 1 Upstream (Typ B) \u00a6 LAN (RJ-45)\nEinstellungen der Anzeigeposition: H\u00f6he, Pivot (Rotation), Drehung, Neigung\nNeigungswinkel: -5/+40\nSchwenkwinkel: 120\nRotationswinkel: 180\nH\u00f6heneinstellung: 130 mm\nVESA-Halterung: 100 x 100 mm\nLeistungsmerkmale: Slot f\u00fcr Sicherheitsschloss (Kabelschloss getrennt erh\u00e4ltlich)\nLebensdauer der Beleuchtung: 30,000 Stunden\nKennzeichnung: FCC Klasse B bescheinigt, CB, EMC, RoHS, WEEE, cTUVus, REACH, UkrSEPRO, ERP, EAC, BIS, Mexico Energy label, Mexico CoC, UKCA\nSchlosstyp zur Diebstahlsicherung: Kensington Slot\nEingangsspannung: Wechselstrom 100-240 V (50/60 Hz)\nStromverbrauch (typisch): 13.7 Watt\nStromverbrauch (max.): 17.4 Watt\nStromverbrauch im Standby-Modus: 0.3 Watt\nDetails zu Abmessungen & Gewicht: Mit Fu\u00df - Breite: 53.9 cm - Tiefe: 20.2 cm - H\u00f6he: 40.619 cm - Gewicht: 6.4 kg \u00a6 Ohne Fu\u00df - Breite: 53.9 cm - Tiefe: 5.2 cm - H\u00f6he: 32 cm - Gewicht: 4 kg\nTransportbreite: 59.5 cm\nTransporttiefe: 21 cm\nTransporth\u00f6he: 39.6 cm\nTransportgewicht: 9.4 kg\nENERGY STAR zertifiziert: Ja\nENERGY STAR-Version: 8.0\nService und Support: Begrenzte Garantie - Arbeitszeit und Ersatzteile - 3 Jahre \u00a6 Begrenzte Garantie - Leuchtpult - 3 Jahre\nMin Betriebstemperatur: 0 \u00b0C\nMax. Betriebstemperatur: 40 \u00b0C\nZul\u00e4ssige Luftfeuchtigkeit im Betrieb: 20 - 90% (nicht kondensierend)",
    "reference_file": "offer_reference_1290.json",
    "shop_name": "BA-Computer"
}