{
    "html_file": "offer_1692_13.html",
    "name": "iiyama G-Master G2770HSU-B1 Red Eagle, 27\"",
    "offer_link": "https://www.mylemon.at/artikel/iiyama/g2770hsu_b1/27-g2770hsu-b1-hdmi-dp.html",
    "price": 189.57,
    "raw_specifications": {
        "AC Eingangsfrequenz": "50 - 60 Hz",
        "AC Eingangsspannung": "100 - 240 V",
        "AMD FreeSync": "Ja",
        "AMD FreeSync-Typ": "FreeSync Premium",
        "Abnehmbarer Standfu\u00df": "Ja",
        "Anzahl DisplayPort Anschl\u00fcsse": "1",
        "Anzahl HDMI-Anschl\u00fcsse": "1",
        "Anzahl OSD-Sprachen": "11",
        "Anzahl der Farben des Displays": "16,7 Millionen Farben",
        "Anzahl der Lautsprecher": "2",
        "Anzahl der nachgeschalteten Steckpl\u00e4tze vom Typ USB-A": "2",
        "Artikelnummer": "M14YMDCL",
        "Audioanschl\u00fcsse": "Nein",
        "Aufl\u00f6sung": "1920x1080",
        "Bildschirmdiagonale": "68,6 cm (27\")",
        "Bildschirmdiagonale (cm)": "68,6 cm",
        "Bildschirmform": "Flach",
        "Bildschirmtechnologie": "LED",
        "Bildwinkel, horizontal": "178\u00b0",
        "Bildwinkel, vertikal": "178\u00b0",
        "DVI Anschluss": "Nein",
        "Display-Aufl\u00f6sung": "1920 x 1080 Pixel",
        "Display-Oberfl\u00e4che": "Matt",
        "DisplayPorts-Version": "1.2",
        "Displaygr\u00f6\u00dfe": "27 Zoll",
        "EAN": "4948570117741",
        "Eingebaute Lautsprecher": "Ja",
        "Energieeffizienzklasse (SDR)": "E",
        "Energieeffizienzskala": "A bis G",
        "Energieverbrauch (SDR) pro 1.000 Stunden": "19 kWh",
        "Flimmerfreie Technologie": "Ja",
        "Fu\u00dffarbe": "Schwarz",
        "Ger\u00e4tebreite (inkl. Fu\u00df)": "612,5 mm",
        "Ger\u00e4teh\u00f6he (inkl. Fu\u00df)": "435,5 mm",
        "Ger\u00e4tetiefe (inkl. Fu\u00df)": "187,5 mm",
        "Gewicht (mit St\u00e4nder)": "4 kg",
        "HD-Typ": "Full HD",
        "HDCP": "Ja",
        "HDMI": "Ja",
        "HDMI-Version": "1.4",
        "Helligkeit": "250 cd/m\u00b2",
        "Helligkeit (typisch)": "250 cd/m\u00b2",
        "Hersteller Artikelnummer": "G2770HSU-B1",
        "Horizontaler Scanbereich": "15 - 225 kHz",
        "Integrierte Kamera": "Nein",
        "Integrierter USB-Hub": "Ja",
        "Kabelsperre-Slot": "Ja",
        "Kontrastverh\u00e4ltnis": "1100:1",
        "Kontrastverh\u00e4ltnis (dynamisch)": "80000000:1",
        "Kopfh\u00f6rerausgang": "Ja",
        "Kopfh\u00f6rerausg\u00e4nge": "1",
        "LED-Anzeigen": "Ja",
        "Low-Blue-Light-Technologie": "Ja",
        "Marktpositionierung": "Gaming",
        "Maximale Bildwiederholrate": "165 Hz",
        "Men\u00fcsprachen": "Tschechisch, Deutsch, Niederl\u00e4ndisch, Englisch, Spanisch, Franz\u00f6sisch, Italienisch, Japanisch, Polnisch, Portugiesisch, Russisch",
        "Mitgelieferte Kabel": "AC, DisplayPort, HDMI, USB",
        "Nachhaltigkeitskonformit\u00e4t": "Ja",
        "Nachhaltigkeitszertifikate": "CE, REACH",
        "Natives Seitenverh\u00e4ltnis": "16:9",
        "Neigungsverstellung": "Ja",
        "Neigungswinkelbereich": "-3,5 - 21,5\u00b0",
        "On-Screen-Display (OSD)": "Ja",
        "Paketgewicht": "6,1 kg",
        "Panel": "IPS",
        "Panel-Montage-Schnittstelle": "100 x 100 mm",
        "Panel-Typ": "IPS",
        "Pixel Abstand": "0,311 x 0,311 mm",
        "Produktfarbe": "Schwarz",
        "RMS-Leistung": "4 W",
        "Reaktionszeit": "0,8 ms",
        "Schnellstart\u00fcbersicht": "Ja",
        "Sichtbare Gr\u00f6\u00dfe (horizontal)": "59,8 cm",
        "Sichtbare Gr\u00f6\u00dfe (vertikal)": "33,6 cm",
        "Slot-Typ Kabelsperre": "Kensington",
        "Smart-Modi": "Spiel",
        "Stromverbrauch (Standardbetrieb)": "22 W",
        "Stromverbrauch (Standby)": "0,5 W",
        "Stromverbrauch (aus)": "0,3 W",
        "St\u00e4nder enthalten": "Ja",
        "Touchscreen": "Nein",
        "USB-Hub-Version": "2.0",
        "VESA Halterung": "100x100 mm",
        "VESA-Halterung": "Ja",
        "Verpackungsbreite": "690 mm",
        "Verpackungsh\u00f6he": "475 mm",
        "Verpackungstiefe": "160 mm",
        "Vertikaler Scanbereich": "48 - 165 Hz",
        "Video Anschl\u00fcsse": "1x HDMI, 1x DisplayPort",
        "WLAN": "Nein",
        "Warentarifnummer (HS)": "85285210",
        "Zertifizierung": "CE, T\u00dcV-Bauart, EAC, PSE, RoHS, ErP, WEEE, VCCI, REACH"
    },
    "raw_specifications_text": "Displaygr\u00f6\u00dfe: 27 Zoll\nAufl\u00f6sung: 1920x1080\nPanel: IPS\nVideo Anschl\u00fcsse: 1x HDMI, 1x DisplayPort\nVESA Halterung: 100x100 mm\nHelligkeit: 250 cd/m\u00b2\nHersteller Artikelnummer: G2770HSU-B1\nEAN: 4948570117741\nArtikelnummer: M14YMDCL\nBildschirmdiagonale: 68,6 cm (27\")\nDisplay-Aufl\u00f6sung: 1920 x 1080 Pixel\nNatives Seitenverh\u00e4ltnis: 16:9\nBildschirmtechnologie: LED\nTouchscreen: Nein\nHD-Typ: Full HD\nPanel-Typ: IPS\nBildschirmform: Flach\nKontrastverh\u00e4ltnis: 1100:1\nMaximale Bildwiederholrate: 165 Hz\nAnzahl der Farben des Displays: 16,7 Millionen Farben\nHelligkeit (typisch): 250 cd/m\u00b2\nReaktionszeit: 0,8 ms\nDisplay-Oberfl\u00e4che: Matt\nKontrastverh\u00e4ltnis (dynamisch): 80000000:1\nBildwinkel, horizontal: 178\u00b0\nBildwinkel, vertikal: 178\u00b0\nPixel Abstand: 0,311 x 0,311 mm\nHorizontaler Scanbereich: 15 - 225 kHz\nVertikaler Scanbereich: 48 - 165 Hz\nSichtbare Gr\u00f6\u00dfe (horizontal): 59,8 cm\nSichtbare Gr\u00f6\u00dfe (vertikal): 33,6 cm\nBildschirmdiagonale (cm): 68,6 cm\nAMD FreeSync: Ja\nAMD FreeSync-Typ: FreeSync Premium\nFlimmerfreie Technologie: Ja\nLow-Blue-Light-Technologie: Ja\nSmart-Modi: Spiel\nEingebaute Lautsprecher: Ja\nIntegrierte Kamera: Nein\nAnzahl der Lautsprecher: 2\nRMS-Leistung: 4 W\nMarktpositionierung: Gaming\nProduktfarbe: Schwarz\nAbnehmbarer Standfu\u00df: Ja\nFu\u00dffarbe: Schwarz\nZertifizierung: CE, T\u00dcV-Bauart, EAC, PSE, RoHS, ErP, WEEE, VCCI, REACH\nIntegrierter USB-Hub: Ja\nHDMI: Ja\nKopfh\u00f6rerausgang: Ja\nUSB-Hub-Version: 2.0\nAnzahl der nachgeschalteten Steckpl\u00e4tze vom Typ USB-A: 2\nDVI Anschluss: Nein\nAnzahl HDMI-Anschl\u00fcsse: 1\nHDMI-Version: 1.4\nAnzahl DisplayPort Anschl\u00fcsse: 1\nDisplayPorts-Version: 1.2\nAudioanschl\u00fcsse: Nein\nKopfh\u00f6rerausg\u00e4nge: 1\nHDCP: Ja\nWLAN: Nein\nVESA-Halterung: Ja\nKabelsperre-Slot: Ja\nPanel-Montage-Schnittstelle: 100 x 100 mm\nSlot-Typ Kabelsperre: Kensington\nNeigungswinkelbereich: -3,5 - 21,5\u00b0\nOn-Screen-Display (OSD): Ja\nMen\u00fcsprachen: Tschechisch, Deutsch, Niederl\u00e4ndisch, Englisch, Spanisch, Franz\u00f6sisch, Italienisch, Japanisch, Polnisch, Portugiesisch, Russisch\nAnzahl OSD-Sprachen: 11\nLED-Anzeigen: Ja\nNeigungsverstellung: Ja\nEnergieeffizienzklasse (SDR): E\nEnergieverbrauch (SDR) pro 1.000 Stunden: 19 kWh\nStromverbrauch (Standardbetrieb): 22 W\nStromverbrauch (Standby): 0,5 W\nStromverbrauch (aus): 0,3 W\nAC Eingangsspannung: 100 - 240 V\nAC Eingangsfrequenz: 50 - 60 Hz\nEnergieeffizienzskala: A bis G\nSt\u00e4nder enthalten: Ja\nMitgelieferte Kabel: AC, DisplayPort, HDMI, USB\nSchnellstart\u00fcbersicht: Ja\nGer\u00e4tebreite (inkl. Fu\u00df): 612,5 mm\nGer\u00e4tetiefe (inkl. Fu\u00df): 187,5 mm\nGer\u00e4teh\u00f6he (inkl. Fu\u00df): 435,5 mm\nGewicht (mit St\u00e4nder): 4 kg\nVerpackungsbreite: 690 mm\nVerpackungstiefe: 160 mm\nVerpackungsh\u00f6he: 475 mm\nPaketgewicht: 6,1 kg\nNachhaltigkeitskonformit\u00e4t: Ja\nNachhaltigkeitszertifikate: CE, REACH\nWarentarifnummer (HS): 85285210",
    "reference_file": "offer_reference_1692.json",
    "shop_name": "mylemon.at"
}