{
    "html_file": "offer_2228_8.html",
    "name": "Dell UltraSharp U4919DW, 49\"",
    "offer_link": "https://syswork.at/sw/index.html?open&mid=Artikel&artid=mon-0665&from=geizhals.at",
    "price": 1161.0,
    "raw_specifications": {
        "AC Eingangsfrequenz": "50 - 60 Hz",
        "AC Eingangsspannung": "100 - 240 V",
        "Anzahl DisplayPort Anschl\u00fcsse": "1",
        "Anzahl HDMI-Anschl\u00fcsse": "2",
        "Anzahl der Farben des Displays": "1,073 Milliarden Farben",
        "Anzahl der nachgeschalteten Ports vom Typ USB-C": "1",
        "Anzahl der nachgeschalteten Steckpl\u00e4tze vom Typ USB-A": "5",
        "Anzahl der vorgeschalteten Steckpl\u00e4tze": "2",
        "Audioanschl\u00fcsse": "Nein",
        "Betriebsanleitung": "Ja",
        "Betriebstemperatur": "0 - 40 \u00b0C",
        "Bewertung der Bildschirmkr\u00fcmmung": "3800R",
        "Bezel Weite (bottom)": "1,74 cm",
        "Bezel Weite (side)": "1,1 cm",
        "Bezel Weite (top)": "1,22 cm",
        "Bild f\u00fcr Bild (PbP)": "Ja",
        "Bildschirmaufl\u00f6sung": "5120 x 1440 Pixel",
        "Bildschirmdiagonale": "124,5 cm (49 Zoll)",
        "Bildschirmform": "Gebogen",
        "Bildschirmkr\u00fcmmung": "3,8 m",
        "Bildschirmtechnologie": "LCD",
        "Bildwinkel, horizontal": "178\u00b0",
        "Bildwinkel, vertikal": "178\u00b0",
        "Breite (ohne Standfu\u00df)": "121,5 cm",
        "DDC/CI": "Ja",
        "DVI Anschluss": "Nein",
        "Datenblatt": "Kein Datenblatt verf\u00fcgbar",
        "Dell Display Manager (DDM)-kompatibel": "Ja",
        "Dell E-Value Code": "u4919dw",
        "DisplayPorts-Version": "1.4",
        "Ein-/Ausschalter": "Ja",
        "Eingangsstrom": "3 A",
        "Eingebaute Lautsprecher": "Nein",
        "Energieeffizienzklasse (SDR)": "G",
        "Energieeffizienzskala": "A bis G",
        "Energieverbrauch (SDR) pro 1.000 Stunden": "47 kWh",
        "Enth\u00e4lt nicht": "PVC",
        "Fu\u00dffarbe": "Schwarz/Silber",
        "Garantieverl\u00e4ngerung auf 5 Jahre+ \u20ac 84,90 = \u20ac 1.245,90 Zusammen in den Warenkorb legen": "Garantieverl\u00e4ngerung auf 5 Jahre+ \u20ac 84,90 = \u20ac 1.245,90 Zusammen in den Warenkorb legen",
        "Ger\u00e4tebreite (inkl. Fu\u00df)": "1215,1 mm",
        "Ger\u00e4teh\u00f6he (inkl. Fu\u00df)": "458,6 mm",
        "Ger\u00e4tetiefe (inkl. Fu\u00df)": "252,6 mm",
        "Gewicht (mit St\u00e4nder)": "17,2 kg",
        "Gewicht (ohne St\u00e4nder)": "11,4 kg",
        "HD-Typ": "UltraWide Dual Quad HD",
        "HDCP": "Ja",
        "HDMI": "Ja",
        "HDMI-Version": "2.0",
        "Helligkeit (typisch)": "350 cd/m\u00b2",
        "Herstellerlink": "Dell",
        "H\u00f6he (ohne Standfu\u00df)": "37,1 cm",
        "H\u00f6he bei Betrieb": "0 - 3048 m",
        "H\u00f6he bei Lagerung": "3048 - 12192 m",
        "H\u00f6heneinstellung": "9 cm",
        "H\u00f6henverstellung": "Ja",
        "Integrierte Kamera": "Nein",
        "Integrierter USB-Hub": "Ja",
        "Kabelsperre-Slot": "Ja",
        "Kontrastverh\u00e4ltnis": "1000:1",
        "Kopfh\u00f6rerausgang": "Nein",
        "Luftfeuchtigkeit bei Lagerung": "10 - 90%",
        "Marktpositionierung": "Business",
        "Maximale Bildwiederholrate": "60 Hz",
        "Mitgelieferte Kabel": "AC, DisplayPort, HDMI, USB, USB Typ-C",
        "Nachhaltigkeitszertifikate": "RoHS, EPEAT Gold, ENERGY STAR",
        "Name der Farbe": "Silver",
        "Natives Seitenverh\u00e4ltnis": "32:9",
        "Neigungswinkelbereich": "-5 - 21\u00b0",
        "On-Screen-Display (OSD)": "Ja",
        "Paketgewicht": "26,4 kg",
        "Panel-Montage-Schnittstelle": "100 x 100 mm",
        "Panel-Typ": "IPS",
        "Pixel Abstand": "0,234 x 0,234 mm",
        "Pixeldichte": "109 ppi",
        "Plug & Play": "Ja",
        "Produktfarbe": "Schwarz, Silber",
        "Produktlink": "Link",
        "RGB-Farbraum": "sRGB",
        "Reaktionszeit": "8 ms",
        "Reaktionszeit (schnell)": "5 ms",
        "Relative Luftfeuchtigkeit in Betrieb": "20 - 80%",
        "Schnellstart\u00fcbersicht": "Ja",
        "Schwenkbar": "Ja",
        "Schwenkwinkelbereich": "-170 - 170\u00b0",
        "Seitenverh\u00e4ltnis": "32:9",
        "Sichtbare Gr\u00f6\u00dfe (diagonal)": "124,5 cm",
        "Sichtbare Gr\u00f6\u00dfe (horizontal)": "119,8 cm",
        "Sichtbare Gr\u00f6\u00dfe (vertikal)": "33,7 cm",
        "Slot-Typ Kabelsperre": "Kensington",
        "Stromeingang": "Ja",
        "Stromverbrauch (PowerSave)": "35,25 W",
        "Stromverbrauch (Standardbetrieb)": "47 W",
        "Stromverbrauch (Standby)": "0,4 W",
        "Stromverbrauch (aus)": "0,2 W",
        "Stromverbrauch (max.)": "230 W",
        "St\u00e4nder enthalten": "Ja",
        "TV Tuner integriert": "Nein",
        "Temperaturbereich bei Lagerung": "-20 - 60 \u00b0C",
        "Tiefe (ohne Standfu\u00df)": "10,9 cm",
        "Typ der Hintergrundbeleuchtung": "W-LED",
        "USB Power Delivery": "Ja",
        "USB-Hub-Version": "3.2 Gen 1 (3.1 Gen 1)",
        "USB-Typ-C DisplayPort-Wechselmodus": "Ja",
        "USB-Upstream-Porttyp": "USB Typ-B",
        "Unterst\u00fctzte Grafik-Aufl\u00f6sungen": "5120 x 1440",
        "Unterst\u00fctzte Video-Modi": "480p,576p,720p,1080i,1080p",
        "VESA-Halterung": "Ja",
        "Verpackungsart": "Box",
        "Verpackungsbreite": "325,1 mm",
        "Verpackungsh\u00f6he": "532,9 mm",
        "Verpackungstiefe": "1404,9 mm",
        "Vertikaler Scanbereich": "24 - 86 Hz",
        "Zertifizierung": "TCO",
        "kippbar": "Ja",
        "sRGB Abdeckung (klassisch)": "99%",
        "\u20ac 182,00 \tinkl. Ustzuzgl. Versandkosten Neomounts by Newstar Select Tischhalterung F\u00fcr Curved MonitoreNeomounts by Newstar Select Tischhalterung F\u00fcr Curved Monitore, Klemme /Bolzen, 18 kg, 25,4 cm (10 Zoll), 124,5 cm (49 Zoll), 100 x 100 mm, Schwarz Versandlager:Graz:  5-9 Werktage ab Bestellung5-9 Werktage ab Bestellung  \u00a0Stk.  In den Warenkorb": "\u20ac 182,00 \tinkl. Ustzuzgl. Versandkosten"
    },
    "raw_specifications_text": "Bildschirmdiagonale: 124,5 cm (49 Zoll)\nBildschirmaufl\u00f6sung: 5120 x 1440 Pixel\nNatives Seitenverh\u00e4ltnis: 32:9\nPanel-Typ: IPS\nHD-Typ: UltraWide Dual Quad HD\nBildschirmtechnologie: LCD\nBildschirmform: Gebogen\nKontrastverh\u00e4ltnis: 1000:1\nMaximale Bildwiederholrate: 60 Hz\nAnzahl der Farben des Displays: 1,073 Milliarden Farben\nHelligkeit (typisch): 350 cd/m\u00b2\nReaktionszeit: 8 ms\nTyp der Hintergrundbeleuchtung: W-LED\nBewertung der Bildschirmkr\u00fcmmung: 3800R\nBildschirmkr\u00fcmmung: 3,8 m\nUnterst\u00fctzte Grafik-Aufl\u00f6sungen: 5120 x 1440\nUnterst\u00fctzte Video-Modi: 480p,576p,720p,1080i,1080p\nSeitenverh\u00e4ltnis: 32:9\nBildwinkel, horizontal: 178\u00b0\nBildwinkel, vertikal: 178\u00b0\nReaktionszeit (schnell): 5 ms\nPixel Abstand: 0,234 x 0,234 mm\nPixeldichte: 109 ppi\nVertikaler Scanbereich: 24 - 86 Hz\nSichtbare Gr\u00f6\u00dfe (horizontal): 119,8 cm\nSichtbare Gr\u00f6\u00dfe (vertikal): 33,7 cm\nSichtbare Gr\u00f6\u00dfe (diagonal): 124,5 cm\nDDC/CI: Ja\nRGB-Farbraum: sRGB\nsRGB Abdeckung (klassisch): 99%\nEingebaute Lautsprecher: Nein\nIntegrierte Kamera: Nein\nMarktpositionierung: Business\nProduktfarbe: Schwarz, Silber\nName der Farbe: Silver\nFu\u00dffarbe: Schwarz/Silber\nZertifizierung: TCO\nIntegrierter USB-Hub: Ja\nHDMI: Ja\nKopfh\u00f6rerausgang: Nein\nUSB-Hub-Version: 3.2 Gen 1 (3.1 Gen 1)\nUSB-Upstream-Porttyp: USB Typ-B\nAnzahl der vorgeschalteten Steckpl\u00e4tze: 2\nAnzahl der nachgeschalteten Steckpl\u00e4tze vom Typ USB-A: 5\nAnzahl der nachgeschalteten Ports vom Typ USB-C: 1\nUSB-Typ-C DisplayPort-Wechselmodus: Ja\nUSB Power Delivery: Ja\nDVI Anschluss: Nein\nAnzahl HDMI-Anschl\u00fcsse: 2\nHDMI-Version: 2.0\nAnzahl DisplayPort Anschl\u00fcsse: 1\nDisplayPorts-Version: 1.4\nAudioanschl\u00fcsse: Nein\nHDCP: Ja\nStromeingang: Ja\nVESA-Halterung: Ja\nKabelsperre-Slot: Ja\nH\u00f6henverstellung: Ja\nPanel-Montage-Schnittstelle: 100 x 100 mm\nSlot-Typ Kabelsperre: Kensington\nH\u00f6heneinstellung: 9 cm\nSchwenkbar: Ja\nSchwenkwinkelbereich: -170 - 170\u00b0\nkippbar: Ja\nNeigungswinkelbereich: -5 - 21\u00b0\nOn-Screen-Display (OSD): Ja\nPlug & Play: Ja\nDell Display Manager (DDM)-kompatibel: Ja\nEnergieeffizienzklasse (SDR): G\nEnergieverbrauch (SDR) pro 1.000 Stunden: 47 kWh\nStromverbrauch (Standardbetrieb): 47 W\nStromverbrauch (Standby): 0,4 W\nStromverbrauch (max.): 230 W\nStromverbrauch (aus): 0,2 W\nStromverbrauch (PowerSave): 35,25 W\nAC Eingangsspannung: 100 - 240 V\nAC Eingangsfrequenz: 50 - 60 Hz\nEingangsstrom: 3 A\nEnergieeffizienzskala: A bis G\nBetriebstemperatur: 0 - 40 \u00b0C\nTemperaturbereich bei Lagerung: -20 - 60 \u00b0C\nRelative Luftfeuchtigkeit in Betrieb: 20 - 80%\nLuftfeuchtigkeit bei Lagerung: 10 - 90%\nH\u00f6he bei Betrieb: 0 - 3048 m\nH\u00f6he bei Lagerung: 3048 - 12192 m\nNachhaltigkeitszertifikate: RoHS, EPEAT Gold, ENERGY STAR\nEnth\u00e4lt nicht: PVC\nGer\u00e4tebreite (inkl. Fu\u00df): 1215,1 mm\nGer\u00e4tetiefe (inkl. Fu\u00df): 252,6 mm\nGer\u00e4teh\u00f6he (inkl. Fu\u00df): 458,6 mm\nGewicht (mit St\u00e4nder): 17,2 kg\nBreite (ohne Standfu\u00df): 121,5 cm\nTiefe (ohne Standfu\u00df): 10,9 cm\nH\u00f6he (ohne Standfu\u00df): 37,1 cm\nGewicht (ohne St\u00e4nder): 11,4 kg\nBezel Weite (side): 1,1 cm\nBezel Weite (top): 1,22 cm\nBezel Weite (bottom): 1,74 cm\nSt\u00e4nder enthalten: Ja\nMitgelieferte Kabel: AC, DisplayPort, HDMI, USB, USB Typ-C\nSchnellstart\u00fcbersicht: Ja\nBetriebsanleitung: Ja\nVerpackungsbreite: 325,1 mm\nVerpackungstiefe: 1404,9 mm\nVerpackungsh\u00f6he: 532,9 mm\nPaketgewicht: 26,4 kg\nVerpackungsart: Box\nEin-/Ausschalter: Ja\nTV Tuner integriert: Nein\nBild f\u00fcr Bild (PbP): Ja\nDell E-Value Code: u4919dw\n\u20ac 182,00 \tinkl. Ustzuzgl. Versandkosten Neomounts by Newstar Select Tischhalterung F\u00fcr Curved MonitoreNeomounts by Newstar Select Tischhalterung F\u00fcr Curved Monitore, Klemme /Bolzen, 18 kg, 25,4 cm (10 Zoll), 124,5 cm (49 Zoll), 100 x 100 mm, Schwarz Versandlager:Graz:  5-9 Werktage ab Bestellung5-9 Werktage ab Bestellung  \u00a0Stk.  In den Warenkorb: \u20ac 182,00 \tinkl. Ustzuzgl. Versandkosten\nDatenblatt: Kein Datenblatt verf\u00fcgbar\nProduktlink: Link\nHerstellerlink: Dell\nGarantieverl\u00e4ngerung auf 5 Jahre+ \u20ac 84,90 = \u20ac 1.245,90 Zusammen in den Warenkorb legen: Garantieverl\u00e4ngerung auf 5 Jahre+ \u20ac 84,90 = \u20ac 1.245,90 Zusammen in den Warenkorb legen",
    "reference_file": "offer_reference_2228.json",
    "shop_name": "Syswork"
}