{
    "html_file": "offer_684_6.html",
    "name": "AOC Agon AG275QZ/EU, 27\"",
    "offer_link": "https://www.amazon.de/dp/B0BGCC3YFD?linkCode=xm2&camp=2025&creative=165953&smid=A3JWKAKR8XB7XF&creativeASIN=B0BGCC3YFD&tag=geizhals1-21",
    "price": 641.33,
    "raw_specifications": {
        "ASIN": "B0BGCC3YFD",
        "Amazon Bestseller-Rang": "Nr. 35,673 in Computer & Zubeh\u00f6r (Siehe Top 100 in Computer & Zubeh\u00f6r)  Nr. 708 in Monitore",
        "Anzahl HDMI Schnittstellen": "\u200e2",
        "Artikelgewicht": "\u200e7 Kilograms",
        "Batterien enthalten": "\u200eNein",
        "Bildschirmaufl\u00f6sung": "\u200e2560 x 1440",
        "Display-Gr\u00f6\u00dfe": "\u200e27 Zoll",
        "Durchschnittliche Kundenbewertung": "4,0  4,0 von 5 Sternen    \n    22 Sternebewertungen   \n\n\n 4,0 von 5 Sternen",
        "Farbe": "\u200eschwarz rot",
        "Garantierte Software-Updates bis": "\u200eunbekannt",
        "Hersteller": "\u200eAOC International",
        "Im Angebot von Amazon.de seit": "19. Oktober 2022",
        "L\u00f6sung": "\u200e2560 x 1440 Pixels",
        "Marke": "\u200eAOC",
        "Modellnummer": "\u200eAG275QZ/EU",
        "Produktabmessungen": "\u200e50 x 25 x 40 cm; 7 Kilogramm",
        "Prozessortyp": "\u200eOthers"
    },
    "raw_specifications_text": "Marke: \u200eAOC\nHersteller: \u200eAOC International\nProduktabmessungen: \u200e50 x 25 x 40 cm; 7 Kilogramm\nModellnummer: \u200eAG275QZ/EU\nFarbe: \u200eschwarz rot\nDisplay-Gr\u00f6\u00dfe: \u200e27 Zoll\nBildschirmaufl\u00f6sung: \u200e2560 x 1440\nL\u00f6sung: \u200e2560 x 1440 Pixels\nProzessortyp: \u200eOthers\nAnzahl HDMI Schnittstellen: \u200e2\nBatterien enthalten: \u200eNein\nArtikelgewicht: \u200e7 Kilograms\nGarantierte Software-Updates bis: \u200eunbekannt\nASIN: B0BGCC3YFD\nDurchschnittliche Kundenbewertung: 4,0  4,0 von 5 Sternen    \n    22 Sternebewertungen   \n\n\n 4,0 von 5 Sternen\nAmazon Bestseller-Rang: Nr. 35,673 in Computer & Zubeh\u00f6r (Siehe Top 100 in Computer & Zubeh\u00f6r)  Nr. 708 in Monitore\nIm Angebot von Amazon.de seit: 19. Oktober 2022",
    "reference_file": "offer_reference_684.json",
    "shop_name": "Amazon.at"
}