{
    "html_file": "offer_825_14.html",
    "name": "Fujitsu P-Line P2410 TS CAM, 23.8\"",
    "offer_link": "https://www.taufnaus.de/product/10602650",
    "price": 426.0,
    "raw_specifications": {
        "Abmessungen (Breite x Tiefe x H\u00f6he)": "53.912 cm x 21.27 cm x 35.47 cm - mit Fu\u00df",
        "Ausgangsleistung/Kanal": "2 Watt",
        "Besonderheiten": "Eco-Mode, Auto Brightness Control, ECO-Taste, DisplayView, Auto Pivot, Workplace Lighting Guide, 24/7 Betriebsmodus",
        "Bildschirmbeschichtung": "Blendfrei, 3H Hard Coating",
        "Bildschirmtyp": "IPS",
        "Details zu Abmessungen & Gewicht": "Mit Fu\u00df - Breite: 53.912 cm - Tiefe: 21.27 cm - H\u00f6he: 35.47 cm - Gewicht: 6 kg \u00a6 Ohne Fu\u00df - Breite: 53.912 cm - Tiefe: 5.923 cm - H\u00f6he: 32.059 cm - Gewicht: 4.1 kg",
        "Diagonalabmessung": "60.5 cm (23.8\")",
        "Display-Typ": "LED-hintergrundbeleuchteter LCD-Monitor",
        "ENERGY STAR zertifiziert": "Ja",
        "ENERGY STAR-Version": "8.0",
        "EPEAT-kompatibel": "EPEAT Silver",
        "Eingangsspannung": "Wechselstrom 100-240 V (50/60 Hz)",
        "Einstellungen der Anzeigeposition": "H\u00f6he, Pivot (Rotation), Drehung, Neigung",
        "Energie Effizienzklasse": "Klasse C",
        "Energierverbrauch Sleep": "0.26 Watt",
        "Energieverbrauch pro Jahr": "46.93 kWh",
        "Enthaltene Kabel": "1 x DisplayPort-Kabel - 1.8 m \u00a6 1 x USB-C Kabel - 1 m",
        "Farbe": "Mattschwarz",
        "Farbraum": "99% sRGB",
        "Farbtemperatur": "5000K, 6500K, 7500K",
        "Farbunterst\u00fctzung": "16,7 Millionen Farben",
        "Gewicht": "6 kg",
        "Helligkeit": "250 cd/m\u00b2",
        "Hintergrundbeleuchtungs-Technologie": "LED-Hintergrundbeleuchtung",
        "Horizontale Bildwiederholrate": "30 - 82 kHz",
        "Horizontaler Betrachtungswinkel": "178",
        "H\u00f6heneinstellung": "150 mm",
        "Integrierte Peripherieger\u00e4te": "Pr\u00e4senzsensor, USB 3.2 Gen 1 Hub, Webcam",
        "Kennzeichnung": "FCC Klasse B bescheinigt, TUV GS, BSMI, RoHS, WEEE, S Mark, cTUVus, Directive 2004/108/EEC, EAC, TUV Rheinland Low Blue Light Certification, TUV Rheinland Flicker Free Certification, EN 62368-1, ISO 9241-307 Class 1",
        "Kontrast": "1000:1 / 20000000:1 (dynamisch)",
        "Leistungsmerkmale": "Slot f\u00fcr Sicherheitsschloss (Kabelschloss getrennt erh\u00e4ltlich)",
        "Max. Betriebstemperatur": "35 \u00b0C",
        "Min Betriebstemperatur": "5 \u00b0C",
        "Native Aufl\u00f6sung": "Full HD (1080p) 1920 x 1080",
        "Neigungswinkel": "-5/+35",
        "OSD-Sprachen": "D\u00e4nisch, Tschechisch, Chinesisch (tradionell), Chinesisch (vereinfacht), Englisch, Deutsch, Franz\u00f6sisch, Italienisch, Norwegisch, Portugiesisch, Polnisch, Finnisch, Schwedisch, Russisch, Spanisch, Holl\u00e4ndisch, T\u00fcrkisch, Arabisch, Japanisch",
        "Pixelpitch": "0.2745 mm",
        "Reaktionszeit": "5 ms",
        "Rotationswinkel": "90",
        "Schlosstyp zur Diebstahlsicherung": "Kensington Slot",
        "Schnittstellen": "2 x DisplayPort \u00a6 HDMI \u00a6 LAN (RJ-45) \u00a6 Kopfh\u00f6rer \u00a6 USB 3.2 Downstream (Type C) \u00a6 3 x USB 3.2 Downstream (Typ A) \u00a6 USB-C Upstream (bis zu 95 W) \u00a6 USB 3.2 Gen 1 Upstream (Typ B)",
        "Schwenkwinkel": "345",
        "Seitenverh\u00e4ltnis": "16:9",
        "Service und Support": "Begrenzte Garantie - 3 Jahre",
        "Stromverbrauch (max.)": "26 Watt",
        "Stromverbrauch SDR (eingeschaltet)": "12 kWh/1.000 h",
        "Stromverbrauch im Standby-Modus": "0.51 Watt",
        "TCO-zertifiziert": "TCO Certified Displays 8",
        "Transportbreite": "16.2 cm",
        "Transportgewicht": "8.78 kg",
        "Transporth\u00f6he": "45 cm",
        "Transporttiefe": "73 cm",
        "Typ": "Lautsprecher - Stereo",
        "USB-Spannungsversorgung": "95 Watt",
        "VESA-Halterung": "100 x 100 mm",
        "Vertikale Bildwiederholrate": "48 - 76 Hz",
        "Vertikaler Betrachtungswinkel": "178",
        "Zul\u00e4ssige Luftfeuchtigkeit im Betrieb": "10 \u2013 85% (nicht kondensierend)"
    },
    "raw_specifications_text": "Display-Typ: LED-hintergrundbeleuchteter LCD-Monitor\nEnergie Effizienzklasse: Klasse C\nEnergieverbrauch pro Jahr: 46.93 kWh\nDiagonalabmessung: 60.5 cm (23.8\")\nIntegrierte Peripherieger\u00e4te: Pr\u00e4senzsensor, USB 3.2 Gen 1 Hub, Webcam\nUSB-Spannungsversorgung: 95 Watt\nBildschirmtyp: IPS\nSeitenverh\u00e4ltnis: 16:9\nNative Aufl\u00f6sung: Full HD (1080p) 1920 x 1080\nPixelpitch: 0.2745 mm\nHelligkeit: 250 cd/m\u00b2\nKontrast: 1000:1 / 20000000:1 (dynamisch)\nFarbunterst\u00fctzung: 16,7 Millionen Farben\nFarbraum: 99% sRGB\nReaktionszeit: 5 ms\nVertikale Bildwiederholrate: 48 - 76 Hz\nHorizontale Bildwiederholrate: 30 - 82 kHz\nHorizontaler Betrachtungswinkel: 178\nVertikaler Betrachtungswinkel: 178\nBildschirmbeschichtung: Blendfrei, 3H Hard Coating\nHintergrundbeleuchtungs-Technologie: LED-Hintergrundbeleuchtung\nFarbtemperatur: 5000K, 6500K, 7500K\nOSD-Sprachen: D\u00e4nisch, Tschechisch, Chinesisch (tradionell), Chinesisch (vereinfacht), Englisch, Deutsch, Franz\u00f6sisch, Italienisch, Norwegisch, Portugiesisch, Polnisch, Finnisch, Schwedisch, Russisch, Spanisch, Holl\u00e4ndisch, T\u00fcrkisch, Arabisch, Japanisch\nBesonderheiten: Eco-Mode, Auto Brightness Control, ECO-Taste, DisplayView, Auto Pivot, Workplace Lighting Guide, 24/7 Betriebsmodus\nFarbe: Mattschwarz\nAbmessungen (Breite x Tiefe x H\u00f6he): 53.912 cm x 21.27 cm x 35.47 cm - mit Fu\u00df\nGewicht: 6 kg\nLeistungsmerkmale: Slot f\u00fcr Sicherheitsschloss (Kabelschloss getrennt erh\u00e4ltlich)\nTyp: Lautsprecher - Stereo\nAusgangsleistung/Kanal: 2 Watt\nSchnittstellen: 2 x DisplayPort \u00a6 HDMI \u00a6 LAN (RJ-45) \u00a6 Kopfh\u00f6rer \u00a6 USB 3.2 Downstream (Type C) \u00a6 3 x USB 3.2 Downstream (Typ A) \u00a6 USB-C Upstream (bis zu 95 W) \u00a6 USB 3.2 Gen 1 Upstream (Typ B)\nEinstellungen der Anzeigeposition: H\u00f6he, Pivot (Rotation), Drehung, Neigung\nNeigungswinkel: -5/+35\nSchwenkwinkel: 345\nRotationswinkel: 90\nH\u00f6heneinstellung: 150 mm\nVESA-Halterung: 100 x 100 mm\nEnthaltene Kabel: 1 x DisplayPort-Kabel - 1.8 m \u00a6 1 x USB-C Kabel - 1 m\nKennzeichnung: FCC Klasse B bescheinigt, TUV GS, BSMI, RoHS, WEEE, S Mark, cTUVus, Directive 2004/108/EEC, EAC, TUV Rheinland Low Blue Light Certification, TUV Rheinland Flicker Free Certification, EN 62368-1, ISO 9241-307 Class 1\nSchlosstyp zur Diebstahlsicherung: Kensington Slot\nEingangsspannung: Wechselstrom 100-240 V (50/60 Hz)\nStromverbrauch SDR (eingeschaltet): 12 kWh/1.000 h\nStromverbrauch (max.): 26 Watt\nStromverbrauch im Standby-Modus: 0.51 Watt\nEnergierverbrauch Sleep: 0.26 Watt\nDetails zu Abmessungen & Gewicht: Mit Fu\u00df - Breite: 53.912 cm - Tiefe: 21.27 cm - H\u00f6he: 35.47 cm - Gewicht: 6 kg \u00a6 Ohne Fu\u00df - Breite: 53.912 cm - Tiefe: 5.923 cm - H\u00f6he: 32.059 cm - Gewicht: 4.1 kg\nTransportbreite: 16.2 cm\nTransporttiefe: 73 cm\nTransporth\u00f6he: 45 cm\nTransportgewicht: 8.78 kg\nTCO-zertifiziert: TCO Certified Displays 8\nEPEAT-kompatibel: EPEAT Silver\nENERGY STAR zertifiziert: Ja\nENERGY STAR-Version: 8.0\nService und Support: Begrenzte Garantie - 3 Jahre\nMin Betriebstemperatur: 5 \u00b0C\nMax. Betriebstemperatur: 35 \u00b0C\nZul\u00e4ssige Luftfeuchtigkeit im Betrieb: 10 \u2013 85% (nicht kondensierend)",
    "reference_file": "offer_reference_825.json",
    "shop_name": "TaufNaus"
}