{
    "html_file": "offer_2079_36.html",
    "name": "BenQ GL2780, 27\"",
    "offer_link": "https://restposten.bauguru.at/monitore/126132-monitor-benq-gl2780-27-led-4718755079597.html",
    "price": 226.6,
    "raw_specifications": {
        "Art": "Gaming",
        "Aufl\u00f6sung": "Full HD",
        "Aufl\u00f6sung (px)": "1920 x 1080 px",
        "Bildschirm": "27\"",
        "Diagonale des Bildschirms (cm)": "68,6 cm",
        "Eingangsanschluss": "DVI",
        "Empfohlene verwendung": "Haushalt",
        "Energieklassifizierung": "D",
        "Enthalten": "Kopfh\u00f6rerausgang",
        "Farbe": "Schwarz",
        "Frequenz": "75 Hz",
        "Glanz": "300 lm ANSI",
        "Installationsart": "Wandmontage",
        "Kompatibel": "VESA 100 x 100 mm",
        "Kontrastverh\u00e4ltnis": "1000:1",
        "Leistung": "4 W",
        "Montage": "VESA",
        "Neigungswinkel": "-5\u00ba / 20\u00ba",
        "Nicht erhalten": "AMD FreeSync",
        "Pixel-Dichte (dpi)": "82 dpi",
        "Seitenverh\u00e4ltnis": "16:9",
        "Standard": "NTSC",
        "Steckbares Produkt": "Ja",
        "Steckertyp": "EU-Stecker",
        "Stromquelle": "Wechselstrom",
        "Touchscreen": "Kein",
        "Verbindung": "DVI-D x 1"
    },
    "raw_specifications_text": "Art: Gaming\nTouchscreen: Kein\nBildschirm: 27\"\nSteckbares Produkt: Ja\nSteckertyp: EU-Stecker\nAufl\u00f6sung (px): 1920 x 1080 px\nAufl\u00f6sung: Full HD\nPixel-Dichte (dpi): 82 dpi\nDiagonale des Bildschirms (cm): 68,6 cm\nFarbe: Schwarz\nSeitenverh\u00e4ltnis: 16:9\nEnergieklassifizierung: D\nKontrastverh\u00e4ltnis: 1000:1\nEingangsanschluss: DVI\nStandard: NTSC\nVerbindung: DVI-D x 1\nFrequenz: 75 Hz\nLeistung: 4 W\nGlanz: 300 lm ANSI\nEnthalten: Kopfh\u00f6rerausgang\nInstallationsart: Wandmontage\nNeigungswinkel: -5\u00ba / 20\u00ba\nStromquelle: Wechselstrom\nNicht erhalten: AMD FreeSync\nMontage: VESA\nEmpfohlene verwendung: Haushalt\nKompatibel: VESA 100 x 100 mm",
    "reference_file": "offer_reference_2079.json",
    "shop_name": "bauguru"
}