{
    "html_file": "offer_1009_46.html",
    "name": "Dell P2723D, 27\"",
    "offer_link": "https://restposten.bauguru.at/monitore/126570-monitor-dell-dell-p2723d-27-ips-led-lcd-5397184656785.html",
    "price": 353.5,
    "raw_specifications": {
        "Arbeitsbereich f\u00fcr Feuchtigkeit": "10 % - 80 %",
        "Arbeitsbereich f\u00fcr Temperatur": "0\u00ba / 40\u00ba",
        "Aufl\u00f6sung": "Quad HD",
        "Aufl\u00f6sung (px)": "2560 x 1440 px",
        "Bildschirm": "27\"",
        "Ca. Temperatur": "- 20\u00baC / 60\u00b0C",
        "Diagonale des Bildschirms (cm)": "68,6 cm",
        "Dreh": "-45\u00ba / 45\u00b0",
        "Empfohlene verwendung": "Haushalt",
        "Energieklassifizierung": "E",
        "Frequenz": "50 - 60 Hz",
        "Geschwindigkeit": "60 Hz",
        "Glanz": "350 lm ANSI",
        "Kompatibel": "VESA 100 x 100 mm",
        "Kontrastverh\u00e4ltnis": "1000:1",
        "Maximale Anpassung": "150 mm",
        "Montage": "VESA",
        "Neigungswinkel": "-5\u00ba / 21\u00ba",
        "Nicht enthalten": "Quecksilber",
        "Nicht erhalten": "AMD FreeSync",
        "Pixel-Dichte (dpi)": "109 dpi",
        "Reichweite": "100% sRGB",
        "Seitenverh\u00e4ltnis": "16:10",
        "Steckbares Produkt": "Ja",
        "Stecker": "Sicherheitsrille",
        "Steckertyp": "EU-Stecker",
        "Stromst\u00e4rke": "1,5 A",
        "Touchscreen": "Kein",
        "Verbindung": "DisplayPort 1.2",
        "Winkel": "178\u00ba"
    },
    "raw_specifications_text": "Bildschirm: 27\"\nAufl\u00f6sung (px): 2560 x 1440 px\nPixel-Dichte (dpi): 109 dpi\nSteckbares Produkt: Ja\nSteckertyp: EU-Stecker\nDiagonale des Bildschirms (cm): 68,6 cm\nSeitenverh\u00e4ltnis: 16:10\nEnergieklassifizierung: E\nKontrastverh\u00e4ltnis: 1000:1\nVerbindung: DisplayPort 1.2\nFrequenz: 50 - 60 Hz\nAufl\u00f6sung: Quad HD\nGlanz: 350 lm ANSI\nTouchscreen: Kein\nNicht enthalten: Quecksilber\nWinkel: 178\u00ba\nArbeitsbereich f\u00fcr Feuchtigkeit: 10 % - 80 %\nStecker: Sicherheitsrille\nNicht erhalten: AMD FreeSync\nCa. Temperatur: - 20\u00baC / 60\u00b0C\nMontage: VESA\nGeschwindigkeit: 60 Hz\nArbeitsbereich f\u00fcr Temperatur: 0\u00ba / 40\u00ba\nStromst\u00e4rke: 1,5 A\nMaximale Anpassung: 150 mm\nEmpfohlene verwendung: Haushalt\nReichweite: 100% sRGB\nKompatibel: VESA 100 x 100 mm\nNeigungswinkel: -5\u00ba / 21\u00ba\nDreh: -45\u00ba / 45\u00b0",
    "reference_file": "offer_reference_1009.json",
    "shop_name": "bauguru"
}