{
    "html_file": "offer_1805_22.html",
    "name": "ASUS VA27DQSB, 27\"",
    "offer_link": "https://www.alternate.at/ASUS/VA27DQSB-LED-Monitor/html/product/1868594?partner=AtGeizhalsat&campaign=Monitor/ASUS/1868594",
    "price": 245.9,
    "raw_specifications": {
        "": "Ausgangsleistung",
        "Abmessungen": "Breite: 61,19 cm x H\u00f6he: 52,34 cm x Tiefe/L\u00e4nge: 22,63 cm",
        "Anschl\u00fcsse": "1x HDMI-Eingang, (HDMI-Version: 1.4), 1x DisplayPort-Eingang, (DisplayPort-Version: 1.2), 1x VGA-Eingang, 1x 3,5-mm-Audio-Eingang, 1x Kopfh\u00f6rer-Ausgang, 2x USB-A-2.0",
        "Bild": "Glaretyp",
        "Bildschirmaufl\u00f6sung": "1.920 x 1.080 Pixel",
        "Bildschirmdiagonale": "69 cm (27 Zoll)",
        "EAN": "4718017756426",
        "Energieeffizienzklasse (SDR)": "C (A - G)",
        "Energieverbauch pro 1000 Stunden (SDR)": "14 kWh",
        "Ergonomie": "Typ",
        "Farbe": "schwarz",
        "Frequenz": "Vertikal",
        "Gewicht": "6,8 kg",
        "Hersteller-Nr.": "90LM06H1-B02370",
        "Lautsprecher": "2 Lautsprecher",
        "Leistungsaufnahme im Bereitschafts- und Aus-Zustand": "0,5 Watt",
        "Leistungsaufnahme im Ein-Zustand bei Standard-Dynamikumfang (SDR)": "14 Watt",
        "Stromversorgung": "Eco-Off",
        "Typ": "LED-Monitor",
        "Weitere Informationen": "Low Blue Light | Ma\u00dfe ohne Standfu\u00df: 611,9 x 364,7 x 55,5 mm (B x H x T) | minimale H\u00f6he mit Standfu\u00df: 373,4 mm | Gewicht ohne Standfu\u00df: 4500 Gramm"
    },
    "raw_specifications_text": "Energieeffizienzklasse (SDR): C (A - G)\nEnergieverbauch pro 1000 Stunden (SDR): 14 kWh\nLeistungsaufnahme im Ein-Zustand bei Standard-Dynamikumfang (SDR): 14 Watt\nLeistungsaufnahme im Bereitschafts- und Aus-Zustand: 0,5 Watt\nBildschirmdiagonale: 69 cm (27 Zoll)\nBildschirmaufl\u00f6sung: 1.920 x 1.080 Pixel\nTyp: LED-Monitor\nFarbe: schwarz\nEAN: 4718017756426\nHersteller-Nr.: 90LM06H1-B02370\nBild: Glaretyp\n: Ausgangsleistung\nFrequenz: Vertikal\nAnschl\u00fcsse: 1x HDMI-Eingang, (HDMI-Version: 1.4), 1x DisplayPort-Eingang, (DisplayPort-Version: 1.2), 1x VGA-Eingang, 1x 3,5-mm-Audio-Eingang, 1x Kopfh\u00f6rer-Ausgang, 2x USB-A-2.0\nErgonomie: Typ\nStromversorgung: Eco-Off\nLautsprecher: 2 Lautsprecher\nWeitere Informationen: Low Blue Light | Ma\u00dfe ohne Standfu\u00df: 611,9 x 364,7 x 55,5 mm (B x H x T) | minimale H\u00f6he mit Standfu\u00df: 373,4 mm | Gewicht ohne Standfu\u00df: 4500 Gramm\nAbmessungen: Breite: 61,19 cm x H\u00f6he: 52,34 cm x Tiefe/L\u00e4nge: 22,63 cm\nGewicht: 6,8 kg",
    "reference_file": "offer_reference_1805.json",
    "shop_name": "Alternate.at"
}