{
    "html_file": "offer_2221_22.html",
    "name": "ASUS VG278QR, 27\"",
    "offer_link": "https://syswork.at/sw/index.html?open&mid=Artikel&artid=mon-1606&from=geizhals.at",
    "price": 240.0,
    "raw_specifications": {
        "3D": "Nein",
        "AC Eingangsfrequenz": "50 - 60 Hz",
        "AC Eingangsspannung": "100 - 240 V",
        "AC-Netzadapter": "Ja",
        "AMD FreeSync": "Ja",
        "AMD FreeSync-Typ": "FreeSync Premium",
        "Anzahl DVI-D-Anschl\u00fcsse": "1",
        "Anzahl DisplayPort Anschl\u00fcsse": "1",
        "Anzahl HDMI-Anschl\u00fcsse": "1",
        "Anzahl OSD-Sprachen": "21",
        "Anzahl der Farben des Displays": "16,78 Millionen Farben",
        "Anzahl der Lautsprecher": "2",
        "Audioanschl\u00fcsse": "Ja",
        "Betriebstemperatur": "0 - 40 \u00b0C",
        "Bildschirmdiagonale": "68,6 cm (27 Zoll)",
        "Bildschirmform": "Flach",
        "Bildschirmtechnologie": "LED",
        "Bildwinkel, horizontal": "170\u00b0",
        "Bildwinkel, vertikal": "160\u00b0",
        "Breite (ohne Standfu\u00df)": "61,9 cm",
        "DVI Anschluss": "Ja",
        "Datenblatt": "Kein Datenblatt verf\u00fcgbar",
        "Digital horizontale Frequenz": "195 - 195 kHz",
        "Digital vertikale Frequenz": "40 - 165 Hz",
        "Display-Aufl\u00f6sung": "1920 x 1080 Pixel",
        "Display-Oberfl\u00e4che": "Matt",
        "DisplayPorts-Version": "1.2",
        "Drehen": "Nein",
        "Dynamisches Kontrastverh\u00e4ltnis Marketingbezeichnung": "SmartContrast",
        "Ein-/Ausschalter": "Ja",
        "Eingangsstrom": "2.1 A",
        "Eingebaute Lautsprecher": "Ja",
        "Energieeffizienzklasse (SDR)": "F",
        "Energieeffizienzskala": "A bis G",
        "Energieverbrauch (SDR) pro 1.000 Stunden": "26 kWh",
        "Flimmerfreie Technologie": "Ja",
        "Fu\u00dffarbe": "Schwarz",
        "Ger\u00e4tebreite (inkl. Fu\u00df)": "619 mm",
        "Ger\u00e4teh\u00f6he (inkl. Fu\u00df)": "376 mm",
        "Ger\u00e4tetiefe (inkl. Fu\u00df)": "211 mm",
        "Gewicht (mit St\u00e4nder)": "5,6 kg",
        "Gewicht (ohne St\u00e4nder)": "3,2 kg",
        "Gleichstrom-Anschluss (DC)": "Ja",
        "HD-Typ": "Full HD",
        "HDCP": "Ja",
        "HDMI-Version": "1.4",
        "Helligkeit (typisch)": "400 cd/m\u00b2",
        "Herstellerlink": "ASUS",
        "H\u00f6he (ohne Standfu\u00df)": "36,3 cm",
        "H\u00f6heneinstellung": "13 cm",
        "H\u00f6henverstellung": "Ja",
        "Integrierte Kamera": "Nein",
        "Integrierter USB-Hub": "Nein",
        "Kabelsperre-Slot": "Ja",
        "Konformit\u00e4t mit Industriestandards": "Windows 10, Windows 8.1, Windows 7",
        "Kontrastverh\u00e4ltnis": "1000:1",
        "Kontrastverh\u00e4ltnis (dynamisch)": "100000000:1",
        "Kopfh\u00f6rer-Anschluss": "3,5 mm",
        "Kopfh\u00f6rerausgang": "Ja",
        "Kopfh\u00f6rerausg\u00e4nge": "1",
        "Low-Blue-Light-Technologie": "Ja",
        "Marktpositionierung": "Gaming",
        "Maximale Bildwiederholrate": "165 Hz",
        "Men\u00fcsprachen": "Vereinfachtes Chinesisch, Traditionelles Chinesisch, Kroatisch, Tschechisch, Deutsch, Niederl\u00e4ndisch, Englisch, Spanisch, Franz\u00f6sisch, Ungarisch, Indonesisch, Italienisch, Japanisch, Koreanisch, Persisch, Polnisch, Portugiesisch, Rum\u00e4nisch, Russisch, Thail\u00e4ndisch, T\u00fcrkisch",
        "Mitgelieferte Kabel": "AC",
        "NTSC Abdeckung (typisch)": "72%",
        "NVIDIA G-SYNC": "Ja",
        "NVIDIA G-SYNC-Typ": "G-SYNC Compatible",
        "Nachhaltigkeitszertifikate": "RoHS",
        "Natives Seitenverh\u00e4ltnis": "16:9",
        "Neigungsverstellung": "Ja",
        "Neigungswinkelbereich": "-5 - 33\u00b0",
        "On-Screen-Display (OSD)": "Ja",
        "Paketgewicht": "8,2 kg",
        "Panel-Montage-Schnittstelle": "100 x 100 mm",
        "Panel-Typ": "TN",
        "Pivot": "Ja",
        "Pivot Winkel": "-90 - 90\u00b0",
        "Pixel Abstand": "0,311 x 0,311 mm",
        "Produktfarbe": "Schwarz",
        "Produktlink": "Link",
        "RGB-Farbraum": "sRGB",
        "RMS-Leistung": "4 W",
        "Rahmenloses Design": "Ja",
        "Reaktionszeit": "0,5 ms",
        "Reaktionszeit (schnell)": "0,5 ms",
        "Schnellstart\u00fcbersicht": "Ja",
        "Schwenkbar": "Ja",
        "Schwenkwinkelbereich": "-90 - 90\u00b0",
        "Seitenverh\u00e4ltnis": "16:9",
        "Sichtbare Gr\u00f6\u00dfe (horizontal)": "59,8 cm",
        "Sichtbare Gr\u00f6\u00dfe (vertikal)": "33,6 cm",
        "Slot-Typ Kabelsperre": "Kensington",
        "SmartResponse": "1 ms",
        "Stromverbrauch (Standardbetrieb)": "26,1 W",
        "Stromverbrauch (Standby)": "0,5 W",
        "Stromverbrauch (aus)": "0,3 W",
        "St\u00e4nder enthalten": "Ja",
        "TV Tuner integriert": "Nein",
        "Temperaturbereich bei Lagerung": "-20 - 60 \u00b0C",
        "Tiefe (ohne Standfu\u00df)": "5 cm",
        "Touchscreen": "Nein",
        "Unterst\u00fctzte Grafik-Aufl\u00f6sungen": "1920 x 1080 (HD 1080)",
        "VESA Adaptive Sync unterst\u00fctzt": "Ja",
        "VESA-Halterung": "Ja",
        "Verpackungsbreite": "700 mm",
        "Verpackungsh\u00f6he": "458 mm",
        "Verpackungstiefe": "190 mm",
        "Vorderer Rahmen": "Schwarz",
        "Warentarifnummer (HS)": "85285210",
        "Zertifizierung": "BSMI, CB, CCC, CE, CEL level 1, CU, ErP, FCC, J-MOSS, KCC, PSE, RoHS, UkrSEPRO, UL/cUL, VCCI, WEEE, WHQL , MEPS, RCM, TUV Flicker-free , eStandby, TUV Low Blue Light, ICES-3, PC recycle"
    },
    "raw_specifications_text": "Bildschirmdiagonale: 68,6 cm (27 Zoll)\nDisplay-Aufl\u00f6sung: 1920 x 1080 Pixel\nNatives Seitenverh\u00e4ltnis: 16:9\nBildschirmtechnologie: LED\nTouchscreen: Nein\nHD-Typ: Full HD\nPanel-Typ: TN\nBildschirmform: Flach\nKontrastverh\u00e4ltnis: 1000:1\nMaximale Bildwiederholrate: 165 Hz\nAnzahl der Farben des Displays: 16,78 Millionen Farben\nHelligkeit (typisch): 400 cd/m\u00b2\nReaktionszeit: 0,5 ms\nDisplay-Oberfl\u00e4che: Matt\nUnterst\u00fctzte Grafik-Aufl\u00f6sungen: 1920 x 1080 (HD 1080)\nSeitenverh\u00e4ltnis: 16:9\nKontrastverh\u00e4ltnis (dynamisch): 100000000:1\nDynamisches Kontrastverh\u00e4ltnis Marketingbezeichnung: SmartContrast\nBildwinkel, horizontal: 170\u00b0\nBildwinkel, vertikal: 160\u00b0\nReaktionszeit (schnell): 0,5 ms\nSmartResponse: 1 ms\nPixel Abstand: 0,311 x 0,311 mm\nSichtbare Gr\u00f6\u00dfe (horizontal): 59,8 cm\nSichtbare Gr\u00f6\u00dfe (vertikal): 33,6 cm\nDigital horizontale Frequenz: 195 - 195 kHz\nDigital vertikale Frequenz: 40 - 165 Hz\nRGB-Farbraum: sRGB\nNTSC Abdeckung (typisch): 72%\n3D: Nein\nNVIDIA G-SYNC: Ja\nAMD FreeSync: Ja\nNVIDIA G-SYNC-Typ: G-SYNC Compatible\nAMD FreeSync-Typ: FreeSync Premium\nVESA Adaptive Sync unterst\u00fctzt: Ja\nFlimmerfreie Technologie: Ja\nLow-Blue-Light-Technologie: Ja\nEingebaute Lautsprecher: Ja\nIntegrierte Kamera: Nein\nAnzahl der Lautsprecher: 2\nRMS-Leistung: 4 W\nMarktpositionierung: Gaming\nProduktfarbe: Schwarz\nRahmenloses Design: Ja\nVorderer Rahmen: Schwarz\nFu\u00dffarbe: Schwarz\nZertifizierung: BSMI, CB, CCC, CE, CEL level 1, CU, ErP, FCC, J-MOSS, KCC, PSE, RoHS, UkrSEPRO, UL/cUL, VCCI, WEEE, WHQL , MEPS, RCM, TUV Flicker-free , eStandby, TUV Low Blue Light, ICES-3, PC recycle\nKonformit\u00e4t mit Industriestandards: Windows 10, Windows 8.1, Windows 7\nIntegrierter USB-Hub: Nein\nKopfh\u00f6rerausgang: Ja\nDVI Anschluss: Ja\nAnzahl DVI-D-Anschl\u00fcsse: 1\nAnzahl HDMI-Anschl\u00fcsse: 1\nHDMI-Version: 1.4\nAnzahl DisplayPort Anschl\u00fcsse: 1\nDisplayPorts-Version: 1.2\nAudioanschl\u00fcsse: Ja\nKopfh\u00f6rerausg\u00e4nge: 1\nKopfh\u00f6rer-Anschluss: 3,5 mm\nHDCP: Ja\nGleichstrom-Anschluss (DC): Ja\nVESA-Halterung: Ja\nKabelsperre-Slot: Ja\nH\u00f6henverstellung: Ja\nPanel-Montage-Schnittstelle: 100 x 100 mm\nSlot-Typ Kabelsperre: Kensington\nH\u00f6heneinstellung: 13 cm\nPivot: Ja\nPivot Winkel: -90 - 90\u00b0\nSchwenkbar: Ja\nSchwenkwinkelbereich: -90 - 90\u00b0\nNeigungswinkelbereich: -5 - 33\u00b0\nOn-Screen-Display (OSD): Ja\nMen\u00fcsprachen: Vereinfachtes Chinesisch, Traditionelles Chinesisch, Kroatisch, Tschechisch, Deutsch, Niederl\u00e4ndisch, Englisch, Spanisch, Franz\u00f6sisch, Ungarisch, Indonesisch, Italienisch, Japanisch, Koreanisch, Persisch, Polnisch, Portugiesisch, Rum\u00e4nisch, Russisch, Thail\u00e4ndisch, T\u00fcrkisch\nAnzahl OSD-Sprachen: 21\nNeigungsverstellung: Ja\nEnergieeffizienzklasse (SDR): F\nEnergieverbrauch (SDR) pro 1.000 Stunden: 26 kWh\nStromverbrauch (Standardbetrieb): 26,1 W\nStromverbrauch (Standby): 0,5 W\nStromverbrauch (aus): 0,3 W\nAC Eingangsspannung: 100 - 240 V\nAC Eingangsfrequenz: 50 - 60 Hz\nEingangsstrom: 2.1 A\nEnergieeffizienzskala: A bis G\nBetriebstemperatur: 0 - 40 \u00b0C\nTemperaturbereich bei Lagerung: -20 - 60 \u00b0C\nSt\u00e4nder enthalten: Ja\nMitgelieferte Kabel: AC\nSchnellstart\u00fcbersicht: Ja\nGer\u00e4tebreite (inkl. Fu\u00df): 619 mm\nGer\u00e4tetiefe (inkl. Fu\u00df): 211 mm\nGer\u00e4teh\u00f6he (inkl. Fu\u00df): 376 mm\nGewicht (mit St\u00e4nder): 5,6 kg\nBreite (ohne Standfu\u00df): 61,9 cm\nTiefe (ohne Standfu\u00df): 5 cm\nH\u00f6he (ohne Standfu\u00df): 36,3 cm\nGewicht (ohne St\u00e4nder): 3,2 kg\nVerpackungsbreite: 700 mm\nVerpackungstiefe: 190 mm\nVerpackungsh\u00f6he: 458 mm\nPaketgewicht: 8,2 kg\nNachhaltigkeitszertifikate: RoHS\nWarentarifnummer (HS): 85285210\nAC-Netzadapter: Ja\nEin-/Ausschalter: Ja\nDrehen: Nein\nTV Tuner integriert: Nein\nDatenblatt: Kein Datenblatt verf\u00fcgbar\nProduktlink: Link\nHerstellerlink: ASUS",
    "reference_file": "offer_reference_2221.json",
    "shop_name": "Syswork"
}