{
    "html_file": "offer_832_0.html",
    "name": "Lenovo Legion Y25-30, 24.5\"",
    "offer_link": "https://www.taufnaus.de/product/10619524",
    "price": 185.51,
    "raw_specifications": {
        "Abmessungen (Breite x Tiefe x H\u00f6he)": "55.73 cm x 25.73 cm x 49.37 cm - mit Standfu\u00df (h\u00f6chste Position)",
        "Adaptive-Sync Technologie": "AMD FreeSync Premium",
        "Ausgangsleistung/Kanal": "3 Watt",
        "Besonderheiten": "Kompatibel mit HDR 400, 8-bit Farbtiefe",
        "Bildschirmbeschichtung": "Blendfrei",
        "Bildschirmtyp": "IPS",
        "Details zu Abmessungen & Gewicht": "Ohne Fu\u00df - Breite: 55.73 cm - Tiefe: 5.5 cm - H\u00f6he: 32.91 cm - Gewicht: 3.4 kg \u00a6 Mit Standfu\u00df (h\u00f6chste Position) - Breite: 55.73 cm - Tiefe: 25.73 cm - H\u00f6he: 49.37 cm - Gewicht: 5.3 kg \u00a6 Mit Standfu\u00df (niedrigste Position) - Breite: 55.73 cm - Tiefe: 25.73 cm - H\u00f6he: 35.87 cm - Gewicht: 5.3 kg",
        "Diagonalabmessung": "62.2 cm (24.5\")",
        "Display-Typ": "LED-hintergrundbeleuchteter LCD-Monitor / TFT-Aktivmatrix",
        "Eingangsspannung": "Wechselstrom 100-240 V (50/60 Hz)",
        "Einstellungen der Anzeigeposition": "H\u00f6he, Pivot (Rotation), Drehung, Neigung",
        "Energierverbrauch Sleep": "0.5 Watt",
        "Enthaltene Kabel": "1 x DisplayPort-Kabel - 1.8 m",
        "Erforderliches Betriebssystem": "Windows 10, Windows 11",
        "Farbe": "Raven Black",
        "Farbraum": "120% sRGB, 99% sRGB",
        "Farbunterst\u00fctzung": "16,7 Millionen Farben",
        "Gaming": "Ja",
        "Gewicht": "5.3 kg",
        "Helligkeit": "430 cd/m\u00b2",
        "Hintergrundbeleuchtungs-Technologie": "WLED",
        "Horizontaler Betrachtungswinkel": "178",
        "H\u00f6heneinstellung": "135 mm",
        "Integrierte Peripherieger\u00e4te": "USB 3.2 Gen 1 Hub",
        "Kennzeichnung": "CCC, TUV Rheinland Eye Comfort Certification, China Energy standard Tier 1, EU RoHS 2002/95/EC, TUV Eyesafe Display Certification, TUV Rheinland Low Blue Light (Hardware Solution)",
        "Kontrast": "1000:1 / 3000000:1 (dynamisch)",
        "Leistungsmerkmale": "Slot f\u00fcr Sicherheitsschloss (Kabelschloss getrennt erh\u00e4ltlich), integrierte Kabelf\u00fchrung",
        "Lokalisierung": "Englisch / Europa",
        "Mitgelieferte Software": "Lenovo Display Control Center",
        "Native Aufl\u00f6sung": "Full HD (1080p) 1920 x 1080 bei 280 Hz",
        "Neigungswinkel": "-5/+22",
        "Pixelpitch": "0.283 mm",
        "Ppi": "89",
        "Reaktionszeit": "0.5 ms (MPRT), 1 ms (Level 1), 2 ms (Level 2), 2 ms (Level 3), 4 ms (Level 4), 5 ms (aus)",
        "Rotationswinkel": "180",
        "Schlosstyp zur Diebstahlsicherung": "Kensington Slot",
        "Schnittstellen": "2 x HDMI \u00a6 DisplayPort \u00a6 Audio Line-Out \u00a6 USB 3.2 Gen 1 Upstream (Typ B) \u00a6 4 x USB 3.2 Gen 1 Downstream",
        "Schwenkwinkel": "90",
        "Seitenverh\u00e4ltnis": "16:9",
        "Service und Support": "Begrenzte Garantie - 3 Jahre",
        "Stromverbrauch (Aus-Modus)": "0.3 Watt",
        "Stromverbrauch (max.)": "33 Watt",
        "Stromverbrauch (typisch)": "17 Watt",
        "Transportbreite": "65.8 cm",
        "Transportgewicht": "8.1 kg",
        "Transporth\u00f6he": "49 cm",
        "Transporttiefe": "16.8 cm",
        "Typ": "Lautsprecher - Stereo",
        "VESA-Halterung": "100 x 100 mm",
        "Vertikaler Betrachtungswinkel": "178"
    },
    "raw_specifications_text": "Display-Typ: LED-hintergrundbeleuchteter LCD-Monitor / TFT-Aktivmatrix\nDiagonalabmessung: 62.2 cm (24.5\")\nAdaptive-Sync Technologie: AMD FreeSync Premium\nIntegrierte Peripherieger\u00e4te: USB 3.2 Gen 1 Hub\nBildschirmtyp: IPS\nSeitenverh\u00e4ltnis: 16:9\nNative Aufl\u00f6sung: Full HD (1080p) 1920 x 1080 bei 280 Hz\nPixelpitch: 0.283 mm\nPpi: 89\nHelligkeit: 430 cd/m\u00b2\nKontrast: 1000:1 / 3000000:1 (dynamisch)\nFarbunterst\u00fctzung: 16,7 Millionen Farben\nFarbraum: 120% sRGB, 99% sRGB\nReaktionszeit: 0.5 ms (MPRT), 1 ms (Level 1), 2 ms (Level 2), 2 ms (Level 3), 4 ms (Level 4), 5 ms (aus)\nGaming: Ja\nHorizontaler Betrachtungswinkel: 178\nVertikaler Betrachtungswinkel: 178\nBildschirmbeschichtung: Blendfrei\nHintergrundbeleuchtungs-Technologie: WLED\nBesonderheiten: Kompatibel mit HDR 400, 8-bit Farbtiefe\nFarbe: Raven Black\nAbmessungen (Breite x Tiefe x H\u00f6he): 55.73 cm x 25.73 cm x 49.37 cm - mit Standfu\u00df (h\u00f6chste Position)\nGewicht: 5.3 kg\nTyp: Lautsprecher - Stereo\nAusgangsleistung/Kanal: 3 Watt\nSchnittstellen: 2 x HDMI \u00a6 DisplayPort \u00a6 Audio Line-Out \u00a6 USB 3.2 Gen 1 Upstream (Typ B) \u00a6 4 x USB 3.2 Gen 1 Downstream\nEinstellungen der Anzeigeposition: H\u00f6he, Pivot (Rotation), Drehung, Neigung\nNeigungswinkel: -5/+22\nSchwenkwinkel: 90\nRotationswinkel: 180\nH\u00f6heneinstellung: 135 mm\nVESA-Halterung: 100 x 100 mm\nLeistungsmerkmale: Slot f\u00fcr Sicherheitsschloss (Kabelschloss getrennt erh\u00e4ltlich), integrierte Kabelf\u00fchrung\nEnthaltene Kabel: 1 x DisplayPort-Kabel - 1.8 m\nKennzeichnung: CCC, TUV Rheinland Eye Comfort Certification, China Energy standard Tier 1, EU RoHS 2002/95/EC, TUV Eyesafe Display Certification, TUV Rheinland Low Blue Light (Hardware Solution)\nLokalisierung: Englisch / Europa\nSchlosstyp zur Diebstahlsicherung: Kensington Slot\nEingangsspannung: Wechselstrom 100-240 V (50/60 Hz)\nStromverbrauch (typisch): 17 Watt\nStromverbrauch (max.): 33 Watt\nEnergierverbrauch Sleep: 0.5 Watt\nStromverbrauch (Aus-Modus): 0.3 Watt\nMitgelieferte Software: Lenovo Display Control Center\nErforderliches Betriebssystem: Windows 10, Windows 11\nDetails zu Abmessungen & Gewicht: Ohne Fu\u00df - Breite: 55.73 cm - Tiefe: 5.5 cm - H\u00f6he: 32.91 cm - Gewicht: 3.4 kg \u00a6 Mit Standfu\u00df (h\u00f6chste Position) - Breite: 55.73 cm - Tiefe: 25.73 cm - H\u00f6he: 49.37 cm - Gewicht: 5.3 kg \u00a6 Mit Standfu\u00df (niedrigste Position) - Breite: 55.73 cm - Tiefe: 25.73 cm - H\u00f6he: 35.87 cm - Gewicht: 5.3 kg\nTransportbreite: 65.8 cm\nTransporttiefe: 16.8 cm\nTransporth\u00f6he: 49 cm\nTransportgewicht: 8.1 kg\nService und Support: Begrenzte Garantie - 3 Jahre",
    "reference_file": "offer_reference_832.json",
    "shop_name": "TaufNaus"
}