{
    "html_file": "offer_1865_43.html",
    "name": "ASUS ZenScreen MB14AC, 14\"",
    "offer_link": "https://ms-it-beratung.at/shop/details.php?art=339718&artname=ASUS+ZenScreen+MB14AC+35.6cm+%2816%3A9%29+FHD+++USB-C",
    "price": 260.0,
    "raw_specifications": {
        "Anzahl der Farben des Displays": "16,78 Millionen Farben",
        "Anzahl der nachgeschalteten Steckpl\u00e4tze vom Typ USB-A": "1",
        "Audioanschl\u00fcsse": "Nein",
        "Betriebstemperatur": "0 - 40 \u00b0C",
        "Bildschirmdiagonale": "35,6 cm (14\")",
        "Bildschirmform": "Flach",
        "Bildwinkel, horizontal": "178\u00b0",
        "Bildwinkel, vertikal": "178\u00b0",
        "DVI Anschluss": "Nein",
        "Display-Aufl\u00f6sung": "1920 x 1080 Pixel",
        "Eingebaute Lautsprecher": "Nein",
        "Energieeffizienzklasse (SDR)": "B",
        "Energieeffizienzskala": "A bis G",
        "Energieverbrauch (SDR) pro 1.000 Stunden": "5 kWh",
        "Flimmerfreie Technologie": "Ja",
        "Ger\u00e4tebreite (inkl. Fu\u00df)": "324,9 mm",
        "Ger\u00e4teh\u00f6he (inkl. Fu\u00df)": "208 mm",
        "Ger\u00e4tetiefe (inkl. Fu\u00df)": "11,2 mm",
        "Gewicht (mit St\u00e4nder)": "590 g",
        "HD-Typ": "Full HD",
        "HDCP": "Ja",
        "HDMI": "Nein",
        "Helligkeit (typisch)": "250 cd/m\u00b2",
        "H\u00f6henverstellung": "Nein",
        "Integrierte Kamera": "Nein",
        "Integrierter USB-Hub": "Ja",
        "Kabelsperre-Slot": "Nein",
        "Kontrastverh\u00e4ltnis": "700:1",
        "Kopfh\u00f6rerausgang": "Nein",
        "LED-Anzeigen": "Ja",
        "Low-Blue-Light-Technologie": "Ja",
        "Marktpositionierung": "Business",
        "Maximale Bildwiederholrate": "60 Hz",
        "Mitgelieferte Kabel": "USB Typ-C auf USB Typ-C",
        "Nachhaltigkeitszertifikate": "RoHS, ENERGY STAR",
        "Natives Seitenverh\u00e4ltnis": "16:9",
        "Paketgewicht": "1,3 kg",
        "Panel-Typ": "IPS",
        "Pixel Abstand": "0,16 x 0,16 mm",
        "Produktfarbe": "Grau",
        "Reaktionszeit": "5 ms",
        "Seitenverh\u00e4ltnis": "16:9",
        "Sichtbare Gr\u00f6\u00dfe (diagonal)": "35,6 cm",
        "Sichtbare Gr\u00f6\u00dfe (horizontal)": "30,9 cm",
        "Sichtbare Gr\u00f6\u00dfe (vertikal)": "17,4 cm",
        "Stromverbrauch (Standardbetrieb)": "7 W",
        "Touchscreen": "Nein",
        "Unterst\u00fctzte Grafik-Aufl\u00f6sungen": "640 x 480 (VGA), 800 x 600 (SVGA), 1024 x 768 (XGA), 1280 x 1024 (SXGA), 1280 x 960, 1440 x 900 (WXGA+), 1680 x 1050 (WSXGA+), 1920 x 1080 (HD 1080)",
        "VESA-Halterung": "Nein",
        "Verpackungsbreite": "392 mm",
        "Verpackungsh\u00f6he": "257 mm",
        "Verpackungstiefe": "77 mm",
        "Warentarifnummer (HS)": "85285210",
        "Zertifizierung": "BSMI, CB, CCC, CE, CU, FCC, J-MOSS, KCC, UkrSEPRO, UL/cUL, VCCI, WEEE, WHQL (Windows 10, Windows 8.1, Windows 7), TUV Flicker-free, TUV Low Blue Light, RCM"
    },
    "raw_specifications_text": "Bildschirmdiagonale: 35,6 cm (14\")\nDisplay-Aufl\u00f6sung: 1920 x 1080 Pixel\nNatives Seitenverh\u00e4ltnis: 16:9\nTouchscreen: Nein\nHD-Typ: Full HD\nPanel-Typ: IPS\nHelligkeit (typisch): 250 cd/m\u00b2\nReaktionszeit: 5 ms\nBildschirmform: Flach\nUnterst\u00fctzte Grafik-Aufl\u00f6sungen: 640 x 480 (VGA), 800 x 600 (SVGA), 1024 x 768 (XGA), 1280 x 1024 (SXGA), 1280 x 960, 1440 x 900 (WXGA+), 1680 x 1050 (WSXGA+), 1920 x 1080 (HD 1080)\nSeitenverh\u00e4ltnis: 16:9\nKontrastverh\u00e4ltnis: 700:1\nMaximale Bildwiederholrate: 60 Hz\nBildwinkel, horizontal: 178\u00b0\nBildwinkel, vertikal: 178\u00b0\nAnzahl der Farben des Displays: 16,78 Millionen Farben\nPixel Abstand: 0,16 x 0,16 mm\nSichtbare Gr\u00f6\u00dfe (horizontal): 30,9 cm\nSichtbare Gr\u00f6\u00dfe (vertikal): 17,4 cm\nSichtbare Gr\u00f6\u00dfe (diagonal): 35,6 cm\nFlimmerfreie Technologie: Ja\nLow-Blue-Light-Technologie: Ja\nEingebaute Lautsprecher: Nein\nIntegrierte Kamera: Nein\nMarktpositionierung: Business\nProduktfarbe: Grau\nZertifizierung: BSMI, CB, CCC, CE, CU, FCC, J-MOSS, KCC, UkrSEPRO, UL/cUL, VCCI, WEEE, WHQL (Windows 10, Windows 8.1, Windows 7), TUV Flicker-free, TUV Low Blue Light, RCM\nIntegrierter USB-Hub: Ja\nAnzahl der nachgeschalteten Steckpl\u00e4tze vom Typ USB-A: 1\nDVI Anschluss: Nein\nHDMI: Nein\nAudioanschl\u00fcsse: Nein\nKopfh\u00f6rerausgang: Nein\nHDCP: Ja\nVESA-Halterung: Nein\nKabelsperre-Slot: Nein\nH\u00f6henverstellung: Nein\nLED-Anzeigen: Ja\nEnergieeffizienzklasse (SDR): B\nEnergieverbrauch (SDR) pro 1.000 Stunden: 5 kWh\nStromverbrauch (Standardbetrieb): 7 W\nEnergieeffizienzskala: A bis G\nBetriebstemperatur: 0 - 40 \u00b0C\nMitgelieferte Kabel: USB Typ-C auf USB Typ-C\nGer\u00e4tebreite (inkl. Fu\u00df): 324,9 mm\nGer\u00e4tetiefe (inkl. Fu\u00df): 11,2 mm\nGer\u00e4teh\u00f6he (inkl. Fu\u00df): 208 mm\nGewicht (mit St\u00e4nder): 590 g\nVerpackungsbreite: 392 mm\nVerpackungstiefe: 77 mm\nVerpackungsh\u00f6he: 257 mm\nPaketgewicht: 1,3 kg\nNachhaltigkeitszertifikate: RoHS, ENERGY STAR\nWarentarifnummer (HS): 85285210",
    "reference_file": "offer_reference_1865.json",
    "shop_name": "ms-it-beratung"
}