{
    "html_file": "offer_1048_20.html",
    "name": "Philips 3000 27E1N3300A, 27\"",
    "offer_link": "https://www.alternate.at/Philips/27E1N3300A-00-LED-Monitor/html/product/1878834?partner=AtGeizhalsat&campaign=Monitor/Philips/1878834",
    "price": 198.9,
    "raw_specifications": {
        "": "AMD FreeSync, Kensington-Schloss",
        "Abmessungen": "Breite: 61,2 cm x H\u00f6he: 45,6 cm x Tiefe/L\u00e4nge: 19,7 cm",
        "Anschl\u00fcsse": "1x HDMI-Eingang, (HDMI-Version: 1.4), 1x 3,5-mm-Audio-Ausgang, 4x USB-A-3.2 Gen 1 (5 Gbit/s), 1x USB-C 3.2 Gen 1 (5 Gbit/s)",
        "Bild": "Format",
        "Bildschirmaufl\u00f6sung": "1.920 x 1.080 Pixel",
        "Bildschirmdiagonale": "69 cm (27 Zoll)",
        "EAN": "8712581783365",
        "Energieeffizienzklasse (SDR)": "E (A - G)",
        "Energieverbauch pro 1000 Stunden (SDR)": "21 kWh",
        "Ergonomie": "Typ",
        "Farbe": "schwarz",
        "Features": "Mega Infinity DCR, SmartImage Spiel, LowBlue Modus, EasyRead Modus, 65 Watt USB-C Power Delivery",
        "Frequenz": "Vertikal",
        "Geeignet f\u00fcr": "Business, Multimedia",
        "Gewicht": "6,1 kg",
        "Hersteller-Nr.": "27E1N3300A/00",
        "Lautsprecher": "2 Lautsprecher",
        "Leistungsaufnahme im Bereitschafts- und Aus-Zustand": "0,5 Watt",
        "Leistungsaufnahme im Ein-Zustand bei Standard-Dynamikumfang (SDR)": "21 Watt",
        "Standards": "Video",
        "Stromversorgung": "Eco-Off",
        "Typ": "LED-Monitor",
        "Wandhalterung": "VESA kompatibel (100 x 100 mm)",
        "Zubeh\u00f6r": "Vorhanden"
    },
    "raw_specifications_text": "Energieeffizienzklasse (SDR): E (A - G)\nEnergieverbauch pro 1000 Stunden (SDR): 21 kWh\nLeistungsaufnahme im Ein-Zustand bei Standard-Dynamikumfang (SDR): 21 Watt\nLeistungsaufnahme im Bereitschafts- und Aus-Zustand: 0,5 Watt\nBildschirmdiagonale: 69 cm (27 Zoll)\nBildschirmaufl\u00f6sung: 1.920 x 1.080 Pixel\nTyp: LED-Monitor\nFarbe: schwarz\nEAN: 8712581783365\nHersteller-Nr.: 27E1N3300A/00\nGeeignet f\u00fcr: Business, Multimedia\nBild: Format\n: AMD FreeSync, Kensington-Schloss\nFrequenz: Vertikal\nAnschl\u00fcsse: 1x HDMI-Eingang, (HDMI-Version: 1.4), 1x 3,5-mm-Audio-Ausgang, 4x USB-A-3.2 Gen 1 (5 Gbit/s), 1x USB-C 3.2 Gen 1 (5 Gbit/s)\nErgonomie: Typ\nStromversorgung: Eco-Off\nLautsprecher: 2 Lautsprecher\nStandards: Video\nWandhalterung: VESA kompatibel (100 x 100 mm)\nFeatures: Mega Infinity DCR, SmartImage Spiel, LowBlue Modus, EasyRead Modus, 65 Watt USB-C Power Delivery\nZubeh\u00f6r: Vorhanden\nAbmessungen: Breite: 61,2 cm x H\u00f6he: 45,6 cm x Tiefe/L\u00e4nge: 19,7 cm\nGewicht: 6,1 kg",
    "reference_file": "offer_reference_1048.json",
    "shop_name": "Alternate.at"
}