{
    "html_file": "offer_1609_10.html",
    "name": "Acer ConceptD CP3 CP3271UVbmiipruzx, 27\"",
    "offer_link": "https://www.1ashop.at/de/produkt/65896/acer-conceptd-cp3-cp3271uvbmiipruzx-27-wqhd-hdmi-dp-usb-c-hoehenverstellbar-lautsprecher.html",
    "price": 505.69,
    "raw_specifications": {
        "Abmessungen (Breite x Tiefe x H\u00f6he)": "61.5 cm x 26.9 cm x 46.5 cm - mit Fu\u00df",
        "Adaptive-Sync Technologie": "AMD Adaptive-Sync",
        "Ausgangsleistung/Kanal": "2 Watt",
        "Bildschirmbeschichtung": "Blendfrei",
        "Bildschirmtyp": "IPS",
        "Details zu Abmessungen & Gewicht": "Mit Fu\u00df - Breite: 61.5 cm - Tiefe: 26.9 cm - H\u00f6he: 46.5 cm - Gewicht: 6.49 kg  Ohne Fu\u00df - Breite: 61.4 cm - Tiefe: 1.25 cm - H\u00f6he: 36.7 cm - Gewicht: 4.49 kg",
        "Diagonalabmessung": "68.6 cm (27\")",
        "Display-Typ": "LED-hintergrundbeleuchteter LCD-Monitor / TFT-Aktivmatrix",
        "EAN/UPC": "4710886179054",
        "Eingangsspannung": "Wechselstrom 120/230 V (50/60 Hz)",
        "Einstellungen der Anzeigeposition": "H\u00f6he, Drehung, Neigung",
        "Energie Effizienzklasse": "Klasse G",
        "Energieklasse (HDR)": "Klasse G",
        "Enthaltene Kabel": "DisplayPort-Kabel  HDMI-Kabel",
        "Farbe": "Schwarz",
        "Farbunterst\u00fctzung": "1,07 Mrd. Farben",
        "Gewicht": "6.49 kg",
        "Gruppe": "TFTs",
        "Helligkeit": "400 cd/m\u00b2",
        "Hersteller": "Acer",
        "Hersteller Art. Nr.": "UM.HC1EE.V05",
        "Hintergrundbeleuchtungs-Technologie": "LED-Hintergrundbeleuchtung",
        "Horizontaler Betrachtungswinkel": "178",
        "H\u00f6heneinstellung": "178 mm",
        "Integrierte Peripherieger\u00e4te": "USB 3.0/USB-C Hub",
        "Kennzeichnung": "MPR II, RoHS",
        "Kontrast": "1000:1 / 100000000:1 (dynamisch)",
        "Leistungsaufnahme im Ein-Zustand": "31.3 W",
        "Leistungsmerkmale": "Unterst\u00fctzung f\u00fcr VESA-Schnittstelle",
        "Native Aufl\u00f6sung": "WQHD 2560 x 1440 (DisplayPort: 165 Hz, HDMI: 144 Hz)",
        "Neigungswinkel": "-5/+35",
        "Reaktionszeit": "1 ms (Grau-zu-Grau); 0,7 ms (Grau-zu-Grau min.)",
        "Schnittstellen": "2 x HDMI  DisplayPort  2 x USB 3.0 Upstream  4 x USB 3.0 Downstream  Audio Line-Out (Mini-Klinkenstecker)  USB-C",
        "Schwenkwinkel": "360",
        "Seitenverh\u00e4ltnis": "16:9",
        "Sichtbare Bildfl\u00e4che": "68.6 cm (27\")",
        "Stromverbrauch (Aus-Modus)": "0.25 Watt",
        "Stromverbrauch HDR (eingeschaltet)": "42.4 kWh/1.000 h",
        "Stromverbrauch SDR (eingeschaltet)": "31.3 kWh/1.000 h",
        "Stromverbrauch im Standby-Modus": "0.3 Watt",
        "Typ": "Lautsprecher - Stereo",
        "VESA-Halterung": "100 x 100 mm",
        "Vertikaler Betrachtungswinkel": "178"
    },
    "raw_specifications_text": "Gruppe: TFTs\nHersteller: Acer\nHersteller Art. Nr.: UM.HC1EE.V05\nEAN/UPC: 4710886179054\nDisplay-Typ: LED-hintergrundbeleuchteter LCD-Monitor / TFT-Aktivmatrix\nEnergie Effizienzklasse: Klasse G\nEnergieklasse (HDR): Klasse G\nDiagonalabmessung: 68.6 cm (27\")\nSichtbare Bildfl\u00e4che: 68.6 cm (27\")\nAdaptive-Sync Technologie: AMD Adaptive-Sync\nIntegrierte Peripherieger\u00e4te: USB 3.0/USB-C Hub\nBildschirmtyp: IPS\nSeitenverh\u00e4ltnis: 16:9\nNative Aufl\u00f6sung: WQHD 2560 x 1440 (DisplayPort: 165 Hz, HDMI: 144 Hz)\nHelligkeit: 400 cd/m\u00b2\nKontrast: 1000:1 / 100000000:1 (dynamisch)\nFarbunterst\u00fctzung: 1,07 Mrd. Farben\nReaktionszeit: 1 ms (Grau-zu-Grau); 0,7 ms (Grau-zu-Grau min.)\nHorizontaler Betrachtungswinkel: 178\nVertikaler Betrachtungswinkel: 178\nBildschirmbeschichtung: Blendfrei\nHintergrundbeleuchtungs-Technologie: LED-Hintergrundbeleuchtung\nFarbe: Schwarz\nAbmessungen (Breite x Tiefe x H\u00f6he): 61.5 cm x 26.9 cm x 46.5 cm - mit Fu\u00df\nGewicht: 6.49 kg\nEingangsspannung: Wechselstrom 120/230 V (50/60 Hz)\nLeistungsaufnahme im Ein-Zustand: 31.3 W\nStromverbrauch SDR (eingeschaltet): 31.3 kWh/1.000 h\nStromverbrauch HDR (eingeschaltet): 42.4 kWh/1.000 h\nStromverbrauch im Standby-Modus: 0.3 Watt\nStromverbrauch (Aus-Modus): 0.25 Watt\nSchnittstellen: 2 x HDMI  DisplayPort  2 x USB 3.0 Upstream  4 x USB 3.0 Downstream  Audio Line-Out (Mini-Klinkenstecker)  USB-C\nTyp: Lautsprecher - Stereo\nAusgangsleistung/Kanal: 2 Watt\nEinstellungen der Anzeigeposition: H\u00f6he, Drehung, Neigung\nNeigungswinkel: -5/+35\nSchwenkwinkel: 360\nH\u00f6heneinstellung: 178 mm\nVESA-Halterung: 100 x 100 mm\nLeistungsmerkmale: Unterst\u00fctzung f\u00fcr VESA-Schnittstelle\nEnthaltene Kabel: DisplayPort-Kabel  HDMI-Kabel\nKennzeichnung: MPR II, RoHS\nDetails zu Abmessungen & Gewicht: Mit Fu\u00df - Breite: 61.5 cm - Tiefe: 26.9 cm - H\u00f6he: 46.5 cm - Gewicht: 6.49 kg  Ohne Fu\u00df - Breite: 61.4 cm - Tiefe: 1.25 cm - H\u00f6he: 36.7 cm - Gewicht: 4.49 kg",
    "reference_file": "offer_reference_1609.json",
    "shop_name": "1ashop.at"
}