{
    "html_file": "offer_392_20.html",
    "name": "Acer Vero B7 B247YDbmiprczxv, 23.8\"",
    "offer_link": "https://www.electronicshop24.at/product_info.php?products_id=50000000410985889&ano=A410985889&mno=UM.QB7EE.D10&ean=4711121327674&utm_medium=cpc&utm_campaign=preisvergleich&utm_content=item&utm_source=geizhals&ref=geizhals",
    "price": 236.0,
    "raw_specifications": {
        "Adaptive-Sync Technologie": "AMD Adaptive-Sync",
        "Besonderheiten": "Acer Adaptive Contrast Management (ACM), 6-bit + Hi-FRC Color Depth",
        "Bildschirmbeschichtung": "Blendfrei",
        "Bildschirmtyp": "IPS",
        "Diagonalabmessung": "60.5 cm (23.8\")",
        "Display-Typ": "LED-hintergrundbeleuchteter LCD-Monitor / TFT-Aktivmatrix",
        "ENERGY STAR zertifiziert": "Ja",
        "EPEAT-kompatibel": "EPEAT Silver",
        "Ein-/Aus-Schalter": "Ja",
        "Eingangsspannung": "Wechselstrom 120 - 230 V (50/60 Hz)",
        "Einstellungen der Anzeigeposition": "H\u00f6he, Pivot (Rotation), Drehung, Neigung",
        "Energie Effizienzklasse": "Klasse F",
        "Enthaltene Kabel": "1 x DisplayPort-Kabel \u00a6 1 x SuperSpeed-USB-Kabel",
        "Farbe": "Schwarz",
        "Farbunterst\u00fctzung": "16,7 Millionen Farben",
        "Helligkeit": "250 cd/m\u00b2",
        "Hintergrundbeleuchtungs-Technologie": "LED-Hintergrundbeleuchtung",
        "Horizontale Bildwiederholrate": "30 - 85 kHz",
        "Horizontaler Betrachtungswinkel": "178",
        "H\u00f6heneinstellung": "120 mm",
        "Integrierte Peripherieger\u00e4te": "Mikrofon, USB 3.0-Hub, FHD-Kamera, IR-Kamera",
        "Kontrast": "1000:1 / 100000000:1 (dynamisch)",
        "Leistungsaufnahme im Ein-Zustand": "22 W",
        "Leistungsmerkmale": "Unterst\u00fctzung f\u00fcr VESA-Schnittstelle",
        "Lokalisierung": "\u00d6sterreich, Deutschland",
        "Native Aufl\u00f6sung": "Full HD (1080p) 1920 x 1080 bei 75 Hz",
        "Neigungswinkel": "-5/+25",
        "Pixelpitch": "0.27 mm",
        "Reaktionszeit": "4 ms (gray-to-gray)",
        "Rotationswinkel": "90",
        "Schnittstellen": "VGA \u00a6 DisplayPort 1.2 \u00a6 HDMI 1.4 \u00a6 Audio Line-Out \u00a6 Audio Line-In \u00a6 USB 3.0 Upstream (Typ B) \u00a6 2 x USB 3.0 Downstream \u00a6 USB 3.0 Downstream (Schnellladung)",
        "Schwenkwinkel": "90",
        "Seitenverh\u00e4ltnis": "16:9",
        "Stromverbrauch (Aus-Modus)": "0.3 Watt",
        "Stromverbrauch SDR (eingeschaltet)": "21.8 kWh/1.000 h",
        "Stromverbrauch im Standby-Modus": "0.5 Watt",
        "Typ": "Lautsprecher - Stereo",
        "VESA-Halterung": "100 x 100 mm",
        "Vertikale Bildwiederholrate": "48 - 75 Hz",
        "Vertikaler Betrachtungswinkel": "178"
    },
    "raw_specifications_text": "Display-Typ: LED-hintergrundbeleuchteter LCD-Monitor / TFT-Aktivmatrix\nEnergie Effizienzklasse: Klasse F\nDiagonalabmessung: 60.5 cm (23.8\")\nAdaptive-Sync Technologie: AMD Adaptive-Sync\nIntegrierte Peripherieger\u00e4te: Mikrofon, USB 3.0-Hub, FHD-Kamera, IR-Kamera\nBildschirmtyp: IPS\nSeitenverh\u00e4ltnis: 16:9\nNative Aufl\u00f6sung: Full HD (1080p) 1920 x 1080 bei 75 Hz\nPixelpitch: 0.27 mm\nHelligkeit: 250 cd/m\u00b2\nKontrast: 1000:1 / 100000000:1 (dynamisch)\nFarbunterst\u00fctzung: 16,7 Millionen Farben\nReaktionszeit: 4 ms (gray-to-gray)\nVertikale Bildwiederholrate: 48 - 75 Hz\nHorizontale Bildwiederholrate: 30 - 85 kHz\nHorizontaler Betrachtungswinkel: 178\nVertikaler Betrachtungswinkel: 178\nBildschirmbeschichtung: Blendfrei\nHintergrundbeleuchtungs-Technologie: LED-Hintergrundbeleuchtung\nBesonderheiten: Acer Adaptive Contrast Management (ACM), 6-bit + Hi-FRC Color Depth\nFarbe: Schwarz\nTyp: Lautsprecher - Stereo\nSchnittstellen: VGA \u00a6 DisplayPort 1.2 \u00a6 HDMI 1.4 \u00a6 Audio Line-Out \u00a6 Audio Line-In \u00a6 USB 3.0 Upstream (Typ B) \u00a6 2 x USB 3.0 Downstream \u00a6 USB 3.0 Downstream (Schnellladung)\nEinstellungen der Anzeigeposition: H\u00f6he, Pivot (Rotation), Drehung, Neigung\nNeigungswinkel: -5/+25\nSchwenkwinkel: 90\nRotationswinkel: 90\nH\u00f6heneinstellung: 120 mm\nVESA-Halterung: 100 x 100 mm\nLeistungsmerkmale: Unterst\u00fctzung f\u00fcr VESA-Schnittstelle\nEnthaltene Kabel: 1 x DisplayPort-Kabel \u00a6 1 x SuperSpeed-USB-Kabel\nLokalisierung: \u00d6sterreich, Deutschland\nEingangsspannung: Wechselstrom 120 - 230 V (50/60 Hz)\nLeistungsaufnahme im Ein-Zustand: 22 W\nStromverbrauch SDR (eingeschaltet): 21.8 kWh/1.000 h\nStromverbrauch im Standby-Modus: 0.5 Watt\nStromverbrauch (Aus-Modus): 0.3 Watt\nEin-/Aus-Schalter: Ja\nEPEAT-kompatibel: EPEAT Silver\nENERGY STAR zertifiziert: Ja",
    "reference_file": "offer_reference_392.json",
    "shop_name": "ElectronicShop24"
}