{
    "html_file": "offer_2125_12.html",
    "name": "Philips E-line 322E1C, 31.5\"",
    "offer_link": "https://www.alternate.at/Philips/322E1C-00-Gaming-Monitor/html/product/1662339?partner=AtGeizhalsat&campaign=Monitor/Philips/1662339",
    "price": 215.9,
    "raw_specifications": {
        "": "AMD FreeSync",
        "Abmessungen": "Breite: 70,9 cm x H\u00f6he: 52,3 cm x Tiefe/L\u00e4nge: 28,1 cm",
        "Anschl\u00fcsse": "1x HDMI-Eingang, (HDMI-Version: 1.4), 1x DisplayPort-Eingang, (DisplayPort-Version: 1.2), 1x VGA-Eingang, 1x Kopfh\u00f6rer-Ausgang",
        "Bild": "Format",
        "Bildschirmaufl\u00f6sung": "1.920 x 1.080 Pixel",
        "Bildschirmdiagonale": "80 cm (31,5 Zoll)",
        "EAN": "8712581758479",
        "Energieeffizienzklasse (SDR)": "F (A - G)",
        "Energieverbauch pro 1000 Stunden (SDR)": "32 kWh",
        "Ergonomie": "Typ",
        "Farbe": "schwarz",
        "Features": "Mega Infinity DCR, Low Blue Modus, Flimmerfreie LEDs, SmartContrast  Funktion",
        "Frequenz": "Vertikal",
        "Geeignet f\u00fcr": "Gaming",
        "Gewicht": "7,1 kg",
        "Hersteller-Nr.": "322E1C/00",
        "Leistungsaufnahme im Bereitschafts- und Aus-Zustand": "0,3 Watt",
        "Leistungsaufnahme im Ein-Zustand bei Standard-Dynamikumfang (SDR)": "31,5 Watt",
        "Standards": "Video",
        "Stromversorgung": "Eco-Off",
        "Typ": "Gaming-Monitor",
        "Wandhalterung": "VESA kompatibel (100 x 100 mm)",
        "Zubeh\u00f6r": "Vorhanden"
    },
    "raw_specifications_text": "Energieeffizienzklasse (SDR): F (A - G)\nEnergieverbauch pro 1000 Stunden (SDR): 32 kWh\nLeistungsaufnahme im Ein-Zustand bei Standard-Dynamikumfang (SDR): 31,5 Watt\nLeistungsaufnahme im Bereitschafts- und Aus-Zustand: 0,3 Watt\nBildschirmdiagonale: 80 cm (31,5 Zoll)\nBildschirmaufl\u00f6sung: 1.920 x 1.080 Pixel\nTyp: Gaming-Monitor\nFarbe: schwarz\nEAN: 8712581758479\nHersteller-Nr.: 322E1C/00\nGeeignet f\u00fcr: Gaming\nBild: Format\n: AMD FreeSync\nFrequenz: Vertikal\nAnschl\u00fcsse: 1x HDMI-Eingang, (HDMI-Version: 1.4), 1x DisplayPort-Eingang, (DisplayPort-Version: 1.2), 1x VGA-Eingang, 1x Kopfh\u00f6rer-Ausgang\nErgonomie: Typ\nStromversorgung: Eco-Off\nStandards: Video\nWandhalterung: VESA kompatibel (100 x 100 mm)\nFeatures: Mega Infinity DCR, Low Blue Modus, Flimmerfreie LEDs, SmartContrast  Funktion\nZubeh\u00f6r: Vorhanden\nAbmessungen: Breite: 70,9 cm x H\u00f6he: 52,3 cm x Tiefe/L\u00e4nge: 28,1 cm\nGewicht: 7,1 kg",
    "reference_file": "offer_reference_2125.json",
    "shop_name": "Alternate.at"
}