{
    "html_file": "offer_1363_6.html",
    "name": "Samsung Odyssey G3 G3A (2021), 24\"",
    "offer_link": "https://direkt.jacob.de/produkte/samsung-odyssey-g3-ls24ag304nuxen-artnr-7298682.html?utm_source=geizhals&utm_medium=cpc&utm_campaign=Preisvergleich&ref=103",
    "price": 170.3,
    "raw_specifications": {
        "AMD FreeSync": "Ja",
        "AMD FreeSync-Typ": "FreeSync Premium",
        "Anzahl DisplayPort Anschl\u00fcsse": "1",
        "Anzahl HDMI-Anschl\u00fcsse": "1",
        "Anzahl der Farben des Displays": "16,7 Millionen Farben",
        "Bildschirmaufl\u00f6sung": "1920 x 1080 Pixel",
        "Bildschirmdiagonale": "61 cm (24\" )",
        "Bildschirmdiagonale (cm)": "61 cm",
        "Bildschirmform": "Flach",
        "Bildschirmtechnologie": "LCD",
        "Blickwinkel, horizontal": "178\u00b0",
        "Blickwinkel, vertikal": "178\u00b0",
        "Breite (ohne Standfu\u00df)": "54,4 cm",
        "Energieeffizienzklasse (SDR)": "F",
        "Energieverbrauch (SDR) pro 1.000 Stunden": "21 kWh",
        "Flimmerfreie Technologie": "Ja",
        "Ger\u00e4tebreite (inkl. Fu\u00df)": "544 mm",
        "Ger\u00e4teh\u00f6he (inkl. Fu\u00df)": "498,4 mm",
        "Ger\u00e4tetiefe (inkl. Fu\u00df)": "218,9 mm",
        "Gewicht (mit St\u00e4nder)": "4,1 kg",
        "HD-Typ": "Full HD",
        "HDMI": "Ja",
        "HDMI-Kabell\u00e4nge": "1,5 m",
        "Helligkeit (typisch)": "250 cd/m\u00b2",
        "H\u00f6he (ohne Standfu\u00df)": "33,3 cm",
        "H\u00f6heneinstellung": "12 cm",
        "H\u00f6henverstellung": "Ja",
        "Kontrastverh\u00e4ltnis": "3000:1",
        "Kopfh\u00f6rerausgang": "Ja",
        "Kopfh\u00f6rerausg\u00e4nge": "1",
        "Maximale Bildwiederholrate": "144 Hz",
        "Nachhaltigkeitszertifikate": "CE",
        "Natives Seitenverh\u00e4ltnis": "16:9",
        "Neigungswinkelbereich": "5 - 20\u00b0",
        "Paketgewicht": "6,3 kg",
        "Panel-Montage-Schnittstelle": "100 x 100 mm",
        "Panel-Typ": "VA",
        "Pivot": "Ja",
        "Pivot Winkel": "2 - 92\u00b0",
        "Produktfarbe": "Schwarz",
        "Reaktionszeit": "1 ms",
        "Schwenkbar": "Ja",
        "Schwenkwinkelbereich": "15 - 15\u00b0",
        "Spiel-Modus": "Ja",
        "Stromverbrauch (Standby)": "0,5 W",
        "Stromverbrauch (aus)": "0,3 W",
        "Tiefe (ohne Standfu\u00df)": "7,55 cm",
        "VESA-Halterung": "Ja",
        "Verpackungsbreite": "636 mm",
        "Verpackungsh\u00f6he": "213 mm",
        "Verpackungstiefe": "454 mm",
        "kippbar": "Ja"
    },
    "raw_specifications_text": "Bildschirmdiagonale: 61 cm (24\" )\nBildschirmaufl\u00f6sung: 1920 x 1080 Pixel\nNatives Seitenverh\u00e4ltnis: 16:9\nPanel-Typ: VA\nHD-Typ: Full HD\nBildschirmtechnologie: LCD\nBildschirmform: Flach\nKontrastverh\u00e4ltnis: 3000:1\nMaximale Bildwiederholrate: 144 Hz\nAnzahl der Farben des Displays: 16,7 Millionen Farben\nHelligkeit (typisch): 250 cd/m\u00b2\nReaktionszeit: 1 ms\nBlickwinkel, horizontal: 178\u00b0\nBlickwinkel, vertikal: 178\u00b0\nBildschirmdiagonale (cm): 61 cm\nAMD FreeSync: Ja\nAMD FreeSync-Typ: FreeSync Premium\nFlimmerfreie Technologie: Ja\nSpiel-Modus: Ja\nProduktfarbe: Schwarz\nHDMI: Ja\nKopfh\u00f6rerausgang: Ja\nAnzahl HDMI-Anschl\u00fcsse: 1\nAnzahl DisplayPort Anschl\u00fcsse: 1\nKopfh\u00f6rerausg\u00e4nge: 1\nVESA-Halterung: Ja\nH\u00f6henverstellung: Ja\nPanel-Montage-Schnittstelle: 100 x 100 mm\nH\u00f6heneinstellung: 12 cm\nPivot: Ja\nPivot Winkel: 2 - 92\u00b0\nSchwenkbar: Ja\nSchwenkwinkelbereich: 15 - 15\u00b0\nkippbar: Ja\nNeigungswinkelbereich: 5 - 20\u00b0\nEnergieeffizienzklasse (SDR): F\nEnergieverbrauch (SDR) pro 1.000 Stunden: 21 kWh\nStromverbrauch (Standby): 0,5 W\nStromverbrauch (aus): 0,3 W\nNachhaltigkeitszertifikate: CE\nGer\u00e4tebreite (inkl. Fu\u00df): 544 mm\nGer\u00e4tetiefe (inkl. Fu\u00df): 218,9 mm\nGer\u00e4teh\u00f6he (inkl. Fu\u00df): 498,4 mm\nGewicht (mit St\u00e4nder): 4,1 kg\nBreite (ohne Standfu\u00df): 54,4 cm\nTiefe (ohne Standfu\u00df): 7,55 cm\nH\u00f6he (ohne Standfu\u00df): 33,3 cm\nHDMI-Kabell\u00e4nge: 1,5 m\nVerpackungsbreite: 636 mm\nVerpackungstiefe: 454 mm\nVerpackungsh\u00f6he: 213 mm\nPaketgewicht: 6,3 kg",
    "reference_file": "offer_reference_1363.json",
    "shop_name": "Jacob Elektronik direkt (AT)"
}