{
    "html_file": "offer_1910_14.html",
    "name": "LG 43BN70U-B, 42.5\"",
    "offer_link": "https://www.e-tec.at/details.php?artnr=304309",
    "price": 666.4,
    "raw_specifications": {
        "Abmessungen (BxHxT)": "967x647.6x275mm (mit Standfu\u00df),  967x575.2x70.6mm (ohne Standfu\u00df)",
        "Anschl\u00fcsse - DisplayPort 1.4": "1",
        "Anschl\u00fcsse - HDMI 1.4": "2",
        "Anschl\u00fcsse - HDMI 2.0": "2",
        "Anschl\u00fcsse - USB-C 3.0 mit DisplayPort 1.2": "1",
        "Anschl\u00fcsse - USB-C 3.0 mit DisplayPort 1.2 (shared)": "1",
        "Anwendung": "station\u00e4r",
        "Audio": "Lautsprecher (2x 10W),  1x Line-Out",
        "Aufl\u00f6sung": "3840x2160",
        "Beschichtung": "matt (non-glare),  H\u00e4rtegrad 3H",
        "Besonderheiten": "Slim Bezel,  USB-C Power Delivery (60W),  Picture-in-Picture,  Sicherheitsschloss (Kensington),  HDCP 2.2,  Fernbedienung,  kompatibel mit LG Dual Controller Software",
        "Bildwiederholfrequenz": "60Hz",
        "Blickwinkel": "178\u00b0/178\u00b0",
        "Diagonale": "42.5\"/108cm",
        "Energieeffizienzklasse HDR (A bis G)": "G",
        "Energieverbrauch HDR": "82kWh/1000h",
        "Energieverbrauch SDR": "59kWh/1000h",
        "Ergonomie": "N/A (h\u00f6henverstellbar),  N/A (Pivot),  N/A (drehbar),  +10\u00b0/-5\u00b0 (neigbar),  keine Angabe (Schr\u00e4glage)",
        "FRC": "ja (8bit+2bit)",
        "Farbe": "schwarz",
        "Farbtiefe": "10bit (1.07 Mrd. Farben)",
        "Form": "gerade (flat)",
        "Gewicht": "17.50kg (mit Standfu\u00df),  13.80kg (ohne Standfu\u00df)",
        "HDR": "HDR10",
        "Helligkeit": "400cd/m\u00b2",
        "Herstellergarantie": "drei Jahre (Bring-In)",
        "Hintergrundbeleuchtung": "White-LED,  flicker-free,  Blaulichtfilter",
        "Hinweis": "BGR Subpixel Layout. F\u00fcr optimale Text-Darstellung sollten ClearType-Anpassungen im Betriebssystem vorgenommen werden (Info).",
        "Kontrast - statisch": "1.000:1",
        "Lautsprecher": "Ja",
        "Leistungsaufnahme": "200W (maximal),  70W (typisch),  keine Angabe (Energielabel alt A+++ bis G),  0.3W (Standby)",
        "Panel": "IPS (AH-IPS)",
        "Panel-Hersteller": "LG Display",
        "Reaktionszeit - GtG": "8ms",
        "Screen-to-Body-Ratio": "89.5% (berechnet)",
        "Seitenverh\u00e4ltnis": "16:9",
        "Signalfrequenz": "30-135kHz (horizontal),  56-61Hz (vertikal)",
        "Stromversorgung": "AC-In (internes Netzteil)",
        "USB-Hub In": "1x USB-C 3.0 mit DisplayPort 1.2",
        "USB-Hub Out": "2x USB-A 3.0",
        "USB-Schreibweise": "Link",
        "VESA": "200x200 (belegt)",
        "VRR (Variable Refresh Rate)": "N/A",
        "Weitere Anschl\u00fcsse": "N/A"
    },
    "raw_specifications_text": "Abmessungen (BxHxT): 967x647.6x275mm (mit Standfu\u00df),  967x575.2x70.6mm (ohne Standfu\u00df)\nAnschl\u00fcsse - DisplayPort 1.4: 1\nAnschl\u00fcsse - HDMI 1.4: 2\nAnschl\u00fcsse - HDMI 2.0: 2\nAnschl\u00fcsse - USB-C 3.0 mit DisplayPort 1.2: 1\nAnschl\u00fcsse - USB-C 3.0 mit DisplayPort 1.2 (shared): 1\nAnwendung: station\u00e4r\nAudio: Lautsprecher (2x 10W),  1x Line-Out\nAufl\u00f6sung: 3840x2160\nBeschichtung: matt (non-glare),  H\u00e4rtegrad 3H\nBesonderheiten: Slim Bezel,  USB-C Power Delivery (60W),  Picture-in-Picture,  Sicherheitsschloss (Kensington),  HDCP 2.2,  Fernbedienung,  kompatibel mit LG Dual Controller Software\nBildwiederholfrequenz: 60Hz\nBlickwinkel: 178\u00b0/178\u00b0\nDiagonale: 42.5\"/108cm\nEnergieeffizienzklasse HDR (A bis G): G\nEnergieverbrauch HDR: 82kWh/1000h\nEnergieverbrauch SDR: 59kWh/1000h\nErgonomie: N/A (h\u00f6henverstellbar),  N/A (Pivot),  N/A (drehbar),  +10\u00b0/-5\u00b0 (neigbar),  keine Angabe (Schr\u00e4glage)\nFarbe: schwarz\nFarbtiefe: 10bit (1.07 Mrd. Farben)\nForm: gerade (flat)\nFRC: ja (8bit+2bit)\nGewicht: 17.50kg (mit Standfu\u00df),  13.80kg (ohne Standfu\u00df)\nHDR: HDR10\nHelligkeit: 400cd/m\u00b2\nHerstellergarantie: drei Jahre (Bring-In)\nHintergrundbeleuchtung: White-LED,  flicker-free,  Blaulichtfilter\nHinweis: BGR Subpixel Layout. F\u00fcr optimale Text-Darstellung sollten ClearType-Anpassungen im Betriebssystem vorgenommen werden (Info).\nKontrast - statisch: 1.000:1\nLautsprecher: Ja\nLeistungsaufnahme: 200W (maximal),  70W (typisch),  keine Angabe (Energielabel alt A+++ bis G),  0.3W (Standby)\nPanel: IPS (AH-IPS)\nPanel-Hersteller: LG Display\nReaktionszeit - GtG: 8ms\nScreen-to-Body-Ratio: 89.5% (berechnet)\nSeitenverh\u00e4ltnis: 16:9\nSignalfrequenz: 30-135kHz (horizontal),  56-61Hz (vertikal)\nStromversorgung: AC-In (internes Netzteil)\nUSB-Hub In: 1x USB-C 3.0 mit DisplayPort 1.2\nUSB-Hub Out: 2x USB-A 3.0\nUSB-Schreibweise: Link\nVESA: 200x200 (belegt)\nVRR (Variable Refresh Rate): N/A\nWeitere Anschl\u00fcsse: N/A",
    "reference_file": "offer_reference_1910.json",
    "shop_name": "e-tec.at"
}