{
    "html_file": "offer_1392_12.html",
    "name": "HP M27fq, 27\"",
    "offer_link": "https://direkt.jacob.de/produkte/hp-m27fq-68-6-2h4b5e9-abb-artnr-7528078.html?utm_source=geizhals&utm_medium=cpc&utm_campaign=Preisvergleich&ref=103",
    "price": 345.2,
    "raw_specifications": {
        "AC Eingangsfrequenz": "50/60 Hz",
        "AC Eingangsspannung": "100 - 240 V",
        "AMD FreeSync": "Ja",
        "Anzahl DisplayPort Anschl\u00fcsse": "1",
        "Anzahl HDMI-Anschl\u00fcsse": "2",
        "Bildschirmaufl\u00f6sung": "2560 x 1440 Pixel",
        "Bildschirmdiagonale": "68,6 cm (27\" )",
        "Bildschirmform": "Flach",
        "Bildschirmtechnologie": "LED",
        "Blendfreier Bildschirm": "Ja",
        "Blickwinkel, horizontal": "178\u00b0",
        "Blickwinkel, vertikal": "178\u00b0",
        "Breite (ohne Standfu\u00df)": "61 cm",
        "Digital vertikale Frequenz": "48 - 75 Hz",
        "DisplayPorts-Version": "1.2",
        "Eingebaute Lautsprecher": "Nein",
        "Eingebautes Mikrofon": "Nein",
        "Energie Effizienzklasse": "F",
        "Farbintensit\u00e4t": "8 Bit",
        "Farbskala": "99%",
        "Flimmerfreie Technologie": "Ja",
        "Ger\u00e4tebreite (inkl. Fu\u00df)": "609,7 mm",
        "Ger\u00e4teh\u00f6he (inkl. Fu\u00df)": "438,1 mm",
        "Ger\u00e4tetiefe (inkl. Fu\u00df)": "188,2 mm",
        "Gewicht (mit St\u00e4nder)": "3,2 kg",
        "HD-Typ": "Quad HD",
        "HDCP": "Ja",
        "HDMI": "Ja",
        "HDMI-Version": "1.4",
        "Helligkeit (typisch)": "300 cd/m\u00b2",
        "Horizontaler Scanbereich": "30 - 120 kHz",
        "H\u00f6he (ohne Standfu\u00df)": "35,7 cm",
        "H\u00f6henverstellung": "Nein",
        "Integrierte Kamera": "Nein",
        "Integrierter USB-Hub": "Nein",
        "Kabelsperre-Slot": "Nein",
        "Kontrastverh\u00e4ltnis": "1000:1",
        "Kontrastverh\u00e4ltnis (dynamisch)": "10000000:1",
        "Kopfh\u00f6rerausgang": "Nein",
        "Low-Blue-Light-Technologie": "Ja",
        "Luftfeuchtigkeit bei Lagerung": "5 - 95%",
        "Marktpositionierung": "Haus",
        "Maximale Bildwiederholrate": "75 Hz",
        "Mitgelieferte Kabel": "AC, DisplayPort, HDMI",
        "NVIDIA G-SYNC": "Nein",
        "Natives Seitenverh\u00e4ltnis": "16:9",
        "Neigungswinkelbereich": "5 - 25\u00b0",
        "Oberfl\u00e4chenh\u00e4rte": "3H",
        "Paketgewicht": "5,8 kg",
        "Panel-Typ": "IPS",
        "Pivot": "Nein",
        "Pixel Abstand": "0,233 x 0,233 mm",
        "Pixeldichte": "109 ppi",
        "Produktfarbe": "Silber",
        "RGB-Farbraum": "sRGB",
        "Reaktionszeit": "5 ms",
        "Relative Luftfeuchtigkeit in Betrieb": "20 - 80%",
        "Schwenkbar": "Nein",
        "Stromverbrauch (Standardbetrieb)": "22,3 W",
        "Stromverbrauch (Standby)": "0,5 W",
        "Stromverbrauch (max.)": "31,5 W",
        "Temperaturbereich in Betrieb": "5 - 35 \u00b0C",
        "Tiefe (ohne Standfu\u00df)": "3,2 cm",
        "Typ der Hintergrundbeleuchtung": "Seiten-LED",
        "Unterst\u00fctzte Grafik-Aufl\u00f6sungen": "640 x 480 (VGA),720 x 400,800 x 600 (SVGA),1024 x 768 (XGA),1280 x 1024 (SXGA),1280 x 720 (HD 720),1280 x 800 (WXGA),1440 x 900 (WXGA+),1600 x 900,1680 x 1050 (WSXGA+),1920 x 1080 (HD 1080),1920 x 1200 (WUXGA),2560 x 1440",
        "VESA-Halterung": "Nein",
        "Verpackungsbreite": "690 mm",
        "Verpackungsh\u00f6he": "430 mm",
        "Verpackungstiefe": "126 mm",
        "kippbar": "Ja"
    },
    "raw_specifications_text": "Bildschirmdiagonale: 68,6 cm (27\" )\nBildschirmaufl\u00f6sung: 2560 x 1440 Pixel\nEnergie Effizienzklasse: F\nNatives Seitenverh\u00e4ltnis: 16:9\nPanel-Typ: IPS\nHD-Typ: Quad HD\nBildschirmtechnologie: LED\nBildschirmform: Flach\nKontrastverh\u00e4ltnis: 1000:1\nMaximale Bildwiederholrate: 75 Hz\nHelligkeit (typisch): 300 cd/m\u00b2\nReaktionszeit: 5 ms\nTyp der Hintergrundbeleuchtung: Seiten-LED\nBlendfreier Bildschirm: Ja\nUnterst\u00fctzte Grafik-Aufl\u00f6sungen: 640 x 480 (VGA),720 x 400,800 x 600 (SVGA),1024 x 768 (XGA),1280 x 1024 (SXGA),1280 x 720 (HD 720),1280 x 800 (WXGA),1440 x 900 (WXGA+),1600 x 900,1680 x 1050 (WSXGA+),1920 x 1080 (HD 1080),1920 x 1200 (WUXGA),2560 x 1440\nKontrastverh\u00e4ltnis (dynamisch): 10000000:1\nBlickwinkel, horizontal: 178\u00b0\nBlickwinkel, vertikal: 178\u00b0\nPixel Abstand: 0,233 x 0,233 mm\nPixeldichte: 109 ppi\nHorizontaler Scanbereich: 30 - 120 kHz\nDigital vertikale Frequenz: 48 - 75 Hz\nOberfl\u00e4chenh\u00e4rte: 3H\nFarbintensit\u00e4t: 8 Bit\nRGB-Farbraum: sRGB\nFarbskala: 99%\nNVIDIA G-SYNC: Nein\nAMD FreeSync: Ja\nFlimmerfreie Technologie: Ja\nLow-Blue-Light-Technologie: Ja\nEingebaute Lautsprecher: Nein\nIntegrierte Kamera: Nein\nEingebautes Mikrofon: Nein\nMarktpositionierung: Haus\nProduktfarbe: Silber\nIntegrierter USB-Hub: Nein\nHDMI: Ja\nKopfh\u00f6rerausgang: Nein\nAnzahl HDMI-Anschl\u00fcsse: 2\nHDMI-Version: 1.4\nAnzahl DisplayPort Anschl\u00fcsse: 1\nDisplayPorts-Version: 1.2\nHDCP: Ja\nVESA-Halterung: Nein\nKabelsperre-Slot: Nein\nH\u00f6henverstellung: Nein\nPivot: Nein\nSchwenkbar: Nein\nkippbar: Ja\nNeigungswinkelbereich: 5 - 25\u00b0\nStromverbrauch (Standardbetrieb): 22,3 W\nStromverbrauch (Standby): 0,5 W\nStromverbrauch (max.): 31,5 W\nAC Eingangsspannung: 100 - 240 V\nAC Eingangsfrequenz: 50/60 Hz\nTemperaturbereich in Betrieb: 5 - 35 \u00b0C\nRelative Luftfeuchtigkeit in Betrieb: 20 - 80%\nLuftfeuchtigkeit bei Lagerung: 5 - 95%\nGer\u00e4tebreite (inkl. Fu\u00df): 609,7 mm\nGer\u00e4tetiefe (inkl. Fu\u00df): 188,2 mm\nGer\u00e4teh\u00f6he (inkl. Fu\u00df): 438,1 mm\nGewicht (mit St\u00e4nder): 3,2 kg\nBreite (ohne Standfu\u00df): 61 cm\nTiefe (ohne Standfu\u00df): 3,2 cm\nH\u00f6he (ohne Standfu\u00df): 35,7 cm\nMitgelieferte Kabel: AC, DisplayPort, HDMI\nVerpackungsbreite: 690 mm\nVerpackungstiefe: 126 mm\nVerpackungsh\u00f6he: 430 mm\nPaketgewicht: 5,8 kg",
    "reference_file": "offer_reference_1392.json",
    "shop_name": "Jacob Elektronik direkt (AT)"
}