{
    "html_file": "offer_1309_1.html",
    "name": "LG 24MP400-B, 23.8\"",
    "offer_link": "https://www.proshop.at/Bildschirm/LG-24-Bildschirm-24MP400-B-Black-5-ms-AMD-FreeSync/3028553?utm_source=geizhals&utm_medium=cpc&utm_campaign=pricesite",
    "price": 106.97,
    "raw_specifications": {
        "Abmessungen (Breite x Tiefe x H\u00f6he)": "53.99 cm x 19 cm x 41.44 cm - mit Fu\u00df",
        "Abmessungen (Breite x Tiefe x H\u00f6he) - mit Fu\u00df": "53.99 cm x 19 cm x 41.44 cm",
        "Adaptive-Sync Technologie": "AMD FreeSync",
        "Besonderheiten": "Crosshair Display, Flicker Safe, Reader Mode, Intelligente Energiespartechnologie, Black Stabilizer, DAS Mode (Dynamic Action Sync), Color Weakness Mode, Super Resolution+, nahezu rahmenloses Display an 3 Seiten",
        "Bildschirmbeschichtung": "Blendfrei",
        "Bildschirmtyp": "IPS",
        "Details zu Abmessungen & Gewicht": "Mit Fu\u00df - Breite: 53.99 cm - Tiefe: 19 cm - H\u00f6he: 41.44 cm - Gewicht: 2.6 kg  Ohne Fu\u00df - Breite: 53.99 cm - Tiefe: 5.62 cm - H\u00f6he: 32.14 cm - Gewicht: 2.3 kg",
        "Diagonalabmessung": "60.5 cm (23.8\")",
        "Display-Typ": "LED-hintergrundbeleuchteter LCD-Monitor / TFT-Aktivmatrix",
        "EAN": "8806091356888",
        "Eingangsanschl\u00fcsse": "HDMI, VGA",
        "Eingangsspannung": "Wechselstrom 100/240 V (50/60 Hz)",
        "Einstellungen der Anzeigeposition": "Neigung",
        "Energie Effizienzklasse": "Klasse F",
        "Energierverbrauch Sleep": "0.3 Watt",
        "Enthaltene Kabel": "1 x HDMI-Kabel",
        "Farbraum": "72% NTSC (CIE 1931)",
        "Farbunterst\u00fctzung": "16,7 Millionen Farben",
        "Ger\u00e4tetyp": "LED-hintergrundbeleuchteter LCD-Monitor - 60.5 cm (23.8\")",
        "Gewicht": "2.6 kg",
        "Helligkeit": "250 cd/m\u00b2",
        "Hersteller": "LG",
        "Hintergrundbeleuchtungs-Technologie": "LED-Hintergrundbeleuchtung",
        "Horizontaler Betrachtungswinkel": "178",
        "Kennzeichnung": "FCC Klasse B bescheinigt, UL, TUV, VCCI, BSMI, cUL, CB, CCC, RoHS, REACH, KC, ERP, BIS",
        "Kontrast": "1000:1",
        "Leistungsaufnahme im Ein-Zustand": "19.5 W",
        "Leistungsmerkmale": "Slot f\u00fcr Sicherheitsschloss (Kabelschloss getrennt erh\u00e4ltlich)",
        "Mitgelieferte Software": "LG On-Screen Control",
        "Modell": "24MP400-B",
        "Native Aufl\u00f6sung": "Full HD (1080p) 1920 x 1080 bei 75 Hz",
        "Neigungswinkel": "-5/+15",
        "Pixelpitch": "0.2745 mm",
        "Produktbeschreibung": "LG 24MP400-B - LED-Monitor - Full HD (1080p) - 60.5 cm (23.8\")",
        "Reaktionszeit": "5 ms (Gray-to-Gray)",
        "Schlosstyp zur Diebstahlsicherung": "Kensington Slot",
        "Schnittstellen": "HDMI  VGA",
        "Seitenverh\u00e4ltnis": "16:9",
        "Spannung": "Wechselstrom 100/240 V (50/60 Hz)",
        "Stromverbrauch (Aus-Modus)": "0.3 Watt",
        "Stromverbrauch (max.)": "22 Watt",
        "Stromverbrauch (typisch)": "19 Watt",
        "Stromverbrauch SDR (eingeschaltet)": "19.5 kWh/1.000 h",
        "Transportbreite": "61.5 cm",
        "Transportgewicht": "3.9 kg",
        "Transporth\u00f6he": "14.8 cm",
        "Transporttiefe": "41 cm",
        "VESA-Halterung": "75 x 75 mm",
        "Vertikale Bildwiederholrate": "56 - 75 Hz",
        "Vertikaler Betrachtungswinkel": "178",
        "Waren-Nr.": "3028553",
        "Zubeh\u00f6r im Lieferumfang": "Schrauben",
        "Zum Hersteller": "www.lge.com"
    },
    "raw_specifications_text": "Hersteller: LG\nWaren-Nr.: 3028553\nModell: 24MP400-B\nEAN: 8806091356888\nZum Hersteller: www.lge.com\nProduktbeschreibung: LG 24MP400-B - LED-Monitor - Full HD (1080p) - 60.5 cm (23.8\")\nGer\u00e4tetyp: LED-hintergrundbeleuchteter LCD-Monitor - 60.5 cm (23.8\")\nEnergie Effizienzklasse: Klasse F\nLeistungsaufnahme im Ein-Zustand: 19.5 W\nAdaptive-Sync Technologie: AMD FreeSync\nBildschirmtyp: IPS\nSeitenverh\u00e4ltnis: 16:9\nNative Aufl\u00f6sung: Full HD (1080p) 1920 x 1080 bei 75 Hz\nPixelpitch: 0.2745 mm\nHelligkeit: 250 cd/m\u00b2\nKontrast: 1000:1\nReaktionszeit: 5 ms (Gray-to-Gray)\nFarbunterst\u00fctzung: 16,7 Millionen Farben\nFarbraum: 72% NTSC (CIE 1931)\nEingangsanschl\u00fcsse: HDMI, VGA\nEinstellungen der Anzeigeposition: Neigung\nBildschirmbeschichtung: Blendfrei\nSpannung: Wechselstrom 100/240 V (50/60 Hz)\nAbmessungen (Breite x Tiefe x H\u00f6he) - mit Fu\u00df: 53.99 cm x 19 cm x 41.44 cm\nGewicht: 2.6 kg\nKennzeichnung: FCC Klasse B bescheinigt, UL, TUV, VCCI, BSMI, cUL, CB, CCC, RoHS, REACH, KC, ERP, BIS\nDisplay-Typ: LED-hintergrundbeleuchteter LCD-Monitor / TFT-Aktivmatrix\nDiagonalabmessung: 60.5 cm (23.8\")\nVertikale Bildwiederholrate: 56 - 75 Hz\nHorizontaler Betrachtungswinkel: 178\nVertikaler Betrachtungswinkel: 178\nHintergrundbeleuchtungs-Technologie: LED-Hintergrundbeleuchtung\nBesonderheiten: Crosshair Display, Flicker Safe, Reader Mode, Intelligente Energiespartechnologie, Black Stabilizer, DAS Mode (Dynamic Action Sync), Color Weakness Mode, Super Resolution+, nahezu rahmenloses Display an 3 Seiten\nAbmessungen (Breite x Tiefe x H\u00f6he): 53.99 cm x 19 cm x 41.44 cm - mit Fu\u00df\nSchnittstellen: HDMI  VGA\nNeigungswinkel: -5/+15\nVESA-Halterung: 75 x 75 mm\nLeistungsmerkmale: Slot f\u00fcr Sicherheitsschloss (Kabelschloss getrennt erh\u00e4ltlich)\nZubeh\u00f6r im Lieferumfang: Schrauben\nEnthaltene Kabel: 1 x HDMI-Kabel\nSchlosstyp zur Diebstahlsicherung: Kensington Slot\nEingangsspannung: Wechselstrom 100/240 V (50/60 Hz)\nStromverbrauch SDR (eingeschaltet): 19.5 kWh/1.000 h\nStromverbrauch (typisch): 19 Watt\nStromverbrauch (max.): 22 Watt\nEnergierverbrauch Sleep: 0.3 Watt\nStromverbrauch (Aus-Modus): 0.3 Watt\nMitgelieferte Software: LG On-Screen Control\nDetails zu Abmessungen & Gewicht: Mit Fu\u00df - Breite: 53.99 cm - Tiefe: 19 cm - H\u00f6he: 41.44 cm - Gewicht: 2.6 kg  Ohne Fu\u00df - Breite: 53.99 cm - Tiefe: 5.62 cm - H\u00f6he: 32.14 cm - Gewicht: 2.3 kg\nTransportbreite: 61.5 cm\nTransporttiefe: 41 cm\nTransporth\u00f6he: 14.8 cm\nTransportgewicht: 3.9 kg",
    "reference_file": "offer_reference_1309.json",
    "shop_name": "Proshop.at"
}