{
    "html_file": "offer_571_7.html",
    "name": "Acer Nitro XV0 XV320QULVbmiiphx, 31.5\"",
    "offer_link": "https://direkt.jacob.de/produkte/acer-nitro-xv0-um-jx0ee-v01-artnr-8261224.html?utm_source=geizhals&utm_medium=cpc&utm_campaign=Preisvergleich&ref=103",
    "price": 381.16,
    "raw_specifications": {
        "AMD FreeSync": "Ja",
        "Anzahl DisplayPort Anschl\u00fcsse": "1",
        "Bildschirmdiagonale": "80 cm (31.5\" )",
        "Bildschirmform": "Flach",
        "Bildwinkel, horizontal": "178\u00b0",
        "Bildwinkel, vertikal": "178\u00b0",
        "Display-Aufl\u00f6sung": "2560 x 1440 Pixel",
        "DisplayPorts-Version": "1.2",
        "Energie Effizienzklasse": "G",
        "Gewicht (mit St\u00e4nder)": "7,64 kg",
        "HD-Typ": "Wide Quad HD",
        "HDMI": "Ja",
        "HDMI-Version": "2.0",
        "Helligkeit (typisch)": "250 cd/m\u00b2",
        "H\u00f6heneinstellung": "9 cm",
        "H\u00f6henverstellung": "Ja",
        "Kontrastverh\u00e4ltnis": "1000:1",
        "Kopfh\u00f6rerausgang": "Ja",
        "Marktpositionierung": "Gaming",
        "Maximale Bildwiederholrate": "170 Hz",
        "Mitgelieferte Kabel": "AC, DisplayPort, HDMI",
        "Natives Seitenverh\u00e4ltnis": "16:9",
        "Panel-Montage-Schnittstelle": "100 x 100 mm",
        "Panel-Typ": "IPS",
        "Produktfarbe": "Schwarz",
        "Reaktionszeit": "1 ms",
        "Seitenverh\u00e4ltnis": "16:9",
        "Stromverbrauch (Standardbetrieb)": "65 W",
        "St\u00e4nder enthalten": "Ja",
        "Touchscreen": "Nein",
        "Typ der Hintergrundbeleuchtung": "LED",
        "VESA-Halterung": "Ja",
        "Warentarifnummer (HS)": "85285210",
        "Zertifizierung": "MPR II"
    },
    "raw_specifications_text": "Bildschirmdiagonale: 80 cm (31.5\" )\nDisplay-Aufl\u00f6sung: 2560 x 1440 Pixel\nEnergie Effizienzklasse: G\nNatives Seitenverh\u00e4ltnis: 16:9\nTouchscreen: Nein\nHD-Typ: Wide Quad HD\nPanel-Typ: IPS\nBildschirmform: Flach\nKontrastverh\u00e4ltnis: 1000:1\nMaximale Bildwiederholrate: 170 Hz\nTyp der Hintergrundbeleuchtung: LED\nHelligkeit (typisch): 250 cd/m\u00b2\nReaktionszeit: 1 ms\nSeitenverh\u00e4ltnis: 16:9\nBildwinkel, horizontal: 178\u00b0\nBildwinkel, vertikal: 178\u00b0\nAMD FreeSync: Ja\nMarktpositionierung: Gaming\nProduktfarbe: Schwarz\nZertifizierung: MPR II\nHDMI: Ja\nKopfh\u00f6rerausgang: Ja\nHDMI-Version: 2.0\nAnzahl DisplayPort Anschl\u00fcsse: 1\nDisplayPorts-Version: 1.2\nVESA-Halterung: Ja\nH\u00f6henverstellung: Ja\nPanel-Montage-Schnittstelle: 100 x 100 mm\nH\u00f6heneinstellung: 9 cm\nStromverbrauch (Standardbetrieb): 65 W\nSt\u00e4nder enthalten: Ja\nMitgelieferte Kabel: AC, DisplayPort, HDMI\nGewicht (mit St\u00e4nder): 7,64 kg\nWarentarifnummer (HS): 85285210",
    "reference_file": "offer_reference_571.json",
    "shop_name": "Jacob Elektronik direkt (AT)"
}