{
    "html_file": "offer_1760_32.html",
    "name": "ASUS ROG Swift PG329Q, 32\"",
    "offer_link": "https://ms-it-beratung.at/shop/details.php?art=348126&artname=ASUS+ROG+Swift+PG329Q+81.28cm+%2816%3A9%29+WQHD+HDMI+DP",
    "price": 854.0,
    "raw_specifications": {
        "AMD FreeSync": "Nein",
        "Anzahl DisplayPort Anschl\u00fcsse": "1",
        "Anzahl HDMI-Anschl\u00fcsse": "2",
        "Anzahl der Farben des Displays": "1,073 Milliarden Farben",
        "Anzahl der nachgeschalteten Steckpl\u00e4tze vom Typ USB-A": "2",
        "Anzahl der vorgeschalteten Steckpl\u00e4tze": "1",
        "Audioanschl\u00fcsse": "Nein",
        "Bildschirmdiagonale": "81,3 cm (32 Zoll)",
        "Bildschirmform": "Flach",
        "Bildwinkel, horizontal": "178\u00b0",
        "Bildwinkel, vertikal": "178\u00b0",
        "Breite (ohne Standfu\u00df)": "72,8 cm",
        "DVI Anschluss": "Nein",
        "Digital horizontale Frequenz": "30 - 250 kHz",
        "Digital vertikale Frequenz": "48 - 175 Hz",
        "Display-Aufl\u00f6sung": "2560 x 1440 Pixel",
        "DisplayPorts-Version": "1.2",
        "Eingebaute Lautsprecher": "Nein",
        "Energieeffizienzklasse (HDR)": "G",
        "Energieeffizienzklasse (SDR)": "G",
        "Energieeffizienzskala": "A bis G",
        "Energieverbrauch (HDR) pro 1.000 Stunden": "91 kWh",
        "Energieverbrauch (SDR) pro 1.000 Stunden": "42 kWh",
        "Flimmerfreie Technologie": "Ja",
        "Fu\u00dffarbe": "Schwarz",
        "Ger\u00e4tebreite (inkl. Fu\u00df)": "728,2 mm",
        "Ger\u00e4teh\u00f6he (inkl. Fu\u00df)": "551,8 mm",
        "Ger\u00e4tetiefe (inkl. Fu\u00df)": "292,6 mm",
        "Gewicht (mit St\u00e4nder)": "9,5 kg",
        "Gewicht (ohne St\u00e4nder)": "5,9 kg",
        "HD-Typ": "Quad HD",
        "HDCP": "Ja",
        "HDMI": "Ja",
        "HDMI-Version": "2.0",
        "Helligkeit (typisch)": "600 cd/m\u00b2",
        "High Dynamic Range Video (HDR) Unterst\u00fctzung": "Ja",
        "H\u00f6he (ohne Standfu\u00df)": "42,9 cm",
        "H\u00f6heneinstellung": "10 cm",
        "H\u00f6henverstellung": "Ja",
        "Integrierte Kamera": "Nein",
        "Integrierter USB-Hub": "Ja",
        "Kabelsperre-Slot": "Ja",
        "Kontrastverh\u00e4ltnis": "1000:1",
        "Kopfh\u00f6rer-Anschluss": "3,5 mm",
        "Kopfh\u00f6rerausgang": "Ja",
        "Kopfh\u00f6rerausg\u00e4nge": "1",
        "Low-Blue-Light-Technologie": "Ja",
        "Marktpositionierung": "Gaming",
        "Maximale Bildwiederholrate": "175 Hz",
        "Mitgelieferte Kabel": "AC",
        "NVIDIA G-SYNC": "Ja",
        "NVIDIA G-SYNC-Typ": "G-SYNC Compatible",
        "Natives Seitenverh\u00e4ltnis": "16:9",
        "Neigungsverstellung": "Ja",
        "Neigungswinkelbereich": "-5 - 20\u00b0",
        "Paketgewicht": "14,3 kg",
        "Panel-Montage-Schnittstelle": "100 x 100 mm",
        "Panel-Typ": "IPS",
        "Pixel Abstand": "0,2768 x 0,2768 mm",
        "Produktfarbe": "Schwarz",
        "Reaktionszeit": "1 ms",
        "Schwenkbar": "Ja",
        "Schwenkwinkelbereich": "-25 - 25\u00b0",
        "Sichtbare Gr\u00f6\u00dfe (horizontal)": "70,8 cm",
        "Sichtbare Gr\u00f6\u00dfe (vertikal)": "39,9 cm",
        "Slot-Typ Kabelsperre": "Kensington",
        "Stromverbrauch (Standardbetrieb)": "43 W",
        "Stromverbrauch (Standby)": "0,5 W",
        "Stromverbrauch (aus)": "0,5 W",
        "Technologie mit hohem Dynamikbereich (HDR)": "High Dynamic Range (HDR) 600",
        "Tiefe (ohne Standfu\u00df)": "8,71 cm",
        "Touchscreen": "Nein",
        "USB-Upstream-Porttyp": "USB Typ-B",
        "Unterst\u00fctzte Grafik-Aufl\u00f6sungen": "2560 x 1440",
        "VESA Adaptive Sync unterst\u00fctzt": "Ja",
        "VESA-Halterung": "Ja",
        "Verpackungsbreite": "812 mm",
        "Verpackungsh\u00f6he": "626 mm",
        "Verpackungstiefe": "238 mm",
        "Warentarifnummer (HS)": "85285210"
    },
    "raw_specifications_text": "Bildschirmdiagonale: 81,3 cm (32 Zoll)\nDisplay-Aufl\u00f6sung: 2560 x 1440 Pixel\nNatives Seitenverh\u00e4ltnis: 16:9\nTouchscreen: Nein\nHD-Typ: Quad HD\nPanel-Typ: IPS\nHelligkeit (typisch): 600 cd/m\u00b2\nReaktionszeit: 1 ms\nBildschirmform: Flach\nUnterst\u00fctzte Grafik-Aufl\u00f6sungen: 2560 x 1440\nKontrastverh\u00e4ltnis: 1000:1\nMaximale Bildwiederholrate: 175 Hz\nBildwinkel, horizontal: 178\u00b0\nBildwinkel, vertikal: 178\u00b0\nAnzahl der Farben des Displays: 1,073 Milliarden Farben\nPixel Abstand: 0,2768 x 0,2768 mm\nSichtbare Gr\u00f6\u00dfe (horizontal): 70,8 cm\nSichtbare Gr\u00f6\u00dfe (vertikal): 39,9 cm\nDigital horizontale Frequenz: 30 - 250 kHz\nDigital vertikale Frequenz: 48 - 175 Hz\nHigh Dynamic Range Video (HDR) Unterst\u00fctzung: Ja\nTechnologie mit hohem Dynamikbereich (HDR): High Dynamic Range (HDR) 600\nNVIDIA G-SYNC: Ja\nAMD FreeSync: Nein\nNVIDIA G-SYNC-Typ: G-SYNC Compatible\nVESA Adaptive Sync unterst\u00fctzt: Ja\nFlimmerfreie Technologie: Ja\nLow-Blue-Light-Technologie: Ja\nEingebaute Lautsprecher: Nein\nIntegrierte Kamera: Nein\nMarktpositionierung: Gaming\nProduktfarbe: Schwarz\nFu\u00dffarbe: Schwarz\nIntegrierter USB-Hub: Ja\nUSB-Upstream-Porttyp: USB Typ-B\nAnzahl der vorgeschalteten Steckpl\u00e4tze: 1\nAnzahl der nachgeschalteten Steckpl\u00e4tze vom Typ USB-A: 2\nDVI Anschluss: Nein\nHDMI: Ja\nAnzahl HDMI-Anschl\u00fcsse: 2\nHDMI-Version: 2.0\nAnzahl DisplayPort Anschl\u00fcsse: 1\nDisplayPorts-Version: 1.2\nAudioanschl\u00fcsse: Nein\nKopfh\u00f6rerausgang: Ja\nKopfh\u00f6rerausg\u00e4nge: 1\nKopfh\u00f6rer-Anschluss: 3,5 mm\nHDCP: Ja\nVESA-Halterung: Ja\nPanel-Montage-Schnittstelle: 100 x 100 mm\nKabelsperre-Slot: Ja\nSlot-Typ Kabelsperre: Kensington\nH\u00f6henverstellung: Ja\nH\u00f6heneinstellung: 10 cm\nSchwenkbar: Ja\nSchwenkwinkelbereich: -25 - 25\u00b0\nNeigungswinkelbereich: -5 - 20\u00b0\nNeigungsverstellung: Ja\nEnergieeffizienzklasse (SDR): G\nEnergieeffizienzklasse (HDR): G\nEnergieverbrauch (SDR) pro 1.000 Stunden: 42 kWh\nEnergieverbrauch (HDR) pro 1.000 Stunden: 91 kWh\nStromverbrauch (Standardbetrieb): 43 W\nStromverbrauch (Standby): 0,5 W\nStromverbrauch (aus): 0,5 W\nEnergieeffizienzskala: A bis G\nMitgelieferte Kabel: AC\nGer\u00e4tebreite (inkl. Fu\u00df): 728,2 mm\nGer\u00e4tetiefe (inkl. Fu\u00df): 292,6 mm\nGer\u00e4teh\u00f6he (inkl. Fu\u00df): 551,8 mm\nGewicht (mit St\u00e4nder): 9,5 kg\nBreite (ohne Standfu\u00df): 72,8 cm\nTiefe (ohne Standfu\u00df): 8,71 cm\nH\u00f6he (ohne Standfu\u00df): 42,9 cm\nGewicht (ohne St\u00e4nder): 5,9 kg\nVerpackungsbreite: 812 mm\nVerpackungstiefe: 238 mm\nVerpackungsh\u00f6he: 626 mm\nPaketgewicht: 14,3 kg\nWarentarifnummer (HS): 85285210",
    "reference_file": "offer_reference_1760.json",
    "shop_name": "ms-it-beratung"
}