{
    "html_file": "offer_741_5.html",
    "name": "Samsung Odyssey OLED G8 G85SB, 34\"",
    "offer_link": "https://www.mylemon.at/artikel/samsung/ls34bg850suxen/odyssey-gaming-monitor-g85nb-32.html",
    "price": 1014.99,
    "raw_specifications": {
        "AC Eingangsfrequenz": "50/60 Hz",
        "AC Eingangsspannung": "100 - 240 V",
        "AMD FreeSync": "Ja",
        "AMD FreeSync-Typ": "FreeSync Premium",
        "Adaptive Klangsteuerung (ASC)": "Ja",
        "AirPlay": "Ja",
        "Anzahl Micro HDMI Anschl\u00fcsse": "1",
        "Anzahl Mini DisplayPorts": "1",
        "Anzahl der Farben des Displays": "1 Milliarden Farben",
        "Anzahl der nachgeschalteten Ports vom Typ USB-C": "2",
        "Artikelnummer": "M1EY7SAL",
        "Audioanschl\u00fcsse": "Nein",
        "Auf Ansicht tippen": "Ja",
        "Aufl\u00f6sung": "3440x1440",
        "Besonderheiten": "170 Hz",
        "Betriebstemperatur": "10 - 40 \u00b0C",
        "Bewertung der Bildschirmkr\u00fcmmung": "1800R",
        "Bildschirmdiagonale": "86,4 cm (34 Zoll)",
        "Bildschirmdiagonale (cm)": "86 cm",
        "Bildschirmform": "Gebogen",
        "Bildschirmtechnologie": "OLED",
        "Bildwinkel, horizontal": "178\u00b0",
        "Bildwinkel, vertikal": "178\u00b0",
        "Bluetooth": "Ja",
        "Bluetooth-Version": "5.2",
        "Breite (ohne Standfu\u00df)": "81,4 cm",
        "ConnectShare (USB)": "Ja",
        "DVI Anschluss": "Nein",
        "Display-Aufl\u00f6sung": "3440 x 1440 Pixel",
        "Displaygr\u00f6\u00dfe": "34 Zoll",
        "EAN": "8806094525175",
        "Eingebaute Lautsprecher": "Ja",
        "Energieeffizienzklasse (HDR)": "G",
        "Energieeffizienzklasse (SDR)": "G",
        "Energieeffizienzskala": "A bis G",
        "Energieverbrauch (HDR) pro 1.000 Stunden": "64 kWh",
        "Energieverbrauch (SDR) pro 1.000 Stunden": "50 kWh",
        "Ergonomie": "H\u00f6henverstellbar, Schwenkbar, Neigbar",
        "Farbskala": "99%",
        "Fernbedienung enthalten": "Ja",
        "Flimmerfreie Technologie": "Ja",
        "Funktioniert mit Samsung Bixby": "Ja",
        "Fu\u00dffarbe": "Silber",
        "Ger\u00e4tebreite (inkl. Fu\u00df)": "813,6 mm",
        "Ger\u00e4teh\u00f6he (inkl. Fu\u00df)": "522,3 mm",
        "Ger\u00e4tetiefe (inkl. Fu\u00df)": "192,8 mm",
        "Gewicht (mit St\u00e4nder)": "7,5 kg",
        "Gewicht (ohne St\u00e4nder)": "5,5 kg",
        "HD-Typ": "UltraWide Quad HD",
        "Helligkeit": "250 cd/m\u00b2",
        "Helligkeit (typisch)": "250 cd/m\u00b2",
        "Hersteller Artikelnummer": "LS34BG850SUXEN",
        "High Dynamic Range Video (HDR) Unterst\u00fctzung": "Ja",
        "H\u00f6he (ohne Standfu\u00df)": "36,4 cm",
        "H\u00f6heneinstellung": "12 cm",
        "H\u00f6henverstellung": "Ja",
        "Installiertes Betriebssystem": "Tizen",
        "Integrierter USB-Hub": "Nein",
        "Kontrastverh\u00e4ltnis": "1000000:1",
        "Kopfh\u00f6rerausgang": "Nein",
        "Marktpositionierung": "Gaming",
        "Maximale Bildwiederholrate": "175 Hz",
        "Mitgelieferte Kabel": "AC, Mini DisplayPort",
        "Natives Seitenverh\u00e4ltnis": "21:9",
        "Neigungsverstellung": "Ja",
        "Neigungswinkelbereich": "-2 - 20\u00b0",
        "Netzteiltyp": "Extern",
        "Paketgewicht": "11,8 kg",
        "Panel": "OLED",
        "Panel-Montage-Schnittstelle": "100 x 100 mm",
        "Pivot": "Ja",
        "Pivot Winkel": "-3 - 3\u00b0",
        "Produktfarbe": "Silber",
        "Reaktionszeit": "0,1 ms",
        "Relative Luftfeuchtigkeit in Betrieb": "10 - 80%",
        "Sichtbare Gr\u00f6\u00dfe (horizontal)": "80 cm",
        "Sichtbare Gr\u00f6\u00dfe (vertikal)": "3,37 m",
        "Spiel-Modus": "Ja",
        "Stromkabell\u00e4nge": "1,5 m",
        "Stromverbrauch (Standardbetrieb)": "50 W",
        "Stromverbrauch (Standby)": "0,5 W",
        "TV Plus": "Ja",
        "Technologie mit hohem Dynamikbereich (HDR)": "DisplayHDR 400 True Black",
        "Tiefe (ohne Standfu\u00df)": "12,8 cm",
        "Ton-Spiegelung": "Ja",
        "USB Power Delivery": "Ja",
        "USB-Stromversorgung bis zu": "65 W",
        "Unterst\u00fctzter Browser": "Microsoft 365",
        "Unterst\u00fctzung der SmartThings-App": "Ja",
        "VESA Halterung": "100x100 mm",
        "VESA-Halterung": "Ja",
        "Verpackungsbreite": "948 mm",
        "Verpackungsh\u00f6he": "185 mm",
        "Verpackungstiefe": "456 mm",
        "Video Anschl\u00fcsse": "1x micro HDMI, 1x mini DisplayPort, USB-C DisplayPort",
        "WLAN": "Ja",
        "WLAN-Standards": "Wi-Fi 5 (802.11ac)"
    },
    "raw_specifications_text": "Displaygr\u00f6\u00dfe: 34 Zoll\nAufl\u00f6sung: 3440x1440\nPanel: OLED\nReaktionszeit: 0,1 ms\nVideo Anschl\u00fcsse: 1x micro HDMI, 1x mini DisplayPort, USB-C DisplayPort\nErgonomie: H\u00f6henverstellbar, Schwenkbar, Neigbar\nVESA Halterung: 100x100 mm\nHelligkeit: 250 cd/m\u00b2\nBesonderheiten: 170 Hz\nHersteller Artikelnummer: LS34BG850SUXEN\nEAN: 8806094525175\nArtikelnummer: M1EY7SAL\nBildschirmdiagonale: 86,4 cm (34 Zoll)\nDisplay-Aufl\u00f6sung: 3440 x 1440 Pixel\nNatives Seitenverh\u00e4ltnis: 21:9\nBildschirmtechnologie: OLED\nHD-Typ: UltraWide Quad HD\nBildschirmform: Gebogen\nKontrastverh\u00e4ltnis: 1000000:1\nMaximale Bildwiederholrate: 175 Hz\nAnzahl der Farben des Displays: 1 Milliarden Farben\nHelligkeit (typisch): 250 cd/m\u00b2\nBewertung der Bildschirmkr\u00fcmmung: 1800R\nBildwinkel, horizontal: 178\u00b0\nBildwinkel, vertikal: 178\u00b0\nSichtbare Gr\u00f6\u00dfe (horizontal): 80 cm\nSichtbare Gr\u00f6\u00dfe (vertikal): 3,37 m\nBildschirmdiagonale (cm): 86 cm\nHigh Dynamic Range Video (HDR) Unterst\u00fctzung: Ja\nTechnologie mit hohem Dynamikbereich (HDR): DisplayHDR 400 True Black\nFarbskala: 99%\nAMD FreeSync: Ja\nAMD FreeSync-Typ: FreeSync Premium\nConnectShare (USB): Ja\nFlimmerfreie Technologie: Ja\nTon-Spiegelung: Ja\nSpiel-Modus: Ja\nTV Plus: Ja\nUnterst\u00fctzung der SmartThings-App: Ja\nFunktioniert mit Samsung Bixby: Ja\nAuf Ansicht tippen: Ja\nUnterst\u00fctzter Browser: Microsoft 365\nInstalliertes Betriebssystem: Tizen\nAirPlay: Ja\nEingebaute Lautsprecher: Ja\nAdaptive Klangsteuerung (ASC): Ja\nMarktpositionierung: Gaming\nProduktfarbe: Silber\nFu\u00dffarbe: Silber\nIntegrierter USB-Hub: Nein\nKopfh\u00f6rerausgang: Nein\nAnzahl der nachgeschalteten Ports vom Typ USB-C: 2\nUSB Power Delivery: Ja\nUSB-Stromversorgung bis zu: 65 W\nDVI Anschluss: Nein\nAnzahl Micro HDMI Anschl\u00fcsse: 1\nAnzahl Mini DisplayPorts: 1\nAudioanschl\u00fcsse: Nein\nWLAN: Ja\nWLAN-Standards: Wi-Fi 5 (802.11ac)\nBluetooth: Ja\nBluetooth-Version: 5.2\nVESA-Halterung: Ja\nH\u00f6henverstellung: Ja\nPanel-Montage-Schnittstelle: 100 x 100 mm\nH\u00f6heneinstellung: 12 cm\nPivot: Ja\nPivot Winkel: -3 - 3\u00b0\nNeigungswinkelbereich: -2 - 20\u00b0\nNeigungsverstellung: Ja\nEnergieeffizienzklasse (SDR): G\nEnergieeffizienzklasse (HDR): G\nEnergieverbrauch (SDR) pro 1.000 Stunden: 50 kWh\nEnergieverbrauch (HDR) pro 1.000 Stunden: 64 kWh\nStromverbrauch (Standardbetrieb): 50 W\nStromverbrauch (Standby): 0,5 W\nAC Eingangsspannung: 100 - 240 V\nAC Eingangsfrequenz: 50/60 Hz\nNetzteiltyp: Extern\nEnergieeffizienzskala: A bis G\nBetriebstemperatur: 10 - 40 \u00b0C\nRelative Luftfeuchtigkeit in Betrieb: 10 - 80%\nMitgelieferte Kabel: AC, Mini DisplayPort\nFernbedienung enthalten: Ja\nStromkabell\u00e4nge: 1,5 m\nGer\u00e4tebreite (inkl. Fu\u00df): 813,6 mm\nGer\u00e4tetiefe (inkl. Fu\u00df): 192,8 mm\nGer\u00e4teh\u00f6he (inkl. Fu\u00df): 522,3 mm\nGewicht (mit St\u00e4nder): 7,5 kg\nBreite (ohne Standfu\u00df): 81,4 cm\nTiefe (ohne Standfu\u00df): 12,8 cm\nH\u00f6he (ohne Standfu\u00df): 36,4 cm\nGewicht (ohne St\u00e4nder): 5,5 kg\nVerpackungsbreite: 948 mm\nVerpackungstiefe: 456 mm\nVerpackungsh\u00f6he: 185 mm\nPaketgewicht: 11,8 kg",
    "reference_file": "offer_reference_741.json",
    "shop_name": "mylemon.at"
}