{
    "html_file": "offer_1400_8.html",
    "name": "Dell UltraSharp U2422H (ohne Standfu\u00df), 23.8\"",
    "offer_link": "https://www.mylemon.at/artikel/dell/dell_u2422hwos/ultrasharp-24-monitor-u2422h-wit.html",
    "price": 229.98,
    "raw_specifications": {
        "AC Eingangsfrequenz": "50/60 Hz",
        "AC Eingangsspannung": "100 - 240 V",
        "AMD FreeSync": "Nein",
        "Anzahl DisplayPort Anschl\u00fcsse": "2",
        "Anzahl HDMI-Anschl\u00fcsse": "1",
        "Anzahl der Farben des Displays": "16,78 Millionen Farben",
        "Anzahl der Upstream-Ports USB Typ-C": "1",
        "Anzahl der nachgeschalteten Ports vom Typ USB-C": "1",
        "Anzahl der nachgeschalteten Steckpl\u00e4tze vom Typ USB-A": "3",
        "Anzahl der vorgeschalteten Steckpl\u00e4tze": "1",
        "Artikelnummer": "M15YDVLL",
        "Audioausgang": "Ja",
        "Aufl\u00f6sung": "1920x1080",
        "Betriebstemperatur": "0 - 40 \u00b0C",
        "Bezel Weite (bottom)": "8,95 mm",
        "Bezel Weite (side)": "5,3 mm",
        "Bezel Weite (top)": "5,3 mm",
        "Bildschirmdiagonale": "61 cm (24 Zoll)",
        "Bildschirmform": "Flach",
        "Bildschirmtechnologie": "LCD",
        "Blendfreier Bildschirm": "Ja",
        "Breite (ohne Standfu\u00df)": "53,8 cm",
        "Display-Aufl\u00f6sung": "1920 x 1080 Pixel",
        "DisplayPorts-Version": "1.4",
        "Displaygr\u00f6\u00dfe": "23,8 Zoll",
        "EAN": "5397184504987",
        "Eingangsstrom": "1.2 A",
        "Eingebaute Lautsprecher": "Nein",
        "Energieeffizienzklasse (HDR)": "Nicht verf\u00fcgbar",
        "Energieeffizienzklasse (SDR)": "C",
        "Energieverbrauch (SDR) pro 1.000 Stunden": "12 kWh",
        "Farbskala": "100%",
        "Gewicht (ohne St\u00e4nder)": "3,52 kg",
        "HD-Typ": "Full HD",
        "HDMI": "Ja",
        "HDMI-Version": "1.4",
        "Helligkeit": "250 cd/m\u00b2",
        "Helligkeit (typisch)": "250 cd/m\u00b2",
        "Hersteller Artikelnummer": "DELL-U2422HWOS",
        "High Dynamic Range Video (HDR) Unterst\u00fctzung": "Nein",
        "Horizontaler Scanbereich": "30 - 83 kHz",
        "H\u00f6he (ohne Standfu\u00df)": "31,1 cm",
        "H\u00f6henverstellung": "Nein",
        "Integrierte Kamera": "Nein",
        "Integrierter USB-Hub": "Ja",
        "Kabelsperre-Slot": "Ja",
        "Kontrastverh\u00e4ltnis": "1000:1",
        "Luftfeuchtigkeit bei Lagerung": "5 - 90%",
        "Marktpositionierung": "Business",
        "Maximale Bildwiederholrate": "60 Hz",
        "NVIDIA G-SYNC": "Nein",
        "Natives Seitenverh\u00e4ltnis": "16:9",
        "Neigungsverstellung": "Nein",
        "Netzteiltyp": "Intern",
        "Paketgewicht": "7,82 kg",
        "Panel": "IPS",
        "Panel-Montage-Schnittstelle": "100 x 100 mm",
        "Panel-Typ": "IPS",
        "Pivot": "Nein",
        "Pixel Abstand": "0,2745 x 0,2745 mm",
        "Pixeldichte": "92,53 ppi",
        "Produktfarbe": "Silber",
        "RGB-Farbraum": "sRGB",
        "Reaktionszeit": "8 ms",
        "Reaktionszeit (schnell)": "5 ms",
        "Relative Luftfeuchtigkeit in Betrieb": "10 - 80%",
        "Schwenkbar": "Nein",
        "Sichtbare Gr\u00f6\u00dfe (diagonal)": "60,5 cm",
        "Sichtbare Gr\u00f6\u00dfe (horizontal)": "52,7 cm",
        "Sichtbare Gr\u00f6\u00dfe (vertikal)": "29,6 cm",
        "Stromverbrauch (PowerSave)": "11,06 W",
        "Stromverbrauch (Standardbetrieb)": "11,6 W",
        "Stromverbrauch (Standby)": "0,3 W",
        "Stromverbrauch (aus)": "0,3 W",
        "Stromverbrauch (max.)": "63 W",
        "Temperaturbereich bei Lagerung": "-20 - 60 \u00b0C",
        "Tiefe (ohne Standfu\u00df)": "4,85 cm",
        "Touchscreen": "Nein",
        "Typ der Hintergrundbeleuchtung": "W-LED",
        "Unterst\u00fctzte Grafik-Aufl\u00f6sungen": "640 x 480 (VGA), 720 x 400, 800 x 600 (SVGA), 1024 x 768 (XGA), 1152 x 864 (XGA+), 1280 x 1024 (SXGA), 1600 x 900, 1920 x 1080 (HD 1080)",
        "Unterst\u00fctzte Video-Modi": "480i, 480p, 576i, 576p, 720p, 1080i, 1080p",
        "VESA Halterung": "100x100 mm",
        "VESA-Halterung": "Ja",
        "Vertikaler Scanbereich": "56 - 76 Hz",
        "Video Anschl\u00fcsse": "1x HDMI, 1x DisplayPort, 3x USB",
        "Vorderer Rahmen": "Schwarz",
        "WLAN": "Nein",
        "Warentarifnummer (HS)": "85285210"
    },
    "raw_specifications_text": "Displaygr\u00f6\u00dfe: 23,8 Zoll\nAufl\u00f6sung: 1920x1080\nPanel: IPS\nReaktionszeit: 8 ms\nVideo Anschl\u00fcsse: 1x HDMI, 1x DisplayPort, 3x USB\nVESA Halterung: 100x100 mm\nHelligkeit: 250 cd/m\u00b2\nHersteller Artikelnummer: DELL-U2422HWOS\nEAN: 5397184504987\nArtikelnummer: M15YDVLL\nBildschirmdiagonale: 61 cm (24 Zoll)\nDisplay-Aufl\u00f6sung: 1920 x 1080 Pixel\nNatives Seitenverh\u00e4ltnis: 16:9\nBildschirmtechnologie: LCD\nTouchscreen: Nein\nHD-Typ: Full HD\nPanel-Typ: IPS\nBildschirmform: Flach\nKontrastverh\u00e4ltnis: 1000:1\nMaximale Bildwiederholrate: 60 Hz\nAnzahl der Farben des Displays: 16,78 Millionen Farben\nTyp der Hintergrundbeleuchtung: W-LED\nHelligkeit (typisch): 250 cd/m\u00b2\nBlendfreier Bildschirm: Ja\nUnterst\u00fctzte Grafik-Aufl\u00f6sungen: 640 x 480 (VGA), 720 x 400, 800 x 600 (SVGA), 1024 x 768 (XGA), 1152 x 864 (XGA+), 1280 x 1024 (SXGA), 1600 x 900, 1920 x 1080 (HD 1080)\nUnterst\u00fctzte Video-Modi: 480i, 480p, 576i, 576p, 720p, 1080i, 1080p\nReaktionszeit (schnell): 5 ms\nPixel Abstand: 0,2745 x 0,2745 mm\nPixeldichte: 92,53 ppi\nHorizontaler Scanbereich: 30 - 83 kHz\nVertikaler Scanbereich: 56 - 76 Hz\nSichtbare Gr\u00f6\u00dfe (horizontal): 52,7 cm\nSichtbare Gr\u00f6\u00dfe (vertikal): 29,6 cm\nSichtbare Gr\u00f6\u00dfe (diagonal): 60,5 cm\nHigh Dynamic Range Video (HDR) Unterst\u00fctzung: Nein\nRGB-Farbraum: sRGB\nFarbskala: 100%\nNVIDIA G-SYNC: Nein\nAMD FreeSync: Nein\nEingebaute Lautsprecher: Nein\nIntegrierte Kamera: Nein\nMarktpositionierung: Business\nProduktfarbe: Silber\nVorderer Rahmen: Schwarz\nIntegrierter USB-Hub: Ja\nHDMI: Ja\nAnzahl der vorgeschalteten Steckpl\u00e4tze: 1\nAnzahl der Upstream-Ports USB Typ-C: 1\nAnzahl der nachgeschalteten Steckpl\u00e4tze vom Typ USB-A: 3\nAnzahl der nachgeschalteten Ports vom Typ USB-C: 1\nAnzahl HDMI-Anschl\u00fcsse: 1\nHDMI-Version: 1.4\nAnzahl DisplayPort Anschl\u00fcsse: 2\nDisplayPorts-Version: 1.4\nAudioausgang: Ja\nWLAN: Nein\nVESA-Halterung: Ja\nKabelsperre-Slot: Ja\nH\u00f6henverstellung: Nein\nPanel-Montage-Schnittstelle: 100 x 100 mm\nPivot: Nein\nSchwenkbar: Nein\nNeigungsverstellung: Nein\nEnergieeffizienzklasse (SDR): C\nEnergieeffizienzklasse (HDR): Nicht verf\u00fcgbar\nEnergieverbrauch (SDR) pro 1.000 Stunden: 12 kWh\nStromverbrauch (Standardbetrieb): 11,6 W\nStromverbrauch (Standby): 0,3 W\nStromverbrauch (max.): 63 W\nStromverbrauch (aus): 0,3 W\nStromverbrauch (PowerSave): 11,06 W\nAC Eingangsspannung: 100 - 240 V\nAC Eingangsfrequenz: 50/60 Hz\nEingangsstrom: 1.2 A\nNetzteiltyp: Intern\nBetriebstemperatur: 0 - 40 \u00b0C\nTemperaturbereich bei Lagerung: -20 - 60 \u00b0C\nRelative Luftfeuchtigkeit in Betrieb: 10 - 80%\nLuftfeuchtigkeit bei Lagerung: 5 - 90%\nBreite (ohne Standfu\u00df): 53,8 cm\nTiefe (ohne Standfu\u00df): 4,85 cm\nH\u00f6he (ohne Standfu\u00df): 31,1 cm\nGewicht (ohne St\u00e4nder): 3,52 kg\nBezel Weite (side): 5,3 mm\nBezel Weite (top): 5,3 mm\nBezel Weite (bottom): 8,95 mm\nPaketgewicht: 7,82 kg\nWarentarifnummer (HS): 85285210",
    "reference_file": "offer_reference_1400.json",
    "shop_name": "mylemon.at"
}