{
    "html_file": "offer_2283_8.html",
    "name": "iiyama ProLite XUB2395WSU-B1, 22.5\"",
    "offer_link": "https://www.csv-direct.de/artinfo.php?artnr=A1660729&KATEGORIE=162&pva=geizhals2",
    "price": 158.99,
    "raw_specifications": {
        "3D": "Nein",
        "AC Eingangsfrequenz": "50 - 60 Hz",
        "AC Eingangsspannung": "100 - 240 V",
        "Anzahl DisplayPort Anschl\u00fcsse": "1",
        "Anzahl HDMI-Anschl\u00fcsse": "1",
        "Anzahl OSD-Sprachen": "7",
        "Anzahl VGA D-Sub Anschl\u00fcsse": "1",
        "Anzahl der Farben des Displays": "1,073 Milliarden Farben",
        "Anzahl der Lautsprecher": "2",
        "Anzahl der nachgeschalteten Steckpl\u00e4tze vom Typ USB-A": "2",
        "Anzahl der vorgeschalteten Steckpl\u00e4tze": "1",
        "Betriebstemperatur": "5 - 35 \u00b0C",
        "Bildschirmdiagonale": "57,1 cm 22.5\"",
        "Bildschirmform": "Flach",
        "Bildschirmtechnologie": "LED",
        "Bildwinkel, horizontal": "178\u00b0",
        "Bildwinkel, vertikal": "178\u00b0",
        "Breite ohne Standfu\u00df": "499 mm",
        "DVI Anschluss": "Nein",
        "Display-Aufl\u00f6sung": "1920 x 1200 Pixel",
        "Display-Oberfl\u00e4che": "Matt",
        "Eingangsstrom": "1.5 A",
        "Energieeffizienzklasse SDR": "E",
        "Energieeffizienzskala": "A bis G",
        "Energieverbrauch SDR pro 1.000 Stunden": "17 kWh",
        "Fu\u00dffarbe": "Schwarz",
        "Ger\u00e4tebreite inkl. Fu\u00df": "499 mm",
        "Ger\u00e4teh\u00f6he inkl. Fu\u00df": "385 mm",
        "Ger\u00e4tetiefe inkl. Fu\u00df": "230 mm",
        "Gewicht mit St\u00e4nder": "5,4 kg",
        "HD-Typ": "WUXGA",
        "Helligkeit typisch": "250 cd/m\u00b2",
        "Horizontaler Scanbereich": "30 - 89 kHz",
        "H\u00f6he ohne Standfu\u00df": "320,5 mm",
        "H\u00f6heneinstellung": "13 cm",
        "Integrierte Kamera": "Nein",
        "J\u00e4hrlicher Energieverbrauch": "34 kWh",
        "Kontrastverh\u00e4ltnis": "1000:1",
        "Kontrastverh\u00e4ltnis dynamisch": "5000000:1",
        "Kopfh\u00f6rer-Anschluss": "3,5 mm",
        "Kopfh\u00f6rerausg\u00e4nge": "1",
        "Luftfeuchtigkeit bei Lagerung": "5 - 85",
        "Marktpositionierung": "Business",
        "Men\u00fcsprachen": "Deutsch, Niederl\u00e4ndisch, Englisch, Franz\u00f6sisch, Japanisch, Polnisch, Russisch",
        "Mitgelieferte Kabel": "AC, DisplayPort, USB",
        "NVIDIA G-SYNC": "Nein",
        "Nachhaltigkeitszertifikate": "ENERGY STAR",
        "Natives Seitenverh\u00e4ltnis": "16:10",
        "Neigungswinkelbereich": "-5 - 22\u00b0",
        "Neigungswinkelbereich nach oben": "0 - 22\u00b0",
        "Neigungswinkelbereich nach unten": "0 - 5\u00b0",
        "Panel-Montage-Schnittstelle": "100 x 100 mm",
        "Panel-Typ": "IPS",
        "Pivot Winkel": "-45 - 45\u00b0",
        "Pixel Abstand": "0,254 x 0,248 mm",
        "Produktfarbe": "Schwarz",
        "RMS-Leistung": "4 W",
        "Reaktionszeit": "4 ms",
        "Relative Luftfeuchtigkeit in Betrieb": "10 - 80",
        "Schwenkwinkelbereich": "-45 - 45\u00b0",
        "Sichtbare Gr\u00f6\u00dfe horizontal": "48,8 cm",
        "Sichtbare Gr\u00f6\u00dfe vertikal": "29,7 cm",
        "Slot-Typ Kabelsperre": "Kensington",
        "Stromverbrauch Standardbetrieb": "24 W",
        "Stromverbrauch Standby": "0,49 W",
        "Stromverbrauch aus": "0,33 W",
        "Temperaturbereich bei Lagerung": "-20 - 60 \u00b0C",
        "Tiefe ohne Standfu\u00df": "43,5 mm",
        "Touchscreen": "Nein",
        "USB-Hub-Version": "2.0",
        "USB-Upstream-Porttyp": "USB Typ-B",
        "Unterst\u00fctzte Grafik-Aufl\u00f6sungen": "640 x 480 VGA, 800 x 600 SVGA, 1024 x 768 XGA, 1280 x 1024 SXGA, 1440 x 900 WXGA+, 1680 x 1050 WSXGA+, 1920 x 1080 HD 1080, 1920 x 1200 WUXGA",
        "Vertikaler Scanbereich": "50 - 76 Hz",
        "Warentarifnummer HS": "85285210",
        "Zertifizierung": "TCO, CE, T\u00dcV-Bauart, CB, VCCI-B, RoHS, WEEE"
    },
    "raw_specifications_text": "Bildschirmdiagonale: 57,1 cm 22.5\"\nDisplay-Aufl\u00f6sung: 1920 x 1200 Pixel\nNatives Seitenverh\u00e4ltnis: 16:10\nBildschirmtechnologie: LED\nTouchscreen: Nein\nHD-Typ: WUXGA\nPanel-Typ: IPS\nBildschirmform: Flach\nKontrastverh\u00e4ltnis: 1000:1\nAnzahl der Farben des Displays: 1,073 Milliarden Farben\nHelligkeit typisch: 250 cd/m\u00b2\nReaktionszeit: 4 ms\nDisplay-Oberfl\u00e4che: Matt\nUnterst\u00fctzte Grafik-Aufl\u00f6sungen: 640 x 480 VGA, 800 x 600 SVGA, 1024 x 768 XGA, 1280 x 1024 SXGA, 1440 x 900 WXGA+, 1680 x 1050 WSXGA+, 1920 x 1080 HD 1080, 1920 x 1200 WUXGA\nKontrastverh\u00e4ltnis dynamisch: 5000000:1\nBildwinkel, horizontal: 178\u00b0\nBildwinkel, vertikal: 178\u00b0\nPixel Abstand: 0,254 x 0,248 mm\nHorizontaler Scanbereich: 30 - 89 kHz\nVertikaler Scanbereich: 50 - 76 Hz\nSichtbare Gr\u00f6\u00dfe horizontal: 48,8 cm\nSichtbare Gr\u00f6\u00dfe vertikal: 29,7 cm\n3D: Nein\nNVIDIA G-SYNC: Nein\nIntegrierte Kamera: Nein\nAnzahl der Lautsprecher: 2\nRMS-Leistung: 4 W\nMarktpositionierung: Business\nProduktfarbe: Schwarz\nFu\u00dffarbe: Schwarz\nZertifizierung: TCO, CE, T\u00dcV-Bauart, CB, VCCI-B, RoHS, WEEE\nUSB-Hub-Version: 2.0\nUSB-Upstream-Porttyp: USB Typ-B\nAnzahl der vorgeschalteten Steckpl\u00e4tze: 1\nAnzahl der nachgeschalteten Steckpl\u00e4tze vom Typ USB-A: 2\nAnzahl VGA D-Sub Anschl\u00fcsse: 1\nDVI Anschluss: Nein\nAnzahl HDMI-Anschl\u00fcsse: 1\nAnzahl DisplayPort Anschl\u00fcsse: 1\nKopfh\u00f6rerausg\u00e4nge: 1\nKopfh\u00f6rer-Anschluss: 3,5 mm\nPanel-Montage-Schnittstelle: 100 x 100 mm\nSlot-Typ Kabelsperre: Kensington\nH\u00f6heneinstellung: 13 cm\nPivot Winkel: -45 - 45\u00b0\nSchwenkwinkelbereich: -45 - 45\u00b0\nNeigungswinkelbereich: -5 - 22\u00b0\nMen\u00fcsprachen: Deutsch, Niederl\u00e4ndisch, Englisch, Franz\u00f6sisch, Japanisch, Polnisch, Russisch\nAnzahl OSD-Sprachen: 7\nNeigungswinkelbereich nach oben: 0 - 22\u00b0\nNeigungswinkelbereich nach unten: 0 - 5\u00b0\nEnergieeffizienzklasse SDR: E\nEnergieverbrauch SDR pro 1.000 Stunden: 17 kWh\nStromverbrauch Standardbetrieb: 24 W\nStromverbrauch Standby: 0,49 W\nStromverbrauch aus: 0,33 W\nAC Eingangsspannung: 100 - 240 V\nAC Eingangsfrequenz: 50 - 60 Hz\nEingangsstrom: 1.5 A\nEnergieeffizienzskala: A bis G\nJ\u00e4hrlicher Energieverbrauch: 34 kWh\nBetriebstemperatur: 5 - 35 \u00b0C\nTemperaturbereich bei Lagerung: -20 - 60 \u00b0C\nRelative Luftfeuchtigkeit in Betrieb: 10 - 80\nLuftfeuchtigkeit bei Lagerung: 5 - 85\nMitgelieferte Kabel: AC, DisplayPort, USB\nGer\u00e4tebreite inkl. Fu\u00df: 499 mm\nGer\u00e4tetiefe inkl. Fu\u00df: 230 mm\nGer\u00e4teh\u00f6he inkl. Fu\u00df: 385 mm\nGewicht mit St\u00e4nder: 5,4 kg\nBreite ohne Standfu\u00df: 499 mm\nTiefe ohne Standfu\u00df: 43,5 mm\nH\u00f6he ohne Standfu\u00df: 320,5 mm\nNachhaltigkeitszertifikate: ENERGY STAR\nWarentarifnummer HS: 85285210",
    "reference_file": "offer_reference_2283.json",
    "shop_name": "CSV-Direct.de"
}