{
    "html_file": "offer_231_21.html",
    "name": "Samsung ViewFinity S5 S50GC, 34\"",
    "offer_link": "https://ms-it-beratung.at/shop/details.php?art=421710&artname=Samsung+%2834%22%29++86%2C4cm+S34C500GAU+16%3A9++ViewFinity+S50GC",
    "price": 280.0,
    "raw_specifications": {
        "AC Eingangsspannung": "100 - 240 V",
        "AMD FreeSync": "Ja",
        "Anzahl DisplayPort Anschl\u00fcsse": "1",
        "Anzahl HDMI-Anschl\u00fcsse": "2",
        "Anzahl der Farben des Displays": "16,7 Millionen Farben",
        "Betriebstemperatur": "10 - 40 \u00b0C",
        "Bildschirmdiagonale": "86,4 cm (34 Zoll)",
        "Bildschirmdiagonale (cm)": "86 cm",
        "Bildschirmform": "Flach",
        "Bildschirmtechnologie": "LED",
        "Bildwinkel, horizontal": "178\u00b0",
        "Bildwinkel, vertikal": "178\u00b0",
        "Breite (ohne Standfu\u00df)": "81,5 cm",
        "Display-Aufl\u00f6sung": "3440 x 1440 Pixel",
        "DisplayPorts-Version": "1.2",
        "Eingebaute Lautsprecher": "Nein",
        "Energieeffizienzklasse (HDR)": "G",
        "Energieeffizienzklasse (SDR)": "G",
        "Energieverbrauch (HDR) pro 1.000 Stunden": "50 kWh",
        "Energieverbrauch (SDR) pro 1.000 Stunden": "32 kWh",
        "Flimmerfreie Technologie": "Ja",
        "Fu\u00dffarbe": "Schwarz",
        "Ger\u00e4tebreite (inkl. Fu\u00df)": "815,3 mm",
        "Ger\u00e4teh\u00f6he (inkl. Fu\u00df)": "457,7 mm",
        "Ger\u00e4tetiefe (inkl. Fu\u00df)": "221,3 mm",
        "Gewicht (mit St\u00e4nder)": "4,9 kg",
        "Gewicht (ohne St\u00e4nder)": "4,2 kg",
        "HD-Typ": "UltraWide Quad HD",
        "HDCP": "Ja",
        "HDCP-Version": "2.2",
        "HDMI": "Ja",
        "HDMI-Version": "2.0",
        "Helligkeit (typisch)": "300 cd/m\u00b2",
        "High Dynamic Range Video (HDR) Unterst\u00fctzung": "Ja",
        "H\u00f6he (ohne Standfu\u00df)": "36 cm",
        "H\u00f6henverstellung": "Nein",
        "Integrierte Kamera": "Nein",
        "Integrierter USB-Hub": "Nein",
        "Kontrastverh\u00e4ltnis": "3000:1",
        "Kopfh\u00f6rerausgang": "Ja",
        "Kopfh\u00f6rerausg\u00e4nge": "1",
        "Marktpositionierung": "Business",
        "Maximale Bildwiederholrate": "100 Hz",
        "Mitgelieferte Kabel": "AC, HDMI",
        "NTSC Abdeckung (typisch)": "72%",
        "NVIDIA G-SYNC": "Nein",
        "Natives Seitenverh\u00e4ltnis": "21:9",
        "Neigungsverstellung": "Ja",
        "Neigungswinkelbereich": "-2 - 22\u00b0",
        "Paketgewicht": "6,8 kg",
        "Panel-Montage-Schnittstelle": "100 x 100 mm",
        "Panel-Typ": "VA",
        "Produktfarbe": "Schwarz",
        "RGB-Farbraum": "NTSC",
        "Rahmenloses Design": "Ja",
        "Reaktionszeit": "5 ms",
        "Relative Luftfeuchtigkeit in Betrieb": "10 - 80%",
        "Sichtbare Gr\u00f6\u00dfe (horizontal)": "79,7 cm",
        "Sichtbare Gr\u00f6\u00dfe (vertikal)": "33,4 cm",
        "Spiel-Modus": "Ja",
        "Stromadapter enthalten": "Ja",
        "Stromverbrauch (Standardbetrieb)": "32 W",
        "Stromverbrauch (Standby)": "0,5 W",
        "Technologie mit hohem Dynamikbereich (HDR)": "High Dynamic Range 10 (HDR10)",
        "Tiefe (ohne Standfu\u00df)": "3,64 cm",
        "Touchscreen": "Nein",
        "VESA-Halterung": "Ja",
        "Verpackungsart": "Box",
        "Verpackungsbreite": "944 mm",
        "Verpackungsh\u00f6he": "434 mm",
        "Verpackungstiefe": "150 mm"
    },
    "raw_specifications_text": "Bildschirmdiagonale: 86,4 cm (34 Zoll)\nDisplay-Aufl\u00f6sung: 3440 x 1440 Pixel\nNatives Seitenverh\u00e4ltnis: 21:9\nBildschirmtechnologie: LED\nTouchscreen: Nein\nHD-Typ: UltraWide Quad HD\nPanel-Typ: VA\nHelligkeit (typisch): 300 cd/m\u00b2\nReaktionszeit: 5 ms\nBildschirmform: Flach\nKontrastverh\u00e4ltnis: 3000:1\nMaximale Bildwiederholrate: 100 Hz\nBildwinkel, horizontal: 178\u00b0\nBildwinkel, vertikal: 178\u00b0\nAnzahl der Farben des Displays: 16,7 Millionen Farben\nSichtbare Gr\u00f6\u00dfe (horizontal): 79,7 cm\nSichtbare Gr\u00f6\u00dfe (vertikal): 33,4 cm\nBildschirmdiagonale (cm): 86 cm\nHigh Dynamic Range Video (HDR) Unterst\u00fctzung: Ja\nTechnologie mit hohem Dynamikbereich (HDR): High Dynamic Range 10 (HDR10)\nRGB-Farbraum: NTSC\nNTSC Abdeckung (typisch): 72%\nNVIDIA G-SYNC: Nein\nAMD FreeSync: Ja\nFlimmerfreie Technologie: Ja\nSpiel-Modus: Ja\nEingebaute Lautsprecher: Nein\nIntegrierte Kamera: Nein\nMarktpositionierung: Business\nProduktfarbe: Schwarz\nRahmenloses Design: Ja\nFu\u00dffarbe: Schwarz\nIntegrierter USB-Hub: Nein\nHDMI: Ja\nAnzahl HDMI-Anschl\u00fcsse: 2\nHDMI-Version: 2.0\nAnzahl DisplayPort Anschl\u00fcsse: 1\nDisplayPorts-Version: 1.2\nKopfh\u00f6rerausgang: Ja\nKopfh\u00f6rerausg\u00e4nge: 1\nHDCP: Ja\nHDCP-Version: 2.2\nVESA-Halterung: Ja\nPanel-Montage-Schnittstelle: 100 x 100 mm\nH\u00f6henverstellung: Nein\nNeigungswinkelbereich: -2 - 22\u00b0\nNeigungsverstellung: Ja\nEnergieeffizienzklasse (SDR): G\nEnergieeffizienzklasse (HDR): G\nEnergieverbrauch (SDR) pro 1.000 Stunden: 32 kWh\nEnergieverbrauch (HDR) pro 1.000 Stunden: 50 kWh\nStromverbrauch (Standardbetrieb): 32 W\nStromverbrauch (Standby): 0,5 W\nAC Eingangsspannung: 100 - 240 V\nBetriebstemperatur: 10 - 40 \u00b0C\nRelative Luftfeuchtigkeit in Betrieb: 10 - 80%\nMitgelieferte Kabel: AC, HDMI\nStromadapter enthalten: Ja\nGer\u00e4tebreite (inkl. Fu\u00df): 815,3 mm\nGer\u00e4tetiefe (inkl. Fu\u00df): 221,3 mm\nGer\u00e4teh\u00f6he (inkl. Fu\u00df): 457,7 mm\nGewicht (mit St\u00e4nder): 4,9 kg\nBreite (ohne Standfu\u00df): 81,5 cm\nTiefe (ohne Standfu\u00df): 3,64 cm\nH\u00f6he (ohne Standfu\u00df): 36 cm\nGewicht (ohne St\u00e4nder): 4,2 kg\nVerpackungsbreite: 944 mm\nVerpackungstiefe: 150 mm\nVerpackungsh\u00f6he: 434 mm\nPaketgewicht: 6,8 kg\nVerpackungsart: Box",
    "reference_file": "offer_reference_231.json",
    "shop_name": "ms-it-beratung"
}