{
    "html_file": "offer_1118_4.html",
    "name": "Acer Predator X28, 28\"",
    "offer_link": "https://www.amazon.de/dp/B099NJL2FX?linkCode=xm2&camp=2025&creative=165953&smid=A3JWKAKR8XB7XF&creativeASIN=B099NJL2FX&tag=geizhals1-21",
    "price": 1008.3,
    "raw_specifications": {
        "ASIN": "B099NJL2FX",
        "Amazon Bestseller-Rang": "Nr. 176,497 in Computer & Zubeh\u00f6r (Siehe Top 100 in Computer & Zubeh\u00f6r)  Nr. 2,852 in Monitore",
        "Artikelgewicht": "\u200e10 Kilograms",
        "Bildschirmaufl\u00f6sung": "\u200e3840 x 2160",
        "Display-Gr\u00f6\u00dfe": "\u200e28 Zoll",
        "Durchschnittliche Kundenbewertung": "4,3  4,3 von 5 Sternen    \n    3 Sternebewertungen   \n\n\n 4,3 von 5 Sternen",
        "Farbe": "\u200eSchwarz",
        "Garantierte Software-Updates bis": "\u200eunbekannt",
        "Hersteller": "\u200eAcer",
        "Im Angebot von Amazon.de seit": "14. Juli 2021",
        "L\u00f6sung": "\u200e3840 x 2160 Pixels",
        "Marke": "\u200eAcer",
        "Modell/Serie": "\u200eX28",
        "Modellnummer": "\u200e28 Zoll",
        "Produktabmessungen": "\u200e30,72 x 63,64 x 53,29 cm; 10 Kilogramm"
    },
    "raw_specifications_text": "Marke: \u200eAcer\nHersteller: \u200eAcer\nModell/Serie: \u200eX28\nProduktabmessungen: \u200e30,72 x 63,64 x 53,29 cm; 10 Kilogramm\nModellnummer: \u200e28 Zoll\nFarbe: \u200eSchwarz\nDisplay-Gr\u00f6\u00dfe: \u200e28 Zoll\nBildschirmaufl\u00f6sung: \u200e3840 x 2160\nL\u00f6sung: \u200e3840 x 2160 Pixels\nArtikelgewicht: \u200e10 Kilograms\nGarantierte Software-Updates bis: \u200eunbekannt\nASIN: B099NJL2FX\nDurchschnittliche Kundenbewertung: 4,3  4,3 von 5 Sternen    \n    3 Sternebewertungen   \n\n\n 4,3 von 5 Sternen\nAmazon Bestseller-Rang: Nr. 176,497 in Computer & Zubeh\u00f6r (Siehe Top 100 in Computer & Zubeh\u00f6r)  Nr. 2,852 in Monitore\nIm Angebot von Amazon.de seit: 14. Juli 2021",
    "reference_file": "offer_reference_1118.json",
    "shop_name": "Amazon.at"
}