{
    "html_file": "offer_2396_24.html",
    "name": "ASUS VZ279HE, 27\"",
    "offer_link": "https://technikladen.at/P-ASUS-VZ279HE27-inch1920x1080HDMID-SUBPC?tl=gzhls",
    "price": 194.67,
    "raw_specifications": {
        "AC Eingangsfrequenz": "50 - 60 Hz",
        "AC Eingangsspannung": "100 - 240 V",
        "AC-Netzadapter": "Ja",
        "Anzahl HDMI-Anschl\u00fcsse": "2",
        "Anzahl VGA (D-Sub) Anschl\u00fcsse": "1",
        "Anzahl der Farben des Displays": "16,78 Millionen Farben",
        "Betriebsanleitung": "Ja",
        "Bildschirmaufl\u00f6sung": "1920 x 1080 Pixel",
        "Bildschirmdiagonale": "68,6 cm",
        "Bildschirmform": "Flach",
        "Bildschirmtechnologie": "LED",
        "Bildwinkel, horizontal": "178 \u00b0",
        "Bildwinkel, vertikal": "178 \u00b0",
        "Breite (ohne Standfu\u00df)": "62,1 cm",
        "DVI Anschluss": "Nein",
        "Display": "LCD",
        "Eingebaute Lautsprecher": "Nein",
        "Energieeffizienzklasse (SDR)": "F",
        "Energieeffizienzskala": "A bis G",
        "Energieverbrauch (SDR) pro 1.000 Stunden": "24 kWh",
        "Ger\u00e4tebreite (inkl. Fu\u00df)": "621 mm",
        "Ger\u00e4teh\u00f6he (inkl. Fu\u00df)": "439,5 mm",
        "Ger\u00e4tetiefe (inkl. Fu\u00df)": "210 mm",
        "Gewicht (mit St\u00e4nder)": "3,9 kg",
        "Gewicht (ohne St\u00e4nder)": "3,9 kg",
        "HD-Typ": "Full HD",
        "HDCP": "Ja",
        "Helligkeit (typisch)": "250 cd/m\u00b2",
        "Horizontaler Scanbereich": "24 - 83 kHz",
        "H\u00f6he (ohne Standfu\u00df)": "44 cm",
        "Integrierter USB-Hub": "Nein",
        "Kabelsperre-Slot": "Ja",
        "Kontrastverh\u00e4ltnis": "1000:1",
        "Kontrastverh\u00e4ltnis (dynamisch)": "80000000:1",
        "LED-Anzeigen": "Ja",
        "Maximale Bildwiederholrate": "75 Hz",
        "Mitgelieferte Kabel": "AC",
        "Nachhaltigkeitszertifikate": "ENERGY STAR",
        "Natives Seitenverh\u00e4ltnis": "16:9",
        "Neigungswinkelbereich": "-5 - 20 \u00b0",
        "Paketgewicht": "6 kg",
        "Panel-Typ": "IPS",
        "Pixel Abstand": "0,311 x 0,311 mm",
        "Produktfarbe": "Schwarz",
        "Reaktionszeit": "5 ms",
        "Schnellstart\u00fcbersicht": "Ja",
        "Slot-Typ Kabelsperre": "Kensington",
        "Stromverbrauch (Standardbetrieb)": "24,2 W",
        "Stromverbrauch (Standby)": "0,2 W",
        "Stromverbrauch (aus)": "0,1 W",
        "Thin Client installiert": "Nein",
        "Tiefe (ohne Standfu\u00df)": "3,95 cm",
        "Unterst\u00fctzte Grafik-Aufl\u00f6sungen": "1920 x 1080 (HD 1080)",
        "Unterst\u00fctzte Video-Modi": "1080p",
        "Verpackungsbreite": "689 mm",
        "Verpackungsh\u00f6he": "544 mm",
        "Verpackungstiefe": "117 mm",
        "Vertikaler Scanbereich": "50 - 75 Hz",
        "Zertifizierung": "CB, CCC, CE, CU, ErP, FCC, J-MOSS, KCC, PSB, RoHS, TCO7.0, UL/cUL, VCCI, WEEE, WHQL (Windows 10, Windows 8.1, Windows 7), TUV",
        "kippbar": "Ja"
    },
    "raw_specifications_text": "Bildschirmdiagonale: 68,6 cm\nBildschirmaufl\u00f6sung: 1920 x 1080 Pixel\nNatives Seitenverh\u00e4ltnis: 16:9\nPanel-Typ: IPS\nHelligkeit (typisch): 250 cd/m\u00b2\nReaktionszeit: 5 ms\nHD-Typ: Full HD\nBildschirmtechnologie: LED\nBildschirmform: Flach\nUnterst\u00fctzte Grafik-Aufl\u00f6sungen: 1920 x 1080 (HD 1080)\nUnterst\u00fctzte Video-Modi: 1080p\nKontrastverh\u00e4ltnis: 1000:1\nKontrastverh\u00e4ltnis (dynamisch): 80000000:1\nMaximale Bildwiederholrate: 75 Hz\nBildwinkel, horizontal: 178 \u00b0\nBildwinkel, vertikal: 178 \u00b0\nAnzahl der Farben des Displays: 16,78 Millionen Farben\nPixel Abstand: 0,311 x 0,311 mm\nHorizontaler Scanbereich: 24 - 83 kHz\nVertikaler Scanbereich: 50 - 75 Hz\nIntegrierter USB-Hub: Nein\nAnzahl VGA (D-Sub) Anschl\u00fcsse: 1\nDVI Anschluss: Nein\nAnzahl HDMI-Anschl\u00fcsse: 2\nHDCP: Ja\nEingebaute Lautsprecher: Nein\nProduktfarbe: Schwarz\nZertifizierung: CB, CCC, CE, CU, ErP, FCC, J-MOSS, KCC, PSB, RoHS, TCO7.0, UL/cUL, VCCI, WEEE, WHQL (Windows 10, Windows 8.1, Windows 7), TUV\nAC-Netzadapter: Ja\nDisplay: LCD\nBetriebsanleitung: Ja\nMitgelieferte Kabel: AC\nSchnellstart\u00fcbersicht: Ja\nVerpackungsbreite: 689 mm\nVerpackungstiefe: 117 mm\nVerpackungsh\u00f6he: 544 mm\nPaketgewicht: 6 kg\nEnergieeffizienzklasse (SDR): F\nEnergieverbrauch (SDR) pro 1.000 Stunden: 24 kWh\nStromverbrauch (Standardbetrieb): 24,2 W\nStromverbrauch (Standby): 0,2 W\nStromverbrauch (aus): 0,1 W\nAC Eingangsspannung: 100 - 240 V\nAC Eingangsfrequenz: 50 - 60 Hz\nEnergieeffizienzskala: A bis G\nThin Client installiert: Nein\nKabelsperre-Slot: Ja\nSlot-Typ Kabelsperre: Kensington\nkippbar: Ja\nNeigungswinkelbereich: -5 - 20 \u00b0\nLED-Anzeigen: Ja\nGer\u00e4tebreite (inkl. Fu\u00df): 621 mm\nGer\u00e4tetiefe (inkl. Fu\u00df): 210 mm\nGer\u00e4teh\u00f6he (inkl. Fu\u00df): 439,5 mm\nGewicht (mit St\u00e4nder): 3,9 kg\nBreite (ohne Standfu\u00df): 62,1 cm\nTiefe (ohne Standfu\u00df): 3,95 cm\nH\u00f6he (ohne Standfu\u00df): 44 cm\nGewicht (ohne St\u00e4nder): 3,9 kg\nNachhaltigkeitszertifikate: ENERGY STAR",
    "reference_file": "offer_reference_2396.json",
    "shop_name": "TechnikLaden"
}