{
    "html_file": "offer_298_8.html",
    "name": "ASUS VY279HGE, 27\"",
    "offer_link": "https://www.alternate.at/ASUS/VY279HGE-Gaming-Monitor/html/product/1915350?partner=AtGeizhalsat&campaign=Monitor/ASUS/1915350",
    "price": 202.9,
    "raw_specifications": {
        "": "AMD FreeSync, Kensington-Schloss",
        "Abmessungen": "Breite: 61,56 cm x H\u00f6he: 43,68 cm x Tiefe/L\u00e4nge: 20,17 cm",
        "Anschl\u00fcsse": "1x HDMI-Eingang, (HDMI-Version: 1.4), 1x 3,5-mm-Audio-Ausgang",
        "Bild": "Format",
        "Bildschirmaufl\u00f6sung": "1.920 x 1.080 Pixel",
        "Bildschirmdiagonale": "689 cm (27 Zoll)",
        "EAN": "4711387078433",
        "Energieeffizienzklasse (SDR)": "C (A - G)",
        "Energieverbauch pro 1000 Stunden (SDR)": "14 kWh",
        "Ergonomie": "Neigbar",
        "Farbe": "schwarz",
        "Features": "Shadowboost, GamePlus, ASUS Eye Care+, Ultra-Low-Blue Light, Flicker-free",
        "Geeignet f\u00fcr": "Gaming",
        "Hersteller-Nr.": "90LM06D5-B02370",
        "Leistungsaufnahme im Bereitschafts- und Aus-Zustand": "0,5 Watt",
        "Leistungsaufnahme im Ein-Zustand bei Standard-Dynamikumfang (SDR)": "14 Watt",
        "Stromversorgung": "Eco-Off",
        "Typ": "Gaming-Monitor",
        "Zubeh\u00f6r": "Vorhanden"
    },
    "raw_specifications_text": "Energieeffizienzklasse (SDR): C (A - G)\nEnergieverbauch pro 1000 Stunden (SDR): 14 kWh\nLeistungsaufnahme im Ein-Zustand bei Standard-Dynamikumfang (SDR): 14 Watt\nLeistungsaufnahme im Bereitschafts- und Aus-Zustand: 0,5 Watt\nBildschirmdiagonale: 689 cm (27 Zoll)\nBildschirmaufl\u00f6sung: 1.920 x 1.080 Pixel\nTyp: Gaming-Monitor\nFarbe: schwarz\nEAN: 4711387078433\nHersteller-Nr.: 90LM06D5-B02370\nGeeignet f\u00fcr: Gaming\nBild: Format\n: AMD FreeSync, Kensington-Schloss\nAnschl\u00fcsse: 1x HDMI-Eingang, (HDMI-Version: 1.4), 1x 3,5-mm-Audio-Ausgang\nErgonomie: Neigbar\nStromversorgung: Eco-Off\nFeatures: Shadowboost, GamePlus, ASUS Eye Care+, Ultra-Low-Blue Light, Flicker-free\nZubeh\u00f6r: Vorhanden\nAbmessungen: Breite: 61,56 cm x H\u00f6he: 43,68 cm x Tiefe/L\u00e4nge: 20,17 cm",
    "reference_file": "offer_reference_298.json",
    "shop_name": "Alternate.at"
}