{
    "html_file": "offer_1235_26.html",
    "name": "ASUS TUF Gaming VG28UQL1A, 28\"",
    "offer_link": "https://www.hiq24.de/shop/artikel/308003/?sPartner=geizhals",
    "price": 708.9,
    "raw_specifications": {
        "Abmessungen (Breite x Tiefe x H\u00f6he)": "63.95 cm x 21.38 cm x 53.98 cm - mit Fu\u00df",
        "Abmessungen (Breite x Tiefe x H\u00f6he) - mit Fu\u00df": "63.95 cm x 21.38 cm x 53.98 cm",
        "Adaptive-Sync Technologie": "NVIDIA G-SYNC Compatible, AMD FreeSync Premium",
        "Ausgangsleistung/Kanal": "2 Watt",
        "Besonderheiten": "Bild f\u00fcr Bild, HDCP, Trace Free Technology, ASUS GamePlus, flimmerfreie Technologie, ASUS GameVisual Technology, Farbtemperatur Auswahl, GameFast Input Technology, Picture-in-Picture, Low Blue Light-Technologie, Shadow Boost-Technologie, ELMB SYNC, Multiple HDR-Modus, Display Widget",
        "Bildschirmbeschichtung": "Blendfrei",
        "Bildschirmtyp": "IPS",
        "Details zu Abmessungen & Gewicht": "Mit Fu\u00df - Breite: 63.95 cm - Tiefe: 21.38 cm - H\u00f6he: 53.98 cm - Gewicht: 6.89 kg  Ohne Fu\u00df - Breite: 63.95 cm - Tiefe: 6.565 cm - H\u00f6he: 36.935 cm - Gewicht: 4.67 kg",
        "Diagonalabmessung": "71.1 cm (28\")",
        "Display-Typ": "LED-hintergrundbeleuchteter LCD-Monitor / TFT-Aktivmatrix",
        "Eingangsanschl\u00fcsse": "4xHDMI, DisplayPort",
        "Eingangsspannung": "Wechselstrom 100-240 V (50/60 Hz)",
        "Einstellungen der Anzeigeposition": "H\u00f6he, Pivot (Rotation), Drehung, Neigung",
        "Energie Effizienzklasse": "Klasse G",
        "Energieklasse (HDR)": "Klasse G",
        "Farbraum": "90% DCI-P3",
        "Farbunterst\u00fctzung": "1,074 Milliarden Farben (10-Bit)",
        "Gaming": "Ja",
        "Ger\u00e4tetyp": "LED-hintergrundbeleuchteter LCD-Monitor - 71.1 cm (28\")",
        "Gewicht": "6.89 kg",
        "HDR-Format": "HDR10",
        "HDR-Zertifizierung": "DisplayHDR 400",
        "HDR-f\u00e4hig": "HDR10 / DisplayHDR 400",
        "Helligkeit": "450 cd/m\u00b2",
        "Hintergrundbeleuchtungs-Technologie": "LED-Hintergrundbeleuchtung",
        "Horizontale Bildwiederholrate": "30 - 340 kHz",
        "Horizontaler Betrachtungswinkel": "178",
        "H\u00f6heneinstellung": "120 mm",
        "Integrierte Peripherieger\u00e4te": "USB 3.1 Hub",
        "Kennzeichnung": "TUV Rheinland Flicker Free Certification, TUV Rheinland Low Blue Light (Software Solution)",
        "Kontrast": "1000:1 / 100000000:1 (dynamisch)",
        "Leistungsmerkmale": "USB 3.1 Hub",
        "Native Aufl\u00f6sung": "4K 3840 x 2160 bei 144 Hz",
        "Neigungswinkel": "-5/20",
        "Pixelpitch": "0.16 mm",
        "Produktbeschreibung": "ASUS TUF Gaming VG28UQL1A - LED-Monitor - 4K - 71.1 cm (28\") - HDR",
        "Reaktionszeit": "1 ms (Gray-to-Gray)",
        "Rotationswinkel": "180",
        "Schlosstyp zur Diebstahlsicherung": "Kensington Slot",
        "Schnittstellen": "4 x HDMI  DisplayPort  Kopfh\u00f6rer  USB 3.1 Upstream  2 x USB 3.1 Downstream",
        "Schwenkwinkel": "30",
        "Seitenverh\u00e4ltnis": "16:9",
        "Spannung": "Wechselstrom 100-240 V (50/60 Hz)",
        "Stromverbrauch (Aus-Modus)": "0.3 Watt",
        "Stromverbrauch (typisch)": "33 Watt",
        "Stromverbrauch HDR (eingeschaltet)": "60 kWh/1.000 h",
        "Stromverbrauch SDR (eingeschaltet)": "33 kWh/1.000 h",
        "Stromverbrauch im Standby-Modus": "0.45 Watt",
        "Transportbreite": "71.6 cm",
        "Transportgewicht": "10.4 kg",
        "Transporth\u00f6he": "44.6 cm",
        "Transporttiefe": "22.4 cm",
        "Typ": "Lautsprecher - Stereo",
        "VESA-Halterung": "100 x 100 mm",
        "Vertikale Bildwiederholrate": "48 - 144 Hz",
        "Vertikaler Betrachtungswinkel": "178"
    },
    "raw_specifications_text": "Display-Typ: LED-hintergrundbeleuchteter LCD-Monitor / TFT-Aktivmatrix\nEnergie Effizienzklasse: Klasse G\nEnergieklasse (HDR): Klasse G\nDiagonalabmessung: 71.1 cm (28\")\nAdaptive-Sync Technologie: NVIDIA G-SYNC Compatible, AMD FreeSync Premium\nIntegrierte Peripherieger\u00e4te: USB 3.1 Hub\nBildschirmtyp: IPS\nSeitenverh\u00e4ltnis: 16:9\nNative Aufl\u00f6sung: 4K 3840 x 2160 bei 144 Hz\nPixelpitch: 0.16 mm\nHelligkeit: 450 cd/m\u00b2\nKontrast: 1000:1 / 100000000:1 (dynamisch)\nHDR-Format: HDR10\nHDR-Zertifizierung: DisplayHDR 400\nFarbunterst\u00fctzung: 1,074 Milliarden Farben (10-Bit)\nFarbraum: 90% DCI-P3\nReaktionszeit: 1 ms (Gray-to-Gray)\nVertikale Bildwiederholrate: 48 - 144 Hz\nHorizontale Bildwiederholrate: 30 - 340 kHz\nGaming: Ja\nHorizontaler Betrachtungswinkel: 178\nVertikaler Betrachtungswinkel: 178\nBildschirmbeschichtung: Blendfrei\nHintergrundbeleuchtungs-Technologie: LED-Hintergrundbeleuchtung\nBesonderheiten: Bild f\u00fcr Bild, HDCP, Trace Free Technology, ASUS GamePlus, flimmerfreie Technologie, ASUS GameVisual Technology, Farbtemperatur Auswahl, GameFast Input Technology, Picture-in-Picture, Low Blue Light-Technologie, Shadow Boost-Technologie, ELMB SYNC, Multiple HDR-Modus, Display Widget\nAbmessungen (Breite x Tiefe x H\u00f6he): 63.95 cm x 21.38 cm x 53.98 cm - mit Fu\u00df\nGewicht: 6.89 kg\nTyp: Lautsprecher - Stereo\nAusgangsleistung/Kanal: 2 Watt\nSchnittstellen: 4 x HDMI  DisplayPort  Kopfh\u00f6rer  USB 3.1 Upstream  2 x USB 3.1 Downstream\nEinstellungen der Anzeigeposition: H\u00f6he, Pivot (Rotation), Drehung, Neigung\nNeigungswinkel: -5/20\nSchwenkwinkel: 30\nRotationswinkel: 180\nH\u00f6heneinstellung: 120 mm\nVESA-Halterung: 100 x 100 mm\nLeistungsmerkmale: USB 3.1 Hub\nKennzeichnung: TUV Rheinland Flicker Free Certification, TUV Rheinland Low Blue Light (Software Solution)\nSchlosstyp zur Diebstahlsicherung: Kensington Slot\nEingangsspannung: Wechselstrom 100-240 V (50/60 Hz)\nStromverbrauch SDR (eingeschaltet): 33 kWh/1.000 h\nStromverbrauch HDR (eingeschaltet): 60 kWh/1.000 h\nStromverbrauch (typisch): 33 Watt\nStromverbrauch im Standby-Modus: 0.45 Watt\nStromverbrauch (Aus-Modus): 0.3 Watt\nDetails zu Abmessungen & Gewicht: Mit Fu\u00df - Breite: 63.95 cm - Tiefe: 21.38 cm - H\u00f6he: 53.98 cm - Gewicht: 6.89 kg  Ohne Fu\u00df - Breite: 63.95 cm - Tiefe: 6.565 cm - H\u00f6he: 36.935 cm - Gewicht: 4.67 kg\nTransportbreite: 71.6 cm\nTransporttiefe: 22.4 cm\nTransporth\u00f6he: 44.6 cm\nTransportgewicht: 10.4 kg\nProduktbeschreibung: ASUS TUF Gaming VG28UQL1A - LED-Monitor - 4K - 71.1 cm (28\") - HDR\nGer\u00e4tetyp: LED-hintergrundbeleuchteter LCD-Monitor - 71.1 cm (28\")\nHDR-f\u00e4hig: HDR10 / DisplayHDR 400\nEingangsanschl\u00fcsse: 4xHDMI, DisplayPort\nSpannung: Wechselstrom 100-240 V (50/60 Hz)\nAbmessungen (Breite x Tiefe x H\u00f6he) - mit Fu\u00df: 63.95 cm x 21.38 cm x 53.98 cm",
    "reference_file": "offer_reference_1235.json",
    "shop_name": "HiQ24"
}