{
    "html_file": "offer_1672_24.html",
    "name": "ASUS TUF Gaming VG24VQE, 23.6\"",
    "offer_link": "https://syswork.at/sw/index.html?open&mid=Artikel&artid=mon-1456&from=geizhals.at",
    "price": 217.0,
    "raw_specifications": {
        "AC Eingangsfrequenz": "50/60 Hz",
        "AC Eingangsspannung": "100 - 240 V",
        "AMD FreeSync": "Ja",
        "AMD FreeSync-Typ": "FreeSync Premium",
        "Anzahl DisplayPort Anschl\u00fcsse": "1",
        "Anzahl HDMI-Anschl\u00fcsse": "2",
        "Anzahl der Farben des Displays": "16,7 Millionen Farben",
        "Anzahl der Lautsprecher": "2",
        "Bewertung der Bildschirmkr\u00fcmmung": "1500R",
        "Bildschirmdiagonale": "59,9 cm (23.6 Zoll)",
        "Bildschirmform": "Gebogen",
        "Bildschirmtechnologie": "LED",
        "Bildwinkel, horizontal": "178\u00b0",
        "Bildwinkel, vertikal": "178\u00b0",
        "Breite (ohne Standfu\u00df)": "53,8 cm",
        "DVI Anschluss": "Nein",
        "Datenblatt": "Kein Datenblatt verf\u00fcgbar",
        "Display-Aufl\u00f6sung": "1920 x 1080 Pixel",
        "DisplayPorts-Version": "1.2",
        "Eingebaute Lautsprecher": "Ja",
        "Energieeffizienzklasse (SDR)": "F",
        "Energieeffizienzskala": "A bis G",
        "Energieverbrauch (SDR) pro 1.000 Stunden": "22 kWh",
        "Flimmerfreie Technologie": "Ja",
        "Ger\u00e4tebreite (inkl. Fu\u00df)": "537,6 mm",
        "Ger\u00e4teh\u00f6he (inkl. Fu\u00df)": "404 mm",
        "Ger\u00e4tetiefe (inkl. Fu\u00df)": "205,9 mm",
        "Gewicht (mit St\u00e4nder)": "3,37 kg",
        "Gewicht (ohne St\u00e4nder)": "2,64 kg",
        "HD-Typ": "Full HD",
        "HDCP": "Ja",
        "HDMI": "Ja",
        "HDMI-Version": "1.4",
        "Helligkeit (typisch)": "250 cd/m\u00b2",
        "Herstellerlink": "ASUS",
        "H\u00f6he (ohne Standfu\u00df)": "32 cm",
        "H\u00f6henverstellung": "Nein",
        "Integrierte Kamera": "Nein",
        "Integrierter USB-Hub": "Nein",
        "Kabelsperre-Slot": "Ja",
        "Kontrastverh\u00e4ltnis": "3000:1",
        "Marktpositionierung": "Gaming",
        "Maximale Bildwiederholrate": "165 Hz",
        "NVIDIA G-SYNC": "Nein",
        "Natives Seitenverh\u00e4ltnis": "16:9",
        "Neigungsverstellung": "Ja",
        "Neigungswinkelbereich": "-5 - 23\u00b0",
        "Paketgewicht": "5,06 kg",
        "Panel-Montage-Schnittstelle": "100 x 100 mm",
        "Panel-Typ": "VA",
        "Produktfarbe": "Schwarz",
        "Produktlink": "Link",
        "RMS-Leistung": "4 W",
        "Reaktionszeit": "1 ms",
        "Slot-Typ Kabelsperre": "Kensington",
        "Spiel-Modus": "Ja",
        "Stromverbrauch (Standardbetrieb)": "23,34 W",
        "Stromverbrauch (aus)": "0,5 W",
        "Tiefe (ohne Standfu\u00df)": "6,99 cm",
        "Touchscreen": "Nein",
        "Ursprungsland": "China",
        "VESA-Halterung": "Ja",
        "Verpackungsart": "Box",
        "Verpackungsbreite": "398 mm",
        "Verpackungsh\u00f6he": "188 mm",
        "Verpackungstiefe": "612 mm",
        "Warentarifnummer (HS)": "85285210"
    },
    "raw_specifications_text": "Bildschirmdiagonale: 59,9 cm (23.6 Zoll)\nDisplay-Aufl\u00f6sung: 1920 x 1080 Pixel\nNatives Seitenverh\u00e4ltnis: 16:9\nBildschirmtechnologie: LED\nTouchscreen: Nein\nHD-Typ: Full HD\nPanel-Typ: VA\nBildschirmform: Gebogen\nKontrastverh\u00e4ltnis: 3000:1\nMaximale Bildwiederholrate: 165 Hz\nAnzahl der Farben des Displays: 16,7 Millionen Farben\nHelligkeit (typisch): 250 cd/m\u00b2\nReaktionszeit: 1 ms\nBewertung der Bildschirmkr\u00fcmmung: 1500R\nBildwinkel, horizontal: 178\u00b0\nBildwinkel, vertikal: 178\u00b0\nNVIDIA G-SYNC: Nein\nAMD FreeSync: Ja\nAMD FreeSync-Typ: FreeSync Premium\nFlimmerfreie Technologie: Ja\nSpiel-Modus: Ja\nEingebaute Lautsprecher: Ja\nIntegrierte Kamera: Nein\nAnzahl der Lautsprecher: 2\nRMS-Leistung: 4 W\nMarktpositionierung: Gaming\nProduktfarbe: Schwarz\nUrsprungsland: China\nIntegrierter USB-Hub: Nein\nHDMI: Ja\nDVI Anschluss: Nein\nAnzahl HDMI-Anschl\u00fcsse: 2\nHDMI-Version: 1.4\nAnzahl DisplayPort Anschl\u00fcsse: 1\nDisplayPorts-Version: 1.2\nHDCP: Ja\nVESA-Halterung: Ja\nKabelsperre-Slot: Ja\nH\u00f6henverstellung: Nein\nPanel-Montage-Schnittstelle: 100 x 100 mm\nSlot-Typ Kabelsperre: Kensington\nNeigungswinkelbereich: -5 - 23\u00b0\nNeigungsverstellung: Ja\nEnergieeffizienzklasse (SDR): F\nEnergieverbrauch (SDR) pro 1.000 Stunden: 22 kWh\nStromverbrauch (Standardbetrieb): 23,34 W\nStromverbrauch (aus): 0,5 W\nAC Eingangsspannung: 100 - 240 V\nAC Eingangsfrequenz: 50/60 Hz\nEnergieeffizienzskala: A bis G\nGer\u00e4tebreite (inkl. Fu\u00df): 537,6 mm\nGer\u00e4tetiefe (inkl. Fu\u00df): 205,9 mm\nGer\u00e4teh\u00f6he (inkl. Fu\u00df): 404 mm\nGewicht (mit St\u00e4nder): 3,37 kg\nBreite (ohne Standfu\u00df): 53,8 cm\nTiefe (ohne Standfu\u00df): 6,99 cm\nH\u00f6he (ohne Standfu\u00df): 32 cm\nGewicht (ohne St\u00e4nder): 2,64 kg\nVerpackungsbreite: 398 mm\nVerpackungstiefe: 612 mm\nVerpackungsh\u00f6he: 188 mm\nPaketgewicht: 5,06 kg\nVerpackungsart: Box\nWarentarifnummer (HS): 85285210\nDatenblatt: Kein Datenblatt verf\u00fcgbar\nProduktlink: Link\nHerstellerlink: ASUS",
    "reference_file": "offer_reference_1672.json",
    "shop_name": "Syswork"
}