{
    "html_file": "offer_2085_14.html",
    "name": "HP Omen X 27, 27\"",
    "offer_link": "https://www.taufnaus.de/product/10622512",
    "price": 444.85,
    "raw_specifications": {
        "Abmessungen (Breite x Tiefe x H\u00f6he)": "55.75 cm x 27.25 cm x 48.96 cm - mit Fu\u00df",
        "Adaptive-Sync Technologie": "AMD FreeSync Premium Pro",
        "Besonderheiten": "HDCP, Technicolor Color-zertifiziert, ohne Quecksilber, arsenfreies Glas",
        "Bildschirmbeschichtung": "Blendfrei",
        "Bildschirmtyp": "TN",
        "Details zu Abmessungen & Gewicht": "Mit Fu\u00df - Breite: 55.75 cm - Tiefe: 27.25 cm - H\u00f6he: 48.96 cm - Gewicht: 7.1 kg \u00a6 Ohne Fu\u00df - Breite: 55.75 cm - Tiefe: 9.87 cm - H\u00f6he: 33.06 cm",
        "Diagonalabmessung": "68.58 cm (27\")",
        "Display-Typ": "LED-hintergrundbeleuchteter LCD-Monitor / TFT-Aktivmatrix",
        "ENERGY STAR zertifiziert": "Ja",
        "Eingangsspannung": "Wechselstrom 120/230 V (50/60 Hz)",
        "Einstellungen der Anzeigeposition": "H\u00f6he, Neigung",
        "Energie Effizienzklasse": "Klasse G",
        "Energieklasse (HDR)": "Klasse G",
        "Energieverbrauch pro Jahr": "66 kWh",
        "Enthaltene Kabel": "1 x DisplayPort-Kabel \u00a6 1 x HDMI-Kabel \u00a6 1 x USB-Kabel Typ A auf Typ B",
        "Farbraum": "90% DCI-P3",
        "Farbunterst\u00fctzung": "16,7 Millionen Farben",
        "Gewicht": "7.1 kg",
        "Helligkeit": "300 cd/m\u00b2",
        "Hintergrundbeleuchtungs-Technologie": "LED-Hintergrundbeleuchtung",
        "Horizontaler Betrachtungswinkel": "170",
        "Integrierte Peripherieger\u00e4te": "USB 3.0-Hub",
        "Kennzeichnung": "Plug and Play, CSA, VCCI, BSMI, NOM, TUV S, CB, CCC, PSB, FCC, ISO 9241-307, KCC, WEEE, ICES, MEPS, KC, CECP, CEL, EAC, ISC, SEPA, CE/EMC",
        "Kontrast": "1000:1 / 10000000:1 (dynamisch)",
        "Leistungsaufnahme im Ein-Zustand": "32.1 W",
        "Leistungsmerkmale": "Slot f\u00fcr Sicherheitsschloss (Kabelschloss getrennt erh\u00e4ltlich), abnehmbarer St\u00e4nder",
        "Lokalisierung": "Englisch / Europa",
        "Max. Betriebstemperatur": "35 \u00b0C",
        "Min Betriebstemperatur": "5 \u00b0C",
        "Native Aufl\u00f6sung": "2.5K 2560 x 1440 bei 240 Hz",
        "Neigungswinkel": "-5/+23",
        "Reaktionszeit": "1 ms (Overdrive)",
        "Schlosstyp zur Diebstahlsicherung": "Kensington Slot",
        "Schnittstellen": "DisplayPort (HDCP) \u00a6 2 x HDMI (HDCP) \u00a6 Audio Line-Out \u00a6 2 x USB 3.0 Downstream \u00a6 USB 3.0 Upstream",
        "Seitenverh\u00e4ltnis": "16:9",
        "Service und Support": "Begrenzte Garantie - Arbeitszeit und Ersatzteile - 1 Jahr",
        "Stromverbrauch (Aus-Modus)": "0.29 Watt",
        "Stromverbrauch HDR (eingeschaltet)": "52.9 kWh/1.000 h",
        "Stromverbrauch SDR (eingeschaltet)": "32.1 kWh/1.000 h",
        "Stromverbrauch im Standby-Modus": "0.45 Watt",
        "Transportbreite": "66 cm",
        "Transporth\u00f6he": "47.3 cm",
        "Transporttiefe": "33.2 cm",
        "Vertikaler Betrachtungswinkel": "160",
        "Zubeh\u00f6r im Lieferumfang": "VESA-Klammer",
        "Zul\u00e4ssige Luftfeuchtigkeit im Betrieb": "20 - 80%"
    },
    "raw_specifications_text": "Display-Typ: LED-hintergrundbeleuchteter LCD-Monitor / TFT-Aktivmatrix\nEnergie Effizienzklasse: Klasse G\nEnergieklasse (HDR): Klasse G\nEnergieverbrauch pro Jahr: 66 kWh\nDiagonalabmessung: 68.58 cm (27\")\nAdaptive-Sync Technologie: AMD FreeSync Premium Pro\nIntegrierte Peripherieger\u00e4te: USB 3.0-Hub\nBildschirmtyp: TN\nSeitenverh\u00e4ltnis: 16:9\nNative Aufl\u00f6sung: 2.5K 2560 x 1440 bei 240 Hz\nHelligkeit: 300 cd/m\u00b2\nKontrast: 1000:1 / 10000000:1 (dynamisch)\nFarbunterst\u00fctzung: 16,7 Millionen Farben\nFarbraum: 90% DCI-P3\nReaktionszeit: 1 ms (Overdrive)\nHorizontaler Betrachtungswinkel: 170\nVertikaler Betrachtungswinkel: 160\nBildschirmbeschichtung: Blendfrei\nHintergrundbeleuchtungs-Technologie: LED-Hintergrundbeleuchtung\nBesonderheiten: HDCP, Technicolor Color-zertifiziert, ohne Quecksilber, arsenfreies Glas\nAbmessungen (Breite x Tiefe x H\u00f6he): 55.75 cm x 27.25 cm x 48.96 cm - mit Fu\u00df\nGewicht: 7.1 kg\nSchnittstellen: DisplayPort (HDCP) \u00a6 2 x HDMI (HDCP) \u00a6 Audio Line-Out \u00a6 2 x USB 3.0 Downstream \u00a6 USB 3.0 Upstream\nEinstellungen der Anzeigeposition: H\u00f6he, Neigung\nNeigungswinkel: -5/+23\nLeistungsmerkmale: Slot f\u00fcr Sicherheitsschloss (Kabelschloss getrennt erh\u00e4ltlich), abnehmbarer St\u00e4nder\nZubeh\u00f6r im Lieferumfang: VESA-Klammer\nEnthaltene Kabel: 1 x DisplayPort-Kabel \u00a6 1 x HDMI-Kabel \u00a6 1 x USB-Kabel Typ A auf Typ B\nKennzeichnung: Plug and Play, CSA, VCCI, BSMI, NOM, TUV S, CB, CCC, PSB, FCC, ISO 9241-307, KCC, WEEE, ICES, MEPS, KC, CECP, CEL, EAC, ISC, SEPA, CE/EMC\nLokalisierung: Englisch / Europa\nSchlosstyp zur Diebstahlsicherung: Kensington Slot\nEingangsspannung: Wechselstrom 120/230 V (50/60 Hz)\nLeistungsaufnahme im Ein-Zustand: 32.1 W\nStromverbrauch SDR (eingeschaltet): 32.1 kWh/1.000 h\nStromverbrauch HDR (eingeschaltet): 52.9 kWh/1.000 h\nStromverbrauch im Standby-Modus: 0.45 Watt\nStromverbrauch (Aus-Modus): 0.29 Watt\nDetails zu Abmessungen & Gewicht: Mit Fu\u00df - Breite: 55.75 cm - Tiefe: 27.25 cm - H\u00f6he: 48.96 cm - Gewicht: 7.1 kg \u00a6 Ohne Fu\u00df - Breite: 55.75 cm - Tiefe: 9.87 cm - H\u00f6he: 33.06 cm\nTransportbreite: 66 cm\nTransporttiefe: 33.2 cm\nTransporth\u00f6he: 47.3 cm\nENERGY STAR zertifiziert: Ja\nService und Support: Begrenzte Garantie - Arbeitszeit und Ersatzteile - 1 Jahr\nMin Betriebstemperatur: 5 \u00b0C\nMax. Betriebstemperatur: 35 \u00b0C\nZul\u00e4ssige Luftfeuchtigkeit im Betrieb: 20 - 80%",
    "reference_file": "offer_reference_2085.json",
    "shop_name": "TaufNaus"
}