{
    "html_file": "offer_593_15.html",
    "name": "Philips 5000 Series 40B1U5600, 39.53\"",
    "offer_link": "https://www.alternate.at/Philips/40B1U5600-LED-Monitor/html/product/100005881?partner=AtGeizhalsat&campaign=Monitor/Philips/100005881",
    "price": 648.0,
    "raw_specifications": {
        "": "VESA DisplayHDR Standard",
        "Abmessungen": "Breite: 94,4 cm x H\u00f6he: 62,8 cm x Tiefe/L\u00e4nge: 28 cm",
        "Anschl\u00fcsse": "1x HDMI-Eingang, (HDMI-Version: 2.0), 1x DisplayPort-Eingang, (DisplayPort-Version: 1.4), 1x Kopfh\u00f6rer-Ausgang, 4x USB-A-3.2 Gen 1 (5 Gbit/s), 2x USB-C",
        "Bild": "Glaretyp",
        "Bildschirmaufl\u00f6sung": "3.440 x 1.440 Pixel",
        "Bildschirmdiagonale": "102 cm (40 Zoll)",
        "EAN": "8712581797478",
        "Energieeffizienzklasse (HDR)": "G (A - G)",
        "Energieeffizienzklasse (SDR)": "F (A - G)",
        "Energieverbauch pro 1000 Stunden (HDR)": "70 kWh",
        "Energieverbauch pro 1000 Stunden (SDR)": "39 kWh",
        "Ergonomie": "Typ",
        "Farbe": "schwarz",
        "Features": "KVM-Switch, Flimmerfrei, SmartImage, EasyRead, Haken f\u00fcr Kopfh\u00f6rer, PowerSensor, LightSensor",
        "Frequenz": "Vertikal",
        "Gewicht": "13,9 kg",
        "Hersteller-Nr.": "40B1U5600/00",
        "Lautsprecher": "2 Lautsprecher",
        "Leistungsaufnahme im Bereitschafts- und Aus-Zustand": "0,5 Watt",
        "Leistungsaufnahme im Ein-Zustand bei Standard-Dynamikumfang (SDR)": "39 Watt",
        "Leistungsaufnahme im Ein-Zustand bei hohem Dynamikumfang (HDR)": "70 Watt",
        "Standards": "Video",
        "Stromversorgung": "Netzschalter",
        "Typ": "LED-Monitor",
        "Wandhalterung": "VESA kompatibel (100 x 100 mm)",
        "Weitere Informationen": "Der USB-C Port unterst\u00fctzt DisplayPort und Power Delivery",
        "Zubeh\u00f6r": "Vorhanden"
    },
    "raw_specifications_text": "Energieeffizienzklasse (SDR): F (A - G)\nEnergieverbauch pro 1000 Stunden (SDR): 39 kWh\nEnergieeffizienzklasse (HDR): G (A - G)\nEnergieverbauch pro 1000 Stunden (HDR): 70 kWh\nLeistungsaufnahme im Ein-Zustand bei Standard-Dynamikumfang (SDR): 39 Watt\nLeistungsaufnahme im Ein-Zustand bei hohem Dynamikumfang (HDR): 70 Watt\nLeistungsaufnahme im Bereitschafts- und Aus-Zustand: 0,5 Watt\nBildschirmdiagonale: 102 cm (40 Zoll)\nBildschirmaufl\u00f6sung: 3.440 x 1.440 Pixel\nTyp: LED-Monitor\nFarbe: schwarz\nEAN: 8712581797478\nHersteller-Nr.: 40B1U5600/00\nBild: Glaretyp\n: VESA DisplayHDR Standard\nFrequenz: Vertikal\nAnschl\u00fcsse: 1x HDMI-Eingang, (HDMI-Version: 2.0), 1x DisplayPort-Eingang, (DisplayPort-Version: 1.4), 1x Kopfh\u00f6rer-Ausgang, 4x USB-A-3.2 Gen 1 (5 Gbit/s), 2x USB-C\nErgonomie: Typ\nStromversorgung: Netzschalter\nLautsprecher: 2 Lautsprecher\nStandards: Video\nWandhalterung: VESA kompatibel (100 x 100 mm)\nFeatures: KVM-Switch, Flimmerfrei, SmartImage, EasyRead, Haken f\u00fcr Kopfh\u00f6rer, PowerSensor, LightSensor\nWeitere Informationen: Der USB-C Port unterst\u00fctzt DisplayPort und Power Delivery\nZubeh\u00f6r: Vorhanden\nAbmessungen: Breite: 94,4 cm x H\u00f6he: 62,8 cm x Tiefe/L\u00e4nge: 28 cm\nGewicht: 13,9 kg",
    "reference_file": "offer_reference_593.json",
    "shop_name": "Alternate.at"
}