{
    "html_file": "offer_2326_0.html",
    "name": "Wortmann Terra LED 2462W PV, 23.8\"",
    "offer_link": "https://www.ba-computer.at/terra-lcd-led-2462w-pv-v2-silber-dp-hdmi-greenline-plus-flachbildschirm-tft-lcd-60-5-cm-3030205.html",
    "price": 228.04,
    "raw_specifications": {
        "AC Eingangsfrequenz": "50 - 60 Hz",
        "AC Eingangsspannung": "100 - 240 V",
        "Anzahl DVI-D-Anschl\u00fcsse": "1",
        "Anzahl DisplayPort Anschl\u00fcsse": "1",
        "Anzahl der Farben des Displays": "16,7 Millionen Farben",
        "Bildschirmdiagonale": "60,5 cm",
        "Bildschirmdiagonale (cm)": "60,5 cm",
        "Bildschirmform": "Flach",
        "Bildschirmtechnologie": "LED",
        "Bildwinkel, horizontal": "178 \u00b0",
        "Bildwinkel, vertikal": "178 \u00b0",
        "Breite (ohne Standfu\u00df)": "540 mm",
        "DVI Anschluss": "Ja",
        "Display-Aufl\u00f6sung": "1920 x 1080 Pixel",
        "DisplayPorts-Version": "1.2",
        "Eingebaute Lautsprecher": "Ja",
        "Energieeffizienzklasse (HDR)": "E",
        "Energieverbrauch (HDR) pro 1.000 Stunden": "18 kWh",
        "Flimmerfreie Technologie": "Ja",
        "Ger\u00e4tebreite (inkl. Fu\u00df)": "540 mm",
        "Ger\u00e4teh\u00f6he (inkl. Fu\u00df)": "512 mm",
        "Ger\u00e4tetiefe (inkl. Fu\u00df)": "235 mm",
        "Gewicht (mit St\u00e4nder)": "5,6 kg",
        "Gewicht (ohne St\u00e4nder)": "3,3 kg",
        "HD-Typ": "Full HD",
        "HDCP": "Ja",
        "HDMI": "Ja",
        "Helligkeit (typisch)": "250 cd/m\u00b2",
        "H\u00f6he (ohne Standfu\u00df)": "325 mm",
        "H\u00f6henverstellung": "Ja",
        "Kabelsperre-Slot": "Ja",
        "Kontrastverh\u00e4ltnis (dynamisch)": "30000000:1",
        "Marktpositionierung": "Haus",
        "Mikrofon-Eingang": "Ja",
        "Mitgelieferte Kabel": "AC, HDMI",
        "Nachhaltigkeitszertifikate": "CE, ENERGY STAR",
        "Natives Seitenverh\u00e4ltnis": "16:9",
        "Neigungswinkelbereich": "5 - 20 \u00b0",
        "Panel-Montage-Schnittstelle": "100 x 100 mm",
        "Panel-Typ": "IPS",
        "Pivot": "Ja",
        "Pixel Abstand": "0,275 x 0,275 mm",
        "Plug & Play": "Ja",
        "Produktfarbe": "Black, Silver",
        "Rahmenloses Design": "Ja",
        "Reaktionszeit": "4 ms",
        "Slot-Typ Kabelsperre": "Kensington",
        "Stromverbrauch (Standardbetrieb)": "18 W",
        "Stromverbrauch (Standby)": "0,5 W",
        "Stromverbrauch (aus)": "0,3 W",
        "Tiefe (ohne Standfu\u00df)": "45 mm",
        "Touchscreen": "Nein",
        "Typ der Hintergrundbeleuchtung": "LED",
        "VESA-Halterung": "Ja"
    },
    "raw_specifications_text": "Bildschirmdiagonale: 60,5 cm\nDisplay-Aufl\u00f6sung: 1920 x 1080 Pixel\nNatives Seitenverh\u00e4ltnis: 16:9\nBildschirmtechnologie: LED\nTouchscreen: Nein\nHD-Typ: Full HD\nPanel-Typ: IPS\nTyp der Hintergrundbeleuchtung: LED\nHelligkeit (typisch): 250 cd/m\u00b2\nReaktionszeit: 4 ms\nBildschirmform: Flach\nKontrastverh\u00e4ltnis (dynamisch): 30000000:1\nBildwinkel, horizontal: 178 \u00b0\nBildwinkel, vertikal: 178 \u00b0\nAnzahl der Farben des Displays: 16,7 Millionen Farben\nPixel Abstand: 0,275 x 0,275 mm\nBildschirmdiagonale (cm): 60,5 cm\nMarktpositionierung: Haus\nProduktfarbe: Black, Silver\nRahmenloses Design: Ja\nEingebaute Lautsprecher: Ja\nVESA-Halterung: Ja\nPanel-Montage-Schnittstelle: 100 x 100 mm\nKabelsperre-Slot: Ja\nSlot-Typ Kabelsperre: Kensington\nH\u00f6henverstellung: Ja\nPivot: Ja\nNeigungswinkelbereich: 5 - 20 \u00b0\nPlug & Play: Ja\nFlimmerfreie Technologie: Ja\nDVI Anschluss: Ja\nAnzahl DVI-D-Anschl\u00fcsse: 1\nHDMI: Ja\nAnzahl DisplayPort Anschl\u00fcsse: 1\nDisplayPorts-Version: 1.2\nMikrofon-Eingang: Ja\nHDCP: Ja\nMitgelieferte Kabel: AC, HDMI\nGer\u00e4tebreite (inkl. Fu\u00df): 540 mm\nGer\u00e4tetiefe (inkl. Fu\u00df): 235 mm\nGer\u00e4teh\u00f6he (inkl. Fu\u00df): 512 mm\nGewicht (mit St\u00e4nder): 5,6 kg\nBreite (ohne Standfu\u00df): 540 mm\nTiefe (ohne Standfu\u00df): 45 mm\nH\u00f6he (ohne Standfu\u00df): 325 mm\nGewicht (ohne St\u00e4nder): 3,3 kg\nEnergieeffizienzklasse (HDR): E\nEnergieverbrauch (HDR) pro 1.000 Stunden: 18 kWh\nStromverbrauch (Standardbetrieb): 18 W\nStromverbrauch (Standby): 0,5 W\nStromverbrauch (aus): 0,3 W\nAC Eingangsspannung: 100 - 240 V\nAC Eingangsfrequenz: 50 - 60 Hz\nNachhaltigkeitszertifikate: CE, ENERGY STAR",
    "reference_file": "offer_reference_2326.json",
    "shop_name": "BA-Computer"
}