{
    "html_file": "offer_33_1.html",
    "name": "BenQ PD3205UA, 31.5\"",
    "offer_link": "https://www.amazon.de/dp/B0BS43H3HX?linkCode=xm2&camp=2025&creative=165953&smid=A3JWKAKR8XB7XF&creativeASIN=B0BS43H3HX&tag=geizhals1-21",
    "price": 705.87,
    "raw_specifications": {
        "ASIN": "B0BS43H3HX",
        "Amazon Bestseller-Rang": "Nr. 18,429 in Computer & Zubeh\u00f6r (Siehe Top 100 in Computer & Zubeh\u00f6r)  Nr. 391 in Monitore",
        "Anzahl HDMI Schnittstellen": "\u200e1",
        "Artikelgewicht": "\u200e8 Kilograms",
        "Batterien enthalten": "\u200eNein",
        "Bildschirmaufl\u00f6sung": "\u200e3840x2160 pixels",
        "Display-Gr\u00f6\u00dfe": "\u200e31.5",
        "Durchschnittliche Kundenbewertung": "4,1  4,1 von 5 Sternen    \n    11 Sternebewertungen   \n\n\n 4,1 von 5 Sternen",
        "Farbe": "\u200eGrau",
        "Garantierte Software-Updates bis": "\u200eunbekannt",
        "Hersteller": "\u200eBenQ",
        "Im Angebot von Amazon.de seit": "3. Januar 2023",
        "L\u00f6sung": "\u200e3840 x 2160 Pixels",
        "Marke": "\u200eBenQ",
        "Modellnummer": "\u200ePD3205UA",
        "Produktabmessungen": "\u200e8,24 x 71,47 x 42,2 cm; 8 Kilogramm",
        "Prozessortyp": "\u200eOthers"
    },
    "raw_specifications_text": "Marke: \u200eBenQ\nHersteller: \u200eBenQ\nProduktabmessungen: \u200e8,24 x 71,47 x 42,2 cm; 8 Kilogramm\nModellnummer: \u200ePD3205UA\nFarbe: \u200eGrau\nDisplay-Gr\u00f6\u00dfe: \u200e31.5\nBildschirmaufl\u00f6sung: \u200e3840x2160 pixels\nL\u00f6sung: \u200e3840 x 2160 Pixels\nProzessortyp: \u200eOthers\nAnzahl HDMI Schnittstellen: \u200e1\nBatterien enthalten: \u200eNein\nArtikelgewicht: \u200e8 Kilograms\nGarantierte Software-Updates bis: \u200eunbekannt\nASIN: B0BS43H3HX\nDurchschnittliche Kundenbewertung: 4,1  4,1 von 5 Sternen    \n    11 Sternebewertungen   \n\n\n 4,1 von 5 Sternen\nAmazon Bestseller-Rang: Nr. 18,429 in Computer & Zubeh\u00f6r (Siehe Top 100 in Computer & Zubeh\u00f6r)  Nr. 391 in Monitore\nIm Angebot von Amazon.de seit: 3. Januar 2023",
    "reference_file": "offer_reference_33.json",
    "shop_name": "Amazon.at"
}