{
    "html_file": "offer_1739_28.html",
    "name": "ASUS ZenScreen MB16AH, 15.6\"",
    "offer_link": "https://technikladen.at/P-ASUS-MB16AH-396-cm-156-Zoll-1920-x-1080-Pixel-Full-HD-5-ms-Schwarz-Grau?tl=gzhls",
    "price": 274.89,
    "raw_specifications": {
        "AC Eingangsfrequenz": "50/60 Hz",
        "AC Eingangsspannung": "100 - 240 V",
        "AMD FreeSync": "Nein",
        "Anzahl HDMI-Anschl\u00fcsse": "1",
        "Anzahl Micro HDMI Anschl\u00fcsse": "1",
        "Anzahl der Farben des Displays": "262000 Farben",
        "Anzahl der Lautsprecher": "2",
        "Bildschirmaufl\u00f6sung": "1920 x 1080 Pixel",
        "Bildschirmdiagonale": "39,6 cm",
        "Bildschirmform": "Flach",
        "Bildwinkel, horizontal": "178 \u00b0",
        "Bildwinkel, vertikal": "178 \u00b0",
        "Blendfreier Bildschirm": "Ja",
        "Display-Oberfl\u00e4che": "Matt",
        "Eingebaute Lautsprecher": "Ja",
        "Energieeffizienzklasse (SDR)": "E",
        "Energieeffizienzskala": "A bis G",
        "Energieverbrauch (SDR) pro 1.000 Stunden": "10 kWh",
        "Flimmerfreie Technologie": "Ja",
        "Ger\u00e4tebreite (inkl. Fu\u00df)": "359,8 mm",
        "Ger\u00e4teh\u00f6he (inkl. Fu\u00df)": "227,6 mm",
        "Ger\u00e4tetiefe (inkl. Fu\u00df)": "9 mm",
        "Gewicht (mit St\u00e4nder)": "730 g",
        "HD-Typ": "Full HD",
        "HDCP": "Ja",
        "HDMI": "Ja",
        "Helligkeit (typisch)": "220 cd/m\u00b2",
        "Integrierte Kamera": "Nein",
        "Integrierter USB-Hub": "Nein",
        "Kontrastverh\u00e4ltnis": "700:1",
        "Kopfh\u00f6rerausgang": "Ja",
        "Kopfh\u00f6rerausg\u00e4nge": "1",
        "Marktpositionierung": "Business",
        "Maximale Bildwiederholrate": "60 Hz",
        "Mitgelieferte Kabel": "AC, HDMI, Micro-HDMI, USB Type-C, USB Type-C to USB Type-A",
        "NVIDIA G-SYNC": "Nein",
        "Nachhaltigkeitszertifikate": "RoHS, ENERGY STAR",
        "Natives Seitenverh\u00e4ltnis": "16:9",
        "Panel-Typ": "IPS",
        "Produktfarbe": "Black, Grey",
        "RMS-Leistung": "1 W",
        "Reaktionszeit": "5 ms",
        "Seitenverh\u00e4ltnis": "16:9",
        "Stromverbrauch (Standardbetrieb)": "10 W",
        "Stromverbrauch (Standby)": "0,3 W",
        "Stromverbrauch (aus)": "0,2 W",
        "St\u00e4nder enthalten": "Ja",
        "Typ der Hintergrundbeleuchtung": "LED",
        "VESA-Halterung": "Nein"
    },
    "raw_specifications_text": "NVIDIA G-SYNC: Nein\nAMD FreeSync: Nein\nFlimmerfreie Technologie: Ja\nBildschirmdiagonale: 39,6 cm\nBildschirmaufl\u00f6sung: 1920 x 1080 Pixel\nNatives Seitenverh\u00e4ltnis: 16:9\nPanel-Typ: IPS\nHelligkeit (typisch): 220 cd/m\u00b2\nReaktionszeit: 5 ms\nHD-Typ: Full HD\nTyp der Hintergrundbeleuchtung: LED\nDisplay-Oberfl\u00e4che: Matt\nBlendfreier Bildschirm: Ja\nBildschirmform: Flach\nSeitenverh\u00e4ltnis: 16:9\nKontrastverh\u00e4ltnis: 700:1\nMaximale Bildwiederholrate: 60 Hz\nBildwinkel, horizontal: 178 \u00b0\nBildwinkel, vertikal: 178 \u00b0\nAnzahl der Farben des Displays: 262000 Farben\nIntegrierter USB-Hub: Nein\nHDMI: Ja\nAnzahl HDMI-Anschl\u00fcsse: 1\nAnzahl Micro HDMI Anschl\u00fcsse: 1\nKopfh\u00f6rerausgang: Ja\nKopfh\u00f6rerausg\u00e4nge: 1\nHDCP: Ja\nVESA-Halterung: Nein\nEingebaute Lautsprecher: Ja\nIntegrierte Kamera: Nein\nAnzahl der Lautsprecher: 2\nRMS-Leistung: 1 W\nMarktpositionierung: Business\nProduktfarbe: Black, Grey\nSt\u00e4nder enthalten: Ja\nMitgelieferte Kabel: AC, HDMI, Micro-HDMI, USB Type-C, USB Type-C to USB Type-A\nEnergieeffizienzklasse (SDR): E\nEnergieverbrauch (SDR) pro 1.000 Stunden: 10 kWh\nStromverbrauch (Standardbetrieb): 10 W\nStromverbrauch (Standby): 0,3 W\nStromverbrauch (aus): 0,2 W\nAC Eingangsspannung: 100 - 240 V\nAC Eingangsfrequenz: 50/60 Hz\nEnergieeffizienzskala: A bis G\nGer\u00e4tebreite (inkl. Fu\u00df): 359,8 mm\nGer\u00e4tetiefe (inkl. Fu\u00df): 9 mm\nGer\u00e4teh\u00f6he (inkl. Fu\u00df): 227,6 mm\nGewicht (mit St\u00e4nder): 730 g\nNachhaltigkeitszertifikate: RoHS, ENERGY STAR",
    "reference_file": "offer_reference_1739.json",
    "shop_name": "TechnikLaden"
}