{
    "html_file": "offer_173_4.html",
    "name": "Dell G2724D, 27\"",
    "offer_link": "https://www.proshop.at/Bildschirm/Dell-27-Bildschirm-27-Gaming-Monitor-G2724D-Black-1-ms-AMD-FreeSync-Premium/3189455?utm_source=geizhals&utm_medium=cpc&utm_campaign=pricesite",
    "price": 343.02,
    "raw_specifications": {
        "Abmessungen (Breite x Tiefe x H\u00f6he)": "61.19 cm x 20.02 cm x 39.348 cm - mit Standfu\u00df (niedrigste Position)",
        "Abmessungen (Breite x Tiefe x H\u00f6he) - mit Standfu\u00df (niedrigste Position)": "61.19 cm x 20.02 cm x 39.348 cm",
        "Adaptive-Sync Technologie": "VESA Adaptive-Sync, NVIDIA G-SYNC Compatible, AMD FreeSync Premium",
        "Besonderheiten": "LED-Randlichtsystem, Low Blue Light-Technologie, an 3 Seiten ohne Blende, Dell ComfortView Plus, flimmerfreies Panel",
        "Bildschirmbeschichtung": "Haze 25 %, anti-glare 3H hardness",
        "Bildschirmtyp": "Fast IPS",
        "Details zu Abmessungen & Gewicht": "Mit Standfu\u00df (niedrigste Position) - Breite: 61.19 cm - Tiefe: 20.02 cm - H\u00f6he: 39.348 cm - Gewicht: 5.59 kg  Mit Standfu\u00df (h\u00f6chste Position) - Breite: 61.19 cm - Tiefe: 20.02 cm - H\u00f6he: 52.348 cm - Gewicht: 5.59 kg  Ohne Fu\u00df - Breite: 61.19 cm - Tiefe: 6.641 cm - H\u00f6he: 36.313 cm - Gewicht: 3.66 kg",
        "Diagonalabmessung": "68.6 cm (27\")",
        "Display-Typ": "LED-hintergrundbeleuchteter LCD-Monitor / TFT-Aktivmatrix",
        "EAN": "5397184821350",
        "Eingangsanschl\u00fcsse": "HDMI, 2xDisplayPort",
        "Eingangsspannung": "Wechselstrom 100-240 V (50/60 Hz)",
        "Einstellungen der Anzeigeposition": "H\u00f6he, Pivot (Rotation), Drehung, Neigung",
        "Energie Effizienzklasse": "Klasse F",
        "Energieklasse (HDR)": "Klasse G",
        "Enthaltene Kabel": "1 x DisplayPort-Kabel  1 x Kabel USB-C auf DisplayPort",
        "Farbraum": "99% sRGB",
        "Farbunterst\u00fctzung": "16,8 Millionen Farben",
        "Gaming": "Ja",
        "Ger\u00e4tetyp": "LED-hintergrundbeleuchteter LCD-Monitor - 68.6 cm (27\")",
        "Gewicht": "5.59 kg",
        "HDR-Zertifizierung": "DisplayHDR 400",
        "HDR-f\u00e4hig": "DisplayHDR 400",
        "Helligkeit": "400 cd/m\u00b2",
        "Hersteller": "Dell",
        "Hintergrundbeleuchtungs-Technologie": "LED-Hintergrundbeleuchtung",
        "Horizontaler Betrachtungswinkel": "178",
        "H\u00f6heneinstellung": "130 mm",
        "Kontrast": "1000:1 / 1000:1 (dynamisch)",
        "Leistungsaufnahme im Ein-Zustand": "26 W",
        "Leistungsmerkmale": "Unterst\u00fctzung f\u00fcr VESA-Schnittstelle",
        "Mitgelieferte Software": "Dell Display Manager",
        "Modell": "210-BHTK",
        "Native Aufl\u00f6sung": "QHD 2560 x 1440 (DisplayPort: 165 Hz, HDMI: 144 Hz)",
        "Neigungswinkel": "-5/+21",
        "Pixelpitch": "0.2331 mm",
        "Ppi": "109",
        "Produktbeschreibung": "Dell 27 Gaming Monitor G2724D - LED-Monitor - 68.6 cm (27\") - HDR",
        "Reaktionszeit": "1 ms (Grau-zu-Grau extrem)",
        "Rotationswinkel": "180",
        "Schnittstellen": "HDMI (HDCP 2.2)  2 x DisplayPort 1.4 (HDCP 2.2)",
        "Schwenkwinkel": "40",
        "Seitenverh\u00e4ltnis": "16:9",
        "Services im Bundle": "3 Jahre erweiterte Basisaustauschgew\u00e4hrleistung",
        "Sichtbare Bildfl\u00e4che": "68.47 cm",
        "Spannung": "Wechselstrom 100-240 V (50/60 Hz)",
        "Stromverbrauch (Aus-Modus)": "0.3 Watt",
        "Stromverbrauch (typisch)": "56 Watt",
        "Stromverbrauch HDR (eingeschaltet)": "45 kWh/1.000 h",
        "Stromverbrauch SDR (eingeschaltet)": "26 kWh/1.000 h",
        "Stromverbrauch im Standby-Modus": "0.3 Watt",
        "Transportgewicht": "8.61 kg",
        "VESA-Halterung": "100 mm",
        "Vertikaler Betrachtungswinkel": "178",
        "Waren-Nr.": "3189455",
        "Zum Hersteller": "www.dell.com/"
    },
    "raw_specifications_text": "Hersteller: Dell\nWaren-Nr.: 3189455\nModell: 210-BHTK\nEAN: 5397184821350\nZum Hersteller: www.dell.com/\nProduktbeschreibung: Dell 27 Gaming Monitor G2724D - LED-Monitor - 68.6 cm (27\") - HDR\nGer\u00e4tetyp: LED-hintergrundbeleuchteter LCD-Monitor - 68.6 cm (27\")\nEnergie Effizienzklasse: Klasse F\nLeistungsaufnahme im Ein-Zustand: 26 W\nAdaptive-Sync Technologie: VESA Adaptive-Sync, NVIDIA G-SYNC Compatible, AMD FreeSync Premium\nBildschirmtyp: Fast IPS\nSeitenverh\u00e4ltnis: 16:9\nNative Aufl\u00f6sung: QHD 2560 x 1440 (DisplayPort: 165 Hz, HDMI: 144 Hz)\nPixelpitch: 0.2331 mm\nHelligkeit: 400 cd/m\u00b2\nKontrast: 1000:1 / 1000:1 (dynamisch)\nHDR-f\u00e4hig: DisplayHDR 400\nReaktionszeit: 1 ms (Grau-zu-Grau extrem)\nGaming: Ja\nFarbunterst\u00fctzung: 16,8 Millionen Farben\nFarbraum: 99% sRGB\nEingangsanschl\u00fcsse: HDMI, 2xDisplayPort\nEinstellungen der Anzeigeposition: H\u00f6he, Pivot (Rotation), Drehung, Neigung\nBildschirmbeschichtung: Haze 25 %, anti-glare 3H hardness\nSpannung: Wechselstrom 100-240 V (50/60 Hz)\nAbmessungen (Breite x Tiefe x H\u00f6he) - mit Standfu\u00df (niedrigste Position): 61.19 cm x 20.02 cm x 39.348 cm\nGewicht: 5.59 kg\nServices im Bundle: 3 Jahre erweiterte Basisaustauschgew\u00e4hrleistung\nDisplay-Typ: LED-hintergrundbeleuchteter LCD-Monitor / TFT-Aktivmatrix\nEnergieklasse (HDR): Klasse G\nDiagonalabmessung: 68.6 cm (27\")\nSichtbare Bildfl\u00e4che: 68.47 cm\nPpi: 109\nHDR-Zertifizierung: DisplayHDR 400\nHorizontaler Betrachtungswinkel: 178\nVertikaler Betrachtungswinkel: 178\nHintergrundbeleuchtungs-Technologie: LED-Hintergrundbeleuchtung\nBesonderheiten: LED-Randlichtsystem, Low Blue Light-Technologie, an 3 Seiten ohne Blende, Dell ComfortView Plus, flimmerfreies Panel\nAbmessungen (Breite x Tiefe x H\u00f6he): 61.19 cm x 20.02 cm x 39.348 cm - mit Standfu\u00df (niedrigste Position)\nSchnittstellen: HDMI (HDCP 2.2)  2 x DisplayPort 1.4 (HDCP 2.2)\nNeigungswinkel: -5/+21\nSchwenkwinkel: 40\nRotationswinkel: 180\nH\u00f6heneinstellung: 130 mm\nVESA-Halterung: 100 mm\nLeistungsmerkmale: Unterst\u00fctzung f\u00fcr VESA-Schnittstelle\nEnthaltene Kabel: 1 x DisplayPort-Kabel  1 x Kabel USB-C auf DisplayPort\nEingangsspannung: Wechselstrom 100-240 V (50/60 Hz)\nStromverbrauch SDR (eingeschaltet): 26 kWh/1.000 h\nStromverbrauch HDR (eingeschaltet): 45 kWh/1.000 h\nStromverbrauch (typisch): 56 Watt\nStromverbrauch im Standby-Modus: 0.3 Watt\nStromverbrauch (Aus-Modus): 0.3 Watt\nMitgelieferte Software: Dell Display Manager\nDetails zu Abmessungen & Gewicht: Mit Standfu\u00df (niedrigste Position) - Breite: 61.19 cm - Tiefe: 20.02 cm - H\u00f6he: 39.348 cm - Gewicht: 5.59 kg  Mit Standfu\u00df (h\u00f6chste Position) - Breite: 61.19 cm - Tiefe: 20.02 cm - H\u00f6he: 52.348 cm - Gewicht: 5.59 kg  Ohne Fu\u00df - Breite: 61.19 cm - Tiefe: 6.641 cm - H\u00f6he: 36.313 cm - Gewicht: 3.66 kg\nTransportgewicht: 8.61 kg",
    "reference_file": "offer_reference_173.json",
    "shop_name": "Proshop.at"
}