{
    "html_file": "offer_71_3.html",
    "name": "V7 L238IPS-HAS-E, 23.8\"",
    "offer_link": "https://direkt.jacob.de/produkte/v7-l238ips-has-e-60-5-l238ips-has-e-artnr-7634198.html?utm_source=geizhals&utm_medium=cpc&utm_campaign=Preisvergleich&ref=103",
    "price": 119.58,
    "raw_specifications": {
        "AC Eingangsfrequenz": "50/60 Hz",
        "AC Eingangsspannung": "100 - 240 V",
        "Anzahl DisplayPort Anschl\u00fcsse": "1",
        "Anzahl HDMI-Anschl\u00fcsse": "1",
        "Anzahl VGA (D-Sub) Anschl\u00fcsse": "1",
        "Anzahl der Farben des Displays": "16,7 Millionen Farben",
        "Anzahl der Lautsprecher": "2",
        "Audioanschl\u00fcsse": "Ja",
        "Audioausgang": "Ja",
        "Bildschirmaufl\u00f6sung": "1920 x 1080 Pixel",
        "Bildschirmdiagonale": "60,5 cm (23.8\" )",
        "Bildschirmform": "Flach",
        "Bildschirmtechnologie": "LED",
        "Bildwinkel, horizontal": "178\u00b0",
        "Bildwinkel, vertikal": "178\u00b0",
        "Breite (ohne Standfu\u00df)": "54,2 cm",
        "Display-Oberfl\u00e4che": "Matt",
        "Eingebaute Lautsprecher": "Ja",
        "Energie Effizienzklasse": "F",
        "Energieeffizienzklasse (SDR)": "F",
        "Ger\u00e4tebreite (inkl. Fu\u00df)": "542 mm",
        "Ger\u00e4teh\u00f6he (inkl. Fu\u00df)": "486 mm",
        "Ger\u00e4tetiefe (inkl. Fu\u00df)": "210 mm",
        "Gewicht (mit St\u00e4nder)": "3,82 kg",
        "HD-Typ": "Full HD",
        "HDMI": "Ja",
        "Helligkeit (typisch)": "220 cd/m\u00b2",
        "H\u00f6he (ohne Standfu\u00df)": "32,1 cm",
        "H\u00f6henverstellung": "Ja",
        "Kontrastverh\u00e4ltnis": "1200:1",
        "Maximale Bildwiederholrate": "60 Hz",
        "Mitgelieferte Kabel": "HDMI",
        "Mittlere Betriebsdauer zwischen Ausf\u00e4llen (MTBF)": "30000 h",
        "Natives Seitenverh\u00e4ltnis": "16:9",
        "Netzkabel enthalten": "Ja",
        "Paketgewicht": "4,8 kg",
        "Panel-Montage-Schnittstelle": "100 x 100 mm",
        "Panel-Typ": "IPS",
        "Pixel Abstand": "0,2745 x 0,2745 mm",
        "Produktfarbe": "Schwarz",
        "RMS-Leistung": "2 W",
        "Reaktionszeit": "14 ms",
        "Schnellstart\u00fcbersicht": "Ja",
        "Schwenkbar": "Ja",
        "Seitenverh\u00e4ltnis": "16:9",
        "Sichtbare Gr\u00f6\u00dfe (horizontal)": "52,7 cm",
        "Sichtbare Gr\u00f6\u00dfe (vertikal)": "29,6 cm",
        "Stromadapter enthalten": "Ja",
        "St\u00e4nder enthalten": "Ja",
        "Tiefe (ohne Standfu\u00df)": "5,4 cm",
        "Ursprungsland": "China",
        "VESA-Halterung": "Ja",
        "Verpackungsbreite": "594 mm",
        "Verpackungsh\u00f6he": "401 mm",
        "Verpackungstiefe": "145 mm",
        "Zertifizierung": "CE, Energy Star, FCC, RoHS, UKCA, WEEE",
        "karte": "Ja",
        "kippbar": "Ja"
    },
    "raw_specifications_text": "Bildschirmdiagonale: 60,5 cm (23.8\" )\nBildschirmaufl\u00f6sung: 1920 x 1080 Pixel\nEnergie Effizienzklasse: F\nNatives Seitenverh\u00e4ltnis: 16:9\nPanel-Typ: IPS\nHD-Typ: Full HD\nBildschirmtechnologie: LED\nBildschirmform: Flach\nKontrastverh\u00e4ltnis: 1200:1\nMaximale Bildwiederholrate: 60 Hz\nAnzahl der Farben des Displays: 16,7 Millionen Farben\nHelligkeit (typisch): 220 cd/m\u00b2\nReaktionszeit: 14 ms\nDisplay-Oberfl\u00e4che: Matt\nSeitenverh\u00e4ltnis: 16:9\nBildwinkel, horizontal: 178\u00b0\nBildwinkel, vertikal: 178\u00b0\nPixel Abstand: 0,2745 x 0,2745 mm\nSichtbare Gr\u00f6\u00dfe (horizontal): 52,7 cm\nSichtbare Gr\u00f6\u00dfe (vertikal): 29,6 cm\nEingebaute Lautsprecher: Ja\nAnzahl der Lautsprecher: 2\nRMS-Leistung: 2 W\nProduktfarbe: Schwarz\nUrsprungsland: China\nZertifizierung: CE, Energy Star, FCC, RoHS, UKCA, WEEE\nHDMI: Ja\nAnzahl VGA (D-Sub) Anschl\u00fcsse: 1\nAnzahl HDMI-Anschl\u00fcsse: 1\nAnzahl DisplayPort Anschl\u00fcsse: 1\nAudioanschl\u00fcsse: Ja\nAudioausgang: Ja\nVESA-Halterung: Ja\nH\u00f6henverstellung: Ja\nPanel-Montage-Schnittstelle: 100 x 100 mm\nSchwenkbar: Ja\nkippbar: Ja\nEnergieeffizienzklasse (SDR): F\nAC Eingangsspannung: 100 - 240 V\nAC Eingangsfrequenz: 50/60 Hz\nGer\u00e4tebreite (inkl. Fu\u00df): 542 mm\nGer\u00e4tetiefe (inkl. Fu\u00df): 210 mm\nGer\u00e4teh\u00f6he (inkl. Fu\u00df): 486 mm\nGewicht (mit St\u00e4nder): 3,82 kg\nBreite (ohne Standfu\u00df): 54,2 cm\nTiefe (ohne Standfu\u00df): 5,4 cm\nH\u00f6he (ohne Standfu\u00df): 32,1 cm\nSt\u00e4nder enthalten: Ja\nMitgelieferte Kabel: HDMI\nSchnellstart\u00fcbersicht: Ja\nStromadapter enthalten: Ja\nkarte: Ja\nVerpackungsbreite: 594 mm\nVerpackungstiefe: 145 mm\nVerpackungsh\u00f6he: 401 mm\nPaketgewicht: 4,8 kg\nNetzkabel enthalten: Ja\nMittlere Betriebsdauer zwischen Ausf\u00e4llen (MTBF): 30000 h",
    "reference_file": "offer_reference_71.json",
    "shop_name": "Jacob Elektronik direkt (AT)"
}