{
    "html_file": "offer_1743_3.html",
    "name": "ASUS VA229QSB, 21.5\"",
    "offer_link": "https://www.alternate.at/ASUS/VA229QSB-Gaming-Monitor/html/product/1806722?partner=AtGeizhalsat&campaign=Monitor/ASUS/1806722",
    "price": 152.9,
    "raw_specifications": {
        "": "AMD FreeSync",
        "Abmessungen": "Breite: 49 cm x H\u00f6he: 42,3 cm x Tiefe/L\u00e4nge: 21,1 cm",
        "Anschl\u00fcsse": "1x HDMI-Eingang, (HDMI-Version: 1.4), 1x DisplayPort-Eingang, (DisplayPort-Version: 1.2), 1x 3,5-mm-Audio-Eingang, 1x Kopfh\u00f6rer-Ausgang",
        "Bild": "Format",
        "Bildschirmaufl\u00f6sung": "1.920 x 1.080 Pixel",
        "Bildschirmdiagonale": "55 cm (22 Zoll)",
        "EAN": "4718017838658",
        "Energieeffizienzklasse (SDR)": "F (A - G)",
        "Energieverbauch pro 1000 Stunden (SDR)": "19 kWh",
        "Ergonomie": "Typ",
        "Farbe": "schwarz",
        "Features": "Flicker-Free LED, Low Blue Light",
        "Frequenz": "Vertikal",
        "Geeignet f\u00fcr": "Gaming",
        "Gewicht": "4,6 kg",
        "Hersteller-Nr.": "90LM06C5-B01370",
        "Lautsprecher": "2 Lautsprecher",
        "Leistungsaufnahme im Bereitschafts- und Aus-Zustand": "0,5 Watt",
        "Leistungsaufnahme im Ein-Zustand bei Standard-Dynamikumfang (SDR)": "19 Watt",
        "Stromversorgung": "Eco-Off",
        "Typ": "Gaming-Monitor",
        "Wandhalterung": "VESA kompatibel (100 x 100 mm)"
    },
    "raw_specifications_text": "Energieeffizienzklasse (SDR): F (A - G)\nEnergieverbauch pro 1000 Stunden (SDR): 19 kWh\nLeistungsaufnahme im Ein-Zustand bei Standard-Dynamikumfang (SDR): 19 Watt\nLeistungsaufnahme im Bereitschafts- und Aus-Zustand: 0,5 Watt\nBildschirmdiagonale: 55 cm (22 Zoll)\nBildschirmaufl\u00f6sung: 1.920 x 1.080 Pixel\nTyp: Gaming-Monitor\nFarbe: schwarz\nEAN: 4718017838658\nHersteller-Nr.: 90LM06C5-B01370\nGeeignet f\u00fcr: Gaming\nBild: Format\n: AMD FreeSync\nFrequenz: Vertikal\nAnschl\u00fcsse: 1x HDMI-Eingang, (HDMI-Version: 1.4), 1x DisplayPort-Eingang, (DisplayPort-Version: 1.2), 1x 3,5-mm-Audio-Eingang, 1x Kopfh\u00f6rer-Ausgang\nErgonomie: Typ\nStromversorgung: Eco-Off\nLautsprecher: 2 Lautsprecher\nWandhalterung: VESA kompatibel (100 x 100 mm)\nFeatures: Flicker-Free LED, Low Blue Light\nAbmessungen: Breite: 49 cm x H\u00f6he: 42,3 cm x Tiefe/L\u00e4nge: 21,1 cm\nGewicht: 4,6 kg",
    "reference_file": "offer_reference_1743.json",
    "shop_name": "Alternate.at"
}