{
    "html_file": "offer_1656_34.html",
    "name": "AOC 24B2XDAM, 23.8\"",
    "offer_link": "https://www.alternate.at/AOC/24B2XDAM-LED-Monitor/html/product/1761623?partner=AtGeizhalsat&campaign=Monitor/AOC/1761623",
    "price": 107.9,
    "raw_specifications": {
        "": "Adaptive-Sync",
        "Abmessungen": "Breite: 53,95 cm x H\u00f6he: 41,84 cm x Tiefe/L\u00e4nge: 17,09 cm",
        "Anschl\u00fcsse": "1x DVI-D-Eingang, 1x HDMI-Eingang, (HDMI-Version: 1.4), 1x VGA-Eingang, 1x 3,5-mm-Audio-Eingang, 1x 3,5-mm-Audio-Ausgang",
        "Bild": "Format",
        "Bildschirmaufl\u00f6sung": "1.920 x 1.080 Pixel",
        "Bildschirmdiagonale": "60 cm (24 Zoll)",
        "EAN": "4038986149600",
        "Energieeffizienzklasse (SDR)": "F (A - G)",
        "Energieverbauch pro 1000 Stunden (SDR)": "21 kWh",
        "Farbe": "schwarz",
        "Features": "Low Blue Light Technologie, Flicker-Free LED",
        "Hersteller-Nr.": "24B2XDAM",
        "Lautsprecher": "2 Lautsprecher",
        "Leistungsaufnahme im Bereitschafts- und Aus-Zustand": "0,5 Watt",
        "Leistungsaufnahme im Ein-Zustand bei Standard-Dynamikumfang (SDR)": "21 Watt",
        "Standards": "Video",
        "Stromversorgung": "Eco-Off",
        "Typ": "LED-Monitor",
        "Wandhalterung": "VESA kompatibel (100 x 100 mm)",
        "Zubeh\u00f6r": "Vorhanden"
    },
    "raw_specifications_text": "Energieeffizienzklasse (SDR): F (A - G)\nEnergieverbauch pro 1000 Stunden (SDR): 21 kWh\nLeistungsaufnahme im Ein-Zustand bei Standard-Dynamikumfang (SDR): 21 Watt\nLeistungsaufnahme im Bereitschafts- und Aus-Zustand: 0,5 Watt\nBildschirmdiagonale: 60 cm (24 Zoll)\nBildschirmaufl\u00f6sung: 1.920 x 1.080 Pixel\nTyp: LED-Monitor\nFarbe: schwarz\nEAN: 4038986149600\nHersteller-Nr.: 24B2XDAM\nBild: Format\n: Adaptive-Sync\nAnschl\u00fcsse: 1x DVI-D-Eingang, 1x HDMI-Eingang, (HDMI-Version: 1.4), 1x VGA-Eingang, 1x 3,5-mm-Audio-Eingang, 1x 3,5-mm-Audio-Ausgang\nStromversorgung: Eco-Off\nLautsprecher: 2 Lautsprecher\nStandards: Video\nWandhalterung: VESA kompatibel (100 x 100 mm)\nFeatures: Low Blue Light Technologie, Flicker-Free LED\nZubeh\u00f6r: Vorhanden\nAbmessungen: Breite: 53,95 cm x H\u00f6he: 41,84 cm x Tiefe/L\u00e4nge: 17,09 cm",
    "reference_file": "offer_reference_1656.json",
    "shop_name": "Alternate.at"
}