{
    "html_file": "offer_429_1.html",
    "name": "MSI MEG 342CDE QD-OLED, 34.18\"",
    "offer_link": "https://www.proshop.at/Bildschirm/MSI-34-Bildschirm-MEG-342C-3440x1440-175Hz-QD-OLED-HDR400-USB-C-Gold-01-ms-AMD-FreeSync-2/3192471?utm_source=geizhals&utm_medium=cpc&utm_campaign=pricesite",
    "price": 1515.64,
    "raw_specifications": {
        "Abmessungen (Breite x Tiefe x H\u00f6he)": "81.4 cm x 29.3 cm x 37.5 cm - mit Fu\u00df",
        "Abmessungen (Breite x Tiefe x H\u00f6he) - mit Fu\u00df": "81.4 cm x 29.3 cm x 37.5 cm",
        "Adaptive-Sync Technologie": "AMD FreeSync Premium Pro",
        "Besonderheiten": "Bild in Bild, Bild f\u00fcr Bild, gro\u00dfe Farbskala, Quantum Dot Technology, Nachtsichtmodus, Monitorkalibrierung Delta E<2, an 3 Seiten ohne Blende, Less Blue Light PRO, Variable Refresh Rate (VRR), Smart Cross Hair, Optix Scope, Konsolenmodus, OLED Care",
        "Bildschirmbeschichtung": "Entspiegelt",
        "Details zu Abmessungen & Gewicht": "Ohne Fu\u00df - Breite: 81.4 cm - Tiefe: 14.3 cm - H\u00f6he: 37.5 cm - Gewicht: 6.5 kg  Mit Fu\u00df - Breite: 81.4 cm - Tiefe: 29.3 cm - H\u00f6he: 37.5 cm - Gewicht: 9.3 kg",
        "Diagonalabmessung": "86.4 cm (34\")",
        "Display-Typ": "OLED-Monitor",
        "EAN": "4711377030243",
        "Eingangsanschl\u00fcsse": "2xHDMI, 2xDisplayPort, USB-C",
        "Eingangsspannung": "Wechselstrom 100-240 V (50/60 Hz)",
        "Einstellungen der Anzeigeposition": "H\u00f6he, Neigung",
        "Energie Effizienzklasse": "Klasse G",
        "Farbe": "Schwarz, Gold",
        "Farbraum": "99.3% DCI-P3 (CIE 1976), 97.8% Adobe RGB (CIE 1976), 139.1% sRGB (CIE 1976)",
        "Farbunterst\u00fctzung": "1,07 Mrd. Farben",
        "Ger\u00e4tetyp": "OLED-Monitor - 86.4 cm (34\")",
        "Geschwungener Bildschirm": "Ja (1800R)",
        "Gewicht": "9.3 kg",
        "HDR-Format": "HDR400",
        "HDR-Zertifizierung": "DisplayHDR 400 True Black",
        "HDR-f\u00e4hig": "HDR400 / DisplayHDR 400 True Black",
        "Helligkeit": "1000 cd/m\u00b2",
        "Hersteller": "MSI",
        "Horizontale Bildwiederholrate": "31 - 274 Khz",
        "Horizontaler Betrachtungswinkel": "178",
        "H\u00f6heneinstellung": "100 mm",
        "Integrierte Peripherieger\u00e4te": "Mikrofon, USB 3.2 Gen 1 Hub, Umgebungslichtsensor",
        "KVM-Schalter": "USB",
        "Kennzeichnung": "BSMI, FCC Part 15 B, WEEE, RoHS 2011/65/EU, ErP 2009/125/EC, EMC 2014/30/EU, LVD 2014/35/EU, TUV Rheinland Flicker Free Certification, JIS C 0950, TUV Rheinland Low Blue Light (Hardware Solution)",
        "Kontrast": "100000000:1",
        "Leistungsmerkmale": "Slot f\u00fcr Sicherheitsschloss (Kabelschloss getrennt erh\u00e4ltlich), RGB-Lichtleiste",
        "Mitgelieferte Software": "MSI Mystic Light, MSI Gaming Intelligence App",
        "Modell": "MEG 342C QD OLED",
        "Native Aufl\u00f6sung": "UWQHD 3440 x 1440 bei 175 Hz",
        "Neigungswinkel": "-5/+20",
        "Pixelpitch": "0.2315 mm",
        "Produktbeschreibung": "MSI MEG 342C QD-OLED - OLED-Monitor - gebogen - 86.4 cm (34\") - HDR",
        "Reaktionszeit": "0,1 ms (Gray-to-Gray)",
        "Schlosstyp zur Diebstahlsicherung": "Kensington Slot",
        "Schnittstellen": "DisplayPort 1.4a  2 x HDMI 2.1  USB-C (DisplayPort Alt Mode, Spannungsversorgung bis 65 W)  USB 3.2 Gen 1 Upstream (Typ B)  4 x USB 3.2 Gen 1 (Typ A)  Kopfh\u00f6rer  Mikrofon  Kombinierter Kopfh\u00f6rer-/-Mikrofonstecker",
        "Seitenverh\u00e4ltnis": "21:9",
        "Sichtbare Bildfl\u00e4che": "86.8 cm (34.18\")",
        "Spannung": "Wechselstrom 100-240 V (50/60 Hz)",
        "Stromverbrauch (Aus-Modus)": "0.3 Watt",
        "Stromverbrauch (typisch)": "280 Watt",
        "Stromverbrauch HDR (eingeschaltet)": "50 kWh/1.000 h",
        "Stromverbrauch SDR (eingeschaltet)": "50 kWh/1.000 h",
        "Stromverbrauch im Standby-Modus": "0.5 Watt",
        "Tastatur-/Mausschnittstelle": "USB",
        "Transportgewicht": "13.9 kg",
        "VESA-Halterung": "100 x 100 mm",
        "Vertikale Bildwiederholrate": "48 - 175 Hz",
        "Vertikaler Betrachtungswinkel": "178",
        "Waren-Nr.": "3192471",
        "Zum Hersteller": "www.msi.com/"
    },
    "raw_specifications_text": "Hersteller: MSI\nWaren-Nr.: 3192471\nModell: MEG 342C QD OLED\nEAN: 4711377030243\nZum Hersteller: www.msi.com/\nProduktbeschreibung: MSI MEG 342C QD-OLED - OLED-Monitor - gebogen - 86.4 cm (34\") - HDR\nGer\u00e4tetyp: OLED-Monitor - 86.4 cm (34\")\nEnergie Effizienzklasse: Klasse G\nKVM-Schalter: USB\nGeschwungener Bildschirm: Ja (1800R)\nAdaptive-Sync Technologie: AMD FreeSync Premium Pro\nLeistungsmerkmale: Slot f\u00fcr Sicherheitsschloss (Kabelschloss getrennt erh\u00e4ltlich), RGB-Lichtleiste\nSeitenverh\u00e4ltnis: 21:9\nNative Aufl\u00f6sung: UWQHD 3440 x 1440 bei 175 Hz\nPixelpitch: 0.2315 mm\nHelligkeit: 1000 cd/m\u00b2\nKontrast: 100000000:1\nHDR-f\u00e4hig: HDR400 / DisplayHDR 400 True Black\nReaktionszeit: 0,1 ms (Gray-to-Gray)\nFarbunterst\u00fctzung: 1,07 Mrd. Farben\nFarbraum: 99.3% DCI-P3 (CIE 1976), 97.8% Adobe RGB (CIE 1976), 139.1% sRGB (CIE 1976)\nEingangsanschl\u00fcsse: 2xHDMI, 2xDisplayPort, USB-C\nEinstellungen der Anzeigeposition: H\u00f6he, Neigung\nBildschirmbeschichtung: Entspiegelt\nSpannung: Wechselstrom 100-240 V (50/60 Hz)\nFarbe: Schwarz, Gold\nAbmessungen (Breite x Tiefe x H\u00f6he) - mit Fu\u00df: 81.4 cm x 29.3 cm x 37.5 cm\nGewicht: 9.3 kg\nKennzeichnung: BSMI, FCC Part 15 B, WEEE, RoHS 2011/65/EU, ErP 2009/125/EC, EMC 2014/30/EU, LVD 2014/35/EU, TUV Rheinland Flicker Free Certification, JIS C 0950, TUV Rheinland Low Blue Light (Hardware Solution)\nDisplay-Typ: OLED-Monitor\nDiagonalabmessung: 86.4 cm (34\")\nSichtbare Bildfl\u00e4che: 86.8 cm (34.18\")\nIntegrierte Peripherieger\u00e4te: Mikrofon, USB 3.2 Gen 1 Hub, Umgebungslichtsensor\nHDR-Format: HDR400\nHDR-Zertifizierung: DisplayHDR 400 True Black\nVertikale Bildwiederholrate: 48 - 175 Hz\nHorizontale Bildwiederholrate: 31 - 274 Khz\nHorizontaler Betrachtungswinkel: 178\nVertikaler Betrachtungswinkel: 178\nBesonderheiten: Bild in Bild, Bild f\u00fcr Bild, gro\u00dfe Farbskala, Quantum Dot Technology, Nachtsichtmodus, Monitorkalibrierung Delta E<2, an 3 Seiten ohne Blende, Less Blue Light PRO, Variable Refresh Rate (VRR), Smart Cross Hair, Optix Scope, Konsolenmodus, OLED Care\nAbmessungen (Breite x Tiefe x H\u00f6he): 81.4 cm x 29.3 cm x 37.5 cm - mit Fu\u00df\nTastatur-/Mausschnittstelle: USB\nSchnittstellen: DisplayPort 1.4a  2 x HDMI 2.1  USB-C (DisplayPort Alt Mode, Spannungsversorgung bis 65 W)  USB 3.2 Gen 1 Upstream (Typ B)  4 x USB 3.2 Gen 1 (Typ A)  Kopfh\u00f6rer  Mikrofon  Kombinierter Kopfh\u00f6rer-/-Mikrofonstecker\nNeigungswinkel: -5/+20\nH\u00f6heneinstellung: 100 mm\nVESA-Halterung: 100 x 100 mm\nSchlosstyp zur Diebstahlsicherung: Kensington Slot\nEingangsspannung: Wechselstrom 100-240 V (50/60 Hz)\nStromverbrauch SDR (eingeschaltet): 50 kWh/1.000 h\nStromverbrauch HDR (eingeschaltet): 50 kWh/1.000 h\nStromverbrauch (typisch): 280 Watt\nStromverbrauch im Standby-Modus: 0.5 Watt\nStromverbrauch (Aus-Modus): 0.3 Watt\nMitgelieferte Software: MSI Mystic Light, MSI Gaming Intelligence App\nDetails zu Abmessungen & Gewicht: Ohne Fu\u00df - Breite: 81.4 cm - Tiefe: 14.3 cm - H\u00f6he: 37.5 cm - Gewicht: 6.5 kg  Mit Fu\u00df - Breite: 81.4 cm - Tiefe: 29.3 cm - H\u00f6he: 37.5 cm - Gewicht: 9.3 kg\nTransportgewicht: 13.9 kg",
    "reference_file": "offer_reference_429.json",
    "shop_name": "Proshop.at"
}