{
    "html_file": "offer_1275_8.html",
    "name": "LC-Power LC-M32-QHD-165-C-K, 32\"",
    "offer_link": "https://www.proshop.at/Bildschirm/LC-Power-32-Bildschirm-LC-M32-QHD-165-C-K-White-1-ms-AMD-Adaptive-Sync/2987933?utm_source=geizhals&utm_medium=cpc&utm_campaign=pricesite",
    "price": 422.02,
    "raw_specifications": {
        "Abmessungen (Breite x Tiefe x H\u00f6he)": "72.1 cm x 28.7 cm x 60 cm - mit Fu\u00df",
        "Abmessungen (Breite x Tiefe x H\u00f6he) - mit Fu\u00df": "72.1 cm x 28.7 cm x 60 cm",
        "Adaptive-Sync Technologie": "AMD Adaptive-Sync",
        "Besonderheiten": "Overdrive-Technologie, flimmerfreie Technologie, kompatibel mit HDR 1000",
        "Bildschirmbeschichtung": "Blendfrei",
        "Bildschirmtyp": "VA",
        "Details zu Abmessungen & Gewicht": "Ohne Fu\u00df - Breite: 72.1 cm - Tiefe: 13.3 cm - H\u00f6he: 42.9 cm - Gewicht: 8.82 kg  Mit Fu\u00df - Breite: 72.1 cm - Tiefe: 28.7 cm - H\u00f6he: 60 cm",
        "Diagonalabmessung": "81.3 cm (32\")",
        "Display-Typ": "LCD-Monitor / TFT-Aktivmatrix",
        "EAN": "4260070128998",
        "Eingangsanschl\u00fcsse": "3xHDMI, DisplayPort, USB-C",
        "Einstellungen der Anzeigeposition": "H\u00f6he, Drehung, Neigung",
        "Energie Effizienzklasse": "Klasse G",
        "Energieklasse (HDR)": "Klasse G",
        "Enthaltene Kabel": "1 x DisplayPort-Kabel",
        "Farbe": "Wei\u00df",
        "Farbraum": "85% Adobe RGB, 85% NTSC, 99% sRGB, 90% DCI-P3",
        "Farbunterst\u00fctzung": "16,7 Millionen Farben",
        "Ger\u00e4tetyp": "LCD-Monitor - 81.3 cm (32\")",
        "Geschwungener Bildschirm": "Ja (1000R)",
        "Gewicht": "8.82 kg",
        "Helligkeit": "1000 cd/m\u00b2",
        "Hersteller": "LC Power",
        "Horizontaler Betrachtungswinkel": "178",
        "H\u00f6heneinstellung": "95 mm",
        "Integrierte Peripherieger\u00e4te": "Lichtsensor",
        "Kennzeichnung": "DisplayPort 1.4",
        "Kontrast": "2500:1",
        "Leistungsmerkmale": "RGB-Hintergrundbeleuchtung",
        "Modell": "LC-M32-QHD-165-C-K",
        "Native Aufl\u00f6sung": "QHD 2560 x 1440 bei 165 Hz",
        "Neigungswinkel": "-5/+15",
        "Produktbeschreibung": "LC Power LC-M32-QHD-165-C-K - LCD-Monitor - gebogen - 81.3 cm (32\")",
        "Reaktionszeit": "1 ms",
        "Schnittstellen": "3 x HDMI  DisplayPort  Audio Line-Out  USB-C mit Stromversorgung (bis zu 65 W)",
        "Schwenkwinkel": "30",
        "Seitenverh\u00e4ltnis": "16:9",
        "Stromverbrauch HDR (eingeschaltet)": "63 kWh/1.000 h",
        "Stromverbrauch SDR (eingeschaltet)": "39 kWh/1.000 h",
        "Stromverbrauch im Standby-Modus": "0.5 Watt",
        "Transportbreite": "82.3 cm",
        "Transportgewicht": "11.14 kg",
        "Transporth\u00f6he": "55.5 cm",
        "Transporttiefe": "28.3 cm",
        "VESA-Halterung": "75 x 75 mm",
        "Vertikaler Betrachtungswinkel": "178",
        "Waren-Nr.": "2987933",
        "Zum Hersteller": "www.lc-power.com"
    },
    "raw_specifications_text": "Hersteller: LC Power\nWaren-Nr.: 2987933\nModell: LC-M32-QHD-165-C-K\nEAN: 4260070128998\nZum Hersteller: www.lc-power.com\nProduktbeschreibung: LC Power LC-M32-QHD-165-C-K - LCD-Monitor - gebogen - 81.3 cm (32\")\nGer\u00e4tetyp: LCD-Monitor - 81.3 cm (32\")\nEnergie Effizienzklasse: Klasse G\nGeschwungener Bildschirm: Ja (1000R)\nAdaptive-Sync Technologie: AMD Adaptive-Sync\nLeistungsmerkmale: RGB-Hintergrundbeleuchtung\nBildschirmtyp: VA\nSeitenverh\u00e4ltnis: 16:9\nNative Aufl\u00f6sung: QHD 2560 x 1440 bei 165 Hz\nHelligkeit: 1000 cd/m\u00b2\nKontrast: 2500:1\nReaktionszeit: 1 ms\nFarbunterst\u00fctzung: 16,7 Millionen Farben\nFarbraum: 85% Adobe RGB, 85% NTSC, 99% sRGB, 90% DCI-P3\nEingangsanschl\u00fcsse: 3xHDMI, DisplayPort, USB-C\nEinstellungen der Anzeigeposition: H\u00f6he, Drehung, Neigung\nBildschirmbeschichtung: Blendfrei\nFarbe: Wei\u00df\nAbmessungen (Breite x Tiefe x H\u00f6he) - mit Fu\u00df: 72.1 cm x 28.7 cm x 60 cm\nGewicht: 8.82 kg\nKennzeichnung: DisplayPort 1.4\nDisplay-Typ: LCD-Monitor / TFT-Aktivmatrix\nEnergieklasse (HDR): Klasse G\nDiagonalabmessung: 81.3 cm (32\")\nIntegrierte Peripherieger\u00e4te: Lichtsensor\nHorizontaler Betrachtungswinkel: 178\nVertikaler Betrachtungswinkel: 178\nBesonderheiten: Overdrive-Technologie, flimmerfreie Technologie, kompatibel mit HDR 1000\nAbmessungen (Breite x Tiefe x H\u00f6he): 72.1 cm x 28.7 cm x 60 cm - mit Fu\u00df\nSchnittstellen: 3 x HDMI  DisplayPort  Audio Line-Out  USB-C mit Stromversorgung (bis zu 65 W)\nNeigungswinkel: -5/+15\nSchwenkwinkel: 30\nH\u00f6heneinstellung: 95 mm\nVESA-Halterung: 75 x 75 mm\nEnthaltene Kabel: 1 x DisplayPort-Kabel\nStromverbrauch SDR (eingeschaltet): 39 kWh/1.000 h\nStromverbrauch HDR (eingeschaltet): 63 kWh/1.000 h\nStromverbrauch im Standby-Modus: 0.5 Watt\nDetails zu Abmessungen & Gewicht: Ohne Fu\u00df - Breite: 72.1 cm - Tiefe: 13.3 cm - H\u00f6he: 42.9 cm - Gewicht: 8.82 kg  Mit Fu\u00df - Breite: 72.1 cm - Tiefe: 28.7 cm - H\u00f6he: 60 cm\nTransportbreite: 82.3 cm\nTransporttiefe: 28.3 cm\nTransporth\u00f6he: 55.5 cm\nTransportgewicht: 11.14 kg",
    "reference_file": "offer_reference_1275.json",
    "shop_name": "Proshop.at"
}