{
    "html_file": "offer_2330_5.html",
    "name": "ViewSonic VA2719-2K-SMHD, 27\"",
    "offer_link": "https://www.taufnaus.de/product/10605577",
    "price": 317.43,
    "raw_specifications": {
        "Abmessungen (Breite x Tiefe x H\u00f6he)": "62.02 cm x 25 cm x 44.38 cm - mit Fu\u00df",
        "Ausgangsleistung/Kanal": "3 Watt",
        "Besonderheiten": "SuperClear, Eco-Mode, 10-Bit-Gamma, schmaler Rahmen, breiter Betrachtungswinkel",
        "Bildschirmbeschichtung": "Blendfrei, 3H Hard Coating",
        "Bildschirmtyp": "IPS",
        "Details zu Abmessungen & Gewicht": "Mit Fu\u00df - Breite: 62.02 cm - Tiefe: 25 cm - H\u00f6he: 44.38 cm - Gewicht: 5.6 kg \u00a6 Ohne Fu\u00df - Breite: 62.02 cm - Tiefe: 4.51 cm - H\u00f6he: 36.22 cm - Gewicht: 4.5 kg",
        "Diagonalabmessung": "68.6 cm (27\")",
        "Display-Typ": "LED-hintergrundbeleuchteter LCD-Monitor / TFT-Aktivmatrix",
        "ENERGY STAR zertifiziert": "Ja",
        "EPEAT-kompatibel": "EPEAT Bronze",
        "Eingangsspannung": "Wechselstrom 120/230 V (50/60 Hz)",
        "Einstellungen der Anzeigeposition": "Neigung",
        "Energie Effizienzklasse": "Klasse F",
        "Enthaltene Kabel": "1 x HDMI-Kabel - 1.5 m \u00a6 1 x Audiokabel - 1.5 m",
        "Farbunterst\u00fctzung": "1,07 Mrd. Farben",
        "Gewicht": "5.6 kg",
        "Helligkeit": "300 cd/m\u00b2",
        "Hintergrundbeleuchtungs-Technologie": "WLED",
        "Horizontale Bildwiederholrate": "15 - 120 kHz",
        "Horizontaler Betrachtungswinkel": "178",
        "Kennzeichnung": "ICES-003, CCC, FCC, WEEE, cTUVus, REACH, UkrSEPRO, EAC, EEI",
        "Kontrast": "1000:1 / 50000000:1 (dynamisch)",
        "Lebensdauer der Beleuchtung": "30,000 Stunden",
        "Leistungsmerkmale": "Slot f\u00fcr Sicherheitsschloss (Kabelschloss getrennt erh\u00e4ltlich)",
        "Max. Betriebstemperatur": "40 \u00b0C",
        "Min Betriebstemperatur": "0 \u00b0C",
        "Native Aufl\u00f6sung": "WQHD 2560 x 1440 bei 60 Hz",
        "Neigungswinkel": "-5/+22",
        "Reaktionszeit": "5 ms (Gray-to-Gray), 14 ms (typisch)",
        "Schlosstyp zur Diebstahlsicherung": "Kensington Slot",
        "Schnittstellen": "DisplayPort \u00a6 2 x HDMI \u00a6 Audio Line-In \u00a6 Audio Line-Out",
        "Seitenverh\u00e4ltnis": "16:9",
        "Service und Support": "Begrenzte Garantie - Arbeitszeit und Ersatzteile - 3 Jahre \u00a6 Begrenzte Garantie - Leuchtpult - 3 Jahre",
        "Stromverbrauch (typisch)": "27 Watt",
        "Stromverbrauch SDR (eingeschaltet)": "25 kWh/1.000 h",
        "Transportbreite": "69.5 cm",
        "Transportgewicht": "7.1 kg",
        "Transporth\u00f6he": "47 cm",
        "Transporttiefe": "13.6 cm",
        "Typ": "Lautsprecher - Stereo",
        "VESA-Halterung": "100 x 100 mm",
        "Vertikale Bildwiederholrate": "24 - 75 Hz",
        "Vertikaler Betrachtungswinkel": "178",
        "Zul\u00e4ssige Luftfeuchtigkeit im Betrieb": "20 - 90% (nicht kondensierend)"
    },
    "raw_specifications_text": "Display-Typ: LED-hintergrundbeleuchteter LCD-Monitor / TFT-Aktivmatrix\nEnergie Effizienzklasse: Klasse F\nDiagonalabmessung: 68.6 cm (27\")\nBildschirmtyp: IPS\nSeitenverh\u00e4ltnis: 16:9\nNative Aufl\u00f6sung: WQHD 2560 x 1440 bei 60 Hz\nHelligkeit: 300 cd/m\u00b2\nKontrast: 1000:1 / 50000000:1 (dynamisch)\nFarbunterst\u00fctzung: 1,07 Mrd. Farben\nReaktionszeit: 5 ms (Gray-to-Gray), 14 ms (typisch)\nVertikale Bildwiederholrate: 24 - 75 Hz\nHorizontale Bildwiederholrate: 15 - 120 kHz\nHorizontaler Betrachtungswinkel: 178\nVertikaler Betrachtungswinkel: 178\nBildschirmbeschichtung: Blendfrei, 3H Hard Coating\nHintergrundbeleuchtungs-Technologie: WLED\nBesonderheiten: SuperClear, Eco-Mode, 10-Bit-Gamma, schmaler Rahmen, breiter Betrachtungswinkel\nAbmessungen (Breite x Tiefe x H\u00f6he): 62.02 cm x 25 cm x 44.38 cm - mit Fu\u00df\nGewicht: 5.6 kg\nTyp: Lautsprecher - Stereo\nAusgangsleistung/Kanal: 3 Watt\nSchnittstellen: DisplayPort \u00a6 2 x HDMI \u00a6 Audio Line-In \u00a6 Audio Line-Out\nEinstellungen der Anzeigeposition: Neigung\nNeigungswinkel: -5/+22\nVESA-Halterung: 100 x 100 mm\nLeistungsmerkmale: Slot f\u00fcr Sicherheitsschloss (Kabelschloss getrennt erh\u00e4ltlich)\nEnthaltene Kabel: 1 x HDMI-Kabel - 1.5 m \u00a6 1 x Audiokabel - 1.5 m\nLebensdauer der Beleuchtung: 30,000 Stunden\nKennzeichnung: ICES-003, CCC, FCC, WEEE, cTUVus, REACH, UkrSEPRO, EAC, EEI\nSchlosstyp zur Diebstahlsicherung: Kensington Slot\nEingangsspannung: Wechselstrom 120/230 V (50/60 Hz)\nStromverbrauch SDR (eingeschaltet): 25 kWh/1.000 h\nStromverbrauch (typisch): 27 Watt\nDetails zu Abmessungen & Gewicht: Mit Fu\u00df - Breite: 62.02 cm - Tiefe: 25 cm - H\u00f6he: 44.38 cm - Gewicht: 5.6 kg \u00a6 Ohne Fu\u00df - Breite: 62.02 cm - Tiefe: 4.51 cm - H\u00f6he: 36.22 cm - Gewicht: 4.5 kg\nTransportbreite: 69.5 cm\nTransporttiefe: 13.6 cm\nTransporth\u00f6he: 47 cm\nTransportgewicht: 7.1 kg\nEPEAT-kompatibel: EPEAT Bronze\nENERGY STAR zertifiziert: Ja\nService und Support: Begrenzte Garantie - Arbeitszeit und Ersatzteile - 3 Jahre \u00a6 Begrenzte Garantie - Leuchtpult - 3 Jahre\nMin Betriebstemperatur: 0 \u00b0C\nMax. Betriebstemperatur: 40 \u00b0C\nZul\u00e4ssige Luftfeuchtigkeit im Betrieb: 20 - 90% (nicht kondensierend)",
    "reference_file": "offer_reference_2330.json",
    "shop_name": "TaufNaus"
}