{
    "html_file": "offer_698_9.html",
    "name": "HP 24mh, 23.8\"",
    "offer_link": "https://www.mylemon.at/artikel/hewlett_packard/1d0j9e9_abb/hp-24-l-24mh-1d0j9e9.html",
    "price": 163.99,
    "raw_specifications": {
        "AC Eingangsfrequenz": "50 - 60 Hz",
        "AC Eingangsspannung": "100 - 240 V",
        "AMD FreeSync": "Nein",
        "Anzahl DisplayPort Anschl\u00fcsse": "1",
        "Anzahl HDMI-Anschl\u00fcsse": "1",
        "Anzahl VGA (D-Sub) Anschl\u00fcsse": "1",
        "Artikelnummer": "M1EYGEOL",
        "Audioanschl\u00fcsse": "Nein",
        "Aufl\u00f6sung": "1920x1080",
        "Bildschirmdiagonale": "60,5 cm (23.8 Zoll)",
        "Bildschirmform": "Flach",
        "Bildschirmtechnologie": "IPS",
        "Bildwinkel, horizontal": "178\u00b0",
        "Bildwinkel, vertikal": "178\u00b0",
        "Breite": "538,2 mm",
        "Breite (ohne Standfu\u00df)": "53,8 cm",
        "DVI Anschluss": "Nein",
        "Display-Aufl\u00f6sung": "1920 x 1080 Pixel",
        "DisplayPorts-Version": "1.2",
        "Displaygr\u00f6\u00dfe": "23,8 Zoll",
        "EAN": "196548497515",
        "Eingebaute Lautsprecher": "Ja",
        "Energieeffizienzklasse (SDR)": "E",
        "Energieeffizienzskala": "A bis G",
        "Energieverbrauch (SDR) pro 1.000 Stunden": "15 kWh",
        "Ergonomie": "H\u00f6henverstellbar, Pivot (90 Grad drehbar), Schwenkbar, Neigbar",
        "Farbtiefe": "8 Bit",
        "Ger\u00e4tebreite (inkl. Fu\u00df)": "538,2 mm",
        "Ger\u00e4teh\u00f6he (inkl. Fu\u00df)": "464,3 mm",
        "Ger\u00e4tetiefe (inkl. Fu\u00df)": "211,6 mm",
        "Gewicht": "4,5 kg",
        "Gewicht (mit St\u00e4nder)": "4,5 kg",
        "HD-Typ": "Full HD",
        "HDMI": "Ja",
        "HDMI-Version": "1.4",
        "HP-Segment": "Haus",
        "Helligkeit": "250 cd/m\u00b2",
        "Helligkeit (typisch)": "250 cd/m\u00b2",
        "Hersteller Artikelnummer": "1D0J9E9#ABB",
        "Horizontaler Scanbereich": "30 - 86 kHz",
        "H\u00f6he": "325,6 mm",
        "H\u00f6he (ohne Standfu\u00df)": "32,6 cm",
        "H\u00f6heneinstellung": "10 cm",
        "H\u00f6henverstellung": "Ja",
        "Integrierte Kamera": "Nein",
        "Integrierter USB-Hub": "Nein",
        "Kontrastverh\u00e4ltnis": "1000:1",
        "Kontrastverh\u00e4ltnis (dynamisch)": "10000000:1",
        "Kopfh\u00f6rerausgang": "Nein",
        "Marktpositionierung": "Haus",
        "Maximale Bildwiederholrate": "60 Hz",
        "NVIDIA G-SYNC": "Nein",
        "Nachhaltige Technologien und Materialien": "Arsenfreies Bildschirmglas; Halogenarm; Quecksilberfreie Hintergrundbeleuchtung",
        "Nachhaltigkeitszertifikate": "ENERGY STAR",
        "Natives Seitenverh\u00e4ltnis": "16:9",
        "Neigungsverstellung": "Ja",
        "Neigungswinkelbereich": "-5 - 23\u00b0",
        "Paketgewicht": "6,04 kg",
        "Panel": "IPS",
        "Panel-Typ": "IPS",
        "Pivot": "Ja",
        "Produktfarbe": "Grau, Silber",
        "Reaktionszeit": "5 ms",
        "Schwenkbar": "Ja",
        "Stromverbrauch (Standardbetrieb)": "22 W",
        "Stromverbrauch (Standby)": "0,5 W",
        "Stromverbrauch (aus)": "0,3 W",
        "Stromverbrauch (max.)": "24 W",
        "Tiefe": "45,9 mm",
        "Tiefe (ohne Standfu\u00df)": "4,59 cm",
        "Touchscreen": "Nein",
        "Typ der Hintergrundbeleuchtung": "Seiten-LED",
        "Unterst\u00fctzte Grafik-Aufl\u00f6sungen": "640 x 350, 720 x 400, 800 x 600 (SVGA), 1024 x 768 (XGA), 1280 x 1024 (SXGA), 1280 x 720 (HD 720), 1280 x 800 (WXGA), 1366  768, 1440 x 900 (WXGA+), 1600 x 900, 1680 x 1050 (WSXGA+), 1920 x 1080 (HD 1080)",
        "VESA Halterung": "100x100 mm",
        "VESA-Halterung": "Ja",
        "Verpackungsbreite": "538,2 mm",
        "Verpackungsh\u00f6he": "464,3 mm",
        "Verpackungstiefe": "211,6 mm",
        "Vertikaler Scanbereich": "48 - 75 Hz",
        "Video Anschl\u00fcsse": "1x VGA, 1x HDMI, 1x DisplayPort",
        "Zertifizierung": "Australian-New Zealand MEPS; BSMI; CB; CCC; CE; CEL; CSA; EAC; Energy Star; FCC; ICES; ISO 9241-307; KC; KCC; NOM; PSB; TUV-S; UL; VCCI; Vietnam MEPS; WEEE; ISC"
    },
    "raw_specifications_text": "Displaygr\u00f6\u00dfe: 23,8 Zoll\nAufl\u00f6sung: 1920x1080\nPanel: IPS\nReaktionszeit: 5 ms\nVideo Anschl\u00fcsse: 1x VGA, 1x HDMI, 1x DisplayPort\nErgonomie: H\u00f6henverstellbar, Pivot (90 Grad drehbar), Schwenkbar, Neigbar\nVESA Halterung: 100x100 mm\nHelligkeit: 250 cd/m\u00b2\nHersteller Artikelnummer: 1D0J9E9#ABB\nEAN: 196548497515\nArtikelnummer: M1EYGEOL\nBildschirmdiagonale: 60,5 cm (23.8 Zoll)\nDisplay-Aufl\u00f6sung: 1920 x 1080 Pixel\nNatives Seitenverh\u00e4ltnis: 16:9\nBildschirmtechnologie: IPS\nTouchscreen: Nein\nHD-Typ: Full HD\nPanel-Typ: IPS\nBildschirmform: Flach\nKontrastverh\u00e4ltnis: 1000:1\nMaximale Bildwiederholrate: 60 Hz\nTyp der Hintergrundbeleuchtung: Seiten-LED\nHelligkeit (typisch): 250 cd/m\u00b2\nUnterst\u00fctzte Grafik-Aufl\u00f6sungen: 640 x 350, 720 x 400, 800 x 600 (SVGA), 1024 x 768 (XGA), 1280 x 1024 (SXGA), 1280 x 720 (HD 720), 1280 x 800 (WXGA), 1366  768, 1440 x 900 (WXGA+), 1600 x 900, 1680 x 1050 (WSXGA+), 1920 x 1080 (HD 1080)\nKontrastverh\u00e4ltnis (dynamisch): 10000000:1\nBildwinkel, horizontal: 178\u00b0\nBildwinkel, vertikal: 178\u00b0\nHorizontaler Scanbereich: 30 - 86 kHz\nVertikaler Scanbereich: 48 - 75 Hz\nFarbtiefe: 8 Bit\nNVIDIA G-SYNC: Nein\nAMD FreeSync: Nein\nHP-Segment: Haus\nEingebaute Lautsprecher: Ja\nIntegrierte Kamera: Nein\nMarktpositionierung: Haus\nProduktfarbe: Grau, Silber\nZertifizierung: Australian-New Zealand MEPS; BSMI; CB; CCC; CE; CEL; CSA; EAC; Energy Star; FCC; ICES; ISO 9241-307; KC; KCC; NOM; PSB; TUV-S; UL; VCCI; Vietnam MEPS; WEEE; ISC\nIntegrierter USB-Hub: Nein\nHDMI: Ja\nKopfh\u00f6rerausgang: Nein\nAnzahl VGA (D-Sub) Anschl\u00fcsse: 1\nDVI Anschluss: Nein\nAnzahl HDMI-Anschl\u00fcsse: 1\nHDMI-Version: 1.4\nAnzahl DisplayPort Anschl\u00fcsse: 1\nDisplayPorts-Version: 1.2\nAudioanschl\u00fcsse: Nein\nVESA-Halterung: Ja\nH\u00f6henverstellung: Ja\nH\u00f6heneinstellung: 10 cm\nPivot: Ja\nSchwenkbar: Ja\nNeigungswinkelbereich: -5 - 23\u00b0\nNeigungsverstellung: Ja\nEnergieeffizienzklasse (SDR): E\nEnergieverbrauch (SDR) pro 1.000 Stunden: 15 kWh\nStromverbrauch (Standardbetrieb): 22 W\nStromverbrauch (Standby): 0,5 W\nStromverbrauch (max.): 24 W\nStromverbrauch (aus): 0,3 W\nAC Eingangsspannung: 100 - 240 V\nAC Eingangsfrequenz: 50 - 60 Hz\nEnergieeffizienzskala: A bis G\nGer\u00e4tebreite (inkl. Fu\u00df): 538,2 mm\nGer\u00e4tetiefe (inkl. Fu\u00df): 211,6 mm\nGer\u00e4teh\u00f6he (inkl. Fu\u00df): 464,3 mm\nGewicht (mit St\u00e4nder): 4,5 kg\nBreite (ohne Standfu\u00df): 53,8 cm\nTiefe (ohne Standfu\u00df): 4,59 cm\nH\u00f6he (ohne Standfu\u00df): 32,6 cm\nVerpackungsbreite: 538,2 mm\nVerpackungstiefe: 211,6 mm\nVerpackungsh\u00f6he: 464,3 mm\nPaketgewicht: 6,04 kg\nNachhaltigkeitszertifikate: ENERGY STAR\nNachhaltige Technologien und Materialien: Arsenfreies Bildschirmglas; Halogenarm; Quecksilberfreie Hintergrundbeleuchtung\nGewicht: 4,5 kg\nH\u00f6he: 325,6 mm\nBreite: 538,2 mm\nTiefe: 45,9 mm",
    "reference_file": "offer_reference_698.json",
    "shop_name": "mylemon.at"
}