{
    "html_file": "offer_1181_5.html",
    "name": "HP U32, 31.5\"",
    "offer_link": "https://www.csv-direct.de/artinfo.php?artnr=A1621076&KATEGORIE=162&pva=geizhals2",
    "price": 518.99,
    "raw_specifications": {
        "AC Eingangsfrequenz": "50 - 60 Hz",
        "AC Eingangsspannung": "100 - 240 V",
        "Anzahl DisplayPort Anschl\u00fcsse": "1",
        "Anzahl HDMI-Anschl\u00fcsse": "1",
        "Anzahl der Farben des Displays": "1,07 Milliarden Farben",
        "Anzahl der nachgeschalteten Ports vom Typ USB-C": "1",
        "Anzahl der nachgeschalteten Steckpl\u00e4tze vom Typ USB-A": "3",
        "Betriebstemperatur": "5 - 35 \u00b0C",
        "Bildschirmdiagonale": "80 cm 31.5\"",
        "Bildschirmdiagonale cm": "80 cm",
        "Bildschirmform": "Gebogen",
        "Bildwinkel, horizontal": "178\u00b0",
        "Bildwinkel, vertikal": "178\u00b0",
        "Breite": "714 mm",
        "Breite ohne Standfu\u00df": "714 mm",
        "Digital horizontale Frequenz": "27 - 136 kHz",
        "Digital vertikale Frequenz": "30 - 60 Hz",
        "Display-Aufl\u00f6sung": "3840 x 2160 Pixel",
        "DisplayPorts-Version": "1.4",
        "Eingebaute Lautsprecher": "Nein",
        "Ger\u00e4tebreite inkl. Fu\u00df": "71,4 mm",
        "Ger\u00e4teh\u00f6he inkl. Fu\u00df": "20,6 mm",
        "Ger\u00e4tetiefe inkl. Fu\u00df": "61,7 mm",
        "Gewicht": "7,5 kg",
        "Gewicht mit St\u00e4nder": "7,5 kg",
        "HD-Typ": "4K Ultra HD",
        "HDMI-Version": "2.0",
        "Helligkeit typisch": "400 cd/m\u00b2",
        "H\u00f6he": "426 mm",
        "H\u00f6he ohne Standfu\u00df": "42,6 mm",
        "H\u00f6heneinstellung": "15 cm",
        "Kontrastverh\u00e4ltnis": "1000:1",
        "Kontrastverh\u00e4ltnis dynamisch": "10000000:1",
        "Marktpositionierung": "Haus",
        "Mitgelieferte Kabel": "AC, DisplayPort, HDMI, USB Typ-C",
        "Natives Seitenverh\u00e4ltnis": "16:9",
        "Neigungswinkelbereich": "-5 - 23\u00b0",
        "Paketgewicht": "12,2 kg",
        "Panel-Montage-Schnittstelle": "100 x 100 mm",
        "Panel-Typ": "IPS",
        "Reaktionszeit": "4 ms",
        "Relative Luftfeuchtigkeit in Betrieb": "20 - 80",
        "Seitenverh\u00e4ltnis": "16:9",
        "Stromverbrauch Standardbetrieb": "45 W",
        "Stromverbrauch Standby": "0,5 W",
        "Stromverbrauch max.": "155 W",
        "Technologie mit hohem Dynamikbereich HDR": "DisplayHDR 400",
        "Tiefe": "43,6 mm",
        "Tiefe ohne Standfu\u00df": "4,36 mm",
        "Touchscreen": "Nein",
        "USB-Stromversorgung bis zu": "65 W",
        "Unterst\u00fctzte Grafik-Aufl\u00f6sungen": "720 x 400, 800 x 600 SVGA, 1024 x 768 XGA, 1280 x 1024 SXGA, 1280 x 720 HD 720, 1280 x 800, 1440 x 900 WXGA+, 1600 x 900, 1680 x 1050 WSXGA+, 1920 x 1080 HD 1080, 1920 x 1200 WUXGA, 2560 x 1440, 3840 x 2160",
        "Verpackungsbreite": "714 mm",
        "Verpackungsh\u00f6he": "617 mm",
        "Verpackungstiefe": "206 mm"
    },
    "raw_specifications_text": "Bildschirmdiagonale: 80 cm 31.5\"\nDisplay-Aufl\u00f6sung: 3840 x 2160 Pixel\nNatives Seitenverh\u00e4ltnis: 16:9\nTouchscreen: Nein\nHD-Typ: 4K Ultra HD\nPanel-Typ: IPS\nBildschirmform: Gebogen\nKontrastverh\u00e4ltnis: 1000:1\nAnzahl der Farben des Displays: 1,07 Milliarden Farben\nHelligkeit typisch: 400 cd/m\u00b2\nReaktionszeit: 4 ms\nUnterst\u00fctzte Grafik-Aufl\u00f6sungen: 720 x 400, 800 x 600 SVGA, 1024 x 768 XGA, 1280 x 1024 SXGA, 1280 x 720 HD 720, 1280 x 800, 1440 x 900 WXGA+, 1600 x 900, 1680 x 1050 WSXGA+, 1920 x 1080 HD 1080, 1920 x 1200 WUXGA, 2560 x 1440, 3840 x 2160\nSeitenverh\u00e4ltnis: 16:9\nKontrastverh\u00e4ltnis dynamisch: 10000000:1\nBildwinkel, horizontal: 178\u00b0\nBildwinkel, vertikal: 178\u00b0\nDigital horizontale Frequenz: 27 - 136 kHz\nDigital vertikale Frequenz: 30 - 60 Hz\nBildschirmdiagonale cm: 80 cm\nTechnologie mit hohem Dynamikbereich HDR: DisplayHDR 400\nEingebaute Lautsprecher: Nein\nMarktpositionierung: Haus\nAnzahl der nachgeschalteten Steckpl\u00e4tze vom Typ USB-A: 3\nAnzahl der nachgeschalteten Ports vom Typ USB-C: 1\nUSB-Stromversorgung bis zu: 65 W\nAnzahl HDMI-Anschl\u00fcsse: 1\nHDMI-Version: 2.0\nAnzahl DisplayPort Anschl\u00fcsse: 1\nDisplayPorts-Version: 1.4\nPanel-Montage-Schnittstelle: 100 x 100 mm\nH\u00f6heneinstellung: 15 cm\nNeigungswinkelbereich: -5 - 23\u00b0\nStromverbrauch Standardbetrieb: 45 W\nStromverbrauch Standby: 0,5 W\nStromverbrauch max.: 155 W\nAC Eingangsspannung: 100 - 240 V\nAC Eingangsfrequenz: 50 - 60 Hz\nBetriebstemperatur: 5 - 35 \u00b0C\nRelative Luftfeuchtigkeit in Betrieb: 20 - 80\nMitgelieferte Kabel: AC, DisplayPort, HDMI, USB Typ-C\nGer\u00e4tebreite inkl. Fu\u00df: 71,4 mm\nGer\u00e4tetiefe inkl. Fu\u00df: 61,7 mm\nGer\u00e4teh\u00f6he inkl. Fu\u00df: 20,6 mm\nGewicht mit St\u00e4nder: 7,5 kg\nBreite ohne Standfu\u00df: 714 mm\nTiefe ohne Standfu\u00df: 4,36 mm\nH\u00f6he ohne Standfu\u00df: 42,6 mm\nVerpackungsbreite: 714 mm\nVerpackungstiefe: 206 mm\nVerpackungsh\u00f6he: 617 mm\nPaketgewicht: 12,2 kg\nGewicht: 7,5 kg\nH\u00f6he: 426 mm\nBreite: 714 mm\nTiefe: 43,6 mm",
    "reference_file": "offer_reference_1181.json",
    "shop_name": "CSV-Direct.de"
}