{
    "html_file": "offer_637_27.html",
    "name": "iiyama ProLite XUB2493HS-B5, 23.8\"",
    "offer_link": "https://www.alternate.at/iiyama/XUB2493HS-B5-LED-Monitor/html/product/1883760?partner=AtGeizhalsat&campaign=Monitor/iiyama/1883760",
    "price": 152.9,
    "raw_specifications": {
        "": "Kensington-Schloss",
        "Abmessungen": "Breite: 53,95 cm x H\u00f6he: 19,3 cm x Tiefe/L\u00e4nge: 20,95 cm",
        "Anschl\u00fcsse": "1x HDMI-Eingang, 1x DisplayPort-Eingang, 1x Kopfh\u00f6rer-Ausgang",
        "Bild": "Format",
        "Bildschirmaufl\u00f6sung": "1.920 x 1.080 Pixel",
        "Bildschirmdiagonale": "61 cm (24 Zoll)",
        "EAN": "4948570121144",
        "Energieeffizienzklasse (SDR)": "D (A - G)",
        "Energieverbauch pro 1000 Stunden (SDR)": "14 kWh",
        "Ergonomie": "Typ",
        "Farbe": "schwarz",
        "Features": "Flicker-Free LED, Low Blue Light Technologie, Kabelmanagement",
        "Frequenz": "Horizontal",
        "Geeignet f\u00fcr": "Multimedia",
        "Gewicht": "5,7 kg",
        "Hersteller-Nr.": "XUB2493HS-B5",
        "Lautsprecher": "2 Lautsprecher",
        "Leistungsaufnahme im Bereitschafts- und Aus-Zustand": "0,5 Watt",
        "Leistungsaufnahme im Ein-Zustand bei Standard-Dynamikumfang (SDR)": "14,4 Watt",
        "Typ": "LED-Monitor",
        "Wandhalterung": "VESA kompatibel (100 x 100 mm)",
        "Zubeh\u00f6r": "Vorhanden"
    },
    "raw_specifications_text": "Energieeffizienzklasse (SDR): D (A - G)\nEnergieverbauch pro 1000 Stunden (SDR): 14 kWh\nLeistungsaufnahme im Ein-Zustand bei Standard-Dynamikumfang (SDR): 14,4 Watt\nLeistungsaufnahme im Bereitschafts- und Aus-Zustand: 0,5 Watt\nBildschirmdiagonale: 61 cm (24 Zoll)\nBildschirmaufl\u00f6sung: 1.920 x 1.080 Pixel\nTyp: LED-Monitor\nFarbe: schwarz\nEAN: 4948570121144\nHersteller-Nr.: XUB2493HS-B5\nGeeignet f\u00fcr: Multimedia\nBild: Format\n: Kensington-Schloss\nFrequenz: Horizontal\nAnschl\u00fcsse: 1x HDMI-Eingang, 1x DisplayPort-Eingang, 1x Kopfh\u00f6rer-Ausgang\nErgonomie: Typ\nLautsprecher: 2 Lautsprecher\nWandhalterung: VESA kompatibel (100 x 100 mm)\nFeatures: Flicker-Free LED, Low Blue Light Technologie, Kabelmanagement\nZubeh\u00f6r: Vorhanden\nAbmessungen: Breite: 53,95 cm x H\u00f6he: 19,3 cm x Tiefe/L\u00e4nge: 20,95 cm\nGewicht: 5,7 kg",
    "reference_file": "offer_reference_637.json",
    "shop_name": "Alternate.at"
}