{
    "html_file": "offer_1034_16.html",
    "name": "Philips Evnia 5000 27M1N5500ZA, 27\"",
    "offer_link": "https://www.alternate.at/Philips/27M1N5500ZA-Gaming-Monitor/html/product/1814033?partner=AtGeizhalsat&campaign=Monitor/Philips/1814033",
    "price": 368.0,
    "raw_specifications": {
        "": "AMD FreeSync",
        "Abmessungen": "Breite: 61,4 cm x H\u00f6he: 54,9 cm x Tiefe/L\u00e4nge: 21,2 cm",
        "Anschl\u00fcsse": "2x HDMI-Eingang, (HDMI-Version: 2.0), 1x DisplayPort-Eingang, (DisplayPort-Version: 1.4), 1x Kopfh\u00f6rer-Ausgang, 4x USB-A-3.2 Gen 1 (5 Gbit/s)",
        "Bild": "Format",
        "Bildschirmaufl\u00f6sung": "2.560 x 1.440 Pixel",
        "Bildschirmdiagonale": "69 cm (27 Zoll)",
        "EAN": "8712581784508",
        "Energieeffizienzklasse (HDR)": "G (A - G)",
        "Energieeffizienzklasse (SDR)": "G (A - G)",
        "Energieverbauch pro 1000 Stunden (HDR)": "46 kWh",
        "Energieverbauch pro 1000 Stunden (SDR)": "32 kWh",
        "Ergonomie": "Typ",
        "Farbe": "schwarz",
        "Features": "SmartContrast/Mega Infinity DCR, LowBlue Modus, EasyRead Funktion, Ultra Wide Color, Delta E<2",
        "Frequenz": "Vertikal",
        "Geeignet f\u00fcr": "Gaming",
        "Gewicht": "4,9 kg",
        "Hersteller-Nr.": "27M1N5500ZA/00",
        "Lautsprecher": "2 Lautsprecher",
        "Leistungsaufnahme im Bereitschafts- und Aus-Zustand": "0,5 Watt",
        "Leistungsaufnahme im Ein-Zustand bei Standard-Dynamikumfang (SDR)": "32 Watt",
        "Leistungsaufnahme im Ein-Zustand bei hohem Dynamikumfang (HDR)": "46 Watt",
        "Standards": "Video",
        "Stromversorgung": "Eco-Off",
        "Typ": "Gaming-Monitor",
        "Wandhalterung": "VESA kompatibel (100 x 100 mm)",
        "Zubeh\u00f6r": "Vorhanden"
    },
    "raw_specifications_text": "Energieeffizienzklasse (SDR): G (A - G)\nEnergieverbauch pro 1000 Stunden (SDR): 32 kWh\nEnergieeffizienzklasse (HDR): G (A - G)\nEnergieverbauch pro 1000 Stunden (HDR): 46 kWh\nLeistungsaufnahme im Ein-Zustand bei Standard-Dynamikumfang (SDR): 32 Watt\nLeistungsaufnahme im Ein-Zustand bei hohem Dynamikumfang (HDR): 46 Watt\nLeistungsaufnahme im Bereitschafts- und Aus-Zustand: 0,5 Watt\nBildschirmdiagonale: 69 cm (27 Zoll)\nBildschirmaufl\u00f6sung: 2.560 x 1.440 Pixel\nTyp: Gaming-Monitor\nFarbe: schwarz\nEAN: 8712581784508\nHersteller-Nr.: 27M1N5500ZA/00\nGeeignet f\u00fcr: Gaming\nBild: Format\n: AMD FreeSync\nFrequenz: Vertikal\nAnschl\u00fcsse: 2x HDMI-Eingang, (HDMI-Version: 2.0), 1x DisplayPort-Eingang, (DisplayPort-Version: 1.4), 1x Kopfh\u00f6rer-Ausgang, 4x USB-A-3.2 Gen 1 (5 Gbit/s)\nErgonomie: Typ\nStromversorgung: Eco-Off\nLautsprecher: 2 Lautsprecher\nStandards: Video\nWandhalterung: VESA kompatibel (100 x 100 mm)\nFeatures: SmartContrast/Mega Infinity DCR, LowBlue Modus, EasyRead Funktion, Ultra Wide Color, Delta E<2\nZubeh\u00f6r: Vorhanden\nAbmessungen: Breite: 61,4 cm x H\u00f6he: 54,9 cm x Tiefe/L\u00e4nge: 21,2 cm\nGewicht: 4,9 kg",
    "reference_file": "offer_reference_1034.json",
    "shop_name": "Alternate.at"
}