{
    "html_file": "offer_1796_5.html",
    "name": "Eizo FlexScan EV2495 schwarz, 24.1\"",
    "offer_link": "https://www.mylemon.at/artikel/eizo/ev2495_bk/24-l-ev2495-bk.html",
    "price": 528.12,
    "raw_specifications": {
        "AC Eingangsfrequenz": "50 - 60 Hz",
        "AC Eingangsspannung": "100 - 240 V",
        "Anzahl DisplayPort Anschl\u00fcsse": "1",
        "Anzahl Ethernet-LAN-Anschl\u00fcsse (RJ-45)": "1",
        "Anzahl HDMI-Anschl\u00fcsse": "1",
        "Anzahl der Farben des Displays": "16,78 Millionen Farben",
        "Anzahl der Lautsprecher": "2",
        "Anzahl der nachgeschalteten Ports vom Typ USB-C": "1",
        "Anzahl der nachgeschalteten Steckpl\u00e4tze vom Typ USB-A": "3",
        "Anzahl der vorgeschalteten Steckpl\u00e4tze": "2",
        "Artikelnummer": "M14Y0SVL",
        "Audioanschl\u00fcsse": "Ja",
        "Aufl\u00f6sung": "1920x1200",
        "Besonderheiten": "Lichtsensor",
        "Betriebstemperatur": "5 - 35 \u00b0C",
        "Bildschirmdiagonale": "61,2 cm (24.1 Zoll)",
        "Bildschirmform": "Flach",
        "Bildschirmtechnologie": "LED",
        "Bildwinkel, horizontal": "178\u00b0",
        "Bildwinkel, vertikal": "178\u00b0",
        "Breite (ohne Standfu\u00df)": "53,1 cm",
        "DVI Anschluss": "Nein",
        "Digital horizontale Frequenz": "31 - 76 kHz",
        "Digital vertikale Frequenz": "59 - 61 Hz",
        "Display-Aufl\u00f6sung": "1920 x 1200 Pixel",
        "Displaygr\u00f6\u00dfe": "24,1 Zoll",
        "EAN": "4995047056539",
        "Eingebaute Lautsprecher": "Ja",
        "Eingebauter Ethernet-Anschluss": "Ja",
        "Energieeffizienzklasse (SDR)": "C",
        "Energieeffizienzskala": "A bis G",
        "Energieverbrauch (SDR) pro 1.000 Stunden": "12 kWh",
        "Ergonomie": "H\u00f6henverstellbar, Pivot (90 Grad drehbar), Schwenkbar, Neigbar",
        "Ethernet LAN Datentransferraten": "10,100,1000 Mbit/s",
        "Flimmerfreie Technologie": "Ja",
        "Ger\u00e4tebreite (inkl. Fu\u00df)": "531 mm",
        "Ger\u00e4teh\u00f6he (inkl. Fu\u00df)": "356 mm",
        "Ger\u00e4tetiefe (inkl. Fu\u00df)": "230 mm",
        "Gewicht (mit St\u00e4nder)": "7,6 kg",
        "Gewicht (ohne St\u00e4nder)": "4,9 kg",
        "HD-Typ": "WUXGA",
        "HDCP": "Ja",
        "HDMI": "Ja",
        "Helligkeit": "350 cd/m\u00b2",
        "Helligkeit (typisch)": "350 cd/m\u00b2",
        "Hersteller Artikelnummer": "EV2495-BK",
        "H\u00f6he (ohne Standfu\u00df)": "34,4 cm",
        "H\u00f6heneinstellung": "18,2 cm",
        "H\u00f6henverstellung": "Ja",
        "Integrierter USB-Hub": "Ja",
        "Kabelsperre-Slot": "Ja",
        "Kontrastverh\u00e4ltnis": "1000:1",
        "Kopfh\u00f6rer-Anschluss": "3,5 mm",
        "Kopfh\u00f6rerausgang": "Ja",
        "Kopfh\u00f6rerausg\u00e4nge": "1",
        "Low-Blue-Light-Technologie": "Ja",
        "Luftfeuchtigkeit bei Lagerung": "10 - 90%",
        "Marktpositionierung": "Business",
        "Maximale Bildwiederholrate": "60 Hz",
        "Men\u00fcsprachen": "Deutsch, Englisch, Spanisch, Franz\u00f6sisch, Italienisch, Schwedisch",
        "Mitgelieferte Kabel": "AC, USB Typ-C auf USB Typ-C",
        "Nachhaltigkeitszertifikate": "RoHS, ENERGY STAR",
        "Natives Seitenverh\u00e4ltnis": "16:10",
        "Neigungsverstellung": "Ja",
        "Neigungswinkelbereich": "-5 - 35\u00b0",
        "On-Screen-Display (OSD)": "Ja",
        "Panel": "IPS",
        "Panel-Montage-Schnittstelle": "100 x 100 mm",
        "Panel-Typ": "IPS",
        "Pivot": "Ja",
        "Pivot Winkel": "-90 - 90\u00b0",
        "Pixel Abstand": "0,27 x 0,27 mm",
        "Produktfarbe": "Schwarz",
        "RGB-Farbraum": "sRGB",
        "RMS-Leistung": "2 W",
        "Reaktionszeit": "5 ms",
        "Relative Luftfeuchtigkeit in Betrieb": "20 - 80%",
        "Schnellstart\u00fcbersicht": "Ja",
        "Schwenkbar": "Ja",
        "Schwenkwinkelbereich": "0 - 344\u00b0",
        "Sichtbare Gr\u00f6\u00dfe (diagonal)": "61,1 cm",
        "Sichtbare Gr\u00f6\u00dfe (horizontal)": "51,8 cm",
        "Sichtbare Gr\u00f6\u00dfe (vertikal)": "32,4 cm",
        "Slot-Typ Kabelsperre": "Kensington",
        "Stromverbrauch (Standardbetrieb)": "11,6 W",
        "Stromverbrauch (Standby)": "0,5 W",
        "St\u00e4nder enthalten": "Ja",
        "Temperaturbereich bei Lagerung": "-20 - 60 \u00b0C",
        "Tiefe (ohne Standfu\u00df)": "5,4 cm",
        "Touchscreen": "Nein",
        "Typ der Hintergrundbeleuchtung": "LED",
        "USB-Hub-Version": "3.2 Gen 1 (3.1 Gen 1)",
        "USB-Typ-C DisplayPort-Wechselmodus": "Ja",
        "Unterst\u00fctzte Grafik-Aufl\u00f6sungen": "640 x 480 (VGA), 720 x 400, 800 x 600 (SVGA), 1024 x 768 (XGA), 1280 x 1024 (SXGA), 1600 x 1200 (UXGA), 1680 x 1050 (WSXGA+), 1920 x 1200 (WUXGA)",
        "VESA Halterung": "100x100 mm",
        "VESA-Halterung": "Ja",
        "Video Anschl\u00fcsse": "1x HDMI, 1x DisplayPort, USB-C DisplayPort",
        "Warentarifnummer (HS)": "85285210",
        "Zertifizierung": "CE, CB, TCO 8.0, EPA Energy Star, T\u00dcV/GS, T\u00dcV Ergonomie  (ISO 9241-307), T\u00dcV/Blue Low Light Content, T\u00dcV/Flicker Free, EPEAT 2018 (US), cT\u00dcVus, T\u00dcV/S, EAC, PSE, FCC-B, CAN ICES-3 (B), RCM, VCCI-B, CCC, RoHS, China RoHS, WEEE"
    },
    "raw_specifications_text": "Displaygr\u00f6\u00dfe: 24,1 Zoll\nAufl\u00f6sung: 1920x1200\nPanel: IPS\nReaktionszeit: 5 ms\nVideo Anschl\u00fcsse: 1x HDMI, 1x DisplayPort, USB-C DisplayPort\nErgonomie: H\u00f6henverstellbar, Pivot (90 Grad drehbar), Schwenkbar, Neigbar\nVESA Halterung: 100x100 mm\nHelligkeit: 350 cd/m\u00b2\nBesonderheiten: Lichtsensor\nHersteller Artikelnummer: EV2495-BK\nEAN: 4995047056539\nArtikelnummer: M14Y0SVL\nBildschirmdiagonale: 61,2 cm (24.1 Zoll)\nDisplay-Aufl\u00f6sung: 1920 x 1200 Pixel\nNatives Seitenverh\u00e4ltnis: 16:10\nBildschirmtechnologie: LED\nTouchscreen: Nein\nHD-Typ: WUXGA\nPanel-Typ: IPS\nBildschirmform: Flach\nKontrastverh\u00e4ltnis: 1000:1\nMaximale Bildwiederholrate: 60 Hz\nAnzahl der Farben des Displays: 16,78 Millionen Farben\nTyp der Hintergrundbeleuchtung: LED\nHelligkeit (typisch): 350 cd/m\u00b2\nUnterst\u00fctzte Grafik-Aufl\u00f6sungen: 640 x 480 (VGA), 720 x 400, 800 x 600 (SVGA), 1024 x 768 (XGA), 1280 x 1024 (SXGA), 1600 x 1200 (UXGA), 1680 x 1050 (WSXGA+), 1920 x 1200 (WUXGA)\nBildwinkel, horizontal: 178\u00b0\nBildwinkel, vertikal: 178\u00b0\nPixel Abstand: 0,27 x 0,27 mm\nSichtbare Gr\u00f6\u00dfe (horizontal): 51,8 cm\nSichtbare Gr\u00f6\u00dfe (vertikal): 32,4 cm\nSichtbare Gr\u00f6\u00dfe (diagonal): 61,1 cm\nDigital horizontale Frequenz: 31 - 76 kHz\nDigital vertikale Frequenz: 59 - 61 Hz\nRGB-Farbraum: sRGB\nFlimmerfreie Technologie: Ja\nLow-Blue-Light-Technologie: Ja\nEingebaute Lautsprecher: Ja\nAnzahl der Lautsprecher: 2\nRMS-Leistung: 2 W\nMarktpositionierung: Business\nProduktfarbe: Schwarz\nZertifizierung: CE, CB, TCO 8.0, EPA Energy Star, T\u00dcV/GS, T\u00dcV Ergonomie  (ISO 9241-307), T\u00dcV/Blue Low Light Content, T\u00dcV/Flicker Free, EPEAT 2018 (US), cT\u00dcVus, T\u00dcV/S, EAC, PSE, FCC-B, CAN ICES-3 (B), RCM, VCCI-B, CCC, RoHS, China RoHS, WEEE\nIntegrierter USB-Hub: Ja\nHDMI: Ja\nKopfh\u00f6rerausgang: Ja\nUSB-Hub-Version: 3.2 Gen 1 (3.1 Gen 1)\nAnzahl der vorgeschalteten Steckpl\u00e4tze: 2\nAnzahl der nachgeschalteten Steckpl\u00e4tze vom Typ USB-A: 3\nAnzahl der nachgeschalteten Ports vom Typ USB-C: 1\nUSB-Typ-C DisplayPort-Wechselmodus: Ja\nDVI Anschluss: Nein\nAnzahl HDMI-Anschl\u00fcsse: 1\nAnzahl DisplayPort Anschl\u00fcsse: 1\nAudioanschl\u00fcsse: Ja\nKopfh\u00f6rerausg\u00e4nge: 1\nKopfh\u00f6rer-Anschluss: 3,5 mm\nHDCP: Ja\nEingebauter Ethernet-Anschluss: Ja\nVESA-Halterung: Ja\nKabelsperre-Slot: Ja\nH\u00f6henverstellung: Ja\nPanel-Montage-Schnittstelle: 100 x 100 mm\nSlot-Typ Kabelsperre: Kensington\nH\u00f6heneinstellung: 18,2 cm\nPivot: Ja\nPivot Winkel: -90 - 90\u00b0\nSchwenkbar: Ja\nSchwenkwinkelbereich: 0 - 344\u00b0\nNeigungswinkelbereich: -5 - 35\u00b0\nOn-Screen-Display (OSD): Ja\nMen\u00fcsprachen: Deutsch, Englisch, Spanisch, Franz\u00f6sisch, Italienisch, Schwedisch\nNeigungsverstellung: Ja\nEnergieeffizienzklasse (SDR): C\nEnergieverbrauch (SDR) pro 1.000 Stunden: 12 kWh\nStromverbrauch (Standardbetrieb): 11,6 W\nStromverbrauch (Standby): 0,5 W\nAC Eingangsspannung: 100 - 240 V\nAC Eingangsfrequenz: 50 - 60 Hz\nEnergieeffizienzskala: A bis G\nBetriebstemperatur: 5 - 35 \u00b0C\nTemperaturbereich bei Lagerung: -20 - 60 \u00b0C\nRelative Luftfeuchtigkeit in Betrieb: 20 - 80%\nLuftfeuchtigkeit bei Lagerung: 10 - 90%\nSt\u00e4nder enthalten: Ja\nMitgelieferte Kabel: AC, USB Typ-C auf USB Typ-C\nSchnellstart\u00fcbersicht: Ja\nGer\u00e4tebreite (inkl. Fu\u00df): 531 mm\nGer\u00e4tetiefe (inkl. Fu\u00df): 230 mm\nGer\u00e4teh\u00f6he (inkl. Fu\u00df): 356 mm\nGewicht (mit St\u00e4nder): 7,6 kg\nBreite (ohne Standfu\u00df): 53,1 cm\nTiefe (ohne Standfu\u00df): 5,4 cm\nH\u00f6he (ohne Standfu\u00df): 34,4 cm\nGewicht (ohne St\u00e4nder): 4,9 kg\nNachhaltigkeitszertifikate: RoHS, ENERGY STAR\nWarentarifnummer (HS): 85285210\nEthernet LAN Datentransferraten: 10,100,1000 Mbit/s\nAnzahl Ethernet-LAN-Anschl\u00fcsse (RJ-45): 1",
    "reference_file": "offer_reference_1796.json",
    "shop_name": "mylemon.at"
}