{
    "html_file": "offer_850_6.html",
    "name": "Samsung Odyssey G4 G4B / G40B, 25\"",
    "offer_link": "https://www.mylemon.at/artikel/samsung/ls25bg400euxen/dis-25-s25bg400eu-gaming.html",
    "price": 203.89,
    "raw_specifications": {
        "AC Eingangsspannung": "100 - 240 V",
        "AMD FreeSync": "Ja",
        "AMD FreeSync-Typ": "FreeSync Premium",
        "Anzahl DisplayPort Anschl\u00fcsse": "1",
        "Anzahl HDMI-Anschl\u00fcsse": "2",
        "Anzahl der Farben des Displays": "16,7 Millionen Farben",
        "Artikelnummer": "M1CYHUXL",
        "Aufl\u00f6sung": "1920x1080",
        "Besonderheiten": "240 Hz",
        "Betriebstemperatur": "10 - 40 \u00b0C",
        "Bildschirmdiagonale": "63,5 cm (25 Zoll)",
        "Bildschirmdiagonale (cm)": "62 cm",
        "Bildschirmform": "Flach",
        "Bildschirmtechnologie": "IPS",
        "Bildwinkel, horizontal": "178\u00b0",
        "Bildwinkel, vertikal": "178\u00b0",
        "Breite (ohne Standfu\u00df)": "55,9 cm",
        "Display-Aufl\u00f6sung": "1920 x 1080 Pixel",
        "Display-Helligkeit (mind.)": "320 cd/m\u00b2",
        "Displaygr\u00f6\u00dfe": "25 Zoll",
        "EAN": "8806094341850",
        "Eingebaute Lautsprecher": "Nein",
        "Energieeffizienzklasse (HDR)": "G",
        "Energieeffizienzklasse (SDR)": "E",
        "Energieverbrauch (HDR) pro 1.000 Stunden": "31 kWh",
        "Energieverbrauch (SDR) pro 1.000 Stunden": "18 kWh",
        "Ergonomie": "H\u00f6henverstellbar, Pivot (90 Grad drehbar), Schwenkbar, Neigbar",
        "Flimmerfreie Technologie": "Ja",
        "Ger\u00e4tebreite (inkl. Fu\u00df)": "558,5 mm",
        "Ger\u00e4teh\u00f6he (inkl. Fu\u00df)": "552,9 mm",
        "Ger\u00e4tetiefe (inkl. Fu\u00df)": "244,8 mm",
        "Gewicht (mit St\u00e4nder)": "4,5 kg",
        "Gewicht (ohne St\u00e4nder)": "2,8 kg",
        "HD-Typ": "Full HD",
        "HDMI": "Ja",
        "HDMI-Kabell\u00e4nge": "1,5 m",
        "HDMI-Version": "2.2",
        "Helligkeit": "400 cd/m\u00b2",
        "Helligkeit (typisch)": "400 cd/m\u00b2",
        "Hersteller Artikelnummer": "LS25BG400EUXEN",
        "H\u00f6he (ohne Standfu\u00df)": "34,1 cm",
        "H\u00f6heneinstellung": "12 cm",
        "H\u00f6henverstellung": "Ja",
        "Integrierte Kamera": "Nein",
        "Kabelsperre-Slot": "Nein",
        "Kontrastverh\u00e4ltnis": "1000:1",
        "Kopfh\u00f6rerausgang": "Ja",
        "Marktpositionierung": "Gaming",
        "Maximale Bildwiederholrate": "240 Hz",
        "Mitgelieferte Kabel": "HDMI",
        "NVIDIA G-SYNC": "Ja",
        "NVIDIA G-SYNC-Typ": "G-SYNC Compatible",
        "Natives Seitenverh\u00e4ltnis": "16:9",
        "Neigungsverstellung": "Ja",
        "Neigungswinkelbereich": "-3 - 22\u00b0",
        "Netzteiltyp": "Extern",
        "Paketgewicht": "6 kg",
        "Panel": "IPS",
        "Panel-Montage-Schnittstelle": "100 x 100 mm",
        "Panel-Typ": "IPS",
        "Pivot": "Ja",
        "Pivot Winkel": "-92 - 92\u00b0",
        "Produktfarbe": "Schwarz",
        "Produkttyp": "PC-Monitor",
        "RGB-Farbraum": "sRGB",
        "Reaktionszeit": "1 ms",
        "Relative Luftfeuchtigkeit in Betrieb": "10 - 80%",
        "Schwenkbar": "Ja",
        "Schwenkwinkelbereich": "-15 - 15\u00b0",
        "Spiel-Modus": "Ja",
        "Stromadapter enthalten": "Ja",
        "Stromverbrauch (Standardbetrieb)": "18 W",
        "Stromverbrauch (Standby)": "0,5 W",
        "Stromverbrauch (aus)": "0,3 W",
        "Stromverbrauch (max.)": "35 W",
        "St\u00e4nder enthalten": "Ja",
        "Tiefe (ohne Standfu\u00df)": "8,54 cm",
        "Touchscreen": "Nein",
        "Typ der Hintergrundbeleuchtung": "LED",
        "VESA Halterung": "100x100 mm",
        "VESA-Halterung": "Ja",
        "Verpackungsbreite": "628 mm",
        "Verpackungsh\u00f6he": "163 mm",
        "Verpackungstiefe": "429 mm",
        "Video Anschl\u00fcsse": "2x HDMI, 1x DisplayPort",
        "sRGB Abdeckung (klassisch)": "99%"
    },
    "raw_specifications_text": "Displaygr\u00f6\u00dfe: 25 Zoll\nAufl\u00f6sung: 1920x1080\nPanel: IPS\nReaktionszeit: 1 ms\nVideo Anschl\u00fcsse: 2x HDMI, 1x DisplayPort\nErgonomie: H\u00f6henverstellbar, Pivot (90 Grad drehbar), Schwenkbar, Neigbar\nVESA Halterung: 100x100 mm\nHelligkeit: 400 cd/m\u00b2\nBesonderheiten: 240 Hz\nHersteller Artikelnummer: LS25BG400EUXEN\nEAN: 8806094341850\nArtikelnummer: M1CYHUXL\nBildschirmdiagonale: 63,5 cm (25 Zoll)\nDisplay-Aufl\u00f6sung: 1920 x 1080 Pixel\nNatives Seitenverh\u00e4ltnis: 16:9\nBildschirmtechnologie: IPS\nTouchscreen: Nein\nHD-Typ: Full HD\nPanel-Typ: IPS\nBildschirmform: Flach\nKontrastverh\u00e4ltnis: 1000:1\nMaximale Bildwiederholrate: 240 Hz\nAnzahl der Farben des Displays: 16,7 Millionen Farben\nTyp der Hintergrundbeleuchtung: LED\nHelligkeit (typisch): 400 cd/m\u00b2\nBildwinkel, horizontal: 178\u00b0\nBildwinkel, vertikal: 178\u00b0\nBildschirmdiagonale (cm): 62 cm\nRGB-Farbraum: sRGB\nsRGB Abdeckung (klassisch): 99%\nDisplay-Helligkeit (mind.): 320 cd/m\u00b2\nProdukttyp: PC-Monitor\nNVIDIA G-SYNC: Ja\nAMD FreeSync: Ja\nNVIDIA G-SYNC-Typ: G-SYNC Compatible\nAMD FreeSync-Typ: FreeSync Premium\nFlimmerfreie Technologie: Ja\nSpiel-Modus: Ja\nEingebaute Lautsprecher: Nein\nIntegrierte Kamera: Nein\nMarktpositionierung: Gaming\nProduktfarbe: Schwarz\nHDMI: Ja\nKopfh\u00f6rerausgang: Ja\nAnzahl HDMI-Anschl\u00fcsse: 2\nHDMI-Version: 2.2\nAnzahl DisplayPort Anschl\u00fcsse: 1\nVESA-Halterung: Ja\nKabelsperre-Slot: Nein\nH\u00f6henverstellung: Ja\nPanel-Montage-Schnittstelle: 100 x 100 mm\nH\u00f6heneinstellung: 12 cm\nPivot: Ja\nPivot Winkel: -92 - 92\u00b0\nSchwenkbar: Ja\nSchwenkwinkelbereich: -15 - 15\u00b0\nNeigungswinkelbereich: -3 - 22\u00b0\nNeigungsverstellung: Ja\nEnergieeffizienzklasse (SDR): E\nEnergieeffizienzklasse (HDR): G\nEnergieverbrauch (SDR) pro 1.000 Stunden: 18 kWh\nEnergieverbrauch (HDR) pro 1.000 Stunden: 31 kWh\nStromverbrauch (Standardbetrieb): 18 W\nStromverbrauch (Standby): 0,5 W\nStromverbrauch (max.): 35 W\nStromverbrauch (aus): 0,3 W\nAC Eingangsspannung: 100 - 240 V\nNetzteiltyp: Extern\nBetriebstemperatur: 10 - 40 \u00b0C\nRelative Luftfeuchtigkeit in Betrieb: 10 - 80%\nSt\u00e4nder enthalten: Ja\nMitgelieferte Kabel: HDMI\nStromadapter enthalten: Ja\nHDMI-Kabell\u00e4nge: 1,5 m\nGer\u00e4tebreite (inkl. Fu\u00df): 558,5 mm\nGer\u00e4tetiefe (inkl. Fu\u00df): 244,8 mm\nGer\u00e4teh\u00f6he (inkl. Fu\u00df): 552,9 mm\nGewicht (mit St\u00e4nder): 4,5 kg\nBreite (ohne Standfu\u00df): 55,9 cm\nTiefe (ohne Standfu\u00df): 8,54 cm\nH\u00f6he (ohne Standfu\u00df): 34,1 cm\nGewicht (ohne St\u00e4nder): 2,8 kg\nVerpackungsbreite: 628 mm\nVerpackungstiefe: 429 mm\nVerpackungsh\u00f6he: 163 mm\nPaketgewicht: 6 kg",
    "reference_file": "offer_reference_850.json",
    "shop_name": "mylemon.at"
}