{
    "html_file": "offer_462_22.html",
    "name": "iiyama G-Master GB2470HSU-B5 Red Eagle, 23.8\"",
    "offer_link": "https://www.proshop.at/Bildschirm/iiyama-24-Bildschirm-G-MASTER-Red-Eagle-GB2470HSU-B5-LED-monitor-Full-HD-1080p-24-Black-1-ms-AMD-FreeSync-Premium/3152731?utm_source=geizhals&utm_medium=cpc&utm_campaign=pricesite",
    "price": 177.62,
    "raw_specifications": {
        "Abmessungen (Breite x Tiefe x H\u00f6he)": "53.95 cm x 21 cm x 38.5 cm",
        "Adaptive-Sync Technologie": "AMD FreeSync Premium",
        "Ausgangsleistung/Kanal": "2 Watt",
        "Besonderheiten": "HDCP, Eco-Mode, Spielmodus, Advanced Contrast Ratio (ACR), X-Res Technology, flimmerfreie Technologie, i-Style Color, IGZO-Technologie, Black Tuner, Gamma-Modus, 6-Axis Color Adjustments, Blue Light Reducer Function, kompatibel mit Mac",
        "Bildschirmbeschichtung": "Matt",
        "Bildschirmtyp": "Fast IPS",
        "Diagonalabmessung": "61 cm (24\")",
        "Display-Typ": "LED-hintergrundbeleuchteter LCD-Monitor / TFT-Aktivmatrix",
        "EAN": "4948570121397",
        "Eingangsanschl\u00fcsse": "HDMI, DisplayPort",
        "Eingangsspannung": "Wechselstrom 100-240 V (50/60 Hz)",
        "Einstellungen der Anzeigeposition": "H\u00f6he, Pivot (Rotation), Neigung",
        "Energie Effizienzklasse": "Klasse E",
        "Enthaltene Kabel": "1 x USB-Kabel  1 x HDMI-Kabel  1 x DisplayPort-Kabel",
        "Farbe": "Mattschwarz",
        "Farbunterst\u00fctzung": "16,7 Millionen Farben (8-Bit)",
        "Ger\u00e4tetyp": "LED-hintergrundbeleuchteter LCD-Monitor - 61 cm (24\")",
        "Gewicht": "4.5 kg",
        "Helligkeit": "250 cd/m\u00b2",
        "Hersteller": "iiyama",
        "Hintergrundbeleuchtungs-Technologie": "LED-Hintergrundbeleuchtung",
        "Horizontale Bildwiederholrate": "15 - 195 kHz",
        "Horizontaler Betrachtungswinkel": "+89 / -89",
        "H\u00f6heneinstellung": "150 mm",
        "Integrierte Peripherieger\u00e4te": "USB 3.0-Hub",
        "Kennzeichnung": "VCCI, DDC-2B, RoHS, WEEE, PSE Mark, REACH, TUV Bauart, ERP, EAC, REACH SvHC",
        "Kontrast": "1100:1 / 80000000:1 (dynamisch)",
        "Leistungsmerkmale": "Slot f\u00fcr Sicherheitsschloss (Kabelschloss getrennt erh\u00e4ltlich), integrierte Kabelf\u00fchrung, Unterst\u00fctzung f\u00fcr VESA-Schnittstelle",
        "Modell": "GB2470HSU-B5",
        "Native Aufl\u00f6sung": "Full HD (1080p) 1920 x 1080 (DisplayPort: 165 Hz, HDMI: 144 Hz)",
        "Neigungswinkel": "-5/+23",
        "OSD-Sprachen": "Tschechisch, Englisch, Deutsch, Franz\u00f6sisch, Italienisch, Portugiesisch, Polnisch, Russisch, Spanisch, Holl\u00e4ndisch, Japanisch",
        "Pixelpitch": "0.275 mm",
        "Produktbeschreibung": "iiyama G-MASTER Red Eagle GB2470HSU-B5 - LED-Monitor - Full HD (1080p) - 61 cm (24\")",
        "Reaktionszeit": "0,8 ms (MPRT)",
        "Rotationswinkel": "90",
        "Schlosstyp zur Diebstahlsicherung": "Kensington Slot",
        "Schnittstellen": "DisplayPort 1.2  HDMI 1.4  2 x USB 2.0  Kopfh\u00f6rer",
        "Seitenverh\u00e4ltnis": "16:9",
        "Spannung": "Wechselstrom 100-240 V (50/60 Hz)",
        "Stromverbrauch (Aus-Modus)": "0.3 Watt",
        "Stromverbrauch (typisch)": "20 Watt",
        "Stromverbrauch SDR (eingeschaltet)": "19 kWh/1.000 h",
        "Stromverbrauch im Standby-Modus": "0.5 Watt",
        "Transportbreite": "61 cm",
        "Transportgewicht": "6 kg",
        "Transporth\u00f6he": "39.8 cm",
        "Transporttiefe": "17 cm",
        "Typ": "Lautsprecher - Stereo",
        "VESA-Halterung": "100 x 100 mm",
        "Vertikaler Betrachtungswinkel": "+89 / -89",
        "Waren-Nr.": "3152731",
        "Zum Hersteller": "www.iiyama.com"
    },
    "raw_specifications_text": "Hersteller: iiyama\nWaren-Nr.: 3152731\nModell: GB2470HSU-B5\nEAN: 4948570121397\nZum Hersteller: www.iiyama.com\nProduktbeschreibung: iiyama G-MASTER Red Eagle GB2470HSU-B5 - LED-Monitor - Full HD (1080p) - 61 cm (24\")\nGer\u00e4tetyp: LED-hintergrundbeleuchteter LCD-Monitor - 61 cm (24\")\nEnergie Effizienzklasse: Klasse E\nAdaptive-Sync Technologie: AMD FreeSync Premium\nLeistungsmerkmale: Slot f\u00fcr Sicherheitsschloss (Kabelschloss getrennt erh\u00e4ltlich), integrierte Kabelf\u00fchrung, Unterst\u00fctzung f\u00fcr VESA-Schnittstelle\nBildschirmtyp: Fast IPS\nSeitenverh\u00e4ltnis: 16:9\nNative Aufl\u00f6sung: Full HD (1080p) 1920 x 1080 (DisplayPort: 165 Hz, HDMI: 144 Hz)\nPixelpitch: 0.275 mm\nHelligkeit: 250 cd/m\u00b2\nKontrast: 1100:1 / 80000000:1 (dynamisch)\nReaktionszeit: 0,8 ms (MPRT)\nFarbunterst\u00fctzung: 16,7 Millionen Farben (8-Bit)\nEingangsanschl\u00fcsse: HDMI, DisplayPort\nEinstellungen der Anzeigeposition: H\u00f6he, Pivot (Rotation), Neigung\nBildschirmbeschichtung: Matt\nSpannung: Wechselstrom 100-240 V (50/60 Hz)\nFarbe: Mattschwarz\nAbmessungen (Breite x Tiefe x H\u00f6he): 53.95 cm x 21 cm x 38.5 cm\nGewicht: 4.5 kg\nKennzeichnung: VCCI, DDC-2B, RoHS, WEEE, PSE Mark, REACH, TUV Bauart, ERP, EAC, REACH SvHC\nDisplay-Typ: LED-hintergrundbeleuchteter LCD-Monitor / TFT-Aktivmatrix\nDiagonalabmessung: 61 cm (24\")\nIntegrierte Peripherieger\u00e4te: USB 3.0-Hub\nHorizontale Bildwiederholrate: 15 - 195 kHz\nHorizontaler Betrachtungswinkel: +89 / -89\nVertikaler Betrachtungswinkel: +89 / -89\nHintergrundbeleuchtungs-Technologie: LED-Hintergrundbeleuchtung\nOSD-Sprachen: Tschechisch, Englisch, Deutsch, Franz\u00f6sisch, Italienisch, Portugiesisch, Polnisch, Russisch, Spanisch, Holl\u00e4ndisch, Japanisch\nBesonderheiten: HDCP, Eco-Mode, Spielmodus, Advanced Contrast Ratio (ACR), X-Res Technology, flimmerfreie Technologie, i-Style Color, IGZO-Technologie, Black Tuner, Gamma-Modus, 6-Axis Color Adjustments, Blue Light Reducer Function, kompatibel mit Mac\nTyp: Lautsprecher - Stereo\nAusgangsleistung/Kanal: 2 Watt\nSchnittstellen: DisplayPort 1.2  HDMI 1.4  2 x USB 2.0  Kopfh\u00f6rer\nNeigungswinkel: -5/+23\nRotationswinkel: 90\nH\u00f6heneinstellung: 150 mm\nVESA-Halterung: 100 x 100 mm\nEnthaltene Kabel: 1 x USB-Kabel  1 x HDMI-Kabel  1 x DisplayPort-Kabel\nSchlosstyp zur Diebstahlsicherung: Kensington Slot\nEingangsspannung: Wechselstrom 100-240 V (50/60 Hz)\nStromverbrauch SDR (eingeschaltet): 19 kWh/1.000 h\nStromverbrauch (typisch): 20 Watt\nStromverbrauch im Standby-Modus: 0.5 Watt\nStromverbrauch (Aus-Modus): 0.3 Watt\nTransportbreite: 61 cm\nTransporttiefe: 17 cm\nTransporth\u00f6he: 39.8 cm\nTransportgewicht: 6 kg",
    "reference_file": "offer_reference_462.json",
    "shop_name": "Proshop.at"
}