{
    "html_file": "offer_2404_6.html",
    "name": "Fujitsu P-Line P27-8 TS UHD LED, 27\"",
    "offer_link": "https://direkt.jacob.de/produkte/fujitsu-p27-8-ts-s26361-k1610-v160-artnr-3644356.html?utm_source=geizhals&utm_medium=cpc&utm_campaign=Preisvergleich&ref=103",
    "price": 667.98,
    "raw_specifications": {
        "Abmessungen (Breite x Tiefe x H\u00f6he)": "61.3 cm x 22.7 cm x 39.6 cm - mit Fu\u00df",
        "Abmessungen (Breite x Tiefe x H\u00f6he) - mit Fu\u00df": "61.3 cm x 22.7 cm x 39.6 cm",
        "Ausgangsleistung/Kanal": "2 Watt",
        "Besonderheiten": "Touch-Tasten, Auto Brightness Control, ECO-Taste, DisplayView, DICOM-kalibriert, 77% NTSC-Farbskala (CIE 1931), 100% sRGB-Farbskala, Auto Pivot, Workplace Lighting Guide, Anwesenheitssensor",
        "Bildschirmbeschichtung": "Blendfrei, 3H Hard Coating",
        "Bildschirmtyp": "IPS",
        "Details zu Abmessungen & Gewicht": "Mit Fu\u00df - Breite: 61.3 cm - Tiefe: 22.7 cm - H\u00f6he: 39.6 cm - Gewicht: 7.81 kg  Ohne Fu\u00df - Breite: 61.3 cm - Tiefe: 5.7 cm - H\u00f6he: 36.4 cm - Gewicht: 4.83 kg",
        "Diagonalabmessung": "68.5 cm (27\")",
        "Display-Typ": "LED-hintergrundbeleuchteter LCD-Monitor / TFT-Aktivmatrix",
        "ENERGY STAR zertifiziert": "Ja",
        "Eingangsanschl\u00fcsse": "2xHDMI, DisplayPort, Mini DisplayPort",
        "Einstellungen der Anzeigeposition": "H\u00f6he, Pivot (Rotation), Drehelement, neigbar",
        "Energie Effizienzklasse": "G",
        "Energierverbrauch Sleep": "0.3 Watt",
        "Energierverbrauch Standby": "0.4 Watt",
        "Energieverbrauch pro Jahr": "52 kWh",
        "Enthaltene Kabel": "1 x DisplayPort-Kabel - 1.8 m  1 x HDMI-Kabel - 1.8 m  1 x USB-Kabel - USB Typ A auf B - 1.8 m",
        "Erforderliche Netzspannung": "Wechselstrom 120/230 V (50/60 Hz)",
        "Farbe": "Matt Black",
        "Farbtemperatur": "5000K, 6500K, 7500K",
        "Farbunterst\u00fctzung": "1,07 Mrd. Farben",
        "Ger\u00e4tetyp": "LED-hintergrundbeleuchteter LCD-Monitor - 68.5 cm (27\") 68.5 cm (27\")",
        "Gewicht": "7.81 kg",
        "Helligkeit": "350 cd/m\u00b2",
        "Hintergrundbeleuchtungs-Technologie": "LED-Hintergrundbeleuchtung",
        "Horizontale Bildwiederholrate": "15.6 - 135 kHz",
        "Horizontaler Betrachtungswinkel": "178",
        "H\u00f6heneinstellung": "130 mm",
        "Integrierte Peripherieger\u00e4te": "USB 3.1 Gen.1 Hub",
        "Kennzeichnung": "FCC Klasse B bescheinigt, TUV GS, cUL, EN 60950, SASO, DDC/CI, RoHS, WEEE, KC, Directive 2004/108/EEC, EAC, VESA MIS-D 100 C, TUV Rheinland Low Blue Light Certification, TCO Displays 7.0, TUV Rheinland Flicker Free Certification, ISO 9241-307 Class 1",
        "Kontrast": "1300:1 / 20000000:1 (dynamisch)",
        "Leistungsaufnahme im Betrieb": "37.5 Watt",
        "Leistungsaufnahme im Ein-Zustand": "35 W",
        "Leistungsmerkmale": "Slot f\u00fcr Sicherheitsschloss (Kabelschloss getrennt erh\u00e4ltlich), Kabelf\u00fchrung",
        "Lokalisierung": "Europa",
        "Max. Betriebstemperatur": "35 \u00b0C",
        "Min Betriebstemperatur": "5 \u00b0C",
        "Native Aufl\u00f6sung": "4K UHD (2160p) 3840 x 2160",
        "Neigungswinkel": "-5/+35",
        "OSD-Sprachen": "D\u00e4nisch, Tschechisch, Chinesisch (tradionell), Chinesisch (vereinfacht), Englisch, Deutsch, Franz\u00f6sisch, Italienisch, Norwegisch, Portugiesisch, Polnisch, Finnisch, Schwedisch, Russisch, Spanisch, Holl\u00e4ndisch, T\u00fcrkisch, Arabisch, Japanisch",
        "Pixelpitch": "0.155 mm",
        "Produktbeschreibung": "Fujitsu P27-8 TS UHD - LED-Monitor - 68.5 cm (27\") 68.5 cm (27\")",
        "Reaktionszeit": "5 ms",
        "Rotationswinkel": "90",
        "Schnittstelle f\u00fcr Flachbildschirmbefestigung": "100 x 100 mm",
        "Schnittstellen": "DisplayPort (DisplayPort 1.2 Modus)  Mini DisplayPort  2 x HDMI  4 x USB 3.1 Downstream  USB 3.1 Upstream  Kopfh\u00f6rer",
        "Schwenkwinkel": "340",
        "Seitenverh\u00e4ltnis": "Breitbild - 16:9",
        "Typ": "Lautsprecher - Stereo",
        "Umweltschutzstandards": "ENERGY STAR-qualifiziert",
        "Vertikale Bildwiederholrate": "29 - 76 Hz",
        "Vertikaler Betrachtungswinkel": "178",
        "Zubeh\u00f6r im Lieferumfang": "Aufstellung",
        "Zul\u00e4ssige Luftfeuchtigkeit im Betrieb": "10 ? 85% (nicht kondensierend)"
    },
    "raw_specifications_text": "Produktbeschreibung: Fujitsu P27-8 TS UHD - LED-Monitor - 68.5 cm (27\") 68.5 cm (27\")\nGer\u00e4tetyp: LED-hintergrundbeleuchteter LCD-Monitor - 68.5 cm (27\") 68.5 cm (27\")\nEnergie Effizienzklasse: G\nEnergieverbrauch pro Jahr: 52 kWh\nLeistungsaufnahme im Ein-Zustand: 35 W\nLeistungsmerkmale: Slot f\u00fcr Sicherheitsschloss (Kabelschloss getrennt erh\u00e4ltlich), Kabelf\u00fchrung\nBildschirmtyp: IPS\nSeitenverh\u00e4ltnis: Breitbild - 16:9\nNative Aufl\u00f6sung: 4K UHD (2160p) 3840 x 2160\nPixelpitch: 0.155 mm\nHelligkeit: 350 cd/m\u00b2\nKontrast: 1300:1 / 20000000:1 (dynamisch)\nReaktionszeit: 5 ms\nFarbunterst\u00fctzung: 1,07 Mrd. Farben\nEingangsanschl\u00fcsse: 2xHDMI, DisplayPort, Mini DisplayPort\nEinstellungen der Anzeigeposition: H\u00f6he, Pivot (Rotation), Drehelement, neigbar\nBildschirmbeschichtung: Blendfrei, 3H Hard Coating\nFarbe: Matt Black\nAbmessungen (Breite x Tiefe x H\u00f6he) - mit Fu\u00df: 61.3 cm x 22.7 cm x 39.6 cm\nGewicht: 7.81 kg\nLokalisierung: Europa\nUmweltschutzstandards: ENERGY STAR-qualifiziert\nKennzeichnung: FCC Klasse B bescheinigt, TUV GS, cUL, EN 60950, SASO, DDC/CI, RoHS, WEEE, KC, Directive 2004/108/EEC, EAC, VESA MIS-D 100 C, TUV Rheinland Low Blue Light Certification, TCO Displays 7.0, TUV Rheinland Flicker Free Certification, ISO 9241-307 Class 1\nDisplay-Typ: LED-hintergrundbeleuchteter LCD-Monitor / TFT-Aktivmatrix\nDiagonalabmessung: 68.5 cm (27\")\nIntegrierte Peripherieger\u00e4te: USB 3.1 Gen.1 Hub\nVertikale Bildwiederholrate: 29 - 76 Hz\nHorizontale Bildwiederholrate: 15.6 - 135 kHz\nHorizontaler Betrachtungswinkel: 178\nVertikaler Betrachtungswinkel: 178\nHintergrundbeleuchtungs-Technologie: LED-Hintergrundbeleuchtung\nFarbtemperatur: 5000K, 6500K, 7500K\nOSD-Sprachen: D\u00e4nisch, Tschechisch, Chinesisch (tradionell), Chinesisch (vereinfacht), Englisch, Deutsch, Franz\u00f6sisch, Italienisch, Norwegisch, Portugiesisch, Polnisch, Finnisch, Schwedisch, Russisch, Spanisch, Holl\u00e4ndisch, T\u00fcrkisch, Arabisch, Japanisch\nBesonderheiten: Touch-Tasten, Auto Brightness Control, ECO-Taste, DisplayView, DICOM-kalibriert, 77% NTSC-Farbskala (CIE 1931), 100% sRGB-Farbskala, Auto Pivot, Workplace Lighting Guide, Anwesenheitssensor\nAbmessungen (Breite x Tiefe x H\u00f6he): 61.3 cm x 22.7 cm x 39.6 cm - mit Fu\u00df\nTyp: Lautsprecher - Stereo\nAusgangsleistung/Kanal: 2 Watt\nSchnittstellen: DisplayPort (DisplayPort 1.2 Modus)  Mini DisplayPort  2 x HDMI  4 x USB 3.1 Downstream  USB 3.1 Upstream  Kopfh\u00f6rer\nNeigungswinkel: -5/+35\nSchwenkwinkel: 340\nRotationswinkel: 90\nH\u00f6heneinstellung: 130 mm\nSchnittstelle f\u00fcr Flachbildschirmbefestigung: 100 x 100 mm\nZubeh\u00f6r im Lieferumfang: Aufstellung\nEnthaltene Kabel: 1 x DisplayPort-Kabel - 1.8 m  1 x HDMI-Kabel - 1.8 m  1 x USB-Kabel - USB Typ A auf B - 1.8 m\nErforderliche Netzspannung: Wechselstrom 120/230 V (50/60 Hz)\nLeistungsaufnahme im Betrieb: 37.5 Watt\nEnergierverbrauch Standby: 0.4 Watt\nEnergierverbrauch Sleep: 0.3 Watt\nDetails zu Abmessungen & Gewicht: Mit Fu\u00df - Breite: 61.3 cm - Tiefe: 22.7 cm - H\u00f6he: 39.6 cm - Gewicht: 7.81 kg  Ohne Fu\u00df - Breite: 61.3 cm - Tiefe: 5.7 cm - H\u00f6he: 36.4 cm - Gewicht: 4.83 kg\nENERGY STAR zertifiziert: Ja\nMin Betriebstemperatur: 5 \u00b0C\nMax. Betriebstemperatur: 35 \u00b0C\nZul\u00e4ssige Luftfeuchtigkeit im Betrieb: 10 ? 85% (nicht kondensierend)",
    "reference_file": "offer_reference_2404.json",
    "shop_name": "Jacob Elektronik direkt (AT)"
}