{
    "html_file": "offer_1782_22.html",
    "name": "Philips Gaming-Monitor E-line 242E1GAJ, 23.8\"",
    "offer_link": "https://syswork.at/sw/index.html?open&mid=Artikel&artid=mon-1340&from=geizhals.at",
    "price": 178.0,
    "raw_specifications": {
        "AC Eingangsfrequenz": "50/60 Hz",
        "AC Eingangsspannung": "100 - 240 V",
        "AMD FreeSync": "Ja",
        "AMD FreeSync-Typ": "FreeSync Premium",
        "Abnehmbarer Standfu\u00df": "Ja",
        "Anzahl DisplayPort Anschl\u00fcsse": "1",
        "Anzahl HDMI-Anschl\u00fcsse": "1",
        "Anzahl OSD-Sprachen": "21",
        "Anzahl der Farben des Displays": "16,7 Millionen Farben",
        "Anzahl der Lautsprecher": "2",
        "Audioausgang": "Ja",
        "Au\u00dfenverkleidungstyp": "Texturiert",
        "Beh\u00f6rdliche Zulassung": "CB; TUV/ISO9241-307; TUV-BAUART; CU-EAC; EAEU RoHS; MEPS; RCM; PSB; CE Mark",
        "Betriebsanleitung": "Ja",
        "Betriebstemperatur": "0 - 40 \u00b0C",
        "Bild-Verbesserung": "SmartImage game",
        "Bildschirmdiagonale": "60,5 cm (23.8 Zoll)",
        "Bildschirmdiagonale (cm)": "60,5 cm",
        "Bildschirmform": "Flach",
        "Bildschirmtechnologie": "LCD",
        "Bildwinkel, horizontal": "178\u00b0",
        "Bildwinkel, vertikal": "178\u00b0",
        "Blendfreier Bildschirm": "Ja",
        "Breite (ohne Standfu\u00df)": "54 cm",
        "DDC/CI": "Ja",
        "DVI Anschluss": "Nein",
        "Datenblatt": "Kein Datenblatt verf\u00fcgbar",
        "Digital horizontale Frequenz": "30 - 160 kHz",
        "Digital vertikale Frequenz": "48 - 144 Hz",
        "Display-Aufl\u00f6sung": "1920 x 1080 Pixel",
        "Display-Oberfl\u00e4che": "Matt",
        "Dynamisches Kontrastverh\u00e4ltnis Marketingbezeichnung": "Mega-Kontrast",
        "Einfach zu lesen Modus": "Ja",
        "Eingebaute Lautsprecher": "Ja",
        "Energieeffizienzklasse (SDR)": "E",
        "Energieeffizienzskala": "A+++ bis D",
        "Energieverbrauch (SDR) pro 1.000 Stunden": "17 kWh",
        "Enth\u00e4lt nicht": "Quecksilber, PVC/BFR",
        "Farbskala": "96,1%",
        "Flimmerfreie Technologie": "Ja",
        "Fu\u00dffarbe": "Schwarz",
        "Ger\u00e4tebreite (inkl. Fu\u00df)": "540 mm",
        "Ger\u00e4teh\u00f6he (inkl. Fu\u00df)": "414 mm",
        "Ger\u00e4tetiefe (inkl. Fu\u00df)": "207 mm",
        "Gewicht (mit St\u00e4nder)": "3,07 kg",
        "Gewicht (ohne St\u00e4nder)": "2,49 kg",
        "Gleichstrom-Anschluss (DC)": "Ja",
        "HD-Typ": "Full HD",
        "HDCP": "Ja",
        "HDMI": "Ja",
        "Helligkeit (typisch)": "350 cd/m\u00b2",
        "Herstellerlink": "Philips",
        "Horizontaler Scanbereich": "30 - 160 kHz",
        "H\u00f6he (ohne Standfu\u00df)": "32,5 cm",
        "H\u00f6he bei Betrieb": "0 - 3658 m",
        "H\u00f6he bei Lagerung": "0 - 12192 m",
        "H\u00f6henverstellung": "Nein",
        "Integrierte Kamera": "Nein",
        "Integrierter USB-Hub": "Nein",
        "Kabelsperre-Slot": "Ja",
        "Komponentenvideo-Synchronisation": "Separate sync",
        "Kontrastverh\u00e4ltnis": "3500:1",
        "LED-Anzeigen": "T\u00e4tigkeit, Stand-by",
        "Low-Blue-Light-Technologie": "Ja",
        "LowBlue-Modus": "Ja",
        "Marktpositionierung": "Gaming",
        "Maximale Bildwiederholrate": "144 Hz",
        "Men\u00fcsprachen": "Vereinfachtes Chinesisch, Traditionelles Chinesisch, Tschechisch, Deutsch, Niederl\u00e4ndisch, Englisch, Spanisch, Finnisch, Franz\u00f6sisch, Griechisch, Ungarisch, Italienisch, Japanisch, Koreanisch, Polnisch, Portugiesisch, Russisch, Schwedisch, T\u00fcrkisch, Ukrainisch",
        "Mitgelieferte Kabel": "DisplayPort, HDMI, AC",
        "Mittlere Betriebsdauer zwischen Ausf\u00e4llen (MTBF)": "50000 h",
        "NTSC Abdeckung (typisch)": "96,1%",
        "NVIDIA G-SYNC": "Nein",
        "Nachhaltigkeitszertifikate": "ENERGY STAR, RoHS",
        "Natives Seitenverh\u00e4ltnis": "16:9",
        "Neigungsverstellung": "Ja",
        "Neigungswinkelbereich": "-5 - 20\u00b0",
        "Netzteiltyp": "Extern",
        "Oberfl\u00e4chenh\u00e4rte": "3H",
        "On-Screen-Display (OSD)": "Ja",
        "PC Audio-Eingang": "Ja",
        "Paketgewicht": "4,83 kg",
        "Panel-Montage-Schnittstelle": "100 x 100 mm",
        "Panel-Typ": "VA",
        "Pixel Abstand": "0,2745 x 0,2745 mm",
        "Pixeldichte": "93 ppi",
        "Plug & Play": "Ja",
        "Produktfarbe": "Schwarz, Chrom",
        "Produktlink": "Link",
        "RGB-Farbraum": "sRGB",
        "RMS-Leistung": "3 W",
        "Rahmenloses Design": "Ja",
        "Reaktionszeit": "4 ms",
        "Reaktionszeit (schnell)": "1 ms",
        "Recycelbares Verpackungsmaterial": "100%",
        "Relative Luftfeuchtigkeit in Betrieb": "20 - 80%",
        "Schwermetallfrei": "Hg (Quecksilber), Pb (Blei)",
        "Seitenverh\u00e4ltnis": "4:3, 16:9",
        "Sichtbare Gr\u00f6\u00dfe (horizontal)": "52,7 cm",
        "Sichtbare Gr\u00f6\u00dfe (vertikal)": "29,6 cm",
        "Slot-Typ Kabelsperre": "Kensington",
        "Stromverbrauch (Standardbetrieb)": "14,83 W",
        "Stromverbrauch (Standby)": "0,5 W",
        "Stromverbrauch (aus)": "0,3 W",
        "Stromverbrauch (durchschnittl.)": "14,83 W",
        "St\u00e4nder enthalten": "Ja",
        "Temperaturbereich bei Lagerung": "-20 - 60 \u00b0C",
        "Tiefe (ohne Standfu\u00df)": "4,3 cm",
        "Touchscreen": "Nein",
        "Tr\u00fcbungsrate": "25%",
        "Typ der Hintergrundbeleuchtung": "W-LED",
        "Unterst\u00fctzte Grafik-Aufl\u00f6sungen": "1920 x 1080 (HD 1080)",
        "Unterst\u00fctzte Video-Modi": "1080p",
        "VESA-Halterung": "Ja",
        "Verpackungsart": "Box",
        "Verpackungsbreite": "586 mm",
        "Verpackungsh\u00f6he": "476 mm",
        "Verpackungstiefe": "148 mm",
        "Vertikaler Scanbereich": "48 - 144 Hz",
        "Vorderer Rahmen": "Schwarz",
        "Warentarifnummer (HS)": "85285210",
        "Zertifizierung": "CB, TUV/ISO9241-307, TUV-BAUART, CU-EAC, EAEU RoHS, MEPS, RCM, PSB, CE Mark",
        "sRGB": "Ja",
        "sRGB Abdeckung (klassisch)": "125,9%"
    },
    "raw_specifications_text": "Bildschirmdiagonale: 60,5 cm (23.8 Zoll)\nDisplay-Aufl\u00f6sung: 1920 x 1080 Pixel\nNatives Seitenverh\u00e4ltnis: 16:9\nBildschirmtechnologie: LCD\nTouchscreen: Nein\nHD-Typ: Full HD\nPanel-Typ: VA\nBildschirmform: Flach\nKontrastverh\u00e4ltnis: 3500:1\nMaximale Bildwiederholrate: 144 Hz\nAnzahl der Farben des Displays: 16,7 Millionen Farben\nTyp der Hintergrundbeleuchtung: W-LED\nHelligkeit (typisch): 350 cd/m\u00b2\nReaktionszeit: 4 ms\nDisplay-Oberfl\u00e4che: Matt\nBlendfreier Bildschirm: Ja\nUnterst\u00fctzte Grafik-Aufl\u00f6sungen: 1920 x 1080 (HD 1080)\nUnterst\u00fctzte Video-Modi: 1080p\nSeitenverh\u00e4ltnis: 4:3, 16:9\nDynamisches Kontrastverh\u00e4ltnis Marketingbezeichnung: Mega-Kontrast\nBildwinkel, horizontal: 178\u00b0\nBildwinkel, vertikal: 178\u00b0\nReaktionszeit (schnell): 1 ms\nPixel Abstand: 0,2745 x 0,2745 mm\nPixeldichte: 93 ppi\nHorizontaler Scanbereich: 30 - 160 kHz\nVertikaler Scanbereich: 48 - 144 Hz\nSichtbare Gr\u00f6\u00dfe (horizontal): 52,7 cm\nSichtbare Gr\u00f6\u00dfe (vertikal): 29,6 cm\nDigital horizontale Frequenz: 30 - 160 kHz\nDigital vertikale Frequenz: 48 - 144 Hz\nBildschirmdiagonale (cm): 60,5 cm\nDDC/CI: Ja\nTr\u00fcbungsrate: 25%\nOberfl\u00e4chenh\u00e4rte: 3H\nRGB-Farbraum: sRGB\nFarbskala: 96,1%\nsRGB Abdeckung (klassisch): 125,9%\nNTSC Abdeckung (typisch): 96,1%\nsRGB: Ja\nNVIDIA G-SYNC: Nein\nAMD FreeSync: Ja\nAMD FreeSync-Typ: FreeSync Premium\nKomponentenvideo-Synchronisation: Separate sync\nFlimmerfreie Technologie: Ja\nLow-Blue-Light-Technologie: Ja\nEingebaute Lautsprecher: Ja\nIntegrierte Kamera: Nein\nAnzahl der Lautsprecher: 2\nRMS-Leistung: 3 W\nMarktpositionierung: Gaming\nProduktfarbe: Schwarz, Chrom\nRahmenloses Design: Ja\nVorderer Rahmen: Schwarz\nAbnehmbarer Standfu\u00df: Ja\nFu\u00dffarbe: Schwarz\nSchwermetallfrei: Hg (Quecksilber), Pb (Blei)\nZertifizierung: CB, TUV/ISO9241-307, TUV-BAUART, CU-EAC, EAEU RoHS, MEPS, RCM, PSB, CE Mark\nIntegrierter USB-Hub: Nein\nHDMI: Ja\nDVI Anschluss: Nein\nAnzahl HDMI-Anschl\u00fcsse: 1\nAnzahl DisplayPort Anschl\u00fcsse: 1\nAudioausgang: Ja\nPC Audio-Eingang: Ja\nHDCP: Ja\nGleichstrom-Anschluss (DC): Ja\nVESA-Halterung: Ja\nKabelsperre-Slot: Ja\nH\u00f6henverstellung: Nein\nPanel-Montage-Schnittstelle: 100 x 100 mm\nSlot-Typ Kabelsperre: Kensington\nNeigungswinkelbereich: -5 - 20\u00b0\nOn-Screen-Display (OSD): Ja\nMen\u00fcsprachen: Vereinfachtes Chinesisch, Traditionelles Chinesisch, Tschechisch, Deutsch, Niederl\u00e4ndisch, Englisch, Spanisch, Finnisch, Franz\u00f6sisch, Griechisch, Ungarisch, Italienisch, Japanisch, Koreanisch, Polnisch, Portugiesisch, Russisch, Schwedisch, T\u00fcrkisch, Ukrainisch\nAnzahl OSD-Sprachen: 21\nPlug & Play: Ja\nLED-Anzeigen: T\u00e4tigkeit, Stand-by\nNeigungsverstellung: Ja\nEnergieeffizienzklasse (SDR): E\nEnergieverbrauch (SDR) pro 1.000 Stunden: 17 kWh\nStromverbrauch (Standardbetrieb): 14,83 W\nStromverbrauch (Standby): 0,5 W\nStromverbrauch (durchschnittl.): 14,83 W\nStromverbrauch (aus): 0,3 W\nAC Eingangsspannung: 100 - 240 V\nAC Eingangsfrequenz: 50/60 Hz\nNetzteiltyp: Extern\nEnergieeffizienzskala: A+++ bis D\nBetriebstemperatur: 0 - 40 \u00b0C\nTemperaturbereich bei Lagerung: -20 - 60 \u00b0C\nRelative Luftfeuchtigkeit in Betrieb: 20 - 80%\nH\u00f6he bei Betrieb: 0 - 3658 m\nH\u00f6he bei Lagerung: 0 - 12192 m\nSt\u00e4nder enthalten: Ja\nMitgelieferte Kabel: DisplayPort, HDMI, AC\nBetriebsanleitung: Ja\nGer\u00e4tebreite (inkl. Fu\u00df): 540 mm\nGer\u00e4tetiefe (inkl. Fu\u00df): 207 mm\nGer\u00e4teh\u00f6he (inkl. Fu\u00df): 414 mm\nGewicht (mit St\u00e4nder): 3,07 kg\nBreite (ohne Standfu\u00df): 54 cm\nTiefe (ohne Standfu\u00df): 4,3 cm\nH\u00f6he (ohne Standfu\u00df): 32,5 cm\nGewicht (ohne St\u00e4nder): 2,49 kg\nVerpackungsbreite: 586 mm\nVerpackungstiefe: 148 mm\nVerpackungsh\u00f6he: 476 mm\nPaketgewicht: 4,83 kg\nVerpackungsart: Box\nNachhaltigkeitszertifikate: ENERGY STAR, RoHS\nEnth\u00e4lt nicht: Quecksilber, PVC/BFR\nWarentarifnummer (HS): 85285210\nAu\u00dfenverkleidungstyp: Texturiert\nRecycelbares Verpackungsmaterial: 100%\nEinfach zu lesen Modus: Ja\nLowBlue-Modus: Ja\nMittlere Betriebsdauer zwischen Ausf\u00e4llen (MTBF): 50000 h\nBild-Verbesserung: SmartImage game\nBeh\u00f6rdliche Zulassung: CB; TUV/ISO9241-307; TUV-BAUART; CU-EAC; EAEU RoHS; MEPS; RCM; PSB; CE Mark\nDatenblatt: Kein Datenblatt verf\u00fcgbar\nProduktlink: Link\nHerstellerlink: Philips",
    "reference_file": "offer_reference_1782.json",
    "shop_name": "Syswork"
}