{
    "html_file": "offer_527_0.html",
    "name": "Dell E2724HS, 27\"",
    "offer_link": "https://www.proshop.at/Bildschirm/Dell-2701-in-Bildschirm-E2724HS-1920x1080-FHD-VA-Speakers-Black-5-ms/3146186?utm_source=geizhals&utm_medium=cpc&utm_campaign=pricesite",
    "price": 157.16,
    "raw_specifications": {
        "Abmessungen (Breite x Tiefe x H\u00f6he)": "61.3 cm x 21.722 cm x 40.519 cm - mit Standfu\u00df (niedrigste Position)",
        "Abmessungen (Breite x Tiefe x H\u00f6he) - mit Standfu\u00df (niedrigste Position)": "61.3 cm x 21.722 cm x 40.519 cm",
        "Ausgangsleistung/Kanal": "1 Watt",
        "Besonderheiten": "Flimmerfrei-Technologie, Dell ComfortView, Low Blue Light-Technologie, an 3 Seiten ohne Blende",
        "Bildschirmbeschichtung": "Blendfrei",
        "Bildschirmtyp": "VA",
        "Details zu Abmessungen & Gewicht": "Mit Standfu\u00df (niedrigste Position) - Breite: 61.3 cm - Tiefe: 21.722 cm - H\u00f6he: 40.519 cm - Gewicht: 5.79 kg  Mit Standfu\u00df (h\u00f6chste Position) - Breite: 61.3 cm - Tiefe: 21.722 cm - H\u00f6he: 53.519 cm - Gewicht: 5.79 kg  Ohne Fu\u00df - Breite: 61.3 cm - Tiefe: 5.1 cm - H\u00f6he: 36.432 cm - Gewicht: 3.89 kg",
        "Diagonalabmessung": "68.599 cm (27.01\")",
        "Display-Typ": "LED-hintergrundbeleuchteter LCD-Monitor / TFT-Aktivmatrix",
        "EAN": "5397184657102",
        "ENERGY STAR zertifiziert": "Ja",
        "EPEAT-kompatibel": "EPEAT Gold",
        "Ein-/Aus-Schalter": "Ja",
        "Eingangsanschl\u00fcsse": "HDMI, VGA, DisplayPort",
        "Eingangsspannung": "Wechselstrom 100-240 V (50/60 Hz)",
        "Einstellungen der Anzeigeposition": "H\u00f6he, Drehung, Neigung",
        "Energie Effizienzklasse": "Klasse D",
        "Energierverbrauch Sleep": "0.3 Watt",
        "Enthaltene Kabel": "1 x HDMI-Kabel",
        "Farbraum": "72% NTSC (CIE 1931), 83% NTSC (CIE 1976)",
        "Farbunterst\u00fctzung": "16,7 Millionen Farben",
        "Ger\u00e4tetyp": "LED-hintergrundbeleuchteter LCD-Monitor - 68.599 cm (27.01\")",
        "Gewicht": "5.79 kg",
        "Helligkeit": "300 cd/m\u00b2",
        "Hersteller": "Dell",
        "Hintergrundbeleuchtungs-Technologie": "LED-Hintergrundbeleuchtung",
        "Horizontaler Betrachtungswinkel": "178",
        "H\u00f6heneinstellung": "135 mm",
        "Kontrast": "3000:1 / 3000:1 (dynamisch)",
        "Leistungsaufnahme im Ein-Zustand": "17 W",
        "Leistungsmerkmale": "Slot f\u00fcr Sicherheitsschloss (Kabelschloss getrennt erh\u00e4ltlich), Unterst\u00fctzung f\u00fcr VESA-Schnittstelle",
        "Mitgelieferte Software": "Dell Display Manager",
        "Modell": "DELL-E2724HS",
        "Native Aufl\u00f6sung": "Full HD (1080p) 1920 x 1080 bei 60 Hz",
        "Neigungswinkel": "-5/+21",
        "Pixelpitch": "0.3114 mm",
        "Ppi": "81.57",
        "Produktbeschreibung": "Dell E2724HS - LED-Monitor - Full HD (1080p) - 68.599 cm (27.01\")",
        "Reaktionszeit": "5 ms (Grau-zu-Grau schnell), 8 ms (Grau-zu-Grau normal)",
        "Schnittstellen": "DisplayPort 1.2  VGA  HDMI",
        "Schwenkwinkel": "346",
        "Seitenverh\u00e4ltnis": "16:9",
        "Services im Bundle": "3 Jahre erweiterter Austauschservice und beschr\u00e4nkte Hardware-Garantie",
        "Spannung": "Wechselstrom 100-240 V (50/60 Hz)",
        "Stromverbrauch (Aus-Modus)": "0.3 Watt",
        "Stromverbrauch (typisch)": "30 Watt",
        "Stromverbrauch im Standby-Modus": "0.3 Watt",
        "TCO-zertifiziert": "TCO Certified Edge Displays, TCO Certified Displays 9",
        "Transportgewicht": "7.73 kg",
        "Typ": "Lautsprecher - Stereo",
        "Umweltschutzstandards": "TCO Certified Edge Displays, TCO Certified Displays 9, ENERGY STAR-qualifiziert EPEAT Gold",
        "VESA-Halterung": "100 x 100 mm",
        "Vertikaler Betrachtungswinkel": "178",
        "Waren-Nr.": "3146186",
        "Zum Hersteller": "www.dell.com/"
    },
    "raw_specifications_text": "Hersteller: Dell\nWaren-Nr.: 3146186\nModell: DELL-E2724HS\nEAN: 5397184657102\nZum Hersteller: www.dell.com/\nProduktbeschreibung: Dell E2724HS - LED-Monitor - Full HD (1080p) - 68.599 cm (27.01\")\nGer\u00e4tetyp: LED-hintergrundbeleuchteter LCD-Monitor - 68.599 cm (27.01\")\nEnergie Effizienzklasse: Klasse D\nLeistungsaufnahme im Ein-Zustand: 17 W\nBildschirmtyp: VA\nSeitenverh\u00e4ltnis: 16:9\nNative Aufl\u00f6sung: Full HD (1080p) 1920 x 1080 bei 60 Hz\nPixelpitch: 0.3114 mm\nHelligkeit: 300 cd/m\u00b2\nKontrast: 3000:1 / 3000:1 (dynamisch)\nReaktionszeit: 5 ms (Grau-zu-Grau schnell), 8 ms (Grau-zu-Grau normal)\nFarbunterst\u00fctzung: 16,7 Millionen Farben\nFarbraum: 72% NTSC (CIE 1931), 83% NTSC (CIE 1976)\nEingangsanschl\u00fcsse: HDMI, VGA, DisplayPort\nEinstellungen der Anzeigeposition: H\u00f6he, Drehung, Neigung\nBildschirmbeschichtung: Blendfrei\nSpannung: Wechselstrom 100-240 V (50/60 Hz)\nAbmessungen (Breite x Tiefe x H\u00f6he) - mit Standfu\u00df (niedrigste Position): 61.3 cm x 21.722 cm x 40.519 cm\nGewicht: 5.79 kg\nUmweltschutzstandards: TCO Certified Edge Displays, TCO Certified Displays 9, ENERGY STAR-qualifiziert EPEAT Gold\nServices im Bundle: 3 Jahre erweiterter Austauschservice und beschr\u00e4nkte Hardware-Garantie\nDisplay-Typ: LED-hintergrundbeleuchteter LCD-Monitor / TFT-Aktivmatrix\nDiagonalabmessung: 68.599 cm (27.01\")\nPpi: 81.57\nHorizontaler Betrachtungswinkel: 178\nVertikaler Betrachtungswinkel: 178\nHintergrundbeleuchtungs-Technologie: LED-Hintergrundbeleuchtung\nBesonderheiten: Flimmerfrei-Technologie, Dell ComfortView, Low Blue Light-Technologie, an 3 Seiten ohne Blende\nAbmessungen (Breite x Tiefe x H\u00f6he): 61.3 cm x 21.722 cm x 40.519 cm - mit Standfu\u00df (niedrigste Position)\nTyp: Lautsprecher - Stereo\nAusgangsleistung/Kanal: 1 Watt\nSchnittstellen: DisplayPort 1.2  VGA  HDMI\nNeigungswinkel: -5/+21\nSchwenkwinkel: 346\nH\u00f6heneinstellung: 135 mm\nVESA-Halterung: 100 x 100 mm\nLeistungsmerkmale: Slot f\u00fcr Sicherheitsschloss (Kabelschloss getrennt erh\u00e4ltlich), Unterst\u00fctzung f\u00fcr VESA-Schnittstelle\nEnthaltene Kabel: 1 x HDMI-Kabel\nEingangsspannung: Wechselstrom 100-240 V (50/60 Hz)\nStromverbrauch (typisch): 30 Watt\nStromverbrauch im Standby-Modus: 0.3 Watt\nEnergierverbrauch Sleep: 0.3 Watt\nStromverbrauch (Aus-Modus): 0.3 Watt\nEin-/Aus-Schalter: Ja\nMitgelieferte Software: Dell Display Manager\nDetails zu Abmessungen & Gewicht: Mit Standfu\u00df (niedrigste Position) - Breite: 61.3 cm - Tiefe: 21.722 cm - H\u00f6he: 40.519 cm - Gewicht: 5.79 kg  Mit Standfu\u00df (h\u00f6chste Position) - Breite: 61.3 cm - Tiefe: 21.722 cm - H\u00f6he: 53.519 cm - Gewicht: 5.79 kg  Ohne Fu\u00df - Breite: 61.3 cm - Tiefe: 5.1 cm - H\u00f6he: 36.432 cm - Gewicht: 3.89 kg\nTransportgewicht: 7.73 kg\nTCO-zertifiziert: TCO Certified Edge Displays, TCO Certified Displays 9\nEPEAT-kompatibel: EPEAT Gold\nENERGY STAR zertifiziert: Ja",
    "reference_file": "offer_reference_527.json",
    "shop_name": "Proshop.at"
}