{
    "html_file": "offer_1758_34.html",
    "name": "AOC 24B2XDA, 23.8\"",
    "offer_link": "https://ms-it-beratung.at/shop/details.php?art=351737&artname=AOC+60%2C5cm+%2823%2C8%22%29+24B2XDA+++16%3A09+HDMI+IPS+black",
    "price": 120.0,
    "raw_specifications": {
        "AC Eingangsfrequenz": "50 - 60 Hz",
        "AC Eingangsspannung": "100 - 240 V",
        "AMD FreeSync": "Nein",
        "Abnehmbarer Standfu\u00df": "Ja",
        "Anzahl HDMI-Anschl\u00fcsse": "1",
        "Anzahl OSD-Sprachen": "16",
        "Anzahl VGA (D-Sub) Anschl\u00fcsse": "1",
        "Anzahl der Farben des Displays": "16,7 Millionen Farben",
        "Anzahl der Lautsprecher": "2",
        "Audioanschl\u00fcsse": "Ja",
        "Au\u00dfenverkleidungstyp": "Texturiert",
        "Bildschirmdiagonale": "60,5 cm (23.8\")",
        "Bildschirmdiagonale (cm)": "60,452 cm",
        "Bildschirmform": "Flach",
        "Bildschirmtechnologie": "LED",
        "Bildwinkel, horizontal": "178\u00b0",
        "Bildwinkel, vertikal": "178\u00b0",
        "Blendfreier Bildschirm": "Ja",
        "Breite (ohne Standfu\u00df)": "539,5 mm",
        "DVI Anschluss": "Ja",
        "Display-Aufl\u00f6sung": "1920 x 1080 Pixel",
        "Display-Oberfl\u00e4che": "Matt",
        "Eingebaute Lautsprecher": "Ja",
        "Eingebautes Mikrofon": "Nein",
        "Energieeffizienzklasse (SDR)": "E",
        "Energieeffizienzskala": "A bis G",
        "Energieverbrauch (SDR) pro 1.000 Stunden": "18 kWh",
        "Externes Netzteil": "Ja",
        "Farbtiefe": "8 Bit",
        "Flimmerfreie Technologie": "Ja",
        "Fu\u00dffarbe": "Schwarz",
        "Ger\u00e4tebreite (inkl. Fu\u00df)": "539,5 mm",
        "Ger\u00e4teh\u00f6he (inkl. Fu\u00df)": "418,4 mm",
        "Ger\u00e4tetiefe (inkl. Fu\u00df)": "170,9 mm",
        "Gewicht (mit St\u00e4nder)": "2,7 kg",
        "HD-Typ": "Full HD",
        "HDMI": "Ja",
        "HDMI-Kabell\u00e4nge": "1,8 m",
        "HDMI-Version": "1.4",
        "Helligkeit (typisch)": "250 cd/m\u00b2",
        "H\u00f6he (ohne Standfu\u00df)": "320,9 mm",
        "H\u00f6henverstellung": "Nein",
        "Integrierte Kamera": "Nein",
        "Integrierter USB-Hub": "Nein",
        "Kabelsperre-Slot": "Ja",
        "Kontrastverh\u00e4ltnis": "1000:1",
        "Kontrastverh\u00e4ltnis (dynamisch)": "20000000:1",
        "Kopfh\u00f6rer-Anschluss": "3,5 mm",
        "Kopfh\u00f6rerausgang": "Ja",
        "Kopfh\u00f6rerausg\u00e4nge": "1",
        "Lichteffekte": "Nein",
        "Low-Blue-Light-Technologie": "Ja",
        "Marktpositionierung": "Haus",
        "Maximale Bildwiederholrate": "75 Hz",
        "Men\u00fcsprachen": "Vereinfachtes Chinesisch, Traditionelles Chinesisch, Kroatisch, Tschechisch, Deutsch, Niederl\u00e4ndisch, Englisch, Spanisch, Finnisch, Franz\u00f6sisch, Italienisch, Japanisch, Koreanisch, Polnisch, Portugiesisch, Russisch, Schwedisch, T\u00fcrkisch, Ukrainisch",
        "Mitgelieferte Kabel": "HDMI",
        "NTSC Abdeckung (typisch)": "72%",
        "NVIDIA G-SYNC": "Nein",
        "Nachhaltigkeitszertifikate": "RoHS, ENERGY STAR",
        "Natives Seitenverh\u00e4ltnis": "16:9",
        "Neigungsverstellung": "Ja",
        "Neigungswinkelbereich": "-5 - 20\u00b0",
        "Oberfl\u00e4chenh\u00e4rte": "3H",
        "On-Screen-Display (OSD)": "Ja",
        "Paketgewicht": "4,5 kg",
        "Panel-Montage-Schnittstelle": "100 x 100 mm",
        "Panel-Typ": "IPS",
        "Pivot": "Ja",
        "Plug & Play": "Ja",
        "Produktfarbe": "Schwarz",
        "RMS-Leistung": "2 W",
        "Rahmenloses Design": "Ja",
        "Reaktionszeit": "4 ms",
        "Recycelbares Verpackungsmaterial": "100%",
        "Schnellladung": "Nein",
        "Schwermetallfrei": "Hg (Quecksilber)",
        "Seitenverh\u00e4ltnis": "4:3, 16:9",
        "Slot-Typ Kabelsperre": "Kensington",
        "Stromadapter enthalten": "Ja",
        "Stromkabell\u00e4nge": "1,8 m",
        "Stromverbrauch (Standardbetrieb)": "13,5 W",
        "Stromverbrauch (Standby)": "0,3 W",
        "Stromverbrauch (aus)": "0,3 W",
        "St\u00e4nder enthalten": "Ja",
        "Tiefe (ohne Standfu\u00df)": "37,6 mm",
        "Touchscreen": "Nein",
        "Typ der Hintergrundbeleuchtung": "W-LED",
        "Unterst\u00fctzte Grafik-Aufl\u00f6sungen": "1280 x 720 (HD 720), 1280 x 768 (WXGA), 1920 x 1080 (HD 1080)",
        "Unterst\u00fctzte Video-Modi": "720p, 768p, 1080p",
        "VESA-Halterung": "Ja",
        "Verpackungsart": "Box",
        "Verpackungsbreite": "614 mm",
        "Verpackungsh\u00f6he": "492 mm",
        "Verpackungstiefe": "131 mm",
        "Vorderer Rahmen": "Schwarz",
        "Warentarifnummer (HS)": "85285210",
        "Zertifizierung": "True"
    },
    "raw_specifications_text": "Bildschirmdiagonale: 60,5 cm (23.8\")\nDisplay-Aufl\u00f6sung: 1920 x 1080 Pixel\nNatives Seitenverh\u00e4ltnis: 16:9\nBildschirmtechnologie: LED\nTouchscreen: Nein\nHD-Typ: Full HD\nPanel-Typ: IPS\nTyp der Hintergrundbeleuchtung: W-LED\nHelligkeit (typisch): 250 cd/m\u00b2\nReaktionszeit: 4 ms\nDisplay-Oberfl\u00e4che: Matt\nBlendfreier Bildschirm: Ja\nBildschirmform: Flach\nUnterst\u00fctzte Grafik-Aufl\u00f6sungen: 1280 x 720 (HD 720), 1280 x 768 (WXGA), 1920 x 1080 (HD 1080)\nUnterst\u00fctzte Video-Modi: 720p, 768p, 1080p\nSeitenverh\u00e4ltnis: 4:3, 16:9\nKontrastverh\u00e4ltnis: 1000:1\nKontrastverh\u00e4ltnis (dynamisch): 20000000:1\nMaximale Bildwiederholrate: 75 Hz\nBildwinkel, horizontal: 178\u00b0\nBildwinkel, vertikal: 178\u00b0\nAnzahl der Farben des Displays: 16,7 Millionen Farben\nBildschirmdiagonale (cm): 60,452 cm\nOberfl\u00e4chenh\u00e4rte: 3H\nFarbtiefe: 8 Bit\nNTSC Abdeckung (typisch): 72%\nNVIDIA G-SYNC: Nein\nAMD FreeSync: Nein\nSchnellladung: Nein\nFlimmerfreie Technologie: Ja\nLow-Blue-Light-Technologie: Ja\nEingebaute Lautsprecher: Ja\nIntegrierte Kamera: Nein\nAnzahl der Lautsprecher: 2\nRMS-Leistung: 2 W\nEingebautes Mikrofon: Nein\nMarktpositionierung: Haus\nProduktfarbe: Schwarz\nRahmenloses Design: Ja\nVorderer Rahmen: Schwarz\nAbnehmbarer Standfu\u00df: Ja\nFu\u00dffarbe: Schwarz\nSchwermetallfrei: Hg (Quecksilber)\nZertifizierung: True\nIntegrierter USB-Hub: Nein\nAnzahl VGA (D-Sub) Anschl\u00fcsse: 1\nDVI Anschluss: Ja\nHDMI: Ja\nAnzahl HDMI-Anschl\u00fcsse: 1\nHDMI-Version: 1.4\nAudioanschl\u00fcsse: Ja\nKopfh\u00f6rerausgang: Ja\nKopfh\u00f6rerausg\u00e4nge: 1\nKopfh\u00f6rer-Anschluss: 3,5 mm\nVESA-Halterung: Ja\nPanel-Montage-Schnittstelle: 100 x 100 mm\nKabelsperre-Slot: Ja\nSlot-Typ Kabelsperre: Kensington\nH\u00f6henverstellung: Nein\nPivot: Ja\nNeigungswinkelbereich: -5 - 20\u00b0\nOn-Screen-Display (OSD): Ja\nMen\u00fcsprachen: Vereinfachtes Chinesisch, Traditionelles Chinesisch, Kroatisch, Tschechisch, Deutsch, Niederl\u00e4ndisch, Englisch, Spanisch, Finnisch, Franz\u00f6sisch, Italienisch, Japanisch, Koreanisch, Polnisch, Portugiesisch, Russisch, Schwedisch, T\u00fcrkisch, Ukrainisch\nAnzahl OSD-Sprachen: 16\nPlug & Play: Ja\nNeigungsverstellung: Ja\nEnergieeffizienzklasse (SDR): E\nEnergieverbrauch (SDR) pro 1.000 Stunden: 18 kWh\nStromverbrauch (Standardbetrieb): 13,5 W\nStromverbrauch (Standby): 0,3 W\nStromverbrauch (aus): 0,3 W\nAC Eingangsspannung: 100 - 240 V\nAC Eingangsfrequenz: 50 - 60 Hz\nEnergieeffizienzskala: A bis G\nExternes Netzteil: Ja\nSt\u00e4nder enthalten: Ja\nMitgelieferte Kabel: HDMI\nStromadapter enthalten: Ja\nHDMI-Kabell\u00e4nge: 1,8 m\nStromkabell\u00e4nge: 1,8 m\nGer\u00e4tebreite (inkl. Fu\u00df): 539,5 mm\nGer\u00e4tetiefe (inkl. Fu\u00df): 170,9 mm\nGer\u00e4teh\u00f6he (inkl. Fu\u00df): 418,4 mm\nGewicht (mit St\u00e4nder): 2,7 kg\nBreite (ohne Standfu\u00df): 539,5 mm\nTiefe (ohne Standfu\u00df): 37,6 mm\nH\u00f6he (ohne Standfu\u00df): 320,9 mm\nVerpackungsbreite: 614 mm\nVerpackungstiefe: 131 mm\nVerpackungsh\u00f6he: 492 mm\nPaketgewicht: 4,5 kg\nVerpackungsart: Box\nNachhaltigkeitszertifikate: RoHS, ENERGY STAR\nWarentarifnummer (HS): 85285210\nAu\u00dfenverkleidungstyp: Texturiert\nRecycelbares Verpackungsmaterial: 100%\nLichteffekte: Nein",
    "reference_file": "offer_reference_1758.json",
    "shop_name": "ms-it-beratung"
}