{
    "html_file": "offer_1106_10.html",
    "name": "BenQ PD3205U, 31.5\"",
    "offer_link": "https://www.amazon.de/dp/B09QLH5JZ8?linkCode=xm2&camp=2025&creative=165953&smid=A3JWKAKR8XB7XF&creativeASIN=B09QLH5JZ8&tag=geizhals1-21",
    "price": 579.83,
    "raw_specifications": {
        "ASIN": "B09QLH5JZ8",
        "Amazon Bestseller-Rang": "Nr. 8,564 in Computer & Zubeh\u00f6r (Siehe Top 100 in Computer & Zubeh\u00f6r)  Nr. 189 in Monitore",
        "Anzahl HDMI Schnittstellen": "\u200e1",
        "Anzahl USB 2.0 Schnittstellen": "\u200e2",
        "Anzahl der Lithium-Metall-Zellen": "\u200e1",
        "Artikelgewicht": "\u200e9,4 Kilograms",
        "Batterien enthalten": "\u200eNein",
        "Bildschirmaufl\u00f6sung": "\u200e3840 x 2160",
        "Display-Gr\u00f6\u00dfe": "\u200e32",
        "Durchschnittliche Kundenbewertung": "4,6  4,6 von 5 Sternen    \n    7.304 Sternebewertungen   \n\n\n 4,6 von 5 Sternen",
        "Farbe": "\u200eSchwarz",
        "Garantierte Software-Updates bis": "\u200eunbekannt",
        "Hersteller": "\u200eBENQ",
        "Im Angebot von Amazon.de seit": "17. Januar 2022",
        "Interface Grafikkarte": "\u200eIntegriert",
        "L\u00f6sung": "\u200e3840 x 2160 Pixels",
        "Marke": "\u200eBenQ",
        "Modell/Serie": "\u200ePD3205U",
        "Modellnummer": "\u200ePD3205U",
        "Produktabmessungen": "\u200e58,9 x 71,47 x 25,68 cm; 9,4 Kilogramm",
        "Prozessorkerne": "\u200e4",
        "Volt": "\u200e240 Volt",
        "Watt": "\u200e90 Watt"
    },
    "raw_specifications_text": "Marke: \u200eBenQ\nHersteller: \u200eBENQ\nModell/Serie: \u200ePD3205U\nProduktabmessungen: \u200e58,9 x 71,47 x 25,68 cm; 9,4 Kilogramm\nModellnummer: \u200ePD3205U\nFarbe: \u200eSchwarz\nDisplay-Gr\u00f6\u00dfe: \u200e32\nBildschirmaufl\u00f6sung: \u200e3840 x 2160\nL\u00f6sung: \u200e3840 x 2160 Pixels\nProzessorkerne: \u200e4\nInterface Grafikkarte: \u200eIntegriert\nAnzahl USB 2.0 Schnittstellen: \u200e2\nAnzahl HDMI Schnittstellen: \u200e1\nVolt: \u200e240 Volt\nWatt: \u200e90 Watt\nBatterien enthalten: \u200eNein\nAnzahl der Lithium-Metall-Zellen: \u200e1\nArtikelgewicht: \u200e9,4 Kilograms\nGarantierte Software-Updates bis: \u200eunbekannt\nASIN: B09QLH5JZ8\nDurchschnittliche Kundenbewertung: 4,6  4,6 von 5 Sternen    \n    7.304 Sternebewertungen   \n\n\n 4,6 von 5 Sternen\nAmazon Bestseller-Rang: Nr. 8,564 in Computer & Zubeh\u00f6r (Siehe Top 100 in Computer & Zubeh\u00f6r)  Nr. 189 in Monitore\nIm Angebot von Amazon.de seit: 17. Januar 2022",
    "reference_file": "offer_reference_1106.json",
    "shop_name": "Amazon.at"
}