{
    "html_file": "offer_2259_10.html",
    "name": "Lenovo ThinkVision T23d-10, 22.5\"",
    "offer_link": "https://www.mylemon.at/artikel/lenovo/61c3mat6eu/thinkvision-t23d-57-15cm-22.html",
    "price": 186.63,
    "raw_specifications": {
        "3D": "Nein",
        "AC-Netzadapter": "Ja",
        "Abnehmbarer Standfu\u00df": "Ja",
        "Anzahl DisplayPort Anschl\u00fcsse": "1",
        "Anzahl HDMI-Anschl\u00fcsse": "1",
        "Anzahl OSD-Sprachen": "8",
        "Anzahl VGA (D-Sub) Anschl\u00fcsse": "1",
        "Artikelnummer": "MTFYJ0L",
        "Aufl\u00f6sung": "1920x1200",
        "Bezel Weite (side)": "2,3 mm",
        "Bildschirmdiagonale": "57,1 cm (22.5 Zoll)",
        "Bildschirmform": "Flach",
        "Bildschirmtechnologie": "LED",
        "Bildwinkel, horizontal": "178\u00b0",
        "Bildwinkel, vertikal": "178\u00b0",
        "Bluetooth": "Nein",
        "DVI Anschluss": "Nein",
        "Display-Aufl\u00f6sung": "1920 x 1200 Pixel",
        "DisplayPort Kabell\u00e4nge": "1,8 m",
        "Displaygr\u00f6\u00dfe": "22 Zoll",
        "EAN": "0192330486408",
        "Ein-/Ausschalter": "Ja",
        "Eingebaute Lautsprecher": "Nein",
        "Eingebauter Ethernet-Anschluss": "Nein",
        "Energieeffizienzklasse (SDR)": "D",
        "Energieeffizienzskala": "A bis G",
        "Energieverbrauch (SDR) pro 1.000 Stunden": "14 kWh",
        "Farbskala": "72%",
        "Ger\u00e4tebreite (inkl. Fu\u00df)": "501,2 mm",
        "Ger\u00e4teh\u00f6he (inkl. Fu\u00df)": "491,9 mm",
        "Ger\u00e4tetiefe (inkl. Fu\u00df)": "251,9 mm",
        "Gewicht (mit St\u00e4nder)": "4,85 kg",
        "Gleichstrom-Anschluss (DC)": "Ja",
        "HD-Typ": "WUXGA",
        "HDMI-Kabell\u00e4nge": "1,8 m",
        "Helligkeit": "250 cd/m\u00b2",
        "Helligkeit (typisch)": "250 cd/m\u00b2",
        "Hersteller Artikelnummer": "61C3MAT6EU",
        "H\u00f6heneinstellung": "11 cm",
        "H\u00f6henverstellung": "Ja",
        "Integrierte Kamera": "Nein",
        "Integrierter USB-Hub": "Nein",
        "Kabelsperre-Slot": "Ja",
        "Kontrastverh\u00e4ltnis": "1000:1",
        "LED-Anzeigen": "Ja",
        "Nachhaltigkeitszertifikate": "RoHS, EPEAT Gold, ENERGY STAR",
        "Natives Seitenverh\u00e4ltnis": "16:10",
        "Neigungsverstellung": "Ja",
        "Neigungswinkelbereich": "-5 - 30\u00b0",
        "On-Screen-Display (OSD)": "Ja",
        "Panel": "IPS",
        "Panel-Montage-Schnittstelle": "100 x 100 mm",
        "Panel-Typ": "TFT/IPS",
        "Pivot": "Ja",
        "Pivot Winkel": "0 - 90\u00b0",
        "Pixel Abstand": "0,25 x 0,25 mm",
        "Plug & Play": "Ja",
        "Produktfarbe": "Schwarz",
        "Quantum-Dot-Farbtechnologie": "Ja",
        "Reaktionszeit": "6 ms",
        "Schwenkbar": "Ja",
        "Schwenkwinkelbereich": "-45 - 45\u00b0",
        "Sichtbare Gr\u00f6\u00dfe (horizontal)": "49,6 cm",
        "Sichtbare Gr\u00f6\u00dfe (vertikal)": "31,4 cm",
        "Slot-Typ Kabelsperre": "Kensington",
        "Stromkabell\u00e4nge": "1,8 m",
        "Stromverbrauch (Standardbetrieb)": "15 W",
        "Stromverbrauch (Standby)": "0,3 W",
        "Stromverbrauch (max.)": "18 W",
        "St\u00e4nder enthalten": "Ja",
        "TV Tuner integriert": "Nein",
        "Touchscreen": "Nein",
        "Unterst\u00fctzte Grafik-Aufl\u00f6sungen": "640 x 480 (VGA), 720 x 400, 800 x 600 (SVGA), 1024 x 768 (XGA), 1280 x 1024 (SXGA), 1360 x 768 (WXGA), 1440 x 900 (WXGA+), 1680 x 1050 (WSXGA+), 1920 x 1080 (HD 1080), 1920 x 1200 (WUXGA)",
        "VESA-Halterung": "Ja",
        "VGA-Kabell\u00e4nge": "1,8 m",
        "Verpackungsart": "Box",
        "Video Anschl\u00fcsse": "1x VGA, 1x HDMI, 1x DisplayPort",
        "WLAN": "Nein",
        "Warentarifnummer (HS)": "85285210",
        "Zertifizierung": "TCO 7.0, DDC2B/CI, ISO 9241-307, FCC Class B, TCO Certified Edge 2.0, WEEE"
    },
    "raw_specifications_text": "Displaygr\u00f6\u00dfe: 22 Zoll\nAufl\u00f6sung: 1920x1200\nPanel: IPS\nReaktionszeit: 6 ms\nVideo Anschl\u00fcsse: 1x VGA, 1x HDMI, 1x DisplayPort\nHelligkeit: 250 cd/m\u00b2\nHersteller Artikelnummer: 61C3MAT6EU\nEAN: 0192330486408\nArtikelnummer: MTFYJ0L\nBildschirmdiagonale: 57,1 cm (22.5 Zoll)\nDisplay-Aufl\u00f6sung: 1920 x 1200 Pixel\nNatives Seitenverh\u00e4ltnis: 16:10\nBildschirmtechnologie: LED\nTouchscreen: Nein\nHD-Typ: WUXGA\nPanel-Typ: TFT/IPS\nBildschirmform: Flach\nKontrastverh\u00e4ltnis: 1000:1\nHelligkeit (typisch): 250 cd/m\u00b2\nUnterst\u00fctzte Grafik-Aufl\u00f6sungen: 640 x 480 (VGA), 720 x 400, 800 x 600 (SVGA), 1024 x 768 (XGA), 1280 x 1024 (SXGA), 1360 x 768 (WXGA), 1440 x 900 (WXGA+), 1680 x 1050 (WSXGA+), 1920 x 1080 (HD 1080), 1920 x 1200 (WUXGA)\nBildwinkel, horizontal: 178\u00b0\nBildwinkel, vertikal: 178\u00b0\nPixel Abstand: 0,25 x 0,25 mm\nSichtbare Gr\u00f6\u00dfe (horizontal): 49,6 cm\nSichtbare Gr\u00f6\u00dfe (vertikal): 31,4 cm\nFarbskala: 72%\n3D: Nein\nQuantum-Dot-Farbtechnologie: Ja\nEingebaute Lautsprecher: Nein\nIntegrierte Kamera: Nein\nProduktfarbe: Schwarz\nAbnehmbarer Standfu\u00df: Ja\nZertifizierung: TCO 7.0, DDC2B/CI, ISO 9241-307, FCC Class B, TCO Certified Edge 2.0, WEEE\nIntegrierter USB-Hub: Nein\nAnzahl VGA (D-Sub) Anschl\u00fcsse: 1\nDVI Anschluss: Nein\nAnzahl HDMI-Anschl\u00fcsse: 1\nAnzahl DisplayPort Anschl\u00fcsse: 1\nGleichstrom-Anschluss (DC): Ja\nWLAN: Nein\nBluetooth: Nein\nEingebauter Ethernet-Anschluss: Nein\nVESA-Halterung: Ja\nKabelsperre-Slot: Ja\nH\u00f6henverstellung: Ja\nPanel-Montage-Schnittstelle: 100 x 100 mm\nSlot-Typ Kabelsperre: Kensington\nH\u00f6heneinstellung: 11 cm\nPivot: Ja\nPivot Winkel: 0 - 90\u00b0\nSchwenkbar: Ja\nSchwenkwinkelbereich: -45 - 45\u00b0\nNeigungswinkelbereich: -5 - 30\u00b0\nOn-Screen-Display (OSD): Ja\nAnzahl OSD-Sprachen: 8\nPlug & Play: Ja\nLED-Anzeigen: Ja\nNeigungsverstellung: Ja\nEnergieeffizienzklasse (SDR): D\nEnergieverbrauch (SDR) pro 1.000 Stunden: 14 kWh\nStromverbrauch (Standardbetrieb): 15 W\nStromverbrauch (Standby): 0,3 W\nStromverbrauch (max.): 18 W\nEnergieeffizienzskala: A bis G\nSt\u00e4nder enthalten: Ja\nDisplayPort Kabell\u00e4nge: 1,8 m\nHDMI-Kabell\u00e4nge: 1,8 m\nStromkabell\u00e4nge: 1,8 m\nGer\u00e4tebreite (inkl. Fu\u00df): 501,2 mm\nGer\u00e4tetiefe (inkl. Fu\u00df): 251,9 mm\nGer\u00e4teh\u00f6he (inkl. Fu\u00df): 491,9 mm\nGewicht (mit St\u00e4nder): 4,85 kg\nBezel Weite (side): 2,3 mm\nVerpackungsart: Box\nVGA-Kabell\u00e4nge: 1,8 m\nNachhaltigkeitszertifikate: RoHS, EPEAT Gold, ENERGY STAR\nWarentarifnummer (HS): 85285210\nAC-Netzadapter: Ja\nEin-/Ausschalter: Ja\nTV Tuner integriert: Nein",
    "reference_file": "offer_reference_2259.json",
    "shop_name": "mylemon.at"
}