{
    "html_file": "offer_1110_6.html",
    "name": "ASUS ROG Strix XG249CM, 23.8\"",
    "offer_link": "https://www.e-tec.at/details.php?artnr=341274",
    "price": 302.5,
    "raw_specifications": {
        "AMD FreeSync Premium": "Ja",
        "Abmessungen (BxHxT)": "540x388x238mm (mit Standfu\u00df),  540x325x57mm (ohne Standfu\u00df)",
        "Adaptive Sync": "Ja",
        "Anschl\u00fcsse - DisplayPort 1.2": "1",
        "Anschl\u00fcsse - HDMI 2.0": "1",
        "Anschl\u00fcsse - USB-C 3.0 mit DisplayPort 1.2": "1",
        "Anwendung": "station\u00e4r",
        "Audio": "1x Line-Out",
        "Aufl\u00f6sung": "1920x1080",
        "Beschichtung": "matt (non-glare)",
        "Besonderheiten": "Slim Bezel,  USB-C Power Delivery (15W),  mechanische Tasten mit Steuerkreuz,  Sicherheitsschloss (Kensington),  Werkskalibrierung (Delta-E <2)",
        "Bildwiederholfrequenz": "270Hz",
        "Blickwinkel": "178\u00b0/178\u00b0",
        "Diagonale": "23.8\"/60.5cm",
        "Energieeffizienzklasse HDR (A bis G)": "G",
        "Energieverbrauch HDR": "32kWh/1000h",
        "Energieverbrauch SDR": "22kWh/1000h",
        "Ergonomie": "100mm (h\u00f6henverstellbar),  90\u00b0 (Pivot),  \u00b125\u00b0 (drehbar),  +20\u00b0/-5\u00b0 (neigbar),  keine Angabe (Schr\u00e4glage)",
        "FRC": "unbekannt",
        "Farbe": "schwarz",
        "Farbraum - Adobe RGB": "68%",
        "Farbraum - sRGB": "105%",
        "Farbtiefe": "8bit (16.7 Mio. Farben)",
        "Form": "gerade (flat)",
        "Gewicht": "6.60kg (mit Standfu\u00df),  3.20kg (ohne Standfu\u00df)",
        "HDR": "HDR10",
        "Helligkeit": "350cd/m\u00b2",
        "Herstellergarantie": "drei Jahre",
        "Hintergrundbeleuchtung": "White-LED,  flicker-free,  Blaulichtfilter",
        "Kontrast - dynamisch": "100.000.000:1",
        "Kontrast - statisch": "1.000:1",
        "Leistungsaufnahme": "keine Angabe (maximal),  22.7W (typisch),  keine Angabe (Energielabel alt A+++ bis G),  0.5W (Standby)",
        "Panel": "IPS",
        "Reaktionszeit - GtG": "1ms",
        "Screen-to-Body-Ratio": "89.0% (berechnet)",
        "Seitenverh\u00e4ltnis": "16:9",
        "Signalfrequenz": "31-300kHz (horizontal),  48-270Hz (vertikal)",
        "Stromversorgung": "DC-In (externes Netzteil)",
        "USB-Hub In": "1x USB-B 3.0,  1x USB-C 3.0 mit DisplayPort 1.2",
        "USB-Hub Out": "2x USB-A 3.0",
        "USB-Schreibweise": "Link",
        "Unsch\u00e4rfereduktionsfunktion": "ASUS Extreme Low Motion Blur Sync (ELMB SYNC)",
        "VESA": "100x100 (belegt)",
        "Weitere Anschl\u00fcsse": "N/A"
    },
    "raw_specifications_text": "Abmessungen (BxHxT): 540x388x238mm (mit Standfu\u00df),  540x325x57mm (ohne Standfu\u00df)\nAdaptive Sync: Ja\nAMD FreeSync Premium: Ja\nAnschl\u00fcsse - DisplayPort 1.2: 1\nAnschl\u00fcsse - HDMI 2.0: 1\nAnschl\u00fcsse - USB-C 3.0 mit DisplayPort 1.2: 1\nAnwendung: station\u00e4r\nAudio: 1x Line-Out\nAufl\u00f6sung: 1920x1080\nBeschichtung: matt (non-glare)\nBesonderheiten: Slim Bezel,  USB-C Power Delivery (15W),  mechanische Tasten mit Steuerkreuz,  Sicherheitsschloss (Kensington),  Werkskalibrierung (Delta-E <2)\nBildwiederholfrequenz: 270Hz\nBlickwinkel: 178\u00b0/178\u00b0\nDiagonale: 23.8\"/60.5cm\nEnergieeffizienzklasse HDR (A bis G): G\nEnergieverbrauch HDR: 32kWh/1000h\nEnergieverbrauch SDR: 22kWh/1000h\nErgonomie: 100mm (h\u00f6henverstellbar),  90\u00b0 (Pivot),  \u00b125\u00b0 (drehbar),  +20\u00b0/-5\u00b0 (neigbar),  keine Angabe (Schr\u00e4glage)\nFarbe: schwarz\nFarbraum - Adobe RGB: 68%\nFarbraum - sRGB: 105%\nFarbtiefe: 8bit (16.7 Mio. Farben)\nForm: gerade (flat)\nFRC: unbekannt\nGewicht: 6.60kg (mit Standfu\u00df),  3.20kg (ohne Standfu\u00df)\nHDR: HDR10\nHelligkeit: 350cd/m\u00b2\nHerstellergarantie: drei Jahre\nHintergrundbeleuchtung: White-LED,  flicker-free,  Blaulichtfilter\nKontrast - dynamisch: 100.000.000:1\nKontrast - statisch: 1.000:1\nLeistungsaufnahme: keine Angabe (maximal),  22.7W (typisch),  keine Angabe (Energielabel alt A+++ bis G),  0.5W (Standby)\nPanel: IPS\nReaktionszeit - GtG: 1ms\nScreen-to-Body-Ratio: 89.0% (berechnet)\nSeitenverh\u00e4ltnis: 16:9\nSignalfrequenz: 31-300kHz (horizontal),  48-270Hz (vertikal)\nStromversorgung: DC-In (externes Netzteil)\nUnsch\u00e4rfereduktionsfunktion: ASUS Extreme Low Motion Blur Sync (ELMB SYNC)\nUSB-Hub In: 1x USB-B 3.0,  1x USB-C 3.0 mit DisplayPort 1.2\nUSB-Hub Out: 2x USB-A 3.0\nUSB-Schreibweise: Link\nVESA: 100x100 (belegt)\nWeitere Anschl\u00fcsse: N/A",
    "reference_file": "offer_reference_1110.json",
    "shop_name": "e-tec.at"
}