{
    "html_file": "offer_1337_5.html",
    "name": "Samsung F37T, 24\"",
    "offer_link": "https://www.office-partner.de/productredirect/index/sku/15537922?sPartner=p-geizhals-at&campaign=psm/geizhals-at/",
    "price": 118.89,
    "raw_specifications": {
        "Anschl\u00fcsse": "HDMI, DisplayPort",
        "Artikelnummer": "15537922",
        "Aufl\u00f6sung Kurzname": "Full HD",
        "Bezeichnung des Herstellers": "Samsung F24T370FWR",
        "Bildwiederholungsrate": "75,00 Hz",
        "Breite": "5392,00 mm",
        "Display Features": "FlickerFree",
        "Display Sync": "AMD FreeSync, Adaptive Sync",
        "Displaygr\u00f6\u00dfe": "60,96 cm (24 Zoll)",
        "EEK - Spektrum": "AG",
        "Energieeffizienzklasse": "E",
        "Geh\u00e4usefarbe des Ger\u00e4tes": "Schwarz",
        "Gewicht": "2,90 kg",
        "Gewicht inkl. Verpackung in Kg": "4,20 kg",
        "Helligkeit Bereich": "150 - 300 cd/m\u00b2",
        "Hersteller": "Samsung",
        "H\u00f6he": "4253,00 mm",
        "Inhalt (ml oder g)": "0,00 ml",
        "Kapazit\u00e4t (Seiten)": "0",
        "Kontrastverh\u00e4ltnis (typisch) Bereich": "800:1 bis 1.200:1",
        "LCD-Technologie": "IPS Panel",
        "L\u00e4nge": "232,00 mm",
        "Produktart": "Monitore",
        "Reaktionszeit": "5,00 ms",
        "Seitenverh\u00e4ltnis": "16:9",
        "Shop Herstellernummer": "LF24T370FWRXEN",
        "Standard-EAN": "8806092014534",
        "Verpackung - Breite in cm": "67,50 cm",
        "Verpackung - H\u00f6he in cm": "12,50 cm",
        "Verpackung - L\u00e4nge in cm": "38,70 cm",
        "max. Aufl\u00f6sung": "1.920 x 1.080 Pixel (16:9)"
    },
    "raw_specifications_text": "Energieeffizienzklasse: E\nGeh\u00e4usefarbe des Ger\u00e4tes: Schwarz\nAnschl\u00fcsse: HDMI, DisplayPort\nGewicht: 2,90 kg\nKontrastverh\u00e4ltnis (typisch) Bereich: 800:1 bis 1.200:1\nDisplay Features: FlickerFree\nHersteller: Samsung\nHelligkeit Bereich: 150 - 300 cd/m\u00b2\nDisplaygr\u00f6\u00dfe: 60,96 cm (24 Zoll)\nProduktart: Monitore\nDisplay Sync: AMD FreeSync, Adaptive Sync\nAufl\u00f6sung Kurzname: Full HD\nInhalt (ml oder g): 0,00 ml\nKapazit\u00e4t (Seiten): 0\nEEK - Spektrum: AG\nVerpackung - H\u00f6he in cm: 12,50 cm\nBreite: 5392,00 mm\nH\u00f6he: 4253,00 mm\nVerpackung - Breite in cm: 67,50 cm\nVerpackung - L\u00e4nge in cm: 38,70 cm\nGewicht inkl. Verpackung in Kg: 4,20 kg\nL\u00e4nge: 232,00 mm\nArtikelnummer: 15537922\nShop Herstellernummer: LF24T370FWRXEN\nBezeichnung des Herstellers: Samsung F24T370FWR\nStandard-EAN: 8806092014534\nmax. Aufl\u00f6sung: 1.920 x 1.080 Pixel (16:9)\nSeitenverh\u00e4ltnis: 16:9\nLCD-Technologie: IPS Panel\nReaktionszeit: 5,00 ms\nBildwiederholungsrate: 75,00 Hz",
    "reference_file": "offer_reference_1337.json",
    "shop_name": "office-partner (AT)"
}