{
    "html_file": "offer_1110_10.html",
    "name": "ASUS ROG Strix XG249CM, 23.8\"",
    "offer_link": "https://www.csv-direct.de/artinfo.php?artnr=AGX1517215&KATEGORIE=162&pva=geizhals2",
    "price": 312.97,
    "raw_specifications": {
        "AC Eingangsfrequenz": "50 - 60 Hz",
        "AC Eingangsspannung": "100 - 240 V",
        "AMD FreeSync-Typ": "FreeSync Premium",
        "Anzahl DisplayPort Anschl\u00fcsse": "1",
        "Anzahl HDMI-Anschl\u00fcsse": "1",
        "Anzahl der Farben des Displays": "16,7 Millionen Farben",
        "Anzahl der nachgeschalteten Steckpl\u00e4tze vom Typ USB-A": "2",
        "Anzahl der vorgeschalteten Steckpl\u00e4tze": "1",
        "Betriebstemperatur": "0 - 40 \u00b0C",
        "Bildschirmdiagonale": "60,5 cm 23.8\"",
        "Bildschirmform": "Flach",
        "Bildschirmtechnologie": "LED",
        "Bildwinkel, horizontal": "178\u00b0",
        "Bildwinkel, vertikal": "178\u00b0",
        "Breite ohne Standfu\u00df": "540 mm",
        "Digital horizontale Frequenz": "31 - 274 kHz",
        "Digital vertikale Frequenz": "48 - 240 Hz",
        "Display-Aufl\u00f6sung": "1920 x 1080 Pixel",
        "DisplayPorts-Version": "1.2",
        "Eingebaute Lautsprecher": "Nein",
        "Energieeffizienzklasse HDR": "G",
        "Energieeffizienzklasse SDR": "F",
        "Energieverbrauch HDR pro 1.000 Stunden": "32 kWh",
        "Energieverbrauch SDR pro 1.000 Stunden": "22 kWh",
        "Fu\u00dffarbe": "Schwarz",
        "Ger\u00e4tebreite inkl. Fu\u00df": "540 mm",
        "Ger\u00e4teh\u00f6he inkl. Fu\u00df": "388 mm",
        "Ger\u00e4tetiefe inkl. Fu\u00df": "238 mm",
        "Gewicht mit St\u00e4nder": "6,6 kg",
        "Gewicht ohne St\u00e4nder": "3,2 kg",
        "HD-Typ": "Full HD",
        "HDMI-Version": "2.0",
        "Helligkeit typisch": "350 cd/m\u00b2",
        "H\u00f6he ohne Standfu\u00df": "325 mm",
        "H\u00f6heneinstellung": "10 cm",
        "Integrierte Kamera": "Nein",
        "Kontrastverh\u00e4ltnis": "1000:1",
        "Kopfh\u00f6rer-Anschluss": "3,5 mm",
        "Kopfh\u00f6rerausg\u00e4nge": "1",
        "Marktpositionierung": "Gaming",
        "Maximale Bildwiederholrate": "270 Hz",
        "Mitgelieferte Kabel": "AC, HDMI, USB, USB Typ-C",
        "NVIDIA G-SYNC": "Nein",
        "Natives Seitenverh\u00e4ltnis": "16:9",
        "Neigungswinkelbereich": "-5 - 20\u00b0",
        "Paketgewicht": "8,8 kg",
        "Panel-Montage-Schnittstelle": "100 x 100 mm",
        "Panel-Typ": "IPS",
        "Pivot Winkel": "0 - 90\u00b0",
        "Pixel Abstand": "0,2745 x 0,2745 mm",
        "Produktfarbe": "Schwarz",
        "Reaktionszeit": "1 ms",
        "Schwenkwinkelbereich": "-25 - 25\u00b0",
        "Sichtbare Gr\u00f6\u00dfe horizontal": "52,7 cm",
        "Sichtbare Gr\u00f6\u00dfe vertikal": "29,6 cm",
        "Slot-Typ Kabelsperre": "Kensington",
        "Stromverbrauch Standardbetrieb": "22,7 W",
        "Stromverbrauch Standby": "0,5 W",
        "Stromverbrauch aus": "0,3 W",
        "Technologie mit hohem Dynamikbereich HDR": "High Dynamic Range 10 HDR10",
        "Temperaturbereich bei Lagerung": "-30 - 65 \u00b0C",
        "Tiefe ohne Standfu\u00df": "57 mm",
        "Touchscreen": "Nein",
        "USB-Hub-Version": "3.2 Gen 1 3.1 Gen 1",
        "USB-Upstream-Porttyp": "USB Typ-C",
        "Verpackungsbreite": "627 mm",
        "Verpackungsh\u00f6he": "409 mm",
        "Verpackungstiefe": "247 mm",
        "Warentarifnummer HS": "85285210"
    },
    "raw_specifications_text": "Bildschirmdiagonale: 60,5 cm 23.8\"\nDisplay-Aufl\u00f6sung: 1920 x 1080 Pixel\nNatives Seitenverh\u00e4ltnis: 16:9\nBildschirmtechnologie: LED\nTouchscreen: Nein\nHD-Typ: Full HD\nPanel-Typ: IPS\nBildschirmform: Flach\nKontrastverh\u00e4ltnis: 1000:1\nMaximale Bildwiederholrate: 270 Hz\nAnzahl der Farben des Displays: 16,7 Millionen Farben\nHelligkeit typisch: 350 cd/m\u00b2\nReaktionszeit: 1 ms\nBildwinkel, horizontal: 178\u00b0\nBildwinkel, vertikal: 178\u00b0\nPixel Abstand: 0,2745 x 0,2745 mm\nSichtbare Gr\u00f6\u00dfe horizontal: 52,7 cm\nSichtbare Gr\u00f6\u00dfe vertikal: 29,6 cm\nDigital horizontale Frequenz: 31 - 274 kHz\nDigital vertikale Frequenz: 48 - 240 Hz\nTechnologie mit hohem Dynamikbereich HDR: High Dynamic Range 10 HDR10\nNVIDIA G-SYNC: Nein\nAMD FreeSync-Typ: FreeSync Premium\nEingebaute Lautsprecher: Nein\nIntegrierte Kamera: Nein\nMarktpositionierung: Gaming\nProduktfarbe: Schwarz\nFu\u00dffarbe: Schwarz\nUSB-Hub-Version: 3.2 Gen 1 3.1 Gen 1\nUSB-Upstream-Porttyp: USB Typ-C\nAnzahl der vorgeschalteten Steckpl\u00e4tze: 1\nAnzahl der nachgeschalteten Steckpl\u00e4tze vom Typ USB-A: 2\nAnzahl HDMI-Anschl\u00fcsse: 1\nHDMI-Version: 2.0\nAnzahl DisplayPort Anschl\u00fcsse: 1\nDisplayPorts-Version: 1.2\nKopfh\u00f6rerausg\u00e4nge: 1\nKopfh\u00f6rer-Anschluss: 3,5 mm\nPanel-Montage-Schnittstelle: 100 x 100 mm\nSlot-Typ Kabelsperre: Kensington\nH\u00f6heneinstellung: 10 cm\nPivot Winkel: 0 - 90\u00b0\nSchwenkwinkelbereich: -25 - 25\u00b0\nNeigungswinkelbereich: -5 - 20\u00b0\nEnergieeffizienzklasse SDR: F\nEnergieeffizienzklasse HDR: G\nEnergieverbrauch SDR pro 1.000 Stunden: 22 kWh\nEnergieverbrauch HDR pro 1.000 Stunden: 32 kWh\nStromverbrauch Standardbetrieb: 22,7 W\nStromverbrauch Standby: 0,5 W\nStromverbrauch aus: 0,3 W\nAC Eingangsspannung: 100 - 240 V\nAC Eingangsfrequenz: 50 - 60 Hz\nBetriebstemperatur: 0 - 40 \u00b0C\nTemperaturbereich bei Lagerung: -30 - 65 \u00b0C\nMitgelieferte Kabel: AC, HDMI, USB, USB Typ-C\nGer\u00e4tebreite inkl. Fu\u00df: 540 mm\nGer\u00e4tetiefe inkl. Fu\u00df: 238 mm\nGer\u00e4teh\u00f6he inkl. Fu\u00df: 388 mm\nGewicht mit St\u00e4nder: 6,6 kg\nBreite ohne Standfu\u00df: 540 mm\nTiefe ohne Standfu\u00df: 57 mm\nH\u00f6he ohne Standfu\u00df: 325 mm\nGewicht ohne St\u00e4nder: 3,2 kg\nVerpackungsbreite: 627 mm\nVerpackungstiefe: 247 mm\nVerpackungsh\u00f6he: 409 mm\nPaketgewicht: 8,8 kg\nWarentarifnummer HS: 85285210",
    "reference_file": "offer_reference_1110.json",
    "shop_name": "CSV-Direct.de"
}