{
    "html_file": "offer_1813_25.html",
    "name": "LG 32MN500M-B, 31.5\"",
    "offer_link": "https://www.future-x.at/lg-32mn500m-b-led-monitor-81-3-cm-32-315-sichtbar-1920-x-1080-full-hd-1080p-ips-250-cd-m%B2-1200%3A1-5-ms-2xhdmi-p-8565232/?pv=2",
    "price": 193.79,
    "raw_specifications": {
        "AMD FreeSync": "Ja",
        "Anzahl HDMI-Anschl\u00fcsse": "2",
        "Anzahl der Farben des Displays": "16.78 million colors",
        "Bildschirmaufl\u00f6sung": "1920 x 1080 Pixel",
        "Bildschirmdiagonale": "80 cm",
        "Bildschirmform": "Flach",
        "Bildschirmtechnologie": "LED",
        "Blickwinkel, horizontal": "178 \u00b0",
        "Blickwinkel, vertikal": "178 \u00b0",
        "Breite": "7298 mm",
        "Eingebaute Lautsprecher": "Nein",
        "Flimmerfreie Technologie": "Ja",
        "Ger\u00e4tebreite (inkl. Fu\u00df)": "729 mm",
        "Ger\u00e4teh\u00f6he (inkl. Fu\u00df)": "513 mm",
        "Ger\u00e4tetiefe (inkl. Fu\u00df)": "209 mm",
        "Gewicht": "6,2 kg",
        "Gewicht (mit St\u00e4nder)": "6,6 kg",
        "HD-Typ": "Full HD",
        "HDMI": "Ja",
        "Helligkeit (typisch)": "250 cd/m\u00b2",
        "H\u00f6he": "45 mm",
        "Kontrastverh\u00e4ltnis": "1200:1",
        "Kopfh\u00f6rerausgang": "Ja",
        "Mitgelieferte Kabel": "AC,HDMI",
        "NTSC Abdeckung (typisch)": "72 %",
        "Natives Seitenverh\u00e4ltnis": "16:9",
        "Paketgewicht": "9,2 kg",
        "Panel-Montage-Schnittstelle": "100 x 100 mm",
        "Panel-Typ": "IPS",
        "Pixel Abstand": "0,121 x 0,364 mm",
        "Produktfarbe": "Schwarz",
        "Reaktionszeit": "5 ms",
        "Seitenverh\u00e4ltnis": "16:9",
        "St\u00e4nder enthalten": "Ja",
        "Tiefe": "429 mm",
        "Unterst\u00fctzte Grafik-Aufl\u00f6sungen": "1920 x 1080 (HD 1080)",
        "VESA-Halterung": "Ja",
        "Verpackungsart": "BoxGewicht und Abmessungen",
        "Verpackungsbreite": "813 mm",
        "Verpackungsh\u00f6he": "516 mm",
        "Verpackungstiefe": "150 mm"
    },
    "raw_specifications_text": "Bildschirmdiagonale: 80 cm\nBildschirmaufl\u00f6sung: 1920 x 1080 Pixel\nNatives Seitenverh\u00e4ltnis: 16:9\nPanel-Typ: IPS\nHelligkeit (typisch): 250 cd/m\u00b2\nReaktionszeit: 5 ms\nHD-Typ: Full HD\nBildschirmtechnologie: LED\nBildschirmform: Flach\nUnterst\u00fctzte Grafik-Aufl\u00f6sungen: 1920 x 1080 (HD 1080)\nSeitenverh\u00e4ltnis: 16:9\nKontrastverh\u00e4ltnis: 1200:1\nBlickwinkel, horizontal: 178 \u00b0\nBlickwinkel, vertikal: 178 \u00b0\nAnzahl der Farben des Displays: 16.78 million colors\nPixel Abstand: 0,121 x 0,364 mm\nNTSC Abdeckung (typisch): 72 %\nVESA-Halterung: Ja\nPanel-Montage-Schnittstelle: 100 x 100 mm\nEingebaute Lautsprecher: Nein\nProduktfarbe: Schwarz\nAMD FreeSync: Ja\nFlimmerfreie Technologie: Ja\nHDMI: Ja\nAnzahl HDMI-Anschl\u00fcsse: 2\nKopfh\u00f6rerausgang: Ja\nSt\u00e4nder enthalten: Ja\nMitgelieferte Kabel: AC,HDMI\nVerpackungsbreite: 813 mm\nVerpackungstiefe: 150 mm\nVerpackungsh\u00f6he: 516 mm\nPaketgewicht: 9,2 kg\nVerpackungsart: BoxGewicht und Abmessungen\nBreite: 7298 mm\nTiefe: 429 mm\nH\u00f6he: 45 mm\nGewicht: 6,2 kg\nGer\u00e4tebreite (inkl. Fu\u00df): 729 mm\nGer\u00e4tetiefe (inkl. Fu\u00df): 209 mm\nGer\u00e4teh\u00f6he (inkl. Fu\u00df): 513 mm\nGewicht (mit St\u00e4nder): 6,6 kg",
    "reference_file": "offer_reference_1813.json",
    "shop_name": "Future-X.at"
}