{
    "html_file": "offer_384_15.html",
    "name": "ASUS ZenScreen MB16AHG, 15.6\"",
    "offer_link": "https://www.ditech.at/details.php?artnr=368138",
    "price": 348.9,
    "raw_specifications": {
        "AMD FreeSync Premium": "Ja",
        "Abmessungen - Breite": "keine angabe (mit standfu\u00df),  359.85mm",
        "Abmessungen - H\u00f6he": "226.75mm",
        "Abmessungen - Tiefe": "11.95 (ohne standfu\u00df)mm",
        "Adaptive Sync": "Ja",
        "Anschl\u00fcsse - Mini HDMI 1.4": "1",
        "Anschl\u00fcsse - Mini HDMI 1.4 144Hz@1920x1080": "1",
        "Anschl\u00fcsse - USB-C mit DisplayPort": "2",
        "Anschl\u00fcsse - USB-C mit DisplayPort 144Hz@1920x1080": "2",
        "Anwendung": "portabel (Klappmechanismus + Stativgewinde),  inkl. Schutzh\u00fclle",
        "Audio": "1x Line-Out",
        "Aufl\u00f6sung": "1920x1080",
        "Beschichtung": "matt (non-glare)",
        "Besonderheiten": "mechanische Tasten,  automatische Bildrotation,  Stativgewinde",
        "Bildwiederholfrequenz": "144Hz",
        "Blickwinkel": "178\u00b0/178\u00b0",
        "Diagonale": "15.6\"/39.6cm",
        "Energieverbrauch SDR": "10kWh/1000h",
        "Ergonomie": "N/A (h\u00f6henverstellbar),  N/A (Pivot),  N/A (drehbar),  keine Angabe (neigbar),  keine Angabe (Schr\u00e4glage)",
        "FRC": "unbekannt",
        "Farbe": "schwarz",
        "Farbraum - sRGB": "100%",
        "Farbtiefe": "8bit (16.7 Mio. Farben)",
        "Form": "gerade (flat)",
        "Gewicht": "keine Angabe (mit Standfu\u00df),  920g (ohne Standfu\u00df)",
        "HDR": "N/A",
        "Helligkeit": "300cd/m\u00b2 (typisch)",
        "Herstellergarantie": "drei Jahre",
        "Hintergrundbeleuchtung": "White-LED,  flicker-free,  Blaulichtfilter",
        "Kontrast - statisch": "1.200:1",
        "Leistungsaufnahme": "keine Angabe (maximal),  17W (typisch),  keine Angabe (Energielabel alt A+++ bis G),  0.5W (Standby)",
        "Panel": "IPS",
        "Reaktionszeit - GtG": "3ms",
        "Screen-to-Body-Ratio": "82.2% (berechnet)",
        "Seitenverh\u00e4ltnis": "16:9",
        "Signalfrequenz": "180kHz (horizontal),  60-144Hz (vertikal)",
        "Stromversorgung": "USB-C",
        "USB-Hub In": "N/A",
        "USB-Hub Out": "N/A",
        "USB-Schreibweise": "Link",
        "VESA": "N/A",
        "Weitere Anschl\u00fcsse": "N/A"
    },
    "raw_specifications_text": "Abmessungen - Breite: keine angabe (mit standfu\u00df),  359.85mm\nAbmessungen - H\u00f6he: 226.75mm\nAbmessungen - Tiefe: 11.95 (ohne standfu\u00df)mm\nAdaptive Sync: Ja\nAMD FreeSync Premium: Ja\nAnschl\u00fcsse - Mini HDMI 1.4: 1\nAnschl\u00fcsse - Mini HDMI 1.4 144Hz@1920x1080: 1\nAnschl\u00fcsse - USB-C mit DisplayPort: 2\nAnschl\u00fcsse - USB-C mit DisplayPort 144Hz@1920x1080: 2\nAnwendung: portabel (Klappmechanismus + Stativgewinde),  inkl. Schutzh\u00fclle\nAudio: 1x Line-Out\nAufl\u00f6sung: 1920x1080\nBeschichtung: matt (non-glare)\nBesonderheiten: mechanische Tasten,  automatische Bildrotation,  Stativgewinde\nBildwiederholfrequenz: 144Hz\nBlickwinkel: 178\u00b0/178\u00b0\nDiagonale: 15.6\"/39.6cm\nEnergieverbrauch SDR: 10kWh/1000h\nErgonomie: N/A (h\u00f6henverstellbar),  N/A (Pivot),  N/A (drehbar),  keine Angabe (neigbar),  keine Angabe (Schr\u00e4glage)\nFarbe: schwarz\nFarbraum - sRGB: 100%\nFarbtiefe: 8bit (16.7 Mio. Farben)\nForm: gerade (flat)\nFRC: unbekannt\nGewicht: keine Angabe (mit Standfu\u00df),  920g (ohne Standfu\u00df)\nHDR: N/A\nHelligkeit: 300cd/m\u00b2 (typisch)\nHerstellergarantie: drei Jahre\nHintergrundbeleuchtung: White-LED,  flicker-free,  Blaulichtfilter\nKontrast - statisch: 1.200:1\nLeistungsaufnahme: keine Angabe (maximal),  17W (typisch),  keine Angabe (Energielabel alt A+++ bis G),  0.5W (Standby)\nPanel: IPS\nReaktionszeit - GtG: 3ms\nScreen-to-Body-Ratio: 82.2% (berechnet)\nSeitenverh\u00e4ltnis: 16:9\nSignalfrequenz: 180kHz (horizontal),  60-144Hz (vertikal)\nStromversorgung: USB-C\nUSB-Hub In: N/A\nUSB-Hub Out: N/A\nUSB-Schreibweise: Link\nVESA: N/A\nWeitere Anschl\u00fcsse: N/A",
    "reference_file": "offer_reference_384.json",
    "shop_name": "DiTech.at"
}