{
    "html_file": "offer_1940_30.html",
    "name": "AOC 24G2ZE/BK, 23.8\"",
    "offer_link": "https://technikladen.at/P-AOC-G2-24G2ZE/BK-605-cm-238-Zoll-1920-x-1080-Pixel-Full-HD-LED-05-ms-Schwarz-Rot?tl=gzhls",
    "price": 264.92,
    "raw_specifications": {
        "AC Eingangsfrequenz": "50/60 Hz",
        "AC Eingangsspannung": "100 - 240 V",
        "AMD FreeSync": "Ja",
        "AMD FreeSync Bildwiederholratenbereich": "48 - 240 Hz",
        "AMD FreeSync-Typ": "FreeSync Premium",
        "Abnehmbarer Standfu\u00df": "Ja",
        "Abtastraten": "30 - 280 KHz, 48 - 240 Hz",
        "Adobe RGB-Abdeckung": "78 %",
        "Anzahl DisplayPort Anschl\u00fcsse": "1",
        "Anzahl HDMI-Anschl\u00fcsse": "2",
        "Anzahl OSD-Sprachen": "16",
        "Anzahl der Farben des Displays": "16,78 Millionen Farben",
        "Audioanschl\u00fcsse": "Ja",
        "Bildschirmaufl\u00f6sung": "1920 x 1080 Pixel",
        "Bildschirmdiagonale": "60,5 cm",
        "Bildschirmform": "Flach",
        "Bildschirmtechnologie": "LED",
        "Bildwinkel, horizontal": "178 \u00b0",
        "Bildwinkel, vertikal": "160 \u00b0",
        "Breite (ohne Standfu\u00df)": "53,9 cm",
        "DVI Anschluss": "Nein",
        "DisplayPorts-Version": "1.2",
        "Energieeffizienzklasse (alt)": "A",
        "Externes Netzteil": "Nein",
        "Farbtiefe": "6 Bit",
        "Flimmerfreie Technologie": "Ja",
        "Fu\u00dffarbe": "Schwarz/Rot",
        "Garantiekarte": "Ja",
        "Gewicht (mit St\u00e4nder)": "4,42 kg",
        "Gewicht (ohne St\u00e4nder)": "2,95 kg",
        "HD-Typ": "Full HD",
        "HDMI": "Ja",
        "HDMI-Version": "2.0",
        "Helligkeit (typisch)": "350 cd/m\u00b2",
        "Horizontaler Scanbereich": "30 - 280 kHz",
        "H\u00f6he (ohne Standfu\u00df)": "32,2 cm",
        "H\u00f6henverstellung": "Ja",
        "Integrierter USB-Hub": "Nein",
        "J\u00e4hrlicher Energieverbrauch": "32 kWh",
        "Kontrastverh\u00e4ltnis": "1000:1",
        "Kontrastverh\u00e4ltnis (dynamisch)": "80000000:1",
        "Kopfh\u00f6rer-Anschluss": "3,5 mm",
        "Kopfh\u00f6rerausgang": "Ja",
        "Marktpositionierung": "Gaming",
        "Maximale Bildwiederholrate": "240 Hz",
        "Men\u00fcsprachen": "Simplified Chinese, Traditional Chinese, Czech, German, Dutch, English, Spanish, Finnish, French, Italian, Japanese, Korean, Polish, Portuguese, Russian, Swedish",
        "Mikrofon-Eingang": "Ja",
        "Mitgelieferte Kabel": "DisplayPort,HDMI",
        "Nachhaltigkeitszertifikate": "RoHS, ENERGY STAR",
        "Natives Seitenverh\u00e4ltnis": "16:9",
        "Neigungswinkelbereich": "-4 - 21,5 \u00b0",
        "Oberfl\u00e4chenh\u00e4rte": "3H",
        "On-Screen-Display (OSD)": "Ja",
        "Paketgewicht": "6,5 kg",
        "Panel-Montage-Schnittstelle": "100 x 100 mm",
        "Panel-Typ": "IPS",
        "Pixel Abstand": "0,275 x 0,275 mm",
        "Produktfarbe": "Black, Red",
        "Rahmenloses Design": "Ja",
        "Reaktionszeit": "0,5 ms",
        "Recycelbares Verpackungsmaterial": "100 %",
        "Schwermetallfrei": "Hg (Quecksilber)",
        "Sichtbare Gr\u00f6\u00dfe (horizontal)": "52,7 cm",
        "Sichtbare Gr\u00f6\u00dfe (vertikal)": "29,6 cm",
        "Stromverbrauch (Standardbetrieb)": "25 W",
        "Stromverbrauch (Standby)": "0,3 W",
        "Stromverbrauch (aus)": "0,3 W",
        "St\u00e4nder enthalten": "Ja",
        "Tiefe (ohne Standfu\u00df)": "4,9 cm",
        "Typ der Hintergrundbeleuchtung": "W-LED",
        "Unterst\u00fctzte Grafik-Aufl\u00f6sungen": "1920 x 1080 (HD 1080)",
        "Unterst\u00fctzte Video-Modi": "1080p",
        "VESA-Halterung": "Ja",
        "Verpackungsart": "Box",
        "Verpackungsbreite": "605 mm",
        "Verpackungsh\u00f6he": "492 mm",
        "Verpackungstiefe": "184 mm",
        "Vorderer Rahmen": "Schwarz",
        "Zertifizierung": "ISO",
        "kippbar": "Ja",
        "sRGB Abdeckung (klassisch)": "105 %"
    },
    "raw_specifications_text": "Bildschirmdiagonale: 60,5 cm\nBildschirmaufl\u00f6sung: 1920 x 1080 Pixel\nHD-Typ: Full HD\nBildschirmtechnologie: LED\nReaktionszeit: 0,5 ms\nNatives Seitenverh\u00e4ltnis: 16:9\nBildwinkel, horizontal: 178 \u00b0\nBildwinkel, vertikal: 160 \u00b0\nVESA-Halterung: Ja\nH\u00f6henverstellung: Ja\nProduktfarbe: Black, Red\nAMD FreeSync: Ja\nAMD FreeSync-Typ: FreeSync Premium\nAMD FreeSync Bildwiederholratenbereich: 48 - 240 Hz\nFlimmerfreie Technologie: Ja\nPanel-Typ: IPS\nHelligkeit (typisch): 350 cd/m\u00b2\nTyp der Hintergrundbeleuchtung: W-LED\nBildschirmform: Flach\nUnterst\u00fctzte Grafik-Aufl\u00f6sungen: 1920 x 1080 (HD 1080)\nUnterst\u00fctzte Video-Modi: 1080p\nKontrastverh\u00e4ltnis: 1000:1\nKontrastverh\u00e4ltnis (dynamisch): 80000000:1\nMaximale Bildwiederholrate: 240 Hz\nAnzahl der Farben des Displays: 16,78 Millionen Farben\nPixel Abstand: 0,275 x 0,275 mm\nHorizontaler Scanbereich: 30 - 280 kHz\nSichtbare Gr\u00f6\u00dfe (horizontal): 52,7 cm\nSichtbare Gr\u00f6\u00dfe (vertikal): 29,6 cm\nOberfl\u00e4chenh\u00e4rte: 3H\nFarbtiefe: 6 Bit\nAbtastraten: 30 - 280 KHz, 48 - 240 Hz\nsRGB Abdeckung (klassisch): 105 %\nAdobe RGB-Abdeckung: 78 %\nIntegrierter USB-Hub: Nein\nDVI Anschluss: Nein\nHDMI: Ja\nAnzahl HDMI-Anschl\u00fcsse: 2\nHDMI-Version: 2.0\nAnzahl DisplayPort Anschl\u00fcsse: 1\nDisplayPorts-Version: 1.2\nAudioanschl\u00fcsse: Ja\nKopfh\u00f6rerausgang: Ja\nKopfh\u00f6rer-Anschluss: 3,5 mm\nMikrofon-Eingang: Ja\nPanel-Montage-Schnittstelle: 100 x 100 mm\nkippbar: Ja\nNeigungswinkelbereich: -4 - 21,5 \u00b0\nOn-Screen-Display (OSD): Ja\nMen\u00fcsprachen: Simplified Chinese, Traditional Chinese, Czech, German, Dutch, English, Spanish, Finnish, French, Italian, Japanese, Korean, Polish, Portuguese, Russian, Swedish\nAnzahl OSD-Sprachen: 16\nMarktpositionierung: Gaming\nRahmenloses Design: Ja\nVorderer Rahmen: Schwarz\nAbnehmbarer Standfu\u00df: Ja\nFu\u00dffarbe: Schwarz/Rot\nSchwermetallfrei: Hg (Quecksilber)\nZertifizierung: ISO\nSt\u00e4nder enthalten: Ja\nMitgelieferte Kabel: DisplayPort,HDMI\nGarantiekarte: Ja\nVerpackungsbreite: 605 mm\nVerpackungstiefe: 184 mm\nVerpackungsh\u00f6he: 492 mm\nPaketgewicht: 6,5 kg\nVerpackungsart: Box\nStromverbrauch (Standardbetrieb): 25 W\nStromverbrauch (Standby): 0,3 W\nStromverbrauch (aus): 0,3 W\nAC Eingangsspannung: 100 - 240 V\nAC Eingangsfrequenz: 50/60 Hz\nJ\u00e4hrlicher Energieverbrauch: 32 kWh\nExternes Netzteil: Nein\nGewicht (mit St\u00e4nder): 4,42 kg\nBreite (ohne Standfu\u00df): 53,9 cm\nTiefe (ohne Standfu\u00df): 4,9 cm\nH\u00f6he (ohne Standfu\u00df): 32,2 cm\nGewicht (ohne St\u00e4nder): 2,95 kg\nNachhaltigkeitszertifikate: RoHS, ENERGY STAR\nRecycelbares Verpackungsmaterial: 100 %\nEnergieeffizienzklasse (alt): A",
    "reference_file": "offer_reference_1940.json",
    "shop_name": "TechnikLaden"
}