{
    "html_file": "offer_578_12.html",
    "name": "iiyama ProLite XCB3494WQSN-B5, 34\"",
    "offer_link": "https://www.amazon.de/dp/B0BNLB5CTF?linkCode=xm2&camp=2025&creative=165953&smid=A3JWKAKR8XB7XF&creativeASIN=B0BNLB5CTF&tag=geizhals1-21",
    "price": 425.55,
    "raw_specifications": {
        "ASIN": "B0BNLB5CTF",
        "Amazon Bestseller-Rang": "Nr. 20,170 in Computer & Zubeh\u00f6r (Siehe Top 100 in Computer & Zubeh\u00f6r)  Nr. 435 in Monitore",
        "Anzahl HDMI Schnittstellen": "\u200e1",
        "Anzahl USB 3.0 Schnittstellen": "\u200e3",
        "Artikelgewicht": "\u200e9,4 Kilograms",
        "Bildschirmaufl\u00f6sung": "\u200e3440 x 1440 @120Hz (4.9 megapixel UWQHD, DisplayPort & USB-C)",
        "Display-Gr\u00f6\u00dfe": "\u200e34 Zoll",
        "Durchschnittliche Kundenbewertung": "4,2  4,2 von 5 Sternen    \n    14 Sternebewertungen   \n\n\n 4,2 von 5 Sternen",
        "Farbe": "\u200eBlack",
        "Garantierte Software-Updates bis": "\u200eunbekannt",
        "Hersteller": "\u200eiiyama",
        "Im Angebot von Amazon.de seit": "31. Dezember 2022",
        "L\u00f6sung": "\u200e3440 x 1440 Pixels",
        "Marke": "\u200eiiyama",
        "Modell/Serie": "\u200eProLite",
        "Modellnummer": "\u200eXCB3494WQSN-B5",
        "Produktabmessungen": "\u200e80,95 x 23,95 x 58,1 cm; 9,4 Kilogramm",
        "Volt": "\u200e240 Volt"
    },
    "raw_specifications_text": "Marke: \u200eiiyama\nHersteller: \u200eiiyama\nModell/Serie: \u200eProLite\nProduktabmessungen: \u200e80,95 x 23,95 x 58,1 cm; 9,4 Kilogramm\nModellnummer: \u200eXCB3494WQSN-B5\nFarbe: \u200eBlack\nDisplay-Gr\u00f6\u00dfe: \u200e34 Zoll\nBildschirmaufl\u00f6sung: \u200e3440 x 1440 @120Hz (4.9 megapixel UWQHD, DisplayPort & USB-C)\nL\u00f6sung: \u200e3440 x 1440 Pixels\nAnzahl USB 3.0 Schnittstellen: \u200e3\nAnzahl HDMI Schnittstellen: \u200e1\nVolt: \u200e240 Volt\nArtikelgewicht: \u200e9,4 Kilograms\nGarantierte Software-Updates bis: \u200eunbekannt\nASIN: B0BNLB5CTF\nDurchschnittliche Kundenbewertung: 4,2  4,2 von 5 Sternen    \n    14 Sternebewertungen   \n\n\n 4,2 von 5 Sternen\nAmazon Bestseller-Rang: Nr. 20,170 in Computer & Zubeh\u00f6r (Siehe Top 100 in Computer & Zubeh\u00f6r)  Nr. 435 in Monitore\nIm Angebot von Amazon.de seit: 31. Dezember 2022",
    "reference_file": "offer_reference_578.json",
    "shop_name": "Amazon.at"
}