{
    "html_file": "offer_1180_25.html",
    "name": "Dell S2722DZ, 27\"",
    "offer_link": "https://www.electronicshop24.at/product_info.php?products_id=20000001349593811&ano=I1349593811&mno=DELL-S2722DZ&ean=5397184567630&utm_medium=cpc&utm_campaign=preisvergleich&utm_content=item&utm_source=geizhals&ref=geizhals",
    "price": 368.0,
    "raw_specifications": {
        "Abmessungen (Breite x Tiefe x H\u00f6he)": "61.16 cm x 17.47 cm x 40 cm - mit Standfu\u00df (niedrigste Position)",
        "Adaptive-Sync Technologie": "AMD FreeSync",
        "Ausgangsleistung/Kanal": "5 Watt",
        "Besonderheiten": "LED-Randlichtsystem, flimmerfreie Technologie, ohne Quecksilber, arsenfreies Glas, Dell Easy Arrange, Low Blue Light-Technologie, an 3 Seiten ohne Blende, Dell ComfortView Plus",
        "Bildschirmbeschichtung": "Anti-glare 3H hardness",
        "Bildschirmtyp": "IPS",
        "Details zu Abmessungen & Gewicht": "Mit Standfu\u00df (niedrigste Position) - Breite: 61.16 cm - Tiefe: 17.47 cm - H\u00f6he: 40 cm - Gewicht: 6.86 kg \u00a6 Mit Standfu\u00df (h\u00f6chste Position) - Breite: 61.16 cm - Tiefe: 17.47 cm - H\u00f6he: 51 cm - Gewicht: 6.86 kg \u00a6 Ohne Fu\u00df - Breite: 61.16 cm - Tiefe: 5.674 cm - H\u00f6he: 36.584 cm - Gewicht: 5.18 kg",
        "Diagonalabmessung": "68.47 cm (27\")",
        "Display-Typ": "LED-hintergrundbeleuchteter LCD-Monitor / TFT-Aktivmatrix",
        "ENERGY STAR zertifiziert": "Ja",
        "Eingangsspannung": "Wechselstrom 100-240 V (50/60 Hz)",
        "Einstellungen der Anzeigeposition": "H\u00f6he, Pivot (Rotation), Drehung, Neigung",
        "Energie Effizienzklasse": "Klasse F",
        "Enthaltene Kabel": "1 x USB-C 3.2 Gen 1 Kabel - 1.8 m",
        "Farbraum": "99% sRGB",
        "Farbunterst\u00fctzung": "16,7 Millionen Farben",
        "Helligkeit": "350 cd/m\u00b2",
        "Hintergrundbeleuchtungs-Technologie": "WLED Edgelight-Hintergrundbeleuchtung",
        "Horizontale Bildwiederholrate": "30 - 120 kHz",
        "Horizontaler Betrachtungswinkel": "178",
        "H\u00f6heneinstellung": "110 mm",
        "Integrierte Peripherieger\u00e4te": "IR-Kamera, USB 3.2 Gen 1/USB-C Hub",
        "Kennzeichnung": "RoHS, DisplayPort 1.2, BFR-frei, HDCP 1.4, PVC-free",
        "Kontrast": "1000:1",
        "Leistungsaufnahme im Ein-Zustand": "18.26 W",
        "Leistungsmerkmale": "Slot f\u00fcr Sicherheitsschloss (Kabelschloss getrennt erh\u00e4ltlich), integrierte Kabelf\u00fchrung, Unterst\u00fctzung f\u00fcr VESA-Schnittstelle",
        "Max. Betriebstemperatur": "40 \u00b0C",
        "Max. Videoaufl\u00f6sung": "1920 x 1080 bei 30 BpS",
        "Mikrofonfunktionen": "Ger\u00e4uschunterdr\u00fcckung",
        "Min Betriebstemperatur": "0 \u00b0C",
        "Mitgelieferte Software": "Dell Display Manager",
        "Native Aufl\u00f6sung": "QHD 2560 x 1440 bei 75 Hz",
        "Neigungswinkel": "-5/+21",
        "Pixelpitch": "0.2331 mm",
        "Ppi": "108.79",
        "Reaktionszeit": "4 ms (Grau-zu-Grau extrem)",
        "Rotationswinkel": "180",
        "Schlosstyp zur Diebstahlsicherung": "Kensington Slot",
        "Schnittstellen": "HDMI (HDCP 1.4) \u00a6 DisplayPort 1.2 (HDCP 1.4) \u00a6 USB-C 3.2 Gen 1 Upstream/DisplayPort 1.2 Alt Mode mit Spannungsversorgung (bis zu 65 W) \u00a6 USB 3.2 Gen 1 Downstream mit Battery Charging 1.2 \u00a6 USB 3.2 Gen 1 Downstream \u00a6 Audio Line-Out",
        "Schwenkwinkel": "60",
        "Seitenverh\u00e4ltnis": "16:9",
        "Sensoraufl\u00f6sung": "5 Megapixel",
        "Services im Bundle": "3 Jahre erweiterte Basisaustauschgew\u00e4hrleistung",
        "Stromverbrauch (Aus-Modus)": "0.2 Watt",
        "Stromverbrauch (max.)": "149 Watt",
        "Stromverbrauch SDR (eingeschaltet)": "24 kWh/1.000 h",
        "Stromverbrauch im Standby-Modus": "0.3 Watt",
        "Transportgewicht": "9.46 kg",
        "Typ": "Lautsprecher - Stereo",
        "USB-Spannungsversorgung": "65 Watt",
        "VESA-Halterung": "100 x 100 mm",
        "Vertikale Bildwiederholrate": "48 - 75 Hz",
        "Vertikaler Betrachtungswinkel": "178",
        "Zul\u00e4ssige Luftfeuchtigkeit im Betrieb": "10 - 80% (nicht kondensierend)"
    },
    "raw_specifications_text": "Display-Typ: LED-hintergrundbeleuchteter LCD-Monitor / TFT-Aktivmatrix\nEnergie Effizienzklasse: Klasse F\nDiagonalabmessung: 68.47 cm (27\")\nAdaptive-Sync Technologie: AMD FreeSync\nIntegrierte Peripherieger\u00e4te: IR-Kamera, USB 3.2 Gen 1/USB-C Hub\nUSB-Spannungsversorgung: 65 Watt\nBildschirmtyp: IPS\nSeitenverh\u00e4ltnis: 16:9\nNative Aufl\u00f6sung: QHD 2560 x 1440 bei 75 Hz\nPixelpitch: 0.2331 mm\nPpi: 108.79\nHelligkeit: 350 cd/m\u00b2\nKontrast: 1000:1\nFarbunterst\u00fctzung: 16,7 Millionen Farben\nFarbraum: 99% sRGB\nReaktionszeit: 4 ms (Grau-zu-Grau extrem)\nVertikale Bildwiederholrate: 48 - 75 Hz\nHorizontale Bildwiederholrate: 30 - 120 kHz\nHorizontaler Betrachtungswinkel: 178\nVertikaler Betrachtungswinkel: 178\nBildschirmbeschichtung: Anti-glare 3H hardness\nHintergrundbeleuchtungs-Technologie: WLED Edgelight-Hintergrundbeleuchtung\nBesonderheiten: LED-Randlichtsystem, flimmerfreie Technologie, ohne Quecksilber, arsenfreies Glas, Dell Easy Arrange, Low Blue Light-Technologie, an 3 Seiten ohne Blende, Dell ComfortView Plus\nAbmessungen (Breite x Tiefe x H\u00f6he): 61.16 cm x 17.47 cm x 40 cm - mit Standfu\u00df (niedrigste Position)\nSensoraufl\u00f6sung: 5 Megapixel\nMax. Videoaufl\u00f6sung: 1920 x 1080 bei 30 BpS\nLeistungsmerkmale: Slot f\u00fcr Sicherheitsschloss (Kabelschloss getrennt erh\u00e4ltlich), integrierte Kabelf\u00fchrung, Unterst\u00fctzung f\u00fcr VESA-Schnittstelle\nTyp: Lautsprecher - Stereo\nMikrofonfunktionen: Ger\u00e4uschunterdr\u00fcckung\nAusgangsleistung/Kanal: 5 Watt\nSchnittstellen: HDMI (HDCP 1.4) \u00a6 DisplayPort 1.2 (HDCP 1.4) \u00a6 USB-C 3.2 Gen 1 Upstream/DisplayPort 1.2 Alt Mode mit Spannungsversorgung (bis zu 65 W) \u00a6 USB 3.2 Gen 1 Downstream mit Battery Charging 1.2 \u00a6 USB 3.2 Gen 1 Downstream \u00a6 Audio Line-Out\nEinstellungen der Anzeigeposition: H\u00f6he, Pivot (Rotation), Drehung, Neigung\nNeigungswinkel: -5/+21\nSchwenkwinkel: 60\nRotationswinkel: 180\nH\u00f6heneinstellung: 110 mm\nVESA-Halterung: 100 x 100 mm\nEnthaltene Kabel: 1 x USB-C 3.2 Gen 1 Kabel - 1.8 m\nKennzeichnung: RoHS, DisplayPort 1.2, BFR-frei, HDCP 1.4, PVC-free\nSchlosstyp zur Diebstahlsicherung: Kensington Slot\nEingangsspannung: Wechselstrom 100-240 V (50/60 Hz)\nLeistungsaufnahme im Ein-Zustand: 18.26 W\nStromverbrauch SDR (eingeschaltet): 24 kWh/1.000 h\nStromverbrauch (max.): 149 Watt\nStromverbrauch im Standby-Modus: 0.3 Watt\nStromverbrauch (Aus-Modus): 0.2 Watt\nMitgelieferte Software: Dell Display Manager\nDetails zu Abmessungen & Gewicht: Mit Standfu\u00df (niedrigste Position) - Breite: 61.16 cm - Tiefe: 17.47 cm - H\u00f6he: 40 cm - Gewicht: 6.86 kg \u00a6 Mit Standfu\u00df (h\u00f6chste Position) - Breite: 61.16 cm - Tiefe: 17.47 cm - H\u00f6he: 51 cm - Gewicht: 6.86 kg \u00a6 Ohne Fu\u00df - Breite: 61.16 cm - Tiefe: 5.674 cm - H\u00f6he: 36.584 cm - Gewicht: 5.18 kg\nTransportgewicht: 9.46 kg\nENERGY STAR zertifiziert: Ja\nServices im Bundle: 3 Jahre erweiterte Basisaustauschgew\u00e4hrleistung\nMin Betriebstemperatur: 0 \u00b0C\nMax. Betriebstemperatur: 40 \u00b0C\nZul\u00e4ssige Luftfeuchtigkeit im Betrieb: 10 - 80% (nicht kondensierend)",
    "reference_file": "offer_reference_1180.json",
    "shop_name": "ElectronicShop24"
}