{
    "html_file": "offer_765_7.html",
    "name": "ASUS VP227HE, 21.5\"",
    "offer_link": "https://www.mylemon.at/artikel/asus/90lm0880_b01170/54-4cm-essential-vp227he-d.html",
    "price": 137.89,
    "raw_specifications": {
        "AC Eingangsfrequenz": "50 - 60 Hz",
        "AC Eingangsspannung": "100 - 240 V",
        "AMD FreeSync": "Ja",
        "AMD FreeSync-Typ": "FreeSync",
        "Anzahl HDMI-Anschl\u00fcsse": "1",
        "Anzahl VGA (D-Sub) Anschl\u00fcsse": "1",
        "Anzahl der Farben des Displays": "16,7 Millionen Farben",
        "Artikelnummer": "M1EY5B1L",
        "Aufl\u00f6sung": "1920x1080",
        "Besonderheiten": "75 Hz",
        "Bildschirmdiagonale": "54,5 cm (21.4\")",
        "Bildschirmform": "Flach",
        "Bildwinkel, vertikal": "178\u00b0",
        "Breite (ohne Standfu\u00df)": "494 mm",
        "Digital horizontale Frequenz": "24 - 84 kHz",
        "Digital vertikale Frequenz": "48 - 75 Hz",
        "Display-Aufl\u00f6sung": "1920 x 1080 Pixel",
        "Displaygr\u00f6\u00dfe": "21,5 Zoll",
        "Dynamisches Kontrastverh\u00e4ltnis Marketingbezeichnung": "ASUS Smart Contrast Ratio (ASCR)",
        "EAN": "4711081714149",
        "Eingebaute Lautsprecher": "Nein",
        "Ergonomie": "Neigbar",
        "Flimmerfreie Technologie": "Ja",
        "Fu\u00dffarbe": "Schwarz",
        "Ger\u00e4tebreite (inkl. Fu\u00df)": "494 mm",
        "Ger\u00e4teh\u00f6he (inkl. Fu\u00df)": "355,6 mm",
        "Ger\u00e4tetiefe (inkl. Fu\u00df)": "204,4 mm",
        "Gewicht (mit St\u00e4nder)": "2,79 kg",
        "Gewicht (ohne St\u00e4nder)": "2,4 kg",
        "HD-Typ": "Full HD",
        "HDCP": "Ja",
        "HDCP-Version": "1.4",
        "HDMI": "Ja",
        "HDMI-Version": "1.4",
        "Helligkeit": "250 cd/m\u00b2",
        "Helligkeit (typisch)": "250 cd/m\u00b2",
        "Hersteller Artikelnummer": "90LM0880-B01170",
        "H\u00f6he (ohne Standfu\u00df)": "290,9 mm",
        "H\u00f6henverstellung": "Nein",
        "Integrierte Kamera": "Nein",
        "Integrierter USB-Hub": "Nein",
        "Kabelsperre-Slot": "Ja",
        "Kontrastverh\u00e4ltnis": "3000:1",
        "Kontrastverh\u00e4ltnis (dynamisch)": "100000000:1",
        "Kopfh\u00f6rerausgang": "Nein",
        "Low-Blue-Light-Technologie": "Ja",
        "Marktpositionierung": "Haus",
        "Maximale Bildwiederholrate": "75 Hz",
        "Mitgelieferte Kabel": "AC",
        "NVIDIA G-SYNC": "Nein",
        "Natives Seitenverh\u00e4ltnis": "16:9",
        "Neigungsverstellung": "Ja",
        "Neigungswinkelbereich": "23 - -5\u00b0",
        "Paketgewicht": "4,59 kg",
        "Panel": "VA",
        "Panel-Montage-Schnittstelle": "100 x 100 mm",
        "Panel-Typ": "VA",
        "Pixel Abstand": "0,249 x 0,249 mm",
        "Produktfarbe": "Schwarz",
        "Reaktionszeit": "5 ms",
        "Schnellstart\u00fcbersicht": "Ja",
        "Seitenverh\u00e4ltnis": "16:9",
        "Sichtbare Gr\u00f6\u00dfe (horizontal)": "47,9 cm",
        "Sichtbare Gr\u00f6\u00dfe (vertikal)": "26 cm",
        "Slot-Typ Kabelsperre": "Kensington",
        "Stromverbrauch (PowerSave)": "0,5 W",
        "Stromverbrauch (Standardbetrieb)": "16 W",
        "Stromverbrauch (aus)": "0,3 W",
        "Tiefe (ohne Standfu\u00df)": "51,3 mm",
        "Touchscreen": "Nein",
        "Typ der Hintergrundbeleuchtung": "LED",
        "VESA Adaptive Sync unterst\u00fctzt": "Ja",
        "VESA Halterung": "100x100 mm",
        "VESA-Halterung": "Ja",
        "Verpackungsbreite": "565 mm",
        "Verpackungsh\u00f6he": "412 mm",
        "Verpackungstiefe": "133 mm",
        "Video Anschl\u00fcsse": "1x VGA, 1x HDMI"
    },
    "raw_specifications_text": "Displaygr\u00f6\u00dfe: 21,5 Zoll\nAufl\u00f6sung: 1920x1080\nPanel: VA\nReaktionszeit: 5 ms\nVideo Anschl\u00fcsse: 1x VGA, 1x HDMI\nErgonomie: Neigbar\nVESA Halterung: 100x100 mm\nHelligkeit: 250 cd/m\u00b2\nBesonderheiten: 75 Hz\nHersteller Artikelnummer: 90LM0880-B01170\nEAN: 4711081714149\nArtikelnummer: M1EY5B1L\nBildschirmdiagonale: 54,5 cm (21.4\")\nDisplay-Aufl\u00f6sung: 1920 x 1080 Pixel\nNatives Seitenverh\u00e4ltnis: 16:9\nTouchscreen: Nein\nHD-Typ: Full HD\nPanel-Typ: VA\nBildschirmform: Flach\nKontrastverh\u00e4ltnis: 3000:1\nMaximale Bildwiederholrate: 75 Hz\nAnzahl der Farben des Displays: 16,7 Millionen Farben\nTyp der Hintergrundbeleuchtung: LED\nHelligkeit (typisch): 250 cd/m\u00b2\nSeitenverh\u00e4ltnis: 16:9\nKontrastverh\u00e4ltnis (dynamisch): 100000000:1\nDynamisches Kontrastverh\u00e4ltnis Marketingbezeichnung: ASUS Smart Contrast Ratio (ASCR)\nBildwinkel, vertikal: 178\u00b0\nPixel Abstand: 0,249 x 0,249 mm\nSichtbare Gr\u00f6\u00dfe (horizontal): 47,9 cm\nSichtbare Gr\u00f6\u00dfe (vertikal): 26 cm\nDigital horizontale Frequenz: 24 - 84 kHz\nDigital vertikale Frequenz: 48 - 75 Hz\nNVIDIA G-SYNC: Nein\nAMD FreeSync: Ja\nAMD FreeSync-Typ: FreeSync\nVESA Adaptive Sync unterst\u00fctzt: Ja\nFlimmerfreie Technologie: Ja\nLow-Blue-Light-Technologie: Ja\nEingebaute Lautsprecher: Nein\nIntegrierte Kamera: Nein\nMarktpositionierung: Haus\nProduktfarbe: Schwarz\nFu\u00dffarbe: Schwarz\nIntegrierter USB-Hub: Nein\nHDMI: Ja\nKopfh\u00f6rerausgang: Nein\nAnzahl VGA (D-Sub) Anschl\u00fcsse: 1\nAnzahl HDMI-Anschl\u00fcsse: 1\nHDMI-Version: 1.4\nHDCP: Ja\nHDCP-Version: 1.4\nVESA-Halterung: Ja\nKabelsperre-Slot: Ja\nH\u00f6henverstellung: Nein\nPanel-Montage-Schnittstelle: 100 x 100 mm\nSlot-Typ Kabelsperre: Kensington\nNeigungswinkelbereich: 23 - -5\u00b0\nNeigungsverstellung: Ja\nStromverbrauch (Standardbetrieb): 16 W\nStromverbrauch (aus): 0,3 W\nStromverbrauch (PowerSave): 0,5 W\nAC Eingangsspannung: 100 - 240 V\nAC Eingangsfrequenz: 50 - 60 Hz\nMitgelieferte Kabel: AC\nSchnellstart\u00fcbersicht: Ja\nGer\u00e4tebreite (inkl. Fu\u00df): 494 mm\nGer\u00e4tetiefe (inkl. Fu\u00df): 204,4 mm\nGer\u00e4teh\u00f6he (inkl. Fu\u00df): 355,6 mm\nGewicht (mit St\u00e4nder): 2,79 kg\nBreite (ohne Standfu\u00df): 494 mm\nTiefe (ohne Standfu\u00df): 51,3 mm\nH\u00f6he (ohne Standfu\u00df): 290,9 mm\nGewicht (ohne St\u00e4nder): 2,4 kg\nVerpackungsbreite: 565 mm\nVerpackungstiefe: 133 mm\nVerpackungsh\u00f6he: 412 mm\nPaketgewicht: 4,59 kg",
    "reference_file": "offer_reference_765.json",
    "shop_name": "mylemon.at"
}