{
    "html_file": "offer_982_14.html",
    "name": "Samsung Smart Monitor M5 M50B wei\u00df, 27\"",
    "offer_link": "https://www.hiq24.de/shop/artikel/319797/?sPartner=geizhals",
    "price": 198.9,
    "raw_specifications": {
        "Abmessungen (Breite x Tiefe x H\u00f6he)": "61.55 cm x 19.35 cm x 45.54 cm - mit Fu\u00df",
        "Abmessungen (Breite x Tiefe x H\u00f6he) - mit Fu\u00df": "61.55 cm x 19.35 cm x 45.54 cm",
        "Besonderheiten": "Spielmodus, ConnectShare, flimmerfreie Technologie, Eye Saver Mode, DLNA, Auto Source Switch+, Adaptive Picture, Ultrawide Game View, Tizen Platform, Tap View, Remote Access, Sound Mirroring, SmartThings App Support, Adaptive Sound, Game Bar 2.0",
        "Bildschirmtyp": "VA",
        "Details zu Abmessungen & Gewicht": "Mit Fu\u00df - Breite: 61.55 cm - Tiefe: 19.35 cm - H\u00f6he: 45.54 cm - Gewicht: 5 kg  Ohne Fu\u00df - Breite: 61.55 cm - Tiefe: 4.18 cm - H\u00f6he: 36.79 cm - Gewicht: 3.9 kg",
        "Diagonalabmessung": "68.6 cm (27\")",
        "Display-Typ": "LED-hintergrundbeleuchteter LCD-Monitor / TFT-Aktivmatrix - Smart Monitor",
        "Eingangsanschl\u00fcsse": "2xHDMI",
        "Eingangsspannung": "Wechselstrom 100-240 V (50/60 Hz)",
        "Einstellungen der Anzeigeposition": "Neigung",
        "Energie Effizienzklasse": "Klasse F",
        "Energieklasse (HDR)": "Klasse G",
        "Energieverbrauch pro Jahr": "38 kWh",
        "Enthaltene Kabel": "1 x HDMI-Kabel",
        "Farbe": "Wei\u00df",
        "Farbunterst\u00fctzung": "1,07 Mrd. Farben",
        "Ger\u00e4tetyp": "LED-hintergrundbeleuchteter LCD-Monitor - 68.6 cm (27\") - Smart Monitor",
        "Gewicht": "5 kg",
        "HDR-Format": "HDR10",
        "HDR-f\u00e4hig": "HDR10",
        "Helligkeit": "250 cd/m\u00b2",
        "Hintergrundbeleuchtungs-Technologie": "LED-Hintergrundbeleuchtung",
        "Horizontaler Betrachtungswinkel": "178",
        "Integrierte Peripherieger\u00e4te": "USB Hub, Wi-Fi, Bluetooth 4.2 Adapter",
        "Kennzeichnung": "CEC",
        "Kontrast": "3000:1",
        "Leistungsmerkmale": "USB Hub, Wi-Fi, Bluetooth 4.2 Adapter",
        "Max. Betriebstemperatur": "40 \u00b0C",
        "Min Betriebstemperatur": "10 \u00b0C",
        "Native Aufl\u00f6sung": "Full HD (1080p) 1920 x 1080 bei 60 Hz",
        "Neigungswinkel": "-2/+22",
        "Pixelpitch": "0.3113 mm",
        "Produktbeschreibung": "Samsung S27BM501EU - M50B Series - LED-Monitor - Full HD (1080p) - 68.6 cm (27\") - HDR",
        "Reaktionszeit": "4 ms (gray-to-gray)",
        "Schlosstyp zur Diebstahlsicherung": "Kensington Slot",
        "Schnittstellen": "2 x HDMI  2 x USB",
        "Seitenverh\u00e4ltnis": "16:9",
        "Spannung": "Wechselstrom 100-240 V (50/60 Hz)",
        "Stromverbrauch (max.)": "50 Watt",
        "Stromverbrauch (typisch)": "26 Watt",
        "Stromverbrauch HDR (eingeschaltet)": "33 kWh/1.000 h",
        "Stromverbrauch SDR (eingeschaltet)": "26 kWh/1.000 h",
        "Stromverbrauch im Standby-Modus": "0.5 Watt",
        "Transportbreite": "73.8 cm",
        "Transportgewicht": "6.2 kg",
        "Transporth\u00f6he": "12.6 cm",
        "Transporttiefe": "42.8 cm",
        "Typ": "Lautsprecher",
        "VESA-Halterung": "100 x 100 mm",
        "Vertikaler Betrachtungswinkel": "178",
        "Zubeh\u00f6r im Lieferumfang": "Fernbedienung",
        "Zul\u00e4ssige Luftfeuchtigkeit im Betrieb": "10 - 80% (nicht kondensierend)"
    },
    "raw_specifications_text": "Display-Typ: LED-hintergrundbeleuchteter LCD-Monitor / TFT-Aktivmatrix - Smart Monitor\nEnergie Effizienzklasse: Klasse F\nEnergieklasse (HDR): Klasse G\nEnergieverbrauch pro Jahr: 38 kWh\nDiagonalabmessung: 68.6 cm (27\")\nIntegrierte Peripherieger\u00e4te: USB Hub, Wi-Fi, Bluetooth 4.2 Adapter\nBildschirmtyp: VA\nSeitenverh\u00e4ltnis: 16:9\nNative Aufl\u00f6sung: Full HD (1080p) 1920 x 1080 bei 60 Hz\nPixelpitch: 0.3113 mm\nHelligkeit: 250 cd/m\u00b2\nKontrast: 3000:1\nHDR-Format: HDR10\nFarbunterst\u00fctzung: 1,07 Mrd. Farben\nReaktionszeit: 4 ms (gray-to-gray)\nHorizontaler Betrachtungswinkel: 178\nVertikaler Betrachtungswinkel: 178\nHintergrundbeleuchtungs-Technologie: LED-Hintergrundbeleuchtung\nBesonderheiten: Spielmodus, ConnectShare, flimmerfreie Technologie, Eye Saver Mode, DLNA, Auto Source Switch+, Adaptive Picture, Ultrawide Game View, Tizen Platform, Tap View, Remote Access, Sound Mirroring, SmartThings App Support, Adaptive Sound, Game Bar 2.0\nFarbe: Wei\u00df\nAbmessungen (Breite x Tiefe x H\u00f6he): 61.55 cm x 19.35 cm x 45.54 cm - mit Fu\u00df\nGewicht: 5 kg\nTyp: Lautsprecher\nSchnittstellen: 2 x HDMI  2 x USB\nEinstellungen der Anzeigeposition: Neigung\nNeigungswinkel: -2/+22\nVESA-Halterung: 100 x 100 mm\nLeistungsmerkmale: USB Hub, Wi-Fi, Bluetooth 4.2 Adapter\nZubeh\u00f6r im Lieferumfang: Fernbedienung\nEnthaltene Kabel: 1 x HDMI-Kabel\nKennzeichnung: CEC\nSchlosstyp zur Diebstahlsicherung: Kensington Slot\nEingangsspannung: Wechselstrom 100-240 V (50/60 Hz)\nStromverbrauch SDR (eingeschaltet): 26 kWh/1.000 h\nStromverbrauch HDR (eingeschaltet): 33 kWh/1.000 h\nStromverbrauch (typisch): 26 Watt\nStromverbrauch (max.): 50 Watt\nStromverbrauch im Standby-Modus: 0.5 Watt\nDetails zu Abmessungen & Gewicht: Mit Fu\u00df - Breite: 61.55 cm - Tiefe: 19.35 cm - H\u00f6he: 45.54 cm - Gewicht: 5 kg  Ohne Fu\u00df - Breite: 61.55 cm - Tiefe: 4.18 cm - H\u00f6he: 36.79 cm - Gewicht: 3.9 kg\nTransportbreite: 73.8 cm\nTransporttiefe: 42.8 cm\nTransporth\u00f6he: 12.6 cm\nTransportgewicht: 6.2 kg\nMin Betriebstemperatur: 10 \u00b0C\nMax. Betriebstemperatur: 40 \u00b0C\nZul\u00e4ssige Luftfeuchtigkeit im Betrieb: 10 - 80% (nicht kondensierend)\nProduktbeschreibung: Samsung S27BM501EU - M50B Series - LED-Monitor - Full HD (1080p) - 68.6 cm (27\") - HDR\nGer\u00e4tetyp: LED-hintergrundbeleuchteter LCD-Monitor - 68.6 cm (27\") - Smart Monitor\nHDR-f\u00e4hig: HDR10\nEingangsanschl\u00fcsse: 2xHDMI\nSpannung: Wechselstrom 100-240 V (50/60 Hz)\nAbmessungen (Breite x Tiefe x H\u00f6he) - mit Fu\u00df: 61.55 cm x 19.35 cm x 45.54 cm",
    "reference_file": "offer_reference_982.json",
    "shop_name": "HiQ24"
}