{
    "html_file": "offer_1103_6.html",
    "name": "Dell E2222H, 21.5\"",
    "offer_link": "https://direkt.jacob.de/produkte/dell-e2222h-54-5-dell-e2222h-artnr-7512772.html?utm_source=geizhals&utm_medium=cpc&utm_campaign=Preisvergleich&ref=103",
    "price": 109.63,
    "raw_specifications": {
        "AC Eingangsfrequenz": "50/60 Hz",
        "AC Eingangsspannung": "100 - 240 V",
        "Abnehmbarer Standfu\u00df": "Ja",
        "Anzahl DisplayPort Anschl\u00fcsse": "1",
        "Anzahl VGA (D-Sub) Anschl\u00fcsse": "1",
        "Anzahl der Farben des Displays": "16,7 Millionen Farben",
        "Bezel Weite (bottom)": "1,69 cm",
        "Bezel Weite (side)": "1,28 cm",
        "Bezel Weite (top)": "1,28 cm",
        "Bildschirmaufl\u00f6sung": "1920 x 1080 Pixel",
        "Bildschirmdiagonale": "54,5 cm (21.4\" )",
        "Bildschirmdiagonale (cm)": "54,48 cm",
        "Bildschirmform": "Flach",
        "Bildschirmtechnologie": "LCD",
        "Blendfreier Bildschirm": "Ja",
        "Blickwinkel, horizontal": "178\u00b0",
        "Blickwinkel, vertikal": "178\u00b0",
        "Breite (ohne Standfu\u00df)": "50,4 cm",
        "DisplayPorts-Version": "1.2",
        "Eingebaute Lautsprecher": "Nein",
        "Energieeffizienzklasse (HDR)": "D",
        "Energieeffizienzskala": "A bis G",
        "Energieverbrauch (HDR) pro 1.000 Stunden": "12 kWh",
        "Enth\u00e4lt nicht": "PVC/BFR",
        "Farbskala": "72%",
        "Fu\u00dffarbe": "Schwarz",
        "Ger\u00e4tebreite (inkl. Fu\u00df)": "504,3 mm",
        "Ger\u00e4teh\u00f6he (inkl. Fu\u00df)": "384,2 mm",
        "Ger\u00e4tetiefe (inkl. Fu\u00df)": "171 mm",
        "Gewicht (mit St\u00e4nder)": "2,59 kg",
        "Gewicht (ohne St\u00e4nder)": "2,26 kg",
        "HD-Typ": "Full HD",
        "HDMI": "Nein",
        "Helligkeit (typisch)": "250 cd/m\u00b2",
        "Horizontaler Scanbereich": "30 - 83 kHz",
        "H\u00f6he (ohne Standfu\u00df)": "29,5 cm",
        "H\u00f6he bei Betrieb": "0 - 5000 m",
        "H\u00f6he bei Lagerung": "0 - 12192 m",
        "H\u00f6henverstellung": "Nein",
        "Integrierte Kamera": "Nein",
        "Kabelsperre-Slot": "Ja",
        "Kontrastverh\u00e4ltnis": "3000:1",
        "LED-Anzeigen": "Ja",
        "Luftfeuchtigkeit bei Lagerung": "5 - 90%",
        "Marktpositionierung": "Haus",
        "Maximale Bildwiederholrate": "60 Hz",
        "Mitgelieferte Kabel": "AC, DisplayPort, VGA",
        "Nachhaltigkeitszertifikate": "ENERGY STAR, RoHS",
        "Natives Seitenverh\u00e4ltnis": "16:9",
        "Neigungswinkelbereich": "5 - 21\u00b0",
        "On-Screen-Display (OSD)": "Ja",
        "Paketgewicht": "4,14 kg",
        "Panel-Montage-Schnittstelle": "100 x 100 mm",
        "Panel-Typ": "VA",
        "Pixel Abstand": "0,249 x 0,241 mm",
        "Pixeldichte": "103 ppi",
        "Plug & Play": "Ja",
        "Produktfarbe": "Schwarz",
        "RGB-Farbraum": "NTSC",
        "Reaktionszeit": "10 ms",
        "Reaktionszeit (schnell)": "5 ms",
        "Relative Luftfeuchtigkeit in Betrieb": "10 - 80%",
        "Schnellstart\u00fcbersicht": "Ja",
        "Schwermetallfrei": "Hg (Quecksilber)",
        "Sichtbare Gr\u00f6\u00dfe (horizontal)": "47,9 cm",
        "Sichtbare Gr\u00f6\u00dfe (vertikal)": "26 cm",
        "Stromeingang": "Ja",
        "Stromverbrauch (Standardbetrieb)": "12,1 W",
        "Stromverbrauch (Standby)": "0,3 W",
        "Stromverbrauch (aus)": "0,3 W",
        "Stromverbrauch (max.)": "19 W",
        "St\u00e4nder enthalten": "Ja",
        "Temperaturbereich bei Lagerung": "20 - 60 \u00b0C",
        "Temperaturbereich in Betrieb": "0 - 40 \u00b0C",
        "Tiefe (ohne Standfu\u00df)": "4,96 cm",
        "Typ der Hintergrundbeleuchtung": "LED",
        "VESA-Halterung": "Ja",
        "Vertikaler Scanbereich": "50 - 75 Hz",
        "Vorderer Rahmen": "Schwarz",
        "kippbar": "Ja"
    },
    "raw_specifications_text": "Bildschirmdiagonale: 54,5 cm (21.4\" )\nBildschirmaufl\u00f6sung: 1920 x 1080 Pixel\nNatives Seitenverh\u00e4ltnis: 16:9\nPanel-Typ: VA\nHD-Typ: Full HD\nBildschirmtechnologie: LCD\nBildschirmform: Flach\nKontrastverh\u00e4ltnis: 3000:1\nMaximale Bildwiederholrate: 60 Hz\nAnzahl der Farben des Displays: 16,7 Millionen Farben\nHelligkeit (typisch): 250 cd/m\u00b2\nReaktionszeit: 10 ms\nTyp der Hintergrundbeleuchtung: LED\nBlendfreier Bildschirm: Ja\nBlickwinkel, horizontal: 178\u00b0\nBlickwinkel, vertikal: 178\u00b0\nReaktionszeit (schnell): 5 ms\nPixel Abstand: 0,249 x 0,241 mm\nPixeldichte: 103 ppi\nHorizontaler Scanbereich: 30 - 83 kHz\nVertikaler Scanbereich: 50 - 75 Hz\nSichtbare Gr\u00f6\u00dfe (horizontal): 47,9 cm\nSichtbare Gr\u00f6\u00dfe (vertikal): 26 cm\nBildschirmdiagonale (cm): 54,48 cm\nRGB-Farbraum: NTSC\nFarbskala: 72%\nEingebaute Lautsprecher: Nein\nIntegrierte Kamera: Nein\nMarktpositionierung: Haus\nProduktfarbe: Schwarz\nVorderer Rahmen: Schwarz\nAbnehmbarer Standfu\u00df: Ja\nFu\u00dffarbe: Schwarz\nSchwermetallfrei: Hg (Quecksilber)\nHDMI: Nein\nAnzahl VGA (D-Sub) Anschl\u00fcsse: 1\nAnzahl DisplayPort Anschl\u00fcsse: 1\nDisplayPorts-Version: 1.2\nStromeingang: Ja\nVESA-Halterung: Ja\nKabelsperre-Slot: Ja\nH\u00f6henverstellung: Nein\nPanel-Montage-Schnittstelle: 100 x 100 mm\nkippbar: Ja\nNeigungswinkelbereich: 5 - 21\u00b0\nOn-Screen-Display (OSD): Ja\nPlug & Play: Ja\nLED-Anzeigen: Ja\nEnergieeffizienzklasse (HDR): D\nEnergieverbrauch (HDR) pro 1.000 Stunden: 12 kWh\nStromverbrauch (Standardbetrieb): 12,1 W\nStromverbrauch (Standby): 0,3 W\nStromverbrauch (max.): 19 W\nStromverbrauch (aus): 0,3 W\nAC Eingangsspannung: 100 - 240 V\nAC Eingangsfrequenz: 50/60 Hz\nEnergieeffizienzskala: A bis G\nTemperaturbereich in Betrieb: 0 - 40 \u00b0C\nTemperaturbereich bei Lagerung: 20 - 60 \u00b0C\nRelative Luftfeuchtigkeit in Betrieb: 10 - 80%\nLuftfeuchtigkeit bei Lagerung: 5 - 90%\nH\u00f6he bei Betrieb: 0 - 5000 m\nH\u00f6he bei Lagerung: 0 - 12192 m\nNachhaltigkeitszertifikate: ENERGY STAR, RoHS\nEnth\u00e4lt nicht: PVC/BFR\nGer\u00e4tebreite (inkl. Fu\u00df): 504,3 mm\nGer\u00e4tetiefe (inkl. Fu\u00df): 171 mm\nGer\u00e4teh\u00f6he (inkl. Fu\u00df): 384,2 mm\nGewicht (mit St\u00e4nder): 2,59 kg\nBreite (ohne Standfu\u00df): 50,4 cm\nTiefe (ohne Standfu\u00df): 4,96 cm\nH\u00f6he (ohne Standfu\u00df): 29,5 cm\nGewicht (ohne St\u00e4nder): 2,26 kg\nBezel Weite (side): 1,28 cm\nBezel Weite (top): 1,28 cm\nBezel Weite (bottom): 1,69 cm\nSt\u00e4nder enthalten: Ja\nMitgelieferte Kabel: AC, DisplayPort, VGA\nSchnellstart\u00fcbersicht: Ja\nPaketgewicht: 4,14 kg",
    "reference_file": "offer_reference_1103.json",
    "shop_name": "Jacob Elektronik direkt (AT)"
}