{
    "html_file": "offer_212_4.html",
    "name": "Samsung ViewFinity S8 S32B800PXP (2023), 32\"",
    "offer_link": "https://www.mylemon.at/artikel/samsung/ls32b800pxpxen/dis-32-s32b800pxp-ips.html",
    "price": 597.54,
    "raw_specifications": {
        "Anzahl der Upstream-Ports USB Typ-C": "1",
        "Artikelnummer": "M1FYK2DL",
        "Aufl\u00f6sung": "3840x2160",
        "Besonderheiten": "60 Hz, USB HUB",
        "Bild-in-Bild": "Ja",
        "Bildschirmdiagonale": "81,3 cm (32 Zoll)",
        "Bildschirmdiagonale (cm)": "81 cm",
        "Bildschirmform": "Flach",
        "Bildschirmtechnologie": "LED",
        "Display-Aufl\u00f6sung": "3840 x 2160 Pixel",
        "Display-Oberfl\u00e4che": "Matt",
        "Displaygr\u00f6\u00dfe": "32 Zoll",
        "EAN": "8806094926361",
        "Energieeffizienzklasse (HDR)": "G",
        "Energieeffizienzskala": "A bis G",
        "Energieverbrauch (HDR) pro 1.000 Stunden": "33 kWh",
        "Ergonomie": "H\u00f6henverstellbar, Pivot (90 Grad drehbar), Schwenkbar, Neigbar",
        "Flimmerfreie Technologie": "Ja",
        "HD-Typ": "4K Ultra HD",
        "Helligkeit": "350 cd/m\u00b2",
        "Hersteller Artikelnummer": "LS32B800PXPXEN",
        "High Dynamic Range Video (HDR) Unterst\u00fctzung": "Ja",
        "H\u00f6heneinstellung": "12 cm",
        "H\u00f6henverstellung": "Ja",
        "Marktpositionierung": "Haus",
        "Maximale Bildwiederholrate": "60 Hz",
        "Natives Seitenverh\u00e4ltnis": "16:9",
        "Neigungsverstellung": "Ja",
        "Panel": "IPS",
        "Panel-Montage-Schnittstelle": "100 x 100 mm",
        "Panel-Typ": "IPS",
        "Pivot": "Ja",
        "Pivot Winkel": "-2 - 92\u00b0",
        "Produktfarbe": "Schwarz",
        "Reaktionszeit": "5 ms",
        "Schwenkbar": "Ja",
        "Schwenkwinkelbereich": "-30 - 30\u00b0",
        "Spiel-Modus": "Ja",
        "Stromverbrauch (Standby)": "0,5 W",
        "Stromverbrauch (aus)": "0,3 W",
        "Technologie mit hohem Dynamikbereich (HDR)": "DisplayHDR 600",
        "Touchscreen": "Nein",
        "Unterst\u00fctzte Grafik-Aufl\u00f6sungen": "3840 x 2160",
        "VESA Halterung": "100x100 mm",
        "VESA-Halterung": "Ja",
        "Video Anschl\u00fcsse": "2x HDMI, 1x DisplayPort"
    },
    "raw_specifications_text": "Displaygr\u00f6\u00dfe: 32 Zoll\nAufl\u00f6sung: 3840x2160\nPanel: IPS\nReaktionszeit: 5 ms\nVideo Anschl\u00fcsse: 2x HDMI, 1x DisplayPort\nErgonomie: H\u00f6henverstellbar, Pivot (90 Grad drehbar), Schwenkbar, Neigbar\nVESA Halterung: 100x100 mm\nHelligkeit: 350 cd/m\u00b2\nBesonderheiten: 60 Hz, USB HUB\nHersteller Artikelnummer: LS32B800PXPXEN\nEAN: 8806094926361\nArtikelnummer: M1FYK2DL\nBildschirmdiagonale: 81,3 cm (32 Zoll)\nDisplay-Aufl\u00f6sung: 3840 x 2160 Pixel\nNatives Seitenverh\u00e4ltnis: 16:9\nBildschirmtechnologie: LED\nTouchscreen: Nein\nHD-Typ: 4K Ultra HD\nPanel-Typ: IPS\nBildschirmform: Flach\nMaximale Bildwiederholrate: 60 Hz\nDisplay-Oberfl\u00e4che: Matt\nUnterst\u00fctzte Grafik-Aufl\u00f6sungen: 3840 x 2160\nBildschirmdiagonale (cm): 81 cm\nHigh Dynamic Range Video (HDR) Unterst\u00fctzung: Ja\nTechnologie mit hohem Dynamikbereich (HDR): DisplayHDR 600\nFlimmerfreie Technologie: Ja\nSpiel-Modus: Ja\nMarktpositionierung: Haus\nProduktfarbe: Schwarz\nAnzahl der Upstream-Ports USB Typ-C: 1\nVESA-Halterung: Ja\nH\u00f6henverstellung: Ja\nPanel-Montage-Schnittstelle: 100 x 100 mm\nH\u00f6heneinstellung: 12 cm\nPivot: Ja\nPivot Winkel: -2 - 92\u00b0\nSchwenkbar: Ja\nSchwenkwinkelbereich: -30 - 30\u00b0\nBild-in-Bild: Ja\nNeigungsverstellung: Ja\nEnergieeffizienzklasse (HDR): G\nEnergieverbrauch (HDR) pro 1.000 Stunden: 33 kWh\nStromverbrauch (Standby): 0,5 W\nStromverbrauch (aus): 0,3 W\nEnergieeffizienzskala: A bis G",
    "reference_file": "offer_reference_212.json",
    "shop_name": "mylemon.at"
}