{
    "html_file": "offer_1167_3.html",
    "name": "LC-Power LC-M40-UWQHD-144, 40\"",
    "offer_link": "https://www.future-x.at/lc-power-led-monitor-101-6-cm-40-3440-x-1440-uwqhd-%40-144-hz-ads-ips-400-cd-m%B2-1200%3A1-hdr600-4-ms-2xhdmi-displayport-usb-c-wei%DF-p-9135511/?pv=2",
    "price": 461.59,
    "raw_specifications": {
        "Abmessungen (Breite x Tiefe x H\u00f6he)": "99,41 cm x 28,68 cm x 59,64 cm - mit Fu\u00df",
        "Adaptive-Sync Technologie": "AMD FreeSync Premium",
        "Besonderheiten": "Bild f\u00fcr Bild, Overdrive-Technologie, FPS Mode, RTS Mode, Picture-in-Picture, an 3 Seiten ohne Blende, GamePlus, Blaulichtfilter",
        "Bildschirmbeschichtung": "Blendfrei",
        "Bildschirmtyp": "ADS-IPS",
        "Details zu Abmessungen & Gewicht": "Mit Fu\u00df - Breite: 99,41 cm - Tiefe: 28,68 cm - H\u00f6he: 59,64 cm \u00a6 Ohne Fu\u00df - Breite: 99,41 cm - Tiefe: 8,24 cm - H\u00f6he: 41,83 cm",
        "Diagonalabmessung": "101,6 cm (40\")",
        "Display-Typ": "LED-hintergrundbeleuchteter LCD-Monitor / TFT-Aktivmatrix",
        "Eingangsspannung": "Wechselstrom 100-240 V (50/60 Hz)",
        "Einstellungen der Anzeigeposition": "H\u00f6he, Drehung, Neigung",
        "Energie Effizienzklasse": "Klasse G",
        "Energieklasse (HDR)": "Klasse G",
        "Enthaltene Kabel": "1 x DisplayPort-Kabel \u00a6 1 x HDMI-Kabel \u00a6 1 x USB-C Kabel",
        "Farbe": "Wei\u00df",
        "Farbraum": "105% NTSC (CIE 1976), 89% Adobe RGB, 95% DCI-P3, 99% sRGB",
        "Farbunterst\u00fctzung": "16,7 Millionen Farben",
        "HDR-Format": "HDR600",
        "Helligkeit": "400 cd/m\u00b2",
        "Hintergrundbeleuchtungs-Technologie": "Edge-LED-Beleuchtung",
        "Horizontaler Betrachtungswinkel": "178",
        "H\u00f6heneinstellung": "95 mm",
        "Kontrast": "1200:1",
        "Leistungsaufnahme im Ein-Zustand": "48 W",
        "Leistungsmerkmale": "RGB-Hintergrundbeleuchtung",
        "Montagekit": "Mitgeliefert",
        "Native Aufl\u00f6sung": "UWQHD 3440 x 1440 (DisplayPort: 144 Hz, HDMI: 100 Hz, USB-C: 60 Hz)",
        "Neigungswinkel": "-5/+15",
        "Pixelpitch": "0.26925 mm",
        "Reaktionszeit": "4 ms (Overdrive)",
        "Schnittstellen": "2 x HDMI \u00a6 DisplayPort 1.4 \u00a6 USB-C mit Stromversorgung \u00a6 Audio Line-Out (Mini-Klinkenstecker)",
        "Schwenkwinkel": "30",
        "Seitenverh\u00e4ltnis": "21:9",
        "Service und Support": "Begrenzte Garantie - 3 Jahre",
        "Stromverbrauch HDR (eingeschaltet)": "52 kWh/1.000 h",
        "Stromverbrauch SDR (eingeschaltet)": "48 kWh/1.000 h",
        "Stromverbrauch im Standby-Modus": "0.5 Watt",
        "Transportbreite": "121,5 cm",
        "Transportgewicht": "15,22 kg",
        "Transporth\u00f6he": "52,8 cm",
        "Transporttiefe": "20,3 cm",
        "USB-Spannungsversorgung": "90 Watt",
        "VESA-Halterung": "75 x 75 mm",
        "Vertikaler Betrachtungswinkel": "178"
    },
    "raw_specifications_text": "Display-Typ: LED-hintergrundbeleuchteter LCD-Monitor / TFT-Aktivmatrix\nEnergie Effizienzklasse: Klasse G\nEnergieklasse (HDR): Klasse G\nDiagonalabmessung: 101,6 cm (40\")\nAdaptive-Sync Technologie: AMD FreeSync Premium\nUSB-Spannungsversorgung: 90 Watt\nBildschirmtyp: ADS-IPS\nSeitenverh\u00e4ltnis: 21:9\nNative Aufl\u00f6sung: UWQHD 3440 x 1440 (DisplayPort: 144 Hz, HDMI: 100 Hz, USB-C: 60 Hz)\nPixelpitch: 0.26925 mm\nHelligkeit: 400 cd/m\u00b2\nKontrast: 1200:1\nHDR-Format: HDR600\nFarbunterst\u00fctzung: 16,7 Millionen Farben\nFarbraum: 105% NTSC (CIE 1976), 89% Adobe RGB, 95% DCI-P3, 99% sRGB\nReaktionszeit: 4 ms (Overdrive)\nHorizontaler Betrachtungswinkel: 178\nVertikaler Betrachtungswinkel: 178\nBildschirmbeschichtung: Blendfrei\nHintergrundbeleuchtungs-Technologie: Edge-LED-Beleuchtung\nBesonderheiten: Bild f\u00fcr Bild, Overdrive-Technologie, FPS Mode, RTS Mode, Picture-in-Picture, an 3 Seiten ohne Blende, GamePlus, Blaulichtfilter\nFarbe: Wei\u00df\nAbmessungen (Breite x Tiefe x H\u00f6he): 99,41 cm x 28,68 cm x 59,64 cm - mit Fu\u00df\nSchnittstellen: 2 x HDMI \u00a6 DisplayPort 1.4 \u00a6 USB-C mit Stromversorgung \u00a6 Audio Line-Out (Mini-Klinkenstecker)\nEinstellungen der Anzeigeposition: H\u00f6he, Drehung, Neigung\nNeigungswinkel: -5/+15\nSchwenkwinkel: 30\nH\u00f6heneinstellung: 95 mm\nVESA-Halterung: 75 x 75 mm\nLeistungsmerkmale: RGB-Hintergrundbeleuchtung\nEnthaltene Kabel: 1 x DisplayPort-Kabel \u00a6 1 x HDMI-Kabel \u00a6 1 x USB-C Kabel\nMontagekit: Mitgeliefert\nEingangsspannung: Wechselstrom 100-240 V (50/60 Hz)\nLeistungsaufnahme im Ein-Zustand: 48 W\nStromverbrauch SDR (eingeschaltet): 48 kWh/1.000 h\nStromverbrauch HDR (eingeschaltet): 52 kWh/1.000 h\nStromverbrauch im Standby-Modus: 0.5 Watt\nDetails zu Abmessungen & Gewicht: Mit Fu\u00df - Breite: 99,41 cm - Tiefe: 28,68 cm - H\u00f6he: 59,64 cm \u00a6 Ohne Fu\u00df - Breite: 99,41 cm - Tiefe: 8,24 cm - H\u00f6he: 41,83 cm\nTransportbreite: 121,5 cm\nTransporttiefe: 20,3 cm\nTransporth\u00f6he: 52,8 cm\nTransportgewicht: 15,22 kg\nService und Support: Begrenzte Garantie - 3 Jahre",
    "reference_file": "offer_reference_1167.json",
    "shop_name": "Future-X.at"
}