{
    "html_file": "offer_1821_19.html",
    "name": "Dell S2721HN / S2721HNM, 27\"",
    "offer_link": "https://restposten.bauguru.at/monitore/126721-monitor-dell-s2721hn-27-ips-5397184409374.html",
    "price": 167.7,
    "raw_specifications": {
        "Arbeitsbereich f\u00fcr Feuchtigkeit": "10 % - 80 %",
        "Arbeitsbereich f\u00fcr Temperatur": "0\u00ba / 40\u00ba",
        "Aufl\u00f6sung": "Full HD",
        "Aufl\u00f6sung (px)": "1920 x 1080 px",
        "Bildschirm": "27\"",
        "Ca. Temperatur": "- 20\u00baC / 60\u00b0C",
        "Empfohlene verwendung": "Haushalt",
        "Energieklassifizierung": "D",
        "Enthalten": "Kopfh\u00f6rerausgang",
        "Farbe": "Grau",
        "Frequenz": "50 - 60 Hz",
        "Geschwindigkeit": "60 Hz",
        "Glanz": "300 lm ANSI",
        "Kompatibel": "VESA 100 x 100 mm",
        "Kontrastverh\u00e4ltnis": "1000:1",
        "Kopfh\u00f6rer": "3,5 mm",
        "LED-Anzeige": "Anschalten, Intensit\u00e4tsstufenwechsel oder Aufladen",
        "Montage": "VESA",
        "Neigungswinkel": "-5\u00ba / 21\u00ba",
        "Seitenverh\u00e4ltnis": "16:9",
        "Spannung": "100 - 240 V",
        "Stecker": "Sicherheitsrille",
        "Stromquelle": "Wechselstrom",
        "Stromst\u00e4rke": "1,5 A",
        "Winkel": "178\u00ba",
        "Zertifikat": "ENERGY STAR-Zertifizierung"
    },
    "raw_specifications_text": "Bildschirm: 27\"\nAufl\u00f6sung (px): 1920 x 1080 px\nFarbe: Grau\nSeitenverh\u00e4ltnis: 16:9\nAufl\u00f6sung: Full HD\nEnergieklassifizierung: D\nKontrastverh\u00e4ltnis: 1000:1\nKopfh\u00f6rer: 3,5 mm\nFrequenz: 50 - 60 Hz\nSpannung: 100 - 240 V\nGlanz: 300 lm ANSI\nEnthalten: Kopfh\u00f6rerausgang\nLED-Anzeige: Anschalten, Intensit\u00e4tsstufenwechsel oder Aufladen\nWinkel: 178\u00ba\nArbeitsbereich f\u00fcr Feuchtigkeit: 10 % - 80 %\nStecker: Sicherheitsrille\nStromquelle: Wechselstrom\nCa. Temperatur: - 20\u00baC / 60\u00b0C\nMontage: VESA\nGeschwindigkeit: 60 Hz\nArbeitsbereich f\u00fcr Temperatur: 0\u00ba / 40\u00ba\nStromst\u00e4rke: 1,5 A\nZertifikat: ENERGY STAR-Zertifizierung\nEmpfohlene verwendung: Haushalt\nKompatibel: VESA 100 x 100 mm\nNeigungswinkel: -5\u00ba / 21\u00ba",
    "reference_file": "offer_reference_1821.json",
    "shop_name": "bauguru"
}