{
    "html_file": "offer_1781_3.html",
    "name": "ASUS TUF Gaming VG279QL1A, 27\"",
    "offer_link": "https://www.csv-direct.de/artinfo.php?artnr=A1620730&KATEGORIE=162&pva=geizhals2",
    "price": 260.86,
    "raw_specifications": {
        "AMD FreeSync-Typ": "FreeSync",
        "Anzahl DisplayPort Anschl\u00fcsse": "1",
        "Anzahl HDMI-Anschl\u00fcsse": "2",
        "Anzahl der Farben des Displays": "16,78 Millionen Farben",
        "Anzahl der Lautsprecher": "2",
        "Audioanschl\u00fcsse": "Nein",
        "Bildschirmdiagonale": "68,6 cm 27\"",
        "Bildschirmform": "Flach",
        "Bildschirmtechnologie": "LED",
        "Bildwinkel, horizontal": "178\u00b0",
        "Bildwinkel, vertikal": "178\u00b0",
        "Breite ohne Standfu\u00df": "614,1 mm",
        "DVI Anschluss": "Nein",
        "Digital horizontale Frequenz": "30 - 200 kHz",
        "Digital vertikale Frequenz": "48 - 165 Hz",
        "Display-Aufl\u00f6sung": "1920 x 1080 Pixel",
        "DisplayPorts-Version": "1.2",
        "Energieeffizienzklasse SDR": "F",
        "Energieeffizienzskala": "A bis G",
        "Energieverbrauch SDR pro 1.000 Stunden": "26 kWh",
        "Fu\u00dffarbe": "Schwarz",
        "Ger\u00e4tebreite inkl. Fu\u00df": "614,1 mm",
        "Ger\u00e4teh\u00f6he inkl. Fu\u00df": "413,6 mm",
        "Ger\u00e4tetiefe inkl. Fu\u00df": "213,8 mm",
        "Gewicht mit St\u00e4nder": "6,2 kg",
        "Gewicht ohne St\u00e4nder": "3,9 kg",
        "HD-Typ": "Full HD",
        "HDMI-Version": "2.0",
        "Helligkeit typisch": "400 cd/m\u00b2",
        "H\u00f6he ohne Standfu\u00df": "364 mm",
        "H\u00f6heneinstellung": "12 cm",
        "Integrierte Kamera": "Nein",
        "Integrierter USB-Hub": "Nein",
        "Kontrastverh\u00e4ltnis": "1000:1",
        "Kopfh\u00f6rer-Anschluss": "3,5 mm",
        "Kopfh\u00f6rerausg\u00e4nge": "1",
        "Marktpositionierung": "Gaming",
        "Maximale Bildwiederholrate": "165 Hz",
        "Mitgelieferte Kabel": "AC",
        "NVIDIA G-SYNC-Typ": "G-SYNC Compatible",
        "Natives Seitenverh\u00e4ltnis": "16:9",
        "Neigungswinkelbereich": "-5 - 23\u00b0",
        "Paketgewicht": "9,5 kg",
        "Panel-Montage-Schnittstelle": "100 x 100 mm",
        "Panel-Typ": "IPS",
        "Pivot Winkel": "-90 - 90\u00b0",
        "Pixel Abstand": "0,311 x 0,311 mm",
        "Produktfarbe": "Schwarz",
        "RGB-Farbraum": "sRGB",
        "RMS-Leistung": "2 W",
        "Reaktionszeit": "1 ms",
        "Schwenkwinkelbereich": "-15 - 15\u00b0",
        "Seitenverh\u00e4ltnis": "16:9",
        "Sichtbare Gr\u00f6\u00dfe diagonal": "68,5 cm",
        "Sichtbare Gr\u00f6\u00dfe horizontal": "59,8 cm",
        "Sichtbare Gr\u00f6\u00dfe vertikal": "33,6 cm",
        "Slot-Typ Kabelsperre": "Kensington",
        "Stromverbrauch PowerSave": "0,5 W",
        "Stromverbrauch Standardbetrieb": "18 W",
        "Stromverbrauch aus": "0,5 W",
        "Technologie mit hohem Dynamikbereich HDR": "High Dynamic Range HDR 400",
        "Tiefe ohne Standfu\u00df": "59,6 mm",
        "Touchscreen": "Nein",
        "Unterst\u00fctzte Grafik-Aufl\u00f6sungen": "1920 x 1080 HD 1080",
        "Verpackungsart": "Box",
        "Verpackungsbreite": "730 mm",
        "Verpackungsh\u00f6he": "441 mm",
        "Verpackungstiefe": "224 mm",
        "Vorderer Rahmen": "Schwarz",
        "Warentarifnummer HS": "85285210",
        "Zertifizierung": "TUV Flicker-free , TUV Low Blue Light, VESA DisplayHDR 400",
        "sRGB Abdeckung klassisch": "125"
    },
    "raw_specifications_text": "Bildschirmdiagonale: 68,6 cm 27\"\nDisplay-Aufl\u00f6sung: 1920 x 1080 Pixel\nNatives Seitenverh\u00e4ltnis: 16:9\nBildschirmtechnologie: LED\nTouchscreen: Nein\nHD-Typ: Full HD\nPanel-Typ: IPS\nBildschirmform: Flach\nKontrastverh\u00e4ltnis: 1000:1\nMaximale Bildwiederholrate: 165 Hz\nAnzahl der Farben des Displays: 16,78 Millionen Farben\nHelligkeit typisch: 400 cd/m\u00b2\nReaktionszeit: 1 ms\nUnterst\u00fctzte Grafik-Aufl\u00f6sungen: 1920 x 1080 HD 1080\nSeitenverh\u00e4ltnis: 16:9\nBildwinkel, horizontal: 178\u00b0\nBildwinkel, vertikal: 178\u00b0\nPixel Abstand: 0,311 x 0,311 mm\nSichtbare Gr\u00f6\u00dfe horizontal: 59,8 cm\nSichtbare Gr\u00f6\u00dfe vertikal: 33,6 cm\nSichtbare Gr\u00f6\u00dfe diagonal: 68,5 cm\nDigital horizontale Frequenz: 30 - 200 kHz\nDigital vertikale Frequenz: 48 - 165 Hz\nTechnologie mit hohem Dynamikbereich HDR: High Dynamic Range HDR 400\nRGB-Farbraum: sRGB\nsRGB Abdeckung klassisch: 125\nNVIDIA G-SYNC-Typ: G-SYNC Compatible\nAMD FreeSync-Typ: FreeSync\nIntegrierte Kamera: Nein\nAnzahl der Lautsprecher: 2\nRMS-Leistung: 2 W\nMarktpositionierung: Gaming\nProduktfarbe: Schwarz\nVorderer Rahmen: Schwarz\nFu\u00dffarbe: Schwarz\nZertifizierung: TUV Flicker-free , TUV Low Blue Light, VESA DisplayHDR 400\nIntegrierter USB-Hub: Nein\nDVI Anschluss: Nein\nAnzahl HDMI-Anschl\u00fcsse: 2\nHDMI-Version: 2.0\nAnzahl DisplayPort Anschl\u00fcsse: 1\nDisplayPorts-Version: 1.2\nAudioanschl\u00fcsse: Nein\nKopfh\u00f6rerausg\u00e4nge: 1\nKopfh\u00f6rer-Anschluss: 3,5 mm\nPanel-Montage-Schnittstelle: 100 x 100 mm\nSlot-Typ Kabelsperre: Kensington\nH\u00f6heneinstellung: 12 cm\nPivot Winkel: -90 - 90\u00b0\nSchwenkwinkelbereich: -15 - 15\u00b0\nNeigungswinkelbereich: -5 - 23\u00b0\nEnergieeffizienzklasse SDR: F\nEnergieverbrauch SDR pro 1.000 Stunden: 26 kWh\nStromverbrauch Standardbetrieb: 18 W\nStromverbrauch aus: 0,5 W\nStromverbrauch PowerSave: 0,5 W\nEnergieeffizienzskala: A bis G\nMitgelieferte Kabel: AC\nGer\u00e4tebreite inkl. Fu\u00df: 614,1 mm\nGer\u00e4tetiefe inkl. Fu\u00df: 213,8 mm\nGer\u00e4teh\u00f6he inkl. Fu\u00df: 413,6 mm\nGewicht mit St\u00e4nder: 6,2 kg\nBreite ohne Standfu\u00df: 614,1 mm\nTiefe ohne Standfu\u00df: 59,6 mm\nH\u00f6he ohne Standfu\u00df: 364 mm\nGewicht ohne St\u00e4nder: 3,9 kg\nVerpackungsbreite: 730 mm\nVerpackungstiefe: 224 mm\nVerpackungsh\u00f6he: 441 mm\nPaketgewicht: 9,5 kg\nVerpackungsart: Box\nWarentarifnummer HS: 85285210",
    "reference_file": "offer_reference_1781.json",
    "shop_name": "CSV-Direct.de"
}