{
    "html_file": "offer_1669_10.html",
    "name": "ASUS VY279HE, 27\"",
    "offer_link": "https://www.e-tec.at/details.php?artnr=311150",
    "price": 176.35,
    "raw_specifications": {
        "AMD FreeSync": "Ja",
        "Abmessungen (BxHxT)": "613x436x202mm (mit Standfu\u00df),  613x365x50mm (ohne Standfu\u00df)",
        "Adaptive Sync": "Ja",
        "Anschl\u00fcsse - HDMI 1.4": "1",
        "Anschl\u00fcsse - VGA": "1",
        "Anwendung": "station\u00e4r",
        "Audio": "1x Line-Out",
        "Aufl\u00f6sung": "1920x1080",
        "Beschichtung": "matt (non-glare)",
        "Besonderheiten": "Slim Bezel,  mechanische Tasten,  Sicherheitsschloss (Kensington)",
        "Bildwiederholfrequenz": "75Hz",
        "Blickwinkel": "178\u00b0/178\u00b0",
        "Diagonale": "27\"/68.6cm",
        "Energieverbrauch SDR": "24kWh/1000h",
        "Ergonomie": "N/A (h\u00f6henverstellbar),  N/A (Pivot),  N/A (drehbar),  +23\u00b0/-5\u00b0 (neigbar),  keine Angabe (Schr\u00e4glage)",
        "FRC": "unbekannt",
        "Farbe": "schwarz",
        "Farbtiefe": "8bit (16.7 Mio. Farben)",
        "Form": "gerade (flat)",
        "Gewicht": "4.21kg (mit Standfu\u00df),  3.68kg (ohne Standfu\u00df)",
        "HDR": "N/A",
        "Helligkeit": "250cd/m\u00b2",
        "Herstellergarantie": "drei Jahre",
        "Hintergrundbeleuchtung": "White-LED,  flicker-free,  Blaulichtfilter",
        "Kontrast - dynamisch": "100.000.000:1",
        "Kontrast - statisch": "1.000:1",
        "Leistungsaufnahme": "keine Angabe (maximal),  17.8W (typisch),  keine Angabe (Energielabel alt A+++ bis G),  0.5W (Standby)",
        "Panel": "IPS",
        "Reaktionszeit - MPRT": "1ms",
        "Screen-to-Body-Ratio": "89.7% (berechnet)",
        "Seitenverh\u00e4ltnis": "16:9",
        "Signalfrequenz": "24-83kHz (horizontal),  48-75Hz (vertikal)",
        "Stromversorgung": "AC-In (internes Netzteil)",
        "USB-Hub In": "N/A",
        "USB-Hub Out": "N/A",
        "USB-Schreibweise": "Link",
        "Unsch\u00e4rfereduktionsfunktion": "N/A",
        "VESA": "100x100 (frei)",
        "VRR (Variable Refresh Rate)": "Adaptive Sync,  AMD FreeSync (48-75Hz via HDMI,  ohne LFC-Support,  ohne HDR)",
        "Weitere Anschl\u00fcsse": "N/A"
    },
    "raw_specifications_text": "Abmessungen (BxHxT): 613x436x202mm (mit Standfu\u00df),  613x365x50mm (ohne Standfu\u00df)\nAdaptive Sync: Ja\nAMD FreeSync: Ja\nAnschl\u00fcsse - HDMI 1.4: 1\nAnschl\u00fcsse - VGA: 1\nAnwendung: station\u00e4r\nAudio: 1x Line-Out\nAufl\u00f6sung: 1920x1080\nBeschichtung: matt (non-glare)\nBesonderheiten: Slim Bezel,  mechanische Tasten,  Sicherheitsschloss (Kensington)\nBildwiederholfrequenz: 75Hz\nBlickwinkel: 178\u00b0/178\u00b0\nDiagonale: 27\"/68.6cm\nEnergieverbrauch SDR: 24kWh/1000h\nErgonomie: N/A (h\u00f6henverstellbar),  N/A (Pivot),  N/A (drehbar),  +23\u00b0/-5\u00b0 (neigbar),  keine Angabe (Schr\u00e4glage)\nFarbe: schwarz\nFarbtiefe: 8bit (16.7 Mio. Farben)\nForm: gerade (flat)\nFRC: unbekannt\nGewicht: 4.21kg (mit Standfu\u00df),  3.68kg (ohne Standfu\u00df)\nHDR: N/A\nHelligkeit: 250cd/m\u00b2\nHerstellergarantie: drei Jahre\nHintergrundbeleuchtung: White-LED,  flicker-free,  Blaulichtfilter\nKontrast - dynamisch: 100.000.000:1\nKontrast - statisch: 1.000:1\nLeistungsaufnahme: keine Angabe (maximal),  17.8W (typisch),  keine Angabe (Energielabel alt A+++ bis G),  0.5W (Standby)\nPanel: IPS\nReaktionszeit - MPRT: 1ms\nScreen-to-Body-Ratio: 89.7% (berechnet)\nSeitenverh\u00e4ltnis: 16:9\nSignalfrequenz: 24-83kHz (horizontal),  48-75Hz (vertikal)\nStromversorgung: AC-In (internes Netzteil)\nUnsch\u00e4rfereduktionsfunktion: N/A\nUSB-Hub In: N/A\nUSB-Hub Out: N/A\nUSB-Schreibweise: Link\nVESA: 100x100 (frei)\nVRR (Variable Refresh Rate): Adaptive Sync,  AMD FreeSync (48-75Hz via HDMI,  ohne LFC-Support,  ohne HDR)\nWeitere Anschl\u00fcsse: N/A",
    "reference_file": "offer_reference_1669.json",
    "shop_name": "e-tec.at"
}