{
    "html_file": "offer_1426_13.html",
    "name": "LG UltraWide 29WP60G-B, 29\"",
    "offer_link": "https://www.ba-computer.at/lg-29wp60g-b-led-monitor-73-7-cm-29-2560-x-1080-uwfhd-29wp60g-b.html",
    "price": 238.4,
    "raw_specifications": {
        "Abmessungen (Breite x Tiefe x H\u00f6he)": "68.8 cm x 22.6 cm x 47.5 cm - mit Fu\u00df",
        "Adaptive-Sync Technologie": "AMD FreeSync",
        "Besonderheiten": "Spielmodus, FPS Mode, Crosshair Display, Flicker Safe, Reader Mode, RTS Mode, Motion Blur Reduction, Intelligente Energiespartechnologie, Color Calibrated, Black Stabilizer, DAS Mode (Dynamic Action Sync), Color Weakness Mode, 1ms Motion Blur Reduction, Super Resolution+, Low Framerate Compensation (LFC), schmale Blende, Auto Input Switch",
        "Bildschirmbeschichtung": "Blendfrei",
        "Bildschirmtyp": "IPS",
        "Details zu Abmessungen & Gewicht": "Mit Fu\u00df - Breite: 68.8 cm - Tiefe: 22.6 cm - H\u00f6he: 47.5 cm - Gewicht: 4.81 kg \u00a6 Ohne Fu\u00df - Breite: 68.8 cm - Tiefe: 7.62 cm - H\u00f6he: 31.2 cm - Gewicht: 3.99 kg",
        "Diagonalabmessung": "73.7 cm (29\")",
        "Display-Typ": "LED-hintergrundbeleuchteter LCD-Monitor / TFT-Aktivmatrix",
        "Eingangsspannung": "Wechselstrom 100-240 V (50/60 Hz)",
        "Einstellungen der Anzeigeposition": "Neigung",
        "Energie Effizienzklasse": "Klasse E",
        "Energieklasse (HDR)": "Klasse F",
        "Energierverbrauch Sleep": "0.5 Watt",
        "Enthaltene Kabel": "1 x HDMI-Kabel",
        "Farbraum": "99% sRGB (CIE 1931)",
        "Farbunterst\u00fctzung": "16,7 Millionen Farben",
        "Gewicht": "4.81 kg",
        "HDR-Format": "HDR10",
        "Helligkeit": "250 cd/m\u00b2",
        "Hintergrundbeleuchtungs-Technologie": "LED-Hintergrundbeleuchtung",
        "Horizontaler Betrachtungswinkel": "178",
        "Kontrast": "1000:1",
        "Leistungsaufnahme im Ein-Zustand": "20.6 W",
        "Leistungsmerkmale": "Slot f\u00fcr Sicherheitsschloss (Kabelschloss getrennt erh\u00e4ltlich), DisplayPort Alt Mode",
        "Mitgelieferte Software": "Dual Controller Software, LG On-Screen Control",
        "Native Aufl\u00f6sung": "UWFHD 2560 x 1080",
        "Reaktionszeit": "5 ms (Gray-to-Gray), 1 ms (MBR)",
        "Schlosstyp zur Diebstahlsicherung": "Kensington Slot",
        "Schnittstellen": "HDMI \u00a6 DisplayPort \u00a6 USB-C \u00a6 Kopfh\u00f6rer",
        "Seitenverh\u00e4ltnis": "21:9",
        "Service und Support": "Begrenzte Garantie - Arbeitszeit und Ersatzteile - 1 Jahr",
        "Stromverbrauch (Aus-Modus)": "0.3 Watt",
        "Stromverbrauch (max.)": "25 Watt",
        "Stromverbrauch (typisch)": "20.5 Watt",
        "Stromverbrauch HDR (eingeschaltet)": "21.2 kWh/1.000 h",
        "Stromverbrauch SDR (eingeschaltet)": "20.6 kWh/1.000 h",
        "Transportbreite": "82.3 cm",
        "Transportgewicht": "6.89 kg",
        "Transporth\u00f6he": "41.4 cm",
        "Transporttiefe": "16 cm",
        "VESA-Halterung": "100 x 100 mm",
        "Vertikale Bildwiederholrate": "75 Hz",
        "Vertikaler Betrachtungswinkel": "178"
    },
    "raw_specifications_text": "Display-Typ: LED-hintergrundbeleuchteter LCD-Monitor / TFT-Aktivmatrix\nEnergie Effizienzklasse: Klasse E\nEnergieklasse (HDR): Klasse F\nDiagonalabmessung: 73.7 cm (29\")\nAdaptive-Sync Technologie: AMD FreeSync\nBildschirmtyp: IPS\nSeitenverh\u00e4ltnis: 21:9\nNative Aufl\u00f6sung: UWFHD 2560 x 1080\nHelligkeit: 250 cd/m\u00b2\nKontrast: 1000:1\nHDR-Format: HDR10\nFarbunterst\u00fctzung: 16,7 Millionen Farben\nFarbraum: 99% sRGB (CIE 1931)\nReaktionszeit: 5 ms (Gray-to-Gray), 1 ms (MBR)\nVertikale Bildwiederholrate: 75 Hz\nHorizontaler Betrachtungswinkel: 178\nVertikaler Betrachtungswinkel: 178\nBildschirmbeschichtung: Blendfrei\nHintergrundbeleuchtungs-Technologie: LED-Hintergrundbeleuchtung\nBesonderheiten: Spielmodus, FPS Mode, Crosshair Display, Flicker Safe, Reader Mode, RTS Mode, Motion Blur Reduction, Intelligente Energiespartechnologie, Color Calibrated, Black Stabilizer, DAS Mode (Dynamic Action Sync), Color Weakness Mode, 1ms Motion Blur Reduction, Super Resolution+, Low Framerate Compensation (LFC), schmale Blende, Auto Input Switch\nAbmessungen (Breite x Tiefe x H\u00f6he): 68.8 cm x 22.6 cm x 47.5 cm - mit Fu\u00df\nGewicht: 4.81 kg\nSchnittstellen: HDMI \u00a6 DisplayPort \u00a6 USB-C \u00a6 Kopfh\u00f6rer\nEinstellungen der Anzeigeposition: Neigung\nVESA-Halterung: 100 x 100 mm\nLeistungsmerkmale: Slot f\u00fcr Sicherheitsschloss (Kabelschloss getrennt erh\u00e4ltlich), DisplayPort Alt Mode\nEnthaltene Kabel: 1 x HDMI-Kabel\nSchlosstyp zur Diebstahlsicherung: Kensington Slot\nEingangsspannung: Wechselstrom 100-240 V (50/60 Hz)\nLeistungsaufnahme im Ein-Zustand: 20.6 W\nStromverbrauch SDR (eingeschaltet): 20.6 kWh/1.000 h\nStromverbrauch HDR (eingeschaltet): 21.2 kWh/1.000 h\nStromverbrauch (typisch): 20.5 Watt\nStromverbrauch (max.): 25 Watt\nEnergierverbrauch Sleep: 0.5 Watt\nStromverbrauch (Aus-Modus): 0.3 Watt\nMitgelieferte Software: Dual Controller Software, LG On-Screen Control\nDetails zu Abmessungen & Gewicht: Mit Fu\u00df - Breite: 68.8 cm - Tiefe: 22.6 cm - H\u00f6he: 47.5 cm - Gewicht: 4.81 kg \u00a6 Ohne Fu\u00df - Breite: 68.8 cm - Tiefe: 7.62 cm - H\u00f6he: 31.2 cm - Gewicht: 3.99 kg\nTransportbreite: 82.3 cm\nTransporttiefe: 16 cm\nTransporth\u00f6he: 41.4 cm\nTransportgewicht: 6.89 kg\nService und Support: Begrenzte Garantie - Arbeitszeit und Ersatzteile - 1 Jahr",
    "reference_file": "offer_reference_1426.json",
    "shop_name": "BA-Computer"
}