{
    "html_file": "offer_2174_4.html",
    "name": "NEC MultiSync EA241F-WH wei\u00df, 23.8\"",
    "offer_link": "https://direkt.jacob.de/produkte/nec-multisync-ea241f-60004787-artnr-3269528.html?utm_source=geizhals&utm_medium=cpc&utm_campaign=Preisvergleich&ref=103",
    "price": 388.32,
    "raw_specifications": {
        "Abmessungen (Breite x Tiefe x H\u00f6he)": "53.77 cm x 25 cm x 33.66 cm - mit Fu\u00df",
        "Abmessungen (Breite x Tiefe x H\u00f6he) - mit Fu\u00df": "53.77 cm x 25 cm x 33.66 cm",
        "Ausgangsleistung/Kanal": "1 Watt",
        "Ausschlussklausel f\u00fcr Bildfarbe": "Das dargestellte Bild des Produkts kann eine andere Farbe aufweisen",
        "Besonderheiten": "Umgebungslichtsensor, XtraView, AccuColor-Farbsteuerungssysteme, Rapid Response, Ambix, Sync-on-Green, Traggriff, HDCP, Eco-Mode, Auto Brightness Control, 72 % NTSC-Farbskala, Dynamic Visual Mode, ControlSync, On-screen Digital Controls, OSD sperren, integrierte Kabelf\u00fchrung, Carbon Footprint Meter, Human Sensor, flimmerfreie Technologie, DICOM-Simulation, zur\u00fccksetzbares Kostenmessger\u00e4t, extrem d\u00fcnnes Blendendesign, Low Blue Light-Technologie",
        "Bildschirmtyp": "IPS",
        "Details zu Abmessungen & Gewicht": "Mit Fu\u00df - Breite: 53.77 cm - Tiefe: 25 cm - H\u00f6he: 33.66 cm - Gewicht: 6.1 kg  Ohne Fu\u00df - Breite: 53.15 cm - Tiefe: 4.76 cm - H\u00f6he: 34.78 cm - Gewicht: 4.2 kg",
        "Diagonalabmessung": "60.96 cm (24\")",
        "Display-Typ": "LED-hintergrundbeleuchteter LCD-Monitor / TFT-Aktivmatrix",
        "ENERGY STAR zertifiziert": "Ja",
        "ENERGY STAR-Version": "7.0",
        "Eingangsanschl\u00fcsse": "HDMI, DVI-D, VGA, DisplayPort",
        "Einstellungen der Anzeigeposition": "H\u00f6he, Pivot (Rotation), Drehelement, neigbar",
        "Enthaltene Kabel": "USB-Kabel  DisplayPort-Kabel  ControlSync-Kabel",
        "Erforderliche Netzspannung": "Wechselstrom 120/230 V (50/60 Hz)",
        "Farbe": "Wei\u00df",
        "Farbunterst\u00fctzung": "16,7 Millionen Farben",
        "Ger\u00e4tetyp": "LED-hintergrundbeleuchteter LCD-Monitor - 60.96 cm (24\")",
        "Gewicht": "6.1 kg",
        "Helligkeit": "250 cd/m\u00b2",
        "Hintergrundbeleuchtungs-Technologie": "WLED",
        "Horizontale Bildwiederholrate": "31.5 - 75 kHz",
        "Horizontaler Betrachtungswinkel": "178",
        "H\u00f6heneinstellung": "150 mm",
        "Integrierte Peripherieger\u00e4te": "USB 3.1 Gen.1 Hub",
        "Kennzeichnung": "Plug and Play, DDC-2B, VESA DPMS, DDC/CI, RoHS, TCO Displays 7.0, ISO 9241-307 Class 1, HDCP 1.4, VESA DDC 2 B",
        "Kontrast": "1000:1 / 5000:1 (dynamisch)",
        "Leistungsaufnahme im Betrieb": "15 Watt",
        "Leistungsmerkmale": "Slot f\u00fcr Sicherheitsschloss (Kabelschloss getrennt erh\u00e4ltlich)",
        "Max. Betriebstemperatur": "35 \u00b0C",
        "Min Betriebstemperatur": "5 \u00b0C",
        "Mitgelieferte Software": "NaViSet, SpectraViewII software",
        "Native Aufl\u00f6sung": "Full HD (1080p) 1920 x 1080",
        "Neigungswinkel": "-5/+35",
        "Pixelpitch": "0.28 mm",
        "Ppi": "93",
        "Produktbeschreibung": "NEC MultiSync EA241F-WH - LED-Monitor - Full HD (1080p) - 60.96 cm (24\")",
        "Reaktionszeit": "5 ms (Gray-to-Gray)",
        "Rotationswinkel": "180",
        "Schlosstyp zur Diebstahlsicherung": "Kensington Slot",
        "Schnittstellen": "HDMI  DisplayPort  VGA  DVI-D  Audio Line-Out (Mini-Buchse)  USB 3.1 Gen 1 Upstream (Typ B)  3 x USB 3.1 Downstream (Typ A)",
        "Schwenkwinkel": "340",
        "Seitenverh\u00e4ltnis": "16:9",
        "Sichtbare Bildfl\u00e4che": "60.45 cm (23.8\")",
        "Stromverbrauch im Standby-Modus": "0.29 Watt",
        "Transportbreite": "68.5 cm",
        "Transportgewicht": "8.5 kg",
        "Transporth\u00f6he": "42 cm",
        "Transporttiefe": "20.4 cm",
        "Typ": "Lautsprecher - Stereo",
        "Umweltschutzstandards": "ENERGY STAR-qualifiziert",
        "VESA-Halterung": "100 x 100 mm",
        "Vertikale Bildwiederholrate": "50 - 75 Hz",
        "Vertikaler Betrachtungswinkel": "178",
        "Zul\u00e4ssige Luftfeuchtigkeit im Betrieb": "20 - 80%"
    },
    "raw_specifications_text": "Produktbeschreibung: NEC MultiSync EA241F-WH - LED-Monitor - Full HD (1080p) - 60.96 cm (24\")\nGer\u00e4tetyp: LED-hintergrundbeleuchteter LCD-Monitor - 60.96 cm (24\")\nLeistungsmerkmale: Slot f\u00fcr Sicherheitsschloss (Kabelschloss getrennt erh\u00e4ltlich)\nBildschirmtyp: IPS\nSeitenverh\u00e4ltnis: 16:9\nNative Aufl\u00f6sung: Full HD (1080p) 1920 x 1080\nPixelpitch: 0.28 mm\nHelligkeit: 250 cd/m\u00b2\nKontrast: 1000:1 / 5000:1 (dynamisch)\nReaktionszeit: 5 ms (Gray-to-Gray)\nFarbunterst\u00fctzung: 16,7 Millionen Farben\nEingangsanschl\u00fcsse: HDMI, DVI-D, VGA, DisplayPort\nEinstellungen der Anzeigeposition: H\u00f6he, Pivot (Rotation), Drehelement, neigbar\nFarbe: Wei\u00df\nAusschlussklausel f\u00fcr Bildfarbe: Das dargestellte Bild des Produkts kann eine andere Farbe aufweisen\nAbmessungen (Breite x Tiefe x H\u00f6he) - mit Fu\u00df: 53.77 cm x 25 cm x 33.66 cm\nGewicht: 6.1 kg\nUmweltschutzstandards: ENERGY STAR-qualifiziert\nKennzeichnung: Plug and Play, DDC-2B, VESA DPMS, DDC/CI, RoHS, TCO Displays 7.0, ISO 9241-307 Class 1, HDCP 1.4, VESA DDC 2 B\nDisplay-Typ: LED-hintergrundbeleuchteter LCD-Monitor / TFT-Aktivmatrix\nDiagonalabmessung: 60.96 cm (24\")\nSichtbare Bildfl\u00e4che: 60.45 cm (23.8\")\nIntegrierte Peripherieger\u00e4te: USB 3.1 Gen.1 Hub\nPpi: 93\nVertikale Bildwiederholrate: 50 - 75 Hz\nHorizontale Bildwiederholrate: 31.5 - 75 kHz\nHorizontaler Betrachtungswinkel: 178\nVertikaler Betrachtungswinkel: 178\nHintergrundbeleuchtungs-Technologie: WLED\nBesonderheiten: Umgebungslichtsensor, XtraView, AccuColor-Farbsteuerungssysteme, Rapid Response, Ambix, Sync-on-Green, Traggriff, HDCP, Eco-Mode, Auto Brightness Control, 72 % NTSC-Farbskala, Dynamic Visual Mode, ControlSync, On-screen Digital Controls, OSD sperren, integrierte Kabelf\u00fchrung, Carbon Footprint Meter, Human Sensor, flimmerfreie Technologie, DICOM-Simulation, zur\u00fccksetzbares Kostenmessger\u00e4t, extrem d\u00fcnnes Blendendesign, Low Blue Light-Technologie\nAbmessungen (Breite x Tiefe x H\u00f6he): 53.77 cm x 25 cm x 33.66 cm - mit Fu\u00df\nTyp: Lautsprecher - Stereo\nAusgangsleistung/Kanal: 1 Watt\nSchnittstellen: HDMI  DisplayPort  VGA  DVI-D  Audio Line-Out (Mini-Buchse)  USB 3.1 Gen 1 Upstream (Typ B)  3 x USB 3.1 Downstream (Typ A)\nNeigungswinkel: -5/+35\nSchwenkwinkel: 340\nRotationswinkel: 180\nH\u00f6heneinstellung: 150 mm\nVESA-Halterung: 100 x 100 mm\nEnthaltene Kabel: USB-Kabel  DisplayPort-Kabel  ControlSync-Kabel\nSchlosstyp zur Diebstahlsicherung: Kensington Slot\nErforderliche Netzspannung: Wechselstrom 120/230 V (50/60 Hz)\nLeistungsaufnahme im Betrieb: 15 Watt\nStromverbrauch im Standby-Modus: 0.29 Watt\nMitgelieferte Software: NaViSet, SpectraViewII software\nDetails zu Abmessungen & Gewicht: Mit Fu\u00df - Breite: 53.77 cm - Tiefe: 25 cm - H\u00f6he: 33.66 cm - Gewicht: 6.1 kg  Ohne Fu\u00df - Breite: 53.15 cm - Tiefe: 4.76 cm - H\u00f6he: 34.78 cm - Gewicht: 4.2 kg\nTransportbreite: 68.5 cm\nTransporttiefe: 20.4 cm\nTransporth\u00f6he: 42 cm\nTransportgewicht: 8.5 kg\nENERGY STAR zertifiziert: Ja\nENERGY STAR-Version: 7.0\nMin Betriebstemperatur: 5 \u00b0C\nMax. Betriebstemperatur: 35 \u00b0C\nZul\u00e4ssige Luftfeuchtigkeit im Betrieb: 20 - 80%",
    "reference_file": "offer_reference_2174.json",
    "shop_name": "Jacob Elektronik direkt (AT)"
}