{
    "html_file": "offer_1439_4.html",
    "name": "Lenovo ThinkVision S27e-20, 27\"",
    "offer_link": "https://www.mylemon.at/artikel/lenovo/62afkat2eu/thinkvision-s27e-20-27-0.html",
    "price": 193.3,
    "raw_specifications": {
        "AC Eingangsspannung": "100 - 240 V",
        "AMD FreeSync": "Ja",
        "Anzahl HDMI-Anschl\u00fcsse": "1",
        "Anzahl VGA (D-Sub) Anschl\u00fcsse": "1",
        "Anzahl der Farben des Displays": "16,7 Millionen Farben",
        "Artikelnummer": "M15Y20TL",
        "Audioausgang": "Ja",
        "Aufl\u00f6sung": "1920x1080",
        "Bezel Weite (bottom)": "2,24 cm",
        "Bezel Weite (side)": "2,5 mm",
        "Bezel Weite (top)": "2,5 mm",
        "Bildschirmdiagonale": "68,6 cm (27 Zoll)",
        "Bildschirmform": "Flach",
        "Bildschirmtechnologie": "LED",
        "Bildwinkel, horizontal": "178\u00b0",
        "Bildwinkel, vertikal": "178\u00b0",
        "Breite (ohne Standfu\u00df)": "61,2 cm",
        "Display-Aufl\u00f6sung": "1920 x 1080 Pixel",
        "Displaygr\u00f6\u00dfe": "27 Zoll",
        "EAN": "0195235830666",
        "Eingebaute Lautsprecher": "Nein",
        "Energieeffizienzklasse (SDR)": "D",
        "Energieeffizienzskala": "A bis G",
        "Energieverbrauch (SDR) pro 1.000 Stunden": "17 kWh",
        "Ergonomie": "Neigbar",
        "Ger\u00e4tebreite (inkl. Fu\u00df)": "612,5 mm",
        "Ger\u00e4teh\u00f6he (inkl. Fu\u00df)": "475,8 mm",
        "Ger\u00e4tetiefe (inkl. Fu\u00df)": "182,5 mm",
        "Gewicht (mit St\u00e4nder)": "4,6 kg",
        "Gewicht (ohne St\u00e4nder)": "3,6 kg",
        "HD-Typ": "Full HD",
        "HDMI": "Ja",
        "HDMI-Version": "1.4",
        "Helligkeit": "250 cd/m\u00b2",
        "Helligkeit (typisch)": "250 cd/m\u00b2",
        "Hersteller Artikelnummer": "62AFKAT2EU",
        "H\u00f6he (ohne Standfu\u00df)": "36,8 cm",
        "Integrierte Kamera": "Nein",
        "J\u00e4hrlicher Energieverbrauch": "115 kWh",
        "Kontrastverh\u00e4ltnis": "1000:1",
        "Kontrastverh\u00e4ltnis (dynamisch)": "3000000:1",
        "Maximale Bildwiederholrate": "60 Hz",
        "NTSC Abdeckung (typisch)": "72%",
        "Name der Farbe": "Raven Black",
        "Natives Seitenverh\u00e4ltnis": "16:9",
        "Neigungsverstellung": "Ja",
        "Neigungswinkelbereich": "-5 - 22\u00b0",
        "Paketgewicht": "6,42 kg",
        "Panel": "IPS",
        "Panel-Montage-Schnittstelle": "100 x 100 mm",
        "Panel-Typ": "IPS",
        "Pixel Abstand": "0,3114 x 0,3114 mm",
        "Pixeldichte": "82 ppi",
        "Produktfarbe": "Schwarz",
        "Reaktionszeit": "6 ms",
        "Reaktionszeit (schnell)": "4 ms",
        "Sichtbare Gr\u00f6\u00dfe (horizontal)": "59,8 cm",
        "Sichtbare Gr\u00f6\u00dfe (vertikal)": "33,6 cm",
        "Stromverbrauch (Standardbetrieb)": "18 W",
        "Stromverbrauch (aus)": "0,5 W",
        "Stromverbrauch (max.)": "24 W",
        "Tiefe (ohne Standfu\u00df)": "4,32 cm",
        "Touchscreen": "Nein",
        "VESA Halterung": "100x100 mm",
        "VESA-Halterung": "Ja",
        "Verpackungsbreite": "710 mm",
        "Verpackungsh\u00f6he": "455 mm",
        "Verpackungstiefe": "126 mm",
        "Video Anschl\u00fcsse": "1x VGA, 1x HDMI",
        "Warentarifnummer (HS)": "85285210"
    },
    "raw_specifications_text": "Displaygr\u00f6\u00dfe: 27 Zoll\nAufl\u00f6sung: 1920x1080\nPanel: IPS\nReaktionszeit: 6 ms\nVideo Anschl\u00fcsse: 1x VGA, 1x HDMI\nErgonomie: Neigbar\nVESA Halterung: 100x100 mm\nHelligkeit: 250 cd/m\u00b2\nHersteller Artikelnummer: 62AFKAT2EU\nEAN: 0195235830666\nArtikelnummer: M15Y20TL\nBildschirmdiagonale: 68,6 cm (27 Zoll)\nDisplay-Aufl\u00f6sung: 1920 x 1080 Pixel\nNatives Seitenverh\u00e4ltnis: 16:9\nBildschirmtechnologie: LED\nTouchscreen: Nein\nHD-Typ: Full HD\nPanel-Typ: IPS\nBildschirmform: Flach\nKontrastverh\u00e4ltnis: 1000:1\nMaximale Bildwiederholrate: 60 Hz\nAnzahl der Farben des Displays: 16,7 Millionen Farben\nHelligkeit (typisch): 250 cd/m\u00b2\nKontrastverh\u00e4ltnis (dynamisch): 3000000:1\nBildwinkel, horizontal: 178\u00b0\nBildwinkel, vertikal: 178\u00b0\nReaktionszeit (schnell): 4 ms\nPixel Abstand: 0,3114 x 0,3114 mm\nPixeldichte: 82 ppi\nSichtbare Gr\u00f6\u00dfe (horizontal): 59,8 cm\nSichtbare Gr\u00f6\u00dfe (vertikal): 33,6 cm\nNTSC Abdeckung (typisch): 72%\nAMD FreeSync: Ja\nEingebaute Lautsprecher: Nein\nIntegrierte Kamera: Nein\nProduktfarbe: Schwarz\nName der Farbe: Raven Black\nHDMI: Ja\nAnzahl VGA (D-Sub) Anschl\u00fcsse: 1\nAnzahl HDMI-Anschl\u00fcsse: 1\nHDMI-Version: 1.4\nAudioausgang: Ja\nVESA-Halterung: Ja\nPanel-Montage-Schnittstelle: 100 x 100 mm\nNeigungswinkelbereich: -5 - 22\u00b0\nNeigungsverstellung: Ja\nEnergieeffizienzklasse (SDR): D\nEnergieverbrauch (SDR) pro 1.000 Stunden: 17 kWh\nStromverbrauch (Standardbetrieb): 18 W\nStromverbrauch (max.): 24 W\nStromverbrauch (aus): 0,5 W\nAC Eingangsspannung: 100 - 240 V\nEnergieeffizienzskala: A bis G\nJ\u00e4hrlicher Energieverbrauch: 115 kWh\nGer\u00e4tebreite (inkl. Fu\u00df): 612,5 mm\nGer\u00e4tetiefe (inkl. Fu\u00df): 182,5 mm\nGer\u00e4teh\u00f6he (inkl. Fu\u00df): 475,8 mm\nGewicht (mit St\u00e4nder): 4,6 kg\nBreite (ohne Standfu\u00df): 61,2 cm\nTiefe (ohne Standfu\u00df): 4,32 cm\nH\u00f6he (ohne Standfu\u00df): 36,8 cm\nGewicht (ohne St\u00e4nder): 3,6 kg\nBezel Weite (side): 2,5 mm\nBezel Weite (top): 2,5 mm\nBezel Weite (bottom): 2,24 cm\nVerpackungsbreite: 710 mm\nVerpackungstiefe: 126 mm\nVerpackungsh\u00f6he: 455 mm\nPaketgewicht: 6,42 kg\nWarentarifnummer (HS): 85285210",
    "reference_file": "offer_reference_1439.json",
    "shop_name": "mylemon.at"
}