{
    "html_file": "offer_2086_14.html",
    "name": "Philips C-line 276C8, 27\"",
    "offer_link": "https://www.alternate.at/Philips/276C8-00-LED-Monitor/html/product/1650432?partner=AtGeizhalsat&campaign=Monitor/Philips/1650432",
    "price": 345.0,
    "raw_specifications": {
        "": "AMD FreeSync, Bild in Bild",
        "Abmessungen": "Breite: 61,1 cm x H\u00f6he: 45,5 cm x Tiefe/L\u00e4nge: 18,5 cm",
        "Anschl\u00fcsse": "2x HDMI-Eingang, (HDMI-Version: 2.0), 1x 3,5-mm-Audio-Eingang, 1x 3,5-mm-Audio-Ausgang, 1x USB-C 3.2 Gen 2 (10 Gbit/s)",
        "Bild": "Format",
        "Bildschirmaufl\u00f6sung": "2.560 x 1.440 Pixel",
        "Bildschirmdiagonale": "68,47 cm (27 Zoll)",
        "EAN": "8712581759162",
        "Energieeffizienzklasse (HDR)": "G (A - G)",
        "Energieeffizienzklasse (SDR)": "G (A - G)",
        "Energieverbauch pro 1000 Stunden (HDR)": "36 kWh",
        "Energieverbauch pro 1000 Stunden (SDR)": "31 kWh",
        "Ergonomie": "Neigbar",
        "Farbe": "schwarz",
        "Features": "SmartImage, Flimmerfreie LEDs, LowBlue Modus, EasyRead, USB-C Power Delivery (65 Watt), Mega Infinity DCR",
        "Frequenz": "Vertikal",
        "Geeignet f\u00fcr": "Business",
        "Gewicht": "4,3 kg",
        "Hersteller-Nr.": "276C8/00",
        "Leistungsaufnahme im Bereitschafts- und Aus-Zustand": "0,5 Watt",
        "Leistungsaufnahme im Ein-Zustand bei Standard-Dynamikumfang (SDR)": "31 Watt",
        "Leistungsaufnahme im Ein-Zustand bei hohem Dynamikumfang (HDR)": "36 Watt",
        "Standards": "Video",
        "Stromversorgung": "Eco-Off",
        "Typ": "LED-Monitor",
        "Zubeh\u00f6r": "Vorhanden"
    },
    "raw_specifications_text": "Energieeffizienzklasse (SDR): G (A - G)\nEnergieverbauch pro 1000 Stunden (SDR): 31 kWh\nEnergieeffizienzklasse (HDR): G (A - G)\nEnergieverbauch pro 1000 Stunden (HDR): 36 kWh\nLeistungsaufnahme im Ein-Zustand bei Standard-Dynamikumfang (SDR): 31 Watt\nLeistungsaufnahme im Ein-Zustand bei hohem Dynamikumfang (HDR): 36 Watt\nLeistungsaufnahme im Bereitschafts- und Aus-Zustand: 0,5 Watt\nBildschirmdiagonale: 68,47 cm (27 Zoll)\nBildschirmaufl\u00f6sung: 2.560 x 1.440 Pixel\nTyp: LED-Monitor\nFarbe: schwarz\nEAN: 8712581759162\nHersteller-Nr.: 276C8/00\nGeeignet f\u00fcr: Business\nBild: Format\n: AMD FreeSync, Bild in Bild\nFrequenz: Vertikal\nAnschl\u00fcsse: 2x HDMI-Eingang, (HDMI-Version: 2.0), 1x 3,5-mm-Audio-Eingang, 1x 3,5-mm-Audio-Ausgang, 1x USB-C 3.2 Gen 2 (10 Gbit/s)\nErgonomie: Neigbar\nStromversorgung: Eco-Off\nStandards: Video\nFeatures: SmartImage, Flimmerfreie LEDs, LowBlue Modus, EasyRead, USB-C Power Delivery (65 Watt), Mega Infinity DCR\nZubeh\u00f6r: Vorhanden\nAbmessungen: Breite: 61,1 cm x H\u00f6he: 45,5 cm x Tiefe/L\u00e4nge: 18,5 cm\nGewicht: 4,3 kg",
    "reference_file": "offer_reference_2086.json",
    "shop_name": "Alternate.at"
}