{
    "html_file": "offer_1893_23.html",
    "name": "Philips B-line 272B1G, 27\"",
    "offer_link": "https://syswork.at/sw/index.html?open&mid=Artikel&artid=mon-1362&from=geizhals.at",
    "price": 216.0,
    "raw_specifications": {
        "AC Eingangsfrequenz": "50/60 Hz",
        "AC Eingangsspannung": "100 - 240 V",
        "AMD FreeSync": "Nein",
        "Abnehmbarer Standfu\u00df": "Ja",
        "Adobe RGB-Abdeckung": "83%",
        "Anzahl DVI-D-Anschl\u00fcsse": "1",
        "Anzahl DisplayPort Anschl\u00fcsse": "1.2",
        "Anzahl HDMI-Anschl\u00fcsse": "1",
        "Anzahl OSD-Sprachen": "21",
        "Anzahl VGA (D-Sub) Anschl\u00fcsse": "1",
        "Anzahl der Farben des Displays": "16,7 Millionen Farben",
        "Anzahl der Lautsprecher": "2",
        "Anzahl der nachgeschalteten Steckpl\u00e4tze vom Typ USB-A": "4",
        "Anzahl der vorgeschalteten Steckpl\u00e4tze": "1",
        "Audioanschl\u00fcsse": "Ja",
        "Au\u00dfenverkleidungstyp": "Texturiert",
        "Beh\u00f6rdliche Zulassung": "CB; FCC Class B; ICES-003; CE Mark; TUV Ergo; TUV/GS; SEMKO; CU-EAC; EAEU RoHS; UKRAINIAN; TUV Eye Comfort certified",
        "Betriebsanleitung": "Ja",
        "Betriebstemperatur": "0 - 40 \u00b0C",
        "Bild-Verbesserung": "SmartImage",
        "Bildschirmdiagonale": "68,6 cm (27 Zoll)",
        "Bildschirmdiagonale (cm)": "68,6 cm",
        "Bildschirmform": "Flach",
        "Bildschirmtechnologie": "LED",
        "Bildwinkel, horizontal": "178\u00b0",
        "Bildwinkel, vertikal": "178\u00b0",
        "Blendfreier Bildschirm": "Ja",
        "Breite (ohne Standfu\u00df)": "61,3 cm",
        "DDC/CI": "Ja",
        "DVI Anschluss": "Ja",
        "Datenblatt": "Kein Datenblatt verf\u00fcgbar",
        "Digital horizontale Frequenz": "30 - 85 kHz",
        "Digital vertikale Frequenz": "48 - 75 Hz",
        "Display-Aufl\u00f6sung": "1920 x 1080 Pixel",
        "Display-Oberfl\u00e4che": "Matt",
        "DisplayPorts-Version": "1.2",
        "Dynamisches Kontrastverh\u00e4ltnis Marketingbezeichnung": "SmartContrast",
        "Einfach zu lesen Modus": "Ja",
        "Eingebaute Lautsprecher": "Ja",
        "Energieeffizienzklasse (SDR)": "C",
        "Energieeffizienzskala": "A bis G",
        "Energieverbrauch (SDR) pro 1.000 Stunden": "14 kWh",
        "Enth\u00e4lt nicht": "Quecksilber, PVC/BFR",
        "Farbpalette DCI-P3": "80%",
        "Farbskala": "76%",
        "Flimmerfreie Technologie": "Ja",
        "Fu\u00dffarbe": "Schwarz",
        "Ger\u00e4tebreite (inkl. Fu\u00df)": "613 mm",
        "Ger\u00e4teh\u00f6he (inkl. Fu\u00df)": "537 mm",
        "Ger\u00e4tetiefe (inkl. Fu\u00df)": "205 mm",
        "Gewicht (mit St\u00e4nder)": "6 kg",
        "Gewicht (ohne St\u00e4nder)": "4,4 kg",
        "Gleichstrom-Anschluss (DC)": "Ja",
        "HD-Typ": "Full HD",
        "HDCP": "Ja",
        "HDCP-Version": "1.4",
        "HDMI": "Ja",
        "HDMI-Version": "1.4",
        "Helligkeit (typisch)": "250 cd/m\u00b2",
        "Herstellerlink": "Philips",
        "Horizontaler Scanbereich": "30 - 85 kHz",
        "H\u00f6he (ohne Standfu\u00df)": "36,6 cm",
        "H\u00f6he bei Betrieb": "0 - 3658 m",
        "H\u00f6he bei Lagerung": "0 - 12192 m",
        "H\u00f6heneinstellung": "15 cm",
        "H\u00f6henverstellung": "Ja",
        "Integrierte Kamera": "Nein",
        "Integrierter USB-Hub": "Ja",
        "Kabelsperre-Slot": "Ja",
        "Komponentenvideo-Synchronisation": "Separate sync, Sync-on-green (SOG)",
        "Kontrastverh\u00e4ltnis": "1000:1",
        "Kontrastverh\u00e4ltnis (dynamisch)": "50000000:1",
        "Kopfh\u00f6rer-Anschluss": "3,5 mm",
        "Kopfh\u00f6rerausgang": "Ja",
        "Kopfh\u00f6rerausg\u00e4nge": "1",
        "LED-Anzeigen": "T\u00e4tigkeit, Stand-by",
        "Lichtsensor": "Ja",
        "Low-Blue-Light-Technologie": "Ja",
        "LowBlue-Modus": "Ja",
        "Luftfeuchtigkeit bei Lagerung": "20 - 80%",
        "Marktpositionierung": "Business",
        "Maximale Bildwiederholrate": "75 Hz",
        "Men\u00fcsprachen": "Vereinfachtes Chinesisch, Traditionelles Chinesisch, Tschechisch, Deutsch, Niederl\u00e4ndisch, Englisch, Spanisch, Finnisch, Franz\u00f6sisch, Griechisch, Ungarisch, Italienisch, Japanisch, Koreanisch, Polnisch, Portugiesisch, Russisch, Schwedisch, T\u00fcrkisch, Ukrainisch",
        "Mitgelieferte Kabel": "VGA, HDMI, DisplayPort, Audio (3,5 mm), AC",
        "Mitgelieferte Software": "SmartControl",
        "Mittlere Betriebsdauer zwischen Ausf\u00e4llen (MTBF)": "70000 h",
        "NTSC Abdeckung (typisch)": "88%",
        "NVIDIA G-SYNC": "Nein",
        "Nach Gebrauch recycelter Kunststoff": "85%",
        "Nachhaltigkeitszertifikate": "ENERGY STAR, RoHS, TCO",
        "Natives Seitenverh\u00e4ltnis": "16:9",
        "Neigungsverstellung": "Ja",
        "Neigungswinkelbereich": "-5 - 35\u00b0",
        "Netzteiltyp": "Intern",
        "Oberfl\u00e4chenh\u00e4rte": "3H",
        "On-Screen-Display (OSD)": "Ja",
        "PC Audio-Eingang": "Ja",
        "Paketgewicht": "9,63 kg",
        "Panel-Montage-Schnittstelle": "100 x 100 mm",
        "Panel-Typ": "IPS",
        "Pivot": "Ja",
        "Pivot Winkel": "-90 - 90\u00b0",
        "Pixel Abstand": "0,3114 x 0,3114 mm",
        "Pixeldichte": "82 ppi",
        "Plug & Play": "Ja",
        "Produktfarbe": "Schwarz",
        "Produktlink": "Link",
        "RGB-Farbraum": "sRGB",
        "RMS-Leistung": "2 W",
        "Rahmenloses Design": "Ja",
        "Reaktionszeit": "4 ms",
        "Recycelbares Verpackungsmaterial": "100%",
        "Relative Luftfeuchtigkeit in Betrieb": "20 - 80%",
        "Schwenkbar": "Ja",
        "Schwenkwinkelbereich": "-180 - 180\u00b0",
        "Seitenverh\u00e4ltnis": "16:9",
        "Sichtbare Gr\u00f6\u00dfe (horizontal)": "59,8 cm",
        "Sichtbare Gr\u00f6\u00dfe (vertikal)": "33,6 cm",
        "Slot-Typ Kabelsperre": "Kensington",
        "Stromverbrauch (PowerSave)": "9,2 W",
        "Stromverbrauch (Standardbetrieb)": "13,1 W",
        "Stromverbrauch (Standby)": "0,35 W",
        "St\u00e4nder enthalten": "Ja",
        "Sync-On-Green (SOG)": "Ja",
        "Temperaturbereich bei Lagerung": "-20 - 60 \u00b0C",
        "Tiefe (ohne Standfu\u00df)": "5,1 cm",
        "Touchscreen": "Nein",
        "Tr\u00fcbungsrate": "25%",
        "Typ der Hintergrundbeleuchtung": "W-LED",
        "USB-Hub-Version": "2.0 / 3.2 Gen 1 (3.1 Gen 1)",
        "USB-Upstream-Porttyp": "USB Typ-B",
        "Unterst\u00fctzte Grafik-Aufl\u00f6sungen": "1280 x 720 (HD 720), 1360 x 768 (WXGA), 1920 x 1080 (HD 1080)",
        "Unterst\u00fctzte Video-Modi": "720p, 768p, 1080p",
        "VESA Adaptive Sync unterst\u00fctzt": "Ja",
        "VESA-Halterung": "Ja",
        "Verpackungsart": "Box",
        "Verpackungsbreite": "700 mm",
        "Verpackungsh\u00f6he": "456 mm",
        "Verpackungstiefe": "215 mm",
        "Vertikaler Scanbereich": "48 - 75 Hz",
        "Vorderer Rahmen": "Schwarz",
        "Warentarifnummer (HS)": "85285210",
        "Zertifizierung": "CB, FCC Class B, ICES-003, CE Mark, TUV Ergo, TUV/GS, SEMKO, CU-EAC, EAEU RoHS, UKRAINIAN, TUV Eye Comfort certified",
        "sRGB": "Ja",
        "sRGB Abdeckung (klassisch)": "102%"
    },
    "raw_specifications_text": "Bildschirmdiagonale: 68,6 cm (27 Zoll)\nDisplay-Aufl\u00f6sung: 1920 x 1080 Pixel\nNatives Seitenverh\u00e4ltnis: 16:9\nBildschirmtechnologie: LED\nTouchscreen: Nein\nHD-Typ: Full HD\nPanel-Typ: IPS\nBildschirmform: Flach\nKontrastverh\u00e4ltnis: 1000:1\nMaximale Bildwiederholrate: 75 Hz\nAnzahl der Farben des Displays: 16,7 Millionen Farben\nTyp der Hintergrundbeleuchtung: W-LED\nHelligkeit (typisch): 250 cd/m\u00b2\nReaktionszeit: 4 ms\nDisplay-Oberfl\u00e4che: Matt\nBlendfreier Bildschirm: Ja\nUnterst\u00fctzte Grafik-Aufl\u00f6sungen: 1280 x 720 (HD 720), 1360 x 768 (WXGA), 1920 x 1080 (HD 1080)\nUnterst\u00fctzte Video-Modi: 720p, 768p, 1080p\nSeitenverh\u00e4ltnis: 16:9\nKontrastverh\u00e4ltnis (dynamisch): 50000000:1\nDynamisches Kontrastverh\u00e4ltnis Marketingbezeichnung: SmartContrast\nBildwinkel, horizontal: 178\u00b0\nBildwinkel, vertikal: 178\u00b0\nPixel Abstand: 0,3114 x 0,3114 mm\nPixeldichte: 82 ppi\nHorizontaler Scanbereich: 30 - 85 kHz\nVertikaler Scanbereich: 48 - 75 Hz\nSichtbare Gr\u00f6\u00dfe (horizontal): 59,8 cm\nSichtbare Gr\u00f6\u00dfe (vertikal): 33,6 cm\nDigital horizontale Frequenz: 30 - 85 kHz\nDigital vertikale Frequenz: 48 - 75 Hz\nSync-On-Green (SOG): Ja\nBildschirmdiagonale (cm): 68,6 cm\nDDC/CI: Ja\nTr\u00fcbungsrate: 25%\nOberfl\u00e4chenh\u00e4rte: 3H\nRGB-Farbraum: sRGB\nFarbskala: 76%\nsRGB Abdeckung (klassisch): 102%\nNTSC Abdeckung (typisch): 88%\nAdobe RGB-Abdeckung: 83%\nsRGB: Ja\nNVIDIA G-SYNC: Nein\nAMD FreeSync: Nein\nVESA Adaptive Sync unterst\u00fctzt: Ja\nKomponentenvideo-Synchronisation: Separate sync, Sync-on-green (SOG)\nFlimmerfreie Technologie: Ja\nLow-Blue-Light-Technologie: Ja\nEingebaute Lautsprecher: Ja\nIntegrierte Kamera: Nein\nAnzahl der Lautsprecher: 2\nRMS-Leistung: 2 W\nMarktpositionierung: Business\nProduktfarbe: Schwarz\nRahmenloses Design: Ja\nVorderer Rahmen: Schwarz\nAbnehmbarer Standfu\u00df: Ja\nFu\u00dffarbe: Schwarz\nZertifizierung: CB, FCC Class B, ICES-003, CE Mark, TUV Ergo, TUV/GS, SEMKO, CU-EAC, EAEU RoHS, UKRAINIAN, TUV Eye Comfort certified\nIntegrierter USB-Hub: Ja\nHDMI: Ja\nKopfh\u00f6rerausgang: Ja\nUSB-Hub-Version: 2.0 / 3.2 Gen 1 (3.1 Gen 1)\nUSB-Upstream-Porttyp: USB Typ-B\nAnzahl der vorgeschalteten Steckpl\u00e4tze: 1\nAnzahl der nachgeschalteten Steckpl\u00e4tze vom Typ USB-A: 4\nAnzahl VGA (D-Sub) Anschl\u00fcsse: 1\nDVI Anschluss: Ja\nAnzahl DVI-D-Anschl\u00fcsse: 1\nAnzahl HDMI-Anschl\u00fcsse: 1\nHDMI-Version: 1.4\nAnzahl DisplayPort Anschl\u00fcsse: 1.2\nDisplayPorts-Version: 1.2\nAudioanschl\u00fcsse: Ja\nKopfh\u00f6rerausg\u00e4nge: 1\nKopfh\u00f6rer-Anschluss: 3,5 mm\nPC Audio-Eingang: Ja\nHDCP: Ja\nHDCP-Version: 1.4\nGleichstrom-Anschluss (DC): Ja\nVESA-Halterung: Ja\nKabelsperre-Slot: Ja\nH\u00f6henverstellung: Ja\nPanel-Montage-Schnittstelle: 100 x 100 mm\nSlot-Typ Kabelsperre: Kensington\nH\u00f6heneinstellung: 15 cm\nPivot: Ja\nPivot Winkel: -90 - 90\u00b0\nSchwenkbar: Ja\nSchwenkwinkelbereich: -180 - 180\u00b0\nNeigungswinkelbereich: -5 - 35\u00b0\nOn-Screen-Display (OSD): Ja\nMen\u00fcsprachen: Vereinfachtes Chinesisch, Traditionelles Chinesisch, Tschechisch, Deutsch, Niederl\u00e4ndisch, Englisch, Spanisch, Finnisch, Franz\u00f6sisch, Griechisch, Ungarisch, Italienisch, Japanisch, Koreanisch, Polnisch, Portugiesisch, Russisch, Schwedisch, T\u00fcrkisch, Ukrainisch\nAnzahl OSD-Sprachen: 21\nPlug & Play: Ja\nLED-Anzeigen: T\u00e4tigkeit, Stand-by\nNeigungsverstellung: Ja\nEnergieeffizienzklasse (SDR): C\nEnergieverbrauch (SDR) pro 1.000 Stunden: 14 kWh\nStromverbrauch (Standardbetrieb): 13,1 W\nStromverbrauch (Standby): 0,35 W\nStromverbrauch (PowerSave): 9,2 W\nAC Eingangsspannung: 100 - 240 V\nAC Eingangsfrequenz: 50/60 Hz\nNetzteiltyp: Intern\nEnergieeffizienzskala: A bis G\nBetriebstemperatur: 0 - 40 \u00b0C\nTemperaturbereich bei Lagerung: -20 - 60 \u00b0C\nRelative Luftfeuchtigkeit in Betrieb: 20 - 80%\nLuftfeuchtigkeit bei Lagerung: 20 - 80%\nH\u00f6he bei Betrieb: 0 - 3658 m\nH\u00f6he bei Lagerung: 0 - 12192 m\nSt\u00e4nder enthalten: Ja\nMitgelieferte Kabel: VGA, HDMI, DisplayPort, Audio (3,5 mm), AC\nBetriebsanleitung: Ja\nMitgelieferte Software: SmartControl\nGer\u00e4tebreite (inkl. Fu\u00df): 613 mm\nGer\u00e4tetiefe (inkl. Fu\u00df): 205 mm\nGer\u00e4teh\u00f6he (inkl. Fu\u00df): 537 mm\nGewicht (mit St\u00e4nder): 6 kg\nBreite (ohne Standfu\u00df): 61,3 cm\nTiefe (ohne Standfu\u00df): 5,1 cm\nH\u00f6he (ohne Standfu\u00df): 36,6 cm\nGewicht (ohne St\u00e4nder): 4,4 kg\nVerpackungsbreite: 700 mm\nVerpackungstiefe: 215 mm\nVerpackungsh\u00f6he: 456 mm\nPaketgewicht: 9,63 kg\nVerpackungsart: Box\nNachhaltigkeitszertifikate: ENERGY STAR, RoHS, TCO\nEnth\u00e4lt nicht: Quecksilber, PVC/BFR\nNach Gebrauch recycelter Kunststoff: 85%\nWarentarifnummer (HS): 85285210\nFarbpalette DCI-P3: 80%\nAu\u00dfenverkleidungstyp: Texturiert\nRecycelbares Verpackungsmaterial: 100%\nLichtsensor: Ja\nEinfach zu lesen Modus: Ja\nLowBlue-Modus: Ja\nMittlere Betriebsdauer zwischen Ausf\u00e4llen (MTBF): 70000 h\nBild-Verbesserung: SmartImage\nBeh\u00f6rdliche Zulassung: CB; FCC Class B; ICES-003; CE Mark; TUV Ergo; TUV/GS; SEMKO; CU-EAC; EAEU RoHS; UKRAINIAN; TUV Eye Comfort certified\nDatenblatt: Kein Datenblatt verf\u00fcgbar\nProduktlink: Link\nHerstellerlink: Philips",
    "reference_file": "offer_reference_1893.json",
    "shop_name": "Syswork"
}