{
    "html_file": "offer_816_25.html",
    "name": "LG UltraWide 49WQ95X-W, 49\"",
    "offer_link": "https://ms-it-beratung.at/shop/details.php?art=410117&artname=LG+49%22+49WQ95X-W+UltraWide+QHD+HDMI+DP+USB+IPS+32%3A9+wei%DF+%28Spedit",
    "price": 1806.0,
    "raw_specifications": {
        "AC Eingangsspannung": "220 - 240 V",
        "AMD FreeSync": "Ja",
        "AMD FreeSync-Typ": "FreeSync Premium Pro",
        "Anzahl HDMI-Anschl\u00fcsse": "2",
        "Anzahl der Farben des Displays": "1,073 Milliarden Farben",
        "Bildschirmdiagonale": "124,5 cm (49 Zoll)",
        "Bildschirmdiagonale (cm)": "124 cm",
        "Bildschirmform": "Gebogen",
        "Bildwinkel, horizontal": "178\u00b0",
        "Bildwinkel, vertikal": "178\u00b0",
        "Display-Aufl\u00f6sung": "5120 x 1440 Pixel",
        "DisplayPorts-Version": "1.4",
        "Eingebaute Lautsprecher": "Ja",
        "Energieeffizienzklasse (HDR)": "G",
        "Energieeffizienzklasse (SDR)": "F",
        "Energieverbrauch (HDR) pro 1.000 Stunden": "109 kWh",
        "Energieverbrauch (SDR) pro 1.000 Stunden": "45 kWh",
        "Gewicht (mit St\u00e4nder)": "15,2 kg",
        "Gewicht (ohne St\u00e4nder)": "12,6 kg",
        "HD-Typ": "UltraWide Dual Quad HD",
        "HDCP": "Ja",
        "HDCP-Version": "2.2",
        "HDMI": "Ja",
        "Helligkeit (typisch)": "400 cd/m\u00b2",
        "High Dynamic Range Video (HDR) Unterst\u00fctzung": "Ja",
        "H\u00f6heneinstellung": "11 cm",
        "H\u00f6henverstellung": "Ja",
        "Integrierte Kamera": "Nein",
        "Integrierter USB-Hub": "Ja",
        "Kontrastverh\u00e4ltnis": "1000:1",
        "Maximale Bildwiederholrate": "144 Hz",
        "Men\u00fcsprachen": "Deutsch, Englisch, Spanisch, Finnisch, Franz\u00f6sisch, Hindi, Italienisch, Koreanisch, Russisch, Ukrainisch",
        "Mitgelieferte Kabel": "AC, DisplayPort, HDMI, USB Typ-C",
        "NVIDIA G-SYNC": "Ja",
        "NVIDIA G-SYNC-Typ": "G-SYNC Compatible",
        "Natives Seitenverh\u00e4ltnis": "32:9",
        "Neigungsverstellung": "Ja",
        "Neigungswinkelbereich": "-5 - 20\u00b0",
        "On-Screen-Display (OSD)": "Ja",
        "Paketgewicht": "19,9 kg",
        "Panel-Montage-Schnittstelle": "100 x 100 mm",
        "Panel-Typ": "IPS",
        "Pixel Abstand": "0,234 x 0,234 mm",
        "Produktfarbe": "Wei\u00df",
        "RGB-Farbraum": "DCI-P3",
        "RMS-Leistung": "20 W",
        "Reaktionszeit": "5 ms",
        "Schwenkbar": "Ja",
        "Schwenkwinkelbereich": "-15 - 15\u00b0",
        "Smart-Modi": "Energiesparend",
        "Stromverbrauch (Standardbetrieb)": "200 W",
        "Stromverbrauch (Standby)": "1 W",
        "Stromverbrauch (aus)": "0,3 W",
        "Technologie mit hohem Dynamikbereich (HDR)": "High Dynamic Range 10 (HDR10)",
        "Touchscreen": "Nein",
        "Typ der Hintergrundbeleuchtung": "LED",
        "USB Power Delivery": "Ja",
        "USB-Stromversorgung bis zu": "90 W",
        "VESA-Halterung": "Ja"
    },
    "raw_specifications_text": "Bildschirmdiagonale: 124,5 cm (49 Zoll)\nDisplay-Aufl\u00f6sung: 5120 x 1440 Pixel\nNatives Seitenverh\u00e4ltnis: 32:9\nTouchscreen: Nein\nHD-Typ: UltraWide Dual Quad HD\nPanel-Typ: IPS\nTyp der Hintergrundbeleuchtung: LED\nHelligkeit (typisch): 400 cd/m\u00b2\nReaktionszeit: 5 ms\nBildschirmform: Gebogen\nKontrastverh\u00e4ltnis: 1000:1\nMaximale Bildwiederholrate: 144 Hz\nBildwinkel, horizontal: 178\u00b0\nBildwinkel, vertikal: 178\u00b0\nAnzahl der Farben des Displays: 1,073 Milliarden Farben\nPixel Abstand: 0,234 x 0,234 mm\nBildschirmdiagonale (cm): 124 cm\nHigh Dynamic Range Video (HDR) Unterst\u00fctzung: Ja\nTechnologie mit hohem Dynamikbereich (HDR): High Dynamic Range 10 (HDR10)\nRGB-Farbraum: DCI-P3\nNVIDIA G-SYNC: Ja\nAMD FreeSync: Ja\nNVIDIA G-SYNC-Typ: G-SYNC Compatible\nAMD FreeSync-Typ: FreeSync Premium Pro\nSmart-Modi: Energiesparend\nEingebaute Lautsprecher: Ja\nIntegrierte Kamera: Nein\nRMS-Leistung: 20 W\nProduktfarbe: Wei\u00df\nIntegrierter USB-Hub: Ja\nUSB Power Delivery: Ja\nUSB-Stromversorgung bis zu: 90 W\nHDMI: Ja\nAnzahl HDMI-Anschl\u00fcsse: 2\nDisplayPorts-Version: 1.4\nHDCP: Ja\nHDCP-Version: 2.2\nVESA-Halterung: Ja\nPanel-Montage-Schnittstelle: 100 x 100 mm\nH\u00f6henverstellung: Ja\nH\u00f6heneinstellung: 11 cm\nSchwenkbar: Ja\nSchwenkwinkelbereich: -15 - 15\u00b0\nNeigungswinkelbereich: -5 - 20\u00b0\nOn-Screen-Display (OSD): Ja\nMen\u00fcsprachen: Deutsch, Englisch, Spanisch, Finnisch, Franz\u00f6sisch, Hindi, Italienisch, Koreanisch, Russisch, Ukrainisch\nNeigungsverstellung: Ja\nEnergieeffizienzklasse (SDR): F\nEnergieeffizienzklasse (HDR): G\nEnergieverbrauch (SDR) pro 1.000 Stunden: 45 kWh\nEnergieverbrauch (HDR) pro 1.000 Stunden: 109 kWh\nStromverbrauch (Standardbetrieb): 200 W\nStromverbrauch (Standby): 1 W\nStromverbrauch (aus): 0,3 W\nAC Eingangsspannung: 220 - 240 V\nMitgelieferte Kabel: AC, DisplayPort, HDMI, USB Typ-C\nGewicht (mit St\u00e4nder): 15,2 kg\nGewicht (ohne St\u00e4nder): 12,6 kg\nPaketgewicht: 19,9 kg",
    "reference_file": "offer_reference_816.json",
    "shop_name": "ms-it-beratung"
}