{
    "html_file": "offer_2365_8.html",
    "name": "Philips V-line 243V7QJABF, 23.8\"",
    "offer_link": "https://www.csv-direct.de/artinfo.php?artnr=AGX1671454&KATEGORIE=162&pva=geizhals2",
    "price": 111.41,
    "raw_specifications": {
        "3D": "Nein",
        "AC Eingangsfrequenz": "50 - 60 Hz",
        "AC Eingangsspannung": "100 - 240 V",
        "Anzahl DisplayPort Anschl\u00fcsse": "1.2",
        "Anzahl HDMI-Anschl\u00fcsse": "1",
        "Anzahl OSD-Sprachen": "21",
        "Anzahl VGA D-Sub Anschl\u00fcsse": "1",
        "Anzahl der Farben des Displays": "16,7 Millionen Farben",
        "Anzahl der Lautsprecher": "2",
        "Audioanschl\u00fcsse": "Nein",
        "Au\u00dfenverkleidungstyp": "Texturiert",
        "Beh\u00f6rdliche Zulassung": "UKRAINIAN; cETLus; CB; TUV/ISO9241-307; SEMKO; CU-EAC; EAEU RoHS; RCM; KCC; BSMI; CE Mark; FCC Class B; ICES-003; TUV Cert. \u2014 blue light cut-off",
        "Betriebstemperatur": "0 - 40 \u00b0C",
        "Bild-Verbesserung": "SmartImage",
        "Bildschirmdiagonale": "60,5 cm 23.8\"",
        "Bildschirmdiagonale cm": "60,5 cm",
        "Bildschirmform": "Flach",
        "Bildschirmtechnologie": "LED",
        "Bildwinkel, horizontal": "178\u00b0",
        "Bildwinkel, vertikal": "178\u00b0",
        "Breite ohne Standfu\u00df": "540 mm",
        "DVI Anschluss": "Nein",
        "Digital horizontale Frequenz": "30 - 83 kHz",
        "Digital vertikale Frequenz": "56 - 76 Hz",
        "Display-Aufl\u00f6sung": "1920 x 1080 Pixel",
        "DisplayPorts-Version": "1.2",
        "Dynamisches Kontrastverh\u00e4ltnis Marketingbezeichnung": "SmartContrast",
        "Empfohlene Aufl\u00f6sung": "1920 x 1080 @ 60 Hz",
        "Energieeffizienzklasse SDR": "E",
        "Energieeffizienzskala": "A bis G",
        "Energieverbrauch SDR pro 1.000 Stunden": "18 kWh",
        "Fu\u00dffarbe": "Schwarz",
        "Ger\u00e4tebreite inkl. Fu\u00df": "540 mm",
        "Ger\u00e4teh\u00f6he inkl. Fu\u00df": "415 mm",
        "Ger\u00e4tetiefe inkl. Fu\u00df": "209 mm",
        "Gewicht mit St\u00e4nder": "3,5 kg",
        "Gewicht ohne St\u00e4nder": "3,08 kg",
        "HD-Typ": "Full HD",
        "Helligkeit typisch": "250 cd/m\u00b2",
        "Horizontaler Scanbereich": "30 - 83 kHz",
        "H\u00f6he bei Betrieb": "0 - 3658 m",
        "H\u00f6he bei Lagerung": "0 - 12192 m",
        "H\u00f6he ohne Standfu\u00df": "325 mm",
        "H\u00f6henverstellung": "Nein",
        "Integrierte Kamera": "Nein",
        "Integrierter USB-Hub": "Nein",
        "Komponentenvideo-Synchronisation": "Separate sync, Sync-on-green SOG",
        "Kontrastverh\u00e4ltnis": "1000:1",
        "Kontrastverh\u00e4ltnis dynamisch": "200000000:1",
        "Kopfh\u00f6rerausg\u00e4nge": "1",
        "LED-Anzeigen": "T\u00e4tigkeit, Stand-by",
        "Marktpositionierung": "Haus",
        "Maximale Bildwiederholrate": "75 Hz",
        "Men\u00fcsprachen": "Vereinfachtes Chinesisch, Traditionelles Chinesisch, Tschechisch, Deutsch, Niederl\u00e4ndisch, Englisch, Spanisch, Finnisch, Franz\u00f6sisch, Griechisch, Ungarisch, Italienisch, Japanisch, Koreanisch, Polnisch, Portugiesisch, Russisch, Schwedisch, T\u00fcrkisch, Ukrainisch",
        "Mitgelieferte Kabel": "HDMI, AC",
        "Mittlere Betriebsdauer zwischen Ausf\u00e4llen MTBF": "50000 h",
        "Nachhaltigkeitszertifikate": "RoHS, EPEAT Gold, ENERGY STAR",
        "Natives Seitenverh\u00e4ltnis": "16:9",
        "Neigungswinkelbereich": "-5 - 20\u00b0",
        "Netzteiltyp": "Intern",
        "Paketgewicht": "4,82 kg",
        "Panel-Montage-Schnittstelle": "100 x 100 mm",
        "Panel-Typ": "IPS",
        "Pixel Abstand": "0,275 x 0,275 mm",
        "Pixeldichte": "93 ppi",
        "Produktfarbe": "Schwarz",
        "RGB-Farbraum": "sRGB",
        "RMS-Leistung": "4 W",
        "Reaktionszeit": "4 ms",
        "Recycelbares Verpackungsmaterial": "100",
        "Relative Luftfeuchtigkeit in Betrieb": "20 - 80",
        "Schwermetallfrei": "Hg Quecksilber",
        "Seitenverh\u00e4ltnis": "16:9",
        "Sichtbare Gr\u00f6\u00dfe horizontal": "52,7 cm",
        "Sichtbare Gr\u00f6\u00dfe vertikal": "29,6 cm",
        "Slot-Typ Kabelsperre": "Kensington",
        "Stromverbrauch Standardbetrieb": "14,13 W",
        "Stromverbrauch Standby": "0,5 W",
        "Stromverbrauch aus": "0,5 W",
        "Stromverbrauch max.": "21 W",
        "TV Tuner integriert": "Nein",
        "Temperaturbereich bei Lagerung": "-20 - 60 \u00b0C",
        "Tiefe ohne Standfu\u00df": "45 mm",
        "Touchscreen": "Nein",
        "Typ der Hintergrundbeleuchtung": "W-LED",
        "Unterst\u00fctzte Grafik-Aufl\u00f6sungen": "1920 x 1080 HD 1080",
        "Verpackungsart": "Box",
        "Verpackungsbreite": "588 mm",
        "Verpackungsh\u00f6he": "465 mm",
        "Verpackungstiefe": "115 mm",
        "Vertikaler Scanbereich": "56 - 76 Hz",
        "Vorderer Rahmen": "Schwarz",
        "Warentarifnummer HS": "85285210",
        "Zertifizierung": "UKRAINIAN, cETLus, CB, TUV/ISO9241-307, SEMKO, CU-EAC, EAEU RoHS, RCM, KCC, BSMI, CE Mark, FCC Class B, ICES-003, TUV Cert. \u2014 blue light cut-off"
    },
    "raw_specifications_text": "Bildschirmdiagonale: 60,5 cm 23.8\"\nDisplay-Aufl\u00f6sung: 1920 x 1080 Pixel\nNatives Seitenverh\u00e4ltnis: 16:9\nBildschirmtechnologie: LED\nTouchscreen: Nein\nHD-Typ: Full HD\nPanel-Typ: IPS\nBildschirmform: Flach\nKontrastverh\u00e4ltnis: 1000:1\nMaximale Bildwiederholrate: 75 Hz\nAnzahl der Farben des Displays: 16,7 Millionen Farben\nTyp der Hintergrundbeleuchtung: W-LED\nHelligkeit typisch: 250 cd/m\u00b2\nReaktionszeit: 4 ms\nUnterst\u00fctzte Grafik-Aufl\u00f6sungen: 1920 x 1080 HD 1080\nSeitenverh\u00e4ltnis: 16:9\nKontrastverh\u00e4ltnis dynamisch: 200000000:1\nDynamisches Kontrastverh\u00e4ltnis Marketingbezeichnung: SmartContrast\nBildwinkel, horizontal: 178\u00b0\nBildwinkel, vertikal: 178\u00b0\nPixel Abstand: 0,275 x 0,275 mm\nPixeldichte: 93 ppi\nHorizontaler Scanbereich: 30 - 83 kHz\nVertikaler Scanbereich: 56 - 76 Hz\nSichtbare Gr\u00f6\u00dfe horizontal: 52,7 cm\nSichtbare Gr\u00f6\u00dfe vertikal: 29,6 cm\nDigital horizontale Frequenz: 30 - 83 kHz\nDigital vertikale Frequenz: 56 - 76 Hz\nBildschirmdiagonale cm: 60,5 cm\nRGB-Farbraum: sRGB\n3D: Nein\nKomponentenvideo-Synchronisation: Separate sync, Sync-on-green SOG\nIntegrierte Kamera: Nein\nAnzahl der Lautsprecher: 2\nRMS-Leistung: 4 W\nMarktpositionierung: Haus\nProduktfarbe: Schwarz\nVorderer Rahmen: Schwarz\nFu\u00dffarbe: Schwarz\nSchwermetallfrei: Hg Quecksilber\nZertifizierung: UKRAINIAN, cETLus, CB, TUV/ISO9241-307, SEMKO, CU-EAC, EAEU RoHS, RCM, KCC, BSMI, CE Mark, FCC Class B, ICES-003, TUV Cert. \u2014 blue light cut-off\nIntegrierter USB-Hub: Nein\nAnzahl VGA D-Sub Anschl\u00fcsse: 1\nDVI Anschluss: Nein\nAnzahl HDMI-Anschl\u00fcsse: 1\nAnzahl DisplayPort Anschl\u00fcsse: 1.2\nDisplayPorts-Version: 1.2\nAudioanschl\u00fcsse: Nein\nKopfh\u00f6rerausg\u00e4nge: 1\nH\u00f6henverstellung: Nein\nPanel-Montage-Schnittstelle: 100 x 100 mm\nSlot-Typ Kabelsperre: Kensington\nNeigungswinkelbereich: -5 - 20\u00b0\nMen\u00fcsprachen: Vereinfachtes Chinesisch, Traditionelles Chinesisch, Tschechisch, Deutsch, Niederl\u00e4ndisch, Englisch, Spanisch, Finnisch, Franz\u00f6sisch, Griechisch, Ungarisch, Italienisch, Japanisch, Koreanisch, Polnisch, Portugiesisch, Russisch, Schwedisch, T\u00fcrkisch, Ukrainisch\nAnzahl OSD-Sprachen: 21\nLED-Anzeigen: T\u00e4tigkeit, Stand-by\nEnergieeffizienzklasse SDR: E\nEnergieverbrauch SDR pro 1.000 Stunden: 18 kWh\nStromverbrauch Standardbetrieb: 14,13 W\nStromverbrauch Standby: 0,5 W\nStromverbrauch max.: 21 W\nStromverbrauch aus: 0,5 W\nAC Eingangsspannung: 100 - 240 V\nAC Eingangsfrequenz: 50 - 60 Hz\nNetzteiltyp: Intern\nEnergieeffizienzskala: A bis G\nBetriebstemperatur: 0 - 40 \u00b0C\nTemperaturbereich bei Lagerung: -20 - 60 \u00b0C\nRelative Luftfeuchtigkeit in Betrieb: 20 - 80\nH\u00f6he bei Betrieb: 0 - 3658 m\nH\u00f6he bei Lagerung: 0 - 12192 m\nMitgelieferte Kabel: HDMI, AC\nGer\u00e4tebreite inkl. Fu\u00df: 540 mm\nGer\u00e4tetiefe inkl. Fu\u00df: 209 mm\nGer\u00e4teh\u00f6he inkl. Fu\u00df: 415 mm\nGewicht mit St\u00e4nder: 3,5 kg\nBreite ohne Standfu\u00df: 540 mm\nTiefe ohne Standfu\u00df: 45 mm\nH\u00f6he ohne Standfu\u00df: 325 mm\nGewicht ohne St\u00e4nder: 3,08 kg\nVerpackungsbreite: 588 mm\nVerpackungstiefe: 115 mm\nVerpackungsh\u00f6he: 465 mm\nPaketgewicht: 4,82 kg\nVerpackungsart: Box\nNachhaltigkeitszertifikate: RoHS, EPEAT Gold, ENERGY STAR\nWarentarifnummer HS: 85285210\nTV Tuner integriert: Nein\nAu\u00dfenverkleidungstyp: Texturiert\nRecycelbares Verpackungsmaterial: 100\nMittlere Betriebsdauer zwischen Ausf\u00e4llen MTBF: 50000 h\nEmpfohlene Aufl\u00f6sung: 1920 x 1080 @ 60 Hz\nBild-Verbesserung: SmartImage\nBeh\u00f6rdliche Zulassung: UKRAINIAN; cETLus; CB; TUV/ISO9241-307; SEMKO; CU-EAC; EAEU RoHS; RCM; KCC; BSMI; CE Mark; FCC Class B; ICES-003; TUV Cert. \u2014 blue light cut-off",
    "reference_file": "offer_reference_2365.json",
    "shop_name": "CSV-Direct.de"
}