{
    "html_file": "offer_835_6.html",
    "name": "LG UltraGear 32GQ85X-B, 31.5\"",
    "offer_link": "https://www.ditech.at/details.php?artnr=354358",
    "price": 617.9,
    "raw_specifications": {
        "AMD FreeSync Premium": "Ja",
        "Adaptive Sync": "Ja",
        "Anschl\u00fcsse - DisplayPort 1.4 260Hz@2560x1440": "1",
        "Anschl\u00fcsse - HDMI 2.1 240Hz@2560x1440": "2",
        "Anschl\u00fcsse - HDMI 2.1 260Hz@2560x1440": "2",
        "Anwendung": "station\u00e4r",
        "Audio": "1x Line-Out",
        "Aufl\u00f6sung": "2560x1440",
        "Beschichtung": "matt (non-glare),  H\u00e4rtegrad 3H",
        "Besonderheiten": "Slim Bezel,  Steuerkreuz,  Sicherheitsschloss (Kensington),  Beleuchtung auf R\u00fcckseite (RGB),  HDCP 2.2,  DTS HP:X",
        "Bildwiederholfrequenz": "240Hz (260Hz OC)",
        "Blickwinkel": "178\u00b0/178\u00b0",
        "Diagonale": "31.5\"/80cm",
        "Energieeffizienzklasse HDR (A bis G)": "G",
        "Energieverbrauch HDR": "79kWh/1000h",
        "Energieverbrauch SDR": "33kWh/1000h",
        "Ergonomie": "110mm (h\u00f6henverstellbar),  90\u00b0 (Pivot),  keine Angabe (drehbar),  +15\u00b0/-5\u00b0 (neigbar),  keine Angabe (Schr\u00e4glage)",
        "FRC": "ja (8bit+2bit)",
        "Farbe": "schwarz",
        "Farbraum - DCI-P3": "98%",
        "Farbtiefe": "10bit (1.07 Mrd. Farben)",
        "Form": "gerade (flat)",
        "Gewicht": "8.20kg (mit Standfu\u00df),  5.90kg (ohne Standfu\u00df)",
        "HDR": "VESA DisplayHDR 600",
        "Helligkeit": "450cd/m\u00b2 (typisch),  600cd/m\u00b2 (HDR)",
        "Herstellergarantie": "drei Jahre (Bring-In)",
        "Hintergrundbeleuchtung": "White-LED,  flicker-free,  Blaulichtfilter",
        "Kontrast - statisch": "1.000:1",
        "Leistungsaufnahme": "110W (maximal),  55W (typisch),  keine Angabe (Energielabel alt A+++ bis G),  0.3W (Standby)",
        "Panel": "IPS (ATW-IPS/Nano IPS)",
        "Panel-Hersteller": "LG Display (LM315WQ3-SSA1)",
        "Reaktionszeit - GtG": "1ms",
        "Screen-to-Body-Ratio": "89.5% (berechnet)",
        "Seitenverh\u00e4ltnis": "16:9",
        "Signalfrequenz": "keine Angabe (horizontal),  keine Angabe (vertikal)",
        "Stromversorgung": "DC-In (externes Netzteil)",
        "USB-Hub In": "1x USB-B 3.0",
        "USB-Hub Out": "2x USB-A 3.0",
        "USB-Schreibweise": "Link",
        "VESA": "100x100 (belegt)",
        "Weitere Anschl\u00fcsse": "N/A"
    },
    "raw_specifications_text": "Adaptive Sync: Ja\nAMD FreeSync Premium: Ja\nAnschl\u00fcsse - DisplayPort 1.4 260Hz@2560x1440: 1\nAnschl\u00fcsse - HDMI 2.1 240Hz@2560x1440: 2\nAnschl\u00fcsse - HDMI 2.1 260Hz@2560x1440: 2\nAnwendung: station\u00e4r\nAudio: 1x Line-Out\nAufl\u00f6sung: 2560x1440\nBeschichtung: matt (non-glare),  H\u00e4rtegrad 3H\nBesonderheiten: Slim Bezel,  Steuerkreuz,  Sicherheitsschloss (Kensington),  Beleuchtung auf R\u00fcckseite (RGB),  HDCP 2.2,  DTS HP:X\nBildwiederholfrequenz: 240Hz (260Hz OC)\nBlickwinkel: 178\u00b0/178\u00b0\nDiagonale: 31.5\"/80cm\nEnergieeffizienzklasse HDR (A bis G): G\nEnergieverbrauch HDR: 79kWh/1000h\nEnergieverbrauch SDR: 33kWh/1000h\nErgonomie: 110mm (h\u00f6henverstellbar),  90\u00b0 (Pivot),  keine Angabe (drehbar),  +15\u00b0/-5\u00b0 (neigbar),  keine Angabe (Schr\u00e4glage)\nFarbe: schwarz\nFarbraum - DCI-P3: 98%\nFarbtiefe: 10bit (1.07 Mrd. Farben)\nForm: gerade (flat)\nFRC: ja (8bit+2bit)\nGewicht: 8.20kg (mit Standfu\u00df),  5.90kg (ohne Standfu\u00df)\nHDR: VESA DisplayHDR 600\nHelligkeit: 450cd/m\u00b2 (typisch),  600cd/m\u00b2 (HDR)\nHerstellergarantie: drei Jahre (Bring-In)\nHintergrundbeleuchtung: White-LED,  flicker-free,  Blaulichtfilter\nKontrast - statisch: 1.000:1\nLeistungsaufnahme: 110W (maximal),  55W (typisch),  keine Angabe (Energielabel alt A+++ bis G),  0.3W (Standby)\nPanel: IPS (ATW-IPS/Nano IPS)\nPanel-Hersteller: LG Display (LM315WQ3-SSA1)\nReaktionszeit - GtG: 1ms\nScreen-to-Body-Ratio: 89.5% (berechnet)\nSeitenverh\u00e4ltnis: 16:9\nSignalfrequenz: keine Angabe (horizontal),  keine Angabe (vertikal)\nStromversorgung: DC-In (externes Netzteil)\nUSB-Hub In: 1x USB-B 3.0\nUSB-Hub Out: 2x USB-A 3.0\nUSB-Schreibweise: Link\nVESA: 100x100 (belegt)\nWeitere Anschl\u00fcsse: N/A",
    "reference_file": "offer_reference_835.json",
    "shop_name": "DiTech.at"
}