{
    "html_file": "offer_734_40.html",
    "name": "iiyama ProLite XU2494HSU-B2, 23.8\"",
    "offer_link": "https://click.cptrack.de/?rd=true&k=H2jZOPSoNfIohcnyCFLwA-Bj-V3olLZ6EVU6Lagx4MwEmNiYncE8WkSZdvh5opWPGy_yTbYED5SeNM2e6jUszA~~&rdlink=https%3A%2F%2Fwww.cyberport.at%2F%3FDEEP%3D6104-2N2%26APID%3D66",
    "price": 135.0,
    "raw_specifications": {
        "Aufl\u00f6sung": "1.920x1.080 Full HD",
        "Betrachtungswinkel h/v": "178\u00b0/178\u00b0",
        "Bildformat": "16:9",
        "Breite in mm": "540mm",
        "DVI": "kein",
        "Displaygr\u00f6\u00dfe in Zoll": "23,8 Zoll",
        "Displaygr\u00f6\u00dfe in cm": "60.5 cm",
        "Displayport": "1x DP",
        "Farbraumabdeckung": "96% sRGB",
        "Farbtiefe": "8 Bit / 16,7 Mio Farben",
        "Gewicht in kg": "3,2 kg",
        "HDMI": "1x HDMI",
        "Helligkeit": "250 cd/m\u00b2",
        "H\u00f6he in mm": "401mm",
        "H\u00f6henverstellbar": "ohne",
        "Jahresverbrauch": "16 kWh",
        "Kontrast dynamisch": "80.000.000:1",
        "Kontrast typisch": "3.000:1",
        "Lautsprecher": "2x",
        "Leistung": "2W",
        "Leistungsaufnahme": "19 Watt",
        "Oberfl\u00e4che": "matt",
        "Reaktionszeit": "4 ms",
        "Technologie": "VA/PVA/MVA/AMVA",
        "Tiefe in mm": "200mm",
        "USB-C": "kein",
        "Wandmontage": "VESA100x100"
    },
    "raw_specifications_text": "Jahresverbrauch: 16 kWh\nLeistungsaufnahme: 19 Watt\nDisplaygr\u00f6\u00dfe in cm: 60.5 cm\nDisplaygr\u00f6\u00dfe in Zoll: 23,8 Zoll\nTechnologie: VA/PVA/MVA/AMVA\nAufl\u00f6sung: 1.920x1.080 Full HD\nBildformat: 16:9\nOberfl\u00e4che: matt\nFarbraumabdeckung: 96% sRGB\nFarbtiefe: 8 Bit / 16,7 Mio Farben\nHelligkeit: 250 cd/m\u00b2\nKontrast typisch: 3.000:1\nKontrast dynamisch: 80.000.000:1\nReaktionszeit: 4 ms\nBetrachtungswinkel h/v: 178\u00b0/178\u00b0\nHDMI: 1x HDMI\nDVI: kein\nDisplayport: 1x DP\nUSB-C: kein\nLautsprecher: 2x\nLeistung: 2W\nH\u00f6henverstellbar: ohne\nWandmontage: VESA100x100\nBreite in mm: 540mm\nH\u00f6he in mm: 401mm\nTiefe in mm: 200mm\nGewicht in kg: 3,2 kg",
    "reference_file": "offer_reference_734.json",
    "shop_name": "Cyberport.at"
}