{
    "html_file": "offer_869_10.html",
    "name": "Dell P3223QE, 31.5\"",
    "offer_link": "https://www.csv-direct.de/artinfo.php?artnr=A1621404&KATEGORIE=162&pva=geizhals2",
    "price": 511.01,
    "raw_specifications": {
        "AC Eingangsfrequenz": "50 - 60 Hz",
        "AC Eingangsspannung": "100 - 240 V",
        "AMD FreeSync": "Nein",
        "Anzahl DisplayPort Anschl\u00fcsse": "1",
        "Anzahl HDMI-Anschl\u00fcsse": "1",
        "Anzahl RJ-45-Anschl\u00fcsse": "1",
        "Anzahl der Farben des Displays": "1,07 Milliarden Farben",
        "Anzahl der Upstream-Ports USB Typ-C": "1",
        "Anzahl der nachgeschalteten Steckpl\u00e4tze vom Typ USB-A": "4",
        "Anzahl der vorgeschalteten Steckpl\u00e4tze": "1",
        "Betriebstemperatur": "0 - 40 \u00b0C",
        "Bildschirmdiagonale": "80 cm 31.5\"",
        "Bildschirmdiagonale cm": "80 cm",
        "Bildschirmform": "Flach",
        "Bildschirmtechnologie": "LCD",
        "Bildwinkel, horizontal": "178\u00b0",
        "Bildwinkel, vertikal": "178\u00b0",
        "Breite ohne Standfu\u00df": "712,4 mm",
        "Display-Aufl\u00f6sung": "3840 x 2160 Pixel",
        "DisplayPort Kabell\u00e4nge": "1,8 m",
        "DisplayPorts-Version": "1.4",
        "Eingangsstrom": "2.3 A",
        "Eingebaute Lautsprecher": "Nein",
        "Energieeffizienzklasse HDR": "Nicht verf\u00fcgbar",
        "Energieeffizienzklasse SDR": "F",
        "Energieeffizienzskala": "A bis G",
        "Energieverbrauch SDR pro 1.000 Stunden": "31 kWh",
        "Enth\u00e4lt nicht": "PVC/BFR",
        "Farbskala": "99",
        "Fu\u00dffarbe": "Silber",
        "Ger\u00e4tebreite inkl. Fu\u00df": "712,4 mm",
        "Ger\u00e4teh\u00f6he inkl. Fu\u00df": "468,7 mm",
        "Ger\u00e4tetiefe inkl. Fu\u00df": "233,2 mm",
        "Gewicht mit St\u00e4nder": "9,9 kg",
        "Gewicht ohne St\u00e4nder": "5,28 kg",
        "HD-Typ": "4K Ultra HD",
        "HDMI-Version": "2.0",
        "Helligkeit peak": "350 cd/m\u00b2",
        "Helligkeit typisch": "350 cd/m\u00b2",
        "High Dynamic Range Video HDR Unterst\u00fctzung": "Nein",
        "Horizontaler Scanbereich": "30 - 140 kHz",
        "H\u00f6he bei Betrieb": "0 - 5000 m",
        "H\u00f6he bei Lagerung": "0 - 12192 m",
        "H\u00f6he ohne Standfu\u00df": "417,2 mm",
        "H\u00f6heneinstellung": "15 cm",
        "Integrierte Kamera": "Nein",
        "Kontrastverh\u00e4ltnis": "1000:1",
        "Kopfh\u00f6rerausgang": "Nein",
        "Luftfeuchtigkeit bei Lagerung": "5 - 90",
        "Marktpositionierung": "Business",
        "Maximale Aufl\u00f6sung": "3840 x 2160 Pixel",
        "Maximale Bildwiederholrate": "60 Hz",
        "Mitgelieferte Kabel": "DisplayPort, USB Typ-C auf USB Typ-A, USB Typ-C auf USB Typ-C",
        "NVIDIA G-SYNC": "Nein",
        "Nachhaltigkeitszertifikate": "ENERGY STAR, RoHS, TCO",
        "Natives Seitenverh\u00e4ltnis": "16:9",
        "Neigungswinkelbereich": "-5 - 21\u00b0",
        "Netzteiltyp": "Intern",
        "Oberfl\u00e4chenh\u00e4rte": "3H",
        "Paketgewicht": "13,4 kg",
        "Panel-Montage-Schnittstelle": "100 x 100 mm",
        "Panel-Typ": "TFT",
        "Pivot Winkel": "-90 - 90\u00b0",
        "Pixel Abstand": "0,18159 x 0,18159 mm",
        "Pixeldichte": "139,87 ppi",
        "Produktfarbe": "Schwarz",
        "RGB-Farbraum": "sRGB",
        "Rahmenbreite Seite": "7,55 mm",
        "Rahmenbreite oben": "7,57 mm",
        "Rahmenbreite unten": "1,74 cm",
        "Reaktionszeit": "8 ms",
        "Reaktionszeit schnell": "5 ms",
        "Relative Luftfeuchtigkeit in Betrieb": "20 - 80",
        "Schwenkwinkelbereich": "-30 - 30\u00b0",
        "Schwermetallfrei": "Hg Quecksilber",
        "Sichtbare Gr\u00f6\u00dfe horizontal": "69,7 cm",
        "Sichtbare Gr\u00f6\u00dfe vertikal": "39,2 cm",
        "Slot-Typ Kabelsperre": "Kensington",
        "Stromverbrauch Standardbetrieb": "30,6 W",
        "Stromverbrauch Standby": "0,3 W",
        "Stromverbrauch aus": "0,3 W",
        "Stromverbrauch max.": "180 W",
        "Temperaturbereich bei Lagerung": "-20 - 60 \u00b0C",
        "Tiefe ohne Standfu\u00df": "56,2 mm",
        "Touchscreen": "Nein",
        "Typ der Hintergrundbeleuchtung": "LED",
        "USB Kabell\u00e4nge": "1 m",
        "USB-Stromversorgung bis zu": "90 W",
        "USB-Upstream-Porttyp": "USB Typ-C",
        "Unterst\u00fctzte Video-Modi": "480p, 576p, 720p, 1080i, 1080p, 2160p",
        "Vertikaler Scanbereich": "24 - 75 Hz",
        "Vorderer Rahmen": "Schwarz",
        "WLAN": "Nein",
        "Warentarifnummer HS": "85285210"
    },
    "raw_specifications_text": "Bildschirmdiagonale: 80 cm 31.5\"\nDisplay-Aufl\u00f6sung: 3840 x 2160 Pixel\nNatives Seitenverh\u00e4ltnis: 16:9\nBildschirmtechnologie: LCD\nTouchscreen: Nein\nHD-Typ: 4K Ultra HD\nPanel-Typ: TFT\nBildschirmform: Flach\nKontrastverh\u00e4ltnis: 1000:1\nMaximale Bildwiederholrate: 60 Hz\nAnzahl der Farben des Displays: 1,07 Milliarden Farben\nTyp der Hintergrundbeleuchtung: LED\nHelligkeit peak: 350 cd/m\u00b2\nHelligkeit typisch: 350 cd/m\u00b2\nReaktionszeit: 8 ms\nUnterst\u00fctzte Video-Modi: 480p, 576p, 720p, 1080i, 1080p, 2160p\nBildwinkel, horizontal: 178\u00b0\nBildwinkel, vertikal: 178\u00b0\nReaktionszeit schnell: 5 ms\nPixel Abstand: 0,18159 x 0,18159 mm\nPixeldichte: 139,87 ppi\nHorizontaler Scanbereich: 30 - 140 kHz\nVertikaler Scanbereich: 24 - 75 Hz\nSichtbare Gr\u00f6\u00dfe horizontal: 69,7 cm\nSichtbare Gr\u00f6\u00dfe vertikal: 39,2 cm\nBildschirmdiagonale cm: 80 cm\nHigh Dynamic Range Video HDR Unterst\u00fctzung: Nein\nOberfl\u00e4chenh\u00e4rte: 3H\nRGB-Farbraum: sRGB\nFarbskala: 99\nNVIDIA G-SYNC: Nein\nAMD FreeSync: Nein\nEingebaute Lautsprecher: Nein\nIntegrierte Kamera: Nein\nMarktpositionierung: Business\nProduktfarbe: Schwarz\nVorderer Rahmen: Schwarz\nFu\u00dffarbe: Silber\nSchwermetallfrei: Hg Quecksilber\nKopfh\u00f6rerausgang: Nein\nUSB-Upstream-Porttyp: USB Typ-C\nAnzahl der vorgeschalteten Steckpl\u00e4tze: 1\nAnzahl der Upstream-Ports USB Typ-C: 1\nAnzahl der nachgeschalteten Steckpl\u00e4tze vom Typ USB-A: 4\nUSB-Stromversorgung bis zu: 90 W\nAnzahl HDMI-Anschl\u00fcsse: 1\nHDMI-Version: 2.0\nAnzahl DisplayPort Anschl\u00fcsse: 1\nDisplayPorts-Version: 1.4\nWLAN: Nein\nPanel-Montage-Schnittstelle: 100 x 100 mm\nSlot-Typ Kabelsperre: Kensington\nH\u00f6heneinstellung: 15 cm\nPivot Winkel: -90 - 90\u00b0\nSchwenkwinkelbereich: -30 - 30\u00b0\nNeigungswinkelbereich: -5 - 21\u00b0\nEnergieeffizienzklasse SDR: F\nEnergieeffizienzklasse HDR: Nicht verf\u00fcgbar\nEnergieverbrauch SDR pro 1.000 Stunden: 31 kWh\nStromverbrauch Standardbetrieb: 30,6 W\nStromverbrauch Standby: 0,3 W\nStromverbrauch max.: 180 W\nStromverbrauch aus: 0,3 W\nAC Eingangsspannung: 100 - 240 V\nAC Eingangsfrequenz: 50 - 60 Hz\nEingangsstrom: 2.3 A\nNetzteiltyp: Intern\nEnergieeffizienzskala: A bis G\nBetriebstemperatur: 0 - 40 \u00b0C\nTemperaturbereich bei Lagerung: -20 - 60 \u00b0C\nRelative Luftfeuchtigkeit in Betrieb: 20 - 80\nLuftfeuchtigkeit bei Lagerung: 5 - 90\nH\u00f6he bei Betrieb: 0 - 5000 m\nH\u00f6he bei Lagerung: 0 - 12192 m\nMitgelieferte Kabel: DisplayPort, USB Typ-C auf USB Typ-A, USB Typ-C auf USB Typ-C\nDisplayPort Kabell\u00e4nge: 1,8 m\nGer\u00e4tebreite inkl. Fu\u00df: 712,4 mm\nGer\u00e4tetiefe inkl. Fu\u00df: 233,2 mm\nGer\u00e4teh\u00f6he inkl. Fu\u00df: 468,7 mm\nGewicht mit St\u00e4nder: 9,9 kg\nBreite ohne Standfu\u00df: 712,4 mm\nTiefe ohne Standfu\u00df: 56,2 mm\nH\u00f6he ohne Standfu\u00df: 417,2 mm\nGewicht ohne St\u00e4nder: 5,28 kg\nRahmenbreite Seite: 7,55 mm\nRahmenbreite oben: 7,57 mm\nRahmenbreite unten: 1,74 cm\nPaketgewicht: 13,4 kg\nUSB Kabell\u00e4nge: 1 m\nNachhaltigkeitszertifikate: ENERGY STAR, RoHS, TCO\nEnth\u00e4lt nicht: PVC/BFR\nWarentarifnummer HS: 85285210\nMaximale Aufl\u00f6sung: 3840 x 2160 Pixel\nAnzahl RJ-45-Anschl\u00fcsse: 1",
    "reference_file": "offer_reference_869.json",
    "shop_name": "CSV-Direct.de"
}