{
    "html_file": "offer_378_14.html",
    "name": "Acer Vero B7 B247Ybmiprzxv, 23.8\"",
    "offer_link": "https://www.alternate.at/Acer/Vero-B247Ybmiprzxv-LED-Monitor/html/product/1878480?partner=AtGeizhalsat&campaign=Monitor/Acer/1878480",
    "price": 152.9,
    "raw_specifications": {
        "": "Ausgangsleistung",
        "Abmessungen": "Breite: 54 cm x H\u00f6he: 49,9 cm x Tiefe/L\u00e4nge: 19,3 cm",
        "Anschl\u00fcsse": "1x HDMI-Eingang, (HDMI-Version: 1.4), 1x DisplayPort-Eingang, (DisplayPort-Version: 1,2), 1x VGA-Eingang, 1x 3,5-mm-Audio-Eingang, 1x Kopfh\u00f6rer-Ausgang, 4x USB-A-3.2 Gen 1 (5 Gbit/s), 1x USB-B-3.2 (5 Gbit/s)",
        "Bild": "Glaretyp",
        "Bildschirmaufl\u00f6sung": "1.920 x 1.080 Pixel",
        "Bildschirmdiagonale": "60,5 cm (23,8 Zoll)",
        "EAN": "4711121314100",
        "Energieeffizienzklasse (SDR)": "E (A - G)",
        "Energieverbauch pro 1000 Stunden (SDR)": "18 kWh",
        "Ergonomie": "Typ",
        "Farbe": "schwarz",
        "Features": "Kensington-Schloss, Kindersicherung",
        "Frequenz": "Vertikal",
        "Geeignet f\u00fcr": "Business",
        "Gewicht": "5,6 kg",
        "Hersteller-Nr.": "UM.QB7EE.046",
        "Lautsprecher": "2 Lautsprecher",
        "Leistungsaufnahme im Bereitschafts- und Aus-Zustand": "0,5 Watt",
        "Leistungsaufnahme im Ein-Zustand bei Standard-Dynamikumfang (SDR)": "18 Watt",
        "Standards": "Video",
        "Stromversorgung": "Eco-Off",
        "Typ": "LED-Monitor",
        "Wandhalterung": "VESA kompatibel (100 x 100 mm)",
        "Weitere Informationen": "72% NTSC",
        "Zubeh\u00f6r": "Vorhanden"
    },
    "raw_specifications_text": "Energieeffizienzklasse (SDR): E (A - G)\nEnergieverbauch pro 1000 Stunden (SDR): 18 kWh\nLeistungsaufnahme im Ein-Zustand bei Standard-Dynamikumfang (SDR): 18 Watt\nLeistungsaufnahme im Bereitschafts- und Aus-Zustand: 0,5 Watt\nBildschirmdiagonale: 60,5 cm (23,8 Zoll)\nBildschirmaufl\u00f6sung: 1.920 x 1.080 Pixel\nTyp: LED-Monitor\nFarbe: schwarz\nEAN: 4711121314100\nHersteller-Nr.: UM.QB7EE.046\nGeeignet f\u00fcr: Business\nBild: Glaretyp\n: Ausgangsleistung\nFrequenz: Vertikal\nAnschl\u00fcsse: 1x HDMI-Eingang, (HDMI-Version: 1.4), 1x DisplayPort-Eingang, (DisplayPort-Version: 1,2), 1x VGA-Eingang, 1x 3,5-mm-Audio-Eingang, 1x Kopfh\u00f6rer-Ausgang, 4x USB-A-3.2 Gen 1 (5 Gbit/s), 1x USB-B-3.2 (5 Gbit/s)\nErgonomie: Typ\nStromversorgung: Eco-Off\nLautsprecher: 2 Lautsprecher\nStandards: Video\nWandhalterung: VESA kompatibel (100 x 100 mm)\nFeatures: Kensington-Schloss, Kindersicherung\nWeitere Informationen: 72% NTSC\nZubeh\u00f6r: Vorhanden\nAbmessungen: Breite: 54 cm x H\u00f6he: 49,9 cm x Tiefe/L\u00e4nge: 19,3 cm\nGewicht: 5,6 kg",
    "reference_file": "offer_reference_378.json",
    "shop_name": "Alternate.at"
}