{
    "html_file": "offer_2030_0.html",
    "name": "ASUS ZenScreen MB16ACE, 15.6\"",
    "offer_link": "https://www.proshop.at/Bildschirm/ASUS-15-Bildschirm-ZenScreen-MB16ACE-Portable-USB-Monitor-156-Full-HD-USB-Type-C-Grey-5-ms/2824280?utm_source=geizhals&utm_medium=cpc&utm_campaign=pricesite",
    "price": 214.07,
    "raw_specifications": {
        "Abmessungen (Breite x Tiefe x H\u00f6he)": "35.97 cm x 0.8 cm x 22.64 cm",
        "Besonderheiten": "HDCP, blendfreie, Skin-Tone Selection, ASUS Splendid Video Preset Mode, ASUS QuickFit Virtual Scale, ASUS GamePlus, Slim Design, flimmerfreie Technologie, ASUS EyeCare Technology, automatische Drehung, Blaulichtfilter-Technologie, Farbtemperatur Auswahl, superschmales Einfassungsdesign, Low Blue Light-Technologie",
        "Bildschirmtyp": "IPS",
        "Diagonalabmessung": "39.6 cm (15.6\")",
        "Display-Typ": "LED-hintergrundbeleuchteter LCD-Monitor / TFT-Aktivmatrix",
        "EAN": "4718017500357",
        "ENERGY STAR zertifiziert": "Ja",
        "Eingangsanschl\u00fcsse": "USB-C",
        "Energie Effizienzklasse": "Klasse B",
        "Enthaltene Kabel": "1 x USB-C Kabel  1 x USB-C auf USB-A Adapter",
        "Erforderliches Betriebssystem": "Microsoft Windows 7 / 8.1 / 10",
        "Farbe": "Dunkelgrau",
        "Ger\u00e4tetyp": "LED-hintergrundbeleuchteter LCD-Monitor - 39.6 cm (15.6\")",
        "Gewicht": "710 g",
        "Helligkeit": "250 cd/m\u00b2",
        "Hersteller": "ASUS",
        "Hintergrundbeleuchtungs-Technologie": "LED-Hintergrundbeleuchtung",
        "Horizontaler Betrachtungswinkel": "178",
        "Kennzeichnung": "UL, VCCI, BSMI, cUL, WHQL, CB, CCC, FCC, RoHS, KCC, WEEE, J-MOSS, UkrSEPRO, RCM, TUV Rheinland Low Blue Light Certification, CU, TUV Rheinland Flicker Free Certification",
        "Kontrast": "800:1 (dynamisch)",
        "Leistungsaufnahme im Ein-Zustand": "6 W",
        "Modell": "90LM0381-B04170",
        "Native Aufl\u00f6sung": "Full HD (1080p) 1920 x 1080 bei 60 Hz",
        "Pixelpitch": "0.179 mm",
        "Produktbeschreibung": "ASUS ZenScreen MB16ACE - LED-Monitor - Full HD (1080p) - 39.6 cm (15.6\")",
        "Reaktionszeit": "5 ms (Gray-to-Gray)",
        "Schnittstellen": "USB-C",
        "Seitenverh\u00e4ltnis": "16:9",
        "Stromverbrauch (Aus-Modus)": "0.3 Watt",
        "Stromverbrauch (typisch)": "8 Watt",
        "Stromverbrauch SDR (eingeschaltet)": "6 kWh/1.000 h",
        "Stromverbrauch im Standby-Modus": "0.5 Watt",
        "Transportbreite": "43.4 cm",
        "Transportgewicht": "1.65 kg",
        "Transporth\u00f6he": "29 cm",
        "Transporttiefe": "7.6 cm",
        "Umweltschutzstandards": "ENERGY STAR-qualifiziert",
        "Vertikaler Betrachtungswinkel": "178",
        "Waren-Nr.": "2824280",
        "Zubeh\u00f6r im Lieferumfang": "ASUS Smart Case",
        "Zum Hersteller": "www.asus.com/index.aspx"
    },
    "raw_specifications_text": "Hersteller: ASUS\nWaren-Nr.: 2824280\nModell: 90LM0381-B04170\nEAN: 4718017500357\nZum Hersteller: www.asus.com/index.aspx\nProduktbeschreibung: ASUS ZenScreen MB16ACE - LED-Monitor - Full HD (1080p) - 39.6 cm (15.6\")\nGer\u00e4tetyp: LED-hintergrundbeleuchteter LCD-Monitor - 39.6 cm (15.6\")\nEnergie Effizienzklasse: Klasse B\nLeistungsaufnahme im Ein-Zustand: 6 W\nBildschirmtyp: IPS\nSeitenverh\u00e4ltnis: 16:9\nNative Aufl\u00f6sung: Full HD (1080p) 1920 x 1080 bei 60 Hz\nPixelpitch: 0.179 mm\nHelligkeit: 250 cd/m\u00b2\nKontrast: 800:1 (dynamisch)\nReaktionszeit: 5 ms (Gray-to-Gray)\nEingangsanschl\u00fcsse: USB-C\nFarbe: Dunkelgrau\nAbmessungen (Breite x Tiefe x H\u00f6he): 35.97 cm x 0.8 cm x 22.64 cm\nGewicht: 710 g\nUmweltschutzstandards: ENERGY STAR-qualifiziert\nKennzeichnung: UL, VCCI, BSMI, cUL, WHQL, CB, CCC, FCC, RoHS, KCC, WEEE, J-MOSS, UkrSEPRO, RCM, TUV Rheinland Low Blue Light Certification, CU, TUV Rheinland Flicker Free Certification\nDisplay-Typ: LED-hintergrundbeleuchteter LCD-Monitor / TFT-Aktivmatrix\nDiagonalabmessung: 39.6 cm (15.6\")\nHorizontaler Betrachtungswinkel: 178\nVertikaler Betrachtungswinkel: 178\nHintergrundbeleuchtungs-Technologie: LED-Hintergrundbeleuchtung\nBesonderheiten: HDCP, blendfreie, Skin-Tone Selection, ASUS Splendid Video Preset Mode, ASUS QuickFit Virtual Scale, ASUS GamePlus, Slim Design, flimmerfreie Technologie, ASUS EyeCare Technology, automatische Drehung, Blaulichtfilter-Technologie, Farbtemperatur Auswahl, superschmales Einfassungsdesign, Low Blue Light-Technologie\nSchnittstellen: USB-C\nZubeh\u00f6r im Lieferumfang: ASUS Smart Case\nEnthaltene Kabel: 1 x USB-C Kabel  1 x USB-C auf USB-A Adapter\nStromverbrauch SDR (eingeschaltet): 6 kWh/1.000 h\nStromverbrauch (typisch): 8 Watt\nStromverbrauch im Standby-Modus: 0.5 Watt\nStromverbrauch (Aus-Modus): 0.3 Watt\nErforderliches Betriebssystem: Microsoft Windows 7 / 8.1 / 10\nTransportbreite: 43.4 cm\nTransporttiefe: 7.6 cm\nTransporth\u00f6he: 29 cm\nTransportgewicht: 1.65 kg\nENERGY STAR zertifiziert: Ja",
    "reference_file": "offer_reference_2030.json",
    "shop_name": "Proshop.at"
}