{
    "html_file": "offer_1804_0.html",
    "name": "LG UltraWide 34WN750-B, 34\"",
    "offer_link": "https://www.proshop.at/Bildschirm/LG-34-Bildschirm-34WN750-B-3440x1440-75Hz-IPS-HDR10-USB-HUB-Speakers-Black-5-ms-AMD-FreeSync/2884613?utm_source=geizhals&utm_medium=cpc&utm_campaign=pricesite",
    "price": 477.26,
    "raw_specifications": {
        "Abmessungen (Breite x Tiefe x H\u00f6he)": "81.65 cm x 22.67 cm x 56.6 cm - mit Fu\u00df",
        "Abmessungen (Breite x Tiefe x H\u00f6he) - mit Fu\u00df": "81.65 cm x 22.67 cm x 56.6 cm",
        "Adaptive-Sync Technologie": "AMD FreeSync",
        "Ausgangsleistung/Kanal": "7 Watt",
        "Besonderheiten": "Geteilter Bildschirm, Energy Saver, Flicker Safe, Reader Mode, MaxxAudio, Color Calibrated, Black Stabilizer, DAS Mode (Dynamic Action Sync), nahezu rahmenloses Display an 3 Seiten, HDR Effect",
        "Bildschirmtyp": "IPS",
        "Details zu Abmessungen & Gewicht": "Mit Fu\u00df - Breite: 81.65 cm - Tiefe: 22.67 cm - H\u00f6he: 56.6 cm - Gewicht: 8.6 kg  Ohne Fu\u00df - Breite: 81.65 cm - Tiefe: 4.55 cm - H\u00f6he: 36.53 cm - Gewicht: 6.9 kg",
        "Diagonalabmessung": "86.72 cm (34\")",
        "Display-Typ": "LED-hintergrundbeleuchteter LCD-Monitor / TFT-Aktivmatrix",
        "EAN": "8806098724673",
        "Eingangsanschl\u00fcsse": "2xHDMI, DisplayPort",
        "Eingangsspannung": "Wechselstrom 100-240 V (50/60 Hz)",
        "Einstellungen der Anzeigeposition": "H\u00f6he, Neigung",
        "Energie Effizienzklasse": "Klasse G",
        "Energieklasse (HDR)": "Klasse G",
        "Energierverbrauch Sleep": "0.5 Watt",
        "Enthaltene Kabel": "1 x HDMI-Kabel",
        "Farbraum": "99% sRGB (CIE 1931)",
        "Farbunterst\u00fctzung": "16,7 Millionen Farben",
        "Ger\u00e4tetyp": "LED-hintergrundbeleuchteter LCD-Monitor - 86.72 cm (34\")",
        "Gewicht": "8.6 kg",
        "HDR-Format": "HDR10",
        "HDR-f\u00e4hig": "HDR10",
        "Helligkeit": "300 cd/m\u00b2",
        "Hersteller": "LG",
        "Hintergrundbeleuchtungs-Technologie": "LED-Hintergrundbeleuchtung",
        "Horizontaler Betrachtungswinkel": "178",
        "Integrierte Peripherieger\u00e4te": "USB 3.0-Hub",
        "Kontrast": "1000:1 / 5000000:1 (dynamisch)",
        "Leistungsmerkmale": "Slot f\u00fcr Sicherheitsschloss (Kabelschloss getrennt erh\u00e4ltlich), abnehmbarer St\u00e4nder",
        "Mitgelieferte Software": "Dual Controller Software, On-Screen Control",
        "Modell": "34WN750-B",
        "Native Aufl\u00f6sung": "UWQHD 3440 x 1440 bei 75 Hz",
        "Pixelpitch": "0.2325 mm",
        "Produktbeschreibung": "LG UltraWide 34WN750P-B - WN750P Series - LED-Monitor - 86.72 cm (34\") - HDR",
        "Reaktionszeit": "5 ms (Gray-to-Gray)",
        "Schlosstyp zur Diebstahlsicherung": "Kensington Slot",
        "Schnittstellen": "2 x HDMI  DisplayPort 1.4  USB 3.0 Upstream  2 x USB 3.0 Downstream  Kopfh\u00f6rer",
        "Seitenverh\u00e4ltnis": "21:9",
        "Spannung": "Wechselstrom 100-240 V (50/60 Hz)",
        "Stromverbrauch (max.)": "67 Watt",
        "Stromverbrauch (typisch)": "45 Watt",
        "Stromverbrauch HDR (eingeschaltet)": "49 kWh/1.000 h",
        "Stromverbrauch SDR (eingeschaltet)": "32 kWh/1.000 h",
        "Typ": "Lautsprecher - Stereo",
        "VESA-Halterung": "100 x 100 mm",
        "Vertikaler Betrachtungswinkel": "178",
        "Waren-Nr.": "2884613",
        "Zum Hersteller": "www.lge.com"
    },
    "raw_specifications_text": "Hersteller: LG\nWaren-Nr.: 2884613\nModell: 34WN750-B\nEAN: 8806098724673\nZum Hersteller: www.lge.com\nProduktbeschreibung: LG UltraWide 34WN750P-B - WN750P Series - LED-Monitor - 86.72 cm (34\") - HDR\nGer\u00e4tetyp: LED-hintergrundbeleuchteter LCD-Monitor - 86.72 cm (34\")\nEnergie Effizienzklasse: Klasse G\nAdaptive-Sync Technologie: AMD FreeSync\nLeistungsmerkmale: Slot f\u00fcr Sicherheitsschloss (Kabelschloss getrennt erh\u00e4ltlich), abnehmbarer St\u00e4nder\nBildschirmtyp: IPS\nSeitenverh\u00e4ltnis: 21:9\nNative Aufl\u00f6sung: UWQHD 3440 x 1440 bei 75 Hz\nPixelpitch: 0.2325 mm\nHelligkeit: 300 cd/m\u00b2\nKontrast: 1000:1 / 5000000:1 (dynamisch)\nHDR-f\u00e4hig: HDR10\nReaktionszeit: 5 ms (Gray-to-Gray)\nFarbunterst\u00fctzung: 16,7 Millionen Farben\nFarbraum: 99% sRGB (CIE 1931)\nEingangsanschl\u00fcsse: 2xHDMI, DisplayPort\nEinstellungen der Anzeigeposition: H\u00f6he, Neigung\nSpannung: Wechselstrom 100-240 V (50/60 Hz)\nAbmessungen (Breite x Tiefe x H\u00f6he) - mit Fu\u00df: 81.65 cm x 22.67 cm x 56.6 cm\nGewicht: 8.6 kg\nDisplay-Typ: LED-hintergrundbeleuchteter LCD-Monitor / TFT-Aktivmatrix\nEnergieklasse (HDR): Klasse G\nDiagonalabmessung: 86.72 cm (34\")\nIntegrierte Peripherieger\u00e4te: USB 3.0-Hub\nHDR-Format: HDR10\nHorizontaler Betrachtungswinkel: 178\nVertikaler Betrachtungswinkel: 178\nHintergrundbeleuchtungs-Technologie: LED-Hintergrundbeleuchtung\nBesonderheiten: Geteilter Bildschirm, Energy Saver, Flicker Safe, Reader Mode, MaxxAudio, Color Calibrated, Black Stabilizer, DAS Mode (Dynamic Action Sync), nahezu rahmenloses Display an 3 Seiten, HDR Effect\nAbmessungen (Breite x Tiefe x H\u00f6he): 81.65 cm x 22.67 cm x 56.6 cm - mit Fu\u00df\nTyp: Lautsprecher - Stereo\nAusgangsleistung/Kanal: 7 Watt\nSchnittstellen: 2 x HDMI  DisplayPort 1.4  USB 3.0 Upstream  2 x USB 3.0 Downstream  Kopfh\u00f6rer\nVESA-Halterung: 100 x 100 mm\nEnthaltene Kabel: 1 x HDMI-Kabel\nSchlosstyp zur Diebstahlsicherung: Kensington Slot\nEingangsspannung: Wechselstrom 100-240 V (50/60 Hz)\nStromverbrauch SDR (eingeschaltet): 32 kWh/1.000 h\nStromverbrauch HDR (eingeschaltet): 49 kWh/1.000 h\nStromverbrauch (typisch): 45 Watt\nStromverbrauch (max.): 67 Watt\nEnergierverbrauch Sleep: 0.5 Watt\nMitgelieferte Software: Dual Controller Software, On-Screen Control\nDetails zu Abmessungen & Gewicht: Mit Fu\u00df - Breite: 81.65 cm - Tiefe: 22.67 cm - H\u00f6he: 56.6 cm - Gewicht: 8.6 kg  Ohne Fu\u00df - Breite: 81.65 cm - Tiefe: 4.55 cm - H\u00f6he: 36.53 cm - Gewicht: 6.9 kg",
    "reference_file": "offer_reference_1804.json",
    "shop_name": "Proshop.at"
}