{
    "html_file": "offer_36_13.html",
    "name": "ASUS TUF Gaming VG34VQL3A, 34\"",
    "offer_link": "https://ms-it-beratung.at/shop/details.php?art=443595&artname=ASUS+TUF+Gaming+VG34VQL3A+86.7cm+%2821%3A9%29+UWQHD+HDMI+DP",
    "price": 678.0,
    "raw_specifications": {
        "AC Eingangsfrequenz": "50/60 Hz",
        "AC Eingangsspannung": "100 - 240 V",
        "AMD FreeSync": "Ja",
        "AMD FreeSync-Typ": "FreeSync Premium Pro",
        "Abnehmbarer Standfu\u00df": "Ja",
        "Anzahl DisplayPort Anschl\u00fcsse": "2",
        "Anzahl HDMI-Anschl\u00fcsse": "2",
        "Anzahl der Farben des Displays": "16,7 Millionen Farben",
        "Anzahl der nachgeschalteten Steckpl\u00e4tze vom Typ USB-A": "3",
        "Bewertung der Bildschirmkr\u00fcmmung": "1500R",
        "Bildschirmdiagonale": "86,4 cm (34\")",
        "Bildschirmform": "Gebogen",
        "Bildschirmtechnologie": "LCD",
        "Bildwinkel, horizontal": "178\u00b0",
        "Bildwinkel, vertikal": "178\u00b0",
        "Blendfreier Bildschirm": "Ja",
        "Breite (ohne Standfu\u00df)": "808 mm",
        "Digital horizontale Frequenz": "267 - 267 kHz",
        "Digital vertikale Frequenz": "48 - 180 Hz",
        "Display-Aufl\u00f6sung": "3440 x 1440 Pixel",
        "DisplayPorts-Version": "1.4",
        "Eingebaute Lautsprecher": "Ja",
        "Energieeffizienzklasse (HDR)": "G",
        "Energieeffizienzklasse (SDR)": "F",
        "Energieeffizienzskala": "A bis G",
        "Energieverbrauch (HDR) pro 1.000 Stunden": "42 kWh",
        "Energieverbrauch (SDR) pro 1.000 Stunden": "28 kWh",
        "Flimmerfreie Technologie": "Ja",
        "Ger\u00e4tebreite (inkl. Fu\u00df)": "808 mm",
        "Ger\u00e4teh\u00f6he (inkl. Fu\u00df)": "541 mm",
        "Ger\u00e4tetiefe (inkl. Fu\u00df)": "250 mm",
        "Gewicht (mit St\u00e4nder)": "8,1 kg",
        "Gewicht (ohne St\u00e4nder)": "5,8 kg",
        "HD-Typ": "UltraWide Quad HD",
        "HDCP": "Ja",
        "HDCP-Version": "2.2",
        "HDMI": "Ja",
        "HDMI-Version": "2.0",
        "Helligkeit (peak)": "400 cd/m\u00b2",
        "Helligkeit (typisch)": "400 cd/m\u00b2",
        "High Dynamic Range Video (HDR) Unterst\u00fctzung": "Ja",
        "H\u00f6he (ohne Standfu\u00df)": "364 mm",
        "H\u00f6heneinstellung": "13 cm",
        "H\u00f6henverstellung": "Ja",
        "Integrierte Kamera": "Nein",
        "Integrierter USB-Hub": "Ja",
        "Kabelsperre-Slot": "Ja",
        "Kontrastverh\u00e4ltnis": "4000:1",
        "Kopfh\u00f6rerausgang": "Ja",
        "Low-Blue-Light-Technologie": "Ja",
        "Marktpositionierung": "Gaming",
        "Maximale Bildwiederholrate": "180 Hz",
        "Mitgelieferte Kabel": "AC, DisplayPort, HDMI, USB Typ-A auf USB Typ-B",
        "NVIDIA G-SYNC": "Nein",
        "Natives Seitenverh\u00e4ltnis": "21:9",
        "Neigungsverstellung": "Ja",
        "Neigungswinkelbereich": "-5 - 20\u00b0",
        "Paketgewicht": "11,3 kg",
        "Panel-Montage-Schnittstelle": "100 x 100 mm",
        "Panel-Typ": "VA",
        "Pixel Abstand": "0,232 x 0,232 mm",
        "Produktfarbe": "Schwarz",
        "RMS-Leistung": "4 W",
        "Reaktionszeit": "1 ms",
        "Reduzierung der Bewegungsunsch\u00e4rfe": "Ja",
        "Schattensteuerung": "Ja",
        "Schnellstart\u00fcbersicht": "Ja",
        "Schwenkbar": "Ja",
        "Schwenkwinkelbereich": "-10 - 10\u00b0",
        "Sichtbare Gr\u00f6\u00dfe (horizontal)": "79,7 cm",
        "Sichtbare Gr\u00f6\u00dfe (vertikal)": "33,4 cm",
        "Slot-Typ Kabelsperre": "Kensington",
        "Spiel-Modus": "Ja",
        "Stromeingang": "Ja",
        "Stromverbrauch (PowerSave)": "0,5 W",
        "Stromverbrauch (Standardbetrieb)": "27 W",
        "Stromverbrauch (aus)": "0,3 W",
        "St\u00e4nder enthalten": "Ja",
        "Technologie mit hohem Dynamikbereich (HDR)": "High Dynamic Range 10 (HDR10)",
        "Tiefe (ohne Standfu\u00df)": "111 mm",
        "Touchscreen": "Nein",
        "USB-Hub-Version": "3.2 Gen 2 (3.1 Gen 2)",
        "VESA-Halterung": "Ja",
        "Verpackungsart": "Box",
        "Verpackungsbreite": "915 mm",
        "Verpackungsh\u00f6he": "495 mm",
        "Verpackungstiefe": "280 mm",
        "Zertifizierung": "T\u00dcV Flicker-free T\u00dcV Low Blue Light VESA DisplayHDR 400 AMD FreeSync Premium Pro"
    },
    "raw_specifications_text": "Bildschirmdiagonale: 86,4 cm (34\")\nDisplay-Aufl\u00f6sung: 3440 x 1440 Pixel\nNatives Seitenverh\u00e4ltnis: 21:9\nBildschirmtechnologie: LCD\nTouchscreen: Nein\nHD-Typ: UltraWide Quad HD\nPanel-Typ: VA\nHelligkeit (peak): 400 cd/m\u00b2\nHelligkeit (typisch): 400 cd/m\u00b2\nReaktionszeit: 1 ms\nBlendfreier Bildschirm: Ja\nBildschirmform: Gebogen\nBewertung der Bildschirmkr\u00fcmmung: 1500R\nKontrastverh\u00e4ltnis: 4000:1\nMaximale Bildwiederholrate: 180 Hz\nBildwinkel, horizontal: 178\u00b0\nBildwinkel, vertikal: 178\u00b0\nAnzahl der Farben des Displays: 16,7 Millionen Farben\nPixel Abstand: 0,232 x 0,232 mm\nSichtbare Gr\u00f6\u00dfe (horizontal): 79,7 cm\nSichtbare Gr\u00f6\u00dfe (vertikal): 33,4 cm\nDigital horizontale Frequenz: 267 - 267 kHz\nDigital vertikale Frequenz: 48 - 180 Hz\nHigh Dynamic Range Video (HDR) Unterst\u00fctzung: Ja\nTechnologie mit hohem Dynamikbereich (HDR): High Dynamic Range 10 (HDR10)\nNVIDIA G-SYNC: Nein\nAMD FreeSync: Ja\nAMD FreeSync-Typ: FreeSync Premium Pro\nFlimmerfreie Technologie: Ja\nLow-Blue-Light-Technologie: Ja\nSchattensteuerung: Ja\nReduzierung der Bewegungsunsch\u00e4rfe: Ja\nSpiel-Modus: Ja\nEingebaute Lautsprecher: Ja\nIntegrierte Kamera: Nein\nRMS-Leistung: 4 W\nMarktpositionierung: Gaming\nProduktfarbe: Schwarz\nAbnehmbarer Standfu\u00df: Ja\nZertifizierung: T\u00dcV Flicker-free T\u00dcV Low Blue Light VESA DisplayHDR 400 AMD FreeSync Premium Pro\nIntegrierter USB-Hub: Ja\nUSB-Hub-Version: 3.2 Gen 2 (3.1 Gen 2)\nAnzahl der nachgeschalteten Steckpl\u00e4tze vom Typ USB-A: 3\nHDMI: Ja\nAnzahl HDMI-Anschl\u00fcsse: 2\nHDMI-Version: 2.0\nAnzahl DisplayPort Anschl\u00fcsse: 2\nDisplayPorts-Version: 1.4\nKopfh\u00f6rerausgang: Ja\nHDCP: Ja\nHDCP-Version: 2.2\nStromeingang: Ja\nVESA-Halterung: Ja\nPanel-Montage-Schnittstelle: 100 x 100 mm\nKabelsperre-Slot: Ja\nSlot-Typ Kabelsperre: Kensington\nH\u00f6henverstellung: Ja\nH\u00f6heneinstellung: 13 cm\nSchwenkbar: Ja\nSchwenkwinkelbereich: -10 - 10\u00b0\nNeigungswinkelbereich: -5 - 20\u00b0\nNeigungsverstellung: Ja\nEnergieeffizienzklasse (SDR): F\nEnergieeffizienzklasse (HDR): G\nEnergieverbrauch (SDR) pro 1.000 Stunden: 28 kWh\nEnergieverbrauch (HDR) pro 1.000 Stunden: 42 kWh\nStromverbrauch (Standardbetrieb): 27 W\nStromverbrauch (aus): 0,3 W\nStromverbrauch (PowerSave): 0,5 W\nAC Eingangsspannung: 100 - 240 V\nAC Eingangsfrequenz: 50/60 Hz\nEnergieeffizienzskala: A bis G\nSt\u00e4nder enthalten: Ja\nMitgelieferte Kabel: AC, DisplayPort, HDMI, USB Typ-A auf USB Typ-B\nSchnellstart\u00fcbersicht: Ja\nGer\u00e4tebreite (inkl. Fu\u00df): 808 mm\nGer\u00e4tetiefe (inkl. Fu\u00df): 250 mm\nGer\u00e4teh\u00f6he (inkl. Fu\u00df): 541 mm\nGewicht (mit St\u00e4nder): 8,1 kg\nBreite (ohne Standfu\u00df): 808 mm\nTiefe (ohne Standfu\u00df): 111 mm\nH\u00f6he (ohne Standfu\u00df): 364 mm\nGewicht (ohne St\u00e4nder): 5,8 kg\nVerpackungsbreite: 915 mm\nVerpackungstiefe: 280 mm\nVerpackungsh\u00f6he: 495 mm\nPaketgewicht: 11,3 kg\nVerpackungsart: Box",
    "reference_file": "offer_reference_36.json",
    "shop_name": "ms-it-beratung"
}