{
    "html_file": "offer_1305_3.html",
    "name": "LG 27UP600-W, 27\"",
    "offer_link": "https://www.office-partner.de/productredirect/index/sku/18164765?sPartner=p-geizhals-at&campaign=psm/geizhals-at/",
    "price": 352.84,
    "raw_specifications": {
        "Anschl\u00fcsse": "HDMI, DisplayPort, Kopfh\u00f6reranschluss",
        "Artikelnummer": "18164765",
        "Aufl\u00f6sung Kurzname": "Full HD, UHD, 4K",
        "Bezeichnung des Herstellers": "LG 27UP600-W",
        "Bildwiederholungsrate": "60,00 Hz",
        "Breite": "6135,00 mm",
        "Display Features": "FlickerFree",
        "Display Sync": "AMD FreeSync, Adaptive Sync",
        "Displaygr\u00f6\u00dfe": "68,58 cm (27 Zoll)",
        "EEK - Spektrum": "AG",
        "Energieeffizienzklasse": "G",
        "Geh\u00e4usefarbe des Ger\u00e4tes": "Silber",
        "Gewicht": "0,10 kg",
        "Gewicht inkl. Verpackung in Kg": "6,40 kg",
        "Helligkeit Bereich": "300 - 450 cd/m\u00b2",
        "Hersteller": "LG Electronics",
        "H\u00f6he": "4548,00 mm",
        "Inhalt (ml oder g)": "0,00 ml",
        "Kapazit\u00e4t (Seiten)": "0",
        "Kontrastverh\u00e4ltnis (typisch) Bereich": "800:1 bis 1.200:1",
        "LCD-Technologie": "IPS Panel",
        "L\u00e4nge": "2115,00 mm",
        "Produktart": "Monitore",
        "Reaktionszeit": "5,00 ms",
        "Seitenverh\u00e4ltnis": "16:9",
        "Shop Herstellernummer": "27UP600-W",
        "Standard-EAN": "8806091246424",
        "Verpackung - Breite in cm": "71,20 cm",
        "Verpackung - H\u00f6he in cm": "43,60 cm",
        "Verpackung - L\u00e4nge in cm": "15,40 cm",
        "max. Aufl\u00f6sung": "3.840 x 2.160 Pixel (16:9)"
    },
    "raw_specifications_text": "Displaygr\u00f6\u00dfe: 68,58 cm (27 Zoll)\nEnergieeffizienzklasse: G\nGeh\u00e4usefarbe des Ger\u00e4tes: Silber\nGewicht: 0,10 kg\nAnschl\u00fcsse: HDMI, DisplayPort, Kopfh\u00f6reranschluss\nHersteller: LG Electronics\nKontrastverh\u00e4ltnis (typisch) Bereich: 800:1 bis 1.200:1\nDisplay Features: FlickerFree\nHelligkeit Bereich: 300 - 450 cd/m\u00b2\nProduktart: Monitore\nDisplay Sync: AMD FreeSync, Adaptive Sync\nAufl\u00f6sung Kurzname: Full HD, UHD, 4K\nInhalt (ml oder g): 0,00 ml\nKapazit\u00e4t (Seiten): 0\nEEK - Spektrum: AG\nBreite: 6135,00 mm\nGewicht inkl. Verpackung in Kg: 6,40 kg\nVerpackung - L\u00e4nge in cm: 15,40 cm\nVerpackung - H\u00f6he in cm: 43,60 cm\nVerpackung - Breite in cm: 71,20 cm\nArtikelnummer: 18164765\nStandard-EAN: 8806091246424\nShop Herstellernummer: 27UP600-W\nBezeichnung des Herstellers: LG 27UP600-W\nH\u00f6he: 4548,00 mm\nL\u00e4nge: 2115,00 mm\nmax. Aufl\u00f6sung: 3.840 x 2.160 Pixel (16:9)\nSeitenverh\u00e4ltnis: 16:9\nLCD-Technologie: IPS Panel\nReaktionszeit: 5,00 ms\nBildwiederholungsrate: 60,00 Hz",
    "reference_file": "offer_reference_1305.json",
    "shop_name": "office-partner (AT)"
}