{
    "html_file": "offer_2132_0.html",
    "name": "HP 27mx, 27\"",
    "offer_link": "https://www.taufnaus.de/product/10618340",
    "price": 552.68,
    "raw_specifications": {
        "Abmessungen (Breite x Tiefe x H\u00f6he)": "61.36 cm x 21.64 cm x 51.02 cm - mit Fu\u00df",
        "Adaptive-Sync Technologie": "AMD FreeSync",
        "Besonderheiten": "Abnehmbar, Frame Rate Control (FRC), Micro Edge, 72 % NTSC Farbraum",
        "Bildschirmbeschichtung": "Blendfrei",
        "Bildschirmtyp": "TN",
        "Details zu Abmessungen & Gewicht": "Mit Fu\u00df - Breite: 61.36 cm - Tiefe: 21.64 cm - H\u00f6he: 51.02 cm - Gewicht: 6.78 kg",
        "Diagonalabmessung": "68.6 cm (27\")",
        "Display-Typ": "LED-hintergrundbeleuchteter LCD-Monitor / TFT-Aktivmatrix",
        "Eingangsspannung": "Wechselstrom 120/230 V (50/60 Hz)",
        "Einstellungen der Anzeigeposition": "Pivot (Rotation), Drehung, Neigung",
        "Energie Effizienzklasse": "Klasse F",
        "Enthaltene Kabel": "1 x HDMI-Kabel",
        "Farbraum": "72% NTSC",
        "Farbunterst\u00fctzung": "16,7 Millionen Farben",
        "Gewicht": "6.78 kg",
        "Helligkeit": "400 cd/m\u00b2",
        "Hintergrundbeleuchtungs-Technologie": "LED-Hintergrundbeleuchtung",
        "Horizontale Bildwiederholrate": "30 - 89 kHz",
        "Horizontaler Betrachtungswinkel": "170",
        "Kennzeichnung": "Plug and Play, CSA, UL, VCCI, BSMI, NOM, TUV S, WHQL, CB, CCC, PSB, FCC, ISO 9241-307, KCC, ICES, KC, CEL, EAC, ISC",
        "Kontrast": "1000:1 / 12000000:1 (dynamisch)",
        "Leistungsaufnahme im Ein-Zustand": "25.9 W",
        "Leistungsmerkmale": "Slot f\u00fcr Sicherheitsschloss (Kabelschloss getrennt erh\u00e4ltlich), abnehmbarer St\u00e4nder",
        "Lokalisierung": "Englisch / Europa",
        "Max. Betriebstemperatur": "35 \u00b0C",
        "Min Betriebstemperatur": "5 \u00b0C",
        "Native Aufl\u00f6sung": "Full HD (1080p) 1920 x 1080 bei 60 Hz",
        "Neigungswinkel": "-4/+20",
        "Pixelpitch": "0.311 mm",
        "Ppi": "81.6",
        "Reaktionszeit": "1 ms (Grau-zu-Grau mit Overdrive)",
        "Rotationswinkel": "90",
        "Schlosstyp zur Diebstahlsicherung": "Kensington Slot",
        "Schnittstellen": "Kopfh\u00f6rer \u00a6 HDMI (HDCP) \u00a6 DisplayPort (HDCP)",
        "Schwenkwinkel": "360",
        "Seitenverh\u00e4ltnis": "16:9",
        "Stromverbrauch (typisch)": "30 Watt",
        "Stromverbrauch SDR (eingeschaltet)": "25.9 kWh/1.000 h",
        "Stromverbrauch im Standby-Modus": "0.5 Watt",
        "Transportbreite": "70.2 cm",
        "Transportgewicht": "8.08 kg",
        "Transporth\u00f6he": "46.3 cm",
        "Transporttiefe": "19 cm",
        "Typ": "Headset",
        "VESA-Halterung": "Ja",
        "Vertikale Bildwiederholrate": "50 - 76 Hz",
        "Vertikaler Betrachtungswinkel": "160",
        "Zul\u00e4ssige Luftfeuchtigkeit im Betrieb": "20 - 80% (nicht kondensierend)"
    },
    "raw_specifications_text": "Display-Typ: LED-hintergrundbeleuchteter LCD-Monitor / TFT-Aktivmatrix\nEnergie Effizienzklasse: Klasse F\nDiagonalabmessung: 68.6 cm (27\")\nAdaptive-Sync Technologie: AMD FreeSync\nBildschirmtyp: TN\nSeitenverh\u00e4ltnis: 16:9\nNative Aufl\u00f6sung: Full HD (1080p) 1920 x 1080 bei 60 Hz\nPixelpitch: 0.311 mm\nPpi: 81.6\nHelligkeit: 400 cd/m\u00b2\nKontrast: 1000:1 / 12000000:1 (dynamisch)\nFarbunterst\u00fctzung: 16,7 Millionen Farben\nFarbraum: 72% NTSC\nReaktionszeit: 1 ms (Grau-zu-Grau mit Overdrive)\nVertikale Bildwiederholrate: 50 - 76 Hz\nHorizontale Bildwiederholrate: 30 - 89 kHz\nHorizontaler Betrachtungswinkel: 170\nVertikaler Betrachtungswinkel: 160\nBildschirmbeschichtung: Blendfrei\nHintergrundbeleuchtungs-Technologie: LED-Hintergrundbeleuchtung\nBesonderheiten: Abnehmbar, Frame Rate Control (FRC), Micro Edge, 72 % NTSC Farbraum\nAbmessungen (Breite x Tiefe x H\u00f6he): 61.36 cm x 21.64 cm x 51.02 cm - mit Fu\u00df\nGewicht: 6.78 kg\nTyp: Headset\nSchnittstellen: Kopfh\u00f6rer \u00a6 HDMI (HDCP) \u00a6 DisplayPort (HDCP)\nEinstellungen der Anzeigeposition: Pivot (Rotation), Drehung, Neigung\nNeigungswinkel: -4/+20\nSchwenkwinkel: 360\nRotationswinkel: 90\nVESA-Halterung: Ja\nLeistungsmerkmale: Slot f\u00fcr Sicherheitsschloss (Kabelschloss getrennt erh\u00e4ltlich), abnehmbarer St\u00e4nder\nEnthaltene Kabel: 1 x HDMI-Kabel\nKennzeichnung: Plug and Play, CSA, UL, VCCI, BSMI, NOM, TUV S, WHQL, CB, CCC, PSB, FCC, ISO 9241-307, KCC, ICES, KC, CEL, EAC, ISC\nLokalisierung: Englisch / Europa\nSchlosstyp zur Diebstahlsicherung: Kensington Slot\nEingangsspannung: Wechselstrom 120/230 V (50/60 Hz)\nLeistungsaufnahme im Ein-Zustand: 25.9 W\nStromverbrauch SDR (eingeschaltet): 25.9 kWh/1.000 h\nStromverbrauch (typisch): 30 Watt\nStromverbrauch im Standby-Modus: 0.5 Watt\nDetails zu Abmessungen & Gewicht: Mit Fu\u00df - Breite: 61.36 cm - Tiefe: 21.64 cm - H\u00f6he: 51.02 cm - Gewicht: 6.78 kg\nTransportbreite: 70.2 cm\nTransporttiefe: 19 cm\nTransporth\u00f6he: 46.3 cm\nTransportgewicht: 8.08 kg\nMin Betriebstemperatur: 5 \u00b0C\nMax. Betriebstemperatur: 35 \u00b0C\nZul\u00e4ssige Luftfeuchtigkeit im Betrieb: 20 - 80% (nicht kondensierend)",
    "reference_file": "offer_reference_2132.json",
    "shop_name": "TaufNaus"
}