{
    "html_file": "offer_1716_4.html",
    "name": "BenQ Zowie XL2540K, 24.5\"",
    "offer_link": "https://www.proshop.at/Bildschirm/BenQ-24-Bildschirm-ZOWIE-XL2540K-240Hz-Black/2913424?utm_source=geizhals&utm_medium=cpc&utm_campaign=pricesite",
    "price": 308.64,
    "raw_specifications": {
        "Abmessungen (Breite x Tiefe x H\u00f6he)": "57.1 cm x 20 cm x 52.1 cm - mit Standfu\u00df (h\u00f6chste Position)",
        "Abmessungen (Breite x Tiefe x H\u00f6he) - mit Standfu\u00df (h\u00f6chste Position)": "57.1 cm x 20 cm x 52.1 cm",
        "Besonderheiten": "Black eQualizer, flimmerfreie Technologie, K Locker, Color Vibrance, Low Blue Light-Technologie, Fast Liquid Crystal, XL Setting to Share",
        "Bildschirmtyp": "TN",
        "Details zu Abmessungen & Gewicht": "Mit Standfu\u00df (h\u00f6chste Position) - Breite: 57.1 cm - Tiefe: 20 cm - H\u00f6he: 52.1 cm - Gewicht: 6.1 kg  Mit Standfu\u00df (niedrigste Position) - Breite: 57.1 cm - Tiefe: 20 cm - H\u00f6he: 44.3 cm - Gewicht: 6.1 kg",
        "Diagonalabmessung": "62.2 cm (24.5\")",
        "Display-Typ": "LCD-Monitor / TFT-Aktivmatrix",
        "EAN": "4718755083303",
        "Eingangsanschl\u00fcsse": "3xHDMI, DisplayPort",
        "Eingangsspannung": "Wechselstrom 120/230 V",
        "Einstellungen der Anzeigeposition": "H\u00f6he, Pivot (Rotation), Drehung, Neigung",
        "Energie Effizienzklasse": "Klasse F",
        "Enthaltene Kabel": "1 x DisplayPort 1.2-Kabel - 1.8 m",
        "Ger\u00e4tetyp": "LCD-Monitor - 62.2 cm (24.5\")",
        "Gewicht": "6.1 kg",
        "Helligkeit": "320 cd/m\u00b2",
        "Hersteller": "BenQ",
        "H\u00f6heneinstellung": "155 mm",
        "Kontrast": "1000:1",
        "Leistungsaufnahme im Ein-Zustand": "20.4 W",
        "Modell": "9H.LJMLB.QBE",
        "Native Aufl\u00f6sung": "Full HD (1080p) 1920 x 1080 bei 240 Hz",
        "Neigungswinkel": "-5/+23",
        "Pixelpitch": "0.28 mm",
        "Produktbeschreibung": "BenQ ZOWIE XL2540K - XL Series - LCD-Monitor - Full HD (1080p) - 62.2 cm (24.5\")",
        "Rotationswinkel": "90",
        "Schnittstellen": "3 x HDMI  DisplayPort 1.2  Kopfh\u00f6rer",
        "Schwenkwinkel": "90",
        "Seitenverh\u00e4ltnis": "16:9",
        "Spannung": "Wechselstrom 120/230 V",
        "Stromverbrauch SDR (eingeschaltet)": "20.4 kWh/1.000 h",
        "VESA-Halterung": "100 x 100 mm",
        "Waren-Nr.": "2913424",
        "Zum Hersteller": "benq.com"
    },
    "raw_specifications_text": "Hersteller: BenQ\nWaren-Nr.: 2913424\nModell: 9H.LJMLB.QBE\nEAN: 4718755083303\nZum Hersteller: benq.com\nProduktbeschreibung: BenQ ZOWIE XL2540K - XL Series - LCD-Monitor - Full HD (1080p) - 62.2 cm (24.5\")\nGer\u00e4tetyp: LCD-Monitor - 62.2 cm (24.5\")\nEnergie Effizienzklasse: Klasse F\nLeistungsaufnahme im Ein-Zustand: 20.4 W\nBildschirmtyp: TN\nSeitenverh\u00e4ltnis: 16:9\nNative Aufl\u00f6sung: Full HD (1080p) 1920 x 1080 bei 240 Hz\nPixelpitch: 0.28 mm\nHelligkeit: 320 cd/m\u00b2\nKontrast: 1000:1\nEingangsanschl\u00fcsse: 3xHDMI, DisplayPort\nEinstellungen der Anzeigeposition: H\u00f6he, Pivot (Rotation), Drehung, Neigung\nSpannung: Wechselstrom 120/230 V\nAbmessungen (Breite x Tiefe x H\u00f6he) - mit Standfu\u00df (h\u00f6chste Position): 57.1 cm x 20 cm x 52.1 cm\nGewicht: 6.1 kg\nDisplay-Typ: LCD-Monitor / TFT-Aktivmatrix\nDiagonalabmessung: 62.2 cm (24.5\")\nBesonderheiten: Black eQualizer, flimmerfreie Technologie, K Locker, Color Vibrance, Low Blue Light-Technologie, Fast Liquid Crystal, XL Setting to Share\nAbmessungen (Breite x Tiefe x H\u00f6he): 57.1 cm x 20 cm x 52.1 cm - mit Standfu\u00df (h\u00f6chste Position)\nSchnittstellen: 3 x HDMI  DisplayPort 1.2  Kopfh\u00f6rer\nNeigungswinkel: -5/+23\nSchwenkwinkel: 90\nRotationswinkel: 90\nH\u00f6heneinstellung: 155 mm\nVESA-Halterung: 100 x 100 mm\nEnthaltene Kabel: 1 x DisplayPort 1.2-Kabel - 1.8 m\nEingangsspannung: Wechselstrom 120/230 V\nStromverbrauch SDR (eingeschaltet): 20.4 kWh/1.000 h\nDetails zu Abmessungen & Gewicht: Mit Standfu\u00df (h\u00f6chste Position) - Breite: 57.1 cm - Tiefe: 20 cm - H\u00f6he: 52.1 cm - Gewicht: 6.1 kg  Mit Standfu\u00df (niedrigste Position) - Breite: 57.1 cm - Tiefe: 20 cm - H\u00f6he: 44.3 cm - Gewicht: 6.1 kg",
    "reference_file": "offer_reference_1716.json",
    "shop_name": "Proshop.at"
}