{
    "html_file": "offer_2368_2.html",
    "name": "Acer Business B6 B276HULEymiipruzx, 27\"",
    "offer_link": "https://www.mylemon.at/artikel/acer/um_hb6ee_e01/dis-27-b276huleymiipruzx-ips.html",
    "price": 260.18,
    "raw_specifications": {
        "3D": "Nein",
        "AMD FreeSync": "Nein",
        "Anzahl DisplayPort Anschl\u00fcsse": "1",
        "Anzahl HDMI-Anschl\u00fcsse": "1",
        "Anzahl der Farben des Displays": "1,073 Milliarden Farben",
        "Anzahl der Lautsprecher": "2",
        "Anzahl der nachgeschalteten Steckpl\u00e4tze vom Typ USB-A": "4",
        "Artikelnummer": "MPAY3NL",
        "Aufl\u00f6sung": "2560x1440",
        "Besonderheiten": "60 Hz, Lautsprecher",
        "Bild-in-Bild": "Ja",
        "Bildschirmdiagonale": "68,6 cm (27 Zoll)",
        "Bildschirmform": "Flach",
        "Bildschirmtechnologie": "LED",
        "Bildwinkel, horizontal": "178\u00b0",
        "Bildwinkel, vertikal": "178\u00b0",
        "Breite (ohne Standfu\u00df)": "36,7 cm",
        "DVI Anschluss": "Nein",
        "Display": "LED",
        "Display-Aufl\u00f6sung": "2560 x 1440 Pixel",
        "Displaygr\u00f6\u00dfe": "27 Zoll",
        "EAN": "4713392815218",
        "Ein-/Ausschalter": "Ja",
        "Eingebaute Lautsprecher": "Ja",
        "Energieeffizienzklasse (SDR)": "G",
        "Energieeffizienzskala": "A bis G",
        "Energieverbrauch (SDR) pro 1.000 Stunden": "32 kWh",
        "Ergonomie": "H\u00f6henverstellbar, Pivot (90 Grad drehbar), Schwenkbar, Neigbar",
        "Ger\u00e4tebreite (inkl. Fu\u00df)": "543,6 mm",
        "Ger\u00e4teh\u00f6he (inkl. Fu\u00df)": "612,1 mm",
        "Ger\u00e4tetiefe (inkl. Fu\u00df)": "246,4 mm",
        "Gewicht (mit St\u00e4nder)": "8,26 kg",
        "Gewicht (ohne St\u00e4nder)": "5,49 kg",
        "HD-Typ": "Quad HD",
        "Helligkeit": "350 cd/m\u00b2",
        "Helligkeit (typisch)": "350 cd/m\u00b2",
        "Hersteller Artikelnummer": "UM.HB6EE.E01",
        "H\u00f6he (ohne Standfu\u00df)": "61,2 cm",
        "H\u00f6heneinstellung": "15 cm",
        "H\u00f6henverstellung": "Ja",
        "Integrierte Kamera": "Nein",
        "Integrierter USB-Hub": "Ja",
        "Kabelsperre-Slot": "Nein",
        "Kontrastverh\u00e4ltnis (dynamisch)": "100000000:1",
        "Maximale Bildwiederholrate": "60 Hz",
        "NVIDIA G-SYNC": "Nein",
        "Nachhaltigkeitszertifikate": "ENERGY STAR",
        "Natives Seitenverh\u00e4ltnis": "16:9",
        "Neigungsverstellung": "Ja",
        "Neigungswinkelbereich": "-5 - 35\u00b0",
        "Panel": "IPS",
        "Panel-Typ": "IPS",
        "Pivot": "Ja",
        "Produktfarbe": "Grau",
        "RMS-Leistung": "4 W",
        "Reaktionszeit": "5 ms",
        "Schwenkbar": "Ja",
        "Stromverbrauch (Standardbetrieb)": "28,44 W",
        "Stromverbrauch (Standby)": "0,36 W",
        "Stromverbrauch (aus)": "0,25 W",
        "TV Tuner integriert": "Nein",
        "Thin Client installiert": "Nein",
        "Tiefe (ohne Standfu\u00df)": "6,5 cm",
        "Touchscreen": "Nein",
        "USB-Hub-Version": "3.2 Gen 1 (3.1 Gen 1)",
        "Unterst\u00fctzte Grafik-Aufl\u00f6sungen": "2560 x 1440",
        "VESA Halterung": "100x100 mm",
        "VESA-Halterung": "Ja",
        "Video Anschl\u00fcsse": "1x HDMI, 1x DisplayPort, 1x USB, 4x USB",
        "Warentarifnummer (HS)": "85285210"
    },
    "raw_specifications_text": "Displaygr\u00f6\u00dfe: 27 Zoll\nAufl\u00f6sung: 2560x1440\nPanel: IPS\nReaktionszeit: 5 ms\nVideo Anschl\u00fcsse: 1x HDMI, 1x DisplayPort, 1x USB, 4x USB\nErgonomie: H\u00f6henverstellbar, Pivot (90 Grad drehbar), Schwenkbar, Neigbar\nVESA Halterung: 100x100 mm\nHelligkeit: 350 cd/m\u00b2\nBesonderheiten: 60 Hz, Lautsprecher\nHersteller Artikelnummer: UM.HB6EE.E01\nEAN: 4713392815218\nArtikelnummer: MPAY3NL\nBildschirmdiagonale: 68,6 cm (27 Zoll)\nDisplay-Aufl\u00f6sung: 2560 x 1440 Pixel\nNatives Seitenverh\u00e4ltnis: 16:9\nBildschirmtechnologie: LED\nTouchscreen: Nein\nHD-Typ: Quad HD\nPanel-Typ: IPS\nBildschirmform: Flach\nMaximale Bildwiederholrate: 60 Hz\nAnzahl der Farben des Displays: 1,073 Milliarden Farben\nHelligkeit (typisch): 350 cd/m\u00b2\nUnterst\u00fctzte Grafik-Aufl\u00f6sungen: 2560 x 1440\nKontrastverh\u00e4ltnis (dynamisch): 100000000:1\nBildwinkel, horizontal: 178\u00b0\nBildwinkel, vertikal: 178\u00b0\n3D: Nein\nNVIDIA G-SYNC: Nein\nAMD FreeSync: Nein\nEingebaute Lautsprecher: Ja\nIntegrierte Kamera: Nein\nAnzahl der Lautsprecher: 2\nRMS-Leistung: 4 W\nProduktfarbe: Grau\nIntegrierter USB-Hub: Ja\nUSB-Hub-Version: 3.2 Gen 1 (3.1 Gen 1)\nAnzahl der nachgeschalteten Steckpl\u00e4tze vom Typ USB-A: 4\nDVI Anschluss: Nein\nAnzahl HDMI-Anschl\u00fcsse: 1\nAnzahl DisplayPort Anschl\u00fcsse: 1\nVESA-Halterung: Ja\nKabelsperre-Slot: Nein\nH\u00f6henverstellung: Ja\nH\u00f6heneinstellung: 15 cm\nPivot: Ja\nSchwenkbar: Ja\nNeigungswinkelbereich: -5 - 35\u00b0\nBild-in-Bild: Ja\nNeigungsverstellung: Ja\nEnergieeffizienzklasse (SDR): G\nEnergieverbrauch (SDR) pro 1.000 Stunden: 32 kWh\nStromverbrauch (Standardbetrieb): 28,44 W\nStromverbrauch (Standby): 0,36 W\nStromverbrauch (aus): 0,25 W\nEnergieeffizienzskala: A bis G\nGer\u00e4tebreite (inkl. Fu\u00df): 543,6 mm\nGer\u00e4tetiefe (inkl. Fu\u00df): 246,4 mm\nGer\u00e4teh\u00f6he (inkl. Fu\u00df): 612,1 mm\nGewicht (mit St\u00e4nder): 8,26 kg\nBreite (ohne Standfu\u00df): 36,7 cm\nTiefe (ohne Standfu\u00df): 6,5 cm\nH\u00f6he (ohne Standfu\u00df): 61,2 cm\nGewicht (ohne St\u00e4nder): 5,49 kg\nNachhaltigkeitszertifikate: ENERGY STAR\nWarentarifnummer (HS): 85285210\nThin Client installiert: Nein\nDisplay: LED\nEin-/Ausschalter: Ja\nTV Tuner integriert: Nein",
    "reference_file": "offer_reference_2368.json",
    "shop_name": "mylemon.at"
}