{
    "html_file": "offer_2010_2.html",
    "name": "Lenovo ThinkVision T32h-20, 32\"",
    "offer_link": "https://www.ba-computer.at/lenovo-thinkvision-t32h-20-led-monitor-80-cm-32-61f1gat2eu.html",
    "price": 412.37,
    "raw_specifications": {
        "Abmessungen (Breite x Tiefe x H\u00f6he)": "71.46 cm x 23.5 cm x 46.94 cm - mit Fu\u00df",
        "Besonderheiten": "Integrierte Kabelf\u00fchrung, NearEdgeless-Design an 3 Seiten, 99 % sRGB Farbraum",
        "Bildschirmbeschichtung": "Blendfrei",
        "Bildschirmtyp": "IPS",
        "Details zu Abmessungen & Gewicht": "Mit Standfu\u00df (h\u00f6chste Position) - Breite: 71.46 cm - Tiefe: 23.5 cm - H\u00f6he: 60.44 cm - Gewicht: 9.85 kg \u00a6 Mit Standfu\u00df (niedrigste Position) - Breite: 71.46 cm - Tiefe: 23.5 cm - H\u00f6he: 46.94 cm - Gewicht: 9.85 kg \u00a6 Ohne Fu\u00df - Breite: 71.46 cm - Tiefe: 5.1 cm - H\u00f6he: 42.6 cm - Gewicht: 6.78 kg",
        "Diagonalabmessung": "80 cm (32\")",
        "Display-Typ": "LED-hintergrundbeleuchteter LCD-Monitor / TFT-Aktivmatrix",
        "ENERGY STAR zertifiziert": "Ja",
        "ENERGY STAR-Version": "8.0",
        "EPEAT-kompatibel": "EPEAT Silver",
        "Eingangsspannung": "Wechselstrom 120/230 V (50/60 Hz)",
        "Einstellungen der Anzeigeposition": "H\u00f6he, Pivot (Rotation), Drehung, Neigung",
        "Energie Effizienzklasse": "Klasse E",
        "Energierverbrauch Sleep": "0.5 Watt",
        "Enthaltene Kabel": "1 x USB-C Kabel - 1.8 m",
        "Farbe": "Raven Black",
        "Farbraum": "99% sRGB",
        "Farbunterst\u00fctzung": "1,07 Mrd. Farben",
        "Gewicht": "9.85 kg",
        "Helligkeit": "350 cd/m\u00b2",
        "Hintergrundbeleuchtungs-Technologie": "WLED",
        "Horizontaler Betrachtungswinkel": "178",
        "H\u00f6heneinstellung": "135 mm",
        "Integrierte Peripherieger\u00e4te": "USB 3.1 Gen.1 Hub",
        "Kennzeichnung": "CCC, RoHS, DisplayPort 1.2, TUV Rheinland Eye Comfort Certification, China Energy standard Tier 1",
        "Kontrast": "1000:1 / 3000000:1 (dynamisch)",
        "Leistungsaufnahme im Ein-Zustand": "26.5 W",
        "Leistungsmerkmale": "Slot f\u00fcr Sicherheitsschloss (Kabelschloss getrennt erh\u00e4ltlich)",
        "Lokalisierung": "Englisch / Europa",
        "Native Aufl\u00f6sung": "QHD 2560 x 1440",
        "Neigungswinkel": "-5/+35",
        "Pixelpitch": "0.2727 mm",
        "Ppi": "94",
        "Reaktionszeit": "14 ms, 6 ms, 4 ms (extremer Modus)",
        "Rotationswinkel": "180",
        "Schlosstyp zur Diebstahlsicherung": "Kensington Slot",
        "Schnittstellen": "DisplayPort \u00a6 HDMI \u00a6 Kopfh\u00f6rer \u00a6 USB 3.1 Gen 1 Downstream mit Batterieladefunktion \u00a6 3 x USB 3.1 Gen 1 Downstream \u00a6 USB-C 3.1 Gen 1 Upstream/DisplayPort Alt Mode mit Spannungsversorgung (bis zu 75 W)",
        "Schwenkwinkel": "90",
        "Seitenverh\u00e4ltnis": "16:9",
        "Service und Support": "Begrenzte Garantie - 3 Jahre",
        "Stromverbrauch (Aus-Modus)": "0.3 Watt",
        "Stromverbrauch (typisch)": "28 Watt",
        "Stromverbrauch SDR (eingeschaltet)": "26.5 kWh/1.000 h",
        "Stromverbrauch im Standby-Modus": "0.5 Watt",
        "TCO-zertifiziert": "TCO Certified Displays 8, TCO Certified Edge Displays",
        "Transportbreite": "84.5 cm",
        "Transportgewicht": "12.96 kg",
        "Transporth\u00f6he": "19 cm",
        "Transporttiefe": "52.8 cm",
        "USB-Spannungsversorgung": "75 Watt",
        "VESA-Halterung": "100 x 100 mm",
        "Vertikale Bildwiederholrate": "60 Hz",
        "Vertikaler Betrachtungswinkel": "178"
    },
    "raw_specifications_text": "Display-Typ: LED-hintergrundbeleuchteter LCD-Monitor / TFT-Aktivmatrix\nEnergie Effizienzklasse: Klasse E\nDiagonalabmessung: 80 cm (32\")\nIntegrierte Peripherieger\u00e4te: USB 3.1 Gen.1 Hub\nUSB-Spannungsversorgung: 75 Watt\nBildschirmtyp: IPS\nSeitenverh\u00e4ltnis: 16:9\nNative Aufl\u00f6sung: QHD 2560 x 1440\nPixelpitch: 0.2727 mm\nPpi: 94\nHelligkeit: 350 cd/m\u00b2\nKontrast: 1000:1 / 3000000:1 (dynamisch)\nFarbunterst\u00fctzung: 1,07 Mrd. Farben\nFarbraum: 99% sRGB\nReaktionszeit: 14 ms, 6 ms, 4 ms (extremer Modus)\nVertikale Bildwiederholrate: 60 Hz\nHorizontaler Betrachtungswinkel: 178\nVertikaler Betrachtungswinkel: 178\nBildschirmbeschichtung: Blendfrei\nHintergrundbeleuchtungs-Technologie: WLED\nBesonderheiten: Integrierte Kabelf\u00fchrung, NearEdgeless-Design an 3 Seiten, 99 % sRGB Farbraum\nFarbe: Raven Black\nAbmessungen (Breite x Tiefe x H\u00f6he): 71.46 cm x 23.5 cm x 46.94 cm - mit Fu\u00df\nGewicht: 9.85 kg\nSchnittstellen: DisplayPort \u00a6 HDMI \u00a6 Kopfh\u00f6rer \u00a6 USB 3.1 Gen 1 Downstream mit Batterieladefunktion \u00a6 3 x USB 3.1 Gen 1 Downstream \u00a6 USB-C 3.1 Gen 1 Upstream/DisplayPort Alt Mode mit Spannungsversorgung (bis zu 75 W)\nEinstellungen der Anzeigeposition: H\u00f6he, Pivot (Rotation), Drehung, Neigung\nNeigungswinkel: -5/+35\nSchwenkwinkel: 90\nRotationswinkel: 180\nH\u00f6heneinstellung: 135 mm\nVESA-Halterung: 100 x 100 mm\nLeistungsmerkmale: Slot f\u00fcr Sicherheitsschloss (Kabelschloss getrennt erh\u00e4ltlich)\nEnthaltene Kabel: 1 x USB-C Kabel - 1.8 m\nKennzeichnung: CCC, RoHS, DisplayPort 1.2, TUV Rheinland Eye Comfort Certification, China Energy standard Tier 1\nLokalisierung: Englisch / Europa\nSchlosstyp zur Diebstahlsicherung: Kensington Slot\nEingangsspannung: Wechselstrom 120/230 V (50/60 Hz)\nLeistungsaufnahme im Ein-Zustand: 26.5 W\nStromverbrauch SDR (eingeschaltet): 26.5 kWh/1.000 h\nStromverbrauch (typisch): 28 Watt\nStromverbrauch im Standby-Modus: 0.5 Watt\nEnergierverbrauch Sleep: 0.5 Watt\nStromverbrauch (Aus-Modus): 0.3 Watt\nDetails zu Abmessungen & Gewicht: Mit Standfu\u00df (h\u00f6chste Position) - Breite: 71.46 cm - Tiefe: 23.5 cm - H\u00f6he: 60.44 cm - Gewicht: 9.85 kg \u00a6 Mit Standfu\u00df (niedrigste Position) - Breite: 71.46 cm - Tiefe: 23.5 cm - H\u00f6he: 46.94 cm - Gewicht: 9.85 kg \u00a6 Ohne Fu\u00df - Breite: 71.46 cm - Tiefe: 5.1 cm - H\u00f6he: 42.6 cm - Gewicht: 6.78 kg\nTransportbreite: 84.5 cm\nTransporttiefe: 52.8 cm\nTransporth\u00f6he: 19 cm\nTransportgewicht: 12.96 kg\nTCO-zertifiziert: TCO Certified Displays 8, TCO Certified Edge Displays\nEPEAT-kompatibel: EPEAT Silver\nENERGY STAR zertifiziert: Ja\nENERGY STAR-Version: 8.0\nService und Support: Begrenzte Garantie - 3 Jahre",
    "reference_file": "offer_reference_2010.json",
    "shop_name": "BA-Computer"
}