{
    "html_file": "offer_165_25.html",
    "name": "Eizo ColorEdge CS2400S, 24.1\"",
    "offer_link": "https://www.taufnaus.de/product/13866071",
    "price": 915.91,
    "raw_specifications": {
        "Abmessungen (Breite x Tiefe x H\u00f6he)": "55.4 cm x 24.5 cm x 55.1 cm - mit Fu\u00df",
        "Besonderheiten": "sRGB-Farbmanagement, Traggriff, HDCP, Digital Uniformity Equalizer (DUE), 16-Bit-Lookup-Tabelle, gro\u00dfe Farbskala, Zero Bright Pixels",
        "Bildschirmtyp": "IPS",
        "Details zu Abmessungen & Gewicht": "Mit Fu\u00df - Breite: 55.4 cm - Tiefe: 24.5 cm - H\u00f6he: 55.1 cm - Gewicht: 8.2 kg \u00a6 Ohne Fu\u00df - Breite: 55.4 cm - Tiefe: 6.4 cm - H\u00f6he: 36.2 cm - Gewicht: 5.2 kg",
        "Diagonalabmessung": "61 cm (24\")",
        "Display-Typ": "LED-hintergrundbeleuchteter LCD-Monitor / TFT-Aktivmatrix",
        "Eingangsspannung": "AC 100 -240 V (50/60 Hz)",
        "Einstellungen der Anzeigeposition": "H\u00f6he, Pivot (Rotation), Drehung, Neigung",
        "Energie Effizienzklasse": "Klasse E",
        "Enthaltene Kabel": "1 x USB-Kabel Typ A auf Typ B - 2 m \u00a6 1 x USB-C Kabel - 2 m \u00a6 1 x HDMI-Kabel - 2 m",
        "Farbraum": "99% Adobe RGB",
        "Farbunterst\u00fctzung": "1,07 Mrd. Farben",
        "Gewicht": "8.2 kg",
        "Helligkeit": "410 cd/m\u00b2",
        "Hintergrundbeleuchtungs-Technologie": "Wide-Gamut LED",
        "Horizontale Bildwiederholrate": "15 - 76 kHz",
        "Horizontaler Betrachtungswinkel": "178",
        "H\u00f6heneinstellung": "155 mm",
        "Integrierte Peripherieger\u00e4te": "USB 2.0 Hub, USB 3.2 Gen 1/USB-C Hub",
        "Kennzeichnung": "FCC Klasse B bescheinigt, TUV GS, TUV S, CB, TUV Ergo, RoHS, WEEE, PSE Mark, cTUVus, VCCI Class B, CAN ICES-3 Class B",
        "Kontrast": "1350:1",
        "Max. Betriebstemperatur": "35 \u00b0C",
        "Min Betriebstemperatur": "0 \u00b0C",
        "Mitgelieferte Software": "EIZO Quick Color Match, EIZO ColorNavigator 7",
        "Native Aufl\u00f6sung": "1920 x 1200",
        "Neigungswinkel": "-5/+35",
        "OSD-Sprachen": "Chinesisch (tradionell), Chinesisch (vereinfacht), Englisch, Deutsch, Franz\u00f6sisch, Italienisch, Schwedisch, Spanisch, Japanisch",
        "Pixelpitch": "0.27 mm",
        "Ppi": "94",
        "Reaktionszeit": "19 ms (Gray-to-Gray)",
        "Rotationswinkel": "90",
        "Schnittstellen": "HDMI (HDCP 2.3) \u00a6 DisplayPort (HDCP 2.3) \u00a6 USB-C 3.2 Gen 1 Upstream/DisplayPort Alt Mode (bis zu 70 W) \u00a6 USB 3.2 Gen 1 Upstream (Typ B) \u00a6 2 x USB 3.2 Gen 1 Downstream (Typ A) \u00a6 2 x USB 2.0 Downstream (Typ A)",
        "Schwenkwinkel": "344",
        "Seitenverh\u00e4ltnis": "16:10",
        "Service und Support": "Begrenzte Garantie - 5 Jahre",
        "Sichtbare Bildfl\u00e4che": "61.1 cm (24.1\")",
        "Stromverbrauch (max.)": "149 Watt",
        "Stromverbrauch (typisch)": "18 Watt",
        "Stromverbrauch SDR (eingeschaltet)": "16 kWh/1.000 h",
        "Stromverbrauch im Standby-Modus": "0.3 Watt",
        "VESA-Halterung": "100 x 100 mm",
        "Vertikale Bildwiederholrate": "23 - 61 Hz",
        "Vertikaler Betrachtungswinkel": "178",
        "Zul\u00e4ssige Luftfeuchtigkeit im Betrieb": "20 - 80% (nicht kondensierend)"
    },
    "raw_specifications_text": "Display-Typ: LED-hintergrundbeleuchteter LCD-Monitor / TFT-Aktivmatrix\nEnergie Effizienzklasse: Klasse E\nDiagonalabmessung: 61 cm (24\")\nSichtbare Bildfl\u00e4che: 61.1 cm (24.1\")\nIntegrierte Peripherieger\u00e4te: USB 2.0 Hub, USB 3.2 Gen 1/USB-C Hub\nBildschirmtyp: IPS\nSeitenverh\u00e4ltnis: 16:10\nNative Aufl\u00f6sung: 1920 x 1200\nPixelpitch: 0.27 mm\nPpi: 94\nHelligkeit: 410 cd/m\u00b2\nKontrast: 1350:1\nFarbunterst\u00fctzung: 1,07 Mrd. Farben\nFarbraum: 99% Adobe RGB\nReaktionszeit: 19 ms (Gray-to-Gray)\nVertikale Bildwiederholrate: 23 - 61 Hz\nHorizontale Bildwiederholrate: 15 - 76 kHz\nHorizontaler Betrachtungswinkel: 178\nVertikaler Betrachtungswinkel: 178\nHintergrundbeleuchtungs-Technologie: Wide-Gamut LED\nOSD-Sprachen: Chinesisch (tradionell), Chinesisch (vereinfacht), Englisch, Deutsch, Franz\u00f6sisch, Italienisch, Schwedisch, Spanisch, Japanisch\nBesonderheiten: sRGB-Farbmanagement, Traggriff, HDCP, Digital Uniformity Equalizer (DUE), 16-Bit-Lookup-Tabelle, gro\u00dfe Farbskala, Zero Bright Pixels\nAbmessungen (Breite x Tiefe x H\u00f6he): 55.4 cm x 24.5 cm x 55.1 cm - mit Fu\u00df\nGewicht: 8.2 kg\nSchnittstellen: HDMI (HDCP 2.3) \u00a6 DisplayPort (HDCP 2.3) \u00a6 USB-C 3.2 Gen 1 Upstream/DisplayPort Alt Mode (bis zu 70 W) \u00a6 USB 3.2 Gen 1 Upstream (Typ B) \u00a6 2 x USB 3.2 Gen 1 Downstream (Typ A) \u00a6 2 x USB 2.0 Downstream (Typ A)\nEinstellungen der Anzeigeposition: H\u00f6he, Pivot (Rotation), Drehung, Neigung\nNeigungswinkel: -5/+35\nSchwenkwinkel: 344\nRotationswinkel: 90\nH\u00f6heneinstellung: 155 mm\nVESA-Halterung: 100 x 100 mm\nEnthaltene Kabel: 1 x USB-Kabel Typ A auf Typ B - 2 m \u00a6 1 x USB-C Kabel - 2 m \u00a6 1 x HDMI-Kabel - 2 m\nKennzeichnung: FCC Klasse B bescheinigt, TUV GS, TUV S, CB, TUV Ergo, RoHS, WEEE, PSE Mark, cTUVus, VCCI Class B, CAN ICES-3 Class B\nEingangsspannung: AC 100 -240 V (50/60 Hz)\nStromverbrauch SDR (eingeschaltet): 16 kWh/1.000 h\nStromverbrauch (typisch): 18 Watt\nStromverbrauch (max.): 149 Watt\nStromverbrauch im Standby-Modus: 0.3 Watt\nMitgelieferte Software: EIZO Quick Color Match, EIZO ColorNavigator 7\nDetails zu Abmessungen & Gewicht: Mit Fu\u00df - Breite: 55.4 cm - Tiefe: 24.5 cm - H\u00f6he: 55.1 cm - Gewicht: 8.2 kg \u00a6 Ohne Fu\u00df - Breite: 55.4 cm - Tiefe: 6.4 cm - H\u00f6he: 36.2 cm - Gewicht: 5.2 kg\nService und Support: Begrenzte Garantie - 5 Jahre\nMin Betriebstemperatur: 0 \u00b0C\nMax. Betriebstemperatur: 35 \u00b0C\nZul\u00e4ssige Luftfeuchtigkeit im Betrieb: 20 - 80% (nicht kondensierend)",
    "reference_file": "offer_reference_165.json",
    "shop_name": "TaufNaus"
}