{
    "html_file": "offer_1432_4.html",
    "name": "LG 32MP60G-B, 31.5\"",
    "offer_link": "https://www.csv-direct.de/artinfo.php?artnr=AGX1402795&KATEGORIE=162&pva=geizhals2",
    "price": 189.88,
    "raw_specifications": {
        "AC Eingangsfrequenz": "47/63 Hz",
        "AC Eingangsspannung": "100 - 240 V",
        "AMD FreeSync-Typ": "FreeSync",
        "Anzahl DisplayPort Anschl\u00fcsse": "1",
        "Anzahl HDMI-Anschl\u00fcsse": "1",
        "Anzahl OSD-Sprachen": "14",
        "Anzahl VGA D-Sub Anschl\u00fcsse": "1",
        "Anzahl der Farben des Displays": "16,7 Millionen Farben",
        "Bildschirmdiagonale": "80 cm 31.5\"",
        "Bildschirmdiagonale cm": "80,01 cm",
        "Bildschirmform": "Flach",
        "Bildschirmtechnologie": "LCD",
        "Bildwinkel, horizontal": "178\u00b0",
        "Bildwinkel, vertikal": "178\u00b0",
        "Breite ohne Standfu\u00df": "729,4 mm",
        "Display-Aufl\u00f6sung": "1920 x 1080 Pixel",
        "DisplayPorts-Version": "1.4",
        "Dynamisches Kontrastverh\u00e4ltnis Marketingbezeichnung": "Mega-Kontrast",
        "Eingebaute Lautsprecher": "Nein",
        "Energieeffizienzklasse SDR": "E",
        "Energieverbrauch SDR pro 1.000 Stunden": "24 kWh",
        "Fu\u00dffarbe": "Schwarz/Rot",
        "Ger\u00e4tebreite inkl. Fu\u00df": "729,4 mm",
        "Ger\u00e4teh\u00f6he inkl. Fu\u00df": "513,3 mm",
        "Ger\u00e4tetiefe inkl. Fu\u00df": "209,3 mm",
        "Gewicht mit St\u00e4nder": "6,6 kg",
        "Gewicht ohne St\u00e4nder": "6,5 kg",
        "HD-Typ": "Full HD",
        "Helligkeit typisch": "300 cd/m\u00b2",
        "Horizontaler Scanbereich": "40 - 60 kHz",
        "H\u00f6he ohne Standfu\u00df": "430,3 mm",
        "H\u00f6henverstellung": "Nein",
        "Integrierte Kamera": "Nein",
        "Integrierter USB-Hub": "Nein",
        "Kabelsperre-Slot": "Nein",
        "Kontrastverh\u00e4ltnis": "1200:1",
        "Kopfh\u00f6rerausg\u00e4nge": "1",
        "Marktpositionierung": "Gaming",
        "Maximale Bildwiederholrate": "75 Hz",
        "Men\u00fcsprachen": "Deutsch, Englisch, Spanisch, Finnisch, Franz\u00f6sisch, Griechisch, Italienisch, Japanisch, Koreanisch, Polnisch, Portugiesisch, Russisch",
        "Mitgelieferte Kabel": "AC, HDMI",
        "NVIDIA G-SYNC": "Nein",
        "Natives Seitenverh\u00e4ltnis": "16:9",
        "Neigungswinkelbereich": "-5 - 15\u00b0",
        "Oberfl\u00e4chenh\u00e4rte": "3H",
        "Paketgewicht": "9,2 kg",
        "Panel-Montage-Schnittstelle": "100 x 100 mm",
        "Panel-Typ": "IPS",
        "Pixel Abstand": "0,363 x 0,363 mm",
        "Produktfarbe": "Schwarz",
        "Reaktionszeit": "5 ms",
        "Stromverbrauch Standby": "0,3 W",
        "Stromverbrauch aus": "0,3 W",
        "Stromverbrauch max.": "27 W",
        "Tiefe ohne Standfu\u00df": "45 mm",
        "Touchscreen": "Nein",
        "Typ der Hintergrundbeleuchtung": "LED",
        "Verpackungsbreite": "813 mm",
        "Verpackungsh\u00f6he": "516 mm",
        "Verpackungstiefe": "150 mm",
        "Vertikaler Scanbereich": "56 - 75 Hz",
        "Vorderer Rahmen": "Schwarz"
    },
    "raw_specifications_text": "Bildschirmdiagonale: 80 cm 31.5\"\nDisplay-Aufl\u00f6sung: 1920 x 1080 Pixel\nNatives Seitenverh\u00e4ltnis: 16:9\nBildschirmtechnologie: LCD\nTouchscreen: Nein\nHD-Typ: Full HD\nPanel-Typ: IPS\nBildschirmform: Flach\nKontrastverh\u00e4ltnis: 1200:1\nMaximale Bildwiederholrate: 75 Hz\nAnzahl der Farben des Displays: 16,7 Millionen Farben\nTyp der Hintergrundbeleuchtung: LED\nHelligkeit typisch: 300 cd/m\u00b2\nReaktionszeit: 5 ms\nDynamisches Kontrastverh\u00e4ltnis Marketingbezeichnung: Mega-Kontrast\nBildwinkel, horizontal: 178\u00b0\nBildwinkel, vertikal: 178\u00b0\nPixel Abstand: 0,363 x 0,363 mm\nHorizontaler Scanbereich: 40 - 60 kHz\nVertikaler Scanbereich: 56 - 75 Hz\nBildschirmdiagonale cm: 80,01 cm\nOberfl\u00e4chenh\u00e4rte: 3H\nNVIDIA G-SYNC: Nein\nAMD FreeSync-Typ: FreeSync\nEingebaute Lautsprecher: Nein\nIntegrierte Kamera: Nein\nMarktpositionierung: Gaming\nProduktfarbe: Schwarz\nVorderer Rahmen: Schwarz\nFu\u00dffarbe: Schwarz/Rot\nIntegrierter USB-Hub: Nein\nAnzahl VGA D-Sub Anschl\u00fcsse: 1\nAnzahl HDMI-Anschl\u00fcsse: 1\nAnzahl DisplayPort Anschl\u00fcsse: 1\nDisplayPorts-Version: 1.4\nKopfh\u00f6rerausg\u00e4nge: 1\nKabelsperre-Slot: Nein\nH\u00f6henverstellung: Nein\nPanel-Montage-Schnittstelle: 100 x 100 mm\nNeigungswinkelbereich: -5 - 15\u00b0\nMen\u00fcsprachen: Deutsch, Englisch, Spanisch, Finnisch, Franz\u00f6sisch, Griechisch, Italienisch, Japanisch, Koreanisch, Polnisch, Portugiesisch, Russisch\nAnzahl OSD-Sprachen: 14\nEnergieeffizienzklasse SDR: E\nEnergieverbrauch SDR pro 1.000 Stunden: 24 kWh\nStromverbrauch Standby: 0,3 W\nStromverbrauch max.: 27 W\nStromverbrauch aus: 0,3 W\nAC Eingangsspannung: 100 - 240 V\nAC Eingangsfrequenz: 47/63 Hz\nMitgelieferte Kabel: AC, HDMI\nGer\u00e4tebreite inkl. Fu\u00df: 729,4 mm\nGer\u00e4tetiefe inkl. Fu\u00df: 209,3 mm\nGer\u00e4teh\u00f6he inkl. Fu\u00df: 513,3 mm\nGewicht mit St\u00e4nder: 6,6 kg\nBreite ohne Standfu\u00df: 729,4 mm\nTiefe ohne Standfu\u00df: 45 mm\nH\u00f6he ohne Standfu\u00df: 430,3 mm\nGewicht ohne St\u00e4nder: 6,5 kg\nVerpackungsbreite: 813 mm\nVerpackungstiefe: 150 mm\nVerpackungsh\u00f6he: 516 mm\nPaketgewicht: 9,2 kg",
    "reference_file": "offer_reference_1432.json",
    "shop_name": "CSV-Direct.de"
}