{
    "html_file": "offer_1450_5.html",
    "name": "ViewSonic VX3276-2K-MHD-2, 31.5\"",
    "offer_link": "https://www.mylemon.at/artikel/viewsonic/vx3276_2k_mhd_2/vx3276-2k-mhd-2-81.html",
    "price": 246.8,
    "raw_specifications": {
        "AC Eingangsfrequenz": "50 - 60 Hz",
        "AC Eingangsspannung": "100 - 240 V",
        "Anzahl DisplayPort Anschl\u00fcsse": "1",
        "Anzahl HDMI-Anschl\u00fcsse": "2",
        "Anzahl Mini DisplayPorts": "1",
        "Anzahl der Farben des Displays": "1,07 Milliarden Farben",
        "Anzahl der Lautsprecher": "2",
        "Artikelnummer": "M15Y2JDL",
        "Aufl\u00f6sung": "2560x1440",
        "Besonderheiten": "Lautsprecher",
        "Betriebstemperatur": "0 - 40 \u00b0C",
        "Bildschirmdiagonale": "81,3 cm (32\")",
        "Bildschirmform": "Flach",
        "Bildschirmtechnologie": "LED",
        "Bildwinkel, horizontal": "178\u00b0",
        "Bildwinkel, vertikal": "178\u00b0",
        "Blendfreier Bildschirm": "Ja",
        "Breite (ohne Standfu\u00df)": "713 mm",
        "Digital horizontale Frequenz": "15 - 113 kHz",
        "Digital vertikale Frequenz": "24 - 75 Hz",
        "Display-Aufl\u00f6sung": "2560 x 1440 Pixel",
        "Displaygr\u00f6\u00dfe": "31,5 Zoll",
        "EAN": "0766907002959",
        "Eingebaute Lautsprecher": "Ja",
        "Energieeffizienzklasse (SDR)": "G",
        "Energieverbrauch (SDR) pro 1.000 Stunden": "40 kWh",
        "Ergonomie": "Neigbar",
        "Farbtiefe": "10 Bit",
        "Flimmerfreie Technologie": "Ja",
        "Fu\u00dffarbe": "Silber",
        "Ger\u00e4tebreite (inkl. Fu\u00df)": "713 mm",
        "Ger\u00e4teh\u00f6he (inkl. Fu\u00df)": "504 mm",
        "Ger\u00e4tetiefe (inkl. Fu\u00df)": "230 mm",
        "Gewicht (mit St\u00e4nder)": "6,2 kg",
        "Gewicht (ohne St\u00e4nder)": "5,6 kg",
        "HD-Typ": "Quad HD",
        "HDMI": "Ja",
        "HDMI-Version": "1.4",
        "Helligkeit": "250 cd/m\u00b2",
        "Helligkeit (typisch)": "250 cd/m\u00b2",
        "Hersteller Artikelnummer": "VX3276-2K-MHD-2",
        "H\u00f6he (ohne Standfu\u00df)": "416 mm",
        "Kabelsperre-Slot": "Ja",
        "Kontrastverh\u00e4ltnis": "1200:1",
        "Kontrastverh\u00e4ltnis (dynamisch)": "80000000:1",
        "Kopfh\u00f6rer-Anschluss": "3,5 mm",
        "Kopfh\u00f6rerausgang": "Ja",
        "Kopfh\u00f6rerausg\u00e4nge": "1",
        "Low-Blue-Light-Technologie": "Ja",
        "Marktpositionierung": "Haus",
        "Maximale Bildwiederholrate": "75 Hz",
        "Mitgelieferte Kabel": "AC, HDMI",
        "NTSC Abdeckung (typisch)": "72%",
        "Natives Seitenverh\u00e4ltnis": "16:9",
        "Neigungsverstellung": "Ja",
        "Neigungswinkelbereich": "-4 - 15\u00b0",
        "Paketgewicht": "8,2 kg",
        "Panel": "IPS",
        "Panel-Montage-Schnittstelle": "100 x 100 mm",
        "Panel-Typ": "IPS",
        "Pixel Abstand": "0,273 x 0,273 mm",
        "Produktfarbe": "Silber",
        "RMS-Leistung": "4 W",
        "Reaktionszeit": "4 ms",
        "Relative Luftfeuchtigkeit in Betrieb": "20 - 90%",
        "Schnellstart\u00fcbersicht": "Ja",
        "Slot-Typ Kabelsperre": "Kensington",
        "Stromeingang": "Ja",
        "Stromverbrauch (Standardbetrieb)": "43 W",
        "Stromverbrauch (Standby)": "0,3 W",
        "Stromverbrauch (max.)": "46 W",
        "Tiefe (ohne Standfu\u00df)": "38 mm",
        "Touchscreen": "Nein",
        "VESA Adaptive Sync unterst\u00fctzt": "Ja",
        "VESA Halterung": "100x100 mm",
        "VESA-Halterung": "Ja",
        "Verpackungsbreite": "806 mm",
        "Verpackungsh\u00f6he": "509 mm",
        "Verpackungstiefe": "109 mm",
        "Video Anschl\u00fcsse": "2x HDMI, 1x DisplayPort, 1x mini DisplayPort",
        "Warentarifnummer (HS)": "85285210",
        "sRGB Abdeckung (klassisch)": "103%"
    },
    "raw_specifications_text": "Displaygr\u00f6\u00dfe: 31,5 Zoll\nAufl\u00f6sung: 2560x1440\nPanel: IPS\nReaktionszeit: 4 ms\nVideo Anschl\u00fcsse: 2x HDMI, 1x DisplayPort, 1x mini DisplayPort\nErgonomie: Neigbar\nVESA Halterung: 100x100 mm\nHelligkeit: 250 cd/m\u00b2\nBesonderheiten: Lautsprecher\nHersteller Artikelnummer: VX3276-2K-MHD-2\nEAN: 0766907002959\nArtikelnummer: M15Y2JDL\nBildschirmdiagonale: 81,3 cm (32\")\nDisplay-Aufl\u00f6sung: 2560 x 1440 Pixel\nNatives Seitenverh\u00e4ltnis: 16:9\nBildschirmtechnologie: LED\nTouchscreen: Nein\nHD-Typ: Quad HD\nPanel-Typ: IPS\nBildschirmform: Flach\nKontrastverh\u00e4ltnis: 1200:1\nMaximale Bildwiederholrate: 75 Hz\nAnzahl der Farben des Displays: 1,07 Milliarden Farben\nHelligkeit (typisch): 250 cd/m\u00b2\nBlendfreier Bildschirm: Ja\nKontrastverh\u00e4ltnis (dynamisch): 80000000:1\nBildwinkel, horizontal: 178\u00b0\nBildwinkel, vertikal: 178\u00b0\nPixel Abstand: 0,273 x 0,273 mm\nDigital horizontale Frequenz: 15 - 113 kHz\nDigital vertikale Frequenz: 24 - 75 Hz\nFarbtiefe: 10 Bit\nsRGB Abdeckung (klassisch): 103%\nNTSC Abdeckung (typisch): 72%\nVESA Adaptive Sync unterst\u00fctzt: Ja\nFlimmerfreie Technologie: Ja\nLow-Blue-Light-Technologie: Ja\nEingebaute Lautsprecher: Ja\nAnzahl der Lautsprecher: 2\nRMS-Leistung: 4 W\nMarktpositionierung: Haus\nProduktfarbe: Silber\nFu\u00dffarbe: Silber\nHDMI: Ja\nKopfh\u00f6rerausgang: Ja\nAnzahl HDMI-Anschl\u00fcsse: 2\nHDMI-Version: 1.4\nAnzahl DisplayPort Anschl\u00fcsse: 1\nAnzahl Mini DisplayPorts: 1\nKopfh\u00f6rerausg\u00e4nge: 1\nKopfh\u00f6rer-Anschluss: 3,5 mm\nStromeingang: Ja\nVESA-Halterung: Ja\nKabelsperre-Slot: Ja\nPanel-Montage-Schnittstelle: 100 x 100 mm\nSlot-Typ Kabelsperre: Kensington\nNeigungswinkelbereich: -4 - 15\u00b0\nNeigungsverstellung: Ja\nEnergieeffizienzklasse (SDR): G\nEnergieverbrauch (SDR) pro 1.000 Stunden: 40 kWh\nStromverbrauch (Standardbetrieb): 43 W\nStromverbrauch (Standby): 0,3 W\nStromverbrauch (max.): 46 W\nAC Eingangsspannung: 100 - 240 V\nAC Eingangsfrequenz: 50 - 60 Hz\nBetriebstemperatur: 0 - 40 \u00b0C\nRelative Luftfeuchtigkeit in Betrieb: 20 - 90%\nMitgelieferte Kabel: AC, HDMI\nSchnellstart\u00fcbersicht: Ja\nGer\u00e4tebreite (inkl. Fu\u00df): 713 mm\nGer\u00e4tetiefe (inkl. Fu\u00df): 230 mm\nGer\u00e4teh\u00f6he (inkl. Fu\u00df): 504 mm\nGewicht (mit St\u00e4nder): 6,2 kg\nBreite (ohne Standfu\u00df): 713 mm\nTiefe (ohne Standfu\u00df): 38 mm\nH\u00f6he (ohne Standfu\u00df): 416 mm\nGewicht (ohne St\u00e4nder): 5,6 kg\nVerpackungsbreite: 806 mm\nVerpackungstiefe: 109 mm\nVerpackungsh\u00f6he: 509 mm\nPaketgewicht: 8,2 kg\nWarentarifnummer (HS): 85285210",
    "reference_file": "offer_reference_1450.json",
    "shop_name": "mylemon.at"
}