{
    "html_file": "offer_1208_1.html",
    "name": "Lenovo L24q-35, 23.8\"",
    "offer_link": "https://www.proshop.at/Bildschirm/Lenovo-Bildschirm-L24Q-35-2560x1440-75Hz-IPS-Speakers/3031455?utm_source=geizhals&utm_medium=cpc&utm_campaign=pricesite",
    "price": 188.33,
    "raw_specifications": {
        "Abmessungen (Breite x Tiefe x H\u00f6he)": "53.98 cm x 16.49 cm x 42.37 cm",
        "Adaptive-Sync Technologie": "AMD FreeSync",
        "Ausgangsleistung/Kanal": "2 Watt",
        "Besonderheiten": "NearEdgeless-Design an 3 Seiten, 8-bit (6-bit + FRC) Farbtiefe",
        "Bildschirmbeschichtung": "Blendfrei",
        "Bildschirmtyp": "IPS",
        "Details zu Abmessungen & Gewicht": "Mit Fu\u00df - Breite: 53.98 cm - Tiefe: 16.49 cm - H\u00f6he: 42.37 cm - Gewicht: 3.9 kg  Ohne Fu\u00df - Breite: 53.98 cm - Tiefe: 4.4 cm - H\u00f6he: 32.57 cm - Gewicht: 3.4 kg",
        "Diagonalabmessung": "61 cm (24\")",
        "Display-Typ": "LED-hintergrundbeleuchteter LCD-Monitor / TFT-Aktivmatrix",
        "EAN": "0195713813945",
        "Eingangsanschl\u00fcsse": "HDMI, DisplayPort",
        "Eingangsspannung": "Wechselstrom 100-240 V (50/60 Hz)",
        "Einstellungen der Anzeigeposition": "Neigung",
        "Energie Effizienzklasse": "Klasse F",
        "Energierverbrauch Sleep": "0.5 Watt",
        "Enthaltene Kabel": "1 x HDMI-Kabel - 1.5 m",
        "Erforderliches Betriebssystem": "Microsoft Windows 7 / 10",
        "Farbe": "Raven Black",
        "Farbraum": "99% sRGB",
        "Farbunterst\u00fctzung": "16,7 Millionen Farben",
        "Ger\u00e4tetyp": "LED-hintergrundbeleuchteter LCD-Monitor - 61 cm (24\")",
        "Gewicht": "3.9 kg",
        "Helligkeit": "300 cd/m\u00b2",
        "Hersteller": "Lenovo",
        "Hintergrundbeleuchtungs-Technologie": "WLED",
        "Horizontaler Betrachtungswinkel": "178",
        "Kennzeichnung": "CCC, CEE Tier 1, TUV Rheinland Flicker Free Certification, TUV Rheinland Eye Comfort Certification, EU RoHS 2002/95/EC, TUV Eyesafe Display Certification, TUV Hardware Low Blue Light Certification",
        "Kontrast": "1000:1 / 3000000:1 (dynamisch)",
        "Leistungsmerkmale": "Slot f\u00fcr Sicherheitsschloss (Kabelschloss getrennt erh\u00e4ltlich), integrierte Kabelf\u00fchrung",
        "Lokalisierung": "EMEA",
        "Modell": "66D1GAC1EU",
        "Native Aufl\u00f6sung": "QHD 2560 x 1440 bei 75 Hz",
        "Neigungswinkel": "-5/+22",
        "Pixelpitch": "0.2058 mm",
        "Ppi": "123",
        "Produktbeschreibung": "Lenovo L24q-35 - LED-Monitor - 61 cm (24\")",
        "Reaktionszeit": "4 ms (extrem), 6 ms (normal)",
        "Schlosstyp zur Diebstahlsicherung": "Kensington Slot",
        "Schnittstellen": "HDMI  DisplayPort 1.2  Kopfh\u00f6rer",
        "Seitenverh\u00e4ltnis": "16:9",
        "Sichtbare Bildfl\u00e4che": "60.5 cm (23.8\")",
        "Spannung": "Wechselstrom 100-240 V (50/60 Hz)",
        "Stromverbrauch (Aus-Modus)": "0.3 Watt",
        "Stromverbrauch (max.)": "32 Watt",
        "Stromverbrauch (typisch)": "22 Watt",
        "Stromverbrauch SDR (eingeschaltet)": "22 kWh/1.000 h",
        "Stromverbrauch im Standby-Modus": "0.5 Watt",
        "Transportbreite": "63.9 cm",
        "Transportgewicht": "5.5 kg",
        "Transporth\u00f6he": "12.2 cm",
        "Transporttiefe": "40.5 cm",
        "Typ": "Lautsprecher - Stereo",
        "VESA-Halterung": "100 x 100 mm",
        "Vertikaler Betrachtungswinkel": "178",
        "Waren-Nr.": "3031455",
        "Zum Hersteller": "lenovo.com"
    },
    "raw_specifications_text": "Hersteller: Lenovo\nWaren-Nr.: 3031455\nModell: 66D1GAC1EU\nEAN: 0195713813945\nZum Hersteller: lenovo.com\nProduktbeschreibung: Lenovo L24q-35 - LED-Monitor - 61 cm (24\")\nGer\u00e4tetyp: LED-hintergrundbeleuchteter LCD-Monitor - 61 cm (24\")\nEnergie Effizienzklasse: Klasse F\nAdaptive-Sync Technologie: AMD FreeSync\nBildschirmtyp: IPS\nSeitenverh\u00e4ltnis: 16:9\nNative Aufl\u00f6sung: QHD 2560 x 1440 bei 75 Hz\nPixelpitch: 0.2058 mm\nHelligkeit: 300 cd/m\u00b2\nKontrast: 1000:1 / 3000000:1 (dynamisch)\nReaktionszeit: 4 ms (extrem), 6 ms (normal)\nFarbunterst\u00fctzung: 16,7 Millionen Farben\nFarbraum: 99% sRGB\nEingangsanschl\u00fcsse: HDMI, DisplayPort\nEinstellungen der Anzeigeposition: Neigung\nBildschirmbeschichtung: Blendfrei\nSpannung: Wechselstrom 100-240 V (50/60 Hz)\nFarbe: Raven Black\nAbmessungen (Breite x Tiefe x H\u00f6he): 53.98 cm x 16.49 cm x 42.37 cm\nGewicht: 3.9 kg\nLokalisierung: EMEA\nKennzeichnung: CCC, CEE Tier 1, TUV Rheinland Flicker Free Certification, TUV Rheinland Eye Comfort Certification, EU RoHS 2002/95/EC, TUV Eyesafe Display Certification, TUV Hardware Low Blue Light Certification\nDisplay-Typ: LED-hintergrundbeleuchteter LCD-Monitor / TFT-Aktivmatrix\nDiagonalabmessung: 61 cm (24\")\nSichtbare Bildfl\u00e4che: 60.5 cm (23.8\")\nPpi: 123\nHorizontaler Betrachtungswinkel: 178\nVertikaler Betrachtungswinkel: 178\nHintergrundbeleuchtungs-Technologie: WLED\nBesonderheiten: NearEdgeless-Design an 3 Seiten, 8-bit (6-bit + FRC) Farbtiefe\nTyp: Lautsprecher - Stereo\nAusgangsleistung/Kanal: 2 Watt\nSchnittstellen: HDMI  DisplayPort 1.2  Kopfh\u00f6rer\nNeigungswinkel: -5/+22\nVESA-Halterung: 100 x 100 mm\nLeistungsmerkmale: Slot f\u00fcr Sicherheitsschloss (Kabelschloss getrennt erh\u00e4ltlich), integrierte Kabelf\u00fchrung\nEnthaltene Kabel: 1 x HDMI-Kabel - 1.5 m\nSchlosstyp zur Diebstahlsicherung: Kensington Slot\nEingangsspannung: Wechselstrom 100-240 V (50/60 Hz)\nStromverbrauch SDR (eingeschaltet): 22 kWh/1.000 h\nStromverbrauch (typisch): 22 Watt\nStromverbrauch (max.): 32 Watt\nStromverbrauch im Standby-Modus: 0.5 Watt\nEnergierverbrauch Sleep: 0.5 Watt\nStromverbrauch (Aus-Modus): 0.3 Watt\nErforderliches Betriebssystem: Microsoft Windows 7 / 10\nDetails zu Abmessungen & Gewicht: Mit Fu\u00df - Breite: 53.98 cm - Tiefe: 16.49 cm - H\u00f6he: 42.37 cm - Gewicht: 3.9 kg  Ohne Fu\u00df - Breite: 53.98 cm - Tiefe: 4.4 cm - H\u00f6he: 32.57 cm - Gewicht: 3.4 kg\nTransportbreite: 63.9 cm\nTransporttiefe: 40.5 cm\nTransporth\u00f6he: 12.2 cm\nTransportgewicht: 5.5 kg",
    "reference_file": "offer_reference_1208.json",
    "shop_name": "Proshop.at"
}