{
    "html_file": "offer_267_0.html",
    "name": "HP V27ie G5, 27\"",
    "offer_link": "https://www.amazon.de/dp/B0BFWSHXYY?linkCode=xm2&camp=2025&creative=165953&smid=A3JWKAKR8XB7XF&creativeASIN=B0BFWSHXYY&tag=geizhals1-21",
    "price": 160.34,
    "raw_specifications": {
        "ASIN": "B0BFWSHXYY",
        "Amazon Bestseller-Rang": "Nr. 7,802 in Computer & Zubeh\u00f6r (Siehe Top 100 in Computer & Zubeh\u00f6r)  Nr. 166 in Monitore  Nr. 3,207 in Climate Pledge Friendly: Zum Shop",
        "Artikelgewicht": "\u200e5,11 Kilograms",
        "Bildschirmaufl\u00f6sung": "\u200e1920x1080",
        "Display-Gr\u00f6\u00dfe": "\u200e27 Zoll",
        "Durchschnittliche Kundenbewertung": "4,6  4,6 von 5 Sternen    \n    2.923 Sternebewertungen   \n\n\n 4,6 von 5 Sternen",
        "Farbe": "\u200eSchwarz",
        "Garantierte Software-Updates bis": "\u200eunbekannt",
        "Hersteller": "\u200eHP",
        "Im Angebot von Amazon.de seit": "20. September 2022",
        "L\u00f6sung": "\u200e1920 x 1080 Pixels",
        "Marke": "\u200eHP",
        "Modell/Serie": "\u200eV27ie G5",
        "Modellnummer": "\u200e6D8H2AA",
        "Produktabmessungen": "\u200e19,03 x 61,1 x 43,84 cm; 5,11 Kilogramm"
    },
    "raw_specifications_text": "Marke: \u200eHP\nHersteller: \u200eHP\nModell/Serie: \u200eV27ie G5\nProduktabmessungen: \u200e19,03 x 61,1 x 43,84 cm; 5,11 Kilogramm\nModellnummer: \u200e6D8H2AA\nFarbe: \u200eSchwarz\nDisplay-Gr\u00f6\u00dfe: \u200e27 Zoll\nBildschirmaufl\u00f6sung: \u200e1920x1080\nL\u00f6sung: \u200e1920 x 1080 Pixels\nArtikelgewicht: \u200e5,11 Kilograms\nGarantierte Software-Updates bis: \u200eunbekannt\nASIN: B0BFWSHXYY\nDurchschnittliche Kundenbewertung: 4,6  4,6 von 5 Sternen    \n    2.923 Sternebewertungen   \n\n\n 4,6 von 5 Sternen\nAmazon Bestseller-Rang: Nr. 7,802 in Computer & Zubeh\u00f6r (Siehe Top 100 in Computer & Zubeh\u00f6r)  Nr. 166 in Monitore  Nr. 3,207 in Climate Pledge Friendly: Zum Shop\nIm Angebot von Amazon.de seit: 20. September 2022",
    "reference_file": "offer_reference_267.json",
    "shop_name": "Amazon.at"
}