{
    "html_file": "offer_2238_14.html",
    "name": "HANNspree HS248PPB, 23.8\"",
    "offer_link": "https://www.taufnaus.de/product/13121521",
    "price": 147.28,
    "raw_specifications": {
        "Ausgangsleistung/Kanal": "1.5 Watt",
        "Besonderheiten": "Ultraweiter Blickwinkel, flimmerfreie Technologie",
        "Bildschirmbeschichtung": "Blendfrei",
        "Diagonalabmessung": "60.45 cm (23.8\")",
        "Display-Typ": "LED-hintergrundbeleuchteter LCD-Monitor / TFT-Aktivmatrix",
        "Ein-/Aus-Schalter": "Nein",
        "Eingangsspannung": "Wechselstrom 120/230 V (50/60 Hz)",
        "Einstellungen der Anzeigeposition": "Neigung",
        "Energie Effizienzklasse": "Klasse F",
        "Energieverbrauch pro Jahr": "28 kWh",
        "Enthaltene Kabel": "1 x VGA-Kabel - 1.5 m \u00a6 1 x Audiokabel - 1.5 m",
        "Farbe": "Black Texture",
        "Farbunterst\u00fctzung": "16,7 Millionen Farben",
        "Helligkeit": "250 cd/m\u00b2",
        "Hintergrundbeleuchtungs-Technologie": "LED-Hintergrundbeleuchtung",
        "Horizontale Bildwiederholrate": "30 - 83 kHz",
        "Horizontaler Betrachtungswinkel": "178",
        "Kontrast": "1000:1 / 80000000:1 (dynamisch)",
        "Leistungsaufnahme im Ein-Zustand": "22 W",
        "Native Aufl\u00f6sung": "Full HD (1080p) 1920 x 1080 bei 60 Hz",
        "Neigungswinkel": "-5/+20",
        "Pixelpitch": "0.274 mm",
        "Reaktionszeit": "5 ms",
        "Schnittstellen": "VGA \u00a6 HDMI \u00a6 DisplayPort \u00a6 Kopfh\u00f6rer",
        "Seitenverh\u00e4ltnis": "16:9",
        "Stromverbrauch (Aus-Modus)": "0.23 Watt",
        "Stromverbrauch (typisch)": "16.9 Watt",
        "Stromverbrauch SDR (eingeschaltet)": "22 kWh/1.000 h",
        "Stromverbrauch im Standby-Modus": "0.35 Watt",
        "TCO-zertifiziert": "TCO Certified Displays 8",
        "Typ": "Lautsprecher - Stereo",
        "VESA-Halterung": "100 x 100 mm",
        "Vertikale Bildwiederholrate": "56 - 75 Hz",
        "Vertikaler Betrachtungswinkel": "178"
    },
    "raw_specifications_text": "Display-Typ: LED-hintergrundbeleuchteter LCD-Monitor / TFT-Aktivmatrix\nEnergie Effizienzklasse: Klasse F\nEnergieverbrauch pro Jahr: 28 kWh\nDiagonalabmessung: 60.45 cm (23.8\")\nSeitenverh\u00e4ltnis: 16:9\nNative Aufl\u00f6sung: Full HD (1080p) 1920 x 1080 bei 60 Hz\nPixelpitch: 0.274 mm\nHelligkeit: 250 cd/m\u00b2\nKontrast: 1000:1 / 80000000:1 (dynamisch)\nFarbunterst\u00fctzung: 16,7 Millionen Farben\nReaktionszeit: 5 ms\nVertikale Bildwiederholrate: 56 - 75 Hz\nHorizontale Bildwiederholrate: 30 - 83 kHz\nHorizontaler Betrachtungswinkel: 178\nVertikaler Betrachtungswinkel: 178\nBildschirmbeschichtung: Blendfrei\nHintergrundbeleuchtungs-Technologie: LED-Hintergrundbeleuchtung\nBesonderheiten: Ultraweiter Blickwinkel, flimmerfreie Technologie\nFarbe: Black Texture\nTyp: Lautsprecher - Stereo\nAusgangsleistung/Kanal: 1.5 Watt\nSchnittstellen: VGA \u00a6 HDMI \u00a6 DisplayPort \u00a6 Kopfh\u00f6rer\nEinstellungen der Anzeigeposition: Neigung\nNeigungswinkel: -5/+20\nVESA-Halterung: 100 x 100 mm\nEnthaltene Kabel: 1 x VGA-Kabel - 1.5 m \u00a6 1 x Audiokabel - 1.5 m\nEingangsspannung: Wechselstrom 120/230 V (50/60 Hz)\nLeistungsaufnahme im Ein-Zustand: 22 W\nStromverbrauch SDR (eingeschaltet): 22 kWh/1.000 h\nStromverbrauch (typisch): 16.9 Watt\nStromverbrauch im Standby-Modus: 0.35 Watt\nStromverbrauch (Aus-Modus): 0.23 Watt\nEin-/Aus-Schalter: Nein\nTCO-zertifiziert: TCO Certified Displays 8",
    "reference_file": "offer_reference_2238.json",
    "shop_name": "TaufNaus"
}