{
    "html_file": "offer_1033_0.html",
    "name": "Philips Evnia 5000 27M1N5200PA, 27\"",
    "offer_link": "https://www.proshop.at/Bildschirm/Philips-27-Bildschirm-Momentum-5000-1920x1080-240Hz-IPS-Black-1-ms-AMD-FreeSync-Premium/3054898?utm_source=geizhals&utm_medium=cpc&utm_campaign=pricesite",
    "price": 270.95,
    "raw_specifications": {
        "Abmessungen (Breite x Tiefe x H\u00f6he)": "61.4 cm x 21.2 cm x 54.9 cm - mit Fu\u00df",
        "Abmessungen (Breite x Tiefe x H\u00f6he) - mit Fu\u00df": "61.4 cm x 21.2 cm x 54.9 cm",
        "Adaptive-Sync Technologie": "AMD FreeSync Premium",
        "Ausgangsleistung/Kanal": "5 Watt",
        "Besonderheiten": "Smart ErgoBase, SmartImage Game, Mega Infinity Dynamic Contrast Ratio, Low Blue Light Mode, flimmerfreie Technologie, SmartUniformity, EasySelect Menu Toggle Key, Niedrige Eingangsverz\u00f6gerung, EasyRead, sRGB Mode, HDR Ready-Technologie, Monitorkalibrierung Delta E<2",
        "Bildschirmbeschichtung": "Blendfrei, 3H Hard Coating, Haze 25 %",
        "Bildschirmtyp": "IPS",
        "Details zu Abmessungen & Gewicht": "Mit Standfu\u00df (h\u00f6chste Position) - Breite: 61.4 cm - Tiefe: 21.2 cm - H\u00f6he: 54.9 cm - Gewicht: 4.92 kg  Ohne Fu\u00df - Breite: 61.4 cm - Tiefe: 4.3 cm - H\u00f6he: 36.3 cm - Gewicht: 3.52 kg",
        "Diagonalabmessung": "68.5 cm (27\")",
        "Display-Typ": "LED-hintergrundbeleuchteter LCD-Monitor / TFT-Aktivmatrix",
        "EAN": "8712581784522",
        "Eingangsanschl\u00fcsse": "2xHDMI, DisplayPort",
        "Eingangsspannung": "Wechselstrom 100-240 V (50/60 Hz)",
        "Einstellungen der Anzeigeposition": "H\u00f6he, Pivot (Rotation), Drehung, Neigung",
        "Energie Effizienzklasse": "Klasse E",
        "Energieklasse (HDR)": "Klasse G",
        "Enthaltene Kabel": "1 x DisplayPort-Kabel  1 x HDMI-Kabel  1 x USB Upstream-Kabel",
        "Farbe": "Textured Black",
        "Farbraum": "95% NTSC (CIE 1976), 110.2% sRGB (CIE 1931), 87.1% Adobe RGB (CIE 1976)",
        "Farbunterst\u00fctzung": "16,7 Millionen Farben",
        "Ger\u00e4tetyp": "LED-hintergrundbeleuchteter LCD-Monitor - 68.5 cm (27\")",
        "Gewicht": "4.92 kg",
        "Helligkeit": "400 cd/m\u00b2",
        "Hersteller": "Philips",
        "Hintergrundbeleuchtungs-Technologie": "WLED",
        "Horizontale Bildwiederholrate": "30 - 255 kHz",
        "Horizontaler Betrachtungswinkel": "178",
        "H\u00f6heneinstellung": "130 mm",
        "Integrierte Peripherieger\u00e4te": "USB 3.2 Hub",
        "Kennzeichnung": "Plug and Play, FCC Klasse B bescheinigt, TUV, ICES-003, CB, DDC/CI, RoHS, ISO 9241-307, TUV Bauart, CU-EAC, quecksilberfrei, EAEU RoHS",
        "Kontrast": "1000:1",
        "Leistungsmerkmale": "Slot f\u00fcr Sicherheitsschloss (Kabelschloss getrennt erh\u00e4ltlich)",
        "MTBF": "50,000 Stunde(n)",
        "Modell": "27M1N5200PA/00",
        "Native Aufl\u00f6sung": "Full HD (1080p) 1920 x 1080 bei 240 Hz",
        "Neigungswinkel": "-5/+20",
        "OSD-Sprachen": "Ungarisch, Tschechisch, Chinesisch (tradionell), Ukrainisch, Brasilianisches Portugiesisch, Englisch, Deutsch, Franz\u00f6sisch, Italienisch, Portugiesisch, Polnisch, Finnisch, Schwedisch, Russisch, Spanisch, Holl\u00e4ndisch, Griechisch, T\u00fcrkisch, Japanisch, Chinesisch, Koreanisch",
        "Pixelpitch": "0.3108 mm",
        "Ppi": "81.9",
        "Produktbeschreibung": "Philips Momentum 5000 27M1N5200PA - LED-Monitor - Full HD (1080p) - 68.5 cm (27\") - HDR",
        "Reaktionszeit": "1 ms (Gray-to-Gray), 0.5 ms (MPRT)",
        "Rotationswinkel": "180",
        "Schlosstyp zur Diebstahlsicherung": "Kensington Slot",
        "Schnittstellen": "2 x HDMI (HDCP 2.2)  DisplayPort 1.4 (HDCP 2.2)  Audio Line-Out  USB Upstream (Typ B)  2 x USB 3.2 Downstream  2 x USB 3.2 Downstream (Schnellladung)",
        "Schwenkwinkel": "90",
        "Seitenverh\u00e4ltnis": "16:9",
        "Sichtbare Bildfl\u00e4che": "68.5 cm (27\")",
        "Spannung": "Wechselstrom 100-240 V (50/60 Hz)",
        "Stromverbrauch (Aus-Modus)": "0.3 Watt",
        "Stromverbrauch (typisch)": "20.5 Watt",
        "Stromverbrauch HDR (eingeschaltet)": "36 kWh/1.000 h",
        "Stromverbrauch SDR (eingeschaltet)": "21 kWh/1.000 h",
        "Stromverbrauch im Standby-Modus": "0.5 Watt",
        "Transportbreite": "78 cm",
        "Transportgewicht": "9.86 kg",
        "Transporth\u00f6he": "52.1 cm",
        "Transporttiefe": "22.4 cm",
        "Typ": "Lautsprecher - Stereo",
        "VESA-Halterung": "100 x 100 mm",
        "Vertikale Bildwiederholrate": "48 - 240 Hz",
        "Vertikaler Betrachtungswinkel": "178",
        "Waren-Nr.": "3054898",
        "Zum Hersteller": "www.philips.com"
    },
    "raw_specifications_text": "Hersteller: Philips\nWaren-Nr.: 3054898\nModell: 27M1N5200PA/00\nEAN: 8712581784522\nZum Hersteller: www.philips.com\nProduktbeschreibung: Philips Momentum 5000 27M1N5200PA - LED-Monitor - Full HD (1080p) - 68.5 cm (27\") - HDR\nGer\u00e4tetyp: LED-hintergrundbeleuchteter LCD-Monitor - 68.5 cm (27\")\nEnergie Effizienzklasse: Klasse E\nAdaptive-Sync Technologie: AMD FreeSync Premium\nLeistungsmerkmale: Slot f\u00fcr Sicherheitsschloss (Kabelschloss getrennt erh\u00e4ltlich)\nBildschirmtyp: IPS\nSeitenverh\u00e4ltnis: 16:9\nNative Aufl\u00f6sung: Full HD (1080p) 1920 x 1080 bei 240 Hz\nPixelpitch: 0.3108 mm\nHelligkeit: 400 cd/m\u00b2\nKontrast: 1000:1\nReaktionszeit: 1 ms (Gray-to-Gray), 0.5 ms (MPRT)\nFarbunterst\u00fctzung: 16,7 Millionen Farben\nFarbraum: 95% NTSC (CIE 1976), 110.2% sRGB (CIE 1931), 87.1% Adobe RGB (CIE 1976)\nEingangsanschl\u00fcsse: 2xHDMI, DisplayPort\nEinstellungen der Anzeigeposition: H\u00f6he, Pivot (Rotation), Drehung, Neigung\nBildschirmbeschichtung: Blendfrei, 3H Hard Coating, Haze 25 %\nSpannung: Wechselstrom 100-240 V (50/60 Hz)\nFarbe: Textured Black\nAbmessungen (Breite x Tiefe x H\u00f6he) - mit Fu\u00df: 61.4 cm x 21.2 cm x 54.9 cm\nGewicht: 4.92 kg\nKennzeichnung: Plug and Play, FCC Klasse B bescheinigt, TUV, ICES-003, CB, DDC/CI, RoHS, ISO 9241-307, TUV Bauart, CU-EAC, quecksilberfrei, EAEU RoHS\nDisplay-Typ: LED-hintergrundbeleuchteter LCD-Monitor / TFT-Aktivmatrix\nEnergieklasse (HDR): Klasse G\nDiagonalabmessung: 68.5 cm (27\")\nSichtbare Bildfl\u00e4che: 68.5 cm (27\")\nIntegrierte Peripherieger\u00e4te: USB 3.2 Hub\nPpi: 81.9\nVertikale Bildwiederholrate: 48 - 240 Hz\nHorizontale Bildwiederholrate: 30 - 255 kHz\nHorizontaler Betrachtungswinkel: 178\nVertikaler Betrachtungswinkel: 178\nHintergrundbeleuchtungs-Technologie: WLED\nOSD-Sprachen: Ungarisch, Tschechisch, Chinesisch (tradionell), Ukrainisch, Brasilianisches Portugiesisch, Englisch, Deutsch, Franz\u00f6sisch, Italienisch, Portugiesisch, Polnisch, Finnisch, Schwedisch, Russisch, Spanisch, Holl\u00e4ndisch, Griechisch, T\u00fcrkisch, Japanisch, Chinesisch, Koreanisch\nBesonderheiten: Smart ErgoBase, SmartImage Game, Mega Infinity Dynamic Contrast Ratio, Low Blue Light Mode, flimmerfreie Technologie, SmartUniformity, EasySelect Menu Toggle Key, Niedrige Eingangsverz\u00f6gerung, EasyRead, sRGB Mode, HDR Ready-Technologie, Monitorkalibrierung Delta E<2\nAbmessungen (Breite x Tiefe x H\u00f6he): 61.4 cm x 21.2 cm x 54.9 cm - mit Fu\u00df\nTyp: Lautsprecher - Stereo\nAusgangsleistung/Kanal: 5 Watt\nSchnittstellen: 2 x HDMI (HDCP 2.2)  DisplayPort 1.4 (HDCP 2.2)  Audio Line-Out  USB Upstream (Typ B)  2 x USB 3.2 Downstream  2 x USB 3.2 Downstream (Schnellladung)\nNeigungswinkel: -5/+20\nSchwenkwinkel: 90\nRotationswinkel: 180\nH\u00f6heneinstellung: 130 mm\nVESA-Halterung: 100 x 100 mm\nEnthaltene Kabel: 1 x DisplayPort-Kabel  1 x HDMI-Kabel  1 x USB Upstream-Kabel\nMTBF: 50,000 Stunde(n)\nSchlosstyp zur Diebstahlsicherung: Kensington Slot\nEingangsspannung: Wechselstrom 100-240 V (50/60 Hz)\nStromverbrauch SDR (eingeschaltet): 21 kWh/1.000 h\nStromverbrauch HDR (eingeschaltet): 36 kWh/1.000 h\nStromverbrauch (typisch): 20.5 Watt\nStromverbrauch im Standby-Modus: 0.5 Watt\nStromverbrauch (Aus-Modus): 0.3 Watt\nDetails zu Abmessungen & Gewicht: Mit Standfu\u00df (h\u00f6chste Position) - Breite: 61.4 cm - Tiefe: 21.2 cm - H\u00f6he: 54.9 cm - Gewicht: 4.92 kg  Ohne Fu\u00df - Breite: 61.4 cm - Tiefe: 4.3 cm - H\u00f6he: 36.3 cm - Gewicht: 3.52 kg\nTransportbreite: 78 cm\nTransporttiefe: 22.4 cm\nTransporth\u00f6he: 52.1 cm\nTransportgewicht: 9.86 kg",
    "reference_file": "offer_reference_1033.json",
    "shop_name": "Proshop.at"
}