{
    "html_file": "offer_1044_2.html",
    "name": "Dell UltraSharp U3023E, 30\"",
    "offer_link": "https://www.csv-direct.de/artinfo.php?artnr=A1621670&KATEGORIE=162&pva=geizhals2",
    "price": 569.45,
    "raw_specifications": {
        "AC Eingangsfrequenz": "50 - 60 Hz",
        "AC Eingangsspannung": "100 - 240 V",
        "AMD FreeSync": "Nein",
        "Anzahl DisplayPort Anschl\u00fcsse": "2",
        "Anzahl HDMI-Anschl\u00fcsse": "1",
        "Anzahl RJ-45-Anschl\u00fcsse": "1",
        "Anzahl der Farben des Displays": "1,07 Milliarden Farben",
        "Anzahl der nachgeschalteten Ports vom Typ USB-C": "1",
        "Anzahl der nachgeschalteten Steckpl\u00e4tze vom Typ USB-A": "4",
        "Anzahl der vorgeschalteten Steckpl\u00e4tze": "2",
        "Betriebstemperatur": "0 - 40 \u00b0C",
        "Bildschirmdiagonale": "76,2 cm 30\"",
        "Bildschirmdiagonale cm": "75,62 cm",
        "Bildschirmform": "Flach",
        "Bildschirmtechnologie": "LCD",
        "Bildwinkel, horizontal": "178\u00b0",
        "Bildwinkel, vertikal": "178\u00b0",
        "Breite ohne Standfu\u00df": "655,9 mm",
        "Display-Aufl\u00f6sung": "2560 x 1600 Pixel",
        "Eingebaute Lautsprecher": "Nein",
        "Energieeffizienzklasse HDR": "Nicht verf\u00fcgbar",
        "Energieeffizienzklasse SDR": "F",
        "Energieeffizienzskala": "A bis G",
        "Energieverbrauch SDR pro 1.000 Stunden": "27 kWh",
        "Enth\u00e4lt nicht": "Arsen, PVC/BFR",
        "Farbpalette DCI-P3": "95",
        "Fu\u00dffarbe": "Silber",
        "Ger\u00e4tebreite inkl. Fu\u00df": "655,9 mm",
        "Ger\u00e4teh\u00f6he inkl. Fu\u00df": "472,7 mm",
        "Ger\u00e4tetiefe inkl. Fu\u00df": "230 mm",
        "Gewicht mit St\u00e4nder": "10,8 kg",
        "Gewicht ohne St\u00e4nder": "6,48 kg",
        "HD-Typ": "WQXGA",
        "HDMI-Version": "1.4",
        "Helligkeit typisch": "350 cd/m\u00b2",
        "High Dynamic Range Video HDR Unterst\u00fctzung": "Nein",
        "Horizontaler Scanbereich": "30 - 113 kHz",
        "H\u00f6he bei Betrieb": "0 - 5000 m",
        "H\u00f6he bei Lagerung": "0 - 12192 m",
        "H\u00f6he ohne Standfu\u00df": "418,6 mm",
        "H\u00f6heneinstellung": "15 cm",
        "Integrierte Kamera": "Nein",
        "Konformit\u00e4t mit Industriestandards": "ENERGY STAR certified Monitor.EPEAT registered where applicable.TCO Certified & TCO Certified Edge.RoHS Compliant.BFR/PVC Free monitorMeets NFPA 99 leakage current requirements.Arsenic-Free glass and Mercury-Free for the panel only.",
        "Kontrastverh\u00e4ltnis": "1000:1",
        "Kopfh\u00f6rer-Anschluss": "3,5 mm",
        "Kopfh\u00f6rerausg\u00e4nge": "1",
        "Luftfeuchtigkeit bei Lagerung": "5 - 90",
        "Marktpositionierung": "Grafikdesign",
        "Maximale Aufl\u00f6sung": "2560 x 1600 Pixel",
        "Maximale Bildwiederholrate": "60 Hz",
        "Mitgelieferte Kabel": "AC, DisplayPort, USB Typ-C, USB Typ-C auf USB Typ-A",
        "NVIDIA G-SYNC": "Nein",
        "Nachhaltigkeitszertifikate": "ENERGY STAR, EPEAT Gold, RoHS",
        "Natives Seitenverh\u00e4ltnis": "16:10",
        "Neigungswinkelbereich": "-5 - 21\u00b0",
        "Netzteiltyp": "Intern",
        "Oberfl\u00e4chenh\u00e4rte": "3H",
        "Paketgewicht": "15,1 kg",
        "Panel-Montage-Schnittstelle": "100 x 100 mm",
        "Panel-Typ": "IPS",
        "Pivot Winkel": "-90 - 90\u00b0",
        "Pixel Abstand": "0,2505 x 0,2505 mm",
        "Pixeldichte": "101,4 ppi",
        "Produktfarbe": "Silber",
        "RGB-Farbraum": "sRGB",
        "Rahmenbreite Seite": "7,3 mm",
        "Rahmenbreite oben": "7,3 mm",
        "Rahmenbreite unten": "1,05 cm",
        "Reaktionszeit": "8 ms",
        "Reaktionszeit schnell": "5 ms",
        "Relative Luftfeuchtigkeit in Betrieb": "10 - 80",
        "Schwenkwinkelbereich": "-30 - 30\u00b0",
        "Schwermetallfrei": "Hg Quecksilber",
        "Sichtbare Gr\u00f6\u00dfe horizontal": "64,1 cm",
        "Sichtbare Gr\u00f6\u00dfe vertikal": "40,1 cm",
        "Stromverbrauch Standardbetrieb": "26,6 W",
        "Stromverbrauch Standby": "0,3 W",
        "Stromverbrauch aus": "0,2 W",
        "Stromverbrauch max.": "210 W",
        "Temperaturbereich bei Lagerung": "-20 - 60 \u00b0C",
        "Tiefe ohne Standfu\u00df": "53 mm",
        "Touchscreen": "Nein",
        "Typ der Hintergrundbeleuchtung": "LED",
        "USB-Hub-Version": "3.2 Gen 2 3.1 Gen 2",
        "USB-Stromversorgung bis zu": "90 W",
        "USB-Upstream-Porttyp": "USB Typ-C",
        "Unterst\u00fctzte Video-Modi": "480i, 480p, 576i, 576p, 720p, 1080i, 1080p",
        "Vertikaler Scanbereich": "56 - 76 Hz",
        "Vorderer Rahmen": "Schwarz",
        "WLAN": "Nein",
        "Warentarifnummer HS": "85285210",
        "W\u00e4rmeableitung typisch": "90,76 BTU/h",
        "sRGB Abdeckung klassisch": "100"
    },
    "raw_specifications_text": "Bildschirmdiagonale: 76,2 cm 30\"\nDisplay-Aufl\u00f6sung: 2560 x 1600 Pixel\nNatives Seitenverh\u00e4ltnis: 16:10\nBildschirmtechnologie: LCD\nTouchscreen: Nein\nHD-Typ: WQXGA\nPanel-Typ: IPS\nBildschirmform: Flach\nKontrastverh\u00e4ltnis: 1000:1\nMaximale Bildwiederholrate: 60 Hz\nAnzahl der Farben des Displays: 1,07 Milliarden Farben\nTyp der Hintergrundbeleuchtung: LED\nHelligkeit typisch: 350 cd/m\u00b2\nReaktionszeit: 8 ms\nUnterst\u00fctzte Video-Modi: 480i, 480p, 576i, 576p, 720p, 1080i, 1080p\nBildwinkel, horizontal: 178\u00b0\nBildwinkel, vertikal: 178\u00b0\nReaktionszeit schnell: 5 ms\nPixel Abstand: 0,2505 x 0,2505 mm\nPixeldichte: 101,4 ppi\nHorizontaler Scanbereich: 30 - 113 kHz\nVertikaler Scanbereich: 56 - 76 Hz\nSichtbare Gr\u00f6\u00dfe horizontal: 64,1 cm\nSichtbare Gr\u00f6\u00dfe vertikal: 40,1 cm\nBildschirmdiagonale cm: 75,62 cm\nHigh Dynamic Range Video HDR Unterst\u00fctzung: Nein\nOberfl\u00e4chenh\u00e4rte: 3H\nRGB-Farbraum: sRGB\nsRGB Abdeckung klassisch: 100\nW\u00e4rmeableitung typisch: 90,76 BTU/h\nNVIDIA G-SYNC: Nein\nAMD FreeSync: Nein\nEingebaute Lautsprecher: Nein\nIntegrierte Kamera: Nein\nMarktpositionierung: Grafikdesign\nProduktfarbe: Silber\nVorderer Rahmen: Schwarz\nFu\u00dffarbe: Silber\nSchwermetallfrei: Hg Quecksilber\nKonformit\u00e4t mit Industriestandards: ENERGY STAR certified Monitor.EPEAT registered where applicable.TCO Certified & TCO Certified Edge.RoHS Compliant.BFR/PVC Free monitorMeets NFPA 99 leakage current requirements.Arsenic-Free glass and Mercury-Free for the panel only.\nUSB-Hub-Version: 3.2 Gen 2 3.1 Gen 2\nUSB-Upstream-Porttyp: USB Typ-C\nAnzahl der vorgeschalteten Steckpl\u00e4tze: 2\nAnzahl der nachgeschalteten Steckpl\u00e4tze vom Typ USB-A: 4\nAnzahl der nachgeschalteten Ports vom Typ USB-C: 1\nUSB-Stromversorgung bis zu: 90 W\nAnzahl HDMI-Anschl\u00fcsse: 1\nHDMI-Version: 1.4\nAnzahl DisplayPort Anschl\u00fcsse: 2\nKopfh\u00f6rerausg\u00e4nge: 1\nKopfh\u00f6rer-Anschluss: 3,5 mm\nWLAN: Nein\nPanel-Montage-Schnittstelle: 100 x 100 mm\nH\u00f6heneinstellung: 15 cm\nPivot Winkel: -90 - 90\u00b0\nSchwenkwinkelbereich: -30 - 30\u00b0\nNeigungswinkelbereich: -5 - 21\u00b0\nEnergieeffizienzklasse SDR: F\nEnergieeffizienzklasse HDR: Nicht verf\u00fcgbar\nEnergieverbrauch SDR pro 1.000 Stunden: 27 kWh\nStromverbrauch Standardbetrieb: 26,6 W\nStromverbrauch Standby: 0,3 W\nStromverbrauch max.: 210 W\nStromverbrauch aus: 0,2 W\nAC Eingangsspannung: 100 - 240 V\nAC Eingangsfrequenz: 50 - 60 Hz\nNetzteiltyp: Intern\nEnergieeffizienzskala: A bis G\nBetriebstemperatur: 0 - 40 \u00b0C\nTemperaturbereich bei Lagerung: -20 - 60 \u00b0C\nRelative Luftfeuchtigkeit in Betrieb: 10 - 80\nLuftfeuchtigkeit bei Lagerung: 5 - 90\nH\u00f6he bei Betrieb: 0 - 5000 m\nH\u00f6he bei Lagerung: 0 - 12192 m\nMitgelieferte Kabel: AC, DisplayPort, USB Typ-C, USB Typ-C auf USB Typ-A\nGer\u00e4tebreite inkl. Fu\u00df: 655,9 mm\nGer\u00e4tetiefe inkl. Fu\u00df: 230 mm\nGer\u00e4teh\u00f6he inkl. Fu\u00df: 472,7 mm\nGewicht mit St\u00e4nder: 10,8 kg\nBreite ohne Standfu\u00df: 655,9 mm\nTiefe ohne Standfu\u00df: 53 mm\nH\u00f6he ohne Standfu\u00df: 418,6 mm\nGewicht ohne St\u00e4nder: 6,48 kg\nRahmenbreite Seite: 7,3 mm\nRahmenbreite oben: 7,3 mm\nRahmenbreite unten: 1,05 cm\nPaketgewicht: 15,1 kg\nNachhaltigkeitszertifikate: ENERGY STAR, EPEAT Gold, RoHS\nEnth\u00e4lt nicht: Arsen, PVC/BFR\nWarentarifnummer HS: 85285210\nFarbpalette DCI-P3: 95\nMaximale Aufl\u00f6sung: 2560 x 1600 Pixel\nAnzahl RJ-45-Anschl\u00fcsse: 1",
    "reference_file": "offer_reference_1044.json",
    "shop_name": "CSV-Direct.de"
}