{
    "html_file": "offer_1759_23.html",
    "name": "AOC 27B2DA, 27\"",
    "offer_link": "https://www.office-partner.de/productredirect/index/sku/15165843?sPartner=p-geizhals-at&campaign=psm/geizhals-at/",
    "price": 135.86,
    "raw_specifications": {
        "Anschl\u00fcsse": "HDMI, VGA/D-Sub, Audioausgang (Line-Out), Audioeingang (Line-In), DVI-D",
        "Artikelnummer": "15165843",
        "Aufl\u00f6sung Kurzname": "Full HD",
        "Bezeichnung des Herstellers": "AOC 27B2DA",
        "Bildwiederholungsrate": "75,00 Hz",
        "Breite": "-1,00 mm",
        "Display Features": "FlickerFree",
        "Display Sync": "Adaptive Sync",
        "Displaygr\u00f6\u00dfe": "68,58 cm (27 Zoll)",
        "EEK - Spektrum": "AG",
        "Energieeffizienzklasse": "E",
        "Geh\u00e4usefarbe des Ger\u00e4tes": "Schwarz",
        "Gewicht": "6,32 kg",
        "Gewicht inkl. Verpackung in Kg": "5,50 kg",
        "Helligkeit Bereich": "150 - 300 cd/m\u00b2",
        "Hersteller": "AOC",
        "H\u00f6he": "-1,00 mm",
        "Inhalt (ml oder g)": "0,00 ml",
        "Kapazit\u00e4t (Seiten)": "0",
        "Kontrastverh\u00e4ltnis (typisch) Bereich": "800:1 bis 1.200:1",
        "LCD-Technologie": "IPS Panel",
        "L\u00e4nge": "-1,00 mm",
        "Produktart": "Monitore",
        "Reaktionszeit": "4,00 ms",
        "Seitenverh\u00e4ltnis": "16:9",
        "Shop Herstellernummer": "27B2DA",
        "Standard-EAN": "4038986188302",
        "Verpackung - Breite in cm": "61,40 cm",
        "Verpackung - H\u00f6he in cm": "49,20 cm",
        "Verpackung - L\u00e4nge in cm": "13,10 cm",
        "max. Aufl\u00f6sung": "1.920 x 1.080 Pixel (16:9)"
    },
    "raw_specifications_text": "Energieeffizienzklasse: E\nDisplaygr\u00f6\u00dfe: 68,58 cm (27 Zoll)\nGeh\u00e4usefarbe des Ger\u00e4tes: Schwarz\nAnschl\u00fcsse: HDMI, VGA/D-Sub, Audioausgang (Line-Out), Audioeingang (Line-In), DVI-D\nKontrastverh\u00e4ltnis (typisch) Bereich: 800:1 bis 1.200:1\nDisplay Features: FlickerFree\nHelligkeit Bereich: 150 - 300 cd/m\u00b2\nHersteller: AOC\nGewicht: 6,32 kg\nProduktart: Monitore\nDisplay Sync: Adaptive Sync\nAufl\u00f6sung Kurzname: Full HD\nInhalt (ml oder g): 0,00 ml\nKapazit\u00e4t (Seiten): 0\nBreite: -1,00 mm\nH\u00f6he: -1,00 mm\nL\u00e4nge: -1,00 mm\nEEK - Spektrum: AG\nVerpackung - H\u00f6he in cm: 49,20 cm\nGewicht inkl. Verpackung in Kg: 5,50 kg\nVerpackung - Breite in cm: 61,40 cm\nVerpackung - L\u00e4nge in cm: 13,10 cm\nArtikelnummer: 15165843\nStandard-EAN: 4038986188302\nShop Herstellernummer: 27B2DA\nBezeichnung des Herstellers: AOC 27B2DA\nmax. Aufl\u00f6sung: 1.920 x 1.080 Pixel (16:9)\nSeitenverh\u00e4ltnis: 16:9\nLCD-Technologie: IPS Panel\nReaktionszeit: 4,00 ms\nBildwiederholungsrate: 75,00 Hz",
    "reference_file": "offer_reference_1759.json",
    "shop_name": "office-partner (AT)"
}