{
    "html_file": "offer_1451_0.html",
    "name": "LG UltraGear 27GP850-B, 27\"",
    "offer_link": "https://direkt.jacob.de/produkte/lg-27gp850-b-computerbildschirm-27gp850-b-artnr-7174823.html?utm_source=geizhals&utm_medium=cpc&utm_campaign=Preisvergleich&ref=103",
    "price": 350.8,
    "raw_specifications": {
        "AMD FreeSync": "Ja",
        "AMD FreeSync-Typ": "FreeSync Premium",
        "Anzahl DisplayPort Anschl\u00fcsse": "1",
        "Anzahl HDMI-Anschl\u00fcsse": "2",
        "Anzahl der Farben des Displays": "1,07 Milliarden Farben",
        "Anzahl der nachgeschalteten Steckpl\u00e4tze vom Typ USB-A": "2",
        "Anzahl der vorgeschalteten Steckpl\u00e4tze": "1",
        "Bildschirmaufl\u00f6sung": "2560 x 1440 Pixel",
        "Bildschirmdiagonale": "68,6 cm (27\" )",
        "Bildschirmform": "Flach",
        "Bildschirmtechnologie": "LED",
        "Blendfreier Bildschirm": "Ja",
        "Blickwinkel, horizontal": "178\u00b0",
        "Blickwinkel, vertikal": "178\u00b0",
        "Breite (ohne Standfu\u00df)": "61,5 cm",
        "DisplayPorts-Version": "1.4",
        "Eingebaute Lautsprecher": "Nein",
        "Energie Effizienzklasse": "G",
        "Farbskala": "98%",
        "Flimmerfreie Technologie": "Ja",
        "Fu\u00dffarbe": "Schwarz/Rot",
        "Ger\u00e4tebreite (inkl. Fu\u00df)": "614,7 mm",
        "Ger\u00e4teh\u00f6he (inkl. Fu\u00df)": "576,6 mm",
        "Ger\u00e4tetiefe (inkl. Fu\u00df)": "292,1 mm",
        "Gewicht (mit St\u00e4nder)": "6,3 kg",
        "Gewicht (ohne St\u00e4nder)": "4,22 kg",
        "HD-Typ": "Quad HD",
        "HDMI": "Ja",
        "Helligkeit (typisch)": "320 cd/m\u00b2",
        "High Dynamic Range Video Unterst\u00fctzung": "Ja",
        "H\u00f6he (ohne Standfu\u00df)": "36,6 cm",
        "H\u00f6henverstellung": "Ja",
        "Integrierter USB-Hub": "Ja",
        "Kontrastverh\u00e4ltnis": "1000:1",
        "Kopfh\u00f6rerausgang": "Ja",
        "Marktpositionierung": "Gaming",
        "Maximale Bildwiederholrate": "165 Hz",
        "Mitgelieferte Kabel": "DisplayPort,HDMI,USB",
        "NVIDIA G-SYNC": "Ja",
        "NVIDIA G-SYNC-Typ": "G-SYNC Compatible",
        "Natives Seitenverh\u00e4ltnis": "16:9",
        "Paketgewicht": "9,12 kg",
        "Panel-Montage-Schnittstelle": "100 x 100 mm",
        "Panel-Typ": "IPS",
        "Pivot": "Ja",
        "Pixel Abstand": "0,2331 x 0,2331 mm",
        "Produktfarbe": "Schwarz, Rot",
        "Reaktionszeit": "1 ms",
        "Stromverbrauch (PowerSave)": "0,5 W",
        "Stromverbrauch (Standby)": "0,5 W",
        "Stromverbrauch (aus)": "0,3 W",
        "Stromverbrauch (in Betrieb)": "48 W",
        "Stromverbrauch (max.)": "65 W",
        "Technologie mit hohem Dynamikbereich (HDR)": "DisplayHDR 400,HDR Effect,High Dynamic Range 10 (HDR10)",
        "Tiefe (ohne Standfu\u00df)": "5,18 cm",
        "USB-Upstream-Porttyp": "USB Typ-B",
        "Ursprungsland": "China",
        "VESA-Halterung": "Ja",
        "Verpackungsbreite": "726,4 mm",
        "Verpackungsh\u00f6he": "205,7 mm",
        "Verpackungstiefe": "487,7 mm",
        "kippbar": "Ja"
    },
    "raw_specifications_text": "Bildschirmdiagonale: 68,6 cm (27\" )\nBildschirmaufl\u00f6sung: 2560 x 1440 Pixel\nEnergie Effizienzklasse: G\nNatives Seitenverh\u00e4ltnis: 16:9\nPanel-Typ: IPS\nHD-Typ: Quad HD\nBildschirmtechnologie: LED\nBildschirmform: Flach\nKontrastverh\u00e4ltnis: 1000:1\nMaximale Bildwiederholrate: 165 Hz\nAnzahl der Farben des Displays: 1,07 Milliarden Farben\nHelligkeit (typisch): 320 cd/m\u00b2\nReaktionszeit: 1 ms\nBlendfreier Bildschirm: Ja\nBlickwinkel, horizontal: 178\u00b0\nBlickwinkel, vertikal: 178\u00b0\nPixel Abstand: 0,2331 x 0,2331 mm\nHigh Dynamic Range Video Unterst\u00fctzung: Ja\nTechnologie mit hohem Dynamikbereich (HDR): DisplayHDR 400,HDR Effect,High Dynamic Range 10 (HDR10)\nFarbskala: 98%\nNVIDIA G-SYNC: Ja\nAMD FreeSync: Ja\nNVIDIA G-SYNC-Typ: G-SYNC Compatible\nAMD FreeSync-Typ: FreeSync Premium\nFlimmerfreie Technologie: Ja\nEingebaute Lautsprecher: Nein\nMarktpositionierung: Gaming\nProduktfarbe: Schwarz, Rot\nFu\u00dffarbe: Schwarz/Rot\nUrsprungsland: China\nIntegrierter USB-Hub: Ja\nHDMI: Ja\nKopfh\u00f6rerausgang: Ja\nUSB-Upstream-Porttyp: USB Typ-B\nAnzahl der vorgeschalteten Steckpl\u00e4tze: 1\nAnzahl der nachgeschalteten Steckpl\u00e4tze vom Typ USB-A: 2\nAnzahl HDMI-Anschl\u00fcsse: 2\nAnzahl DisplayPort Anschl\u00fcsse: 1\nDisplayPorts-Version: 1.4\nVESA-Halterung: Ja\nH\u00f6henverstellung: Ja\nPanel-Montage-Schnittstelle: 100 x 100 mm\nPivot: Ja\nkippbar: Ja\nStromverbrauch (in Betrieb): 48 W\nStromverbrauch (Standby): 0,5 W\nStromverbrauch (max.): 65 W\nStromverbrauch (aus): 0,3 W\nStromverbrauch (PowerSave): 0,5 W\nGer\u00e4tebreite (inkl. Fu\u00df): 614,7 mm\nGer\u00e4tetiefe (inkl. Fu\u00df): 292,1 mm\nGer\u00e4teh\u00f6he (inkl. Fu\u00df): 576,6 mm\nGewicht (mit St\u00e4nder): 6,3 kg\nBreite (ohne Standfu\u00df): 61,5 cm\nTiefe (ohne Standfu\u00df): 5,18 cm\nH\u00f6he (ohne Standfu\u00df): 36,6 cm\nGewicht (ohne St\u00e4nder): 4,22 kg\nMitgelieferte Kabel: DisplayPort,HDMI,USB\nVerpackungsbreite: 726,4 mm\nVerpackungstiefe: 487,7 mm\nVerpackungsh\u00f6he: 205,7 mm\nPaketgewicht: 9,12 kg",
    "reference_file": "offer_reference_1451.json",
    "shop_name": "Jacob Elektronik direkt (AT)"
}