{
    "html_file": "offer_2177_17.html",
    "name": "NEC MultiSync EA231WU-WH wei\u00df, 22.5\"",
    "offer_link": "https://www.future-x.at/nec-display-multisync-ea231wu-wh-led-monitor-58-4-cm-23-225-sichtbar-1920-x-1200-wuxga-ips-250-cd-m%B2-1000%3A1-5-ms-hdmi-dvi-d-vga-displayport-lautsprecher-p-6098269/?pv=2",
    "price": 292.99,
    "raw_specifications": {
        "Abmessungen (Breite x Tiefe x H\u00f6he)": "49,89 cm x 4,56 cm x 31,97 cm - mit Fu\u00df",
        "Ausgangsleistung/Kanal": "1 Watt",
        "Ausschlussklausel f\u00fcr Bildfarbe": "Das dargestellte Bild des Produkts kann eine andere Farbe aufweisen",
        "Besonderheiten": "Umgebungslichtsensor, XtraView, AccuColor-Farbsteuerungssysteme, Rapid Response, Ambix, Sync-on-Green, Traggriff, HDCP, Eco-Mode, Auto Brightness Control, 72 % NTSC-Farbskala, Dynamic Visual Mode, ControlSync, On-screen Digital Controls, OSD sperren, integrierte Kabelf\u00fchrung, Carbon Footprint Meter, Human Sensor, flimmerfreie Technologie, DICOM-Simulation, zur\u00fccksetzbares Kostenmessger\u00e4t, extrem d\u00fcnnes Blendendesign, Low Blue Light-Technologie",
        "Bildschirmtyp": "IPS",
        "Details zu Abmessungen & Gewicht": "Mit Fu\u00df - Breite: 49,89 cm - Tiefe: 4,56 cm - H\u00f6he: 3,4 cm - Gewicht: 5,9 kg \u00a6 Ohne Fu\u00df - Breite: 49,89 cm - Tiefe: 45,6 cm - H\u00f6he: 31,97 cm - Gewicht: 3,4 kg",
        "Diagonalabmessung": "58,4 cm (23\")",
        "Display-Typ": "LED-hintergrundbeleuchteter LCD-Monitor / TFT-Aktivmatrix",
        "ENERGY STAR zertifiziert": "Ja",
        "ENERGY STAR-Version": "7.0",
        "Enthaltene Kabel": "USB-Kabel \u00a6 DisplayPort-Kabel \u00a6 ControlSync-Kabel",
        "Farbe": "Wei\u00df",
        "Farbunterst\u00fctzung": "16,7 Millionen Farben",
        "Gewicht": "5,9 kg",
        "Helligkeit": "250 cd/m\u00b2",
        "Hintergrundbeleuchtungs-Technologie": "WLED",
        "Horizontale Bildwiederholrate": "31.5 - 75 kHz",
        "Horizontaler Betrachtungswinkel": "178",
        "Integrierte Peripherieger\u00e4te": "USB 3.1 Gen.1 Hub",
        "Kennzeichnung": "Plug and Play, DDC-2B, VESA DPMS, DDC/CI, RoHS, TCO Displays 7.0, ISO 9241-307 Class 1, HDCP 1.4, VESA DDC 2 B",
        "Kontrast": "1000:1 / 5000:1 (dynamisch)",
        "Leistungsmerkmale": "Slot f\u00fcr Sicherheitsschloss (Kabelschloss getrennt erh\u00e4ltlich)",
        "Max. Betriebstemperatur": "35 \u00b0C",
        "Min Betriebstemperatur": "5 \u00b0C",
        "Mitgelieferte Software": "NaViSet, SpectraViewII software",
        "Native Aufl\u00f6sung": "WUXGA 1920 x 1200",
        "Pixelpitch": "0.25 mm",
        "Ppi": "100",
        "Reaktionszeit": "5 ms (Gray-to-Gray)",
        "Schlosstyp zur Diebstahlsicherung": "Kensington SlotSoftware / Systemanforderungen",
        "Schnittstellen": "HDMI \u00a6 DisplayPort \u00a6 VGA \u00a6 DVI-D \u00a6 Audio Line-Out (Mini-Buchse) \u00a6 USB 3.1 Gen 1 Upstream (Typ B) \u00a6 3 x USB 3.1 Downstream (Typ A)",
        "Seitenverh\u00e4ltnis": "16:10",
        "Service & Support": "Begrenzte Garantie - Arbeitszeit und Ersatzteile - 3 Jahre",
        "Sichtbare Bildfl\u00e4che": "57,2 cm (22.5\")",
        "Transportbreite": "65,5 cm",
        "Transportgewicht": "8,3 kg",
        "Transporth\u00f6he": "42 cm",
        "Transporttiefe": "20 cm",
        "Typ": "Lautsprecher - Stereo",
        "VESA-Halterung": "100 x 100 mm",
        "Vertikale Bildwiederholrate": "50 - 60 Hz",
        "Vertikaler Betrachtungswinkel": "178",
        "Zul\u00e4ssige Luftfeuchtigkeit im Betrieb": "20 - 80%"
    },
    "raw_specifications_text": "Display-Typ: LED-hintergrundbeleuchteter LCD-Monitor / TFT-Aktivmatrix\nDiagonalabmessung: 58,4 cm (23\")\nSichtbare Bildfl\u00e4che: 57,2 cm (22.5\")\nIntegrierte Peripherieger\u00e4te: USB 3.1 Gen.1 Hub\nBildschirmtyp: IPS\nSeitenverh\u00e4ltnis: 16:10\nNative Aufl\u00f6sung: WUXGA 1920 x 1200\nPixelpitch: 0.25 mm\nPpi: 100\nHelligkeit: 250 cd/m\u00b2\nKontrast: 1000:1 / 5000:1 (dynamisch)\nFarbunterst\u00fctzung: 16,7 Millionen Farben\nReaktionszeit: 5 ms (Gray-to-Gray)\nVertikale Bildwiederholrate: 50 - 60 Hz\nHorizontale Bildwiederholrate: 31.5 - 75 kHz\nHorizontaler Betrachtungswinkel: 178\nVertikaler Betrachtungswinkel: 178\nHintergrundbeleuchtungs-Technologie: WLED\nBesonderheiten: Umgebungslichtsensor, XtraView, AccuColor-Farbsteuerungssysteme, Rapid Response, Ambix, Sync-on-Green, Traggriff, HDCP, Eco-Mode, Auto Brightness Control, 72 % NTSC-Farbskala, Dynamic Visual Mode, ControlSync, On-screen Digital Controls, OSD sperren, integrierte Kabelf\u00fchrung, Carbon Footprint Meter, Human Sensor, flimmerfreie Technologie, DICOM-Simulation, zur\u00fccksetzbares Kostenmessger\u00e4t, extrem d\u00fcnnes Blendendesign, Low Blue Light-Technologie\nFarbe: Wei\u00df\nAusschlussklausel f\u00fcr Bildfarbe: Das dargestellte Bild des Produkts kann eine andere Farbe aufweisen\nAbmessungen (Breite x Tiefe x H\u00f6he): 49,89 cm x 4,56 cm x 31,97 cm - mit Fu\u00df\nGewicht: 5,9 kg\nTyp: Lautsprecher - Stereo\nAusgangsleistung/Kanal: 1 Watt\nSchnittstellen: HDMI \u00a6 DisplayPort \u00a6 VGA \u00a6 DVI-D \u00a6 Audio Line-Out (Mini-Buchse) \u00a6 USB 3.1 Gen 1 Upstream (Typ B) \u00a6 3 x USB 3.1 Downstream (Typ A)\nVESA-Halterung: 100 x 100 mm\nLeistungsmerkmale: Slot f\u00fcr Sicherheitsschloss (Kabelschloss getrennt erh\u00e4ltlich)\nEnthaltene Kabel: USB-Kabel \u00a6 DisplayPort-Kabel \u00a6 ControlSync-Kabel\nKennzeichnung: Plug and Play, DDC-2B, VESA DPMS, DDC/CI, RoHS, TCO Displays 7.0, ISO 9241-307 Class 1, HDCP 1.4, VESA DDC 2 B\nSchlosstyp zur Diebstahlsicherung: Kensington SlotSoftware / Systemanforderungen\nMitgelieferte Software: NaViSet, SpectraViewII software\nDetails zu Abmessungen & Gewicht: Mit Fu\u00df - Breite: 49,89 cm - Tiefe: 4,56 cm - H\u00f6he: 3,4 cm - Gewicht: 5,9 kg \u00a6 Ohne Fu\u00df - Breite: 49,89 cm - Tiefe: 45,6 cm - H\u00f6he: 31,97 cm - Gewicht: 3,4 kg\nTransportbreite: 65,5 cm\nTransporttiefe: 20 cm\nTransporth\u00f6he: 42 cm\nTransportgewicht: 8,3 kg\nENERGY STAR zertifiziert: Ja\nENERGY STAR-Version: 7.0\nService & Support: Begrenzte Garantie - Arbeitszeit und Ersatzteile - 3 Jahre\nMin Betriebstemperatur: 5 \u00b0C\nMax. Betriebstemperatur: 35 \u00b0C\nZul\u00e4ssige Luftfeuchtigkeit im Betrieb: 20 - 80%",
    "reference_file": "offer_reference_2177.json",
    "shop_name": "Future-X.at"
}