{
    "html_file": "offer_1562_23.html",
    "name": "AOC Q24V4EA, 23.8\"",
    "offer_link": "https://www.alternate.at/AOC/Q24V4EA-LED-Monitor/html/product/1761643?partner=AtGeizhalsat&campaign=Monitor/AOC/1761643",
    "price": 152.9,
    "raw_specifications": {
        "": "Adaptive-Sync",
        "Abmessungen": "Breite: 53,91 cm x H\u00f6he: 41,66 cm x Tiefe/L\u00e4nge: 19,69 cm",
        "Anschl\u00fcsse": "1x HDMI-Eingang, (HDMI-Version: 1.4), 1x DisplayPort-Eingang, (DisplayPort-Version: 1.2), 1x Kopfh\u00f6rer-Ausgang",
        "Bild": "Glaretyp",
        "Bildschirmaufl\u00f6sung": "2.560 x 1.440 Pixel",
        "Bildschirmdiagonale": "60 cm (24 Zoll)",
        "EAN": "4038986149877",
        "Energieeffizienzklasse (SDR)": "F (A - G)",
        "Energieverbauch pro 1000 Stunden (SDR)": "21 kWh",
        "Farbe": "schwarz",
        "Features": "Flicker-Free LED, LowBlue Light",
        "Hersteller-Nr.": "Q24V4EA",
        "Lautsprecher": "2 Lautsprecher",
        "Leistungsaufnahme im Bereitschafts- und Aus-Zustand": "0,5 Watt",
        "Leistungsaufnahme im Ein-Zustand bei Standard-Dynamikumfang (SDR)": "21 Watt",
        "Serie": "Value Line",
        "Standards": "Video",
        "Stromversorgung": "Eco-Off",
        "Typ": "LED-Monitor",
        "Wandhalterung": "VESA kompatibel (100 x 100 mm)",
        "Zubeh\u00f6r": "Vorhanden"
    },
    "raw_specifications_text": "Energieeffizienzklasse (SDR): F (A - G)\nEnergieverbauch pro 1000 Stunden (SDR): 21 kWh\nLeistungsaufnahme im Ein-Zustand bei Standard-Dynamikumfang (SDR): 21 Watt\nLeistungsaufnahme im Bereitschafts- und Aus-Zustand: 0,5 Watt\nBildschirmdiagonale: 60 cm (24 Zoll)\nBildschirmaufl\u00f6sung: 2.560 x 1.440 Pixel\nTyp: LED-Monitor\nFarbe: schwarz\nEAN: 4038986149877\nHersteller-Nr.: Q24V4EA\nSerie: Value Line\nBild: Glaretyp\n: Adaptive-Sync\nAnschl\u00fcsse: 1x HDMI-Eingang, (HDMI-Version: 1.4), 1x DisplayPort-Eingang, (DisplayPort-Version: 1.2), 1x Kopfh\u00f6rer-Ausgang\nStromversorgung: Eco-Off\nLautsprecher: 2 Lautsprecher\nStandards: Video\nWandhalterung: VESA kompatibel (100 x 100 mm)\nFeatures: Flicker-Free LED, LowBlue Light\nZubeh\u00f6r: Vorhanden\nAbmessungen: Breite: 53,91 cm x H\u00f6he: 41,66 cm x Tiefe/L\u00e4nge: 19,69 cm",
    "reference_file": "offer_reference_1562.json",
    "shop_name": "Alternate.at"
}