{
    "html_file": "offer_1470_10.html",
    "name": "Dell UltraSharp UP2716DA, 27\"",
    "offer_link": "https://www.electronicshop24.at/product_info.php?products_id=140000001002270745&ano=R1002270745&mno=UP2716DA&ean=5397184409626&utm_medium=cpc&utm_campaign=preisvergleich&utm_content=item&utm_source=geizhals&ref=geizhals",
    "price": 945.0,
    "raw_specifications": {
        "Abmessungen (Breite x Tiefe x H\u00f6he)": "61.14 cm x 20.03 cm x 41.03 cm - mit Fu\u00df",
        "Besonderheiten": "Bild in Bild, Bild f\u00fcr Bild, PremierColor-Technologie, CustomColor Mode, Multi-Stream-Transport (MST), The Paper Mode, BFR/PVC-frei, Energy Gauge, ohne Quecksilber, Farbkalibrierung, arsenfreies Glas, Werks-Kalibrierungsbericht, Farbtemperatur Auswahl, Movie Mode, Multimedia Mode, extrem d\u00fcnnes Blendendesign, an 3 Seiten ohne Blende",
        "Bildschirmbeschichtung": "Blendfrei, 3H Hard Coating",
        "Bildschirmtyp": "IPS",
        "Details zu Abmessungen & Gewicht": "Mit Fu\u00df - Breite: 61.14 cm - Tiefe: 20.03 cm - H\u00f6he: 41.03 cm - Gewicht: 7.42 kg \u00a6 Ohne Fu\u00df - Breite: 61.14 cm - Tiefe: 5.14 cm - H\u00f6he: 36.25 cm - Gewicht: 4.56 kg",
        "Diagonalabmessung": "68.47 cm (27\")",
        "Display-Typ": "LED-hintergrundbeleuchteter LCD-Monitor / TFT-Aktivmatrix",
        "ENERGY STAR zertifiziert": "Ja",
        "Eingangsspannung": "Wechselstrom 120/230 V (50/60 Hz)",
        "Einstellungen der Anzeigeposition": "H\u00f6he, Pivot (Rotation), Drehung, Neigung",
        "Energie Effizienzklasse": "Klasse G",
        "Energieverbrauch pro Jahr": "89.3 kWh",
        "Enthaltene Kabel": "1 x USB 3.0 Upstream-Kabel - 1.8 m \u00a6 1 x Mini-DisplayPort-Kabel - miniDisplayPort auf DisplayPort - 1.8 m",
        "Farbe": "Schwarz",
        "Farbraum": "100% Adobe RGB, 100% Rec 709, 100% sRGB, 98% DCI-P3",
        "Farbtemperatur": "5000K, 10000K",
        "Farbunterst\u00fctzung": "1,07 Mrd. Farben",
        "Gewicht": "7.42 kg",
        "Helligkeit": "300 cd/m\u00b2",
        "Hintergrundbeleuchtungs-Technologie": "LED-Hintergrundbeleuchtung",
        "Horizontale Bildwiederholrate": "30 - 88 kHz",
        "Horizontaler Betrachtungswinkel": "178",
        "H\u00f6heneinstellung": "130 mm",
        "Integrierte Peripherieger\u00e4te": "USB 3.0-Hub",
        "Kennzeichnung": "Plug and Play, VESA EDID, FCC, DDC/CI, RoHS, DDC, HDCP 1.4",
        "Kontrast": "1000:1 / 2000000:1 (dynamisch)",
        "Leistungsaufnahme im Ein-Zustand": "30.5 W",
        "Leistungsmerkmale": "Slot f\u00fcr Sicherheitsschloss (Kabelschloss getrennt erh\u00e4ltlich), Unterst\u00fctzung f\u00fcr VESA-Schnittstelle, Schlitz f\u00fcr diebstahlsicheres St\u00e4nderschloss",
        "Max. Betriebstemperatur": "35 \u00b0C",
        "Min Betriebstemperatur": "0 \u00b0C",
        "Native Aufl\u00f6sung": "QHD 2560 x 1440 bei 60 Hz",
        "Neigungswinkel": "-5/+21",
        "OSD-Sprachen": "Chinesisch (vereinfacht), Brasilianisches Portugiesisch, Englisch, Deutsch, Franz\u00f6sisch, Russisch, Spanisch, Japanisch",
        "Pixelpitch": "0.2331 mm",
        "Reaktionszeit": "14 ms (typisch), 6 ms (schnell)",
        "Rotationswinkel": "90",
        "Schnittstellen": "2 x HDMI (HDCP 1.4) \u00a6 DisplayPort (HDCP 1.4) \u00a6 Mini DisplayPort (HDCP 1.4) \u00a6 2 x USB 3.0 Upstream (Typ B) \u00a6 USB 3.0 Downstream mit Batterieladeger\u00e4t 1.2 (Typ A) \u00a6 USB 3.0 Downstream (Typ A) \u00a6 DisplayPort-Ausgang (MST) \u00a6 Audio Line-Out (Mini-Klinkenstecker)",
        "Schwenkwinkel": "90",
        "Seitenverh\u00e4ltnis": "16:9",
        "Services im Bundle": "3 Jahre erweiterte Basisaustauschgew\u00e4hrleistung",
        "Stromverbrauch (Aus-Modus)": "0.3 Watt",
        "Stromverbrauch (typisch)": "30.5 Watt",
        "Stromverbrauch SDR (eingeschaltet)": "30.5 kWh/1.000 h",
        "Stromverbrauch im Standby-Modus": "0.3 Watt",
        "Transportgewicht": "9.52 kg",
        "VESA-Halterung": "100 x 100 mm",
        "Vertikale Bildwiederholrate": "50 - 75 Hz",
        "Vertikaler Betrachtungswinkel": "178",
        "Zul\u00e4ssige Luftfeuchtigkeit im Betrieb": "10 - 80% (nicht kondensierend)"
    },
    "raw_specifications_text": "Display-Typ: LED-hintergrundbeleuchteter LCD-Monitor / TFT-Aktivmatrix\nEnergie Effizienzklasse: Klasse G\nEnergieverbrauch pro Jahr: 89.3 kWh\nDiagonalabmessung: 68.47 cm (27\")\nIntegrierte Peripherieger\u00e4te: USB 3.0-Hub\nBildschirmtyp: IPS\nSeitenverh\u00e4ltnis: 16:9\nNative Aufl\u00f6sung: QHD 2560 x 1440 bei 60 Hz\nPixelpitch: 0.2331 mm\nHelligkeit: 300 cd/m\u00b2\nKontrast: 1000:1 / 2000000:1 (dynamisch)\nFarbunterst\u00fctzung: 1,07 Mrd. Farben\nFarbraum: 100% Adobe RGB, 100% Rec 709, 100% sRGB, 98% DCI-P3\nReaktionszeit: 14 ms (typisch), 6 ms (schnell)\nVertikale Bildwiederholrate: 50 - 75 Hz\nHorizontale Bildwiederholrate: 30 - 88 kHz\nHorizontaler Betrachtungswinkel: 178\nVertikaler Betrachtungswinkel: 178\nBildschirmbeschichtung: Blendfrei, 3H Hard Coating\nHintergrundbeleuchtungs-Technologie: LED-Hintergrundbeleuchtung\nFarbtemperatur: 5000K, 10000K\nOSD-Sprachen: Chinesisch (vereinfacht), Brasilianisches Portugiesisch, Englisch, Deutsch, Franz\u00f6sisch, Russisch, Spanisch, Japanisch\nBesonderheiten: Bild in Bild, Bild f\u00fcr Bild, PremierColor-Technologie, CustomColor Mode, Multi-Stream-Transport (MST), The Paper Mode, BFR/PVC-frei, Energy Gauge, ohne Quecksilber, Farbkalibrierung, arsenfreies Glas, Werks-Kalibrierungsbericht, Farbtemperatur Auswahl, Movie Mode, Multimedia Mode, extrem d\u00fcnnes Blendendesign, an 3 Seiten ohne Blende\nFarbe: Schwarz\nAbmessungen (Breite x Tiefe x H\u00f6he): 61.14 cm x 20.03 cm x 41.03 cm - mit Fu\u00df\nGewicht: 7.42 kg\nSchnittstellen: 2 x HDMI (HDCP 1.4) \u00a6 DisplayPort (HDCP 1.4) \u00a6 Mini DisplayPort (HDCP 1.4) \u00a6 2 x USB 3.0 Upstream (Typ B) \u00a6 USB 3.0 Downstream mit Batterieladeger\u00e4t 1.2 (Typ A) \u00a6 USB 3.0 Downstream (Typ A) \u00a6 DisplayPort-Ausgang (MST) \u00a6 Audio Line-Out (Mini-Klinkenstecker)\nEinstellungen der Anzeigeposition: H\u00f6he, Pivot (Rotation), Drehung, Neigung\nNeigungswinkel: -5/+21\nSchwenkwinkel: 90\nRotationswinkel: 90\nH\u00f6heneinstellung: 130 mm\nVESA-Halterung: 100 x 100 mm\nLeistungsmerkmale: Slot f\u00fcr Sicherheitsschloss (Kabelschloss getrennt erh\u00e4ltlich), Unterst\u00fctzung f\u00fcr VESA-Schnittstelle, Schlitz f\u00fcr diebstahlsicheres St\u00e4nderschloss\nEnthaltene Kabel: 1 x USB 3.0 Upstream-Kabel - 1.8 m \u00a6 1 x Mini-DisplayPort-Kabel - miniDisplayPort auf DisplayPort - 1.8 m\nKennzeichnung: Plug and Play, VESA EDID, FCC, DDC/CI, RoHS, DDC, HDCP 1.4\nEingangsspannung: Wechselstrom 120/230 V (50/60 Hz)\nLeistungsaufnahme im Ein-Zustand: 30.5 W\nStromverbrauch SDR (eingeschaltet): 30.5 kWh/1.000 h\nStromverbrauch (typisch): 30.5 Watt\nStromverbrauch im Standby-Modus: 0.3 Watt\nStromverbrauch (Aus-Modus): 0.3 Watt\nDetails zu Abmessungen & Gewicht: Mit Fu\u00df - Breite: 61.14 cm - Tiefe: 20.03 cm - H\u00f6he: 41.03 cm - Gewicht: 7.42 kg \u00a6 Ohne Fu\u00df - Breite: 61.14 cm - Tiefe: 5.14 cm - H\u00f6he: 36.25 cm - Gewicht: 4.56 kg\nTransportgewicht: 9.52 kg\nENERGY STAR zertifiziert: Ja\nServices im Bundle: 3 Jahre erweiterte Basisaustauschgew\u00e4hrleistung\nMin Betriebstemperatur: 0 \u00b0C\nMax. Betriebstemperatur: 35 \u00b0C\nZul\u00e4ssige Luftfeuchtigkeit im Betrieb: 10 - 80% (nicht kondensierend)",
    "reference_file": "offer_reference_1470.json",
    "shop_name": "ElectronicShop24"
}