{
    "html_file": "offer_1734_1.html",
    "name": "Lenovo ThinkCentre Tiny-in-One 24 Gen 4, 23.8\"",
    "offer_link": "https://www.proshop.at/Bildschirm/Lenovo-24-Bildschirm-ThinkCentre-TIO24Gen4-Black-4-ms/2918065?utm_source=geizhals&utm_medium=cpc&utm_campaign=pricesite",
    "price": 323.93,
    "raw_specifications": {
        "Abmessungen (Breite x Tiefe x H\u00f6he)": "53.98 cm x 23.04 cm x 44.69 cm - mit Standfu\u00df (niedrigste Position)",
        "Abmessungen (Breite x Tiefe x H\u00f6he) - mit Standfu\u00df (niedrigste Position)": "53.98 cm x 23.04 cm x 44.69 cm",
        "Ausgangsleistung/Kanal": "2 Watt",
        "Bildschirmbeschichtung": "Blendfrei",
        "Details zu Abmessungen & Gewicht": "Mit Standfu\u00df (niedrigste Position) - Breite: 53.98 cm - Tiefe: 23.04 cm - H\u00f6he: 44.69 cm - Gewicht: 6.66 kg  Mit Standfu\u00df (h\u00f6chste Position) - Breite: 53.98 cm - Tiefe: 23.04 cm - H\u00f6he: 59.69 cm - Gewicht: 6.66 kg  Ohne Fu\u00df - Breite: 53.98 cm - Tiefe: 6.53 cm - H\u00f6he: 36.76 cm - Gewicht: 3.61 kg",
        "Diagonalabmessung": "61 cm (24\")",
        "Display-Typ": "LED-hintergrundbeleuchteter LCD-Monitor / TFT-Aktivmatrix",
        "EAN": "0194778282277",
        "ENERGY STAR zertifiziert": "Ja",
        "ENERGY STAR-Version": "8.0",
        "EPEAT-kompatibel": "EPEAT Silver",
        "Eingangsanschl\u00fcsse": "DisplayPort",
        "Eingangsspannung": "Wechselstrom 120/230 V (50/60 Hz)",
        "Einstellungen der Anzeigeposition": "H\u00f6he, Pivot (Rotation), Drehung, Neigung",
        "Energie Effizienzklasse": "Klasse D",
        "Farbe": "Schwarz",
        "Farbraum": "72% NTSC (CIE 1931)",
        "Ger\u00e4tetyp": "LED-hintergrundbeleuchteter LCD-Monitor - 61 cm (24\")",
        "Gewicht": "6.66 kg",
        "Helligkeit": "250 cd/m\u00b2",
        "Hersteller": "Lenovo",
        "Hintergrundbeleuchtungs-Technologie": "WLED",
        "Horizontaler Betrachtungswinkel": "+89 / -89",
        "H\u00f6heneinstellung": "150 mm",
        "Integrierte Peripherieger\u00e4te": "USB 3.1 Gen.1 Hub, RGBIR-Kamera",
        "Kennzeichnung": "UL, VESA FPMPMI, RoHS, WEEE, GREENGUARD, Energy-Related Products (ErP) Lot 5, TUV Rheinland Eye Comfort Certification",
        "Kontrast": "1000:1",
        "Leistungsmerkmale": "Slot f\u00fcr Sicherheitsschloss (Kabelschloss getrennt erh\u00e4ltlich), Netzteil mit 88% Effizienz, Tiny Notebook-Dockingstation",
        "Lokalisierung": "Englisch / Europa",
        "Modell": "11GEPAT1EU",
        "Montagekit": "Optional",
        "Native Aufl\u00f6sung": "Full HD (1080p) 1920 x 1080",
        "Neigungswinkel": "-5/+30",
        "Pixelpitch": "0.2745 mm",
        "Ppi": "92.6",
        "Produktbeschreibung": "Lenovo ThinkCentre Tiny-in-One 24 Gen 4 - LED-Monitor - Full HD (1080p) - 61 cm (24\")",
        "Reaktionszeit": "6 ms, 4 ms (Overdrive), 14 ms (Standard)",
        "Rotationswinkel": "-5/+90",
        "Schlosstyp zur Diebstahlsicherung": "Kensington Slot",
        "Schnittstellen": "DisplayPort/USB 3.1 Gen 1/Spannungsversorgung (unverlierbares 3-in-1-Kabel)  USB 3.1 Gen 1 Upstream  DisplayPort  USB 3.1 Gen 1 Downstream",
        "Schwenkwinkel": "90",
        "Seitenverh\u00e4ltnis": "16:9",
        "Sichtbare Bildfl\u00e4che": "60.47 cm (23.8\")",
        "Spannung": "Wechselstrom 120/230 V (50/60 Hz)",
        "Stromverbrauch (typisch)": "15 Watt",
        "Stromverbrauch SDR (eingeschaltet)": "14 kWh/1.000 h",
        "Stromverbrauch im Standby-Modus": "0.5 Watt",
        "TCO-zertifiziert": "TCO Certified Displays 8, TCO Certified Edge Displays",
        "Typ": "Lautsprecher - Stereo",
        "Umweltschutzstandards": "TCO Certified Displays 8, TCO Certified Edge Displays, ENERGY STAR-qualifiziert EPEAT Silver",
        "VESA-Halterung": "100 x 100 mm",
        "Vertikaler Betrachtungswinkel": "+89 / -89",
        "Waren-Nr.": "2918065",
        "Zum Hersteller": "lenovo.com"
    },
    "raw_specifications_text": "Hersteller: Lenovo\nWaren-Nr.: 2918065\nModell: 11GEPAT1EU\nEAN: 0194778282277\nZum Hersteller: lenovo.com\nProduktbeschreibung: Lenovo ThinkCentre Tiny-in-One 24 Gen 4 - LED-Monitor - Full HD (1080p) - 61 cm (24\")\nGer\u00e4tetyp: LED-hintergrundbeleuchteter LCD-Monitor - 61 cm (24\")\nEnergie Effizienzklasse: Klasse D\nLeistungsmerkmale: Slot f\u00fcr Sicherheitsschloss (Kabelschloss getrennt erh\u00e4ltlich), Netzteil mit 88% Effizienz, Tiny Notebook-Dockingstation\nSeitenverh\u00e4ltnis: 16:9\nNative Aufl\u00f6sung: Full HD (1080p) 1920 x 1080\nPixelpitch: 0.2745 mm\nHelligkeit: 250 cd/m\u00b2\nKontrast: 1000:1\nReaktionszeit: 6 ms, 4 ms (Overdrive), 14 ms (Standard)\nFarbraum: 72% NTSC (CIE 1931)\nEingangsanschl\u00fcsse: DisplayPort\nEinstellungen der Anzeigeposition: H\u00f6he, Pivot (Rotation), Drehung, Neigung\nBildschirmbeschichtung: Blendfrei\nSpannung: Wechselstrom 120/230 V (50/60 Hz)\nFarbe: Schwarz\nAbmessungen (Breite x Tiefe x H\u00f6he) - mit Standfu\u00df (niedrigste Position): 53.98 cm x 23.04 cm x 44.69 cm\nGewicht: 6.66 kg\nLokalisierung: Englisch / Europa\nUmweltschutzstandards: TCO Certified Displays 8, TCO Certified Edge Displays, ENERGY STAR-qualifiziert EPEAT Silver\nKennzeichnung: UL, VESA FPMPMI, RoHS, WEEE, GREENGUARD, Energy-Related Products (ErP) Lot 5, TUV Rheinland Eye Comfort Certification\nDisplay-Typ: LED-hintergrundbeleuchteter LCD-Monitor / TFT-Aktivmatrix\nDiagonalabmessung: 61 cm (24\")\nSichtbare Bildfl\u00e4che: 60.47 cm (23.8\")\nIntegrierte Peripherieger\u00e4te: USB 3.1 Gen.1 Hub, RGBIR-Kamera\nPpi: 92.6\nHorizontaler Betrachtungswinkel: +89 / -89\nVertikaler Betrachtungswinkel: +89 / -89\nHintergrundbeleuchtungs-Technologie: WLED\nAbmessungen (Breite x Tiefe x H\u00f6he): 53.98 cm x 23.04 cm x 44.69 cm - mit Standfu\u00df (niedrigste Position)\nTyp: Lautsprecher - Stereo\nAusgangsleistung/Kanal: 2 Watt\nSchnittstellen: DisplayPort/USB 3.1 Gen 1/Spannungsversorgung (unverlierbares 3-in-1-Kabel)  USB 3.1 Gen 1 Upstream  DisplayPort  USB 3.1 Gen 1 Downstream\nNeigungswinkel: -5/+30\nSchwenkwinkel: 90\nRotationswinkel: -5/+90\nH\u00f6heneinstellung: 150 mm\nVESA-Halterung: 100 x 100 mm\nMontagekit: Optional\nSchlosstyp zur Diebstahlsicherung: Kensington Slot\nEingangsspannung: Wechselstrom 120/230 V (50/60 Hz)\nStromverbrauch SDR (eingeschaltet): 14 kWh/1.000 h\nStromverbrauch (typisch): 15 Watt\nStromverbrauch im Standby-Modus: 0.5 Watt\nDetails zu Abmessungen & Gewicht: Mit Standfu\u00df (niedrigste Position) - Breite: 53.98 cm - Tiefe: 23.04 cm - H\u00f6he: 44.69 cm - Gewicht: 6.66 kg  Mit Standfu\u00df (h\u00f6chste Position) - Breite: 53.98 cm - Tiefe: 23.04 cm - H\u00f6he: 59.69 cm - Gewicht: 6.66 kg  Ohne Fu\u00df - Breite: 53.98 cm - Tiefe: 6.53 cm - H\u00f6he: 36.76 cm - Gewicht: 3.61 kg\nTCO-zertifiziert: TCO Certified Displays 8, TCO Certified Edge Displays\nEPEAT-kompatibel: EPEAT Silver\nENERGY STAR zertifiziert: Ja\nENERGY STAR-Version: 8.0",
    "reference_file": "offer_reference_1734.json",
    "shop_name": "Proshop.at"
}