{
    "html_file": "offer_418_4.html",
    "name": "Samsung Smart Monitor M7 M70B schwarz (2023), 43\"",
    "offer_link": "https://www.ba-computer.at/samsung-s43bm700up-m70b-series-led-monitor-smart-108-cm-43-ls43bm700upxen.html",
    "price": 383.16,
    "raw_specifications": {
        "Abmessungen (Breite x Tiefe x H\u00f6he)": "96.55 cm x 24.72 cm x 62.93 cm - mit Fu\u00df",
        "Besonderheiten": "Spielmodus, ConnectShare, Intel Wireless Display (WiDi), flimmerfreie Technologie, Eye Saver Mode, Werkstuning, DLNA, Auto Source Switch+, Adaptive Picture, Tap View, Remote Access, Sound Mirroring, SmartThings App Support, Adaptive Sound, Game Bar 2.0, Far-Field Voice Interaction, IoT Hub, Mobile to Screen Mirroring, Super Ultrawide GameView",
        "Betriebssystem": "Tizen",
        "Bildschirmtyp": "VA",
        "Details zu Abmessungen & Gewicht": "Mit Fu\u00df - Breite: 96.55 cm - Tiefe: 24.72 cm - H\u00f6he: 62.93 cm - Gewicht: 10.6 kg \u00a6 Ohne Fu\u00df - Breite: 96.55 cm - Tiefe: 2.57 cm - H\u00f6he: 55.98 cm - Gewicht: 8.5 kg",
        "Diagonalabmessung": "108 cm (43\")",
        "Display-Typ": "LED-hintergrundbeleuchteter LCD-Monitor / TFT-Aktivmatrix - Smart Monitor",
        "Eingangsspannung": "Wechselstrom 100-240 V",
        "Einstellungen der Anzeigeposition": "Neigung",
        "Energie Effizienzklasse": "Klasse G",
        "Energieklasse (HDR)": "Klasse G",
        "Energieverbrauch pro Jahr": "77 kWh",
        "Enthaltene Kabel": "1 x HDMI-Kabel",
        "Farbe": "Schwarz",
        "Farbunterst\u00fctzung": "1 Milliarde Farben",
        "Gewicht": "10.6 kg",
        "HDR-Format": "HDR10",
        "Helligkeit": "300 cd/m\u00b2",
        "Hintergrundbeleuchtungs-Technologie": "LED-Hintergrundbeleuchtung",
        "Horizontaler Betrachtungswinkel": "178",
        "Integrierte Peripherieger\u00e4te": "USB 2.0 Hub, 802.11a/b/g/n/ac Netzwerkadapter, Bluetooth 5.2 Adapter",
        "Kennzeichnung": "CEC",
        "Kontrast": "5000:1",
        "Leistungsmerkmale": "Slot f\u00fcr Sicherheitsschloss (Kabelschloss getrennt erh\u00e4ltlich)",
        "Max. Betriebstemperatur": "40 \u00b0C",
        "Min Betriebstemperatur": "10 \u00b0C",
        "Mitgelieferte Software": "Microsoft 365, Alexa, Google Duo, Samsung Workspace, Bixby Voice Assistant, Apple AirPlay 2",
        "Native Aufl\u00f6sung": "4K 3840 x 2160 bei 60 Hz",
        "Neigungswinkel": "-2/+20",
        "Pixelpitch": "0.2479 mm",
        "Reaktionszeit": "4 ms (gray-to-gray)",
        "Schlosstyp zur Diebstahlsicherung": "Kensington Slot",
        "Schnittstellen": "2 x HDMI 2.0 \u00a6 USB-C (DisplayPort Alt Mode, Daten, Leistung bis zu 65 W) \u00a6 3 x USB 2.0",
        "Seitenverh\u00e4ltnis": "16:9",
        "Stromverbrauch (typisch)": "53 Watt",
        "Stromverbrauch HDR (eingeschaltet)": "125 kWh/1.000 h",
        "Stromverbrauch SDR (eingeschaltet)": "53 kWh/1.000 h",
        "Stromverbrauch im Standby-Modus": "0.5 Watt",
        "Transportbreite": "119.8 cm",
        "Transportgewicht": "13.7 kg",
        "Transporth\u00f6he": "67.7 cm",
        "Transporttiefe": "15.9 cm",
        "Typ": "Lautsprecher",
        "USB-Spannungsversorgung": "65 Watt",
        "VESA-Halterung": "200 x 200 mm",
        "Vertikaler Betrachtungswinkel": "178",
        "Zubeh\u00f6r im Lieferumfang": "Fernbedienung",
        "Zul\u00e4ssige Luftfeuchtigkeit im Betrieb": "10 - 80% (nicht kondensierend)"
    },
    "raw_specifications_text": "Display-Typ: LED-hintergrundbeleuchteter LCD-Monitor / TFT-Aktivmatrix - Smart Monitor\nEnergie Effizienzklasse: Klasse G\nEnergieklasse (HDR): Klasse G\nEnergieverbrauch pro Jahr: 77 kWh\nDiagonalabmessung: 108 cm (43\")\nBetriebssystem: Tizen\nIntegrierte Peripherieger\u00e4te: USB 2.0 Hub, 802.11a/b/g/n/ac Netzwerkadapter, Bluetooth 5.2 Adapter\nUSB-Spannungsversorgung: 65 Watt\nBildschirmtyp: VA\nSeitenverh\u00e4ltnis: 16:9\nNative Aufl\u00f6sung: 4K 3840 x 2160 bei 60 Hz\nPixelpitch: 0.2479 mm\nHelligkeit: 300 cd/m\u00b2\nKontrast: 5000:1\nHDR-Format: HDR10\nFarbunterst\u00fctzung: 1 Milliarde Farben\nReaktionszeit: 4 ms (gray-to-gray)\nHorizontaler Betrachtungswinkel: 178\nVertikaler Betrachtungswinkel: 178\nHintergrundbeleuchtungs-Technologie: LED-Hintergrundbeleuchtung\nBesonderheiten: Spielmodus, ConnectShare, Intel Wireless Display (WiDi), flimmerfreie Technologie, Eye Saver Mode, Werkstuning, DLNA, Auto Source Switch+, Adaptive Picture, Tap View, Remote Access, Sound Mirroring, SmartThings App Support, Adaptive Sound, Game Bar 2.0, Far-Field Voice Interaction, IoT Hub, Mobile to Screen Mirroring, Super Ultrawide GameView\nFarbe: Schwarz\nAbmessungen (Breite x Tiefe x H\u00f6he): 96.55 cm x 24.72 cm x 62.93 cm - mit Fu\u00df\nGewicht: 10.6 kg\nTyp: Lautsprecher\nSchnittstellen: 2 x HDMI 2.0 \u00a6 USB-C (DisplayPort Alt Mode, Daten, Leistung bis zu 65 W) \u00a6 3 x USB 2.0\nEinstellungen der Anzeigeposition: Neigung\nNeigungswinkel: -2/+20\nVESA-Halterung: 200 x 200 mm\nLeistungsmerkmale: Slot f\u00fcr Sicherheitsschloss (Kabelschloss getrennt erh\u00e4ltlich)\nZubeh\u00f6r im Lieferumfang: Fernbedienung\nEnthaltene Kabel: 1 x HDMI-Kabel\nKennzeichnung: CEC\nSchlosstyp zur Diebstahlsicherung: Kensington Slot\nEingangsspannung: Wechselstrom 100-240 V\nStromverbrauch SDR (eingeschaltet): 53 kWh/1.000 h\nStromverbrauch HDR (eingeschaltet): 125 kWh/1.000 h\nStromverbrauch (typisch): 53 Watt\nStromverbrauch im Standby-Modus: 0.5 Watt\nMitgelieferte Software: Microsoft 365, Alexa, Google Duo, Samsung Workspace, Bixby Voice Assistant, Apple AirPlay 2\nDetails zu Abmessungen & Gewicht: Mit Fu\u00df - Breite: 96.55 cm - Tiefe: 24.72 cm - H\u00f6he: 62.93 cm - Gewicht: 10.6 kg \u00a6 Ohne Fu\u00df - Breite: 96.55 cm - Tiefe: 2.57 cm - H\u00f6he: 55.98 cm - Gewicht: 8.5 kg\nTransportbreite: 119.8 cm\nTransporttiefe: 15.9 cm\nTransporth\u00f6he: 67.7 cm\nTransportgewicht: 13.7 kg\nMin Betriebstemperatur: 10 \u00b0C\nMax. Betriebstemperatur: 40 \u00b0C\nZul\u00e4ssige Luftfeuchtigkeit im Betrieb: 10 - 80% (nicht kondensierend)",
    "reference_file": "offer_reference_418.json",
    "shop_name": "BA-Computer"
}