{
    "html_file": "offer_2283_31.html",
    "name": "iiyama ProLite XUB2395WSU-B1, 22.5\"",
    "offer_link": "https://www.future-x.at/iiyama-prolite-led-monitor-57-15-cm-225-1920-x-1200-wuxga-ips-250-cd-m%B2-1000%3A1-4-ms-hdmi-vga-displayport-lautsprecher-schwarz-p-3048021/?pv=2",
    "price": 168.89,
    "raw_specifications": {
        "3D": "Nein",
        "AMD FreeSync": "Ja",
        "Anzahl DisplayPort Anschl\u00fcsse": "1",
        "Anzahl HDMI Anschl\u00fcsse": "1",
        "Anzahl OSD-Sprachen": "7Betriebsbedingungen",
        "Anzahl VGA (D-Sub) Anschl\u00fcsse": "1",
        "Anzahl der Farben des Displays": "1,073 Milliarden Farben",
        "Anzahl der Lautsprecher": "2",
        "Anzahl der nachgeschalteten Steckpl\u00e4tze vom Typ USB-A": "2",
        "Anzahl der vorgeschalteten Steckpl\u00e4tze": "1",
        "Bildschirmaufl\u00f6sung": "1920 x 1200 Pixel",
        "Bildschirmdiagonale": "57,1 cm (22.5 Zoll)",
        "Bildschirmdiagonale (cm)": "57,15 cm",
        "Bildschirmdisplay (OSD)-Sprachen": "Deutsch, Niederl\u00e4ndisch, Englisch, Franz\u00f6sisch, Japanisch, Polnisch, Russisch",
        "Bildschirmtechnologie": "LED",
        "Blickwinkel, horizontal": "178\u00b0",
        "Blickwinkel, vertikal": "178\u00b0",
        "Breite": "499 mm",
        "DDC/CI": "Ja",
        "DVI Anschluss": "Nein",
        "Display-Oberfl\u00e4che": "Matt",
        "Ein-/Ausschalter": "Ja",
        "Eingebaute Lautsprecher": "Ja",
        "Energy Star-zertifiziert": "Ja",
        "Form des Bildschirms": "Flach",
        "Fu\u00dffarbe": "Schwarz",
        "Ger\u00e4tebreite (inkl. Fu\u00df)": "499 mm",
        "Ger\u00e4teh\u00f6he (inkl. Fu\u00df)": "385 mm",
        "Ger\u00e4tetiefe (inkl. Fu\u00df)": "230 mm",
        "Gewicht": "5,4 kg",
        "HD-Typ": "Full HD",
        "HDCP": "Ja",
        "Helligkeit (typisch)": "250 cd/m\u00b2",
        "Horizontaler Scanbereich": "30 - 89 kHz",
        "H\u00f6he": "320,5 mm",
        "H\u00f6heneinstellung": "13 cm",
        "H\u00f6henverstellung": "Ja",
        "Integrierte Kamera": "Nein",
        "Integrierter USB-Hub": "Ja",
        "Kabelsperre-Slot": "Ja",
        "Kontrastverh\u00e4ltnis": "1000:1",
        "Kontrastverh\u00e4ltnis (dynamisch)": "5000000:1",
        "Kopfh\u00f6rer-Konnektivit\u00e4t": "3,5 mm",
        "Kopfh\u00f6rerausgang": "Ja",
        "Kopfh\u00f6rerausg\u00e4nge": "1",
        "Luftfeuchtigkeit (au\u00dfer Betrieb)": "5 - 85%",
        "Luftfeuchtigkeit in Betrieb": "10 - 80%",
        "Marktpositionierung": "Home & Office",
        "Mitgelieferte Kabel": "AC, DisplayPort, USB",
        "NVIDIA G-SYNC": "Nein",
        "Native Seitenverh\u00e4ltnis": "16:10",
        "Neigungsverstellung": "Ja",
        "Neigungswinkelbereich nach oben": "0 - 22\u00b0",
        "Neigungswinkelbereich nach unten": "0 - 5\u00b0",
        "On-Screen-Display (OSD)": "Ja",
        "Panel-Typ": "IPS",
        "Pivot": "Ja",
        "Pivot Winkel": "-45 - 45\u00b0",
        "Pixel Abstand": "0,254 x 0,248 mm",
        "Produktfarbe": "Schwarz",
        "RMS-Leistung": "4 W",
        "Reaktionszeit": "4 ms",
        "Schnellstart\u00fcbersicht": "Ja",
        "Schwenkbar": "Ja",
        "Schwenkwinkelbereich": "-45 - 45\u00b0",
        "Separate H/V-Sync": "Ja",
        "Sichtbare Gr\u00f6\u00dfe (horizontal)": "50,9 cm",
        "Sichtbare Gr\u00f6\u00dfe (vertikal)": "28,6 cm",
        "Slot-Typ Kabelsperre": "Kensington",
        "Temperaturbereich bei Lagerung": "-20 - 60 \u00b0C",
        "Temperaturbereich in Betrieb": "5 - 35 \u00b0C",
        "Tiefe": "43,5 mm",
        "USB-Hub-Version": "USB 2.0",
        "USB-Upstream-Porttyp": "USB Typ-B",
        "Unterst\u00fctzte Grafik-Aufl\u00f6sungen": "640 x 480 (VGA),800 x 600 (SVGA),1024 x 768 (XGA),1280 x 1024 (SXGA),1440 x 900 (WXGA+),1680 x 1050 (WSXGA+),1920 x 1080 (HD 1080),1920 x 1200 (WUXGA)",
        "VESA Montageadapter": "100 x 100 mm",
        "VESA-Halterung": "Ja",
        "Vertikaler Scanbereich": "50 - 76 Hz",
        "Zertifizierung": "TCO, CE, T\u00dcV-Bauart, CB, VCCI-B, RoHS, WEEE"
    },
    "raw_specifications_text": "Bildschirmdiagonale: 57,1 cm (22.5 Zoll)\nHelligkeit (typisch): 250 cd/m\u00b2\nBildschirmaufl\u00f6sung: 1920 x 1200 Pixel\nReaktionszeit: 4 ms\n3D: Nein\nHD-Typ: Full HD\nBildschirmtechnologie: LED\nPanel-Typ: IPS\nUnterst\u00fctzte Grafik-Aufl\u00f6sungen: 640 x 480 (VGA),800 x 600 (SVGA),1024 x 768 (XGA),1280 x 1024 (SXGA),1440 x 900 (WXGA+),1680 x 1050 (WSXGA+),1920 x 1080 (HD 1080),1920 x 1200 (WUXGA)\nKontrastverh\u00e4ltnis: 1000:1\nBlickwinkel, horizontal: 178\u00b0\nBlickwinkel, vertikal: 178\u00b0\nAnzahl der Farben des Displays: 1,073 Milliarden Farben\nNative Seitenverh\u00e4ltnis: 16:10\nForm des Bildschirms: Flach\nDisplay-Oberfl\u00e4che: Matt\nKontrastverh\u00e4ltnis (dynamisch): 5000000:1\nBildschirmdiagonale (cm): 57,15 cm\nPixel Abstand: 0,254 x 0,248 mm\nHorizontaler Scanbereich: 30 - 89 kHz\nVertikaler Scanbereich: 50 - 76 Hz\nSichtbare Gr\u00f6\u00dfe (horizontal): 50,9 cm\nSichtbare Gr\u00f6\u00dfe (vertikal): 28,6 cm\nSeparate H/V-Sync: Ja\nHDCP: Ja\nDDC/CI: Ja\nEingebaute Lautsprecher: Ja\nIntegrierte Kamera: Nein\nAnzahl der Lautsprecher: 2\nRMS-Leistung: 4 W\nMarktpositionierung: Home & Office\nProduktfarbe: Schwarz\nFu\u00dffarbe: Schwarz\nNVIDIA G-SYNC: Nein\nAMD FreeSync: Ja\nIntegrierter USB-Hub: Ja\nAnzahl VGA (D-Sub) Anschl\u00fcsse: 1\nDVI Anschluss: Nein\nAnzahl HDMI Anschl\u00fcsse: 1\nUSB-Hub-Version: USB 2.0\nUSB-Upstream-Porttyp: USB Typ-B\nAnzahl der vorgeschalteten Steckpl\u00e4tze: 1\nAnzahl der nachgeschalteten Steckpl\u00e4tze vom Typ USB-A: 2\nAnzahl DisplayPort Anschl\u00fcsse: 1\nKopfh\u00f6rerausgang: Ja\nKopfh\u00f6rerausg\u00e4nge: 1\nKopfh\u00f6rer-Konnektivit\u00e4t: 3,5 mm\nKabelsperre-Slot: Ja\nEin-/Ausschalter: Ja\nVESA-Halterung: Ja\nH\u00f6henverstellung: Ja\nSlot-Typ Kabelsperre: Kensington\nVESA Montageadapter: 100 x 100 mm\nPivot: Ja\nPivot Winkel: -45 - 45\u00b0\nSchwenkbar: Ja\nSchwenkwinkelbereich: -45 - 45\u00b0\nNeigungsverstellung: Ja\nNeigungswinkelbereich nach oben: 0 - 22\u00b0\nNeigungswinkelbereich nach unten: 0 - 5\u00b0\nH\u00f6heneinstellung: 13 cm\nBildschirmdisplay (OSD)-Sprachen: Deutsch, Niederl\u00e4ndisch, Englisch, Franz\u00f6sisch, Japanisch, Polnisch, Russisch\nOn-Screen-Display (OSD): Ja\nAnzahl OSD-Sprachen: 7Betriebsbedingungen\nTemperaturbereich in Betrieb: 5 - 35 \u00b0C\nTemperaturbereich bei Lagerung: -20 - 60 \u00b0C\nLuftfeuchtigkeit in Betrieb: 10 - 80%\nLuftfeuchtigkeit (au\u00dfer Betrieb): 5 - 85%\nEnergy Star-zertifiziert: Ja\nZertifizierung: TCO, CE, T\u00dcV-Bauart, CB, VCCI-B, RoHS, WEEE\nBreite: 499 mm\nTiefe: 43,5 mm\nH\u00f6he: 320,5 mm\nGewicht: 5,4 kg\nGer\u00e4tebreite (inkl. Fu\u00df): 499 mm\nGer\u00e4tetiefe (inkl. Fu\u00df): 230 mm\nGer\u00e4teh\u00f6he (inkl. Fu\u00df): 385 mm\nMitgelieferte Kabel: AC, DisplayPort, USB\nSchnellstart\u00fcbersicht: Ja",
    "reference_file": "offer_reference_2283.json",
    "shop_name": "Future-X.at"
}