{
    "html_file": "offer_2072_5.html",
    "name": "BenQ EW2480, 23.8\"",
    "offer_link": "https://www.mylemon.at/artikel/benq/9h_lj3la_tse/68-6cm-ew2780-16-9.html",
    "price": 225.57,
    "raw_specifications": {
        "3D": "Nein",
        "AC Eingangsspannung": "100 - 240 V",
        "Anzahl HDMI-Anschl\u00fcsse": "3",
        "Anzahl der Farben des Displays": "16,78 Millionen Farben",
        "Anzahl der Lautsprecher": "2",
        "Artikelnummer": "MZ5YPZL",
        "Aufl\u00f6sung": "1920x1080",
        "Besonderheiten": "Lautsprecher",
        "Bildschirmdiagonale": "60,5 cm (23.8 Zoll)",
        "Bildschirmform": "Flach",
        "Bildschirmtechnologie": "IPS",
        "Bildwinkel, horizontal": "178\u00b0",
        "Bildwinkel, vertikal": "178\u00b0",
        "Display-Aufl\u00f6sung": "1920 x 1080 Pixel",
        "Displaygr\u00f6\u00dfe": "23,8 Zoll",
        "EAN": "4718755079382",
        "Eingebaute Lautsprecher": "Ja",
        "Energieeffizienzklasse (HDR)": "F",
        "Energieeffizienzklasse (SDR)": "F",
        "Energieeffizienzskala": "A bis G",
        "Energieverbrauch (HDR) pro 1.000 Stunden": "21 kWh",
        "Energieverbrauch (SDR) pro 1.000 Stunden": "19 kWh",
        "Ergonomie": "Neigbar",
        "Farbskala": "72%",
        "Ger\u00e4tebreite (inkl. Fu\u00df)": "537,4 mm",
        "Ger\u00e4teh\u00f6he (inkl. Fu\u00df)": "416,7 mm",
        "Ger\u00e4tetiefe (inkl. Fu\u00df)": "186,5 mm",
        "Gewicht (mit St\u00e4nder)": "3,6 kg",
        "HD-Typ": "Full HD",
        "HDCP": "Ja",
        "HDMI": "Ja",
        "HDMI-Version": "2.0",
        "Helligkeit": "250 cd/m\u00b2",
        "Helligkeit (typisch)": "250 cd/m\u00b2",
        "Hersteller Artikelnummer": "9H.LJ3LA.TSE",
        "Integrierte Kamera": "Nein",
        "Kontrastverh\u00e4ltnis": "1000:1",
        "Kontrastverh\u00e4ltnis (dynamisch)": "2000000:1",
        "Kopfh\u00f6rerausgang": "Ja",
        "Maximale Bildwiederholrate": "60 Hz",
        "Name der Farbe": "BLACK-METALLIC GREY",
        "Natives Seitenverh\u00e4ltnis": "16:9",
        "Panel": "IPS",
        "Panel-Montage-Schnittstelle": "100 x 100 mm",
        "Panel-Typ": "IPS",
        "Pixeldichte": "93 ppi",
        "Produktfarbe": "Schwarz, Grau",
        "RGB-Farbraum": "NTSC",
        "RMS-Leistung": "2 W",
        "Reaktionszeit": "5 ms",
        "Stromverbrauch (Standardbetrieb)": "18,8 W",
        "Stromverbrauch (Standby)": "0,3 W",
        "Stromverbrauch (aus)": "0,2 W",
        "Touchscreen": "Nein",
        "Typ der Hintergrundbeleuchtung": "LED",
        "Unterst\u00fctzte Grafik-Aufl\u00f6sungen": "1920 x 1080 (HD 1080)",
        "VESA Halterung": "100x100 mm",
        "VESA-Halterung": "Ja",
        "Video Anschl\u00fcsse": "3x HDMI",
        "Warentarifnummer (HS)": "85285210"
    },
    "raw_specifications_text": "Displaygr\u00f6\u00dfe: 23,8 Zoll\nAufl\u00f6sung: 1920x1080\nPanel: IPS\nReaktionszeit: 5 ms\nVideo Anschl\u00fcsse: 3x HDMI\nErgonomie: Neigbar\nVESA Halterung: 100x100 mm\nHelligkeit: 250 cd/m\u00b2\nBesonderheiten: Lautsprecher\nHersteller Artikelnummer: 9H.LJ3LA.TSE\nEAN: 4718755079382\nArtikelnummer: MZ5YPZL\nBildschirmdiagonale: 60,5 cm (23.8 Zoll)\nDisplay-Aufl\u00f6sung: 1920 x 1080 Pixel\nNatives Seitenverh\u00e4ltnis: 16:9\nBildschirmtechnologie: IPS\nTouchscreen: Nein\nHD-Typ: Full HD\nPanel-Typ: IPS\nBildschirmform: Flach\nKontrastverh\u00e4ltnis: 1000:1\nMaximale Bildwiederholrate: 60 Hz\nAnzahl der Farben des Displays: 16,78 Millionen Farben\nTyp der Hintergrundbeleuchtung: LED\nHelligkeit (typisch): 250 cd/m\u00b2\nUnterst\u00fctzte Grafik-Aufl\u00f6sungen: 1920 x 1080 (HD 1080)\nKontrastverh\u00e4ltnis (dynamisch): 2000000:1\nBildwinkel, horizontal: 178\u00b0\nBildwinkel, vertikal: 178\u00b0\nPixeldichte: 93 ppi\nRGB-Farbraum: NTSC\nFarbskala: 72%\n3D: Nein\nEingebaute Lautsprecher: Ja\nIntegrierte Kamera: Nein\nAnzahl der Lautsprecher: 2\nRMS-Leistung: 2 W\nProduktfarbe: Schwarz, Grau\nName der Farbe: BLACK-METALLIC GREY\nHDMI: Ja\nKopfh\u00f6rerausgang: Ja\nAnzahl HDMI-Anschl\u00fcsse: 3\nHDMI-Version: 2.0\nHDCP: Ja\nVESA-Halterung: Ja\nPanel-Montage-Schnittstelle: 100 x 100 mm\nEnergieeffizienzklasse (SDR): F\nEnergieeffizienzklasse (HDR): F\nEnergieverbrauch (SDR) pro 1.000 Stunden: 19 kWh\nEnergieverbrauch (HDR) pro 1.000 Stunden: 21 kWh\nStromverbrauch (Standardbetrieb): 18,8 W\nStromverbrauch (Standby): 0,3 W\nStromverbrauch (aus): 0,2 W\nAC Eingangsspannung: 100 - 240 V\nEnergieeffizienzskala: A bis G\nGer\u00e4tebreite (inkl. Fu\u00df): 537,4 mm\nGer\u00e4tetiefe (inkl. Fu\u00df): 186,5 mm\nGer\u00e4teh\u00f6he (inkl. Fu\u00df): 416,7 mm\nGewicht (mit St\u00e4nder): 3,6 kg\nWarentarifnummer (HS): 85285210",
    "reference_file": "offer_reference_2072.json",
    "shop_name": "mylemon.at"
}