{
    "html_file": "offer_1116_11.html",
    "name": "HANNspree HP246PDB, 24\"",
    "offer_link": "https://www.future-x.at/hannspree-hp-246-pdb-led-monitor-60-96-cm-24-1920-x-1200-wuxga-%40-60-hz-ads-ips-300-cd-m%B2-1000%3A1-4-ms-hdmi-displayport-lautsprecher-p-8957078/?pv=2",
    "price": 196.69,
    "raw_specifications": {
        "Abmessungen (Breite x Tiefe x H\u00f6he)": "55,68 cm x 24,5 cm x 56,29 cm - mit Fu\u00df",
        "Ausgangsleistung/Kanal": "1.5 Watt",
        "Besonderheiten": "Low Blue Light Mode, flimmerfreie Technologie, Reihenschaltung m\u00f6glich, Picture-in-Picture, Picture-by-Picture",
        "Bildschirmbeschichtung": "Blendfrei, 3H Hard Coating, Haze 25 %",
        "Bildschirmtyp": "ADS-IPS",
        "Diagonalabmessung": "60,96 cm (24\")",
        "Display-Typ": "LED-hintergrundbeleuchteter LCD-Monitor / TFT-Aktivmatrix",
        "Eingangsspannung": "AC 100 - 240 V (50 - 65 Hz)",
        "Einstellungen der Anzeigeposition": "H\u00f6he, Pivot (Rotation), Drehung, Neigung",
        "Energie Effizienzklasse": "Klasse F",
        "Enthaltene Kabel": "1 x HDMI-Kabel - 1.5 m",
        "Farbtemperatur": "9300K, 6500K, 5500K",
        "Farbunterst\u00fctzung": "16,7 Millionen Farben",
        "Gewicht": "7,2 kg",
        "Helligkeit": "300 cd/m\u00b2",
        "Hintergrundbeleuchtungs-Technologie": "LED-Hintergrundbeleuchtung",
        "Horizontale Bildwiederholrate": "30 - 83 kHz",
        "Horizontaler Betrachtungswinkel": "178",
        "H\u00f6heneinstellung": "117 mm",
        "Integrierte Peripherieger\u00e4te": "USB 3.0-Hub",
        "Kontrast": "1000:1 / 80000000:1 (dynamisch)",
        "Leistungsaufnahme im Ein-Zustand": "22 W",
        "Leistungsmerkmale": "Slot f\u00fcr Sicherheitsschloss (Kabelschloss getrennt erh\u00e4ltlich)",
        "Native Aufl\u00f6sung": "WUXGA 1920 x 1200 bei 60 Hz",
        "Neigungswinkel": "-5/+30",
        "Pixelpitch": "0.274 mm",
        "Reaktionszeit": "4 ms (Overdrive)",
        "Rotationswinkel": "90",
        "Schlosstyp zur Diebstahlsicherung": "Kensington Slot",
        "Schnittstellen": "DisplayPort 1.2 \u00a6 HDMI \u00a6 DisplayPort-Ausgang \u00a6 Kopfh\u00f6rer \u00a6 USB 3.0 Upstream \u00a6 4 x USB 3.0 Downstream",
        "Schwenkwinkel": "170",
        "Seitenverh\u00e4ltnis": "16:10",
        "Stromverbrauch (Aus-Modus)": "0.28 Watt",
        "Stromverbrauch (typisch)": "13.59 Watt",
        "Stromverbrauch SDR (eingeschaltet)": "22 kWh/1.000 h",
        "Stromverbrauch im Standby-Modus": "0.3 Watt",
        "TCO-zertifiziert": "TCO Certified Displays 8",
        "Transportbreite": "63 cm",
        "Transportgewicht": "9,2 kg",
        "Transporth\u00f6he": "43,8 cm",
        "Transporttiefe": "20,9 cm",
        "Typ": "Lautsprecher - Stereo",
        "VESA-Halterung": "100 x 100 mm",
        "Vertikale Bildwiederholrate": "56 - 75 Hz",
        "Vertikaler Betrachtungswinkel": "178",
        "Zubeh\u00f6r im Lieferumfang": "Aufstellung"
    },
    "raw_specifications_text": "Display-Typ: LED-hintergrundbeleuchteter LCD-Monitor / TFT-Aktivmatrix\nEnergie Effizienzklasse: Klasse F\nDiagonalabmessung: 60,96 cm (24\")\nIntegrierte Peripherieger\u00e4te: USB 3.0-Hub\nBildschirmtyp: ADS-IPS\nSeitenverh\u00e4ltnis: 16:10\nNative Aufl\u00f6sung: WUXGA 1920 x 1200 bei 60 Hz\nPixelpitch: 0.274 mm\nHelligkeit: 300 cd/m\u00b2\nKontrast: 1000:1 / 80000000:1 (dynamisch)\nFarbunterst\u00fctzung: 16,7 Millionen Farben\nReaktionszeit: 4 ms (Overdrive)\nVertikale Bildwiederholrate: 56 - 75 Hz\nHorizontale Bildwiederholrate: 30 - 83 kHz\nHorizontaler Betrachtungswinkel: 178\nVertikaler Betrachtungswinkel: 178\nBildschirmbeschichtung: Blendfrei, 3H Hard Coating, Haze 25 %\nHintergrundbeleuchtungs-Technologie: LED-Hintergrundbeleuchtung\nFarbtemperatur: 9300K, 6500K, 5500K\nBesonderheiten: Low Blue Light Mode, flimmerfreie Technologie, Reihenschaltung m\u00f6glich, Picture-in-Picture, Picture-by-Picture\nAbmessungen (Breite x Tiefe x H\u00f6he): 55,68 cm x 24,5 cm x 56,29 cm - mit Fu\u00df\nGewicht: 7,2 kg\nTyp: Lautsprecher - Stereo\nAusgangsleistung/Kanal: 1.5 Watt\nSchnittstellen: DisplayPort 1.2 \u00a6 HDMI \u00a6 DisplayPort-Ausgang \u00a6 Kopfh\u00f6rer \u00a6 USB 3.0 Upstream \u00a6 4 x USB 3.0 Downstream\nEinstellungen der Anzeigeposition: H\u00f6he, Pivot (Rotation), Drehung, Neigung\nNeigungswinkel: -5/+30\nSchwenkwinkel: 170\nRotationswinkel: 90\nH\u00f6heneinstellung: 117 mm\nVESA-Halterung: 100 x 100 mm\nLeistungsmerkmale: Slot f\u00fcr Sicherheitsschloss (Kabelschloss getrennt erh\u00e4ltlich)\nZubeh\u00f6r im Lieferumfang: Aufstellung\nEnthaltene Kabel: 1 x HDMI-Kabel - 1.5 m\nSchlosstyp zur Diebstahlsicherung: Kensington Slot\nEingangsspannung: AC 100 - 240 V (50 - 65 Hz)\nLeistungsaufnahme im Ein-Zustand: 22 W\nStromverbrauch SDR (eingeschaltet): 22 kWh/1.000 h\nStromverbrauch (typisch): 13.59 Watt\nStromverbrauch im Standby-Modus: 0.3 Watt\nStromverbrauch (Aus-Modus): 0.28 Watt\nTransportbreite: 63 cm\nTransporttiefe: 20,9 cm\nTransporth\u00f6he: 43,8 cm\nTransportgewicht: 9,2 kg\nTCO-zertifiziert: TCO Certified Displays 8",
    "reference_file": "offer_reference_1116.json",
    "shop_name": "Future-X.at"
}