{
    "html_file": "offer_1459_29.html",
    "name": "Samsung ViewFinity S8 S27A800NMU (2021), 26.9\"",
    "offer_link": "https://www.1ashop.at/de/produkt/70799/samsung-s27a800nmu-led-monitor-68-cm-27.html",
    "price": 372.38,
    "raw_specifications": {
        "Abmessungen (Breite x Tiefe x H\u00f6he)": "61.55 cm x 19.64 cm x 55.19 cm - mit Fu\u00df",
        "Besonderheiten": "Spielmodus, flimmerfreie Technologie, ohne Quecksilber, Image Size, Eco Saving Plus, Eye Saver Mode, Picture-in-Picture, Picture-by-Picture, Off Timer, 62 % max. Leuchtverh\u00e4ltnis",
        "Bildschirmtyp": "IPS",
        "Details zu Abmessungen & Gewicht": "Mit Fu\u00df - Breite: 61.55 cm - Tiefe: 19.64 cm - H\u00f6he: 55.19 cm - Gewicht: 6.4 kg  Ohne Fu\u00df - Breite: 61.55 cm - Tiefe: 4.27 cm - H\u00f6he: 36.82 cm",
        "Diagonalabmessung": "68 cm (27\")",
        "Display-Typ": "LED-hintergrundbeleuchteter LCD-Monitor / TFT-Aktivmatrix",
        "EAN/UPC": "8806090989063",
        "Einstellungen der Anzeigeposition": "H\u00f6he, Pivot (Rotation), Drehung, Neigung",
        "Energie Effizienzklasse": "Klasse G",
        "Energieklasse (HDR)": "Klasse G",
        "Enthaltene Kabel": "1 x HDMI-Kabel - 1.5 m  1 x SuperSpeed-USB-Kabel",
        "Farbe": "Schwarz",
        "Farbunterst\u00fctzung": "1,07 Mrd. Farben",
        "Gewicht": "6.4 kg",
        "Gruppe": "TFTs",
        "HDR-Format": "HDR10",
        "Helligkeit": "300 cd/m\u00b2",
        "Hersteller": "Samsung",
        "Hersteller Art. Nr.": "LS27A800NMUXEN",
        "Hintergrundbeleuchtungs-Technologie": "LED-Hintergrundbeleuchtung",
        "Horizontaler Betrachtungswinkel": "178",
        "H\u00f6heneinstellung": "120 mm",
        "Integrierte Peripherieger\u00e4te": "USB 3.0-Hub",
        "Kennzeichnung": "TUV, EMC, ISO 9241-307 Class 2",
        "Kontrast": "1000:1",
        "Leistungsaufnahme im Ein-Zustand": "28 W",
        "Leistungsmerkmale": "Slot f\u00fcr Sicherheitsschloss (Kabelschloss getrennt erh\u00e4ltlich)",
        "Native Aufl\u00f6sung": "4K 3840 x 2160 bei 60 Hz",
        "Neigungswinkel": "-2/+25",
        "Reaktionszeit": "5 ms (Gray-to-Gray)",
        "Rotationswinkel": "-2/+92",
        "Schlosstyp zur Diebstahlsicherung": "Kensington Slot",
        "Schnittstellen": "DisplayPort  HDMI  Kopfh\u00f6rer  3 x USB 3.0  USB 2.0",
        "Schwenkwinkel": "60",
        "Seitenverh\u00e4ltnis": "16:9",
        "Service und Support": "Begrenzte Garantie - 3 Jahre",
        "Stromverbrauch (Aus-Modus)": "0.3 Watt",
        "Stromverbrauch HDR (eingeschaltet)": "34 kWh/1.000 h",
        "Stromverbrauch SDR (eingeschaltet)": "28 kWh/1.000 h",
        "Stromverbrauch im Standby-Modus": "0.5 Watt",
        "TCO-zertifiziert": "TCO Certified Displays 8",
        "Transportbreite": "68.6 cm",
        "Transportgewicht": "8.1 kg",
        "Transporth\u00f6he": "45 cm",
        "Transporttiefe": "17.1 cm",
        "VESA-Halterung": "100 x 100 mm",
        "Vertikaler Betrachtungswinkel": "178"
    },
    "raw_specifications_text": "Gruppe: TFTs\nHersteller: Samsung\nHersteller Art. Nr.: LS27A800NMUXEN\nEAN/UPC: 8806090989063\nDisplay-Typ: LED-hintergrundbeleuchteter LCD-Monitor / TFT-Aktivmatrix\nEnergie Effizienzklasse: Klasse G\nEnergieklasse (HDR): Klasse G\nDiagonalabmessung: 68 cm (27\")\nIntegrierte Peripherieger\u00e4te: USB 3.0-Hub\nBildschirmtyp: IPS\nSeitenverh\u00e4ltnis: 16:9\nNative Aufl\u00f6sung: 4K 3840 x 2160 bei 60 Hz\nHelligkeit: 300 cd/m\u00b2\nKontrast: 1000:1\nHDR-Format: HDR10\nFarbunterst\u00fctzung: 1,07 Mrd. Farben\nReaktionszeit: 5 ms (Gray-to-Gray)\nHorizontaler Betrachtungswinkel: 178\nVertikaler Betrachtungswinkel: 178\nHintergrundbeleuchtungs-Technologie: LED-Hintergrundbeleuchtung\nBesonderheiten: Spielmodus, flimmerfreie Technologie, ohne Quecksilber, Image Size, Eco Saving Plus, Eye Saver Mode, Picture-in-Picture, Picture-by-Picture, Off Timer, 62 % max. Leuchtverh\u00e4ltnis\nFarbe: Schwarz\nAbmessungen (Breite x Tiefe x H\u00f6he): 61.55 cm x 19.64 cm x 55.19 cm - mit Fu\u00df\nGewicht: 6.4 kg\nLeistungsaufnahme im Ein-Zustand: 28 W\nStromverbrauch SDR (eingeschaltet): 28 kWh/1.000 h\nStromverbrauch HDR (eingeschaltet): 34 kWh/1.000 h\nStromverbrauch im Standby-Modus: 0.5 Watt\nStromverbrauch (Aus-Modus): 0.3 Watt\nSchnittstellen: DisplayPort  HDMI  Kopfh\u00f6rer  3 x USB 3.0  USB 2.0\nEinstellungen der Anzeigeposition: H\u00f6he, Pivot (Rotation), Drehung, Neigung\nNeigungswinkel: -2/+25\nSchwenkwinkel: 60\nRotationswinkel: -2/+92\nH\u00f6heneinstellung: 120 mm\nVESA-Halterung: 100 x 100 mm\nLeistungsmerkmale: Slot f\u00fcr Sicherheitsschloss (Kabelschloss getrennt erh\u00e4ltlich)\nEnthaltene Kabel: 1 x HDMI-Kabel - 1.5 m  1 x SuperSpeed-USB-Kabel\nKennzeichnung: TUV, EMC, ISO 9241-307 Class 2\nSchlosstyp zur Diebstahlsicherung: Kensington Slot\nDetails zu Abmessungen & Gewicht: Mit Fu\u00df - Breite: 61.55 cm - Tiefe: 19.64 cm - H\u00f6he: 55.19 cm - Gewicht: 6.4 kg  Ohne Fu\u00df - Breite: 61.55 cm - Tiefe: 4.27 cm - H\u00f6he: 36.82 cm\nTransportbreite: 68.6 cm\nTransporttiefe: 17.1 cm\nTransporth\u00f6he: 45 cm\nTransportgewicht: 8.1 kg\nTCO-zertifiziert: TCO Certified Displays 8\nService und Support: Begrenzte Garantie - 3 Jahre",
    "reference_file": "offer_reference_1459.json",
    "shop_name": "1ashop.at"
}