{
    "html_file": "offer_171_1.html",
    "name": "Dell S2721QSA, 27\"",
    "offer_link": "https://www.amazon.de/dp/B0BW128B19?linkCode=xm2&camp=2025&creative=165953&smid=A3JWKAKR8XB7XF&creativeASIN=B0BW128B19&tag=geizhals1-21",
    "price": 248.82,
    "raw_specifications": {
        "ASIN": "B0BW128B19",
        "Amazon Bestseller-Rang": "Nr. 1,846 in Computer & Zubeh\u00f6r (Siehe Top 100 in Computer & Zubeh\u00f6r)  Nr. 33 in Monitore",
        "Artikelgewicht": "\u200e6,4 Kilograms",
        "Batterien enthalten": "\u200eNein",
        "Bildschirmaufl\u00f6sung": "\u200e3840 x 2160",
        "Display-Gr\u00f6\u00dfe": "\u200e27 Zoll",
        "Durchschnittliche Kundenbewertung": "4,5  4,5 von 5 Sternen    \n    5.221 Sternebewertungen   \n\n\n 4,5 von 5 Sternen",
        "Farbe": "\u200ePlatinum Silver",
        "Garantierte Software-Updates bis": "\u200eunbekannt",
        "Hersteller": "\u200eDell",
        "Im Angebot von Amazon.de seit": "24. Februar 2023",
        "L\u00f6sung": "\u200e3840 x 2160 Pixels",
        "Marke": "\u200eDell",
        "Modell/Serie": "\u200eS2721QSA",
        "Modellnummer": "\u200eS2721QSA",
        "Produktabmessungen": "\u200e17,47 x 61,16 x 40,01 cm; 6,4 Kilogramm",
        "Prozessortyp": "\u200eOthers",
        "Volt": "\u200e240 Volt (Wechselstrom)"
    },
    "raw_specifications_text": "Marke: \u200eDell\nHersteller: \u200eDell\nModell/Serie: \u200eS2721QSA\nProduktabmessungen: \u200e17,47 x 61,16 x 40,01 cm; 6,4 Kilogramm\nModellnummer: \u200eS2721QSA\nFarbe: \u200ePlatinum Silver\nDisplay-Gr\u00f6\u00dfe: \u200e27 Zoll\nBildschirmaufl\u00f6sung: \u200e3840 x 2160\nL\u00f6sung: \u200e3840 x 2160 Pixels\nProzessortyp: \u200eOthers\nVolt: \u200e240 Volt (Wechselstrom)\nBatterien enthalten: \u200eNein\nArtikelgewicht: \u200e6,4 Kilograms\nGarantierte Software-Updates bis: \u200eunbekannt\nASIN: B0BW128B19\nDurchschnittliche Kundenbewertung: 4,5  4,5 von 5 Sternen    \n    5.221 Sternebewertungen   \n\n\n 4,5 von 5 Sternen\nAmazon Bestseller-Rang: Nr. 1,846 in Computer & Zubeh\u00f6r (Siehe Top 100 in Computer & Zubeh\u00f6r)  Nr. 33 in Monitore\nIm Angebot von Amazon.de seit: 24. Februar 2023",
    "reference_file": "offer_reference_171.json",
    "shop_name": "Amazon.at"
}