{
    "html_file": "offer_738_39.html",
    "name": "AOC 25G3ZM/BK, 24.5\"",
    "offer_link": "https://ms-it-beratung.at/shop/details.php?art=415562&artname=AOC+62%2C2cm+%2824%2C5%22%29+25G3ZM%2FBK+16%3A09+VA+2xHDMI%2BDP%2BUSB+bl.%2Fred+reta",
    "price": 247.0,
    "raw_specifications": {
        "AMD FreeSync": "Ja",
        "AMD FreeSync-Typ": "FreeSync Premium",
        "Abnehmbarer Standfu\u00df": "Ja",
        "Anzahl DisplayPort Anschl\u00fcsse": "1",
        "Anzahl HDMI-Anschl\u00fcsse": "2",
        "Anzahl der Farben des Displays": "16,7 Millionen Farben",
        "Au\u00dfenverkleidungstyp": "Matt",
        "Bildschirmdiagonale": "62,2 cm (24.5 Zoll)",
        "Bildschirmdiagonale (cm)": "62,23 cm",
        "Bildschirmform": "Flach",
        "Bildwinkel, horizontal": "178\u00b0",
        "Bildwinkel, vertikal": "178\u00b0",
        "Blendfreier Bildschirm": "Ja",
        "Breite (ohne Standfu\u00df)": "55,7 cm",
        "Display-Aufl\u00f6sung": "1920 x 1080 Pixel",
        "DisplayPort Kabell\u00e4nge": "1,8 m",
        "DisplayPorts-Version": "1.2",
        "Energieeffizienzklasse (SDR)": "E",
        "Energieeffizienzskala": "A bis G",
        "Energieverbrauch (SDR) pro 1.000 Stunden": "18 kWh",
        "Farbpalette DCI-P3": "92%",
        "Farbskala": "92%",
        "Flimmerfreie Technologie": "Ja",
        "Ger\u00e4tebreite (inkl. Fu\u00df)": "557,3 mm",
        "Ger\u00e4teh\u00f6he (inkl. Fu\u00df)": "503 mm",
        "Ger\u00e4tetiefe (inkl. Fu\u00df)": "258,8 mm",
        "Gewicht (mit St\u00e4nder)": "4,24 kg",
        "HD-Typ": "Full HD",
        "HDMI": "Ja",
        "HDMI-Kabell\u00e4nge": "1,8 m",
        "HDMI-Version": "2.0",
        "Helligkeit (typisch)": "300 cd/m\u00b2",
        "H\u00f6he (ohne Standfu\u00df)": "32,9 cm",
        "H\u00f6heneinstellung": "13 cm",
        "H\u00f6henverstellung": "Ja",
        "Kabelsperre-Slot": "Ja",
        "Kontrastverh\u00e4ltnis": "3000:1",
        "Kontrastverh\u00e4ltnis (dynamisch)": "80000000:1",
        "Kopfh\u00f6rer-Anschluss": "3,5 mm",
        "Kopfh\u00f6rerausgang": "Ja",
        "Low-Blue-Light-Technologie": "Ja",
        "Marktpositionierung": "Gaming",
        "Maximale Bildwiederholrate": "240 Hz",
        "Mitgelieferte Kabel": "AC",
        "NVIDIA G-SYNC": "Nein",
        "Natives Seitenverh\u00e4ltnis": "16:9",
        "Neigungsverstellung": "Ja",
        "Neigungswinkelbereich": "-5 - 23\u00b0",
        "Paketgewicht": "6,34 kg",
        "Panel-Montage-Schnittstelle": "100 x 100 mm",
        "Panel-Typ": "VA",
        "Pivot": "Ja",
        "Pixeldichte": "90 ppi",
        "Produktfarbe": "Schwarz, Rot",
        "RGB-Farbraum": "DCI-P3",
        "Reaktionszeit": "0,5 ms",
        "Schwenkbar": "Ja",
        "Schwenkwinkelbereich": "-30 - 30\u00b0",
        "Slot-Typ Kabelsperre": "Kensington",
        "Spiel-Modus": "Ja",
        "Stromverbrauch (Standardbetrieb)": "25 W",
        "Stromverbrauch (Standby)": "0,3 W",
        "Stromverbrauch (aus)": "0,3 W",
        "Tiefe (ohne Standfu\u00df)": "4,8 cm",
        "Touchscreen": "Nein",
        "Typ der Hintergrundbeleuchtung": "W-LED",
        "VESA-Halterung": "Ja",
        "Verpackungsbreite": "620 mm",
        "Verpackungsh\u00f6he": "541 mm",
        "Verpackungstiefe": "160 mm",
        "Vorderer Rahmen": "Schwarz/Rot",
        "Zertifizierung": "ISO 9241-307",
        "sRGB Abdeckung (klassisch)": "100%"
    },
    "raw_specifications_text": "Bildschirmdiagonale: 62,2 cm (24.5 Zoll)\nDisplay-Aufl\u00f6sung: 1920 x 1080 Pixel\nNatives Seitenverh\u00e4ltnis: 16:9\nTouchscreen: Nein\nHD-Typ: Full HD\nPanel-Typ: VA\nTyp der Hintergrundbeleuchtung: W-LED\nHelligkeit (typisch): 300 cd/m\u00b2\nReaktionszeit: 0,5 ms\nBlendfreier Bildschirm: Ja\nBildschirmform: Flach\nKontrastverh\u00e4ltnis: 3000:1\nKontrastverh\u00e4ltnis (dynamisch): 80000000:1\nMaximale Bildwiederholrate: 240 Hz\nBildwinkel, horizontal: 178\u00b0\nBildwinkel, vertikal: 178\u00b0\nAnzahl der Farben des Displays: 16,7 Millionen Farben\nPixeldichte: 90 ppi\nBildschirmdiagonale (cm): 62,23 cm\nRGB-Farbraum: DCI-P3\nFarbskala: 92%\nsRGB Abdeckung (klassisch): 100%\nNVIDIA G-SYNC: Nein\nAMD FreeSync: Ja\nAMD FreeSync-Typ: FreeSync Premium\nFlimmerfreie Technologie: Ja\nLow-Blue-Light-Technologie: Ja\nSpiel-Modus: Ja\nMarktpositionierung: Gaming\nProduktfarbe: Schwarz, Rot\nVorderer Rahmen: Schwarz/Rot\nAbnehmbarer Standfu\u00df: Ja\nZertifizierung: ISO 9241-307\nHDMI: Ja\nAnzahl HDMI-Anschl\u00fcsse: 2\nHDMI-Version: 2.0\nAnzahl DisplayPort Anschl\u00fcsse: 1\nDisplayPorts-Version: 1.2\nKopfh\u00f6rerausgang: Ja\nKopfh\u00f6rer-Anschluss: 3,5 mm\nVESA-Halterung: Ja\nPanel-Montage-Schnittstelle: 100 x 100 mm\nKabelsperre-Slot: Ja\nSlot-Typ Kabelsperre: Kensington\nH\u00f6henverstellung: Ja\nH\u00f6heneinstellung: 13 cm\nPivot: Ja\nSchwenkbar: Ja\nSchwenkwinkelbereich: -30 - 30\u00b0\nNeigungswinkelbereich: -5 - 23\u00b0\nNeigungsverstellung: Ja\nEnergieeffizienzklasse (SDR): E\nEnergieverbrauch (SDR) pro 1.000 Stunden: 18 kWh\nStromverbrauch (Standardbetrieb): 25 W\nStromverbrauch (Standby): 0,3 W\nStromverbrauch (aus): 0,3 W\nEnergieeffizienzskala: A bis G\nMitgelieferte Kabel: AC\nDisplayPort Kabell\u00e4nge: 1,8 m\nHDMI-Kabell\u00e4nge: 1,8 m\nGer\u00e4tebreite (inkl. Fu\u00df): 557,3 mm\nGer\u00e4tetiefe (inkl. Fu\u00df): 258,8 mm\nGer\u00e4teh\u00f6he (inkl. Fu\u00df): 503 mm\nGewicht (mit St\u00e4nder): 4,24 kg\nBreite (ohne Standfu\u00df): 55,7 cm\nTiefe (ohne Standfu\u00df): 4,8 cm\nH\u00f6he (ohne Standfu\u00df): 32,9 cm\nVerpackungsbreite: 620 mm\nVerpackungstiefe: 160 mm\nVerpackungsh\u00f6he: 541 mm\nPaketgewicht: 6,34 kg\nFarbpalette DCI-P3: 92%\nAu\u00dfenverkleidungstyp: Matt",
    "reference_file": "offer_reference_738.json",
    "shop_name": "ms-it-beratung"
}