{
    "html_file": "offer_356_13.html",
    "name": "LG 32UN550P-W, 31.5\"",
    "offer_link": "https://www.alternate.at/LG/32UN550P-W-LED-Monitor/html/product/1906616?partner=AtGeizhalsat&campaign=Monitor/LG/1906616",
    "price": 331.0,
    "raw_specifications": {
        "": "H\u00f6henverstellbar",
        "Abmessungen": "Breite: 71,43 cm x H\u00f6he: 48,59 cm x Tiefe/L\u00e4nge: 22,67 cm",
        "Anschl\u00fcsse": "2x HDMI-Eingang, 1x DisplayPort-Eingang",
        "Bild": "Glaretyp",
        "Bildschirmaufl\u00f6sung": "3.840 x 2.160 Pixel",
        "Bildschirmdiagonale": "80 cm (31,5 Zoll)",
        "EAN": "8806091984555",
        "Energieeffizienzklasse (HDR)": "G (A - G)",
        "Energieeffizienzklasse (SDR)": "F (A - G)",
        "Energieverbauch pro 1000 Stunden (HDR)": "52 kWh",
        "Energieverbauch pro 1000 Stunden (SDR)": "32 kWh",
        "Ergonomie": "Typ",
        "Farbe": "wei\u00df/schwarz",
        "Features": "AMD FreeSync",
        "Gewicht": "8,4 kg",
        "Hersteller-Nr.": "32UN550P-W.AEU",
        "Lautsprecher": "2 Lautsprecher",
        "Leistungsaufnahme im Bereitschafts- und Aus-Zustand": "0,5 Watt",
        "Leistungsaufnahme im Ein-Zustand bei Standard-Dynamikumfang (SDR)": "32 Watt",
        "Leistungsaufnahme im Ein-Zustand bei hohem Dynamikumfang (HDR)": "52 Watt",
        "Typ": "LED-Monitor",
        "Weitere Informationen": "Flicker Safe, Lesemodus, Super Resolution+, Black Stabilizer, Dynamic Action Sync, 90% DCI-P3, Maxx Audio | Ma\u00dfe ohne Standfu\u00df: 714,3 x 420 x 45,7 mm (BxHxT) | Gewicht ohne Standfu\u00df: 6700",
        "Zubeh\u00f6r": "Vorhanden"
    },
    "raw_specifications_text": "Energieeffizienzklasse (SDR): F (A - G)\nEnergieverbauch pro 1000 Stunden (SDR): 32 kWh\nEnergieeffizienzklasse (HDR): G (A - G)\nEnergieverbauch pro 1000 Stunden (HDR): 52 kWh\nLeistungsaufnahme im Ein-Zustand bei Standard-Dynamikumfang (SDR): 32 Watt\nLeistungsaufnahme im Ein-Zustand bei hohem Dynamikumfang (HDR): 52 Watt\nLeistungsaufnahme im Bereitschafts- und Aus-Zustand: 0,5 Watt\nBildschirmdiagonale: 80 cm (31,5 Zoll)\nBildschirmaufl\u00f6sung: 3.840 x 2.160 Pixel\nTyp: LED-Monitor\nFarbe: wei\u00df/schwarz\nEAN: 8806091984555\nHersteller-Nr.: 32UN550P-W.AEU\nBild: Glaretyp\n: H\u00f6henverstellbar\nAnschl\u00fcsse: 2x HDMI-Eingang, 1x DisplayPort-Eingang\nErgonomie: Typ\nLautsprecher: 2 Lautsprecher\nFeatures: AMD FreeSync\nWeitere Informationen: Flicker Safe, Lesemodus, Super Resolution+, Black Stabilizer, Dynamic Action Sync, 90% DCI-P3, Maxx Audio | Ma\u00dfe ohne Standfu\u00df: 714,3 x 420 x 45,7 mm (BxHxT) | Gewicht ohne Standfu\u00df: 6700\nZubeh\u00f6r: Vorhanden\nAbmessungen: Breite: 71,43 cm x H\u00f6he: 48,59 cm x Tiefe/L\u00e4nge: 22,67 cm\nGewicht: 8,4 kg",
    "reference_file": "offer_reference_356.json",
    "shop_name": "Alternate.at"
}