{
    "html_file": "offer_1824_18.html",
    "name": "Dell S2421H, 23.8\"",
    "offer_link": "https://restposten.bauguru.at/monitore/126532-monitor-dell-s2421h-ips-23-8-5397184409329.html",
    "price": 146.6,
    "raw_specifications": {
        "Arbeitsbereich f\u00fcr Feuchtigkeit": "10 % - 80 %",
        "Arbeitsbereich f\u00fcr Temperatur": "0\u00ba / 40\u00ba",
        "Art": "Gaming",
        "Batteriebetrieben": "Sonderzubeh\u00f6r",
        "Bildschirm": "23,8\"",
        "Ca. Temperatur": "- 20\u00baC / 60\u00b0C",
        "Diagonale des Bildschirms (cm)": "60,5 cm",
        "Empfohlene verwendung": "Haushalt",
        "Energieklassifizierung": "D",
        "Farbe": "Grau",
        "Gewicht": "3,4 kg",
        "Glanz": "250 ANSI",
        "Installationsart": "Wandmontage",
        "Kompatibel": "VESA 100 x 100 mm",
        "Kontrastverh\u00e4ltnis": "1000:1",
        "Montage": "VESA",
        "Neigungswinkel": "-5\u00ba / 21\u00ba",
        "Nicht enthalten": "Quecksilber",
        "Pixel-Dichte (dpi)": "92,56 dpi",
        "Ports": "Audio-Ausgang",
        "Seitenverh\u00e4ltnis": "16:9",
        "Steckbares Produkt": "Ja",
        "Stecker": "Sicherheitsrille",
        "Steckertyp": "EU-Stecker",
        "Winkel": "178\u00ba",
        "Zertifikat": "ENERGY STAR-Zertifizierung"
    },
    "raw_specifications_text": "Bildschirm: 23,8\"\nSteckbares Produkt: Ja\nSteckertyp: EU-Stecker\nPixel-Dichte (dpi): 92,56 dpi\nDiagonale des Bildschirms (cm): 60,5 cm\nArt: Gaming\nFarbe: Grau\nSeitenverh\u00e4ltnis: 16:9\nEnergieklassifizierung: D\nKontrastverh\u00e4ltnis: 1000:1\nPorts: Audio-Ausgang\nGlanz: 250 ANSI\nBatteriebetrieben: Sonderzubeh\u00f6r\nNicht enthalten: Quecksilber\nInstallationsart: Wandmontage\nGewicht: 3,4 kg\nWinkel: 178\u00ba\nArbeitsbereich f\u00fcr Feuchtigkeit: 10 % - 80 %\nStecker: Sicherheitsrille\nCa. Temperatur: - 20\u00baC / 60\u00b0C\nMontage: VESA\nArbeitsbereich f\u00fcr Temperatur: 0\u00ba / 40\u00ba\nZertifikat: ENERGY STAR-Zertifizierung\nEmpfohlene verwendung: Haushalt\nKompatibel: VESA 100 x 100 mm\nNeigungswinkel: -5\u00ba / 21\u00ba",
    "reference_file": "offer_reference_1824.json",
    "shop_name": "bauguru"
}