{
    "html_file": "offer_1472_1.html",
    "name": "GIGABYTE AORUS FI32Q, 31.5\"",
    "offer_link": "https://www.amazon.de/dp/B0917982X7?linkCode=xm2&camp=2025&creative=165953&smid=A3JWKAKR8XB7XF&creativeASIN=B0917982X7&tag=geizhals1-21",
    "price": 503.56,
    "raw_specifications": {
        "ASIN": "B0917982X7",
        "Amazon Bestseller-Rang": "Nr. 3,684 in Monitore",
        "Anzahl HDMI Schnittstellen": "\u200e2",
        "Anzahl USB 3.0 Schnittstellen": "\u200e3",
        "Anzahl der Lithium-Ionen-Zellen": "\u200e5",
        "Anzahl der Lithium-Metall-Zellen": "\u200e5",
        "Artikelgewicht": "\u200e10,8 Kilograms",
        "Batterien": "\u200e1 Lithium-Ionen Batterien erforderlich.",
        "Batterien enthalten": "\u200eNein",
        "Bildschirmaufl\u00f6sung": "\u200e2560 x 1440 Pixels",
        "Display-Gr\u00f6\u00dfe": "\u200e32 Zoll",
        "Durchschnittliche Kundenbewertung": "4,7  4,7 von 5 Sternen    \n    4 Sternebewertungen   \n\n\n 4,7 von 5 Sternen",
        "Garantierte Software-Updates bis": "\u200eunbekannt",
        "Gewicht Lithium-Akku": "\u200e2 Gramm",
        "Hersteller": "\u200eGigabyte",
        "Im Angebot von Amazon.de seit": "25. M\u00e4rz 2021",
        "Kapazit\u00e4t Lithium-Akku": "\u200e2 Kilowattstunden",
        "L\u00f6sung": "\u200e2560 x 1440",
        "Marke": "\u200eGigabyte",
        "Modell/Serie": "\u200eGigabyte FI32Q pantalla para PC 80 cm (31.5\") 2560 x 1440 Pixeles 2K Ultra HD LED Negro",
        "Modellnummer": "\u200eFI32Q-EK",
        "Produktabmessungen": "\u200e24,5 x 71,6 x 58,6 cm; 10,8 Kilogramm",
        "Volt": "\u200e5 Volt"
    },
    "raw_specifications_text": "Marke: \u200eGigabyte\nHersteller: \u200eGigabyte\nModell/Serie: \u200eGigabyte FI32Q pantalla para PC 80 cm (31.5\") 2560 x 1440 Pixeles 2K Ultra HD LED Negro\nProduktabmessungen: \u200e24,5 x 71,6 x 58,6 cm; 10,8 Kilogramm\nBatterien: \u200e1 Lithium-Ionen Batterien erforderlich.\nModellnummer: \u200eFI32Q-EK\nDisplay-Gr\u00f6\u00dfe: \u200e32 Zoll\nBildschirmaufl\u00f6sung: \u200e2560 x 1440 Pixels\nL\u00f6sung: \u200e2560 x 1440\nAnzahl USB 3.0 Schnittstellen: \u200e3\nAnzahl HDMI Schnittstellen: \u200e2\nVolt: \u200e5 Volt\nBatterien enthalten: \u200eNein\nKapazit\u00e4t Lithium-Akku: \u200e2 Kilowattstunden\nGewicht Lithium-Akku: \u200e2 Gramm\nAnzahl der Lithium-Ionen-Zellen: \u200e5\nAnzahl der Lithium-Metall-Zellen: \u200e5\nArtikelgewicht: \u200e10,8 Kilograms\nGarantierte Software-Updates bis: \u200eunbekannt\nASIN: B0917982X7\nDurchschnittliche Kundenbewertung: 4,7  4,7 von 5 Sternen    \n    4 Sternebewertungen   \n\n\n 4,7 von 5 Sternen\nAmazon Bestseller-Rang: Nr. 3,684 in Monitore\nIm Angebot von Amazon.de seit: 25. M\u00e4rz 2021",
    "reference_file": "offer_reference_1472.json",
    "shop_name": "Amazon.at"
}