{
    "html_file": "offer_1192_9.html",
    "name": "LC-Power LC-M27-QHD-144-C-V2, 27\"",
    "offer_link": "https://www.proshop.at/Bildschirm/LC-Power-27-Bildschirm-LC-M27-QHD-144-C-V2-LCD-monitor-curved-QHD-27-Black-4-ms-AMD-FreeSync/3041498?utm_source=geizhals&utm_medium=cpc&utm_campaign=pricesite",
    "price": 222.62,
    "raw_specifications": {
        "Abmessungen (Breite x Tiefe x H\u00f6he)": "61.7 cm x 23.8 cm x 44.6 cm - mit Fu\u00df",
        "Abmessungen (Breite x Tiefe x H\u00f6he) - mit Fu\u00df": "61.7 cm x 23.8 cm x 44.6 cm",
        "Adaptive-Sync Technologie": "AMD FreeSync",
        "Besonderheiten": "Overdrive-Technologie, FPS Mode, Low Blue Light Mode, flimmerfreie Technologie, RTS Mode, Adaptive-Sync-Technologie, an 3 Seiten ohne Blende, GamePlus",
        "Bildschirmbeschichtung": "Blendfrei",
        "Bildschirmtyp": "VA",
        "Details zu Abmessungen & Gewicht": "Mit Fu\u00df - Breite: 61.7 cm - Tiefe: 23.8 cm - H\u00f6he: 44.6 cm - Gewicht: 4.96 kg  Ohne Fu\u00df - Breite: 61.7 cm - Tiefe: 10.1 cm - H\u00f6he: 36.8 cm",
        "Diagonalabmessung": "68.58 cm (27\")",
        "Display-Typ": "LCD-Monitor / TFT-Aktivmatrix",
        "EAN": "4260070128950",
        "Eingangsanschl\u00fcsse": "3xHDMI, DisplayPort",
        "Einstellungen der Anzeigeposition": "Neigung",
        "Energie Effizienzklasse": "Klasse G",
        "Enthaltene Kabel": "1 x DisplayPort-Kabel",
        "Farbe": "Schwarz",
        "Farbraum": "83% Adobe RGB, 85% NTSC, 99% sRGB, 90% DCI-P3",
        "Farbunterst\u00fctzung": "16,7 Millionen Farben",
        "Ger\u00e4tetyp": "LCD-Monitor - 68.58 cm (27\")",
        "Geschwungener Bildschirm": "Ja (1500R)",
        "Gewicht": "4.96 kg",
        "Helligkeit": "250 cd/m\u00b2",
        "Hersteller": "LC Power",
        "Hintergrundbeleuchtungs-Technologie": "LED-Hintergrundbeleuchtung",
        "Horizontaler Betrachtungswinkel": "178",
        "Kontrast": "3000:1",
        "Leistungsmerkmale": "Rote LED-Beleuchtung",
        "Modell": "LC-M27-QHD-144-C-V2",
        "Montagekit": "Mitgeliefert",
        "Native Aufl\u00f6sung": "QHD 2560 x 1440 (DisplayPort: 144 Hz, HDMI1: 144 Hz, HDMI2: 75 Hz)",
        "Neigungswinkel": "-5/+15",
        "Pixelpitch": "0.2331 mm",
        "Produktbeschreibung": "LC Power LC-M27-QHD-144-C-V2 - LCD-Monitor - gebogen - QHD - 68.58 cm (27\")",
        "Reaktionszeit": "4 ms (Overdrive)",
        "Schnittstellen": "3 x HDMI  DisplayPort 1.2  Audio Line-Out (Mini-Klinkenstecker)",
        "Seitenverh\u00e4ltnis": "16:9",
        "Stromverbrauch SDR (eingeschaltet)": "27.4 kWh/1.000 h",
        "Stromverbrauch im Standby-Modus": "0.5 Watt",
        "Transportbreite": "70.2 cm",
        "Transportgewicht": "6.2 kg",
        "Transporth\u00f6he": "17.5 cm",
        "Transporttiefe": "45.5 cm",
        "VESA-Halterung": "75 x 75 mm",
        "Vertikaler Betrachtungswinkel": "178",
        "Waren-Nr.": "3041498",
        "Zum Hersteller": "www.lc-power.com"
    },
    "raw_specifications_text": "Hersteller: LC Power\nWaren-Nr.: 3041498\nModell: LC-M27-QHD-144-C-V2\nEAN: 4260070128950\nZum Hersteller: www.lc-power.com\nProduktbeschreibung: LC Power LC-M27-QHD-144-C-V2 - LCD-Monitor - gebogen - QHD - 68.58 cm (27\")\nGer\u00e4tetyp: LCD-Monitor - 68.58 cm (27\")\nEnergie Effizienzklasse: Klasse G\nGeschwungener Bildschirm: Ja (1500R)\nAdaptive-Sync Technologie: AMD FreeSync\nBildschirmtyp: VA\nSeitenverh\u00e4ltnis: 16:9\nNative Aufl\u00f6sung: QHD 2560 x 1440 (DisplayPort: 144 Hz, HDMI1: 144 Hz, HDMI2: 75 Hz)\nPixelpitch: 0.2331 mm\nHelligkeit: 250 cd/m\u00b2\nKontrast: 3000:1\nReaktionszeit: 4 ms (Overdrive)\nFarbunterst\u00fctzung: 16,7 Millionen Farben\nFarbraum: 83% Adobe RGB, 85% NTSC, 99% sRGB, 90% DCI-P3\nEingangsanschl\u00fcsse: 3xHDMI, DisplayPort\nEinstellungen der Anzeigeposition: Neigung\nBildschirmbeschichtung: Blendfrei\nFarbe: Schwarz\nAbmessungen (Breite x Tiefe x H\u00f6he) - mit Fu\u00df: 61.7 cm x 23.8 cm x 44.6 cm\nGewicht: 4.96 kg\nDisplay-Typ: LCD-Monitor / TFT-Aktivmatrix\nDiagonalabmessung: 68.58 cm (27\")\nHorizontaler Betrachtungswinkel: 178\nVertikaler Betrachtungswinkel: 178\nHintergrundbeleuchtungs-Technologie: LED-Hintergrundbeleuchtung\nBesonderheiten: Overdrive-Technologie, FPS Mode, Low Blue Light Mode, flimmerfreie Technologie, RTS Mode, Adaptive-Sync-Technologie, an 3 Seiten ohne Blende, GamePlus\nAbmessungen (Breite x Tiefe x H\u00f6he): 61.7 cm x 23.8 cm x 44.6 cm - mit Fu\u00df\nSchnittstellen: 3 x HDMI  DisplayPort 1.2  Audio Line-Out (Mini-Klinkenstecker)\nNeigungswinkel: -5/+15\nVESA-Halterung: 75 x 75 mm\nLeistungsmerkmale: Rote LED-Beleuchtung\nEnthaltene Kabel: 1 x DisplayPort-Kabel\nMontagekit: Mitgeliefert\nStromverbrauch SDR (eingeschaltet): 27.4 kWh/1.000 h\nStromverbrauch im Standby-Modus: 0.5 Watt\nDetails zu Abmessungen & Gewicht: Mit Fu\u00df - Breite: 61.7 cm - Tiefe: 23.8 cm - H\u00f6he: 44.6 cm - Gewicht: 4.96 kg  Ohne Fu\u00df - Breite: 61.7 cm - Tiefe: 10.1 cm - H\u00f6he: 36.8 cm\nTransportbreite: 70.2 cm\nTransporttiefe: 45.5 cm\nTransporth\u00f6he: 17.5 cm\nTransportgewicht: 6.2 kg",
    "reference_file": "offer_reference_1192.json",
    "shop_name": "Proshop.at"
}