{
    "html_file": "offer_1400_4.html",
    "name": "Dell UltraSharp U2422H (ohne Standfu\u00df), 23.8\"",
    "offer_link": "https://www.amazon.de/dp/B091P5BK8K?linkCode=xm2&camp=2025&creative=165953&smid=A3JWKAKR8XB7XF&creativeASIN=B091P5BK8K&tag=geizhals1-21",
    "price": 217.61,
    "raw_specifications": {
        "ASIN": "B091P5BK8K",
        "Amazon Bestseller-Rang": "Nr. 220,989 in Computer & Zubeh\u00f6r (Siehe Top 100 in Computer & Zubeh\u00f6r)  Nr. 3,300 in Monitore",
        "Anzahl HDMI Schnittstellen": "\u200e1",
        "Artikelgewicht": "\u200e3,52 Kilograms",
        "Batterien enthalten": "\u200eNein",
        "Bildschirmaufl\u00f6sung": "\u200e1920x1080",
        "Display-Gr\u00f6\u00dfe": "\u200e24 Zoll",
        "Durchschnittliche Kundenbewertung": "4,0  4,0 von 5 Sternen    \n    1 Sternebewertung   \n\n\n 4,0 von 5 Sternen",
        "Farbe": "\u200eschwarz",
        "Garantierte Software-Updates bis": "\u200eunbekannt",
        "Gewicht Lithium-Akku": "\u200e13 Kilogramm",
        "Hersteller": "\u200eDell Computers",
        "Im Angebot von Amazon.de seit": "30. M\u00e4rz 2021",
        "L\u00f6sung": "\u200e1920 x 1080 Pixels",
        "Marke": "\u200eDell",
        "Modell/Serie": "\u200eU2422H_WOST",
        "Modellnummer": "\u200eDELL-U2422HWOS",
        "Produktabmessungen": "\u200e4,85 x 53,76 x 31,07 cm; 3,52 Kilogramm",
        "Prozessortyp": "\u200eOthers",
        "Volt": "\u200e240 Volt"
    },
    "raw_specifications_text": "Marke: \u200eDell\nHersteller: \u200eDell Computers\nModell/Serie: \u200eU2422H_WOST\nProduktabmessungen: \u200e4,85 x 53,76 x 31,07 cm; 3,52 Kilogramm\nModellnummer: \u200eDELL-U2422HWOS\nFarbe: \u200eschwarz\nDisplay-Gr\u00f6\u00dfe: \u200e24 Zoll\nBildschirmaufl\u00f6sung: \u200e1920x1080\nL\u00f6sung: \u200e1920 x 1080 Pixels\nProzessortyp: \u200eOthers\nAnzahl HDMI Schnittstellen: \u200e1\nVolt: \u200e240 Volt\nBatterien enthalten: \u200eNein\nGewicht Lithium-Akku: \u200e13 Kilogramm\nArtikelgewicht: \u200e3,52 Kilograms\nGarantierte Software-Updates bis: \u200eunbekannt\nASIN: B091P5BK8K\nDurchschnittliche Kundenbewertung: 4,0  4,0 von 5 Sternen    \n    1 Sternebewertung   \n\n\n 4,0 von 5 Sternen\nAmazon Bestseller-Rang: Nr. 220,989 in Computer & Zubeh\u00f6r (Siehe Top 100 in Computer & Zubeh\u00f6r)  Nr. 3,300 in Monitore\nIm Angebot von Amazon.de seit: 30. M\u00e4rz 2021",
    "reference_file": "offer_reference_1400.json",
    "shop_name": "Amazon.at"
}