{
    "html_file": "offer_1897_13.html",
    "name": "Philips S-line 242S1AE, 23.8\"",
    "offer_link": "https://www.ditech.at/details.php?artnr=305129",
    "price": 152.9,
    "raw_specifications": {
        "Abmessungen (BxHxT)": "540x501x205mm (mit Standfu\u00df),  540x323x51mm (ohne Standfu\u00df)",
        "Adaptive Sync": "Ja",
        "Anschl\u00fcsse - DVI-D": "1",
        "Anschl\u00fcsse - DisplayPort 1.2": "1",
        "Anschl\u00fcsse - HDMI 1.4": "1",
        "Anschl\u00fcsse - VGA": "1",
        "Anwendung": "station\u00e4r",
        "Audio": "Lautsprecher (2x 2W),  1x Line-In,  1x Line-Out",
        "Aufl\u00f6sung": "1920x1080",
        "Beschichtung": "matt (non-glare),  H\u00e4rtegrad 3H",
        "Besonderheiten": "Slim Bezel,  mechanische Tasten,  Sicherheitsschloss (Kensington),  TCO 9 zertifiziert,  Philips SmartImage",
        "Bildwiederholfrequenz": "75Hz",
        "Blickwinkel": "178\u00b0/178\u00b0",
        "Diagonale": "23.8\"/60.5cm",
        "Energieeffizienzklasse alt (A+++ bis D)": "A+",
        "Energieeffizienzklasse alt (A+++ bis G)": "A+",
        "Energieverbrauch SDR": "16kWh/1000h",
        "Ergonomie": "130mm (h\u00f6henverstellbar),  \u00b190\u00b0 (Pivot),  \u00b1180\u00b0 (drehbar),  +25\u00b0/-5\u00b0 (neigbar),  keine Angabe (Schr\u00e4glage)",
        "FRC": "unbekannt",
        "Farbe": "schwarz",
        "Farbraum - sRGB": "107%",
        "Farbtiefe": "8bit (16.7 Mio. Farben)",
        "Form": "gerade (flat)",
        "Gewicht": "4.83kg (mit Standfu\u00df),  2.98kg (ohne Standfu\u00df)",
        "HDR": "N/A",
        "Helligkeit": "250cd/m\u00b2",
        "Herstellergarantie": "zwei Jahre",
        "Hintergrundbeleuchtung": "White-LED,  flicker-free,  Blaulichtfilter",
        "Jahresverbrauch alt (A+++ bis D)": "26.28kWh",
        "Jahresverbrauch alt (A+++ bis G)": "26.28kWh",
        "Kontrast - dynamisch": "50.000.000:1",
        "Kontrast - statisch": "1.000:1",
        "Lautsprecher": "Ja",
        "Leistungsaufnahme": "keine Angabe (maximal),  13.6W (typisch),  18W (Energielabel alt A+++ bis G),  0.3W (Standby)",
        "Panel": "IPS",
        "Reaktionszeit - GtG": "4ms",
        "Screen-to-Body-Ratio": "89.5% (berechnet)",
        "Seitenverh\u00e4ltnis": "16:9",
        "Signalfrequenz": "30-85kHz (horizontal),  48-75Hz (vertikal)",
        "Stromversorgung": "AC-In (internes Netzteil)",
        "USB-Hub In": "N/A",
        "USB-Hub Out": "N/A",
        "USB-Schreibweise": "Link",
        "Unsch\u00e4rfereduktionsfunktion": "N/A",
        "VESA": "100x100 (belegt)",
        "Weitere Anschl\u00fcsse": "N/A"
    },
    "raw_specifications_text": "Abmessungen (BxHxT): 540x501x205mm (mit Standfu\u00df),  540x323x51mm (ohne Standfu\u00df)\nAdaptive Sync: Ja\nAnschl\u00fcsse - DisplayPort 1.2: 1\nAnschl\u00fcsse - DVI-D: 1\nAnschl\u00fcsse - HDMI 1.4: 1\nAnschl\u00fcsse - VGA: 1\nAnwendung: station\u00e4r\nAudio: Lautsprecher (2x 2W),  1x Line-In,  1x Line-Out\nAufl\u00f6sung: 1920x1080\nBeschichtung: matt (non-glare),  H\u00e4rtegrad 3H\nBesonderheiten: Slim Bezel,  mechanische Tasten,  Sicherheitsschloss (Kensington),  TCO 9 zertifiziert,  Philips SmartImage\nBildwiederholfrequenz: 75Hz\nBlickwinkel: 178\u00b0/178\u00b0\nDiagonale: 23.8\"/60.5cm\nEnergieeffizienzklasse alt (A+++ bis D): A+\nEnergieeffizienzklasse alt (A+++ bis G): A+\nEnergieverbrauch SDR: 16kWh/1000h\nErgonomie: 130mm (h\u00f6henverstellbar),  \u00b190\u00b0 (Pivot),  \u00b1180\u00b0 (drehbar),  +25\u00b0/-5\u00b0 (neigbar),  keine Angabe (Schr\u00e4glage)\nFarbe: schwarz\nFarbraum - sRGB: 107%\nFarbtiefe: 8bit (16.7 Mio. Farben)\nForm: gerade (flat)\nFRC: unbekannt\nGewicht: 4.83kg (mit Standfu\u00df),  2.98kg (ohne Standfu\u00df)\nHDR: N/A\nHelligkeit: 250cd/m\u00b2\nHerstellergarantie: zwei Jahre\nHintergrundbeleuchtung: White-LED,  flicker-free,  Blaulichtfilter\nJahresverbrauch alt (A+++ bis D): 26.28kWh\nJahresverbrauch alt (A+++ bis G): 26.28kWh\nKontrast - dynamisch: 50.000.000:1\nKontrast - statisch: 1.000:1\nLautsprecher: Ja\nLeistungsaufnahme: keine Angabe (maximal),  13.6W (typisch),  18W (Energielabel alt A+++ bis G),  0.3W (Standby)\nPanel: IPS\nReaktionszeit - GtG: 4ms\nScreen-to-Body-Ratio: 89.5% (berechnet)\nSeitenverh\u00e4ltnis: 16:9\nSignalfrequenz: 30-85kHz (horizontal),  48-75Hz (vertikal)\nStromversorgung: AC-In (internes Netzteil)\nUnsch\u00e4rfereduktionsfunktion: N/A\nUSB-Hub In: N/A\nUSB-Hub Out: N/A\nUSB-Schreibweise: Link\nVESA: 100x100 (belegt)\nWeitere Anschl\u00fcsse: N/A",
    "reference_file": "offer_reference_1897.json",
    "shop_name": "DiTech.at"
}