{
    "html_file": "offer_1995_0.html",
    "name": "Acer Predator XB3 XB253QGPbmiiprzx, 24.5\"",
    "offer_link": "https://www.amazon.de/dp/B093ZTJLGN?linkCode=xm2&camp=2025&creative=165953&smid=A3JWKAKR8XB7XF&creativeASIN=B093ZTJLGN&tag=geizhals1-21",
    "price": 180.5,
    "raw_specifications": {
        "ASIN": "B093ZTJLGN",
        "Amazon Bestseller-Rang": "Nr. 5,670 in Computer & Zubeh\u00f6r (Siehe Top 100 in Computer & Zubeh\u00f6r)  Nr. 126 in Monitore",
        "Anzahl HDMI Schnittstellen": "\u200e2",
        "Artikelgewicht": "\u200e5,3 Kilograms",
        "Batterien enthalten": "\u200eNein",
        "Bildschirmaufl\u00f6sung": "\u200e1920x1080",
        "Display-Gr\u00f6\u00dfe": "\u200e24,5 Zoll",
        "Durchschnittliche Kundenbewertung": "4,7  4,7 von 5 Sternen    \n    353 Sternebewertungen   \n\n\n 4,7 von 5 Sternen",
        "Farbe": "\u200eSchwarz",
        "Garantierte Software-Updates bis": "\u200eunbekannt",
        "Hersteller": "\u200eAcer",
        "Im Angebot von Amazon.de seit": "1. Mai 2021",
        "L\u00f6sung": "\u200e1920 x 1080 Pixels",
        "Marke": "\u200eAcer",
        "Modell/Serie": "\u200eAcer Predator XB253QGP",
        "Modellnummer": "\u200eUM.KX3EE.P14",
        "Produktabmessungen": "\u200e23,6 x 55,8 x 39,8 cm; 5,3 Kilogramm"
    },
    "raw_specifications_text": "Marke: \u200eAcer\nHersteller: \u200eAcer\nModell/Serie: \u200eAcer Predator XB253QGP\nProduktabmessungen: \u200e23,6 x 55,8 x 39,8 cm; 5,3 Kilogramm\nModellnummer: \u200eUM.KX3EE.P14\nFarbe: \u200eSchwarz\nDisplay-Gr\u00f6\u00dfe: \u200e24,5 Zoll\nBildschirmaufl\u00f6sung: \u200e1920x1080\nL\u00f6sung: \u200e1920 x 1080 Pixels\nAnzahl HDMI Schnittstellen: \u200e2\nBatterien enthalten: \u200eNein\nArtikelgewicht: \u200e5,3 Kilograms\nGarantierte Software-Updates bis: \u200eunbekannt\nASIN: B093ZTJLGN\nDurchschnittliche Kundenbewertung: 4,7  4,7 von 5 Sternen    \n    353 Sternebewertungen   \n\n\n 4,7 von 5 Sternen\nAmazon Bestseller-Rang: Nr. 5,670 in Computer & Zubeh\u00f6r (Siehe Top 100 in Computer & Zubeh\u00f6r)  Nr. 126 in Monitore\nIm Angebot von Amazon.de seit: 1. Mai 2021",
    "reference_file": "offer_reference_1995.json",
    "shop_name": "Amazon.at"
}