{
    "html_file": "offer_1523_6.html",
    "name": "ViewSonic VG2439Smh-2, 23.6\"",
    "offer_link": "https://www.mylemon.at/artikel/viewsonic/vg2439smh_2/24-vg2439smh-2-full-hd.html",
    "price": 140.05,
    "raw_specifications": {
        "3D": "Nein",
        "AC Eingangsfrequenz": "50 - 60 Hz",
        "AC Eingangsspannung": "100 - 240 V",
        "AMD FreeSync": "Nein",
        "Anzahl DisplayPort Anschl\u00fcsse": "1",
        "Anzahl HDMI-Anschl\u00fcsse": "1",
        "Anzahl VGA (D-Sub) Anschl\u00fcsse": "1",
        "Anzahl der Farben des Displays": "16,78 Millionen Farben",
        "Anzahl der Lautsprecher": "2",
        "Anzahl der nachgeschalteten Steckpl\u00e4tze vom Typ USB-A": "2",
        "Anzahl der vorgeschalteten Steckpl\u00e4tze": "1",
        "Artikelnummer": "MSAY7KL",
        "Audioanschl\u00fcsse": "Ja",
        "Audioausgang": "Ja",
        "Aufl\u00f6sung": "1920x1080",
        "Besonderheiten": "60 Hz, Lautsprecher",
        "Betriebstemperatur": "0 - 40 \u00b0C",
        "Bildschirmdiagonale": "61 cm (24\")",
        "Bildschirmform": "Flach",
        "Bildschirmtechnologie": "LCD",
        "Bildwinkel, horizontal": "178\u00b0",
        "Bildwinkel, vertikal": "178\u00b0",
        "Breite (ohne Standfu\u00df)": "560,3 mm",
        "DVI Anschluss": "Nein",
        "Digital horizontale Frequenz": "15 - 82 kHz",
        "Digital vertikale Frequenz": "50 - 75 Hz",
        "Display": "LCD",
        "Display-Aufl\u00f6sung": "1920 x 1080 Pixel",
        "Displaygr\u00f6\u00dfe": "23,6 Zoll",
        "EAN": "0766907801910",
        "Eingebaute Lautsprecher": "Ja",
        "Energieeffizienzklasse (SDR)": "F",
        "Energieverbrauch (SDR) pro 1.000 Stunden": "22 kWh",
        "Ergonomie": "H\u00f6henverstellbar, Pivot (90 Grad drehbar), Schwenkbar, Neigbar",
        "Ger\u00e4tebreite (inkl. Fu\u00df)": "560,3 mm",
        "Ger\u00e4teh\u00f6he (inkl. Fu\u00df)": "435,2 mm",
        "Ger\u00e4tetiefe (inkl. Fu\u00df)": "239,6 mm",
        "Gewicht (mit St\u00e4nder)": "4,99 kg",
        "Gewicht (ohne St\u00e4nder)": "3,53 kg",
        "HD-Typ": "Full HD",
        "Helligkeit": "250 cd/m\u00b2",
        "Helligkeit (typisch)": "250 cd/m\u00b2",
        "Hersteller Artikelnummer": "VG2439SMH-2",
        "Horizontaler Scanbereich": "24 - 82 kHz",
        "H\u00f6he (ohne Standfu\u00df)": "332,7 mm",
        "H\u00f6heneinstellung": "13,5 cm",
        "H\u00f6henverstellung": "Ja",
        "Integrierte Kamera": "Nein",
        "Integrierter Kartenleser": "Nein",
        "Integrierter USB-Hub": "Ja",
        "Kontrastverh\u00e4ltnis": "3000:1",
        "Kontrastverh\u00e4ltnis (dynamisch)": "20000000:1",
        "Mac-Kompatibilit\u00e4t": "Ja",
        "Mitgelieferte Kabel": "AC, Audio (3,5 mm), DisplayPort, USB",
        "NVIDIA G-SYNC": "Nein",
        "Natives Seitenverh\u00e4ltnis": "16:9",
        "Neigungswinkelbereich": "20 - -5\u00b0",
        "Paketgewicht": "6,5 kg",
        "Panel": "VA",
        "Panel-Montage-Schnittstelle": "100 x 100 mm",
        "Panel-Typ": "TFT",
        "Pivot Winkel": "0 - 90\u00b0",
        "Produktfarbe": "Schwarz",
        "RMS-Leistung": "4 W",
        "Reaktionszeit": "5 ms",
        "Relative Luftfeuchtigkeit in Betrieb": "20 - 90%",
        "Schnellstart\u00fcbersicht": "Ja",
        "Schwenkbar": "Ja",
        "Schwenkwinkelbereich": "0 - 360\u00b0",
        "Sichtbare Gr\u00f6\u00dfe (horizontal)": "52,1 cm",
        "Sichtbare Gr\u00f6\u00dfe (vertikal)": "29,3 cm",
        "Stromverbrauch (Standardbetrieb)": "18,7 W",
        "Stromverbrauch (Standby)": "0,5 W",
        "TV Tuner integriert": "Nein",
        "Tiefe (ohne Standfu\u00df)": "58,2 mm",
        "Touchscreen": "Nein",
        "USB-Upstream-Porttyp": "USB Typ-B",
        "Unterst\u00fctzte Grafik-Aufl\u00f6sungen": "1920 x 1080 (HD 1080)",
        "VESA Halterung": "100x100 mm",
        "VESA-Halterung": "Ja",
        "Verpackungsart": "Box",
        "Verpackungsbreite": "652 mm",
        "Verpackungsh\u00f6he": "420 mm",
        "Verpackungstiefe": "195 mm",
        "Vertikaler Scanbereich": "50 - 75 Hz",
        "Video Anschl\u00fcsse": "1x VGA, 1x HDMI, 1x DisplayPort, 1x USB, 2x USB",
        "Warentarifnummer (HS)": "85285210",
        "Zertifizierung": "CE, RoHS, REACH, WEEE, EAC, UkrSEPRO, EEL, TCO 7.0, GS, BSMI, RCM, MEPS, PSE, VCCI"
    },
    "raw_specifications_text": "Displaygr\u00f6\u00dfe: 23,6 Zoll\nAufl\u00f6sung: 1920x1080\nPanel: VA\nReaktionszeit: 5 ms\nVideo Anschl\u00fcsse: 1x VGA, 1x HDMI, 1x DisplayPort, 1x USB, 2x USB\nErgonomie: H\u00f6henverstellbar, Pivot (90 Grad drehbar), Schwenkbar, Neigbar\nVESA Halterung: 100x100 mm\nHelligkeit: 250 cd/m\u00b2\nBesonderheiten: 60 Hz, Lautsprecher\nHersteller Artikelnummer: VG2439SMH-2\nEAN: 0766907801910\nArtikelnummer: MSAY7KL\nBildschirmdiagonale: 61 cm (24\")\nDisplay-Aufl\u00f6sung: 1920 x 1080 Pixel\nNatives Seitenverh\u00e4ltnis: 16:9\nBildschirmtechnologie: LCD\nTouchscreen: Nein\nHD-Typ: Full HD\nPanel-Typ: TFT\nBildschirmform: Flach\nKontrastverh\u00e4ltnis: 3000:1\nAnzahl der Farben des Displays: 16,78 Millionen Farben\nHelligkeit (typisch): 250 cd/m\u00b2\nUnterst\u00fctzte Grafik-Aufl\u00f6sungen: 1920 x 1080 (HD 1080)\nKontrastverh\u00e4ltnis (dynamisch): 20000000:1\nBildwinkel, horizontal: 178\u00b0\nBildwinkel, vertikal: 178\u00b0\nHorizontaler Scanbereich: 24 - 82 kHz\nVertikaler Scanbereich: 50 - 75 Hz\nSichtbare Gr\u00f6\u00dfe (horizontal): 52,1 cm\nSichtbare Gr\u00f6\u00dfe (vertikal): 29,3 cm\nDigital horizontale Frequenz: 15 - 82 kHz\nDigital vertikale Frequenz: 50 - 75 Hz\n3D: Nein\nNVIDIA G-SYNC: Nein\nAMD FreeSync: Nein\nEingebaute Lautsprecher: Ja\nIntegrierte Kamera: Nein\nAnzahl der Lautsprecher: 2\nRMS-Leistung: 4 W\nProduktfarbe: Schwarz\nZertifizierung: CE, RoHS, REACH, WEEE, EAC, UkrSEPRO, EEL, TCO 7.0, GS, BSMI, RCM, MEPS, PSE, VCCI\nIntegrierter USB-Hub: Ja\nUSB-Upstream-Porttyp: USB Typ-B\nAnzahl der vorgeschalteten Steckpl\u00e4tze: 1\nAnzahl der nachgeschalteten Steckpl\u00e4tze vom Typ USB-A: 2\nAnzahl VGA (D-Sub) Anschl\u00fcsse: 1\nDVI Anschluss: Nein\nAnzahl HDMI-Anschl\u00fcsse: 1\nAnzahl DisplayPort Anschl\u00fcsse: 1\nAudioanschl\u00fcsse: Ja\nAudioausgang: Ja\nIntegrierter Kartenleser: Nein\nVESA-Halterung: Ja\nH\u00f6henverstellung: Ja\nPanel-Montage-Schnittstelle: 100 x 100 mm\nH\u00f6heneinstellung: 13,5 cm\nPivot Winkel: 0 - 90\u00b0\nSchwenkbar: Ja\nSchwenkwinkelbereich: 0 - 360\u00b0\nNeigungswinkelbereich: 20 - -5\u00b0\nEnergieeffizienzklasse (SDR): F\nEnergieverbrauch (SDR) pro 1.000 Stunden: 22 kWh\nStromverbrauch (Standardbetrieb): 18,7 W\nStromverbrauch (Standby): 0,5 W\nAC Eingangsspannung: 100 - 240 V\nAC Eingangsfrequenz: 50 - 60 Hz\nBetriebstemperatur: 0 - 40 \u00b0C\nRelative Luftfeuchtigkeit in Betrieb: 20 - 90%\nMitgelieferte Kabel: AC, Audio (3,5 mm), DisplayPort, USB\nSchnellstart\u00fcbersicht: Ja\nGer\u00e4tebreite (inkl. Fu\u00df): 560,3 mm\nGer\u00e4tetiefe (inkl. Fu\u00df): 239,6 mm\nGer\u00e4teh\u00f6he (inkl. Fu\u00df): 435,2 mm\nGewicht (mit St\u00e4nder): 4,99 kg\nBreite (ohne Standfu\u00df): 560,3 mm\nTiefe (ohne Standfu\u00df): 58,2 mm\nH\u00f6he (ohne Standfu\u00df): 332,7 mm\nGewicht (ohne St\u00e4nder): 3,53 kg\nVerpackungsbreite: 652 mm\nVerpackungstiefe: 195 mm\nVerpackungsh\u00f6he: 420 mm\nPaketgewicht: 6,5 kg\nVerpackungsart: Box\nWarentarifnummer (HS): 85285210\nDisplay: LCD\nTV Tuner integriert: Nein\nMac-Kompatibilit\u00e4t: Ja",
    "reference_file": "offer_reference_1523.json",
    "shop_name": "mylemon.at"
}