{
    "html_file": "offer_271_3.html",
    "name": "LG UltraWide 49WL95CP-W, 49\"",
    "offer_link": "https://direkt.jacob.de/produkte/lg-monitor-49wl95cp-w-49wl95cp-w-aeu-artnr-8315755.html?utm_source=geizhals&utm_medium=cpc&utm_campaign=Preisvergleich&ref=103",
    "price": 1136.45,
    "raw_specifications": {
        "AC Eingangsfrequenz": "50 - 60 Hz",
        "AC Eingangsspannung": "100 - 240 V",
        "AMD FreeSync": "Nein",
        "Anzahl DisplayPort Anschl\u00fcsse": "1",
        "Anzahl HDMI-Anschl\u00fcsse": "2",
        "Anzahl der Farben des Displays": "1,07 Milliarden Farben",
        "Anzahl der Lautsprecher": "2",
        "Bildschirmdiagonale": "124,5 cm (49\" )",
        "Bildschirmdiagonale (cm)": "124,46 cm",
        "Bildschirmform": "Gebogen",
        "Bildwinkel, horizontal": "178\u00b0",
        "Bildwinkel, vertikal": "178\u00b0",
        "Blendfreier Bildschirm": "Ja",
        "Breite (ohne Standfu\u00df)": "121,5 cm",
        "Display-Aufl\u00f6sung": "5120 x 1440 Pixel",
        "DisplayPorts-Version": "1.4",
        "Eingebaute Lautsprecher": "Ja",
        "Energieeffizienzklasse (HDR)": "G",
        "Energieeffizienzklasse (SDR)": "G",
        "Energieverbrauch (HDR) pro 1.000 Stunden": "77 kWh",
        "Energieverbrauch (SDR) pro 1.000 Stunden": "45 kWh",
        "Farbskala": "99%",
        "Flimmerfreie Technologie": "Ja",
        "Ger\u00e4tebreite (inkl. Fu\u00df)": "1215,1 mm",
        "Ger\u00e4tetiefe (inkl. Fu\u00df)": "307,3 mm",
        "Gewicht (mit St\u00e4nder)": "15,2 kg",
        "Gewicht (ohne St\u00e4nder)": "12,6 kg",
        "HD-Typ": "DQHD",
        "HDMI": "Ja",
        "Helligkeit (typisch)": "350 cd/m\u00b2",
        "High Dynamic Range Video (HDR) Unterst\u00fctzung": "Ja",
        "H\u00f6he (ohne Standfu\u00df)": "36,6 cm",
        "H\u00f6henverstellung": "Ja",
        "Integrierte Kamera": "Nein",
        "Integrierter USB-Hub": "Nein",
        "Kabelsperre-Slot": "Nein",
        "Kopfh\u00f6rerausgang": "Ja",
        "Maximale Bildwiederholrate": "60 Hz",
        "NVIDIA G-SYNC": "Nein",
        "Natives Seitenverh\u00e4ltnis": "32:9",
        "Neigungsverstellung": "Ja",
        "Oberfl\u00e4chenh\u00e4rte": "3H",
        "Paketgewicht": "19,9 kg",
        "Panel-Montage-Schnittstelle": "100 x 100 mm",
        "Panel-Typ": "IPS",
        "Pixel Abstand": "0,234 x 0,234 mm",
        "Produktfarbe": "Silber",
        "RGB-Farbraum": "sRGB",
        "RMS-Leistung": "10 W",
        "Reaktionszeit": "5 ms",
        "Schwenkbar": "Ja",
        "Stromverbrauch (Standardbetrieb)": "80 W",
        "Stromverbrauch (Standby)": "0,5 W",
        "Stromverbrauch (aus)": "0,3 W",
        "Stromverbrauch (max.)": "200 W",
        "Technologie mit hohem Dynamikbereich (HDR)": "High Dynamic Range 10 (HDR10)",
        "Tiefe (ohne Standfu\u00df)": "11,4 cm",
        "Touchscreen": "Nein",
        "USB Power Delivery": "Ja",
        "USB-Stromversorgung bis zu": "85 W",
        "VESA-Halterung": "Ja",
        "Verpackungsbreite": "1330 mm",
        "Verpackungsh\u00f6he": "298 mm",
        "Verpackungstiefe": "490 mm",
        "Wandmontage": "Ja"
    },
    "raw_specifications_text": "Bildschirmdiagonale: 124,5 cm (49\" )\nDisplay-Aufl\u00f6sung: 5120 x 1440 Pixel\nNatives Seitenverh\u00e4ltnis: 32:9\nTouchscreen: Nein\nHD-Typ: DQHD\nPanel-Typ: IPS\nBildschirmform: Gebogen\nMaximale Bildwiederholrate: 60 Hz\nAnzahl der Farben des Displays: 1,07 Milliarden Farben\nHelligkeit (typisch): 350 cd/m\u00b2\nReaktionszeit: 5 ms\nBlendfreier Bildschirm: Ja\nBildwinkel, horizontal: 178\u00b0\nBildwinkel, vertikal: 178\u00b0\nPixel Abstand: 0,234 x 0,234 mm\nBildschirmdiagonale (cm): 124,46 cm\nHigh Dynamic Range Video (HDR) Unterst\u00fctzung: Ja\nTechnologie mit hohem Dynamikbereich (HDR): High Dynamic Range 10 (HDR10)\nOberfl\u00e4chenh\u00e4rte: 3H\nRGB-Farbraum: sRGB\nFarbskala: 99%\nNVIDIA G-SYNC: Nein\nAMD FreeSync: Nein\nFlimmerfreie Technologie: Ja\nEingebaute Lautsprecher: Ja\nIntegrierte Kamera: Nein\nAnzahl der Lautsprecher: 2\nRMS-Leistung: 10 W\nProduktfarbe: Silber\nIntegrierter USB-Hub: Nein\nHDMI: Ja\nKopfh\u00f6rerausgang: Ja\nUSB Power Delivery: Ja\nUSB-Stromversorgung bis zu: 85 W\nAnzahl HDMI-Anschl\u00fcsse: 2\nAnzahl DisplayPort Anschl\u00fcsse: 1\nDisplayPorts-Version: 1.4\nVESA-Halterung: Ja\nKabelsperre-Slot: Nein\nH\u00f6henverstellung: Ja\nPanel-Montage-Schnittstelle: 100 x 100 mm\nWandmontage: Ja\nSchwenkbar: Ja\nNeigungsverstellung: Ja\nEnergieeffizienzklasse (SDR): G\nEnergieeffizienzklasse (HDR): G\nEnergieverbrauch (SDR) pro 1.000 Stunden: 45 kWh\nEnergieverbrauch (HDR) pro 1.000 Stunden: 77 kWh\nStromverbrauch (Standardbetrieb): 80 W\nStromverbrauch (Standby): 0,5 W\nStromverbrauch (max.): 200 W\nStromverbrauch (aus): 0,3 W\nAC Eingangsspannung: 100 - 240 V\nAC Eingangsfrequenz: 50 - 60 Hz\nGer\u00e4tebreite (inkl. Fu\u00df): 1215,1 mm\nGer\u00e4tetiefe (inkl. Fu\u00df): 307,3 mm\nGewicht (mit St\u00e4nder): 15,2 kg\nBreite (ohne Standfu\u00df): 121,5 cm\nTiefe (ohne Standfu\u00df): 11,4 cm\nH\u00f6he (ohne Standfu\u00df): 36,6 cm\nGewicht (ohne St\u00e4nder): 12,6 kg\nVerpackungsbreite: 1330 mm\nVerpackungstiefe: 490 mm\nVerpackungsh\u00f6he: 298 mm\nPaketgewicht: 19,9 kg",
    "reference_file": "offer_reference_271.json",
    "shop_name": "Jacob Elektronik direkt (AT)"
}