{
    "html_file": "offer_750_46.html",
    "name": "Dell E2423HN, 23.8\"",
    "offer_link": "https://www.alternate.at/Dell/E2423HN-LED-Monitor/html/product/1897793?partner=AtGeizhalsat&campaign=Monitor/Dell/1897793",
    "price": 144.9,
    "raw_specifications": {
        "": "Kontrast",
        "Abmessungen": "Breite: 55,264 cm x H\u00f6he: 42,035 cm x Tiefe/L\u00e4nge: 17,1 cm",
        "Anschl\u00fcsse": "1x DisplayPort-Eingang, (DisplayPort-Version: 1.2), 1x VGA-Eingang",
        "Bild": "Format",
        "Bildschirmaufl\u00f6sung": "1.920 x 1.080 Pixel",
        "Bildschirmdiagonale": "61 cm (24 Zoll)",
        "EAN": "5397184656914",
        "Energieeffizienzklasse (SDR)": "E (A - G)",
        "Energieverbauch pro 1000 Stunden (SDR)": "16 kWh",
        "Ergonomie": "Neigbar",
        "Farbe": "schwarz",
        "Hersteller-Nr.": "DELL-E2423HN",
        "Leistungsaufnahme im Bereitschafts- und Aus-Zustand": "0,3 Watt / 0,3 Watt",
        "Leistungsaufnahme im Ein-Zustand bei Standard-Dynamikumfang (SDR)": "16 Watt",
        "Stromversorgung": "Sleep Mode",
        "Typ": "LED-Monitor",
        "Wandhalterung": "VESA kompatibel (100 x 100 mm)",
        "Zubeh\u00f6r": "Vorhanden"
    },
    "raw_specifications_text": "Energieeffizienzklasse (SDR): E (A - G)\nEnergieverbauch pro 1000 Stunden (SDR): 16 kWh\nLeistungsaufnahme im Ein-Zustand bei Standard-Dynamikumfang (SDR): 16 Watt\nLeistungsaufnahme im Bereitschafts- und Aus-Zustand: 0,3 Watt / 0,3 Watt\nBildschirmdiagonale: 61 cm (24 Zoll)\nBildschirmaufl\u00f6sung: 1.920 x 1.080 Pixel\nTyp: LED-Monitor\nFarbe: schwarz\nEAN: 5397184656914\nHersteller-Nr.: DELL-E2423HN\nBild: Format\n: Kontrast\nAnschl\u00fcsse: 1x DisplayPort-Eingang, (DisplayPort-Version: 1.2), 1x VGA-Eingang\nErgonomie: Neigbar\nStromversorgung: Sleep Mode\nWandhalterung: VESA kompatibel (100 x 100 mm)\nZubeh\u00f6r: Vorhanden\nAbmessungen: Breite: 55,264 cm x H\u00f6he: 42,035 cm x Tiefe/L\u00e4nge: 17,1 cm",
    "reference_file": "offer_reference_750.json",
    "shop_name": "Alternate.at"
}