{
    "html_file": "offer_1477_7.html",
    "name": "AOC 24B2XHM2, 23.8\"",
    "offer_link": "https://direkt.jacob.de/produkte/aoc-basic-line-24b2xhm2-24b2xhm2-artnr-6988265.html?utm_source=geizhals&utm_medium=cpc&utm_campaign=Preisvergleich&ref=103",
    "price": 89.74,
    "raw_specifications": {
        "AC Eingangsfrequenz": "50/60 Hz",
        "AC Eingangsspannung": "100 - 240 V",
        "AMD FreeSync": "Nein",
        "Anzahl HDMI-Anschl\u00fcsse": "1",
        "Anzahl OSD-Sprachen": "16",
        "Anzahl VGA (D-Sub) Anschl\u00fcsse": "1",
        "Anzahl der Farben des Displays": "16,78 Millionen Farben",
        "Audioanschl\u00fcsse": "Nein",
        "Bildschirmaufl\u00f6sung": "1920 x 1080 Pixel",
        "Bildschirmdiagonale": "60,5 cm (23.8\" )",
        "Bildschirmdisplay (OSD)-Sprachen": "Vereinfachtes Chinesisch, Traditionelles Chinesisch, Tschechisch, Deutsch, Niederl\u00e4ndisch, Englisch, Spanisch, Finnisch, Franz\u00f6sisch, Italienisch, Japanisch, Koreanisch, Polnisch, Portugiesisch, Russisch, SER",
        "Bildschirmform": "Flach",
        "Bildschirmtechnologie": "LCD",
        "Blickwinkel, horizontal": "178\u00b0",
        "Blickwinkel, vertikal": "178\u00b0",
        "Breite (ohne Standfu\u00df)": "53,9 cm",
        "DVI Anschluss": "Nein",
        "Display-Oberfl\u00e4che": "Matt",
        "Eingebaute Lautsprecher": "Nein",
        "Energie-Effizienzklasse": "A+",
        "Energieeffizienzskala": "A+++ bis D",
        "Externes Netzteil": "Ja",
        "Farbintensit\u00e4t": "8 Bit",
        "Flimmerfreie Technologie": "Ja",
        "Fu\u00dffarbe": "Schwarz",
        "Ger\u00e4tebreite (inkl. Fu\u00df)": "539,5 mm",
        "Ger\u00e4teh\u00f6he (inkl. Fu\u00df)": "418,4 mm",
        "Ger\u00e4tetiefe (inkl. Fu\u00df)": "170,9 mm",
        "Gewicht (mit St\u00e4nder)": "2,7 kg",
        "Gewicht (ohne St\u00e4nder)": "2,7 kg",
        "HD-Typ": "Full HD",
        "HDMI": "Ja",
        "HDMI-Version": "1.4",
        "Helligkeit (typisch)": "250 cd/m\u00b2",
        "Horizontaler Scanbereich": "30 - 83 kHz",
        "H\u00f6he (ohne Standfu\u00df)": "41,8 cm",
        "H\u00f6henverstellung": "Nein",
        "Integrierte Kamera": "Nein",
        "Integrierter USB-Hub": "Nein",
        "J\u00e4hrlicher Energieverbrauch": "26 kWh",
        "Kabelsperre-Slot": "Ja",
        "Kontrastverh\u00e4ltnis": "3000:1",
        "Kontrastverh\u00e4ltnis (dynamisch)": "20000000:1",
        "Kopfh\u00f6rer-Konnektivit\u00e4t": "3,5 mm",
        "Kopfh\u00f6rerausgang": "Ja",
        "Kopfh\u00f6rerausg\u00e4nge": "1",
        "Low-Blue-Light-Technologie": "Ja",
        "Marktpositionierung": "Haus",
        "Maximale Bildwiederholrate": "75 Hz",
        "Mitgelieferte Kabel": "AC",
        "Mittlere Betriebsdauer zwischen Ausf\u00e4llen (MTBF)": "50000 h",
        "NVIDIA G-SYNC": "Nein",
        "Nachhaltigkeitszertifikate": "REACH, RoHS, Nein, ENERGY STAR",
        "Natives Seitenverh\u00e4ltnis": "16:9",
        "Neigungswinkelbereich": "3,5 - 21,5\u00b0",
        "Oberfl\u00e4chenh\u00e4rte": "3H",
        "On-Screen-Display (OSD)": "Ja",
        "Paketgewicht": "4,5 kg",
        "Panel-Montage-Schnittstelle": "100 x 100 mm",
        "Panel-Typ": "VA",
        "Pixel Abstand": "0,2745 x 0,2745 mm",
        "Produktfarbe": "Schwarz",
        "Rahmenloses Design": "Ja",
        "Reaktionszeit": "4 ms",
        "Seitenverh\u00e4ltnis": "4:3,16:9",
        "Sichtbare Gr\u00f6\u00dfe (horizontal)": "52,7 cm",
        "Sichtbare Gr\u00f6\u00dfe (vertikal)": "29,6 cm",
        "Slot-Typ Kabelsperre": "Kensington",
        "Stromverbrauch (Standby)": "0,3 W",
        "Stromverbrauch (aus)": "0,3 W",
        "Stromverbrauch (in Betrieb)": "19 W",
        "St\u00e4nder enthalten": "Ja",
        "Tiefe (ohne Standfu\u00df)": "17,1 cm",
        "Typ der Hintergrundbeleuchtung": "W-LED",
        "Unterst\u00fctzte Video-Modi": "720p,1080p",
        "VESA-Halterung": "Ja",
        "Verpackungsart": "Box",
        "Verpackungsbreite": "614 mm",
        "Verpackungsh\u00f6he": "492 mm",
        "Verpackungstiefe": "131 mm",
        "Vertikaler Scanbereich": "50 - 76 Hz",
        "Zertifizierung": "ISO",
        "kippbar": "Ja"
    },
    "raw_specifications_text": "Bildschirmdiagonale: 60,5 cm (23.8\" )\nBildschirmaufl\u00f6sung: 1920 x 1080 Pixel\nNatives Seitenverh\u00e4ltnis: 16:9\nPanel-Typ: VA\nHelligkeit (typisch): 250 cd/m\u00b2\nReaktionszeit: 4 ms\nHD-Typ: Full HD\nBildschirmtechnologie: LCD\nBildschirmform: Flach\nKontrastverh\u00e4ltnis: 3000:1\nMaximale Bildwiederholrate: 75 Hz\nBlickwinkel, horizontal: 178\u00b0\nBlickwinkel, vertikal: 178\u00b0\nAnzahl der Farben des Displays: 16,78 Millionen Farben\nTyp der Hintergrundbeleuchtung: W-LED\nDisplay-Oberfl\u00e4che: Matt\nUnterst\u00fctzte Video-Modi: 720p,1080p\nSeitenverh\u00e4ltnis: 4:3,16:9\nKontrastverh\u00e4ltnis (dynamisch): 20000000:1\nPixel Abstand: 0,2745 x 0,2745 mm\nHorizontaler Scanbereich: 30 - 83 kHz\nVertikaler Scanbereich: 50 - 76 Hz\nSichtbare Gr\u00f6\u00dfe (horizontal): 52,7 cm\nSichtbare Gr\u00f6\u00dfe (vertikal): 29,6 cm\nOberfl\u00e4chenh\u00e4rte: 3H\nFarbintensit\u00e4t: 8 Bit\nNVIDIA G-SYNC: Nein\nAMD FreeSync: Nein\nFlimmerfreie Technologie: Ja\nLow-Blue-Light-Technologie: Ja\nEingebaute Lautsprecher: Nein\nIntegrierte Kamera: Nein\nMarktpositionierung: Haus\nProduktfarbe: Schwarz\nRahmenloses Design: Ja\nFu\u00dffarbe: Schwarz\nZertifizierung: ISO\nIntegrierter USB-Hub: Nein\nDVI Anschluss: Nein\nHDMI: Ja\nAudioanschl\u00fcsse: Nein\nKopfh\u00f6rerausgang: Ja\nAnzahl VGA (D-Sub) Anschl\u00fcsse: 1\nAnzahl HDMI-Anschl\u00fcsse: 1\nHDMI-Version: 1.4\nKopfh\u00f6rerausg\u00e4nge: 1\nKopfh\u00f6rer-Konnektivit\u00e4t: 3,5 mm\nVESA-Halterung: Ja\nKabelsperre-Slot: Ja\nH\u00f6henverstellung: Nein\nPanel-Montage-Schnittstelle: 100 x 100 mm\nSlot-Typ Kabelsperre: Kensington\nkippbar: Ja\nNeigungswinkelbereich: 3,5 - 21,5\u00b0\nOn-Screen-Display (OSD): Ja\nBildschirmdisplay (OSD)-Sprachen: Vereinfachtes Chinesisch, Traditionelles Chinesisch, Tschechisch, Deutsch, Niederl\u00e4ndisch, Englisch, Spanisch, Finnisch, Franz\u00f6sisch, Italienisch, Japanisch, Koreanisch, Polnisch, Portugiesisch, Russisch, SER\nAnzahl OSD-Sprachen: 16\nEnergie-Effizienzklasse: A+\nJ\u00e4hrlicher Energieverbrauch: 26 kWh\nStromverbrauch (in Betrieb): 19 W\nStromverbrauch (Standby): 0,3 W\nStromverbrauch (aus): 0,3 W\nAC Eingangsspannung: 100 - 240 V\nAC Eingangsfrequenz: 50/60 Hz\nExternes Netzteil: Ja\nEnergieeffizienzskala: A+++ bis D\nNachhaltigkeitszertifikate: REACH, RoHS, Nein, ENERGY STAR\nGer\u00e4tebreite (inkl. Fu\u00df): 539,5 mm\nGer\u00e4tetiefe (inkl. Fu\u00df): 170,9 mm\nGer\u00e4teh\u00f6he (inkl. Fu\u00df): 418,4 mm\nGewicht (mit St\u00e4nder): 2,7 kg\nBreite (ohne Standfu\u00df): 53,9 cm\nTiefe (ohne Standfu\u00df): 17,1 cm\nH\u00f6he (ohne Standfu\u00df): 41,8 cm\nGewicht (ohne St\u00e4nder): 2,7 kg\nSt\u00e4nder enthalten: Ja\nMitgelieferte Kabel: AC\nVerpackungsbreite: 614 mm\nVerpackungstiefe: 131 mm\nVerpackungsh\u00f6he: 492 mm\nPaketgewicht: 4,5 kg\nVerpackungsart: Box\nMittlere Betriebsdauer zwischen Ausf\u00e4llen (MTBF): 50000 h",
    "reference_file": "offer_reference_1477.json",
    "shop_name": "Jacob Elektronik direkt (AT)"
}