{
    "html_file": "offer_2077_18.html",
    "name": "BenQ GL2480, 24\"",
    "offer_link": "https://www.ditech.at/details.php?artnr=295701",
    "price": 135.9,
    "raw_specifications": {
        "Abmessungen (BxHxT)": "565x433x175mm (mit Standfu\u00df),  565x338x51mm (ohne Standfu\u00df)",
        "Anschl\u00fcsse - DVI": "1",
        "Anschl\u00fcsse - HDMI 1.4": "1",
        "Anschl\u00fcsse - VGA": "1",
        "Anwendung": "station\u00e4r",
        "Audio": "1x Line-Out",
        "Aufl\u00f6sung": "1920x1080",
        "Beschichtung": "matt (non-glare)",
        "Besonderheiten": "EPEAT Bronze,  mechanische Tasten,  Sicherheitsschloss (Kensington)",
        "Bildwiederholfrequenz": "75Hz",
        "Blickwinkel": "170\u00b0/160\u00b0",
        "Diagonale": "24\"/61cm",
        "Energieeffizienzklasse alt (A+++ bis D)": "A+",
        "Energieeffizienzklasse alt (A+++ bis G)": "A+",
        "Energieverbrauch SDR": "18kWh/1000h",
        "Ergonomie": "N/A (h\u00f6henverstellbar),  N/A (Pivot),  N/A (drehbar),  +20\u00b0/-5\u00b0 (neigbar),  keine Angabe (Schr\u00e4glage)",
        "FRC": "unbekannt",
        "Farbe": "schwarz",
        "Farbtiefe": "8bit (16.7 Mio. Farben)",
        "Form": "gerade (flat)",
        "Gewicht": "3.90kg (mit Standfu\u00df),  keine Angabe (ohne Standfu\u00df)",
        "HDR": "N/A",
        "Helligkeit": "250cd/m\u00b2",
        "Herstellergarantie": "zwei Jahre (Pickup&Return)",
        "Hintergrundbeleuchtung": "White-LED,  flicker-free,  Blaulichtfilter",
        "Jahresverbrauch alt (A+++ bis D)": "23.36kWh",
        "Jahresverbrauch alt (A+++ bis G)": "23.36kWh",
        "Kontrast - dynamisch": "12.000.000:1",
        "Kontrast - statisch": "1.000:1",
        "Leistungsaufnahme": "keine Angabe (maximal),  25W (typisch),  16W (Energielabel alt A+++ bis G),  0.5W (Standby)",
        "Panel": "TN",
        "Reaktionszeit - GtG": "1ms",
        "Screen-to-Body-Ratio": "83.1% (berechnet)",
        "Seitenverh\u00e4ltnis": "16:9",
        "Signalfrequenz": "30-83kHz (horizontal),  50-76Hz (vertikal)",
        "Stromversorgung": "AC-In (internes Netzteil)",
        "USB-Hub In": "N/A",
        "USB-Hub Out": "N/A",
        "USB-Schreibweise": "Link",
        "VESA": "100x100 (frei)",
        "VRR (Variable Refresh Rate)": "N/A",
        "Weitere Anschl\u00fcsse": "N/A"
    },
    "raw_specifications_text": "Abmessungen (BxHxT): 565x433x175mm (mit Standfu\u00df),  565x338x51mm (ohne Standfu\u00df)\nAnschl\u00fcsse - DVI: 1\nAnschl\u00fcsse - HDMI 1.4: 1\nAnschl\u00fcsse - VGA: 1\nAnwendung: station\u00e4r\nAudio: 1x Line-Out\nAufl\u00f6sung: 1920x1080\nBeschichtung: matt (non-glare)\nBesonderheiten: EPEAT Bronze,  mechanische Tasten,  Sicherheitsschloss (Kensington)\nBildwiederholfrequenz: 75Hz\nBlickwinkel: 170\u00b0/160\u00b0\nDiagonale: 24\"/61cm\nEnergieeffizienzklasse alt (A+++ bis D): A+\nEnergieeffizienzklasse alt (A+++ bis G): A+\nEnergieverbrauch SDR: 18kWh/1000h\nErgonomie: N/A (h\u00f6henverstellbar),  N/A (Pivot),  N/A (drehbar),  +20\u00b0/-5\u00b0 (neigbar),  keine Angabe (Schr\u00e4glage)\nFarbe: schwarz\nFarbtiefe: 8bit (16.7 Mio. Farben)\nForm: gerade (flat)\nFRC: unbekannt\nGewicht: 3.90kg (mit Standfu\u00df),  keine Angabe (ohne Standfu\u00df)\nHDR: N/A\nHelligkeit: 250cd/m\u00b2\nHerstellergarantie: zwei Jahre (Pickup&Return)\nHintergrundbeleuchtung: White-LED,  flicker-free,  Blaulichtfilter\nJahresverbrauch alt (A+++ bis D): 23.36kWh\nJahresverbrauch alt (A+++ bis G): 23.36kWh\nKontrast - dynamisch: 12.000.000:1\nKontrast - statisch: 1.000:1\nLeistungsaufnahme: keine Angabe (maximal),  25W (typisch),  16W (Energielabel alt A+++ bis G),  0.5W (Standby)\nPanel: TN\nReaktionszeit - GtG: 1ms\nScreen-to-Body-Ratio: 83.1% (berechnet)\nSeitenverh\u00e4ltnis: 16:9\nSignalfrequenz: 30-83kHz (horizontal),  50-76Hz (vertikal)\nStromversorgung: AC-In (internes Netzteil)\nUSB-Hub In: N/A\nUSB-Hub Out: N/A\nUSB-Schreibweise: Link\nVESA: 100x100 (frei)\nVRR (Variable Refresh Rate): N/A\nWeitere Anschl\u00fcsse: N/A",
    "reference_file": "offer_reference_2077.json",
    "shop_name": "DiTech.at"
}