{
    "html_file": "offer_1166_7.html",
    "name": "Lenovo G27e-20, 27\"",
    "offer_link": "https://www.mylemon.at/artikel/lenovo/66d8gar1eu/g27e-20.html",
    "price": 199.71,
    "raw_specifications": {
        "AC Eingangsfrequenz": "50/60 Hz",
        "AC Eingangsspannung": "100 - 240 V",
        "AMD FreeSync": "Ja",
        "AMD FreeSync-Typ": "FreeSync Premium",
        "Anzahl DisplayPort Anschl\u00fcsse": "1",
        "Anzahl HDMI-Anschl\u00fcsse": "1",
        "Anzahl der Farben des Displays": "16,7 Millionen Farben",
        "Artikelnummer": "M18YE2VL",
        "Audioausgang": "Ja",
        "Aufl\u00f6sung": "1920x1920",
        "Bezel Weite (bottom)": "2,2 cm",
        "Bezel Weite (side)": "2 mm",
        "Bezel Weite (top)": "2 mm",
        "Bildschirmdiagonale": "68,6 cm (27 Zoll)",
        "Bildschirmform": "Flach",
        "Bildschirmtechnologie": "LED",
        "Bildwinkel, horizontal": "178\u00b0",
        "Bildwinkel, vertikal": "178\u00b0",
        "Blendfreier Bildschirm": "Ja",
        "Breite (ohne Standfu\u00df)": "61,4 cm",
        "Display-Aufl\u00f6sung": "1920 x 1080 Pixel",
        "DisplayPorts-Version": "1.2",
        "Displaygr\u00f6\u00dfe": "27 Zoll",
        "EAN": "0195891415795",
        "Eingebaute Lautsprecher": "Nein",
        "Energieeffizienzklasse (SDR)": "F",
        "Energieeffizienzskala": "A bis G",
        "Energieverbrauch (SDR) pro 1.000 Stunden": "23 kWh",
        "Ergonomie": "Neigbar",
        "Farbskala": "95%",
        "Farbtiefe": "8 Bit",
        "Ger\u00e4tebreite (inkl. Fu\u00df)": "613,5 mm",
        "Ger\u00e4teh\u00f6he (inkl. Fu\u00df)": "450,3 mm",
        "Ger\u00e4tetiefe (inkl. Fu\u00df)": "184,7 mm",
        "Gewicht (mit St\u00e4nder)": "4,6 kg",
        "Gewicht (ohne St\u00e4nder)": "3,9 kg",
        "HD-Typ": "Full HD",
        "HDMI": "Ja",
        "HDMI-Version": "2.0",
        "Helligkeit": "300 cd/m\u00b2",
        "Helligkeit (typisch)": "300 cd/m\u00b2",
        "Hersteller Artikelnummer": "66D8GAR1EU",
        "H\u00f6he (ohne Standfu\u00df)": "36,8 cm",
        "H\u00f6henverstellung": "Nein",
        "Integrierte Kamera": "Nein",
        "Integrierter USB-Hub": "Nein",
        "Kabelsperre-Slot": "Ja",
        "Kontrastverh\u00e4ltnis": "3000:1",
        "Kontrastverh\u00e4ltnis (dynamisch)": "3000000:1",
        "Maximale Bildwiederholrate": "120 Hz",
        "Natives Seitenverh\u00e4ltnis": "16:9",
        "Neigungsverstellung": "Ja",
        "Neigungswinkelbereich": "-5 - 22\u00b0",
        "Paketgewicht": "7,1 kg",
        "Panel": "VA",
        "Panel-Montage-Schnittstelle": "100 x 100 mm",
        "Panel-Typ": "VA",
        "Pixel Abstand": "0,1038 x 0,3114 mm",
        "Pixeldichte": "82 ppi",
        "Produktfarbe": "Schwarz",
        "RGB-Farbraum": "sRGB",
        "Reaktionszeit": "4 ms",
        "Reaktionszeit (schnell)": "1 ms",
        "Sichtbare Gr\u00f6\u00dfe (horizontal)": "59,8 cm",
        "Sichtbare Gr\u00f6\u00dfe (vertikal)": "33,6 cm",
        "Slot-Typ Kabelsperre": "Kensington",
        "Stromverbrauch (Standardbetrieb)": "23 W",
        "Stromverbrauch (aus)": "0,3 W",
        "Stromverbrauch (max.)": "30 W",
        "St\u00e4nder enthalten": "Ja",
        "Tiefe (ohne Standfu\u00df)": "4,4 cm",
        "Touchscreen": "Nein",
        "VESA Halterung": "100x100 mm",
        "VESA-Halterung": "Ja",
        "Verpackungsbreite": "715 mm",
        "Verpackungsh\u00f6he": "445 mm",
        "Verpackungstiefe": "131 mm",
        "Video Anschl\u00fcsse": "1x HDMI, 1x DisplayPort",
        "Zertifizierung": "CCC, RoHS, T\u00dcV",
        "sRGB Abdeckung (klassisch)": "95%"
    },
    "raw_specifications_text": "Displaygr\u00f6\u00dfe: 27 Zoll\nAufl\u00f6sung: 1920x1920\nPanel: VA\nReaktionszeit: 4 ms\nVideo Anschl\u00fcsse: 1x HDMI, 1x DisplayPort\nErgonomie: Neigbar\nVESA Halterung: 100x100 mm\nHelligkeit: 300 cd/m\u00b2\nHersteller Artikelnummer: 66D8GAR1EU\nEAN: 0195891415795\nArtikelnummer: M18YE2VL\nBildschirmdiagonale: 68,6 cm (27 Zoll)\nDisplay-Aufl\u00f6sung: 1920 x 1080 Pixel\nNatives Seitenverh\u00e4ltnis: 16:9\nBildschirmtechnologie: LED\nTouchscreen: Nein\nHD-Typ: Full HD\nPanel-Typ: VA\nBildschirmform: Flach\nKontrastverh\u00e4ltnis: 3000:1\nMaximale Bildwiederholrate: 120 Hz\nAnzahl der Farben des Displays: 16,7 Millionen Farben\nHelligkeit (typisch): 300 cd/m\u00b2\nBlendfreier Bildschirm: Ja\nKontrastverh\u00e4ltnis (dynamisch): 3000000:1\nBildwinkel, horizontal: 178\u00b0\nBildwinkel, vertikal: 178\u00b0\nReaktionszeit (schnell): 1 ms\nPixel Abstand: 0,1038 x 0,3114 mm\nPixeldichte: 82 ppi\nSichtbare Gr\u00f6\u00dfe (horizontal): 59,8 cm\nSichtbare Gr\u00f6\u00dfe (vertikal): 33,6 cm\nFarbtiefe: 8 Bit\nRGB-Farbraum: sRGB\nFarbskala: 95%\nsRGB Abdeckung (klassisch): 95%\nAMD FreeSync: Ja\nAMD FreeSync-Typ: FreeSync Premium\nEingebaute Lautsprecher: Nein\nIntegrierte Kamera: Nein\nProduktfarbe: Schwarz\nZertifizierung: CCC, RoHS, T\u00dcV\nIntegrierter USB-Hub: Nein\nHDMI: Ja\nAnzahl HDMI-Anschl\u00fcsse: 1\nHDMI-Version: 2.0\nAnzahl DisplayPort Anschl\u00fcsse: 1\nDisplayPorts-Version: 1.2\nAudioausgang: Ja\nVESA-Halterung: Ja\nKabelsperre-Slot: Ja\nH\u00f6henverstellung: Nein\nPanel-Montage-Schnittstelle: 100 x 100 mm\nSlot-Typ Kabelsperre: Kensington\nNeigungswinkelbereich: -5 - 22\u00b0\nNeigungsverstellung: Ja\nEnergieeffizienzklasse (SDR): F\nEnergieverbrauch (SDR) pro 1.000 Stunden: 23 kWh\nStromverbrauch (Standardbetrieb): 23 W\nStromverbrauch (max.): 30 W\nStromverbrauch (aus): 0,3 W\nAC Eingangsspannung: 100 - 240 V\nAC Eingangsfrequenz: 50/60 Hz\nEnergieeffizienzskala: A bis G\nSt\u00e4nder enthalten: Ja\nGer\u00e4tebreite (inkl. Fu\u00df): 613,5 mm\nGer\u00e4tetiefe (inkl. Fu\u00df): 184,7 mm\nGer\u00e4teh\u00f6he (inkl. Fu\u00df): 450,3 mm\nGewicht (mit St\u00e4nder): 4,6 kg\nBreite (ohne Standfu\u00df): 61,4 cm\nTiefe (ohne Standfu\u00df): 4,4 cm\nH\u00f6he (ohne Standfu\u00df): 36,8 cm\nGewicht (ohne St\u00e4nder): 3,9 kg\nBezel Weite (side): 2 mm\nBezel Weite (top): 2 mm\nBezel Weite (bottom): 2,2 cm\nVerpackungsbreite: 715 mm\nVerpackungstiefe: 131 mm\nVerpackungsh\u00f6he: 445 mm\nPaketgewicht: 7,1 kg",
    "reference_file": "offer_reference_1166.json",
    "shop_name": "mylemon.at"
}