{
    "html_file": "offer_791_0.html",
    "name": "Acer Vero BR7 BR247Ybmiprx, 23.8\"",
    "offer_link": "https://www.mylemon.at/artikel/acer/um_qb7ee_026/dis-24-vero-br247ybmiprx-fhd.html",
    "price": 136.63,
    "raw_specifications": {
        "AC Eingangsspannung": "120 - 230 V",
        "Anzahl DisplayPort Anschl\u00fcsse": "1",
        "Anzahl HDMI-Anschl\u00fcsse": "1",
        "Anzahl VGA (D-Sub) Anschl\u00fcsse": "1",
        "Anzahl der Farben des Displays": "16,7 Millionen Farben",
        "Anzahl der Lautsprecher": "1",
        "Artikelnummer": "M18YSLML",
        "Aufl\u00f6sung": "1920x1080",
        "Besonderheiten": "75 Hz, Lautsprecher",
        "Bildschirmdiagonale": "60,5 cm (23.8 Zoll)",
        "Bildschirmdiagonale (cm)": "60,5 cm",
        "Bildschirmform": "Flach",
        "Bildwinkel, horizontal": "178\u00b0",
        "Bildwinkel, vertikal": "178\u00b0",
        "Breite (ohne Standfu\u00df)": "54 cm",
        "Display-Aufl\u00f6sung": "1920 x 1080 Pixel",
        "DisplayPorts-Version": "1.2",
        "Displaygr\u00f6\u00dfe": "23,8 Zoll",
        "EAN": "4710886930389",
        "Eingebaute Lautsprecher": "Ja",
        "Energieeffizienzklasse (SDR)": "E",
        "Energieverbrauch (SDR) pro 1.000 Stunden": "17,8 kWh",
        "Ergonomie": "H\u00f6henverstellbar, Pivot (90 Grad drehbar), Schwenkbar, Neigbar",
        "Farbskala": "72%",
        "Farbtiefe": "6 Bit",
        "Ger\u00e4tebreite (inkl. Fu\u00df)": "540,2 mm",
        "Ger\u00e4teh\u00f6he (inkl. Fu\u00df)": "449,3 mm",
        "Ger\u00e4tetiefe (inkl. Fu\u00df)": "192,1 mm",
        "HD-Typ": "Full HD",
        "HDMI": "Ja",
        "HDMI-Version": "1.4",
        "Helligkeit": "250 cd/m\u00b2",
        "Helligkeit (typisch)": "250 cd/m\u00b2",
        "Hersteller Artikelnummer": "UM.QB7EE.026",
        "H\u00f6he (ohne Standfu\u00df)": "32,4 cm",
        "H\u00f6heneinstellung": "12 cm",
        "H\u00f6henverstellung": "Ja",
        "Kontrastverh\u00e4ltnis (dynamisch)": "100000000:1",
        "Kopfh\u00f6rerausgang": "Ja",
        "Maximale Bildwiederholrate": "75 Hz",
        "Mitgelieferte Kabel": "AC, HDMI, VGA",
        "Natives Seitenverh\u00e4ltnis": "16:9",
        "Neigungsverstellung": "Ja",
        "Neigungswinkelbereich": "-5 - 25\u00b0",
        "Panel": "IPS",
        "Panel-Montage-Schnittstelle": "100 x 100 mm",
        "Panel-Typ": "IPS",
        "Pixel Abstand": "0,27 x 0,27 mm",
        "Produktfarbe": "Schwarz",
        "Reaktionszeit": "4 ms",
        "Schwenkbar": "Ja",
        "Schwenkwinkelbereich": "-45 - 45\u00b0",
        "Seitenverh\u00e4ltnis": "16:9",
        "Stromverbrauch (Standardbetrieb)": "22 W",
        "Stromverbrauch (Standby)": "0,5 W",
        "Stromverbrauch (aus)": "0,3 W",
        "Stromverbrauch (max.)": "47 W",
        "Tiefe (ohne Standfu\u00df)": "6,53 cm",
        "Touchscreen": "Nein",
        "Typ der Hintergrundbeleuchtung": "LED",
        "VESA Halterung": "100x100 mm",
        "VESA-Halterung": "Ja",
        "Video Anschl\u00fcsse": "1x VGA, 1x HDMI, 1x DisplayPort",
        "Wandmontage": "Ja",
        "Warentarifnummer (HS)": "85285210",
        "Zertifizierung": "TCO"
    },
    "raw_specifications_text": "Displaygr\u00f6\u00dfe: 23,8 Zoll\nAufl\u00f6sung: 1920x1080\nPanel: IPS\nReaktionszeit: 4 ms\nVideo Anschl\u00fcsse: 1x VGA, 1x HDMI, 1x DisplayPort\nErgonomie: H\u00f6henverstellbar, Pivot (90 Grad drehbar), Schwenkbar, Neigbar\nVESA Halterung: 100x100 mm\nHelligkeit: 250 cd/m\u00b2\nBesonderheiten: 75 Hz, Lautsprecher\nHersteller Artikelnummer: UM.QB7EE.026\nEAN: 4710886930389\nArtikelnummer: M18YSLML\nBildschirmdiagonale: 60,5 cm (23.8 Zoll)\nDisplay-Aufl\u00f6sung: 1920 x 1080 Pixel\nNatives Seitenverh\u00e4ltnis: 16:9\nTouchscreen: Nein\nHD-Typ: Full HD\nPanel-Typ: IPS\nBildschirmform: Flach\nMaximale Bildwiederholrate: 75 Hz\nAnzahl der Farben des Displays: 16,7 Millionen Farben\nTyp der Hintergrundbeleuchtung: LED\nHelligkeit (typisch): 250 cd/m\u00b2\nSeitenverh\u00e4ltnis: 16:9\nKontrastverh\u00e4ltnis (dynamisch): 100000000:1\nBildwinkel, horizontal: 178\u00b0\nBildwinkel, vertikal: 178\u00b0\nPixel Abstand: 0,27 x 0,27 mm\nBildschirmdiagonale (cm): 60,5 cm\nFarbtiefe: 6 Bit\nFarbskala: 72%\nEingebaute Lautsprecher: Ja\nAnzahl der Lautsprecher: 1\nProduktfarbe: Schwarz\nZertifizierung: TCO\nHDMI: Ja\nKopfh\u00f6rerausgang: Ja\nAnzahl VGA (D-Sub) Anschl\u00fcsse: 1\nAnzahl HDMI-Anschl\u00fcsse: 1\nHDMI-Version: 1.4\nAnzahl DisplayPort Anschl\u00fcsse: 1\nDisplayPorts-Version: 1.2\nVESA-Halterung: Ja\nH\u00f6henverstellung: Ja\nPanel-Montage-Schnittstelle: 100 x 100 mm\nWandmontage: Ja\nH\u00f6heneinstellung: 12 cm\nSchwenkbar: Ja\nSchwenkwinkelbereich: -45 - 45\u00b0\nNeigungswinkelbereich: -5 - 25\u00b0\nNeigungsverstellung: Ja\nEnergieeffizienzklasse (SDR): E\nEnergieverbrauch (SDR) pro 1.000 Stunden: 17,8 kWh\nStromverbrauch (Standardbetrieb): 22 W\nStromverbrauch (Standby): 0,5 W\nStromverbrauch (max.): 47 W\nStromverbrauch (aus): 0,3 W\nAC Eingangsspannung: 120 - 230 V\nMitgelieferte Kabel: AC, HDMI, VGA\nGer\u00e4tebreite (inkl. Fu\u00df): 540,2 mm\nGer\u00e4tetiefe (inkl. Fu\u00df): 192,1 mm\nGer\u00e4teh\u00f6he (inkl. Fu\u00df): 449,3 mm\nBreite (ohne Standfu\u00df): 54 cm\nTiefe (ohne Standfu\u00df): 6,53 cm\nH\u00f6he (ohne Standfu\u00df): 32,4 cm\nWarentarifnummer (HS): 85285210",
    "reference_file": "offer_reference_791.json",
    "shop_name": "mylemon.at"
}