{
    "html_file": "offer_482_4.html",
    "name": "Samsung Odyssey G3 G3A (2023), 24\"",
    "offer_link": "https://www.mylemon.at/artikel/samsung/ls24ag304nrxen/dis-24-s24ag304nr.html",
    "price": 137.46,
    "raw_specifications": {
        "AMD FreeSync": "Ja",
        "AMD FreeSync-Typ": "FreeSync Premium",
        "Anzahl DisplayPort Anschl\u00fcsse": "1",
        "Anzahl HDMI-Anschl\u00fcsse": "1",
        "Anzahl der Farben des Displays": "16,7 Millionen Farben",
        "Artikelnummer": "M1FYA1AL",
        "Aufl\u00f6sung": "1920x1080",
        "Besonderheiten": "144 Hz",
        "Betriebsanleitung": "Ja",
        "Bildschirmdiagonale": "61 cm (24 Zoll)",
        "Bildschirmdiagonale (cm)": "61 cm",
        "Bildschirmform": "Flach",
        "Bildschirmtechnologie": "LED",
        "Bildwinkel, horizontal": "178\u00b0",
        "Bildwinkel, vertikal": "178\u00b0",
        "Breite (ohne Standfu\u00df)": "54,4 cm",
        "Display-Aufl\u00f6sung": "1920 x 1080 Pixel",
        "DisplayPorts-Version": "1.2",
        "Displaygr\u00f6\u00dfe": "24 Zoll",
        "EAN": "8806094672220",
        "Energieeffizienzklasse (HDR)": "Nicht verf\u00fcgbar",
        "Energieeffizienzklasse (SDR)": "E",
        "Energieverbrauch (SDR) pro 1.000 Stunden": "17 kWh",
        "Ergonomie": "H\u00f6henverstellbar, Pivot (90 Grad drehbar), Schwenkbar, Neigbar",
        "Flimmerfreie Technologie": "Ja",
        "Fu\u00dffarbe": "Schwarz",
        "Ger\u00e4tebreite (inkl. Fu\u00df)": "544 mm",
        "Ger\u00e4teh\u00f6he (inkl. Fu\u00df)": "498,4 mm",
        "Ger\u00e4tetiefe (inkl. Fu\u00df)": "218,9 mm",
        "Gewicht (mit St\u00e4nder)": "4,1 kg",
        "Gewicht (ohne St\u00e4nder)": "2,6 kg",
        "Gew\u00e4hrleistungsfrist": "2 Jahr(e)",
        "Gleichstrom-Anschluss (DC)": "Ja",
        "HD-Typ": "Full HD",
        "HDMI": "Ja",
        "Helligkeit": "250 cd/m\u00b2",
        "Helligkeit (typisch)": "250 cd/m\u00b2",
        "Hersteller Artikelnummer": "LS24AG304NRXEN",
        "H\u00f6he (ohne Standfu\u00df)": "33,3 cm",
        "H\u00f6heneinstellung": "12 cm",
        "H\u00f6henverstellung": "Ja",
        "Integrierte Kamera": "Nein",
        "Kontrastverh\u00e4ltnis": "3000:1",
        "Kopfh\u00f6rerausgang": "Ja",
        "Markenspezifische Technologien": "Black Equalizer",
        "Marktpositionierung": "Gaming",
        "Maximale Bildwiederholrate": "144 Hz",
        "Mitgelieferte Kabel": "AC, DisplayPort",
        "Natives Seitenverh\u00e4ltnis": "16:9",
        "Neigungswinkelbereich": "-5 - 20\u00b0",
        "On-Screen-Display (OSD)": "Ja",
        "Paketgewicht": "6,3 kg",
        "Panel": "VA",
        "Panel-Montage-Schnittstelle": "100 x 100 mm",
        "Panel-Typ": "VA",
        "Pivot": "Ja",
        "Produktfarbe": "Schwarz",
        "Reaktionszeit": "1 ms",
        "Schwenkbar": "Ja",
        "Schwenkwinkelbereich": "-15 - 15\u00b0",
        "Smart-Modi": "Energiesparend",
        "Spiel-Modus": "Ja",
        "Stromverbrauch (Standardbetrieb)": "17 W",
        "Stromverbrauch (Standby)": "0,3 W",
        "Stromverbrauch (aus)": "0,3 W",
        "St\u00e4nder enthalten": "Ja",
        "Tiefe (ohne Standfu\u00df)": "7,55 cm",
        "Touchscreen": "Nein",
        "Typ der Hintergrundbeleuchtung": "Seiten-LED",
        "VESA Halterung": "100x100 mm",
        "VESA-Halterung": "Ja",
        "Verpackungsart": "Box",
        "Verpackungsbreite": "636 mm",
        "Verpackungsh\u00f6he": "454 mm",
        "Verpackungstiefe": "213 mm",
        "Video Anschl\u00fcsse": "1x HDMI, 1x DisplayPort"
    },
    "raw_specifications_text": "Displaygr\u00f6\u00dfe: 24 Zoll\nAufl\u00f6sung: 1920x1080\nPanel: VA\nReaktionszeit: 1 ms\nVideo Anschl\u00fcsse: 1x HDMI, 1x DisplayPort\nErgonomie: H\u00f6henverstellbar, Pivot (90 Grad drehbar), Schwenkbar, Neigbar\nVESA Halterung: 100x100 mm\nHelligkeit: 250 cd/m\u00b2\nBesonderheiten: 144 Hz\nHersteller Artikelnummer: LS24AG304NRXEN\nEAN: 8806094672220\nArtikelnummer: M1FYA1AL\nBildschirmdiagonale: 61 cm (24 Zoll)\nDisplay-Aufl\u00f6sung: 1920 x 1080 Pixel\nNatives Seitenverh\u00e4ltnis: 16:9\nBildschirmtechnologie: LED\nTouchscreen: Nein\nHD-Typ: Full HD\nPanel-Typ: VA\nBildschirmform: Flach\nKontrastverh\u00e4ltnis: 3000:1\nMaximale Bildwiederholrate: 144 Hz\nAnzahl der Farben des Displays: 16,7 Millionen Farben\nTyp der Hintergrundbeleuchtung: Seiten-LED\nHelligkeit (typisch): 250 cd/m\u00b2\nBildwinkel, horizontal: 178\u00b0\nBildwinkel, vertikal: 178\u00b0\nBildschirmdiagonale (cm): 61 cm\nAMD FreeSync: Ja\nAMD FreeSync-Typ: FreeSync Premium\nMarkenspezifische Technologien: Black Equalizer\nFlimmerfreie Technologie: Ja\nSpiel-Modus: Ja\nSmart-Modi: Energiesparend\nIntegrierte Kamera: Nein\nMarktpositionierung: Gaming\nProduktfarbe: Schwarz\nFu\u00dffarbe: Schwarz\nHDMI: Ja\nKopfh\u00f6rerausgang: Ja\nAnzahl HDMI-Anschl\u00fcsse: 1\nAnzahl DisplayPort Anschl\u00fcsse: 1\nDisplayPorts-Version: 1.2\nGleichstrom-Anschluss (DC): Ja\nVESA-Halterung: Ja\nH\u00f6henverstellung: Ja\nPanel-Montage-Schnittstelle: 100 x 100 mm\nH\u00f6heneinstellung: 12 cm\nPivot: Ja\nSchwenkbar: Ja\nSchwenkwinkelbereich: -15 - 15\u00b0\nNeigungswinkelbereich: -5 - 20\u00b0\nOn-Screen-Display (OSD): Ja\nEnergieeffizienzklasse (SDR): E\nEnergieeffizienzklasse (HDR): Nicht verf\u00fcgbar\nEnergieverbrauch (SDR) pro 1.000 Stunden: 17 kWh\nStromverbrauch (Standardbetrieb): 17 W\nStromverbrauch (Standby): 0,3 W\nStromverbrauch (aus): 0,3 W\nSt\u00e4nder enthalten: Ja\nMitgelieferte Kabel: AC, DisplayPort\nBetriebsanleitung: Ja\nGer\u00e4tebreite (inkl. Fu\u00df): 544 mm\nGer\u00e4tetiefe (inkl. Fu\u00df): 218,9 mm\nGer\u00e4teh\u00f6he (inkl. Fu\u00df): 498,4 mm\nGewicht (mit St\u00e4nder): 4,1 kg\nBreite (ohne Standfu\u00df): 54,4 cm\nTiefe (ohne Standfu\u00df): 7,55 cm\nH\u00f6he (ohne Standfu\u00df): 33,3 cm\nGewicht (ohne St\u00e4nder): 2,6 kg\nVerpackungsbreite: 636 mm\nVerpackungstiefe: 213 mm\nVerpackungsh\u00f6he: 454 mm\nPaketgewicht: 6,3 kg\nVerpackungsart: Box\nGew\u00e4hrleistungsfrist: 2 Jahr(e)",
    "reference_file": "offer_reference_482.json",
    "shop_name": "mylemon.at"
}