{
    "html_file": "offer_1806_23.html",
    "name": "Philips E-line 345E2AE, 34\"",
    "offer_link": "https://www.alternate.at/Philips/345E2AE-00-Gaming-Monitor/html/product/1674523?partner=AtGeizhalsat&campaign=Monitor/Philips/1674523",
    "price": 385.0,
    "raw_specifications": {
        "": "AMD FreeSync, Kensington-Schloss",
        "Abmessungen": "Breite: 81,7 cm x H\u00f6he: 49,1 cm x Tiefe/L\u00e4nge: 23,5 cm",
        "Anschl\u00fcsse": "2x HDMI-Eingang, 1x DisplayPort-Eingang, 1x 3,5-mm-Audio-Eingang, 1x Kopfh\u00f6rer-Ausgang",
        "Bild": "Glaretyp",
        "Bildschirmaufl\u00f6sung": "3.440 x 1.440 Pixel",
        "Bildschirmdiagonale": "86 cm (34 Zoll)",
        "EAN": "8712581767587",
        "Energieeffizienzklasse (SDR)": "G (A - G)",
        "Energieverbauch pro 1000 Stunden (SDR)": "39 kWh",
        "Ergonomie": "Typ",
        "Farbe": "schwarz",
        "Features": "SmartImage, Ultra Wide Color, Low Blue Mode, Flicker-Free LED",
        "Frequenz": "Vertikal",
        "Geeignet f\u00fcr": "Gaming",
        "Gewicht": "7,6 kg",
        "Hersteller-Nr.": "345E2AE/00",
        "Lautsprecher": "2 Lautsprecher",
        "Leistungsaufnahme im Bereitschafts- und Aus-Zustand": "0,5 Watt",
        "Leistungsaufnahme im Ein-Zustand bei Standard-Dynamikumfang (SDR)": "39 Watt",
        "Standards": "Video",
        "Stromversorgung": "Eco-Off",
        "Typ": "Gaming-Monitor",
        "Wandhalterung": "VESA kompatibel (100 x 100 mm)",
        "Zubeh\u00f6r": "Vorhanden"
    },
    "raw_specifications_text": "Energieeffizienzklasse (SDR): G (A - G)\nEnergieverbauch pro 1000 Stunden (SDR): 39 kWh\nLeistungsaufnahme im Ein-Zustand bei Standard-Dynamikumfang (SDR): 39 Watt\nLeistungsaufnahme im Bereitschafts- und Aus-Zustand: 0,5 Watt\nBildschirmdiagonale: 86 cm (34 Zoll)\nBildschirmaufl\u00f6sung: 3.440 x 1.440 Pixel\nTyp: Gaming-Monitor\nFarbe: schwarz\nEAN: 8712581767587\nHersteller-Nr.: 345E2AE/00\nGeeignet f\u00fcr: Gaming\nBild: Glaretyp\n: AMD FreeSync, Kensington-Schloss\nFrequenz: Vertikal\nAnschl\u00fcsse: 2x HDMI-Eingang, 1x DisplayPort-Eingang, 1x 3,5-mm-Audio-Eingang, 1x Kopfh\u00f6rer-Ausgang\nErgonomie: Typ\nStromversorgung: Eco-Off\nLautsprecher: 2 Lautsprecher\nStandards: Video\nWandhalterung: VESA kompatibel (100 x 100 mm)\nFeatures: SmartImage, Ultra Wide Color, Low Blue Mode, Flicker-Free LED\nZubeh\u00f6r: Vorhanden\nAbmessungen: Breite: 81,7 cm x H\u00f6he: 49,1 cm x Tiefe/L\u00e4nge: 23,5 cm\nGewicht: 7,6 kg",
    "reference_file": "offer_reference_1806.json",
    "shop_name": "Alternate.at"
}