{
    "html_file": "offer_551_26.html",
    "name": "HP Z32k G3, 31.5\"",
    "offer_link": "https://www.playox.de/productredirect/index/sku/25410628?sPartner=p-geizhals-at&campaign=psm/geizhals-at/",
    "price": 1018.49,
    "raw_specifications": {
        "Anschl\u00fcsse": "USB, DisplayPort, HDMI, Thunderbolt",
        "Artikelnummer": "25410628",
        "Aufl\u00f6sung Kurzname": "UHD, 4K",
        "Bezeichnung des Herstellers": "HP Z32k G3",
        "Breite": "7135,00 mm",
        "Display Features": "FlickerFree",
        "Displaygr\u00f6\u00dfe": "81,28 cm (32 Zoll)",
        "Displayoberfl\u00e4che": "matt",
        "EEK - Spektrum": "AG",
        "Einsatzort": "Innen",
        "Energieeffizienzklasse": "G",
        "Geh\u00e4usefarbe des Ger\u00e4tes": "Schwarz",
        "Gewicht": "9,00 kg",
        "Gewicht inkl. Verpackung in Kg": "0,00 kg",
        "Helligkeit Bereich": "300 - 450 cd/m\u00b2",
        "Hersteller": "HP Inc.",
        "H\u00f6he": "6049,00 mm",
        "Kontrastverh\u00e4ltnis (typisch) Bereich": "ab 1.200:1",
        "LCD-Technologie": "IPS Panel",
        "L\u00e4nge": "217,00 mm",
        "Produktart": "Monitore",
        "Reaktionszeit": "5,00 ms",
        "Seitenverh\u00e4ltnis": "16:9",
        "Shop Herstellernummer": "50U19AA#ABB",
        "Standard-EAN": "0196188669341",
        "Verbindungen": "Netzwerk (LAN)",
        "max. Aufl\u00f6sung": "3.840 x 2.160 Pixel (16:9)"
    },
    "raw_specifications_text": "Geh\u00e4usefarbe des Ger\u00e4tes: Schwarz\nAnschl\u00fcsse: USB, DisplayPort, HDMI, Thunderbolt\nGewicht: 9,00 kg\nProduktart: Monitore\nKontrastverh\u00e4ltnis (typisch) Bereich: ab 1.200:1\nDisplay Features: FlickerFree\nHersteller: HP Inc.\nHelligkeit Bereich: 300 - 450 cd/m\u00b2\nDisplaygr\u00f6\u00dfe: 81,28 cm (32 Zoll)\nVerbindungen: Netzwerk (LAN)\nGewicht inkl. Verpackung in Kg: 0,00 kg\nEEK - Spektrum: AG\nAufl\u00f6sung Kurzname: UHD, 4K\nL\u00e4nge: 217,00 mm\nArtikelnummer: 25410628\nStandard-EAN: 0196188669341\nShop Herstellernummer: 50U19AA#ABB\nBezeichnung des Herstellers: HP Z32k G3\nBreite: 7135,00 mm\nH\u00f6he: 6049,00 mm\nmax. Aufl\u00f6sung: 3.840 x 2.160 Pixel (16:9)\nSeitenverh\u00e4ltnis: 16:9\nLCD-Technologie: IPS Panel\nReaktionszeit: 5,00 ms\nDisplayoberfl\u00e4che: matt\nEinsatzort: Innen\nEnergieeffizienzklasse: G",
    "reference_file": "offer_reference_551.json",
    "shop_name": "playox (AT)"
}