{
    "html_file": "offer_2012_13.html",
    "name": "Lenovo ThinkVision T25d-10, 25\"",
    "offer_link": "https://www.mylemon.at/artikel/lenovo/61dbmat1eu/thinkvision-t25d-10-63-50cm.html",
    "price": 245.35,
    "raw_specifications": {
        "3D": "Nein",
        "AC Eingangsfrequenz": "50 - 60 Hz",
        "AC Eingangsspannung": "100 - 240 V",
        "Anzahl DisplayPort Anschl\u00fcsse": "1",
        "Anzahl HDMI-Anschl\u00fcsse": "1",
        "Anzahl OSD-Sprachen": "8",
        "Anzahl VGA (D-Sub) Anschl\u00fcsse": "1",
        "Anzahl der Farben des Displays": "16,78 Millionen Farben",
        "Anzahl der nachgeschalteten Steckpl\u00e4tze vom Typ USB-A": "4",
        "Anzahl der vorgeschalteten Steckpl\u00e4tze": "1",
        "Artikelnummer": "MZHYPCL",
        "Audioausgang": "Ja",
        "Aufl\u00f6sung": "1920x1200",
        "Besonderheiten": "60 Hz",
        "Bezel Weite (bottom)": "2,22 cm",
        "Bezel Weite (side)": "2 mm",
        "Bezel Weite (top)": "2 mm",
        "Bildschirmdiagonale": "63,5 cm (25 Zoll)",
        "Bildschirmform": "Flach",
        "Bildschirmtechnologie": "LED",
        "Bildwinkel, horizontal": "178\u00b0",
        "Bildwinkel, vertikal": "178\u00b0",
        "Breite (ohne Standfu\u00df)": "54,9 cm",
        "DVI Anschluss": "Nein",
        "Display-Aufl\u00f6sung": "1920 x 1200 Pixel",
        "Display-Oberfl\u00e4che": "Matt",
        "DisplayPorts-Version": "1.2",
        "Displaygr\u00f6\u00dfe": "25 Zoll",
        "EAN": "0193268784048",
        "Ein-/Ausschalter": "Ja",
        "Eingebaute Lautsprecher": "Nein",
        "Energieeffizienzklasse (SDR)": "D",
        "Energieeffizienzskala": "A bis G",
        "Energieverbrauch (SDR) pro 1.000 Stunden": "16 kWh",
        "Ergonomie": "H\u00f6henverstellbar, Pivot (90 Grad drehbar), Schwenkbar, Neigbar",
        "Farbskala": "99%",
        "Fu\u00dffarbe": "Schwarz",
        "Ger\u00e4tebreite (inkl. Fu\u00df)": "548,7 mm",
        "Ger\u00e4teh\u00f6he (inkl. Fu\u00df)": "399,5 mm",
        "Ger\u00e4tetiefe (inkl. Fu\u00df)": "260,4 mm",
        "Gewicht (mit St\u00e4nder)": "5,5 kg",
        "Gewicht (ohne St\u00e4nder)": "3,58 kg",
        "HD-Typ": "WUXGA",
        "HDMI": "Ja",
        "HDMI-Version": "1.4",
        "Helligkeit": "300 cd/m\u00b2",
        "Helligkeit (typisch)": "300 cd/m\u00b2",
        "Hersteller Artikelnummer": "61DBMAT1EU",
        "H\u00f6he (ohne Standfu\u00df)": "36,9 cm",
        "H\u00f6heneinstellung": "11 cm",
        "H\u00f6henverstellung": "Ja",
        "Integrierte Kamera": "Nein",
        "Integrierter USB-Hub": "Ja",
        "J\u00e4hrlicher Energieverbrauch": "52,06 kWh",
        "Kabelsperre-Slot": "Ja",
        "Kontrastverh\u00e4ltnis": "1000:1",
        "Kontrastverh\u00e4ltnis (dynamisch)": "3000000:1",
        "Kopfh\u00f6rer-Anschluss": "3,5 mm",
        "Kopfh\u00f6rerausgang": "Ja",
        "Marktpositionierung": "Business",
        "Maximale Bildwiederholrate": "60 Hz",
        "Mitgelieferte Kabel": "AC, DisplayPort, HDMI, USB",
        "Nachhaltigkeitszertifikate": "RoHS, EPEAT Bronze, ENERGY STAR",
        "Natives Seitenverh\u00e4ltnis": "16:10",
        "Neigungsverstellung": "Ja",
        "Neigungswinkelbereich": "-5 - 30\u00b0",
        "On-Screen-Display (OSD)": "Ja",
        "Paketgewicht": "7,8 kg",
        "Panel-Montage-Schnittstelle": "100 x 100 mm",
        "Panel-Typ": "IPS",
        "Pivot": "Ja",
        "Pivot Winkel": "-90 - 90\u00b0",
        "Pixel Abstand": "0,2789 x 0,2823 mm",
        "Produktfarbe": "Schwarz",
        "Reaktionszeit": "6 ms",
        "Reaktionszeit (schnell)": "4 ms",
        "Schnellstart\u00fcbersicht": "Ja",
        "Schwenkbar": "Ja",
        "Schwenkwinkelbereich": "-45 - 45\u00b0",
        "Sichtbare Gr\u00f6\u00dfe (horizontal)": "53,3 cm",
        "Sichtbare Gr\u00f6\u00dfe (vertikal)": "33,9 cm",
        "Slot-Typ Kabelsperre": "Kensington",
        "Stromverbrauch (Standardbetrieb)": "25 W",
        "Stromverbrauch (Standby)": "0,5 W",
        "Stromverbrauch (aus)": "0,3 W",
        "Stromverbrauch (max.)": "66 W",
        "St\u00e4nder enthalten": "Ja",
        "TV Tuner integriert": "Nein",
        "Tiefe (ohne Standfu\u00df)": "4,3 cm",
        "Touchscreen": "Nein",
        "Typ der Hintergrundbeleuchtung": "W-LED",
        "USB-Hub-Version": "3.2 Gen 1 (3.1 Gen 1)",
        "Unterst\u00fctzte Grafik-Aufl\u00f6sungen": "1920 x 1200 (WUXGA)",
        "VESA Halterung": "100x100 mm",
        "VESA-Halterung": "Ja",
        "Verpackungsart": "Box",
        "Verpackungsbreite": "160 mm",
        "Verpackungsh\u00f6he": "450 mm",
        "Verpackungstiefe": "706 mm",
        "Video Anschl\u00fcsse": "1x VGA, 1x HDMI, 1x DisplayPort, 5x USB",
        "Warentarifnummer (HS)": "85285210",
        "Zertifizierung": "CCC, TCO 8.0, TCO Edge 2.0, China Energy Efficiency Standard Tier 2, T\u00dcV Eye Comfort, ULE Gold"
    },
    "raw_specifications_text": "Displaygr\u00f6\u00dfe: 25 Zoll\nAufl\u00f6sung: 1920x1200\nReaktionszeit: 6 ms\nVideo Anschl\u00fcsse: 1x VGA, 1x HDMI, 1x DisplayPort, 5x USB\nErgonomie: H\u00f6henverstellbar, Pivot (90 Grad drehbar), Schwenkbar, Neigbar\nVESA Halterung: 100x100 mm\nHelligkeit: 300 cd/m\u00b2\nBesonderheiten: 60 Hz\nHersteller Artikelnummer: 61DBMAT1EU\nEAN: 0193268784048\nArtikelnummer: MZHYPCL\nBildschirmdiagonale: 63,5 cm (25 Zoll)\nDisplay-Aufl\u00f6sung: 1920 x 1200 Pixel\nNatives Seitenverh\u00e4ltnis: 16:10\nBildschirmtechnologie: LED\nTouchscreen: Nein\nHD-Typ: WUXGA\nPanel-Typ: IPS\nBildschirmform: Flach\nKontrastverh\u00e4ltnis: 1000:1\nMaximale Bildwiederholrate: 60 Hz\nAnzahl der Farben des Displays: 16,78 Millionen Farben\nTyp der Hintergrundbeleuchtung: W-LED\nHelligkeit (typisch): 300 cd/m\u00b2\nDisplay-Oberfl\u00e4che: Matt\nUnterst\u00fctzte Grafik-Aufl\u00f6sungen: 1920 x 1200 (WUXGA)\nKontrastverh\u00e4ltnis (dynamisch): 3000000:1\nBildwinkel, horizontal: 178\u00b0\nBildwinkel, vertikal: 178\u00b0\nReaktionszeit (schnell): 4 ms\nPixel Abstand: 0,2789 x 0,2823 mm\nSichtbare Gr\u00f6\u00dfe (horizontal): 53,3 cm\nSichtbare Gr\u00f6\u00dfe (vertikal): 33,9 cm\nFarbskala: 99%\n3D: Nein\nEingebaute Lautsprecher: Nein\nIntegrierte Kamera: Nein\nMarktpositionierung: Business\nProduktfarbe: Schwarz\nFu\u00dffarbe: Schwarz\nZertifizierung: CCC, TCO 8.0, TCO Edge 2.0, China Energy Efficiency Standard Tier 2, T\u00dcV Eye Comfort, ULE Gold\nIntegrierter USB-Hub: Ja\nHDMI: Ja\nKopfh\u00f6rerausgang: Ja\nUSB-Hub-Version: 3.2 Gen 1 (3.1 Gen 1)\nAnzahl der vorgeschalteten Steckpl\u00e4tze: 1\nAnzahl der nachgeschalteten Steckpl\u00e4tze vom Typ USB-A: 4\nAnzahl VGA (D-Sub) Anschl\u00fcsse: 1\nDVI Anschluss: Nein\nAnzahl HDMI-Anschl\u00fcsse: 1\nHDMI-Version: 1.4\nAnzahl DisplayPort Anschl\u00fcsse: 1\nDisplayPorts-Version: 1.2\nAudioausgang: Ja\nKopfh\u00f6rer-Anschluss: 3,5 mm\nVESA-Halterung: Ja\nKabelsperre-Slot: Ja\nH\u00f6henverstellung: Ja\nPanel-Montage-Schnittstelle: 100 x 100 mm\nSlot-Typ Kabelsperre: Kensington\nH\u00f6heneinstellung: 11 cm\nPivot: Ja\nPivot Winkel: -90 - 90\u00b0\nSchwenkbar: Ja\nSchwenkwinkelbereich: -45 - 45\u00b0\nNeigungswinkelbereich: -5 - 30\u00b0\nOn-Screen-Display (OSD): Ja\nAnzahl OSD-Sprachen: 8\nNeigungsverstellung: Ja\nEnergieeffizienzklasse (SDR): D\nEnergieverbrauch (SDR) pro 1.000 Stunden: 16 kWh\nStromverbrauch (Standardbetrieb): 25 W\nStromverbrauch (Standby): 0,5 W\nStromverbrauch (max.): 66 W\nStromverbrauch (aus): 0,3 W\nAC Eingangsspannung: 100 - 240 V\nAC Eingangsfrequenz: 50 - 60 Hz\nEnergieeffizienzskala: A bis G\nJ\u00e4hrlicher Energieverbrauch: 52,06 kWh\nSt\u00e4nder enthalten: Ja\nMitgelieferte Kabel: AC, DisplayPort, HDMI, USB\nSchnellstart\u00fcbersicht: Ja\nGer\u00e4tebreite (inkl. Fu\u00df): 548,7 mm\nGer\u00e4tetiefe (inkl. Fu\u00df): 260,4 mm\nGer\u00e4teh\u00f6he (inkl. Fu\u00df): 399,5 mm\nGewicht (mit St\u00e4nder): 5,5 kg\nBreite (ohne Standfu\u00df): 54,9 cm\nTiefe (ohne Standfu\u00df): 4,3 cm\nH\u00f6he (ohne Standfu\u00df): 36,9 cm\nGewicht (ohne St\u00e4nder): 3,58 kg\nBezel Weite (side): 2 mm\nBezel Weite (top): 2 mm\nBezel Weite (bottom): 2,22 cm\nVerpackungsbreite: 160 mm\nVerpackungstiefe: 706 mm\nVerpackungsh\u00f6he: 450 mm\nPaketgewicht: 7,8 kg\nVerpackungsart: Box\nNachhaltigkeitszertifikate: RoHS, EPEAT Bronze, ENERGY STAR\nWarentarifnummer (HS): 85285210\nEin-/Ausschalter: Ja\nTV Tuner integriert: Nein",
    "reference_file": "offer_reference_2012.json",
    "shop_name": "mylemon.at"
}