{
    "html_file": "offer_717_3.html",
    "name": "Acer R2 R242Yyi, 23.8\"",
    "offer_link": "https://www.mylemon.at/artikel/acer/um_qr2ee_001/monitor-lcd-24-r242yyi-dark.html",
    "price": 116.58,
    "raw_specifications": {
        "Anzahl VGA (D-Sub) Anschl\u00fcsse": "1",
        "Anzahl der Farben des Displays": "16,7 Millionen Farben",
        "Artikelnummer": "M1IYAK7L",
        "Aufl\u00f6sung": "1920x1080",
        "Besonderheiten": "75 Hz",
        "Bildschirmdiagonale": "60,5 cm (23.8 Zoll)",
        "Bildschirmdiagonale (cm)": "60,5 cm",
        "Bildschirmform": "Flach",
        "Bildschirmtechnologie": "LCD",
        "Bildwinkel, horizontal": "178\u00b0",
        "Bildwinkel, vertikal": "178\u00b0",
        "Display-Aufl\u00f6sung": "1920 x 1080 Pixel",
        "Displaygr\u00f6\u00dfe": "23,8 Zoll",
        "EAN": "4710886494256",
        "Ergonomie": "Neigbar",
        "HD-Typ": "Full HD",
        "HDMI": "Ja",
        "Helligkeit": "250 cd/m\u00b2",
        "Helligkeit (typisch)": "250 cd/m\u00b2",
        "Hersteller Artikelnummer": "UM.QR2EE.001",
        "Horizontaler Scanbereich": "30 - 85 kHz",
        "Kontrastverh\u00e4ltnis": "1000:1",
        "Kontrastverh\u00e4ltnis (dynamisch)": "100000000:1",
        "Marktpositionierung": "B\u00fcro",
        "Mitgelieferte Kabel": "HDMI",
        "Name der Farbe": "Dark Grey",
        "Natives Seitenverh\u00e4ltnis": "16:9",
        "Panel": "IPS",
        "Panel-Typ": "IPS",
        "Produktfarbe": "Grau",
        "Reaktionszeit": "1 ms",
        "Stromverbrauch (Standardbetrieb)": "30 W",
        "Stromverbrauch (max.)": "30 W",
        "Touchscreen": "Nein",
        "Typ der Hintergrundbeleuchtung": "LED",
        "Vertikaler Scanbereich": "50 - 76 Hz",
        "Video Anschl\u00fcsse": "1x HDMI"
    },
    "raw_specifications_text": "Displaygr\u00f6\u00dfe: 23,8 Zoll\nAufl\u00f6sung: 1920x1080\nPanel: IPS\nReaktionszeit: 1 ms\nVideo Anschl\u00fcsse: 1x HDMI\nErgonomie: Neigbar\nHelligkeit: 250 cd/m\u00b2\nBesonderheiten: 75 Hz\nHersteller Artikelnummer: UM.QR2EE.001\nEAN: 4710886494256\nArtikelnummer: M1IYAK7L\nBildschirmdiagonale: 60,5 cm (23.8 Zoll)\nDisplay-Aufl\u00f6sung: 1920 x 1080 Pixel\nNatives Seitenverh\u00e4ltnis: 16:9\nBildschirmtechnologie: LCD\nTouchscreen: Nein\nHD-Typ: Full HD\nPanel-Typ: IPS\nBildschirmform: Flach\nKontrastverh\u00e4ltnis: 1000:1\nAnzahl der Farben des Displays: 16,7 Millionen Farben\nTyp der Hintergrundbeleuchtung: LED\nHelligkeit (typisch): 250 cd/m\u00b2\nKontrastverh\u00e4ltnis (dynamisch): 100000000:1\nBildwinkel, horizontal: 178\u00b0\nBildwinkel, vertikal: 178\u00b0\nHorizontaler Scanbereich: 30 - 85 kHz\nVertikaler Scanbereich: 50 - 76 Hz\nBildschirmdiagonale (cm): 60,5 cm\nMarktpositionierung: B\u00fcro\nProduktfarbe: Grau\nName der Farbe: Dark Grey\nHDMI: Ja\nAnzahl VGA (D-Sub) Anschl\u00fcsse: 1\nStromverbrauch (Standardbetrieb): 30 W\nStromverbrauch (max.): 30 W\nMitgelieferte Kabel: HDMI",
    "reference_file": "offer_reference_717.json",
    "shop_name": "mylemon.at"
}