{
    "html_file": "offer_1670_27.html",
    "name": "ASUS VY249HE, 23.8\"",
    "offer_link": "https://www.proshop.at/Bildschirm/ASUS-24-Bildschirm-VY249HE-75Hz-Black-1-ms-AMD-FreeSync/2956373?utm_source=geizhals&utm_medium=cpc&utm_campaign=pricesite",
    "price": 166.28,
    "raw_specifications": {
        "Abmessungen (Breite x Tiefe x H\u00f6he)": "54.1 cm x 18.5 cm x 39.3 cm - mit Fu\u00df",
        "Abmessungen (Breite x Tiefe x H\u00f6he) - mit Fu\u00df": "54.1 cm x 18.5 cm x 39.3 cm",
        "Adaptive-Sync Technologie": "AMD FreeSync",
        "Besonderheiten": "HDCP, ASUS Splendid Video Intelligence Technology, Trace Free Technology, ASUS Smart Contrast Ratio (ASCR), ASUS QuickFit Virtual Scale, ASUS GamePlus, flimmerfreie Technologie, Farbtemperatur Auswahl, Low Blue Light-Technologie, an 3 Seiten ohne Blende, 6-bit + A-FRC Color Depth, ASUS EyeCare+ Technology, ASUS BacGuard",
        "Bildschirmbeschichtung": "Blendfrei",
        "Bildschirmtyp": "IPS",
        "Details zu Abmessungen & Gewicht": "Mit Fu\u00df - Breite: 54.1 cm - Tiefe: 18.5 cm - H\u00f6he: 39.3 cm - Gewicht: 3.38 kg  Ohne Fu\u00df - Breite: 54.1 cm - Tiefe: 4.8 cm - H\u00f6he: 39.3 cm - Gewicht: 2.8 kg",
        "Diagonalabmessung": "60.5 cm (23.8\")",
        "Display-Typ": "LED-hintergrundbeleuchteter LCD-Monitor / TFT-Aktivmatrix",
        "EAN": "4718017912969",
        "Eingangsanschl\u00fcsse": "HDMI, VGA",
        "Eingangsspannung": "Wechselstrom 120/230 V (50/60 Hz)",
        "Einstellungen der Anzeigeposition": "Neigung",
        "Energie Effizienzklasse": "Klasse C",
        "Farbunterst\u00fctzung": "16,7 Millionen Farben",
        "Ger\u00e4tetyp": "LED-hintergrundbeleuchteter LCD-Monitor - 60.5 cm (23.8\")",
        "Gewicht": "3.38 kg",
        "Helligkeit": "250 cd/m\u00b2",
        "Hersteller": "ASUS",
        "Hintergrundbeleuchtungs-Technologie": "LED-Hintergrundbeleuchtung",
        "Horizontale Bildwiederholrate": "30 - 86 kHz",
        "Horizontaler Betrachtungswinkel": "178",
        "Kennzeichnung": "JIS Z 2801, TUV Rheinland Low Blue Light Certification, TUV Rheinland Flicker Free Certification, HDCP 1.4, BPR, ISO 22196:2011, POP, ISO 846 B",
        "Kontrast": "1000:1 / 30000000:1 (dynamisch)",
        "Leistungsaufnahme im Ein-Zustand": "12 W",
        "Leistungsmerkmale": "Slot f\u00fcr Sicherheitsschloss (Kabelschloss getrennt erh\u00e4ltlich)",
        "Modell": "90LM06A0-B01H70",
        "Native Aufl\u00f6sung": "Full HD (1080p) 1920 x 1080 bei 75 Hz",
        "Neigungswinkel": "-5/+23",
        "Pixelpitch": "0.2745 mm",
        "Produktbeschreibung": "ASUS VY249HE - LED-Monitor - Full HD (1080p) - 60.5 cm (23.8\")",
        "Reaktionszeit": "5 ms (Gray-to-Gray), 1 ms (MPRT)",
        "Schlosstyp zur Diebstahlsicherung": "Kensington Slot",
        "Schnittstellen": "HDMI  VGA  Kopfh\u00f6rer",
        "Seitenverh\u00e4ltnis": "16:9",
        "Spannung": "Wechselstrom 120/230 V (50/60 Hz)",
        "Stromverbrauch (Aus-Modus)": "0.3 Watt",
        "Stromverbrauch (typisch)": "16 Watt",
        "Stromverbrauch SDR (eingeschaltet)": "12 kWh/1.000 h",
        "TCO-zertifiziert": "TCO Certified Displays 8",
        "Transportbreite": "60.3 cm",
        "Transportgewicht": "4.62 kg",
        "Transporth\u00f6he": "39.2 cm",
        "Transporttiefe": "13 cm",
        "Umweltschutzstandards": "TCO Certified Displays 8",
        "VESA-Halterung": "100 x 100 mm",
        "Vertikale Bildwiederholrate": "48 - 75 Hz",
        "Vertikaler Betrachtungswinkel": "178",
        "Waren-Nr.": "2956373",
        "Zum Hersteller": "www.asus.com/index.aspx"
    },
    "raw_specifications_text": "Hersteller: ASUS\nWaren-Nr.: 2956373\nModell: 90LM06A0-B01H70\nEAN: 4718017912969\nZum Hersteller: www.asus.com/index.aspx\nProduktbeschreibung: ASUS VY249HE - LED-Monitor - Full HD (1080p) - 60.5 cm (23.8\")\nGer\u00e4tetyp: LED-hintergrundbeleuchteter LCD-Monitor - 60.5 cm (23.8\")\nEnergie Effizienzklasse: Klasse C\nLeistungsaufnahme im Ein-Zustand: 12 W\nAdaptive-Sync Technologie: AMD FreeSync\nBildschirmtyp: IPS\nSeitenverh\u00e4ltnis: 16:9\nNative Aufl\u00f6sung: Full HD (1080p) 1920 x 1080 bei 75 Hz\nPixelpitch: 0.2745 mm\nHelligkeit: 250 cd/m\u00b2\nKontrast: 1000:1 / 30000000:1 (dynamisch)\nReaktionszeit: 5 ms (Gray-to-Gray), 1 ms (MPRT)\nFarbunterst\u00fctzung: 16,7 Millionen Farben\nEingangsanschl\u00fcsse: HDMI, VGA\nEinstellungen der Anzeigeposition: Neigung\nBildschirmbeschichtung: Blendfrei\nSpannung: Wechselstrom 120/230 V (50/60 Hz)\nAbmessungen (Breite x Tiefe x H\u00f6he) - mit Fu\u00df: 54.1 cm x 18.5 cm x 39.3 cm\nGewicht: 3.38 kg\nUmweltschutzstandards: TCO Certified Displays 8\nKennzeichnung: JIS Z 2801, TUV Rheinland Low Blue Light Certification, TUV Rheinland Flicker Free Certification, HDCP 1.4, BPR, ISO 22196:2011, POP, ISO 846 B\nDisplay-Typ: LED-hintergrundbeleuchteter LCD-Monitor / TFT-Aktivmatrix\nDiagonalabmessung: 60.5 cm (23.8\")\nVertikale Bildwiederholrate: 48 - 75 Hz\nHorizontale Bildwiederholrate: 30 - 86 kHz\nHorizontaler Betrachtungswinkel: 178\nVertikaler Betrachtungswinkel: 178\nHintergrundbeleuchtungs-Technologie: LED-Hintergrundbeleuchtung\nBesonderheiten: HDCP, ASUS Splendid Video Intelligence Technology, Trace Free Technology, ASUS Smart Contrast Ratio (ASCR), ASUS QuickFit Virtual Scale, ASUS GamePlus, flimmerfreie Technologie, Farbtemperatur Auswahl, Low Blue Light-Technologie, an 3 Seiten ohne Blende, 6-bit + A-FRC Color Depth, ASUS EyeCare+ Technology, ASUS BacGuard\nAbmessungen (Breite x Tiefe x H\u00f6he): 54.1 cm x 18.5 cm x 39.3 cm - mit Fu\u00df\nSchnittstellen: HDMI  VGA  Kopfh\u00f6rer\nNeigungswinkel: -5/+23\nVESA-Halterung: 100 x 100 mm\nLeistungsmerkmale: Slot f\u00fcr Sicherheitsschloss (Kabelschloss getrennt erh\u00e4ltlich)\nSchlosstyp zur Diebstahlsicherung: Kensington Slot\nEingangsspannung: Wechselstrom 120/230 V (50/60 Hz)\nStromverbrauch SDR (eingeschaltet): 12 kWh/1.000 h\nStromverbrauch (typisch): 16 Watt\nStromverbrauch (Aus-Modus): 0.3 Watt\nDetails zu Abmessungen & Gewicht: Mit Fu\u00df - Breite: 54.1 cm - Tiefe: 18.5 cm - H\u00f6he: 39.3 cm - Gewicht: 3.38 kg  Ohne Fu\u00df - Breite: 54.1 cm - Tiefe: 4.8 cm - H\u00f6he: 39.3 cm - Gewicht: 2.8 kg\nTransportbreite: 60.3 cm\nTransporttiefe: 13 cm\nTransporth\u00f6he: 39.2 cm\nTransportgewicht: 4.62 kg\nTCO-zertifiziert: TCO Certified Displays 8",
    "reference_file": "offer_reference_1670.json",
    "shop_name": "Proshop.at"
}