{
    "html_file": "offer_2253_5.html",
    "name": "Dell P2419HC, 23.8\"",
    "offer_link": "https://www.ba-computer.at/dell-p2419hc-led-monitor-61-cm-24-23-8-sichtbar-dell-p2419hc.html",
    "price": 371.47,
    "raw_specifications": {
        "Abmessungen (Breite x Tiefe x H\u00f6he)": "53.78 cm x 16.6 cm x 35.61 cm - mit Fu\u00df",
        "Besonderheiten": "LED-Randlichtsystem, BFR/PVC-frei, ohne Quecksilber, arsenfrei",
        "Bildschirmbeschichtung": "Blendfrei, 3H Hard Coating",
        "Bildschirmtyp": "IPS",
        "Details zu Abmessungen & Gewicht": "Ohne Fu\u00df - Breite: 53.78 cm - Tiefe: 4.28 cm - H\u00f6he: 32.22 cm - Gewicht: 3.52 kg \u00a6 Mit Fu\u00df - Breite: 53.78 cm - Tiefe: 16.6 cm - H\u00f6he: 35.61 cm",
        "Diagonalabmessung": "61 cm (24\")",
        "Display-Typ": "LED-hintergrundbeleuchteter LCD-Monitor / TFT-Aktivmatrix",
        "ENERGY STAR zertifiziert": "Ja",
        "Ein-/Aus-Schalter": "Nein",
        "Eingangsspannung": "Wechselstrom 120/230 V (50/60 Hz)",
        "Einstellungen der Anzeigeposition": "H\u00f6he, Pivot (Rotation), Drehung, Neigung",
        "Energie Effizienzklasse": "Klasse D",
        "Energieverbrauch pro Jahr": "28 kWh",
        "Enthaltene Kabel": "1 x DisplayPort-Kabel - DisplayPort zu DisplayPort \u00a6 1 x USB-C Kabel",
        "Entwickelt f\u00fcr": "Dell 7560 \u00a6 Dell Latitude 5320, 5520, 7400 2-in-1 \u00a6 Dell XPS 13 9380, 15 9570",
        "Farbraum": "72% (CIE 1931)",
        "Farbunterst\u00fctzung": "16,7 Millionen Farben",
        "Helligkeit": "250 cd/m\u00b2",
        "Hintergrundbeleuchtungs-Technologie": "LED-Hintergrundbeleuchtung",
        "Horizontaler Betrachtungswinkel": "178",
        "H\u00f6heneinstellung": "130 mm",
        "Integrierte Peripherieger\u00e4te": "USB 3.0-Hub",
        "Kennzeichnung": "RoHS",
        "Kontrast": "1000:1",
        "Leistungsaufnahme im Ein-Zustand": "14.2 W",
        "Leistungsmerkmale": "Slot f\u00fcr Sicherheitsschloss (Kabelschloss getrennt erh\u00e4ltlich), Unterst\u00fctzung f\u00fcr VESA-Schnittstelle",
        "Max. Betriebstemperatur": "40 \u00b0C",
        "Min Betriebstemperatur": "0 \u00b0C",
        "Native Aufl\u00f6sung": "Full HD (1080p) 1920 x 1080 bei 60 Hz",
        "Neigungswinkel": "-5/+21",
        "Pixelpitch": "0.275 mm",
        "Ppi": "92",
        "Reaktionszeit": "5 ms (fast), 8 ms (normal)",
        "Rotationswinkel": "180",
        "Schlosstyp zur Diebstahlsicherung": "Kensington Slot",
        "Schnittstellen": "DisplayPort \u00a6 DisplayPort-Ausgang \u00a6 HDMI \u00a6 USB-C \u00a6 2 x USB 3.0 Downstream (Typ A) \u00a6 2 x USB 2.0 Downstream (Typ A)",
        "Schwenkwinkel": "90",
        "Seitenverh\u00e4ltnis": "16:9",
        "Services im Bundle": "3 Jahre Advanced Exchange-Service",
        "Sichtbare Bildfl\u00e4che": "60.45 cm (23.8\")",
        "Stromverbrauch (typisch)": "18 Watt",
        "Stromverbrauch SDR (eingeschaltet)": "14.2 kWh/1.000 h",
        "Stromverbrauch im Standby-Modus": "0.3 Watt",
        "TCO-zertifiziert": "TCO Certified Displays 8",
        "Transportgewicht": "7.26 kg",
        "VESA-Halterung": "100 x 100 mm",
        "Vertikaler Betrachtungswinkel": "178",
        "Zubeh\u00f6r im Lieferumfang": "Kabelbinder",
        "Zul\u00e4ssige Luftfeuchtigkeit im Betrieb": "20 - 80% (nicht kondensierend)"
    },
    "raw_specifications_text": "Display-Typ: LED-hintergrundbeleuchteter LCD-Monitor / TFT-Aktivmatrix\nEnergie Effizienzklasse: Klasse D\nEnergieverbrauch pro Jahr: 28 kWh\nDiagonalabmessung: 61 cm (24\")\nSichtbare Bildfl\u00e4che: 60.45 cm (23.8\")\nIntegrierte Peripherieger\u00e4te: USB 3.0-Hub\nBildschirmtyp: IPS\nSeitenverh\u00e4ltnis: 16:9\nNative Aufl\u00f6sung: Full HD (1080p) 1920 x 1080 bei 60 Hz\nPixelpitch: 0.275 mm\nPpi: 92\nHelligkeit: 250 cd/m\u00b2\nKontrast: 1000:1\nFarbunterst\u00fctzung: 16,7 Millionen Farben\nFarbraum: 72% (CIE 1931)\nReaktionszeit: 5 ms (fast), 8 ms (normal)\nHorizontaler Betrachtungswinkel: 178\nVertikaler Betrachtungswinkel: 178\nBildschirmbeschichtung: Blendfrei, 3H Hard Coating\nHintergrundbeleuchtungs-Technologie: LED-Hintergrundbeleuchtung\nBesonderheiten: LED-Randlichtsystem, BFR/PVC-frei, ohne Quecksilber, arsenfrei\nAbmessungen (Breite x Tiefe x H\u00f6he): 53.78 cm x 16.6 cm x 35.61 cm - mit Fu\u00df\nSchnittstellen: DisplayPort \u00a6 DisplayPort-Ausgang \u00a6 HDMI \u00a6 USB-C \u00a6 2 x USB 3.0 Downstream (Typ A) \u00a6 2 x USB 2.0 Downstream (Typ A)\nEinstellungen der Anzeigeposition: H\u00f6he, Pivot (Rotation), Drehung, Neigung\nNeigungswinkel: -5/+21\nSchwenkwinkel: 90\nRotationswinkel: 180\nH\u00f6heneinstellung: 130 mm\nVESA-Halterung: 100 x 100 mm\nLeistungsmerkmale: Slot f\u00fcr Sicherheitsschloss (Kabelschloss getrennt erh\u00e4ltlich), Unterst\u00fctzung f\u00fcr VESA-Schnittstelle\nZubeh\u00f6r im Lieferumfang: Kabelbinder\nEnthaltene Kabel: 1 x DisplayPort-Kabel - DisplayPort zu DisplayPort \u00a6 1 x USB-C Kabel\nKennzeichnung: RoHS\nSchlosstyp zur Diebstahlsicherung: Kensington Slot\nEingangsspannung: Wechselstrom 120/230 V (50/60 Hz)\nLeistungsaufnahme im Ein-Zustand: 14.2 W\nStromverbrauch SDR (eingeschaltet): 14.2 kWh/1.000 h\nStromverbrauch (typisch): 18 Watt\nStromverbrauch im Standby-Modus: 0.3 Watt\nEin-/Aus-Schalter: Nein\nDetails zu Abmessungen & Gewicht: Ohne Fu\u00df - Breite: 53.78 cm - Tiefe: 4.28 cm - H\u00f6he: 32.22 cm - Gewicht: 3.52 kg \u00a6 Mit Fu\u00df - Breite: 53.78 cm - Tiefe: 16.6 cm - H\u00f6he: 35.61 cm\nTransportgewicht: 7.26 kg\nTCO-zertifiziert: TCO Certified Displays 8\nENERGY STAR zertifiziert: Ja\nServices im Bundle: 3 Jahre Advanced Exchange-Service\nMin Betriebstemperatur: 0 \u00b0C\nMax. Betriebstemperatur: 40 \u00b0C\nZul\u00e4ssige Luftfeuchtigkeit im Betrieb: 20 - 80% (nicht kondensierend)\nEntwickelt f\u00fcr: Dell 7560 \u00a6 Dell Latitude 5320, 5520, 7400 2-in-1 \u00a6 Dell XPS 13 9380, 15 9570",
    "reference_file": "offer_reference_2253.json",
    "shop_name": "BA-Computer"
}