{
    "html_file": "offer_373_13.html",
    "name": "iiyama G-Master G2760HSU-B3 Red Eagle, 27\"",
    "offer_link": "https://www.csv-direct.de/artinfo.php?artnr=AGX1644058&KATEGORIE=162&pva=geizhals2",
    "price": 169.89,
    "raw_specifications": {
        "AC Eingangsfrequenz": "50/60 Hz",
        "AC Eingangsspannung": "100 - 240 V",
        "Anzahl DisplayPort Anschl\u00fcsse": "1",
        "Anzahl HDMI-Anschl\u00fcsse": "1",
        "Anzahl OSD-Sprachen": "10",
        "Anzahl der Farben des Displays": "16,7 Millionen Farben",
        "Anzahl der Lautsprecher": "2",
        "Bildschirmdiagonale": "68,6 cm 27\"",
        "Bildschirmdiagonale cm": "68,6 cm",
        "Bildschirmtechnologie": "LED",
        "Bildwinkel, horizontal": "170\u00b0",
        "Bildwinkel, vertikal": "160\u00b0",
        "Display-Aufl\u00f6sung": "1920 x 1080 Pixel",
        "DisplayPorts-Version": "1.3",
        "Energieeffizienzklasse HDR": "G",
        "Energieeffizienzklasse SDR": "F",
        "Energieverbrauch HDR pro 1.000 Stunden": "29 kWh",
        "Energieverbrauch SDR pro 1.000 Stunden": "26 kWh",
        "Ger\u00e4tebreite inkl. Fu\u00df": "613,5 mm",
        "Ger\u00e4teh\u00f6he inkl. Fu\u00df": "440 mm",
        "Ger\u00e4tetiefe inkl. Fu\u00df": "197 mm",
        "Gewicht mit St\u00e4nder": "5,4 kg",
        "HD-Typ": "Full HD",
        "HDMI-Version": "2.0",
        "Helligkeit typisch": "400 cd/m\u00b2",
        "Horizontaler Scanbereich": "31 - 184 kHz",
        "Integrierte Kamera": "Nein",
        "Kontrastverh\u00e4ltnis": "1000:1",
        "Kontrastverh\u00e4ltnis dynamisch": "80000000:1",
        "Men\u00fcsprachen": "Tschechisch, Deutsch, Niederl\u00e4ndisch, Englisch, Spanisch, Franz\u00f6sisch, Italienisch, Japanisch, Polnisch, Russisch",
        "Mitgelieferte Kabel": "AC, HDMI, USB",
        "Natives Seitenverh\u00e4ltnis": "16:9",
        "Neigungswinkelbereich": "-5 - 22\u00b0",
        "Panel-Montage-Schnittstelle": "100 x 100 mm",
        "Panel-Typ": "TN",
        "Pixel Abstand": "0,311 x 0,311 mm",
        "Produktfarbe": "Schwarz",
        "Reaktionszeit": "0,5 ms",
        "Sichtbare Gr\u00f6\u00dfe horizontal": "59,8 cm",
        "Sichtbare Gr\u00f6\u00dfe vertikal": "33,6 cm",
        "Slot-Typ Kabelsperre": "Kensington",
        "Stromverbrauch Standardbetrieb": "23 W",
        "Stromverbrauch Standby": "0,5 W",
        "Stromverbrauch aus": "0,3 W",
        "Technologie mit hohem Dynamikbereich HDR": "High Dynamic Range HDR 400",
        "Touchscreen": "Nein",
        "USB-Hub-Version": "2.0",
        "Zertifizierung": "CE, TUV-GS, EAC, RoHS, ErP, WEEE, EPEAT, REACH, UKCA"
    },
    "raw_specifications_text": "Bildschirmdiagonale: 68,6 cm 27\"\nDisplay-Aufl\u00f6sung: 1920 x 1080 Pixel\nNatives Seitenverh\u00e4ltnis: 16:9\nBildschirmtechnologie: LED\nTouchscreen: Nein\nHD-Typ: Full HD\nPanel-Typ: TN\nKontrastverh\u00e4ltnis: 1000:1\nAnzahl der Farben des Displays: 16,7 Millionen Farben\nHelligkeit typisch: 400 cd/m\u00b2\nReaktionszeit: 0,5 ms\nKontrastverh\u00e4ltnis dynamisch: 80000000:1\nBildwinkel, horizontal: 170\u00b0\nBildwinkel, vertikal: 160\u00b0\nPixel Abstand: 0,311 x 0,311 mm\nHorizontaler Scanbereich: 31 - 184 kHz\nSichtbare Gr\u00f6\u00dfe horizontal: 59,8 cm\nSichtbare Gr\u00f6\u00dfe vertikal: 33,6 cm\nBildschirmdiagonale cm: 68,6 cm\nTechnologie mit hohem Dynamikbereich HDR: High Dynamic Range HDR 400\nIntegrierte Kamera: Nein\nAnzahl der Lautsprecher: 2\nProduktfarbe: Schwarz\nZertifizierung: CE, TUV-GS, EAC, RoHS, ErP, WEEE, EPEAT, REACH, UKCA\nUSB-Hub-Version: 2.0\nAnzahl HDMI-Anschl\u00fcsse: 1\nHDMI-Version: 2.0\nAnzahl DisplayPort Anschl\u00fcsse: 1\nDisplayPorts-Version: 1.3\nPanel-Montage-Schnittstelle: 100 x 100 mm\nSlot-Typ Kabelsperre: Kensington\nNeigungswinkelbereich: -5 - 22\u00b0\nMen\u00fcsprachen: Tschechisch, Deutsch, Niederl\u00e4ndisch, Englisch, Spanisch, Franz\u00f6sisch, Italienisch, Japanisch, Polnisch, Russisch\nAnzahl OSD-Sprachen: 10\nEnergieeffizienzklasse SDR: F\nEnergieeffizienzklasse HDR: G\nEnergieverbrauch SDR pro 1.000 Stunden: 26 kWh\nEnergieverbrauch HDR pro 1.000 Stunden: 29 kWh\nStromverbrauch Standardbetrieb: 23 W\nStromverbrauch Standby: 0,5 W\nStromverbrauch aus: 0,3 W\nAC Eingangsspannung: 100 - 240 V\nAC Eingangsfrequenz: 50/60 Hz\nMitgelieferte Kabel: AC, HDMI, USB\nGer\u00e4tebreite inkl. Fu\u00df: 613,5 mm\nGer\u00e4tetiefe inkl. Fu\u00df: 197 mm\nGer\u00e4teh\u00f6he inkl. Fu\u00df: 440 mm\nGewicht mit St\u00e4nder: 5,4 kg",
    "reference_file": "offer_reference_373.json",
    "shop_name": "CSV-Direct.de"
}