{
    "html_file": "offer_913_6.html",
    "name": "ViewSonic VX1755, 17.2\"",
    "offer_link": "https://direkt.jacob.de/produkte/viewsonic-vx-series-vx1755-artnr-7799227.html?utm_source=geizhals&utm_medium=cpc&utm_campaign=Preisvergleich&ref=103",
    "price": 378.72,
    "raw_specifications": {
        "Anzahl Mini-HDMI-Anschl\u00fcsse": "1",
        "Anzahl der Farben des Displays": "16,7 Millionen Farben",
        "Anzahl der Lautsprecher": "2",
        "Anzahl der Upstream-Ports USB Typ-C": "2",
        "Audioausgang": "Ja",
        "Betriebstemperatur": "0 - 40 \u00b0C",
        "Bildschirmaufl\u00f6sung": "1920 x 1080 Pixel",
        "Bildschirmdiagonale": "43,2 cm (17\" )",
        "Bildschirmform": "Flach",
        "Bildschirmtechnologie": "LED",
        "Bildwinkel, horizontal": "170\u00b0",
        "Bildwinkel, vertikal": "170\u00b0",
        "Breite (ohne Standfu\u00df)": "39,6 cm",
        "Eingebaute Lautsprecher": "Ja",
        "Energie Effizienzklasse": "D",
        "Farbtiefe": "8 Bit",
        "Ger\u00e4tebreite (inkl. Fu\u00df)": "396 mm",
        "Ger\u00e4teh\u00f6he (inkl. Fu\u00df)": "17 mm",
        "Ger\u00e4tetiefe (inkl. Fu\u00df)": "247 mm",
        "Gewicht (mit St\u00e4nder)": "1 g",
        "Gewicht (ohne St\u00e4nder)": "1 g",
        "HD-Typ": "Full HD",
        "HDMI": "Ja",
        "HDMI-Version": "2.0",
        "Helligkeit (typisch)": "250 cd/m\u00b2",
        "H\u00f6he (ohne Standfu\u00df)": "1,7 cm",
        "Integrierter USB-Hub": "Ja",
        "Kontrastverh\u00e4ltnis": "800:1",
        "Kontrastverh\u00e4ltnis (dynamisch)": "80000000:1",
        "Maximale Bildwiederholrate": "144 Hz",
        "Mitgelieferte Kabel": "HDMI to Mini-HDMI, USB Typ-C auf USB Typ-A, USB Typ-C auf USB Typ-C",
        "Natives Seitenverh\u00e4ltnis": "16:9",
        "Neigungswinkelbereich": "20 - 62\u00b0",
        "Paketgewicht": "2,2 g",
        "Panel-Typ": "IPS",
        "Produktfarbe": "Schwarz, Grau",
        "RMS-Leistung": "0,8 W",
        "Reaktionszeit": "4,489 ms",
        "Relative Luftfeuchtigkeit in Betrieb": "20 - 90%",
        "Schnellstart\u00fcbersicht": "Ja",
        "Stromadapter enthalten": "Ja",
        "Stromverbrauch (Standardbetrieb)": "12 W",
        "Stromverbrauch (Standby)": "0,5 W",
        "Stromverbrauch (max.)": "13 W",
        "Tiefe (ohne Standfu\u00df)": "24,7 cm",
        "USB-Hub-Version": "3.2 Gen 1 (3.1 Gen 1)",
        "VESA-Halterung": "Nein",
        "Verpackungsbreite": "495 mm",
        "Verpackungsh\u00f6he": "77 mm",
        "Verpackungstiefe": "395 mm",
        "Zertifizierung": "cTUVus, FCC-B, ICES003, CEC, NRCan, NOM, CE, CE EMC, CB, RoHS, ErP, UkrSEPRO, UKCA"
    },
    "raw_specifications_text": "Bildschirmdiagonale: 43,2 cm (17\" )\nBildschirmaufl\u00f6sung: 1920 x 1080 Pixel\nEnergie Effizienzklasse: D\nNatives Seitenverh\u00e4ltnis: 16:9\nPanel-Typ: IPS\nHD-Typ: Full HD\nBildschirmtechnologie: LED\nBildschirmform: Flach\nKontrastverh\u00e4ltnis: 800:1\nMaximale Bildwiederholrate: 144 Hz\nAnzahl der Farben des Displays: 16,7 Millionen Farben\nHelligkeit (typisch): 250 cd/m\u00b2\nReaktionszeit: 4,489 ms\nKontrastverh\u00e4ltnis (dynamisch): 80000000:1\nBildwinkel, horizontal: 170\u00b0\nBildwinkel, vertikal: 170\u00b0\nFarbtiefe: 8 Bit\nEingebaute Lautsprecher: Ja\nAnzahl der Lautsprecher: 2\nRMS-Leistung: 0,8 W\nProduktfarbe: Schwarz, Grau\nZertifizierung: cTUVus, FCC-B, ICES003, CEC, NRCan, NOM, CE, CE EMC, CB, RoHS, ErP, UkrSEPRO, UKCA\nIntegrierter USB-Hub: Ja\nHDMI: Ja\nUSB-Hub-Version: 3.2 Gen 1 (3.1 Gen 1)\nAnzahl der Upstream-Ports USB Typ-C: 2\nHDMI-Version: 2.0\nAnzahl Mini-HDMI-Anschl\u00fcsse: 1\nAudioausgang: Ja\nVESA-Halterung: Nein\nNeigungswinkelbereich: 20 - 62\u00b0\nStromverbrauch (Standardbetrieb): 12 W\nStromverbrauch (Standby): 0,5 W\nStromverbrauch (max.): 13 W\nBetriebstemperatur: 0 - 40 \u00b0C\nRelative Luftfeuchtigkeit in Betrieb: 20 - 90%\nGer\u00e4tebreite (inkl. Fu\u00df): 396 mm\nGer\u00e4tetiefe (inkl. Fu\u00df): 247 mm\nGer\u00e4teh\u00f6he (inkl. Fu\u00df): 17 mm\nGewicht (mit St\u00e4nder): 1 g\nBreite (ohne Standfu\u00df): 39,6 cm\nTiefe (ohne Standfu\u00df): 24,7 cm\nH\u00f6he (ohne Standfu\u00df): 1,7 cm\nGewicht (ohne St\u00e4nder): 1 g\nMitgelieferte Kabel: HDMI to Mini-HDMI, USB Typ-C auf USB Typ-A, USB Typ-C auf USB Typ-C\nSchnellstart\u00fcbersicht: Ja\nStromadapter enthalten: Ja\nVerpackungsbreite: 495 mm\nVerpackungstiefe: 395 mm\nVerpackungsh\u00f6he: 77 mm\nPaketgewicht: 2,2 g",
    "reference_file": "offer_reference_913.json",
    "shop_name": "Jacob Elektronik direkt (AT)"
}