{
    "html_file": "offer_1100_26.html",
    "name": "GIGABYTE M32QC, 31.5\"",
    "offer_link": "https://www.alternate.at/GIGABYTE/M32QC-Gaming-Monitor/html/product/1816180?partner=AtGeizhalsat&campaign=Monitor/GIGABYTE/1816180",
    "price": 393.0,
    "raw_specifications": {
        "": "VESA DisplayHDR Standard",
        "Abmessungen": "Breite: 71,05 cm x H\u00f6he: 55,22 cm x Tiefe/L\u00e4nge: 23,48 cm",
        "Anschl\u00fcsse": "2x HDMI-Eingang, (HDMI-Version: 2.0), 1x DisplayPort-Eingang, (DisplayPort-Version: 1.2), 1x Kopfh\u00f6rer-Ausgang, 2x USB-A-3.2 Gen 1 (5 Gbit/s), 1x USB-C",
        "Bild": "Glaretyp",
        "Bildschirmaufl\u00f6sung": "2.560 x 1.440 Pixel",
        "Bildschirmdiagonale": "80 cm (32 Zoll)",
        "EAN": "4719331810474",
        "Energieeffizienzklasse (HDR)": "G (A - G)",
        "Energieeffizienzklasse (SDR)": "G (A - G)",
        "Energieverbauch pro 1000 Stunden (HDR)": "64 kWh",
        "Energieverbauch pro 1000 Stunden (SDR)": "40 kWh",
        "Ergonomie": "Typ",
        "Farbe": "schwarz",
        "Features": "Aim Stabilizer Sync, Flicker-Free LED, Low Blue Light, Black Equalizer, KVM Switch, 90 Watt USB-C Power Delivery",
        "Geeignet f\u00fcr": "Gaming",
        "Gewicht": "7,8 kg",
        "Hersteller-Nr.": "M32QC",
        "Leistungsaufnahme im Bereitschafts- und Aus-Zustand": "0,3 Watt",
        "Leistungsaufnahme im Ein-Zustand bei Standard-Dynamikumfang (SDR)": "40 Watt",
        "Leistungsaufnahme im Ein-Zustand bei hohem Dynamikumfang (HDR)": "64 Watt",
        "Standards": "Video",
        "Stromversorgung": "Netzteil",
        "Typ": "Gaming-Monitor",
        "Wandhalterung": "VESA kompatibel (100 x 100 mm)",
        "Weitere Informationen": "Die Bildwiederholrate von 170 Hz wird per overclocking erreicht",
        "Zubeh\u00f6r": "Vorhanden"
    },
    "raw_specifications_text": "Energieeffizienzklasse (SDR): G (A - G)\nEnergieverbauch pro 1000 Stunden (SDR): 40 kWh\nEnergieeffizienzklasse (HDR): G (A - G)\nEnergieverbauch pro 1000 Stunden (HDR): 64 kWh\nLeistungsaufnahme im Ein-Zustand bei Standard-Dynamikumfang (SDR): 40 Watt\nLeistungsaufnahme im Ein-Zustand bei hohem Dynamikumfang (HDR): 64 Watt\nLeistungsaufnahme im Bereitschafts- und Aus-Zustand: 0,3 Watt\nBildschirmdiagonale: 80 cm (32 Zoll)\nBildschirmaufl\u00f6sung: 2.560 x 1.440 Pixel\nTyp: Gaming-Monitor\nFarbe: schwarz\nEAN: 4719331810474\nHersteller-Nr.: M32QC\nGeeignet f\u00fcr: Gaming\nBild: Glaretyp\n: VESA DisplayHDR Standard\nAnschl\u00fcsse: 2x HDMI-Eingang, (HDMI-Version: 2.0), 1x DisplayPort-Eingang, (DisplayPort-Version: 1.2), 1x Kopfh\u00f6rer-Ausgang, 2x USB-A-3.2 Gen 1 (5 Gbit/s), 1x USB-C\nErgonomie: Typ\nStromversorgung: Netzteil\nStandards: Video\nWandhalterung: VESA kompatibel (100 x 100 mm)\nFeatures: Aim Stabilizer Sync, Flicker-Free LED, Low Blue Light, Black Equalizer, KVM Switch, 90 Watt USB-C Power Delivery\nWeitere Informationen: Die Bildwiederholrate von 170 Hz wird per overclocking erreicht\nZubeh\u00f6r: Vorhanden\nAbmessungen: Breite: 71,05 cm x H\u00f6he: 55,22 cm x Tiefe/L\u00e4nge: 23,48 cm\nGewicht: 7,8 kg",
    "reference_file": "offer_reference_1100.json",
    "shop_name": "Alternate.at"
}