{
    "html_file": "offer_1479_2.html",
    "name": "Samsung UR590 / UR592 / UR594 (2021), 31.5\"",
    "offer_link": "https://direkt.jacob.de/produkte/samsung-u32r594cwr-81-3-lu32r594cwrxzg-artnr-6978582.html?utm_source=geizhals&utm_medium=cpc&utm_campaign=Preisvergleich&ref=103",
    "price": 349.68,
    "raw_specifications": {
        "Abmessungen (Breite x Tiefe x H\u00f6he)": "71.27 cm x 23.79 cm x 51.5 cm - mit Fu\u00df",
        "Abmessungen (Breite x Tiefe x H\u00f6he) - mit Fu\u00df": "71.27 cm x 23.79 cm x 51.5 cm",
        "Besonderheiten": "MagicBright, Spielmodus, Magic Upscale, flimmerfreie Technologie, Image Size, Eye Saver Mode, Picture-by-Picture",
        "Bildschirmtyp": "VA",
        "Details zu Abmessungen & Gewicht": "Mit Fu\u00df - Breite: 71.27 cm - Tiefe: 23.79 cm - H\u00f6he: 51.5 cm - Gewicht: 5.5 kg  Ohne Fu\u00df - Breite: 71.27 cm - Tiefe: 8.36 cm - H\u00f6he: 42.09 cm - Gewicht: 4.8 kg",
        "Diagonalabmessung": "80 cm (32\")",
        "Display-Typ": "LED-hintergrundbeleuchteter LCD-Monitor / TFT-Aktivmatrix",
        "Eingangsanschl\u00fcsse": "HDMI, DisplayPort",
        "Einstellungen der Anzeigeposition": "Neigung",
        "Energie Effizienzklasse": "Klasse G",
        "Energieverbrauch pro Jahr": "57 kWh",
        "Enthaltene Kabel": "1 x HDMI-Kabel",
        "Erforderliche Netzspannung": "Wechselstrom 120/230 V",
        "Farbe": "Dunkelgrau/blau",
        "Farbunterst\u00fctzung": "1 Milliarde Farben",
        "Ger\u00e4tetyp": "LED-hintergrundbeleuchteter LCD-Monitor - 80 cm (32\")",
        "Geschwungener Bildschirm": "Ja (1500R)",
        "Gewicht": "5.5 kg",
        "Helligkeit": "250 cd/m\u00b2",
        "Hintergrundbeleuchtungs-Technologie": "LED-Hintergrundbeleuchtung",
        "Horizontaler Betrachtungswinkel": "178",
        "Kennzeichnung": "DDC-2B, ISO 9241-307, EMI",
        "Kontrast": "2500:1",
        "Leistungsaufnahme im Ein-Zustand": "39 W",
        "Mitgelieferte Software": "Easy Setting Box",
        "Native Aufl\u00f6sung": "4K 3840 x 2160 bei 60 Hz",
        "Neigungswinkel": "-1/+17",
        "Produktbeschreibung": "Samsung U32R594CWR - LED-Monitor - gebogen - 4K - 80 cm (32\")",
        "Reaktionszeit": "4 ms (gray-to-gray)",
        "Schnittstellen": "DisplayPort  HDMI  Kopfh\u00f6rer",
        "Seitenverh\u00e4ltnis": "16:9",
        "Sichtbare Bildfl\u00e4che": "80 cm (31.5\")",
        "Stromverbrauch (Aus-Modus)": "0.3 Watt",
        "Stromverbrauch (eingeschaltet)": "39 kWh/1.000 h",
        "Stromverbrauch (typisch)": "39 Watt",
        "Stromverbrauch im Standby-Modus": "0.5 Watt",
        "Transportbreite": "79.5 cm",
        "Transportgewicht": "8.4 kg",
        "Transporth\u00f6he": "18.9 cm",
        "Transporttiefe": "50.3 cm",
        "Vertikaler Betrachtungswinkel": "178"
    },
    "raw_specifications_text": "Produktbeschreibung: Samsung U32R594CWR - LED-Monitor - gebogen - 4K - 80 cm (32\")\nGer\u00e4tetyp: LED-hintergrundbeleuchteter LCD-Monitor - 80 cm (32\")\nEnergie Effizienzklasse: Klasse G\nEnergieverbrauch pro Jahr: 57 kWh\nLeistungsaufnahme im Ein-Zustand: 39 W\nGeschwungener Bildschirm: Ja (1500R)\nBildschirmtyp: VA\nSeitenverh\u00e4ltnis: 16:9\nNative Aufl\u00f6sung: 4K 3840 x 2160 bei 60 Hz\nHelligkeit: 250 cd/m\u00b2\nKontrast: 2500:1\nReaktionszeit: 4 ms (gray-to-gray)\nFarbunterst\u00fctzung: 1 Milliarde Farben\nEingangsanschl\u00fcsse: HDMI, DisplayPort\nEinstellungen der Anzeigeposition: Neigung\nFarbe: Dunkelgrau/blau\nAbmessungen (Breite x Tiefe x H\u00f6he) - mit Fu\u00df: 71.27 cm x 23.79 cm x 51.5 cm\nGewicht: 5.5 kg\nKennzeichnung: DDC-2B, ISO 9241-307, EMI\nDisplay-Typ: LED-hintergrundbeleuchteter LCD-Monitor / TFT-Aktivmatrix\nDiagonalabmessung: 80 cm (32\")\nSichtbare Bildfl\u00e4che: 80 cm (31.5\")\nHorizontaler Betrachtungswinkel: 178\nVertikaler Betrachtungswinkel: 178\nHintergrundbeleuchtungs-Technologie: LED-Hintergrundbeleuchtung\nBesonderheiten: MagicBright, Spielmodus, Magic Upscale, flimmerfreie Technologie, Image Size, Eye Saver Mode, Picture-by-Picture\nAbmessungen (Breite x Tiefe x H\u00f6he): 71.27 cm x 23.79 cm x 51.5 cm - mit Fu\u00df\nSchnittstellen: DisplayPort  HDMI  Kopfh\u00f6rer\nNeigungswinkel: -1/+17\nEnthaltene Kabel: 1 x HDMI-Kabel\nErforderliche Netzspannung: Wechselstrom 120/230 V\nStromverbrauch (eingeschaltet): 39 kWh/1.000 h\nStromverbrauch (typisch): 39 Watt\nStromverbrauch im Standby-Modus: 0.5 Watt\nStromverbrauch (Aus-Modus): 0.3 Watt\nMitgelieferte Software: Easy Setting Box\nDetails zu Abmessungen & Gewicht: Mit Fu\u00df - Breite: 71.27 cm - Tiefe: 23.79 cm - H\u00f6he: 51.5 cm - Gewicht: 5.5 kg  Ohne Fu\u00df - Breite: 71.27 cm - Tiefe: 8.36 cm - H\u00f6he: 42.09 cm - Gewicht: 4.8 kg\nTransportbreite: 79.5 cm\nTransporttiefe: 50.3 cm\nTransporth\u00f6he: 18.9 cm\nTransportgewicht: 8.4 kg",
    "reference_file": "offer_reference_1479.json",
    "shop_name": "Jacob Elektronik direkt (AT)"
}