{
    "html_file": "offer_240_13.html",
    "name": "Corsair Xeneon 27QHD240 OLED, 26.5\"",
    "offer_link": "https://www.ba-computer.at/corsair-xeneon-27qhd240-oled-monitor-gaming-68-6-cm-27-cm-9030002-pe.html",
    "price": 1233.85,
    "raw_specifications": {
        "Adaptive-Sync Technologie": "NVIDIA G-SYNC Compatible, AMD FreeSync Premium",
        "Besonderheiten": "Flimmerfreie Technologie, Low Blue Light-Technologie, Variable Refresh Rate (VRR), Einbrennschutz, OSD-Ann\u00e4herungssensor, OLED META Technology",
        "Bildschirmbeschichtung": "Blendfrei",
        "Diagonalabmessung": "68.6 cm (27\")",
        "Display-Typ": "OLED-Monitor / OLED",
        "Einstellungen der Anzeigeposition": "H\u00f6he, Pivot (Rotation), Drehung, Neigung",
        "Farbraum": "98.5% DCI-P3, 100% sRGB",
        "Farbunterst\u00fctzung": "1,07 Mrd. Farben",
        "Gaming": "Ja",
        "Gewicht": "9.1 kg",
        "Helligkeit": "1000 cd/m\u00b2",
        "H\u00f6heneinstellung": "100 mm",
        "Integrierte Peripherieger\u00e4te": "USB 3.1 Gen 1/USB-C Hub",
        "Kennzeichnung": "TUV Rheinland Low Blue Light Certification",
        "Kontrast": "1500000:1",
        "Mitgelieferte Software": "CORSAIR iCUE",
        "Native Aufl\u00f6sung": "QHD 2560 x 1440 bei 240 Hz",
        "Neigungswinkel": "-7/+15",
        "Ppi": "110",
        "Reaktionszeit": "0,03 ms (Gray-to-Gray)",
        "Rotationswinkel": "-90/+90",
        "Schnittstellen": "2 x HDMI 2.1 \u00a6 DisplayPort 1.4 \u00a6 USB-C 3.1 Gen 1 Upstream/DisplayPort Alt Mode \u00a6 USB-C 3.1 Gen 1 Upstream \u00a6 4 x USB 3.1 Gen 1 Downstream \u00a6 Kombinierter Kopfh\u00f6rer-/-Mikrofonstecker",
        "Schwenkwinkel": "60",
        "Seitenverh\u00e4ltnis": "16:9",
        "Service und Support": "Begrenzte Garantie - 3 Jahre",
        "Services im Bundle": "Zero Dead Pixel Guarantee",
        "Stromverbrauch (max.)": "180 Watt",
        "VESA-Halterung": "100 x 100 mm",
        "Zubeh\u00f6r im Lieferumfang": "Netzteil"
    },
    "raw_specifications_text": "Display-Typ: OLED-Monitor / OLED\nDiagonalabmessung: 68.6 cm (27\")\nAdaptive-Sync Technologie: NVIDIA G-SYNC Compatible, AMD FreeSync Premium\nIntegrierte Peripherieger\u00e4te: USB 3.1 Gen 1/USB-C Hub\nSeitenverh\u00e4ltnis: 16:9\nNative Aufl\u00f6sung: QHD 2560 x 1440 bei 240 Hz\nPpi: 110\nHelligkeit: 1000 cd/m\u00b2\nKontrast: 1500000:1\nFarbunterst\u00fctzung: 1,07 Mrd. Farben\nFarbraum: 98.5% DCI-P3, 100% sRGB\nReaktionszeit: 0,03 ms (Gray-to-Gray)\nGaming: Ja\nBildschirmbeschichtung: Blendfrei\nBesonderheiten: Flimmerfreie Technologie, Low Blue Light-Technologie, Variable Refresh Rate (VRR), Einbrennschutz, OSD-Ann\u00e4herungssensor, OLED META Technology\nGewicht: 9.1 kg\nSchnittstellen: 2 x HDMI 2.1 \u00a6 DisplayPort 1.4 \u00a6 USB-C 3.1 Gen 1 Upstream/DisplayPort Alt Mode \u00a6 USB-C 3.1 Gen 1 Upstream \u00a6 4 x USB 3.1 Gen 1 Downstream \u00a6 Kombinierter Kopfh\u00f6rer-/-Mikrofonstecker\nEinstellungen der Anzeigeposition: H\u00f6he, Pivot (Rotation), Drehung, Neigung\nNeigungswinkel: -7/+15\nSchwenkwinkel: 60\nRotationswinkel: -90/+90\nH\u00f6heneinstellung: 100 mm\nVESA-Halterung: 100 x 100 mm\nZubeh\u00f6r im Lieferumfang: Netzteil\nKennzeichnung: TUV Rheinland Low Blue Light Certification\nStromverbrauch (max.): 180 Watt\nMitgelieferte Software: CORSAIR iCUE\nService und Support: Begrenzte Garantie - 3 Jahre\nServices im Bundle: Zero Dead Pixel Guarantee",
    "reference_file": "offer_reference_240.json",
    "shop_name": "BA-Computer"
}