{
    "html_file": "offer_1727_12.html",
    "name": "Philips P-line 279P1, 27\"",
    "offer_link": "https://www.ba-computer.at/philips-p-line-279p1-led-monitor-68-6-cm-27-279p1-00.html",
    "price": 459.9,
    "raw_specifications": {
        "Abmessungen (Breite x Tiefe x H\u00f6he)": "61.3 cm x 20.5 cm x 53.7 cm - mit Fu\u00df",
        "Ausgangsleistung/Kanal": "3 Watt",
        "Besonderheiten": "PowerSensor, SmartImage, Smart ErgoBase, Low Blue Light Mode, flimmerfreie Technologie, SmartUniformity, Adaptive-Sync-Technologie, LightSensor, EasyRead, sRGB Mode, Monitorkalibrierung Delta E<2, High Bit Rate 3 (HBR3)",
        "Bildschirmbeschichtung": "Blendfrei, 3H Hard Coating, Haze 25 %",
        "Bildschirmtyp": "IPS",
        "Details zu Abmessungen & Gewicht": "Mit Standfu\u00df (h\u00f6chste Position) - Breite: 61.3 cm - Tiefe: 20.5 cm - H\u00f6he: 53.7 cm - Gewicht: 7.38 kg \u00a6 Ohne Fu\u00df - Breite: 61.3 cm - Tiefe: 5.4 cm - H\u00f6he: 36.6 cm - Gewicht: 5.73 kg",
        "Diagonalabmessung": "68.6 cm (27\")",
        "Display-Typ": "LED-hintergrundbeleuchteter LCD-Monitor / TFT-Aktivmatrix",
        "ENERGY STAR zertifiziert": "Ja",
        "ENERGY STAR-Version": "8.0",
        "Ein-/Aus-Schalter": "Ja",
        "Eingangsspannung": "Wechselstrom 120/230 V (50/60 Hz)",
        "Einstellungen der Anzeigeposition": "H\u00f6he, Pivot (Rotation), Drehung, Neigung",
        "Energie Effizienzklasse": "Klasse G",
        "Energieverbrauch pro Jahr": "44 kWh",
        "Enthaltene Kabel": "DisplayPort-Kabel \u00a6 HDMI-Kabel \u00a6 USB-C Kabel",
        "Farbe": "Black Texture",
        "Farbraum": "103% NTSC (CIE 1976), 122% sRGB (CIE 1931)",
        "Farbunterst\u00fctzung": "1,07 Mrd. Farben",
        "Gewicht": "7.38 kg",
        "Helligkeit": "350 cd/m\u00b2",
        "Hintergrundbeleuchtungs-Technologie": "WLED",
        "Horizontale Bildwiederholrate": "30 - 140 kHz",
        "Horizontaler Betrachtungswinkel": "178",
        "H\u00f6heneinstellung": "150 mm",
        "Integrierte Peripherieger\u00e4te": "USB Hub, Gigabit Ethernet-Netzwerkadapter",
        "Kennzeichnung": "Plug and Play, FCC Klasse B bescheinigt, TUV GS, ICES-003, SEMKO, CB, TUV Ergo, DDC/CI, RoHS, Bleifrei, EPA, cETLus, CU-EAC, BFR-frei, Ukraine, PVC-free, quecksilberfrei, TUV Eye Comfort certified, EAEU RoHS",
        "Kontrast": "1000:1 / 50000000:1 (dynamisch)",
        "Leistungsaufnahme im Ein-Zustand": "30.3 W",
        "Leistungsmerkmale": "Slot f\u00fcr Sicherheitsschloss (Kabelschloss getrennt erh\u00e4ltlich), DisplayPort Alt Mode",
        "MTBF": "70,000 Stunde(n)",
        "Max. Betriebstemperatur": "40 \u00b0C",
        "Min Betriebstemperatur": "0 \u00b0C",
        "Mitgelieferte Software": "Philips SmartControl",
        "Native Aufl\u00f6sung": "4K 3840 x 2160 bei 60 Hz",
        "Neigungswinkel": "-5/+30",
        "OSD-Sprachen": "Multilingual",
        "Pixelpitch": "0.1554 mm",
        "Ppi": "163",
        "Reaktionszeit": "4 ms (gray-to-gray)",
        "Rotationswinkel": "180",
        "Schlosstyp zur Diebstahlsicherung": "Kensington Slot",
        "Schnittstellen": "2 x HDMI (HDCP 2.2) \u00a6 DisplayPort 1.4 (HDCP 2.2) \u00a6 USB-C 3,2 Gen 2 Upstream (bis zu 90 W) \u00a6 3 x USB 3.2 Downstream \u00a6 USB 3.2 Downstream (Schnellladung) \u00a6 Audio Line-Out \u00a6 Netzwerk (RJ-45)",
        "Schwenkwinkel": "360",
        "Seitenverh\u00e4ltnis": "16:9",
        "Service und Support": "Begrenzte Garantie - 3 Jahre",
        "Stromverbrauch (Aus-Modus)": "0 Watt",
        "Stromverbrauch (typisch)": "25.9 Watt",
        "Stromverbrauch SDR (eingeschaltet)": "30.3 kWh/1.000 h",
        "Stromverbrauch im Standby-Modus": "0.3 Watt",
        "TCO-zertifiziert": "TCO Certified Displays 8, TCO Certified Edge Displays",
        "Transportbreite": "73 cm",
        "Transportgewicht": "9.18 kg",
        "Transporth\u00f6he": "47.1 cm",
        "Transporttiefe": "19.3 cm",
        "Typ": "Lautsprecher - Stereo",
        "USB-Spannungsversorgung": "90 Watt",
        "VESA-Halterung": "100 x 100 mm",
        "Vertikale Bildwiederholrate": "23 - 60 Hz",
        "Vertikaler Betrachtungswinkel": "178",
        "Zul\u00e4ssige Luftfeuchtigkeit im Betrieb": "20 - 80%"
    },
    "raw_specifications_text": "Display-Typ: LED-hintergrundbeleuchteter LCD-Monitor / TFT-Aktivmatrix\nEnergie Effizienzklasse: Klasse G\nEnergieverbrauch pro Jahr: 44 kWh\nDiagonalabmessung: 68.6 cm (27\")\nIntegrierte Peripherieger\u00e4te: USB Hub, Gigabit Ethernet-Netzwerkadapter\nUSB-Spannungsversorgung: 90 Watt\nBildschirmtyp: IPS\nSeitenverh\u00e4ltnis: 16:9\nNative Aufl\u00f6sung: 4K 3840 x 2160 bei 60 Hz\nPixelpitch: 0.1554 mm\nPpi: 163\nHelligkeit: 350 cd/m\u00b2\nKontrast: 1000:1 / 50000000:1 (dynamisch)\nFarbunterst\u00fctzung: 1,07 Mrd. Farben\nFarbraum: 103% NTSC (CIE 1976), 122% sRGB (CIE 1931)\nReaktionszeit: 4 ms (gray-to-gray)\nVertikale Bildwiederholrate: 23 - 60 Hz\nHorizontale Bildwiederholrate: 30 - 140 kHz\nHorizontaler Betrachtungswinkel: 178\nVertikaler Betrachtungswinkel: 178\nBildschirmbeschichtung: Blendfrei, 3H Hard Coating, Haze 25 %\nHintergrundbeleuchtungs-Technologie: WLED\nOSD-Sprachen: Multilingual\nBesonderheiten: PowerSensor, SmartImage, Smart ErgoBase, Low Blue Light Mode, flimmerfreie Technologie, SmartUniformity, Adaptive-Sync-Technologie, LightSensor, EasyRead, sRGB Mode, Monitorkalibrierung Delta E<2, High Bit Rate 3 (HBR3)\nFarbe: Black Texture\nAbmessungen (Breite x Tiefe x H\u00f6he): 61.3 cm x 20.5 cm x 53.7 cm - mit Fu\u00df\nGewicht: 7.38 kg\nTyp: Lautsprecher - Stereo\nAusgangsleistung/Kanal: 3 Watt\nSchnittstellen: 2 x HDMI (HDCP 2.2) \u00a6 DisplayPort 1.4 (HDCP 2.2) \u00a6 USB-C 3,2 Gen 2 Upstream (bis zu 90 W) \u00a6 3 x USB 3.2 Downstream \u00a6 USB 3.2 Downstream (Schnellladung) \u00a6 Audio Line-Out \u00a6 Netzwerk (RJ-45)\nEinstellungen der Anzeigeposition: H\u00f6he, Pivot (Rotation), Drehung, Neigung\nNeigungswinkel: -5/+30\nSchwenkwinkel: 360\nRotationswinkel: 180\nH\u00f6heneinstellung: 150 mm\nVESA-Halterung: 100 x 100 mm\nLeistungsmerkmale: Slot f\u00fcr Sicherheitsschloss (Kabelschloss getrennt erh\u00e4ltlich), DisplayPort Alt Mode\nEnthaltene Kabel: DisplayPort-Kabel \u00a6 HDMI-Kabel \u00a6 USB-C Kabel\nMTBF: 70,000 Stunde(n)\nKennzeichnung: Plug and Play, FCC Klasse B bescheinigt, TUV GS, ICES-003, SEMKO, CB, TUV Ergo, DDC/CI, RoHS, Bleifrei, EPA, cETLus, CU-EAC, BFR-frei, Ukraine, PVC-free, quecksilberfrei, TUV Eye Comfort certified, EAEU RoHS\nSchlosstyp zur Diebstahlsicherung: Kensington Slot\nEingangsspannung: Wechselstrom 120/230 V (50/60 Hz)\nLeistungsaufnahme im Ein-Zustand: 30.3 W\nStromverbrauch SDR (eingeschaltet): 30.3 kWh/1.000 h\nStromverbrauch (typisch): 25.9 Watt\nStromverbrauch im Standby-Modus: 0.3 Watt\nStromverbrauch (Aus-Modus): 0 Watt\nEin-/Aus-Schalter: Ja\nMitgelieferte Software: Philips SmartControl\nDetails zu Abmessungen & Gewicht: Mit Standfu\u00df (h\u00f6chste Position) - Breite: 61.3 cm - Tiefe: 20.5 cm - H\u00f6he: 53.7 cm - Gewicht: 7.38 kg \u00a6 Ohne Fu\u00df - Breite: 61.3 cm - Tiefe: 5.4 cm - H\u00f6he: 36.6 cm - Gewicht: 5.73 kg\nTransportbreite: 73 cm\nTransporttiefe: 19.3 cm\nTransporth\u00f6he: 47.1 cm\nTransportgewicht: 9.18 kg\nTCO-zertifiziert: TCO Certified Displays 8, TCO Certified Edge Displays\nENERGY STAR zertifiziert: Ja\nENERGY STAR-Version: 8.0\nService und Support: Begrenzte Garantie - 3 Jahre\nMin Betriebstemperatur: 0 \u00b0C\nMax. Betriebstemperatur: 40 \u00b0C\nZul\u00e4ssige Luftfeuchtigkeit im Betrieb: 20 - 80%",
    "reference_file": "offer_reference_1727.json",
    "shop_name": "BA-Computer"
}