{
    "html_file": "offer_293_1.html",
    "name": "LG UltraFine 27UN880P-B, 27\"",
    "offer_link": "https://www.proshop.at/Bildschirm/LG-27-Bildschirm-UltraFine-Ergo-27UN880P-B-4K-UHD-USB-60W-Hub-Speakers-Black-5-ms-AMD-FreeSync/3153991?utm_source=geizhals&utm_medium=cpc&utm_campaign=pricesite",
    "price": 391.25,
    "raw_specifications": {
        "Abmessungen (Breite x Tiefe x H\u00f6he)": "61.31 cm x 40.02 cm x 59.6 cm - mit Fu\u00df",
        "Abmessungen (Breite x Tiefe x H\u00f6he) - mit Fu\u00df": "61.31 cm x 40.02 cm x 59.6 cm",
        "Adaptive-Sync Technologie": "AMD FreeSync",
        "Ausgangsleistung/Kanal": "5 Watt",
        "Besonderheiten": "ErgoStand, Geteilter Bildschirm, Cinema Mode, CustomColor Mode, Vivid Color, TrueColor Pro, FPS Mode, Flicker Safe, Reader Mode, RTS Mode, EBU-Farbskala, MaxxAudio, Farbkalibrierung, Black Stabilizer, DAS Mode (Dynamic Action Sync), Color Weakness Mode, HDR Effect, 10 bits (8 bits + FRC)",
        "Bildschirmbeschichtung": "Blendfrei",
        "Bildschirmtyp": "IPS",
        "Details zu Abmessungen & Gewicht": "Mit Standfu\u00df (niedrigste Position) - Breite: 61.31 cm - Tiefe: 40.02 cm - H\u00f6he: 59.6 cm - Gewicht: 7.8 kg  Mit Standfu\u00df (h\u00f6chste Position) - Breite: 61.31 cm - Tiefe: 40.02 cm - H\u00f6he: 72.6 cm - Gewicht: 7.8 kg  Ohne Fu\u00df - Breite: 61.31 cm - Tiefe: 4.46 cm - H\u00f6he: 36.44 cm - Gewicht: 4 kg",
        "Diagonalabmessung": "68 cm (27\")",
        "Display-Typ": "LED-hintergrundbeleuchteter LCD-Monitor / TFT-Aktivmatrix",
        "EAN": "8806091984227",
        "Eingangsanschl\u00fcsse": "2xHDMI, DisplayPort, USB-C",
        "Einstellungen der Anzeigeposition": "H\u00f6he, Pivot (Rotation), Drehung, Neigung, ausfahren, einfahren",
        "Energie Effizienzklasse": "Klasse F",
        "Energieklasse (HDR)": "Klasse G",
        "Enthaltene Kabel": "1 x HDMI-Kabel  1 x USB-C Kabel",
        "Farbraum": "99% sRGB (CIE 1931)",
        "Farbunterst\u00fctzung": "1,07 Mrd. Farben",
        "Ger\u00e4tetyp": "LED-hintergrundbeleuchteter LCD-Monitor - 68 cm (27\")",
        "Gewicht": "7.8 kg",
        "HDR-Format": "HDR10",
        "HDR-Zertifizierung": "DisplayHDR 400",
        "HDR-f\u00e4hig": "HDR10 / DisplayHDR 400",
        "Helligkeit": "350 cd/m\u00b2",
        "Hersteller": "LG",
        "Hintergrundbeleuchtungs-Technologie": "LED-Hintergrundbeleuchtung",
        "Horizontaler Betrachtungswinkel": "178",
        "H\u00f6heneinstellung": "130 mm",
        "Integrierte Peripherieger\u00e4te": "USB 3.0-Hub",
        "Kennzeichnung": "FCC Klasse B bescheinigt, TUV, CB, RoHS, EPA 8.0, UL/cUL",
        "Kontrast": "5000000:1 (dynamisch)",
        "Leistungsmerkmale": "Slot f\u00fcr Sicherheitsschloss (Kabelschloss getrennt erh\u00e4ltlich), abnehmbarer St\u00e4nder",
        "Mitgelieferte Software": "LG On-Screen Control",
        "Modell": "27UN880P-B",
        "Native Aufl\u00f6sung": "4K 3840 x 2160 bei 60 Hz",
        "Neigungswinkel": "-25/+25",
        "Pixelpitch": "0.15 mm",
        "Produktbeschreibung": "LG UltraFine Ergo 27UN880P-B - UN880P Series - LED-Monitor - 4K - 68 cm (27\") - HDR",
        "Reaktionszeit": "5 ms (Gray-to-Gray)",
        "Rotationswinkel": "90",
        "Schlosstyp zur Diebstahlsicherung": "Kensington Slot",
        "Schnittstellen": "2 x HDMI 2.0 (HDCP 2.2)  DisplayPort 1.4 (HDCP 2.2)  USB-C (bis zu 60 W)  Kopfh\u00f6rer (Mini-Klinkenstecker)  2 x USB 3.0 Downstream",
        "Schwenkwinkel": "560",
        "Seitenverh\u00e4ltnis": "16:9",
        "Stromverbrauch HDR (eingeschaltet)": "44 kWh/1.000 h",
        "Stromverbrauch SDR (eingeschaltet)": "26 kWh/1.000 h",
        "Typ": "Lautsprecher - Stereo",
        "USB-Spannungsversorgung": "60 Watt",
        "VESA-Halterung": "100 x 100 mm",
        "Vertikaler Betrachtungswinkel": "178",
        "Waren-Nr.": "3153991",
        "Zum Hersteller": "www.lge.com"
    },
    "raw_specifications_text": "Hersteller: LG\nWaren-Nr.: 3153991\nModell: 27UN880P-B\nEAN: 8806091984227\nZum Hersteller: www.lge.com\nProduktbeschreibung: LG UltraFine Ergo 27UN880P-B - UN880P Series - LED-Monitor - 4K - 68 cm (27\") - HDR\nGer\u00e4tetyp: LED-hintergrundbeleuchteter LCD-Monitor - 68 cm (27\")\nEnergie Effizienzklasse: Klasse F\nAdaptive-Sync Technologie: AMD FreeSync\nLeistungsmerkmale: Slot f\u00fcr Sicherheitsschloss (Kabelschloss getrennt erh\u00e4ltlich), abnehmbarer St\u00e4nder\nBildschirmtyp: IPS\nSeitenverh\u00e4ltnis: 16:9\nNative Aufl\u00f6sung: 4K 3840 x 2160 bei 60 Hz\nPixelpitch: 0.15 mm\nHelligkeit: 350 cd/m\u00b2\nKontrast: 5000000:1 (dynamisch)\nHDR-f\u00e4hig: HDR10 / DisplayHDR 400\nReaktionszeit: 5 ms (Gray-to-Gray)\nFarbunterst\u00fctzung: 1,07 Mrd. Farben\nFarbraum: 99% sRGB (CIE 1931)\nEingangsanschl\u00fcsse: 2xHDMI, DisplayPort, USB-C\nEinstellungen der Anzeigeposition: H\u00f6he, Pivot (Rotation), Drehung, Neigung, ausfahren, einfahren\nBildschirmbeschichtung: Blendfrei\nAbmessungen (Breite x Tiefe x H\u00f6he) - mit Fu\u00df: 61.31 cm x 40.02 cm x 59.6 cm\nGewicht: 7.8 kg\nKennzeichnung: FCC Klasse B bescheinigt, TUV, CB, RoHS, EPA 8.0, UL/cUL\nDisplay-Typ: LED-hintergrundbeleuchteter LCD-Monitor / TFT-Aktivmatrix\nEnergieklasse (HDR): Klasse G\nDiagonalabmessung: 68 cm (27\")\nIntegrierte Peripherieger\u00e4te: USB 3.0-Hub\nUSB-Spannungsversorgung: 60 Watt\nHDR-Format: HDR10\nHDR-Zertifizierung: DisplayHDR 400\nHorizontaler Betrachtungswinkel: 178\nVertikaler Betrachtungswinkel: 178\nHintergrundbeleuchtungs-Technologie: LED-Hintergrundbeleuchtung\nBesonderheiten: ErgoStand, Geteilter Bildschirm, Cinema Mode, CustomColor Mode, Vivid Color, TrueColor Pro, FPS Mode, Flicker Safe, Reader Mode, RTS Mode, EBU-Farbskala, MaxxAudio, Farbkalibrierung, Black Stabilizer, DAS Mode (Dynamic Action Sync), Color Weakness Mode, HDR Effect, 10 bits (8 bits + FRC)\nAbmessungen (Breite x Tiefe x H\u00f6he): 61.31 cm x 40.02 cm x 59.6 cm - mit Fu\u00df\nTyp: Lautsprecher - Stereo\nAusgangsleistung/Kanal: 5 Watt\nSchnittstellen: 2 x HDMI 2.0 (HDCP 2.2)  DisplayPort 1.4 (HDCP 2.2)  USB-C (bis zu 60 W)  Kopfh\u00f6rer (Mini-Klinkenstecker)  2 x USB 3.0 Downstream\nNeigungswinkel: -25/+25\nSchwenkwinkel: 560\nRotationswinkel: 90\nH\u00f6heneinstellung: 130 mm\nVESA-Halterung: 100 x 100 mm\nEnthaltene Kabel: 1 x HDMI-Kabel  1 x USB-C Kabel\nSchlosstyp zur Diebstahlsicherung: Kensington Slot\nStromverbrauch SDR (eingeschaltet): 26 kWh/1.000 h\nStromverbrauch HDR (eingeschaltet): 44 kWh/1.000 h\nMitgelieferte Software: LG On-Screen Control\nDetails zu Abmessungen & Gewicht: Mit Standfu\u00df (niedrigste Position) - Breite: 61.31 cm - Tiefe: 40.02 cm - H\u00f6he: 59.6 cm - Gewicht: 7.8 kg  Mit Standfu\u00df (h\u00f6chste Position) - Breite: 61.31 cm - Tiefe: 40.02 cm - H\u00f6he: 72.6 cm - Gewicht: 7.8 kg  Ohne Fu\u00df - Breite: 61.31 cm - Tiefe: 4.46 cm - H\u00f6he: 36.44 cm - Gewicht: 4 kg",
    "reference_file": "offer_reference_293.json",
    "shop_name": "Proshop.at"
}