{
    "html_file": "offer_240_11.html",
    "name": "Corsair Xeneon 27QHD240 OLED, 26.5\"",
    "offer_link": "https://www.csv-direct.de/artinfo.php?artnr=AGX1654030&KATEGORIE=162&pva=geizhals2",
    "price": 1194.12,
    "raw_specifications": {
        "AMD FreeSync": "Nein",
        "Anzahl DisplayPort Anschl\u00fcsse": "1",
        "Anzahl HDMI-Anschl\u00fcsse": "2",
        "Anzahl der Farben des Displays": "1,073 Milliarden Farben",
        "Anzahl der Upstream-Ports USB Typ-C": "1",
        "Anzahl der nachgeschalteten Ports vom Typ USB-C": "1",
        "Anzahl der nachgeschalteten Steckpl\u00e4tze vom Typ USB-A": "4",
        "Anzahl der vorgeschalteten Steckpl\u00e4tze": "1",
        "Bildschirmdiagonale": "68,6 cm 27\"",
        "Bildschirmform": "Flach",
        "Bildschirmtechnologie": "OLED",
        "Display-Aufl\u00f6sung": "2560 x 1440 Pixel",
        "DisplayPorts-Version": "1.4",
        "Eingebaute Lautsprecher": "Nein",
        "Energieeffizienzklasse HDR": "Nicht verf\u00fcgbar",
        "Energieeffizienzklasse SDR": "Nicht verf\u00fcgbar",
        "Farbskala": "98,5",
        "Farbtiefe": "10 Bit",
        "HD-Typ": "Quad HD",
        "HDMI-Version": "2.1",
        "Helligkeit peak": "450 cd/m\u00b2",
        "H\u00f6heneinstellung": "10 cm",
        "Integrierte Kamera": "Nein",
        "Kabelsperre-Slot": "Nein",
        "Kontrastverh\u00e4ltnis": "1500000:1",
        "Marktpositionierung": "Gaming",
        "Maximale Bildwiederholrate": "240 Hz",
        "NVIDIA G-SYNC-Typ": "G-SYNC Compatible",
        "Natives Seitenverh\u00e4ltnis": "16:9",
        "Panel-Montage-Schnittstelle": "100 x 100 mm",
        "Produktfarbe": "Schwarz",
        "Reaktionszeit": "0,03 ms",
        "Reaktionszeit schnell": "0,03 ms",
        "Seitenverh\u00e4ltnis": "16:9",
        "Touchscreen": "Nein",
        "USB-Upstream-Porttyp": "USB Typ-C",
        "sRGB Abdeckung klassisch": "100"
    },
    "raw_specifications_text": "Bildschirmdiagonale: 68,6 cm 27\"\nDisplay-Aufl\u00f6sung: 2560 x 1440 Pixel\nNatives Seitenverh\u00e4ltnis: 16:9\nBildschirmtechnologie: OLED\nTouchscreen: Nein\nHD-Typ: Quad HD\nBildschirmform: Flach\nKontrastverh\u00e4ltnis: 1500000:1\nMaximale Bildwiederholrate: 240 Hz\nAnzahl der Farben des Displays: 1,073 Milliarden Farben\nHelligkeit peak: 450 cd/m\u00b2\nReaktionszeit: 0,03 ms\nSeitenverh\u00e4ltnis: 16:9\nReaktionszeit schnell: 0,03 ms\nFarbtiefe: 10 Bit\nFarbskala: 98,5\nsRGB Abdeckung klassisch: 100\nAMD FreeSync: Nein\nNVIDIA G-SYNC-Typ: G-SYNC Compatible\nEingebaute Lautsprecher: Nein\nIntegrierte Kamera: Nein\nMarktpositionierung: Gaming\nProduktfarbe: Schwarz\nUSB-Upstream-Porttyp: USB Typ-C\nAnzahl der vorgeschalteten Steckpl\u00e4tze: 1\nAnzahl der Upstream-Ports USB Typ-C: 1\nAnzahl der nachgeschalteten Steckpl\u00e4tze vom Typ USB-A: 4\nAnzahl der nachgeschalteten Ports vom Typ USB-C: 1\nAnzahl HDMI-Anschl\u00fcsse: 2\nHDMI-Version: 2.1\nAnzahl DisplayPort Anschl\u00fcsse: 1\nDisplayPorts-Version: 1.4\nKabelsperre-Slot: Nein\nPanel-Montage-Schnittstelle: 100 x 100 mm\nH\u00f6heneinstellung: 10 cm\nEnergieeffizienzklasse SDR: Nicht verf\u00fcgbar\nEnergieeffizienzklasse HDR: Nicht verf\u00fcgbar",
    "reference_file": "offer_reference_240.json",
    "shop_name": "CSV-Direct.de"
}