{
    "html_file": "offer_1561_6.html",
    "name": "AOC Q27V4EA, 27\"",
    "offer_link": "https://www.amazon.de/dp/B08XY8BJDS?linkCode=xm2&camp=2025&creative=165953&smid=A3JWKAKR8XB7XF&creativeASIN=B08XY8BJDS&tag=geizhals1-21",
    "price": 169.67,
    "raw_specifications": {
        "ASIN": "B08XY8BJDS",
        "Amazon Bestseller-Rang": "Nr. 97,987 in Computer & Zubeh\u00f6r (Siehe Top 100 in Computer & Zubeh\u00f6r)  Nr. 1,768 in Monitore",
        "Anzahl HDMI Schnittstellen": "\u200e1",
        "Anzahl USB 3.0 Schnittstellen": "\u200e3",
        "Anzahl der Lithium-Ionen-Zellen": "\u200e7",
        "Anzahl der Lithium-Metall-Zellen": "\u200e7",
        "Artikelgewicht": "\u200e4,6 Kilograms",
        "Batterien": "\u200e1 A Batterien erforderlich.",
        "Batterien enthalten": "\u200eNein",
        "Bildschirmaufl\u00f6sung": "\u200e2560 x 1440",
        "Display-Gr\u00f6\u00dfe": "\u200e68,6 Zentimeter",
        "Durchschnittliche Kundenbewertung": "4,2  4,2 von 5 Sternen    \n    117 Sternebewertungen   \n\n\n 4,2 von 5 Sternen",
        "Farbe": "\u200eschwarz",
        "Garantierte Software-Updates bis": "\u200eunbekannt",
        "Gewicht Lithium-Akku": "\u200e1 Gramm",
        "Hersteller": "\u200eAOC International",
        "Im Angebot von Amazon.de seit": "3. M\u00e4rz 2021",
        "Kapazit\u00e4t Lithium-Akku": "\u200e2,6 Britische W\u00e4rmeeinheiten (BTU)",
        "L\u00f6sung": "\u200e2560 x 1440 Pixels",
        "Marke": "\u200eAOC",
        "Modell/Serie": "\u200eMONITOR AOC QHD 27\" WLED IPS 2560X1440 4MS 75HZ HDMI DP ALTAVOCES",
        "Modellnummer": "\u200eQ27V4EA",
        "Produktabmessungen": "\u200e30 x 30 x 30 cm; 4,6 Kilogramm",
        "Prozessortyp": "\u200eOthers",
        "Volt": "\u200e240 Volt"
    },
    "raw_specifications_text": "Marke: \u200eAOC\nHersteller: \u200eAOC International\nModell/Serie: \u200eMONITOR AOC QHD 27\" WLED IPS 2560X1440 4MS 75HZ HDMI DP ALTAVOCES\nProduktabmessungen: \u200e30 x 30 x 30 cm; 4,6 Kilogramm\nBatterien: \u200e1 A Batterien erforderlich.\nModellnummer: \u200eQ27V4EA\nFarbe: \u200eschwarz\nDisplay-Gr\u00f6\u00dfe: \u200e68,6 Zentimeter\nBildschirmaufl\u00f6sung: \u200e2560 x 1440\nL\u00f6sung: \u200e2560 x 1440 Pixels\nProzessortyp: \u200eOthers\nAnzahl USB 3.0 Schnittstellen: \u200e3\nAnzahl HDMI Schnittstellen: \u200e1\nVolt: \u200e240 Volt\nBatterien enthalten: \u200eNein\nKapazit\u00e4t Lithium-Akku: \u200e2,6 Britische W\u00e4rmeeinheiten (BTU)\nGewicht Lithium-Akku: \u200e1 Gramm\nAnzahl der Lithium-Ionen-Zellen: \u200e7\nAnzahl der Lithium-Metall-Zellen: \u200e7\nArtikelgewicht: \u200e4,6 Kilograms\nGarantierte Software-Updates bis: \u200eunbekannt\nASIN: B08XY8BJDS\nDurchschnittliche Kundenbewertung: 4,2  4,2 von 5 Sternen    \n    117 Sternebewertungen   \n\n\n 4,2 von 5 Sternen\nAmazon Bestseller-Rang: Nr. 97,987 in Computer & Zubeh\u00f6r (Siehe Top 100 in Computer & Zubeh\u00f6r)  Nr. 1,768 in Monitore\nIm Angebot von Amazon.de seit: 3. M\u00e4rz 2021",
    "reference_file": "offer_reference_1561.json",
    "shop_name": "Amazon.at"
}