{
    "html_file": "offer_635_5.html",
    "name": "BenQ Mobiuz EX270QM, 27\"",
    "offer_link": "https://www.proshop.at/Bildschirm/BenQ-27-Bildschirm-EX270QM-LED-monitor-QHD-27-Black-1-ms-AMD-FreeSync-2/3124248?utm_source=geizhals&utm_medium=cpc&utm_campaign=pricesite",
    "price": 882.7,
    "raw_specifications": {
        "Abmessungen (Breite x Tiefe x H\u00f6he)": "60.9 cm x 7.06 cm x 37.16 cm - ohne Fu\u00df",
        "Abmessungen (Breite x Tiefe x H\u00f6he) - ohne Fu\u00df": "60.9 cm x 7.06 cm x 37.16 cm",
        "Adaptive-Sync Technologie": "AMD FreeSync Premium Pro",
        "Ausgangsleistung/Kanal": "2 Watt",
        "Besonderheiten": "sRGB-Farbmanagement, AMA-Technologie (Advanced Motion Accelerator), Black eQualizer, FPS Mode, flimmerfreie Technologie, M-book Mode, Motion Blur Reduction, OSD-Controller, Color Weakness Mode, Color Vibrance, RPG Mode, Eye-Care Technology, Brightness Intelligence Plus Technology, Low Blue Light-Technologie, Local Dimming, ePaper-Modus, HDRi, Light Tuner, TreVolo Audio, Videoformat-Support, Cinema HDRi, Game HDRi",
        "Bildschirmbeschichtung": "Blendfrei",
        "Bildschirmtyp": "IPS",
        "Details zu Abmessungen & Gewicht": "Mit Fu\u00df - Breite: 60.9 cm - Tiefe: 19.4 cm  Ohne Fu\u00df - Breite: 60.9 cm - Tiefe: 7.06 cm - H\u00f6he: 37.16 cm - Gewicht: 5.5 kg",
        "Diagonalabmessung": "68.6 cm (27\")",
        "Display-Typ": "LED-hintergrundbeleuchteter LCD-Monitor / TFT-Aktivmatrix",
        "EAN": "4718755089350",
        "Eingangsanschl\u00fcsse": "2xHDMI, DisplayPort",
        "Eingangsspannung": "Wechselstrom 100-240 V",
        "Einstellungen der Anzeigeposition": "H\u00f6he, Drehung, Neigung",
        "Energie Effizienzklasse": "Klasse F",
        "Energieklasse (HDR)": "Klasse G",
        "Energierverbrauch Sleep": "0.5 Watt",
        "Farbraum": "98% P3",
        "Farbunterst\u00fctzung": "1,07 Mrd. Farben",
        "Ger\u00e4tetyp": "LED-hintergrundbeleuchteter LCD-Monitor - 68.6 cm (27\")",
        "Gewicht": "5.5 kg",
        "HDR-Format": "HDR10",
        "HDR-Zertifizierung": "DisplayHDR 600",
        "HDR-f\u00e4hig": "HDR10 / DisplayHDR 600",
        "Helligkeit": "400 cd/m\u00b2",
        "Hersteller": "BenQ",
        "Hintergrundbeleuchtungs-Technologie": "LED-Hintergrundbeleuchtung",
        "Horizontaler Betrachtungswinkel": "178",
        "H\u00f6heneinstellung": "100 mm",
        "Integrierte Peripherieger\u00e4te": "USB 3.0-Hub",
        "Kennzeichnung": "HDCP 2.2, T\u00dcV-zertifizierte Low-Blue-Light-Technologie, T\u00dcV-zertifizierte Flimmerfrei-Technologie",
        "Kontrast": "1000:1",
        "Leistungsaufnahme im Ein-Zustand": "54.8 W",
        "Leistungsmerkmale": "USB 3.0-Hub",
        "Modell": "9H.LL9LJ.LBE",
        "Native Aufl\u00f6sung": "QHD 2560 x 1440 bei 240 Hz",
        "Neigungswinkel": "-5/+15",
        "OSD-Sprachen": "Ungarisch, Tschechisch, Chinesisch (tradionell), Chinesisch (vereinfacht), Englisch, Deutsch, Franz\u00f6sisch, Italienisch, Portugiesisch, Polnisch, Schwedisch, Russisch, Spanisch, Holl\u00e4ndisch, Arabisch, Rum\u00e4nisch, Japanisch, Koreanisch",
        "Ppi": "109",
        "Produktbeschreibung": "BenQ EX270QM - LED-Monitor - QHD - 68.6 cm (27\")",
        "Reaktionszeit": "1 ms (Gray-to-Gray), 1 ms (MPRT)",
        "Schnittstellen": "Kopfh\u00f6rer  DisplayPort 1.4  2 x HDMI 2.1  USB-B 3.0 Upstream  2 x USB 3.0 Downstream",
        "Seitenverh\u00e4ltnis": "16:9",
        "Spannung": "Wechselstrom 100-240 V",
        "Stromverbrauch (max.)": "98 Watt",
        "Stromverbrauch (typisch)": "28 Watt",
        "Stromverbrauch HDR (eingeschaltet)": "55 kWh/1.000 h",
        "Stromverbrauch SDR (eingeschaltet)": "25 kWh/1.000 h",
        "Typ": "Lautsprecher - Stereo",
        "VESA-Halterung": "100 x 100 mm",
        "Vertikaler Betrachtungswinkel": "178",
        "Waren-Nr.": "3124248",
        "Zubeh\u00f6r im Lieferumfang": "Fernbedienung, I/O-Abdeckung",
        "Zum Hersteller": "benq.com"
    },
    "raw_specifications_text": "Hersteller: BenQ\nWaren-Nr.: 3124248\nModell: 9H.LL9LJ.LBE\nEAN: 4718755089350\nZum Hersteller: benq.com\nProduktbeschreibung: BenQ EX270QM - LED-Monitor - QHD - 68.6 cm (27\")\nGer\u00e4tetyp: LED-hintergrundbeleuchteter LCD-Monitor - 68.6 cm (27\")\nEnergie Effizienzklasse: Klasse F\nLeistungsaufnahme im Ein-Zustand: 54.8 W\nAdaptive-Sync Technologie: AMD FreeSync Premium Pro\nLeistungsmerkmale: USB 3.0-Hub\nBildschirmtyp: IPS\nSeitenverh\u00e4ltnis: 16:9\nNative Aufl\u00f6sung: QHD 2560 x 1440 bei 240 Hz\nHelligkeit: 400 cd/m\u00b2\nKontrast: 1000:1\nHDR-f\u00e4hig: HDR10 / DisplayHDR 600\nReaktionszeit: 1 ms (Gray-to-Gray), 1 ms (MPRT)\nFarbunterst\u00fctzung: 1,07 Mrd. Farben\nFarbraum: 98% P3\nEingangsanschl\u00fcsse: 2xHDMI, DisplayPort\nEinstellungen der Anzeigeposition: H\u00f6he, Drehung, Neigung\nBildschirmbeschichtung: Blendfrei\nSpannung: Wechselstrom 100-240 V\nAbmessungen (Breite x Tiefe x H\u00f6he) - ohne Fu\u00df: 60.9 cm x 7.06 cm x 37.16 cm\nGewicht: 5.5 kg\nKennzeichnung: HDCP 2.2, T\u00dcV-zertifizierte Low-Blue-Light-Technologie, T\u00dcV-zertifizierte Flimmerfrei-Technologie\nDisplay-Typ: LED-hintergrundbeleuchteter LCD-Monitor / TFT-Aktivmatrix\nEnergieklasse (HDR): Klasse G\nDiagonalabmessung: 68.6 cm (27\")\nIntegrierte Peripherieger\u00e4te: USB 3.0-Hub\nPpi: 109\nHDR-Format: HDR10\nHDR-Zertifizierung: DisplayHDR 600\nHorizontaler Betrachtungswinkel: 178\nVertikaler Betrachtungswinkel: 178\nHintergrundbeleuchtungs-Technologie: LED-Hintergrundbeleuchtung\nOSD-Sprachen: Ungarisch, Tschechisch, Chinesisch (tradionell), Chinesisch (vereinfacht), Englisch, Deutsch, Franz\u00f6sisch, Italienisch, Portugiesisch, Polnisch, Schwedisch, Russisch, Spanisch, Holl\u00e4ndisch, Arabisch, Rum\u00e4nisch, Japanisch, Koreanisch\nBesonderheiten: sRGB-Farbmanagement, AMA-Technologie (Advanced Motion Accelerator), Black eQualizer, FPS Mode, flimmerfreie Technologie, M-book Mode, Motion Blur Reduction, OSD-Controller, Color Weakness Mode, Color Vibrance, RPG Mode, Eye-Care Technology, Brightness Intelligence Plus Technology, Low Blue Light-Technologie, Local Dimming, ePaper-Modus, HDRi, Light Tuner, TreVolo Audio, Videoformat-Support, Cinema HDRi, Game HDRi\nAbmessungen (Breite x Tiefe x H\u00f6he): 60.9 cm x 7.06 cm x 37.16 cm - ohne Fu\u00df\nTyp: Lautsprecher - Stereo\nAusgangsleistung/Kanal: 2 Watt\nSchnittstellen: Kopfh\u00f6rer  DisplayPort 1.4  2 x HDMI 2.1  USB-B 3.0 Upstream  2 x USB 3.0 Downstream\nNeigungswinkel: -5/+15\nH\u00f6heneinstellung: 100 mm\nVESA-Halterung: 100 x 100 mm\nZubeh\u00f6r im Lieferumfang: Fernbedienung, I/O-Abdeckung\nEingangsspannung: Wechselstrom 100-240 V\nStromverbrauch SDR (eingeschaltet): 25 kWh/1.000 h\nStromverbrauch HDR (eingeschaltet): 55 kWh/1.000 h\nStromverbrauch (typisch): 28 Watt\nStromverbrauch (max.): 98 Watt\nEnergierverbrauch Sleep: 0.5 Watt\nDetails zu Abmessungen & Gewicht: Mit Fu\u00df - Breite: 60.9 cm - Tiefe: 19.4 cm  Ohne Fu\u00df - Breite: 60.9 cm - Tiefe: 7.06 cm - H\u00f6he: 37.16 cm - Gewicht: 5.5 kg",
    "reference_file": "offer_reference_635.json",
    "shop_name": "Proshop.at"
}