{
    "html_file": "offer_205_6.html",
    "name": "Samsung ViewFinity S8 S27A800UJP (2023), 26.9\"",
    "offer_link": "https://direkt.jacob.de/produkte/premium-monitor-s80ua-ls27a800ujpxen-artnr-8139899.html?utm_source=geizhals&utm_medium=cpc&utm_campaign=Preisvergleich&ref=103",
    "price": 324.12,
    "raw_specifications": {
        "AC Eingangsspannung": "100 - 240 V",
        "AMD FreeSync": "Nein",
        "Abnehmbarer Standfu\u00df": "Ja",
        "Anzahl DisplayPort Anschl\u00fcsse": "1",
        "Anzahl HDMI-Anschl\u00fcsse": "1",
        "Anzahl der Farben des Displays": "1,07 Milliarden Farben",
        "Anzahl der Upstream-Ports USB Typ-C": "1",
        "Anzahl der vorgeschalteten Steckpl\u00e4tze": "3",
        "Betriebstemperatur": "10 - 40 \u00b0C",
        "Bild-in-Bild": "Ja",
        "Bildschirmdiagonale": "68,6 cm (27\" )",
        "Bildschirmform": "Flach",
        "Bildschirmtechnologie": "LCD",
        "Bildwinkel, horizontal": "178\u00b0",
        "Bildwinkel, vertikal": "178\u00b0",
        "Breite (ohne Standfu\u00df)": "61,5 cm",
        "Display-Aufl\u00f6sung": "3840 x 2160 Pixel",
        "DisplayPorts-Version": "1.2",
        "Dynamisches Kontrastverh\u00e4ltnis Marketingbezeichnung": "Mega DCR",
        "Eingebaute Lautsprecher": "Nein",
        "Energieeffizienzklasse (HDR)": "G",
        "Energieeffizienzklasse (SDR)": "F",
        "Energieeffizienzskala": "A bis G",
        "Energieverbrauch (HDR) pro 1.000 Stunden": "37 kWh",
        "Energieverbrauch (SDR) pro 1.000 Stunden": "26 kWh",
        "Fu\u00dffarbe": "Schwarz",
        "Geh\u00e4usematerial": "Kunststoff, Recycelbarer Kunststoff",
        "Ger\u00e4tebreite (inkl. Fu\u00df)": "615,5 mm",
        "Ger\u00e4teh\u00f6he (inkl. Fu\u00df)": "551,9 mm",
        "Ger\u00e4tetiefe (inkl. Fu\u00df)": "196,4 mm",
        "Gewicht (mit St\u00e4nder)": "6,7 kg",
        "Gewicht (ohne St\u00e4nder)": "4,7 kg",
        "HD-Typ": "4K Ultra HD",
        "HDMI": "Ja",
        "HDMI-Version": "2.0",
        "Helligkeit (typisch)": "300 cd/m\u00b2",
        "High Dynamic Range Video (HDR) Unterst\u00fctzung": "Ja",
        "H\u00f6he (ohne Standfu\u00df)": "36,8 cm",
        "H\u00f6heneinstellung": "12 cm",
        "H\u00f6henverstellung": "Ja",
        "Integrierte Kamera": "Nein",
        "Integrierter USB-Hub": "Ja",
        "Kabelsperre-Slot": "Nein",
        "Kontrastverh\u00e4ltnis": "1000:1",
        "Kopfh\u00f6rer-Anschluss": "3,5 mm",
        "Kopfh\u00f6rerausgang": "Ja",
        "Kopfh\u00f6rerausg\u00e4nge": "1",
        "LED-Anzeigen": "Ja",
        "Marktpositionierung": "Business",
        "Maximale Bildwiederholrate": "60 Hz",
        "Mitgelieferte Kabel": "Gleichstrom, HDMI, USB Typ-C",
        "NVIDIA G-SYNC": "Nein",
        "Nachhaltigkeitszertifikate": "TCO",
        "Natives Seitenverh\u00e4ltnis": "16:9",
        "Neigungswinkelbereich": "2 - 25\u00b0",
        "Paketgewicht": "8,4 kg",
        "Panel-Montage-Schnittstelle": "100 x 100 mm",
        "Panel-Typ": "IPS",
        "Pivot": "Ja",
        "Pivot Winkel": "2 - 92\u00b0",
        "Produktfarbe": "Schwarz",
        "Rahmenloses Design": "Ja",
        "Reaktionszeit": "5 ms",
        "Relative Luftfeuchtigkeit in Betrieb": "10 - 80%",
        "Schwenkbar": "Ja",
        "Schwenkwinkelbereich": "30 - 30\u00b0",
        "Smart-Modi": "Kino, Benutzerdefinierung, Dynamisch, Standard",
        "Spiel-Modus": "Ja",
        "Stromkabell\u00e4nge": "1,5 m",
        "Stromverbrauch (Standardbetrieb)": "26,1 W",
        "Stromverbrauch (Standby)": "0,5 W",
        "Stromverbrauch (aus)": "0,3 W",
        "St\u00e4nder enthalten": "Ja",
        "Technologie mit hohem Dynamikbereich (HDR)": "High Dynamic Range 10 (HDR10)",
        "Tiefe (ohne Standfu\u00df)": "4,27 cm",
        "Touchscreen": "Nein",
        "USB Power Delivery": "Ja",
        "USB-Hub-Version": "3.2 Gen 1 (3.1 Gen 1)",
        "USB-Stromversorgung bis zu": "90 W",
        "USB-Upstream-Porttyp": "USB Typ-A",
        "VESA-Halterung": "Ja",
        "Verpackungsart": "Box",
        "Verpackungsbreite": "686 mm",
        "Verpackungsh\u00f6he": "171 mm",
        "Verpackungstiefe": "450 mm",
        "Vorderer Rahmen": "Schwarz",
        "Wandmontage": "Ja",
        "Zertifizierung": "TUV",
        "sRGB Abdeckung (klassisch)": "99%"
    },
    "raw_specifications_text": "Bildschirmdiagonale: 68,6 cm (27\" )\nDisplay-Aufl\u00f6sung: 3840 x 2160 Pixel\nNatives Seitenverh\u00e4ltnis: 16:9\nBildschirmtechnologie: LCD\nTouchscreen: Nein\nHD-Typ: 4K Ultra HD\nPanel-Typ: IPS\nBildschirmform: Flach\nKontrastverh\u00e4ltnis: 1000:1\nMaximale Bildwiederholrate: 60 Hz\nAnzahl der Farben des Displays: 1,07 Milliarden Farben\nHelligkeit (typisch): 300 cd/m\u00b2\nReaktionszeit: 5 ms\nDynamisches Kontrastverh\u00e4ltnis Marketingbezeichnung: Mega DCR\nBildwinkel, horizontal: 178\u00b0\nBildwinkel, vertikal: 178\u00b0\nHigh Dynamic Range Video (HDR) Unterst\u00fctzung: Ja\nTechnologie mit hohem Dynamikbereich (HDR): High Dynamic Range 10 (HDR10)\nsRGB Abdeckung (klassisch): 99%\nNVIDIA G-SYNC: Nein\nAMD FreeSync: Nein\nSpiel-Modus: Ja\nSmart-Modi: Kino, Benutzerdefinierung, Dynamisch, Standard\nEingebaute Lautsprecher: Nein\nIntegrierte Kamera: Nein\nMarktpositionierung: Business\nProduktfarbe: Schwarz\nRahmenloses Design: Ja\nGeh\u00e4usematerial: Kunststoff, Recycelbarer Kunststoff\nVorderer Rahmen: Schwarz\nAbnehmbarer Standfu\u00df: Ja\nFu\u00dffarbe: Schwarz\nZertifizierung: TUV\nIntegrierter USB-Hub: Ja\nHDMI: Ja\nKopfh\u00f6rerausgang: Ja\nUSB-Hub-Version: 3.2 Gen 1 (3.1 Gen 1)\nUSB-Upstream-Porttyp: USB Typ-A\nAnzahl der vorgeschalteten Steckpl\u00e4tze: 3\nAnzahl der Upstream-Ports USB Typ-C: 1\nUSB Power Delivery: Ja\nUSB-Stromversorgung bis zu: 90 W\nAnzahl HDMI-Anschl\u00fcsse: 1\nHDMI-Version: 2.0\nAnzahl DisplayPort Anschl\u00fcsse: 1\nDisplayPorts-Version: 1.2\nKopfh\u00f6rerausg\u00e4nge: 1\nKopfh\u00f6rer-Anschluss: 3,5 mm\nVESA-Halterung: Ja\nKabelsperre-Slot: Nein\nH\u00f6henverstellung: Ja\nPanel-Montage-Schnittstelle: 100 x 100 mm\nWandmontage: Ja\nH\u00f6heneinstellung: 12 cm\nPivot: Ja\nPivot Winkel: 2 - 92\u00b0\nSchwenkbar: Ja\nSchwenkwinkelbereich: 30 - 30\u00b0\nNeigungswinkelbereich: 2 - 25\u00b0\nBild-in-Bild: Ja\nLED-Anzeigen: Ja\nEnergieeffizienzklasse (SDR): F\nEnergieeffizienzklasse (HDR): G\nEnergieverbrauch (SDR) pro 1.000 Stunden: 26 kWh\nEnergieverbrauch (HDR) pro 1.000 Stunden: 37 kWh\nStromverbrauch (Standardbetrieb): 26,1 W\nStromverbrauch (Standby): 0,5 W\nStromverbrauch (aus): 0,3 W\nAC Eingangsspannung: 100 - 240 V\nEnergieeffizienzskala: A bis G\nBetriebstemperatur: 10 - 40 \u00b0C\nRelative Luftfeuchtigkeit in Betrieb: 10 - 80%\nSt\u00e4nder enthalten: Ja\nMitgelieferte Kabel: Gleichstrom, HDMI, USB Typ-C\nStromkabell\u00e4nge: 1,5 m\nGer\u00e4tebreite (inkl. Fu\u00df): 615,5 mm\nGer\u00e4tetiefe (inkl. Fu\u00df): 196,4 mm\nGer\u00e4teh\u00f6he (inkl. Fu\u00df): 551,9 mm\nGewicht (mit St\u00e4nder): 6,7 kg\nBreite (ohne Standfu\u00df): 61,5 cm\nTiefe (ohne Standfu\u00df): 4,27 cm\nH\u00f6he (ohne Standfu\u00df): 36,8 cm\nGewicht (ohne St\u00e4nder): 4,7 kg\nVerpackungsbreite: 686 mm\nVerpackungstiefe: 450 mm\nVerpackungsh\u00f6he: 171 mm\nPaketgewicht: 8,4 kg\nVerpackungsart: Box\nNachhaltigkeitszertifikate: TCO",
    "reference_file": "offer_reference_205.json",
    "shop_name": "Jacob Elektronik direkt (AT)"
}