{
    "html_file": "offer_1277_26.html",
    "name": "AOC Q32P2CA, 31.5\"",
    "offer_link": "https://www.hiq24.de/shop/artikel/306480/?sPartner=geizhals",
    "price": 300.9,
    "raw_specifications": {
        "Abmessungen (Breite x Tiefe x H\u00f6he)": "73.019 cm x 27.51 cm x 50.147 cm - mit Fu\u00df",
        "Abmessungen (Breite x Tiefe x H\u00f6he) - mit Fu\u00df": "73.019 cm x 27.51 cm x 50.147 cm",
        "Bildschirmtyp": "IPS",
        "Details zu Abmessungen & Gewicht": "Mit Standfu\u00df (niedrigste Position) - Breite: 73.019 cm - Tiefe: 27.51 cm - H\u00f6he: 50.147 cm - Gewicht: 9.4 kg  Mit Standfu\u00df (h\u00f6chste Position) - Breite: 73.019 cm - Tiefe: 27.51 cm - H\u00f6he: 65.065 cm - Gewicht: 9.4 kg",
        "Diagonalabmessung": "81.3 cm (32\")",
        "Display-Typ": "LED-hintergrundbeleuchteter LCD-Monitor / TFT-Aktivmatrix",
        "ENERGY STAR zertifiziert": "Ja",
        "Eingangsanschl\u00fcsse": "2xHDMI, DisplayPort, USB-C",
        "Einstellungen der Anzeigeposition": "H\u00f6he, Pivot (Rotation), Drehung, Neigung",
        "Energie Effizienzklasse": "Klasse G",
        "Energieklasse (HDR)": "Klasse G",
        "Enthaltene Kabel": "1 x HDMI-Kabel - 1.8 m  1 x DisplayPort-Kabel - 1.8 m  USB-C Kabel",
        "Farbunterst\u00fctzung": "1,07 Mrd. Farben",
        "Ger\u00e4tetyp": "LED-hintergrundbeleuchteter LCD-Monitor - 81.3 cm (32\")",
        "Gewicht": "9.4 kg",
        "Helligkeit": "250 cd/m\u00b2",
        "Hintergrundbeleuchtungs-Technologie": "WLED",
        "Horizontale Bildwiederholrate": "30 - 114 kHz",
        "Horizontaler Betrachtungswinkel": "178",
        "Integrierte Peripherieger\u00e4te": "USB 3.2 Gen 1 Hub",
        "Leistungsmerkmale": "USB 3.2 Gen 1 Hub, USB PD 65 Watt",
        "Native Aufl\u00f6sung": "QHD 2560 x 1440 bei 75 Hz",
        "Neigungswinkel": "-5/+21.5",
        "OSD-Sprachen": "Tschechisch, Chinesisch (tradionell), Chinesisch (vereinfacht), Englisch, Deutsch, Franz\u00f6sisch, Italienisch, Portugiesisch, Polnisch, Finnisch, Schwedisch, Russisch, Spanisch, Holl\u00e4ndisch, Japanisch, Koreanisch",
        "Pixelpitch": "0.2727 mm",
        "Produktbeschreibung": "AOC Q32P2CA - LED-Monitor - QHD - 81.3 cm (32\")",
        "Reaktionszeit": "4 ms (gray-to-gray)",
        "Schnittstellen": "2 x HDMI  DisplayPort 1.2  USB-C/DisplayPort Alt Mode (bis zu 65 W)  4 x USB 3.2 Gen 1  Kopfh\u00f6rer",
        "Schwenkwinkel": "360",
        "Seitenverh\u00e4ltnis": "16:9",
        "Sichtbare Bildfl\u00e4che": "80 cm (31.5\")",
        "Stromverbrauch (Aus-Modus)": "0.3 Watt",
        "Stromverbrauch (typisch)": "40 Watt",
        "Stromverbrauch HDR (eingeschaltet)": "45 kWh/1.000 h",
        "Stromverbrauch SDR (eingeschaltet)": "39 kWh/1.000 h",
        "Stromverbrauch im Standby-Modus": "0.5 Watt",
        "Transportgewicht": "12.6 kg",
        "USB-Spannungsversorgung": "65 Watt",
        "Umweltschutzstandards": "ENERGY STAR-qualifiziert",
        "VESA-Halterung": "100 x 100 mm",
        "Vertikale Bildwiederholrate": "48 - 75 Hz",
        "Vertikaler Betrachtungswinkel": "178"
    },
    "raw_specifications_text": "Display-Typ: LED-hintergrundbeleuchteter LCD-Monitor / TFT-Aktivmatrix\nEnergie Effizienzklasse: Klasse G\nEnergieklasse (HDR): Klasse G\nDiagonalabmessung: 81.3 cm (32\")\nSichtbare Bildfl\u00e4che: 80 cm (31.5\")\nIntegrierte Peripherieger\u00e4te: USB 3.2 Gen 1 Hub\nUSB-Spannungsversorgung: 65 Watt\nBildschirmtyp: IPS\nSeitenverh\u00e4ltnis: 16:9\nNative Aufl\u00f6sung: QHD 2560 x 1440 bei 75 Hz\nPixelpitch: 0.2727 mm\nHelligkeit: 250 cd/m\u00b2\nFarbunterst\u00fctzung: 1,07 Mrd. Farben\nReaktionszeit: 4 ms (gray-to-gray)\nVertikale Bildwiederholrate: 48 - 75 Hz\nHorizontale Bildwiederholrate: 30 - 114 kHz\nHorizontaler Betrachtungswinkel: 178\nVertikaler Betrachtungswinkel: 178\nHintergrundbeleuchtungs-Technologie: WLED\nOSD-Sprachen: Tschechisch, Chinesisch (tradionell), Chinesisch (vereinfacht), Englisch, Deutsch, Franz\u00f6sisch, Italienisch, Portugiesisch, Polnisch, Finnisch, Schwedisch, Russisch, Spanisch, Holl\u00e4ndisch, Japanisch, Koreanisch\nAbmessungen (Breite x Tiefe x H\u00f6he): 73.019 cm x 27.51 cm x 50.147 cm - mit Fu\u00df\nGewicht: 9.4 kg\nSchnittstellen: 2 x HDMI  DisplayPort 1.2  USB-C/DisplayPort Alt Mode (bis zu 65 W)  4 x USB 3.2 Gen 1  Kopfh\u00f6rer\nEinstellungen der Anzeigeposition: H\u00f6he, Pivot (Rotation), Drehung, Neigung\nNeigungswinkel: -5/+21.5\nSchwenkwinkel: 360\nVESA-Halterung: 100 x 100 mm\nEnthaltene Kabel: 1 x HDMI-Kabel - 1.8 m  1 x DisplayPort-Kabel - 1.8 m  USB-C Kabel\nStromverbrauch SDR (eingeschaltet): 39 kWh/1.000 h\nStromverbrauch HDR (eingeschaltet): 45 kWh/1.000 h\nStromverbrauch (typisch): 40 Watt\nStromverbrauch im Standby-Modus: 0.5 Watt\nStromverbrauch (Aus-Modus): 0.3 Watt\nDetails zu Abmessungen & Gewicht: Mit Standfu\u00df (niedrigste Position) - Breite: 73.019 cm - Tiefe: 27.51 cm - H\u00f6he: 50.147 cm - Gewicht: 9.4 kg  Mit Standfu\u00df (h\u00f6chste Position) - Breite: 73.019 cm - Tiefe: 27.51 cm - H\u00f6he: 65.065 cm - Gewicht: 9.4 kg\nTransportgewicht: 12.6 kg\nENERGY STAR zertifiziert: Ja\nProduktbeschreibung: AOC Q32P2CA - LED-Monitor - QHD - 81.3 cm (32\")\nGer\u00e4tetyp: LED-hintergrundbeleuchteter LCD-Monitor - 81.3 cm (32\")\nLeistungsmerkmale: USB 3.2 Gen 1 Hub, USB PD 65 Watt\nEingangsanschl\u00fcsse: 2xHDMI, DisplayPort, USB-C\nAbmessungen (Breite x Tiefe x H\u00f6he) - mit Fu\u00df: 73.019 cm x 27.51 cm x 50.147 cm\nUmweltschutzstandards: ENERGY STAR-qualifiziert",
    "reference_file": "offer_reference_1277.json",
    "shop_name": "HiQ24"
}