{
    "html_file": "offer_1833_9.html",
    "name": "ASUS TUF Gaming VG249Q1R, 23.8\"",
    "offer_link": "https://www.alternate.at/ASUS/TUF-Gaming-VG249Q1R-Gaming-Monitor/html/product/1656616?partner=AtGeizhalsat&campaign=Monitor/ASUS/1656616",
    "price": 173.9,
    "raw_specifications": {
        "": "Optional",
        "Abmessungen": "Breite: 53,95 cm x H\u00f6he: 40,65 cm x Tiefe/L\u00e4nge: 21,3 cm",
        "Anschl\u00fcsse": "2x HDMI-Eingang, (HDMI-Version: 1.4), 1x DisplayPort-Eingang, (DisplayPort-Version: 1.2), 1x Kopfh\u00f6rer-Ausgang",
        "Bild": "Format",
        "Bildschirmaufl\u00f6sung": "1.920 x 1.080 Pixel",
        "Bildschirmdiagonale": "61 cm (24 Zoll)",
        "EAN": "4718017734714",
        "Energieeffizienzklasse (SDR)": "G (A - G)",
        "Energieverbauch pro 1000 Stunden (SDR)": "24 kWh",
        "Ergonomie": "Typ",
        "Farbe": "schwarz",
        "Features": "Flicker Free LED, Blaulichtfilter, GamePlus Modus, Shadow Boost, ELMB (Extreme Low Motion Blur)",
        "Frequenz": "Vertikal",
        "Geeignet f\u00fcr": "Gaming",
        "Gewicht": "3 kg",
        "Hersteller-Nr.": "90LM05V1-B01E70",
        "Lautsprecher": "2 Lautsprecher",
        "Leistungsaufnahme im Bereitschafts- und Aus-Zustand": "0,3 Watt",
        "Leistungsaufnahme im Ein-Zustand bei Standard-Dynamikumfang (SDR)": "23,8 Watt",
        "Serie": "TUF Gaming",
        "Stromversorgung": "Eco-Off",
        "Typ": "Gaming-Monitor",
        "Wandhalterung": "VESA kompatibel (75 x 75 mm)",
        "Zubeh\u00f6r": "Vorhanden"
    },
    "raw_specifications_text": "Energieeffizienzklasse (SDR): G (A - G)\nEnergieverbauch pro 1000 Stunden (SDR): 24 kWh\nLeistungsaufnahme im Ein-Zustand bei Standard-Dynamikumfang (SDR): 23,8 Watt\nLeistungsaufnahme im Bereitschafts- und Aus-Zustand: 0,3 Watt\nBildschirmdiagonale: 61 cm (24 Zoll)\nBildschirmaufl\u00f6sung: 1.920 x 1.080 Pixel\nTyp: Gaming-Monitor\nFarbe: schwarz\nEAN: 4718017734714\nHersteller-Nr.: 90LM05V1-B01E70\nSerie: TUF Gaming\nGeeignet f\u00fcr: Gaming\nBild: Format\n: Optional\nFrequenz: Vertikal\nAnschl\u00fcsse: 2x HDMI-Eingang, (HDMI-Version: 1.4), 1x DisplayPort-Eingang, (DisplayPort-Version: 1.2), 1x Kopfh\u00f6rer-Ausgang\nErgonomie: Typ\nStromversorgung: Eco-Off\nLautsprecher: 2 Lautsprecher\nWandhalterung: VESA kompatibel (75 x 75 mm)\nFeatures: Flicker Free LED, Blaulichtfilter, GamePlus Modus, Shadow Boost, ELMB (Extreme Low Motion Blur)\nZubeh\u00f6r: Vorhanden\nAbmessungen: Breite: 53,95 cm x H\u00f6he: 40,65 cm x Tiefe/L\u00e4nge: 21,3 cm\nGewicht: 3 kg",
    "reference_file": "offer_reference_1833.json",
    "shop_name": "Alternate.at"
}