{
    "html_file": "offer_867_17.html",
    "name": "iiyama G-Master GB2870UHSU-B1 Red Eagle, 28\"",
    "offer_link": "https://www.alternate.at/iiyama/G-Master-GB2870UHSU-B1-Gaming-Monitor/html/product/1851965?partner=AtGeizhalsat&campaign=Monitor/iiyama/1851965",
    "price": 607.0,
    "raw_specifications": {
        "": "VESA DisplayHDR Standard",
        "Abmessungen": "Breite: 63,65 cm x H\u00f6he: 54,3 cm x Tiefe/L\u00e4nge: 25,6 cm",
        "Anschl\u00fcsse": "1x HDMI-Eingang, (HDMI-Version: 2.1), 1x DisplayPort-Eingang, (DisplayPort-Version: 1.4), 1x Kopfh\u00f6rer-Ausgang, 3x USB-A-3.2 Gen 1 (5 Gbit/s)",
        "Bild": "Format",
        "Bildschirmaufl\u00f6sung": "3.840 x 2.160 Pixel",
        "Bildschirmdiagonale": "71 cm (28 Zoll)",
        "EAN": "4948570118687",
        "Energieeffizienzklasse (HDR)": "G (A - G)",
        "Energieeffizienzklasse (SDR)": "G (A - G)",
        "Energieverbauch pro 1000 Stunden (HDR)": "54 kWh",
        "Energieverbauch pro 1000 Stunden (SDR)": "33 kWh",
        "Ergonomie": "Typ",
        "Farbe": "schwarz",
        "Features": "Blaulichtfilter, Flicker-Free LED, Kabelmanagement",
        "Frequenz": "Horizontal",
        "Geeignet f\u00fcr": "Gaming",
        "Gewicht": "6,9 kg",
        "Hersteller-Nr.": "GB2870UHSU-B1",
        "Lautsprecher": "2 Lautsprecher",
        "Leistungsaufnahme im Bereitschafts- und Aus-Zustand": "0,4 Watt",
        "Leistungsaufnahme im Ein-Zustand bei Standard-Dynamikumfang (SDR)": "33,3 Watt",
        "Leistungsaufnahme im Ein-Zustand bei hohem Dynamikumfang (HDR)": "54.4 Watt",
        "Serie": "G-Master",
        "Stromversorgung": "Eco-Off",
        "Typ": "Gaming-Monitor",
        "Wandhalterung": "VESA kompatibel (100 x 100 mm)",
        "Zubeh\u00f6r": "Vorhanden"
    },
    "raw_specifications_text": "Energieeffizienzklasse (SDR): G (A - G)\nEnergieverbauch pro 1000 Stunden (SDR): 33 kWh\nEnergieeffizienzklasse (HDR): G (A - G)\nEnergieverbauch pro 1000 Stunden (HDR): 54 kWh\nLeistungsaufnahme im Ein-Zustand bei Standard-Dynamikumfang (SDR): 33,3 Watt\nLeistungsaufnahme im Ein-Zustand bei hohem Dynamikumfang (HDR): 54.4 Watt\nLeistungsaufnahme im Bereitschafts- und Aus-Zustand: 0,4 Watt\nBildschirmdiagonale: 71 cm (28 Zoll)\nBildschirmaufl\u00f6sung: 3.840 x 2.160 Pixel\nTyp: Gaming-Monitor\nFarbe: schwarz\nEAN: 4948570118687\nHersteller-Nr.: GB2870UHSU-B1\nSerie: G-Master\nGeeignet f\u00fcr: Gaming\nBild: Format\n: VESA DisplayHDR Standard\nFrequenz: Horizontal\nAnschl\u00fcsse: 1x HDMI-Eingang, (HDMI-Version: 2.1), 1x DisplayPort-Eingang, (DisplayPort-Version: 1.4), 1x Kopfh\u00f6rer-Ausgang, 3x USB-A-3.2 Gen 1 (5 Gbit/s)\nErgonomie: Typ\nStromversorgung: Eco-Off\nLautsprecher: 2 Lautsprecher\nWandhalterung: VESA kompatibel (100 x 100 mm)\nFeatures: Blaulichtfilter, Flicker-Free LED, Kabelmanagement\nZubeh\u00f6r: Vorhanden\nAbmessungen: Breite: 63,65 cm x H\u00f6he: 54,3 cm x Tiefe/L\u00e4nge: 25,6 cm\nGewicht: 6,9 kg",
    "reference_file": "offer_reference_867.json",
    "shop_name": "Alternate.at"
}