{
    "html_file": "offer_2412_21.html",
    "name": "Philips V-line 243V7QDAB, 23.8\"",
    "offer_link": "https://click.cptrack.de/?rd=true&k=H2jZOPSoNfIohcnyCFLwAwqzX3eQZkYX44I26OZb1lebv3wVkMfsaQ6xkdfo6YYuGy_yTbYED5SeNM2e6jUszA~~&rdlink=https%3A%2F%2Fwww.cyberport.at%2F%3FDEEP%3D6108-1ET%26APID%3D66",
    "price": 112.0,
    "raw_specifications": {
        "Aufl\u00f6sung": "1.920x1.080 Full HD",
        "Betrachtungswinkel h/v": "178\u00b0/178\u00b0",
        "Bildformat": "16:9",
        "Bildwiederholfrequenz": "60 Hz",
        "Breite in mm": "540mm",
        "DVI": "1x DVI",
        "Displaygr\u00f6\u00dfe in Zoll": "23,8 Zoll",
        "Displaygr\u00f6\u00dfe in cm": "60,5 cm",
        "Displayport": "kein",
        "Farbraumabdeckung": "100% sRGB",
        "Farbtiefe": "8 Bit / 16,7 Mio Farben",
        "Gewicht in kg": "3,5 kg",
        "HDMI": "1x HDMI",
        "Helligkeit": "250 cd/m\u00b2",
        "H\u00f6he in mm": "415mm",
        "H\u00f6henverstellbar": "ohne",
        "Jahresverbrauch": "31 kWh",
        "Kontrast dynamisch": "10.000.000:1",
        "Kontrast typisch": "1.000:1",
        "Lautsprecher": "2x",
        "Leistung": "2W",
        "Leistungsaufnahme": "21 Watt",
        "Oberfl\u00e4che": "entspiegelt",
        "Reaktionszeit": "5 ms",
        "Technologie": "IPS",
        "Tiefe in mm": "210mm",
        "USB-C": "kein",
        "Wandmontage": "VESA100x100"
    },
    "raw_specifications_text": "Jahresverbrauch: 31 kWh\nLeistungsaufnahme: 21 Watt\nDisplaygr\u00f6\u00dfe in cm: 60,5 cm\nDisplaygr\u00f6\u00dfe in Zoll: 23,8 Zoll\nTechnologie: IPS\nAufl\u00f6sung: 1.920x1.080 Full HD\nBildformat: 16:9\nOberfl\u00e4che: entspiegelt\nFarbraumabdeckung: 100% sRGB\nFarbtiefe: 8 Bit / 16,7 Mio Farben\nHelligkeit: 250 cd/m\u00b2\nKontrast typisch: 1.000:1\nKontrast dynamisch: 10.000.000:1\nReaktionszeit: 5 ms\nBetrachtungswinkel h/v: 178\u00b0/178\u00b0\nBildwiederholfrequenz: 60 Hz\nHDMI: 1x HDMI\nDVI: 1x DVI\nDisplayport: kein\nUSB-C: kein\nLautsprecher: 2x\nLeistung: 2W\nH\u00f6henverstellbar: ohne\nWandmontage: VESA100x100\nBreite in mm: 540mm\nH\u00f6he in mm: 415mm\nTiefe in mm: 210mm\nGewicht in kg: 3,5 kg",
    "reference_file": "offer_reference_2412.json",
    "shop_name": "Cyberport.at"
}