{
    "html_file": "offer_300_0.html",
    "name": "ASUS VY249HGE, 23.8\"",
    "offer_link": "https://www.proshop.at/Bildschirm/ASUS-24-Bildschirm-VY249HGE-Black-1-ms-AMD-FreeSync-Premium/3181841?utm_source=geizhals&utm_medium=cpc&utm_campaign=pricesite",
    "price": 160.27,
    "raw_specifications": {
        "Abmessungen (Breite x Tiefe x H\u00f6he)": "54.122 cm x 18.475 cm x 39.513 cm - mit Fu\u00df",
        "Abmessungen (Breite x Tiefe x H\u00f6he) - mit Fu\u00df": "54.122 cm x 18.475 cm x 39.513 cm",
        "Adaptive-Sync Technologie": "AMD FreeSync Premium",
        "Besonderheiten": "ASUS Splendid Video Intelligence Technology, Trace Free Technology, Spielmodus, ASUS QuickFit Virtual Scale, ASUS GamePlus, an 3 Seiten ohne Blende, ASUS EyeCare+ Technology, Variable Refresh Rate (VRR)",
        "Bildschirmbeschichtung": "Blendfrei",
        "Bildschirmtyp": "IPS",
        "Details zu Abmessungen & Gewicht": "Mit Fu\u00df - Breite: 54.122 cm - Tiefe: 18.475 cm - H\u00f6he: 39.513 cm - Gewicht: 4 kg  Ohne Fu\u00df - Breite: 54.122 cm - Tiefe: 5.178 cm - H\u00f6he: 32.292 cm - Gewicht: 3.5 kg",
        "Diagonalabmessung": "61 cm (24\")",
        "Display-Typ": "LED-hintergrundbeleuchteter LCD-Monitor / TFT-Aktivmatrix",
        "EAN": "4711387078389",
        "ENERGY STAR zertifiziert": "Ja",
        "EPEAT-kompatibel": "EPEAT Silver",
        "Eingangsspannung": "Wechselstrom 100-240 V (50/60 Hz)",
        "Einstellungen der Anzeigeposition": "Neigung",
        "Energie Effizienzklasse": "Klasse D",
        "Farbe": "Schwarz",
        "Farbunterst\u00fctzung": "16,7 Millionen Farben (6-Bit)",
        "Gaming": "Ja",
        "Ger\u00e4tetyp": "LED-hintergrundbeleuchteter LCD-Monitor - 61 cm (24\")",
        "Gewicht": "4 kg",
        "Helligkeit": "250 cd/m\u00b2",
        "Hersteller": "ASUS",
        "Hintergrundbeleuchtungs-Technologie": "LED-Hintergrundbeleuchtung",
        "Horizontale Bildwiederholrate": "30 - 159 kHz",
        "Horizontaler Betrachtungswinkel": "178",
        "Kennzeichnung": "cUL, CB, WEEE, CEC, KC, RCM, TUV Rheinland Low Blue Light Certification, CU, TUV Rheinland Flicker Free Certification, HDCP 1.4, sDoC, Ukraine Energy Label",
        "Kontrast": "1000:1 / 100000000:1 (dynamisch)",
        "Leistungsaufnahme im Ein-Zustand": "15 W",
        "Leistungsmerkmale": "Slot f\u00fcr Sicherheitsschloss (Kabelschloss getrennt erh\u00e4ltlich)",
        "Modell": "90LM06A5-B02370",
        "Native Aufl\u00f6sung": "Full HD (1080p) 1920 x 1080 bei 144 Hz",
        "Neigungswinkel": "-5/+20",
        "Pixelpitch": "0.2745 mm",
        "Produktbeschreibung": "ASUS VY249HGE - LED-Monitor - Full HD (1080p) - 61 cm (24\")",
        "Reaktionszeit": "5 ms (Gray-to-Gray), 1 ms (MPRT)",
        "Schlosstyp zur Diebstahlsicherung": "Kensington Slot",
        "Schnittstellen": "HDMI  Kopfh\u00f6rer",
        "Seitenverh\u00e4ltnis": "16:9",
        "Sichtbare Bildfl\u00e4che": "60.5 cm (23.8\")",
        "Spannung": "Wechselstrom 100-240 V (50/60 Hz)",
        "Stromverbrauch (Aus-Modus)": "0.3 Watt",
        "Stromverbrauch (typisch)": "13.99 Watt",
        "Stromverbrauch SDR (eingeschaltet)": "15 kWh/1.000 h",
        "Stromverbrauch im Standby-Modus": "0.5 Watt",
        "Transportbreite": "60.3 cm",
        "Transportgewicht": "5.2 kg",
        "Transporth\u00f6he": "39.2 cm",
        "Transporttiefe": "13 cm",
        "Umweltschutzstandards": "ENERGY STAR-qualifiziert EPEAT Silver",
        "VESA-Halterung": "100 x 100 mm",
        "Vertikale Bildwiederholrate": "48 - 144 Hz",
        "Vertikaler Betrachtungswinkel": "178",
        "Waren-Nr.": "3181841",
        "Zum Hersteller": "www.asus.com/"
    },
    "raw_specifications_text": "Hersteller: ASUS\nWaren-Nr.: 3181841\nModell: 90LM06A5-B02370\nEAN: 4711387078389\nZum Hersteller: www.asus.com/\nProduktbeschreibung: ASUS VY249HGE - LED-Monitor - Full HD (1080p) - 61 cm (24\")\nGer\u00e4tetyp: LED-hintergrundbeleuchteter LCD-Monitor - 61 cm (24\")\nEnergie Effizienzklasse: Klasse D\nLeistungsaufnahme im Ein-Zustand: 15 W\nAdaptive-Sync Technologie: AMD FreeSync Premium\nBildschirmtyp: IPS\nSeitenverh\u00e4ltnis: 16:9\nNative Aufl\u00f6sung: Full HD (1080p) 1920 x 1080 bei 144 Hz\nPixelpitch: 0.2745 mm\nHelligkeit: 250 cd/m\u00b2\nKontrast: 1000:1 / 100000000:1 (dynamisch)\nReaktionszeit: 5 ms (Gray-to-Gray), 1 ms (MPRT)\nGaming: Ja\nFarbunterst\u00fctzung: 16,7 Millionen Farben (6-Bit)\nEinstellungen der Anzeigeposition: Neigung\nBildschirmbeschichtung: Blendfrei\nSpannung: Wechselstrom 100-240 V (50/60 Hz)\nFarbe: Schwarz\nAbmessungen (Breite x Tiefe x H\u00f6he) - mit Fu\u00df: 54.122 cm x 18.475 cm x 39.513 cm\nGewicht: 4 kg\nUmweltschutzstandards: ENERGY STAR-qualifiziert EPEAT Silver\nKennzeichnung: cUL, CB, WEEE, CEC, KC, RCM, TUV Rheinland Low Blue Light Certification, CU, TUV Rheinland Flicker Free Certification, HDCP 1.4, sDoC, Ukraine Energy Label\nDisplay-Typ: LED-hintergrundbeleuchteter LCD-Monitor / TFT-Aktivmatrix\nDiagonalabmessung: 61 cm (24\")\nSichtbare Bildfl\u00e4che: 60.5 cm (23.8\")\nVertikale Bildwiederholrate: 48 - 144 Hz\nHorizontale Bildwiederholrate: 30 - 159 kHz\nHorizontaler Betrachtungswinkel: 178\nVertikaler Betrachtungswinkel: 178\nHintergrundbeleuchtungs-Technologie: LED-Hintergrundbeleuchtung\nBesonderheiten: ASUS Splendid Video Intelligence Technology, Trace Free Technology, Spielmodus, ASUS QuickFit Virtual Scale, ASUS GamePlus, an 3 Seiten ohne Blende, ASUS EyeCare+ Technology, Variable Refresh Rate (VRR)\nAbmessungen (Breite x Tiefe x H\u00f6he): 54.122 cm x 18.475 cm x 39.513 cm - mit Fu\u00df\nSchnittstellen: HDMI  Kopfh\u00f6rer\nNeigungswinkel: -5/+20\nVESA-Halterung: 100 x 100 mm\nLeistungsmerkmale: Slot f\u00fcr Sicherheitsschloss (Kabelschloss getrennt erh\u00e4ltlich)\nSchlosstyp zur Diebstahlsicherung: Kensington Slot\nEingangsspannung: Wechselstrom 100-240 V (50/60 Hz)\nStromverbrauch SDR (eingeschaltet): 15 kWh/1.000 h\nStromverbrauch (typisch): 13.99 Watt\nStromverbrauch im Standby-Modus: 0.5 Watt\nStromverbrauch (Aus-Modus): 0.3 Watt\nDetails zu Abmessungen & Gewicht: Mit Fu\u00df - Breite: 54.122 cm - Tiefe: 18.475 cm - H\u00f6he: 39.513 cm - Gewicht: 4 kg  Ohne Fu\u00df - Breite: 54.122 cm - Tiefe: 5.178 cm - H\u00f6he: 32.292 cm - Gewicht: 3.5 kg\nTransportbreite: 60.3 cm\nTransporttiefe: 13 cm\nTransporth\u00f6he: 39.2 cm\nTransportgewicht: 5.2 kg\nEPEAT-kompatibel: EPEAT Silver\nENERGY STAR zertifiziert: Ja",
    "reference_file": "offer_reference_300.json",
    "shop_name": "Proshop.at"
}