{
    "html_file": "offer_1096_6.html",
    "name": "Samsung Odyssey G3 G32A, 31.5\"",
    "offer_link": "https://www.mylemon.at/artikel/samsung/ls32ag320nuxen/ls32ag320n-81-3-cm-32.html",
    "price": 275.85,
    "raw_specifications": {
        "AC Eingangsspannung": "100 - 240 V",
        "AMD FreeSync": "Ja",
        "AMD FreeSync-Typ": "FreeSync Premium",
        "Anzahl DisplayPort Anschl\u00fcsse": "1",
        "Anzahl HDMI-Anschl\u00fcsse": "1",
        "Anzahl der Farben des Displays": "16,7 Millionen Farben",
        "Artikelnummer": "M1CY22VL",
        "Aufl\u00f6sung": "1920x1080",
        "Besonderheiten": "165 Hz",
        "Betriebstemperatur": "10 - 40 \u00b0C",
        "Bildschirmdiagonale": "81,3 cm (32 Zoll)",
        "Bildschirmform": "Flach",
        "Bildschirmtechnologie": "LED",
        "Bildwinkel, horizontal": "178\u00b0",
        "Bildwinkel, vertikal": "178\u00b0",
        "Breite (ohne Standfu\u00df)": "71,9 cm",
        "Display-Aufl\u00f6sung": "1920 x 1080 Pixel",
        "DisplayPorts-Version": "1.2",
        "Displaygr\u00f6\u00dfe": "31,5 Zoll",
        "Dynamisches Kontrastverh\u00e4ltnis Marketingbezeichnung": "Mega-Kontrast",
        "EAN": "8806092802179",
        "Energieeffizienzklasse (SDR)": "E",
        "Energieeffizienzskala": "A bis G",
        "Energieverbrauch (SDR) pro 1.000 Stunden": "24 kWh",
        "Ergonomie": "H\u00f6henverstellbar, Pivot (90 Grad drehbar), Schwenkbar, Neigbar",
        "Flimmerfreie Technologie": "Ja",
        "Ger\u00e4tebreite (inkl. Fu\u00df)": "719,2 mm",
        "Ger\u00e4teh\u00f6he (inkl. Fu\u00df)": "597,4 mm",
        "Ger\u00e4tetiefe (inkl. Fu\u00df)": "248,8 mm",
        "Gewicht (mit St\u00e4nder)": "6,2 kg",
        "Gewicht (ohne St\u00e4nder)": "4,5 kg",
        "HD-Typ": "Full HD",
        "HDMI": "Ja",
        "HDMI-Version": "1.4",
        "Helligkeit": "250 cd/m\u00b2",
        "Helligkeit (typisch)": "250 cd/m\u00b2",
        "Hersteller Artikelnummer": "LS32AG320NUXEN",
        "H\u00f6he (ohne Standfu\u00df)": "43,5 cm",
        "H\u00f6heneinstellung": "12 cm",
        "H\u00f6henverstellung": "Ja",
        "Kontrastverh\u00e4ltnis": "3000:1",
        "Kopfh\u00f6rerausgang": "Ja",
        "Marktpositionierung": "Gaming",
        "Maximale Bildwiederholrate": "165 Hz",
        "Mitgelieferte Kabel": "AC, DisplayPort",
        "NTSC Abdeckung (typisch)": "72%",
        "Natives Seitenverh\u00e4ltnis": "16:9",
        "Neigungsverstellung": "Ja",
        "Neigungswinkelbereich": "-5 - 20\u00b0",
        "Paketgewicht": "9,1 kg",
        "Panel": "VA",
        "Panel-Montage-Schnittstelle": "100 x 100 mm",
        "Panel-Typ": "VA",
        "Pivot": "Ja",
        "Pivot Winkel": "-2 - 92\u00b0",
        "Produktfarbe": "Schwarz",
        "Reaktionszeit": "1 ms",
        "Relative Luftfeuchtigkeit in Betrieb": "10 - 80%",
        "Schwenkbar": "Ja",
        "Schwenkwinkelbereich": "-15 - 15\u00b0",
        "Sichtbare Gr\u00f6\u00dfe (horizontal)": "69,8 cm",
        "Sichtbare Gr\u00f6\u00dfe (vertikal)": "39,3 cm",
        "Spiel-Modus": "Ja",
        "Stromverbrauch (Standardbetrieb)": "24 W",
        "Stromverbrauch (Standby)": "0,5 W",
        "Stromverbrauch (aus)": "0,3 W",
        "Stromverbrauch (max.)": "48 W",
        "Tiefe (ohne Standfu\u00df)": "9,37 cm",
        "Touchscreen": "Nein",
        "VESA Halterung": "100x100 mm",
        "VESA-Halterung": "Ja",
        "Verpackungsbreite": "813 mm",
        "Verpackungsh\u00f6he": "220 mm",
        "Verpackungstiefe": "560 mm",
        "Video Anschl\u00fcsse": "1x HDMI, 1x DisplayPort"
    },
    "raw_specifications_text": "Displaygr\u00f6\u00dfe: 31,5 Zoll\nAufl\u00f6sung: 1920x1080\nPanel: VA\nReaktionszeit: 1 ms\nVideo Anschl\u00fcsse: 1x HDMI, 1x DisplayPort\nErgonomie: H\u00f6henverstellbar, Pivot (90 Grad drehbar), Schwenkbar, Neigbar\nVESA Halterung: 100x100 mm\nHelligkeit: 250 cd/m\u00b2\nBesonderheiten: 165 Hz\nHersteller Artikelnummer: LS32AG320NUXEN\nEAN: 8806092802179\nArtikelnummer: M1CY22VL\nBildschirmdiagonale: 81,3 cm (32 Zoll)\nDisplay-Aufl\u00f6sung: 1920 x 1080 Pixel\nNatives Seitenverh\u00e4ltnis: 16:9\nBildschirmtechnologie: LED\nTouchscreen: Nein\nHD-Typ: Full HD\nPanel-Typ: VA\nBildschirmform: Flach\nKontrastverh\u00e4ltnis: 3000:1\nMaximale Bildwiederholrate: 165 Hz\nAnzahl der Farben des Displays: 16,7 Millionen Farben\nHelligkeit (typisch): 250 cd/m\u00b2\nDynamisches Kontrastverh\u00e4ltnis Marketingbezeichnung: Mega-Kontrast\nBildwinkel, horizontal: 178\u00b0\nBildwinkel, vertikal: 178\u00b0\nSichtbare Gr\u00f6\u00dfe (horizontal): 69,8 cm\nSichtbare Gr\u00f6\u00dfe (vertikal): 39,3 cm\nNTSC Abdeckung (typisch): 72%\nAMD FreeSync: Ja\nAMD FreeSync-Typ: FreeSync Premium\nFlimmerfreie Technologie: Ja\nSpiel-Modus: Ja\nMarktpositionierung: Gaming\nProduktfarbe: Schwarz\nHDMI: Ja\nKopfh\u00f6rerausgang: Ja\nAnzahl HDMI-Anschl\u00fcsse: 1\nHDMI-Version: 1.4\nAnzahl DisplayPort Anschl\u00fcsse: 1\nDisplayPorts-Version: 1.2\nVESA-Halterung: Ja\nH\u00f6henverstellung: Ja\nPanel-Montage-Schnittstelle: 100 x 100 mm\nH\u00f6heneinstellung: 12 cm\nPivot: Ja\nPivot Winkel: -2 - 92\u00b0\nSchwenkbar: Ja\nSchwenkwinkelbereich: -15 - 15\u00b0\nNeigungswinkelbereich: -5 - 20\u00b0\nNeigungsverstellung: Ja\nEnergieeffizienzklasse (SDR): E\nEnergieverbrauch (SDR) pro 1.000 Stunden: 24 kWh\nStromverbrauch (Standardbetrieb): 24 W\nStromverbrauch (Standby): 0,5 W\nStromverbrauch (max.): 48 W\nStromverbrauch (aus): 0,3 W\nAC Eingangsspannung: 100 - 240 V\nEnergieeffizienzskala: A bis G\nBetriebstemperatur: 10 - 40 \u00b0C\nRelative Luftfeuchtigkeit in Betrieb: 10 - 80%\nMitgelieferte Kabel: AC, DisplayPort\nGer\u00e4tebreite (inkl. Fu\u00df): 719,2 mm\nGer\u00e4tetiefe (inkl. Fu\u00df): 248,8 mm\nGer\u00e4teh\u00f6he (inkl. Fu\u00df): 597,4 mm\nGewicht (mit St\u00e4nder): 6,2 kg\nBreite (ohne Standfu\u00df): 71,9 cm\nTiefe (ohne Standfu\u00df): 9,37 cm\nH\u00f6he (ohne Standfu\u00df): 43,5 cm\nGewicht (ohne St\u00e4nder): 4,5 kg\nVerpackungsbreite: 813 mm\nVerpackungstiefe: 560 mm\nVerpackungsh\u00f6he: 220 mm\nPaketgewicht: 9,1 kg",
    "reference_file": "offer_reference_1096.json",
    "shop_name": "mylemon.at"
}