{
    "html_file": "offer_676_21.html",
    "name": "Philips Evnia 5000 32M1C5500VL, 31.5\"",
    "offer_link": "https://www.ba-computer.at/philips-momentum-5000-32m1c5500vl-led-monitor-gaming-gebogen-81-3-cm-32-32m1c5500vl-00.html",
    "price": 304.63,
    "raw_specifications": {
        "Abmessungen (Breite x Tiefe x H\u00f6he)": "70.9 cm x 23.9 cm x 52.7 cm - mit Fu\u00df",
        "Besonderheiten": "SmartImage Game, Mega Infinity Dynamic Contrast Ratio, flimmerfreie Technologie, Crystal Clear UltraWide QHD, Adaptive-Sync-Technologie, breiter Betrachtungswinkel, Niedrige Eingangsverz\u00f6gerung, EasyRead, SmartImage HDR, LowBlue Mode",
        "Bildschirmbeschichtung": "Blendfrei, 3H Hard Coating, Haze 25 %",
        "Bildschirmtyp": "VA",
        "Details zu Abmessungen & Gewicht": "Mit Fu\u00df - Breite: 70.9 cm - Tiefe: 23.9 cm - H\u00f6he: 52.7 cm - Gewicht: 7.83 kg \u00a6 Ohne Fu\u00df - Breite: 70.9 cm - Tiefe: 9.5 cm - H\u00f6he: 42.3 cm - Gewicht: 6.37 kg",
        "Diagonalabmessung": "81.3 cm (32\")",
        "Display-Typ": "LED-hintergrundbeleuchteter LCD-Monitor / TFT-Aktivmatrix",
        "Eingangsspannung": "Wechselstrom 100-240 V (50/60 Hz)",
        "Einstellungen der Anzeigeposition": "Neigung",
        "Energie Effizienzklasse": "Klasse F",
        "Energieklasse (HDR)": "Klasse G",
        "Enthaltene Kabel": "1 x DisplayPort-Kabel \u00a6 1 x HDMI-Kabel",
        "Erforderliches Betriebssystem": "Apple MacOS X, Microsoft Windows 7 / 8 / 8.1 / 10 / 11",
        "Farbe": "Textured Black",
        "Farbraum": "102.1% NTSC (CIE 1976), 121.6 % sRGB (CIE 1931)",
        "Farbunterst\u00fctzung": "16,7 Millionen Farben",
        "Gaming": "Ja",
        "Geschwungener Bildschirm": "Ja (1500R)",
        "Gewicht": "7.83 kg",
        "HDR-Format": "HDR10",
        "Helligkeit": "250 cd/m\u00b2",
        "Hintergrundbeleuchtungs-Technologie": "WLED",
        "Horizontale Bildwiederholrate": "30 - 250 kHz",
        "Horizontaler Betrachtungswinkel": "178",
        "Kennzeichnung": "Plug and Play, FCC Klasse B bescheinigt, TUV, ICES-003, CB, ISO 9241-307, TUV Bauart, CU-EAC, BFR-frei, HDCP 2.2, HDCP 1.4, PVC-free, quecksilberfrei, EAEU RoHS",
        "Kontrast": "3000:1",
        "Leistungsmerkmale": "Slot f\u00fcr Sicherheitsschloss (Kabelschloss getrennt erh\u00e4ltlich)",
        "MTBF": "50,000 Stunde(n)",
        "Max. Betriebstemperatur": "35 \u00b0C",
        "Min Betriebstemperatur": "0 \u00b0C",
        "Native Aufl\u00f6sung": "QHD 2560 x 1440 (DisplayPort: 165 Hz, HDMI: 144 Hz)",
        "Neigungswinkel": "-5/+20",
        "OSD-Sprachen": "Ungarisch, Tschechisch, Chinesisch (tradionell), Chinesisch (vereinfacht), Ukrainisch, Brasilianisches Portugiesisch, Englisch, Deutsch, Franz\u00f6sisch, Italienisch, Portugiesisch, Polnisch, Finnisch, Schwedisch, Russisch, Spanisch, Holl\u00e4ndisch, Griechisch, T\u00fcrkisch, Japanisch, Koreanisch",
        "Pixelpitch": "0.2724 mm",
        "Ppi": "93.24",
        "Reaktionszeit": "4 ms (gray-to-gray), 1 ms (MPRT)",
        "Schlosstyp zur Diebstahlsicherung": "Kensington Slot",
        "Schnittstellen": "2 x HDMI (HDCP 2.2) \u00a6 DisplayPort 1.4 (HDCP 2.2)",
        "Seitenverh\u00e4ltnis": "16:9",
        "Sichtbare Bildfl\u00e4che": "80 cm (31.5\")",
        "Stromverbrauch (Aus-Modus)": "0.3 Watt",
        "Stromverbrauch (typisch)": "45.1 Watt",
        "Stromverbrauch HDR (eingeschaltet)": "57 kWh/1.000 h",
        "Stromverbrauch SDR (eingeschaltet)": "32 kWh/1.000 h",
        "Stromverbrauch im Standby-Modus": "0.5 Watt",
        "Transportbreite": "78.2 cm",
        "Transportgewicht": "10.36 kg",
        "Transporth\u00f6he": "52.3 cm",
        "Transporttiefe": "22.7 cm",
        "VESA-Halterung": "100 x 100 mm",
        "Vertikale Bildwiederholrate": "48 - 144 Hz",
        "Vertikaler Betrachtungswinkel": "178",
        "Zul\u00e4ssige Luftfeuchtigkeit im Betrieb": "20 - 80%"
    },
    "raw_specifications_text": "Display-Typ: LED-hintergrundbeleuchteter LCD-Monitor / TFT-Aktivmatrix\nEnergie Effizienzklasse: Klasse F\nEnergieklasse (HDR): Klasse G\nDiagonalabmessung: 81.3 cm (32\")\nSichtbare Bildfl\u00e4che: 80 cm (31.5\")\nGeschwungener Bildschirm: Ja (1500R)\nBildschirmtyp: VA\nSeitenverh\u00e4ltnis: 16:9\nNative Aufl\u00f6sung: QHD 2560 x 1440 (DisplayPort: 165 Hz, HDMI: 144 Hz)\nPixelpitch: 0.2724 mm\nPpi: 93.24\nHelligkeit: 250 cd/m\u00b2\nKontrast: 3000:1\nHDR-Format: HDR10\nFarbunterst\u00fctzung: 16,7 Millionen Farben\nFarbraum: 102.1% NTSC (CIE 1976), 121.6 % sRGB (CIE 1931)\nReaktionszeit: 4 ms (gray-to-gray), 1 ms (MPRT)\nVertikale Bildwiederholrate: 48 - 144 Hz\nHorizontale Bildwiederholrate: 30 - 250 kHz\nGaming: Ja\nHorizontaler Betrachtungswinkel: 178\nVertikaler Betrachtungswinkel: 178\nBildschirmbeschichtung: Blendfrei, 3H Hard Coating, Haze 25 %\nHintergrundbeleuchtungs-Technologie: WLED\nOSD-Sprachen: Ungarisch, Tschechisch, Chinesisch (tradionell), Chinesisch (vereinfacht), Ukrainisch, Brasilianisches Portugiesisch, Englisch, Deutsch, Franz\u00f6sisch, Italienisch, Portugiesisch, Polnisch, Finnisch, Schwedisch, Russisch, Spanisch, Holl\u00e4ndisch, Griechisch, T\u00fcrkisch, Japanisch, Koreanisch\nBesonderheiten: SmartImage Game, Mega Infinity Dynamic Contrast Ratio, flimmerfreie Technologie, Crystal Clear UltraWide QHD, Adaptive-Sync-Technologie, breiter Betrachtungswinkel, Niedrige Eingangsverz\u00f6gerung, EasyRead, SmartImage HDR, LowBlue Mode\nFarbe: Textured Black\nAbmessungen (Breite x Tiefe x H\u00f6he): 70.9 cm x 23.9 cm x 52.7 cm - mit Fu\u00df\nGewicht: 7.83 kg\nSchnittstellen: 2 x HDMI (HDCP 2.2) \u00a6 DisplayPort 1.4 (HDCP 2.2)\nEinstellungen der Anzeigeposition: Neigung\nNeigungswinkel: -5/+20\nVESA-Halterung: 100 x 100 mm\nLeistungsmerkmale: Slot f\u00fcr Sicherheitsschloss (Kabelschloss getrennt erh\u00e4ltlich)\nEnthaltene Kabel: 1 x DisplayPort-Kabel \u00a6 1 x HDMI-Kabel\nMTBF: 50,000 Stunde(n)\nKennzeichnung: Plug and Play, FCC Klasse B bescheinigt, TUV, ICES-003, CB, ISO 9241-307, TUV Bauart, CU-EAC, BFR-frei, HDCP 2.2, HDCP 1.4, PVC-free, quecksilberfrei, EAEU RoHS\nSchlosstyp zur Diebstahlsicherung: Kensington Slot\nEingangsspannung: Wechselstrom 100-240 V (50/60 Hz)\nStromverbrauch SDR (eingeschaltet): 32 kWh/1.000 h\nStromverbrauch HDR (eingeschaltet): 57 kWh/1.000 h\nStromverbrauch (typisch): 45.1 Watt\nStromverbrauch im Standby-Modus: 0.5 Watt\nStromverbrauch (Aus-Modus): 0.3 Watt\nErforderliches Betriebssystem: Apple MacOS X, Microsoft Windows 7 / 8 / 8.1 / 10 / 11\nDetails zu Abmessungen & Gewicht: Mit Fu\u00df - Breite: 70.9 cm - Tiefe: 23.9 cm - H\u00f6he: 52.7 cm - Gewicht: 7.83 kg \u00a6 Ohne Fu\u00df - Breite: 70.9 cm - Tiefe: 9.5 cm - H\u00f6he: 42.3 cm - Gewicht: 6.37 kg\nTransportbreite: 78.2 cm\nTransporttiefe: 22.7 cm\nTransporth\u00f6he: 52.3 cm\nTransportgewicht: 10.36 kg\nMin Betriebstemperatur: 0 \u00b0C\nMax. Betriebstemperatur: 35 \u00b0C\nZul\u00e4ssige Luftfeuchtigkeit im Betrieb: 20 - 80%",
    "reference_file": "offer_reference_676.json",
    "shop_name": "BA-Computer"
}