{
    "html_file": "offer_255_10.html",
    "name": "LG UltraGear 27GR75Q-B, 27\"",
    "offer_link": "https://www.amazon.de/dp/B0BVWMSP1V?linkCode=xm2&camp=2025&creative=165953&smid=A3JWKAKR8XB7XF&creativeASIN=B0BVWMSP1V&tag=geizhals1-21",
    "price": 261.18,
    "raw_specifications": {
        "ASIN": "B0BVWMSP1V",
        "Amazon Bestseller-Rang": "Nr. 3,319 in Computer & Zubeh\u00f6r (Siehe Top 100 in Computer & Zubeh\u00f6r)  Nr. 60 in Monitore",
        "Anzahl HDMI Schnittstellen": "\u200e2",
        "Artikelgewicht": "\u200e4 g",
        "Batterien enthalten": "\u200eNein",
        "Bildschirmaufl\u00f6sung": "\u200e2.56 x 1.44",
        "Display-Gr\u00f6\u00dfe": "\u200e27 Zoll",
        "Durchschnittliche Kundenbewertung": "4,7  4,7 von 5 Sternen    \n    132 Sternebewertungen   \n\n\n 4,7 von 5 Sternen",
        "Farbe": "\u200eSchwarz",
        "Garantierte Software-Updates bis": "\u200eunbekannt",
        "Hersteller": "\u200eLG Electronics",
        "Im Angebot von Amazon.de seit": "17. Mai 2023",
        "L\u00f6sung": "\u200e2560 x 1440 Pixels",
        "Marke": "\u200eLG Electronics",
        "Modell/Serie": "\u200eUltraGear Monitor",
        "Modellnummer": "\u200e27GR75Q-B.AEU",
        "Produktabmessungen": "\u200e29,12 x 61,35 x 56,98 cm; 4 Gramm",
        "Prozessortyp": "\u200eOthers",
        "Volt": "\u200e240 Volt (Wechselstrom)"
    },
    "raw_specifications_text": "Marke: \u200eLG Electronics\nHersteller: \u200eLG Electronics\nModell/Serie: \u200eUltraGear Monitor\nProduktabmessungen: \u200e29,12 x 61,35 x 56,98 cm; 4 Gramm\nModellnummer: \u200e27GR75Q-B.AEU\nFarbe: \u200eSchwarz\nDisplay-Gr\u00f6\u00dfe: \u200e27 Zoll\nBildschirmaufl\u00f6sung: \u200e2.56 x 1.44\nL\u00f6sung: \u200e2560 x 1440 Pixels\nProzessortyp: \u200eOthers\nAnzahl HDMI Schnittstellen: \u200e2\nVolt: \u200e240 Volt (Wechselstrom)\nBatterien enthalten: \u200eNein\nArtikelgewicht: \u200e4 g\nGarantierte Software-Updates bis: \u200eunbekannt\nASIN: B0BVWMSP1V\nDurchschnittliche Kundenbewertung: 4,7  4,7 von 5 Sternen    \n    132 Sternebewertungen   \n\n\n 4,7 von 5 Sternen\nAmazon Bestseller-Rang: Nr. 3,319 in Computer & Zubeh\u00f6r (Siehe Top 100 in Computer & Zubeh\u00f6r)  Nr. 60 in Monitore\nIm Angebot von Amazon.de seit: 17. Mai 2023",
    "reference_file": "offer_reference_255.json",
    "shop_name": "Amazon.at"
}