{
    "html_file": "offer_946_3.html",
    "name": "ASUS VY279HE-W, 27\"",
    "offer_link": "https://www.amazon.de/dp/B09TT5SJGN?linkCode=xm2&camp=2025&creative=165953&smid=A3JWKAKR8XB7XF&creativeASIN=B09TT5SJGN&tag=geizhals1-21",
    "price": 191.5,
    "raw_specifications": {
        "ASIN": "B09TT5SJGN",
        "Amazon Bestseller-Rang": "Nr. 31,147 in Computer & Zubeh\u00f6r (Siehe Top 100 in Computer & Zubeh\u00f6r)  Nr. 677 in Monitore",
        "Anzahl der Lithium-Ionen-Zellen": "\u200e1",
        "Anzahl der Lithium-Metall-Zellen": "\u200e1",
        "Artikelgewicht": "\u200e1 Kilograms",
        "Batterien enthalten": "\u200eNein",
        "Bildschirmaufl\u00f6sung": "\u200e1920x1080",
        "Display-Gr\u00f6\u00dfe": "\u200e27 Zoll",
        "Durchschnittliche Kundenbewertung": "4,5  4,5 von 5 Sternen    \n    150 Sternebewertungen   \n\n\n 4,5 von 5 Sternen",
        "Farbe": "\u200eWei\u00df",
        "Garantierte Software-Updates bis": "\u200eunbekannt",
        "Hersteller": "\u200eASUS",
        "Im Angebot von Amazon.de seit": "3. M\u00e4rz 2022",
        "L\u00f6sung": "\u200e1920 x 1080 Pixels",
        "Marke": "\u200eASUSK",
        "Modell/Serie": "\u200eVY279HE-W",
        "Modellnummer": "\u200e90LM06D2-B01170",
        "Produktabmessungen": "\u200e30 x 30 x 30 cm; 1 Kilogramm",
        "Prozessortyp": "\u200eOthers"
    },
    "raw_specifications_text": "Marke: \u200eASUSK\nHersteller: \u200eASUS\nModell/Serie: \u200eVY279HE-W\nProduktabmessungen: \u200e30 x 30 x 30 cm; 1 Kilogramm\nModellnummer: \u200e90LM06D2-B01170\nFarbe: \u200eWei\u00df\nDisplay-Gr\u00f6\u00dfe: \u200e27 Zoll\nBildschirmaufl\u00f6sung: \u200e1920x1080\nL\u00f6sung: \u200e1920 x 1080 Pixels\nProzessortyp: \u200eOthers\nBatterien enthalten: \u200eNein\nAnzahl der Lithium-Ionen-Zellen: \u200e1\nAnzahl der Lithium-Metall-Zellen: \u200e1\nArtikelgewicht: \u200e1 Kilograms\nGarantierte Software-Updates bis: \u200eunbekannt\nASIN: B09TT5SJGN\nDurchschnittliche Kundenbewertung: 4,5  4,5 von 5 Sternen    \n    150 Sternebewertungen   \n\n\n 4,5 von 5 Sternen\nAmazon Bestseller-Rang: Nr. 31,147 in Computer & Zubeh\u00f6r (Siehe Top 100 in Computer & Zubeh\u00f6r)  Nr. 677 in Monitore\nIm Angebot von Amazon.de seit: 3. M\u00e4rz 2022",
    "reference_file": "offer_reference_946.json",
    "shop_name": "Amazon.at"
}