{
    "html_file": "offer_2525_28.html",
    "name": "Eizo FlexScan S2133 schwarz, 21.3\"",
    "offer_link": "https://syswork.at/sw/index.html?open&mid=Artikel&artid=mon-0871&from=geizhals.at",
    "price": 847.0,
    "raw_specifications": {
        "3D": "Ja",
        "AC Eingangsfrequenz": "50 - 60 Hz",
        "AC Eingangsspannung": "100 - 240 V",
        "AMD FreeSync": "Nein",
        "Anzahl": "1",
        "Anzahl DVI-D-Anschl\u00fcsse": "1",
        "Anzahl DisplayPort Anschl\u00fcsse": "1",
        "Anzahl OSD-Sprachen": "6",
        "Anzahl VGA (D-Sub) Anschl\u00fcsse": "1",
        "Anzahl der Farben des Displays": "16,78 Millionen Farben",
        "Anzahl der nachgeschalteten Steckpl\u00e4tze vom Typ USB-A": "2",
        "Anzahl der vorgeschalteten Steckpl\u00e4tze": "1",
        "Anzeige": "LCD",
        "Betriebsanleitung": "Ja",
        "Bildschirmaufl\u00f6sung": "1600 x 1200 Pixel",
        "Bildschirmdiagonale": "54,1 cm (21.3 Zoll)",
        "Bildschirmdisplay (OSD)-Sprachen": "Deutsch, Englisch, Spanisch, Franz\u00f6sisch, Italienisch, Schwedisch",
        "Bildschirmform": "Flach",
        "Bildschirmformateinstellungen": "4:3",
        "Bildschirmtechnologie": "LED",
        "Blickwinkel, horizontal": "178\u00b0",
        "Blickwinkel, vertikal": "178\u00b0",
        "Breite (ohne Standfu\u00df)": "46,5 cm",
        "DVI Anschluss": "Ja",
        "Datenblatt": "Download",
        "Digital horizontale Frequenz": "24 - 80 kHz",
        "Digital vertikale Frequenz": "49 - 76 Hz",
        "Ein-/Ausschalter": "Ja",
        "Eingebaute Lautsprecher": "Nein",
        "Energieeffizienzklasse (SDR)": "E",
        "Energieeffizienzskala": "A bis G",
        "Energieverbrauch (SDR) pro 1.000 Stunden": "17 kWh",
        "Fu\u00dffarbe": "Schwarz",
        "Ger\u00e4tebreite (inkl. Fu\u00df)": "465 mm",
        "Ger\u00e4teh\u00f6he (inkl. Fu\u00df)": "535 mm",
        "Ger\u00e4tetiefe (inkl. Fu\u00df)": "209 mm",
        "Gewicht (mit St\u00e4nder)": "8,6 kg",
        "Gewicht (ohne St\u00e4nder)": "5,6 kg",
        "HD-Typ": "UXGA",
        "HDCP": "Ja",
        "Helligkeit (typisch)": "420 cd/m\u00b2",
        "Herstellerlink": "EIZO",
        "H\u00f6he (ohne Standfu\u00df)": "36,1 cm",
        "H\u00f6heneinstellung": "8,2 cm",
        "H\u00f6henverstellung": "Ja",
        "Integrierte Kamera": "Nein",
        "Integrierter Kartenleser": "Nein",
        "Integrierter USB-Hub": "Ja",
        "Kabelsperre-Slot": "Nein",
        "Kontrastverh\u00e4ltnis": "1500:1",
        "Mitgelieferte Kabel": "DVI,USB",
        "NVIDIA G-SYNC": "Nein",
        "Nachhaltigkeitszertifikate": "ENERGY STAR",
        "Natives Seitenverh\u00e4ltnis": "4:3",
        "On-Screen-Display (OSD)": "Ja",
        "Panel-Montage-Schnittstelle": "100 x 100 mm",
        "Panel-Typ": "IPS",
        "Pivot": "Ja",
        "Pivot Winkel": "0 - 90\u00b0",
        "Pixel Abstand": "0,270 x 0,270 mm",
        "Plug & Play": "Ja",
        "Produktfarbe": "Schwarz",
        "Produktlink": "Link",
        "Reaktionszeit": "20 ms",
        "Schwenkbar": "Ja",
        "Schwenkwinkelbereich": "0 - 40\u00b0",
        "Seitenverh\u00e4ltnis": "4:3",
        "Sichtbare Gr\u00f6\u00dfe (horizontal)": "54 cm",
        "Sichtbare Gr\u00f6\u00dfe (vertikal)": "54 cm",
        "Stromverbrauch (Standby)": "0,3 W",
        "Stromverbrauch (aus)": "0,1 W",
        "Stromverbrauch (in Betrieb)": "17,4 W",
        "Stromverbrauch (max.)": "45 W",
        "TV Tuner integriert": "Nein",
        "Tiefe (ohne Standfu\u00df)": "6,4 cm",
        "USB-Upstream-Porttyp": "USB Typ-B",
        "Unterst\u00fctzte Grafik-Aufl\u00f6sungen": "720 x 400,1024 x 768 (XGA),1280 x 1024 (SXGA),1600 x 1200 (UXGA),640 x 480 (VGA),800 x 600 (SVGA)",
        "VESA-Halterung": "Ja",
        "Zertifizierung": "CE, T\u00dcV GS, T\u00dcV,  ISO 9241-307, TCO 6.0",
        "kippbar": "Ja"
    },
    "raw_specifications_text": "Bildschirmdiagonale: 54,1 cm (21.3 Zoll)\nBildschirmaufl\u00f6sung: 1600 x 1200 Pixel\nNatives Seitenverh\u00e4ltnis: 4:3\nPanel-Typ: IPS\nHelligkeit (typisch): 420 cd/m\u00b2\nReaktionszeit: 20 ms\nHD-Typ: UXGA\nBildschirmtechnologie: LED\nBildschirmform: Flach\nKontrastverh\u00e4ltnis: 1500:1\nBlickwinkel, horizontal: 178\u00b0\nBlickwinkel, vertikal: 178\u00b0\nAnzahl der Farben des Displays: 16,78 Millionen Farben\nUnterst\u00fctzte Grafik-Aufl\u00f6sungen: 720 x 400,1024 x 768 (XGA),1280 x 1024 (SXGA),1600 x 1200 (UXGA),640 x 480 (VGA),800 x 600 (SVGA)\nSeitenverh\u00e4ltnis: 4:3\n3D: Ja\nPixel Abstand: 0,270 x 0,270 mm\nSichtbare Gr\u00f6\u00dfe (horizontal): 54 cm\nSichtbare Gr\u00f6\u00dfe (vertikal): 54 cm\nDigital horizontale Frequenz: 24 - 80 kHz\nDigital vertikale Frequenz: 49 - 76 Hz\nNVIDIA G-SYNC: Nein\nAMD FreeSync: Nein\nEingebaute Lautsprecher: Nein\nIntegrierte Kamera: Nein\nProduktfarbe: Schwarz\nFu\u00dffarbe: Schwarz\nZertifizierung: CE, T\u00dcV GS, T\u00dcV,  ISO 9241-307, TCO 6.0\nIntegrierter USB-Hub: Ja\nDVI Anschluss: Ja\nAnzahl DisplayPort Anschl\u00fcsse: 1\nUSB-Upstream-Porttyp: USB Typ-B\nAnzahl der vorgeschalteten Steckpl\u00e4tze: 1\nAnzahl der nachgeschalteten Steckpl\u00e4tze vom Typ USB-A: 2\nAnzahl VGA (D-Sub) Anschl\u00fcsse: 1\nAnzahl DVI-D-Anschl\u00fcsse: 1\nHDCP: Ja\nIntegrierter Kartenleser: Nein\nVESA-Halterung: Ja\nKabelsperre-Slot: Nein\nH\u00f6henverstellung: Ja\nPanel-Montage-Schnittstelle: 100 x 100 mm\nH\u00f6heneinstellung: 8,2 cm\nPivot: Ja\nPivot Winkel: 0 - 90\u00b0\nSchwenkbar: Ja\nSchwenkwinkelbereich: 0 - 40\u00b0\nkippbar: Ja\nOn-Screen-Display (OSD): Ja\nBildschirmdisplay (OSD)-Sprachen: Deutsch, Englisch, Spanisch, Franz\u00f6sisch, Italienisch, Schwedisch\nAnzahl OSD-Sprachen: 6\nPlug & Play: Ja\nEnergieeffizienzklasse (SDR): E\nEnergieverbrauch (SDR) pro 1.000 Stunden: 17 kWh\nStromverbrauch (in Betrieb): 17,4 W\nStromverbrauch (Standby): 0,3 W\nStromverbrauch (max.): 45 W\nStromverbrauch (aus): 0,1 W\nAC Eingangsspannung: 100 - 240 V\nAC Eingangsfrequenz: 50 - 60 Hz\nEnergieeffizienzskala: A bis G\nNachhaltigkeitszertifikate: ENERGY STAR\nGer\u00e4tebreite (inkl. Fu\u00df): 465 mm\nGer\u00e4tetiefe (inkl. Fu\u00df): 209 mm\nGer\u00e4teh\u00f6he (inkl. Fu\u00df): 535 mm\nGewicht (mit St\u00e4nder): 8,6 kg\nBreite (ohne Standfu\u00df): 46,5 cm\nTiefe (ohne Standfu\u00df): 6,4 cm\nH\u00f6he (ohne Standfu\u00df): 36,1 cm\nGewicht (ohne St\u00e4nder): 5,6 kg\nMitgelieferte Kabel: DVI,USB\nAnzeige: LCD\nEin-/Ausschalter: Ja\nBildschirmformateinstellungen: 4:3\nTV Tuner integriert: Nein\nBetriebsanleitung: Ja\nAnzahl: 1\nDatenblatt: Download\nProduktlink: Link\nHerstellerlink: EIZO",
    "reference_file": "offer_reference_2525.json",
    "shop_name": "Syswork"
}