{
    "html_file": "offer_161_2.html",
    "name": "ASUS ROG Swift PG32UQXR, 32\"",
    "offer_link": "https://www.amazon.de/dp/B0CB8QFLLF?linkCode=xm2&camp=2025&creative=165953&smid=A3JWKAKR8XB7XF&creativeASIN=B0CB8QFLLF&tag=geizhals1-21",
    "price": 1686.4,
    "raw_specifications": {
        "ASIN": "B0CB8QFLLF",
        "Amazon Bestseller-Rang": "Nr. 25,617 in Computer & Zubeh\u00f6r (Siehe Top 100 in Computer & Zubeh\u00f6r)  Nr. 517 in Monitore",
        "Artikelgewicht": "\u200e10,8 Kilograms",
        "Batterien enthalten": "\u200eNein",
        "Bildschirmaufl\u00f6sung": "\u200e3820 x 2160",
        "Display-Gr\u00f6\u00dfe": "\u200e32 Zoll",
        "Durchschnittliche Kundenbewertung": "3,6  3,6 von 5 Sternen    \n    4 Sternebewertungen   \n\n\n 3,6 von 5 Sternen",
        "Farbe": "\u200eSchwarz",
        "Garantierte Software-Updates bis": "\u200eunbekannt",
        "Hersteller": "\u200eASUS",
        "Im Angebot von Amazon.de seit": "6. Juli 2023",
        "L\u00f6sung": "\u200e3840 x 2160 Pixels",
        "Marke": "\u200eASUS",
        "Modell/Serie": "\u200ePG32UQXR",
        "Modellnummer": "\u200ePG32UQXR",
        "Produktabmessungen": "\u200e9,5 x 72,6 x 54,1 cm; 10,8 Kilogramm",
        "Prozessortyp": "\u200eOthers",
        "Volt": "\u200e240 Volt"
    },
    "raw_specifications_text": "Marke: \u200eASUS\nHersteller: \u200eASUS\nModell/Serie: \u200ePG32UQXR\nProduktabmessungen: \u200e9,5 x 72,6 x 54,1 cm; 10,8 Kilogramm\nModellnummer: \u200ePG32UQXR\nFarbe: \u200eSchwarz\nDisplay-Gr\u00f6\u00dfe: \u200e32 Zoll\nBildschirmaufl\u00f6sung: \u200e3820 x 2160\nL\u00f6sung: \u200e3840 x 2160 Pixels\nProzessortyp: \u200eOthers\nVolt: \u200e240 Volt\nBatterien enthalten: \u200eNein\nArtikelgewicht: \u200e10,8 Kilograms\nGarantierte Software-Updates bis: \u200eunbekannt\nASIN: B0CB8QFLLF\nDurchschnittliche Kundenbewertung: 3,6  3,6 von 5 Sternen    \n    4 Sternebewertungen   \n\n\n 3,6 von 5 Sternen\nAmazon Bestseller-Rang: Nr. 25,617 in Computer & Zubeh\u00f6r (Siehe Top 100 in Computer & Zubeh\u00f6r)  Nr. 517 in Monitore\nIm Angebot von Amazon.de seit: 6. Juli 2023",
    "reference_file": "offer_reference_161.json",
    "shop_name": "Amazon.at"
}