{
    "html_file": "offer_1787_0.html",
    "name": "AOC G2790VXA, 27\"",
    "offer_link": "https://www.mylemon.at/artikel/aoc/g2790vxa/g2790vxa-27-va-1920x1080-16.html",
    "price": 199.54,
    "raw_specifications": {
        "AC Eingangsfrequenz": "50/60 Hz",
        "AC Eingangsspannung": "100 - 240 V",
        "AMD FreeSync": "Ja",
        "AMD FreeSync Bildwiederholratenbereich": "48 - 144 Hz",
        "AMD FreeSync-Typ": "FreeSync Premium",
        "Abnehmbarer Standfu\u00df": "Ja",
        "Anzahl DisplayPort Anschl\u00fcsse": "1",
        "Anzahl HDMI-Anschl\u00fcsse": "1",
        "Anzahl OSD-Sprachen": "16",
        "Anzahl der Farben des Displays": "16,7 Millionen Farben",
        "Anzahl der Lautsprecher": "2",
        "Artikelnummer": "M12Y5LBL",
        "Audioanschl\u00fcsse": "Nein",
        "Aufl\u00f6sung": "1920x1080",
        "Au\u00dfenverkleidungstyp": "Texturiert",
        "Besonderheiten": "144 Hz, Lautsprecher",
        "Bildschirmdiagonale": "68,6 cm (27 Zoll)",
        "Bildschirmdiagonale (cm)": "68,58 cm",
        "Bildschirmform": "Flach",
        "Bildschirmtechnologie": "LED",
        "Bildwinkel, horizontal": "178\u00b0",
        "Bildwinkel, vertikal": "178\u00b0",
        "Blendfreier Bildschirm": "Ja",
        "Breite (ohne Standfu\u00df)": "61,5 cm",
        "DVI Anschluss": "Nein",
        "Display-Aufl\u00f6sung": "1920 x 1080 Pixel",
        "Display-Oberfl\u00e4che": "Matt",
        "DisplayPort Kabell\u00e4nge": "1,8 m",
        "DisplayPorts-Version": "1.2",
        "Displaygr\u00f6\u00dfe": "27 Zoll",
        "EAN": "4038986188654",
        "Eingebaute Lautsprecher": "Ja",
        "Eingebautes Mikrofon": "Nein",
        "Energieeffizienzklasse (HDR)": "F",
        "Energieeffizienzklasse (SDR)": "F",
        "Energieeffizienzskala": "A bis G",
        "Energieverbrauch (HDR) pro 1.000 Stunden": "24 kWh",
        "Energieverbrauch (SDR) pro 1.000 Stunden": "22 kWh",
        "Ergonomie": "Neigbar",
        "Externes Netzteil": "Ja",
        "Farbtiefe": "8 Bit",
        "Flimmerfreie Technologie": "Ja",
        "Fu\u00dffarbe": "Schwarz",
        "Ger\u00e4tebreite (inkl. Fu\u00df)": "614,9 mm",
        "Ger\u00e4teh\u00f6he (inkl. Fu\u00df)": "445,8 mm",
        "Ger\u00e4tetiefe (inkl. Fu\u00df)": "199,7 mm",
        "Gewicht (mit St\u00e4nder)": "4,37 kg",
        "Gleichstrom-Anschluss (DC)": "Ja",
        "HD-Typ": "Full HD",
        "HDMI": "Ja",
        "HDMI-Kabell\u00e4nge": "1,8 m",
        "HDMI-Version": "1.4",
        "Helligkeit": "350 cd/m\u00b2",
        "Helligkeit (typisch)": "350 cd/m\u00b2",
        "Hersteller Artikelnummer": "G2790VXA",
        "H\u00f6he (ohne Standfu\u00df)": "36,6 cm",
        "H\u00f6henverstellung": "Nein",
        "Integrierte Kamera": "Nein",
        "Integrierter USB-Hub": "Nein",
        "Kabelsperre-Slot": "Ja",
        "Kontrastverh\u00e4ltnis": "3000:1",
        "Kontrastverh\u00e4ltnis (dynamisch)": "80000000:1",
        "Kopfh\u00f6rerausgang": "Nein",
        "Lichteffekte": "Nein",
        "Low-Blue-Light-Technologie": "Ja",
        "Marktpositionierung": "Gaming",
        "Maximale Bildwiederholrate": "144 Hz",
        "Men\u00fcsprachen": "Vereinfachtes Chinesisch, Traditionelles Chinesisch, Kroatisch, Tschechisch, Deutsch, Niederl\u00e4ndisch, Englisch, Spanisch, Finnisch, Franz\u00f6sisch, Italienisch, Japanisch, Koreanisch, Polnisch, Portugiesisch, Russisch, Schwedisch, T\u00fcrkisch, Ukrainisch",
        "Mitgelieferte Kabel": "AC, DisplayPort, HDMI",
        "NTSC Abdeckung (typisch)": "85%",
        "NVIDIA G-SYNC": "Nein",
        "Nachhaltigkeitszertifikate": "WEEE",
        "Natives Seitenverh\u00e4ltnis": "16:9",
        "Neigungsverstellung": "Ja",
        "Neigungswinkelbereich": "-5 - 23\u00b0",
        "Oberfl\u00e4chenh\u00e4rte": "3H",
        "On-Screen-Display (OSD)": "Ja",
        "Paketgewicht": "6,47 kg",
        "Panel": "VA",
        "Panel-Montage-Schnittstelle": "100 x 100 mm",
        "Panel-Typ": "VA",
        "Pivot": "Ja",
        "Pixeldichte": "82 ppi",
        "Plug & Play": "Ja",
        "Produktfarbe": "Schwarz, Rot",
        "RMS-Leistung": "2 W",
        "Rahmenloses Design": "Ja",
        "Reaktionszeit": "1 ms",
        "Recycelbares Verpackungsmaterial": "100%",
        "Schnellladung": "Nein",
        "Schwermetallfrei": "Hg (Quecksilber)",
        "Seitenverh\u00e4ltnis": "4:3, 16:9",
        "Slot-Typ Kabelsperre": "Kensington",
        "Stromverbrauch (Standardbetrieb)": "30 W",
        "Stromverbrauch (Standby)": "0,5 W",
        "Stromverbrauch (aus)": "0,5 W",
        "St\u00e4nder enthalten": "Ja",
        "Tiefe (ohne Standfu\u00df)": "4,88 cm",
        "Touchscreen": "Nein",
        "Typ der Hintergrundbeleuchtung": "W-LED",
        "Unterst\u00fctzte Grafik-Aufl\u00f6sungen": "1920 x 1080 (HD 1080)",
        "Unterst\u00fctzte Video-Modi": "1080p",
        "VESA-Halterung": "Ja",
        "Verpackungsart": "Box",
        "Verpackungsbreite": "703 mm",
        "Verpackungsh\u00f6he": "467 mm",
        "Verpackungstiefe": "185 mm",
        "Video Anschl\u00fcsse": "1x HDMI, 1x DisplayPort",
        "Vorderer Rahmen": "Schwarz/Rot",
        "Warentarifnummer (HS)": "85285210",
        "Zertifizierung": "True"
    },
    "raw_specifications_text": "Displaygr\u00f6\u00dfe: 27 Zoll\nAufl\u00f6sung: 1920x1080\nPanel: VA\nReaktionszeit: 1 ms\nVideo Anschl\u00fcsse: 1x HDMI, 1x DisplayPort\nErgonomie: Neigbar\nHelligkeit: 350 cd/m\u00b2\nBesonderheiten: 144 Hz, Lautsprecher\nHersteller Artikelnummer: G2790VXA\nEAN: 4038986188654\nArtikelnummer: M12Y5LBL\nBildschirmdiagonale: 68,6 cm (27 Zoll)\nDisplay-Aufl\u00f6sung: 1920 x 1080 Pixel\nNatives Seitenverh\u00e4ltnis: 16:9\nBildschirmtechnologie: LED\nTouchscreen: Nein\nHD-Typ: Full HD\nPanel-Typ: VA\nBildschirmform: Flach\nKontrastverh\u00e4ltnis: 3000:1\nMaximale Bildwiederholrate: 144 Hz\nAnzahl der Farben des Displays: 16,7 Millionen Farben\nTyp der Hintergrundbeleuchtung: W-LED\nHelligkeit (typisch): 350 cd/m\u00b2\nDisplay-Oberfl\u00e4che: Matt\nBlendfreier Bildschirm: Ja\nUnterst\u00fctzte Grafik-Aufl\u00f6sungen: 1920 x 1080 (HD 1080)\nUnterst\u00fctzte Video-Modi: 1080p\nSeitenverh\u00e4ltnis: 4:3, 16:9\nKontrastverh\u00e4ltnis (dynamisch): 80000000:1\nBildwinkel, horizontal: 178\u00b0\nBildwinkel, vertikal: 178\u00b0\nPixeldichte: 82 ppi\nBildschirmdiagonale (cm): 68,58 cm\nOberfl\u00e4chenh\u00e4rte: 3H\nFarbtiefe: 8 Bit\nNTSC Abdeckung (typisch): 85%\nNVIDIA G-SYNC: Nein\nAMD FreeSync: Ja\nAMD FreeSync-Typ: FreeSync Premium\nAMD FreeSync Bildwiederholratenbereich: 48 - 144 Hz\nSchnellladung: Nein\nFlimmerfreie Technologie: Ja\nLow-Blue-Light-Technologie: Ja\nEingebaute Lautsprecher: Ja\nIntegrierte Kamera: Nein\nAnzahl der Lautsprecher: 2\nRMS-Leistung: 2 W\nEingebautes Mikrofon: Nein\nMarktpositionierung: Gaming\nProduktfarbe: Schwarz, Rot\nRahmenloses Design: Ja\nVorderer Rahmen: Schwarz/Rot\nAbnehmbarer Standfu\u00df: Ja\nFu\u00dffarbe: Schwarz\nSchwermetallfrei: Hg (Quecksilber)\nZertifizierung: True\nIntegrierter USB-Hub: Nein\nHDMI: Ja\nKopfh\u00f6rerausgang: Nein\nDVI Anschluss: Nein\nAnzahl HDMI-Anschl\u00fcsse: 1\nHDMI-Version: 1.4\nAnzahl DisplayPort Anschl\u00fcsse: 1\nDisplayPorts-Version: 1.2\nAudioanschl\u00fcsse: Nein\nGleichstrom-Anschluss (DC): Ja\nVESA-Halterung: Ja\nKabelsperre-Slot: Ja\nH\u00f6henverstellung: Nein\nPanel-Montage-Schnittstelle: 100 x 100 mm\nSlot-Typ Kabelsperre: Kensington\nPivot: Ja\nNeigungswinkelbereich: -5 - 23\u00b0\nOn-Screen-Display (OSD): Ja\nMen\u00fcsprachen: Vereinfachtes Chinesisch, Traditionelles Chinesisch, Kroatisch, Tschechisch, Deutsch, Niederl\u00e4ndisch, Englisch, Spanisch, Finnisch, Franz\u00f6sisch, Italienisch, Japanisch, Koreanisch, Polnisch, Portugiesisch, Russisch, Schwedisch, T\u00fcrkisch, Ukrainisch\nAnzahl OSD-Sprachen: 16\nPlug & Play: Ja\nNeigungsverstellung: Ja\nEnergieeffizienzklasse (SDR): F\nEnergieeffizienzklasse (HDR): F\nEnergieverbrauch (SDR) pro 1.000 Stunden: 22 kWh\nEnergieverbrauch (HDR) pro 1.000 Stunden: 24 kWh\nStromverbrauch (Standardbetrieb): 30 W\nStromverbrauch (Standby): 0,5 W\nStromverbrauch (aus): 0,5 W\nAC Eingangsspannung: 100 - 240 V\nAC Eingangsfrequenz: 50/60 Hz\nEnergieeffizienzskala: A bis G\nExternes Netzteil: Ja\nSt\u00e4nder enthalten: Ja\nMitgelieferte Kabel: AC, DisplayPort, HDMI\nDisplayPort Kabell\u00e4nge: 1,8 m\nHDMI-Kabell\u00e4nge: 1,8 m\nGer\u00e4tebreite (inkl. Fu\u00df): 614,9 mm\nGer\u00e4tetiefe (inkl. Fu\u00df): 199,7 mm\nGer\u00e4teh\u00f6he (inkl. Fu\u00df): 445,8 mm\nGewicht (mit St\u00e4nder): 4,37 kg\nBreite (ohne Standfu\u00df): 61,5 cm\nTiefe (ohne Standfu\u00df): 4,88 cm\nH\u00f6he (ohne Standfu\u00df): 36,6 cm\nVerpackungsbreite: 703 mm\nVerpackungstiefe: 185 mm\nVerpackungsh\u00f6he: 467 mm\nPaketgewicht: 6,47 kg\nVerpackungsart: Box\nNachhaltigkeitszertifikate: WEEE\nWarentarifnummer (HS): 85285210\nAu\u00dfenverkleidungstyp: Texturiert\nRecycelbares Verpackungsmaterial: 100%\nLichteffekte: Nein",
    "reference_file": "offer_reference_1787.json",
    "shop_name": "mylemon.at"
}