{
    "html_file": "offer_2223_27.html",
    "name": "Philips B-line 241B8QJEB, 23.8\"",
    "offer_link": "https://www.cyberport.at/?DEEP=6108-1F0&APID=294&STOREID=7",
    "price": 200.9,
    "raw_specifications": {
        "Aufl\u00f6sung": "1.920x1.080 Full HD",
        "Betrachtungswinkel h/v": "178\u00b0/178\u00b0",
        "Bildformat": "16:9",
        "Breite in mm": "540mm",
        "DVI": "1x DVI",
        "Displaygr\u00f6\u00dfe in Zoll": "24 Zoll",
        "Displaygr\u00f6\u00dfe in cm": "61,0 cm",
        "Displayport": "1x DP",
        "Farbraumabdeckung": "100% sRGB",
        "Farbtiefe": "8 Bit / 16,7 Mio Farben",
        "Gewicht in kg": "5,0 kg",
        "HDMI": "1x HDMI",
        "Helligkeit": "250 cd/m\u00b2",
        "H\u00f6he in mm": "507mm",
        "H\u00f6henverstellbar": "150mm",
        "Jahresverbrauch": "26 kWh",
        "Kontrast dynamisch": "50.000.000:1",
        "Kontrast typisch": "1.000:1",
        "Lautsprecher": "2x",
        "Leistung": "2W",
        "Leistungsaufnahme": "18 Watt",
        "Oberfl\u00e4che": "entspiegelt",
        "Reaktionszeit": "5 ms",
        "Technologie": "LED-IPS",
        "Tiefe in mm": "206mm",
        "USB-C": "kein",
        "Wandmontage": "VESA100x100"
    },
    "raw_specifications_text": "Jahresverbrauch: 26 kWh\nLeistungsaufnahme: 18 Watt\nDisplaygr\u00f6\u00dfe in cm: 61,0 cm\nDisplaygr\u00f6\u00dfe in Zoll: 24 Zoll\nTechnologie: LED-IPS\nAufl\u00f6sung: 1.920x1.080 Full HD\nBildformat: 16:9\nOberfl\u00e4che: entspiegelt\nFarbraumabdeckung: 100% sRGB\nFarbtiefe: 8 Bit / 16,7 Mio Farben\nHelligkeit: 250 cd/m\u00b2\nKontrast typisch: 1.000:1\nKontrast dynamisch: 50.000.000:1\nReaktionszeit: 5 ms\nBetrachtungswinkel h/v: 178\u00b0/178\u00b0\nHDMI: 1x HDMI\nDVI: 1x DVI\nDisplayport: 1x DP\nUSB-C: kein\nLautsprecher: 2x\nLeistung: 2W\nH\u00f6henverstellbar: 150mm\nWandmontage: VESA100x100\nBreite in mm: 540mm\nH\u00f6he in mm: 507mm\nTiefe in mm: 206mm\nGewicht in kg: 5,0 kg",
    "reference_file": "offer_reference_2223.json",
    "shop_name": "Cyberport Stores \u00d6sterreich"
}