{
    "html_file": "offer_2438_3.html",
    "name": "Dell UltraSharp UP3218K / UP3218KA, 31.5\"",
    "offer_link": "https://www.taufnaus.de/product/10606125",
    "price": 4192.97,
    "raw_specifications": {
        "Abmessungen (Breite x Tiefe x H\u00f6he)": "72.05 cm x 22.2 cm x 61.8 cm - mit Fu\u00df",
        "Besonderheiten": "100% Adobe RGB-Farbskala, 100% sRGB-Farbskala, 98% DCI-P3, 100% Rec 709 Farbpalette",
        "Bildschirmbeschichtung": "Entspiegelt, 2H Hard Coating",
        "Bildschirmtyp": "IPS",
        "Details zu Abmessungen & Gewicht": "Mit Fu\u00df - Breite: 72.05 cm - Tiefe: 22.2 cm - H\u00f6he: 61.8 cm - Gewicht: 10.5 kg \u00a6 Ohne Fu\u00df - Breite: 72.05 cm - Tiefe: 5.32 cm - H\u00f6he: 42.12 cm - Gewicht: 6.9 kg",
        "Diagonalabmessung": "81.3 cm (32\")",
        "Display-Typ": "LED-hintergrundbeleuchteter LCD-Monitor / TFT-Aktivmatrix",
        "ENERGY STAR zertifiziert": "Ja",
        "Einstellungen der Anzeigeposition": "H\u00f6he, Pivot (Rotation), Drehung, Neigung",
        "Energie Effizienzklasse": "Klasse G",
        "Enthaltene Kabel": "1 x SuperSpeed-USB-Kabel \u00a6 2 x DisplayPort-Kabel",
        "Erforderliche Netzspannung": "Wechselstrom 120/230 V (50/60 Hz)",
        "Farbe": "Schwarz",
        "Farbunterst\u00fctzung": "1,07 Mrd. Farben",
        "Gewicht": "10.5 kg",
        "Helligkeit": "400 cd/m\u00b2",
        "Hintergrundbeleuchtungs-Technologie": "WLED",
        "Horizontaler Betrachtungswinkel": "178",
        "H\u00f6heneinstellung": "120 mm",
        "Integrierte Peripherieger\u00e4te": "USB 3.0-Hub",
        "Kennzeichnung": "Plug and Play, DDC/CI, RoHS, BFR-frei",
        "Kontrast": "1300:1",
        "Leistungsaufnahme im Ein-Zustand": "88.5 W",
        "Leistungsmerkmale": "Slot f\u00fcr Sicherheitsschloss (Kabelschloss getrennt erh\u00e4ltlich), Diebstahlschutz, VESA 100 x 100 mm, ohne Arsen",
        "Lokalisierung": "Europa",
        "Max. Betriebstemperatur": "35 \u00b0C",
        "Min Betriebstemperatur": "0 \u00b0C",
        "Montagekit": "Optional",
        "Native Aufl\u00f6sung": "8K 7680 x 4320 bei 60 Hz",
        "Neigungswinkel": "-5/+21",
        "Reaktionszeit": "8 ms (normal); 6 ms (schnell)",
        "Rotationswinkel": "90",
        "Schlosstyp zur Diebstahlsicherung": "Kensington Slot",
        "Schnittstellen": "2 x DisplayPort \u00a6 3 x USB 3.0 Downstream (Typ A) \u00a6 USB 3.0 Downstream (Typ A (nur Strom)) \u00a6 USB 3.0 Upstream (Typ B) \u00a6 Audio Line-Out",
        "Schwenkwinkel": "60",
        "Seitenverh\u00e4ltnis": "16:9",
        "Service & Support": "Begrenzte Garantie - 3 Jahre",
        "Services im Bundle": "3 Jahre Advanced Exchange-Service",
        "Sichtbare Bildfl\u00e4che": "80.01 cm (31.5\")",
        "Stromverbrauch (Aus-Modus)": "0.3 Watt",
        "Stromverbrauch (typisch)": "87 Watt",
        "Stromverbrauch SDR (eingeschaltet)": "88.5 kWh/1.000 h",
        "VESA-Halterung": "100 x 100 mm",
        "Vertikaler Betrachtungswinkel": "178",
        "Zul\u00e4ssige Luftfeuchtigkeit im Betrieb": "10 - 80% (nicht kondensierend)"
    },
    "raw_specifications_text": "Display-Typ: LED-hintergrundbeleuchteter LCD-Monitor / TFT-Aktivmatrix\nEnergie Effizienzklasse: Klasse G\nDiagonalabmessung: 81.3 cm (32\")\nSichtbare Bildfl\u00e4che: 80.01 cm (31.5\")\nIntegrierte Peripherieger\u00e4te: USB 3.0-Hub\nBildschirmtyp: IPS\nSeitenverh\u00e4ltnis: 16:9\nNative Aufl\u00f6sung: 8K 7680 x 4320 bei 60 Hz\nHelligkeit: 400 cd/m\u00b2\nKontrast: 1300:1\nFarbunterst\u00fctzung: 1,07 Mrd. Farben\nReaktionszeit: 8 ms (normal); 6 ms (schnell)\nHorizontaler Betrachtungswinkel: 178\nVertikaler Betrachtungswinkel: 178\nBildschirmbeschichtung: Entspiegelt, 2H Hard Coating\nHintergrundbeleuchtungs-Technologie: WLED\nBesonderheiten: 100% Adobe RGB-Farbskala, 100% sRGB-Farbskala, 98% DCI-P3, 100% Rec 709 Farbpalette\nFarbe: Schwarz\nAbmessungen (Breite x Tiefe x H\u00f6he): 72.05 cm x 22.2 cm x 61.8 cm - mit Fu\u00df\nGewicht: 10.5 kg\nSchnittstellen: 2 x DisplayPort \u00a6 3 x USB 3.0 Downstream (Typ A) \u00a6 USB 3.0 Downstream (Typ A (nur Strom)) \u00a6 USB 3.0 Upstream (Typ B) \u00a6 Audio Line-Out\nEinstellungen der Anzeigeposition: H\u00f6he, Pivot (Rotation), Drehung, Neigung\nNeigungswinkel: -5/+21\nSchwenkwinkel: 60\nRotationswinkel: 90\nH\u00f6heneinstellung: 120 mm\nVESA-Halterung: 100 x 100 mm\nLeistungsmerkmale: Slot f\u00fcr Sicherheitsschloss (Kabelschloss getrennt erh\u00e4ltlich), Diebstahlschutz, VESA 100 x 100 mm, ohne Arsen\nEnthaltene Kabel: 1 x SuperSpeed-USB-Kabel \u00a6 2 x DisplayPort-Kabel\nMontagekit: Optional\nKennzeichnung: Plug and Play, DDC/CI, RoHS, BFR-frei\nLokalisierung: Europa\nSchlosstyp zur Diebstahlsicherung: Kensington Slot\nErforderliche Netzspannung: Wechselstrom 120/230 V (50/60 Hz)\nLeistungsaufnahme im Ein-Zustand: 88.5 W\nStromverbrauch SDR (eingeschaltet): 88.5 kWh/1.000 h\nStromverbrauch (typisch): 87 Watt\nStromverbrauch (Aus-Modus): 0.3 Watt\nDetails zu Abmessungen & Gewicht: Mit Fu\u00df - Breite: 72.05 cm - Tiefe: 22.2 cm - H\u00f6he: 61.8 cm - Gewicht: 10.5 kg \u00a6 Ohne Fu\u00df - Breite: 72.05 cm - Tiefe: 5.32 cm - H\u00f6he: 42.12 cm - Gewicht: 6.9 kg\nENERGY STAR zertifiziert: Ja\nService & Support: Begrenzte Garantie - 3 Jahre\nServices im Bundle: 3 Jahre Advanced Exchange-Service\nMin Betriebstemperatur: 0 \u00b0C\nMax. Betriebstemperatur: 35 \u00b0C\nZul\u00e4ssige Luftfeuchtigkeit im Betrieb: 10 - 80% (nicht kondensierend)",
    "reference_file": "offer_reference_2438.json",
    "shop_name": "TaufNaus"
}