{
    "html_file": "offer_54_12.html",
    "name": "GIGABYTE GS27QC, 27\"",
    "offer_link": "https://www.alternate.at/GIGABYTE/GS27QC-Gaming-Monitor/html/product/100013986?partner=AtGeizhalsat&campaign=Monitor/GIGABYTE/100013986",
    "price": 296.0,
    "raw_specifications": {
        "": "Adaptive-Sync, AMD FreeSync, Bild in Bild",
        "Abmessungen": "Breite: 61,05 cm x H\u00f6he: 44,1 cm x Tiefe/L\u00e4nge: 20,8 cm",
        "Anschl\u00fcsse": "2x HDMI-Eingang, (HDMI-Version: 2:0), 1x DisplayPort-Eingang, (DisplayPort-Version: 1:4), 1x Kopfh\u00f6rer-Ausgang",
        "Bild": "Format",
        "Bildschirmaufl\u00f6sung": "2.560 x 1.440 Pixel",
        "Bildschirmdiagonale": "69 cm (27 Zoll)",
        "EAN": "4719331854225",
        "Energieeffizienzklasse (HDR)": "G (A - G)",
        "Energieeffizienzklasse (SDR)": "F (A - G)",
        "Energieverbauch pro 1000 Stunden (HDR)": "33 kWh",
        "Energieverbauch pro 1000 Stunden (SDR)": "26 kWh",
        "Ergonomie": "Neigbar",
        "Farbe": "schwarz",
        "Features": "OSD Sidekick, Aim Stailizer, Black Equalizer, Crosshair, Timer, Flicker Free LED, Low Blue Light Modus",
        "Geeignet f\u00fcr": "Gaming",
        "Gewicht": "4,5 kg",
        "Hersteller-Nr.": "GS27QC",
        "Leistungsaufnahme im Bereitschafts- und Aus-Zustand": "0,5 Watt",
        "Leistungsaufnahme im Ein-Zustand bei Standard-Dynamikumfang (SDR)": "26 Watt",
        "Leistungsaufnahme im Ein-Zustand bei hohem Dynamikumfang (HDR)": "33 Watt",
        "Standards": "Video",
        "Stromversorgung": "Eco-Off",
        "Typ": "Gaming-Monitor",
        "Wandhalterung": "VESA kompatibel (100 x 100 mm)"
    },
    "raw_specifications_text": "Energieeffizienzklasse (SDR): F (A - G)\nEnergieverbauch pro 1000 Stunden (SDR): 26 kWh\nEnergieeffizienzklasse (HDR): G (A - G)\nEnergieverbauch pro 1000 Stunden (HDR): 33 kWh\nLeistungsaufnahme im Ein-Zustand bei Standard-Dynamikumfang (SDR): 26 Watt\nLeistungsaufnahme im Ein-Zustand bei hohem Dynamikumfang (HDR): 33 Watt\nLeistungsaufnahme im Bereitschafts- und Aus-Zustand: 0,5 Watt\nBildschirmdiagonale: 69 cm (27 Zoll)\nBildschirmaufl\u00f6sung: 2.560 x 1.440 Pixel\nTyp: Gaming-Monitor\nFarbe: schwarz\nEAN: 4719331854225\nHersteller-Nr.: GS27QC\nGeeignet f\u00fcr: Gaming\nBild: Format\n: Adaptive-Sync, AMD FreeSync, Bild in Bild\nAnschl\u00fcsse: 2x HDMI-Eingang, (HDMI-Version: 2:0), 1x DisplayPort-Eingang, (DisplayPort-Version: 1:4), 1x Kopfh\u00f6rer-Ausgang\nErgonomie: Neigbar\nStromversorgung: Eco-Off\nStandards: Video\nWandhalterung: VESA kompatibel (100 x 100 mm)\nFeatures: OSD Sidekick, Aim Stailizer, Black Equalizer, Crosshair, Timer, Flicker Free LED, Low Blue Light Modus\nAbmessungen: Breite: 61,05 cm x H\u00f6he: 44,1 cm x Tiefe/L\u00e4nge: 20,8 cm\nGewicht: 4,5 kg",
    "reference_file": "offer_reference_54.json",
    "shop_name": "Alternate.at"
}