{
    "html_file": "offer_1938_38.html",
    "name": "AOC C27G2ZU/BK, 27\"",
    "offer_link": "https://technikladen.at/P-AOC-G2-C27G2ZU/BK-686-cm-27-Zoll-1920-x-1080-Pixel-Full-HD-LED-05-ms-Schwarz-Rot?tl=gzhls",
    "price": 265.06,
    "raw_specifications": {
        "AC Eingangsfrequenz": "50/60 Hz",
        "AC Eingangsspannung": "100 - 240 V",
        "AMD FreeSync": "Ja",
        "AMD FreeSync Bildwiederholratenbereich": "48 - 240 Hz",
        "AMD FreeSync-Typ": "FreeSync Premium",
        "Abnehmbarer Standfu\u00df": "Ja",
        "Adobe RGB-Abdeckung": "89 %",
        "Anzahl DisplayPort Anschl\u00fcsse": "1",
        "Anzahl HDMI-Anschl\u00fcsse": "2",
        "Anzahl OSD-Sprachen": "16",
        "Anzahl der Farben des Displays": "16,78 Millionen Farben",
        "Anzahl der Lautsprecher": "2",
        "Anzahl der nachgeschalteten Steckpl\u00e4tze vom Typ USB-A": "4",
        "Audioanschl\u00fcsse": "Nein",
        "Bewertung der Bildschirmkr\u00fcmmung": "1500R",
        "Bildschirmaufl\u00f6sung": "1920 x 1080 Pixel",
        "Bildschirmdiagonale": "68,6 cm",
        "Bildschirmform": "Geschwungen",
        "Bildschirmkr\u00fcmmung": "150 cm",
        "Bildschirmtechnologie": "LED",
        "Bildwinkel, horizontal": "178 \u00b0",
        "Bildwinkel, vertikal": "178 \u00b0",
        "Breite (ohne Standfu\u00df)": "61,2 cm",
        "DVI Anschluss": "Nein",
        "DisplayPorts-Version": "1.2",
        "Eingebaute Lautsprecher": "Ja",
        "Energieeffizienzklasse (SDR)": "F",
        "Energieeffizienzskala": "A bis G",
        "Energieverbrauch (SDR) pro 1.000 Stunden": "24 kWh",
        "Externes Netzteil": "Nein",
        "Farbtiefe": "8 Bit",
        "Flimmerfreie Technologie": "Ja",
        "Ger\u00e4tebreite (inkl. Fu\u00df)": "612,4 mm",
        "Ger\u00e4teh\u00f6he (inkl. Fu\u00df)": "528,6 mm",
        "Ger\u00e4tetiefe (inkl. Fu\u00df)": "227,4 mm",
        "Gewicht (mit St\u00e4nder)": "5,5 kg",
        "Gewicht (ohne St\u00e4nder)": "4,1 kg",
        "HD-Typ": "Full HD",
        "HDMI": "Ja",
        "HDMI-Version": "2.0",
        "Helligkeit (typisch)": "300 cd/m\u00b2",
        "Horizontaler Scanbereich": "30 - 255 kHz",
        "H\u00f6he (ohne Standfu\u00df)": "36,7 cm",
        "H\u00f6heneinstellung": "13 cm",
        "H\u00f6henverstellung": "Ja",
        "Integrierte Kamera": "Nein",
        "Integrierter USB-Hub": "Ja",
        "Kabelsperre-Slot": "Nein",
        "Kontrastverh\u00e4ltnis": "3000:1",
        "Kontrastverh\u00e4ltnis (dynamisch)": "80000000:1",
        "Kopfh\u00f6rer-Anschluss": "3,5 mm",
        "Kopfh\u00f6rerausgang": "Ja",
        "Marktpositionierung": "Gaming",
        "Maximale Bildwiederholrate": "240 Hz",
        "Men\u00fcsprachen": "Simplified Chinese, Traditional Chinese, Czech, German, Dutch, English, Spanish, Finnish, French, Italian, Japanese, Korean, Polish, Portuguese, Russian, SER",
        "Mitgelieferte Kabel": "DisplayPort,HDMI",
        "NVIDIA G-SYNC": "Nein",
        "Nachhaltigkeitszertifikate": "RoHS",
        "Natives Seitenverh\u00e4ltnis": "16:9",
        "Neigungswinkelbereich": "3,5 - 21,5 \u00b0",
        "On-Screen-Display (OSD)": "Ja",
        "Paketgewicht": "7,8 kg",
        "Panel-Montage-Schnittstelle": "100 x 100 mm",
        "Panel-Typ": "VA",
        "Pixel Abstand": "0,311 x 0,311 mm",
        "Produktfarbe": "Black, Red",
        "RMS-Leistung": "4 W",
        "Reaktionszeit": "0,5 ms",
        "Recycelbares Verpackungsmaterial": "100 %",
        "Schwenkbar": "Ja",
        "Schwenkwinkelbereich": "30 - 30 \u00b0",
        "Schwermetallfrei": "Hg (Quecksilber)",
        "Seitenverh\u00e4ltnis": "16:9",
        "Sichtbare Gr\u00f6\u00dfe (horizontal)": "59,8 cm",
        "Sichtbare Gr\u00f6\u00dfe (vertikal)": "33,6 cm",
        "Stromverbrauch (Standardbetrieb)": "31 W",
        "Stromverbrauch (Standby)": "0,3 W",
        "Stromverbrauch (aus)": "0,3 W",
        "St\u00e4nder enthalten": "Ja",
        "Tiefe (ohne Standfu\u00df)": "7,32 cm",
        "Typ der Hintergrundbeleuchtung": "W-LED",
        "USB-Hub-Version": "3.2 Gen 1 (3.1 Gen 1)",
        "Unterst\u00fctzte Grafik-Aufl\u00f6sungen": "1920 x 1080 (HD 1080)",
        "VESA-Halterung": "Ja",
        "Verpackungsbreite": "686 mm",
        "Verpackungsh\u00f6he": "523 mm",
        "Verpackungstiefe": "214 mm",
        "Vertikaler Scanbereich": "48 - 240 Hz",
        "Zertifizierung": "CE",
        "kippbar": "Ja",
        "sRGB Abdeckung (klassisch)": "120 %"
    },
    "raw_specifications_text": "NVIDIA G-SYNC: Nein\nAMD FreeSync: Ja\nAMD FreeSync-Typ: FreeSync Premium\nAMD FreeSync Bildwiederholratenbereich: 48 - 240 Hz\nFlimmerfreie Technologie: Ja\nBildschirmdiagonale: 68,6 cm\nBildschirmaufl\u00f6sung: 1920 x 1080 Pixel\nNatives Seitenverh\u00e4ltnis: 16:9\nPanel-Typ: VA\nHelligkeit (typisch): 300 cd/m\u00b2\nReaktionszeit: 0,5 ms\nHD-Typ: Full HD\nBildschirmtechnologie: LED\nTyp der Hintergrundbeleuchtung: W-LED\nBildschirmform: Geschwungen\nBewertung der Bildschirmkr\u00fcmmung: 1500R\nBildschirmkr\u00fcmmung: 150 cm\nUnterst\u00fctzte Grafik-Aufl\u00f6sungen: 1920 x 1080 (HD 1080)\nSeitenverh\u00e4ltnis: 16:9\nKontrastverh\u00e4ltnis: 3000:1\nKontrastverh\u00e4ltnis (dynamisch): 80000000:1\nMaximale Bildwiederholrate: 240 Hz\nBildwinkel, horizontal: 178 \u00b0\nBildwinkel, vertikal: 178 \u00b0\nAnzahl der Farben des Displays: 16,78 Millionen Farben\nPixel Abstand: 0,311 x 0,311 mm\nHorizontaler Scanbereich: 30 - 255 kHz\nVertikaler Scanbereich: 48 - 240 Hz\nSichtbare Gr\u00f6\u00dfe (horizontal): 59,8 cm\nSichtbare Gr\u00f6\u00dfe (vertikal): 33,6 cm\nFarbtiefe: 8 Bit\nsRGB Abdeckung (klassisch): 120 %\nAdobe RGB-Abdeckung: 89 %\nIntegrierter USB-Hub: Ja\nUSB-Hub-Version: 3.2 Gen 1 (3.1 Gen 1)\nAnzahl der nachgeschalteten Steckpl\u00e4tze vom Typ USB-A: 4\nDVI Anschluss: Nein\nHDMI: Ja\nAnzahl HDMI-Anschl\u00fcsse: 2\nHDMI-Version: 2.0\nAnzahl DisplayPort Anschl\u00fcsse: 1\nDisplayPorts-Version: 1.2\nAudioanschl\u00fcsse: Nein\nKopfh\u00f6rerausgang: Ja\nKopfh\u00f6rer-Anschluss: 3,5 mm\nVESA-Halterung: Ja\nPanel-Montage-Schnittstelle: 100 x 100 mm\nKabelsperre-Slot: Nein\nH\u00f6henverstellung: Ja\nH\u00f6heneinstellung: 13 cm\nSchwenkbar: Ja\nSchwenkwinkelbereich: 30 - 30 \u00b0\nkippbar: Ja\nNeigungswinkelbereich: 3,5 - 21,5 \u00b0\nOn-Screen-Display (OSD): Ja\nMen\u00fcsprachen: Simplified Chinese, Traditional Chinese, Czech, German, Dutch, English, Spanish, Finnish, French, Italian, Japanese, Korean, Polish, Portuguese, Russian, SER\nAnzahl OSD-Sprachen: 16\nEingebaute Lautsprecher: Ja\nIntegrierte Kamera: Nein\nAnzahl der Lautsprecher: 2\nRMS-Leistung: 4 W\nMarktpositionierung: Gaming\nProduktfarbe: Black, Red\nAbnehmbarer Standfu\u00df: Ja\nSchwermetallfrei: Hg (Quecksilber)\nZertifizierung: CE\nSt\u00e4nder enthalten: Ja\nMitgelieferte Kabel: DisplayPort,HDMI\nVerpackungsbreite: 686 mm\nVerpackungstiefe: 214 mm\nVerpackungsh\u00f6he: 523 mm\nPaketgewicht: 7,8 kg\nEnergieeffizienzklasse (SDR): F\nEnergieverbrauch (SDR) pro 1.000 Stunden: 24 kWh\nStromverbrauch (Standardbetrieb): 31 W\nStromverbrauch (Standby): 0,3 W\nStromverbrauch (aus): 0,3 W\nAC Eingangsspannung: 100 - 240 V\nAC Eingangsfrequenz: 50/60 Hz\nExternes Netzteil: Nein\nEnergieeffizienzskala: A bis G\nGer\u00e4tebreite (inkl. Fu\u00df): 612,4 mm\nGer\u00e4tetiefe (inkl. Fu\u00df): 227,4 mm\nGer\u00e4teh\u00f6he (inkl. Fu\u00df): 528,6 mm\nGewicht (mit St\u00e4nder): 5,5 kg\nBreite (ohne Standfu\u00df): 61,2 cm\nTiefe (ohne Standfu\u00df): 7,32 cm\nH\u00f6he (ohne Standfu\u00df): 36,7 cm\nGewicht (ohne St\u00e4nder): 4,1 kg\nNachhaltigkeitszertifikate: RoHS\nRecycelbares Verpackungsmaterial: 100 %",
    "reference_file": "offer_reference_1938.json",
    "shop_name": "TechnikLaden"
}