{
    "html_file": "offer_716_19.html",
    "name": "ASUS VA24ECPSN, 23.8\"",
    "offer_link": "https://www.proshop.at/Bildschirm/ASUS-24-Bildschirm-VA24ECPSN-LED-monitor-Full-HD-1080p-238-Black-5-ms-AMD-FreeSync/3144296?utm_source=geizhals&utm_medium=cpc&utm_campaign=pricesite",
    "price": 262.78,
    "raw_specifications": {
        "Abmessungen (Breite x Tiefe x H\u00f6he)": "53.952 cm x 21.14 cm x 45.035 cm - mit Fu\u00df",
        "Abmessungen (Breite x Tiefe x H\u00f6he) - mit Fu\u00df": "53.952 cm x 21.14 cm x 45.035 cm",
        "Adaptive-Sync Technologie": "AMD FreeSync, VESA Adaptive-Sync",
        "Besonderheiten": "HDCP, rahmenlos, Low Blue Light Mode, flimmerfreie Technologie, Farbtemperatur Auswahl, GamePlus, ASUS EyeCare+ Technology, Variable Refresh Rate (VRR)",
        "Bildschirmbeschichtung": "Blendfrei",
        "Bildschirmtyp": "IPS",
        "Details zu Abmessungen & Gewicht": "Ohne Fu\u00df - Breite: 53.952 cm - Tiefe: 4.815 cm - H\u00f6he: 32.315 cm - Gewicht: 3.4 kg",
        "Diagonalabmessung": "60.5 cm (23.8\")",
        "Display-Typ": "LED-hintergrundbeleuchteter LCD-Monitor / TFT-Aktivmatrix",
        "EAN": "4711081844396",
        "Eingangsanschl\u00fcsse": "HDMI, DisplayPort, USB-C",
        "Eingangsspannung": "Wechselstrom 100-240 V (50/60 Hz)",
        "Einstellungen der Anzeigeposition": "H\u00f6he, Pivot (Rotation), Drehung, Neigung",
        "Enthaltene Kabel": "HDMI-Kabel  USB-C Kabel",
        "Farbunterst\u00fctzung": "16,7 Millionen Farben (8-Bit)",
        "Ger\u00e4tetyp": "LED-hintergrundbeleuchteter LCD-Monitor - 60.5 cm (23.8\")",
        "Gewicht": "5.35 kg",
        "Helligkeit": "300 cd/m\u00b2",
        "Hersteller": "ASUS",
        "Hintergrundbeleuchtungs-Technologie": "LED-Hintergrundbeleuchtung",
        "Horizontale Bildwiederholrate": "30 - 84 kHz",
        "Horizontaler Betrachtungswinkel": "178",
        "H\u00f6heneinstellung": "130 mm",
        "Integrierte Peripherieger\u00e4te": "USB 3.2 Gen 1 Hub",
        "Kennzeichnung": "TUV Rheinland Flicker Free Certification, HDCP 1.4, TUV Rheinland Low Blue Light (Software Solution), TCO Certified Edge",
        "Kontrast": "1000:1 / 100000000:1 (dynamisch)",
        "Leistungsmerkmale": "Slot f\u00fcr Sicherheitsschloss (Kabelschloss getrennt erh\u00e4ltlich)",
        "Modell": "90LM056J-B01170",
        "Native Aufl\u00f6sung": "Full HD (1080p) 1920 x 1080 bei 75 Hz",
        "Neigungswinkel": "-5/+35",
        "Pixelpitch": "0.2745 mm",
        "Produktbeschreibung": "ASUS VA24ECPSN - LED-Monitor - Full HD (1080p) - 60.5 cm (23.8\")",
        "Reaktionszeit": "5 ms (Gray-to-Gray)",
        "Rotationswinkel": "180",
        "Schlosstyp zur Diebstahlsicherung": "Kensington Slot",
        "Schnittstellen": "USB-C  HDMI  Kopfh\u00f6rer  DisplayPort 1.2  2 x USB 3.2 Gen 1 Downstream  USB 3.2 Gen 1 Upstream",
        "Schwenkwinkel": "360",
        "Seitenverh\u00e4ltnis": "16:9",
        "Spannung": "Wechselstrom 100-240 V (50/60 Hz)",
        "Stromverbrauch (Aus-Modus)": "0.3 Watt",
        "Stromverbrauch (typisch)": "14.5 Watt",
        "Stromverbrauch im Standby-Modus": "0.5 Watt",
        "Transportgewicht": "7.24 kg",
        "Typ": "Lautsprecher - Stereo",
        "Umweltschutzstandards": "TCO Certified Edge Displays, TCO Certified Displays 9, ENERGY STAR-qualifiziert EPEAT Silver",
        "VESA-Halterung": "100 x 100 mm",
        "Vertikale Bildwiederholrate": "48 - 75 Hz",
        "Vertikaler Betrachtungswinkel": "178",
        "Waren-Nr.": "3144296",
        "Zum Hersteller": "www.asus.com/"
    },
    "raw_specifications_text": "Hersteller: ASUS\nWaren-Nr.: 3144296\nModell: 90LM056J-B01170\nEAN: 4711081844396\nZum Hersteller: www.asus.com/\nProduktbeschreibung: ASUS VA24ECPSN - LED-Monitor - Full HD (1080p) - 60.5 cm (23.8\")\nGer\u00e4tetyp: LED-hintergrundbeleuchteter LCD-Monitor - 60.5 cm (23.8\")\nAdaptive-Sync Technologie: AMD FreeSync, VESA Adaptive-Sync\nLeistungsmerkmale: Slot f\u00fcr Sicherheitsschloss (Kabelschloss getrennt erh\u00e4ltlich)\nBildschirmtyp: IPS\nSeitenverh\u00e4ltnis: 16:9\nNative Aufl\u00f6sung: Full HD (1080p) 1920 x 1080 bei 75 Hz\nPixelpitch: 0.2745 mm\nHelligkeit: 300 cd/m\u00b2\nKontrast: 1000:1 / 100000000:1 (dynamisch)\nReaktionszeit: 5 ms (Gray-to-Gray)\nFarbunterst\u00fctzung: 16,7 Millionen Farben (8-Bit)\nEingangsanschl\u00fcsse: HDMI, DisplayPort, USB-C\nEinstellungen der Anzeigeposition: H\u00f6he, Pivot (Rotation), Drehung, Neigung\nBildschirmbeschichtung: Blendfrei\nSpannung: Wechselstrom 100-240 V (50/60 Hz)\nAbmessungen (Breite x Tiefe x H\u00f6he) - mit Fu\u00df: 53.952 cm x 21.14 cm x 45.035 cm\nGewicht: 5.35 kg\nUmweltschutzstandards: TCO Certified Edge Displays, TCO Certified Displays 9, ENERGY STAR-qualifiziert EPEAT Silver\nKennzeichnung: TUV Rheinland Flicker Free Certification, HDCP 1.4, TUV Rheinland Low Blue Light (Software Solution), TCO Certified Edge\nDisplay-Typ: LED-hintergrundbeleuchteter LCD-Monitor / TFT-Aktivmatrix\nDiagonalabmessung: 60.5 cm (23.8\")\nIntegrierte Peripherieger\u00e4te: USB 3.2 Gen 1 Hub\nVertikale Bildwiederholrate: 48 - 75 Hz\nHorizontale Bildwiederholrate: 30 - 84 kHz\nHorizontaler Betrachtungswinkel: 178\nVertikaler Betrachtungswinkel: 178\nHintergrundbeleuchtungs-Technologie: LED-Hintergrundbeleuchtung\nBesonderheiten: HDCP, rahmenlos, Low Blue Light Mode, flimmerfreie Technologie, Farbtemperatur Auswahl, GamePlus, ASUS EyeCare+ Technology, Variable Refresh Rate (VRR)\nAbmessungen (Breite x Tiefe x H\u00f6he): 53.952 cm x 21.14 cm x 45.035 cm - mit Fu\u00df\nTyp: Lautsprecher - Stereo\nSchnittstellen: USB-C  HDMI  Kopfh\u00f6rer  DisplayPort 1.2  2 x USB 3.2 Gen 1 Downstream  USB 3.2 Gen 1 Upstream\nNeigungswinkel: -5/+35\nSchwenkwinkel: 360\nRotationswinkel: 180\nH\u00f6heneinstellung: 130 mm\nVESA-Halterung: 100 x 100 mm\nEnthaltene Kabel: HDMI-Kabel  USB-C Kabel\nSchlosstyp zur Diebstahlsicherung: Kensington Slot\nEingangsspannung: Wechselstrom 100-240 V (50/60 Hz)\nStromverbrauch (typisch): 14.5 Watt\nStromverbrauch im Standby-Modus: 0.5 Watt\nStromverbrauch (Aus-Modus): 0.3 Watt\nDetails zu Abmessungen & Gewicht: Ohne Fu\u00df - Breite: 53.952 cm - Tiefe: 4.815 cm - H\u00f6he: 32.315 cm - Gewicht: 3.4 kg\nTransportgewicht: 7.24 kg",
    "reference_file": "offer_reference_716.json",
    "shop_name": "Proshop.at"
}