{
    "html_file": "offer_948_23.html",
    "name": "HP E34m G4, 34\"",
    "offer_link": "https://click.cptrack.de/?rd=true&k=5QNCBYB9xMh6DJycvhgeWzvw6S05tOLBUEFglaFJEIlOxHP3jvwJiGzRItC0EKL7iqCdpe0PJ81gw-kNg21utg~~&rdlink=https%3A%2F%2Fwww.cw-mobile.de%2Fhp-e34m-g4-86-36-cm-34-zoll-usb-c-curved-konferenzmonitor.html%3Futm_source%3DPSM%26utm_medium%3DGeizhals%26utm_campaign%3DPSM",
    "price": 630.99,
    "raw_specifications": {
        "Abmessungen & Gewicht (Transport)Transportbreite": "90.5 cmTransporttiefe: 28.1 cmTransporth\u00f6he: 48.1 cmTransportgewicht: 17.69 kg",
        "Abmessungen und GewichtDetails zu Abmessungen & Gewicht": "Ohne Fu\u00df - Breite: 80.83 cm - Tiefe: 10.91 cm - H\u00f6he: 38.81 cm \u00a6 Mit Fu\u00df - Breite: 80.83 cm - Tiefe: 23.3 cm - H\u00f6he: 54.32 cm - Gewicht: 11.98 kg",
        "AllgemeinDisplay-Typ": "LED-hintergrundbeleuchteter LCD-Monitor / TFT-AktivmatrixEnergie Effizienzklasse: Klasse GDiagonalabmessung: 86.4 cm (34\")Geschwungener Bildschirm: Ja (1500R)Integrierte Peripherieger\u00e4te: IR-Kamera, USB 3.2 Gen 1 HubUSB-Spannungsversorgung: 65 WattBildschirmtyp: VASeitenverh\u00e4ltnis: 21:9Native Aufl\u00f6sung: WQHD 3440 x 1440 bei 75 HzPixelpitch: 0.23175 mmPpi: 110Helligkeit: 400 cd/m\u00b2Kontrast: 3000:1 / 10000000:1 (dynamisch)Farbunterst\u00fctzung: 16,7 Millionen FarbenFarbraum: 99% sRGBReaktionszeit: 5 ms (grau zu grau mit \u00dcbersteuerung)Vertikale Bildwiederholrate: 48 - 75 HzHorizontale Bildwiederholrate: 30 - 150 kHzHorizontaler Betrachtungswinkel: 178Vertikaler Betrachtungswinkel: 178Bildschirmbeschichtung: Blendfrei, 3H Hard Coating, Haze 25 %Hintergrundbeleuchtungs-Technologie: LED-HintergrundbeleuchtungFarbtemperatur: 6500KOSD-Sprachen: Chinesisch (tradionell), Chinesisch (vereinfacht), Englisch, Deutsch, Franz\u00f6sisch, Italienisch, Portugiesisch, Spanisch, Holl\u00e4ndisch, JapanischBesonderheiten: HDCP, flimmerfreie Technologie, extrem schmale Blende an drei Seiten, Low Blue Light-Technologie, 8-bit Farbtiefe, kantenbeleuchtete LED-Hintergrundbeleuchtung, HP Eye Ease, Pop-up-Webcam, Zoom CertifiedFarbe: Silber (Halter), schwarzer KopfAbmessungen (Breite x Tiefe x H\u00f6he): 80.83 cm x 23.3 cm x 54.32 cm - mit Fu\u00dfGewicht: 11.98 kg",
        "AudioTyp": "Lautsprecher - StereoAusgangsleistung/Kanal: 5 Watt",
        "AudioeingangTyp": "MikrofonMikrofonfunktionen: Echounterdr\u00fcckung",
        "Informationen zur NachhaltigkeitENERGY STAR zertifiziert": "Ja",
        "Konnektivit\u00e4tSchnittstellen": "DisplayPort 1.2 (HDCP) \u00a6 HDMI (HDCP) \u00a6 USB-C 3.2 Gen 1 (bis zu 65 W) \u00a6 4 x USB 3.2 Gen 1 \u00a6 LAN \u00a6 Audio Line-In/-Out (Mini-Klinkenstecker)",
        "MechanischEinstellungen der Anzeigeposition": "H\u00f6he, Drehung, NeigungNeigungswinkel: -5/+20Schwenkwinkel: 60H\u00f6heneinstellung: 150 mmVESA-Halterung: 100 x 100 mm",
        "Software / SystemanforderungenMitgelieferte Software": "HP Display Assistant",
        "StromversorgungEingangsspannung": "Wechselstrom 120/230 V (50/60 Hz)Leistungsaufnahme im Ein-Zustand: 39 WStromverbrauch SDR (eingeschaltet): 39 kWh/1.000 hStromverbrauch (typisch): 65 WattStromverbrauch (max.): 185 WattStromverbrauch im Standby-Modus: 0.5 Watt",
        "UmgebungsbedingungenMin Betriebstemperatur": "5 \u00b0CMax. Betriebstemperatur: 35 \u00b0CZul\u00e4ssige Luftfeuchtigkeit im Betrieb: 20 - 80% (nicht kondensierend)",
        "VerschiedenesLeistungsmerkmale": "Slot f\u00fcr Sicherheitsschloss (Kabelschloss getrennt erh\u00e4ltlich), abnehmbarer St\u00e4nder, Unterst\u00fctzung f\u00fcr VESA-SchnittstelleZubeh\u00f6r im Lieferumfang: BefestigungsadapterEnthaltene Kabel: 1 x USB-C KabelMontagekit: MitgeliefertLebensdauer der Beleuchtung: 30,000 StundenKennzeichnung: TUV GS, VCCI, BSMI, NOM, TUV S, CB, CCC, PSB, FCC, ISO 9241-307, KCC, WEEE, cTUVus, E-Standby, KC, CECP, EAC, CEL Grade 1, ISC, RCM, SEPA, BIS, halogenarm, DisplayPort 1.2, Energy-using Products (EuP) Lot 5, ICE, SmartWay, NRCS, Mexico Energy label, Ukraine, UAE, TGM, Belarus EnergyLokalisierung: Englisch / EuropaSchlosstyp zur Diebstahlsicherung: Kensington Slot"
    },
    "raw_specifications_text": "AllgemeinDisplay-Typ: LED-hintergrundbeleuchteter LCD-Monitor / TFT-AktivmatrixEnergie Effizienzklasse: Klasse GDiagonalabmessung: 86.4 cm (34\")Geschwungener Bildschirm: Ja (1500R)Integrierte Peripherieger\u00e4te: IR-Kamera, USB 3.2 Gen 1 HubUSB-Spannungsversorgung: 65 WattBildschirmtyp: VASeitenverh\u00e4ltnis: 21:9Native Aufl\u00f6sung: WQHD 3440 x 1440 bei 75 HzPixelpitch: 0.23175 mmPpi: 110Helligkeit: 400 cd/m\u00b2Kontrast: 3000:1 / 10000000:1 (dynamisch)Farbunterst\u00fctzung: 16,7 Millionen FarbenFarbraum: 99% sRGBReaktionszeit: 5 ms (grau zu grau mit \u00dcbersteuerung)Vertikale Bildwiederholrate: 48 - 75 HzHorizontale Bildwiederholrate: 30 - 150 kHzHorizontaler Betrachtungswinkel: 178Vertikaler Betrachtungswinkel: 178Bildschirmbeschichtung: Blendfrei, 3H Hard Coating, Haze 25 %Hintergrundbeleuchtungs-Technologie: LED-HintergrundbeleuchtungFarbtemperatur: 6500KOSD-Sprachen: Chinesisch (tradionell), Chinesisch (vereinfacht), Englisch, Deutsch, Franz\u00f6sisch, Italienisch, Portugiesisch, Spanisch, Holl\u00e4ndisch, JapanischBesonderheiten: HDCP, flimmerfreie Technologie, extrem schmale Blende an drei Seiten, Low Blue Light-Technologie, 8-bit Farbtiefe, kantenbeleuchtete LED-Hintergrundbeleuchtung, HP Eye Ease, Pop-up-Webcam, Zoom CertifiedFarbe: Silber (Halter), schwarzer KopfAbmessungen (Breite x Tiefe x H\u00f6he): 80.83 cm x 23.3 cm x 54.32 cm - mit Fu\u00dfGewicht: 11.98 kg\nAudioeingangTyp: MikrofonMikrofonfunktionen: Echounterdr\u00fcckung\nAudioTyp: Lautsprecher - StereoAusgangsleistung/Kanal: 5 Watt\nKonnektivit\u00e4tSchnittstellen: DisplayPort 1.2 (HDCP) \u00a6 HDMI (HDCP) \u00a6 USB-C 3.2 Gen 1 (bis zu 65 W) \u00a6 4 x USB 3.2 Gen 1 \u00a6 LAN \u00a6 Audio Line-In/-Out (Mini-Klinkenstecker)\nMechanischEinstellungen der Anzeigeposition: H\u00f6he, Drehung, NeigungNeigungswinkel: -5/+20Schwenkwinkel: 60H\u00f6heneinstellung: 150 mmVESA-Halterung: 100 x 100 mm\nVerschiedenesLeistungsmerkmale: Slot f\u00fcr Sicherheitsschloss (Kabelschloss getrennt erh\u00e4ltlich), abnehmbarer St\u00e4nder, Unterst\u00fctzung f\u00fcr VESA-SchnittstelleZubeh\u00f6r im Lieferumfang: BefestigungsadapterEnthaltene Kabel: 1 x USB-C KabelMontagekit: MitgeliefertLebensdauer der Beleuchtung: 30,000 StundenKennzeichnung: TUV GS, VCCI, BSMI, NOM, TUV S, CB, CCC, PSB, FCC, ISO 9241-307, KCC, WEEE, cTUVus, E-Standby, KC, CECP, EAC, CEL Grade 1, ISC, RCM, SEPA, BIS, halogenarm, DisplayPort 1.2, Energy-using Products (EuP) Lot 5, ICE, SmartWay, NRCS, Mexico Energy label, Ukraine, UAE, TGM, Belarus EnergyLokalisierung: Englisch / EuropaSchlosstyp zur Diebstahlsicherung: Kensington Slot\nStromversorgungEingangsspannung: Wechselstrom 120/230 V (50/60 Hz)Leistungsaufnahme im Ein-Zustand: 39 WStromverbrauch SDR (eingeschaltet): 39 kWh/1.000 hStromverbrauch (typisch): 65 WattStromverbrauch (max.): 185 WattStromverbrauch im Standby-Modus: 0.5 Watt\nSoftware / SystemanforderungenMitgelieferte Software: HP Display Assistant\nAbmessungen und GewichtDetails zu Abmessungen & Gewicht: Ohne Fu\u00df - Breite: 80.83 cm - Tiefe: 10.91 cm - H\u00f6he: 38.81 cm \u00a6 Mit Fu\u00df - Breite: 80.83 cm - Tiefe: 23.3 cm - H\u00f6he: 54.32 cm - Gewicht: 11.98 kg\nAbmessungen & Gewicht (Transport)Transportbreite: 90.5 cmTransporttiefe: 28.1 cmTransporth\u00f6he: 48.1 cmTransportgewicht: 17.69 kg\nInformationen zur NachhaltigkeitENERGY STAR zertifiziert: Ja\nUmgebungsbedingungenMin Betriebstemperatur: 5 \u00b0CMax. Betriebstemperatur: 35 \u00b0CZul\u00e4ssige Luftfeuchtigkeit im Betrieb: 20 - 80% (nicht kondensierend)",
    "reference_file": "offer_reference_948.json",
    "shop_name": "cw-mobile.de"
}