{
    "html_file": "offer_1020_4.html",
    "name": "Apple Studio Display, Standardglas, neigungs- und h\u00f6henverstellbarer Standfu\u00df, 27\"",
    "offer_link": "https://direkt.jacob.de/produkte/apple-studio-display-mk0q3d-a-artnr-7648730.html?utm_source=geizhals&utm_medium=cpc&utm_campaign=Preisvergleich&ref=103",
    "price": 2059.05,
    "raw_specifications": {
        "AC Eingangsfrequenz": "50/60 Hz",
        "AC Eingangsspannung": "100 - 240 V",
        "AMD FreeSync": "Nein",
        "Anzahl der Farben des Displays": "1 Milliarden Farben",
        "Anzahl der Lautsprecher": "6",
        "Anzahl der Upstream-Ports USB Typ-C": "1",
        "Anzahl der nachgeschalteten Ports vom Typ USB-C": "3",
        "Betriebstemperatur": "10 - 35 \u00b0C",
        "Bildschirmaufl\u00f6sung": "5120 x 2880 Pixel",
        "Bildschirmdiagonale": "68,6 cm (27\" )",
        "Bildschirmdiagonale (cm)": "68,3 cm",
        "Bildschirmform": "Flach",
        "Bildschirmmaterial": "Standardglas",
        "Eingebaute Lautsprecher": "Ja",
        "Eingebautes Mikrofon": "Ja",
        "Energieeffizienzklasse (SDR)": "E",
        "Energieeffizienzskala": "A bis G",
        "Energieverbrauch (SDR) pro 1.000 Stunden": "21 kWh",
        "Ger\u00e4tebreite (inkl. Fu\u00df)": "623 mm",
        "Ger\u00e4teh\u00f6he (inkl. Fu\u00df)": "583 mm",
        "Ger\u00e4tetiefe (inkl. Fu\u00df)": "207 mm",
        "Gewicht (mit St\u00e4nder)": "7,7 kg",
        "HD-Typ": "5K Ultra HD",
        "HDMI": "Nein",
        "Helligkeit (typisch)": "600 cd/m\u00b2",
        "H\u00f6he bei Betrieb": "0 - 5000 m",
        "H\u00f6heneinstellung": "10,5 cm",
        "H\u00f6henverstellung": "Ja",
        "Integrierte Kamera": "Ja",
        "Integrierter USB-Hub": "Ja",
        "Kompatibilit\u00e4t": "Mac Studio (2022), 40,60cm (16\")  MacBook Pro (2019 or later), 35,60cm (14\")  MacBook Pro (2021), 33,00cm (13\")  MacBook Pro (2016 or later), 38,10cm (15\")  MacBook Pro (2016 or later), MacBook Air (2018 or later), Mac mini (2018 or later), Mac Pro (2019 or later), 61,00cm (24\")  iMac (2021), 68,60cm (27\")  iMac (2017 or later), 21.5\"  iMac (2017 or later), iMac Pro (2017), iPad Pro 12.9\"  (3rd generation or later), iPad Pro 27,90cm (11\") , iPad Air (5th generation)",
        "Kompatible Betriebssysteme": "macOS Monterey 12.3 or lateriPadOS 15.4 or later",
        "Kopfh\u00f6rerausgang": "Nein",
        "Marktpositionierung": "Grafikdesign",
        "Maximale Bildwiederholrate": "60 Hz",
        "Megapixel": "12 MP",
        "Mitgelieferte Kabel": "Thunderbolt",
        "NVIDIA G-SYNC": "Nein",
        "Nachhaltigkeitszertifikate": "ENERGY STAR",
        "Natives Seitenverh\u00e4ltnis": "16:9",
        "Neigungswinkelbereich": "5 - 25\u00b0",
        "Produktfarbe": "Silber",
        "Relative Luftfeuchtigkeit in Betrieb": "5 - 90%",
        "Standfu\u00df": "Neigungs- und h\u00f6henverstellbarer Standfu\u00df",
        "Stromverbrauch (Standby)": "0,5 W",
        "St\u00e4nder enthalten": "Ja",
        "USB-Upstream-Porttyp": "USB Typ-C",
        "kippbar": "Ja"
    },
    "raw_specifications_text": "Bildschirmdiagonale: 68,6 cm (27\" )\nBildschirmaufl\u00f6sung: 5120 x 2880 Pixel\nNatives Seitenverh\u00e4ltnis: 16:9\nHD-Typ: 5K Ultra HD\nBildschirmform: Flach\nMaximale Bildwiederholrate: 60 Hz\nAnzahl der Farben des Displays: 1 Milliarden Farben\nHelligkeit (typisch): 600 cd/m\u00b2\nBildschirmdiagonale (cm): 68,3 cm\nBildschirmmaterial: Standardglas\nStandfu\u00df: Neigungs- und h\u00f6henverstellbarer Standfu\u00df\nNVIDIA G-SYNC: Nein\nAMD FreeSync: Nein\nKompatible Betriebssysteme: macOS Monterey 12.3 or lateriPadOS 15.4 or later\nKompatibilit\u00e4t: Mac Studio (2022), 40,60cm (16\")  MacBook Pro (2019 or later), 35,60cm (14\")  MacBook Pro (2021), 33,00cm (13\")  MacBook Pro (2016 or later), 38,10cm (15\")  MacBook Pro (2016 or later), MacBook Air (2018 or later), Mac mini (2018 or later), Mac Pro (2019 or later), 61,00cm (24\")  iMac (2021), 68,60cm (27\")  iMac (2017 or later), 21.5\"  iMac (2017 or later), iMac Pro (2017), iPad Pro 12.9\"  (3rd generation or later), iPad Pro 27,90cm (11\") , iPad Air (5th generation)\nEingebaute Lautsprecher: Ja\nIntegrierte Kamera: Ja\nAnzahl der Lautsprecher: 6\nMegapixel: 12 MP\nEingebautes Mikrofon: Ja\nMarktpositionierung: Grafikdesign\nProduktfarbe: Silber\nIntegrierter USB-Hub: Ja\nHDMI: Nein\nKopfh\u00f6rerausgang: Nein\nUSB-Upstream-Porttyp: USB Typ-C\nAnzahl der Upstream-Ports USB Typ-C: 1\nAnzahl der nachgeschalteten Ports vom Typ USB-C: 3\nH\u00f6henverstellung: Ja\nH\u00f6heneinstellung: 10,5 cm\nkippbar: Ja\nNeigungswinkelbereich: 5 - 25\u00b0\nEnergieeffizienzklasse (SDR): E\nEnergieverbrauch (SDR) pro 1.000 Stunden: 21 kWh\nStromverbrauch (Standby): 0,5 W\nAC Eingangsspannung: 100 - 240 V\nAC Eingangsfrequenz: 50/60 Hz\nEnergieeffizienzskala: A bis G\nBetriebstemperatur: 10 - 35 \u00b0C\nRelative Luftfeuchtigkeit in Betrieb: 5 - 90%\nH\u00f6he bei Betrieb: 0 - 5000 m\nNachhaltigkeitszertifikate: ENERGY STAR\nGer\u00e4tebreite (inkl. Fu\u00df): 623 mm\nGer\u00e4tetiefe (inkl. Fu\u00df): 207 mm\nGer\u00e4teh\u00f6he (inkl. Fu\u00df): 583 mm\nGewicht (mit St\u00e4nder): 7,7 kg\nSt\u00e4nder enthalten: Ja\nMitgelieferte Kabel: Thunderbolt",
    "reference_file": "offer_reference_1020.json",
    "shop_name": "Jacob Elektronik direkt (AT)"
}