{
    "html_file": "offer_1026_10.html",
    "name": "Dell E2223HV, 21.5\"",
    "offer_link": "https://www.amazon.de/dp/B09SQ6Z29L?linkCode=xm2&camp=2025&creative=165953&smid=A3JWKAKR8XB7XF&creativeASIN=B09SQ6Z29L&tag=geizhals1-21",
    "price": 101.81,
    "raw_specifications": {
        "ASIN": "B09SQ6Z29L",
        "Amazon Bestseller-Rang": "Nr. 258,262 in Computer & Zubeh\u00f6r (Siehe Top 100 in Computer & Zubeh\u00f6r)  Nr. 3,586 in Monitore",
        "Anzahl der Lithium-Ionen-Zellen": "\u200e5",
        "Anzahl der Lithium-Metall-Zellen": "\u200e5",
        "Artikelgewicht": "\u200e2,6 Kilograms",
        "Batterien": "\u200e1 Lithium-Ionen Batterien erforderlich.",
        "Batterien enthalten": "\u200eNein",
        "Bildschirmaufl\u00f6sung": "\u200e1920 x 1080 pixels",
        "Display-Gr\u00f6\u00dfe": "\u200e21,45 Zoll",
        "Durchschnittliche Kundenbewertung": "1,0  1,0 von 5 Sternen    \n    1 Sternebewertung   \n\n\n 1,0 von 5 Sternen",
        "Farbe": "\u200eBlack",
        "Garantierte Software-Updates bis": "\u200eunbekannt",
        "Gewicht Lithium-Akku": "\u200e9 Kilogramm",
        "Hersteller": "\u200eDDELL",
        "Im Angebot von Amazon.de seit": "17. Februar 2022",
        "Kapazit\u00e4t Lithium-Akku": "\u200e2 Kilowattstunden",
        "L\u00f6sung": "\u200e1920 x 1080 Pixels",
        "Marke": "\u200eDell",
        "Modell/Serie": "\u200eDell 22 Monitor - E2223HV",
        "Modellnummer": "\u200eE2223HV",
        "Produktabmessungen": "\u200e51 x 17 x 38 cm; 2,6 Kilogramm",
        "Volt": "\u200e240 Volt"
    },
    "raw_specifications_text": "Marke: \u200eDell\nHersteller: \u200eDDELL\nModell/Serie: \u200eDell 22 Monitor - E2223HV\nProduktabmessungen: \u200e51 x 17 x 38 cm; 2,6 Kilogramm\nBatterien: \u200e1 Lithium-Ionen Batterien erforderlich.\nModellnummer: \u200eE2223HV\nFarbe: \u200eBlack\nDisplay-Gr\u00f6\u00dfe: \u200e21,45 Zoll\nBildschirmaufl\u00f6sung: \u200e1920 x 1080 pixels\nL\u00f6sung: \u200e1920 x 1080 Pixels\nVolt: \u200e240 Volt\nBatterien enthalten: \u200eNein\nKapazit\u00e4t Lithium-Akku: \u200e2 Kilowattstunden\nGewicht Lithium-Akku: \u200e9 Kilogramm\nAnzahl der Lithium-Ionen-Zellen: \u200e5\nAnzahl der Lithium-Metall-Zellen: \u200e5\nArtikelgewicht: \u200e2,6 Kilograms\nGarantierte Software-Updates bis: \u200eunbekannt\nASIN: B09SQ6Z29L\nDurchschnittliche Kundenbewertung: 1,0  1,0 von 5 Sternen    \n    1 Sternebewertung   \n\n\n 1,0 von 5 Sternen\nAmazon Bestseller-Rang: Nr. 258,262 in Computer & Zubeh\u00f6r (Siehe Top 100 in Computer & Zubeh\u00f6r)  Nr. 3,586 in Monitore\nIm Angebot von Amazon.de seit: 17. Februar 2022",
    "reference_file": "offer_reference_1026.json",
    "shop_name": "Amazon.at"
}