{
    "html_file": "offer_268_0.html",
    "name": "HP M27h, 27\"",
    "offer_link": "https://www.amazon.de/dp/B0BSH29YRM?linkCode=xm2&camp=2025&creative=165953&smid=A3JWKAKR8XB7XF&creativeASIN=B0BSH29YRM&tag=geizhals1-21",
    "price": 160.34,
    "raw_specifications": {
        "ASIN": "B0BSH29YRM",
        "Amazon Bestseller-Rang": "Nr. 4,646 in Computer & Zubeh\u00f6r (Siehe Top 100 in Computer & Zubeh\u00f6r)  Nr. 92 in Monitore",
        "Artikelgewicht": "\u200e4,15 Kilograms",
        "Batterien enthalten": "\u200eNein",
        "Bildschirmaufl\u00f6sung": "\u200e1920x1080",
        "Display-Gr\u00f6\u00dfe": "\u200e27 Zoll",
        "Durchschnittliche Kundenbewertung": "4,5  4,5 von 5 Sternen    \n    526 Sternebewertungen   \n\n\n 4,5 von 5 Sternen",
        "Farbe": "\u200eSchwarz",
        "Garantierte Software-Updates bis": "\u200eunbekannt",
        "Hersteller": "\u200eHP",
        "Im Angebot von Amazon.de seit": "17. Januar 2023",
        "L\u00f6sung": "\u200e1920 x 1080 Pixels",
        "Marke": "\u200eHP",
        "Modell/Serie": "\u200eM27h",
        "Modellnummer": "\u200eM27h",
        "Produktabmessungen": "\u200e212,2 x 607,9 x 500,3 cm; 4,15 Kilogramm"
    },
    "raw_specifications_text": "Marke: \u200eHP\nHersteller: \u200eHP\nModell/Serie: \u200eM27h\nProduktabmessungen: \u200e212,2 x 607,9 x 500,3 cm; 4,15 Kilogramm\nModellnummer: \u200eM27h\nFarbe: \u200eSchwarz\nDisplay-Gr\u00f6\u00dfe: \u200e27 Zoll\nBildschirmaufl\u00f6sung: \u200e1920x1080\nL\u00f6sung: \u200e1920 x 1080 Pixels\nBatterien enthalten: \u200eNein\nArtikelgewicht: \u200e4,15 Kilograms\nGarantierte Software-Updates bis: \u200eunbekannt\nASIN: B0BSH29YRM\nDurchschnittliche Kundenbewertung: 4,5  4,5 von 5 Sternen    \n    526 Sternebewertungen   \n\n\n 4,5 von 5 Sternen\nAmazon Bestseller-Rang: Nr. 4,646 in Computer & Zubeh\u00f6r (Siehe Top 100 in Computer & Zubeh\u00f6r)  Nr. 92 in Monitore\nIm Angebot von Amazon.de seit: 17. Januar 2023",
    "reference_file": "offer_reference_268.json",
    "shop_name": "Amazon.at"
}