{
    "html_file": "offer_607_7.html",
    "name": "Corsair Xeneon Flex 45WQHD240 OLED, 45\"",
    "offer_link": "https://www.csv-direct.de/artinfo.php?artnr=AGX1626068&KATEGORIE=162&pva=geizhals2",
    "price": 2401.72,
    "raw_specifications": {
        "AMD FreeSync-Typ": "FreeSync Premium",
        "Anzahl DisplayPort Anschl\u00fcsse": "1",
        "Anzahl HDMI-Anschl\u00fcsse": "2",
        "Anzahl der Farben des Displays": "1,07 Milliarden Farben",
        "Bildschirmdiagonale": "114,3 cm 45\"",
        "Bildschirmform": "Gebogen",
        "Bildschirmtechnologie": "OLED",
        "Display-Aufl\u00f6sung": "3440 x 1440 Pixel",
        "DisplayPorts-Version": "1.4",
        "Eingebaute Lautsprecher": "Nein",
        "Farbskala": "100",
        "HDMI-Version": "2.1",
        "Helligkeit peak": "1000 cd/m\u00b2",
        "Integrierte Kamera": "Nein",
        "Integrierter USB-Hub": "Nein",
        "Kabelsperre-Slot": "Nein",
        "Kontrastverh\u00e4ltnis": "1500000:1",
        "Kopfh\u00f6rerausgang": "Nein",
        "Marktpositionierung": "Gaming",
        "Maximale Bildwiederholrate": "240 Hz",
        "NVIDIA G-SYNC-Typ": "G-SYNC Compatible",
        "Natives Seitenverh\u00e4ltnis": "21:9",
        "Produktfarbe": "Schwarz",
        "Reaktionszeit": "0,03 ms",
        "Stromverbrauch Standardbetrieb": "240 W",
        "Technologie mit hohem Dynamikbereich HDR": "High Dynamic Range 10 HDR10",
        "Touchscreen": "Nein",
        "Unterst\u00fctzte Grafik-Aufl\u00f6sungen": "3440 x 1440",
        "VESA-Halterung": "Nein"
    },
    "raw_specifications_text": "Bildschirmdiagonale: 114,3 cm 45\"\nDisplay-Aufl\u00f6sung: 3440 x 1440 Pixel\nNatives Seitenverh\u00e4ltnis: 21:9\nBildschirmtechnologie: OLED\nTouchscreen: Nein\nBildschirmform: Gebogen\nKontrastverh\u00e4ltnis: 1500000:1\nMaximale Bildwiederholrate: 240 Hz\nAnzahl der Farben des Displays: 1,07 Milliarden Farben\nHelligkeit peak: 1000 cd/m\u00b2\nReaktionszeit: 0,03 ms\nUnterst\u00fctzte Grafik-Aufl\u00f6sungen: 3440 x 1440\nTechnologie mit hohem Dynamikbereich HDR: High Dynamic Range 10 HDR10\nFarbskala: 100\nNVIDIA G-SYNC-Typ: G-SYNC Compatible\nAMD FreeSync-Typ: FreeSync Premium\nEingebaute Lautsprecher: Nein\nIntegrierte Kamera: Nein\nMarktpositionierung: Gaming\nProduktfarbe: Schwarz\nIntegrierter USB-Hub: Nein\nKopfh\u00f6rerausgang: Nein\nAnzahl HDMI-Anschl\u00fcsse: 2\nHDMI-Version: 2.1\nAnzahl DisplayPort Anschl\u00fcsse: 1\nDisplayPorts-Version: 1.4\nVESA-Halterung: Nein\nKabelsperre-Slot: Nein\nStromverbrauch Standardbetrieb: 240 W",
    "reference_file": "offer_reference_607.json",
    "shop_name": "CSV-Direct.de"
}