{
    "html_file": "offer_380_2.html",
    "name": "Acer EK0 EK240YCbi, 23.8\"",
    "offer_link": "https://direkt.jacob.de/produkte/acer-ek240ycbi-60-5-um-qe0ee-c01-artnr-8327323.html?utm_source=geizhals&utm_medium=cpc&utm_campaign=Preisvergleich&ref=103",
    "price": 112.03,
    "raw_specifications": {
        "AMD FreeSync": "Ja",
        "Abnehmbarer Standfu\u00df": "Ja",
        "Anzahl VGA (D-Sub) Anschl\u00fcsse": "1",
        "Anzahl der Farben des Displays": "16,78 Millionen Farben",
        "Bildschirmdiagonale": "60,5 cm (23.8\" )",
        "Bildschirmform": "Flach",
        "Bildschirmtechnologie": "LED",
        "Bildwinkel, horizontal": "178\u00b0",
        "Bildwinkel, vertikal": "178\u00b0",
        "Breite (ohne Standfu\u00df)": "55,1 cm",
        "Display-Aufl\u00f6sung": "1920 x 1080 Pixel",
        "Eingebaute Lautsprecher": "Nein",
        "Energie Effizienzklasse": "F",
        "Energieeffizienzklasse (SDR)": "F",
        "Energieeffizienzskala": "A bis G",
        "Energieverbrauch (SDR) pro 1.000 Stunden": "20 kWh",
        "Fu\u00dffarbe": "Schwarz",
        "Ger\u00e4tebreite (inkl. Fu\u00df)": "551 mm",
        "Ger\u00e4teh\u00f6he (inkl. Fu\u00df)": "389 mm",
        "Ger\u00e4tetiefe (inkl. Fu\u00df)": "181 mm",
        "Gewicht (mit St\u00e4nder)": "2,9 kg",
        "Gewicht (ohne St\u00e4nder)": "2,5 kg",
        "HD-Typ": "Full HD",
        "HDMI": "Ja",
        "Helligkeit (typisch)": "250 cd/m\u00b2",
        "H\u00f6he (ohne Standfu\u00df)": "32,5 cm",
        "Integrierte Kamera": "Nein",
        "Integrierter USB-Hub": "Nein",
        "Kontrastverh\u00e4ltnis": "1000:1",
        "Kontrastverh\u00e4ltnis (dynamisch)": "100000000:1",
        "Kopfh\u00f6rerausgang": "Ja",
        "LED-Anzeigen": "Ja",
        "Maximale Bildwiederholrate": "60 Hz",
        "NVIDIA G-SYNC": "Nein",
        "Natives Seitenverh\u00e4ltnis": "16:9",
        "Neigungsverstellung": "Ja",
        "Neigungswinkelbereich": "5 - 20\u00b0",
        "Panel-Typ": "VA",
        "Produktfarbe": "Schwarz",
        "Reaktionszeit": "5 ms",
        "Seitenverh\u00e4ltnis": "16:9",
        "Stromverbrauch (Standardbetrieb)": "20 W",
        "St\u00e4nder enthalten": "Ja",
        "Tiefe (ohne Standfu\u00df)": "3,7 cm",
        "Touchscreen": "Nein",
        "Unterst\u00fctzte Grafik-Aufl\u00f6sungen": "1920 x 1080 (HD 1080)",
        "VESA-Halterung": "Ja",
        "Verpackungsart": "Box",
        "Vorderer Rahmen": "Schwarz"
    },
    "raw_specifications_text": "Bildschirmdiagonale: 60,5 cm (23.8\" )\nDisplay-Aufl\u00f6sung: 1920 x 1080 Pixel\nEnergie Effizienzklasse: F\nNatives Seitenverh\u00e4ltnis: 16:9\nBildschirmtechnologie: LED\nTouchscreen: Nein\nHD-Typ: Full HD\nPanel-Typ: VA\nBildschirmform: Flach\nKontrastverh\u00e4ltnis: 1000:1\nMaximale Bildwiederholrate: 60 Hz\nAnzahl der Farben des Displays: 16,78 Millionen Farben\nHelligkeit (typisch): 250 cd/m\u00b2\nReaktionszeit: 5 ms\nUnterst\u00fctzte Grafik-Aufl\u00f6sungen: 1920 x 1080 (HD 1080)\nSeitenverh\u00e4ltnis: 16:9\nKontrastverh\u00e4ltnis (dynamisch): 100000000:1\nBildwinkel, horizontal: 178\u00b0\nBildwinkel, vertikal: 178\u00b0\nNVIDIA G-SYNC: Nein\nAMD FreeSync: Ja\nEingebaute Lautsprecher: Nein\nIntegrierte Kamera: Nein\nProduktfarbe: Schwarz\nVorderer Rahmen: Schwarz\nAbnehmbarer Standfu\u00df: Ja\nFu\u00dffarbe: Schwarz\nIntegrierter USB-Hub: Nein\nHDMI: Ja\nKopfh\u00f6rerausgang: Ja\nAnzahl VGA (D-Sub) Anschl\u00fcsse: 1\nVESA-Halterung: Ja\nNeigungswinkelbereich: 5 - 20\u00b0\nLED-Anzeigen: Ja\nNeigungsverstellung: Ja\nEnergieeffizienzklasse (SDR): F\nEnergieverbrauch (SDR) pro 1.000 Stunden: 20 kWh\nStromverbrauch (Standardbetrieb): 20 W\nEnergieeffizienzskala: A bis G\nSt\u00e4nder enthalten: Ja\nGer\u00e4tebreite (inkl. Fu\u00df): 551 mm\nGer\u00e4tetiefe (inkl. Fu\u00df): 181 mm\nGer\u00e4teh\u00f6he (inkl. Fu\u00df): 389 mm\nGewicht (mit St\u00e4nder): 2,9 kg\nBreite (ohne Standfu\u00df): 55,1 cm\nTiefe (ohne Standfu\u00df): 3,7 cm\nH\u00f6he (ohne Standfu\u00df): 32,5 cm\nGewicht (ohne St\u00e4nder): 2,5 kg\nVerpackungsart: Box",
    "reference_file": "offer_reference_380.json",
    "shop_name": "Jacob Elektronik direkt (AT)"
}