{
    "html_file": "offer_999_38.html",
    "name": "Lenovo ThinkVision P34w-20, 34.14\"",
    "offer_link": "https://www.alternate.at/Lenovo/ThinkVision-P34w-20-LED-Monitor/html/product/1821733?partner=AtGeizhalsat&campaign=Monitor/Lenovo/1821733",
    "price": 951.0,
    "raw_specifications": {
        "": "Ausgangsleistung",
        "Abmessungen": "Breite: 81,73 cm x H\u00f6he: 62,14 cm x Tiefe/L\u00e4nge: 24,5 cm",
        "Anschl\u00fcsse": "2x HDMI-Eingang, (HDMI-Version: 2.0), 1x DisplayPort-Eingang, 1x DisplayPort-Ausgang, (DisplayPort-Version: 1.2), 1x Kopfh\u00f6rer-Ausgang, 1x USB-C 3.2 Gen 1 (5 Gbit/s), 1x RJ 45",
        "Bild": "Glaretyp",
        "Bildschirmaufl\u00f6sung": "3.440 x 1.440 Pixel",
        "Bildschirmdiagonale": "86 cm (34 Zoll)",
        "EAN": "0195713586733",
        "Energieeffizienzklasse (HDR)": "G (A - G)",
        "Energieeffizienzklasse (SDR)": "F (A - G)",
        "Energieverbauch pro 1000 Stunden (HDR)": "34 kWh",
        "Energieverbauch pro 1000 Stunden (SDR)": "32 kWh",
        "Ergonomie": "Typ",
        "Farbe": "schwarz",
        "Features": "KVM-Switch, Delta E < 2, Low Blue Light, Eye Comfort Funktion",
        "Gewicht": "10,8 kg",
        "Hersteller-Nr.": "62CCRAT3EU",
        "Lautsprecher": "2 Lautsprecher",
        "Leistungsaufnahme im Bereitschafts- und Aus-Zustand": "0,3 Watt",
        "Leistungsaufnahme im Ein-Zustand bei Standard-Dynamikumfang (SDR)": "31,6 Watt",
        "Leistungsaufnahme im Ein-Zustand bei hohem Dynamikumfang (HDR)": "34.2 Watt",
        "Serie": "ThinkVison",
        "Standards": "Video",
        "Stromversorgung": "Eco-Off",
        "Typ": "LED-Monitor",
        "Wandhalterung": "VESA kompatibel (100 x 100 mm)",
        "Zubeh\u00f6r": "Vorhanden"
    },
    "raw_specifications_text": "Energieeffizienzklasse (SDR): F (A - G)\nEnergieverbauch pro 1000 Stunden (SDR): 32 kWh\nEnergieeffizienzklasse (HDR): G (A - G)\nEnergieverbauch pro 1000 Stunden (HDR): 34 kWh\nLeistungsaufnahme im Ein-Zustand bei Standard-Dynamikumfang (SDR): 31,6 Watt\nLeistungsaufnahme im Ein-Zustand bei hohem Dynamikumfang (HDR): 34.2 Watt\nLeistungsaufnahme im Bereitschafts- und Aus-Zustand: 0,3 Watt\nBildschirmdiagonale: 86 cm (34 Zoll)\nBildschirmaufl\u00f6sung: 3.440 x 1.440 Pixel\nTyp: LED-Monitor\nFarbe: schwarz\nEAN: 0195713586733\nHersteller-Nr.: 62CCRAT3EU\nSerie: ThinkVison\nBild: Glaretyp\n: Ausgangsleistung\nAnschl\u00fcsse: 2x HDMI-Eingang, (HDMI-Version: 2.0), 1x DisplayPort-Eingang, 1x DisplayPort-Ausgang, (DisplayPort-Version: 1.2), 1x Kopfh\u00f6rer-Ausgang, 1x USB-C 3.2 Gen 1 (5 Gbit/s), 1x RJ 45\nErgonomie: Typ\nStromversorgung: Eco-Off\nLautsprecher: 2 Lautsprecher\nStandards: Video\nWandhalterung: VESA kompatibel (100 x 100 mm)\nFeatures: KVM-Switch, Delta E < 2, Low Blue Light, Eye Comfort Funktion\nZubeh\u00f6r: Vorhanden\nAbmessungen: Breite: 81,73 cm x H\u00f6he: 62,14 cm x Tiefe/L\u00e4nge: 24,5 cm\nGewicht: 10,8 kg",
    "reference_file": "offer_reference_999.json",
    "shop_name": "Alternate.at"
}