{
    "html_file": "offer_1331_13.html",
    "name": "Samsung T45F, 27\"",
    "offer_link": "https://www.proshop.at/Bildschirm/Samsung-27-Bildschirm-F27T450FZU-Black-5-ms-AMD-FreeSync/2990219?utm_source=geizhals&utm_medium=cpc&utm_campaign=pricesite",
    "price": 154.06,
    "raw_specifications": {
        "Abmessungen (Breite x Tiefe x H\u00f6he)": "61.21 cm x 22.4 cm x 39.16 cm - mit Fu\u00df",
        "Abmessungen (Breite x Tiefe x H\u00f6he) - mit Fu\u00df": "61.21 cm x 22.4 cm x 39.16 cm",
        "Adaptive-Sync Technologie": "AMD FreeSync",
        "Besonderheiten": "Spielmodus, Mega Dynamic Contrast Ratio, flimmerfreie Technologie, Image Size, Eco Saving Plus, Eye Saver Mode, Off Timer Plus",
        "Bildschirmtyp": "IPS",
        "Details zu Abmessungen & Gewicht": "Mit Fu\u00df - Breite: 61.21 cm - Tiefe: 22.4 cm - H\u00f6he: 39.16 cm - Gewicht: 4.6 kg  Ohne Fu\u00df - Breite: 61.21 cm - Tiefe: 3.94 cm - H\u00f6he: 36.36 cm - Gewicht: 3.2 kg",
        "Diagonalabmessung": "68.6 cm (27\")",
        "Display-Typ": "LED-hintergrundbeleuchteter LCD-Monitor / TFT-Aktivmatrix",
        "EAN": "8806092614802",
        "ENERGY STAR zertifiziert": "Ja",
        "Eingangsanschl\u00fcsse": "2xHDMI, DisplayPort",
        "Eingangsspannung": "Wechselstrom 100-240 V",
        "Einstellungen der Anzeigeposition": "H\u00f6he, Pivot (Rotation), Drehung, Neigung",
        "Energie Effizienzklasse": "Klasse D",
        "Energieverbrauch pro Jahr": "25 kWh",
        "Enthaltene Kabel": "1 x HDMI-Kabel",
        "Farbe": "Schwarz",
        "Farbraum": "72% (CIE 1931)",
        "Farbunterst\u00fctzung": "16,7 Millionen Farben",
        "Ger\u00e4tetyp": "LED-hintergrundbeleuchteter LCD-Monitor - 68.6 cm (27\")",
        "Gewicht": "4.6 kg",
        "Helligkeit": "250 cd/m\u00b2",
        "Hersteller": "Samsung",
        "Hintergrundbeleuchtungs-Technologie": "LED-Hintergrundbeleuchtung",
        "Horizontaler Betrachtungswinkel": "178",
        "H\u00f6heneinstellung": "130 mm",
        "Integrierte Peripherieger\u00e4te": "USB 2.0 Hub",
        "Kontrast": "1000:1",
        "Leistungsmerkmale": "Slot f\u00fcr Sicherheitsschloss (Kabelschloss getrennt erh\u00e4ltlich)",
        "Modell": "LF27T450FZUXEN",
        "Native Aufl\u00f6sung": "Full HD (1080p) 1920 x 1080 bei 75 Hz",
        "Neigungswinkel": "-3/+25",
        "Produktbeschreibung": "Samsung F27T450FZU - T45F Series - LED-Monitor - Full HD (1080p) - 68.6 cm (27\")",
        "Reaktionszeit": "5 ms (Gray-to-Gray)",
        "Schlosstyp zur Diebstahlsicherung": "Kensington Slot",
        "Schnittstellen": "DisplayPort 1.2  2 x HDMI  Kopfh\u00f6rer  2 x USB 2.0",
        "Schwenkwinkel": "90",
        "Seitenverh\u00e4ltnis": "16:9",
        "Spannung": "Wechselstrom 100-240 V",
        "Stromverbrauch (Aus-Modus)": "0.3 Watt",
        "Stromverbrauch (typisch)": "17 Watt",
        "Stromverbrauch SDR (eingeschaltet)": "17 kWh/1.000 h",
        "Stromverbrauch im Standby-Modus": "0.5 Watt",
        "TCO-zertifiziert": "TCO Certified Displays 8",
        "Transportbreite": "69.3 cm",
        "Transportgewicht": "6.2 kg",
        "Transporth\u00f6he": "42.8 cm",
        "Transporttiefe": "14.7 cm",
        "Typ": "Lautsprecher",
        "Umweltschutzstandards": "TCO Certified Displays 8, ENERGY STAR-qualifiziert",
        "VESA-Halterung": "100 x 100 mm",
        "Vertikaler Betrachtungswinkel": "178",
        "Waren-Nr.": "2990219",
        "Zum Hersteller": "www.samsung.com"
    },
    "raw_specifications_text": "Hersteller: Samsung\nWaren-Nr.: 2990219\nModell: LF27T450FZUXEN\nEAN: 8806092614802\nZum Hersteller: www.samsung.com\nProduktbeschreibung: Samsung F27T450FZU - T45F Series - LED-Monitor - Full HD (1080p) - 68.6 cm (27\")\nGer\u00e4tetyp: LED-hintergrundbeleuchteter LCD-Monitor - 68.6 cm (27\")\nEnergie Effizienzklasse: Klasse D\nEnergieverbrauch pro Jahr: 25 kWh\nAdaptive-Sync Technologie: AMD FreeSync\nLeistungsmerkmale: Slot f\u00fcr Sicherheitsschloss (Kabelschloss getrennt erh\u00e4ltlich)\nBildschirmtyp: IPS\nSeitenverh\u00e4ltnis: 16:9\nNative Aufl\u00f6sung: Full HD (1080p) 1920 x 1080 bei 75 Hz\nHelligkeit: 250 cd/m\u00b2\nKontrast: 1000:1\nReaktionszeit: 5 ms (Gray-to-Gray)\nFarbunterst\u00fctzung: 16,7 Millionen Farben\nFarbraum: 72% (CIE 1931)\nEingangsanschl\u00fcsse: 2xHDMI, DisplayPort\nEinstellungen der Anzeigeposition: H\u00f6he, Pivot (Rotation), Drehung, Neigung\nSpannung: Wechselstrom 100-240 V\nFarbe: Schwarz\nAbmessungen (Breite x Tiefe x H\u00f6he) - mit Fu\u00df: 61.21 cm x 22.4 cm x 39.16 cm\nGewicht: 4.6 kg\nUmweltschutzstandards: TCO Certified Displays 8, ENERGY STAR-qualifiziert\nDisplay-Typ: LED-hintergrundbeleuchteter LCD-Monitor / TFT-Aktivmatrix\nDiagonalabmessung: 68.6 cm (27\")\nIntegrierte Peripherieger\u00e4te: USB 2.0 Hub\nHorizontaler Betrachtungswinkel: 178\nVertikaler Betrachtungswinkel: 178\nHintergrundbeleuchtungs-Technologie: LED-Hintergrundbeleuchtung\nBesonderheiten: Spielmodus, Mega Dynamic Contrast Ratio, flimmerfreie Technologie, Image Size, Eco Saving Plus, Eye Saver Mode, Off Timer Plus\nAbmessungen (Breite x Tiefe x H\u00f6he): 61.21 cm x 22.4 cm x 39.16 cm - mit Fu\u00df\nTyp: Lautsprecher\nSchnittstellen: DisplayPort 1.2  2 x HDMI  Kopfh\u00f6rer  2 x USB 2.0\nNeigungswinkel: -3/+25\nSchwenkwinkel: 90\nH\u00f6heneinstellung: 130 mm\nVESA-Halterung: 100 x 100 mm\nEnthaltene Kabel: 1 x HDMI-Kabel\nSchlosstyp zur Diebstahlsicherung: Kensington Slot\nEingangsspannung: Wechselstrom 100-240 V\nStromverbrauch SDR (eingeschaltet): 17 kWh/1.000 h\nStromverbrauch (typisch): 17 Watt\nStromverbrauch im Standby-Modus: 0.5 Watt\nStromverbrauch (Aus-Modus): 0.3 Watt\nDetails zu Abmessungen & Gewicht: Mit Fu\u00df - Breite: 61.21 cm - Tiefe: 22.4 cm - H\u00f6he: 39.16 cm - Gewicht: 4.6 kg  Ohne Fu\u00df - Breite: 61.21 cm - Tiefe: 3.94 cm - H\u00f6he: 36.36 cm - Gewicht: 3.2 kg\nTransportbreite: 69.3 cm\nTransporttiefe: 14.7 cm\nTransporth\u00f6he: 42.8 cm\nTransportgewicht: 6.2 kg\nTCO-zertifiziert: TCO Certified Displays 8\nENERGY STAR zertifiziert: Ja",
    "reference_file": "offer_reference_1331.json",
    "shop_name": "Proshop.at"
}