{
    "html_file": "offer_1159_0.html",
    "name": "Lenovo Legion Y25g-30, 24.5\"",
    "offer_link": "https://technikladen.at/I-Lenovo-Y25g-30?tl=gzhls",
    "price": 327.72,
    "raw_specifications": {
        "AC Eingangsfrequenz": "50/60 Hz",
        "AC Eingangsspannung": "100 - 240 V",
        "Anzahl DisplayPort Anschl\u00fcsse": "1",
        "Anzahl HDMI-Anschl\u00fcsse": "2",
        "Anzahl der Farben des Displays": "16,7 Millionen Farben",
        "Anzahl der Lautsprecher": "2",
        "Anzahl der Upstream-Ports USB Typ-B": "1",
        "Anzahl der nachgeschalteten Ports vom Typ USB-C": "1",
        "Anzahl der nachgeschalteten Steckpl\u00e4tze vom Typ USB-A": "3",
        "Bezel Weite (bottom)": "2,25 cm",
        "Bezel Weite (side)": "2 mm",
        "Bezel Weite (top)": "2 mm",
        "Bildschirmaufl\u00f6sung": "1920 x 1080 Pixel",
        "Bildschirmdiagonale": "62,2 cm",
        "Bildschirmform": "Flach",
        "Bildschirmtechnologie": "LED",
        "Blendfreier Bildschirm": "Ja",
        "Blickwinkel, horizontal": "178 \u00b0",
        "Blickwinkel, vertikal": "178 \u00b0",
        "Breite (ohne Standfu\u00df)": "55,7 cm",
        "DisplayPort Kabell\u00e4nge": "1,8 m",
        "DisplayPorts-Version": "1.4",
        "Eingebaute Lautsprecher": "Ja",
        "Eingebautes Mikrofon": "Nein",
        "Energieeffizienzklasse (HDR)": "F",
        "Energieeffizienzklasse (SDR)": "F",
        "Energieeffizienzskala": "A bis G",
        "Energieverbrauch (HDR) pro 1.000 Stunden": "35 kWh",
        "Energieverbrauch (SDR) pro 1.000 Stunden": "23 kWh",
        "Farbintensit\u00e4t": "8 Bit",
        "Flimmerfreie Technologie": "Ja",
        "Ger\u00e4tebreite (inkl. Fu\u00df)": "557,3 mm",
        "Ger\u00e4teh\u00f6he (inkl. Fu\u00df)": "509,8 mm",
        "Ger\u00e4tetiefe (inkl. Fu\u00df)": "230,6 mm",
        "Gewicht (mit St\u00e4nder)": "6,1 kg",
        "Gewicht (ohne St\u00e4nder)": "4,1 kg",
        "HD-Typ": "Full HD",
        "HDMI": "Ja",
        "HDMI-Version": "2.0",
        "Helligkeit (typisch)": "400 cd/m\u00b2",
        "H\u00f6he (ohne Standfu\u00df)": "33,3 cm",
        "H\u00f6heneinstellung": "13 cm",
        "H\u00f6henverstellung": "Ja",
        "Integrierte Kamera": "Nein",
        "Integrierter USB-Hub": "Ja",
        "Intergrierter Kopfh\u00f6rer-Haken": "Ja",
        "Kabelsperre-Slot": "Ja",
        "Kontrastverh\u00e4ltnis": "1000:1",
        "Kontrastverh\u00e4ltnis (dynamisch)": "3000000:1",
        "Kopfh\u00f6rer-Konnektivit\u00e4t": "3,5 mm",
        "Kopfh\u00f6rerausgang": "Ja",
        "Kopfh\u00f6rerausg\u00e4nge": "1",
        "Low-Blue-Light-Technologie": "Ja",
        "Marktpositionierung": "Gaming",
        "Maximale Bildwiederholrate": "360 Hz",
        "Mitgelieferte Kabel": "AC, DisplayPort, USB Type-A to USB Type-B",
        "NVIDIA G-SYNC": "Ja",
        "Nachhaltigkeitszertifikate": "RoHS",
        "Name der Farbe": "Raven Black",
        "Natives Seitenverh\u00e4ltnis": "16:9",
        "Neigungswinkelbereich": "-5 - 22 \u00b0",
        "Netzteiltyp": "Extern",
        "Paketgewicht": "8,8 kg",
        "Panel-Montage-Schnittstelle": "100 x 100 mm",
        "Panel-Typ": "IPS",
        "Pivot": "Ja",
        "Pivot Winkel": "-90 - 90 \u00b0",
        "Pixel Abstand": "0,283 x 0,28 mm",
        "Pixeldichte": "90 ppi",
        "Produktfarbe": "Schwarz",
        "RGB-Farbraum": "sRGB",
        "RMS-Leistung": "6 W",
        "Reaktionszeit (schnell)": "1 ms",
        "Schnellstart\u00fcbersicht": "Ja",
        "Schwenkbar": "Ja",
        "Schwenkwinkelbereich": "-30 - 30 \u00b0",
        "Sichtbare Gr\u00f6\u00dfe (horizontal)": "55,2 cm",
        "Sichtbare Gr\u00f6\u00dfe (vertikal)": "32 cm",
        "Slot-Typ Kabelsperre": "Kensington",
        "Stromadapter enthalten": "Ja",
        "Stromverbrauch (Standardbetrieb)": "30 W",
        "Stromverbrauch (aus)": "0,3 W",
        "Stromverbrauch (max.)": "115 W",
        "St\u00e4nder enthalten": "Ja",
        "Tiefe (ohne Standfu\u00df)": "5,7 cm",
        "Typ der Hintergrundbeleuchtung": "W-LED",
        "USB-Hub-Version": "3.2 Gen 1 (3.1 Gen 1)",
        "USB-Stromversorgung bis zu": "27 W",
        "USB-Upstream-Porttyp": "USB Typ-B",
        "Unterst\u00fctzte Grafik-Aufl\u00f6sungen": "1920 x 1080 (HD 1080)",
        "VESA-Halterung": "Ja",
        "Verpackungsart": "Box",
        "Verpackungsbreite": "720 mm",
        "Verpackungsh\u00f6he": "421 mm",
        "Verpackungstiefe": "160 mm",
        "Vorderer Rahmen": "Schwarz",
        "Zertifizierung": "CCC, Tier 2, T\u00dcV Rheinland Low Blue Light, T\u00dcV Rheinland Flicker Free",
        "kippbar": "Ja",
        "sRGB Abdeckung (klassisch)": "99 %"
    },
    "raw_specifications_text": "NVIDIA G-SYNC: Ja\nFlimmerfreie Technologie: Ja\nLow-Blue-Light-Technologie: Ja\nBildschirmdiagonale: 62,2 cm\nBildschirmaufl\u00f6sung: 1920 x 1080 Pixel\nNatives Seitenverh\u00e4ltnis: 16:9\nPanel-Typ: IPS\nHelligkeit (typisch): 400 cd/m\u00b2\nHD-Typ: Full HD\nBildschirmtechnologie: LED\nTyp der Hintergrundbeleuchtung: W-LED\nBlendfreier Bildschirm: Ja\nBildschirmform: Flach\nUnterst\u00fctzte Grafik-Aufl\u00f6sungen: 1920 x 1080 (HD 1080)\nKontrastverh\u00e4ltnis: 1000:1\nKontrastverh\u00e4ltnis (dynamisch): 3000000:1\nMaximale Bildwiederholrate: 360 Hz\nBlickwinkel, horizontal: 178 \u00b0\nBlickwinkel, vertikal: 178 \u00b0\nAnzahl der Farben des Displays: 16,7 Millionen Farben\nReaktionszeit (schnell): 1 ms\nPixel Abstand: 0,283 x 0,28 mm\nPixeldichte: 90 ppi\nSichtbare Gr\u00f6\u00dfe (horizontal): 55,2 cm\nSichtbare Gr\u00f6\u00dfe (vertikal): 32 cm\nFarbintensit\u00e4t: 8 Bit\nRGB-Farbraum: sRGB\nsRGB Abdeckung (klassisch): 99 %\nIntegrierter USB-Hub: Ja\nUSB-Hub-Version: 3.2 Gen 1 (3.1 Gen 1)\nUSB-Upstream-Porttyp: USB Typ-B\nAnzahl der Upstream-Ports USB Typ-B: 1\nAnzahl der nachgeschalteten Steckpl\u00e4tze vom Typ USB-A: 3\nAnzahl der nachgeschalteten Ports vom Typ USB-C: 1\nUSB-Stromversorgung bis zu: 27 W\nHDMI: Ja\nAnzahl HDMI-Anschl\u00fcsse: 2\nHDMI-Version: 2.0\nAnzahl DisplayPort Anschl\u00fcsse: 1\nDisplayPorts-Version: 1.4\nKopfh\u00f6rerausgang: Ja\nKopfh\u00f6rerausg\u00e4nge: 1\nKopfh\u00f6rer-Konnektivit\u00e4t: 3,5 mm\nVESA-Halterung: Ja\nPanel-Montage-Schnittstelle: 100 x 100 mm\nKabelsperre-Slot: Ja\nSlot-Typ Kabelsperre: Kensington\nH\u00f6henverstellung: Ja\nH\u00f6heneinstellung: 13 cm\nPivot: Ja\nPivot Winkel: -90 - 90 \u00b0\nSchwenkbar: Ja\nSchwenkwinkelbereich: -30 - 30 \u00b0\nkippbar: Ja\nNeigungswinkelbereich: -5 - 22 \u00b0\nEingebaute Lautsprecher: Ja\nIntegrierte Kamera: Nein\nAnzahl der Lautsprecher: 2\nRMS-Leistung: 6 W\nEingebautes Mikrofon: Nein\nMarktpositionierung: Gaming\nProduktfarbe: Schwarz\nName der Farbe: Raven Black\nVorderer Rahmen: Schwarz\nZertifizierung: CCC, Tier 2, T\u00dcV Rheinland Low Blue Light, T\u00dcV Rheinland Flicker Free\nSt\u00e4nder enthalten: Ja\nMitgelieferte Kabel: AC, DisplayPort, USB Type-A to USB Type-B\nDisplayPort Kabell\u00e4nge: 1,8 m\nSchnellstart\u00fcbersicht: Ja\nStromadapter enthalten: Ja\nVerpackungsbreite: 720 mm\nVerpackungstiefe: 160 mm\nVerpackungsh\u00f6he: 421 mm\nPaketgewicht: 8,8 kg\nVerpackungsart: Box\nEnergieeffizienzklasse (SDR): F\nEnergieeffizienzklasse (HDR): F\nEnergieverbrauch (SDR) pro 1.000 Stunden: 23 kWh\nEnergieverbrauch (HDR) pro 1.000 Stunden: 35 kWh\nStromverbrauch (Standardbetrieb): 30 W\nStromverbrauch (max.): 115 W\nStromverbrauch (aus): 0,3 W\nAC Eingangsspannung: 100 - 240 V\nAC Eingangsfrequenz: 50/60 Hz\nNetzteiltyp: Extern\nEnergieeffizienzskala: A bis G\nGer\u00e4tebreite (inkl. Fu\u00df): 557,3 mm\nGer\u00e4tetiefe (inkl. Fu\u00df): 230,6 mm\nGer\u00e4teh\u00f6he (inkl. Fu\u00df): 509,8 mm\nGewicht (mit St\u00e4nder): 6,1 kg\nBreite (ohne Standfu\u00df): 55,7 cm\nTiefe (ohne Standfu\u00df): 5,7 cm\nH\u00f6he (ohne Standfu\u00df): 33,3 cm\nGewicht (ohne St\u00e4nder): 4,1 kg\nBezel Weite (side): 2 mm\nBezel Weite (top): 2 mm\nBezel Weite (bottom): 2,25 cm\nNachhaltigkeitszertifikate: RoHS\nIntergrierter Kopfh\u00f6rer-Haken: Ja",
    "reference_file": "offer_reference_1159.json",
    "shop_name": "TechnikLaden"
}