{
    "html_file": "offer_1025_8.html",
    "name": "Philips 5000 27E1N5600HE, 27\"",
    "offer_link": "https://www.playox.de/productredirect/index/sku/23709419?sPartner=p-geizhals-at&campaign=psm/geizhals-at/",
    "price": 285.46,
    "raw_specifications": {
        "Anschl\u00fcsse": "USB, DisplayPort, HDMI, Audioausgang (Line-Out)",
        "Artikelnummer": "23709419",
        "Bezeichnung des Herstellers": "Philips 27E1N5600HE/00",
        "Bildwiederholungsrate": "75,00 Hz",
        "Breite": "614,00 mm",
        "Display Sync": "Adaptive Sync",
        "Displaygr\u00f6\u00dfe": "68,58 cm (27 Zoll)",
        "EEK - Spektrum": "AG",
        "Energieeffizienzklasse": "F",
        "Geh\u00e4usefarbe des Ger\u00e4tes": "Schwarz",
        "Gewicht": "6,57 kg",
        "Gewicht inkl. Verpackung in Kg": "6,57 kg",
        "Helligkeit Bereich": "150 - 300 cd/m\u00b2",
        "Hersteller": "Philips",
        "H\u00f6he": "524,00 mm",
        "Inhalt (ml oder g)": "0,00 ml",
        "Kapazit\u00e4t (Seiten)": "0",
        "Kontrastverh\u00e4ltnis (typisch) Bereich": "800:1 bis 1.200:1",
        "LCD-Technologie": "IPS Panel",
        "L\u00e4nge": "212,00 mm",
        "Produktart": "Monitore",
        "Reaktionszeit": "1,00 ms",
        "Seitenverh\u00e4ltnis": "16:9",
        "Shop Herstellernummer": "27E1N5600HE/00",
        "Standard-EAN": "8712581783426",
        "Verpackung - Breite in cm": "61,40 cm",
        "Verpackung - H\u00f6he in cm": "52,40 cm",
        "Verpackung - L\u00e4nge in cm": "21,20 cm",
        "max. Aufl\u00f6sung": "2.560 x 1.440 Pixel (16:9)"
    },
    "raw_specifications_text": "Displaygr\u00f6\u00dfe: 68,58 cm (27 Zoll)\nGeh\u00e4usefarbe des Ger\u00e4tes: Schwarz\nAnschl\u00fcsse: USB, DisplayPort, HDMI, Audioausgang (Line-Out)\nProduktart: Monitore\nHelligkeit Bereich: 150 - 300 cd/m\u00b2\nKontrastverh\u00e4ltnis (typisch) Bereich: 800:1 bis 1.200:1\nHersteller: Philips\nGewicht: 6,57 kg\nDisplay Sync: Adaptive Sync\nInhalt (ml oder g): 0,00 ml\nKapazit\u00e4t (Seiten): 0\nEEK - Spektrum: AG\nL\u00e4nge: 212,00 mm\nBreite: 614,00 mm\nVerpackung - Breite in cm: 61,40 cm\nVerpackung - L\u00e4nge in cm: 21,20 cm\nVerpackung - H\u00f6he in cm: 52,40 cm\nGewicht inkl. Verpackung in Kg: 6,57 kg\nH\u00f6he: 524,00 mm\nArtikelnummer: 23709419\nStandard-EAN: 8712581783426\nShop Herstellernummer: 27E1N5600HE/00\nBezeichnung des Herstellers: Philips 27E1N5600HE/00\nmax. Aufl\u00f6sung: 2.560 x 1.440 Pixel (16:9)\nSeitenverh\u00e4ltnis: 16:9\nLCD-Technologie: IPS Panel\nReaktionszeit: 1,00 ms\nBildwiederholungsrate: 75,00 Hz\nEnergieeffizienzklasse: F",
    "reference_file": "offer_reference_1025.json",
    "shop_name": "playox (AT)"
}