{
    "html_file": "offer_2121_5.html",
    "name": "ASUS TUF Gaming VG27AQ, 27\"",
    "offer_link": "https://www.proshop.at/Bildschirm/ASUS-27-Bildschirm-TUF-Gaming-VG27AQ-165Hz-Black-1-ms-NVIDIA-G-SYNC/2798291?utm_source=geizhals&utm_medium=cpc&utm_campaign=pricesite",
    "price": 303.54,
    "raw_specifications": {
        "Abmessungen (Breite x Tiefe x H\u00f6he)": "62 cm x 21.1 cm x 50.7 cm - mit Fu\u00df",
        "Abmessungen (Breite x Tiefe x H\u00f6he) - mit Fu\u00df": "62 cm x 21.1 cm x 50.7 cm",
        "Adaptive-Sync Technologie": "NVIDIA G-SYNC, VESA Adaptive-Sync",
        "Ausgangsleistung/Kanal": "2 Watt",
        "Besonderheiten": "HDCP, Trace Free Technology, ASUS GamePlus, flimmerfreie Technologie, ASUS GameVisual Technology, Farbtemperatur Auswahl, GameFast Input Technology, ASUS Extreme Low Motion Blur technology, Ultra-Low Blue Light Technology, ASUS Extreme Low Motion Blur Sync, 99 % sRGB Farbraum",
        "Bildschirmbeschichtung": "Blendfrei",
        "Bildschirmtyp": "IPS",
        "Details zu Abmessungen & Gewicht": "Ohne Fu\u00df - Breite: 61 cm - Tiefe: 6.6 cm - H\u00f6he: 36.3 cm - Gewicht: 3.5 kg  Mit Fu\u00df - Breite: 62 cm - Tiefe: 21.1 cm - H\u00f6he: 50.7 cm",
        "Diagonalabmessung": "68.47 cm (27\")",
        "Display-Typ": "LED-hintergrundbeleuchteter LCD-Monitor / TFT-Aktivmatrix",
        "EAN": "4718017296762",
        "Eingangsanschl\u00fcsse": "2xHDMI, DisplayPort",
        "Einstellungen der Anzeigeposition": "H\u00f6he, Pivot (Rotation), Drehung, Neigung",
        "Energie Effizienzklasse": "Klasse G",
        "Energieklasse (HDR)": "Klasse G",
        "Energieverbrauch pro Jahr": "32 kWh",
        "Farbe": "Schwarz",
        "Farbraum": "99% sRGB",
        "Farbunterst\u00fctzung": "16,7 Millionen Farben",
        "Gaming": "Ja",
        "Ger\u00e4tetyp": "LED-hintergrundbeleuchteter LCD-Monitor - 68.47 cm (27\")",
        "Gewicht": "5.8 kg",
        "HDR-Format": "HDR10",
        "HDR-f\u00e4hig": "HDR10",
        "Helligkeit": "350 cd/m\u00b2",
        "Hersteller": "ASUS",
        "Hintergrundbeleuchtungs-Technologie": "LED-Hintergrundbeleuchtung",
        "Horizontale Bildwiederholrate": "30 - 243 kHz",
        "Horizontaler Betrachtungswinkel": "178",
        "H\u00f6heneinstellung": "130 mm",
        "Kennzeichnung": "UL, VCCI, BSMI, cUL, WHQL, CB, CCC, FCC, RoHS, KCC, WEEE, MEPS, J-MOSS, ErP Ready, E-Standby, RCM, TUV Rheinland Low Blue Light Certification, CU, TUV Rheinland Flicker Free Certification",
        "Kontrast": "1000:1 / 100000000:1 (dynamisch)",
        "Leistungsaufnahme im Ein-Zustand": "32.1 W",
        "Leistungsmerkmale": "Slot f\u00fcr Sicherheitsschloss (Kabelschloss getrennt erh\u00e4ltlich)",
        "Modell": "90LM0500-B01370",
        "Native Aufl\u00f6sung": "WQHD 2560 x 1440 bei 165 Hz",
        "Neigungswinkel": "-5/+33",
        "Pixelpitch": "0.233 mm",
        "Produktbeschreibung": "ASUS TUF Gaming VG27AQ - LED-Monitor - 68.47 cm (27\") - HDR",
        "Reaktionszeit": "1 ms (MPRT)",
        "Rotationswinkel": "90",
        "Schlosstyp zur Diebstahlsicherung": "Kensington Slot",
        "Schnittstellen": "2 x HDMI  DisplayPort  Kopfh\u00f6rer",
        "Schwenkwinkel": "180",
        "Seitenverh\u00e4ltnis": "16:9",
        "Stromverbrauch (Aus-Modus)": "0.5 Watt",
        "Stromverbrauch (typisch)": "65 Watt",
        "Stromverbrauch HDR (eingeschaltet)": "40.2 kWh/1.000 h",
        "Stromverbrauch SDR (eingeschaltet)": "32.1 kWh/1.000 h",
        "Transportbreite": "70.4 cm",
        "Transportgewicht": "8 kg",
        "Transporth\u00f6he": "46.4 cm",
        "Transporttiefe": "21 cm",
        "Typ": "Lautsprecher - Stereo",
        "VESA-Halterung": "100 x 100 mm",
        "Vertikale Bildwiederholrate": "48 - 165 Hz",
        "Vertikaler Betrachtungswinkel": "178",
        "Waren-Nr.": "2798291",
        "Zum Hersteller": "www.asus.com/index.aspx"
    },
    "raw_specifications_text": "Hersteller: ASUS\nWaren-Nr.: 2798291\nModell: 90LM0500-B01370\nEAN: 4718017296762\nZum Hersteller: www.asus.com/index.aspx\nProduktbeschreibung: ASUS TUF Gaming VG27AQ - LED-Monitor - 68.47 cm (27\") - HDR\nGer\u00e4tetyp: LED-hintergrundbeleuchteter LCD-Monitor - 68.47 cm (27\")\nEnergie Effizienzklasse: Klasse G\nEnergieverbrauch pro Jahr: 32 kWh\nLeistungsaufnahme im Ein-Zustand: 32.1 W\nAdaptive-Sync Technologie: NVIDIA G-SYNC, VESA Adaptive-Sync\nBildschirmtyp: IPS\nSeitenverh\u00e4ltnis: 16:9\nNative Aufl\u00f6sung: WQHD 2560 x 1440 bei 165 Hz\nPixelpitch: 0.233 mm\nHelligkeit: 350 cd/m\u00b2\nKontrast: 1000:1 / 100000000:1 (dynamisch)\nHDR-f\u00e4hig: HDR10\nReaktionszeit: 1 ms (MPRT)\nGaming: Ja\nFarbunterst\u00fctzung: 16,7 Millionen Farben\nFarbraum: 99% sRGB\nEingangsanschl\u00fcsse: 2xHDMI, DisplayPort\nEinstellungen der Anzeigeposition: H\u00f6he, Pivot (Rotation), Drehung, Neigung\nBildschirmbeschichtung: Blendfrei\nFarbe: Schwarz\nAbmessungen (Breite x Tiefe x H\u00f6he) - mit Fu\u00df: 62 cm x 21.1 cm x 50.7 cm\nGewicht: 5.8 kg\nKennzeichnung: UL, VCCI, BSMI, cUL, WHQL, CB, CCC, FCC, RoHS, KCC, WEEE, MEPS, J-MOSS, ErP Ready, E-Standby, RCM, TUV Rheinland Low Blue Light Certification, CU, TUV Rheinland Flicker Free Certification\nDisplay-Typ: LED-hintergrundbeleuchteter LCD-Monitor / TFT-Aktivmatrix\nEnergieklasse (HDR): Klasse G\nDiagonalabmessung: 68.47 cm (27\")\nHDR-Format: HDR10\nVertikale Bildwiederholrate: 48 - 165 Hz\nHorizontale Bildwiederholrate: 30 - 243 kHz\nHorizontaler Betrachtungswinkel: 178\nVertikaler Betrachtungswinkel: 178\nHintergrundbeleuchtungs-Technologie: LED-Hintergrundbeleuchtung\nBesonderheiten: HDCP, Trace Free Technology, ASUS GamePlus, flimmerfreie Technologie, ASUS GameVisual Technology, Farbtemperatur Auswahl, GameFast Input Technology, ASUS Extreme Low Motion Blur technology, Ultra-Low Blue Light Technology, ASUS Extreme Low Motion Blur Sync, 99 % sRGB Farbraum\nAbmessungen (Breite x Tiefe x H\u00f6he): 62 cm x 21.1 cm x 50.7 cm - mit Fu\u00df\nTyp: Lautsprecher - Stereo\nAusgangsleistung/Kanal: 2 Watt\nSchnittstellen: 2 x HDMI  DisplayPort  Kopfh\u00f6rer\nNeigungswinkel: -5/+33\nSchwenkwinkel: 180\nRotationswinkel: 90\nH\u00f6heneinstellung: 130 mm\nVESA-Halterung: 100 x 100 mm\nLeistungsmerkmale: Slot f\u00fcr Sicherheitsschloss (Kabelschloss getrennt erh\u00e4ltlich)\nSchlosstyp zur Diebstahlsicherung: Kensington Slot\nStromverbrauch SDR (eingeschaltet): 32.1 kWh/1.000 h\nStromverbrauch HDR (eingeschaltet): 40.2 kWh/1.000 h\nStromverbrauch (typisch): 65 Watt\nStromverbrauch (Aus-Modus): 0.5 Watt\nDetails zu Abmessungen & Gewicht: Ohne Fu\u00df - Breite: 61 cm - Tiefe: 6.6 cm - H\u00f6he: 36.3 cm - Gewicht: 3.5 kg  Mit Fu\u00df - Breite: 62 cm - Tiefe: 21.1 cm - H\u00f6he: 50.7 cm\nTransportbreite: 70.4 cm\nTransporttiefe: 21 cm\nTransporth\u00f6he: 46.4 cm\nTransportgewicht: 8 kg",
    "reference_file": "offer_reference_2121.json",
    "shop_name": "Proshop.at"
}