{
    "html_file": "offer_407_26.html",
    "name": "Samsung ViewFinity S8 S27A800UNP (2023), 26.9\"",
    "offer_link": "https://www.alternate.at/SAMSUNG/ViewFinity-S8-S27A800UNP-LED-Monitor/html/product/1897960?partner=AtGeizhalsat&campaign=Monitor/SAMSUNG/1897960",
    "price": 454.0,
    "raw_specifications": {
        "": "H\u00f6henverstellbar",
        "Abmessungen": "Breite: 61,55 cm x H\u00f6he: 55,19 cm x Tiefe/L\u00e4nge: 19,64 cm",
        "Anschl\u00fcsse": "1x HDMI-Eingang, (HDMI-Version: 2.0), 1x DisplayPort-Eingang, (DisplayPort-Version: 1.2), 1x Kopfh\u00f6rer-Ausgang, 3x USB-A-3.2 Gen 1 (5 Gbit/s), 1x USB-C",
        "Bild": "Format",
        "Bildschirmaufl\u00f6sung": "3.840 x 2.160 Pixel",
        "Bildschirmdiagonale": "68 cm (27 Zoll)",
        "EAN": "8806094771794",
        "Energieeffizienzklasse (HDR)": "G (A - G)",
        "Energieeffizienzklasse (SDR)": "F (A - G)",
        "Energieverbauch pro 1000 Stunden (HDR)": "37 kWh",
        "Energieverbauch pro 1000 Stunden (SDR)": "26 kWh",
        "Ergonomie": "Typ",
        "Features": "Eco Saving Plus, Eye Saver Mode, Flicker Free, Picture-In-Picture, Picture-By-Picture, Spiel-Modus, Image Size, Off Timer Plus, Auto Source Switch",
        "Gewicht": "6,8 kg",
        "Hersteller-Nr.": "LS27A800UNPXEN",
        "Lautsprecher": "2 Lautsprecher",
        "Leistungsaufnahme im Bereitschafts- und Aus-Zustand": "0,5 Watt",
        "Leistungsaufnahme im Ein-Zustand bei Standard-Dynamikumfang (SDR)": "26 Watt",
        "Leistungsaufnahme im Ein-Zustand bei hohem Dynamikumfang (HDR)": "37 Watt",
        "Stromversorgung": "Eco-Off",
        "Typ": "LED-Monitor",
        "Weitere Informationen": "Der USB-C Port unterst\u00fctzt DisplayPort und 90 Watt Power Delivery",
        "Zubeh\u00f6r": "Vorhanden"
    },
    "raw_specifications_text": "Energieeffizienzklasse (SDR): F (A - G)\nEnergieverbauch pro 1000 Stunden (SDR): 26 kWh\nEnergieeffizienzklasse (HDR): G (A - G)\nEnergieverbauch pro 1000 Stunden (HDR): 37 kWh\nLeistungsaufnahme im Ein-Zustand bei Standard-Dynamikumfang (SDR): 26 Watt\nLeistungsaufnahme im Ein-Zustand bei hohem Dynamikumfang (HDR): 37 Watt\nLeistungsaufnahme im Bereitschafts- und Aus-Zustand: 0,5 Watt\nBildschirmdiagonale: 68 cm (27 Zoll)\nBildschirmaufl\u00f6sung: 3.840 x 2.160 Pixel\nTyp: LED-Monitor\nEAN: 8806094771794\nHersteller-Nr.: LS27A800UNPXEN\nBild: Format\n: H\u00f6henverstellbar\nAnschl\u00fcsse: 1x HDMI-Eingang, (HDMI-Version: 2.0), 1x DisplayPort-Eingang, (DisplayPort-Version: 1.2), 1x Kopfh\u00f6rer-Ausgang, 3x USB-A-3.2 Gen 1 (5 Gbit/s), 1x USB-C\nErgonomie: Typ\nStromversorgung: Eco-Off\nLautsprecher: 2 Lautsprecher\nFeatures: Eco Saving Plus, Eye Saver Mode, Flicker Free, Picture-In-Picture, Picture-By-Picture, Spiel-Modus, Image Size, Off Timer Plus, Auto Source Switch\nWeitere Informationen: Der USB-C Port unterst\u00fctzt DisplayPort und 90 Watt Power Delivery\nZubeh\u00f6r: Vorhanden\nAbmessungen: Breite: 61,55 cm x H\u00f6he: 55,19 cm x Tiefe/L\u00e4nge: 19,64 cm\nGewicht: 6,8 kg",
    "reference_file": "offer_reference_407.json",
    "shop_name": "Alternate.at"
}