{
    "html_file": "offer_969_0.html",
    "name": "Philips Evnia 3000 27M1N3200ZA, 27\"",
    "offer_link": "https://www.amazon.de/dp/B09PZ15H8R?linkCode=xm2&camp=2025&creative=165953&smid=A3JWKAKR8XB7XF&creativeASIN=B09PZ15H8R&tag=geizhals1-21",
    "price": 171.42,
    "raw_specifications": {
        "ASIN": "B09PZ15H8R",
        "Amazon Bestseller-Rang": "Nr. 27,981 in Computer & Zubeh\u00f6r (Siehe Top 100 in Computer & Zubeh\u00f6r)  Nr. 607 in Monitore",
        "Anzahl HDMI Schnittstellen": "\u200e2",
        "Artikelgewicht": "\u200e2 Kilograms",
        "Batterien enthalten": "\u200eNein",
        "Bildschirmaufl\u00f6sung": "\u200e1920x1080",
        "Display-Gr\u00f6\u00dfe": "\u200e68,6 Zentimeter",
        "Durchschnittliche Kundenbewertung": "4,4  4,4 von 5 Sternen    \n    268 Sternebewertungen   \n\n\n 4,4 von 5 Sternen",
        "Farbe": "\u200eschwarz",
        "Garantierte Software-Updates bis": "\u200eunbekannt",
        "Gewicht Lithium-Akku": "\u200e22 Kilogramm",
        "Hersteller": "\u200ePhilips",
        "Im Angebot von Amazon.de seit": "7. Januar 2022",
        "L\u00f6sung": "\u200e1920 x 1080 Pixels",
        "Marke": "\u200ePhilips Monitors",
        "Modellnummer": "\u200e27M1N3200ZA/01",
        "Produktabmessungen": "\u200e8,94 x 24,09 x 17,83 cm; 2 Kilogramm",
        "Prozessortyp": "\u200eOthers"
    },
    "raw_specifications_text": "Marke: \u200ePhilips Monitors\nHersteller: \u200ePhilips\nProduktabmessungen: \u200e8,94 x 24,09 x 17,83 cm; 2 Kilogramm\nModellnummer: \u200e27M1N3200ZA/01\nFarbe: \u200eschwarz\nDisplay-Gr\u00f6\u00dfe: \u200e68,6 Zentimeter\nBildschirmaufl\u00f6sung: \u200e1920x1080\nL\u00f6sung: \u200e1920 x 1080 Pixels\nProzessortyp: \u200eOthers\nAnzahl HDMI Schnittstellen: \u200e2\nBatterien enthalten: \u200eNein\nGewicht Lithium-Akku: \u200e22 Kilogramm\nArtikelgewicht: \u200e2 Kilograms\nGarantierte Software-Updates bis: \u200eunbekannt\nASIN: B09PZ15H8R\nDurchschnittliche Kundenbewertung: 4,4  4,4 von 5 Sternen    \n    268 Sternebewertungen   \n\n\n 4,4 von 5 Sternen\nAmazon Bestseller-Rang: Nr. 27,981 in Computer & Zubeh\u00f6r (Siehe Top 100 in Computer & Zubeh\u00f6r)  Nr. 607 in Monitore\nIm Angebot von Amazon.de seit: 7. Januar 2022",
    "reference_file": "offer_reference_969.json",
    "shop_name": "Amazon.at"
}