{
    "html_file": "offer_2440_21.html",
    "name": "Dell E2016HV, 19.5\"",
    "offer_link": "https://www.alternate.at/Dell/E2016HV-LED-Monitor/html/product/1384366?partner=AtGeizhalsat&campaign=Monitor/Dell/1384366",
    "price": 103.9,
    "raw_specifications": {
        "": "Netzteil",
        "Abmessungen": "Breite: 47,2 cm x H\u00f6he: 36,9 cm x Tiefe/L\u00e4nge: 16,7 cm",
        "Anschl\u00fcsse": "1x VGA-Eingang",
        "Bild": "Glaretyp",
        "Bildschirmaufl\u00f6sung": "1.600 x 900 Pixel",
        "Bildschirmdiagonale": "49,5 cm (19,5 Zoll)",
        "EAN": "5397063744459",
        "Energieeffizienzklasse (SDR)": "D (A - G)",
        "Energieverbauch pro 1000 Stunden (SDR)": "11 kWh",
        "Ergonomie": "Typ",
        "Farbe": "schwarz",
        "Features": "Kensington-Schloss",
        "Frequenz": "Vertikal",
        "Geeignet f\u00fcr": "Business, Multimedia",
        "Gewicht": "3 kg",
        "Hersteller-Nr.": "E2016HV",
        "Leistungsaufnahme im Bereitschafts- und Aus-Zustand": "0,3 Watt",
        "Leistungsaufnahme im Ein-Zustand bei Standard-Dynamikumfang (SDR)": "10,6 Watt",
        "Stromversorgung": "Eco-Off",
        "Typ": "LED-Monitor",
        "Wandhalterung": "VESA kompatibel (100 x 100 mm)",
        "Zubeh\u00f6r": "Vorhanden"
    },
    "raw_specifications_text": "Energieeffizienzklasse (SDR): D (A - G)\nEnergieverbauch pro 1000 Stunden (SDR): 11 kWh\nLeistungsaufnahme im Ein-Zustand bei Standard-Dynamikumfang (SDR): 10,6 Watt\nLeistungsaufnahme im Bereitschafts- und Aus-Zustand: 0,3 Watt\nBildschirmdiagonale: 49,5 cm (19,5 Zoll)\nBildschirmaufl\u00f6sung: 1.600 x 900 Pixel\nTyp: LED-Monitor\nFarbe: schwarz\nEAN: 5397063744459\nHersteller-Nr.: E2016HV\nGeeignet f\u00fcr: Business, Multimedia\nBild: Glaretyp\n: Netzteil\nFrequenz: Vertikal\nAnschl\u00fcsse: 1x VGA-Eingang\nErgonomie: Typ\nStromversorgung: Eco-Off\nWandhalterung: VESA kompatibel (100 x 100 mm)\nFeatures: Kensington-Schloss\nZubeh\u00f6r: Vorhanden\nAbmessungen: Breite: 47,2 cm x H\u00f6he: 36,9 cm x Tiefe/L\u00e4nge: 16,7 cm\nGewicht: 3 kg",
    "reference_file": "offer_reference_2440.json",
    "shop_name": "Alternate.at"
}