{
    "html_file": "offer_2294_45.html",
    "name": "AOC 24B1H, 23.6\"",
    "offer_link": "https://www.taufnaus.de/product/10619749",
    "price": 118.34,
    "raw_specifications": {
        "Abmessungen (Breite x Tiefe x H\u00f6he)": "54.01 cm x 18.68 cm x 41.74 cm - mit Fu\u00df",
        "Besonderheiten": "HDCP",
        "Bildschirmtyp": "VA",
        "Details zu Abmessungen & Gewicht": "Ohne Fu\u00df - Breite: 54.01 cm - Tiefe: 3.4 cm - H\u00f6he: 31.81 cm - Gewicht: 2.3 kg",
        "Diagonalabmessung": "59.9 cm (23.6\")",
        "Display-Typ": "LED-hintergrundbeleuchteter LCD-Monitor / TFT-Aktivmatrix",
        "ENERGY STAR zertifiziert": "Ja",
        "Einstellungen der Anzeigeposition": "Neigung",
        "Energie Effizienzklasse": "Klasse E",
        "Enthaltene Kabel": "1 x HDMI-Kabel - 1.5 m",
        "Erforderliches Betriebssystem": "Windows 10",
        "Farbe": "Schwarz",
        "Farbunterst\u00fctzung": "16,7 Millionen Farben",
        "Gewicht": "2.6 kg",
        "Helligkeit": "250 cd/m\u00b2",
        "Hintergrundbeleuchtungs-Technologie": "LED-Hintergrundbeleuchtung",
        "Horizontale Bildwiederholrate": "30 - 83 kHz",
        "Horizontaler Betrachtungswinkel": "178",
        "Kennzeichnung": "CCC, CECP, CEL, DDC-2B/CI, China RoHS",
        "Kontrast": "3000:1 / 20000000:1 (dynamisch)",
        "Leistungsaufnahme im Ein-Zustand": "18.3 W",
        "Max. Betriebstemperatur": "40 \u00b0C",
        "Min Betriebstemperatur": "0 \u00b0C",
        "Native Aufl\u00f6sung": "Full HD (1080p) 1920 x 1080 bei 60 Hz",
        "Neigungswinkel": "-5/+23",
        "OSD-Sprachen": "Tschechisch, Chinesisch (tradionell), Chinesisch (vereinfacht), Englisch, Deutsch, Franz\u00f6sisch, Italienisch, Portugiesisch, Polnisch, Finnisch, Schwedisch, Russisch, Spanisch, Holl\u00e4ndisch, Japanisch, Koreanisch",
        "Pixelpitch": "0.2715 mm",
        "Reaktionszeit": "5 ms (Gray-to-Gray)",
        "Schnittstellen": "VGA \u00a6 HDMI \u00a6 Kopfh\u00f6rer",
        "Seitenverh\u00e4ltnis": "16:9",
        "Service und Support": "Begrenzte Garantie - Arbeitszeit und Ersatzteile - 3 Jahre",
        "Stromverbrauch (Aus-Modus)": "0.3 Watt",
        "Stromverbrauch (typisch)": "22 Watt",
        "Stromverbrauch SDR (eingeschaltet)": "18.3 kWh/1.000 h",
        "Stromverbrauch im Standby-Modus": "0.3 Watt",
        "Transportbreite": "61.4 cm",
        "Transportgewicht": "4.2 kg",
        "Transporth\u00f6he": "49.2 cm",
        "Transporttiefe": "13.1 cm",
        "Vertikale Bildwiederholrate": "50 - 76 Hz",
        "Vertikaler Betrachtungswinkel": "178",
        "Zubeh\u00f6r im Lieferumfang": "Aufstellung",
        "Zul\u00e4ssige Luftfeuchtigkeit im Betrieb": "10 \u2013 85% (nicht kondensierend)"
    },
    "raw_specifications_text": "Display-Typ: LED-hintergrundbeleuchteter LCD-Monitor / TFT-Aktivmatrix\nEnergie Effizienzklasse: Klasse E\nDiagonalabmessung: 59.9 cm (23.6\")\nBildschirmtyp: VA\nSeitenverh\u00e4ltnis: 16:9\nNative Aufl\u00f6sung: Full HD (1080p) 1920 x 1080 bei 60 Hz\nPixelpitch: 0.2715 mm\nHelligkeit: 250 cd/m\u00b2\nKontrast: 3000:1 / 20000000:1 (dynamisch)\nFarbunterst\u00fctzung: 16,7 Millionen Farben\nReaktionszeit: 5 ms (Gray-to-Gray)\nVertikale Bildwiederholrate: 50 - 76 Hz\nHorizontale Bildwiederholrate: 30 - 83 kHz\nHorizontaler Betrachtungswinkel: 178\nVertikaler Betrachtungswinkel: 178\nHintergrundbeleuchtungs-Technologie: LED-Hintergrundbeleuchtung\nOSD-Sprachen: Tschechisch, Chinesisch (tradionell), Chinesisch (vereinfacht), Englisch, Deutsch, Franz\u00f6sisch, Italienisch, Portugiesisch, Polnisch, Finnisch, Schwedisch, Russisch, Spanisch, Holl\u00e4ndisch, Japanisch, Koreanisch\nBesonderheiten: HDCP\nFarbe: Schwarz\nAbmessungen (Breite x Tiefe x H\u00f6he): 54.01 cm x 18.68 cm x 41.74 cm - mit Fu\u00df\nGewicht: 2.6 kg\nSchnittstellen: VGA \u00a6 HDMI \u00a6 Kopfh\u00f6rer\nEinstellungen der Anzeigeposition: Neigung\nNeigungswinkel: -5/+23\nZubeh\u00f6r im Lieferumfang: Aufstellung\nEnthaltene Kabel: 1 x HDMI-Kabel - 1.5 m\nKennzeichnung: CCC, CECP, CEL, DDC-2B/CI, China RoHS\nLeistungsaufnahme im Ein-Zustand: 18.3 W\nStromverbrauch SDR (eingeschaltet): 18.3 kWh/1.000 h\nStromverbrauch (typisch): 22 Watt\nStromverbrauch im Standby-Modus: 0.3 Watt\nStromverbrauch (Aus-Modus): 0.3 Watt\nErforderliches Betriebssystem: Windows 10\nDetails zu Abmessungen & Gewicht: Ohne Fu\u00df - Breite: 54.01 cm - Tiefe: 3.4 cm - H\u00f6he: 31.81 cm - Gewicht: 2.3 kg\nTransportbreite: 61.4 cm\nTransporttiefe: 13.1 cm\nTransporth\u00f6he: 49.2 cm\nTransportgewicht: 4.2 kg\nENERGY STAR zertifiziert: Ja\nService und Support: Begrenzte Garantie - Arbeitszeit und Ersatzteile - 3 Jahre\nMin Betriebstemperatur: 0 \u00b0C\nMax. Betriebstemperatur: 40 \u00b0C\nZul\u00e4ssige Luftfeuchtigkeit im Betrieb: 10 \u2013 85% (nicht kondensierend)",
    "reference_file": "offer_reference_2294.json",
    "shop_name": "TaufNaus"
}