{
    "html_file": "offer_1631_13.html",
    "name": "Lenovo Qreator 27, 27\"",
    "offer_link": "https://www.proshop.at/Bildschirm/Lenovo-Bildschirm-Qreator-3840x2160-IPS-96W-USB-C/2922202?utm_source=geizhals&utm_medium=cpc&utm_campaign=pricesite",
    "price": 612.01,
    "raw_specifications": {
        "Abmessungen (Breite x Tiefe x H\u00f6he)": "60.86 cm x 18.2 cm x 47.64 cm - mit Fu\u00df",
        "Abmessungen (Breite x Tiefe x H\u00f6he) - mit Fu\u00df": "60.86 cm x 18.2 cm x 47.64 cm",
        "Adaptive-Sync Technologie": "AMD FreeSync",
        "Besonderheiten": "Integrierte Kabelf\u00fchrung, Monitorkalibrierung Delta E<2, NearEdgeless-Design an allen 4 Seiten, 10-bit (8-bit + FRC) Farbtiefe, 99 % sRGB Farbraum",
        "Bildschirmbeschichtung": "Blendfrei",
        "Bildschirmtyp": "IPS",
        "Details zu Abmessungen & Gewicht": "Mit Fu\u00df - Breite: 60.86 cm - Tiefe: 18.2 cm - H\u00f6he: 47.64 cm - Gewicht: 6.2 kg  Ohne Fu\u00df - Breite: 60.86 cm - Tiefe: 4.4 cm - H\u00f6he: 35.1 cm - Gewicht: 4.81 kg",
        "Diagonalabmessung": "68.6 cm (27\")",
        "Display-Typ": "LED-hintergrundbeleuchteter LCD-Monitor / TFT-Aktivmatrix",
        "EAN": "0195235827901",
        "Eingangsanschl\u00fcsse": "2xHDMI, DisplayPort, USB-C",
        "Eingangsspannung": "Wechselstrom 120/230 V (50/60 Hz)",
        "Einstellungen der Anzeigeposition": "Neigung",
        "Energie Effizienzklasse": "Klasse G",
        "Energieklasse (HDR)": "Klasse G",
        "Energierverbrauch Sleep": "0.5 Watt",
        "Enthaltene Kabel": "1 x HDMI-Kabel - 1.8 m  1 x DisplayPort-Kabel - 1.8 m  1 x Kabel USB-C 3.2 Gen 2 - 1.5 m",
        "Farbe": "Iron Gray",
        "Farbraum": "98% DCI-P3, 99% sRGB",
        "Farbunterst\u00fctzung": "1,07 Mrd. Farben",
        "Ger\u00e4tetyp": "LED-hintergrundbeleuchteter LCD-Monitor - 68.6 cm (27\")",
        "Gewicht": "6.2 kg",
        "HDR-Zertifizierung": "DisplayHDR 400",
        "HDR-f\u00e4hig": "DisplayHDR 400",
        "Helligkeit": "400 cd/m\u00b2",
        "Hersteller": "Lenovo",
        "Hintergrundbeleuchtungs-Technologie": "WLED",
        "Horizontaler Betrachtungswinkel": "178",
        "Integrierte Peripherieger\u00e4te": "USB 3.2 Gen 1/USB-C Hub",
        "Kennzeichnung": "CCC, TUV Rheinland Eye Comfort Certification, China Energy standard Tier 1, EU RoHS 2002/95/EC",
        "Kontrast": "1300:1 / 3000000:1 (dynamisch)",
        "Leistungsaufnahme im Ein-Zustand": "31.9 W",
        "Leistungsmerkmale": "Slot f\u00fcr Sicherheitsschloss (Kabelschloss getrennt erh\u00e4ltlich)",
        "Lokalisierung": "Englisch / Europa",
        "Modell": "66B7RAC1EU",
        "Native Aufl\u00f6sung": "4K 3840 x 2160",
        "Neigungswinkel": "-5/+22",
        "Pixelpitch": "0.1554 mm",
        "Ppi": "164",
        "Produktbeschreibung": "Lenovo Qreator 27 - LED-Monitor - 4K - 68.6 cm (27\") - HDR",
        "Reaktionszeit": "4 ms (Level 4), 5 ms (Level 3), 6 ms (Level 2), 8 ms (Level 1)",
        "Schlosstyp zur Diebstahlsicherung": "Kensington Slot",
        "Schnittstellen": "USB-C 3.2 Gen 2 Upstream/DisplayPort 1.4 Alt Mode  2 x HDMI  DisplayPort 1.4  2 x USB 3.2 Gen 1 Downstream  USB-C 3.2 Gen 1 Downstream  Audio Line-In/-Out",
        "Seitenverh\u00e4ltnis": "16:9",
        "Spannung": "Wechselstrom 120/230 V (50/60 Hz)",
        "Stromverbrauch (Aus-Modus)": "0.3 Watt",
        "Stromverbrauch (typisch)": "40 Watt",
        "Stromverbrauch HDR (eingeschaltet)": "61.8 kWh/1.000 h",
        "Stromverbrauch SDR (eingeschaltet)": "31.9 kWh/1.000 h",
        "Stromverbrauch im Standby-Modus": "0.5 Watt",
        "Transportbreite": "69.5 cm",
        "Transportgewicht": "8.84 kg",
        "Transporth\u00f6he": "42.3 cm",
        "Transporttiefe": "13.9 cm",
        "Typ": "Lautsprecher",
        "USB-Spannungsversorgung": "96 Watt",
        "Vertikale Bildwiederholrate": "60 Hz",
        "Vertikaler Betrachtungswinkel": "178",
        "Waren-Nr.": "2922202",
        "Zum Hersteller": "lenovo.com"
    },
    "raw_specifications_text": "Hersteller: Lenovo\nWaren-Nr.: 2922202\nModell: 66B7RAC1EU\nEAN: 0195235827901\nZum Hersteller: lenovo.com\nProduktbeschreibung: Lenovo Qreator 27 - LED-Monitor - 4K - 68.6 cm (27\") - HDR\nGer\u00e4tetyp: LED-hintergrundbeleuchteter LCD-Monitor - 68.6 cm (27\")\nEnergie Effizienzklasse: Klasse G\nLeistungsaufnahme im Ein-Zustand: 31.9 W\nAdaptive-Sync Technologie: AMD FreeSync\nLeistungsmerkmale: Slot f\u00fcr Sicherheitsschloss (Kabelschloss getrennt erh\u00e4ltlich)\nBildschirmtyp: IPS\nSeitenverh\u00e4ltnis: 16:9\nNative Aufl\u00f6sung: 4K 3840 x 2160\nPixelpitch: 0.1554 mm\nHelligkeit: 400 cd/m\u00b2\nKontrast: 1300:1 / 3000000:1 (dynamisch)\nHDR-f\u00e4hig: DisplayHDR 400\nReaktionszeit: 4 ms (Level 4), 5 ms (Level 3), 6 ms (Level 2), 8 ms (Level 1)\nFarbunterst\u00fctzung: 1,07 Mrd. Farben\nFarbraum: 98% DCI-P3, 99% sRGB\nEingangsanschl\u00fcsse: 2xHDMI, DisplayPort, USB-C\nEinstellungen der Anzeigeposition: Neigung\nBildschirmbeschichtung: Blendfrei\nSpannung: Wechselstrom 120/230 V (50/60 Hz)\nFarbe: Iron Gray\nAbmessungen (Breite x Tiefe x H\u00f6he) - mit Fu\u00df: 60.86 cm x 18.2 cm x 47.64 cm\nGewicht: 6.2 kg\nLokalisierung: Englisch / Europa\nKennzeichnung: CCC, TUV Rheinland Eye Comfort Certification, China Energy standard Tier 1, EU RoHS 2002/95/EC\nDisplay-Typ: LED-hintergrundbeleuchteter LCD-Monitor / TFT-Aktivmatrix\nEnergieklasse (HDR): Klasse G\nDiagonalabmessung: 68.6 cm (27\")\nIntegrierte Peripherieger\u00e4te: USB 3.2 Gen 1/USB-C Hub\nUSB-Spannungsversorgung: 96 Watt\nPpi: 164\nHDR-Zertifizierung: DisplayHDR 400\nVertikale Bildwiederholrate: 60 Hz\nHorizontaler Betrachtungswinkel: 178\nVertikaler Betrachtungswinkel: 178\nHintergrundbeleuchtungs-Technologie: WLED\nBesonderheiten: Integrierte Kabelf\u00fchrung, Monitorkalibrierung Delta E<2, NearEdgeless-Design an allen 4 Seiten, 10-bit (8-bit + FRC) Farbtiefe, 99 % sRGB Farbraum\nAbmessungen (Breite x Tiefe x H\u00f6he): 60.86 cm x 18.2 cm x 47.64 cm - mit Fu\u00df\nTyp: Lautsprecher\nSchnittstellen: USB-C 3.2 Gen 2 Upstream/DisplayPort 1.4 Alt Mode  2 x HDMI  DisplayPort 1.4  2 x USB 3.2 Gen 1 Downstream  USB-C 3.2 Gen 1 Downstream  Audio Line-In/-Out\nNeigungswinkel: -5/+22\nEnthaltene Kabel: 1 x HDMI-Kabel - 1.8 m  1 x DisplayPort-Kabel - 1.8 m  1 x Kabel USB-C 3.2 Gen 2 - 1.5 m\nSchlosstyp zur Diebstahlsicherung: Kensington Slot\nEingangsspannung: Wechselstrom 120/230 V (50/60 Hz)\nStromverbrauch SDR (eingeschaltet): 31.9 kWh/1.000 h\nStromverbrauch HDR (eingeschaltet): 61.8 kWh/1.000 h\nStromverbrauch (typisch): 40 Watt\nStromverbrauch im Standby-Modus: 0.5 Watt\nEnergierverbrauch Sleep: 0.5 Watt\nStromverbrauch (Aus-Modus): 0.3 Watt\nDetails zu Abmessungen & Gewicht: Mit Fu\u00df - Breite: 60.86 cm - Tiefe: 18.2 cm - H\u00f6he: 47.64 cm - Gewicht: 6.2 kg  Ohne Fu\u00df - Breite: 60.86 cm - Tiefe: 4.4 cm - H\u00f6he: 35.1 cm - Gewicht: 4.81 kg\nTransportbreite: 69.5 cm\nTransporttiefe: 13.9 cm\nTransporth\u00f6he: 42.3 cm\nTransportgewicht: 8.84 kg",
    "reference_file": "offer_reference_1631.json",
    "shop_name": "Proshop.at"
}