{
    "html_file": "offer_1560_20.html",
    "name": "AOC Q32V4, 31.5\"",
    "offer_link": "https://www.proshop.at/Bildschirm/AOC-32-Bildschirm-Q32V4-2560x1440-75Hz-IPS-Black-4-ms/3022664?utm_source=geizhals&utm_medium=cpc&utm_campaign=pricesite",
    "price": 213.42,
    "raw_specifications": {
        "Ausgangsleistung/Kanal": "2 Watt",
        "Besonderheiten": "Low Blue Light Mode, flimmerfreie Technologie, Adaptive-Sync-Technologie",
        "Bildschirmbeschichtung": "Blendfrei, 3H Hard Coating",
        "Bildschirmtyp": "IPS",
        "Diagonalabmessung": "81.3 cm (32\")",
        "Display-Typ": "LED-hintergrundbeleuchteter LCD-Monitor / TFT-Aktivmatrix",
        "EAN": "4038986119900",
        "Eingangsanschl\u00fcsse": "HDMI, DisplayPort",
        "Eingangsspannung": "Wechselstrom 120/230 V (50/60 Hz)",
        "Einstellungen der Anzeigeposition": "Neigung",
        "Energie Effizienzklasse": "Klasse G",
        "Energieklasse (HDR)": "Klasse G",
        "Enthaltene Kabel": "1 x HDMI-Kabel - 1.5 m",
        "Farbe": "Schwarz",
        "Farbunterst\u00fctzung": "16,7 Millionen Farben",
        "Ger\u00e4tetyp": "LED-hintergrundbeleuchteter LCD-Monitor - 81.3 cm (32\")",
        "Helligkeit": "250 cd/m\u00b2",
        "Hersteller": "AOC",
        "Hintergrundbeleuchtungs-Technologie": "WLED",
        "Horizontaler Betrachtungswinkel": "178",
        "Kontrast": "1200:1 / 20000000:1 (dynamisch)",
        "Leistungsaufnahme im Ein-Zustand": "38 W",
        "Leistungsmerkmale": "Slot f\u00fcr Sicherheitsschloss (Kabelschloss getrennt erh\u00e4ltlich)",
        "Modell": "Q32V4",
        "Native Aufl\u00f6sung": "QHD 2560 x 1440 bei 75 Hz",
        "Neigungswinkel": "-3.5/+21.5",
        "OSD-Sprachen": "Tschechisch, Chinesisch (tradionell), Chinesisch (vereinfacht), Englisch, Deutsch, Franz\u00f6sisch, Italienisch, Portugiesisch, Polnisch, Finnisch, Schwedisch, Russisch, Spanisch, Holl\u00e4ndisch, Japanisch, Koreanisch",
        "Ppi": "93",
        "Produktbeschreibung": "AOC Q32V4 - LED-Monitor - QHD - 81.3 cm (32\")",
        "Reaktionszeit": "4 ms (gray-to-gray)",
        "Schlosstyp zur Diebstahlsicherung": "Kensington Slot",
        "Schnittstellen": "HDMI  DisplayPort 1.2  Kopfh\u00f6rer",
        "Seitenverh\u00e4ltnis": "16:9",
        "Sichtbare Bildfl\u00e4che": "80 cm (31.5\")",
        "Spannung": "Wechselstrom 120/230 V (50/60 Hz)",
        "Stromverbrauch (Aus-Modus)": "0.3 Watt",
        "Stromverbrauch HDR (eingeschaltet)": "38 kWh/1.000 h",
        "Stromverbrauch SDR (eingeschaltet)": "38 kWh/1.000 h",
        "Stromverbrauch im Standby-Modus": "0.5 Watt",
        "Typ": "Lautsprecher - Stereo",
        "VESA-Halterung": "100 x 100 mm",
        "Vertikaler Betrachtungswinkel": "178",
        "Waren-Nr.": "3022664",
        "Zum Hersteller": "www.aoc.com"
    },
    "raw_specifications_text": "Hersteller: AOC\nWaren-Nr.: 3022664\nModell: Q32V4\nEAN: 4038986119900\nZum Hersteller: www.aoc.com\nProduktbeschreibung: AOC Q32V4 - LED-Monitor - QHD - 81.3 cm (32\")\nGer\u00e4tetyp: LED-hintergrundbeleuchteter LCD-Monitor - 81.3 cm (32\")\nEnergie Effizienzklasse: Klasse G\nLeistungsaufnahme im Ein-Zustand: 38 W\nBildschirmtyp: IPS\nSeitenverh\u00e4ltnis: 16:9\nNative Aufl\u00f6sung: QHD 2560 x 1440 bei 75 Hz\nHelligkeit: 250 cd/m\u00b2\nKontrast: 1200:1 / 20000000:1 (dynamisch)\nReaktionszeit: 4 ms (gray-to-gray)\nFarbunterst\u00fctzung: 16,7 Millionen Farben\nEingangsanschl\u00fcsse: HDMI, DisplayPort\nEinstellungen der Anzeigeposition: Neigung\nBildschirmbeschichtung: Blendfrei, 3H Hard Coating\nSpannung: Wechselstrom 120/230 V (50/60 Hz)\nFarbe: Schwarz\nDisplay-Typ: LED-hintergrundbeleuchteter LCD-Monitor / TFT-Aktivmatrix\nEnergieklasse (HDR): Klasse G\nDiagonalabmessung: 81.3 cm (32\")\nSichtbare Bildfl\u00e4che: 80 cm (31.5\")\nPpi: 93\nHorizontaler Betrachtungswinkel: 178\nVertikaler Betrachtungswinkel: 178\nHintergrundbeleuchtungs-Technologie: WLED\nOSD-Sprachen: Tschechisch, Chinesisch (tradionell), Chinesisch (vereinfacht), Englisch, Deutsch, Franz\u00f6sisch, Italienisch, Portugiesisch, Polnisch, Finnisch, Schwedisch, Russisch, Spanisch, Holl\u00e4ndisch, Japanisch, Koreanisch\nBesonderheiten: Low Blue Light Mode, flimmerfreie Technologie, Adaptive-Sync-Technologie\nTyp: Lautsprecher - Stereo\nAusgangsleistung/Kanal: 2 Watt\nSchnittstellen: HDMI  DisplayPort 1.2  Kopfh\u00f6rer\nNeigungswinkel: -3.5/+21.5\nVESA-Halterung: 100 x 100 mm\nLeistungsmerkmale: Slot f\u00fcr Sicherheitsschloss (Kabelschloss getrennt erh\u00e4ltlich)\nEnthaltene Kabel: 1 x HDMI-Kabel - 1.5 m\nSchlosstyp zur Diebstahlsicherung: Kensington Slot\nEingangsspannung: Wechselstrom 120/230 V (50/60 Hz)\nStromverbrauch SDR (eingeschaltet): 38 kWh/1.000 h\nStromverbrauch HDR (eingeschaltet): 38 kWh/1.000 h\nStromverbrauch im Standby-Modus: 0.5 Watt\nStromverbrauch (Aus-Modus): 0.3 Watt",
    "reference_file": "offer_reference_1560.json",
    "shop_name": "Proshop.at"
}