{
    "html_file": "offer_57_4.html",
    "name": "Samsung Odyssey OLED G9 G93SC, 49\"",
    "offer_link": "https://www.playox.de/productredirect/index/sku/26970389?sPartner=p-geizhals-at&campaign=psm/geizhals-at/",
    "price": 1459.78,
    "raw_specifications": {
        "Anschl\u00fcsse": "DisplayPort, HDMI, Kopfh\u00f6reranschluss, Audioausgang (Line-Out)",
        "Artikelnummer": "26970389",
        "Aufl\u00f6sung Kurzname": "Full HD",
        "Bezeichnung des Herstellers": "Samsung 49\" Odyssey OLED G9 G93SC S49CG934SU",
        "Bildwiederholungsrate": "240,00",
        "Breite": "11947,00",
        "Display Features": "FlickerFree, 3D ready, Bild an Bild (PbP) Funktion, Bild in Bild (PiP) Funktion",
        "Display Sync": "AMD FreeSync, Adaptive Sync",
        "Displaygr\u00f6\u00dfe": "124,46 cm (49 Zoll)",
        "Displayoberfl\u00e4che": "matt",
        "EEK - Energieeffizienzklasse (HDR)": "G",
        "EEK - Spektrum": "AG",
        "Einsatzort": "Innen",
        "Energieeffizienzklasse": "G",
        "Geh\u00e4usefarbe des Ger\u00e4tes": "Grau",
        "Gewicht": "12,60",
        "Gewicht inkl. Verpackung in Kg": "18,10",
        "Helligkeit Bereich": "150 - 300 cd/m\u00b2",
        "Hersteller": "Samsung",
        "H\u00f6he": "5293,00",
        "Kontrastverh\u00e4ltnis (typisch) Bereich": "ab 1.200:1",
        "LCD-Technologie": "OLED",
        "L\u00e4nge": "2841,00",
        "Produktart": "Monitore",
        "Reaktionszeit": "1,00",
        "Seitenverh\u00e4ltnis": "32:9",
        "Shop Herstellernummer": "LS49CG934SUXEN",
        "Standard-EAN": "8806095053653",
        "Verpackung - Breite in cm": "135,20",
        "Verpackung - H\u00f6he in cm": "24,00",
        "Verpackung - L\u00e4nge in cm": "47,40",
        "max. Aufl\u00f6sung": "sonstige"
    },
    "raw_specifications_text": "Geh\u00e4usefarbe des Ger\u00e4tes: Grau\nHersteller: Samsung\nProduktart: Monitore\nKontrastverh\u00e4ltnis (typisch) Bereich: ab 1.200:1\nHelligkeit Bereich: 150 - 300 cd/m\u00b2\nAnschl\u00fcsse: DisplayPort, HDMI, Kopfh\u00f6reranschluss, Audioausgang (Line-Out)\nDisplay Features: FlickerFree, 3D ready, Bild an Bild (PbP) Funktion, Bild in Bild (PiP) Funktion\nDisplaygr\u00f6\u00dfe: 124,46 cm (49 Zoll)\nDisplay Sync: AMD FreeSync, Adaptive Sync\nAufl\u00f6sung Kurzname: Full HD\nEEK - Spektrum: AG\nEEK - Energieeffizienzklasse (HDR): G\nVerpackung - H\u00f6he in cm: 24,00\nArtikelnummer: 26970389\nStandard-EAN: 8806095053653\nShop Herstellernummer: LS49CG934SUXEN\nBezeichnung des Herstellers: Samsung 49\" Odyssey OLED G9 G93SC S49CG934SU\nBreite: 11947,00\nH\u00f6he: 5293,00\nL\u00e4nge: 2841,00\nGewicht: 12,60\nVerpackung - Breite in cm: 135,20\nVerpackung - L\u00e4nge in cm: 47,40\nGewicht inkl. Verpackung in Kg: 18,10\nmax. Aufl\u00f6sung: sonstige\nSeitenverh\u00e4ltnis: 32:9\nLCD-Technologie: OLED\nReaktionszeit: 1,00\nDisplayoberfl\u00e4che: matt\nBildwiederholungsrate: 240,00\nEinsatzort: Innen\nEnergieeffizienzklasse: G",
    "reference_file": "offer_reference_57.json",
    "shop_name": "playox (AT)"
}