{
    "html_file": "offer_490_9.html",
    "name": "Samsung CRG9 (2023), 49\"",
    "offer_link": "https://www.mylemon.at/artikel/samsung/lc49rg94sspxen/serie-9-124-0cm-c49rg94ssp.html",
    "price": 841.62,
    "raw_specifications": {
        "AC Eingangsspannung": "100 - 240 V",
        "AMD FreeSync": "Ja",
        "Adobe RGB-Abdeckung": "92%",
        "Anzahl der Farben des Displays": "16,7 Millionen Farben",
        "Anzahl der nachgeschalteten Steckpl\u00e4tze vom Typ USB-A": "4",
        "Artikelnummer": "M1IY79SL",
        "Aufl\u00f6sung": "5120x1440",
        "Besonderheiten": "120 Hz, Curved, USB HUB",
        "Betriebstemperatur": "10 - 40 \u00b0C",
        "Bewertung der Bildschirmkr\u00fcmmung": "1800R",
        "Bild-in-Bild": "Ja",
        "Bildschirmdiagonale": "124 cm (48.8 Zoll)",
        "Bildschirmform": "Gebogen",
        "Bildschirmtechnologie": "QLED",
        "Bildwinkel, horizontal": "178\u00b0",
        "Bildwinkel, vertikal": "178\u00b0",
        "Breite (ohne Standfu\u00df)": "120 cm",
        "Display-Aufl\u00f6sung": "5120 x 1440 Pixel",
        "DisplayPorts-Version": "1.4",
        "Displaygr\u00f6\u00dfe": "49 Zoll",
        "EAN": "8806094796391",
        "Energieeffizienzklasse (HDR)": "G",
        "Energieeffizienzskala": "A bis G",
        "Energieverbrauch (HDR) pro 1.000 Stunden": "66 kWh",
        "Ergonomie": "H\u00f6henverstellbar, Schwenkbar, Neigbar",
        "Farbskala": "0,95%",
        "Flimmerfreie Technologie": "Ja",
        "Geringe Eingabeverz\u00f6gerung": "Ja",
        "Ger\u00e4tebreite (inkl. Fu\u00df)": "1199,5 mm",
        "Ger\u00e4teh\u00f6he (inkl. Fu\u00df)": "523,1 mm",
        "Ger\u00e4tetiefe (inkl. Fu\u00df)": "349,7 mm",
        "Gewicht (mit St\u00e4nder)": "14,6 kg",
        "Gewicht (ohne St\u00e4nder)": "11,6 kg",
        "HD-Typ": "Quad HD",
        "HDMI": "Ja",
        "HDMI-Version": "2.0",
        "Helligkeit": "600 cd/m\u00b2",
        "Helligkeit (peak)": "1000 cd/m\u00b2",
        "Helligkeit (typisch)": "600 cd/m\u00b2",
        "Hersteller Artikelnummer": "LC49RG94SSPXEN",
        "High Dynamic Range Video (HDR) Unterst\u00fctzung": "Ja",
        "H\u00f6he (ohne Standfu\u00df)": "36,9 cm",
        "H\u00f6heneinstellung": "12 cm",
        "H\u00f6henverstellung": "Ja",
        "Integrierter USB-Hub": "Nein",
        "Kontrastverh\u00e4ltnis": "3000:1",
        "Kopfh\u00f6rerausgang": "Ja",
        "Markenspezifische Technologien": "Black Equalizer, Augenpflege+",
        "Marktpositionierung": "Gaming",
        "Maximale Bildwiederholrate": "120 Hz",
        "Mitgelieferte Kabel": "DisplayPort, USB",
        "NTSC Abdeckung (typisch)": "88%",
        "Natives Seitenverh\u00e4ltnis": "32:9",
        "Paketgewicht": "2,1 kg",
        "Panel": "VA",
        "Panel-Montage-Schnittstelle": "100 x 100 mm",
        "Panel-Typ": "VA",
        "Reaktionszeit": "4 ms",
        "Relative Luftfeuchtigkeit in Betrieb": "10 - 80%",
        "Schnellladung": "Ja",
        "Schwenkwinkelbereich": "-2 - 15\u00b0",
        "Sichtbare Gr\u00f6\u00dfe (diagonal)": "12,4 cm",
        "Spiel-Modus": "Ja",
        "Stromadapter enthalten": "Ja",
        "Stromkabell\u00e4nge": "1,5 m",
        "Stromverbrauch (Standardbetrieb)": "45 W",
        "Stromverbrauch (Standby)": "0,5 W",
        "Stromverbrauch (aus)": "0,3 W",
        "St\u00e4nder enthalten": "Ja",
        "Tiefe (ohne Standfu\u00df)": "19,4 cm",
        "Touchscreen": "Nein",
        "USB-Hub-Version": "2.0 / 3.2 Gen 1 (3.1 Gen 1)",
        "VESA Halterung": "100x100 mm",
        "VESA-Halterung": "Ja",
        "Verpackungsart": "Box",
        "Verpackungsbreite": "1327 mm",
        "Verpackungsh\u00f6he": "318 mm",
        "Verpackungstiefe": "497 mm",
        "Video Anschl\u00fcsse": "1x HDMI, 2x DisplayPort",
        "Wandmontage": "Ja",
        "sRGB Abdeckung (klassisch)": "125%"
    },
    "raw_specifications_text": "Displaygr\u00f6\u00dfe: 49 Zoll\nAufl\u00f6sung: 5120x1440\nPanel: VA\nReaktionszeit: 4 ms\nVideo Anschl\u00fcsse: 1x HDMI, 2x DisplayPort\nErgonomie: H\u00f6henverstellbar, Schwenkbar, Neigbar\nVESA Halterung: 100x100 mm\nHelligkeit: 600 cd/m\u00b2\nBesonderheiten: 120 Hz, Curved, USB HUB\nHersteller Artikelnummer: LC49RG94SSPXEN\nEAN: 8806094796391\nArtikelnummer: M1IY79SL\nBildschirmdiagonale: 124 cm (48.8 Zoll)\nDisplay-Aufl\u00f6sung: 5120 x 1440 Pixel\nNatives Seitenverh\u00e4ltnis: 32:9\nBildschirmtechnologie: QLED\nTouchscreen: Nein\nHD-Typ: Quad HD\nPanel-Typ: VA\nBildschirmform: Gebogen\nKontrastverh\u00e4ltnis: 3000:1\nMaximale Bildwiederholrate: 120 Hz\nAnzahl der Farben des Displays: 16,7 Millionen Farben\nHelligkeit (peak): 1000 cd/m\u00b2\nHelligkeit (typisch): 600 cd/m\u00b2\nBewertung der Bildschirmkr\u00fcmmung: 1800R\nBildwinkel, horizontal: 178\u00b0\nBildwinkel, vertikal: 178\u00b0\nSichtbare Gr\u00f6\u00dfe (diagonal): 12,4 cm\nHigh Dynamic Range Video (HDR) Unterst\u00fctzung: Ja\nFarbskala: 0,95%\nsRGB Abdeckung (klassisch): 125%\nNTSC Abdeckung (typisch): 88%\nAdobe RGB-Abdeckung: 92%\nAMD FreeSync: Ja\nMarkenspezifische Technologien: Black Equalizer, Augenpflege+\nSchnellladung: Ja\nFlimmerfreie Technologie: Ja\nGeringe Eingabeverz\u00f6gerung: Ja\nSpiel-Modus: Ja\nMarktpositionierung: Gaming\nIntegrierter USB-Hub: Nein\nHDMI: Ja\nKopfh\u00f6rerausgang: Ja\nUSB-Hub-Version: 2.0 / 3.2 Gen 1 (3.1 Gen 1)\nAnzahl der nachgeschalteten Steckpl\u00e4tze vom Typ USB-A: 4\nHDMI-Version: 2.0\nDisplayPorts-Version: 1.4\nVESA-Halterung: Ja\nH\u00f6henverstellung: Ja\nPanel-Montage-Schnittstelle: 100 x 100 mm\nWandmontage: Ja\nH\u00f6heneinstellung: 12 cm\nSchwenkwinkelbereich: -2 - 15\u00b0\nBild-in-Bild: Ja\nEnergieeffizienzklasse (HDR): G\nEnergieverbrauch (HDR) pro 1.000 Stunden: 66 kWh\nStromverbrauch (Standardbetrieb): 45 W\nStromverbrauch (Standby): 0,5 W\nStromverbrauch (aus): 0,3 W\nAC Eingangsspannung: 100 - 240 V\nEnergieeffizienzskala: A bis G\nBetriebstemperatur: 10 - 40 \u00b0C\nRelative Luftfeuchtigkeit in Betrieb: 10 - 80%\nSt\u00e4nder enthalten: Ja\nMitgelieferte Kabel: DisplayPort, USB\nStromadapter enthalten: Ja\nStromkabell\u00e4nge: 1,5 m\nGer\u00e4tebreite (inkl. Fu\u00df): 1199,5 mm\nGer\u00e4tetiefe (inkl. Fu\u00df): 349,7 mm\nGer\u00e4teh\u00f6he (inkl. Fu\u00df): 523,1 mm\nGewicht (mit St\u00e4nder): 14,6 kg\nBreite (ohne Standfu\u00df): 120 cm\nTiefe (ohne Standfu\u00df): 19,4 cm\nH\u00f6he (ohne Standfu\u00df): 36,9 cm\nGewicht (ohne St\u00e4nder): 11,6 kg\nVerpackungsbreite: 1327 mm\nVerpackungstiefe: 497 mm\nVerpackungsh\u00f6he: 318 mm\nPaketgewicht: 2,1 kg\nVerpackungsart: Box",
    "reference_file": "offer_reference_490.json",
    "shop_name": "mylemon.at"
}