{
    "html_file": "offer_409_14.html",
    "name": "AOC Agon AG325QZN/EU, 31.5\"",
    "offer_link": "https://www.future-x.at/aoc-agon-ag325qzn-ag5-series-led-monitor-gaming-80-cm-315-2560-x-1440-qhd-%40-240-hz-va-400-cd-m%B2-4000%3A1-displayhdr-1-ms-2xhdmi-2xdisplayport-schwarz-p-9171814/?pv=2",
    "price": 569.09,
    "raw_specifications": {
        "Abmessungen (Breite x Tiefe x H\u00f6he)": "71,42 cm x 27,61 cm x 48,08 cm - mit Fu\u00df",
        "Adaptive-Sync Technologie": "AMD FreeSync Premium",
        "Besonderheiten": "Flimmerfreie Technologie, AOC schwache Eingangsleistung Verz\u00f6gerungsmodus, AOC Shadow Control, AOC Game Color, an 3 Seiten rahmenlos, 8-zone local dimming",
        "Bildschirmbeschichtung": "Blendfrei",
        "Bildschirmtyp": "VA",
        "Details zu Abmessungen & Gewicht": "Mit Standfu\u00df (niedrigste Position) - Breite: 71,42 cm - Tiefe: 27,61 cm - H\u00f6he: 48,08 cm - Gewicht: 8,5 kg \u00a6 Mit Standfu\u00df (h\u00f6chste Position) - Breite: 71,42 cm - Tiefe: 27,61 cm - H\u00f6he: 63,08 cm - Gewicht: 8,5 kg \u00a6 Ohne Fu\u00df - Breite: 71,42 cm - Tiefe: 4,89 cm - H\u00f6he: 42,875 cm - Gewicht: 6,22 kg",
        "Diagonalabmessung": "80 cm (31.5\")",
        "Display-Typ": "LED-hintergrundbeleuchteter LCD-Monitor / TFT-Aktivmatrix",
        "Eingangsspannung": "Wechselstrom 100-240 V (50/60 Hz)",
        "Einstellungen der Anzeigeposition": "H\u00f6he, Pivot (Rotation), Drehung, Neigung",
        "Energie Effizienzklasse": "Klasse F",
        "Energieklasse (HDR)": "Klasse G",
        "Farbe": "Schwarz",
        "Farbraum": "120.6% sRGB (CIE 1931), 99.2% Adobe RGB (CIE 1976), 115.7% sRGB (CIE 1976), 88.9% DCI-P3 (CIE 1931), 92.2% DCI-P3 (CIE 1976), 89.4% Adobe RGB (CIE 1931), 85.4% NTSC (CIE 1931), 100.9% NTSC (CIE 1976)",
        "Farbunterst\u00fctzung": "1,07 Mrd. Farben",
        "Gaming": "Ja",
        "Gewicht": "8,5 kg",
        "HDR-Zertifizierung": "DisplayHDR 400",
        "Helligkeit": "400 cd/m\u00b2",
        "Hintergrundbeleuchtungs-Technologie": "WLED",
        "Horizontaler Betrachtungswinkel": "178",
        "H\u00f6heneinstellung": "150 mm",
        "Integrierte Peripherieger\u00e4te": "Mikrofon, USB Hub",
        "Kontrast": "4000:1 / 80000000:1 (dynamisch)",
        "Leistungsmerkmale": "Slot f\u00fcr Sicherheitsschloss (Kabelschloss getrennt erh\u00e4ltlich)",
        "Native Aufl\u00f6sung": "QHD 2560 x 1440 bei 240 Hz",
        "Neigungswinkel": "-3.5/+21.5",
        "Pixelpitch": "0.2724 mm",
        "Ppi": "93.2",
        "Reaktionszeit": "1 ms (Gray-to-Gray), 0,5 ms (MPRT)",
        "Schlosstyp zur Diebstahlsicherung": "Kensington Slot",
        "Schnittstellen": "2 x HDMI \u00a6 2 x DisplayPort 1.4 \u00a6 Kopfh\u00f6rer \u00a6 4 x USB Downstream",
        "Schwenkwinkel": "40",
        "Seitenverh\u00e4ltnis": "16:9",
        "Service und Support": "Begrenzte Garantie - 3 Jahre",
        "Stromverbrauch (Aus-Modus)": "0.3 Watt",
        "Stromverbrauch (typisch)": "39 Watt",
        "Stromverbrauch HDR (eingeschaltet)": "55 kWh/1.000 h",
        "Stromverbrauch SDR (eingeschaltet)": "32 kWh/1.000 h",
        "Stromverbrauch im Standby-Modus": "0.5 Watt",
        "Transportbreite": "98 cm",
        "Transportgewicht": "11,48 kg",
        "Transporth\u00f6he": "52 cm",
        "Transporttiefe": "16,2 cm",
        "VESA-Halterung": "100 x 100 mm, VESA",
        "Vertikaler Betrachtungswinkel": "178"
    },
    "raw_specifications_text": "Display-Typ: LED-hintergrundbeleuchteter LCD-Monitor / TFT-Aktivmatrix\nEnergie Effizienzklasse: Klasse F\nEnergieklasse (HDR): Klasse G\nDiagonalabmessung: 80 cm (31.5\")\nAdaptive-Sync Technologie: AMD FreeSync Premium\nIntegrierte Peripherieger\u00e4te: Mikrofon, USB Hub\nBildschirmtyp: VA\nSeitenverh\u00e4ltnis: 16:9\nNative Aufl\u00f6sung: QHD 2560 x 1440 bei 240 Hz\nPixelpitch: 0.2724 mm\nPpi: 93.2\nHelligkeit: 400 cd/m\u00b2\nKontrast: 4000:1 / 80000000:1 (dynamisch)\nHDR-Zertifizierung: DisplayHDR 400\nFarbunterst\u00fctzung: 1,07 Mrd. Farben\nFarbraum: 120.6% sRGB (CIE 1931), 99.2% Adobe RGB (CIE 1976), 115.7% sRGB (CIE 1976), 88.9% DCI-P3 (CIE 1931), 92.2% DCI-P3 (CIE 1976), 89.4% Adobe RGB (CIE 1931), 85.4% NTSC (CIE 1931), 100.9% NTSC (CIE 1976)\nReaktionszeit: 1 ms (Gray-to-Gray), 0,5 ms (MPRT)\nGaming: Ja\nHorizontaler Betrachtungswinkel: 178\nVertikaler Betrachtungswinkel: 178\nBildschirmbeschichtung: Blendfrei\nHintergrundbeleuchtungs-Technologie: WLED\nBesonderheiten: Flimmerfreie Technologie, AOC schwache Eingangsleistung Verz\u00f6gerungsmodus, AOC Shadow Control, AOC Game Color, an 3 Seiten rahmenlos, 8-zone local dimming\nFarbe: Schwarz\nAbmessungen (Breite x Tiefe x H\u00f6he): 71,42 cm x 27,61 cm x 48,08 cm - mit Fu\u00df\nGewicht: 8,5 kg\nSchnittstellen: 2 x HDMI \u00a6 2 x DisplayPort 1.4 \u00a6 Kopfh\u00f6rer \u00a6 4 x USB Downstream\nEinstellungen der Anzeigeposition: H\u00f6he, Pivot (Rotation), Drehung, Neigung\nNeigungswinkel: -3.5/+21.5\nSchwenkwinkel: 40\nH\u00f6heneinstellung: 150 mm\nVESA-Halterung: 100 x 100 mm, VESA\nLeistungsmerkmale: Slot f\u00fcr Sicherheitsschloss (Kabelschloss getrennt erh\u00e4ltlich)\nSchlosstyp zur Diebstahlsicherung: Kensington Slot\nEingangsspannung: Wechselstrom 100-240 V (50/60 Hz)\nStromverbrauch SDR (eingeschaltet): 32 kWh/1.000 h\nStromverbrauch HDR (eingeschaltet): 55 kWh/1.000 h\nStromverbrauch (typisch): 39 Watt\nStromverbrauch im Standby-Modus: 0.5 Watt\nStromverbrauch (Aus-Modus): 0.3 Watt\nDetails zu Abmessungen & Gewicht: Mit Standfu\u00df (niedrigste Position) - Breite: 71,42 cm - Tiefe: 27,61 cm - H\u00f6he: 48,08 cm - Gewicht: 8,5 kg \u00a6 Mit Standfu\u00df (h\u00f6chste Position) - Breite: 71,42 cm - Tiefe: 27,61 cm - H\u00f6he: 63,08 cm - Gewicht: 8,5 kg \u00a6 Ohne Fu\u00df - Breite: 71,42 cm - Tiefe: 4,89 cm - H\u00f6he: 42,875 cm - Gewicht: 6,22 kg\nTransportbreite: 98 cm\nTransporttiefe: 16,2 cm\nTransporth\u00f6he: 52 cm\nTransportgewicht: 11,48 kg\nService und Support: Begrenzte Garantie - 3 Jahre",
    "reference_file": "offer_reference_409.json",
    "shop_name": "Future-X.at"
}