{
    "html_file": "offer_299_10.html",
    "name": "Samsung UR590 / UR592 / UR594 (2023), 31.5\"",
    "offer_link": "https://www.office-partner.de/productredirect/index/sku/26032525?sPartner=p-geizhals-at&campaign=psm/geizhals-at/",
    "price": 301.41,
    "raw_specifications": {
        "Anschl\u00fcsse": "HDMI, DisplayPort, Kopfh\u00f6reranschluss, Audioausgang (Line-Out)",
        "Artikelnummer": "26032525",
        "Aufl\u00f6sung Kurzname": "Full HD, UHD, 4K",
        "Bezeichnung des Herstellers": "Samsung U32R590CWR",
        "Bildwiederholungsrate": "60,00",
        "Breite": "7127,00",
        "Display Features": "FlickerFree, 3D ready, Bild an Bild (PbP) Funktion",
        "Displaygr\u00f6\u00dfe": "81,28 cm (32 Zoll)",
        "EEK - Spektrum": "AG",
        "Energieeffizienzklasse": "G",
        "Geh\u00e4usefarbe des Ger\u00e4tes": "Grau",
        "Gewicht": "8,46",
        "Gewicht inkl. Verpackung in Kg": "8,40",
        "Helligkeit Bereich": "150 - 300 cd/m\u00b2",
        "Hersteller": "Samsung",
        "H\u00f6he": "515,00",
        "Kapazit\u00e4t (Seiten)": "0",
        "Kontrastverh\u00e4ltnis (typisch) Bereich": "ab 1.200:1",
        "LCD-Technologie": "VA Panel",
        "L\u00e4nge": "2379,00",
        "Produktart": "Monitore",
        "Reaktionszeit": "4,00",
        "Seitenverh\u00e4ltnis": "16:9",
        "Shop Herstellernummer": "LU32R590CWPXEN",
        "Standard-EAN": "8806094772005",
        "Verpackung - Breite in cm": "79,50",
        "Verpackung - H\u00f6he in cm": "18,90",
        "Verpackung - L\u00e4nge in cm": "50,30",
        "max. Aufl\u00f6sung": "3.840 x 2.160 Pixel (16:9)"
    },
    "raw_specifications_text": "Energieeffizienzklasse: G\nGeh\u00e4usefarbe des Ger\u00e4tes: Grau\nAnschl\u00fcsse: HDMI, DisplayPort, Kopfh\u00f6reranschluss, Audioausgang (Line-Out)\nDisplay Features: FlickerFree, 3D ready, Bild an Bild (PbP) Funktion\nHersteller: Samsung\nKontrastverh\u00e4ltnis (typisch) Bereich: ab 1.200:1\nHelligkeit Bereich: 150 - 300 cd/m\u00b2\nDisplaygr\u00f6\u00dfe: 81,28 cm (32 Zoll)\nProduktart: Monitore\nAufl\u00f6sung Kurzname: Full HD, UHD, 4K\nKapazit\u00e4t (Seiten): 0\nEEK - Spektrum: AG\nBezeichnung des Herstellers: Samsung U32R590CWR\nGewicht inkl. Verpackung in Kg: 8,40\nGewicht: 8,46\nVerpackung - L\u00e4nge in cm: 50,30\nH\u00f6he: 515,00\nArtikelnummer: 26032525\nStandard-EAN: 8806094772005\nShop Herstellernummer: LU32R590CWPXEN\nBreite: 7127,00\nL\u00e4nge: 2379,00\nVerpackung - Breite in cm: 79,50\nVerpackung - H\u00f6he in cm: 18,90\nmax. Aufl\u00f6sung: 3.840 x 2.160 Pixel (16:9)\nSeitenverh\u00e4ltnis: 16:9\nLCD-Technologie: VA Panel\nReaktionszeit: 4,00\nBildwiederholungsrate: 60,00",
    "reference_file": "offer_reference_299.json",
    "shop_name": "office-partner (AT)"
}