{
    "html_file": "offer_2389_14.html",
    "name": "AG neovo X-22E, 21.5\" schwarz",
    "offer_link": "https://www.ditech.at/details.php?artnr=250598",
    "price": 724.9,
    "raw_specifications": {
        "Abmessungen (BxHxT)": "513x369x155mm (mit Standfu\u00df),  513x324x54mm (ohne Standfu\u00df)",
        "Anschl\u00fcsse - DVI": "1",
        "Anschl\u00fcsse - DisplayPort 1.2": "1",
        "Anschl\u00fcsse - HDMI 1.4": "1",
        "Anschl\u00fcsse - VGA": "1",
        "Anschl\u00fcsse - VGA (60Hz@1920x1080)": "1",
        "Anschl\u00fcsse - VGA 60Hz@1920x1080": "1",
        "Anwendung": "station\u00e4r",
        "Audio": "Lautsprecher (2x 1W),  1x Line-In,  2x Cinch-In",
        "Aufl\u00f6sung": "1920x1080",
        "Besonderheiten": "Lichtsensor,  Schutzglas,  Picture-in-Picture",
        "Bildwiederholfrequenz": "60Hz",
        "Blickwinkel": "170\u00b0/160\u00b0",
        "Diagonale": "21.5\"/54.6cm",
        "Energieverbrauch SDR": "15kWh/1000h",
        "Ergonomie": "N/A (h\u00f6henverstellbar),  N/A (Pivot),  N/A (drehbar),  keine Angabe (neigbar),  keine Angabe (Schr\u00e4glage)",
        "FRC": "unbekannt",
        "Farbe": "schwarz",
        "Farbtiefe": "8bit (16.7 Mio. Farben)",
        "Form": "gerade (flat)",
        "Gewicht": "6.90kg (mit Standfu\u00df),  6.30kg (ohne Standfu\u00df)",
        "HDR": "N/A",
        "Helligkeit": "250cd/m\u00b2",
        "Hintergrundbeleuchtung": "White-LED",
        "Kontrast - dynamisch": "2.000.000:1",
        "Lautsprecher": "Ja",
        "Leistungsaufnahme": "28W (maximal),  17W (typisch),  keine Angabe (Energielabel alt A+++ bis G),  keine Angabe (Standby)",
        "Panel": "TN",
        "Reaktionszeit - GtG": "5ms",
        "Screen-to-Body-Ratio": "76.7% (berechnet)",
        "Seitenverh\u00e4ltnis": "16:9",
        "Signalfrequenz": "24-82kHz (horizontal),  50-75Hz (vertikal)",
        "Stromversorgung": "DC-In (externes Netzteil)",
        "USB-Hub In": "N/A",
        "USB-Hub Out": "N/A",
        "USB-Schreibweise": "Link",
        "VESA": "100x100/75x75 (frei)",
        "VRR (Variable Refresh Rate)": "N/A",
        "Weitere Anschl\u00fcsse": "N/A"
    },
    "raw_specifications_text": "Abmessungen (BxHxT): 513x369x155mm (mit Standfu\u00df),  513x324x54mm (ohne Standfu\u00df)\nAnschl\u00fcsse - DisplayPort 1.2: 1\nAnschl\u00fcsse - DVI: 1\nAnschl\u00fcsse - HDMI 1.4: 1\nAnschl\u00fcsse - VGA: 1\nAnschl\u00fcsse - VGA (60Hz@1920x1080): 1\nAnschl\u00fcsse - VGA 60Hz@1920x1080: 1\nAnwendung: station\u00e4r\nAudio: Lautsprecher (2x 1W),  1x Line-In,  2x Cinch-In\nAufl\u00f6sung: 1920x1080\nBesonderheiten: Lichtsensor,  Schutzglas,  Picture-in-Picture\nBildwiederholfrequenz: 60Hz\nBlickwinkel: 170\u00b0/160\u00b0\nDiagonale: 21.5\"/54.6cm\nEnergieverbrauch SDR: 15kWh/1000h\nErgonomie: N/A (h\u00f6henverstellbar),  N/A (Pivot),  N/A (drehbar),  keine Angabe (neigbar),  keine Angabe (Schr\u00e4glage)\nFarbe: schwarz\nFarbtiefe: 8bit (16.7 Mio. Farben)\nForm: gerade (flat)\nFRC: unbekannt\nGewicht: 6.90kg (mit Standfu\u00df),  6.30kg (ohne Standfu\u00df)\nHDR: N/A\nHelligkeit: 250cd/m\u00b2\nHintergrundbeleuchtung: White-LED\nKontrast - dynamisch: 2.000.000:1\nLautsprecher: Ja\nLeistungsaufnahme: 28W (maximal),  17W (typisch),  keine Angabe (Energielabel alt A+++ bis G),  keine Angabe (Standby)\nPanel: TN\nReaktionszeit - GtG: 5ms\nScreen-to-Body-Ratio: 76.7% (berechnet)\nSeitenverh\u00e4ltnis: 16:9\nSignalfrequenz: 24-82kHz (horizontal),  50-75Hz (vertikal)\nStromversorgung: DC-In (externes Netzteil)\nUSB-Hub In: N/A\nUSB-Hub Out: N/A\nUSB-Schreibweise: Link\nVESA: 100x100/75x75 (frei)\nVRR (Variable Refresh Rate): N/A\nWeitere Anschl\u00fcsse: N/A",
    "reference_file": "offer_reference_2389.json",
    "shop_name": "DiTech.at"
}