{
    "html_file": "offer_2038_3.html",
    "name": "ViewSonic Elite XG2705, 27\"",
    "offer_link": "https://www.mylemon.at/artikel/viewsonic/xg2705/xg2705-68-58cm-27zoll-16.html",
    "price": 255.99,
    "raw_specifications": {
        "3D": "Nein",
        "AC Eingangsfrequenz": "50/60 Hz",
        "AC Eingangsspannung": "100 - 240 V",
        "AMD FreeSync": "Ja",
        "Anti-Blue-Light-Technologie": "Ja",
        "Anzahl DisplayPort Anschl\u00fcsse": "1",
        "Anzahl HDMI-Anschl\u00fcsse": "1",
        "Anzahl der Farben des Displays": "16,78 Millionen Farben",
        "Anzahl der Lautsprecher": "2",
        "Artikelnummer": "M10YB16L",
        "Audioanschl\u00fcsse": "Nein",
        "Audioausgang": "Ja",
        "Aufl\u00f6sung": "1920x1080",
        "Besonderheiten": "AMD FreeSync, Lautsprecher",
        "Betriebstemperatur": "0 - 40 \u00b0C",
        "Bildschirmdiagonale": "68,6 cm (27 Zoll)",
        "Bildschirmform": "Flach",
        "Bildschirmtechnologie": "LED",
        "Bildwinkel, horizontal": "178\u00b0",
        "Bildwinkel, vertikal": "178\u00b0",
        "Breite (ohne Standfu\u00df)": "61,2 cm",
        "DVI Anschluss": "Nein",
        "Display-Aufl\u00f6sung": "1920 x 1080 Pixel",
        "DisplayPorts-Version": "1.2",
        "Displaygr\u00f6\u00dfe": "27 Zoll",
        "EAN": "0766907005042",
        "Ein-/Ausschalter": "Ja",
        "Eingebaute Lautsprecher": "Ja",
        "Energieeffizienzklasse (SDR)": "F",
        "Energieverbrauch (SDR) pro 1.000 Stunden": "26 kWh",
        "Ergonomie": "H\u00f6henverstellbar, Pivot (90 Grad drehbar), Schwenkbar, Neigbar",
        "Farbraum": "NTSC, sRGB",
        "Flimmerfreie Technologie": "Ja",
        "Fu\u00dffarbe": "Schwarz",
        "Ger\u00e4tebreite (inkl. Fu\u00df)": "612 mm",
        "Ger\u00e4teh\u00f6he (inkl. Fu\u00df)": "433,9 mm",
        "Ger\u00e4tetiefe (inkl. Fu\u00df)": "239 mm",
        "Gewicht (mit St\u00e4nder)": "7,5 kg",
        "Gewicht (ohne St\u00e4nder)": "4,2 kg",
        "HD-Typ": "Full HD",
        "HDMI": "Ja",
        "HDMI-Version": "1.4",
        "Helligkeit": "250 cd/m\u00b2",
        "Helligkeit (typisch)": "250 cd/m\u00b2",
        "Hersteller Artikelnummer": "XG2705",
        "Horizontaler Scanbereich": "30 - 180 kHz",
        "H\u00f6he (ohne Standfu\u00df)": "36,7 cm",
        "H\u00f6he bei Betrieb": "0 - 5000 m",
        "H\u00f6he bei Lagerung": "0 - 12100 m",
        "H\u00f6heneinstellung": "12 cm",
        "H\u00f6henverstellung": "Ja",
        "Integrierte Kamera": "Nein",
        "Integrierter USB-Hub": "Nein",
        "Kabelsperre-Slot": "Ja",
        "Kontrastverh\u00e4ltnis": "1000:1",
        "Kontrastverh\u00e4ltnis (dynamisch)": "80000000:1",
        "Kopfh\u00f6rerausgang": "Ja",
        "Kopfh\u00f6rerausg\u00e4nge": "1",
        "Luftfeuchtigkeit bei Lagerung": "5 - 90%",
        "Marktpositionierung": "Gaming",
        "Maximale Bildwiederholrate": "144 Hz",
        "Mitgelieferte Kabel": "AC, HDMI",
        "NTSC Abdeckung (typisch)": "72%",
        "NVIDIA G-SYNC": "Nein",
        "Nachhaltigkeitszertifikate": "RoHS",
        "Natives Seitenverh\u00e4ltnis": "16:9",
        "Neigungsverstellung": "Ja",
        "Neigungswinkelbereich": "-5 - 20\u00b0",
        "Paketgewicht": "9,3 kg",
        "Panel": "IPS",
        "Panel-Montage-Schnittstelle": "100 x 100 mm",
        "Panel-Typ": "IPS",
        "Pivot": "Ja",
        "Pivot Winkel": "0 - 90\u00b0",
        "Pixel Abstand": "0,311 x 0,311 mm",
        "Produktfarbe": "Schwarz",
        "RMS-Leistung": "4 W",
        "Reaktionszeit": "1 ms",
        "Relative Luftfeuchtigkeit in Betrieb": "20 - 90%",
        "Schnellstart\u00fcbersicht": "Ja",
        "Schwenkbar": "Ja",
        "Schwenkwinkelbereich": "0 - 90\u00b0",
        "Sichtbare Gr\u00f6\u00dfe (horizontal)": "59,8 cm",
        "Sichtbare Gr\u00f6\u00dfe (vertikal)": "33,6 cm",
        "Slot-Typ Kabelsperre": "Kensington",
        "Stromeingang": "Ja",
        "Stromverbrauch (Standardbetrieb)": "26 W",
        "Stromverbrauch (Standby)": "0,5 W",
        "Stromverbrauch (aus)": "0,3 W",
        "Stromverbrauch (max.)": "32 W",
        "St\u00e4nder enthalten": "Ja",
        "TV Tuner integriert": "Nein",
        "Temperaturbereich bei Lagerung": "-20 - 60 \u00b0C",
        "Tiefe (ohne Standfu\u00df)": "4,9 cm",
        "Touchscreen": "Nein",
        "Unterst\u00fctzte Grafik-Aufl\u00f6sungen": "640 x 350, 640 x 400, 640 x 480 (VGA), 720 x 400, 720 x 480, 800 x 600 (SVGA), 832 x 624, 848 x 480, 1024 x 600, 1024 x 768 (XGA), 1152 x 864 (XGA+), 1152 x 870, 1280 x 1024 (SXGA), 1280 x 720 (HD 720), 1280 x 768 (WXGA), 1280 x 800 (WXGA), 1280 x 960, 1400 x 1050 (SXGA+), 1440 x 900 (WXGA+), 1600 x 1200 (UXGA), 1600 x 900, 1680 x 1050 (WSXGA+), 1920 x 1080 (HD 1080)",
        "VESA Adaptive Sync unterst\u00fctzt": "Ja",
        "VESA Halterung": "100x100 mm",
        "VESA-Halterung": "Ja",
        "Verpackungsbreite": "612 mm",
        "Verpackungsh\u00f6he": "367 mm",
        "Verpackungstiefe": "49 mm",
        "Vertikaler Scanbereich": "47 - 144 Hz",
        "Video Anschl\u00fcsse": "2x HDMI, 1x DisplayPort",
        "Zertifizierung": "CE, CE EMC, CB, RoHS, ErP, REACH, WEEE, EAC, UkrSEPRO, BSMI, VCCI, PSE, KC, e-Standby, CCC, China RoHS, CEL",
        "sRGB Abdeckung (klassisch)": "104%"
    },
    "raw_specifications_text": "Displaygr\u00f6\u00dfe: 27 Zoll\nAufl\u00f6sung: 1920x1080\nPanel: IPS\nReaktionszeit: 1 ms\nVideo Anschl\u00fcsse: 2x HDMI, 1x DisplayPort\nErgonomie: H\u00f6henverstellbar, Pivot (90 Grad drehbar), Schwenkbar, Neigbar\nVESA Halterung: 100x100 mm\nHelligkeit: 250 cd/m\u00b2\nBesonderheiten: AMD FreeSync, Lautsprecher\nHersteller Artikelnummer: XG2705\nEAN: 0766907005042\nArtikelnummer: M10YB16L\nBildschirmdiagonale: 68,6 cm (27 Zoll)\nDisplay-Aufl\u00f6sung: 1920 x 1080 Pixel\nNatives Seitenverh\u00e4ltnis: 16:9\nBildschirmtechnologie: LED\nTouchscreen: Nein\nHD-Typ: Full HD\nPanel-Typ: IPS\nBildschirmform: Flach\nKontrastverh\u00e4ltnis: 1000:1\nMaximale Bildwiederholrate: 144 Hz\nAnzahl der Farben des Displays: 16,78 Millionen Farben\nHelligkeit (typisch): 250 cd/m\u00b2\nUnterst\u00fctzte Grafik-Aufl\u00f6sungen: 640 x 350, 640 x 400, 640 x 480 (VGA), 720 x 400, 720 x 480, 800 x 600 (SVGA), 832 x 624, 848 x 480, 1024 x 600, 1024 x 768 (XGA), 1152 x 864 (XGA+), 1152 x 870, 1280 x 1024 (SXGA), 1280 x 720 (HD 720), 1280 x 768 (WXGA), 1280 x 800 (WXGA), 1280 x 960, 1400 x 1050 (SXGA+), 1440 x 900 (WXGA+), 1600 x 1200 (UXGA), 1600 x 900, 1680 x 1050 (WSXGA+), 1920 x 1080 (HD 1080)\nKontrastverh\u00e4ltnis (dynamisch): 80000000:1\nBildwinkel, horizontal: 178\u00b0\nBildwinkel, vertikal: 178\u00b0\nPixel Abstand: 0,311 x 0,311 mm\nHorizontaler Scanbereich: 30 - 180 kHz\nVertikaler Scanbereich: 47 - 144 Hz\nSichtbare Gr\u00f6\u00dfe (horizontal): 59,8 cm\nSichtbare Gr\u00f6\u00dfe (vertikal): 33,6 cm\nsRGB Abdeckung (klassisch): 104%\nNTSC Abdeckung (typisch): 72%\n3D: Nein\nFarbraum: NTSC, sRGB\nNVIDIA G-SYNC: Nein\nAMD FreeSync: Ja\nVESA Adaptive Sync unterst\u00fctzt: Ja\nFlimmerfreie Technologie: Ja\nEingebaute Lautsprecher: Ja\nIntegrierte Kamera: Nein\nAnzahl der Lautsprecher: 2\nRMS-Leistung: 4 W\nMarktpositionierung: Gaming\nProduktfarbe: Schwarz\nFu\u00dffarbe: Schwarz\nZertifizierung: CE, CE EMC, CB, RoHS, ErP, REACH, WEEE, EAC, UkrSEPRO, BSMI, VCCI, PSE, KC, e-Standby, CCC, China RoHS, CEL\nIntegrierter USB-Hub: Nein\nHDMI: Ja\nKopfh\u00f6rerausgang: Ja\nDVI Anschluss: Nein\nAnzahl HDMI-Anschl\u00fcsse: 1\nHDMI-Version: 1.4\nAnzahl DisplayPort Anschl\u00fcsse: 1\nDisplayPorts-Version: 1.2\nAudioanschl\u00fcsse: Nein\nAudioausgang: Ja\nKopfh\u00f6rerausg\u00e4nge: 1\nStromeingang: Ja\nVESA-Halterung: Ja\nKabelsperre-Slot: Ja\nH\u00f6henverstellung: Ja\nPanel-Montage-Schnittstelle: 100 x 100 mm\nSlot-Typ Kabelsperre: Kensington\nH\u00f6heneinstellung: 12 cm\nPivot: Ja\nPivot Winkel: 0 - 90\u00b0\nSchwenkbar: Ja\nSchwenkwinkelbereich: 0 - 90\u00b0\nNeigungswinkelbereich: -5 - 20\u00b0\nNeigungsverstellung: Ja\nEnergieeffizienzklasse (SDR): F\nEnergieverbrauch (SDR) pro 1.000 Stunden: 26 kWh\nStromverbrauch (Standardbetrieb): 26 W\nStromverbrauch (Standby): 0,5 W\nStromverbrauch (max.): 32 W\nStromverbrauch (aus): 0,3 W\nAC Eingangsspannung: 100 - 240 V\nAC Eingangsfrequenz: 50/60 Hz\nBetriebstemperatur: 0 - 40 \u00b0C\nTemperaturbereich bei Lagerung: -20 - 60 \u00b0C\nRelative Luftfeuchtigkeit in Betrieb: 20 - 90%\nLuftfeuchtigkeit bei Lagerung: 5 - 90%\nH\u00f6he bei Betrieb: 0 - 5000 m\nH\u00f6he bei Lagerung: 0 - 12100 m\nSt\u00e4nder enthalten: Ja\nMitgelieferte Kabel: AC, HDMI\nSchnellstart\u00fcbersicht: Ja\nGer\u00e4tebreite (inkl. Fu\u00df): 612 mm\nGer\u00e4tetiefe (inkl. Fu\u00df): 239 mm\nGer\u00e4teh\u00f6he (inkl. Fu\u00df): 433,9 mm\nGewicht (mit St\u00e4nder): 7,5 kg\nBreite (ohne Standfu\u00df): 61,2 cm\nTiefe (ohne Standfu\u00df): 4,9 cm\nH\u00f6he (ohne Standfu\u00df): 36,7 cm\nGewicht (ohne St\u00e4nder): 4,2 kg\nVerpackungsbreite: 612 mm\nVerpackungstiefe: 49 mm\nVerpackungsh\u00f6he: 367 mm\nPaketgewicht: 9,3 kg\nNachhaltigkeitszertifikate: RoHS\nEin-/Ausschalter: Ja\nTV Tuner integriert: Nein\nAnti-Blue-Light-Technologie: Ja",
    "reference_file": "offer_reference_2038.json",
    "shop_name": "mylemon.at"
}