{
    "html_file": "offer_641_1.html",
    "name": "MSI Modern MD272PW, 27\"",
    "offer_link": "https://www.proshop.at/Bildschirm/MSI-27-Bildschirm-Modern-MD272PW-White-5-ms-VESA-Adaptive-Sync/3118144?utm_source=geizhals&utm_medium=cpc&utm_campaign=pricesite",
    "price": 292.9,
    "raw_specifications": {
        "Abmessungen (Breite x Tiefe x H\u00f6he)": "61.35 cm x 20.081 cm x 40.15 cm",
        "Adaptive-Sync Technologie": "VESA Adaptive-Sync",
        "Ausgangsleistung/Kanal": "2 Watt",
        "Besonderheiten": "MSI Anti-Flicker, rahmeloses Blendendesign, Less Blue Light PRO",
        "Bildschirmbeschichtung": "Blendfrei",
        "Bildschirmtyp": "IPS",
        "Diagonalabmessung": "69 cm (27\")",
        "Display-Typ": "LED-hintergrundbeleuchteter LCD-Monitor / TFT-Aktivmatrix",
        "EAN": "4719072955311",
        "Eingangsanschl\u00fcsse": "HDMI, DisplayPort, USB-C",
        "Eingangsspannung": "Wechselstrom 100-240 V (50/60 Hz)",
        "Einstellungen der Anzeigeposition": "H\u00f6he, Pivot (Rotation), Drehung, Neigung",
        "Energie Effizienzklasse": "Klasse F",
        "Farbraum": "100% DCI-P3 (CIE 1976)",
        "Farbunterst\u00fctzung": "16,7 Millionen Farben (8-Bit)",
        "Ger\u00e4tetyp": "LED-hintergrundbeleuchteter LCD-Monitor - 69 cm (27\")",
        "Gewicht": "5.85 kg",
        "Helligkeit": "250 cd/m\u00b2",
        "Hersteller": "MSI",
        "Hintergrundbeleuchtungs-Technologie": "LED-Hintergrundbeleuchtung",
        "Horizontale Bildwiederholrate": "30 - 112 kHz",
        "Horizontaler Betrachtungswinkel": "178",
        "H\u00f6heneinstellung": "110 mm",
        "Integrierte Peripherieger\u00e4te": "KVM-Switch, 2-Port USB 2.0 Hub",
        "Kennzeichnung": "TUV Rheinland, CIE1976",
        "Kontrast": "1000:1 / 100000000:1 (dynamisch)",
        "Leistungsmerkmale": "Slot f\u00fcr Sicherheitsschloss (Kabelschloss getrennt erh\u00e4ltlich)",
        "Modell": "Modern MD272PW",
        "Native Aufl\u00f6sung": "Full HD (1080p) 1920 x 1080 bei 75 Hz",
        "Neigungswinkel": "-5/+20",
        "Pixelpitch": "0.3114 mm",
        "Produktbeschreibung": "MSI Modern MD272PW - LED-Monitor - Full HD (1080p) - 69 cm (27\")",
        "Reaktionszeit": "5 ms (Gray-to-Gray)",
        "Rotationswinkel": "180",
        "Schlosstyp zur Diebstahlsicherung": "Kensington Slot",
        "Schnittstellen": "HDMI  DisplayPort 1.2a  USB-C/DisplayPort Alt Mode mit Spannungsversorgung (bis zu 65 W)  Kopfh\u00f6rer  2 x USB 2.0 Downstream  USB 2.0 Upstream",
        "Schwenkwinkel": "60",
        "Seitenverh\u00e4ltnis": "16:9",
        "Spannung": "Wechselstrom 100-240 V (50/60 Hz)",
        "Stromverbrauch SDR (eingeschaltet)": "26 kWh/1.000 h",
        "Transportbreite": "89.3 cm",
        "Transportgewicht": "8.1 kg",
        "Transporth\u00f6he": "16.7 cm",
        "Transporttiefe": "46.4 cm",
        "Typ": "Lautsprecher - Stereo",
        "VESA-Halterung": "75 x 75 mm",
        "Vertikale Bildwiederholrate": "48 - 75 Hz",
        "Vertikaler Betrachtungswinkel": "178",
        "Waren-Nr.": "3118144",
        "Zubeh\u00f6r im Lieferumfang": "Netzteil"
    },
    "raw_specifications_text": "Hersteller: MSI\nWaren-Nr.: 3118144\nModell: Modern MD272PW\nEAN: 4719072955311\nProduktbeschreibung: MSI Modern MD272PW - LED-Monitor - Full HD (1080p) - 69 cm (27\")\nGer\u00e4tetyp: LED-hintergrundbeleuchteter LCD-Monitor - 69 cm (27\")\nEnergie Effizienzklasse: Klasse F\nAdaptive-Sync Technologie: VESA Adaptive-Sync\nLeistungsmerkmale: Slot f\u00fcr Sicherheitsschloss (Kabelschloss getrennt erh\u00e4ltlich)\nBildschirmtyp: IPS\nSeitenverh\u00e4ltnis: 16:9\nNative Aufl\u00f6sung: Full HD (1080p) 1920 x 1080 bei 75 Hz\nPixelpitch: 0.3114 mm\nHelligkeit: 250 cd/m\u00b2\nKontrast: 1000:1 / 100000000:1 (dynamisch)\nReaktionszeit: 5 ms (Gray-to-Gray)\nFarbunterst\u00fctzung: 16,7 Millionen Farben (8-Bit)\nFarbraum: 100% DCI-P3 (CIE 1976)\nEingangsanschl\u00fcsse: HDMI, DisplayPort, USB-C\nEinstellungen der Anzeigeposition: H\u00f6he, Pivot (Rotation), Drehung, Neigung\nBildschirmbeschichtung: Blendfrei\nSpannung: Wechselstrom 100-240 V (50/60 Hz)\nAbmessungen (Breite x Tiefe x H\u00f6he): 61.35 cm x 20.081 cm x 40.15 cm\nGewicht: 5.85 kg\nKennzeichnung: TUV Rheinland, CIE1976\nDisplay-Typ: LED-hintergrundbeleuchteter LCD-Monitor / TFT-Aktivmatrix\nDiagonalabmessung: 69 cm (27\")\nIntegrierte Peripherieger\u00e4te: KVM-Switch, 2-Port USB 2.0 Hub\nVertikale Bildwiederholrate: 48 - 75 Hz\nHorizontale Bildwiederholrate: 30 - 112 kHz\nHorizontaler Betrachtungswinkel: 178\nVertikaler Betrachtungswinkel: 178\nHintergrundbeleuchtungs-Technologie: LED-Hintergrundbeleuchtung\nBesonderheiten: MSI Anti-Flicker, rahmeloses Blendendesign, Less Blue Light PRO\nTyp: Lautsprecher - Stereo\nAusgangsleistung/Kanal: 2 Watt\nSchnittstellen: HDMI  DisplayPort 1.2a  USB-C/DisplayPort Alt Mode mit Spannungsversorgung (bis zu 65 W)  Kopfh\u00f6rer  2 x USB 2.0 Downstream  USB 2.0 Upstream\nNeigungswinkel: -5/+20\nSchwenkwinkel: 60\nRotationswinkel: 180\nH\u00f6heneinstellung: 110 mm\nVESA-Halterung: 75 x 75 mm\nZubeh\u00f6r im Lieferumfang: Netzteil\nSchlosstyp zur Diebstahlsicherung: Kensington Slot\nEingangsspannung: Wechselstrom 100-240 V (50/60 Hz)\nStromverbrauch SDR (eingeschaltet): 26 kWh/1.000 h\nTransportbreite: 89.3 cm\nTransporttiefe: 46.4 cm\nTransporth\u00f6he: 16.7 cm\nTransportgewicht: 8.1 kg",
    "reference_file": "offer_reference_641.json",
    "shop_name": "Proshop.at"
}