{
    "html_file": "offer_739_10.html",
    "name": "LG UltraWide 34WQ75X-B, 34\"",
    "offer_link": "https://direkt.jacob.de/produkte/lg-electronics-34wq75x-b-aeu-34wq75x-b-aeu-artnr-8114732.html?utm_source=geizhals&utm_medium=cpc&utm_campaign=Preisvergleich&ref=103",
    "price": 560.7,
    "raw_specifications": {
        "AC Eingangsspannung": "220 - 240 V",
        "AMD FreeSync": "Nein",
        "Anzahl DisplayPort Anschl\u00fcsse": "1",
        "Anzahl HDMI-Anschl\u00fcsse": "2",
        "Anzahl OSD-Sprachen": "2",
        "Anzahl der Farben des Displays": "1,07 Milliarden Farben",
        "Anzahl der Upstream-Ports USB Typ-C": "1",
        "Anzahl der nachgeschalteten Steckpl\u00e4tze vom Typ USB-A": "2",
        "Betriebsanleitung": "Ja",
        "Bildschirmdiagonale": "86,4 cm (34\" )",
        "Bildschirmdiagonale (cm)": "86,72 cm",
        "Bildschirmform": "Gebogen",
        "Bildschirmtechnologie": "LED",
        "Bildwinkel, horizontal": "178\u00b0",
        "Bildwinkel, vertikal": "178\u00b0",
        "Blendfreier Bildschirm": "Ja",
        "Display-Aufl\u00f6sung": "3440 x 1440 Pixel",
        "DisplayPorts-Version": "1.4",
        "Eingebaute Lautsprecher": "Ja",
        "Eingebauter Ethernet-Anschluss": "Ja",
        "Energieeffizienzklasse (HDR)": "G",
        "Energieeffizienzklasse (SDR)": "G",
        "Energieeffizienzskala": "A bis G",
        "Energieverbrauch (HDR) pro 1.000 Stunden": "51 kWh",
        "Energieverbrauch (SDR) pro 1.000 Stunden": "32 kWh",
        "Gewicht (mit St\u00e4nder)": "8,6 kg",
        "Gewicht (ohne St\u00e4nder)": "6,7 kg",
        "HD-Typ": "Quad HD",
        "HDMI": "Ja",
        "Hardware-Kalibrierung": "Nein",
        "Helligkeit (typisch)": "300 cd/m\u00b2",
        "High Dynamic Range Video (HDR) Unterst\u00fctzung": "Ja",
        "H\u00f6henverstellung": "Nein",
        "Integrierte Kamera": "Nein",
        "Integrierter USB-Hub": "Nein",
        "Kabelsperre-Slot": "Nein",
        "Kontrastverh\u00e4ltnis": "1000:1",
        "Kopfh\u00f6rerausgang": "Ja",
        "Marktpositionierung": "Haus",
        "Men\u00fcsprachen": "Deutsch, Englisch",
        "Mitgelieferte Kabel": "AC, DisplayPort, HDMI, USB Typ-C",
        "NVIDIA G-SYNC": "Nein",
        "Nachhaltigkeitskonformit\u00e4t": "Ja",
        "Nachhaltigkeitszertifikate": "CE, ErP",
        "Natives Seitenverh\u00e4ltnis": "21:9",
        "Neigungsverstellung": "Ja",
        "Neigungswinkelbereich": "5 - 20\u00b0",
        "On-Screen-Display (OSD)": "Ja",
        "Paketgewicht": "11,1 kg",
        "Panel-Typ": "IPS",
        "Pixel Abstand": "0,2325 x 0,2325 mm",
        "Produktfarbe": "Schwarz",
        "Reaktionszeit": "5 ms",
        "Smart-Modi": "Energiesparend",
        "Stromverbrauch (Standardbetrieb)": "180 W",
        "Stromverbrauch (Standby)": "0,5 W",
        "Stromverbrauch (aus)": "0,3 W",
        "Technologie mit hohem Dynamikbereich (HDR)": "High Dynamic Range 10 (HDR10)",
        "Touchscreen": "Nein",
        "Typ der Hintergrundbeleuchtung": "LED",
        "VESA-Halterung": "Ja",
        "Zertifizierung": "TUV Type, CB, UL (cUL), FCC-B"
    },
    "raw_specifications_text": "Bildschirmdiagonale: 86,4 cm (34\" )\nDisplay-Aufl\u00f6sung: 3440 x 1440 Pixel\nNatives Seitenverh\u00e4ltnis: 21:9\nBildschirmtechnologie: LED\nTouchscreen: Nein\nHD-Typ: Quad HD\nPanel-Typ: IPS\nBildschirmform: Gebogen\nKontrastverh\u00e4ltnis: 1000:1\nAnzahl der Farben des Displays: 1,07 Milliarden Farben\nTyp der Hintergrundbeleuchtung: LED\nHelligkeit (typisch): 300 cd/m\u00b2\nReaktionszeit: 5 ms\nBlendfreier Bildschirm: Ja\nBildwinkel, horizontal: 178\u00b0\nBildwinkel, vertikal: 178\u00b0\nPixel Abstand: 0,2325 x 0,2325 mm\nBildschirmdiagonale (cm): 86,72 cm\nHigh Dynamic Range Video (HDR) Unterst\u00fctzung: Ja\nTechnologie mit hohem Dynamikbereich (HDR): High Dynamic Range 10 (HDR10)\nHardware-Kalibrierung: Nein\nNVIDIA G-SYNC: Nein\nAMD FreeSync: Nein\nSmart-Modi: Energiesparend\nEingebaute Lautsprecher: Ja\nIntegrierte Kamera: Nein\nMarktpositionierung: Haus\nProduktfarbe: Schwarz\nZertifizierung: TUV Type, CB, UL (cUL), FCC-B\nIntegrierter USB-Hub: Nein\nHDMI: Ja\nKopfh\u00f6rerausgang: Ja\nAnzahl der Upstream-Ports USB Typ-C: 1\nAnzahl der nachgeschalteten Steckpl\u00e4tze vom Typ USB-A: 2\nAnzahl HDMI-Anschl\u00fcsse: 2\nAnzahl DisplayPort Anschl\u00fcsse: 1\nDisplayPorts-Version: 1.4\nEingebauter Ethernet-Anschluss: Ja\nVESA-Halterung: Ja\nKabelsperre-Slot: Nein\nH\u00f6henverstellung: Nein\nNeigungswinkelbereich: 5 - 20\u00b0\nOn-Screen-Display (OSD): Ja\nMen\u00fcsprachen: Deutsch, Englisch\nAnzahl OSD-Sprachen: 2\nNeigungsverstellung: Ja\nEnergieeffizienzklasse (SDR): G\nEnergieeffizienzklasse (HDR): G\nEnergieverbrauch (SDR) pro 1.000 Stunden: 32 kWh\nEnergieverbrauch (HDR) pro 1.000 Stunden: 51 kWh\nStromverbrauch (Standardbetrieb): 180 W\nStromverbrauch (Standby): 0,5 W\nStromverbrauch (aus): 0,3 W\nAC Eingangsspannung: 220 - 240 V\nEnergieeffizienzskala: A bis G\nMitgelieferte Kabel: AC, DisplayPort, HDMI, USB Typ-C\nBetriebsanleitung: Ja\nGewicht (mit St\u00e4nder): 8,6 kg\nGewicht (ohne St\u00e4nder): 6,7 kg\nPaketgewicht: 11,1 kg\nNachhaltigkeitskonformit\u00e4t: Ja\nNachhaltigkeitszertifikate: CE, ErP",
    "reference_file": "offer_reference_739.json",
    "shop_name": "Jacob Elektronik direkt (AT)"
}