{
    "html_file": "offer_128_9.html",
    "name": "Corsair Xeneon 32UHD144-A, 32\"",
    "offer_link": "https://www.mylemon.at/artikel/corsair/cm_9020006_pe/xeneon-32uhd144-a.html",
    "price": 1221.14,
    "raw_specifications": {
        "AMD FreeSync": "Ja",
        "AMD FreeSync-Typ": "FreeSync Premium",
        "Adobe RGB-Abdeckung": "100%",
        "Anzahl DisplayPort Anschl\u00fcsse": "1",
        "Anzahl HDMI-Anschl\u00fcsse": "2",
        "Anzahl der Farben des Displays": "1,073 Milliarden Farben",
        "Anzahl der Upstream-Ports USB Typ-C": "1",
        "Artikelnummer": "M1LYBWLL",
        "Audioausgang": "Ja",
        "Aufl\u00f6sung": "3840x2160",
        "Besonderheiten": "144 Hz, USB HUB",
        "Bildschirmdiagonale": "81,3 cm (32\")",
        "Bildschirmform": "Flach",
        "Bildwinkel, horizontal": "178\u00b0",
        "Bildwinkel, vertikal": "178\u00b0",
        "Blendfreier Bildschirm": "Ja",
        "Display-Aufl\u00f6sung": "3840 x 2160 Pixel",
        "DisplayPorts-Version": "1.4",
        "Displaygr\u00f6\u00dfe": "32 Zoll",
        "EAN": "0840006665984",
        "Ergonomie": "H\u00f6henverstellbar, Schwenkbar, Neigbar",
        "Farbskala": "98%",
        "Farbtiefe": "8 Bit",
        "Flimmerfreie Technologie": "Ja",
        "Gew\u00e4hrleistungsfrist": "3 Jahr(e)",
        "HD-Typ": "4K Ultra HD",
        "HDMI": "Ja",
        "HDMI-Version": "2.1",
        "Helligkeit": "350 cd/m\u00b2",
        "Helligkeit (peak)": "600 cd/m\u00b2",
        "Hersteller Artikelnummer": "CM-9020006-PE",
        "High Dynamic Range Video (HDR) Unterst\u00fctzung": "Ja",
        "H\u00f6heneinstellung": "11 cm",
        "H\u00f6henverstellung": "Ja",
        "Integrierter USB-Hub": "Ja",
        "Kontrastverh\u00e4ltnis": "1000:1",
        "Marktpositionierung": "Gaming",
        "Maximale Bildwiederholrate": "144 Hz",
        "NVIDIA G-SYNC": "Ja",
        "NVIDIA G-SYNC-Typ": "G-SYNC Compatible",
        "Natives Seitenverh\u00e4ltnis": "16:9",
        "Neigungswinkelbereich": "-5 - 20\u00b0",
        "Panel": "IPS",
        "Panel-Montage-Schnittstelle": "100 x 100 mm",
        "Panel-Typ": "IPS",
        "Produktfarbe": "Schwarz",
        "RGB-Farbraum": "DCI-P3",
        "Reaktionszeit": "1 ms",
        "Schwenkbar": "Ja",
        "Schwenkwinkelbereich": "-30 - 30\u00b0",
        "Stromverbrauch (Standardbetrieb)": "40 W",
        "Stromverbrauch (Standby)": "0,5 W",
        "Stromverbrauch (aus)": "0,3 W",
        "Stromverbrauch (max.)": "150 W",
        "Technologie mit hohem Dynamikbereich (HDR)": "High Dynamic Range (HDR) 400, High Dynamic Range (HDR) 600",
        "Touchscreen": "Nein",
        "VESA Halterung": "100x100 mm",
        "VESA-Halterung": "Ja",
        "Video Anschl\u00fcsse": "2x HDMI, 1x DisplayPort"
    },
    "raw_specifications_text": "Displaygr\u00f6\u00dfe: 32 Zoll\nAufl\u00f6sung: 3840x2160\nPanel: IPS\nReaktionszeit: 1 ms\nVideo Anschl\u00fcsse: 2x HDMI, 1x DisplayPort\nErgonomie: H\u00f6henverstellbar, Schwenkbar, Neigbar\nVESA Halterung: 100x100 mm\nHelligkeit: 350 cd/m\u00b2\nBesonderheiten: 144 Hz, USB HUB\nHersteller Artikelnummer: CM-9020006-PE\nEAN: 0840006665984\nArtikelnummer: M1LYBWLL\nBildschirmdiagonale: 81,3 cm (32\")\nDisplay-Aufl\u00f6sung: 3840 x 2160 Pixel\nNatives Seitenverh\u00e4ltnis: 16:9\nTouchscreen: Nein\nHD-Typ: 4K Ultra HD\nPanel-Typ: IPS\nBildschirmform: Flach\nKontrastverh\u00e4ltnis: 1000:1\nMaximale Bildwiederholrate: 144 Hz\nAnzahl der Farben des Displays: 1,073 Milliarden Farben\nHelligkeit (peak): 600 cd/m\u00b2\nBlendfreier Bildschirm: Ja\nBildwinkel, horizontal: 178\u00b0\nBildwinkel, vertikal: 178\u00b0\nHigh Dynamic Range Video (HDR) Unterst\u00fctzung: Ja\nTechnologie mit hohem Dynamikbereich (HDR): High Dynamic Range (HDR) 400, High Dynamic Range (HDR) 600\nFarbtiefe: 8 Bit\nRGB-Farbraum: DCI-P3\nFarbskala: 98%\nAdobe RGB-Abdeckung: 100%\nNVIDIA G-SYNC: Ja\nAMD FreeSync: Ja\nNVIDIA G-SYNC-Typ: G-SYNC Compatible\nAMD FreeSync-Typ: FreeSync Premium\nFlimmerfreie Technologie: Ja\nMarktpositionierung: Gaming\nProduktfarbe: Schwarz\nIntegrierter USB-Hub: Ja\nHDMI: Ja\nAnzahl der Upstream-Ports USB Typ-C: 1\nAnzahl HDMI-Anschl\u00fcsse: 2\nHDMI-Version: 2.1\nAnzahl DisplayPort Anschl\u00fcsse: 1\nDisplayPorts-Version: 1.4\nAudioausgang: Ja\nVESA-Halterung: Ja\nH\u00f6henverstellung: Ja\nPanel-Montage-Schnittstelle: 100 x 100 mm\nH\u00f6heneinstellung: 11 cm\nSchwenkbar: Ja\nSchwenkwinkelbereich: -30 - 30\u00b0\nNeigungswinkelbereich: -5 - 20\u00b0\nStromverbrauch (Standardbetrieb): 40 W\nStromverbrauch (Standby): 0,5 W\nStromverbrauch (max.): 150 W\nStromverbrauch (aus): 0,3 W\nGew\u00e4hrleistungsfrist: 3 Jahr(e)",
    "reference_file": "offer_reference_128.json",
    "shop_name": "mylemon.at"
}