{
    "html_file": "offer_677_0.html",
    "name": "iiyama ProLite XUB2794HSU-B1, 27\"",
    "offer_link": "https://www.ba-computer.at/iiyama-prolite-xub2794hsu-b1-led-monitor-68-6-cm-27-xub2794hsu-b1.html",
    "price": 157.86,
    "raw_specifications": {
        "Abmessungen (Breite x Tiefe x H\u00f6he)": "61.5 cm x 22.45 cm",
        "Ausgangsleistung/Kanal": "2 Watt",
        "Besonderheiten": "HDCP, Eco-Mode, Advanced Contrast Ratio (ACR), flimmerfreie Technologie, i-Style Color, 3 Side Borderless Design, Blue Light Reducer Function",
        "Bildschirmbeschichtung": "Matt",
        "Bildschirmtyp": "VA",
        "Diagonalabmessung": "68.6 cm (27\")",
        "Display-Typ": "LED-hintergrundbeleuchteter LCD-Monitor / TFT-Aktivmatrix",
        "Eingangsspannung": "Wechselstrom 100-240 V (50/60 Hz)",
        "Einstellungen der Anzeigeposition": "H\u00f6he, Pivot (Rotation), Drehung, Neigung",
        "Energie Effizienzklasse": "Klasse E",
        "Enthaltene Kabel": "1 x USB-Kabel \u00a6 1 x HDMI-Kabel \u00a6 1 x Stromkabel",
        "Farbe": "Mattschwarz",
        "Farbraum": "72% NTSC, 96% sRGB",
        "Farbunterst\u00fctzung": "16,7 Millionen Farben",
        "Gewicht": "5.5 kg",
        "Helligkeit": "250 cd/m\u00b2",
        "Hintergrundbeleuchtungs-Technologie": "LED-Hintergrundbeleuchtung",
        "Horizontale Bildwiederholrate": "30 - 85 kHz",
        "Horizontaler Betrachtungswinkel": "178",
        "H\u00f6heneinstellung": "150 mm",
        "Integrierte Peripherieger\u00e4te": "USB 3.0-Hub",
        "Kennzeichnung": "VCCI, DDC-2B, DDC/CI, RoHS, WEEE, PSE Mark, REACH, TUV Bauart, ERP, REACH SvHC, UKCA",
        "Kontrast": "3000:1 / 80000000:1 (dynamisch)",
        "Leistungsmerkmale": "Slot f\u00fcr Sicherheitsschloss (Kabelschloss getrennt erh\u00e4ltlich)",
        "Native Aufl\u00f6sung": "Full HD (1080p) 1920 x 1080 bei 75 Hz",
        "Neigungswinkel": "-5/+23",
        "OSD-Sprachen": "Tschechisch, Englisch, Deutsch, Franz\u00f6sisch, Italienisch, Polnisch, Russisch, Spanisch, Holl\u00e4ndisch, Japanisch",
        "Pixelpitch": "0.311 mm",
        "Reaktionszeit": "4 ms (gray-to-gray)",
        "Rotationswinkel": "90",
        "Schlosstyp zur Diebstahlsicherung": "Kensington Slot",
        "Schnittstellen": "HDMI \u00a6 DisplayPort \u00a6 2 x USB 3.0 \u00a6 Kopfh\u00f6rer",
        "Schwenkwinkel": "90",
        "Seitenverh\u00e4ltnis": "16:9",
        "Stromverbrauch (Aus-Modus)": "0.3 Watt",
        "Stromverbrauch (typisch)": "25 Watt",
        "Stromverbrauch SDR (eingeschaltet)": "22 kWh/1.000 h",
        "Stromverbrauch im Standby-Modus": "0.5 Watt",
        "Transportbreite": "68.8 cm",
        "Transportgewicht": "6.9 kg",
        "Transporth\u00f6he": "13.7 cm",
        "Transporttiefe": "48.5 cm",
        "Typ": "Lautsprecher - Stereo",
        "VESA-Halterung": "100 x 100 mm",
        "Vertikaler Betrachtungswinkel": "178"
    },
    "raw_specifications_text": "Display-Typ: LED-hintergrundbeleuchteter LCD-Monitor / TFT-Aktivmatrix\nEnergie Effizienzklasse: Klasse E\nDiagonalabmessung: 68.6 cm (27\")\nIntegrierte Peripherieger\u00e4te: USB 3.0-Hub\nBildschirmtyp: VA\nSeitenverh\u00e4ltnis: 16:9\nNative Aufl\u00f6sung: Full HD (1080p) 1920 x 1080 bei 75 Hz\nPixelpitch: 0.311 mm\nHelligkeit: 250 cd/m\u00b2\nKontrast: 3000:1 / 80000000:1 (dynamisch)\nFarbunterst\u00fctzung: 16,7 Millionen Farben\nFarbraum: 72% NTSC, 96% sRGB\nReaktionszeit: 4 ms (gray-to-gray)\nHorizontale Bildwiederholrate: 30 - 85 kHz\nHorizontaler Betrachtungswinkel: 178\nVertikaler Betrachtungswinkel: 178\nBildschirmbeschichtung: Matt\nHintergrundbeleuchtungs-Technologie: LED-Hintergrundbeleuchtung\nOSD-Sprachen: Tschechisch, Englisch, Deutsch, Franz\u00f6sisch, Italienisch, Polnisch, Russisch, Spanisch, Holl\u00e4ndisch, Japanisch\nBesonderheiten: HDCP, Eco-Mode, Advanced Contrast Ratio (ACR), flimmerfreie Technologie, i-Style Color, 3 Side Borderless Design, Blue Light Reducer Function\nFarbe: Mattschwarz\nAbmessungen (Breite x Tiefe x H\u00f6he): 61.5 cm x 22.45 cm\nGewicht: 5.5 kg\nTyp: Lautsprecher - Stereo\nAusgangsleistung/Kanal: 2 Watt\nSchnittstellen: HDMI \u00a6 DisplayPort \u00a6 2 x USB 3.0 \u00a6 Kopfh\u00f6rer\nEinstellungen der Anzeigeposition: H\u00f6he, Pivot (Rotation), Drehung, Neigung\nNeigungswinkel: -5/+23\nSchwenkwinkel: 90\nRotationswinkel: 90\nH\u00f6heneinstellung: 150 mm\nVESA-Halterung: 100 x 100 mm\nLeistungsmerkmale: Slot f\u00fcr Sicherheitsschloss (Kabelschloss getrennt erh\u00e4ltlich)\nEnthaltene Kabel: 1 x USB-Kabel \u00a6 1 x HDMI-Kabel \u00a6 1 x Stromkabel\nKennzeichnung: VCCI, DDC-2B, DDC/CI, RoHS, WEEE, PSE Mark, REACH, TUV Bauart, ERP, REACH SvHC, UKCA\nSchlosstyp zur Diebstahlsicherung: Kensington Slot\nEingangsspannung: Wechselstrom 100-240 V (50/60 Hz)\nStromverbrauch SDR (eingeschaltet): 22 kWh/1.000 h\nStromverbrauch (typisch): 25 Watt\nStromverbrauch im Standby-Modus: 0.5 Watt\nStromverbrauch (Aus-Modus): 0.3 Watt\nTransportbreite: 68.8 cm\nTransporttiefe: 48.5 cm\nTransporth\u00f6he: 13.7 cm\nTransportgewicht: 6.9 kg",
    "reference_file": "offer_reference_677.json",
    "shop_name": "BA-Computer"
}