{
    "html_file": "offer_155_24.html",
    "name": "ASUS VA27EHF, 27\"",
    "offer_link": "https://ms-it-beratung.at/shop/details.php?art=433173&artname=ASUS+Eye+Care+VA27EHF+68.5cm+%2816%3A9%29+FHD+HDMI",
    "price": 196.0,
    "raw_specifications": {
        "AC Eingangsfrequenz": "50/60 Hz",
        "AC Eingangsspannung": "100 - 240 V",
        "AMD FreeSync": "Nein",
        "Abnehmbarer Standfu\u00df": "Ja",
        "Anzahl HDMI-Anschl\u00fcsse": "1",
        "Anzahl der Farben des Displays": "16,7 Millionen Farben",
        "Bildschirmdiagonale": "68,6 cm (27\")",
        "Bildschirmform": "Flach",
        "Bildschirmtechnologie": "LCD",
        "Bildwinkel, horizontal": "178\u00b0",
        "Bildwinkel, vertikal": "178\u00b0",
        "Blendfreier Bildschirm": "Ja",
        "Breite (ohne Standfu\u00df)": "612,4 mm",
        "Digital horizontale Frequenz": "30 - 120 kHz",
        "Digital vertikale Frequenz": "48 - 100 Hz",
        "Display-Aufl\u00f6sung": "1920 x 1080 Pixel",
        "Eingebaute Lautsprecher": "Nein",
        "Energieeffizienzklasse (SDR)": "E",
        "Energieeffizienzskala": "A bis G",
        "Energieverbrauch (SDR) pro 1.000 Stunden": "19 kWh",
        "Flimmerfreie Technologie": "Ja",
        "Fu\u00dffarbe": "Schwarz",
        "Ger\u00e4tebreite (inkl. Fu\u00df)": "612,4 mm",
        "Ger\u00e4teh\u00f6he (inkl. Fu\u00df)": "465,3 mm",
        "Ger\u00e4tetiefe (inkl. Fu\u00df)": "240 mm",
        "Gewicht (mit St\u00e4nder)": "3,85 kg",
        "Gewicht (ohne St\u00e4nder)": "3,28 kg",
        "HD-Typ": "Full HD",
        "HDMI": "Ja",
        "HDMI-Version": "1.4",
        "Helligkeit (typisch)": "250 cd/m\u00b2",
        "H\u00f6he (ohne Standfu\u00df)": "367 mm",
        "H\u00f6henverstellung": "Nein",
        "Integrierte Kamera": "Nein",
        "Integrierter USB-Hub": "Nein",
        "Kabelsperre-Slot": "Ja",
        "Kontrastverh\u00e4ltnis": "1300:1",
        "Kopfh\u00f6rerausgang": "Nein",
        "Low-Blue-Light-Technologie": "Ja",
        "Markenspezifische Technologien": "Augenpflege+",
        "Marktpositionierung": "Haus",
        "Maximale Bildwiederholrate": "100 Hz",
        "Mitgelieferte Kabel": "AC, HDMI",
        "NVIDIA G-SYNC": "Nein",
        "Natives Seitenverh\u00e4ltnis": "16:9",
        "Neigungsverstellung": "Ja",
        "Neigungswinkelbereich": "-5 - 23\u00b0",
        "Netzteiltyp": "Intern",
        "Paketgewicht": "5,53 kg",
        "Panel-Montage-Schnittstelle": "100 x 100 mm",
        "Panel-Typ": "IPS",
        "Pixel Abstand": "0,311 x 0,311 mm",
        "Produktfarbe": "Schwarz",
        "Reaktionszeit": "1 ms",
        "Schnellstart\u00fcbersicht": "Ja",
        "Sichtbare Gr\u00f6\u00dfe (horizontal)": "59,8 cm",
        "Sichtbare Gr\u00f6\u00dfe (vertikal)": "33,6 cm",
        "Slot-Typ Kabelsperre": "Kensington",
        "Spiel-Modus": "Ja",
        "Stromeingang": "Ja",
        "Stromverbrauch (PowerSave)": "0,5 W",
        "Stromverbrauch (Standardbetrieb)": "14,63 W",
        "Stromverbrauch (aus)": "0,3 W",
        "St\u00e4nder enthalten": "Ja",
        "Tiefe (ohne Standfu\u00df)": "47,2 mm",
        "Touchscreen": "Nein",
        "Typ der Hintergrundbeleuchtung": "LED",
        "VESA-Halterung": "Ja",
        "Verpackungsart": "Box",
        "Verpackungsbreite": "680 mm",
        "Verpackungsh\u00f6he": "475 mm",
        "Verpackungstiefe": "150 mm",
        "Vorderer Rahmen": "Schwarz",
        "Zertifizierung": "Energy Star EPEAT Bronze T\u00dcV Flicker-free T\u00dcV Low Blue Light"
    },
    "raw_specifications_text": "Bildschirmdiagonale: 68,6 cm (27\")\nDisplay-Aufl\u00f6sung: 1920 x 1080 Pixel\nNatives Seitenverh\u00e4ltnis: 16:9\nBildschirmtechnologie: LCD\nTouchscreen: Nein\nHD-Typ: Full HD\nPanel-Typ: IPS\nTyp der Hintergrundbeleuchtung: LED\nHelligkeit (typisch): 250 cd/m\u00b2\nReaktionszeit: 1 ms\nBlendfreier Bildschirm: Ja\nBildschirmform: Flach\nKontrastverh\u00e4ltnis: 1300:1\nMaximale Bildwiederholrate: 100 Hz\nBildwinkel, horizontal: 178\u00b0\nBildwinkel, vertikal: 178\u00b0\nAnzahl der Farben des Displays: 16,7 Millionen Farben\nPixel Abstand: 0,311 x 0,311 mm\nSichtbare Gr\u00f6\u00dfe (horizontal): 59,8 cm\nSichtbare Gr\u00f6\u00dfe (vertikal): 33,6 cm\nDigital horizontale Frequenz: 30 - 120 kHz\nDigital vertikale Frequenz: 48 - 100 Hz\nNVIDIA G-SYNC: Nein\nAMD FreeSync: Nein\nMarkenspezifische Technologien: Augenpflege+\nFlimmerfreie Technologie: Ja\nLow-Blue-Light-Technologie: Ja\nSpiel-Modus: Ja\nEingebaute Lautsprecher: Nein\nIntegrierte Kamera: Nein\nMarktpositionierung: Haus\nProduktfarbe: Schwarz\nVorderer Rahmen: Schwarz\nAbnehmbarer Standfu\u00df: Ja\nFu\u00dffarbe: Schwarz\nZertifizierung: Energy Star EPEAT Bronze T\u00dcV Flicker-free T\u00dcV Low Blue Light\nIntegrierter USB-Hub: Nein\nHDMI: Ja\nAnzahl HDMI-Anschl\u00fcsse: 1\nHDMI-Version: 1.4\nKopfh\u00f6rerausgang: Nein\nStromeingang: Ja\nVESA-Halterung: Ja\nPanel-Montage-Schnittstelle: 100 x 100 mm\nKabelsperre-Slot: Ja\nSlot-Typ Kabelsperre: Kensington\nH\u00f6henverstellung: Nein\nNeigungswinkelbereich: -5 - 23\u00b0\nNeigungsverstellung: Ja\nEnergieeffizienzklasse (SDR): E\nEnergieverbrauch (SDR) pro 1.000 Stunden: 19 kWh\nStromverbrauch (Standardbetrieb): 14,63 W\nStromverbrauch (aus): 0,3 W\nStromverbrauch (PowerSave): 0,5 W\nAC Eingangsspannung: 100 - 240 V\nAC Eingangsfrequenz: 50/60 Hz\nNetzteiltyp: Intern\nEnergieeffizienzskala: A bis G\nSt\u00e4nder enthalten: Ja\nMitgelieferte Kabel: AC, HDMI\nSchnellstart\u00fcbersicht: Ja\nGer\u00e4tebreite (inkl. Fu\u00df): 612,4 mm\nGer\u00e4tetiefe (inkl. Fu\u00df): 240 mm\nGer\u00e4teh\u00f6he (inkl. Fu\u00df): 465,3 mm\nGewicht (mit St\u00e4nder): 3,85 kg\nBreite (ohne Standfu\u00df): 612,4 mm\nTiefe (ohne Standfu\u00df): 47,2 mm\nH\u00f6he (ohne Standfu\u00df): 367 mm\nGewicht (ohne St\u00e4nder): 3,28 kg\nVerpackungsbreite: 680 mm\nVerpackungstiefe: 150 mm\nVerpackungsh\u00f6he: 475 mm\nPaketgewicht: 5,53 kg\nVerpackungsart: Box",
    "reference_file": "offer_reference_155.json",
    "shop_name": "ms-it-beratung"
}