{
    "html_file": "offer_866_4.html",
    "name": "iiyama ProLite XUB2492HSC-B1, 23.8\"",
    "offer_link": "https://www.electronicshop24.at/product_info.php?products_id=310000000909319500&ano=A-H909319500&mno=XUB2492HSC-B1&ean=4948570117888&utm_medium=cpc&utm_campaign=preisvergleich&utm_content=item&utm_source=geizhals&ref=geizhals",
    "price": 184.0,
    "raw_specifications": {
        "Abmessungen (Breite x Tiefe x H\u00f6he)": "53.95 cm x 21 cm x 36.65 cm",
        "Ausgangsleistung/Kanal": "2 Watt",
        "Besonderheiten": "Eco-Mode, Advanced Contrast Ratio (ACR), flimmerfreie Technologie, i-Style Color, an 3 Seiten ohne Blende, Blue Light Reducer Function",
        "Bildschirmbeschichtung": "Matt",
        "Bildschirmtyp": "IPS",
        "Diagonalabmessung": "61 cm (24\")",
        "Display-Typ": "LED-hintergrundbeleuchteter LCD-Monitor / TFT-Aktivmatrix",
        "ENERGY STAR zertifiziert": "Ja",
        "Eingangsspannung": "Wechselstrom 100-240 V (50/60 Hz)",
        "Einstellungen der Anzeigeposition": "H\u00f6he, Pivot (Rotation), Drehung, Neigung",
        "Energie Effizienzklasse": "Klasse F",
        "Enthaltene Kabel": "1 x HDMI-Kabel \u00a6 1 x USB-C Kabel",
        "Farbe": "Schwarz",
        "Farbraum": "72% NTSC, 99% sRGB",
        "Farbunterst\u00fctzung": "16,7 Millionen Farben",
        "Gewicht": "5.4 kg",
        "Helligkeit": "250 cd/m\u00b2",
        "Hintergrundbeleuchtungs-Technologie": "LED-Hintergrundbeleuchtung",
        "Horizontale Bildwiederholrate": "30 - 85 kHz",
        "Horizontaler Betrachtungswinkel": "178",
        "H\u00f6heneinstellung": "130 mm",
        "Integrierte Peripherieger\u00e4te": "USB 3.0-Hub",
        "Kennzeichnung": "TUV GS, DDC-2B, RoHS, WEEE, PSE Mark, REACH, ERP, VCCI Class B, EAC, REACH SvHC, HDCP, UKCA",
        "Kontrast": "1000:1 / 80000000:1 (dynamisch)",
        "Leistungsmerkmale": "Slot f\u00fcr Sicherheitsschloss (Kabelschloss getrennt erh\u00e4ltlich), abnehmbarer St\u00e4nder, Unterst\u00fctzung f\u00fcr VESA-Schnittstelle",
        "Max. Betriebstemperatur": "35 \u00b0C",
        "Min Betriebstemperatur": "5 \u00b0C",
        "Native Aufl\u00f6sung": "Full HD (1080p) 1920 x 1080 bei 75 Hz",
        "Neigungswinkel": "-5/+22",
        "OSD-Sprachen": "Tschechisch, Englisch, Deutsch, Franz\u00f6sisch, Italienisch, Polnisch, Russisch, Spanisch, Holl\u00e4ndisch, Japanisch",
        "Pixelpitch": "0.275 mm",
        "Reaktionszeit": "4 ms (gray-to-gray)",
        "Rotationswinkel": "90",
        "Schlosstyp zur Diebstahlsicherung": "Kensington Slot",
        "Schnittstellen": "DisplayPort (HDCP) \u00a6 HDMI (HDCP) \u00a6 USB-C (bis zu 65 W) \u00a6 2 x USB 3.0 \u00a6 Kopfh\u00f6rer (Mini-Klinkenstecker)",
        "Schwenkwinkel": "90",
        "Seitenverh\u00e4ltnis": "16:9",
        "Sichtbare Bildfl\u00e4che": "60.5 cm (23.8\")",
        "Stromverbrauch (Aus-Modus)": "0.5 Watt",
        "Stromverbrauch (typisch)": "19 Watt",
        "Stromverbrauch SDR (eingeschaltet)": "20 kWh/1.000 h",
        "Stromverbrauch im Standby-Modus": "0.5 Watt",
        "Transportbreite": "68.8 cm",
        "Transportgewicht": "7.2 kg",
        "Transporth\u00f6he": "40 cm",
        "Transporttiefe": "19.6 cm",
        "Typ": "Lautsprecher - Stereo",
        "VESA-Halterung": "100 x 100 mm",
        "Vertikaler Betrachtungswinkel": "178"
    },
    "raw_specifications_text": "Display-Typ: LED-hintergrundbeleuchteter LCD-Monitor / TFT-Aktivmatrix\nEnergie Effizienzklasse: Klasse F\nDiagonalabmessung: 61 cm (24\")\nSichtbare Bildfl\u00e4che: 60.5 cm (23.8\")\nIntegrierte Peripherieger\u00e4te: USB 3.0-Hub\nBildschirmtyp: IPS\nSeitenverh\u00e4ltnis: 16:9\nNative Aufl\u00f6sung: Full HD (1080p) 1920 x 1080 bei 75 Hz\nPixelpitch: 0.275 mm\nHelligkeit: 250 cd/m\u00b2\nKontrast: 1000:1 / 80000000:1 (dynamisch)\nFarbunterst\u00fctzung: 16,7 Millionen Farben\nFarbraum: 72% NTSC, 99% sRGB\nReaktionszeit: 4 ms (gray-to-gray)\nHorizontale Bildwiederholrate: 30 - 85 kHz\nHorizontaler Betrachtungswinkel: 178\nVertikaler Betrachtungswinkel: 178\nBildschirmbeschichtung: Matt\nHintergrundbeleuchtungs-Technologie: LED-Hintergrundbeleuchtung\nOSD-Sprachen: Tschechisch, Englisch, Deutsch, Franz\u00f6sisch, Italienisch, Polnisch, Russisch, Spanisch, Holl\u00e4ndisch, Japanisch\nBesonderheiten: Eco-Mode, Advanced Contrast Ratio (ACR), flimmerfreie Technologie, i-Style Color, an 3 Seiten ohne Blende, Blue Light Reducer Function\nFarbe: Schwarz\nAbmessungen (Breite x Tiefe x H\u00f6he): 53.95 cm x 21 cm x 36.65 cm\nGewicht: 5.4 kg\nTyp: Lautsprecher - Stereo\nAusgangsleistung/Kanal: 2 Watt\nSchnittstellen: DisplayPort (HDCP) \u00a6 HDMI (HDCP) \u00a6 USB-C (bis zu 65 W) \u00a6 2 x USB 3.0 \u00a6 Kopfh\u00f6rer (Mini-Klinkenstecker)\nEinstellungen der Anzeigeposition: H\u00f6he, Pivot (Rotation), Drehung, Neigung\nNeigungswinkel: -5/+22\nSchwenkwinkel: 90\nRotationswinkel: 90\nH\u00f6heneinstellung: 130 mm\nVESA-Halterung: 100 x 100 mm\nLeistungsmerkmale: Slot f\u00fcr Sicherheitsschloss (Kabelschloss getrennt erh\u00e4ltlich), abnehmbarer St\u00e4nder, Unterst\u00fctzung f\u00fcr VESA-Schnittstelle\nEnthaltene Kabel: 1 x HDMI-Kabel \u00a6 1 x USB-C Kabel\nKennzeichnung: TUV GS, DDC-2B, RoHS, WEEE, PSE Mark, REACH, ERP, VCCI Class B, EAC, REACH SvHC, HDCP, UKCA\nSchlosstyp zur Diebstahlsicherung: Kensington Slot\nEingangsspannung: Wechselstrom 100-240 V (50/60 Hz)\nStromverbrauch SDR (eingeschaltet): 20 kWh/1.000 h\nStromverbrauch (typisch): 19 Watt\nStromverbrauch im Standby-Modus: 0.5 Watt\nStromverbrauch (Aus-Modus): 0.5 Watt\nTransportbreite: 68.8 cm\nTransporttiefe: 19.6 cm\nTransporth\u00f6he: 40 cm\nTransportgewicht: 7.2 kg\nENERGY STAR zertifiziert: Ja\nMin Betriebstemperatur: 5 \u00b0C\nMax. Betriebstemperatur: 35 \u00b0C",
    "reference_file": "offer_reference_866.json",
    "shop_name": "ElectronicShop24"
}