{
    "html_file": "offer_539_4.html",
    "name": "ASUS ROG Strix XG32AQ, 32\"",
    "offer_link": "https://www.proshop.at/Bildschirm/ASUS-32-Bildschirm-ROG-Strix-XG32AQ-Black-1-ms-AMD-FreeSync-2/3150926?utm_source=geizhals&utm_medium=cpc&utm_campaign=pricesite",
    "price": 590.81,
    "raw_specifications": {
        "Abmessungen (Breite x Tiefe x H\u00f6he)": "72.818 cm x 27.993 cm x 45.987 cm - mit Fu\u00df",
        "Abmessungen (Breite x Tiefe x H\u00f6he) - mit Fu\u00df": "72.818 cm x 27.993 cm x 45.987 cm",
        "Adaptive-Sync Technologie": "AMD FreeSync Premium Pro, NVIDIA G-SYNC Compatible",
        "Besonderheiten": "Trace Free Technology, ASUS GamePlus, flimmerfreie Technologie, ASUS GameVisual Technology, ASUS Extreme Low Motion Blur technology, Low Blue Light-Technologie, Shadow Boost-Technologie, Multiple HDR-Modus, Display Widget, Stativgewinde, Delta E\u22642-Farbgenauigkeit, Variable Refresh Rate (VRR)",
        "Bildschirmbeschichtung": "Blendfrei",
        "Bildschirmtyp": "Fast IPS",
        "Details zu Abmessungen & Gewicht": "Ohne Fu\u00df - Breite: 72.818 cm - Tiefe: 8.712 cm - H\u00f6he: 42.852 cm - Gewicht: 5.77 kg  Mit Standfu\u00df (niedrigste Position) - Breite: 72.818 cm - Tiefe: 27.993 cm - H\u00f6he: 45.987 cm - Gewicht: 8.9 kg  Mit Standfu\u00df (h\u00f6chste Position) - Breite: 72.818 cm - Tiefe: 27.993 cm - H\u00f6he: 53.987 cm - Gewicht: 8.9 kg",
        "Diagonalabmessung": "81.3 cm (32\")",
        "Display-Typ": "LED-hintergrundbeleuchteter LCD-Monitor / TFT-Aktivmatrix",
        "EAN": "4711081847236",
        "Eingangsanschl\u00fcsse": "2xHDMI, DisplayPort",
        "Eingangsspannung": "Wechselstrom 100-240 V (50/60 Hz)",
        "Einstellungen der Anzeigeposition": "H\u00f6he, Drehung, Neigung",
        "Energie Effizienzklasse": "Klasse F",
        "Energieklasse (HDR)": "Klasse G",
        "Farbe": "Schwarz",
        "Farbraum": "130% sRGB, 96% DCI-P3",
        "Farbunterst\u00fctzung": "1,0737 Milliarden Farben (10-Bit)",
        "Gaming": "Ja",
        "Ger\u00e4tetyp": "LED-hintergrundbeleuchteter LCD-Monitor - 81.3 cm (32\")",
        "Gewicht": "8.9 kg",
        "HDR-Format": "HDR600",
        "HDR-Zertifizierung": "DisplayHDR 600",
        "HDR-f\u00e4hig": "HDR600 / DisplayHDR 600",
        "Helligkeit": "450 cd/m\u00b2",
        "Hersteller": "ASUS",
        "Hintergrundbeleuchtungs-Technologie": "LED-Hintergrundbeleuchtung",
        "Horizontaler Betrachtungswinkel": "178",
        "H\u00f6heneinstellung": "80 mm",
        "Integrierte Peripherieger\u00e4te": "USB 3.2 Gen 1 Hub",
        "Kennzeichnung": "TUV Rheinland Low Blue Light Certification, TUV Rheinland Flicker Free Certification, HDCP 2.2",
        "Kontrast": "1000:1 / 100000000:1 (dynamisch)",
        "Leistungsmerkmale": "Slot f\u00fcr Sicherheitsschloss (Kabelschloss getrennt erh\u00e4ltlich)",
        "Modell": "90LM08A0-B01170",
        "Native Aufl\u00f6sung": "WQHD 2560 x 1440 (DisplayPort(OC): 175 Hz, DisplayPort: 144 Hz, HDMI: 120 Hz)",
        "Neigungswinkel": "-5/+20",
        "Pixelpitch": "0.277 mm",
        "Produktbeschreibung": "ASUS ROG Strix XG32AQ - LED-Monitor - 81.3 cm (32\") - HDR",
        "Reaktionszeit": "1 ms (Gray-to-Gray)",
        "Schlosstyp zur Diebstahlsicherung": "Kensington Slot",
        "Schnittstellen": "DisplayPort 1.2  2 x HDMI  2 x USB 3.2 Gen 1 Downstream  Kopfh\u00f6rer  USB 3.2 Gen 1 Upstream",
        "Schwenkwinkel": "50",
        "Seitenverh\u00e4ltnis": "16:9",
        "Spannung": "Wechselstrom 100-240 V (50/60 Hz)",
        "Stromverbrauch (Aus-Modus)": "0.3 Watt",
        "Stromverbrauch (typisch)": "32 Watt",
        "Stromverbrauch HDR (eingeschaltet)": "74 kWh/1.000 h",
        "Stromverbrauch SDR (eingeschaltet)": "33 kWh/1.000 h",
        "Stromverbrauch im Standby-Modus": "0.5 Watt",
        "Transportbreite": "90 cm",
        "Transportgewicht": "13 kg",
        "Transporth\u00f6he": "52.6 cm",
        "Transporttiefe": "22.6 cm",
        "VESA-Halterung": "100 x 100 mm",
        "Vertikaler Betrachtungswinkel": "178",
        "Waren-Nr.": "3150926",
        "Zubeh\u00f6r im Lieferumfang": "4 Schrauben, ROG-Tasche, ROG-Sticker",
        "Zum Hersteller": "www.asus.com/"
    },
    "raw_specifications_text": "Hersteller: ASUS\nWaren-Nr.: 3150926\nModell: 90LM08A0-B01170\nEAN: 4711081847236\nZum Hersteller: www.asus.com/\nProduktbeschreibung: ASUS ROG Strix XG32AQ - LED-Monitor - 81.3 cm (32\") - HDR\nGer\u00e4tetyp: LED-hintergrundbeleuchteter LCD-Monitor - 81.3 cm (32\")\nEnergie Effizienzklasse: Klasse F\nAdaptive-Sync Technologie: AMD FreeSync Premium Pro, NVIDIA G-SYNC Compatible\nLeistungsmerkmale: Slot f\u00fcr Sicherheitsschloss (Kabelschloss getrennt erh\u00e4ltlich)\nBildschirmtyp: Fast IPS\nSeitenverh\u00e4ltnis: 16:9\nNative Aufl\u00f6sung: WQHD 2560 x 1440 (DisplayPort(OC): 175 Hz, DisplayPort: 144 Hz, HDMI: 120 Hz)\nPixelpitch: 0.277 mm\nHelligkeit: 450 cd/m\u00b2\nKontrast: 1000:1 / 100000000:1 (dynamisch)\nHDR-f\u00e4hig: HDR600 / DisplayHDR 600\nReaktionszeit: 1 ms (Gray-to-Gray)\nGaming: Ja\nFarbunterst\u00fctzung: 1,0737 Milliarden Farben (10-Bit)\nFarbraum: 130% sRGB, 96% DCI-P3\nEingangsanschl\u00fcsse: 2xHDMI, DisplayPort\nEinstellungen der Anzeigeposition: H\u00f6he, Drehung, Neigung\nBildschirmbeschichtung: Blendfrei\nSpannung: Wechselstrom 100-240 V (50/60 Hz)\nFarbe: Schwarz\nAbmessungen (Breite x Tiefe x H\u00f6he) - mit Fu\u00df: 72.818 cm x 27.993 cm x 45.987 cm\nGewicht: 8.9 kg\nKennzeichnung: TUV Rheinland Low Blue Light Certification, TUV Rheinland Flicker Free Certification, HDCP 2.2\nDisplay-Typ: LED-hintergrundbeleuchteter LCD-Monitor / TFT-Aktivmatrix\nEnergieklasse (HDR): Klasse G\nDiagonalabmessung: 81.3 cm (32\")\nIntegrierte Peripherieger\u00e4te: USB 3.2 Gen 1 Hub\nHDR-Format: HDR600\nHDR-Zertifizierung: DisplayHDR 600\nHorizontaler Betrachtungswinkel: 178\nVertikaler Betrachtungswinkel: 178\nHintergrundbeleuchtungs-Technologie: LED-Hintergrundbeleuchtung\nBesonderheiten: Trace Free Technology, ASUS GamePlus, flimmerfreie Technologie, ASUS GameVisual Technology, ASUS Extreme Low Motion Blur technology, Low Blue Light-Technologie, Shadow Boost-Technologie, Multiple HDR-Modus, Display Widget, Stativgewinde, Delta E\u22642-Farbgenauigkeit, Variable Refresh Rate (VRR)\nAbmessungen (Breite x Tiefe x H\u00f6he): 72.818 cm x 27.993 cm x 45.987 cm - mit Fu\u00df\nSchnittstellen: DisplayPort 1.2  2 x HDMI  2 x USB 3.2 Gen 1 Downstream  Kopfh\u00f6rer  USB 3.2 Gen 1 Upstream\nNeigungswinkel: -5/+20\nSchwenkwinkel: 50\nH\u00f6heneinstellung: 80 mm\nVESA-Halterung: 100 x 100 mm\nZubeh\u00f6r im Lieferumfang: 4 Schrauben, ROG-Tasche, ROG-Sticker\nSchlosstyp zur Diebstahlsicherung: Kensington Slot\nEingangsspannung: Wechselstrom 100-240 V (50/60 Hz)\nStromverbrauch SDR (eingeschaltet): 33 kWh/1.000 h\nStromverbrauch HDR (eingeschaltet): 74 kWh/1.000 h\nStromverbrauch (typisch): 32 Watt\nStromverbrauch im Standby-Modus: 0.5 Watt\nStromverbrauch (Aus-Modus): 0.3 Watt\nDetails zu Abmessungen & Gewicht: Ohne Fu\u00df - Breite: 72.818 cm - Tiefe: 8.712 cm - H\u00f6he: 42.852 cm - Gewicht: 5.77 kg  Mit Standfu\u00df (niedrigste Position) - Breite: 72.818 cm - Tiefe: 27.993 cm - H\u00f6he: 45.987 cm - Gewicht: 8.9 kg  Mit Standfu\u00df (h\u00f6chste Position) - Breite: 72.818 cm - Tiefe: 27.993 cm - H\u00f6he: 53.987 cm - Gewicht: 8.9 kg\nTransportbreite: 90 cm\nTransporttiefe: 22.6 cm\nTransporth\u00f6he: 52.6 cm\nTransportgewicht: 13 kg",
    "reference_file": "offer_reference_539.json",
    "shop_name": "Proshop.at"
}