{
    "html_file": "offer_2454_8.html",
    "name": "Dell P1917S schwarz, 19\"",
    "offer_link": "https://www.mylemon.at/artikel/dell/dell_p1917se/19-monitor-p1917s-48cm-19.html",
    "price": 197.98,
    "raw_specifications": {
        "3D": "Nein",
        "AC Eingangsfrequenz": "50 - 60 Hz",
        "AC Eingangsspannung": "100 - 240 V",
        "AMD FreeSync": "Nein",
        "Anzahl DisplayPort Anschl\u00fcsse": "1",
        "Anzahl HDMI-Anschl\u00fcsse": "1",
        "Anzahl VGA (D-Sub) Anschl\u00fcsse": "1",
        "Anzahl der Farben des Displays": "16,78 Millionen Farben",
        "Anzahl der nachgeschalteten Steckpl\u00e4tze vom Typ USB-A": "4",
        "Anzahl der vorgeschalteten Steckpl\u00e4tze": "1",
        "Artikelnummer": "M1FY8W7L",
        "Aufl\u00f6sung": "1280x1024",
        "Besonderheiten": "USB HUB",
        "Betriebstemperatur": "0 - 40 \u00b0C",
        "Bildschirmdiagonale": "48,3 cm (19\")",
        "Bildschirmform": "Flach",
        "Bildschirmtechnologie": "LCD",
        "Bildwinkel, horizontal": "178\u00b0",
        "Bildwinkel, vertikal": "178\u00b0",
        "Breite (ohne Standfu\u00df)": "405,6 mm",
        "DVI Anschluss": "Nein",
        "Display": "LED",
        "Display-Aufl\u00f6sung": "1280 x 1024 Pixel",
        "Displaygr\u00f6\u00dfe": "19 Zoll",
        "EAN": "5397184200384",
        "Eingangsstrom": "1.5 A",
        "Eingebaute Lautsprecher": "Nein",
        "Energieeffizienzklasse (HDR)": "Nicht verf\u00fcgbar",
        "Energieeffizienzklasse (SDR)": "D",
        "Energieeffizienzklasse (alt)": "A+",
        "Energieverbrauch (SDR) pro 1.000 Stunden": "11 kWh",
        "Ergonomie": "H\u00f6henverstellbar, Pivot (90 Grad drehbar), Schwenkbar, Neigbar",
        "Ger\u00e4tebreite (inkl. Fu\u00df)": "405,6 mm",
        "Ger\u00e4teh\u00f6he (inkl. Fu\u00df)": "499,3 mm",
        "Ger\u00e4tetiefe (inkl. Fu\u00df)": "180 mm",
        "Gewicht (mit St\u00e4nder)": "5,13 kg",
        "Gewicht (ohne St\u00e4nder)": "2,6 kg",
        "HD-Typ": "SXGA",
        "HDMI": "Ja",
        "Helligkeit": "250 cd/m\u00b2",
        "Helligkeit (typisch)": "250 cd/m\u00b2",
        "Hersteller Artikelnummer": "DELL-P1917SE",
        "High Dynamic Range Video (HDR) Unterst\u00fctzung": "Nein",
        "Horizontaler Scanbereich": "30 - 81 kHz",
        "H\u00f6he (ohne Standfu\u00df)": "334,3 mm",
        "H\u00f6he bei Betrieb": "0 - 5000 m",
        "H\u00f6he bei Lagerung": "5000 - 12192 m",
        "H\u00f6heneinstellung": "13 cm",
        "H\u00f6henverstellung": "Ja",
        "Integrierte Kamera": "Nein",
        "Integrierter USB-Hub": "Ja",
        "J\u00e4hrlicher Energieverbrauch": "17 kWh",
        "Kabelsperre-Slot": "Nein",
        "Konformit\u00e4t mit Industriestandards": "TCO",
        "Kontrastverh\u00e4ltnis": "1000:1",
        "Kontrastverh\u00e4ltnis (dynamisch)": "4000000:1",
        "Luftfeuchtigkeit bei Lagerung": "10 - 90%",
        "Marktpositionierung": "Haus",
        "Maximale Bildwiederholrate": "60 Hz",
        "Mitgelieferte Kabel": "AC, DisplayPort, USB, VGA",
        "NVIDIA G-SYNC": "Nein",
        "Nachhaltigkeitszertifikate": "ENERGY STAR",
        "Natives Seitenverh\u00e4ltnis": "5:4",
        "Neigungsverstellung": "Ja",
        "Neigungswinkelbereich": "-5 - 21\u00b0",
        "Netzteiltyp": "Intern",
        "Panel": "IPS",
        "Panel-Montage-Schnittstelle": "100 x 100 mm",
        "Panel-Typ": "IPS",
        "Pivot": "Ja",
        "Pivot Winkel": "-90 - 90\u00b0",
        "Pixel Abstand": "0,293 x 0,293 mm",
        "Pixeldichte": "86 ppi",
        "Produktfarbe": "Schwarz",
        "Reaktionszeit": "6 ms",
        "Relative Luftfeuchtigkeit in Betrieb": "20 - 80%",
        "Schwenkbar": "Ja",
        "Schwenkwinkelbereich": "-45 - 45\u00b0",
        "Sichtbare Gr\u00f6\u00dfe (diagonal)": "48 cm",
        "Sichtbare Gr\u00f6\u00dfe (horizontal)": "37,5 cm",
        "Sichtbare Gr\u00f6\u00dfe (vertikal)": "30 cm",
        "Stromverbrauch (PowerSave)": "13 W",
        "Stromverbrauch (Standardbetrieb)": "14 W",
        "Stromverbrauch (Standby)": "0,3 W",
        "Stromverbrauch (aus)": "0,3 W",
        "Stromverbrauch (max.)": "38 W",
        "St\u00e4nder enthalten": "Ja",
        "TV Tuner integriert": "Nein",
        "Temperaturbereich bei Lagerung": "-20 - 60 \u00b0C",
        "Thin Client installiert": "Nein",
        "Tiefe (ohne Standfu\u00df)": "50,3 mm",
        "Touchscreen": "Nein",
        "Typ der Hintergrundbeleuchtung": "LED",
        "USB-Hub-Version": "3.2 Gen 1 (3.1 Gen 1)",
        "USB-Upstream-Porttyp": "USB Typ-B",
        "Unterst\u00fctzte Grafik-Aufl\u00f6sungen": "1280 x 1024 (SXGA)",
        "VESA Halterung": "100x100 mm",
        "VESA-Halterung": "Ja",
        "Vertikaler Scanbereich": "56 - 76 Hz",
        "Video Anschl\u00fcsse": "1x VGA, 1x HDMI",
        "WLAN": "Nein"
    },
    "raw_specifications_text": "Displaygr\u00f6\u00dfe: 19 Zoll\nAufl\u00f6sung: 1280x1024\nPanel: IPS\nReaktionszeit: 6 ms\nVideo Anschl\u00fcsse: 1x VGA, 1x HDMI\nErgonomie: H\u00f6henverstellbar, Pivot (90 Grad drehbar), Schwenkbar, Neigbar\nVESA Halterung: 100x100 mm\nHelligkeit: 250 cd/m\u00b2\nBesonderheiten: USB HUB\nHersteller Artikelnummer: DELL-P1917SE\nEAN: 5397184200384\nArtikelnummer: M1FY8W7L\nBildschirmdiagonale: 48,3 cm (19\")\nDisplay-Aufl\u00f6sung: 1280 x 1024 Pixel\nNatives Seitenverh\u00e4ltnis: 5:4\nBildschirmtechnologie: LCD\nTouchscreen: Nein\nHD-Typ: SXGA\nPanel-Typ: IPS\nBildschirmform: Flach\nKontrastverh\u00e4ltnis: 1000:1\nMaximale Bildwiederholrate: 60 Hz\nAnzahl der Farben des Displays: 16,78 Millionen Farben\nTyp der Hintergrundbeleuchtung: LED\nHelligkeit (typisch): 250 cd/m\u00b2\nUnterst\u00fctzte Grafik-Aufl\u00f6sungen: 1280 x 1024 (SXGA)\nKontrastverh\u00e4ltnis (dynamisch): 4000000:1\nBildwinkel, horizontal: 178\u00b0\nBildwinkel, vertikal: 178\u00b0\nPixel Abstand: 0,293 x 0,293 mm\nPixeldichte: 86 ppi\nHorizontaler Scanbereich: 30 - 81 kHz\nVertikaler Scanbereich: 56 - 76 Hz\nSichtbare Gr\u00f6\u00dfe (horizontal): 37,5 cm\nSichtbare Gr\u00f6\u00dfe (vertikal): 30 cm\nSichtbare Gr\u00f6\u00dfe (diagonal): 48 cm\nHigh Dynamic Range Video (HDR) Unterst\u00fctzung: Nein\n3D: Nein\nNVIDIA G-SYNC: Nein\nAMD FreeSync: Nein\nEingebaute Lautsprecher: Nein\nIntegrierte Kamera: Nein\nMarktpositionierung: Haus\nProduktfarbe: Schwarz\nKonformit\u00e4t mit Industriestandards: TCO\nIntegrierter USB-Hub: Ja\nHDMI: Ja\nUSB-Hub-Version: 3.2 Gen 1 (3.1 Gen 1)\nUSB-Upstream-Porttyp: USB Typ-B\nAnzahl der vorgeschalteten Steckpl\u00e4tze: 1\nAnzahl der nachgeschalteten Steckpl\u00e4tze vom Typ USB-A: 4\nAnzahl VGA (D-Sub) Anschl\u00fcsse: 1\nDVI Anschluss: Nein\nAnzahl HDMI-Anschl\u00fcsse: 1\nAnzahl DisplayPort Anschl\u00fcsse: 1\nWLAN: Nein\nVESA-Halterung: Ja\nKabelsperre-Slot: Nein\nH\u00f6henverstellung: Ja\nPanel-Montage-Schnittstelle: 100 x 100 mm\nH\u00f6heneinstellung: 13 cm\nPivot: Ja\nPivot Winkel: -90 - 90\u00b0\nSchwenkbar: Ja\nSchwenkwinkelbereich: -45 - 45\u00b0\nNeigungswinkelbereich: -5 - 21\u00b0\nNeigungsverstellung: Ja\nEnergieeffizienzklasse (SDR): D\nEnergieeffizienzklasse (HDR): Nicht verf\u00fcgbar\nEnergieverbrauch (SDR) pro 1.000 Stunden: 11 kWh\nStromverbrauch (Standardbetrieb): 14 W\nStromverbrauch (Standby): 0,3 W\nStromverbrauch (max.): 38 W\nStromverbrauch (aus): 0,3 W\nStromverbrauch (PowerSave): 13 W\nAC Eingangsspannung: 100 - 240 V\nAC Eingangsfrequenz: 50 - 60 Hz\nEingangsstrom: 1.5 A\nNetzteiltyp: Intern\nJ\u00e4hrlicher Energieverbrauch: 17 kWh\nBetriebstemperatur: 0 - 40 \u00b0C\nTemperaturbereich bei Lagerung: -20 - 60 \u00b0C\nRelative Luftfeuchtigkeit in Betrieb: 20 - 80%\nLuftfeuchtigkeit bei Lagerung: 10 - 90%\nH\u00f6he bei Betrieb: 0 - 5000 m\nH\u00f6he bei Lagerung: 5000 - 12192 m\nSt\u00e4nder enthalten: Ja\nMitgelieferte Kabel: AC, DisplayPort, USB, VGA\nGer\u00e4tebreite (inkl. Fu\u00df): 405,6 mm\nGer\u00e4tetiefe (inkl. Fu\u00df): 180 mm\nGer\u00e4teh\u00f6he (inkl. Fu\u00df): 499,3 mm\nGewicht (mit St\u00e4nder): 5,13 kg\nBreite (ohne Standfu\u00df): 405,6 mm\nTiefe (ohne Standfu\u00df): 50,3 mm\nH\u00f6he (ohne Standfu\u00df): 334,3 mm\nGewicht (ohne St\u00e4nder): 2,6 kg\nNachhaltigkeitszertifikate: ENERGY STAR\nThin Client installiert: Nein\nDisplay: LED\nTV Tuner integriert: Nein\nEnergieeffizienzklasse (alt): A+",
    "reference_file": "offer_reference_2454.json",
    "shop_name": "mylemon.at"
}