{
    "html_file": "offer_361_31.html",
    "name": "LG 24BR550Y-C, 23.8\"",
    "offer_link": "https://ms-it-beratung.at/shop/details.php?art=425411&artname=LG+24%22+24BR550Y-C+Full+HD+DVI+DP+HDMI+USB+IPS+16%3A9+black",
    "price": 178.0,
    "raw_specifications": {
        "AC Eingangsfrequenz": "50 - 60 Hz",
        "AC Eingangsspannung": "110 - 240 V",
        "AMD FreeSync": "Nein",
        "Anzahl DisplayPort Anschl\u00fcsse": "1",
        "Anzahl OSD-Sprachen": "14",
        "Anzahl der Farben des Displays": "16,7 Millionen Farben",
        "Anzahl der Lautsprecher": "2",
        "Anzahl der nachgeschalteten Steckpl\u00e4tze vom Typ USB-A": "2",
        "Bildschirmdiagonale": "60,5 cm (23.8\")",
        "Bildschirmdiagonale (cm)": "60,4 cm",
        "Bildschirmform": "Flach",
        "Bildwinkel, horizontal": "178\u00b0",
        "Bildwinkel, vertikal": "178\u00b0",
        "Blendfreier Bildschirm": "Ja",
        "Breite (ohne Standfu\u00df)": "539,6 mm",
        "DVI Anschluss": "Ja",
        "Display-Aufl\u00f6sung": "1920 x 1080 Pixel",
        "DisplayPorts-Version": "1.2",
        "Eingebaute Lautsprecher": "Ja",
        "Energieeffizienzklasse (SDR)": "E",
        "Energieverbrauch (SDR) pro 1.000 Stunden": "15 kWh",
        "Flimmerfreie Technologie": "Ja",
        "Ger\u00e4tebreite (inkl. Fu\u00df)": "539,6 mm",
        "Ger\u00e4teh\u00f6he (inkl. Fu\u00df)": "548 mm",
        "Ger\u00e4tetiefe (inkl. Fu\u00df)": "256 mm",
        "Gewicht (mit St\u00e4nder)": "6,3 kg",
        "HD-Typ": "Full HD",
        "HDMI": "Ja",
        "Helligkeit (typisch)": "250 cd/m\u00b2",
        "H\u00f6he (ohne Standfu\u00df)": "323 mm",
        "H\u00f6heneinstellung": "13 cm",
        "H\u00f6henverstellung": "Ja",
        "Integrierte Kamera": "Nein",
        "Integrierter USB-Hub": "Nein",
        "Kabelsperre-Slot": "Nein",
        "Kontrastverh\u00e4ltnis": "1000:1",
        "Kopfh\u00f6rerausgang": "Ja",
        "Markenspezifische Technologien": "Crosshair",
        "Men\u00fcsprachen": "Deutsch, Englisch, Franz\u00f6sisch, Hindi, Italienisch, Polnisch, Portugiesisch, Russisch, Ukrainisch",
        "NVIDIA G-SYNC": "Nein",
        "Natives Seitenverh\u00e4ltnis": "16:9",
        "Neigungsverstellung": "Ja",
        "Neigungswinkelbereich": "5 - 25\u00b0",
        "Oberfl\u00e4chenh\u00e4rte": "3H",
        "Paketgewicht": "7,9 kg",
        "Panel-Typ": "IPS",
        "Pivot": "Ja",
        "Pivot Winkel": "-30 - 30\u00b0",
        "Pixel Abstand": "0,2745 x 0,2745 mm",
        "Produktfarbe": "Schwarz",
        "RGB-Farbraum": "NTSC",
        "Reaktionszeit": "5 ms",
        "Schwenkbar": "Ja",
        "Stromverbrauch (Standardbetrieb)": "25 W",
        "Stromverbrauch (Standby)": "0,3 W",
        "Stromverbrauch (aus)": "0,3 W",
        "Tiefe (ohne Standfu\u00df)": "50 mm",
        "Touchscreen": "Nein",
        "Typ der Hintergrundbeleuchtung": "LED",
        "USB-Upstream-Porttyp": "USB Typ-A",
        "VESA-Halterung": "Nein",
        "Verpackungsbreite": "613 mm",
        "Verpackungsh\u00f6he": "491 mm",
        "Verpackungstiefe": "184 mm"
    },
    "raw_specifications_text": "Bildschirmdiagonale: 60,5 cm (23.8\")\nDisplay-Aufl\u00f6sung: 1920 x 1080 Pixel\nNatives Seitenverh\u00e4ltnis: 16:9\nTouchscreen: Nein\nHD-Typ: Full HD\nPanel-Typ: IPS\nTyp der Hintergrundbeleuchtung: LED\nHelligkeit (typisch): 250 cd/m\u00b2\nReaktionszeit: 5 ms\nBlendfreier Bildschirm: Ja\nBildschirmform: Flach\nKontrastverh\u00e4ltnis: 1000:1\nBildwinkel, horizontal: 178\u00b0\nBildwinkel, vertikal: 178\u00b0\nAnzahl der Farben des Displays: 16,7 Millionen Farben\nPixel Abstand: 0,2745 x 0,2745 mm\nBildschirmdiagonale (cm): 60,4 cm\nOberfl\u00e4chenh\u00e4rte: 3H\nRGB-Farbraum: NTSC\nNVIDIA G-SYNC: Nein\nAMD FreeSync: Nein\nMarkenspezifische Technologien: Crosshair\nFlimmerfreie Technologie: Ja\nEingebaute Lautsprecher: Ja\nIntegrierte Kamera: Nein\nAnzahl der Lautsprecher: 2\nProduktfarbe: Schwarz\nIntegrierter USB-Hub: Nein\nUSB-Upstream-Porttyp: USB Typ-A\nAnzahl der nachgeschalteten Steckpl\u00e4tze vom Typ USB-A: 2\nDVI Anschluss: Ja\nHDMI: Ja\nAnzahl DisplayPort Anschl\u00fcsse: 1\nDisplayPorts-Version: 1.2\nKopfh\u00f6rerausgang: Ja\nVESA-Halterung: Nein\nKabelsperre-Slot: Nein\nH\u00f6henverstellung: Ja\nH\u00f6heneinstellung: 13 cm\nPivot: Ja\nPivot Winkel: -30 - 30\u00b0\nSchwenkbar: Ja\nNeigungswinkelbereich: 5 - 25\u00b0\nMen\u00fcsprachen: Deutsch, Englisch, Franz\u00f6sisch, Hindi, Italienisch, Polnisch, Portugiesisch, Russisch, Ukrainisch\nAnzahl OSD-Sprachen: 14\nNeigungsverstellung: Ja\nEnergieeffizienzklasse (SDR): E\nEnergieverbrauch (SDR) pro 1.000 Stunden: 15 kWh\nStromverbrauch (Standardbetrieb): 25 W\nStromverbrauch (Standby): 0,3 W\nStromverbrauch (aus): 0,3 W\nAC Eingangsspannung: 110 - 240 V\nAC Eingangsfrequenz: 50 - 60 Hz\nGer\u00e4tebreite (inkl. Fu\u00df): 539,6 mm\nGer\u00e4tetiefe (inkl. Fu\u00df): 256 mm\nGer\u00e4teh\u00f6he (inkl. Fu\u00df): 548 mm\nGewicht (mit St\u00e4nder): 6,3 kg\nBreite (ohne Standfu\u00df): 539,6 mm\nTiefe (ohne Standfu\u00df): 50 mm\nH\u00f6he (ohne Standfu\u00df): 323 mm\nVerpackungsbreite: 613 mm\nVerpackungstiefe: 184 mm\nVerpackungsh\u00f6he: 491 mm\nPaketgewicht: 7,9 kg",
    "reference_file": "offer_reference_361.json",
    "shop_name": "ms-it-beratung"
}