{
    "html_file": "offer_2042_24.html",
    "name": "ASUS TUF Gaming VG249Q, 23.8\"",
    "offer_link": "https://technikladen.at/P-ASUS-TUF-Gaming-VG249Q-605-cm-238-Zoll-1920-x-1080-Pixel-Full-HD-LED-1-ms-Schwarz?tl=gzhls",
    "price": 235.23,
    "raw_specifications": {
        "3D": "Nein",
        "AMD FreeSync": "Ja",
        "AMD FreeSync-Typ": "FreeSync",
        "Anzahl DisplayPort Anschl\u00fcsse": "1",
        "Anzahl HDMI-Anschl\u00fcsse": "1",
        "Anzahl OSD-Sprachen": "21",
        "Anzahl VGA (D-Sub) Anschl\u00fcsse": "1",
        "Anzahl der Farben des Displays": "16,78 Millionen Farben",
        "Anzahl der Lautsprecher": "2",
        "Audioanschl\u00fcsse": "Ja",
        "Bildschirmaufl\u00f6sung": "1920 x 1080 Pixel",
        "Bildschirmdiagonale": "60,5 cm",
        "Bildschirmform": "Flach",
        "Bildschirmtechnologie": "LED",
        "Bildwinkel, horizontal": "178 \u00b0",
        "Bildwinkel, vertikal": "178 \u00b0",
        "Breite (ohne Standfu\u00df)": "54 cm",
        "DVI Anschluss": "Nein",
        "Digital horizontale Frequenz": "30 - 180 kHz",
        "Digital vertikale Frequenz": "48 - 144 Hz",
        "Display-Oberfl\u00e4che": "Matt",
        "Eingebaute Lautsprecher": "Ja",
        "Energieeffizienzklasse (SDR)": "F",
        "Energieeffizienzskala": "A bis G",
        "Energieverbrauch (SDR) pro 1.000 Stunden": "22 kWh",
        "Flimmerfreie Technologie": "Ja",
        "Ger\u00e4tebreite (inkl. Fu\u00df)": "540,5 mm",
        "Ger\u00e4teh\u00f6he (inkl. Fu\u00df)": "515 mm",
        "Ger\u00e4tetiefe (inkl. Fu\u00df)": "217,6 mm",
        "Gewicht (mit St\u00e4nder)": "6,5 kg",
        "Gewicht (ohne St\u00e4nder)": "6,5 kg",
        "HD-Typ": "Full HD",
        "HDCP": "Ja",
        "HDMI": "Ja",
        "Helligkeit (typisch)": "250 cd/m\u00b2",
        "H\u00f6he (ohne Standfu\u00df)": "32,5 cm",
        "H\u00f6heneinstellung": "15 cm",
        "H\u00f6henverstellung": "Ja",
        "Integrierte Kamera": "Nein",
        "Integrierter USB-Hub": "Nein",
        "Kabelsperre-Slot": "Ja",
        "Kontrastverh\u00e4ltnis": "1000:1",
        "Kopfh\u00f6rerausgang": "Nein",
        "Low-Blue-Light-Technologie": "Ja",
        "Marktpositionierung": "Gaming",
        "Maximale Bildwiederholrate": "144 Hz",
        "Men\u00fcsprachen": "Simplified Chinese, Traditional Chinese, Croatian, Czech, German, Dutch, English, Spanish, French, Hungarian, Indonesian, Italian, Japanese, Korean, Persian, Polish, Portuguese, Romanian, Russian, Thai, Turkish",
        "NTSC Abdeckung (typisch)": "72 %",
        "NVIDIA G-SYNC": "Nein",
        "Natives Seitenverh\u00e4ltnis": "16:9",
        "Neigungswinkelbereich": "-5 - 20 \u00b0",
        "On-Screen-Display (OSD)": "Ja",
        "Paketgewicht": "9 kg",
        "Panel-Montage-Schnittstelle": "100 x 100 mm",
        "Panel-Typ": "IPS",
        "Pivot": "Ja",
        "Pivot Winkel": "-90 - 90 \u00b0",
        "Pixel Abstand": "0,275 x 0,275 mm",
        "Produktfarbe": "Schwarz",
        "RMS-Leistung": "4 W",
        "Rahmenloses Design": "Ja",
        "Reaktionszeit": "1 ms",
        "Reaktionszeit (schnell)": "1 ms",
        "Schwenkbar": "Ja",
        "Schwenkwinkelbereich": "-62 - 62 \u00b0",
        "Sichtbare Gr\u00f6\u00dfe (horizontal)": "52,7 cm",
        "Sichtbare Gr\u00f6\u00dfe (vertikal)": "29,6 cm",
        "Slot-Typ Kabelsperre": "Kensington",
        "Stromeingang": "Ja",
        "Stromverbrauch (PowerSave)": "0,5 W",
        "Stromverbrauch (Standardbetrieb)": "21,7 W",
        "Stromverbrauch (Standby)": "0,3 W",
        "Stromverbrauch (aus)": "0,2 W",
        "TV Tuner integriert": "Nein",
        "Tiefe (ohne Standfu\u00df)": "5,17 cm",
        "VESA Adaptive Sync unterst\u00fctzt": "Ja",
        "VESA-Halterung": "Ja",
        "Verpackungsbreite": "723 mm",
        "Verpackungsh\u00f6he": "400 mm",
        "Verpackungstiefe": "200 mm",
        "Warentarifnummer (HS)": "85285210",
        "kippbar": "Ja"
    },
    "raw_specifications_text": "NVIDIA G-SYNC: Nein\nAMD FreeSync: Ja\nAMD FreeSync-Typ: FreeSync\nVESA Adaptive Sync unterst\u00fctzt: Ja\nFlimmerfreie Technologie: Ja\nLow-Blue-Light-Technologie: Ja\nBildschirmdiagonale: 60,5 cm\nBildschirmaufl\u00f6sung: 1920 x 1080 Pixel\nNatives Seitenverh\u00e4ltnis: 16:9\nPanel-Typ: IPS\nHelligkeit (typisch): 250 cd/m\u00b2\nReaktionszeit: 1 ms\nHD-Typ: Full HD\nBildschirmtechnologie: LED\nDisplay-Oberfl\u00e4che: Matt\nBildschirmform: Flach\nKontrastverh\u00e4ltnis: 1000:1\nMaximale Bildwiederholrate: 144 Hz\nBildwinkel, horizontal: 178 \u00b0\nBildwinkel, vertikal: 178 \u00b0\nAnzahl der Farben des Displays: 16,78 Millionen Farben\nReaktionszeit (schnell): 1 ms\nPixel Abstand: 0,275 x 0,275 mm\nSichtbare Gr\u00f6\u00dfe (horizontal): 52,7 cm\nSichtbare Gr\u00f6\u00dfe (vertikal): 29,6 cm\nDigital horizontale Frequenz: 30 - 180 kHz\nDigital vertikale Frequenz: 48 - 144 Hz\nNTSC Abdeckung (typisch): 72 %\nIntegrierter USB-Hub: Nein\nAnzahl VGA (D-Sub) Anschl\u00fcsse: 1\nDVI Anschluss: Nein\nHDMI: Ja\nAnzahl HDMI-Anschl\u00fcsse: 1\nAnzahl DisplayPort Anschl\u00fcsse: 1\nAudioanschl\u00fcsse: Ja\nKopfh\u00f6rerausgang: Nein\nHDCP: Ja\nStromeingang: Ja\nVESA-Halterung: Ja\nPanel-Montage-Schnittstelle: 100 x 100 mm\nKabelsperre-Slot: Ja\nSlot-Typ Kabelsperre: Kensington\nH\u00f6henverstellung: Ja\nH\u00f6heneinstellung: 15 cm\nPivot: Ja\nPivot Winkel: -90 - 90 \u00b0\nSchwenkbar: Ja\nSchwenkwinkelbereich: -62 - 62 \u00b0\nkippbar: Ja\nNeigungswinkelbereich: -5 - 20 \u00b0\nOn-Screen-Display (OSD): Ja\nMen\u00fcsprachen: Simplified Chinese, Traditional Chinese, Croatian, Czech, German, Dutch, English, Spanish, French, Hungarian, Indonesian, Italian, Japanese, Korean, Persian, Polish, Portuguese, Romanian, Russian, Thai, Turkish\nAnzahl OSD-Sprachen: 21\nEingebaute Lautsprecher: Ja\nIntegrierte Kamera: Nein\nAnzahl der Lautsprecher: 2\nRMS-Leistung: 4 W\nMarktpositionierung: Gaming\nProduktfarbe: Schwarz\nRahmenloses Design: Ja\nStromverbrauch (Standardbetrieb): 21,7 W\nStromverbrauch (aus): 0,2 W\nStromverbrauch (PowerSave): 0,5 W\nGer\u00e4tebreite (inkl. Fu\u00df): 540,5 mm\nGer\u00e4tetiefe (inkl. Fu\u00df): 217,6 mm\nGer\u00e4teh\u00f6he (inkl. Fu\u00df): 515 mm\nGewicht (mit St\u00e4nder): 6,5 kg\nBreite (ohne Standfu\u00df): 54 cm\nTiefe (ohne Standfu\u00df): 5,17 cm\nH\u00f6he (ohne Standfu\u00df): 32,5 cm\nGewicht (ohne St\u00e4nder): 6,5 kg\nWarentarifnummer (HS): 85285210\nVerpackungsbreite: 723 mm\nVerpackungstiefe: 200 mm\nVerpackungsh\u00f6he: 400 mm\nPaketgewicht: 9 kg\n3D: Nein\nEnergieeffizienzklasse (SDR): F\nEnergieverbrauch (SDR) pro 1.000 Stunden: 22 kWh\nStromverbrauch (Standby): 0,3 W\nEnergieeffizienzskala: A bis G\nTV Tuner integriert: Nein",
    "reference_file": "offer_reference_2042.json",
    "shop_name": "TechnikLaden"
}