{
    "html_file": "offer_1964_11.html",
    "name": "HP EliteDisplay E24d G4, 23.8\"",
    "offer_link": "https://www.e-tec.at/details.php?artnr=315097",
    "price": 221.2,
    "raw_specifications": {
        "Abmessungen - Breite": "keine angabe (mit standfu\u00df),  539mm",
        "Abmessungen - H\u00f6he": "322mm",
        "Abmessungen - Tiefe": "48 (ohne standfu\u00df)mm",
        "Anschl\u00fcsse - DisplayPort 1.2": "1",
        "Anschl\u00fcsse - DisplayPort-Out 1.2 Daisy Chain": "1",
        "Anschl\u00fcsse - HDMI 1.4": "1",
        "Anschl\u00fcsse - USB-C 3.0 mit DisplayPort 1.2 shared": "1",
        "Anwendung": "station\u00e4r",
        "Audio": "1x Line-Out",
        "Aufl\u00f6sung": "1920x1080",
        "Beschichtung": "matt (non-glare)",
        "Besonderheiten": "Slim Bezel,  USB-C Power Delivery (100W),  mechanische Tasten,  Mikrofon,  IR-Webcam,  Sicherheitsschloss (Kensington),  KVM Switch",
        "Bildwiederholfrequenz": "60Hz",
        "Blickwinkel": "178\u00b0/178\u00b0",
        "Diagonale": "23.8\"/60.5cm",
        "Energieeffizienzklasse alt (A+++ bis G)": "A+",
        "Energieverbrauch SDR": "18kWh/1000h",
        "Ergonomie": "150mm (h\u00f6henverstellbar),  90\u00b0 (Pivot),  \u00b130\u00b0 (drehbar),  +20\u00b0/-5\u00b0 (neigbar),  keine Angabe (Schr\u00e4glage)",
        "FRC": "unbekannt",
        "Farbe": "schwarz",
        "Farbtiefe": "8bit (16.7 Mio. Farben)",
        "Form": "gerade (flat)",
        "Gewicht": "6.86kg (mit Standfu\u00df),  4.10kg (ohne Standfu\u00df)",
        "HDR": "N/A",
        "Helligkeit": "250cd/m\u00b2",
        "Herstellergarantie": "drei Jahre (Vor-Ort)",
        "Hintergrundbeleuchtung": "White-LED,  flicker-free,  Blaulichtfilter",
        "Jahresverbrauch alt (A+++ bis G)": "26.28kWh",
        "Kontrast - dynamisch": "5.000.000:1",
        "Kontrast - statisch": "1.000:1",
        "Leistungsaufnahme": "175W (maximal),  70W (typisch),  18W (Energielabel alt A+++ bis G),  0.5W (Standby)",
        "Panel": "IPS",
        "Reaktionszeit - GtG": "5ms",
        "Screen-to-Body-Ratio": "keine Angabe (berechnet)",
        "Seitenverh\u00e4ltnis": "16:9",
        "Signalfrequenz": "30-80kHz (horizontal),  50-60Hz (vertikal)",
        "Stromversorgung": "AC-In (internes Netzteil)",
        "USB-Hub In": "1x USB-C 3.0 mit DisplayPort 1.2 (shared)",
        "USB-Hub Out": "4x USB-A 3.0 (BC 1.2)",
        "USB-Schreibweise": "Link",
        "VESA": "100x100 (belegt)",
        "Weitere Anschl\u00fcsse": "1x Gb LAN (RJ-45)"
    },
    "raw_specifications_text": "Abmessungen - Breite: keine angabe (mit standfu\u00df),  539mm\nAbmessungen - H\u00f6he: 322mm\nAbmessungen - Tiefe: 48 (ohne standfu\u00df)mm\nAnschl\u00fcsse - DisplayPort 1.2: 1\nAnschl\u00fcsse - DisplayPort-Out 1.2 Daisy Chain: 1\nAnschl\u00fcsse - HDMI 1.4: 1\nAnschl\u00fcsse - USB-C 3.0 mit DisplayPort 1.2 shared: 1\nAnwendung: station\u00e4r\nAudio: 1x Line-Out\nAufl\u00f6sung: 1920x1080\nBeschichtung: matt (non-glare)\nBesonderheiten: Slim Bezel,  USB-C Power Delivery (100W),  mechanische Tasten,  Mikrofon,  IR-Webcam,  Sicherheitsschloss (Kensington),  KVM Switch\nBildwiederholfrequenz: 60Hz\nBlickwinkel: 178\u00b0/178\u00b0\nDiagonale: 23.8\"/60.5cm\nEnergieeffizienzklasse alt (A+++ bis G): A+\nEnergieverbrauch SDR: 18kWh/1000h\nErgonomie: 150mm (h\u00f6henverstellbar),  90\u00b0 (Pivot),  \u00b130\u00b0 (drehbar),  +20\u00b0/-5\u00b0 (neigbar),  keine Angabe (Schr\u00e4glage)\nFarbe: schwarz\nFarbtiefe: 8bit (16.7 Mio. Farben)\nForm: gerade (flat)\nFRC: unbekannt\nGewicht: 6.86kg (mit Standfu\u00df),  4.10kg (ohne Standfu\u00df)\nHDR: N/A\nHelligkeit: 250cd/m\u00b2\nHerstellergarantie: drei Jahre (Vor-Ort)\nHintergrundbeleuchtung: White-LED,  flicker-free,  Blaulichtfilter\nJahresverbrauch alt (A+++ bis G): 26.28kWh\nKontrast - dynamisch: 5.000.000:1\nKontrast - statisch: 1.000:1\nLeistungsaufnahme: 175W (maximal),  70W (typisch),  18W (Energielabel alt A+++ bis G),  0.5W (Standby)\nPanel: IPS\nReaktionszeit - GtG: 5ms\nScreen-to-Body-Ratio: keine Angabe (berechnet)\nSeitenverh\u00e4ltnis: 16:9\nSignalfrequenz: 30-80kHz (horizontal),  50-60Hz (vertikal)\nStromversorgung: AC-In (internes Netzteil)\nUSB-Hub In: 1x USB-C 3.0 mit DisplayPort 1.2 (shared)\nUSB-Hub Out: 4x USB-A 3.0 (BC 1.2)\nUSB-Schreibweise: Link\nVESA: 100x100 (belegt)\nWeitere Anschl\u00fcsse: 1x Gb LAN (RJ-45)",
    "reference_file": "offer_reference_1964.json",
    "shop_name": "e-tec.at"
}