{
    "html_file": "offer_1814_4.html",
    "name": "ASUS TUF Gaming VG328H1B, 31.5\"",
    "offer_link": "https://www.amazon.de/dp/B08CH5Z41X?linkCode=xm2&camp=2025&creative=165953&smid=A3JWKAKR8XB7XF&creativeASIN=B08CH5Z41X&tag=geizhals1-21",
    "price": 261.31,
    "raw_specifications": {
        "ASIN": "B08CH5Z41X",
        "Amazon Bestseller-Rang": "Nr. 70,787 in Computer & Zubeh\u00f6r (Siehe Top 100 in Computer & Zubeh\u00f6r)  Nr. 1,323 in Monitore",
        "Antriebsart": "\u200eHandbetrieben",
        "Anzahl USB 3.0 Schnittstellen": "\u200e1",
        "Anzahl der Lithium-Ionen-Zellen": "\u200e7",
        "Anzahl der Lithium-Metall-Zellen": "\u200e7",
        "Artikelgewicht": "\u200e9,6 Kilograms",
        "Batterien enthalten": "\u200eNein",
        "Bildschirmaufl\u00f6sung": "\u200e1920x1080",
        "Display-Gr\u00f6\u00dfe": "\u200e31,5 Zoll",
        "Durchschnittliche Kundenbewertung": "4,5  4,5 von 5 Sternen    \n    4.057 Sternebewertungen   \n\n\n 4,5 von 5 Sternen",
        "Farbe": "\u200eschwarz",
        "Garantierte Software-Updates bis": "\u200eunbekannt",
        "Hersteller": "\u200eAsus",
        "Im Angebot von Amazon.de seit": "7. Juli 2020",
        "Kapazit\u00e4t Lithium-Akku": "\u200e2,6 Britische W\u00e4rmeeinheiten (BTU)",
        "L\u00f6sung": "\u200e1920 x 1080 Pixels",
        "Marke": "\u200eASUS",
        "Modell/Serie": "\u200eVG328H1B",
        "Modellnummer": "\u200eVG328H1B",
        "Produktabmessungen": "\u200e71 x 21,4 x 50,7 cm; 9,6 Kilogramm",
        "Speicher-Art": "\u200eDIMM",
        "Volt": "\u200e240 Volt"
    },
    "raw_specifications_text": "Marke: \u200eASUS\nHersteller: \u200eAsus\nModell/Serie: \u200eVG328H1B\nProduktabmessungen: \u200e71 x 21,4 x 50,7 cm; 9,6 Kilogramm\nModellnummer: \u200eVG328H1B\nFarbe: \u200eschwarz\nDisplay-Gr\u00f6\u00dfe: \u200e31,5 Zoll\nBildschirmaufl\u00f6sung: \u200e1920x1080\nL\u00f6sung: \u200e1920 x 1080 Pixels\nSpeicher-Art: \u200eDIMM\nAnzahl USB 3.0 Schnittstellen: \u200e1\nVolt: \u200e240 Volt\nAntriebsart: \u200eHandbetrieben\nBatterien enthalten: \u200eNein\nKapazit\u00e4t Lithium-Akku: \u200e2,6 Britische W\u00e4rmeeinheiten (BTU)\nAnzahl der Lithium-Ionen-Zellen: \u200e7\nAnzahl der Lithium-Metall-Zellen: \u200e7\nArtikelgewicht: \u200e9,6 Kilograms\nGarantierte Software-Updates bis: \u200eunbekannt\nASIN: B08CH5Z41X\nDurchschnittliche Kundenbewertung: 4,5  4,5 von 5 Sternen    \n    4.057 Sternebewertungen   \n\n\n 4,5 von 5 Sternen\nAmazon Bestseller-Rang: Nr. 70,787 in Computer & Zubeh\u00f6r (Siehe Top 100 in Computer & Zubeh\u00f6r)  Nr. 1,323 in Monitore\nIm Angebot von Amazon.de seit: 7. Juli 2020",
    "reference_file": "offer_reference_1814.json",
    "shop_name": "Amazon.at"
}