{
    "html_file": "offer_2052_17.html",
    "name": "Fujitsu B-Line B27-9 TS QHD, 27\"",
    "offer_link": "https://www.alternate.at/Fujitsu/B27-9-TS-QHD-LED-Monitor/html/product/1693618?partner=AtGeizhalsat&campaign=Monitor/Fujitsu/1693618",
    "price": 365.0,
    "raw_specifications": {
        "": "Ausgangsleistung",
        "Abmessungen": "Breite: 61,27 cm x H\u00f6he: 38,56 cm x Tiefe/L\u00e4nge: 27,5 cm",
        "Anschl\u00fcsse": "1x DVI-D-Eingang, 1x HDMI-Eingang, (HDMI-Version: 1.4), 1x DisplayPort-Eingang, (DisplayPort-Version: 1.2), 1x 3,5-mm-Audio-Eingang, 1x Kopfh\u00f6rer-Ausgang, 5x USB-A-3.2 Gen 1 (5 Gbit/s)",
        "Bild": "Format",
        "Bildschirmaufl\u00f6sung": "2.560 x 1.440 Pixel",
        "Bildschirmdiagonale": "68,6 cm (27 Zoll)",
        "EAN": "4059595827062",
        "Energieeffizienzklasse (SDR)": "E (A - G)",
        "Energieverbauch pro 1000 Stunden (SDR)": "19 kWh",
        "Ergonomie": "Typ",
        "Farbe": "schwarz",
        "Frequenz": "Pixel-Bandbreite",
        "Geeignet f\u00fcr": "Business",
        "Gewicht": "7,6 kg",
        "Hersteller-Nr.": "S26361-K1694-V160",
        "Lautsprecher": "2 Lautsprecher",
        "Leistungsaufnahme im Bereitschafts- und Aus-Zustand": "0,2 Watt",
        "Leistungsaufnahme im Ein-Zustand bei Standard-Dynamikumfang (SDR)": "19,4 Watt",
        "Standards": "Video",
        "Stromversorgung": "Eco-Off",
        "Typ": "LED-Monitor",
        "Wandhalterung": "VESA kompatibel (100 x 100 mm)",
        "Zubeh\u00f6r": "Vorhanden"
    },
    "raw_specifications_text": "Energieeffizienzklasse (SDR): E (A - G)\nEnergieverbauch pro 1000 Stunden (SDR): 19 kWh\nLeistungsaufnahme im Ein-Zustand bei Standard-Dynamikumfang (SDR): 19,4 Watt\nLeistungsaufnahme im Bereitschafts- und Aus-Zustand: 0,2 Watt\nBildschirmdiagonale: 68,6 cm (27 Zoll)\nBildschirmaufl\u00f6sung: 2.560 x 1.440 Pixel\nTyp: LED-Monitor\nFarbe: schwarz\nEAN: 4059595827062\nHersteller-Nr.: S26361-K1694-V160\nGeeignet f\u00fcr: Business\nBild: Format\n: Ausgangsleistung\nFrequenz: Pixel-Bandbreite\nAnschl\u00fcsse: 1x DVI-D-Eingang, 1x HDMI-Eingang, (HDMI-Version: 1.4), 1x DisplayPort-Eingang, (DisplayPort-Version: 1.2), 1x 3,5-mm-Audio-Eingang, 1x Kopfh\u00f6rer-Ausgang, 5x USB-A-3.2 Gen 1 (5 Gbit/s)\nErgonomie: Typ\nStromversorgung: Eco-Off\nLautsprecher: 2 Lautsprecher\nStandards: Video\nWandhalterung: VESA kompatibel (100 x 100 mm)\nZubeh\u00f6r: Vorhanden\nAbmessungen: Breite: 61,27 cm x H\u00f6he: 38,56 cm x Tiefe/L\u00e4nge: 27,5 cm\nGewicht: 7,6 kg",
    "reference_file": "offer_reference_2052.json",
    "shop_name": "Alternate.at"
}