{
    "html_file": "offer_1647_25.html",
    "name": "ASUS ProArt PA247CV, 23.8\"",
    "offer_link": "https://www.alternate.at/ASUS/PA247CV-LED-Monitor/html/product/1719154?partner=AtGeizhalsat&campaign=Monitor/ASUS/1719154",
    "price": 305.0,
    "raw_specifications": {
        "": "H\u00f6henverstellbar",
        "Abmessungen": "Breite: 54 cm x H\u00f6he: 34,2 cm x Tiefe/L\u00e4nge: 21,1 cm",
        "Anschl\u00fcsse": "1x HDMI-Eingang, (HDMI-Version: 1.4), 1x DisplayPort-Eingang, 1x DisplayPort-Ausgang, (DisplayPort-Version: 1.22), 1x Kopfh\u00f6rer-Ausgang, 4x USB-A-3.2 Gen 1 (5 Gbit/s), 1x USB-C 3.2 Gen 1 (5 Gbit/s)",
        "Bild": "Glaretyp",
        "Bildschirmaufl\u00f6sung": "1.920 x 1.080 Pixel",
        "Bildschirmdiagonale": "61 cm (24 Zoll)",
        "EAN": "4718017886864",
        "Energieeffizienzklasse (SDR)": "F (A - G)",
        "Energieverbauch pro 1000 Stunden (SDR)": "22 kWh",
        "Ergonomie": "Typ",
        "Farbe": "schwarz/silber",
        "Features": "USB-C Power Delivery (65 Watt), Flicker-Free LED, Blue Light Filter",
        "Frequenz": "Vertikal",
        "Geeignet f\u00fcr": "Multimedia",
        "Gewicht": "6,3 kg",
        "Hersteller-Nr.": "90LM03Y1-B01370",
        "Lautsprecher": "2 Lautsprecher",
        "Leistungsaufnahme im Bereitschafts- und Aus-Zustand": "0,5 Watt",
        "Leistungsaufnahme im Ein-Zustand bei Standard-Dynamikumfang (SDR)": "21,8 Watt",
        "Standards": "Video",
        "Stromversorgung": "Eco-Off",
        "Typ": "LED-Monitor",
        "Wandhalterung": "VESA kompatibel (100 x 100 mm)"
    },
    "raw_specifications_text": "Energieeffizienzklasse (SDR): F (A - G)\nEnergieverbauch pro 1000 Stunden (SDR): 22 kWh\nLeistungsaufnahme im Ein-Zustand bei Standard-Dynamikumfang (SDR): 21,8 Watt\nLeistungsaufnahme im Bereitschafts- und Aus-Zustand: 0,5 Watt\nBildschirmdiagonale: 61 cm (24 Zoll)\nBildschirmaufl\u00f6sung: 1.920 x 1.080 Pixel\nTyp: LED-Monitor\nFarbe: schwarz/silber\nEAN: 4718017886864\nHersteller-Nr.: 90LM03Y1-B01370\nGeeignet f\u00fcr: Multimedia\nBild: Glaretyp\n: H\u00f6henverstellbar\nFrequenz: Vertikal\nAnschl\u00fcsse: 1x HDMI-Eingang, (HDMI-Version: 1.4), 1x DisplayPort-Eingang, 1x DisplayPort-Ausgang, (DisplayPort-Version: 1.22), 1x Kopfh\u00f6rer-Ausgang, 4x USB-A-3.2 Gen 1 (5 Gbit/s), 1x USB-C 3.2 Gen 1 (5 Gbit/s)\nErgonomie: Typ\nStromversorgung: Eco-Off\nLautsprecher: 2 Lautsprecher\nStandards: Video\nWandhalterung: VESA kompatibel (100 x 100 mm)\nFeatures: USB-C Power Delivery (65 Watt), Flicker-Free LED, Blue Light Filter\nAbmessungen: Breite: 54 cm x H\u00f6he: 34,2 cm x Tiefe/L\u00e4nge: 21,1 cm\nGewicht: 6,3 kg",
    "reference_file": "offer_reference_1647.json",
    "shop_name": "Alternate.at"
}