{
    "html_file": "offer_1018_24.html",
    "name": "Apple Studio Display, Standardglas, VESA Mount Adapter, 27\"",
    "offer_link": "https://www.taufnaus.de/product/10610460",
    "price": 1769.52,
    "raw_specifications": {
        "Abmessungen (Breite x Tiefe x H\u00f6he)": "62.3 cm x 3.1 cm x 36.2 cm",
        "Besonderheiten": "Retina-Display, P3 Wide Color Gamut, True Tone-Technologie, Standardglas, Dolby Atmos",
        "Diagonalabmessung": "68.6 cm (27\")",
        "Display-Typ": "LCD-Monitor",
        "ENERGY STAR zertifiziert": "Ja",
        "Eingangsspannung": "Wechselstrom 100-240 V (50/60 Hz)",
        "Energie Effizienzklasse": "Klasse E",
        "Enthaltene Kabel": "1 x Thunderbolt-Kabel - 1 m",
        "Erforderliches Betriebssystem": "Apple macOS Monterey 12.3 oder sp\u00e4ter, Apple iPadOS 15.4 oder sp\u00e4ter",
        "Farbunterst\u00fctzung": "1 Milliarde Farben",
        "Gewicht": "5.5 kg",
        "Helligkeit": "600 cd/m\u00b2",
        "Integrierte Peripherieger\u00e4te": "12 Megapixel Kamera, 6 Lautsprecher, 3 Mikrofonstangen-Form-Arrays",
        "Leistungsmerkmale": "Montage im Quer-/Hochformat, Spatial Audio, A13 Bionic Chip",
        "Lokalisierung": "Deutsch / Deutschland",
        "Max. Betriebstemperatur": "35 \u00b0C",
        "Min Betriebstemperatur": "10 \u00b0C",
        "Mitgelieferte Software": "Siri",
        "Native Aufl\u00f6sung": "5K 5120 x 2880",
        "Ppi": "218",
        "Schnittstellen": "Thunderbolt 3 / USB-C (bis zu 96 W) \u00a6 3 x USB-C",
        "Sensoraufl\u00f6sung": "12 Megapixel (Ultra Wide)",
        "Service und Support": "Begrenzte Garantie - 1 Jahr \u00a6 Technischer Support - Telefonberatung - 90 Tage",
        "Stromverbrauch SDR (eingeschaltet)": "21.2 kWh/1.000 h",
        "Typ": "Lautsprecher mit Subwoofer - Stereo mit Subwoofer",
        "USB-Spannungsversorgung": "96 Watt",
        "VESA-Halterung": "100 x 100 mm",
        "Zubeh\u00f6r im Lieferumfang": "VESA-Klammer",
        "Zul\u00e4ssige Luftfeuchtigkeit im Betrieb": "5 - 90% (nicht kondensierend)"
    },
    "raw_specifications_text": "Display-Typ: LCD-Monitor\nEnergie Effizienzklasse: Klasse E\nDiagonalabmessung: 68.6 cm (27\")\nIntegrierte Peripherieger\u00e4te: 12 Megapixel Kamera, 6 Lautsprecher, 3 Mikrofonstangen-Form-Arrays\nUSB-Spannungsversorgung: 96 Watt\nNative Aufl\u00f6sung: 5K 5120 x 2880\nPpi: 218\nHelligkeit: 600 cd/m\u00b2\nFarbunterst\u00fctzung: 1 Milliarde Farben\nBesonderheiten: Retina-Display, P3 Wide Color Gamut, True Tone-Technologie, Standardglas, Dolby Atmos\nAbmessungen (Breite x Tiefe x H\u00f6he): 62.3 cm x 3.1 cm x 36.2 cm\nGewicht: 5.5 kg\nSensoraufl\u00f6sung: 12 Megapixel (Ultra Wide)\nLeistungsmerkmale: Montage im Quer-/Hochformat, Spatial Audio, A13 Bionic Chip\nTyp: Lautsprecher mit Subwoofer - Stereo mit Subwoofer\nSchnittstellen: Thunderbolt 3 / USB-C (bis zu 96 W) \u00a6 3 x USB-C\nVESA-Halterung: 100 x 100 mm\nZubeh\u00f6r im Lieferumfang: VESA-Klammer\nEnthaltene Kabel: 1 x Thunderbolt-Kabel - 1 m\nLokalisierung: Deutsch / Deutschland\nEingangsspannung: Wechselstrom 100-240 V (50/60 Hz)\nStromverbrauch SDR (eingeschaltet): 21.2 kWh/1.000 h\nMitgelieferte Software: Siri\nErforderliches Betriebssystem: Apple macOS Monterey 12.3 oder sp\u00e4ter, Apple iPadOS 15.4 oder sp\u00e4ter\nENERGY STAR zertifiziert: Ja\nService und Support: Begrenzte Garantie - 1 Jahr \u00a6 Technischer Support - Telefonberatung - 90 Tage\nMin Betriebstemperatur: 10 \u00b0C\nMax. Betriebstemperatur: 35 \u00b0C\nZul\u00e4ssige Luftfeuchtigkeit im Betrieb: 5 - 90% (nicht kondensierend)",
    "reference_file": "offer_reference_1018.json",
    "shop_name": "TaufNaus"
}