{
    "html_file": "offer_470_0.html",
    "name": "Acer CB2 CBA242YAbir, 23.8\"",
    "offer_link": "https://www.amazon.de/dp/B0BGX7F2QC?linkCode=xm2&camp=2025&creative=165953&smid=A3JWKAKR8XB7XF&creativeASIN=B0BGX7F2QC&tag=geizhals1-21",
    "price": 140.17,
    "raw_specifications": {
        "ASIN": "B0BGX7F2QC",
        "Amazon Bestseller-Rang": "Nr. 17,409 in Computer & Zubeh\u00f6r (Siehe Top 100 in Computer & Zubeh\u00f6r)  Nr. 361 in Monitore",
        "Artikelgewicht": "\u200e5,9 Kilograms",
        "Bildschirmaufl\u00f6sung": "\u200e1920x1080",
        "Display-Gr\u00f6\u00dfe": "\u200e23,8 Zoll",
        "Durchschnittliche Kundenbewertung": "4,0  4,0 von 5 Sternen    \n    21 Sternebewertungen   \n\n\n 4,0 von 5 Sternen",
        "Farbe": "\u200eSchwarz",
        "Garantierte Software-Updates bis": "\u200eunbekannt",
        "Hersteller": "\u200eAcer",
        "Im Angebot von Amazon.de seit": "30. September 2022",
        "L\u00f6sung": "\u200e1920 x 1080 Pixels",
        "Marke": "\u200eAcer",
        "Modell/Serie": "\u200eCBA242YA",
        "Modellnummer": "\u200eUM.QB2EE.A15",
        "Produktabmessungen": "\u200e54,03 x 23,4 x 49,5 cm; 5,9 Kilogramm"
    },
    "raw_specifications_text": "Marke: \u200eAcer\nHersteller: \u200eAcer\nModell/Serie: \u200eCBA242YA\nProduktabmessungen: \u200e54,03 x 23,4 x 49,5 cm; 5,9 Kilogramm\nModellnummer: \u200eUM.QB2EE.A15\nFarbe: \u200eSchwarz\nDisplay-Gr\u00f6\u00dfe: \u200e23,8 Zoll\nBildschirmaufl\u00f6sung: \u200e1920x1080\nL\u00f6sung: \u200e1920 x 1080 Pixels\nArtikelgewicht: \u200e5,9 Kilograms\nGarantierte Software-Updates bis: \u200eunbekannt\nASIN: B0BGX7F2QC\nDurchschnittliche Kundenbewertung: 4,0  4,0 von 5 Sternen    \n    21 Sternebewertungen   \n\n\n 4,0 von 5 Sternen\nAmazon Bestseller-Rang: Nr. 17,409 in Computer & Zubeh\u00f6r (Siehe Top 100 in Computer & Zubeh\u00f6r)  Nr. 361 in Monitore\nIm Angebot von Amazon.de seit: 30. September 2022",
    "reference_file": "offer_reference_470.json",
    "shop_name": "Amazon.at"
}