{
    "html_file": "offer_1338_18.html",
    "name": "LG UltraWide 29WP500-B, 29\"",
    "offer_link": "https://www.future-x.at/lg-73-7-cm-29-zoll-2560-x-1080-pixel-ultrawide-full-hd-led-5-ms-schwarz-ips-x-21%3A9-250-cd-m%B2-75hz-radeon-freesync-2-x-hdmi-headphone-tilt-6885-x-3134-x-p-8853799/?pv=2",
    "price": 188.5,
    "raw_specifications": {
        "AC Eingangsfrequenz": "50/60 Hz",
        "AC Eingangsspannung": "100 - 240 V",
        "AMD FreeSync": "Ja",
        "Anzahl HDMI-Anschl\u00fcsse": "2",
        "Anzahl der Farben des Displays": "16,7 Millionen Farben",
        "Bildschirmaufl\u00f6sung": "2560 x 1080 Pixel",
        "Bildschirmdiagonale": "73,7 cm",
        "Bildschirmdiagonale (cm)": "73 cm",
        "Bildschirmform": "Flach",
        "Bildschirmtechnologie": "LED",
        "Blendfreier Bildschirm": "Ja",
        "Blickwinkel, horizontal": "178 \u00b0",
        "Blickwinkel, vertikal": "178 \u00b0",
        "Breite (ohne Standfu\u00df)": "68,8 cm",
        "Flimmerfreie Technologie": "Ja",
        "Fu\u00dffarbe": "Schwarz",
        "Ger\u00e4tebreite (inkl. Fu\u00df)": "688,5 mm",
        "Ger\u00e4teh\u00f6he (inkl. Fu\u00df)": "405 mm",
        "Ger\u00e4tetiefe (inkl. Fu\u00df)": "223,8 mm",
        "Gewicht (mit St\u00e4nder)": "4,5 kg",
        "Gewicht (ohne St\u00e4nder)": "4 kg",
        "HD-Typ": "UltraWide Full HD",
        "HDMI": "Ja",
        "Helligkeit (typisch)": "250 cd/m\u00b2",
        "High Dynamic Range Video Unterst\u00fctzung": "Ja",
        "H\u00f6he (ohne Standfu\u00df)": "31,3 cm",
        "H\u00f6henverstellung": "Nein",
        "Integrierter USB-Hub": "Nein",
        "Kontrastverh\u00e4ltnis": "1000:1",
        "Kopfh\u00f6rerausgang": "Ja",
        "Maximale Bildwiederholrate": "75 Hz",
        "Mitgelieferte Kabel": "HDMI",
        "NVIDIA G-SYNC": "Nein",
        "Natives Seitenverh\u00e4ltnis": "21:9",
        "Paketgewicht": "6,6 kg",
        "Panel-Montage-Schnittstelle": "100 x 100 mm",
        "Panel-Typ": "IPS",
        "Pixel Abstand": "0,263 x 0,263 mm",
        "Produktfarbe": "Schwarz",
        "RGB-Farbraum": "sRGB",
        "Reaktionszeit": "5 ms",
        "Seitenverh\u00e4ltnis": "21:9",
        "Stromverbrauch (Standby)": "0,5 W",
        "Stromverbrauch (aus)": "0,3 W",
        "Stromverbrauch (in Betrieb)": "22 W",
        "Stromverbrauch (max.)": "25 W",
        "Technologie mit hohem Dynamikbereich (HDR)": "High Dynamic Range 10 (HDR10)",
        "Tiefe (ohne Standfu\u00df)": "7,69 cm",
        "Unterst\u00fctzte Grafik-Aufl\u00f6sungen": "2560 x 1080",
        "VESA-Halterung": "Ja",
        "Verpackungsart": "Box",
        "Verpackungsbreite": "822 mm",
        "Verpackungsh\u00f6he": "413 mm",
        "Verpackungstiefe": "159 mm",
        "Vorderer Rahmen": "Schwarz",
        "kippbar": "Ja",
        "sRGB Abdeckung (klassisch)": "99 %"
    },
    "raw_specifications_text": "NVIDIA G-SYNC: Nein\nAMD FreeSync: Ja\nFlimmerfreie Technologie: Ja\nBildschirmdiagonale: 73,7 cm\nBildschirmaufl\u00f6sung: 2560 x 1080 Pixel\nNatives Seitenverh\u00e4ltnis: 21:9\nPanel-Typ: IPS\nHelligkeit (typisch): 250 cd/m\u00b2\nReaktionszeit: 5 ms\nHD-Typ: UltraWide Full HD\nBildschirmtechnologie: LED\nBlendfreier Bildschirm: Ja\nBildschirmform: Flach\nUnterst\u00fctzte Grafik-Aufl\u00f6sungen: 2560 x 1080\nSeitenverh\u00e4ltnis: 21:9\nKontrastverh\u00e4ltnis: 1000:1\nMaximale Bildwiederholrate: 75 Hz\nBlickwinkel, horizontal: 178 \u00b0\nBlickwinkel, vertikal: 178 \u00b0\nAnzahl der Farben des Displays: 16,7 Millionen Farben\nPixel Abstand: 0,263 x 0,263 mm\nBildschirmdiagonale (cm): 73 cm\nHigh Dynamic Range Video Unterst\u00fctzung: Ja\nTechnologie mit hohem Dynamikbereich (HDR): High Dynamic Range 10 (HDR10)\nRGB-Farbraum: sRGB\nsRGB Abdeckung (klassisch): 99 %\nIntegrierter USB-Hub: Nein\nHDMI: Ja\nAnzahl HDMI-Anschl\u00fcsse: 2\nKopfh\u00f6rerausgang: Ja\nVESA-Halterung: Ja\nPanel-Montage-Schnittstelle: 100 x 100 mm\nH\u00f6henverstellung: Nein\nkippbar: Ja\nProduktfarbe: Schwarz\nVorderer Rahmen: Schwarz\nFu\u00dffarbe: Schwarz\nMitgelieferte Kabel: HDMI\nVerpackungsbreite: 822 mm\nVerpackungstiefe: 159 mm\nVerpackungsh\u00f6he: 413 mm\nPaketgewicht: 6,6 kg\nVerpackungsart: Box\nStromverbrauch (in Betrieb): 22 W\nStromverbrauch (Standby): 0,5 W\nStromverbrauch (max.): 25 W\nStromverbrauch (aus): 0,3 W\nAC Eingangsspannung: 100 - 240 V\nAC Eingangsfrequenz: 50/60 Hz\nGer\u00e4tebreite (inkl. Fu\u00df): 688,5 mm\nGer\u00e4tetiefe (inkl. Fu\u00df): 223,8 mm\nGer\u00e4teh\u00f6he (inkl. Fu\u00df): 405 mm\nGewicht (mit St\u00e4nder): 4,5 kg\nBreite (ohne Standfu\u00df): 68,8 cm\nTiefe (ohne Standfu\u00df): 7,69 cm\nH\u00f6he (ohne Standfu\u00df): 31,3 cm\nGewicht (ohne St\u00e4nder): 4 kg",
    "reference_file": "offer_reference_1338.json",
    "shop_name": "Future-X.at"
}