{
    "html_file": "offer_364_19.html",
    "name": "ASUS TUF Gaming VG246H1A, 23.8\"",
    "offer_link": "https://www.future-x.at/asus-tuf-gaming-vg246h1a-led-monitor-60-5-cm-238-1920-x-1080-full-hd-1080p-%40-100-hz-ips-300-cd-m%B2-1300%3A1-0-5-ms-2xhdmi-p-9185880/?pv=2",
    "price": 180.19,
    "raw_specifications": {
        "Abmessungen (Breite x Tiefe x H\u00f6he)": "54,104 cm x 17,398 cm x 39,436 cm - mit Fu\u00df",
        "Adaptive-Sync Technologie": "AMD FreeSync",
        "Besonderheiten": "HDCP, ASUS GamePlus, flimmerfreie Technologie, ASUS GameVisual Technology, Farbtemperatur Auswahl, GameFast Input Technology, Low Blue Light-Technologie, Shadow Boost-Technologie, ASUS Extreme Low Motion Blur Sync, Display Widget, Variable Refresh Rate (VRR)",
        "Bildschirmbeschichtung": "Blendfrei",
        "Bildschirmtyp": "IPS",
        "Details zu Abmessungen & Gewicht": "Ohne Fu\u00df - Breite: 54,104 cm - Tiefe: 6,137 cm - H\u00f6he: 32,326 cm - Gewicht: 2,87 kg",
        "Diagonalabmessung": "60,5 cm (23.8\")",
        "Display-Typ": "LED-hintergrundbeleuchteter LCD-Monitor / TFT-Aktivmatrix",
        "Eingangsspannung": "Wechselstrom 100-240 V (50/60 Hz)",
        "Einstellungen der Anzeigeposition": "Neigung",
        "Farbraum": "110% sRGB",
        "Farbunterst\u00fctzung": "16,7 Millionen Farben",
        "Gaming": "Ja",
        "Gewicht": "3,42 kg",
        "Helligkeit": "300 cd/m\u00b2",
        "Hintergrundbeleuchtungs-Technologie": "LED-Hintergrundbeleuchtung",
        "Horizontale Bildwiederholrate": "30 - 120 kHz",
        "Horizontaler Betrachtungswinkel": "178",
        "Kennzeichnung": "TUV Rheinland Low Blue Light Certification, TUV Rheinland Flicker Free Certification",
        "Kontrast": "1300:1",
        "Leistungsmerkmale": "Slot f\u00fcr Sicherheitsschloss (Kabelschloss getrennt erh\u00e4ltlich)",
        "Native Aufl\u00f6sung": "Full HD (1080p) 1920 x 1080 bei 100 Hz",
        "Neigungswinkel": "-5/+23",
        "Pixelpitch": "0.2745 mm",
        "Reaktionszeit": "0,5 ms (MPRT)",
        "Schlosstyp zur Diebstahlsicherung": "Kensington Slot",
        "Schnittstellen": "2 x HDMI \u00a6 Kopfh\u00f6rer",
        "Seitenverh\u00e4ltnis": "16:9",
        "Stromverbrauch (typisch)": "19 Watt",
        "Transportbreite": "60 cm",
        "Transportgewicht": "5,01 kg",
        "Transporth\u00f6he": "40,5 cm",
        "Transporttiefe": "16,8 cm",
        "VESA-Halterung": "100 x 100 mm",
        "Vertikale Bildwiederholrate": "48 - 100 Hz",
        "Vertikaler Betrachtungswinkel": "178"
    },
    "raw_specifications_text": "Display-Typ: LED-hintergrundbeleuchteter LCD-Monitor / TFT-Aktivmatrix\nDiagonalabmessung: 60,5 cm (23.8\")\nAdaptive-Sync Technologie: AMD FreeSync\nBildschirmtyp: IPS\nSeitenverh\u00e4ltnis: 16:9\nNative Aufl\u00f6sung: Full HD (1080p) 1920 x 1080 bei 100 Hz\nPixelpitch: 0.2745 mm\nHelligkeit: 300 cd/m\u00b2\nKontrast: 1300:1\nFarbunterst\u00fctzung: 16,7 Millionen Farben\nFarbraum: 110% sRGB\nReaktionszeit: 0,5 ms (MPRT)\nVertikale Bildwiederholrate: 48 - 100 Hz\nHorizontale Bildwiederholrate: 30 - 120 kHz\nGaming: Ja\nHorizontaler Betrachtungswinkel: 178\nVertikaler Betrachtungswinkel: 178\nBildschirmbeschichtung: Blendfrei\nHintergrundbeleuchtungs-Technologie: LED-Hintergrundbeleuchtung\nBesonderheiten: HDCP, ASUS GamePlus, flimmerfreie Technologie, ASUS GameVisual Technology, Farbtemperatur Auswahl, GameFast Input Technology, Low Blue Light-Technologie, Shadow Boost-Technologie, ASUS Extreme Low Motion Blur Sync, Display Widget, Variable Refresh Rate (VRR)\nAbmessungen (Breite x Tiefe x H\u00f6he): 54,104 cm x 17,398 cm x 39,436 cm - mit Fu\u00df\nGewicht: 3,42 kg\nSchnittstellen: 2 x HDMI \u00a6 Kopfh\u00f6rer\nEinstellungen der Anzeigeposition: Neigung\nNeigungswinkel: -5/+23\nVESA-Halterung: 100 x 100 mm\nLeistungsmerkmale: Slot f\u00fcr Sicherheitsschloss (Kabelschloss getrennt erh\u00e4ltlich)\nKennzeichnung: TUV Rheinland Low Blue Light Certification, TUV Rheinland Flicker Free Certification\nSchlosstyp zur Diebstahlsicherung: Kensington Slot\nEingangsspannung: Wechselstrom 100-240 V (50/60 Hz)\nStromverbrauch (typisch): 19 Watt\nDetails zu Abmessungen & Gewicht: Ohne Fu\u00df - Breite: 54,104 cm - Tiefe: 6,137 cm - H\u00f6he: 32,326 cm - Gewicht: 2,87 kg\nTransportbreite: 60 cm\nTransporttiefe: 16,8 cm\nTransporth\u00f6he: 40,5 cm\nTransportgewicht: 5,01 kg",
    "reference_file": "offer_reference_364.json",
    "shop_name": "Future-X.at"
}