{
    "html_file": "offer_962_9.html",
    "name": "Samsung Smart Monitor M8 M80B Daylight Blue, 32\"",
    "offer_link": "https://www.mylemon.at/artikel/samsung/ls32bm80buuxen/dis-32-s32bm80buu-smartmonitor-blue.html",
    "price": 503.18,
    "raw_specifications": {
        "AC Eingangsspannung": "100 - 240 V",
        "Anzahl Micro HDMI Anschl\u00fcsse": "1",
        "Anzahl der Farben des Displays": "1 Milliarden Farben",
        "Artikelnummer": "M1BY0FYL",
        "Aufl\u00f6sung": "3840x2160",
        "Besonderheiten": "Lautsprecher",
        "Betriebstemperatur": "10 - 40 \u00b0C",
        "Bildschirmdiagonale": "81,3 cm (32 Zoll)",
        "Bildschirmdiagonale (cm)": "80 cm",
        "Bildschirmform": "Flach",
        "Bildwinkel, horizontal": "178\u00b0",
        "Bildwinkel, vertikal": "178\u00b0",
        "Bluetooth": "Ja",
        "Bluetooth-Version": "4.2",
        "Breite (ohne Standfu\u00df)": "71,3 cm",
        "Display-Aufl\u00f6sung": "3840 x 2160 Pixel",
        "Displaygr\u00f6\u00dfe": "32 Zoll",
        "EAN": "8806094364637",
        "Eingebaute Lautsprecher": "Ja",
        "Energieeffizienzklasse (HDR)": "G",
        "Energieeffizienzklasse (SDR)": "G",
        "Energieeffizienzskala": "A bis G",
        "Energieverbrauch (HDR) pro 1.000 Stunden": "75 kWh",
        "Energieverbrauch (SDR) pro 1.000 Stunden": "40 kWh",
        "Ergonomie": "H\u00f6henverstellbar, Neigbar",
        "Flimmerfreie Technologie": "Ja",
        "Funktioniert mit Samsung Bixby": "Ja",
        "Ger\u00e4tebreite (inkl. Fu\u00df)": "713,4 mm",
        "Ger\u00e4teh\u00f6he (inkl. Fu\u00df)": "575,2 mm",
        "Ger\u00e4tetiefe (inkl. Fu\u00df)": "203,8 mm",
        "Gewicht (mit St\u00e4nder)": "6,7 kg",
        "Gewicht (ohne St\u00e4nder)": "4,4 kg",
        "HD-Typ": "4K Ultra HD",
        "HDCP": "Ja",
        "HDMI": "Ja",
        "HDMI-Version": "2.0",
        "Helligkeit": "400 cd/m\u00b2",
        "Helligkeit (typisch)": "400 cd/m\u00b2",
        "Hersteller Artikelnummer": "LS32BM80BUUXEN",
        "High Dynamic Range Video (HDR) Unterst\u00fctzung": "Ja",
        "H\u00f6he (ohne Standfu\u00df)": "41,9 cm",
        "H\u00f6heneinstellung": "12 cm",
        "H\u00f6henverstellung": "Ja",
        "Installiertes Betriebssystem": "Tizen",
        "Integrierte Kamera": "Nein",
        "Integrierter USB-Hub": "Ja",
        "Kontrastverh\u00e4ltnis": "3000:1",
        "Kopfh\u00f6rerausgang": "Nein",
        "Low-Blue-Light-Technologie": "Ja",
        "Marktpositionierung": "Intelligent",
        "Maximale Bildwiederholrate": "60 Hz",
        "Mitgelieferte Kabel": "AC, HDMI, USB",
        "Name der Farbe": "DAYLIGHT BLUE",
        "Natives Seitenverh\u00e4ltnis": "16:9",
        "Neigungsverstellung": "Ja",
        "Neigungswinkelbereich": "-2 - 15\u00b0",
        "Paketgewicht": "9,4 kg",
        "Panel": "VA",
        "Panel-Typ": "VA",
        "Produktfarbe": "Blau, Wei\u00df",
        "Reaktionszeit": "4 ms",
        "Schnellladung": "Ja",
        "Sichtbare Gr\u00f6\u00dfe (horizontal)": "69,7 cm",
        "Sichtbare Gr\u00f6\u00dfe (vertikal)": "39,2 cm",
        "Spiel-Modus": "Ja",
        "Stromverbrauch (Standardbetrieb)": "40 W",
        "Stromverbrauch (Standby)": "0,5 W",
        "Technologie mit hohem Dynamikbereich (HDR)": "High Dynamic Range 10+ (HDR10 Plus)",
        "Tiefe (ohne Standfu\u00df)": "2,23 cm",
        "Touchscreen": "Nein",
        "USB Power Delivery": "Ja",
        "USB-Hub-Version": "3.2 Gen 1 (3.1 Gen 1)",
        "USB-Stromversorgung bis zu": "65 W",
        "USB-Upstream-Porttyp": "USB Typ-C",
        "Unterst\u00fctzte Grafik-Aufl\u00f6sungen": "3840 x 2160",
        "Unterst\u00fctzte Video-Modi": "2160p",
        "VESA Halterung": "100x100 mm",
        "Verpackungsbreite": "798 mm",
        "Verpackungsh\u00f6he": "568 mm",
        "Verpackungstiefe": "124 mm",
        "Video Anschl\u00fcsse": "1x micro HDMI, USB-C DisplayPort",
        "WLAN": "Ja",
        "WLAN-Standards": "Wi-Fi 5 (802.11ac)",
        "Warentarifnummer (HS)": "85285210",
        "sRGB Abdeckung (klassisch)": "99%"
    },
    "raw_specifications_text": "Displaygr\u00f6\u00dfe: 32 Zoll\nAufl\u00f6sung: 3840x2160\nPanel: VA\nReaktionszeit: 4 ms\nVideo Anschl\u00fcsse: 1x micro HDMI, USB-C DisplayPort\nErgonomie: H\u00f6henverstellbar, Neigbar\nVESA Halterung: 100x100 mm\nHelligkeit: 400 cd/m\u00b2\nBesonderheiten: Lautsprecher\nHersteller Artikelnummer: LS32BM80BUUXEN\nEAN: 8806094364637\nArtikelnummer: M1BY0FYL\nBildschirmdiagonale: 81,3 cm (32 Zoll)\nDisplay-Aufl\u00f6sung: 3840 x 2160 Pixel\nNatives Seitenverh\u00e4ltnis: 16:9\nTouchscreen: Nein\nHD-Typ: 4K Ultra HD\nPanel-Typ: VA\nBildschirmform: Flach\nKontrastverh\u00e4ltnis: 3000:1\nMaximale Bildwiederholrate: 60 Hz\nAnzahl der Farben des Displays: 1 Milliarden Farben\nHelligkeit (typisch): 400 cd/m\u00b2\nUnterst\u00fctzte Grafik-Aufl\u00f6sungen: 3840 x 2160\nUnterst\u00fctzte Video-Modi: 2160p\nBildwinkel, horizontal: 178\u00b0\nBildwinkel, vertikal: 178\u00b0\nSichtbare Gr\u00f6\u00dfe (horizontal): 69,7 cm\nSichtbare Gr\u00f6\u00dfe (vertikal): 39,2 cm\nBildschirmdiagonale (cm): 80 cm\nHigh Dynamic Range Video (HDR) Unterst\u00fctzung: Ja\nTechnologie mit hohem Dynamikbereich (HDR): High Dynamic Range 10+ (HDR10 Plus)\nsRGB Abdeckung (klassisch): 99%\nSchnellladung: Ja\nFlimmerfreie Technologie: Ja\nLow-Blue-Light-Technologie: Ja\nSpiel-Modus: Ja\nFunktioniert mit Samsung Bixby: Ja\nInstalliertes Betriebssystem: Tizen\nEingebaute Lautsprecher: Ja\nIntegrierte Kamera: Nein\nMarktpositionierung: Intelligent\nProduktfarbe: Blau, Wei\u00df\nName der Farbe: DAYLIGHT BLUE\nIntegrierter USB-Hub: Ja\nHDMI: Ja\nKopfh\u00f6rerausgang: Nein\nUSB-Hub-Version: 3.2 Gen 1 (3.1 Gen 1)\nUSB-Upstream-Porttyp: USB Typ-C\nUSB Power Delivery: Ja\nUSB-Stromversorgung bis zu: 65 W\nHDMI-Version: 2.0\nAnzahl Micro HDMI Anschl\u00fcsse: 1\nHDCP: Ja\nWLAN: Ja\nWLAN-Standards: Wi-Fi 5 (802.11ac)\nBluetooth: Ja\nBluetooth-Version: 4.2\nH\u00f6henverstellung: Ja\nH\u00f6heneinstellung: 12 cm\nNeigungswinkelbereich: -2 - 15\u00b0\nNeigungsverstellung: Ja\nEnergieeffizienzklasse (SDR): G\nEnergieeffizienzklasse (HDR): G\nEnergieverbrauch (SDR) pro 1.000 Stunden: 40 kWh\nEnergieverbrauch (HDR) pro 1.000 Stunden: 75 kWh\nStromverbrauch (Standardbetrieb): 40 W\nStromverbrauch (Standby): 0,5 W\nAC Eingangsspannung: 100 - 240 V\nEnergieeffizienzskala: A bis G\nBetriebstemperatur: 10 - 40 \u00b0C\nMitgelieferte Kabel: AC, HDMI, USB\nGer\u00e4tebreite (inkl. Fu\u00df): 713,4 mm\nGer\u00e4tetiefe (inkl. Fu\u00df): 203,8 mm\nGer\u00e4teh\u00f6he (inkl. Fu\u00df): 575,2 mm\nGewicht (mit St\u00e4nder): 6,7 kg\nBreite (ohne Standfu\u00df): 71,3 cm\nTiefe (ohne Standfu\u00df): 2,23 cm\nH\u00f6he (ohne Standfu\u00df): 41,9 cm\nGewicht (ohne St\u00e4nder): 4,4 kg\nVerpackungsbreite: 798 mm\nVerpackungstiefe: 124 mm\nVerpackungsh\u00f6he: 568 mm\nPaketgewicht: 9,4 kg\nWarentarifnummer (HS): 85285210",
    "reference_file": "offer_reference_962.json",
    "shop_name": "mylemon.at"
}