{
    "html_file": "offer_951_7.html",
    "name": "Eizo ColorEdge CG2700S, 27\"",
    "offer_link": "https://www.mylemon.at/artikel/eizo/cg2700s/68-5cm-27-cg2700s-16.html",
    "price": 2036.88,
    "raw_specifications": {
        "AC Eingangsfrequenz": "50 - 60 Hz",
        "AC Eingangsspannung": "100 - 240 V",
        "AMD FreeSync": "Nein",
        "Adobe RGB-Abdeckung": "99%",
        "Anzahl DisplayPort Anschl\u00fcsse": "1",
        "Anzahl HDMI-Anschl\u00fcsse": "1",
        "Anzahl RJ-45-Anschl\u00fcsse": "1",
        "Anzahl der Farben des Displays": "1,07 Milliarden Farben",
        "Anzahl der Upstream-Ports USB Typ-B": "1",
        "Anzahl der Upstream-Ports USB Typ-C": "1",
        "Anzahl der nachgeschalteten Steckpl\u00e4tze vom Typ USB-A": "4",
        "Artikelnummer": "M1CY0YQL",
        "Aufl\u00f6sung": "2560x1440",
        "Besonderheiten": "USB HUB",
        "Bildschirmdiagonale": "68,6 cm (27 Zoll)",
        "Bildschirmdiagonale (cm)": "68,5 cm",
        "Bildschirmform": "Flach",
        "Bildschirmtechnologie": "LCD",
        "Bildwinkel, horizontal": "178\u00b0",
        "Bildwinkel, vertikal": "178\u00b0",
        "Digital horizontale Frequenz": "26 - 89 kHz",
        "Digital vertikale Frequenz": "23 - 61 Hz",
        "Display-Aufl\u00f6sung": "2560 x 1440 Pixel",
        "Displaygr\u00f6\u00dfe": "27 Zoll",
        "EAN": "4995047063650",
        "Energieeffizienzklasse (SDR)": "E",
        "Energieverbrauch (SDR) pro 1.000 Stunden": "18 kWh",
        "Ergonomie": "H\u00f6henverstellbar, Pivot (90 Grad drehbar), Schwenkbar, Neigbar",
        "Farbtiefe": "10 Bit",
        "Flimmerfreie Technologie": "Ja",
        "Ger\u00e4tebreite (inkl. Fu\u00df)": "638 mm",
        "Ger\u00e4teh\u00f6he (inkl. Fu\u00df)": "416 mm",
        "Ger\u00e4tetiefe (inkl. Fu\u00df)": "245 mm",
        "Gewicht (mit St\u00e4nder)": "9,4 kg",
        "HD-Typ": "Wide Quad HD",
        "HDCP": "Ja",
        "HDMI": "Ja",
        "Helligkeit": "400 cd/m\u00b2",
        "Helligkeit (typisch)": "400 cd/m\u00b2",
        "Hersteller Artikelnummer": "CG2700S",
        "H\u00f6heneinstellung": "15,5 cm",
        "H\u00f6henverstellung": "Ja",
        "Integrierter USB-Hub": "Ja",
        "Kabelsperre-Slot": "Ja",
        "Kontrastverh\u00e4ltnis": "1600:1",
        "Marktpositionierung": "Grafikdesign",
        "Maximale Bildwiederholrate": "60 Hz",
        "Men\u00fcsprachen": "Vereinfachtes Chinesisch, Traditionelles Chinesisch, Deutsch, Englisch, Spanisch, Franz\u00f6sisch, Italienisch, Japanisch, Schwedisch",
        "Mitgelieferte Kabel": "AC, HDMI, USB, USB Typ-C auf USB Typ-C",
        "NVIDIA G-SYNC": "Nein",
        "Natives Seitenverh\u00e4ltnis": "16:9",
        "Neigungsverstellung": "Ja",
        "Neigungswinkelbereich": "-5 - 35\u00b0",
        "On-Screen-Display (OSD)": "Ja",
        "Panel": "IPS",
        "Panel-Montage-Schnittstelle": "100 x 100 mm",
        "Panel-Typ": "IPS",
        "Pivot": "Ja",
        "Pivot Winkel": "-90 - 90\u00b0",
        "Pixel Abstand": "0,233 x 0,233 mm",
        "Produktfarbe": "Schwarz",
        "RGB-Farbraum": "Adobe RGB",
        "Reaktionszeit": "19 ms",
        "Schnellstart\u00fcbersicht": "Ja",
        "Schwenkbar": "Ja",
        "Schwenkwinkelbereich": "0 - 344\u00b0",
        "Sichtbare Gr\u00f6\u00dfe (horizontal)": "59,7 cm",
        "Sichtbare Gr\u00f6\u00dfe (vertikal)": "33,6 cm",
        "Stromverbrauch (Standardbetrieb)": "17 W",
        "Stromverbrauch (Standby)": "0,3 W",
        "Technologie mit hohem Dynamikbereich (HDR)": "Hybrid Log-Gamma (HLG)",
        "Touchscreen": "Nein",
        "Typ der Hintergrundbeleuchtung": "LED",
        "USB-Hub-Version": "3.2 Gen 1 (3.1 Gen 1)",
        "USB-Typ-C DisplayPort-Wechselmodus": "Ja",
        "USB-Upstream-Porttyp": "USB Typ-B, USB Typ-C",
        "Unterst\u00fctzte Grafik-Aufl\u00f6sungen": "1920 x 1080 (HD 1080), 1920 x 1200 (WUXGA), 2560 x 1440",
        "Unterst\u00fctzte Video-Modi": "480i, 480p, 576i, 576p, 720p, 1080i, 1080p",
        "VESA-Halterung": "Ja",
        "Video Anschl\u00fcsse": "1x HDMI, 1x DisplayPort, USB-C DisplayPort",
        "Warentarifnummer (HS)": "85285210",
        "Zertifizierung": "CE, CB, UKCA, T\u00dcV/GS, T\u00dcV Ergonomie gepr\u00fcft (einschlie\u00dflich ISO 9241-307)**, T\u00dcV/Color Accuracy (Quick Stability), FograCert Softproofing System (class A), cT\u00dcVus, T\u00dcV/S, EAC, PSE, FCC-B, CAN ICES-3 (B), RCM, VCCI-B, CCC, RoHS, China RoHS, WEEE",
        "sRGB Abdeckung (klassisch)": "100%"
    },
    "raw_specifications_text": "Displaygr\u00f6\u00dfe: 27 Zoll\nAufl\u00f6sung: 2560x1440\nPanel: IPS\nReaktionszeit: 19 ms\nVideo Anschl\u00fcsse: 1x HDMI, 1x DisplayPort, USB-C DisplayPort\nErgonomie: H\u00f6henverstellbar, Pivot (90 Grad drehbar), Schwenkbar, Neigbar\nHelligkeit: 400 cd/m\u00b2\nBesonderheiten: USB HUB\nHersteller Artikelnummer: CG2700S\nEAN: 4995047063650\nArtikelnummer: M1CY0YQL\nBildschirmdiagonale: 68,6 cm (27 Zoll)\nDisplay-Aufl\u00f6sung: 2560 x 1440 Pixel\nNatives Seitenverh\u00e4ltnis: 16:9\nBildschirmtechnologie: LCD\nTouchscreen: Nein\nHD-Typ: Wide Quad HD\nPanel-Typ: IPS\nBildschirmform: Flach\nKontrastverh\u00e4ltnis: 1600:1\nMaximale Bildwiederholrate: 60 Hz\nAnzahl der Farben des Displays: 1,07 Milliarden Farben\nTyp der Hintergrundbeleuchtung: LED\nHelligkeit (typisch): 400 cd/m\u00b2\nUnterst\u00fctzte Grafik-Aufl\u00f6sungen: 1920 x 1080 (HD 1080), 1920 x 1200 (WUXGA), 2560 x 1440\nUnterst\u00fctzte Video-Modi: 480i, 480p, 576i, 576p, 720p, 1080i, 1080p\nBildwinkel, horizontal: 178\u00b0\nBildwinkel, vertikal: 178\u00b0\nPixel Abstand: 0,233 x 0,233 mm\nSichtbare Gr\u00f6\u00dfe (horizontal): 59,7 cm\nSichtbare Gr\u00f6\u00dfe (vertikal): 33,6 cm\nDigital horizontale Frequenz: 26 - 89 kHz\nDigital vertikale Frequenz: 23 - 61 Hz\nBildschirmdiagonale (cm): 68,5 cm\nTechnologie mit hohem Dynamikbereich (HDR): Hybrid Log-Gamma (HLG)\nFarbtiefe: 10 Bit\nRGB-Farbraum: Adobe RGB\nsRGB Abdeckung (klassisch): 100%\nAdobe RGB-Abdeckung: 99%\nNVIDIA G-SYNC: Nein\nAMD FreeSync: Nein\nFlimmerfreie Technologie: Ja\nMarktpositionierung: Grafikdesign\nProduktfarbe: Schwarz\nZertifizierung: CE, CB, UKCA, T\u00dcV/GS, T\u00dcV Ergonomie gepr\u00fcft (einschlie\u00dflich ISO 9241-307)**, T\u00dcV/Color Accuracy (Quick Stability), FograCert Softproofing System (class A), cT\u00dcVus, T\u00dcV/S, EAC, PSE, FCC-B, CAN ICES-3 (B), RCM, VCCI-B, CCC, RoHS, China RoHS, WEEE\nIntegrierter USB-Hub: Ja\nHDMI: Ja\nUSB-Hub-Version: 3.2 Gen 1 (3.1 Gen 1)\nUSB-Upstream-Porttyp: USB Typ-B, USB Typ-C\nAnzahl der Upstream-Ports USB Typ-B: 1\nAnzahl der Upstream-Ports USB Typ-C: 1\nAnzahl der nachgeschalteten Steckpl\u00e4tze vom Typ USB-A: 4\nUSB-Typ-C DisplayPort-Wechselmodus: Ja\nAnzahl HDMI-Anschl\u00fcsse: 1\nAnzahl DisplayPort Anschl\u00fcsse: 1\nHDCP: Ja\nVESA-Halterung: Ja\nKabelsperre-Slot: Ja\nH\u00f6henverstellung: Ja\nPanel-Montage-Schnittstelle: 100 x 100 mm\nH\u00f6heneinstellung: 15,5 cm\nPivot: Ja\nPivot Winkel: -90 - 90\u00b0\nSchwenkbar: Ja\nSchwenkwinkelbereich: 0 - 344\u00b0\nNeigungswinkelbereich: -5 - 35\u00b0\nOn-Screen-Display (OSD): Ja\nMen\u00fcsprachen: Vereinfachtes Chinesisch, Traditionelles Chinesisch, Deutsch, Englisch, Spanisch, Franz\u00f6sisch, Italienisch, Japanisch, Schwedisch\nNeigungsverstellung: Ja\nEnergieeffizienzklasse (SDR): E\nEnergieverbrauch (SDR) pro 1.000 Stunden: 18 kWh\nStromverbrauch (Standardbetrieb): 17 W\nStromverbrauch (Standby): 0,3 W\nAC Eingangsspannung: 100 - 240 V\nAC Eingangsfrequenz: 50 - 60 Hz\nMitgelieferte Kabel: AC, HDMI, USB, USB Typ-C auf USB Typ-C\nSchnellstart\u00fcbersicht: Ja\nGer\u00e4tebreite (inkl. Fu\u00df): 638 mm\nGer\u00e4tetiefe (inkl. Fu\u00df): 245 mm\nGer\u00e4teh\u00f6he (inkl. Fu\u00df): 416 mm\nGewicht (mit St\u00e4nder): 9,4 kg\nWarentarifnummer (HS): 85285210\nAnzahl RJ-45-Anschl\u00fcsse: 1",
    "reference_file": "offer_reference_951.json",
    "shop_name": "mylemon.at"
}