{
    "html_file": "offer_627_12.html",
    "name": "Philips E-line 346E2LAE, 34\"",
    "offer_link": "https://www.ditech.at/details.php?artnr=360874",
    "price": 334.9,
    "raw_specifications": {
        "AMD FreeSync": "Ja",
        "Adaptive Sync": "Ja",
        "Anschl\u00fcsse - DisplayPort": "1",
        "Anschl\u00fcsse - DisplayPort 1.2 100Hz@3440x1440": "1",
        "Anschl\u00fcsse - HDMI": "1",
        "Anschl\u00fcsse - HDMI 2.0 100Hz@3440x1440": "1",
        "Anschl\u00fcsse - USB-C 3.0 mit DisplayPort": "1",
        "Anschl\u00fcsse - USB-C 3.0 mit DisplayPort 1.2 100Hz@3440x1440": "1",
        "Anwendung": "station\u00e4r",
        "Audio": "Lautsprecher (2x 3W),  1x Line-Out",
        "Aufl\u00f6sung": "3440x1440",
        "Beschichtung": "matt (non-glare),  H\u00e4rtegrad 3H",
        "Besonderheiten": "Slim Bezel,  Steuerkreuz,  USB-C Power Delivery (65W),  Sicherheitsschloss (Kensington),  HDCP 2.2,  Philips SmartImage",
        "Bildwiederholfrequenz": "100Hz",
        "Blickwinkel": "178\u00b0/178\u00b0",
        "Diagonale": "34\"/86.4cm",
        "Energieeffizienzklasse alt (A+++ bis G)": "B",
        "Energieverbrauch SDR": "31kWh/1000h",
        "Ergonomie": "100mm (h\u00f6henverstellbar),  N/A (Pivot),  N/A (drehbar),  +20\u00b0/-5\u00b0 (neigbar),  keine Angabe (Schr\u00e4glage)",
        "FRC": "unbekannt",
        "Farbe": "schwarz",
        "Farbraum - Adobe RGB": "90%",
        "Farbraum - sRGB": "121.32%",
        "Farbtiefe": "8bit (16.7 Mio. Farben)",
        "Form": "gerade (flat)",
        "Gewicht": "7.36kg (mit Standfu\u00df),  5.43kg (ohne Standfu\u00df)",
        "HDR": "N/A",
        "Helligkeit": "300cd/m\u00b2",
        "Herstellergarantie": "zwei Jahre (Pickup&Return)",
        "Hintergrundbeleuchtung": "White-LED,  flicker-free,  Blaulichtfilter",
        "Jahresverbrauch alt (A+++ bis G)": "56.94kWh",
        "Kontrast - statisch": "4.000:1",
        "Lautsprecher": "Ja",
        "Leistungsaufnahme": "keine Angabe (maximal),  35W (typisch),  keine Angabe (Energielabel alt A+++ bis G),  0.5W (Standby)",
        "Panel": "VA",
        "Reaktionszeit - GtG": "4ms",
        "Reaktionszeit - MPRT": "1ms",
        "Screen-to-Body-Ratio": "89.1% (berechnet)",
        "Seitenverh\u00e4ltnis": "21:9",
        "Signalfrequenz": "30-160kHz (horizontal),  48-100Hz (vertikal)",
        "Stromversorgung": "DC-In (externes Netzteil)",
        "USB-Hub In": "1x USB-C 3.0 mit DisplayPort 1.2",
        "USB-Hub Out": "4x USB-A 3.0",
        "USB-Schreibweise": "Link",
        "Unsch\u00e4rfereduktionsfunktion": "N/A",
        "VESA": "100x100 (belegt)",
        "Weitere Anschl\u00fcsse": "N/A"
    },
    "raw_specifications_text": "Adaptive Sync: Ja\nAMD FreeSync: Ja\nAnschl\u00fcsse - DisplayPort: 1\nAnschl\u00fcsse - DisplayPort 1.2 100Hz@3440x1440: 1\nAnschl\u00fcsse - HDMI: 1\nAnschl\u00fcsse - HDMI 2.0 100Hz@3440x1440: 1\nAnschl\u00fcsse - USB-C 3.0 mit DisplayPort: 1\nAnschl\u00fcsse - USB-C 3.0 mit DisplayPort 1.2 100Hz@3440x1440: 1\nAnwendung: station\u00e4r\nAudio: Lautsprecher (2x 3W),  1x Line-Out\nAufl\u00f6sung: 3440x1440\nBeschichtung: matt (non-glare),  H\u00e4rtegrad 3H\nBesonderheiten: Slim Bezel,  Steuerkreuz,  USB-C Power Delivery (65W),  Sicherheitsschloss (Kensington),  HDCP 2.2,  Philips SmartImage\nBildwiederholfrequenz: 100Hz\nBlickwinkel: 178\u00b0/178\u00b0\nDiagonale: 34\"/86.4cm\nEnergieeffizienzklasse alt (A+++ bis G): B\nEnergieverbrauch SDR: 31kWh/1000h\nErgonomie: 100mm (h\u00f6henverstellbar),  N/A (Pivot),  N/A (drehbar),  +20\u00b0/-5\u00b0 (neigbar),  keine Angabe (Schr\u00e4glage)\nFarbe: schwarz\nFarbraum - Adobe RGB: 90%\nFarbraum - sRGB: 121.32%\nFarbtiefe: 8bit (16.7 Mio. Farben)\nForm: gerade (flat)\nFRC: unbekannt\nGewicht: 7.36kg (mit Standfu\u00df),  5.43kg (ohne Standfu\u00df)\nHDR: N/A\nHelligkeit: 300cd/m\u00b2\nHerstellergarantie: zwei Jahre (Pickup&Return)\nHintergrundbeleuchtung: White-LED,  flicker-free,  Blaulichtfilter\nJahresverbrauch alt (A+++ bis G): 56.94kWh\nKontrast - statisch: 4.000:1\nLautsprecher: Ja\nLeistungsaufnahme: keine Angabe (maximal),  35W (typisch),  keine Angabe (Energielabel alt A+++ bis G),  0.5W (Standby)\nPanel: VA\nReaktionszeit - GtG: 4ms\nReaktionszeit - MPRT: 1ms\nScreen-to-Body-Ratio: 89.1% (berechnet)\nSeitenverh\u00e4ltnis: 21:9\nSignalfrequenz: 30-160kHz (horizontal),  48-100Hz (vertikal)\nStromversorgung: DC-In (externes Netzteil)\nUnsch\u00e4rfereduktionsfunktion: N/A\nUSB-Hub In: 1x USB-C 3.0 mit DisplayPort 1.2\nUSB-Hub Out: 4x USB-A 3.0\nUSB-Schreibweise: Link\nVESA: 100x100 (belegt)\nWeitere Anschl\u00fcsse: N/A",
    "reference_file": "offer_reference_627.json",
    "shop_name": "DiTech.at"
}