{
    "html_file": "offer_1297_18.html",
    "name": "AOC Agon AG493UCX2, 48.8\"",
    "offer_link": "https://www.ba-computer.at/aoc-gaming-ag493ucx2-agon-series-led-monitor-gaming-gebogen-124-5-cm-49-ag493ucx2.html",
    "price": 1290.41,
    "raw_specifications": {
        "Abmessungen (Breite x Tiefe x H\u00f6he)": "119.44 cm x 30.8 cm x 46.76 cm - mit Fu\u00df",
        "Adaptive-Sync Technologie": "AMD FreeSync Premium Pro, NVIDIA G-SYNC Compatible",
        "Ausgangsleistung/Kanal": "5 Watt",
        "Besonderheiten": "Bild f\u00fcr Bild, Spielmodus, flimmerfreie Technologie, AOC Shadow Control, Picture-in-Picture, Low Blue Light-Technologie, an 3 Seiten rahmenlos",
        "Bildschirmbeschichtung": "Blendfrei, 3H Hard Coating",
        "Bildschirmtyp": "VA",
        "Details zu Abmessungen & Gewicht": "Mit Standfu\u00df (niedrigste Position) - Breite: 119.44 cm - Tiefe: 30.8 cm - H\u00f6he: 46.76 cm - Gewicht: 14.4 kg \u00a6 Mit Standfu\u00df (h\u00f6chste Position) - Breite: 119.44 cm - Tiefe: 30.8 cm - H\u00f6he: 56.76 cm - Gewicht: 14.4 kg \u00a6 Ohne Fu\u00df - Breite: 119.44 cm - Tiefe: 15.324 cm - H\u00f6he: 36.94 cm",
        "Diagonalabmessung": "124.5 cm (49\")",
        "Display-Typ": "LED-hintergrundbeleuchteter LCD-Monitor / TFT-Aktivmatrix",
        "Eingangsspannung": "Wechselstrom 100-240 V (50/60 Hz)",
        "Einstellungen der Anzeigeposition": "H\u00f6he, Drehung, Neigung",
        "Energie Effizienzklasse": "Klasse G",
        "Energieklasse (HDR)": "Klasse G",
        "Enthaltene Kabel": "1 x DisplayPort-Kabel - 1.8 m \u00a6 1 x HDMI-Kabel - 1.8 m \u00a6 1 x USB-Kabel \u00a6 1 x Kabel USB-C auf USB-C - 1.8 m",
        "Farbe": "Textured Black",
        "Farbraum": "100% NTSC (CIE 1976), 121.57% sRGB (CIE 1931), 98% Adobe RGB (CIE 1976), 90.1% Adobe RGB (CIE 1931)",
        "Farbunterst\u00fctzung": "16,7 Millionen Farben",
        "Gaming": "Ja",
        "Geschwungener Bildschirm": "Ja (1800R)",
        "Gewicht": "14.4 kg",
        "HDR-Zertifizierung": "DisplayHDR 400",
        "Helligkeit": "550 cd/m\u00b2",
        "Hintergrundbeleuchtungs-Technologie": "WLED",
        "Horizontale Bildwiederholrate": "30 - 250 kHz",
        "Horizontaler Betrachtungswinkel": "178",
        "H\u00f6heneinstellung": "100 mm",
        "Integrierte Peripherieger\u00e4te": "KVM-Switch, USB 3.1 Gen 1/USB-C Hub",
        "Kennzeichnung": "WHQL, FCC, RoHS, WEEE, cTUVus",
        "Kontrast": "3000:1 / 80000000:1 (dynamisch)",
        "Leistungsmerkmale": "Slot f\u00fcr Sicherheitsschloss (Kabelschloss getrennt erh\u00e4ltlich)",
        "Mitgelieferte Software": "AOC eSaver, AOC G-Menu",
        "Native Aufl\u00f6sung": "Dual Quad HD 5120 x 1440 (DisplayPort: 165 Hz, HDMI: 75 Hz, USB-C: 120 Hz)",
        "Neigungswinkel": "-3.5/+13.5",
        "OSD-Sprachen": "Multilingual",
        "Pixelpitch": "0.2331 mm",
        "Ppi": "109",
        "Reaktionszeit": "4 ms (gray-to-gray), 1 ms (MPRT)",
        "Schlosstyp zur Diebstahlsicherung": "Kensington Slot",
        "Schnittstellen": "DisplayPort 1.4 \u00a6 USB-C/DisplayPort Alt Mode mit Spannungsversorgung (bis zu 65 W) \u00a6 3 x HDMI \u00a6 3 x USB 3.1 Gen 1 \u00a6 USB 3.1 Gen 1 (Schnellladung) \u00a6 Kopfh\u00f6rer",
        "Schwenkwinkel": "30",
        "Seitenverh\u00e4ltnis": "32:9",
        "Service und Support": "Begrenzte Garantie - 3 Jahre",
        "Sichtbare Bildfl\u00e4che": "124 cm (48.8\")",
        "Stromverbrauch (Aus-Modus)": "0.5 Watt",
        "Stromverbrauch (typisch)": "68 Watt",
        "Stromverbrauch HDR (eingeschaltet)": "105 kWh/1.000 h",
        "Stromverbrauch SDR (eingeschaltet)": "55 kWh/1.000 h",
        "Stromverbrauch im Standby-Modus": "0.5 Watt",
        "Transportbreite": "130.8 cm",
        "Transportgewicht": "20.8 kg",
        "Transporth\u00f6he": "42 cm",
        "Transporttiefe": "55.3 cm",
        "Typ": "Lautsprecher - Stereo",
        "VESA-Halterung": "100 x 100 mm",
        "Vertikale Bildwiederholrate": "48 - 165 Hz",
        "Vertikaler Betrachtungswinkel": "178",
        "Zubeh\u00f6r im Lieferumfang": "Fernbedienung"
    },
    "raw_specifications_text": "Display-Typ: LED-hintergrundbeleuchteter LCD-Monitor / TFT-Aktivmatrix\nEnergie Effizienzklasse: Klasse G\nEnergieklasse (HDR): Klasse G\nDiagonalabmessung: 124.5 cm (49\")\nSichtbare Bildfl\u00e4che: 124 cm (48.8\")\nGeschwungener Bildschirm: Ja (1800R)\nAdaptive-Sync Technologie: AMD FreeSync Premium Pro, NVIDIA G-SYNC Compatible\nIntegrierte Peripherieger\u00e4te: KVM-Switch, USB 3.1 Gen 1/USB-C Hub\nBildschirmtyp: VA\nSeitenverh\u00e4ltnis: 32:9\nNative Aufl\u00f6sung: Dual Quad HD 5120 x 1440 (DisplayPort: 165 Hz, HDMI: 75 Hz, USB-C: 120 Hz)\nPixelpitch: 0.2331 mm\nPpi: 109\nHelligkeit: 550 cd/m\u00b2\nKontrast: 3000:1 / 80000000:1 (dynamisch)\nHDR-Zertifizierung: DisplayHDR 400\nFarbunterst\u00fctzung: 16,7 Millionen Farben\nFarbraum: 100% NTSC (CIE 1976), 121.57% sRGB (CIE 1931), 98% Adobe RGB (CIE 1976), 90.1% Adobe RGB (CIE 1931)\nReaktionszeit: 4 ms (gray-to-gray), 1 ms (MPRT)\nVertikale Bildwiederholrate: 48 - 165 Hz\nHorizontale Bildwiederholrate: 30 - 250 kHz\nGaming: Ja\nHorizontaler Betrachtungswinkel: 178\nVertikaler Betrachtungswinkel: 178\nBildschirmbeschichtung: Blendfrei, 3H Hard Coating\nHintergrundbeleuchtungs-Technologie: WLED\nOSD-Sprachen: Multilingual\nBesonderheiten: Bild f\u00fcr Bild, Spielmodus, flimmerfreie Technologie, AOC Shadow Control, Picture-in-Picture, Low Blue Light-Technologie, an 3 Seiten rahmenlos\nFarbe: Textured Black\nAbmessungen (Breite x Tiefe x H\u00f6he): 119.44 cm x 30.8 cm x 46.76 cm - mit Fu\u00df\nGewicht: 14.4 kg\nTyp: Lautsprecher - Stereo\nAusgangsleistung/Kanal: 5 Watt\nSchnittstellen: DisplayPort 1.4 \u00a6 USB-C/DisplayPort Alt Mode mit Spannungsversorgung (bis zu 65 W) \u00a6 3 x HDMI \u00a6 3 x USB 3.1 Gen 1 \u00a6 USB 3.1 Gen 1 (Schnellladung) \u00a6 Kopfh\u00f6rer\nEinstellungen der Anzeigeposition: H\u00f6he, Drehung, Neigung\nNeigungswinkel: -3.5/+13.5\nSchwenkwinkel: 30\nH\u00f6heneinstellung: 100 mm\nVESA-Halterung: 100 x 100 mm\nLeistungsmerkmale: Slot f\u00fcr Sicherheitsschloss (Kabelschloss getrennt erh\u00e4ltlich)\nZubeh\u00f6r im Lieferumfang: Fernbedienung\nEnthaltene Kabel: 1 x DisplayPort-Kabel - 1.8 m \u00a6 1 x HDMI-Kabel - 1.8 m \u00a6 1 x USB-Kabel \u00a6 1 x Kabel USB-C auf USB-C - 1.8 m\nKennzeichnung: WHQL, FCC, RoHS, WEEE, cTUVus\nSchlosstyp zur Diebstahlsicherung: Kensington Slot\nEingangsspannung: Wechselstrom 100-240 V (50/60 Hz)\nStromverbrauch SDR (eingeschaltet): 55 kWh/1.000 h\nStromverbrauch HDR (eingeschaltet): 105 kWh/1.000 h\nStromverbrauch (typisch): 68 Watt\nStromverbrauch im Standby-Modus: 0.5 Watt\nStromverbrauch (Aus-Modus): 0.5 Watt\nMitgelieferte Software: AOC eSaver, AOC G-Menu\nDetails zu Abmessungen & Gewicht: Mit Standfu\u00df (niedrigste Position) - Breite: 119.44 cm - Tiefe: 30.8 cm - H\u00f6he: 46.76 cm - Gewicht: 14.4 kg \u00a6 Mit Standfu\u00df (h\u00f6chste Position) - Breite: 119.44 cm - Tiefe: 30.8 cm - H\u00f6he: 56.76 cm - Gewicht: 14.4 kg \u00a6 Ohne Fu\u00df - Breite: 119.44 cm - Tiefe: 15.324 cm - H\u00f6he: 36.94 cm\nTransportbreite: 130.8 cm\nTransporttiefe: 55.3 cm\nTransporth\u00f6he: 42 cm\nTransportgewicht: 20.8 kg\nService und Support: Begrenzte Garantie - 3 Jahre",
    "reference_file": "offer_reference_1297.json",
    "shop_name": "BA-Computer"
}