{
    "html_file": "offer_112_17.html",
    "name": "AOC 27E3QAF, 27\"",
    "offer_link": "https://www.taufnaus.de/product/13711961",
    "price": 201.72,
    "raw_specifications": {
        "Abmessungen (Breite x Tiefe x H\u00f6he)": "61.47 cm x 29.62 cm x 54.45 cm - mit Standfu\u00df (h\u00f6chste Position)",
        "Adaptive-Sync Technologie": "VESA Adaptive-Sync",
        "Ausgangsleistung/Kanal": "2 Watt",
        "Besonderheiten": "Integrierte Kabelf\u00fchrung, Slim Design, flimmerfreie Technologie, Low Blue Light-Technologie, an 3 Seiten rahmenlos, Global Dimming",
        "Bildschirmbeschichtung": "Blendfrei, 3H Hard Coating",
        "Bildschirmtyp": "IPS",
        "Details zu Abmessungen & Gewicht": "Mit Standfu\u00df (h\u00f6chste Position) - Breite: 61.47 cm - Tiefe: 29.62 cm - H\u00f6he: 54.45 cm - Gewicht: 5.38 kg \u00a6 Mit Standfu\u00df (niedrigste Position) - Breite: 61.47 cm - Tiefe: 29.62 cm - H\u00f6he: 20.13 cm - Gewicht: 5.38 kg \u00a6 Ohne Fu\u00df - Breite: 61.47 cm - Tiefe: 5.08 cm - H\u00f6he: 36.96 cm - Gewicht: 3.56 kg",
        "Diagonalabmessung": "68.6 cm (27\")",
        "Display-Typ": "LED-hintergrundbeleuchteter LCD-Monitor / TFT-Aktivmatrix",
        "ENERGY STAR zertifiziert": "Ja",
        "EPEAT-kompatibel": "EPEAT Silver",
        "Eingangsspannung": "Wechselstrom 100-240 V (50/60 Hz)",
        "Einstellungen der Anzeigeposition": "H\u00f6he, Pivot (Rotation), Drehung, Neigung",
        "Enthaltene Kabel": "1 x HDMI-Kabel \u00a6 1 x DisplayPort-Kabel",
        "Farbe": "Textured Black",
        "Farbunterst\u00fctzung": "16,7 Millionen Farben",
        "Gewicht": "5.38 kg",
        "Hintergrundbeleuchtungs-Technologie": "WLED",
        "Horizontale Bildwiederholrate": "30 - 85 kHz",
        "Horizontaler Betrachtungswinkel": "178",
        "Integrierte Peripherieger\u00e4te": "USB 3.2 Hub",
        "Kennzeichnung": "TUV GS, FCC, RoHS, WEEE, EAC, HF, TCO Certified 9.0, TUV/ISO 9241-307",
        "Kontrast": "1000:1 / 20000000:1 (dynamisch)",
        "Leistungsmerkmale": "Slot f\u00fcr Sicherheitsschloss (Kabelschloss getrennt erh\u00e4ltlich)",
        "Native Aufl\u00f6sung": "Full HD (1080p) 1920 x 1080 bei 75 Hz",
        "Neigungswinkel": "3.5/33",
        "OSD-Sprachen": "Tschechisch, Chinesisch (tradionell), Chinesisch (vereinfacht), Englisch, Deutsch, Franz\u00f6sisch, Italienisch, Portugiesisch, Polnisch, Finnisch, Schwedisch, Russisch, Spanisch, Holl\u00e4ndisch, Japanisch, Koreanisch",
        "Pixelpitch": "0.3114 mm",
        "Ppi": "82",
        "Reaktionszeit": "4 ms (gray-to-gray)",
        "Rotationswinkel": "-90/+90",
        "Schlosstyp zur Diebstahlsicherung": "Kensington Slot",
        "Schnittstellen": "VGA (HD-15) \u00a6 HDMI 1.4 (HDCP 1.4) \u00a6 DisplayPort 1.2 \u00a6 2 x USB 3.2 Gen 1 Downstream (Schnellladung) \u00a6 Audio Line-In/-Out (Mini-Klinkenstecker)",
        "Schwenkwinkel": "175",
        "Seitenverh\u00e4ltnis": "16:9",
        "Service und Support": "Begrenzte Garantie - 3 Jahre",
        "Stromverbrauch (Aus-Modus)": "0.3 Watt",
        "Stromverbrauch (typisch)": "18 Watt",
        "Stromverbrauch im Standby-Modus": "0.5 Watt",
        "Transportbreite": "82 cm",
        "Transportgewicht": "8.71 kg",
        "Transporth\u00f6he": "48.1 cm",
        "Transporttiefe": "16.2 cm",
        "Typ": "Lautsprecher - Stereo",
        "VESA-Halterung": "100 x 100 mm",
        "Vertikale Bildwiederholrate": "48 - 75 Hz",
        "Vertikaler Betrachtungswinkel": "178"
    },
    "raw_specifications_text": "Display-Typ: LED-hintergrundbeleuchteter LCD-Monitor / TFT-Aktivmatrix\nDiagonalabmessung: 68.6 cm (27\")\nAdaptive-Sync Technologie: VESA Adaptive-Sync\nIntegrierte Peripherieger\u00e4te: USB 3.2 Hub\nBildschirmtyp: IPS\nSeitenverh\u00e4ltnis: 16:9\nNative Aufl\u00f6sung: Full HD (1080p) 1920 x 1080 bei 75 Hz\nPixelpitch: 0.3114 mm\nPpi: 82\nKontrast: 1000:1 / 20000000:1 (dynamisch)\nFarbunterst\u00fctzung: 16,7 Millionen Farben\nReaktionszeit: 4 ms (gray-to-gray)\nVertikale Bildwiederholrate: 48 - 75 Hz\nHorizontale Bildwiederholrate: 30 - 85 kHz\nHorizontaler Betrachtungswinkel: 178\nVertikaler Betrachtungswinkel: 178\nBildschirmbeschichtung: Blendfrei, 3H Hard Coating\nHintergrundbeleuchtungs-Technologie: WLED\nOSD-Sprachen: Tschechisch, Chinesisch (tradionell), Chinesisch (vereinfacht), Englisch, Deutsch, Franz\u00f6sisch, Italienisch, Portugiesisch, Polnisch, Finnisch, Schwedisch, Russisch, Spanisch, Holl\u00e4ndisch, Japanisch, Koreanisch\nBesonderheiten: Integrierte Kabelf\u00fchrung, Slim Design, flimmerfreie Technologie, Low Blue Light-Technologie, an 3 Seiten rahmenlos, Global Dimming\nFarbe: Textured Black\nAbmessungen (Breite x Tiefe x H\u00f6he): 61.47 cm x 29.62 cm x 54.45 cm - mit Standfu\u00df (h\u00f6chste Position)\nGewicht: 5.38 kg\nTyp: Lautsprecher - Stereo\nAusgangsleistung/Kanal: 2 Watt\nSchnittstellen: VGA (HD-15) \u00a6 HDMI 1.4 (HDCP 1.4) \u00a6 DisplayPort 1.2 \u00a6 2 x USB 3.2 Gen 1 Downstream (Schnellladung) \u00a6 Audio Line-In/-Out (Mini-Klinkenstecker)\nEinstellungen der Anzeigeposition: H\u00f6he, Pivot (Rotation), Drehung, Neigung\nNeigungswinkel: 3.5/33\nSchwenkwinkel: 175\nRotationswinkel: -90/+90\nVESA-Halterung: 100 x 100 mm\nLeistungsmerkmale: Slot f\u00fcr Sicherheitsschloss (Kabelschloss getrennt erh\u00e4ltlich)\nEnthaltene Kabel: 1 x HDMI-Kabel \u00a6 1 x DisplayPort-Kabel\nKennzeichnung: TUV GS, FCC, RoHS, WEEE, EAC, HF, TCO Certified 9.0, TUV/ISO 9241-307\nSchlosstyp zur Diebstahlsicherung: Kensington Slot\nEingangsspannung: Wechselstrom 100-240 V (50/60 Hz)\nStromverbrauch (typisch): 18 Watt\nStromverbrauch im Standby-Modus: 0.5 Watt\nStromverbrauch (Aus-Modus): 0.3 Watt\nDetails zu Abmessungen & Gewicht: Mit Standfu\u00df (h\u00f6chste Position) - Breite: 61.47 cm - Tiefe: 29.62 cm - H\u00f6he: 54.45 cm - Gewicht: 5.38 kg \u00a6 Mit Standfu\u00df (niedrigste Position) - Breite: 61.47 cm - Tiefe: 29.62 cm - H\u00f6he: 20.13 cm - Gewicht: 5.38 kg \u00a6 Ohne Fu\u00df - Breite: 61.47 cm - Tiefe: 5.08 cm - H\u00f6he: 36.96 cm - Gewicht: 3.56 kg\nTransportbreite: 82 cm\nTransporttiefe: 16.2 cm\nTransporth\u00f6he: 48.1 cm\nTransportgewicht: 8.71 kg\nEPEAT-kompatibel: EPEAT Silver\nENERGY STAR zertifiziert: Ja\nService und Support: Begrenzte Garantie - 3 Jahre",
    "reference_file": "offer_reference_112.json",
    "shop_name": "TaufNaus"
}