{
    "html_file": "offer_286_33.html",
    "name": "LG 27BN65YP-B, 27\"",
    "offer_link": "https://ms-it-beratung.at/shop/details.php?art=425493&artname=LG+27%22+27BN65YP-B+Full+HD+DVI+DP+HDMI+USB+IPS+16%3A9+black",
    "price": 200.0,
    "raw_specifications": {
        "AMD FreeSync": "Nein",
        "Anzahl DVI-D-Anschl\u00fcsse": "1",
        "Anzahl DisplayPort Anschl\u00fcsse": "1",
        "Anzahl HDMI-Anschl\u00fcsse": "1",
        "Anzahl der Farben des Displays": "16,7 Millionen Farben",
        "Anzahl der Lautsprecher": "2",
        "Anzahl der nachgeschalteten Steckpl\u00e4tze vom Typ USB-A": "2",
        "Anzahl der vorgeschalteten Steckpl\u00e4tze": "1",
        "Betriebsanleitung": "Ja",
        "Bildschirmdiagonale": "68,6 cm (27\")",
        "Bildschirmform": "Flach",
        "Bildschirmtechnologie": "LCD",
        "Bildwinkel, horizontal": "178\u00b0",
        "Bildwinkel, vertikal": "178\u00b0",
        "Blendfreier Bildschirm": "Ja",
        "Breite (ohne Standfu\u00df)": "611,5 mm",
        "DVI Anschluss": "Ja",
        "Display-Aufl\u00f6sung": "1920 x 1080 Pixel",
        "DisplayPort Kabell\u00e4nge": "1,8 m",
        "DisplayPorts-Version": "1.2",
        "Eingebaute Lautsprecher": "Ja",
        "Energieeffizienzklasse (HDR)": "Nicht verf\u00fcgbar",
        "Energieeffizienzklasse (SDR)": "E",
        "Energieeffizienzskala": "A bis G",
        "Energieverbrauch (SDR) pro 1.000 Stunden": "21 kWh",
        "Farbskala": "72%",
        "Farbtiefe": "8 Bit",
        "Ger\u00e4tebreite (inkl. Fu\u00df)": "611,5 mm",
        "Ger\u00e4teh\u00f6he (inkl. Fu\u00df)": "526,2 mm",
        "Ger\u00e4tetiefe (inkl. Fu\u00df)": "240 mm",
        "Gewicht (mit St\u00e4nder)": "7,2 kg",
        "Gewicht (ohne St\u00e4nder)": "5 kg",
        "Gew\u00e4hrleistungsfrist": "3 Jahr(e)",
        "HD-Typ": "Full HD",
        "HDCP": "Ja",
        "HDCP-Version": "1.4",
        "HDMI": "Ja",
        "HDMI-Version": "1.4",
        "Helligkeit (typisch)": "250 cd/m\u00b2",
        "H\u00f6he (ohne Standfu\u00df)": "367,5 mm",
        "H\u00f6heneinstellung": "13 cm",
        "H\u00f6henverstellung": "Ja",
        "Integrierte Kamera": "Nein",
        "Integrierter USB-Hub": "Ja",
        "Kabelsperre-Slot": "Nein",
        "Kontrast-Verst\u00e4rker": "Ja",
        "Kontrastverh\u00e4ltnis": "1000:1",
        "Kontrastverh\u00e4ltnis (dynamisch)": "5000000:1",
        "Kopfh\u00f6rerausgang": "Ja",
        "Kopfh\u00f6rerausg\u00e4nge": "1",
        "Markenspezifische Technologien": "Black Equalizer, Crosshair, DAS Mode",
        "Marktpositionierung": "B\u00fcro",
        "Maximale Bildwiederholrate": "75 Hz",
        "Mitgelieferte Kabel": "AC",
        "NVIDIA G-SYNC": "Nein",
        "Nachhaltigkeitszertifikate": "ErP, Eidgen\u00f6ssische Kommunikationskommission (FCC), REACH, RoHS",
        "Name der Farbe": "Matt Black",
        "Natives Seitenverh\u00e4ltnis": "16:9",
        "Neigungsverstellung": "Ja",
        "Neigungswinkelbereich": "-5 - 35\u00b0",
        "PC Audio-Eingang": "Ja",
        "Paketgewicht": "9,7 kg",
        "Panel-Montage-Schnittstelle": "100 x 100 mm",
        "Panel-Typ": "IPS",
        "Pivot": "Ja",
        "Pivot Winkel": "0 - 90\u00b0",
        "Pixel Abstand": "0,31 x 0,31 mm",
        "Produktfarbe": "Schwarz",
        "RGB-Farbraum": "NTSC",
        "RMS-Leistung": "4 W",
        "Reaktionszeit": "5 ms",
        "Schattensteuerung": "Ja",
        "Schwenkbar": "Ja",
        "Schwenkwinkelbereich": "0 - 355\u00b0",
        "Smart-Modi": "Kino, Benutzerdefinierung, Spiel, M-Book, Foto",
        "Spiel-Modus": "Ja",
        "St\u00e4nder enthalten": "Ja",
        "Tiefe (ohne Standfu\u00df)": "52,1 mm",
        "Touchscreen": "Nein",
        "Typ der Hintergrundbeleuchtung": "Direkte LED",
        "USB-Upstream-Porttyp": "USB Typ-C",
        "VESA-Halterung": "Ja",
        "Verpackungsart": "Box",
        "Verpackungsbreite": "693 mm",
        "Verpackungsh\u00f6he": "534 mm",
        "Verpackungstiefe": "195 mm",
        "Wandmontage": "Ja"
    },
    "raw_specifications_text": "Bildschirmdiagonale: 68,6 cm (27\")\nDisplay-Aufl\u00f6sung: 1920 x 1080 Pixel\nNatives Seitenverh\u00e4ltnis: 16:9\nBildschirmtechnologie: LCD\nTouchscreen: Nein\nHD-Typ: Full HD\nPanel-Typ: IPS\nTyp der Hintergrundbeleuchtung: Direkte LED\nHelligkeit (typisch): 250 cd/m\u00b2\nReaktionszeit: 5 ms\nBlendfreier Bildschirm: Ja\nBildschirmform: Flach\nKontrastverh\u00e4ltnis: 1000:1\nKontrastverh\u00e4ltnis (dynamisch): 5000000:1\nMaximale Bildwiederholrate: 75 Hz\nBildwinkel, horizontal: 178\u00b0\nBildwinkel, vertikal: 178\u00b0\nAnzahl der Farben des Displays: 16,7 Millionen Farben\nPixel Abstand: 0,31 x 0,31 mm\nKontrast-Verst\u00e4rker: Ja\nFarbtiefe: 8 Bit\nRGB-Farbraum: NTSC\nFarbskala: 72%\nNVIDIA G-SYNC: Nein\nAMD FreeSync: Nein\nMarkenspezifische Technologien: Black Equalizer, Crosshair, DAS Mode\nSchattensteuerung: Ja\nSpiel-Modus: Ja\nSmart-Modi: Kino, Benutzerdefinierung, Spiel, M-Book, Foto\nEingebaute Lautsprecher: Ja\nIntegrierte Kamera: Nein\nAnzahl der Lautsprecher: 2\nRMS-Leistung: 4 W\nMarktpositionierung: B\u00fcro\nProduktfarbe: Schwarz\nName der Farbe: Matt Black\nIntegrierter USB-Hub: Ja\nUSB-Upstream-Porttyp: USB Typ-C\nAnzahl der vorgeschalteten Steckpl\u00e4tze: 1\nAnzahl der nachgeschalteten Steckpl\u00e4tze vom Typ USB-A: 2\nDVI Anschluss: Ja\nAnzahl DVI-D-Anschl\u00fcsse: 1\nHDMI: Ja\nAnzahl HDMI-Anschl\u00fcsse: 1\nHDMI-Version: 1.4\nAnzahl DisplayPort Anschl\u00fcsse: 1\nDisplayPorts-Version: 1.2\nKopfh\u00f6rerausgang: Ja\nKopfh\u00f6rerausg\u00e4nge: 1\nPC Audio-Eingang: Ja\nHDCP: Ja\nHDCP-Version: 1.4\nVESA-Halterung: Ja\nPanel-Montage-Schnittstelle: 100 x 100 mm\nWandmontage: Ja\nKabelsperre-Slot: Nein\nH\u00f6henverstellung: Ja\nH\u00f6heneinstellung: 13 cm\nPivot: Ja\nPivot Winkel: 0 - 90\u00b0\nSchwenkbar: Ja\nSchwenkwinkelbereich: 0 - 355\u00b0\nNeigungswinkelbereich: -5 - 35\u00b0\nNeigungsverstellung: Ja\nEnergieeffizienzklasse (SDR): E\nEnergieeffizienzklasse (HDR): Nicht verf\u00fcgbar\nEnergieverbrauch (SDR) pro 1.000 Stunden: 21 kWh\nEnergieeffizienzskala: A bis G\nSt\u00e4nder enthalten: Ja\nMitgelieferte Kabel: AC\nBetriebsanleitung: Ja\nDisplayPort Kabell\u00e4nge: 1,8 m\nGer\u00e4tebreite (inkl. Fu\u00df): 611,5 mm\nGer\u00e4tetiefe (inkl. Fu\u00df): 240 mm\nGer\u00e4teh\u00f6he (inkl. Fu\u00df): 526,2 mm\nGewicht (mit St\u00e4nder): 7,2 kg\nBreite (ohne Standfu\u00df): 611,5 mm\nTiefe (ohne Standfu\u00df): 52,1 mm\nH\u00f6he (ohne Standfu\u00df): 367,5 mm\nGewicht (ohne St\u00e4nder): 5 kg\nVerpackungsbreite: 693 mm\nVerpackungstiefe: 195 mm\nVerpackungsh\u00f6he: 534 mm\nPaketgewicht: 9,7 kg\nVerpackungsart: Box\nNachhaltigkeitszertifikate: ErP, Eidgen\u00f6ssische Kommunikationskommission (FCC), REACH, RoHS\nGew\u00e4hrleistungsfrist: 3 Jahr(e)",
    "reference_file": "offer_reference_286.json",
    "shop_name": "ms-it-beratung"
}