{
    "html_file": "offer_2352_5.html",
    "name": "Eizo FlexScan EV2785 wei\u00df, 27\"",
    "offer_link": "https://technikladen.at/P-EIZO-FlexScan-EV2785-WT-LED-Monitor-685-cm-27-3840-x-2160-4K-IPS-350-cd/m-Flachbildschirm-TFT/LCD-686-cm?tl=gzhls",
    "price": 692.05,
    "raw_specifications": {
        "3D": "Nein",
        "AC Eingangsfrequenz": "50 - 60 Hz",
        "AC Eingangsspannung": "100 - 240 V",
        "AMD FreeSync": "Nein",
        "Anzahl DisplayPort Anschl\u00fcsse": "1",
        "Anzahl HDMI-Anschl\u00fcsse": "2",
        "Anzahl OSD-Sprachen": "9",
        "Anzahl der Farben des Displays": "16,78 Millionen Farben",
        "Anzahl der Lautsprecher": "2",
        "Anzahl der nachgeschalteten Steckpl\u00e4tze vom Typ USB-A": "2",
        "Anzahl der vorgeschalteten Steckpl\u00e4tze": "1",
        "Betriebsanleitung": "Ja",
        "Betriebstemperatur": "5 - 35 \u00b0C",
        "Bildschirmaufl\u00f6sung": "3840 x 2160 Pixel",
        "Bildschirmdiagonale": "68,6 cm",
        "Bildschirmform": "Flach",
        "Bildschirmtechnologie": "LED",
        "Bildwinkel, horizontal": "178 \u00b0",
        "Bildwinkel, vertikal": "178 \u00b0",
        "Breite (ohne Standfu\u00df)": "61,1 cm",
        "DVI Anschluss": "Nein",
        "Display": "LED",
        "Ein-/Ausschalter": "Ja",
        "Eingebaute Lautsprecher": "Ja",
        "Energieeffizienzklasse (SDR)": "G",
        "Energieeffizienzskala": "A bis G",
        "Energieverbrauch (SDR) pro 1.000 Stunden": "28 kWh",
        "Ger\u00e4tebreite (inkl. Fu\u00df)": "611,4 mm",
        "Ger\u00e4teh\u00f6he (inkl. Fu\u00df)": "545,2 mm",
        "Ger\u00e4tetiefe (inkl. Fu\u00df)": "230 mm",
        "Gewicht (mit St\u00e4nder)": "8,2 kg",
        "Gewicht (ohne St\u00e4nder)": "4,9 kg",
        "HD-Typ": "4K Ultra HD",
        "HDCP": "Ja",
        "Helligkeit (typisch)": "350 cd/m\u00b2",
        "H\u00f6he (ohne Standfu\u00df)": "35,6 cm",
        "H\u00f6heneinstellung": "17,8 cm",
        "H\u00f6henverstellung": "Ja",
        "Integrierte Kamera": "Nein",
        "Integrierter USB-Hub": "Ja",
        "Kabelsperre-Slot": "Ja",
        "Kein Flimmern": "Ja",
        "Kontrastverh\u00e4ltnis": "1300:1",
        "Kopfh\u00f6rer-Anschluss": "3,5 mm",
        "Kopfh\u00f6rerausg\u00e4nge": "1",
        "LED-Anzeigen": "Leistung",
        "Lichtsensor": "Ja",
        "Luftfeuchtigkeit bei Lagerung": "10 - 90 %",
        "Men\u00fcsprachen": "Simplified Chinese, Traditional Chinese, German, English, Spanish, French, Italian, Japanese, Swedish",
        "Mitgelieferte Kabel": "AC",
        "NVIDIA G-SYNC": "Nein",
        "Nachhaltigkeitszertifikate": "EPEAT Gold, ENERGY STAR",
        "Natives Seitenverh\u00e4ltnis": "16:9",
        "Panel-Montage-Schnittstelle": "100 x 100 mm",
        "Panel-Typ": "IPS",
        "Pivot": "Ja",
        "Pivot Winkel": "-45 - 45 \u00b0",
        "Pixel Abstand": "0,155 x 0,155 mm",
        "Produktfarbe": "Wei\u00df",
        "RMS-Leistung": "2 W",
        "Reaktionszeit": "14 ms",
        "Relative Luftfeuchtigkeit in Betrieb": "20 - 80 %",
        "Schwenkbar": "Ja",
        "Schwenkwinkelbereich": "-172 - 172 \u00b0",
        "Sichtbare Gr\u00f6\u00dfe (horizontal)": "59,7 cm",
        "Sichtbare Gr\u00f6\u00dfe (vertikal)": "33,6 cm",
        "Slot-Typ Kabelsperre": "Kensington",
        "Stromeingang": "Ja",
        "Stromverbrauch (Standardbetrieb)": "27,7 W",
        "Stromverbrauch (Standby)": "0,5 W",
        "Stromverbrauch (max.)": "163 W",
        "Stromversorgungsfunktionen - Beschreibung": "Ja",
        "TV Tuner integriert": "Nein",
        "Temperaturbereich bei Lagerung": "-20 - 60 \u00b0C",
        "Thin Client installiert": "Nein",
        "Tiefe (ohne Standfu\u00df)": "5 cm",
        "USB-Hub-Version": "3.2 Gen 1 (3.1 Gen 1)",
        "USB-Upstream-Porttyp": "USB Typ-C",
        "Unterst\u00fctzte Grafik-Aufl\u00f6sungen": "640 x 480 (VGA),720 x 400,720 x 576,800 x 600 (SVGA),1024 x 768 (XGA),1280 x 1024 (SXGA),1280 x 720 (HD 720),1280 x 800 (WXGA),1600 x 1200 (UXGA),1600 x 900,1680 x 1050 (WSXGA+),1920 x 1080 (HD 1080),1920 x 2160,3840 x 2160",
        "VESA-Halterung": "Ja",
        "Zertifizierung": "TCO Certified Displays 7, TUV/Ergonomics, TUV/GS, RCM, CE, CB, cTUVus, FCC-B, CAN ICES-3 (B), TUV/S, VCCI-B, EPA Energy Star, WEEE, China RoHS, CCC, EAC",
        "kippbar": "Ja"
    },
    "raw_specifications_text": "NVIDIA G-SYNC: Nein\nAMD FreeSync: Nein\nBildschirmdiagonale: 68,6 cm\nBildschirmaufl\u00f6sung: 3840 x 2160 Pixel\nNatives Seitenverh\u00e4ltnis: 16:9\nPanel-Typ: IPS\nHelligkeit (typisch): 350 cd/m\u00b2\nReaktionszeit: 14 ms\nHD-Typ: 4K Ultra HD\nBildschirmtechnologie: LED\nBildschirmform: Flach\nUnterst\u00fctzte Grafik-Aufl\u00f6sungen: 640 x 480 (VGA),720 x 400,720 x 576,800 x 600 (SVGA),1024 x 768 (XGA),1280 x 1024 (SXGA),1280 x 720 (HD 720),1280 x 800 (WXGA),1600 x 1200 (UXGA),1600 x 900,1680 x 1050 (WSXGA+),1920 x 1080 (HD 1080),1920 x 2160,3840 x 2160\nKontrastverh\u00e4ltnis: 1300:1\nBildwinkel, horizontal: 178 \u00b0\nBildwinkel, vertikal: 178 \u00b0\nAnzahl der Farben des Displays: 16,78 Millionen Farben\n3D: Nein\nPixel Abstand: 0,155 x 0,155 mm\nSichtbare Gr\u00f6\u00dfe (horizontal): 59,7 cm\nSichtbare Gr\u00f6\u00dfe (vertikal): 33,6 cm\nIntegrierter USB-Hub: Ja\nUSB-Hub-Version: 3.2 Gen 1 (3.1 Gen 1)\nUSB-Upstream-Porttyp: USB Typ-C\nAnzahl der vorgeschalteten Steckpl\u00e4tze: 1\nAnzahl der nachgeschalteten Steckpl\u00e4tze vom Typ USB-A: 2\nDVI Anschluss: Nein\nAnzahl HDMI-Anschl\u00fcsse: 2\nAnzahl DisplayPort Anschl\u00fcsse: 1\nKopfh\u00f6rerausg\u00e4nge: 1\nKopfh\u00f6rer-Anschluss: 3,5 mm\nHDCP: Ja\nStromeingang: Ja\nVESA-Halterung: Ja\nPanel-Montage-Schnittstelle: 100 x 100 mm\nKabelsperre-Slot: Ja\nSlot-Typ Kabelsperre: Kensington\nH\u00f6henverstellung: Ja\nH\u00f6heneinstellung: 17,8 cm\nPivot: Ja\nPivot Winkel: -45 - 45 \u00b0\nSchwenkbar: Ja\nSchwenkwinkelbereich: -172 - 172 \u00b0\nkippbar: Ja\nMen\u00fcsprachen: Simplified Chinese, Traditional Chinese, German, English, Spanish, French, Italian, Japanese, Swedish\nAnzahl OSD-Sprachen: 9\nLED-Anzeigen: Leistung\nEingebaute Lautsprecher: Ja\nIntegrierte Kamera: Nein\nAnzahl der Lautsprecher: 2\nRMS-Leistung: 2 W\nProduktfarbe: Wei\u00df\nZertifizierung: TCO Certified Displays 7, TUV/Ergonomics, TUV/GS, RCM, CE, CB, cTUVus, FCC-B, CAN ICES-3 (B), TUV/S, VCCI-B, EPA Energy Star, WEEE, China RoHS, CCC, EAC\nMitgelieferte Kabel: AC\nBetriebsanleitung: Ja\nDisplay: LED\nEin-/Ausschalter: Ja\nTV Tuner integriert: Nein\nLichtsensor: Ja\nKein Flimmern: Ja\nStromversorgungsfunktionen - Beschreibung: Ja\nEnergieeffizienzklasse (SDR): G\nEnergieverbrauch (SDR) pro 1.000 Stunden: 28 kWh\nStromverbrauch (Standardbetrieb): 27,7 W\nStromverbrauch (Standby): 0,5 W\nStromverbrauch (max.): 163 W\nAC Eingangsspannung: 100 - 240 V\nAC Eingangsfrequenz: 50 - 60 Hz\nEnergieeffizienzskala: A bis G\nThin Client installiert: Nein\nBetriebstemperatur: 5 - 35 \u00b0C\nTemperaturbereich bei Lagerung: -20 - 60 \u00b0C\nRelative Luftfeuchtigkeit in Betrieb: 20 - 80 %\nLuftfeuchtigkeit bei Lagerung: 10 - 90 %\nGer\u00e4tebreite (inkl. Fu\u00df): 611,4 mm\nGer\u00e4tetiefe (inkl. Fu\u00df): 230 mm\nGer\u00e4teh\u00f6he (inkl. Fu\u00df): 545,2 mm\nGewicht (mit St\u00e4nder): 8,2 kg\nBreite (ohne Standfu\u00df): 61,1 cm\nTiefe (ohne Standfu\u00df): 5 cm\nH\u00f6he (ohne Standfu\u00df): 35,6 cm\nGewicht (ohne St\u00e4nder): 4,9 kg\nNachhaltigkeitszertifikate: EPEAT Gold, ENERGY STAR",
    "reference_file": "offer_reference_2352.json",
    "shop_name": "TechnikLaden"
}