{
    "html_file": "offer_765_6.html",
    "name": "ASUS VP227HE, 21.5\"",
    "offer_link": "https://www.csv-direct.de/artinfo.php?artnr=AGX1601231&KATEGORIE=162&pva=geizhals2",
    "price": 137.58,
    "raw_specifications": {
        "AC Eingangsfrequenz": "50 - 60 Hz",
        "AC Eingangsspannung": "100 - 240 V",
        "AMD FreeSync-Typ": "FreeSync",
        "Anzahl HDMI-Anschl\u00fcsse": "1",
        "Anzahl VGA D-Sub Anschl\u00fcsse": "1",
        "Anzahl der Farben des Displays": "16,7 Millionen Farben",
        "Bildschirmdiagonale": "54,5 cm 21.4\"",
        "Bildschirmform": "Flach",
        "Bildwinkel, vertikal": "178\u00b0",
        "Breite ohne Standfu\u00df": "494 mm",
        "Digital horizontale Frequenz": "24 - 84 kHz",
        "Digital vertikale Frequenz": "48 - 75 Hz",
        "Display-Aufl\u00f6sung": "1920 x 1080 Pixel",
        "Dynamisches Kontrastverh\u00e4ltnis Marketingbezeichnung": "ASUS Smart Contrast Ratio ASCR",
        "Eingebaute Lautsprecher": "Nein",
        "Fu\u00dffarbe": "Schwarz",
        "Ger\u00e4tebreite inkl. Fu\u00df": "494 mm",
        "Ger\u00e4teh\u00f6he inkl. Fu\u00df": "355,6 mm",
        "Ger\u00e4tetiefe inkl. Fu\u00df": "204,4 mm",
        "Gewicht mit St\u00e4nder": "2,79 kg",
        "Gewicht ohne St\u00e4nder": "2,4 kg",
        "HD-Typ": "Full HD",
        "HDCP-Version": "1.4",
        "HDMI-Version": "1.4",
        "Helligkeit typisch": "250 cd/m\u00b2",
        "H\u00f6he ohne Standfu\u00df": "290,9 mm",
        "H\u00f6henverstellung": "Nein",
        "Integrierte Kamera": "Nein",
        "Integrierter USB-Hub": "Nein",
        "Kontrastverh\u00e4ltnis": "3000:1",
        "Kontrastverh\u00e4ltnis dynamisch": "100000000:1",
        "Kopfh\u00f6rerausgang": "Nein",
        "Marktpositionierung": "Haus",
        "Maximale Bildwiederholrate": "75 Hz",
        "Mitgelieferte Kabel": "AC",
        "NVIDIA G-SYNC": "Nein",
        "Natives Seitenverh\u00e4ltnis": "16:9",
        "Neigungswinkelbereich": "23 - -5\u00b0",
        "Paketgewicht": "4,59 kg",
        "Panel-Montage-Schnittstelle": "100 x 100 mm",
        "Panel-Typ": "VA",
        "Pixel Abstand": "0,249 x 0,249 mm",
        "Produktfarbe": "Schwarz",
        "Reaktionszeit": "5 ms",
        "Seitenverh\u00e4ltnis": "16:9",
        "Sichtbare Gr\u00f6\u00dfe horizontal": "47,9 cm",
        "Sichtbare Gr\u00f6\u00dfe vertikal": "26 cm",
        "Slot-Typ Kabelsperre": "Kensington",
        "Stromverbrauch PowerSave": "0,5 W",
        "Stromverbrauch Standardbetrieb": "16 W",
        "Stromverbrauch aus": "0,3 W",
        "Tiefe ohne Standfu\u00df": "51,3 mm",
        "Touchscreen": "Nein",
        "Typ der Hintergrundbeleuchtung": "LED",
        "Verpackungsbreite": "565 mm",
        "Verpackungsh\u00f6he": "412 mm",
        "Verpackungstiefe": "133 mm"
    },
    "raw_specifications_text": "Bildschirmdiagonale: 54,5 cm 21.4\"\nDisplay-Aufl\u00f6sung: 1920 x 1080 Pixel\nNatives Seitenverh\u00e4ltnis: 16:9\nTouchscreen: Nein\nHD-Typ: Full HD\nPanel-Typ: VA\nBildschirmform: Flach\nKontrastverh\u00e4ltnis: 3000:1\nMaximale Bildwiederholrate: 75 Hz\nAnzahl der Farben des Displays: 16,7 Millionen Farben\nTyp der Hintergrundbeleuchtung: LED\nHelligkeit typisch: 250 cd/m\u00b2\nReaktionszeit: 5 ms\nSeitenverh\u00e4ltnis: 16:9\nKontrastverh\u00e4ltnis dynamisch: 100000000:1\nDynamisches Kontrastverh\u00e4ltnis Marketingbezeichnung: ASUS Smart Contrast Ratio ASCR\nBildwinkel, vertikal: 178\u00b0\nPixel Abstand: 0,249 x 0,249 mm\nSichtbare Gr\u00f6\u00dfe horizontal: 47,9 cm\nSichtbare Gr\u00f6\u00dfe vertikal: 26 cm\nDigital horizontale Frequenz: 24 - 84 kHz\nDigital vertikale Frequenz: 48 - 75 Hz\nNVIDIA G-SYNC: Nein\nAMD FreeSync-Typ: FreeSync\nEingebaute Lautsprecher: Nein\nIntegrierte Kamera: Nein\nMarktpositionierung: Haus\nProduktfarbe: Schwarz\nFu\u00dffarbe: Schwarz\nIntegrierter USB-Hub: Nein\nKopfh\u00f6rerausgang: Nein\nAnzahl VGA D-Sub Anschl\u00fcsse: 1\nAnzahl HDMI-Anschl\u00fcsse: 1\nHDMI-Version: 1.4\nHDCP-Version: 1.4\nH\u00f6henverstellung: Nein\nPanel-Montage-Schnittstelle: 100 x 100 mm\nSlot-Typ Kabelsperre: Kensington\nNeigungswinkelbereich: 23 - -5\u00b0\nStromverbrauch Standardbetrieb: 16 W\nStromverbrauch aus: 0,3 W\nStromverbrauch PowerSave: 0,5 W\nAC Eingangsspannung: 100 - 240 V\nAC Eingangsfrequenz: 50 - 60 Hz\nMitgelieferte Kabel: AC\nGer\u00e4tebreite inkl. Fu\u00df: 494 mm\nGer\u00e4tetiefe inkl. Fu\u00df: 204,4 mm\nGer\u00e4teh\u00f6he inkl. Fu\u00df: 355,6 mm\nGewicht mit St\u00e4nder: 2,79 kg\nBreite ohne Standfu\u00df: 494 mm\nTiefe ohne Standfu\u00df: 51,3 mm\nH\u00f6he ohne Standfu\u00df: 290,9 mm\nGewicht ohne St\u00e4nder: 2,4 kg\nVerpackungsbreite: 565 mm\nVerpackungstiefe: 133 mm\nVerpackungsh\u00f6he: 412 mm\nPaketgewicht: 4,59 kg",
    "reference_file": "offer_reference_765.json",
    "shop_name": "CSV-Direct.de"
}