{
    "html_file": "offer_707_5.html",
    "name": "LG 24MP450-B, 23.8\"",
    "offer_link": "https://direkt.jacob.de/produkte/lg-24mp450-b-led-24mp450-b-artnr-7465395.html?utm_source=geizhals&utm_medium=cpc&utm_campaign=Preisvergleich&ref=103",
    "price": 130.63,
    "raw_specifications": {
        "AC Eingangsfrequenz": "50/60 Hz",
        "AC Eingangsspannung": "100 - 240 V",
        "AMD FreeSync": "Ja",
        "AMD FreeSync Bildwiederholratenbereich": "48 - 75 Hz",
        "Anzahl HDMI-Anschl\u00fcsse": "1",
        "Anzahl OSD-Sprachen": "18",
        "Anzahl VGA (D-Sub) Anschl\u00fcsse": "1",
        "Anzahl der Farben des Displays": "16,7 Millionen Farben",
        "Bildschirmaufl\u00f6sung": "1920 x 1080 Pixel",
        "Bildschirmdiagonale": "60,5 cm (23.8\" )",
        "Bildschirmdiagonale (cm)": "60,4 cm",
        "Bildschirmdisplay (OSD)-Sprachen": "Vereinfachtes Chinesisch, Traditionelles Chinesisch, Deutsch, Englisch, Spanisch, Finnisch, Franz\u00f6sisch, Griechisch, Hindi, Italienisch, Japanisch, Koreanisch, Polnisch, Portugiesisch, Russisch, Schwedisch, Ukrainisch",
        "Bildschirmform": "Flach",
        "Bildschirmtechnologie": "LED",
        "Blendfreier Bildschirm": "Ja",
        "Blickwinkel, horizontal": "178\u00b0",
        "Blickwinkel, vertikal": "178\u00b0",
        "Breite (ohne Standfu\u00df)": "54 cm",
        "Dynamisches Kontrastverh\u00e4ltnis Marketingbezeichnung": "Mega-Kontrast",
        "Eingebaute Lautsprecher": "Nein",
        "Energie Effizienzklasse": "F",
        "Energieeffizienzklasse (SDR)": "F",
        "Energieverbrauch (SDR) pro 1.000 Stunden": "20 kWh",
        "Farbintensit\u00e4t": "8 Bit",
        "Flimmerfreie Technologie": "Ja",
        "Fu\u00dffarbe": "Schwarz",
        "Ger\u00e4tebreite (inkl. Fu\u00df)": "539,9 mm",
        "Ger\u00e4teh\u00f6he (inkl. Fu\u00df)": "414,4 mm",
        "Ger\u00e4tetiefe (inkl. Fu\u00df)": "190 mm",
        "Gewicht (mit St\u00e4nder)": "2,6 kg",
        "Gewicht (ohne St\u00e4nder)": "2,3 kg",
        "HD-Typ": "Full HD",
        "HDCP": "Ja",
        "HDMI": "Ja",
        "HDMI-Kabell\u00e4nge": "1,5 m",
        "HDMI-Version": "1.4",
        "Helligkeit (typisch)": "250 cd/m\u00b2",
        "H\u00f6he (ohne Standfu\u00df)": "32,1 cm",
        "Integrierte Kamera": "Nein",
        "Integrierter USB-Hub": "Nein",
        "Kontrastverh\u00e4ltnis": "1000:1",
        "Kopfh\u00f6rerausgang": "Nein",
        "Marktpositionierung": "Gaming",
        "Maximale Bildwiederholrate": "60 Hz",
        "Mitgelieferte Kabel": "AC, HDMI",
        "NTSC Abdeckung (typisch)": "72%",
        "NVIDIA G-SYNC": "Nein",
        "Nachhaltigkeitszertifikate": "ErP, REACH, RoHS",
        "Natives Seitenverh\u00e4ltnis": "16:9",
        "Neigungswinkelbereich": "5 - 15\u00b0",
        "On-Screen-Display (OSD)": "Ja",
        "Paketgewicht": "3,9 kg",
        "Panel-Montage-Schnittstelle": "75 x 75 mm",
        "Panel-Typ": "IPS",
        "Pixel Abstand": "0,2745 x 0,2745 mm",
        "Produktfarbe": "Schwarz",
        "Reaktionszeit": "5 ms",
        "Stromadapter enthalten": "Ja",
        "Stromverbrauch (Standardbetrieb)": "19 W",
        "Stromverbrauch (Standby)": "0,3 W",
        "Stromverbrauch (aus)": "0,3 W",
        "Stromverbrauch (max.)": "22 W",
        "St\u00e4nder enthalten": "Ja",
        "Tiefe (ohne Standfu\u00df)": "5,62 cm",
        "Typ der Hintergrundbeleuchtung": "Direkte LED",
        "VESA-Halterung": "Ja",
        "Verpackungsbreite": "615 mm",
        "Verpackungsh\u00f6he": "410 mm",
        "Verpackungstiefe": "148 mm",
        "Vertikaler Scanbereich": "56 - 75 Hz",
        "kippbar": "Ja"
    },
    "raw_specifications_text": "Bildschirmdiagonale: 60,5 cm (23.8\" )\nBildschirmaufl\u00f6sung: 1920 x 1080 Pixel\nEnergie Effizienzklasse: F\nNatives Seitenverh\u00e4ltnis: 16:9\nPanel-Typ: IPS\nHD-Typ: Full HD\nBildschirmtechnologie: LED\nBildschirmform: Flach\nKontrastverh\u00e4ltnis: 1000:1\nMaximale Bildwiederholrate: 60 Hz\nAnzahl der Farben des Displays: 16,7 Millionen Farben\nHelligkeit (typisch): 250 cd/m\u00b2\nReaktionszeit: 5 ms\nTyp der Hintergrundbeleuchtung: Direkte LED\nBlendfreier Bildschirm: Ja\nDynamisches Kontrastverh\u00e4ltnis Marketingbezeichnung: Mega-Kontrast\nBlickwinkel, horizontal: 178\u00b0\nBlickwinkel, vertikal: 178\u00b0\nPixel Abstand: 0,2745 x 0,2745 mm\nVertikaler Scanbereich: 56 - 75 Hz\nBildschirmdiagonale (cm): 60,4 cm\nFarbintensit\u00e4t: 8 Bit\nNTSC Abdeckung (typisch): 72%\nNVIDIA G-SYNC: Nein\nAMD FreeSync: Ja\nAMD FreeSync Bildwiederholratenbereich: 48 - 75 Hz\nFlimmerfreie Technologie: Ja\nEingebaute Lautsprecher: Nein\nIntegrierte Kamera: Nein\nMarktpositionierung: Gaming\nProduktfarbe: Schwarz\nFu\u00dffarbe: Schwarz\nIntegrierter USB-Hub: Nein\nHDMI: Ja\nKopfh\u00f6rerausgang: Nein\nAnzahl VGA (D-Sub) Anschl\u00fcsse: 1\nAnzahl HDMI-Anschl\u00fcsse: 1\nHDMI-Version: 1.4\nHDCP: Ja\nVESA-Halterung: Ja\nPanel-Montage-Schnittstelle: 75 x 75 mm\nkippbar: Ja\nNeigungswinkelbereich: 5 - 15\u00b0\nOn-Screen-Display (OSD): Ja\nBildschirmdisplay (OSD)-Sprachen: Vereinfachtes Chinesisch, Traditionelles Chinesisch, Deutsch, Englisch, Spanisch, Finnisch, Franz\u00f6sisch, Griechisch, Hindi, Italienisch, Japanisch, Koreanisch, Polnisch, Portugiesisch, Russisch, Schwedisch, Ukrainisch\nAnzahl OSD-Sprachen: 18\nEnergieeffizienzklasse (SDR): F\nEnergieverbrauch (SDR) pro 1.000 Stunden: 20 kWh\nStromverbrauch (Standardbetrieb): 19 W\nStromverbrauch (Standby): 0,3 W\nStromverbrauch (max.): 22 W\nStromverbrauch (aus): 0,3 W\nAC Eingangsspannung: 100 - 240 V\nAC Eingangsfrequenz: 50/60 Hz\nNachhaltigkeitszertifikate: ErP, REACH, RoHS\nGer\u00e4tebreite (inkl. Fu\u00df): 539,9 mm\nGer\u00e4tetiefe (inkl. Fu\u00df): 190 mm\nGer\u00e4teh\u00f6he (inkl. Fu\u00df): 414,4 mm\nGewicht (mit St\u00e4nder): 2,6 kg\nBreite (ohne Standfu\u00df): 54 cm\nTiefe (ohne Standfu\u00df): 5,62 cm\nH\u00f6he (ohne Standfu\u00df): 32,1 cm\nGewicht (ohne St\u00e4nder): 2,3 kg\nSt\u00e4nder enthalten: Ja\nMitgelieferte Kabel: AC, HDMI\nHDMI-Kabell\u00e4nge: 1,5 m\nStromadapter enthalten: Ja\nVerpackungsbreite: 615 mm\nVerpackungstiefe: 148 mm\nVerpackungsh\u00f6he: 410 mm\nPaketgewicht: 3,9 kg",
    "reference_file": "offer_reference_707.json",
    "shop_name": "Jacob Elektronik direkt (AT)"
}