{
    "html_file": "offer_1100_15.html",
    "name": "GIGABYTE M32QC, 31.5\"",
    "offer_link": "https://www.hiq24.de/shop/artikel/317978/?sPartner=geizhals",
    "price": 364.9,
    "raw_specifications": {
        "Abmessungen (Breite x Tiefe x H\u00f6he)": "71.05 cm x 23.48 cm x 55.22 cm - mit Fu\u00df",
        "Abmessungen (Breite x Tiefe x H\u00f6he) - mit Fu\u00df": "71.05 cm x 23.48 cm x 55.22 cm",
        "Adaptive-Sync Technologie": "AMD FreeSync Premium Pro",
        "Besonderheiten": "Bild f\u00fcr Bild, Black eQualizer, flimmerfreie Technologie, Crosshair Display, mit Game-Timer, Picture-in-Picture, an 3 Seiten ohne Blende, AORUS Aim Stabilizer, 8-bit Farbtiefe, FPS-Counter, AORUS Dashboard, AORUS OSD Sidekick, Eagle Eye",
        "Bildschirmbeschichtung": "Blendfrei",
        "Bildschirmtyp": "VA",
        "Details zu Abmessungen & Gewicht": "Mit Fu\u00df - Breite: 71.05 cm - Tiefe: 23.48 cm - H\u00f6he: 55.22 cm - Gewicht: 7.8 kg  Ohne Fu\u00df - Breite: 71.05 cm - Tiefe: 10.28 cm - H\u00f6he: 42.33 cm - Gewicht: 5.5 kg",
        "Diagonalabmessung": "80 cm (31.5\")",
        "Display-Typ": "LED-hintergrundbeleuchteter LCD-Monitor / TFT-Aktivmatrix",
        "Eingangsanschl\u00fcsse": "2xHDMI, DisplayPort, USB-C",
        "Eingangsspannung": "Wechselstrom 100-240 V (50 - 60 Hz)",
        "Einstellungen der Anzeigeposition": "H\u00f6he, Neigung",
        "Energie Effizienzklasse": "Klasse G",
        "Energieklasse (HDR)": "Klasse G",
        "Enthaltene Kabel": "1 x HDMI-Kabel  1 x DisplayPort-Kabel  1 x USB-Kabel",
        "Farbraum": "123% sRGB, 94% DCI-P3",
        "Ger\u00e4tetyp": "LED-hintergrundbeleuchteter LCD-Monitor - 80 cm (31.5\")",
        "Geschwungener Bildschirm": "Ja",
        "Gewicht": "7.8 kg",
        "HDR-Zertifizierung": "DisplayHDR 400",
        "HDR-f\u00e4hig": "DisplayHDR 400",
        "Helligkeit": "350 cd/m\u00b2",
        "Hintergrundbeleuchtungs-Technologie": "Edge-LED-Beleuchtung",
        "Horizontaler Betrachtungswinkel": "178",
        "H\u00f6heneinstellung": "130 mm",
        "Integrierte Peripherieger\u00e4te": "USB 3.0-Hub",
        "Kennzeichnung": "DisplayPort 1.2",
        "Kontrast": "3000:1",
        "Leistungsmerkmale": "USB 3.0-Hub, USB PD 18 Watt",
        "Native Aufl\u00f6sung": "QHD 2560 x 1440 (DisplayPort(OC): 170 Hz, DisplayPort: 165 Hz, HDMI: 144 Hz, USB-C: 165 Hz)",
        "Neigungswinkel": "-5/+20",
        "Pixelpitch": "0.2724 mm",
        "Produktbeschreibung": "Gigabyte M32QC - LED-Monitor - gebogen - QHD - 80 cm (31.5\") - HDR",
        "Reaktionszeit": "1 ms (MPRT)",
        "Schlosstyp zur Diebstahlsicherung": "Kensington Slot",
        "Schnittstellen": "2 x HDMI  DisplayPort  USB-C (KVM-Option)  Kopfh\u00f6rer  USB 3.0 Upstream  2 x USB 3.0 Downstream",
        "Seitenverh\u00e4ltnis": "16:9",
        "Spannung": "Wechselstrom 100-240 V (50 - 60 Hz)",
        "Stromverbrauch (Aus-Modus)": "0.3 Watt",
        "Stromverbrauch (typisch)": "90 Watt",
        "Stromverbrauch HDR (eingeschaltet)": "64 kWh/1.000 h",
        "Stromverbrauch SDR (eingeschaltet)": "40 kWh/1.000 h",
        "Stromverbrauch im Standby-Modus": "0.5 Watt",
        "Transportbreite": "86 cm",
        "Transportgewicht": "11.21 kg",
        "Transporth\u00f6he": "55.5 cm",
        "Transporttiefe": "19 cm",
        "USB-Spannungsversorgung": "18 Watt",
        "VESA-Halterung": "100 x 100 mm",
        "Vertikaler Betrachtungswinkel": "178"
    },
    "raw_specifications_text": "Display-Typ: LED-hintergrundbeleuchteter LCD-Monitor / TFT-Aktivmatrix\nEnergie Effizienzklasse: Klasse G\nEnergieklasse (HDR): Klasse G\nDiagonalabmessung: 80 cm (31.5\")\nGeschwungener Bildschirm: Ja\nAdaptive-Sync Technologie: AMD FreeSync Premium Pro\nIntegrierte Peripherieger\u00e4te: USB 3.0-Hub\nUSB-Spannungsversorgung: 18 Watt\nBildschirmtyp: VA\nSeitenverh\u00e4ltnis: 16:9\nNative Aufl\u00f6sung: QHD 2560 x 1440 (DisplayPort(OC): 170 Hz, DisplayPort: 165 Hz, HDMI: 144 Hz, USB-C: 165 Hz)\nPixelpitch: 0.2724 mm\nHelligkeit: 350 cd/m\u00b2\nKontrast: 3000:1\nHDR-Zertifizierung: DisplayHDR 400\nFarbraum: 123% sRGB, 94% DCI-P3\nReaktionszeit: 1 ms (MPRT)\nHorizontaler Betrachtungswinkel: 178\nVertikaler Betrachtungswinkel: 178\nBildschirmbeschichtung: Blendfrei\nHintergrundbeleuchtungs-Technologie: Edge-LED-Beleuchtung\nBesonderheiten: Bild f\u00fcr Bild, Black eQualizer, flimmerfreie Technologie, Crosshair Display, mit Game-Timer, Picture-in-Picture, an 3 Seiten ohne Blende, AORUS Aim Stabilizer, 8-bit Farbtiefe, FPS-Counter, AORUS Dashboard, AORUS OSD Sidekick, Eagle Eye\nAbmessungen (Breite x Tiefe x H\u00f6he): 71.05 cm x 23.48 cm x 55.22 cm - mit Fu\u00df\nGewicht: 7.8 kg\nSchnittstellen: 2 x HDMI  DisplayPort  USB-C (KVM-Option)  Kopfh\u00f6rer  USB 3.0 Upstream  2 x USB 3.0 Downstream\nEinstellungen der Anzeigeposition: H\u00f6he, Neigung\nNeigungswinkel: -5/+20\nH\u00f6heneinstellung: 130 mm\nVESA-Halterung: 100 x 100 mm\nLeistungsmerkmale: USB 3.0-Hub, USB PD 18 Watt\nEnthaltene Kabel: 1 x HDMI-Kabel  1 x DisplayPort-Kabel  1 x USB-Kabel\nKennzeichnung: DisplayPort 1.2\nSchlosstyp zur Diebstahlsicherung: Kensington Slot\nEingangsspannung: Wechselstrom 100-240 V (50 - 60 Hz)\nStromverbrauch SDR (eingeschaltet): 40 kWh/1.000 h\nStromverbrauch HDR (eingeschaltet): 64 kWh/1.000 h\nStromverbrauch (typisch): 90 Watt\nStromverbrauch im Standby-Modus: 0.5 Watt\nStromverbrauch (Aus-Modus): 0.3 Watt\nDetails zu Abmessungen & Gewicht: Mit Fu\u00df - Breite: 71.05 cm - Tiefe: 23.48 cm - H\u00f6he: 55.22 cm - Gewicht: 7.8 kg  Ohne Fu\u00df - Breite: 71.05 cm - Tiefe: 10.28 cm - H\u00f6he: 42.33 cm - Gewicht: 5.5 kg\nTransportbreite: 86 cm\nTransporttiefe: 19 cm\nTransporth\u00f6he: 55.5 cm\nTransportgewicht: 11.21 kg\nProduktbeschreibung: Gigabyte M32QC - LED-Monitor - gebogen - QHD - 80 cm (31.5\") - HDR\nGer\u00e4tetyp: LED-hintergrundbeleuchteter LCD-Monitor - 80 cm (31.5\")\nHDR-f\u00e4hig: DisplayHDR 400\nEingangsanschl\u00fcsse: 2xHDMI, DisplayPort, USB-C\nSpannung: Wechselstrom 100-240 V (50 - 60 Hz)\nAbmessungen (Breite x Tiefe x H\u00f6he) - mit Fu\u00df: 71.05 cm x 23.48 cm x 55.22 cm",
    "reference_file": "offer_reference_1100.json",
    "shop_name": "HiQ24"
}