{
    "html_file": "offer_1027_10.html",
    "name": "AOC Agon AG275QXL League of Legends Edition, 27\"",
    "offer_link": "https://www.alternate.at/AOC/AGON-Pro-AG275QXL-Gaming-Monitor/html/product/1823793?partner=AtGeizhalsat&campaign=Monitor/AOC/1823793",
    "price": 507.0,
    "raw_specifications": {
        "": "VESA DisplayHDR Standard",
        "Abmessungen": "Breite: 61,34 cm x H\u00f6he: 55,36 cm x Tiefe/L\u00e4nge: 24,9 cm",
        "Anschl\u00fcsse": "2x HDMI-Eingang, (HDMI-Version: 1.4), 2x DisplayPort-Eingang, (DisplayPort-Version: 1.4), 4x USB-A-3.2 Gen 1 (5 Gbit/s)",
        "Beleuchtung": "Ja, RGB",
        "Bild": "Format",
        "Bildschirmaufl\u00f6sung": "2.560 x 1.440 Pixel",
        "Bildschirmdiagonale": "69 cm (27 Zoll)",
        "EAN": "4038986180580",
        "Energieeffizienzklasse (HDR)": "G (A - G)",
        "Energieeffizienzklasse (SDR)": "G (A - G)",
        "Energieverbauch pro 1000 Stunden (HDR)": "63 kWh",
        "Energieverbauch pro 1000 Stunden (SDR)": "32 kWh",
        "Ergonomie": "Typ",
        "Farbe": "schwarz",
        "Features": "Flicker-free Technologie, Low Blue Light, LightFX Beleuchtung, Headset Halter",
        "Frequenz": "Vertikal",
        "Geeignet f\u00fcr": "Gaming",
        "Gewicht": "7,8 kg",
        "Hersteller-Nr.": "AG275QXL",
        "Lautsprecher": "2 Lautsprecher",
        "Leistungsaufnahme im Bereitschafts- und Aus-Zustand": "0,5 Watt",
        "Leistungsaufnahme im Ein-Zustand bei Standard-Dynamikumfang (SDR)": "32 Watt",
        "Leistungsaufnahme im Ein-Zustand bei hohem Dynamikumfang (HDR)": "63 Watt",
        "Serie": "AGON Pro",
        "Stromversorgung": "Eco-Off",
        "Typ": "Gaming-Monitor",
        "Wandhalterung": "VESA kompatibel (100 x 100 mm)",
        "Zubeh\u00f6r": "Vorhanden"
    },
    "raw_specifications_text": "Energieeffizienzklasse (SDR): G (A - G)\nEnergieverbauch pro 1000 Stunden (SDR): 32 kWh\nEnergieeffizienzklasse (HDR): G (A - G)\nEnergieverbauch pro 1000 Stunden (HDR): 63 kWh\nLeistungsaufnahme im Ein-Zustand bei Standard-Dynamikumfang (SDR): 32 Watt\nLeistungsaufnahme im Ein-Zustand bei hohem Dynamikumfang (HDR): 63 Watt\nLeistungsaufnahme im Bereitschafts- und Aus-Zustand: 0,5 Watt\nBildschirmdiagonale: 69 cm (27 Zoll)\nBildschirmaufl\u00f6sung: 2.560 x 1.440 Pixel\nTyp: Gaming-Monitor\nFarbe: schwarz\nEAN: 4038986180580\nHersteller-Nr.: AG275QXL\nSerie: AGON Pro\nGeeignet f\u00fcr: Gaming\nBild: Format\n: VESA DisplayHDR Standard\nFrequenz: Vertikal\nBeleuchtung: Ja, RGB\nAnschl\u00fcsse: 2x HDMI-Eingang, (HDMI-Version: 1.4), 2x DisplayPort-Eingang, (DisplayPort-Version: 1.4), 4x USB-A-3.2 Gen 1 (5 Gbit/s)\nErgonomie: Typ\nStromversorgung: Eco-Off\nLautsprecher: 2 Lautsprecher\nWandhalterung: VESA kompatibel (100 x 100 mm)\nFeatures: Flicker-free Technologie, Low Blue Light, LightFX Beleuchtung, Headset Halter\nZubeh\u00f6r: Vorhanden\nAbmessungen: Breite: 61,34 cm x H\u00f6he: 55,36 cm x Tiefe/L\u00e4nge: 24,9 cm\nGewicht: 7,8 kg",
    "reference_file": "offer_reference_1027.json",
    "shop_name": "Alternate.at"
}