{
    "html_file": "offer_213_11.html",
    "name": "Samsung ViewFinity S8 S27B800PXP (2023), 27\"",
    "offer_link": "https://www.electronicshop24.at/product_info.php?products_id=160000000844564857&ano=S844564857&mno=LS27B800PXPXEN&ean=8806094926347&utm_medium=cpc&utm_campaign=preisvergleich&utm_content=item&utm_source=geizhals&ref=geizhals",
    "price": 428.0,
    "raw_specifications": {
        "Abmessungen (Breite x Tiefe x H\u00f6he)": "61.55 cm x 19.64 cm x 55.19 cm - mit Fu\u00df",
        "Besonderheiten": "Bild f\u00fcr Bild, Spielmodus, Cinema Mode, Mega Dynamic Contrast Ratio, Eco Light Sensor, CustomColor Mode, flimmerfreie Technologie, Farbraum BT.709, Image Size, DICOM-Simulation, Eco Saving Plus, Eye Saver Mode, Werkstuning, Farbpalette DCI, Off Timer Plus, sRGB Mode, Picture-in-Picture, Dynamic Contrast Mode, Auto Source Switch+, Adaptive Picture, High Bright-Modus",
        "Bildschirmbeschichtung": "Blendfrei, matt",
        "Bildschirmtyp": "IPS",
        "Details zu Abmessungen & Gewicht": "Mit Fu\u00df - Breite: 61.55 cm - Tiefe: 19.64 cm - H\u00f6he: 55.19 cm - Gewicht: 6.7 kg \u00a6 Ohne Fu\u00df - Breite: 61.55 cm - Tiefe: 4.27 cm - H\u00f6he: 36.82 cm - Gewicht: 4.7 kg",
        "Diagonalabmessung": "68 cm (27\")",
        "Display-Typ": "LED-hintergrundbeleuchteter LCD-Monitor / TFT-Aktivmatrix",
        "ENERGY STAR zertifiziert": "Ja",
        "Eingangsspannung": "Wechselstrom 100-240 V",
        "Einstellungen der Anzeigeposition": "H\u00f6he, Pivot (Rotation), Drehung, Neigung",
        "Energie Effizienzklasse": "Klasse F",
        "Energieklasse (HDR)": "Klasse G",
        "Energieverbrauch pro Jahr": "36 kWh",
        "Enthaltene Kabel": "1 x HDMI-Kabel \u00a6 1 x USB 3.0 C-Kabel",
        "Farbe": "Schwarz",
        "Farbraum": "98% DCI-P3",
        "Farbunterst\u00fctzung": "1,07 Mrd. Farben",
        "Gewicht": "6.7 kg",
        "HDR-Zertifizierung": "DisplayHDR 400",
        "Helligkeit": "350 cd/m\u00b2",
        "Hintergrundbeleuchtungs-Technologie": "LED-Hintergrundbeleuchtung",
        "Horizontaler Betrachtungswinkel": "178",
        "H\u00f6heneinstellung": "120 mm",
        "Integrierte Peripherieger\u00e4te": "USB 3.0/USB-C Hub, Ethernet-Netzwerkadapter",
        "Kennzeichnung": "TUV Rheinland, HDCP 2.2, TCO Certified Edge, UL Glare Free, Pantone Validated",
        "Kontrast": "1000:1",
        "Leistungsmerkmale": "Slot f\u00fcr Sicherheitsschloss (Kabelschloss getrennt erh\u00e4ltlich), 3 % recycelter Kunststoff",
        "Max. Betriebstemperatur": "40 \u00b0C",
        "Min Betriebstemperatur": "10 \u00b0C",
        "Native Aufl\u00f6sung": "4K 3840 x 2160 bei 60 Hz",
        "Neigungswinkel": "-2/+25",
        "Reaktionszeit": "5 ms",
        "Rotationswinkel": "-2/+92",
        "Schlosstyp zur Diebstahlsicherung": "Kensington Slot",
        "Schnittstellen": "DisplayPort 1.4 \u00a6 HDMI 2.0 (HDCP 2.2) \u00a6 USB-C (bis zu 90 W) \u00a6 3 x USB 3.0 \u00a6 Kopfh\u00f6rer (Mini-Klinkenstecker) \u00a6 LAN (RJ-45)",
        "Schwenkwinkel": "60",
        "Seitenverh\u00e4ltnis": "16:9",
        "Stromverbrauch (max.)": "170 Watt",
        "Stromverbrauch (typisch)": "26.1 Watt",
        "Stromverbrauch HDR (eingeschaltet)": "49 kWh/1.000 h",
        "Stromverbrauch SDR (eingeschaltet)": "26 kWh/1.000 h",
        "TCO-zertifiziert": "TCO Certified Displays 9",
        "Transportbreite": "68.6 cm",
        "Transportgewicht": "8.4 kg",
        "Transporth\u00f6he": "45 cm",
        "Transporttiefe": "17.1 cm",
        "USB-Spannungsversorgung": "90 Watt",
        "VESA-Halterung": "100 x 100 mm",
        "Vertikaler Betrachtungswinkel": "178",
        "Zul\u00e4ssige Luftfeuchtigkeit im Betrieb": "10 - 80% (nicht kondensierend)"
    },
    "raw_specifications_text": "Display-Typ: LED-hintergrundbeleuchteter LCD-Monitor / TFT-Aktivmatrix\nEnergie Effizienzklasse: Klasse F\nEnergieklasse (HDR): Klasse G\nEnergieverbrauch pro Jahr: 36 kWh\nDiagonalabmessung: 68 cm (27\")\nIntegrierte Peripherieger\u00e4te: USB 3.0/USB-C Hub, Ethernet-Netzwerkadapter\nUSB-Spannungsversorgung: 90 Watt\nBildschirmtyp: IPS\nSeitenverh\u00e4ltnis: 16:9\nNative Aufl\u00f6sung: 4K 3840 x 2160 bei 60 Hz\nHelligkeit: 350 cd/m\u00b2\nKontrast: 1000:1\nHDR-Zertifizierung: DisplayHDR 400\nFarbunterst\u00fctzung: 1,07 Mrd. Farben\nFarbraum: 98% DCI-P3\nReaktionszeit: 5 ms\nHorizontaler Betrachtungswinkel: 178\nVertikaler Betrachtungswinkel: 178\nBildschirmbeschichtung: Blendfrei, matt\nHintergrundbeleuchtungs-Technologie: LED-Hintergrundbeleuchtung\nBesonderheiten: Bild f\u00fcr Bild, Spielmodus, Cinema Mode, Mega Dynamic Contrast Ratio, Eco Light Sensor, CustomColor Mode, flimmerfreie Technologie, Farbraum BT.709, Image Size, DICOM-Simulation, Eco Saving Plus, Eye Saver Mode, Werkstuning, Farbpalette DCI, Off Timer Plus, sRGB Mode, Picture-in-Picture, Dynamic Contrast Mode, Auto Source Switch+, Adaptive Picture, High Bright-Modus\nFarbe: Schwarz\nAbmessungen (Breite x Tiefe x H\u00f6he): 61.55 cm x 19.64 cm x 55.19 cm - mit Fu\u00df\nGewicht: 6.7 kg\nSchnittstellen: DisplayPort 1.4 \u00a6 HDMI 2.0 (HDCP 2.2) \u00a6 USB-C (bis zu 90 W) \u00a6 3 x USB 3.0 \u00a6 Kopfh\u00f6rer (Mini-Klinkenstecker) \u00a6 LAN (RJ-45)\nEinstellungen der Anzeigeposition: H\u00f6he, Pivot (Rotation), Drehung, Neigung\nNeigungswinkel: -2/+25\nSchwenkwinkel: 60\nRotationswinkel: -2/+92\nH\u00f6heneinstellung: 120 mm\nVESA-Halterung: 100 x 100 mm\nLeistungsmerkmale: Slot f\u00fcr Sicherheitsschloss (Kabelschloss getrennt erh\u00e4ltlich), 3 % recycelter Kunststoff\nEnthaltene Kabel: 1 x HDMI-Kabel \u00a6 1 x USB 3.0 C-Kabel\nKennzeichnung: TUV Rheinland, HDCP 2.2, TCO Certified Edge, UL Glare Free, Pantone Validated\nSchlosstyp zur Diebstahlsicherung: Kensington Slot\nEingangsspannung: Wechselstrom 100-240 V\nStromverbrauch SDR (eingeschaltet): 26 kWh/1.000 h\nStromverbrauch HDR (eingeschaltet): 49 kWh/1.000 h\nStromverbrauch (typisch): 26.1 Watt\nStromverbrauch (max.): 170 Watt\nDetails zu Abmessungen & Gewicht: Mit Fu\u00df - Breite: 61.55 cm - Tiefe: 19.64 cm - H\u00f6he: 55.19 cm - Gewicht: 6.7 kg \u00a6 Ohne Fu\u00df - Breite: 61.55 cm - Tiefe: 4.27 cm - H\u00f6he: 36.82 cm - Gewicht: 4.7 kg\nTransportbreite: 68.6 cm\nTransporttiefe: 17.1 cm\nTransporth\u00f6he: 45 cm\nTransportgewicht: 8.4 kg\nTCO-zertifiziert: TCO Certified Displays 9\nENERGY STAR zertifiziert: Ja\nMin Betriebstemperatur: 10 \u00b0C\nMax. Betriebstemperatur: 40 \u00b0C\nZul\u00e4ssige Luftfeuchtigkeit im Betrieb: 10 - 80% (nicht kondensierend)",
    "reference_file": "offer_reference_213.json",
    "shop_name": "ElectronicShop24"
}