{
    "html_file": "offer_899_7.html",
    "name": "Samsung Odyssey Neo G7 G75NB (2022), 32\"",
    "offer_link": "https://direkt.jacob.de/produkte/samsung-odyssey-ls32bg750nu-ls32bg750nuxen-artnr-7750622.html?utm_source=geizhals&utm_medium=cpc&utm_campaign=Preisvergleich&ref=103",
    "price": 943.85,
    "raw_specifications": {
        "AC Eingangsspannung": "100 - 240 V",
        "AMD FreeSync": "Ja",
        "AMD FreeSync-Typ": "FreeSync Premium Pro",
        "Abnehmbarer Standfu\u00df": "Ja",
        "Anzahl DisplayPort Anschl\u00fcsse": "1",
        "Anzahl HDMI-Anschl\u00fcsse": "2",
        "Anzahl der nachgeschalteten Steckpl\u00e4tze vom Typ USB-A": "2",
        "Betriebstemperatur": "10 - 40 \u00b0C",
        "Bewertung der Bildschirmkr\u00fcmmung": "1000R",
        "Bild-in-Bild": "Ja",
        "Bildschirmaufl\u00f6sung": "3840 x 2160 Pixel",
        "Bildschirmdiagonale": "81,3 cm (32\" )",
        "Bildschirmdiagonale (cm)": "80 cm",
        "Bildschirmform": "Gebogen",
        "Bildschirmtechnologie": "LED",
        "Bildwinkel, horizontal": "178\u00b0",
        "Bildwinkel, vertikal": "178\u00b0",
        "Breite (ohne Standfu\u00df)": "71,3 cm",
        "DisplayPorts-Version": "1.4",
        "Eingebaute Lautsprecher": "Nein",
        "Energie Effizienzklasse": "G",
        "Energieeffizienzklasse (HDR)": "G",
        "Energieeffizienzklasse (SDR)": "G",
        "Energieeffizienzskala": "A bis G",
        "Energieverbrauch (HDR) pro 1.000 Stunden": "90 kWh",
        "Energieverbrauch (SDR) pro 1.000 Stunden": "41 kWh",
        "Farbskala": "95%",
        "Flimmerfreie Technologie": "Ja",
        "Fu\u00dffarbe": "Schwarz",
        "Ger\u00e4tebreite (inkl. Fu\u00df)": "713 mm",
        "Ger\u00e4teh\u00f6he (inkl. Fu\u00df)": "606,2 mm",
        "Ger\u00e4tetiefe (inkl. Fu\u00df)": "311,1 mm",
        "Gewicht (mit St\u00e4nder)": "8,6 kg",
        "Gewicht (ohne St\u00e4nder)": "6,7 kg",
        "HD-Typ": "4K Ultra HD",
        "HDCP": "Ja",
        "HDMI": "Ja",
        "HDMI-Version": "2.1",
        "Helligkeit (peak)": "1000 cd/m\u00b2",
        "Helligkeit (typisch)": "350 cd/m\u00b2",
        "High Dynamic Range Video (HDR) Unterst\u00fctzung": "Ja",
        "H\u00f6he (ohne Standfu\u00df)": "44 cm",
        "H\u00f6heneinstellung": "12 cm",
        "H\u00f6henverstellung": "Ja",
        "Integrierte Kamera": "Nein",
        "Integrierter USB-Hub": "Ja",
        "Kontrastverh\u00e4ltnis": "1000000:1",
        "Kopfh\u00f6rerausgang": "Ja",
        "Marktpositionierung": "Gaming",
        "Maximale Bildwiederholrate": "165 Hz",
        "NVIDIA G-SYNC": "Ja",
        "NVIDIA G-SYNC-Typ": "G-SYNC",
        "Natives Seitenverh\u00e4ltnis": "16:9",
        "Neigungswinkelbereich": "9 - 13\u00b0",
        "Netzteiltyp": "Extern",
        "Paketgewicht": "12 kg",
        "Panel-Montage-Schnittstelle": "100 x 100 mm",
        "Panel-Typ": "VA",
        "Pivot": "Ja",
        "Pivot Winkel": "0 - 92\u00b0",
        "Produktfarbe": "Schwarz",
        "RGB-Farbraum": "DCI-P3",
        "Reaktionszeit": "1 ms",
        "Relative Luftfeuchtigkeit in Betrieb": "10 - 80%",
        "Schwenkbar": "Ja",
        "Schwenkwinkelbereich": "0 - 15\u00b0",
        "Stromverbrauch (Standardbetrieb)": "40,8 W",
        "Stromverbrauch (Standby)": "0,5 W",
        "Stromverbrauch (aus)": "0,3 W",
        "St\u00e4nder enthalten": "Ja",
        "Technologie mit hohem Dynamikbereich (HDR)": "Quantum HDR 2000",
        "Tiefe (ohne Standfu\u00df)": "18,5 cm",
        "USB-Hub-Version": "3.2 Gen 1 (3.1 Gen 1)",
        "Unterst\u00fctzte Grafik-Aufl\u00f6sungen": "3840 x 2160",
        "Unterst\u00fctzte Video-Modi": "2160p",
        "VESA Adaptive Sync unterst\u00fctzt": "Ja",
        "VESA-Halterung": "Ja",
        "Verpackungsart": "Box",
        "Verpackungsbreite": "827 mm",
        "Verpackungsh\u00f6he": "231 mm",
        "Verpackungstiefe": "499 mm",
        "Vorderer Rahmen": "Schwarz",
        "kippbar": "Ja"
    },
    "raw_specifications_text": "Bildschirmdiagonale: 81,3 cm (32\" )\nBildschirmaufl\u00f6sung: 3840 x 2160 Pixel\nEnergie Effizienzklasse: G\nNatives Seitenverh\u00e4ltnis: 16:9\nPanel-Typ: VA\nHD-Typ: 4K Ultra HD\nBildschirmtechnologie: LED\nBildschirmform: Gebogen\nKontrastverh\u00e4ltnis: 1000000:1\nMaximale Bildwiederholrate: 165 Hz\nHelligkeit (peak): 1000 cd/m\u00b2\nHelligkeit (typisch): 350 cd/m\u00b2\nReaktionszeit: 1 ms\nBewertung der Bildschirmkr\u00fcmmung: 1000R\nUnterst\u00fctzte Grafik-Aufl\u00f6sungen: 3840 x 2160\nUnterst\u00fctzte Video-Modi: 2160p\nBildwinkel, horizontal: 178\u00b0\nBildwinkel, vertikal: 178\u00b0\nBildschirmdiagonale (cm): 80 cm\nHigh Dynamic Range Video (HDR) Unterst\u00fctzung: Ja\nTechnologie mit hohem Dynamikbereich (HDR): Quantum HDR 2000\nRGB-Farbraum: DCI-P3\nFarbskala: 95%\nNVIDIA G-SYNC: Ja\nAMD FreeSync: Ja\nNVIDIA G-SYNC-Typ: G-SYNC\nAMD FreeSync-Typ: FreeSync Premium Pro\nVESA Adaptive Sync unterst\u00fctzt: Ja\nFlimmerfreie Technologie: Ja\nEingebaute Lautsprecher: Nein\nIntegrierte Kamera: Nein\nMarktpositionierung: Gaming\nProduktfarbe: Schwarz\nVorderer Rahmen: Schwarz\nAbnehmbarer Standfu\u00df: Ja\nFu\u00dffarbe: Schwarz\nIntegrierter USB-Hub: Ja\nHDMI: Ja\nKopfh\u00f6rerausgang: Ja\nUSB-Hub-Version: 3.2 Gen 1 (3.1 Gen 1)\nAnzahl der nachgeschalteten Steckpl\u00e4tze vom Typ USB-A: 2\nAnzahl HDMI-Anschl\u00fcsse: 2\nHDMI-Version: 2.1\nAnzahl DisplayPort Anschl\u00fcsse: 1\nDisplayPorts-Version: 1.4\nHDCP: Ja\nVESA-Halterung: Ja\nH\u00f6henverstellung: Ja\nPanel-Montage-Schnittstelle: 100 x 100 mm\nH\u00f6heneinstellung: 12 cm\nPivot: Ja\nPivot Winkel: 0 - 92\u00b0\nSchwenkbar: Ja\nSchwenkwinkelbereich: 0 - 15\u00b0\nkippbar: Ja\nNeigungswinkelbereich: 9 - 13\u00b0\nBild-in-Bild: Ja\nEnergieeffizienzklasse (SDR): G\nEnergieeffizienzklasse (HDR): G\nEnergieverbrauch (SDR) pro 1.000 Stunden: 41 kWh\nEnergieverbrauch (HDR) pro 1.000 Stunden: 90 kWh\nStromverbrauch (Standardbetrieb): 40,8 W\nStromverbrauch (Standby): 0,5 W\nStromverbrauch (aus): 0,3 W\nAC Eingangsspannung: 100 - 240 V\nNetzteiltyp: Extern\nEnergieeffizienzskala: A bis G\nBetriebstemperatur: 10 - 40 \u00b0C\nRelative Luftfeuchtigkeit in Betrieb: 10 - 80%\nGer\u00e4tebreite (inkl. Fu\u00df): 713 mm\nGer\u00e4tetiefe (inkl. Fu\u00df): 311,1 mm\nGer\u00e4teh\u00f6he (inkl. Fu\u00df): 606,2 mm\nGewicht (mit St\u00e4nder): 8,6 kg\nBreite (ohne Standfu\u00df): 71,3 cm\nTiefe (ohne Standfu\u00df): 18,5 cm\nH\u00f6he (ohne Standfu\u00df): 44 cm\nGewicht (ohne St\u00e4nder): 6,7 kg\nSt\u00e4nder enthalten: Ja\nVerpackungsbreite: 827 mm\nVerpackungstiefe: 499 mm\nVerpackungsh\u00f6he: 231 mm\nPaketgewicht: 12 kg\nVerpackungsart: Box",
    "reference_file": "offer_reference_899.json",
    "shop_name": "Jacob Elektronik direkt (AT)"
}