{
    "html_file": "offer_482_30.html",
    "name": "Samsung Odyssey G3 G3A (2023), 24\"",
    "offer_link": "https://www.alternate.at/SAMSUNG/Odyssey-Gaming-G3A-S24AG304NR-Gaming-Monitor/html/product/1917498?partner=AtGeizhalsat&campaign=Monitor/SAMSUNG/1917498",
    "price": 169.9,
    "raw_specifications": {
        "": "H\u00f6henverstellbar",
        "Abmessungen": "Breite: 54,4 cm x H\u00f6he: 49,84 cm x Tiefe/L\u00e4nge: 21,89 cm",
        "Anschl\u00fcsse": "1x HDMI-Eingang, 1x Mini-DisplayPort-Eingang, (Mini-DisplayPort-Version: 1.2), 1x Kopfh\u00f6rer-Ausgang",
        "Bild": "Format",
        "Bildschirmaufl\u00f6sung": "1.920 x 1.080 Pixel",
        "Bildschirmdiagonale": "61 cm (24 Zoll)",
        "EAN": "8806094672220",
        "Energieeffizienzklasse (SDR)": "E (A - G)",
        "Energieverbauch pro 1000 Stunden (SDR)": "17 kWh",
        "Ergonomie": "Typ",
        "Farbe": "schwarz",
        "Features": "Eco Saving Plus, Eye Saver Mode, Flicker Free, Game Mode, Black Equalizer, Refresh Rate Optimizer",
        "Geeignet f\u00fcr": "Gaming",
        "Gewicht": "4,1 kg",
        "Hersteller-Nr.": "LS24AG304NRXEN",
        "Leistungsaufnahme im Bereitschafts- und Aus-Zustand": "0,3 Watt / 0,3 Watt",
        "Leistungsaufnahme im Ein-Zustand bei Standard-Dynamikumfang (SDR)": "17 Watt",
        "Serie": "Odyssey",
        "Stromversorgung": "Sleep Mode",
        "Typ": "Gaming-Monitor",
        "Wandhalterung": "VESA kompatibel (100 x 100 mm)",
        "Zubeh\u00f6r": "Vorhanden"
    },
    "raw_specifications_text": "Energieeffizienzklasse (SDR): E (A - G)\nEnergieverbauch pro 1000 Stunden (SDR): 17 kWh\nLeistungsaufnahme im Ein-Zustand bei Standard-Dynamikumfang (SDR): 17 Watt\nLeistungsaufnahme im Bereitschafts- und Aus-Zustand: 0,3 Watt / 0,3 Watt\nBildschirmdiagonale: 61 cm (24 Zoll)\nBildschirmaufl\u00f6sung: 1.920 x 1.080 Pixel\nTyp: Gaming-Monitor\nFarbe: schwarz\nEAN: 8806094672220\nHersteller-Nr.: LS24AG304NRXEN\nSerie: Odyssey\nGeeignet f\u00fcr: Gaming\nBild: Format\n: H\u00f6henverstellbar\nAnschl\u00fcsse: 1x HDMI-Eingang, 1x Mini-DisplayPort-Eingang, (Mini-DisplayPort-Version: 1.2), 1x Kopfh\u00f6rer-Ausgang\nErgonomie: Typ\nStromversorgung: Sleep Mode\nWandhalterung: VESA kompatibel (100 x 100 mm)\nFeatures: Eco Saving Plus, Eye Saver Mode, Flicker Free, Game Mode, Black Equalizer, Refresh Rate Optimizer\nZubeh\u00f6r: Vorhanden\nAbmessungen: Breite: 54,4 cm x H\u00f6he: 49,84 cm x Tiefe/L\u00e4nge: 21,89 cm\nGewicht: 4,1 kg",
    "reference_file": "offer_reference_482.json",
    "shop_name": "Alternate.at"
}