{
    "html_file": "offer_481_9.html",
    "name": "Samsung Odyssey G3 G3A (2023), 27\"",
    "offer_link": "https://www.amazon.de/dp/B0BJZ922DV?linkCode=xm2&camp=2025&creative=165953&smid=A3JWKAKR8XB7XF&creativeASIN=B0BJZ922DV&tag=geizhals1-21",
    "price": 171.51,
    "raw_specifications": {
        "ASIN": "B0BJZ922DV",
        "Amazon Bestseller-Rang": "Nr. 4,006 in Computer & Zubeh\u00f6r (Siehe Top 100 in Computer & Zubeh\u00f6r)  Nr. 74 in Monitore",
        "Anzahl HDMI Schnittstellen": "\u200e1",
        "Artikelgewicht": "\u200e5,3 Kilograms",
        "Display-Gr\u00f6\u00dfe": "\u200e27 Zoll",
        "Durchschnittliche Kundenbewertung": "4,4  4,4 von 5 Sternen    \n    37 Sternebewertungen   \n\n\n 4,4 von 5 Sternen",
        "Farbe": "\u200eSchwarz",
        "Garantierte Software-Updates bis": "\u200eunbekannt",
        "Hersteller": "\u200eSamsung",
        "Im Angebot von Amazon.de seit": "21. Oktober 2022",
        "L\u00f6sung": "\u200e1920 x 1080 Pixels",
        "Marke": "\u200eSamsung",
        "Modell/Serie": "\u200eOdyssey G3A Gaming Monitor",
        "Modellnummer": "\u200eLS27AG304NRXEN",
        "Produktabmessungen": "\u200e21,89 x 61,82 x 52,05 cm; 5,3 Kilogramm",
        "Prozessortyp": "\u200eOthers"
    },
    "raw_specifications_text": "Marke: \u200eSamsung\nHersteller: \u200eSamsung\nModell/Serie: \u200eOdyssey G3A Gaming Monitor\nProduktabmessungen: \u200e21,89 x 61,82 x 52,05 cm; 5,3 Kilogramm\nModellnummer: \u200eLS27AG304NRXEN\nFarbe: \u200eSchwarz\nDisplay-Gr\u00f6\u00dfe: \u200e27 Zoll\nL\u00f6sung: \u200e1920 x 1080 Pixels\nProzessortyp: \u200eOthers\nAnzahl HDMI Schnittstellen: \u200e1\nArtikelgewicht: \u200e5,3 Kilograms\nGarantierte Software-Updates bis: \u200eunbekannt\nASIN: B0BJZ922DV\nDurchschnittliche Kundenbewertung: 4,4  4,4 von 5 Sternen    \n    37 Sternebewertungen   \n\n\n 4,4 von 5 Sternen\nAmazon Bestseller-Rang: Nr. 4,006 in Computer & Zubeh\u00f6r (Siehe Top 100 in Computer & Zubeh\u00f6r)  Nr. 74 in Monitore\nIm Angebot von Amazon.de seit: 21. Oktober 2022",
    "reference_file": "offer_reference_481.json",
    "shop_name": "Amazon.at"
}