{
    "html_file": "offer_1629_16.html",
    "name": "Lenovo L27i-30, 27\"",
    "offer_link": "https://www.alternate.at/Lenovo/L27i-30-LED-Monitor/html/product/1886224?partner=AtGeizhalsat&campaign=Monitor/Lenovo/1886224",
    "price": 172.9,
    "raw_specifications": {
        "": "Stromverbrauch",
        "Abmessungen": "Breite: 61,25 cm x H\u00f6he: 47,58 cm x Tiefe/L\u00e4nge: 17,5 cm",
        "Anschl\u00fcsse": "1x HDMI-Eingang, (HDMI-Version: 1.4), 1x VGA-Eingang, 1x 3,5-mm-Audio-Ausgang",
        "Bild": "Format",
        "Bildschirmaufl\u00f6sung": "1.920 x 1.080 Pixel",
        "Bildschirmdiagonale": "69 cm (27 Zoll)",
        "EAN": "0195477455597",
        "Energieeffizienzklasse (SDR)": "E (A - G)",
        "Energieverbauch pro 1000 Stunden (SDR)": "18 kWh",
        "Ergonomie": "Typ",
        "Farbe": "schwarz",
        "Features": "AMD FreeSync",
        "Gewicht": "4,4 kg",
        "Hersteller-Nr.": "66BFKAC2E5",
        "Leistungsaufnahme im Bereitschafts- und Aus-Zustand": "0,2 Watt",
        "Leistungsaufnahme im Ein-Zustand bei Standard-Dynamikumfang (SDR)": "18 Watt",
        "Rahmen": "Breite",
        "Stromversorgung": "Eco-Off",
        "Typ": "LED-Monitor",
        "Weitere Informationen": "Die Reaktionszeit von 4 ms wird im Extreme Mode erreicht (6 ms Standard)",
        "Zubeh\u00f6r": "Vorhanden"
    },
    "raw_specifications_text": "Energieeffizienzklasse (SDR): E (A - G)\nEnergieverbauch pro 1000 Stunden (SDR): 18 kWh\nLeistungsaufnahme im Ein-Zustand bei Standard-Dynamikumfang (SDR): 18 Watt\nLeistungsaufnahme im Bereitschafts- und Aus-Zustand: 0,2 Watt\nBildschirmdiagonale: 69 cm (27 Zoll)\nBildschirmaufl\u00f6sung: 1.920 x 1.080 Pixel\nTyp: LED-Monitor\nFarbe: schwarz\nEAN: 0195477455597\nHersteller-Nr.: 66BFKAC2E5\nBild: Format\n: Stromverbrauch\nRahmen: Breite\nAnschl\u00fcsse: 1x HDMI-Eingang, (HDMI-Version: 1.4), 1x VGA-Eingang, 1x 3,5-mm-Audio-Ausgang\nErgonomie: Typ\nStromversorgung: Eco-Off\nFeatures: AMD FreeSync\nWeitere Informationen: Die Reaktionszeit von 4 ms wird im Extreme Mode erreicht (6 ms Standard)\nZubeh\u00f6r: Vorhanden\nAbmessungen: Breite: 61,25 cm x H\u00f6he: 47,58 cm x Tiefe/L\u00e4nge: 17,5 cm\nGewicht: 4,4 kg",
    "reference_file": "offer_reference_1629.json",
    "shop_name": "Alternate.at"
}