{
    "html_file": "offer_1571_12.html",
    "name": "HANNspree HP248UJB, 23.8\"",
    "offer_link": "https://www.proshop.at/Bildschirm/HANNspree-24-Bildschirm-HP248UJB-Black-4-ms/2928508?utm_source=geizhals&utm_medium=cpc&utm_campaign=pricesite",
    "price": 134.52,
    "raw_specifications": {
        "Abmessungen (Breite x Tiefe x H\u00f6he)": "54 cm x 25.14 cm x 64.64 cm",
        "Ausgangsleistung/Kanal": "2 Watt",
        "Besonderheiten": "Eco-Mode, Multiple Display, Spielmodus, flimmerfreie Technologie, Hard Coating (3H), Full HD Ultraweitwinkel (UWVA), Movie Mode, Ultra Slim Design Bezel, Low Blue Light-Technologie, d\u00fcnnes Blendendesign",
        "Bildschirmbeschichtung": "Blendfrei",
        "Bildschirmtyp": "ADS-IPS",
        "Diagonalabmessung": "60.45 cm (23.8\")",
        "Display-Typ": "LED-hintergrundbeleuchteter LCD-Monitor / TFT-Aktivmatrix",
        "EAN": "4711404023323",
        "Eingangsanschl\u00fcsse": "HDMI, VGA, DisplayPort",
        "Eingangsspannung": "AC 100 - 240 V (50 - 60 Hz)",
        "Einstellungen der Anzeigeposition": "H\u00f6he, Pivot (Rotation), Drehung, Neigung",
        "Energie Effizienzklasse": "Klasse F",
        "Energierverbrauch Sleep": "0.5 Watt",
        "Enthaltene Kabel": "1 x HDMI-Kabel - 1.5 m",
        "Farbe": "Black Texture",
        "Farbunterst\u00fctzung": "16,7 Millionen Farben",
        "Ger\u00e4tetyp": "LED-hintergrundbeleuchteter LCD-Monitor - 60.45 cm (23.8\")",
        "Gewicht": "4.1 kg",
        "Helligkeit": "300 cd/m\u00b2",
        "Hersteller": "HANNspree",
        "Hintergrundbeleuchtungs-Technologie": "LED-Hintergrundbeleuchtung",
        "Horizontale Bildwiederholrate": "30 - 83 kHz",
        "Horizontaler Betrachtungswinkel": "178",
        "H\u00f6heneinstellung": "120 mm",
        "Integrierte Peripherieger\u00e4te": "USB 3.0-Hub",
        "Kontrast": "1000:1 / 80000000:1 (dynamisch)",
        "Leistungsmerkmale": "USB 3.0-Hub",
        "Modell": "HP248UJB",
        "Native Aufl\u00f6sung": "Full HD (1080p) 1920 x 1080 bei 60 Hz",
        "Neigungswinkel": "-5/20",
        "OSD-Sprachen": "Multilingual",
        "Pixelpitch": "0.274 mm",
        "Produktbeschreibung": "Hannspree HP248UJB - LED-Monitor - Full HD (1080p) - 60.45 cm (23.8\")",
        "Reaktionszeit": "4 ms",
        "Rotationswinkel": "90",
        "Schnittstellen": "HDMI  VGA  Kopfh\u00f6rer  DisplayPort  USB 3.0 Upstream  2 x USB 3.0 Downstream",
        "Schwenkwinkel": "90",
        "Seitenverh\u00e4ltnis": "16:9",
        "Spannung": "AC 100 - 240 V (50 - 60 Hz)",
        "Stromverbrauch (Aus-Modus)": "0.3 Watt",
        "Stromverbrauch SDR (eingeschaltet)": "22 kWh/1.000 h",
        "Typ": "Lautsprecher - Stereo",
        "VESA-Halterung": "100 x 100 mm",
        "Vertikale Bildwiederholrate": "56 - 75 Hz",
        "Vertikaler Betrachtungswinkel": "178",
        "Waren-Nr.": "2928508",
        "Zum Hersteller": "www.hannspree.com/eu/en/"
    },
    "raw_specifications_text": "Hersteller: HANNspree\nWaren-Nr.: 2928508\nModell: HP248UJB\nEAN: 4711404023323\nZum Hersteller: www.hannspree.com/eu/en/\nProduktbeschreibung: Hannspree HP248UJB - LED-Monitor - Full HD (1080p) - 60.45 cm (23.8\")\nGer\u00e4tetyp: LED-hintergrundbeleuchteter LCD-Monitor - 60.45 cm (23.8\")\nEnergie Effizienzklasse: Klasse F\nLeistungsmerkmale: USB 3.0-Hub\nBildschirmtyp: ADS-IPS\nSeitenverh\u00e4ltnis: 16:9\nNative Aufl\u00f6sung: Full HD (1080p) 1920 x 1080 bei 60 Hz\nPixelpitch: 0.274 mm\nHelligkeit: 300 cd/m\u00b2\nKontrast: 1000:1 / 80000000:1 (dynamisch)\nReaktionszeit: 4 ms\nFarbunterst\u00fctzung: 16,7 Millionen Farben\nEingangsanschl\u00fcsse: HDMI, VGA, DisplayPort\nEinstellungen der Anzeigeposition: H\u00f6he, Pivot (Rotation), Drehung, Neigung\nBildschirmbeschichtung: Blendfrei\nSpannung: AC 100 - 240 V (50 - 60 Hz)\nFarbe: Black Texture\nAbmessungen (Breite x Tiefe x H\u00f6he): 54 cm x 25.14 cm x 64.64 cm\nGewicht: 4.1 kg\nDisplay-Typ: LED-hintergrundbeleuchteter LCD-Monitor / TFT-Aktivmatrix\nDiagonalabmessung: 60.45 cm (23.8\")\nIntegrierte Peripherieger\u00e4te: USB 3.0-Hub\nVertikale Bildwiederholrate: 56 - 75 Hz\nHorizontale Bildwiederholrate: 30 - 83 kHz\nHorizontaler Betrachtungswinkel: 178\nVertikaler Betrachtungswinkel: 178\nHintergrundbeleuchtungs-Technologie: LED-Hintergrundbeleuchtung\nOSD-Sprachen: Multilingual\nBesonderheiten: Eco-Mode, Multiple Display, Spielmodus, flimmerfreie Technologie, Hard Coating (3H), Full HD Ultraweitwinkel (UWVA), Movie Mode, Ultra Slim Design Bezel, Low Blue Light-Technologie, d\u00fcnnes Blendendesign\nTyp: Lautsprecher - Stereo\nAusgangsleistung/Kanal: 2 Watt\nSchnittstellen: HDMI  VGA  Kopfh\u00f6rer  DisplayPort  USB 3.0 Upstream  2 x USB 3.0 Downstream\nNeigungswinkel: -5/20\nSchwenkwinkel: 90\nRotationswinkel: 90\nH\u00f6heneinstellung: 120 mm\nVESA-Halterung: 100 x 100 mm\nEnthaltene Kabel: 1 x HDMI-Kabel - 1.5 m\nEingangsspannung: AC 100 - 240 V (50 - 60 Hz)\nStromverbrauch SDR (eingeschaltet): 22 kWh/1.000 h\nEnergierverbrauch Sleep: 0.5 Watt\nStromverbrauch (Aus-Modus): 0.3 Watt",
    "reference_file": "offer_reference_1571.json",
    "shop_name": "Proshop.at"
}