{
    "html_file": "offer_1949_30.html",
    "name": "AOC 24B2XH, 23.8\"",
    "offer_link": "https://www.future-x.at/aoc-led-monitor-60-5-cm-238-1920-x-1080-full-hd-1080p-ips-250-cd-m%B2-1000%3A1-8-ms-hdmi-vga-p-8267329/?pv=2",
    "price": 110.69,
    "raw_specifications": {
        "Abmessungen (Breite x Tiefe x H\u00f6he)": "41,835 cm x 17,094 cm x 53,947 cm - mit Fu\u00df",
        "Bildschirmtyp": "IPS",
        "Diagonalabmessung": "60,5 cm (23.8\")",
        "Display-Typ": "LED-hintergrundbeleuchteter LCD-Monitor / TFT-Aktivmatrix",
        "Einstellungen der Anzeigeposition": "Neigbar",
        "Enthaltene Kabel": "1 x HDMI-Kabel - 1.5 m",
        "Farbunterst\u00fctzung": "16,7 Millionen Farben",
        "Gewicht": "2,7 kg",
        "Helligkeit": "250 cd/m\u00b2",
        "Hintergrundbeleuchtungs-Technologie": "WLED",
        "Horizontaler Betrachtungswinkel": "178",
        "Kennzeichnung": "TUV GS, GOST, FCC, REACHAbmessungen & Gewicht (Transport)",
        "Kontrast": "1000:1 / 20000000:1 (dynamisch)",
        "MTBF": "50,000 Stunde(n)",
        "Native Aufl\u00f6sung": "Full HD (1080p) 1920 x 1080 bei 60 Hz",
        "Neigungswinkel": "-3.5/+21.5",
        "OSD-Sprachen": "Tschechisch, Chinesisch (tradionell), Chinesisch (vereinfacht), Englisch, Deutsch, Franz\u00f6sisch, Italienisch, Portugiesisch, Polnisch, Finnisch, Schwedisch, Russisch, Spanisch, Holl\u00e4ndisch, Japanisch, Koreanisch",
        "Pixelpitch": "0.2745 mm",
        "Reaktionszeit": "8 ms",
        "Schnittstellen": "VGA \u00a6 HDMI \u00a6 Kopfh\u00f6rer",
        "Seitenverh\u00e4ltnis": "16:9",
        "Service & Support": "Begrenzte Garantie - 3 Jahre",
        "Transportbreite": "46,7 cm",
        "Transportgewicht": "4,5 kg",
        "Transporth\u00f6he": "29,2 cm",
        "Transporttiefe": "10,6 cm",
        "Vertikaler Betrachtungswinkel": "178"
    },
    "raw_specifications_text": "Display-Typ: LED-hintergrundbeleuchteter LCD-Monitor / TFT-Aktivmatrix\nDiagonalabmessung: 60,5 cm (23.8\")\nBildschirmtyp: IPS\nSeitenverh\u00e4ltnis: 16:9\nNative Aufl\u00f6sung: Full HD (1080p) 1920 x 1080 bei 60 Hz\nPixelpitch: 0.2745 mm\nHelligkeit: 250 cd/m\u00b2\nKontrast: 1000:1 / 20000000:1 (dynamisch)\nFarbunterst\u00fctzung: 16,7 Millionen Farben\nReaktionszeit: 8 ms\nHorizontaler Betrachtungswinkel: 178\nVertikaler Betrachtungswinkel: 178\nHintergrundbeleuchtungs-Technologie: WLED\nOSD-Sprachen: Tschechisch, Chinesisch (tradionell), Chinesisch (vereinfacht), Englisch, Deutsch, Franz\u00f6sisch, Italienisch, Portugiesisch, Polnisch, Finnisch, Schwedisch, Russisch, Spanisch, Holl\u00e4ndisch, Japanisch, Koreanisch\nAbmessungen (Breite x Tiefe x H\u00f6he): 41,835 cm x 17,094 cm x 53,947 cm - mit Fu\u00df\nGewicht: 2,7 kg\nSchnittstellen: VGA \u00a6 HDMI \u00a6 Kopfh\u00f6rer\nEinstellungen der Anzeigeposition: Neigbar\nNeigungswinkel: -3.5/+21.5\nEnthaltene Kabel: 1 x HDMI-Kabel - 1.5 m\nMTBF: 50,000 Stunde(n)\nKennzeichnung: TUV GS, GOST, FCC, REACHAbmessungen & Gewicht (Transport)\nTransportbreite: 46,7 cm\nTransporttiefe: 10,6 cm\nTransporth\u00f6he: 29,2 cm\nTransportgewicht: 4,5 kg\nService & Support: Begrenzte Garantie - 3 Jahre",
    "reference_file": "offer_reference_1949.json",
    "shop_name": "Future-X.at"
}