{
    "html_file": "offer_746_4.html",
    "name": "ASRock Phantom Gaming PG34WQ15R2B, 34\"",
    "offer_link": "https://www.amazon.de/dp/B0BVKY9W3M?linkCode=xm2&camp=2025&creative=165953&smid=A3JWKAKR8XB7XF&creativeASIN=B0BVKY9W3M&tag=geizhals1-21",
    "price": 457.69,
    "raw_specifications": {
        "ASIN": "B0BVKY9W3M",
        "Amazon Bestseller-Rang": "Nr. 84,166 in Computer & Zubeh\u00f6r (Siehe Top 100 in Computer & Zubeh\u00f6r)  Nr. 1,563 in Monitore  Nr. 2,966 in Pr\u00e4sentationszubeh\u00f6r",
        "Antriebsart": "\u200eAC (Wechselstrom)",
        "Anzahl HDMI Schnittstellen": "\u200e2",
        "Artikelgewicht": "\u200e2 Kilograms",
        "Batterien enthalten": "\u200eNein",
        "Bildschirmaufl\u00f6sung": "\u200e3440 x 1440",
        "Display-Gr\u00f6\u00dfe": "\u200e34 Zoll",
        "Durchschnittliche Kundenbewertung": "4,3  4,3 von 5 Sternen    \n    4 Sternebewertungen   \n\n\n 4,3 von 5 Sternen",
        "Farbe": "\u200eSchwarz",
        "Garantierte Software-Updates bis": "\u200eunbekannt",
        "Hersteller": "\u200eAsrock",
        "Im Angebot von Amazon.de seit": "13. Februar 2023",
        "L\u00f6sung": "\u200e3440 x 1440 Pixels",
        "Marke": "\u200eASRock",
        "Modell/Serie": "\u200ePG34WQ15R2B GAMING MONITOR",
        "Modellnummer": "\u200ePG34WQ15R2B",
        "Produktabmessungen": "\u200e28,31 x 80,93 x 57,45 cm; 2 Kilogramm"
    },
    "raw_specifications_text": "Marke: \u200eASRock\nHersteller: \u200eAsrock\nModell/Serie: \u200ePG34WQ15R2B GAMING MONITOR\nProduktabmessungen: \u200e28,31 x 80,93 x 57,45 cm; 2 Kilogramm\nModellnummer: \u200ePG34WQ15R2B\nFarbe: \u200eSchwarz\nDisplay-Gr\u00f6\u00dfe: \u200e34 Zoll\nBildschirmaufl\u00f6sung: \u200e3440 x 1440\nL\u00f6sung: \u200e3440 x 1440 Pixels\nAnzahl HDMI Schnittstellen: \u200e2\nAntriebsart: \u200eAC (Wechselstrom)\nBatterien enthalten: \u200eNein\nArtikelgewicht: \u200e2 Kilograms\nGarantierte Software-Updates bis: \u200eunbekannt\nASIN: B0BVKY9W3M\nDurchschnittliche Kundenbewertung: 4,3  4,3 von 5 Sternen    \n    4 Sternebewertungen   \n\n\n 4,3 von 5 Sternen\nAmazon Bestseller-Rang: Nr. 84,166 in Computer & Zubeh\u00f6r (Siehe Top 100 in Computer & Zubeh\u00f6r)  Nr. 1,563 in Monitore  Nr. 2,966 in Pr\u00e4sentationszubeh\u00f6r\nIm Angebot von Amazon.de seit: 13. Februar 2023",
    "reference_file": "offer_reference_746.json",
    "shop_name": "Amazon.at"
}