{
    "html_file": "offer_2492_2.html",
    "name": "Samsung SE450, 22\"",
    "offer_link": "https://www.mylemon.at/artikel/samsung/ls22e45kmwv_en/dis-22-s22e450mw.html",
    "price": 145.71,
    "raw_specifications": {
        "AC Eingangsspannung": "100 - 240 V",
        "AMD FreeSync": "Nein",
        "Anzahl VGA (D-Sub) Anschl\u00fcsse": "1",
        "Anzahl der Farben des Displays": "16,78 Millionen Farben",
        "Artikelnummer": "MFIY06L",
        "Audioanschl\u00fcsse": "Ja",
        "Aufl\u00f6sung": "1680x1050",
        "Benutzerhandbuch auf CD-ROM": "Ja",
        "Besonderheiten": "60 Hz, Lautsprecher",
        "Betriebstemperatur": "10 - 40 \u00b0C",
        "Bildschirmdiagonale": "55,9 cm (22\")",
        "Bildschirmtechnologie": "LED",
        "Bildwinkel, horizontal": "170\u00b0",
        "Bildwinkel, vertikal": "160\u00b0",
        "Bluetooth": "Nein",
        "Breite (ohne Standfu\u00df)": "502,4 mm",
        "DVI Anschluss": "Ja",
        "Display": "LED",
        "Display-Aufl\u00f6sung": "1680 x 1050 Pixel",
        "Display-Helligkeit (mind.)": "200 cd/m\u00b2",
        "Displaygr\u00f6\u00dfe": "22 Zoll",
        "Dynamisches Kontrastverh\u00e4ltnis Marketingbezeichnung": "Mega-Kontrast",
        "EAN": "8806086875257",
        "ECO-Modus": "Ja",
        "Eingebaute Lautsprecher": "Ja",
        "Eingebauter Ethernet-Anschluss": "Nein",
        "Energieeffizienzklasse (SDR)": "G",
        "Energieeffizienzskala": "A bis G",
        "Energieverbrauch (SDR) pro 1.000 Stunden": "23 kWh",
        "Ergonomie": "H\u00f6henverstellbar, Pivot (90 Grad drehbar), Schwenkbar, Neigbar",
        "Farbskala": "72%",
        "Flimmerfreie Technologie": "Ja",
        "Ger\u00e4tebreite (inkl. Fu\u00df)": "502,4 mm",
        "Ger\u00e4teh\u00f6he (inkl. Fu\u00df)": "453,4 mm",
        "Ger\u00e4tetiefe (inkl. Fu\u00df)": "210 mm",
        "Gewicht (mit St\u00e4nder)": "4,91 kg",
        "Gewicht (ohne St\u00e4nder)": "3,42 kg",
        "HD-Typ": "WSXGA+",
        "HDCP": "Ja",
        "Helligkeit": "250 cd/m\u00b2",
        "Helligkeit (typisch)": "250 cd/m\u00b2",
        "Hersteller Artikelnummer": "LS22E45KMWV/EN",
        "H\u00f6he (ohne Standfu\u00df)": "329,8 mm",
        "H\u00f6heneinstellung": "10 cm",
        "H\u00f6henverstellung": "Ja",
        "Integrierter USB-Hub": "Nein",
        "Kabell\u00e4nge": "1,5 m",
        "Kabelsperre-Slot": "Nein",
        "Kein Flimmern": "Ja",
        "Kontrastverh\u00e4ltnis": "1000:1",
        "Kopfh\u00f6rerausg\u00e4nge": "1",
        "LED-Anzeigen": "Leistung",
        "Maximale Bildwiederholrate": "60 Hz",
        "Mitgelieferte Kabel": "Audio (3,5 mm), DVI, VGA",
        "Nachhaltigkeitszertifikate": "ENERGY STAR",
        "Natives Seitenverh\u00e4ltnis": "16:10",
        "Neigungsverstellung": "Ja",
        "Neigungswinkelbereich": "-3 - 25\u00b0",
        "On-Screen-Display (OSD)": "Ja",
        "Paketgewicht": "6,26 kg",
        "Panel": "TN",
        "Panel-Montage-Schnittstelle": "100 x 100 mm",
        "Panel-Typ": "TN",
        "Pivot Winkel": "-1 - 95\u00b0",
        "Pixel Abstand": "0,282 x 0,282 mm",
        "Plug & Play": "Ja",
        "Produktfarbe": "Schwarz",
        "Reaktionszeit": "5 ms",
        "Recycelbares Material": "30%",
        "Relative Luftfeuchtigkeit in Betrieb": "10 - 80%",
        "Samsung Eye Saver-Modus": "Ja",
        "Samsung Magic Function": "MagicAngle, MagicBright, MagicUpscale",
        "Schnellstart\u00fcbersicht": "Ja",
        "Schwenkbar": "Ja",
        "Schwenkwinkelbereich": "-45 - 45\u00b0",
        "Seitenverh\u00e4ltnis": "16:10",
        "Sicherheit": "CBEU): IEC60950-1, EN60950-1, cULusUS,Canada): UL60950-1, KC(Korea): K60950-1, PSB(singapore), Soncap(Negeria), Kucas(Kwuit), SASO(Saudi Arabia): IEC60950-1, CCC(China): GB4943-2011",
        "Sichtbare Gr\u00f6\u00dfe (horizontal)": "47,4 cm",
        "Sichtbare Gr\u00f6\u00dfe (vertikal)": "29,6 cm",
        "Sleep-Timer": "Ja",
        "Spiel-Modus": "Ja",
        "Stromkabell\u00e4nge": "1,5 m",
        "Stromverbrauch (DPMS)": "0,3 W",
        "Stromverbrauch (aus)": "0,005 W",
        "St\u00e4nder enthalten": "Ja",
        "TV Tuner integriert": "Nein",
        "Thin Client installiert": "Nein",
        "Tiefe (ohne Standfu\u00df)": "55,7 mm",
        "Touchscreen": "Nein",
        "Unterst\u00fctzt Windows-Betriebssysteme": "Windows 10 Education, Windows 10 Education x64, Windows 10 Enterprise, Windows 10 Enterprise x64, Windows 10 Home, Windows 10 Home x64, Windows 10 Pro, Windows 10 Pro x64, Ja",
        "Unterst\u00fctzte Grafik-Aufl\u00f6sungen": "1680 x 1050 (WSXGA+)",
        "VESA Halterung": "100x100 mm",
        "VESA-Halterung": "Ja",
        "Verpackungsbreite": "578 mm",
        "Verpackungsh\u00f6he": "188 mm",
        "Verpackungstiefe": "416 mm",
        "Video Anschl\u00fcsse": "1x DVI, 1x VGA",
        "WLAN": "Nein",
        "Warentarifnummer (HS)": "85285210",
        "Zertifizierung": "FCC(USA), IC(Canada): FCC Part15 Subpart B, CE(Europe): EN55022,EN55024, KCC(korean) KN22,KN24, C-tick (Australia): AS/NZS3548(CISPR22), CCC(China): GB9254-2008 GB17625.1-2012"
    },
    "raw_specifications_text": "Displaygr\u00f6\u00dfe: 22 Zoll\nAufl\u00f6sung: 1680x1050\nPanel: TN\nReaktionszeit: 5 ms\nVideo Anschl\u00fcsse: 1x DVI, 1x VGA\nErgonomie: H\u00f6henverstellbar, Pivot (90 Grad drehbar), Schwenkbar, Neigbar\nVESA Halterung: 100x100 mm\nHelligkeit: 250 cd/m\u00b2\nBesonderheiten: 60 Hz, Lautsprecher\nHersteller Artikelnummer: LS22E45KMWV/EN\nEAN: 8806086875257\nArtikelnummer: MFIY06L\nBildschirmdiagonale: 55,9 cm (22\")\nDisplay-Aufl\u00f6sung: 1680 x 1050 Pixel\nNatives Seitenverh\u00e4ltnis: 16:10\nBildschirmtechnologie: LED\nTouchscreen: Nein\nHD-Typ: WSXGA+\nPanel-Typ: TN\nKontrastverh\u00e4ltnis: 1000:1\nMaximale Bildwiederholrate: 60 Hz\nAnzahl der Farben des Displays: 16,78 Millionen Farben\nHelligkeit (typisch): 250 cd/m\u00b2\nUnterst\u00fctzte Grafik-Aufl\u00f6sungen: 1680 x 1050 (WSXGA+)\nSeitenverh\u00e4ltnis: 16:10\nDynamisches Kontrastverh\u00e4ltnis Marketingbezeichnung: Mega-Kontrast\nBildwinkel, horizontal: 170\u00b0\nBildwinkel, vertikal: 160\u00b0\nPixel Abstand: 0,282 x 0,282 mm\nSichtbare Gr\u00f6\u00dfe (horizontal): 47,4 cm\nSichtbare Gr\u00f6\u00dfe (vertikal): 29,6 cm\nFarbskala: 72%\nDisplay-Helligkeit (mind.): 200 cd/m\u00b2\nAMD FreeSync: Nein\nFlimmerfreie Technologie: Ja\nSpiel-Modus: Ja\nUnterst\u00fctzt Windows-Betriebssysteme: Windows 10 Education, Windows 10 Education x64, Windows 10 Enterprise, Windows 10 Enterprise x64, Windows 10 Home, Windows 10 Home x64, Windows 10 Pro, Windows 10 Pro x64, Ja\nEingebaute Lautsprecher: Ja\nProduktfarbe: Schwarz\nSicherheit: CBEU): IEC60950-1, EN60950-1, cULusUS,Canada): UL60950-1, KC(Korea): K60950-1, PSB(singapore), Soncap(Negeria), Kucas(Kwuit), SASO(Saudi Arabia): IEC60950-1, CCC(China): GB4943-2011\nZertifizierung: FCC(USA), IC(Canada): FCC Part15 Subpart B, CE(Europe): EN55022,EN55024, KCC(korean) KN22,KN24, C-tick (Australia): AS/NZS3548(CISPR22), CCC(China): GB9254-2008 GB17625.1-2012\nIntegrierter USB-Hub: Nein\nAnzahl VGA (D-Sub) Anschl\u00fcsse: 1\nDVI Anschluss: Ja\nAudioanschl\u00fcsse: Ja\nKopfh\u00f6rerausg\u00e4nge: 1\nHDCP: Ja\nWLAN: Nein\nBluetooth: Nein\nEingebauter Ethernet-Anschluss: Nein\nVESA-Halterung: Ja\nKabelsperre-Slot: Nein\nH\u00f6henverstellung: Ja\nPanel-Montage-Schnittstelle: 100 x 100 mm\nH\u00f6heneinstellung: 10 cm\nPivot Winkel: -1 - 95\u00b0\nSchwenkbar: Ja\nSchwenkwinkelbereich: -45 - 45\u00b0\nNeigungswinkelbereich: -3 - 25\u00b0\nOn-Screen-Display (OSD): Ja\nPlug & Play: Ja\nLED-Anzeigen: Leistung\nNeigungsverstellung: Ja\nKabell\u00e4nge: 1,5 m\nEnergieeffizienzklasse (SDR): G\nEnergieverbrauch (SDR) pro 1.000 Stunden: 23 kWh\nStromverbrauch (aus): 0,005 W\nAC Eingangsspannung: 100 - 240 V\nEnergieeffizienzskala: A bis G\nBetriebstemperatur: 10 - 40 \u00b0C\nRelative Luftfeuchtigkeit in Betrieb: 10 - 80%\nSt\u00e4nder enthalten: Ja\nMitgelieferte Kabel: Audio (3,5 mm), DVI, VGA\nSchnellstart\u00fcbersicht: Ja\nStromkabell\u00e4nge: 1,5 m\nGer\u00e4tebreite (inkl. Fu\u00df): 502,4 mm\nGer\u00e4tetiefe (inkl. Fu\u00df): 210 mm\nGer\u00e4teh\u00f6he (inkl. Fu\u00df): 453,4 mm\nGewicht (mit St\u00e4nder): 4,91 kg\nBreite (ohne Standfu\u00df): 502,4 mm\nTiefe (ohne Standfu\u00df): 55,7 mm\nH\u00f6he (ohne Standfu\u00df): 329,8 mm\nGewicht (ohne St\u00e4nder): 3,42 kg\nVerpackungsbreite: 578 mm\nVerpackungstiefe: 416 mm\nVerpackungsh\u00f6he: 188 mm\nPaketgewicht: 6,26 kg\nBenutzerhandbuch auf CD-ROM: Ja\nNachhaltigkeitszertifikate: ENERGY STAR\nRecycelbares Material: 30%\nWarentarifnummer (HS): 85285210\nThin Client installiert: Nein\nDisplay: LED\nStromverbrauch (DPMS): 0,3 W\nTV Tuner integriert: Nein\nECO-Modus: Ja\nSleep-Timer: Ja\nKein Flimmern: Ja\nSamsung Eye Saver-Modus: Ja\nSamsung Magic Function: MagicAngle, MagicBright, MagicUpscale",
    "reference_file": "offer_reference_2492.json",
    "shop_name": "mylemon.at"
}