{
    "html_file": "offer_1933_25.html",
    "name": "Acer Nitro ED0 ED320QRPbiipx, 31.5\"",
    "offer_link": "https://www.taufnaus.de/product/10601615",
    "price": 291.13,
    "raw_specifications": {
        "Abmessungen (Breite x Tiefe x H\u00f6he)": "71.3 cm x 51.25 cm x 19.86 cm",
        "Adaptive-Sync Technologie": "AMD FreeSync",
        "Besonderheiten": "ComfyView, Flimmerfrei-Technologie, Abblend-Technologie, Blaulichtfilter-Technologie, Acer VisionCare, 0.363 mm Pixelabstand, 72 % NTSC Farbraum",
        "Bildschirmbeschichtung": "Blendfrei",
        "Bildschirmtyp": "VA",
        "Diagonalabmessung": "80 cm (31.5\")",
        "Display-Typ": "LED-hintergrundbeleuchteter LCD-Monitor / TFT-Aktivmatrix",
        "Eingangsspannung": "Wechselstrom 120/230 V (50/60 Hz)",
        "Einstellungen der Anzeigeposition": "Neigung",
        "Energie Effizienzklasse": "Klasse F",
        "Energieverbrauch pro Jahr": "50 kWh",
        "Enthaltene Kabel": "1 x VGA-Kabel \u00a6 1 x DisplayPort-Kabel",
        "Farbe": "Schwarz",
        "Farbraum": "72% NTSC",
        "Farbunterst\u00fctzung": "16,7 Millionen Farben (8-Bit)",
        "Geschwungener Bildschirm": "Ja (1800R)",
        "Helligkeit": "300 cd/m\u00b2",
        "Hintergrundbeleuchtungs-Technologie": "LED-Hintergrundbeleuchtung",
        "Horizontale Bildwiederholrate": "53.28 - 183.15 kHz",
        "Horizontaler Betrachtungswinkel": "178",
        "Integrierte Peripherieger\u00e4te": "USB 3.0-Hub",
        "Kennzeichnung": "MPR II, TUV GS, ISO 9241-307 Class 2",
        "Kontrast": "4000:1 / 100000000:1 (dynamisch)",
        "Leistungsaufnahme im Ein-Zustand": "31.1 W",
        "Leistungsmerkmale": "Unterst\u00fctzung f\u00fcr VESA-Schnittstelle",
        "Native Aufl\u00f6sung": "Full HD (1080p) 1920 x 1080 (DisplayPort: 165 Hz, HDMI: 144 Hz)",
        "Neigungswinkel": "-5/+20",
        "Ppi": "70",
        "Reaktionszeit": "5 ms (Gray-to-Gray)",
        "Schnittstellen": "2 x HDMI \u00a6 DisplayPort \u00a6 Audio Line-Out",
        "Seitenverh\u00e4ltnis": "16:9",
        "Stromverbrauch SDR (eingeschaltet)": "31.1 kWh/1.000 h",
        "Stromverbrauch im Standby-Modus": "0.5 Watt",
        "Transportgewicht": "6.7 kg",
        "Vertikale Bildwiederholrate": "48 - 165 Hz",
        "Vertikaler Betrachtungswinkel": "178"
    },
    "raw_specifications_text": "Display-Typ: LED-hintergrundbeleuchteter LCD-Monitor / TFT-Aktivmatrix\nEnergie Effizienzklasse: Klasse F\nEnergieverbrauch pro Jahr: 50 kWh\nDiagonalabmessung: 80 cm (31.5\")\nGeschwungener Bildschirm: Ja (1800R)\nAdaptive-Sync Technologie: AMD FreeSync\nIntegrierte Peripherieger\u00e4te: USB 3.0-Hub\nBildschirmtyp: VA\nSeitenverh\u00e4ltnis: 16:9\nNative Aufl\u00f6sung: Full HD (1080p) 1920 x 1080 (DisplayPort: 165 Hz, HDMI: 144 Hz)\nPpi: 70\nHelligkeit: 300 cd/m\u00b2\nKontrast: 4000:1 / 100000000:1 (dynamisch)\nFarbunterst\u00fctzung: 16,7 Millionen Farben (8-Bit)\nFarbraum: 72% NTSC\nReaktionszeit: 5 ms (Gray-to-Gray)\nVertikale Bildwiederholrate: 48 - 165 Hz\nHorizontale Bildwiederholrate: 53.28 - 183.15 kHz\nHorizontaler Betrachtungswinkel: 178\nVertikaler Betrachtungswinkel: 178\nBildschirmbeschichtung: Blendfrei\nHintergrundbeleuchtungs-Technologie: LED-Hintergrundbeleuchtung\nBesonderheiten: ComfyView, Flimmerfrei-Technologie, Abblend-Technologie, Blaulichtfilter-Technologie, Acer VisionCare, 0.363 mm Pixelabstand, 72 % NTSC Farbraum\nFarbe: Schwarz\nAbmessungen (Breite x Tiefe x H\u00f6he): 71.3 cm x 51.25 cm x 19.86 cm\nSchnittstellen: 2 x HDMI \u00a6 DisplayPort \u00a6 Audio Line-Out\nEinstellungen der Anzeigeposition: Neigung\nNeigungswinkel: -5/+20\nLeistungsmerkmale: Unterst\u00fctzung f\u00fcr VESA-Schnittstelle\nEnthaltene Kabel: 1 x VGA-Kabel \u00a6 1 x DisplayPort-Kabel\nKennzeichnung: MPR II, TUV GS, ISO 9241-307 Class 2\nEingangsspannung: Wechselstrom 120/230 V (50/60 Hz)\nLeistungsaufnahme im Ein-Zustand: 31.1 W\nStromverbrauch SDR (eingeschaltet): 31.1 kWh/1.000 h\nStromverbrauch im Standby-Modus: 0.5 Watt\nTransportgewicht: 6.7 kg",
    "reference_file": "offer_reference_1933.json",
    "shop_name": "TaufNaus"
}