{
    "html_file": "offer_150_15.html",
    "name": "Philips S-line 275S9JML, 27\"",
    "offer_link": "https://www.electronicshop24.at/product_info.php?products_id=20000001900274651&ano=I1900274651&mno=275S9JML&ean=8712581801168&utm_medium=cpc&utm_campaign=preisvergleich&utm_content=item&utm_source=geizhals&ref=geizhals",
    "price": 210.0,
    "raw_specifications": {
        "Abmessungen (Breite x Tiefe x H\u00f6he)": "61.3 cm x 20.5 cm x 52.5 cm - mit Standfu\u00df (h\u00f6chste Position)",
        "Ausgangsleistung/Kanal": "2 Watt",
        "Besonderheiten": "SmartImage, Smart ErgoBase, flimmerfreie Technologie, Adaptive-Sync-Technologie, EasyRead, an 3 Seiten ohne Blende, LowBlue Mode",
        "Bildschirmbeschichtung": "Blendfrei, 3H Hard Coating, Haze 25 %",
        "Bildschirmtyp": "VA",
        "Details zu Abmessungen & Gewicht": "Mit Standfu\u00df (h\u00f6chste Position) - Breite: 61.3 cm - Tiefe: 20.5 cm - H\u00f6he: 52.5 cm - Gewicht: 5.6 kg \u00a6 Ohne Fu\u00df - Breite: 61.3 cm - Tiefe: 5.6 cm - H\u00f6he: 36.7 cm - Gewicht: 3.84 kg",
        "Diagonalabmessung": "68.5 cm (27\")",
        "Display-Typ": "LED-hintergrundbeleuchteter LCD-Monitor / TFT-Aktivmatrix",
        "ENERGY STAR zertifiziert": "Ja",
        "ENERGY STAR-Version": "8.0",
        "Ein-/Aus-Schalter": "Ja",
        "Eingangsspannung": "Wechselstrom 100-240 V (50/60 Hz)",
        "Einstellungen der Anzeigeposition": "H\u00f6he, Pivot (Rotation), Drehung, Neigung",
        "Energie Effizienzklasse": "Klasse F",
        "Enthaltene Kabel": "HDMI-Kabel",
        "Farbe": "Textured Black",
        "Farbraum": "119% sRGB (CIE 1931), 84% NTSC (CIE 1976)",
        "Farbunterst\u00fctzung": "16,7 Millionen Farben (8-Bit)",
        "Gewicht": "5.6 kg",
        "Helligkeit": "300 cd/m\u00b2",
        "Hintergrundbeleuchtungs-Technologie": "WLED",
        "Horizontale Bildwiederholrate": "30 - 114 kHz",
        "Horizontaler Betrachtungswinkel": "178",
        "H\u00f6heneinstellung": "130 mm",
        "Integrierte Peripherieger\u00e4te": "USB 3.2 Gen 1 Hub",
        "Kennzeichnung": "Plug and Play, FCC Klasse B bescheinigt, TUV GS, ICES-003, CB, TUV Ergo, DDC/CI, BC1.2, CU-EAC, BFR-frei, PVC-free, quecksilberfrei, EAEU RoHS, TCO Certified Edge",
        "Kontrast": "4000:1 / 50000000:1 (dynamisch)",
        "Leistungsmerkmale": "Slot f\u00fcr Sicherheitsschloss (Kabelschloss getrennt erh\u00e4ltlich)",
        "MTBF": "70,000 Stunde(n)",
        "Max. Betriebstemperatur": "40 \u00b0C",
        "Min Betriebstemperatur": "0 \u00b0C",
        "Mitgelieferte Software": "Philips SmartControl",
        "Native Aufl\u00f6sung": "QHD 2560 x 1440 bei 75 Hz",
        "Neigungswinkel": "-5/25",
        "OSD-Sprachen": "Ungarisch, Tschechisch, Chinesisch (tradionell), Chinesisch (vereinfacht), Ukrainisch, Brasilianisches Portugiesisch, Englisch, Deutsch, Franz\u00f6sisch, Italienisch, Portugiesisch, Polnisch, Finnisch, Schwedisch, Russisch, Spanisch, Holl\u00e4ndisch, Griechisch, T\u00fcrkisch, Japanisch, Koreanisch",
        "Pixelpitch": "0.2331 mm",
        "Ppi": "108.79",
        "Reaktionszeit": "4 ms (gray-to-gray)",
        "Rotationswinkel": "-90/+90",
        "Schlosstyp zur Diebstahlsicherung": "Kensington Slot",
        "Schnittstellen": "HDMI 1.4 (HDCP 1.4) \u00a6 DisplayPort 1.2 (HDCP 1.4) \u00a6 USB-B 3.2 Gen 1 Upstream \u00a6 USB 3.2 Gen 1 Downstream \u00a6 USB 3.2 Gen 1 Downstream (BC 1.2) \u00a6 Audio Line-Out",
        "Schwenkwinkel": "360",
        "Seitenverh\u00e4ltnis": "16:9",
        "Service und Support": "Norwegen: begrenzte Garantie - 3 Jahre \u00a6 D\u00e4nemark: begrenzte Garantie - 3 Jahre",
        "Stromverbrauch (Aus-Modus)": "0.3 Watt",
        "Stromverbrauch (typisch)": "19.6 Watt",
        "Stromverbrauch SDR (eingeschaltet)": "26 kWh/1.000 h",
        "Stromverbrauch im Standby-Modus": "0.3 Watt",
        "TCO-zertifiziert": "TCO Certified Edge Displays, TCO Certified Displays 9",
        "Transportbreite": "78 cm",
        "Transportgewicht": "8.2 kg",
        "Transporth\u00f6he": "44.5 cm",
        "Transporttiefe": "16.1 cm",
        "Typ": "Lautsprecher - Stereo",
        "VESA-Halterung": "100 x 100 mm",
        "Vertikale Bildwiederholrate": "48 - 75 Hz",
        "Vertikaler Betrachtungswinkel": "178",
        "Zul\u00e4ssige Luftfeuchtigkeit im Betrieb": "20 - 80% RH"
    },
    "raw_specifications_text": "Display-Typ: LED-hintergrundbeleuchteter LCD-Monitor / TFT-Aktivmatrix\nEnergie Effizienzklasse: Klasse F\nDiagonalabmessung: 68.5 cm (27\")\nIntegrierte Peripherieger\u00e4te: USB 3.2 Gen 1 Hub\nBildschirmtyp: VA\nSeitenverh\u00e4ltnis: 16:9\nNative Aufl\u00f6sung: QHD 2560 x 1440 bei 75 Hz\nPixelpitch: 0.2331 mm\nPpi: 108.79\nHelligkeit: 300 cd/m\u00b2\nKontrast: 4000:1 / 50000000:1 (dynamisch)\nFarbunterst\u00fctzung: 16,7 Millionen Farben (8-Bit)\nFarbraum: 119% sRGB (CIE 1931), 84% NTSC (CIE 1976)\nReaktionszeit: 4 ms (gray-to-gray)\nVertikale Bildwiederholrate: 48 - 75 Hz\nHorizontale Bildwiederholrate: 30 - 114 kHz\nHorizontaler Betrachtungswinkel: 178\nVertikaler Betrachtungswinkel: 178\nBildschirmbeschichtung: Blendfrei, 3H Hard Coating, Haze 25 %\nHintergrundbeleuchtungs-Technologie: WLED\nOSD-Sprachen: Ungarisch, Tschechisch, Chinesisch (tradionell), Chinesisch (vereinfacht), Ukrainisch, Brasilianisches Portugiesisch, Englisch, Deutsch, Franz\u00f6sisch, Italienisch, Portugiesisch, Polnisch, Finnisch, Schwedisch, Russisch, Spanisch, Holl\u00e4ndisch, Griechisch, T\u00fcrkisch, Japanisch, Koreanisch\nBesonderheiten: SmartImage, Smart ErgoBase, flimmerfreie Technologie, Adaptive-Sync-Technologie, EasyRead, an 3 Seiten ohne Blende, LowBlue Mode\nFarbe: Textured Black\nAbmessungen (Breite x Tiefe x H\u00f6he): 61.3 cm x 20.5 cm x 52.5 cm - mit Standfu\u00df (h\u00f6chste Position)\nGewicht: 5.6 kg\nTyp: Lautsprecher - Stereo\nAusgangsleistung/Kanal: 2 Watt\nSchnittstellen: HDMI 1.4 (HDCP 1.4) \u00a6 DisplayPort 1.2 (HDCP 1.4) \u00a6 USB-B 3.2 Gen 1 Upstream \u00a6 USB 3.2 Gen 1 Downstream \u00a6 USB 3.2 Gen 1 Downstream (BC 1.2) \u00a6 Audio Line-Out\nEinstellungen der Anzeigeposition: H\u00f6he, Pivot (Rotation), Drehung, Neigung\nNeigungswinkel: -5/25\nSchwenkwinkel: 360\nRotationswinkel: -90/+90\nH\u00f6heneinstellung: 130 mm\nVESA-Halterung: 100 x 100 mm\nLeistungsmerkmale: Slot f\u00fcr Sicherheitsschloss (Kabelschloss getrennt erh\u00e4ltlich)\nEnthaltene Kabel: HDMI-Kabel\nMTBF: 70,000 Stunde(n)\nKennzeichnung: Plug and Play, FCC Klasse B bescheinigt, TUV GS, ICES-003, CB, TUV Ergo, DDC/CI, BC1.2, CU-EAC, BFR-frei, PVC-free, quecksilberfrei, EAEU RoHS, TCO Certified Edge\nSchlosstyp zur Diebstahlsicherung: Kensington Slot\nEingangsspannung: Wechselstrom 100-240 V (50/60 Hz)\nStromverbrauch SDR (eingeschaltet): 26 kWh/1.000 h\nStromverbrauch (typisch): 19.6 Watt\nStromverbrauch im Standby-Modus: 0.3 Watt\nStromverbrauch (Aus-Modus): 0.3 Watt\nEin-/Aus-Schalter: Ja\nMitgelieferte Software: Philips SmartControl\nDetails zu Abmessungen & Gewicht: Mit Standfu\u00df (h\u00f6chste Position) - Breite: 61.3 cm - Tiefe: 20.5 cm - H\u00f6he: 52.5 cm - Gewicht: 5.6 kg \u00a6 Ohne Fu\u00df - Breite: 61.3 cm - Tiefe: 5.6 cm - H\u00f6he: 36.7 cm - Gewicht: 3.84 kg\nTransportbreite: 78 cm\nTransporttiefe: 16.1 cm\nTransporth\u00f6he: 44.5 cm\nTransportgewicht: 8.2 kg\nTCO-zertifiziert: TCO Certified Edge Displays, TCO Certified Displays 9\nENERGY STAR zertifiziert: Ja\nENERGY STAR-Version: 8.0\nService und Support: Norwegen: begrenzte Garantie - 3 Jahre \u00a6 D\u00e4nemark: begrenzte Garantie - 3 Jahre\nMin Betriebstemperatur: 0 \u00b0C\nMax. Betriebstemperatur: 40 \u00b0C\nZul\u00e4ssige Luftfeuchtigkeit im Betrieb: 20 - 80% RH",
    "reference_file": "offer_reference_150.json",
    "shop_name": "ElectronicShop24"
}