{
    "html_file": "offer_194_8.html",
    "name": "ASUS TUF Gaming VG328QA1A, 31.5\"",
    "offer_link": "https://www.alternate.at/ASUS/TUF-Gaming-VG328QA1A-Gaming-Monitor/html/product/100003638?partner=AtGeizhalsat&campaign=Monitor/ASUS/100003638",
    "price": 246.9,
    "raw_specifications": {
        "": "Ausgangsleistung",
        "Abmessungen": "Breite: 71,62 cm x H\u00f6he: 49,72 cm x Tiefe/L\u00e4nge: 21,38 cm",
        "Anschl\u00fcsse": "2x HDMI-Eingang, (HDMI-Version: 2.0), 1x DisplayPort-Eingang, (DisplayPort-Version: 1.2), 1x Kopfh\u00f6rer-Ausgang",
        "Bild": "Glaretyp",
        "Bildschirmaufl\u00f6sung": "1.920 x 1.080 Pixel",
        "Bildschirmdiagonale": "80 cm (31,5 Zoll)",
        "EAN": "4711081983767",
        "Energieeffizienzklasse (SDR)": "F (A - G)",
        "Energieverbauch pro 1000 Stunden (SDR)": "32 kWh",
        "Ergonomie": "Typ",
        "Farbe": "schwarz/silber",
        "Features": "Adaptive-Sync, AMD FreeSync, Kensington-Schloss",
        "Frequenz": "Vertikal",
        "Geeignet f\u00fcr": "Gaming",
        "Gewicht": "6,8 kg",
        "Hersteller-Nr.": "90LM08R0-B01E70",
        "Lautsprecher": "2 Lautsprecher",
        "Leistungsaufnahme im Bereitschafts- und Aus-Zustand": "0,5 Watt",
        "Serie": "TUF Gaming",
        "Standards": "Video",
        "Stromversorgung": "Netzteil",
        "Typ": "Gaming-Monitor",
        "Wandhalterung": "VESA kompatibel (100 x 100 mm)",
        "Weitere Informationen": "flimmerfreie LEDs, GamePlus, Extreme Low Moton Blur, Dark Boost, Shadow Boost, Low Blue Light | Ma\u00dfe ohne Standfu\u00df: 716,2 x 426,9 x 58 mm (BxHxT) | Gewicht ohne Standfu\u00df: 5900 Gramm | das Ger\u00e4t unterst\u00fctzt Full HD-Ausgabe mit 120 Hz auf PS5 & Xbox Serie X/S",
        "Zubeh\u00f6r": "Vorhanden"
    },
    "raw_specifications_text": "Energieeffizienzklasse (SDR): F (A - G)\nEnergieverbauch pro 1000 Stunden (SDR): 32 kWh\nLeistungsaufnahme im Bereitschafts- und Aus-Zustand: 0,5 Watt\nBildschirmdiagonale: 80 cm (31,5 Zoll)\nBildschirmaufl\u00f6sung: 1.920 x 1.080 Pixel\nTyp: Gaming-Monitor\nFarbe: schwarz/silber\nEAN: 4711081983767\nHersteller-Nr.: 90LM08R0-B01E70\nSerie: TUF Gaming\nGeeignet f\u00fcr: Gaming\nBild: Glaretyp\n: Ausgangsleistung\nFrequenz: Vertikal\nAnschl\u00fcsse: 2x HDMI-Eingang, (HDMI-Version: 2.0), 1x DisplayPort-Eingang, (DisplayPort-Version: 1.2), 1x Kopfh\u00f6rer-Ausgang\nErgonomie: Typ\nStromversorgung: Netzteil\nLautsprecher: 2 Lautsprecher\nStandards: Video\nWandhalterung: VESA kompatibel (100 x 100 mm)\nFeatures: Adaptive-Sync, AMD FreeSync, Kensington-Schloss\nWeitere Informationen: flimmerfreie LEDs, GamePlus, Extreme Low Moton Blur, Dark Boost, Shadow Boost, Low Blue Light | Ma\u00dfe ohne Standfu\u00df: 716,2 x 426,9 x 58 mm (BxHxT) | Gewicht ohne Standfu\u00df: 5900 Gramm | das Ger\u00e4t unterst\u00fctzt Full HD-Ausgabe mit 120 Hz auf PS5 & Xbox Serie X/S\nZubeh\u00f6r: Vorhanden\nAbmessungen: Breite: 71,62 cm x H\u00f6he: 49,72 cm x Tiefe/L\u00e4nge: 21,38 cm\nGewicht: 6,8 kg",
    "reference_file": "offer_reference_194.json",
    "shop_name": "Alternate.at"
}