{
    "html_file": "offer_520_5.html",
    "name": "ASRock Phantom Gaming PG27F15RS1A, 27\"",
    "offer_link": "https://www.taufnaus.de/product/10619173",
    "price": 243.91,
    "raw_specifications": {
        "Abmessungen (Breite x Tiefe x H\u00f6he)": "61.034 cm x 19.261 cm x 45.791 cm - mit Fu\u00df",
        "Ausgangsleistung/Kanal": "2 Watt",
        "Besonderheiten": "Flimmerfreie Technologie, Adaptive-Sync-Technologie, Low Blue Light-Technologie",
        "Bildschirmbeschichtung": "Blendfrei",
        "Bildschirmtyp": "VA",
        "Details zu Abmessungen & Gewicht": "Ohne Fu\u00df - Breite: 61.034 cm - Tiefe: 7.965 cm - H\u00f6he: 36.734 cm - Gewicht: 4.4 kg \u00a6 Mit Fu\u00df - Breite: 61.034 cm - Tiefe: 19.261 cm - H\u00f6he: 45.791 cm - Gewicht: 5.11 kg",
        "Diagonalabmessung": "68.6 cm (27\")",
        "Display-Typ": "LED-hintergrundbeleuchteter LCD-Monitor / TFT-Aktivmatrix",
        "Eingangsspannung": "Wechselstrom 100-240 V (50/60 Hz)",
        "Einstellungen der Anzeigeposition": "Drehung, Neigung",
        "Energie Effizienzklasse": "Klasse E",
        "Enthaltene Kabel": "1 x DisplayPort-Kabel \u00a6 1 x HDMI-Kabel",
        "Farbraum": "113% sRGB, 90% DCI-P3",
        "Farbunterst\u00fctzung": "16,7 Millionen Farben",
        "Gaming": "Ja",
        "Geschwungener Bildschirm": "Ja (1500R)",
        "Gewicht": "5.11 kg",
        "HDR-Format": "HDR10",
        "Helligkeit": "300 cd/m\u00b2",
        "Hintergrundbeleuchtungs-Technologie": "LED-Hintergrundbeleuchtung",
        "Horizontale Bildwiederholrate": "30 - 255 kHz",
        "Horizontaler Betrachtungswinkel": "178",
        "Kennzeichnung": "DisplayPort 1.2, HDMI 2.0",
        "Kontrast": "3000:1",
        "Max. Betriebstemperatur": "40 \u00b0C",
        "Min Betriebstemperatur": "0 \u00b0C",
        "Native Aufl\u00f6sung": "Full HD (1080p) 1920 x 1080 bei 240 Hz",
        "Neigungswinkel": "-5/+23",
        "Pixelpitch": "0.3114 mm",
        "Reaktionszeit": "1 ms (MPRT)",
        "Schnittstellen": "2 x HDMI \u00a6 DisplayPort \u00a6 Kopfh\u00f6reranschluss",
        "Schwenkwinkel": "40",
        "Seitenverh\u00e4ltnis": "16:9",
        "Stromverbrauch (Aus-Modus)": "0.3 Watt",
        "Stromverbrauch (max.)": "70 Watt",
        "Stromverbrauch (typisch)": "35 Watt",
        "Stromverbrauch SDR (eingeschaltet)": "21 kWh/1.000 h",
        "Stromverbrauch im Standby-Modus": "0.5 Watt",
        "Transportgewicht": "6.9 kg",
        "Typ": "Lautsprecher",
        "VESA-Halterung": "100 x 100 mm",
        "Vertikale Bildwiederholrate": "48 - 240 Hz",
        "Vertikaler Betrachtungswinkel": "178",
        "Zul\u00e4ssige Luftfeuchtigkeit im Betrieb": "10 \u2013 85% (nicht kondensierend)"
    },
    "raw_specifications_text": "Display-Typ: LED-hintergrundbeleuchteter LCD-Monitor / TFT-Aktivmatrix\nEnergie Effizienzklasse: Klasse E\nDiagonalabmessung: 68.6 cm (27\")\nGeschwungener Bildschirm: Ja (1500R)\nBildschirmtyp: VA\nSeitenverh\u00e4ltnis: 16:9\nNative Aufl\u00f6sung: Full HD (1080p) 1920 x 1080 bei 240 Hz\nPixelpitch: 0.3114 mm\nHelligkeit: 300 cd/m\u00b2\nKontrast: 3000:1\nHDR-Format: HDR10\nFarbunterst\u00fctzung: 16,7 Millionen Farben\nFarbraum: 113% sRGB, 90% DCI-P3\nReaktionszeit: 1 ms (MPRT)\nVertikale Bildwiederholrate: 48 - 240 Hz\nHorizontale Bildwiederholrate: 30 - 255 kHz\nGaming: Ja\nHorizontaler Betrachtungswinkel: 178\nVertikaler Betrachtungswinkel: 178\nBildschirmbeschichtung: Blendfrei\nHintergrundbeleuchtungs-Technologie: LED-Hintergrundbeleuchtung\nBesonderheiten: Flimmerfreie Technologie, Adaptive-Sync-Technologie, Low Blue Light-Technologie\nAbmessungen (Breite x Tiefe x H\u00f6he): 61.034 cm x 19.261 cm x 45.791 cm - mit Fu\u00df\nGewicht: 5.11 kg\nTyp: Lautsprecher\nAusgangsleistung/Kanal: 2 Watt\nSchnittstellen: 2 x HDMI \u00a6 DisplayPort \u00a6 Kopfh\u00f6reranschluss\nEinstellungen der Anzeigeposition: Drehung, Neigung\nNeigungswinkel: -5/+23\nSchwenkwinkel: 40\nVESA-Halterung: 100 x 100 mm\nEnthaltene Kabel: 1 x DisplayPort-Kabel \u00a6 1 x HDMI-Kabel\nKennzeichnung: DisplayPort 1.2, HDMI 2.0\nEingangsspannung: Wechselstrom 100-240 V (50/60 Hz)\nStromverbrauch SDR (eingeschaltet): 21 kWh/1.000 h\nStromverbrauch (typisch): 35 Watt\nStromverbrauch (max.): 70 Watt\nStromverbrauch im Standby-Modus: 0.5 Watt\nStromverbrauch (Aus-Modus): 0.3 Watt\nDetails zu Abmessungen & Gewicht: Ohne Fu\u00df - Breite: 61.034 cm - Tiefe: 7.965 cm - H\u00f6he: 36.734 cm - Gewicht: 4.4 kg \u00a6 Mit Fu\u00df - Breite: 61.034 cm - Tiefe: 19.261 cm - H\u00f6he: 45.791 cm - Gewicht: 5.11 kg\nTransportgewicht: 6.9 kg\nMin Betriebstemperatur: 0 \u00b0C\nMax. Betriebstemperatur: 40 \u00b0C\nZul\u00e4ssige Luftfeuchtigkeit im Betrieb: 10 \u2013 85% (nicht kondensierend)",
    "reference_file": "offer_reference_520.json",
    "shop_name": "TaufNaus"
}