{
    "html_file": "offer_397_30.html",
    "name": "Acer Vero CB1 CB271Ubmiprux, 27\"",
    "offer_link": "https://www.cyberport.at/?DEEP=6121-4MY&APID=294&STOREID=7",
    "price": 349.9,
    "raw_specifications": {
        "Aufl\u00f6sung": "2.560x1.440 WQHD",
        "Betrachtungswinkel h/v": "178\u00b0/178\u00b0",
        "Bildformat": "16:9",
        "Breite in mm": "514,3",
        "DVI": "kein",
        "Displaygr\u00f6\u00dfe in Zoll": "27 Zoll",
        "Displaygr\u00f6\u00dfe in cm": "68,6 cm",
        "Displayport": "1x DP",
        "Farbraumabdeckung": "99% sRGB",
        "Farbtiefe": "8 Bit / 16,7 Mio Farben",
        "Gewicht in kg": "8,1 kg",
        "HDMI": "1x HDMI",
        "Helligkeit": "350 cd/m\u00b2",
        "H\u00f6he in mm": "367",
        "H\u00f6henverstellbar": "150mm",
        "Jahresverbrauch": "21 kWh",
        "Jahresverbrauch HDR": "37 kWh",
        "Kontrast dynamisch": "100.000.000:1",
        "Kontrast typisch": "1.000:1",
        "Lautsprecher": "2x",
        "Leistung": "2W",
        "Oberfl\u00e4che": "entspiegelt",
        "Reaktionszeit": "5 ms",
        "Technologie": "IPS",
        "Tiefe in mm": "69,6",
        "USB-C": "1x",
        "Wandmontage": "VESA100x100"
    },
    "raw_specifications_text": "Jahresverbrauch: 21 kWh\nJahresverbrauch HDR: 37 kWh\nDisplaygr\u00f6\u00dfe in cm: 68,6 cm\nDisplaygr\u00f6\u00dfe in Zoll: 27 Zoll\nTechnologie: IPS\nAufl\u00f6sung: 2.560x1.440 WQHD\nBildformat: 16:9\nOberfl\u00e4che: entspiegelt\nFarbraumabdeckung: 99% sRGB\nFarbtiefe: 8 Bit / 16,7 Mio Farben\nHelligkeit: 350 cd/m\u00b2\nKontrast typisch: 1.000:1\nKontrast dynamisch: 100.000.000:1\nReaktionszeit: 5 ms\nBetrachtungswinkel h/v: 178\u00b0/178\u00b0\nHDMI: 1x HDMI\nDVI: kein\nDisplayport: 1x DP\nUSB-C: 1x\nLautsprecher: 2x\nLeistung: 2W\nH\u00f6henverstellbar: 150mm\nWandmontage: VESA100x100\nBreite in mm: 514,3\nH\u00f6he in mm: 367\nTiefe in mm: 69,6\nGewicht in kg: 8,1 kg",
    "reference_file": "offer_reference_397.json",
    "shop_name": "Cyberport Stores \u00d6sterreich"
}