{
    "html_file": "offer_2203_4.html",
    "name": "Acer Nitro VG0 VG270Ubmiipx, 27\"",
    "offer_link": "https://www.taufnaus.de/product/10610790",
    "price": 254.01,
    "raw_specifications": {
        "Abmessungen (Breite x Tiefe x H\u00f6he)": "61.4 cm x 24 cm x 47.5 cm - mit Fu\u00df",
        "Adaptive-Sync Technologie": "AMD FreeSync",
        "Ausgangsleistung/Kanal": "4 Watt",
        "Besonderheiten": "Acer Adaptive Contrast Management (ACM), Zero Frame",
        "Bildschirmbeschichtung": "Blendfrei",
        "Bildschirmtyp": "IPS",
        "Details zu Abmessungen & Gewicht": "Mit Fu\u00df - Breite: 61.4 cm - Tiefe: 24 cm - H\u00f6he: 47.5 cm - Gewicht: 5.83 kg \u00a6 Ohne Fu\u00df - Breite: 61.4 cm - Tiefe: 6.6 cm - H\u00f6he: 36.7 cm - Gewicht: 5.39 kg",
        "Diagonalabmessung": "68.6 cm (27\")",
        "Display-Typ": "LED-hintergrundbeleuchteter LCD-Monitor / TFT-Aktivmatrix",
        "ENERGY STAR zertifiziert": "Ja",
        "Eingangsspannung": "Wechselstrom 120/230 V (50/60 Hz)",
        "Einstellungen der Anzeigeposition": "Neigung",
        "Energie Effizienzklasse": "Klasse G",
        "Energieverbrauch pro Jahr": "63 kWh",
        "Enthaltene Kabel": "1 x DisplayPort-Kabel",
        "Farbe": "Schwarz",
        "Farbraum": "100% sRGB",
        "Farbunterst\u00fctzung": "1,77 Mrd. Farben",
        "Gewicht": "5.83 kg",
        "Helligkeit": "350 cd/m\u00b2",
        "Hintergrundbeleuchtungs-Technologie": "LED-Hintergrundbeleuchtung",
        "Horizontaler Betrachtungswinkel": "178",
        "Kennzeichnung": "MPR II",
        "Kontrast": "100000000:1",
        "Leistungsaufnahme im Ein-Zustand": "32.1 W",
        "Leistungsmerkmale": "Unterst\u00fctzung f\u00fcr VESA-Schnittstelle",
        "Native Aufl\u00f6sung": "WQHD 2560 x 1440 bei 75 Hz",
        "Neigungswinkel": "-5/+20",
        "Reaktionszeit": "1 ms (VRB)",
        "Schnittstellen": "2 x HDMI \u00a6 DisplayPort \u00a6 Audio Line-Out",
        "Seitenverh\u00e4ltnis": "16:9",
        "Stromverbrauch (Aus-Modus)": "0.42 Watt",
        "Stromverbrauch (typisch)": "26.02 Watt",
        "Stromverbrauch SDR (eingeschaltet)": "32.1 kWh/1.000 h",
        "Stromverbrauch im Standby-Modus": "0.52 Watt",
        "Typ": "Lautsprecher - Stereo",
        "Vertikaler Betrachtungswinkel": "178"
    },
    "raw_specifications_text": "Display-Typ: LED-hintergrundbeleuchteter LCD-Monitor / TFT-Aktivmatrix\nEnergie Effizienzklasse: Klasse G\nEnergieverbrauch pro Jahr: 63 kWh\nDiagonalabmessung: 68.6 cm (27\")\nAdaptive-Sync Technologie: AMD FreeSync\nBildschirmtyp: IPS\nSeitenverh\u00e4ltnis: 16:9\nNative Aufl\u00f6sung: WQHD 2560 x 1440 bei 75 Hz\nHelligkeit: 350 cd/m\u00b2\nKontrast: 100000000:1\nFarbunterst\u00fctzung: 1,77 Mrd. Farben\nFarbraum: 100% sRGB\nReaktionszeit: 1 ms (VRB)\nHorizontaler Betrachtungswinkel: 178\nVertikaler Betrachtungswinkel: 178\nBildschirmbeschichtung: Blendfrei\nHintergrundbeleuchtungs-Technologie: LED-Hintergrundbeleuchtung\nBesonderheiten: Acer Adaptive Contrast Management (ACM), Zero Frame\nFarbe: Schwarz\nAbmessungen (Breite x Tiefe x H\u00f6he): 61.4 cm x 24 cm x 47.5 cm - mit Fu\u00df\nGewicht: 5.83 kg\nTyp: Lautsprecher - Stereo\nAusgangsleistung/Kanal: 4 Watt\nSchnittstellen: 2 x HDMI \u00a6 DisplayPort \u00a6 Audio Line-Out\nEinstellungen der Anzeigeposition: Neigung\nNeigungswinkel: -5/+20\nLeistungsmerkmale: Unterst\u00fctzung f\u00fcr VESA-Schnittstelle\nEnthaltene Kabel: 1 x DisplayPort-Kabel\nKennzeichnung: MPR II\nEingangsspannung: Wechselstrom 120/230 V (50/60 Hz)\nLeistungsaufnahme im Ein-Zustand: 32.1 W\nStromverbrauch SDR (eingeschaltet): 32.1 kWh/1.000 h\nStromverbrauch (typisch): 26.02 Watt\nStromverbrauch im Standby-Modus: 0.52 Watt\nStromverbrauch (Aus-Modus): 0.42 Watt\nDetails zu Abmessungen & Gewicht: Mit Fu\u00df - Breite: 61.4 cm - Tiefe: 24 cm - H\u00f6he: 47.5 cm - Gewicht: 5.83 kg \u00a6 Ohne Fu\u00df - Breite: 61.4 cm - Tiefe: 6.6 cm - H\u00f6he: 36.7 cm - Gewicht: 5.39 kg\nENERGY STAR zertifiziert: Ja",
    "reference_file": "offer_reference_2203.json",
    "shop_name": "TaufNaus"
}