{
    "html_file": "offer_527_34.html",
    "name": "Dell E2724HS, 27\"",
    "offer_link": "https://www.alternate.at/Dell/E2724HS-LED-Monitor/html/product/1900714?partner=AtGeizhalsat&campaign=Monitor/Dell/1900714",
    "price": 193.9,
    "raw_specifications": {
        "": "Kensington-Schloss",
        "Abmessungen": "Breite: 61,214 cm x H\u00f6he: 40,64 cm x Tiefe/L\u00e4nge: 21,844 cm",
        "Anschl\u00fcsse": "1x HDMI-Eingang, (HDMI-Version: 1.4), 1x DisplayPort-Eingang, (DisplayPort-Version: 1.2), 1x VGA-Eingang",
        "Bild": "Glaretyp",
        "Bildschirmaufl\u00f6sung": "1.920 x 1.080 Pixel",
        "Bildschirmdiagonale": "69 cm (27 Zoll)",
        "EAN": "5397184657102",
        "Energieeffizienzklasse (SDR)": "D (A - G)",
        "Energieverbauch pro 1000 Stunden (SDR)": "17 kWh",
        "Ergonomie": "Typ",
        "Farbe": "schwarz",
        "Features": "Dell ComfortView",
        "Gewicht": "5,8 kg",
        "Hersteller-Nr.": "DELL-E2724HS",
        "Lautsprecher": "2 Lautsprecher",
        "Leistungsaufnahme im Bereitschafts- und Aus-Zustand": "0,3 Watt",
        "Leistungsaufnahme im Ein-Zustand bei Standard-Dynamikumfang (SDR)": "17 Watt",
        "Stromversorgung": "Eco-Off",
        "Typ": "LED-Monitor",
        "Wandhalterung": "VESA kompatibel (100 x 100 mm)",
        "Zubeh\u00f6r": "Vorhanden"
    },
    "raw_specifications_text": "Energieeffizienzklasse (SDR): D (A - G)\nEnergieverbauch pro 1000 Stunden (SDR): 17 kWh\nLeistungsaufnahme im Ein-Zustand bei Standard-Dynamikumfang (SDR): 17 Watt\nLeistungsaufnahme im Bereitschafts- und Aus-Zustand: 0,3 Watt\nBildschirmdiagonale: 69 cm (27 Zoll)\nBildschirmaufl\u00f6sung: 1.920 x 1.080 Pixel\nTyp: LED-Monitor\nFarbe: schwarz\nEAN: 5397184657102\nHersteller-Nr.: DELL-E2724HS\nBild: Glaretyp\n: Kensington-Schloss\nAnschl\u00fcsse: 1x HDMI-Eingang, (HDMI-Version: 1.4), 1x DisplayPort-Eingang, (DisplayPort-Version: 1.2), 1x VGA-Eingang\nErgonomie: Typ\nStromversorgung: Eco-Off\nLautsprecher: 2 Lautsprecher\nWandhalterung: VESA kompatibel (100 x 100 mm)\nFeatures: Dell ComfortView\nZubeh\u00f6r: Vorhanden\nAbmessungen: Breite: 61,214 cm x H\u00f6he: 40,64 cm x Tiefe/L\u00e4nge: 21,844 cm\nGewicht: 5,8 kg",
    "reference_file": "offer_reference_527.json",
    "shop_name": "Alternate.at"
}