{
    "html_file": "offer_229_10.html",
    "name": "Acer Nitro XV5 XV345CURVbmiphuzx, 34\"",
    "offer_link": "https://www.mylemon.at/artikel/acer/um_cx5ee_v01/nitro-xv345curvbmiphuzx-86-4cm-34.html",
    "price": 509.27,
    "raw_specifications": {
        "Anzahl DisplayPort Anschl\u00fcsse": "1",
        "Anzahl HDMI-Anschl\u00fcsse": "1",
        "Anzahl der Farben des Displays": "16,7 Millionen Farben",
        "Anzahl der Lautsprecher": "2",
        "Artikelnummer": "M1JYJVYL",
        "Aufl\u00f6sung": "3440x1440",
        "Besonderheiten": "165 Hz, Lautsprecher, USB HUB",
        "Bildschirmdiagonale": "86,4 cm (34\")",
        "Bildschirmtechnologie": "LED",
        "Bildwinkel, horizontal": "178\u00b0",
        "Bildwinkel, vertikal": "178\u00b0",
        "Breite (ohne Standfu\u00df)": "807 mm",
        "DVI Anschluss": "Nein",
        "Display-Aufl\u00f6sung": "3440 x 1440 Pixel",
        "DisplayPorts-Version": "1.4",
        "Displaygr\u00f6\u00dfe": "34 Zoll",
        "EAN": "4711121415388",
        "Eingebaute Lautsprecher": "Ja",
        "Eingebautes Mikrofon": "Nein",
        "Energieeffizienzklasse (HDR)": "G",
        "Energieeffizienzklasse (SDR)": "F",
        "Energieverbrauch (HDR) pro 1.000 Stunden": "49 kWh",
        "Energieverbrauch (SDR) pro 1.000 Stunden": "31 kWh",
        "Ergonomie": "H\u00f6henverstellbar, Schwenkbar, Neigbar",
        "Farbskala": "90%",
        "Ger\u00e4tebreite (inkl. Fu\u00df)": "807 mm",
        "Ger\u00e4teh\u00f6he (inkl. Fu\u00df)": "544 mm",
        "Ger\u00e4tetiefe (inkl. Fu\u00df)": "232 mm",
        "Gewicht (mit St\u00e4nder)": "7,96 kg",
        "Gewicht (ohne St\u00e4nder)": "6,36 kg",
        "Gew\u00e4hrleistungsfrist": "2 Jahr(e)",
        "HDMI": "Ja",
        "HDMI-Version": "2.0",
        "Helligkeit": "300 cd/m\u00b2",
        "Helligkeit (peak)": "300 cd/m\u00b2",
        "Hersteller Artikelnummer": "UM.CX5EE.V01",
        "H\u00f6he (ohne Standfu\u00df)": "364 mm",
        "H\u00f6heneinstellung": "11 cm",
        "H\u00f6henverstellung": "Ja",
        "Integrierte Kamera": "Nein",
        "Integrierter USB-Hub": "Ja",
        "Kabelsperre-Slot": "Ja",
        "Kontrastverh\u00e4ltnis": "4000:1",
        "Kontrastverh\u00e4ltnis (dynamisch)": "100000000:1",
        "Marktpositionierung": "Gaming",
        "Maximale Bildwiederholrate": "165 Hz",
        "Natives Seitenverh\u00e4ltnis": "21:9",
        "Paketgewicht": "10,7 kg",
        "Panel": "VA",
        "Panel-Montage-Schnittstelle": "100 x 100 mm",
        "Panel-Typ": "VA",
        "Produktfarbe": "Grau",
        "RGB-Farbraum": "sRGB",
        "RMS-Leistung": "6 W",
        "Reaktionszeit": "1 ms",
        "Slot-Typ Kabelsperre": "Kensington",
        "Stromverbrauch (Standardbetrieb)": "65 W",
        "Tiefe (ohne Standfu\u00df)": "125 mm",
        "Touchscreen": "Nein",
        "Typ Ladeanschluss": "USB Typ-C",
        "Typ der Hintergrundbeleuchtung": "LED",
        "USB-Hub-Version": "2.0",
        "VESA Halterung": "100x100 mm",
        "VESA-Halterung": "Ja",
        "Verpackungsart": "Box",
        "Verpackungsbreite": "907 mm",
        "Verpackungsh\u00f6he": "479 mm",
        "Verpackungstiefe": "238 mm",
        "Video Anschl\u00fcsse": "1x HDMI, 1x DisplayPort, USB-C DisplayPort"
    },
    "raw_specifications_text": "Displaygr\u00f6\u00dfe: 34 Zoll\nAufl\u00f6sung: 3440x1440\nPanel: VA\nReaktionszeit: 1 ms\nVideo Anschl\u00fcsse: 1x HDMI, 1x DisplayPort, USB-C DisplayPort\nErgonomie: H\u00f6henverstellbar, Schwenkbar, Neigbar\nVESA Halterung: 100x100 mm\nHelligkeit: 300 cd/m\u00b2\nBesonderheiten: 165 Hz, Lautsprecher, USB HUB\nHersteller Artikelnummer: UM.CX5EE.V01\nEAN: 4711121415388\nArtikelnummer: M1JYJVYL\nBildschirmdiagonale: 86,4 cm (34\")\nDisplay-Aufl\u00f6sung: 3440 x 1440 Pixel\nNatives Seitenverh\u00e4ltnis: 21:9\nBildschirmtechnologie: LED\nTouchscreen: Nein\nPanel-Typ: VA\nKontrastverh\u00e4ltnis: 4000:1\nMaximale Bildwiederholrate: 165 Hz\nAnzahl der Farben des Displays: 16,7 Millionen Farben\nTyp der Hintergrundbeleuchtung: LED\nHelligkeit (peak): 300 cd/m\u00b2\nKontrastverh\u00e4ltnis (dynamisch): 100000000:1\nBildwinkel, horizontal: 178\u00b0\nBildwinkel, vertikal: 178\u00b0\nRGB-Farbraum: sRGB\nFarbskala: 90%\nEingebaute Lautsprecher: Ja\nIntegrierte Kamera: Nein\nAnzahl der Lautsprecher: 2\nRMS-Leistung: 6 W\nEingebautes Mikrofon: Nein\nMarktpositionierung: Gaming\nProduktfarbe: Grau\nIntegrierter USB-Hub: Ja\nHDMI: Ja\nUSB-Hub-Version: 2.0\nDVI Anschluss: Nein\nAnzahl HDMI-Anschl\u00fcsse: 1\nHDMI-Version: 2.0\nAnzahl DisplayPort Anschl\u00fcsse: 1\nDisplayPorts-Version: 1.4\nTyp Ladeanschluss: USB Typ-C\nVESA-Halterung: Ja\nKabelsperre-Slot: Ja\nH\u00f6henverstellung: Ja\nPanel-Montage-Schnittstelle: 100 x 100 mm\nSlot-Typ Kabelsperre: Kensington\nH\u00f6heneinstellung: 11 cm\nEnergieeffizienzklasse (SDR): F\nEnergieeffizienzklasse (HDR): G\nEnergieverbrauch (SDR) pro 1.000 Stunden: 31 kWh\nEnergieverbrauch (HDR) pro 1.000 Stunden: 49 kWh\nStromverbrauch (Standardbetrieb): 65 W\nGer\u00e4tebreite (inkl. Fu\u00df): 807 mm\nGer\u00e4tetiefe (inkl. Fu\u00df): 232 mm\nGer\u00e4teh\u00f6he (inkl. Fu\u00df): 544 mm\nGewicht (mit St\u00e4nder): 7,96 kg\nBreite (ohne Standfu\u00df): 807 mm\nTiefe (ohne Standfu\u00df): 125 mm\nH\u00f6he (ohne Standfu\u00df): 364 mm\nGewicht (ohne St\u00e4nder): 6,36 kg\nVerpackungsbreite: 907 mm\nVerpackungstiefe: 238 mm\nVerpackungsh\u00f6he: 479 mm\nPaketgewicht: 10,7 kg\nVerpackungsart: Box\nGew\u00e4hrleistungsfrist: 2 Jahr(e)",
    "reference_file": "offer_reference_229.json",
    "shop_name": "mylemon.at"
}