{
    "html_file": "offer_412_13.html",
    "name": "Philips 3000 Series 16B1P3302D, 15.6\"",
    "offer_link": "https://www.ditech.at/details.php?artnr=367327",
    "price": 261.9,
    "raw_specifications": {
        "Abmessungen - Breite": "359mm",
        "Abmessungen - H\u00f6he": "232mm",
        "Abmessungen - Tiefe": "119 (mit standfu\u00df),  keine angabe (ohne standfu\u00df)mm",
        "Anschl\u00fcsse - USB-C mit DisplayPort PD 65W": "1",
        "Anschl\u00fcsse - USB-C mit DisplayPort PD 65W, Netzanschluss": "1",
        "Anwendung": "portabel (Klappmechanismus),  inkl. Schutzh\u00fclle",
        "Audio": "1x Line-Out",
        "Aufl\u00f6sung": "1920x1080",
        "Beschichtung": "matt (non-glare),  H\u00e4rtegrad 3H",
        "Besonderheiten": "mechanische Tasten,  Sicherheitsschloss (Kensington),  automatische Bildrotation,  HDCP 2.2,  USB-C Power Delivery (65W),  Philips SmartImage",
        "Bildwiederholfrequenz": "75Hz",
        "Blickwinkel": "178\u00b0/178\u00b0",
        "Diagonale": "15.6\"/39.6cm",
        "Energieverbrauch SDR": "8kWh/1000h",
        "Ergonomie": "N/A (h\u00f6henverstellbar),  \u00b190\u00b0 (Pivot),  N/A (drehbar),  +90\u00b0/-0\u00b0 (neigbar),  keine Angabe (Schr\u00e4glage)",
        "FRC": "ja (6bit+2bit)",
        "Farbe": "schwarz",
        "Farbraum - sRGB": "64%",
        "Farbtiefe": "8bit (16.7 Mio. Farben)",
        "Form": "gerade (flat)",
        "Gewicht": "1.03kg (mit Standfu\u00df),  keine Angabe (ohne Standfu\u00df)",
        "HDR": "N/A",
        "Helligkeit": "250cd/m\u00b2 (typisch)",
        "Herstellergarantie": "zwei Jahre (Pickup&Return)",
        "Hintergrundbeleuchtung": "White-LED,  flicker-free,  Blaulichtfilter",
        "Kontrast - dynamisch": "50.000.000:1",
        "Kontrast - statisch": "700:1",
        "Leistungsaufnahme": "keine Angabe (maximal),  6W (typisch),  keine Angabe (Energielabel alt A+++ bis G),  0.1W (Standby)",
        "Panel": "IPS",
        "Reaktionszeit - GtG": "4ms",
        "Screen-to-Body-Ratio": "keine Angabe (berechnet)",
        "Seitenverh\u00e4ltnis": "16:9",
        "Signalfrequenz": "30-140kHz (horizontal),  48-75Hz (vertikal)",
        "Stromversorgung": "USB-C (90W)",
        "USB-Hub In": "N/A",
        "USB-Hub Out": "N/A",
        "USB-Schreibweise": "Link",
        "Unsch\u00e4rfereduktionsfunktion": "N/A",
        "VESA": "100x100 (belegt)",
        "Weitere Anschl\u00fcsse": "N/A"
    },
    "raw_specifications_text": "Abmessungen - Breite: 359mm\nAbmessungen - H\u00f6he: 232mm\nAbmessungen - Tiefe: 119 (mit standfu\u00df),  keine angabe (ohne standfu\u00df)mm\nAnschl\u00fcsse - USB-C mit DisplayPort PD 65W: 1\nAnschl\u00fcsse - USB-C mit DisplayPort PD 65W, Netzanschluss: 1\nAnwendung: portabel (Klappmechanismus),  inkl. Schutzh\u00fclle\nAudio: 1x Line-Out\nAufl\u00f6sung: 1920x1080\nBeschichtung: matt (non-glare),  H\u00e4rtegrad 3H\nBesonderheiten: mechanische Tasten,  Sicherheitsschloss (Kensington),  automatische Bildrotation,  HDCP 2.2,  USB-C Power Delivery (65W),  Philips SmartImage\nBildwiederholfrequenz: 75Hz\nBlickwinkel: 178\u00b0/178\u00b0\nDiagonale: 15.6\"/39.6cm\nEnergieverbrauch SDR: 8kWh/1000h\nErgonomie: N/A (h\u00f6henverstellbar),  \u00b190\u00b0 (Pivot),  N/A (drehbar),  +90\u00b0/-0\u00b0 (neigbar),  keine Angabe (Schr\u00e4glage)\nFarbe: schwarz\nFarbraum - sRGB: 64%\nFarbtiefe: 8bit (16.7 Mio. Farben)\nForm: gerade (flat)\nFRC: ja (6bit+2bit)\nGewicht: 1.03kg (mit Standfu\u00df),  keine Angabe (ohne Standfu\u00df)\nHDR: N/A\nHelligkeit: 250cd/m\u00b2 (typisch)\nHerstellergarantie: zwei Jahre (Pickup&Return)\nHintergrundbeleuchtung: White-LED,  flicker-free,  Blaulichtfilter\nKontrast - dynamisch: 50.000.000:1\nKontrast - statisch: 700:1\nLeistungsaufnahme: keine Angabe (maximal),  6W (typisch),  keine Angabe (Energielabel alt A+++ bis G),  0.1W (Standby)\nPanel: IPS\nReaktionszeit - GtG: 4ms\nScreen-to-Body-Ratio: keine Angabe (berechnet)\nSeitenverh\u00e4ltnis: 16:9\nSignalfrequenz: 30-140kHz (horizontal),  48-75Hz (vertikal)\nStromversorgung: USB-C (90W)\nUnsch\u00e4rfereduktionsfunktion: N/A\nUSB-Hub In: N/A\nUSB-Hub Out: N/A\nUSB-Schreibweise: Link\nVESA: 100x100 (belegt)\nWeitere Anschl\u00fcsse: N/A",
    "reference_file": "offer_reference_412.json",
    "shop_name": "DiTech.at"
}