{
    "html_file": "offer_1747_10.html",
    "name": "BenQ Zowie XL2411K, 24\"",
    "offer_link": "https://www.mylemon.at/artikel/benq/9h_ljplb_qbe/xl2411k-60-96cm-24in-tn.html",
    "price": 231.98,
    "raw_specifications": {
        "AC Eingangsspannung": "100 - 240 V",
        "Anzahl DisplayPort Anschl\u00fcsse": "1",
        "Anzahl HDMI-Anschl\u00fcsse": "3",
        "Artikelnummer": "M14Y4XKL",
        "Audioanschl\u00fcsse": "Nein",
        "Aufl\u00f6sung": "1920x1080",
        "Besonderheiten": "144 Hz",
        "Bildschirmdiagonale": "61 cm (24 Zoll)",
        "Bildschirmform": "Flach",
        "DVI Anschluss": "Nein",
        "Display-Aufl\u00f6sung": "1920 x 1080 Pixel",
        "DisplayPorts-Version": "1.2",
        "Displaygr\u00f6\u00dfe": "24 Zoll",
        "EAN": "4718755083402",
        "Eingebaute Lautsprecher": "Nein",
        "Energieeffizienzklasse (SDR)": "F",
        "Energieeffizienzskala": "A bis G",
        "Energieverbrauch (SDR) pro 1.000 Stunden": "22 kWh",
        "Ergonomie": "H\u00f6henverstellbar, Pivot (90 Grad drehbar), Schwenkbar, Neigbar",
        "Flimmerfreie Technologie": "Ja",
        "Fu\u00dffarbe": "Schwarz/Rot",
        "Ger\u00e4tebreite (inkl. Fu\u00df)": "571 mm",
        "Ger\u00e4teh\u00f6he (inkl. Fu\u00df)": "525 mm",
        "Ger\u00e4tetiefe (inkl. Fu\u00df)": "200 mm",
        "Gewicht (mit St\u00e4nder)": "5,9 kg",
        "HD-Typ": "Full HD",
        "HDMI": "Ja",
        "HDMI-Version": "1.4/2.0",
        "Helligkeit": "350 cd/m\u00b2",
        "Helligkeit (typisch)": "320 cd/m\u00b2",
        "Hersteller Artikelnummer": "9H.LJPLB.QBE",
        "H\u00f6heneinstellung": "15,5 cm",
        "H\u00f6henverstellung": "Ja",
        "Integrierte Kamera": "Nein",
        "Integrierter USB-Hub": "Nein",
        "Kabelsperre-Slot": "Ja",
        "Kontrastverh\u00e4ltnis": "1000:1",
        "Kopfh\u00f6rerausgang": "Ja",
        "Kopfh\u00f6rerausg\u00e4nge": "1",
        "Low-Blue-Light-Technologie": "Ja",
        "Marktpositionierung": "Gaming",
        "Maximale Bildwiederholrate": "144 Hz",
        "Natives Seitenverh\u00e4ltnis": "16:9",
        "Neigungsverstellung": "Ja",
        "Neigungswinkelbereich": "-5 - 23\u00b0",
        "Paketgewicht": "8,5 kg",
        "Panel": "TN",
        "Panel-Montage-Schnittstelle": "100 x 100 mm",
        "Panel-Typ": "TN",
        "Produktfarbe": "Schwarz",
        "Reaktionszeit": "1 ms",
        "Reaktionszeit (schnell)": "1 ms",
        "Schwenkbar": "Ja",
        "Schwenkwinkelbereich": "45 - 45\u00b0",
        "Seitenverh\u00e4ltnis": "16:9",
        "Sichtbare Gr\u00f6\u00dfe (horizontal)": "53,1 cm",
        "Sichtbare Gr\u00f6\u00dfe (vertikal)": "29,9 cm",
        "Slot-Typ Kabelsperre": "Kensington",
        "Stromeingang": "Ja",
        "Stromverbrauch (Standardbetrieb)": "45 W",
        "Touchscreen": "Nein",
        "Unterst\u00fctzte Grafik-Aufl\u00f6sungen": "1920 x 1080 (HD 1080)",
        "Ursprungsland": "China",
        "VESA Halterung": "100x100 mm",
        "VESA-Halterung": "Ja",
        "Video Anschl\u00fcsse": "2x HDMI, 1x DisplayPort",
        "Vorderer Rahmen": "Schwarz",
        "Warentarifnummer (HS)": "85285210"
    },
    "raw_specifications_text": "Displaygr\u00f6\u00dfe: 24 Zoll\nAufl\u00f6sung: 1920x1080\nPanel: TN\nReaktionszeit: 1 ms\nVideo Anschl\u00fcsse: 2x HDMI, 1x DisplayPort\nErgonomie: H\u00f6henverstellbar, Pivot (90 Grad drehbar), Schwenkbar, Neigbar\nVESA Halterung: 100x100 mm\nHelligkeit: 350 cd/m\u00b2\nBesonderheiten: 144 Hz\nHersteller Artikelnummer: 9H.LJPLB.QBE\nEAN: 4718755083402\nArtikelnummer: M14Y4XKL\nBildschirmdiagonale: 61 cm (24 Zoll)\nDisplay-Aufl\u00f6sung: 1920 x 1080 Pixel\nNatives Seitenverh\u00e4ltnis: 16:9\nTouchscreen: Nein\nHD-Typ: Full HD\nPanel-Typ: TN\nBildschirmform: Flach\nKontrastverh\u00e4ltnis: 1000:1\nMaximale Bildwiederholrate: 144 Hz\nHelligkeit (typisch): 320 cd/m\u00b2\nUnterst\u00fctzte Grafik-Aufl\u00f6sungen: 1920 x 1080 (HD 1080)\nSeitenverh\u00e4ltnis: 16:9\nReaktionszeit (schnell): 1 ms\nSichtbare Gr\u00f6\u00dfe (horizontal): 53,1 cm\nSichtbare Gr\u00f6\u00dfe (vertikal): 29,9 cm\nFlimmerfreie Technologie: Ja\nLow-Blue-Light-Technologie: Ja\nEingebaute Lautsprecher: Nein\nIntegrierte Kamera: Nein\nMarktpositionierung: Gaming\nProduktfarbe: Schwarz\nVorderer Rahmen: Schwarz\nFu\u00dffarbe: Schwarz/Rot\nUrsprungsland: China\nIntegrierter USB-Hub: Nein\nHDMI: Ja\nKopfh\u00f6rerausgang: Ja\nDVI Anschluss: Nein\nAnzahl HDMI-Anschl\u00fcsse: 3\nHDMI-Version: 1.4/2.0\nAnzahl DisplayPort Anschl\u00fcsse: 1\nDisplayPorts-Version: 1.2\nAudioanschl\u00fcsse: Nein\nKopfh\u00f6rerausg\u00e4nge: 1\nStromeingang: Ja\nVESA-Halterung: Ja\nKabelsperre-Slot: Ja\nH\u00f6henverstellung: Ja\nPanel-Montage-Schnittstelle: 100 x 100 mm\nSlot-Typ Kabelsperre: Kensington\nH\u00f6heneinstellung: 15,5 cm\nSchwenkbar: Ja\nSchwenkwinkelbereich: 45 - 45\u00b0\nNeigungswinkelbereich: -5 - 23\u00b0\nNeigungsverstellung: Ja\nEnergieeffizienzklasse (SDR): F\nEnergieverbrauch (SDR) pro 1.000 Stunden: 22 kWh\nStromverbrauch (Standardbetrieb): 45 W\nAC Eingangsspannung: 100 - 240 V\nEnergieeffizienzskala: A bis G\nGer\u00e4tebreite (inkl. Fu\u00df): 571 mm\nGer\u00e4tetiefe (inkl. Fu\u00df): 200 mm\nGer\u00e4teh\u00f6he (inkl. Fu\u00df): 525 mm\nGewicht (mit St\u00e4nder): 5,9 kg\nPaketgewicht: 8,5 kg\nWarentarifnummer (HS): 85285210",
    "reference_file": "offer_reference_1747.json",
    "shop_name": "mylemon.at"
}