{
    "html_file": "offer_212_7.html",
    "name": "Samsung ViewFinity S8 S32B800PXP (2023), 32\"",
    "offer_link": "https://www.playox.de/productredirect/index/sku/26076092?sPartner=p-geizhals-at&campaign=psm/geizhals-at/",
    "price": 598.6,
    "raw_specifications": {
        "Anschl\u00fcsse": "USB, DisplayPort, HDMI, Kopfh\u00f6reranschluss, Audioausgang (Line-Out)",
        "Bildwiederholungsrate": "60,00 Hz",
        "Display Features": "FlickerFree, Bild an Bild (PbP) Funktion, Bild in Bild (PiP) Funktion",
        "Displaygr\u00f6\u00dfe": "81,28 cm (32 Zoll)",
        "Displayoberfl\u00e4che": "matt",
        "Einsatzort": "Innen",
        "Energieeffizienzklasse": "G",
        "Filtergruppennummer": "Monitore",
        "Geh\u00e4usefarbe des Ger\u00e4tes": "Schwarz",
        "Gewicht": "7,50 kg",
        "Helligkeit Bereich": "300 - 450 cd/m\u00b2",
        "Kontrastverh\u00e4ltnis (typisch) Bereich": "800:1 bis 1.200:1",
        "LCD-Technologie": "IPS Panel",
        "Reaktionszeit": "5,00 ms",
        "Seitenverh\u00e4ltnis": "16:9",
        "Verbindungen": "Netzwerk (LAN)",
        "max. Aufl\u00f6sung": "3.840 x 2.160 Pixel (16:9)"
    },
    "raw_specifications_text": "Geh\u00e4usefarbe des Ger\u00e4tes: Schwarz\nAnschl\u00fcsse: USB, DisplayPort, HDMI, Kopfh\u00f6reranschluss, Audioausgang (Line-Out)\nDisplay Features: FlickerFree, Bild an Bild (PbP) Funktion, Bild in Bild (PiP) Funktion\nKontrastverh\u00e4ltnis (typisch) Bereich: 800:1 bis 1.200:1\nHelligkeit Bereich: 300 - 450 cd/m\u00b2\nDisplaygr\u00f6\u00dfe: 81,28 cm (32 Zoll)\nGewicht: 7,50 kg\nVerbindungen: Netzwerk (LAN)\nFiltergruppennummer: Monitore\nmax. Aufl\u00f6sung: 3.840 x 2.160 Pixel (16:9)\nSeitenverh\u00e4ltnis: 16:9\nLCD-Technologie: IPS Panel\nReaktionszeit: 5,00 ms\nDisplayoberfl\u00e4che: matt\nBildwiederholungsrate: 60,00 Hz\nEinsatzort: Innen\nEnergieeffizienzklasse: G",
    "reference_file": "offer_reference_212.json",
    "shop_name": "playox (AT)"
}