{
    "html_file": "offer_1155_0.html",
    "name": "Wortmann Terra LED 2448W Greenline Plus, 23.8\"",
    "offer_link": "https://www.ba-computer.at/terra-lcd-led-2448w-v3-schwarz-hdmi-dp-usb-c-greenline-plus-flachbildschirm-tft-lcd-60-5-cm-3030225.html",
    "price": 139.6,
    "raw_specifications": {
        "AC Eingangsfrequenz": "50/60 Hz",
        "AC Eingangsspannung": "100 - 240 V",
        "Abnehmbarer Standfu\u00df": "Ja",
        "Anzahl DisplayPort Anschl\u00fcsse": "1",
        "Anzahl HDMI-Anschl\u00fcsse": "1",
        "Anzahl der Farben des Displays": "16,7 Millionen Farben",
        "Audioausgang": "Ja",
        "Bildschirmdiagonale": "60,5 cm",
        "Bildschirmdiagonale (cm)": "60,5 cm",
        "Bildschirmform": "Flach",
        "Bildschirmtechnologie": "LCD",
        "Bildwinkel, horizontal": "178 \u00b0",
        "Bildwinkel, vertikal": "178 \u00b0",
        "Blendfreier Bildschirm": "Ja",
        "Breite (ohne Standfu\u00df)": "540 mm",
        "DDC/CI": "Ja",
        "Display-Aufl\u00f6sung": "1920 x 1080 Pixel",
        "DisplayPorts-Version": "1.2",
        "Eingebaute Lautsprecher": "Nein",
        "Energieeffizienzklasse (HDR)": "E",
        "Energieeffizienzskala": "A bis G",
        "Energieverbrauch (HDR) pro 1.000 Stunden": "15 kWh",
        "Fu\u00dffarbe": "Schwarz",
        "Ger\u00e4tebreite (inkl. Fu\u00df)": "540 mm",
        "Ger\u00e4teh\u00f6he (inkl. Fu\u00df)": "394 mm",
        "Ger\u00e4tetiefe (inkl. Fu\u00df)": "210 mm",
        "Gewicht (mit St\u00e4nder)": "3,5 kg",
        "Gewicht (ohne St\u00e4nder)": "3,1 kg",
        "Gleichstrom-Anschluss (DC)": "Ja",
        "HD-Typ": "Full HD",
        "HDCP": "Ja",
        "HDMI": "Ja",
        "Helligkeit (typisch)": "250 cd/m\u00b2",
        "H\u00f6he (ohne Standfu\u00df)": "325 mm",
        "H\u00f6henverstellung": "Nein",
        "Integrierte Kamera": "Nein",
        "Integrierter USB-Hub": "Nein",
        "Kabelsperre-Slot": "Ja",
        "Kopfh\u00f6rerausgang": "Ja",
        "Kopfh\u00f6rerausg\u00e4nge": "1",
        "Low-Blue-Light-Technologie": "Ja",
        "Marktpositionierung": "Business",
        "Maximale Bildwiederholrate": "100 Hz",
        "Mitgelieferte Kabel": "Leistung",
        "Nachhaltigkeitskonformit\u00e4t": "Ja",
        "Nachhaltigkeitszertifikate": "CE",
        "Natives Seitenverh\u00e4ltnis": "16:9",
        "Neigungsverstellung": "Ja",
        "Neigungswinkelbereich": "5 - 20 \u00b0",
        "Netzteiltyp": "Extern",
        "PC Audio-Eingang": "Nein",
        "Panel-Montage-Schnittstelle": "100 x 100 mm",
        "Panel-Typ": "IPS",
        "Pixel Abstand": "0,275 x 0,275 mm",
        "Rahmenloses Design": "Ja",
        "Reaktionszeit": "5 ms",
        "Slot-Typ Kabelsperre": "Kensington",
        "Stromadapter enthalten": "Ja",
        "Stromverbrauch (Standardbetrieb)": "15 W",
        "Stromverbrauch (Standby)": "0,5 W",
        "Stromverbrauch (aus)": "0,3 W",
        "St\u00e4nder enthalten": "Ja",
        "Tiefe (ohne Standfu\u00df)": "39 mm",
        "Touchscreen": "Nein",
        "Typ Ladeanschluss": "DC-Anschluss",
        "Typ der Hintergrundbeleuchtung": "LED",
        "USB-Typ-C DisplayPort-Wechselmodus": "Ja",
        "Ursprungsland": "Deutschland",
        "VESA-Halterung": "Ja",
        "Vorderer Rahmen": "Schwarz"
    },
    "raw_specifications_text": "Bildschirmdiagonale: 60,5 cm\nDisplay-Aufl\u00f6sung: 1920 x 1080 Pixel\nNatives Seitenverh\u00e4ltnis: 16:9\nBildschirmtechnologie: LCD\nTouchscreen: Nein\nHD-Typ: Full HD\nPanel-Typ: IPS\nTyp der Hintergrundbeleuchtung: LED\nHelligkeit (typisch): 250 cd/m\u00b2\nReaktionszeit: 5 ms\nBlendfreier Bildschirm: Ja\nBildschirmform: Flach\nMaximale Bildwiederholrate: 100 Hz\nBildwinkel, horizontal: 178 \u00b0\nBildwinkel, vertikal: 178 \u00b0\nAnzahl der Farben des Displays: 16,7 Millionen Farben\nPixel Abstand: 0,275 x 0,275 mm\nBildschirmdiagonale (cm): 60,5 cm\nDDC/CI: Ja\nIntegrierter USB-Hub: Nein\nUSB-Typ-C DisplayPort-Wechselmodus: Ja\nHDMI: Ja\nAnzahl HDMI-Anschl\u00fcsse: 1\nAnzahl DisplayPort Anschl\u00fcsse: 1\nDisplayPorts-Version: 1.2\nAudioausgang: Ja\nKopfh\u00f6rerausgang: Ja\nKopfh\u00f6rerausg\u00e4nge: 1\nPC Audio-Eingang: Nein\nHDCP: Ja\nTyp Ladeanschluss: DC-Anschluss\nGleichstrom-Anschluss (DC): Ja\nMarktpositionierung: Business\nRahmenloses Design: Ja\nVorderer Rahmen: Schwarz\nAbnehmbarer Standfu\u00df: Ja\nFu\u00dffarbe: Schwarz\nUrsprungsland: Deutschland\nEingebaute Lautsprecher: Nein\nIntegrierte Kamera: Nein\nVESA-Halterung: Ja\nPanel-Montage-Schnittstelle: 100 x 100 mm\nKabelsperre-Slot: Ja\nSlot-Typ Kabelsperre: Kensington\nH\u00f6henverstellung: Nein\nNeigungswinkelbereich: 5 - 20 \u00b0\nNeigungsverstellung: Ja\nLow-Blue-Light-Technologie: Ja\nSt\u00e4nder enthalten: Ja\nMitgelieferte Kabel: Leistung\nStromadapter enthalten: Ja\nGer\u00e4tebreite (inkl. Fu\u00df): 540 mm\nGer\u00e4tetiefe (inkl. Fu\u00df): 210 mm\nGer\u00e4teh\u00f6he (inkl. Fu\u00df): 394 mm\nGewicht (mit St\u00e4nder): 3,5 kg\nBreite (ohne Standfu\u00df): 540 mm\nTiefe (ohne Standfu\u00df): 39 mm\nH\u00f6he (ohne Standfu\u00df): 325 mm\nGewicht (ohne St\u00e4nder): 3,1 kg\nEnergieeffizienzklasse (HDR): E\nEnergieverbrauch (HDR) pro 1.000 Stunden: 15 kWh\nStromverbrauch (Standardbetrieb): 15 W\nStromverbrauch (Standby): 0,5 W\nStromverbrauch (aus): 0,3 W\nAC Eingangsspannung: 100 - 240 V\nAC Eingangsfrequenz: 50/60 Hz\nNetzteiltyp: Extern\nEnergieeffizienzskala: A bis G\nNachhaltigkeitskonformit\u00e4t: Ja\nNachhaltigkeitszertifikate: CE",
    "reference_file": "offer_reference_1155.json",
    "shop_name": "BA-Computer"
}