{
    "html_file": "offer_1585_24.html",
    "name": "Acer Business B8 B248Ybemiqprcuzx, 23.8\"",
    "offer_link": "https://www.electronicshop24.at/product_info.php?products_id=50000000560247809&ano=A560247809&mno=UM.QB8EE.001&ean=4710886259077&utm_medium=cpc&utm_campaign=preisvergleich&utm_content=item&utm_source=geizhals&ref=geizhals",
    "price": 202.0,
    "raw_specifications": {
        "Abmessungen (Breite x Tiefe x H\u00f6he)": "54 cm x 19.3 cm x 39.8 cm - mit Fu\u00df",
        "Ausgangsleistung/Kanal": "2 Watt",
        "Besonderheiten": "Acer Adaptive Contrast Management (ACM), Adaptive-Sync-Technologie, Acer VisionCare, an 3 Seiten ohne Blende, Delta E<1 Kalibrierung, Eyesafe-Technologie",
        "Bildschirmbeschichtung": "Blendfrei",
        "Bildschirmtyp": "IPS",
        "Details zu Abmessungen & Gewicht": "Mit Fu\u00df - Breite: 54 cm - Tiefe: 19.3 cm - H\u00f6he: 39.8 cm - Gewicht: 6.04 kg \u00a6 Ohne Fu\u00df - Breite: 54 cm - Tiefe: 6.5 cm - H\u00f6he: 32.3 cm - Gewicht: 3.64 kg",
        "Diagonalabmessung": "60.5 cm (23.8\")",
        "Display-Typ": "LED-hintergrundbeleuchteter LCD-Monitor / TFT-Aktivmatrix",
        "ENERGY STAR zertifiziert": "Ja",
        "EPEAT-kompatibel": "EPEAT Bronze",
        "Eingangsspannung": "Wechselstrom 120/230 V (50/60 Hz)",
        "Einstellungen der Anzeigeposition": "H\u00f6he, Pivot (Rotation), Drehung, Neigung",
        "Energie Effizienzklasse": "Klasse E",
        "Energieklasse (HDR)": "Klasse F",
        "Energierverbrauch Sleep": "0.5 Watt",
        "Enthaltene Kabel": "1 x HDMI-Kabel \u00a6 1 x USB-C Kabel \u00a6 1 x SuperSpeed-USB-Kabel",
        "Farbe": "Schwarz",
        "Farbunterst\u00fctzung": "16,7 Millionen Farben",
        "Gewicht": "6.04 kg",
        "HDR-Format": "HDR10",
        "Helligkeit": "250 cd/m\u00b2",
        "Hintergrundbeleuchtungs-Technologie": "LED-Hintergrundbeleuchtung",
        "Horizontaler Betrachtungswinkel": "178",
        "H\u00f6heneinstellung": "120 mm",
        "Integrierte Peripherieger\u00e4te": "Mikrofon, USB 3.0-Hub, FHD-Kamera, USB-C-Docking-Station",
        "Kennzeichnung": "DisplayPort 1.4, TUV Eyesafe Display Certification",
        "Kontrast": "1000:1 / 100000000:1 (dynamisch)",
        "Leistungsaufnahme im Ein-Zustand": "17 W",
        "Leistungsmerkmale": "Slot f\u00fcr Sicherheitsschloss (Kabelschloss getrennt erh\u00e4ltlich), Unterst\u00fctzung f\u00fcr VESA-Schnittstelle",
        "Mitgelieferte Software": "Acer Smart Console",
        "Native Aufl\u00f6sung": "Full HD (1080p) 1920 x 1080 bei 75 Hz",
        "Neigungswinkel": "-5/+35",
        "Reaktionszeit": "4 ms",
        "Rotationswinkel": "180",
        "Schlosstyp zur Diebstahlsicherung": "Kensington Slot",
        "Schnittstellen": "HDMI \u00a6 DisplayPort 1.4 \u00a6 DisplayPort-Ausgang \u00a6 USB-C (bis zu 100 W) \u00a6 Netzwerk (RJ-45) \u00a6 Audio Line-Out \u00a6 USB 3.0 Upstream (Typ B) \u00a6 4 x USB 3.0 Downstream",
        "Schwenkwinkel": "120",
        "Seitenverh\u00e4ltnis": "16:9",
        "Stromverbrauch (Aus-Modus)": "0.45 Watt",
        "Stromverbrauch (typisch)": "16 Watt",
        "Stromverbrauch HDR (eingeschaltet)": "20 kWh/1.000 h",
        "Stromverbrauch SDR (eingeschaltet)": "17 kWh/1.000 h",
        "TCO-zertifiziert": "TCO Certified Displays 8, TCO Certified Displays 9",
        "Typ": "Lautsprecher - Stereo",
        "USB-Spannungsversorgung": "100 Watt",
        "VESA-Halterung": "100 x 100 mm",
        "Vertikaler Betrachtungswinkel": "178"
    },
    "raw_specifications_text": "Display-Typ: LED-hintergrundbeleuchteter LCD-Monitor / TFT-Aktivmatrix\nEnergie Effizienzklasse: Klasse E\nEnergieklasse (HDR): Klasse F\nDiagonalabmessung: 60.5 cm (23.8\")\nIntegrierte Peripherieger\u00e4te: Mikrofon, USB 3.0-Hub, FHD-Kamera, USB-C-Docking-Station\nUSB-Spannungsversorgung: 100 Watt\nBildschirmtyp: IPS\nSeitenverh\u00e4ltnis: 16:9\nNative Aufl\u00f6sung: Full HD (1080p) 1920 x 1080 bei 75 Hz\nHelligkeit: 250 cd/m\u00b2\nKontrast: 1000:1 / 100000000:1 (dynamisch)\nHDR-Format: HDR10\nFarbunterst\u00fctzung: 16,7 Millionen Farben\nReaktionszeit: 4 ms\nHorizontaler Betrachtungswinkel: 178\nVertikaler Betrachtungswinkel: 178\nBildschirmbeschichtung: Blendfrei\nHintergrundbeleuchtungs-Technologie: LED-Hintergrundbeleuchtung\nBesonderheiten: Acer Adaptive Contrast Management (ACM), Adaptive-Sync-Technologie, Acer VisionCare, an 3 Seiten ohne Blende, Delta E<1 Kalibrierung, Eyesafe-Technologie\nFarbe: Schwarz\nAbmessungen (Breite x Tiefe x H\u00f6he): 54 cm x 19.3 cm x 39.8 cm - mit Fu\u00df\nGewicht: 6.04 kg\nTyp: Lautsprecher - Stereo\nAusgangsleistung/Kanal: 2 Watt\nSchnittstellen: HDMI \u00a6 DisplayPort 1.4 \u00a6 DisplayPort-Ausgang \u00a6 USB-C (bis zu 100 W) \u00a6 Netzwerk (RJ-45) \u00a6 Audio Line-Out \u00a6 USB 3.0 Upstream (Typ B) \u00a6 4 x USB 3.0 Downstream\nEinstellungen der Anzeigeposition: H\u00f6he, Pivot (Rotation), Drehung, Neigung\nNeigungswinkel: -5/+35\nSchwenkwinkel: 120\nRotationswinkel: 180\nH\u00f6heneinstellung: 120 mm\nVESA-Halterung: 100 x 100 mm\nLeistungsmerkmale: Slot f\u00fcr Sicherheitsschloss (Kabelschloss getrennt erh\u00e4ltlich), Unterst\u00fctzung f\u00fcr VESA-Schnittstelle\nEnthaltene Kabel: 1 x HDMI-Kabel \u00a6 1 x USB-C Kabel \u00a6 1 x SuperSpeed-USB-Kabel\nKennzeichnung: DisplayPort 1.4, TUV Eyesafe Display Certification\nSchlosstyp zur Diebstahlsicherung: Kensington Slot\nEingangsspannung: Wechselstrom 120/230 V (50/60 Hz)\nLeistungsaufnahme im Ein-Zustand: 17 W\nStromverbrauch SDR (eingeschaltet): 17 kWh/1.000 h\nStromverbrauch HDR (eingeschaltet): 20 kWh/1.000 h\nStromverbrauch (typisch): 16 Watt\nEnergierverbrauch Sleep: 0.5 Watt\nStromverbrauch (Aus-Modus): 0.45 Watt\nMitgelieferte Software: Acer Smart Console\nDetails zu Abmessungen & Gewicht: Mit Fu\u00df - Breite: 54 cm - Tiefe: 19.3 cm - H\u00f6he: 39.8 cm - Gewicht: 6.04 kg \u00a6 Ohne Fu\u00df - Breite: 54 cm - Tiefe: 6.5 cm - H\u00f6he: 32.3 cm - Gewicht: 3.64 kg\nTCO-zertifiziert: TCO Certified Displays 8, TCO Certified Displays 9\nEPEAT-kompatibel: EPEAT Bronze\nENERGY STAR zertifiziert: Ja",
    "reference_file": "offer_reference_1585.json",
    "shop_name": "ElectronicShop24"
}