{
    "html_file": "offer_2480_0.html",
    "name": "Eizo DuraVision FDS1903 schwarz, 19\"",
    "offer_link": "https://www.csv-direct.de/artinfo.php?artnr=AGX1191557&KATEGORIE=162&pva=geizhals2",
    "price": 680.15,
    "raw_specifications": {
        "3D": "Nein",
        "AC Eingangsfrequenz": "50 - 60 Hz",
        "AC Eingangsspannung": "100 - 240 V",
        "AMD FreeSync": "Nein",
        "Analoges Signalformatsystem": "NTSC, PAL, SECAM",
        "Anzahl HDMI-Anschl\u00fcsse": "1",
        "Anzahl OSD-Sprachen": "9",
        "Anzahl der Farben des Displays": "16,78 Millionen Farben",
        "Anzahl der Lautsprecher": "2",
        "Audioanschl\u00fcsse": "Nein",
        "Betriebstemperatur": "0 - 40 \u00b0C",
        "Bildschirmdiagonale": "48,3 cm 19\"",
        "Bildschirmform": "Flach",
        "Bildschirmtechnologie": "LED",
        "Bildwinkel, horizontal": "170\u00b0",
        "Bildwinkel, vertikal": "160\u00b0",
        "Breite ohne Standfu\u00df": "405 mm",
        "Composite Video-Eingang": "1",
        "DVI Anschluss": "Nein",
        "Display-Aufl\u00f6sung": "1280 x 1024 Pixel",
        "Energieeffizienzklasse SDR": "E",
        "Energieverbrauch SDR pro 1.000 Stunden": "15 kWh",
        "Ger\u00e4tebreite inkl. Fu\u00df": "405 mm",
        "Ger\u00e4teh\u00f6he inkl. Fu\u00df": "506,5 mm",
        "Ger\u00e4tetiefe inkl. Fu\u00df": "205 mm",
        "Gewicht ohne St\u00e4nder": "5,9 kg",
        "HD-Typ": "SXGA",
        "Helligkeit typisch": "350 cd/m\u00b2",
        "Horizontaler Scanbereich": "15 - 68 kHz",
        "H\u00f6he ohne Standfu\u00df": "615 mm",
        "H\u00f6heneinstellung": "10 cm",
        "Integrierte Kamera": "Nein",
        "Integrierter USB-Hub": "Nein",
        "Kontrastverh\u00e4ltnis": "1000:1",
        "Kopfh\u00f6rer-Anschluss": "3,5 mm",
        "Kopfh\u00f6rerausg\u00e4nge": "1",
        "Marktpositionierung": "Business",
        "NVIDIA G-SYNC": "Nein",
        "Natives Seitenverh\u00e4ltnis": "5:4",
        "Neigungswinkelbereich": "0 - 30\u00b0",
        "Panel-Typ": "TN",
        "Pivot Winkel": "0 - 90\u00b0",
        "Pixel Abstand": "0,294 x 0,294 mm",
        "Produktfarbe": "Schwarz",
        "RMS-Leistung": "1 W",
        "Reaktionszeit": "10 ms",
        "Relative Luftfeuchtigkeit in Betrieb": "20 - 80",
        "Schwenkwinkelbereich": "-35 - 35\u00b0",
        "Sichtbare Gr\u00f6\u00dfe horizontal": "37,6 cm",
        "Sichtbare Gr\u00f6\u00dfe vertikal": "30,1 cm",
        "Stromverbrauch Standby": "0,4 W",
        "Stromverbrauch max.": "24 W",
        "Touchscreen": "Nein",
        "Typ der Hintergrundbeleuchtung": "LED",
        "Unterst\u00fctzte Grafik-Aufl\u00f6sungen": "1280 x 1024 SXGA",
        "Vertikaler Scanbereich": "50 - 61 Hz",
        "Warentarifnummer HS": "85285210",
        "Zertifizierung": "CE, CB, cTUVus, FCC-A, CAN ICES-3 A, VCCI-A, RCM, RoHS, WEEE"
    },
    "raw_specifications_text": "Bildschirmdiagonale: 48,3 cm 19\"\nDisplay-Aufl\u00f6sung: 1280 x 1024 Pixel\nNatives Seitenverh\u00e4ltnis: 5:4\nBildschirmtechnologie: LED\nTouchscreen: Nein\nHD-Typ: SXGA\nPanel-Typ: TN\nBildschirmform: Flach\nKontrastverh\u00e4ltnis: 1000:1\nAnzahl der Farben des Displays: 16,78 Millionen Farben\nTyp der Hintergrundbeleuchtung: LED\nHelligkeit typisch: 350 cd/m\u00b2\nReaktionszeit: 10 ms\nUnterst\u00fctzte Grafik-Aufl\u00f6sungen: 1280 x 1024 SXGA\nBildwinkel, horizontal: 170\u00b0\nBildwinkel, vertikal: 160\u00b0\nPixel Abstand: 0,294 x 0,294 mm\nHorizontaler Scanbereich: 15 - 68 kHz\nVertikaler Scanbereich: 50 - 61 Hz\nSichtbare Gr\u00f6\u00dfe horizontal: 37,6 cm\nSichtbare Gr\u00f6\u00dfe vertikal: 30,1 cm\n3D: Nein\nNVIDIA G-SYNC: Nein\nAMD FreeSync: Nein\nIntegrierte Kamera: Nein\nAnzahl der Lautsprecher: 2\nRMS-Leistung: 1 W\nMarktpositionierung: Business\nProduktfarbe: Schwarz\nZertifizierung: CE, CB, cTUVus, FCC-A, CAN ICES-3 A, VCCI-A, RCM, RoHS, WEEE\nIntegrierter USB-Hub: Nein\nDVI Anschluss: Nein\nAnzahl HDMI-Anschl\u00fcsse: 1\nAudioanschl\u00fcsse: Nein\nKopfh\u00f6rerausg\u00e4nge: 1\nKopfh\u00f6rer-Anschluss: 3,5 mm\nComposite Video-Eingang: 1\nH\u00f6heneinstellung: 10 cm\nPivot Winkel: 0 - 90\u00b0\nSchwenkwinkelbereich: -35 - 35\u00b0\nNeigungswinkelbereich: 0 - 30\u00b0\nAnzahl OSD-Sprachen: 9\nEnergieeffizienzklasse SDR: E\nEnergieverbrauch SDR pro 1.000 Stunden: 15 kWh\nStromverbrauch Standby: 0,4 W\nStromverbrauch max.: 24 W\nAC Eingangsspannung: 100 - 240 V\nAC Eingangsfrequenz: 50 - 60 Hz\nBetriebstemperatur: 0 - 40 \u00b0C\nRelative Luftfeuchtigkeit in Betrieb: 20 - 80\nGer\u00e4tebreite inkl. Fu\u00df: 405 mm\nGer\u00e4tetiefe inkl. Fu\u00df: 205 mm\nGer\u00e4teh\u00f6he inkl. Fu\u00df: 506,5 mm\nBreite ohne Standfu\u00df: 405 mm\nH\u00f6he ohne Standfu\u00df: 615 mm\nGewicht ohne St\u00e4nder: 5,9 kg\nWarentarifnummer HS: 85285210\nAnaloges Signalformatsystem: NTSC, PAL, SECAM",
    "reference_file": "offer_reference_2480.json",
    "shop_name": "CSV-Direct.de"
}