{
    "html_file": "offer_1148_11.html",
    "name": "ViewSonic Elite XG320Q, 32\"",
    "offer_link": "https://www.electronicshop24.at/product_info.php?products_id=20000002146049497&ano=I2146049497&mno=XG320Q&ean=766907011296&utm_medium=cpc&utm_campaign=preisvergleich&utm_content=item&utm_source=geizhals&ref=geizhals",
    "price": 790.0,
    "raw_specifications": {
        "Abmessungen (Breite x Tiefe x H\u00f6he)": "72.6 cm x 26.5 cm x 48.23 cm - mit Fu\u00df",
        "Adaptive-Sync Technologie": "NVIDIA G-SYNC Compatible",
        "Ausgangsleistung/Kanal": "5 Watt",
        "Besonderheiten": "HDCP, flimmerfreie Technologie, TMDS-Technologie (Transition Minimized Differential Signaling), Blaulichtfilter-Technologie, Adaptive-Sync-Technologie, Quantum Dot Technology, PureXP Motion Blur Reduction",
        "Bildschirmbeschichtung": "Blendfrei, 3H Hard Coating",
        "Bildschirmtyp": "IPS",
        "Details zu Abmessungen & Gewicht": "Mit Fu\u00df - Breite: 72.6 cm - Tiefe: 26.5 cm - H\u00f6he: 48.23 cm - Gewicht: 10.1 kg \u00a6 Ohne Fu\u00df - Breite: 72.6 cm - Tiefe: 8.7 cm - H\u00f6he: 43.2 cm - Gewicht: 7.1 kg",
        "Diagonalabmessung": "81.3 cm (32\")",
        "Display-Typ": "LED-hintergrundbeleuchteter LCD-Monitor / TFT-Aktivmatrix",
        "Eingangsspannung": "Wechselstrom 100-240 V (50/60 Hz)",
        "Einstellungen der Anzeigeposition": "H\u00f6he, Drehung, Neigung",
        "Energie Effizienzklasse": "Klasse G",
        "Energieklasse (HDR)": "Klasse G",
        "Enthaltene Kabel": "1 x DisplayPort-Kabel \u00a6 1 x USB 3.2 Kabel",
        "Farbraum": "112% NTSC (CIE 1976), 99% Adobe RGB, 99% sRGB",
        "Farbunterst\u00fctzung": "16,7 Millionen Farben (8-Bit)",
        "Gaming": "Ja",
        "Gewicht": "10.1 kg",
        "HDR-Format": "HDR600",
        "HDR-Zertifizierung": "DisplayHDR 600",
        "Helligkeit": "440 cd/m\u00b2",
        "Hintergrundbeleuchtungs-Technologie": "LED-Hintergrundbeleuchtung",
        "Horizontale Bildwiederholrate": "30 - 254 kHz",
        "Horizontaler Betrachtungswinkel": "178",
        "H\u00f6heneinstellung": "120 mm",
        "Integrierte Peripherieger\u00e4te": "USB 3.2 Hub, Mausverankerung",
        "Kennzeichnung": "FCC Klasse B bescheinigt, ICES-003, NOM, CB, CCC, EMC, RoHS, WEEE, cTUVus, REACH, CEC, UkrSEPRO, ERP, EAC, China Energy Label, China RoHS, HDCP 2.2, Mexico Energy label, UKCA",
        "Kontrast": "1000:1 / 120000000:1 (dynamisch)",
        "Lebensdauer der Beleuchtung": "30,000 Stunden",
        "Leistungsmerkmale": "Slot f\u00fcr Sicherheitsschloss (Kabelschloss getrennt erh\u00e4ltlich), Kabel - Organizer, Kopfh\u00f6rerhaken, RGB-Lichteffekte",
        "Max. Betriebstemperatur": "40 \u00b0C",
        "Min Betriebstemperatur": "0 \u00b0C",
        "Native Aufl\u00f6sung": "QHD 2560 x 1440 (DisplayPort: 175 Hz, HDMI: 144 Hz)",
        "Neigungswinkel": "-5/20",
        "Pixelpitch": "0.27675 mm",
        "Reaktionszeit": "1 ms (Gray-to-Gray), 0.5 ms (MPRT)",
        "Schlosstyp zur Diebstahlsicherung": "Kensington Slot",
        "Schnittstellen": "DisplayPort 1.4 \u00a6 2 x HDMI \u00a6 Kopfh\u00f6rer \u00a6 USB 3.2 Upstream (Typ B) \u00a6 3 x USB 3.2 Downstream (Typ A) \u00a6 Micro-USB (Typ B)",
        "Schwenkwinkel": "50",
        "Seitenverh\u00e4ltnis": "16:9",
        "Service und Support": "Begrenzte Garantie - 3 Jahre - Pick-Up & Return",
        "Stromverbrauch (Aus-Modus)": "0.2 Watt",
        "Stromverbrauch (max.)": "67.2 Watt",
        "Stromverbrauch (typisch)": "43.8 Watt",
        "Stromverbrauch HDR (eingeschaltet)": "50.5 kWh/1.000 h",
        "Stromverbrauch SDR (eingeschaltet)": "39.8 kWh/1.000 h",
        "Stromverbrauch im Standby-Modus": "0.3 Watt",
        "Transportbreite": "85 cm",
        "Transportgewicht": "14.6 kg",
        "Transporth\u00f6he": "52.7 cm",
        "Transporttiefe": "32.7 cm",
        "Typ": "Lautsprecher - Stereo",
        "VESA-Halterung": "100 x 100 mm",
        "Vertikale Bildwiederholrate": "48 - 175 Hz",
        "Vertikaler Betrachtungswinkel": "178",
        "Zul\u00e4ssige Luftfeuchtigkeit im Betrieb": "20 - 90% (nicht kondensierend)"
    },
    "raw_specifications_text": "Display-Typ: LED-hintergrundbeleuchteter LCD-Monitor / TFT-Aktivmatrix\nEnergie Effizienzklasse: Klasse G\nEnergieklasse (HDR): Klasse G\nDiagonalabmessung: 81.3 cm (32\")\nAdaptive-Sync Technologie: NVIDIA G-SYNC Compatible\nIntegrierte Peripherieger\u00e4te: USB 3.2 Hub, Mausverankerung\nBildschirmtyp: IPS\nSeitenverh\u00e4ltnis: 16:9\nNative Aufl\u00f6sung: QHD 2560 x 1440 (DisplayPort: 175 Hz, HDMI: 144 Hz)\nPixelpitch: 0.27675 mm\nHelligkeit: 440 cd/m\u00b2\nKontrast: 1000:1 / 120000000:1 (dynamisch)\nHDR-Format: HDR600\nHDR-Zertifizierung: DisplayHDR 600\nFarbunterst\u00fctzung: 16,7 Millionen Farben (8-Bit)\nFarbraum: 112% NTSC (CIE 1976), 99% Adobe RGB, 99% sRGB\nReaktionszeit: 1 ms (Gray-to-Gray), 0.5 ms (MPRT)\nVertikale Bildwiederholrate: 48 - 175 Hz\nHorizontale Bildwiederholrate: 30 - 254 kHz\nGaming: Ja\nHorizontaler Betrachtungswinkel: 178\nVertikaler Betrachtungswinkel: 178\nBildschirmbeschichtung: Blendfrei, 3H Hard Coating\nHintergrundbeleuchtungs-Technologie: LED-Hintergrundbeleuchtung\nBesonderheiten: HDCP, flimmerfreie Technologie, TMDS-Technologie (Transition Minimized Differential Signaling), Blaulichtfilter-Technologie, Adaptive-Sync-Technologie, Quantum Dot Technology, PureXP Motion Blur Reduction\nAbmessungen (Breite x Tiefe x H\u00f6he): 72.6 cm x 26.5 cm x 48.23 cm - mit Fu\u00df\nGewicht: 10.1 kg\nTyp: Lautsprecher - Stereo\nAusgangsleistung/Kanal: 5 Watt\nSchnittstellen: DisplayPort 1.4 \u00a6 2 x HDMI \u00a6 Kopfh\u00f6rer \u00a6 USB 3.2 Upstream (Typ B) \u00a6 3 x USB 3.2 Downstream (Typ A) \u00a6 Micro-USB (Typ B)\nEinstellungen der Anzeigeposition: H\u00f6he, Drehung, Neigung\nNeigungswinkel: -5/20\nSchwenkwinkel: 50\nH\u00f6heneinstellung: 120 mm\nVESA-Halterung: 100 x 100 mm\nLeistungsmerkmale: Slot f\u00fcr Sicherheitsschloss (Kabelschloss getrennt erh\u00e4ltlich), Kabel - Organizer, Kopfh\u00f6rerhaken, RGB-Lichteffekte\nEnthaltene Kabel: 1 x DisplayPort-Kabel \u00a6 1 x USB 3.2 Kabel\nLebensdauer der Beleuchtung: 30,000 Stunden\nKennzeichnung: FCC Klasse B bescheinigt, ICES-003, NOM, CB, CCC, EMC, RoHS, WEEE, cTUVus, REACH, CEC, UkrSEPRO, ERP, EAC, China Energy Label, China RoHS, HDCP 2.2, Mexico Energy label, UKCA\nSchlosstyp zur Diebstahlsicherung: Kensington Slot\nEingangsspannung: Wechselstrom 100-240 V (50/60 Hz)\nStromverbrauch SDR (eingeschaltet): 39.8 kWh/1.000 h\nStromverbrauch HDR (eingeschaltet): 50.5 kWh/1.000 h\nStromverbrauch (typisch): 43.8 Watt\nStromverbrauch (max.): 67.2 Watt\nStromverbrauch im Standby-Modus: 0.3 Watt\nStromverbrauch (Aus-Modus): 0.2 Watt\nDetails zu Abmessungen & Gewicht: Mit Fu\u00df - Breite: 72.6 cm - Tiefe: 26.5 cm - H\u00f6he: 48.23 cm - Gewicht: 10.1 kg \u00a6 Ohne Fu\u00df - Breite: 72.6 cm - Tiefe: 8.7 cm - H\u00f6he: 43.2 cm - Gewicht: 7.1 kg\nTransportbreite: 85 cm\nTransporttiefe: 32.7 cm\nTransporth\u00f6he: 52.7 cm\nTransportgewicht: 14.6 kg\nService und Support: Begrenzte Garantie - 3 Jahre - Pick-Up & Return\nMin Betriebstemperatur: 0 \u00b0C\nMax. Betriebstemperatur: 40 \u00b0C\nZul\u00e4ssige Luftfeuchtigkeit im Betrieb: 20 - 90% (nicht kondensierend)",
    "reference_file": "offer_reference_1148.json",
    "shop_name": "ElectronicShop24"
}