{
    "html_file": "offer_674_3.html",
    "name": "Philips Brilliance 7000 Series 27B1U7903, 27\"",
    "offer_link": "https://www.amazon.de/dp/B0BLWDWGMZ?linkCode=xm2&camp=2025&creative=165953&smid=A3JWKAKR8XB7XF&creativeASIN=B0BLWDWGMZ&tag=geizhals1-21",
    "price": 1093.33,
    "raw_specifications": {
        "ASIN": "B0BLWDWGMZ",
        "Amazon Bestseller-Rang": "Nr. 160,388 in Computer & Zubeh\u00f6r (Siehe Top 100 in Computer & Zubeh\u00f6r)  Nr. 2,687 in Monitore",
        "Artikelgewicht": "\u200e9,43 Kilograms",
        "Batterien enthalten": "\u200eNein",
        "Bildschirmaufl\u00f6sung": "\u200e3840 x 2160",
        "Display-Gr\u00f6\u00dfe": "\u200e27 Zoll",
        "Durchschnittliche Kundenbewertung": "4,0  4,0 von 5 Sternen    \n    56 Sternebewertungen   \n\n\n 4,0 von 5 Sternen",
        "Farbe": "\u200eschwarz",
        "Garantierte Software-Updates bis": "\u200eunbekannt",
        "Hersteller": "\u200ePhilips",
        "Im Angebot von Amazon.de seit": "13. Dezember 2022",
        "L\u00f6sung": "\u200e3840 x 2160 Pixels",
        "Marke": "\u200ePhilips",
        "Modellnummer": "\u200e27B1U7903/00",
        "Produktabmessungen": "\u200e20,4 x 61,3 x 51,5 cm; 9,43 Kilogramm",
        "Prozessortyp": "\u200eOthers"
    },
    "raw_specifications_text": "Marke: \u200ePhilips\nHersteller: \u200ePhilips\nProduktabmessungen: \u200e20,4 x 61,3 x 51,5 cm; 9,43 Kilogramm\nModellnummer: \u200e27B1U7903/00\nFarbe: \u200eschwarz\nDisplay-Gr\u00f6\u00dfe: \u200e27 Zoll\nBildschirmaufl\u00f6sung: \u200e3840 x 2160\nL\u00f6sung: \u200e3840 x 2160 Pixels\nProzessortyp: \u200eOthers\nBatterien enthalten: \u200eNein\nArtikelgewicht: \u200e9,43 Kilograms\nGarantierte Software-Updates bis: \u200eunbekannt\nASIN: B0BLWDWGMZ\nDurchschnittliche Kundenbewertung: 4,0  4,0 von 5 Sternen    \n    56 Sternebewertungen   \n\n\n 4,0 von 5 Sternen\nAmazon Bestseller-Rang: Nr. 160,388 in Computer & Zubeh\u00f6r (Siehe Top 100 in Computer & Zubeh\u00f6r)  Nr. 2,687 in Monitore\nIm Angebot von Amazon.de seit: 13. Dezember 2022",
    "reference_file": "offer_reference_674.json",
    "shop_name": "Amazon.at"
}