{
    "html_file": "offer_2351_19.html",
    "name": "Philips P-line 328P6AUBREB, 31.5\"",
    "offer_link": "https://syswork.at/sw/index.html?open&mid=Artikel&artid=mon-1181&from=geizhals.at",
    "price": 522.0,
    "raw_specifications": {
        "3D": "Nein",
        "AC Eingangsfrequenz": "50/60 Hz",
        "AC Eingangsspannung": "100 - 240 V",
        "AMD FreeSync": "Nein",
        "Adobe RGB-Abdeckung": "99%",
        "Anzahl DisplayPort Anschl\u00fcsse": "1",
        "Anzahl Ethernet-LAN-Anschl\u00fcsse (RJ-45)": "1",
        "Anzahl HDMI-Anschl\u00fcsse": "1",
        "Anzahl VGA (D-Sub) Anschl\u00fcsse": "1",
        "Anzahl der Farben des Displays": "1,07 Milliarden Farben",
        "Anzahl der Lautsprecher": "2",
        "Anzahl der nachgeschalteten Steckpl\u00e4tze vom Typ USB-A": "2",
        "Anzahl der vorgeschalteten Steckpl\u00e4tze": "1",
        "Au\u00dfenverkleidungstyp": "Texturiert",
        "Beh\u00f6rdliche Zulassung": "CE Mark; FCC Class B; VCCI; RCM; BSMI; ICES-003; J-MOSS; cETLus; EPA; PSB; CU-EAC; SEMKO; SASO; KUCAS; UKRAINIAN; PSE; CECP; WEEE; TUV Ergo; TUV/GS; CB",
        "Benutzerhandbuch": "Ja",
        "Betriebsanleitung": "Ja",
        "Betriebstemperatur": "0 - 40 \u00b0C",
        "Bild-Verbesserung": "SmartImage",
        "Bildschirmdiagonale": "80 cm (31.5 Zoll)",
        "Bildschirmdiagonale (cm)": "80,1 cm",
        "Bildschirmform": "Flach",
        "Bildschirmtechnologie": "LED",
        "Bildwinkel, horizontal": "178\u00b0",
        "Bildwinkel, vertikal": "178\u00b0",
        "Blendfreier Bildschirm": "Ja",
        "Breite (ohne Standfu\u00df)": "74,2 cm",
        "DDC/CI": "Ja",
        "DVI Anschluss": "Nein",
        "Datenblatt": "Kein Datenblatt verf\u00fcgbar",
        "Delta E": "2",
        "Display": "LCD",
        "Display-Aufl\u00f6sung": "2560 x 1440 Pixel",
        "Drehen": "Ja",
        "Dynamisches Kontrastverh\u00e4ltnis Marketingbezeichnung": "SmartContrast",
        "Ein-/Ausschalter": "Ja",
        "Einfach zu lesen Modus": "Ja",
        "Eingebaute Lautsprecher": "Ja",
        "Eingebauter Ethernet-Anschluss": "Ja",
        "Empfohlene Aufl\u00f6sung": "2560 x 1440 @ 60Hz",
        "Energieeffizienzklasse (HDR)": "G",
        "Energieeffizienzklasse (SDR)": "G",
        "Energieeffizienzskala": "A bis G",
        "Energieverbrauch (HDR) pro 1.000 Stunden": "55 kWh",
        "Energieverbrauch (SDR) pro 1.000 Stunden": "40 kWh",
        "Enth\u00e4lt nicht": "PVC/BFR, Quecksilber",
        "Ethernet LAN Datentransferraten": "10,100,1000 Mbit/s",
        "Flimmerfreie Technologie": "Ja",
        "Fu\u00dffarbe": "Schwarz",
        "Ger\u00e4tebreite (inkl. Fu\u00df)": "742 mm",
        "Ger\u00e4teh\u00f6he (inkl. Fu\u00df)": "657 mm",
        "Ger\u00e4tetiefe (inkl. Fu\u00df)": "270 mm",
        "Gewicht (mit St\u00e4nder)": "9,7 kg",
        "Gewicht (ohne St\u00e4nder)": "6,74 kg",
        "HD-Typ": "Quad HD",
        "Helligkeit (typisch)": "450 cd/m\u00b2",
        "Herstellerlink": "Philips",
        "Horizontaler Scanbereich": "30 - 83 kHz",
        "H\u00f6he (ohne Standfu\u00df)": "43,8 cm",
        "H\u00f6he bei Betrieb": "0 - 3658 m",
        "H\u00f6he bei Lagerung": "0 - 12192 m",
        "H\u00f6heneinstellung": "18 cm",
        "H\u00f6henverstellung": "Ja",
        "Integrierte Kamera": "Nein",
        "Integrierter USB-Hub": "Ja",
        "Kabelsperre-Slot": "Ja",
        "Kein Flimmern": "Ja",
        "Komponentenvideo-Synchronisation": "Separate sync, Sync-on-green (SOG)",
        "Kontrastverh\u00e4ltnis": "1200:1",
        "Kontrastverh\u00e4ltnis (dynamisch)": "50000000:1",
        "Kopfh\u00f6rerausgang": "Ja",
        "LED-Anzeigen": "T\u00e4tigkeit, Stand-by",
        "Low-Blue-Light-Technologie": "Ja",
        "LowBlue-Modus": "Ja",
        "Marktpositionierung": "Haus",
        "Maximale Bildwiederholrate": "60 Hz",
        "Men\u00fcsprachen": "Vereinfachtes Chinesisch, Traditionelles Chinesisch, Tschechisch, Deutsch, Niederl\u00e4ndisch, Englisch, Spanisch, Finnisch, Franz\u00f6sisch, Griechisch, Ungarisch, Italienisch, Japanisch, Koreanisch, Polnisch, Portugiesisch, Russisch, Schwedisch, T\u00fcrkisch, Ukrainisch",
        "Mitgelieferte Kabel": "VGA, DisplayPort, HDMI, USB Typ-C auf USB Typ-C, USB Typ-C auf USB Typ-A, AC, Audio (3,5 mm)",
        "Mitgelieferte Software": "SmartControl",
        "Mittlere Betriebsdauer zwischen Ausf\u00e4llen (MTBF)": "70000 h",
        "NVIDIA G-SYNC": "Nein",
        "Nach Gebrauch recycelter Kunststoff": "65%",
        "Nachhaltigkeitszertifikate": "ENERGY STAR, RoHS",
        "Natives Seitenverh\u00e4ltnis": "16:9",
        "Neigungsverstellung": "Ja",
        "Neigungswinkelbereich": "-5 - 20\u00b0",
        "Netzteiltyp": "Intern",
        "Oberfl\u00e4chenh\u00e4rte": "3H",
        "On-Screen-Display (OSD)": "Ja",
        "PC Audio-Eingang": "Ja",
        "Paketgewicht": "13,9 kg",
        "Panel-Montage-Schnittstelle": "100 x 100 mm",
        "Panel-Typ": "IPS",
        "Philips SmartUniformity": "96 - 103%",
        "Pivot": "Ja",
        "Pivot Winkel": "90 - 90\u00b0",
        "Pixel Abstand": "0,2727 x 0,2727 mm",
        "Pixeldichte": "93 ppi",
        "Plug & Play": "Ja",
        "Produktfarbe": "Schwarz",
        "Produktlink": "Link",
        "RGB-Farbraum": "sRGB",
        "RMS-Leistung": "6 W",
        "Reaktionszeit": "4 ms",
        "Recycelbares Material": "65%",
        "Recycelbares Verpackungsmaterial": "100%",
        "Relative Luftfeuchtigkeit": "20 - 80%",
        "Relative Luftfeuchtigkeit in Betrieb": "20 - 80%",
        "Schwenkwinkelbereich": "-170 - 170\u00b0",
        "Schwermetallfrei": "Hg (Quecksilber)",
        "Seitenverh\u00e4ltnis": "16:9",
        "Sichtbare Gr\u00f6\u00dfe (horizontal)": "69,8 cm",
        "Sichtbare Gr\u00f6\u00dfe (vertikal)": "39,3 cm",
        "Slot-Typ Kabelsperre": "Kensington",
        "Stromverbrauch (PowerSave)": "31,9 W",
        "Stromverbrauch (Standardbetrieb)": "23,72 W",
        "Stromverbrauch (Standby)": "0,5 W",
        "Stromverbrauch (max.)": "32,4 W",
        "St\u00e4nder enthalten": "Ja",
        "TV Tuner integriert": "Nein",
        "Technologie mit hohem Dynamikbereich (HDR)": "DisplayHDR 400",
        "Temperaturbereich bei Lagerung": "-20 - 60 \u00b0C",
        "Thin Client installiert": "Nein",
        "Tiefe (ohne Standfu\u00df)": "6,3 cm",
        "Touchscreen": "Nein",
        "Tr\u00fcbungsrate": "25%",
        "Typ der Hintergrundbeleuchtung": "W-LED",
        "USB Power Delivery": "Ja",
        "USB-Hub-Version": "3.2 Gen 1 (3.1 Gen 1)",
        "USB-Stromversorgung Revision": "2.0",
        "USB-Stromversorgung bis zu": "60 W",
        "USB-Typ-C DisplayPort-Wechselmodus": "Ja",
        "USB-Upstream-Porttyp": "USB Typ-C",
        "Unterst\u00fctzt Mac-Betriebssysteme": "Mac OS X 10.0 Cheetah, Mac OS X 10.1 Puma, Mac OS X 10.10 Yosemite, Mac OS X 10.11 El Capitan, Mac OS X 10.12 Sierra, Mac OS X 10.2 Jaguar, Mac OS X 10.3 Panther, Mac OS X 10.4 Tiger, Mac OS X 10.5 Leopard, Mac OS X 10.6 Snow Leopard, Mac OS X 10.7 Lion, Mac OS X 10.8 Mountain Lion, Mac OS X 10.9 Mavericks",
        "Unterst\u00fctzt Windows-Betriebssysteme": "Windows 10, Windows 7, Windows 8, Windows 8.1",
        "Unterst\u00fctzte Grafik-Aufl\u00f6sungen": "2560 x 1440",
        "VESA-Halterung": "Ja",
        "Verpackungsbreite": "970 mm",
        "Verpackungsh\u00f6he": "526 mm",
        "Verpackungstiefe": "224 mm",
        "Vertikaler Scanbereich": "56 - 76 Hz",
        "Vorderer Rahmen": "Schwarz",
        "Warentarifnummer (HS)": "85285210",
        "Zertifizierung": "CE Mark, FCC Class B, VCCI, RCM, BSMI, ICES-003, J-MOSS, cETLus, EPA, PSB, CU-EAC, SEMKO, SASO, KUCAS, UKRAINIAN, PSE, CECP, WEEE, TUV Ergo, TUV/GS, CB",
        "sRGB": "Ja"
    },
    "raw_specifications_text": "Bildschirmdiagonale: 80 cm (31.5 Zoll)\nDisplay-Aufl\u00f6sung: 2560 x 1440 Pixel\nNatives Seitenverh\u00e4ltnis: 16:9\nBildschirmtechnologie: LED\nTouchscreen: Nein\nHD-Typ: Quad HD\nPanel-Typ: IPS\nBildschirmform: Flach\nKontrastverh\u00e4ltnis: 1200:1\nMaximale Bildwiederholrate: 60 Hz\nAnzahl der Farben des Displays: 1,07 Milliarden Farben\nTyp der Hintergrundbeleuchtung: W-LED\nHelligkeit (typisch): 450 cd/m\u00b2\nReaktionszeit: 4 ms\nBlendfreier Bildschirm: Ja\nUnterst\u00fctzte Grafik-Aufl\u00f6sungen: 2560 x 1440\nSeitenverh\u00e4ltnis: 16:9\nKontrastverh\u00e4ltnis (dynamisch): 50000000:1\nDynamisches Kontrastverh\u00e4ltnis Marketingbezeichnung: SmartContrast\nBildwinkel, horizontal: 178\u00b0\nBildwinkel, vertikal: 178\u00b0\nPixel Abstand: 0,2727 x 0,2727 mm\nPixeldichte: 93 ppi\nHorizontaler Scanbereich: 30 - 83 kHz\nVertikaler Scanbereich: 56 - 76 Hz\nSichtbare Gr\u00f6\u00dfe (horizontal): 69,8 cm\nSichtbare Gr\u00f6\u00dfe (vertikal): 39,3 cm\nBildschirmdiagonale (cm): 80,1 cm\nTechnologie mit hohem Dynamikbereich (HDR): DisplayHDR 400\nDDC/CI: Ja\nTr\u00fcbungsrate: 25%\nOberfl\u00e4chenh\u00e4rte: 3H\nRGB-Farbraum: sRGB\nAdobe RGB-Abdeckung: 99%\n3D: Nein\nsRGB: Ja\nNVIDIA G-SYNC: Nein\nAMD FreeSync: Nein\nKomponentenvideo-Synchronisation: Separate sync, Sync-on-green (SOG)\nFlimmerfreie Technologie: Ja\nLow-Blue-Light-Technologie: Ja\nUnterst\u00fctzt Windows-Betriebssysteme: Windows 10, Windows 7, Windows 8, Windows 8.1\nUnterst\u00fctzt Mac-Betriebssysteme: Mac OS X 10.0 Cheetah, Mac OS X 10.1 Puma, Mac OS X 10.10 Yosemite, Mac OS X 10.11 El Capitan, Mac OS X 10.12 Sierra, Mac OS X 10.2 Jaguar, Mac OS X 10.3 Panther, Mac OS X 10.4 Tiger, Mac OS X 10.5 Leopard, Mac OS X 10.6 Snow Leopard, Mac OS X 10.7 Lion, Mac OS X 10.8 Mountain Lion, Mac OS X 10.9 Mavericks\nEingebaute Lautsprecher: Ja\nIntegrierte Kamera: Nein\nAnzahl der Lautsprecher: 2\nRMS-Leistung: 6 W\nMarktpositionierung: Haus\nProduktfarbe: Schwarz\nVorderer Rahmen: Schwarz\nFu\u00dffarbe: Schwarz\nSchwermetallfrei: Hg (Quecksilber)\nZertifizierung: CE Mark, FCC Class B, VCCI, RCM, BSMI, ICES-003, J-MOSS, cETLus, EPA, PSB, CU-EAC, SEMKO, SASO, KUCAS, UKRAINIAN, PSE, CECP, WEEE, TUV Ergo, TUV/GS, CB\nIntegrierter USB-Hub: Ja\nKopfh\u00f6rerausgang: Ja\nUSB-Hub-Version: 3.2 Gen 1 (3.1 Gen 1)\nUSB-Upstream-Porttyp: USB Typ-C\nAnzahl der vorgeschalteten Steckpl\u00e4tze: 1\nAnzahl der nachgeschalteten Steckpl\u00e4tze vom Typ USB-A: 2\nUSB-Typ-C DisplayPort-Wechselmodus: Ja\nUSB Power Delivery: Ja\nUSB-Stromversorgung bis zu: 60 W\nAnzahl VGA (D-Sub) Anschl\u00fcsse: 1\nDVI Anschluss: Nein\nAnzahl HDMI-Anschl\u00fcsse: 1\nAnzahl DisplayPort Anschl\u00fcsse: 1\nPC Audio-Eingang: Ja\nEingebauter Ethernet-Anschluss: Ja\nVESA-Halterung: Ja\nKabelsperre-Slot: Ja\nH\u00f6henverstellung: Ja\nPanel-Montage-Schnittstelle: 100 x 100 mm\nSlot-Typ Kabelsperre: Kensington\nH\u00f6heneinstellung: 18 cm\nPivot: Ja\nPivot Winkel: 90 - 90\u00b0\nSchwenkwinkelbereich: -170 - 170\u00b0\nNeigungswinkelbereich: -5 - 20\u00b0\nOn-Screen-Display (OSD): Ja\nMen\u00fcsprachen: Vereinfachtes Chinesisch, Traditionelles Chinesisch, Tschechisch, Deutsch, Niederl\u00e4ndisch, Englisch, Spanisch, Finnisch, Franz\u00f6sisch, Griechisch, Ungarisch, Italienisch, Japanisch, Koreanisch, Polnisch, Portugiesisch, Russisch, Schwedisch, T\u00fcrkisch, Ukrainisch\nPlug & Play: Ja\nLED-Anzeigen: T\u00e4tigkeit, Stand-by\nNeigungsverstellung: Ja\nEnergieeffizienzklasse (SDR): G\nEnergieeffizienzklasse (HDR): G\nEnergieverbrauch (SDR) pro 1.000 Stunden: 40 kWh\nEnergieverbrauch (HDR) pro 1.000 Stunden: 55 kWh\nStromverbrauch (Standardbetrieb): 23,72 W\nStromverbrauch (Standby): 0,5 W\nStromverbrauch (max.): 32,4 W\nStromverbrauch (PowerSave): 31,9 W\nAC Eingangsspannung: 100 - 240 V\nAC Eingangsfrequenz: 50/60 Hz\nNetzteiltyp: Intern\nEnergieeffizienzskala: A bis G\nBetriebstemperatur: 0 - 40 \u00b0C\nTemperaturbereich bei Lagerung: -20 - 60 \u00b0C\nRelative Luftfeuchtigkeit in Betrieb: 20 - 80%\nH\u00f6he bei Betrieb: 0 - 3658 m\nH\u00f6he bei Lagerung: 0 - 12192 m\nRelative Luftfeuchtigkeit: 20 - 80%\nSt\u00e4nder enthalten: Ja\nMitgelieferte Kabel: VGA, DisplayPort, HDMI, USB Typ-C auf USB Typ-C, USB Typ-C auf USB Typ-A, AC, Audio (3,5 mm)\nBetriebsanleitung: Ja\nMitgelieferte Software: SmartControl\nGer\u00e4tebreite (inkl. Fu\u00df): 742 mm\nGer\u00e4tetiefe (inkl. Fu\u00df): 270 mm\nGer\u00e4teh\u00f6he (inkl. Fu\u00df): 657 mm\nGewicht (mit St\u00e4nder): 9,7 kg\nBreite (ohne Standfu\u00df): 74,2 cm\nTiefe (ohne Standfu\u00df): 6,3 cm\nH\u00f6he (ohne Standfu\u00df): 43,8 cm\nGewicht (ohne St\u00e4nder): 6,74 kg\nVerpackungsbreite: 970 mm\nVerpackungstiefe: 224 mm\nVerpackungsh\u00f6he: 526 mm\nPaketgewicht: 13,9 kg\nNachhaltigkeitszertifikate: ENERGY STAR, RoHS\nEnth\u00e4lt nicht: PVC/BFR, Quecksilber\nRecycelbares Material: 65%\nNach Gebrauch recycelter Kunststoff: 65%\nWarentarifnummer (HS): 85285210\nThin Client installiert: Nein\nDisplay: LCD\nEin-/Ausschalter: Ja\nUSB-Stromversorgung Revision: 2.0\nDrehen: Ja\nTV Tuner integriert: Nein\nAu\u00dfenverkleidungstyp: Texturiert\nRecycelbares Verpackungsmaterial: 100%\nKein Flimmern: Ja\nEinfach zu lesen Modus: Ja\nLowBlue-Modus: Ja\nBenutzerhandbuch: Ja\nPhilips SmartUniformity: 96 - 103%\nMittlere Betriebsdauer zwischen Ausf\u00e4llen (MTBF): 70000 h\nEthernet LAN Datentransferraten: 10,100,1000 Mbit/s\nAnzahl Ethernet-LAN-Anschl\u00fcsse (RJ-45): 1\nEmpfohlene Aufl\u00f6sung: 2560 x 1440 @ 60Hz\nBild-Verbesserung: SmartImage\nBeh\u00f6rdliche Zulassung: CE Mark; FCC Class B; VCCI; RCM; BSMI; ICES-003; J-MOSS; cETLus; EPA; PSB; CU-EAC; SEMKO; SASO; KUCAS; UKRAINIAN; PSE; CECP; WEEE; TUV Ergo; TUV/GS; CB\nDelta E: 2\nDatenblatt: Kein Datenblatt verf\u00fcgbar\nProduktlink: Link\nHerstellerlink: Philips",
    "reference_file": "offer_reference_2351.json",
    "shop_name": "Syswork"
}