{
    "html_file": "offer_2466_21.html",
    "name": "Lenovo ThinkCentre Tiny-in-One 24, 23.8\"",
    "offer_link": "https://direkt.jacob.de/produkte/lenovo-thinkcentre-tiny-in-one-11gdpat1eu-artnr-6497673.html?utm_source=geizhals&utm_medium=cpc&utm_campaign=Preisvergleich&ref=103",
    "price": 304.5,
    "raw_specifications": {
        "Abmessungen (Breite x Tiefe x H\u00f6he)": "53.98 cm x 23.04 cm x 44.69 cm - mit Standfu\u00df (niedrigste Position)",
        "Abmessungen (Breite x Tiefe x H\u00f6he) - mit Standfu\u00df (niedrigste Position)": "53.98 cm x 23.04 cm x 44.69 cm",
        "Ausgangsleistung/Kanal": "2 Watt",
        "Besonderheiten": "72% NTSC (CIE 1931) Farbskala",
        "Bildschirmbeschichtung": "Blendfrei",
        "Blendentyp": "Flache Front",
        "Details zu Abmessungen & Gewicht": "Mit Standfu\u00df (niedrigste Position) - Breite: 53.98 cm - Tiefe: 23.04 cm - H\u00f6he: 44.69 cm - Gewicht: 6.66 kg  Mit Standfu\u00df (h\u00f6chste Position) - Breite: 53.98 cm - Tiefe: 23.04 cm - H\u00f6he: 59.69 cm - Gewicht: 6.66 kg  Ohne Fu\u00df - Breite: 53.98 cm - Tiefe: 6.53 cm - H\u00f6he: 36.76 cm - Gewicht: 3.61 kg",
        "Diagonalabmessung": "60.47 cm (23.8\")",
        "Display-Typ": "LED-hintergrundbeleuchteter LCD-Monitor / TFT-Aktivmatrix",
        "ENERGY STAR zertifiziert": "Ja",
        "ENERGY STAR-Version": "8.0",
        "EPEAT-kompatibel": "EPEAT Silver",
        "Eingangsanschl\u00fcsse": "DisplayPort",
        "Einstellungen der Anzeigeposition": "H\u00f6he, swivel, tilt",
        "Energie Effizienzklasse": "D",
        "Erforderliche Netzspannung": "Wechselstrom 120/230 V (50/60 Hz)",
        "Farbe": "Schwarz",
        "Ger\u00e4tetyp": "LED-hintergrundbeleuchteter LCD-Monitor - 60.47 cm (23.8\")",
        "Gewicht": "6.66 kg",
        "Helligkeit": "250 cd/m\u00b2",
        "Hintergrundbeleuchtungs-Technologie": "WLED",
        "Horizontaler Betrachtungswinkel": "+89 / -89",
        "H\u00f6heneinstellung": "150 mm",
        "Integrierte Peripherieger\u00e4te": "USB 3.1 Gen.1 Hub, 1080p Kamera mit Doppel-Mikrofon und Think Shutter",
        "Kennzeichnung": "UL, VESA FPMPMI, RoHS, WEEE, GREENGUARD, Energy-Related Products (ErP) Lot 5, TUV Rheinland Eye Comfort Certification",
        "Kontrast": "1000:1",
        "Leistungsaufnahme im Betrieb": "15 Watt",
        "Leistungsmerkmale": "Slot f\u00fcr Sicherheitsschloss (Kabelschloss getrennt erh\u00e4ltlich), Netzteil mit 88% Effizienz, Tiny Notebook-Dockingstation",
        "Lokalisierung": "Englisch / Europa",
        "Montagekit": "Optional",
        "Native Aufl\u00f6sung": "Full HD (1080p) 1920 x 1080",
        "Neigungswinkel": "-5/+30",
        "Pixelpitch": "0.2745 mm",
        "Ppi": "92.6",
        "Produktbeschreibung": "Lenovo ThinkCentre TIO24Gen4 - LED-Monitor - Full HD (1080p) - 60.47 cm (23.8\")",
        "Reaktionszeit": "14 ms (Standard); 6 ms; 4 ms (Overdrive)",
        "Schlosstyp zur Diebstahlsicherung": "Kensington Slot",
        "Schnittstellen": "DisplayPort/USB 3.1 Gen 1/Spannungsversorgung (unverlierbares 3-in-1-Kabel)  USB 3.1 Gen 1 Upstream  DisplayPort  USB 3.1 Gen 1 Downstream",
        "Schwenkwinkel": "90",
        "Seitenverh\u00e4ltnis": "16:9",
        "Sichtbare Bildfl\u00e4che": "60.47 cm (23.8\")",
        "Stromverbrauch im Standby-Modus": "0.5 Watt",
        "Typ": "Lautsprecher - Stereo",
        "Umweltschutzstandards": "ENERGY STAR-qualifiziert EPEAT Silver",
        "VESA-Halterung": "100 x 100 mm",
        "Vertikaler Betrachtungswinkel": "+89 / -89"
    },
    "raw_specifications_text": "Produktbeschreibung: Lenovo ThinkCentre TIO24Gen4 - LED-Monitor - Full HD (1080p) - 60.47 cm (23.8\")\nGer\u00e4tetyp: LED-hintergrundbeleuchteter LCD-Monitor - 60.47 cm (23.8\")\nLeistungsmerkmale: Slot f\u00fcr Sicherheitsschloss (Kabelschloss getrennt erh\u00e4ltlich), Netzteil mit 88% Effizienz, Tiny Notebook-Dockingstation\nEnergie Effizienzklasse: D\nSeitenverh\u00e4ltnis: 16:9\nNative Aufl\u00f6sung: Full HD (1080p) 1920 x 1080\nPixelpitch: 0.2745 mm\nHelligkeit: 250 cd/m\u00b2\nKontrast: 1000:1\nReaktionszeit: 14 ms (Standard); 6 ms; 4 ms (Overdrive)\nEingangsanschl\u00fcsse: DisplayPort\nEinstellungen der Anzeigeposition: H\u00f6he, swivel, tilt\nBildschirmbeschichtung: Blendfrei\nFarbe: Schwarz\nAbmessungen (Breite x Tiefe x H\u00f6he) - mit Standfu\u00df (niedrigste Position): 53.98 cm x 23.04 cm x 44.69 cm\nGewicht: 6.66 kg\nLokalisierung: Englisch / Europa\nUmweltschutzstandards: ENERGY STAR-qualifiziert EPEAT Silver\nKennzeichnung: UL, VESA FPMPMI, RoHS, WEEE, GREENGUARD, Energy-Related Products (ErP) Lot 5, TUV Rheinland Eye Comfort Certification\nDisplay-Typ: LED-hintergrundbeleuchteter LCD-Monitor / TFT-Aktivmatrix\nDiagonalabmessung: 60.47 cm (23.8\")\nSichtbare Bildfl\u00e4che: 60.47 cm (23.8\")\nIntegrierte Peripherieger\u00e4te: USB 3.1 Gen.1 Hub, 1080p Kamera mit Doppel-Mikrofon und Think Shutter\nPpi: 92.6\nHorizontaler Betrachtungswinkel: +89 / -89\nVertikaler Betrachtungswinkel: +89 / -89\nHintergrundbeleuchtungs-Technologie: WLED\nBlendentyp: Flache Front\nBesonderheiten: 72% NTSC (CIE 1931) Farbskala\nAbmessungen (Breite x Tiefe x H\u00f6he): 53.98 cm x 23.04 cm x 44.69 cm - mit Standfu\u00df (niedrigste Position)\nTyp: Lautsprecher - Stereo\nAusgangsleistung/Kanal: 2 Watt\nSchnittstellen: DisplayPort/USB 3.1 Gen 1/Spannungsversorgung (unverlierbares 3-in-1-Kabel)  USB 3.1 Gen 1 Upstream  DisplayPort  USB 3.1 Gen 1 Downstream\nNeigungswinkel: -5/+30\nSchwenkwinkel: 90\nH\u00f6heneinstellung: 150 mm\nVESA-Halterung: 100 x 100 mm\nMontagekit: Optional\nSchlosstyp zur Diebstahlsicherung: Kensington Slot\nErforderliche Netzspannung: Wechselstrom 120/230 V (50/60 Hz)\nLeistungsaufnahme im Betrieb: 15 Watt\nStromverbrauch im Standby-Modus: 0.5 Watt\nDetails zu Abmessungen & Gewicht: Mit Standfu\u00df (niedrigste Position) - Breite: 53.98 cm - Tiefe: 23.04 cm - H\u00f6he: 44.69 cm - Gewicht: 6.66 kg  Mit Standfu\u00df (h\u00f6chste Position) - Breite: 53.98 cm - Tiefe: 23.04 cm - H\u00f6he: 59.69 cm - Gewicht: 6.66 kg  Ohne Fu\u00df - Breite: 53.98 cm - Tiefe: 6.53 cm - H\u00f6he: 36.76 cm - Gewicht: 3.61 kg\nEPEAT-kompatibel: EPEAT Silver\nENERGY STAR zertifiziert: Ja\nENERGY STAR-Version: 8.0",
    "reference_file": "offer_reference_2466.json",
    "shop_name": "Jacob Elektronik direkt (AT)"
}