{
    "html_file": "offer_2363_12.html",
    "name": "Philips B-line 221B7QPJKEB, 21.5\"",
    "offer_link": "https://syswork.at/sw/index.html?open&mid=Artikel&artid=mon-1367&from=geizhals.at",
    "price": 213.0,
    "raw_specifications": {
        "3D": "Nein",
        "AC Eingangsfrequenz": "50/60 Hz",
        "AC Eingangsspannung": "100 - 240 V",
        "AMD FreeSync": "Nein",
        "Abnehmbarer Standfu\u00df": "Ja",
        "Anzahl DisplayPort Anschl\u00fcsse": "1.2",
        "Anzahl HDMI-Anschl\u00fcsse": "1.4",
        "Anzahl OSD-Sprachen": "21",
        "Anzahl VGA (D-Sub) Anschl\u00fcsse": "1",
        "Anzahl der Farben des Displays": "16,7 Millionen Farben",
        "Anzahl der Lautsprecher": "2",
        "Anzahl der nachgeschalteten Steckpl\u00e4tze vom Typ USB-A": "3",
        "Audioanschl\u00fcsse": "Ja",
        "Au\u00dfenverkleidungstyp": "Texturiert",
        "Beh\u00f6rdliche Zulassung": "CE Mark; FCC Class B; SEMKO; cETLus; CU-EAC; TUV Ergo; TUV/GS; WEEE; EPA; UKRAINIAN; ICES-003; SASO; KUCAS",
        "Betriebsanleitung": "Ja",
        "Betriebstemperatur": "0 - 40 \u00b0C",
        "Bild-Verbesserung": "SmartImage",
        "Bildschirmdiagonale": "54,6 cm (21.5 Zoll)",
        "Bildschirmdiagonale (cm)": "54,6 cm",
        "Bildschirmform": "Flach",
        "Bildschirmtechnologie": "LED",
        "Bildwinkel, horizontal": "178\u00b0",
        "Bildwinkel, vertikal": "178\u00b0",
        "Breite (ohne Standfu\u00df)": "49 cm",
        "DDC/CI": "Ja",
        "DVI Anschluss": "Nein",
        "Datenblatt": "Kein Datenblatt verf\u00fcgbar",
        "Digital horizontale Frequenz": "30 - 83 kHz",
        "Digital vertikale Frequenz": "56 - 76 Hz",
        "Display-Aufl\u00f6sung": "1920 x 1080 Pixel",
        "DisplayPorts-Version": "1.2",
        "Dynamisches Kontrastverh\u00e4ltnis Marketingbezeichnung": "SmartContrast",
        "Ein-/Ausschalter": "Ja",
        "Eingebaute Lautsprecher": "Ja",
        "Eingebautes Mikrofon": "Ja",
        "Empfohlene Aufl\u00f6sung": "1920 x 1080 @ 60 Hz",
        "Energieeffizienzklasse (SDR)": "E",
        "Energieeffizienzskala": "A bis G",
        "Energieverbrauch (SDR) pro 1.000 Stunden": "16 kWh",
        "Enth\u00e4lt nicht": "PVC/BFR, Quecksilber",
        "Flimmerfreie Technologie": "Ja",
        "Fu\u00dffarbe": "Schwarz",
        "Ger\u00e4tebreite (inkl. Fu\u00df)": "490 mm",
        "Ger\u00e4teh\u00f6he (inkl. Fu\u00df)": "473 mm",
        "Ger\u00e4tetiefe (inkl. Fu\u00df)": "220 mm",
        "Gewicht (mit St\u00e4nder)": "5,08 kg",
        "Gewicht (ohne St\u00e4nder)": "2,98 kg",
        "HD-Typ": "Full HD",
        "HDMI": "Ja",
        "HDMI-Version": "1.4",
        "Helligkeit (typisch)": "250 cd/m\u00b2",
        "Herstellerlink": "Philips",
        "Horizontaler Scanbereich": "30 - 83 kHz",
        "H\u00f6he (ohne Standfu\u00df)": "30,2 cm",
        "H\u00f6he bei Betrieb": "0 - 3658 m",
        "H\u00f6he bei Lagerung": "0 - 12192 m",
        "H\u00f6heneinstellung": "13 cm",
        "H\u00f6henverstellung": "Ja",
        "Integrierte Kamera": "Ja",
        "Integrierter USB-Hub": "Ja",
        "Kabelsperre-Slot": "Ja",
        "Komponentenvideo-Synchronisation": "Separate sync, Sync-on-green (SOG)",
        "Kontrastverh\u00e4ltnis": "1000:1",
        "Kontrastverh\u00e4ltnis (dynamisch)": "20000000:1",
        "Kopfh\u00f6rer-Anschluss": "3,5 mm",
        "Kopfh\u00f6rerausgang": "Ja",
        "Kopfh\u00f6rerausg\u00e4nge": "1",
        "LED-Anzeigen": "T\u00e4tigkeit, Stand-by",
        "Marktpositionierung": "Haus",
        "Maximale Bildwiederholrate": "60 Hz",
        "Megapixel (ca.)": "2 MP",
        "Men\u00fcsprachen": "Vereinfachtes Chinesisch, Traditionelles Chinesisch, Tschechisch, Deutsch, Niederl\u00e4ndisch, Englisch, Spanisch, Finnisch, Franz\u00f6sisch, Griechisch, Ungarisch, Italienisch, Japanisch, Koreanisch, Polnisch, Portugiesisch, Russisch, Schwedisch, T\u00fcrkisch, Ukrainisch",
        "Mitgelieferte Kabel": "VGA, DisplayPort, USB, Audio (3,5 mm), AC",
        "Mitgelieferte Software": "SmartControl",
        "Mittlere Betriebsdauer zwischen Ausf\u00e4llen (MTBF)": "70000 h",
        "NVIDIA G-SYNC": "Nein",
        "Nach Gebrauch recycelter Kunststoff": "85%",
        "Nachhaltigkeitszertifikate": "ENERGY STAR, TCO, RoHS",
        "Natives Seitenverh\u00e4ltnis": "16:9",
        "Neigungsverstellung": "Ja",
        "Neigungswinkelbereich": "-5 - 20\u00b0",
        "Netzteiltyp": "Intern",
        "On-Screen-Display (OSD)": "Ja",
        "PC Audio-Eingang": "Ja",
        "Paketgewicht": "7,05 kg",
        "Panel-Montage-Schnittstelle": "100 x 100 mm",
        "Panel-Typ": "IPS",
        "Pivot": "Ja",
        "Pivot Winkel": "90 - 90\u00b0",
        "Pixel Abstand": "0,248 x 0,248 mm",
        "Plug & Play": "Ja",
        "Produktfarbe": "Schwarz",
        "Produktlink": "Link",
        "RGB-Farbraum": "sRGB",
        "RMS-Leistung": "2 W",
        "Reaktionszeit": "5 ms",
        "Recycelbares Verpackungsmaterial": "100%",
        "Relative Luftfeuchtigkeit in Betrieb": "20 - 80%",
        "Schwenkbar": "Ja",
        "Schwenkwinkelbereich": "-175 - 175\u00b0",
        "Schwermetallfrei": "Hg (Quecksilber)",
        "Seitenverh\u00e4ltnis": "16:9",
        "Sichtbare Gr\u00f6\u00dfe (horizontal)": "47,6 cm",
        "Sichtbare Gr\u00f6\u00dfe (vertikal)": "26,8 cm",
        "Slot-Typ Kabelsperre": "Kensington",
        "Stromeingang": "Ja",
        "Stromverbrauch (PowerSave)": "10,7 W",
        "Stromverbrauch (Standardbetrieb)": "13,52 W",
        "Stromverbrauch (Standby)": "0,3 W",
        "St\u00e4nder enthalten": "Ja",
        "TV Tuner integriert": "Nein",
        "Temperaturbereich bei Lagerung": "-20 - 60 \u00b0C",
        "Tiefe (ohne Standfu\u00df)": "5,2 cm",
        "Touchscreen": "Nein",
        "Typ der Hintergrundbeleuchtung": "W-LED",
        "USB Power Delivery": "Ja",
        "USB-Hub-Version": "3.2 Gen 1 (3.1 Gen 1)",
        "Unterst\u00fctzte Grafik-Aufl\u00f6sungen": "1920 x 1080 (HD 1080)",
        "Unterst\u00fctzte Video-Modi": "1080p",
        "VESA-Halterung": "Ja",
        "Verpackungsart": "Box",
        "Verpackungsbreite": "552 mm",
        "Verpackungsh\u00f6he": "464 mm",
        "Verpackungstiefe": "187 mm",
        "Vertikaler Scanbereich": "56 - 76 Hz",
        "Vorderer Rahmen": "Schwarz",
        "Warentarifnummer (HS)": "85285210",
        "Zertifizierung": "CE Mark, FCC Class B, SEMKO, cETLus, CU-EAC, TUV Ergo, TUV/GS, WEEE, EPA, UKRAINIAN, ICES-003, SASO, KUCAS",
        "sRGB": "Ja"
    },
    "raw_specifications_text": "Bildschirmdiagonale: 54,6 cm (21.5 Zoll)\nDisplay-Aufl\u00f6sung: 1920 x 1080 Pixel\nNatives Seitenverh\u00e4ltnis: 16:9\nBildschirmtechnologie: LED\nTouchscreen: Nein\nHD-Typ: Full HD\nPanel-Typ: IPS\nBildschirmform: Flach\nKontrastverh\u00e4ltnis: 1000:1\nMaximale Bildwiederholrate: 60 Hz\nAnzahl der Farben des Displays: 16,7 Millionen Farben\nTyp der Hintergrundbeleuchtung: W-LED\nHelligkeit (typisch): 250 cd/m\u00b2\nReaktionszeit: 5 ms\nUnterst\u00fctzte Grafik-Aufl\u00f6sungen: 1920 x 1080 (HD 1080)\nUnterst\u00fctzte Video-Modi: 1080p\nSeitenverh\u00e4ltnis: 16:9\nKontrastverh\u00e4ltnis (dynamisch): 20000000:1\nDynamisches Kontrastverh\u00e4ltnis Marketingbezeichnung: SmartContrast\nBildwinkel, horizontal: 178\u00b0\nBildwinkel, vertikal: 178\u00b0\nPixel Abstand: 0,248 x 0,248 mm\nHorizontaler Scanbereich: 30 - 83 kHz\nVertikaler Scanbereich: 56 - 76 Hz\nSichtbare Gr\u00f6\u00dfe (horizontal): 47,6 cm\nSichtbare Gr\u00f6\u00dfe (vertikal): 26,8 cm\nDigital horizontale Frequenz: 30 - 83 kHz\nDigital vertikale Frequenz: 56 - 76 Hz\nBildschirmdiagonale (cm): 54,6 cm\nDDC/CI: Ja\nRGB-Farbraum: sRGB\n3D: Nein\nsRGB: Ja\nNVIDIA G-SYNC: Nein\nAMD FreeSync: Nein\nKomponentenvideo-Synchronisation: Separate sync, Sync-on-green (SOG)\nFlimmerfreie Technologie: Ja\nEingebaute Lautsprecher: Ja\nIntegrierte Kamera: Ja\nAnzahl der Lautsprecher: 2\nRMS-Leistung: 2 W\nMegapixel (ca.): 2 MP\nEingebautes Mikrofon: Ja\nMarktpositionierung: Haus\nProduktfarbe: Schwarz\nVorderer Rahmen: Schwarz\nAbnehmbarer Standfu\u00df: Ja\nFu\u00dffarbe: Schwarz\nSchwermetallfrei: Hg (Quecksilber)\nZertifizierung: CE Mark, FCC Class B, SEMKO, cETLus, CU-EAC, TUV Ergo, TUV/GS, WEEE, EPA, UKRAINIAN, ICES-003, SASO, KUCAS\nIntegrierter USB-Hub: Ja\nHDMI: Ja\nKopfh\u00f6rerausgang: Ja\nUSB-Hub-Version: 3.2 Gen 1 (3.1 Gen 1)\nAnzahl der nachgeschalteten Steckpl\u00e4tze vom Typ USB-A: 3\nUSB Power Delivery: Ja\nAnzahl VGA (D-Sub) Anschl\u00fcsse: 1\nDVI Anschluss: Nein\nAnzahl HDMI-Anschl\u00fcsse: 1.4\nHDMI-Version: 1.4\nAnzahl DisplayPort Anschl\u00fcsse: 1.2\nDisplayPorts-Version: 1.2\nAudioanschl\u00fcsse: Ja\nKopfh\u00f6rerausg\u00e4nge: 1\nKopfh\u00f6rer-Anschluss: 3,5 mm\nPC Audio-Eingang: Ja\nStromeingang: Ja\nVESA-Halterung: Ja\nKabelsperre-Slot: Ja\nH\u00f6henverstellung: Ja\nPanel-Montage-Schnittstelle: 100 x 100 mm\nSlot-Typ Kabelsperre: Kensington\nH\u00f6heneinstellung: 13 cm\nPivot: Ja\nPivot Winkel: 90 - 90\u00b0\nSchwenkbar: Ja\nSchwenkwinkelbereich: -175 - 175\u00b0\nNeigungswinkelbereich: -5 - 20\u00b0\nOn-Screen-Display (OSD): Ja\nMen\u00fcsprachen: Vereinfachtes Chinesisch, Traditionelles Chinesisch, Tschechisch, Deutsch, Niederl\u00e4ndisch, Englisch, Spanisch, Finnisch, Franz\u00f6sisch, Griechisch, Ungarisch, Italienisch, Japanisch, Koreanisch, Polnisch, Portugiesisch, Russisch, Schwedisch, T\u00fcrkisch, Ukrainisch\nAnzahl OSD-Sprachen: 21\nPlug & Play: Ja\nLED-Anzeigen: T\u00e4tigkeit, Stand-by\nNeigungsverstellung: Ja\nEnergieeffizienzklasse (SDR): E\nEnergieverbrauch (SDR) pro 1.000 Stunden: 16 kWh\nStromverbrauch (Standardbetrieb): 13,52 W\nStromverbrauch (Standby): 0,3 W\nStromverbrauch (PowerSave): 10,7 W\nAC Eingangsspannung: 100 - 240 V\nAC Eingangsfrequenz: 50/60 Hz\nNetzteiltyp: Intern\nEnergieeffizienzskala: A bis G\nBetriebstemperatur: 0 - 40 \u00b0C\nTemperaturbereich bei Lagerung: -20 - 60 \u00b0C\nRelative Luftfeuchtigkeit in Betrieb: 20 - 80%\nH\u00f6he bei Betrieb: 0 - 3658 m\nH\u00f6he bei Lagerung: 0 - 12192 m\nSt\u00e4nder enthalten: Ja\nMitgelieferte Kabel: VGA, DisplayPort, USB, Audio (3,5 mm), AC\nBetriebsanleitung: Ja\nMitgelieferte Software: SmartControl\nGer\u00e4tebreite (inkl. Fu\u00df): 490 mm\nGer\u00e4tetiefe (inkl. Fu\u00df): 220 mm\nGer\u00e4teh\u00f6he (inkl. Fu\u00df): 473 mm\nGewicht (mit St\u00e4nder): 5,08 kg\nBreite (ohne Standfu\u00df): 49 cm\nTiefe (ohne Standfu\u00df): 5,2 cm\nH\u00f6he (ohne Standfu\u00df): 30,2 cm\nGewicht (ohne St\u00e4nder): 2,98 kg\nVerpackungsbreite: 552 mm\nVerpackungstiefe: 187 mm\nVerpackungsh\u00f6he: 464 mm\nPaketgewicht: 7,05 kg\nVerpackungsart: Box\nNachhaltigkeitszertifikate: ENERGY STAR, TCO, RoHS\nEnth\u00e4lt nicht: PVC/BFR, Quecksilber\nNach Gebrauch recycelter Kunststoff: 85%\nWarentarifnummer (HS): 85285210\nEin-/Ausschalter: Ja\nTV Tuner integriert: Nein\nAu\u00dfenverkleidungstyp: Texturiert\nRecycelbares Verpackungsmaterial: 100%\nMittlere Betriebsdauer zwischen Ausf\u00e4llen (MTBF): 70000 h\nEmpfohlene Aufl\u00f6sung: 1920 x 1080 @ 60 Hz\nBild-Verbesserung: SmartImage\nBeh\u00f6rdliche Zulassung: CE Mark; FCC Class B; SEMKO; cETLus; CU-EAC; TUV Ergo; TUV/GS; WEEE; EPA; UKRAINIAN; ICES-003; SASO; KUCAS\nDatenblatt: Kein Datenblatt verf\u00fcgbar\nProduktlink: Link\nHerstellerlink: Philips",
    "reference_file": "offer_reference_2363.json",
    "shop_name": "Syswork"
}