{
    "html_file": "offer_1306_1.html",
    "name": "AOC 24B2XDM, 23.8\"",
    "offer_link": "https://direkt.jacob.de/produkte/aoc-b2-24b2xdm-24b2xdm-artnr-7024355.html?utm_source=geizhals&utm_medium=cpc&utm_campaign=Preisvergleich&ref=103",
    "price": 98.78,
    "raw_specifications": {
        "Abmessungen (Breite x Tiefe x H\u00f6he)": "54.01 cm x 18.68 cm x 41.98 cm - mit Fu\u00df",
        "Abmessungen (Breite x Tiefe x H\u00f6he) - mit Fu\u00df": "54.01 cm x 18.68 cm x 41.98 cm",
        "Besonderheiten": "Flimmerfreie Technologie, breiter Betrachtungswinkel, Low Blue Light-Technologie, an 3 Seiten ohne Blende",
        "Bildschirmbeschichtung": "Blendfrei, 3H Hard Coating",
        "Bildschirmtyp": "VA",
        "Details zu Abmessungen & Gewicht": "Mit Fu\u00df - Breite: 54.01 cm - Tiefe: 18.68 cm - H\u00f6he: 41.98 cm - Gewicht: 2.7 kg  Ohne Fu\u00df - Breite: 53.947 cm - Tiefe: 3.76 cm - H\u00f6he: 32.094 cm",
        "Diagonalabmessung": "60.5 cm (23.8\")",
        "Display-Typ": "LED-hintergrundbeleuchteter LCD-Monitor / TFT-Aktivmatrix",
        "Eingangsanschl\u00fcsse": "DVI, VGA",
        "Eingangsspannung": "Wechselstrom 120/230 V (50/60 Hz)",
        "Einstellungen der Anzeigeposition": "Neigung",
        "Energie Effizienzklasse": "Klasse F",
        "Enthaltene Kabel": "1 x VGA-Kabel - 1.5 m",
        "Farbe": "Schwarz",
        "Farbunterst\u00fctzung": "16,7 Millionen Farben",
        "Ger\u00e4tetyp": "LED-hintergrundbeleuchteter LCD-Monitor - 60.5 cm (23.8\")",
        "Gewicht": "2.7 kg",
        "Helligkeit": "250 cd/m\u00b2",
        "Hintergrundbeleuchtungs-Technologie": "WLED",
        "Horizontaler Betrachtungswinkel": "178",
        "Kennzeichnung": "FCC, EAC",
        "Kontrast": "3000:1 / 20000000:1 (dynamisch)",
        "Leistungsaufnahme im Ein-Zustand": "21 W",
        "Native Aufl\u00f6sung": "Full HD (1080p) 1920 x 1080 bei 75 Hz",
        "Neigungswinkel": "-5/+20",
        "OSD-Sprachen": "Multilingual",
        "Produktbeschreibung": "AOC 24B2XDM - B2 Series - LED-Monitor - Full HD (1080p) - 60.5 cm (23.8\")",
        "Reaktionszeit": "4 ms (gray-to-gray)",
        "Schnittstellen": "VGA  DVI",
        "Seitenverh\u00e4ltnis": "16:9",
        "Spannung": "Wechselstrom 120/230 V (50/60 Hz)",
        "Stromverbrauch (Aus-Modus)": "0.3 Watt",
        "Stromverbrauch SDR (eingeschaltet)": "21 kWh/1.000 h",
        "Stromverbrauch im Standby-Modus": "0.3 Watt",
        "Transportbreite": "49.2 cm",
        "Transportgewicht": "4.5 kg",
        "Transporth\u00f6he": "61.4 cm",
        "Transporttiefe": "13.1 cm",
        "VESA-Halterung": "100 x 100 mm",
        "Vertikaler Betrachtungswinkel": "178"
    },
    "raw_specifications_text": "Produktbeschreibung: AOC 24B2XDM - B2 Series - LED-Monitor - Full HD (1080p) - 60.5 cm (23.8\")\nGer\u00e4tetyp: LED-hintergrundbeleuchteter LCD-Monitor - 60.5 cm (23.8\")\nEnergie Effizienzklasse: Klasse F\nLeistungsaufnahme im Ein-Zustand: 21 W\nBildschirmtyp: VA\nSeitenverh\u00e4ltnis: 16:9\nNative Aufl\u00f6sung: Full HD (1080p) 1920 x 1080 bei 75 Hz\nHelligkeit: 250 cd/m\u00b2\nKontrast: 3000:1 / 20000000:1 (dynamisch)\nReaktionszeit: 4 ms (gray-to-gray)\nFarbunterst\u00fctzung: 16,7 Millionen Farben\nEingangsanschl\u00fcsse: DVI, VGA\nEinstellungen der Anzeigeposition: Neigung\nBildschirmbeschichtung: Blendfrei, 3H Hard Coating\nSpannung: Wechselstrom 120/230 V (50/60 Hz)\nFarbe: Schwarz\nAbmessungen (Breite x Tiefe x H\u00f6he) - mit Fu\u00df: 54.01 cm x 18.68 cm x 41.98 cm\nGewicht: 2.7 kg\nKennzeichnung: FCC, EAC\nDisplay-Typ: LED-hintergrundbeleuchteter LCD-Monitor / TFT-Aktivmatrix\nDiagonalabmessung: 60.5 cm (23.8\")\nHorizontaler Betrachtungswinkel: 178\nVertikaler Betrachtungswinkel: 178\nHintergrundbeleuchtungs-Technologie: WLED\nOSD-Sprachen: Multilingual\nBesonderheiten: Flimmerfreie Technologie, breiter Betrachtungswinkel, Low Blue Light-Technologie, an 3 Seiten ohne Blende\nAbmessungen (Breite x Tiefe x H\u00f6he): 54.01 cm x 18.68 cm x 41.98 cm - mit Fu\u00df\nSchnittstellen: VGA  DVI\nNeigungswinkel: -5/+20\nVESA-Halterung: 100 x 100 mm\nEnthaltene Kabel: 1 x VGA-Kabel - 1.5 m\nEingangsspannung: Wechselstrom 120/230 V (50/60 Hz)\nStromverbrauch SDR (eingeschaltet): 21 kWh/1.000 h\nStromverbrauch im Standby-Modus: 0.3 Watt\nStromverbrauch (Aus-Modus): 0.3 Watt\nDetails zu Abmessungen & Gewicht: Mit Fu\u00df - Breite: 54.01 cm - Tiefe: 18.68 cm - H\u00f6he: 41.98 cm - Gewicht: 2.7 kg  Ohne Fu\u00df - Breite: 53.947 cm - Tiefe: 3.76 cm - H\u00f6he: 32.094 cm\nTransportbreite: 49.2 cm\nTransporttiefe: 13.1 cm\nTransporth\u00f6he: 61.4 cm\nTransportgewicht: 4.5 kg",
    "reference_file": "offer_reference_1306.json",
    "shop_name": "Jacob Elektronik direkt (AT)"
}