{
    "html_file": "offer_1609_3.html",
    "name": "Acer ConceptD CP3 CP3271UVbmiipruzx, 27\"",
    "offer_link": "https://www.alternate.at/Acer/ConceptD-CP3271UV-LED-Monitor/html/product/1767226?partner=AtGeizhalsat&campaign=Monitor/Acer/1767226",
    "price": 495.0,
    "raw_specifications": {
        "": "VESA DisplayHDR Standard",
        "Abmessungen": "Breite: 61,4 cm x H\u00f6he: 61,4 cm x Tiefe/L\u00e4nge: 26,9 cm",
        "Anschl\u00fcsse": "2x HDMI-Eingang, (HDMI-Version: 2.0), 2x DisplayPort-Eingang, (DisplayPort-Version: 1.4), 1x Kopfh\u00f6rer-Ausgang, 4x USB-A-3.2 Gen 1 (5 Gbit/s), 1x USB-C",
        "Bild": "Glaretyp",
        "Bildschirmaufl\u00f6sung": "2.560 x 1.440 Pixel",
        "Bildschirmdiagonale": "68,6 cm (27 Zoll)",
        "EAN": "4710886179054",
        "Energieeffizienzklasse (HDR)": "G (A - G)",
        "Energieeffizienzklasse (SDR)": "G (A - G)",
        "Energieverbauch pro 1000 Stunden (HDR)": "42 kWh",
        "Energieverbauch pro 1000 Stunden (SDR)": "31 kWh",
        "Ergonomie": "Typ",
        "Farbe": "schwarz",
        "Features": "65 Watt USB-C Power Delivery",
        "Frequenz": "Vertikal",
        "Gewicht": "6,5 kg",
        "Hersteller-Nr.": "UM.HC1EE.V05",
        "Lautsprecher": "2 Lautsprecher",
        "Leistungsaufnahme im Bereitschafts- und Aus-Zustand": "0,3 Watt",
        "Leistungsaufnahme im Ein-Zustand bei Standard-Dynamikumfang (SDR)": "31,3 Watt",
        "Leistungsaufnahme im Ein-Zustand bei hohem Dynamikumfang (HDR)": "42.4 Watt",
        "Standards": "Video",
        "Stromversorgung": "Eco-Off",
        "Typ": "LED-Monitor",
        "Wandhalterung": "VESA kompatibel (100 x 100 mm)",
        "Zubeh\u00f6r": "Vorhanden"
    },
    "raw_specifications_text": "Energieeffizienzklasse (SDR): G (A - G)\nEnergieverbauch pro 1000 Stunden (SDR): 31 kWh\nEnergieeffizienzklasse (HDR): G (A - G)\nEnergieverbauch pro 1000 Stunden (HDR): 42 kWh\nLeistungsaufnahme im Ein-Zustand bei Standard-Dynamikumfang (SDR): 31,3 Watt\nLeistungsaufnahme im Ein-Zustand bei hohem Dynamikumfang (HDR): 42.4 Watt\nLeistungsaufnahme im Bereitschafts- und Aus-Zustand: 0,3 Watt\nBildschirmdiagonale: 68,6 cm (27 Zoll)\nBildschirmaufl\u00f6sung: 2.560 x 1.440 Pixel\nTyp: LED-Monitor\nFarbe: schwarz\nEAN: 4710886179054\nHersteller-Nr.: UM.HC1EE.V05\nBild: Glaretyp\n: VESA DisplayHDR Standard\nFrequenz: Vertikal\nAnschl\u00fcsse: 2x HDMI-Eingang, (HDMI-Version: 2.0), 2x DisplayPort-Eingang, (DisplayPort-Version: 1.4), 1x Kopfh\u00f6rer-Ausgang, 4x USB-A-3.2 Gen 1 (5 Gbit/s), 1x USB-C\nErgonomie: Typ\nStromversorgung: Eco-Off\nLautsprecher: 2 Lautsprecher\nStandards: Video\nWandhalterung: VESA kompatibel (100 x 100 mm)\nFeatures: 65 Watt USB-C Power Delivery\nZubeh\u00f6r: Vorhanden\nAbmessungen: Breite: 61,4 cm x H\u00f6he: 61,4 cm x Tiefe/L\u00e4nge: 26,9 cm\nGewicht: 6,5 kg",
    "reference_file": "offer_reference_1609.json",
    "shop_name": "Alternate.at"
}