{
    "html_file": "offer_865_3.html",
    "name": "ASUS VA27EQSB, 27\"",
    "offer_link": "https://www.alternate.at/ASUS/VA27EQSB-LED-Monitor/html/product/1861455?partner=AtGeizhalsat&campaign=Monitor/ASUS/1861455",
    "price": 193.9,
    "raw_specifications": {
        "": "Kensington-Schloss",
        "Abmessungen": "Breite: 61,33 cm x H\u00f6he: 52,38 cm x Tiefe/L\u00e4nge: 22,63 cm",
        "Anschl\u00fcsse": "1x HDMI-Eingang, (HDMI-Version: 1.4), 1x DisplayPort-Eingang, (DisplayPort-Version: 1.2), 1x VGA-Eingang, 1x Kopfh\u00f6rer-Ausgang, 2x USB-A-3.2 Gen 1 (5 Gbit/s)",
        "Bild": "Format",
        "Bildschirmaufl\u00f6sung": "1.920 x 1.080 Pixel",
        "Bildschirmdiagonale": "69 cm (27 Zoll)",
        "EAN": "4711081557272",
        "Energieeffizienzklasse (SDR)": "E (A - G)",
        "Energieverbauch pro 1000 Stunden (SDR)": "19 kWh",
        "Ergonomie": "Typ",
        "Farbe": "schwarz",
        "Features": "Flimmerfreie Technologie, Low-Blue-Light-Technologie",
        "Frequenz": "Vertikal",
        "Gewicht": "6 kg",
        "Hersteller-Nr.": "90LM0559-B01170",
        "Lautsprecher": "2 Lautsprecher",
        "Leistungsaufnahme im Bereitschafts- und Aus-Zustand": "0,2 Watt",
        "Leistungsaufnahme im Ein-Zustand bei Standard-Dynamikumfang (SDR)": "18,5 Watt",
        "Stromversorgung": "Eco-Off",
        "Typ": "LED-Monitor",
        "Wandhalterung": "VESA kompatibel (100 x 100 mm)",
        "Zubeh\u00f6r": "Vorhanden"
    },
    "raw_specifications_text": "Energieeffizienzklasse (SDR): E (A - G)\nEnergieverbauch pro 1000 Stunden (SDR): 19 kWh\nLeistungsaufnahme im Ein-Zustand bei Standard-Dynamikumfang (SDR): 18,5 Watt\nLeistungsaufnahme im Bereitschafts- und Aus-Zustand: 0,2 Watt\nBildschirmdiagonale: 69 cm (27 Zoll)\nBildschirmaufl\u00f6sung: 1.920 x 1.080 Pixel\nTyp: LED-Monitor\nFarbe: schwarz\nEAN: 4711081557272\nHersteller-Nr.: 90LM0559-B01170\nBild: Format\n: Kensington-Schloss\nFrequenz: Vertikal\nAnschl\u00fcsse: 1x HDMI-Eingang, (HDMI-Version: 1.4), 1x DisplayPort-Eingang, (DisplayPort-Version: 1.2), 1x VGA-Eingang, 1x Kopfh\u00f6rer-Ausgang, 2x USB-A-3.2 Gen 1 (5 Gbit/s)\nErgonomie: Typ\nStromversorgung: Eco-Off\nLautsprecher: 2 Lautsprecher\nWandhalterung: VESA kompatibel (100 x 100 mm)\nFeatures: Flimmerfreie Technologie, Low-Blue-Light-Technologie\nZubeh\u00f6r: Vorhanden\nAbmessungen: Breite: 61,33 cm x H\u00f6he: 52,38 cm x Tiefe/L\u00e4nge: 22,63 cm\nGewicht: 6 kg",
    "reference_file": "offer_reference_865.json",
    "shop_name": "Alternate.at"
}