{
    "html_file": "offer_334_0.html",
    "name": "MSI Modern MD272QP, 27\"",
    "offer_link": "https://www.proshop.at/Bildschirm/MSI-27-Bildschirm-Modern-MD272QP-Black-4-ms-AMD-FreeSync/3126865?utm_source=geizhals&utm_medium=cpc&utm_campaign=pricesite",
    "price": 341.04,
    "raw_specifications": {
        "Abmessungen (Breite x Tiefe x H\u00f6he)": "61.3 cm x 20 cm x 40.1 cm - mit Fu\u00df",
        "Abmessungen (Breite x Tiefe x H\u00f6he) - mit Fu\u00df": "61.3 cm x 20 cm x 40.1 cm",
        "Adaptive-Sync Technologie": "AMD FreeSync",
        "Besonderheiten": "HDCP, rahmeloses Blendendesign",
        "Bildschirmbeschichtung": "Blendfrei",
        "Bildschirmtyp": "IPS",
        "Details zu Abmessungen & Gewicht": "Mit Fu\u00df - Breite: 61.3 cm - Tiefe: 20 cm - H\u00f6he: 40.1 cm  Ohne Fu\u00df - Breite: 61.3 cm - Tiefe: 7.2 cm - H\u00f6he: 36.2 cm",
        "Diagonalabmessung": "69 cm (27\")",
        "Display-Typ": "LED-hintergrundbeleuchteter LCD-Monitor / TFT-Aktivmatrix",
        "EAN": "4719072944292",
        "Eingangsanschl\u00fcsse": "HDMI, DisplayPort, USB-C",
        "Eingangsspannung": "Wechselstrom 100-240 V (50/60 Hz)",
        "Einstellungen der Anzeigeposition": "H\u00f6he, Pivot (Rotation), Drehung, Neigung",
        "Energie Effizienzklasse": "Klasse F",
        "Enthaltene Kabel": "HDMI-Kabel  USB-Kabel Typ A auf Typ B",
        "Farbe": "Schwarz",
        "Farbunterst\u00fctzung": "16,7 Millionen Farben (8-Bit)",
        "Ger\u00e4tetyp": "LED-hintergrundbeleuchteter LCD-Monitor - 69 cm (27\")",
        "Helligkeit": "250 cd/m\u00b2",
        "Hersteller": "MSI",
        "Hintergrundbeleuchtungs-Technologie": "LED-Hintergrundbeleuchtung",
        "Horizontale Bildwiederholrate": "30 - 112 kHz",
        "Horizontaler Betrachtungswinkel": "178",
        "H\u00f6heneinstellung": "110 mm",
        "Integrierte Peripherieger\u00e4te": "2-Port USB 2.0 Hub",
        "Kontrast": "1000:1 / 100000000:1 (dynamisch)",
        "Leistungsmerkmale": "Slot f\u00fcr Sicherheitsschloss (Kabelschloss getrennt erh\u00e4ltlich)",
        "Modell": "MODERN MD272QP",
        "Native Aufl\u00f6sung": "WQHD 2560 x 1440 bei 75 Hz",
        "Neigungswinkel": "-5/+20",
        "Pixelpitch": "0.2331 mm",
        "Produktbeschreibung": "MSI Modern MD272QP - LED-Monitor - 69 cm (27\")",
        "Reaktionszeit": "4 ms (gray-to-gray), 14 ms (tr - tf)",
        "Rotationswinkel": "180",
        "Schlosstyp zur Diebstahlsicherung": "Kensington Slot",
        "Schnittstellen": "HDMI  DisplayPort 1.2  USB-C/DisplayPort Alt Mode mit Spannungsversorgung (bis zu 65 W)  Kopfh\u00f6rer  2 x USB 2.0 Downstream  USB 2.0 Upstream",
        "Schwenkwinkel": "60",
        "Seitenverh\u00e4ltnis": "16:9",
        "Spannung": "Wechselstrom 100-240 V (50/60 Hz)",
        "Stromverbrauch SDR (eingeschaltet)": "26 kWh/1.000 h",
        "Typ": "Lautsprecher - Stereo",
        "VESA-Halterung": "75 x 75 mm",
        "Vertikale Bildwiederholrate": "48 - 75 Hz",
        "Vertikaler Betrachtungswinkel": "178",
        "Waren-Nr.": "3126865",
        "Zubeh\u00f6r im Lieferumfang": "Schrauben, Netzteil",
        "Zum Hersteller": "www.msi.com/"
    },
    "raw_specifications_text": "Hersteller: MSI\nWaren-Nr.: 3126865\nModell: MODERN MD272QP\nEAN: 4719072944292\nZum Hersteller: www.msi.com/\nProduktbeschreibung: MSI Modern MD272QP - LED-Monitor - 69 cm (27\")\nGer\u00e4tetyp: LED-hintergrundbeleuchteter LCD-Monitor - 69 cm (27\")\nEnergie Effizienzklasse: Klasse F\nAdaptive-Sync Technologie: AMD FreeSync\nLeistungsmerkmale: Slot f\u00fcr Sicherheitsschloss (Kabelschloss getrennt erh\u00e4ltlich)\nBildschirmtyp: IPS\nSeitenverh\u00e4ltnis: 16:9\nNative Aufl\u00f6sung: WQHD 2560 x 1440 bei 75 Hz\nPixelpitch: 0.2331 mm\nHelligkeit: 250 cd/m\u00b2\nKontrast: 1000:1 / 100000000:1 (dynamisch)\nReaktionszeit: 4 ms (gray-to-gray), 14 ms (tr - tf)\nFarbunterst\u00fctzung: 16,7 Millionen Farben (8-Bit)\nEingangsanschl\u00fcsse: HDMI, DisplayPort, USB-C\nEinstellungen der Anzeigeposition: H\u00f6he, Pivot (Rotation), Drehung, Neigung\nBildschirmbeschichtung: Blendfrei\nSpannung: Wechselstrom 100-240 V (50/60 Hz)\nFarbe: Schwarz\nAbmessungen (Breite x Tiefe x H\u00f6he) - mit Fu\u00df: 61.3 cm x 20 cm x 40.1 cm\nDisplay-Typ: LED-hintergrundbeleuchteter LCD-Monitor / TFT-Aktivmatrix\nDiagonalabmessung: 69 cm (27\")\nIntegrierte Peripherieger\u00e4te: 2-Port USB 2.0 Hub\nVertikale Bildwiederholrate: 48 - 75 Hz\nHorizontale Bildwiederholrate: 30 - 112 kHz\nHorizontaler Betrachtungswinkel: 178\nVertikaler Betrachtungswinkel: 178\nHintergrundbeleuchtungs-Technologie: LED-Hintergrundbeleuchtung\nBesonderheiten: HDCP, rahmeloses Blendendesign\nAbmessungen (Breite x Tiefe x H\u00f6he): 61.3 cm x 20 cm x 40.1 cm - mit Fu\u00df\nTyp: Lautsprecher - Stereo\nSchnittstellen: HDMI  DisplayPort 1.2  USB-C/DisplayPort Alt Mode mit Spannungsversorgung (bis zu 65 W)  Kopfh\u00f6rer  2 x USB 2.0 Downstream  USB 2.0 Upstream\nNeigungswinkel: -5/+20\nSchwenkwinkel: 60\nRotationswinkel: 180\nH\u00f6heneinstellung: 110 mm\nVESA-Halterung: 75 x 75 mm\nZubeh\u00f6r im Lieferumfang: Schrauben, Netzteil\nEnthaltene Kabel: HDMI-Kabel  USB-Kabel Typ A auf Typ B\nSchlosstyp zur Diebstahlsicherung: Kensington Slot\nEingangsspannung: Wechselstrom 100-240 V (50/60 Hz)\nStromverbrauch SDR (eingeschaltet): 26 kWh/1.000 h\nDetails zu Abmessungen & Gewicht: Mit Fu\u00df - Breite: 61.3 cm - Tiefe: 20 cm - H\u00f6he: 40.1 cm  Ohne Fu\u00df - Breite: 61.3 cm - Tiefe: 7.2 cm - H\u00f6he: 36.2 cm",
    "reference_file": "offer_reference_334.json",
    "shop_name": "Proshop.at"
}