{
    "html_file": "offer_1806_13.html",
    "name": "Philips E-line 345E2AE, 34\"",
    "offer_link": "https://www.e-tec.at/details.php?artnr=306613",
    "price": 370.55,
    "raw_specifications": {
        "Abmessungen (BxHxT)": "817x491x235mm (mit Standfu\u00df),  817x365x49mm (ohne Standfu\u00df)",
        "Adaptive Sync": "Ja",
        "Anschl\u00fcsse - DisplayPort 1.2": "1",
        "Anschl\u00fcsse - HDMI 2.0": "2",
        "Anwendung": "station\u00e4r",
        "Audio": "Lautsprecher (2x 3W),  1x Line-In,  1x Line-Out",
        "Aufl\u00f6sung": "3440x1440",
        "Beschichtung": "matt (non-glare),  H\u00e4rtegrad 3H",
        "Besonderheiten": "Slim Bezel,  Steuerkreuz,  Picture-in-Picture,  Sicherheitsschloss (Kensington),  Philips SmartImage",
        "Bildwiederholfrequenz": "75Hz",
        "Blickwinkel": "178\u00b0/178\u00b0",
        "Diagonale": "34\"/86.4cm",
        "Energieeffizienzklasse alt (A+++ bis D)": "B",
        "Energieeffizienzklasse alt (A+++ bis G)": "B",
        "Energieverbrauch SDR": "39kWh/1000h",
        "Ergonomie": "100mm (h\u00f6henverstellbar),  N/A (Pivot),  N/A (drehbar),  +20\u00b0/-5\u00b0 (neigbar),  keine Angabe (Schr\u00e4glage)",
        "FRC": "unbekannt",
        "Farbe": "schwarz",
        "Farbraum - sRGB": "120.3%",
        "Farbtiefe": "8bit (16.7 Mio. Farben)",
        "Form": "gerade (flat)",
        "Gewicht": "7.61kg (mit Standfu\u00df),  5.65kg (ohne Standfu\u00df)",
        "HDR": "N/A",
        "Helligkeit": "300cd/m\u00b2",
        "Herstellergarantie": "zwei Jahre",
        "Hintergrundbeleuchtung": "White-LED,  flicker-free,  Blaulichtfilter",
        "Jahresverbrauch alt (A+++ bis D)": "61.32kWh",
        "Jahresverbrauch alt (A+++ bis G)": "61.32kWh",
        "Kontrast - statisch": "1.000:1",
        "Lautsprecher": "Ja",
        "Leistungsaufnahme": "keine Angabe (maximal),  37.6W (typisch),  42W (Energielabel alt A+++ bis G),  0.35W (Standby)",
        "Panel": "IPS",
        "Reaktionszeit - GtG": "4ms",
        "Screen-to-Body-Ratio": "89.1% (berechnet)",
        "Seitenverh\u00e4ltnis": "21:9",
        "Signalfrequenz": "30-120kHz (horizontal),  48-75Hz (vertikal)",
        "Stromversorgung": "DC-In (externes Netzteil)",
        "USB-Hub In": "N/A",
        "USB-Hub Out": "N/A",
        "USB-Schreibweise": "Link",
        "Unsch\u00e4rfereduktionsfunktion": "N/A",
        "VESA": "100x100 (belegt)",
        "VRR (Variable Refresh Rate)": "Adaptive Sync",
        "Weitere Anschl\u00fcsse": "N/A"
    },
    "raw_specifications_text": "Abmessungen (BxHxT): 817x491x235mm (mit Standfu\u00df),  817x365x49mm (ohne Standfu\u00df)\nAdaptive Sync: Ja\nAnschl\u00fcsse - DisplayPort 1.2: 1\nAnschl\u00fcsse - HDMI 2.0: 2\nAnwendung: station\u00e4r\nAudio: Lautsprecher (2x 3W),  1x Line-In,  1x Line-Out\nAufl\u00f6sung: 3440x1440\nBeschichtung: matt (non-glare),  H\u00e4rtegrad 3H\nBesonderheiten: Slim Bezel,  Steuerkreuz,  Picture-in-Picture,  Sicherheitsschloss (Kensington),  Philips SmartImage\nBildwiederholfrequenz: 75Hz\nBlickwinkel: 178\u00b0/178\u00b0\nDiagonale: 34\"/86.4cm\nEnergieeffizienzklasse alt (A+++ bis D): B\nEnergieeffizienzklasse alt (A+++ bis G): B\nEnergieverbrauch SDR: 39kWh/1000h\nErgonomie: 100mm (h\u00f6henverstellbar),  N/A (Pivot),  N/A (drehbar),  +20\u00b0/-5\u00b0 (neigbar),  keine Angabe (Schr\u00e4glage)\nFarbe: schwarz\nFarbraum - sRGB: 120.3%\nFarbtiefe: 8bit (16.7 Mio. Farben)\nForm: gerade (flat)\nFRC: unbekannt\nGewicht: 7.61kg (mit Standfu\u00df),  5.65kg (ohne Standfu\u00df)\nHDR: N/A\nHelligkeit: 300cd/m\u00b2\nHerstellergarantie: zwei Jahre\nHintergrundbeleuchtung: White-LED,  flicker-free,  Blaulichtfilter\nJahresverbrauch alt (A+++ bis D): 61.32kWh\nJahresverbrauch alt (A+++ bis G): 61.32kWh\nKontrast - statisch: 1.000:1\nLautsprecher: Ja\nLeistungsaufnahme: keine Angabe (maximal),  37.6W (typisch),  42W (Energielabel alt A+++ bis G),  0.35W (Standby)\nPanel: IPS\nReaktionszeit - GtG: 4ms\nScreen-to-Body-Ratio: 89.1% (berechnet)\nSeitenverh\u00e4ltnis: 21:9\nSignalfrequenz: 30-120kHz (horizontal),  48-75Hz (vertikal)\nStromversorgung: DC-In (externes Netzteil)\nUnsch\u00e4rfereduktionsfunktion: N/A\nUSB-Hub In: N/A\nUSB-Hub Out: N/A\nUSB-Schreibweise: Link\nVESA: 100x100 (belegt)\nVRR (Variable Refresh Rate): Adaptive Sync\nWeitere Anschl\u00fcsse: N/A",
    "reference_file": "offer_reference_1806.json",
    "shop_name": "e-tec.at"
}