{
    "html_file": "offer_785_25.html",
    "name": "LG 24BP750C-B, 23.8\"",
    "offer_link": "https://www.alternate.at/LG/24BP750C-B-LED-Monitor/html/product/1822239?partner=AtGeizhalsat&campaign=Monitor/LG/1822239",
    "price": 148.9,
    "raw_specifications": {
        "": "Mikrofon, Webcam",
        "Anschl\u00fcsse": "1x HDMI-Eingang, (HDMI-Version: 1.4), 1x DisplayPort-Eingang, 1x DisplayPort-Ausgang, (DisplayPort-Version: 1.2), 1x Kopfh\u00f6rer-Ausgang, 1x USB-C, 1x RJ 45",
        "Bild": "Glaretyp",
        "Bildschirmaufl\u00f6sung": "1.920 x 1.080 Pixel",
        "Bildschirmdiagonale": "60 cm (24 Zoll)",
        "EAN": "8806091451309",
        "Energieeffizienzklasse (SDR)": "F (A - G)",
        "Energieverbauch pro 1000 Stunden (SDR)": "19 kWh",
        "Ergonomie": "Typ",
        "Farbe": "schwarz (matt)",
        "Features": "65 Watt USB-C Power Delivery, Reader Mode, Color Weakness Mode, Flicker Safe Backlight, DAS (Dynamic Action Sync), Super+ Resolution, Integrierte Webcam + Mikrofone",
        "Geeignet f\u00fcr": "Multimedia",
        "Hersteller-Nr.": "24BP750C-B.AEU",
        "Lautsprecher": "2 Lautsprecher",
        "Leistungsaufnahme im Bereitschafts- und Aus-Zustand": "0,5 Watt",
        "Leistungsaufnahme im Ein-Zustand bei Standard-Dynamikumfang (SDR)": "18,5 Watt",
        "Stromversorgung": "Eco-Off",
        "Typ": "LED-Monitor",
        "Wandhalterung": "VESA kompatibel (100 x 100 mm)"
    },
    "raw_specifications_text": "Energieeffizienzklasse (SDR): F (A - G)\nEnergieverbauch pro 1000 Stunden (SDR): 19 kWh\nLeistungsaufnahme im Ein-Zustand bei Standard-Dynamikumfang (SDR): 18,5 Watt\nLeistungsaufnahme im Bereitschafts- und Aus-Zustand: 0,5 Watt\nBildschirmdiagonale: 60 cm (24 Zoll)\nBildschirmaufl\u00f6sung: 1.920 x 1.080 Pixel\nTyp: LED-Monitor\nFarbe: schwarz (matt)\nEAN: 8806091451309\nHersteller-Nr.: 24BP750C-B.AEU\nGeeignet f\u00fcr: Multimedia\nBild: Glaretyp\n: Mikrofon, Webcam\nAnschl\u00fcsse: 1x HDMI-Eingang, (HDMI-Version: 1.4), 1x DisplayPort-Eingang, 1x DisplayPort-Ausgang, (DisplayPort-Version: 1.2), 1x Kopfh\u00f6rer-Ausgang, 1x USB-C, 1x RJ 45\nErgonomie: Typ\nStromversorgung: Eco-Off\nLautsprecher: 2 Lautsprecher\nWandhalterung: VESA kompatibel (100 x 100 mm)\nFeatures: 65 Watt USB-C Power Delivery, Reader Mode, Color Weakness Mode, Flicker Safe Backlight, DAS (Dynamic Action Sync), Super+ Resolution, Integrierte Webcam + Mikrofone",
    "reference_file": "offer_reference_785.json",
    "shop_name": "Alternate.at"
}