{
    "html_file": "offer_107_5.html",
    "name": "Acer Nitro VG0 VG240YS3bmiipx, 23.8\"",
    "offer_link": "https://www.alternate.at/Acer/Nitro-VG240YS3-Gaming-Monitor/html/product/1914811?partner=AtGeizhalsat&campaign=Monitor/Acer/1914811",
    "price": 151.9,
    "raw_specifications": {
        "": "AMD FreeSync, Kensington-Schloss",
        "Abmessungen": "Breite: 54,03 cm x H\u00f6he: 41,41 cm x Tiefe/L\u00e4nge: 24,01 cm",
        "Anschl\u00fcsse": "2x HDMI-Eingang, (HDMI-Version: 2.0), 1x DisplayPort-Eingang, (DisplayPort-Version: 1.2), 1x Kopfh\u00f6rer-Ausgang",
        "Bild": "Glaretyp",
        "Bildschirmaufl\u00f6sung": "1.920 x 1.080 Pixel",
        "Bildschirmdiagonale": "61 cm (24 Zoll)",
        "EAN": "4711121561528",
        "Energieeffizienzklasse (HDR)": "G (A - G)",
        "Energieeffizienzklasse (SDR)": "E (A - G)",
        "Energieverbauch pro 1000 Stunden (HDR)": "27 kWh",
        "Energieverbauch pro 1000 Stunden (SDR)": "18 kWh",
        "Ergonomie": "Neigbar",
        "Farbe": "schwarz/rot",
        "Features": "Acer VisionCare, Acer Display Widget",
        "Geeignet f\u00fcr": "Gaming",
        "Gewicht": "4,1 kg",
        "Hersteller-Nr.": "UM.QV0EE.302",
        "Lautsprecher": "2 Lautsprecher",
        "Leistungsaufnahme im Bereitschafts- und Aus-Zustand": "0,5 Watt",
        "Leistungsaufnahme im Ein-Zustand bei Standard-Dynamikumfang (SDR)": "18 Watt",
        "Leistungsaufnahme im Ein-Zustand bei hohem Dynamikumfang (HDR)": "27 Watt",
        "Stromversorgung": "Eco-Off",
        "Typ": "Gaming-Monitor",
        "Wandhalterung": "VESA kompatibel (100 x 100 mm)",
        "Zubeh\u00f6r": "Vorhanden"
    },
    "raw_specifications_text": "Energieeffizienzklasse (SDR): E (A - G)\nEnergieverbauch pro 1000 Stunden (SDR): 18 kWh\nEnergieeffizienzklasse (HDR): G (A - G)\nEnergieverbauch pro 1000 Stunden (HDR): 27 kWh\nLeistungsaufnahme im Ein-Zustand bei Standard-Dynamikumfang (SDR): 18 Watt\nLeistungsaufnahme im Ein-Zustand bei hohem Dynamikumfang (HDR): 27 Watt\nLeistungsaufnahme im Bereitschafts- und Aus-Zustand: 0,5 Watt\nBildschirmdiagonale: 61 cm (24 Zoll)\nBildschirmaufl\u00f6sung: 1.920 x 1.080 Pixel\nTyp: Gaming-Monitor\nFarbe: schwarz/rot\nEAN: 4711121561528\nHersteller-Nr.: UM.QV0EE.302\nGeeignet f\u00fcr: Gaming\nBild: Glaretyp\n: AMD FreeSync, Kensington-Schloss\nAnschl\u00fcsse: 2x HDMI-Eingang, (HDMI-Version: 2.0), 1x DisplayPort-Eingang, (DisplayPort-Version: 1.2), 1x Kopfh\u00f6rer-Ausgang\nErgonomie: Neigbar\nStromversorgung: Eco-Off\nLautsprecher: 2 Lautsprecher\nWandhalterung: VESA kompatibel (100 x 100 mm)\nFeatures: Acer VisionCare, Acer Display Widget\nZubeh\u00f6r: Vorhanden\nAbmessungen: Breite: 54,03 cm x H\u00f6he: 41,41 cm x Tiefe/L\u00e4nge: 24,01 cm\nGewicht: 4,1 kg",
    "reference_file": "offer_reference_107.json",
    "shop_name": "Alternate.at"
}