{
    "html_file": "offer_261_16.html",
    "name": "Samsung ViewFinity S6 S60A (2023), 31.5\"",
    "offer_link": "https://www.e-tec.at/details.php?artnr=368177",
    "price": 277.7,
    "raw_specifications": {
        "AMD FreeSync": "Ja",
        "Adaptive Sync": "Ja",
        "Anschl\u00fcsse - DisplayPort 1.2": "1",
        "Anschl\u00fcsse - HDMI 1.4": "1",
        "Anwendung": "station\u00e4r",
        "Audio": "1x Line-Out",
        "Aufl\u00f6sung": "2560x1440",
        "Beschichtung": "matt (non-glare)",
        "Besonderheiten": "mechanische Tasten mit Steuerkreuz,  Lichtsensor,  Picture-in-Picture,  Sicherheitsschloss (Kensington)",
        "Bildwiederholfrequenz": "75Hz",
        "Blickwinkel": "178\u00b0/178\u00b0",
        "Diagonale": "31.5\"/80cm",
        "Energieeffizienzklasse HDR (A bis G)": "G",
        "Energieverbrauch HDR": "50kWh/1000h",
        "Energieverbrauch SDR": "32kWh/1000h",
        "Ergonomie": "120mm (h\u00f6henverstellbar),  90\u00b0 (Pivot),  \u00b130\u00b0 (drehbar),  +25\u00b0/-2\u00b0 (neigbar),  keine Angabe (Schr\u00e4glage)",
        "FRC": "ja (8bit+2bit)",
        "Farbe": "schwarz",
        "Farbraum - sRGB": "99%",
        "Farbtiefe": "10bit (1.07 Mrd. Farben)",
        "Form": "gerade (flat)",
        "Gewicht": "6.90kg (mit Standfu\u00df),  4.80kg (ohne Standfu\u00df)",
        "HDR": "HDR10",
        "Helligkeit": "300cd/m\u00b2",
        "Herstellergarantie": "drei Jahre",
        "Hintergrundbeleuchtung": "White-LED,  flicker-free,  Blaulichtfilter",
        "Kontrast - statisch": "3.000:1",
        "Leistungsaufnahme": "keine Angabe (maximal),  keine Angabe (typisch),  keine Angabe (Energielabel alt A+++ bis G),  0.5W (Standby)",
        "Panel": "VA",
        "Reaktionszeit - GtG": "5ms",
        "Screen-to-Body-Ratio": "89.9% (berechnet)",
        "Seitenverh\u00e4ltnis": "16:9",
        "Signalfrequenz": "74-112kHz (horizontal),  48-75Hz (vertikal)",
        "Stromversorgung": "AC-In (internes Netzteil)",
        "USB-Hub In": "1x USB-B 3.0",
        "USB-Hub Out": "3x USB-A 3.0,  1x USB-A 2.0",
        "USB-Schreibweise": "Link",
        "VESA": "100x100 (belegt)",
        "Weitere Anschl\u00fcsse": "N/A"
    },
    "raw_specifications_text": "Adaptive Sync: Ja\nAMD FreeSync: Ja\nAnschl\u00fcsse - DisplayPort 1.2: 1\nAnschl\u00fcsse - HDMI 1.4: 1\nAnwendung: station\u00e4r\nAudio: 1x Line-Out\nAufl\u00f6sung: 2560x1440\nBeschichtung: matt (non-glare)\nBesonderheiten: mechanische Tasten mit Steuerkreuz,  Lichtsensor,  Picture-in-Picture,  Sicherheitsschloss (Kensington)\nBildwiederholfrequenz: 75Hz\nBlickwinkel: 178\u00b0/178\u00b0\nDiagonale: 31.5\"/80cm\nEnergieeffizienzklasse HDR (A bis G): G\nEnergieverbrauch HDR: 50kWh/1000h\nEnergieverbrauch SDR: 32kWh/1000h\nErgonomie: 120mm (h\u00f6henverstellbar),  90\u00b0 (Pivot),  \u00b130\u00b0 (drehbar),  +25\u00b0/-2\u00b0 (neigbar),  keine Angabe (Schr\u00e4glage)\nFarbe: schwarz\nFarbraum - sRGB: 99%\nFarbtiefe: 10bit (1.07 Mrd. Farben)\nForm: gerade (flat)\nFRC: ja (8bit+2bit)\nGewicht: 6.90kg (mit Standfu\u00df),  4.80kg (ohne Standfu\u00df)\nHDR: HDR10\nHelligkeit: 300cd/m\u00b2\nHerstellergarantie: drei Jahre\nHintergrundbeleuchtung: White-LED,  flicker-free,  Blaulichtfilter\nKontrast - statisch: 3.000:1\nLeistungsaufnahme: keine Angabe (maximal),  keine Angabe (typisch),  keine Angabe (Energielabel alt A+++ bis G),  0.5W (Standby)\nPanel: VA\nReaktionszeit - GtG: 5ms\nScreen-to-Body-Ratio: 89.9% (berechnet)\nSeitenverh\u00e4ltnis: 16:9\nSignalfrequenz: 74-112kHz (horizontal),  48-75Hz (vertikal)\nStromversorgung: AC-In (internes Netzteil)\nUSB-Hub In: 1x USB-B 3.0\nUSB-Hub Out: 3x USB-A 3.0,  1x USB-A 2.0\nUSB-Schreibweise: Link\nVESA: 100x100 (belegt)\nWeitere Anschl\u00fcsse: N/A",
    "reference_file": "offer_reference_261.json",
    "shop_name": "e-tec.at"
}