{
    "html_file": "offer_1514_10.html",
    "name": "ViewSonic VG2440V, 23.8\"",
    "offer_link": "https://www.e-tec.at/details.php?artnr=315207",
    "price": 201.1,
    "raw_specifications": {
        "Abmessungen (BxHxT)": "549x406.78x206mm (mit Standfu\u00df),  549x352x50mm (ohne Standfu\u00df)",
        "Anschl\u00fcsse - DisplayPort 1.2": "1",
        "Anschl\u00fcsse - HDMI 1.4": "1",
        "Anschl\u00fcsse - VGA": "1",
        "Anschl\u00fcsse - VGA (60Hz@1920x1080)": "1",
        "Anschl\u00fcsse - VGA 60Hz@1920x1080": "1",
        "Anwendung": "station\u00e4r",
        "Audio": "Lautsprecher (2x 2W),  1x Line-In,  1x Line-Out",
        "Aufl\u00f6sung": "1920x1080",
        "Beschichtung": "matt (non-glare),  H\u00e4rtegrad 3H",
        "Besonderheiten": "EPEAT Silver,  mechanische Tasten,  Sicherheitsschloss (Kensington),  Mikrofon,  Webcam (2.0 Megapixel,  neigbar,  verriegelbar)",
        "Bildwiederholfrequenz": "60Hz",
        "Blickwinkel": "178\u00b0/178\u00b0",
        "Diagonale": "23.8\"/60.5cm",
        "Energieverbrauch SDR": "21kWh/1000h",
        "Ergonomie": "130mm (h\u00f6henverstellbar),  \u00b190\u00b0 (Pivot),  \u00b160\u00b0 (drehbar),  +40\u00b0/-5\u00b0 (neigbar),  keine Angabe (Schr\u00e4glage)",
        "FRC": "ja (6bit+2bit)",
        "Farbe": "schwarz",
        "Farbraum - sRGB": "104%",
        "Farbtiefe": "8bit (16.7 Mio. Farben)",
        "Form": "gerade (flat)",
        "Gewicht": "6.00kg (mit Standfu\u00df),  3.60kg (ohne Standfu\u00df)",
        "HDR": "N/A",
        "Helligkeit": "250cd/m\u00b2",
        "Herstellergarantie": "vier Jahre (Vorabaustausch)",
        "Hintergrundbeleuchtung": "White-LED,  flicker-free,  Blaulichtfilter",
        "Kontrast - dynamisch": "80.000.000:1",
        "Kontrast - statisch": "1.000:1",
        "Lautsprecher": "Ja",
        "Leistungsaufnahme": "16.52W (maximal),  13.68W (typisch),  keine Angabe (Energielabel alt A+++ bis G),  0.5W (Standby)",
        "Panel": "IPS",
        "Reaktionszeit - GtG": "5ms",
        "Screen-to-Body-Ratio": "keine Angabe (berechnet)",
        "Seitenverh\u00e4ltnis": "16:9",
        "Signalfrequenz": "15-90kHz (horizontal),  49-75Hz (vertikal)",
        "Stromversorgung": "AC-In (internes Netzteil)",
        "USB-Hub In": "1x USB-B 3.0",
        "USB-Hub Out": "3x USB-A 3.0",
        "USB-Schreibweise": "Link",
        "Unsch\u00e4rfereduktionsfunktion": "N/A",
        "VESA": "100x100 (belegt)",
        "VRR (Variable Refresh Rate)": "N/A",
        "Weitere Anschl\u00fcsse": "N/A"
    },
    "raw_specifications_text": "Abmessungen (BxHxT): 549x406.78x206mm (mit Standfu\u00df),  549x352x50mm (ohne Standfu\u00df)\nAnschl\u00fcsse - DisplayPort 1.2: 1\nAnschl\u00fcsse - HDMI 1.4: 1\nAnschl\u00fcsse - VGA: 1\nAnschl\u00fcsse - VGA (60Hz@1920x1080): 1\nAnschl\u00fcsse - VGA 60Hz@1920x1080: 1\nAnwendung: station\u00e4r\nAudio: Lautsprecher (2x 2W),  1x Line-In,  1x Line-Out\nAufl\u00f6sung: 1920x1080\nBeschichtung: matt (non-glare),  H\u00e4rtegrad 3H\nBesonderheiten: EPEAT Silver,  mechanische Tasten,  Sicherheitsschloss (Kensington),  Mikrofon,  Webcam (2.0 Megapixel,  neigbar,  verriegelbar)\nBildwiederholfrequenz: 60Hz\nBlickwinkel: 178\u00b0/178\u00b0\nDiagonale: 23.8\"/60.5cm\nEnergieverbrauch SDR: 21kWh/1000h\nErgonomie: 130mm (h\u00f6henverstellbar),  \u00b190\u00b0 (Pivot),  \u00b160\u00b0 (drehbar),  +40\u00b0/-5\u00b0 (neigbar),  keine Angabe (Schr\u00e4glage)\nFarbe: schwarz\nFarbraum - sRGB: 104%\nFarbtiefe: 8bit (16.7 Mio. Farben)\nForm: gerade (flat)\nFRC: ja (6bit+2bit)\nGewicht: 6.00kg (mit Standfu\u00df),  3.60kg (ohne Standfu\u00df)\nHDR: N/A\nHelligkeit: 250cd/m\u00b2\nHerstellergarantie: vier Jahre (Vorabaustausch)\nHintergrundbeleuchtung: White-LED,  flicker-free,  Blaulichtfilter\nKontrast - dynamisch: 80.000.000:1\nKontrast - statisch: 1.000:1\nLautsprecher: Ja\nLeistungsaufnahme: 16.52W (maximal),  13.68W (typisch),  keine Angabe (Energielabel alt A+++ bis G),  0.5W (Standby)\nPanel: IPS\nReaktionszeit - GtG: 5ms\nScreen-to-Body-Ratio: keine Angabe (berechnet)\nSeitenverh\u00e4ltnis: 16:9\nSignalfrequenz: 15-90kHz (horizontal),  49-75Hz (vertikal)\nStromversorgung: AC-In (internes Netzteil)\nUnsch\u00e4rfereduktionsfunktion: N/A\nUSB-Hub In: 1x USB-B 3.0\nUSB-Hub Out: 3x USB-A 3.0\nUSB-Schreibweise: Link\nVESA: 100x100 (belegt)\nVRR (Variable Refresh Rate): N/A\nWeitere Anschl\u00fcsse: N/A",
    "reference_file": "offer_reference_1514.json",
    "shop_name": "e-tec.at"
}