{
    "html_file": "offer_2023_43.html",
    "name": "HP P24h G4, 23.8\"",
    "offer_link": "https://direkt.jacob.de/produkte/hp-inc-k-6xhp-7vh44aa-artnr-6545323.html?utm_source=geizhals&utm_medium=cpc&utm_campaign=Preisvergleich&ref=103",
    "price": 203.86,
    "raw_specifications": {
        "Abmessungen (Breite x Tiefe x H\u00f6he)": "53.82 cm x 21.16 cm x 46.43 cm - mit Fu\u00df",
        "Abmessungen (Breite x Tiefe x H\u00f6he) - mit Fu\u00df": "53.82 cm x 21.16 cm x 46.43 cm",
        "Ausgangsleistung/Kanal": "2 Watt",
        "Besonderheiten": "HDCP, Low Blue Light Mode, flimmerfreie Technologie, Color Calibrated, extrem schmale Blende an drei Seiten, 6-bit + A-FRC Color Depth, 72 % NTSC Farbraum",
        "Bildschirmbeschichtung": "Blendfrei",
        "Bildschirmtyp": "IPS",
        "Details zu Abmessungen & Gewicht": "Mit Fu\u00df - Breite: 53.82 cm - Tiefe: 21.16 cm - H\u00f6he: 46.43 cm - Gewicht: 4.51 kg  Ohne Fu\u00df - Breite: 43.82 cm - Tiefe: 4.59 cm - H\u00f6he: 32.56 cm - Gewicht: 2.53 kg",
        "Diagonalabmessung": "61 cm (24\")",
        "Display-Typ": "LED-hintergrundbeleuchteter LCD-Monitor / TFT-Aktivmatrix",
        "ENERGY STAR zertifiziert": "Ja",
        "ENERGY STAR-Version": "8.0",
        "Eingangsanschl\u00fcsse": "HDMI, VGA, DisplayPort",
        "Eingangsspannung": "Wechselstrom 120/230 V (50/60 Hz)",
        "Einstellungen der Anzeigeposition": "H\u00f6he, Pivot (Rotation), Drehung, Neigung",
        "Energie Effizienzklasse": "Klasse E",
        "Energieverbrauch pro Jahr": "20.8 kWh",
        "Enthaltene Kabel": "1 x VGA-Kabel - 1.8 m  1 x Audiokabel - 1.8 m",
        "Entwickelt f\u00fcr": "HP 250 G9 Notebook  HP Elite 600 G9, 800 G9  HP EliteBook 745 G5, 830 G5, 830 G6, 840 G5  HP EliteDesk 800 G6  HP Pro 260 G9, 290 G9  HP ZBook Firefly 14 G9 Mobile Workstation",
        "Farbe": "Schwarz",
        "Farbraum": "72% NTSC",
        "Farbtemperatur": "9300K, 5000K, 6500K",
        "Ger\u00e4tetyp": "LED-hintergrundbeleuchteter LCD-Monitor - 61 cm (24\")",
        "Gewicht": "4.51 kg",
        "Helligkeit": "250 cd/m\u00b2",
        "Hintergrundbeleuchtungs-Technologie": "LED-Hintergrundbeleuchtung",
        "Horizontale Bildwiederholrate": "30 - 86 kHz",
        "Horizontaler Betrachtungswinkel": "178",
        "H\u00f6heneinstellung": "100 mm",
        "Kennzeichnung": "Plug and Play, CSA, UL, VCCI, BSMI, NOM, TUV S, WHQL, CB, CCC, PSB, FCC, RoHS, ISO 9241-307, KCC, WEEE, ICES, MEPS, KC, CEL, EAC, CEL Grade 1, ISC, CP65, halogenarm, DisplayPort 1.2, IEEE 1680, ISO 11469, ISO 1043",
        "Kontrast": "1000:1 / 8000000:1 (dynamisch)",
        "Lebensdauer der Beleuchtung": "30,000 Stunden",
        "Leistungsaufnahme im Ein-Zustand": "15 W",
        "Leistungsmerkmale": "Slot f\u00fcr Sicherheitsschloss (Kabelschloss getrennt erh\u00e4ltlich), ohne Arsen, quecksilberfrei",
        "Max. Betriebstemperatur": "35 \u00b0C",
        "Min Betriebstemperatur": "5 \u00b0C",
        "Mitgelieferte Software": "HP Display Assistant",
        "Native Aufl\u00f6sung": "Full HD (1080p) 1920 x 1080 bei 75 Hz",
        "Neigungswinkel": "-5/+23",
        "OSD-Sprachen": "Chinesisch (tradionell), Chinesisch (vereinfacht), Englisch, Deutsch, Franz\u00f6sisch, Italienisch, Portugiesisch, Spanisch, Holl\u00e4ndisch, Japanisch",
        "Pixelpitch": "0.274 mm",
        "Ppi": "93",
        "Produktbeschreibung": "HP P24h G4 - LED-Monitor - Full HD (1080p) - 61 cm (24\")",
        "Reaktionszeit": "5 ms (Gray-to-Gray)",
        "Rotationswinkel": "180",
        "Schlosstyp zur Diebstahlsicherung": "Kensington Slot",
        "Schnittstellen": "DisplayPort (HDCP)  HDMI (HDCP)  VGA  Audio Line-In (Mini-Klinkenstecker)",
        "Schwenkwinkel": "360",
        "Seitenverh\u00e4ltnis": "16:9",
        "Sichtbare Bildfl\u00e4che": "60.5 cm (23.8\")",
        "Spannung": "Wechselstrom 120/230 V (50/60 Hz)",
        "Stromverbrauch (typisch)": "22 Watt",
        "Stromverbrauch SDR (eingeschaltet)": "15 kWh/1.000 h",
        "Stromverbrauch im Standby-Modus": "0.5 Watt",
        "Transportbreite": "59.8 cm",
        "Transportgewicht": "6.04 kg",
        "Transporth\u00f6he": "41.5 cm",
        "Transporttiefe": "16.5 cm",
        "Typ": "Lautsprecher - Stereo",
        "Umweltschutzstandards": "ENERGY STAR-qualifiziert",
        "VESA-Halterung": "100 x 100 mm",
        "Vertikale Bildwiederholrate": "48 - 75 Hz",
        "Vertikaler Betrachtungswinkel": "178",
        "Zul\u00e4ssige Luftfeuchtigkeit im Betrieb": "20 - 80% (nicht kondensierend)"
    },
    "raw_specifications_text": "Produktbeschreibung: HP P24h G4 - LED-Monitor - Full HD (1080p) - 61 cm (24\")\nGer\u00e4tetyp: LED-hintergrundbeleuchteter LCD-Monitor - 61 cm (24\")\nEnergie Effizienzklasse: Klasse E\nEnergieverbrauch pro Jahr: 20.8 kWh\nLeistungsaufnahme im Ein-Zustand: 15 W\nBildschirmtyp: IPS\nSeitenverh\u00e4ltnis: 16:9\nNative Aufl\u00f6sung: Full HD (1080p) 1920 x 1080 bei 75 Hz\nPixelpitch: 0.274 mm\nHelligkeit: 250 cd/m\u00b2\nKontrast: 1000:1 / 8000000:1 (dynamisch)\nReaktionszeit: 5 ms (Gray-to-Gray)\nFarbraum: 72% NTSC\nEingangsanschl\u00fcsse: HDMI, VGA, DisplayPort\nEinstellungen der Anzeigeposition: H\u00f6he, Pivot (Rotation), Drehung, Neigung\nBildschirmbeschichtung: Blendfrei\nSpannung: Wechselstrom 120/230 V (50/60 Hz)\nFarbe: Schwarz\nAbmessungen (Breite x Tiefe x H\u00f6he) - mit Fu\u00df: 53.82 cm x 21.16 cm x 46.43 cm\nGewicht: 4.51 kg\nUmweltschutzstandards: ENERGY STAR-qualifiziert\nKennzeichnung: Plug and Play, CSA, UL, VCCI, BSMI, NOM, TUV S, WHQL, CB, CCC, PSB, FCC, RoHS, ISO 9241-307, KCC, WEEE, ICES, MEPS, KC, CEL, EAC, CEL Grade 1, ISC, CP65, halogenarm, DisplayPort 1.2, IEEE 1680, ISO 11469, ISO 1043\nEntwickelt f\u00fcr: HP 250 G9 Notebook  HP Elite 600 G9, 800 G9  HP EliteBook 745 G5, 830 G5, 830 G6, 840 G5  HP EliteDesk 800 G6  HP Pro 260 G9, 290 G9  HP ZBook Firefly 14 G9 Mobile Workstation\nDisplay-Typ: LED-hintergrundbeleuchteter LCD-Monitor / TFT-Aktivmatrix\nDiagonalabmessung: 61 cm (24\")\nSichtbare Bildfl\u00e4che: 60.5 cm (23.8\")\nPpi: 93\nVertikale Bildwiederholrate: 48 - 75 Hz\nHorizontale Bildwiederholrate: 30 - 86 kHz\nHorizontaler Betrachtungswinkel: 178\nVertikaler Betrachtungswinkel: 178\nHintergrundbeleuchtungs-Technologie: LED-Hintergrundbeleuchtung\nFarbtemperatur: 9300K, 5000K, 6500K\nOSD-Sprachen: Chinesisch (tradionell), Chinesisch (vereinfacht), Englisch, Deutsch, Franz\u00f6sisch, Italienisch, Portugiesisch, Spanisch, Holl\u00e4ndisch, Japanisch\nBesonderheiten: HDCP, Low Blue Light Mode, flimmerfreie Technologie, Color Calibrated, extrem schmale Blende an drei Seiten, 6-bit + A-FRC Color Depth, 72 % NTSC Farbraum\nAbmessungen (Breite x Tiefe x H\u00f6he): 53.82 cm x 21.16 cm x 46.43 cm - mit Fu\u00df\nTyp: Lautsprecher - Stereo\nAusgangsleistung/Kanal: 2 Watt\nSchnittstellen: DisplayPort (HDCP)  HDMI (HDCP)  VGA  Audio Line-In (Mini-Klinkenstecker)\nNeigungswinkel: -5/+23\nSchwenkwinkel: 360\nRotationswinkel: 180\nH\u00f6heneinstellung: 100 mm\nVESA-Halterung: 100 x 100 mm\nLeistungsmerkmale: Slot f\u00fcr Sicherheitsschloss (Kabelschloss getrennt erh\u00e4ltlich), ohne Arsen, quecksilberfrei\nEnthaltene Kabel: 1 x VGA-Kabel - 1.8 m  1 x Audiokabel - 1.8 m\nLebensdauer der Beleuchtung: 30,000 Stunden\nSchlosstyp zur Diebstahlsicherung: Kensington Slot\nEingangsspannung: Wechselstrom 120/230 V (50/60 Hz)\nStromverbrauch SDR (eingeschaltet): 15 kWh/1.000 h\nStromverbrauch (typisch): 22 Watt\nStromverbrauch im Standby-Modus: 0.5 Watt\nMitgelieferte Software: HP Display Assistant\nDetails zu Abmessungen & Gewicht: Mit Fu\u00df - Breite: 53.82 cm - Tiefe: 21.16 cm - H\u00f6he: 46.43 cm - Gewicht: 4.51 kg  Ohne Fu\u00df - Breite: 43.82 cm - Tiefe: 4.59 cm - H\u00f6he: 32.56 cm - Gewicht: 2.53 kg\nTransportbreite: 59.8 cm\nTransporttiefe: 16.5 cm\nTransporth\u00f6he: 41.5 cm\nTransportgewicht: 6.04 kg\nENERGY STAR zertifiziert: Ja\nENERGY STAR-Version: 8.0\nMin Betriebstemperatur: 5 \u00b0C\nMax. Betriebstemperatur: 35 \u00b0C\nZul\u00e4ssige Luftfeuchtigkeit im Betrieb: 20 - 80% (nicht kondensierend)",
    "reference_file": "offer_reference_2023.json",
    "shop_name": "Jacob Elektronik direkt (AT)"
}