{
    "html_file": "offer_298_12.html",
    "name": "ASUS VY279HGE, 27\"",
    "offer_link": "https://www.csv-direct.de/artinfo.php?artnr=A1621564&KATEGORIE=162&pva=geizhals2",
    "price": 209.43,
    "raw_specifications": {
        "AC Eingangsfrequenz": "50 - 60 Hz",
        "AC Eingangsspannung": "100 - 240 V",
        "AMD FreeSync-Typ": "FreeSync Premium",
        "Anzahl HDMI-Anschl\u00fcsse": "1",
        "Anzahl der Farben des Displays": "16,7 Millionen Farben",
        "Bildschirmdiagonale": "68,6 cm 27\"",
        "Bildschirmform": "Flach",
        "Bildwinkel, horizontal": "178\u00b0",
        "Bildwinkel, vertikal": "178\u00b0",
        "Breite ohne Standfu\u00df": "615,6 mm",
        "Digital horizontale Frequenz": "30 - 159 kHz",
        "Digital vertikale Frequenz": "48 - 144 Hz",
        "Display-Aufl\u00f6sung": "1920 x 1080 Pixel",
        "Eingebaute Lautsprecher": "Nein",
        "Farbskala": "99",
        "Fu\u00dffarbe": "Schwarz",
        "Ger\u00e4tebreite inkl. Fu\u00df": "615,6 mm",
        "Ger\u00e4teh\u00f6he inkl. Fu\u00df": "436,8 mm",
        "Ger\u00e4tetiefe inkl. Fu\u00df": "201,7 mm",
        "Gewicht mit St\u00e4nder": "5,2 kg",
        "Gewicht ohne St\u00e4nder": "4,7 kg",
        "HD-Typ": "Full HD",
        "HDCP-Version": "1.4",
        "HDMI-Version": "1.4",
        "Helligkeit typisch": "250 cd/m\u00b2",
        "H\u00f6he ohne Standfu\u00df": "366,2 mm",
        "H\u00f6henverstellung": "Nein",
        "Integrierte Kamera": "Nein",
        "Integrierter USB-Hub": "Nein",
        "Kontrastverh\u00e4ltnis": "1000:1",
        "Kopfh\u00f6rerausg\u00e4nge": "1",
        "Markenspezifische Technologien": "Augenpflege+, SPLENDID",
        "Marktpositionierung": "Gaming",
        "Maximale Bildwiederholrate": "144 Hz",
        "Natives Seitenverh\u00e4ltnis": "16:9",
        "Neigungswinkelbereich": "-5 - 23\u00b0",
        "Paketgewicht": "5,8 kg",
        "Panel-Montage-Schnittstelle": "100 x 100 mm",
        "Panel-Typ": "IPS",
        "Pixel Abstand": "0,311 x 0,311 mm",
        "Pixeldichte": "82 ppi",
        "Produktfarbe": "Schwarz",
        "RGB-Farbraum": "sRGB",
        "Reaktionszeit": "1 ms",
        "Sichtbare Gr\u00f6\u00dfe horizontal": "59,8 cm",
        "Sichtbare Gr\u00f6\u00dfe vertikal": "33,6 cm",
        "Slot-Typ Kabelsperre": "Kensington",
        "Stromverbrauch PowerSave": "0,5 W",
        "Stromverbrauch Standardbetrieb": "16,04 W",
        "Stromverbrauch aus": "0,3 W",
        "Tiefe ohne Standfu\u00df": "55,9 mm",
        "Touchscreen": "Nein",
        "Typ der Hintergrundbeleuchtung": "LED",
        "Verpackungsart": "Box",
        "Verpackungsbreite": "679 mm",
        "Verpackungsh\u00f6he": "445 mm",
        "Verpackungstiefe": "148 mm"
    },
    "raw_specifications_text": "Bildschirmdiagonale: 68,6 cm 27\"\nDisplay-Aufl\u00f6sung: 1920 x 1080 Pixel\nNatives Seitenverh\u00e4ltnis: 16:9\nTouchscreen: Nein\nHD-Typ: Full HD\nPanel-Typ: IPS\nBildschirmform: Flach\nKontrastverh\u00e4ltnis: 1000:1\nMaximale Bildwiederholrate: 144 Hz\nAnzahl der Farben des Displays: 16,7 Millionen Farben\nTyp der Hintergrundbeleuchtung: LED\nHelligkeit typisch: 250 cd/m\u00b2\nReaktionszeit: 1 ms\nBildwinkel, horizontal: 178\u00b0\nBildwinkel, vertikal: 178\u00b0\nPixel Abstand: 0,311 x 0,311 mm\nPixeldichte: 82 ppi\nSichtbare Gr\u00f6\u00dfe horizontal: 59,8 cm\nSichtbare Gr\u00f6\u00dfe vertikal: 33,6 cm\nDigital horizontale Frequenz: 30 - 159 kHz\nDigital vertikale Frequenz: 48 - 144 Hz\nRGB-Farbraum: sRGB\nFarbskala: 99\nAMD FreeSync-Typ: FreeSync Premium\nMarkenspezifische Technologien: Augenpflege+, SPLENDID\nEingebaute Lautsprecher: Nein\nIntegrierte Kamera: Nein\nMarktpositionierung: Gaming\nProduktfarbe: Schwarz\nFu\u00dffarbe: Schwarz\nIntegrierter USB-Hub: Nein\nAnzahl HDMI-Anschl\u00fcsse: 1\nHDMI-Version: 1.4\nKopfh\u00f6rerausg\u00e4nge: 1\nHDCP-Version: 1.4\nH\u00f6henverstellung: Nein\nPanel-Montage-Schnittstelle: 100 x 100 mm\nSlot-Typ Kabelsperre: Kensington\nNeigungswinkelbereich: -5 - 23\u00b0\nStromverbrauch Standardbetrieb: 16,04 W\nStromverbrauch aus: 0,3 W\nStromverbrauch PowerSave: 0,5 W\nAC Eingangsspannung: 100 - 240 V\nAC Eingangsfrequenz: 50 - 60 Hz\nGer\u00e4tebreite inkl. Fu\u00df: 615,6 mm\nGer\u00e4tetiefe inkl. Fu\u00df: 201,7 mm\nGer\u00e4teh\u00f6he inkl. Fu\u00df: 436,8 mm\nGewicht mit St\u00e4nder: 5,2 kg\nBreite ohne Standfu\u00df: 615,6 mm\nTiefe ohne Standfu\u00df: 55,9 mm\nH\u00f6he ohne Standfu\u00df: 366,2 mm\nGewicht ohne St\u00e4nder: 4,7 kg\nVerpackungsbreite: 679 mm\nVerpackungstiefe: 148 mm\nVerpackungsh\u00f6he: 445 mm\nPaketgewicht: 5,8 kg\nVerpackungsart: Box",
    "reference_file": "offer_reference_298.json",
    "shop_name": "CSV-Direct.de"
}