{
    "html_file": "offer_33_6.html",
    "name": "BenQ PD3205UA, 31.5\"",
    "offer_link": "https://www.mylemon.at/artikel/benq/9h_lkgla_tpe/monitor-31-5-inch-pd3205ua.html",
    "price": 981.79,
    "raw_specifications": {
        "AC Eingangsspannung": "100 - 240 V",
        "Abnehmbarer Standfu\u00df": "Ja",
        "Anzahl DisplayPort Anschl\u00fcsse": "1",
        "Anzahl HDMI-Anschl\u00fcsse": "1",
        "Anzahl OSD-Sprachen": "18",
        "Anzahl Thunderbolt 3 Anschl\u00fcsse": "1",
        "Anzahl der Farben des Displays": "1,07 Milliarden Farben",
        "Anzahl der Lautsprecher": "2",
        "Anzahl der Upstream-Ports USB Typ-B": "2",
        "Anzahl der nachgeschalteten Ports vom Typ USB-C": "1",
        "Anzahl der nachgeschalteten Steckpl\u00e4tze vom Typ USB-A": "3",
        "Anzahl der vorgeschalteten Steckpl\u00e4tze": "2",
        "Artikelnummer": "M1JY56RL",
        "Aufl\u00f6sung": "3840x2160",
        "Bild-in-Bild": "Ja",
        "Bildschirmdiagonale": "80 cm (31.5\")",
        "Bildschirmform": "Flach",
        "Bildschirmspiegelung": "Ja",
        "Bildschirmtechnologie": "LCD",
        "Bildwinkel, horizontal": "178\u00b0",
        "Bildwinkel, vertikal": "178\u00b0",
        "Blendfreier Bildschirm": "Ja",
        "Breite (ohne Standfu\u00df)": "714,7 mm",
        "ConnectShare (USB)": "Ja",
        "Display-Aufl\u00f6sung": "3840 x 2160 Pixel",
        "DisplayPorts-Version": "1.4",
        "Displaygr\u00f6\u00dfe": "31,5 Zoll",
        "EAN": "4718755090394",
        "Eingebaute KVM-Umschaltung": "Ja",
        "Eingebaute Lautsprecher": "Ja",
        "Energieeffizienzklasse (HDR)": "G",
        "Energieeffizienzklasse (SDR)": "F",
        "Energieeffizienzskala": "A bis G",
        "Energieverbrauch (HDR) pro 1.000 Stunden": "45 kWh",
        "Energieverbrauch (SDR) pro 1.000 Stunden": "30 kWh",
        "Farbskala": "99%",
        "Flimmerfreie Technologie": "Ja",
        "Fu\u00dffarbe": "Schwarz",
        "Ger\u00e4tebreite (inkl. Fu\u00df)": "714,7 mm",
        "Ger\u00e4teh\u00f6he (inkl. Fu\u00df)": "731,2 mm",
        "Ger\u00e4tetiefe (inkl. Fu\u00df)": "459,4 mm",
        "Gewicht (mit St\u00e4nder)": "10,1 kg",
        "Gewicht (ohne St\u00e4nder)": "6,3 kg",
        "HD-Typ": "4K Ultra HD",
        "HDCP": "Ja",
        "HDCP-Version": "2.2",
        "HDMI": "Ja",
        "HDMI-Version": "2.0",
        "Hardware-Kalibrierung": "Ja",
        "Helligkeit (peak)": "350 cd/m\u00b2",
        "Helligkeit (typisch)": "250 cd/m\u00b2",
        "Hersteller Artikelnummer": "9H.LKGLA.TPE",
        "High Dynamic Range Video (HDR) Unterst\u00fctzung": "Ja",
        "H\u00f6he (ohne Standfu\u00df)": "422 mm",
        "H\u00f6heneinstellung": "15 cm",
        "H\u00f6henverstellung": "Ja",
        "Integrierte Kamera": "Nein",
        "Integrierter USB-Hub": "Ja",
        "KVM switch-Anschlussanzahl": "1",
        "Kontrastverh\u00e4ltnis": "1000:1",
        "Kopfh\u00f6rerausgang": "Ja",
        "Kopfh\u00f6rerausg\u00e4nge": "1",
        "Low-Blue-Light-Technologie": "Ja",
        "Markenspezifische Technologien": "Augenpflege+",
        "Marktpositionierung": "Grafikdesign",
        "Maximale Bildwiederholrate": "60 Hz",
        "Men\u00fcsprachen": "Arabisch, Vereinfachtes Chinesisch, Traditionelles Chinesisch, Tschechisch, Deutsch, Englisch, Spanisch, Franz\u00f6sisch, Ungarisch, Italienisch, Japanisch, Koreanisch, Norwegisch, Polnisch, Portugiesisch, Rum\u00e4nisch, Russisch, Schwedisch",
        "Mitgelieferte Software": "Display Pilot",
        "Natives Seitenverh\u00e4ltnis": "16:9",
        "Neigungsverstellung": "Ja",
        "Neigungswinkelbereich": "-5 - 30\u00b0",
        "Netzteiltyp": "Intern",
        "On-Screen-Display (OSD)": "Ja",
        "Panel-Montage-Schnittstelle": "100 x 100 mm",
        "Panel-Typ": "IPS",
        "Pivot": "Ja",
        "Pivot Winkel": "0 - 90\u00b0",
        "Pixeldichte": "140 ppi",
        "Produktfarbe": "Schwarz",
        "RGB-Farbraum": "sRGB",
        "RMS-Leistung": "5 W",
        "Rahmenloses Design": "Ja",
        "Reaktionszeit": "5 ms",
        "Schnellladung": "Ja",
        "Schnellstart\u00fcbersicht": "Ja",
        "Schwenkbar": "Ja",
        "Schwenkwinkelbereich": "270 - 275\u00b0",
        "Smart-Modi": "Animation, M-Book, Pers\u00f6nlich",
        "Stromverbrauch (Standardbetrieb)": "31,5 W",
        "Stromverbrauch (Standby)": "0,5 W",
        "Stromverbrauch (max.)": "168 W",
        "St\u00e4nder enthalten": "Ja",
        "Technologie mit hohem Dynamikbereich (HDR)": "High Dynamic Range 10 (HDR10)",
        "Tiefe (ohne Standfu\u00df)": "82,4 mm",
        "Touchscreen": "Nein",
        "Typ der Hintergrundbeleuchtung": "Direkte LED",
        "USB Power Delivery": "Ja",
        "USB-Hub-Version": "2.0 / 3.2 Gen 1 (3.1 Gen 1)",
        "USB-Stromversorgung bis zu": "65 W",
        "USB-Typ-C DisplayPort-Wechselmodus": "Ja",
        "USB-Upstream-Porttyp": "USB Typ-B",
        "VESA Adaptive Sync unterst\u00fctzt": "Ja",
        "VESA-Halterung": "Ja",
        "Verpackungsart": "Box",
        "Video Anschl\u00fcsse": "1x HDMI",
        "Vorderer Rahmen": "Schwarz",
        "Wandmontage": "Ja",
        "Zertifizierung": "TUV, Solidworks, calman , Pantone , Pantone SkinTone",
        "sRGB Abdeckung (klassisch)": "99%"
    },
    "raw_specifications_text": "Displaygr\u00f6\u00dfe: 31,5 Zoll\nAufl\u00f6sung: 3840x2160\nReaktionszeit: 5 ms\nVideo Anschl\u00fcsse: 1x HDMI\nHersteller Artikelnummer: 9H.LKGLA.TPE\nEAN: 4718755090394\nArtikelnummer: M1JY56RL\nBildschirmdiagonale: 80 cm (31.5\")\nDisplay-Aufl\u00f6sung: 3840 x 2160 Pixel\nNatives Seitenverh\u00e4ltnis: 16:9\nBildschirmtechnologie: LCD\nTouchscreen: Nein\nHD-Typ: 4K Ultra HD\nPanel-Typ: IPS\nBildschirmform: Flach\nKontrastverh\u00e4ltnis: 1000:1\nMaximale Bildwiederholrate: 60 Hz\nAnzahl der Farben des Displays: 1,07 Milliarden Farben\nTyp der Hintergrundbeleuchtung: Direkte LED\nHelligkeit (peak): 350 cd/m\u00b2\nHelligkeit (typisch): 250 cd/m\u00b2\nBlendfreier Bildschirm: Ja\nBildwinkel, horizontal: 178\u00b0\nBildwinkel, vertikal: 178\u00b0\nPixeldichte: 140 ppi\nHigh Dynamic Range Video (HDR) Unterst\u00fctzung: Ja\nTechnologie mit hohem Dynamikbereich (HDR): High Dynamic Range 10 (HDR10)\nRGB-Farbraum: sRGB\nFarbskala: 99%\nHardware-Kalibrierung: Ja\nsRGB Abdeckung (klassisch): 99%\nMarkenspezifische Technologien: Augenpflege+\nSchnellladung: Ja\nConnectShare (USB): Ja\nVESA Adaptive Sync unterst\u00fctzt: Ja\nFlimmerfreie Technologie: Ja\nLow-Blue-Light-Technologie: Ja\nBildschirmspiegelung: Ja\nSmart-Modi: Animation, M-Book, Pers\u00f6nlich\nEingebaute Lautsprecher: Ja\nIntegrierte Kamera: Nein\nAnzahl der Lautsprecher: 2\nRMS-Leistung: 5 W\nMarktpositionierung: Grafikdesign\nProduktfarbe: Schwarz\nRahmenloses Design: Ja\nVorderer Rahmen: Schwarz\nAbnehmbarer Standfu\u00df: Ja\nFu\u00dffarbe: Schwarz\nZertifizierung: TUV, Solidworks, calman , Pantone , Pantone SkinTone\nIntegrierter USB-Hub: Ja\nHDMI: Ja\nKopfh\u00f6rerausgang: Ja\nUSB-Hub-Version: 2.0 / 3.2 Gen 1 (3.1 Gen 1)\nUSB-Upstream-Porttyp: USB Typ-B\nAnzahl der vorgeschalteten Steckpl\u00e4tze: 2\nAnzahl der Upstream-Ports USB Typ-B: 2\nAnzahl der nachgeschalteten Steckpl\u00e4tze vom Typ USB-A: 3\nAnzahl der nachgeschalteten Ports vom Typ USB-C: 1\nUSB-Typ-C DisplayPort-Wechselmodus: Ja\nUSB Power Delivery: Ja\nUSB-Stromversorgung bis zu: 65 W\nAnzahl HDMI-Anschl\u00fcsse: 1\nHDMI-Version: 2.0\nAnzahl DisplayPort Anschl\u00fcsse: 1\nDisplayPorts-Version: 1.4\nAnzahl Thunderbolt 3 Anschl\u00fcsse: 1\nKopfh\u00f6rerausg\u00e4nge: 1\nEingebaute KVM-Umschaltung: Ja\nKVM switch-Anschlussanzahl: 1\nHDCP: Ja\nHDCP-Version: 2.2\nVESA-Halterung: Ja\nH\u00f6henverstellung: Ja\nPanel-Montage-Schnittstelle: 100 x 100 mm\nWandmontage: Ja\nH\u00f6heneinstellung: 15 cm\nPivot: Ja\nPivot Winkel: 0 - 90\u00b0\nSchwenkbar: Ja\nSchwenkwinkelbereich: 270 - 275\u00b0\nNeigungswinkelbereich: -5 - 30\u00b0\nBild-in-Bild: Ja\nOn-Screen-Display (OSD): Ja\nMen\u00fcsprachen: Arabisch, Vereinfachtes Chinesisch, Traditionelles Chinesisch, Tschechisch, Deutsch, Englisch, Spanisch, Franz\u00f6sisch, Ungarisch, Italienisch, Japanisch, Koreanisch, Norwegisch, Polnisch, Portugiesisch, Rum\u00e4nisch, Russisch, Schwedisch\nAnzahl OSD-Sprachen: 18\nNeigungsverstellung: Ja\nEnergieeffizienzklasse (SDR): F\nEnergieeffizienzklasse (HDR): G\nEnergieverbrauch (SDR) pro 1.000 Stunden: 30 kWh\nEnergieverbrauch (HDR) pro 1.000 Stunden: 45 kWh\nStromverbrauch (Standardbetrieb): 31,5 W\nStromverbrauch (Standby): 0,5 W\nStromverbrauch (max.): 168 W\nAC Eingangsspannung: 100 - 240 V\nNetzteiltyp: Intern\nEnergieeffizienzskala: A bis G\nSt\u00e4nder enthalten: Ja\nSchnellstart\u00fcbersicht: Ja\nMitgelieferte Software: Display Pilot\nGer\u00e4tebreite (inkl. Fu\u00df): 714,7 mm\nGer\u00e4tetiefe (inkl. Fu\u00df): 459,4 mm\nGer\u00e4teh\u00f6he (inkl. Fu\u00df): 731,2 mm\nGewicht (mit St\u00e4nder): 10,1 kg\nBreite (ohne Standfu\u00df): 714,7 mm\nTiefe (ohne Standfu\u00df): 82,4 mm\nH\u00f6he (ohne Standfu\u00df): 422 mm\nGewicht (ohne St\u00e4nder): 6,3 kg\nVerpackungsart: Box",
    "reference_file": "offer_reference_33.json",
    "shop_name": "mylemon.at"
}