{
    "html_file": "offer_1481_31.html",
    "name": "Samsung UR550 / UR552 / UR554 (2021), 28\"",
    "offer_link": "https://www.mylemon.at/artikel/samsung/lu28r552uqrxen/dis-28-u28r552uqr-high-resolution.html",
    "price": 425.03,
    "raw_specifications": {
        "AC Eingangsspannung": "100 - 240 V",
        "AMD FreeSync": "Ja",
        "AMD FreeSync-Typ": "FreeSync",
        "Anzahl DisplayPort Anschl\u00fcsse": "1",
        "Anzahl HDMI-Anschl\u00fcsse": "2",
        "Anzahl der Farben des Displays": "1 Milliarden Farben",
        "Artikelnummer": "M15Y4RNL",
        "Aufl\u00f6sung": "3840x2160",
        "Betriebstemperatur": "10 - 40 \u00b0C",
        "Bild f\u00fcr Bild (PbP)": "Ja",
        "Bildschirmdiagonale": "71,1 cm (28 Zoll)",
        "Bildschirmform": "Flach",
        "Bildschirmtechnologie": "LED",
        "Bildwinkel, horizontal": "178\u00b0",
        "Bildwinkel, vertikal": "178\u00b0",
        "Breite (ohne Standfu\u00df)": "63,9 cm",
        "Display-Aufl\u00f6sung": "3840 x 2160 Pixel",
        "DisplayPorts-Version": "1.2",
        "Displaygr\u00f6\u00dfe": "28 Zoll",
        "Dynamisches Kontrastverh\u00e4ltnis Marketingbezeichnung": "Mega DCR",
        "EAN": "8806090961816",
        "Ein/Aus Timer": "Ja",
        "Eingebaute Lautsprecher": "Nein",
        "Energieeffizienzklasse (HDR)": "G",
        "Energieeffizienzklasse (SDR)": "G",
        "Energieeffizienzskala": "A bis G",
        "Energieverbrauch (HDR) pro 1.000 Stunden": "40 kWh",
        "Energieverbrauch (SDR) pro 1.000 Stunden": "32 kWh",
        "Ergonomie": "Neigbar",
        "Flimmerfreie Technologie": "Ja",
        "Fu\u00dffarbe": "Schwarz",
        "Ger\u00e4tebreite (inkl. Fu\u00df)": "638,8 mm",
        "Ger\u00e4teh\u00f6he (inkl. Fu\u00df)": "479,3 mm",
        "Ger\u00e4tetiefe (inkl. Fu\u00df)": "250,5 mm",
        "Gewicht (mit St\u00e4nder)": "5,8 kg",
        "Gewicht (ohne St\u00e4nder)": "5 kg",
        "HD-Typ": "4K Ultra HD",
        "HDMI": "Ja",
        "HDMI-Version": "2.0",
        "Helligkeit": "300 cd/m\u00b2",
        "Helligkeit (typisch)": "300 cd/m\u00b2",
        "Hersteller Artikelnummer": "LU28R552UQRXEN",
        "High Dynamic Range Video (HDR) Unterst\u00fctzung": "Ja",
        "H\u00f6he (ohne Standfu\u00df)": "37,4 cm",
        "H\u00f6henverstellung": "Nein",
        "Integrierte Kamera": "Nein",
        "Integrierter USB-Hub": "Nein",
        "Kabelsperre-Slot": "Nein",
        "Kontrastverh\u00e4ltnis": "1000:1",
        "Kopfh\u00f6rer-Anschluss": "3,5 mm",
        "Kopfh\u00f6rerausgang": "Ja",
        "Kopfh\u00f6rerausg\u00e4nge": "1",
        "Marktpositionierung": "Haus",
        "Maximale Bildwiederholrate": "60 Hz",
        "Mitgelieferte Kabel": "AC, HDMI",
        "NVIDIA G-SYNC": "Nein",
        "Name der Farbe": "Dark Blue Grey",
        "Natives Seitenverh\u00e4ltnis": "16:9",
        "Neigungsverstellung": "Ja",
        "Neigungswinkelbereich": "-2 - 15\u00b0",
        "Netzteil Ausgangsspannung": "19 V",
        "Paketgewicht": "7,8 kg",
        "Panel": "IPS",
        "Panel-Montage-Schnittstelle": "75 x 75 mm",
        "Panel-Typ": "IPS",
        "Plug & Play": "Ja",
        "Produktfarbe": "Blau, Grau",
        "Reaktionszeit": "4 ms",
        "Relative Luftfeuchtigkeit in Betrieb": "10 - 80%",
        "Sichtbare Gr\u00f6\u00dfe (horizontal)": "62,1 cm",
        "Sichtbare Gr\u00f6\u00dfe (vertikal)": "34,1 cm",
        "Spezielle Eigenschaften": "Samsung MagicBright\nSamsung MagicUpscale\nEco Saving Plus\nEye Saver Mode\nEasy Setting Box",
        "Spiel-Modus": "Ja",
        "Stromverbrauch (Standardbetrieb)": "32 W",
        "Stromverbrauch (Standby)": "0,5 W",
        "Stromverbrauch (aus)": "0,3 W",
        "Stromverbrauch (max.)": "48 W",
        "St\u00e4nder enthalten": "Ja",
        "Technologie mit hohem Dynamikbereich (HDR)": "High Dynamic Range 10 (HDR10)",
        "Tiefe (ohne Standfu\u00df)": "6,4 cm",
        "Touchscreen": "Nein",
        "Unterst\u00fctzt Windows-Betriebssysteme": "Windows 10",
        "Unterst\u00fctzte Grafik-Aufl\u00f6sungen": "3840 x 2160",
        "Unterst\u00fctzte Video-Modi": "2160p",
        "VESA Halterung": "75x75 mm",
        "VESA-Halterung": "Ja",
        "Verpackungsart": "Box",
        "Verpackungsbreite": "732 mm",
        "Verpackungsh\u00f6he": "465 mm",
        "Verpackungstiefe": "176 mm",
        "Video Anschl\u00fcsse": "2x HDMI, 1x DisplayPort"
    },
    "raw_specifications_text": "Displaygr\u00f6\u00dfe: 28 Zoll\nAufl\u00f6sung: 3840x2160\nPanel: IPS\nReaktionszeit: 4 ms\nVideo Anschl\u00fcsse: 2x HDMI, 1x DisplayPort\nErgonomie: Neigbar\nVESA Halterung: 75x75 mm\nHelligkeit: 300 cd/m\u00b2\nHersteller Artikelnummer: LU28R552UQRXEN\nEAN: 8806090961816\nArtikelnummer: M15Y4RNL\nBildschirmdiagonale: 71,1 cm (28 Zoll)\nDisplay-Aufl\u00f6sung: 3840 x 2160 Pixel\nNatives Seitenverh\u00e4ltnis: 16:9\nBildschirmtechnologie: LED\nTouchscreen: Nein\nHD-Typ: 4K Ultra HD\nPanel-Typ: IPS\nBildschirmform: Flach\nKontrastverh\u00e4ltnis: 1000:1\nMaximale Bildwiederholrate: 60 Hz\nAnzahl der Farben des Displays: 1 Milliarden Farben\nHelligkeit (typisch): 300 cd/m\u00b2\nUnterst\u00fctzte Grafik-Aufl\u00f6sungen: 3840 x 2160\nUnterst\u00fctzte Video-Modi: 2160p\nDynamisches Kontrastverh\u00e4ltnis Marketingbezeichnung: Mega DCR\nBildwinkel, horizontal: 178\u00b0\nBildwinkel, vertikal: 178\u00b0\nSichtbare Gr\u00f6\u00dfe (horizontal): 62,1 cm\nSichtbare Gr\u00f6\u00dfe (vertikal): 34,1 cm\nHigh Dynamic Range Video (HDR) Unterst\u00fctzung: Ja\nTechnologie mit hohem Dynamikbereich (HDR): High Dynamic Range 10 (HDR10)\nNVIDIA G-SYNC: Nein\nAMD FreeSync: Ja\nAMD FreeSync-Typ: FreeSync\nFlimmerfreie Technologie: Ja\nSpiel-Modus: Ja\nUnterst\u00fctzt Windows-Betriebssysteme: Windows 10\nEingebaute Lautsprecher: Nein\nIntegrierte Kamera: Nein\nMarktpositionierung: Haus\nProduktfarbe: Blau, Grau\nName der Farbe: Dark Blue Grey\nFu\u00dffarbe: Schwarz\nIntegrierter USB-Hub: Nein\nHDMI: Ja\nKopfh\u00f6rerausgang: Ja\nAnzahl HDMI-Anschl\u00fcsse: 2\nHDMI-Version: 2.0\nAnzahl DisplayPort Anschl\u00fcsse: 1\nDisplayPorts-Version: 1.2\nKopfh\u00f6rerausg\u00e4nge: 1\nKopfh\u00f6rer-Anschluss: 3,5 mm\nVESA-Halterung: Ja\nKabelsperre-Slot: Nein\nH\u00f6henverstellung: Nein\nPanel-Montage-Schnittstelle: 75 x 75 mm\nNeigungswinkelbereich: -2 - 15\u00b0\nPlug & Play: Ja\nNeigungsverstellung: Ja\nEnergieeffizienzklasse (SDR): G\nEnergieeffizienzklasse (HDR): G\nEnergieverbrauch (SDR) pro 1.000 Stunden: 32 kWh\nEnergieverbrauch (HDR) pro 1.000 Stunden: 40 kWh\nStromverbrauch (Standardbetrieb): 32 W\nStromverbrauch (Standby): 0,5 W\nStromverbrauch (max.): 48 W\nStromverbrauch (aus): 0,3 W\nAC Eingangsspannung: 100 - 240 V\nNetzteil Ausgangsspannung: 19 V\nEnergieeffizienzskala: A bis G\nBetriebstemperatur: 10 - 40 \u00b0C\nRelative Luftfeuchtigkeit in Betrieb: 10 - 80%\nSt\u00e4nder enthalten: Ja\nMitgelieferte Kabel: AC, HDMI\nGer\u00e4tebreite (inkl. Fu\u00df): 638,8 mm\nGer\u00e4tetiefe (inkl. Fu\u00df): 250,5 mm\nGer\u00e4teh\u00f6he (inkl. Fu\u00df): 479,3 mm\nGewicht (mit St\u00e4nder): 5,8 kg\nBreite (ohne Standfu\u00df): 63,9 cm\nTiefe (ohne Standfu\u00df): 6,4 cm\nH\u00f6he (ohne Standfu\u00df): 37,4 cm\nGewicht (ohne St\u00e4nder): 5 kg\nVerpackungsbreite: 732 mm\nVerpackungstiefe: 176 mm\nVerpackungsh\u00f6he: 465 mm\nPaketgewicht: 7,8 kg\nVerpackungsart: Box\nBild f\u00fcr Bild (PbP): Ja\nEin/Aus Timer: Ja\nSpezielle Eigenschaften: Samsung MagicBright\nSamsung MagicUpscale\nEco Saving Plus\nEye Saver Mode\nEasy Setting Box",
    "reference_file": "offer_reference_1481.json",
    "shop_name": "mylemon.at"
}