{
    "html_file": "offer_2427_22.html",
    "name": "LG 24BK55WY-B, 24\"",
    "offer_link": "https://www.electronicshop24.at/product_info.php?products_id=160000001014056286&ano=S1014056286&mno=24BK55WY-B&ean=8806084820495&utm_medium=cpc&utm_campaign=preisvergleich&utm_content=item&utm_source=geizhals&ref=geizhals",
    "price": 155.0,
    "raw_specifications": {
        "Abmessungen (Breite x Tiefe x H\u00f6he)": "55.8 cm x 23.9 cm x 39.5 cm - mit Fu\u00df",
        "Ausgangsleistung/Kanal": "1 Watt",
        "Besonderheiten": "Mega Dynamic Contrast Ratio, Multiscan Support, Flicker Safe, Reader Mode, ohne Quecksilber, Intelligente Energiespartechnologie, Color Calibrated, One Click Stand, Mini-PC aufsetzbar",
        "Bildschirmbeschichtung": "Blendfrei, 3H Hard Coating",
        "Bildschirmtyp": "AH-IPS",
        "Details zu Abmessungen & Gewicht": "Mit Fu\u00df - Breite: 55.8 cm - Tiefe: 23.9 cm - H\u00f6he: 39.5 cm - Gewicht: 5.4 kg \u00a6 Ohne Fu\u00df - Breite: 55.8 cm - Tiefe: 5.8 cm - H\u00f6he: 37 cm - Gewicht: 4.8 kg",
        "Diagonalabmessung": "60.96 cm (24\")",
        "Display-Typ": "LED-hintergrundbeleuchteter LCD-Monitor / TFT-Aktivmatrix",
        "ENERGY STAR zertifiziert": "Ja",
        "Einstellungen der Anzeigeposition": "H\u00f6he, Pivot (Rotation), Neigung",
        "Energie Effizienzklasse": "Klasse G",
        "Enthaltene Kabel": "1 x Audiokabel - 1.8 m \u00a6 1 x USB-Kabel \u00a6 1 x DVI-Kabel - 1.8 m \u00a6 1 x DisplayPort-Kabel",
        "Erforderliche Netzspannung": "Wechselstrom 120/230 V (50/60 Hz)",
        "Farbe": "Dunkelanthrazit",
        "Farbunterst\u00fctzung": "16,7 Millionen Farben",
        "Gewicht": "5.4 kg",
        "Helligkeit": "300 cd/m\u00b2",
        "Hintergrundbeleuchtungs-Technologie": "WLED",
        "Horizontale Bildwiederholrate": "30 - 83 kHz",
        "Horizontaler Betrachtungswinkel": "178",
        "H\u00f6heneinstellung": "130 mm",
        "Integrierte Peripherieger\u00e4te": "USB 2.0 Hub",
        "Kennzeichnung": "Plug and Play, CSA, UL, TUV GS, NEMKO, SEMKO, EN 61000-3-3, EN55024, TUV Ergo, DDC/CI, RoHS, Directive 2006/95/CE, EN 60950-1:2006, EN61000-3-2:2006, EMC 2004/108/EC, EN55022:2006 Class B, DIN ISO 9241-307, EPA 7.0",
        "Kontrast": "1000:1",
        "Lebensdauer der Beleuchtung": "50,000 Stunden",
        "Leistungsmerkmale": "Slot f\u00fcr Sicherheitsschloss (Kabelschloss getrennt erh\u00e4ltlich)",
        "MTBF": "70,000 Stunde(n)",
        "Native Aufl\u00f6sung": "Full HD (1080p) 1920 x 1200",
        "Neigungswinkel": "-5/+35",
        "Pixelpitch": "0.269 mm",
        "Reaktionszeit": "5 ms (Gray-to-Gray)",
        "Rotationswinkel": "180",
        "Schnittstellen": "DVI-D \u00a6 VGA \u00a6 2 x USB 2.0 \u00a6 Audio Line-In \u00a6 Kopfh\u00f6rer \u00a6 DisplayPort",
        "Seitenverh\u00e4ltnis": "16:10",
        "Service & Support": "- Leuchtpult - 3 Jahre",
        "Stromverbrauch (Aus-Modus)": "0 Watt",
        "Stromverbrauch (eingeschaltet)": "24 kWh/1.000 h",
        "Stromverbrauch (typisch)": "26 Watt",
        "Stromverbrauch im Standby-Modus": "0.3 Watt",
        "Typ": "Lautsprecher - Stereo",
        "VESA-Halterung": "100 x 100 mm, 200 x 100 mm",
        "Vertikale Bildwiederholrate": "56 - 75 Hz",
        "Vertikaler Betrachtungswinkel": "178"
    },
    "raw_specifications_text": "Display-Typ: LED-hintergrundbeleuchteter LCD-Monitor / TFT-Aktivmatrix\nEnergie Effizienzklasse: Klasse G\nDiagonalabmessung: 60.96 cm (24\")\nIntegrierte Peripherieger\u00e4te: USB 2.0 Hub\nBildschirmtyp: AH-IPS\nSeitenverh\u00e4ltnis: 16:10\nNative Aufl\u00f6sung: Full HD (1080p) 1920 x 1200\nPixelpitch: 0.269 mm\nHelligkeit: 300 cd/m\u00b2\nKontrast: 1000:1\nFarbunterst\u00fctzung: 16,7 Millionen Farben\nReaktionszeit: 5 ms (Gray-to-Gray)\nVertikale Bildwiederholrate: 56 - 75 Hz\nHorizontale Bildwiederholrate: 30 - 83 kHz\nHorizontaler Betrachtungswinkel: 178\nVertikaler Betrachtungswinkel: 178\nBildschirmbeschichtung: Blendfrei, 3H Hard Coating\nHintergrundbeleuchtungs-Technologie: WLED\nBesonderheiten: Mega Dynamic Contrast Ratio, Multiscan Support, Flicker Safe, Reader Mode, ohne Quecksilber, Intelligente Energiespartechnologie, Color Calibrated, One Click Stand, Mini-PC aufsetzbar\nFarbe: Dunkelanthrazit\nAbmessungen (Breite x Tiefe x H\u00f6he): 55.8 cm x 23.9 cm x 39.5 cm - mit Fu\u00df\nGewicht: 5.4 kg\nTyp: Lautsprecher - Stereo\nAusgangsleistung/Kanal: 1 Watt\nSchnittstellen: DVI-D \u00a6 VGA \u00a6 2 x USB 2.0 \u00a6 Audio Line-In \u00a6 Kopfh\u00f6rer \u00a6 DisplayPort\nEinstellungen der Anzeigeposition: H\u00f6he, Pivot (Rotation), Neigung\nNeigungswinkel: -5/+35\nRotationswinkel: 180\nH\u00f6heneinstellung: 130 mm\nVESA-Halterung: 100 x 100 mm, 200 x 100 mm\nLeistungsmerkmale: Slot f\u00fcr Sicherheitsschloss (Kabelschloss getrennt erh\u00e4ltlich)\nEnthaltene Kabel: 1 x Audiokabel - 1.8 m \u00a6 1 x USB-Kabel \u00a6 1 x DVI-Kabel - 1.8 m \u00a6 1 x DisplayPort-Kabel\nLebensdauer der Beleuchtung: 50,000 Stunden\nMTBF: 70,000 Stunde(n)\nKennzeichnung: Plug and Play, CSA, UL, TUV GS, NEMKO, SEMKO, EN 61000-3-3, EN55024, TUV Ergo, DDC/CI, RoHS, Directive 2006/95/CE, EN 60950-1:2006, EN61000-3-2:2006, EMC 2004/108/EC, EN55022:2006 Class B, DIN ISO 9241-307, EPA 7.0\nErforderliche Netzspannung: Wechselstrom 120/230 V (50/60 Hz)\nStromverbrauch (eingeschaltet): 24 kWh/1.000 h\nStromverbrauch (typisch): 26 Watt\nStromverbrauch im Standby-Modus: 0.3 Watt\nStromverbrauch (Aus-Modus): 0 Watt\nDetails zu Abmessungen & Gewicht: Mit Fu\u00df - Breite: 55.8 cm - Tiefe: 23.9 cm - H\u00f6he: 39.5 cm - Gewicht: 5.4 kg \u00a6 Ohne Fu\u00df - Breite: 55.8 cm - Tiefe: 5.8 cm - H\u00f6he: 37 cm - Gewicht: 4.8 kg\nENERGY STAR zertifiziert: Ja\nService & Support: - Leuchtpult - 3 Jahre",
    "reference_file": "offer_reference_2427.json",
    "shop_name": "ElectronicShop24"
}