{
    "html_file": "offer_2170_8.html",
    "name": "iiyama ProLite XUB2595WSU-B1, 25\"",
    "offer_link": "https://direkt.jacob.de/produkte/iiyama-prolite-25-xub2595wsu-b1-artnr-5052808.html?utm_source=geizhals&utm_medium=cpc&utm_campaign=Preisvergleich&ref=103",
    "price": 239.93,
    "raw_specifications": {
        "Abmessungen (Breite x Tiefe x H\u00f6he)": "54.65 cm x 39.9 cm x 52.9 cm",
        "Ausgangsleistung/Kanal": "2 Watt",
        "Besonderheiten": "Ultra Slim Design, flimmerfreie Technologie",
        "Bildschirmtyp": "AH-IPS",
        "Diagonalabmessung": "63.36 cm (25\")",
        "Display-Typ": "LED-hintergrundbeleuchteter LCD-Monitor / TFT-Aktivmatrix",
        "ENERGY STAR zertifiziert": "Ja",
        "Eingangsanschl\u00fcsse": "HDMI, VGA, DisplayPort",
        "Einstellungen der Anzeigeposition": "H\u00f6he, Pivot (Rotation)",
        "Energie Effizienzklasse": "E",
        "Enthaltene Kabel": "1 x DisplayPort-Kabel  1 x USB-Kabel",
        "Farbe": "Mattschwarz",
        "Farbunterst\u00fctzung": "16,7 Millionen Farben",
        "Ger\u00e4tetyp": "LED-hintergrundbeleuchteter LCD-Monitor - 63.36 cm (25\")",
        "Gewicht": "5.2 kg",
        "Helligkeit": "300 cd/m\u00b2",
        "Hintergrundbeleuchtungs-Technologie": "LED-Hintergrundbeleuchtung",
        "Horizontaler Betrachtungswinkel": "178",
        "H\u00f6heneinstellung": "90 mm",
        "Integrierte Peripherieger\u00e4te": "USB 2.0 Hub",
        "Kennzeichnung": "VESA DPMS, CB, TUV Bauart, TCO Displays, EAC",
        "Kontrast": "1000:1 / 5000000:1 (dynamisch)",
        "Leistungsaufnahme im Betrieb": "28 Watt",
        "Leistungsmerkmale": "USB 2.0 Hub",
        "Native Aufl\u00f6sung": "Full HD (1080p) 1920 x 1200",
        "Produktbeschreibung": "iiyama ProLite XUB2595WSU-B1 - LED-Monitor - Full HD (1080p) - 63.36 cm (25\")",
        "Reaktionszeit": "4 ms",
        "Rotationswinkel": "180",
        "Schnittstellen": "VGA  HDMI  DisplayPort  USB 2.0 Upstream (Typ B)  2 x USB 2.0 Downstream (Typ A)  Kopfh\u00f6rer (Mini-Buchse)",
        "Stromverbrauch im Standby-Modus": "0.5 Watt",
        "Typ": "Lautsprecher - Stereo",
        "Umweltschutzstandards": "ENERGY STAR-qualifiziert",
        "Vertikaler Betrachtungswinkel": "178"
    },
    "raw_specifications_text": "Produktbeschreibung: iiyama ProLite XUB2595WSU-B1 - LED-Monitor - Full HD (1080p) - 63.36 cm (25\")\nEnergie Effizienzklasse: E\nGer\u00e4tetyp: LED-hintergrundbeleuchteter LCD-Monitor - 63.36 cm (25\")\nLeistungsmerkmale: USB 2.0 Hub\nBildschirmtyp: AH-IPS\nNative Aufl\u00f6sung: Full HD (1080p) 1920 x 1200\nHelligkeit: 300 cd/m\u00b2\nKontrast: 1000:1 / 5000000:1 (dynamisch)\nReaktionszeit: 4 ms\nFarbunterst\u00fctzung: 16,7 Millionen Farben\nEingangsanschl\u00fcsse: HDMI, VGA, DisplayPort\nEinstellungen der Anzeigeposition: H\u00f6he, Pivot (Rotation)\nFarbe: Mattschwarz\nAbmessungen (Breite x Tiefe x H\u00f6he): 54.65 cm x 39.9 cm x 52.9 cm\nGewicht: 5.2 kg\nUmweltschutzstandards: ENERGY STAR-qualifiziert\nKennzeichnung: VESA DPMS, CB, TUV Bauart, TCO Displays, EAC\nDisplay-Typ: LED-hintergrundbeleuchteter LCD-Monitor / TFT-Aktivmatrix\nDiagonalabmessung: 63.36 cm (25\")\nIntegrierte Peripherieger\u00e4te: USB 2.0 Hub\nHorizontaler Betrachtungswinkel: 178\nVertikaler Betrachtungswinkel: 178\nHintergrundbeleuchtungs-Technologie: LED-Hintergrundbeleuchtung\nBesonderheiten: Ultra Slim Design, flimmerfreie Technologie\nTyp: Lautsprecher - Stereo\nAusgangsleistung/Kanal: 2 Watt\nSchnittstellen: VGA  HDMI  DisplayPort  USB 2.0 Upstream (Typ B)  2 x USB 2.0 Downstream (Typ A)  Kopfh\u00f6rer (Mini-Buchse)\nRotationswinkel: 180\nH\u00f6heneinstellung: 90 mm\nEnthaltene Kabel: 1 x DisplayPort-Kabel  1 x USB-Kabel\nLeistungsaufnahme im Betrieb: 28 Watt\nStromverbrauch im Standby-Modus: 0.5 Watt\nENERGY STAR zertifiziert: Ja",
    "reference_file": "offer_reference_2170.json",
    "shop_name": "Jacob Elektronik direkt (AT)"
}