{
    "html_file": "offer_309_3.html",
    "name": "LG 24MP400P-B, 23.8\"",
    "offer_link": "https://direkt.jacob.de/produkte/lg-24mp400p-b-computerbildschirm-24mp400p-b-artnr-9106215.html?utm_source=geizhals&utm_medium=cpc&utm_campaign=Preisvergleich&ref=103",
    "price": 123.12,
    "raw_specifications": {
        "AMD FreeSync": "Ja",
        "Anzahl HDMI-Anschl\u00fcsse": "1",
        "Anzahl VGA (D-Sub) Anschl\u00fcsse": "1",
        "Anzahl der Farben des Displays": "16,7 Millionen Farben",
        "Betriebsanleitung": "Ja",
        "Bildschirmdiagonale": "60,5 cm (23.8\" )",
        "Bildschirmdiagonale (cm)": "60,4 cm",
        "Bildschirmform": "Flach",
        "Bildschirmtechnologie": "LED",
        "Bildwinkel, horizontal": "178\u00b0",
        "Bildwinkel, vertikal": "178\u00b0",
        "Breite (ohne Standfu\u00df)": "54 cm",
        "Display-Aufl\u00f6sung": "1920 x 1080 Pixel",
        "Eingebaute Lautsprecher": "Nein",
        "Energie Effizienzklasse": "E",
        "Energieeffizienzklasse (SDR)": "E",
        "Energieverbrauch (SDR) pro 1.000 Stunden": "20 kWh",
        "Flimmerfreie Technologie": "Ja",
        "Fu\u00dffarbe": "Schwarz",
        "Ger\u00e4tebreite (inkl. Fu\u00df)": "539,9 mm",
        "Ger\u00e4teh\u00f6he (inkl. Fu\u00df)": "414,4 mm",
        "Ger\u00e4tetiefe (inkl. Fu\u00df)": "190 mm",
        "Gewicht (mit St\u00e4nder)": "2,6 kg",
        "Gewicht (ohne St\u00e4nder)": "2,3 kg",
        "Gleichstrom-Anschluss (DC)": "Ja",
        "HD-Typ": "Full HD",
        "HDMI": "Ja",
        "Helligkeit (peak)": "250 cd/m\u00b2",
        "H\u00f6he (ohne Standfu\u00df)": "32,1 cm",
        "H\u00f6henverstellung": "Nein",
        "Integrierte Kamera": "Nein",
        "Integrierter USB-Hub": "Nein",
        "Kabelsperre-Slot": "Ja",
        "Kontrastverh\u00e4ltnis": "1000:1",
        "Kopfh\u00f6rerausgang": "Nein",
        "Markenspezifische Technologien": "Crosshair, DAS Mode",
        "Maximale Bildwiederholrate": "75 Hz",
        "Mitgelieferte Kabel": "AC, HDMI",
        "NVIDIA G-SYNC": "Nein",
        "Natives Seitenverh\u00e4ltnis": "16:9",
        "On-Screen-Display (OSD)": "Ja",
        "Paketgewicht": "3,9 kg",
        "Panel-Montage-Schnittstelle": "75 x 75 mm",
        "Panel-Typ": "IPS",
        "Pixel Abstand": "0,2745 x 0,2746 mm",
        "Produktfarbe": "Schwarz",
        "Reaktionszeit": "5 ms",
        "Schnellstart\u00fcbersicht": "Ja",
        "Stromverbrauch (Standardbetrieb)": "19 W",
        "Stromverbrauch (Standby)": "0,3 W",
        "Stromverbrauch (aus)": "0,3 W",
        "St\u00e4nder enthalten": "Ja",
        "Tiefe (ohne Standfu\u00df)": "5,62 cm",
        "Touchscreen": "Nein",
        "Unterst\u00fctzte Grafik-Aufl\u00f6sungen": "1920 x 1080 (HD 1080)",
        "VESA-Halterung": "Ja",
        "Verpackungsart": "Box",
        "Vorderer Rahmen": "Schwarz"
    },
    "raw_specifications_text": "Bildschirmdiagonale: 60,5 cm (23.8\" )\nDisplay-Aufl\u00f6sung: 1920 x 1080 Pixel\nNatives Seitenverh\u00e4ltnis: 16:9\nEnergie Effizienzklasse: E\nBildschirmtechnologie: LED\nTouchscreen: Nein\nHD-Typ: Full HD\nPanel-Typ: IPS\nBildschirmform: Flach\nKontrastverh\u00e4ltnis: 1000:1\nMaximale Bildwiederholrate: 75 Hz\nAnzahl der Farben des Displays: 16,7 Millionen Farben\nHelligkeit (peak): 250 cd/m\u00b2\nReaktionszeit: 5 ms\nUnterst\u00fctzte Grafik-Aufl\u00f6sungen: 1920 x 1080 (HD 1080)\nBildwinkel, horizontal: 178\u00b0\nBildwinkel, vertikal: 178\u00b0\nPixel Abstand: 0,2745 x 0,2746 mm\nBildschirmdiagonale (cm): 60,4 cm\nNVIDIA G-SYNC: Nein\nAMD FreeSync: Ja\nMarkenspezifische Technologien: Crosshair, DAS Mode\nFlimmerfreie Technologie: Ja\nEingebaute Lautsprecher: Nein\nIntegrierte Kamera: Nein\nProduktfarbe: Schwarz\nVorderer Rahmen: Schwarz\nFu\u00dffarbe: Schwarz\nIntegrierter USB-Hub: Nein\nHDMI: Ja\nKopfh\u00f6rerausgang: Nein\nAnzahl VGA (D-Sub) Anschl\u00fcsse: 1\nAnzahl HDMI-Anschl\u00fcsse: 1\nGleichstrom-Anschluss (DC): Ja\nVESA-Halterung: Ja\nKabelsperre-Slot: Ja\nH\u00f6henverstellung: Nein\nPanel-Montage-Schnittstelle: 75 x 75 mm\nOn-Screen-Display (OSD): Ja\nEnergieeffizienzklasse (SDR): E\nEnergieverbrauch (SDR) pro 1.000 Stunden: 20 kWh\nStromverbrauch (Standardbetrieb): 19 W\nStromverbrauch (Standby): 0,3 W\nStromverbrauch (aus): 0,3 W\nSt\u00e4nder enthalten: Ja\nMitgelieferte Kabel: AC, HDMI\nSchnellstart\u00fcbersicht: Ja\nBetriebsanleitung: Ja\nGer\u00e4tebreite (inkl. Fu\u00df): 539,9 mm\nGer\u00e4tetiefe (inkl. Fu\u00df): 190 mm\nGer\u00e4teh\u00f6he (inkl. Fu\u00df): 414,4 mm\nGewicht (mit St\u00e4nder): 2,6 kg\nBreite (ohne Standfu\u00df): 54 cm\nTiefe (ohne Standfu\u00df): 5,62 cm\nH\u00f6he (ohne Standfu\u00df): 32,1 cm\nGewicht (ohne St\u00e4nder): 2,3 kg\nPaketgewicht: 3,9 kg\nVerpackungsart: Box",
    "reference_file": "offer_reference_309.json",
    "shop_name": "Jacob Elektronik direkt (AT)"
}