{
    "html_file": "offer_704_12.html",
    "name": "HP P24h G5, 23.8\"",
    "offer_link": "https://www.proshop.at/Bildschirm/HP-24-Bildschirm-P24h-G5-Black-5-ms/3110591?utm_source=geizhals&utm_medium=cpc&utm_campaign=pricesite",
    "price": 144.96,
    "raw_specifications": {
        "Abmessungen (Breite x Tiefe x H\u00f6he)": "53.89 cm x 19.64 cm x 46.92 cm - mit Fu\u00df",
        "Abmessungen (Breite x Tiefe x H\u00f6he) - mit Fu\u00df": "53.89 cm x 19.64 cm x 46.92 cm",
        "Ausgangsleistung/Kanal": "2 Watt",
        "Besonderheiten": "HDCP, Frame Rate Control (FRC), On-screen Digital Controls, Low Blue Light Mode, flimmerfreie Technologie, extrem schmale Blende an drei Seiten",
        "Bildschirmbeschichtung": "Blendfrei",
        "Bildschirmtyp": "IPS",
        "Details zu Abmessungen & Gewicht": "Mit Fu\u00df - Breite: 53.89 cm - Tiefe: 19.64 cm - H\u00f6he: 46.92 cm - Gewicht: 4.6 kg  Ohne Fu\u00df - Breite: 53.89 cm - Tiefe: 5.15 cm - H\u00f6he: 32.36 cm - Gewicht: 3.38 kg",
        "Diagonalabmessung": "60.5 cm (23.8\")",
        "Display-Typ": "LED-hintergrundbeleuchteter LCD-Monitor / TFT-Aktivmatrix",
        "EAN": "0196548132300",
        "ENERGY STAR zertifiziert": "Ja",
        "Eingangsanschl\u00fcsse": "HDMI, VGA, DisplayPort",
        "Eingangsspannung": "(50/60 Hz)",
        "Einstellungen der Anzeigeposition": "H\u00f6he, Neigung",
        "Energie Effizienzklasse": "Klasse E",
        "Enthaltene Kabel": "1 x VGA-Kabel - 1.8 m  1 x HDMI-Kabel - 1.8 m",
        "Farbe": "Schwarz",
        "Farbraum": "72% NTSC",
        "Farbtemperatur": "6500K",
        "Ger\u00e4tetyp": "LED-hintergrundbeleuchteter LCD-Monitor - 60.5 cm (23.8\")",
        "Gewicht": "4.6 kg",
        "Helligkeit": "250 cd/m\u00b2",
        "Hersteller": "HP",
        "Hintergrundbeleuchtungs-Technologie": "LED-Hintergrundbeleuchtung",
        "Horizontale Bildwiederholrate": "30 - 86 kHz",
        "Horizontaler Betrachtungswinkel": "178",
        "H\u00f6heneinstellung": "100 mm",
        "Kennzeichnung": "VCCI, CB, CCC, FCC, RoHS, KCC, ICES, cTUVus, CEC, KC, ERP, CECP, CEL, EAC, CEL Grade 1, SEPA, halogenarm, TUV Rheinland Flicker Free Certification, EU RoHS, Energy-using Products (EuP) Lot 26, UAE, Australia MEPS",
        "Kontrast": "1000:1 / 8000000:1 (dynamisch)",
        "Lebensdauer der Beleuchtung": "30,000 Stunden",
        "Leistungsaufnahme im Ein-Zustand": "15 W",
        "Leistungsmerkmale": "Slot f\u00fcr Sicherheitsschloss (Kabelschloss getrennt erh\u00e4ltlich), abnehmbarer St\u00e4nder, Unterst\u00fctzung f\u00fcr VESA-Schnittstelle",
        "Lokalisierung": "Englisch / Europa",
        "Mitgelieferte Software": "HP Display Center, HP Display Manager",
        "Modell": "64W34AA#ABB",
        "Native Aufl\u00f6sung": "Full HD (1080p) 1920 x 1080 bei 75 Hz",
        "Neigungswinkel": "-5/+23",
        "OSD-Sprachen": "Chinesisch (tradionell), Chinesisch (vereinfacht), Englisch, Deutsch, Franz\u00f6sisch, Italienisch, Portugiesisch, Russisch, Spanisch, Holl\u00e4ndisch, Japanisch",
        "Pixelpitch": "0.2744 mm",
        "Ppi": "93",
        "Produktbeschreibung": "HP P24h G5 - LED-Monitor - Full HD (1080p) - 60.5 cm (23.8\")",
        "Reaktionszeit": "5 ms (grau zu grau mit \u00dcbersteuerung)",
        "Schlosstyp zur Diebstahlsicherung": "Kensington Slot",
        "Schnittstellen": "DisplayPort (HDCP)  HDMI (HDCP)  VGA",
        "Seitenverh\u00e4ltnis": "16:9",
        "Spannung": "(50/60 Hz)",
        "Stromverbrauch (max.)": "28 Watt",
        "Stromverbrauch (typisch)": "18 Watt",
        "Stromverbrauch SDR (eingeschaltet)": "15 kWh/1.000 h",
        "Stromverbrauch im Standby-Modus": "0.5 Watt",
        "Transportbreite": "59.5 cm",
        "Transportgewicht": "6.74 kg",
        "Transporth\u00f6he": "39.1 cm",
        "Transporttiefe": "12.4 cm",
        "Typ": "Lautsprecher - Stereo",
        "Umweltschutzstandards": "ENERGY STAR-qualifiziert",
        "VESA-Halterung": "100 x 100 mm",
        "Vertikale Bildwiederholrate": "48 - 75 Hz",
        "Vertikaler Betrachtungswinkel": "178",
        "Waren-Nr.": "3110591",
        "Zum Hersteller": "www.hp.com"
    },
    "raw_specifications_text": "Hersteller: HP\nWaren-Nr.: 3110591\nModell: 64W34AA#ABB\nEAN: 0196548132300\nZum Hersteller: www.hp.com\nProduktbeschreibung: HP P24h G5 - LED-Monitor - Full HD (1080p) - 60.5 cm (23.8\")\nGer\u00e4tetyp: LED-hintergrundbeleuchteter LCD-Monitor - 60.5 cm (23.8\")\nEnergie Effizienzklasse: Klasse E\nLeistungsaufnahme im Ein-Zustand: 15 W\nBildschirmtyp: IPS\nSeitenverh\u00e4ltnis: 16:9\nNative Aufl\u00f6sung: Full HD (1080p) 1920 x 1080 bei 75 Hz\nPixelpitch: 0.2744 mm\nHelligkeit: 250 cd/m\u00b2\nKontrast: 1000:1 / 8000000:1 (dynamisch)\nReaktionszeit: 5 ms (grau zu grau mit \u00dcbersteuerung)\nFarbraum: 72% NTSC\nEingangsanschl\u00fcsse: HDMI, VGA, DisplayPort\nEinstellungen der Anzeigeposition: H\u00f6he, Neigung\nBildschirmbeschichtung: Blendfrei\nSpannung: (50/60 Hz)\nFarbe: Schwarz\nAbmessungen (Breite x Tiefe x H\u00f6he) - mit Fu\u00df: 53.89 cm x 19.64 cm x 46.92 cm\nGewicht: 4.6 kg\nLokalisierung: Englisch / Europa\nUmweltschutzstandards: ENERGY STAR-qualifiziert\nKennzeichnung: VCCI, CB, CCC, FCC, RoHS, KCC, ICES, cTUVus, CEC, KC, ERP, CECP, CEL, EAC, CEL Grade 1, SEPA, halogenarm, TUV Rheinland Flicker Free Certification, EU RoHS, Energy-using Products (EuP) Lot 26, UAE, Australia MEPS\nDisplay-Typ: LED-hintergrundbeleuchteter LCD-Monitor / TFT-Aktivmatrix\nDiagonalabmessung: 60.5 cm (23.8\")\nPpi: 93\nVertikale Bildwiederholrate: 48 - 75 Hz\nHorizontale Bildwiederholrate: 30 - 86 kHz\nHorizontaler Betrachtungswinkel: 178\nVertikaler Betrachtungswinkel: 178\nHintergrundbeleuchtungs-Technologie: LED-Hintergrundbeleuchtung\nFarbtemperatur: 6500K\nOSD-Sprachen: Chinesisch (tradionell), Chinesisch (vereinfacht), Englisch, Deutsch, Franz\u00f6sisch, Italienisch, Portugiesisch, Russisch, Spanisch, Holl\u00e4ndisch, Japanisch\nBesonderheiten: HDCP, Frame Rate Control (FRC), On-screen Digital Controls, Low Blue Light Mode, flimmerfreie Technologie, extrem schmale Blende an drei Seiten\nAbmessungen (Breite x Tiefe x H\u00f6he): 53.89 cm x 19.64 cm x 46.92 cm - mit Fu\u00df\nTyp: Lautsprecher - Stereo\nAusgangsleistung/Kanal: 2 Watt\nSchnittstellen: DisplayPort (HDCP)  HDMI (HDCP)  VGA\nNeigungswinkel: -5/+23\nH\u00f6heneinstellung: 100 mm\nVESA-Halterung: 100 x 100 mm\nLeistungsmerkmale: Slot f\u00fcr Sicherheitsschloss (Kabelschloss getrennt erh\u00e4ltlich), abnehmbarer St\u00e4nder, Unterst\u00fctzung f\u00fcr VESA-Schnittstelle\nEnthaltene Kabel: 1 x VGA-Kabel - 1.8 m  1 x HDMI-Kabel - 1.8 m\nLebensdauer der Beleuchtung: 30,000 Stunden\nSchlosstyp zur Diebstahlsicherung: Kensington Slot\nEingangsspannung: (50/60 Hz)\nStromverbrauch SDR (eingeschaltet): 15 kWh/1.000 h\nStromverbrauch (typisch): 18 Watt\nStromverbrauch (max.): 28 Watt\nStromverbrauch im Standby-Modus: 0.5 Watt\nMitgelieferte Software: HP Display Center, HP Display Manager\nDetails zu Abmessungen & Gewicht: Mit Fu\u00df - Breite: 53.89 cm - Tiefe: 19.64 cm - H\u00f6he: 46.92 cm - Gewicht: 4.6 kg  Ohne Fu\u00df - Breite: 53.89 cm - Tiefe: 5.15 cm - H\u00f6he: 32.36 cm - Gewicht: 3.38 kg\nTransportbreite: 59.5 cm\nTransporttiefe: 12.4 cm\nTransporth\u00f6he: 39.1 cm\nTransportgewicht: 6.74 kg\nENERGY STAR zertifiziert: Ja",
    "reference_file": "offer_reference_704.json",
    "shop_name": "Proshop.at"
}