{
    "html_file": "offer_819_6.html",
    "name": "Eizo FlexScan EV2781 wei\u00df, 27\"",
    "offer_link": "https://www.mylemon.at/artikel/eizo/ev2781_wt/68-5cm-27-ev2781-wt.html",
    "price": 571.41,
    "raw_specifications": {
        "AC Eingangsfrequenz": "50 - 60 Hz",
        "AC Eingangsspannung": "100 - 240 V",
        "AMD FreeSync": "Nein",
        "Anzahl DisplayPort Anschl\u00fcsse": "1",
        "Anzahl HDMI-Anschl\u00fcsse": "1",
        "Anzahl der Farben des Displays": "16,7 Millionen Farben",
        "Anzahl der Lautsprecher": "2",
        "Anzahl der Upstream-Ports USB Typ-C": "1",
        "Anzahl der nachgeschalteten Steckpl\u00e4tze vom Typ USB-A": "4",
        "Anzahl der vorgeschalteten Steckpl\u00e4tze": "1",
        "Artikelnummer": "M1EY5FDL",
        "Aufl\u00f6sung": "2560x1440",
        "Besonderheiten": "Lautsprecher, USB HUB",
        "Betriebstemperatur": "5 - 35 \u00b0C",
        "Bildschirmdiagonale": "68,6 cm (27 Zoll)",
        "Bildschirmdiagonale (cm)": "68,5 cm",
        "Bildschirmform": "Flach",
        "Bildschirmtechnologie": "LED",
        "Bildwinkel, horizontal": "178\u00b0",
        "Bildwinkel, vertikal": "178\u00b0",
        "Breite (ohne Standfu\u00df)": "61,1 cm",
        "Display-Aufl\u00f6sung": "2560 x 1440 Pixel",
        "Displaygr\u00f6\u00dfe": "27 Zoll",
        "EAN": "4995047063445",
        "Eingebaute Lautsprecher": "Ja",
        "Energieeffizienzklasse (SDR)": "D",
        "Energieeffizienzskala": "A bis G",
        "Energieverbrauch (SDR) pro 1.000 Stunden": "17 kWh",
        "Ergonomie": "H\u00f6henverstellbar, Pivot (90 Grad drehbar), Schwenkbar, Neigbar",
        "Ger\u00e4tebreite (inkl. Fu\u00df)": "611 mm",
        "Ger\u00e4teh\u00f6he (inkl. Fu\u00df)": "369 mm",
        "Ger\u00e4tetiefe (inkl. Fu\u00df)": "230 mm",
        "Gewicht (mit St\u00e4nder)": "8,5 kg",
        "Gewicht (ohne St\u00e4nder)": "5,7 kg",
        "HD-Typ": "Quad HD",
        "HDCP": "Ja",
        "HDMI": "Ja",
        "Helligkeit": "350 cd/m\u00b2",
        "Helligkeit (typisch)": "350 cd/m\u00b2",
        "Hersteller Artikelnummer": "EV2781-WT",
        "Horizontaler Scanbereich": "31 - 89 kHz",
        "H\u00f6he (ohne Standfu\u00df)": "35,7 cm",
        "H\u00f6heneinstellung": "17,7 cm",
        "H\u00f6henverstellung": "Ja",
        "Integrierte Kamera": "Nein",
        "Integrierter USB-Hub": "Ja",
        "Kabelsperre-Slot": "Ja",
        "Kontrastverh\u00e4ltnis": "1000:1",
        "Kopfh\u00f6rer-Anschluss": "3,5 mm",
        "Kopfh\u00f6rerausgang": "Ja",
        "Kopfh\u00f6rerausg\u00e4nge": "1",
        "Marktpositionierung": "Business",
        "Maximale Bildwiederholrate": "60 Hz",
        "Men\u00fcsprachen": "Deutsch, Englisch, Spanisch, Franz\u00f6sisch, Italienisch, Schwedisch",
        "Mitgelieferte Kabel": "AC, USB Typ-A auf USB Typ-C",
        "NVIDIA G-SYNC": "Nein",
        "Natives Seitenverh\u00e4ltnis": "16:9",
        "Neigungsverstellung": "Ja",
        "Neigungswinkelbereich": "-5 - 35\u00b0",
        "On-Screen-Display (OSD)": "Ja",
        "Panel": "IPS",
        "Panel-Montage-Schnittstelle": "100 x 100 mm",
        "Panel-Typ": "IPS",
        "Pivot": "Ja",
        "Pivot Winkel": "-90 - 90\u00b0",
        "Pixel Abstand": "0,233 x 0,233 mm",
        "Pixeldichte": "109 ppi",
        "Produktfarbe": "Wei\u00df",
        "RGB-Farbraum": "sRGB",
        "RMS-Leistung": "2 W",
        "Reaktionszeit": "5 ms",
        "Relative Luftfeuchtigkeit in Betrieb": "20 - 80%",
        "Schnellstart\u00fcbersicht": "Ja",
        "Schwenkbar": "Ja",
        "Schwenkwinkelbereich": "0 - 344\u00b0",
        "Sichtbare Gr\u00f6\u00dfe (horizontal)": "59,7 cm",
        "Sichtbare Gr\u00f6\u00dfe (vertikal)": "33,6 cm",
        "Slot-Typ Kabelsperre": "Kensington",
        "Stromverbrauch (Standardbetrieb)": "18 W",
        "Stromverbrauch (Standby)": "0,5 W",
        "Stromverbrauch (max.)": "153 W",
        "Tiefe (ohne Standfu\u00df)": "5,6 cm",
        "Touchscreen": "Nein",
        "Typ der Hintergrundbeleuchtung": "LED",
        "USB Power Delivery": "Ja",
        "USB-Hub-Version": "3.2 Gen 1 (3.1 Gen 1)",
        "USB-Stromversorgung bis zu": "70 W",
        "USB-Typ-C DisplayPort-Wechselmodus": "Ja",
        "USB-Upstream-Porttyp": "USB Typ-C",
        "Unterst\u00fctzte Grafik-Aufl\u00f6sungen": "640 x 480 (VGA), 720 x 400, 800 x 600 (SVGA), 1024 x 768 (XGA), 1600 x 1200 (UXGA), 1680 x 1050 (WSXGA+), 1920 x 1080 (HD 1080), 1920 x 1200 (WUXGA), 2560 x 1440",
        "VESA Halterung": "100x100 mm",
        "VESA-Halterung": "Ja",
        "Verpackungsart": "Box",
        "Vertikaler Scanbereich": "59 - 61 Hz",
        "Video Anschl\u00fcsse": "1x HDMI, 1x DisplayPort, USB-C DisplayPort",
        "Zertifizierung": "CE, CB, UKCA, TCO Certified Generation 9, EPA ENERGY STAR \u00ae, T\u00dcV/GS, T\u00dcV Ergonomie gepr\u00fcft (einschlie\u00dflich ISO 9241-307), T\u00dcV/Blue Low Light Content, T\u00dcV/Flicker Free, EPEAT 2018 (US), cT\u00dcVus, T\u00dcV/S, EAC, PSE, FCC-B, CAN ICES-3 (B), RCM, VCCI-B, CCC, RoHS, China RoHS, WEEE"
    },
    "raw_specifications_text": "Displaygr\u00f6\u00dfe: 27 Zoll\nAufl\u00f6sung: 2560x1440\nPanel: IPS\nReaktionszeit: 5 ms\nVideo Anschl\u00fcsse: 1x HDMI, 1x DisplayPort, USB-C DisplayPort\nErgonomie: H\u00f6henverstellbar, Pivot (90 Grad drehbar), Schwenkbar, Neigbar\nVESA Halterung: 100x100 mm\nHelligkeit: 350 cd/m\u00b2\nBesonderheiten: Lautsprecher, USB HUB\nHersteller Artikelnummer: EV2781-WT\nEAN: 4995047063445\nArtikelnummer: M1EY5FDL\nBildschirmdiagonale: 68,6 cm (27 Zoll)\nDisplay-Aufl\u00f6sung: 2560 x 1440 Pixel\nNatives Seitenverh\u00e4ltnis: 16:9\nBildschirmtechnologie: LED\nTouchscreen: Nein\nHD-Typ: Quad HD\nPanel-Typ: IPS\nBildschirmform: Flach\nKontrastverh\u00e4ltnis: 1000:1\nMaximale Bildwiederholrate: 60 Hz\nAnzahl der Farben des Displays: 16,7 Millionen Farben\nTyp der Hintergrundbeleuchtung: LED\nHelligkeit (typisch): 350 cd/m\u00b2\nUnterst\u00fctzte Grafik-Aufl\u00f6sungen: 640 x 480 (VGA), 720 x 400, 800 x 600 (SVGA), 1024 x 768 (XGA), 1600 x 1200 (UXGA), 1680 x 1050 (WSXGA+), 1920 x 1080 (HD 1080), 1920 x 1200 (WUXGA), 2560 x 1440\nBildwinkel, horizontal: 178\u00b0\nBildwinkel, vertikal: 178\u00b0\nPixel Abstand: 0,233 x 0,233 mm\nPixeldichte: 109 ppi\nHorizontaler Scanbereich: 31 - 89 kHz\nVertikaler Scanbereich: 59 - 61 Hz\nSichtbare Gr\u00f6\u00dfe (horizontal): 59,7 cm\nSichtbare Gr\u00f6\u00dfe (vertikal): 33,6 cm\nBildschirmdiagonale (cm): 68,5 cm\nRGB-Farbraum: sRGB\nNVIDIA G-SYNC: Nein\nAMD FreeSync: Nein\nEingebaute Lautsprecher: Ja\nIntegrierte Kamera: Nein\nAnzahl der Lautsprecher: 2\nRMS-Leistung: 2 W\nMarktpositionierung: Business\nProduktfarbe: Wei\u00df\nZertifizierung: CE, CB, UKCA, TCO Certified Generation 9, EPA ENERGY STAR \u00ae, T\u00dcV/GS, T\u00dcV Ergonomie gepr\u00fcft (einschlie\u00dflich ISO 9241-307), T\u00dcV/Blue Low Light Content, T\u00dcV/Flicker Free, EPEAT 2018 (US), cT\u00dcVus, T\u00dcV/S, EAC, PSE, FCC-B, CAN ICES-3 (B), RCM, VCCI-B, CCC, RoHS, China RoHS, WEEE\nIntegrierter USB-Hub: Ja\nHDMI: Ja\nKopfh\u00f6rerausgang: Ja\nUSB-Hub-Version: 3.2 Gen 1 (3.1 Gen 1)\nUSB-Upstream-Porttyp: USB Typ-C\nAnzahl der vorgeschalteten Steckpl\u00e4tze: 1\nAnzahl der Upstream-Ports USB Typ-C: 1\nAnzahl der nachgeschalteten Steckpl\u00e4tze vom Typ USB-A: 4\nUSB-Typ-C DisplayPort-Wechselmodus: Ja\nUSB Power Delivery: Ja\nUSB-Stromversorgung bis zu: 70 W\nAnzahl HDMI-Anschl\u00fcsse: 1\nAnzahl DisplayPort Anschl\u00fcsse: 1\nKopfh\u00f6rerausg\u00e4nge: 1\nKopfh\u00f6rer-Anschluss: 3,5 mm\nHDCP: Ja\nVESA-Halterung: Ja\nKabelsperre-Slot: Ja\nH\u00f6henverstellung: Ja\nPanel-Montage-Schnittstelle: 100 x 100 mm\nSlot-Typ Kabelsperre: Kensington\nH\u00f6heneinstellung: 17,7 cm\nPivot: Ja\nPivot Winkel: -90 - 90\u00b0\nSchwenkbar: Ja\nSchwenkwinkelbereich: 0 - 344\u00b0\nNeigungswinkelbereich: -5 - 35\u00b0\nOn-Screen-Display (OSD): Ja\nMen\u00fcsprachen: Deutsch, Englisch, Spanisch, Franz\u00f6sisch, Italienisch, Schwedisch\nNeigungsverstellung: Ja\nEnergieeffizienzklasse (SDR): D\nEnergieverbrauch (SDR) pro 1.000 Stunden: 17 kWh\nStromverbrauch (Standardbetrieb): 18 W\nStromverbrauch (Standby): 0,5 W\nStromverbrauch (max.): 153 W\nAC Eingangsspannung: 100 - 240 V\nAC Eingangsfrequenz: 50 - 60 Hz\nEnergieeffizienzskala: A bis G\nBetriebstemperatur: 5 - 35 \u00b0C\nRelative Luftfeuchtigkeit in Betrieb: 20 - 80%\nMitgelieferte Kabel: AC, USB Typ-A auf USB Typ-C\nSchnellstart\u00fcbersicht: Ja\nGer\u00e4tebreite (inkl. Fu\u00df): 611 mm\nGer\u00e4tetiefe (inkl. Fu\u00df): 230 mm\nGer\u00e4teh\u00f6he (inkl. Fu\u00df): 369 mm\nGewicht (mit St\u00e4nder): 8,5 kg\nBreite (ohne Standfu\u00df): 61,1 cm\nTiefe (ohne Standfu\u00df): 5,6 cm\nH\u00f6he (ohne Standfu\u00df): 35,7 cm\nGewicht (ohne St\u00e4nder): 5,7 kg\nVerpackungsart: Box",
    "reference_file": "offer_reference_819.json",
    "shop_name": "mylemon.at"
}