{
    "html_file": "offer_1224_7.html",
    "name": "ASUS VZ27EHE, 27\"",
    "offer_link": "https://www.taufnaus.de/product/10619867",
    "price": 184.92,
    "raw_specifications": {
        "Abmessungen (Breite x Tiefe x H\u00f6he)": "61.2 cm x 21 cm x 43.4 cm - mit Fu\u00df",
        "Adaptive-Sync Technologie": "AMD FreeSync",
        "Besonderheiten": "HDCP, ASUS Splendid Video Intelligence Technology, Trace Free Technology, ASUS QuickFit Virtual Scale, ASUS GamePlus, flimmerfreie Technologie, Farbtemperatur Auswahl, Low Blue Light-Technologie, Shadow Boost-Technologie, ASUS EyeCare+ Technology",
        "Bildschirmbeschichtung": "Blendfrei",
        "Bildschirmtyp": "IPS",
        "Details zu Abmessungen & Gewicht": "Mit Fu\u00df - Breite: 61.2 cm - Tiefe: 21 cm - H\u00f6he: 43.4 cm - Gewicht: 3.6 kg \u00a6 Ohne Fu\u00df - Breite: 61.2 cm - Tiefe: 3.9 cm - H\u00f6he: 35.6 cm - Gewicht: 3.2 kg",
        "Diagonalabmessung": "68.6 cm (27\")",
        "Display-Typ": "LED-hintergrundbeleuchteter LCD-Monitor / TFT-Aktivmatrix",
        "Eingangsspannung": "Wechselstrom 100-240 V (50/60 Hz)",
        "Einstellungen der Anzeigeposition": "Neigung",
        "Energie Effizienzklasse": "Klasse E",
        "Enthaltene Kabel": "1 x HDMI-Kabel \u00a6 1 x VGA-Kabel",
        "Farbunterst\u00fctzung": "16,7 Millionen Farben",
        "Gewicht": "3.6 kg",
        "Helligkeit": "250 cd/m\u00b2",
        "Hintergrundbeleuchtungs-Technologie": "LED-Hintergrundbeleuchtung",
        "Horizontale Bildwiederholrate": "24 - 83 kHz",
        "Horizontaler Betrachtungswinkel": "178",
        "Kennzeichnung": "TUV Rheinland Low Blue Light Certification, TUV Rheinland Flicker Free Certification",
        "Kontrast": "1000:1 / 100000000:1 (dynamisch)",
        "Leistungsmerkmale": "Slot f\u00fcr Sicherheitsschloss (Kabelschloss getrennt erh\u00e4ltlich)",
        "Native Aufl\u00f6sung": "Full HD (1080p) 1920 x 1080 bei 75 Hz",
        "Neigungswinkel": "-5/+23",
        "Pixelpitch": "0.311 mm",
        "Reaktionszeit": "1 ms (MPRT)",
        "Schlosstyp zur Diebstahlsicherung": "Kensington Slot",
        "Schnittstellen": "HDMI \u00a6 VGA \u00a6 Kopfh\u00f6rer",
        "Seitenverh\u00e4ltnis": "16:9",
        "Stromverbrauch (Aus-Modus)": "0.5 Watt",
        "Stromverbrauch (typisch)": "19 Watt",
        "Stromverbrauch SDR (eingeschaltet)": "21 kWh/1.000 h",
        "Stromverbrauch im Standby-Modus": "0.5 Watt",
        "TCO-zertifiziert": "TCO Certified Displays 8",
        "Transportbreite": "67.8 cm",
        "Transportgewicht": "5.2 kg",
        "Transporth\u00f6he": "53.2 cm",
        "Transporttiefe": "12.4 cm",
        "VESA-Halterung": "75 x 75 mm",
        "Vertikale Bildwiederholrate": "48 - 75 Hz",
        "Vertikaler Betrachtungswinkel": "178"
    },
    "raw_specifications_text": "Display-Typ: LED-hintergrundbeleuchteter LCD-Monitor / TFT-Aktivmatrix\nEnergie Effizienzklasse: Klasse E\nDiagonalabmessung: 68.6 cm (27\")\nAdaptive-Sync Technologie: AMD FreeSync\nBildschirmtyp: IPS\nSeitenverh\u00e4ltnis: 16:9\nNative Aufl\u00f6sung: Full HD (1080p) 1920 x 1080 bei 75 Hz\nPixelpitch: 0.311 mm\nHelligkeit: 250 cd/m\u00b2\nKontrast: 1000:1 / 100000000:1 (dynamisch)\nFarbunterst\u00fctzung: 16,7 Millionen Farben\nReaktionszeit: 1 ms (MPRT)\nVertikale Bildwiederholrate: 48 - 75 Hz\nHorizontale Bildwiederholrate: 24 - 83 kHz\nHorizontaler Betrachtungswinkel: 178\nVertikaler Betrachtungswinkel: 178\nBildschirmbeschichtung: Blendfrei\nHintergrundbeleuchtungs-Technologie: LED-Hintergrundbeleuchtung\nBesonderheiten: HDCP, ASUS Splendid Video Intelligence Technology, Trace Free Technology, ASUS QuickFit Virtual Scale, ASUS GamePlus, flimmerfreie Technologie, Farbtemperatur Auswahl, Low Blue Light-Technologie, Shadow Boost-Technologie, ASUS EyeCare+ Technology\nAbmessungen (Breite x Tiefe x H\u00f6he): 61.2 cm x 21 cm x 43.4 cm - mit Fu\u00df\nGewicht: 3.6 kg\nSchnittstellen: HDMI \u00a6 VGA \u00a6 Kopfh\u00f6rer\nEinstellungen der Anzeigeposition: Neigung\nNeigungswinkel: -5/+23\nVESA-Halterung: 75 x 75 mm\nLeistungsmerkmale: Slot f\u00fcr Sicherheitsschloss (Kabelschloss getrennt erh\u00e4ltlich)\nEnthaltene Kabel: 1 x HDMI-Kabel \u00a6 1 x VGA-Kabel\nKennzeichnung: TUV Rheinland Low Blue Light Certification, TUV Rheinland Flicker Free Certification\nSchlosstyp zur Diebstahlsicherung: Kensington Slot\nEingangsspannung: Wechselstrom 100-240 V (50/60 Hz)\nStromverbrauch SDR (eingeschaltet): 21 kWh/1.000 h\nStromverbrauch (typisch): 19 Watt\nStromverbrauch im Standby-Modus: 0.5 Watt\nStromverbrauch (Aus-Modus): 0.5 Watt\nDetails zu Abmessungen & Gewicht: Mit Fu\u00df - Breite: 61.2 cm - Tiefe: 21 cm - H\u00f6he: 43.4 cm - Gewicht: 3.6 kg \u00a6 Ohne Fu\u00df - Breite: 61.2 cm - Tiefe: 3.9 cm - H\u00f6he: 35.6 cm - Gewicht: 3.2 kg\nTransportbreite: 67.8 cm\nTransporttiefe: 12.4 cm\nTransporth\u00f6he: 53.2 cm\nTransportgewicht: 5.2 kg\nTCO-zertifiziert: TCO Certified Displays 8",
    "reference_file": "offer_reference_1224.json",
    "shop_name": "TaufNaus"
}