{
    "html_file": "offer_353_1.html",
    "name": "LG gram 16 +view 16MR70, 16\"",
    "offer_link": "https://www.playox.de/productredirect/index/sku/26923009?sPartner=p-geizhals-at&campaign=psm/geizhals-at/",
    "price": 267.12,
    "raw_specifications": {
        "Anschl\u00fcsse": "USB",
        "Artikelnummer": "26923009",
        "Aufl\u00f6sung Kurzname": "Full HD",
        "Bezeichnung des Herstellers": "LG gram +view 16MR70.ASDWU",
        "Breite": "360,00",
        "Displaygr\u00f6\u00dfe": "bis 45,72 cm (18 Zoll)",
        "Displayoberfl\u00e4che": "matt",
        "EEK - Spektrum": "AG",
        "Energieeffizienzklasse": "D",
        "Geh\u00e4usefarbe des Ger\u00e4tes": "Silber",
        "Gewicht": "0,92",
        "Gewicht inkl. Verpackung in Kg": "0,00",
        "Helligkeit Bereich": "300 - 450 cd/m\u00b2",
        "Hersteller": "LG Electronics",
        "H\u00f6he": "2455,00",
        "Kapazit\u00e4t (Seiten)": "0",
        "Kontrastverh\u00e4ltnis (typisch) Bereich": "800:1 bis 1.200:1",
        "LCD-Technologie": "IPS Panel",
        "L\u00e4nge": "83,00",
        "Produktart": "Monitore",
        "Seitenverh\u00e4ltnis": "16:10",
        "Shop Herstellernummer": "16MR70.ASDWU",
        "Standard-EAN": "8806084054548",
        "max. Aufl\u00f6sung": "2.560 x 1.600 Pixel (16:10)"
    },
    "raw_specifications_text": "Geh\u00e4usefarbe des Ger\u00e4tes: Silber\nAnschl\u00fcsse: USB\nProduktart: Monitore\nKontrastverh\u00e4ltnis (typisch) Bereich: 800:1 bis 1.200:1\nHelligkeit Bereich: 300 - 450 cd/m\u00b2\nHersteller: LG Electronics\nDisplaygr\u00f6\u00dfe: bis 45,72 cm (18 Zoll)\nKapazit\u00e4t (Seiten): 0\nAufl\u00f6sung Kurzname: Full HD\nEEK - Spektrum: AG\nArtikelnummer: 26923009\nStandard-EAN: 8806084054548\nShop Herstellernummer: 16MR70.ASDWU\nBezeichnung des Herstellers: LG gram +view 16MR70.ASDWU\nGewicht inkl. Verpackung in Kg: 0,00\nL\u00e4nge: 83,00\nBreite: 360,00\nGewicht: 0,92\nH\u00f6he: 2455,00\nmax. Aufl\u00f6sung: 2.560 x 1.600 Pixel (16:10)\nSeitenverh\u00e4ltnis: 16:10\nLCD-Technologie: IPS Panel\nDisplayoberfl\u00e4che: matt\nEnergieeffizienzklasse: D",
    "reference_file": "offer_reference_353.json",
    "shop_name": "playox (AT)"
}