{
    "html_file": "offer_1485_1.html",
    "name": "Samsung Odyssey G7 G73T / G74T / G75T (2021), 26.9\"",
    "offer_link": "https://www.ditech.at/details.php?artnr=321897",
    "price": 545.2,
    "raw_specifications": {
        "AMD FreeSync Premium": "Ja",
        "Abmessungen (BxHxT)": "614.6x576x305.9mm (mit Standfu\u00df),  614.6x382.8x171mm (ohne Standfu\u00df)",
        "Adaptive Sync": "Ja",
        "Anschl\u00fcsse - DisplayPort 1.4": "2",
        "Anschl\u00fcsse - HDMI 2.0": "1",
        "Anwendung": "station\u00e4r",
        "Audio": "1x Line-Out",
        "Aufl\u00f6sung": "2560x1440",
        "Beschichtung": "matt (non-glare)",
        "Besonderheiten": "Slim Bezel,  Steuerkreuz,  Picture-in-Picture,  Sicherheitsschloss (Kensington),  Beleuchtung auf R\u00fcckseite (RGB)",
        "Bildwiederholfrequenz": "240Hz",
        "Blickwinkel": "178\u00b0/178\u00b0",
        "Diagonale": "26.9\"/68.3cm",
        "Energieeffizienzklasse HDR (A bis G)": "G",
        "Energieverbrauch HDR": "66kWh/1000h",
        "Energieverbrauch SDR": "32kWh/1000h",
        "Ergonomie": "120mm (h\u00f6henverstellbar),  90\u00b0 (Pivot),  \u00b115\u00b0 (drehbar),  +9\u00b0/-13\u00b0 (neigbar),  keine Angabe (Schr\u00e4glage)",
        "FRC": "unbekannt",
        "Farbe": "schwarz",
        "Farbraum - DCI-P3": "95%",
        "Farbraum - sRGB": "125%",
        "Farbtiefe": "10bit (1.07 Mrd. Farben)",
        "Form": "gebogen (curved),  1000R/1m",
        "Gewicht": "7.20kg (mit Standfu\u00df),  5.50kg (ohne Standfu\u00df)",
        "HDR": "VESA DisplayHDR 600,  HDR10",
        "Helligkeit": "350cd/m\u00b2 (typisch),  600cd/m\u00b2 (HDR)",
        "Herstellergarantie": "zwei Jahre",
        "Hintergrundbeleuchtung": "Blue-LED,  flicker-free,  Blaulichtfilter",
        "Kontrast - statisch": "2.500:1",
        "Leistungsaufnahme": "100W (maximal),  32W (typisch),  keine Angabe (Energielabel alt A+++ bis G),  0.5W (Standby)",
        "Panel": "VA (SVA),  Quantum-Dot (QLED)",
        "Panel-Hersteller": "Samsung (CY-PT270PLLV1H)",
        "Reaktionszeit - GtG": "1ms",
        "Screen-to-Body-Ratio": "84.8% (berechnet)",
        "Seitenverh\u00e4ltnis": "16:9",
        "Signalfrequenz": "keine Angabe (horizontal),  keine Angabe (vertikal)",
        "Stromversorgung": "DC-In (externes Netzteil)",
        "USB-Hub In": "1x USB-B 3.0",
        "USB-Hub Out": "2x USB-A 3.0",
        "USB-Schreibweise": "Link",
        "VESA": "100x100 (via Adapter,  inkludiert)",
        "VRR (Variable Refresh Rate)": "Adaptive Sync,  AMD FreeSync Premium Pro (60-240Hz via DisplayPort,  48-144Hz via HDMI,  mit LFC-Support,  mit HDR),  NVIDIA G-Sync Compatible zertifiziert (60-240Hz via DisplayPort)",
        "Weitere Anschl\u00fcsse": "N/A"
    },
    "raw_specifications_text": "Abmessungen (BxHxT): 614.6x576x305.9mm (mit Standfu\u00df),  614.6x382.8x171mm (ohne Standfu\u00df)\nAdaptive Sync: Ja\nAMD FreeSync Premium: Ja\nAnschl\u00fcsse - DisplayPort 1.4: 2\nAnschl\u00fcsse - HDMI 2.0: 1\nAnwendung: station\u00e4r\nAudio: 1x Line-Out\nAufl\u00f6sung: 2560x1440\nBeschichtung: matt (non-glare)\nBesonderheiten: Slim Bezel,  Steuerkreuz,  Picture-in-Picture,  Sicherheitsschloss (Kensington),  Beleuchtung auf R\u00fcckseite (RGB)\nBildwiederholfrequenz: 240Hz\nBlickwinkel: 178\u00b0/178\u00b0\nDiagonale: 26.9\"/68.3cm\nEnergieeffizienzklasse HDR (A bis G): G\nEnergieverbrauch HDR: 66kWh/1000h\nEnergieverbrauch SDR: 32kWh/1000h\nErgonomie: 120mm (h\u00f6henverstellbar),  90\u00b0 (Pivot),  \u00b115\u00b0 (drehbar),  +9\u00b0/-13\u00b0 (neigbar),  keine Angabe (Schr\u00e4glage)\nFarbe: schwarz\nFarbraum - DCI-P3: 95%\nFarbraum - sRGB: 125%\nFarbtiefe: 10bit (1.07 Mrd. Farben)\nForm: gebogen (curved),  1000R/1m\nFRC: unbekannt\nGewicht: 7.20kg (mit Standfu\u00df),  5.50kg (ohne Standfu\u00df)\nHDR: VESA DisplayHDR 600,  HDR10\nHelligkeit: 350cd/m\u00b2 (typisch),  600cd/m\u00b2 (HDR)\nHerstellergarantie: zwei Jahre\nHintergrundbeleuchtung: Blue-LED,  flicker-free,  Blaulichtfilter\nKontrast - statisch: 2.500:1\nLeistungsaufnahme: 100W (maximal),  32W (typisch),  keine Angabe (Energielabel alt A+++ bis G),  0.5W (Standby)\nPanel: VA (SVA),  Quantum-Dot (QLED)\nPanel-Hersteller: Samsung (CY-PT270PLLV1H)\nReaktionszeit - GtG: 1ms\nScreen-to-Body-Ratio: 84.8% (berechnet)\nSeitenverh\u00e4ltnis: 16:9\nSignalfrequenz: keine Angabe (horizontal),  keine Angabe (vertikal)\nStromversorgung: DC-In (externes Netzteil)\nUSB-Hub In: 1x USB-B 3.0\nUSB-Hub Out: 2x USB-A 3.0\nUSB-Schreibweise: Link\nVESA: 100x100 (via Adapter,  inkludiert)\nVRR (Variable Refresh Rate): Adaptive Sync,  AMD FreeSync Premium Pro (60-240Hz via DisplayPort,  48-144Hz via HDMI,  mit LFC-Support,  mit HDR),  NVIDIA G-Sync Compatible zertifiziert (60-240Hz via DisplayPort)\nWeitere Anschl\u00fcsse: N/A",
    "reference_file": "offer_reference_1485.json",
    "shop_name": "DiTech.at"
}