{
    "html_file": "offer_1414_0.html",
    "name": "HP Z27k G3, 27\"",
    "offer_link": "https://www.alternate.at/HP/Z27k-G3-LED-Monitor/html/product/1760721?partner=AtGeizhalsat&campaign=Monitor/HP/1760721",
    "price": 475.0,
    "raw_specifications": {
        "": "Kensington-Schloss",
        "Abmessungen": "Breite: 612,3 mm x H\u00f6he: 356,1 mm x Tiefe/L\u00e4nge: 63,5 mm",
        "Anschl\u00fcsse": "1x HDMI-Eingang, (HDMI-Version: 2.0), 4x USB-A-3.2 Gen 1 (5 Gbit/s), 1x USB-C 3.2 Gen 1 (5 Gbit/s), 1x RJ 45",
        "Bild": "Glaretyp",
        "Bildschirmaufl\u00f6sung": "3.840 x 2.160 Pixel",
        "Bildschirmdiagonale": "69 cm (27 Zoll)",
        "EAN": "0195122249748",
        "Energieeffizienzklasse (SDR)": "F (A - G)",
        "Energieverbauch pro 1000 Stunden (SDR)": "26 kWh",
        "Ergonomie": "Typ",
        "Farbe": "schwarz",
        "Features": "HP Eye Ease, 100 Watt USB-C Power Delivery",
        "Frequenz": "Vertikal",
        "Gewicht": "6,2 kg",
        "Hersteller-Nr.": "1B9T0AA#ABB",
        "Leistungsaufnahme im Bereitschafts- und Aus-Zustand": "0,2 Watt",
        "Leistungsaufnahme im Ein-Zustand bei Standard-Dynamikumfang (SDR)": "26 Watt",
        "Stromversorgung": "Eco-Off",
        "Typ": "LED-Monitor",
        "Wandhalterung": "VESA kompatibel (100 x 100 mm)",
        "Zubeh\u00f6r": "Vorhanden"
    },
    "raw_specifications_text": "Energieeffizienzklasse (SDR): F (A - G)\nEnergieverbauch pro 1000 Stunden (SDR): 26 kWh\nLeistungsaufnahme im Ein-Zustand bei Standard-Dynamikumfang (SDR): 26 Watt\nLeistungsaufnahme im Bereitschafts- und Aus-Zustand: 0,2 Watt\nBildschirmdiagonale: 69 cm (27 Zoll)\nBildschirmaufl\u00f6sung: 3.840 x 2.160 Pixel\nTyp: LED-Monitor\nFarbe: schwarz\nEAN: 0195122249748\nHersteller-Nr.: 1B9T0AA#ABB\nBild: Glaretyp\n: Kensington-Schloss\nFrequenz: Vertikal\nAnschl\u00fcsse: 1x HDMI-Eingang, (HDMI-Version: 2.0), 4x USB-A-3.2 Gen 1 (5 Gbit/s), 1x USB-C 3.2 Gen 1 (5 Gbit/s), 1x RJ 45\nErgonomie: Typ\nStromversorgung: Eco-Off\nWandhalterung: VESA kompatibel (100 x 100 mm)\nFeatures: HP Eye Ease, 100 Watt USB-C Power Delivery\nZubeh\u00f6r: Vorhanden\nAbmessungen: Breite: 612,3 mm x H\u00f6he: 356,1 mm x Tiefe/L\u00e4nge: 63,5 mm\nGewicht: 6,2 kg",
    "reference_file": "offer_reference_1414.json",
    "shop_name": "Alternate.at"
}