{
    "html_file": "offer_714_6.html",
    "name": "HP P24v G5, 23.8\"",
    "offer_link": "https://www.csv-direct.de/artinfo.php?artnr=AGX1611269&KATEGORIE=162&pva=geizhals2",
    "price": 167.9,
    "raw_specifications": {
        "AC Eingangsfrequenz": "50 - 60 Hz",
        "AC Eingangsspannung": "100 - 240 V",
        "AMD FreeSync": "Nein",
        "Anzahl HDMI-Anschl\u00fcsse": "1",
        "Anzahl OSD-Sprachen": "11",
        "Anzahl VGA D-Sub Anschl\u00fcsse": "1",
        "Anzahl der Farben des Displays": "16,7 Millionen Farben",
        "Betriebstemperatur": "5 - 35 \u00b0C",
        "Bildschirmdiagonale": "60,5 cm 23.8\"",
        "Bildschirmdiagonale cm": "60,5 cm",
        "Bildschirmform": "Flach",
        "Bildwinkel, horizontal": "178\u00b0",
        "Bildwinkel, vertikal": "178\u00b0",
        "Breite": "538,9 mm",
        "Digital horizontale Frequenz": "55,6 - 90,8 kHz",
        "Digital vertikale Frequenz": "48 - 75 Hz",
        "Display-Aufl\u00f6sung": "1920 x 1080 Pixel",
        "Eingebaute Lautsprecher": "Nein",
        "Energieeffizienzklasse SDR": "E",
        "Farbskala": "72",
        "Farbtiefe": "8 Bit",
        "Ger\u00e4tebreite inkl. Fu\u00df": "53,9 mm",
        "Ger\u00e4teh\u00f6he inkl. Fu\u00df": "18,1 mm",
        "Ger\u00e4tetiefe inkl. Fu\u00df": "39,8 mm",
        "Gewicht": "3,57 kg",
        "Gewicht mit St\u00e4nder": "3,57 kg",
        "HD-Typ": "Full HD",
        "HDMI-Version": "1.4",
        "HP-Segment": "Business",
        "Helligkeit peak": "250 cd/m\u00b2",
        "Horizontaler Scanbereich": "55,6 - 90,8 kHz",
        "H\u00f6he": "323,6 mm",
        "H\u00f6he ohne Standfu\u00df": "32,4 mm",
        "H\u00f6henverstellung": "Nein",
        "Integrierte Kamera": "Nein",
        "Integrierter USB-Hub": "Nein",
        "Kontrastverh\u00e4ltnis": "3000:1",
        "Kontrastverh\u00e4ltnis dynamisch": "8000000:1",
        "Kopfh\u00f6rerausgang": "Nein",
        "Marktpositionierung": "Business",
        "Maximale Bildwiederholrate": "75 Hz",
        "Men\u00fcsprachen": "Vereinfachtes Chinesisch, Traditionelles Chinesisch, Deutsch, Niederl\u00e4ndisch, Englisch, Spanisch, Franz\u00f6sisch, Italienisch, Japanisch, Portugiesisch, Russisch",
        "NTSC Abdeckung typisch": "72",
        "NVIDIA G-SYNC": "Nein",
        "Nachhaltige Technologien und Materialien": "Das geformte Papierzellstoffpolster im Inneren der Verpackung stammt zu 100  aus nachhaltigen Quellen und ist recycelbar; 85  recycelter Haushaltskunststoff; 100  Kunststoff aus geschlossenem IT-Ger\u00e4te-Kreislauf; Halogenarm",
        "Nachhaltigkeitszertifikate": "ENERGY STAR",
        "Natives Seitenverh\u00e4ltnis": "16:9",
        "Neigungswinkelbereich": "-5 - 23\u00b0",
        "Oberfl\u00e4chenh\u00e4rte": "3H",
        "Paketgewicht": "5,49 kg",
        "Panel-Montage-Schnittstelle": "100 x 100 mm",
        "Panel-Typ": "VA",
        "Pixel Abstand": "0,27 x 0,27 mm",
        "Pixeldichte": "93 ppi",
        "Produktfarbe": "Schwarz",
        "RGB-Farbraum": "NTSC",
        "Reaktionszeit": "5 ms",
        "Relative Luftfeuchtigkeit in Betrieb": "20 - 80",
        "Stromverbrauch Standardbetrieb": "20 W",
        "Stromverbrauch Standby": "0,5 W",
        "Stromverbrauch max.": "30 W",
        "Tiefe": "51,4 mm",
        "Tiefe ohne Standfu\u00df": "5,14 mm",
        "Touchscreen": "Nein",
        "Tr\u00fcbungsrate": "25",
        "Unterst\u00fctzte Grafik-Aufl\u00f6sungen": "640 x 480 VGA, 720 x 400, 800 x 600 SVGA, 1024 x 768 XGA, 1280 x 1024 SXGA, 1280 x 720 HD 720, 1440 x 900, 1600 x 900, 1680 x 1050 WSXGA+, 1920 x 1080 HD 1080",
        "Verpackungsbreite": "538,9 mm",
        "Verpackungsh\u00f6he": "397,8 mm",
        "Verpackungstiefe": "180,5 mm",
        "Vertikaler Scanbereich": "48 - 75 Hz"
    },
    "raw_specifications_text": "Bildschirmdiagonale: 60,5 cm 23.8\"\nDisplay-Aufl\u00f6sung: 1920 x 1080 Pixel\nNatives Seitenverh\u00e4ltnis: 16:9\nTouchscreen: Nein\nHD-Typ: Full HD\nPanel-Typ: VA\nBildschirmform: Flach\nKontrastverh\u00e4ltnis: 3000:1\nMaximale Bildwiederholrate: 75 Hz\nAnzahl der Farben des Displays: 16,7 Millionen Farben\nHelligkeit peak: 250 cd/m\u00b2\nReaktionszeit: 5 ms\nUnterst\u00fctzte Grafik-Aufl\u00f6sungen: 640 x 480 VGA, 720 x 400, 800 x 600 SVGA, 1024 x 768 XGA, 1280 x 1024 SXGA, 1280 x 720 HD 720, 1440 x 900, 1600 x 900, 1680 x 1050 WSXGA+, 1920 x 1080 HD 1080\nKontrastverh\u00e4ltnis dynamisch: 8000000:1\nBildwinkel, horizontal: 178\u00b0\nBildwinkel, vertikal: 178\u00b0\nPixel Abstand: 0,27 x 0,27 mm\nPixeldichte: 93 ppi\nHorizontaler Scanbereich: 55,6 - 90,8 kHz\nVertikaler Scanbereich: 48 - 75 Hz\nDigital horizontale Frequenz: 55,6 - 90,8 kHz\nDigital vertikale Frequenz: 48 - 75 Hz\nBildschirmdiagonale cm: 60,5 cm\nTr\u00fcbungsrate: 25\nOberfl\u00e4chenh\u00e4rte: 3H\nFarbtiefe: 8 Bit\nRGB-Farbraum: NTSC\nFarbskala: 72\nNTSC Abdeckung typisch: 72\nNVIDIA G-SYNC: Nein\nAMD FreeSync: Nein\nHP-Segment: Business\nEingebaute Lautsprecher: Nein\nIntegrierte Kamera: Nein\nMarktpositionierung: Business\nProduktfarbe: Schwarz\nIntegrierter USB-Hub: Nein\nKopfh\u00f6rerausgang: Nein\nAnzahl VGA D-Sub Anschl\u00fcsse: 1\nAnzahl HDMI-Anschl\u00fcsse: 1\nHDMI-Version: 1.4\nH\u00f6henverstellung: Nein\nPanel-Montage-Schnittstelle: 100 x 100 mm\nNeigungswinkelbereich: -5 - 23\u00b0\nMen\u00fcsprachen: Vereinfachtes Chinesisch, Traditionelles Chinesisch, Deutsch, Niederl\u00e4ndisch, Englisch, Spanisch, Franz\u00f6sisch, Italienisch, Japanisch, Portugiesisch, Russisch\nAnzahl OSD-Sprachen: 11\nEnergieeffizienzklasse SDR: E\nStromverbrauch Standardbetrieb: 20 W\nStromverbrauch Standby: 0,5 W\nStromverbrauch max.: 30 W\nAC Eingangsspannung: 100 - 240 V\nAC Eingangsfrequenz: 50 - 60 Hz\nBetriebstemperatur: 5 - 35 \u00b0C\nRelative Luftfeuchtigkeit in Betrieb: 20 - 80\nGer\u00e4tebreite inkl. Fu\u00df: 53,9 mm\nGer\u00e4tetiefe inkl. Fu\u00df: 39,8 mm\nGer\u00e4teh\u00f6he inkl. Fu\u00df: 18,1 mm\nGewicht mit St\u00e4nder: 3,57 kg\nTiefe ohne Standfu\u00df: 5,14 mm\nH\u00f6he ohne Standfu\u00df: 32,4 mm\nVerpackungsbreite: 538,9 mm\nVerpackungstiefe: 180,5 mm\nVerpackungsh\u00f6he: 397,8 mm\nPaketgewicht: 5,49 kg\nNachhaltigkeitszertifikate: ENERGY STAR\nNachhaltige Technologien und Materialien: Das geformte Papierzellstoffpolster im Inneren der Verpackung stammt zu 100  aus nachhaltigen Quellen und ist recycelbar; 85  recycelter Haushaltskunststoff; 100  Kunststoff aus geschlossenem IT-Ger\u00e4te-Kreislauf; Halogenarm\nGewicht: 3,57 kg\nH\u00f6he: 323,6 mm\nBreite: 538,9 mm\nTiefe: 51,4 mm",
    "reference_file": "offer_reference_714.json",
    "shop_name": "CSV-Direct.de"
}