{
    "html_file": "offer_561_13.html",
    "name": "LG UltraGear OLED 45GR95QE-B, 44.5\"",
    "offer_link": "https://www.amazon.de/dp/B0BM4XQ4L6?linkCode=xm2&camp=2025&creative=165953&smid=A3JWKAKR8XB7XF&creativeASIN=B0BM4XQ4L6&tag=geizhals1-21",
    "price": 1360.34,
    "raw_specifications": {
        "ASIN": "B0BM4XQ4L6",
        "Amazon Bestseller-Rang": "Nr. 23,153 in Computer & Zubeh\u00f6r (Siehe Top 100 in Computer & Zubeh\u00f6r)  Nr. 484 in Monitore",
        "Anzahl HDMI Schnittstellen": "\u200e2",
        "Anzahl USB 2.0 Schnittstellen": "\u200e3",
        "Anzahl USB 3.0 Schnittstellen": "\u200e3",
        "Artikelgewicht": "\u200e10,9 Kilograms",
        "Batterien enthalten": "\u200eNein",
        "Bildschirmaufl\u00f6sung": "\u200e3440 x 1440 pixels",
        "Display-Gr\u00f6\u00dfe": "\u200e45 Zoll",
        "Durchschnittliche Kundenbewertung": "4,0  4,0 von 5 Sternen    \n    87 Sternebewertungen   \n\n\n 4,0 von 5 Sternen",
        "Farbe": "\u200eSchwarz",
        "Garantierte Software-Updates bis": "\u200eunbekannt",
        "Hersteller": "\u200eLG",
        "Im Angebot von Amazon.de seit": "15. Februar 2023",
        "Interface Grafikkarte": "\u200eIntegriert",
        "L\u00f6sung": "\u200e3440 x 1440 Pixels",
        "Marke": "\u200eLG Electronics",
        "Modell/Serie": "\u200e45GR95QE-B.AEU",
        "Modellnummer": "\u200e45GR95QE-B.AEK",
        "Produktabmessungen": "\u200e36,25 x 99,27 x 64,77 cm; 10,9 Kilogramm",
        "Prozessorkerne": "\u200e1",
        "Speicher-Art": "\u200eDIMM",
        "Volt": "\u200e240 Volt (Wechselstrom)"
    },
    "raw_specifications_text": "Marke: \u200eLG Electronics\nHersteller: \u200eLG\nModell/Serie: \u200e45GR95QE-B.AEU\nProduktabmessungen: \u200e36,25 x 99,27 x 64,77 cm; 10,9 Kilogramm\nModellnummer: \u200e45GR95QE-B.AEK\nFarbe: \u200eSchwarz\nDisplay-Gr\u00f6\u00dfe: \u200e45 Zoll\nBildschirmaufl\u00f6sung: \u200e3440 x 1440 pixels\nL\u00f6sung: \u200e3440 x 1440 Pixels\nProzessorkerne: \u200e1\nSpeicher-Art: \u200eDIMM\nInterface Grafikkarte: \u200eIntegriert\nAnzahl USB 2.0 Schnittstellen: \u200e3\nAnzahl USB 3.0 Schnittstellen: \u200e3\nAnzahl HDMI Schnittstellen: \u200e2\nVolt: \u200e240 Volt (Wechselstrom)\nBatterien enthalten: \u200eNein\nArtikelgewicht: \u200e10,9 Kilograms\nGarantierte Software-Updates bis: \u200eunbekannt\nASIN: B0BM4XQ4L6\nDurchschnittliche Kundenbewertung: 4,0  4,0 von 5 Sternen    \n    87 Sternebewertungen   \n\n\n 4,0 von 5 Sternen\nAmazon Bestseller-Rang: Nr. 23,153 in Computer & Zubeh\u00f6r (Siehe Top 100 in Computer & Zubeh\u00f6r)  Nr. 484 in Monitore\nIm Angebot von Amazon.de seit: 15. Februar 2023",
    "reference_file": "offer_reference_561.json",
    "shop_name": "Amazon.at"
}