{
    "html_file": "offer_1960_0.html",
    "name": "iiyama G-Master GB3461WQSU-B1 Red Eagle, 34\"",
    "offer_link": "https://www.csv-direct.de/artinfo.php?artnr=A1620462&KATEGORIE=162&pva=geizhals2",
    "price": 397.34,
    "raw_specifications": {
        "AC Eingangsfrequenz": "50 - 60 Hz",
        "AC Eingangsspannung": "100 - 240 V",
        "Anzahl DisplayPort Anschl\u00fcsse": "2",
        "Anzahl HDMI-Anschl\u00fcsse": "2",
        "Anzahl OSD-Sprachen": "9",
        "Anzahl der Farben des Displays": "16,78 Millionen Farben",
        "Anzahl der Lautsprecher": "2",
        "Anzahl der nachgeschalteten Steckpl\u00e4tze vom Typ USB-A": "2",
        "Anzahl der vorgeschalteten Steckpl\u00e4tze": "1",
        "Audioanschl\u00fcsse": "Nein",
        "Betriebstemperatur": "5 - 35 \u00b0C",
        "Bildschirmdiagonale": "86,4 cm 34\"",
        "Bildschirmform": "Flach",
        "Bildschirmtechnologie": "LED",
        "Bildwinkel, horizontal": "178\u00b0",
        "Bildwinkel, vertikal": "178\u00b0",
        "Breite ohne Standfu\u00df": "817 mm",
        "DVI Anschluss": "Nein",
        "Display-Aufl\u00f6sung": "3440 x 1440 Pixel",
        "Display-Oberfl\u00e4che": "Matt",
        "Eingangsstrom": "1.2 A",
        "Energieeffizienzklasse HDR": "G",
        "Energieeffizienzklasse SDR": "G",
        "Energieeffizienzskala": "A bis G",
        "Energieverbrauch HDR pro 1.000 Stunden": "56 kWh",
        "Energieverbrauch SDR pro 1.000 Stunden": "40 kWh",
        "Fu\u00dffarbe": "Schwarz",
        "Ger\u00e4tebreite inkl. Fu\u00df": "817 mm",
        "Ger\u00e4teh\u00f6he inkl. Fu\u00df": "415 mm",
        "Ger\u00e4tetiefe inkl. Fu\u00df": "230 mm",
        "Gewicht mit St\u00e4nder": "9,7 kg",
        "Gewicht ohne St\u00e4nder": "7 kg",
        "HD-Typ": "UltraWide Quad HD",
        "Helligkeit typisch": "350 cd/m\u00b2",
        "Horizontaler Scanbereich": "30 - 220 kHz",
        "H\u00f6he ohne Standfu\u00df": "367 mm",
        "H\u00f6heneinstellung": "13 cm",
        "Integrierte Kamera": "Nein",
        "Kontrastverh\u00e4ltnis": "1000:1",
        "Kontrastverh\u00e4ltnis dynamisch": "80000000:1",
        "Kopfh\u00f6rerausg\u00e4nge": "1",
        "Luftfeuchtigkeit bei Lagerung": "5 - 85",
        "Marktpositionierung": "Gaming",
        "Maximale Bildwiederholrate": "144 Hz",
        "Menge pro Packung": "1 St\u00fccke",
        "Men\u00fcsprachen": "Tschechisch, Deutsch, Niederl\u00e4ndisch, Englisch, Franz\u00f6sisch, Italienisch, Japanisch, Polnisch, Russisch",
        "Mitgelieferte Kabel": "AC, DisplayPort, HDMI, USB",
        "NVIDIA G-SYNC": "Nein",
        "Nachhaltigkeitszertifikate": "RoHS",
        "Natives Seitenverh\u00e4ltnis": "21:9",
        "Neigungswinkelbereich": "3 - 22\u00b0",
        "Paketgewicht": "12,8 kg",
        "Panel-Montage-Schnittstelle": "100 x 100 mm",
        "Panel-Typ": "IPS-ADS",
        "Pixel Abstand": "0,233 x 0,233 mm",
        "Produktfarbe": "Schwarz",
        "RMS-Leistung": "10 W",
        "Reaktionszeit": "1 ms",
        "Relative Luftfeuchtigkeit in Betrieb": "10 - 80",
        "Schwenkwinkelbereich": "-45 - 45\u00b0",
        "Sichtbare Gr\u00f6\u00dfe horizontal": "80 cm",
        "Sichtbare Gr\u00f6\u00dfe vertikal": "33,5 cm",
        "Slot-Typ Kabelsperre": "Kensington",
        "Stromverbrauch Standardbetrieb": "49 W",
        "Stromverbrauch Standby": "0,5 W",
        "Stromverbrauch aus": "0,5 W",
        "Temperaturbereich bei Lagerung": "-20 - 60 \u00b0C",
        "Tiefe ohne Standfu\u00df": "58,5 mm",
        "Touchscreen": "Nein",
        "USB-Hub-Version": "3.2 Gen 1 3.1 Gen 1",
        "USB-Upstream-Porttyp": "USB Typ-B",
        "Unterst\u00fctzte Grafik-Aufl\u00f6sungen": "3440 x 1440",
        "Verpackungsart": "Box",
        "Verpackungsbreite": "900 mm",
        "Verpackungsh\u00f6he": "460 mm",
        "Verpackungstiefe": "230 mm",
        "Vertikaler Scanbereich": "48 - 144 Hz",
        "Warentarifnummer HS": "85285210",
        "Zertifizierung": "CE, T\u00dcV-Bauart, EAC, PSE, WEEE, VCCI"
    },
    "raw_specifications_text": "Bildschirmdiagonale: 86,4 cm 34\"\nDisplay-Aufl\u00f6sung: 3440 x 1440 Pixel\nNatives Seitenverh\u00e4ltnis: 21:9\nBildschirmtechnologie: LED\nTouchscreen: Nein\nHD-Typ: UltraWide Quad HD\nPanel-Typ: IPS-ADS\nBildschirmform: Flach\nKontrastverh\u00e4ltnis: 1000:1\nMaximale Bildwiederholrate: 144 Hz\nAnzahl der Farben des Displays: 16,78 Millionen Farben\nHelligkeit typisch: 350 cd/m\u00b2\nReaktionszeit: 1 ms\nDisplay-Oberfl\u00e4che: Matt\nUnterst\u00fctzte Grafik-Aufl\u00f6sungen: 3440 x 1440\nKontrastverh\u00e4ltnis dynamisch: 80000000:1\nBildwinkel, horizontal: 178\u00b0\nBildwinkel, vertikal: 178\u00b0\nPixel Abstand: 0,233 x 0,233 mm\nHorizontaler Scanbereich: 30 - 220 kHz\nVertikaler Scanbereich: 48 - 144 Hz\nSichtbare Gr\u00f6\u00dfe horizontal: 80 cm\nSichtbare Gr\u00f6\u00dfe vertikal: 33,5 cm\nNVIDIA G-SYNC: Nein\nIntegrierte Kamera: Nein\nAnzahl der Lautsprecher: 2\nRMS-Leistung: 10 W\nMarktpositionierung: Gaming\nProduktfarbe: Schwarz\nFu\u00dffarbe: Schwarz\nZertifizierung: CE, T\u00dcV-Bauart, EAC, PSE, WEEE, VCCI\nUSB-Hub-Version: 3.2 Gen 1 3.1 Gen 1\nUSB-Upstream-Porttyp: USB Typ-B\nAnzahl der vorgeschalteten Steckpl\u00e4tze: 1\nAnzahl der nachgeschalteten Steckpl\u00e4tze vom Typ USB-A: 2\nDVI Anschluss: Nein\nAnzahl HDMI-Anschl\u00fcsse: 2\nAnzahl DisplayPort Anschl\u00fcsse: 2\nAudioanschl\u00fcsse: Nein\nKopfh\u00f6rerausg\u00e4nge: 1\nPanel-Montage-Schnittstelle: 100 x 100 mm\nSlot-Typ Kabelsperre: Kensington\nH\u00f6heneinstellung: 13 cm\nSchwenkwinkelbereich: -45 - 45\u00b0\nNeigungswinkelbereich: 3 - 22\u00b0\nMen\u00fcsprachen: Tschechisch, Deutsch, Niederl\u00e4ndisch, Englisch, Franz\u00f6sisch, Italienisch, Japanisch, Polnisch, Russisch\nAnzahl OSD-Sprachen: 9\nEnergieeffizienzklasse SDR: G\nEnergieeffizienzklasse HDR: G\nEnergieverbrauch SDR pro 1.000 Stunden: 40 kWh\nEnergieverbrauch HDR pro 1.000 Stunden: 56 kWh\nStromverbrauch Standardbetrieb: 49 W\nStromverbrauch Standby: 0,5 W\nStromverbrauch aus: 0,5 W\nAC Eingangsspannung: 100 - 240 V\nAC Eingangsfrequenz: 50 - 60 Hz\nEingangsstrom: 1.2 A\nEnergieeffizienzskala: A bis G\nBetriebstemperatur: 5 - 35 \u00b0C\nTemperaturbereich bei Lagerung: -20 - 60 \u00b0C\nRelative Luftfeuchtigkeit in Betrieb: 10 - 80\nLuftfeuchtigkeit bei Lagerung: 5 - 85\nMitgelieferte Kabel: AC, DisplayPort, HDMI, USB\nGer\u00e4tebreite inkl. Fu\u00df: 817 mm\nGer\u00e4tetiefe inkl. Fu\u00df: 230 mm\nGer\u00e4teh\u00f6he inkl. Fu\u00df: 415 mm\nGewicht mit St\u00e4nder: 9,7 kg\nBreite ohne Standfu\u00df: 817 mm\nTiefe ohne Standfu\u00df: 58,5 mm\nH\u00f6he ohne Standfu\u00df: 367 mm\nGewicht ohne St\u00e4nder: 7 kg\nVerpackungsbreite: 900 mm\nVerpackungstiefe: 230 mm\nVerpackungsh\u00f6he: 460 mm\nPaketgewicht: 12,8 kg\nVerpackungsart: Box\nMenge pro Packung: 1 St\u00fccke\nNachhaltigkeitszertifikate: RoHS\nWarentarifnummer HS: 85285210",
    "reference_file": "offer_reference_1960.json",
    "shop_name": "CSV-Direct.de"
}