{
    "html_file": "offer_251_2.html",
    "name": "HP Omen 27k, 27\"",
    "offer_link": "https://www.amazon.de/dp/B0C4F58DRK?linkCode=xm2&camp=2025&creative=165953&smid=A3JWKAKR8XB7XF&creativeASIN=B0C4F58DRK&tag=geizhals1-21",
    "price": 553.61,
    "raw_specifications": {
        "ASIN": "B0C4F58DRK",
        "Amazon Bestseller-Rang": "Nr. 7,092 in Computer & Zubeh\u00f6r (Siehe Top 100 in Computer & Zubeh\u00f6r)  Nr. 147 in Monitore",
        "Anzahl HDMI Schnittstellen": "\u200e2",
        "Artikelgewicht": "\u200e1 g",
        "Bildschirmaufl\u00f6sung": "\u200e3840 x 2160 Pixels",
        "Display-Gr\u00f6\u00dfe": "\u200e27 Zoll",
        "Durchschnittliche Kundenbewertung": "4,4  4,4 von 5 Sternen    \n    31 Sternebewertungen   \n\n\n 4,4 von 5 Sternen",
        "Farbe": "\u200e4K Display",
        "Garantierte Software-Updates bis": "\u200eunbekannt",
        "Hersteller": "\u200eHP",
        "Im Angebot von Amazon.de seit": "9. Mai 2023",
        "L\u00f6sung": "\u200e3840 x 2160 Pixels",
        "Marke": "\u200eHP",
        "Modell/Serie": "\u200e27k",
        "Modellnummer": "\u200e780G8E9#ABB",
        "Produktabmessungen": "\u200e223,3 x 613,6 x 523,7 cm; 1 Gramm"
    },
    "raw_specifications_text": "Marke: \u200eHP\nHersteller: \u200eHP\nModell/Serie: \u200e27k\nProduktabmessungen: \u200e223,3 x 613,6 x 523,7 cm; 1 Gramm\nModellnummer: \u200e780G8E9#ABB\nFarbe: \u200e4K Display\nDisplay-Gr\u00f6\u00dfe: \u200e27 Zoll\nBildschirmaufl\u00f6sung: \u200e3840 x 2160 Pixels\nL\u00f6sung: \u200e3840 x 2160 Pixels\nAnzahl HDMI Schnittstellen: \u200e2\nArtikelgewicht: \u200e1 g\nGarantierte Software-Updates bis: \u200eunbekannt\nASIN: B0C4F58DRK\nDurchschnittliche Kundenbewertung: 4,4  4,4 von 5 Sternen    \n    31 Sternebewertungen   \n\n\n 4,4 von 5 Sternen\nAmazon Bestseller-Rang: Nr. 7,092 in Computer & Zubeh\u00f6r (Siehe Top 100 in Computer & Zubeh\u00f6r)  Nr. 147 in Monitore\nIm Angebot von Amazon.de seit: 9. Mai 2023",
    "reference_file": "offer_reference_251.json",
    "shop_name": "Amazon.at"
}