{
    "html_file": "offer_1464_8.html",
    "name": "Samsung S60UA, 24\"",
    "offer_link": "https://www.amazon.de/dp/B092991G49?linkCode=xm2&camp=2025&creative=165953&smid=A3JWKAKR8XB7XF&creativeASIN=B092991G49&tag=geizhals1-21",
    "price": 186.23,
    "raw_specifications": {
        "ASIN": "B092991G49",
        "Amazon Bestseller-Rang": "Nr. 14,483 in Computer & Zubeh\u00f6r (Siehe Top 100 in Computer & Zubeh\u00f6r)  Nr. 315 in Monitore  Nr. 662 in Pr\u00e4sentationszubeh\u00f6r",
        "Anzahl USB 2.0 Schnittstellen": "\u200e1",
        "Anzahl USB 3.0 Schnittstellen": "\u200e1",
        "Anzahl der Lithium-Ionen-Zellen": "\u200e7",
        "Anzahl der Lithium-Metall-Zellen": "\u200e7",
        "Artikelgewicht": "\u200e5 Kilograms",
        "Batterien": "\u200e1 A Batterien erforderlich.",
        "Batterien enthalten": "\u200eNein",
        "Bildschirmaufl\u00f6sung": "\u200e2560 x 1440",
        "Display-Gr\u00f6\u00dfe": "\u200e24 Zoll",
        "Durchschnittliche Kundenbewertung": "4,3  4,3 von 5 Sternen    \n    53 Sternebewertungen   \n\n\n 4,3 von 5 Sternen",
        "Farbe": "\u200eSchwarz",
        "Garantierte Software-Updates bis": "\u200eunbekannt",
        "Hersteller": "\u200eSamsung",
        "Im Angebot von Amazon.de seit": "2. M\u00e4rz 2021",
        "Kapazit\u00e4t Lithium-Akku": "\u200e2,6 Britische W\u00e4rmeeinheiten (BTU)",
        "L\u00f6sung": "\u200e2560 x 1440 Pixels",
        "Marke": "\u200eSamsung",
        "Modell/Serie": "\u200eEcran PC 24'' Pro S\u00e9rie S60UA",
        "Modellnummer": "\u200eLS24A600UCUXEN",
        "Produktabmessungen": "\u200e2,79 x 24,64 x 16,51 cm; 5 Kilogramm",
        "Prozessortyp": "\u200eOthers",
        "Volt": "\u200e220"
    },
    "raw_specifications_text": "Marke: \u200eSamsung\nHersteller: \u200eSamsung\nModell/Serie: \u200eEcran PC 24'' Pro S\u00e9rie S60UA\nProduktabmessungen: \u200e2,79 x 24,64 x 16,51 cm; 5 Kilogramm\nBatterien: \u200e1 A Batterien erforderlich.\nModellnummer: \u200eLS24A600UCUXEN\nFarbe: \u200eSchwarz\nDisplay-Gr\u00f6\u00dfe: \u200e24 Zoll\nBildschirmaufl\u00f6sung: \u200e2560 x 1440\nL\u00f6sung: \u200e2560 x 1440 Pixels\nProzessortyp: \u200eOthers\nAnzahl USB 2.0 Schnittstellen: \u200e1\nAnzahl USB 3.0 Schnittstellen: \u200e1\nVolt: \u200e220\nBatterien enthalten: \u200eNein\nKapazit\u00e4t Lithium-Akku: \u200e2,6 Britische W\u00e4rmeeinheiten (BTU)\nAnzahl der Lithium-Ionen-Zellen: \u200e7\nAnzahl der Lithium-Metall-Zellen: \u200e7\nArtikelgewicht: \u200e5 Kilograms\nGarantierte Software-Updates bis: \u200eunbekannt\nASIN: B092991G49\nDurchschnittliche Kundenbewertung: 4,3  4,3 von 5 Sternen    \n    53 Sternebewertungen   \n\n\n 4,3 von 5 Sternen\nAmazon Bestseller-Rang: Nr. 14,483 in Computer & Zubeh\u00f6r (Siehe Top 100 in Computer & Zubeh\u00f6r)  Nr. 315 in Monitore  Nr. 662 in Pr\u00e4sentationszubeh\u00f6r\nIm Angebot von Amazon.de seit: 2. M\u00e4rz 2021",
    "reference_file": "offer_reference_1464.json",
    "shop_name": "Amazon.at"
}