{
    "html_file": "offer_1560_3.html",
    "name": "AOC Q32V4, 31.5\"",
    "offer_link": "https://technikladen.at/P-AOC-Q32V4-LED-Monitor-813-cm-32-315-sichtbar?tl=gzhls",
    "price": 199.8,
    "raw_specifications": {
        "AC Eingangsfrequenz": "50/60 Hz",
        "AC Eingangsspannung": "100 - 240 V",
        "AMD FreeSync": "Nein",
        "Abnehmbarer Standfu\u00df": "Ja",
        "Adobe RGB-Abdeckung": "75 %",
        "Anzahl DisplayPort Anschl\u00fcsse": "1",
        "Anzahl HDMI-Anschl\u00fcsse": "1",
        "Anzahl OSD-Sprachen": "16",
        "Anzahl der Farben des Displays": "16,78 Millionen Farben",
        "Anzahl der Lautsprecher": "2",
        "Audioanschl\u00fcsse": "Ja",
        "Bildschirmaufl\u00f6sung": "2560 x 1440 Pixel",
        "Bildschirmdiagonale": "80 cm",
        "Bildschirmform": "Flach",
        "Bildschirmtechnologie": "LED",
        "Bildwinkel, horizontal": "178 \u00b0",
        "Bildwinkel, vertikal": "178 \u00b0",
        "DVI Anschluss": "Nein",
        "Display-Oberfl\u00e4che": "Matt",
        "DisplayPorts-Version": "1.2",
        "Eingebaute Lautsprecher": "Ja",
        "Energieeffizienzklasse (SDR)": "G",
        "Energieeffizienzskala": "A bis G",
        "Energieverbrauch (SDR) pro 1.000 Stunden": "38 kWh",
        "Externes Netzteil": "Nein",
        "Farbtiefe": "8 Bit",
        "Flimmerfreie Technologie": "Ja",
        "Fu\u00dffarbe": "Schwarz",
        "Gewicht (mit St\u00e4nder)": "6,8 kg",
        "Gleichstrom-Anschluss (DC)": "Ja",
        "HD-Typ": "2K Ultra HD",
        "HDMI": "Ja",
        "HDMI-Kabell\u00e4nge": "1,5 m",
        "HDMI-Version": "1.4",
        "Helligkeit (typisch)": "250 cd/m\u00b2",
        "H\u00f6henverstellung": "Nein",
        "Integrierte Kamera": "Nein",
        "Integrierter USB-Hub": "Nein",
        "Kabelsperre-Slot": "Ja",
        "Kontrastverh\u00e4ltnis": "1200:1",
        "Kontrastverh\u00e4ltnis (dynamisch)": "20000000:1",
        "Kopfh\u00f6rer-Anschluss": "3,5 mm",
        "Kopfh\u00f6rerausgang": "Ja",
        "Kopfh\u00f6rerausg\u00e4nge": "1",
        "Low-Blue-Light-Technologie": "Ja",
        "Marktpositionierung": "Haus",
        "Maximale Bildwiederholrate": "75 Hz",
        "Men\u00fcsprachen": "Simplified Chinese, Traditional Chinese, Czech, German, Dutch, English, Spanish, Finnish, French, Italian, Japanese, Korean, Polish, Portuguese, Russian, SER",
        "Mitgelieferte Kabel": "HDMI",
        "NVIDIA G-SYNC": "Nein",
        "Natives Seitenverh\u00e4ltnis": "16:9",
        "Neigungswinkelbereich": "-3,5 - 21,5 \u00b0",
        "Oberfl\u00e4chenh\u00e4rte": "3H",
        "On-Screen-Display (OSD)": "Ja",
        "Paketgewicht": "8,68 kg",
        "Panel-Montage-Schnittstelle": "100 x 100 mm",
        "Panel-Typ": "IPS",
        "Pixeldichte": "93 ppi",
        "Plug & Play": "Ja",
        "Produktfarbe": "Schwarz",
        "RMS-Leistung": "2 W",
        "Rahmenloses Design": "Ja",
        "Reaktionszeit": "4 ms",
        "Schnellstart\u00fcbersicht": "Ja",
        "Seitenverh\u00e4ltnis": "4:3,16:9",
        "Slot-Typ Kabelsperre": "Kensington",
        "Stromverbrauch (Standardbetrieb)": "47 W",
        "Stromverbrauch (Standby)": "0,3 W",
        "Stromverbrauch (aus)": "0,3 W",
        "St\u00e4nder enthalten": "Ja",
        "Typ der Hintergrundbeleuchtung": "W-LED",
        "Unterst\u00fctzte Grafik-Aufl\u00f6sungen": "1920 x 1080 (HD 1080),2560 x 1440",
        "Unterst\u00fctzte Video-Modi": "1080p,1440p",
        "VESA Adaptive Sync unterst\u00fctzt": "Ja",
        "VESA-Halterung": "Ja",
        "Verpackungsart": "Box",
        "Vorderer Rahmen": "Schwarz",
        "Zertifizierung": "GOST",
        "sRGB Abdeckung (klassisch)": "102 %"
    },
    "raw_specifications_text": "NVIDIA G-SYNC: Nein\nAMD FreeSync: Nein\nVESA Adaptive Sync unterst\u00fctzt: Ja\nFlimmerfreie Technologie: Ja\nLow-Blue-Light-Technologie: Ja\nBildschirmdiagonale: 80 cm\nBildschirmaufl\u00f6sung: 2560 x 1440 Pixel\nNatives Seitenverh\u00e4ltnis: 16:9\nPanel-Typ: IPS\nHelligkeit (typisch): 250 cd/m\u00b2\nReaktionszeit: 4 ms\nHD-Typ: 2K Ultra HD\nBildschirmtechnologie: LED\nTyp der Hintergrundbeleuchtung: W-LED\nDisplay-Oberfl\u00e4che: Matt\nBildschirmform: Flach\nUnterst\u00fctzte Grafik-Aufl\u00f6sungen: 1920 x 1080 (HD 1080),2560 x 1440\nUnterst\u00fctzte Video-Modi: 1080p,1440p\nSeitenverh\u00e4ltnis: 4:3,16:9\nKontrastverh\u00e4ltnis: 1200:1\nKontrastverh\u00e4ltnis (dynamisch): 20000000:1\nMaximale Bildwiederholrate: 75 Hz\nBildwinkel, horizontal: 178 \u00b0\nBildwinkel, vertikal: 178 \u00b0\nAnzahl der Farben des Displays: 16,78 Millionen Farben\nPixeldichte: 93 ppi\nOberfl\u00e4chenh\u00e4rte: 3H\nFarbtiefe: 8 Bit\nsRGB Abdeckung (klassisch): 102 %\nAdobe RGB-Abdeckung: 75 %\nIntegrierter USB-Hub: Nein\nDVI Anschluss: Nein\nHDMI: Ja\nAnzahl HDMI-Anschl\u00fcsse: 1\nHDMI-Version: 1.4\nAnzahl DisplayPort Anschl\u00fcsse: 1\nDisplayPorts-Version: 1.2\nAudioanschl\u00fcsse: Ja\nKopfh\u00f6rerausgang: Ja\nKopfh\u00f6rerausg\u00e4nge: 1\nKopfh\u00f6rer-Anschluss: 3,5 mm\nGleichstrom-Anschluss (DC): Ja\nVESA-Halterung: Ja\nPanel-Montage-Schnittstelle: 100 x 100 mm\nKabelsperre-Slot: Ja\nSlot-Typ Kabelsperre: Kensington\nH\u00f6henverstellung: Nein\nNeigungswinkelbereich: -3,5 - 21,5 \u00b0\nOn-Screen-Display (OSD): Ja\nMen\u00fcsprachen: Simplified Chinese, Traditional Chinese, Czech, German, Dutch, English, Spanish, Finnish, French, Italian, Japanese, Korean, Polish, Portuguese, Russian, SER\nAnzahl OSD-Sprachen: 16\nPlug & Play: Ja\nEingebaute Lautsprecher: Ja\nIntegrierte Kamera: Nein\nAnzahl der Lautsprecher: 2\nRMS-Leistung: 2 W\nMarktpositionierung: Haus\nProduktfarbe: Schwarz\nRahmenloses Design: Ja\nVorderer Rahmen: Schwarz\nAbnehmbarer Standfu\u00df: Ja\nFu\u00dffarbe: Schwarz\nZertifizierung: GOST\nSt\u00e4nder enthalten: Ja\nMitgelieferte Kabel: HDMI\nHDMI-Kabell\u00e4nge: 1,5 m\nSchnellstart\u00fcbersicht: Ja\nPaketgewicht: 8,68 kg\nVerpackungsart: Box\nEnergieeffizienzklasse (SDR): G\nEnergieverbrauch (SDR) pro 1.000 Stunden: 38 kWh\nStromverbrauch (Standardbetrieb): 47 W\nStromverbrauch (Standby): 0,3 W\nStromverbrauch (aus): 0,3 W\nAC Eingangsspannung: 100 - 240 V\nAC Eingangsfrequenz: 50/60 Hz\nExternes Netzteil: Nein\nEnergieeffizienzskala: A bis G\nGewicht (mit St\u00e4nder): 6,8 kg",
    "reference_file": "offer_reference_1560.json",
    "shop_name": "TechnikLaden"
}