{
    "html_file": "offer_301_0.html",
    "name": "Philips Evnia 5000 25M2N5200P, 24.5\"",
    "offer_link": "https://www.amazon.de/dp/B0BY999658?linkCode=xm2&camp=2025&creative=165953&smid=A3JWKAKR8XB7XF&creativeASIN=B0BY999658&tag=geizhals1-21",
    "price": 201.67,
    "raw_specifications": {
        "ASIN": "B0BY999658",
        "Amazon Bestseller-Rang": "Nr. 28,629 in Computer & Zubeh\u00f6r (Siehe Top 100 in Computer & Zubeh\u00f6r)  Nr. 561 in Monitore",
        "Artikelgewicht": "\u200e4,64 Kilograms",
        "Batterien enthalten": "\u200eNein",
        "Bildschirmaufl\u00f6sung": "\u200e1920x1080",
        "Display-Gr\u00f6\u00dfe": "\u200e25 Zoll",
        "Durchschnittliche Kundenbewertung": "3,9  3,9 von 5 Sternen    \n    14 Sternebewertungen   \n\n\n 3,9 von 5 Sternen",
        "Farbe": "\u200eschwarz",
        "Garantierte Software-Updates bis": "\u200eunbekannt",
        "Hersteller": "\u200ePhilips",
        "Im Angebot von Amazon.de seit": "13. M\u00e4rz 2023",
        "L\u00f6sung": "\u200e1920 x 1080 Pixels",
        "Marke": "\u200ePhilips",
        "Modellnummer": "\u200ePHILIPS EVNIA 25M2N5200P/00",
        "Produktabmessungen": "\u200e21 x 38 x 49 cm; 4,64 Kilogramm",
        "Prozessortyp": "\u200eOthers"
    },
    "raw_specifications_text": "Marke: \u200ePhilips\nHersteller: \u200ePhilips\nProduktabmessungen: \u200e21 x 38 x 49 cm; 4,64 Kilogramm\nModellnummer: \u200ePHILIPS EVNIA 25M2N5200P/00\nFarbe: \u200eschwarz\nDisplay-Gr\u00f6\u00dfe: \u200e25 Zoll\nBildschirmaufl\u00f6sung: \u200e1920x1080\nL\u00f6sung: \u200e1920 x 1080 Pixels\nProzessortyp: \u200eOthers\nBatterien enthalten: \u200eNein\nArtikelgewicht: \u200e4,64 Kilograms\nGarantierte Software-Updates bis: \u200eunbekannt\nASIN: B0BY999658\nDurchschnittliche Kundenbewertung: 3,9  3,9 von 5 Sternen    \n    14 Sternebewertungen   \n\n\n 3,9 von 5 Sternen\nAmazon Bestseller-Rang: Nr. 28,629 in Computer & Zubeh\u00f6r (Siehe Top 100 in Computer & Zubeh\u00f6r)  Nr. 561 in Monitore\nIm Angebot von Amazon.de seit: 13. M\u00e4rz 2023",
    "reference_file": "offer_reference_301.json",
    "shop_name": "Amazon.at"
}