{
    "html_file": "offer_890_2.html",
    "name": "MSI MAG342CQPVDE, 34\"",
    "offer_link": "https://www.alternate.at/MSI/Optix-MAG342CQPVDE-Gaming-Monitor/html/product/1863668?partner=AtGeizhalsat&campaign=Monitor/MSI/1863668",
    "price": 506.0,
    "raw_specifications": {
        "": "Adaptive-Sync, Kensington-Schloss",
        "Anschl\u00fcsse": "2x HDMI-Eingang, (HDMI-Version: 2.0), 1x DisplayPort-Eingang, (DisplayPort-Version: 1.2a), 1x Kopfh\u00f6rer-Ausgang",
        "Bild": "Glaretyp",
        "Bildschirmaufl\u00f6sung": "3.440 x 1.440 Pixel",
        "Bildschirmdiagonale": "86 cm (34 Zoll)",
        "EAN": "4719072948177",
        "Energieeffizienzklasse (SDR)": "G (A - G)",
        "Energieverbauch pro 1000 Stunden (SDR)": "39 kWh",
        "Ergonomie": "Typ",
        "Farbe": "schwarz",
        "Features": "MSI Night Vision, Anti-Flicker Technologie, Less Blue Light, Frameless Design",
        "Frequenz": "Vertikal",
        "Geeignet f\u00fcr": "Gaming",
        "Hersteller-Nr.": "9S6-3DB64H-052",
        "Leistungsaufnahme im Bereitschafts- und Aus-Zustand": "0,5 Watt",
        "Leistungsaufnahme im Ein-Zustand bei Standard-Dynamikumfang (SDR)": "39 Watt",
        "Standards": "Video",
        "Stromversorgung": "Eco-Off",
        "Typ": "Gaming-Monitor",
        "Wandhalterung": "VESA kompatibel (75 x 75 mm)",
        "Zubeh\u00f6r": "Vorhanden"
    },
    "raw_specifications_text": "Energieeffizienzklasse (SDR): G (A - G)\nEnergieverbauch pro 1000 Stunden (SDR): 39 kWh\nLeistungsaufnahme im Ein-Zustand bei Standard-Dynamikumfang (SDR): 39 Watt\nLeistungsaufnahme im Bereitschafts- und Aus-Zustand: 0,5 Watt\nBildschirmdiagonale: 86 cm (34 Zoll)\nBildschirmaufl\u00f6sung: 3.440 x 1.440 Pixel\nTyp: Gaming-Monitor\nFarbe: schwarz\nEAN: 4719072948177\nHersteller-Nr.: 9S6-3DB64H-052\nGeeignet f\u00fcr: Gaming\nBild: Glaretyp\n: Adaptive-Sync, Kensington-Schloss\nFrequenz: Vertikal\nAnschl\u00fcsse: 2x HDMI-Eingang, (HDMI-Version: 2.0), 1x DisplayPort-Eingang, (DisplayPort-Version: 1.2a), 1x Kopfh\u00f6rer-Ausgang\nErgonomie: Typ\nStromversorgung: Eco-Off\nStandards: Video\nWandhalterung: VESA kompatibel (75 x 75 mm)\nFeatures: MSI Night Vision, Anti-Flicker Technologie, Less Blue Light, Frameless Design\nZubeh\u00f6r: Vorhanden",
    "reference_file": "offer_reference_890.json",
    "shop_name": "Alternate.at"
}