{
    "html_file": "offer_2065_27.html",
    "name": "Samsung SR650 / SR652, 23.8\"",
    "offer_link": "https://technikladen.at/I-LS24R650FDUXEN-Samsung-LS24R650FDU-605-cm-238-Zoll-1920-x-1080-Pixel-Full-HD-5-ms-Schwarz-Grau-LS24R650FDUXEN-Displays-Projektoren-GRATISVERSAND-Versandkostenfrei-bestellen-in-Oesterreich?tl=gzhls",
    "price": 150.42,
    "raw_specifications": {
        "AC Eingangsspannung": "100 - 240 V",
        "AMD FreeSync": "Ja",
        "Abnehmbarer Standfu\u00df": "Ja",
        "Anzahl DisplayPort Anschl\u00fcsse": "1",
        "Anzahl HDMI-Anschl\u00fcsse": "1",
        "Anzahl VGA (D-Sub) Anschl\u00fcsse": "1",
        "Anzahl der Farben des Displays": "16,78 Millionen Farben",
        "Anzahl der nachgeschalteten Steckpl\u00e4tze vom Typ USB-A": "4",
        "Audioanschl\u00fcsse": "Ja",
        "Bildschirmaufl\u00f6sung": "1920 x 1080 Pixel",
        "Bildschirmdiagonale": "60,5 cm",
        "Bildschirmform": "Flach",
        "Bildschirmtechnologie": "LED",
        "Bildwinkel, horizontal": "178 \u00b0",
        "Bildwinkel, vertikal": "178 \u00b0",
        "Breite (ohne Standfu\u00df)": "53,9 cm",
        "DVI Anschluss": "Nein",
        "Display-Oberfl\u00e4che": "Matt",
        "Dynamisches Kontrastverh\u00e4ltnis Marketingbezeichnung": "Mega-Kontrast",
        "Eingebaute Lautsprecher": "Nein",
        "Energieeffizienzklasse (SDR)": "E",
        "Energieeffizienzskala": "A bis G",
        "Energieverbrauch (SDR) pro 1.000 Stunden": "18 kWh",
        "Flimmerfreie Technologie": "Ja",
        "Ger\u00e4tebreite (inkl. Fu\u00df)": "539,4 mm",
        "Ger\u00e4teh\u00f6he (inkl. Fu\u00df)": "473,8 mm",
        "Ger\u00e4tetiefe (inkl. Fu\u00df)": "200,5 mm",
        "Gewicht (mit St\u00e4nder)": "5,1 kg",
        "Gewicht (ohne St\u00e4nder)": "3,3 kg",
        "Gleichstrom-Anschluss (DC)": "Ja",
        "HD-Typ": "Full HD",
        "HDMI": "Ja",
        "HDMI-Version": "1.4",
        "Helligkeit (typisch)": "250 cd/m\u00b2",
        "H\u00f6he (ohne Standfu\u00df)": "32 cm",
        "H\u00f6heneinstellung": "13,5 cm",
        "H\u00f6henverstellung": "Ja",
        "Integrierte Kamera": "Nein",
        "Integrierter USB-Hub": "Ja",
        "Kabelsperre-Slot": "Nein",
        "Kontrastverh\u00e4ltnis": "1000:1",
        "Kopfh\u00f6rerausgang": "Nein",
        "Marktpositionierung": "Business",
        "Maximale Bildwiederholrate": "75 Hz",
        "Mitgelieferte Kabel": "AC, HDMI, USB",
        "NTSC Abdeckung (typisch)": "72 %",
        "NVIDIA G-SYNC": "Nein",
        "Nachhaltigkeitszertifikate": "ENERGY STAR",
        "Natives Seitenverh\u00e4ltnis": "16:9",
        "Neigungswinkelbereich": "-5 - 24 \u00b0",
        "Paketgewicht": "6,7 kg",
        "Panel-Montage-Schnittstelle": "100 x 100 mm",
        "Panel-Typ": "IPS",
        "Pivot": "Ja",
        "Pivot Winkel": "-2 - 92 \u00b0",
        "Plug & Play": "Ja",
        "Produktfarbe": "Blue, Grey",
        "Rahmenloses Design": "Ja",
        "Reaktionszeit": "5 ms",
        "Schwenkbar": "Ja",
        "Schwenkwinkelbereich": "-45 - 45 \u00b0",
        "Seitenverh\u00e4ltnis": "4:3,16:9",
        "Stromverbrauch (Standardbetrieb)": "18 W",
        "Stromverbrauch (Standby)": "0,4 W",
        "Stromverbrauch (aus)": "0,3 W",
        "St\u00e4nder enthalten": "Ja",
        "Tiefe (ohne Standfu\u00df)": "7,16 cm",
        "USB-Hub-Version": "2.0 / 3.2 Gen 1 (3.1 Gen 1)",
        "Unterst\u00fctzte Grafik-Aufl\u00f6sungen": "1280 x 720 (HD 720),1920 x 1080 (HD 1080)",
        "Unterst\u00fctzte Video-Modi": "720p,1080p",
        "VESA-Halterung": "Ja",
        "Verpackungsart": "Box",
        "Verpackungsbreite": "605 mm",
        "Verpackungsh\u00f6he": "215 mm",
        "Verpackungstiefe": "385 mm",
        "Vorderer Rahmen": "Grau",
        "kippbar": "Ja"
    },
    "raw_specifications_text": "NVIDIA G-SYNC: Nein\nAMD FreeSync: Ja\nFlimmerfreie Technologie: Ja\nBildschirmdiagonale: 60,5 cm\nBildschirmaufl\u00f6sung: 1920 x 1080 Pixel\nNatives Seitenverh\u00e4ltnis: 16:9\nPanel-Typ: IPS\nHelligkeit (typisch): 250 cd/m\u00b2\nReaktionszeit: 5 ms\nHD-Typ: Full HD\nBildschirmtechnologie: LED\nDisplay-Oberfl\u00e4che: Matt\nBildschirmform: Flach\nUnterst\u00fctzte Grafik-Aufl\u00f6sungen: 1280 x 720 (HD 720),1920 x 1080 (HD 1080)\nUnterst\u00fctzte Video-Modi: 720p,1080p\nSeitenverh\u00e4ltnis: 4:3,16:9\nKontrastverh\u00e4ltnis: 1000:1\nMaximale Bildwiederholrate: 75 Hz\nDynamisches Kontrastverh\u00e4ltnis Marketingbezeichnung: Mega-Kontrast\nBildwinkel, horizontal: 178 \u00b0\nBildwinkel, vertikal: 178 \u00b0\nAnzahl der Farben des Displays: 16,78 Millionen Farben\nNTSC Abdeckung (typisch): 72 %\nIntegrierter USB-Hub: Ja\nUSB-Hub-Version: 2.0 / 3.2 Gen 1 (3.1 Gen 1)\nAnzahl der nachgeschalteten Steckpl\u00e4tze vom Typ USB-A: 4\nAnzahl VGA (D-Sub) Anschl\u00fcsse: 1\nDVI Anschluss: Nein\nHDMI: Ja\nAnzahl HDMI-Anschl\u00fcsse: 1\nHDMI-Version: 1.4\nAnzahl DisplayPort Anschl\u00fcsse: 1\nAudioanschl\u00fcsse: Ja\nKopfh\u00f6rerausgang: Nein\nGleichstrom-Anschluss (DC): Ja\nVESA-Halterung: Ja\nPanel-Montage-Schnittstelle: 100 x 100 mm\nKabelsperre-Slot: Nein\nH\u00f6henverstellung: Ja\nH\u00f6heneinstellung: 13,5 cm\nPivot: Ja\nPivot Winkel: -2 - 92 \u00b0\nSchwenkbar: Ja\nSchwenkwinkelbereich: -45 - 45 \u00b0\nkippbar: Ja\nNeigungswinkelbereich: -5 - 24 \u00b0\nPlug & Play: Ja\nEingebaute Lautsprecher: Nein\nIntegrierte Kamera: Nein\nMarktpositionierung: Business\nProduktfarbe: Blue, Grey\nRahmenloses Design: Ja\nVorderer Rahmen: Grau\nAbnehmbarer Standfu\u00df: Ja\nSt\u00e4nder enthalten: Ja\nMitgelieferte Kabel: AC, HDMI, USB\nVerpackungsbreite: 605 mm\nVerpackungstiefe: 385 mm\nVerpackungsh\u00f6he: 215 mm\nPaketgewicht: 6,7 kg\nVerpackungsart: Box\nEnergieeffizienzklasse (SDR): E\nEnergieverbrauch (SDR) pro 1.000 Stunden: 18 kWh\nStromverbrauch (Standardbetrieb): 18 W\nStromverbrauch (Standby): 0,4 W\nStromverbrauch (aus): 0,3 W\nAC Eingangsspannung: 100 - 240 V\nEnergieeffizienzskala: A bis G\nGer\u00e4tebreite (inkl. Fu\u00df): 539,4 mm\nGer\u00e4tetiefe (inkl. Fu\u00df): 200,5 mm\nGer\u00e4teh\u00f6he (inkl. Fu\u00df): 473,8 mm\nGewicht (mit St\u00e4nder): 5,1 kg\nBreite (ohne Standfu\u00df): 53,9 cm\nTiefe (ohne Standfu\u00df): 7,16 cm\nH\u00f6he (ohne Standfu\u00df): 32 cm\nGewicht (ohne St\u00e4nder): 3,3 kg\nNachhaltigkeitszertifikate: ENERGY STAR",
    "reference_file": "offer_reference_2065.json",
    "shop_name": "TechnikLaden"
}