{
    "html_file": "offer_1439_7.html",
    "name": "Lenovo ThinkVision S27e-20, 27\"",
    "offer_link": "https://direkt.jacob.de/produkte/lenovo-thinkvision-s27e-20-62afkat2eu-artnr-6988250.html?utm_source=geizhals&utm_medium=cpc&utm_campaign=Preisvergleich&ref=103",
    "price": 195.16,
    "raw_specifications": {
        "Abmessungen (Breite x Tiefe x H\u00f6he)": "61.25 cm x 18.25 cm x 47.58 cm - mit Fu\u00df",
        "Abmessungen (Breite x Tiefe x H\u00f6he) - mit Fu\u00df": "61.25 cm x 18.25 cm x 47.58 cm",
        "Adaptive-Sync Technologie": "AMD FreeSync",
        "Besonderheiten": "72% NTSC (CIE 1931) Farbskala, integrierte Kabelf\u00fchrung, NearEdgeless-Design an 3 Seiten",
        "Bildschirmbeschichtung": "Blendfrei",
        "Bildschirmtyp": "IPS",
        "Details zu Abmessungen & Gewicht": "Mit Fu\u00df - Breite: 61.25 cm - Tiefe: 18.25 cm - H\u00f6he: 47.58 cm - Gewicht: 4.6 kg  Ohne Fu\u00df - Breite: 61.25 cm - Tiefe: 4.32 cm - H\u00f6he: 36.77 cm - Gewicht: 3.6 kg",
        "Diagonalabmessung": "68.6 cm (27\")",
        "Display-Typ": "LED-hintergrundbeleuchteter LCD-Monitor / TFT-Aktivmatrix",
        "ENERGY STAR zertifiziert": "Ja",
        "EPEAT-kompatibel": "EPEAT Silver",
        "Eingangsanschl\u00fcsse": "HDMI, VGA",
        "Einstellungen der Anzeigeposition": "Neigung",
        "Energie Effizienzklasse": "Klasse D",
        "Energierverbrauch Sleep": "0.5 Watt",
        "Erforderliche Netzspannung": "Wechselstrom 120/230 V (50/60 Hz)",
        "Farbe": "Raven Black",
        "Farbunterst\u00fctzung": "16,7 Millionen Farben",
        "Ger\u00e4tetyp": "LED-hintergrundbeleuchteter LCD-Monitor - 68.6 cm (27\")",
        "Gewicht": "4.6 kg",
        "Helligkeit": "250 cd/m\u00b2",
        "Hintergrundbeleuchtungs-Technologie": "LED-Hintergrundbeleuchtung",
        "Horizontaler Betrachtungswinkel": "178",
        "Kennzeichnung": "CCC, RoHS, Directive 2002/95/EC, TUV Rheinland Low Blue Light Certification, TUV Rheinland Eye Comfort Certification, China Energy standard Tier 1",
        "Kontrast": "1000:1 / 3000000:1 (dynamisch)",
        "Leistungsaufnahme im Ein-Zustand": "16.6 W",
        "Leistungsmerkmale": "Slot f\u00fcr Sicherheitsschloss (Kabelschloss getrennt erh\u00e4ltlich)",
        "Lokalisierung": "Englisch / Europa",
        "Native Aufl\u00f6sung": "Full HD (1080p) 1920 x 1080",
        "Neigungswinkel": "-5/+22",
        "Pixelpitch": "0.3114 mm",
        "Ppi": "82",
        "Produktbeschreibung": "Lenovo ThinkVision S27e-20 - LED-Monitor - Full HD (1080p) - 68.6 cm (27\")",
        "Reaktionszeit": "6 ms (normal); 4 ms (extrem)",
        "Schlosstyp zur Diebstahlsicherung": "Kensington Slot",
        "Schnittstellen": "HDMI  VGA (HD-15)  Audio Line-Out",
        "Seitenverh\u00e4ltnis": "16:9",
        "Sichtbare Bildfl\u00e4che": "68.6 cm (27\")",
        "Stromverbrauch (Aus-Modus)": "0.3 Watt",
        "Stromverbrauch (typisch)": "18 Watt",
        "Stromverbrauch SDR (eingeschaltet)": "16.6 kWh/1.000 h",
        "Stromverbrauch im Standby-Modus": "0.5 Watt",
        "TCO-zertifiziert": "TCO Certified Displays 8, TCO Certified Edge Displays",
        "Transportbreite": "71 cm",
        "Transportgewicht": "6.42 kg",
        "Transporth\u00f6he": "45.5 cm",
        "Transporttiefe": "12.6 cm",
        "Umweltschutzstandards": "TCO Certified Displays 8, TCO Certified Edge Displays, ENERGY STAR-qualifiziert EPEAT Silver",
        "VESA-Halterung": "100 x 100 mm",
        "Vertikale Bildwiederholrate": "60 Hz",
        "Vertikaler Betrachtungswinkel": "178"
    },
    "raw_specifications_text": "Produktbeschreibung: Lenovo ThinkVision S27e-20 - LED-Monitor - Full HD (1080p) - 68.6 cm (27\")\nGer\u00e4tetyp: LED-hintergrundbeleuchteter LCD-Monitor - 68.6 cm (27\")\nEnergie Effizienzklasse: Klasse D\nLeistungsaufnahme im Ein-Zustand: 16.6 W\nAdaptive-Sync Technologie: AMD FreeSync\nBildschirmtyp: IPS\nSeitenverh\u00e4ltnis: 16:9\nNative Aufl\u00f6sung: Full HD (1080p) 1920 x 1080\nPixelpitch: 0.3114 mm\nHelligkeit: 250 cd/m\u00b2\nKontrast: 1000:1 / 3000000:1 (dynamisch)\nReaktionszeit: 6 ms (normal); 4 ms (extrem)\nFarbunterst\u00fctzung: 16,7 Millionen Farben\nEingangsanschl\u00fcsse: HDMI, VGA\nEinstellungen der Anzeigeposition: Neigung\nBildschirmbeschichtung: Blendfrei\nFarbe: Raven Black\nAbmessungen (Breite x Tiefe x H\u00f6he) - mit Fu\u00df: 61.25 cm x 18.25 cm x 47.58 cm\nGewicht: 4.6 kg\nLokalisierung: Englisch / Europa\nUmweltschutzstandards: TCO Certified Displays 8, TCO Certified Edge Displays, ENERGY STAR-qualifiziert EPEAT Silver\nKennzeichnung: CCC, RoHS, Directive 2002/95/EC, TUV Rheinland Low Blue Light Certification, TUV Rheinland Eye Comfort Certification, China Energy standard Tier 1\nDisplay-Typ: LED-hintergrundbeleuchteter LCD-Monitor / TFT-Aktivmatrix\nDiagonalabmessung: 68.6 cm (27\")\nSichtbare Bildfl\u00e4che: 68.6 cm (27\")\nPpi: 82\nVertikale Bildwiederholrate: 60 Hz\nHorizontaler Betrachtungswinkel: 178\nVertikaler Betrachtungswinkel: 178\nHintergrundbeleuchtungs-Technologie: LED-Hintergrundbeleuchtung\nBesonderheiten: 72% NTSC (CIE 1931) Farbskala, integrierte Kabelf\u00fchrung, NearEdgeless-Design an 3 Seiten\nAbmessungen (Breite x Tiefe x H\u00f6he): 61.25 cm x 18.25 cm x 47.58 cm - mit Fu\u00df\nSchnittstellen: HDMI  VGA (HD-15)  Audio Line-Out\nNeigungswinkel: -5/+22\nVESA-Halterung: 100 x 100 mm\nLeistungsmerkmale: Slot f\u00fcr Sicherheitsschloss (Kabelschloss getrennt erh\u00e4ltlich)\nSchlosstyp zur Diebstahlsicherung: Kensington Slot\nErforderliche Netzspannung: Wechselstrom 120/230 V (50/60 Hz)\nStromverbrauch SDR (eingeschaltet): 16.6 kWh/1.000 h\nStromverbrauch (typisch): 18 Watt\nStromverbrauch im Standby-Modus: 0.5 Watt\nEnergierverbrauch Sleep: 0.5 Watt\nStromverbrauch (Aus-Modus): 0.3 Watt\nDetails zu Abmessungen & Gewicht: Mit Fu\u00df - Breite: 61.25 cm - Tiefe: 18.25 cm - H\u00f6he: 47.58 cm - Gewicht: 4.6 kg  Ohne Fu\u00df - Breite: 61.25 cm - Tiefe: 4.32 cm - H\u00f6he: 36.77 cm - Gewicht: 3.6 kg\nTransportbreite: 71 cm\nTransporttiefe: 12.6 cm\nTransporth\u00f6he: 45.5 cm\nTransportgewicht: 6.42 kg\nTCO-zertifiziert: TCO Certified Displays 8, TCO Certified Edge Displays\nEPEAT-kompatibel: EPEAT Silver\nENERGY STAR zertifiziert: Ja",
    "reference_file": "offer_reference_1439.json",
    "shop_name": "Jacob Elektronik direkt (AT)"
}