{
    "html_file": "offer_673_14.html",
    "name": "LG UltraGear 24GN60R-B, 23.8\"",
    "offer_link": "https://direkt.jacob.de/produkte/lg-24gn60r-b-beu-led-monitor-24gn60r-b-artnr-8058762.html?utm_source=geizhals&utm_medium=cpc&utm_campaign=Preisvergleich&ref=103",
    "price": 150.46,
    "raw_specifications": {
        "AMD FreeSync": "Ja",
        "AMD FreeSync-Typ": "FreeSync Premium",
        "Anzahl DisplayPort Anschl\u00fcsse": "1",
        "Anzahl HDMI-Anschl\u00fcsse": "2",
        "Anzahl der Farben des Displays": "16,7 Millionen Farben",
        "Bildschirmaufl\u00f6sung": "1920 x 1080 Pixel",
        "Bildschirmdiagonale": "61 cm (24\" )",
        "Bildschirmdiagonale (cm)": "60,4 cm",
        "Bildschirmform": "Flach",
        "Bildschirmtechnologie": "LED",
        "Bildwinkel, horizontal": "178\u00b0",
        "Bildwinkel, vertikal": "178\u00b0",
        "Breite (ohne Standfu\u00df)": "54,1 cm",
        "DisplayPorts-Version": "1.4",
        "Energie Effizienzklasse": "E",
        "Energieeffizienzklasse (HDR)": "G",
        "Energieeffizienzklasse (SDR)": "E",
        "Energieverbrauch (HDR) pro 1.000 Stunden": "24 kWh",
        "Energieverbrauch (SDR) pro 1.000 Stunden": "18 kWh",
        "Fu\u00dffarbe": "Schwarz/Rot",
        "Ger\u00e4tebreite (inkl. Fu\u00df)": "540,8 mm",
        "Ger\u00e4teh\u00f6he (inkl. Fu\u00df)": "408,9 mm",
        "Ger\u00e4tetiefe (inkl. Fu\u00df)": "180,5 mm",
        "Gewicht (mit St\u00e4nder)": "3,9 kg",
        "Gewicht (ohne St\u00e4nder)": "3,5 kg",
        "HD-Typ": "Full HD",
        "HDCP": "Ja",
        "HDCP-Version": "2.2",
        "HDMI": "Ja",
        "HDMI-Version": "2.0",
        "Helligkeit (typisch)": "300 cd/m\u00b2",
        "High Dynamic Range Video (HDR) Unterst\u00fctzung": "Ja",
        "H\u00f6he (ohne Standfu\u00df)": "32,4 cm",
        "Integrierte Kamera": "Nein",
        "Kontrastverh\u00e4ltnis (dynamisch)": "5000000:1",
        "Marktpositionierung": "Gaming",
        "Maximale Bildwiederholrate": "144 Hz",
        "Mitgelieferte Kabel": "DisplayPort",
        "NVIDIA G-SYNC": "Nein",
        "Natives Seitenverh\u00e4ltnis": "16:9",
        "Neigungswinkelbereich": "5 - 15\u00b0",
        "Paketgewicht": "5,2 kg",
        "Panel-Montage-Schnittstelle": "100 x 100 mm",
        "Panel-Typ": "IPS",
        "Pixel Abstand": "0,27 x 0,27 mm",
        "Produktfarbe": "Schwarz",
        "Reaktionszeit": "1 ms",
        "Stromverbrauch (Standby)": "0,5 W",
        "St\u00e4nder enthalten": "Ja",
        "Technologie mit hohem Dynamikbereich (HDR)": "High Dynamic Range 10 (HDR10)",
        "Tiefe (ohne Standfu\u00df)": "4,28 cm",
        "Touchscreen": "Nein",
        "VESA-Halterung": "Ja",
        "Verpackungsart": "Box",
        "Verpackungsbreite": "601 mm",
        "Verpackungsh\u00f6he": "384 mm",
        "Verpackungstiefe": "129 mm",
        "Vorderer Rahmen": "Schwarz",
        "Zertifizierung": "TUV-Ergo, EPA, ErP, CE, CB, UL (cUL)",
        "kippbar": "Ja",
        "sRGB Abdeckung (klassisch)": "99%"
    },
    "raw_specifications_text": "Bildschirmdiagonale: 61 cm (24\" )\nBildschirmaufl\u00f6sung: 1920 x 1080 Pixel\nEnergie Effizienzklasse: E\nNatives Seitenverh\u00e4ltnis: 16:9\nBildschirmtechnologie: LED\nTouchscreen: Nein\nHD-Typ: Full HD\nPanel-Typ: IPS\nBildschirmform: Flach\nMaximale Bildwiederholrate: 144 Hz\nAnzahl der Farben des Displays: 16,7 Millionen Farben\nHelligkeit (typisch): 300 cd/m\u00b2\nReaktionszeit: 1 ms\nKontrastverh\u00e4ltnis (dynamisch): 5000000:1\nBildwinkel, horizontal: 178\u00b0\nBildwinkel, vertikal: 178\u00b0\nPixel Abstand: 0,27 x 0,27 mm\nBildschirmdiagonale (cm): 60,4 cm\nHigh Dynamic Range Video (HDR) Unterst\u00fctzung: Ja\nTechnologie mit hohem Dynamikbereich (HDR): High Dynamic Range 10 (HDR10)\nsRGB Abdeckung (klassisch): 99%\nNVIDIA G-SYNC: Nein\nAMD FreeSync: Ja\nAMD FreeSync-Typ: FreeSync Premium\nIntegrierte Kamera: Nein\nMarktpositionierung: Gaming\nProduktfarbe: Schwarz\nVorderer Rahmen: Schwarz\nFu\u00dffarbe: Schwarz/Rot\nZertifizierung: TUV-Ergo, EPA, ErP, CE, CB, UL (cUL)\nHDMI: Ja\nAnzahl HDMI-Anschl\u00fcsse: 2\nHDMI-Version: 2.0\nAnzahl DisplayPort Anschl\u00fcsse: 1\nDisplayPorts-Version: 1.4\nHDCP: Ja\nHDCP-Version: 2.2\nVESA-Halterung: Ja\nPanel-Montage-Schnittstelle: 100 x 100 mm\nkippbar: Ja\nNeigungswinkelbereich: 5 - 15\u00b0\nEnergieeffizienzklasse (SDR): E\nEnergieeffizienzklasse (HDR): G\nEnergieverbrauch (SDR) pro 1.000 Stunden: 18 kWh\nEnergieverbrauch (HDR) pro 1.000 Stunden: 24 kWh\nStromverbrauch (Standby): 0,5 W\nSt\u00e4nder enthalten: Ja\nMitgelieferte Kabel: DisplayPort\nGer\u00e4tebreite (inkl. Fu\u00df): 540,8 mm\nGer\u00e4tetiefe (inkl. Fu\u00df): 180,5 mm\nGer\u00e4teh\u00f6he (inkl. Fu\u00df): 408,9 mm\nGewicht (mit St\u00e4nder): 3,9 kg\nBreite (ohne Standfu\u00df): 54,1 cm\nTiefe (ohne Standfu\u00df): 4,28 cm\nH\u00f6he (ohne Standfu\u00df): 32,4 cm\nGewicht (ohne St\u00e4nder): 3,5 kg\nVerpackungsbreite: 601 mm\nVerpackungstiefe: 129 mm\nVerpackungsh\u00f6he: 384 mm\nPaketgewicht: 5,2 kg\nVerpackungsart: Box",
    "reference_file": "offer_reference_673.json",
    "shop_name": "Jacob Elektronik direkt (AT)"
}