{
    "html_file": "offer_971_29.html",
    "name": "HP E24m G4, 23.8\"",
    "offer_link": "https://www.proshop.at/Bildschirm/HP-24-Bildschirm-E24m-G4-Conferencing-Silver-5-ms/3080116?utm_source=geizhals&utm_medium=cpc&utm_campaign=pricesite",
    "price": 306.88,
    "raw_specifications": {
        "Abmessungen (Breite x Tiefe x H\u00f6he)": "53.94 cm x 21.6 cm x 53.07 cm - mit Fu\u00df",
        "Abmessungen (Breite x Tiefe x H\u00f6he) - mit Fu\u00df": "53.94 cm x 21.6 cm x 53.07 cm",
        "Audioeingang": "Mikrofon",
        "Ausgangsleistung/Kanal": "5 Watt",
        "Besonderheiten": "HDCP, Low Blue Light Mode, flimmerfreie Technologie, extrem schmale Blende an drei Seiten, 8-bit Farbtiefe, kantenbeleuchtete LED-Hintergrundbeleuchtung, HP Eye Ease",
        "Bildschirmbeschichtung": "Blendfrei, 3H Hard Coating, Haze 25 %",
        "Bildschirmtyp": "IPS",
        "Details zu Abmessungen & Gewicht": "Mit Fu\u00df - Breite: 53.94 cm - Tiefe: 21.6 cm - H\u00f6he: 53.07 cm - Gewicht: 7.39 kg  Ohne Fu\u00df - Breite: 53.94 cm - Tiefe: 4.7 cm - H\u00f6he: 35.56 cm - Gewicht: 4.76 kg",
        "Diagonalabmessung": "61 cm (24\")",
        "Display-Typ": "LED-hintergrundbeleuchteter LCD-Monitor / TFT-Aktivmatrix",
        "ENERGY STAR zertifiziert": "Ja",
        "ENERGY STAR-Version": "8.0",
        "Eingangsanschl\u00fcsse": "HDMI, DisplayPort, USB-C",
        "Eingangsspannung": "Wechselstrom 100-240 V (50/60 Hz)",
        "Einstellungen der Anzeigeposition": "H\u00f6he, Pivot (Rotation), Drehung, Neigung",
        "Energie Effizienzklasse": "Klasse F",
        "Energierverbrauch Sleep": "0.3 Watt",
        "Enthaltene Kabel": "1 x USB-C Kabel - 1.8 m",
        "Entwickelt f\u00fcr": "Elite Mobile Thin Client mt645 G7; Fortis 11 G9 Q Chromebook; Pro Mobile Thin Client mt440 G3; ZBook Firefly 14 G9 Mobile Workstation",
        "Ethernet integriert": "Ja",
        "Farbe": "Silber (Halter), schwarzer Kopf",
        "Farbraum": "99% sRGB",
        "Farbtemperatur": "6500K",
        "Farbunterst\u00fctzung": "16,7 Millionen Farben (8-Bit)",
        "Ger\u00e4tetyp": "LED-hintergrundbeleuchteter LCD-Monitor - 61 cm (24\")",
        "Gewicht": "7.39 kg",
        "Helligkeit": "300 cd/m\u00b2",
        "Hersteller": "HP",
        "Hintergrundbeleuchtungs-Technologie": "LED-Hintergrundbeleuchtung",
        "Horizontale Bildwiederholrate": "30 - 85 kHz",
        "Horizontaler Betrachtungswinkel": "178",
        "H\u00f6heneinstellung": "150 mm",
        "Integrierte Peripherieger\u00e4te": "USB Hub, IR-Kamera",
        "Kennzeichnung": "TUV GS, VCCI, BSMI, NOM, TUV S, WHQL, CCC, PSB, FCC, ISO 9241-307, KCC, WEEE, E-Standby, KC, CECP, CEL, EAC, CEL Grade 1, ISC, RCM, SEPA, BIS, DisplayPort 1.2, CE/EMC, ICE, NRCS, Mexico Energy label, Ukraine, UAE, KES, TGM, Belarus Energy",
        "Kontrast": "1000:1 / 10000000:1 (dynamisch)",
        "Lebensdauer der Beleuchtung": "30,000 Stunden",
        "Leistungsmerkmale": "Slot f\u00fcr Sicherheitsschloss (Kabelschloss getrennt erh\u00e4ltlich), Lautst\u00e4rkeregler, abnehmbarer St\u00e4nder, Unterst\u00fctzung f\u00fcr VESA-Schnittstelle, ohne Arsen, quecksilberfrei, Mikrofon-Stummtaste",
        "Max. Betriebstemperatur": "35 \u00b0C",
        "Min Betriebstemperatur": "5 \u00b0C",
        "Mitgelieferte Software": "HP Display Center, HP Display Manager",
        "Modell": "40Z32AA",
        "Native Aufl\u00f6sung": "Full HD (1080p) 1920 x 1080 bei 75 Hz",
        "Neigungswinkel": "-5/+23",
        "OSD-Sprachen": "Chinesisch (tradionell), Chinesisch (vereinfacht), Englisch, Deutsch, Franz\u00f6sisch, Italienisch, Portugiesisch, Russisch, Spanisch, Holl\u00e4ndisch, Japanisch",
        "Pixelpitch": "0.2745 mm",
        "Ppi": "93",
        "Produktbeschreibung": "HP E24m G4 Conferencing - E-Series - LED-Monitor - Full HD (1080p) - 61 cm (24\")",
        "Reaktionszeit": "5 ms (grau zu grau mit \u00dcbersteuerung)",
        "Rotationswinkel": "180",
        "Schlosstyp zur Diebstahlsicherung": "Kensington Slot",
        "Schnittstellen": "DisplayPort 1.2 (HDCP)  DisplayPort 1.2 Ausgang (HDCP)  HDMI (HDCP)  USB-C/DisplayPort 1.2 Alt Mode (bis zu 65 W)  4 x USB (Typ A)  Audio Line-In/-Out (Mini-Klinkenstecker)  LAN (RJ-45)",
        "Schwenkwinkel": "90",
        "Seitenverh\u00e4ltnis": "16:9",
        "Sichtbare Bildfl\u00e4che": "60.45 cm (23.8\")",
        "Spannung": "Wechselstrom 100-240 V (50/60 Hz)",
        "Stromverbrauch (max.)": "150 Watt",
        "Stromverbrauch (typisch)": "37 Watt",
        "Stromverbrauch SDR (eingeschaltet)": "19 kWh/1.000 h",
        "Stromverbrauch im Standby-Modus": "0.5 Watt",
        "Transportbreite": "60.3 cm",
        "Transportgewicht": "10.31 kg",
        "Transporth\u00f6he": "42.1 cm",
        "Transporttiefe": "19.2 cm",
        "Typ": "Lautsprecher - Stereo",
        "Umweltschutzstandards": "ENERGY STAR-qualifiziert",
        "VESA-Halterung": "100 x 100 mm",
        "Vertikale Bildwiederholrate": "50 - 75 Hz",
        "Vertikaler Betrachtungswinkel": "178",
        "Waren-Nr.": "3080116",
        "Zul\u00e4ssige Luftfeuchtigkeit im Betrieb": "20 - 80% (nicht kondensierend)",
        "Zum Hersteller": "www.hp.com"
    },
    "raw_specifications_text": "Hersteller: HP\nWaren-Nr.: 3080116\nModell: 40Z32AA\nZum Hersteller: www.hp.com\nProduktbeschreibung: HP E24m G4 Conferencing - E-Series - LED-Monitor - Full HD (1080p) - 61 cm (24\")\nGer\u00e4tetyp: LED-hintergrundbeleuchteter LCD-Monitor - 61 cm (24\")\nEnergie Effizienzklasse: Klasse F\nLeistungsmerkmale: Slot f\u00fcr Sicherheitsschloss (Kabelschloss getrennt erh\u00e4ltlich), Lautst\u00e4rkeregler, abnehmbarer St\u00e4nder, Unterst\u00fctzung f\u00fcr VESA-Schnittstelle, ohne Arsen, quecksilberfrei, Mikrofon-Stummtaste\nBildschirmtyp: IPS\nSeitenverh\u00e4ltnis: 16:9\nNative Aufl\u00f6sung: Full HD (1080p) 1920 x 1080 bei 75 Hz\nPixelpitch: 0.2745 mm\nHelligkeit: 300 cd/m\u00b2\nKontrast: 1000:1 / 10000000:1 (dynamisch)\nReaktionszeit: 5 ms (grau zu grau mit \u00dcbersteuerung)\nFarbunterst\u00fctzung: 16,7 Millionen Farben (8-Bit)\nFarbraum: 99% sRGB\nEingangsanschl\u00fcsse: HDMI, DisplayPort, USB-C\nEthernet integriert: Ja\nAudioeingang: Mikrofon\nEinstellungen der Anzeigeposition: H\u00f6he, Pivot (Rotation), Drehung, Neigung\nBildschirmbeschichtung: Blendfrei, 3H Hard Coating, Haze 25 %\nSpannung: Wechselstrom 100-240 V (50/60 Hz)\nFarbe: Silber (Halter), schwarzer Kopf\nAbmessungen (Breite x Tiefe x H\u00f6he) - mit Fu\u00df: 53.94 cm x 21.6 cm x 53.07 cm\nGewicht: 7.39 kg\nUmweltschutzstandards: ENERGY STAR-qualifiziert\nKennzeichnung: TUV GS, VCCI, BSMI, NOM, TUV S, WHQL, CCC, PSB, FCC, ISO 9241-307, KCC, WEEE, E-Standby, KC, CECP, CEL, EAC, CEL Grade 1, ISC, RCM, SEPA, BIS, DisplayPort 1.2, CE/EMC, ICE, NRCS, Mexico Energy label, Ukraine, UAE, KES, TGM, Belarus Energy\nEntwickelt f\u00fcr: Elite Mobile Thin Client mt645 G7; Fortis 11 G9 Q Chromebook; Pro Mobile Thin Client mt440 G3; ZBook Firefly 14 G9 Mobile Workstation\nDisplay-Typ: LED-hintergrundbeleuchteter LCD-Monitor / TFT-Aktivmatrix\nDiagonalabmessung: 61 cm (24\")\nSichtbare Bildfl\u00e4che: 60.45 cm (23.8\")\nIntegrierte Peripherieger\u00e4te: USB Hub, IR-Kamera\nPpi: 93\nVertikale Bildwiederholrate: 50 - 75 Hz\nHorizontale Bildwiederholrate: 30 - 85 kHz\nHorizontaler Betrachtungswinkel: 178\nVertikaler Betrachtungswinkel: 178\nHintergrundbeleuchtungs-Technologie: LED-Hintergrundbeleuchtung\nFarbtemperatur: 6500K\nOSD-Sprachen: Chinesisch (tradionell), Chinesisch (vereinfacht), Englisch, Deutsch, Franz\u00f6sisch, Italienisch, Portugiesisch, Russisch, Spanisch, Holl\u00e4ndisch, Japanisch\nBesonderheiten: HDCP, Low Blue Light Mode, flimmerfreie Technologie, extrem schmale Blende an drei Seiten, 8-bit Farbtiefe, kantenbeleuchtete LED-Hintergrundbeleuchtung, HP Eye Ease\nAbmessungen (Breite x Tiefe x H\u00f6he): 53.94 cm x 21.6 cm x 53.07 cm - mit Fu\u00df\nTyp: Lautsprecher - Stereo\nAusgangsleistung/Kanal: 5 Watt\nSchnittstellen: DisplayPort 1.2 (HDCP)  DisplayPort 1.2 Ausgang (HDCP)  HDMI (HDCP)  USB-C/DisplayPort 1.2 Alt Mode (bis zu 65 W)  4 x USB (Typ A)  Audio Line-In/-Out (Mini-Klinkenstecker)  LAN (RJ-45)\nNeigungswinkel: -5/+23\nSchwenkwinkel: 90\nRotationswinkel: 180\nH\u00f6heneinstellung: 150 mm\nVESA-Halterung: 100 x 100 mm\nEnthaltene Kabel: 1 x USB-C Kabel - 1.8 m\nLebensdauer der Beleuchtung: 30,000 Stunden\nSchlosstyp zur Diebstahlsicherung: Kensington Slot\nEingangsspannung: Wechselstrom 100-240 V (50/60 Hz)\nStromverbrauch SDR (eingeschaltet): 19 kWh/1.000 h\nStromverbrauch (typisch): 37 Watt\nStromverbrauch (max.): 150 Watt\nStromverbrauch im Standby-Modus: 0.5 Watt\nEnergierverbrauch Sleep: 0.3 Watt\nMitgelieferte Software: HP Display Center, HP Display Manager\nDetails zu Abmessungen & Gewicht: Mit Fu\u00df - Breite: 53.94 cm - Tiefe: 21.6 cm - H\u00f6he: 53.07 cm - Gewicht: 7.39 kg  Ohne Fu\u00df - Breite: 53.94 cm - Tiefe: 4.7 cm - H\u00f6he: 35.56 cm - Gewicht: 4.76 kg\nTransportbreite: 60.3 cm\nTransporttiefe: 19.2 cm\nTransporth\u00f6he: 42.1 cm\nTransportgewicht: 10.31 kg\nENERGY STAR zertifiziert: Ja\nENERGY STAR-Version: 8.0\nMin Betriebstemperatur: 5 \u00b0C\nMax. Betriebstemperatur: 35 \u00b0C\nZul\u00e4ssige Luftfeuchtigkeit im Betrieb: 20 - 80% (nicht kondensierend)",
    "reference_file": "offer_reference_971.json",
    "shop_name": "Proshop.at"
}