{
    "html_file": "offer_1924_23.html",
    "name": "AOC 24P2C, 23.8\"",
    "offer_link": "https://www.1ashop.at/de/produkt/24642/aoc-24p2c-led-monitor-61-cm-24-23-8-sichtbar-1920-x-1080-full-hd-1080p.html",
    "price": 233.03,
    "raw_specifications": {
        "Abmessungen (Breite x Tiefe x H\u00f6he)": "54.02 cm x 20.01 cm x 51.3 cm - mit Fu\u00df",
        "Ausgangsleistung/Kanal": "2 Watt",
        "Besonderheiten": "Flimmerfreie Technologie",
        "Bildschirmbeschichtung": "Blendfrei, 3H Hard Coating",
        "Bildschirmtyp": "IPS",
        "Details zu Abmessungen & Gewicht": "Ohne Fu\u00df - Breite: 54.02 cm - Tiefe: 5.07 cm - H\u00f6he: 32.64 cm",
        "Diagonalabmessung": "61 cm (24\")",
        "Display-Typ": "LED-hintergrundbeleuchteter LCD-Monitor / TFT-Aktivmatrix",
        "EAN/UPC": "4038986147309",
        "Eingangsspannung": "Wechselstrom 120/230 V (50/60 Hz)",
        "Einstellungen der Anzeigeposition": "H\u00f6he, Pivot (Rotation), Drehung, Neigung",
        "Energie Effizienzklasse": "Klasse E",
        "Energieklasse (HDR)": "Klasse F",
        "Enthaltene Kabel": "1 x HDMI-Kabel - 1.8 m  1 x DisplayPort-Kabel - 1.8 m  1 x Audiokabel - 1.8 m  1 x USB-Kabel - 1.8 m",
        "Farbe": "Schwarz",
        "Farbraum": "107% sRGB, 79% Adobe RGB",
        "Farbunterst\u00fctzung": "16,7 Millionen Farben",
        "Gewicht": "5.01 kg",
        "Gruppe": "TFTs",
        "Helligkeit": "250 cd/m\u00b2",
        "Hersteller": "AOC",
        "Hersteller Art. Nr.": "24P2C",
        "Hintergrundbeleuchtungs-Technologie": "WLED",
        "Horizontaler Betrachtungswinkel": "178",
        "H\u00f6heneinstellung": "150 mm",
        "Integrierte Peripherieger\u00e4te": "USB 3.2 Gen 1 Hub",
        "Kennzeichnung": "RoHS, Bleifrei, quecksilberfrei",
        "Kontrast": "1000:1 / 50000000:1 (dynamisch)",
        "Leistungsaufnahme im Ein-Zustand": "18 W",
        "Native Aufl\u00f6sung": "Full HD (1080p) 1920 x 1080 bei 75 Hz",
        "Neigungswinkel": "-5/+35",
        "OSD-Sprachen": "Multilingual",
        "Pixelpitch": "0.2745 mm",
        "Reaktionszeit": "4 ms (gray-to-gray)",
        "Rotationswinkel": "180",
        "Schnittstellen": "HDMI  DisplayPort 1.2  USB-C/DisplayPort Alt Mode  4 x USB 3.2 Gen 1  Audio Line-In  Kopfh\u00f6rer",
        "Schwenkwinkel": "180",
        "Seitenverh\u00e4ltnis": "16:9",
        "Service und Support": "Begrenzte Garantie - 3 Jahre",
        "Sichtbare Bildfl\u00e4che": "60.5 cm (23.8\")",
        "Stromverbrauch (Aus-Modus)": "0.3 Watt",
        "Stromverbrauch HDR (eingeschaltet)": "19 kWh/1.000 h",
        "Stromverbrauch SDR (eingeschaltet)": "18 kWh/1.000 h",
        "Stromverbrauch im Standby-Modus": "0.5 Watt",
        "TCO-zertifiziert": "TCO Certified Displays 8",
        "Typ": "Lautsprecher - Stereo",
        "VESA-Halterung": "100 x 100 mm",
        "Vertikaler Betrachtungswinkel": "178"
    },
    "raw_specifications_text": "Gruppe: TFTs\nHersteller: AOC\nHersteller Art. Nr.: 24P2C\nEAN/UPC: 4038986147309\nEnergie Effizienzklasse: Klasse E\nDisplay-Typ: LED-hintergrundbeleuchteter LCD-Monitor / TFT-Aktivmatrix\nEnergieklasse (HDR): Klasse F\nDiagonalabmessung: 61 cm (24\")\nSichtbare Bildfl\u00e4che: 60.5 cm (23.8\")\nIntegrierte Peripherieger\u00e4te: USB 3.2 Gen 1 Hub\nBildschirmtyp: IPS\nSeitenverh\u00e4ltnis: 16:9\nNative Aufl\u00f6sung: Full HD (1080p) 1920 x 1080 bei 75 Hz\nPixelpitch: 0.2745 mm\nHelligkeit: 250 cd/m\u00b2\nKontrast: 1000:1 / 50000000:1 (dynamisch)\nFarbunterst\u00fctzung: 16,7 Millionen Farben\nReaktionszeit: 4 ms (gray-to-gray)\nFarbraum: 107% sRGB, 79% Adobe RGB\nHorizontaler Betrachtungswinkel: 178\nVertikaler Betrachtungswinkel: 178\nBildschirmbeschichtung: Blendfrei, 3H Hard Coating\nHintergrundbeleuchtungs-Technologie: WLED\nOSD-Sprachen: Multilingual\nBesonderheiten: Flimmerfreie Technologie\nFarbe: Schwarz\nAbmessungen (Breite x Tiefe x H\u00f6he): 54.02 cm x 20.01 cm x 51.3 cm - mit Fu\u00df\nGewicht: 5.01 kg\nLeistungsaufnahme im Ein-Zustand: 18 W\nEingangsspannung: Wechselstrom 120/230 V (50/60 Hz)\nStromverbrauch HDR (eingeschaltet): 19 kWh/1.000 h\nStromverbrauch SDR (eingeschaltet): 18 kWh/1.000 h\nStromverbrauch im Standby-Modus: 0.5 Watt\nStromverbrauch (Aus-Modus): 0.3 Watt\nSchnittstellen: HDMI  DisplayPort 1.2  USB-C/DisplayPort Alt Mode  4 x USB 3.2 Gen 1  Audio Line-In  Kopfh\u00f6rer\nTyp: Lautsprecher - Stereo\nAusgangsleistung/Kanal: 2 Watt\nEinstellungen der Anzeigeposition: H\u00f6he, Pivot (Rotation), Drehung, Neigung\nNeigungswinkel: -5/+35\nSchwenkwinkel: 180\nRotationswinkel: 180\nH\u00f6heneinstellung: 150 mm\nVESA-Halterung: 100 x 100 mm\nEnthaltene Kabel: 1 x HDMI-Kabel - 1.8 m  1 x DisplayPort-Kabel - 1.8 m  1 x Audiokabel - 1.8 m  1 x USB-Kabel - 1.8 m\nKennzeichnung: RoHS, Bleifrei, quecksilberfrei\nDetails zu Abmessungen & Gewicht: Ohne Fu\u00df - Breite: 54.02 cm - Tiefe: 5.07 cm - H\u00f6he: 32.64 cm\nTCO-zertifiziert: TCO Certified Displays 8\nService und Support: Begrenzte Garantie - 3 Jahre",
    "reference_file": "offer_reference_1924.json",
    "shop_name": "1ashop.at"
}