{
    "html_file": "offer_1907_9.html",
    "name": "ASUS BE24EQSB, 23.8\"",
    "offer_link": "https://www.alternate.at/ASUS/BE24EQSB-LED-Monitor/html/product/1642411?partner=AtGeizhalsat&campaign=Monitor/ASUS/1642411",
    "price": 233.9,
    "raw_specifications": {
        "": "Ausgangsleistung",
        "Abmessungen": "Breite: 54 cm x H\u00f6he: 42,6 cm x Tiefe/L\u00e4nge: 19,5 cm",
        "Anschl\u00fcsse": "1x HDMI-Eingang, 1x DisplayPort-Eingang, 1x VGA-Eingang, 1x 3,5-mm-Audio-Ausgang, 4x USB-A-3.2 Gen 1 (5 Gbit/s)",
        "Bild": "Format",
        "Bildschirmaufl\u00f6sung": "1.920 x 1.080 Pixel",
        "Bildschirmdiagonale": "61 cm (24 Zoll)",
        "EAN": "4718017562782",
        "Energieeffizienzklasse (SDR)": "F (A - G)",
        "Energieverbauch pro 1000 Stunden (SDR)": "22 kWh",
        "Ergonomie": "Typ",
        "Farbe": "schwarz",
        "Features": "Flicker-Free LED, Blaulichtfilter",
        "Gewicht": "7,8 kg",
        "Hersteller-Nr.": "90LM05M1-B06370",
        "Lautsprecher": "2 Lautsprecher",
        "Leistungsaufnahme im Bereitschafts- und Aus-Zustand": "0,5 Watt",
        "Leistungsaufnahme im Ein-Zustand bei Standard-Dynamikumfang (SDR)": "21,7 Watt",
        "Stromversorgung": "Eco-Off",
        "Typ": "LED-Monitor",
        "Wandhalterung": "VESA kompatibel (100 x 100 mm)",
        "Zubeh\u00f6r": "Vorhanden"
    },
    "raw_specifications_text": "Energieeffizienzklasse (SDR): F (A - G)\nEnergieverbauch pro 1000 Stunden (SDR): 22 kWh\nLeistungsaufnahme im Ein-Zustand bei Standard-Dynamikumfang (SDR): 21,7 Watt\nLeistungsaufnahme im Bereitschafts- und Aus-Zustand: 0,5 Watt\nBildschirmdiagonale: 61 cm (24 Zoll)\nBildschirmaufl\u00f6sung: 1.920 x 1.080 Pixel\nTyp: LED-Monitor\nFarbe: schwarz\nEAN: 4718017562782\nHersteller-Nr.: 90LM05M1-B06370\nBild: Format\n: Ausgangsleistung\nAnschl\u00fcsse: 1x HDMI-Eingang, 1x DisplayPort-Eingang, 1x VGA-Eingang, 1x 3,5-mm-Audio-Ausgang, 4x USB-A-3.2 Gen 1 (5 Gbit/s)\nErgonomie: Typ\nStromversorgung: Eco-Off\nLautsprecher: 2 Lautsprecher\nWandhalterung: VESA kompatibel (100 x 100 mm)\nFeatures: Flicker-Free LED, Blaulichtfilter\nZubeh\u00f6r: Vorhanden\nAbmessungen: Breite: 54 cm x H\u00f6he: 42,6 cm x Tiefe/L\u00e4nge: 19,5 cm\nGewicht: 7,8 kg",
    "reference_file": "offer_reference_1907.json",
    "shop_name": "Alternate.at"
}