{
    "html_file": "offer_2431_26.html",
    "name": "Philips V-line 243V7QDSB, 23.8\"",
    "offer_link": "https://www.1ashop.at/de/produkt/70851/philips-v-line-243v7qdsb-led-monitor-61-cm-24.html",
    "price": 117.66,
    "raw_specifications": {
        "Abmessungen (Breite x Tiefe x H\u00f6he)": "54 cm x 20.9 cm x 41.5 cm - mit Fu\u00df",
        "Besonderheiten": "Sync-on-Green, sRGB-Farbmanagement, SmartResponse, SmartContrast, SmartImage, Kantenglas, Low Blue Light Mode, flimmerfreie Technologie, Ultra-schmale Kante, ohne Quecksilber, breiter Betrachtungswinkel, EasyRead",
        "Bildschirmtyp": "IPS",
        "Details zu Abmessungen & Gewicht": "Mit Fu\u00df - Breite: 54 cm - Tiefe: 20.9 cm - H\u00f6he: 41.5 cm - Gewicht: 3.5 kg  Ohne Fu\u00df - Breite: 54 cm - Tiefe: 4.5 cm - H\u00f6he: 32.5 cm - Gewicht: 3.1 kg",
        "Diagonalabmessung": "61 cm (24\")",
        "Display-Typ": "LED-hintergrundbeleuchteter LCD-Monitor / TFT-Aktivmatrix",
        "EAN/UPC": "8712581742331",
        "ENERGY STAR zertifiziert": "Ja",
        "Einstellungen der Anzeigeposition": "Neigung",
        "Energie Effizienzklasse": "Klasse E",
        "Energieverbrauch pro Jahr": "31 kWh",
        "Enthaltene Kabel": "1 x VGA-Kabel",
        "Erforderliche Netzspannung": "Wechselstrom 120/230 V (50/60 Hz)",
        "Erforderliches Betriebssystem": "Apple MacOS X, Microsoft Windows 7 / 8 / 8.1 / 10",
        "Farbe": "Textured Black",
        "Farbunterst\u00fctzung": "16,7 Millionen Farben",
        "Gewicht": "3.5 kg",
        "Gruppe": "TFTs",
        "Helligkeit": "250 cd/m\u00b2",
        "Hersteller": "Philips",
        "Hersteller Art. Nr.": "243V7QDSB/00",
        "Hintergrundbeleuchtungs-Technologie": "WLED",
        "Horizontale Bildwiederholrate": "30 - 83 kHz",
        "Horizontaler Betrachtungswinkel": "178",
        "Kennzeichnung": "Plug and Play, FCC Klasse B bescheinigt, TUV, VCCI, ICES-003, SEMKO, DDC/CI, RoHS, Bleifrei, ISO 9241-307, KCC, WEEE, CECP, cETLus, RCM, CU",
        "Kontrast": "1000:1 / 10000000:1 (dynamisch)",
        "Leistungsaufnahme im Ein-Zustand": "18.2 W",
        "Leistungsmerkmale": "Slot f\u00fcr Sicherheitsschloss (Kabelschloss getrennt erh\u00e4ltlich)",
        "MTBF": "50,000 Stunde(n)",
        "Max. Betriebstemperatur": "40 \u00b0C",
        "Min Betriebstemperatur": "0 \u00b0C",
        "Native Aufl\u00f6sung": "Full HD (1080p) 1920 x 1080 bei 60 Hz",
        "Neigungswinkel": "-5/+20",
        "OSD-Sprachen": "Ungarisch, Tschechisch, Chinesisch (tradionell), Chinesisch (vereinfacht), Ukrainisch, Brasilianisches Portugiesisch, Englisch, Deutsch, Franz\u00f6sisch, Italienisch, Portugiesisch, Polnisch, Finnisch, Schwedisch, Russisch, Spanisch, Holl\u00e4ndisch, Griechisch, T\u00fcrkisch, Japanisch, Koreanisch",
        "Pixelpitch": "0.275 mm",
        "Ppi": "93",
        "Reaktionszeit": "5 ms (Gray-to-Gray)",
        "Schnittstellen": "VGA  HDMI (HDCP)  DVI-D (HDCP)",
        "Seitenverh\u00e4ltnis": "16:9",
        "Sichtbare Bildfl\u00e4che": "60.5 cm (23.8\")",
        "Stromverbrauch (Aus-Modus)": "0.5 Watt",
        "Stromverbrauch SDR (eingeschaltet)": "18 kWh/1.000 h",
        "Stromverbrauch im Standby-Modus": "0.5 Watt",
        "TCO-zertifiziert": "TCO Certified Displays 8",
        "VESA-Halterung": "100 x 100 mm",
        "Vertikale Bildwiederholrate": "56 - 76 Hz",
        "Vertikaler Betrachtungswinkel": "178",
        "Zul\u00e4ssige Luftfeuchtigkeit im Betrieb": "20 - 80%"
    },
    "raw_specifications_text": "Gruppe: TFTs\nHersteller: Philips\nHersteller Art. Nr.: 243V7QDSB/00\nEAN/UPC: 8712581742331\nDisplay-Typ: LED-hintergrundbeleuchteter LCD-Monitor / TFT-Aktivmatrix\nEnergie Effizienzklasse: Klasse E\nEnergieverbrauch pro Jahr: 31 kWh\nDiagonalabmessung: 61 cm (24\")\nSichtbare Bildfl\u00e4che: 60.5 cm (23.8\")\nBildschirmtyp: IPS\nSeitenverh\u00e4ltnis: 16:9\nNative Aufl\u00f6sung: Full HD (1080p) 1920 x 1080 bei 60 Hz\nPixelpitch: 0.275 mm\nPpi: 93\nHelligkeit: 250 cd/m\u00b2\nKontrast: 1000:1 / 10000000:1 (dynamisch)\nFarbunterst\u00fctzung: 16,7 Millionen Farben\nReaktionszeit: 5 ms (Gray-to-Gray)\nVertikale Bildwiederholrate: 56 - 76 Hz\nHorizontale Bildwiederholrate: 30 - 83 kHz\nHorizontaler Betrachtungswinkel: 178\nVertikaler Betrachtungswinkel: 178\nHintergrundbeleuchtungs-Technologie: WLED\nOSD-Sprachen: Ungarisch, Tschechisch, Chinesisch (tradionell), Chinesisch (vereinfacht), Ukrainisch, Brasilianisches Portugiesisch, Englisch, Deutsch, Franz\u00f6sisch, Italienisch, Portugiesisch, Polnisch, Finnisch, Schwedisch, Russisch, Spanisch, Holl\u00e4ndisch, Griechisch, T\u00fcrkisch, Japanisch, Koreanisch\nBesonderheiten: Sync-on-Green, sRGB-Farbmanagement, SmartResponse, SmartContrast, SmartImage, Kantenglas, Low Blue Light Mode, flimmerfreie Technologie, Ultra-schmale Kante, ohne Quecksilber, breiter Betrachtungswinkel, EasyRead\nFarbe: Textured Black\nAbmessungen (Breite x Tiefe x H\u00f6he): 54 cm x 20.9 cm x 41.5 cm - mit Fu\u00df\nGewicht: 3.5 kg\nMin Betriebstemperatur: 0 \u00b0C\nMax. Betriebstemperatur: 40 \u00b0C\nZul\u00e4ssige Luftfeuchtigkeit im Betrieb: 20 - 80%\nErforderliche Netzspannung: Wechselstrom 120/230 V (50/60 Hz)\nLeistungsaufnahme im Ein-Zustand: 18.2 W\nStromverbrauch SDR (eingeschaltet): 18 kWh/1.000 h\nStromverbrauch im Standby-Modus: 0.5 Watt\nStromverbrauch (Aus-Modus): 0.5 Watt\nErforderliches Betriebssystem: Apple MacOS X, Microsoft Windows 7 / 8 / 8.1 / 10\nSchnittstellen: VGA  HDMI (HDCP)  DVI-D (HDCP)\nEinstellungen der Anzeigeposition: Neigung\nNeigungswinkel: -5/+20\nVESA-Halterung: 100 x 100 mm\nLeistungsmerkmale: Slot f\u00fcr Sicherheitsschloss (Kabelschloss getrennt erh\u00e4ltlich)\nEnthaltene Kabel: 1 x VGA-Kabel\nMTBF: 50,000 Stunde(n)\nKennzeichnung: Plug and Play, FCC Klasse B bescheinigt, TUV, VCCI, ICES-003, SEMKO, DDC/CI, RoHS, Bleifrei, ISO 9241-307, KCC, WEEE, CECP, cETLus, RCM, CU\nDetails zu Abmessungen & Gewicht: Mit Fu\u00df - Breite: 54 cm - Tiefe: 20.9 cm - H\u00f6he: 41.5 cm - Gewicht: 3.5 kg  Ohne Fu\u00df - Breite: 54 cm - Tiefe: 4.5 cm - H\u00f6he: 32.5 cm - Gewicht: 3.1 kg\nTCO-zertifiziert: TCO Certified Displays 8\nENERGY STAR zertifiziert: Ja",
    "reference_file": "offer_reference_2431.json",
    "shop_name": "1ashop.at"
}