{
    "html_file": "offer_1484_10.html",
    "name": "Samsung Odyssey G7 G73T / G74T / G75T (2021), 31.5\"",
    "offer_link": "https://direkt.jacob.de/produkte/samsung-c32g75tqsr-80-lc32g75tqsrxen-artnr-7072354.html?utm_source=geizhals&utm_medium=cpc&utm_campaign=Preisvergleich&ref=103",
    "price": 738.84,
    "raw_specifications": {
        "Abmessungen (Breite x Tiefe x H\u00f6he)": "71.01 cm x 30.59 cm x 59.45 cm - mit Fu\u00df",
        "Abmessungen (Breite x Tiefe x H\u00f6he) - mit Fu\u00df": "71.01 cm x 30.59 cm x 59.45 cm",
        "Adaptive-Sync Technologie": "AMD FreeSync Premium Pro, NVIDIA G-Sync Compatible",
        "Besonderheiten": "HighBrightness, Crystal Clear, Cinema Mode, Black eQualizer, CustomColor Mode, FPS Mode, Mega Dynamic Contrast Ratio, flimmerfreie Technologie, RTS Mode, extra schnelles Aufladen \u00fcber USB, Eye Saver Mode, Werkstuning, Werks-Kalibrierungsbericht, Off Timer Plus, Niedrige Eingangsverz\u00f6gerung, Quantum Dot Technology, 125% sRGB-Farbskala, Super Arena Gaming UX, Screen Size Optimizer, Refresh Rate Optimizer, DCI-P3 95 % Farbraum, RPG Mode, AOS Mode, sRGB Mode, Picture-in-Picture, Picture-by-Picture, Dynamic Contrast Mode, Core-Beleuchtungsdesign",
        "Bildschirmtyp": "VA",
        "Details zu Abmessungen & Gewicht": "Mit Fu\u00df - Breite: 71.01 cm - Tiefe: 30.59 cm - H\u00f6he: 59.45 cm - Gewicht: 8.2 kg  Ohne Fu\u00df - Breite: 71.01 cm - Tiefe: 18.71 cm - H\u00f6he: 43.91 cm - Gewicht: 6.5 kg",
        "Diagonalabmessung": "81.3 cm (32\")",
        "Display-Typ": "LED-hintergrundbeleuchteter LCD-Monitor / TFT-Aktivmatrix",
        "Eingangsanschl\u00fcsse": "HDMI, 2xDisplayPort",
        "Eingangsspannung": "Wechselstrom 120/230 V",
        "Einstellungen der Anzeigeposition": "H\u00f6he, Pivot (Rotation), Drehung, Neigung",
        "Energie Effizienzklasse": "Klasse G",
        "Energieklasse (HDR)": "Klasse G",
        "Enthaltene Kabel": "1 x DisplayPort-Kabel  1 x SuperSpeed-USB-Kabel",
        "Farbe": "Schwarz",
        "Farbunterst\u00fctzung": "1,07 Mrd. Farben",
        "Ger\u00e4tetyp": "LED-hintergrundbeleuchteter LCD-Monitor - 81.3 cm (32\")",
        "Geschwungener Bildschirm": "Ja (1000R)",
        "Gewicht": "8.2 kg",
        "HDR-Zertifizierung": "DisplayHDR 600",
        "HDR-f\u00e4hig": "DisplayHDR 600",
        "Helligkeit": "600 cd/m\u00b2",
        "Hintergrundbeleuchtungs-Technologie": "LED-Hintergrundbeleuchtung",
        "Horizontaler Betrachtungswinkel": "178",
        "H\u00f6heneinstellung": "120 mm",
        "Integrierte Peripherieger\u00e4te": "USB 3.0-Hub",
        "Kennzeichnung": "DisplayPort 1.4",
        "Kontrast": "2500:1",
        "Leistungsaufnahme im Ein-Zustand": "40 W",
        "Leistungsmerkmale": "Slot f\u00fcr Sicherheitsschloss (Kabelschloss getrennt erh\u00e4ltlich)",
        "Max. Betriebstemperatur": "40 \u00b0C",
        "Min Betriebstemperatur": "10 \u00b0C",
        "Native Aufl\u00f6sung": "WQHD 2560 x 1440 bei 240 Hz",
        "Neigungswinkel": "-9/+13",
        "Produktbeschreibung": "Samsung Odyssey G7 C32G75TQSR - G75T Series - LED-Monitor - gebogen - 81.3 cm (32\") - HDR",
        "Reaktionszeit": "1 ms (Gray-to-Gray)",
        "Rotationswinkel": "-2/+92",
        "Schlosstyp zur Diebstahlsicherung": "Kensington Slot",
        "Schnittstellen": "2 x DisplayPort (DisplayPort 1,4 Modus)  HDMI  Kopfh\u00f6rer  2 x USB 3.0",
        "Schwenkwinkel": "30",
        "Seitenverh\u00e4ltnis": "16:9",
        "Sichtbare Bildfl\u00e4che": "80 cm (32\")",
        "Spannung": "Wechselstrom 120/230 V",
        "Stromverbrauch (Aus-Modus)": "0.3 Watt",
        "Stromverbrauch (max.)": "140 Watt",
        "Stromverbrauch (typisch)": "40 Watt",
        "Stromverbrauch HDR (eingeschaltet)": "80 kWh/1.000 h",
        "Stromverbrauch SDR (eingeschaltet)": "40 kWh/1.000 h",
        "Stromverbrauch im Standby-Modus": "0.5 Watt",
        "Transportbreite": "80.6 cm",
        "Transportgewicht": "12.3 kg",
        "Transporth\u00f6he": "27.2 cm",
        "Transporttiefe": "52 cm",
        "VESA-Halterung": "100 x 100 mm",
        "Vertikaler Betrachtungswinkel": "178",
        "Zul\u00e4ssige Luftfeuchtigkeit im Betrieb": "10 - 80% (nicht kondensierend)"
    },
    "raw_specifications_text": "Produktbeschreibung: Samsung Odyssey G7 C32G75TQSR - G75T Series - LED-Monitor - gebogen - 81.3 cm (32\") - HDR\nGer\u00e4tetyp: LED-hintergrundbeleuchteter LCD-Monitor - 81.3 cm (32\")\nEnergie Effizienzklasse: Klasse G\nLeistungsaufnahme im Ein-Zustand: 40 W\nGeschwungener Bildschirm: Ja (1000R)\nAdaptive-Sync Technologie: AMD FreeSync Premium Pro, NVIDIA G-Sync Compatible\nLeistungsmerkmale: Slot f\u00fcr Sicherheitsschloss (Kabelschloss getrennt erh\u00e4ltlich)\nBildschirmtyp: VA\nSeitenverh\u00e4ltnis: 16:9\nNative Aufl\u00f6sung: WQHD 2560 x 1440 bei 240 Hz\nHelligkeit: 600 cd/m\u00b2\nKontrast: 2500:1\nHDR-f\u00e4hig: DisplayHDR 600\nReaktionszeit: 1 ms (Gray-to-Gray)\nFarbunterst\u00fctzung: 1,07 Mrd. Farben\nEingangsanschl\u00fcsse: HDMI, 2xDisplayPort\nEinstellungen der Anzeigeposition: H\u00f6he, Pivot (Rotation), Drehung, Neigung\nSpannung: Wechselstrom 120/230 V\nFarbe: Schwarz\nAbmessungen (Breite x Tiefe x H\u00f6he) - mit Fu\u00df: 71.01 cm x 30.59 cm x 59.45 cm\nGewicht: 8.2 kg\nKennzeichnung: DisplayPort 1.4\nDisplay-Typ: LED-hintergrundbeleuchteter LCD-Monitor / TFT-Aktivmatrix\nEnergieklasse (HDR): Klasse G\nDiagonalabmessung: 81.3 cm (32\")\nSichtbare Bildfl\u00e4che: 80 cm (32\")\nIntegrierte Peripherieger\u00e4te: USB 3.0-Hub\nHDR-Zertifizierung: DisplayHDR 600\nHorizontaler Betrachtungswinkel: 178\nVertikaler Betrachtungswinkel: 178\nHintergrundbeleuchtungs-Technologie: LED-Hintergrundbeleuchtung\nBesonderheiten: HighBrightness, Crystal Clear, Cinema Mode, Black eQualizer, CustomColor Mode, FPS Mode, Mega Dynamic Contrast Ratio, flimmerfreie Technologie, RTS Mode, extra schnelles Aufladen \u00fcber USB, Eye Saver Mode, Werkstuning, Werks-Kalibrierungsbericht, Off Timer Plus, Niedrige Eingangsverz\u00f6gerung, Quantum Dot Technology, 125% sRGB-Farbskala, Super Arena Gaming UX, Screen Size Optimizer, Refresh Rate Optimizer, DCI-P3 95 % Farbraum, RPG Mode, AOS Mode, sRGB Mode, Picture-in-Picture, Picture-by-Picture, Dynamic Contrast Mode, Core-Beleuchtungsdesign\nAbmessungen (Breite x Tiefe x H\u00f6he): 71.01 cm x 30.59 cm x 59.45 cm - mit Fu\u00df\nSchnittstellen: 2 x DisplayPort (DisplayPort 1,4 Modus)  HDMI  Kopfh\u00f6rer  2 x USB 3.0\nNeigungswinkel: -9/+13\nSchwenkwinkel: 30\nRotationswinkel: -2/+92\nH\u00f6heneinstellung: 120 mm\nVESA-Halterung: 100 x 100 mm\nEnthaltene Kabel: 1 x DisplayPort-Kabel  1 x SuperSpeed-USB-Kabel\nSchlosstyp zur Diebstahlsicherung: Kensington Slot\nEingangsspannung: Wechselstrom 120/230 V\nStromverbrauch SDR (eingeschaltet): 40 kWh/1.000 h\nStromverbrauch HDR (eingeschaltet): 80 kWh/1.000 h\nStromverbrauch (typisch): 40 Watt\nStromverbrauch (max.): 140 Watt\nStromverbrauch im Standby-Modus: 0.5 Watt\nStromverbrauch (Aus-Modus): 0.3 Watt\nDetails zu Abmessungen & Gewicht: Mit Fu\u00df - Breite: 71.01 cm - Tiefe: 30.59 cm - H\u00f6he: 59.45 cm - Gewicht: 8.2 kg  Ohne Fu\u00df - Breite: 71.01 cm - Tiefe: 18.71 cm - H\u00f6he: 43.91 cm - Gewicht: 6.5 kg\nTransportbreite: 80.6 cm\nTransporttiefe: 52 cm\nTransporth\u00f6he: 27.2 cm\nTransportgewicht: 12.3 kg\nMin Betriebstemperatur: 10 \u00b0C\nMax. Betriebstemperatur: 40 \u00b0C\nZul\u00e4ssige Luftfeuchtigkeit im Betrieb: 10 - 80% (nicht kondensierend)",
    "reference_file": "offer_reference_1484.json",
    "shop_name": "Jacob Elektronik direkt (AT)"
}