{
    "html_file": "offer_1842_41.html",
    "name": "ASUS TUF Gaming VG279Q1R, 27\"",
    "offer_link": "https://www.alternate.at/ASUS/TUF-Gaming-VG279Q1R-Gaming-Monitor/html/product/1657371?partner=AtGeizhalsat&campaign=Monitor/ASUS/1657371",
    "price": 244.9,
    "raw_specifications": {
        "": "Optional",
        "Abmessungen": "Breite: 61,26 cm x H\u00f6he: 43,1 cm x Tiefe/L\u00e4nge: 21,3 cm",
        "Anschl\u00fcsse": "2x HDMI-Eingang, (HDMI-Version: 1.4), 1x DisplayPort-Eingang, (DisplayPort-Version: 1.2), 1x 3,5-mm-Audio-Ausgang",
        "Bild": "Glaretyp",
        "Bildschirmaufl\u00f6sung": "1.920 x 1.080 Pixel",
        "Bildschirmdiagonale": "69 cm (27 Zoll)",
        "EAN": "4718017571555",
        "Energieeffizienzklasse (SDR)": "F (A - G)",
        "Energieverbauch pro 1000 Stunden (SDR)": "26 kWh",
        "Ergonomie": "Typ",
        "Farbe": "schwarz",
        "Features": "Flicker-Free LED, Low Blue Light, ASUS Shadow Boost, ASUS Extreme-Low-Motion-Blur (ELMB), ASUS GamePlus",
        "Frequenz": "Vertikal",
        "Geeignet f\u00fcr": "Gaming",
        "Gewicht": "3,9 kg",
        "Hersteller-Nr.": "90LM05S1-B01E70",
        "Lautsprecher": "2 Lautsprecher",
        "Leistungsaufnahme im Bereitschafts- und Aus-Zustand": "0,322 Watt",
        "Leistungsaufnahme im Ein-Zustand bei Standard-Dynamikumfang (SDR)": "25,72 Watt",
        "Serie": "TUF Gaming",
        "Typ": "Gaming-Monitor",
        "Wandhalterung": "VESA kompatibel (75 x 75 mm)",
        "Zubeh\u00f6r": "Vorhanden"
    },
    "raw_specifications_text": "Energieeffizienzklasse (SDR): F (A - G)\nEnergieverbauch pro 1000 Stunden (SDR): 26 kWh\nLeistungsaufnahme im Ein-Zustand bei Standard-Dynamikumfang (SDR): 25,72 Watt\nLeistungsaufnahme im Bereitschafts- und Aus-Zustand: 0,322 Watt\nBildschirmdiagonale: 69 cm (27 Zoll)\nBildschirmaufl\u00f6sung: 1.920 x 1.080 Pixel\nTyp: Gaming-Monitor\nFarbe: schwarz\nEAN: 4718017571555\nHersteller-Nr.: 90LM05S1-B01E70\nSerie: TUF Gaming\nGeeignet f\u00fcr: Gaming\nBild: Glaretyp\n: Optional\nFrequenz: Vertikal\nAnschl\u00fcsse: 2x HDMI-Eingang, (HDMI-Version: 1.4), 1x DisplayPort-Eingang, (DisplayPort-Version: 1.2), 1x 3,5-mm-Audio-Ausgang\nErgonomie: Typ\nLautsprecher: 2 Lautsprecher\nWandhalterung: VESA kompatibel (75 x 75 mm)\nFeatures: Flicker-Free LED, Low Blue Light, ASUS Shadow Boost, ASUS Extreme-Low-Motion-Blur (ELMB), ASUS GamePlus\nZubeh\u00f6r: Vorhanden\nAbmessungen: Breite: 61,26 cm x H\u00f6he: 43,1 cm x Tiefe/L\u00e4nge: 21,3 cm\nGewicht: 3,9 kg",
    "reference_file": "offer_reference_1842.json",
    "shop_name": "Alternate.at"
}