{
    "html_file": "offer_799_6.html",
    "name": "AOC Agon Pro AG344UXM, 34\"",
    "offer_link": "https://www.taufnaus.de/product/10602039",
    "price": 1133.86,
    "raw_specifications": {
        "Abmessungen (Breite x Tiefe x H\u00f6he)": "81.64 cm x 40.014 cm x 46.774 cm - mit Fu\u00df",
        "Adaptive-Sync Technologie": "NVIDIA G-SYNC Compatible, AMD FreeSync Premium",
        "Ausgangsleistung/Kanal": "16 Watt",
        "Besonderheiten": "Bild f\u00fcr Bild, FPS Mode, Low Blue Light Mode, flimmerfreie Technologie, Niedrige Eingangsverz\u00f6gerung, Game Color Mode, Rennmodus, Picture-in-Picture, Dial Point, an 3 Seiten rahmenlos, Logo-Projektionslicht, Shadow Control, G-menu, Bildz\u00e4hler, Quick Switch, Light FX",
        "Bildschirmbeschichtung": "Blendfrei",
        "Bildschirmtyp": "IPS",
        "Details zu Abmessungen & Gewicht": "Mit Standfu\u00df (niedrigste Position) - Breite: 81.64 cm - Tiefe: 40.014 cm - H\u00f6he: 46.774 cm - Gewicht: 12.77 kg \u00a6 Mit Standfu\u00df (h\u00f6chste Position) - Breite: 81.64 cm - Tiefe: 40.014 cm - H\u00f6he: 59.774 cm - Gewicht: 12.77 kg \u00a6 Ohne Fu\u00df - Breite: 81.64 cm - Tiefe: 8.79 cm - H\u00f6he: 37.25 cm",
        "Diagonalabmessung": "86.7 cm (34\")",
        "Display-Typ": "LED-hintergrundbeleuchteter LCD-Monitor / TFT-Aktivmatrix",
        "Einstellungen der Anzeigeposition": "H\u00f6he, Drehung, Neigung",
        "Energie Effizienzklasse": "Klasse G",
        "Energieklasse (HDR)": "Klasse G",
        "Enthaltene Kabel": "1 x Kabel USB-C auf USB-C / USB-A - 1.5 m \u00a6 1 x HDMI-Kabel - 1.8 m \u00a6 1 x DisplayPort-Kabel - 1.8 m",
        "Farbe": "Schwarz",
        "Farbraum": "100% sRGB (CIE 1976), 93% Adobe RGB (CIE 1976)",
        "Farbunterst\u00fctzung": "1,07 Mrd. Farben",
        "Gaming": "Ja",
        "Gewicht": "12.77 kg",
        "HDR-Zertifizierung": "DisplayHDR 1000",
        "Helligkeit": "1000 cd/m\u00b2",
        "Hintergrundbeleuchtungs-Technologie": "Mini LED-Hintergrundbeleuchtung",
        "Horizontaler Betrachtungswinkel": "178",
        "H\u00f6heneinstellung": "130 mm",
        "Integrierte Peripherieger\u00e4te": "USB 3.2 Gen 1 Hub",
        "Kontrast": "1000:1 / 80000000:1 (dynamisch)",
        "Leistungsmerkmale": "Slot f\u00fcr Sicherheitsschloss (Kabelschloss getrennt erh\u00e4ltlich)",
        "Native Aufl\u00f6sung": "UWQHD 3440 x 1440 bei 170 Hz",
        "Neigungswinkel": "-5/+23",
        "OSD-Sprachen": "Multilingual",
        "Pixelpitch": "0.2316 mm",
        "Reaktionszeit": "1 ms (Gray-to-Gray)",
        "Schlosstyp zur Diebstahlsicherung": "Kensington Slot",
        "Schnittstellen": "Kopfh\u00f6rer \u00a6 USB-C/DisplayPort Alt Mode (bis zu 90 W) \u00a6 2 x HDMI \u00a6 DisplayPort 1.4 \u00a6 Mikrofon \u00a6 4 x USB",
        "Schwenkwinkel": "40",
        "Seitenverh\u00e4ltnis": "21:9",
        "Service und Support": "Begrenzte Garantie - 3 Jahre",
        "Stromverbrauch (Aus-Modus)": "0.3 Watt",
        "Stromverbrauch (typisch)": "142 Watt",
        "Stromverbrauch HDR (eingeschaltet)": "100 kWh/1.000 h",
        "Stromverbrauch SDR (eingeschaltet)": "70 kWh/1.000 h",
        "Stromverbrauch im Standby-Modus": "0.5 Watt",
        "Tastatur-/Mausschnittstelle": "USB",
        "Transportbreite": "98.3 cm",
        "Transportgewicht": "17.7 kg",
        "Transporth\u00f6he": "52.6 cm",
        "Transporttiefe": "28.3 cm",
        "Typ": "Lautsprecher - Stereo",
        "VESA-Halterung": "100 x 100 mm",
        "Vertikaler Betrachtungswinkel": "178"
    },
    "raw_specifications_text": "Display-Typ: LED-hintergrundbeleuchteter LCD-Monitor / TFT-Aktivmatrix\nEnergie Effizienzklasse: Klasse G\nEnergieklasse (HDR): Klasse G\nDiagonalabmessung: 86.7 cm (34\")\nAdaptive-Sync Technologie: NVIDIA G-SYNC Compatible, AMD FreeSync Premium\nIntegrierte Peripherieger\u00e4te: USB 3.2 Gen 1 Hub\nBildschirmtyp: IPS\nSeitenverh\u00e4ltnis: 21:9\nNative Aufl\u00f6sung: UWQHD 3440 x 1440 bei 170 Hz\nPixelpitch: 0.2316 mm\nHelligkeit: 1000 cd/m\u00b2\nKontrast: 1000:1 / 80000000:1 (dynamisch)\nHDR-Zertifizierung: DisplayHDR 1000\nFarbunterst\u00fctzung: 1,07 Mrd. Farben\nFarbraum: 100% sRGB (CIE 1976), 93% Adobe RGB (CIE 1976)\nReaktionszeit: 1 ms (Gray-to-Gray)\nGaming: Ja\nHorizontaler Betrachtungswinkel: 178\nVertikaler Betrachtungswinkel: 178\nBildschirmbeschichtung: Blendfrei\nHintergrundbeleuchtungs-Technologie: Mini LED-Hintergrundbeleuchtung\nOSD-Sprachen: Multilingual\nBesonderheiten: Bild f\u00fcr Bild, FPS Mode, Low Blue Light Mode, flimmerfreie Technologie, Niedrige Eingangsverz\u00f6gerung, Game Color Mode, Rennmodus, Picture-in-Picture, Dial Point, an 3 Seiten rahmenlos, Logo-Projektionslicht, Shadow Control, G-menu, Bildz\u00e4hler, Quick Switch, Light FX\nFarbe: Schwarz\nAbmessungen (Breite x Tiefe x H\u00f6he): 81.64 cm x 40.014 cm x 46.774 cm - mit Fu\u00df\nGewicht: 12.77 kg\nTyp: Lautsprecher - Stereo\nAusgangsleistung/Kanal: 16 Watt\nTastatur-/Mausschnittstelle: USB\nSchnittstellen: Kopfh\u00f6rer \u00a6 USB-C/DisplayPort Alt Mode (bis zu 90 W) \u00a6 2 x HDMI \u00a6 DisplayPort 1.4 \u00a6 Mikrofon \u00a6 4 x USB\nEinstellungen der Anzeigeposition: H\u00f6he, Drehung, Neigung\nNeigungswinkel: -5/+23\nSchwenkwinkel: 40\nH\u00f6heneinstellung: 130 mm\nVESA-Halterung: 100 x 100 mm\nLeistungsmerkmale: Slot f\u00fcr Sicherheitsschloss (Kabelschloss getrennt erh\u00e4ltlich)\nEnthaltene Kabel: 1 x Kabel USB-C auf USB-C / USB-A - 1.5 m \u00a6 1 x HDMI-Kabel - 1.8 m \u00a6 1 x DisplayPort-Kabel - 1.8 m\nSchlosstyp zur Diebstahlsicherung: Kensington Slot\nStromverbrauch SDR (eingeschaltet): 70 kWh/1.000 h\nStromverbrauch HDR (eingeschaltet): 100 kWh/1.000 h\nStromverbrauch (typisch): 142 Watt\nStromverbrauch im Standby-Modus: 0.5 Watt\nStromverbrauch (Aus-Modus): 0.3 Watt\nDetails zu Abmessungen & Gewicht: Mit Standfu\u00df (niedrigste Position) - Breite: 81.64 cm - Tiefe: 40.014 cm - H\u00f6he: 46.774 cm - Gewicht: 12.77 kg \u00a6 Mit Standfu\u00df (h\u00f6chste Position) - Breite: 81.64 cm - Tiefe: 40.014 cm - H\u00f6he: 59.774 cm - Gewicht: 12.77 kg \u00a6 Ohne Fu\u00df - Breite: 81.64 cm - Tiefe: 8.79 cm - H\u00f6he: 37.25 cm\nTransportbreite: 98.3 cm\nTransporttiefe: 28.3 cm\nTransporth\u00f6he: 52.6 cm\nTransportgewicht: 17.7 kg\nService und Support: Begrenzte Garantie - 3 Jahre",
    "reference_file": "offer_reference_799.json",
    "shop_name": "TaufNaus"
}