{
    "html_file": "offer_1046_0.html",
    "name": "AOC Agon Pro AG274QS, 27\"",
    "offer_link": "https://direkt.jacob.de/produkte/aoc-ag274qs-led-ag274qs-artnr-7560198.html?utm_source=geizhals&utm_medium=cpc&utm_campaign=Preisvergleich&ref=103",
    "price": 654.43,
    "raw_specifications": {
        "AMD FreeSync": "Ja",
        "AMD FreeSync Bildwiederholratenbereich": "48 - 300 Hz",
        "Abnehmbarer Standfu\u00df": "Ja",
        "Anzahl DisplayPort Anschl\u00fcsse": "2",
        "Anzahl HDMI-Anschl\u00fcsse": "2",
        "Anzahl der Farben des Displays": "16,78 Millionen Farben",
        "Anzahl der nachgeschalteten Steckpl\u00e4tze vom Typ USB-A": "4",
        "Bildschirmdiagonale": "68,6 cm (27\" )",
        "Bildschirmform": "Flach",
        "Blickwinkel, horizontal": "178\u00b0",
        "Blickwinkel, vertikal": "178\u00b0",
        "DC-Anschluss": "Ja",
        "Eingebaute Lautsprecher": "Ja",
        "Energie Effizienzklasse": "G",
        "Energieeffizienzskala": "A bis G",
        "Externes Netzteil": "Ja",
        "Fu\u00dffarbe": "Schwarz/Rot",
        "Gewicht (mit St\u00e4nder)": "7,62 kg",
        "HD-Typ": "Quad HD",
        "HDMI": "Ja",
        "HDMI-Version": "2.0",
        "Helligkeit (typisch)": "350 cd/m\u00b2",
        "High Dynamic Range Video Unterst\u00fctzung": "Ja",
        "H\u00f6heneinstellung": "13 cm",
        "H\u00f6henverstellung": "Ja",
        "Integrierte Kamera": "Nein",
        "Integrierter USB-Hub": "Ja",
        "Kontrastverh\u00e4ltnis": "1000:1",
        "Kontrastverh\u00e4ltnis (dynamisch)": "50000000:1",
        "Kopfh\u00f6rerausgang": "Ja",
        "Marktpositionierung": "Gaming",
        "Maximale Bildwiederholrate": "300 Hz",
        "Mikrofon-Eingang": "Ja",
        "NVIDIA G-SYNC": "Ja",
        "Natives Seitenverh\u00e4ltnis": "16:9",
        "Neigungswinkelbereich": "3 - 21\u00b0",
        "Netzteiltyp": "Extern",
        "On-Screen-Display (OSD)": "Ja",
        "Paketgewicht": "11,7 kg",
        "Panel-Montage-Schnittstelle": "100 x 100 mm",
        "Panel-Typ": "IPS",
        "Pivot": "Ja",
        "Produktfarbe": "Schwarz, Rot",
        "Reaktionszeit": "1 ms",
        "Schwenkbar": "Ja",
        "Schwenkwinkelbereich": "28 - 28\u00b0",
        "Stromverbrauch (Standby)": "0,5 W",
        "Stromverbrauch (aus)": "0,3 W",
        "St\u00e4nder enthalten": "Ja",
        "Technologie mit hohem Dynamikbereich (HDR)": "High Dynamic Range (HDR) 400",
        "Typ der Hintergrundbeleuchtung": "W-LED",
        "USB-Hub-Version": "3.2 Gen 1 (3.1 Gen 1)",
        "VESA-Halterung": "Ja",
        "kippbar": "Ja"
    },
    "raw_specifications_text": "Bildschirmdiagonale: 68,6 cm (27\" )\nNatives Seitenverh\u00e4ltnis: 16:9\nEnergie Effizienzklasse: G\nPanel-Typ: IPS\nHD-Typ: Quad HD\nBildschirmform: Flach\nKontrastverh\u00e4ltnis: 1000:1\nMaximale Bildwiederholrate: 300 Hz\nAnzahl der Farben des Displays: 16,78 Millionen Farben\nHelligkeit (typisch): 350 cd/m\u00b2\nReaktionszeit: 1 ms\nTyp der Hintergrundbeleuchtung: W-LED\nKontrastverh\u00e4ltnis (dynamisch): 50000000:1\nBlickwinkel, horizontal: 178\u00b0\nBlickwinkel, vertikal: 178\u00b0\nHigh Dynamic Range Video Unterst\u00fctzung: Ja\nTechnologie mit hohem Dynamikbereich (HDR): High Dynamic Range (HDR) 400\nNVIDIA G-SYNC: Ja\nAMD FreeSync: Ja\nAMD FreeSync Bildwiederholratenbereich: 48 - 300 Hz\nEingebaute Lautsprecher: Ja\nIntegrierte Kamera: Nein\nMarktpositionierung: Gaming\nProduktfarbe: Schwarz, Rot\nAbnehmbarer Standfu\u00df: Ja\nFu\u00dffarbe: Schwarz/Rot\nIntegrierter USB-Hub: Ja\nHDMI: Ja\nKopfh\u00f6rerausgang: Ja\nUSB-Hub-Version: 3.2 Gen 1 (3.1 Gen 1)\nAnzahl der nachgeschalteten Steckpl\u00e4tze vom Typ USB-A: 4\nAnzahl HDMI-Anschl\u00fcsse: 2\nHDMI-Version: 2.0\nAnzahl DisplayPort Anschl\u00fcsse: 2\nMikrofon-Eingang: Ja\nDC-Anschluss: Ja\nVESA-Halterung: Ja\nH\u00f6henverstellung: Ja\nPanel-Montage-Schnittstelle: 100 x 100 mm\nH\u00f6heneinstellung: 13 cm\nPivot: Ja\nSchwenkbar: Ja\nSchwenkwinkelbereich: 28 - 28\u00b0\nkippbar: Ja\nNeigungswinkelbereich: 3 - 21\u00b0\nOn-Screen-Display (OSD): Ja\nStromverbrauch (Standby): 0,5 W\nStromverbrauch (aus): 0,3 W\nNetzteiltyp: Extern\nExternes Netzteil: Ja\nEnergieeffizienzskala: A bis G\nGewicht (mit St\u00e4nder): 7,62 kg\nSt\u00e4nder enthalten: Ja\nPaketgewicht: 11,7 kg",
    "reference_file": "offer_reference_1046.json",
    "shop_name": "Jacob Elektronik direkt (AT)"
}