{
    "html_file": "offer_1135_2.html",
    "name": "LC-Power LC-M27-QHD-240-C-K, 27\"",
    "offer_link": "https://direkt.jacob.de/produkte/lc-power-27-68-58cm-tft-lc-m27-qhd-240-c-k-artnr-7346430.html?utm_source=geizhals&utm_medium=cpc&utm_campaign=Preisvergleich&ref=103",
    "price": 561.23,
    "raw_specifications": {
        "AMD FreeSync": "Ja",
        "AMD FreeSync-Typ": "FreeSync Premium",
        "Adobe RGB-Abdeckung": "89,5%",
        "Anzahl DisplayPort Anschl\u00fcsse": "1",
        "Anzahl HDMI-Anschl\u00fcsse": "2",
        "Anzahl der Farben des Displays": "16,7 Millionen Farben",
        "Anzahl der nachgeschalteten Steckpl\u00e4tze vom Typ USB-A": "2",
        "Audioanschl\u00fcsse": "Nein",
        "Audioausgang": "Ja",
        "Betriebsanleitung": "Ja",
        "Bewertung der Bildschirmkr\u00fcmmung": "1000R",
        "Bildschirmaufl\u00f6sung": "2560 x 1440 Pixel",
        "Bildschirmdiagonale": "68,6 cm (27\" )",
        "Bildschirmdiagonale (cm)": "68,58 cm",
        "Bildschirmform": "Gebogen",
        "Bildwinkel, horizontal": "178\u00b0",
        "Bildwinkel, vertikal": "178\u00b0",
        "Blendfreier Bildschirm": "Ja",
        "Breite (ohne Standfu\u00df)": "61,6 cm",
        "DisplayPorts-Version": "1.4",
        "Eingebaute Lautsprecher": "Nein",
        "Energieeffizienzklasse (HDR)": "G",
        "Energieeffizienzklasse (SDR)": "F",
        "Energieeffizienzskala": "A bis G",
        "Energieverbrauch (HDR) pro 1.000 Stunden": "52 kWh",
        "Energieverbrauch (SDR) pro 1.000 Stunden": "25 kWh",
        "Farbskala": "94,1%",
        "Flimmerfreie Technologie": "Ja",
        "Fu\u00dffarbe": "Wei\u00df",
        "Ger\u00e4tebreite (inkl. Fu\u00df)": "616 mm",
        "Ger\u00e4teh\u00f6he (inkl. Fu\u00df)": "560 mm",
        "Ger\u00e4tetiefe (inkl. Fu\u00df)": "269 mm",
        "Gewicht (mit St\u00e4nder)": "5,18 kg",
        "HD-Typ": "Quad HD",
        "HDMI": "Ja",
        "HDMI-Version": "2.0",
        "Helligkeit (typisch)": "650 cd/m\u00b2",
        "High Dynamic Range Video (HDR) Unterst\u00fctzung": "Ja",
        "H\u00f6he (ohne Standfu\u00df)": "37,2 cm",
        "H\u00f6heneinstellung": "11,5 cm",
        "H\u00f6henverstellung": "Ja",
        "Integrierte Kamera": "Nein",
        "Integrierter USB-Hub": "Ja",
        "Kontrastverh\u00e4ltnis": "2500:1",
        "Kopfh\u00f6rer-Anschluss": "3,5 mm",
        "Kopfh\u00f6rerausgang": "Ja",
        "Kopfh\u00f6rerausg\u00e4nge": "1",
        "Marktpositionierung": "Gaming",
        "Maximale Bildwiederholrate": "240 Hz",
        "Mitgelieferte Kabel": "AC, DisplayPort, HDMI",
        "NTSC Abdeckung (typisch)": "109%",
        "NVIDIA G-SYNC": "Nein",
        "Nachhaltigkeitszertifikate": "CE",
        "Natives Seitenverh\u00e4ltnis": "16:9",
        "Neigungswinkelbereich": "5 - 20\u00b0",
        "Paketgewicht": "9,28 kg",
        "Panel-Montage-Schnittstelle": "100 x 100 mm",
        "Panel-Typ": "VA",
        "Pivot": "Ja",
        "Pivot Winkel": "0 - 25\u00b0",
        "Pixel Abstand": "0,0777 x 0,2331 mm",
        "Produktfarbe": "Wei\u00df",
        "RGB-Farbraum": "DCI-P3",
        "Reaktionszeit": "1 ms",
        "Stromadapter enthalten": "Ja",
        "Stromverbrauch (Standby)": "0,5 W",
        "Technologie mit hohem Dynamikbereich (HDR)": "DisplayHDR 1000",
        "Tiefe (ohne Standfu\u00df)": "12,2 cm",
        "USB Power Delivery": "Ja",
        "USB-Hub-Version": "3.2 Gen 1 (3.1 Gen 1)",
        "USB-Stromversorgung bis zu": "65 W",
        "VESA-Halterung": "Ja",
        "Verpackungsbreite": "713 mm",
        "Verpackungsh\u00f6he": "252 mm",
        "Verpackungstiefe": "515 mm",
        "kippbar": "Ja",
        "sRGB Abdeckung (klassisch)": "99,2%"
    },
    "raw_specifications_text": "Bildschirmdiagonale: 68,6 cm (27\" )\nBildschirmaufl\u00f6sung: 2560 x 1440 Pixel\nNatives Seitenverh\u00e4ltnis: 16:9\nPanel-Typ: VA\nHD-Typ: Quad HD\nBildschirmform: Gebogen\nKontrastverh\u00e4ltnis: 2500:1\nMaximale Bildwiederholrate: 240 Hz\nAnzahl der Farben des Displays: 16,7 Millionen Farben\nHelligkeit (typisch): 650 cd/m\u00b2\nReaktionszeit: 1 ms\nBlendfreier Bildschirm: Ja\nBewertung der Bildschirmkr\u00fcmmung: 1000R\nBildwinkel, horizontal: 178\u00b0\nBildwinkel, vertikal: 178\u00b0\nPixel Abstand: 0,0777 x 0,2331 mm\nBildschirmdiagonale (cm): 68,58 cm\nHigh Dynamic Range Video (HDR) Unterst\u00fctzung: Ja\nTechnologie mit hohem Dynamikbereich (HDR): DisplayHDR 1000\nRGB-Farbraum: DCI-P3\nFarbskala: 94,1%\nsRGB Abdeckung (klassisch): 99,2%\nNTSC Abdeckung (typisch): 109%\nAdobe RGB-Abdeckung: 89,5%\nNVIDIA G-SYNC: Nein\nAMD FreeSync: Ja\nAMD FreeSync-Typ: FreeSync Premium\nFlimmerfreie Technologie: Ja\nEingebaute Lautsprecher: Nein\nIntegrierte Kamera: Nein\nMarktpositionierung: Gaming\nProduktfarbe: Wei\u00df\nFu\u00dffarbe: Wei\u00df\nIntegrierter USB-Hub: Ja\nHDMI: Ja\nKopfh\u00f6rerausgang: Ja\nUSB-Hub-Version: 3.2 Gen 1 (3.1 Gen 1)\nAnzahl der nachgeschalteten Steckpl\u00e4tze vom Typ USB-A: 2\nUSB Power Delivery: Ja\nUSB-Stromversorgung bis zu: 65 W\nAnzahl HDMI-Anschl\u00fcsse: 2\nHDMI-Version: 2.0\nAnzahl DisplayPort Anschl\u00fcsse: 1\nDisplayPorts-Version: 1.4\nAudioanschl\u00fcsse: Nein\nAudioausgang: Ja\nKopfh\u00f6rerausg\u00e4nge: 1\nKopfh\u00f6rer-Anschluss: 3,5 mm\nVESA-Halterung: Ja\nH\u00f6henverstellung: Ja\nPanel-Montage-Schnittstelle: 100 x 100 mm\nH\u00f6heneinstellung: 11,5 cm\nPivot: Ja\nPivot Winkel: 0 - 25\u00b0\nkippbar: Ja\nNeigungswinkelbereich: 5 - 20\u00b0\nEnergieeffizienzklasse (SDR): F\nEnergieeffizienzklasse (HDR): G\nEnergieverbrauch (SDR) pro 1.000 Stunden: 25 kWh\nEnergieverbrauch (HDR) pro 1.000 Stunden: 52 kWh\nStromverbrauch (Standby): 0,5 W\nEnergieeffizienzskala: A bis G\nNachhaltigkeitszertifikate: CE\nGer\u00e4tebreite (inkl. Fu\u00df): 616 mm\nGer\u00e4tetiefe (inkl. Fu\u00df): 269 mm\nGer\u00e4teh\u00f6he (inkl. Fu\u00df): 560 mm\nGewicht (mit St\u00e4nder): 5,18 kg\nBreite (ohne Standfu\u00df): 61,6 cm\nTiefe (ohne Standfu\u00df): 12,2 cm\nH\u00f6he (ohne Standfu\u00df): 37,2 cm\nMitgelieferte Kabel: AC, DisplayPort, HDMI\nStromadapter enthalten: Ja\nBetriebsanleitung: Ja\nVerpackungsbreite: 713 mm\nVerpackungstiefe: 515 mm\nVerpackungsh\u00f6he: 252 mm\nPaketgewicht: 9,28 kg",
    "reference_file": "offer_reference_1135.json",
    "shop_name": "Jacob Elektronik direkt (AT)"
}