{
    "html_file": "offer_2127_0.html",
    "name": "ViewSonic VX3276-4K-MHD, 31.5\"",
    "offer_link": "https://direkt.jacob.de/produkte/viewsonic-vx-series-vx3276-4k-mhd-artnr-5807392.html?utm_source=geizhals&utm_medium=cpc&utm_campaign=Preisvergleich&ref=103",
    "price": 371.74,
    "raw_specifications": {
        "AC Eingangsfrequenz": "50/60 Hz",
        "AC Eingangsspannung": "100 - 240 V",
        "Anzahl DisplayPort Anschl\u00fcsse": "1",
        "Anzahl HDMI Anschl\u00fcsse": "2",
        "Anzahl der Farben des Displays": "16,78 Millionen Farben",
        "Anzahl der Lautsprecher": "2",
        "Anzahl der Mini DisplayPorts": "1",
        "Bildschirmaufl\u00f6sung": "3840 x 2160 Pixel",
        "Bildschirmdiagonale": "81,3 cm (32\" )",
        "Bildschirmtechnologie": "LED",
        "Blickwinkel, horizontal": "178\u00b0",
        "Blickwinkel, vertikal": "178\u00b0",
        "Breite": "713 mm",
        "Digital horizontale Frequenz": "15 - 140 kHz",
        "Digital vertikale Frequenz": "24 - 75 Hz",
        "Display-Oberfl\u00e4che": "Matt",
        "DisplayPorts-Version": "1.2",
        "Eingebaute Lautsprecher": "Ja",
        "Energie Effizienzklasse": "G",
        "Form des Bildschirms": "Flach",
        "Ger\u00e4tebreite (inkl. Fu\u00df)": "713 mm",
        "Ger\u00e4teh\u00f6he (inkl. Fu\u00df)": "507 mm",
        "Ger\u00e4tetiefe (inkl. Fu\u00df)": "230 mm",
        "Gewicht": "6,2 kg",
        "Gewicht (mit Standfu\u00df)": "6,8 kg",
        "HD-Typ": "4K Ultra HD",
        "HDMI": "Ja",
        "HDMI-Version": "2.0",
        "Helligkeit (typisch)": "300 cd/m\u00b2",
        "High Dynamic Range Video Unterst\u00fctzung": "Ja",
        "Hintergrundbeleuchtung": "W-LED",
        "H\u00f6he": "418 mm",
        "Integrierte Kamera": "Nein",
        "Kabelsperre-Slot": "Ja",
        "Kontrastverh\u00e4ltnis": "2500:1",
        "Kontrastverh\u00e4ltnis (dynamisch)": "80000000:1",
        "Kopfh\u00f6rer-Konnektivit\u00e4t": "3,5 mm",
        "Kopfh\u00f6rerausgang": "Ja",
        "Kopfh\u00f6rerausg\u00e4nge": "1",
        "Luftfeuchtigkeit in Betrieb": "20 - 90%",
        "Marktpositionierung": "Gaming",
        "Mitgelieferte Kabel": "AC,HDMI",
        "Natives Seitenverh\u00e4ltnis": "16:9",
        "Neigungsverstellung": "Ja",
        "Neigungswinkelbereich": "4 - 15\u00b0",
        "On-Screen-Display (OSD)": "Ja",
        "Paketgewicht": "9 kg",
        "Panel-Typ": "MVA",
        "Produktfarbe": "Silber",
        "RMS-Leistung": "4 W",
        "Reaktionszeit": "8 ms",
        "Reaktionszeit (schnell)": "3 ms",
        "Schnellstart\u00fcbersicht": "Ja",
        "Slot-Typ Kabelsperre": "Kensington",
        "Stromverbrauch (PowerSave)": "24 W",
        "Stromverbrauch (Standby)": "0,5 W",
        "Stromverbrauch (in Betrieb)": "53 W",
        "Stromverbrauch (max.)": "56 W",
        "Temperaturbereich in Betrieb": "0 - 40 \u00b0C",
        "Tiefe": "42 mm",
        "Unterst\u00fctzte Grafik-Aufl\u00f6sungen": "3840 x 2160",
        "VESA Montageadapter": "100 x 100 mm",
        "VESA-Halterung": "Ja",
        "Verpackungsbreite": "838 mm",
        "Verpackungsh\u00f6he": "514 mm",
        "Verpackungstiefe": "118 mm",
        "Zertifizierung": "EPEAT, CEC, MX-CoC, Mexico Energy, CE, CE EMC, CB"
    },
    "raw_specifications_text": "Bildschirmdiagonale: 81,3 cm (32\" )\nHelligkeit (typisch): 300 cd/m\u00b2\nBildschirmaufl\u00f6sung: 3840 x 2160 Pixel\nEnergie Effizienzklasse: G\nNatives Seitenverh\u00e4ltnis: 16:9\nReaktionszeit: 8 ms\nPanel-Typ: MVA\nHD-Typ: 4K Ultra HD\nBildschirmtechnologie: LED\nForm des Bildschirms: Flach\nUnterst\u00fctzte Grafik-Aufl\u00f6sungen: 3840 x 2160\nKontrastverh\u00e4ltnis: 2500:1\nBlickwinkel, horizontal: 178\u00b0\nBlickwinkel, vertikal: 178\u00b0\nAnzahl der Farben des Displays: 16,78 Millionen Farben\nHintergrundbeleuchtung: W-LED\nDisplay-Oberfl\u00e4che: Matt\nKontrastverh\u00e4ltnis (dynamisch): 80000000:1\nReaktionszeit (schnell): 3 ms\nDigital horizontale Frequenz: 15 - 140 kHz\nDigital vertikale Frequenz: 24 - 75 Hz\nHigh Dynamic Range Video Unterst\u00fctzung: Ja\nEingebaute Lautsprecher: Ja\nIntegrierte Kamera: Nein\nAnzahl der Lautsprecher: 2\nRMS-Leistung: 4 W\nMarktpositionierung: Gaming\nProduktfarbe: Silber\nZertifizierung: EPEAT, CEC, MX-CoC, Mexico Energy, CE, CE EMC, CB\nHDMI: Ja\nAnzahl DisplayPort Anschl\u00fcsse: 1\nKopfh\u00f6rerausgang: Ja\nAnzahl HDMI Anschl\u00fcsse: 2\nHDMI-Version: 2.0\nAnzahl der Mini DisplayPorts: 1\nDisplayPorts-Version: 1.2\nKopfh\u00f6rerausg\u00e4nge: 1\nKopfh\u00f6rer-Konnektivit\u00e4t: 3,5 mm\nVESA-Halterung: Ja\nKabelsperre-Slot: Ja\nVESA Montageadapter: 100 x 100 mm\nSlot-Typ Kabelsperre: Kensington\nNeigungsverstellung: Ja\nNeigungswinkelbereich: 4 - 15\u00b0\nOn-Screen-Display (OSD): Ja\nStromverbrauch (in Betrieb): 53 W\nStromverbrauch (Standby): 0,5 W\nStromverbrauch (max.): 56 W\nStromverbrauch (PowerSave): 24 W\nAC Eingangsspannung: 100 - 240 V\nAC Eingangsfrequenz: 50/60 Hz\nTemperaturbereich in Betrieb: 0 - 40 \u00b0C\nLuftfeuchtigkeit in Betrieb: 20 - 90%\nBreite: 713 mm\nTiefe: 42 mm\nH\u00f6he: 418 mm\nGewicht: 6,2 kg\nGer\u00e4tebreite (inkl. Fu\u00df): 713 mm\nGer\u00e4tetiefe (inkl. Fu\u00df): 230 mm\nGer\u00e4teh\u00f6he (inkl. Fu\u00df): 507 mm\nGewicht (mit Standfu\u00df): 6,8 kg\nMitgelieferte Kabel: AC,HDMI\nSchnellstart\u00fcbersicht: Ja\nVerpackungsbreite: 838 mm\nVerpackungstiefe: 118 mm\nVerpackungsh\u00f6he: 514 mm\nPaketgewicht: 9 kg",
    "reference_file": "offer_reference_2127.json",
    "shop_name": "Jacob Elektronik direkt (AT)"
}