{
    "html_file": "offer_558_0.html",
    "name": "Lenovo Legion Y27-30, 27\"",
    "offer_link": "https://www.amazon.de/dp/B0BCQJZQX7?linkCode=xm2&camp=2025&creative=165953&smid=A3JWKAKR8XB7XF&creativeASIN=B0BCQJZQX7&tag=geizhals1-21",
    "price": 180.5,
    "raw_specifications": {
        "ASIN": "B0BCQJZQX7",
        "Amazon Bestseller-Rang": "Nr. 8,439 in Computer & Zubeh\u00f6r (Siehe Top 100 in Computer & Zubeh\u00f6r)  Nr. 179 in Monitore",
        "Artikelgewicht": "\u200e6,4 Kilograms",
        "Batterien enthalten": "\u200eNein",
        "Bildschirmaufl\u00f6sung": "\u200e1920x1080",
        "Display-Gr\u00f6\u00dfe": "\u200e27 Zoll",
        "Durchschnittliche Kundenbewertung": "3,6  3,6 von 5 Sternen    \n    39 Sternebewertungen   \n\n\n 3,6 von 5 Sternen",
        "Farbe": "\u200eSchwarz",
        "Garantierte Software-Updates bis": "\u200eunbekannt",
        "Hersteller": "\u200eLenovo",
        "Im Angebot von Amazon.de seit": "1. September 2022",
        "L\u00f6sung": "\u200e1920 x 1080 Pixels",
        "Marke": "\u200eLenovo",
        "Modellnummer": "\u200e66F8GAC3EU",
        "Produktabmessungen": "\u200e25,88 x 61,37 x 53,65 cm; 6,4 Kilogramm"
    },
    "raw_specifications_text": "Marke: \u200eLenovo\nHersteller: \u200eLenovo\nProduktabmessungen: \u200e25,88 x 61,37 x 53,65 cm; 6,4 Kilogramm\nModellnummer: \u200e66F8GAC3EU\nFarbe: \u200eSchwarz\nDisplay-Gr\u00f6\u00dfe: \u200e27 Zoll\nBildschirmaufl\u00f6sung: \u200e1920x1080\nL\u00f6sung: \u200e1920 x 1080 Pixels\nBatterien enthalten: \u200eNein\nArtikelgewicht: \u200e6,4 Kilograms\nGarantierte Software-Updates bis: \u200eunbekannt\nASIN: B0BCQJZQX7\nDurchschnittliche Kundenbewertung: 3,6  3,6 von 5 Sternen    \n    39 Sternebewertungen   \n\n\n 3,6 von 5 Sternen\nAmazon Bestseller-Rang: Nr. 8,439 in Computer & Zubeh\u00f6r (Siehe Top 100 in Computer & Zubeh\u00f6r)  Nr. 179 in Monitore\nIm Angebot von Amazon.de seit: 1. September 2022",
    "reference_file": "offer_reference_558.json",
    "shop_name": "Amazon.at"
}