{
    "html_file": "offer_2228_26.html",
    "name": "Dell UltraSharp U4919DW, 49\"",
    "offer_link": "https://click.cptrack.de/?rd=true&k=5QNCBYB9xMh6DJycvhgeW4dHnBpDMePaGGl8_JpSZRrRXnbb_h9UvgC6CnP1ys8WiqCdpe0PJ81gw-kNg21utg~~&rdlink=https%3A%2F%2Fwww.cw-mobile.de%2Fdell-ultrasharp-u4919dw-124-46-cm-49-zoll-led-monitor.html%3Futm_source%3DPSM%26utm_medium%3DGeizhals%26utm_campaign%3DPSM",
    "price": 1257.99,
    "raw_specifications": {
        "Abmessungen & Gewicht (Transport)Transportgewicht": "26.43 kg",
        "Abmessungen und GewichtDetails zu Abmessungen & Gewicht": "Mit Fu\u00df - Breite: 121.51 cm \u00a6 Ohne Fu\u00df - Breite: 121.51 cm - H\u00f6he: 37.1 cm - Gewicht: 11.4 kg",
        "AllgemeinDisplay-Typ": "LED-hintergrundbeleuchteter LCD-Monitor / TFT-AktivmatrixEnergie Effizienzklasse: Klasse GEnergieverbrauch pro Jahr: 74 kWhDiagonalabmessung: 124.5 cm (49\")Geschwungener Bildschirm: Ja (3800R)Integrierte Peripherieger\u00e4te: USB 3.0-HubBildschirmtyp: IPSSeitenverh\u00e4ltnis: 32:9Native Aufl\u00f6sung: Dual Quad HD 5120 x 1440 bei 60 HzPixelpitch: 0.234 mmPpi: 109Helligkeit: 350 cd/m\u00b2Kontrast: 1000:1Farbunterst\u00fctzung: 1,07 Mrd. FarbenFarbraum: 99% sRGBReaktionszeit: 5 ms (Fast), 8 ms (normal)Horizontaler Betrachtungswinkel: 178Vertikaler Betrachtungswinkel: 178Bildschirmbeschichtung: Blendfrei, 3H Hard CoatingHintergrundbeleuchtungs-Technologie: WLEDBesonderheiten: Bild f\u00fcr Bild, 10-Bit-Gamma, LED-Randlichtsystem, Monitorkalibrierung Delta EAbmessungen (Breite x Tiefe x H\u00f6he): 121.51 cm x 25.26 cm x 45.86 cm - mit Fu\u00df",
        "Informationen zur Kompatibilit\u00e4tEntwickelt f\u00fcr": "Dell 7560 \u00a6 Dell OptiPlex 3090 \u00a6 Dell XPS 15 9570",
        "Konnektivit\u00e4tSchnittstellen": "2 x HDMI (HDCP) \u00a6 DisplayPort (HDCP) \u00a6 2 x USB 3.0 Upstream \u00a6 5 x USB 3.0 Downstream \u00a6 USB-C/DisplayPort 1.4 Alt Mode",
        "MechanischEinstellungen der Anzeigeposition": "H\u00f6he, Drehung, NeigungNeigungswinkel: -5/+21Schwenkwinkel: 340H\u00f6heneinstellung: 90 mmVESA-Halterung: Ja",
        "Software / SystemanforderungenMitgelieferte Software": "Dell Display Manager",
        "StromversorgungEingangsspannung": "Wechselstrom 100-240 V (50/60 Hz)Leistungsaufnahme im Ein-Zustand: 47 WStromverbrauch SDR (eingeschaltet): 47 kWh/1.000 hStromverbrauch (typisch): 60 WattStromverbrauch (max.): 230 WattStromverbrauch im Standby-Modus: 0.4 WattStromverbrauch (Aus-Modus): 0.2 WattEin-/Aus-Schalter: Nein",
        "UmgebungsbedingungenZul\u00e4ssige Luftfeuchtigkeit im Betrieb": "20 - 80% (nicht kondensierend)",
        "UmweltschutzstandardsTCO-zertifiziert": "TCO Certified Displays 8ENERGY STAR zertifiziert: Ja",
        "VerschiedenesKennzeichnung": "DisplayPort 1.4, HDCP 2.2"
    },
    "raw_specifications_text": "AllgemeinDisplay-Typ: LED-hintergrundbeleuchteter LCD-Monitor / TFT-AktivmatrixEnergie Effizienzklasse: Klasse GEnergieverbrauch pro Jahr: 74 kWhDiagonalabmessung: 124.5 cm (49\")Geschwungener Bildschirm: Ja (3800R)Integrierte Peripherieger\u00e4te: USB 3.0-HubBildschirmtyp: IPSSeitenverh\u00e4ltnis: 32:9Native Aufl\u00f6sung: Dual Quad HD 5120 x 1440 bei 60 HzPixelpitch: 0.234 mmPpi: 109Helligkeit: 350 cd/m\u00b2Kontrast: 1000:1Farbunterst\u00fctzung: 1,07 Mrd. FarbenFarbraum: 99% sRGBReaktionszeit: 5 ms (Fast), 8 ms (normal)Horizontaler Betrachtungswinkel: 178Vertikaler Betrachtungswinkel: 178Bildschirmbeschichtung: Blendfrei, 3H Hard CoatingHintergrundbeleuchtungs-Technologie: WLEDBesonderheiten: Bild f\u00fcr Bild, 10-Bit-Gamma, LED-Randlichtsystem, Monitorkalibrierung Delta EAbmessungen (Breite x Tiefe x H\u00f6he): 121.51 cm x 25.26 cm x 45.86 cm - mit Fu\u00df\nKonnektivit\u00e4tSchnittstellen: 2 x HDMI (HDCP) \u00a6 DisplayPort (HDCP) \u00a6 2 x USB 3.0 Upstream \u00a6 5 x USB 3.0 Downstream \u00a6 USB-C/DisplayPort 1.4 Alt Mode\nMechanischEinstellungen der Anzeigeposition: H\u00f6he, Drehung, NeigungNeigungswinkel: -5/+21Schwenkwinkel: 340H\u00f6heneinstellung: 90 mmVESA-Halterung: Ja\nVerschiedenesKennzeichnung: DisplayPort 1.4, HDCP 2.2\nStromversorgungEingangsspannung: Wechselstrom 100-240 V (50/60 Hz)Leistungsaufnahme im Ein-Zustand: 47 WStromverbrauch SDR (eingeschaltet): 47 kWh/1.000 hStromverbrauch (typisch): 60 WattStromverbrauch (max.): 230 WattStromverbrauch im Standby-Modus: 0.4 WattStromverbrauch (Aus-Modus): 0.2 WattEin-/Aus-Schalter: Nein\nSoftware / SystemanforderungenMitgelieferte Software: Dell Display Manager\nAbmessungen und GewichtDetails zu Abmessungen & Gewicht: Mit Fu\u00df - Breite: 121.51 cm \u00a6 Ohne Fu\u00df - Breite: 121.51 cm - H\u00f6he: 37.1 cm - Gewicht: 11.4 kg\nAbmessungen & Gewicht (Transport)Transportgewicht: 26.43 kg\nUmweltschutzstandardsTCO-zertifiziert: TCO Certified Displays 8ENERGY STAR zertifiziert: Ja\nUmgebungsbedingungenZul\u00e4ssige Luftfeuchtigkeit im Betrieb: 20 - 80% (nicht kondensierend)\nInformationen zur Kompatibilit\u00e4tEntwickelt f\u00fcr: Dell 7560 \u00a6 Dell OptiPlex 3090 \u00a6 Dell XPS 15 9570",
    "reference_file": "offer_reference_2228.json",
    "shop_name": "cw-mobile.de"
}