{
    "html_file": "offer_1624_0.html",
    "name": "AG neovo MX-24, 23.6\"",
    "offer_link": "https://www.csv-direct.de/artinfo.php?artnr=AGX0483964&KATEGORIE=162&pva=geizhals2",
    "price": 1163.59,
    "raw_specifications": {
        "3D": "Nein",
        "AMD FreeSync": "Nein",
        "Anzahl DVI-D-Anschl\u00fcsse": "1",
        "Anzahl DisplayPort Anschl\u00fcsse": "1",
        "Anzahl HDMI-Anschl\u00fcsse": "1",
        "Anzahl VGA D-Sub Anschl\u00fcsse": "1",
        "Anzahl der Farben des Displays": "16,78 Millionen Farben",
        "Anzahl der Lautsprecher": "2",
        "Betriebstemperatur": "0 - 40 \u00b0C",
        "Bildschirmdiagonale": "59,9 cm 23.6\"",
        "Bildschirmform": "Flach",
        "Bildschirmtechnologie": "LCD",
        "Bildwinkel, horizontal": "170\u00b0",
        "Bildwinkel, vertikal": "160\u00b0",
        "Breite ohne Standfu\u00df": "562 mm",
        "Display-Aufl\u00f6sung": "1920 x 1080 Pixel",
        "Eingangsstrom": "2.5 A",
        "Energieeffizienzklasse alt": "G",
        "Gewicht ohne St\u00e4nder": "7,8 kg",
        "HD-Typ": "Full HD",
        "Helligkeit typisch": "300 cd/m\u00b2",
        "Horizontaler Scanbereich": "24 - 82 kHz",
        "H\u00f6he bei Betrieb": "0 - 3000 m",
        "H\u00f6he bei Lagerung": "0 - 12192 m",
        "H\u00f6he ohne Standfu\u00df": "397 mm",
        "H\u00f6henverstellung": "Nein",
        "Integrierte Kamera": "Nein",
        "Integrierter USB-Hub": "Nein",
        "Kontrastverh\u00e4ltnis": "1000:1",
        "Kontrastverh\u00e4ltnis dynamisch": "20000000:1",
        "Luftfeuchtigkeit bei Lagerung": "5 - 95",
        "Marktpositionierung": "Medizinisch",
        "Mitgelieferte Kabel": "AC, Audio 3,5 mm, VGA",
        "NVIDIA G-SYNC": "Nein",
        "Nachhaltigkeitszertifikate": "RoHS",
        "Paketgewicht": "10,6 kg",
        "Panel-Montage-Schnittstelle": "75 x 75,100 x 100 mm",
        "Panel-Typ": "TFT",
        "Pixel Abstand": "0,2715 x 0,2715 mm",
        "Produktfarbe": "Wei\u00df",
        "RMS-Leistung": "4 W",
        "Reaktionszeit": "5 ms",
        "Relative Luftfeuchtigkeit in Betrieb": "10 - 90",
        "Slot-Typ Kabelsperre": "Kensington",
        "Stromverbrauch Standardbetrieb": "19 W",
        "Stromverbrauch Standby": "0,5 W",
        "TV Tuner integriert": "Nein",
        "Temperaturbereich bei Lagerung": "-20 - 60 \u00b0C",
        "Tiefe ohne Standfu\u00df": "155 mm",
        "Touchscreen": "Nein",
        "Unterst\u00fctzte Grafik-Aufl\u00f6sungen": "1920 x 1080 HD 1080",
        "Verpackungsbreite": "676 mm",
        "Verpackungsh\u00f6he": "525 mm",
        "Verpackungstiefe": "213 mm",
        "Vertikaler Scanbereich": "50 - 75 Hz",
        "Zertifizierung": "CE, EN60601-1, IEC60601-1, WEEE, REACH"
    },
    "raw_specifications_text": "Bildschirmdiagonale: 59,9 cm 23.6\"\nDisplay-Aufl\u00f6sung: 1920 x 1080 Pixel\nBildschirmtechnologie: LCD\nTouchscreen: Nein\nHD-Typ: Full HD\nPanel-Typ: TFT\nBildschirmform: Flach\nKontrastverh\u00e4ltnis: 1000:1\nAnzahl der Farben des Displays: 16,78 Millionen Farben\nHelligkeit typisch: 300 cd/m\u00b2\nReaktionszeit: 5 ms\nUnterst\u00fctzte Grafik-Aufl\u00f6sungen: 1920 x 1080 HD 1080\nKontrastverh\u00e4ltnis dynamisch: 20000000:1\nBildwinkel, horizontal: 170\u00b0\nBildwinkel, vertikal: 160\u00b0\nPixel Abstand: 0,2715 x 0,2715 mm\nHorizontaler Scanbereich: 24 - 82 kHz\nVertikaler Scanbereich: 50 - 75 Hz\n3D: Nein\nNVIDIA G-SYNC: Nein\nAMD FreeSync: Nein\nIntegrierte Kamera: Nein\nAnzahl der Lautsprecher: 2\nRMS-Leistung: 4 W\nMarktpositionierung: Medizinisch\nProduktfarbe: Wei\u00df\nZertifizierung: CE, EN60601-1, IEC60601-1, WEEE, REACH\nIntegrierter USB-Hub: Nein\nAnzahl VGA D-Sub Anschl\u00fcsse: 1\nAnzahl DVI-D-Anschl\u00fcsse: 1\nAnzahl HDMI-Anschl\u00fcsse: 1\nAnzahl DisplayPort Anschl\u00fcsse: 1\nH\u00f6henverstellung: Nein\nPanel-Montage-Schnittstelle: 75 x 75,100 x 100 mm\nSlot-Typ Kabelsperre: Kensington\nStromverbrauch Standardbetrieb: 19 W\nStromverbrauch Standby: 0,5 W\nEingangsstrom: 2.5 A\nBetriebstemperatur: 0 - 40 \u00b0C\nTemperaturbereich bei Lagerung: -20 - 60 \u00b0C\nRelative Luftfeuchtigkeit in Betrieb: 10 - 90\nLuftfeuchtigkeit bei Lagerung: 5 - 95\nH\u00f6he bei Betrieb: 0 - 3000 m\nH\u00f6he bei Lagerung: 0 - 12192 m\nMitgelieferte Kabel: AC, Audio 3,5 mm, VGA\nBreite ohne Standfu\u00df: 562 mm\nTiefe ohne Standfu\u00df: 155 mm\nH\u00f6he ohne Standfu\u00df: 397 mm\nGewicht ohne St\u00e4nder: 7,8 kg\nVerpackungsbreite: 676 mm\nVerpackungstiefe: 213 mm\nVerpackungsh\u00f6he: 525 mm\nPaketgewicht: 10,6 kg\nNachhaltigkeitszertifikate: RoHS\nTV Tuner integriert: Nein\nEnergieeffizienzklasse alt: G",
    "reference_file": "offer_reference_1624.json",
    "shop_name": "CSV-Direct.de"
}