{
    "html_file": "offer_1054_23.html",
    "name": "ViewSonic VP3256-4K, 31.5\"",
    "offer_link": "https://www.taufnaus.de/product/10611318",
    "price": 802.35,
    "raw_specifications": {
        "Abmessungen (Breite x Tiefe x H\u00f6he)": "71.5 cm x 26.5 cm x 51.38 cm - mit Fu\u00df",
        "Ausgangsleistung/Kanal": "3 Watt",
        "Besonderheiten": "Eco-Mode, rahmenlos, On-screen Digital Controls, flimmerfreie Technologie, automatische Drehung, TMDS-Technologie (Transition Minimized Differential Signaling), Blaulichtfilter-Technologie, Adaptive-Sync-Technologie, Monitorkalibrierung Delta E<2, Pantone kalibriert, 10-bit (8-bit + A-FRC) Farbtiefe, ergonomischer St\u00e4nder",
        "Bildschirmbeschichtung": "Anti-glare 3H hardness",
        "Bildschirmtyp": "IPS",
        "Details zu Abmessungen & Gewicht": "Mit Fu\u00df - Breite: 71.5 cm - Tiefe: 26.5 cm - H\u00f6he: 51.38 cm - Gewicht: 10.9 kg \u00a6 Ohne Fu\u00df - Breite: 71.5 cm - Tiefe: 6.6 cm - H\u00f6he: 42.3 cm - Gewicht: 7.2 kg",
        "Diagonalabmessung": "81.3 cm (32\")",
        "Display-Typ": "LED-hintergrundbeleuchteter LCD-Monitor / TFT-Aktivmatrix",
        "ENERGY STAR zertifiziert": "Ja",
        "Eingangsspannung": "Wechselstrom 100-240 V (50/60 Hz)",
        "Einstellungen der Anzeigeposition": "H\u00f6he, Pivot (Rotation), Drehung, Neigung",
        "Energie Effizienzklasse": "Klasse G",
        "Energieklasse (HDR)": "Klasse G",
        "Enthaltene Kabel": "1 x USB-C Kabel \u00a6 1 x DisplayPort 1.2-Kabel \u00a6 1 x HDMI-Kabel \u00a6 1 x USB 3.2 Kabel - USB Typ A auf B",
        "Erforderliches Betriebssystem": "Apple MacOS, Microsoft Windows 7 / 8 / 10",
        "Farbraum": "100% sRGB",
        "Farbunterst\u00fctzung": "1,07 Mrd. Farben",
        "Gewicht": "10.9 kg",
        "Helligkeit": "350 cd/m\u00b2",
        "Hintergrundbeleuchtungs-Technologie": "LED-Hintergrundbeleuchtung",
        "Horizontale Bildwiederholrate": "15 - 136 kHz",
        "Horizontaler Betrachtungswinkel": "178",
        "H\u00f6heneinstellung": "130 mm",
        "Integrierte Peripherieger\u00e4te": "USB 3.2 Hub",
        "Kennzeichnung": "FCC Klasse B bescheinigt, ICES-003, NOM, CB, CCC, RoHS, WEEE, cTUVus, REACH, CEC, UkrSEPRO, ERP, EAC, China Energy Label, China RoHS, CE/EMC, Mexico Energy label, UKCA",
        "Kontrast": "1000:1 / 20000000:1 (dynamisch)",
        "Lebensdauer der Beleuchtung": "30,000 Stunden",
        "Leistungsmerkmale": "Slot f\u00fcr Sicherheitsschloss (Kabelschloss getrennt erh\u00e4ltlich), Unterst\u00fctzung f\u00fcr VESA-Schnittstelle",
        "Max. Betriebstemperatur": "40 \u00b0C",
        "Min Betriebstemperatur": "0 \u00b0C",
        "Native Aufl\u00f6sung": "4K UHD (2160p) 3840 x 2160 (DisplayPort: 75 Hz, HDMI: 75 Hz, USB-C: 60 Hz)",
        "Neigungswinkel": "-5/+21",
        "Reaktionszeit": "5 ms (grau zu grau mit \u00dcbersteuerung)",
        "Rotationswinkel": "90",
        "Schlosstyp zur Diebstahlsicherung": "Kensington Slot",
        "Schnittstellen": "2 x HDMI \u00a6 DisplayPort 1.2a \u00a6 2 x USB 3.2 Downstream (Typ A) \u00a6 USB 3.2 Upstream (Typ B) \u00a6 USB-C 3.2 Upstream/DisplayPort 1.2a Alt Mode mit Spannungsversorgung (bis zu 60 W)",
        "Schwenkwinkel": "120",
        "Seitenverh\u00e4ltnis": "16:9",
        "Service und Support": "Begrenzte Garantie - 3 Jahre - Pick-Up & Return",
        "Sichtbare Bildfl\u00e4che": "80 cm (31.5\")",
        "Stromverbrauch (max.)": "50 Watt",
        "Stromverbrauch (typisch)": "46 Watt",
        "Stromverbrauch HDR (eingeschaltet)": "52 kWh/1.000 h",
        "Stromverbrauch SDR (eingeschaltet)": "52 kWh/1.000 h",
        "Stromverbrauch im Standby-Modus": "0.5 Watt",
        "Transportbreite": "84 cm",
        "Transportgewicht": "15.3 kg",
        "Transporth\u00f6he": "52 cm",
        "Transporttiefe": "32.6 cm",
        "Typ": "Lautsprecher - Stereo",
        "USB-Spannungsversorgung": "60 Watt",
        "VESA-Halterung": "100 x 100 mm",
        "Vertikale Bildwiederholrate": "24 - 75 Hz",
        "Vertikaler Betrachtungswinkel": "178",
        "Zubeh\u00f6r im Lieferumfang": "Kabelh\u00fclle",
        "Zul\u00e4ssige Luftfeuchtigkeit im Betrieb": "20 - 90% (nicht kondensierend)"
    },
    "raw_specifications_text": "Display-Typ: LED-hintergrundbeleuchteter LCD-Monitor / TFT-Aktivmatrix\nEnergie Effizienzklasse: Klasse G\nEnergieklasse (HDR): Klasse G\nDiagonalabmessung: 81.3 cm (32\")\nSichtbare Bildfl\u00e4che: 80 cm (31.5\")\nIntegrierte Peripherieger\u00e4te: USB 3.2 Hub\nUSB-Spannungsversorgung: 60 Watt\nBildschirmtyp: IPS\nSeitenverh\u00e4ltnis: 16:9\nNative Aufl\u00f6sung: 4K UHD (2160p) 3840 x 2160 (DisplayPort: 75 Hz, HDMI: 75 Hz, USB-C: 60 Hz)\nHelligkeit: 350 cd/m\u00b2\nKontrast: 1000:1 / 20000000:1 (dynamisch)\nFarbunterst\u00fctzung: 1,07 Mrd. Farben\nFarbraum: 100% sRGB\nReaktionszeit: 5 ms (grau zu grau mit \u00dcbersteuerung)\nVertikale Bildwiederholrate: 24 - 75 Hz\nHorizontale Bildwiederholrate: 15 - 136 kHz\nHorizontaler Betrachtungswinkel: 178\nVertikaler Betrachtungswinkel: 178\nBildschirmbeschichtung: Anti-glare 3H hardness\nHintergrundbeleuchtungs-Technologie: LED-Hintergrundbeleuchtung\nBesonderheiten: Eco-Mode, rahmenlos, On-screen Digital Controls, flimmerfreie Technologie, automatische Drehung, TMDS-Technologie (Transition Minimized Differential Signaling), Blaulichtfilter-Technologie, Adaptive-Sync-Technologie, Monitorkalibrierung Delta E<2, Pantone kalibriert, 10-bit (8-bit + A-FRC) Farbtiefe, ergonomischer St\u00e4nder\nAbmessungen (Breite x Tiefe x H\u00f6he): 71.5 cm x 26.5 cm x 51.38 cm - mit Fu\u00df\nGewicht: 10.9 kg\nTyp: Lautsprecher - Stereo\nAusgangsleistung/Kanal: 3 Watt\nSchnittstellen: 2 x HDMI \u00a6 DisplayPort 1.2a \u00a6 2 x USB 3.2 Downstream (Typ A) \u00a6 USB 3.2 Upstream (Typ B) \u00a6 USB-C 3.2 Upstream/DisplayPort 1.2a Alt Mode mit Spannungsversorgung (bis zu 60 W)\nEinstellungen der Anzeigeposition: H\u00f6he, Pivot (Rotation), Drehung, Neigung\nNeigungswinkel: -5/+21\nSchwenkwinkel: 120\nRotationswinkel: 90\nH\u00f6heneinstellung: 130 mm\nVESA-Halterung: 100 x 100 mm\nLeistungsmerkmale: Slot f\u00fcr Sicherheitsschloss (Kabelschloss getrennt erh\u00e4ltlich), Unterst\u00fctzung f\u00fcr VESA-Schnittstelle\nZubeh\u00f6r im Lieferumfang: Kabelh\u00fclle\nEnthaltene Kabel: 1 x USB-C Kabel \u00a6 1 x DisplayPort 1.2-Kabel \u00a6 1 x HDMI-Kabel \u00a6 1 x USB 3.2 Kabel - USB Typ A auf B\nLebensdauer der Beleuchtung: 30,000 Stunden\nKennzeichnung: FCC Klasse B bescheinigt, ICES-003, NOM, CB, CCC, RoHS, WEEE, cTUVus, REACH, CEC, UkrSEPRO, ERP, EAC, China Energy Label, China RoHS, CE/EMC, Mexico Energy label, UKCA\nSchlosstyp zur Diebstahlsicherung: Kensington Slot\nEingangsspannung: Wechselstrom 100-240 V (50/60 Hz)\nStromverbrauch SDR (eingeschaltet): 52 kWh/1.000 h\nStromverbrauch HDR (eingeschaltet): 52 kWh/1.000 h\nStromverbrauch (typisch): 46 Watt\nStromverbrauch (max.): 50 Watt\nStromverbrauch im Standby-Modus: 0.5 Watt\nErforderliches Betriebssystem: Apple MacOS, Microsoft Windows 7 / 8 / 10\nDetails zu Abmessungen & Gewicht: Mit Fu\u00df - Breite: 71.5 cm - Tiefe: 26.5 cm - H\u00f6he: 51.38 cm - Gewicht: 10.9 kg \u00a6 Ohne Fu\u00df - Breite: 71.5 cm - Tiefe: 6.6 cm - H\u00f6he: 42.3 cm - Gewicht: 7.2 kg\nTransportbreite: 84 cm\nTransporttiefe: 32.6 cm\nTransporth\u00f6he: 52 cm\nTransportgewicht: 15.3 kg\nENERGY STAR zertifiziert: Ja\nService und Support: Begrenzte Garantie - 3 Jahre - Pick-Up & Return\nMin Betriebstemperatur: 0 \u00b0C\nMax. Betriebstemperatur: 40 \u00b0C\nZul\u00e4ssige Luftfeuchtigkeit im Betrieb: 20 - 90% (nicht kondensierend)",
    "reference_file": "offer_reference_1054.json",
    "shop_name": "TaufNaus"
}