{
    "html_file": "offer_904_4.html",
    "name": "ViewSonic VG2448a-2, 23.8\"",
    "offer_link": "https://www.playox.de/productredirect/index/sku/23781401?sPartner=p-geizhals-at&campaign=psm/geizhals-at/",
    "price": 166.08,
    "raw_specifications": {
        "Anschl\u00fcsse": "USB, DisplayPort, HDMI, VGA/D-Sub",
        "Artikelnummer": "23781401",
        "Aufl\u00f6sung Kurzname": "Full HD",
        "Bezeichnung des Herstellers": "ViewSonic VG2448A-2 (24\") 60,62cm LED-Monitor",
        "Breite": "52,00 mm",
        "Displaygr\u00f6\u00dfe": "60,96 cm (24 Zoll)",
        "EEK - Spektrum": "AG",
        "Einsatzort": "Innen",
        "Energieeffizienzklasse": "E",
        "Geh\u00e4usefarbe des Ger\u00e4tes": "Schwarz",
        "Gewicht": "3,80 kg",
        "Gewicht inkl. Verpackung in Kg": "8,20 kg",
        "Helligkeit Bereich": "150 - 300 cd/m\u00b2",
        "Hersteller": "Viewsonic",
        "H\u00f6he": "320,00 mm",
        "Inhalt (ml oder g)": "0,00 ml",
        "Kapazit\u00e4t (Seiten)": "0",
        "Kontrastverh\u00e4ltnis (typisch) Bereich": "800:1 bis 1.200:1",
        "LCD-Technologie": "IPS Panel",
        "L\u00e4nge": "539,00 mm",
        "Produktart": "Monitore",
        "Reaktionszeit": "5,00 ms",
        "Seitenverh\u00e4ltnis": "16:9",
        "Shop Herstellernummer": "VG2448A-2",
        "Standard-EAN": "0766907014693",
        "Verpackung - Breite in cm": "39,60 cm",
        "Verpackung - H\u00f6he in cm": "21,00 cm",
        "Verpackung - L\u00e4nge in cm": "59,50 cm",
        "max. Aufl\u00f6sung": "1.920 x 1.080 Pixel (16:9)"
    },
    "raw_specifications_text": "Geh\u00e4usefarbe des Ger\u00e4tes: Schwarz\nAnschl\u00fcsse: USB, DisplayPort, HDMI, VGA/D-Sub\nProduktart: Monitore\nDisplaygr\u00f6\u00dfe: 60,96 cm (24 Zoll)\nHelligkeit Bereich: 150 - 300 cd/m\u00b2\nKontrastverh\u00e4ltnis (typisch) Bereich: 800:1 bis 1.200:1\nHersteller: Viewsonic\nGewicht: 3,80 kg\nInhalt (ml oder g): 0,00 ml\nKapazit\u00e4t (Seiten): 0\nAufl\u00f6sung Kurzname: Full HD\nEEK - Spektrum: AG\nVerpackung - H\u00f6he in cm: 21,00 cm\nVerpackung - L\u00e4nge in cm: 59,50 cm\nGewicht inkl. Verpackung in Kg: 8,20 kg\nBreite: 52,00 mm\nH\u00f6he: 320,00 mm\nArtikelnummer: 23781401\nStandard-EAN: 0766907014693\nShop Herstellernummer: VG2448A-2\nBezeichnung des Herstellers: ViewSonic VG2448A-2 (24\") 60,62cm LED-Monitor\nL\u00e4nge: 539,00 mm\nVerpackung - Breite in cm: 39,60 cm\nmax. Aufl\u00f6sung: 1.920 x 1.080 Pixel (16:9)\nSeitenverh\u00e4ltnis: 16:9\nLCD-Technologie: IPS Panel\nReaktionszeit: 5,00 ms\nEinsatzort: Innen\nEnergieeffizienzklasse: E",
    "reference_file": "offer_reference_904.json",
    "shop_name": "playox (AT)"
}