{
    "html_file": "offer_1440_16.html",
    "name": "ViewSonic VX2718-2KPC-MHD, 27\"",
    "offer_link": "https://www.taufnaus.de/product/10620672",
    "price": 298.57,
    "raw_specifications": {
        "Abmessungen (Breite x Tiefe x H\u00f6he)": "61.1 cm x 22.5 cm x 47.5 cm - mit Fu\u00df",
        "Ausgangsleistung/Kanal": "2 Watt",
        "Besonderheiten": "Eco-Mode, Spielmodus, flimmerfreie Technologie, TMDS-Technologie (Transition Minimized Differential Signaling), Blaulichtfilter-Technologie, Adaptive-Sync-Technologie, Movie Mode, Textmodus, Webmodus, Monomodus, ViewMode, Eye-Care Technology",
        "Bildschirmbeschichtung": "Entspiegelt, 3H Hard Coating",
        "Bildschirmtyp": "VA",
        "Details zu Abmessungen & Gewicht": "Mit Fu\u00df - Breite: 61.1 cm - Tiefe: 22.5 cm - H\u00f6he: 47.5 cm - Gewicht: 3.9 kg \u00a6 Ohne Fu\u00df - Breite: 61.1 cm - Tiefe: 7.5 cm - H\u00f6he: 36.3 cm - Gewicht: 3.3 kg",
        "Diagonalabmessung": "68.6 cm (27\")",
        "Display-Typ": "LED-hintergrundbeleuchteter LCD-Monitor / TFT-Aktivmatrix",
        "Eingangsspannung": "Wechselstrom 120/230 V (50/60 Hz)",
        "Einstellungen der Anzeigeposition": "Neigung",
        "Energie Effizienzklasse": "Klasse G",
        "Enthaltene Kabel": "DisplayPort 1.2-Kabel",
        "Erforderliches Betriebssystem": "Apple MacOS, Windows 10",
        "Farbraum": "102% sRGB, 72% NTSC",
        "Farbunterst\u00fctzung": "16,7 Millionen Farben (8-Bit)",
        "Gaming": "Ja",
        "Geschwungener Bildschirm": "Ja (1500R)",
        "Gewicht": "3.9 kg",
        "Helligkeit": "250 cd/m\u00b2",
        "Hintergrundbeleuchtungs-Technologie": "LED-Hintergrundbeleuchtung",
        "Horizontale Bildwiederholrate": "30 - 243 kHz",
        "Horizontaler Betrachtungswinkel": "178",
        "Kennzeichnung": "FCC Klasse B bescheinigt, BSMI, ICES-003, CB, RoHS, WEEE, cTUVus, REACH, E-Standby, CEC, KC, ERP, RCM, CE/EMC, Mexico Energy label, Mexico CoC",
        "Kontrast": "4000:1 / 80000000:1 (dynamisch)",
        "Lebensdauer der Beleuchtung": "30,000 Stunden",
        "Leistungsmerkmale": "Slot f\u00fcr Sicherheitsschloss (Kabelschloss getrennt erh\u00e4ltlich), VESA 75 x 75 mm",
        "Max. Betriebstemperatur": "40 \u00b0C",
        "Min Betriebstemperatur": "0 \u00b0C",
        "Native Aufl\u00f6sung": "QHD 2560 x 1440 (DisplayPort: 165 Hz, HDMI: 144 Hz)",
        "Neigungswinkel": "-5/+20",
        "Reaktionszeit": "1 ms (MPRT)",
        "Schlosstyp zur Diebstahlsicherung": "Kensington Slot",
        "Schnittstellen": "Audio Line-Out \u00a6 2 x HDMI \u00a6 DisplayPort",
        "Seitenverh\u00e4ltnis": "16:9",
        "Service und Support": "Begrenzte Garantie - 2 Jahre",
        "Stromverbrauch SDR (eingeschaltet)": "29 kWh/1.000 h",
        "Stromverbrauch im Standby-Modus": "0.5 Watt",
        "Transportgewicht": "5.5 kg",
        "Typ": "Lautsprecher - Stereo",
        "Vertikale Bildwiederholrate": "48 - 165 Hz",
        "Vertikaler Betrachtungswinkel": "178",
        "Zubeh\u00f6r im Lieferumfang": "Netzteil",
        "Zul\u00e4ssige Luftfeuchtigkeit im Betrieb": "20 - 90% (nicht kondensierend)"
    },
    "raw_specifications_text": "Display-Typ: LED-hintergrundbeleuchteter LCD-Monitor / TFT-Aktivmatrix\nEnergie Effizienzklasse: Klasse G\nDiagonalabmessung: 68.6 cm (27\")\nGeschwungener Bildschirm: Ja (1500R)\nBildschirmtyp: VA\nSeitenverh\u00e4ltnis: 16:9\nNative Aufl\u00f6sung: QHD 2560 x 1440 (DisplayPort: 165 Hz, HDMI: 144 Hz)\nHelligkeit: 250 cd/m\u00b2\nKontrast: 4000:1 / 80000000:1 (dynamisch)\nFarbunterst\u00fctzung: 16,7 Millionen Farben (8-Bit)\nFarbraum: 102% sRGB, 72% NTSC\nReaktionszeit: 1 ms (MPRT)\nVertikale Bildwiederholrate: 48 - 165 Hz\nHorizontale Bildwiederholrate: 30 - 243 kHz\nGaming: Ja\nHorizontaler Betrachtungswinkel: 178\nVertikaler Betrachtungswinkel: 178\nBildschirmbeschichtung: Entspiegelt, 3H Hard Coating\nHintergrundbeleuchtungs-Technologie: LED-Hintergrundbeleuchtung\nBesonderheiten: Eco-Mode, Spielmodus, flimmerfreie Technologie, TMDS-Technologie (Transition Minimized Differential Signaling), Blaulichtfilter-Technologie, Adaptive-Sync-Technologie, Movie Mode, Textmodus, Webmodus, Monomodus, ViewMode, Eye-Care Technology\nAbmessungen (Breite x Tiefe x H\u00f6he): 61.1 cm x 22.5 cm x 47.5 cm - mit Fu\u00df\nGewicht: 3.9 kg\nTyp: Lautsprecher - Stereo\nAusgangsleistung/Kanal: 2 Watt\nSchnittstellen: Audio Line-Out \u00a6 2 x HDMI \u00a6 DisplayPort\nEinstellungen der Anzeigeposition: Neigung\nNeigungswinkel: -5/+20\nLeistungsmerkmale: Slot f\u00fcr Sicherheitsschloss (Kabelschloss getrennt erh\u00e4ltlich), VESA 75 x 75 mm\nZubeh\u00f6r im Lieferumfang: Netzteil\nEnthaltene Kabel: DisplayPort 1.2-Kabel\nLebensdauer der Beleuchtung: 30,000 Stunden\nKennzeichnung: FCC Klasse B bescheinigt, BSMI, ICES-003, CB, RoHS, WEEE, cTUVus, REACH, E-Standby, CEC, KC, ERP, RCM, CE/EMC, Mexico Energy label, Mexico CoC\nSchlosstyp zur Diebstahlsicherung: Kensington Slot\nEingangsspannung: Wechselstrom 120/230 V (50/60 Hz)\nStromverbrauch SDR (eingeschaltet): 29 kWh/1.000 h\nStromverbrauch im Standby-Modus: 0.5 Watt\nErforderliches Betriebssystem: Apple MacOS, Windows 10\nDetails zu Abmessungen & Gewicht: Mit Fu\u00df - Breite: 61.1 cm - Tiefe: 22.5 cm - H\u00f6he: 47.5 cm - Gewicht: 3.9 kg \u00a6 Ohne Fu\u00df - Breite: 61.1 cm - Tiefe: 7.5 cm - H\u00f6he: 36.3 cm - Gewicht: 3.3 kg\nTransportgewicht: 5.5 kg\nService und Support: Begrenzte Garantie - 2 Jahre\nMin Betriebstemperatur: 0 \u00b0C\nMax. Betriebstemperatur: 40 \u00b0C\nZul\u00e4ssige Luftfeuchtigkeit im Betrieb: 20 - 90% (nicht kondensierend)",
    "reference_file": "offer_reference_1440.json",
    "shop_name": "TaufNaus"
}