{
    "html_file": "offer_401_7.html",
    "name": "AOC 27E3UM, 27\"",
    "offer_link": "https://www.mylemon.at/artikel/aoc/27e3um/68-6cm-27-27e3um-16.html",
    "price": 141.07,
    "raw_specifications": {
        "AC Eingangsfrequenz": "50/60 Hz",
        "AC Eingangsspannung": "100 - 240 V",
        "AMD FreeSync": "Nein",
        "Abnehmbarer Standfu\u00df": "Ja",
        "Adobe RGB-Abdeckung": "98%",
        "Anzahl DisplayPort Anschl\u00fcsse": "1",
        "Anzahl HDMI-Anschl\u00fcsse": "1",
        "Anzahl VGA (D-Sub) Anschl\u00fcsse": "1",
        "Anzahl der Farben des Displays": "16,7 Millionen Farben",
        "Anzahl der Lautsprecher": "2",
        "Anzahl der nachgeschalteten Steckpl\u00e4tze vom Typ USB-A": "2",
        "Artikelnummer": "M1EYLR2L",
        "Audioanschl\u00fcsse": "Ja",
        "Aufl\u00f6sung": "1920x1080",
        "Au\u00dfenverkleidungstyp": "Texturiert",
        "Bildschirmdiagonale": "68,6 cm (27 Zoll)",
        "Bildschirmdiagonale (cm)": "68,6 cm",
        "Bildschirmform": "Flach",
        "Bildwinkel, horizontal": "178\u00b0",
        "Bildwinkel, vertikal": "178\u00b0",
        "Blendfreier Bildschirm": "Ja",
        "Breite (ohne Standfu\u00df)": "61,5 cm",
        "DVI Anschluss": "Nein",
        "Display-Aufl\u00f6sung": "1920 x 1080 Pixel",
        "DisplayPorts-Version": "1.2",
        "Displaygr\u00f6\u00dfe": "27 Zoll",
        "EAN": "4038986180696",
        "Eingebaute Lautsprecher": "Ja",
        "Energieeffizienzklasse (SDR)": "E",
        "Flimmerfreie Technologie": "Ja",
        "Ger\u00e4tebreite (inkl. Fu\u00df)": "614,7 mm",
        "Ger\u00e4teh\u00f6he (inkl. Fu\u00df)": "449,1 mm",
        "Ger\u00e4tetiefe (inkl. Fu\u00df)": "201,3 mm",
        "Gewicht (mit St\u00e4nder)": "4,34 kg",
        "HD-Typ": "Full HD",
        "HDCP": "Ja",
        "HDCP-Version": "1.4",
        "HDMI": "Ja",
        "HDMI-Kabell\u00e4nge": "1,8 m",
        "HDMI-Version": "1.4",
        "Helligkeit (typisch)": "300 cd/m\u00b2",
        "Hersteller Artikelnummer": "27E3UM",
        "H\u00f6he (ohne Standfu\u00df)": "37 cm",
        "H\u00f6henverstellung": "Nein",
        "Integrierte Kamera": "Nein",
        "Integrierter USB-Hub": "Ja",
        "Kabelsperre-Slot": "Ja",
        "Kontrastverh\u00e4ltnis": "3000:1",
        "Kontrastverh\u00e4ltnis (dynamisch)": "20000000:1",
        "Kopfh\u00f6rer-Anschluss": "3,5 mm",
        "Kopfh\u00f6rerausgang": "Ja",
        "Lichteffekte": "Nein",
        "Low-Blue-Light-Technologie": "Ja",
        "Markenspezifische Eigenschaften": "False",
        "Marktpositionierung": "Haus",
        "Maximale Bildwiederholrate": "75 Hz",
        "Mitgelieferte Kabel": "AC",
        "Mobile High-Definition Link (MHL)": "Nein",
        "NTSC Abdeckung (typisch)": "100%",
        "NVIDIA G-SYNC": "Nein",
        "Natives Seitenverh\u00e4ltnis": "16:9",
        "Neigungsverstellung": "Ja",
        "Neigungswinkelbereich": "5 - 23\u00b0",
        "Netzteiltyp": "Intern",
        "Oberfl\u00e4chenh\u00e4rte": "3H",
        "Paketgewicht": "6,39 kg",
        "Panel": "VA",
        "Panel-Montage-Schnittstelle": "100 x 100 mm",
        "Panel-Typ": "VA",
        "Pivot": "Ja",
        "Pixel Abstand": "0,3114 x 0,3114 mm",
        "Pixeldichte": "82 ppi",
        "Produktfarbe": "Schwarz",
        "RMS-Leistung": "2 W",
        "Reaktionszeit": "4 ms",
        "Schnellladung": "Ja",
        "Slot-Typ Kabelsperre": "Kensington",
        "Stromkabell\u00e4nge": "1,8 m",
        "Stromverbrauch (Standardbetrieb)": "21 W",
        "Stromverbrauch (Standby)": "0,5 W",
        "Stromverbrauch (aus)": "0,3 W",
        "St\u00e4nder enthalten": "Ja",
        "Tiefe (ohne Standfu\u00df)": "5,28 cm",
        "Touchscreen": "Nein",
        "Typ der Hintergrundbeleuchtung": "W-LED",
        "USB-Hub-Version": "3.2 Gen 1 (3.1 Gen 1)",
        "VESA-Halterung": "Ja",
        "Verpackungsbreite": "691 mm",
        "Verpackungsh\u00f6he": "452 mm",
        "Verpackungstiefe": "142 mm",
        "Video Anschl\u00fcsse": "1x HDMI, 1x DisplayPort",
        "Vorderer Rahmen": "Schwarz",
        "sRGB Abdeckung (klassisch)": "115%"
    },
    "raw_specifications_text": "Displaygr\u00f6\u00dfe: 27 Zoll\nAufl\u00f6sung: 1920x1080\nPanel: VA\nReaktionszeit: 4 ms\nVideo Anschl\u00fcsse: 1x HDMI, 1x DisplayPort\nHersteller Artikelnummer: 27E3UM\nEAN: 4038986180696\nArtikelnummer: M1EYLR2L\nBildschirmdiagonale: 68,6 cm (27 Zoll)\nDisplay-Aufl\u00f6sung: 1920 x 1080 Pixel\nNatives Seitenverh\u00e4ltnis: 16:9\nTouchscreen: Nein\nHD-Typ: Full HD\nPanel-Typ: VA\nBildschirmform: Flach\nKontrastverh\u00e4ltnis: 3000:1\nMaximale Bildwiederholrate: 75 Hz\nAnzahl der Farben des Displays: 16,7 Millionen Farben\nTyp der Hintergrundbeleuchtung: W-LED\nHelligkeit (typisch): 300 cd/m\u00b2\nBlendfreier Bildschirm: Ja\nKontrastverh\u00e4ltnis (dynamisch): 20000000:1\nBildwinkel, horizontal: 178\u00b0\nBildwinkel, vertikal: 178\u00b0\nPixel Abstand: 0,3114 x 0,3114 mm\nPixeldichte: 82 ppi\nBildschirmdiagonale (cm): 68,6 cm\nOberfl\u00e4chenh\u00e4rte: 3H\nsRGB Abdeckung (klassisch): 115%\nNTSC Abdeckung (typisch): 100%\nAdobe RGB-Abdeckung: 98%\nNVIDIA G-SYNC: Nein\nAMD FreeSync: Nein\nSchnellladung: Ja\nFlimmerfreie Technologie: Ja\nLow-Blue-Light-Technologie: Ja\nMarkenspezifische Eigenschaften: False\nEingebaute Lautsprecher: Ja\nIntegrierte Kamera: Nein\nAnzahl der Lautsprecher: 2\nRMS-Leistung: 2 W\nMarktpositionierung: Haus\nProduktfarbe: Schwarz\nVorderer Rahmen: Schwarz\nAbnehmbarer Standfu\u00df: Ja\nIntegrierter USB-Hub: Ja\nHDMI: Ja\nKopfh\u00f6rerausgang: Ja\nUSB-Hub-Version: 3.2 Gen 1 (3.1 Gen 1)\nAnzahl der nachgeschalteten Steckpl\u00e4tze vom Typ USB-A: 2\nAnzahl VGA (D-Sub) Anschl\u00fcsse: 1\nDVI Anschluss: Nein\nAnzahl HDMI-Anschl\u00fcsse: 1\nHDMI-Version: 1.4\nAnzahl DisplayPort Anschl\u00fcsse: 1\nDisplayPorts-Version: 1.2\nAudioanschl\u00fcsse: Ja\nKopfh\u00f6rer-Anschluss: 3,5 mm\nHDCP: Ja\nHDCP-Version: 1.4\nMobile High-Definition Link (MHL): Nein\nVESA-Halterung: Ja\nKabelsperre-Slot: Ja\nH\u00f6henverstellung: Nein\nPanel-Montage-Schnittstelle: 100 x 100 mm\nSlot-Typ Kabelsperre: Kensington\nPivot: Ja\nNeigungswinkelbereich: 5 - 23\u00b0\nNeigungsverstellung: Ja\nEnergieeffizienzklasse (SDR): E\nStromverbrauch (Standardbetrieb): 21 W\nStromverbrauch (Standby): 0,5 W\nStromverbrauch (aus): 0,3 W\nAC Eingangsspannung: 100 - 240 V\nAC Eingangsfrequenz: 50/60 Hz\nNetzteiltyp: Intern\nSt\u00e4nder enthalten: Ja\nMitgelieferte Kabel: AC\nHDMI-Kabell\u00e4nge: 1,8 m\nStromkabell\u00e4nge: 1,8 m\nGer\u00e4tebreite (inkl. Fu\u00df): 614,7 mm\nGer\u00e4tetiefe (inkl. Fu\u00df): 201,3 mm\nGer\u00e4teh\u00f6he (inkl. Fu\u00df): 449,1 mm\nGewicht (mit St\u00e4nder): 4,34 kg\nBreite (ohne Standfu\u00df): 61,5 cm\nTiefe (ohne Standfu\u00df): 5,28 cm\nH\u00f6he (ohne Standfu\u00df): 37 cm\nVerpackungsbreite: 691 mm\nVerpackungstiefe: 142 mm\nVerpackungsh\u00f6he: 452 mm\nPaketgewicht: 6,39 kg\nAu\u00dfenverkleidungstyp: Texturiert\nLichteffekte: Nein",
    "reference_file": "offer_reference_401.json",
    "shop_name": "mylemon.at"
}