{
    "html_file": "offer_1014_7.html",
    "name": "ViewSonic VG2440, 23.6\"",
    "offer_link": "https://www.playox.de/productredirect/index/sku/20347097?sPartner=p-geizhals-at&campaign=psm/geizhals-at/",
    "price": 123.1,
    "raw_specifications": {
        "Anschl\u00fcsse": "USB, DisplayPort, HDMI, VGA/D-Sub",
        "Artikelnummer": "20347097",
        "Aufl\u00f6sung Kurzname": "Full HD",
        "Bezeichnung des Herstellers": "ViewSonic Ergonomic VG2440 (24\") 60,62cm LED-Monitor",
        "Breite": "549,00 mm",
        "Displaygr\u00f6\u00dfe": "60,96 cm (24 Zoll)",
        "EEK - Spektrum": "AG",
        "Einsatzort": "Innen",
        "Energieeffizienzklasse": "F",
        "Geh\u00e4usefarbe des Ger\u00e4tes": "Schwarz",
        "Gewicht": "5,80 kg",
        "Gewicht inkl. Verpackung in Kg": "7,10 kg",
        "Hersteller": "Viewsonic",
        "H\u00f6he": "329,00 mm",
        "Inhalt (ml oder g)": "0,00 ml",
        "Kapazit\u00e4t (Seiten)": "0",
        "LCD-Technologie": "VA Panel",
        "L\u00e4nge": "50,00 mm",
        "Produktart": "Monitore",
        "Seitenverh\u00e4ltnis": "16:9",
        "Shop Herstellernummer": "VG2440",
        "Standard-EAN": "0766907010329",
        "Verpackung - Breite in cm": "41,00 cm",
        "Verpackung - H\u00f6he in cm": "21,00 cm",
        "Verpackung - L\u00e4nge in cm": "61,00 cm",
        "max. Aufl\u00f6sung": "1.920 x 1.080 Pixel (16:9)"
    },
    "raw_specifications_text": "Geh\u00e4usefarbe des Ger\u00e4tes: Schwarz\nAnschl\u00fcsse: USB, DisplayPort, HDMI, VGA/D-Sub\nProduktart: Monitore\nDisplaygr\u00f6\u00dfe: 60,96 cm (24 Zoll)\nHersteller: Viewsonic\nGewicht: 5,80 kg\nInhalt (ml oder g): 0,00 ml\nKapazit\u00e4t (Seiten): 0\nAufl\u00f6sung Kurzname: Full HD\nEEK - Spektrum: AG\nVerpackung - H\u00f6he in cm: 21,00 cm\nVerpackung - L\u00e4nge in cm: 61,00 cm\nVerpackung - Breite in cm: 41,00 cm\nL\u00e4nge: 50,00 mm\nH\u00f6he: 329,00 mm\nBreite: 549,00 mm\nGewicht inkl. Verpackung in Kg: 7,10 kg\nArtikelnummer: 20347097\nStandard-EAN: 0766907010329\nShop Herstellernummer: VG2440\nBezeichnung des Herstellers: ViewSonic Ergonomic VG2440 (24\") 60,62cm LED-Monitor\nmax. Aufl\u00f6sung: 1.920 x 1.080 Pixel (16:9)\nSeitenverh\u00e4ltnis: 16:9\nLCD-Technologie: VA Panel\nEinsatzort: Innen\nEnergieeffizienzklasse: F",
    "reference_file": "offer_reference_1014.json",
    "shop_name": "playox (AT)"
}