{
    "html_file": "offer_1318_1.html",
    "name": "LC-Power LC-M27-FHD-240-C, 27\"",
    "offer_link": "https://direkt.jacob.de/produkte/lc-power-lc-m27-fhd-240-c-computerbildschirm-lc-m27-fhd-240-artnr-7175105.html?utm_source=geizhals&utm_medium=cpc&utm_campaign=Preisvergleich&ref=103",
    "price": 219.61,
    "raw_specifications": {
        "Adobe RGB-Abdeckung": "72%",
        "Anzahl DisplayPort Anschl\u00fcsse": "1",
        "Anzahl HDMI-Anschl\u00fcsse": "3",
        "Anzahl der Farben des Displays": "16,7 Millionen Farben",
        "Audioausgang": "Ja",
        "Bild-in-Bild": "Ja",
        "Bildschirmaufl\u00f6sung": "1920 x 1080 Pixel",
        "Bildschirmdiagonale": "68,6 cm (27\" )",
        "Bildschirmdiagonale (cm)": "68,58 cm",
        "Bildschirmform": "Gebogen",
        "Blendfreier Bildschirm": "Ja",
        "Blickwinkel, horizontal": "178\u00b0",
        "Blickwinkel, vertikal": "178\u00b0",
        "Breite (ohne Standfu\u00df)": "61,7 cm",
        "DC-Anschluss": "Ja",
        "DisplayPorts-Version": "1.2",
        "Eingebaute Lautsprecher": "Nein",
        "Energieeffizienzklasse (SDR)": "F",
        "Energieeffizienzskala": "A bis G",
        "Energieverbrauch (SDR) pro 1.000 Stunden": "26 kWh",
        "Ger\u00e4tebreite (inkl. Fu\u00df)": "617 mm",
        "Ger\u00e4teh\u00f6he (inkl. Fu\u00df)": "512 mm",
        "Ger\u00e4tetiefe (inkl. Fu\u00df)": "331 mm",
        "Gewicht (mit St\u00e4nder)": "5,9 kg",
        "HD-Typ": "Full HD",
        "HDMI": "Ja",
        "HDMI-Version": "1.4/2.0",
        "Helligkeit (typisch)": "300 cd/m\u00b2",
        "H\u00f6he (ohne Standfu\u00df)": "36,8 cm",
        "H\u00f6henverstellung": "Ja",
        "Integrierte Kamera": "Nein",
        "Integrierter USB-Hub": "Nein",
        "Kontrastverh\u00e4ltnis": "3000:1",
        "Kopfh\u00f6rer-Konnektivit\u00e4t": "3,5 mm",
        "Kopfh\u00f6rerausgang": "Ja",
        "Kopfh\u00f6rerausg\u00e4nge": "1",
        "LED-Anzeigen": "Status, Ja",
        "Marktpositionierung": "Gaming",
        "Maximale Bildwiederholrate": "240 Hz",
        "Mitgelieferte Kabel": "AC, DisplayPort, HDMI",
        "NTSC Abdeckung (typisch)": "72%",
        "Natives Seitenverh\u00e4ltnis": "16:9",
        "Netzteil Ausgangsspannung": "12 V",
        "On-Screen-Display (OSD)": "Ja",
        "Paketgewicht": "7,84 kg",
        "Panel-Montage-Schnittstelle": "75 x 75 mm",
        "Panel-Typ": "VA",
        "Produktfarbe": "Schwarz",
        "Reaktionszeit": "4 ms",
        "Reaktionszeit (schnell)": "1 ms",
        "Schnellstart\u00fcbersicht": "Ja",
        "Seitenverh\u00e4ltnis": "16:9",
        "Spiel-Modus": "Ja",
        "Stromadapter enthalten": "Ja",
        "St\u00e4nder enthalten": "Ja",
        "Tiefe (ohne Standfu\u00df)": "9,7 cm",
        "VESA-Halterung": "Ja",
        "Verpackungsart": "Box",
        "Verpackungsbreite": "702 mm",
        "Verpackungsh\u00f6he": "455 mm",
        "Verpackungstiefe": "175 mm",
        "Zertifizierung": "CE",
        "sRGB Abdeckung (klassisch)": "95%"
    },
    "raw_specifications_text": "Bildschirmdiagonale: 68,6 cm (27\" )\nBildschirmaufl\u00f6sung: 1920 x 1080 Pixel\nNatives Seitenverh\u00e4ltnis: 16:9\nPanel-Typ: VA\nHD-Typ: Full HD\nBildschirmform: Gebogen\nKontrastverh\u00e4ltnis: 3000:1\nMaximale Bildwiederholrate: 240 Hz\nAnzahl der Farben des Displays: 16,7 Millionen Farben\nHelligkeit (typisch): 300 cd/m\u00b2\nReaktionszeit: 4 ms\nBlendfreier Bildschirm: Ja\nSeitenverh\u00e4ltnis: 16:9\nBlickwinkel, horizontal: 178\u00b0\nBlickwinkel, vertikal: 178\u00b0\nReaktionszeit (schnell): 1 ms\nBildschirmdiagonale (cm): 68,58 cm\nsRGB Abdeckung (klassisch): 95%\nNTSC Abdeckung (typisch): 72%\nAdobe RGB-Abdeckung: 72%\nSpiel-Modus: Ja\nEingebaute Lautsprecher: Nein\nIntegrierte Kamera: Nein\nMarktpositionierung: Gaming\nProduktfarbe: Schwarz\nZertifizierung: CE\nIntegrierter USB-Hub: Nein\nHDMI: Ja\nKopfh\u00f6rerausgang: Ja\nAnzahl HDMI-Anschl\u00fcsse: 3\nHDMI-Version: 1.4/2.0\nAnzahl DisplayPort Anschl\u00fcsse: 1\nDisplayPorts-Version: 1.2\nAudioausgang: Ja\nKopfh\u00f6rerausg\u00e4nge: 1\nKopfh\u00f6rer-Konnektivit\u00e4t: 3,5 mm\nDC-Anschluss: Ja\nVESA-Halterung: Ja\nH\u00f6henverstellung: Ja\nPanel-Montage-Schnittstelle: 75 x 75 mm\nBild-in-Bild: Ja\nOn-Screen-Display (OSD): Ja\nLED-Anzeigen: Status, Ja\nEnergieeffizienzklasse (SDR): F\nEnergieverbrauch (SDR) pro 1.000 Stunden: 26 kWh\nNetzteil Ausgangsspannung: 12 V\nEnergieeffizienzskala: A bis G\nGer\u00e4tebreite (inkl. Fu\u00df): 617 mm\nGer\u00e4tetiefe (inkl. Fu\u00df): 331 mm\nGer\u00e4teh\u00f6he (inkl. Fu\u00df): 512 mm\nGewicht (mit St\u00e4nder): 5,9 kg\nBreite (ohne Standfu\u00df): 61,7 cm\nTiefe (ohne Standfu\u00df): 9,7 cm\nH\u00f6he (ohne Standfu\u00df): 36,8 cm\nSt\u00e4nder enthalten: Ja\nMitgelieferte Kabel: AC, DisplayPort, HDMI\nSchnellstart\u00fcbersicht: Ja\nStromadapter enthalten: Ja\nVerpackungsbreite: 702 mm\nVerpackungstiefe: 175 mm\nVerpackungsh\u00f6he: 455 mm\nPaketgewicht: 7,84 kg\nVerpackungsart: Box",
    "reference_file": "offer_reference_1318.json",
    "shop_name": "Jacob Elektronik direkt (AT)"
}