{
    "html_file": "offer_257_26.html",
    "name": "iiyama ProLite XUB2893UHSU-B5, 28\"",
    "offer_link": "https://www.alternate.at/iiyama/ProLite-XUB2893UHSU-B5-LED-Monitor/html/product/1900680?partner=AtGeizhalsat&campaign=Monitor/iiyama/1900680",
    "price": 334.0,
    "raw_specifications": {
        "": "Kensington-Schloss",
        "Abmessungen": "Breite: 63,65 cm x H\u00f6he: 54,65 cm x Tiefe/L\u00e4nge: 20,95 cm",
        "Anschl\u00fcsse": "1x HDMI-Eingang, 1x DisplayPort-Eingang, 1x Kopfh\u00f6rer-Ausgang, 2x USB-A-2.0, 2x USB-A-3.2 Gen 1 (5 Gbit/s)",
        "Bild": "Glaretyp",
        "Bildschirmaufl\u00f6sung": "3.840 x 2.160 Pixel",
        "Bildschirmdiagonale": "71 cm (28 Zoll)",
        "EAN": "4948570121519",
        "Energieeffizienzklasse (SDR)": "F (A - G)",
        "Energieverbauch pro 1000 Stunden (SDR)": "27 kWh",
        "Ergonomie": "Typ",
        "Farbe": "schwarz",
        "Features": "Blaulicht Reduktion, Flicker-Free, i-Style colour",
        "Frequenz": "Horizontal",
        "Geeignet f\u00fcr": "Business, Multimedia",
        "Gewicht": "6,9 kg",
        "Hersteller-Nr.": "XUB2893UHSU-B5",
        "Lautsprecher": "2 Lautsprecher",
        "Leistungsaufnahme im Bereitschafts- und Aus-Zustand": "0,3 Watt",
        "Leistungsaufnahme im Ein-Zustand bei Standard-Dynamikumfang (SDR)": "26,9 Watt",
        "Stromversorgung": "Eco-Off",
        "Typ": "LED-Monitor",
        "Wandhalterung": "VESA kompatibel (100 x 100 mm)",
        "Zubeh\u00f6r": "Vorhanden"
    },
    "raw_specifications_text": "Energieeffizienzklasse (SDR): F (A - G)\nEnergieverbauch pro 1000 Stunden (SDR): 27 kWh\nLeistungsaufnahme im Ein-Zustand bei Standard-Dynamikumfang (SDR): 26,9 Watt\nLeistungsaufnahme im Bereitschafts- und Aus-Zustand: 0,3 Watt\nBildschirmdiagonale: 71 cm (28 Zoll)\nBildschirmaufl\u00f6sung: 3.840 x 2.160 Pixel\nTyp: LED-Monitor\nFarbe: schwarz\nEAN: 4948570121519\nHersteller-Nr.: XUB2893UHSU-B5\nGeeignet f\u00fcr: Business, Multimedia\nBild: Glaretyp\n: Kensington-Schloss\nFrequenz: Horizontal\nAnschl\u00fcsse: 1x HDMI-Eingang, 1x DisplayPort-Eingang, 1x Kopfh\u00f6rer-Ausgang, 2x USB-A-2.0, 2x USB-A-3.2 Gen 1 (5 Gbit/s)\nErgonomie: Typ\nStromversorgung: Eco-Off\nLautsprecher: 2 Lautsprecher\nWandhalterung: VESA kompatibel (100 x 100 mm)\nFeatures: Blaulicht Reduktion, Flicker-Free, i-Style colour\nZubeh\u00f6r: Vorhanden\nAbmessungen: Breite: 63,65 cm x H\u00f6he: 54,65 cm x Tiefe/L\u00e4nge: 20,95 cm\nGewicht: 6,9 kg",
    "reference_file": "offer_reference_257.json",
    "shop_name": "Alternate.at"
}