{
    "html_file": "offer_1489_9.html",
    "name": "Samsung TU87F (2021), 31.5\"",
    "offer_link": "https://www.1ashop.at/de/produkt/67067/samsung-f32tu870vr-tu87f-series-led-monitor-80-cm-31-5.html",
    "price": 491.0,
    "raw_specifications": {
        "Abmessungen (Breite x Tiefe x H\u00f6he)": "71.62 cm x 22.6 cm x 61 cm - mit Fu\u00df",
        "Besonderheiten": "Spielmodus, flimmerfreie Technologie, Image Size, Eco Saving Plus, Eye Saver Mode, Off Timer Plus, Picture-in-Picture, Picture-by-Picture",
        "Bildschirmtyp": "VA",
        "Daisy-Chaining": "Ja",
        "Details zu Abmessungen & Gewicht": "Mit Fu\u00df - Breite: 71.62 cm - Tiefe: 22.6 cm - H\u00f6he: 61 cm - Gewicht: 8.1 kg  Ohne Fu\u00df - Breite: 71.62 cm - Tiefe: 5.29 cm - H\u00f6he: 42.01 cm - Gewicht: 5.5 kg",
        "Diagonalabmessung": "80 cm (31.5\")",
        "Display-Typ": "LED-hintergrundbeleuchteter LCD-Monitor / TFT-Aktivmatrix",
        "EAN/UPC": "8806090961793",
        "Eingangsspannung": "Wechselstrom 120/230 V",
        "Einstellungen der Anzeigeposition": "H\u00f6he, Pivot (Rotation), Drehung, Neigung",
        "Energie Effizienzklasse": "Klasse G",
        "Energieklasse (HDR)": "Klasse G",
        "Energierverbrauch Sleep": "0.5 Watt",
        "Enthaltene Kabel": "1 x HDMI-Kabel  1 x Kabel Thunderbolt 3",
        "Farbe": "Dunkelgrau/blau",
        "Farbraum": "85% Adobe RGB (CIE 1931), 87.2% NTSC (CIE 1976), 91.6% DCI-P3 (CIE 1976), 99.9% sRGB (CIE 1931)",
        "Farbunterst\u00fctzung": "1 Milliarde Farben",
        "Gewicht": "8.1 kg",
        "Gruppe": "TFTs",
        "HDR-Format": "HDR10",
        "Helligkeit": "250 cd/m\u00b2",
        "Hersteller": "Samsung",
        "Hersteller Art. Nr.": "LF32TU870VRXEN",
        "Hintergrundbeleuchtungs-Technologie": "LED-Hintergrundbeleuchtung",
        "Horizontaler Betrachtungswinkel": "178",
        "H\u00f6heneinstellung": "135 mm",
        "Integrierte Peripherieger\u00e4te": "USB 3.0-Hub",
        "Kontrast": "2500:1 / 100000:1 (dynamisch)",
        "Leistungsaufnahme im Ein-Zustand": "39 W",
        "Leistungsmerkmale": "Slot f\u00fcr Sicherheitsschloss (Kabelschloss getrennt erh\u00e4ltlich)",
        "Max. Betriebstemperatur": "40 \u00b0C",
        "Min Betriebstemperatur": "10 \u00b0C",
        "Native Aufl\u00f6sung": "4K 3840 x 2160 bei 60 Hz",
        "Neigungswinkel": "-7/+13",
        "Reaktionszeit": "8 ms (Gray-to-Gray)",
        "Rotationswinkel": "-2/+92",
        "Schlosstyp zur Diebstahlsicherung": "Kensington Slot",
        "Schnittstellen": "DisplayPort 1.2  HDMI  Kopfh\u00f6rer  2 x USB 3.0  Thunderbolt 3 (bis zu 92 W)  Thunderbolt 3 (bis zu 15 W)  Netzwerk",
        "Schwenkwinkel": "90",
        "Seitenverh\u00e4ltnis": "16:9",
        "Service und Support": "Begrenzte Garantie - 3 Jahre",
        "Sichtbare Bildfl\u00e4che": "80 cm (32\")",
        "Stromverbrauch (Aus-Modus)": "0.5 Watt",
        "Stromverbrauch (typisch)": "39 Watt",
        "Stromverbrauch HDR (eingeschaltet)": "59 kWh/1.000 h",
        "Stromverbrauch SDR (eingeschaltet)": "39 kWh/1.000 h",
        "Transportbreite": "81 cm",
        "Transportgewicht": "10.6 kg",
        "Transporth\u00f6he": "19.2 cm",
        "Transporttiefe": "54.4 cm",
        "VESA-Halterung": "100 x 100 mm",
        "Vertikaler Betrachtungswinkel": "178",
        "Zul\u00e4ssige Luftfeuchtigkeit im Betrieb": "10 - 80% (nicht kondensierend)"
    },
    "raw_specifications_text": "Gruppe: TFTs\nHersteller: Samsung\nHersteller Art. Nr.: LF32TU870VRXEN\nEAN/UPC: 8806090961793\nDisplay-Typ: LED-hintergrundbeleuchteter LCD-Monitor / TFT-Aktivmatrix\nEnergie Effizienzklasse: Klasse G\nEnergieklasse (HDR): Klasse G\nDiagonalabmessung: 80 cm (31.5\")\nSichtbare Bildfl\u00e4che: 80 cm (32\")\nIntegrierte Peripherieger\u00e4te: USB 3.0-Hub\nBildschirmtyp: VA\nSeitenverh\u00e4ltnis: 16:9\nDaisy-Chaining: Ja\nNative Aufl\u00f6sung: 4K 3840 x 2160 bei 60 Hz\nHelligkeit: 250 cd/m\u00b2\nKontrast: 2500:1 / 100000:1 (dynamisch)\nHDR-Format: HDR10\nFarbunterst\u00fctzung: 1 Milliarde Farben\nReaktionszeit: 8 ms (Gray-to-Gray)\nHorizontaler Betrachtungswinkel: 178\nFarbraum: 85% Adobe RGB (CIE 1931), 87.2% NTSC (CIE 1976), 91.6% DCI-P3 (CIE 1976), 99.9% sRGB (CIE 1931)\nVertikaler Betrachtungswinkel: 178\nHintergrundbeleuchtungs-Technologie: LED-Hintergrundbeleuchtung\nFarbe: Dunkelgrau/blau\nAbmessungen (Breite x Tiefe x H\u00f6he): 71.62 cm x 22.6 cm x 61 cm - mit Fu\u00df\nGewicht: 8.1 kg\nBesonderheiten: Spielmodus, flimmerfreie Technologie, Image Size, Eco Saving Plus, Eye Saver Mode, Off Timer Plus, Picture-in-Picture, Picture-by-Picture\nMin Betriebstemperatur: 10 \u00b0C\nMax. Betriebstemperatur: 40 \u00b0C\nZul\u00e4ssige Luftfeuchtigkeit im Betrieb: 10 - 80% (nicht kondensierend)\nEingangsspannung: Wechselstrom 120/230 V\nLeistungsaufnahme im Ein-Zustand: 39 W\nStromverbrauch SDR (eingeschaltet): 39 kWh/1.000 h\nStromverbrauch HDR (eingeschaltet): 59 kWh/1.000 h\nStromverbrauch (typisch): 39 Watt\nEnergierverbrauch Sleep: 0.5 Watt\nStromverbrauch (Aus-Modus): 0.5 Watt\nSchnittstellen: DisplayPort 1.2  HDMI  Kopfh\u00f6rer  2 x USB 3.0  Thunderbolt 3 (bis zu 92 W)  Thunderbolt 3 (bis zu 15 W)  Netzwerk\nEinstellungen der Anzeigeposition: H\u00f6he, Pivot (Rotation), Drehung, Neigung\nNeigungswinkel: -7/+13\nSchwenkwinkel: 90\nRotationswinkel: -2/+92\nH\u00f6heneinstellung: 135 mm\nVESA-Halterung: 100 x 100 mm\nLeistungsmerkmale: Slot f\u00fcr Sicherheitsschloss (Kabelschloss getrennt erh\u00e4ltlich)\nEnthaltene Kabel: 1 x HDMI-Kabel  1 x Kabel Thunderbolt 3\nSchlosstyp zur Diebstahlsicherung: Kensington Slot\nDetails zu Abmessungen & Gewicht: Mit Fu\u00df - Breite: 71.62 cm - Tiefe: 22.6 cm - H\u00f6he: 61 cm - Gewicht: 8.1 kg  Ohne Fu\u00df - Breite: 71.62 cm - Tiefe: 5.29 cm - H\u00f6he: 42.01 cm - Gewicht: 5.5 kg\nTransportbreite: 81 cm\nTransporttiefe: 54.4 cm\nTransporth\u00f6he: 19.2 cm\nTransportgewicht: 10.6 kg\nService und Support: Begrenzte Garantie - 3 Jahre",
    "reference_file": "offer_reference_1489.json",
    "shop_name": "1ashop.at"
}