{
    "html_file": "offer_1353_34.html",
    "name": "Lenovo L27m-30, 27\"",
    "offer_link": "https://www.amazon.de/dp/B09D3THTW2?linkCode=xm2&camp=2025&creative=165953&smid=A3JWKAKR8XB7XF&creativeASIN=B09D3THTW2&tag=geizhals1-21",
    "price": 301.51,
    "raw_specifications": {
        "ASIN": "B09D3THTW2",
        "Amazon Bestseller-Rang": "Nr. 74,018 in Computer & Zubeh\u00f6r (Siehe Top 100 in Computer & Zubeh\u00f6r)  Nr. 1,385 in Monitore",
        "Artikelgewicht": "\u200e4,63 Kilograms",
        "Batterien enthalten": "\u200eNein",
        "Bildschirmaufl\u00f6sung": "\u200e1920x1080",
        "Display-Gr\u00f6\u00dfe": "\u200e68.58",
        "Durchschnittliche Kundenbewertung": "4,2  4,2 von 5 Sternen    \n    36 Sternebewertungen   \n\n\n 4,2 von 5 Sternen",
        "Farbe": "\u200eschwarz",
        "Garantierte Software-Updates bis": "\u200eunbekannt",
        "Hersteller": "\u200eLenovo",
        "Im Angebot von Amazon.de seit": "17. August 2021",
        "L\u00f6sung": "\u200e1920 x 1080",
        "Marke": "\u200eLenovo",
        "Modell/Serie": "\u200eL27m-30 with LC50",
        "Modellnummer": "\u200e66DEKAC2EU",
        "Produktabmessungen": "\u200e21,49 x 61,25 x 56,47 cm; 4,63 Kilogramm",
        "Prozessortyp": "\u200eOthers",
        "Volt": "\u200e240 Volt (Wechselstrom)"
    },
    "raw_specifications_text": "Marke: \u200eLenovo\nHersteller: \u200eLenovo\nModell/Serie: \u200eL27m-30 with LC50\nProduktabmessungen: \u200e21,49 x 61,25 x 56,47 cm; 4,63 Kilogramm\nModellnummer: \u200e66DEKAC2EU\nFarbe: \u200eschwarz\nDisplay-Gr\u00f6\u00dfe: \u200e68.58\nBildschirmaufl\u00f6sung: \u200e1920x1080\nL\u00f6sung: \u200e1920 x 1080\nProzessortyp: \u200eOthers\nVolt: \u200e240 Volt (Wechselstrom)\nBatterien enthalten: \u200eNein\nArtikelgewicht: \u200e4,63 Kilograms\nGarantierte Software-Updates bis: \u200eunbekannt\nASIN: B09D3THTW2\nDurchschnittliche Kundenbewertung: 4,2  4,2 von 5 Sternen    \n    36 Sternebewertungen   \n\n\n 4,2 von 5 Sternen\nAmazon Bestseller-Rang: Nr. 74,018 in Computer & Zubeh\u00f6r (Siehe Top 100 in Computer & Zubeh\u00f6r)  Nr. 1,385 in Monitore\nIm Angebot von Amazon.de seit: 17. August 2021",
    "reference_file": "offer_reference_1353.json",
    "shop_name": "Amazon.at"
}