{
    "html_file": "offer_1097_1.html",
    "name": "Samsung Odyssey G3 G32A, 27\"",
    "offer_link": "https://www.csv-direct.de/artinfo.php?artnr=AGX1562109&KATEGORIE=162&pva=geizhals2",
    "price": 174.65,
    "raw_specifications": {
        "AC Eingangsspannung": "100 - 240 V",
        "AMD FreeSync-Typ": "FreeSync Premium",
        "Anzahl DisplayPort Anschl\u00fcsse": "1",
        "Anzahl HDMI-Anschl\u00fcsse": "1",
        "Anzahl der Farben des Displays": "16,7 Millionen Farben",
        "Betriebstemperatur": "10 - 40 \u00b0C",
        "Bildschirmdiagonale": "68,6 cm 27\"",
        "Bildschirmform": "Flach",
        "Bildwinkel, horizontal": "178\u00b0",
        "Bildwinkel, vertikal": "178\u00b0",
        "Breite ohne Standfu\u00df": "618,2 mm",
        "DVI Anschluss": "Nein",
        "Display-Aufl\u00f6sung": "1920 x 1080 Pixel",
        "DisplayPorts-Version": "1.2",
        "Dynamisches Kontrastverh\u00e4ltnis Marketingbezeichnung": "Mega-Kontrast",
        "Eingebaute Lautsprecher": "Nein",
        "Energieeffizienzklasse SDR": "E",
        "Energieverbrauch SDR pro 1.000 Stunden": "19 kWh",
        "Ger\u00e4tebreite inkl. Fu\u00df": "618,2 mm",
        "Ger\u00e4teh\u00f6he inkl. Fu\u00df": "520,6 mm",
        "Ger\u00e4tetiefe inkl. Fu\u00df": "234,2 mm",
        "Gewicht mit St\u00e4nder": "4,8 kg",
        "Gewicht ohne St\u00e4nder": "3,3 kg",
        "HD-Typ": "Full HD",
        "HDMI-Version": "1.4",
        "Helligkeit typisch": "250 cd/m\u00b2",
        "H\u00f6he ohne Standfu\u00df": "376,9 mm",
        "H\u00f6heneinstellung": "12 cm",
        "Integrierter USB-Hub": "Nein",
        "Kontrastverh\u00e4ltnis": "3000:1",
        "Markenspezifische Technologien": "Black Equalizer",
        "Marktpositionierung": "Gaming",
        "Maximale Bildwiederholrate": "165 Hz",
        "Mitgelieferte Kabel": "AC, DisplayPort",
        "NTSC Abdeckung typisch": "72",
        "Natives Seitenverh\u00e4ltnis": "16:9",
        "Neigungswinkelbereich": "-5 - 20\u00b0",
        "Paketgewicht": "7,2 kg",
        "Panel-Montage-Schnittstelle": "100 x 100 mm",
        "Panel-Typ": "VA",
        "Pivot Winkel": "-2 - 92\u00b0",
        "Produktfarbe": "Schwarz",
        "Reaktionszeit": "1 ms",
        "Relative Luftfeuchtigkeit in Betrieb": "10 - 80",
        "Schwenkwinkelbereich": "-15 - 15\u00b0",
        "Stromkabell\u00e4nge": "1,5 m",
        "Stromverbrauch Standardbetrieb": "19 W",
        "Stromverbrauch Standby": "0,5 W",
        "Stromverbrauch aus": "0,3 W",
        "Stromverbrauch max.": "35 W",
        "Tiefe ohne Standfu\u00df": "92,4 mm",
        "Touchscreen": "Nein",
        "Verpackungsbreite": "704 mm",
        "Verpackungsh\u00f6he": "218 mm",
        "Verpackungstiefe": "464 mm"
    },
    "raw_specifications_text": "Bildschirmdiagonale: 68,6 cm 27\"\nDisplay-Aufl\u00f6sung: 1920 x 1080 Pixel\nNatives Seitenverh\u00e4ltnis: 16:9\nTouchscreen: Nein\nHD-Typ: Full HD\nPanel-Typ: VA\nBildschirmform: Flach\nKontrastverh\u00e4ltnis: 3000:1\nMaximale Bildwiederholrate: 165 Hz\nAnzahl der Farben des Displays: 16,7 Millionen Farben\nHelligkeit typisch: 250 cd/m\u00b2\nReaktionszeit: 1 ms\nDynamisches Kontrastverh\u00e4ltnis Marketingbezeichnung: Mega-Kontrast\nBildwinkel, horizontal: 178\u00b0\nBildwinkel, vertikal: 178\u00b0\nNTSC Abdeckung typisch: 72\nAMD FreeSync-Typ: FreeSync Premium\nMarkenspezifische Technologien: Black Equalizer\nEingebaute Lautsprecher: Nein\nMarktpositionierung: Gaming\nProduktfarbe: Schwarz\nIntegrierter USB-Hub: Nein\nDVI Anschluss: Nein\nAnzahl HDMI-Anschl\u00fcsse: 1\nHDMI-Version: 1.4\nAnzahl DisplayPort Anschl\u00fcsse: 1\nDisplayPorts-Version: 1.2\nPanel-Montage-Schnittstelle: 100 x 100 mm\nH\u00f6heneinstellung: 12 cm\nPivot Winkel: -2 - 92\u00b0\nSchwenkwinkelbereich: -15 - 15\u00b0\nNeigungswinkelbereich: -5 - 20\u00b0\nEnergieeffizienzklasse SDR: E\nEnergieverbrauch SDR pro 1.000 Stunden: 19 kWh\nStromverbrauch Standardbetrieb: 19 W\nStromverbrauch Standby: 0,5 W\nStromverbrauch max.: 35 W\nStromverbrauch aus: 0,3 W\nAC Eingangsspannung: 100 - 240 V\nBetriebstemperatur: 10 - 40 \u00b0C\nRelative Luftfeuchtigkeit in Betrieb: 10 - 80\nMitgelieferte Kabel: AC, DisplayPort\nStromkabell\u00e4nge: 1,5 m\nGer\u00e4tebreite inkl. Fu\u00df: 618,2 mm\nGer\u00e4tetiefe inkl. Fu\u00df: 234,2 mm\nGer\u00e4teh\u00f6he inkl. Fu\u00df: 520,6 mm\nGewicht mit St\u00e4nder: 4,8 kg\nBreite ohne Standfu\u00df: 618,2 mm\nTiefe ohne Standfu\u00df: 92,4 mm\nH\u00f6he ohne Standfu\u00df: 376,9 mm\nGewicht ohne St\u00e4nder: 3,3 kg\nVerpackungsbreite: 704 mm\nVerpackungstiefe: 464 mm\nVerpackungsh\u00f6he: 218 mm\nPaketgewicht: 7,2 kg",
    "reference_file": "offer_reference_1097.json",
    "shop_name": "CSV-Direct.de"
}