{
    "html_file": "offer_2416_18.html",
    "name": "Dell E2216HV, 21.5\"",
    "offer_link": "https://www.electronicshop24.at/product_info.php?products_id=160000001295482885&ano=S1295482885&mno=E2216HV&ean=5397063744466&utm_medium=cpc&utm_campaign=preisvergleich&utm_content=item&utm_source=geizhals&ref=geizhals",
    "price": 91.9,
    "raw_specifications": {
        "Abmessungen (Breite x Tiefe x H\u00f6he)": "51.22 cm x 18 cm x 39.67 cm - mit Fu\u00df",
        "Besonderheiten": "72% (CIE 1931)-Farbskala, 85% (CIE 1976)-Farbskala, LED Lichtbalkensystem",
        "Bildschirmbeschichtung": "Blendfrei",
        "Bildschirmtyp": "TN",
        "Details zu Abmessungen & Gewicht": "Mit Fu\u00df - Breite: 51.22 cm - Tiefe: 18 cm - H\u00f6he: 39.67 cm - Gewicht: 3.35 kg \u00a6 Ohne Fu\u00df - Breite: 51.22 cm - Tiefe: 5.05 cm - H\u00f6he: 30.37 cm - Gewicht: 2.83 kg",
        "Diagonalabmessung": "55.9 cm (22\")",
        "Display-Typ": "LED-hintergrundbeleuchteter LCD-Monitor / TFT-Aktivmatrix",
        "ENERGY STAR zertifiziert": "Ja",
        "Einstellungen der Anzeigeposition": "Neigung",
        "Energie Effizienzklasse": "Klasse D",
        "Energierverbrauch Sleep": "0.3 Watt",
        "Enthaltene Kabel": "1 x VGA-Kabel",
        "Erforderliche Netzspannung": "Wechselstrom 120/230 V (50/60 Hz)",
        "Farbe": "Schwarz",
        "Farbunterst\u00fctzung": "16,7 Millionen Farben",
        "Gewicht": "3.35 kg",
        "Helligkeit": "200 cd/m\u00b2",
        "Hintergrundbeleuchtungs-Technologie": "LED-Hintergrundbeleuchtung",
        "Horizontaler Betrachtungswinkel": "90",
        "Kennzeichnung": "RoHS, CECP",
        "Kontrast": "600:1",
        "Leistungsaufnahme im Ein-Zustand": "12.9 W",
        "Leistungsmerkmale": "Slot f\u00fcr Sicherheitsschloss (Kabelschloss getrennt erh\u00e4ltlich), LED-Anzeige, integrierte Kabelf\u00fchrung, Unterst\u00fctzung f\u00fcr VESA-Schnittstelle, Dell Soundbar-Befestigungsschlitze, ohne Arsen, quecksilberfrei",
        "Max. Betriebstemperatur": "40 \u00b0C",
        "Min Betriebstemperatur": "0 \u00b0C",
        "Native Aufl\u00f6sung": "Full HD (1080p) 1920 x 1080 bei 60 Hz",
        "Neigungswinkel": "-5/+21",
        "Pixelpitch": "0.248 mm",
        "Reaktionszeit": "5 ms (schwarz-auf-wei\u00df)",
        "Schnittstellen": "VGA",
        "Seitenverh\u00e4ltnis": "16:9",
        "Service & Support": "Begrenzte Garantie - 3 Jahre",
        "Services im Bundle": "3 Jahre Advanced Exchange-Service",
        "Sichtbare Bildfl\u00e4che": "54.6 cm (21.5\")",
        "Stromverbrauch (typisch)": "18 Watt",
        "Stromverbrauch SDR (eingeschaltet)": "12.9 kWh/1.000 h",
        "Stromverbrauch im Standby-Modus": "0.3 Watt",
        "TCO-zertifiziert": "TCO Certified Displays 8",
        "VESA-Halterung": "100 x 100 mm",
        "Vertikaler Betrachtungswinkel": "65",
        "Zul\u00e4ssige Luftfeuchtigkeit im Betrieb": "10 - 80% (nicht kondensierend)"
    },
    "raw_specifications_text": "Display-Typ: LED-hintergrundbeleuchteter LCD-Monitor / TFT-Aktivmatrix\nEnergie Effizienzklasse: Klasse D\nDiagonalabmessung: 55.9 cm (22\")\nSichtbare Bildfl\u00e4che: 54.6 cm (21.5\")\nBildschirmtyp: TN\nSeitenverh\u00e4ltnis: 16:9\nNative Aufl\u00f6sung: Full HD (1080p) 1920 x 1080 bei 60 Hz\nPixelpitch: 0.248 mm\nHelligkeit: 200 cd/m\u00b2\nKontrast: 600:1\nFarbunterst\u00fctzung: 16,7 Millionen Farben\nReaktionszeit: 5 ms (schwarz-auf-wei\u00df)\nHorizontaler Betrachtungswinkel: 90\nVertikaler Betrachtungswinkel: 65\nBildschirmbeschichtung: Blendfrei\nHintergrundbeleuchtungs-Technologie: LED-Hintergrundbeleuchtung\nBesonderheiten: 72% (CIE 1931)-Farbskala, 85% (CIE 1976)-Farbskala, LED Lichtbalkensystem\nFarbe: Schwarz\nAbmessungen (Breite x Tiefe x H\u00f6he): 51.22 cm x 18 cm x 39.67 cm - mit Fu\u00df\nGewicht: 3.35 kg\nSchnittstellen: VGA\nEinstellungen der Anzeigeposition: Neigung\nNeigungswinkel: -5/+21\nVESA-Halterung: 100 x 100 mm\nLeistungsmerkmale: Slot f\u00fcr Sicherheitsschloss (Kabelschloss getrennt erh\u00e4ltlich), LED-Anzeige, integrierte Kabelf\u00fchrung, Unterst\u00fctzung f\u00fcr VESA-Schnittstelle, Dell Soundbar-Befestigungsschlitze, ohne Arsen, quecksilberfrei\nEnthaltene Kabel: 1 x VGA-Kabel\nKennzeichnung: RoHS, CECP\nErforderliche Netzspannung: Wechselstrom 120/230 V (50/60 Hz)\nLeistungsaufnahme im Ein-Zustand: 12.9 W\nStromverbrauch SDR (eingeschaltet): 12.9 kWh/1.000 h\nStromverbrauch (typisch): 18 Watt\nStromverbrauch im Standby-Modus: 0.3 Watt\nEnergierverbrauch Sleep: 0.3 Watt\nDetails zu Abmessungen & Gewicht: Mit Fu\u00df - Breite: 51.22 cm - Tiefe: 18 cm - H\u00f6he: 39.67 cm - Gewicht: 3.35 kg \u00a6 Ohne Fu\u00df - Breite: 51.22 cm - Tiefe: 5.05 cm - H\u00f6he: 30.37 cm - Gewicht: 2.83 kg\nTCO-zertifiziert: TCO Certified Displays 8\nENERGY STAR zertifiziert: Ja\nService & Support: Begrenzte Garantie - 3 Jahre\nServices im Bundle: 3 Jahre Advanced Exchange-Service\nMin Betriebstemperatur: 0 \u00b0C\nMax. Betriebstemperatur: 40 \u00b0C\nZul\u00e4ssige Luftfeuchtigkeit im Betrieb: 10 - 80% (nicht kondensierend)",
    "reference_file": "offer_reference_2416.json",
    "shop_name": "ElectronicShop24"
}