{
    "html_file": "offer_1695_31.html",
    "name": "iiyama G-Master G2740HSU-B1 Black Hawk, 27\"",
    "offer_link": "https://www.future-x.at/iiyama-g-master-black-hawk-led-monitor-68-6-cm-27-1920-x-1080-full-hd-1080p-75-hz-ips-250-cd-m%B2-1000%3A1-1-ms-hdmi-displayport-lautsprecher-mattschwarz-p-8740256/?pv=2",
    "price": 155.8,
    "raw_specifications": {
        "Abmessungen (Breite x Tiefe x H\u00f6he)": "61 cm x 23,9 cm x 43,3 cm",
        "Adaptive-Sync Technologie": "AMD FreeSync",
        "Ausgangsleistung/Kanal": "2 Watt",
        "Besonderheiten": "HDCP, flimmerfreie Technologie, Blue Light Reducer Function",
        "Bildschirmtyp": "IPS",
        "Diagonalabmessung": "68,6 cm (27\")",
        "Display-Typ": "LED-hintergrundbeleuchteter LCD-Monitor / TFT-Aktivmatrix",
        "Eingangsspannung": "Wechselstrom 120/230 V (50/60 Hz)",
        "Einstellungen der Anzeigeposition": "Neigung",
        "Energie Effizienzklasse": "Klasse E",
        "Energieverbrauch pro Jahr": "29 kWh",
        "Enthaltene Kabel": "1 x USB-Kabel \u00a6 1 x HDMI-Kabel",
        "Farbe": "Mattschwarz",
        "Farbunterst\u00fctzung": "16,7 Millionen Farben",
        "Gewicht": "4,5 kg",
        "Helligkeit": "250 cd/m\u00b2",
        "Hintergrundbeleuchtungs-Technologie": "LED-Hintergrundbeleuchtung",
        "Horizontale Bildwiederholrate": "31 - 85 kHz",
        "Horizontaler Betrachtungswinkel": "+89 / -89",
        "Integrierte Peripherieger\u00e4te": "USB 2.0 Hub",
        "Kennzeichnung": "TUV GS, RoHS, WEEE, PSE Mark, REACH, ERP, VCCI Class B, EAC",
        "Kontrast": "1000:1 / 80000000:1 (dynamisch)",
        "Leistungsaufnahme im Ein-Zustand": "19.5 W",
        "Leistungsmerkmale": "Slot f\u00fcr Sicherheitsschloss (Kabelschloss getrennt erh\u00e4ltlich)",
        "Native Aufl\u00f6sung": "Full HD (1080p) 1920 x 1080 bei 75 Hz",
        "Neigungswinkel": "-4/+22",
        "OSD-Sprachen": "Tschechisch, Englisch, Deutsch, Franz\u00f6sisch, Italienisch, Polnisch, Russisch, Spanisch, Holl\u00e4ndisch, Japanisch",
        "Pixelpitch": "0.311 mm",
        "Reaktionszeit": "1 ms",
        "Schlosstyp zur Diebstahlsicherung": "Kensington Slot",
        "Schnittstellen": "DisplayPort \u00a6 HDMI \u00a6 Kopfh\u00f6rer (Mini-Klinkenstecker) \u00a6 2 x USB 2.0 (Typ A) \u00a6 USB 2.0 (Typ B)",
        "Seitenverh\u00e4ltnis": "16:9",
        "Service und Support": "Begrenzte Garantie - 3 Jahre - Vor-Ort",
        "Stromverbrauch (typisch)": "19 Watt",
        "Stromverbrauch SDR (eingeschaltet)": "19.5 kWh/1.000 h",
        "Stromverbrauch im Standby-Modus": "0.5 Watt",
        "Transportbreite": "69,2 cm",
        "Transportgewicht": "6,1 kg",
        "Transporth\u00f6he": "45,2 cm",
        "Transporttiefe": "14,7 cm",
        "Typ": "Lautsprecher - Stereo",
        "VESA-Halterung": "100 x 100 mm",
        "Vertikale Bildwiederholrate": "48 - 75 Hz",
        "Vertikaler Betrachtungswinkel": "+89 / -89"
    },
    "raw_specifications_text": "Display-Typ: LED-hintergrundbeleuchteter LCD-Monitor / TFT-Aktivmatrix\nEnergie Effizienzklasse: Klasse E\nEnergieverbrauch pro Jahr: 29 kWh\nDiagonalabmessung: 68,6 cm (27\")\nAdaptive-Sync Technologie: AMD FreeSync\nIntegrierte Peripherieger\u00e4te: USB 2.0 Hub\nBildschirmtyp: IPS\nSeitenverh\u00e4ltnis: 16:9\nNative Aufl\u00f6sung: Full HD (1080p) 1920 x 1080 bei 75 Hz\nPixelpitch: 0.311 mm\nHelligkeit: 250 cd/m\u00b2\nKontrast: 1000:1 / 80000000:1 (dynamisch)\nFarbunterst\u00fctzung: 16,7 Millionen Farben\nReaktionszeit: 1 ms\nVertikale Bildwiederholrate: 48 - 75 Hz\nHorizontale Bildwiederholrate: 31 - 85 kHz\nHorizontaler Betrachtungswinkel: +89 / -89\nVertikaler Betrachtungswinkel: +89 / -89\nHintergrundbeleuchtungs-Technologie: LED-Hintergrundbeleuchtung\nOSD-Sprachen: Tschechisch, Englisch, Deutsch, Franz\u00f6sisch, Italienisch, Polnisch, Russisch, Spanisch, Holl\u00e4ndisch, Japanisch\nBesonderheiten: HDCP, flimmerfreie Technologie, Blue Light Reducer Function\nFarbe: Mattschwarz\nAbmessungen (Breite x Tiefe x H\u00f6he): 61 cm x 23,9 cm x 43,3 cm\nGewicht: 4,5 kg\nTyp: Lautsprecher - Stereo\nAusgangsleistung/Kanal: 2 Watt\nSchnittstellen: DisplayPort \u00a6 HDMI \u00a6 Kopfh\u00f6rer (Mini-Klinkenstecker) \u00a6 2 x USB 2.0 (Typ A) \u00a6 USB 2.0 (Typ B)\nEinstellungen der Anzeigeposition: Neigung\nNeigungswinkel: -4/+22\nVESA-Halterung: 100 x 100 mm\nLeistungsmerkmale: Slot f\u00fcr Sicherheitsschloss (Kabelschloss getrennt erh\u00e4ltlich)\nEnthaltene Kabel: 1 x USB-Kabel \u00a6 1 x HDMI-Kabel\nKennzeichnung: TUV GS, RoHS, WEEE, PSE Mark, REACH, ERP, VCCI Class B, EAC\nSchlosstyp zur Diebstahlsicherung: Kensington Slot\nEingangsspannung: Wechselstrom 120/230 V (50/60 Hz)\nLeistungsaufnahme im Ein-Zustand: 19.5 W\nStromverbrauch SDR (eingeschaltet): 19.5 kWh/1.000 h\nStromverbrauch (typisch): 19 Watt\nStromverbrauch im Standby-Modus: 0.5 Watt\nTransportbreite: 69,2 cm\nTransporttiefe: 14,7 cm\nTransporth\u00f6he: 45,2 cm\nTransportgewicht: 6,1 kg\nService und Support: Begrenzte Garantie - 3 Jahre - Vor-Ort",
    "reference_file": "offer_reference_1695.json",
    "shop_name": "Future-X.at"
}