{
    "html_file": "offer_1942_1.html",
    "name": "LC-Power LC-M29-UW-UXGA-100-C, 29\"",
    "offer_link": "https://www.csv-direct.de/artinfo.php?artnr=A1620479&KATEGORIE=162&pva=geizhals2",
    "price": 225.37,
    "raw_specifications": {
        "AC Eingangsfrequenz": "50 - 60 Hz",
        "AC Eingangsspannung": "100 - 240 V",
        "AMD FreeSync": "Nein",
        "Anzahl DisplayPort Anschl\u00fcsse": "1",
        "Anzahl HDMI-Anschl\u00fcsse": "2",
        "Anzahl der Farben des Displays": "16,78 Millionen Farben",
        "Audioanschl\u00fcsse": "Nein",
        "Bildschirmdiagonale": "73,7 cm 29\"",
        "Bildschirmform": "Gebogen",
        "Bildschirmtechnologie": "LED",
        "Bildwinkel, horizontal": "178\u00b0",
        "Bildwinkel, vertikal": "178\u00b0",
        "Breite ohne Standfu\u00df": "694 mm",
        "Display-Aufl\u00f6sung": "2560 x 1080 Pixel",
        "DisplayPorts-Version": "1.2",
        "Eingangsstrom": "4 A",
        "Eingebaute Lautsprecher": "Nein",
        "Energieeffizienzklasse SDR": "G",
        "Energieeffizienzskala": "A bis G",
        "Energieverbrauch SDR pro 1.000 Stunden": "36 kWh",
        "Fu\u00dffarbe": "Schwarz",
        "Ger\u00e4tebreite inkl. Fu\u00df": "694 mm",
        "Ger\u00e4teh\u00f6he inkl. Fu\u00df": "411 mm",
        "Ger\u00e4tetiefe inkl. Fu\u00df": "187 mm",
        "Gewicht ohne St\u00e4nder": "4,5 kg",
        "HD-Typ": "UW-UXGA",
        "HDMI-Version": "1.4",
        "Helligkeit typisch": "250 cd/m\u00b2",
        "H\u00f6he ohne Standfu\u00df": "319 mm",
        "H\u00f6henverstellung": "Nein",
        "Integrierte Kamera": "Nein",
        "Integrierter USB-Hub": "Nein",
        "Kontrastverh\u00e4ltnis": "3000:1",
        "Marktpositionierung": "Gaming",
        "Maximale Bildwiederholrate": "100 Hz",
        "Mitgelieferte Kabel": "AC, DisplayPort",
        "NVIDIA G-SYNC": "Nein",
        "Natives Seitenverh\u00e4ltnis": "21:9",
        "Neigungswinkelbereich": "-5 - 15\u00b0",
        "Paketgewicht": "6,8 kg",
        "Panel-Montage-Schnittstelle": "75 x 75 mm",
        "Panel-Typ": "VA",
        "RGB-Farbraum": "sRGB",
        "Reaktionszeit": "6 ms",
        "Sichtbare Gr\u00f6\u00dfe diagonal": "73,7 cm",
        "Stromverbrauch Standardbetrieb": "32 W",
        "Stromverbrauch Standby": "0,5 W",
        "Tiefe ohne Standfu\u00df": "116 mm",
        "Touchscreen": "Nein",
        "Unterst\u00fctzte Grafik-Aufl\u00f6sungen": "2560 x 1080",
        "Verpackungsbreite": "791 mm",
        "Verpackungsh\u00f6he": "387 mm",
        "Verpackungstiefe": "165 mm",
        "Warentarifnummer HS": "85285210",
        "Zertifizierung": "CE",
        "sRGB Abdeckung klassisch": "95"
    },
    "raw_specifications_text": "Bildschirmdiagonale: 73,7 cm 29\"\nDisplay-Aufl\u00f6sung: 2560 x 1080 Pixel\nNatives Seitenverh\u00e4ltnis: 21:9\nBildschirmtechnologie: LED\nTouchscreen: Nein\nHD-Typ: UW-UXGA\nPanel-Typ: VA\nBildschirmform: Gebogen\nKontrastverh\u00e4ltnis: 3000:1\nMaximale Bildwiederholrate: 100 Hz\nAnzahl der Farben des Displays: 16,78 Millionen Farben\nHelligkeit typisch: 250 cd/m\u00b2\nReaktionszeit: 6 ms\nUnterst\u00fctzte Grafik-Aufl\u00f6sungen: 2560 x 1080\nBildwinkel, horizontal: 178\u00b0\nBildwinkel, vertikal: 178\u00b0\nSichtbare Gr\u00f6\u00dfe diagonal: 73,7 cm\nRGB-Farbraum: sRGB\nsRGB Abdeckung klassisch: 95\nNVIDIA G-SYNC: Nein\nAMD FreeSync: Nein\nEingebaute Lautsprecher: Nein\nIntegrierte Kamera: Nein\nMarktpositionierung: Gaming\nFu\u00dffarbe: Schwarz\nZertifizierung: CE\nIntegrierter USB-Hub: Nein\nAnzahl HDMI-Anschl\u00fcsse: 2\nHDMI-Version: 1.4\nAnzahl DisplayPort Anschl\u00fcsse: 1\nDisplayPorts-Version: 1.2\nAudioanschl\u00fcsse: Nein\nH\u00f6henverstellung: Nein\nPanel-Montage-Schnittstelle: 75 x 75 mm\nNeigungswinkelbereich: -5 - 15\u00b0\nEnergieeffizienzklasse SDR: G\nEnergieverbrauch SDR pro 1.000 Stunden: 36 kWh\nStromverbrauch Standardbetrieb: 32 W\nStromverbrauch Standby: 0,5 W\nAC Eingangsspannung: 100 - 240 V\nAC Eingangsfrequenz: 50 - 60 Hz\nEingangsstrom: 4 A\nEnergieeffizienzskala: A bis G\nMitgelieferte Kabel: AC, DisplayPort\nGer\u00e4tebreite inkl. Fu\u00df: 694 mm\nGer\u00e4tetiefe inkl. Fu\u00df: 187 mm\nGer\u00e4teh\u00f6he inkl. Fu\u00df: 411 mm\nBreite ohne Standfu\u00df: 694 mm\nTiefe ohne Standfu\u00df: 116 mm\nH\u00f6he ohne Standfu\u00df: 319 mm\nGewicht ohne St\u00e4nder: 4,5 kg\nVerpackungsbreite: 791 mm\nVerpackungstiefe: 165 mm\nVerpackungsh\u00f6he: 387 mm\nPaketgewicht: 6,8 kg\nWarentarifnummer HS: 85285210",
    "reference_file": "offer_reference_1942.json",
    "shop_name": "CSV-Direct.de"
}