{
    "html_file": "offer_762_9.html",
    "name": "Lenovo ThinkVision P27h-30, 27\"",
    "offer_link": "https://www.proshop.at/Bildschirm/Lenovo-27-Bildschirm-ThinkVision-P27h-30-2560x1440-IPS-100W-USB-HUB-LAN-Black-4-ms/3097054?utm_source=geizhals&utm_medium=cpc&utm_campaign=pricesite",
    "price": 352.97,
    "raw_specifications": {
        "Abmessungen (Breite x Tiefe x H\u00f6he)": "61.19 cm x 20.45 cm x 53.53 cm - mit Fu\u00df",
        "Abmessungen (Breite x Tiefe x H\u00f6he) - mit Fu\u00df": "61.19 cm x 20.45 cm x 53.53 cm",
        "Besonderheiten": "Integrierte Kabelf\u00fchrung, HDR10-kompatibel, Monitorkalibrierung Delta E<2, NearEdgeless-Design an allen 4 Seiten, Smart Power Technology",
        "Bildschirmbeschichtung": "Blendfrei",
        "Bildschirmtyp": "IPS",
        "Diagonalabmessung": "68.6 cm (27\")",
        "Display-Typ": "LED-hintergrundbeleuchteter LCD-Monitor / TFT-Aktivmatrix",
        "EAN": "0196379715147",
        "ENERGY STAR zertifiziert": "Ja",
        "ENERGY STAR-Version": "8.0",
        "EPEAT-kompatibel": "EPEAT Gold",
        "Eingangsanschl\u00fcsse": "HDMI, DisplayPort, USB-C",
        "Eingangsspannung": "Wechselstrom 100-240 V (50/60 Hz)",
        "Einstellungen der Anzeigeposition": "H\u00f6he, Pivot (Rotation), Drehung, Neigung",
        "Energie Effizienzklasse": "Klasse F",
        "Energieklasse (HDR)": "Klasse G",
        "Enthaltene Kabel": "1 x Kabel USB-C 3.2 Gen 2 - 1 m  1 x USB-Kabel Typ A auf Typ B - 1.8 m",
        "Erforderliches Betriebssystem": "Windows 10, Windows 11",
        "Farbe": "Raven Black",
        "Farbraum": "95% DCI-P3, 99% BT.709, 99% sRGB",
        "Farbunterst\u00fctzung": "1,07 Mrd. Farben",
        "Ger\u00e4tetyp": "LED-hintergrundbeleuchteter LCD-Monitor - 68.6 cm (27\")",
        "Gewicht": "7 kg",
        "Helligkeit": "350 cd/m\u00b2",
        "Hersteller": "Lenovo",
        "Hintergrundbeleuchtungs-Technologie": "WLED",
        "Horizontaler Betrachtungswinkel": "178",
        "H\u00f6heneinstellung": "155 mm",
        "Integrierte Peripherieger\u00e4te": "USB 3.2 Gen 1/USB-C Hub",
        "Kennzeichnung": "CCC, TUV Rheinland Eye Comfort Certification, EU RoHS 2002/95/EC, TUV Rheinland Eyesafe Display",
        "Kontrast": "1000:1 / 3000000:1 (dynamisch)",
        "Leistungsmerkmale": "Slot f\u00fcr Sicherheitsschloss (Kabelschloss getrennt erh\u00e4ltlich)",
        "Lokalisierung": "Englisch / Europa",
        "Modell": "63A1GAT1EU",
        "Native Aufl\u00f6sung": "QHD 2560 x 1440 bei 60 Hz",
        "Neigungswinkel": "-5/23.5",
        "Pixelpitch": "0.2331 mm",
        "Ppi": "109",
        "Produktbeschreibung": "Lenovo ThinkVision P27h-30 - LED-Monitor - QHD - 68.6 cm (27\")",
        "Reaktionszeit": "14 ms (aus), 4 ms (extremer Modus), 6 ms (typisch)",
        "Rotationswinkel": "180",
        "Schlosstyp zur Diebstahlsicherung": "Kensington Slot",
        "Schnittstellen": "HDMI  DisplayPort 1.4  DisplayPort 1,4 Ausgang  USB-C 3.2 Gen 2/DisplayPort 1.4 Alt Mode  Audio Line-Out  USB-C 3,2 Gen 1 Upstream  USB 3.2 Gen 1 Upstream (Typ B)  4 x USB 3.2 Gen 1 Downstream  USB-C 3.2 Gen 1 Downstream  LAN",
        "Schwenkwinkel": "90",
        "Seitenverh\u00e4ltnis": "16:9",
        "Spannung": "Wechselstrom 100-240 V (50/60 Hz)",
        "Stromverbrauch (max.)": "180 Watt",
        "Stromverbrauch (typisch)": "22 Watt",
        "Stromverbrauch HDR (eingeschaltet)": "32 kWh/1.000 h",
        "Stromverbrauch SDR (eingeschaltet)": "26 kWh/1.000 h",
        "TCO-zertifiziert": "TCO Certified Edge Displays, TCO Certified Displays 9",
        "Transportbreite": "69 cm",
        "Transportgewicht": "10.3 kg",
        "Transporth\u00f6he": "15 cm",
        "Transporttiefe": "52.5 cm",
        "Umweltschutzstandards": "TCO Certified Edge Displays, TCO Certified Displays 9, ENERGY STAR-qualifiziert EPEAT Gold",
        "VESA-Halterung": "100 x 100 mm",
        "Vertikaler Betrachtungswinkel": "178",
        "Waren-Nr.": "3097054",
        "Zum Hersteller": "lenovo.com"
    },
    "raw_specifications_text": "Hersteller: Lenovo\nWaren-Nr.: 3097054\nModell: 63A1GAT1EU\nEAN: 0196379715147\nZum Hersteller: lenovo.com\nProduktbeschreibung: Lenovo ThinkVision P27h-30 - LED-Monitor - QHD - 68.6 cm (27\")\nGer\u00e4tetyp: LED-hintergrundbeleuchteter LCD-Monitor - 68.6 cm (27\")\nEnergie Effizienzklasse: Klasse F\nLeistungsmerkmale: Slot f\u00fcr Sicherheitsschloss (Kabelschloss getrennt erh\u00e4ltlich)\nBildschirmtyp: IPS\nSeitenverh\u00e4ltnis: 16:9\nNative Aufl\u00f6sung: QHD 2560 x 1440 bei 60 Hz\nPixelpitch: 0.2331 mm\nHelligkeit: 350 cd/m\u00b2\nKontrast: 1000:1 / 3000000:1 (dynamisch)\nReaktionszeit: 14 ms (aus), 4 ms (extremer Modus), 6 ms (typisch)\nFarbunterst\u00fctzung: 1,07 Mrd. Farben\nFarbraum: 95% DCI-P3, 99% BT.709, 99% sRGB\nEingangsanschl\u00fcsse: HDMI, DisplayPort, USB-C\nEinstellungen der Anzeigeposition: H\u00f6he, Pivot (Rotation), Drehung, Neigung\nBildschirmbeschichtung: Blendfrei\nSpannung: Wechselstrom 100-240 V (50/60 Hz)\nFarbe: Raven Black\nAbmessungen (Breite x Tiefe x H\u00f6he) - mit Fu\u00df: 61.19 cm x 20.45 cm x 53.53 cm\nGewicht: 7 kg\nLokalisierung: Englisch / Europa\nUmweltschutzstandards: TCO Certified Edge Displays, TCO Certified Displays 9, ENERGY STAR-qualifiziert EPEAT Gold\nKennzeichnung: CCC, TUV Rheinland Eye Comfort Certification, EU RoHS 2002/95/EC, TUV Rheinland Eyesafe Display\nDisplay-Typ: LED-hintergrundbeleuchteter LCD-Monitor / TFT-Aktivmatrix\nEnergieklasse (HDR): Klasse G\nDiagonalabmessung: 68.6 cm (27\")\nIntegrierte Peripherieger\u00e4te: USB 3.2 Gen 1/USB-C Hub\nPpi: 109\nHorizontaler Betrachtungswinkel: 178\nVertikaler Betrachtungswinkel: 178\nHintergrundbeleuchtungs-Technologie: WLED\nBesonderheiten: Integrierte Kabelf\u00fchrung, HDR10-kompatibel, Monitorkalibrierung Delta E<2, NearEdgeless-Design an allen 4 Seiten, Smart Power Technology\nAbmessungen (Breite x Tiefe x H\u00f6he): 61.19 cm x 20.45 cm x 53.53 cm - mit Fu\u00df\nSchnittstellen: HDMI  DisplayPort 1.4  DisplayPort 1,4 Ausgang  USB-C 3.2 Gen 2/DisplayPort 1.4 Alt Mode  Audio Line-Out  USB-C 3,2 Gen 1 Upstream  USB 3.2 Gen 1 Upstream (Typ B)  4 x USB 3.2 Gen 1 Downstream  USB-C 3.2 Gen 1 Downstream  LAN\nNeigungswinkel: -5/23.5\nSchwenkwinkel: 90\nRotationswinkel: 180\nH\u00f6heneinstellung: 155 mm\nVESA-Halterung: 100 x 100 mm\nEnthaltene Kabel: 1 x Kabel USB-C 3.2 Gen 2 - 1 m  1 x USB-Kabel Typ A auf Typ B - 1.8 m\nSchlosstyp zur Diebstahlsicherung: Kensington Slot\nEingangsspannung: Wechselstrom 100-240 V (50/60 Hz)\nStromverbrauch SDR (eingeschaltet): 26 kWh/1.000 h\nStromverbrauch HDR (eingeschaltet): 32 kWh/1.000 h\nStromverbrauch (typisch): 22 Watt\nStromverbrauch (max.): 180 Watt\nErforderliches Betriebssystem: Windows 10, Windows 11\nTransportbreite: 69 cm\nTransporttiefe: 52.5 cm\nTransporth\u00f6he: 15 cm\nTransportgewicht: 10.3 kg\nTCO-zertifiziert: TCO Certified Edge Displays, TCO Certified Displays 9\nEPEAT-kompatibel: EPEAT Gold\nENERGY STAR zertifiziert: Ja\nENERGY STAR-Version: 8.0",
    "reference_file": "offer_reference_762.json",
    "shop_name": "Proshop.at"
}