{
    "html_file": "offer_360_2.html",
    "name": "LG UltraWide 34WK95UP-W, 34\"",
    "offer_link": "https://www.mylemon.at/artikel/lg/34wk95up_w_aeu/dis-34-34wk95up-w-ultrawide.html",
    "price": 896.79,
    "raw_specifications": {
        "Anzahl DisplayPort Anschl\u00fcsse": "1",
        "Anzahl HDMI-Anschl\u00fcsse": "2",
        "Anzahl der Farben des Displays": "1,07 Milliarden Farben",
        "Anzahl der Lautsprecher": "2",
        "Anzahl der nachgeschalteten Steckpl\u00e4tze vom Typ USB-A": "2",
        "Anzahl der vorgeschalteten Steckpl\u00e4tze": "1",
        "Artikelnummer": "M1IYHZVL",
        "Aufl\u00f6sung": "5120x2160",
        "Beleuchteter St\u00e4nder": "Nein",
        "Besonderheiten": "Lautsprecher",
        "Bildschirmdiagonale": "86,4 cm (34\")",
        "Bildschirmdiagonale (cm)": "86 cm",
        "Bildschirmform": "Flach",
        "Breite (ohne Standfu\u00df)": "816,9 mm",
        "DDC/CI": "Ja",
        "Display-Aufl\u00f6sung": "5120 x 2160 Pixel",
        "Displaygr\u00f6\u00dfe": "34 Zoll",
        "EAN": "8806091970459",
        "Eingebaute Lautsprecher": "Ja",
        "Energieeffizienzklasse (HDR)": "G",
        "Energieeffizienzklasse (SDR)": "G",
        "Energieeffizienzskala": "A bis G",
        "Energieverbrauch (HDR) pro 1.000 Stunden": "71 kWh",
        "Energieverbrauch (SDR) pro 1.000 Stunden": "32 kWh",
        "Ergonomie": "H\u00f6henverstellbar",
        "Farbtiefe": "10 Bit",
        "Flimmerfreie Technologie": "Ja",
        "Fu\u00dffarbe": "Silber",
        "Ger\u00e4tebreite (inkl. Fu\u00df)": "816,9 mm",
        "Ger\u00e4teh\u00f6he (inkl. Fu\u00df)": "559 mm",
        "Ger\u00e4tetiefe (inkl. Fu\u00df)": "234,3 mm",
        "Gewicht (mit St\u00e4nder)": "9 kg",
        "Gewicht (ohne St\u00e4nder)": "7,7 kg",
        "HD-Typ": "5K Ultra HD",
        "HDMI": "Ja",
        "Helligkeit (typisch)": "450 cd/m\u00b2",
        "Hersteller Artikelnummer": "34WK95UP-W.AEU",
        "H\u00f6he (ohne Standfu\u00df)": "359,8 mm",
        "H\u00f6heneinstellung": "12 cm",
        "H\u00f6henverstellung": "Ja",
        "Integrierte Kamera": "Nein",
        "Kontrastverh\u00e4ltnis (dynamisch)": "5000000:1",
        "Kopfh\u00f6rerausgang": "Ja",
        "Markenspezifische Technologien": "DAS Mode",
        "Marktpositionierung": "Business",
        "Maximale Bildwiederholrate": "60 Hz",
        "Mitgelieferte Kabel": "DisplayPort, Leistung, USB",
        "Natives Seitenverh\u00e4ltnis": "21:9",
        "Neigungswinkelbereich": "-5 - 15\u00b0",
        "Netzteiltyp": "Intern",
        "On-Screen-Display (OSD)": "Ja",
        "Paketgewicht": "12,3 kg",
        "Panel": "IPS",
        "Panel-Montage-Schnittstelle": "100 x 100 mm",
        "Panel-Typ": "Nano IPS",
        "Produktfarbe": "Wei\u00df",
        "RMS-Leistung": "10 W",
        "Reaktionszeit": "5 ms",
        "Smart-Modi": "Kino, Benutzerdefinierung, Spiel, Foto",
        "Spiel-Modus": "Ja",
        "Stromverbrauch (Standby)": "0,5 W",
        "Stromverbrauch (aus)": "0,3 W",
        "St\u00e4nder enthalten": "Ja",
        "Tiefe (ohne Standfu\u00df)": "57,1 mm",
        "Touchscreen": "Nein",
        "VESA-Halterung": "Ja",
        "Verpackungsart": "Box",
        "Verpackungsbreite": "982 mm",
        "Verpackungsh\u00f6he": "527 mm",
        "Verpackungstiefe": "191 mm",
        "Video Anschl\u00fcsse": "2x HDMI, 1x DisplayPort",
        "Vorderer Rahmen": "Schwarz",
        "Wandmontage": "Ja"
    },
    "raw_specifications_text": "Displaygr\u00f6\u00dfe: 34 Zoll\nAufl\u00f6sung: 5120x2160\nPanel: IPS\nReaktionszeit: 5 ms\nVideo Anschl\u00fcsse: 2x HDMI, 1x DisplayPort\nErgonomie: H\u00f6henverstellbar\nBesonderheiten: Lautsprecher\nHersteller Artikelnummer: 34WK95UP-W.AEU\nEAN: 8806091970459\nArtikelnummer: M1IYHZVL\nBildschirmdiagonale: 86,4 cm (34\")\nDisplay-Aufl\u00f6sung: 5120 x 2160 Pixel\nNatives Seitenverh\u00e4ltnis: 21:9\nTouchscreen: Nein\nHD-Typ: 5K Ultra HD\nPanel-Typ: Nano IPS\nBildschirmform: Flach\nMaximale Bildwiederholrate: 60 Hz\nAnzahl der Farben des Displays: 1,07 Milliarden Farben\nHelligkeit (typisch): 450 cd/m\u00b2\nKontrastverh\u00e4ltnis (dynamisch): 5000000:1\nBildschirmdiagonale (cm): 86 cm\nDDC/CI: Ja\nFarbtiefe: 10 Bit\nMarkenspezifische Technologien: DAS Mode\nFlimmerfreie Technologie: Ja\nSpiel-Modus: Ja\nSmart-Modi: Kino, Benutzerdefinierung, Spiel, Foto\nEingebaute Lautsprecher: Ja\nIntegrierte Kamera: Nein\nAnzahl der Lautsprecher: 2\nRMS-Leistung: 10 W\nMarktpositionierung: Business\nProduktfarbe: Wei\u00df\nVorderer Rahmen: Schwarz\nBeleuchteter St\u00e4nder: Nein\nFu\u00dffarbe: Silber\nHDMI: Ja\nKopfh\u00f6rerausgang: Ja\nAnzahl der vorgeschalteten Steckpl\u00e4tze: 1\nAnzahl der nachgeschalteten Steckpl\u00e4tze vom Typ USB-A: 2\nAnzahl HDMI-Anschl\u00fcsse: 2\nAnzahl DisplayPort Anschl\u00fcsse: 1\nVESA-Halterung: Ja\nH\u00f6henverstellung: Ja\nPanel-Montage-Schnittstelle: 100 x 100 mm\nWandmontage: Ja\nH\u00f6heneinstellung: 12 cm\nNeigungswinkelbereich: -5 - 15\u00b0\nOn-Screen-Display (OSD): Ja\nEnergieeffizienzklasse (SDR): G\nEnergieeffizienzklasse (HDR): G\nEnergieverbrauch (SDR) pro 1.000 Stunden: 32 kWh\nEnergieverbrauch (HDR) pro 1.000 Stunden: 71 kWh\nStromverbrauch (Standby): 0,5 W\nStromverbrauch (aus): 0,3 W\nNetzteiltyp: Intern\nEnergieeffizienzskala: A bis G\nSt\u00e4nder enthalten: Ja\nMitgelieferte Kabel: DisplayPort, Leistung, USB\nGer\u00e4tebreite (inkl. Fu\u00df): 816,9 mm\nGer\u00e4tetiefe (inkl. Fu\u00df): 234,3 mm\nGer\u00e4teh\u00f6he (inkl. Fu\u00df): 559 mm\nGewicht (mit St\u00e4nder): 9 kg\nBreite (ohne Standfu\u00df): 816,9 mm\nTiefe (ohne Standfu\u00df): 57,1 mm\nH\u00f6he (ohne Standfu\u00df): 359,8 mm\nGewicht (ohne St\u00e4nder): 7,7 kg\nVerpackungsbreite: 982 mm\nVerpackungstiefe: 191 mm\nVerpackungsh\u00f6he: 527 mm\nPaketgewicht: 12,3 kg\nVerpackungsart: Box",
    "reference_file": "offer_reference_360.json",
    "shop_name": "mylemon.at"
}