{
    "html_file": "offer_789_1.html",
    "name": "Acer Vero BR7 BR277bmiprx, 27\"",
    "offer_link": "https://www.csv-direct.de/artinfo.php?artnr=AGX1520635&KATEGORIE=162&pva=geizhals2",
    "price": 198.99,
    "raw_specifications": {
        "Anzahl DisplayPort Anschl\u00fcsse": "1",
        "Anzahl VGA D-Sub Anschl\u00fcsse": "1",
        "Anzahl der Farben des Displays": "16,7 Millionen Farben",
        "Bildschirmdiagonale": "68,6 cm 27\"",
        "Bildschirmdiagonale cm": "68,6 cm",
        "Bildschirmform": "Flach",
        "Bildwinkel, horizontal": "178\u00b0",
        "Bildwinkel, vertikal": "178\u00b0",
        "Breite ohne Standfu\u00df": "612,3 mm",
        "Digital horizontale Frequenz": "30 - 85 kHz",
        "Digital vertikale Frequenz": "56 - 76 Hz",
        "Display-Aufl\u00f6sung": "1920 x 1080 Pixel",
        "DisplayPorts-Version": "1.2",
        "Energieeffizienzklasse SDR": "E",
        "Energieeffizienzskala": "A bis G",
        "Energieverbrauch SDR pro 1.000 Stunden": "22 kWh",
        "Ger\u00e4tebreite inkl. Fu\u00df": "612,3 mm",
        "Ger\u00e4teh\u00f6he inkl. Fu\u00df": "521,1 mm",
        "Ger\u00e4tetiefe inkl. Fu\u00df": "201 mm",
        "Gewicht mit St\u00e4nder": "4,9 kg",
        "HD-Typ": "Full HD",
        "HDMI-Version": "1.4",
        "Helligkeit typisch": "250 cd/m\u00b2",
        "H\u00f6he ohne Standfu\u00df": "366,5 mm",
        "H\u00f6heneinstellung": "12 cm",
        "Kontrastverh\u00e4ltnis dynamisch": "100000000:1",
        "Maximale Bildwiederholrate": "75 Hz",
        "Mitgelieferte Kabel": "HDMI, VGA",
        "NTSC Abdeckung typisch": "72",
        "Natives Seitenverh\u00e4ltnis": "16:9",
        "Panel-Montage-Schnittstelle": "100 x 100 mm",
        "Panel-Typ": "IPS",
        "Produktfarbe": "Schwarz",
        "Reaktionszeit": "4 ms",
        "Schwenkwinkelbereich": "-45 - 45\u00b0",
        "Seitenverh\u00e4ltnis": "16:9",
        "Tiefe ohne Standfu\u00df": "68,4 mm",
        "Touchscreen": "Nein",
        "Typ der Hintergrundbeleuchtung": "LED",
        "Warentarifnummer HS": "85285210"
    },
    "raw_specifications_text": "Bildschirmdiagonale: 68,6 cm 27\"\nDisplay-Aufl\u00f6sung: 1920 x 1080 Pixel\nNatives Seitenverh\u00e4ltnis: 16:9\nTouchscreen: Nein\nHD-Typ: Full HD\nPanel-Typ: IPS\nBildschirmform: Flach\nMaximale Bildwiederholrate: 75 Hz\nAnzahl der Farben des Displays: 16,7 Millionen Farben\nTyp der Hintergrundbeleuchtung: LED\nHelligkeit typisch: 250 cd/m\u00b2\nReaktionszeit: 4 ms\nSeitenverh\u00e4ltnis: 16:9\nKontrastverh\u00e4ltnis dynamisch: 100000000:1\nBildwinkel, horizontal: 178\u00b0\nBildwinkel, vertikal: 178\u00b0\nDigital horizontale Frequenz: 30 - 85 kHz\nDigital vertikale Frequenz: 56 - 76 Hz\nBildschirmdiagonale cm: 68,6 cm\nNTSC Abdeckung typisch: 72\nProduktfarbe: Schwarz\nAnzahl VGA D-Sub Anschl\u00fcsse: 1\nHDMI-Version: 1.4\nAnzahl DisplayPort Anschl\u00fcsse: 1\nDisplayPorts-Version: 1.2\nPanel-Montage-Schnittstelle: 100 x 100 mm\nH\u00f6heneinstellung: 12 cm\nSchwenkwinkelbereich: -45 - 45\u00b0\nEnergieeffizienzklasse SDR: E\nEnergieverbrauch SDR pro 1.000 Stunden: 22 kWh\nEnergieeffizienzskala: A bis G\nMitgelieferte Kabel: HDMI, VGA\nGer\u00e4tebreite inkl. Fu\u00df: 612,3 mm\nGer\u00e4tetiefe inkl. Fu\u00df: 201 mm\nGer\u00e4teh\u00f6he inkl. Fu\u00df: 521,1 mm\nGewicht mit St\u00e4nder: 4,9 kg\nBreite ohne Standfu\u00df: 612,3 mm\nTiefe ohne Standfu\u00df: 68,4 mm\nH\u00f6he ohne Standfu\u00df: 366,5 mm\nWarentarifnummer HS: 85285210",
    "reference_file": "offer_reference_789.json",
    "shop_name": "CSV-Direct.de"
}