{
    "html_file": "offer_1938_0.html",
    "name": "AOC C27G2ZU/BK, 27\"",
    "offer_link": "https://www.csv-direct.de/artinfo.php?artnr=A1620764&KATEGORIE=162&pva=geizhals2",
    "price": 200.87,
    "raw_specifications": {
        "AC Eingangsfrequenz": "50 - 60 Hz",
        "AC Eingangsspannung": "100 - 240 V",
        "AMD FreeSync Bildwiederholratenbereich": "48 - 240 Hz",
        "AMD FreeSync-Typ": "FreeSync Premium",
        "Adobe RGB-Abdeckung": "89",
        "Anzahl DisplayPort Anschl\u00fcsse": "1",
        "Anzahl HDMI-Anschl\u00fcsse": "2",
        "Anzahl OSD-Sprachen": "16",
        "Anzahl der Farben des Displays": "16,7 Millionen Farben",
        "Anzahl der Lautsprecher": "2",
        "Anzahl der nachgeschalteten Steckpl\u00e4tze vom Typ USB-A": "4",
        "Audioanschl\u00fcsse": "Nein",
        "Au\u00dfenverkleidungstyp": "Texturiert",
        "Bewertung der Bildschirmkr\u00fcmmung": "1500R",
        "Bildschirmdiagonale": "68,6 cm 27\"",
        "Bildschirmdiagonale cm": "68,58 cm",
        "Bildschirmform": "Gebogen",
        "Bildschirmkr\u00fcmmung": "150 cm",
        "Bildschirmtechnologie": "LED",
        "Bildwinkel, horizontal": "178\u00b0",
        "Bildwinkel, vertikal": "178\u00b0",
        "Breite ohne Standfu\u00df": "612,4 mm",
        "DVI Anschluss": "Nein",
        "Digital horizontale Frequenz": "30 - 255 kHz",
        "Display-Aufl\u00f6sung": "1920 x 1080 Pixel",
        "DisplayPort Kabell\u00e4nge": "1,8 m",
        "DisplayPorts-Version": "1.2",
        "Eingebautes Mikrofon": "Nein",
        "Energieeffizienzklasse SDR": "F",
        "Energieeffizienzskala": "A bis G",
        "Energieverbrauch SDR pro 1.000 Stunden": "26 kWh",
        "Farbtiefe": "8 Bit",
        "Ger\u00e4tebreite inkl. Fu\u00df": "612,4 mm",
        "Ger\u00e4teh\u00f6he inkl. Fu\u00df": "528,6 mm",
        "Ger\u00e4tetiefe inkl. Fu\u00df": "227,4 mm",
        "Gewicht mit St\u00e4nder": "5,5 kg",
        "Gewicht ohne St\u00e4nder": "4,1 kg",
        "HD-Typ": "Full HD",
        "HDMI-Kabell\u00e4nge": "1,8 m",
        "HDMI-Version": "2.0",
        "Helligkeit typisch": "300 cd/m\u00b2",
        "Horizontaler Scanbereich": "30 - 255 kHz",
        "H\u00f6he ohne Standfu\u00df": "367,3 mm",
        "H\u00f6heneinstellung": "13 cm",
        "Integrierte Kamera": "Nein",
        "Kontrastverh\u00e4ltnis": "3000:1",
        "Kontrastverh\u00e4ltnis dynamisch": "80000000:1",
        "Kopfh\u00f6rer-Anschluss": "3,5 mm",
        "Lichteffekte": "Nein",
        "Marktpositionierung": "Gaming",
        "Maximale Bildwiederholrate": "240 Hz",
        "Men\u00fcsprachen": "Vereinfachtes Chinesisch, Traditionelles Chinesisch, Kroatisch, Tschechisch, Deutsch, Niederl\u00e4ndisch, Englisch, Spanisch, Finnisch, Franz\u00f6sisch, Italienisch, Japanisch, Koreanisch, Polnisch, Portugiesisch, Russisch, Schwedisch, T\u00fcrkisch, Ukrainisch",
        "Mitgelieferte Kabel": "DisplayPort, HDMI",
        "NTSC Abdeckung typisch": "85",
        "NVIDIA G-SYNC": "Nein",
        "Nachhaltigkeitszertifikate": "RoHS",
        "Natives Seitenverh\u00e4ltnis": "16:9",
        "Neigungswinkelbereich": "-5 - 23\u00b0",
        "Oberfl\u00e4chenh\u00e4rte": "3H",
        "Paketgewicht": "7,8 kg",
        "Panel-Montage-Schnittstelle": "100 x 100 mm",
        "Panel-Typ": "VA",
        "Pixel Abstand": "0,3114 x 0,3114 mm",
        "Produktfarbe": "Schwarz, Rot",
        "RMS-Leistung": "2 W",
        "Reaktionszeit": "0,5 ms",
        "Recycelbares Verpackungsmaterial": "100",
        "Schwenkwinkelbereich": "-32 - 32\u00b0",
        "Schwermetallfrei": "Hg Quecksilber",
        "Seitenverh\u00e4ltnis": "16:9",
        "Sichtbare Gr\u00f6\u00dfe horizontal": "59,8 cm",
        "Sichtbare Gr\u00f6\u00dfe vertikal": "33,6 cm",
        "Slot-Typ Kabelsperre": "Kensington",
        "Stromkabell\u00e4nge": "1,8 m",
        "Stromverbrauch Standardbetrieb": "31 W",
        "Stromverbrauch Standby": "0,3 W",
        "Stromverbrauch aus": "0,3 W",
        "Tiefe ohne Standfu\u00df": "73,2 mm",
        "Touchscreen": "Nein",
        "Typ der Hintergrundbeleuchtung": "W-LED",
        "USB-Hub-Version": "3.2 Gen 1 3.1 Gen 1",
        "Unterst\u00fctzte Grafik-Aufl\u00f6sungen": "1920 x 1080 HD 1080",
        "Ursprungsland": "China",
        "Verpackungsbreite": "686 mm",
        "Verpackungsh\u00f6he": "523 mm",
        "Verpackungstiefe": "214 mm",
        "Vertikaler Scanbereich": "48 - 240 Hz",
        "Vorderer Rahmen": "Schwarz/Rot",
        "Warenklassifizierungssystem zur automatisierten Nachverfolgung CCATS": "8528594000",
        "Warentarifnummer HS": "85285210",
        "Zertifizierung": "ISO 9241-307",
        "sRGB Abdeckung klassisch": "120"
    },
    "raw_specifications_text": "Bildschirmdiagonale: 68,6 cm 27\"\nDisplay-Aufl\u00f6sung: 1920 x 1080 Pixel\nNatives Seitenverh\u00e4ltnis: 16:9\nBildschirmtechnologie: LED\nTouchscreen: Nein\nHD-Typ: Full HD\nPanel-Typ: VA\nBildschirmform: Gebogen\nKontrastverh\u00e4ltnis: 3000:1\nMaximale Bildwiederholrate: 240 Hz\nAnzahl der Farben des Displays: 16,7 Millionen Farben\nTyp der Hintergrundbeleuchtung: W-LED\nHelligkeit typisch: 300 cd/m\u00b2\nReaktionszeit: 0,5 ms\nBewertung der Bildschirmkr\u00fcmmung: 1500R\nUnterst\u00fctzte Grafik-Aufl\u00f6sungen: 1920 x 1080 HD 1080\nSeitenverh\u00e4ltnis: 16:9\nKontrastverh\u00e4ltnis dynamisch: 80000000:1\nBildwinkel, horizontal: 178\u00b0\nBildwinkel, vertikal: 178\u00b0\nPixel Abstand: 0,3114 x 0,3114 mm\nHorizontaler Scanbereich: 30 - 255 kHz\nVertikaler Scanbereich: 48 - 240 Hz\nSichtbare Gr\u00f6\u00dfe horizontal: 59,8 cm\nSichtbare Gr\u00f6\u00dfe vertikal: 33,6 cm\nDigital horizontale Frequenz: 30 - 255 kHz\nBildschirmdiagonale cm: 68,58 cm\nOberfl\u00e4chenh\u00e4rte: 3H\nFarbtiefe: 8 Bit\nsRGB Abdeckung klassisch: 120\nNTSC Abdeckung typisch: 85\nAdobe RGB-Abdeckung: 89\nBildschirmkr\u00fcmmung: 150 cm\nNVIDIA G-SYNC: Nein\nAMD FreeSync-Typ: FreeSync Premium\nAMD FreeSync Bildwiederholratenbereich: 48 - 240 Hz\nIntegrierte Kamera: Nein\nAnzahl der Lautsprecher: 2\nRMS-Leistung: 2 W\nEingebautes Mikrofon: Nein\nMarktpositionierung: Gaming\nProduktfarbe: Schwarz, Rot\nVorderer Rahmen: Schwarz/Rot\nSchwermetallfrei: Hg Quecksilber\nUrsprungsland: China\nZertifizierung: ISO 9241-307\nUSB-Hub-Version: 3.2 Gen 1 3.1 Gen 1\nAnzahl der nachgeschalteten Steckpl\u00e4tze vom Typ USB-A: 4\nDVI Anschluss: Nein\nAnzahl HDMI-Anschl\u00fcsse: 2\nHDMI-Version: 2.0\nAnzahl DisplayPort Anschl\u00fcsse: 1\nDisplayPorts-Version: 1.2\nAudioanschl\u00fcsse: Nein\nKopfh\u00f6rer-Anschluss: 3,5 mm\nPanel-Montage-Schnittstelle: 100 x 100 mm\nSlot-Typ Kabelsperre: Kensington\nH\u00f6heneinstellung: 13 cm\nSchwenkwinkelbereich: -32 - 32\u00b0\nNeigungswinkelbereich: -5 - 23\u00b0\nMen\u00fcsprachen: Vereinfachtes Chinesisch, Traditionelles Chinesisch, Kroatisch, Tschechisch, Deutsch, Niederl\u00e4ndisch, Englisch, Spanisch, Finnisch, Franz\u00f6sisch, Italienisch, Japanisch, Koreanisch, Polnisch, Portugiesisch, Russisch, Schwedisch, T\u00fcrkisch, Ukrainisch\nAnzahl OSD-Sprachen: 16\nEnergieeffizienzklasse SDR: F\nEnergieverbrauch SDR pro 1.000 Stunden: 26 kWh\nStromverbrauch Standardbetrieb: 31 W\nStromverbrauch Standby: 0,3 W\nStromverbrauch aus: 0,3 W\nAC Eingangsspannung: 100 - 240 V\nAC Eingangsfrequenz: 50 - 60 Hz\nEnergieeffizienzskala: A bis G\nMitgelieferte Kabel: DisplayPort, HDMI\nDisplayPort Kabell\u00e4nge: 1,8 m\nHDMI-Kabell\u00e4nge: 1,8 m\nStromkabell\u00e4nge: 1,8 m\nGer\u00e4tebreite inkl. Fu\u00df: 612,4 mm\nGer\u00e4tetiefe inkl. Fu\u00df: 227,4 mm\nGer\u00e4teh\u00f6he inkl. Fu\u00df: 528,6 mm\nGewicht mit St\u00e4nder: 5,5 kg\nBreite ohne Standfu\u00df: 612,4 mm\nTiefe ohne Standfu\u00df: 73,2 mm\nH\u00f6he ohne Standfu\u00df: 367,3 mm\nGewicht ohne St\u00e4nder: 4,1 kg\nVerpackungsbreite: 686 mm\nVerpackungstiefe: 214 mm\nVerpackungsh\u00f6he: 523 mm\nPaketgewicht: 7,8 kg\nNachhaltigkeitszertifikate: RoHS\nWarenklassifizierungssystem zur automatisierten Nachverfolgung CCATS: 8528594000\nWarentarifnummer HS: 85285210\nAu\u00dfenverkleidungstyp: Texturiert\nRecycelbares Verpackungsmaterial: 100\nLichteffekte: Nein",
    "reference_file": "offer_reference_1938.json",
    "shop_name": "CSV-Direct.de"
}