{
    "html_file": "offer_2025_2.html",
    "name": "Dell E2720H, 27\"",
    "offer_link": "https://direkt.jacob.de/produkte/dell-emc-tft-dell-e2720h-artnr-6162218.html?utm_source=geizhals&utm_medium=cpc&utm_campaign=Preisvergleich&ref=103",
    "price": 191.05,
    "raw_specifications": {
        "Abmessungen (Breite x Tiefe x H\u00f6he)": "62.15 cm x 17.5 cm x 45.81 cm - mit Fu\u00df",
        "Abmessungen (Breite x Tiefe x H\u00f6he) - mit Fu\u00df": "62.15 cm x 17.5 cm x 45.81 cm",
        "Besonderheiten": "72% (CIE 1931)-Farbskala, 83% (CIE 1976)-Farbskala, flimmerfreie Technologie, Dell ComfortView",
        "Bildschirmbeschichtung": "Blendfrei",
        "Bildschirmtyp": "IPS",
        "Details zu Abmessungen & Gewicht": "Ohne Fu\u00df - Gewicht: 4.5 kg  Mit Fu\u00df - Breite: 62.15 cm - Tiefe: 17.5 cm - H\u00f6he: 45.81 cm",
        "Diagonalabmessung": "68.6 cm (27\")",
        "Display-Typ": "LED-hintergrundbeleuchteter LCD-Monitor / TFT-Aktivmatrix",
        "ENERGY STAR zertifiziert": "Ja",
        "Eingangsanschl\u00fcsse": "VGA, DisplayPort",
        "Einstellungen der Anzeigeposition": "Neigbar",
        "Energie Effizienzklasse": "E",
        "Energierverbrauch Sleep": "0.3 Watt",
        "Enthaltene Kabel": "1 x DisplayPort-Kabel - DisplayPort zu DisplayPort",
        "Erforderliche Netzspannung": "Wechselstrom 120/230 V (50/60 Hz)",
        "Farbunterst\u00fctzung": "16,7 Millionen Farben",
        "Ger\u00e4tetyp": "LED-hintergrundbeleuchteter LCD-Monitor - 68.6 cm (27\")",
        "Helligkeit": "300 cd/m\u00b2",
        "Hintergrundbeleuchtungs-Technologie": "LED-Hintergrundbeleuchtung",
        "Horizontaler Betrachtungswinkel": "178",
        "Kennzeichnung": "DisplayPort 1.2, HDCP 1.2",
        "Kontrast": "1000:1",
        "Leistungsaufnahme im Betrieb": "21 Watt",
        "Leistungsmerkmale": "Slot f\u00fcr Sicherheitsschloss (Kabelschloss getrennt erh\u00e4ltlich), Unterst\u00fctzung f\u00fcr VESA-Schnittstelle",
        "Mitgelieferte Software": "Dell Display Manager",
        "Native Aufl\u00f6sung": "Full HD (1080p) 1920 x 1080 bei 60 Hz",
        "Neigungswinkel": "-5/+21",
        "Pixelpitch": "0.311 mm",
        "Ppi": "81",
        "Produktbeschreibung": "Dell E2720H - LED-Monitor - Full HD (1080p) - 68.6 cm (27\")",
        "Reaktionszeit": "8 ms (normal); 5 ms (grau-zu-grau)",
        "Schnittstellen": "DisplayPort (DisplayPort 1.2 Modus)  VGA",
        "Seitenverh\u00e4ltnis": "16:9",
        "Services im Bundle": "3 Jahre Advanced Exchange-Service",
        "Sichtbare Bildfl\u00e4che": "68.59 cm (27\")",
        "Stromverbrauch im Standby-Modus": "0.3 Watt",
        "Transportgewicht": "8.07 kg",
        "Umweltschutzstandards": "ENERGY STAR-qualifiziert",
        "VESA-Halterung": "100 x 100 mm",
        "Vertikaler Betrachtungswinkel": "178",
        "Zubeh\u00f6r im Lieferumfang": "VESA-Schraubenabdeckung"
    },
    "raw_specifications_text": "Produktbeschreibung: Dell E2720H - LED-Monitor - Full HD (1080p) - 68.6 cm (27\")\nGer\u00e4tetyp: LED-hintergrundbeleuchteter LCD-Monitor - 68.6 cm (27\")\nEnergie Effizienzklasse: E\nBildschirmtyp: IPS\nSeitenverh\u00e4ltnis: 16:9\nNative Aufl\u00f6sung: Full HD (1080p) 1920 x 1080 bei 60 Hz\nPixelpitch: 0.311 mm\nHelligkeit: 300 cd/m\u00b2\nKontrast: 1000:1\nReaktionszeit: 8 ms (normal); 5 ms (grau-zu-grau)\nFarbunterst\u00fctzung: 16,7 Millionen Farben\nEingangsanschl\u00fcsse: VGA, DisplayPort\nEinstellungen der Anzeigeposition: Neigbar\nBildschirmbeschichtung: Blendfrei\nAbmessungen (Breite x Tiefe x H\u00f6he) - mit Fu\u00df: 62.15 cm x 17.5 cm x 45.81 cm\nUmweltschutzstandards: ENERGY STAR-qualifiziert\nKennzeichnung: DisplayPort 1.2, HDCP 1.2\nServices im Bundle: 3 Jahre Advanced Exchange-Service\nDisplay-Typ: LED-hintergrundbeleuchteter LCD-Monitor / TFT-Aktivmatrix\nDiagonalabmessung: 68.6 cm (27\")\nSichtbare Bildfl\u00e4che: 68.59 cm (27\")\nPpi: 81\nHorizontaler Betrachtungswinkel: 178\nVertikaler Betrachtungswinkel: 178\nHintergrundbeleuchtungs-Technologie: LED-Hintergrundbeleuchtung\nBesonderheiten: 72% (CIE 1931)-Farbskala, 83% (CIE 1976)-Farbskala, flimmerfreie Technologie, Dell ComfortView\nAbmessungen (Breite x Tiefe x H\u00f6he): 62.15 cm x 17.5 cm x 45.81 cm - mit Fu\u00df\nSchnittstellen: DisplayPort (DisplayPort 1.2 Modus)  VGA\nNeigungswinkel: -5/+21\nVESA-Halterung: 100 x 100 mm\nLeistungsmerkmale: Slot f\u00fcr Sicherheitsschloss (Kabelschloss getrennt erh\u00e4ltlich), Unterst\u00fctzung f\u00fcr VESA-Schnittstelle\nZubeh\u00f6r im Lieferumfang: VESA-Schraubenabdeckung\nEnthaltene Kabel: 1 x DisplayPort-Kabel - DisplayPort zu DisplayPort\nErforderliche Netzspannung: Wechselstrom 120/230 V (50/60 Hz)\nLeistungsaufnahme im Betrieb: 21 Watt\nStromverbrauch im Standby-Modus: 0.3 Watt\nEnergierverbrauch Sleep: 0.3 Watt\nMitgelieferte Software: Dell Display Manager\nDetails zu Abmessungen & Gewicht: Ohne Fu\u00df - Gewicht: 4.5 kg  Mit Fu\u00df - Breite: 62.15 cm - Tiefe: 17.5 cm - H\u00f6he: 45.81 cm\nTransportgewicht: 8.07 kg\nENERGY STAR zertifiziert: Ja",
    "reference_file": "offer_reference_2025.json",
    "shop_name": "Jacob Elektronik direkt (AT)"
}