{
    "html_file": "offer_1739_35.html",
    "name": "ASUS ZenScreen MB16AH, 15.6\"",
    "offer_link": "https://www.electronicshop24.at/product_info.php?products_id=110000000858104686&ano=F858104686&mno=90LM04T0-B02170&ean=4718017705301&utm_medium=cpc&utm_campaign=preisvergleich&utm_content=item&utm_source=geizhals&ref=geizhals",
    "price": 293.0,
    "raw_specifications": {
        "Abmessungen (Breite x Tiefe x H\u00f6he)": "35.97 cm x 0.9 cm x 22.74 cm",
        "Ausgangsleistung/Kanal": "1 Watt",
        "Besonderheiten": "HDCP, ASUS Splendid Video Preset Mode, ASUS QuickFit Virtual Scale, Low Blue Light Mode, flimmerfreie Technologie, ASUS EyeCare Technology, automatische Drehung, Blaulichtfilter-Technologie, superschmales Einfassungsdesign, GamePlus",
        "Bildschirmbeschichtung": "Blendfrei",
        "Bildschirmtyp": "IPS",
        "Diagonalabmessung": "39.6 cm (15.6\")",
        "Display-Typ": "LED-hintergrundbeleuchteter LCD-Monitor / TFT-Aktivmatrix",
        "ENERGY STAR zertifiziert": "Ja",
        "Energie Effizienzklasse": "Klasse B",
        "Enthaltene Kabel": "1 x Kabel USB-C auf USB-C \u00a6 1 x USB-C auf USB-A Adapter \u00a6 Micro-HDMI-an-HDMI-Kabel",
        "Erforderliches Betriebssystem": "Apple MacOS, Linux, Microsoft Windows, Google Chrome OS",
        "Farbe": "Dunkelgrau",
        "Gewicht": "730 g",
        "Helligkeit": "250 cd/m\u00b2",
        "Hintergrundbeleuchtungs-Technologie": "LED-Hintergrundbeleuchtung",
        "Horizontaler Betrachtungswinkel": "178",
        "Kennzeichnung": "UL, VCCI, BSMI, cUL, WHQL, CB, CCC, FCC, RoHS, KCC, WEEE, J-MOSS, UkrSEPRO, RCM, TUV Rheinland Low Blue Light Certification, TUV Rheinland Flicker Free Certification",
        "Kontrast": "700:1 (dynamisch)",
        "Leistungsaufnahme im Ein-Zustand": "6 W",
        "Native Aufl\u00f6sung": "Full HD (1080p) 1920 x 1080",
        "Pixelpitch": "0.179 mm",
        "Reaktionszeit": "5 ms (Gray-to-Gray)",
        "Schnittstellen": "USB-C \u00a6 Micro HDMI \u00a6 Kopfh\u00f6rer",
        "Seitenverh\u00e4ltnis": "16:9",
        "Stromverbrauch (Aus-Modus)": "0.3 Watt",
        "Stromverbrauch (typisch)": "9 Watt",
        "Stromverbrauch SDR (eingeschaltet)": "6 kWh/1.000 h",
        "Transportbreite": "50.2 cm",
        "Transportgewicht": "2.2 kg",
        "Transporth\u00f6he": "31.2 cm",
        "Transporttiefe": "8.8 cm",
        "Typ": "Lautsprecher - Stereo",
        "Vertikaler Betrachtungswinkel": "178",
        "Zubeh\u00f6r im Lieferumfang": "H\u00fclle"
    },
    "raw_specifications_text": "Display-Typ: LED-hintergrundbeleuchteter LCD-Monitor / TFT-Aktivmatrix\nEnergie Effizienzklasse: Klasse B\nDiagonalabmessung: 39.6 cm (15.6\")\nBildschirmtyp: IPS\nSeitenverh\u00e4ltnis: 16:9\nNative Aufl\u00f6sung: Full HD (1080p) 1920 x 1080\nPixelpitch: 0.179 mm\nHelligkeit: 250 cd/m\u00b2\nKontrast: 700:1 (dynamisch)\nReaktionszeit: 5 ms (Gray-to-Gray)\nHorizontaler Betrachtungswinkel: 178\nVertikaler Betrachtungswinkel: 178\nBildschirmbeschichtung: Blendfrei\nHintergrundbeleuchtungs-Technologie: LED-Hintergrundbeleuchtung\nBesonderheiten: HDCP, ASUS Splendid Video Preset Mode, ASUS QuickFit Virtual Scale, Low Blue Light Mode, flimmerfreie Technologie, ASUS EyeCare Technology, automatische Drehung, Blaulichtfilter-Technologie, superschmales Einfassungsdesign, GamePlus\nFarbe: Dunkelgrau\nAbmessungen (Breite x Tiefe x H\u00f6he): 35.97 cm x 0.9 cm x 22.74 cm\nGewicht: 730 g\nTyp: Lautsprecher - Stereo\nAusgangsleistung/Kanal: 1 Watt\nSchnittstellen: USB-C \u00a6 Micro HDMI \u00a6 Kopfh\u00f6rer\nZubeh\u00f6r im Lieferumfang: H\u00fclle\nEnthaltene Kabel: 1 x Kabel USB-C auf USB-C \u00a6 1 x USB-C auf USB-A Adapter \u00a6 Micro-HDMI-an-HDMI-Kabel\nKennzeichnung: UL, VCCI, BSMI, cUL, WHQL, CB, CCC, FCC, RoHS, KCC, WEEE, J-MOSS, UkrSEPRO, RCM, TUV Rheinland Low Blue Light Certification, TUV Rheinland Flicker Free Certification\nLeistungsaufnahme im Ein-Zustand: 6 W\nStromverbrauch SDR (eingeschaltet): 6 kWh/1.000 h\nStromverbrauch (typisch): 9 Watt\nStromverbrauch (Aus-Modus): 0.3 Watt\nErforderliches Betriebssystem: Apple MacOS, Linux, Microsoft Windows, Google Chrome OS\nTransportbreite: 50.2 cm\nTransporttiefe: 8.8 cm\nTransporth\u00f6he: 31.2 cm\nTransportgewicht: 2.2 kg\nENERGY STAR zertifiziert: Ja",
    "reference_file": "offer_reference_1739.json",
    "shop_name": "ElectronicShop24"
}