{
    "html_file": "offer_2274_1.html",
    "name": "Dell P2419H, 23.8\"",
    "offer_link": "https://direkt.jacob.de/produkte/dell-24-monitor-p2419h-dell-p2419h-artnr-4330650.html?utm_source=geizhals&utm_medium=cpc&utm_campaign=Preisvergleich&ref=103",
    "price": 364.98,
    "raw_specifications": {
        "Abmessungen (Breite x Tiefe x H\u00f6he)": "53.78 cm x 16.6 cm x 35.61 cm - mit Fu\u00df",
        "Abmessungen (Breite x Tiefe x H\u00f6he) - mit Fu\u00df": "53.78 cm x 16.6 cm x 35.61 cm",
        "Besonderheiten": "72% (CIE 1931)-Farbskala, LED-Randlichtsystem, Dell Custom Color, flimmerfreie Technologie, BFR/PVC-frei, ohne Quecksilber, Dell ComfortView, arsenfrei",
        "Bildschirmbeschichtung": "Blendfrei, 3H Hard Coating",
        "Bildschirmtyp": "IPS",
        "Details zu Abmessungen & Gewicht": "Ohne Fu\u00df - Breite: 53.78 cm - Tiefe: 4.28 cm - H\u00f6he: 32.22 cm - Gewicht: 3.26 kg  Mit Fu\u00df - Breite: 53.78 cm - Tiefe: 16.6 cm - H\u00f6he: 35.61 cm",
        "Diagonalabmessung": "61 cm (24\")",
        "Display-Typ": "LED-hintergrundbeleuchteter LCD-Monitor / TFT-Aktivmatrix",
        "ENERGY STAR zertifiziert": "Ja",
        "Eingangsanschl\u00fcsse": "HDMI, VGA, DisplayPort",
        "Einstellungen der Anzeigeposition": "H\u00f6he, Pivot (Rotation), Drehelement, neigbar",
        "Energie Effizienzklasse": "D",
        "Energieverbrauch pro Jahr": "29 kWh",
        "Enthaltene Kabel": "1 x DisplayPort-Kabel - DisplayPort zu DisplayPort  1 x SuperSpeed-USB-Kabel",
        "Entwickelt f\u00fcr": "Dell Latitude 7400 2-in-1  Dell XPS 13 9380, 15 9570",
        "Erforderliche Netzspannung": "Wechselstrom 120/230 V (50/60 Hz)",
        "Erforderliches Betriebssystem": "Microsoft Windows 7 / 8 / 8.1 / 10",
        "Farbunterst\u00fctzung": "16,7 Millionen Farben",
        "Ger\u00e4tetyp": "LED-hintergrundbeleuchteter LCD-Monitor - 61 cm (24\")",
        "Helligkeit": "250 cd/m\u00b2",
        "Hintergrundbeleuchtungs-Technologie": "LED-Hintergrundbeleuchtung",
        "Horizontale Bildwiederholrate": "30 - 83 kHz",
        "Horizontaler Betrachtungswinkel": "178",
        "H\u00f6heneinstellung": "130 mm",
        "Integrierte Peripherieger\u00e4te": "USB 3.0-Hub",
        "Kennzeichnung": "Plug and Play, DDC/CI, RoHS, TCO Displays, EDID-kompatibel, DisplayPort 1.2",
        "Kontrast": "1000:1",
        "Leistungsaufnahme im Betrieb": "18 Watt",
        "Leistungsaufnahme im Ein-Zustand": "20 W",
        "Leistungsmerkmale": "Slot f\u00fcr Sicherheitsschloss (Kabelschloss getrennt erh\u00e4ltlich), LED-Anzeige, Unterst\u00fctzung f\u00fcr VESA-Schnittstelle",
        "Max. Betriebstemperatur": "40 \u00b0C",
        "Min Betriebstemperatur": "0 \u00b0C",
        "Mitgelieferte Software": "Dell Display Manager",
        "Native Aufl\u00f6sung": "Full HD (1080p) 1920 x 1080 bei 60 Hz",
        "Neigungswinkel": "-5/+21",
        "OSD-Sprachen": "Chinesisch (vereinfacht), Brasilianisches Portugiesisch, Englisch, Deutsch, Franz\u00f6sisch, Russisch, Spanisch, Japanisch",
        "Pixelpitch": "0.275 mm",
        "Ppi": "92",
        "Produktbeschreibung": "Dell P2419H - LED-Monitor - Full HD (1080p) - 61 cm (24\")",
        "Reaktionszeit": "8 ms (normal); 5 ms (schnell)",
        "Rotationswinkel": "180",
        "Schlosstyp zur Diebstahlsicherung": "Kensington Slot",
        "Schnittstellen": "DisplayPort  VGA  HDMI  USB 3.0 Upstream (Typ B)  2 x USB 3.0 Downstream (Typ A)  2 x USB 2.0 Downstream (Typ A)",
        "Schwenkwinkel": "90",
        "Seitenverh\u00e4ltnis": "16:9",
        "Services im Bundle": "3 Jahre Advanced Exchange-Service",
        "Sichtbare Bildfl\u00e4che": "60.5 cm (23.8\")",
        "Stromverbrauch (Aus-Modus)": "0.3 Watt",
        "Stromverbrauch im Standby-Modus": "0.3 Watt",
        "Transportgewicht": "7.1 kg",
        "Umweltschutzstandards": "ENERGY STAR-qualifiziert",
        "VESA-Halterung": "100 x 100 mm",
        "Vertikale Bildwiederholrate": "50 - 76 Hz",
        "Vertikaler Betrachtungswinkel": "178",
        "Zul\u00e4ssige Luftfeuchtigkeit im Betrieb": "20 - 80% (nicht kondensierend)"
    },
    "raw_specifications_text": "Produktbeschreibung: Dell P2419H - LED-Monitor - Full HD (1080p) - 61 cm (24\")\nGer\u00e4tetyp: LED-hintergrundbeleuchteter LCD-Monitor - 61 cm (24\")\nEnergie Effizienzklasse: D\nEnergieverbrauch pro Jahr: 29 kWh\nLeistungsaufnahme im Ein-Zustand: 20 W\nLeistungsmerkmale: Slot f\u00fcr Sicherheitsschloss (Kabelschloss getrennt erh\u00e4ltlich), LED-Anzeige, Unterst\u00fctzung f\u00fcr VESA-Schnittstelle\nBildschirmtyp: IPS\nSeitenverh\u00e4ltnis: 16:9\nNative Aufl\u00f6sung: Full HD (1080p) 1920 x 1080 bei 60 Hz\nPixelpitch: 0.275 mm\nHelligkeit: 250 cd/m\u00b2\nKontrast: 1000:1\nReaktionszeit: 8 ms (normal); 5 ms (schnell)\nFarbunterst\u00fctzung: 16,7 Millionen Farben\nEingangsanschl\u00fcsse: HDMI, VGA, DisplayPort\nEinstellungen der Anzeigeposition: H\u00f6he, Pivot (Rotation), Drehelement, neigbar\nBildschirmbeschichtung: Blendfrei, 3H Hard Coating\nAbmessungen (Breite x Tiefe x H\u00f6he) - mit Fu\u00df: 53.78 cm x 16.6 cm x 35.61 cm\nUmweltschutzstandards: ENERGY STAR-qualifiziert\nKennzeichnung: Plug and Play, DDC/CI, RoHS, TCO Displays, EDID-kompatibel, DisplayPort 1.2\nServices im Bundle: 3 Jahre Advanced Exchange-Service\nEntwickelt f\u00fcr: Dell Latitude 7400 2-in-1  Dell XPS 13 9380, 15 9570\nDisplay-Typ: LED-hintergrundbeleuchteter LCD-Monitor / TFT-Aktivmatrix\nDiagonalabmessung: 61 cm (24\")\nSichtbare Bildfl\u00e4che: 60.5 cm (23.8\")\nIntegrierte Peripherieger\u00e4te: USB 3.0-Hub\nPpi: 92\nVertikale Bildwiederholrate: 50 - 76 Hz\nHorizontale Bildwiederholrate: 30 - 83 kHz\nHorizontaler Betrachtungswinkel: 178\nVertikaler Betrachtungswinkel: 178\nHintergrundbeleuchtungs-Technologie: LED-Hintergrundbeleuchtung\nOSD-Sprachen: Chinesisch (vereinfacht), Brasilianisches Portugiesisch, Englisch, Deutsch, Franz\u00f6sisch, Russisch, Spanisch, Japanisch\nBesonderheiten: 72% (CIE 1931)-Farbskala, LED-Randlichtsystem, Dell Custom Color, flimmerfreie Technologie, BFR/PVC-frei, ohne Quecksilber, Dell ComfortView, arsenfrei\nAbmessungen (Breite x Tiefe x H\u00f6he): 53.78 cm x 16.6 cm x 35.61 cm - mit Fu\u00df\nSchnittstellen: DisplayPort  VGA  HDMI  USB 3.0 Upstream (Typ B)  2 x USB 3.0 Downstream (Typ A)  2 x USB 2.0 Downstream (Typ A)\nNeigungswinkel: -5/+21\nSchwenkwinkel: 90\nRotationswinkel: 180\nH\u00f6heneinstellung: 130 mm\nVESA-Halterung: 100 x 100 mm\nEnthaltene Kabel: 1 x DisplayPort-Kabel - DisplayPort zu DisplayPort  1 x SuperSpeed-USB-Kabel\nSchlosstyp zur Diebstahlsicherung: Kensington Slot\nErforderliche Netzspannung: Wechselstrom 120/230 V (50/60 Hz)\nLeistungsaufnahme im Betrieb: 18 Watt\nStromverbrauch im Standby-Modus: 0.3 Watt\nStromverbrauch (Aus-Modus): 0.3 Watt\nMitgelieferte Software: Dell Display Manager\nErforderliches Betriebssystem: Microsoft Windows 7 / 8 / 8.1 / 10\nDetails zu Abmessungen & Gewicht: Ohne Fu\u00df - Breite: 53.78 cm - Tiefe: 4.28 cm - H\u00f6he: 32.22 cm - Gewicht: 3.26 kg  Mit Fu\u00df - Breite: 53.78 cm - Tiefe: 16.6 cm - H\u00f6he: 35.61 cm\nTransportgewicht: 7.1 kg\nENERGY STAR zertifiziert: Ja\nMin Betriebstemperatur: 0 \u00b0C\nMax. Betriebstemperatur: 40 \u00b0C\nZul\u00e4ssige Luftfeuchtigkeit im Betrieb: 20 - 80% (nicht kondensierend)",
    "reference_file": "offer_reference_2274.json",
    "shop_name": "Jacob Elektronik direkt (AT)"
}