{
    "html_file": "offer_2474_19.html",
    "name": "Eizo ColorEdge CS2420, 24\"",
    "offer_link": "https://www.taufnaus.de/product/10610592",
    "price": 788.44,
    "raw_specifications": {
        "Abmessungen (Breite x Tiefe x H\u00f6he)": "55.44 cm x 24.5 cm x 39.6 cm - mit Fu\u00df",
        "Besonderheiten": "sRGB-Farbmanagement, Digital Uniformity Equalizer (DUE), 99% Adobe RGB-Farbskala, 16-Bit-Lookup-Tabelle, gro\u00dfe Farbskala",
        "Bildschirmbeschichtung": "Blendfrei",
        "Bildschirmtyp": "IPS",
        "Details zu Abmessungen & Gewicht": "Ohne Fu\u00df - Breite: 55.44 cm - Tiefe: 6.4 cm - H\u00f6he: 36.2 cm - Gewicht: 5 kg \u00a6 Mit Fu\u00df - Breite: 55.44 cm - Tiefe: 24.5 cm - H\u00f6he: 39.6 cm - Gewicht: 7.8 kg",
        "Diagonalabmessung": "61.1 cm (24.1\")",
        "Display-Typ": "LED-hintergrundbeleuchteter LCD-Monitor / TFT-Aktivmatrix",
        "Einstellungen der Anzeigeposition": "H\u00f6he, Pivot (Rotation), Drehung, Neigung",
        "Energie Effizienzklasse": "Klasse G",
        "Energieverbrauch pro Jahr": "41 kWh",
        "Enthaltene Kabel": "1 x USB-Kabel \u00a6 1 x DVI-Kabel - DVI-D/DVI-D \u00a6 1 x Mini DisplayPort-DisplayPort-Kabel",
        "Erforderliche Netzspannung": "AC 100/240 V (50/60 Hz)",
        "Farbe": "Schwarz",
        "Farbunterst\u00fctzung": "1,07 Mrd. Farben",
        "Gewicht": "7.8 kg",
        "Helligkeit": "350 cd/m\u00b2",
        "Hintergrundbeleuchtungs-Technologie": "LED-Hintergrundbeleuchtung",
        "Horizontale Bildwiederholrate": "15 - 78 kHz",
        "Horizontaler Betrachtungswinkel": "178",
        "H\u00f6heneinstellung": "155 mm",
        "Integrierte Peripherieger\u00e4te": "USB 3.0-Hub",
        "Kennzeichnung": "FCC Klasse B bescheinigt, TUV GS, TUV S, CB, ICES-003 Class B, TUV Ergo, RoHS, WEEE, PSE Mark, cTUVus, J-MOSS, VCCI Class B, EAC, RCM, PC Green Label Ver.13",
        "Kontrast": "1000:1",
        "Leistungsaufnahme im Ein-Zustand": "28.2 W",
        "Leistungsmerkmale": "Hoch-/Querformatmodus",
        "Max. Betriebstemperatur": "35 \u00b0C",
        "Min Betriebstemperatur": "0 \u00b0C",
        "Mitgelieferte Software": "Treiber & Dienstprogramme, EIZO ColorNavigator 6",
        "Native Aufl\u00f6sung": "1920 x 1200",
        "Neigungswinkel": "-5/+35",
        "Pixelpitch": "0.27 mm",
        "Ppi": "94",
        "Reaktionszeit": "15 ms (Gray-to-Gray)",
        "Rotationswinkel": "90",
        "Schnittstellen": "DVI-D (HDCP) \u00a6 DisplayPort (HDCP) \u00a6 USB 3.0 Upstream (Typ B) \u00a6 3 x USB 3.0 Downstream (Typ A) \u00a6 HDMI (HDCP)",
        "Schwenkwinkel": "344",
        "Seitenverh\u00e4ltnis": "16:10",
        "Service & Support": "Begrenzte Garantie - 5 Jahre",
        "Stromverbrauch (Aus-Modus)": "0.6 Watt",
        "Stromverbrauch (typisch)": "92 Watt",
        "Stromverbrauch SDR (eingeschaltet)": "28.2 kWh/1.000 h",
        "Stromverbrauch im Standby-Modus": "0.7 Watt",
        "VESA-Halterung": "100 x 100 mm",
        "Vertikale Bildwiederholrate": "24 - 61 Hz",
        "Vertikaler Betrachtungswinkel": "178",
        "Zul\u00e4ssige Luftfeuchtigkeit im Betrieb": "20 - 80% (nicht kondensierend)"
    },
    "raw_specifications_text": "Display-Typ: LED-hintergrundbeleuchteter LCD-Monitor / TFT-Aktivmatrix\nEnergie Effizienzklasse: Klasse G\nEnergieverbrauch pro Jahr: 41 kWh\nDiagonalabmessung: 61.1 cm (24.1\")\nIntegrierte Peripherieger\u00e4te: USB 3.0-Hub\nBildschirmtyp: IPS\nSeitenverh\u00e4ltnis: 16:10\nNative Aufl\u00f6sung: 1920 x 1200\nPixelpitch: 0.27 mm\nPpi: 94\nHelligkeit: 350 cd/m\u00b2\nKontrast: 1000:1\nFarbunterst\u00fctzung: 1,07 Mrd. Farben\nReaktionszeit: 15 ms (Gray-to-Gray)\nVertikale Bildwiederholrate: 24 - 61 Hz\nHorizontale Bildwiederholrate: 15 - 78 kHz\nHorizontaler Betrachtungswinkel: 178\nVertikaler Betrachtungswinkel: 178\nBildschirmbeschichtung: Blendfrei\nHintergrundbeleuchtungs-Technologie: LED-Hintergrundbeleuchtung\nBesonderheiten: sRGB-Farbmanagement, Digital Uniformity Equalizer (DUE), 99% Adobe RGB-Farbskala, 16-Bit-Lookup-Tabelle, gro\u00dfe Farbskala\nFarbe: Schwarz\nAbmessungen (Breite x Tiefe x H\u00f6he): 55.44 cm x 24.5 cm x 39.6 cm - mit Fu\u00df\nGewicht: 7.8 kg\nSchnittstellen: DVI-D (HDCP) \u00a6 DisplayPort (HDCP) \u00a6 USB 3.0 Upstream (Typ B) \u00a6 3 x USB 3.0 Downstream (Typ A) \u00a6 HDMI (HDCP)\nEinstellungen der Anzeigeposition: H\u00f6he, Pivot (Rotation), Drehung, Neigung\nNeigungswinkel: -5/+35\nSchwenkwinkel: 344\nRotationswinkel: 90\nH\u00f6heneinstellung: 155 mm\nVESA-Halterung: 100 x 100 mm\nLeistungsmerkmale: Hoch-/Querformatmodus\nEnthaltene Kabel: 1 x USB-Kabel \u00a6 1 x DVI-Kabel - DVI-D/DVI-D \u00a6 1 x Mini DisplayPort-DisplayPort-Kabel\nKennzeichnung: FCC Klasse B bescheinigt, TUV GS, TUV S, CB, ICES-003 Class B, TUV Ergo, RoHS, WEEE, PSE Mark, cTUVus, J-MOSS, VCCI Class B, EAC, RCM, PC Green Label Ver.13\nErforderliche Netzspannung: AC 100/240 V (50/60 Hz)\nLeistungsaufnahme im Ein-Zustand: 28.2 W\nStromverbrauch SDR (eingeschaltet): 28.2 kWh/1.000 h\nStromverbrauch (typisch): 92 Watt\nStromverbrauch im Standby-Modus: 0.7 Watt\nStromverbrauch (Aus-Modus): 0.6 Watt\nMitgelieferte Software: Treiber & Dienstprogramme, EIZO ColorNavigator 6\nDetails zu Abmessungen & Gewicht: Ohne Fu\u00df - Breite: 55.44 cm - Tiefe: 6.4 cm - H\u00f6he: 36.2 cm - Gewicht: 5 kg \u00a6 Mit Fu\u00df - Breite: 55.44 cm - Tiefe: 24.5 cm - H\u00f6he: 39.6 cm - Gewicht: 7.8 kg\nService & Support: Begrenzte Garantie - 5 Jahre\nMin Betriebstemperatur: 0 \u00b0C\nMax. Betriebstemperatur: 35 \u00b0C\nZul\u00e4ssige Luftfeuchtigkeit im Betrieb: 20 - 80% (nicht kondensierend)",
    "reference_file": "offer_reference_2474.json",
    "shop_name": "TaufNaus"
}