{
    "html_file": "offer_1946_5.html",
    "name": "iiyama G-Master GB3466WQSU-B1 Red Eagle, 34\"",
    "offer_link": "https://www.mylemon.at/artikel/iiyama/gb3466wqsu_b1/iiya-34-l-gb3466wqsu-b1.html",
    "price": 393.63,
    "raw_specifications": {
        "AC Eingangsfrequenz": "50/60 Hz",
        "AC Eingangsspannung": "100 - 240 V",
        "AMD FreeSync": "Ja",
        "Anzahl DisplayPort Anschl\u00fcsse": "2",
        "Anzahl HDMI-Anschl\u00fcsse": "2",
        "Anzahl OSD-Sprachen": "10",
        "Anzahl der Farben des Displays": "16,78 Millionen Farben",
        "Anzahl der Lautsprecher": "2",
        "Anzahl der nachgeschalteten Steckpl\u00e4tze vom Typ USB-A": "2",
        "Anzahl der vorgeschalteten Steckpl\u00e4tze": "1",
        "Artikelnummer": "M11YPVEL",
        "Audioanschl\u00fcsse": "Nein",
        "Aufl\u00f6sung": "3440x1440",
        "Besonderheiten": "Lautsprecher, USB HUB",
        "Betriebstemperatur": "5 - 35 \u00b0C",
        "Bild-in-Bild": "Ja",
        "Bildschirmdiagonale": "86,4 cm (34 Zoll)",
        "Bildschirmform": "Gebogen",
        "Bildschirmtechnologie": "LED",
        "Bildwinkel, horizontal": "178\u00b0",
        "Bildwinkel, vertikal": "178\u00b0",
        "Breite (ohne Standfu\u00df)": "80,8 cm",
        "DVI Anschluss": "Nein",
        "Display-Aufl\u00f6sung": "3440 x 1440 Pixel",
        "Display-Oberfl\u00e4che": "Matt",
        "Displaygr\u00f6\u00dfe": "34 Zoll",
        "EAN": "4948570117406",
        "Eingangsstrom": "1 A",
        "Eingebaute Lautsprecher": "Ja",
        "Energieeffizienzklasse (HDR)": "G",
        "Energieeffizienzklasse (SDR)": "F",
        "Energieeffizienzskala": "A bis G",
        "Energieverbrauch (HDR) pro 1.000 Stunden": "61 kWh",
        "Energieverbrauch (SDR) pro 1.000 Stunden": "32 kWh",
        "Ergonomie": "H\u00f6henverstellbar, Neigbar",
        "Flimmerfreie Technologie": "Ja",
        "Fu\u00dffarbe": "Schwarz",
        "Ger\u00e4tebreite (inkl. Fu\u00df)": "808 mm",
        "Ger\u00e4teh\u00f6he (inkl. Fu\u00df)": "441,5 mm",
        "Ger\u00e4tetiefe (inkl. Fu\u00df)": "256 mm",
        "Gewicht (mit St\u00e4nder)": "10,9 kg",
        "HD-Typ": "UltraWide Quad HD",
        "HDCP": "Ja",
        "HDMI": "Ja",
        "Helligkeit": "400 cd/m\u00b2",
        "Helligkeit (typisch)": "400 cd/m\u00b2",
        "Hersteller Artikelnummer": "GB3466WQSU-B1",
        "Horizontaler Scanbereich": "30 - 160 kHz",
        "H\u00f6he (ohne Standfu\u00df)": "36,4 cm",
        "H\u00f6heneinstellung": "11 cm",
        "H\u00f6henverstellung": "Ja",
        "Integrierte Kamera": "Nein",
        "Integrierter USB-Hub": "Ja",
        "Kabelsperre-Slot": "Ja",
        "Kontrastverh\u00e4ltnis": "3000:1",
        "Kontrastverh\u00e4ltnis (dynamisch)": "80000000:1",
        "Kopfh\u00f6rer-Anschluss": "3,5 mm",
        "Kopfh\u00f6rerausgang": "Ja",
        "Kopfh\u00f6rerausg\u00e4nge": "1",
        "LED-Anzeigen": "Ja",
        "Low-Blue-Light-Technologie": "Ja",
        "Luftfeuchtigkeit bei Lagerung": "5 - 85%",
        "Marktpositionierung": "Gaming",
        "Maximale Bildwiederholrate": "144 Hz",
        "Men\u00fcsprachen": "Tschechisch, Deutsch, Niederl\u00e4ndisch, Englisch, Spanisch, Franz\u00f6sisch, Italienisch, Japanisch, Polnisch, Russisch",
        "Mitgelieferte Kabel": "AC, DisplayPort, HDMI, USB",
        "NVIDIA G-SYNC": "Nein",
        "Nachhaltigkeitszertifikate": "RoHS",
        "Natives Seitenverh\u00e4ltnis": "21:9",
        "Neigungsverstellung": "Ja",
        "Neigungswinkelbereich": "-5 - 20\u00b0",
        "On-Screen-Display (OSD)": "Ja",
        "Panel": "VA",
        "Panel-Montage-Schnittstelle": "100 x 100 mm",
        "Panel-Typ": "VA",
        "Pixel Abstand": "0,23175 x 0,23175 mm",
        "Plug & Play": "Ja",
        "Produktfarbe": "Schwarz",
        "RMS-Leistung": "6 W",
        "Reaktionszeit": "1 ms",
        "Relative Luftfeuchtigkeit in Betrieb": "10 - 80%",
        "Sichtbare Gr\u00f6\u00dfe (diagonal)": "86,5 cm",
        "Sichtbare Gr\u00f6\u00dfe (horizontal)": "79,7 cm",
        "Sichtbare Gr\u00f6\u00dfe (vertikal)": "33,4 cm",
        "Slot-Typ Kabelsperre": "Kensington",
        "Stromeingang": "Ja",
        "Stromverbrauch (Standardbetrieb)": "60 W",
        "Stromverbrauch (Standby)": "0,5 W",
        "Stromverbrauch (aus)": "0,5 W",
        "St\u00e4nder enthalten": "Ja",
        "Temperaturbereich bei Lagerung": "-20 - 60 \u00b0C",
        "Tiefe (ohne Standfu\u00df)": "11,2 cm",
        "Touchscreen": "Nein",
        "USB-Hub-Version": "3.2 Gen 1 (3.1 Gen 1)",
        "USB-Upstream-Porttyp": "USB Typ-B",
        "Unterst\u00fctzte Grafik-Aufl\u00f6sungen": "800 x 600 (SVGA), 1024 x 768 (XGA), 1280 x 1024 (SXGA), 1440 x 900 (WXGA+), 1600 x 1200 (UXGA), 1680 x 1050 (WSXGA+), 1920 x 1080 (HD 1080), 1920 x 2160, 2560 x 1440, 3440 x 1440",
        "VESA Halterung": "100x100 mm",
        "VESA-Halterung": "Ja",
        "Verpackungsbreite": "909 mm",
        "Verpackungsh\u00f6he": "505 mm",
        "Verpackungstiefe": "282 mm",
        "Vertikaler Scanbereich": "48 - 144 Hz",
        "Video Anschl\u00fcsse": "2x HDMI, 2x DisplayPort",
        "Warentarifnummer (HS)": "85285210",
        "Zertifizierung": "CE, EAC, RoHS, WEEE"
    },
    "raw_specifications_text": "Displaygr\u00f6\u00dfe: 34 Zoll\nAufl\u00f6sung: 3440x1440\nPanel: VA\nReaktionszeit: 1 ms\nVideo Anschl\u00fcsse: 2x HDMI, 2x DisplayPort\nErgonomie: H\u00f6henverstellbar, Neigbar\nVESA Halterung: 100x100 mm\nHelligkeit: 400 cd/m\u00b2\nBesonderheiten: Lautsprecher, USB HUB\nHersteller Artikelnummer: GB3466WQSU-B1\nEAN: 4948570117406\nArtikelnummer: M11YPVEL\nBildschirmdiagonale: 86,4 cm (34 Zoll)\nDisplay-Aufl\u00f6sung: 3440 x 1440 Pixel\nNatives Seitenverh\u00e4ltnis: 21:9\nBildschirmtechnologie: LED\nTouchscreen: Nein\nHD-Typ: UltraWide Quad HD\nPanel-Typ: VA\nBildschirmform: Gebogen\nKontrastverh\u00e4ltnis: 3000:1\nMaximale Bildwiederholrate: 144 Hz\nAnzahl der Farben des Displays: 16,78 Millionen Farben\nHelligkeit (typisch): 400 cd/m\u00b2\nDisplay-Oberfl\u00e4che: Matt\nUnterst\u00fctzte Grafik-Aufl\u00f6sungen: 800 x 600 (SVGA), 1024 x 768 (XGA), 1280 x 1024 (SXGA), 1440 x 900 (WXGA+), 1600 x 1200 (UXGA), 1680 x 1050 (WSXGA+), 1920 x 1080 (HD 1080), 1920 x 2160, 2560 x 1440, 3440 x 1440\nKontrastverh\u00e4ltnis (dynamisch): 80000000:1\nBildwinkel, horizontal: 178\u00b0\nBildwinkel, vertikal: 178\u00b0\nPixel Abstand: 0,23175 x 0,23175 mm\nHorizontaler Scanbereich: 30 - 160 kHz\nVertikaler Scanbereich: 48 - 144 Hz\nSichtbare Gr\u00f6\u00dfe (horizontal): 79,7 cm\nSichtbare Gr\u00f6\u00dfe (vertikal): 33,4 cm\nSichtbare Gr\u00f6\u00dfe (diagonal): 86,5 cm\nNVIDIA G-SYNC: Nein\nAMD FreeSync: Ja\nFlimmerfreie Technologie: Ja\nLow-Blue-Light-Technologie: Ja\nEingebaute Lautsprecher: Ja\nIntegrierte Kamera: Nein\nAnzahl der Lautsprecher: 2\nRMS-Leistung: 6 W\nMarktpositionierung: Gaming\nProduktfarbe: Schwarz\nFu\u00dffarbe: Schwarz\nZertifizierung: CE, EAC, RoHS, WEEE\nIntegrierter USB-Hub: Ja\nHDMI: Ja\nKopfh\u00f6rerausgang: Ja\nUSB-Hub-Version: 3.2 Gen 1 (3.1 Gen 1)\nUSB-Upstream-Porttyp: USB Typ-B\nAnzahl der vorgeschalteten Steckpl\u00e4tze: 1\nAnzahl der nachgeschalteten Steckpl\u00e4tze vom Typ USB-A: 2\nDVI Anschluss: Nein\nAnzahl HDMI-Anschl\u00fcsse: 2\nAnzahl DisplayPort Anschl\u00fcsse: 2\nAudioanschl\u00fcsse: Nein\nKopfh\u00f6rerausg\u00e4nge: 1\nKopfh\u00f6rer-Anschluss: 3,5 mm\nHDCP: Ja\nStromeingang: Ja\nVESA-Halterung: Ja\nKabelsperre-Slot: Ja\nH\u00f6henverstellung: Ja\nPanel-Montage-Schnittstelle: 100 x 100 mm\nSlot-Typ Kabelsperre: Kensington\nH\u00f6heneinstellung: 11 cm\nNeigungswinkelbereich: -5 - 20\u00b0\nBild-in-Bild: Ja\nOn-Screen-Display (OSD): Ja\nMen\u00fcsprachen: Tschechisch, Deutsch, Niederl\u00e4ndisch, Englisch, Spanisch, Franz\u00f6sisch, Italienisch, Japanisch, Polnisch, Russisch\nAnzahl OSD-Sprachen: 10\nPlug & Play: Ja\nLED-Anzeigen: Ja\nNeigungsverstellung: Ja\nEnergieeffizienzklasse (SDR): F\nEnergieeffizienzklasse (HDR): G\nEnergieverbrauch (SDR) pro 1.000 Stunden: 32 kWh\nEnergieverbrauch (HDR) pro 1.000 Stunden: 61 kWh\nStromverbrauch (Standardbetrieb): 60 W\nStromverbrauch (Standby): 0,5 W\nStromverbrauch (aus): 0,5 W\nAC Eingangsspannung: 100 - 240 V\nAC Eingangsfrequenz: 50/60 Hz\nEingangsstrom: 1 A\nEnergieeffizienzskala: A bis G\nBetriebstemperatur: 5 - 35 \u00b0C\nTemperaturbereich bei Lagerung: -20 - 60 \u00b0C\nRelative Luftfeuchtigkeit in Betrieb: 10 - 80%\nLuftfeuchtigkeit bei Lagerung: 5 - 85%\nSt\u00e4nder enthalten: Ja\nMitgelieferte Kabel: AC, DisplayPort, HDMI, USB\nGer\u00e4tebreite (inkl. Fu\u00df): 808 mm\nGer\u00e4tetiefe (inkl. Fu\u00df): 256 mm\nGer\u00e4teh\u00f6he (inkl. Fu\u00df): 441,5 mm\nGewicht (mit St\u00e4nder): 10,9 kg\nBreite (ohne Standfu\u00df): 80,8 cm\nTiefe (ohne Standfu\u00df): 11,2 cm\nH\u00f6he (ohne Standfu\u00df): 36,4 cm\nVerpackungsbreite: 909 mm\nVerpackungstiefe: 282 mm\nVerpackungsh\u00f6he: 505 mm\nNachhaltigkeitszertifikate: RoHS\nWarentarifnummer (HS): 85285210",
    "reference_file": "offer_reference_1946.json",
    "shop_name": "mylemon.at"
}