{
    "html_file": "offer_825_2.html",
    "name": "Fujitsu P-Line P2410 TS CAM, 23.8\"",
    "offer_link": "https://www.mylemon.at/artikel/fujitsu/s26361_k1699_v165/display-p2410-ts-cam-p.html",
    "price": 371.29,
    "raw_specifications": {
        "AC Eingangsfrequenz": "50/60 Hz",
        "AC Eingangsspannung": "100 - 240 V",
        "Anzahl DisplayPort Anschl\u00fcsse": "2",
        "Anzahl HDMI-Anschl\u00fcsse": "1",
        "Anzahl der Farben des Displays": "16,7 Millionen Farben",
        "Anzahl der Lautsprecher": "2",
        "Anzahl der Upstream-Ports USB Typ-B": "1",
        "Anzahl der Upstream-Ports USB Typ-C": "1",
        "Anzahl der nachgeschalteten Ports vom Typ USB-C": "1",
        "Anzahl der nachgeschalteten Steckpl\u00e4tze vom Typ USB-A": "3",
        "Anzahl der vorgeschalteten Steckpl\u00e4tze": "2",
        "Artikelnummer": "M17Y57EL",
        "Aufl\u00f6sung": "1920x1080",
        "Besonderheiten": "Lautsprecher",
        "Betriebstemperatur": "5 - 35 \u00b0C",
        "Bildschirmdiagonale": "60,5 cm (23.8 Zoll)",
        "Bildschirmform": "Flach",
        "Bildschirmtechnologie": "LED",
        "Bildwinkel, horizontal": "178\u00b0",
        "Bildwinkel, vertikal": "178\u00b0",
        "Blendfreier Bildschirm": "Ja",
        "Breite (ohne Standfu\u00df)": "53,9 cm",
        "Digital horizontale Frequenz": "30 - 82 kHz",
        "Digital vertikale Frequenz": "48 - 76 Hz",
        "Display-Aufl\u00f6sung": "1920 x 1080 Pixel",
        "DisplayPorts-Version": "1.2",
        "Displaygr\u00f6\u00dfe": "23,8 Zoll",
        "EAN": "4065221160267",
        "Eingebaute KVM-Umschaltung": "Ja",
        "Eingebaute Lautsprecher": "Ja",
        "Eingebauter Ethernet-Anschluss": "Ja",
        "Energieeffizienzklasse (HDR)": "C",
        "Energieeffizienzklasse (SDR)": "C",
        "Energieeffizienzskala": "A bis G",
        "Farbskala": "99%",
        "Ger\u00e4tebreite (inkl. Fu\u00df)": "539,1 mm",
        "Ger\u00e4teh\u00f6he (inkl. Fu\u00df)": "500,6 mm",
        "Ger\u00e4tetiefe (inkl. Fu\u00df)": "212,7 mm",
        "Gewicht (mit St\u00e4nder)": "6 kg",
        "Gewicht (ohne St\u00e4nder)": "4,1 kg",
        "HD-Typ": "Full HD",
        "HDMI": "Ja",
        "HDMI-Version": "1.4",
        "Helligkeit": "250 cd/m\u00b2",
        "Helligkeit (typisch)": "250 cd/m\u00b2",
        "Hersteller Artikelnummer": "S26361-K1699-V165",
        "H\u00f6he (ohne Standfu\u00df)": "33,9 cm",
        "H\u00f6heneinstellung": "15 cm",
        "H\u00f6henverstellung": "Ja",
        "Integrierte Kamera": "Nein",
        "Integrierter USB-Hub": "Ja",
        "Kabelsperre-Slot": "Ja",
        "Kontrastverh\u00e4ltnis": "1000:1",
        "Kopfh\u00f6rer-Anschluss": "3,5 mm",
        "Kopfh\u00f6rerausgang": "Ja",
        "Natives Seitenverh\u00e4ltnis": "16:9",
        "Neigungsverstellung": "Ja",
        "Neigungswinkelbereich": "-5 - 35\u00b0",
        "On-Screen-Display (OSD)": "Ja",
        "Panel": "IPS",
        "Panel-Typ": "IPS",
        "Pixel Abstand": "0,2745 x 0,2745 mm",
        "Produktfarbe": "Schwarz",
        "RGB-Farbraum": "sRGB",
        "RMS-Leistung": "2 W",
        "Reaktionszeit": "5 ms",
        "Relative Luftfeuchtigkeit in Betrieb": "10 - 85%",
        "Schwenkbar": "Ja",
        "Schwenkwinkelbereich": "0 - 345\u00b0",
        "Sichtbare Gr\u00f6\u00dfe (horizontal)": "52,7 cm",
        "Sichtbare Gr\u00f6\u00dfe (vertikal)": "29,6 cm",
        "Slot-Typ Kabelsperre": "Kensington",
        "Stromverbrauch (PowerSave)": "0,51 W",
        "Stromverbrauch (aus)": "0,26 W",
        "Stromverbrauch (max.)": "26 W",
        "Tiefe (ohne Standfu\u00df)": "5,92 cm",
        "Touchscreen": "Nein",
        "Unterst\u00fctzte Grafik-Aufl\u00f6sungen": "640 x 480 (VGA), 800 x 600 (SVGA), 1024 x 768 (XGA), 1280 x 1024 (SXGA), 1280 x 720 (HD 720), 1440 x 900, 1680 x 1050 (WSXGA+)",
        "VESA-Halterung": "Ja",
        "Video Anschl\u00fcsse": "1x HDMI, 2x DisplayPort, USB-C DisplayPort",
        "sRGB Abdeckung (klassisch)": "99%"
    },
    "raw_specifications_text": "Displaygr\u00f6\u00dfe: 23,8 Zoll\nAufl\u00f6sung: 1920x1080\nPanel: IPS\nReaktionszeit: 5 ms\nVideo Anschl\u00fcsse: 1x HDMI, 2x DisplayPort, USB-C DisplayPort\nHelligkeit: 250 cd/m\u00b2\nBesonderheiten: Lautsprecher\nHersteller Artikelnummer: S26361-K1699-V165\nEAN: 4065221160267\nArtikelnummer: M17Y57EL\nBildschirmdiagonale: 60,5 cm (23.8 Zoll)\nDisplay-Aufl\u00f6sung: 1920 x 1080 Pixel\nNatives Seitenverh\u00e4ltnis: 16:9\nBildschirmtechnologie: LED\nTouchscreen: Nein\nHD-Typ: Full HD\nPanel-Typ: IPS\nBildschirmform: Flach\nKontrastverh\u00e4ltnis: 1000:1\nAnzahl der Farben des Displays: 16,7 Millionen Farben\nHelligkeit (typisch): 250 cd/m\u00b2\nBlendfreier Bildschirm: Ja\nUnterst\u00fctzte Grafik-Aufl\u00f6sungen: 640 x 480 (VGA), 800 x 600 (SVGA), 1024 x 768 (XGA), 1280 x 1024 (SXGA), 1280 x 720 (HD 720), 1440 x 900, 1680 x 1050 (WSXGA+)\nBildwinkel, horizontal: 178\u00b0\nBildwinkel, vertikal: 178\u00b0\nPixel Abstand: 0,2745 x 0,2745 mm\nSichtbare Gr\u00f6\u00dfe (horizontal): 52,7 cm\nSichtbare Gr\u00f6\u00dfe (vertikal): 29,6 cm\nDigital horizontale Frequenz: 30 - 82 kHz\nDigital vertikale Frequenz: 48 - 76 Hz\nRGB-Farbraum: sRGB\nFarbskala: 99%\nsRGB Abdeckung (klassisch): 99%\nEingebaute Lautsprecher: Ja\nIntegrierte Kamera: Nein\nAnzahl der Lautsprecher: 2\nRMS-Leistung: 2 W\nProduktfarbe: Schwarz\nIntegrierter USB-Hub: Ja\nHDMI: Ja\nKopfh\u00f6rerausgang: Ja\nAnzahl der vorgeschalteten Steckpl\u00e4tze: 2\nAnzahl der Upstream-Ports USB Typ-B: 1\nAnzahl der Upstream-Ports USB Typ-C: 1\nAnzahl der nachgeschalteten Steckpl\u00e4tze vom Typ USB-A: 3\nAnzahl der nachgeschalteten Ports vom Typ USB-C: 1\nAnzahl HDMI-Anschl\u00fcsse: 1\nHDMI-Version: 1.4\nAnzahl DisplayPort Anschl\u00fcsse: 2\nDisplayPorts-Version: 1.2\nKopfh\u00f6rer-Anschluss: 3,5 mm\nEingebaute KVM-Umschaltung: Ja\nEingebauter Ethernet-Anschluss: Ja\nVESA-Halterung: Ja\nKabelsperre-Slot: Ja\nH\u00f6henverstellung: Ja\nSlot-Typ Kabelsperre: Kensington\nH\u00f6heneinstellung: 15 cm\nSchwenkbar: Ja\nSchwenkwinkelbereich: 0 - 345\u00b0\nNeigungswinkelbereich: -5 - 35\u00b0\nOn-Screen-Display (OSD): Ja\nNeigungsverstellung: Ja\nEnergieeffizienzklasse (SDR): C\nEnergieeffizienzklasse (HDR): C\nStromverbrauch (max.): 26 W\nStromverbrauch (aus): 0,26 W\nStromverbrauch (PowerSave): 0,51 W\nAC Eingangsspannung: 100 - 240 V\nAC Eingangsfrequenz: 50/60 Hz\nEnergieeffizienzskala: A bis G\nBetriebstemperatur: 5 - 35 \u00b0C\nRelative Luftfeuchtigkeit in Betrieb: 10 - 85%\nGer\u00e4tebreite (inkl. Fu\u00df): 539,1 mm\nGer\u00e4tetiefe (inkl. Fu\u00df): 212,7 mm\nGer\u00e4teh\u00f6he (inkl. Fu\u00df): 500,6 mm\nGewicht (mit St\u00e4nder): 6 kg\nBreite (ohne Standfu\u00df): 53,9 cm\nTiefe (ohne Standfu\u00df): 5,92 cm\nH\u00f6he (ohne Standfu\u00df): 33,9 cm\nGewicht (ohne St\u00e4nder): 4,1 kg",
    "reference_file": "offer_reference_825.json",
    "shop_name": "mylemon.at"
}