{
    "html_file": "offer_1895_6.html",
    "name": "Philips B-line 278B1, 27\"",
    "offer_link": "https://click.cptrack.de/?rd=true&k=H2jZOPSoNfIohcnyCFLwAwqzX3eQZkYX44I26OZb1ldzbPLYJ8jLUOYq52L9PZ2FGy_yTbYED5SeNM2e6jUszA~~&rdlink=https%3A%2F%2Fwww.cyberport.at%2F%3FDEEP%3D6108-1K1%26APID%3D66",
    "price": 280.0,
    "raw_specifications": {
        "Aufl\u00f6sung": "3.840x2.160 4K (Ultra HD)",
        "Betrachtungswinkel h/v": "178\u00b0/178\u00b0",
        "Bildformat": "16:9",
        "Bildwiederholfrequenz": "60 Hz",
        "Breite in mm": "613mm",
        "Displaygr\u00f6\u00dfe in Zoll": "27 Zoll",
        "Displaygr\u00f6\u00dfe in cm": "68,6 cm",
        "Displayport": "1x DP 1.2",
        "Farbraumabdeckung": "122% sRGB",
        "Farbtiefe": "10 Bit / 1,07 Mrd Farben",
        "Gewicht in kg": "6,6 kg",
        "HDMI": "2x HDMI 2.0",
        "Helligkeit": "350 cd/m\u00b2",
        "H\u00f6he in mm": "537mm",
        "H\u00f6henverstellbar": "150mm",
        "Jahresverbrauch": "28 kWh",
        "Kontrast dynamisch": "50.000.000:1",
        "Kontrast typisch": "1.000:1",
        "Lautsprecher": "2x",
        "Leistung": "2W",
        "Oberfl\u00e4che": "entspiegelt",
        "Reaktionszeit": "4 ms",
        "Technologie": "IPS",
        "Tiefe in mm": "205mm",
        "Wandmontage": "VESA100x100"
    },
    "raw_specifications_text": "Jahresverbrauch: 28 kWh\nDisplaygr\u00f6\u00dfe in cm: 68,6 cm\nDisplaygr\u00f6\u00dfe in Zoll: 27 Zoll\nTechnologie: IPS\nAufl\u00f6sung: 3.840x2.160 4K (Ultra HD)\nBildformat: 16:9\nOberfl\u00e4che: entspiegelt\nFarbraumabdeckung: 122% sRGB\nFarbtiefe: 10 Bit / 1,07 Mrd Farben\nHelligkeit: 350 cd/m\u00b2\nKontrast typisch: 1.000:1\nKontrast dynamisch: 50.000.000:1\nReaktionszeit: 4 ms\nBetrachtungswinkel h/v: 178\u00b0/178\u00b0\nBildwiederholfrequenz: 60 Hz\nHDMI: 2x HDMI 2.0\nDisplayport: 1x DP 1.2\nLautsprecher: 2x\nLeistung: 2W\nH\u00f6henverstellbar: 150mm\nWandmontage: VESA100x100\nBreite in mm: 613mm\nH\u00f6he in mm: 537mm\nTiefe in mm: 205mm\nGewicht in kg: 6,6 kg",
    "reference_file": "offer_reference_1895.json",
    "shop_name": "Cyberport.at"
}