{
    "html_file": "offer_2078_1.html",
    "name": "Acer Nitro XV3 XV273Xbmiiprzx, 27\"",
    "offer_link": "https://www.electronicshop24.at/product_info.php?products_id=210000001261982489&ano=A-L1261982489&mno=UM.HX3EE.X01&ean=4710180491630&utm_medium=cpc&utm_campaign=preisvergleich&utm_content=item&utm_source=geizhals&ref=geizhals",
    "price": 288.0,
    "raw_specifications": {
        "Abmessungen (Breite x Tiefe x H\u00f6he)": "61.4 cm x 23.6 cm x 41.5 cm - mit Fu\u00df",
        "Adaptive-Sync Technologie": "NVIDIA G-SYNC Compatible",
        "Ausgangsleistung/Kanal": "2 Watt",
        "Besonderheiten": "Acer Adaptive Contrast Management (ACM), ComfyView, Flimmerfrei-Technologie, Abblend-Technologie, gro\u00dfe Farbskala, Blaulichtfilter-Technologie, Super Sharpness-Technologie, Adaptive-Sync-Technologie, Monitorkalibrierung Delta E<2, Acer Display Widget, Delta E<1 Kalibrierung, 6 Farbeinstellungen",
        "Bildschirmbeschichtung": "Blendfrei",
        "Bildschirmtyp": "IPS",
        "Details zu Abmessungen & Gewicht": "Mit Fu\u00df - Breite: 61.4 cm - Tiefe: 23.6 cm - H\u00f6he: 41.5 cm - Gewicht: 6.24 kg",
        "Diagonalabmessung": "69 cm (27\")",
        "Display-Typ": "LED-hintergrundbeleuchteter LCD-Monitor / TFT-Aktivmatrix",
        "Eingangsspannung": "Wechselstrom 120/230 V (50/60 Hz)",
        "Einstellungen der Anzeigeposition": "H\u00f6he, Pivot (Rotation), Drehung, Neigung",
        "Energie Effizienzklasse": "Klasse B",
        "Energierverbrauch Sleep": "0.43 Watt",
        "Energieverbrauch pro Jahr": "50 kWh",
        "Enthaltene Kabel": "1 x HDMI-Kabel \u00a6 1 x USB 3.0 Upstream-Kabel",
        "Farbe": "Schwarz",
        "Farbraum": "90% DCI-P3",
        "Farbunterst\u00fctzung": "16,7 Millionen Farben",
        "Gewicht": "6.24 kg",
        "HDR-Zertifizierung": "DisplayHDR 400",
        "Helligkeit": "400 cd/m\u00b2",
        "Hintergrundbeleuchtungs-Technologie": "LED-Hintergrundbeleuchtung",
        "Horizontale Bildwiederholrate": "30 - 255 kHz",
        "Horizontaler Betrachtungswinkel": "178",
        "H\u00f6heneinstellung": "115 mm",
        "Integrierte Peripherieger\u00e4te": "USB 3.0-Hub",
        "Kennzeichnung": "MPR II, DisplayPort 1.2",
        "Kontrast": "100000000:1 (dynamisch)",
        "Leistungsmerkmale": "Unterst\u00fctzung f\u00fcr VESA-Schnittstelle",
        "Max. Betriebstemperatur": "40 \u00b0C",
        "Min Betriebstemperatur": "0 \u00b0C",
        "Native Aufl\u00f6sung": "Full HD (1080p) 1920 x 1080 bei 240 Hz",
        "Neigungswinkel": "-5/+20",
        "Reaktionszeit": "1 ms (Gray-to-Gray), 0,1 ms (Grau-zu-Grau min.)",
        "Rotationswinkel": "180",
        "Schnittstellen": "2 x HDMI \u00a6 DisplayPort 1.2 \u00a6 USB 3.0 Upstream \u00a6 4 x USB 3.0 Downstream \u00a6 Audio Line-Out",
        "Schwenkwinkel": "40",
        "Seitenverh\u00e4ltnis": "16:9",
        "Stromverbrauch (Aus-Modus)": "0.34 Watt",
        "Stromverbrauch (typisch)": "25 Watt",
        "Typ": "Lautsprecher - Stereo",
        "VESA-Halterung": "100 x 100 mm",
        "Vertikale Bildwiederholrate": "48 - 240 Hz",
        "Vertikaler Betrachtungswinkel": "178",
        "Zul\u00e4ssige Luftfeuchtigkeit im Betrieb": "20 - 80%"
    },
    "raw_specifications_text": "Display-Typ: LED-hintergrundbeleuchteter LCD-Monitor / TFT-Aktivmatrix\nEnergie Effizienzklasse: Klasse B\nEnergieverbrauch pro Jahr: 50 kWh\nDiagonalabmessung: 69 cm (27\")\nAdaptive-Sync Technologie: NVIDIA G-SYNC Compatible\nIntegrierte Peripherieger\u00e4te: USB 3.0-Hub\nBildschirmtyp: IPS\nSeitenverh\u00e4ltnis: 16:9\nNative Aufl\u00f6sung: Full HD (1080p) 1920 x 1080 bei 240 Hz\nHelligkeit: 400 cd/m\u00b2\nKontrast: 100000000:1 (dynamisch)\nHDR-Zertifizierung: DisplayHDR 400\nFarbunterst\u00fctzung: 16,7 Millionen Farben\nFarbraum: 90% DCI-P3\nReaktionszeit: 1 ms (Gray-to-Gray), 0,1 ms (Grau-zu-Grau min.)\nVertikale Bildwiederholrate: 48 - 240 Hz\nHorizontale Bildwiederholrate: 30 - 255 kHz\nHorizontaler Betrachtungswinkel: 178\nVertikaler Betrachtungswinkel: 178\nBildschirmbeschichtung: Blendfrei\nHintergrundbeleuchtungs-Technologie: LED-Hintergrundbeleuchtung\nBesonderheiten: Acer Adaptive Contrast Management (ACM), ComfyView, Flimmerfrei-Technologie, Abblend-Technologie, gro\u00dfe Farbskala, Blaulichtfilter-Technologie, Super Sharpness-Technologie, Adaptive-Sync-Technologie, Monitorkalibrierung Delta E<2, Acer Display Widget, Delta E<1 Kalibrierung, 6 Farbeinstellungen\nFarbe: Schwarz\nAbmessungen (Breite x Tiefe x H\u00f6he): 61.4 cm x 23.6 cm x 41.5 cm - mit Fu\u00df\nGewicht: 6.24 kg\nTyp: Lautsprecher - Stereo\nAusgangsleistung/Kanal: 2 Watt\nSchnittstellen: 2 x HDMI \u00a6 DisplayPort 1.2 \u00a6 USB 3.0 Upstream \u00a6 4 x USB 3.0 Downstream \u00a6 Audio Line-Out\nEinstellungen der Anzeigeposition: H\u00f6he, Pivot (Rotation), Drehung, Neigung\nNeigungswinkel: -5/+20\nSchwenkwinkel: 40\nRotationswinkel: 180\nH\u00f6heneinstellung: 115 mm\nVESA-Halterung: 100 x 100 mm\nLeistungsmerkmale: Unterst\u00fctzung f\u00fcr VESA-Schnittstelle\nEnthaltene Kabel: 1 x HDMI-Kabel \u00a6 1 x USB 3.0 Upstream-Kabel\nKennzeichnung: MPR II, DisplayPort 1.2\nEingangsspannung: Wechselstrom 120/230 V (50/60 Hz)\nStromverbrauch (typisch): 25 Watt\nEnergierverbrauch Sleep: 0.43 Watt\nStromverbrauch (Aus-Modus): 0.34 Watt\nDetails zu Abmessungen & Gewicht: Mit Fu\u00df - Breite: 61.4 cm - Tiefe: 23.6 cm - H\u00f6he: 41.5 cm - Gewicht: 6.24 kg\nMin Betriebstemperatur: 0 \u00b0C\nMax. Betriebstemperatur: 40 \u00b0C\nZul\u00e4ssige Luftfeuchtigkeit im Betrieb: 20 - 80%",
    "reference_file": "offer_reference_2078.json",
    "shop_name": "ElectronicShop24"
}