{
    "html_file": "offer_1569_8.html",
    "name": "LG 24CN670N-6A, 23.8\"",
    "offer_link": "https://direkt.jacob.de/produkte/lg-thin-client-24cn670n-6n-aeu-artnr-7469538.html?utm_source=geizhals&utm_medium=cpc&utm_campaign=Preisvergleich&ref=103",
    "price": 643.24,
    "raw_specifications": {
        "Abmessungen (Breite x Tiefe x H\u00f6he)": "55.38 cm x 24 cm x 51.29 cm",
        "Anz. der Kerne": "Quad-Core",
        "Audioausgang": "Stereo",
        "Bereitgestelltes Betriebssystem": "Kein Betriebssystem",
        "Breitbild-Bildschirm": "Ja",
        "Breite": "55.38 cm",
        "Data Link Protocol": "Ethernet, Fast Ethernet, Gigabit Ethernet, IEEE 802.11b, IEEE 802.11a, IEEE 802.11g, IEEE 802.11n, Bluetooth 4.0",
        "Details zu Abmessungen & Gewicht": "55.38 cm - 24 cm - 51.29 cm - 6.2 kg - mit St\u00e4nder  55.38 cm - 6.3 cm - 35.33 cm - 4.05 kg - ohne St\u00e4nder",
        "Diagonalabmessung": "60.47 cm (23.8\")",
        "Diebstahl-/Einbruchschutz": "Sicherheitsschloss-Schlitz (Kabelschloss wird separat verkauft)",
        "Erforderliche Netzspannung": "Wechselstrom 100-240 V (50/60 Hz)",
        "Farbe": "Wei\u00df",
        "Festplatte": "SSD 16 GB - eMMC",
        "Formfaktor des Produktes": "All-in-One (Komplettl\u00f6sung) - mit OneClick-Standfu\u00df",
        "Ger\u00e4tetyp": "Netzteil",
        "Gewicht": "6.2 kg",
        "Grafik-Controller": "Intel UHD Graphics 600",
        "Grafikprozessor": "Intel UHD Graphics 600",
        "Helligkeit": "250 cd/m\u00b2",
        "Horizontaler Betrachtungswinkel": "178",
        "H\u00f6he": "51.29 cm",
        "Installierte Anzahl": "4 GB",
        "Integrierte Peripherieger\u00e4te": "RFID-Leser",
        "Integrierte Sicherheit": "Trusted Platform Module (TPM) Security Chip",
        "Kapazit\u00e4t": "1 x 16 GB",
        "Kennzeichnung": "Plug and Play, FCC Klasse B bescheinigt, UL, TUV GS, CB, TUV Ergo, DDC/CI, IEC 60601-1, FDA Class I",
        "Kontrastverh\u00e4ltnis": "1000:1",
        "Leistungsaufnahme im Betrieb": "70 Watt",
        "Max. Turbo-Taktfrequenz": "2.5 GHz",
        "Mit Lautsprechern": "2 x linker/rechter Kanal",
        "Monitor": "60.47 cm (23.8\") - LED - 1920 x 1080 (Full HD) @ 60 Hz - 16:9",
        "Monitormerkmale": "Blendfreie, SUPER + Resolution, Hard Coating (3H), Flicker Safe, Reader Mode, MaxxAudio, Intelligente Energiespartechnologie, Mega DFC, Kippst\u00e4nder (-5\u00b0 - 35\u00b0), schwenkbarer Standfu\u00df (0\u00b0 - 355\u00b0), einstellbare H\u00f6he (0 - 130 mm), schwenkbarer St\u00e4nder",
        "Monitortyp": "LED - AH-IPS",
        "Native Aufl\u00f6sung": "1920 x 1080 (Full HD)",
        "Netzwerk": "GigE, 802.11a, 802.11b/g/n, Bluetooth 4.0",
        "Optischer Speicher": "Kein optisches Laufwerk",
        "Pixelpitch": "0.2745 mm",
        "Produktbeschreibung": "LG 24CN670N-6N - All-in-One (Komplettl\u00f6sung) - Celeron J4105 1.5 GHz - 4 GB - SSD 16 GB - LED 60.47 cm (23.8\")",
        "Prozessor": "1 x Intel Celeron J4105 / 1.5 GHz (2.5 GHz) (Quad-Core)",
        "Prozessoranzahl": "1",
        "RAM": "4 GB DDR4 SDRAM",
        "Reaktionszeit": "5 ms",
        "Schlosstyp zur Diebstahlsicherung": "Kensington Slot",
        "Schnittstellen": "1 x DisplayPort-Ausgang  1 x Audio-Ausgang - Mini-Klinkenstecker  1 x HDMI-Eingang  2 x USB 3.0  1 x Mikrofon - Mini-Klinkenstecker  1 x LAN (Gigabit Ethernet) - RJ-45  DisplayPort-Eingang  4 x USB 3.1 Gen 1 - Type A  1 x USB-C",
        "Seitenverh\u00e4ltnis des Bildes": "16:9",
        "Soundmodus": "Stereo",
        "Stromverbrauch im Standby-Modus": "1.24 Watt",
        "Stromversorgung": "(50/60 Hz)",
        "Taktfrequenz": "1.5 GHz",
        "Technologie": "DDR4 SDRAM",
        "Tiefe": "24 cm",
        "Transportbreite": "63.1 cm",
        "Transportgewicht": "9.4 kg",
        "Transporth\u00f6he": "51.5 cm",
        "Transporttiefe": "20 cm",
        "Typ": "Kein optisches Laufwerk",
        "VESA-Halterung": "100 x 100 mm, VESA",
        "Vertikale Bildwiederholrate bei max. Aufl\u00f6sung": "60 Hz",
        "Vertikaler Betrachtungswinkel": "178",
        "Wireless LAN unterst\u00fctzt": "Ja"
    },
    "raw_specifications_text": "Produktbeschreibung: LG 24CN670N-6N - All-in-One (Komplettl\u00f6sung) - Celeron J4105 1.5 GHz - 4 GB - SSD 16 GB - LED 60.47 cm (23.8\")\nTyp: Kein optisches Laufwerk\nProzessor: 1 x Intel Celeron J4105 / 1.5 GHz (2.5 GHz) (Quad-Core)\nRAM: 4 GB DDR4 SDRAM\nFestplatte: SSD 16 GB - eMMC\nOptischer Speicher: Kein optisches Laufwerk\nMonitor: 60.47 cm (23.8\") - LED - 1920 x 1080 (Full HD) @ 60 Hz - 16:9\nGrafik-Controller: Intel UHD Graphics 600\nAudioausgang: Stereo\nNetzwerk: GigE, 802.11a, 802.11b/g/n, Bluetooth 4.0\nStromversorgung: (50/60 Hz)\nBereitgestelltes Betriebssystem: Kein Betriebssystem\nFarbe: Wei\u00df\nAbmessungen (Breite x Tiefe x H\u00f6he): 55.38 cm x 24 cm x 51.29 cm\nGewicht: 6.2 kg\nFormfaktor des Produktes: All-in-One (Komplettl\u00f6sung) - mit OneClick-Standfu\u00df\nIntegrierte Peripherieger\u00e4te: RFID-Leser\nIntegrierte Sicherheit: Trusted Platform Module (TPM) Security Chip\nTaktfrequenz: 1.5 GHz\nMax. Turbo-Taktfrequenz: 2.5 GHz\nAnz. der Kerne: Quad-Core\nProzessoranzahl: 1\nInstallierte Anzahl: 4 GB\nTechnologie: DDR4 SDRAM\nKapazit\u00e4t: 1 x 16 GB\nMonitortyp: LED - AH-IPS\nDiagonalabmessung: 60.47 cm (23.8\")\nNative Aufl\u00f6sung: 1920 x 1080 (Full HD)\nVertikale Bildwiederholrate bei max. Aufl\u00f6sung: 60 Hz\nBreitbild-Bildschirm: Ja\nSeitenverh\u00e4ltnis des Bildes: 16:9\nHorizontaler Betrachtungswinkel: 178\nVertikaler Betrachtungswinkel: 178\nPixelpitch: 0.2745 mm\nReaktionszeit: 5 ms\nHelligkeit: 250 cd/m\u00b2\nKontrastverh\u00e4ltnis: 1000:1\nMonitormerkmale: Blendfreie, SUPER + Resolution, Hard Coating (3H), Flicker Safe, Reader Mode, MaxxAudio, Intelligente Energiespartechnologie, Mega DFC, Kippst\u00e4nder (-5\u00b0 - 35\u00b0), schwenkbarer Standfu\u00df (0\u00b0 - 355\u00b0), einstellbare H\u00f6he (0 - 130 mm), schwenkbarer St\u00e4nder\nGrafikprozessor: Intel UHD Graphics 600\nSoundmodus: Stereo\nMit Lautsprechern: 2 x linker/rechter Kanal\nWireless LAN unterst\u00fctzt: Ja\nData Link Protocol: Ethernet, Fast Ethernet, Gigabit Ethernet, IEEE 802.11b, IEEE 802.11a, IEEE 802.11g, IEEE 802.11n, Bluetooth 4.0\nSchnittstellen: 1 x DisplayPort-Ausgang  1 x Audio-Ausgang - Mini-Klinkenstecker  1 x HDMI-Eingang  2 x USB 3.0  1 x Mikrofon - Mini-Klinkenstecker  1 x LAN (Gigabit Ethernet) - RJ-45  DisplayPort-Eingang  4 x USB 3.1 Gen 1 - Type A  1 x USB-C\nDiebstahl-/Einbruchschutz: Sicherheitsschloss-Schlitz (Kabelschloss wird separat verkauft)\nSchlosstyp zur Diebstahlsicherung: Kensington Slot\nVESA-Halterung: 100 x 100 mm, VESA\nKennzeichnung: Plug and Play, FCC Klasse B bescheinigt, UL, TUV GS, CB, TUV Ergo, DDC/CI, IEC 60601-1, FDA Class I\nGer\u00e4tetyp: Netzteil\nErforderliche Netzspannung: Wechselstrom 100-240 V (50/60 Hz)\nLeistungsaufnahme im Betrieb: 70 Watt\nStromverbrauch im Standby-Modus: 1.24 Watt\nDetails zu Abmessungen & Gewicht: 55.38 cm - 24 cm - 51.29 cm - 6.2 kg - mit St\u00e4nder  55.38 cm - 6.3 cm - 35.33 cm - 4.05 kg - ohne St\u00e4nder\nBreite: 55.38 cm\nTiefe: 24 cm\nH\u00f6he: 51.29 cm\nTransportbreite: 63.1 cm\nTransporttiefe: 20 cm\nTransporth\u00f6he: 51.5 cm\nTransportgewicht: 9.4 kg",
    "reference_file": "offer_reference_1569.json",
    "shop_name": "Jacob Elektronik direkt (AT)"
}