{
    "html_file": "offer_1597_15.html",
    "name": "LG 24BL650C-B, 23.8\"",
    "offer_link": "https://www.ba-computer.at/lg-24bl650c-b-led-monitor-60-cm-24-23-8-sichtbar-24bl650c-b-aeu.html",
    "price": 150.58,
    "raw_specifications": {
        "Abmessungen (Breite x Tiefe x H\u00f6he)": "53.92 cm x 24 cm x 50.56 cm - mit Fu\u00df",
        "Ausgangsleistung/Kanal": "1.2 Watt",
        "Besonderheiten": "Picture Mode, Spielmodus, Mega Dynamic Contrast Ratio, On-screen Digital Controls, Crosshair Display, Flicker Safe, Intelligente Energiespartechnologie, Color Calibrated, Black Stabilizer, DAS Mode (Dynamic Action Sync), Color Weakness Mode, Super Resolution+",
        "Bildschirmbeschichtung": "Entspiegelt, 3H Hard Coating",
        "Bildschirmtyp": "IPS",
        "Details zu Abmessungen & Gewicht": "Mit Standfu\u00df (niedrigste Position) - Breite: 53.92 cm - Tiefe: 24 cm - H\u00f6he: 50.56 cm - Gewicht: 5.3 kg \u00a6 Mit Standfu\u00df (h\u00f6chste Position) - Breite: 53.92 cm - Tiefe: 24 cm - H\u00f6he: 61.56 cm - Gewicht: 5.3 kg \u00a6 Ohne Fu\u00df - Breite: 53.92 cm - Tiefe: 5.92 cm - H\u00f6he: 32.16 cm - Gewicht: 3.1 kg",
        "Diagonalabmessung": "60 cm (24\")",
        "Display-Typ": "LED-hintergrundbeleuchteter LCD-Monitor / TFT-Aktivmatrix",
        "Eingangsspannung": "Wechselstrom 120/230 V (50/60 Hz)",
        "Einstellungen der Anzeigeposition": "H\u00f6he, Pivot (Rotation), Drehung, Neigung",
        "Energie Effizienzklasse": "Klasse A+",
        "Energierverbrauch Sleep": "0.5 Watt",
        "Energieverbrauch pro Jahr": "23 kWh",
        "Enthaltene Kabel": "1 x HDMI-Kabel - 1.8 m \u00a6 1 x USB-C Kabel - 1.5 m",
        "Farbe": "Mattschwarz",
        "Farbraum": "72% NTSC (CIE 1931)",
        "Farbunterst\u00fctzung": "16,7 Millionen Farben",
        "Gewicht": "5.3 kg",
        "Helligkeit": "250 cd/m\u00b2",
        "Hintergrundbeleuchtungs-Technologie": "LED-Hintergrundbeleuchtung",
        "Horizontaler Betrachtungswinkel": "178",
        "H\u00f6heneinstellung": "130 mm",
        "Integrierte Peripherieger\u00e4te": "USB 3.0-Hub",
        "Kennzeichnung": "FCC Klasse B bescheinigt, UL, TUV GS, cUL, CB, TUV Ergo, RoHS, ISO 9241-307, REACH, ERP, EPA 7.0, DisplayPort 1.2, HDCP 1.4",
        "Kontrast": "1000:1",
        "Leistungsaufnahme im Ein-Zustand": "16 W",
        "Leistungsmerkmale": "Slot f\u00fcr Sicherheitsschloss (Kabelschloss getrennt erh\u00e4ltlich)",
        "Native Aufl\u00f6sung": "Full HD (1080p) 1920 x 1080 bei 75 Hz",
        "Neigungswinkel": "-5/+35",
        "OSD-Sprachen": "Multilingual",
        "Pixelpitch": "0.2745 mm",
        "Reaktionszeit": "5 ms (Gray-to-Gray)",
        "Rotationswinkel": "180",
        "Schlosstyp zur Diebstahlsicherung": "Kensington Slot",
        "Schnittstellen": "HDMI \u00a6 DisplayPort \u00a6 USB-C Upstream/DisplayPort Alt Mode (bis zu 45 W) \u00a6 2 x USB 3.0 Downstream \u00a6 Kopfh\u00f6rer",
        "Schwenkwinkel": "356",
        "Seitenverh\u00e4ltnis": "16:9",
        "Sichtbare Bildfl\u00e4che": "60.4 cm (23.8\")",
        "Stromverbrauch (Aus-Modus)": "0.3 Watt",
        "Stromverbrauch (typisch)": "20.4 Watt",
        "Transportbreite": "62.6 cm",
        "Transporth\u00f6he": "19.4 cm",
        "Transporttiefe": "47.4 cm",
        "Typ": "Lautsprecher - Stereo",
        "USB-Spannungsversorgung": "45 Watt",
        "VESA-Halterung": "100 x 100 mm",
        "Vertikaler Betrachtungswinkel": "178"
    },
    "raw_specifications_text": "Display-Typ: LED-hintergrundbeleuchteter LCD-Monitor / TFT-Aktivmatrix\nEnergie Effizienzklasse: Klasse A+\nEnergieverbrauch pro Jahr: 23 kWh\nDiagonalabmessung: 60 cm (24\")\nSichtbare Bildfl\u00e4che: 60.4 cm (23.8\")\nIntegrierte Peripherieger\u00e4te: USB 3.0-Hub\nUSB-Spannungsversorgung: 45 Watt\nBildschirmtyp: IPS\nSeitenverh\u00e4ltnis: 16:9\nNative Aufl\u00f6sung: Full HD (1080p) 1920 x 1080 bei 75 Hz\nPixelpitch: 0.2745 mm\nHelligkeit: 250 cd/m\u00b2\nKontrast: 1000:1\nFarbunterst\u00fctzung: 16,7 Millionen Farben\nFarbraum: 72% NTSC (CIE 1931)\nReaktionszeit: 5 ms (Gray-to-Gray)\nHorizontaler Betrachtungswinkel: 178\nVertikaler Betrachtungswinkel: 178\nBildschirmbeschichtung: Entspiegelt, 3H Hard Coating\nHintergrundbeleuchtungs-Technologie: LED-Hintergrundbeleuchtung\nOSD-Sprachen: Multilingual\nBesonderheiten: Picture Mode, Spielmodus, Mega Dynamic Contrast Ratio, On-screen Digital Controls, Crosshair Display, Flicker Safe, Intelligente Energiespartechnologie, Color Calibrated, Black Stabilizer, DAS Mode (Dynamic Action Sync), Color Weakness Mode, Super Resolution+\nFarbe: Mattschwarz\nAbmessungen (Breite x Tiefe x H\u00f6he): 53.92 cm x 24 cm x 50.56 cm - mit Fu\u00df\nGewicht: 5.3 kg\nTyp: Lautsprecher - Stereo\nAusgangsleistung/Kanal: 1.2 Watt\nSchnittstellen: HDMI \u00a6 DisplayPort \u00a6 USB-C Upstream/DisplayPort Alt Mode (bis zu 45 W) \u00a6 2 x USB 3.0 Downstream \u00a6 Kopfh\u00f6rer\nEinstellungen der Anzeigeposition: H\u00f6he, Pivot (Rotation), Drehung, Neigung\nNeigungswinkel: -5/+35\nSchwenkwinkel: 356\nRotationswinkel: 180\nH\u00f6heneinstellung: 130 mm\nVESA-Halterung: 100 x 100 mm\nLeistungsmerkmale: Slot f\u00fcr Sicherheitsschloss (Kabelschloss getrennt erh\u00e4ltlich)\nEnthaltene Kabel: 1 x HDMI-Kabel - 1.8 m \u00a6 1 x USB-C Kabel - 1.5 m\nKennzeichnung: FCC Klasse B bescheinigt, UL, TUV GS, cUL, CB, TUV Ergo, RoHS, ISO 9241-307, REACH, ERP, EPA 7.0, DisplayPort 1.2, HDCP 1.4\nSchlosstyp zur Diebstahlsicherung: Kensington Slot\nEingangsspannung: Wechselstrom 120/230 V (50/60 Hz)\nLeistungsaufnahme im Ein-Zustand: 16 W\nStromverbrauch (typisch): 20.4 Watt\nEnergierverbrauch Sleep: 0.5 Watt\nStromverbrauch (Aus-Modus): 0.3 Watt\nDetails zu Abmessungen & Gewicht: Mit Standfu\u00df (niedrigste Position) - Breite: 53.92 cm - Tiefe: 24 cm - H\u00f6he: 50.56 cm - Gewicht: 5.3 kg \u00a6 Mit Standfu\u00df (h\u00f6chste Position) - Breite: 53.92 cm - Tiefe: 24 cm - H\u00f6he: 61.56 cm - Gewicht: 5.3 kg \u00a6 Ohne Fu\u00df - Breite: 53.92 cm - Tiefe: 5.92 cm - H\u00f6he: 32.16 cm - Gewicht: 3.1 kg\nTransportbreite: 62.6 cm\nTransporttiefe: 47.4 cm\nTransporth\u00f6he: 19.4 cm",
    "reference_file": "offer_reference_1597.json",
    "shop_name": "BA-Computer"
}