{
    "html_file": "offer_1858_2.html",
    "name": "Lenovo G27c-10, 27\"",
    "offer_link": "https://www.taufnaus.de/product/10621508",
    "price": 263.24,
    "raw_specifications": {
        "Abmessungen (Breite x Tiefe x H\u00f6he)": "61.199 cm x 23.48 cm x 52.04 cm - mit Fu\u00df",
        "Adaptive-Sync Technologie": "AMD FreeSync",
        "Besonderheiten": "Flimmerfreie Technologie, Low Blue Light-Technologie, NearEdgeless-Design an 3 Seiten",
        "Bildschirmbeschichtung": "Blendfrei",
        "Bildschirmtyp": "VA",
        "Details zu Abmessungen & Gewicht": "Mit Standfu\u00df (h\u00f6chste Position) - Breite: 61.199 cm - Tiefe: 23.48 cm - H\u00f6he: 52.04 cm - Gewicht: 6.1 kg \u00a6 Mit Standfu\u00df (niedrigste Position) - Breite: 61.199 cm - Tiefe: 23.48 cm - H\u00f6he: 39.04 cm - Gewicht: 6.1 kg",
        "Diagonalabmessung": "68.6 cm (27\")",
        "Display-Typ": "LED-hintergrundbeleuchteter LCD-Monitor / TFT-Aktivmatrix",
        "Eingangsspannung": "AC 90 - 264 V (47/63 Hz)",
        "Einstellungen der Anzeigeposition": "H\u00f6he, Neigung",
        "Energie Effizienzklasse": "Klasse E",
        "Energierverbrauch Sleep": "0.5 Watt",
        "Enthaltene Kabel": "1 x HDMI-Kabel - 1.8 m",
        "Erforderliches Betriebssystem": "Microsoft Windows 7, Windows 10",
        "Farbe": "Raven Black",
        "Farbraum": "72%",
        "Farbunterst\u00fctzung": "16,7 Millionen Farben",
        "Geschwungener Bildschirm": "Ja (1500R)",
        "Gewicht": "6.1 kg",
        "Helligkeit": "350 cd/m\u00b2",
        "Hintergrundbeleuchtungs-Technologie": "WLED",
        "Horizontaler Betrachtungswinkel": "178",
        "H\u00f6heneinstellung": "130 mm",
        "Kennzeichnung": "CCC, China Energy standard Tier 1, EU RoHS 2002/95/EC",
        "Kontrast": "3000:1 / 3000000:1 (dynamisch)",
        "Leistungsaufnahme im Ein-Zustand": "20.6 W",
        "Leistungsmerkmale": "Slot f\u00fcr Sicherheitsschloss (Kabelschloss getrennt erh\u00e4ltlich), integrierte Kabelf\u00fchrung",
        "Lokalisierung": "EMEA",
        "Native Aufl\u00f6sung": "Full HD (1080p) 1920 x 1080 bei 165 Hz",
        "Neigungswinkel": "-5/+22",
        "Pixelpitch": "0.3114 mm",
        "Ppi": "81.6",
        "Reaktionszeit": "4 ms (extrem), 14 ms (aus), 6 ms (typisch)",
        "Schlosstyp zur Diebstahlsicherung": "Kensington Slot",
        "Schnittstellen": "DisplayPort \u00a6 HDMI \u00a6 Audio Line-Out (Mini-Klinkenstecker)",
        "Seitenverh\u00e4ltnis": "16:9",
        "Service und Support": "Begrenzte Garantie - 3 Jahre",
        "Stromverbrauch (Aus-Modus)": "0.3 Watt",
        "Stromverbrauch (typisch)": "27 Watt",
        "Stromverbrauch SDR (eingeschaltet)": "20.6 kWh/1.000 h",
        "Transportbreite": "72.4 cm",
        "Transportgewicht": "8.5 kg",
        "Transporth\u00f6he": "47.2 cm",
        "Transporttiefe": "25 cm",
        "VESA-Halterung": "100 x 100 mm",
        "Vertikaler Betrachtungswinkel": "178"
    },
    "raw_specifications_text": "Display-Typ: LED-hintergrundbeleuchteter LCD-Monitor / TFT-Aktivmatrix\nEnergie Effizienzklasse: Klasse E\nDiagonalabmessung: 68.6 cm (27\")\nGeschwungener Bildschirm: Ja (1500R)\nAdaptive-Sync Technologie: AMD FreeSync\nBildschirmtyp: VA\nSeitenverh\u00e4ltnis: 16:9\nNative Aufl\u00f6sung: Full HD (1080p) 1920 x 1080 bei 165 Hz\nPixelpitch: 0.3114 mm\nPpi: 81.6\nHelligkeit: 350 cd/m\u00b2\nKontrast: 3000:1 / 3000000:1 (dynamisch)\nFarbunterst\u00fctzung: 16,7 Millionen Farben\nFarbraum: 72%\nReaktionszeit: 4 ms (extrem), 14 ms (aus), 6 ms (typisch)\nHorizontaler Betrachtungswinkel: 178\nVertikaler Betrachtungswinkel: 178\nBildschirmbeschichtung: Blendfrei\nHintergrundbeleuchtungs-Technologie: WLED\nBesonderheiten: Flimmerfreie Technologie, Low Blue Light-Technologie, NearEdgeless-Design an 3 Seiten\nFarbe: Raven Black\nAbmessungen (Breite x Tiefe x H\u00f6he): 61.199 cm x 23.48 cm x 52.04 cm - mit Fu\u00df\nGewicht: 6.1 kg\nSchnittstellen: DisplayPort \u00a6 HDMI \u00a6 Audio Line-Out (Mini-Klinkenstecker)\nEinstellungen der Anzeigeposition: H\u00f6he, Neigung\nNeigungswinkel: -5/+22\nH\u00f6heneinstellung: 130 mm\nVESA-Halterung: 100 x 100 mm\nLeistungsmerkmale: Slot f\u00fcr Sicherheitsschloss (Kabelschloss getrennt erh\u00e4ltlich), integrierte Kabelf\u00fchrung\nEnthaltene Kabel: 1 x HDMI-Kabel - 1.8 m\nKennzeichnung: CCC, China Energy standard Tier 1, EU RoHS 2002/95/EC\nLokalisierung: EMEA\nSchlosstyp zur Diebstahlsicherung: Kensington Slot\nEingangsspannung: AC 90 - 264 V (47/63 Hz)\nLeistungsaufnahme im Ein-Zustand: 20.6 W\nStromverbrauch SDR (eingeschaltet): 20.6 kWh/1.000 h\nStromverbrauch (typisch): 27 Watt\nEnergierverbrauch Sleep: 0.5 Watt\nStromverbrauch (Aus-Modus): 0.3 Watt\nErforderliches Betriebssystem: Microsoft Windows 7, Windows 10\nDetails zu Abmessungen & Gewicht: Mit Standfu\u00df (h\u00f6chste Position) - Breite: 61.199 cm - Tiefe: 23.48 cm - H\u00f6he: 52.04 cm - Gewicht: 6.1 kg \u00a6 Mit Standfu\u00df (niedrigste Position) - Breite: 61.199 cm - Tiefe: 23.48 cm - H\u00f6he: 39.04 cm - Gewicht: 6.1 kg\nTransportbreite: 72.4 cm\nTransporttiefe: 25 cm\nTransporth\u00f6he: 47.2 cm\nTransportgewicht: 8.5 kg\nService und Support: Begrenzte Garantie - 3 Jahre",
    "reference_file": "offer_reference_1858.json",
    "shop_name": "TaufNaus"
}