{
    "html_file": "offer_600_1.html",
    "name": "Samsung Odyssey G5 G50A (2022), 32\"",
    "offer_link": "https://www.proshop.at/Bildschirm/Samsung-32-Bildschirm-Odyssey-G5-S32AG520PU-2560x1440-165Hz-IPS-Black-1-ms-AMD-FreeSync-Premium/3071593?utm_source=geizhals&utm_medium=cpc&utm_campaign=pricesite",
    "price": 409.88,
    "raw_specifications": {
        "Abmessungen (Breite x Tiefe x H\u00f6he)": "71.46 cm x 31.11 cm x 60.29 cm - mit Fu\u00df",
        "Abmessungen (Breite x Tiefe x H\u00f6he) - mit Fu\u00df": "71.46 cm x 31.11 cm x 60.29 cm",
        "Adaptive-Sync Technologie": "NVIDIA G-SYNC Compatible, AMD FreeSync Premium",
        "Besonderheiten": "Cinema Mode, CustomColor Mode, konfigurierbare OSD-Schaltfl\u00e4chen, FPS Mode, Mega Infinity Dynamic Contrast Ratio, flimmerfreie Technologie, RTS Mode, Eye Saver Mode, Screen Size Optimizer, RPG Mode, AOS Mode, sRGB Mode, Off Timer, Dynamic Contrast Mode, Low Input Delay Mode, Super Arena Gaming Experience, Aktualisierungsraten-Optimierer, Ultrawide Game View, Auto Source Switch",
        "Bildschirmtyp": "IPS",
        "Details zu Abmessungen & Gewicht": "Mit Fu\u00df - Breite: 71.46 cm - Tiefe: 31.11 cm - H\u00f6he: 60.29 cm - Gewicht: 7.5 kg  Ohne Fu\u00df - Breite: 71.46 cm - Tiefe: 9.15 cm - H\u00f6he: 44.06 cm - Gewicht: 5.6 kg",
        "Diagonalabmessung": "80 cm (32\")",
        "Display-Typ": "LED-hintergrundbeleuchteter LCD-Monitor / TFT-Aktivmatrix",
        "EAN": "8806092784086",
        "Eingangsanschl\u00fcsse": "HDMI, DisplayPort",
        "Eingangsspannung": "Wechselstrom 100-240 V",
        "Einstellungen der Anzeigeposition": "H\u00f6he, Pivot (Rotation), Drehung, Neigung",
        "Energie Effizienzklasse": "Klasse G",
        "Energieklasse (HDR)": "Klasse G",
        "Energieverbrauch pro Jahr": "53 kWh",
        "Enthaltene Kabel": "1 x DisplayPort-Kabel",
        "Farbe": "Schwarz",
        "Ger\u00e4tetyp": "LED-hintergrundbeleuchteter LCD-Monitor - 80 cm (32\")",
        "Gewicht": "7.5 kg",
        "HDR-Format": "HDR10",
        "HDR-f\u00e4hig": "HDR10",
        "Helligkeit": "350 cd/m\u00b2",
        "Hersteller": "Samsung",
        "Hintergrundbeleuchtungs-Technologie": "LED-Hintergrundbeleuchtung",
        "Horizontaler Betrachtungswinkel": "178",
        "H\u00f6heneinstellung": "120 mm",
        "Kontrast": "1000:1",
        "Leistungsmerkmale": "Slot f\u00fcr Sicherheitsschloss (Kabelschloss getrennt erh\u00e4ltlich)",
        "Modell": "LS32AG520PUXEN",
        "Native Aufl\u00f6sung": "QHD 2560 x 1440 bei 165 Hz",
        "Neigungswinkel": "-11/+15",
        "Produktbeschreibung": "Samsung Odyssey G5 S32AG500PU - LED-Monitor - QHD - 80 cm (32\") - HDR",
        "Reaktionszeit": "1 ms (Gray-to-Gray)",
        "Rotationswinkel": "-2/+92",
        "Schlosstyp zur Diebstahlsicherung": "Kensington Slot",
        "Schnittstellen": "DisplayPort 1.2  HDMI  Kopfh\u00f6rer",
        "Schwenkwinkel": "30",
        "Seitenverh\u00e4ltnis": "16:9",
        "Spannung": "Wechselstrom 100-240 V",
        "Stromverbrauch (Aus-Modus)": "0.3 Watt",
        "Stromverbrauch (max.)": "59 Watt",
        "Stromverbrauch (typisch)": "36 Watt",
        "Stromverbrauch HDR (eingeschaltet)": "61 kWh/1.000 h",
        "Stromverbrauch SDR (eingeschaltet)": "36 kWh/1.000 h",
        "Stromverbrauch im Standby-Modus": "0.5 Watt",
        "Transportbreite": "80.2 cm",
        "Transportgewicht": "9.7 kg",
        "Transporth\u00f6he": "54.5 cm",
        "Transporttiefe": "17.6 cm",
        "VESA-Halterung": "100 x 100 mm",
        "Vertikaler Betrachtungswinkel": "178",
        "Waren-Nr.": "3071593",
        "Zum Hersteller": "www.samsung.com"
    },
    "raw_specifications_text": "Hersteller: Samsung\nWaren-Nr.: 3071593\nModell: LS32AG520PUXEN\nEAN: 8806092784086\nZum Hersteller: www.samsung.com\nProduktbeschreibung: Samsung Odyssey G5 S32AG500PU - LED-Monitor - QHD - 80 cm (32\") - HDR\nGer\u00e4tetyp: LED-hintergrundbeleuchteter LCD-Monitor - 80 cm (32\")\nEnergie Effizienzklasse: Klasse G\nEnergieverbrauch pro Jahr: 53 kWh\nAdaptive-Sync Technologie: NVIDIA G-SYNC Compatible, AMD FreeSync Premium\nBildschirmtyp: IPS\nSeitenverh\u00e4ltnis: 16:9\nNative Aufl\u00f6sung: QHD 2560 x 1440 bei 165 Hz\nHelligkeit: 350 cd/m\u00b2\nKontrast: 1000:1\nHDR-f\u00e4hig: HDR10\nReaktionszeit: 1 ms (Gray-to-Gray)\nEingangsanschl\u00fcsse: HDMI, DisplayPort\nEinstellungen der Anzeigeposition: H\u00f6he, Pivot (Rotation), Drehung, Neigung\nSpannung: Wechselstrom 100-240 V\nFarbe: Schwarz\nAbmessungen (Breite x Tiefe x H\u00f6he) - mit Fu\u00df: 71.46 cm x 31.11 cm x 60.29 cm\nGewicht: 7.5 kg\nDisplay-Typ: LED-hintergrundbeleuchteter LCD-Monitor / TFT-Aktivmatrix\nEnergieklasse (HDR): Klasse G\nDiagonalabmessung: 80 cm (32\")\nHDR-Format: HDR10\nHorizontaler Betrachtungswinkel: 178\nVertikaler Betrachtungswinkel: 178\nHintergrundbeleuchtungs-Technologie: LED-Hintergrundbeleuchtung\nBesonderheiten: Cinema Mode, CustomColor Mode, konfigurierbare OSD-Schaltfl\u00e4chen, FPS Mode, Mega Infinity Dynamic Contrast Ratio, flimmerfreie Technologie, RTS Mode, Eye Saver Mode, Screen Size Optimizer, RPG Mode, AOS Mode, sRGB Mode, Off Timer, Dynamic Contrast Mode, Low Input Delay Mode, Super Arena Gaming Experience, Aktualisierungsraten-Optimierer, Ultrawide Game View, Auto Source Switch\nAbmessungen (Breite x Tiefe x H\u00f6he): 71.46 cm x 31.11 cm x 60.29 cm - mit Fu\u00df\nSchnittstellen: DisplayPort 1.2  HDMI  Kopfh\u00f6rer\nNeigungswinkel: -11/+15\nSchwenkwinkel: 30\nRotationswinkel: -2/+92\nH\u00f6heneinstellung: 120 mm\nVESA-Halterung: 100 x 100 mm\nLeistungsmerkmale: Slot f\u00fcr Sicherheitsschloss (Kabelschloss getrennt erh\u00e4ltlich)\nEnthaltene Kabel: 1 x DisplayPort-Kabel\nSchlosstyp zur Diebstahlsicherung: Kensington Slot\nEingangsspannung: Wechselstrom 100-240 V\nStromverbrauch SDR (eingeschaltet): 36 kWh/1.000 h\nStromverbrauch HDR (eingeschaltet): 61 kWh/1.000 h\nStromverbrauch (typisch): 36 Watt\nStromverbrauch (max.): 59 Watt\nStromverbrauch im Standby-Modus: 0.5 Watt\nStromverbrauch (Aus-Modus): 0.3 Watt\nDetails zu Abmessungen & Gewicht: Mit Fu\u00df - Breite: 71.46 cm - Tiefe: 31.11 cm - H\u00f6he: 60.29 cm - Gewicht: 7.5 kg  Ohne Fu\u00df - Breite: 71.46 cm - Tiefe: 9.15 cm - H\u00f6he: 44.06 cm - Gewicht: 5.6 kg\nTransportbreite: 80.2 cm\nTransporttiefe: 17.6 cm\nTransporth\u00f6he: 54.5 cm\nTransportgewicht: 9.7 kg",
    "reference_file": "offer_reference_600.json",
    "shop_name": "Proshop.at"
}