{
    "html_file": "offer_439_13.html",
    "name": "MSI PRO MP273QPDE, 27\"",
    "offer_link": "https://ms-it-beratung.at/shop/details.php?art=424785&artname=MSI+68%2C6cm++%2827%22%29+IPS+WQHD+PRO+MP273QPDE++HDMI%2FDP%2F4ms%2FPivot",
    "price": 305.0,
    "raw_specifications": {
        "Aktiver Anzeigebereich (mm)": "596.736(H)x335.664(V)",
        "Aufl\u00f6sung": "2560x1440 (WQHD)",
        "Bildschirmgr\u00f6\u00dfe": "27\" (69 cm)",
        "Bildwiederholrate": "75Hz",
        "Blickwinkel": "178\u00b0(H)/178\u00b0(V)",
        "DCR (Dynamic Contrast Ratio)": "100000000:1",
        "DisplayPort": "1",
        "DisplayPort HDCP Version": "1.3",
        "DisplayPort-Version": "1.2a",
        "Displayfarben": "16.7M",
        "Farbe": "ID1/Black-Black",
        "Farbtiefe (bit)": "8 bits",
        "G-SyncFreeSync": "FreeSync",
        "HDMI\u0099": "2",
        "HDMI\u0099 HDCP version": "1.4",
        "HDMI\u0099-Version": "1.4b",
        "Helligkeit (nits)": "350",
        "Kontrastverh\u00e4ltnis": "1000:1",
        "Kopfh\u00f6rerausgang": "1",
        "Kr\u00fcmmung": "Flat",
        "Lautsprecher": "2",
        "Lock Typ": "Kensington Lock",
        "Oberfl\u00e4chenbehandlung": "Anti-glare",
        "Panel-Art": "IPS",
        "Reaktionszeit (MPRT)": "1ms(MPRT)",
        "Seitenverh\u00e4ltnis": "16:9",
        "Signalfrequenz": "69.7~112.7 KHz(H) / 48~75 Hz(V)"
    },
    "raw_specifications_text": "Farbe: ID1/Black-Black\nBildschirmgr\u00f6\u00dfe: 27\" (69 cm)\nAktiver Anzeigebereich (mm): 596.736(H)x335.664(V)\nKr\u00fcmmung: Flat\nPanel-Art: IPS\nAufl\u00f6sung: 2560x1440 (WQHD)\nSeitenverh\u00e4ltnis: 16:9\nG-SyncFreeSync: FreeSync\nHelligkeit (nits): 350\nKontrastverh\u00e4ltnis: 1000:1\nDCR (Dynamic Contrast Ratio): 100000000:1\nSignalfrequenz: 69.7~112.7 KHz(H) / 48~75 Hz(V)\nBildwiederholrate: 75Hz\nReaktionszeit (MPRT): 1ms(MPRT)\nBlickwinkel: 178\u00b0(H)/178\u00b0(V)\nOberfl\u00e4chenbehandlung: Anti-glare\nDisplayfarben: 16.7M\nFarbtiefe (bit): 8 bits\nDisplayPort: 1\nHDMI\u0099: 2\nHDMI\u0099-Version: 1.4b\nHDMI\u0099 HDCP version: 1.4\nDisplayPort-Version: 1.2a\nDisplayPort HDCP Version: 1.3\nKopfh\u00f6rerausgang: 1\nLock Typ: Kensington Lock\nLautsprecher: 2",
    "reference_file": "offer_reference_439.json",
    "shop_name": "ms-it-beratung"
}