{
    "html_file": "offer_1699_32.html",
    "name": "Lenovo ThinkCentre Tiny-in-One 27 (11JH), 27\"",
    "offer_link": "https://ms-it-beratung.at/shop/details.php?art=351723&artname=Lenovo+ThinkCentre+TiO+27+++%2827%22%29+++2560x1440+DP+WEBCAM",
    "price": 473.0,
    "raw_specifications": {
        "Anzahl DisplayPort Anschl\u00fcsse": "1",
        "Anzahl der Lautsprecher": "2",
        "Anzahl der nachgeschalteten Steckpl\u00e4tze vom Typ USB-A": "2",
        "Bildschirmdiagonale": "68,6 cm (27\")",
        "Bildschirmform": "Flach",
        "Bildschirmtechnologie": "LED",
        "Bildwinkel, horizontal": "178\u00b0",
        "Bildwinkel, vertikal": "178\u00b0",
        "Breite (ohne Standfu\u00df)": "614 mm",
        "DDC/CI": "Ja",
        "DVI Anschluss": "Nein",
        "Display-Aufl\u00f6sung": "2560 x 1440 Pixel",
        "Eingebaute Lautsprecher": "Ja",
        "Energieeffizienzklasse (SDR)": "G",
        "Energieeffizienzskala": "A bis G",
        "Energieverbrauch (SDR) pro 1.000 Stunden": "34 kWh",
        "Ger\u00e4tebreite (inkl. Fu\u00df)": "614 mm",
        "Ger\u00e4teh\u00f6he (inkl. Fu\u00df)": "444,2 mm",
        "Ger\u00e4tetiefe (inkl. Fu\u00df)": "329 mm",
        "Gewicht (mit St\u00e4nder)": "7,95 kg",
        "Gewicht (ohne St\u00e4nder)": "4,91 kg",
        "Gleichstrom-Anschluss (DC)": "Ja",
        "HD-Typ": "Quad HD",
        "HDMI": "Ja",
        "Helligkeit (typisch)": "350 cd/m\u00b2",
        "H\u00f6he (ohne Standfu\u00df)": "413,1 mm",
        "H\u00f6heneinstellung": "11 cm",
        "H\u00f6henverstellung": "Ja",
        "Integrierte Kamera": "Ja",
        "Integrierter USB-Hub": "Ja",
        "Kabelsperre-Slot": "Ja",
        "Kontrastverh\u00e4ltnis": "1000:1",
        "Marktpositionierung": "Business",
        "Maximale Bildwiederholrate": "75 Hz",
        "Mitgelieferte Kabel": "AC",
        "Nachhaltigkeitszertifikate": "RoHS, EPEAT Silver, ENERGY STAR",
        "Natives Seitenverh\u00e4ltnis": "16:9",
        "Neigungsverstellung": "Ja",
        "Neigungswinkelbereich": "-5 - 35\u00b0",
        "Panel-Montage-Schnittstelle": "100 x 100 mm",
        "Panel-Typ": "IPS",
        "Pivot": "Ja",
        "Pivot Winkel": "-5 - 90\u00b0",
        "Pixeldichte": "109 ppi",
        "Produktfarbe": "Schwarz",
        "RMS-Leistung": "4 W",
        "Reaktionszeit": "14 ms",
        "Reaktionszeit (schnell)": "4 ms",
        "Schwenkbar": "Ja",
        "Schwenkwinkelbereich": "-45 - 45\u00b0",
        "Seitenverh\u00e4ltnis": "16:9",
        "Sichtbare Gr\u00f6\u00dfe (horizontal)": "59,7 cm",
        "Sichtbare Gr\u00f6\u00dfe (vertikal)": "33,6 cm",
        "Slot-Typ Kabelsperre": "Kensington",
        "Stromadapter enthalten": "Ja",
        "Stromverbrauch (Standardbetrieb)": "37 W",
        "Stromverbrauch (Standby)": "0,5 W",
        "St\u00e4nder enthalten": "Ja",
        "Tiefe (ohne Standfu\u00df)": "73,9 mm",
        "Touchscreen": "Nein",
        "Typ der Hintergrundbeleuchtung": "W-LED",
        "USB-Hub-Version": "3.2 Gen 1 (3.1 Gen 1)",
        "USB-Upstream-Porttyp": "USB Typ-B",
        "Unterst\u00fctzte Grafik-Aufl\u00f6sungen": "640 x 350, 640 x 480 (VGA), 720 x 400, 800 x 600 (SVGA), 1024 x 768 (XGA), 1152 x 864 (XGA+), 1280 x 1024 (SXGA), 1280 x 768 (WXGA), 1280 x 800 (WXGA), 1366 ? 768, 1440 x 900 (WXGA+), 1600 x 1200 (UXGA), 1680 x 1050 (WSXGA+), 1920 x 1080 (HD 1080), 2560 x 1440",
        "VESA-Halterung": "Ja",
        "Warentarifnummer (HS)": "85285210",
        "Zertifizierung": "VESA DDC/CI, VESA DPMS, SO 9241-307, TUV Eye Comfort, FCC Class B, TCO 8.0, TCO Edge 2.0, WEEE, ULE Gold, TUV, VOC",
        "sRGB Abdeckung (klassisch)": "99%"
    },
    "raw_specifications_text": "Bildschirmdiagonale: 68,6 cm (27\")\nDisplay-Aufl\u00f6sung: 2560 x 1440 Pixel\nNatives Seitenverh\u00e4ltnis: 16:9\nBildschirmtechnologie: LED\nTouchscreen: Nein\nHD-Typ: Quad HD\nPanel-Typ: IPS\nTyp der Hintergrundbeleuchtung: W-LED\nHelligkeit (typisch): 350 cd/m\u00b2\nReaktionszeit: 14 ms\nBildschirmform: Flach\nUnterst\u00fctzte Grafik-Aufl\u00f6sungen: 640 x 350, 640 x 480 (VGA), 720 x 400, 800 x 600 (SVGA), 1024 x 768 (XGA), 1152 x 864 (XGA+), 1280 x 1024 (SXGA), 1280 x 768 (WXGA), 1280 x 800 (WXGA), 1366 ? 768, 1440 x 900 (WXGA+), 1600 x 1200 (UXGA), 1680 x 1050 (WSXGA+), 1920 x 1080 (HD 1080), 2560 x 1440\nSeitenverh\u00e4ltnis: 16:9\nKontrastverh\u00e4ltnis: 1000:1\nMaximale Bildwiederholrate: 75 Hz\nBildwinkel, horizontal: 178\u00b0\nBildwinkel, vertikal: 178\u00b0\nReaktionszeit (schnell): 4 ms\nPixeldichte: 109 ppi\nSichtbare Gr\u00f6\u00dfe (horizontal): 59,7 cm\nSichtbare Gr\u00f6\u00dfe (vertikal): 33,6 cm\nDDC/CI: Ja\nsRGB Abdeckung (klassisch): 99%\nEingebaute Lautsprecher: Ja\nIntegrierte Kamera: Ja\nAnzahl der Lautsprecher: 2\nRMS-Leistung: 4 W\nMarktpositionierung: Business\nProduktfarbe: Schwarz\nZertifizierung: VESA DDC/CI, VESA DPMS, SO 9241-307, TUV Eye Comfort, FCC Class B, TCO 8.0, TCO Edge 2.0, WEEE, ULE Gold, TUV, VOC\nIntegrierter USB-Hub: Ja\nUSB-Hub-Version: 3.2 Gen 1 (3.1 Gen 1)\nUSB-Upstream-Porttyp: USB Typ-B\nAnzahl der nachgeschalteten Steckpl\u00e4tze vom Typ USB-A: 2\nDVI Anschluss: Nein\nHDMI: Ja\nAnzahl DisplayPort Anschl\u00fcsse: 1\nGleichstrom-Anschluss (DC): Ja\nVESA-Halterung: Ja\nPanel-Montage-Schnittstelle: 100 x 100 mm\nKabelsperre-Slot: Ja\nSlot-Typ Kabelsperre: Kensington\nH\u00f6henverstellung: Ja\nH\u00f6heneinstellung: 11 cm\nPivot: Ja\nPivot Winkel: -5 - 90\u00b0\nSchwenkbar: Ja\nSchwenkwinkelbereich: -45 - 45\u00b0\nNeigungswinkelbereich: -5 - 35\u00b0\nNeigungsverstellung: Ja\nEnergieeffizienzklasse (SDR): G\nEnergieverbrauch (SDR) pro 1.000 Stunden: 34 kWh\nStromverbrauch (Standardbetrieb): 37 W\nStromverbrauch (Standby): 0,5 W\nEnergieeffizienzskala: A bis G\nSt\u00e4nder enthalten: Ja\nMitgelieferte Kabel: AC\nStromadapter enthalten: Ja\nGer\u00e4tebreite (inkl. Fu\u00df): 614 mm\nGer\u00e4tetiefe (inkl. Fu\u00df): 329 mm\nGer\u00e4teh\u00f6he (inkl. Fu\u00df): 444,2 mm\nGewicht (mit St\u00e4nder): 7,95 kg\nBreite (ohne Standfu\u00df): 614 mm\nTiefe (ohne Standfu\u00df): 73,9 mm\nH\u00f6he (ohne Standfu\u00df): 413,1 mm\nGewicht (ohne St\u00e4nder): 4,91 kg\nNachhaltigkeitszertifikate: RoHS, EPEAT Silver, ENERGY STAR\nWarentarifnummer (HS): 85285210",
    "reference_file": "offer_reference_1699.json",
    "shop_name": "ms-it-beratung"
}