{
    "html_file": "offer_676_4.html",
    "name": "Philips Evnia 5000 32M1C5500VL, 31.5\"",
    "offer_link": "https://www.amazon.de/dp/B0BH569RTQ?linkCode=xm2&camp=2025&creative=165953&smid=A3JWKAKR8XB7XF&creativeASIN=B0BH569RTQ&tag=geizhals1-21",
    "price": 267.23,
    "raw_specifications": {
        "ASIN": "B0BH569RTQ",
        "Amazon Bestseller-Rang": "Nr. 69,102 in Computer & Zubeh\u00f6r (Siehe Top 100 in Computer & Zubeh\u00f6r)  Nr. 1,301 in Monitore",
        "Anzahl HDMI Schnittstellen": "\u200e2",
        "Artikelgewicht": "\u200e7,83 Kilograms",
        "Batterien enthalten": "\u200eNein",
        "Bildschirmaufl\u00f6sung": "\u200e1440 x 2160",
        "Display-Gr\u00f6\u00dfe": "\u200e31,5 Zoll",
        "Durchschnittliche Kundenbewertung": "4,4  4,4 von 5 Sternen    \n    167 Sternebewertungen   \n\n\n 4,4 von 5 Sternen",
        "Farbe": "\u200eschwarz",
        "Garantierte Software-Updates bis": "\u200eunbekannt",
        "Hersteller": "\u200ePhilips",
        "Im Angebot von Amazon.de seit": "31. August 2022",
        "L\u00f6sung": "\u200e2560 x 1440 Pixels",
        "Marke": "\u200ePhilips Monitors",
        "Modellnummer": "\u200e32M1C5500VL/00",
        "Produktabmessungen": "\u200e22,7 x 78,2 x 52,3 cm; 7,83 Kilogramm",
        "Prozessortyp": "\u200eOthers"
    },
    "raw_specifications_text": "Marke: \u200ePhilips Monitors\nHersteller: \u200ePhilips\nProduktabmessungen: \u200e22,7 x 78,2 x 52,3 cm; 7,83 Kilogramm\nModellnummer: \u200e32M1C5500VL/00\nFarbe: \u200eschwarz\nDisplay-Gr\u00f6\u00dfe: \u200e31,5 Zoll\nBildschirmaufl\u00f6sung: \u200e1440 x 2160\nL\u00f6sung: \u200e2560 x 1440 Pixels\nProzessortyp: \u200eOthers\nAnzahl HDMI Schnittstellen: \u200e2\nBatterien enthalten: \u200eNein\nArtikelgewicht: \u200e7,83 Kilograms\nGarantierte Software-Updates bis: \u200eunbekannt\nASIN: B0BH569RTQ\nDurchschnittliche Kundenbewertung: 4,4  4,4 von 5 Sternen    \n    167 Sternebewertungen   \n\n\n 4,4 von 5 Sternen\nAmazon Bestseller-Rang: Nr. 69,102 in Computer & Zubeh\u00f6r (Siehe Top 100 in Computer & Zubeh\u00f6r)  Nr. 1,301 in Monitore\nIm Angebot von Amazon.de seit: 31. August 2022",
    "reference_file": "offer_reference_676.json",
    "shop_name": "Amazon.at"
}