{
    "html_file": "offer_1871_1.html",
    "name": "Philips B-line 273B9, 27\"",
    "offer_link": "https://www.alternate.at/Philips/273B9-00-LED-Monitor/html/product/1829533?partner=AtGeizhalsat&campaign=Monitor/Philips/1829533",
    "price": 176.9,
    "raw_specifications": {
        "": "Adaptive-Sync, Kensington-Schloss",
        "Abmessungen": "Breite: 61,4 cm x H\u00f6he: 55,8 cm x Tiefe/L\u00e4nge: 22,4 cm",
        "Anschl\u00fcsse": "1x USB-C",
        "Bild": "Format",
        "Bildschirmaufl\u00f6sung": "1.920 x 1.080 Pixel",
        "Bildschirmdiagonale": "69 cm (27 Zoll)",
        "EAN": "8712581764197",
        "Energieeffizienzklasse (SDR)": "E (A - G)",
        "Energieverbauch pro 1000 Stunden (SDR)": "21 kWh",
        "Ergonomie": "Typ",
        "Farbe": "schwarz",
        "Features": "SmartErgo Base, SmartImage Funktion, Flimmerfreie LEDs, LowBlue Modus, EasyRead Modus, 65 Watt USB-C PD, PowerSensor",
        "Gewicht": "7 kg",
        "Hersteller-Nr.": "273B9/00",
        "Lautsprecher": "Ausgangsleistung",
        "Leistungsaufnahme im Bereitschafts- und Aus-Zustand": "0,5 Watt",
        "Leistungsaufnahme im Ein-Zustand bei Standard-Dynamikumfang (SDR)": "21 Watt",
        "Stromversorgung": "Eco-Off",
        "Typ": "LED-Monitor",
        "Wandhalterung": "VESA kompatibel (100 x 100 mm)",
        "Zubeh\u00f6r": "Vorhanden"
    },
    "raw_specifications_text": "Energieeffizienzklasse (SDR): E (A - G)\nEnergieverbauch pro 1000 Stunden (SDR): 21 kWh\nLeistungsaufnahme im Ein-Zustand bei Standard-Dynamikumfang (SDR): 21 Watt\nLeistungsaufnahme im Bereitschafts- und Aus-Zustand: 0,5 Watt\nBildschirmdiagonale: 69 cm (27 Zoll)\nBildschirmaufl\u00f6sung: 1.920 x 1.080 Pixel\nTyp: LED-Monitor\nFarbe: schwarz\nEAN: 8712581764197\nHersteller-Nr.: 273B9/00\nBild: Format\n: Adaptive-Sync, Kensington-Schloss\nAnschl\u00fcsse: 1x USB-C\nErgonomie: Typ\nStromversorgung: Eco-Off\nLautsprecher: Ausgangsleistung\nWandhalterung: VESA kompatibel (100 x 100 mm)\nFeatures: SmartErgo Base, SmartImage Funktion, Flimmerfreie LEDs, LowBlue Modus, EasyRead Modus, 65 Watt USB-C PD, PowerSensor\nZubeh\u00f6r: Vorhanden\nAbmessungen: Breite: 61,4 cm x H\u00f6he: 55,8 cm x Tiefe/L\u00e4nge: 22,4 cm\nGewicht: 7 kg",
    "reference_file": "offer_reference_1871.json",
    "shop_name": "Alternate.at"
}