{
    "html_file": "offer_974_0.html",
    "name": "Eizo FlexScan EV2490 schwarz, 23.8\"",
    "offer_link": "https://www.proshop.at/Bildschirm/EIZO-24-Bildschirm-FlexScan-Black-5-ms/3069147?utm_source=geizhals&utm_medium=cpc&utm_campaign=pricesite",
    "price": 337.93,
    "raw_specifications": {
        "Abmessungen (Breite x Tiefe x H\u00f6he)": "53.78 cm x 33.24 cm x 23 cm - mit Fu\u00df",
        "Abmessungen (Breite x Tiefe x H\u00f6he) - mit Fu\u00df": "53.78 cm x 33.24 cm x 23 cm",
        "Ausgangsleistung/Kanal": "1 Watt",
        "Besonderheiten": "sRGB-Farbmanagement, Auto EcoView, The Paper Mode, flimmerfreie Technologie, Blaulichtfilter-Technologie, Power Saving Mode, 100 x 100 VESA-Halterung",
        "Bildschirmtyp": "IPS",
        "Daisy-Chaining": "Ja",
        "Details zu Abmessungen & Gewicht": "Mit Fu\u00df - Breite: 53.78 cm - Tiefe: 33.24 cm - H\u00f6he: 23 cm - Gewicht: 7.2 kg  Ohne Fu\u00df - Breite: 53.78 cm - Tiefe: 5.74 cm - H\u00f6he: 32.04 cm - Gewicht: 4.5 kg",
        "Diagonalabmessung": "60.5 cm (23.8\")",
        "Display-Typ": "LED-hintergrundbeleuchteter LCD-Monitor / TFT-Aktivmatrix",
        "EAN": "4995047063315",
        "ENERGY STAR zertifiziert": "Ja",
        "Eingangsanschl\u00fcsse": "HDMI, DisplayPort, USB-C",
        "Eingangsspannung": "Wechselstrom 120/230 V (50/60 Hz)",
        "Einstellungen der Anzeigeposition": "H\u00f6he, Pivot (Rotation), Drehung, Neigung",
        "Enthaltene Kabel": "1 x USB-C Kabel - 2 m",
        "Ethernet integriert": "Ja",
        "Farbe": "Schwarz",
        "Farbraum": "100% sRGB",
        "Farbunterst\u00fctzung": "16,7 Millionen Farben",
        "Ger\u00e4tetyp": "LED-hintergrundbeleuchteter LCD-Monitor - 60.5 cm (23.8\")",
        "Gewicht": "7.2 kg",
        "Helligkeit": "250 cd/m\u00b2",
        "Hersteller": "EIZO",
        "Hintergrundbeleuchtungs-Technologie": "LED-Hintergrundbeleuchtung",
        "Horizontale Bildwiederholrate": "31 - 68 kHz",
        "Horizontaler Betrachtungswinkel": "178",
        "H\u00f6heneinstellung": "191.2 mm",
        "Integrierte Peripherieger\u00e4te": "USB 3.1 Gen.1 Hub",
        "Kennzeichnung": "FCC Klasse B bescheinigt, TUV, TUV GS, GS, TUV S, CB, CCC, TUV Ergo, RoHS, WEEE, PSE Mark, cTUVus, China Energy Label Level 2, EPA, VCCI Class B, EAC, China RoHS, RCM, CAN ICES-3 Class B, TUV LBL",
        "Kontrast": "1000:1",
        "Leistungsmerkmale": "Abnehmbarer St\u00e4nder, Unterst\u00fctzung f\u00fcr VESA-Schnittstelle",
        "Mitgelieferte Software": "EIZO Screen InStyle",
        "Modell": "EV2490-BK",
        "Native Aufl\u00f6sung": "Full HD (1080p) 1920 x 1080 bei 60 Hz",
        "Neigungswinkel": "-5/+35",
        "OSD-Sprachen": "Chinesisch (tradionell), Chinesisch (vereinfacht), Englisch, Deutsch, Franz\u00f6sisch, Italienisch, Schwedisch, Spanisch, Japanisch",
        "Pixelpitch": "0.275 mm",
        "Ppi": "93",
        "Produktbeschreibung": "EIZO FlexScan EV2490-BK - mit FlexStand - LED-Monitor - Full HD (1080p) - 60.5 cm (23.8\")",
        "Reaktionszeit": "5 ms (Gray-to-Gray)",
        "Rotationswinkel": "180",
        "Schnittstellen": "HDMI (HDCP 1.4)  DisplayPort (HDCP 1.3)  USB-C (HDCP 1.3)  USB 3.1 Gen 1 Upstream (Typ B)  Kopfh\u00f6rer (Mini-Klinkenstecker)  USB-C 3.1 Gen 1 Upstream/DisplayPort Alt Mode mit Spannungsversorgung (bis zu 70 W)  3 x USB 3.1 Gen 1 Downstream (Typ A)  USB-C 3.1 Downstream mit Spannungsversorgung (bis zu 15 W)  LAN (RJ-45)",
        "Schwenkwinkel": "344",
        "Seitenverh\u00e4ltnis": "16:9",
        "Spannung": "Wechselstrom 120/230 V (50/60 Hz)",
        "Stromverbrauch (max.)": "155 Watt",
        "Stromverbrauch (typisch)": "11 Watt",
        "Stromverbrauch im Standby-Modus": "0.5 Watt",
        "Typ": "Lautsprecher - Stereo",
        "Umweltschutzstandards": "ENERGY STAR-qualifiziert",
        "VESA-Halterung": "100 x 100 mm",
        "Vertikale Bildwiederholrate": "59 - 61 Hz",
        "Vertikaler Betrachtungswinkel": "178",
        "Waren-Nr.": "3069147",
        "Zum Hersteller": "www.eizo.com"
    },
    "raw_specifications_text": "Hersteller: EIZO\nWaren-Nr.: 3069147\nModell: EV2490-BK\nEAN: 4995047063315\nZum Hersteller: www.eizo.com\nProduktbeschreibung: EIZO FlexScan EV2490-BK - mit FlexStand - LED-Monitor - Full HD (1080p) - 60.5 cm (23.8\")\nGer\u00e4tetyp: LED-hintergrundbeleuchteter LCD-Monitor - 60.5 cm (23.8\")\nDaisy-Chaining: Ja\nLeistungsmerkmale: Abnehmbarer St\u00e4nder, Unterst\u00fctzung f\u00fcr VESA-Schnittstelle\nBildschirmtyp: IPS\nSeitenverh\u00e4ltnis: 16:9\nNative Aufl\u00f6sung: Full HD (1080p) 1920 x 1080 bei 60 Hz\nPixelpitch: 0.275 mm\nHelligkeit: 250 cd/m\u00b2\nKontrast: 1000:1\nReaktionszeit: 5 ms (Gray-to-Gray)\nFarbunterst\u00fctzung: 16,7 Millionen Farben\nFarbraum: 100% sRGB\nEingangsanschl\u00fcsse: HDMI, DisplayPort, USB-C\nEthernet integriert: Ja\nEinstellungen der Anzeigeposition: H\u00f6he, Pivot (Rotation), Drehung, Neigung\nSpannung: Wechselstrom 120/230 V (50/60 Hz)\nFarbe: Schwarz\nAbmessungen (Breite x Tiefe x H\u00f6he) - mit Fu\u00df: 53.78 cm x 33.24 cm x 23 cm\nGewicht: 7.2 kg\nUmweltschutzstandards: ENERGY STAR-qualifiziert\nKennzeichnung: FCC Klasse B bescheinigt, TUV, TUV GS, GS, TUV S, CB, CCC, TUV Ergo, RoHS, WEEE, PSE Mark, cTUVus, China Energy Label Level 2, EPA, VCCI Class B, EAC, China RoHS, RCM, CAN ICES-3 Class B, TUV LBL\nDisplay-Typ: LED-hintergrundbeleuchteter LCD-Monitor / TFT-Aktivmatrix\nDiagonalabmessung: 60.5 cm (23.8\")\nIntegrierte Peripherieger\u00e4te: USB 3.1 Gen.1 Hub\nPpi: 93\nVertikale Bildwiederholrate: 59 - 61 Hz\nHorizontale Bildwiederholrate: 31 - 68 kHz\nHorizontaler Betrachtungswinkel: 178\nVertikaler Betrachtungswinkel: 178\nHintergrundbeleuchtungs-Technologie: LED-Hintergrundbeleuchtung\nOSD-Sprachen: Chinesisch (tradionell), Chinesisch (vereinfacht), Englisch, Deutsch, Franz\u00f6sisch, Italienisch, Schwedisch, Spanisch, Japanisch\nBesonderheiten: sRGB-Farbmanagement, Auto EcoView, The Paper Mode, flimmerfreie Technologie, Blaulichtfilter-Technologie, Power Saving Mode, 100 x 100 VESA-Halterung\nAbmessungen (Breite x Tiefe x H\u00f6he): 53.78 cm x 33.24 cm x 23 cm - mit Fu\u00df\nTyp: Lautsprecher - Stereo\nAusgangsleistung/Kanal: 1 Watt\nSchnittstellen: HDMI (HDCP 1.4)  DisplayPort (HDCP 1.3)  USB-C (HDCP 1.3)  USB 3.1 Gen 1 Upstream (Typ B)  Kopfh\u00f6rer (Mini-Klinkenstecker)  USB-C 3.1 Gen 1 Upstream/DisplayPort Alt Mode mit Spannungsversorgung (bis zu 70 W)  3 x USB 3.1 Gen 1 Downstream (Typ A)  USB-C 3.1 Downstream mit Spannungsversorgung (bis zu 15 W)  LAN (RJ-45)\nNeigungswinkel: -5/+35\nSchwenkwinkel: 344\nRotationswinkel: 180\nH\u00f6heneinstellung: 191.2 mm\nVESA-Halterung: 100 x 100 mm\nEnthaltene Kabel: 1 x USB-C Kabel - 2 m\nEingangsspannung: Wechselstrom 120/230 V (50/60 Hz)\nStromverbrauch (typisch): 11 Watt\nStromverbrauch (max.): 155 Watt\nStromverbrauch im Standby-Modus: 0.5 Watt\nMitgelieferte Software: EIZO Screen InStyle\nDetails zu Abmessungen & Gewicht: Mit Fu\u00df - Breite: 53.78 cm - Tiefe: 33.24 cm - H\u00f6he: 23 cm - Gewicht: 7.2 kg  Ohne Fu\u00df - Breite: 53.78 cm - Tiefe: 5.74 cm - H\u00f6he: 32.04 cm - Gewicht: 4.5 kg\nENERGY STAR zertifiziert: Ja",
    "reference_file": "offer_reference_974.json",
    "shop_name": "Proshop.at"
}