{
    "html_file": "offer_581_6.html",
    "name": "iiyama ProLite XB2483HSU-B5, 23.8\"",
    "offer_link": "https://www.playox.de/productredirect/index/sku/25932881?sPartner=p-geizhals-at&campaign=psm/geizhals-at/",
    "price": 138.3,
    "raw_specifications": {
        "Anschl\u00fcsse": "USB, DisplayPort, HDMI, Kopfh\u00f6reranschluss",
        "Artikelnummer": "25932881",
        "Aufl\u00f6sung Kurzname": "Full HD",
        "Bezeichnung des Herstellers": "Iiyama ProLiteXB2483HSU-B5 LED-Display 60,5 cm (23,8\")",
        "Bildwiederholungsrate": "75,00 Hz",
        "Breite": "349,00 mm",
        "Display Features": "FlickerFree",
        "Displaygr\u00f6\u00dfe": "60,96 cm (24 Zoll)",
        "Displayoberfl\u00e4che": "matt",
        "EEK - Spektrum": "AG",
        "Einsatzort": "Innen",
        "Energieeffizienzklasse": "E",
        "Geh\u00e4usefarbe des Ger\u00e4tes": "Schwarz",
        "Gewicht": "5,50 kg",
        "Gewicht inkl. Verpackung in Kg": "6,80 kg",
        "Helligkeit Bereich": "150 - 300 cd/m\u00b2",
        "Hersteller": "Iiyama",
        "H\u00f6he": "2095,00 mm",
        "Inhalt (ml oder g)": "0,00 ml",
        "Kapazit\u00e4t (Seiten)": "0",
        "Kontrastverh\u00e4ltnis (typisch) Bereich": "ab 1.200:1",
        "LCD-Technologie": "VA Panel",
        "L\u00e4nge": "5525,00 mm",
        "Produktart": "Monitore",
        "Reaktionszeit": "4,00 ms",
        "Seitenverh\u00e4ltnis": "16:9",
        "Shop Herstellernummer": "XB2483HSU-B5",
        "Standard-EAN": "4948570121564",
        "Verpackung - Breite in cm": "42,00 cm",
        "Verpackung - H\u00f6he in cm": "16,20 cm",
        "Verpackung - L\u00e4nge in cm": "62,70 cm",
        "max. Aufl\u00f6sung": "1.920 x 1.080 Pixel (16:9)"
    },
    "raw_specifications_text": "Geh\u00e4usefarbe des Ger\u00e4tes: Schwarz\nAnschl\u00fcsse: USB, DisplayPort, HDMI, Kopfh\u00f6reranschluss\nGewicht: 5,50 kg\nProduktart: Monitore\nHersteller: Iiyama\nDisplaygr\u00f6\u00dfe: 60,96 cm (24 Zoll)\nKontrastverh\u00e4ltnis (typisch) Bereich: ab 1.200:1\nHelligkeit Bereich: 150 - 300 cd/m\u00b2\nDisplay Features: FlickerFree\nInhalt (ml oder g): 0,00 ml\nKapazit\u00e4t (Seiten): 0\nAufl\u00f6sung Kurzname: Full HD\nEEK - Spektrum: AG\nVerpackung - Breite in cm: 42,00 cm\nBreite: 349,00 mm\nGewicht inkl. Verpackung in Kg: 6,80 kg\nVerpackung - H\u00f6he in cm: 16,20 cm\nH\u00f6he: 2095,00 mm\nArtikelnummer: 25932881\nStandard-EAN: 4948570121564\nShop Herstellernummer: XB2483HSU-B5\nBezeichnung des Herstellers: Iiyama ProLiteXB2483HSU-B5 LED-Display 60,5 cm (23,8\")\nL\u00e4nge: 5525,00 mm\nVerpackung - L\u00e4nge in cm: 62,70 cm\nmax. Aufl\u00f6sung: 1.920 x 1.080 Pixel (16:9)\nSeitenverh\u00e4ltnis: 16:9\nLCD-Technologie: VA Panel\nReaktionszeit: 4,00 ms\nDisplayoberfl\u00e4che: matt\nBildwiederholungsrate: 75,00 Hz\nEinsatzort: Innen\nEnergieeffizienzklasse: E",
    "reference_file": "offer_reference_581.json",
    "shop_name": "playox (AT)"
}