{
    "html_file": "offer_1990_17.html",
    "name": "MSI Optix G241, DE-Version, 23.8\"",
    "offer_link": "https://www.future-x.at/msi-optix-g241-led-monitor-60-cm-238-1920-x-1080-full-hd-1080p-ips-250-cd-m%B2-1000%3A1-1-ms-2xhdmi-displayport-p-8686940/?pv=2",
    "price": 238.0,
    "raw_specifications": {
        "AMD FreeSync": "Ja",
        "Anzahl DisplayPort Anschl\u00fcsse": "1",
        "Anzahl HDMI-Anschl\u00fcsse": "2",
        "Anzahl der Farben des Displays": "16.78 million colors",
        "Audioanschl\u00fcsse": "Nein",
        "Bildschirmaufl\u00f6sung": "1920 x 1080 Pixel",
        "Bildschirmdiagonale": "60,5 cm",
        "Bildschirmform": "Flach",
        "Bildschirmtechnologie": "LED",
        "Blickwinkel, horizontal": "178 \u00b0",
        "Blickwinkel, vertikal": "178 \u00b0",
        "Breite": "540,3 mm",
        "DVI Anschluss": "Nein",
        "Digital horizontale Frequenz": "47 - 145 kHz",
        "DisplayPorts-Version": "1.2a",
        "Eingebaute Lautsprecher": "Nein",
        "Energy Star-zertifiziert": "Nein",
        "Gewicht": "3,3 kg",
        "HD-Typ": "Full HD",
        "HDMI": "Ja",
        "HDMI-Version": "1.4b",
        "Helligkeit (typisch)": "250 cd/m\u00b2",
        "Horizontaler Scanbereich": "30 - 100 kHz",
        "H\u00f6he": "422,6 mm",
        "H\u00f6henverstellung": "Nein",
        "Integrierte Kamera": "Nein",
        "Integrierter USB-Hub": "Nein",
        "Kabelsperre-Slot": "Ja",
        "Kontrastverh\u00e4ltnis": "1000:1",
        "Kontrastverh\u00e4ltnis (dynamisch)": "100000000:1",
        "Kopfh\u00f6rer-Konnektivit\u00e4t": "3,5 mm",
        "Kopfh\u00f6rerausgang": "Ja",
        "Kopfh\u00f6rerausg\u00e4nge": "1",
        "Marktpositionierung": "Gaming",
        "Maximale Bildwiederholrate": "144 Hz",
        "NVIDIA G-SYNC": "Nein",
        "Natives Seitenverh\u00e4ltnis": "16:9",
        "Neigungsverstellung": "Ja",
        "Neigungswinkelbereich": "-5 - 20 \u00b0",
        "On-Screen-Display (OSD)": "Ja",
        "Paketgewicht": "5 kg",
        "Panel-Montage-Schnittstelle": "100 x 100 mm",
        "Panel-Typ": "IPS",
        "Pixel Abstand": "0,275 x 0,275 mm",
        "Produktfarbe": "Schwarz",
        "Rahmenloses Design": "Ja",
        "Reaktionszeit": "1 ms",
        "Slot-Typ Kabelsperre": "Kensington",
        "Tiefe": "219,6 mm",
        "Unterst\u00fctzte Grafik-Aufl\u00f6sungen": "1920 x 1080 (HD 1080)",
        "VESA Adaptive Sync support": "JaGewicht und Abmessungen",
        "VESA-Halterung": "Ja",
        "Verpackungsbreite": "606 mm",
        "Verpackungsh\u00f6he": "409 mm",
        "Verpackungstiefe": "172 mm",
        "sRGB Abdeckung (klassisch)": "128 %"
    },
    "raw_specifications_text": "Bildschirmdiagonale: 60,5 cm\nBildschirmaufl\u00f6sung: 1920 x 1080 Pixel\nNatives Seitenverh\u00e4ltnis: 16:9\nPanel-Typ: IPS\nHelligkeit (typisch): 250 cd/m\u00b2\nReaktionszeit: 1 ms\nHD-Typ: Full HD\nBildschirmtechnologie: LED\nBildschirmform: Flach\nUnterst\u00fctzte Grafik-Aufl\u00f6sungen: 1920 x 1080 (HD 1080)\nKontrastverh\u00e4ltnis: 1000:1\nKontrastverh\u00e4ltnis (dynamisch): 100000000:1\nMaximale Bildwiederholrate: 144 Hz\nBlickwinkel, horizontal: 178 \u00b0\nBlickwinkel, vertikal: 178 \u00b0\nAnzahl der Farben des Displays: 16.78 million colors\nPixel Abstand: 0,275 x 0,275 mm\nHorizontaler Scanbereich: 30 - 100 kHz\nDigital horizontale Frequenz: 47 - 145 kHz\nsRGB Abdeckung (klassisch): 128 %\nVESA-Halterung: Ja\nPanel-Montage-Schnittstelle: 100 x 100 mm\nKabelsperre-Slot: Ja\nSlot-Typ Kabelsperre: Kensington\nH\u00f6henverstellung: Nein\nNeigungsverstellung: Ja\nNeigungswinkelbereich: -5 - 20 \u00b0\nOn-Screen-Display (OSD): Ja\nEingebaute Lautsprecher: Nein\nIntegrierte Kamera: Nein\nIntegrierter USB-Hub: Nein\nDVI Anschluss: Nein\nHDMI: Ja\nAnzahl HDMI-Anschl\u00fcsse: 2\nHDMI-Version: 1.4b\nAnzahl DisplayPort Anschl\u00fcsse: 1\nDisplayPorts-Version: 1.2a\nAudioanschl\u00fcsse: Nein\nKopfh\u00f6rerausgang: Ja\nKopfh\u00f6rerausg\u00e4nge: 1\nKopfh\u00f6rer-Konnektivit\u00e4t: 3,5 mm\nMarktpositionierung: Gaming\nProduktfarbe: Schwarz\nEnergy Star-zertifiziert: Nein\nRahmenloses Design: Ja\nNVIDIA G-SYNC: Nein\nAMD FreeSync: Ja\nVESA Adaptive Sync support: JaGewicht und Abmessungen\nBreite: 540,3 mm\nTiefe: 219,6 mm\nH\u00f6he: 422,6 mm\nGewicht: 3,3 kg\nVerpackungsbreite: 606 mm\nVerpackungstiefe: 172 mm\nVerpackungsh\u00f6he: 409 mm\nPaketgewicht: 5 kg",
    "reference_file": "offer_reference_1990.json",
    "shop_name": "Future-X.at"
}