{
    "html_file": "offer_2118_20.html",
    "name": "Philips E-line 272E1CA, 27\"",
    "offer_link": "https://www.future-x.at/philips-e-line-272e1ca-led-monitor-gebogen-68-6-cm-27-1920-x-1080-full-hd-1080p-va-250-cd-m%B2-3000%3A1-4-ms-hdmi-vga-displayport-lautsprecher-textured-black-p-7699299/?pv=2",
    "price": 179.09,
    "raw_specifications": {
        "3D": "Nein",
        "Anzahl DisplayPort Anschl\u00fcsse": "1",
        "Anzahl HDMI Anschl\u00fcsse": "1",
        "Anzahl OSD-Sprachen": "21",
        "Anzahl VGA (D-Sub) Anschl\u00fcsse": "1",
        "Anzahl der Farben des Displays": "16.78 million colors",
        "Anzahl der Lautsprecher": "2",
        "Betriebsanleitung": "Ja",
        "Bildschirmaufl\u00f6sung": "1920 x 1080 Pixel",
        "Bildschirmdiagonale": "68,6 cm",
        "Bildschirmdiagonale (cm)": "68,6 cm",
        "Bildschirmdisplay (OSD)-Sprachen": "Simplified Chinese, Traditional Chinese, Czech, German, Dutch, English, Spanish, Finnish, French, Greek, Hungarian, Italian, Japanese, Korean, Polish, Portuguese, Russian, Swedish, Turkish, Ukrainian",
        "Bildschirmkr\u00fcmmung": "150 cm",
        "Bildschirmtechnologie": "LCD",
        "Blickwinkel, horizontal": "178 \u00b0",
        "Blickwinkel, vertikal": "178 \u00b0",
        "Breite": "611 mm",
        "DDC/CI": "Ja",
        "DVI Anschluss": "Nein",
        "Digital horizontale Frequenz": "30 - 85 kHz",
        "Digital vertikale Frequenz": "48 - 76 Hz",
        "Display-Oberfl\u00e4che": "Matt",
        "Ein-/Ausschalter": "Ja",
        "Eingebaute Lautsprecher": "Ja",
        "Farbskala": "83 %",
        "Flimmerfreie Technologie": "Ja",
        "Form des Bildschirms": "Geschwungen",
        "Fu\u00dffarbe": "Schwarz",
        "Ger\u00e4tebreite (inkl. Fu\u00df)": "611 mm",
        "Ger\u00e4teh\u00f6he (inkl. Fu\u00df)": "462 mm",
        "Ger\u00e4tetiefe (inkl. Fu\u00df)": "203 mm",
        "Gewicht": "3,85 kg",
        "Gewicht (mit Standfu\u00df)": "4,45 kg",
        "HD-Typ": "Full HD",
        "HDCP": "Ja",
        "HDMI": "Ja",
        "Helligkeit (typisch)": "250 cd/m\u00b2",
        "Hintergrundbeleuchtung": "W-LED",
        "H\u00f6he": "367 mm",
        "H\u00f6he bei Betrieb": "0 - 3658 mVerpackungsinformation",
        "H\u00f6he bei Lagerung": "0 - 12192 m",
        "H\u00f6henverstellung": "Nein",
        "Integrierte Kamera": "Nein",
        "Integrierter USB-Hub": "Nein",
        "Kabelsperre-Slot": "Ja",
        "Komponentenvideo-Synchronisation": "Separate sync,Sync-on-green (SOG)",
        "Kontrastverh\u00e4ltnis": "3000:1",
        "Kopfh\u00f6rer-Konnektivit\u00e4t": "3,5 mm",
        "Kopfh\u00f6rerausgang": "Ja",
        "Kopfh\u00f6rerausg\u00e4nge": "1",
        "LED-Anzeigen": "Operation,Stand-by",
        "Low-Blue-Light-Technologie": "Ja",
        "Luftfeuchtigkeit in Betrieb": "20 - 80 %",
        "Marktpositionierung": "Haus",
        "Maximale Bildwiederholrate": "75 Hz",
        "Mitgelieferte Kabel": "AC,Audio (3.5mm),HDMI",
        "Mittlere Betriebsdauer zwischen Ausf\u00e4llen (MTBF)": "50000 h",
        "Natives Seitenverh\u00e4ltnis": "16:9",
        "Neigungsverstellung": "Ja",
        "Neigungswinkelbereich": "-5 - 20 \u00b0",
        "Oberfl\u00e4chenh\u00e4rte": "3H",
        "On-Screen-Display (OSD)": "Ja",
        "PC Audio-Eingang": "Ja",
        "Paketgewicht": "6,9 kg",
        "Panel-Typ": "VA",
        "Pixel Abstand": "0,311 x 0,311 mm",
        "Pixeldichte": "82 ppi",
        "Plug & Play": "Ja",
        "Produktfarbe": "Schwarz",
        "RMS-Leistung": "6 W",
        "Reaktionszeit": "4 ms",
        "Recycelbares Material": "100 %",
        "Recycelbares Verpackungsmaterial": "100 %",
        "RoHS-Kompatibel": "Ja",
        "Schnellstart\u00fcbersicht": "Ja",
        "Schwermetallfrei": "Hg (mercury),Pb (lead)",
        "Seitenverh\u00e4ltnis": "16:9",
        "Separate H/V-Sync": "Ja",
        "Sichtbare Gr\u00f6\u00dfe (horizontal)": "59,8 cm",
        "Sichtbare Gr\u00f6\u00dfe (vertikal)": "33,6 cm",
        "Slot-Typ Kabelsperre": "Kensington",
        "Stromeingang": "Ja",
        "St\u00e4nder enthalten": "Ja",
        "Sync-On-Green (SOG)": "Ja",
        "TV Tuner integriert": "Nein",
        "Temperaturbereich bei Lagerung": "-20 - 60 \u00b0C",
        "Temperaturbereich in Betrieb": "0 - 40 \u00b0C",
        "Tiefe": "43 mm",
        "Unterst\u00fctzt Mac-Betriebssysteme": "Mac OS X 10.0 Cheetah,Mac OS X 10.1 Puma,Mac OS X 10.10 Yosemite,Mac OS X 10.11 El Capitan,Mac OS X 10.12 Sierra,Mac OS X 10.13 High Sierra,Mac OS X 10.14 Mojave,Mac OS X 10.2 Jaguar,Mac OS X 10.3 Panther,Mac OS X 10.4 Tiger,Mac OS X 10.5 Leopard,Mac OS X 10.6 Snow Leopard,Mac OS X 10.7 Lion,Mac OS X 10.8 Mountain Lion,Mac OS X 10.9 Mavericks",
        "Unterst\u00fctzt Windows-Betriebssysteme": "Windows 10,Windows 7,Windows 8,Windows 8.1",
        "Unterst\u00fctzte Grafik-Aufl\u00f6sungen": "1920 x 1080 (HD 1080)",
        "Unterst\u00fctzte Video-Modi": "1080p",
        "VESA Montageadapter": "100 x 100 mm",
        "VESA-Halterung": "Ja",
        "Verpackungsart": "Box",
        "Verpackungsbreite": "730 mm",
        "Verpackungsh\u00f6he": "538 mm",
        "Verpackungstiefe": "186 mm",
        "Vorderer Rahmen": "Schwarz",
        "Zertifizierung": "CE Mark, CU-EAC, TUV-BAUART",
        "sRGB": "Ja",
        "sRGB Abdeckung (klassisch)": "100 %"
    },
    "raw_specifications_text": "Eingebaute Lautsprecher: Ja\nIntegrierte Kamera: Nein\nTV Tuner integriert: Nein\nRMS-Leistung: 6 W\nAnzahl der Lautsprecher: 2\nRecycelbares Verpackungsmaterial: 100 %\nOberfl\u00e4chenh\u00e4rte: 3H\nGer\u00e4tetiefe (inkl. Fu\u00df): 203 mm\nGewicht: 3,85 kg\nH\u00f6he: 367 mm\nBreite: 611 mm\nGer\u00e4tebreite (inkl. Fu\u00df): 611 mm\nGewicht (mit Standfu\u00df): 4,45 kg\nGer\u00e4teh\u00f6he (inkl. Fu\u00df): 462 mm\nTiefe: 43 mm\nTemperaturbereich in Betrieb: 0 - 40 \u00b0C\nH\u00f6he bei Lagerung: 0 - 12192 m\nTemperaturbereich bei Lagerung: -20 - 60 \u00b0C\nLuftfeuchtigkeit in Betrieb: 20 - 80 %\nH\u00f6he bei Betrieb: 0 - 3658 mVerpackungsinformation\nBetriebsanleitung: Ja\nSchnellstart\u00fcbersicht: Ja\nMitgelieferte Kabel: AC,Audio (3.5mm),HDMI\nPaketgewicht: 6,9 kg\nVerpackungsart: Box\nVerpackungstiefe: 186 mm\nSt\u00e4nder enthalten: Ja\nVerpackungsh\u00f6he: 538 mm\nVerpackungsbreite: 730 mm\nProduktfarbe: Schwarz\nRoHS-Kompatibel: Ja\nZertifizierung: CE Mark, CU-EAC, TUV-BAUART\nSchwermetallfrei: Hg (mercury),Pb (lead)\nMittlere Betriebsdauer zwischen Ausf\u00e4llen (MTBF): 50000 h\nMarktpositionierung: Haus\nFu\u00dffarbe: Schwarz\nVorderer Rahmen: Schwarz\nEin-/Ausschalter: Ja\nAnzahl OSD-Sprachen: 21\nNeigungswinkelbereich: -5 - 20 \u00b0\nVESA Montageadapter: 100 x 100 mm\nSlot-Typ Kabelsperre: Kensington\nOn-Screen-Display (OSD): Ja\nNeigungsverstellung: Ja\nKabelsperre-Slot: Ja\nLED-Anzeigen: Operation,Stand-by\nPlug & Play: Ja\nBildschirmdisplay (OSD)-Sprachen: Simplified Chinese, Traditional Chinese, Czech, German, Dutch, English, Spanish, Finnish, French, Greek, Hungarian, Italian, Japanese, Korean, Polish, Portuguese, Russian, Swedish, Turkish, Ukrainian\nVESA-Halterung: Ja\nH\u00f6henverstellung: Nein\nRecycelbares Material: 100 %\nForm des Bildschirms: Geschwungen\nPixel Abstand: 0,311 x 0,311 mm\nDigital vertikale Frequenz: 48 - 76 Hz\nPanel-Typ: VA\nSeparate H/V-Sync: Ja\nFarbskala: 83 %\nReaktionszeit: 4 ms\nNatives Seitenverh\u00e4ltnis: 16:9\nDigital horizontale Frequenz: 30 - 85 kHz\nBlickwinkel, horizontal: 178 \u00b0\nHelligkeit (typisch): 250 cd/m\u00b2\nBildschirmdiagonale: 68,6 cm\nDDC/CI: Ja\nBlickwinkel, vertikal: 178 \u00b0\nSichtbare Gr\u00f6\u00dfe (horizontal): 59,8 cm\nDisplay-Oberfl\u00e4che: Matt\nMaximale Bildwiederholrate: 75 Hz\nBildschirmtechnologie: LCD\nBildschirmaufl\u00f6sung: 1920 x 1080 Pixel\nKontrastverh\u00e4ltnis: 3000:1\nsRGB Abdeckung (klassisch): 100 %\nHintergrundbeleuchtung: W-LED\nUnterst\u00fctzte Grafik-Aufl\u00f6sungen: 1920 x 1080 (HD 1080)\nBildschirmkr\u00fcmmung: 150 cm\nAnzahl der Farben des Displays: 16.78 million colors\nUnterst\u00fctzte Video-Modi: 1080p\nSichtbare Gr\u00f6\u00dfe (vertikal): 33,6 cm\nHD-Typ: Full HD\nsRGB: Ja\nSync-On-Green (SOG): Ja\n3D: Nein\nSeitenverh\u00e4ltnis: 16:9\nBildschirmdiagonale (cm): 68,6 cm\nPixeldichte: 82 ppi\nUnterst\u00fctzt Mac-Betriebssysteme: Mac OS X 10.0 Cheetah,Mac OS X 10.1 Puma,Mac OS X 10.10 Yosemite,Mac OS X 10.11 El Capitan,Mac OS X 10.12 Sierra,Mac OS X 10.13 High Sierra,Mac OS X 10.14 Mojave,Mac OS X 10.2 Jaguar,Mac OS X 10.3 Panther,Mac OS X 10.4 Tiger,Mac OS X 10.5 Leopard,Mac OS X 10.6 Snow Leopard,Mac OS X 10.7 Lion,Mac OS X 10.8 Mountain Lion,Mac OS X 10.9 Mavericks\nKomponentenvideo-Synchronisation: Separate sync,Sync-on-green (SOG)\nLow-Blue-Light-Technologie: Ja\nUnterst\u00fctzt Windows-Betriebssysteme: Windows 10,Windows 7,Windows 8,Windows 8.1\nFlimmerfreie Technologie: Ja\nAnzahl VGA (D-Sub) Anschl\u00fcsse: 1\nAnzahl DisplayPort Anschl\u00fcsse: 1\nDVI Anschluss: Nein\nAnzahl HDMI Anschl\u00fcsse: 1\nKopfh\u00f6rer-Konnektivit\u00e4t: 3,5 mm\nHDCP: Ja\nKopfh\u00f6rerausg\u00e4nge: 1\nIntegrierter USB-Hub: Nein\nStromeingang: Ja\nKopfh\u00f6rerausgang: Ja\nHDMI: Ja\nPC Audio-Eingang: Ja",
    "reference_file": "offer_reference_2118.json",
    "shop_name": "Future-X.at"
}