{
    "html_file": "offer_996_4.html",
    "name": "ASUS ZenScreen MB165B, 15.6\"",
    "offer_link": "https://direkt.jacob.de/produkte/asus-zenscreen-mb165b-90lm0703-b01170-artnr-7521053.html?utm_source=geizhals&utm_medium=cpc&utm_campaign=Preisvergleich&ref=103",
    "price": 141.06,
    "raw_specifications": {
        "Anzahl der Farben des Displays": "260000 colours",
        "Bildschirmaufl\u00f6sung": "1366 x 768 Pixel",
        "Bildschirmdiagonale": "39,6 cm (15.6\" )",
        "Bildschirmdiagonale (cm)": "39,62 cm",
        "Bildschirmform": "Flach",
        "Bildschirmtechnologie": "LCD",
        "Blendfreier Bildschirm": "Ja",
        "Blickwinkel, horizontal": "90\u00b0",
        "Blickwinkel, vertikal": "65\u00b0",
        "Breite (ohne Standfu\u00df)": "36 cm",
        "Eingebaute Lautsprecher": "Nein",
        "Energieeffizienzklasse (SDR)": "B",
        "Energieverbrauch (SDR) pro 1.000 Stunden": "6 kWh",
        "Gewicht (ohne St\u00e4nder)": "780 g",
        "HD-Typ": "WXGA",
        "HDCP": "Ja",
        "HDMI": "Nein",
        "Helligkeit (typisch)": "220 cd/m\u00b2",
        "H\u00f6he (ohne Standfu\u00df)": "22,6 cm",
        "Integrierte Kamera": "Nein",
        "Integrierter USB-Hub": "Nein",
        "Kontrastverh\u00e4ltnis": "500:1",
        "Kopfh\u00f6rerausgang": "Nein",
        "LED-Anzeigen": "Ja",
        "Maximale Bildwiederholrate": "60 Hz",
        "Mitgelieferte Kabel": "USB",
        "Natives Seitenverh\u00e4ltnis": "16:9",
        "Paketgewicht": "1,65 kg",
        "Panel-Typ": "TN",
        "Pixel Abstand": "0,252 x 0,252 mm",
        "Produktfarbe": "Schwarz",
        "Reaktionszeit": "10 ms",
        "Schnellstart\u00fcbersicht": "Ja",
        "Sichtbare Gr\u00f6\u00dfe (horizontal)": "34,4 cm",
        "Sichtbare Gr\u00f6\u00dfe (vertikal)": "19,4 cm",
        "Stromverbrauch (Standardbetrieb)": "7 W",
        "Stromverbrauch (Standby)": "0,5 W",
        "Stromverbrauch (aus)": "0,3 W",
        "Tiefe (ohne Standfu\u00df)": "1,18 cm",
        "Typ der Hintergrundbeleuchtung": "LED",
        "USB-Version": "2.0/3.2 Gen 1 (3.1 Gen 1)",
        "Verpackungsbreite": "434 mm",
        "Verpackungsh\u00f6he": "290 mm",
        "Verpackungstiefe": "76 mm"
    },
    "raw_specifications_text": "Bildschirmdiagonale: 39,6 cm (15.6\" )\nBildschirmaufl\u00f6sung: 1366 x 768 Pixel\nNatives Seitenverh\u00e4ltnis: 16:9\nPanel-Typ: TN\nHD-Typ: WXGA\nBildschirmtechnologie: LCD\nBildschirmform: Flach\nKontrastverh\u00e4ltnis: 500:1\nMaximale Bildwiederholrate: 60 Hz\nAnzahl der Farben des Displays: 260000 colours\nHelligkeit (typisch): 220 cd/m\u00b2\nReaktionszeit: 10 ms\nTyp der Hintergrundbeleuchtung: LED\nBlendfreier Bildschirm: Ja\nBlickwinkel, horizontal: 90\u00b0\nBlickwinkel, vertikal: 65\u00b0\nPixel Abstand: 0,252 x 0,252 mm\nSichtbare Gr\u00f6\u00dfe (horizontal): 34,4 cm\nSichtbare Gr\u00f6\u00dfe (vertikal): 19,4 cm\nBildschirmdiagonale (cm): 39,62 cm\nEingebaute Lautsprecher: Nein\nIntegrierte Kamera: Nein\nProduktfarbe: Schwarz\nIntegrierter USB-Hub: Nein\nHDMI: Nein\nKopfh\u00f6rerausgang: Nein\nUSB-Version: 2.0/3.2 Gen 1 (3.1 Gen 1)\nHDCP: Ja\nLED-Anzeigen: Ja\nEnergieeffizienzklasse (SDR): B\nEnergieverbrauch (SDR) pro 1.000 Stunden: 6 kWh\nStromverbrauch (Standardbetrieb): 7 W\nStromverbrauch (Standby): 0,5 W\nStromverbrauch (aus): 0,3 W\nBreite (ohne Standfu\u00df): 36 cm\nTiefe (ohne Standfu\u00df): 1,18 cm\nH\u00f6he (ohne Standfu\u00df): 22,6 cm\nGewicht (ohne St\u00e4nder): 780 g\nMitgelieferte Kabel: USB\nSchnellstart\u00fcbersicht: Ja\nVerpackungsbreite: 434 mm\nVerpackungstiefe: 76 mm\nVerpackungsh\u00f6he: 290 mm\nPaketgewicht: 1,65 kg",
    "reference_file": "offer_reference_996.json",
    "shop_name": "Jacob Elektronik direkt (AT)"
}