{
    "html_file": "offer_1509_22.html",
    "name": "Samsung T45F (2021), 22\"",
    "offer_link": "https://syswork.at/sw/index.html?open&mid=Artikel&artid=mon-1676&from=geizhals.at",
    "price": 144.0,
    "raw_specifications": {
        "AMD FreeSync": "Ja",
        "AMD FreeSync-Typ": "FreeSync",
        "Anzahl DisplayPort Anschl\u00fcsse": "1",
        "Anzahl HDMI-Anschl\u00fcsse": "2",
        "Audioanschl\u00fcsse": "Nein",
        "Betriebstemperatur": "10 - 40 \u00b0C",
        "Bild f\u00fcr Bild (PbP)": "Nein",
        "Bild-in-Bild": "Nein",
        "Bildschirmdiagonale": "55,9 cm (22 Zoll)",
        "Bildschirmform": "Flach",
        "Bildwinkel, horizontal": "178\u00b0",
        "Bildwinkel, vertikal": "178\u00b0",
        "Black eQualizer-Funktion": "Nein",
        "Breite (ohne Standfu\u00df)": "48,9 cm",
        "DVI Anschluss": "Nein",
        "Datenblatt": "Kein Datenblatt verf\u00fcgbar",
        "Display-Aufl\u00f6sung": "1920 x 1080 Pixel",
        "DisplayPorts-Version": "1.2",
        "ECO-Modus": "Ja",
        "Ein/Aus Timer": "Ja",
        "Eingebaute Lautsprecher": "Nein",
        "Energieeffizienzklasse (SDR)": "D",
        "Energieeffizienzskala": "A bis G",
        "Energieverbrauch (SDR) pro 1.000 Stunden": "12 kWh",
        "Farbskala": "72%",
        "Flimmerfreie Technologie": "Ja",
        "Ger\u00e4tebreite (inkl. Fu\u00df)": "488,8 mm",
        "Ger\u00e4teh\u00f6he (inkl. Fu\u00df)": "325,3 mm",
        "Ger\u00e4tetiefe (inkl. Fu\u00df)": "210 mm",
        "Gewicht (mit St\u00e4nder)": "3,5 kg",
        "Gewicht (ohne St\u00e4nder)": "2,2 kg",
        "HD-Typ": "Full HD",
        "HDMI": "Ja",
        "HDMI-Version": "1.4",
        "Helligkeit (typisch)": "250 cd/m\u00b2",
        "Herstellerlink": "Samsung",
        "High Dynamic Range Video (HDR) Unterst\u00fctzung": "Nein",
        "H\u00f6he (ohne Standfu\u00df)": "29,4 cm",
        "H\u00f6heneinstellung": "10 cm",
        "H\u00f6henverstellung": "Ja",
        "Integrierte Kamera": "Nein",
        "Integrierter USB-Hub": "Ja",
        "Kontrastverh\u00e4ltnis": "1000:1",
        "Kopfh\u00f6rerausgang": "Ja",
        "Marktpositionierung": "Business",
        "Maximale Bildwiederholrate": "75 Hz",
        "Mitgelieferte Kabel": "HDMI",
        "NVIDIA G-SYNC": "Nein",
        "Natives Seitenverh\u00e4ltnis": "16:9",
        "Neigungsverstellung": "Ja",
        "Neigungswinkelbereich": "-3 - 25\u00b0",
        "Paketgewicht": "4,7 kg",
        "Panel-Montage-Schnittstelle": "100 x 100 mm",
        "Panel-Typ": "IPS",
        "Pivot": "Ja",
        "Produktfarbe": "Schwarz",
        "Produktlink": "Link",
        "Quantum-Dot-Farbtechnologie": "Nein",
        "Reaktionszeit": "5 ms",
        "Relative Luftfeuchtigkeit in Betrieb": "10 - 80%",
        "Samsung Eye Saver-Modus": "Ja",
        "Schwenkbar": "Ja",
        "Schwenkwinkelbereich": "-45 - 45\u00b0",
        "Seitenverh\u00e4ltnis": "16:9",
        "Spiel-Modus": "Ja",
        "Stromverbrauch (DPMS)": "0,5 W",
        "Stromverbrauch (Standardbetrieb)": "12 W",
        "Stromverbrauch (Standby)": "0,5 W",
        "Stromverbrauch (aus)": "0,3 W",
        "Tiefe (ohne Standfu\u00df)": "3,94 cm",
        "Touchscreen": "Nein",
        "USB-Hub-Version": "2.0",
        "Unterst\u00fctzte Grafik-Aufl\u00f6sungen": "1920 x 1080 (HD 1080)",
        "VESA-Halterung": "Ja",
        "Verkettung": "Nein",
        "Verpackungsbreite": "553 mm",
        "Verpackungsh\u00f6he": "146 mm",
        "Verpackungstiefe": "358 mm",
        "Warentarifnummer (HS)": "85285210"
    },
    "raw_specifications_text": "Bildschirmdiagonale: 55,9 cm (22 Zoll)\nDisplay-Aufl\u00f6sung: 1920 x 1080 Pixel\nNatives Seitenverh\u00e4ltnis: 16:9\nTouchscreen: Nein\nHD-Typ: Full HD\nPanel-Typ: IPS\nBildschirmform: Flach\nKontrastverh\u00e4ltnis: 1000:1\nMaximale Bildwiederholrate: 75 Hz\nHelligkeit (typisch): 250 cd/m\u00b2\nReaktionszeit: 5 ms\nUnterst\u00fctzte Grafik-Aufl\u00f6sungen: 1920 x 1080 (HD 1080)\nSeitenverh\u00e4ltnis: 16:9\nBildwinkel, horizontal: 178\u00b0\nBildwinkel, vertikal: 178\u00b0\nHigh Dynamic Range Video (HDR) Unterst\u00fctzung: Nein\nFarbskala: 72%\nQuantum-Dot-Farbtechnologie: Nein\nNVIDIA G-SYNC: Nein\nAMD FreeSync: Ja\nAMD FreeSync-Typ: FreeSync\nFlimmerfreie Technologie: Ja\nSpiel-Modus: Ja\nEingebaute Lautsprecher: Nein\nIntegrierte Kamera: Nein\nMarktpositionierung: Business\nProduktfarbe: Schwarz\nIntegrierter USB-Hub: Ja\nHDMI: Ja\nKopfh\u00f6rerausgang: Ja\nUSB-Hub-Version: 2.0\nDVI Anschluss: Nein\nAnzahl HDMI-Anschl\u00fcsse: 2\nHDMI-Version: 1.4\nAnzahl DisplayPort Anschl\u00fcsse: 1\nDisplayPorts-Version: 1.2\nAudioanschl\u00fcsse: Nein\nVESA-Halterung: Ja\nH\u00f6henverstellung: Ja\nPanel-Montage-Schnittstelle: 100 x 100 mm\nH\u00f6heneinstellung: 10 cm\nPivot: Ja\nSchwenkbar: Ja\nSchwenkwinkelbereich: -45 - 45\u00b0\nNeigungswinkelbereich: -3 - 25\u00b0\nBild-in-Bild: Nein\nBlack eQualizer-Funktion: Nein\nNeigungsverstellung: Ja\nEnergieeffizienzklasse (SDR): D\nEnergieverbrauch (SDR) pro 1.000 Stunden: 12 kWh\nStromverbrauch (Standardbetrieb): 12 W\nStromverbrauch (Standby): 0,5 W\nStromverbrauch (aus): 0,3 W\nEnergieeffizienzskala: A bis G\nBetriebstemperatur: 10 - 40 \u00b0C\nRelative Luftfeuchtigkeit in Betrieb: 10 - 80%\nMitgelieferte Kabel: HDMI\nGer\u00e4tebreite (inkl. Fu\u00df): 488,8 mm\nGer\u00e4tetiefe (inkl. Fu\u00df): 210 mm\nGer\u00e4teh\u00f6he (inkl. Fu\u00df): 325,3 mm\nGewicht (mit St\u00e4nder): 3,5 kg\nBreite (ohne Standfu\u00df): 48,9 cm\nTiefe (ohne Standfu\u00df): 3,94 cm\nH\u00f6he (ohne Standfu\u00df): 29,4 cm\nGewicht (ohne St\u00e4nder): 2,2 kg\nVerpackungsbreite: 553 mm\nVerpackungstiefe: 358 mm\nVerpackungsh\u00f6he: 146 mm\nPaketgewicht: 4,7 kg\nWarentarifnummer (HS): 85285210\nStromverbrauch (DPMS): 0,5 W\nBild f\u00fcr Bild (PbP): Nein\nECO-Modus: Ja\nSamsung Eye Saver-Modus: Ja\nEin/Aus Timer: Ja\nVerkettung: Nein\nDatenblatt: Kein Datenblatt verf\u00fcgbar\nProduktlink: Link\nHerstellerlink: Samsung",
    "reference_file": "offer_reference_1509.json",
    "shop_name": "Syswork"
}