{
    "html_file": "offer_528_1.html",
    "name": "Koorui 27E6QC, 27\"",
    "offer_link": "https://www.amazon.de/dp/B0BBRKND8T?linkCode=xm2&camp=2025&creative=165953&smid=A3JWKAKR8XB7XF&creativeASIN=B0BBRKND8T&tag=geizhals1-21",
    "price": 209.0,
    "raw_specifications": {
        "ASIN": "B0BBRKND8T",
        "Amazon Bestseller-Rang": "Nr. 537 in Computer & Zubeh\u00f6r (Siehe Top 100 in Computer & Zubeh\u00f6r)  Nr. 3 in Monitore",
        "Artikelgewicht": "\u200e5,89 Kilograms",
        "Batterien enthalten": "\u200eNein",
        "Bildschirmaufl\u00f6sung": "\u200e2560 x 1440",
        "Display-Gr\u00f6\u00dfe": "\u200e27 Zoll",
        "Durchschnittliche Kundenbewertung": "4,4  4,4 von 5 Sternen    \n    7.358 Sternebewertungen   \n\n\n 4,4 von 5 Sternen",
        "Farbe": "\u200eSchwarz Rot",
        "Garantierte Software-Updates bis": "\u200eunbekannt",
        "Hersteller": "\u200eKOORUI",
        "Im Angebot von Amazon.de seit": "24. August 2022",
        "L\u00f6sung": "\u200e2560 x 1440 Pixels",
        "Marke": "\u200eKOORUI",
        "Modellnummer": "\u200e27E6QC",
        "Produktabmessungen": "\u200e61,2 x 45,8 x 22,9 cm; 5,89 Kilogramm",
        "Volt": "\u200e240 Volt (Wechselstrom)"
    },
    "raw_specifications_text": "Marke: \u200eKOORUI\nHersteller: \u200eKOORUI\nProduktabmessungen: \u200e61,2 x 45,8 x 22,9 cm; 5,89 Kilogramm\nModellnummer: \u200e27E6QC\nFarbe: \u200eSchwarz Rot\nDisplay-Gr\u00f6\u00dfe: \u200e27 Zoll\nBildschirmaufl\u00f6sung: \u200e2560 x 1440\nL\u00f6sung: \u200e2560 x 1440 Pixels\nVolt: \u200e240 Volt (Wechselstrom)\nBatterien enthalten: \u200eNein\nArtikelgewicht: \u200e5,89 Kilograms\nGarantierte Software-Updates bis: \u200eunbekannt\nASIN: B0BBRKND8T\nDurchschnittliche Kundenbewertung: 4,4  4,4 von 5 Sternen    \n    7.358 Sternebewertungen   \n\n\n 4,4 von 5 Sternen\nAmazon Bestseller-Rang: Nr. 537 in Computer & Zubeh\u00f6r (Siehe Top 100 in Computer & Zubeh\u00f6r)  Nr. 3 in Monitore\nIm Angebot von Amazon.de seit: 24. August 2022",
    "reference_file": "offer_reference_528.json",
    "shop_name": "Amazon.at"
}