{
    "html_file": "offer_834_2.html",
    "name": "ViewSonic VP2786-4K, 27\"",
    "offer_link": "https://www.playox.de/productredirect/index/sku/24773260?sPartner=p-geizhals-at&campaign=psm/geizhals-at/",
    "price": 1208.07,
    "raw_specifications": {
        "Anschl\u00fcsse": "USB, DisplayPort, HDMI, Kopfh\u00f6reranschluss, Audioausgang (Line-Out)",
        "Artikelnummer": "24773260",
        "Aufl\u00f6sung Kurzname": "Full HD, UHD, 4K",
        "Bezeichnung des Herstellers": "ViewSonic VP2786-4K",
        "Bildwiederholungsrate": "60,00 Hz",
        "Breite": "613,00 mm",
        "Display Features": "FlickerFree, 3D Funktion",
        "Displaygr\u00f6\u00dfe": "68,58 cm (27 Zoll)",
        "EEK - Spektrum": "AG",
        "Energieeffizienzklasse": "F",
        "Geh\u00e4usefarbe des Ger\u00e4tes": "Schwarz",
        "Gewicht": "13,20 kg",
        "Gewicht inkl. Verpackung in Kg": "13,20 kg",
        "Helligkeit Bereich": "300 - 450 cd/m\u00b2",
        "Hersteller": "Viewsonic",
        "H\u00f6he": "5691,00 mm",
        "Inhalt (ml oder g)": "0,00 ml",
        "Kapazit\u00e4t (Seiten)": "0",
        "Kontrastverh\u00e4ltnis (typisch) Bereich": "ab 1.200:1",
        "LCD-Technologie": "IPS Panel",
        "L\u00e4nge": "232,00 mm",
        "Produktart": "Monitore",
        "Reaktionszeit": "5,00 ms",
        "Seitenverh\u00e4ltnis": "16:9",
        "Shop Herstellernummer": "VP2786-4K",
        "Standard-EAN": "0766907016130",
        "Verpackung - Breite in cm": "69,20 cm",
        "Verpackung - H\u00f6he in cm": "50,50 cm",
        "Verpackung - L\u00e4nge in cm": "22,50 cm",
        "max. Aufl\u00f6sung": "3.840 x 2.160 Pixel (16:9)"
    },
    "raw_specifications_text": "Displaygr\u00f6\u00dfe: 68,58 cm (27 Zoll)\nGeh\u00e4usefarbe des Ger\u00e4tes: Schwarz\nAnschl\u00fcsse: USB, DisplayPort, HDMI, Kopfh\u00f6reranschluss, Audioausgang (Line-Out)\nProduktart: Monitore\nKontrastverh\u00e4ltnis (typisch) Bereich: ab 1.200:1\nDisplay Features: FlickerFree, 3D Funktion\nHelligkeit Bereich: 300 - 450 cd/m\u00b2\nHersteller: Viewsonic\nGewicht: 13,20 kg\nInhalt (ml oder g): 0,00 ml\nKapazit\u00e4t (Seiten): 0\nAufl\u00f6sung Kurzname: Full HD, UHD, 4K\nEEK - Spektrum: AG\nGewicht inkl. Verpackung in Kg: 13,20 kg\nVerpackung - L\u00e4nge in cm: 22,50 cm\nVerpackung - H\u00f6he in cm: 50,50 cm\nBreite: 613,00 mm\nL\u00e4nge: 232,00 mm\nVerpackung - Breite in cm: 69,20 cm\nArtikelnummer: 24773260\nStandard-EAN: 0766907016130\nShop Herstellernummer: VP2786-4K\nBezeichnung des Herstellers: ViewSonic VP2786-4K\nH\u00f6he: 5691,00 mm\nmax. Aufl\u00f6sung: 3.840 x 2.160 Pixel (16:9)\nSeitenverh\u00e4ltnis: 16:9\nLCD-Technologie: IPS Panel\nReaktionszeit: 5,00 ms\nBildwiederholungsrate: 60,00 Hz\nEnergieeffizienzklasse: F",
    "reference_file": "offer_reference_834.json",
    "shop_name": "playox (AT)"
}