{
    "html_file": "offer_1136_4.html",
    "name": "ASUS TUF Gaming VG27AQZ, 27\"",
    "offer_link": "https://direkt.jacob.de/produkte/asus-tuf-gaming-90lm0503-b01370-artnr-7468884.html?utm_source=geizhals&utm_medium=cpc&utm_campaign=Preisvergleich&ref=103",
    "price": 322.56,
    "raw_specifications": {
        "AC Eingangsfrequenz": "50/60 Hz",
        "AC Eingangsspannung": "100 - 240 V",
        "AMD FreeSync": "Nein",
        "Anzahl DisplayPort Anschl\u00fcsse": "1",
        "Anzahl HDMI-Anschl\u00fcsse": "2",
        "Anzahl der Farben des Displays": "16,7 Millionen Farben",
        "Anzahl der Lautsprecher": "2",
        "Bildschirmaufl\u00f6sung": "2560 x 1440 Pixel",
        "Bildschirmdiagonale": "68,6 cm (27\" )",
        "Bildschirmform": "Flach",
        "Bildschirmtechnologie": "LED",
        "Blendfreier Bildschirm": "Ja",
        "Blickwinkel, horizontal": "178\u00b0",
        "Blickwinkel, vertikal": "178\u00b0",
        "Breite (ohne Standfu\u00df)": "62 cm",
        "Digital horizontale Frequenz": "30 - 243 kHz",
        "Digital vertikale Frequenz": "30 - 230 Hz",
        "DisplayPorts-Version": "1.2",
        "Eingebaute Lautsprecher": "Ja",
        "Energie Effizienzklasse": "G",
        "Flimmerfreie Technologie": "Ja",
        "Fu\u00dffarbe": "Schwarz",
        "Ger\u00e4tebreite (inkl. Fu\u00df)": "620 mm",
        "Ger\u00e4teh\u00f6he (inkl. Fu\u00df)": "377 mm",
        "Ger\u00e4tetiefe (inkl. Fu\u00df)": "211 mm",
        "Gewicht (mit St\u00e4nder)": "5,8 kg",
        "Gewicht (ohne St\u00e4nder)": "3,5 kg",
        "HD-Typ": "Wide Quad HD",
        "HDCP": "Ja",
        "HDMI": "Ja",
        "HDMI-Version": "2.0",
        "Helligkeit (typisch)": "350 cd/m\u00b2",
        "High Dynamic Range Video Unterst\u00fctzung": "Ja",
        "H\u00f6he (ohne Standfu\u00df)": "36,3 cm",
        "H\u00f6henverstellung": "Ja",
        "Integrierte Kamera": "Nein",
        "Integrierter USB-Hub": "Nein",
        "Kabelsperre-Slot": "Ja",
        "Kopfh\u00f6rerausgang": "Ja",
        "Kopfh\u00f6rerausg\u00e4nge": "1",
        "Low-Blue-Light-Technologie": "Ja",
        "Marktpositionierung": "Gaming",
        "Maximale Bildwiederholrate": "165 Hz",
        "Mitgelieferte Kabel": "AC, DisplayPort",
        "NVIDIA G-SYNC": "Ja",
        "Natives Seitenverh\u00e4ltnis": "16:9",
        "Neigungswinkelbereich": "5 - 35\u00b0",
        "Paketgewicht": "8 kg",
        "Panel-Montage-Schnittstelle": "100 x 100 mm",
        "Panel-Typ": "IPS",
        "Pivot": "Ja",
        "Pivot Winkel": "0 - 90\u00b0",
        "Pixel Abstand": "0,233 x 0,233 mm",
        "Produktfarbe": "Schwarz",
        "RMS-Leistung": "4 W",
        "Reaktionszeit": "1 ms",
        "Schnellstart\u00fcbersicht": "Ja",
        "Schwenkbar": "Ja",
        "Schwenkwinkelbereich": "90 - 90\u00b0",
        "Sichtbare Gr\u00f6\u00dfe (horizontal)": "59,7 cm",
        "Sichtbare Gr\u00f6\u00dfe (vertikal)": "33,6 cm",
        "Slot-Typ Kabelsperre": "Kensington",
        "Stromadapter enthalten": "Ja",
        "Stromverbrauch (Standardbetrieb)": "27 W",
        "Stromverbrauch (Standby)": "0,5 W",
        "Stromverbrauch (aus)": "0,5 W",
        "St\u00e4nder enthalten": "Ja",
        "Technologie mit hohem Dynamikbereich (HDR)": "High Dynamic Range 10 (HDR10)",
        "Tiefe (ohne Standfu\u00df)": "6,6 cm",
        "VESA-Halterung": "Ja",
        "Verpackungsbreite": "704 mm",
        "Verpackungsh\u00f6he": "464 mm",
        "Verpackungstiefe": "210 mm",
        "kippbar": "Ja",
        "sRGB Abdeckung (klassisch)": "100%"
    },
    "raw_specifications_text": "Energie Effizienzklasse: G\nBildschirmdiagonale: 68,6 cm (27\" )\nBildschirmaufl\u00f6sung: 2560 x 1440 Pixel\nNatives Seitenverh\u00e4ltnis: 16:9\nPanel-Typ: IPS\nHD-Typ: Wide Quad HD\nBildschirmtechnologie: LED\nBildschirmform: Flach\nMaximale Bildwiederholrate: 165 Hz\nAnzahl der Farben des Displays: 16,7 Millionen Farben\nHelligkeit (typisch): 350 cd/m\u00b2\nReaktionszeit: 1 ms\nBlendfreier Bildschirm: Ja\nBlickwinkel, horizontal: 178\u00b0\nBlickwinkel, vertikal: 178\u00b0\nPixel Abstand: 0,233 x 0,233 mm\nSichtbare Gr\u00f6\u00dfe (horizontal): 59,7 cm\nSichtbare Gr\u00f6\u00dfe (vertikal): 33,6 cm\nDigital horizontale Frequenz: 30 - 243 kHz\nDigital vertikale Frequenz: 30 - 230 Hz\nHigh Dynamic Range Video Unterst\u00fctzung: Ja\nTechnologie mit hohem Dynamikbereich (HDR): High Dynamic Range 10 (HDR10)\nsRGB Abdeckung (klassisch): 100%\nNVIDIA G-SYNC: Ja\nAMD FreeSync: Nein\nFlimmerfreie Technologie: Ja\nLow-Blue-Light-Technologie: Ja\nEingebaute Lautsprecher: Ja\nIntegrierte Kamera: Nein\nAnzahl der Lautsprecher: 2\nRMS-Leistung: 4 W\nMarktpositionierung: Gaming\nProduktfarbe: Schwarz\nFu\u00dffarbe: Schwarz\nIntegrierter USB-Hub: Nein\nHDMI: Ja\nKopfh\u00f6rerausgang: Ja\nAnzahl HDMI-Anschl\u00fcsse: 2\nHDMI-Version: 2.0\nAnzahl DisplayPort Anschl\u00fcsse: 1\nDisplayPorts-Version: 1.2\nKopfh\u00f6rerausg\u00e4nge: 1\nHDCP: Ja\nVESA-Halterung: Ja\nKabelsperre-Slot: Ja\nH\u00f6henverstellung: Ja\nPanel-Montage-Schnittstelle: 100 x 100 mm\nSlot-Typ Kabelsperre: Kensington\nPivot: Ja\nPivot Winkel: 0 - 90\u00b0\nSchwenkbar: Ja\nSchwenkwinkelbereich: 90 - 90\u00b0\nkippbar: Ja\nNeigungswinkelbereich: 5 - 35\u00b0\nStromverbrauch (Standardbetrieb): 27 W\nStromverbrauch (Standby): 0,5 W\nStromverbrauch (aus): 0,5 W\nAC Eingangsspannung: 100 - 240 V\nAC Eingangsfrequenz: 50/60 Hz\nGer\u00e4tebreite (inkl. Fu\u00df): 620 mm\nGer\u00e4tetiefe (inkl. Fu\u00df): 211 mm\nGer\u00e4teh\u00f6he (inkl. Fu\u00df): 377 mm\nGewicht (mit St\u00e4nder): 5,8 kg\nBreite (ohne Standfu\u00df): 62 cm\nTiefe (ohne Standfu\u00df): 6,6 cm\nH\u00f6he (ohne Standfu\u00df): 36,3 cm\nGewicht (ohne St\u00e4nder): 3,5 kg\nSt\u00e4nder enthalten: Ja\nMitgelieferte Kabel: AC, DisplayPort\nSchnellstart\u00fcbersicht: Ja\nStromadapter enthalten: Ja\nVerpackungsbreite: 704 mm\nVerpackungstiefe: 210 mm\nVerpackungsh\u00f6he: 464 mm\nPaketgewicht: 8 kg",
    "reference_file": "offer_reference_1136.json",
    "shop_name": "Jacob Elektronik direkt (AT)"
}