{
    "html_file": "offer_770_31.html",
    "name": "Lenovo ThinkVision T27i-30, 27\"",
    "offer_link": "https://www.taufnaus.de/product/10604906",
    "price": 233.65,
    "raw_specifications": {
        "Abmessungen (Breite x Tiefe x H\u00f6he)": "61.19 cm x 20.45 cm x 54.43 cm - mit Standfu\u00df (h\u00f6chste Position)",
        "Besonderheiten": "Grenzenlos",
        "Bildschirmbeschichtung": "Blendfrei",
        "Bildschirmtyp": "IPS",
        "Details zu Abmessungen & Gewicht": "Mit Standfu\u00df (h\u00f6chste Position) - Breite: 61.19 cm - Tiefe: 20.45 cm - H\u00f6he: 54.43 cm - Gewicht: 6.9 kg \u00a6 Mit Standfu\u00df (niedrigste Position) - Breite: 61.19 cm - Tiefe: 20.45 cm - H\u00f6he: 38.93 cm - Gewicht: 6.9 kg \u00a6 Ohne Fu\u00df - Breite: 61.19 cm - Tiefe: 5 cm - H\u00f6he: 36.25 cm - Gewicht: 4.9 kg",
        "Diagonalabmessung": "68.6 cm (27\")",
        "Display-Typ": "LED-hintergrundbeleuchteter LCD-Monitor / TFT-Aktivmatrix",
        "ENERGY STAR zertifiziert": "Ja",
        "EPEAT-kompatibel": "EPEAT Gold",
        "Eingangsspannung": "Wechselstrom 100-240 V (50/60 Hz)",
        "Einstellungen der Anzeigeposition": "H\u00f6he, Pivot (Rotation), Drehung, Neigung",
        "Energierverbrauch Sleep": "0.5 Watt",
        "Enthaltene Kabel": "1 x DisplayPort-Kabel - 1.8 m \u00a6 1 x USB-Kabel Typ A auf Typ B - 1.8 m",
        "Erforderliches Betriebssystem": "Windows 10, Windows 11",
        "Farbe": "Schwarz",
        "Farbraum": "99% sRGB (CIE 1931)",
        "Farbunterst\u00fctzung": "16,7 Millionen Farben",
        "Gewicht": "6.9 kg",
        "Helligkeit": "300 cd/m\u00b2",
        "Hintergrundbeleuchtungs-Technologie": "WLED",
        "Horizontaler Betrachtungswinkel": "178",
        "H\u00f6heneinstellung": "155 mm",
        "Integrierte Peripherieger\u00e4te": "USB 3.2 Gen 1 Hub",
        "Kennzeichnung": "CCC, RoHS, China Energy standard Tier 2, TUV Rheinland Eye Comfort Certification, TUV Eyesafe Display Certification, TUV Rheinland Low Blue Light (Hardware Solution)",
        "Kontrast": "1000:1 / 3000000:1 (dynamisch)",
        "Leistungsmerkmale": "Slot f\u00fcr Sicherheitsschloss (Kabelschloss getrennt erh\u00e4ltlich), integrierte Kabelf\u00fchrung",
        "Lokalisierung": "Englisch / Europa",
        "Mitgelieferte Software": "Lenovo ThinkColour",
        "Native Aufl\u00f6sung": "Full HD (1080p) 1920 x 1080 bei 60 Hz",
        "Neigungswinkel": "-5/+23.5",
        "Pixelpitch": "0.3114 mm",
        "Ppi": "82",
        "Reaktionszeit": "4 ms (extrem), 6 ms (typisch)",
        "Rotationswinkel": "180",
        "Schlosstyp zur Diebstahlsicherung": "Kensington Slot",
        "Schnittstellen": "HDMI \u00a6 VGA (HD-15) \u00a6 DisplayPort \u00a6 4 x USB 3.2 Gen 1 Downstream \u00a6 USB 3.2 Gen 1 Upstream",
        "Schwenkwinkel": "90",
        "Seitenverh\u00e4ltnis": "16:9",
        "Service und Support": "Begrenzte Garantie - 3 Jahre",
        "Stromverbrauch (Aus-Modus)": "0.3 Watt",
        "Stromverbrauch (max.)": "65 Watt",
        "Stromverbrauch (typisch)": "24 Watt",
        "TCO-zertifiziert": "TCO Certified Edge Displays, TCO Certified Displays 9",
        "Transportbreite": "69 cm",
        "Transportgewicht": "10.1 kg",
        "Transporth\u00f6he": "14.8 cm",
        "Transporttiefe": "52.5 cm",
        "VESA-Halterung": "100 x 100 mm",
        "Vertikaler Betrachtungswinkel": "178"
    },
    "raw_specifications_text": "Display-Typ: LED-hintergrundbeleuchteter LCD-Monitor / TFT-Aktivmatrix\nDiagonalabmessung: 68.6 cm (27\")\nIntegrierte Peripherieger\u00e4te: USB 3.2 Gen 1 Hub\nBildschirmtyp: IPS\nSeitenverh\u00e4ltnis: 16:9\nNative Aufl\u00f6sung: Full HD (1080p) 1920 x 1080 bei 60 Hz\nPixelpitch: 0.3114 mm\nPpi: 82\nHelligkeit: 300 cd/m\u00b2\nKontrast: 1000:1 / 3000000:1 (dynamisch)\nFarbunterst\u00fctzung: 16,7 Millionen Farben\nFarbraum: 99% sRGB (CIE 1931)\nReaktionszeit: 4 ms (extrem), 6 ms (typisch)\nHorizontaler Betrachtungswinkel: 178\nVertikaler Betrachtungswinkel: 178\nBildschirmbeschichtung: Blendfrei\nHintergrundbeleuchtungs-Technologie: WLED\nBesonderheiten: Grenzenlos\nFarbe: Schwarz\nAbmessungen (Breite x Tiefe x H\u00f6he): 61.19 cm x 20.45 cm x 54.43 cm - mit Standfu\u00df (h\u00f6chste Position)\nGewicht: 6.9 kg\nSchnittstellen: HDMI \u00a6 VGA (HD-15) \u00a6 DisplayPort \u00a6 4 x USB 3.2 Gen 1 Downstream \u00a6 USB 3.2 Gen 1 Upstream\nEinstellungen der Anzeigeposition: H\u00f6he, Pivot (Rotation), Drehung, Neigung\nNeigungswinkel: -5/+23.5\nSchwenkwinkel: 90\nRotationswinkel: 180\nH\u00f6heneinstellung: 155 mm\nVESA-Halterung: 100 x 100 mm\nLeistungsmerkmale: Slot f\u00fcr Sicherheitsschloss (Kabelschloss getrennt erh\u00e4ltlich), integrierte Kabelf\u00fchrung\nEnthaltene Kabel: 1 x DisplayPort-Kabel - 1.8 m \u00a6 1 x USB-Kabel Typ A auf Typ B - 1.8 m\nKennzeichnung: CCC, RoHS, China Energy standard Tier 2, TUV Rheinland Eye Comfort Certification, TUV Eyesafe Display Certification, TUV Rheinland Low Blue Light (Hardware Solution)\nLokalisierung: Englisch / Europa\nSchlosstyp zur Diebstahlsicherung: Kensington Slot\nEingangsspannung: Wechselstrom 100-240 V (50/60 Hz)\nStromverbrauch (typisch): 24 Watt\nStromverbrauch (max.): 65 Watt\nEnergierverbrauch Sleep: 0.5 Watt\nStromverbrauch (Aus-Modus): 0.3 Watt\nMitgelieferte Software: Lenovo ThinkColour\nErforderliches Betriebssystem: Windows 10, Windows 11\nDetails zu Abmessungen & Gewicht: Mit Standfu\u00df (h\u00f6chste Position) - Breite: 61.19 cm - Tiefe: 20.45 cm - H\u00f6he: 54.43 cm - Gewicht: 6.9 kg \u00a6 Mit Standfu\u00df (niedrigste Position) - Breite: 61.19 cm - Tiefe: 20.45 cm - H\u00f6he: 38.93 cm - Gewicht: 6.9 kg \u00a6 Ohne Fu\u00df - Breite: 61.19 cm - Tiefe: 5 cm - H\u00f6he: 36.25 cm - Gewicht: 4.9 kg\nTransportbreite: 69 cm\nTransporttiefe: 52.5 cm\nTransporth\u00f6he: 14.8 cm\nTransportgewicht: 10.1 kg\nTCO-zertifiziert: TCO Certified Edge Displays, TCO Certified Displays 9\nEPEAT-kompatibel: EPEAT Gold\nENERGY STAR zertifiziert: Ja\nService und Support: Begrenzte Garantie - 3 Jahre",
    "reference_file": "offer_reference_770.json",
    "shop_name": "TaufNaus"
}