{
    "html_file": "offer_591_8.html",
    "name": "ASRock Side Panel Kit, 13.3\"",
    "offer_link": "https://www.ditech.at/details.php?artnr=363411",
    "price": 101.9,
    "raw_specifications": {
        "Abmessungen - Breite": "keine angabe (mit standfu\u00df),  300.3mm",
        "Abmessungen - H\u00f6he": "177.6mm",
        "Abmessungen - Tiefe": "2.3 (ohne standfu\u00df)mm",
        "Anschl\u00fcsse - eDP": "1",
        "Anwendung": "Sidepanel f\u00fcr PC-Geh\u00e4use",
        "Audio": "N/A",
        "Aufl\u00f6sung": "1920x1080",
        "Beschichtung": "matt (non-glare)",
        "Besonderheiten": "Slim Bezel,  keine Angabe",
        "Bildwiederholfrequenz": "60Hz",
        "Blickwinkel": "178\u00b0/178\u00b0",
        "Diagonale": "13.3\"/33.8cm",
        "Ergonomie": "N/A (h\u00f6henverstellbar),  N/A (Pivot),  N/A (drehbar),  N/A (neigbar),  keine Angabe (Schr\u00e4glage)",
        "FRC": "unbekannt",
        "Farbe": "schwarz",
        "Farbtiefe": "8bit (16.7 Mio. Farben)",
        "Form": "gerade (flat)",
        "Gewicht": "keine Angabe (mit Standfu\u00df),  keine Angabe (ohne Standfu\u00df)",
        "HDR": "N/A",
        "Helligkeit": "300cd/m\u00b2",
        "Hintergrundbeleuchtung": "White-LED",
        "Kontrast - statisch": "800:1",
        "Leistungsaufnahme": "keine Angabe (maximal),  keine Angabe (typisch),  keine Angabe (Energielabel alt A+++ bis G),  0W (Standby)",
        "Panel": "IPS",
        "Screen-to-Body-Ratio": "91.4% (berechnet)",
        "Seitenverh\u00e4ltnis": "16:9",
        "Signalfrequenz": "keine Angabe (horizontal),  keine Angabe (vertikal)",
        "Stromversorgung": "eDP",
        "USB-Hub In": "N/A",
        "USB-Hub Out": "N/A",
        "USB-Schreibweise": "Link",
        "VESA": "N/A",
        "Weitere Anschl\u00fcsse": "N/A"
    },
    "raw_specifications_text": "Abmessungen - Breite: keine angabe (mit standfu\u00df),  300.3mm\nAbmessungen - H\u00f6he: 177.6mm\nAbmessungen - Tiefe: 2.3 (ohne standfu\u00df)mm\nAnschl\u00fcsse - eDP: 1\nAnwendung: Sidepanel f\u00fcr PC-Geh\u00e4use\nAudio: N/A\nAufl\u00f6sung: 1920x1080\nBeschichtung: matt (non-glare)\nBesonderheiten: Slim Bezel,  keine Angabe\nBildwiederholfrequenz: 60Hz\nBlickwinkel: 178\u00b0/178\u00b0\nDiagonale: 13.3\"/33.8cm\nErgonomie: N/A (h\u00f6henverstellbar),  N/A (Pivot),  N/A (drehbar),  N/A (neigbar),  keine Angabe (Schr\u00e4glage)\nFarbe: schwarz\nFarbtiefe: 8bit (16.7 Mio. Farben)\nForm: gerade (flat)\nFRC: unbekannt\nGewicht: keine Angabe (mit Standfu\u00df),  keine Angabe (ohne Standfu\u00df)\nHDR: N/A\nHelligkeit: 300cd/m\u00b2\nHintergrundbeleuchtung: White-LED\nKontrast - statisch: 800:1\nLeistungsaufnahme: keine Angabe (maximal),  keine Angabe (typisch),  keine Angabe (Energielabel alt A+++ bis G),  0W (Standby)\nPanel: IPS\nScreen-to-Body-Ratio: 91.4% (berechnet)\nSeitenverh\u00e4ltnis: 16:9\nSignalfrequenz: keine Angabe (horizontal),  keine Angabe (vertikal)\nStromversorgung: eDP\nUSB-Hub In: N/A\nUSB-Hub Out: N/A\nUSB-Schreibweise: Link\nVESA: N/A\nWeitere Anschl\u00fcsse: N/A",
    "reference_file": "offer_reference_591.json",
    "shop_name": "DiTech.at"
}