{
    "html_file": "offer_1087_9.html",
    "name": "LC-Power LC-M27-FHD-165-C-V2, 27\"",
    "offer_link": "https://www.future-x.at/lc-power-lc-m27-fhd-165-c-v2-led-monitor-gebogen-68-5-cm-27-1920-x-1080-full-hd-1080p-%40-165-hz-va-250-cd-m%B2-4000%3A1-1-ms-2xhdmi-displayport-schwarz-p-9135507/?pv=2",
    "price": 232.99,
    "raw_specifications": {
        "Abmessungen (Breite x Tiefe x H\u00f6he)": "61,6 cm x 19,6 cm x 45,3 cm - mit Fu\u00df",
        "Besonderheiten": "Overdrive-Technologie, Low Blue Light Mode, flimmerfreie Technologie, GamePlus",
        "Bildschirmtyp": "VA",
        "Details zu Abmessungen & Gewicht": "Ohne Fu\u00df - Breite: 61,6 cm - Tiefe: 9,7 cm - H\u00f6he: 36,7 cm",
        "Diagonalabmessung": "68,5 cm (27\")",
        "Display-Typ": "LED-hintergrundbeleuchteter LCD-Monitor",
        "Einstellungen der Anzeigeposition": "Neigung",
        "Energie Effizienzklasse": "Klasse F",
        "Enthaltene Kabel": "1 x DisplayPort-Kabel",
        "Farbe": "Schwarz",
        "Farbraum": "90% Adobe RGB, 90% NTSC, 95% sRGB, 90% DCI-P3",
        "Farbunterst\u00fctzung": "16,7 Millionen Farben",
        "Geschwungener Bildschirm": "Ja (1500R)",
        "Gewicht": "4,85 kg",
        "Helligkeit": "250 cd/m\u00b2",
        "Hintergrundbeleuchtungs-Technologie": "LED-Hintergrundbeleuchtung",
        "Horizontaler Betrachtungswinkel": "178",
        "Kontrast": "4000:1",
        "Leistungsmerkmale": "Rote Beleuchtung",
        "Native Aufl\u00f6sung": "Full HD (1080p) 1920 x 1080 bei 165 Hz",
        "Neigungswinkel": "-5/+15",
        "Reaktionszeit": "1 ms",
        "Schnittstellen": "2 x HDMI \u00a6 DisplayPort \u00a6 Audio Line-Out",
        "Seitenverh\u00e4ltnis": "16:9",
        "Service und Support": "Begrenzte Garantie - 3 Jahre",
        "Stromverbrauch SDR (eingeschaltet)": "22.9 kWh/1.000 h",
        "Stromverbrauch im Standby-Modus": "0.5 Watt",
        "Transportbreite": "69,9 cm",
        "Transportgewicht": "6,72 kg",
        "Transporth\u00f6he": "44 cm",
        "Transporttiefe": "16,9 cm",
        "VESA-Halterung": "75 x 75 mm",
        "Vertikaler Betrachtungswinkel": "178",
        "Zubeh\u00f6r im Lieferumfang": "Befestigungskit"
    },
    "raw_specifications_text": "Display-Typ: LED-hintergrundbeleuchteter LCD-Monitor\nEnergie Effizienzklasse: Klasse F\nDiagonalabmessung: 68,5 cm (27\")\nGeschwungener Bildschirm: Ja (1500R)\nBildschirmtyp: VA\nSeitenverh\u00e4ltnis: 16:9\nNative Aufl\u00f6sung: Full HD (1080p) 1920 x 1080 bei 165 Hz\nHelligkeit: 250 cd/m\u00b2\nKontrast: 4000:1\nFarbunterst\u00fctzung: 16,7 Millionen Farben\nFarbraum: 90% Adobe RGB, 90% NTSC, 95% sRGB, 90% DCI-P3\nReaktionszeit: 1 ms\nHorizontaler Betrachtungswinkel: 178\nVertikaler Betrachtungswinkel: 178\nHintergrundbeleuchtungs-Technologie: LED-Hintergrundbeleuchtung\nBesonderheiten: Overdrive-Technologie, Low Blue Light Mode, flimmerfreie Technologie, GamePlus\nFarbe: Schwarz\nAbmessungen (Breite x Tiefe x H\u00f6he): 61,6 cm x 19,6 cm x 45,3 cm - mit Fu\u00df\nGewicht: 4,85 kg\nSchnittstellen: 2 x HDMI \u00a6 DisplayPort \u00a6 Audio Line-Out\nEinstellungen der Anzeigeposition: Neigung\nNeigungswinkel: -5/+15\nVESA-Halterung: 75 x 75 mm\nLeistungsmerkmale: Rote Beleuchtung\nZubeh\u00f6r im Lieferumfang: Befestigungskit\nEnthaltene Kabel: 1 x DisplayPort-Kabel\nStromverbrauch SDR (eingeschaltet): 22.9 kWh/1.000 h\nStromverbrauch im Standby-Modus: 0.5 Watt\nDetails zu Abmessungen & Gewicht: Ohne Fu\u00df - Breite: 61,6 cm - Tiefe: 9,7 cm - H\u00f6he: 36,7 cm\nTransportbreite: 69,9 cm\nTransporttiefe: 16,9 cm\nTransporth\u00f6he: 44 cm\nTransportgewicht: 6,72 kg\nService und Support: Begrenzte Garantie - 3 Jahre",
    "reference_file": "offer_reference_1087.json",
    "shop_name": "Future-X.at"
}