{
    "html_file": "offer_516_0.html",
    "name": "Samsung Odyssey Neo G7 G70C, 43\"",
    "offer_link": "https://www.csv-direct.de/artinfo.php?artnr=A1621602&KATEGORIE=162&pva=geizhals2",
    "price": 731.94,
    "raw_specifications": {
        "AC Eingangsfrequenz": "50 - 60 Hz",
        "AC Eingangsspannung": "100 - 240 V",
        "AMD FreeSync-Typ": "FreeSync Premium Pro",
        "Anzahl DisplayPort Anschl\u00fcsse": "1",
        "Anzahl HDMI-Anschl\u00fcsse": "2",
        "Anzahl der Farben des Displays": "1 Milliarden Farben",
        "Betriebstemperatur": "0 - 40 \u00b0C",
        "Bildschirmdiagonale": "109,2 cm 43\"",
        "Bildschirmdiagonale cm": "108 cm",
        "Bildschirmform": "Flach",
        "Bildschirmtechnologie": "LED",
        "Bildwinkel, horizontal": "178\u00b0",
        "Bildwinkel, vertikal": "178\u00b0",
        "Bluetooth-Version": "5.2",
        "Breite ohne Standfu\u00df": "960,8 mm",
        "DVI Anschluss": "Nein",
        "Display-Aufl\u00f6sung": "3840 x 2160 Pixel",
        "DisplayPorts-Version": "1.4",
        "Dynamisches Kontrastverh\u00e4ltnis Marketingbezeichnung": "Mega DCR",
        "Energieeffizienzklasse HDR": "G",
        "Energieeffizienzklasse SDR": "G",
        "Energieeffizienzskala": "A bis G",
        "Energieverbrauch HDR pro 1.000 Stunden": "105 kWh",
        "Energieverbrauch SDR pro 1.000 Stunden": "54 kWh",
        "Farbskala": "95",
        "Fu\u00dffarbe": "Schwarz",
        "Ger\u00e4tebreite inkl. Fu\u00df": "960,8 mm",
        "Ger\u00e4teh\u00f6he inkl. Fu\u00df": "635 mm",
        "Ger\u00e4tetiefe inkl. Fu\u00df": "254,1 mm",
        "Gewicht mit St\u00e4nder": "11,7 kg",
        "Gewicht ohne St\u00e4nder": "9,2 kg",
        "HD-Typ": "4K Ultra HD",
        "HDCP-Version": "2.2",
        "HDMI-Version": "2.1",
        "Helligkeit typisch": "400 cd/m\u00b2",
        "H\u00f6he ohne Standfu\u00df": "563,3 mm",
        "H\u00f6henverstellung": "Nein",
        "Installiertes Betriebssystem": "Tizen",
        "Integrierte Kamera": "Nein",
        "J\u00e4hrlicher Energieverbrauch": "79 kWh",
        "Kontrastverh\u00e4ltnis": "4250:1",
        "Kontrastverh\u00e4ltnis dynamisch": "1000000:1",
        "Lokale Dimmbereiche": "1",
        "Markenspezifische Technologien": "Augenpflege+",
        "Marktpositionierung": "Gaming",
        "Maximale Bildwiederholrate": "144 Hz",
        "Mitgelieferte Kabel": "DisplayPort, Leistung",
        "NVIDIA G-SYNC": "Nein",
        "Natives Seitenverh\u00e4ltnis": "16:9",
        "Neigungswinkelbereich": "-2 - 20\u00b0",
        "Netzteiltyp": "Intern",
        "Paketgewicht": "161 kg",
        "Panel-Montage-Schnittstelle": "200 x 200 mm",
        "Panel-Typ": "VA",
        "Produktfarbe": "Wei\u00df",
        "Reaktionszeit": "1 ms",
        "Relative Luftfeuchtigkeit in Betrieb": "10 - 80",
        "Sichtbare Gr\u00f6\u00dfe horizontal": "94,1 cm",
        "Sichtbare Gr\u00f6\u00dfe vertikal": "52,9 cm",
        "Smart-Modi": "Dynamisch, Spiel, Bild, Standard",
        "Stromkabell\u00e4nge": "1,5 m",
        "Stromverbrauch Standardbetrieb": "54,4 W",
        "Stromverbrauch Standby": "0,5 W",
        "Technologie mit hohem Dynamikbereich HDR": "High Dynamic Range 10+ Gaming HDR10 Plus Gaming",
        "Tiefe ohne Standfu\u00df": "37,9 mm",
        "Touchscreen": "Nein",
        "USB-Hub-Version": "3.2 Gen 1 3.1 Gen 1",
        "Verpackungsart": "Box",
        "Verpackungsbreite": "1233 mm",
        "Verpackungsh\u00f6he": "667 mm",
        "Verpackungstiefe": "153 mm",
        "Vorderer Rahmen": "Schwarz",
        "WLAN-Standards": "Wi-Fi 5 802.11ac"
    },
    "raw_specifications_text": "Bildschirmdiagonale: 109,2 cm 43\"\nDisplay-Aufl\u00f6sung: 3840 x 2160 Pixel\nNatives Seitenverh\u00e4ltnis: 16:9\nBildschirmtechnologie: LED\nTouchscreen: Nein\nHD-Typ: 4K Ultra HD\nPanel-Typ: VA\nBildschirmform: Flach\nKontrastverh\u00e4ltnis: 4250:1\nMaximale Bildwiederholrate: 144 Hz\nAnzahl der Farben des Displays: 1 Milliarden Farben\nHelligkeit typisch: 400 cd/m\u00b2\nReaktionszeit: 1 ms\nKontrastverh\u00e4ltnis dynamisch: 1000000:1\nDynamisches Kontrastverh\u00e4ltnis Marketingbezeichnung: Mega DCR\nBildwinkel, horizontal: 178\u00b0\nBildwinkel, vertikal: 178\u00b0\nSichtbare Gr\u00f6\u00dfe horizontal: 94,1 cm\nSichtbare Gr\u00f6\u00dfe vertikal: 52,9 cm\nBildschirmdiagonale cm: 108 cm\nLokale Dimmbereiche: 1\nTechnologie mit hohem Dynamikbereich HDR: High Dynamic Range 10+ Gaming HDR10 Plus Gaming\nFarbskala: 95\nNVIDIA G-SYNC: Nein\nAMD FreeSync-Typ: FreeSync Premium Pro\nMarkenspezifische Technologien: Augenpflege+\nSmart-Modi: Dynamisch, Spiel, Bild, Standard\nInstalliertes Betriebssystem: Tizen\nIntegrierte Kamera: Nein\nMarktpositionierung: Gaming\nProduktfarbe: Wei\u00df\nVorderer Rahmen: Schwarz\nFu\u00dffarbe: Schwarz\nUSB-Hub-Version: 3.2 Gen 1 3.1 Gen 1\nDVI Anschluss: Nein\nAnzahl HDMI-Anschl\u00fcsse: 2\nHDMI-Version: 2.1\nAnzahl DisplayPort Anschl\u00fcsse: 1\nDisplayPorts-Version: 1.4\nHDCP-Version: 2.2\nWLAN-Standards: Wi-Fi 5 802.11ac\nBluetooth-Version: 5.2\nH\u00f6henverstellung: Nein\nPanel-Montage-Schnittstelle: 200 x 200 mm\nNeigungswinkelbereich: -2 - 20\u00b0\nEnergieeffizienzklasse SDR: G\nEnergieeffizienzklasse HDR: G\nEnergieverbrauch SDR pro 1.000 Stunden: 54 kWh\nEnergieverbrauch HDR pro 1.000 Stunden: 105 kWh\nStromverbrauch Standardbetrieb: 54,4 W\nStromverbrauch Standby: 0,5 W\nAC Eingangsspannung: 100 - 240 V\nAC Eingangsfrequenz: 50 - 60 Hz\nNetzteiltyp: Intern\nEnergieeffizienzskala: A bis G\nJ\u00e4hrlicher Energieverbrauch: 79 kWh\nBetriebstemperatur: 0 - 40 \u00b0C\nRelative Luftfeuchtigkeit in Betrieb: 10 - 80\nMitgelieferte Kabel: DisplayPort, Leistung\nStromkabell\u00e4nge: 1,5 m\nGer\u00e4tebreite inkl. Fu\u00df: 960,8 mm\nGer\u00e4tetiefe inkl. Fu\u00df: 254,1 mm\nGer\u00e4teh\u00f6he inkl. Fu\u00df: 635 mm\nGewicht mit St\u00e4nder: 11,7 kg\nBreite ohne Standfu\u00df: 960,8 mm\nTiefe ohne Standfu\u00df: 37,9 mm\nH\u00f6he ohne Standfu\u00df: 563,3 mm\nGewicht ohne St\u00e4nder: 9,2 kg\nVerpackungsbreite: 1233 mm\nVerpackungstiefe: 153 mm\nVerpackungsh\u00f6he: 667 mm\nPaketgewicht: 161 kg\nVerpackungsart: Box",
    "reference_file": "offer_reference_516.json",
    "shop_name": "CSV-Direct.de"
}