{
    "html_file": "offer_1558_1.html",
    "name": "HP E27u G4, 27\"",
    "offer_link": "https://www.playox.de/productredirect/index/sku/15543277?sPartner=p-geizhals-at&campaign=psm/geizhals-at/",
    "price": 265.41,
    "raw_specifications": {
        "Anschl\u00fcsse": "USB, DisplayPort, HDMI",
        "Artikelnummer": "15543277",
        "Aufl\u00f6sung Kurzname": "Full HD",
        "Bezeichnung des Herstellers": "HP E27u G4",
        "Bildwiederholungsrate": "60,00 Hz",
        "Breite": "-1,00 mm",
        "Displaygr\u00f6\u00dfe": "68,58 cm (27 Zoll)",
        "Displayoberfl\u00e4che": "matt",
        "EEK - Spektrum": "AG",
        "Energieeffizienzklasse": "E",
        "Geh\u00e4usefarbe des Ger\u00e4tes": "Schwarz",
        "Gewicht": "6,20 kg",
        "Gewicht inkl. Verpackung in Kg": "11,00 kg",
        "Helligkeit Bereich": "150 - 300 cd/m\u00b2",
        "Hersteller": "HP Inc.",
        "H\u00f6he": "-1,00 mm",
        "Inhalt (ml oder g)": "0,00 ml",
        "Kapazit\u00e4t (Seiten)": "0",
        "Kontrastverh\u00e4ltnis (typisch) Bereich": "800:1 bis 1.200:1",
        "LCD-Technologie": "IPS Panel",
        "L\u00e4nge": "-1,00 mm",
        "Produktart": "Monitore",
        "Reaktionszeit": "5,00 ms",
        "Seitenverh\u00e4ltnis": "16:9",
        "Shop Herstellernummer": "189T3AA#ABB",
        "Standard-EAN": "0195122124649",
        "Verpackung - Breite in cm": "69,50 cm",
        "Verpackung - H\u00f6he in cm": "38,60 cm",
        "Verpackung - L\u00e4nge in cm": "44,40 cm",
        "max. Aufl\u00f6sung": "2.560 x 1.440 Pixel (16:9)"
    },
    "raw_specifications_text": "Displaygr\u00f6\u00dfe: 68,58 cm (27 Zoll)\nGeh\u00e4usefarbe des Ger\u00e4tes: Schwarz\nAnschl\u00fcsse: USB, DisplayPort, HDMI\nGewicht: 6,20 kg\nProduktart: Monitore\nHelligkeit Bereich: 150 - 300 cd/m\u00b2\nHersteller: HP Inc.\nKontrastverh\u00e4ltnis (typisch) Bereich: 800:1 bis 1.200:1\nInhalt (ml oder g): 0,00 ml\nKapazit\u00e4t (Seiten): 0\nAufl\u00f6sung Kurzname: Full HD\nBreite: -1,00 mm\nH\u00f6he: -1,00 mm\nL\u00e4nge: -1,00 mm\nEEK - Spektrum: AG\nGewicht inkl. Verpackung in Kg: 11,00 kg\nArtikelnummer: 15543277\nStandard-EAN: 0195122124649\nShop Herstellernummer: 189T3AA#ABB\nBezeichnung des Herstellers: HP E27u G4\nVerpackung - Breite in cm: 69,50 cm\nVerpackung - H\u00f6he in cm: 38,60 cm\nVerpackung - L\u00e4nge in cm: 44,40 cm\nmax. Aufl\u00f6sung: 2.560 x 1.440 Pixel (16:9)\nSeitenverh\u00e4ltnis: 16:9\nLCD-Technologie: IPS Panel\nReaktionszeit: 5,00 ms\nDisplayoberfl\u00e4che: matt\nBildwiederholungsrate: 60,00 Hz\nEnergieeffizienzklasse: E",
    "reference_file": "offer_reference_1558.json",
    "shop_name": "playox (AT)"
}