{
    "html_file": "offer_1523_13.html",
    "name": "ViewSonic VG2439Smh-2, 23.6\"",
    "offer_link": "https://www.electronicshop24.at/product_info.php?products_id=20000000132197375&ano=I132197375&mno=VG2439SMH-2&ean=766907801910&utm_medium=cpc&utm_campaign=preisvergleich&utm_content=item&utm_source=geizhals&ref=geizhals",
    "price": 146.0,
    "raw_specifications": {
        "Abmessungen (Breite x Tiefe x H\u00f6he)": "56.03 cm x 23.96 cm x 43.52 cm - mit Fu\u00df",
        "Ausgangsleistung/Kanal": "2 Watt",
        "Besonderheiten": "Eco-Mode, flimmerfreie Technologie, Bluelight Filter",
        "Bildschirmtyp": "VA",
        "Details zu Abmessungen & Gewicht": "Mit Fu\u00df - Breite: 56.03 cm - Tiefe: 23.96 cm - H\u00f6he: 43.52 cm - Gewicht: 4.49 kg \u00a6 Ohne Fu\u00df - Breite: 56.03 cm - Tiefe: 5.82 cm - H\u00f6he: 33.27 cm - Gewicht: 3.53 kg",
        "Diagonalabmessung": "61 cm (24\")",
        "Display-Typ": "LED-hintergrundbeleuchteter LCD-Monitor / TFT-Aktivmatrix",
        "Eingangsspannung": "Wechselstrom 120/230 V (50/60 Hz)",
        "Einstellungen der Anzeigeposition": "H\u00f6he, Pivot (Rotation), Drehung, Neigung",
        "Enthaltene Kabel": "1 x DisplayPort-Kabel - 1.8 m \u00a6 1 x USB-Kabel - 1.8 m \u00a6 1 x Audiokabel - 1.8 m",
        "Gewicht": "4.49 kg",
        "Helligkeit": "250 cd/m\u00b2",
        "Hintergrundbeleuchtungs-Technologie": "LED-Hintergrundbeleuchtung",
        "Horizontale Bildwiederholrate": "24 - 82 kHz",
        "Horizontaler Betrachtungswinkel": "178",
        "H\u00f6heneinstellung": "135 mm",
        "Integrierte Peripherieger\u00e4te": "USB 2.0 Hub",
        "Kennzeichnung": "VCCI, BSMI, GS, RoHS, WEEE, PSE Mark, MEPS, REACH, UkrSEPRO, EAC, RCM",
        "Kontrast": "3000:1 / 20000000:1 (dynamisch)",
        "Max. Betriebstemperatur": "40 \u00b0C",
        "Min Betriebstemperatur": "0 \u00b0C",
        "Native Aufl\u00f6sung": "Full HD (1080p) 1920 x 1080",
        "Neigungswinkel": "-5/+20",
        "Reaktionszeit": "5 ms (Gray-to-Gray)",
        "Rotationswinkel": "90",
        "Schnittstellen": "VGA \u00a6 HDMI \u00a6 DisplayPort \u00a6 Audio Line-In \u00a6 Kopfh\u00f6rer \u00a6 2 x USB 2.0 Downstream (Typ A) \u00a6 USB 2.0 Upstream (Typ B)",
        "Schwenkwinkel": "360",
        "Seitenverh\u00e4ltnis": "16:9",
        "Sichtbare Bildfl\u00e4che": "59.9 cm (23.6\")",
        "Stromverbrauch (typisch)": "18.7 Watt",
        "Transportbreite": "65.2 cm",
        "Transportgewicht": "6.5 kg",
        "Transporth\u00f6he": "42 cm",
        "Transporttiefe": "19.5 cm",
        "Typ": "Lautsprecher - Stereo",
        "VESA-Halterung": "100 x 100 mm",
        "Vertikale Bildwiederholrate": "50 - 75 Hz",
        "Vertikaler Betrachtungswinkel": "178",
        "Zul\u00e4ssige Luftfeuchtigkeit im Betrieb": "20 - 90% (nicht kondensierend)"
    },
    "raw_specifications_text": "Display-Typ: LED-hintergrundbeleuchteter LCD-Monitor / TFT-Aktivmatrix\nDiagonalabmessung: 61 cm (24\")\nSichtbare Bildfl\u00e4che: 59.9 cm (23.6\")\nIntegrierte Peripherieger\u00e4te: USB 2.0 Hub\nBildschirmtyp: VA\nSeitenverh\u00e4ltnis: 16:9\nNative Aufl\u00f6sung: Full HD (1080p) 1920 x 1080\nHelligkeit: 250 cd/m\u00b2\nKontrast: 3000:1 / 20000000:1 (dynamisch)\nReaktionszeit: 5 ms (Gray-to-Gray)\nVertikale Bildwiederholrate: 50 - 75 Hz\nHorizontale Bildwiederholrate: 24 - 82 kHz\nHorizontaler Betrachtungswinkel: 178\nVertikaler Betrachtungswinkel: 178\nHintergrundbeleuchtungs-Technologie: LED-Hintergrundbeleuchtung\nBesonderheiten: Eco-Mode, flimmerfreie Technologie, Bluelight Filter\nAbmessungen (Breite x Tiefe x H\u00f6he): 56.03 cm x 23.96 cm x 43.52 cm - mit Fu\u00df\nGewicht: 4.49 kg\nTyp: Lautsprecher - Stereo\nAusgangsleistung/Kanal: 2 Watt\nSchnittstellen: VGA \u00a6 HDMI \u00a6 DisplayPort \u00a6 Audio Line-In \u00a6 Kopfh\u00f6rer \u00a6 2 x USB 2.0 Downstream (Typ A) \u00a6 USB 2.0 Upstream (Typ B)\nEinstellungen der Anzeigeposition: H\u00f6he, Pivot (Rotation), Drehung, Neigung\nNeigungswinkel: -5/+20\nSchwenkwinkel: 360\nRotationswinkel: 90\nH\u00f6heneinstellung: 135 mm\nVESA-Halterung: 100 x 100 mm\nEnthaltene Kabel: 1 x DisplayPort-Kabel - 1.8 m \u00a6 1 x USB-Kabel - 1.8 m \u00a6 1 x Audiokabel - 1.8 m\nKennzeichnung: VCCI, BSMI, GS, RoHS, WEEE, PSE Mark, MEPS, REACH, UkrSEPRO, EAC, RCM\nEingangsspannung: Wechselstrom 120/230 V (50/60 Hz)\nStromverbrauch (typisch): 18.7 Watt\nDetails zu Abmessungen & Gewicht: Mit Fu\u00df - Breite: 56.03 cm - Tiefe: 23.96 cm - H\u00f6he: 43.52 cm - Gewicht: 4.49 kg \u00a6 Ohne Fu\u00df - Breite: 56.03 cm - Tiefe: 5.82 cm - H\u00f6he: 33.27 cm - Gewicht: 3.53 kg\nTransportbreite: 65.2 cm\nTransporttiefe: 19.5 cm\nTransporth\u00f6he: 42 cm\nTransportgewicht: 6.5 kg\nMin Betriebstemperatur: 0 \u00b0C\nMax. Betriebstemperatur: 40 \u00b0C\nZul\u00e4ssige Luftfeuchtigkeit im Betrieb: 20 - 90% (nicht kondensierend)",
    "reference_file": "offer_reference_1523.json",
    "shop_name": "ElectronicShop24"
}