{
    "html_file": "offer_794_0.html",
    "name": "ASUS ZenScreen OLED MQ13AH, 13.3\"",
    "offer_link": "https://www.proshop.at/Bildschirm/ASUS-13-Bildschirm-LED-monitor-Full-HD-1080p-Grey-1-ms/3145597?utm_source=geizhals&utm_medium=cpc&utm_campaign=pricesite",
    "price": 416.54,
    "raw_specifications": {
        "Abmessungen (Breite x Tiefe x H\u00f6he)": "30.82 cm x 0.895 cm x 19.71 cm - ohne Fu\u00df",
        "Abmessungen (Breite x Tiefe x H\u00f6he) - ohne Fu\u00df": "30.82 cm x 0.895 cm x 19.71 cm",
        "Besonderheiten": "ASUS Splendid Video Intelligence Technology, Trace Free Technology, ASUS Smart Contrast Ratio (ASCR), ASUS QuickFit Virtual Scale, ASUS GamePlus, flimmerfreie Technologie, Super Slim Design, Farbtemperatur Auswahl, Low Blue Light-Technologie, Monitorkalibrierung Delta E<2, Display Widget",
        "Bildschirmbeschichtung": "Anti-Blendbehandlung",
        "Diagonalabmessung": "33 cm (13\")",
        "Display-Typ": "OLED-Monitor / OLED",
        "EAN": "4711081259480",
        "ENERGY STAR zertifiziert": "Ja",
        "ENERGY STAR-Version": "8.0",
        "Eingangsanschl\u00fcsse": "Mini HDMI, 2xUSB-C",
        "Eingangsspannung": "Wechselstrom 100-240 V (50/60 Hz)",
        "Energie Effizienzklasse": "Klasse C",
        "Energieklasse (HDR)": "Klasse D",
        "Enthaltene Kabel": "1 x Mini-HDMI-HDMI-Kabel  1 x USB-C Kabel",
        "Farbe": "Grau",
        "Farbraum": "100% DCI-P3",
        "Farbunterst\u00fctzung": "1,0737 Milliarden Farben (10-Bit)",
        "Ger\u00e4tetyp": "OLED-Monitor - 33 cm (13\")",
        "Gewicht": "490 g",
        "HDR-Format": "HDR10",
        "HDR-f\u00e4hig": "HDR10",
        "Helligkeit": "400 cd/m\u00b2",
        "Hersteller": "ASUS",
        "Horizontaler Betrachtungswinkel": "178",
        "Integrierte Peripherieger\u00e4te": "N\u00e4herungssensor",
        "Kennzeichnung": "UL, VCCI, BSMI, cUL, WHQL, CB, CCC, FCC, RoHS, KCC, WEEE, J-MOSS, UkrSEPRO, EAC, RCM, CU, TUV Rheinland Flicker Free Certification, HDCP 1.4, TUV Rheinland Low Blue Light (Hardware Solution)",
        "Kontrast": "100000:1 / 1000000:1 (dynamisch)",
        "Leistungsmerkmale": "Auf Stativ montierbar",
        "Mitgelieferte Software": "Adobe Creative Cloud (3-Monats-Mitgliedschaft)",
        "Modell": "90LM07EV-B01170",
        "Native Aufl\u00f6sung": "Full HD (1080p) 1920 x 1080 bei 60 Hz",
        "Pixelpitch": "0.153 mm",
        "Produktbeschreibung": "ASUS ZenScreen OLED MQ13AH - OLED-Monitor - Full HD (1080p) - 33 cm (13\") - HDR",
        "Reaktionszeit": "1 ms (tr + tf)",
        "Schnittstellen": "2 x USB-C/DisplayPort Alt Mode  Mini HDMI  USB-C (nur Strom)",
        "Seitenverh\u00e4ltnis": "16:9",
        "Sichtbare Bildfl\u00e4che": "33.78 cm (13.3\")",
        "Spannung": "Wechselstrom 100-240 V (50/60 Hz)",
        "Stromverbrauch (Aus-Modus)": "0.3 Watt",
        "Stromverbrauch (max.)": "15 Watt",
        "Stromverbrauch (typisch)": "4.64 Watt",
        "Stromverbrauch HDR (eingeschaltet)": "9 kWh/1.000 h",
        "Stromverbrauch SDR (eingeschaltet)": "7 kWh/1.000 h",
        "Stromverbrauch im Standby-Modus": "0.5 Watt",
        "Transportbreite": "50.6 cm",
        "Transportgewicht": "3.05 kg",
        "Transporth\u00f6he": "13.4 cm",
        "Transporttiefe": "36.1 cm",
        "Umweltschutzstandards": "ENERGY STAR-qualifiziert",
        "Vertikaler Betrachtungswinkel": "178",
        "Waren-Nr.": "3145597",
        "Zubeh\u00f6r im Lieferumfang": "ZenScreen Smart Case, USB-C Netzteil",
        "Zum Hersteller": "www.asus.com/"
    },
    "raw_specifications_text": "Hersteller: ASUS\nWaren-Nr.: 3145597\nModell: 90LM07EV-B01170\nEAN: 4711081259480\nZum Hersteller: www.asus.com/\nProduktbeschreibung: ASUS ZenScreen OLED MQ13AH - OLED-Monitor - Full HD (1080p) - 33 cm (13\") - HDR\nGer\u00e4tetyp: OLED-Monitor - 33 cm (13\")\nEnergie Effizienzklasse: Klasse C\nLeistungsmerkmale: Auf Stativ montierbar\nSeitenverh\u00e4ltnis: 16:9\nNative Aufl\u00f6sung: Full HD (1080p) 1920 x 1080 bei 60 Hz\nPixelpitch: 0.153 mm\nHelligkeit: 400 cd/m\u00b2\nKontrast: 100000:1 / 1000000:1 (dynamisch)\nHDR-f\u00e4hig: HDR10\nReaktionszeit: 1 ms (tr + tf)\nFarbunterst\u00fctzung: 1,0737 Milliarden Farben (10-Bit)\nFarbraum: 100% DCI-P3\nEingangsanschl\u00fcsse: Mini HDMI, 2xUSB-C\nBildschirmbeschichtung: Anti-Blendbehandlung\nSpannung: Wechselstrom 100-240 V (50/60 Hz)\nFarbe: Grau\nAbmessungen (Breite x Tiefe x H\u00f6he) - ohne Fu\u00df: 30.82 cm x 0.895 cm x 19.71 cm\nGewicht: 490 g\nUmweltschutzstandards: ENERGY STAR-qualifiziert\nKennzeichnung: UL, VCCI, BSMI, cUL, WHQL, CB, CCC, FCC, RoHS, KCC, WEEE, J-MOSS, UkrSEPRO, EAC, RCM, CU, TUV Rheinland Flicker Free Certification, HDCP 1.4, TUV Rheinland Low Blue Light (Hardware Solution)\nDisplay-Typ: OLED-Monitor / OLED\nEnergieklasse (HDR): Klasse D\nDiagonalabmessung: 33 cm (13\")\nSichtbare Bildfl\u00e4che: 33.78 cm (13.3\")\nIntegrierte Peripherieger\u00e4te: N\u00e4herungssensor\nHDR-Format: HDR10\nHorizontaler Betrachtungswinkel: 178\nVertikaler Betrachtungswinkel: 178\nBesonderheiten: ASUS Splendid Video Intelligence Technology, Trace Free Technology, ASUS Smart Contrast Ratio (ASCR), ASUS QuickFit Virtual Scale, ASUS GamePlus, flimmerfreie Technologie, Super Slim Design, Farbtemperatur Auswahl, Low Blue Light-Technologie, Monitorkalibrierung Delta E<2, Display Widget\nAbmessungen (Breite x Tiefe x H\u00f6he): 30.82 cm x 0.895 cm x 19.71 cm - ohne Fu\u00df\nSchnittstellen: 2 x USB-C/DisplayPort Alt Mode  Mini HDMI  USB-C (nur Strom)\nZubeh\u00f6r im Lieferumfang: ZenScreen Smart Case, USB-C Netzteil\nEnthaltene Kabel: 1 x Mini-HDMI-HDMI-Kabel  1 x USB-C Kabel\nEingangsspannung: Wechselstrom 100-240 V (50/60 Hz)\nStromverbrauch SDR (eingeschaltet): 7 kWh/1.000 h\nStromverbrauch HDR (eingeschaltet): 9 kWh/1.000 h\nStromverbrauch (typisch): 4.64 Watt\nStromverbrauch (max.): 15 Watt\nStromverbrauch im Standby-Modus: 0.5 Watt\nStromverbrauch (Aus-Modus): 0.3 Watt\nMitgelieferte Software: Adobe Creative Cloud (3-Monats-Mitgliedschaft)\nTransportbreite: 50.6 cm\nTransporttiefe: 36.1 cm\nTransporth\u00f6he: 13.4 cm\nTransportgewicht: 3.05 kg\nENERGY STAR zertifiziert: Ja\nENERGY STAR-Version: 8.0",
    "reference_file": "offer_reference_794.json",
    "shop_name": "Proshop.at"
}