{
    "html_file": "offer_904_1.html",
    "name": "ViewSonic VG2448a-2, 23.8\"",
    "offer_link": "https://direkt.jacob.de/produkte/viewsonic-vg-series-vg2448a-2-artnr-7642199.html?utm_source=geizhals&utm_medium=cpc&utm_campaign=Preisvergleich&ref=103",
    "price": 160.51,
    "raw_specifications": {
        "AC Eingangsfrequenz": "50/60 Hz",
        "AC Eingangsspannung": "100 - 240 V",
        "AMD FreeSync": "Nein",
        "Anzahl DisplayPort Anschl\u00fcsse": "1",
        "Anzahl HDMI-Anschl\u00fcsse": "1",
        "Anzahl VGA (D-Sub) Anschl\u00fcsse": "1",
        "Anzahl der Farben des Displays": "16,7 Millionen Farben",
        "Anzahl der nachgeschalteten Steckpl\u00e4tze vom Typ USB-A": "4",
        "Anzahl der vorgeschalteten Steckpl\u00e4tze": "1",
        "Betriebstemperatur": "0 - 40 \u00b0C",
        "Bildschirmaufl\u00f6sung": "1920 x 1080 Pixel",
        "Bildschirmdiagonale": "61 cm (24\" )",
        "Bildschirmform": "Flach",
        "Bildschirmtechnologie": "LED",
        "Bildwinkel, horizontal": "178\u00b0",
        "Bildwinkel, vertikal": "178\u00b0",
        "Blendfreier Bildschirm": "Ja",
        "Breite (ohne Standfu\u00df)": "61,2 cm",
        "Eingebaute Lautsprecher": "Ja",
        "Energie Effizienzklasse": "E",
        "Farbtiefe": "6 Bit",
        "Fu\u00dffarbe": "Schwarz",
        "Ger\u00e4tebreite (inkl. Fu\u00df)": "612 mm",
        "Ger\u00e4teh\u00f6he (inkl. Fu\u00df)": "401,2 mm",
        "Ger\u00e4tetiefe (inkl. Fu\u00df)": "202 mm",
        "Gewicht (mit St\u00e4nder)": "7,3 kg",
        "Gewicht (ohne St\u00e4nder)": "4,9 kg",
        "HD-Typ": "Full HD",
        "HDMI": "Ja",
        "HDMI-Version": "1.4",
        "Helligkeit (typisch)": "250 cd/m\u00b2",
        "H\u00f6he (ohne Standfu\u00df)": "36,2 cm",
        "H\u00f6heneinstellung": "13 cm",
        "H\u00f6henverstellung": "Ja",
        "Integrierte Kamera": "Nein",
        "Integrierter USB-Hub": "Ja",
        "Kabelsperre-Slot": "Ja",
        "Kontrastverh\u00e4ltnis": "1000:1",
        "Kontrastverh\u00e4ltnis (dynamisch)": "50000000:1",
        "Kopfh\u00f6rerausgang": "Nein",
        "Marktpositionierung": "Haus",
        "Mitgelieferte Kabel": "AC, DisplayPort, USB Typ-A auf USB Typ-B",
        "NVIDIA G-SYNC": "Nein",
        "Natives Seitenverh\u00e4ltnis": "16:9",
        "Neigungswinkelbereich": "5 - 40\u00b0",
        "Paketgewicht": "10,5 kg",
        "Panel-Typ": "IPS",
        "Pivot": "Ja",
        "Pivot Winkel": "90 - 90\u00b0",
        "Produktfarbe": "Schwarz",
        "RMS-Leistung": "4 W",
        "Reaktionszeit": "5 ms",
        "Relative Luftfeuchtigkeit in Betrieb": "20 - 90%",
        "Schnellstart\u00fcbersicht": "Ja",
        "Schwenkbar": "Ja",
        "Schwenkwinkelbereich": "0 - 120\u00b0",
        "Slot-Typ Kabelsperre": "Kensington",
        "Stromverbrauch (Standardbetrieb)": "25,5 W",
        "Stromverbrauch (Standby)": "0,5 W",
        "Stromverbrauch (max.)": "58 W",
        "St\u00e4nder enthalten": "Ja",
        "Tiefe (ohne Standfu\u00df)": "5,2 cm",
        "USB-Upstream-Porttyp": "USB Typ-B",
        "Verpackungsbreite": "692 mm",
        "Verpackungsh\u00f6he": "430 mm",
        "Verpackungstiefe": "218 mm",
        "Zertifizierung": "cTUVus, FCC-B, ICES003, Energy Star 8.0, EPEAT Silver, CEC, NOM, Mexico Energy",
        "kippbar": "Ja"
    },
    "raw_specifications_text": "Bildschirmdiagonale: 61 cm (24\" )\nBildschirmaufl\u00f6sung: 1920 x 1080 Pixel\nEnergie Effizienzklasse: E\nNatives Seitenverh\u00e4ltnis: 16:9\nPanel-Typ: IPS\nHD-Typ: Full HD\nBildschirmtechnologie: LED\nBildschirmform: Flach\nKontrastverh\u00e4ltnis: 1000:1\nAnzahl der Farben des Displays: 16,7 Millionen Farben\nHelligkeit (typisch): 250 cd/m\u00b2\nReaktionszeit: 5 ms\nBlendfreier Bildschirm: Ja\nKontrastverh\u00e4ltnis (dynamisch): 50000000:1\nBildwinkel, horizontal: 178\u00b0\nBildwinkel, vertikal: 178\u00b0\nFarbtiefe: 6 Bit\nNVIDIA G-SYNC: Nein\nAMD FreeSync: Nein\nEingebaute Lautsprecher: Ja\nIntegrierte Kamera: Nein\nRMS-Leistung: 4 W\nMarktpositionierung: Haus\nProduktfarbe: Schwarz\nFu\u00dffarbe: Schwarz\nZertifizierung: cTUVus, FCC-B, ICES003, Energy Star 8.0, EPEAT Silver, CEC, NOM, Mexico Energy\nIntegrierter USB-Hub: Ja\nHDMI: Ja\nKopfh\u00f6rerausgang: Nein\nUSB-Upstream-Porttyp: USB Typ-B\nAnzahl der vorgeschalteten Steckpl\u00e4tze: 1\nAnzahl der nachgeschalteten Steckpl\u00e4tze vom Typ USB-A: 4\nAnzahl VGA (D-Sub) Anschl\u00fcsse: 1\nAnzahl HDMI-Anschl\u00fcsse: 1\nHDMI-Version: 1.4\nAnzahl DisplayPort Anschl\u00fcsse: 1\nKabelsperre-Slot: Ja\nH\u00f6henverstellung: Ja\nSlot-Typ Kabelsperre: Kensington\nH\u00f6heneinstellung: 13 cm\nPivot: Ja\nPivot Winkel: 90 - 90\u00b0\nSchwenkbar: Ja\nSchwenkwinkelbereich: 0 - 120\u00b0\nkippbar: Ja\nNeigungswinkelbereich: 5 - 40\u00b0\nStromverbrauch (Standardbetrieb): 25,5 W\nStromverbrauch (Standby): 0,5 W\nStromverbrauch (max.): 58 W\nAC Eingangsspannung: 100 - 240 V\nAC Eingangsfrequenz: 50/60 Hz\nBetriebstemperatur: 0 - 40 \u00b0C\nRelative Luftfeuchtigkeit in Betrieb: 20 - 90%\nGer\u00e4tebreite (inkl. Fu\u00df): 612 mm\nGer\u00e4tetiefe (inkl. Fu\u00df): 202 mm\nGer\u00e4teh\u00f6he (inkl. Fu\u00df): 401,2 mm\nGewicht (mit St\u00e4nder): 7,3 kg\nBreite (ohne Standfu\u00df): 61,2 cm\nTiefe (ohne Standfu\u00df): 5,2 cm\nH\u00f6he (ohne Standfu\u00df): 36,2 cm\nGewicht (ohne St\u00e4nder): 4,9 kg\nSt\u00e4nder enthalten: Ja\nMitgelieferte Kabel: AC, DisplayPort, USB Typ-A auf USB Typ-B\nSchnellstart\u00fcbersicht: Ja\nVerpackungsbreite: 692 mm\nVerpackungstiefe: 218 mm\nVerpackungsh\u00f6he: 430 mm\nPaketgewicht: 10,5 kg",
    "reference_file": "offer_reference_904.json",
    "shop_name": "Jacob Elektronik direkt (AT)"
}