{
    "html_file": "offer_2310_21.html",
    "name": "AOC I1601FWUX, 15.6\"",
    "offer_link": "https://technikladen.at/P-AOC-01-Series-I1601FWUX-396-cm-156-Zoll-1920-x-1080-Pixel-Full-HD-LED-5-ms-Schwarz?tl=gzhls",
    "price": 208.38,
    "raw_specifications": {
        "3D": "Nein",
        "AMD FreeSync": "Nein",
        "Anzahl der Farben des Displays": "16,78 Millionen Farben",
        "Anzahl der nachgeschalteten Ports vom Typ USB-C": "1",
        "Betriebstemperatur": "0 - 40 \u00b0C",
        "Bildschirmaufl\u00f6sung": "1920 x 1080 Pixel",
        "Bildschirmdiagonale": "39,6 cm",
        "Bildschirmform": "Flach",
        "Bildschirmtechnologie": "LED",
        "Bildwinkel, horizontal": "160 \u00b0",
        "Bildwinkel, vertikal": "160 \u00b0",
        "Breite (ohne Standfu\u00df)": "37,6 cm",
        "DVI Anschluss": "Nein",
        "Eingebaute Lautsprecher": "Nein",
        "Energieeffizienzklasse (SDR)": "B",
        "Energieeffizienzskala": "A bis G",
        "Energieverbrauch (SDR) pro 1.000 Stunden": "5 kWh",
        "Externes Netzteil": "Nein",
        "Farbtiefe": "6 Bit",
        "Ger\u00e4tebreite (inkl. Fu\u00df)": "376,2 mm",
        "Ger\u00e4teh\u00f6he (inkl. Fu\u00df)": "235 mm",
        "Ger\u00e4tetiefe (inkl. Fu\u00df)": "8,5 mm",
        "Gewicht (mit St\u00e4nder)": "824 g",
        "HD-Typ": "Full HD",
        "Helligkeit (typisch)": "220 cd/m\u00b2",
        "Horizontaler Scanbereich": "30 - 83 kHz",
        "H\u00f6he bei Betrieb": "0 - 5000 m",
        "H\u00f6he bei Lagerung": "5000 - 12192 m",
        "H\u00f6henverstellung": "Nein",
        "Integrierte Kamera": "Nein",
        "Integrierter USB-Hub": "Ja",
        "Kabelsperre-Slot": "Nein",
        "Kontrastverh\u00e4ltnis": "700:1",
        "Kontrastverh\u00e4ltnis (dynamisch)": "100000000:1",
        "Low-Blue-Light-Technologie": "Ja",
        "Luftfeuchtigkeit bei Lagerung": "5 - 93 %",
        "Marktpositionierung": "Haus",
        "Maximale Bildwiederholrate": "60 Hz",
        "Mitgelieferte Kabel": "USB Typ-C",
        "NVIDIA G-SYNC": "Nein",
        "Nachhaltigkeitszertifikate": "RoHS, EPEAT Silver, ENERGY STAR",
        "Natives Seitenverh\u00e4ltnis": "16:9",
        "Neigungswinkelbereich": "-5 - 25 \u00b0",
        "Paketgewicht": "1,57 kg",
        "Panel-Typ": "IPS",
        "Pivot": "Ja",
        "Pixel Abstand": "0,179 x 0,179 mm",
        "Produktfarbe": "Schwarz",
        "Reaktionszeit": "5 ms",
        "Recycelbares Verpackungsmaterial": "100 %",
        "Relative Luftfeuchtigkeit in Betrieb": "10 - 85 %",
        "Schnellstart\u00fcbersicht": "Ja",
        "Schwermetallfrei": "Hg (Quecksilber)",
        "Seitenverh\u00e4ltnis": "16:9",
        "Sichtbare Gr\u00f6\u00dfe (horizontal)": "34,4 cm",
        "Sichtbare Gr\u00f6\u00dfe (vertikal)": "19,4 cm",
        "Stromverbrauch (Standardbetrieb)": "8 W",
        "Stromverbrauch (Standby)": "0,5 W",
        "Stromverbrauch (max.)": "23,5 W",
        "TV Tuner integriert": "Nein",
        "Temperaturbereich bei Lagerung": "-25 - 55 \u00b0C",
        "Typ der Hintergrundbeleuchtung": "W-LED",
        "Typ der L\u00fcnettendicke": "Normal",
        "USB Kabell\u00e4nge": "1,8 m",
        "USB-Typ-C DisplayPort-Wechselmodus": "Ja",
        "USB-Upstream-Porttyp": "USB Typ-C",
        "Unterst\u00fctzte Grafik-Aufl\u00f6sungen": "1920 x 1080 (HD 1080)",
        "Verpackungsart": "Box",
        "Verpackungsbreite": "442 mm",
        "Verpackungsh\u00f6he": "295 mm",
        "Verpackungstiefe": "84 mm",
        "Vertikaler Scanbereich": "50 - 76 Hz",
        "kippbar": "Ja"
    },
    "raw_specifications_text": "NVIDIA G-SYNC: Nein\nAMD FreeSync: Nein\nLow-Blue-Light-Technologie: Ja\nBildschirmdiagonale: 39,6 cm\nBildschirmaufl\u00f6sung: 1920 x 1080 Pixel\nNatives Seitenverh\u00e4ltnis: 16:9\nPanel-Typ: IPS\nHelligkeit (typisch): 220 cd/m\u00b2\nReaktionszeit: 5 ms\nHD-Typ: Full HD\nBildschirmtechnologie: LED\nTyp der Hintergrundbeleuchtung: W-LED\nBildschirmform: Flach\nUnterst\u00fctzte Grafik-Aufl\u00f6sungen: 1920 x 1080 (HD 1080)\nSeitenverh\u00e4ltnis: 16:9\nKontrastverh\u00e4ltnis: 700:1\nKontrastverh\u00e4ltnis (dynamisch): 100000000:1\nMaximale Bildwiederholrate: 60 Hz\nBildwinkel, horizontal: 160 \u00b0\nBildwinkel, vertikal: 160 \u00b0\nAnzahl der Farben des Displays: 16,78 Millionen Farben\n3D: Nein\nPixel Abstand: 0,179 x 0,179 mm\nHorizontaler Scanbereich: 30 - 83 kHz\nVertikaler Scanbereich: 50 - 76 Hz\nSichtbare Gr\u00f6\u00dfe (horizontal): 34,4 cm\nSichtbare Gr\u00f6\u00dfe (vertikal): 19,4 cm\nFarbtiefe: 6 Bit\nIntegrierter USB-Hub: Ja\nUSB-Upstream-Porttyp: USB Typ-C\nAnzahl der nachgeschalteten Ports vom Typ USB-C: 1\nUSB-Typ-C DisplayPort-Wechselmodus: Ja\nDVI Anschluss: Nein\nEingebaute Lautsprecher: Nein\nIntegrierte Kamera: Nein\nMarktpositionierung: Haus\nProduktfarbe: Schwarz\nSchwermetallfrei: Hg (Quecksilber)\nMitgelieferte Kabel: USB Typ-C\nUSB Kabell\u00e4nge: 1,8 m\nSchnellstart\u00fcbersicht: Ja\nVerpackungsbreite: 442 mm\nVerpackungstiefe: 84 mm\nVerpackungsh\u00f6he: 295 mm\nPaketgewicht: 1,57 kg\nVerpackungsart: Box\nEnergieeffizienzklasse (SDR): B\nEnergieverbrauch (SDR) pro 1.000 Stunden: 5 kWh\nStromverbrauch (Standardbetrieb): 8 W\nStromverbrauch (Standby): 0,5 W\nStromverbrauch (max.): 23,5 W\nExternes Netzteil: Nein\nEnergieeffizienzskala: A bis G\nKabelsperre-Slot: Nein\nH\u00f6henverstellung: Nein\nPivot: Ja\nkippbar: Ja\nNeigungswinkelbereich: -5 - 25 \u00b0\nBetriebstemperatur: 0 - 40 \u00b0C\nTemperaturbereich bei Lagerung: -25 - 55 \u00b0C\nRelative Luftfeuchtigkeit in Betrieb: 10 - 85 %\nLuftfeuchtigkeit bei Lagerung: 5 - 93 %\nH\u00f6he bei Betrieb: 0 - 5000 m\nH\u00f6he bei Lagerung: 5000 - 12192 m\nGer\u00e4tebreite (inkl. Fu\u00df): 376,2 mm\nGer\u00e4tetiefe (inkl. Fu\u00df): 8,5 mm\nGer\u00e4teh\u00f6he (inkl. Fu\u00df): 235 mm\nGewicht (mit St\u00e4nder): 824 g\nBreite (ohne Standfu\u00df): 37,6 cm\nTV Tuner integriert: Nein\nRecycelbares Verpackungsmaterial: 100 %\nTyp der L\u00fcnettendicke: Normal\nNachhaltigkeitszertifikate: RoHS, EPEAT Silver, ENERGY STAR",
    "reference_file": "offer_reference_2310.json",
    "shop_name": "TechnikLaden"
}