{
    "html_file": "offer_680_27.html",
    "name": "ASUS ROG Swift PG27AQN, 27\"",
    "offer_link": "https://www.taufnaus.de/product/12656446",
    "price": 1398.72,
    "raw_specifications": {
        "Abmessungen (Breite x Tiefe x H\u00f6he)": "61.4 cm x 25.5 cm x 40.8 cm - mit Fu\u00df",
        "Adaptive-Sync Technologie": "NVIDIA G-SYNC",
        "Besonderheiten": "ASUS GamePlus, flimmerfreie Technologie, ASUS GameVisual Technology, Ultra Low Blue Light technology, ASUS Aura Sync technology, NVIDIA Reflex Latency Analyzer, Delta E=2-Farbgenauigkeit",
        "Bildschirmbeschichtung": "Blendfrei",
        "Bildschirmtyp": "Fast IPS",
        "Details zu Abmessungen & Gewicht": "Mit Standfu\u00df (niedrigste Position) - Breite: 61.4 cm - Tiefe: 25.5 cm - H\u00f6he: 40.8 cm - Gewicht: 8.4 kg \u00a6 Mit Standfu\u00df (h\u00f6chste Position) - Breite: 61.4 cm - Tiefe: 25.5 cm - H\u00f6he: 50.8 cm - Gewicht: 8.4 kg \u00a6 Ohne Fu\u00df - Breite: 61.4 cm - Tiefe: 9 cm - H\u00f6he: 36.7 cm - Gewicht: 4.8 kg",
        "Diagonalabmessung": "68.4 cm (27\")",
        "Display-Typ": "LED-hintergrundbeleuchteter LCD-Monitor / TFT-Aktivmatrix",
        "Eingangsspannung": "Wechselstrom 100-240 V (50/60 Hz)",
        "Einstellungen der Anzeigeposition": "H\u00f6he, Pivot (Rotation), Drehung, Neigung",
        "Energie Effizienzklasse": "Klasse G",
        "Energieklasse (HDR)": "Klasse G",
        "Enthaltene Kabel": "1 x DisplayPort-Kabel \u00a6 1 x USB 3.2 Kabel \u00a6 1 x HDMI-Kabel",
        "Farbe": "Schwarz",
        "Farbraum": "135% sRGB, 98% DCI-P3",
        "Farbunterst\u00fctzung": "16,7 Millionen Farben",
        "Gaming": "Ja",
        "Gewicht": "8.4 kg",
        "HDR-Format": "HDR10",
        "HDR-Zertifizierung": "DisplayHDR 600",
        "Helligkeit": "600 cd/m\u00b2",
        "Hintergrundbeleuchtungs-Technologie": "LED-Hintergrundbeleuchtung",
        "Horizontaler Betrachtungswinkel": "178",
        "H\u00f6heneinstellung": "100 mm",
        "Integrierte Peripherieger\u00e4te": "USB 3.2 Gen 1 Hub",
        "Kennzeichnung": "VCCI, C-Tick, BSMI, CB, CCC, PSB, FCC, RoHS, KCC, WEEE, PSE Mark, cTUVus, MEPS, J-MOSS, E-Standby, CEC, UkrSEPRO, ERP, CEL, TUV Rheinland Low Blue Light Certification, CU, TUV Rheinland Flicker Free Certification, DisplayPort 1.4, HDCP 2.2, Ukraine Energy Label",
        "Kontrast": "1000:1",
        "Leistungsmerkmale": "Slot f\u00fcr Sicherheitsschloss (Kabelschloss getrennt erh\u00e4ltlich), integrierte Kabelf\u00fchrung",
        "Max. Betriebstemperatur": "40 \u00b0C",
        "Min Betriebstemperatur": "0 \u00b0C",
        "Native Aufl\u00f6sung": "QHD 2560 x 1440 (DisplayPort: 360 Hz, HDMI: 240 Hz)",
        "Neigungswinkel": "-5/+20",
        "Pixelpitch": "0.233 mm",
        "Reaktionszeit": "1 ms (Gray-to-Gray)",
        "Rotationswinkel": "90",
        "Schlosstyp zur Diebstahlsicherung": "Kensington Slot",
        "Schnittstellen": "3 x HDMI \u00a6 DisplayPort 1.4 (DSC (Display Stream Compression)) \u00a6 Kopfh\u00f6rer \u00a6 USB 3.2 Gen 1 Upstream \u00a6 2 x USB 3.2 Gen 1 Downstream",
        "Schwenkwinkel": "50",
        "Seitenverh\u00e4ltnis": "16:9",
        "Service und Support": "Begrenzte Garantie - 3 Jahre",
        "Stromverbrauch (Aus-Modus)": "0.3 Watt",
        "Stromverbrauch (typisch)": "42 Watt",
        "Stromverbrauch HDR (eingeschaltet)": "49 kWh/1.000 h",
        "Stromverbrauch SDR (eingeschaltet)": "32 kWh/1.000 h",
        "Stromverbrauch im Standby-Modus": "0.5 Watt",
        "Transportbreite": "7.19 cm",
        "Transportgewicht": "11.8 kg",
        "Transporth\u00f6he": "51.2 cm",
        "Transporttiefe": "26.7 cm",
        "VESA-Halterung": "100 x 100 mm",
        "Vertikaler Betrachtungswinkel": "178",
        "Zubeh\u00f6r im Lieferumfang": "ROG-Sticker"
    },
    "raw_specifications_text": "Display-Typ: LED-hintergrundbeleuchteter LCD-Monitor / TFT-Aktivmatrix\nEnergie Effizienzklasse: Klasse G\nEnergieklasse (HDR): Klasse G\nDiagonalabmessung: 68.4 cm (27\")\nAdaptive-Sync Technologie: NVIDIA G-SYNC\nIntegrierte Peripherieger\u00e4te: USB 3.2 Gen 1 Hub\nBildschirmtyp: Fast IPS\nSeitenverh\u00e4ltnis: 16:9\nNative Aufl\u00f6sung: QHD 2560 x 1440 (DisplayPort: 360 Hz, HDMI: 240 Hz)\nPixelpitch: 0.233 mm\nHelligkeit: 600 cd/m\u00b2\nKontrast: 1000:1\nHDR-Format: HDR10\nHDR-Zertifizierung: DisplayHDR 600\nFarbunterst\u00fctzung: 16,7 Millionen Farben\nFarbraum: 135% sRGB, 98% DCI-P3\nReaktionszeit: 1 ms (Gray-to-Gray)\nGaming: Ja\nHorizontaler Betrachtungswinkel: 178\nVertikaler Betrachtungswinkel: 178\nBildschirmbeschichtung: Blendfrei\nHintergrundbeleuchtungs-Technologie: LED-Hintergrundbeleuchtung\nBesonderheiten: ASUS GamePlus, flimmerfreie Technologie, ASUS GameVisual Technology, Ultra Low Blue Light technology, ASUS Aura Sync technology, NVIDIA Reflex Latency Analyzer, Delta E=2-Farbgenauigkeit\nFarbe: Schwarz\nAbmessungen (Breite x Tiefe x H\u00f6he): 61.4 cm x 25.5 cm x 40.8 cm - mit Fu\u00df\nGewicht: 8.4 kg\nSchnittstellen: 3 x HDMI \u00a6 DisplayPort 1.4 (DSC (Display Stream Compression)) \u00a6 Kopfh\u00f6rer \u00a6 USB 3.2 Gen 1 Upstream \u00a6 2 x USB 3.2 Gen 1 Downstream\nEinstellungen der Anzeigeposition: H\u00f6he, Pivot (Rotation), Drehung, Neigung\nNeigungswinkel: -5/+20\nSchwenkwinkel: 50\nRotationswinkel: 90\nH\u00f6heneinstellung: 100 mm\nVESA-Halterung: 100 x 100 mm\nLeistungsmerkmale: Slot f\u00fcr Sicherheitsschloss (Kabelschloss getrennt erh\u00e4ltlich), integrierte Kabelf\u00fchrung\nZubeh\u00f6r im Lieferumfang: ROG-Sticker\nEnthaltene Kabel: 1 x DisplayPort-Kabel \u00a6 1 x USB 3.2 Kabel \u00a6 1 x HDMI-Kabel\nKennzeichnung: VCCI, C-Tick, BSMI, CB, CCC, PSB, FCC, RoHS, KCC, WEEE, PSE Mark, cTUVus, MEPS, J-MOSS, E-Standby, CEC, UkrSEPRO, ERP, CEL, TUV Rheinland Low Blue Light Certification, CU, TUV Rheinland Flicker Free Certification, DisplayPort 1.4, HDCP 2.2, Ukraine Energy Label\nSchlosstyp zur Diebstahlsicherung: Kensington Slot\nEingangsspannung: Wechselstrom 100-240 V (50/60 Hz)\nStromverbrauch SDR (eingeschaltet): 32 kWh/1.000 h\nStromverbrauch HDR (eingeschaltet): 49 kWh/1.000 h\nStromverbrauch (typisch): 42 Watt\nStromverbrauch im Standby-Modus: 0.5 Watt\nStromverbrauch (Aus-Modus): 0.3 Watt\nDetails zu Abmessungen & Gewicht: Mit Standfu\u00df (niedrigste Position) - Breite: 61.4 cm - Tiefe: 25.5 cm - H\u00f6he: 40.8 cm - Gewicht: 8.4 kg \u00a6 Mit Standfu\u00df (h\u00f6chste Position) - Breite: 61.4 cm - Tiefe: 25.5 cm - H\u00f6he: 50.8 cm - Gewicht: 8.4 kg \u00a6 Ohne Fu\u00df - Breite: 61.4 cm - Tiefe: 9 cm - H\u00f6he: 36.7 cm - Gewicht: 4.8 kg\nTransportbreite: 7.19 cm\nTransporttiefe: 26.7 cm\nTransporth\u00f6he: 51.2 cm\nTransportgewicht: 11.8 kg\nService und Support: Begrenzte Garantie - 3 Jahre\nMin Betriebstemperatur: 0 \u00b0C\nMax. Betriebstemperatur: 40 \u00b0C",
    "reference_file": "offer_reference_680.json",
    "shop_name": "TaufNaus"
}