{
    "html_file": "offer_498_12.html",
    "name": "Lenovo Legion Y27qf-30, 27\"",
    "offer_link": "https://www.alternate.at/Lenovo/Legion-Y27qf-30-Gaming-Monitor/html/product/1919817?partner=AtGeizhalsat&campaign=Monitor/Lenovo/1919817",
    "price": 454.0,
    "raw_specifications": {
        "": "VESA DisplayHDR Standard",
        "Abmessungen": "Breite: 61,37 cm x H\u00f6he: 53,65 cm x Tiefe/L\u00e4nge: 25,88 cm",
        "Anschl\u00fcsse": "2x HDMI-Eingang, (HDMI-Version: 2.0), 1x DisplayPort-Eingang, (DisplayPort-Version: 1.4), 4x USB-A-3.2 Gen 1 (5 Gbit/s), 1x USB-B-3.2 (5 Gbit/s)",
        "Bild": "Glaretyp",
        "Bildschirmaufl\u00f6sung": "2.560 x 1.440 Pixel",
        "Bildschirmdiagonale": "68,5 cm (27 Zoll)",
        "EAN": "0196802793179",
        "Energieeffizienzklasse (HDR)": "G (A - G)",
        "Energieeffizienzklasse (SDR)": "F (A - G)",
        "Energieverbauch pro 1000 Stunden (HDR)": "38 kWh",
        "Energieverbauch pro 1000 Stunden (SDR)": "26 kWh",
        "Ergonomie": "Typ",
        "Farbe": "schwarz",
        "Features": "Adaptive-Sync",
        "Geeignet f\u00fcr": "Gaming",
        "Gewicht": "6,5 kg",
        "Hersteller-Nr.": "67A7GAC3EU",
        "Lautsprecher": "2 Lautsprecher",
        "Leistungsaufnahme im Bereitschafts- und Aus-Zustand": "0,5 Watt",
        "Leistungsaufnahme im Ein-Zustand bei Standard-Dynamikumfang (SDR)": "26,1 Watt",
        "Leistungsaufnahme im Ein-Zustand bei hohem Dynamikumfang (HDR)": "37.9 Watt",
        "Standards": "Video",
        "Stromversorgung": "Netzteil",
        "Typ": "Gaming-Monitor",
        "Weitere Informationen": "Reaktionszeit: 0.5 ms (MPRT) / 1 ms (Level 4) / 2 ms (Level 3) / 3ms (Level 2) / 4ms (Level 1) / 5ms (Off) | AMD Free-Sync Premium | Low Blue Light"
    },
    "raw_specifications_text": "Energieeffizienzklasse (SDR): F (A - G)\nEnergieverbauch pro 1000 Stunden (SDR): 26 kWh\nEnergieeffizienzklasse (HDR): G (A - G)\nEnergieverbauch pro 1000 Stunden (HDR): 38 kWh\nLeistungsaufnahme im Ein-Zustand bei Standard-Dynamikumfang (SDR): 26,1 Watt\nLeistungsaufnahme im Ein-Zustand bei hohem Dynamikumfang (HDR): 37.9 Watt\nLeistungsaufnahme im Bereitschafts- und Aus-Zustand: 0,5 Watt\nBildschirmdiagonale: 68,5 cm (27 Zoll)\nBildschirmaufl\u00f6sung: 2.560 x 1.440 Pixel\nTyp: Gaming-Monitor\nFarbe: schwarz\nEAN: 0196802793179\nHersteller-Nr.: 67A7GAC3EU\nGeeignet f\u00fcr: Gaming\nBild: Glaretyp\n: VESA DisplayHDR Standard\nAnschl\u00fcsse: 2x HDMI-Eingang, (HDMI-Version: 2.0), 1x DisplayPort-Eingang, (DisplayPort-Version: 1.4), 4x USB-A-3.2 Gen 1 (5 Gbit/s), 1x USB-B-3.2 (5 Gbit/s)\nErgonomie: Typ\nStromversorgung: Netzteil\nLautsprecher: 2 Lautsprecher\nStandards: Video\nFeatures: Adaptive-Sync\nWeitere Informationen: Reaktionszeit: 0.5 ms (MPRT) / 1 ms (Level 4) / 2 ms (Level 3) / 3ms (Level 2) / 4ms (Level 1) / 5ms (Off) | AMD Free-Sync Premium | Low Blue Light\nAbmessungen: Breite: 61,37 cm x H\u00f6he: 53,65 cm x Tiefe/L\u00e4nge: 25,88 cm\nGewicht: 6,5 kg",
    "reference_file": "offer_reference_498.json",
    "shop_name": "Alternate.at"
}