{
    "html_file": "offer_1765_1.html",
    "name": "AOC U32E2N, 31.5\"",
    "offer_link": "https://www.ba-computer.at/aoc-u32e2n-led-monitor-80-cm-32-31-5-sichtbar-u32e2n.html",
    "price": 348.29,
    "raw_specifications": {
        "Abmessungen (Breite x Tiefe x H\u00f6he)": "71.482 cm x 25.381 cm x 52.281 cm - mit Fu\u00df",
        "Ausgangsleistung/Kanal": "3 Watt",
        "Besonderheiten": "Low Blue Light Mode, flimmerfreie Technologie, Adaptive-Sync-Technologie, grenzenlos, 3 Side Borderless Design",
        "Bildschirmbeschichtung": "Blendfrei, 3H Hard Coating",
        "Bildschirmtyp": "VA",
        "Details zu Abmessungen & Gewicht": "Mit Fu\u00df - Breite: 71.482 cm - Tiefe: 25.381 cm - H\u00f6he: 52.281 cm \u00a6 Ohne Fu\u00df - Breite: 71.482 cm - Tiefe: 5.571 cm - H\u00f6he: 42.524 cm",
        "Diagonalabmessung": "80 cm (32\")",
        "Display-Typ": "LED-hintergrundbeleuchteter LCD-Monitor / TFT-Aktivmatrix",
        "Eingangsspannung": "Wechselstrom 120/230 V (50/60 Hz)",
        "Einstellungen der Anzeigeposition": "Neigung",
        "Energie Effizienzklasse": "Klasse G",
        "Enthaltene Kabel": "1 x HDMI-Kabel - 1.8 m \u00a6 1 x DisplayPort-Kabel - 1.8 m",
        "Farbe": "Schwarz",
        "Farbraum": "104% sRGB, 77% Adobe RGB",
        "Farbunterst\u00fctzung": "16,7 Millionen Farben",
        "Gewicht": "8.34 kg",
        "Helligkeit": "350 cd/m\u00b2",
        "Hintergrundbeleuchtungs-Technologie": "WLED",
        "Horizontaler Betrachtungswinkel": "178",
        "Kontrast": "2500:1 / 20000000:1 (dynamisch)",
        "Leistungsaufnahme im Ein-Zustand": "39.9 W",
        "Leistungsmerkmale": "Slot f\u00fcr Sicherheitsschloss (Kabelschloss getrennt erh\u00e4ltlich)",
        "Native Aufl\u00f6sung": "4K 3840 x 2160 bei 60 Hz",
        "Neigungswinkel": "-5.5/+22",
        "OSD-Sprachen": "Multilingual",
        "Reaktionszeit": "4 ms (gray-to-gray)",
        "Schlosstyp zur Diebstahlsicherung": "Kensington Slot",
        "Schnittstellen": "2 x HDMI \u00a6 DisplayPort 1.2",
        "Seitenverh\u00e4ltnis": "16:9",
        "Service und Support": "Begrenzte Garantie - 3 Jahre",
        "Sichtbare Bildfl\u00e4che": "80 cm (31.5\")",
        "Stromverbrauch (Aus-Modus)": "0.3 Watt",
        "Stromverbrauch (typisch)": "44 Watt",
        "Stromverbrauch SDR (eingeschaltet)": "39.9 kWh/1.000 h",
        "Stromverbrauch im Standby-Modus": "0.5 Watt",
        "Transportbreite": "82 cm",
        "Transportgewicht": "11.2 kg",
        "Transporth\u00f6he": "54.6 cm",
        "Transporttiefe": "18.7 cm",
        "Typ": "Lautsprecher - Stereo",
        "VESA-Halterung": "100 x 100 mm",
        "Vertikaler Betrachtungswinkel": "178"
    },
    "raw_specifications_text": "Display-Typ: LED-hintergrundbeleuchteter LCD-Monitor / TFT-Aktivmatrix\nEnergie Effizienzklasse: Klasse G\nDiagonalabmessung: 80 cm (32\")\nSichtbare Bildfl\u00e4che: 80 cm (31.5\")\nBildschirmtyp: VA\nSeitenverh\u00e4ltnis: 16:9\nNative Aufl\u00f6sung: 4K 3840 x 2160 bei 60 Hz\nHelligkeit: 350 cd/m\u00b2\nKontrast: 2500:1 / 20000000:1 (dynamisch)\nFarbunterst\u00fctzung: 16,7 Millionen Farben\nFarbraum: 104% sRGB, 77% Adobe RGB\nReaktionszeit: 4 ms (gray-to-gray)\nHorizontaler Betrachtungswinkel: 178\nVertikaler Betrachtungswinkel: 178\nBildschirmbeschichtung: Blendfrei, 3H Hard Coating\nHintergrundbeleuchtungs-Technologie: WLED\nOSD-Sprachen: Multilingual\nBesonderheiten: Low Blue Light Mode, flimmerfreie Technologie, Adaptive-Sync-Technologie, grenzenlos, 3 Side Borderless Design\nFarbe: Schwarz\nAbmessungen (Breite x Tiefe x H\u00f6he): 71.482 cm x 25.381 cm x 52.281 cm - mit Fu\u00df\nGewicht: 8.34 kg\nTyp: Lautsprecher - Stereo\nAusgangsleistung/Kanal: 3 Watt\nSchnittstellen: 2 x HDMI \u00a6 DisplayPort 1.2\nEinstellungen der Anzeigeposition: Neigung\nNeigungswinkel: -5.5/+22\nVESA-Halterung: 100 x 100 mm\nLeistungsmerkmale: Slot f\u00fcr Sicherheitsschloss (Kabelschloss getrennt erh\u00e4ltlich)\nEnthaltene Kabel: 1 x HDMI-Kabel - 1.8 m \u00a6 1 x DisplayPort-Kabel - 1.8 m\nSchlosstyp zur Diebstahlsicherung: Kensington Slot\nEingangsspannung: Wechselstrom 120/230 V (50/60 Hz)\nLeistungsaufnahme im Ein-Zustand: 39.9 W\nStromverbrauch SDR (eingeschaltet): 39.9 kWh/1.000 h\nStromverbrauch (typisch): 44 Watt\nStromverbrauch im Standby-Modus: 0.5 Watt\nStromverbrauch (Aus-Modus): 0.3 Watt\nDetails zu Abmessungen & Gewicht: Mit Fu\u00df - Breite: 71.482 cm - Tiefe: 25.381 cm - H\u00f6he: 52.281 cm \u00a6 Ohne Fu\u00df - Breite: 71.482 cm - Tiefe: 5.571 cm - H\u00f6he: 42.524 cm\nTransportbreite: 82 cm\nTransporttiefe: 18.7 cm\nTransporth\u00f6he: 54.6 cm\nTransportgewicht: 11.2 kg\nService und Support: Begrenzte Garantie - 3 Jahre",
    "reference_file": "offer_reference_1765.json",
    "shop_name": "BA-Computer"
}