{
    "html_file": "offer_1267_0.html",
    "name": "Lenovo L24e-30, 23.8\"",
    "offer_link": "https://www.taufnaus.de/product/10607204",
    "price": 105.9,
    "raw_specifications": {
        "Abmessungen (Breite x Tiefe x H\u00f6he)": "54.04 cm x 16.5 cm x 43.49 cm - mit Fu\u00df",
        "Adaptive-Sync Technologie": "AMD FreeSync",
        "Besonderheiten": "Integrierte Kabelf\u00fchrung, NearEdgeless-Design an 3 Seiten",
        "Bildschirmbeschichtung": "Blendfrei",
        "Bildschirmtyp": "VA",
        "Details zu Abmessungen & Gewicht": "Mit Fu\u00df - Breite: 54.04 cm - Tiefe: 16.5 cm - H\u00f6he: 43.49 cm - Gewicht: 3.82 kg \u00a6 Ohne Fu\u00df - Breite: 54.04 cm - Tiefe: 4.55 cm - H\u00f6he: 32.72 cm - Gewicht: 3.08 kg",
        "Diagonalabmessung": "61 cm (24\")",
        "Display-Typ": "LED-hintergrundbeleuchteter LCD-Monitor / TFT-Aktivmatrix",
        "Eingangsspannung": "Wechselstrom 100-240 V (50/60 Hz)",
        "Einstellungen der Anzeigeposition": "Neigung",
        "Energie Effizienzklasse": "Klasse E",
        "Energierverbrauch Sleep": "0.5 Watt",
        "Enthaltene Kabel": "1 x HDMI-Kabel - 1.8 m",
        "Erforderliches Betriebssystem": "Microsoft Windows 7 / 10",
        "Farbe": "Raven Black",
        "Farbraum": "72% NTSC (CIE 1931)",
        "Farbunterst\u00fctzung": "16,7 Millionen Farben",
        "Gewicht": "3.82 kg",
        "Helligkeit": "250 cd/m\u00b2",
        "Hintergrundbeleuchtungs-Technologie": "WLED",
        "Horizontale Bildwiederholrate": "30 - 83 kHz",
        "Horizontaler Betrachtungswinkel": "178",
        "Kennzeichnung": "CCC, RoHS, CEE Tier 2, Directive 2002/95/EC, TUV Rheinland Eye Comfort Certification",
        "Kontrast": "3000:1 / 3000000:1 (dynamisch)",
        "Leistungsaufnahme im Ein-Zustand": "15.5 W",
        "Leistungsmerkmale": "Slot f\u00fcr Sicherheitsschloss (Kabelschloss getrennt erh\u00e4ltlich)",
        "Lokalisierung": "EMEA",
        "Max. Betriebstemperatur": "40 \u00b0C",
        "Min Betriebstemperatur": "0 \u00b0C",
        "Mitgelieferte Software": "Lenovo Artery, Lenovo Display Control Center",
        "Native Aufl\u00f6sung": "Full HD (1080p) 1920 x 1080 bei 75 Hz",
        "Neigungswinkel": "-5/22",
        "Pixelpitch": "0.2745 mm",
        "Ppi": "93",
        "Reaktionszeit": "4 ms (extrem), 6 ms (typisch)",
        "Schlosstyp zur Diebstahlsicherung": "Kensington Slot",
        "Schnittstellen": "VGA \u00a6 HDMI \u00a6 Audio Line-Out",
        "Seitenverh\u00e4ltnis": "16:9",
        "Service und Support": "Begrenzte Garantie - 3 Jahre",
        "Sichtbare Bildfl\u00e4che": "60.47 cm (23.8\")",
        "Stromverbrauch (Aus-Modus)": "0.3 Watt",
        "Stromverbrauch (typisch)": "17.5 Watt",
        "Stromverbrauch SDR (eingeschaltet)": "15.5 kWh/1.000 h",
        "Stromverbrauch im Standby-Modus": "0.5 Watt",
        "TCO-zertifiziert": "TCO Certified Displays 8, TCO Certified Edge Displays",
        "Transportbreite": "41.5 cm",
        "Transportgewicht": "5.42 kg",
        "Transporth\u00f6he": "12.4 cm",
        "Transporttiefe": "62.4 cm",
        "VESA-Halterung": "100 x 100 mm",
        "Vertikale Bildwiederholrate": "48 - 75 Hz",
        "Vertikaler Betrachtungswinkel": "178",
        "Zul\u00e4ssige Luftfeuchtigkeit im Betrieb": "10 - 80% (nicht kondensierend)"
    },
    "raw_specifications_text": "Display-Typ: LED-hintergrundbeleuchteter LCD-Monitor / TFT-Aktivmatrix\nEnergie Effizienzklasse: Klasse E\nDiagonalabmessung: 61 cm (24\")\nSichtbare Bildfl\u00e4che: 60.47 cm (23.8\")\nAdaptive-Sync Technologie: AMD FreeSync\nBildschirmtyp: VA\nSeitenverh\u00e4ltnis: 16:9\nNative Aufl\u00f6sung: Full HD (1080p) 1920 x 1080 bei 75 Hz\nPixelpitch: 0.2745 mm\nPpi: 93\nHelligkeit: 250 cd/m\u00b2\nKontrast: 3000:1 / 3000000:1 (dynamisch)\nFarbunterst\u00fctzung: 16,7 Millionen Farben\nFarbraum: 72% NTSC (CIE 1931)\nReaktionszeit: 4 ms (extrem), 6 ms (typisch)\nVertikale Bildwiederholrate: 48 - 75 Hz\nHorizontale Bildwiederholrate: 30 - 83 kHz\nHorizontaler Betrachtungswinkel: 178\nVertikaler Betrachtungswinkel: 178\nBildschirmbeschichtung: Blendfrei\nHintergrundbeleuchtungs-Technologie: WLED\nBesonderheiten: Integrierte Kabelf\u00fchrung, NearEdgeless-Design an 3 Seiten\nFarbe: Raven Black\nAbmessungen (Breite x Tiefe x H\u00f6he): 54.04 cm x 16.5 cm x 43.49 cm - mit Fu\u00df\nGewicht: 3.82 kg\nSchnittstellen: VGA \u00a6 HDMI \u00a6 Audio Line-Out\nEinstellungen der Anzeigeposition: Neigung\nNeigungswinkel: -5/22\nVESA-Halterung: 100 x 100 mm\nLeistungsmerkmale: Slot f\u00fcr Sicherheitsschloss (Kabelschloss getrennt erh\u00e4ltlich)\nEnthaltene Kabel: 1 x HDMI-Kabel - 1.8 m\nKennzeichnung: CCC, RoHS, CEE Tier 2, Directive 2002/95/EC, TUV Rheinland Eye Comfort Certification\nLokalisierung: EMEA\nSchlosstyp zur Diebstahlsicherung: Kensington Slot\nEingangsspannung: Wechselstrom 100-240 V (50/60 Hz)\nLeistungsaufnahme im Ein-Zustand: 15.5 W\nStromverbrauch SDR (eingeschaltet): 15.5 kWh/1.000 h\nStromverbrauch (typisch): 17.5 Watt\nStromverbrauch im Standby-Modus: 0.5 Watt\nEnergierverbrauch Sleep: 0.5 Watt\nStromverbrauch (Aus-Modus): 0.3 Watt\nMitgelieferte Software: Lenovo Artery, Lenovo Display Control Center\nErforderliches Betriebssystem: Microsoft Windows 7 / 10\nDetails zu Abmessungen & Gewicht: Mit Fu\u00df - Breite: 54.04 cm - Tiefe: 16.5 cm - H\u00f6he: 43.49 cm - Gewicht: 3.82 kg \u00a6 Ohne Fu\u00df - Breite: 54.04 cm - Tiefe: 4.55 cm - H\u00f6he: 32.72 cm - Gewicht: 3.08 kg\nTransportbreite: 41.5 cm\nTransporttiefe: 62.4 cm\nTransporth\u00f6he: 12.4 cm\nTransportgewicht: 5.42 kg\nTCO-zertifiziert: TCO Certified Displays 8, TCO Certified Edge Displays\nService und Support: Begrenzte Garantie - 3 Jahre\nMin Betriebstemperatur: 0 \u00b0C\nMax. Betriebstemperatur: 40 \u00b0C\nZul\u00e4ssige Luftfeuchtigkeit im Betrieb: 10 - 80% (nicht kondensierend)",
    "reference_file": "offer_reference_1267.json",
    "shop_name": "TaufNaus"
}