{
    "html_file": "offer_1055_49.html",
    "name": "Dell UltraSharp U2723QE, 27\"",
    "offer_link": "https://www.alternate.at/Dell/U2723QE-LED-Monitor/html/product/1832343?partner=AtGeizhalsat&campaign=Monitor/Dell/1832343",
    "price": 677.0,
    "raw_specifications": {
        "": "Kensington-Schloss",
        "Abmessungen": "Breite: 61,14 cm x H\u00f6he: 38,518 cm x Tiefe/L\u00e4nge: 18,5 cm",
        "Anschl\u00fcsse": "1x HDMI-Eingang, 1x DisplayPort-Eingang, 1x DisplayPort-Ausgang, (DisplayPort-Version: 1.4), 1x 3,5-mm-Audio-Ausgang, 4x USB-A-3.2 Gen 1 (5 Gbit/s), 2x USB-C 3.2 Gen 1 (5 Gbit/s), 1x RJ 45",
        "Bild": "Format",
        "Bildschirmaufl\u00f6sung": "3.840 x 2.160 Pixel",
        "Bildschirmdiagonale": "69 cm (27 Zoll)",
        "EAN": "5397184567753",
        "Energieeffizienzklasse (HDR)": "G (A - G)",
        "Energieeffizienzklasse (SDR)": "F (A - G)",
        "Energieverbauch pro 1000 Stunden (HDR)": "38 kWh",
        "Energieverbauch pro 1000 Stunden (SDR)": "26 kWh",
        "Ergonomie": "Typ",
        "Farbe": "schwarz/silber",
        "Features": "IPS Black-Technologie",
        "Gewicht": "6,6 kg",
        "Hersteller-Nr.": "DELL-U2723QE",
        "Leistungsaufnahme im Bereitschafts- und Aus-Zustand": "0,3 Watt",
        "Leistungsaufnahme im Ein-Zustand bei Standard-Dynamikumfang (SDR)": "25,9 Watt",
        "Leistungsaufnahme im Ein-Zustand bei hohem Dynamikumfang (HDR)": "37.7 Watt",
        "Stromversorgung": "Eco-Off",
        "Typ": "LED-Monitor",
        "Wandhalterung": "VESA kompatibel (100 x 100 mm)",
        "Zubeh\u00f6r": "Vorhanden"
    },
    "raw_specifications_text": "Energieeffizienzklasse (SDR): F (A - G)\nEnergieverbauch pro 1000 Stunden (SDR): 26 kWh\nEnergieeffizienzklasse (HDR): G (A - G)\nEnergieverbauch pro 1000 Stunden (HDR): 38 kWh\nLeistungsaufnahme im Ein-Zustand bei Standard-Dynamikumfang (SDR): 25,9 Watt\nLeistungsaufnahme im Ein-Zustand bei hohem Dynamikumfang (HDR): 37.7 Watt\nLeistungsaufnahme im Bereitschafts- und Aus-Zustand: 0,3 Watt\nBildschirmdiagonale: 69 cm (27 Zoll)\nBildschirmaufl\u00f6sung: 3.840 x 2.160 Pixel\nTyp: LED-Monitor\nFarbe: schwarz/silber\nEAN: 5397184567753\nHersteller-Nr.: DELL-U2723QE\nBild: Format\n: Kensington-Schloss\nAnschl\u00fcsse: 1x HDMI-Eingang, 1x DisplayPort-Eingang, 1x DisplayPort-Ausgang, (DisplayPort-Version: 1.4), 1x 3,5-mm-Audio-Ausgang, 4x USB-A-3.2 Gen 1 (5 Gbit/s), 2x USB-C 3.2 Gen 1 (5 Gbit/s), 1x RJ 45\nErgonomie: Typ\nStromversorgung: Eco-Off\nWandhalterung: VESA kompatibel (100 x 100 mm)\nFeatures: IPS Black-Technologie\nZubeh\u00f6r: Vorhanden\nAbmessungen: Breite: 61,14 cm x H\u00f6he: 38,518 cm x Tiefe/L\u00e4nge: 18,5 cm\nGewicht: 6,6 kg",
    "reference_file": "offer_reference_1055.json",
    "shop_name": "Alternate.at"
}