{
    "html_file": "offer_1075_10.html",
    "name": "BenQ Zowie XL2746K, 27\"",
    "offer_link": "https://www.ditech.at/details.php?artnr=345025",
    "price": 643.9,
    "raw_specifications": {
        "AMD FreeSync Premium": "Ja",
        "Adaptive Sync": "Ja",
        "Anschl\u00fcsse - DisplayPort 1.2": "1",
        "Anschl\u00fcsse - HDMI 2.0": "3",
        "Anwendung": "station\u00e4r",
        "Audio": "1x Line-Out",
        "Aufl\u00f6sung": "1920x1080",
        "Beschichtung": "matt (non-glare)",
        "Besonderheiten": "Lichtschutzblende,  mechanische Tasten,  Sicherheitsschloss (Kensington),  Kopfh\u00f6rerhalter,  Fernbedienung",
        "Bildwiederholfrequenz": "240Hz",
        "Blickwinkel": "170\u00b0/160\u00b0",
        "Diagonale": "27\"/68.6cm",
        "Energieverbrauch SDR": "23kWh/1000h",
        "Ergonomie": "155mm (h\u00f6henverstellbar),  90\u00b0 (Pivot),  \u00b145\u00b0 (drehbar),  +23\u00b0/-5\u00b0 (neigbar),  keine Angabe (Schr\u00e4glage)",
        "FRC": "unbekannt",
        "Farbe": "schwarz",
        "Farbtiefe": "8bit (16.7 Mio. Farben)",
        "Form": "gerade (flat)",
        "Gewicht": "8.80kg (mit Standfu\u00df),  keine Angabe (ohne Standfu\u00df)",
        "HDR": "N/A",
        "Helligkeit": "320cd/m\u00b2",
        "Herstellergarantie": "zwei Jahre (Pickup&Return)",
        "Hintergrundbeleuchtung": "White-LED,  flicker-free,  Blaulichtfilter",
        "Kontrast - dynamisch": "12.000.000:1",
        "Leistungsaufnahme": "keine Angabe (maximal),  40W (typisch),  keine Angabe (Energielabel alt A+++ bis G),  0.5W (Standby)",
        "Panel": "TN",
        "Reaktionszeit - GtG": "0.5ms",
        "Screen-to-Body-Ratio": "86.6% (berechnet)",
        "Seitenverh\u00e4ltnis": "16:9",
        "Signalfrequenz": "30-255kHz (horizontal),  48-240Hz (vertikal)",
        "Stromversorgung": "AC-In (internes Netzteil)",
        "USB-Hub In": "1x USB-B 3.0",
        "USB-Hub Out": "2x USB-A 3.0",
        "USB-Schreibweise": "Link",
        "Unsch\u00e4rfereduktionsfunktion": "BenQ Zowie DyAc+",
        "VESA": "100x100 (belegt)"
    },
    "raw_specifications_text": "Adaptive Sync: Ja\nAMD FreeSync Premium: Ja\nAnschl\u00fcsse - DisplayPort 1.2: 1\nAnschl\u00fcsse - HDMI 2.0: 3\nAnwendung: station\u00e4r\nAudio: 1x Line-Out\nAufl\u00f6sung: 1920x1080\nBeschichtung: matt (non-glare)\nBesonderheiten: Lichtschutzblende,  mechanische Tasten,  Sicherheitsschloss (Kensington),  Kopfh\u00f6rerhalter,  Fernbedienung\nBildwiederholfrequenz: 240Hz\nBlickwinkel: 170\u00b0/160\u00b0\nDiagonale: 27\"/68.6cm\nEnergieverbrauch SDR: 23kWh/1000h\nErgonomie: 155mm (h\u00f6henverstellbar),  90\u00b0 (Pivot),  \u00b145\u00b0 (drehbar),  +23\u00b0/-5\u00b0 (neigbar),  keine Angabe (Schr\u00e4glage)\nFarbe: schwarz\nFarbtiefe: 8bit (16.7 Mio. Farben)\nForm: gerade (flat)\nFRC: unbekannt\nGewicht: 8.80kg (mit Standfu\u00df),  keine Angabe (ohne Standfu\u00df)\nHDR: N/A\nHelligkeit: 320cd/m\u00b2\nHerstellergarantie: zwei Jahre (Pickup&Return)\nHintergrundbeleuchtung: White-LED,  flicker-free,  Blaulichtfilter\nKontrast - dynamisch: 12.000.000:1\nLeistungsaufnahme: keine Angabe (maximal),  40W (typisch),  keine Angabe (Energielabel alt A+++ bis G),  0.5W (Standby)\nPanel: TN\nReaktionszeit - GtG: 0.5ms\nScreen-to-Body-Ratio: 86.6% (berechnet)\nSeitenverh\u00e4ltnis: 16:9\nSignalfrequenz: 30-255kHz (horizontal),  48-240Hz (vertikal)\nStromversorgung: AC-In (internes Netzteil)\nUnsch\u00e4rfereduktionsfunktion: BenQ Zowie DyAc+\nUSB-Hub In: 1x USB-B 3.0\nUSB-Hub Out: 2x USB-A 3.0\nUSB-Schreibweise: Link\nVESA: 100x100 (belegt)",
    "reference_file": "offer_reference_1075.json",
    "shop_name": "DiTech.at"
}