{
    "html_file": "offer_49_2.html",
    "name": "Acer Nitro XV5 XV275KP3biipruzx, 27\"",
    "offer_link": "https://www.amazon.de/dp/B0C3D91LS5?linkCode=xm2&camp=2025&creative=165953&smid=A3JWKAKR8XB7XF&creativeASIN=B0C3D91LS5&tag=geizhals1-21",
    "price": 805.71,
    "raw_specifications": {
        "ASIN": "B0C3D91LS5",
        "Amazon Bestseller-Rang": "Nr. 122,917 in Computer & Zubeh\u00f6r (Siehe Top 100 in Computer & Zubeh\u00f6r)  Nr. 2,135 in Monitore",
        "Artikelgewicht": "\u200e6,72 Kilograms",
        "Display-Gr\u00f6\u00dfe": "\u200e27 Zoll",
        "Durchschnittliche Kundenbewertung": "1,5  1,5 von 5 Sternen    \n    2 Sternebewertungen   \n\n\n 1,5 von 5 Sternen",
        "Farbe": "\u200eSchwarz",
        "Garantierte Software-Updates bis": "\u200eunbekannt",
        "Hardware Plattform": "\u200eNot Machine Specific",
        "Hersteller": "\u200eAcer",
        "Im Angebot von Amazon.de seit": "24. April 2023",
        "L\u00f6sung": "\u200e3840 x 2160 Pixels",
        "Marke": "\u200eAcer",
        "Modell/Serie": "\u200eNitro XV275KP3biipruzx",
        "Modellnummer": "\u200eUM.HXXEE.305",
        "Produktabmessungen": "\u200e26,7 x 61,31 x 43,7 cm; 6,72 Kilogramm"
    },
    "raw_specifications_text": "Marke: \u200eAcer\nHersteller: \u200eAcer\nModell/Serie: \u200eNitro XV275KP3biipruzx\nProduktabmessungen: \u200e26,7 x 61,31 x 43,7 cm; 6,72 Kilogramm\nModellnummer: \u200eUM.HXXEE.305\nFarbe: \u200eSchwarz\nDisplay-Gr\u00f6\u00dfe: \u200e27 Zoll\nL\u00f6sung: \u200e3840 x 2160 Pixels\nHardware Plattform: \u200eNot Machine Specific\nArtikelgewicht: \u200e6,72 Kilograms\nGarantierte Software-Updates bis: \u200eunbekannt\nASIN: B0C3D91LS5\nDurchschnittliche Kundenbewertung: 1,5  1,5 von 5 Sternen    \n    2 Sternebewertungen   \n\n\n 1,5 von 5 Sternen\nAmazon Bestseller-Rang: Nr. 122,917 in Computer & Zubeh\u00f6r (Siehe Top 100 in Computer & Zubeh\u00f6r)  Nr. 2,135 in Monitore\nIm Angebot von Amazon.de seit: 24. April 2023",
    "reference_file": "offer_reference_49.json",
    "shop_name": "Amazon.at"
}