{
    "html_file": "offer_2008_10.html",
    "name": "LG 43UN700-B, 42.5\"",
    "offer_link": "https://www.mylemon.at/artikel/lg/43un700_b/43-43un700-b-4k-uhd.html",
    "price": 737.64,
    "raw_specifications": {
        "AC Eingangsfrequenz": "50/60 Hz",
        "AC Eingangsspannung": "100 - 240 V",
        "Anzahl DisplayPort Anschl\u00fcsse": "1",
        "Anzahl HDMI-Anschl\u00fcsse": "4",
        "Anzahl der Farben des Displays": "1,073 Milliarden Farben",
        "Anzahl der nachgeschalteten Steckpl\u00e4tze vom Typ USB-A": "2",
        "Artikelnummer": "M10YQ0HL",
        "Aufl\u00f6sung": "3840x2160",
        "Besonderheiten": "Lautsprecher, Picture-in-Picture",
        "Bild f\u00fcr Bild (PbP)": "Ja",
        "Bild-in-Bild": "Ja",
        "Bildschirmdiagonale": "108 cm (42.5 Zoll)",
        "Bildschirmform": "Flach",
        "Bildschirmtechnologie": "LED",
        "Bildwinkel, horizontal": "178\u00b0",
        "Bildwinkel, vertikal": "178\u00b0",
        "Breite (ohne Standfu\u00df)": "96,8 cm",
        "DVI Anschluss": "Nein",
        "Display-Aufl\u00f6sung": "3840 x 2160 Pixel",
        "Display-Oberfl\u00e4che": "Matt",
        "Displaygr\u00f6\u00dfe": "42,5 Zoll",
        "EAN": "8806098699773",
        "Ein-/Ausschalter": "Ja",
        "Eingebaute Lautsprecher": "Ja",
        "Energieeffizienzklasse (HDR)": "G",
        "Energieeffizienzklasse (SDR)": "G",
        "Energieeffizienzskala": "A bis G",
        "Energieverbrauch (HDR) pro 1.000 Stunden": "81 kWh",
        "Energieverbrauch (SDR) pro 1.000 Stunden": "57 kWh",
        "Ergonomie": "Neigbar",
        "Farbskala": "72%",
        "Fernbedienung enthalten": "Ja",
        "Ger\u00e4tebreite (inkl. Fu\u00df)": "968 mm",
        "Ger\u00e4teh\u00f6he (inkl. Fu\u00df)": "647,7 mm",
        "Ger\u00e4tetiefe (inkl. Fu\u00df)": "274,3 mm",
        "Gewicht (mit St\u00e4nder)": "17,5 kg",
        "Gewicht (ohne St\u00e4nder)": "13,8 kg",
        "HDMI": "Ja",
        "Helligkeit": "400 cd/m\u00b2",
        "Helligkeit (typisch)": "400 cd/m\u00b2",
        "Hersteller Artikelnummer": "43UN700-B",
        "High Dynamic Range Video (HDR) Unterst\u00fctzung": "Ja",
        "H\u00f6he (ohne Standfu\u00df)": "57,7 cm",
        "H\u00f6henverstellung": "Nein",
        "Integrierter USB-Hub": "Ja",
        "Kontrastverh\u00e4ltnis": "1000:1",
        "Kopfh\u00f6rerausgang": "Ja",
        "Kopfh\u00f6rerausg\u00e4nge": "1",
        "Marktpositionierung": "Gaming",
        "Maximale Bildwiederholrate": "60 Hz",
        "Mitgelieferte Kabel": "DisplayPort, HDMI, USB Typ-C",
        "Natives Seitenverh\u00e4ltnis": "16:9",
        "Neigungsverstellung": "Ja",
        "Paketgewicht": "21,5 kg",
        "Panel": "IPS",
        "Panel-Montage-Schnittstelle": "200 x 200 mm",
        "Panel-Typ": "IPS",
        "Pixel Abstand": "0,2451 x 0,2451 mm",
        "Produktfarbe": "Schwarz",
        "RMS-Leistung": "10 W",
        "Reaktionszeit": "8 ms",
        "Seitenverh\u00e4ltnis": "16:9",
        "Stromverbrauch (aus)": "0,3 W",
        "St\u00e4nder enthalten": "Ja",
        "Tiefe (ohne Standfu\u00df)": "7,1 cm",
        "Touchscreen": "Nein",
        "Unterst\u00fctzte Grafik-Aufl\u00f6sungen": "3840 x 2160",
        "VESA Halterung": "200x200 mm",
        "VESA-Halterung": "Ja",
        "Verpackungsbreite": "1064,3 mm",
        "Verpackungsh\u00f6he": "658 mm",
        "Verpackungstiefe": "284,5 mm",
        "Video Anschl\u00fcsse": "4x HDMI, 1x DisplayPort, USB-C DisplayPort",
        "Warentarifnummer (HS)": "85285210"
    },
    "raw_specifications_text": "Displaygr\u00f6\u00dfe: 42,5 Zoll\nAufl\u00f6sung: 3840x2160\nPanel: IPS\nReaktionszeit: 8 ms\nVideo Anschl\u00fcsse: 4x HDMI, 1x DisplayPort, USB-C DisplayPort\nErgonomie: Neigbar\nVESA Halterung: 200x200 mm\nHelligkeit: 400 cd/m\u00b2\nBesonderheiten: Lautsprecher, Picture-in-Picture\nHersteller Artikelnummer: 43UN700-B\nEAN: 8806098699773\nArtikelnummer: M10YQ0HL\nBildschirmdiagonale: 108 cm (42.5 Zoll)\nDisplay-Aufl\u00f6sung: 3840 x 2160 Pixel\nNatives Seitenverh\u00e4ltnis: 16:9\nBildschirmtechnologie: LED\nTouchscreen: Nein\nPanel-Typ: IPS\nBildschirmform: Flach\nKontrastverh\u00e4ltnis: 1000:1\nMaximale Bildwiederholrate: 60 Hz\nAnzahl der Farben des Displays: 1,073 Milliarden Farben\nHelligkeit (typisch): 400 cd/m\u00b2\nDisplay-Oberfl\u00e4che: Matt\nUnterst\u00fctzte Grafik-Aufl\u00f6sungen: 3840 x 2160\nSeitenverh\u00e4ltnis: 16:9\nBildwinkel, horizontal: 178\u00b0\nBildwinkel, vertikal: 178\u00b0\nPixel Abstand: 0,2451 x 0,2451 mm\nHigh Dynamic Range Video (HDR) Unterst\u00fctzung: Ja\nFarbskala: 72%\nEingebaute Lautsprecher: Ja\nRMS-Leistung: 10 W\nMarktpositionierung: Gaming\nProduktfarbe: Schwarz\nIntegrierter USB-Hub: Ja\nHDMI: Ja\nKopfh\u00f6rerausgang: Ja\nAnzahl der nachgeschalteten Steckpl\u00e4tze vom Typ USB-A: 2\nDVI Anschluss: Nein\nAnzahl HDMI-Anschl\u00fcsse: 4\nAnzahl DisplayPort Anschl\u00fcsse: 1\nKopfh\u00f6rerausg\u00e4nge: 1\nVESA-Halterung: Ja\nH\u00f6henverstellung: Nein\nPanel-Montage-Schnittstelle: 200 x 200 mm\nBild-in-Bild: Ja\nNeigungsverstellung: Ja\nEnergieeffizienzklasse (SDR): G\nEnergieeffizienzklasse (HDR): G\nEnergieverbrauch (SDR) pro 1.000 Stunden: 57 kWh\nEnergieverbrauch (HDR) pro 1.000 Stunden: 81 kWh\nStromverbrauch (aus): 0,3 W\nAC Eingangsspannung: 100 - 240 V\nAC Eingangsfrequenz: 50/60 Hz\nEnergieeffizienzskala: A bis G\nSt\u00e4nder enthalten: Ja\nMitgelieferte Kabel: DisplayPort, HDMI, USB Typ-C\nFernbedienung enthalten: Ja\nGer\u00e4tebreite (inkl. Fu\u00df): 968 mm\nGer\u00e4tetiefe (inkl. Fu\u00df): 274,3 mm\nGer\u00e4teh\u00f6he (inkl. Fu\u00df): 647,7 mm\nGewicht (mit St\u00e4nder): 17,5 kg\nBreite (ohne Standfu\u00df): 96,8 cm\nTiefe (ohne Standfu\u00df): 7,1 cm\nH\u00f6he (ohne Standfu\u00df): 57,7 cm\nGewicht (ohne St\u00e4nder): 13,8 kg\nVerpackungsbreite: 1064,3 mm\nVerpackungstiefe: 284,5 mm\nVerpackungsh\u00f6he: 658 mm\nPaketgewicht: 21,5 kg\nWarentarifnummer (HS): 85285210\nEin-/Ausschalter: Ja\nBild f\u00fcr Bild (PbP): Ja",
    "reference_file": "offer_reference_2008.json",
    "shop_name": "mylemon.at"
}