{
    "html_file": "offer_691_8.html",
    "name": "AOC Q27B3MA, 27\"",
    "offer_link": "https://www.amazon.de/dp/B0B5PLT7FZ?linkCode=xm2&camp=2025&creative=165953&smid=A3JWKAKR8XB7XF&creativeASIN=B0B5PLT7FZ&tag=geizhals1-21",
    "price": 163.36,
    "raw_specifications": {
        "ASIN": "B0B5PLT7FZ",
        "Amazon Bestseller-Rang": "Nr. 13,288 in Computer & Zubeh\u00f6r (Siehe Top 100 in Computer & Zubeh\u00f6r)  Nr. 280 in Monitore",
        "Artikelgewicht": "\u200e2 Kilograms",
        "Batterien enthalten": "\u200eNein",
        "Bildschirmaufl\u00f6sung": "\u200e1440 x 2160",
        "Display-Gr\u00f6\u00dfe": "\u200e27 Zoll",
        "Durchschnittliche Kundenbewertung": "4,3  4,3 von 5 Sternen    \n    28 Sternebewertungen   \n\n\n 4,3 von 5 Sternen",
        "Farbe": "\u200eschwarz",
        "Garantierte Software-Updates bis": "\u200eunbekannt",
        "Hersteller": "\u200eAOC International",
        "Im Angebot von Amazon.de seit": "3. Juli 2022",
        "L\u00f6sung": "\u200e2560 x 1440 Pixels",
        "Marke": "\u200eAOC",
        "Modellnummer": "\u200eQ27B3MA",
        "Produktabmessungen": "\u200e63,4 x 51,3 x 1,6 cm; 2 Kilogramm",
        "Prozessortyp": "\u200eOthers",
        "Speicher-Art": "\u200eDIMM",
        "Volt": "\u200e240 Volt"
    },
    "raw_specifications_text": "Marke: \u200eAOC\nHersteller: \u200eAOC International\nProduktabmessungen: \u200e63,4 x 51,3 x 1,6 cm; 2 Kilogramm\nModellnummer: \u200eQ27B3MA\nFarbe: \u200eschwarz\nDisplay-Gr\u00f6\u00dfe: \u200e27 Zoll\nBildschirmaufl\u00f6sung: \u200e1440 x 2160\nL\u00f6sung: \u200e2560 x 1440 Pixels\nProzessortyp: \u200eOthers\nSpeicher-Art: \u200eDIMM\nVolt: \u200e240 Volt\nBatterien enthalten: \u200eNein\nArtikelgewicht: \u200e2 Kilograms\nGarantierte Software-Updates bis: \u200eunbekannt\nASIN: B0B5PLT7FZ\nDurchschnittliche Kundenbewertung: 4,3  4,3 von 5 Sternen    \n    28 Sternebewertungen   \n\n\n 4,3 von 5 Sternen\nAmazon Bestseller-Rang: Nr. 13,288 in Computer & Zubeh\u00f6r (Siehe Top 100 in Computer & Zubeh\u00f6r)  Nr. 280 in Monitore\nIm Angebot von Amazon.de seit: 3. Juli 2022",
    "reference_file": "offer_reference_691.json",
    "shop_name": "Amazon.at"
}