{
    "html_file": "offer_1500_12.html",
    "name": "Samsung CF390 (2021), 23.6\"",
    "offer_link": "https://www.hiq24.de/shop/artikel/316108/?sPartner=geizhals",
    "price": 120.5,
    "raw_specifications": {
        "Abmessungen (Breite x Tiefe x H\u00f6he)": "54.78 cm x 20.65 cm x 41.82 cm - mit Fu\u00df",
        "Abmessungen (Breite x Tiefe x H\u00f6he) - mit Fu\u00df": "54.78 cm x 20.65 cm x 41.82 cm",
        "Besonderheiten": "MagicBright, Spielmodus, Magic Upscale, flimmerfreie Technologie, Image Size, Eco Saving Plus, Eye Saver Mode, FreeSync Technology",
        "Bildschirmtyp": "VA",
        "Details zu Abmessungen & Gewicht": "Mit Fu\u00df - Breite: 54.78 cm - Tiefe: 20.65 cm - H\u00f6he: 41.82 cm - Gewicht: 3.3 kg  Ohne Fu\u00df - Breite: 54.78 cm - Tiefe: 8.76 cm - H\u00f6he: 32.63 cm - Gewicht: 2.8 kg",
        "Diagonalabmessung": "59 cm (24\")",
        "Display-Typ": "LED-hintergrundbeleuchteter LCD-Monitor / TFT-Aktivmatrix",
        "Eingangsanschl\u00fcsse": "HDMI, VGA",
        "Eingangsspannung": "Wechselstrom 120/230 V",
        "Einstellungen der Anzeigeposition": "Neigung",
        "Energie Effizienzklasse": "Klasse E",
        "Energieverbrauch pro Jahr": "26 kWh",
        "Farbe": "Schwarz",
        "Farbraum": "72% (NTSC 1976)",
        "Farbunterst\u00fctzung": "16,7 Millionen Farben",
        "Ger\u00e4tetyp": "LED-hintergrundbeleuchteter LCD-Monitor - 59 cm (24\")",
        "Geschwungener Bildschirm": "Ja",
        "Gewicht": "3.3 kg",
        "Helligkeit": "250 cd/m\u00b2",
        "Hintergrundbeleuchtungs-Technologie": "LED-Hintergrundbeleuchtung",
        "Horizontaler Betrachtungswinkel": "178",
        "Kontrast": "3000:1",
        "Leistungsaufnahme im Ein-Zustand": "18 W",
        "Leistungsmerkmale": "Slot f\u00fcr Sicherheitsschloss (Kabelschloss getrennt erh\u00e4ltlich)",
        "Max. Betriebstemperatur": "40 \u00b0C",
        "Min Betriebstemperatur": "10 \u00b0C",
        "Native Aufl\u00f6sung": "Full HD (1080p) 1920 x 1080 bei 60 Hz",
        "Neigungswinkel": "-2/+22",
        "Produktbeschreibung": "Samsung C24F390FHR - LED-Monitor - gebogen - Full HD (1080p) - 59 cm (24\")",
        "Reaktionszeit": "4 ms (gray-to-gray)",
        "Schlosstyp zur Diebstahlsicherung": "Kensington Slot",
        "Schnittstellen": "VGA  HDMI  Kopfh\u00f6rer",
        "Seitenverh\u00e4ltnis": "16:9",
        "Sichtbare Bildfl\u00e4che": "59.8 cm (23.5\")",
        "Spannung": "Wechselstrom 120/230 V",
        "Stromverbrauch (Aus-Modus)": "0.3 Watt",
        "Stromverbrauch (typisch)": "18 Watt",
        "Stromverbrauch SDR (eingeschaltet)": "18 kWh/1.000 h",
        "Stromverbrauch im Standby-Modus": "0.3 Watt",
        "Transportbreite": "61.8 cm",
        "Transportgewicht": "4.7 kg",
        "Transporth\u00f6he": "16.6 cm",
        "Transporttiefe": "39.4 cm",
        "VESA-Halterung": "75 x 75 mm",
        "Vertikaler Betrachtungswinkel": "178",
        "Zul\u00e4ssige Luftfeuchtigkeit im Betrieb": "10 - 80% (nicht kondensierend)"
    },
    "raw_specifications_text": "Display-Typ: LED-hintergrundbeleuchteter LCD-Monitor / TFT-Aktivmatrix\nEnergie Effizienzklasse: Klasse E\nEnergieverbrauch pro Jahr: 26 kWh\nDiagonalabmessung: 59 cm (24\")\nSichtbare Bildfl\u00e4che: 59.8 cm (23.5\")\nGeschwungener Bildschirm: Ja\nBildschirmtyp: VA\nSeitenverh\u00e4ltnis: 16:9\nNative Aufl\u00f6sung: Full HD (1080p) 1920 x 1080 bei 60 Hz\nHelligkeit: 250 cd/m\u00b2\nKontrast: 3000:1\nFarbunterst\u00fctzung: 16,7 Millionen Farben\nFarbraum: 72% (NTSC 1976)\nReaktionszeit: 4 ms (gray-to-gray)\nHorizontaler Betrachtungswinkel: 178\nVertikaler Betrachtungswinkel: 178\nHintergrundbeleuchtungs-Technologie: LED-Hintergrundbeleuchtung\nBesonderheiten: MagicBright, Spielmodus, Magic Upscale, flimmerfreie Technologie, Image Size, Eco Saving Plus, Eye Saver Mode, FreeSync Technology\nFarbe: Schwarz\nAbmessungen (Breite x Tiefe x H\u00f6he): 54.78 cm x 20.65 cm x 41.82 cm - mit Fu\u00df\nGewicht: 3.3 kg\nSchnittstellen: VGA  HDMI  Kopfh\u00f6rer\nEinstellungen der Anzeigeposition: Neigung\nNeigungswinkel: -2/+22\nVESA-Halterung: 75 x 75 mm\nLeistungsmerkmale: Slot f\u00fcr Sicherheitsschloss (Kabelschloss getrennt erh\u00e4ltlich)\nSchlosstyp zur Diebstahlsicherung: Kensington Slot\nEingangsspannung: Wechselstrom 120/230 V\nLeistungsaufnahme im Ein-Zustand: 18 W\nStromverbrauch SDR (eingeschaltet): 18 kWh/1.000 h\nStromverbrauch (typisch): 18 Watt\nStromverbrauch im Standby-Modus: 0.3 Watt\nStromverbrauch (Aus-Modus): 0.3 Watt\nDetails zu Abmessungen & Gewicht: Mit Fu\u00df - Breite: 54.78 cm - Tiefe: 20.65 cm - H\u00f6he: 41.82 cm - Gewicht: 3.3 kg  Ohne Fu\u00df - Breite: 54.78 cm - Tiefe: 8.76 cm - H\u00f6he: 32.63 cm - Gewicht: 2.8 kg\nTransportbreite: 61.8 cm\nTransporttiefe: 39.4 cm\nTransporth\u00f6he: 16.6 cm\nTransportgewicht: 4.7 kg\nMin Betriebstemperatur: 10 \u00b0C\nMax. Betriebstemperatur: 40 \u00b0C\nZul\u00e4ssige Luftfeuchtigkeit im Betrieb: 10 - 80% (nicht kondensierend)\nProduktbeschreibung: Samsung C24F390FHR - LED-Monitor - gebogen - Full HD (1080p) - 59 cm (24\")\nGer\u00e4tetyp: LED-hintergrundbeleuchteter LCD-Monitor - 59 cm (24\")\nEingangsanschl\u00fcsse: HDMI, VGA\nSpannung: Wechselstrom 120/230 V\nAbmessungen (Breite x Tiefe x H\u00f6he) - mit Fu\u00df: 54.78 cm x 20.65 cm x 41.82 cm",
    "reference_file": "offer_reference_1500.json",
    "shop_name": "HiQ24"
}