{
    "html_file": "offer_1559_5.html",
    "name": "AOC U27V4EA, 27\"",
    "offer_link": "https://www.amazon.de/dp/B08XY7GZYJ?linkCode=xm2&camp=2025&creative=165953&smid=A3JWKAKR8XB7XF&creativeASIN=B08XY7GZYJ&tag=geizhals1-21",
    "price": 246.71,
    "raw_specifications": {
        "ASIN": "B08XY7GZYJ",
        "Amazon Bestseller-Rang": "Nr. 62,553 in Computer & Zubeh\u00f6r (Siehe Top 100 in Computer & Zubeh\u00f6r)  Nr. 1,181 in Monitore",
        "Anzahl HDMI Schnittstellen": "\u200e2",
        "Anzahl der Lithium-Ionen-Zellen": "\u200e5",
        "Anzahl der Lithium-Metall-Zellen": "\u200e5",
        "Artikelgewicht": "\u200e6,8 Kilograms",
        "Batterien": "\u200e1 Lithium-Ionen Batterien erforderlich.",
        "Batterien enthalten": "\u200eNein",
        "Bildschirmaufl\u00f6sung": "\u200e3840 x 2160",
        "Display-Gr\u00f6\u00dfe": "\u200e68,6 Zentimeter",
        "Durchschnittliche Kundenbewertung": "4,2  4,2 von 5 Sternen    \n    117 Sternebewertungen   \n\n\n 4,2 von 5 Sternen",
        "Farbe": "\u200eschwarz",
        "Formfaktor": "\u200eDRUCKER",
        "Garantierte Software-Updates bis": "\u200eunbekannt",
        "Gewicht Lithium-Akku": "\u200e15 Kilogramm",
        "Hersteller": "\u200eAOC International",
        "Im Angebot von Amazon.de seit": "3. M\u00e4rz 2021",
        "Kapazit\u00e4t Lithium-Akku": "\u200e2 Kilowattstunden",
        "L\u00f6sung": "\u200e3840 x 2160 Pixels",
        "Marke": "\u200eAOC",
        "Modell/Serie": "\u200eAOC U27V4EA - 27 Zoll UHD Monitor, AdaptiveSync (3840x2160, 60 Hz, HDMI 2.0, DisplayPort) schwarz",
        "Modellnummer": "\u200eU27V4EA",
        "Produktabmessungen": "\u200e30 x 30 x 30 cm; 6,8 Kilogramm",
        "Prozessortyp": "\u200eOthers",
        "Volt": "\u200e220 Volt"
    },
    "raw_specifications_text": "Marke: \u200eAOC\nHersteller: \u200eAOC International\nModell/Serie: \u200eAOC U27V4EA - 27 Zoll UHD Monitor, AdaptiveSync (3840x2160, 60 Hz, HDMI 2.0, DisplayPort) schwarz\nProduktabmessungen: \u200e30 x 30 x 30 cm; 6,8 Kilogramm\nBatterien: \u200e1 Lithium-Ionen Batterien erforderlich.\nModellnummer: \u200eU27V4EA\nFarbe: \u200eschwarz\nFormfaktor: \u200eDRUCKER\nDisplay-Gr\u00f6\u00dfe: \u200e68,6 Zentimeter\nBildschirmaufl\u00f6sung: \u200e3840 x 2160\nL\u00f6sung: \u200e3840 x 2160 Pixels\nProzessortyp: \u200eOthers\nAnzahl HDMI Schnittstellen: \u200e2\nVolt: \u200e220 Volt\nBatterien enthalten: \u200eNein\nKapazit\u00e4t Lithium-Akku: \u200e2 Kilowattstunden\nGewicht Lithium-Akku: \u200e15 Kilogramm\nAnzahl der Lithium-Ionen-Zellen: \u200e5\nAnzahl der Lithium-Metall-Zellen: \u200e5\nArtikelgewicht: \u200e6,8 Kilograms\nGarantierte Software-Updates bis: \u200eunbekannt\nASIN: B08XY7GZYJ\nDurchschnittliche Kundenbewertung: 4,2  4,2 von 5 Sternen    \n    117 Sternebewertungen   \n\n\n 4,2 von 5 Sternen\nAmazon Bestseller-Rang: Nr. 62,553 in Computer & Zubeh\u00f6r (Siehe Top 100 in Computer & Zubeh\u00f6r)  Nr. 1,181 in Monitore\nIm Angebot von Amazon.de seit: 3. M\u00e4rz 2021",
    "reference_file": "offer_reference_1559.json",
    "shop_name": "Amazon.at"
}