{
    "html_file": "offer_2048_12.html",
    "name": "AOC Q27G2U/BK, 27\"",
    "offer_link": "https://direkt.jacob.de/produkte/aoc-68-6cm-27-q27g2u-bk-artnr-6106278.html?utm_source=geizhals&utm_medium=cpc&utm_campaign=Preisvergleich&ref=103",
    "price": 228.66,
    "raw_specifications": {
        "Abmessungen (Breite x Tiefe x H\u00f6he)": "61.25 cm x 22.74 cm x 39.86 cm",
        "Adaptive-Sync Technologie": "AMD FreeSync",
        "Ausgangsleistung/Kanal": "2 Watt",
        "Besonderheiten": "Rahmenlos, 121% sRGB-Farbskala, 90% Adobe RGB-Farbskala",
        "Bildschirmbeschichtung": "3H Hard Coating",
        "Bildschirmtyp": "VA",
        "Diagonalabmessung": "68.6 cm (27\")",
        "Display-Typ": "LED-hintergrundbeleuchteter LCD-Monitor / TFT-Aktivmatrix",
        "Eingangsanschl\u00fcsse": "2xHDMI, DisplayPort",
        "Einstellungen der Anzeigeposition": "H\u00f6he, Pivot (Rotation), Drehelement, neigbar",
        "Energie Effizienzklasse": "G",
        "Enthaltene Kabel": "1 x HDMI-Kabel - 1.8 m  1 x DisplayPort-Kabel - 1.8 m",
        "Erforderliche Netzspannung": "Wechselstrom 120/230 V (50/60 Hz)",
        "Farbe": "Schwarz",
        "Farbunterst\u00fctzung": "16,7 Millionen Farben",
        "Ger\u00e4tetyp": "LED-hintergrundbeleuchteter LCD-Monitor - 68.6 cm (27\")",
        "Gewicht": "5.2 kg",
        "Helligkeit": "250 cd/m\u00b2",
        "Hintergrundbeleuchtungs-Technologie": "WLED",
        "Horizontale Bildwiederholrate": "30 - 160 kHz",
        "Horizontaler Betrachtungswinkel": "178",
        "H\u00f6heneinstellung": "130 mm",
        "Integrierte Peripherieger\u00e4te": "USB 3.0-Hub",
        "Kennzeichnung": "DisplayPort 1.2",
        "Kontrast": "3000:1 / 80000000:1 (dynamisch)",
        "Leistungsaufnahme im Ein-Zustand": "32 W",
        "Leistungsmerkmale": "USB 3.0-Hub",
        "Native Aufl\u00f6sung": "2560 x 1440 bei 144 Hz",
        "Neigungswinkel": "3.5/21.5",
        "OSD-Sprachen": "Tschechisch, Chinesisch (tradionell), Chinesisch (vereinfacht), Englisch, Deutsch, Franz\u00f6sisch, Italienisch, Portugiesisch, Polnisch, Finnisch, Russisch, Spanisch, Holl\u00e4ndisch, Japanisch, Koreanisch",
        "Pixelpitch": "0.2745 mm",
        "Produktbeschreibung": "AOC Q27G2U/BK - LED-Monitor - 68.6 cm (27\")",
        "Reaktionszeit": "1 ms (MPRT)",
        "Schnittstellen": "DisplayPort  2 x HDMI  4 x USB 3.0  Audio Line-In  Kopfh\u00f6rer",
        "Schwenkwinkel": "60",
        "Seitenverh\u00e4ltnis": "16:9",
        "Stromverbrauch (Aus-Modus)": "0.3 Watt",
        "Stromverbrauch im Standby-Modus": "0.5 Watt",
        "Transportbreite": "73 cm",
        "Transportgewicht": "7.53 kg",
        "Transporth\u00f6he": "52 cm",
        "Transporttiefe": "18.7 cm",
        "Typ": "Lautsprecher - Stereo",
        "VESA-Halterung": "100 x 100 mm",
        "Vertikale Bildwiederholrate": "48 - 146 Hz",
        "Vertikaler Betrachtungswinkel": "178"
    },
    "raw_specifications_text": "Produktbeschreibung: AOC Q27G2U/BK - LED-Monitor - 68.6 cm (27\")\nGer\u00e4tetyp: LED-hintergrundbeleuchteter LCD-Monitor - 68.6 cm (27\")\nEnergie Effizienzklasse: G\nLeistungsaufnahme im Ein-Zustand: 32 W\nAdaptive-Sync Technologie: AMD FreeSync\nLeistungsmerkmale: USB 3.0-Hub\nBildschirmtyp: VA\nSeitenverh\u00e4ltnis: 16:9\nNative Aufl\u00f6sung: 2560 x 1440 bei 144 Hz\nPixelpitch: 0.2745 mm\nHelligkeit: 250 cd/m\u00b2\nKontrast: 3000:1 / 80000000:1 (dynamisch)\nReaktionszeit: 1 ms (MPRT)\nFarbunterst\u00fctzung: 16,7 Millionen Farben\nEingangsanschl\u00fcsse: 2xHDMI, DisplayPort\nEinstellungen der Anzeigeposition: H\u00f6he, Pivot (Rotation), Drehelement, neigbar\nBildschirmbeschichtung: 3H Hard Coating\nFarbe: Schwarz\nAbmessungen (Breite x Tiefe x H\u00f6he): 61.25 cm x 22.74 cm x 39.86 cm\nGewicht: 5.2 kg\nKennzeichnung: DisplayPort 1.2\nDisplay-Typ: LED-hintergrundbeleuchteter LCD-Monitor / TFT-Aktivmatrix\nDiagonalabmessung: 68.6 cm (27\")\nIntegrierte Peripherieger\u00e4te: USB 3.0-Hub\nVertikale Bildwiederholrate: 48 - 146 Hz\nHorizontale Bildwiederholrate: 30 - 160 kHz\nHorizontaler Betrachtungswinkel: 178\nVertikaler Betrachtungswinkel: 178\nHintergrundbeleuchtungs-Technologie: WLED\nOSD-Sprachen: Tschechisch, Chinesisch (tradionell), Chinesisch (vereinfacht), Englisch, Deutsch, Franz\u00f6sisch, Italienisch, Portugiesisch, Polnisch, Finnisch, Russisch, Spanisch, Holl\u00e4ndisch, Japanisch, Koreanisch\nBesonderheiten: Rahmenlos, 121% sRGB-Farbskala, 90% Adobe RGB-Farbskala\nTyp: Lautsprecher - Stereo\nAusgangsleistung/Kanal: 2 Watt\nSchnittstellen: DisplayPort  2 x HDMI  4 x USB 3.0  Audio Line-In  Kopfh\u00f6rer\nNeigungswinkel: 3.5/21.5\nSchwenkwinkel: 60\nH\u00f6heneinstellung: 130 mm\nVESA-Halterung: 100 x 100 mm\nEnthaltene Kabel: 1 x HDMI-Kabel - 1.8 m  1 x DisplayPort-Kabel - 1.8 m\nErforderliche Netzspannung: Wechselstrom 120/230 V (50/60 Hz)\nStromverbrauch im Standby-Modus: 0.5 Watt\nStromverbrauch (Aus-Modus): 0.3 Watt\nTransportbreite: 73 cm\nTransporttiefe: 18.7 cm\nTransporth\u00f6he: 52 cm\nTransportgewicht: 7.53 kg",
    "reference_file": "offer_reference_2048.json",
    "shop_name": "Jacob Elektronik direkt (AT)"
}