{
    "html_file": "offer_266_1.html",
    "name": "Lenovo L27q-38, 27\"",
    "offer_link": "https://www.amazon.de/dp/B09X6ZS8PM?linkCode=xm2&camp=2025&creative=165953&smid=A3JWKAKR8XB7XF&creativeASIN=B09X6ZS8PM&tag=geizhals1-21",
    "price": 230.92,
    "raw_specifications": {
        "ASIN": "B09X6ZS8PM",
        "Amazon Bestseller-Rang": "Nr. 15,897 in Computer & Zubeh\u00f6r (Siehe Top 100 in Computer & Zubeh\u00f6r)  Nr. 333 in Monitore",
        "Artikelgewicht": "\u200e5,9 Kilograms",
        "Batterien enthalten": "\u200eNein",
        "Bildschirmaufl\u00f6sung": "\u200e2560 x 1440",
        "Display-Gr\u00f6\u00dfe": "\u200e27 Zoll",
        "Durchschnittliche Kundenbewertung": "4,5  4,5 von 5 Sternen    \n    744 Sternebewertungen   \n\n\n 4,5 von 5 Sternen",
        "Farbe": "\u200eSchwarz",
        "Garantierte Software-Updates bis": "\u200eunbekannt",
        "Hersteller": "\u200eLenovo",
        "Im Angebot von Amazon.de seit": "9. Mai 2022",
        "L\u00f6sung": "\u200e2560 x 1440 Pixels",
        "Marke": "\u200eLenovo",
        "Modellnummer": "\u200e66F5GAC2EU",
        "Produktabmessungen": "\u200e50 x 50 x 28 cm; 5,9 Kilogramm"
    },
    "raw_specifications_text": "Marke: \u200eLenovo\nHersteller: \u200eLenovo\nProduktabmessungen: \u200e50 x 50 x 28 cm; 5,9 Kilogramm\nModellnummer: \u200e66F5GAC2EU\nFarbe: \u200eSchwarz\nDisplay-Gr\u00f6\u00dfe: \u200e27 Zoll\nBildschirmaufl\u00f6sung: \u200e2560 x 1440\nL\u00f6sung: \u200e2560 x 1440 Pixels\nBatterien enthalten: \u200eNein\nArtikelgewicht: \u200e5,9 Kilograms\nGarantierte Software-Updates bis: \u200eunbekannt\nASIN: B09X6ZS8PM\nDurchschnittliche Kundenbewertung: 4,5  4,5 von 5 Sternen    \n    744 Sternebewertungen   \n\n\n 4,5 von 5 Sternen\nAmazon Bestseller-Rang: Nr. 15,897 in Computer & Zubeh\u00f6r (Siehe Top 100 in Computer & Zubeh\u00f6r)  Nr. 333 in Monitore\nIm Angebot von Amazon.de seit: 9. Mai 2022",
    "reference_file": "offer_reference_266.json",
    "shop_name": "Amazon.at"
}