{
    "html_file": "offer_462_0.html",
    "name": "iiyama G-Master GB2470HSU-B5 Red Eagle, 23.8\"",
    "offer_link": "https://www.mylemon.at/artikel/iiyama/gb2470hsu_b5/60-5cm-23-8-gb2470hsu.html",
    "price": 133.9,
    "raw_specifications": {
        "AC Eingangsfrequenz": "50 - 60 Hz",
        "AC Eingangsspannung": "100 - 240 V",
        "AMD FreeSync": "Ja",
        "Anzahl DisplayPort Anschl\u00fcsse": "1",
        "Anzahl HDMI-Anschl\u00fcsse": "1",
        "Anzahl der Farben des Displays": "16,7 Millionen Farben",
        "Anzahl der Lautsprecher": "2",
        "Anzahl der nachgeschalteten Steckpl\u00e4tze vom Typ USB-A": "2",
        "Artikelnummer": "M1IYHVXL",
        "Aufl\u00f6sung": "1920x1080",
        "Besonderheiten": "165 Hz, Lautsprecher, USB HUB",
        "Bildschirmdiagonale": "61 cm (24\")",
        "Bildschirmdiagonale (cm)": "60,5 cm",
        "Bildschirmform": "Flach",
        "Bildschirmtechnologie": "LED",
        "Bildwinkel, horizontal": "178\u00b0",
        "Bildwinkel, vertikal": "178\u00b0",
        "Display-Aufl\u00f6sung": "1920 x 1080 Pixel",
        "DisplayPorts-Version": "1.2",
        "Displaygr\u00f6\u00dfe": "23,8 Zoll",
        "Eingebaute Lautsprecher": "Ja",
        "Energieeffizienzklasse (HDR)": "Nicht verf\u00fcgbar",
        "Energieeffizienzklasse (SDR)": "E",
        "Energieeffizienzskala": "A bis G",
        "Energieverbrauch (SDR) pro 1.000 Stunden": "19 kWh",
        "Ergonomie": "H\u00f6henverstellbar, Pivot (90 Grad drehbar), Schwenkbar, Neigbar",
        "Flimmerfreie Technologie": "Ja",
        "Ger\u00e4tebreite (inkl. Fu\u00df)": "539,5 mm",
        "Ger\u00e4teh\u00f6he (inkl. Fu\u00df)": "535 mm",
        "Ger\u00e4tetiefe (inkl. Fu\u00df)": "210 mm",
        "Gewicht (mit St\u00e4nder)": "4,5 kg",
        "HD-Typ": "Full HD",
        "HDCP": "Ja",
        "HDMI": "Ja",
        "HDMI-Version": "1.4",
        "Helligkeit": "250 cd/m\u00b2",
        "Helligkeit (typisch)": "250 cd/m\u00b2",
        "Hersteller Artikelnummer": "GB2470HSU-B5",
        "Horizontaler Scanbereich": "15 - 195 kHz",
        "H\u00f6heneinstellung": "15 cm",
        "H\u00f6henverstellung": "Ja",
        "Integrierte Kamera": "Nein",
        "Integrierter USB-Hub": "Ja",
        "Kabelsperre-Slot": "Ja",
        "Kompatible Betriebssysteme": "Mac",
        "Kontrastverh\u00e4ltnis": "1100:1",
        "Kontrastverh\u00e4ltnis (dynamisch)": "80000000:1",
        "Kopfh\u00f6rerausgang": "Ja",
        "Kopfh\u00f6rerausg\u00e4nge": "1",
        "Marktpositionierung": "Gaming",
        "Maximale Bildwiederholrate": "165 Hz",
        "Men\u00fcsprachen": "Tschechisch, Deutsch, Niederl\u00e4ndisch, Englisch, Spanisch, Franz\u00f6sisch, Italienisch, Japanisch, Polnisch, Portugiesisch, Russisch",
        "Mitgelieferte Kabel": "AC, DisplayPort, HDMI, USB",
        "NVIDIA G-SYNC": "Nein",
        "Natives Seitenverh\u00e4ltnis": "16:9",
        "Neigungsverstellung": "Ja",
        "Neigungswinkelbereich": "-5 - 23\u00b0",
        "Netzteiltyp": "Intern",
        "On-Screen-Display (OSD)": "Ja",
        "Paketgewicht": "6 kg",
        "Panel": "IPS",
        "Panel-Montage-Schnittstelle": "100 x 100 mm",
        "Panel-Typ": "IPS",
        "Pivot": "Ja",
        "Pivot Winkel": "0 - 90\u00b0",
        "Pixel Abstand": "0,275 x 0,275 mm",
        "Produktfarbe": "Schwarz",
        "RMS-Leistung": "4 W",
        "Reaktionszeit": "0,8 ms",
        "Schnellstart\u00fcbersicht": "Ja",
        "Seitenverh\u00e4ltnis": "16:9",
        "Stromverbrauch (Standardbetrieb)": "20 W",
        "Stromverbrauch (Standby)": "0,5 W",
        "Stromverbrauch (aus)": "0,3 W",
        "Touchscreen": "Nein",
        "USB-Hub-Version": "2.0",
        "VESA Halterung": "100x100 mm",
        "VESA-Halterung": "Ja",
        "Verbessertes Kabelmanagement": "Ja",
        "Verpackungsart": "Box",
        "Verpackungsbreite": "610 mm",
        "Verpackungsh\u00f6he": "398 mm",
        "Verpackungstiefe": "157 mm",
        "Video Anschl\u00fcsse": "1x HDMI, 1x DisplayPort",
        "Zertifizierung": "CE, T\u00dcV-Bauart, EAC, PSE, RoHS support, ErP, WEEE, VCCI, REACH"
    },
    "raw_specifications_text": "Displaygr\u00f6\u00dfe: 23,8 Zoll\nAufl\u00f6sung: 1920x1080\nPanel: IPS\nReaktionszeit: 0,8 ms\nVideo Anschl\u00fcsse: 1x HDMI, 1x DisplayPort\nErgonomie: H\u00f6henverstellbar, Pivot (90 Grad drehbar), Schwenkbar, Neigbar\nVESA Halterung: 100x100 mm\nHelligkeit: 250 cd/m\u00b2\nBesonderheiten: 165 Hz, Lautsprecher, USB HUB\nHersteller Artikelnummer: GB2470HSU-B5\nArtikelnummer: M1IYHVXL\nBildschirmdiagonale: 61 cm (24\")\nDisplay-Aufl\u00f6sung: 1920 x 1080 Pixel\nNatives Seitenverh\u00e4ltnis: 16:9\nBildschirmtechnologie: LED\nTouchscreen: Nein\nHD-Typ: Full HD\nPanel-Typ: IPS\nBildschirmform: Flach\nKontrastverh\u00e4ltnis: 1100:1\nMaximale Bildwiederholrate: 165 Hz\nAnzahl der Farben des Displays: 16,7 Millionen Farben\nHelligkeit (typisch): 250 cd/m\u00b2\nSeitenverh\u00e4ltnis: 16:9\nKontrastverh\u00e4ltnis (dynamisch): 80000000:1\nBildwinkel, horizontal: 178\u00b0\nBildwinkel, vertikal: 178\u00b0\nPixel Abstand: 0,275 x 0,275 mm\nHorizontaler Scanbereich: 15 - 195 kHz\nBildschirmdiagonale (cm): 60,5 cm\nNVIDIA G-SYNC: Nein\nAMD FreeSync: Ja\nFlimmerfreie Technologie: Ja\nKompatible Betriebssysteme: Mac\nEingebaute Lautsprecher: Ja\nIntegrierte Kamera: Nein\nAnzahl der Lautsprecher: 2\nRMS-Leistung: 4 W\nMarktpositionierung: Gaming\nProduktfarbe: Schwarz\nZertifizierung: CE, T\u00dcV-Bauart, EAC, PSE, RoHS support, ErP, WEEE, VCCI, REACH\nIntegrierter USB-Hub: Ja\nHDMI: Ja\nKopfh\u00f6rerausgang: Ja\nUSB-Hub-Version: 2.0\nAnzahl der nachgeschalteten Steckpl\u00e4tze vom Typ USB-A: 2\nAnzahl HDMI-Anschl\u00fcsse: 1\nHDMI-Version: 1.4\nAnzahl DisplayPort Anschl\u00fcsse: 1\nDisplayPorts-Version: 1.2\nKopfh\u00f6rerausg\u00e4nge: 1\nHDCP: Ja\nVESA-Halterung: Ja\nKabelsperre-Slot: Ja\nH\u00f6henverstellung: Ja\nPanel-Montage-Schnittstelle: 100 x 100 mm\nVerbessertes Kabelmanagement: Ja\nH\u00f6heneinstellung: 15 cm\nPivot: Ja\nPivot Winkel: 0 - 90\u00b0\nNeigungswinkelbereich: -5 - 23\u00b0\nOn-Screen-Display (OSD): Ja\nMen\u00fcsprachen: Tschechisch, Deutsch, Niederl\u00e4ndisch, Englisch, Spanisch, Franz\u00f6sisch, Italienisch, Japanisch, Polnisch, Portugiesisch, Russisch\nNeigungsverstellung: Ja\nEnergieeffizienzklasse (SDR): E\nEnergieeffizienzklasse (HDR): Nicht verf\u00fcgbar\nEnergieverbrauch (SDR) pro 1.000 Stunden: 19 kWh\nStromverbrauch (Standardbetrieb): 20 W\nStromverbrauch (Standby): 0,5 W\nStromverbrauch (aus): 0,3 W\nAC Eingangsspannung: 100 - 240 V\nAC Eingangsfrequenz: 50 - 60 Hz\nNetzteiltyp: Intern\nEnergieeffizienzskala: A bis G\nMitgelieferte Kabel: AC, DisplayPort, HDMI, USB\nSchnellstart\u00fcbersicht: Ja\nGer\u00e4tebreite (inkl. Fu\u00df): 539,5 mm\nGer\u00e4tetiefe (inkl. Fu\u00df): 210 mm\nGer\u00e4teh\u00f6he (inkl. Fu\u00df): 535 mm\nGewicht (mit St\u00e4nder): 4,5 kg\nVerpackungsbreite: 610 mm\nVerpackungstiefe: 157 mm\nVerpackungsh\u00f6he: 398 mm\nPaketgewicht: 6 kg\nVerpackungsart: Box",
    "reference_file": "offer_reference_462.json",
    "shop_name": "mylemon.at"
}