{
    "html_file": "offer_1936_33.html",
    "name": "AOC C32G2ZE/BK, 31.5\"",
    "offer_link": "https://www.1ashop.at/de/produkt/24648/aoc-81-3cm-31-5-c32g2ze-16-09-2xhdmi-dp-curved-flachbildschirm-tft/lcd-80-01-cm.html",
    "price": 265.04,
    "raw_specifications": {
        "Abmessungen (Breite x Tiefe x H\u00f6he)": "52.44 cm x 24.49 cm x 70.99 cm - mit Fu\u00df",
        "Adaptive-Sync Technologie": "AMD FreeSync Premium",
        "Besonderheiten": "AOC schwache Eingangsleistung Verz\u00f6gerungsmodus, Low Framerate Compensation (LFC)",
        "Bildschirmtyp": "VA",
        "Diagonalabmessung": "81.3 cm (32\")",
        "Display-Typ": "LED-hintergrundbeleuchteter LCD-Monitor / TFT-Aktivmatrix",
        "EAN/UPC": "4038986117395",
        "Einstellungen der Anzeigeposition": "Neigung",
        "Energie Effizienzklasse": "Klasse F",
        "Enthaltene Kabel": "1 x HDMI-Kabel - 1.8 m  1 x DisplayPort-Kabel - 1.8 m",
        "Farbraum": "123% sRGB (CIE 1931), 91% Adobe RGB (CIE 1931)",
        "Farbunterst\u00fctzung": "16,7 Millionen Farben",
        "Gaming": "Yes",
        "Geschwungener Bildschirm": "Ja (1500R)",
        "Gewicht": "6.83 kg",
        "Gruppe": "TFTs",
        "Helligkeit": "300 cd/m\u00b2",
        "Hersteller": "AOC",
        "Hersteller Art. Nr.": "C32G2ZE",
        "Hintergrundbeleuchtungs-Technologie": "WLED",
        "Horizontale Bildwiederholrate": "30 - 255 kHz",
        "Horizontaler Betrachtungswinkel": "178",
        "Leistungsaufnahme im Ein-Zustand": "31.5 W",
        "Leistungsmerkmale": "Slot f\u00fcr Sicherheitsschloss (Kabelschloss getrennt erh\u00e4ltlich)",
        "MTBF": "50,000 Stunde(n)",
        "Native Aufl\u00f6sung": "Full HD (1080p) 1920 x 1080 bei 240 Hz",
        "Neigungswinkel": "-3.5/+21.5",
        "OSD-Sprachen": "Tschechisch, Chinesisch (tradionell), Chinesisch (vereinfacht), Englisch, Deutsch, Franz\u00f6sisch, Italienisch, Portugiesisch, Polnisch, Finnisch, Schwedisch, Russisch, Spanisch, Holl\u00e4ndisch, Japanisch, Koreanisch",
        "Pixelpitch": "0.3637 mm",
        "Reaktionszeit": "0.5 ms",
        "Schlosstyp zur Diebstahlsicherung": "Kensington Slot",
        "Schnittstellen": "2 x HDMI  DisplayPort 1.2  Kopfh\u00f6rer",
        "Seitenverh\u00e4ltnis": "16:9",
        "Sichtbare Bildfl\u00e4che": "80 cm (31.5\")",
        "Stromverbrauch (typisch)": "60 Watt",
        "Stromverbrauch SDR (eingeschaltet)": "31.5 kWh/1.000 h",
        "Stromverbrauch im Standby-Modus": "0.5 Watt",
        "Transportgewicht": "9.81 kg",
        "VESA-Halterung": "100 x 100 mm",
        "Vertikale Bildwiederholrate": "48 - 240 Hz",
        "Vertikaler Betrachtungswinkel": "178"
    },
    "raw_specifications_text": "Gruppe: TFTs\nHersteller: AOC\nHersteller Art. Nr.: C32G2ZE\nEAN/UPC: 4038986117395\nDisplay-Typ: LED-hintergrundbeleuchteter LCD-Monitor / TFT-Aktivmatrix\nDiagonalabmessung: 81.3 cm (32\")\nSichtbare Bildfl\u00e4che: 80 cm (31.5\")\nGeschwungener Bildschirm: Ja (1500R)\nEnergie Effizienzklasse: Klasse F\nAdaptive-Sync Technologie: AMD FreeSync Premium\nBildschirmtyp: VA\nSeitenverh\u00e4ltnis: 16:9\nNative Aufl\u00f6sung: Full HD (1080p) 1920 x 1080 bei 240 Hz\nPixelpitch: 0.3637 mm\nHelligkeit: 300 cd/m\u00b2\nFarbunterst\u00fctzung: 16,7 Millionen Farben\nReaktionszeit: 0.5 ms\nVertikale Bildwiederholrate: 48 - 240 Hz\nHorizontale Bildwiederholrate: 30 - 255 kHz\nHorizontaler Betrachtungswinkel: 178\nVertikaler Betrachtungswinkel: 178\nFarbraum: 123% sRGB (CIE 1931), 91% Adobe RGB (CIE 1931)\nHintergrundbeleuchtungs-Technologie: WLED\nOSD-Sprachen: Tschechisch, Chinesisch (tradionell), Chinesisch (vereinfacht), Englisch, Deutsch, Franz\u00f6sisch, Italienisch, Portugiesisch, Polnisch, Finnisch, Schwedisch, Russisch, Spanisch, Holl\u00e4ndisch, Japanisch, Koreanisch\nAbmessungen (Breite x Tiefe x H\u00f6he): 52.44 cm x 24.49 cm x 70.99 cm - mit Fu\u00df\nGewicht: 6.83 kg\nGaming: Yes\nBesonderheiten: AOC schwache Eingangsleistung Verz\u00f6gerungsmodus, Low Framerate Compensation (LFC)\nStromverbrauch (typisch): 60 Watt\nStromverbrauch im Standby-Modus: 0.5 Watt\nLeistungsaufnahme im Ein-Zustand: 31.5 W\nStromverbrauch SDR (eingeschaltet): 31.5 kWh/1.000 h\nSchnittstellen: 2 x HDMI  DisplayPort 1.2  Kopfh\u00f6rer\nEinstellungen der Anzeigeposition: Neigung\nNeigungswinkel: -3.5/+21.5\nVESA-Halterung: 100 x 100 mm\nLeistungsmerkmale: Slot f\u00fcr Sicherheitsschloss (Kabelschloss getrennt erh\u00e4ltlich)\nEnthaltene Kabel: 1 x HDMI-Kabel - 1.8 m  1 x DisplayPort-Kabel - 1.8 m\nMTBF: 50,000 Stunde(n)\nSchlosstyp zur Diebstahlsicherung: Kensington Slot\nTransportgewicht: 9.81 kg",
    "reference_file": "offer_reference_1936.json",
    "shop_name": "1ashop.at"
}