{
    "html_file": "offer_1168_0.html",
    "name": "BenQ GW2785TC, 27\"",
    "offer_link": "https://www.proshop.at/Bildschirm/BenQ-27-Bildschirm-GW2785TC-LED-monitor-Full-HD-1080p-27-Black-5-ms/3027677?utm_source=geizhals&utm_medium=cpc&utm_campaign=pricesite",
    "price": 204.01,
    "raw_specifications": {
        "Abmessungen (Breite x Tiefe x H\u00f6he)": "51.2 cm x 23.9 cm x 55.2 cm - mit Fu\u00df",
        "Abmessungen (Breite x Tiefe x H\u00f6he) - mit Fu\u00df": "51.2 cm x 23.9 cm x 55.2 cm",
        "Audioeingang": "Mikrofon",
        "Ausgangsleistung/Kanal": "2 Watt",
        "Besonderheiten": "HDCP, AMA-Technologie (Advanced Motion Accelerator), Low Blue Light Mode, flimmerfreie Technologie, Reader Mode, Color Weakness Mode, Farbtemperatur Auswahl, Brightness Intelligence Technology, an 3 Seiten ohne Blende, ePaper-Modus, Eye Care Mode, Coding-Modus",
        "Bildschirmtyp": "IPS",
        "Daisy-Chaining": "Ja",
        "Diagonalabmessung": "68.6 cm (27\")",
        "Display-Typ": "LED-hintergrundbeleuchteter LCD-Monitor / TFT-Aktivmatrix",
        "EAN": "4718755086854",
        "Eingangsanschl\u00fcsse": "HDMI, DisplayPort, USB-C",
        "Eingangsspannung": "Wechselstrom 100-240 V",
        "Einstellungen der Anzeigeposition": "H\u00f6he, Pivot (Rotation), Drehung, Neigung",
        "Energie Effizienzklasse": "Klasse F",
        "Farbe": "Schwarz",
        "Farbraum": "72% NTSC",
        "Farbtemperatur": "9300K, 6500K, 5700K",
        "Farbunterst\u00fctzung": "16,7 Millionen Farben",
        "Ger\u00e4tetyp": "LED-hintergrundbeleuchteter LCD-Monitor - 68.6 cm (27\")",
        "Gewicht": "6.6 kg",
        "Helligkeit": "250 cd/m\u00b2",
        "Hersteller": "BenQ",
        "Hintergrundbeleuchtungs-Technologie": "LED-Hintergrundbeleuchtung",
        "Horizontaler Betrachtungswinkel": "178",
        "H\u00f6heneinstellung": "140 mm",
        "Kennzeichnung": "TUV LBL",
        "Kontrast": "1000:1 / 20000000:1 (dynamisch)",
        "Leistungsaufnahme im Ein-Zustand": "32 W",
        "Leistungsmerkmale": "Slot f\u00fcr Sicherheitsschloss (Kabelschloss getrennt erh\u00e4ltlich)",
        "Mikrofonfunktionen": "Ger\u00e4uschunterdr\u00fcckung",
        "Modell": "9H.LKNLB.QBE",
        "Native Aufl\u00f6sung": "Full HD (1080p) 1920 x 1080 bei 75 Hz",
        "Neigungswinkel": "-5/+35",
        "OSD-Sprachen": "Ungarisch, Tschechisch, Chinesisch (vereinfacht), Englisch, Deutsch, Franz\u00f6sisch, Italienisch, Portugiesisch, Polnisch, Schwedisch, Russisch, Spanisch, Holl\u00e4ndisch, Arabisch, Rum\u00e4nisch, Japanisch, Chinesisch, Koreanisch",
        "Ppi": "82",
        "Produktbeschreibung": "BenQ GW2785TC - LED-Monitor - Full HD (1080p) - 68.6 cm (27\")",
        "Reaktionszeit": "5 ms (Gray-to-Gray)",
        "Rotationswinkel": "90",
        "Schlosstyp zur Diebstahlsicherung": "Kensington Slot",
        "Schnittstellen": "2 x DisplayPort 1.2  HDMI  USB-C (bis zu 60 W)  Audio Line-In  Kopfh\u00f6rer",
        "Schwenkwinkel": "350",
        "Seitenverh\u00e4ltnis": "16:9",
        "Spannung": "Wechselstrom 100-240 V",
        "Stromverbrauch (typisch)": "18 Watt",
        "Stromverbrauch SDR (eingeschaltet)": "22.1 kWh/1.000 h",
        "TCO-zertifiziert": "TCO Certified Displays 8",
        "Transportgewicht": "8.7 kg",
        "Typ": "Lautsprecher - Stereo",
        "Umweltschutzstandards": "TCO Certified Displays 8",
        "VESA-Halterung": "100 x 100 mm",
        "Vertikaler Betrachtungswinkel": "178",
        "Waren-Nr.": "3027677",
        "Zum Hersteller": "benq.com"
    },
    "raw_specifications_text": "Hersteller: BenQ\nWaren-Nr.: 3027677\nModell: 9H.LKNLB.QBE\nEAN: 4718755086854\nZum Hersteller: benq.com\nProduktbeschreibung: BenQ GW2785TC - LED-Monitor - Full HD (1080p) - 68.6 cm (27\")\nGer\u00e4tetyp: LED-hintergrundbeleuchteter LCD-Monitor - 68.6 cm (27\")\nEnergie Effizienzklasse: Klasse F\nLeistungsaufnahme im Ein-Zustand: 32 W\nDaisy-Chaining: Ja\nBildschirmtyp: IPS\nSeitenverh\u00e4ltnis: 16:9\nNative Aufl\u00f6sung: Full HD (1080p) 1920 x 1080 bei 75 Hz\nHelligkeit: 250 cd/m\u00b2\nKontrast: 1000:1 / 20000000:1 (dynamisch)\nReaktionszeit: 5 ms (Gray-to-Gray)\nFarbunterst\u00fctzung: 16,7 Millionen Farben\nFarbraum: 72% NTSC\nEingangsanschl\u00fcsse: HDMI, DisplayPort, USB-C\nAudioeingang: Mikrofon\nEinstellungen der Anzeigeposition: H\u00f6he, Pivot (Rotation), Drehung, Neigung\nSpannung: Wechselstrom 100-240 V\nFarbe: Schwarz\nAbmessungen (Breite x Tiefe x H\u00f6he) - mit Fu\u00df: 51.2 cm x 23.9 cm x 55.2 cm\nGewicht: 6.6 kg\nUmweltschutzstandards: TCO Certified Displays 8\nKennzeichnung: TUV LBL\nDisplay-Typ: LED-hintergrundbeleuchteter LCD-Monitor / TFT-Aktivmatrix\nDiagonalabmessung: 68.6 cm (27\")\nPpi: 82\nHorizontaler Betrachtungswinkel: 178\nVertikaler Betrachtungswinkel: 178\nHintergrundbeleuchtungs-Technologie: LED-Hintergrundbeleuchtung\nFarbtemperatur: 9300K, 6500K, 5700K\nOSD-Sprachen: Ungarisch, Tschechisch, Chinesisch (vereinfacht), Englisch, Deutsch, Franz\u00f6sisch, Italienisch, Portugiesisch, Polnisch, Schwedisch, Russisch, Spanisch, Holl\u00e4ndisch, Arabisch, Rum\u00e4nisch, Japanisch, Chinesisch, Koreanisch\nBesonderheiten: HDCP, AMA-Technologie (Advanced Motion Accelerator), Low Blue Light Mode, flimmerfreie Technologie, Reader Mode, Color Weakness Mode, Farbtemperatur Auswahl, Brightness Intelligence Technology, an 3 Seiten ohne Blende, ePaper-Modus, Eye Care Mode, Coding-Modus\nAbmessungen (Breite x Tiefe x H\u00f6he): 51.2 cm x 23.9 cm x 55.2 cm - mit Fu\u00df\nTyp: Lautsprecher - Stereo\nMikrofonfunktionen: Ger\u00e4uschunterdr\u00fcckung\nAusgangsleistung/Kanal: 2 Watt\nSchnittstellen: 2 x DisplayPort 1.2  HDMI  USB-C (bis zu 60 W)  Audio Line-In  Kopfh\u00f6rer\nNeigungswinkel: -5/+35\nSchwenkwinkel: 350\nRotationswinkel: 90\nH\u00f6heneinstellung: 140 mm\nVESA-Halterung: 100 x 100 mm\nLeistungsmerkmale: Slot f\u00fcr Sicherheitsschloss (Kabelschloss getrennt erh\u00e4ltlich)\nSchlosstyp zur Diebstahlsicherung: Kensington Slot\nEingangsspannung: Wechselstrom 100-240 V\nStromverbrauch SDR (eingeschaltet): 22.1 kWh/1.000 h\nStromverbrauch (typisch): 18 Watt\nTransportgewicht: 8.7 kg\nTCO-zertifiziert: TCO Certified Displays 8",
    "reference_file": "offer_reference_1168.json",
    "shop_name": "Proshop.at"
}