{
    "html_file": "offer_1826_25.html",
    "name": "Dell S2721H, 27\"",
    "offer_link": "https://www.taufnaus.de/product/10611153",
    "price": 226.91,
    "raw_specifications": {
        "Abmessungen (Breite x Tiefe x H\u00f6he)": "60.99 cm x 18.68 cm x 45.33 cm - mit Fu\u00df",
        "Adaptive-Sync Technologie": "AMD FreeSync",
        "Ausgangsleistung/Kanal": "3 Watt",
        "Besonderheiten": "LED-Randlichtsystem, flimmerfreie Technologie, BFR/PVC-frei, ohne Quecksilber, arsenfreies Glas, Dell Easy Arrange, Dell ComfortView, Low Blue Light-Technologie, an 3 Seiten ohne Blende",
        "Bildschirmbeschichtung": "Blendfrei, 3H Hard Coating",
        "Bildschirmtyp": "IPS",
        "Details zu Abmessungen & Gewicht": "Mit Fu\u00df - Breite: 60.99 cm - Tiefe: 18.68 cm - H\u00f6he: 45.33 cm \u00a6 Ohne Fu\u00df - Gewicht: 4.4 kg",
        "Diagonalabmessung": "68.6 cm (27\")",
        "Display-Typ": "LED-hintergrundbeleuchteter LCD-Monitor / TFT-Aktivmatrix",
        "ENERGY STAR zertifiziert": "Ja",
        "Ein-/Aus-Schalter": "Nein",
        "Eingangsspannung": "Wechselstrom 100/240 V (50/60 Hz)",
        "Einstellungen der Anzeigeposition": "Neigung",
        "Energie Effizienzklasse": "Klasse D",
        "Energieverbrauch pro Jahr": "27 kWh",
        "Enthaltene Kabel": "1 x HDMI-Kabel",
        "Farbraum": "72% NTSC (CIE 1931), 99% sRGB",
        "Farbunterst\u00fctzung": "16,7 Millionen Farben",
        "Helligkeit": "300 cd/m\u00b2",
        "Hintergrundbeleuchtungs-Technologie": "LED-Hintergrundbeleuchtung",
        "Horizontaler Betrachtungswinkel": "178",
        "Kennzeichnung": "RoHS, HDCP 1.4",
        "Kontrast": "1000:1",
        "Leistungsaufnahme im Ein-Zustand": "16.8 W",
        "Leistungsmerkmale": "Integrierte Kabelf\u00fchrung, Unterst\u00fctzung f\u00fcr VESA-Schnittstelle",
        "Mitgelieferte Software": "Dell Display Manager",
        "Native Aufl\u00f6sung": "Full HD (1080p) 1920 x 1080 bei 75 Hz",
        "Neigungswinkel": "-5/+21",
        "Pixelpitch": "0.3114 mm",
        "Ppi": "81.59",
        "Reaktionszeit": "4 ms (Grau-zu-Grau extrem)",
        "Schnittstellen": "2 x HDMI (HDCP 1.4) \u00a6 Audio Line-Out",
        "Seitenverh\u00e4ltnis": "16:9",
        "Services im Bundle": "3 Jahre Advanced Exchange Service und Premium Panel Exchange",
        "Stromverbrauch (Aus-Modus)": "0.2 Watt",
        "Stromverbrauch (max.)": "41 Watt",
        "Stromverbrauch (typisch)": "21 Watt",
        "Stromverbrauch SDR (eingeschaltet)": "16.8 kWh/1.000 h",
        "Stromverbrauch im Standby-Modus": "0.2 Watt",
        "TCO-zertifiziert": "TCO Certified Displays 8",
        "Transportgewicht": "7.7 kg",
        "Typ": "Lautsprecher - Stereo",
        "VESA-Halterung": "100 x 100 mm",
        "Vertikaler Betrachtungswinkel": "178",
        "Zubeh\u00f6r im Lieferumfang": "Aufstellung, VESA Abdeckung, Standfu\u00df"
    },
    "raw_specifications_text": "Display-Typ: LED-hintergrundbeleuchteter LCD-Monitor / TFT-Aktivmatrix\nEnergie Effizienzklasse: Klasse D\nEnergieverbrauch pro Jahr: 27 kWh\nDiagonalabmessung: 68.6 cm (27\")\nAdaptive-Sync Technologie: AMD FreeSync\nBildschirmtyp: IPS\nSeitenverh\u00e4ltnis: 16:9\nNative Aufl\u00f6sung: Full HD (1080p) 1920 x 1080 bei 75 Hz\nPixelpitch: 0.3114 mm\nPpi: 81.59\nHelligkeit: 300 cd/m\u00b2\nKontrast: 1000:1\nFarbunterst\u00fctzung: 16,7 Millionen Farben\nFarbraum: 72% NTSC (CIE 1931), 99% sRGB\nReaktionszeit: 4 ms (Grau-zu-Grau extrem)\nHorizontaler Betrachtungswinkel: 178\nVertikaler Betrachtungswinkel: 178\nBildschirmbeschichtung: Blendfrei, 3H Hard Coating\nHintergrundbeleuchtungs-Technologie: LED-Hintergrundbeleuchtung\nBesonderheiten: LED-Randlichtsystem, flimmerfreie Technologie, BFR/PVC-frei, ohne Quecksilber, arsenfreies Glas, Dell Easy Arrange, Dell ComfortView, Low Blue Light-Technologie, an 3 Seiten ohne Blende\nAbmessungen (Breite x Tiefe x H\u00f6he): 60.99 cm x 18.68 cm x 45.33 cm - mit Fu\u00df\nTyp: Lautsprecher - Stereo\nAusgangsleistung/Kanal: 3 Watt\nSchnittstellen: 2 x HDMI (HDCP 1.4) \u00a6 Audio Line-Out\nEinstellungen der Anzeigeposition: Neigung\nNeigungswinkel: -5/+21\nVESA-Halterung: 100 x 100 mm\nLeistungsmerkmale: Integrierte Kabelf\u00fchrung, Unterst\u00fctzung f\u00fcr VESA-Schnittstelle\nZubeh\u00f6r im Lieferumfang: Aufstellung, VESA Abdeckung, Standfu\u00df\nEnthaltene Kabel: 1 x HDMI-Kabel\nKennzeichnung: RoHS, HDCP 1.4\nEingangsspannung: Wechselstrom 100/240 V (50/60 Hz)\nLeistungsaufnahme im Ein-Zustand: 16.8 W\nStromverbrauch SDR (eingeschaltet): 16.8 kWh/1.000 h\nStromverbrauch (typisch): 21 Watt\nStromverbrauch (max.): 41 Watt\nStromverbrauch im Standby-Modus: 0.2 Watt\nStromverbrauch (Aus-Modus): 0.2 Watt\nEin-/Aus-Schalter: Nein\nMitgelieferte Software: Dell Display Manager\nDetails zu Abmessungen & Gewicht: Mit Fu\u00df - Breite: 60.99 cm - Tiefe: 18.68 cm - H\u00f6he: 45.33 cm \u00a6 Ohne Fu\u00df - Gewicht: 4.4 kg\nTransportgewicht: 7.7 kg\nTCO-zertifiziert: TCO Certified Displays 8\nENERGY STAR zertifiziert: Ja\nServices im Bundle: 3 Jahre Advanced Exchange Service und Premium Panel Exchange",
    "reference_file": "offer_reference_1826.json",
    "shop_name": "TaufNaus"
}