{
    "html_file": "offer_837_7.html",
    "name": "LG UltraGear 48GQ900-B, 47.5\"",
    "offer_link": "https://www.ditech.at/details.php?artnr=361517",
    "price": 1008.9,
    "raw_specifications": {
        "AMD FreeSync Premium": "Ja",
        "Adaptive Sync": "Ja",
        "Anschl\u00fcsse - DisplayPort 1.4 138Hz@3840x2160": "1",
        "Anschl\u00fcsse - HDMI 2.1 138Hz@3840x2160": "3",
        "Anwendung": "station\u00e4r",
        "Audio": "Lautsprecher (2x 20W),  1x Line-Out",
        "Aufl\u00f6sung": "3840x2160",
        "Beschichtung": "matt (non-glare)",
        "Besonderheiten": "Slim Bezel,  Steuerkreuz,  Hardware-Kalibrierung,  Sicherheitsschloss (Kensington),  Beleuchtung auf R\u00fcckseite (RGB),  Werkskalibrierung,  Fernbedienung,  DTS HP:X",
        "Bildwiederholfrequenz": "120Hz (138Hz OC)",
        "Blickwinkel": "178\u00b0/178\u00b0",
        "Diagonale": "47.5\"/120.7cm",
        "Energieeffizienzklasse HDR (A bis G)": "G",
        "Energieverbrauch HDR": "69kWh/1000h",
        "Energieverbrauch SDR": "60kWh/1000h",
        "Ergonomie": "N/A (h\u00f6henverstellbar),  N/A (Pivot),  N/A (drehbar),  N/A (neigbar),  keine Angabe (Schr\u00e4glage)",
        "FRC": "nein (10bit nativ)",
        "Farbe": "schwarz",
        "Farbraum - DCI-P3": "99%",
        "Farbtiefe": "10bit (1.07 Mrd. Farben)",
        "Form": "gerade (flat)",
        "Gewicht": "16.80kg (mit Standfu\u00df),  15.51kg (ohne Standfu\u00df)",
        "HDR": "HDR10",
        "Helligkeit": "135cd/m\u00b2",
        "Herstellergarantie": "zwei Jahre (Bring-In)",
        "Hintergrundbeleuchtung": "N/A",
        "Kontrast - statisch": "1.500.000:1",
        "Lautsprecher": "Ja",
        "Leistungsaufnahme": "222W (maximal),  175W (typisch),  keine Angabe (Energielabel alt A+++ bis G),  0.5W (Standby)",
        "Panel": "OLED",
        "Panel-Hersteller": "LG Display",
        "Reaktionszeit - GtG": "0.1ms",
        "Screen-to-Body-Ratio": "92.9% (berechnet)",
        "Seitenverh\u00e4ltnis": "16:9",
        "Signalfrequenz": "keine Angabe (horizontal),  keine Angabe (vertikal)",
        "Stromversorgung": "AC-In (internes Netzteil)",
        "USB-Hub In": "1x USB-B 3.0",
        "USB-Hub Out": "2x USB-A 3.0",
        "USB-Schreibweise": "Link",
        "VESA": "300x200 (frei)",
        "Weitere Anschl\u00fcsse": "1x Toslink"
    },
    "raw_specifications_text": "Adaptive Sync: Ja\nAMD FreeSync Premium: Ja\nAnschl\u00fcsse - DisplayPort 1.4 138Hz@3840x2160: 1\nAnschl\u00fcsse - HDMI 2.1 138Hz@3840x2160: 3\nAnwendung: station\u00e4r\nAudio: Lautsprecher (2x 20W),  1x Line-Out\nAufl\u00f6sung: 3840x2160\nBeschichtung: matt (non-glare)\nBesonderheiten: Slim Bezel,  Steuerkreuz,  Hardware-Kalibrierung,  Sicherheitsschloss (Kensington),  Beleuchtung auf R\u00fcckseite (RGB),  Werkskalibrierung,  Fernbedienung,  DTS HP:X\nBildwiederholfrequenz: 120Hz (138Hz OC)\nBlickwinkel: 178\u00b0/178\u00b0\nDiagonale: 47.5\"/120.7cm\nEnergieeffizienzklasse HDR (A bis G): G\nEnergieverbrauch HDR: 69kWh/1000h\nEnergieverbrauch SDR: 60kWh/1000h\nErgonomie: N/A (h\u00f6henverstellbar),  N/A (Pivot),  N/A (drehbar),  N/A (neigbar),  keine Angabe (Schr\u00e4glage)\nFarbe: schwarz\nFarbraum - DCI-P3: 99%\nFarbtiefe: 10bit (1.07 Mrd. Farben)\nForm: gerade (flat)\nFRC: nein (10bit nativ)\nGewicht: 16.80kg (mit Standfu\u00df),  15.51kg (ohne Standfu\u00df)\nHDR: HDR10\nHelligkeit: 135cd/m\u00b2\nHerstellergarantie: zwei Jahre (Bring-In)\nHintergrundbeleuchtung: N/A\nKontrast - statisch: 1.500.000:1\nLautsprecher: Ja\nLeistungsaufnahme: 222W (maximal),  175W (typisch),  keine Angabe (Energielabel alt A+++ bis G),  0.5W (Standby)\nPanel: OLED\nPanel-Hersteller: LG Display\nReaktionszeit - GtG: 0.1ms\nScreen-to-Body-Ratio: 92.9% (berechnet)\nSeitenverh\u00e4ltnis: 16:9\nSignalfrequenz: keine Angabe (horizontal),  keine Angabe (vertikal)\nStromversorgung: AC-In (internes Netzteil)\nUSB-Hub In: 1x USB-B 3.0\nUSB-Hub Out: 2x USB-A 3.0\nUSB-Schreibweise: Link\nVESA: 300x200 (frei)\nWeitere Anschl\u00fcsse: 1x Toslink",
    "reference_file": "offer_reference_837.json",
    "shop_name": "DiTech.at"
}