{
    "html_file": "offer_231_12.html",
    "name": "Samsung ViewFinity S5 S50GC, 34\"",
    "offer_link": "https://www.e-tec.at/details.php?artnr=365898",
    "price": 268.2,
    "raw_specifications": {
        "AMD FreeSync": "Ja",
        "Adaptive Sync": "Ja",
        "Anschl\u00fcsse - DisplayPort 1.2 100Hz@3440x1440": "1",
        "Anschl\u00fcsse - HDMI 2.0 100Hz@3440x1440": "2",
        "Anwendung": "station\u00e4r",
        "Audio": "1x Line-Out",
        "Aufl\u00f6sung": "3440x1440",
        "Beschichtung": "matt (non-glare)",
        "Besonderheiten": "mechanische Tasten mit Steuerkreuz,  Picture-in-Picture,  Sicherheitsschloss (Kensington),  HDCP 2.2",
        "Bildwiederholfrequenz": "100Hz",
        "Blickwinkel": "178\u00b0/178\u00b0",
        "Diagonale": "34\"/86.4cm",
        "Energieeffizienzklasse HDR (A bis G)": "G",
        "Energieverbrauch HDR": "50kWh/1000h",
        "Energieverbrauch SDR": "32kWh/1000h",
        "Ergonomie": "N/A (h\u00f6henverstellbar),  N/A (Pivot),  N/A (drehbar),  +22\u00b0/-2\u00b0 (neigbar),  keine Angabe (Schr\u00e4glage)",
        "FRC": "nein (8bit nativ)",
        "Farbe": "schwarz",
        "Farbraum - sRGB": "99%",
        "Farbtiefe": "8bit (16.7 Mio. Farben)",
        "Form": "gerade (flat)",
        "Gewicht": "4.90kg (mit Standfu\u00df),  4.20kg (ohne Standfu\u00df)",
        "HDR": "HDR10",
        "Helligkeit": "300cd/m\u00b2",
        "Herstellergarantie": "zwei Jahre",
        "Hintergrundbeleuchtung": "White-LED,  flicker-free,  Blaulichtfilter",
        "Kontrast - statisch": "3.000:1",
        "Leistungsaufnahme": "keine Angabe (maximal),  32W (typisch),  keine Angabe (Energielabel alt A+++ bis G),  0.5W (Standby)",
        "Panel": "VA",
        "Reaktionszeit - GtG": "5ms",
        "Screen-to-Body-Ratio": "90.6% (berechnet)",
        "Seitenverh\u00e4ltnis": "21:9",
        "Signalfrequenz": "keine Angabe (horizontal),  keine Angabe (vertikal)",
        "Stromversorgung": "DC-In (externes Netzteil)",
        "USB-Hub In": "N/A",
        "USB-Hub Out": "N/A",
        "USB-Schreibweise": "Link",
        "VESA": "100x100 (frei)",
        "Weitere Anschl\u00fcsse": "N/A"
    },
    "raw_specifications_text": "Adaptive Sync: Ja\nAMD FreeSync: Ja\nAnschl\u00fcsse - DisplayPort 1.2 100Hz@3440x1440: 1\nAnschl\u00fcsse - HDMI 2.0 100Hz@3440x1440: 2\nAnwendung: station\u00e4r\nAudio: 1x Line-Out\nAufl\u00f6sung: 3440x1440\nBeschichtung: matt (non-glare)\nBesonderheiten: mechanische Tasten mit Steuerkreuz,  Picture-in-Picture,  Sicherheitsschloss (Kensington),  HDCP 2.2\nBildwiederholfrequenz: 100Hz\nBlickwinkel: 178\u00b0/178\u00b0\nDiagonale: 34\"/86.4cm\nEnergieeffizienzklasse HDR (A bis G): G\nEnergieverbrauch HDR: 50kWh/1000h\nEnergieverbrauch SDR: 32kWh/1000h\nErgonomie: N/A (h\u00f6henverstellbar),  N/A (Pivot),  N/A (drehbar),  +22\u00b0/-2\u00b0 (neigbar),  keine Angabe (Schr\u00e4glage)\nFarbe: schwarz\nFarbraum - sRGB: 99%\nFarbtiefe: 8bit (16.7 Mio. Farben)\nForm: gerade (flat)\nFRC: nein (8bit nativ)\nGewicht: 4.90kg (mit Standfu\u00df),  4.20kg (ohne Standfu\u00df)\nHDR: HDR10\nHelligkeit: 300cd/m\u00b2\nHerstellergarantie: zwei Jahre\nHintergrundbeleuchtung: White-LED,  flicker-free,  Blaulichtfilter\nKontrast - statisch: 3.000:1\nLeistungsaufnahme: keine Angabe (maximal),  32W (typisch),  keine Angabe (Energielabel alt A+++ bis G),  0.5W (Standby)\nPanel: VA\nReaktionszeit - GtG: 5ms\nScreen-to-Body-Ratio: 90.6% (berechnet)\nSeitenverh\u00e4ltnis: 21:9\nSignalfrequenz: keine Angabe (horizontal),  keine Angabe (vertikal)\nStromversorgung: DC-In (externes Netzteil)\nUSB-Hub In: N/A\nUSB-Hub Out: N/A\nUSB-Schreibweise: Link\nVESA: 100x100 (frei)\nWeitere Anschl\u00fcsse: N/A",
    "reference_file": "offer_reference_231.json",
    "shop_name": "e-tec.at"
}