{
    "html_file": "offer_1148_3.html",
    "name": "ViewSonic Elite XG320Q, 32\"",
    "offer_link": "https://direkt.jacob.de/produkte/viewsonic-elite-xg320q-xg320q-artnr-7465450.html?utm_source=geizhals&utm_medium=cpc&utm_campaign=Preisvergleich&ref=103",
    "price": 654.81,
    "raw_specifications": {
        "AC Eingangsfrequenz": "50/60 Hz",
        "AC Eingangsspannung": "100 - 240 V",
        "AMD FreeSync": "Nein",
        "Anzahl DisplayPort Anschl\u00fcsse": "1",
        "Anzahl HDMI-Anschl\u00fcsse": "2",
        "Anzahl der nachgeschalteten Steckpl\u00e4tze vom Typ USB-A": "3",
        "Anzahl der vorgeschalteten Steckpl\u00e4tze": "1",
        "Bildschirmaufl\u00f6sung": "2560 x 1440 Pixel",
        "Bildschirmdiagonale": "81,3 cm (32\" )",
        "Bildschirmdiagonale (cm)": "81,29 cm",
        "Bildschirmform": "Flach",
        "Bildschirmtechnologie": "LCD",
        "Blendfreier Bildschirm": "Ja",
        "Blickwinkel, horizontal": "178\u00b0",
        "Blickwinkel, vertikal": "178\u00b0",
        "DisplayPorts-Version": "1.4",
        "Eingebaute Lautsprecher": "Nein",
        "Energie Effizienzklasse": "G",
        "Fu\u00dffarbe": "Schwarz",
        "Ger\u00e4tebreite (inkl. Fu\u00df)": "726,3 mm",
        "Ger\u00e4teh\u00f6he (inkl. Fu\u00df)": "482,3 mm",
        "Ger\u00e4tetiefe (inkl. Fu\u00df)": "265,2 mm",
        "Gewicht (mit St\u00e4nder)": "14,6 kg",
        "HD-Typ": "Quad HD",
        "HDMI": "Ja",
        "HDMI-Version": "2.0",
        "H\u00f6he bei Betrieb": "0 - 3048 m",
        "H\u00f6he bei Lagerung": "0 - 12100 m",
        "H\u00f6henverstellung": "Ja",
        "Integrierte Kamera": "Nein",
        "Integrierter USB-Hub": "Ja",
        "Kopfh\u00f6rer-Konnektivit\u00e4t": "3,5 mm",
        "Kopfh\u00f6rerausgang": "Ja",
        "Kopfh\u00f6rerausg\u00e4nge": "1",
        "Luftfeuchtigkeit bei Lagerung": "5 - 90%",
        "Marktpositionierung": "Gaming",
        "Maximale Bildwiederholrate": "165 Hz",
        "NVIDIA G-SYNC": "Ja",
        "Panel-Montage-Schnittstelle": "100 x 100 mm",
        "Panel-Typ": "TFT",
        "Pixel Abstand": "0,27675 x 0,27675 mm",
        "Produktfarbe": "Schwarz",
        "Relative Luftfeuchtigkeit in Betrieb": "20 - 60%",
        "Sichtbare Gr\u00f6\u00dfe (horizontal)": "70,8 cm",
        "Sichtbare Gr\u00f6\u00dfe (vertikal)": "39,9 cm",
        "Stromeingang": "Ja",
        "Stromverbrauch (Standardbetrieb)": "35,9 W",
        "Stromverbrauch (aus)": "0,3 W",
        "St\u00e4nder enthalten": "Ja",
        "Technologie mit hohem Dynamikbereich (HDR)": "DisplayHDR 600",
        "Temperaturbereich bei Lagerung": "20 - 90 \u00b0C",
        "Temperaturbereich in Betrieb": "0 - 40 \u00b0C",
        "USB-Hub-Version": "3.2 Gen 1 (3.1 Gen 1)",
        "USB-Upstream-Porttyp": "USB Typ-B",
        "Unterst\u00fctzte Grafik-Aufl\u00f6sungen": "640 x 480 (VGA),720 x 400,800 x 600 (SVGA),1024 x 768 (XGA),1152 x 864 (XGA+),1280 x 1024 (SXGA),1280 x 800 (WXGA),1600 x 1200 (UXGA),1680 x 1050 (WSXGA+),1920 x 1080 (HD 1080),1920 x 1200 (WUXGA),2560 x 1440",
        "VESA-Halterung": "Ja"
    },
    "raw_specifications_text": "Bildschirmdiagonale: 81,3 cm (32\" )\nBildschirmaufl\u00f6sung: 2560 x 1440 Pixel\nEnergie Effizienzklasse: G\nPanel-Typ: TFT\nHD-Typ: Quad HD\nBildschirmtechnologie: LCD\nBildschirmform: Flach\nMaximale Bildwiederholrate: 165 Hz\nBlendfreier Bildschirm: Ja\nUnterst\u00fctzte Grafik-Aufl\u00f6sungen: 640 x 480 (VGA),720 x 400,800 x 600 (SVGA),1024 x 768 (XGA),1152 x 864 (XGA+),1280 x 1024 (SXGA),1280 x 800 (WXGA),1600 x 1200 (UXGA),1680 x 1050 (WSXGA+),1920 x 1080 (HD 1080),1920 x 1200 (WUXGA),2560 x 1440\nBlickwinkel, horizontal: 178\u00b0\nBlickwinkel, vertikal: 178\u00b0\nPixel Abstand: 0,27675 x 0,27675 mm\nSichtbare Gr\u00f6\u00dfe (horizontal): 70,8 cm\nSichtbare Gr\u00f6\u00dfe (vertikal): 39,9 cm\nBildschirmdiagonale (cm): 81,29 cm\nTechnologie mit hohem Dynamikbereich (HDR): DisplayHDR 600\nNVIDIA G-SYNC: Ja\nAMD FreeSync: Nein\nEingebaute Lautsprecher: Nein\nIntegrierte Kamera: Nein\nMarktpositionierung: Gaming\nProduktfarbe: Schwarz\nFu\u00dffarbe: Schwarz\nIntegrierter USB-Hub: Ja\nHDMI: Ja\nKopfh\u00f6rerausgang: Ja\nUSB-Hub-Version: 3.2 Gen 1 (3.1 Gen 1)\nUSB-Upstream-Porttyp: USB Typ-B\nAnzahl der vorgeschalteten Steckpl\u00e4tze: 1\nAnzahl der nachgeschalteten Steckpl\u00e4tze vom Typ USB-A: 3\nAnzahl HDMI-Anschl\u00fcsse: 2\nHDMI-Version: 2.0\nAnzahl DisplayPort Anschl\u00fcsse: 1\nDisplayPorts-Version: 1.4\nKopfh\u00f6rerausg\u00e4nge: 1\nKopfh\u00f6rer-Konnektivit\u00e4t: 3,5 mm\nStromeingang: Ja\nVESA-Halterung: Ja\nH\u00f6henverstellung: Ja\nPanel-Montage-Schnittstelle: 100 x 100 mm\nStromverbrauch (Standardbetrieb): 35,9 W\nStromverbrauch (aus): 0,3 W\nAC Eingangsspannung: 100 - 240 V\nAC Eingangsfrequenz: 50/60 Hz\nTemperaturbereich in Betrieb: 0 - 40 \u00b0C\nTemperaturbereich bei Lagerung: 20 - 90 \u00b0C\nRelative Luftfeuchtigkeit in Betrieb: 20 - 60%\nLuftfeuchtigkeit bei Lagerung: 5 - 90%\nH\u00f6he bei Betrieb: 0 - 3048 m\nH\u00f6he bei Lagerung: 0 - 12100 m\nGer\u00e4tebreite (inkl. Fu\u00df): 726,3 mm\nGer\u00e4tetiefe (inkl. Fu\u00df): 265,2 mm\nGer\u00e4teh\u00f6he (inkl. Fu\u00df): 482,3 mm\nGewicht (mit St\u00e4nder): 14,6 kg\nSt\u00e4nder enthalten: Ja",
    "reference_file": "offer_reference_1148.json",
    "shop_name": "Jacob Elektronik direkt (AT)"
}