{
    "html_file": "offer_2267_4.html",
    "name": "HP 27xq, 27\"",
    "offer_link": "https://www.electronicshop24.at/product_info.php?products_id=380000001053738630&ano=A-M1053738630&mno=3WL54AA%23ABB&ean=192545213608&utm_medium=cpc&utm_campaign=preisvergleich&utm_content=item&utm_source=geizhals&ref=geizhals",
    "price": 269.0,
    "raw_specifications": {
        "Abmessungen (Breite x Tiefe x H\u00f6he)": "61.4 cm x 21.6 cm x 51 cm - mit Fu\u00df",
        "Adaptive-Sync Technologie": "AMD FreeSync",
        "Besonderheiten": "HDCP, On-screen Digital Controls, ohne Quecksilber, arsenfrei",
        "Bildschirmbeschichtung": "Antistatisch",
        "Bildschirmtyp": "TN",
        "Details zu Abmessungen & Gewicht": "Mit Fu\u00df - Breite: 61.4 cm - Tiefe: 21.6 cm - H\u00f6he: 51 cm - Gewicht: 6.2 kg \u00a6 Ohne Fu\u00df - Breite: 61.36 cm - Tiefe: 5.56 cm - H\u00f6he: 37.86 cm",
        "Diagonalabmessung": "68.6 cm (27\")",
        "Display-Typ": "LED-hintergrundbeleuchteter LCD-Monitor / TFT-Aktivmatrix",
        "Eingangsspannung": "Wechselstrom 120/230 V (50/60 Hz)",
        "Einstellungen der Anzeigeposition": "H\u00f6he, Pivot (Rotation), Drehung, Neigung",
        "Energie Effizienzklasse": "Klasse G",
        "Energieverbrauch pro Jahr": "56 kWh",
        "Gewicht": "6.2 kg",
        "Helligkeit": "350 cd/m\u00b2",
        "Hintergrundbeleuchtungs-Technologie": "LED-Hintergrundbeleuchtung",
        "Horizontaler Betrachtungswinkel": "170",
        "Kennzeichnung": "Plug and Play, CSA, VCCI, BSMI, NOM, TUV S, WHQL, CB, CCC, PSB, FCC, ISO 9241-307, KCC, WEEE, MEPS, KC, CEL, EAC, halogenarm, CE/EMC, SmartWay",
        "Kontrast": "1000:1",
        "Leistungsaufnahme im Ein-Zustand": "32.1 W",
        "Leistungsmerkmale": "Slot f\u00fcr Sicherheitsschloss (Kabelschloss getrennt erh\u00e4ltlich)",
        "Lokalisierung": "Englisch / Europa",
        "Max. Betriebstemperatur": "35 \u00b0C",
        "Min Betriebstemperatur": "5 \u00b0C",
        "Native Aufl\u00f6sung": "WQHD 2560 x 1440 bei 144 Hz",
        "Neigungswinkel": "-4/+20",
        "Pixelpitch": "0.233 mm",
        "Reaktionszeit": "1 ms (Gray-to-Gray)",
        "Schlosstyp zur Diebstahlsicherung": "Kensington Slot",
        "Schnittstellen": "HDMI (HDCP) \u00a6 DisplayPort (HDCP)",
        "Schwenkwinkel": "360",
        "Service und Support": "Begrenzte Garantie - 1 Jahr",
        "Stromverbrauch (typisch)": "42 Watt",
        "Stromverbrauch SDR (eingeschaltet)": "32.1 kWh/1.000 h",
        "Stromverbrauch im Standby-Modus": "0.5 Watt",
        "Vertikale Bildwiederholrate": "48 - 144 Hz",
        "Vertikaler Betrachtungswinkel": "160",
        "Zul\u00e4ssige Luftfeuchtigkeit im Betrieb": "20 - 80% (nicht kondensierend)"
    },
    "raw_specifications_text": "Display-Typ: LED-hintergrundbeleuchteter LCD-Monitor / TFT-Aktivmatrix\nEnergie Effizienzklasse: Klasse G\nEnergieverbrauch pro Jahr: 56 kWh\nDiagonalabmessung: 68.6 cm (27\")\nAdaptive-Sync Technologie: AMD FreeSync\nBildschirmtyp: TN\nNative Aufl\u00f6sung: WQHD 2560 x 1440 bei 144 Hz\nPixelpitch: 0.233 mm\nHelligkeit: 350 cd/m\u00b2\nKontrast: 1000:1\nReaktionszeit: 1 ms (Gray-to-Gray)\nVertikale Bildwiederholrate: 48 - 144 Hz\nHorizontaler Betrachtungswinkel: 170\nVertikaler Betrachtungswinkel: 160\nBildschirmbeschichtung: Antistatisch\nHintergrundbeleuchtungs-Technologie: LED-Hintergrundbeleuchtung\nBesonderheiten: HDCP, On-screen Digital Controls, ohne Quecksilber, arsenfrei\nAbmessungen (Breite x Tiefe x H\u00f6he): 61.4 cm x 21.6 cm x 51 cm - mit Fu\u00df\nGewicht: 6.2 kg\nSchnittstellen: HDMI (HDCP) \u00a6 DisplayPort (HDCP)\nEinstellungen der Anzeigeposition: H\u00f6he, Pivot (Rotation), Drehung, Neigung\nNeigungswinkel: -4/+20\nSchwenkwinkel: 360\nLeistungsmerkmale: Slot f\u00fcr Sicherheitsschloss (Kabelschloss getrennt erh\u00e4ltlich)\nKennzeichnung: Plug and Play, CSA, VCCI, BSMI, NOM, TUV S, WHQL, CB, CCC, PSB, FCC, ISO 9241-307, KCC, WEEE, MEPS, KC, CEL, EAC, halogenarm, CE/EMC, SmartWay\nLokalisierung: Englisch / Europa\nSchlosstyp zur Diebstahlsicherung: Kensington Slot\nEingangsspannung: Wechselstrom 120/230 V (50/60 Hz)\nLeistungsaufnahme im Ein-Zustand: 32.1 W\nStromverbrauch SDR (eingeschaltet): 32.1 kWh/1.000 h\nStromverbrauch (typisch): 42 Watt\nStromverbrauch im Standby-Modus: 0.5 Watt\nDetails zu Abmessungen & Gewicht: Mit Fu\u00df - Breite: 61.4 cm - Tiefe: 21.6 cm - H\u00f6he: 51 cm - Gewicht: 6.2 kg \u00a6 Ohne Fu\u00df - Breite: 61.36 cm - Tiefe: 5.56 cm - H\u00f6he: 37.86 cm\nService und Support: Begrenzte Garantie - 1 Jahr\nMin Betriebstemperatur: 5 \u00b0C\nMax. Betriebstemperatur: 35 \u00b0C\nZul\u00e4ssige Luftfeuchtigkeit im Betrieb: 20 - 80% (nicht kondensierend)",
    "reference_file": "offer_reference_2267.json",
    "shop_name": "ElectronicShop24"
}