{
    "html_file": "offer_1964_0.html",
    "name": "HP EliteDisplay E24d G4, 23.8\"",
    "offer_link": "https://www.playox.de/productredirect/index/sku/15651427?sPartner=p-geizhals-at&campaign=psm/geizhals-at/",
    "price": 205.71,
    "raw_specifications": {
        "Anschl\u00fcsse": "USB, DisplayPort, HDMI",
        "Artikelnummer": "15651427",
        "Aufl\u00f6sung Kurzname": "Full HD",
        "Bezeichnung des Herstellers": "HP E24d G4 Advanced Docking Monitor",
        "Bildwiederholungsrate": "60,00 Hz",
        "Breite": "5394,00 mm",
        "Displaygr\u00f6\u00dfe": "60,96 cm (24 Zoll)",
        "EEK - Spektrum": "AG",
        "Einsatzort": "Innen",
        "Energieeffizienzklasse": "E",
        "Geh\u00e4usefarbe des Ger\u00e4tes": "Schwarz",
        "Gewicht": "6,86 kg",
        "Gewicht inkl. Verpackung in Kg": "0,00 kg",
        "Helligkeit Bereich": "150 - 300 cd/m\u00b2",
        "Hersteller": "HP Inc.",
        "H\u00f6he": "4944,00 mm",
        "Inhalt (ml oder g)": "0,00 ml",
        "Kapazit\u00e4t (Seiten)": "0",
        "Kontrastverh\u00e4ltnis (typisch) Bereich": "800:1 bis 1.200:1",
        "LCD-Technologie": "IPS Panel",
        "L\u00e4nge": "485,00 mm",
        "Produktart": "Monitore",
        "Reaktionszeit": "5,00 ms",
        "Seitenverh\u00e4ltnis": "16:9",
        "Shop Herstellernummer": "6PA50A4#ABB",
        "Standard-EAN": "0195697978890",
        "Verbindungen": "Netzwerk (LAN)",
        "max. Aufl\u00f6sung": "1.920 x 1.080 Pixel (16:9)"
    },
    "raw_specifications_text": "Geh\u00e4usefarbe des Ger\u00e4tes: Schwarz\nAnschl\u00fcsse: USB, DisplayPort, HDMI\nProduktart: Monitore\nDisplaygr\u00f6\u00dfe: 60,96 cm (24 Zoll)\nHelligkeit Bereich: 150 - 300 cd/m\u00b2\nHersteller: HP Inc.\nKontrastverh\u00e4ltnis (typisch) Bereich: 800:1 bis 1.200:1\nVerbindungen: Netzwerk (LAN)\nGewicht: 6,86 kg\nGewicht inkl. Verpackung in Kg: 0,00 kg\nInhalt (ml oder g): 0,00 ml\nKapazit\u00e4t (Seiten): 0\nAufl\u00f6sung Kurzname: Full HD\nEEK - Spektrum: AG\nArtikelnummer: 15651427\nStandard-EAN: 0195697978890\nShop Herstellernummer: 6PA50A4#ABB\nBezeichnung des Herstellers: HP E24d G4 Advanced Docking Monitor\nBreite: 5394,00 mm\nH\u00f6he: 4944,00 mm\nL\u00e4nge: 485,00 mm\nmax. Aufl\u00f6sung: 1.920 x 1.080 Pixel (16:9)\nSeitenverh\u00e4ltnis: 16:9\nLCD-Technologie: IPS Panel\nReaktionszeit: 5,00 ms\nBildwiederholungsrate: 60,00 Hz\nEinsatzort: Innen\nEnergieeffizienzklasse: E",
    "reference_file": "offer_reference_1964.json",
    "shop_name": "playox (AT)"
}