{
    "html_file": "offer_363_9.html",
    "name": "LG 27BR550Y-C, 27\"",
    "offer_link": "https://www.proshop.at/Bildschirm/LG-27-Bildschirm-27BR550Y-C-LED-monitor-Full-HD-1080p-27-Black-5-ms/3181840?utm_source=geizhals&utm_medium=cpc&utm_campaign=pricesite",
    "price": 167.88,
    "raw_specifications": {
        "Abmessungen (Breite x Tiefe x H\u00f6he)": "61.17 cm x 25.6 cm x 56.75 cm - mit Fu\u00df",
        "Abmessungen (Breite x Tiefe x H\u00f6he) - mit Fu\u00df": "61.17 cm x 25.6 cm x 56.75 cm",
        "Ausgangsleistung/Kanal": "2 Watt",
        "Besonderheiten": "Picture Mode, Spielmodus, Cinema Mode, Mega Dynamic Contrast Ratio, CustomColor Mode, Crosshair Display, Flicker Safe, Reader Mode, Intelligente Energiespartechnologie, Farbkalibrierung, Black Stabilizer, DAS Mode (Dynamic Action Sync), Color Weakness Mode, One Click Stand, Super Resolution+, Photo Mode, nahezu rahmenloses Display an 3 Seiten, 8-bit (6-bit + FRC) Farbtiefe, Global Dimming, H1B Backlight Array",
        "Bildschirmbeschichtung": "Entspiegelt, 3H Hard Coating, Haze 25 %",
        "Bildschirmtyp": "IPS",
        "Details zu Abmessungen & Gewicht": "Mit Fu\u00df - Breite: 61.17 cm - Tiefe: 25.6 cm - H\u00f6he: 56.75 cm - Gewicht: 7.95 kg  Ohne Fu\u00df - Breite: 61.17 cm - Tiefe: 5.03 cm - H\u00f6he: 36.41 cm - Gewicht: 5.2 kg",
        "Diagonalabmessung": "68.6 cm (27\")",
        "Display-Typ": "LED-hintergrundbeleuchteter LCD-Monitor / TFT-Aktivmatrix",
        "EAN": "8806091957252",
        "Eingangsanschl\u00fcsse": "HDMI, DVI, DisplayPort",
        "Eingangsspannung": "Wechselstrom 100-240 V (50/60 Hz)",
        "Einstellungen der Anzeigeposition": "H\u00f6he, Pivot (Rotation), Drehung, Neigung",
        "Energie Effizienzklasse": "Klasse D",
        "Farbe": "Holzkohlefarben",
        "Farbraum": "72% NTSC (CIE 1931)",
        "Farbunterst\u00fctzung": "16,7 Millionen Farben",
        "Ger\u00e4tetyp": "LED-hintergrundbeleuchteter LCD-Monitor - 68.6 cm (27\")",
        "Gewicht": "7.95 kg",
        "Helligkeit": "250 cd/m\u00b2",
        "Hersteller": "LG",
        "Hintergrundbeleuchtungs-Technologie": "Edge LED",
        "Horizontaler Betrachtungswinkel": "178",
        "H\u00f6heneinstellung": "130 mm",
        "Integrierte Peripherieger\u00e4te": "USB 3.0-Hub",
        "Kennzeichnung": "FCC Klasse B bescheinigt, TUV, VCCI, BSMI, CB, CCC, TUV Ergo, RoHS, REACH, KC, ERP, BIS, EPA 8.0, UL/cUL, TCO Certified Edge, TUV-GS",
        "Kontrast": "1000:1",
        "Leistungsmerkmale": "Slot f\u00fcr Sicherheitsschloss (Kabelschloss getrennt erh\u00e4ltlich), abnehmbarer St\u00e4nder, strukturierte Oberfl\u00e4che",
        "Mitgelieferte Software": "Dual Controller Software, LG On-Screen Control",
        "Modell": "27BR550Y-C",
        "Native Aufl\u00f6sung": "Full HD (1080p) 1920 x 1080 bei 75 Hz",
        "Neigungswinkel": "-5/+25",
        "OSD-Sprachen": "Multilingual",
        "Pixelpitch": "0.3114 mm",
        "Produktbeschreibung": "LG 27BR550Y-C - LED-Monitor - Full HD (1080p) - 68.6 cm (27\")",
        "Reaktionszeit": "5 ms (Gray-to-Gray)",
        "Schlosstyp zur Diebstahlsicherung": "Kensington Slot",
        "Schnittstellen": "DVI  HDMI 1.4  DisplayPort 1.2  USB 3.0 Upstream  2 x USB 3.0 Downstream  Audio Line-In  Kopfh\u00f6reranschluss",
        "Schwenkwinkel": "30",
        "Seitenverh\u00e4ltnis": "16:9",
        "Spannung": "Wechselstrom 100-240 V (50/60 Hz)",
        "Stromverbrauch (Aus-Modus)": "0.3 Watt",
        "Stromverbrauch (max.)": "39 Watt",
        "Stromverbrauch (typisch)": "27 Watt",
        "Stromverbrauch SDR (eingeschaltet)": "17 kWh/1.000 h",
        "Stromverbrauch im Standby-Modus": "0.3 Watt",
        "Transportbreite": "69.3 cm",
        "Transportgewicht": "10.65 kg",
        "Transporth\u00f6he": "53.4 cm",
        "Transporttiefe": "19.8 cm",
        "Typ": "Lautsprecher - Stereo",
        "Umweltschutzstandards": "TCO Certified Displays 9",
        "VESA-Halterung": "100 x 100 mm",
        "Vertikaler Betrachtungswinkel": "178",
        "Waren-Nr.": "3181840",
        "Zum Hersteller": "www.lge.com"
    },
    "raw_specifications_text": "Hersteller: LG\nWaren-Nr.: 3181840\nModell: 27BR550Y-C\nEAN: 8806091957252\nZum Hersteller: www.lge.com\nProduktbeschreibung: LG 27BR550Y-C - LED-Monitor - Full HD (1080p) - 68.6 cm (27\")\nGer\u00e4tetyp: LED-hintergrundbeleuchteter LCD-Monitor - 68.6 cm (27\")\nEnergie Effizienzklasse: Klasse D\nLeistungsmerkmale: Slot f\u00fcr Sicherheitsschloss (Kabelschloss getrennt erh\u00e4ltlich), abnehmbarer St\u00e4nder, strukturierte Oberfl\u00e4che\nBildschirmtyp: IPS\nSeitenverh\u00e4ltnis: 16:9\nNative Aufl\u00f6sung: Full HD (1080p) 1920 x 1080 bei 75 Hz\nPixelpitch: 0.3114 mm\nHelligkeit: 250 cd/m\u00b2\nKontrast: 1000:1\nReaktionszeit: 5 ms (Gray-to-Gray)\nFarbunterst\u00fctzung: 16,7 Millionen Farben\nFarbraum: 72% NTSC (CIE 1931)\nEingangsanschl\u00fcsse: HDMI, DVI, DisplayPort\nEinstellungen der Anzeigeposition: H\u00f6he, Pivot (Rotation), Drehung, Neigung\nBildschirmbeschichtung: Entspiegelt, 3H Hard Coating, Haze 25 %\nSpannung: Wechselstrom 100-240 V (50/60 Hz)\nFarbe: Holzkohlefarben\nAbmessungen (Breite x Tiefe x H\u00f6he) - mit Fu\u00df: 61.17 cm x 25.6 cm x 56.75 cm\nGewicht: 7.95 kg\nUmweltschutzstandards: TCO Certified Displays 9\nKennzeichnung: FCC Klasse B bescheinigt, TUV, VCCI, BSMI, CB, CCC, TUV Ergo, RoHS, REACH, KC, ERP, BIS, EPA 8.0, UL/cUL, TCO Certified Edge, TUV-GS\nDisplay-Typ: LED-hintergrundbeleuchteter LCD-Monitor / TFT-Aktivmatrix\nDiagonalabmessung: 68.6 cm (27\")\nIntegrierte Peripherieger\u00e4te: USB 3.0-Hub\nHorizontaler Betrachtungswinkel: 178\nVertikaler Betrachtungswinkel: 178\nHintergrundbeleuchtungs-Technologie: Edge LED\nOSD-Sprachen: Multilingual\nBesonderheiten: Picture Mode, Spielmodus, Cinema Mode, Mega Dynamic Contrast Ratio, CustomColor Mode, Crosshair Display, Flicker Safe, Reader Mode, Intelligente Energiespartechnologie, Farbkalibrierung, Black Stabilizer, DAS Mode (Dynamic Action Sync), Color Weakness Mode, One Click Stand, Super Resolution+, Photo Mode, nahezu rahmenloses Display an 3 Seiten, 8-bit (6-bit + FRC) Farbtiefe, Global Dimming, H1B Backlight Array\nAbmessungen (Breite x Tiefe x H\u00f6he): 61.17 cm x 25.6 cm x 56.75 cm - mit Fu\u00df\nTyp: Lautsprecher - Stereo\nAusgangsleistung/Kanal: 2 Watt\nSchnittstellen: DVI  HDMI 1.4  DisplayPort 1.2  USB 3.0 Upstream  2 x USB 3.0 Downstream  Audio Line-In  Kopfh\u00f6reranschluss\nNeigungswinkel: -5/+25\nSchwenkwinkel: 30\nH\u00f6heneinstellung: 130 mm\nVESA-Halterung: 100 x 100 mm\nSchlosstyp zur Diebstahlsicherung: Kensington Slot\nEingangsspannung: Wechselstrom 100-240 V (50/60 Hz)\nStromverbrauch SDR (eingeschaltet): 17 kWh/1.000 h\nStromverbrauch (typisch): 27 Watt\nStromverbrauch (max.): 39 Watt\nStromverbrauch im Standby-Modus: 0.3 Watt\nStromverbrauch (Aus-Modus): 0.3 Watt\nMitgelieferte Software: Dual Controller Software, LG On-Screen Control\nDetails zu Abmessungen & Gewicht: Mit Fu\u00df - Breite: 61.17 cm - Tiefe: 25.6 cm - H\u00f6he: 56.75 cm - Gewicht: 7.95 kg  Ohne Fu\u00df - Breite: 61.17 cm - Tiefe: 5.03 cm - H\u00f6he: 36.41 cm - Gewicht: 5.2 kg\nTransportbreite: 69.3 cm\nTransporttiefe: 19.8 cm\nTransporth\u00f6he: 53.4 cm\nTransportgewicht: 10.65 kg",
    "reference_file": "offer_reference_363.json",
    "shop_name": "Proshop.at"
}