{
    "html_file": "offer_1097_4.html",
    "name": "Samsung Odyssey G3 G32A, 27\"",
    "offer_link": "https://www.office-partner.de/productredirect/index/sku/20312797?sPartner=p-geizhals-at&campaign=psm/geizhals-at/",
    "price": 176.14,
    "raw_specifications": {
        "Anschl\u00fcsse": "HDMI, DisplayPort, Kopfh\u00f6reranschluss, Audioausgang (Line-Out)",
        "Artikelnummer": "20312797",
        "Aufl\u00f6sung Kurzname": "Full HD",
        "Bezeichnung des Herstellers": "Samsung S27AG320NU",
        "Bildwiederholungsrate": "165,00 Hz",
        "Breite": "6182,00 mm",
        "Display Features": "FlickerFree, Black-Tuner",
        "Display Sync": "AMD FreeSync, Adaptive Sync",
        "Displaygr\u00f6\u00dfe": "68,58 cm (27 Zoll)",
        "Displayoberfl\u00e4che": "matt",
        "EEK - Spektrum": "AG",
        "Einsatzort": "Innen",
        "Energieeffizienzklasse": "E",
        "Geh\u00e4usefarbe des Ger\u00e4tes": "Schwarz",
        "Gewicht": "4,80 kg",
        "Gewicht inkl. Verpackung in Kg": "7,20 kg",
        "Helligkeit Bereich": "150 - 300 cd/m\u00b2",
        "Hersteller": "Samsung",
        "H\u00f6he": "5206,00 mm",
        "Inhalt (ml oder g)": "0,00 ml",
        "Kapazit\u00e4t (Seiten)": "0",
        "Kontrastverh\u00e4ltnis (typisch) Bereich": "ab 1.200:1",
        "LCD-Technologie": "VA Panel",
        "L\u00e4nge": "2342,00 mm",
        "Produktart": "Monitore",
        "Reaktionszeit": "1,00 ms",
        "Seitenverh\u00e4ltnis": "16:9",
        "Shop Herstellernummer": "LS27AG320NUXEN",
        "Standard-EAN": "8806092802148",
        "Verpackung - Breite in cm": "70,40 cm",
        "Verpackung - H\u00f6he in cm": "46,40 cm",
        "Verpackung - L\u00e4nge in cm": "21,80 cm",
        "max. Aufl\u00f6sung": "1.920 x 1.080 Pixel (16:9)"
    },
    "raw_specifications_text": "Energieeffizienzklasse: E\nDisplaygr\u00f6\u00dfe: 68,58 cm (27 Zoll)\nGeh\u00e4usefarbe des Ger\u00e4tes: Schwarz\nAnschl\u00fcsse: HDMI, DisplayPort, Kopfh\u00f6reranschluss, Audioausgang (Line-Out)\nDisplay Features: FlickerFree, Black-Tuner\nHersteller: Samsung\nKontrastverh\u00e4ltnis (typisch) Bereich: ab 1.200:1\nHelligkeit Bereich: 150 - 300 cd/m\u00b2\nGewicht: 4,80 kg\nProduktart: Monitore\nDisplay Sync: AMD FreeSync, Adaptive Sync\nAufl\u00f6sung Kurzname: Full HD\nInhalt (ml oder g): 0,00 ml\nKapazit\u00e4t (Seiten): 0\nEEK - Spektrum: AG\nVerpackung - Breite in cm: 70,40 cm\nVerpackung - H\u00f6he in cm: 46,40 cm\nVerpackung - L\u00e4nge in cm: 21,80 cm\nGewicht inkl. Verpackung in Kg: 7,20 kg\nL\u00e4nge: 2342,00 mm\nH\u00f6he: 5206,00 mm\nArtikelnummer: 20312797\nStandard-EAN: 8806092802148\nShop Herstellernummer: LS27AG320NUXEN\nBezeichnung des Herstellers: Samsung S27AG320NU\nBreite: 6182,00 mm\nmax. Aufl\u00f6sung: 1.920 x 1.080 Pixel (16:9)\nSeitenverh\u00e4ltnis: 16:9\nLCD-Technologie: VA Panel\nReaktionszeit: 1,00 ms\nDisplayoberfl\u00e4che: matt\nBildwiederholungsrate: 165,00 Hz\nEinsatzort: Innen",
    "reference_file": "offer_reference_1097.json",
    "shop_name": "office-partner (AT)"
}