{
    "html_file": "offer_1087_7.html",
    "name": "LC-Power LC-M27-FHD-165-C-V2, 27\"",
    "offer_link": "https://www.amazon.de/dp/B08G1Z6TKX?linkCode=xm2&camp=2025&creative=165953&smid=A3JWKAKR8XB7XF&creativeASIN=B08G1Z6TKX&tag=geizhals1-21",
    "price": 225.11,
    "raw_specifications": {
        "ASIN": "B08G1Z6TKX",
        "Amazon Bestseller-Rang": "Nr. 35,722 in Computer & Zubeh\u00f6r (Siehe Top 100 in Computer & Zubeh\u00f6r)  Nr. 744 in Monitore",
        "Antriebsart": "\u200eHandbetrieben",
        "Anzahl HDMI Schnittstellen": "\u200e2",
        "Artikelgewicht": "\u200e4,8 Kilograms",
        "Batterien enthalten": "\u200eNein",
        "Bildschirmaufl\u00f6sung": "\u200e1920 x 1080",
        "Display-Gr\u00f6\u00dfe": "\u200e27 Zoll",
        "Durchschnittliche Kundenbewertung": "4,5  4,5 von 5 Sternen    \n    1.244 Sternebewertungen   \n\n\n 4,5 von 5 Sternen",
        "Farbe": "\u200eSchwarz",
        "Garantierte Software-Updates bis": "\u200eunbekannt",
        "Hersteller": "\u200eLC Power",
        "Im Angebot von Amazon.de seit": "17. August 2020",
        "L\u00f6sung": "\u200e1920 x 1080",
        "Marke": "\u200eLC-POWER",
        "Modell/Serie": "\u200eLC-M27-FHD-165-C",
        "Modellnummer": "\u200eLC-M27-FHD-165-C-V2",
        "Produktabmessungen": "\u200e45,3 x 19,5 x 45,3 cm; 4,8 Kilogramm"
    },
    "raw_specifications_text": "Marke: \u200eLC-POWER\nHersteller: \u200eLC Power\nModell/Serie: \u200eLC-M27-FHD-165-C\nProduktabmessungen: \u200e45,3 x 19,5 x 45,3 cm; 4,8 Kilogramm\nModellnummer: \u200eLC-M27-FHD-165-C-V2\nFarbe: \u200eSchwarz\nDisplay-Gr\u00f6\u00dfe: \u200e27 Zoll\nBildschirmaufl\u00f6sung: \u200e1920 x 1080\nL\u00f6sung: \u200e1920 x 1080\nAnzahl HDMI Schnittstellen: \u200e2\nAntriebsart: \u200eHandbetrieben\nBatterien enthalten: \u200eNein\nArtikelgewicht: \u200e4,8 Kilograms\nGarantierte Software-Updates bis: \u200eunbekannt\nASIN: B08G1Z6TKX\nDurchschnittliche Kundenbewertung: 4,5  4,5 von 5 Sternen    \n    1.244 Sternebewertungen   \n\n\n 4,5 von 5 Sternen\nAmazon Bestseller-Rang: Nr. 35,722 in Computer & Zubeh\u00f6r (Siehe Top 100 in Computer & Zubeh\u00f6r)  Nr. 744 in Monitore\nIm Angebot von Amazon.de seit: 17. August 2020",
    "reference_file": "offer_reference_1087.json",
    "shop_name": "Amazon.at"
}