{
    "html_file": "offer_1910_12.html",
    "name": "LG 43BN70U-B, 42.5\"",
    "offer_link": "https://www.1ashop.at/de/produkt/69728/lg-43bn70u-b-led-monitor-109-2-cm-43-42-51-sichtbar.html",
    "price": 663.16,
    "raw_specifications": {
        "Abmessungen (Breite x Tiefe x H\u00f6he)": "96.8 cm x 27.4 cm x 64.8 cm - mit Fu\u00df",
        "Ausgangsleistung/Kanal": "10 Watt",
        "Besonderheiten": "HDCP, Geteilter Bildschirm, Black eQualizer, On-screen Digital Controls, Reader Mode, SIX Axis Control, Werkskalibrierung, Dual Controller, DAS Mode (Dynamic Action Sync), Mega DFC, Super Resolution+, Rich Bass, Picture-in-Picture, Picture-by-Picture, 10-bit Farbtiefe",
        "Bildschirmbeschichtung": "Blendfrei",
        "Bildschirmtyp": "IPS",
        "Details zu Abmessungen & Gewicht": "Mit Fu\u00df - Breite: 96.8 cm - Tiefe: 27.4 cm - H\u00f6he: 64.8 cm - Gewicht: 15.9 kg  Ohne Fu\u00df - Breite: 96.8 cm - Tiefe: 7.11 cm - H\u00f6he: 57.4 cm - Gewicht: 12.3 kg",
        "Diagonalabmessung": "109.2 cm (43\")",
        "Display-Typ": "LED-hintergrundbeleuchteter LCD-Monitor / TFT-Aktivmatrix",
        "EAN/UPC": "8806091008909",
        "Eingangsspannung": "Wechselstrom 120/230 V (50/60 Hz)",
        "Einstellungen der Anzeigeposition": "Neigung",
        "Energie Effizienzklasse": "Klasse G",
        "Energieklasse (HDR)": "Klasse G",
        "Energierverbrauch Sleep": "0.5 Watt",
        "Enthaltene Kabel": "1 x USB-Kabel Typ A auf Typ B  1 x HDMI-Kabel  1 x DisplayPort-Kabel",
        "Farbe": "Mattschwarz",
        "Farbraum": "72% (CIE 1931)",
        "Gewicht": "15.9 kg",
        "Gruppe": "TFTs",
        "Helligkeit": "350 cd/m\u00b2",
        "Hersteller": "LG",
        "Hersteller Art. Nr.": "43BN70U-B",
        "Hintergrundbeleuchtungs-Technologie": "LED-Hintergrundbeleuchtung",
        "Horizontale Bildwiederholrate": "30 - 135 kHz",
        "Horizontaler Betrachtungswinkel": "178",
        "Integrierte Peripherieger\u00e4te": "USB Hub",
        "Kennzeichnung": "Plug and Play, FCC Klasse B bescheinigt, UL, TUV, cUL, CB, DDC/CI, RoHS, REACH, ERP, DisplayPort 1.2, HDCP 2.2",
        "Kontrast": "1000:1",
        "Leistungsmerkmale": "Slot f\u00fcr Sicherheitsschloss (Kabelschloss getrennt erh\u00e4ltlich)",
        "Native Aufl\u00f6sung": "4K 3840 x 2160 (DisplayPort: 60 Hz, HDMI1-2: 30 Hz, HDMI3-4: 60 Hz, USB-C: 60 Hz)",
        "Neigungswinkel": "-5/+10",
        "OSD-Sprachen": "Multilingual",
        "Pixelpitch": "0.2451 mm",
        "Reaktionszeit": "8 ms",
        "Schlosstyp zur Diebstahlsicherung": "Kensington Slot",
        "Schnittstellen": "2 x USB Downstream  4 x HDMI  DisplayPort  Kopfh\u00f6rer  USB-C (bis zu 60 W)",
        "Seitenverh\u00e4ltnis": "16:9",
        "Service und Support": "Begrenzte Garantie - Arbeitszeit und Ersatzteile - Leuchtpult - 3 Jahre",
        "Sichtbare Bildfl\u00e4che": "108 cm (42.51\")",
        "Stromverbrauch (Aus-Modus)": "0.3 Watt",
        "Stromverbrauch (typisch)": "70 Watt",
        "Stromverbrauch HDR (eingeschaltet)": "81.9 kWh/1.000 h",
        "Stromverbrauch SDR (eingeschaltet)": "58.8 kWh/1.000 h",
        "Transportbreite": "106 cm",
        "Transportgewicht": "20 kg",
        "Transporth\u00f6he": "65.8 cm",
        "Transporttiefe": "28.4 cm",
        "Typ": "Lautsprecher - Stereo",
        "USB-Spannungsversorgung": "60 Watt",
        "VESA-Halterung": "200 x 200 mm",
        "Vertikale Bildwiederholrate": "56 - 61 Hz",
        "Vertikaler Betrachtungswinkel": "178"
    },
    "raw_specifications_text": "Gruppe: TFTs\nHersteller: LG\nHersteller Art. Nr.: 43BN70U-B\nEAN/UPC: 8806091008909\nDiagonalabmessung: 109.2 cm (43\")\nDisplay-Typ: LED-hintergrundbeleuchteter LCD-Monitor / TFT-Aktivmatrix\nSichtbare Bildfl\u00e4che: 108 cm (42.51\")\nEnergie Effizienzklasse: Klasse G\nEnergieklasse (HDR): Klasse G\nBildschirmtyp: IPS\nIntegrierte Peripherieger\u00e4te: USB Hub\nUSB-Spannungsversorgung: 60 Watt\nHelligkeit: 350 cd/m\u00b2\nSeitenverh\u00e4ltnis: 16:9\nFarbraum: 72% (CIE 1931)\nNative Aufl\u00f6sung: 4K 3840 x 2160 (DisplayPort: 60 Hz, HDMI1-2: 30 Hz, HDMI3-4: 60 Hz, USB-C: 60 Hz)\nReaktionszeit: 8 ms\nPixelpitch: 0.2451 mm\nKontrast: 1000:1\nBildschirmbeschichtung: Blendfrei\nHintergrundbeleuchtungs-Technologie: LED-Hintergrundbeleuchtung\nVertikale Bildwiederholrate: 56 - 61 Hz\nOSD-Sprachen: Multilingual\nHorizontale Bildwiederholrate: 30 - 135 kHz\nHorizontaler Betrachtungswinkel: 178\nBesonderheiten: HDCP, Geteilter Bildschirm, Black eQualizer, On-screen Digital Controls, Reader Mode, SIX Axis Control, Werkskalibrierung, Dual Controller, DAS Mode (Dynamic Action Sync), Mega DFC, Super Resolution+, Rich Bass, Picture-in-Picture, Picture-by-Picture, 10-bit Farbtiefe\nVertikaler Betrachtungswinkel: 178\nAbmessungen (Breite x Tiefe x H\u00f6he): 96.8 cm x 27.4 cm x 64.8 cm - mit Fu\u00df\nGewicht: 15.9 kg\nFarbe: Mattschwarz\nTyp: Lautsprecher - Stereo\nStromverbrauch SDR (eingeschaltet): 58.8 kWh/1.000 h\nStromverbrauch HDR (eingeschaltet): 81.9 kWh/1.000 h\nStromverbrauch (typisch): 70 Watt\nEnergierverbrauch Sleep: 0.5 Watt\nEingangsspannung: Wechselstrom 120/230 V (50/60 Hz)\nStromverbrauch (Aus-Modus): 0.3 Watt\nSchnittstellen: 2 x USB Downstream  4 x HDMI  DisplayPort  Kopfh\u00f6rer  USB-C (bis zu 60 W)\nAusgangsleistung/Kanal: 10 Watt\nEinstellungen der Anzeigeposition: Neigung\nNeigungswinkel: -5/+10\nVESA-Halterung: 200 x 200 mm\nLeistungsmerkmale: Slot f\u00fcr Sicherheitsschloss (Kabelschloss getrennt erh\u00e4ltlich)\nEnthaltene Kabel: 1 x USB-Kabel Typ A auf Typ B  1 x HDMI-Kabel  1 x DisplayPort-Kabel\nKennzeichnung: Plug and Play, FCC Klasse B bescheinigt, UL, TUV, cUL, CB, DDC/CI, RoHS, REACH, ERP, DisplayPort 1.2, HDCP 2.2\nSchlosstyp zur Diebstahlsicherung: Kensington Slot\nDetails zu Abmessungen & Gewicht: Mit Fu\u00df - Breite: 96.8 cm - Tiefe: 27.4 cm - H\u00f6he: 64.8 cm - Gewicht: 15.9 kg  Ohne Fu\u00df - Breite: 96.8 cm - Tiefe: 7.11 cm - H\u00f6he: 57.4 cm - Gewicht: 12.3 kg\nTransportbreite: 106 cm\nTransporttiefe: 28.4 cm\nTransporth\u00f6he: 65.8 cm\nTransportgewicht: 20 kg\nService und Support: Begrenzte Garantie - Arbeitszeit und Ersatzteile - Leuchtpult - 3 Jahre",
    "reference_file": "offer_reference_1910.json",
    "shop_name": "1ashop.at"
}