{
    "html_file": "offer_255_32.html",
    "name": "LG UltraGear 27GR75Q-B, 27\"",
    "offer_link": "https://ms-it-beratung.at/shop/details.php?art=433163&artname=LG+27%22+27GR75Q-B+WQHD+Gaming+Monitor+HDMI+DP+IPS+schwarz",
    "price": 333.0,
    "raw_specifications": {
        "AC Eingangsfrequenz": "50 - 60 Hz",
        "AC Eingangsspannung": "100 - 240 V",
        "AMD FreeSync": "Ja",
        "AMD FreeSync-Typ": "FreeSync Premium",
        "Anzahl DisplayPort Anschl\u00fcsse": "1",
        "Anzahl HDMI-Anschl\u00fcsse": "2",
        "Anzahl der Farben des Displays": "16,7 Millionen Farben",
        "Bildschirmdiagonale": "68,6 cm (27\")",
        "Bildschirmdiagonale (cm)": "68,5 cm",
        "Bildschirmform": "Flach",
        "Bildwinkel, horizontal": "178\u00b0",
        "Bildwinkel, vertikal": "178\u00b0",
        "Blendfreier Bildschirm": "Ja",
        "Breite (ohne Standfu\u00df)": "613,5 mm",
        "Digitales Signalformatsystem": "Nicht unterst\u00fctzt",
        "Display-Aufl\u00f6sung": "2560 x 1440 Pixel",
        "DisplayPort Kabell\u00e4nge": "1,8 m",
        "DisplayPorts-Version": "1.4",
        "Eingebaute Lautsprecher": "Nein",
        "Energieeffizienzklasse (HDR)": "G",
        "Energieeffizienzklasse (SDR)": "F",
        "Energieverbrauch (HDR) pro 1.000 Stunden": "37 kWh",
        "Energieverbrauch (SDR) pro 1.000 Stunden": "26 kWh",
        "FPS-Z\u00e4hler": "Ja",
        "Flimmerfreie Technologie": "Ja",
        "Ger\u00e4tebreite (inkl. Fu\u00df)": "613,5 mm",
        "Ger\u00e4teh\u00f6he (inkl. Fu\u00df)": "569,8 mm",
        "Ger\u00e4tetiefe (inkl. Fu\u00df)": "291,2 mm",
        "Gewicht (mit St\u00e4nder)": "6,19 kg",
        "Gewicht (ohne St\u00e4nder)": "4,05 kg",
        "HD-Typ": "Quad HD",
        "HDCP": "Ja",
        "HDCP-Version": "2.2",
        "HDMI": "Ja",
        "Helligkeit (typisch)": "300 cd/m\u00b2",
        "High Dynamic Range Video (HDR) Unterst\u00fctzung": "Ja",
        "H\u00f6he (ohne Standfu\u00df)": "371,6 mm",
        "H\u00f6heneinstellung": "11 cm",
        "H\u00f6henverstellung": "Ja",
        "Integrierte Kamera": "Nein",
        "Integrierter USB-Hub": "Nein",
        "Kabelsperre-Slot": "Nein",
        "Kontrastverh\u00e4ltnis": "1000:1",
        "Kopfh\u00f6rerausgang": "Ja",
        "Markenspezifische Technologien": "Crosshair",
        "Marktpositionierung": "Gaming",
        "Maximale Bildwiederholrate": "165 Hz",
        "NVIDIA G-SYNC": "Ja",
        "NVIDIA G-SYNC-Typ": "G-SYNC Compatible",
        "Natives Seitenverh\u00e4ltnis": "16:9",
        "Neigungswinkelbereich": "-5 - 15\u00b0",
        "Netzteiltyp": "Extern",
        "Paketgewicht": "8,55 kg",
        "Panel-Montage-Schnittstelle": "100 x 100 mm",
        "Panel-Typ": "IPS",
        "Pivot": "Ja",
        "Pixel Abstand": "0,2331 x 0,2331 mm",
        "Produktfarbe": "Schwarz",
        "Reaktionszeit": "1 ms",
        "Stromverbrauch (Standardbetrieb)": "45 W",
        "Stromverbrauch (aus)": "0,3 W",
        "Stromverbrauch (max.)": "48 W",
        "St\u00e4nder enthalten": "Ja",
        "Technologie mit hohem Dynamikbereich (HDR)": "HDR Effect, High Dynamic Range 10 (HDR10)",
        "Tiefe (ohne Standfu\u00df)": "51,3 mm",
        "Touchscreen": "Nein",
        "VESA-Halterung": "Ja",
        "Verpackungsbreite": "691 mm",
        "Verpackungsh\u00f6he": "513 mm",
        "Verpackungstiefe": "185 mm",
        "sRGB Abdeckung (klassisch)": "95%"
    },
    "raw_specifications_text": "Bildschirmdiagonale: 68,6 cm (27\")\nDisplay-Aufl\u00f6sung: 2560 x 1440 Pixel\nNatives Seitenverh\u00e4ltnis: 16:9\nTouchscreen: Nein\nHD-Typ: Quad HD\nPanel-Typ: IPS\nHelligkeit (typisch): 300 cd/m\u00b2\nReaktionszeit: 1 ms\nBlendfreier Bildschirm: Ja\nBildschirmform: Flach\nKontrastverh\u00e4ltnis: 1000:1\nMaximale Bildwiederholrate: 165 Hz\nBildwinkel, horizontal: 178\u00b0\nBildwinkel, vertikal: 178\u00b0\nAnzahl der Farben des Displays: 16,7 Millionen Farben\nPixel Abstand: 0,2331 x 0,2331 mm\nBildschirmdiagonale (cm): 68,5 cm\nHigh Dynamic Range Video (HDR) Unterst\u00fctzung: Ja\nTechnologie mit hohem Dynamikbereich (HDR): HDR Effect, High Dynamic Range 10 (HDR10)\nsRGB Abdeckung (klassisch): 95%\nNVIDIA G-SYNC: Ja\nAMD FreeSync: Ja\nNVIDIA G-SYNC-Typ: G-SYNC Compatible\nAMD FreeSync-Typ: FreeSync Premium\nMarkenspezifische Technologien: Crosshair\nFlimmerfreie Technologie: Ja\nFPS-Z\u00e4hler: Ja\nEingebaute Lautsprecher: Nein\nIntegrierte Kamera: Nein\nMarktpositionierung: Gaming\nProduktfarbe: Schwarz\nIntegrierter USB-Hub: Nein\nHDMI: Ja\nAnzahl HDMI-Anschl\u00fcsse: 2\nAnzahl DisplayPort Anschl\u00fcsse: 1\nDisplayPorts-Version: 1.4\nKopfh\u00f6rerausgang: Ja\nHDCP: Ja\nHDCP-Version: 2.2\nVESA-Halterung: Ja\nPanel-Montage-Schnittstelle: 100 x 100 mm\nKabelsperre-Slot: Nein\nH\u00f6henverstellung: Ja\nH\u00f6heneinstellung: 11 cm\nPivot: Ja\nNeigungswinkelbereich: -5 - 15\u00b0\nEnergieeffizienzklasse (SDR): F\nEnergieeffizienzklasse (HDR): G\nEnergieverbrauch (SDR) pro 1.000 Stunden: 26 kWh\nEnergieverbrauch (HDR) pro 1.000 Stunden: 37 kWh\nStromverbrauch (Standardbetrieb): 45 W\nStromverbrauch (max.): 48 W\nStromverbrauch (aus): 0,3 W\nAC Eingangsspannung: 100 - 240 V\nAC Eingangsfrequenz: 50 - 60 Hz\nNetzteiltyp: Extern\nSt\u00e4nder enthalten: Ja\nDisplayPort Kabell\u00e4nge: 1,8 m\nGer\u00e4tebreite (inkl. Fu\u00df): 613,5 mm\nGer\u00e4tetiefe (inkl. Fu\u00df): 291,2 mm\nGer\u00e4teh\u00f6he (inkl. Fu\u00df): 569,8 mm\nGewicht (mit St\u00e4nder): 6,19 kg\nBreite (ohne Standfu\u00df): 613,5 mm\nTiefe (ohne Standfu\u00df): 51,3 mm\nH\u00f6he (ohne Standfu\u00df): 371,6 mm\nGewicht (ohne St\u00e4nder): 4,05 kg\nVerpackungsbreite: 691 mm\nVerpackungstiefe: 185 mm\nVerpackungsh\u00f6he: 513 mm\nPaketgewicht: 8,55 kg\nDigitales Signalformatsystem: Nicht unterst\u00fctzt",
    "reference_file": "offer_reference_255.json",
    "shop_name": "ms-it-beratung"
}