{
    "html_file": "offer_256_3.html",
    "name": "HP Omen 27 (2023), 27\"",
    "offer_link": "https://www.playox.de/productredirect/index/sku/27361404?sPartner=p-geizhals-at&campaign=psm/geizhals-at/",
    "price": 194.72,
    "raw_specifications": {
        "Anschl\u00fcsse": "USB, DisplayPort, HDMI, Kopfh\u00f6reranschluss",
        "Artikelnummer": "27361404",
        "Aufl\u00f6sung Kurzname": "Full HD",
        "Bezeichnung des Herstellers": "HP OMEN 27",
        "Bildwiederholungsrate": "165,00",
        "Breite": "-1,00",
        "Display Sync": "AMD FreeSync",
        "Displaygr\u00f6\u00dfe": "68,58 cm (27 Zoll)",
        "Displayoberfl\u00e4che": "matt",
        "EEK - Spektrum": "AG",
        "Einsatzort": "Innen",
        "Energieeffizienzklasse": "G",
        "Geh\u00e4usefarbe des Ger\u00e4tes": "Schwarz",
        "Gewicht": "11,32",
        "Gewicht inkl. Verpackung in Kg": "0,00",
        "Helligkeit Bereich": "300 - 450 cd/m\u00b2",
        "Hersteller": "HP Inc.",
        "H\u00f6he": "-1,00",
        "Kapazit\u00e4t (Seiten)": "0",
        "Kontrastverh\u00e4ltnis (typisch) Bereich": "800:1 bis 1.200:1",
        "LCD-Technologie": "IPS Panel",
        "L\u00e4nge": "-1,00",
        "Produktart": "Monitore",
        "Reaktionszeit": "1,00",
        "Seitenverh\u00e4ltnis": "16:9",
        "Shop Herstellernummer": "780F9E9#ABB",
        "Standard-EAN": "0197029615145",
        "max. Aufl\u00f6sung": "1.920 x 1.080 Pixel (16:9)"
    },
    "raw_specifications_text": "Displaygr\u00f6\u00dfe: 68,58 cm (27 Zoll)\nGeh\u00e4usefarbe des Ger\u00e4tes: Schwarz\nAnschl\u00fcsse: USB, DisplayPort, HDMI, Kopfh\u00f6reranschluss\nProduktart: Monitore\nHersteller: HP Inc.\nKontrastverh\u00e4ltnis (typisch) Bereich: 800:1 bis 1.200:1\nHelligkeit Bereich: 300 - 450 cd/m\u00b2\nDisplay Sync: AMD FreeSync\nKapazit\u00e4t (Seiten): 0\nAufl\u00f6sung Kurzname: Full HD\nEEK - Spektrum: AG\nBreite: -1,00\nH\u00f6he: -1,00\nL\u00e4nge: -1,00\nGewicht inkl. Verpackung in Kg: 0,00\nArtikelnummer: 27361404\nStandard-EAN: 0197029615145\nShop Herstellernummer: 780F9E9#ABB\nBezeichnung des Herstellers: HP OMEN 27\nGewicht: 11,32\nmax. Aufl\u00f6sung: 1.920 x 1.080 Pixel (16:9)\nSeitenverh\u00e4ltnis: 16:9\nLCD-Technologie: IPS Panel\nReaktionszeit: 1,00\nDisplayoberfl\u00e4che: matt\nBildwiederholungsrate: 165,00\nEinsatzort: Innen\nEnergieeffizienzklasse: G",
    "reference_file": "offer_reference_256.json",
    "shop_name": "playox (AT)"
}