{
    "html_file": "offer_1258_15.html",
    "name": "AOC Q27P2CA, 27\"",
    "offer_link": "https://www.hiq24.de/shop/artikel/316858/?sPartner=geizhals",
    "price": 265.9,
    "raw_specifications": {
        "Abmessungen (Breite x Tiefe x H\u00f6he)": "61.36 cm x 20.01 cm x 39.45 cm - mit Fu\u00df",
        "Abmessungen (Breite x Tiefe x H\u00f6he) - mit Fu\u00df": "61.36 cm x 20.01 cm x 39.45 cm",
        "Bildschirmtyp": "IPS",
        "Details zu Abmessungen & Gewicht": "Mit Standfu\u00df (niedrigste Position) - Breite: 61.36 cm - Tiefe: 20.01 cm - H\u00f6he: 39.45 cm - Gewicht: 6.3 kg  Mit Standfu\u00df (h\u00f6chste Position) - Breite: 61.36 cm - Tiefe: 20.01 cm - H\u00f6he: 54.45 cm - Gewicht: 6.3 kg",
        "Diagonalabmessung": "68.6 cm (27\")",
        "Display-Typ": "LED-hintergrundbeleuchteter LCD-Monitor / TFT-Aktivmatrix",
        "ENERGY STAR zertifiziert": "Ja",
        "Eingangsanschl\u00fcsse": "2xHDMI, DisplayPort, USB-C",
        "Einstellungen der Anzeigeposition": "H\u00f6he, Pivot (Rotation), Drehung, Neigung",
        "Energie Effizienzklasse": "Klasse G",
        "Energieklasse (HDR)": "Klasse G",
        "Enthaltene Kabel": "1 x HDMI-Kabel - 1.8 m  1 x DisplayPort-Kabel - 1.8 m  USB-C Kabel",
        "Farbunterst\u00fctzung": "16,7 Millionen Farben",
        "Ger\u00e4tetyp": "LED-hintergrundbeleuchteter LCD-Monitor - 68.6 cm (27\")",
        "Gewicht": "6.3 kg",
        "Helligkeit": "300 cd/m\u00b2",
        "Hintergrundbeleuchtungs-Technologie": "WLED",
        "Horizontaler Betrachtungswinkel": "178",
        "Integrierte Peripherieger\u00e4te": "USB 3.2 Gen 1 Hub",
        "Leistungsmerkmale": "USB 3.2 Gen 1 Hub, USB PD 65 Watt",
        "Native Aufl\u00f6sung": "QHD 2560 x 1440 bei 75 Hz",
        "Neigungswinkel": "-5/+35",
        "OSD-Sprachen": "Tschechisch, Chinesisch (tradionell), Chinesisch (vereinfacht), Englisch, Deutsch, Franz\u00f6sisch, Italienisch, Portugiesisch, Polnisch, Finnisch, Schwedisch, Russisch, Spanisch, Holl\u00e4ndisch, Japanisch, Koreanisch",
        "Pixelpitch": "0.2331 mm",
        "Ppi": "109",
        "Produktbeschreibung": "AOC Q27P2CA - LED-Monitor - QHD - 68.6 cm (27\")",
        "Reaktionszeit": "4 ms (gray-to-gray)",
        "Schlosstyp zur Diebstahlsicherung": "Kensington Slot",
        "Schnittstellen": "2 x HDMI  DisplayPort 1.2  USB-C/DisplayPort Alt Mode (bis zu 65 W)  4 x USB 3.2 Gen 1  Kopfh\u00f6rer",
        "Schwenkwinkel": "360",
        "Seitenverh\u00e4ltnis": "16:9",
        "Stromverbrauch (Aus-Modus)": "0.3 Watt",
        "Stromverbrauch (typisch)": "37 Watt",
        "Stromverbrauch HDR (eingeschaltet)": "31 kWh/1.000 h",
        "Stromverbrauch SDR (eingeschaltet)": "30 kWh/1.000 h",
        "Stromverbrauch im Standby-Modus": "0.5 Watt",
        "TCO-zertifiziert": "TCO Certified Displays 8",
        "Transportgewicht": "8.8 kg",
        "USB-Spannungsversorgung": "65 Watt",
        "Umweltschutzstandards": "TCO Certified Displays 8, ENERGY STAR-qualifiziert",
        "VESA-Halterung": "100 x 100 mm",
        "Vertikaler Betrachtungswinkel": "178"
    },
    "raw_specifications_text": "Display-Typ: LED-hintergrundbeleuchteter LCD-Monitor / TFT-Aktivmatrix\nEnergie Effizienzklasse: Klasse G\nEnergieklasse (HDR): Klasse G\nDiagonalabmessung: 68.6 cm (27\")\nIntegrierte Peripherieger\u00e4te: USB 3.2 Gen 1 Hub\nUSB-Spannungsversorgung: 65 Watt\nBildschirmtyp: IPS\nSeitenverh\u00e4ltnis: 16:9\nNative Aufl\u00f6sung: QHD 2560 x 1440 bei 75 Hz\nPixelpitch: 0.2331 mm\nPpi: 109\nHelligkeit: 300 cd/m\u00b2\nFarbunterst\u00fctzung: 16,7 Millionen Farben\nReaktionszeit: 4 ms (gray-to-gray)\nHorizontaler Betrachtungswinkel: 178\nVertikaler Betrachtungswinkel: 178\nHintergrundbeleuchtungs-Technologie: WLED\nOSD-Sprachen: Tschechisch, Chinesisch (tradionell), Chinesisch (vereinfacht), Englisch, Deutsch, Franz\u00f6sisch, Italienisch, Portugiesisch, Polnisch, Finnisch, Schwedisch, Russisch, Spanisch, Holl\u00e4ndisch, Japanisch, Koreanisch\nAbmessungen (Breite x Tiefe x H\u00f6he): 61.36 cm x 20.01 cm x 39.45 cm - mit Fu\u00df\nGewicht: 6.3 kg\nSchnittstellen: 2 x HDMI  DisplayPort 1.2  USB-C/DisplayPort Alt Mode (bis zu 65 W)  4 x USB 3.2 Gen 1  Kopfh\u00f6rer\nEinstellungen der Anzeigeposition: H\u00f6he, Pivot (Rotation), Drehung, Neigung\nNeigungswinkel: -5/+35\nSchwenkwinkel: 360\nVESA-Halterung: 100 x 100 mm\nLeistungsmerkmale: USB 3.2 Gen 1 Hub, USB PD 65 Watt\nEnthaltene Kabel: 1 x HDMI-Kabel - 1.8 m  1 x DisplayPort-Kabel - 1.8 m  USB-C Kabel\nSchlosstyp zur Diebstahlsicherung: Kensington Slot\nStromverbrauch SDR (eingeschaltet): 30 kWh/1.000 h\nStromverbrauch HDR (eingeschaltet): 31 kWh/1.000 h\nStromverbrauch (typisch): 37 Watt\nStromverbrauch im Standby-Modus: 0.5 Watt\nStromverbrauch (Aus-Modus): 0.3 Watt\nDetails zu Abmessungen & Gewicht: Mit Standfu\u00df (niedrigste Position) - Breite: 61.36 cm - Tiefe: 20.01 cm - H\u00f6he: 39.45 cm - Gewicht: 6.3 kg  Mit Standfu\u00df (h\u00f6chste Position) - Breite: 61.36 cm - Tiefe: 20.01 cm - H\u00f6he: 54.45 cm - Gewicht: 6.3 kg\nTransportgewicht: 8.8 kg\nTCO-zertifiziert: TCO Certified Displays 8\nENERGY STAR zertifiziert: Ja\nProduktbeschreibung: AOC Q27P2CA - LED-Monitor - QHD - 68.6 cm (27\")\nGer\u00e4tetyp: LED-hintergrundbeleuchteter LCD-Monitor - 68.6 cm (27\")\nEingangsanschl\u00fcsse: 2xHDMI, DisplayPort, USB-C\nAbmessungen (Breite x Tiefe x H\u00f6he) - mit Fu\u00df: 61.36 cm x 20.01 cm x 39.45 cm\nUmweltschutzstandards: TCO Certified Displays 8, ENERGY STAR-qualifiziert",
    "reference_file": "offer_reference_1258.json",
    "shop_name": "HiQ24"
}