{
    "html_file": "offer_2151_2.html",
    "name": "Eizo ColorEdge CS2731, 27\"",
    "offer_link": "https://www.ditech.at/details.php?artnr=300382",
    "price": 1027.0,
    "raw_specifications": {
        "Abmessungen (BxHxT)": "638x404x265mm (mit Standfu\u00df),  638x378x75mm (ohne Standfu\u00df)",
        "Anschl\u00fcsse - DVI": "1",
        "Anschl\u00fcsse - DisplayPort 1.2": "1",
        "Anschl\u00fcsse - HDMI 1.4": "1",
        "Anschl\u00fcsse - USB-C 3.0 mit DisplayPort 1.2 (shared)": "1",
        "Anschl\u00fcsse - USB-C 3.0 mit DisplayPort 1.2 shared": "1",
        "Anwendung": "station\u00e4r",
        "Audio": "N/A",
        "Aufl\u00f6sung": "2560x1440",
        "Beschichtung": "matt (non-glare)",
        "Besonderheiten": "USB-C Power Delivery (60W),  mechanische Tasten,  Hardware-Kalibrierung (16bit LUT),  Sicherheitsschloss (Kensington)",
        "Bildwiederholfrequenz": "60Hz",
        "Blickwinkel": "178\u00b0/178\u00b0",
        "Diagonale": "27\"/68.6cm",
        "Energieeffizienzklasse alt (A+++ bis D)": "B",
        "Energieeffizienzklasse alt (A+++ bis G)": "B",
        "Energieverbrauch SDR": "36kWh/1000h",
        "Ergonomie": "155mm (h\u00f6henverstellbar),  90\u00b0 (Pivot),  \u00b1172\u00b0 (drehbar),  +35\u00b0/-5\u00b0 (neigbar),  keine Angabe (Schr\u00e4glage)",
        "FRC": "ja (8bit+2bit)",
        "Farbe": "schwarz",
        "Farbraum - Adobe RGB": "99%",
        "Farbraum - DCI-P3": "95%",
        "Farbraum - sRGB": "100%",
        "Farbtiefe": "10bit (1.07 Mrd. Farben)",
        "Form": "gerade (flat)",
        "Gewicht": "10.10kg (mit Standfu\u00df),  6.50kg (ohne Standfu\u00df)",
        "HDR": "N/A",
        "Helligkeit": "350cd/m\u00b2",
        "Herstellergarantie": "f\u00fcnf Jahre (Vor-Ort)",
        "Hintergrundbeleuchtung": "White-LED,  flicker-free",
        "Jahresverbrauch alt (A+++ bis D)": "61.32kWh",
        "Jahresverbrauch alt (A+++ bis G)": "61.32kWh",
        "Kontrast - statisch": "1.000:1",
        "Leistungsaufnahme": "159W (maximal),  42W (typisch),  42W (Energielabel alt A+++ bis G),  1W (Standby)",
        "Panel": "IPS",
        "Reaktionszeit - GtG": "16ms",
        "Screen-to-Body-Ratio": "83.3% (berechnet)",
        "Seitenverh\u00e4ltnis": "16:9",
        "Signalfrequenz": "26-89kHz (horizontal),  23-61Hz (vertikal)",
        "Stromversorgung": "AC-In (internes Netzteil)",
        "USB-Hub In": "1x USB-C 3.0 mit DisplayPort 1.2 (shared),  1x USB-B 3.0",
        "USB-Hub Out": "2x USB-A 3.0,  2x USB-A 2.0",
        "USB-Schreibweise": "Link",
        "VESA": "100x100 (belegt)",
        "VRR (Variable Refresh Rate)": "N/A",
        "Weitere Anschl\u00fcsse": "N/A"
    },
    "raw_specifications_text": "Abmessungen (BxHxT): 638x404x265mm (mit Standfu\u00df),  638x378x75mm (ohne Standfu\u00df)\nAnschl\u00fcsse - DisplayPort 1.2: 1\nAnschl\u00fcsse - DVI: 1\nAnschl\u00fcsse - HDMI 1.4: 1\nAnschl\u00fcsse - USB-C 3.0 mit DisplayPort 1.2 (shared): 1\nAnschl\u00fcsse - USB-C 3.0 mit DisplayPort 1.2 shared: 1\nAnwendung: station\u00e4r\nAudio: N/A\nAufl\u00f6sung: 2560x1440\nBeschichtung: matt (non-glare)\nBesonderheiten: USB-C Power Delivery (60W),  mechanische Tasten,  Hardware-Kalibrierung (16bit LUT),  Sicherheitsschloss (Kensington)\nBildwiederholfrequenz: 60Hz\nBlickwinkel: 178\u00b0/178\u00b0\nDiagonale: 27\"/68.6cm\nEnergieeffizienzklasse alt (A+++ bis D): B\nEnergieeffizienzklasse alt (A+++ bis G): B\nEnergieverbrauch SDR: 36kWh/1000h\nErgonomie: 155mm (h\u00f6henverstellbar),  90\u00b0 (Pivot),  \u00b1172\u00b0 (drehbar),  +35\u00b0/-5\u00b0 (neigbar),  keine Angabe (Schr\u00e4glage)\nFarbe: schwarz\nFarbraum - Adobe RGB: 99%\nFarbraum - DCI-P3: 95%\nFarbraum - sRGB: 100%\nFarbtiefe: 10bit (1.07 Mrd. Farben)\nForm: gerade (flat)\nFRC: ja (8bit+2bit)\nGewicht: 10.10kg (mit Standfu\u00df),  6.50kg (ohne Standfu\u00df)\nHDR: N/A\nHelligkeit: 350cd/m\u00b2\nHerstellergarantie: f\u00fcnf Jahre (Vor-Ort)\nHintergrundbeleuchtung: White-LED,  flicker-free\nJahresverbrauch alt (A+++ bis D): 61.32kWh\nJahresverbrauch alt (A+++ bis G): 61.32kWh\nKontrast - statisch: 1.000:1\nLeistungsaufnahme: 159W (maximal),  42W (typisch),  42W (Energielabel alt A+++ bis G),  1W (Standby)\nPanel: IPS\nReaktionszeit - GtG: 16ms\nScreen-to-Body-Ratio: 83.3% (berechnet)\nSeitenverh\u00e4ltnis: 16:9\nSignalfrequenz: 26-89kHz (horizontal),  23-61Hz (vertikal)\nStromversorgung: AC-In (internes Netzteil)\nUSB-Hub In: 1x USB-C 3.0 mit DisplayPort 1.2 (shared),  1x USB-B 3.0\nUSB-Hub Out: 2x USB-A 3.0,  2x USB-A 2.0\nUSB-Schreibweise: Link\nVESA: 100x100 (belegt)\nVRR (Variable Refresh Rate): N/A\nWeitere Anschl\u00fcsse: N/A",
    "reference_file": "offer_reference_2151.json",
    "shop_name": "DiTech.at"
}