{
    "html_file": "offer_1208_13.html",
    "name": "Lenovo L24q-35, 23.8\"",
    "offer_link": "https://www.electronicshop24.at/product_info.php?products_id=10000001853596593&ano=BC1853596593&mno=66D1GAC1EU&ean=195713813945&utm_medium=cpc&utm_campaign=preisvergleich&utm_content=item&utm_source=geizhals&ref=geizhals",
    "price": 217.0,
    "raw_specifications": {
        "Abmessungen (Breite x Tiefe x H\u00f6he)": "53.98 cm x 16.49 cm x 42.37 cm",
        "Adaptive-Sync Technologie": "AMD FreeSync",
        "Ausgangsleistung/Kanal": "2 Watt",
        "Besonderheiten": "NearEdgeless-Design an 3 Seiten, 8-bit (6-bit + FRC) Farbtiefe",
        "Bildschirmbeschichtung": "Blendfrei",
        "Bildschirmtyp": "IPS",
        "Details zu Abmessungen & Gewicht": "Mit Fu\u00df - Breite: 53.98 cm - Tiefe: 16.49 cm - H\u00f6he: 42.37 cm - Gewicht: 3.9 kg \u00a6 Ohne Fu\u00df - Breite: 53.98 cm - Tiefe: 4.4 cm - H\u00f6he: 32.57 cm - Gewicht: 3.4 kg",
        "Diagonalabmessung": "61 cm (24\")",
        "Display-Typ": "LED-hintergrundbeleuchteter LCD-Monitor / TFT-Aktivmatrix",
        "Eingangsspannung": "Wechselstrom 100-240 V (50/60 Hz)",
        "Einstellungen der Anzeigeposition": "Neigung",
        "Energie Effizienzklasse": "Klasse F",
        "Energierverbrauch Sleep": "0.5 Watt",
        "Enthaltene Kabel": "1 x HDMI-Kabel - 1.5 m",
        "Erforderliches Betriebssystem": "Microsoft Windows 7 / 10",
        "Farbe": "Raven Black",
        "Farbraum": "99% sRGB",
        "Farbunterst\u00fctzung": "16,7 Millionen Farben",
        "Gewicht": "3.9 kg",
        "Helligkeit": "300 cd/m\u00b2",
        "Hintergrundbeleuchtungs-Technologie": "WLED",
        "Horizontaler Betrachtungswinkel": "178",
        "Kennzeichnung": "CCC, CEE Tier 1, TUV Rheinland Flicker Free Certification, TUV Rheinland Eye Comfort Certification, EU RoHS 2002/95/EC, TUV Eyesafe Display Certification, TUV Hardware Low Blue Light Certification",
        "Kontrast": "1000:1 / 3000000:1 (dynamisch)",
        "Leistungsmerkmale": "Slot f\u00fcr Sicherheitsschloss (Kabelschloss getrennt erh\u00e4ltlich), integrierte Kabelf\u00fchrung",
        "Lokalisierung": "EMEA",
        "Native Aufl\u00f6sung": "QHD 2560 x 1440 bei 75 Hz",
        "Neigungswinkel": "-5/+22",
        "Pixelpitch": "0.2058 mm",
        "Ppi": "123",
        "Reaktionszeit": "4 ms (extrem), 6 ms (normal)",
        "Schlosstyp zur Diebstahlsicherung": "Kensington Slot",
        "Schnittstellen": "HDMI \u00a6 DisplayPort 1.2 \u00a6 Kopfh\u00f6rer",
        "Seitenverh\u00e4ltnis": "16:9",
        "Service und Support": "Begrenzte Garantie - 3 Jahre",
        "Sichtbare Bildfl\u00e4che": "60.5 cm (23.8\")",
        "Stromverbrauch (Aus-Modus)": "0.3 Watt",
        "Stromverbrauch (max.)": "32 Watt",
        "Stromverbrauch (typisch)": "22 Watt",
        "Stromverbrauch SDR (eingeschaltet)": "22 kWh/1.000 h",
        "Stromverbrauch im Standby-Modus": "0.5 Watt",
        "Transportbreite": "63.9 cm",
        "Transportgewicht": "5.5 kg",
        "Transporth\u00f6he": "12.2 cm",
        "Transporttiefe": "40.5 cm",
        "Typ": "Lautsprecher - Stereo",
        "VESA-Halterung": "100 x 100 mm",
        "Vertikaler Betrachtungswinkel": "178"
    },
    "raw_specifications_text": "Display-Typ: LED-hintergrundbeleuchteter LCD-Monitor / TFT-Aktivmatrix\nEnergie Effizienzklasse: Klasse F\nDiagonalabmessung: 61 cm (24\")\nSichtbare Bildfl\u00e4che: 60.5 cm (23.8\")\nAdaptive-Sync Technologie: AMD FreeSync\nBildschirmtyp: IPS\nSeitenverh\u00e4ltnis: 16:9\nNative Aufl\u00f6sung: QHD 2560 x 1440 bei 75 Hz\nPixelpitch: 0.2058 mm\nPpi: 123\nHelligkeit: 300 cd/m\u00b2\nKontrast: 1000:1 / 3000000:1 (dynamisch)\nFarbunterst\u00fctzung: 16,7 Millionen Farben\nFarbraum: 99% sRGB\nReaktionszeit: 4 ms (extrem), 6 ms (normal)\nHorizontaler Betrachtungswinkel: 178\nVertikaler Betrachtungswinkel: 178\nBildschirmbeschichtung: Blendfrei\nHintergrundbeleuchtungs-Technologie: WLED\nBesonderheiten: NearEdgeless-Design an 3 Seiten, 8-bit (6-bit + FRC) Farbtiefe\nFarbe: Raven Black\nAbmessungen (Breite x Tiefe x H\u00f6he): 53.98 cm x 16.49 cm x 42.37 cm\nGewicht: 3.9 kg\nTyp: Lautsprecher - Stereo\nAusgangsleistung/Kanal: 2 Watt\nSchnittstellen: HDMI \u00a6 DisplayPort 1.2 \u00a6 Kopfh\u00f6rer\nEinstellungen der Anzeigeposition: Neigung\nNeigungswinkel: -5/+22\nVESA-Halterung: 100 x 100 mm\nLeistungsmerkmale: Slot f\u00fcr Sicherheitsschloss (Kabelschloss getrennt erh\u00e4ltlich), integrierte Kabelf\u00fchrung\nEnthaltene Kabel: 1 x HDMI-Kabel - 1.5 m\nKennzeichnung: CCC, CEE Tier 1, TUV Rheinland Flicker Free Certification, TUV Rheinland Eye Comfort Certification, EU RoHS 2002/95/EC, TUV Eyesafe Display Certification, TUV Hardware Low Blue Light Certification\nLokalisierung: EMEA\nSchlosstyp zur Diebstahlsicherung: Kensington Slot\nEingangsspannung: Wechselstrom 100-240 V (50/60 Hz)\nStromverbrauch SDR (eingeschaltet): 22 kWh/1.000 h\nStromverbrauch (typisch): 22 Watt\nStromverbrauch (max.): 32 Watt\nStromverbrauch im Standby-Modus: 0.5 Watt\nEnergierverbrauch Sleep: 0.5 Watt\nStromverbrauch (Aus-Modus): 0.3 Watt\nErforderliches Betriebssystem: Microsoft Windows 7 / 10\nDetails zu Abmessungen & Gewicht: Mit Fu\u00df - Breite: 53.98 cm - Tiefe: 16.49 cm - H\u00f6he: 42.37 cm - Gewicht: 3.9 kg \u00a6 Ohne Fu\u00df - Breite: 53.98 cm - Tiefe: 4.4 cm - H\u00f6he: 32.57 cm - Gewicht: 3.4 kg\nTransportbreite: 63.9 cm\nTransporttiefe: 40.5 cm\nTransporth\u00f6he: 12.2 cm\nTransportgewicht: 5.5 kg\nService und Support: Begrenzte Garantie - 3 Jahre",
    "reference_file": "offer_reference_1208.json",
    "shop_name": "ElectronicShop24"
}