{
    "html_file": "offer_672_1.html",
    "name": "Cooler Master GM238-FFS, 23.8\"",
    "offer_link": "https://www.hiq24.de/shop/artikel/325681/?sPartner=geizhals",
    "price": 187.9,
    "raw_specifications": {
        "Abmessungen (Breite x Tiefe x H\u00f6he)": "54.004 cm x 21.178 cm x 41.759 cm - with base",
        "Abmessungen (Breite x Tiefe x H\u00f6he) - with base": "54.004 cm x 21.178 cm x 41.759 cm",
        "Adaptive-Sync Technologie": "NVIDIA G-SYNC, AMD Adaptive-Sync",
        "Besonderheiten": "Overdrive-Technologie, Dynamic Contrast Ratio, Low Blue Light-Technologie, Antiflimmer",
        "Bildschirmtyp": "IPS",
        "Details zu Abmessungen & Gewicht": "Without base - Breite: 54.004 cm - Tiefe: 4.2 cm - H\u00f6he: 31.959 cm - Gewicht: 2.79 kg",
        "Diagonalabmessung": "60.5 cm (23.8\")",
        "Display-Typ": "LED-hintergrundbeleuchteter LCD-Monitor / TFT-Aktivmatrix",
        "Eingangsanschl\u00fcsse": "2xHDMI, 2xDisplayPort",
        "Einstellungen der Anzeigeposition": "Neigung",
        "Energie Effizienzklasse": "Klasse E",
        "Farbraum": "120% sRGB, 90% DCI-P3",
        "Gaming": "Ja",
        "Ger\u00e4tetyp": "LED-hintergrundbeleuchteter LCD-Monitor - 60.5 cm (23.8\")",
        "Gewicht": "3.05 kg",
        "HDR-Format": "HDR10",
        "HDR-f\u00e4hig": "HDR10",
        "Helligkeit": "250 cd/m\u00b2",
        "Hintergrundbeleuchtungs-Technologie": "LED-Hintergrundbeleuchtung",
        "Horizontaler Betrachtungswinkel": "178",
        "Kontrast": "1000:1",
        "Native Aufl\u00f6sung": "Full HD (1080p) 1920 x 1080 bei 144 Hz",
        "Neigungswinkel": "-5/+15",
        "Produktbeschreibung": "Cooler Master GM238-FFS - LED-Monitor - Full HD (1080p) - 60.5 cm (23.8\") - HDR",
        "Schnittstellen": "2 x HDMI  2 x DisplayPort",
        "Seitenverh\u00e4ltnis": "16:9",
        "Stromverbrauch SDR (eingeschaltet)": "17 kWh/1.000 h",
        "Transportbreite": "62 cm",
        "Transporth\u00f6he": "47.5 cm",
        "Transporttiefe": "11.5 cm",
        "VESA-Halterung": "100 x 100 mm",
        "Vertikaler Betrachtungswinkel": "178"
    },
    "raw_specifications_text": "Display-Typ: LED-hintergrundbeleuchteter LCD-Monitor / TFT-Aktivmatrix\nEnergie Effizienzklasse: Klasse E\nDiagonalabmessung: 60.5 cm (23.8\")\nAdaptive-Sync Technologie: NVIDIA G-SYNC, AMD Adaptive-Sync\nBildschirmtyp: IPS\nSeitenverh\u00e4ltnis: 16:9\nNative Aufl\u00f6sung: Full HD (1080p) 1920 x 1080 bei 144 Hz\nHelligkeit: 250 cd/m\u00b2\nKontrast: 1000:1\nHDR-Format: HDR10\nFarbraum: 120% sRGB, 90% DCI-P3\nGaming: Ja\nHorizontaler Betrachtungswinkel: 178\nVertikaler Betrachtungswinkel: 178\nHintergrundbeleuchtungs-Technologie: LED-Hintergrundbeleuchtung\nBesonderheiten: Overdrive-Technologie, Dynamic Contrast Ratio, Low Blue Light-Technologie, Antiflimmer\nAbmessungen (Breite x Tiefe x H\u00f6he): 54.004 cm x 21.178 cm x 41.759 cm - with base\nGewicht: 3.05 kg\nSchnittstellen: 2 x HDMI  2 x DisplayPort\nEinstellungen der Anzeigeposition: Neigung\nNeigungswinkel: -5/+15\nVESA-Halterung: 100 x 100 mm\nStromverbrauch SDR (eingeschaltet): 17 kWh/1.000 h\nDetails zu Abmessungen & Gewicht: Without base - Breite: 54.004 cm - Tiefe: 4.2 cm - H\u00f6he: 31.959 cm - Gewicht: 2.79 kg\nTransportbreite: 62 cm\nTransporttiefe: 11.5 cm\nTransporth\u00f6he: 47.5 cm\nProduktbeschreibung: Cooler Master GM238-FFS - LED-Monitor - Full HD (1080p) - 60.5 cm (23.8\") - HDR\nGer\u00e4tetyp: LED-hintergrundbeleuchteter LCD-Monitor - 60.5 cm (23.8\")\nHDR-f\u00e4hig: HDR10\nEingangsanschl\u00fcsse: 2xHDMI, 2xDisplayPort\nAbmessungen (Breite x Tiefe x H\u00f6he) - with base: 54.004 cm x 21.178 cm x 41.759 cm",
    "reference_file": "offer_reference_672.json",
    "shop_name": "HiQ24"
}