{
    "html_file": "offer_1756_3.html",
    "name": "NEC MultiSync E243F-WH wei\u00df, 23.8\"",
    "offer_link": "https://www.mylemon.at/artikel/nec/60005204/multisync-e242n-black-60-96cm.html",
    "price": 297.17,
    "raw_specifications": {
        "Anzahl DisplayPort Anschl\u00fcsse": "1",
        "Anzahl HDMI-Anschl\u00fcsse": "1",
        "Anzahl der Farben des Displays": "16,7 Millionen Farben",
        "Anzahl der Lautsprecher": "2",
        "Anzahl der nachgeschalteten Ports vom Typ USB-C": "1",
        "Anzahl der nachgeschalteten Steckpl\u00e4tze vom Typ USB-A": "3",
        "Anzahl der vorgeschalteten Steckpl\u00e4tze": "1",
        "Artikelnummer": "M14Y8L3L",
        "Aufl\u00f6sung": "1920x1080",
        "Besonderheiten": "Lautsprecher",
        "Betriebstemperatur": "5 - 35 \u00b0C",
        "Bildschirmdiagonale": "61 cm (24 Zoll)",
        "Bildschirmdiagonale (cm)": "60 cm",
        "Bildschirmform": "Flach",
        "Bildschirmtechnologie": "LED",
        "Bildwinkel, horizontal": "178\u00b0",
        "Bildwinkel, vertikal": "178\u00b0",
        "Digital horizontale Frequenz": "31,5 - 83 kHz",
        "Digital vertikale Frequenz": "50 - 75 Hz",
        "Display-Aufl\u00f6sung": "1920 x 1080 Pixel",
        "Displaygr\u00f6\u00dfe": "23,8 Zoll",
        "EAN": "5028695119819",
        "Eingebaute Lautsprecher": "Ja",
        "Energieeffizienzklasse (SDR)": "E",
        "Energieeffizienzskala": "A bis G",
        "Energieverbrauch (SDR) pro 1.000 Stunden": "18 kWh",
        "Ergonomie": "H\u00f6henverstellbar, Pivot (90 Grad drehbar), Schwenkbar, Neigbar",
        "Flimmerfreie Technologie": "Ja",
        "Ger\u00e4tebreite (inkl. Fu\u00df)": "538,1 mm",
        "Ger\u00e4teh\u00f6he (inkl. Fu\u00df)": "332,6 mm",
        "Ger\u00e4tetiefe (inkl. Fu\u00df)": "190 mm",
        "Gewicht (mit St\u00e4nder)": "5 kg",
        "HD-Typ": "Full HD",
        "HDMI": "Ja",
        "Helligkeit": "250 cd/m\u00b2",
        "Helligkeit (typisch)": "250 cd/m\u00b2",
        "Hersteller Artikelnummer": "60005204",
        "H\u00f6heneinstellung": "13 cm",
        "H\u00f6henverstellung": "Ja",
        "Integrierter USB-Hub": "Ja",
        "Kabelsperre-Slot": "Ja",
        "Kontrastverh\u00e4ltnis": "1000:1",
        "Kopfh\u00f6rerausgang": "Ja",
        "Low-Blue-Light-Technologie": "Ja",
        "Luftfeuchtigkeit bei Lagerung": "10 - 85%",
        "Marktpositionierung": "Haus",
        "Maximale Bildwiederholrate": "60 Hz",
        "Mitgelieferte Kabel": "AC, DisplayPort, USB Typ-C",
        "Nachhaltigkeitszertifikate": "ENERGY STAR, RoHS, TCO",
        "Natives Seitenverh\u00e4ltnis": "16:9",
        "Neigungsverstellung": "Ja",
        "Neigungswinkelbereich": "-5 - 25\u00b0",
        "Panel": "IPS",
        "Panel-Montage-Schnittstelle": "100 x 100 mm",
        "Panel-Typ": "TFT/IPS",
        "Pivot": "Ja",
        "Pivot Winkel": "-90 - 90\u00b0",
        "Pixel Abstand": "0,275 x 0,275 mm",
        "Produktfarbe": "Schwarz",
        "RMS-Leistung": "2 W",
        "Rahmenbreite (Seite)": "1 mm",
        "Rahmenbreite (oben)": "1 mm",
        "Rahmenbreite (unten)": "1 mm",
        "Reaktionszeit": "6 ms",
        "Relative Luftfeuchtigkeit in Betrieb": "20 - 80%",
        "Schnellstart\u00fcbersicht": "Ja",
        "Schwenkbar": "Ja",
        "Schwenkwinkelbereich": "-170 - 170\u00b0",
        "Slot-Typ Kabelsperre": "Kensington",
        "Stromverbrauch (PowerSave)": "0,4 W",
        "Stromverbrauch (Standardbetrieb)": "18 W",
        "Stromverbrauch (max.)": "20 W",
        "Temperaturbereich bei Lagerung": "-10 - 60 \u00b0C",
        "Touchscreen": "Nein",
        "Typ der Hintergrundbeleuchtung": "W-LED",
        "USB-Hub-Version": "3.2 Gen 1 (3.1 Gen 1)",
        "VESA Halterung": "100x100 mm",
        "VESA-Halterung": "Ja",
        "Video Anschl\u00fcsse": "1x HDMI, 1x DisplayPort, 3x USB, USB-C DisplayPort",
        "Warentarifnummer (HS)": "85285210"
    },
    "raw_specifications_text": "Displaygr\u00f6\u00dfe: 23,8 Zoll\nAufl\u00f6sung: 1920x1080\nPanel: IPS\nReaktionszeit: 6 ms\nVideo Anschl\u00fcsse: 1x HDMI, 1x DisplayPort, 3x USB, USB-C DisplayPort\nErgonomie: H\u00f6henverstellbar, Pivot (90 Grad drehbar), Schwenkbar, Neigbar\nVESA Halterung: 100x100 mm\nHelligkeit: 250 cd/m\u00b2\nBesonderheiten: Lautsprecher\nHersteller Artikelnummer: 60005204\nEAN: 5028695119819\nArtikelnummer: M14Y8L3L\nBildschirmdiagonale: 61 cm (24 Zoll)\nDisplay-Aufl\u00f6sung: 1920 x 1080 Pixel\nNatives Seitenverh\u00e4ltnis: 16:9\nBildschirmtechnologie: LED\nTouchscreen: Nein\nHD-Typ: Full HD\nPanel-Typ: TFT/IPS\nBildschirmform: Flach\nKontrastverh\u00e4ltnis: 1000:1\nMaximale Bildwiederholrate: 60 Hz\nAnzahl der Farben des Displays: 16,7 Millionen Farben\nTyp der Hintergrundbeleuchtung: W-LED\nHelligkeit (typisch): 250 cd/m\u00b2\nBildwinkel, horizontal: 178\u00b0\nBildwinkel, vertikal: 178\u00b0\nPixel Abstand: 0,275 x 0,275 mm\nDigital horizontale Frequenz: 31,5 - 83 kHz\nDigital vertikale Frequenz: 50 - 75 Hz\nBildschirmdiagonale (cm): 60 cm\nFlimmerfreie Technologie: Ja\nLow-Blue-Light-Technologie: Ja\nEingebaute Lautsprecher: Ja\nAnzahl der Lautsprecher: 2\nRMS-Leistung: 2 W\nMarktpositionierung: Haus\nProduktfarbe: Schwarz\nIntegrierter USB-Hub: Ja\nHDMI: Ja\nKopfh\u00f6rerausgang: Ja\nUSB-Hub-Version: 3.2 Gen 1 (3.1 Gen 1)\nAnzahl der vorgeschalteten Steckpl\u00e4tze: 1\nAnzahl der nachgeschalteten Steckpl\u00e4tze vom Typ USB-A: 3\nAnzahl der nachgeschalteten Ports vom Typ USB-C: 1\nAnzahl HDMI-Anschl\u00fcsse: 1\nAnzahl DisplayPort Anschl\u00fcsse: 1\nVESA-Halterung: Ja\nKabelsperre-Slot: Ja\nH\u00f6henverstellung: Ja\nPanel-Montage-Schnittstelle: 100 x 100 mm\nSlot-Typ Kabelsperre: Kensington\nH\u00f6heneinstellung: 13 cm\nPivot: Ja\nPivot Winkel: -90 - 90\u00b0\nSchwenkbar: Ja\nSchwenkwinkelbereich: -170 - 170\u00b0\nNeigungswinkelbereich: -5 - 25\u00b0\nNeigungsverstellung: Ja\nEnergieeffizienzklasse (SDR): E\nEnergieverbrauch (SDR) pro 1.000 Stunden: 18 kWh\nStromverbrauch (Standardbetrieb): 18 W\nStromverbrauch (max.): 20 W\nStromverbrauch (PowerSave): 0,4 W\nEnergieeffizienzskala: A bis G\nBetriebstemperatur: 5 - 35 \u00b0C\nTemperaturbereich bei Lagerung: -10 - 60 \u00b0C\nRelative Luftfeuchtigkeit in Betrieb: 20 - 80%\nLuftfeuchtigkeit bei Lagerung: 10 - 85%\nMitgelieferte Kabel: AC, DisplayPort, USB Typ-C\nSchnellstart\u00fcbersicht: Ja\nGer\u00e4tebreite (inkl. Fu\u00df): 538,1 mm\nGer\u00e4tetiefe (inkl. Fu\u00df): 190 mm\nGer\u00e4teh\u00f6he (inkl. Fu\u00df): 332,6 mm\nGewicht (mit St\u00e4nder): 5 kg\nRahmenbreite (Seite): 1 mm\nRahmenbreite (oben): 1 mm\nRahmenbreite (unten): 1 mm\nNachhaltigkeitszertifikate: ENERGY STAR, RoHS, TCO\nWarentarifnummer (HS): 85285210",
    "reference_file": "offer_reference_1756.json",
    "shop_name": "mylemon.at"
}