{
    "html_file": "offer_1399_0.html",
    "name": "HP M24fw, 23.8\"",
    "offer_link": "https://direkt.jacob.de/produkte/hp-m24fw-2d9k1aa-abb-artnr-7283312.html?utm_source=geizhals&utm_medium=cpc&utm_campaign=Preisvergleich&ref=103",
    "price": 130.93,
    "raw_specifications": {
        "AC Eingangsfrequenz": "50/60 Hz",
        "AC Eingangsspannung": "100 - 240 V",
        "AMD FreeSync": "Ja",
        "Anzahl HDMI-Anschl\u00fcsse": "1",
        "Anzahl VGA (D-Sub) Anschl\u00fcsse": "1",
        "Audioanschl\u00fcsse": "Nein",
        "Bildschirmaufl\u00f6sung": "1920 x 1080 Pixel",
        "Bildschirmdiagonale": "60,5 cm (23.8\" )",
        "Bildschirmdiagonale (cm)": "60,45 cm",
        "Bildschirmform": "Flach",
        "Bildschirmtechnologie": "LED",
        "Blendfreier Bildschirm": "Ja",
        "Blickwinkel, horizontal": "178\u00b0",
        "Blickwinkel, vertikal": "178\u00b0",
        "Breite (ohne Standfu\u00df)": "53,6 cm",
        "Eingebaute Lautsprecher": "Nein",
        "Energieeffizienzklasse (HDR)": "E",
        "Energieeffizienzklasse (SDR)": "E",
        "Energieverbrauch (HDR) pro 1.000 Stunden": "15 kWh",
        "Energieverbrauch (SDR) pro 1.000 Stunden": "15 kWh",
        "Flimmerfreie Technologie": "Ja",
        "Ger\u00e4tebreite (inkl. Fu\u00df)": "535,8 mm",
        "Ger\u00e4teh\u00f6he (inkl. Fu\u00df)": "396,8 mm",
        "Ger\u00e4tetiefe (inkl. Fu\u00df)": "177,2 mm",
        "Gewicht (mit St\u00e4nder)": "2,5 kg",
        "HD-Typ": "Full HD",
        "HDMI": "Ja",
        "HDMI-Version": "1.4",
        "Helligkeit (typisch)": "300 cd/m\u00b2",
        "Horizontaler Scanbereich": "30 - 86 kHz",
        "H\u00f6he (ohne Standfu\u00df)": "31,6 cm",
        "H\u00f6henverstellung": "Nein",
        "Integrierte Kamera": "Nein",
        "Integrierter USB-Hub": "Nein",
        "Kabelsperre-Slot": "Ja",
        "Kontrastverh\u00e4ltnis": "1000:1",
        "Kontrastverh\u00e4ltnis (dynamisch)": "10000000:1",
        "Kopfh\u00f6rerausgang": "Nein",
        "Low-Blue-Light-Technologie": "Ja",
        "Marktpositionierung": "Haus",
        "Maximale Bildwiederholrate": "75 Hz",
        "NVIDIA G-SYNC": "Nein",
        "Natives Seitenverh\u00e4ltnis": "16:9",
        "Neigungswinkelbereich": "5 - 25\u00b0",
        "Oberfl\u00e4chenh\u00e4rte": "3H",
        "Paketgewicht": "4,7 kg",
        "Panel-Typ": "IPS",
        "Pixel Abstand": "0,275 x 0,275 mm",
        "Produktfarbe": "Silber",
        "RGB-Farbraum": "sRGB",
        "Reaktionszeit": "5 ms",
        "Relative Luftfeuchtigkeit in Betrieb": "20 - 80%",
        "Schwenkbar": "Nein",
        "Sichtbare Gr\u00f6\u00dfe (horizontal)": "52,7 cm",
        "Sichtbare Gr\u00f6\u00dfe (vertikal)": "29,6 cm",
        "Stromverbrauch (Standardbetrieb)": "20 W",
        "Stromverbrauch (Standby)": "0,5 W",
        "Temperaturbereich in Betrieb": "5 - 35 \u00b0C",
        "Tiefe (ohne Standfu\u00df)": "3,4 cm",
        "Typ der Hintergrundbeleuchtung": "Seiten-LED",
        "Unterst\u00fctzte Grafik-Aufl\u00f6sungen": "640 x 480 (VGA),720 x 400,800 x 600 (SVGA),1024 x 768 (XGA),1280 x 1024 (SXGA),1280 x 720 (HD 720),1280 x 800 (WXGA),1440 x 900 (WXGA+),1600 x 900,1680 x 1050 (WSXGA+),1920 x 1080 (HD 1080)",
        "VESA-Halterung": "Nein",
        "Verpackungsbreite": "610 mm",
        "Verpackungsh\u00f6he": "399 mm",
        "Verpackungstiefe": "121 mm",
        "Vertikaler Scanbereich": "48 - 75 Hz",
        "Zertifizierung": "IS; BSMI; CB; CCC; CE; CECP; CELL",
        "sRGB Abdeckung (klassisch)": "99%"
    },
    "raw_specifications_text": "Bildschirmdiagonale: 60,5 cm (23.8\" )\nBildschirmaufl\u00f6sung: 1920 x 1080 Pixel\nNatives Seitenverh\u00e4ltnis: 16:9\nPanel-Typ: IPS\nHD-Typ: Full HD\nBildschirmtechnologie: LED\nBildschirmform: Flach\nKontrastverh\u00e4ltnis: 1000:1\nMaximale Bildwiederholrate: 75 Hz\nHelligkeit (typisch): 300 cd/m\u00b2\nReaktionszeit: 5 ms\nTyp der Hintergrundbeleuchtung: Seiten-LED\nBlendfreier Bildschirm: Ja\nUnterst\u00fctzte Grafik-Aufl\u00f6sungen: 640 x 480 (VGA),720 x 400,800 x 600 (SVGA),1024 x 768 (XGA),1280 x 1024 (SXGA),1280 x 720 (HD 720),1280 x 800 (WXGA),1440 x 900 (WXGA+),1600 x 900,1680 x 1050 (WSXGA+),1920 x 1080 (HD 1080)\nKontrastverh\u00e4ltnis (dynamisch): 10000000:1\nBlickwinkel, horizontal: 178\u00b0\nBlickwinkel, vertikal: 178\u00b0\nPixel Abstand: 0,275 x 0,275 mm\nHorizontaler Scanbereich: 30 - 86 kHz\nVertikaler Scanbereich: 48 - 75 Hz\nSichtbare Gr\u00f6\u00dfe (horizontal): 52,7 cm\nSichtbare Gr\u00f6\u00dfe (vertikal): 29,6 cm\nBildschirmdiagonale (cm): 60,45 cm\nOberfl\u00e4chenh\u00e4rte: 3H\nRGB-Farbraum: sRGB\nsRGB Abdeckung (klassisch): 99%\nNVIDIA G-SYNC: Nein\nAMD FreeSync: Ja\nFlimmerfreie Technologie: Ja\nLow-Blue-Light-Technologie: Ja\nEingebaute Lautsprecher: Nein\nIntegrierte Kamera: Nein\nMarktpositionierung: Haus\nProduktfarbe: Silber\nZertifizierung: IS; BSMI; CB; CCC; CE; CECP; CELL\nIntegrierter USB-Hub: Nein\nHDMI: Ja\nKopfh\u00f6rerausgang: Nein\nAnzahl VGA (D-Sub) Anschl\u00fcsse: 1\nAnzahl HDMI-Anschl\u00fcsse: 1\nHDMI-Version: 1.4\nAudioanschl\u00fcsse: Nein\nVESA-Halterung: Nein\nKabelsperre-Slot: Ja\nH\u00f6henverstellung: Nein\nSchwenkbar: Nein\nNeigungswinkelbereich: 5 - 25\u00b0\nEnergieeffizienzklasse (SDR): E\nEnergieeffizienzklasse (HDR): E\nEnergieverbrauch (SDR) pro 1.000 Stunden: 15 kWh\nEnergieverbrauch (HDR) pro 1.000 Stunden: 15 kWh\nStromverbrauch (Standardbetrieb): 20 W\nStromverbrauch (Standby): 0,5 W\nAC Eingangsspannung: 100 - 240 V\nAC Eingangsfrequenz: 50/60 Hz\nTemperaturbereich in Betrieb: 5 - 35 \u00b0C\nRelative Luftfeuchtigkeit in Betrieb: 20 - 80%\nGer\u00e4tebreite (inkl. Fu\u00df): 535,8 mm\nGer\u00e4tetiefe (inkl. Fu\u00df): 177,2 mm\nGer\u00e4teh\u00f6he (inkl. Fu\u00df): 396,8 mm\nGewicht (mit St\u00e4nder): 2,5 kg\nBreite (ohne Standfu\u00df): 53,6 cm\nTiefe (ohne Standfu\u00df): 3,4 cm\nH\u00f6he (ohne Standfu\u00df): 31,6 cm\nVerpackungsbreite: 610 mm\nVerpackungstiefe: 121 mm\nVerpackungsh\u00f6he: 399 mm\nPaketgewicht: 4,7 kg",
    "reference_file": "offer_reference_1399.json",
    "shop_name": "Jacob Elektronik direkt (AT)"
}