{
    "html_file": "offer_1397_6.html",
    "name": "ASUS ZenScreen MB16ACV, 15.6\"",
    "offer_link": "https://www.proshop.at/Bildschirm/ASUS-15-Bildschirm-ZenScreen-MB16ACV-USB-C-Black-5-ms/2942454?utm_source=geizhals&utm_medium=cpc&utm_campaign=pricesite",
    "price": 204.55,
    "raw_specifications": {
        "Abmessungen (Breite x Tiefe x H\u00f6he)": "35.79 cm x 1.05 cm x 22.48 cm",
        "Besonderheiten": "Trace Free Technology, ASUS Smart Contrast Ratio (ASCR), ASUS QuickFit Virtual Scale, ASUS GamePlus, Low Blue Light Mode, flimmerfreie Technologie, ASUS BacGuard, Display Widget",
        "Bildschirmbeschichtung": "Blendfrei, antibakteriell",
        "Bildschirmtyp": "IPS",
        "Diagonalabmessung": "39.6 cm (15.6\")",
        "Display-Typ": "LED-hintergrundbeleuchteter LCD-Monitor / TFT-Aktivmatrix",
        "EAN": "4718017949040",
        "Eingangsanschl\u00fcsse": "USB-C",
        "Eingangsspannung": "DC 5 V",
        "Energie Effizienzklasse": "Klasse B",
        "Farbunterst\u00fctzung": "260.000 Farben",
        "Ger\u00e4tetyp": "LED-hintergrundbeleuchteter LCD-Monitor - 39.6 cm (15.6\")",
        "Gewicht": "830 g",
        "Helligkeit": "250 cd/m\u00b2",
        "Hersteller": "ASUS",
        "Hintergrundbeleuchtungs-Technologie": "LED-Hintergrundbeleuchtung",
        "Horizontale Bildwiederholrate": "31 - 75 kHz",
        "Horizontaler Betrachtungswinkel": "178",
        "Kennzeichnung": "TUV Rheinland Low Blue Light Certification, TUV Rheinland Flicker Free Certification",
        "Kontrast": "800:1 / 100000000:1 (dynamisch)",
        "Leistungsaufnahme im Ein-Zustand": "13 W",
        "Leistungsmerkmale": "Auf Stativ montierbar, integrierter Standfu\u00df",
        "Modell": "90LM0381-B01370",
        "Native Aufl\u00f6sung": "Full HD (1080p) 1920 x 1080 bei 60 Hz",
        "Pixelpitch": "0.179 mm",
        "Produktbeschreibung": "ASUS ZenScreen MB16ACV - LED-Monitor - Full HD (1080p) - 39.6 cm (15.6\")",
        "Reaktionszeit": "5 ms (Gray-to-Gray)",
        "Schnittstellen": "USB-C",
        "Seitenverh\u00e4ltnis": "16:9",
        "Spannung": "DC 5 V",
        "Stromverbrauch (Aus-Modus)": "0.3 Watt",
        "Stromverbrauch (typisch)": "15 Watt",
        "Stromverbrauch SDR (eingeschaltet)": "6 kWh/1.000 h",
        "Stromverbrauch im Standby-Modus": "0.5 Watt",
        "Vertikale Bildwiederholrate": "60 Hz",
        "Vertikaler Betrachtungswinkel": "178",
        "Waren-Nr.": "2942454",
        "Zum Hersteller": "www.asus.com/index.aspx"
    },
    "raw_specifications_text": "Hersteller: ASUS\nWaren-Nr.: 2942454\nModell: 90LM0381-B01370\nEAN: 4718017949040\nZum Hersteller: www.asus.com/index.aspx\nProduktbeschreibung: ASUS ZenScreen MB16ACV - LED-Monitor - Full HD (1080p) - 39.6 cm (15.6\")\nGer\u00e4tetyp: LED-hintergrundbeleuchteter LCD-Monitor - 39.6 cm (15.6\")\nEnergie Effizienzklasse: Klasse B\nLeistungsaufnahme im Ein-Zustand: 13 W\nBildschirmtyp: IPS\nSeitenverh\u00e4ltnis: 16:9\nNative Aufl\u00f6sung: Full HD (1080p) 1920 x 1080 bei 60 Hz\nPixelpitch: 0.179 mm\nHelligkeit: 250 cd/m\u00b2\nKontrast: 800:1 / 100000000:1 (dynamisch)\nReaktionszeit: 5 ms (Gray-to-Gray)\nFarbunterst\u00fctzung: 260.000 Farben\nEingangsanschl\u00fcsse: USB-C\nBildschirmbeschichtung: Blendfrei, antibakteriell\nSpannung: DC 5 V\nAbmessungen (Breite x Tiefe x H\u00f6he): 35.79 cm x 1.05 cm x 22.48 cm\nGewicht: 830 g\nKennzeichnung: TUV Rheinland Low Blue Light Certification, TUV Rheinland Flicker Free Certification\nDisplay-Typ: LED-hintergrundbeleuchteter LCD-Monitor / TFT-Aktivmatrix\nDiagonalabmessung: 39.6 cm (15.6\")\nVertikale Bildwiederholrate: 60 Hz\nHorizontale Bildwiederholrate: 31 - 75 kHz\nHorizontaler Betrachtungswinkel: 178\nVertikaler Betrachtungswinkel: 178\nHintergrundbeleuchtungs-Technologie: LED-Hintergrundbeleuchtung\nBesonderheiten: Trace Free Technology, ASUS Smart Contrast Ratio (ASCR), ASUS QuickFit Virtual Scale, ASUS GamePlus, Low Blue Light Mode, flimmerfreie Technologie, ASUS BacGuard, Display Widget\nSchnittstellen: USB-C\nLeistungsmerkmale: Auf Stativ montierbar, integrierter Standfu\u00df\nEingangsspannung: DC 5 V\nStromverbrauch SDR (eingeschaltet): 6 kWh/1.000 h\nStromverbrauch (typisch): 15 Watt\nStromverbrauch im Standby-Modus: 0.5 Watt\nStromverbrauch (Aus-Modus): 0.3 Watt",
    "reference_file": "offer_reference_1397.json",
    "shop_name": "Proshop.at"
}