{
    "html_file": "offer_2259_28.html",
    "name": "Lenovo ThinkVision T23d-10, 22.5\"",
    "offer_link": "https://technikladen.at/P-Lenovo-ThinkVision-T23d-571-cm-225-Zoll-1920-x-1200-Pixel-WUXGA-LED-6-ms-Schwarz?tl=gzhls",
    "price": 193.3,
    "raw_specifications": {
        "3D": "Nein",
        "AC-Netzadapter": "Ja",
        "Abnehmbarer Standfu\u00df": "Ja",
        "Anzahl DisplayPort Anschl\u00fcsse": "1",
        "Anzahl HDMI-Anschl\u00fcsse": "1",
        "Anzahl OSD-Sprachen": "8",
        "Anzahl VGA (D-Sub) Anschl\u00fcsse": "1",
        "Bezel Weite (side)": "2,3 mm",
        "Bildschirmaufl\u00f6sung": "1920 x 1200 Pixel",
        "Bildschirmdiagonale": "57,1 cm",
        "Bildschirmform": "Flach",
        "Bildschirmtechnologie": "LED",
        "Bildwinkel, horizontal": "178 \u00b0",
        "Bildwinkel, vertikal": "178 \u00b0",
        "Bluetooth": "Nein",
        "DVI Anschluss": "Nein",
        "DisplayPort Kabell\u00e4nge": "1,8 m",
        "Ein-/Ausschalter": "Ja",
        "Eingebaute Lautsprecher": "Nein",
        "Eingebauter Ethernet-Anschluss": "Nein",
        "Energieeffizienzklasse (SDR)": "D",
        "Energieeffizienzskala": "A bis G",
        "Energieverbrauch (SDR) pro 1.000 Stunden": "14 kWh",
        "Farbskala": "72 %",
        "Ger\u00e4tebreite (inkl. Fu\u00df)": "501,2 mm",
        "Ger\u00e4teh\u00f6he (inkl. Fu\u00df)": "491,9 mm",
        "Ger\u00e4tetiefe (inkl. Fu\u00df)": "251,9 mm",
        "Gewicht (mit St\u00e4nder)": "4,85 kg",
        "Gleichstrom-Anschluss (DC)": "Ja",
        "HD-Typ": "WUXGA",
        "HDMI-Kabell\u00e4nge": "1,8 m",
        "Helligkeit (typisch)": "250 cd/m\u00b2",
        "H\u00f6heneinstellung": "11 cm",
        "H\u00f6henverstellung": "Ja",
        "Integrierte Kamera": "Nein",
        "Integrierter USB-Hub": "Nein",
        "Kabelsperre-Slot": "Ja",
        "Kontrastverh\u00e4ltnis": "1000:1",
        "LED-Anzeigen": "Ja",
        "Nachhaltigkeitszertifikate": "RoHS, EPEAT Gold, ENERGY STAR",
        "Natives Seitenverh\u00e4ltnis": "16:10",
        "Neigungswinkelbereich": "-5 - 30 \u00b0",
        "On-Screen-Display (OSD)": "Ja",
        "Panel-Montage-Schnittstelle": "100 x 100 mm",
        "Panel-Typ": "TFT/IPS",
        "Pivot": "Ja",
        "Pivot Winkel": "0 - 90 \u00b0",
        "Pixel Abstand": "0,25 x 0,25 mm",
        "Plug & Play": "Ja",
        "Produktfarbe": "Schwarz",
        "Quantum-Dot-Farbtechnologie": "Ja",
        "Reaktionszeit": "6 ms",
        "Schwenkbar": "Ja",
        "Schwenkwinkelbereich": "-45 - 45 \u00b0",
        "Sichtbare Gr\u00f6\u00dfe (horizontal)": "49,6 cm",
        "Sichtbare Gr\u00f6\u00dfe (vertikal)": "31,4 cm",
        "Slot-Typ Kabelsperre": "Kensington",
        "Stromkabell\u00e4nge": "1,8 m",
        "Stromverbrauch (Standardbetrieb)": "15 W",
        "Stromverbrauch (Standby)": "0,3 W",
        "Stromverbrauch (max.)": "18 W",
        "St\u00e4nder enthalten": "Ja",
        "TV Tuner integriert": "Nein",
        "Unterst\u00fctzte Grafik-Aufl\u00f6sungen": "640 x 480 (VGA),720 x 400,800 x 600 (SVGA),1024 x 768 (XGA),1280 x 1024 (SXGA),1360 x 768 (WXGA),1440 x 900 (WXGA+),1680 x 1050 (WSXGA+),1920 x 1080 (HD 1080),1920 x 1200 (WUXGA)",
        "VESA-Halterung": "Ja",
        "VGA-Kabell\u00e4nge": "1,8 m",
        "Verpackungsart": "Box",
        "WLAN": "Nein",
        "Zertifizierung": "TCO 7.0, DDC2B/CI, ISO 9241-307, FCC Class B, TCO Certified Edge 2.0, WEEE",
        "kippbar": "Ja"
    },
    "raw_specifications_text": "Bildschirmdiagonale: 57,1 cm\nBildschirmaufl\u00f6sung: 1920 x 1200 Pixel\nNatives Seitenverh\u00e4ltnis: 16:10\nPanel-Typ: TFT/IPS\nHelligkeit (typisch): 250 cd/m\u00b2\nReaktionszeit: 6 ms\nHD-Typ: WUXGA\nBildschirmtechnologie: LED\nBildschirmform: Flach\nUnterst\u00fctzte Grafik-Aufl\u00f6sungen: 640 x 480 (VGA),720 x 400,800 x 600 (SVGA),1024 x 768 (XGA),1280 x 1024 (SXGA),1360 x 768 (WXGA),1440 x 900 (WXGA+),1680 x 1050 (WSXGA+),1920 x 1080 (HD 1080),1920 x 1200 (WUXGA)\nKontrastverh\u00e4ltnis: 1000:1\nBildwinkel, horizontal: 178 \u00b0\nBildwinkel, vertikal: 178 \u00b0\n3D: Nein\nPixel Abstand: 0,25 x 0,25 mm\nSichtbare Gr\u00f6\u00dfe (horizontal): 49,6 cm\nSichtbare Gr\u00f6\u00dfe (vertikal): 31,4 cm\nQuantum-Dot-Farbtechnologie: Ja\nFarbskala: 72 %\nIntegrierter USB-Hub: Nein\nAnzahl VGA (D-Sub) Anschl\u00fcsse: 1\nDVI Anschluss: Nein\nAnzahl HDMI-Anschl\u00fcsse: 1\nAnzahl DisplayPort Anschl\u00fcsse: 1\nGleichstrom-Anschluss (DC): Ja\nVESA-Halterung: Ja\nPanel-Montage-Schnittstelle: 100 x 100 mm\nKabelsperre-Slot: Ja\nSlot-Typ Kabelsperre: Kensington\nH\u00f6henverstellung: Ja\nH\u00f6heneinstellung: 11 cm\nPivot: Ja\nPivot Winkel: 0 - 90 \u00b0\nSchwenkbar: Ja\nSchwenkwinkelbereich: -45 - 45 \u00b0\nkippbar: Ja\nNeigungswinkelbereich: -5 - 30 \u00b0\nOn-Screen-Display (OSD): Ja\nAnzahl OSD-Sprachen: 8\nPlug & Play: Ja\nLED-Anzeigen: Ja\nEingebaute Lautsprecher: Nein\nIntegrierte Kamera: Nein\nProduktfarbe: Schwarz\nAbnehmbarer Standfu\u00df: Ja\nZertifizierung: TCO 7.0, DDC2B/CI, ISO 9241-307, FCC Class B, TCO Certified Edge 2.0, WEEE\nSt\u00e4nder enthalten: Ja\nDisplayPort Kabell\u00e4nge: 1,8 m\nHDMI-Kabell\u00e4nge: 1,8 m\nVGA-Kabell\u00e4nge: 1,8 m\nVerpackungsart: Box\nAC-Netzadapter: Ja\nStromkabell\u00e4nge: 1,8 m\nEin-/Ausschalter: Ja\nTV Tuner integriert: Nein\nEingebauter Ethernet-Anschluss: Nein\nEnergieeffizienzklasse (SDR): D\nEnergieverbrauch (SDR) pro 1.000 Stunden: 14 kWh\nStromverbrauch (Standardbetrieb): 15 W\nStromverbrauch (Standby): 0,3 W\nStromverbrauch (max.): 18 W\nEnergieeffizienzskala: A bis G\nWLAN: Nein\nBluetooth: Nein\nGer\u00e4tebreite (inkl. Fu\u00df): 501,2 mm\nGer\u00e4tetiefe (inkl. Fu\u00df): 251,9 mm\nGer\u00e4teh\u00f6he (inkl. Fu\u00df): 491,9 mm\nGewicht (mit St\u00e4nder): 4,85 kg\nBezel Weite (side): 2,3 mm\nNachhaltigkeitszertifikate: RoHS, EPEAT Gold, ENERGY STAR",
    "reference_file": "offer_reference_2259.json",
    "shop_name": "TechnikLaden"
}