{
    "html_file": "offer_405_16.html",
    "name": "Philips S-line 273S1, 27\"",
    "offer_link": "https://click.cptrack.de/?rd=true&k=H2jZOPSoNfIohcnyCFLwAwqzX3eQZkYX44I26OZb1lfNFdWalBJFVW6kuFcOAKCuGy_yTbYED5SeNM2e6jUszA~~&rdlink=https%3A%2F%2Fwww.cyberport.at%2F%3FDEEP%3D6108-1JZ%26APID%3D66",
    "price": 193.0,
    "raw_specifications": {
        "Abtastfrequenz": "30 bis 85 kHz (H)/48 bis 75 Hz (V)",
        "Art der Hintergrundbeleuchtung": "W-LED-System",
        "Aufl\u00f6sung": "1.920x1.080 Full HD",
        "Betrachtungswinkel": "178 \u00ba (H)/178 \u00ba (V) bei C/R > 10",
        "Betrachtungswinkel h/v": "178\u00b0/178\u00b0",
        "Bildformat": "16:9",
        "Bildoptimierung": "SmartImage",
        "Bildschirmbeschichtung": "Blendfrei, 3 H, Glanzschleier 25 %",
        "Breite in mm": "613mm",
        "DVI": "kein",
        "Display-Farben": "16,7 Mio",
        "Displaygr\u00f6\u00dfe in Zoll": "27 Zoll",
        "Displaygr\u00f6\u00dfe in cm": "68,6 cm",
        "Displayport": "1x DP",
        "Drehteller": "-/+ 180 Grad",
        "Effektive Bildfl\u00e4che": "597,888 (H) x 336,312 (V)",
        "Farbraumabdeckung": "102% sRGB",
        "Farbspektrum (Standard)": "NTSC 81 %*, sRGB 102 %*",
        "Farbtiefe": "8 Bit / 16,7 Mio Farben",
        "Gewicht in kg": "6,1 kg",
        "Gr\u00f6\u00dfe des Displays": "68,6 cm (27\")",
        "HDCP": "HDCP 1.4 (DVI/DP/HDMI)",
        "HDMI": "1x HDMI",
        "Helligkeit": "250 cd/m\u00b2",
        "H\u00f6he in mm": "537mm",
        "H\u00f6heneinstellung": "130 mm",
        "H\u00f6henverstellbar": "130mm",
        "Kontrast dynamisch": "50.000.000:1",
        "Kontrast typisch": "1.000:1",
        "Kontrastverh\u00e4ltnis (normal)": "1.000:1",
        "Lautsprecher": "2x",
        "Leistung": "2W",
        "Leistungsaufnahme": "21 Watt",
        "Maximale Aufl\u00f6sung": "1.920 x 1.080 bei 75 Hz*",
        "Neigung": "-5~25 Grad",
        "Oberfl\u00e4che": "matt",
        "Pivot": "-/+ 90 Grad",
        "Pixelabstand": "0,3114 x 0,3114 mm",
        "Pixeldichte": "82 PPI",
        "Reaktionszeit": "4 ms",
        "Reaktionszeit (normal)": "4 ms (Grau zu Grau)*",
        "SmartContrast": "50.000.000:1",
        "Technologie": "IPS",
        "Tiefe in mm": "205mm",
        "USB": "1 x USB-B (Upstream), 4 x USB 3.2 (Downstream mit 1 x Schnellaufladungs-BC 1.2)",
        "USB-C": "1x",
        "Wandmontage": "VESA100x100"
    },
    "raw_specifications_text": "Leistungsaufnahme: 21 Watt\nDisplaygr\u00f6\u00dfe in cm: 68,6 cm\nDisplaygr\u00f6\u00dfe in Zoll: 27 Zoll\nTechnologie: IPS\nAufl\u00f6sung: 1.920x1.080 Full HD\nBildformat: 16:9\nOberfl\u00e4che: matt\nFarbraumabdeckung: 102% sRGB\nFarbtiefe: 8 Bit / 16,7 Mio Farben\nHelligkeit: 250 cd/m\u00b2\nKontrast typisch: 1.000:1\nKontrast dynamisch: 50.000.000:1\nReaktionszeit: 4 ms\nBetrachtungswinkel h/v: 178\u00b0/178\u00b0\nArt der Hintergrundbeleuchtung: W-LED-System\nGr\u00f6\u00dfe des Displays: 68,6 cm (27\")\nBildschirmbeschichtung: Blendfrei, 3 H, Glanzschleier 25 %\nEffektive Bildfl\u00e4che: 597,888 (H) x 336,312 (V)\nMaximale Aufl\u00f6sung: 1.920 x 1.080 bei 75 Hz*\nPixeldichte: 82 PPI\nReaktionszeit (normal): 4 ms (Grau zu Grau)*\nKontrastverh\u00e4ltnis (normal): 1.000:1\nSmartContrast: 50.000.000:1\nPixelabstand: 0,3114 x 0,3114 mm\nBetrachtungswinkel: 178 \u00ba (H)/178 \u00ba (V) bei C/R > 10\nBildoptimierung: SmartImage\nFarbspektrum (Standard): NTSC 81 %*, sRGB 102 %*\nDisplay-Farben: 16,7 Mio\nAbtastfrequenz: 30 bis 85 kHz (H)/48 bis 75 Hz (V)\nHDMI: 1x HDMI\nDVI: kein\nDisplayport: 1x DP\nUSB-C: 1x\nHDCP: HDCP 1.4 (DVI/DP/HDMI)\nUSB: 1 x USB-B (Upstream), 4 x USB 3.2 (Downstream mit 1 x Schnellaufladungs-BC 1.2)\nLautsprecher: 2x\nLeistung: 2W\nH\u00f6henverstellbar: 130mm\nWandmontage: VESA100x100\nH\u00f6heneinstellung: 130 mm\nPivot: -/+ 90 Grad\nDrehteller: -/+ 180 Grad\nNeigung: -5~25 Grad\nBreite in mm: 613mm\nH\u00f6he in mm: 537mm\nTiefe in mm: 205mm\nGewicht in kg: 6,1 kg",
    "reference_file": "offer_reference_405.json",
    "shop_name": "Cyberport.at"
}