{
    "html_file": "offer_318_1.html",
    "name": "LG 24MP450P-B, 23.8\"",
    "offer_link": "https://www.mylemon.at/artikel/lg/24mp450p_b/lcd-monitor-24mp450p-b-23.html",
    "price": 120.47,
    "raw_specifications": {
        "AC Eingangsspannung": "240 V",
        "AMD FreeSync": "Ja",
        "AMD FreeSync-Typ": "FreeSync",
        "Abnehmbarer Standfu\u00df": "Ja",
        "Anzahl HDMI-Anschl\u00fcsse": "1",
        "Anzahl VGA (D-Sub) Anschl\u00fcsse": "1",
        "Anzahl der Farben des Displays": "16,7 Millionen Farben",
        "Artikelnummer": "M1IYZPVL",
        "Aufl\u00f6sung": "1920x1080",
        "Beleuchteter St\u00e4nder": "Nein",
        "Bildschirmdiagonale": "60,5 cm (23.8\")",
        "Bildschirmdiagonale (cm)": "60 cm",
        "Bildschirmform": "Flach",
        "Bildschirmtechnologie": "LED",
        "Bildwinkel, horizontal": "178\u00b0",
        "Bildwinkel, vertikal": "178\u00b0",
        "Blendfreier Bildschirm": "Ja",
        "Breite (ohne Standfu\u00df)": "539,9 mm",
        "Display-Aufl\u00f6sung": "1920 x 1080 Pixel",
        "Displaygr\u00f6\u00dfe": "23,8 Zoll",
        "EAN": "8806091970817",
        "Eingebaute Lautsprecher": "Nein",
        "Eingebautes Mikrofon": "Nein",
        "Energieeffizienzklasse (HDR)": "Nicht verf\u00fcgbar",
        "Energieeffizienzklasse (SDR)": "E",
        "Energieeffizienzskala": "A bis G",
        "Energieverbrauch (SDR) pro 1.000 Stunden": "18 kWh",
        "Farbskala": "72%",
        "Farbtiefe": "8 Bit",
        "Flimmerfreie Technologie": "Ja",
        "Fu\u00dffarbe": "Schwarz",
        "Ger\u00e4tebreite (inkl. Fu\u00df)": "539,9 mm",
        "Ger\u00e4teh\u00f6he (inkl. Fu\u00df)": "447,6 mm",
        "Ger\u00e4tetiefe (inkl. Fu\u00df)": "219,4 mm",
        "Gewicht (mit St\u00e4nder)": "3,1 kg",
        "Gewicht (ohne St\u00e4nder)": "2,3 kg",
        "HD-Typ": "Full HD",
        "HDCP": "Ja",
        "HDCP-Version": "1.4",
        "HDMI": "Ja",
        "HDMI-Kabell\u00e4nge": "1,5 m",
        "HDMI-Version": "1.4",
        "Hersteller Artikelnummer": "24MP450P-B",
        "H\u00f6he (ohne Standfu\u00df)": "321,4 mm",
        "H\u00f6heneinstellung": "8 cm",
        "H\u00f6henverstellung": "Ja",
        "Integrierte Kamera": "Nein",
        "Kontrastverh\u00e4ltnis": "1000:1",
        "Kontrastverh\u00e4ltnis (dynamisch)": "5000000:1",
        "Kopfh\u00f6rerausgang": "Ja",
        "Kopfh\u00f6rerausg\u00e4nge": "1",
        "Markenspezifische Technologien": "Black Equalizer, Crosshair",
        "Marktpositionierung": "Business",
        "Mitgelieferte Kabel": "HDMI, Leistung",
        "NTSC Abdeckung (typisch)": "72%",
        "Natives Seitenverh\u00e4ltnis": "16:9",
        "Neigungswinkelbereich": "-5 - 15\u00b0",
        "Netzteil Ausgangsspannung": "19 V",
        "Netzteiltyp": "Extern",
        "Paketgewicht": "4,5 kg",
        "Panel": "IPS",
        "Panel-Typ": "IPS",
        "Pixel Abstand": "0,27 x 0,27 mm",
        "Produktfarbe": "Schwarz",
        "RGB-Farbraum": "NTSC",
        "Reaktionszeit": "5 ms",
        "Smart-Modi": "Kino, Spiel, Foto",
        "St\u00e4nder enthalten": "Ja",
        "Tiefe (ohne Standfu\u00df)": "56,2 mm",
        "Touchscreen": "Nein",
        "VESA Halterung": "75x75 mm",
        "Verpackungsart": "Box",
        "Verpackungsbreite": "615 mm",
        "Verpackungsh\u00f6he": "404 mm",
        "Verpackungstiefe": "175 mm",
        "Video Anschl\u00fcsse": "1x VGA, 1x HDMI, 1x DisplayPort",
        "Vorderer Rahmen": "Schwarz"
    },
    "raw_specifications_text": "Displaygr\u00f6\u00dfe: 23,8 Zoll\nAufl\u00f6sung: 1920x1080\nPanel: IPS\nVideo Anschl\u00fcsse: 1x VGA, 1x HDMI, 1x DisplayPort\nVESA Halterung: 75x75 mm\nHersteller Artikelnummer: 24MP450P-B\nEAN: 8806091970817\nArtikelnummer: M1IYZPVL\nBildschirmdiagonale: 60,5 cm (23.8\")\nDisplay-Aufl\u00f6sung: 1920 x 1080 Pixel\nNatives Seitenverh\u00e4ltnis: 16:9\nBildschirmtechnologie: LED\nTouchscreen: Nein\nHD-Typ: Full HD\nPanel-Typ: IPS\nBildschirmform: Flach\nKontrastverh\u00e4ltnis: 1000:1\nAnzahl der Farben des Displays: 16,7 Millionen Farben\nReaktionszeit: 5 ms\nBlendfreier Bildschirm: Ja\nKontrastverh\u00e4ltnis (dynamisch): 5000000:1\nBildwinkel, horizontal: 178\u00b0\nBildwinkel, vertikal: 178\u00b0\nPixel Abstand: 0,27 x 0,27 mm\nBildschirmdiagonale (cm): 60 cm\nFarbtiefe: 8 Bit\nRGB-Farbraum: NTSC\nFarbskala: 72%\nNTSC Abdeckung (typisch): 72%\nAMD FreeSync: Ja\nAMD FreeSync-Typ: FreeSync\nMarkenspezifische Technologien: Black Equalizer, Crosshair\nFlimmerfreie Technologie: Ja\nSmart-Modi: Kino, Spiel, Foto\nEingebaute Lautsprecher: Nein\nIntegrierte Kamera: Nein\nEingebautes Mikrofon: Nein\nMarktpositionierung: Business\nProduktfarbe: Schwarz\nVorderer Rahmen: Schwarz\nAbnehmbarer Standfu\u00df: Ja\nBeleuchteter St\u00e4nder: Nein\nFu\u00dffarbe: Schwarz\nHDMI: Ja\nKopfh\u00f6rerausgang: Ja\nAnzahl VGA (D-Sub) Anschl\u00fcsse: 1\nAnzahl HDMI-Anschl\u00fcsse: 1\nHDMI-Version: 1.4\nKopfh\u00f6rerausg\u00e4nge: 1\nHDCP: Ja\nHDCP-Version: 1.4\nH\u00f6henverstellung: Ja\nH\u00f6heneinstellung: 8 cm\nNeigungswinkelbereich: -5 - 15\u00b0\nEnergieeffizienzklasse (SDR): E\nEnergieeffizienzklasse (HDR): Nicht verf\u00fcgbar\nEnergieverbrauch (SDR) pro 1.000 Stunden: 18 kWh\nAC Eingangsspannung: 240 V\nNetzteil Ausgangsspannung: 19 V\nNetzteiltyp: Extern\nEnergieeffizienzskala: A bis G\nSt\u00e4nder enthalten: Ja\nMitgelieferte Kabel: HDMI, Leistung\nHDMI-Kabell\u00e4nge: 1,5 m\nGer\u00e4tebreite (inkl. Fu\u00df): 539,9 mm\nGer\u00e4tetiefe (inkl. Fu\u00df): 219,4 mm\nGer\u00e4teh\u00f6he (inkl. Fu\u00df): 447,6 mm\nGewicht (mit St\u00e4nder): 3,1 kg\nBreite (ohne Standfu\u00df): 539,9 mm\nTiefe (ohne Standfu\u00df): 56,2 mm\nH\u00f6he (ohne Standfu\u00df): 321,4 mm\nGewicht (ohne St\u00e4nder): 2,3 kg\nVerpackungsbreite: 615 mm\nVerpackungstiefe: 175 mm\nVerpackungsh\u00f6he: 404 mm\nPaketgewicht: 4,5 kg\nVerpackungsart: Box",
    "reference_file": "offer_reference_318.json",
    "shop_name": "mylemon.at"
}