{
    "html_file": "offer_630_7.html",
    "name": "AG neovo LA-27, 27\"",
    "offer_link": "https://www.electronicshop24.at/product_info.php?products_id=20000000817683765&ano=I817683765&mno=LA27A011E0100&ean=4710739595758&utm_medium=cpc&utm_campaign=preisvergleich&utm_content=item&utm_source=geizhals&ref=geizhals",
    "price": 324.0,
    "raw_specifications": {
        "Abmessungen (Breite x Tiefe x H\u00f6he)": "61.2 cm x 22.6 cm x 45.2 cm - mit Fu\u00df",
        "Ausgangsleistung/Kanal": "2 Watt",
        "Besonderheiten": "Flimmerfreie Technologie, Augenkomfort-Modus, Bluelight Filter",
        "Bildschirmbeschichtung": "3H Hard Coating, entspiegelt (25 %)",
        "Bildschirmtyp": "VA",
        "Details zu Abmessungen & Gewicht": "Mit Fu\u00df - Breite: 61.2 cm - Tiefe: 22.6 cm - H\u00f6he: 45.2 cm - Gewicht: 4.3 kg \u00a6 Ohne Fu\u00df - Breite: 61.2 cm - Tiefe: 4.6 cm - H\u00f6he: 36.5 cm - Gewicht: 3.8 kg",
        "Diagonalabmessung": "68.6 cm (27\")",
        "Display-Typ": "LED-hintergrundbeleuchteter LCD-Monitor / TFT-Aktivmatrix",
        "Eingangsspannung": "AC 100 - 240 V (50/60 Hz)",
        "Einstellungen der Anzeigeposition": "Neigung",
        "Energie Effizienzklasse": "Klasse E",
        "Enthaltene Kabel": "1 x VGA-Kabel \u00a6 1 x Audiokabel",
        "Farbunterst\u00fctzung": "16,7 Millionen Farben",
        "Gewicht": "4.3 kg",
        "Helligkeit": "280 cd/m\u00b2",
        "Hintergrundbeleuchtungs-Technologie": "LED-Hintergrundbeleuchtung",
        "Horizontale Bildwiederholrate": "30 - 83 kHz",
        "Horizontaler Betrachtungswinkel": "178",
        "Kennzeichnung": "VESA FPMPMI, CCC, RoHS, WEEE, REACH, LVD, CEL",
        "Kontrast": "20000000:1 (dynamisch)",
        "Leistungsaufnahme im Ein-Zustand": "17.3 W",
        "Leistungsmerkmale": "Slot f\u00fcr Sicherheitsschloss (Kabelschloss getrennt erh\u00e4ltlich), Unterst\u00fctzung f\u00fcr VESA-Schnittstelle",
        "Max. Betriebstemperatur": "35 \u00b0C",
        "Min Betriebstemperatur": "5 \u00b0C",
        "Native Aufl\u00f6sung": "Full HD (1080p) 1920 x 1080",
        "Neigungswinkel": "-5/+20",
        "Pixelpitch": "0.314 mm",
        "Reaktionszeit": "5 ms",
        "Schlosstyp zur Diebstahlsicherung": "Kensington Slot",
        "Schnittstellen": "VGA (HD-15) \u00a6 HDMI \u00a6 DisplayPort \u00a6 Audio Line-In \u00a6 Audio Line-Out",
        "Seitenverh\u00e4ltnis": "16:9",
        "Stromverbrauch (Aus-Modus)": "0.5 Watt",
        "Stromverbrauch (typisch)": "25 Watt",
        "Stromverbrauch SDR (eingeschaltet)": "17.3 kWh/1.000 h",
        "Stromverbrauch im Standby-Modus": "0.5 Watt",
        "Transportbreite": "67.8 cm",
        "Transportgewicht": "5.9 kg",
        "Transporth\u00f6he": "54.5 cm",
        "Transporttiefe": "13.4 cm",
        "Typ": "Lautsprecher - Stereo",
        "VESA-Halterung": "100 x 100 mm",
        "Vertikale Bildwiederholrate": "56 - 75 Hz",
        "Vertikaler Betrachtungswinkel": "178",
        "Zul\u00e4ssige Luftfeuchtigkeit im Betrieb": "20 - 85% (nicht kondensierend)"
    },
    "raw_specifications_text": "Display-Typ: LED-hintergrundbeleuchteter LCD-Monitor / TFT-Aktivmatrix\nEnergie Effizienzklasse: Klasse E\nDiagonalabmessung: 68.6 cm (27\")\nBildschirmtyp: VA\nSeitenverh\u00e4ltnis: 16:9\nNative Aufl\u00f6sung: Full HD (1080p) 1920 x 1080\nPixelpitch: 0.314 mm\nHelligkeit: 280 cd/m\u00b2\nKontrast: 20000000:1 (dynamisch)\nFarbunterst\u00fctzung: 16,7 Millionen Farben\nReaktionszeit: 5 ms\nVertikale Bildwiederholrate: 56 - 75 Hz\nHorizontale Bildwiederholrate: 30 - 83 kHz\nHorizontaler Betrachtungswinkel: 178\nVertikaler Betrachtungswinkel: 178\nBildschirmbeschichtung: 3H Hard Coating, entspiegelt (25 %)\nHintergrundbeleuchtungs-Technologie: LED-Hintergrundbeleuchtung\nBesonderheiten: Flimmerfreie Technologie, Augenkomfort-Modus, Bluelight Filter\nAbmessungen (Breite x Tiefe x H\u00f6he): 61.2 cm x 22.6 cm x 45.2 cm - mit Fu\u00df\nGewicht: 4.3 kg\nTyp: Lautsprecher - Stereo\nAusgangsleistung/Kanal: 2 Watt\nSchnittstellen: VGA (HD-15) \u00a6 HDMI \u00a6 DisplayPort \u00a6 Audio Line-In \u00a6 Audio Line-Out\nEinstellungen der Anzeigeposition: Neigung\nNeigungswinkel: -5/+20\nVESA-Halterung: 100 x 100 mm\nLeistungsmerkmale: Slot f\u00fcr Sicherheitsschloss (Kabelschloss getrennt erh\u00e4ltlich), Unterst\u00fctzung f\u00fcr VESA-Schnittstelle\nEnthaltene Kabel: 1 x VGA-Kabel \u00a6 1 x Audiokabel\nKennzeichnung: VESA FPMPMI, CCC, RoHS, WEEE, REACH, LVD, CEL\nSchlosstyp zur Diebstahlsicherung: Kensington Slot\nEingangsspannung: AC 100 - 240 V (50/60 Hz)\nLeistungsaufnahme im Ein-Zustand: 17.3 W\nStromverbrauch SDR (eingeschaltet): 17.3 kWh/1.000 h\nStromverbrauch (typisch): 25 Watt\nStromverbrauch im Standby-Modus: 0.5 Watt\nStromverbrauch (Aus-Modus): 0.5 Watt\nDetails zu Abmessungen & Gewicht: Mit Fu\u00df - Breite: 61.2 cm - Tiefe: 22.6 cm - H\u00f6he: 45.2 cm - Gewicht: 4.3 kg \u00a6 Ohne Fu\u00df - Breite: 61.2 cm - Tiefe: 4.6 cm - H\u00f6he: 36.5 cm - Gewicht: 3.8 kg\nTransportbreite: 67.8 cm\nTransporttiefe: 13.4 cm\nTransporth\u00f6he: 54.5 cm\nTransportgewicht: 5.9 kg\nMin Betriebstemperatur: 5 \u00b0C\nMax. Betriebstemperatur: 35 \u00b0C\nZul\u00e4ssige Luftfeuchtigkeit im Betrieb: 20 - 85% (nicht kondensierend)",
    "reference_file": "offer_reference_630.json",
    "shop_name": "ElectronicShop24"
}