{
    "html_file": "offer_1529_6.html",
    "name": "ViewSonic VP2468a, 23.8\"",
    "offer_link": "https://www.amazon.de/dp/B08L9XCTGP?linkCode=xm2&camp=2025&creative=165953&smid=A3JWKAKR8XB7XF&creativeASIN=B08L9XCTGP&tag=geizhals1-21",
    "price": 357.48,
    "raw_specifications": {
        "ASIN": "B08L9XCTGP",
        "Amazon Bestseller-Rang": "Nr. 31,979 in Computer & Zubeh\u00f6r (Siehe Top 100 in Computer & Zubeh\u00f6r)  Nr. 683 in Monitore",
        "Antriebsart": "\u200eHandbetrieben",
        "Anzahl HDMI Schnittstellen": "\u200e1",
        "Artikelgewicht": "\u200e5,67 Kilograms",
        "Batterien enthalten": "\u200eNein",
        "Display-Gr\u00f6\u00dfe": "\u200e24 Zoll",
        "Durchschnittliche Kundenbewertung": "4,5  4,5 von 5 Sternen    \n    1.321 Sternebewertungen   \n\n\n 4,5 von 5 Sternen",
        "Farbe": "\u200eschwarz",
        "Garantierte Software-Updates bis": "\u200eunbekannt",
        "Gewicht Lithium-Akku": "\u200e32 Kilogramm",
        "Hersteller": "\u200eViewsonic",
        "Im Angebot von Amazon.de seit": "4. November 2020",
        "L\u00f6sung": "\u200e1920 x 1080 Pixels",
        "Marke": "\u200eViewSonic",
        "Modell/Serie": "\u200eVS16475",
        "Modellnummer": "\u200eVP2468A",
        "Produktabmessungen": "\u200e21,59 x 53,85 x 42,16 cm; 5,67 Kilogramm",
        "Volt": "\u200e12 Volt"
    },
    "raw_specifications_text": "Marke: \u200eViewSonic\nHersteller: \u200eViewsonic\nModell/Serie: \u200eVS16475\nProduktabmessungen: \u200e21,59 x 53,85 x 42,16 cm; 5,67 Kilogramm\nModellnummer: \u200eVP2468A\nFarbe: \u200eschwarz\nDisplay-Gr\u00f6\u00dfe: \u200e24 Zoll\nL\u00f6sung: \u200e1920 x 1080 Pixels\nAnzahl HDMI Schnittstellen: \u200e1\nVolt: \u200e12 Volt\nAntriebsart: \u200eHandbetrieben\nBatterien enthalten: \u200eNein\nGewicht Lithium-Akku: \u200e32 Kilogramm\nArtikelgewicht: \u200e5,67 Kilograms\nGarantierte Software-Updates bis: \u200eunbekannt\nASIN: B08L9XCTGP\nDurchschnittliche Kundenbewertung: 4,5  4,5 von 5 Sternen    \n    1.321 Sternebewertungen   \n\n\n 4,5 von 5 Sternen\nAmazon Bestseller-Rang: Nr. 31,979 in Computer & Zubeh\u00f6r (Siehe Top 100 in Computer & Zubeh\u00f6r)  Nr. 683 in Monitore\nIm Angebot von Amazon.de seit: 4. November 2020",
    "reference_file": "offer_reference_1529.json",
    "shop_name": "Amazon.at"
}