{
    "html_file": "offer_729_23.html",
    "name": "iiyama ProLite XUB2793QS-B1, 27\"",
    "offer_link": "https://www.ditech.at/details.php?artnr=358941",
    "price": 225.9,
    "raw_specifications": {
        "AMD FreeSync": "Ja",
        "Adaptive Sync": "Ja",
        "Anschl\u00fcsse - DisplayPort 75Hz@2560x1440": "1",
        "Anschl\u00fcsse - HDMI 75Hz@2560x1440": "2",
        "Anwendung": "station\u00e4r",
        "Audio": "Lautsprecher (2x 2W),  1x Line-Out",
        "Aufl\u00f6sung": "2560x1440",
        "Beschichtung": "matt (non-glare)",
        "Besonderheiten": "Slim Bezel,  mechanische Tasten,  Sicherheitsschloss (Kensington)",
        "Bildwiederholfrequenz": "75Hz",
        "Blickwinkel": "178\u00b0/178\u00b0",
        "Diagonale": "27\"/68.6cm",
        "Energieverbrauch SDR": "25kWh/1000h",
        "Ergonomie": "150mm (h\u00f6henverstellbar),  90\u00b0 (Pivot),  \u00b145\u00b0 (drehbar),  +23\u00b0/-5\u00b0 (neigbar),  keine Angabe (Schr\u00e4glage)",
        "FRC": "ja (8bit+2bit)",
        "Farbe": "schwarz",
        "Farbraum - sRGB": "96%",
        "Farbtiefe": "10bit (1.07 Mrd. Farben)",
        "Form": "gerade (flat)",
        "Gewicht": "6.20kg (mit Standfu\u00df),  keine Angabe (ohne Standfu\u00df)",
        "HDR": "N/A",
        "Helligkeit": "300cd/m\u00b2",
        "Herstellergarantie": "drei Jahre (Abwicklung \u00fcber Hersteller,  Produktregistrierung innerhalb von 60 Tagen nach dem Kauf: Link,  Garantie-Informationen: Link)",
        "Hintergrundbeleuchtung": "White-LED,  flicker-free,  Blaulichtfilter",
        "Kontrast - dynamisch": "80.000.000:1",
        "Kontrast - statisch": "1.000:1",
        "Lautsprecher": "Ja",
        "Leistungsaufnahme": "keine Angabe (maximal),  25W (typisch),  keine Angabe (Energielabel alt A+++ bis G),  0.5W (Standby)",
        "Panel": "IPS",
        "Reaktionszeit - MPRT": "1ms",
        "Screen-to-Body-Ratio": "89.9% (berechnet)",
        "Seitenverh\u00e4ltnis": "16:9",
        "Signalfrequenz": "30-120kHz (horizontal),  48-76Hz (vertikal)",
        "Stromversorgung": "AC-In (internes Netzteil)",
        "USB-Hub In": "N/A",
        "USB-Hub Out": "N/A",
        "USB-Schreibweise": "Link",
        "VESA": "100x100 (belegt)",
        "Weitere Anschl\u00fcsse": "N/A"
    },
    "raw_specifications_text": "Adaptive Sync: Ja\nAMD FreeSync: Ja\nAnschl\u00fcsse - DisplayPort 75Hz@2560x1440: 1\nAnschl\u00fcsse - HDMI 75Hz@2560x1440: 2\nAnwendung: station\u00e4r\nAudio: Lautsprecher (2x 2W),  1x Line-Out\nAufl\u00f6sung: 2560x1440\nBeschichtung: matt (non-glare)\nBesonderheiten: Slim Bezel,  mechanische Tasten,  Sicherheitsschloss (Kensington)\nBildwiederholfrequenz: 75Hz\nBlickwinkel: 178\u00b0/178\u00b0\nDiagonale: 27\"/68.6cm\nEnergieverbrauch SDR: 25kWh/1000h\nErgonomie: 150mm (h\u00f6henverstellbar),  90\u00b0 (Pivot),  \u00b145\u00b0 (drehbar),  +23\u00b0/-5\u00b0 (neigbar),  keine Angabe (Schr\u00e4glage)\nFarbe: schwarz\nFarbraum - sRGB: 96%\nFarbtiefe: 10bit (1.07 Mrd. Farben)\nForm: gerade (flat)\nFRC: ja (8bit+2bit)\nGewicht: 6.20kg (mit Standfu\u00df),  keine Angabe (ohne Standfu\u00df)\nHDR: N/A\nHelligkeit: 300cd/m\u00b2\nHerstellergarantie: drei Jahre (Abwicklung \u00fcber Hersteller,  Produktregistrierung innerhalb von 60 Tagen nach dem Kauf: Link,  Garantie-Informationen: Link)\nHintergrundbeleuchtung: White-LED,  flicker-free,  Blaulichtfilter\nKontrast - dynamisch: 80.000.000:1\nKontrast - statisch: 1.000:1\nLautsprecher: Ja\nLeistungsaufnahme: keine Angabe (maximal),  25W (typisch),  keine Angabe (Energielabel alt A+++ bis G),  0.5W (Standby)\nPanel: IPS\nReaktionszeit - MPRT: 1ms\nScreen-to-Body-Ratio: 89.9% (berechnet)\nSeitenverh\u00e4ltnis: 16:9\nSignalfrequenz: 30-120kHz (horizontal),  48-76Hz (vertikal)\nStromversorgung: AC-In (internes Netzteil)\nUSB-Hub In: N/A\nUSB-Hub Out: N/A\nUSB-Schreibweise: Link\nVESA: 100x100 (belegt)\nWeitere Anschl\u00fcsse: N/A",
    "reference_file": "offer_reference_729.json",
    "shop_name": "DiTech.at"
}