{
    "html_file": "offer_15_14.html",
    "name": "Acer Vero V7 V277Ebipv, 27\"",
    "offer_link": "https://www.ditech.at/details.php?artnr=374803",
    "price": 155.9,
    "raw_specifications": {
        "AMD FreeSync": "Ja",
        "Abmessungen - Breite": "614mm",
        "Abmessungen - H\u00f6he": "455mm",
        "Abmessungen - Tiefe": "225 (mit standfu\u00df),  keine angabe (ohne standfu\u00df)mm",
        "Adaptive Sync": "Ja",
        "Anschl\u00fcsse - DisplayPort 1.2 100Hz@1920x1080": "1",
        "Anschl\u00fcsse - HDMI 1.4 100Hz@1920x1080": "1",
        "Anschl\u00fcsse - VGA 75Hz@1920x1080": "1",
        "Anwendung": "station\u00e4r",
        "Audio": "N/A",
        "Aufl\u00f6sung": "1920x1080",
        "Beschichtung": "matt (non-glare)",
        "Besonderheiten": "Slim Bezel,  EPEAT Silver,  mechanische Tasten mit Steuerkreuz,  Sicherheitsschloss (Kensington)",
        "Bildwiederholfrequenz": "100Hz",
        "Blickwinkel": "178\u00b0/178\u00b0",
        "Diagonale": "27\"/68.6cm",
        "Energieverbrauch SDR": "21kWh/1000h",
        "Ergonomie": "N/A (h\u00f6henverstellbar),  N/A (Pivot),  N/A (drehbar),  +25\u00b0/-5\u00b0 (neigbar),  keine Angabe (Schr\u00e4glage)",
        "FRC": "unbekannt",
        "Farbe": "schwarz",
        "Farbraum - sRGB": "99%",
        "Farbtiefe": "8bit (16.7 Mio. Farben)",
        "Form": "gerade (flat)",
        "Gewicht": "5.60kg (mit Standfu\u00df),  4.79kg (ohne Standfu\u00df)",
        "HDR": "N/A",
        "Helligkeit": "250cd/m\u00b2",
        "Herstellergarantie": "drei Jahre (Bring-In)",
        "Hintergrundbeleuchtung": "Blue-LED,  flicker-free,  Blaulichtfilter",
        "Kontrast - dynamisch": "100.000.000:1",
        "Kontrast - statisch": "1.000:1",
        "Leistungsaufnahme": "keine Angabe (maximal),  keien Angabe (typisch),  keine Angabe (Energielabel alt A+++ bis G),  0.5W (Standby)",
        "Panel": "IPS",
        "Reaktionszeit - GtG": "4ms",
        "Screen-to-Body-Ratio": "keine Angabe (berechnet)",
        "Seitenverh\u00e4ltnis": "16:9",
        "Signalfrequenz": "30-85kHz (horizontal),  48-100Hz (vertikal)",
        "Stromversorgung": "AC-In (internes Netzteil)",
        "USB-Hub In": "N/A",
        "USB-Hub Out": "N/A",
        "USB-Schreibweise": "Link",
        "VESA": "100x100 (frei)",
        "Weitere Anschl\u00fcsse": "N/A"
    },
    "raw_specifications_text": "Abmessungen - Breite: 614mm\nAbmessungen - H\u00f6he: 455mm\nAbmessungen - Tiefe: 225 (mit standfu\u00df),  keine angabe (ohne standfu\u00df)mm\nAdaptive Sync: Ja\nAMD FreeSync: Ja\nAnschl\u00fcsse - DisplayPort 1.2 100Hz@1920x1080: 1\nAnschl\u00fcsse - HDMI 1.4 100Hz@1920x1080: 1\nAnschl\u00fcsse - VGA 75Hz@1920x1080: 1\nAnwendung: station\u00e4r\nAudio: N/A\nAufl\u00f6sung: 1920x1080\nBeschichtung: matt (non-glare)\nBesonderheiten: Slim Bezel,  EPEAT Silver,  mechanische Tasten mit Steuerkreuz,  Sicherheitsschloss (Kensington)\nBildwiederholfrequenz: 100Hz\nBlickwinkel: 178\u00b0/178\u00b0\nDiagonale: 27\"/68.6cm\nEnergieverbrauch SDR: 21kWh/1000h\nErgonomie: N/A (h\u00f6henverstellbar),  N/A (Pivot),  N/A (drehbar),  +25\u00b0/-5\u00b0 (neigbar),  keine Angabe (Schr\u00e4glage)\nFarbe: schwarz\nFarbraum - sRGB: 99%\nFarbtiefe: 8bit (16.7 Mio. Farben)\nForm: gerade (flat)\nFRC: unbekannt\nGewicht: 5.60kg (mit Standfu\u00df),  4.79kg (ohne Standfu\u00df)\nHDR: N/A\nHelligkeit: 250cd/m\u00b2\nHerstellergarantie: drei Jahre (Bring-In)\nHintergrundbeleuchtung: Blue-LED,  flicker-free,  Blaulichtfilter\nKontrast - dynamisch: 100.000.000:1\nKontrast - statisch: 1.000:1\nLeistungsaufnahme: keine Angabe (maximal),  keien Angabe (typisch),  keine Angabe (Energielabel alt A+++ bis G),  0.5W (Standby)\nPanel: IPS\nReaktionszeit - GtG: 4ms\nScreen-to-Body-Ratio: keine Angabe (berechnet)\nSeitenverh\u00e4ltnis: 16:9\nSignalfrequenz: 30-85kHz (horizontal),  48-100Hz (vertikal)\nStromversorgung: AC-In (internes Netzteil)\nUSB-Hub In: N/A\nUSB-Hub Out: N/A\nUSB-Schreibweise: Link\nVESA: 100x100 (frei)\nWeitere Anschl\u00fcsse: N/A",
    "reference_file": "offer_reference_15.json",
    "shop_name": "DiTech.at"
}