{
    "html_file": "offer_1321_4.html",
    "name": "iiyama G-Master GB2766HSU-B1 Red Eagle, 27\"",
    "offer_link": "https://www.csv-direct.de/artinfo.php?artnr=A1621375&KATEGORIE=162&pva=geizhals2",
    "price": 199.89,
    "raw_specifications": {
        "AC Eingangsfrequenz": "50 - 60 Hz",
        "AC Eingangsspannung": "100 - 240 V",
        "AMD FreeSync Bildwiederholratenbereich": "48 - 165 Hz",
        "AMD FreeSync-Typ": "FreeSync Premium",
        "Anzahl DisplayPort Anschl\u00fcsse": "1",
        "Anzahl HDMI-Anschl\u00fcsse": "2",
        "Anzahl OSD-Sprachen": "10",
        "Anzahl der Farben des Displays": "16,7 Millionen Farben",
        "Anzahl der Lautsprecher": "2",
        "Anzahl der nachgeschalteten Steckpl\u00e4tze vom Typ USB-A": "2",
        "Anzahl der vorgeschalteten Steckpl\u00e4tze": "1",
        "Betriebstemperatur": "5 - 35 \u00b0C",
        "Bewertung der Bildschirmkr\u00fcmmung": "1500R",
        "Bildschirmdiagonale": "68,6 cm 27\"",
        "Bildschirmdiagonale cm": "68,5 cm",
        "Bildschirmform": "Gebogen",
        "Bildschirmtechnologie": "LED",
        "Bildwinkel, horizontal": "178\u00b0",
        "Bildwinkel, vertikal": "178\u00b0",
        "Digital horizontale Frequenz": "30 - 184 kHz",
        "Display-Aufl\u00f6sung": "1920 x 1080 Pixel",
        "Display-Oberfl\u00e4che": "Matt",
        "DisplayPorts-Version": "1.4",
        "Energieeffizienzklasse HDR": "G",
        "Energieeffizienzklasse SDR": "E",
        "Energieverbrauch HDR pro 1.000 Stunden": "30 kWh",
        "Energieverbrauch SDR pro 1.000 Stunden": "20 kWh",
        "Fu\u00dffarbe": "Schwarz",
        "Ger\u00e4tebreite inkl. Fu\u00df": "610,5 mm",
        "Ger\u00e4teh\u00f6he inkl. Fu\u00df": "409,5 mm",
        "Ger\u00e4tetiefe inkl. Fu\u00df": "256 mm",
        "Gewicht mit St\u00e4nder": "5,7 kg",
        "HD-Typ": "Full HD",
        "HDMI-Version": "2.0",
        "Helligkeit typisch": "250 cd/m\u00b2",
        "H\u00f6heneinstellung": "13 cm",
        "Integrierte Kamera": "Nein",
        "Kontrastverh\u00e4ltnis": "3000:1",
        "Kontrastverh\u00e4ltnis dynamisch": "80000000:1",
        "Kopfh\u00f6rerausg\u00e4nge": "1",
        "Luftfeuchtigkeit bei Lagerung": "10 - 90",
        "Marktpositionierung": "Gaming",
        "Maximale Bildwiederholrate": "165 Hz",
        "Men\u00fcsprachen": "Tschechisch, Deutsch, Niederl\u00e4ndisch, Englisch, Spanisch, Franz\u00f6sisch, Italienisch, Japanisch, Polnisch, Russisch",
        "Mitgelieferte Kabel": "AC, DisplayPort, USB",
        "NVIDIA G-SYNC": "Nein",
        "Nachhaltigkeitszertifikate": "CE, ErP, REACH, RoHS, WEEE",
        "Natives Seitenverh\u00e4ltnis": "16:9",
        "Neigungswinkelbereich": "-5 - 18\u00b0",
        "Panel-Montage-Schnittstelle": "100 x 100 mm",
        "Panel-Typ": "VA",
        "Pixel Abstand": "0,311 x 0,311 mm",
        "Produktfarbe": "Schwarz",
        "RMS-Leistung": "4 W",
        "Reaktionszeit": "1 ms",
        "Relative Luftfeuchtigkeit in Betrieb": "10 - 90",
        "Sichtbare Gr\u00f6\u00dfe horizontal": "59,8 cm",
        "Sichtbare Gr\u00f6\u00dfe vertikal": "33,6 cm",
        "Slot-Typ Kabelsperre": "Kensington",
        "Stromverbrauch Standardbetrieb": "28 W",
        "Stromverbrauch Standby": "0,5 W",
        "Stromverbrauch aus": "0,3 W",
        "Temperaturbereich bei Lagerung": "-20 - 60 \u00b0C",
        "Touchscreen": "Nein",
        "USB-Hub-Version": "2.0",
        "USB-Upstream-Porttyp": "USB Typ-B",
        "Verpackungsbreite": "692 mm",
        "Verpackungsh\u00f6he": "505 mm",
        "Verpackungstiefe": "228 mm",
        "Warentarifnummer HS": "85285210"
    },
    "raw_specifications_text": "Bildschirmdiagonale: 68,6 cm 27\"\nDisplay-Aufl\u00f6sung: 1920 x 1080 Pixel\nNatives Seitenverh\u00e4ltnis: 16:9\nBildschirmtechnologie: LED\nTouchscreen: Nein\nHD-Typ: Full HD\nPanel-Typ: VA\nBildschirmform: Gebogen\nKontrastverh\u00e4ltnis: 3000:1\nMaximale Bildwiederholrate: 165 Hz\nAnzahl der Farben des Displays: 16,7 Millionen Farben\nHelligkeit typisch: 250 cd/m\u00b2\nReaktionszeit: 1 ms\nDisplay-Oberfl\u00e4che: Matt\nBewertung der Bildschirmkr\u00fcmmung: 1500R\nKontrastverh\u00e4ltnis dynamisch: 80000000:1\nBildwinkel, horizontal: 178\u00b0\nBildwinkel, vertikal: 178\u00b0\nPixel Abstand: 0,311 x 0,311 mm\nSichtbare Gr\u00f6\u00dfe horizontal: 59,8 cm\nSichtbare Gr\u00f6\u00dfe vertikal: 33,6 cm\nDigital horizontale Frequenz: 30 - 184 kHz\nBildschirmdiagonale cm: 68,5 cm\nNVIDIA G-SYNC: Nein\nAMD FreeSync-Typ: FreeSync Premium\nAMD FreeSync Bildwiederholratenbereich: 48 - 165 Hz\nIntegrierte Kamera: Nein\nAnzahl der Lautsprecher: 2\nRMS-Leistung: 4 W\nMarktpositionierung: Gaming\nProduktfarbe: Schwarz\nFu\u00dffarbe: Schwarz\nUSB-Hub-Version: 2.0\nUSB-Upstream-Porttyp: USB Typ-B\nAnzahl der vorgeschalteten Steckpl\u00e4tze: 1\nAnzahl der nachgeschalteten Steckpl\u00e4tze vom Typ USB-A: 2\nAnzahl HDMI-Anschl\u00fcsse: 2\nHDMI-Version: 2.0\nAnzahl DisplayPort Anschl\u00fcsse: 1\nDisplayPorts-Version: 1.4\nKopfh\u00f6rerausg\u00e4nge: 1\nPanel-Montage-Schnittstelle: 100 x 100 mm\nSlot-Typ Kabelsperre: Kensington\nH\u00f6heneinstellung: 13 cm\nNeigungswinkelbereich: -5 - 18\u00b0\nMen\u00fcsprachen: Tschechisch, Deutsch, Niederl\u00e4ndisch, Englisch, Spanisch, Franz\u00f6sisch, Italienisch, Japanisch, Polnisch, Russisch\nAnzahl OSD-Sprachen: 10\nEnergieeffizienzklasse SDR: E\nEnergieeffizienzklasse HDR: G\nEnergieverbrauch SDR pro 1.000 Stunden: 20 kWh\nEnergieverbrauch HDR pro 1.000 Stunden: 30 kWh\nStromverbrauch Standardbetrieb: 28 W\nStromverbrauch Standby: 0,5 W\nStromverbrauch aus: 0,3 W\nAC Eingangsspannung: 100 - 240 V\nAC Eingangsfrequenz: 50 - 60 Hz\nBetriebstemperatur: 5 - 35 \u00b0C\nTemperaturbereich bei Lagerung: -20 - 60 \u00b0C\nRelative Luftfeuchtigkeit in Betrieb: 10 - 90\nLuftfeuchtigkeit bei Lagerung: 10 - 90\nMitgelieferte Kabel: AC, DisplayPort, USB\nGer\u00e4tebreite inkl. Fu\u00df: 610,5 mm\nGer\u00e4tetiefe inkl. Fu\u00df: 256 mm\nGer\u00e4teh\u00f6he inkl. Fu\u00df: 409,5 mm\nGewicht mit St\u00e4nder: 5,7 kg\nVerpackungsbreite: 692 mm\nVerpackungstiefe: 228 mm\nVerpackungsh\u00f6he: 505 mm\nNachhaltigkeitszertifikate: CE, ErP, REACH, RoHS, WEEE\nWarentarifnummer HS: 85285210",
    "reference_file": "offer_reference_1321.json",
    "shop_name": "CSV-Direct.de"
}