{
    "html_file": "offer_2425_3.html",
    "name": "LG 24BK550Y-B, 23.8\"",
    "offer_link": "https://www.alternate.at/LG/24BK550Y-B-LED-Monitor/html/product/1870873?partner=AtGeizhalsat&campaign=Monitor/LG/1870873",
    "price": 144.9,
    "raw_specifications": {
        "": "Ausgangsleistung",
        "Abmessungen": "Breite: 55,38 cm x H\u00f6he: 51,29 cm x Tiefe/L\u00e4nge: 24 cm",
        "Anschl\u00fcsse": "1x DVI-D-Eingang, 1x HDMI-Eingang, 1x DisplayPort-Eingang, (DisplayPort-Version: 1.2), 1x VGA-Eingang, 1x 3,5-mm-Audio-Eingang, 1x Kopfh\u00f6rer-Ausgang, 2x USB-A-2.0, 1x USB-B-2.0",
        "Bild": "Glaretyp",
        "Bildschirmaufl\u00f6sung": "1.920 x 1.080 Pixel",
        "Bildschirmdiagonale": "60,45 cm (24 Zoll)",
        "EAN": "8806084080233",
        "Energieeffizienzklasse (SDR)": "E (A - G)",
        "Energieverbauch pro 1000 Stunden (SDR)": "18 kWh",
        "Ergonomie": "Typ",
        "Farbe": "schwarz (matt)",
        "Frequenz": "Pixel-Bandbreite",
        "Geeignet f\u00fcr": "Business",
        "Gewicht": "5,7 kg",
        "Hersteller-Nr.": "24BK550Y-B.AEU",
        "Lautsprecher": "2 Lautsprecher",
        "Leistungsaufnahme im Bereitschafts- und Aus-Zustand": "0,5 Watt",
        "Leistungsaufnahme im Ein-Zustand bei Standard-Dynamikumfang (SDR)": "18,2 Watt",
        "Stromversorgung": "Eco-Off",
        "Typ": "LED-Monitor",
        "Weitere Informationen": "Lebensdauer der Hintergrundbeleuchtung: bis zu 50.000 Stunden | Werkskalibrierung mit 6 Achsen-Farbkontrolle | Multiscan-Support | 99% sRGB | Formatumschaltung von 4:3 auf 16:9 | Bedientasten: Ein/Aus, Eingang, Menu",
        "Zubeh\u00f6r": "Vorhanden"
    },
    "raw_specifications_text": "Energieeffizienzklasse (SDR): E (A - G)\nEnergieverbauch pro 1000 Stunden (SDR): 18 kWh\nLeistungsaufnahme im Ein-Zustand bei Standard-Dynamikumfang (SDR): 18,2 Watt\nLeistungsaufnahme im Bereitschafts- und Aus-Zustand: 0,5 Watt\nBildschirmdiagonale: 60,45 cm (24 Zoll)\nBildschirmaufl\u00f6sung: 1.920 x 1.080 Pixel\nTyp: LED-Monitor\nFarbe: schwarz (matt)\nEAN: 8806084080233\nHersteller-Nr.: 24BK550Y-B.AEU\nGeeignet f\u00fcr: Business\nBild: Glaretyp\n: Ausgangsleistung\nFrequenz: Pixel-Bandbreite\nAnschl\u00fcsse: 1x DVI-D-Eingang, 1x HDMI-Eingang, 1x DisplayPort-Eingang, (DisplayPort-Version: 1.2), 1x VGA-Eingang, 1x 3,5-mm-Audio-Eingang, 1x Kopfh\u00f6rer-Ausgang, 2x USB-A-2.0, 1x USB-B-2.0\nErgonomie: Typ\nStromversorgung: Eco-Off\nLautsprecher: 2 Lautsprecher\nWeitere Informationen: Lebensdauer der Hintergrundbeleuchtung: bis zu 50.000 Stunden | Werkskalibrierung mit 6 Achsen-Farbkontrolle | Multiscan-Support | 99% sRGB | Formatumschaltung von 4:3 auf 16:9 | Bedientasten: Ein/Aus, Eingang, Menu\nZubeh\u00f6r: Vorhanden\nAbmessungen: Breite: 55,38 cm x H\u00f6he: 51,29 cm x Tiefe/L\u00e4nge: 24 cm\nGewicht: 5,7 kg",
    "reference_file": "offer_reference_2425.json",
    "shop_name": "Alternate.at"
}