{
    "html_file": "offer_2081_2.html",
    "name": "Philips E-line 271E1CA, 27\"",
    "offer_link": "https://www.proshop.at/Bildschirm/Philips-27-Bildschirm-E-line-271E1CA-LED-monitor-curved-Full-HD-1080p-27-Black-4-ms/3154831?utm_source=geizhals&utm_medium=cpc&utm_campaign=pricesite",
    "price": 155.9,
    "raw_specifications": {
        "Abmessungen (Breite x Tiefe x H\u00f6he)": "61.1 cm x 20.3 cm x 46.2 cm - mit Fu\u00df",
        "Abmessungen (Breite x Tiefe x H\u00f6he) - mit Fu\u00df": "61.1 cm x 20.3 cm x 46.2 cm",
        "Ausgangsleistung/Kanal": "3 Watt",
        "Besonderheiten": "SmartContrast, SmartImage Game, Mega Infinity Dynamic Contrast Ratio, Low Blue Light Mode, flimmerfreie Technologie, Adaptive-Sync-Technologie, sRGB Mode",
        "Bildschirmbeschichtung": "Blendfrei, 3H Hard Coating, Haze 25 %",
        "Bildschirmtyp": "VA",
        "Details zu Abmessungen & Gewicht": "Mit Fu\u00df - Breite: 61.1 cm - Tiefe: 20.3 cm - H\u00f6he: 46.2 cm - Gewicht: 4.41 kg  Ohne Fu\u00df - Breite: 61.1 cm - Tiefe: 4.3 cm - H\u00f6he: 36.7 cm - Gewicht: 3.81 kg",
        "Diagonalabmessung": "68.6 cm (27\")",
        "Display-Typ": "LED-hintergrundbeleuchteter LCD-Monitor / TFT-Aktivmatrix",
        "EAN": "8712581760946",
        "Eingangsanschl\u00fcsse": "HDMI, VGA",
        "Eingangsspannung": "Wechselstrom 120/230 V (50/60 Hz)",
        "Einstellungen der Anzeigeposition": "Neigung",
        "Energie Effizienzklasse": "Klasse F",
        "Energieverbrauch pro Jahr": "61 kWh",
        "Enthaltene Kabel": "1 x HDMI-Kabel  1 x Audiokabel",
        "Farbe": "Textured Black",
        "Farbraum": "100% sRGB (CIE 1931), 83% NTSC (CIE 1976)",
        "Farbunterst\u00fctzung": "16,7 Millionen Farben",
        "Ger\u00e4tetyp": "LED-hintergrundbeleuchteter LCD-Monitor - 68.6 cm (27\")",
        "Geschwungener Bildschirm": "Ja (1500R)",
        "Gewicht": "4.41 kg",
        "Helligkeit": "250 cd/m\u00b2",
        "Hersteller": "Philips",
        "Hintergrundbeleuchtungs-Technologie": "WLED",
        "Horizontale Bildwiederholrate": "30 - 85 kHz",
        "Horizontaler Betrachtungswinkel": "178",
        "Kennzeichnung": "Plug and Play, DDC/CI, RoHS, Bleifrei, TUV Bauart, CU-EAC, quecksilberfrei",
        "Kontrast": "3000:1",
        "Leistungsaufnahme im Ein-Zustand": "25.2 W",
        "Leistungsmerkmale": "Slot f\u00fcr Sicherheitsschloss (Kabelschloss getrennt erh\u00e4ltlich)",
        "Modell": "271E1CA/00",
        "Native Aufl\u00f6sung": "Full HD (1080p) 1920 x 1080 bei 75 Hz",
        "Neigungswinkel": "-5/20",
        "OSD-Sprachen": "Multilingual",
        "Pixelpitch": "0.311 mm",
        "Ppi": "82",
        "Produktbeschreibung": "Philips E-line 271E1CA - LED-Monitor - gebogen - Full HD (1080p) - 68.6 cm (27\")",
        "Reaktionszeit": "4 ms (gray-to-gray)",
        "Schlosstyp zur Diebstahlsicherung": "Kensington Slot",
        "Schnittstellen": "VGA  HDMI (HDCP)  Audio Line-In  Kopfh\u00f6rer",
        "Seitenverh\u00e4ltnis": "16:9",
        "Spannung": "Wechselstrom 120/230 V (50/60 Hz)",
        "Stromverbrauch (Aus-Modus)": "0.3 Watt",
        "Stromverbrauch (typisch)": "33.2 Watt",
        "Stromverbrauch SDR (eingeschaltet)": "25.2 kWh/1.000 h",
        "Stromverbrauch im Standby-Modus": "0.5 Watt",
        "Transportbreite": "73 cm",
        "Transportgewicht": "6.86 kg",
        "Transporth\u00f6he": "53.8 cm",
        "Transporttiefe": "18.6 cm",
        "Typ": "Lautsprecher - Stereo",
        "VESA-Halterung": "100 x 100 mm",
        "Vertikale Bildwiederholrate": "48 - 76 Hz",
        "Vertikaler Betrachtungswinkel": "178",
        "Waren-Nr.": "3154831",
        "Zum Hersteller": "www.philips.com"
    },
    "raw_specifications_text": "Hersteller: Philips\nWaren-Nr.: 3154831\nModell: 271E1CA/00\nEAN: 8712581760946\nZum Hersteller: www.philips.com\nProduktbeschreibung: Philips E-line 271E1CA - LED-Monitor - gebogen - Full HD (1080p) - 68.6 cm (27\")\nGer\u00e4tetyp: LED-hintergrundbeleuchteter LCD-Monitor - 68.6 cm (27\")\nEnergie Effizienzklasse: Klasse F\nEnergieverbrauch pro Jahr: 61 kWh\nLeistungsaufnahme im Ein-Zustand: 25.2 W\nGeschwungener Bildschirm: Ja (1500R)\nBildschirmtyp: VA\nSeitenverh\u00e4ltnis: 16:9\nNative Aufl\u00f6sung: Full HD (1080p) 1920 x 1080 bei 75 Hz\nPixelpitch: 0.311 mm\nHelligkeit: 250 cd/m\u00b2\nKontrast: 3000:1\nReaktionszeit: 4 ms (gray-to-gray)\nFarbunterst\u00fctzung: 16,7 Millionen Farben\nFarbraum: 100% sRGB (CIE 1931), 83% NTSC (CIE 1976)\nEingangsanschl\u00fcsse: HDMI, VGA\nEinstellungen der Anzeigeposition: Neigung\nBildschirmbeschichtung: Blendfrei, 3H Hard Coating, Haze 25 %\nSpannung: Wechselstrom 120/230 V (50/60 Hz)\nFarbe: Textured Black\nAbmessungen (Breite x Tiefe x H\u00f6he) - mit Fu\u00df: 61.1 cm x 20.3 cm x 46.2 cm\nGewicht: 4.41 kg\nKennzeichnung: Plug and Play, DDC/CI, RoHS, Bleifrei, TUV Bauart, CU-EAC, quecksilberfrei\nDisplay-Typ: LED-hintergrundbeleuchteter LCD-Monitor / TFT-Aktivmatrix\nDiagonalabmessung: 68.6 cm (27\")\nPpi: 82\nVertikale Bildwiederholrate: 48 - 76 Hz\nHorizontale Bildwiederholrate: 30 - 85 kHz\nHorizontaler Betrachtungswinkel: 178\nVertikaler Betrachtungswinkel: 178\nHintergrundbeleuchtungs-Technologie: WLED\nOSD-Sprachen: Multilingual\nBesonderheiten: SmartContrast, SmartImage Game, Mega Infinity Dynamic Contrast Ratio, Low Blue Light Mode, flimmerfreie Technologie, Adaptive-Sync-Technologie, sRGB Mode\nAbmessungen (Breite x Tiefe x H\u00f6he): 61.1 cm x 20.3 cm x 46.2 cm - mit Fu\u00df\nTyp: Lautsprecher - Stereo\nAusgangsleistung/Kanal: 3 Watt\nSchnittstellen: VGA  HDMI (HDCP)  Audio Line-In  Kopfh\u00f6rer\nNeigungswinkel: -5/20\nVESA-Halterung: 100 x 100 mm\nLeistungsmerkmale: Slot f\u00fcr Sicherheitsschloss (Kabelschloss getrennt erh\u00e4ltlich)\nEnthaltene Kabel: 1 x HDMI-Kabel  1 x Audiokabel\nSchlosstyp zur Diebstahlsicherung: Kensington Slot\nEingangsspannung: Wechselstrom 120/230 V (50/60 Hz)\nStromverbrauch SDR (eingeschaltet): 25.2 kWh/1.000 h\nStromverbrauch (typisch): 33.2 Watt\nStromverbrauch im Standby-Modus: 0.5 Watt\nStromverbrauch (Aus-Modus): 0.3 Watt\nDetails zu Abmessungen & Gewicht: Mit Fu\u00df - Breite: 61.1 cm - Tiefe: 20.3 cm - H\u00f6he: 46.2 cm - Gewicht: 4.41 kg  Ohne Fu\u00df - Breite: 61.1 cm - Tiefe: 4.3 cm - H\u00f6he: 36.7 cm - Gewicht: 3.81 kg\nTransportbreite: 73 cm\nTransporttiefe: 18.6 cm\nTransporth\u00f6he: 53.8 cm\nTransportgewicht: 6.86 kg",
    "reference_file": "offer_reference_2081.json",
    "shop_name": "Proshop.at"
}