{
    "html_file": "offer_1899_1.html",
    "name": "Hikvision Value Series QE DS-D5019QE-B, 18.5\"",
    "offer_link": "https://direkt.jacob.de/produkte/hikvision-ds-d5019qe-b-eu-lcd-tft-ds-d5019qe-b-eu-artnr-3900054.html?utm_source=geizhals&utm_medium=cpc&utm_campaign=Preisvergleich&ref=103",
    "price": 158.4,
    "raw_specifications": {
        "Abmessungen (Breite x Tiefe x H\u00f6he)": "44.558 cm x 4.46 cm x 27.499 cm",
        "Besonderheiten": "3D-Kammfilter, 3D Noise Reduction, 3D Deinterlace",
        "Diagonalabmessung": "47 cm (18.5\")",
        "Display-Typ": "LED-hintergrundbeleuchteter LCD-Monitor / TFT-Aktivmatrix",
        "Eingangsanschl\u00fcsse": "HDMI, VGA",
        "Eingangsspannung": "AC 100 - 240 V (50 - 60 Hz)",
        "Energie Effizienzklasse": "Klasse F",
        "Enthaltene Kabel": "VGA-Kabel  Stromkabel",
        "Farbunterst\u00fctzung": "16,7 Millionen Farben",
        "Ger\u00e4tetyp": "LED-hintergrundbeleuchteter LCD-Monitor - 47 cm (18.5\")",
        "Gewicht": "2.8 kg",
        "Helligkeit": "200 cd/m\u00b2",
        "Hintergrundbeleuchtungs-Technologie": "LED-Hintergrundbeleuchtung",
        "Horizontaler Betrachtungswinkel": "90",
        "Kontrast": "600:1",
        "Leistungsaufnahme im Ein-Zustand": "15 W",
        "Lokalisierung": "Europa",
        "Max. Betriebstemperatur": "40 \u00b0C",
        "Min Betriebstemperatur": "0 \u00b0C",
        "Native Aufl\u00f6sung": "1366 x 768",
        "Pixelpitch": "0.3 mm",
        "Produktbeschreibung": "Hikvision DS-D5019QE-B - LED-Monitor - 47 cm (18.5\")",
        "Schnittstellen": "HDMI  VGA",
        "Seitenverh\u00e4ltnis": "16:9",
        "Spannung": "AC 100 - 240 V (50 - 60 Hz)",
        "Stromverbrauch (typisch)": "20 Watt",
        "Stromverbrauch SDR (eingeschaltet)": "15 kWh/1.000 h",
        "Stromverbrauch im Standby-Modus": "0.5 Watt",
        "VESA-Halterung": "75 x 75 mm",
        "Vertikaler Betrachtungswinkel": "65",
        "Zul\u00e4ssige Luftfeuchtigkeit im Betrieb": "10 ? 85% (nicht kondensierend)"
    },
    "raw_specifications_text": "Produktbeschreibung: Hikvision DS-D5019QE-B - LED-Monitor - 47 cm (18.5\")\nGer\u00e4tetyp: LED-hintergrundbeleuchteter LCD-Monitor - 47 cm (18.5\")\nEnergie Effizienzklasse: Klasse F\nLeistungsaufnahme im Ein-Zustand: 15 W\nSeitenverh\u00e4ltnis: 16:9\nNative Aufl\u00f6sung: 1366 x 768\nPixelpitch: 0.3 mm\nHelligkeit: 200 cd/m\u00b2\nKontrast: 600:1\nFarbunterst\u00fctzung: 16,7 Millionen Farben\nEingangsanschl\u00fcsse: HDMI, VGA\nSpannung: AC 100 - 240 V (50 - 60 Hz)\nAbmessungen (Breite x Tiefe x H\u00f6he): 44.558 cm x 4.46 cm x 27.499 cm\nGewicht: 2.8 kg\nLokalisierung: Europa\nDisplay-Typ: LED-hintergrundbeleuchteter LCD-Monitor / TFT-Aktivmatrix\nDiagonalabmessung: 47 cm (18.5\")\nHorizontaler Betrachtungswinkel: 90\nVertikaler Betrachtungswinkel: 65\nHintergrundbeleuchtungs-Technologie: LED-Hintergrundbeleuchtung\nBesonderheiten: 3D-Kammfilter, 3D Noise Reduction, 3D Deinterlace\nSchnittstellen: HDMI  VGA\nVESA-Halterung: 75 x 75 mm\nEnthaltene Kabel: VGA-Kabel  Stromkabel\nEingangsspannung: AC 100 - 240 V (50 - 60 Hz)\nStromverbrauch SDR (eingeschaltet): 15 kWh/1.000 h\nStromverbrauch (typisch): 20 Watt\nStromverbrauch im Standby-Modus: 0.5 Watt\nMin Betriebstemperatur: 0 \u00b0C\nMax. Betriebstemperatur: 40 \u00b0C\nZul\u00e4ssige Luftfeuchtigkeit im Betrieb: 10 ? 85% (nicht kondensierend)",
    "reference_file": "offer_reference_1899.json",
    "shop_name": "Jacob Elektronik direkt (AT)"
}