{
    "html_file": "offer_40_5.html",
    "name": "NEC MultiSync EA242WU-BK schwarz, 24\"",
    "offer_link": "https://www.mylemon.at/artikel/nec/60004855/ea242wu24-led-1920x1200-usb-c.html",
    "price": 391.89,
    "raw_specifications": {
        "Anzahl DisplayPort Anschl\u00fcsse": "1",
        "Anzahl HDMI-Anschl\u00fcsse": "1",
        "Anzahl der Farben des Displays": "16,7 Millionen Farben",
        "Anzahl der Lautsprecher": "2",
        "Anzahl der nachgeschalteten Steckpl\u00e4tze vom Typ USB-A": "2",
        "Anzahl der vorgeschalteten Steckpl\u00e4tze": "1",
        "Artikelnummer": "M1DYH7VL",
        "Aufl\u00f6sung": "1920x1200",
        "Besonderheiten": "Lautsprecher",
        "Betriebstemperatur": "-5 - 35 \u00b0C",
        "Bildschirmdiagonale": "61 cm (24 Zoll)",
        "Bildschirmdiagonale (cm)": "61 cm",
        "Bildschirmform": "Flach",
        "Bildschirmtechnologie": "LCD",
        "Bildwinkel, horizontal": "178\u00b0",
        "Bildwinkel, vertikal": "178\u00b0",
        "Bluetooth": "Nein",
        "DVI Anschluss": "Nein",
        "Digital horizontale Frequenz": "31,5 - 77 kHz",
        "Digital vertikale Frequenz": "50 - 60 Hz",
        "Display-Aufl\u00f6sung": "1920 x 1200 Pixel",
        "Displaygr\u00f6\u00dfe": "24 Zoll",
        "EAN": "5028695124622",
        "Eingebaute Lautsprecher": "Ja",
        "Eingebauter Ethernet-Anschluss": "Ja",
        "Energieeffizienzklasse (SDR)": "D",
        "Energieeffizienzskala": "A bis G",
        "Energieverbrauch (SDR) pro 1.000 Stunden": "13 kWh",
        "Flimmerfreie Technologie": "Ja",
        "Ger\u00e4tebreite (inkl. Fu\u00df)": "531 mm",
        "Ger\u00e4teh\u00f6he (inkl. Fu\u00df)": "365 mm",
        "Ger\u00e4tetiefe (inkl. Fu\u00df)": "250 mm",
        "Gewicht (mit St\u00e4nder)": "6,7 kg",
        "HDMI": "Ja",
        "Helligkeit": "300 cd/m\u00b2",
        "Helligkeit (typisch)": "300 cd/m\u00b2",
        "Hersteller Artikelnummer": "60004855",
        "H\u00f6heneinstellung": "15 cm",
        "H\u00f6henverstellung": "Ja",
        "Integrierte Kamera": "Nein",
        "Integrierter USB-Hub": "Ja",
        "Kabelsperre-Slot": "Ja",
        "Kontrastverh\u00e4ltnis": "1000:1",
        "Kontrastverh\u00e4ltnis (dynamisch)": "5000:1",
        "Kopfh\u00f6rerausgang": "Ja",
        "LED-Anzeigen": "Ja",
        "Low-Blue-Light-Technologie": "Ja",
        "Maximale Bildwiederholrate": "60 Hz",
        "Mitgelieferte Kabel": "AC, USB Typ-C",
        "Nachhaltigkeitszertifikate": "CE, ENERGY STAR, TCO",
        "Natives Seitenverh\u00e4ltnis": "16:10",
        "Neigungsverstellung": "Ja",
        "Neigungswinkelbereich": "-5 - 35\u00b0",
        "Netzteiltyp": "Intern",
        "On-Screen-Display (OSD)": "Ja",
        "Panel": "IPS",
        "Panel-Montage-Schnittstelle": "100 x 100 mm",
        "Panel-Typ": "TFT/IPS",
        "Pivot": "Ja",
        "Pivot Winkel": "-90 - 90\u00b0",
        "Pixel Abstand": "0,27 x 0,27 mm",
        "Plug & Play": "Ja",
        "Produktfarbe": "Schwarz",
        "RMS-Leistung": "2 W",
        "Rahmenbreite (oben)": "0,8 mm",
        "Reaktionszeit": "6 ms",
        "Relative Luftfeuchtigkeit in Betrieb": "20 - 80%",
        "Schnellstart\u00fcbersicht": "Ja",
        "Schwenkbar": "Ja",
        "Schwenkwinkelbereich": "-170 - 170\u00b0",
        "Slot-Typ Kabelsperre": "Kensington",
        "Stromverbrauch (PowerSave)": "0,3 W",
        "Stromverbrauch (Standardbetrieb)": "21 W",
        "St\u00e4nder enthalten": "Ja",
        "Touchscreen": "Nein",
        "Typ der Hintergrundbeleuchtung": "W-LED",
        "USB Power Delivery": "Ja",
        "USB-Hub-Version": "3.2 Gen 1 (3.1 Gen 1)",
        "USB-Stromversorgung bis zu": "65 W",
        "Unterst\u00fctzte Grafik-Aufl\u00f6sungen": "640 x 480 (VGA), 800 x 600 (SVGA), 1024 x 768 (XGA), 1280 x 1024 (SXGA), 1280 x 720 (HD 720), 1280 x 768, 1280 x 960, 1360 x 768 (WXGA), 1366 x 768, 1400 x 1050 (SXGA+), 1440 x 900, 1600 x 1200 (UXGA), 1680 x 1050 (WSXGA+), 1920 x 1080 (HD 1080), 1920 x 1200 (WUXGA)",
        "VESA-Halterung": "Ja",
        "Verbessertes Kabelmanagement": "Ja",
        "Video Anschl\u00fcsse": "1x HDMI, 1x DisplayPort",
        "Vorderer Rahmen": "Schwarz",
        "WLAN": "Nein"
    },
    "raw_specifications_text": "Displaygr\u00f6\u00dfe: 24 Zoll\nAufl\u00f6sung: 1920x1200\nPanel: IPS\nReaktionszeit: 6 ms\nVideo Anschl\u00fcsse: 1x HDMI, 1x DisplayPort\nHelligkeit: 300 cd/m\u00b2\nBesonderheiten: Lautsprecher\nHersteller Artikelnummer: 60004855\nEAN: 5028695124622\nArtikelnummer: M1DYH7VL\nBildschirmdiagonale: 61 cm (24 Zoll)\nDisplay-Aufl\u00f6sung: 1920 x 1200 Pixel\nNatives Seitenverh\u00e4ltnis: 16:10\nBildschirmtechnologie: LCD\nTouchscreen: Nein\nPanel-Typ: TFT/IPS\nBildschirmform: Flach\nKontrastverh\u00e4ltnis: 1000:1\nMaximale Bildwiederholrate: 60 Hz\nAnzahl der Farben des Displays: 16,7 Millionen Farben\nTyp der Hintergrundbeleuchtung: W-LED\nHelligkeit (typisch): 300 cd/m\u00b2\nUnterst\u00fctzte Grafik-Aufl\u00f6sungen: 640 x 480 (VGA), 800 x 600 (SVGA), 1024 x 768 (XGA), 1280 x 1024 (SXGA), 1280 x 720 (HD 720), 1280 x 768, 1280 x 960, 1360 x 768 (WXGA), 1366 x 768, 1400 x 1050 (SXGA+), 1440 x 900, 1600 x 1200 (UXGA), 1680 x 1050 (WSXGA+), 1920 x 1080 (HD 1080), 1920 x 1200 (WUXGA)\nKontrastverh\u00e4ltnis (dynamisch): 5000:1\nBildwinkel, horizontal: 178\u00b0\nBildwinkel, vertikal: 178\u00b0\nPixel Abstand: 0,27 x 0,27 mm\nDigital horizontale Frequenz: 31,5 - 77 kHz\nDigital vertikale Frequenz: 50 - 60 Hz\nBildschirmdiagonale (cm): 61 cm\nFlimmerfreie Technologie: Ja\nLow-Blue-Light-Technologie: Ja\nEingebaute Lautsprecher: Ja\nIntegrierte Kamera: Nein\nAnzahl der Lautsprecher: 2\nRMS-Leistung: 2 W\nProduktfarbe: Schwarz\nVorderer Rahmen: Schwarz\nIntegrierter USB-Hub: Ja\nHDMI: Ja\nKopfh\u00f6rerausgang: Ja\nUSB-Hub-Version: 3.2 Gen 1 (3.1 Gen 1)\nAnzahl der vorgeschalteten Steckpl\u00e4tze: 1\nAnzahl der nachgeschalteten Steckpl\u00e4tze vom Typ USB-A: 2\nUSB Power Delivery: Ja\nUSB-Stromversorgung bis zu: 65 W\nDVI Anschluss: Nein\nAnzahl HDMI-Anschl\u00fcsse: 1\nAnzahl DisplayPort Anschl\u00fcsse: 1\nWLAN: Nein\nBluetooth: Nein\nEingebauter Ethernet-Anschluss: Ja\nVESA-Halterung: Ja\nKabelsperre-Slot: Ja\nH\u00f6henverstellung: Ja\nPanel-Montage-Schnittstelle: 100 x 100 mm\nVerbessertes Kabelmanagement: Ja\nSlot-Typ Kabelsperre: Kensington\nH\u00f6heneinstellung: 15 cm\nPivot: Ja\nPivot Winkel: -90 - 90\u00b0\nSchwenkbar: Ja\nSchwenkwinkelbereich: -170 - 170\u00b0\nNeigungswinkelbereich: -5 - 35\u00b0\nOn-Screen-Display (OSD): Ja\nPlug & Play: Ja\nLED-Anzeigen: Ja\nNeigungsverstellung: Ja\nEnergieeffizienzklasse (SDR): D\nEnergieverbrauch (SDR) pro 1.000 Stunden: 13 kWh\nStromverbrauch (Standardbetrieb): 21 W\nStromverbrauch (PowerSave): 0,3 W\nNetzteiltyp: Intern\nEnergieeffizienzskala: A bis G\nBetriebstemperatur: -5 - 35 \u00b0C\nRelative Luftfeuchtigkeit in Betrieb: 20 - 80%\nSt\u00e4nder enthalten: Ja\nMitgelieferte Kabel: AC, USB Typ-C\nSchnellstart\u00fcbersicht: Ja\nGer\u00e4tebreite (inkl. Fu\u00df): 531 mm\nGer\u00e4tetiefe (inkl. Fu\u00df): 250 mm\nGer\u00e4teh\u00f6he (inkl. Fu\u00df): 365 mm\nGewicht (mit St\u00e4nder): 6,7 kg\nRahmenbreite (oben): 0,8 mm\nNachhaltigkeitszertifikate: CE, ENERGY STAR, TCO",
    "reference_file": "offer_reference_40.json",
    "shop_name": "mylemon.at"
}