{
    "html_file": "offer_860_20.html",
    "name": "AOC 24V5CE/BK, 23.8\"",
    "offer_link": "https://www.alternate.at/AOC/24V5CE-BK-LED-Monitor/html/product/1878853?partner=AtGeizhalsat&campaign=Monitor/AOC/1878853",
    "price": 152.9,
    "raw_specifications": {
        "": "AMD FreeSync, Kensington-Schloss",
        "Abmessungen": "Breite: 53,934 cm x H\u00f6he: 42,779 cm x Tiefe/L\u00e4nge: 18,5 cm",
        "Anschl\u00fcsse": "1x HDMI-Eingang, (HDMI-Version: 1.4), 1x 3,5-mm-Audio-Ausgang, 4x USB-A-3.2 Gen 1 (5 Gbit/s), 1x USB-C",
        "Bild": "Glaretyp",
        "Bildschirmaufl\u00f6sung": "1.920 x 1.080 Pixel",
        "Bildschirmdiagonale": "61 cm (24 Zoll)",
        "EAN": "4038986140133",
        "Energieeffizienzklasse (HDR)": "E (A - G)",
        "Energieeffizienzklasse (SDR)": "E (A - G)",
        "Energieverbauch pro 1000 Stunden (HDR)": "18 kWh",
        "Energieverbauch pro 1000 Stunden (SDR)": "18 kWh",
        "Ergonomie": "Typ",
        "Farbe": "schwarz",
        "Features": "Flicker-free LED, Low blue light Technologie",
        "Geeignet f\u00fcr": "Business, Multimedia",
        "Gewicht": "4,8 kg",
        "Hersteller-Nr.": "24V5CE/BK",
        "Lautsprecher": "2 Lautsprecher",
        "Leistungsaufnahme im Bereitschafts- und Aus-Zustand": "0,5 Watt",
        "Leistungsaufnahme im Ein-Zustand bei Standard-Dynamikumfang (SDR)": "18 Watt",
        "Leistungsaufnahme im Ein-Zustand bei hohem Dynamikumfang (HDR)": "18 Watt",
        "Serie": "V5",
        "Standards": "Video",
        "Stromversorgung": "Eco-Off",
        "Typ": "LED-Monitor",
        "Wandhalterung": "VESA kompatibel (100 x 100 mm)",
        "Zubeh\u00f6r": "Vorhanden"
    },
    "raw_specifications_text": "Energieeffizienzklasse (SDR): E (A - G)\nEnergieverbauch pro 1000 Stunden (SDR): 18 kWh\nEnergieeffizienzklasse (HDR): E (A - G)\nEnergieverbauch pro 1000 Stunden (HDR): 18 kWh\nLeistungsaufnahme im Ein-Zustand bei Standard-Dynamikumfang (SDR): 18 Watt\nLeistungsaufnahme im Ein-Zustand bei hohem Dynamikumfang (HDR): 18 Watt\nLeistungsaufnahme im Bereitschafts- und Aus-Zustand: 0,5 Watt\nBildschirmdiagonale: 61 cm (24 Zoll)\nBildschirmaufl\u00f6sung: 1.920 x 1.080 Pixel\nTyp: LED-Monitor\nFarbe: schwarz\nEAN: 4038986140133\nHersteller-Nr.: 24V5CE/BK\nSerie: V5\nGeeignet f\u00fcr: Business, Multimedia\nBild: Glaretyp\n: AMD FreeSync, Kensington-Schloss\nAnschl\u00fcsse: 1x HDMI-Eingang, (HDMI-Version: 1.4), 1x 3,5-mm-Audio-Ausgang, 4x USB-A-3.2 Gen 1 (5 Gbit/s), 1x USB-C\nErgonomie: Typ\nStromversorgung: Eco-Off\nLautsprecher: 2 Lautsprecher\nStandards: Video\nWandhalterung: VESA kompatibel (100 x 100 mm)\nFeatures: Flicker-free LED, Low blue light Technologie\nZubeh\u00f6r: Vorhanden\nAbmessungen: Breite: 53,934 cm x H\u00f6he: 42,779 cm x Tiefe/L\u00e4nge: 18,5 cm\nGewicht: 4,8 kg",
    "reference_file": "offer_reference_860.json",
    "shop_name": "Alternate.at"
}