{
    "html_file": "offer_1353_7.html",
    "name": "Lenovo L27m-30, 27\"",
    "offer_link": "https://www.mylemon.at/artikel/lenovo/66d0kac2eu/l27m-30.html",
    "price": 173.89,
    "raw_specifications": {
        "AC Eingangsfrequenz": "50/60 Hz",
        "AC Eingangsspannung": "100 - 240 V",
        "AMD FreeSync": "Ja",
        "Anzahl HDMI-Anschl\u00fcsse": "1",
        "Anzahl VGA (D-Sub) Anschl\u00fcsse": "1",
        "Anzahl der Farben des Displays": "16,7 Millionen Farben",
        "Anzahl der Lautsprecher": "2",
        "Anzahl der nachgeschalteten Steckpl\u00e4tze vom Typ USB-A": "4",
        "Anzahl der vorgeschalteten Steckpl\u00e4tze": "1",
        "Artikelnummer": "M18YGP9L",
        "Audioausgang": "Ja",
        "Aufl\u00f6sung": "1920x1080",
        "Bezel Weite (bottom)": "2,23 cm",
        "Bezel Weite (side)": "2,5 mm",
        "Bezel Weite (top)": "2,5 mm",
        "Bildschirmdiagonale": "68,6 cm (27 Zoll)",
        "Bildschirmdiagonale (cm)": "68,6 cm",
        "Bildschirmform": "Flach",
        "Bildschirmtechnologie": "LED",
        "Bildwinkel, horizontal": "178\u00b0",
        "Bildwinkel, vertikal": "178\u00b0",
        "Blendfreier Bildschirm": "Ja",
        "Breite (ohne Standfu\u00df)": "61,2 cm",
        "Display-Aufl\u00f6sung": "1920 x 1080 Pixel",
        "Displaygr\u00f6\u00dfe": "27 Zoll",
        "EAN": "0195713714709",
        "Eingebaute Lautsprecher": "Ja",
        "Energieeffizienzklasse (SDR)": "C",
        "Energieeffizienzskala": "A bis G",
        "Energieverbrauch (SDR) pro 1.000 Stunden": "14 kWh",
        "Ergonomie": "H\u00f6henverstellbar, Pivot (90 Grad drehbar), Neigbar",
        "Farbskala": "72%",
        "Farbtiefe": "8 Bit",
        "Ger\u00e4tebreite (inkl. Fu\u00df)": "564,7 mm",
        "Ger\u00e4teh\u00f6he (inkl. Fu\u00df)": "612,5 mm",
        "Ger\u00e4tetiefe (inkl. Fu\u00df)": "214,9 mm",
        "Gewicht (mit St\u00e4nder)": "6,1 kg",
        "Gewicht (ohne St\u00e4nder)": "4,1 kg",
        "HD-Typ": "Full HD",
        "HDMI": "Ja",
        "HDMI-Version": "1.4",
        "Helligkeit": "250 cd/m\u00b2",
        "Helligkeit (typisch)": "250 cd/m\u00b2",
        "Hersteller Artikelnummer": "66D0KAC2EU",
        "H\u00f6he (ohne Standfu\u00df)": "36,8 cm",
        "H\u00f6heneinstellung": "15 cm",
        "H\u00f6henverstellung": "Ja",
        "Integrierter USB-Hub": "Ja",
        "Kabelsperre-Slot": "Ja",
        "Kontrastverh\u00e4ltnis": "1000:1",
        "Kontrastverh\u00e4ltnis (dynamisch)": "3000000:1",
        "Maximale Bildwiederholrate": "75 Hz",
        "NTSC Abdeckung (typisch)": "72%",
        "Natives Seitenverh\u00e4ltnis": "16:9",
        "Neigungsverstellung": "Ja",
        "Neigungswinkelbereich": "-5 - 22\u00b0",
        "Paketgewicht": "8,4 kg",
        "Panel": "IPS",
        "Panel-Montage-Schnittstelle": "100 x 100 mm",
        "Panel-Typ": "IPS",
        "Pivot": "Ja",
        "Pivot Winkel": "-90 - 90\u00b0",
        "Pixel Abstand": "0,3114 x 0,3114 mm",
        "Pixeldichte": "82 ppi",
        "Produktfarbe": "Schwarz",
        "RGB-Farbraum": "NTSC",
        "RMS-Leistung": "6 W",
        "Reaktionszeit": "6 ms",
        "Reaktionszeit (schnell)": "4 ms",
        "Schwenkbar": "Ja",
        "Schwenkwinkelbereich": "0 - 360\u00b0",
        "Sichtbare Gr\u00f6\u00dfe (horizontal)": "61,2 cm",
        "Sichtbare Gr\u00f6\u00dfe (vertikal)": "36,8 cm",
        "Slot-Typ Kabelsperre": "Kensington",
        "Stromverbrauch (Standardbetrieb)": "18 W",
        "Stromverbrauch (aus)": "0,3 W",
        "Stromverbrauch (max.)": "130 W",
        "St\u00e4nder enthalten": "Ja",
        "Tiefe (ohne Standfu\u00df)": "4,32 cm",
        "Touchscreen": "Nein",
        "USB-Hub-Version": "3.2 Gen 1 (3.1 Gen 1)",
        "USB-Typ-C DisplayPort-Wechselmodus": "Ja",
        "USB-Upstream-Porttyp": "USB Typ-C",
        "VESA Halterung": "100x100 mm",
        "VESA-Halterung": "Ja",
        "Verpackungsbreite": "710 mm",
        "Verpackungsh\u00f6he": "509 mm",
        "Verpackungstiefe": "142 mm",
        "Video Anschl\u00fcsse": "1x VGA, 1x HDMI, 1x USB",
        "Warentarifnummer (HS)": "85285210",
        "Zertifizierung": "CCC, RoHS, T\u00dcV"
    },
    "raw_specifications_text": "Displaygr\u00f6\u00dfe: 27 Zoll\nAufl\u00f6sung: 1920x1080\nPanel: IPS\nReaktionszeit: 6 ms\nVideo Anschl\u00fcsse: 1x VGA, 1x HDMI, 1x USB\nErgonomie: H\u00f6henverstellbar, Pivot (90 Grad drehbar), Neigbar\nVESA Halterung: 100x100 mm\nHelligkeit: 250 cd/m\u00b2\nHersteller Artikelnummer: 66D0KAC2EU\nEAN: 0195713714709\nArtikelnummer: M18YGP9L\nBildschirmdiagonale: 68,6 cm (27 Zoll)\nDisplay-Aufl\u00f6sung: 1920 x 1080 Pixel\nNatives Seitenverh\u00e4ltnis: 16:9\nBildschirmtechnologie: LED\nTouchscreen: Nein\nHD-Typ: Full HD\nPanel-Typ: IPS\nBildschirmform: Flach\nKontrastverh\u00e4ltnis: 1000:1\nMaximale Bildwiederholrate: 75 Hz\nAnzahl der Farben des Displays: 16,7 Millionen Farben\nHelligkeit (typisch): 250 cd/m\u00b2\nBlendfreier Bildschirm: Ja\nKontrastverh\u00e4ltnis (dynamisch): 3000000:1\nBildwinkel, horizontal: 178\u00b0\nBildwinkel, vertikal: 178\u00b0\nReaktionszeit (schnell): 4 ms\nPixel Abstand: 0,3114 x 0,3114 mm\nPixeldichte: 82 ppi\nSichtbare Gr\u00f6\u00dfe (horizontal): 61,2 cm\nSichtbare Gr\u00f6\u00dfe (vertikal): 36,8 cm\nBildschirmdiagonale (cm): 68,6 cm\nFarbtiefe: 8 Bit\nRGB-Farbraum: NTSC\nFarbskala: 72%\nNTSC Abdeckung (typisch): 72%\nAMD FreeSync: Ja\nEingebaute Lautsprecher: Ja\nAnzahl der Lautsprecher: 2\nRMS-Leistung: 6 W\nProduktfarbe: Schwarz\nZertifizierung: CCC, RoHS, T\u00dcV\nIntegrierter USB-Hub: Ja\nHDMI: Ja\nUSB-Hub-Version: 3.2 Gen 1 (3.1 Gen 1)\nUSB-Upstream-Porttyp: USB Typ-C\nAnzahl der vorgeschalteten Steckpl\u00e4tze: 1\nAnzahl der nachgeschalteten Steckpl\u00e4tze vom Typ USB-A: 4\nUSB-Typ-C DisplayPort-Wechselmodus: Ja\nAnzahl VGA (D-Sub) Anschl\u00fcsse: 1\nAnzahl HDMI-Anschl\u00fcsse: 1\nHDMI-Version: 1.4\nAudioausgang: Ja\nVESA-Halterung: Ja\nKabelsperre-Slot: Ja\nH\u00f6henverstellung: Ja\nPanel-Montage-Schnittstelle: 100 x 100 mm\nSlot-Typ Kabelsperre: Kensington\nH\u00f6heneinstellung: 15 cm\nPivot: Ja\nPivot Winkel: -90 - 90\u00b0\nSchwenkbar: Ja\nSchwenkwinkelbereich: 0 - 360\u00b0\nNeigungswinkelbereich: -5 - 22\u00b0\nNeigungsverstellung: Ja\nEnergieeffizienzklasse (SDR): C\nEnergieverbrauch (SDR) pro 1.000 Stunden: 14 kWh\nStromverbrauch (Standardbetrieb): 18 W\nStromverbrauch (max.): 130 W\nStromverbrauch (aus): 0,3 W\nAC Eingangsspannung: 100 - 240 V\nAC Eingangsfrequenz: 50/60 Hz\nEnergieeffizienzskala: A bis G\nSt\u00e4nder enthalten: Ja\nGer\u00e4tebreite (inkl. Fu\u00df): 564,7 mm\nGer\u00e4tetiefe (inkl. Fu\u00df): 214,9 mm\nGer\u00e4teh\u00f6he (inkl. Fu\u00df): 612,5 mm\nGewicht (mit St\u00e4nder): 6,1 kg\nBreite (ohne Standfu\u00df): 61,2 cm\nTiefe (ohne Standfu\u00df): 4,32 cm\nH\u00f6he (ohne Standfu\u00df): 36,8 cm\nGewicht (ohne St\u00e4nder): 4,1 kg\nBezel Weite (side): 2,5 mm\nBezel Weite (top): 2,5 mm\nBezel Weite (bottom): 2,23 cm\nVerpackungsbreite: 710 mm\nVerpackungstiefe: 142 mm\nVerpackungsh\u00f6he: 509 mm\nPaketgewicht: 8,4 kg\nWarentarifnummer (HS): 85285210",
    "reference_file": "offer_reference_1353.json",
    "shop_name": "mylemon.at"
}