{
    "html_file": "offer_820_5.html",
    "name": "Eizo FlexScan EV2781 schwarz, 27\"",
    "offer_link": "https://www.csv-direct.de/artinfo.php?artnr=A1621381&KATEGORIE=162&pva=geizhals2",
    "price": 567.7,
    "raw_specifications": {
        "AC Eingangsfrequenz": "50 - 60 Hz",
        "AC Eingangsspannung": "100 - 240 V",
        "AMD FreeSync": "Nein",
        "Anzahl DisplayPort Anschl\u00fcsse": "1",
        "Anzahl HDMI-Anschl\u00fcsse": "1",
        "Anzahl der Farben des Displays": "16,7 Millionen Farben",
        "Anzahl der Lautsprecher": "2",
        "Anzahl der Upstream-Ports USB Typ-C": "1",
        "Anzahl der nachgeschalteten Steckpl\u00e4tze vom Typ USB-A": "4",
        "Anzahl der vorgeschalteten Steckpl\u00e4tze": "1",
        "Betriebstemperatur": "5 - 35 \u00b0C",
        "Bildschirmdiagonale": "68,6 cm 27\"",
        "Bildschirmdiagonale cm": "68,5 cm",
        "Bildschirmform": "Flach",
        "Bildschirmtechnologie": "LED",
        "Bildwinkel, horizontal": "178\u00b0",
        "Bildwinkel, vertikal": "178\u00b0",
        "Breite ohne Standfu\u00df": "611 mm",
        "Display-Aufl\u00f6sung": "2560 x 1440 Pixel",
        "DisplayPorts-Version": "1.3",
        "Energieeffizienzklasse SDR": "D",
        "Energieeffizienzskala": "A bis G",
        "Energieverbrauch SDR pro 1.000 Stunden": "17 kWh",
        "Ger\u00e4tebreite inkl. Fu\u00df": "611 mm",
        "Ger\u00e4teh\u00f6he inkl. Fu\u00df": "369 mm",
        "Ger\u00e4tetiefe inkl. Fu\u00df": "230 mm",
        "Gewicht mit St\u00e4nder": "8,5 kg",
        "Gewicht ohne St\u00e4nder": "5,7 kg",
        "HD-Typ": "Quad HD",
        "Helligkeit typisch": "350 cd/m\u00b2",
        "Horizontaler Scanbereich": "31 - 89 kHz",
        "H\u00f6he ohne Standfu\u00df": "357 mm",
        "H\u00f6heneinstellung": "17,7 cm",
        "Kontrastverh\u00e4ltnis": "1000:1",
        "Kopfh\u00f6rer-Anschluss": "3,5 mm",
        "Kopfh\u00f6rerausg\u00e4nge": "1",
        "Marktpositionierung": "Business",
        "Maximale Bildwiederholrate": "60 Hz",
        "Men\u00fcsprachen": "Deutsch, Englisch, Schwedisch, Spanisch, Italienisch, Franz\u00f6sisch",
        "Mitgelieferte Kabel": "AC, USB Typ-A auf USB Typ-C",
        "NVIDIA G-SYNC": "Nein",
        "Natives Seitenverh\u00e4ltnis": "16:9",
        "Neigungswinkelbereich": "-5 - 35\u00b0",
        "Panel-Montage-Schnittstelle": "100 x 100 mm",
        "Panel-Typ": "IPS",
        "Pivot Winkel": "-90 - 90\u00b0",
        "Pixel Abstand": "0,233 x 0,233 mm",
        "Pixeldichte": "109 ppi",
        "Produktfarbe": "Schwarz",
        "RGB-Farbraum": "sRGB",
        "RMS-Leistung": "2 W",
        "Reaktionszeit": "5 ms",
        "Relative Luftfeuchtigkeit in Betrieb": "20 - 80",
        "Schwenkwinkelbereich": "0 - 344\u00b0",
        "Sichtbare Gr\u00f6\u00dfe horizontal": "59,7 cm",
        "Sichtbare Gr\u00f6\u00dfe vertikal": "33,6 cm",
        "Stromverbrauch Standardbetrieb": "18 W",
        "Stromverbrauch Standby": "0,5 W",
        "Stromverbrauch max.": "153 W",
        "Tiefe ohne Standfu\u00df": "56 mm",
        "Touchscreen": "Nein",
        "Typ der Hintergrundbeleuchtung": "LED",
        "USB-Hub-Version": "3.2 Gen 1 3.1 Gen 1",
        "USB-Stromversorgung bis zu": "70 W",
        "USB-Upstream-Porttyp": "USB Typ-C",
        "Unterst\u00fctzte Grafik-Aufl\u00f6sungen": "2560 x 1440",
        "Verpackungsart": "Box",
        "Vertikaler Scanbereich": "59 - 61 Hz",
        "Zertifizierung": "CE, CB, UKCA, TCO Certified Generation 9, EPA ENERGY STAR \u00ae, T\u00dcV/GS, T\u00dcV Ergonomie gepr\u00fcft einschlie\u00dflich ISO 9241-307, T\u00dcV/Blue Low Light Content, T\u00dcV/Flicker Free, EPEAT 2018 US, cT\u00dcVus, T\u00dcV/S, EAC, PSE, FCC-B, CAN ICES-3 B, RCM, VCCI-B, CCC, RoHS, China RoHS, WEEE"
    },
    "raw_specifications_text": "Bildschirmdiagonale: 68,6 cm 27\"\nDisplay-Aufl\u00f6sung: 2560 x 1440 Pixel\nNatives Seitenverh\u00e4ltnis: 16:9\nBildschirmtechnologie: LED\nTouchscreen: Nein\nHD-Typ: Quad HD\nPanel-Typ: IPS\nBildschirmform: Flach\nKontrastverh\u00e4ltnis: 1000:1\nMaximale Bildwiederholrate: 60 Hz\nAnzahl der Farben des Displays: 16,7 Millionen Farben\nTyp der Hintergrundbeleuchtung: LED\nHelligkeit typisch: 350 cd/m\u00b2\nReaktionszeit: 5 ms\nUnterst\u00fctzte Grafik-Aufl\u00f6sungen: 2560 x 1440\nBildwinkel, horizontal: 178\u00b0\nBildwinkel, vertikal: 178\u00b0\nPixel Abstand: 0,233 x 0,233 mm\nPixeldichte: 109 ppi\nHorizontaler Scanbereich: 31 - 89 kHz\nVertikaler Scanbereich: 59 - 61 Hz\nSichtbare Gr\u00f6\u00dfe horizontal: 59,7 cm\nSichtbare Gr\u00f6\u00dfe vertikal: 33,6 cm\nBildschirmdiagonale cm: 68,5 cm\nRGB-Farbraum: sRGB\nNVIDIA G-SYNC: Nein\nAMD FreeSync: Nein\nAnzahl der Lautsprecher: 2\nRMS-Leistung: 2 W\nMarktpositionierung: Business\nProduktfarbe: Schwarz\nZertifizierung: CE, CB, UKCA, TCO Certified Generation 9, EPA ENERGY STAR \u00ae, T\u00dcV/GS, T\u00dcV Ergonomie gepr\u00fcft einschlie\u00dflich ISO 9241-307, T\u00dcV/Blue Low Light Content, T\u00dcV/Flicker Free, EPEAT 2018 US, cT\u00dcVus, T\u00dcV/S, EAC, PSE, FCC-B, CAN ICES-3 B, RCM, VCCI-B, CCC, RoHS, China RoHS, WEEE\nUSB-Hub-Version: 3.2 Gen 1 3.1 Gen 1\nUSB-Upstream-Porttyp: USB Typ-C\nAnzahl der vorgeschalteten Steckpl\u00e4tze: 1\nAnzahl der Upstream-Ports USB Typ-C: 1\nAnzahl der nachgeschalteten Steckpl\u00e4tze vom Typ USB-A: 4\nUSB-Stromversorgung bis zu: 70 W\nAnzahl HDMI-Anschl\u00fcsse: 1\nAnzahl DisplayPort Anschl\u00fcsse: 1\nDisplayPorts-Version: 1.3\nKopfh\u00f6rerausg\u00e4nge: 1\nKopfh\u00f6rer-Anschluss: 3,5 mm\nPanel-Montage-Schnittstelle: 100 x 100 mm\nH\u00f6heneinstellung: 17,7 cm\nPivot Winkel: -90 - 90\u00b0\nSchwenkwinkelbereich: 0 - 344\u00b0\nNeigungswinkelbereich: -5 - 35\u00b0\nMen\u00fcsprachen: Deutsch, Englisch, Schwedisch, Spanisch, Italienisch, Franz\u00f6sisch\nEnergieeffizienzklasse SDR: D\nEnergieverbrauch SDR pro 1.000 Stunden: 17 kWh\nStromverbrauch Standardbetrieb: 18 W\nStromverbrauch Standby: 0,5 W\nStromverbrauch max.: 153 W\nAC Eingangsspannung: 100 - 240 V\nAC Eingangsfrequenz: 50 - 60 Hz\nEnergieeffizienzskala: A bis G\nBetriebstemperatur: 5 - 35 \u00b0C\nRelative Luftfeuchtigkeit in Betrieb: 20 - 80\nMitgelieferte Kabel: AC, USB Typ-A auf USB Typ-C\nGer\u00e4tebreite inkl. Fu\u00df: 611 mm\nGer\u00e4tetiefe inkl. Fu\u00df: 230 mm\nGer\u00e4teh\u00f6he inkl. Fu\u00df: 369 mm\nGewicht mit St\u00e4nder: 8,5 kg\nBreite ohne Standfu\u00df: 611 mm\nTiefe ohne Standfu\u00df: 56 mm\nH\u00f6he ohne Standfu\u00df: 357 mm\nGewicht ohne St\u00e4nder: 5,7 kg\nVerpackungsart: Box",
    "reference_file": "offer_reference_820.json",
    "shop_name": "CSV-Direct.de"
}