{
    "html_file": "offer_1819_2.html",
    "name": "Dell S2421HN / S2421HNM, 23.8\"",
    "offer_link": "https://www.proshop.at/Bildschirm/Dell-24-Bildschirm-S2421HN-1920x1080-FHD-75Hz-IPS-Black-4-ms-AMD-FreeSync/2910449?utm_source=geizhals&utm_medium=cpc&utm_campaign=pricesite",
    "price": 120.8,
    "raw_specifications": {
        "Abmessungen (Breite x Tiefe x H\u00f6he)": "53.78 cm x 15.28 cm x 41.28 cm - mit Fu\u00df",
        "Abmessungen (Breite x Tiefe x H\u00f6he) - mit Fu\u00df": "53.78 cm x 15.28 cm x 41.28 cm",
        "Adaptive-Sync Technologie": "AMD FreeSync",
        "Besonderheiten": "LED-Randlichtsystem, BFR/PVC-frei, arsenfreies Glas, Dell ComfortView, Low Blue Light-Technologie, an 3 Seiten ohne Blende",
        "Bildschirmbeschichtung": "Anti-glare 3H hardness",
        "Bildschirmtyp": "IPS",
        "Details zu Abmessungen & Gewicht": "Mit Fu\u00df - Breite: 53.78 cm - Tiefe: 15.28 cm - H\u00f6he: 41.28 cm  Ohne Fu\u00df - Breite: 53.78 cm - H\u00f6he: 32.26 cm - Gewicht: 3.3 kg",
        "Diagonalabmessung": "60.45 cm (24\")",
        "Display-Typ": "LED-hintergrundbeleuchteter LCD-Monitor / TFT-Aktivmatrix",
        "EAN": "5397184409336",
        "ENERGY STAR zertifiziert": "Ja",
        "Eingangsanschl\u00fcsse": "2xHDMI",
        "Eingangsspannung": "AC 100/240 V (50/60 Hz)",
        "Einstellungen der Anzeigeposition": "Neigung",
        "Energie Effizienzklasse": "Klasse D",
        "Energierverbrauch Sleep": "0.3 Watt",
        "Enthaltene Kabel": "1 x HDMI-Kabel",
        "Entwickelt f\u00fcr": "Vostro 15 3510",
        "Farbraum": "72% NTSC (CIE 1931)",
        "Farbunterst\u00fctzung": "16,7 Millionen Farben",
        "Ger\u00e4tetyp": "LED-hintergrundbeleuchteter LCD-Monitor - 60.45 cm (24\")",
        "Helligkeit": "250 cd/m\u00b2",
        "Hersteller": "Dell",
        "Hintergrundbeleuchtungs-Technologie": "LED-Hintergrundbeleuchtung",
        "Horizontaler Betrachtungswinkel": "178",
        "Kennzeichnung": "RoHS, HDCP 1.4, quecksilberfrei",
        "Kontrast": "1000:1",
        "Leistungsaufnahme im Ein-Zustand": "12.2 W",
        "Leistungsmerkmale": "Slot f\u00fcr Sicherheitsschloss (Kabelschloss getrennt erh\u00e4ltlich)",
        "Mitgelieferte Software": "Dell Display Manager",
        "Modell": "DELL-S2421HN",
        "Native Aufl\u00f6sung": "Full HD (1080p) 1920 x 1080 bei 75 Hz",
        "Neigungswinkel": "-5/+21",
        "Pixelpitch": "0.2745 mm",
        "Ppi": "92.56",
        "Produktbeschreibung": "Dell S2421HN - LED-Monitor - Full HD (1080p) - 60.45 cm (24\")",
        "Reaktionszeit": "4 ms (Grau-zu-Grau extrem)",
        "Schlosstyp zur Diebstahlsicherung": "Kensington Slot",
        "Schnittstellen": "2 x HDMI (HDCP 1.4)  Audio Line-Out",
        "Seitenverh\u00e4ltnis": "16:9",
        "Services im Bundle": "3 Jahre erweiterte Basisaustauschgew\u00e4hrleistung",
        "Spannung": "AC 100/240 V (50/60 Hz)",
        "Stromverbrauch (typisch)": "16 Watt",
        "Stromverbrauch SDR (eingeschaltet)": "12.2 kWh/1.000 h",
        "Stromverbrauch im Standby-Modus": "0.3 Watt",
        "TCO-zertifiziert": "TCO Certified Displays 8",
        "Transportgewicht": "5.9 kg",
        "Umweltschutzstandards": "TCO Certified Displays 8, ENERGY STAR-qualifiziert",
        "VESA-Halterung": "100 x 100 mm",
        "Vertikaler Betrachtungswinkel": "178",
        "Waren-Nr.": "2910449",
        "Zubeh\u00f6r im Lieferumfang": "Aufstellung, VESA Abdeckung, Standfu\u00df",
        "Zum Hersteller": "www.dell.com/"
    },
    "raw_specifications_text": "Hersteller: Dell\nWaren-Nr.: 2910449\nModell: DELL-S2421HN\nEAN: 5397184409336\nZum Hersteller: www.dell.com/\nProduktbeschreibung: Dell S2421HN - LED-Monitor - Full HD (1080p) - 60.45 cm (24\")\nGer\u00e4tetyp: LED-hintergrundbeleuchteter LCD-Monitor - 60.45 cm (24\")\nEnergie Effizienzklasse: Klasse D\nLeistungsaufnahme im Ein-Zustand: 12.2 W\nAdaptive-Sync Technologie: AMD FreeSync\nBildschirmtyp: IPS\nSeitenverh\u00e4ltnis: 16:9\nNative Aufl\u00f6sung: Full HD (1080p) 1920 x 1080 bei 75 Hz\nPixelpitch: 0.2745 mm\nHelligkeit: 250 cd/m\u00b2\nKontrast: 1000:1\nReaktionszeit: 4 ms (Grau-zu-Grau extrem)\nFarbunterst\u00fctzung: 16,7 Millionen Farben\nFarbraum: 72% NTSC (CIE 1931)\nEingangsanschl\u00fcsse: 2xHDMI\nEinstellungen der Anzeigeposition: Neigung\nBildschirmbeschichtung: Anti-glare 3H hardness\nSpannung: AC 100/240 V (50/60 Hz)\nAbmessungen (Breite x Tiefe x H\u00f6he) - mit Fu\u00df: 53.78 cm x 15.28 cm x 41.28 cm\nUmweltschutzstandards: TCO Certified Displays 8, ENERGY STAR-qualifiziert\nKennzeichnung: RoHS, HDCP 1.4, quecksilberfrei\nServices im Bundle: 3 Jahre erweiterte Basisaustauschgew\u00e4hrleistung\nEntwickelt f\u00fcr: Vostro 15 3510\nDisplay-Typ: LED-hintergrundbeleuchteter LCD-Monitor / TFT-Aktivmatrix\nDiagonalabmessung: 60.45 cm (24\")\nPpi: 92.56\nHorizontaler Betrachtungswinkel: 178\nVertikaler Betrachtungswinkel: 178\nHintergrundbeleuchtungs-Technologie: LED-Hintergrundbeleuchtung\nBesonderheiten: LED-Randlichtsystem, BFR/PVC-frei, arsenfreies Glas, Dell ComfortView, Low Blue Light-Technologie, an 3 Seiten ohne Blende\nAbmessungen (Breite x Tiefe x H\u00f6he): 53.78 cm x 15.28 cm x 41.28 cm - mit Fu\u00df\nSchnittstellen: 2 x HDMI (HDCP 1.4)  Audio Line-Out\nNeigungswinkel: -5/+21\nVESA-Halterung: 100 x 100 mm\nLeistungsmerkmale: Slot f\u00fcr Sicherheitsschloss (Kabelschloss getrennt erh\u00e4ltlich)\nZubeh\u00f6r im Lieferumfang: Aufstellung, VESA Abdeckung, Standfu\u00df\nEnthaltene Kabel: 1 x HDMI-Kabel\nSchlosstyp zur Diebstahlsicherung: Kensington Slot\nEingangsspannung: AC 100/240 V (50/60 Hz)\nStromverbrauch SDR (eingeschaltet): 12.2 kWh/1.000 h\nStromverbrauch (typisch): 16 Watt\nStromverbrauch im Standby-Modus: 0.3 Watt\nEnergierverbrauch Sleep: 0.3 Watt\nMitgelieferte Software: Dell Display Manager\nDetails zu Abmessungen & Gewicht: Mit Fu\u00df - Breite: 53.78 cm - Tiefe: 15.28 cm - H\u00f6he: 41.28 cm  Ohne Fu\u00df - Breite: 53.78 cm - H\u00f6he: 32.26 cm - Gewicht: 3.3 kg\nTransportgewicht: 5.9 kg\nTCO-zertifiziert: TCO Certified Displays 8\nENERGY STAR zertifiziert: Ja",
    "reference_file": "offer_reference_1819.json",
    "shop_name": "Proshop.at"
}