{
    "html_file": "offer_317_2.html",
    "name": "iiyama ProLite XUB3293UHSN-B5, 31.5\"",
    "offer_link": "https://www.csv-direct.de/artinfo.php?artnr=A1621683&KATEGORIE=162&pva=geizhals2",
    "price": 447.14,
    "raw_specifications": {
        "AMD FreeSync": "Nein",
        "Anzahl DisplayPort Anschl\u00fcsse": "1",
        "Anzahl der Farben des Displays": "1,07 Milliarden Farben",
        "Anzahl der Lautsprecher": "2",
        "Anzahl der Upstream-Ports USB Typ-C": "1",
        "Anzahl der nachgeschalteten Steckpl\u00e4tze vom Typ USB-A": "2",
        "Bildschirmdiagonale": "80 cm 31.5\"",
        "Bildschirmdiagonale cm": "80 cm",
        "Bildschirmform": "Flach",
        "Bildschirmtechnologie": "LCD",
        "Bildwinkel, horizontal": "178\u00b0",
        "Bildwinkel, vertikal": "178\u00b0",
        "Display-Aufl\u00f6sung": "3840 x 2160 Pixel",
        "Energieeffizienzklasse SDR": "G",
        "Energieeffizienzskala": "A bis G",
        "Energieverbrauch SDR pro 1.000 Stunden": "33 kWh",
        "Farbtiefe": "10 Bit",
        "Ger\u00e4tebreite inkl. Fu\u00df": "714 mm",
        "Ger\u00e4teh\u00f6he inkl. Fu\u00df": "602 mm",
        "Ger\u00e4tetiefe inkl. Fu\u00df": "239,5 mm",
        "Gewicht mit St\u00e4nder": "9,9 kg",
        "HD-Typ": "4K Ultra HD",
        "Helligkeit typisch": "350 cd/m\u00b2",
        "Horizontaler Scanbereich": "30 - 135 kHz",
        "H\u00f6heneinstellung": "15 cm",
        "Integrierte Kamera": "Nein",
        "Kontrastverh\u00e4ltnis": "1000:1",
        "Kontrastverh\u00e4ltnis dynamisch": "80000000:1",
        "Maximale Bildwiederholrate": "60 Hz",
        "Men\u00fcsprachen": "Tschechisch, Deutsch, Niederl\u00e4ndisch, Englisch, Franz\u00f6sisch, Italienisch, Japanisch, Polnisch, Russisch",
        "Mitgelieferte Kabel": "DisplayPort, HDMI, Leistung, USB, USB Typ-C",
        "NTSC Abdeckung typisch": "93",
        "NVIDIA G-SYNC": "Nein",
        "Natives Seitenverh\u00e4ltnis": "16:9",
        "Netzteiltyp": "Intern",
        "Panel-Montage-Schnittstelle": "100 x 100 mm",
        "Panel-Typ": "IPS",
        "Pivot Winkel": "0 - 90\u00b0",
        "Pixel Abstand": "0,182 x 0,182 mm",
        "Produktfarbe": "Schwarz",
        "RMS-Leistung": "3 W",
        "Reaktionszeit": "4 ms",
        "Schwenkwinkelbereich": "-45 - 45\u00b0",
        "Sichtbare Gr\u00f6\u00dfe horizontal": "69,8 cm",
        "Sichtbare Gr\u00f6\u00dfe vertikal": "39,3 cm",
        "Slot-Typ Kabelsperre": "Kensington",
        "Stromverbrauch Standardbetrieb": "48 W",
        "Stromverbrauch Standby": "0,5 W",
        "Stromverbrauch aus": "0,5 W",
        "Touchscreen": "Nein",
        "USB-Hub-Version": "3.2 Gen 1 3.1 Gen 1",
        "USB-Upstream-Porttyp": "USB Typ-C",
        "sRGB Abdeckung klassisch": "99"
    },
    "raw_specifications_text": "Bildschirmdiagonale: 80 cm 31.5\"\nDisplay-Aufl\u00f6sung: 3840 x 2160 Pixel\nNatives Seitenverh\u00e4ltnis: 16:9\nBildschirmtechnologie: LCD\nTouchscreen: Nein\nHD-Typ: 4K Ultra HD\nPanel-Typ: IPS\nBildschirmform: Flach\nKontrastverh\u00e4ltnis: 1000:1\nMaximale Bildwiederholrate: 60 Hz\nAnzahl der Farben des Displays: 1,07 Milliarden Farben\nHelligkeit typisch: 350 cd/m\u00b2\nReaktionszeit: 4 ms\nKontrastverh\u00e4ltnis dynamisch: 80000000:1\nBildwinkel, horizontal: 178\u00b0\nBildwinkel, vertikal: 178\u00b0\nPixel Abstand: 0,182 x 0,182 mm\nHorizontaler Scanbereich: 30 - 135 kHz\nSichtbare Gr\u00f6\u00dfe horizontal: 69,8 cm\nSichtbare Gr\u00f6\u00dfe vertikal: 39,3 cm\nBildschirmdiagonale cm: 80 cm\nFarbtiefe: 10 Bit\nsRGB Abdeckung klassisch: 99\nNTSC Abdeckung typisch: 93\nNVIDIA G-SYNC: Nein\nAMD FreeSync: Nein\nIntegrierte Kamera: Nein\nAnzahl der Lautsprecher: 2\nRMS-Leistung: 3 W\nProduktfarbe: Schwarz\nUSB-Hub-Version: 3.2 Gen 1 3.1 Gen 1\nUSB-Upstream-Porttyp: USB Typ-C\nAnzahl der Upstream-Ports USB Typ-C: 1\nAnzahl der nachgeschalteten Steckpl\u00e4tze vom Typ USB-A: 2\nAnzahl DisplayPort Anschl\u00fcsse: 1\nPanel-Montage-Schnittstelle: 100 x 100 mm\nSlot-Typ Kabelsperre: Kensington\nH\u00f6heneinstellung: 15 cm\nPivot Winkel: 0 - 90\u00b0\nSchwenkwinkelbereich: -45 - 45\u00b0\nMen\u00fcsprachen: Tschechisch, Deutsch, Niederl\u00e4ndisch, Englisch, Franz\u00f6sisch, Italienisch, Japanisch, Polnisch, Russisch\nEnergieeffizienzklasse SDR: G\nEnergieverbrauch SDR pro 1.000 Stunden: 33 kWh\nStromverbrauch Standardbetrieb: 48 W\nStromverbrauch Standby: 0,5 W\nStromverbrauch aus: 0,5 W\nNetzteiltyp: Intern\nEnergieeffizienzskala: A bis G\nMitgelieferte Kabel: DisplayPort, HDMI, Leistung, USB, USB Typ-C\nGer\u00e4tebreite inkl. Fu\u00df: 714 mm\nGer\u00e4tetiefe inkl. Fu\u00df: 239,5 mm\nGer\u00e4teh\u00f6he inkl. Fu\u00df: 602 mm\nGewicht mit St\u00e4nder: 9,9 kg",
    "reference_file": "offer_reference_317.json",
    "shop_name": "CSV-Direct.de"
}