{
    "html_file": "offer_2310_25.html",
    "name": "AOC I1601FWUX, 15.6\"",
    "offer_link": "https://www.future-x.at/aoc-led-monitor-39-6-cm-156-sichtbar-tragbar-1920-x-1080-full-hd-1080p-ips-220-cd-m%B2-5-ms-usb-c-schwarz-silber-p-2653413/?pv=2",
    "price": 213.79,
    "raw_specifications": {
        "Abmessungen (Breite x Tiefe x H\u00f6he)": "23,52 cm x 0,85 cm x 37,62 cm",
        "Besonderheiten": "Ultra Slim Design, Spannungsversorgung \u00fcber USB-Bus, Low Blue Light Mode, automatische Drehung, breiter Betrachtungswinkel, foldable stand",
        "Bildschirmtyp": "IPS",
        "Diagonalabmessung": "39,6 cm (15.6\")",
        "Display-Typ": "LED-hintergrundbeleuchteter LCD-Monitor / TFT-Aktivmatrix",
        "ENERGY STAR zertifiziert": "Ja",
        "Einstellungen der Anzeigeposition": "Pivot (Rotation), neigbar",
        "Enthaltene Kabel": "1 x USB-C Kabel",
        "Erforderliches Betriebssystem": "Windows 8 / 10, Apple MacOS X 10.12.1 or later",
        "Farbe": "Schwarz/Silber",
        "Farbunterst\u00fctzung": "262.000 Farben",
        "Gewicht": "824 g",
        "Helligkeit": "220 cd/m\u00b2",
        "Hintergrundbeleuchtungs-Technologie": "LED-Hintergrundbeleuchtung",
        "Horizontale Bildwiederholrate": "30 - 83 kHz",
        "Horizontaler Betrachtungswinkel": "160",
        "Kennzeichnung": "FCC, RoHS, cTUVus, EPA, DDC-2B/CISoftware / Systemanforderungen",
        "Kontrast": "700:1 (dynamisch)",
        "Max. Betriebstemperatur": "40 \u00b0C",
        "Min Betriebstemperatur": "0 \u00b0C",
        "Native Aufl\u00f6sung": "Full HD (1080p) 1920 x 1080 bei 60 Hz",
        "Neigungswinkel": "+5/+25",
        "OSD-Sprachen": "Englisch, Franz\u00f6sisch, Spanisch",
        "Pixelpitch": "0.17925 mm",
        "Reaktionszeit": "5 ms (Gray-to-Gray)",
        "Schnittstellen": "USB-C",
        "Seitenverh\u00e4ltnis": "16:9",
        "Service & Support": "Begrenzte Garantie - Arbeitszeit und Ersatzteile - 3 Jahre",
        "Sichtbare Bildfl\u00e4che": "39,6 cm (15.6\")",
        "Vertikale Bildwiederholrate": "50 - 76 Hz",
        "Vertikaler Betrachtungswinkel": "160",
        "Zubeh\u00f6r im Lieferumfang": "Flexi-Stand Smart Cover",
        "Zul\u00e4ssige Luftfeuchtigkeit im Betrieb": "10 ? 85% (nicht kondensierend)"
    },
    "raw_specifications_text": "Display-Typ: LED-hintergrundbeleuchteter LCD-Monitor / TFT-Aktivmatrix\nDiagonalabmessung: 39,6 cm (15.6\")\nSichtbare Bildfl\u00e4che: 39,6 cm (15.6\")\nBildschirmtyp: IPS\nSeitenverh\u00e4ltnis: 16:9\nNative Aufl\u00f6sung: Full HD (1080p) 1920 x 1080 bei 60 Hz\nPixelpitch: 0.17925 mm\nHelligkeit: 220 cd/m\u00b2\nKontrast: 700:1 (dynamisch)\nFarbunterst\u00fctzung: 262.000 Farben\nReaktionszeit: 5 ms (Gray-to-Gray)\nVertikale Bildwiederholrate: 50 - 76 Hz\nHorizontale Bildwiederholrate: 30 - 83 kHz\nHorizontaler Betrachtungswinkel: 160\nVertikaler Betrachtungswinkel: 160\nHintergrundbeleuchtungs-Technologie: LED-Hintergrundbeleuchtung\nOSD-Sprachen: Englisch, Franz\u00f6sisch, Spanisch\nBesonderheiten: Ultra Slim Design, Spannungsversorgung \u00fcber USB-Bus, Low Blue Light Mode, automatische Drehung, breiter Betrachtungswinkel, foldable stand\nFarbe: Schwarz/Silber\nAbmessungen (Breite x Tiefe x H\u00f6he): 23,52 cm x 0,85 cm x 37,62 cm\nGewicht: 824 g\nSchnittstellen: USB-C\nEinstellungen der Anzeigeposition: Pivot (Rotation), neigbar\nNeigungswinkel: +5/+25\nZubeh\u00f6r im Lieferumfang: Flexi-Stand Smart Cover\nEnthaltene Kabel: 1 x USB-C Kabel\nKennzeichnung: FCC, RoHS, cTUVus, EPA, DDC-2B/CISoftware / Systemanforderungen\nErforderliches Betriebssystem: Windows 8 / 10, Apple MacOS X 10.12.1 or later\nENERGY STAR zertifiziert: Ja\nService & Support: Begrenzte Garantie - Arbeitszeit und Ersatzteile - 3 Jahre\nMin Betriebstemperatur: 0 \u00b0C\nMax. Betriebstemperatur: 40 \u00b0C\nZul\u00e4ssige Luftfeuchtigkeit im Betrieb: 10 ? 85% (nicht kondensierend)",
    "reference_file": "offer_reference_2310.json",
    "shop_name": "Future-X.at"
}