{
    "html_file": "offer_1627_23.html",
    "name": "Philips B-line 328B1, 31.5\"",
    "offer_link": "https://www.electronicshop24.at/product_info.php?products_id=110000000966994830&ano=F966994830&mno=328B1%2F00&ean=8712581768072&utm_medium=cpc&utm_campaign=preisvergleich&utm_content=item&utm_source=geizhals&ref=geizhals",
    "price": 445.0,
    "raw_specifications": {
        "Abmessungen (Breite x Tiefe x H\u00f6he)": "71.4 cm x 28 cm x 64.9 cm - mit Fu\u00df",
        "Ausgangsleistung/Kanal": "3 Watt",
        "Besonderheiten": "Eco-Mode, PowerSensor, SmartImage, Spielmodus, Low Blue Light Mode, flimmerfreie Technologie, SmartUniformity, Adaptive-Sync-Technologie, Movie Mode, LightSensor, EasyRead, Monitorkalibrierung Delta E<2, Photo Mode",
        "Bildschirmbeschichtung": "Blendfrei, 3H Hard Coating, Haze 25 %",
        "Bildschirmtyp": "VA",
        "Details zu Abmessungen & Gewicht": "Mit Standfu\u00df (h\u00f6chste Position) - Breite: 71.4 cm - Tiefe: 28 cm - H\u00f6he: 64.9 cm - Gewicht: 11.55 kg \u00a6 Ohne Fu\u00df - Breite: 71.4 cm - Tiefe: 6.2 cm - H\u00f6he: 42.2 cm - Gewicht: 7.54 kg",
        "Diagonalabmessung": "81.3 cm (32\")",
        "Display-Typ": "LED-hintergrundbeleuchteter LCD-Monitor / TFT-Aktivmatrix",
        "Ein-/Aus-Schalter": "Ja",
        "Eingangsspannung": "Wechselstrom 120/230 V (50/60 Hz)",
        "Einstellungen der Anzeigeposition": "H\u00f6he, Pivot (Rotation), Drehung, Neigung",
        "Energie Effizienzklasse": "Klasse G",
        "Enthaltene Kabel": "DisplayPort-Kabel \u00a6 HDMI-Kabel",
        "Farbe": "Black Texture",
        "Farbraum": "119% sRGB (CIE 1931), 97% Adobe RGB (CIE 1976), 98% NTSC (CIE 1976)",
        "Farbunterst\u00fctzung": "16,7 Millionen Farben",
        "Gewicht": "11.55 kg",
        "Helligkeit": "350 cd/m\u00b2",
        "Hintergrundbeleuchtungs-Technologie": "WLED",
        "Horizontale Bildwiederholrate": "30 - 140 kHz",
        "Horizontaler Betrachtungswinkel": "178",
        "H\u00f6heneinstellung": "180 mm",
        "Integrierte Peripherieger\u00e4te": "USB Hub",
        "Kennzeichnung": "Plug and Play, FCC Klasse B bescheinigt, TUV GS, ICES-003, SEMKO, CB, CCC, TUV Ergo, DDC/CI, RoHS, Bleifrei, CECP, CEL, CU-EAC, BFR-frei, Ukraine, PVC-free, quecksilberfrei, EAEU RoHS",
        "Kontrast": "3000:1 / 50000000:1 (dynamisch)",
        "Leistungsaufnahme im Ein-Zustand": "40 W",
        "Leistungsmerkmale": "Slot f\u00fcr Sicherheitsschloss (Kabelschloss getrennt erh\u00e4ltlich)",
        "MTBF": "70,000 Stunde(n)",
        "Max. Betriebstemperatur": "40 \u00b0C",
        "Min Betriebstemperatur": "0 \u00b0C",
        "Mitgelieferte Software": "Philips SmartControl",
        "Native Aufl\u00f6sung": "4K 3840 x 2160 bei 60 Hz",
        "Neigungswinkel": "-5/+30",
        "OSD-Sprachen": "Multilingual",
        "Pixelpitch": "0.18159 mm",
        "Ppi": "140",
        "Reaktionszeit": "4 ms (gray-to-gray)",
        "Rotationswinkel": "180",
        "Schlosstyp zur Diebstahlsicherung": "Kensington Slot",
        "Schnittstellen": "2 x HDMI (HDCP 2.2) \u00a6 DisplayPort 1.2 (HDCP 2.2) \u00a6 USB Upstream (Typ B) \u00a6 3 x USB 3.2 Downstream \u00a6 USB 3.2 Downstream (Schnellladung) \u00a6 Audio Line-Out",
        "Schwenkwinkel": "360",
        "Seitenverh\u00e4ltnis": "16:9",
        "Service und Support": "Begrenzte Garantie - 3 Jahre",
        "Sichtbare Bildfl\u00e4che": "80 cm (31.5\")",
        "Stromverbrauch (Aus-Modus)": "0 Watt",
        "Stromverbrauch (typisch)": "60.3 Watt",
        "Stromverbrauch SDR (eingeschaltet)": "40 kWh/1.000 h",
        "Stromverbrauch im Standby-Modus": "0.3 Watt",
        "Transportbreite": "93 cm",
        "Transportgewicht": "14.76 kg",
        "Transporth\u00f6he": "56.3 cm",
        "Transporttiefe": "18.6 cm",
        "Typ": "Lautsprecher - Stereo",
        "VESA-Halterung": "100 x 100 mm",
        "Vertikale Bildwiederholrate": "40 - 60 Hz",
        "Vertikaler Betrachtungswinkel": "178",
        "Zul\u00e4ssige Luftfeuchtigkeit im Betrieb": "20 - 80%"
    },
    "raw_specifications_text": "Display-Typ: LED-hintergrundbeleuchteter LCD-Monitor / TFT-Aktivmatrix\nEnergie Effizienzklasse: Klasse G\nDiagonalabmessung: 81.3 cm (32\")\nSichtbare Bildfl\u00e4che: 80 cm (31.5\")\nIntegrierte Peripherieger\u00e4te: USB Hub\nBildschirmtyp: VA\nSeitenverh\u00e4ltnis: 16:9\nNative Aufl\u00f6sung: 4K 3840 x 2160 bei 60 Hz\nPixelpitch: 0.18159 mm\nPpi: 140\nHelligkeit: 350 cd/m\u00b2\nKontrast: 3000:1 / 50000000:1 (dynamisch)\nFarbunterst\u00fctzung: 16,7 Millionen Farben\nFarbraum: 119% sRGB (CIE 1931), 97% Adobe RGB (CIE 1976), 98% NTSC (CIE 1976)\nReaktionszeit: 4 ms (gray-to-gray)\nVertikale Bildwiederholrate: 40 - 60 Hz\nHorizontale Bildwiederholrate: 30 - 140 kHz\nHorizontaler Betrachtungswinkel: 178\nVertikaler Betrachtungswinkel: 178\nBildschirmbeschichtung: Blendfrei, 3H Hard Coating, Haze 25 %\nHintergrundbeleuchtungs-Technologie: WLED\nOSD-Sprachen: Multilingual\nBesonderheiten: Eco-Mode, PowerSensor, SmartImage, Spielmodus, Low Blue Light Mode, flimmerfreie Technologie, SmartUniformity, Adaptive-Sync-Technologie, Movie Mode, LightSensor, EasyRead, Monitorkalibrierung Delta E<2, Photo Mode\nFarbe: Black Texture\nAbmessungen (Breite x Tiefe x H\u00f6he): 71.4 cm x 28 cm x 64.9 cm - mit Fu\u00df\nGewicht: 11.55 kg\nTyp: Lautsprecher - Stereo\nAusgangsleistung/Kanal: 3 Watt\nSchnittstellen: 2 x HDMI (HDCP 2.2) \u00a6 DisplayPort 1.2 (HDCP 2.2) \u00a6 USB Upstream (Typ B) \u00a6 3 x USB 3.2 Downstream \u00a6 USB 3.2 Downstream (Schnellladung) \u00a6 Audio Line-Out\nEinstellungen der Anzeigeposition: H\u00f6he, Pivot (Rotation), Drehung, Neigung\nNeigungswinkel: -5/+30\nSchwenkwinkel: 360\nRotationswinkel: 180\nH\u00f6heneinstellung: 180 mm\nVESA-Halterung: 100 x 100 mm\nLeistungsmerkmale: Slot f\u00fcr Sicherheitsschloss (Kabelschloss getrennt erh\u00e4ltlich)\nEnthaltene Kabel: DisplayPort-Kabel \u00a6 HDMI-Kabel\nMTBF: 70,000 Stunde(n)\nKennzeichnung: Plug and Play, FCC Klasse B bescheinigt, TUV GS, ICES-003, SEMKO, CB, CCC, TUV Ergo, DDC/CI, RoHS, Bleifrei, CECP, CEL, CU-EAC, BFR-frei, Ukraine, PVC-free, quecksilberfrei, EAEU RoHS\nSchlosstyp zur Diebstahlsicherung: Kensington Slot\nEingangsspannung: Wechselstrom 120/230 V (50/60 Hz)\nLeistungsaufnahme im Ein-Zustand: 40 W\nStromverbrauch SDR (eingeschaltet): 40 kWh/1.000 h\nStromverbrauch (typisch): 60.3 Watt\nStromverbrauch im Standby-Modus: 0.3 Watt\nStromverbrauch (Aus-Modus): 0 Watt\nEin-/Aus-Schalter: Ja\nMitgelieferte Software: Philips SmartControl\nDetails zu Abmessungen & Gewicht: Mit Standfu\u00df (h\u00f6chste Position) - Breite: 71.4 cm - Tiefe: 28 cm - H\u00f6he: 64.9 cm - Gewicht: 11.55 kg \u00a6 Ohne Fu\u00df - Breite: 71.4 cm - Tiefe: 6.2 cm - H\u00f6he: 42.2 cm - Gewicht: 7.54 kg\nTransportbreite: 93 cm\nTransporttiefe: 18.6 cm\nTransporth\u00f6he: 56.3 cm\nTransportgewicht: 14.76 kg\nService und Support: Begrenzte Garantie - 3 Jahre\nMin Betriebstemperatur: 0 \u00b0C\nMax. Betriebstemperatur: 40 \u00b0C\nZul\u00e4ssige Luftfeuchtigkeit im Betrieb: 20 - 80%",
    "reference_file": "offer_reference_1627.json",
    "shop_name": "ElectronicShop24"
}