{
    "html_file": "offer_1257_20.html",
    "name": "Dell S2722DC, 27\"",
    "offer_link": "https://www.taufnaus.de/product/10606693",
    "price": 322.99,
    "raw_specifications": {
        "Abmessungen (Breite x Tiefe x H\u00f6he)": "61.16 cm x 17.472 cm x 40.005 cm - mit Standfu\u00df (niedrigste Position)",
        "Adaptive-Sync Technologie": "AMD FreeSync",
        "Ausgangsleistung/Kanal": "3 Watt",
        "Besonderheiten": "Flimmerfreie Technologie, ohne Quecksilber, arsenfreies Glas, Dell Easy Arrange, Dell ComfortView, an 3 Seiten ohne Blende",
        "Bildschirmbeschichtung": "Blendfrei, Haze 25 %",
        "Bildschirmtyp": "IPS",
        "Details zu Abmessungen & Gewicht": "Mit Standfu\u00df (h\u00f6chste Position) - Breite: 61.16 cm - Tiefe: 17.472 cm - H\u00f6he: 51.005 cm \u00a6 Ohne Fu\u00df - Breite: 61.16 cm - Tiefe: 5.543 cm - H\u00f6he: 36.464 cm - Gewicht: 5.4 kg",
        "Diagonalabmessung": "68.47 cm (27\")",
        "Display-Typ": "LED-hintergrundbeleuchteter LCD-Monitor / TFT-Aktivmatrix",
        "Eingangsspannung": "Wechselstrom 100-240 V (50/60 Hz)",
        "Einstellungen der Anzeigeposition": "H\u00f6he, Pivot (Rotation), Drehung, Neigung",
        "Energie Effizienzklasse": "Klasse E",
        "Enthaltene Kabel": "1 x USB-C 3.2 Gen 1 Kabel - 1.8 m",
        "Farbraum": "99% sRGB",
        "Farbunterst\u00fctzung": "16,7 Millionen Farben",
        "Helligkeit": "350 cd/m\u00b2",
        "Hintergrundbeleuchtungs-Technologie": "WLED Edgelight-Hintergrundbeleuchtung",
        "Horizontale Bildwiederholrate": "30 - 114 kHz",
        "Horizontaler Betrachtungswinkel": "178",
        "H\u00f6heneinstellung": "110 mm",
        "Integrierte Peripherieger\u00e4te": "USB 3.2 Gen 1/USB-C Hub",
        "Kennzeichnung": "Plug and Play, RoHS, BFR-frei, PVC-free",
        "Kontrast": "1000:1",
        "Leistungsaufnahme im Ein-Zustand": "17.7 W",
        "Leistungsmerkmale": "Slot f\u00fcr Sicherheitsschloss (Kabelschloss getrennt erh\u00e4ltlich), integrierte Kabelf\u00fchrung, Unterst\u00fctzung f\u00fcr VESA-Schnittstelle",
        "Max. Betriebstemperatur": "40 \u00b0C",
        "Min Betriebstemperatur": "0 \u00b0C",
        "Native Aufl\u00f6sung": "QHD 2560 x 1440 bei 75 Hz",
        "Neigungswinkel": "-5/+21",
        "Pixelpitch": "0.2331 mm",
        "Ppi": "109",
        "Reaktionszeit": "4 ms (Grau-zu-Grau extrem), 5 ms (gray-to-gray fast), 8 ms (gray-to-gray typical)",
        "Rotationswinkel": "180",
        "Schnittstellen": "2 x HDMI \u00a6 USB-C Upstream/DisplayPort 1.2 Alt Mode mit Spannungsversorgung (bis zu 65 W) \u00a6 USB 3.2 Gen 1 Downstream mit Battery Charging 1.2 \u00a6 USB 3.2 Gen 1 Downstream \u00a6 Audio Line-Out",
        "Schwenkwinkel": "60",
        "Seitenverh\u00e4ltnis": "16:9",
        "Services im Bundle": "3 Jahre Advanced Exchange-Service",
        "Stromverbrauch (Aus-Modus)": "0.2 Watt",
        "Stromverbrauch (max.)": "155 Watt",
        "Stromverbrauch SDR (eingeschaltet)": "17.7 kWh/1.000 h",
        "Stromverbrauch im Standby-Modus": "0.3 Watt",
        "Transportgewicht": "9.78 kg",
        "Typ": "Lautsprecher - Stereo",
        "VESA-Halterung": "100 x 100 mm",
        "Vertikale Bildwiederholrate": "48 - 75 Hz",
        "Vertikaler Betrachtungswinkel": "178",
        "Zul\u00e4ssige Luftfeuchtigkeit im Betrieb": "10 - 80% (nicht kondensierend)"
    },
    "raw_specifications_text": "Display-Typ: LED-hintergrundbeleuchteter LCD-Monitor / TFT-Aktivmatrix\nEnergie Effizienzklasse: Klasse E\nDiagonalabmessung: 68.47 cm (27\")\nAdaptive-Sync Technologie: AMD FreeSync\nIntegrierte Peripherieger\u00e4te: USB 3.2 Gen 1/USB-C Hub\nBildschirmtyp: IPS\nSeitenverh\u00e4ltnis: 16:9\nNative Aufl\u00f6sung: QHD 2560 x 1440 bei 75 Hz\nPixelpitch: 0.2331 mm\nPpi: 109\nHelligkeit: 350 cd/m\u00b2\nKontrast: 1000:1\nFarbunterst\u00fctzung: 16,7 Millionen Farben\nFarbraum: 99% sRGB\nReaktionszeit: 4 ms (Grau-zu-Grau extrem), 5 ms (gray-to-gray fast), 8 ms (gray-to-gray typical)\nVertikale Bildwiederholrate: 48 - 75 Hz\nHorizontale Bildwiederholrate: 30 - 114 kHz\nHorizontaler Betrachtungswinkel: 178\nVertikaler Betrachtungswinkel: 178\nBildschirmbeschichtung: Blendfrei, Haze 25 %\nHintergrundbeleuchtungs-Technologie: WLED Edgelight-Hintergrundbeleuchtung\nBesonderheiten: Flimmerfreie Technologie, ohne Quecksilber, arsenfreies Glas, Dell Easy Arrange, Dell ComfortView, an 3 Seiten ohne Blende\nAbmessungen (Breite x Tiefe x H\u00f6he): 61.16 cm x 17.472 cm x 40.005 cm - mit Standfu\u00df (niedrigste Position)\nTyp: Lautsprecher - Stereo\nAusgangsleistung/Kanal: 3 Watt\nSchnittstellen: 2 x HDMI \u00a6 USB-C Upstream/DisplayPort 1.2 Alt Mode mit Spannungsversorgung (bis zu 65 W) \u00a6 USB 3.2 Gen 1 Downstream mit Battery Charging 1.2 \u00a6 USB 3.2 Gen 1 Downstream \u00a6 Audio Line-Out\nEinstellungen der Anzeigeposition: H\u00f6he, Pivot (Rotation), Drehung, Neigung\nNeigungswinkel: -5/+21\nSchwenkwinkel: 60\nRotationswinkel: 180\nH\u00f6heneinstellung: 110 mm\nVESA-Halterung: 100 x 100 mm\nLeistungsmerkmale: Slot f\u00fcr Sicherheitsschloss (Kabelschloss getrennt erh\u00e4ltlich), integrierte Kabelf\u00fchrung, Unterst\u00fctzung f\u00fcr VESA-Schnittstelle\nEnthaltene Kabel: 1 x USB-C 3.2 Gen 1 Kabel - 1.8 m\nKennzeichnung: Plug and Play, RoHS, BFR-frei, PVC-free\nEingangsspannung: Wechselstrom 100-240 V (50/60 Hz)\nLeistungsaufnahme im Ein-Zustand: 17.7 W\nStromverbrauch SDR (eingeschaltet): 17.7 kWh/1.000 h\nStromverbrauch (max.): 155 Watt\nStromverbrauch im Standby-Modus: 0.3 Watt\nStromverbrauch (Aus-Modus): 0.2 Watt\nDetails zu Abmessungen & Gewicht: Mit Standfu\u00df (h\u00f6chste Position) - Breite: 61.16 cm - Tiefe: 17.472 cm - H\u00f6he: 51.005 cm \u00a6 Ohne Fu\u00df - Breite: 61.16 cm - Tiefe: 5.543 cm - H\u00f6he: 36.464 cm - Gewicht: 5.4 kg\nTransportgewicht: 9.78 kg\nServices im Bundle: 3 Jahre Advanced Exchange-Service\nMin Betriebstemperatur: 0 \u00b0C\nMax. Betriebstemperatur: 40 \u00b0C\nZul\u00e4ssige Luftfeuchtigkeit im Betrieb: 10 - 80% (nicht kondensierend)",
    "reference_file": "offer_reference_1257.json",
    "shop_name": "TaufNaus"
}