{
    "html_file": "offer_1439_9.html",
    "name": "Lenovo ThinkVision S27e-20, 27\"",
    "offer_link": "https://www.alternate.at/Lenovo/ThinkVision-S27e-20-LED-Monitor/html/product/1735616?partner=AtGeizhalsat&campaign=Monitor/Lenovo/1735616",
    "price": 199.9,
    "raw_specifications": {
        "": "AMD FreeSync",
        "Abmessungen": "Breite: 61,25 cm x H\u00f6he: 47,58 cm x Tiefe/L\u00e4nge: 18,25 cm",
        "Anschl\u00fcsse": "1x HDMI-Eingang, 1x VGA-Eingang",
        "Bild": "Format",
        "Bildschirmaufl\u00f6sung": "1.920 x 1.080 Pixel",
        "Bildschirmdiagonale": "69 cm (27 Zoll)",
        "EAN": "0195235830666",
        "Energieeffizienzklasse (SDR)": "G (A - G)",
        "Energieverbauch pro 1000 Stunden (SDR)": "17 kWh",
        "Ergonomie": "TCO-Norm",
        "Farbe": "schwarz",
        "Features": "Low Blue Light Mode",
        "Gewicht": "4,6 kg",
        "Hersteller-Nr.": "62AFKAT2EU",
        "Leistungsaufnahme im Bereitschafts- und Aus-Zustand": "0,2 Watt",
        "Leistungsaufnahme im Ein-Zustand bei Standard-Dynamikumfang (SDR)": "16,6 Watt",
        "Rahmen": "Breite",
        "Serie": "ThinkVision",
        "Stromversorgung": "Eco-Off",
        "Typ": "LED-Monitor",
        "Weitere Informationen": "Die Reaktionszeit von 4 ms wird per Extrem Mode erreicht (6 ms Standard)"
    },
    "raw_specifications_text": "Energieeffizienzklasse (SDR): G (A - G)\nEnergieverbauch pro 1000 Stunden (SDR): 17 kWh\nLeistungsaufnahme im Ein-Zustand bei Standard-Dynamikumfang (SDR): 16,6 Watt\nLeistungsaufnahme im Bereitschafts- und Aus-Zustand: 0,2 Watt\nBildschirmdiagonale: 69 cm (27 Zoll)\nBildschirmaufl\u00f6sung: 1.920 x 1.080 Pixel\nTyp: LED-Monitor\nFarbe: schwarz\nEAN: 0195235830666\nHersteller-Nr.: 62AFKAT2EU\nSerie: ThinkVision\nBild: Format\n: AMD FreeSync\nRahmen: Breite\nAnschl\u00fcsse: 1x HDMI-Eingang, 1x VGA-Eingang\nErgonomie: TCO-Norm\nStromversorgung: Eco-Off\nFeatures: Low Blue Light Mode\nWeitere Informationen: Die Reaktionszeit von 4 ms wird per Extrem Mode erreicht (6 ms Standard)\nAbmessungen: Breite: 61,25 cm x H\u00f6he: 47,58 cm x Tiefe/L\u00e4nge: 18,25 cm\nGewicht: 4,6 kg",
    "reference_file": "offer_reference_1439.json",
    "shop_name": "Alternate.at"
}