{
    "html_file": "offer_198_1.html",
    "name": "Fujitsu P-Line P2711 TE QHD, 27\"",
    "offer_link": "https://www.proshop.at/Bildschirm/Fujitsu-27-Bildschirm-P2711-TE-LED-monitor-QHD-27-Grey-5-ms/3145372?utm_source=geizhals&utm_medium=cpc&utm_campaign=pricesite",
    "price": 735.78,
    "raw_specifications": {
        "Abmessungen (Breite x Tiefe x H\u00f6he)": "61.36 cm x 5.94 cm x 36.27 cm",
        "Audioeingang": "Stereo-Mikrofon",
        "Ausgangsleistung/Kanal": "2 Watt",
        "Besonderheiten": "Eco-Mode, Overdrive-Technologie, Auto Brightness Control, ECO-Taste, DisplayView, Advanced Contrast Ratio (ACR), Low Blue Light Mode, Auto Pivot, Workplace Lighting Guide, 24/7 Betriebsmodus, Black Level, DICOM Compliant, Delta E\u22642-Farbgenauigkeit",
        "Bildschirmbeschichtung": "Blendfrei, 3H Hard Coating",
        "Bildschirmtyp": "IPS",
        "Daisy-Chaining": "Ja",
        "Details zu Abmessungen & Gewicht": "Mit Fu\u00df - Breite: 61.36 cm - Tiefe: 22.53 cm - H\u00f6he: 51.225 cm",
        "Diagonalabmessung": "68.5 cm (27\")",
        "Display-Typ": "LED-hintergrundbeleuchteter LCD-Monitor / TFT-Aktivmatrix",
        "EAN": "4065221781172",
        "ENERGY STAR zertifiziert": "Ja",
        "ENERGY STAR-Version": "8.0",
        "EPEAT-kompatibel": "EPEAT Gold",
        "Eingangsanschl\u00fcsse": "HDMI, DisplayPort, USB-C",
        "Eingangsspannung": "Wechselstrom 100-240 V (50/60 Hz)",
        "Energie Effizienzklasse": "Klasse E",
        "Energierverbrauch Sleep": "0.22 Watt",
        "Enthaltene Kabel": "1 x DisplayPort-Kabel - 1.8 m  1 x Kabel USB-C auf USB-C - 1 m  1 x USB-Kabel Typ A auf Typ B - 1.8 m",
        "Ethernet integriert": "Ja",
        "Farbe": "Marble Gray",
        "Farbraum": "99% sRGB",
        "Farbunterst\u00fctzung": "16,7 Millionen Farben (8-Bit)",
        "Ger\u00e4tetyp": "LED-hintergrundbeleuchteter LCD-Monitor - 68.5 cm (27\")",
        "Gewicht": "5.66 kg",
        "Helligkeit": "350 cd/m\u00b2",
        "Hersteller": "Fujitsu",
        "Hintergrundbeleuchtungs-Technologie": "LED-Hintergrundbeleuchtung",
        "Horizontale Bildwiederholrate": "30 - 100 kHz",
        "Horizontaler Betrachtungswinkel": "178",
        "Integrierte Peripherieger\u00e4te": "KVM-Switch, Pr\u00e4senzsensor, USB 3.2 Gen 1/USB-C Hub",
        "Kennzeichnung": "FCC Klasse B bescheinigt, TUV GS, DDC/CI, RoHS, WEEE, S Mark, cTUVus, Directive 2004/108/EEC, VESA MIS-D 100 C, TUV Rheinland Low Blue Light Certification, TUV Rheinland Flicker Free Certification, EN 62368-1, ISO 9241-307 Class 1",
        "Kontrast": "1000:1 / 20000000:1 (dynamisch)",
        "Leistungsmerkmale": "Slot f\u00fcr Sicherheitsschloss (Kabelschloss getrennt erh\u00e4ltlich)",
        "Modell": "S26361-K1703-V140",
        "Native Aufl\u00f6sung": "QHD 2560 x 1440",
        "Neigungswinkel": "-5/+35",
        "Pixelpitch": "0.233 mm",
        "Produktbeschreibung": "Fujitsu P2711 TE - LED-Monitor - QHD - 68.5 cm (27\")",
        "Reaktionszeit": "5 ms",
        "Rotationswinkel": "90",
        "Schlosstyp zur Diebstahlsicherung": "Kensington Slot",
        "Schnittstellen": "DisplayPort 1.2  HDMI 1.4  Kopfh\u00f6rer (Mini-Klinkenstecker)  3 x USB 3.2 Downstream  USB-C 3.2 Downstream  DisplayPort-Ausgang (f\u00fcr Daisy-Chain)  USB 3.2 Gen 1 Upstream (Typ B)  USB-C Upstream (bis zu 95 W)  LAN",
        "Schwenkwinkel": "345",
        "Seitenverh\u00e4ltnis": "16:9",
        "Spannung": "Wechselstrom 100-240 V (50/60 Hz)",
        "Stromverbrauch (typisch)": "21.88 Watt",
        "Stromverbrauch im Standby-Modus": "0.29 Watt",
        "Transportgewicht": "7.75 kg",
        "Typ": "Lautsprecher - Stereo",
        "USB-Spannungsversorgung": "95 Watt",
        "Umweltschutzstandards": "ENERGY STAR-qualifiziert EPEAT Gold",
        "Vertikale Bildwiederholrate": "48 - 76 Hz",
        "Vertikaler Betrachtungswinkel": "178",
        "Waren-Nr.": "3145372",
        "Zum Hersteller": "www.fujitsu.com/global/"
    },
    "raw_specifications_text": "Hersteller: Fujitsu\nWaren-Nr.: 3145372\nModell: S26361-K1703-V140\nEAN: 4065221781172\nZum Hersteller: www.fujitsu.com/global/\nProduktbeschreibung: Fujitsu P2711 TE - LED-Monitor - QHD - 68.5 cm (27\")\nGer\u00e4tetyp: LED-hintergrundbeleuchteter LCD-Monitor - 68.5 cm (27\")\nEnergie Effizienzklasse: Klasse E\nDaisy-Chaining: Ja\nLeistungsmerkmale: Slot f\u00fcr Sicherheitsschloss (Kabelschloss getrennt erh\u00e4ltlich)\nBildschirmtyp: IPS\nSeitenverh\u00e4ltnis: 16:9\nNative Aufl\u00f6sung: QHD 2560 x 1440\nPixelpitch: 0.233 mm\nHelligkeit: 350 cd/m\u00b2\nKontrast: 1000:1 / 20000000:1 (dynamisch)\nReaktionszeit: 5 ms\nFarbunterst\u00fctzung: 16,7 Millionen Farben (8-Bit)\nFarbraum: 99% sRGB\nEingangsanschl\u00fcsse: HDMI, DisplayPort, USB-C\nEthernet integriert: Ja\nAudioeingang: Stereo-Mikrofon\nBildschirmbeschichtung: Blendfrei, 3H Hard Coating\nSpannung: Wechselstrom 100-240 V (50/60 Hz)\nFarbe: Marble Gray\nAbmessungen (Breite x Tiefe x H\u00f6he): 61.36 cm x 5.94 cm x 36.27 cm\nGewicht: 5.66 kg\nUmweltschutzstandards: ENERGY STAR-qualifiziert EPEAT Gold\nKennzeichnung: FCC Klasse B bescheinigt, TUV GS, DDC/CI, RoHS, WEEE, S Mark, cTUVus, Directive 2004/108/EEC, VESA MIS-D 100 C, TUV Rheinland Low Blue Light Certification, TUV Rheinland Flicker Free Certification, EN 62368-1, ISO 9241-307 Class 1\nDisplay-Typ: LED-hintergrundbeleuchteter LCD-Monitor / TFT-Aktivmatrix\nDiagonalabmessung: 68.5 cm (27\")\nIntegrierte Peripherieger\u00e4te: KVM-Switch, Pr\u00e4senzsensor, USB 3.2 Gen 1/USB-C Hub\nUSB-Spannungsversorgung: 95 Watt\nVertikale Bildwiederholrate: 48 - 76 Hz\nHorizontale Bildwiederholrate: 30 - 100 kHz\nHorizontaler Betrachtungswinkel: 178\nVertikaler Betrachtungswinkel: 178\nHintergrundbeleuchtungs-Technologie: LED-Hintergrundbeleuchtung\nBesonderheiten: Eco-Mode, Overdrive-Technologie, Auto Brightness Control, ECO-Taste, DisplayView, Advanced Contrast Ratio (ACR), Low Blue Light Mode, Auto Pivot, Workplace Lighting Guide, 24/7 Betriebsmodus, Black Level, DICOM Compliant, Delta E\u22642-Farbgenauigkeit\nTyp: Lautsprecher - Stereo\nAusgangsleistung/Kanal: 2 Watt\nSchnittstellen: DisplayPort 1.2  HDMI 1.4  Kopfh\u00f6rer (Mini-Klinkenstecker)  3 x USB 3.2 Downstream  USB-C 3.2 Downstream  DisplayPort-Ausgang (f\u00fcr Daisy-Chain)  USB 3.2 Gen 1 Upstream (Typ B)  USB-C Upstream (bis zu 95 W)  LAN\nNeigungswinkel: -5/+35\nSchwenkwinkel: 345\nRotationswinkel: 90\nEnthaltene Kabel: 1 x DisplayPort-Kabel - 1.8 m  1 x Kabel USB-C auf USB-C - 1 m  1 x USB-Kabel Typ A auf Typ B - 1.8 m\nSchlosstyp zur Diebstahlsicherung: Kensington Slot\nEingangsspannung: Wechselstrom 100-240 V (50/60 Hz)\nStromverbrauch (typisch): 21.88 Watt\nStromverbrauch im Standby-Modus: 0.29 Watt\nEnergierverbrauch Sleep: 0.22 Watt\nDetails zu Abmessungen & Gewicht: Mit Fu\u00df - Breite: 61.36 cm - Tiefe: 22.53 cm - H\u00f6he: 51.225 cm\nTransportgewicht: 7.75 kg\nEPEAT-kompatibel: EPEAT Gold\nENERGY STAR zertifiziert: Ja\nENERGY STAR-Version: 8.0",
    "reference_file": "offer_reference_198.json",
    "shop_name": "Proshop.at"
}