{
    "html_file": "offer_465_43.html",
    "name": "HP E27q G5, 27\"",
    "offer_link": "https://www.proshop.at/Bildschirm/HP-27-Bildschirm-E27Q-G5-Silver-5-ms/3150676?utm_source=geizhals&utm_medium=cpc&utm_campaign=pricesite",
    "price": 306.83,
    "raw_specifications": {
        "Abmessungen (Breite x Tiefe x H\u00f6he)": "61.4 cm x 22.7 cm x 54.7 cm - mit Fu\u00df",
        "Abmessungen (Breite x Tiefe x H\u00f6he) - mit Fu\u00df": "61.4 cm x 22.7 cm x 54.7 cm",
        "Besonderheiten": "Low Blue Light Mode, flimmerfreie Technologie, 3 Side Borderless Design, HP Eye Ease",
        "Bildschirmbeschichtung": "Blendfrei, 3H Hard Coating, Haze 25 %",
        "Bildschirmtyp": "IPS",
        "Details zu Abmessungen & Gewicht": "Mit Fu\u00df - Breite: 61.4 cm - Tiefe: 22.7 cm - H\u00f6he: 54.7 cm - Gewicht: 7.08 kg  Ohne Fu\u00df - Breite: 61.34 cm - Tiefe: 4.83 cm - H\u00f6he: 36.46 cm - Gewicht: 4.94 kg",
        "Diagonalabmessung": "68.6 cm (27\")",
        "Display-Typ": "LED-hintergrundbeleuchteter LCD-Monitor / TFT-Aktivmatrix",
        "ENERGY STAR zertifiziert": "Ja",
        "Eingangsanschl\u00fcsse": "HDMI, DisplayPort",
        "Eingangsspannung": "Wechselstrom 100-240 V (50/60 Hz)",
        "Einstellungen der Anzeigeposition": "H\u00f6he, Pivot (Rotation), Drehung, Neigung",
        "Energie Effizienzklasse": "Klasse E",
        "Energieverbrauch pro Jahr": "21 kWh",
        "Farbe": "Schwarz, Schwarz und Silber (St\u00e4nder)",
        "Farbraum": "99% sRGB",
        "Farbtemperatur": "6500K",
        "Farbunterst\u00fctzung": "16,7 Millionen Farben (8-Bit)",
        "Ger\u00e4tetyp": "LED-hintergrundbeleuchteter LCD-Monitor - 68.6 cm (27\")",
        "Gewicht": "7.08 kg",
        "Helligkeit": "350 cd/m\u00b2",
        "Hersteller": "HP",
        "Hintergrundbeleuchtungs-Technologie": "Edge-LED-Beleuchtung",
        "Horizontale Bildwiederholrate": "30 - 115 kHz",
        "Horizontaler Betrachtungswinkel": "178",
        "H\u00f6heneinstellung": "150 mm",
        "Integrierte Peripherieger\u00e4te": "USB Hub",
        "Kennzeichnung": "VCCI, BSMI, GS, NOM, TUV S, CB, CCC, PSB, FCC, ISO 9241-307, KCC, WEEE, PSE Mark, cTUVus, E-Standby, KC, CECP, CEL, EAC, ISC, SEPA, BIS, ICE, NRCS, Ukraine, UAE, TGM, TCO Certified Edge",
        "Kontrast": "1000:1 / 8000000:1 (dynamisch)",
        "Lebensdauer der Beleuchtung": "30,000 Stunden",
        "Leistungsaufnahme im Ein-Zustand": "21 W",
        "Leistungsmerkmale": "Slot f\u00fcr Sicherheitsschloss (Kabelschloss getrennt erh\u00e4ltlich), abnehmbarer St\u00e4nder",
        "Lokalisierung": "Englisch / Europa",
        "Mitgelieferte Software": "HP Display Center",
        "Modell": "6N6F2A5#ABB",
        "Native Aufl\u00f6sung": "QHD 2560 x 1440 bei 75 Hz",
        "Neigungswinkel": "-5/+20",
        "OSD-Sprachen": "Chinesisch (tradionell), Chinesisch (vereinfacht), Englisch, Deutsch, Franz\u00f6sisch, Italienisch, Portugiesisch, Russisch, Spanisch, Holl\u00e4ndisch, Japanisch",
        "Pixelpitch": "0.23 mm",
        "Ppi": "109",
        "Produktbeschreibung": "HP E27Q G5 PVC Free - E-Series - LED-Monitor - QHD - 68.6 cm (27\")",
        "Reaktionszeit": "5 ms (grau zu grau mit \u00dcbersteuerung)",
        "Rotationswinkel": "180",
        "Schlosstyp zur Diebstahlsicherung": "Kensington Slot",
        "Schnittstellen": "DisplayPort 1.2 (HDCP)  HDMI 1.4 (HDCP)  3 x USB 3.2 Gen 1 (Typ A)  USB 3.2 Gen 1 (Typ A (nur Strom))  USB-B",
        "Schwenkwinkel": "90",
        "Seitenverh\u00e4ltnis": "16:9",
        "Spannung": "Wechselstrom 100-240 V (50/60 Hz)",
        "Stromverbrauch (Aus-Modus)": "0.3 Watt",
        "Stromverbrauch (max.)": "60 Watt",
        "Stromverbrauch (typisch)": "35 Watt",
        "Stromverbrauch SDR (eingeschaltet)": "21 kWh/1.000 h",
        "Stromverbrauch im Standby-Modus": "0.5 Watt",
        "TCO-zertifiziert": "TCO Certified Edge Displays, TCO Certified Displays 9",
        "Transportbreite": "69.9 cm",
        "Transportgewicht": "11 kg",
        "Transporth\u00f6he": "44.6 cm",
        "Transporttiefe": "16 cm",
        "Umweltschutzstandards": "TCO Certified Edge Displays, TCO Certified Displays 9, ENERGY STAR-qualifiziert",
        "VESA-Halterung": "100 x 100 mm",
        "Vertikale Bildwiederholrate": "50 - 75 Hz",
        "Vertikaler Betrachtungswinkel": "178",
        "Waren-Nr.": "3150676",
        "Zum Hersteller": "www.hp.com"
    },
    "raw_specifications_text": "Hersteller: HP\nWaren-Nr.: 3150676\nModell: 6N6F2A5#ABB\nZum Hersteller: www.hp.com\nProduktbeschreibung: HP E27Q G5 PVC Free - E-Series - LED-Monitor - QHD - 68.6 cm (27\")\nGer\u00e4tetyp: LED-hintergrundbeleuchteter LCD-Monitor - 68.6 cm (27\")\nEnergie Effizienzklasse: Klasse E\nEnergieverbrauch pro Jahr: 21 kWh\nLeistungsaufnahme im Ein-Zustand: 21 W\nLeistungsmerkmale: Slot f\u00fcr Sicherheitsschloss (Kabelschloss getrennt erh\u00e4ltlich), abnehmbarer St\u00e4nder\nBildschirmtyp: IPS\nSeitenverh\u00e4ltnis: 16:9\nNative Aufl\u00f6sung: QHD 2560 x 1440 bei 75 Hz\nPixelpitch: 0.23 mm\nHelligkeit: 350 cd/m\u00b2\nKontrast: 1000:1 / 8000000:1 (dynamisch)\nReaktionszeit: 5 ms (grau zu grau mit \u00dcbersteuerung)\nFarbunterst\u00fctzung: 16,7 Millionen Farben (8-Bit)\nFarbraum: 99% sRGB\nEingangsanschl\u00fcsse: HDMI, DisplayPort\nEinstellungen der Anzeigeposition: H\u00f6he, Pivot (Rotation), Drehung, Neigung\nBildschirmbeschichtung: Blendfrei, 3H Hard Coating, Haze 25 %\nSpannung: Wechselstrom 100-240 V (50/60 Hz)\nFarbe: Schwarz, Schwarz und Silber (St\u00e4nder)\nAbmessungen (Breite x Tiefe x H\u00f6he) - mit Fu\u00df: 61.4 cm x 22.7 cm x 54.7 cm\nGewicht: 7.08 kg\nLokalisierung: Englisch / Europa\nUmweltschutzstandards: TCO Certified Edge Displays, TCO Certified Displays 9, ENERGY STAR-qualifiziert\nKennzeichnung: VCCI, BSMI, GS, NOM, TUV S, CB, CCC, PSB, FCC, ISO 9241-307, KCC, WEEE, PSE Mark, cTUVus, E-Standby, KC, CECP, CEL, EAC, ISC, SEPA, BIS, ICE, NRCS, Ukraine, UAE, TGM, TCO Certified Edge\nDisplay-Typ: LED-hintergrundbeleuchteter LCD-Monitor / TFT-Aktivmatrix\nDiagonalabmessung: 68.6 cm (27\")\nIntegrierte Peripherieger\u00e4te: USB Hub\nPpi: 109\nVertikale Bildwiederholrate: 50 - 75 Hz\nHorizontale Bildwiederholrate: 30 - 115 kHz\nHorizontaler Betrachtungswinkel: 178\nVertikaler Betrachtungswinkel: 178\nHintergrundbeleuchtungs-Technologie: Edge-LED-Beleuchtung\nFarbtemperatur: 6500K\nOSD-Sprachen: Chinesisch (tradionell), Chinesisch (vereinfacht), Englisch, Deutsch, Franz\u00f6sisch, Italienisch, Portugiesisch, Russisch, Spanisch, Holl\u00e4ndisch, Japanisch\nBesonderheiten: Low Blue Light Mode, flimmerfreie Technologie, 3 Side Borderless Design, HP Eye Ease\nAbmessungen (Breite x Tiefe x H\u00f6he): 61.4 cm x 22.7 cm x 54.7 cm - mit Fu\u00df\nSchnittstellen: DisplayPort 1.2 (HDCP)  HDMI 1.4 (HDCP)  3 x USB 3.2 Gen 1 (Typ A)  USB 3.2 Gen 1 (Typ A (nur Strom))  USB-B\nNeigungswinkel: -5/+20\nSchwenkwinkel: 90\nRotationswinkel: 180\nH\u00f6heneinstellung: 150 mm\nVESA-Halterung: 100 x 100 mm\nLebensdauer der Beleuchtung: 30,000 Stunden\nSchlosstyp zur Diebstahlsicherung: Kensington Slot\nEingangsspannung: Wechselstrom 100-240 V (50/60 Hz)\nStromverbrauch SDR (eingeschaltet): 21 kWh/1.000 h\nStromverbrauch (typisch): 35 Watt\nStromverbrauch (max.): 60 Watt\nStromverbrauch im Standby-Modus: 0.5 Watt\nStromverbrauch (Aus-Modus): 0.3 Watt\nMitgelieferte Software: HP Display Center\nDetails zu Abmessungen & Gewicht: Mit Fu\u00df - Breite: 61.4 cm - Tiefe: 22.7 cm - H\u00f6he: 54.7 cm - Gewicht: 7.08 kg  Ohne Fu\u00df - Breite: 61.34 cm - Tiefe: 4.83 cm - H\u00f6he: 36.46 cm - Gewicht: 4.94 kg\nTransportbreite: 69.9 cm\nTransporttiefe: 16 cm\nTransporth\u00f6he: 44.6 cm\nTransportgewicht: 11 kg\nTCO-zertifiziert: TCO Certified Edge Displays, TCO Certified Displays 9\nENERGY STAR zertifiziert: Ja",
    "reference_file": "offer_reference_465.json",
    "shop_name": "Proshop.at"
}