{
    "html_file": "offer_2135_4.html",
    "name": "Philips E-line 245E1S, 23.8\"",
    "offer_link": "https://www.amazon.de/dp/B07SPCWZHP?linkCode=xm2&camp=2025&creative=165953&smid=A3JWKAKR8XB7XF&creativeASIN=B07SPCWZHP&tag=geizhals1-21",
    "price": 147.23,
    "raw_specifications": {
        "ASIN": "B07SPCWZHP",
        "Amazon Bestseller-Rang": "Nr. 23,922 in Computer & Zubeh\u00f6r (Siehe Top 100 in Computer & Zubeh\u00f6r)  Nr. 526 in Monitore",
        "Anzahl HDMI Schnittstellen": "\u200e1",
        "Anzahl USB 2.0 Schnittstellen": "\u200e2",
        "Anzahl VGA Schnittstellen": "\u200e1",
        "Artikelgewicht": "\u200e2,56 Kilograms",
        "Batterien enthalten": "\u200eNein",
        "Bildschirmaufl\u00f6sung": "\u200e2560 x 1440 Pixel",
        "Display-Gr\u00f6\u00dfe": "\u200e23,8 Zoll",
        "Durchschnittliche Kundenbewertung": "4,5  4,5 von 5 Sternen    \n    353 Sternebewertungen   \n\n\n 4,5 von 5 Sternen",
        "Farbe": "\u200eSchwarz",
        "Garantierte Software-Updates bis": "\u200eunbekannt",
        "Hersteller": "\u200ePhilips",
        "Im Angebot von Amazon.de seit": "15. Mai 2019",
        "L\u00f6sung": "\u200e2560 x 1440 Pixels",
        "Marke": "\u200ePhilips",
        "Modell/Serie": "\u200e245E1S/00",
        "Modellnummer": "\u200e245E1S-00",
        "Produktabmessungen": "\u200e5,4 x 1,95 x 4,14 cm; 2,56 Kilogramm",
        "Prozessortyp": "\u200eOthers",
        "Volt": "\u200e240 Volt",
        "Watt": "\u200e17.94 Watt"
    },
    "raw_specifications_text": "Marke: \u200ePhilips\nHersteller: \u200ePhilips\nModell/Serie: \u200e245E1S/00\nProduktabmessungen: \u200e5,4 x 1,95 x 4,14 cm; 2,56 Kilogramm\nModellnummer: \u200e245E1S-00\nFarbe: \u200eSchwarz\nDisplay-Gr\u00f6\u00dfe: \u200e23,8 Zoll\nBildschirmaufl\u00f6sung: \u200e2560 x 1440 Pixel\nL\u00f6sung: \u200e2560 x 1440 Pixels\nProzessortyp: \u200eOthers\nAnzahl USB 2.0 Schnittstellen: \u200e2\nAnzahl HDMI Schnittstellen: \u200e1\nAnzahl VGA Schnittstellen: \u200e1\nVolt: \u200e240 Volt\nWatt: \u200e17.94 Watt\nBatterien enthalten: \u200eNein\nArtikelgewicht: \u200e2,56 Kilograms\nGarantierte Software-Updates bis: \u200eunbekannt\nASIN: B07SPCWZHP\nDurchschnittliche Kundenbewertung: 4,5  4,5 von 5 Sternen    \n    353 Sternebewertungen   \n\n\n 4,5 von 5 Sternen\nAmazon Bestseller-Rang: Nr. 23,922 in Computer & Zubeh\u00f6r (Siehe Top 100 in Computer & Zubeh\u00f6r)  Nr. 526 in Monitore\nIm Angebot von Amazon.de seit: 15. Mai 2019",
    "reference_file": "offer_reference_2135.json",
    "shop_name": "Amazon.at"
}