{
    "html_file": "offer_841_17.html",
    "name": "ASUS TUF Gaming VG27VQM, 27\"",
    "offer_link": "https://www.proshop.at/Bildschirm/ASUS-27-Bildschirm-TUF-Gaming-VG27VQM-Black-1-ms-AMD-FreeSync-Premium/3171910?utm_source=geizhals&utm_medium=cpc&utm_campaign=pricesite",
    "price": 276.05,
    "raw_specifications": {
        "Abmessungen (Breite x Tiefe x H\u00f6he)": "60.9 cm x 21.12 cm x 38.69 cm - mit Fu\u00df",
        "Abmessungen (Breite x Tiefe x H\u00f6he) - mit Fu\u00df": "60.9 cm x 21.12 cm x 38.69 cm",
        "Adaptive-Sync Technologie": "AMD FreeSync Premium",
        "Ausgangsleistung/Kanal": "2 Watt",
        "Besonderheiten": "HDCP, Overdrive-Technologie, Trace Free Technology, ASUS Smart Contrast Ratio (ASCR), ASUS GamePlus, flimmerfreie Technologie, Adaptive-Sync-Technologie, ASUS GameVisual Technology, GameFast Input Technology, ASUS Extreme Low Motion Blur technology, Low Blue Light-Technologie, an 3 Seiten ohne Blende, Shadow Boost-Technologie, ASUS Extreme Low Motion Blur Sync, Display Widget",
        "Bildschirmbeschichtung": "Blendfrei",
        "Bildschirmtyp": "VA",
        "Details zu Abmessungen & Gewicht": "Ohne Fu\u00df - Breite: 60.9 cm - Tiefe: 4.4 cm - H\u00f6he: 35.99 cm - Gewicht: 3.77 kg  Mit Fu\u00df - Breite: 60.9 cm - Tiefe: 21.12 cm - H\u00f6he: 38.69 cm - Gewicht: 6 kg",
        "Diagonalabmessung": "68.5 cm (27\")",
        "Display-Typ": "LED-hintergrundbeleuchteter LCD-Monitor / TFT-Aktivmatrix",
        "EAN": "4711081714033",
        "Eingangsanschl\u00fcsse": "2xHDMI, DisplayPort",
        "Eingangsspannung": "Wechselstrom 100-240 V",
        "Einstellungen der Anzeigeposition": "H\u00f6he, Drehung, Neigung",
        "Farbe": "Schwarz",
        "Farbraum": "105% sRGB",
        "Farbunterst\u00fctzung": "16,7 Millionen Farben",
        "Gaming": "Ja",
        "Ger\u00e4tetyp": "LED-hintergrundbeleuchteter LCD-Monitor - 68.5 cm (27\")",
        "Geschwungener Bildschirm": "Ja (1500R)",
        "Gewicht": "6 kg",
        "HDR-Format": "HDR10",
        "HDR-f\u00e4hig": "HDR10",
        "Helligkeit": "350 cd/m\u00b2",
        "Hersteller": "ASUS",
        "Hintergrundbeleuchtungs-Technologie": "LED-Hintergrundbeleuchtung",
        "Horizontaler Betrachtungswinkel": "178",
        "H\u00f6heneinstellung": "120 mm",
        "Integrierte Peripherieger\u00e4te": "USB 3.2 Gen 1 Hub",
        "Kennzeichnung": "VCCI, BSMI, CB, CCC, PSB, FCC, RoHS, KCC, PSE Mark, cTUVus, MEPS, J-MOSS, E-Standby, UkrSEPRO, ERP, CEL, RCM, TUV Rheinland Low Blue Light Certification, CU, TUV Rheinland Flicker Free Certification, HDCP 2.2, ICES 003",
        "Kontrast": "3000:1 / 100000000:1 (dynamisch)",
        "Leistungsmerkmale": "Slot f\u00fcr Sicherheitsschloss (Kabelschloss getrennt erh\u00e4ltlich)",
        "Modell": "90LM0510-B03E70",
        "Native Aufl\u00f6sung": "Full HD (1080p) 1920 x 1080 bei 240 Hz",
        "Neigungswinkel": "-5/+25",
        "OSD-Sprachen": "Ungarisch, Tschechisch, Kroatisch, Indonesisch, Thail\u00e4ndisch, Chinesisch (tradionell), Chinesisch (vereinfacht), Ukrainisch, Englisch, Deutsch, Franz\u00f6sisch, Italienisch, Portugiesisch, Polnisch, Russisch, Spanisch, Holl\u00e4ndisch, T\u00fcrkisch, Rum\u00e4nisch, Japanisch, Koreanisch, Persisch",
        "Pixelpitch": "0.311 mm",
        "Produktbeschreibung": "ASUS TUF Gaming VG27VQM - LED-Monitor - gebogen - Full HD (1080p) - 68.5 cm (27\") - HDR",
        "Reaktionszeit": "1 ms (MPRT), 5 ms (Grau-zu-Grau)",
        "Schlosstyp zur Diebstahlsicherung": "Kensington Slot",
        "Schnittstellen": "2 x HDMI  DisplayPort 1.2  Kopfh\u00f6rer  2 x USB 3.2 Gen 1 Downstream  USB 3.2 Gen 1 Upstream",
        "Schwenkwinkel": "180",
        "Seitenverh\u00e4ltnis": "16:9",
        "Spannung": "Wechselstrom 100-240 V",
        "Stromverbrauch (Aus-Modus)": "0.3 Watt",
        "Stromverbrauch (typisch)": "18.2 Watt",
        "Stromverbrauch im Standby-Modus": "0.5 Watt",
        "Transportbreite": "68.2 cm",
        "Transporth\u00f6he": "44.8 cm",
        "Transporttiefe": "20.9 cm",
        "Typ": "Lautsprecher - Stereo",
        "VESA-Halterung": "100 x 100 mm",
        "Vertikaler Betrachtungswinkel": "178",
        "Waren-Nr.": "3171910",
        "Zum Hersteller": "www.asus.com/"
    },
    "raw_specifications_text": "Hersteller: ASUS\nWaren-Nr.: 3171910\nModell: 90LM0510-B03E70\nEAN: 4711081714033\nZum Hersteller: www.asus.com/\nProduktbeschreibung: ASUS TUF Gaming VG27VQM - LED-Monitor - gebogen - Full HD (1080p) - 68.5 cm (27\") - HDR\nGer\u00e4tetyp: LED-hintergrundbeleuchteter LCD-Monitor - 68.5 cm (27\")\nGeschwungener Bildschirm: Ja (1500R)\nAdaptive-Sync Technologie: AMD FreeSync Premium\nLeistungsmerkmale: Slot f\u00fcr Sicherheitsschloss (Kabelschloss getrennt erh\u00e4ltlich)\nBildschirmtyp: VA\nSeitenverh\u00e4ltnis: 16:9\nNative Aufl\u00f6sung: Full HD (1080p) 1920 x 1080 bei 240 Hz\nPixelpitch: 0.311 mm\nHelligkeit: 350 cd/m\u00b2\nKontrast: 3000:1 / 100000000:1 (dynamisch)\nHDR-f\u00e4hig: HDR10\nReaktionszeit: 1 ms (MPRT), 5 ms (Grau-zu-Grau)\nGaming: Ja\nFarbunterst\u00fctzung: 16,7 Millionen Farben\nFarbraum: 105% sRGB\nEingangsanschl\u00fcsse: 2xHDMI, DisplayPort\nEinstellungen der Anzeigeposition: H\u00f6he, Drehung, Neigung\nBildschirmbeschichtung: Blendfrei\nSpannung: Wechselstrom 100-240 V\nFarbe: Schwarz\nAbmessungen (Breite x Tiefe x H\u00f6he) - mit Fu\u00df: 60.9 cm x 21.12 cm x 38.69 cm\nGewicht: 6 kg\nKennzeichnung: VCCI, BSMI, CB, CCC, PSB, FCC, RoHS, KCC, PSE Mark, cTUVus, MEPS, J-MOSS, E-Standby, UkrSEPRO, ERP, CEL, RCM, TUV Rheinland Low Blue Light Certification, CU, TUV Rheinland Flicker Free Certification, HDCP 2.2, ICES 003\nDisplay-Typ: LED-hintergrundbeleuchteter LCD-Monitor / TFT-Aktivmatrix\nDiagonalabmessung: 68.5 cm (27\")\nIntegrierte Peripherieger\u00e4te: USB 3.2 Gen 1 Hub\nHDR-Format: HDR10\nHorizontaler Betrachtungswinkel: 178\nVertikaler Betrachtungswinkel: 178\nHintergrundbeleuchtungs-Technologie: LED-Hintergrundbeleuchtung\nOSD-Sprachen: Ungarisch, Tschechisch, Kroatisch, Indonesisch, Thail\u00e4ndisch, Chinesisch (tradionell), Chinesisch (vereinfacht), Ukrainisch, Englisch, Deutsch, Franz\u00f6sisch, Italienisch, Portugiesisch, Polnisch, Russisch, Spanisch, Holl\u00e4ndisch, T\u00fcrkisch, Rum\u00e4nisch, Japanisch, Koreanisch, Persisch\nBesonderheiten: HDCP, Overdrive-Technologie, Trace Free Technology, ASUS Smart Contrast Ratio (ASCR), ASUS GamePlus, flimmerfreie Technologie, Adaptive-Sync-Technologie, ASUS GameVisual Technology, GameFast Input Technology, ASUS Extreme Low Motion Blur technology, Low Blue Light-Technologie, an 3 Seiten ohne Blende, Shadow Boost-Technologie, ASUS Extreme Low Motion Blur Sync, Display Widget\nAbmessungen (Breite x Tiefe x H\u00f6he): 60.9 cm x 21.12 cm x 38.69 cm - mit Fu\u00df\nTyp: Lautsprecher - Stereo\nAusgangsleistung/Kanal: 2 Watt\nSchnittstellen: 2 x HDMI  DisplayPort 1.2  Kopfh\u00f6rer  2 x USB 3.2 Gen 1 Downstream  USB 3.2 Gen 1 Upstream\nNeigungswinkel: -5/+25\nSchwenkwinkel: 180\nH\u00f6heneinstellung: 120 mm\nVESA-Halterung: 100 x 100 mm\nSchlosstyp zur Diebstahlsicherung: Kensington Slot\nEingangsspannung: Wechselstrom 100-240 V\nStromverbrauch (typisch): 18.2 Watt\nStromverbrauch im Standby-Modus: 0.5 Watt\nStromverbrauch (Aus-Modus): 0.3 Watt\nDetails zu Abmessungen & Gewicht: Ohne Fu\u00df - Breite: 60.9 cm - Tiefe: 4.4 cm - H\u00f6he: 35.99 cm - Gewicht: 3.77 kg  Mit Fu\u00df - Breite: 60.9 cm - Tiefe: 21.12 cm - H\u00f6he: 38.69 cm - Gewicht: 6 kg\nTransportbreite: 68.2 cm\nTransporttiefe: 20.9 cm\nTransporth\u00f6he: 44.8 cm",
    "reference_file": "offer_reference_841.json",
    "shop_name": "Proshop.at"
}