{
    "html_file": "offer_526_30.html",
    "name": "Dell E2424HS, 23.8\"",
    "offer_link": "https://ms-it-beratung.at/shop/details.php?art=429709&artname=Dell+60.5cm+%2823%2C8%22%29+E2424HS+16%3A9++HDMI%2BDP++++Lift+black",
    "price": 161.0,
    "raw_specifications": {
        "AC Eingangsfrequenz": "50 - 60 Hz",
        "AC Eingangsspannung": "100 - 240 V",
        "AMD FreeSync": "Nein",
        "Abnehmbarer Standfu\u00df": "Ja",
        "Anzahl DisplayPort Anschl\u00fcsse": "1",
        "Anzahl HDMI-Anschl\u00fcsse": "1",
        "Anzahl VGA (D-Sub) Anschl\u00fcsse": "1",
        "Anzahl der Farben des Displays": "16,7 Millionen Farben",
        "Anzahl der Lautsprecher": "2",
        "Betriebstemperatur": "0 - 40 \u00b0C",
        "Bildschirmdiagonale": "60,5 cm (23.8\")",
        "Bildschirmdiagonale (cm)": "60,47 cm",
        "Bildschirmform": "Flach",
        "Bildschirmtechnologie": "LCD",
        "Bildwinkel, horizontal": "178\u00b0",
        "Bildwinkel, vertikal": "178\u00b0",
        "Blendfreier Bildschirm": "Ja",
        "Breite (ohne Standfu\u00df)": "538,6 mm",
        "Digital horizontale Frequenz": "30 - 83 kHz",
        "Digital vertikale Frequenz": "50 - 75 Hz",
        "Display-Aufl\u00f6sung": "1920 x 1080 Pixel",
        "DisplayPorts-Version": "1.2",
        "Eingangsstrom": "1.5 A",
        "Eingebaute Lautsprecher": "Ja",
        "Energieeffizienzklasse (HDR)": "Nicht verf\u00fcgbar",
        "Energieeffizienzklasse (SDR)": "D",
        "Energieeffizienzskala": "A bis G",
        "Energieverbrauch (SDR) pro 1.000 Stunden": "14 kWh",
        "Enth\u00e4lt nicht": "PVC/BFR",
        "Farbskala": "83%",
        "Flimmerfreie Technologie": "Ja",
        "Fu\u00dffarbe": "Schwarz",
        "Ger\u00e4tebreite (inkl. Fu\u00df)": "538,6 mm",
        "Ger\u00e4teh\u00f6he (inkl. Fu\u00df)": "512,1 mm",
        "Ger\u00e4tetiefe (inkl. Fu\u00df)": "209,5 mm",
        "Gewicht (mit St\u00e4nder)": "4,06 kg",
        "Gewicht (ohne St\u00e4nder)": "2,82 kg",
        "HD-Typ": "Full HD",
        "HDMI": "Ja",
        "Helligkeit (typisch)": "250 cd/m\u00b2",
        "High Dynamic Range Video (HDR) Unterst\u00fctzung": "Nein",
        "H\u00f6he (ohne Standfu\u00df)": "324,2 mm",
        "H\u00f6he bei Betrieb": "0 - 5000 m",
        "H\u00f6he bei Lagerung": "5000 - 12192 m",
        "H\u00f6heneinstellung": "13 cm",
        "H\u00f6henverstellung": "Ja",
        "Integrierte Kamera": "Nein",
        "Integrierter USB-Hub": "Nein",
        "Kabelsperre-Slot": "Ja",
        "Kontrastverh\u00e4ltnis": "3000:1",
        "Kopfh\u00f6rerausgang": "Nein",
        "LED-Anzeigen": "Ja",
        "Low-Blue-Light-Technologie": "Ja",
        "Luftfeuchtigkeit bei Lagerung": "5 - 90%",
        "Marktpositionierung": "B\u00fcro",
        "Maximale Bildwiederholrate": "60 Hz",
        "Mitgelieferte Kabel": "AC, HDMI",
        "NVIDIA G-SYNC": "Nein",
        "Nachhaltigkeitszertifikate": "ENERGY STAR, RoHS, TCO",
        "Natives Seitenverh\u00e4ltnis": "16:9",
        "Neigungsverstellung": "Ja",
        "Neigungswinkelbereich": "-5 - 21\u00b0",
        "Netzteiltyp": "Intern",
        "On-Screen-Display (OSD)": "Ja",
        "Paketgewicht": "5,96 kg",
        "Panel-Montage-Schnittstelle": "100 x 100 mm",
        "Panel-Typ": "VA",
        "Pivot": "Nein",
        "Pixel Abstand": "0,2745 x 0,2745 mm",
        "Pixeldichte": "93 ppi",
        "Plug & Play": "Ja",
        "Produktfarbe": "Schwarz",
        "RGB-Farbraum": "NTSC",
        "RMS-Leistung": "2 W",
        "Rahmenbreite (Seite)": "5,8 mm",
        "Rahmenbreite (oben)": "5,8 mm",
        "Rahmenbreite (unten)": "2,19 cm",
        "Reaktionszeit": "8 ms",
        "Reaktionszeit (schnell)": "5 ms",
        "Relative Luftfeuchtigkeit in Betrieb": "10 - 80%",
        "Schnellstart\u00fcbersicht": "Ja",
        "Schwenkbar": "Ja",
        "Schwenkwinkelbereich": "-173 - 173\u00b0",
        "Schwermetallfrei": "Hg (Quecksilber)",
        "Sichtbare Gr\u00f6\u00dfe (horizontal)": "52,7 cm",
        "Sichtbare Gr\u00f6\u00dfe (vertikal)": "29,6 cm",
        "Slot-Typ Kabelsperre": "Kensington",
        "Stromeingang": "Ja",
        "Stromverbrauch (Standardbetrieb)": "16 W",
        "Stromverbrauch (Standby)": "0,3 W",
        "Stromverbrauch (aus)": "0,3 W",
        "Stromverbrauch (max.)": "28 W",
        "St\u00e4nder enthalten": "Ja",
        "Temperaturbereich bei Lagerung": "-20 - 60 \u00b0C",
        "Tiefe (ohne Standfu\u00df)": "48,9 mm",
        "Touchscreen": "Nein",
        "Typ der Hintergrundbeleuchtung": "LED",
        "VESA-Halterung": "Ja",
        "Verbessertes Kabelmanagement": "Ja",
        "Vorderer Rahmen": "Schwarz",
        "WLAN": "Nein"
    },
    "raw_specifications_text": "Bildschirmdiagonale: 60,5 cm (23.8\")\nDisplay-Aufl\u00f6sung: 1920 x 1080 Pixel\nNatives Seitenverh\u00e4ltnis: 16:9\nBildschirmtechnologie: LCD\nTouchscreen: Nein\nHD-Typ: Full HD\nPanel-Typ: VA\nTyp der Hintergrundbeleuchtung: LED\nHelligkeit (typisch): 250 cd/m\u00b2\nReaktionszeit: 8 ms\nBlendfreier Bildschirm: Ja\nBildschirmform: Flach\nKontrastverh\u00e4ltnis: 3000:1\nMaximale Bildwiederholrate: 60 Hz\nBildwinkel, horizontal: 178\u00b0\nBildwinkel, vertikal: 178\u00b0\nAnzahl der Farben des Displays: 16,7 Millionen Farben\nReaktionszeit (schnell): 5 ms\nPixel Abstand: 0,2745 x 0,2745 mm\nPixeldichte: 93 ppi\nSichtbare Gr\u00f6\u00dfe (horizontal): 52,7 cm\nSichtbare Gr\u00f6\u00dfe (vertikal): 29,6 cm\nDigital horizontale Frequenz: 30 - 83 kHz\nDigital vertikale Frequenz: 50 - 75 Hz\nBildschirmdiagonale (cm): 60,47 cm\nHigh Dynamic Range Video (HDR) Unterst\u00fctzung: Nein\nRGB-Farbraum: NTSC\nFarbskala: 83%\nNVIDIA G-SYNC: Nein\nAMD FreeSync: Nein\nFlimmerfreie Technologie: Ja\nLow-Blue-Light-Technologie: Ja\nEingebaute Lautsprecher: Ja\nIntegrierte Kamera: Nein\nAnzahl der Lautsprecher: 2\nRMS-Leistung: 2 W\nMarktpositionierung: B\u00fcro\nProduktfarbe: Schwarz\nVorderer Rahmen: Schwarz\nAbnehmbarer Standfu\u00df: Ja\nFu\u00dffarbe: Schwarz\nSchwermetallfrei: Hg (Quecksilber)\nIntegrierter USB-Hub: Nein\nAnzahl VGA (D-Sub) Anschl\u00fcsse: 1\nHDMI: Ja\nAnzahl HDMI-Anschl\u00fcsse: 1\nAnzahl DisplayPort Anschl\u00fcsse: 1\nDisplayPorts-Version: 1.2\nKopfh\u00f6rerausgang: Nein\nStromeingang: Ja\nWLAN: Nein\nVESA-Halterung: Ja\nPanel-Montage-Schnittstelle: 100 x 100 mm\nVerbessertes Kabelmanagement: Ja\nKabelsperre-Slot: Ja\nSlot-Typ Kabelsperre: Kensington\nH\u00f6henverstellung: Ja\nH\u00f6heneinstellung: 13 cm\nPivot: Nein\nSchwenkbar: Ja\nSchwenkwinkelbereich: -173 - 173\u00b0\nNeigungswinkelbereich: -5 - 21\u00b0\nOn-Screen-Display (OSD): Ja\nPlug & Play: Ja\nLED-Anzeigen: Ja\nNeigungsverstellung: Ja\nEnergieeffizienzklasse (SDR): D\nEnergieeffizienzklasse (HDR): Nicht verf\u00fcgbar\nEnergieverbrauch (SDR) pro 1.000 Stunden: 14 kWh\nStromverbrauch (Standardbetrieb): 16 W\nStromverbrauch (Standby): 0,3 W\nStromverbrauch (max.): 28 W\nStromverbrauch (aus): 0,3 W\nAC Eingangsspannung: 100 - 240 V\nAC Eingangsfrequenz: 50 - 60 Hz\nEingangsstrom: 1.5 A\nNetzteiltyp: Intern\nEnergieeffizienzskala: A bis G\nBetriebstemperatur: 0 - 40 \u00b0C\nTemperaturbereich bei Lagerung: -20 - 60 \u00b0C\nRelative Luftfeuchtigkeit in Betrieb: 10 - 80%\nLuftfeuchtigkeit bei Lagerung: 5 - 90%\nH\u00f6he bei Betrieb: 0 - 5000 m\nH\u00f6he bei Lagerung: 5000 - 12192 m\nSt\u00e4nder enthalten: Ja\nMitgelieferte Kabel: AC, HDMI\nSchnellstart\u00fcbersicht: Ja\nGer\u00e4tebreite (inkl. Fu\u00df): 538,6 mm\nGer\u00e4tetiefe (inkl. Fu\u00df): 209,5 mm\nGer\u00e4teh\u00f6he (inkl. Fu\u00df): 512,1 mm\nGewicht (mit St\u00e4nder): 4,06 kg\nBreite (ohne Standfu\u00df): 538,6 mm\nTiefe (ohne Standfu\u00df): 48,9 mm\nH\u00f6he (ohne Standfu\u00df): 324,2 mm\nGewicht (ohne St\u00e4nder): 2,82 kg\nRahmenbreite (Seite): 5,8 mm\nRahmenbreite (oben): 5,8 mm\nRahmenbreite (unten): 2,19 cm\nPaketgewicht: 5,96 kg\nNachhaltigkeitszertifikate: ENERGY STAR, RoHS, TCO\nEnth\u00e4lt nicht: PVC/BFR",
    "reference_file": "offer_reference_526.json",
    "shop_name": "ms-it-beratung"
}