{
    "html_file": "offer_2111_15.html",
    "name": "AOC 27G2U5/BK, 27\"",
    "offer_link": "https://www.future-x.at/aoc-led-monitor-68-6-cm-27-1920-x-1080-full-hd-1080p-%40-75-hz-ips-250-cd-m%B2-1000%3A1-5-ms-2xhdmi-displayport-lautsprecher-schwarz-p-8813103/?pv=2",
    "price": 175.9,
    "raw_specifications": {
        "3D": "Nein",
        "AC Eingangsfrequenz": "50/60 Hz",
        "AC Eingangsspannung": "100 - 240 V",
        "AMD FreeSync": "Ja",
        "AMD FreeSync Bildwiederholratenbereich": "48 - 144 Hz",
        "AMD FreeSync-Typ": "FreeSync",
        "Abnehmbarer Standfu\u00df": "Ja",
        "Anzahl DisplayPort Anschl\u00fcsse": "1",
        "Anzahl HDMI-Anschl\u00fcsse": "2",
        "Anzahl OSD-Sprachen": "16",
        "Anzahl VGA (D-Sub) Anschl\u00fcsse": "1",
        "Anzahl der Farben des Displays": "16,78 Millionen Farben",
        "Anzahl der Lautsprecher": "2",
        "Anzahl der nachgeschalteten Steckpl\u00e4tze vom Typ USB-A": "4",
        "Audioanschl\u00fcsse": "Ja",
        "Bildschirmaufl\u00f6sung": "1920 x 1080 Pixel",
        "Bildschirmdiagonale": "68,6 cm",
        "Bildschirmdisplay (OSD)-Sprachen": "Simplified Chinese, Traditional Chinese, Czech, German, Dutch, English, Spanish, Finnish, French, Italian, Japanese, Korean, Polish, Portuguese, Russian, SER",
        "Bildschirmform": "Flach",
        "Bildschirmtechnologie": "LED",
        "Blickwinkel, horizontal": "178 \u00b0",
        "Blickwinkel, vertikal": "178 \u00b0",
        "Breite (ohne Standfu\u00df)": "61,2 cm",
        "DVI Anschluss": "Nein",
        "DisplayPorts-Version": "1.2",
        "Ein-/Ausschalter": "Ja",
        "Eingebaute Lautsprecher": "Ja",
        "Externes Netzteil": "Nein",
        "Farbintensit\u00e4t": "6 Bit",
        "Fu\u00dffarbe": "Schwarz",
        "Ger\u00e4tebreite (inkl. Fu\u00df)": "612,1 mm",
        "Ger\u00e4teh\u00f6he (inkl. Fu\u00df)": "395,9 mm",
        "Ger\u00e4tetiefe (inkl. Fu\u00df)": "227,4 mm",
        "Gewicht (mit St\u00e4nder)": "5,1 kg",
        "Gewicht (ohne St\u00e4nder)": "3,7 kg",
        "HD-Typ": "Full HD",
        "HDMI": "Ja",
        "HDMI-Version": "1.4",
        "Helligkeit (typisch)": "250 cd/m\u00b2",
        "Horizontaler Scanbereich": "30 - 160 kHz",
        "H\u00f6he (ohne Standfu\u00df)": "36,3 cm",
        "H\u00f6heneinstellung": "13 cm",
        "H\u00f6henverstellung": "Ja",
        "Integrierte Kamera": "Nein",
        "Integrierter USB-Hub": "Ja",
        "Kontrastverh\u00e4ltnis": "1000:1",
        "Kontrastverh\u00e4ltnis (dynamisch)": "20000000:1",
        "Kopfh\u00f6rer-Konnektivit\u00e4t": "3,5 mm",
        "Kopfh\u00f6rerausgang": "Ja",
        "Kopfh\u00f6rerausg\u00e4nge": "1",
        "Low-Blue-Light-Technologie": "Ja",
        "Marktpositionierung": "Gaming",
        "Maximale Bildwiederholrate": "75 Hz",
        "Mikrofon-Eingang": "Ja",
        "Mitgelieferte Kabel": "DisplayPort,HDMI",
        "NVIDIA G-SYNC": "Nein",
        "Natives Seitenverh\u00e4ltnis": "16:9",
        "Neigungswinkelbereich": "3,5 - 21,5 \u00b0",
        "On-Screen-Display (OSD)": "Ja",
        "Paketgewicht": "7,43 kg",
        "Panel-Montage-Schnittstelle": "100 x 100 mm",
        "Panel-Typ": "IPS",
        "Pivot": "Ja",
        "Pixel Abstand": "0,275 x 0,275 mm",
        "Produktfarbe": "Schwarz",
        "RMS-Leistung": "4 W",
        "Rahmenloses Design": "Ja",
        "Reaktionszeit": "5 ms",
        "Recycelbares Verpackungsmaterial": "100 %",
        "Schwenkbar": "Ja",
        "Schwenkwinkelbereich": "-30 - 30 \u00b0",
        "Schwermetallfrei": "Hg (Quecksilber)",
        "Sichtbare Gr\u00f6\u00dfe (horizontal)": "59,8 cm",
        "Sichtbare Gr\u00f6\u00dfe (vertikal)": "33,6 cm",
        "Stromverbrauch (Standby)": "0,3 W",
        "Stromverbrauch (aus)": "0,3 W",
        "Stromverbrauch (in Betrieb)": "28 W",
        "TV Tuner integriert": "Nein",
        "Tiefe (ohne Standfu\u00df)": "4,6 cm",
        "Typ der Hintergrundbeleuchtung": "W-LED",
        "USB-Hub-Version": "3.2 Gen 1 (3.1 Gen 1)",
        "Unterst\u00fctzte Grafik-Aufl\u00f6sungen": "1920 x 1080 (HD 1080)",
        "VESA Adaptive Sync unterst\u00fctzt": "Ja",
        "VESA-Halterung": "Ja",
        "Verpackungsbreite": "730 mm",
        "Verpackungsh\u00f6he": "520 mm",
        "Verpackungstiefe": "187 mm",
        "Zertifizierung": "ISO",
        "kippbar": "Ja"
    },
    "raw_specifications_text": "NVIDIA G-SYNC: Nein\nAMD FreeSync: Ja\nAMD FreeSync-Typ: FreeSync\nAMD FreeSync Bildwiederholratenbereich: 48 - 144 Hz\nVESA Adaptive Sync unterst\u00fctzt: Ja\nLow-Blue-Light-Technologie: Ja\nBildschirmdiagonale: 68,6 cm\nBildschirmaufl\u00f6sung: 1920 x 1080 Pixel\nNatives Seitenverh\u00e4ltnis: 16:9\nPanel-Typ: IPS\nHelligkeit (typisch): 250 cd/m\u00b2\nReaktionszeit: 5 ms\nHD-Typ: Full HD\nBildschirmtechnologie: LED\nTyp der Hintergrundbeleuchtung: W-LED\nBildschirmform: Flach\nUnterst\u00fctzte Grafik-Aufl\u00f6sungen: 1920 x 1080 (HD 1080)\nKontrastverh\u00e4ltnis: 1000:1\nKontrastverh\u00e4ltnis (dynamisch): 20000000:1\nMaximale Bildwiederholrate: 75 Hz\nBlickwinkel, horizontal: 178 \u00b0\nBlickwinkel, vertikal: 178 \u00b0\nAnzahl der Farben des Displays: 16,78 Millionen Farben\n3D: Nein\nPixel Abstand: 0,275 x 0,275 mm\nHorizontaler Scanbereich: 30 - 160 kHz\nSichtbare Gr\u00f6\u00dfe (horizontal): 59,8 cm\nSichtbare Gr\u00f6\u00dfe (vertikal): 33,6 cm\nFarbintensit\u00e4t: 6 Bit\nIntegrierter USB-Hub: Ja\nUSB-Hub-Version: 3.2 Gen 1 (3.1 Gen 1)\nAnzahl der nachgeschalteten Steckpl\u00e4tze vom Typ USB-A: 4\nAnzahl VGA (D-Sub) Anschl\u00fcsse: 1\nDVI Anschluss: Nein\nHDMI: Ja\nAnzahl HDMI-Anschl\u00fcsse: 2\nHDMI-Version: 1.4\nAnzahl DisplayPort Anschl\u00fcsse: 1\nDisplayPorts-Version: 1.2\nAudioanschl\u00fcsse: Ja\nKopfh\u00f6rerausgang: Ja\nKopfh\u00f6rerausg\u00e4nge: 1\nKopfh\u00f6rer-Konnektivit\u00e4t: 3,5 mm\nMikrofon-Eingang: Ja\nVESA-Halterung: Ja\nPanel-Montage-Schnittstelle: 100 x 100 mm\nH\u00f6henverstellung: Ja\nH\u00f6heneinstellung: 13 cm\nPivot: Ja\nSchwenkbar: Ja\nSchwenkwinkelbereich: -30 - 30 \u00b0\nkippbar: Ja\nNeigungswinkelbereich: 3,5 - 21,5 \u00b0\nOn-Screen-Display (OSD): Ja\nBildschirmdisplay (OSD)-Sprachen: Simplified Chinese, Traditional Chinese, Czech, German, Dutch, English, Spanish, Finnish, French, Italian, Japanese, Korean, Polish, Portuguese, Russian, SER\nAnzahl OSD-Sprachen: 16\nEingebaute Lautsprecher: Ja\nIntegrierte Kamera: Nein\nAnzahl der Lautsprecher: 2\nRMS-Leistung: 4 W\nMarktpositionierung: Gaming\nProduktfarbe: Schwarz\nRahmenloses Design: Ja\nAbnehmbarer Standfu\u00df: Ja\nFu\u00dffarbe: Schwarz\nSchwermetallfrei: Hg (Quecksilber)\nZertifizierung: ISO\nMitgelieferte Kabel: DisplayPort,HDMI\nVerpackungsbreite: 730 mm\nVerpackungstiefe: 187 mm\nVerpackungsh\u00f6he: 520 mm\nPaketgewicht: 7,43 kg\nStromverbrauch (in Betrieb): 28 W\nStromverbrauch (Standby): 0,3 W\nStromverbrauch (aus): 0,3 W\nAC Eingangsspannung: 100 - 240 V\nAC Eingangsfrequenz: 50/60 Hz\nExternes Netzteil: Nein\nEin-/Ausschalter: Ja\nTV Tuner integriert: Nein\nRecycelbares Verpackungsmaterial: 100 %\nGer\u00e4tebreite (inkl. Fu\u00df): 612,1 mm\nGer\u00e4tetiefe (inkl. Fu\u00df): 227,4 mm\nGer\u00e4teh\u00f6he (inkl. Fu\u00df): 395,9 mm\nGewicht (mit St\u00e4nder): 5,1 kg\nBreite (ohne Standfu\u00df): 61,2 cm\nTiefe (ohne Standfu\u00df): 4,6 cm\nH\u00f6he (ohne Standfu\u00df): 36,3 cm\nGewicht (ohne St\u00e4nder): 3,7 kg",
    "reference_file": "offer_reference_2111.json",
    "shop_name": "Future-X.at"
}