{
    "html_file": "offer_2356_34.html",
    "name": "BenQ BL2480, 23.8\"",
    "offer_link": "https://www.alternate.at/BenQ/BL2480-LED-Monitor/html/product/1425806?partner=AtGeizhalsat&campaign=Monitor/BenQ/1425806",
    "price": 141.9,
    "raw_specifications": {
        "": "Kensington-Schloss",
        "Abmessungen": "Breite: 55,3 cm x H\u00f6he: 42,5 cm x Tiefe/L\u00e4nge: 18,9 cm",
        "Anschl\u00fcsse": "1x HDMI-Eingang, (HDMI-Version: 1.4), 1x DisplayPort-Eingang, (DisplayPort-Version: 1.2), 1x VGA-Eingang, 1x 3,5-mm-Audio-Eingang, 1x Kopfh\u00f6rer-Ausgang",
        "Bild": "Format",
        "Bildschirmaufl\u00f6sung": "1.920 x 1.080 Pixel",
        "Bildschirmdiagonale": "60,45 cm (23,8 Zoll)",
        "EAN": "4718755073533",
        "Energieeffizienzklasse (SDR)": "E (A - G)",
        "Energieverbauch pro 1000 Stunden (SDR)": "15 kWh",
        "Ergonomie": "Typ",
        "Farbe": "schwarz",
        "Features": "Flimmerfreie LEDs, Blaulichtfilter, Intelligente Helligkeit",
        "Frequenz": "Vertikal",
        "Geeignet f\u00fcr": "Business, Multimedia",
        "Gewicht": "3,8 kg",
        "Hersteller-Nr.": "9H.LH1LA.TBE",
        "Lautsprecher": "2 Lautsprecher",
        "Leistungsaufnahme im Bereitschafts- und Aus-Zustand": "0,3 Watt",
        "Leistungsaufnahme im Ein-Zustand bei Standard-Dynamikumfang (SDR)": "14,9 Watt",
        "Stromversorgung": "Eco-Off",
        "Typ": "LED-Monitor",
        "Wandhalterung": "VESA kompatibel (100 x 100 mm)",
        "Zubeh\u00f6r": "Vorhanden"
    },
    "raw_specifications_text": "Energieeffizienzklasse (SDR): E (A - G)\nEnergieverbauch pro 1000 Stunden (SDR): 15 kWh\nLeistungsaufnahme im Ein-Zustand bei Standard-Dynamikumfang (SDR): 14,9 Watt\nLeistungsaufnahme im Bereitschafts- und Aus-Zustand: 0,3 Watt\nBildschirmdiagonale: 60,45 cm (23,8 Zoll)\nBildschirmaufl\u00f6sung: 1.920 x 1.080 Pixel\nTyp: LED-Monitor\nFarbe: schwarz\nEAN: 4718755073533\nHersteller-Nr.: 9H.LH1LA.TBE\nGeeignet f\u00fcr: Business, Multimedia\nBild: Format\n: Kensington-Schloss\nFrequenz: Vertikal\nAnschl\u00fcsse: 1x HDMI-Eingang, (HDMI-Version: 1.4), 1x DisplayPort-Eingang, (DisplayPort-Version: 1.2), 1x VGA-Eingang, 1x 3,5-mm-Audio-Eingang, 1x Kopfh\u00f6rer-Ausgang\nErgonomie: Typ\nStromversorgung: Eco-Off\nLautsprecher: 2 Lautsprecher\nWandhalterung: VESA kompatibel (100 x 100 mm)\nFeatures: Flimmerfreie LEDs, Blaulichtfilter, Intelligente Helligkeit\nZubeh\u00f6r: Vorhanden\nAbmessungen: Breite: 55,3 cm x H\u00f6he: 42,5 cm x Tiefe/L\u00e4nge: 18,9 cm\nGewicht: 3,8 kg",
    "reference_file": "offer_reference_2356.json",
    "shop_name": "Alternate.at"
}