{
    "html_file": "offer_159_4.html",
    "name": "ASUS TUF Gaming VG27AQML1A, 27\"",
    "offer_link": "https://www.csv-direct.de/artinfo.php?artnr=A1621618&KATEGORIE=162&pva=geizhals2",
    "price": 456.89,
    "raw_specifications": {
        "AC Eingangsfrequenz": "50/60 Hz",
        "AC Eingangsspannung": "100 - 240 V",
        "AMD FreeSync-Typ": "FreeSync Premium",
        "Anzahl DisplayPort Anschl\u00fcsse": "1",
        "Anzahl HDMI-Anschl\u00fcsse": "2",
        "Anzahl der Farben des Displays": "1,073 Milliarden Farben",
        "Anzahl der Lautsprecher": "2",
        "Anzahl der nachgeschalteten Steckpl\u00e4tze vom Typ USB-A": "2",
        "Bildschirmdiagonale": "68,6 cm 27\"",
        "Bildschirmform": "Flach",
        "Bildschirmtechnologie": "LCD",
        "Bildwinkel, horizontal": "178\u00b0",
        "Bildwinkel, vertikal": "178\u00b0",
        "Breite ohne Standfu\u00df": "614,9 mm",
        "Digital horizontale Frequenz": "30 - 223 kHz",
        "Digital vertikale Frequenz": "48 - 144 Hz",
        "Display-Aufl\u00f6sung": "2560 x 1440 Pixel",
        "DisplayPorts-Version": "1.4",
        "Energieeffizienzklasse HDR": "G",
        "Energieeffizienzklasse SDR": "F",
        "Energieeffizienzskala": "A bis G",
        "Energieverbrauch HDR pro 1.000 Stunden": "36 kWh",
        "Energieverbrauch SDR pro 1.000 Stunden": "26 kWh",
        "Farbskala": "90",
        "Fu\u00dffarbe": "Schwarz",
        "Ger\u00e4tebreite inkl. Fu\u00df": "614,9 mm",
        "Ger\u00e4teh\u00f6he inkl. Fu\u00df": "533,9 mm",
        "Ger\u00e4tetiefe inkl. Fu\u00df": "213,8 mm",
        "Gewicht mit St\u00e4nder": "6,4 kg",
        "Gewicht ohne St\u00e4nder": "4,1 kg",
        "HD-Typ": "Wide Quad HD",
        "HDMI-Version": "2.0",
        "Helligkeit typisch": "400 cd/m\u00b2",
        "H\u00f6he ohne Standfu\u00df": "366,5 mm",
        "H\u00f6heneinstellung": "13 cm",
        "Integrierte Kamera": "Nein",
        "Kontrastverh\u00e4ltnis": "1000:1",
        "Kontrastverh\u00e4ltnis dynamisch": "100000000:1",
        "Kopfh\u00f6rerausg\u00e4nge": "1",
        "Marktpositionierung": "Gaming",
        "Maximale Bildwiederholrate": "260 Hz",
        "NVIDIA G-SYNC-Typ": "G-SYNC Compatible",
        "Natives Seitenverh\u00e4ltnis": "16:9",
        "Neigungswinkelbereich": "-5 - 20\u00b0",
        "Paketgewicht": "8,8 kg",
        "Panel-Montage-Schnittstelle": "100 x 100 mm",
        "Panel-Typ": "IPS",
        "Pivot Winkel": "-90 - 90\u00b0",
        "Pixel Abstand": "0,233 x 0,233 mm",
        "Produktfarbe": "Schwarz",
        "RGB-Farbraum": "DCI-P3",
        "RMS-Leistung": "4 W",
        "Reaktionszeit": "1 ms",
        "Schwenkwinkelbereich": "-20 - 20\u00b0",
        "Sichtbare Gr\u00f6\u00dfe horizontal": "59,7 cm",
        "Sichtbare Gr\u00f6\u00dfe vertikal": "33,6 cm",
        "Slot-Typ Kabelsperre": "Kensington",
        "Stromverbrauch Standardbetrieb": "26 W",
        "Stromverbrauch Standby": "0,5 W",
        "Stromverbrauch aus": "0,3 W",
        "Technologie mit hohem Dynamikbereich HDR": "High Dynamic Range 10 HDR10",
        "Tiefe ohne Standfu\u00df": "54 mm",
        "Touchscreen": "Nein",
        "Typ der Hintergrundbeleuchtung": "LED",
        "USB-Hub-Version": "3.2 Gen 1 3.1 Gen 1",
        "Verpackungsart": "Box",
        "Verpackungsbreite": "815 mm",
        "Verpackungsh\u00f6he": "170 mm",
        "Verpackungstiefe": "477 mm",
        "sRGB Abdeckung klassisch": "100"
    },
    "raw_specifications_text": "Bildschirmdiagonale: 68,6 cm 27\"\nDisplay-Aufl\u00f6sung: 2560 x 1440 Pixel\nNatives Seitenverh\u00e4ltnis: 16:9\nBildschirmtechnologie: LCD\nTouchscreen: Nein\nHD-Typ: Wide Quad HD\nPanel-Typ: IPS\nBildschirmform: Flach\nKontrastverh\u00e4ltnis: 1000:1\nMaximale Bildwiederholrate: 260 Hz\nAnzahl der Farben des Displays: 1,073 Milliarden Farben\nTyp der Hintergrundbeleuchtung: LED\nHelligkeit typisch: 400 cd/m\u00b2\nReaktionszeit: 1 ms\nKontrastverh\u00e4ltnis dynamisch: 100000000:1\nBildwinkel, horizontal: 178\u00b0\nBildwinkel, vertikal: 178\u00b0\nPixel Abstand: 0,233 x 0,233 mm\nSichtbare Gr\u00f6\u00dfe horizontal: 59,7 cm\nSichtbare Gr\u00f6\u00dfe vertikal: 33,6 cm\nDigital horizontale Frequenz: 30 - 223 kHz\nDigital vertikale Frequenz: 48 - 144 Hz\nTechnologie mit hohem Dynamikbereich HDR: High Dynamic Range 10 HDR10\nRGB-Farbraum: DCI-P3\nFarbskala: 90\nsRGB Abdeckung klassisch: 100\nNVIDIA G-SYNC-Typ: G-SYNC Compatible\nAMD FreeSync-Typ: FreeSync Premium\nIntegrierte Kamera: Nein\nAnzahl der Lautsprecher: 2\nRMS-Leistung: 4 W\nMarktpositionierung: Gaming\nProduktfarbe: Schwarz\nFu\u00dffarbe: Schwarz\nUSB-Hub-Version: 3.2 Gen 1 3.1 Gen 1\nAnzahl der nachgeschalteten Steckpl\u00e4tze vom Typ USB-A: 2\nAnzahl HDMI-Anschl\u00fcsse: 2\nHDMI-Version: 2.0\nAnzahl DisplayPort Anschl\u00fcsse: 1\nDisplayPorts-Version: 1.4\nKopfh\u00f6rerausg\u00e4nge: 1\nPanel-Montage-Schnittstelle: 100 x 100 mm\nSlot-Typ Kabelsperre: Kensington\nH\u00f6heneinstellung: 13 cm\nPivot Winkel: -90 - 90\u00b0\nSchwenkwinkelbereich: -20 - 20\u00b0\nNeigungswinkelbereich: -5 - 20\u00b0\nEnergieeffizienzklasse SDR: F\nEnergieeffizienzklasse HDR: G\nEnergieverbrauch SDR pro 1.000 Stunden: 26 kWh\nEnergieverbrauch HDR pro 1.000 Stunden: 36 kWh\nStromverbrauch Standardbetrieb: 26 W\nStromverbrauch Standby: 0,5 W\nStromverbrauch aus: 0,3 W\nAC Eingangsspannung: 100 - 240 V\nAC Eingangsfrequenz: 50/60 Hz\nEnergieeffizienzskala: A bis G\nGer\u00e4tebreite inkl. Fu\u00df: 614,9 mm\nGer\u00e4tetiefe inkl. Fu\u00df: 213,8 mm\nGer\u00e4teh\u00f6he inkl. Fu\u00df: 533,9 mm\nGewicht mit St\u00e4nder: 6,4 kg\nBreite ohne Standfu\u00df: 614,9 mm\nTiefe ohne Standfu\u00df: 54 mm\nH\u00f6he ohne Standfu\u00df: 366,5 mm\nGewicht ohne St\u00e4nder: 4,1 kg\nVerpackungsbreite: 815 mm\nVerpackungstiefe: 477 mm\nVerpackungsh\u00f6he: 170 mm\nPaketgewicht: 8,8 kg\nVerpackungsart: Box",
    "reference_file": "offer_reference_159.json",
    "shop_name": "CSV-Direct.de"
}