{
    "html_file": "offer_1024_6.html",
    "name": "Philips 5000 24E1N5300HE, 23.8\"",
    "offer_link": "https://www.e-tec.at/details.php?artnr=344943",
    "price": 159.15,
    "raw_specifications": {
        "Adaptive Sync": "Ja",
        "Anschl\u00fcsse - DisplayPort 1.2 75Hz@1920x1080": "1",
        "Anschl\u00fcsse - HDMI 1.4 75Hz@1920x1080": "1",
        "Anschl\u00fcsse - USB-C 3.0 mit DisplayPort 1.2 75Hz@1920x1080": "1",
        "Anwendung": "station\u00e4r",
        "Audio": "Lautsprecher (2x 5W),  1x Line-Out",
        "Aufl\u00f6sung": "1920x1080",
        "Beschichtung": "matt (non-glare),  H\u00e4rtegrad 3H",
        "Besonderheiten": "Slim Bezel,  USB-C Power Delivery (65W),  Steuerkreuz,  Mikrofon,  Webcam (5.0 Megapixel,  verriegelbar),  Sicherheitsschloss (Kensington),  Philips SmartImage",
        "Bildwiederholfrequenz": "75Hz",
        "Blickwinkel": "178\u00b0/178\u00b0",
        "Diagonale": "23.8\"/60.5cm",
        "Ergonomie": "130mm (h\u00f6henverstellbar),  \u00b190\u00b0 (Pivot),  N/A (drehbar),  +20\u00b0/-5\u00b0 (neigbar),  keine Angabe (Schr\u00e4glage)",
        "FRC": "unbekannt",
        "Farbe": "schwarz",
        "Farbraum - sRGB": "120.9%",
        "Farbtiefe": "8bit (16.7 Mio. Farben)",
        "Form": "gerade (flat)",
        "Gewicht": "4.37kg (mit Standfu\u00df),  2.71kg (ohne Standfu\u00df)",
        "HDR": "N/A",
        "Helligkeit": "300cd/m\u00b2 (typisch)",
        "Herstellergarantie": "zwei Jahre (Pickup&Return)",
        "Hintergrundbeleuchtung": "White-LED,  flicker-free,  Blaulichtfilter",
        "Kontrast - statisch": "1.000:1",
        "Lautsprecher": "Ja",
        "Leistungsaufnahme": "keine Angabe (maximal),  24.2W (typisch),  keine Angabe (Energielabel alt A+++ bis G),  0.5W (Standby)",
        "Panel": "IPS",
        "Reaktionszeit - GtG": "4ms",
        "Reaktionszeit - MPRT": "1ms",
        "Screen-to-Body-Ratio": "keine Angabe (berechnet)",
        "Seitenverh\u00e4ltnis": "16:9",
        "Signalfrequenz": "30-85kHz (horizontal),  48-75Hz (vertikal)",
        "Stromversorgung": "DC-In (externes Netzteil)",
        "USB-Hub In": "1x USB-C 3.0 mit DisplayPort 1.2 (75Hz@1920x1080)",
        "USB-Hub Out": "4x USB-A 3.0",
        "USB-Schreibweise": "Link",
        "Unsch\u00e4rfereduktionsfunktion": "N/A",
        "VESA": "100x100 (belegt)",
        "Weitere Anschl\u00fcsse": "N/A"
    },
    "raw_specifications_text": "Adaptive Sync: Ja\nAnschl\u00fcsse - DisplayPort 1.2 75Hz@1920x1080: 1\nAnschl\u00fcsse - HDMI 1.4 75Hz@1920x1080: 1\nAnschl\u00fcsse - USB-C 3.0 mit DisplayPort 1.2 75Hz@1920x1080: 1\nAnwendung: station\u00e4r\nAudio: Lautsprecher (2x 5W),  1x Line-Out\nAufl\u00f6sung: 1920x1080\nBeschichtung: matt (non-glare),  H\u00e4rtegrad 3H\nBesonderheiten: Slim Bezel,  USB-C Power Delivery (65W),  Steuerkreuz,  Mikrofon,  Webcam (5.0 Megapixel,  verriegelbar),  Sicherheitsschloss (Kensington),  Philips SmartImage\nBildwiederholfrequenz: 75Hz\nBlickwinkel: 178\u00b0/178\u00b0\nDiagonale: 23.8\"/60.5cm\nErgonomie: 130mm (h\u00f6henverstellbar),  \u00b190\u00b0 (Pivot),  N/A (drehbar),  +20\u00b0/-5\u00b0 (neigbar),  keine Angabe (Schr\u00e4glage)\nFarbe: schwarz\nFarbraum - sRGB: 120.9%\nFarbtiefe: 8bit (16.7 Mio. Farben)\nForm: gerade (flat)\nFRC: unbekannt\nGewicht: 4.37kg (mit Standfu\u00df),  2.71kg (ohne Standfu\u00df)\nHDR: N/A\nHelligkeit: 300cd/m\u00b2 (typisch)\nHerstellergarantie: zwei Jahre (Pickup&Return)\nHintergrundbeleuchtung: White-LED,  flicker-free,  Blaulichtfilter\nKontrast - statisch: 1.000:1\nLautsprecher: Ja\nLeistungsaufnahme: keine Angabe (maximal),  24.2W (typisch),  keine Angabe (Energielabel alt A+++ bis G),  0.5W (Standby)\nPanel: IPS\nReaktionszeit - GtG: 4ms\nReaktionszeit - MPRT: 1ms\nScreen-to-Body-Ratio: keine Angabe (berechnet)\nSeitenverh\u00e4ltnis: 16:9\nSignalfrequenz: 30-85kHz (horizontal),  48-75Hz (vertikal)\nStromversorgung: DC-In (externes Netzteil)\nUnsch\u00e4rfereduktionsfunktion: N/A\nUSB-Hub In: 1x USB-C 3.0 mit DisplayPort 1.2 (75Hz@1920x1080)\nUSB-Hub Out: 4x USB-A 3.0\nUSB-Schreibweise: Link\nVESA: 100x100 (belegt)\nWeitere Anschl\u00fcsse: N/A",
    "reference_file": "offer_reference_1024.json",
    "shop_name": "e-tec.at"
}