{
    "html_file": "offer_1692_30.html",
    "name": "iiyama G-Master G2770HSU-B1 Red Eagle, 27\"",
    "offer_link": "https://www.future-x.at/iiyama-g-master-red-eagle-led-monitor-68-6-cm-27-1920-x-1080-full-hd-1080p-165-hz-fast-ips-250-cd-m%B2-1100%3A1-0-8-ms-hdmi-displayport-lautsprecher-mattschwarz-p-8740258/?pv=2",
    "price": 197.09,
    "raw_specifications": {
        "Abmessungen (Breite x Tiefe x H\u00f6he)": "61,25 cm x 18,75 cm x 43,55 cm",
        "Adaptive-Sync Technologie": "AMD FreeSync Premium",
        "Ausgangsleistung/Kanal": "2 Watt",
        "Besonderheiten": "HDCP, flimmerfreie Technologie, Black Tuner, Blue Light Reducer Function",
        "Bildschirmbeschichtung": "Matt",
        "Bildschirmtyp": "Fast IPS",
        "Diagonalabmessung": "68,6 cm (27\")",
        "Display-Typ": "LED-hintergrundbeleuchteter LCD-Monitor / TFT-Aktivmatrix",
        "Eingangsspannung": "Wechselstrom 120/230 V (50/60 Hz)",
        "Einstellungen der Anzeigeposition": "Neigung",
        "Energie Effizienzklasse": "Klasse E",
        "Energieverbrauch pro Jahr": "27 kWh",
        "Enthaltene Kabel": "1 x USB-Kabel \u00a6 1 x DisplayPort-Kabel \u00a6 1 x HDMI-Kabel",
        "Farbe": "Mattschwarz",
        "Farbunterst\u00fctzung": "16,7 Millionen Farben (8-Bit)",
        "Gewicht": "4 kg",
        "Helligkeit": "250 cd/m\u00b2",
        "Hintergrundbeleuchtungs-Technologie": "LED-Hintergrundbeleuchtung",
        "Horizontale Bildwiederholrate": "15 - 225 kHz",
        "Horizontaler Betrachtungswinkel": "+89 / -89",
        "Integrierte Peripherieger\u00e4te": "USB 2.0 Hub",
        "Kennzeichnung": "VCCI, DDC-2B, RoHS, WEEE, PSE Mark, REACH, TUV Bauart, ERP, EAC",
        "Kontrast": "1100:1 / 80000000:1 (dynamisch)",
        "Leistungsaufnahme im Ein-Zustand": "18.8 W",
        "Leistungsmerkmale": "Slot f\u00fcr Sicherheitsschloss (Kabelschloss getrennt erh\u00e4ltlich), integrierte Kabelf\u00fchrung",
        "Native Aufl\u00f6sung": "Full HD (1080p) 1920 x 1080 (DisplayPort: 165 Hz, HDMI: 144 Hz)",
        "Neigungswinkel": "-3.5/+21.5",
        "OSD-Sprachen": "Tschechisch, Englisch, Deutsch, Franz\u00f6sisch, Italienisch, Portugiesisch, Polnisch, Russisch, Spanisch, Holl\u00e4ndisch, Japanisch",
        "Pixelpitch": "0.311 mm",
        "Reaktionszeit": "0,8 ms",
        "Schlosstyp zur Diebstahlsicherung": "Kensington Slot",
        "Schnittstellen": "HDMI \u00a6 DisplayPort \u00a6 2 x USB 2.0 Downstream (Typ A) \u00a6 USB 2.0 Upstream (Typ B) \u00a6 Kopfh\u00f6rer",
        "Seitenverh\u00e4ltnis": "16:9",
        "Stromverbrauch (Aus-Modus)": "0.3 Watt",
        "Stromverbrauch (typisch)": "22 Watt",
        "Stromverbrauch SDR (eingeschaltet)": "18.8 kWh/1.000 h",
        "Stromverbrauch im Standby-Modus": "0.5 Watt",
        "Transportbreite": "69 cm",
        "Transportgewicht": "6,1 kg",
        "Transporth\u00f6he": "47,5 cm",
        "Transporttiefe": "16 cm",
        "Typ": "Lautsprecher - Stereo",
        "VESA-Halterung": "100 x 100 mm",
        "Vertikale Bildwiederholrate": "48 - 165 Hz",
        "Vertikaler Betrachtungswinkel": "+89 / -89"
    },
    "raw_specifications_text": "Display-Typ: LED-hintergrundbeleuchteter LCD-Monitor / TFT-Aktivmatrix\nEnergie Effizienzklasse: Klasse E\nEnergieverbrauch pro Jahr: 27 kWh\nDiagonalabmessung: 68,6 cm (27\")\nAdaptive-Sync Technologie: AMD FreeSync Premium\nIntegrierte Peripherieger\u00e4te: USB 2.0 Hub\nBildschirmtyp: Fast IPS\nSeitenverh\u00e4ltnis: 16:9\nNative Aufl\u00f6sung: Full HD (1080p) 1920 x 1080 (DisplayPort: 165 Hz, HDMI: 144 Hz)\nPixelpitch: 0.311 mm\nHelligkeit: 250 cd/m\u00b2\nKontrast: 1100:1 / 80000000:1 (dynamisch)\nFarbunterst\u00fctzung: 16,7 Millionen Farben (8-Bit)\nReaktionszeit: 0,8 ms\nVertikale Bildwiederholrate: 48 - 165 Hz\nHorizontale Bildwiederholrate: 15 - 225 kHz\nHorizontaler Betrachtungswinkel: +89 / -89\nVertikaler Betrachtungswinkel: +89 / -89\nBildschirmbeschichtung: Matt\nHintergrundbeleuchtungs-Technologie: LED-Hintergrundbeleuchtung\nOSD-Sprachen: Tschechisch, Englisch, Deutsch, Franz\u00f6sisch, Italienisch, Portugiesisch, Polnisch, Russisch, Spanisch, Holl\u00e4ndisch, Japanisch\nBesonderheiten: HDCP, flimmerfreie Technologie, Black Tuner, Blue Light Reducer Function\nFarbe: Mattschwarz\nAbmessungen (Breite x Tiefe x H\u00f6he): 61,25 cm x 18,75 cm x 43,55 cm\nGewicht: 4 kg\nTyp: Lautsprecher - Stereo\nAusgangsleistung/Kanal: 2 Watt\nSchnittstellen: HDMI \u00a6 DisplayPort \u00a6 2 x USB 2.0 Downstream (Typ A) \u00a6 USB 2.0 Upstream (Typ B) \u00a6 Kopfh\u00f6rer\nEinstellungen der Anzeigeposition: Neigung\nNeigungswinkel: -3.5/+21.5\nVESA-Halterung: 100 x 100 mm\nLeistungsmerkmale: Slot f\u00fcr Sicherheitsschloss (Kabelschloss getrennt erh\u00e4ltlich), integrierte Kabelf\u00fchrung\nEnthaltene Kabel: 1 x USB-Kabel \u00a6 1 x DisplayPort-Kabel \u00a6 1 x HDMI-Kabel\nKennzeichnung: VCCI, DDC-2B, RoHS, WEEE, PSE Mark, REACH, TUV Bauart, ERP, EAC\nSchlosstyp zur Diebstahlsicherung: Kensington Slot\nEingangsspannung: Wechselstrom 120/230 V (50/60 Hz)\nLeistungsaufnahme im Ein-Zustand: 18.8 W\nStromverbrauch SDR (eingeschaltet): 18.8 kWh/1.000 h\nStromverbrauch (typisch): 22 Watt\nStromverbrauch im Standby-Modus: 0.5 Watt\nStromverbrauch (Aus-Modus): 0.3 Watt\nTransportbreite: 69 cm\nTransporttiefe: 16 cm\nTransporth\u00f6he: 47,5 cm\nTransportgewicht: 6,1 kg",
    "reference_file": "offer_reference_1692.json",
    "shop_name": "Future-X.at"
}