{
    "html_file": "offer_146_1.html",
    "name": "Acer KA0 KA240YHbi, 23.8\"",
    "offer_link": "https://www.mylemon.at/artikel/acer/um_qx0ee_h02/61-0cm-24-ka240yhbi-16.html",
    "price": 105.97,
    "raw_specifications": {
        "AMD FreeSync": "Ja",
        "AMD FreeSync-Typ": "FreeSync",
        "Anzahl HDMI-Anschl\u00fcsse": "1",
        "Anzahl VGA (D-Sub) Anschl\u00fcsse": "1",
        "Anzahl der Farben des Displays": "16,7 Millionen Farben",
        "Artikelnummer": "M1IYWRQL",
        "Aufl\u00f6sung": "1920x1080",
        "Besonderheiten": "75 Hz",
        "Bildschirmdiagonale": "60,5 cm (23.8\")",
        "Bildschirmform": "Flach",
        "Bildschirmtechnologie": "LED",
        "Bildwinkel, horizontal": "178\u00b0",
        "Bildwinkel, vertikal": "178\u00b0",
        "Breite (ohne Standfu\u00df)": "540 mm",
        "Display-Aufl\u00f6sung": "1920 x 1080 Pixel",
        "Displaygr\u00f6\u00dfe": "23,8 Zoll",
        "EAN": "4711121495731",
        "Energieeffizienzklasse (HDR)": "E",
        "Energieeffizienzklasse (SDR)": "E",
        "Energieverbrauch (HDR) pro 1.000 Stunden": "18 kWh",
        "Ergonomie": "Neigbar",
        "Farbtiefe": "6 Bit",
        "Flimmerfreie Technologie": "Ja",
        "Ger\u00e4tebreite (inkl. Fu\u00df)": "540 mm",
        "Ger\u00e4teh\u00f6he (inkl. Fu\u00df)": "414 mm",
        "Ger\u00e4tetiefe (inkl. Fu\u00df)": "192 mm",
        "Gewicht (mit St\u00e4nder)": "3,8 kg",
        "Gewicht (ohne St\u00e4nder)": "3,41 kg",
        "Gew\u00e4hrleistungsfrist": "3 Jahr(e)",
        "HD-Typ": "Full HD",
        "HDMI": "Ja",
        "HDMI-Version": "1.4",
        "Helligkeit": "250 cd/m\u00b2",
        "Helligkeit (typisch)": "250 cd/m\u00b2",
        "Hersteller Artikelnummer": "UM.QX0EE.H02",
        "H\u00f6he (ohne Standfu\u00df)": "324 mm",
        "H\u00f6henverstellung": "Nein",
        "Kabelsperre-Slot": "Ja",
        "Kontrastverh\u00e4ltnis": "3000:1",
        "Kontrastverh\u00e4ltnis (dynamisch)": "100000000:1",
        "Marktpositionierung": "Haus",
        "Maximale Bildwiederholrate": "100 Hz",
        "NTSC Abdeckung (typisch)": "72%",
        "Nachhaltigkeitszertifikate": "CE",
        "Natives Seitenverh\u00e4ltnis": "16:9",
        "Neigungswinkelbereich": "-5 - 15\u00b0",
        "Oberfl\u00e4chenh\u00e4rte": "3H",
        "Paketgewicht": "4,5 kg",
        "Panel": "VA",
        "Panel-Montage-Schnittstelle": "100 x 100 mm",
        "Panel-Typ": "TFT",
        "Pivot": "Nein",
        "Pixel Abstand": "0,275 x 0,275 mm",
        "Pixeldichte": "93 ppi",
        "Produktfarbe": "Schwarz",
        "Reaktionszeit": "1 ms",
        "Schwenkbar": "Nein",
        "Slot-Typ Kabelsperre": "Kensington",
        "Stromverbrauch (Standardbetrieb)": "20 W",
        "Stromverbrauch (Standby)": "0,5 W",
        "Stromverbrauch (aus)": "0,3 W",
        "Stromverbrauch (max.)": "30 W",
        "Tiefe (ohne Standfu\u00df)": "65 mm",
        "Touchscreen": "Nein",
        "Typ der Hintergrundbeleuchtung": "LED",
        "Unterst\u00fctzte Grafik-Aufl\u00f6sungen": "1920 x 1080 (HD 1080)",
        "VESA Halterung": "100x100 mm",
        "VESA-Halterung": "Ja",
        "Verpackungsbreite": "607 mm",
        "Verpackungsh\u00f6he": "420 mm",
        "Verpackungstiefe": "131 mm",
        "Video Anschl\u00fcsse": "1x VGA, 1x HDMI",
        "Zertifizierung": "CE, ISO9241-307 class I"
    },
    "raw_specifications_text": "Displaygr\u00f6\u00dfe: 23,8 Zoll\nAufl\u00f6sung: 1920x1080\nPanel: VA\nReaktionszeit: 1 ms\nVideo Anschl\u00fcsse: 1x VGA, 1x HDMI\nErgonomie: Neigbar\nVESA Halterung: 100x100 mm\nHelligkeit: 250 cd/m\u00b2\nBesonderheiten: 75 Hz\nHersteller Artikelnummer: UM.QX0EE.H02\nEAN: 4711121495731\nArtikelnummer: M1IYWRQL\nBildschirmdiagonale: 60,5 cm (23.8\")\nDisplay-Aufl\u00f6sung: 1920 x 1080 Pixel\nNatives Seitenverh\u00e4ltnis: 16:9\nBildschirmtechnologie: LED\nTouchscreen: Nein\nHD-Typ: Full HD\nPanel-Typ: TFT\nBildschirmform: Flach\nKontrastverh\u00e4ltnis: 3000:1\nMaximale Bildwiederholrate: 100 Hz\nAnzahl der Farben des Displays: 16,7 Millionen Farben\nTyp der Hintergrundbeleuchtung: LED\nHelligkeit (typisch): 250 cd/m\u00b2\nUnterst\u00fctzte Grafik-Aufl\u00f6sungen: 1920 x 1080 (HD 1080)\nKontrastverh\u00e4ltnis (dynamisch): 100000000:1\nBildwinkel, horizontal: 178\u00b0\nBildwinkel, vertikal: 178\u00b0\nPixel Abstand: 0,275 x 0,275 mm\nPixeldichte: 93 ppi\nOberfl\u00e4chenh\u00e4rte: 3H\nFarbtiefe: 6 Bit\nNTSC Abdeckung (typisch): 72%\nAMD FreeSync: Ja\nAMD FreeSync-Typ: FreeSync\nFlimmerfreie Technologie: Ja\nMarktpositionierung: Haus\nProduktfarbe: Schwarz\nZertifizierung: CE, ISO9241-307 class I\nHDMI: Ja\nAnzahl VGA (D-Sub) Anschl\u00fcsse: 1\nAnzahl HDMI-Anschl\u00fcsse: 1\nHDMI-Version: 1.4\nVESA-Halterung: Ja\nKabelsperre-Slot: Ja\nH\u00f6henverstellung: Nein\nPanel-Montage-Schnittstelle: 100 x 100 mm\nSlot-Typ Kabelsperre: Kensington\nPivot: Nein\nSchwenkbar: Nein\nNeigungswinkelbereich: -5 - 15\u00b0\nEnergieeffizienzklasse (SDR): E\nEnergieeffizienzklasse (HDR): E\nEnergieverbrauch (HDR) pro 1.000 Stunden: 18 kWh\nStromverbrauch (Standardbetrieb): 20 W\nStromverbrauch (Standby): 0,5 W\nStromverbrauch (max.): 30 W\nStromverbrauch (aus): 0,3 W\nGer\u00e4tebreite (inkl. Fu\u00df): 540 mm\nGer\u00e4tetiefe (inkl. Fu\u00df): 192 mm\nGer\u00e4teh\u00f6he (inkl. Fu\u00df): 414 mm\nGewicht (mit St\u00e4nder): 3,8 kg\nBreite (ohne Standfu\u00df): 540 mm\nTiefe (ohne Standfu\u00df): 65 mm\nH\u00f6he (ohne Standfu\u00df): 324 mm\nGewicht (ohne St\u00e4nder): 3,41 kg\nVerpackungsbreite: 607 mm\nVerpackungstiefe: 131 mm\nVerpackungsh\u00f6he: 420 mm\nPaketgewicht: 4,5 kg\nNachhaltigkeitszertifikate: CE\nGew\u00e4hrleistungsfrist: 3 Jahr(e)",
    "reference_file": "offer_reference_146.json",
    "shop_name": "mylemon.at"
}