{
    "html_file": "offer_644_8.html",
    "name": "Samsung Odyssey G6 G65B, 27\"",
    "offer_link": "https://www.office-partner.de/productredirect/index/sku/20642295?sPartner=p-geizhals-at&campaign=psm/geizhals-at/",
    "price": 335.88,
    "raw_specifications": {
        "Anschl\u00fcsse": "HDMI, DisplayPort, USB, Kopfh\u00f6reranschluss",
        "Artikelnummer": "20642295",
        "Aufl\u00f6sung Kurzname": "Full HD",
        "Bezeichnung des Herstellers": "Samsung S27BG650EU",
        "Bildwiederholungsrate": "240,00",
        "Breite": "6158,00",
        "Display Features": "FlickerFree, 3D ready",
        "Display Sync": "AMD FreeSync, Adaptive Sync",
        "Displaygr\u00f6\u00dfe": "81,28 cm (32 Zoll)",
        "Displayoberfl\u00e4che": "matt",
        "EEK - Spektrum": "AG",
        "Energieeffizienzklasse": "F",
        "Geh\u00e4usefarbe des Ger\u00e4tes": "Schwarz",
        "Gewicht": "6,40",
        "Gewicht inkl. Verpackung in Kg": "8,80",
        "Helligkeit Bereich": "300 - 450 cd/m\u00b2",
        "Hersteller": "Samsung",
        "H\u00f6he": "5783,00",
        "Inhalt (ml oder g)": "0,00",
        "Kapazit\u00e4t (Seiten)": "0",
        "Kontrastverh\u00e4ltnis (typisch) Bereich": "ab 1.200:1",
        "LCD-Technologie": "VA Panel",
        "L\u00e4nge": "3111,00",
        "Produktart": "Monitore",
        "Reaktionszeit": "1,00",
        "Seitenverh\u00e4ltnis": "16:9",
        "Shop Herstellernummer": "LS27BG650EUXEN",
        "Standard-EAN": "8806094192599",
        "Verbindungen": "Netzwerk (LAN)",
        "Verpackung - Breite in cm": "68,80",
        "Verpackung - H\u00f6he in cm": "21,40",
        "Verpackung - L\u00e4nge in cm": "46,10",
        "max. Aufl\u00f6sung": "2.560 x 1.440 Pixel (16:9)"
    },
    "raw_specifications_text": "Energieeffizienzklasse: F\nGeh\u00e4usefarbe des Ger\u00e4tes: Schwarz\nAnschl\u00fcsse: HDMI, DisplayPort, USB, Kopfh\u00f6reranschluss\nDisplay Features: FlickerFree, 3D ready\nHersteller: Samsung\nKontrastverh\u00e4ltnis (typisch) Bereich: ab 1.200:1\nHelligkeit Bereich: 300 - 450 cd/m\u00b2\nVerbindungen: Netzwerk (LAN)\nDisplaygr\u00f6\u00dfe: 81,28 cm (32 Zoll)\nProduktart: Monitore\nDisplay Sync: AMD FreeSync, Adaptive Sync\nAufl\u00f6sung Kurzname: Full HD\nKapazit\u00e4t (Seiten): 0\nEEK - Spektrum: AG\nArtikelnummer: 20642295\nStandard-EAN: 8806094192599\nShop Herstellernummer: LS27BG650EUXEN\nBezeichnung des Herstellers: Samsung S27BG650EU\nInhalt (ml oder g): 0,00\nL\u00e4nge: 3111,00\nGewicht: 6,40\nGewicht inkl. Verpackung in Kg: 8,80\nBreite: 6158,00\nH\u00f6he: 5783,00\nVerpackung - Breite in cm: 68,80\nVerpackung - H\u00f6he in cm: 21,40\nVerpackung - L\u00e4nge in cm: 46,10\nmax. Aufl\u00f6sung: 2.560 x 1.440 Pixel (16:9)\nSeitenverh\u00e4ltnis: 16:9\nLCD-Technologie: VA Panel\nReaktionszeit: 1,00\nDisplayoberfl\u00e4che: matt\nBildwiederholungsrate: 240,00",
    "reference_file": "offer_reference_644.json",
    "shop_name": "office-partner (AT)"
}