{
    "html_file": "offer_23_0.html",
    "name": "ASUS VZ27EHF-W, 27\"",
    "offer_link": "https://www.alternate.at/ASUS/VZ27EHF-W-LED-Monitor/html/product/100013946?partner=AtGeizhalsat&campaign=Monitor/ASUS/100013946",
    "price": 196.9,
    "raw_specifications": {
        "": "Netzteil",
        "Abmessungen": "Breite: 61,23 cm x H\u00f6he: 43,35 cm x Tiefe/L\u00e4nge: 20,98 cm",
        "Anschl\u00fcsse": "1x HDMI-Eingang, (HDMI-Version: 1.4), 1x Kopfh\u00f6rer-Ausgang",
        "Bild": "Glaretyp",
        "Bildschirmaufl\u00f6sung": "1.920 x 1.080 Pixel",
        "Bildschirmdiagonale": "69 cm (27 Zoll)",
        "EAN": "4711387206430",
        "Energieeffizienzklasse (SDR)": "D (A - G)",
        "Energieverbauch pro 1000 Stunden (SDR)": "17 kWh",
        "Ergonomie": "Typ",
        "Farbe": "wei\u00df",
        "Features": "Adaptive-Sync, Kensington-Schloss",
        "Frequenz": "Vertikal",
        "Geeignet f\u00fcr": "Multimedia",
        "Gewicht": "3,5 kg",
        "Hersteller-Nr.": "90LM07B0-B02470",
        "Leistungsaufnahme im Bereitschafts- und Aus-Zustand": "0,5 Watt",
        "Leistungsaufnahme im Ein-Zustand bei Standard-Dynamikumfang (SDR)": "17,2 Watt",
        "Stromversorgung": "Eco-Off",
        "Typ": "LED-Monitor",
        "Wandhalterung": "VESA kompatibel (75 x 75 mm)",
        "Zubeh\u00f6r": "Vorhanden"
    },
    "raw_specifications_text": "Energieeffizienzklasse (SDR): D (A - G)\nEnergieverbauch pro 1000 Stunden (SDR): 17 kWh\nLeistungsaufnahme im Ein-Zustand bei Standard-Dynamikumfang (SDR): 17,2 Watt\nLeistungsaufnahme im Bereitschafts- und Aus-Zustand: 0,5 Watt\nBildschirmdiagonale: 69 cm (27 Zoll)\nBildschirmaufl\u00f6sung: 1.920 x 1.080 Pixel\nTyp: LED-Monitor\nFarbe: wei\u00df\nEAN: 4711387206430\nHersteller-Nr.: 90LM07B0-B02470\nGeeignet f\u00fcr: Multimedia\nBild: Glaretyp\n: Netzteil\nFrequenz: Vertikal\nAnschl\u00fcsse: 1x HDMI-Eingang, (HDMI-Version: 1.4), 1x Kopfh\u00f6rer-Ausgang\nErgonomie: Typ\nStromversorgung: Eco-Off\nWandhalterung: VESA kompatibel (75 x 75 mm)\nFeatures: Adaptive-Sync, Kensington-Schloss\nZubeh\u00f6r: Vorhanden\nAbmessungen: Breite: 61,23 cm x H\u00f6he: 43,35 cm x Tiefe/L\u00e4nge: 20,98 cm\nGewicht: 3,5 kg",
    "reference_file": "offer_reference_23.json",
    "shop_name": "Alternate.at"
}