{
    "html_file": "offer_1040_26.html",
    "name": "Dell E2723HN, 27\"",
    "offer_link": "https://www.future-x.at/dell-e2723hn-led-monitor-68-6-cm-27-1920-x-1080-full-hd-1080p-60-hz-ips-300-cd-m%B2-1000%3A1-5-ms-hdmi-vga-schwarz-p-9017441/?pv=2",
    "price": 156.49,
    "raw_specifications": {
        "Abmessungen (Breite x Tiefe x H\u00f6he)": "62,33 cm x 18,829 cm x 45,89 cm - mit Fu\u00df",
        "Besonderheiten": "Breiter Betrachtungswinkel",
        "Bildschirmbeschichtung": "Blendfrei",
        "Bildschirmtyp": "IPS",
        "Details zu Abmessungen & Gewicht": "Mit Fu\u00df - Breite: 62,33 cm - Tiefe: 18,829 cm - H\u00f6he: 45,89 cm - Gewicht: 4,86 kg \u00a6 Ohne Fu\u00df - Breite: 62,33 cm - Tiefe: 5,041 cm - H\u00f6he: 37,087 cm - Gewicht: 3,8 kg",
        "Diagonalabmessung": "68,6 cm (27\")",
        "Display-Typ": "LED-hintergrundbeleuchteter LCD-Monitor / TFT-Aktivmatrix",
        "ENERGY STAR zertifiziert": "Ja",
        "EPEAT-kompatibel": "EPEAT Gold",
        "Ein-/Aus-Schalter": "Ja",
        "Eingangsspannung": "Wechselstrom 100-240 V (50/60 Hz)",
        "Einstellungen der Anzeigeposition": "H\u00f6he, Neigung",
        "Energie Effizienzklasse": "Klasse D",
        "Energierverbrauch Sleep": "0.3 Watt",
        "Enthaltene Kabel": "1 x HDMI-Kabel",
        "Farbraum": "72% (CIE 1931), 83% (CIE 1976)",
        "Farbunterst\u00fctzung": "16,7 Millionen Farben",
        "Gewicht": "4,86 kg",
        "Helligkeit": "300 cd/m\u00b2",
        "Hintergrundbeleuchtungs-Technologie": "LED-Hintergrundbeleuchtung",
        "Horizontaler Betrachtungswinkel": "178",
        "H\u00f6heneinstellung": "100 mm",
        "Kennzeichnung": "HDCP 1.2",
        "Kontrast": "1000:1 / 1000:1 (dynamisch)",
        "Leistungsaufnahme im Ein-Zustand": "17 W",
        "Leistungsmerkmale": "Slot f\u00fcr Sicherheitsschloss (Kabelschloss getrennt erh\u00e4ltlich), Unterst\u00fctzung f\u00fcr VESA-Schnittstelle",
        "Max. Betriebstemperatur": "40 \u00b0C",
        "Min Betriebstemperatur": "0 \u00b0C",
        "Native Aufl\u00f6sung": "Full HD (1080p) 1920 x 1080 bei 60 Hz",
        "Neigungswinkel": "-5/+21",
        "Pixelpitch": "0.3114 mm",
        "Ppi": "81",
        "Reaktionszeit": "8 ms (grau-zu-grau normal); 5 ms (grau-zu-grau schnell)",
        "Schlosstyp zur Diebstahlsicherung": "Kensington Slot",
        "Schnittstellen": "VGA \u00a6 HDMI",
        "Seitenverh\u00e4ltnis": "16:9",
        "Services im Bundle": "3 Jahre Advanced Exchange-Service",
        "Stromverbrauch (Aus-Modus)": "0.25 Watt",
        "Stromverbrauch (max.)": "30 Watt",
        "Stromverbrauch SDR (eingeschaltet)": "17 kWh/1.000 h",
        "Stromverbrauch im Standby-Modus": "0.3 Watt",
        "Transportgewicht": "6,81 kg",
        "VESA-Halterung": "100 x 100 mm",
        "Vertikaler Betrachtungswinkel": "178",
        "Zubeh\u00f6r im Lieferumfang": "VESA-Schraubenabdeckung",
        "Zul\u00e4ssige Luftfeuchtigkeit im Betrieb": "10 - 80% (nicht kondensierend)"
    },
    "raw_specifications_text": "Display-Typ: LED-hintergrundbeleuchteter LCD-Monitor / TFT-Aktivmatrix\nEnergie Effizienzklasse: Klasse D\nDiagonalabmessung: 68,6 cm (27\")\nBildschirmtyp: IPS\nSeitenverh\u00e4ltnis: 16:9\nNative Aufl\u00f6sung: Full HD (1080p) 1920 x 1080 bei 60 Hz\nPixelpitch: 0.3114 mm\nPpi: 81\nHelligkeit: 300 cd/m\u00b2\nKontrast: 1000:1 / 1000:1 (dynamisch)\nFarbunterst\u00fctzung: 16,7 Millionen Farben\nFarbraum: 72% (CIE 1931), 83% (CIE 1976)\nReaktionszeit: 8 ms (grau-zu-grau normal); 5 ms (grau-zu-grau schnell)\nHorizontaler Betrachtungswinkel: 178\nVertikaler Betrachtungswinkel: 178\nBildschirmbeschichtung: Blendfrei\nHintergrundbeleuchtungs-Technologie: LED-Hintergrundbeleuchtung\nBesonderheiten: Breiter Betrachtungswinkel\nAbmessungen (Breite x Tiefe x H\u00f6he): 62,33 cm x 18,829 cm x 45,89 cm - mit Fu\u00df\nGewicht: 4,86 kg\nSchnittstellen: VGA \u00a6 HDMI\nEinstellungen der Anzeigeposition: H\u00f6he, Neigung\nNeigungswinkel: -5/+21\nH\u00f6heneinstellung: 100 mm\nVESA-Halterung: 100 x 100 mm\nLeistungsmerkmale: Slot f\u00fcr Sicherheitsschloss (Kabelschloss getrennt erh\u00e4ltlich), Unterst\u00fctzung f\u00fcr VESA-Schnittstelle\nZubeh\u00f6r im Lieferumfang: VESA-Schraubenabdeckung\nEnthaltene Kabel: 1 x HDMI-Kabel\nKennzeichnung: HDCP 1.2\nSchlosstyp zur Diebstahlsicherung: Kensington Slot\nEingangsspannung: Wechselstrom 100-240 V (50/60 Hz)\nLeistungsaufnahme im Ein-Zustand: 17 W\nStromverbrauch SDR (eingeschaltet): 17 kWh/1.000 h\nStromverbrauch (max.): 30 Watt\nStromverbrauch im Standby-Modus: 0.3 Watt\nEnergierverbrauch Sleep: 0.3 Watt\nStromverbrauch (Aus-Modus): 0.25 Watt\nEin-/Aus-Schalter: Ja\nDetails zu Abmessungen & Gewicht: Mit Fu\u00df - Breite: 62,33 cm - Tiefe: 18,829 cm - H\u00f6he: 45,89 cm - Gewicht: 4,86 kg \u00a6 Ohne Fu\u00df - Breite: 62,33 cm - Tiefe: 5,041 cm - H\u00f6he: 37,087 cm - Gewicht: 3,8 kg\nTransportgewicht: 6,81 kg\nEPEAT-kompatibel: EPEAT Gold\nENERGY STAR zertifiziert: Ja\nServices im Bundle: 3 Jahre Advanced Exchange-Service\nMin Betriebstemperatur: 0 \u00b0C\nMax. Betriebstemperatur: 40 \u00b0C\nZul\u00e4ssige Luftfeuchtigkeit im Betrieb: 10 - 80% (nicht kondensierend)",
    "reference_file": "offer_reference_1040.json",
    "shop_name": "Future-X.at"
}