{
    "html_file": "offer_1874_5.html",
    "name": "Philips B-line 275B1, 27\"",
    "offer_link": "https://www.proshop.at/Bildschirm/Philips-27-Bildschirm-B-Line-275B1-Black-4-ms/2860023?utm_source=geizhals&utm_medium=cpc&utm_campaign=pricesite",
    "price": 269.76,
    "raw_specifications": {
        "Abmessungen (Breite x Tiefe x H\u00f6he)": "61.3 cm x 20.5 cm x 53.7 cm - mit Fu\u00df",
        "Abmessungen (Breite x Tiefe x H\u00f6he) - mit Fu\u00df": "61.3 cm x 20.5 cm x 53.7 cm",
        "Ausgangsleistung/Kanal": "2 Watt",
        "Besonderheiten": "PowerSensor, SmartImage, Low Blue Light Mode, flimmerfreie Technologie, Adaptive-Sync-Technologie, LightSensor, EasyRead, sRGB Mode",
        "Bildschirmbeschichtung": "Blendfrei, 3H Hard Coating, Haze 25 %",
        "Bildschirmtyp": "IPS",
        "Details zu Abmessungen & Gewicht": "Mit Standfu\u00df (h\u00f6chste Position) - Breite: 61.3 cm - Tiefe: 20.5 cm - H\u00f6he: 53.7 cm - Gewicht: 6.36 kg  Ohne Fu\u00df - Breite: 61.3 cm - Tiefe: 5.1 cm - H\u00f6he: 36.6 cm - Gewicht: 4.75 kg",
        "Diagonalabmessung": "68.6 cm (27\")",
        "Display-Typ": "LED-hintergrundbeleuchteter LCD-Monitor / TFT-Aktivmatrix",
        "EAN": "8712581764333",
        "ENERGY STAR zertifiziert": "Ja",
        "ENERGY STAR-Version": "8.0",
        "Ein-/Aus-Schalter": "Ja",
        "Eingangsanschl\u00fcsse": "HDMI, DVI-D, DisplayPort",
        "Eingangsspannung": "Wechselstrom 120/230 V (50/60 Hz)",
        "Einstellungen der Anzeigeposition": "H\u00f6he, Pivot (Rotation), Drehung, Neigung",
        "Energie Effizienzklasse": "Klasse F",
        "Energieverbrauch pro Jahr": "44 kWh",
        "Enthaltene Kabel": "1 x HDMI-Kabel  1 x DisplayPort-Kabel  1 x Audiokabel",
        "Farbe": "Black Texture",
        "Farbraum": "110% NTSC (CIE 1976), 123% sRGB (CIE 1931)",
        "Farbunterst\u00fctzung": "16,7 Millionen Farben",
        "Ger\u00e4tetyp": "LED-hintergrundbeleuchteter LCD-Monitor - 68.6 cm (27\")",
        "Gewicht": "6.36 kg",
        "Helligkeit": "300 cd/m\u00b2",
        "Hersteller": "Philips",
        "Hintergrundbeleuchtungs-Technologie": "WLED",
        "Horizontale Bildwiederholrate": "30 - 114 kHz",
        "Horizontaler Betrachtungswinkel": "178",
        "H\u00f6heneinstellung": "150 mm",
        "Integrierte Peripherieger\u00e4te": "USB 3.2 Hub",
        "Kennzeichnung": "Plug and Play, FCC Klasse B bescheinigt, TUV GS, ICES-003, SEMKO, CB, TUV Ergo, DDC/CI, RoHS, Bleifrei, EPA, CU-EAC, DisplayPort 1.2, BFR-frei, HDCP 1.4, PVC-free, quecksilberfrei",
        "Kontrast": "1000:1 / 50000000:1 (dynamisch)",
        "Leistungsaufnahme im Ein-Zustand": "25.4 W",
        "Leistungsmerkmale": "Slot f\u00fcr Sicherheitsschloss (Kabelschloss getrennt erh\u00e4ltlich)",
        "MTBF": "70,000 Stunde(n)",
        "Mitgelieferte Software": "Philips SmartControl",
        "Modell": "275B1/00",
        "Native Aufl\u00f6sung": "QHD 2560 x 1440 bei 75 Hz",
        "Neigungswinkel": "-5/+35",
        "OSD-Sprachen": "Multilingual",
        "Pixelpitch": "0.2331 mm",
        "Ppi": "109",
        "Produktbeschreibung": "Philips B Line 275B1 - LED-Monitor - 68.6 cm (27\")",
        "Reaktionszeit": "4 ms (gray-to-gray)",
        "Rotationswinkel": "180",
        "Schlosstyp zur Diebstahlsicherung": "Kensington Slot",
        "Schnittstellen": "DVI-D (HDCP)  DisplayPort (HDCP)  HDMI (HDCP)  USB Upstream (Typ B)  3 x USB 3.2 Downstream  USB 3.2 Downstream (Schnellladung)  Audio Line-Out",
        "Schwenkwinkel": "360",
        "Seitenverh\u00e4ltnis": "16:9",
        "Spannung": "Wechselstrom 120/230 V (50/60 Hz)",
        "Stromverbrauch (Aus-Modus)": "0 Watt",
        "Stromverbrauch (typisch)": "18 Watt",
        "Stromverbrauch SDR (eingeschaltet)": "25.4 kWh/1.000 h",
        "Stromverbrauch im Standby-Modus": "0.4 Watt",
        "TCO-zertifiziert": "TCO Certified Displays 8, TCO Certified Edge Displays",
        "Transportbreite": "70 cm",
        "Transportgewicht": "8.47 kg",
        "Transporth\u00f6he": "45.6 cm",
        "Transporttiefe": "21.6 cm",
        "Typ": "Lautsprecher - Stereo",
        "Umweltschutzstandards": "TCO Certified Displays 8, TCO Certified Edge Displays, ENERGY STAR-qualifiziert",
        "VESA-Halterung": "100 x 100 mm",
        "Vertikale Bildwiederholrate": "48 - 75 Hz",
        "Vertikaler Betrachtungswinkel": "178",
        "Waren-Nr.": "2860023",
        "Zum Hersteller": "www.philips.com"
    },
    "raw_specifications_text": "Hersteller: Philips\nWaren-Nr.: 2860023\nModell: 275B1/00\nEAN: 8712581764333\nZum Hersteller: www.philips.com\nProduktbeschreibung: Philips B Line 275B1 - LED-Monitor - 68.6 cm (27\")\nGer\u00e4tetyp: LED-hintergrundbeleuchteter LCD-Monitor - 68.6 cm (27\")\nEnergie Effizienzklasse: Klasse F\nEnergieverbrauch pro Jahr: 44 kWh\nLeistungsaufnahme im Ein-Zustand: 25.4 W\nLeistungsmerkmale: Slot f\u00fcr Sicherheitsschloss (Kabelschloss getrennt erh\u00e4ltlich)\nBildschirmtyp: IPS\nSeitenverh\u00e4ltnis: 16:9\nNative Aufl\u00f6sung: QHD 2560 x 1440 bei 75 Hz\nPixelpitch: 0.2331 mm\nHelligkeit: 300 cd/m\u00b2\nKontrast: 1000:1 / 50000000:1 (dynamisch)\nReaktionszeit: 4 ms (gray-to-gray)\nFarbunterst\u00fctzung: 16,7 Millionen Farben\nFarbraum: 110% NTSC (CIE 1976), 123% sRGB (CIE 1931)\nEingangsanschl\u00fcsse: HDMI, DVI-D, DisplayPort\nEinstellungen der Anzeigeposition: H\u00f6he, Pivot (Rotation), Drehung, Neigung\nBildschirmbeschichtung: Blendfrei, 3H Hard Coating, Haze 25 %\nSpannung: Wechselstrom 120/230 V (50/60 Hz)\nFarbe: Black Texture\nAbmessungen (Breite x Tiefe x H\u00f6he) - mit Fu\u00df: 61.3 cm x 20.5 cm x 53.7 cm\nGewicht: 6.36 kg\nUmweltschutzstandards: TCO Certified Displays 8, TCO Certified Edge Displays, ENERGY STAR-qualifiziert\nKennzeichnung: Plug and Play, FCC Klasse B bescheinigt, TUV GS, ICES-003, SEMKO, CB, TUV Ergo, DDC/CI, RoHS, Bleifrei, EPA, CU-EAC, DisplayPort 1.2, BFR-frei, HDCP 1.4, PVC-free, quecksilberfrei\nDisplay-Typ: LED-hintergrundbeleuchteter LCD-Monitor / TFT-Aktivmatrix\nDiagonalabmessung: 68.6 cm (27\")\nIntegrierte Peripherieger\u00e4te: USB 3.2 Hub\nPpi: 109\nVertikale Bildwiederholrate: 48 - 75 Hz\nHorizontale Bildwiederholrate: 30 - 114 kHz\nHorizontaler Betrachtungswinkel: 178\nVertikaler Betrachtungswinkel: 178\nHintergrundbeleuchtungs-Technologie: WLED\nOSD-Sprachen: Multilingual\nBesonderheiten: PowerSensor, SmartImage, Low Blue Light Mode, flimmerfreie Technologie, Adaptive-Sync-Technologie, LightSensor, EasyRead, sRGB Mode\nAbmessungen (Breite x Tiefe x H\u00f6he): 61.3 cm x 20.5 cm x 53.7 cm - mit Fu\u00df\nTyp: Lautsprecher - Stereo\nAusgangsleistung/Kanal: 2 Watt\nSchnittstellen: DVI-D (HDCP)  DisplayPort (HDCP)  HDMI (HDCP)  USB Upstream (Typ B)  3 x USB 3.2 Downstream  USB 3.2 Downstream (Schnellladung)  Audio Line-Out\nNeigungswinkel: -5/+35\nSchwenkwinkel: 360\nRotationswinkel: 180\nH\u00f6heneinstellung: 150 mm\nVESA-Halterung: 100 x 100 mm\nEnthaltene Kabel: 1 x HDMI-Kabel  1 x DisplayPort-Kabel  1 x Audiokabel\nMTBF: 70,000 Stunde(n)\nSchlosstyp zur Diebstahlsicherung: Kensington Slot\nEingangsspannung: Wechselstrom 120/230 V (50/60 Hz)\nStromverbrauch SDR (eingeschaltet): 25.4 kWh/1.000 h\nStromverbrauch (typisch): 18 Watt\nStromverbrauch im Standby-Modus: 0.4 Watt\nStromverbrauch (Aus-Modus): 0 Watt\nEin-/Aus-Schalter: Ja\nMitgelieferte Software: Philips SmartControl\nDetails zu Abmessungen & Gewicht: Mit Standfu\u00df (h\u00f6chste Position) - Breite: 61.3 cm - Tiefe: 20.5 cm - H\u00f6he: 53.7 cm - Gewicht: 6.36 kg  Ohne Fu\u00df - Breite: 61.3 cm - Tiefe: 5.1 cm - H\u00f6he: 36.6 cm - Gewicht: 4.75 kg\nTransportbreite: 70 cm\nTransporttiefe: 21.6 cm\nTransporth\u00f6he: 45.6 cm\nTransportgewicht: 8.47 kg\nTCO-zertifiziert: TCO Certified Displays 8, TCO Certified Edge Displays\nENERGY STAR zertifiziert: Ja\nENERGY STAR-Version: 8.0",
    "reference_file": "offer_reference_1874.json",
    "shop_name": "Proshop.at"
}