{
    "html_file": "offer_2139_5.html",
    "name": "Philips E-Line 328E1CA, 31.5\"",
    "offer_link": "https://www.amazon.de/dp/B07SNG873R?linkCode=xm2&camp=2025&creative=165953&smid=A3JWKAKR8XB7XF&creativeASIN=B07SNG873R&tag=geizhals1-21",
    "price": 329.75,
    "raw_specifications": {
        "ASIN": "B07SNG873R",
        "Amazon Bestseller-Rang": "Nr. 20,337 in Computer & Zubeh\u00f6r (Siehe Top 100 in Computer & Zubeh\u00f6r)  Nr. 445 in Monitore",
        "Anzahl HDMI Schnittstellen": "\u200e2",
        "Anzahl der Lithium-Ionen-Zellen": "\u200e5",
        "Anzahl der Lithium-Metall-Zellen": "\u200e5",
        "Artikelgewicht": "\u200e7,71 Kilograms",
        "Batterien": "\u200e1 Lithium-Ionen Batterien erforderlich.",
        "Batterien enthalten": "\u200eNein",
        "Bildschirmaufl\u00f6sung": "\u200e3840 x 2160 Pixel",
        "Display-Gr\u00f6\u00dfe": "\u200e31,5 Zoll",
        "Durchschnittliche Kundenbewertung": "4,5  4,5 von 5 Sternen    \n    1.919 Sternebewertungen   \n\n\n 4,5 von 5 Sternen",
        "Farbe": "\u200eSchwarz",
        "Garantierte Software-Updates bis": "\u200eunbekannt",
        "Gewicht Lithium-Akku": "\u200e2 Gramm",
        "Hersteller": "\u200ePhilips",
        "Im Angebot von Amazon.de seit": "3. Juni 2019",
        "Kapazit\u00e4t Lithium-Akku": "\u200e2 Kilowattstunden",
        "L\u00f6sung": "\u200e3840 x 2160 Pixels",
        "Marke": "\u200ePhilips Monitors",
        "Modell/Serie": "\u200e328E1CA",
        "Modellnummer": "\u200e328E1CA/00",
        "Produktabmessungen": "\u200e1,11 x 2,79 x 2,06 cm; 7,71 Kilogramm",
        "Prozessortyp": "\u200eOthers",
        "Volt": "\u200e220 Volt",
        "Watt": "\u200e49.3 Watt"
    },
    "raw_specifications_text": "Marke: \u200ePhilips Monitors\nHersteller: \u200ePhilips\nModell/Serie: \u200e328E1CA\nProduktabmessungen: \u200e1,11 x 2,79 x 2,06 cm; 7,71 Kilogramm\nBatterien: \u200e1 Lithium-Ionen Batterien erforderlich.\nModellnummer: \u200e328E1CA/00\nFarbe: \u200eSchwarz\nDisplay-Gr\u00f6\u00dfe: \u200e31,5 Zoll\nBildschirmaufl\u00f6sung: \u200e3840 x 2160 Pixel\nL\u00f6sung: \u200e3840 x 2160 Pixels\nProzessortyp: \u200eOthers\nAnzahl HDMI Schnittstellen: \u200e2\nVolt: \u200e220 Volt\nWatt: \u200e49.3 Watt\nBatterien enthalten: \u200eNein\nKapazit\u00e4t Lithium-Akku: \u200e2 Kilowattstunden\nGewicht Lithium-Akku: \u200e2 Gramm\nAnzahl der Lithium-Ionen-Zellen: \u200e5\nAnzahl der Lithium-Metall-Zellen: \u200e5\nArtikelgewicht: \u200e7,71 Kilograms\nGarantierte Software-Updates bis: \u200eunbekannt\nASIN: B07SNG873R\nDurchschnittliche Kundenbewertung: 4,5  4,5 von 5 Sternen    \n    1.919 Sternebewertungen   \n\n\n 4,5 von 5 Sternen\nAmazon Bestseller-Rang: Nr. 20,337 in Computer & Zubeh\u00f6r (Siehe Top 100 in Computer & Zubeh\u00f6r)  Nr. 445 in Monitore\nIm Angebot von Amazon.de seit: 3. Juni 2019",
    "reference_file": "offer_reference_2139.json",
    "shop_name": "Amazon.at"
}