{
    "html_file": "offer_1669_29.html",
    "name": "ASUS VY279HE, 27\"",
    "offer_link": "https://technikladen.at/P-ASUS-VY279HE-686-cm-27-Zoll-1920-x-1080-Pixel-Full-HD-LED-1-ms-Schwarz?tl=gzhls",
    "price": 214.31,
    "raw_specifications": {
        "AC Eingangsfrequenz": "50/60 Hz",
        "AC Eingangsspannung": "100 - 240 V",
        "AMD FreeSync": "Ja",
        "AMD FreeSync-Typ": "FreeSync",
        "Anzahl HDMI-Anschl\u00fcsse": "1",
        "Anzahl VGA (D-Sub) Anschl\u00fcsse": "1",
        "Anzahl der Farben des Displays": "16,7 Millionen Farben",
        "Audioanschl\u00fcsse": "Nein",
        "Bildschirmaufl\u00f6sung": "1920 x 1080 Pixel",
        "Bildschirmdiagonale": "68,6 cm",
        "Bildschirmform": "Flach",
        "Bildschirmtechnologie": "LED",
        "Bildwinkel, horizontal": "178 \u00b0",
        "Bildwinkel, vertikal": "178 \u00b0",
        "Breite (ohne Standfu\u00df)": "61,3 cm",
        "DVI Anschluss": "Nein",
        "Eingebaute Lautsprecher": "Nein",
        "Energieeffizienzklasse (SDR)": "F",
        "Energieeffizienzskala": "A bis G",
        "Energieverbrauch (SDR) pro 1.000 Stunden": "24 kWh",
        "Ger\u00e4tebreite (inkl. Fu\u00df)": "613,3 mm",
        "Ger\u00e4teh\u00f6he (inkl. Fu\u00df)": "201,7 mm",
        "Ger\u00e4tetiefe (inkl. Fu\u00df)": "435,6 mm",
        "Gewicht (mit St\u00e4nder)": "4,21 kg",
        "Gewicht (ohne St\u00e4nder)": "3,68 kg",
        "HD-Typ": "Full HD",
        "HDCP": "Ja",
        "HDMI": "Ja",
        "HDMI-Version": "1.4",
        "Helligkeit (typisch)": "250 cd/m\u00b2",
        "H\u00f6he (ohne Standfu\u00df)": "5 cm",
        "Integrierte Kamera": "Nein",
        "Integrierter USB-Hub": "Nein",
        "Kabelsperre-Slot": "Ja",
        "Kontrastverh\u00e4ltnis": "1000:1",
        "Kopfh\u00f6rerausgang": "Nein",
        "Maximale Bildwiederholrate": "75 Hz",
        "NVIDIA G-SYNC": "Nein",
        "Natives Seitenverh\u00e4ltnis": "16:9",
        "Neigungswinkelbereich": "-5 - 23 \u00b0",
        "Paketgewicht": "6,8 kg",
        "Panel-Montage-Schnittstelle": "100 x 100 mm",
        "Panel-Typ": "IPS",
        "Produktfarbe": "Schwarz",
        "Reaktionszeit": "1 ms",
        "Slot-Typ Kabelsperre": "Kensington",
        "Stromverbrauch (Standardbetrieb)": "23,5 W",
        "Stromverbrauch (Standby)": "0,2 W",
        "Stromverbrauch (aus)": "0,2 W",
        "Tiefe (ohne Standfu\u00df)": "36,5 cm",
        "VESA-Halterung": "Ja",
        "Verpackungsart": "Box",
        "Verpackungsbreite": "679 mm",
        "Verpackungsh\u00f6he": "148 mm",
        "Verpackungstiefe": "445 mm",
        "kippbar": "Ja"
    },
    "raw_specifications_text": "NVIDIA G-SYNC: Nein\nAMD FreeSync: Ja\nAMD FreeSync-Typ: FreeSync\nBildschirmdiagonale: 68,6 cm\nBildschirmaufl\u00f6sung: 1920 x 1080 Pixel\nNatives Seitenverh\u00e4ltnis: 16:9\nPanel-Typ: IPS\nHelligkeit (typisch): 250 cd/m\u00b2\nReaktionszeit: 1 ms\nHD-Typ: Full HD\nBildschirmtechnologie: LED\nBildschirmform: Flach\nKontrastverh\u00e4ltnis: 1000:1\nMaximale Bildwiederholrate: 75 Hz\nBildwinkel, horizontal: 178 \u00b0\nBildwinkel, vertikal: 178 \u00b0\nAnzahl der Farben des Displays: 16,7 Millionen Farben\nIntegrierter USB-Hub: Nein\nAnzahl VGA (D-Sub) Anschl\u00fcsse: 1\nDVI Anschluss: Nein\nHDMI: Ja\nAnzahl HDMI-Anschl\u00fcsse: 1\nHDMI-Version: 1.4\nAudioanschl\u00fcsse: Nein\nKopfh\u00f6rerausgang: Nein\nHDCP: Ja\nVESA-Halterung: Ja\nPanel-Montage-Schnittstelle: 100 x 100 mm\nKabelsperre-Slot: Ja\nSlot-Typ Kabelsperre: Kensington\nkippbar: Ja\nNeigungswinkelbereich: -5 - 23 \u00b0\nEingebaute Lautsprecher: Nein\nIntegrierte Kamera: Nein\nProduktfarbe: Schwarz\nEnergieeffizienzklasse (SDR): F\nEnergieverbrauch (SDR) pro 1.000 Stunden: 24 kWh\nStromverbrauch (Standardbetrieb): 23,5 W\nStromverbrauch (Standby): 0,2 W\nStromverbrauch (aus): 0,2 W\nAC Eingangsspannung: 100 - 240 V\nAC Eingangsfrequenz: 50/60 Hz\nEnergieeffizienzskala: A bis G\nGer\u00e4tebreite (inkl. Fu\u00df): 613,3 mm\nGer\u00e4tetiefe (inkl. Fu\u00df): 435,6 mm\nGer\u00e4teh\u00f6he (inkl. Fu\u00df): 201,7 mm\nGewicht (mit St\u00e4nder): 4,21 kg\nBreite (ohne Standfu\u00df): 61,3 cm\nTiefe (ohne Standfu\u00df): 36,5 cm\nH\u00f6he (ohne Standfu\u00df): 5 cm\nGewicht (ohne St\u00e4nder): 3,68 kg\nVerpackungsbreite: 679 mm\nVerpackungstiefe: 445 mm\nVerpackungsh\u00f6he: 148 mm\nPaketgewicht: 6,8 kg\nVerpackungsart: Box",
    "reference_file": "offer_reference_1669.json",
    "shop_name": "TechnikLaden"
}