{
    "html_file": "offer_592_10.html",
    "name": "Philips 5000 Series 40B1U5601H, 39.53\"",
    "offer_link": "https://www.amazon.de/dp/B0BPYBVKN6?linkCode=xm2&camp=2025&creative=165953&smid=A3JWKAKR8XB7XF&creativeASIN=B0BPYBVKN6&tag=geizhals1-21",
    "price": 666.32,
    "raw_specifications": {
        "ASIN": "B0BPYBVKN6",
        "Amazon Bestseller-Rang": "Nr. 144,170 in Computer & Zubeh\u00f6r (Siehe Top 100 in Computer & Zubeh\u00f6r)  Nr. 2,474 in Monitore",
        "Artikelgewicht": "\u200e14,1 Kilograms",
        "Batterien enthalten": "\u200eNein",
        "Display-Gr\u00f6\u00dfe": "\u200e39,53 Zoll",
        "Durchschnittliche Kundenbewertung": "4,5  4,5 von 5 Sternen    \n    1.793 Sternebewertungen   \n\n\n 4,5 von 5 Sternen",
        "Farbe": "\u200eschwarz",
        "Garantierte Software-Updates bis": "\u200eunbekannt",
        "Hersteller": "\u200ePhilips",
        "Im Angebot von Amazon.de seit": "13. Dezember 2022",
        "Konnektivit\u00e4tstyp": "\u200eWLAN",
        "L\u00f6sung": "\u200e3440 x 1440 Pixels",
        "Marke": "\u200ePhilips",
        "Modellnummer": "\u200e40B1U5601H/00",
        "Produktabmessungen": "\u200e28 x 94,4 x 62,8 cm; 14,12 Kilogramm",
        "Prozessortyp": "\u200eOthers",
        "Watt": "\u200e100 Watt"
    },
    "raw_specifications_text": "Marke: \u200ePhilips\nHersteller: \u200ePhilips\nProduktabmessungen: \u200e28 x 94,4 x 62,8 cm; 14,12 Kilogramm\nModellnummer: \u200e40B1U5601H/00\nFarbe: \u200eschwarz\nDisplay-Gr\u00f6\u00dfe: \u200e39,53 Zoll\nL\u00f6sung: \u200e3440 x 1440 Pixels\nProzessortyp: \u200eOthers\nKonnektivit\u00e4tstyp: \u200eWLAN\nWatt: \u200e100 Watt\nBatterien enthalten: \u200eNein\nArtikelgewicht: \u200e14,1 Kilograms\nGarantierte Software-Updates bis: \u200eunbekannt\nASIN: B0BPYBVKN6\nDurchschnittliche Kundenbewertung: 4,5  4,5 von 5 Sternen    \n    1.793 Sternebewertungen   \n\n\n 4,5 von 5 Sternen\nAmazon Bestseller-Rang: Nr. 144,170 in Computer & Zubeh\u00f6r (Siehe Top 100 in Computer & Zubeh\u00f6r)  Nr. 2,474 in Monitore\nIm Angebot von Amazon.de seit: 13. Dezember 2022",
    "reference_file": "offer_reference_592.json",
    "shop_name": "Amazon.at"
}