{
    "html_file": "offer_1657_22.html",
    "name": "ASUS ProArt PA279CV, 27\"",
    "offer_link": "https://technikladen.at/P-ASUS-ProArt-PA279CV-686-cm-27-Zoll-3840-x-2160-Pixel-4K-Ultra-HD-LED-5-ms?tl=gzhls",
    "price": 554.09,
    "raw_specifications": {
        "AC Eingangsfrequenz": "50/60 Hz",
        "AC Eingangsspannung": "100 - 240 V",
        "Abnehmbarer Standfu\u00df": "Ja",
        "Anzahl DisplayPort Anschl\u00fcsse": "1",
        "Anzahl HDMI-Anschl\u00fcsse": "2",
        "Anzahl der Farben des Displays": "1,073 Milliarden Farben",
        "Anzahl der Lautsprecher": "2",
        "Anzahl der nachgeschalteten Ports vom Typ USB-C": "1",
        "Anzahl der nachgeschalteten Steckpl\u00e4tze vom Typ USB-A": "4",
        "Anzahl der vorgeschalteten Steckpl\u00e4tze": "4",
        "Audioanschl\u00fcsse": "Nein",
        "Bildschirmaufl\u00f6sung": "3840 x 2160 Pixel",
        "Bildschirmdiagonale": "68,6 cm",
        "Bildschirmform": "Flach",
        "Bildschirmtechnologie": "LED",
        "Bildwinkel, horizontal": "178 \u00b0",
        "Bildwinkel, vertikal": "178 \u00b0",
        "Breite (ohne Standfu\u00df)": "61,4 cm",
        "DVI Anschluss": "Nein",
        "Digital horizontale Frequenz": "29 - 160 kHz",
        "Digital vertikale Frequenz": "40 - 60 Hz",
        "DisplayPorts-Version": "1.2",
        "Dynamisches Kontrastverh\u00e4ltnis Marketingbezeichnung": "SmartContrast",
        "Eingebaute Lautsprecher": "Ja",
        "Energieeffizienzklasse (HDR)": "G",
        "Energieeffizienzklasse (SDR)": "G",
        "Energieeffizienzskala": "A bis G",
        "Energieverbrauch (HDR) pro 1.000 Stunden": "54 kWh",
        "Energieverbrauch (SDR) pro 1.000 Stunden": "32 kWh",
        "Flimmerfreie Technologie": "Ja",
        "Fu\u00dffarbe": "Silber",
        "Ger\u00e4tebreite (inkl. Fu\u00df)": "614 mm",
        "Ger\u00e4teh\u00f6he (inkl. Fu\u00df)": "524 mm",
        "Ger\u00e4tetiefe (inkl. Fu\u00df)": "228 mm",
        "Gewicht (mit St\u00e4nder)": "8,6 kg",
        "Gewicht (ohne St\u00e4nder)": "5,7 kg",
        "HD-Typ": "4K Ultra HD",
        "HDCP": "Ja",
        "HDMI": "Ja",
        "HDMI-Version": "2.0",
        "Helligkeit (typisch)": "350 cd/m\u00b2",
        "High Dynamic Range Video (HDR) Unterst\u00fctzung": "Ja",
        "H\u00f6he (ohne Standfu\u00df)": "37 cm",
        "H\u00f6heneinstellung": "15 cm",
        "H\u00f6henverstellung": "Ja",
        "Integrierte Kamera": "Nein",
        "Integrierter USB-Hub": "Ja",
        "Kabelsperre-Slot": "Ja",
        "Kontrastverh\u00e4ltnis": "1000:1",
        "Kontrastverh\u00e4ltnis (dynamisch)": "100000000:1",
        "Kopfh\u00f6rer-Anschluss": "3,5 mm",
        "Kopfh\u00f6rerausgang": "Ja",
        "Kopfh\u00f6rerausg\u00e4nge": "1",
        "Low-Blue-Light-Technologie": "Ja",
        "Maximale Bildwiederholrate": "60 Hz",
        "Mitgelieferte Kabel": "AC",
        "Natives Seitenverh\u00e4ltnis": "16:9",
        "Neigungswinkelbereich": "-5 - 35 \u00b0",
        "Paketgewicht": "11,2 kg",
        "Panel-Montage-Schnittstelle": "100 x 100 mm",
        "Panel-Typ": "IPS",
        "Pivot": "Ja",
        "Pivot Winkel": "-90 - 90 \u00b0",
        "Pixel Abstand": "0,155 x 0,155 mm",
        "Produktfarbe": "Black, Silver",
        "RMS-Leistung": "2 W",
        "Rahmenloses Design": "Ja",
        "Reaktionszeit": "5 ms",
        "Schnellstart\u00fcbersicht": "Ja",
        "Schwenkbar": "Ja",
        "Schwenkwinkelbereich": "-45 - 45 \u00b0",
        "Seitenverh\u00e4ltnis": "16:9",
        "Sichtbare Gr\u00f6\u00dfe (diagonal)": "68,5 cm",
        "Sichtbare Gr\u00f6\u00dfe (horizontal)": "59,7 cm",
        "Sichtbare Gr\u00f6\u00dfe (vertikal)": "33,6 cm",
        "Slot-Typ Kabelsperre": "Kensington",
        "Stromeingang": "Ja",
        "Stromverbrauch (Standardbetrieb)": "32,1 W",
        "Stromverbrauch (Standby)": "0,5 W",
        "Stromverbrauch (aus)": "0,2 W",
        "St\u00e4nder enthalten": "Ja",
        "Technologie mit hohem Dynamikbereich (HDR)": "High Dynamic Range 10 (HDR10)",
        "Tiefe (ohne Standfu\u00df)": "6 cm",
        "USB-Hub-Version": "3.2 Gen 1 (3.1 Gen 1)",
        "Unterst\u00fctzte Grafik-Aufl\u00f6sungen": "3840 x 2160",
        "VESA Adaptive Sync unterst\u00fctzt": "Ja",
        "VESA-Halterung": "Ja",
        "Verpackungsart": "Box",
        "Verpackungsbreite": "680 mm",
        "Verpackungsh\u00f6he": "516 mm",
        "Verpackungstiefe": "161 mm",
        "Vorderer Rahmen": "Schwarz",
        "Zertifizierung": "TUV Flicker-free , TUV Low Blue Light, Calman Verified",
        "kippbar": "Ja",
        "sRGB Abdeckung (klassisch)": "100 %"
    },
    "raw_specifications_text": "Bildschirmdiagonale: 68,6 cm\nBildschirmaufl\u00f6sung: 3840 x 2160 Pixel\nNatives Seitenverh\u00e4ltnis: 16:9\nPanel-Typ: IPS\nHelligkeit (typisch): 350 cd/m\u00b2\nReaktionszeit: 5 ms\nHD-Typ: 4K Ultra HD\nBildschirmtechnologie: LED\nBildschirmform: Flach\nUnterst\u00fctzte Grafik-Aufl\u00f6sungen: 3840 x 2160\nSeitenverh\u00e4ltnis: 16:9\nKontrastverh\u00e4ltnis: 1000:1\nKontrastverh\u00e4ltnis (dynamisch): 100000000:1\nMaximale Bildwiederholrate: 60 Hz\nDynamisches Kontrastverh\u00e4ltnis Marketingbezeichnung: SmartContrast\nBildwinkel, horizontal: 178 \u00b0\nBildwinkel, vertikal: 178 \u00b0\nAnzahl der Farben des Displays: 1,073 Milliarden Farben\nPixel Abstand: 0,155 x 0,155 mm\nSichtbare Gr\u00f6\u00dfe (horizontal): 59,7 cm\nSichtbare Gr\u00f6\u00dfe (vertikal): 33,6 cm\nSichtbare Gr\u00f6\u00dfe (diagonal): 68,5 cm\nDigital horizontale Frequenz: 29 - 160 kHz\nDigital vertikale Frequenz: 40 - 60 Hz\nHigh Dynamic Range Video (HDR) Unterst\u00fctzung: Ja\nTechnologie mit hohem Dynamikbereich (HDR): High Dynamic Range 10 (HDR10)\nsRGB Abdeckung (klassisch): 100 %\nIntegrierter USB-Hub: Ja\nUSB-Hub-Version: 3.2 Gen 1 (3.1 Gen 1)\nAnzahl der vorgeschalteten Steckpl\u00e4tze: 4\nAnzahl der nachgeschalteten Steckpl\u00e4tze vom Typ USB-A: 4\nAnzahl der nachgeschalteten Ports vom Typ USB-C: 1\nDVI Anschluss: Nein\nHDMI: Ja\nAnzahl HDMI-Anschl\u00fcsse: 2\nHDMI-Version: 2.0\nAnzahl DisplayPort Anschl\u00fcsse: 1\nDisplayPorts-Version: 1.2\nAudioanschl\u00fcsse: Nein\nKopfh\u00f6rerausgang: Ja\nKopfh\u00f6rerausg\u00e4nge: 1\nKopfh\u00f6rer-Anschluss: 3,5 mm\nHDCP: Ja\nStromeingang: Ja\nVESA-Halterung: Ja\nPanel-Montage-Schnittstelle: 100 x 100 mm\nKabelsperre-Slot: Ja\nSlot-Typ Kabelsperre: Kensington\nH\u00f6henverstellung: Ja\nH\u00f6heneinstellung: 15 cm\nPivot: Ja\nPivot Winkel: -90 - 90 \u00b0\nSchwenkbar: Ja\nSchwenkwinkelbereich: -45 - 45 \u00b0\nkippbar: Ja\nNeigungswinkelbereich: -5 - 35 \u00b0\nEingebaute Lautsprecher: Ja\nIntegrierte Kamera: Nein\nAnzahl der Lautsprecher: 2\nRMS-Leistung: 2 W\nProduktfarbe: Black, Silver\nRahmenloses Design: Ja\nVorderer Rahmen: Schwarz\nAbnehmbarer Standfu\u00df: Ja\nFu\u00dffarbe: Silber\nZertifizierung: TUV Flicker-free , TUV Low Blue Light, Calman Verified\nSt\u00e4nder enthalten: Ja\nMitgelieferte Kabel: AC\nSchnellstart\u00fcbersicht: Ja\nVerpackungsbreite: 680 mm\nVerpackungstiefe: 161 mm\nVerpackungsh\u00f6he: 516 mm\nPaketgewicht: 11,2 kg\nVerpackungsart: Box\nEnergieeffizienzklasse (SDR): G\nEnergieeffizienzklasse (HDR): G\nEnergieverbrauch (SDR) pro 1.000 Stunden: 32 kWh\nEnergieverbrauch (HDR) pro 1.000 Stunden: 54 kWh\nStromverbrauch (Standardbetrieb): 32,1 W\nStromverbrauch (Standby): 0,5 W\nStromverbrauch (aus): 0,2 W\nAC Eingangsspannung: 100 - 240 V\nAC Eingangsfrequenz: 50/60 Hz\nEnergieeffizienzskala: A bis G\nGer\u00e4tebreite (inkl. Fu\u00df): 614 mm\nGer\u00e4tetiefe (inkl. Fu\u00df): 228 mm\nGer\u00e4teh\u00f6he (inkl. Fu\u00df): 524 mm\nGewicht (mit St\u00e4nder): 8,6 kg\nBreite (ohne Standfu\u00df): 61,4 cm\nTiefe (ohne Standfu\u00df): 6 cm\nH\u00f6he (ohne Standfu\u00df): 37 cm\nGewicht (ohne St\u00e4nder): 5,7 kg\nVESA Adaptive Sync unterst\u00fctzt: Ja\nFlimmerfreie Technologie: Ja\nLow-Blue-Light-Technologie: Ja",
    "reference_file": "offer_reference_1657.json",
    "shop_name": "TechnikLaden"
}