{
    "html_file": "offer_886_32.html",
    "name": "ASUS ProArt PA32UCR-K, 32\"",
    "offer_link": "https://ms-it-beratung.at/shop/details.php?art=405392&artname=ASUS+ProArt+PA32UCR-K+81.28cm+%2816%3A9%29+UHD+HDMI+DP",
    "price": 1558.0,
    "raw_specifications": {
        "AC Eingangsfrequenz": "50 - 60 Hz",
        "AC Eingangsspannung": "100 - 240 V",
        "AMD FreeSync": "Nein",
        "Anzahl DisplayPort Anschl\u00fcsse": "1",
        "Anzahl HDMI-Anschl\u00fcsse": "3",
        "Anzahl der Farben des Displays": "1,073 Milliarden Farben",
        "Anzahl der Lautsprecher": "2",
        "Anzahl der nachgeschalteten Ports vom Typ USB-C": "1",
        "Anzahl der nachgeschalteten Steckpl\u00e4tze vom Typ USB-A": "3",
        "Bildschirmdiagonale": "81,3 cm (32 Zoll)",
        "Bildschirmform": "Flach",
        "Bildschirmtechnologie": "LED",
        "Bildwinkel, horizontal": "178\u00b0",
        "Bildwinkel, vertikal": "178\u00b0",
        "Blendfreier Bildschirm": "Ja",
        "Breite (ohne Standfu\u00df)": "72,7 cm",
        "Digital horizontale Frequenz": "40 - 144 kHz",
        "Digital vertikale Frequenz": "30 - 60 Hz",
        "Display-Aufl\u00f6sung": "3840 x 2160 Pixel",
        "DisplayPorts-Version": "1.2",
        "Eingebaute Lautsprecher": "Ja",
        "Energieeffizienzklasse (HDR)": "G",
        "Energieeffizienzklasse (SDR)": "G",
        "Energieverbrauch (HDR) pro 1.000 Stunden": "70 kWh",
        "Energieverbrauch (SDR) pro 1.000 Stunden": "42 kWh",
        "Farbskala": "100%",
        "Flimmerfreie Technologie": "Ja",
        "Ger\u00e4tebreite (inkl. Fu\u00df)": "726,9 mm",
        "Ger\u00e4teh\u00f6he (inkl. Fu\u00df)": "604,1 mm",
        "Ger\u00e4tetiefe (inkl. Fu\u00df)": "245 mm",
        "Gewicht (mit St\u00e4nder)": "12,3 kg",
        "Gewicht (ohne St\u00e4nder)": "7,7 kg",
        "HD-Typ": "4K Ultra HD",
        "HDCP": "Ja",
        "HDMI": "Ja",
        "HDMI-Version": "2.0",
        "Helligkeit (typisch)": "400 cd/m\u00b2",
        "High Dynamic Range Video (HDR) Unterst\u00fctzung": "Ja",
        "H\u00f6he (ohne Standfu\u00df)": "42,6 cm",
        "H\u00f6heneinstellung": "13 cm",
        "H\u00f6henverstellung": "Ja",
        "Integrierte Kamera": "Nein",
        "Integrierter USB-Hub": "Ja",
        "Kabelsperre-Slot": "Ja",
        "Kontrastverh\u00e4ltnis": "1000:1",
        "Kontrastverh\u00e4ltnis (dynamisch)": "100000000:1",
        "Kopfh\u00f6rerausgang": "Ja",
        "Low-Blue-Light-Technologie": "Ja",
        "Maximale Bildwiederholrate": "60 Hz",
        "Mitgelieferte Kabel": "AC, DisplayPort, HDMI, USB Typ-C",
        "NVIDIA G-SYNC": "Nein",
        "Natives Seitenverh\u00e4ltnis": "16:9",
        "Neigungsverstellung": "Ja",
        "Neigungswinkelbereich": "-5 - 23\u00b0",
        "Panel-Montage-Schnittstelle": "100 x 100 mm",
        "Panel-Typ": "IPS",
        "Pivot": "Ja",
        "Pivot Winkel": "-90 - 90\u00b0",
        "Pixel Abstand": "0,1845 x 0,1845 mm",
        "Produktfarbe": "Schwarz",
        "RGB-Farbraum": "sRGB",
        "RMS-Leistung": "4 W",
        "Reaktionszeit": "5 ms",
        "Schnellstart\u00fcbersicht": "Ja",
        "Schwenkbar": "Ja",
        "Schwenkwinkelbereich": "-30 - 30\u00b0",
        "Slot-Typ Kabelsperre": "Kensington",
        "Stromverbrauch (PowerSave)": "0,5 W",
        "Stromverbrauch (Standardbetrieb)": "46 W",
        "St\u00e4nder enthalten": "Ja",
        "Technologie mit hohem Dynamikbereich (HDR)": "High Dynamic Range 10 (HDR10), Hybrid Log-Gamma (HLG)",
        "Tiefe (ohne Standfu\u00df)": "6,87 cm",
        "Touchscreen": "Nein",
        "Typ Ladeanschluss": "USB Typ-C",
        "Typ der Hintergrundbeleuchtung": "LED",
        "USB-Hub-Version": "3.2 Gen 1 (3.1 Gen 1)",
        "VESA-Halterung": "Ja",
        "Warentarifnummer (HS)": "85285210",
        "Zertifizierung": "T\u00dcV Flicker-free T\u00dcV Low Blue Light VESA DisplayHDR 1000 Calman Ready",
        "sRGB Abdeckung (klassisch)": "100%"
    },
    "raw_specifications_text": "Bildschirmdiagonale: 81,3 cm (32 Zoll)\nDisplay-Aufl\u00f6sung: 3840 x 2160 Pixel\nNatives Seitenverh\u00e4ltnis: 16:9\nBildschirmtechnologie: LED\nTouchscreen: Nein\nHD-Typ: 4K Ultra HD\nPanel-Typ: IPS\nTyp der Hintergrundbeleuchtung: LED\nHelligkeit (typisch): 400 cd/m\u00b2\nReaktionszeit: 5 ms\nBlendfreier Bildschirm: Ja\nBildschirmform: Flach\nKontrastverh\u00e4ltnis: 1000:1\nKontrastverh\u00e4ltnis (dynamisch): 100000000:1\nMaximale Bildwiederholrate: 60 Hz\nBildwinkel, horizontal: 178\u00b0\nBildwinkel, vertikal: 178\u00b0\nAnzahl der Farben des Displays: 1,073 Milliarden Farben\nPixel Abstand: 0,1845 x 0,1845 mm\nDigital horizontale Frequenz: 40 - 144 kHz\nDigital vertikale Frequenz: 30 - 60 Hz\nHigh Dynamic Range Video (HDR) Unterst\u00fctzung: Ja\nTechnologie mit hohem Dynamikbereich (HDR): High Dynamic Range 10 (HDR10), Hybrid Log-Gamma (HLG)\nRGB-Farbraum: sRGB\nFarbskala: 100%\nsRGB Abdeckung (klassisch): 100%\nNVIDIA G-SYNC: Nein\nAMD FreeSync: Nein\nFlimmerfreie Technologie: Ja\nLow-Blue-Light-Technologie: Ja\nEingebaute Lautsprecher: Ja\nIntegrierte Kamera: Nein\nAnzahl der Lautsprecher: 2\nRMS-Leistung: 4 W\nProduktfarbe: Schwarz\nZertifizierung: T\u00dcV Flicker-free T\u00dcV Low Blue Light VESA DisplayHDR 1000 Calman Ready\nIntegrierter USB-Hub: Ja\nUSB-Hub-Version: 3.2 Gen 1 (3.1 Gen 1)\nAnzahl der nachgeschalteten Steckpl\u00e4tze vom Typ USB-A: 3\nAnzahl der nachgeschalteten Ports vom Typ USB-C: 1\nHDMI: Ja\nAnzahl HDMI-Anschl\u00fcsse: 3\nHDMI-Version: 2.0\nAnzahl DisplayPort Anschl\u00fcsse: 1\nDisplayPorts-Version: 1.2\nKopfh\u00f6rerausgang: Ja\nHDCP: Ja\nTyp Ladeanschluss: USB Typ-C\nVESA-Halterung: Ja\nPanel-Montage-Schnittstelle: 100 x 100 mm\nKabelsperre-Slot: Ja\nSlot-Typ Kabelsperre: Kensington\nH\u00f6henverstellung: Ja\nH\u00f6heneinstellung: 13 cm\nPivot: Ja\nPivot Winkel: -90 - 90\u00b0\nSchwenkbar: Ja\nSchwenkwinkelbereich: -30 - 30\u00b0\nNeigungswinkelbereich: -5 - 23\u00b0\nNeigungsverstellung: Ja\nEnergieeffizienzklasse (SDR): G\nEnergieeffizienzklasse (HDR): G\nEnergieverbrauch (SDR) pro 1.000 Stunden: 42 kWh\nEnergieverbrauch (HDR) pro 1.000 Stunden: 70 kWh\nStromverbrauch (Standardbetrieb): 46 W\nStromverbrauch (PowerSave): 0,5 W\nAC Eingangsspannung: 100 - 240 V\nAC Eingangsfrequenz: 50 - 60 Hz\nSt\u00e4nder enthalten: Ja\nMitgelieferte Kabel: AC, DisplayPort, HDMI, USB Typ-C\nSchnellstart\u00fcbersicht: Ja\nGer\u00e4tebreite (inkl. Fu\u00df): 726,9 mm\nGer\u00e4tetiefe (inkl. Fu\u00df): 245 mm\nGer\u00e4teh\u00f6he (inkl. Fu\u00df): 604,1 mm\nGewicht (mit St\u00e4nder): 12,3 kg\nBreite (ohne Standfu\u00df): 72,7 cm\nTiefe (ohne Standfu\u00df): 6,87 cm\nH\u00f6he (ohne Standfu\u00df): 42,6 cm\nGewicht (ohne St\u00e4nder): 7,7 kg\nWarentarifnummer (HS): 85285210",
    "reference_file": "offer_reference_886.json",
    "shop_name": "ms-it-beratung"
}