{
    "html_file": "offer_604_21.html",
    "name": "Philips S-line 242S9JAL, 23.8\"",
    "offer_link": "https://www.future-x.at/philips-s-line-led-monitor-60-5-cm-238-1920-x-1080-full-hd-1080p-%40-75-hz-va-300-cd-m%B2-3000%3A1-4-ms-hdmi-vga-displayport-lautsprecher-schwarz-p-9079946/?pv=2",
    "price": 132.29,
    "raw_specifications": {
        "Abmessungen (Breite x Tiefe x H\u00f6he)": "53,9 cm x 20,8 cm x 43 cm - mit Standfu\u00df (h\u00f6chste Position)",
        "Ausgangsleistung/Kanal": "2 Watt",
        "Besonderheiten": "Sync-on-Green, SmartImage, flimmerfreie Technologie, Adaptive-Sync-Technologie, EasyRead, sRGB Mode, an 3 Seiten ohne Blende, LowBlue Mode, LED-Betriebsanzeige",
        "Bildschirmbeschichtung": "Haze 25 %, anti-glare 3H hardness",
        "Bildschirmtyp": "VA",
        "Details zu Abmessungen & Gewicht": "Mit Standfu\u00df (h\u00f6chste Position) - Breite: 53,9 cm - Tiefe: 20,8 cm - H\u00f6he: 43 cm - Gewicht: 3,43 kg \u00a6 Ohne Fu\u00df - Breite: 53,9 cm - Tiefe: 5,5 cm - H\u00f6he: 32,4 cm - Gewicht: 3,01 kg",
        "Diagonalabmessung": "60,5 cm (23.8\")",
        "Display-Typ": "LED-hintergrundbeleuchteter LCD-Monitor",
        "ENERGY STAR zertifiziert": "Ja",
        "ENERGY STAR-Version": "8.0",
        "Ein-/Aus-Schalter": "Ja",
        "Eingangsspannung": "Wechselstrom 100-240 V (50/60 Hz)",
        "Einstellungen der Anzeigeposition": "Neigung",
        "Energie Effizienzklasse": "Klasse E",
        "Energieverbrauch pro Jahr": "21 kWh",
        "Enthaltene Kabel": "HDMI-Kabel",
        "Erforderliches Betriebssystem": "Apple MacOS X, Microsoft Windows 7 / 8 / 8.1 / 10 / 11",
        "Farbe": "Schwarz",
        "Farbraum": "80% NTSC (CIE 1976)",
        "Farbunterst\u00fctzung": "16,7 Millionen Farben (8-Bit)",
        "Gewicht": "3,43 kg",
        "Helligkeit": "300 cd/m\u00b2",
        "Hintergrundbeleuchtungs-Technologie": "WLED",
        "Horizontale Bildwiederholrate": "30 - 85 kHz",
        "Horizontaler Betrachtungswinkel": "178",
        "Integrierte Peripherieger\u00e4te": "USB Hub",
        "Kennzeichnung": "FCC Klasse B bescheinigt, TUV GS, ICES-003, SEMKO, CB, TUV Ergo, DDC/CI, RoHS, CU-EAC, HDCP 1.4, TCO Certified Edge, EAEU RoHS",
        "Kontrast": "3000:1 / 50000000:1 (dynamisch)",
        "Leistungsmerkmale": "Slot f\u00fcr Sicherheitsschloss (Kabelschloss getrennt erh\u00e4ltlich), PVC-frei, quecksilberfrei, 100 % recycelbare Verpackung, strukturierte Oberfl\u00e4che, 85 % recycelter Kunststoff, frei von BFR",
        "MTBF": "70,000 Stunde(n)",
        "Max. Betriebstemperatur": "40 \u00b0C",
        "Min Betriebstemperatur": "0 \u00b0C",
        "Mitgelieferte Software": "Philips SmartControl",
        "Native Aufl\u00f6sung": "Full HD (1080p) 1920 x 1080 bei 75 Hz",
        "Neigungswinkel": "-5/+25",
        "OSD-Sprachen": "Ungarisch, Tschechisch, Chinesisch (tradionell), Chinesisch (vereinfacht), Ukrainisch, Brasilianisches Portugiesisch, Englisch, Deutsch, Franz\u00f6sisch, Italienisch, Portugiesisch, Polnisch, Finnisch, Schwedisch, Russisch, Spanisch, Holl\u00e4ndisch, Griechisch, T\u00fcrkisch, Japanisch, Koreanisch",
        "Pixelpitch": "0.2745 mm",
        "Ppi": "93",
        "Reaktionszeit": "4 ms (gray-to-gray)",
        "Schlosstyp zur Diebstahlsicherung": "Kensington Slot",
        "Schnittstellen": "VGA (DB-15) \u00a6 HDMI (HDCP 1.4) \u00a6 DisplayPort (HDCP 1.4) \u00a6 Audio Line-Out \u00a6 Audio Line-In \u00a6 USB-B 3.2 Gen 1 Upstream \u00a6 USB Downstream (Schnellladung) \u00a6 USB Downstream",
        "Seitenverh\u00e4ltnis": "16:9",
        "Service und Support": "Begrenzte Garantie - 3 Jahre",
        "Stromverbrauch (Aus-Modus)": "0.3 Watt",
        "Stromverbrauch (typisch)": "15 Watt",
        "Stromverbrauch im Standby-Modus": "0.3 Watt",
        "Transportbreite": "61,6 cm",
        "Transportgewicht": "5,31 kg",
        "Transporth\u00f6he": "42 cm",
        "Transporttiefe": "12,4 cm",
        "Typ": "Lautsprecher - Stereo",
        "VESA-Halterung": "100 x 100 mm",
        "Vertikale Bildwiederholrate": "48 - 75 Hz",
        "Vertikaler Betrachtungswinkel": "178",
        "Zul\u00e4ssige Luftfeuchtigkeit im Betrieb": "20 - 80% RH"
    },
    "raw_specifications_text": "Display-Typ: LED-hintergrundbeleuchteter LCD-Monitor\nEnergie Effizienzklasse: Klasse E\nEnergieverbrauch pro Jahr: 21 kWh\nDiagonalabmessung: 60,5 cm (23.8\")\nIntegrierte Peripherieger\u00e4te: USB Hub\nBildschirmtyp: VA\nSeitenverh\u00e4ltnis: 16:9\nNative Aufl\u00f6sung: Full HD (1080p) 1920 x 1080 bei 75 Hz\nPixelpitch: 0.2745 mm\nPpi: 93\nHelligkeit: 300 cd/m\u00b2\nKontrast: 3000:1 / 50000000:1 (dynamisch)\nFarbunterst\u00fctzung: 16,7 Millionen Farben (8-Bit)\nFarbraum: 80% NTSC (CIE 1976)\nReaktionszeit: 4 ms (gray-to-gray)\nVertikale Bildwiederholrate: 48 - 75 Hz\nHorizontale Bildwiederholrate: 30 - 85 kHz\nHorizontaler Betrachtungswinkel: 178\nVertikaler Betrachtungswinkel: 178\nBildschirmbeschichtung: Haze 25 %, anti-glare 3H hardness\nHintergrundbeleuchtungs-Technologie: WLED\nOSD-Sprachen: Ungarisch, Tschechisch, Chinesisch (tradionell), Chinesisch (vereinfacht), Ukrainisch, Brasilianisches Portugiesisch, Englisch, Deutsch, Franz\u00f6sisch, Italienisch, Portugiesisch, Polnisch, Finnisch, Schwedisch, Russisch, Spanisch, Holl\u00e4ndisch, Griechisch, T\u00fcrkisch, Japanisch, Koreanisch\nBesonderheiten: Sync-on-Green, SmartImage, flimmerfreie Technologie, Adaptive-Sync-Technologie, EasyRead, sRGB Mode, an 3 Seiten ohne Blende, LowBlue Mode, LED-Betriebsanzeige\nFarbe: Schwarz\nAbmessungen (Breite x Tiefe x H\u00f6he): 53,9 cm x 20,8 cm x 43 cm - mit Standfu\u00df (h\u00f6chste Position)\nGewicht: 3,43 kg\nTyp: Lautsprecher - Stereo\nAusgangsleistung/Kanal: 2 Watt\nSchnittstellen: VGA (DB-15) \u00a6 HDMI (HDCP 1.4) \u00a6 DisplayPort (HDCP 1.4) \u00a6 Audio Line-Out \u00a6 Audio Line-In \u00a6 USB-B 3.2 Gen 1 Upstream \u00a6 USB Downstream (Schnellladung) \u00a6 USB Downstream\nEinstellungen der Anzeigeposition: Neigung\nNeigungswinkel: -5/+25\nVESA-Halterung: 100 x 100 mm\nLeistungsmerkmale: Slot f\u00fcr Sicherheitsschloss (Kabelschloss getrennt erh\u00e4ltlich), PVC-frei, quecksilberfrei, 100 % recycelbare Verpackung, strukturierte Oberfl\u00e4che, 85 % recycelter Kunststoff, frei von BFR\nEnthaltene Kabel: HDMI-Kabel\nMTBF: 70,000 Stunde(n)\nKennzeichnung: FCC Klasse B bescheinigt, TUV GS, ICES-003, SEMKO, CB, TUV Ergo, DDC/CI, RoHS, CU-EAC, HDCP 1.4, TCO Certified Edge, EAEU RoHS\nSchlosstyp zur Diebstahlsicherung: Kensington Slot\nEingangsspannung: Wechselstrom 100-240 V (50/60 Hz)\nStromverbrauch (typisch): 15 Watt\nStromverbrauch im Standby-Modus: 0.3 Watt\nStromverbrauch (Aus-Modus): 0.3 Watt\nEin-/Aus-Schalter: Ja\nMitgelieferte Software: Philips SmartControl\nErforderliches Betriebssystem: Apple MacOS X, Microsoft Windows 7 / 8 / 8.1 / 10 / 11\nDetails zu Abmessungen & Gewicht: Mit Standfu\u00df (h\u00f6chste Position) - Breite: 53,9 cm - Tiefe: 20,8 cm - H\u00f6he: 43 cm - Gewicht: 3,43 kg \u00a6 Ohne Fu\u00df - Breite: 53,9 cm - Tiefe: 5,5 cm - H\u00f6he: 32,4 cm - Gewicht: 3,01 kg\nTransportbreite: 61,6 cm\nTransporttiefe: 12,4 cm\nTransporth\u00f6he: 42 cm\nTransportgewicht: 5,31 kg\nENERGY STAR zertifiziert: Ja\nENERGY STAR-Version: 8.0\nService und Support: Begrenzte Garantie - 3 Jahre\nMin Betriebstemperatur: 0 \u00b0C\nMax. Betriebstemperatur: 40 \u00b0C\nZul\u00e4ssige Luftfeuchtigkeit im Betrieb: 20 - 80% RH",
    "reference_file": "offer_reference_604.json",
    "shop_name": "Future-X.at"
}