{
    "html_file": "offer_2377_0.html",
    "name": "iiyama ProLite B2283HS-B3, 21.5\"",
    "offer_link": "https://www.taufnaus.de/product/10621043",
    "price": 184.48,
    "raw_specifications": {
        "Abmessungen (Breite x Tiefe x H\u00f6he)": "50.5 cm x 2.3 cm x 37.15 cm",
        "Ausgangsleistung/Kanal": "1 Watt",
        "Besonderheiten": "HDCP, Overdrive-Technologie, Advanced Contrast Ratio (ACR), flimmerfreie Technologie, Reduzierung des blauen Lichtanteils",
        "Bildschirmbeschichtung": "Matt",
        "Bildschirmtyp": "TN",
        "Diagonalabmessung": "54.7 cm (21.5\")",
        "Display-Typ": "LED-hintergrundbeleuchteter LCD-Monitor / TFT-Aktivmatrix",
        "ENERGY STAR zertifiziert": "Ja",
        "Einstellungen der Anzeigeposition": "H\u00f6he, Pivot (Rotation), Drehung, Neigung",
        "Energie Effizienzklasse": "Klasse B",
        "Energieverbrauch pro Jahr": "32 kWh",
        "Enthaltene Kabel": "1 x HDMI-Kabel",
        "Erforderliche Netzspannung": "Wechselstrom 120/230 V (50/60 Hz)",
        "Farbe": "Schwarz",
        "Farbunterst\u00fctzung": "16,7 Millionen Farben",
        "Gewicht": "4.8 kg",
        "Helligkeit": "250 cd/m\u00b2",
        "Hintergrundbeleuchtungs-Technologie": "LED-Hintergrundbeleuchtung",
        "Horizontale Bildwiederholrate": "30 - 80 kHz",
        "Horizontaler Betrachtungswinkel": "+85 / -85",
        "H\u00f6heneinstellung": "130 mm",
        "Kennzeichnung": "TUV GS, DDC-2B, VESA DPMS, VCCI Class B, CU",
        "Kontrast": "1000:1 / 80000000:1 (dynamisch)",
        "Leistungsaufnahme im Betrieb": "21 Watt",
        "Leistungsaufnahme im Ein-Zustand": "21.8 W",
        "Leistungsmerkmale": "Slot f\u00fcr Sicherheitsschloss (Kabelschloss getrennt erh\u00e4ltlich)",
        "Native Aufl\u00f6sung": "Full HD (1080p) 1920 x 1080 bei 60 Hz",
        "Neigungswinkel": "-5/+22",
        "OSD-Sprachen": "Tschechisch, Englisch, Deutsch, Franz\u00f6sisch, Italienisch, Polnisch, Russisch, Spanisch, Holl\u00e4ndisch, Japanisch, Chinesisch",
        "Pixelpitch": "0.248 mm",
        "Power Consumption (Typical)": "21 Watt",
        "Reaktionszeit": "1 ms",
        "Rotationswinkel": "90",
        "Schnittstellen": "VGA \u00a6 HDMI \u00a6 Kopfh\u00f6rer \u00a6 DisplayPort \u00a6 Audio Line-In",
        "Schwenkwinkel": "90",
        "Seitenverh\u00e4ltnis": "16:9",
        "Service & Support": "Begrenzte Garantie - 3 Jahre",
        "Stromverbrauch im Standby-Modus": "0.5 Watt",
        "Typ": "Lautsprecher - Stereo",
        "VESA-Halterung": "100 x 100 mm",
        "Vertikale Bildwiederholrate": "55 - 75 Hz",
        "Vertikaler Betrachtungswinkel": "+80 / -80"
    },
    "raw_specifications_text": "Display-Typ: LED-hintergrundbeleuchteter LCD-Monitor / TFT-Aktivmatrix\nEnergie Effizienzklasse: Klasse B\nEnergieverbrauch pro Jahr: 32 kWh\nDiagonalabmessung: 54.7 cm (21.5\")\nBildschirmtyp: TN\nSeitenverh\u00e4ltnis: 16:9\nNative Aufl\u00f6sung: Full HD (1080p) 1920 x 1080 bei 60 Hz\nPixelpitch: 0.248 mm\nHelligkeit: 250 cd/m\u00b2\nKontrast: 1000:1 / 80000000:1 (dynamisch)\nFarbunterst\u00fctzung: 16,7 Millionen Farben\nReaktionszeit: 1 ms\nVertikale Bildwiederholrate: 55 - 75 Hz\nHorizontale Bildwiederholrate: 30 - 80 kHz\nHorizontaler Betrachtungswinkel: +85 / -85\nVertikaler Betrachtungswinkel: +80 / -80\nBildschirmbeschichtung: Matt\nHintergrundbeleuchtungs-Technologie: LED-Hintergrundbeleuchtung\nOSD-Sprachen: Tschechisch, Englisch, Deutsch, Franz\u00f6sisch, Italienisch, Polnisch, Russisch, Spanisch, Holl\u00e4ndisch, Japanisch, Chinesisch\nBesonderheiten: HDCP, Overdrive-Technologie, Advanced Contrast Ratio (ACR), flimmerfreie Technologie, Reduzierung des blauen Lichtanteils\nFarbe: Schwarz\nAbmessungen (Breite x Tiefe x H\u00f6he): 50.5 cm x 2.3 cm x 37.15 cm\nGewicht: 4.8 kg\nTyp: Lautsprecher - Stereo\nAusgangsleistung/Kanal: 1 Watt\nSchnittstellen: VGA \u00a6 HDMI \u00a6 Kopfh\u00f6rer \u00a6 DisplayPort \u00a6 Audio Line-In\nEinstellungen der Anzeigeposition: H\u00f6he, Pivot (Rotation), Drehung, Neigung\nNeigungswinkel: -5/+22\nSchwenkwinkel: 90\nRotationswinkel: 90\nH\u00f6heneinstellung: 130 mm\nVESA-Halterung: 100 x 100 mm\nLeistungsmerkmale: Slot f\u00fcr Sicherheitsschloss (Kabelschloss getrennt erh\u00e4ltlich)\nEnthaltene Kabel: 1 x HDMI-Kabel\nKennzeichnung: TUV GS, DDC-2B, VESA DPMS, VCCI Class B, CU\nErforderliche Netzspannung: Wechselstrom 120/230 V (50/60 Hz)\nLeistungsaufnahme im Ein-Zustand: 21.8 W\nLeistungsaufnahme im Betrieb: 21 Watt\nPower Consumption (Typical): 21 Watt\nStromverbrauch im Standby-Modus: 0.5 Watt\nENERGY STAR zertifiziert: Ja\nService & Support: Begrenzte Garantie - 3 Jahre",
    "reference_file": "offer_reference_2377.json",
    "shop_name": "TaufNaus"
}