{
    "html_file": "offer_1304_6.html",
    "name": "Samsung Odyssey Neo G9 G95NA (2021), 49\"",
    "offer_link": "https://direkt.jacob.de/produkte/samsung-odyssey-neo-ls49ag954nuxen-artnr-7182691.html?utm_source=geizhals&utm_medium=cpc&utm_campaign=Preisvergleich&ref=103",
    "price": 1506.54,
    "raw_specifications": {
        "AMD FreeSync": "Ja",
        "AMD FreeSync-Typ": "FreeSync Premium Pro",
        "Anzahl DisplayPort Anschl\u00fcsse": "1",
        "Anzahl HDMI-Anschl\u00fcsse": "2",
        "Anzahl der Farben des Displays": "1,07 Milliarden Farben",
        "Bewertung der Bildschirmkr\u00fcmmung": "1000R",
        "Bild-in-Bild": "Ja",
        "Bildschirmaufl\u00f6sung": "5120 x 1440 Pixel",
        "Bildschirmdiagonale": "124,5 cm (49\" )",
        "Bildschirmdiagonale (cm)": "124 cm",
        "Bildschirmform": "Gebogen",
        "Bildschirmtechnologie": "LCD",
        "Blickwinkel, horizontal": "178\u00b0",
        "Blickwinkel, vertikal": "178\u00b0",
        "Breite (ohne Standfu\u00df)": "115 cm",
        "DisplayPort Kabell\u00e4nge": "1,5 m",
        "Energie Effizienzklasse": "G",
        "Energieeffizienzklasse (HDR)": "G",
        "Energieeffizienzklasse (SDR)": "G",
        "Energieverbrauch (HDR) pro 1.000 Stunden": "95 kWh",
        "Energieverbrauch (SDR) pro 1.000 Stunden": "55 kWh",
        "Flimmerfreie Technologie": "Ja",
        "Ger\u00e4tebreite (inkl. Fu\u00df)": "1149,5 mm",
        "Ger\u00e4teh\u00f6he (inkl. Fu\u00df)": "537,2 mm",
        "Ger\u00e4tetiefe (inkl. Fu\u00df)": "418,3 mm",
        "Gewicht (ohne St\u00e4nder)": "14,5 kg",
        "HD-Typ": "5K Ultra HD",
        "HDMI-Version": "2.0",
        "Helligkeit (typisch)": "420 cd/m\u00b2",
        "High Dynamic Range Video Unterst\u00fctzung": "Ja",
        "H\u00f6he (ohne Standfu\u00df)": "36,4 cm",
        "H\u00f6heneinstellung": "12 cm",
        "H\u00f6henverstellung": "Ja",
        "Integrierter USB-Hub": "Ja",
        "Kontrastverh\u00e4ltnis": "1000000:1",
        "Marktpositionierung": "Business",
        "Maximale Bildwiederholrate": "240 Hz",
        "Mitgelieferte Kabel": "AC, USB",
        "NVIDIA G-SYNC": "Ja",
        "NVIDIA G-SYNC-Typ": "G-SYNC Compatible",
        "Name der Farbe": "Wei\u00df, Schwarz",
        "Natives Seitenverh\u00e4ltnis": "32:9",
        "Neigungswinkelbereich": "3 - 13\u00b0",
        "Paketgewicht": "20,4 kg",
        "Panel-Montage-Schnittstelle": "100 x 100 mm",
        "Panel-Typ": "VA",
        "Pivot": "Ja",
        "Pivot Winkel": "15 - 15\u00b0",
        "Produktfarbe": "Schwarz, Wei\u00df",
        "Reaktionszeit": "1 ms",
        "Stromverbrauch (Standardbetrieb)": "55 W",
        "Stromverbrauch (Standby)": "0,5 W",
        "Stromverbrauch (aus)": "0,3 W",
        "St\u00e4nder enthalten": "Ja",
        "Technologie mit hohem Dynamikbereich (HDR)": "Quantum HDR 2000",
        "Tiefe (ohne Standfu\u00df)": "28,7 cm",
        "USB-Hub-Version": "3.2 Gen 1 (3.1 Gen 1)",
        "VESA-Halterung": "Ja",
        "Verpackungsart": "Box",
        "Verpackungsbreite": "1265 mm",
        "Verpackungsh\u00f6he": "366 mm",
        "Verpackungstiefe": "481 mm",
        "Zertifizierung": "CE"
    },
    "raw_specifications_text": "Energie Effizienzklasse: G\nBildschirmdiagonale: 124,5 cm (49\" )\nBildschirmaufl\u00f6sung: 5120 x 1440 Pixel\nNatives Seitenverh\u00e4ltnis: 32:9\nPanel-Typ: VA\nHD-Typ: 5K Ultra HD\nBildschirmtechnologie: LCD\nBildschirmform: Gebogen\nKontrastverh\u00e4ltnis: 1000000:1\nMaximale Bildwiederholrate: 240 Hz\nAnzahl der Farben des Displays: 1,07 Milliarden Farben\nHelligkeit (typisch): 420 cd/m\u00b2\nReaktionszeit: 1 ms\nBewertung der Bildschirmkr\u00fcmmung: 1000R\nBlickwinkel, horizontal: 178\u00b0\nBlickwinkel, vertikal: 178\u00b0\nBildschirmdiagonale (cm): 124 cm\nHigh Dynamic Range Video Unterst\u00fctzung: Ja\nTechnologie mit hohem Dynamikbereich (HDR): Quantum HDR 2000\nNVIDIA G-SYNC: Ja\nAMD FreeSync: Ja\nNVIDIA G-SYNC-Typ: G-SYNC Compatible\nAMD FreeSync-Typ: FreeSync Premium Pro\nFlimmerfreie Technologie: Ja\nMarktpositionierung: Business\nProduktfarbe: Schwarz, Wei\u00df\nName der Farbe: Wei\u00df, Schwarz\nZertifizierung: CE\nIntegrierter USB-Hub: Ja\nUSB-Hub-Version: 3.2 Gen 1 (3.1 Gen 1)\nAnzahl HDMI-Anschl\u00fcsse: 2\nHDMI-Version: 2.0\nAnzahl DisplayPort Anschl\u00fcsse: 1\nVESA-Halterung: Ja\nH\u00f6henverstellung: Ja\nPanel-Montage-Schnittstelle: 100 x 100 mm\nH\u00f6heneinstellung: 12 cm\nPivot: Ja\nPivot Winkel: 15 - 15\u00b0\nNeigungswinkelbereich: 3 - 13\u00b0\nBild-in-Bild: Ja\nEnergieeffizienzklasse (SDR): G\nEnergieeffizienzklasse (HDR): G\nEnergieverbrauch (SDR) pro 1.000 Stunden: 55 kWh\nEnergieverbrauch (HDR) pro 1.000 Stunden: 95 kWh\nStromverbrauch (Standardbetrieb): 55 W\nStromverbrauch (Standby): 0,5 W\nStromverbrauch (aus): 0,3 W\nGer\u00e4tebreite (inkl. Fu\u00df): 1149,5 mm\nGer\u00e4tetiefe (inkl. Fu\u00df): 418,3 mm\nGer\u00e4teh\u00f6he (inkl. Fu\u00df): 537,2 mm\nBreite (ohne Standfu\u00df): 115 cm\nTiefe (ohne Standfu\u00df): 28,7 cm\nH\u00f6he (ohne Standfu\u00df): 36,4 cm\nGewicht (ohne St\u00e4nder): 14,5 kg\nSt\u00e4nder enthalten: Ja\nMitgelieferte Kabel: AC, USB\nDisplayPort Kabell\u00e4nge: 1,5 m\nVerpackungsbreite: 1265 mm\nVerpackungstiefe: 481 mm\nVerpackungsh\u00f6he: 366 mm\nPaketgewicht: 20,4 kg\nVerpackungsart: Box",
    "reference_file": "offer_reference_1304.json",
    "shop_name": "Jacob Elektronik direkt (AT)"
}