{
    "html_file": "offer_2395_10.html",
    "name": "BenQ GW2480, 23.8\"",
    "offer_link": "https://www.mylemon.at/artikel/benq/9h_lgdla_tbe/60-5cm-gw2480-16-9.html",
    "price": 122.94,
    "raw_specifications": {
        "AC Eingangsspannung": "100 - 240 V",
        "AMD FreeSync": "Nein",
        "Anzahl DisplayPort Anschl\u00fcsse": "1",
        "Anzahl HDMI-Anschl\u00fcsse": "1",
        "Anzahl OSD-Sprachen": "17",
        "Anzahl VGA (D-Sub) Anschl\u00fcsse": "1",
        "Anzahl der Farben des Displays": "16,78 Millionen Farben",
        "Anzahl der Lautsprecher": "2",
        "Artikelnummer": "MPEYOHL",
        "Aufl\u00f6sung": "1920x1080",
        "Besonderheiten": "Lautsprecher",
        "Betriebstemperatur": "5 - 40 \u00b0C",
        "Bildschirmdiagonale": "60,5 cm (23.8 Zoll)",
        "Bildschirmform": "Flach",
        "Bildschirmtechnologie": "LED",
        "Bildwinkel, horizontal": "178\u00b0",
        "Bildwinkel, vertikal": "178\u00b0",
        "Breite (ohne Standfu\u00df)": "61,2 cm",
        "DVI Anschluss": "Nein",
        "Digital horizontale Frequenz": "30 - 83 kHz",
        "Digital vertikale Frequenz": "50 - 76 Hz",
        "Display-Aufl\u00f6sung": "1920 x 1080 Pixel",
        "DisplayPorts-Version": "1.2",
        "Displaygr\u00f6\u00dfe": "23,8 Zoll",
        "EAN": "4718755070068",
        "Ein-/Ausschalter": "Ja",
        "Eingebaute Lautsprecher": "Ja",
        "Eingebauter Ethernet-Anschluss": "Nein",
        "Energieeffizienzklasse (SDR)": "E",
        "Energieeffizienzskala": "A bis G",
        "Energieverbrauch (SDR) pro 1.000 Stunden": "15 kWh",
        "Flimmerfreie Technologie": "Ja",
        "Fu\u00dffarbe": "Schwarz",
        "Ger\u00e4tebreite (inkl. Fu\u00df)": "612 mm",
        "Ger\u00e4teh\u00f6he (inkl. Fu\u00df)": "463 mm",
        "Ger\u00e4tetiefe (inkl. Fu\u00df)": "183 mm",
        "Gewicht (mit St\u00e4nder)": "3,84 kg",
        "Gewicht (ohne St\u00e4nder)": "3,04 kg",
        "HD-Typ": "Full HD",
        "HDCP": "Ja",
        "HDCP-Version": "1.4",
        "HDMI": "Ja",
        "HDMI-Version": "1.4",
        "Helligkeit": "250 cd/m\u00b2",
        "Helligkeit (typisch)": "250 cd/m\u00b2",
        "Hersteller Artikelnummer": "9H.LGDLA.TBE",
        "H\u00f6he (ohne Standfu\u00df)": "38,1 cm",
        "H\u00f6henverstellung": "Nein",
        "Integrierte Kamera": "Nein",
        "Integrierter USB-Hub": "Nein",
        "Kabelsperre-Slot": "Ja",
        "Kontrastverh\u00e4ltnis": "1000:1",
        "Kontrastverh\u00e4ltnis (dynamisch)": "12000000:1",
        "Kopfh\u00f6rer-Anschluss": "3,5 mm",
        "Kopfh\u00f6rerausg\u00e4nge": "1",
        "LED-Anzeigen": "Ja",
        "Low-Blue-Light-Technologie": "Ja",
        "Luftfeuchtigkeit bei Lagerung": "10 - 90%",
        "Marktpositionierung": "Haus",
        "Maximale Bildwiederholrate": "60 Hz",
        "Men\u00fcsprachen": "Vereinfachtes Chinesisch, Traditionelles Chinesisch, Tschechisch, Deutsch, Niederl\u00e4ndisch, Englisch, Spanisch, Franz\u00f6sisch, Ungarisch, Italienisch, Japanisch, Koreanisch, Polnisch, Portugiesisch, Rum\u00e4nisch, Russisch, Schwedisch",
        "Mitgelieferte Kabel": "AC, HDMI, VGA",
        "NTSC Abdeckung (typisch)": "72%",
        "NVIDIA G-SYNC": "Nein",
        "Nachhaltigkeitszertifikate": "EPEAT Silver, ENERGY STAR",
        "Natives Seitenverh\u00e4ltnis": "16:9",
        "Neigungsverstellung": "Ja",
        "Neigungswinkelbereich": "-5 - 20\u00b0",
        "On-Screen-Display (OSD)": "Ja",
        "Panel": "IPS",
        "Panel-Montage-Schnittstelle": "100 x 100 mm",
        "Panel-Typ": "IPS",
        "Pixel Abstand": "0,311 x 0,311 mm",
        "Pixeldichte": "93 ppi",
        "Produktfarbe": "Schwarz",
        "RGB-Farbraum": "NTSC",
        "RMS-Leistung": "2 W",
        "Reaktionszeit": "5 ms",
        "Relative Luftfeuchtigkeit in Betrieb": "20 - 90%",
        "Sichtbare Gr\u00f6\u00dfe (vertikal)": "52,7 cm",
        "Slot-Typ Kabelsperre": "Kensington",
        "Smart-Modi": "Kino, Benutzerdefinierung, Spiel, Foto, Standard",
        "Stromverbrauch (Standardbetrieb)": "14,7 W",
        "Stromverbrauch (Standby)": "0,3 W",
        "Stromverbrauch (aus)": "0,2 W",
        "TV Tuner integriert": "Nein",
        "Temperaturbereich bei Lagerung": "-20 - 60 \u00b0C",
        "Tiefe (ohne Standfu\u00df)": "5 cm",
        "Touchscreen": "Nein",
        "Unterst\u00fctzte Grafik-Aufl\u00f6sungen": "1920 x 1080 (HD 1080)",
        "Unterst\u00fctzte Video-Modi": "1080p",
        "VESA Halterung": "100x100 mm",
        "VESA-Halterung": "Ja",
        "Verpackungsart": "Box",
        "Verpackungsbreite": "466 mm",
        "Verpackungsh\u00f6he": "140 mm",
        "Verpackungstiefe": "730 mm",
        "Video Anschl\u00fcsse": "1x HDMI",
        "WLAN": "Nein",
        "Warentarifnummer (HS)": "85285210",
        "Zertifizierung": "CE, T\u00dcV Bauart"
    },
    "raw_specifications_text": "Displaygr\u00f6\u00dfe: 23,8 Zoll\nAufl\u00f6sung: 1920x1080\nPanel: IPS\nReaktionszeit: 5 ms\nVideo Anschl\u00fcsse: 1x HDMI\nVESA Halterung: 100x100 mm\nHelligkeit: 250 cd/m\u00b2\nBesonderheiten: Lautsprecher\nHersteller Artikelnummer: 9H.LGDLA.TBE\nEAN: 4718755070068\nArtikelnummer: MPEYOHL\nBildschirmdiagonale: 60,5 cm (23.8 Zoll)\nDisplay-Aufl\u00f6sung: 1920 x 1080 Pixel\nNatives Seitenverh\u00e4ltnis: 16:9\nBildschirmtechnologie: LED\nTouchscreen: Nein\nHD-Typ: Full HD\nPanel-Typ: IPS\nBildschirmform: Flach\nKontrastverh\u00e4ltnis: 1000:1\nMaximale Bildwiederholrate: 60 Hz\nAnzahl der Farben des Displays: 16,78 Millionen Farben\nHelligkeit (typisch): 250 cd/m\u00b2\nUnterst\u00fctzte Grafik-Aufl\u00f6sungen: 1920 x 1080 (HD 1080)\nUnterst\u00fctzte Video-Modi: 1080p\nKontrastverh\u00e4ltnis (dynamisch): 12000000:1\nBildwinkel, horizontal: 178\u00b0\nBildwinkel, vertikal: 178\u00b0\nPixel Abstand: 0,311 x 0,311 mm\nPixeldichte: 93 ppi\nSichtbare Gr\u00f6\u00dfe (vertikal): 52,7 cm\nDigital horizontale Frequenz: 30 - 83 kHz\nDigital vertikale Frequenz: 50 - 76 Hz\nRGB-Farbraum: NTSC\nNTSC Abdeckung (typisch): 72%\nNVIDIA G-SYNC: Nein\nAMD FreeSync: Nein\nFlimmerfreie Technologie: Ja\nLow-Blue-Light-Technologie: Ja\nSmart-Modi: Kino, Benutzerdefinierung, Spiel, Foto, Standard\nEingebaute Lautsprecher: Ja\nIntegrierte Kamera: Nein\nAnzahl der Lautsprecher: 2\nRMS-Leistung: 2 W\nMarktpositionierung: Haus\nProduktfarbe: Schwarz\nFu\u00dffarbe: Schwarz\nZertifizierung: CE, T\u00dcV Bauart\nIntegrierter USB-Hub: Nein\nHDMI: Ja\nAnzahl VGA (D-Sub) Anschl\u00fcsse: 1\nDVI Anschluss: Nein\nAnzahl HDMI-Anschl\u00fcsse: 1\nHDMI-Version: 1.4\nAnzahl DisplayPort Anschl\u00fcsse: 1\nDisplayPorts-Version: 1.2\nKopfh\u00f6rerausg\u00e4nge: 1\nKopfh\u00f6rer-Anschluss: 3,5 mm\nHDCP: Ja\nHDCP-Version: 1.4\nWLAN: Nein\nEingebauter Ethernet-Anschluss: Nein\nVESA-Halterung: Ja\nKabelsperre-Slot: Ja\nH\u00f6henverstellung: Nein\nPanel-Montage-Schnittstelle: 100 x 100 mm\nSlot-Typ Kabelsperre: Kensington\nNeigungswinkelbereich: -5 - 20\u00b0\nOn-Screen-Display (OSD): Ja\nMen\u00fcsprachen: Vereinfachtes Chinesisch, Traditionelles Chinesisch, Tschechisch, Deutsch, Niederl\u00e4ndisch, Englisch, Spanisch, Franz\u00f6sisch, Ungarisch, Italienisch, Japanisch, Koreanisch, Polnisch, Portugiesisch, Rum\u00e4nisch, Russisch, Schwedisch\nAnzahl OSD-Sprachen: 17\nLED-Anzeigen: Ja\nNeigungsverstellung: Ja\nEnergieeffizienzklasse (SDR): E\nEnergieverbrauch (SDR) pro 1.000 Stunden: 15 kWh\nStromverbrauch (Standardbetrieb): 14,7 W\nStromverbrauch (Standby): 0,3 W\nStromverbrauch (aus): 0,2 W\nAC Eingangsspannung: 100 - 240 V\nEnergieeffizienzskala: A bis G\nBetriebstemperatur: 5 - 40 \u00b0C\nTemperaturbereich bei Lagerung: -20 - 60 \u00b0C\nRelative Luftfeuchtigkeit in Betrieb: 20 - 90%\nLuftfeuchtigkeit bei Lagerung: 10 - 90%\nMitgelieferte Kabel: AC, HDMI, VGA\nGer\u00e4tebreite (inkl. Fu\u00df): 612 mm\nGer\u00e4tetiefe (inkl. Fu\u00df): 183 mm\nGer\u00e4teh\u00f6he (inkl. Fu\u00df): 463 mm\nGewicht (mit St\u00e4nder): 3,84 kg\nBreite (ohne Standfu\u00df): 61,2 cm\nTiefe (ohne Standfu\u00df): 5 cm\nH\u00f6he (ohne Standfu\u00df): 38,1 cm\nGewicht (ohne St\u00e4nder): 3,04 kg\nVerpackungsbreite: 466 mm\nVerpackungstiefe: 730 mm\nVerpackungsh\u00f6he: 140 mm\nVerpackungsart: Box\nNachhaltigkeitszertifikate: EPEAT Silver, ENERGY STAR\nWarentarifnummer (HS): 85285210\nEin-/Ausschalter: Ja\nTV Tuner integriert: Nein",
    "reference_file": "offer_reference_2395.json",
    "shop_name": "mylemon.at"
}