{
    "html_file": "offer_886_15.html",
    "name": "ASUS ProArt PA32UCR-K, 32\"",
    "offer_link": "https://www.alternate.at/ASUS/ProArt-PA32UCR-K-LED-Monitor/html/product/1843096?partner=AtGeizhalsat&campaign=Monitor/ASUS/1843096",
    "price": 1419.0,
    "raw_specifications": {
        "": "VESA DisplayHDR Standard",
        "Abmessungen": "Breite: 72,69 cm x H\u00f6he: 60,41 cm x Tiefe/L\u00e4nge: 24,51 cm",
        "Anschl\u00fcsse": "3x HDMI-Eingang, (HDMI-Version: 2.0), 1x DisplayPort-Eingang, (DisplayPort-Version: 1.2), 3x USB-A-3.2 Gen 1 (5 Gbit/s), 1x USB-C 3.2 Gen 1 (5 Gbit/s)",
        "Bild": "Format",
        "Bildschirmaufl\u00f6sung": "3.840 x 2.160 Pixel",
        "Bildschirmdiagonale": "81 cm (32 Zoll)",
        "EAN": "4711081401544",
        "Energieeffizienzklasse (HDR)": "G (A - G)",
        "Energieeffizienzklasse (SDR)": "G (A - G)",
        "Energieverbauch pro 1000 Stunden (HDR)": "70 kWh",
        "Energieverbauch pro 1000 Stunden (SDR)": "42 kWh",
        "Ergonomie": "Typ",
        "Farbe": "schwarz",
        "Features": "Flicker-free LED, Low Blue Light, \u0394E < 1, Calman Ready, ColourSpace Integration",
        "Frequenz": "Vertikal",
        "Geeignet f\u00fcr": "Multimedia",
        "Gewicht": "12,3 kg",
        "Hersteller-Nr.": "90LM03H3-B02370",
        "Lautsprecher": "2 Lautsprecher",
        "Leistungsaufnahme im Bereitschafts- und Aus-Zustand": "0,5 Watt",
        "Leistungsaufnahme im Ein-Zustand bei Standard-Dynamikumfang (SDR)": "41,7 Watt",
        "Leistungsaufnahme im Ein-Zustand bei hohem Dynamikumfang (HDR)": "69.8 Watt",
        "Standards": "Video",
        "Stromversorgung": "Eco-Off",
        "Typ": "LED-Monitor",
        "Wandhalterung": "VESA kompatibel (100 x 100 mm)",
        "Zubeh\u00f6r": "Vorhanden"
    },
    "raw_specifications_text": "Energieeffizienzklasse (SDR): G (A - G)\nEnergieverbauch pro 1000 Stunden (SDR): 42 kWh\nEnergieeffizienzklasse (HDR): G (A - G)\nEnergieverbauch pro 1000 Stunden (HDR): 70 kWh\nLeistungsaufnahme im Ein-Zustand bei Standard-Dynamikumfang (SDR): 41,7 Watt\nLeistungsaufnahme im Ein-Zustand bei hohem Dynamikumfang (HDR): 69.8 Watt\nLeistungsaufnahme im Bereitschafts- und Aus-Zustand: 0,5 Watt\nBildschirmdiagonale: 81 cm (32 Zoll)\nBildschirmaufl\u00f6sung: 3.840 x 2.160 Pixel\nTyp: LED-Monitor\nFarbe: schwarz\nEAN: 4711081401544\nHersteller-Nr.: 90LM03H3-B02370\nGeeignet f\u00fcr: Multimedia\nBild: Format\n: VESA DisplayHDR Standard\nFrequenz: Vertikal\nAnschl\u00fcsse: 3x HDMI-Eingang, (HDMI-Version: 2.0), 1x DisplayPort-Eingang, (DisplayPort-Version: 1.2), 3x USB-A-3.2 Gen 1 (5 Gbit/s), 1x USB-C 3.2 Gen 1 (5 Gbit/s)\nErgonomie: Typ\nStromversorgung: Eco-Off\nLautsprecher: 2 Lautsprecher\nStandards: Video\nWandhalterung: VESA kompatibel (100 x 100 mm)\nFeatures: Flicker-free LED, Low Blue Light, \u0394E < 1, Calman Ready, ColourSpace Integration\nZubeh\u00f6r: Vorhanden\nAbmessungen: Breite: 72,69 cm x H\u00f6he: 60,41 cm x Tiefe/L\u00e4nge: 24,51 cm\nGewicht: 12,3 kg",
    "reference_file": "offer_reference_886.json",
    "shop_name": "Alternate.at"
}