{
    "html_file": "offer_1166_9.html",
    "name": "Lenovo G27e-20, 27\"",
    "offer_link": "https://www.csv-direct.de/artinfo.php?artnr=A1621279&KATEGORIE=162&pva=geizhals2",
    "price": 200.56,
    "raw_specifications": {
        "AC Eingangsfrequenz": "50 - 60 Hz",
        "AC Eingangsspannung": "100 - 240 V",
        "AMD FreeSync-Typ": "FreeSync Premium",
        "Anzahl DisplayPort Anschl\u00fcsse": "1",
        "Anzahl HDMI-Anschl\u00fcsse": "1",
        "Anzahl der Farben des Displays": "16,7 Millionen Farben",
        "Bildschirmdiagonale": "68,6 cm 27\"",
        "Bildschirmform": "Flach",
        "Bildschirmtechnologie": "LED",
        "Bildwinkel, horizontal": "178\u00b0",
        "Bildwinkel, vertikal": "178\u00b0",
        "Breite ohne Standfu\u00df": "613,5 mm",
        "Display-Aufl\u00f6sung": "1920 x 1080 Pixel",
        "DisplayPorts-Version": "1.2",
        "Eingebaute Lautsprecher": "Nein",
        "Energieeffizienzklasse SDR": "F",
        "Energieeffizienzskala": "A bis G",
        "Energieverbrauch SDR pro 1.000 Stunden": "23 kWh",
        "Farbskala": "95",
        "Farbtiefe": "8 Bit",
        "Ger\u00e4tebreite inkl. Fu\u00df": "613,5 mm",
        "Ger\u00e4teh\u00f6he inkl. Fu\u00df": "450,3 mm",
        "Ger\u00e4tetiefe inkl. Fu\u00df": "184,7 mm",
        "Gewicht mit St\u00e4nder": "4,6 kg",
        "Gewicht ohne St\u00e4nder": "3,9 kg",
        "HD-Typ": "Full HD",
        "HDMI-Version": "2.0",
        "Helligkeit typisch": "300 cd/m\u00b2",
        "H\u00f6he ohne Standfu\u00df": "367,6 mm",
        "H\u00f6henverstellung": "Nein",
        "Integrierte Kamera": "Nein",
        "Integrierter USB-Hub": "Nein",
        "Kontrastverh\u00e4ltnis": "3000:1",
        "Kontrastverh\u00e4ltnis dynamisch": "3000000:1",
        "Maximale Bildwiederholrate": "120 Hz",
        "Natives Seitenverh\u00e4ltnis": "16:9",
        "Neigungswinkelbereich": "-5 - 22\u00b0",
        "Paketgewicht": "7,1 kg",
        "Panel-Montage-Schnittstelle": "100 x 100 mm",
        "Panel-Typ": "VA",
        "Pixel Abstand": "0,1038 x 0,3114 mm",
        "Pixeldichte": "82 ppi",
        "Produktfarbe": "Schwarz",
        "RGB-Farbraum": "sRGB",
        "Rahmenbreite Seite": "2 mm",
        "Rahmenbreite oben": "2 mm",
        "Rahmenbreite unten": "2,2 cm",
        "Reaktionszeit schnell": "1 ms",
        "Sichtbare Gr\u00f6\u00dfe horizontal": "59,8 cm",
        "Sichtbare Gr\u00f6\u00dfe vertikal": "33,6 cm",
        "Slot-Typ Kabelsperre": "Kensington",
        "Stromverbrauch Standardbetrieb": "23 W",
        "Stromverbrauch aus": "0,3 W",
        "Stromverbrauch max.": "30 W",
        "Tiefe ohne Standfu\u00df": "44 mm",
        "Touchscreen": "Nein",
        "Verpackungsbreite": "715 mm",
        "Verpackungsh\u00f6he": "445 mm",
        "Verpackungstiefe": "131 mm",
        "Zertifizierung": "CCC, RoHS, T\u00dcV",
        "sRGB Abdeckung klassisch": "95"
    },
    "raw_specifications_text": "Bildschirmdiagonale: 68,6 cm 27\"\nDisplay-Aufl\u00f6sung: 1920 x 1080 Pixel\nNatives Seitenverh\u00e4ltnis: 16:9\nBildschirmtechnologie: LED\nTouchscreen: Nein\nHD-Typ: Full HD\nPanel-Typ: VA\nBildschirmform: Flach\nKontrastverh\u00e4ltnis: 3000:1\nMaximale Bildwiederholrate: 120 Hz\nAnzahl der Farben des Displays: 16,7 Millionen Farben\nHelligkeit typisch: 300 cd/m\u00b2\nKontrastverh\u00e4ltnis dynamisch: 3000000:1\nBildwinkel, horizontal: 178\u00b0\nBildwinkel, vertikal: 178\u00b0\nReaktionszeit schnell: 1 ms\nPixel Abstand: 0,1038 x 0,3114 mm\nPixeldichte: 82 ppi\nSichtbare Gr\u00f6\u00dfe horizontal: 59,8 cm\nSichtbare Gr\u00f6\u00dfe vertikal: 33,6 cm\nFarbtiefe: 8 Bit\nRGB-Farbraum: sRGB\nFarbskala: 95\nsRGB Abdeckung klassisch: 95\nAMD FreeSync-Typ: FreeSync Premium\nEingebaute Lautsprecher: Nein\nIntegrierte Kamera: Nein\nProduktfarbe: Schwarz\nZertifizierung: CCC, RoHS, T\u00dcV\nIntegrierter USB-Hub: Nein\nAnzahl HDMI-Anschl\u00fcsse: 1\nHDMI-Version: 2.0\nAnzahl DisplayPort Anschl\u00fcsse: 1\nDisplayPorts-Version: 1.2\nH\u00f6henverstellung: Nein\nPanel-Montage-Schnittstelle: 100 x 100 mm\nSlot-Typ Kabelsperre: Kensington\nNeigungswinkelbereich: -5 - 22\u00b0\nEnergieeffizienzklasse SDR: F\nEnergieverbrauch SDR pro 1.000 Stunden: 23 kWh\nStromverbrauch Standardbetrieb: 23 W\nStromverbrauch max.: 30 W\nStromverbrauch aus: 0,3 W\nAC Eingangsspannung: 100 - 240 V\nAC Eingangsfrequenz: 50 - 60 Hz\nEnergieeffizienzskala: A bis G\nGer\u00e4tebreite inkl. Fu\u00df: 613,5 mm\nGer\u00e4tetiefe inkl. Fu\u00df: 184,7 mm\nGer\u00e4teh\u00f6he inkl. Fu\u00df: 450,3 mm\nGewicht mit St\u00e4nder: 4,6 kg\nBreite ohne Standfu\u00df: 613,5 mm\nTiefe ohne Standfu\u00df: 44 mm\nH\u00f6he ohne Standfu\u00df: 367,6 mm\nGewicht ohne St\u00e4nder: 3,9 kg\nRahmenbreite Seite: 2 mm\nRahmenbreite oben: 2 mm\nRahmenbreite unten: 2,2 cm\nVerpackungsbreite: 715 mm\nVerpackungstiefe: 131 mm\nVerpackungsh\u00f6he: 445 mm\nPaketgewicht: 7,1 kg",
    "reference_file": "offer_reference_1166.json",
    "shop_name": "CSV-Direct.de"
}