{
    "html_file": "offer_2057_0.html",
    "name": "Lenovo C32q-20, 31.5\"",
    "offer_link": "https://www.amazon.de/dp/B07XWK94CG?linkCode=xm2&camp=2025&creative=165953&smid=A3JWKAKR8XB7XF&creativeASIN=B07XWK94CG&tag=geizhals1-21",
    "price": 180.5,
    "raw_specifications": {
        "ASIN": "B07XWK94CG",
        "Amazon Bestseller-Rang": "Nr. 5,071 in Computer & Zubeh\u00f6r (Siehe Top 100 in Computer & Zubeh\u00f6r)  Nr. 109 in Monitore",
        "Anzahl HDMI Schnittstellen": "\u200e1",
        "Artikelgewicht": "\u200e7,16 Kilograms",
        "Batterien enthalten": "\u200eNein",
        "Bildschirmaufl\u00f6sung": "\u200e2560 x 1440 pixels",
        "Display-Gr\u00f6\u00dfe": "\u200e31,5 Zoll",
        "Durchschnittliche Kundenbewertung": "4,4  4,4 von 5 Sternen    \n    1.243 Sternebewertungen   \n\n\n 4,4 von 5 Sternen",
        "Farbe": "\u200eBlack",
        "Garantierte Software-Updates bis": "\u200eunbekannt",
        "Hersteller": "\u200eLENOVO",
        "Im Angebot von Amazon.de seit": "14. September 2019",
        "L\u00f6sung": "\u200e2560 x 1440 Pixels",
        "Marke": "\u200eLenovo",
        "Modell/Serie": "\u200eC32q-20",
        "Modellnummer": "\u200e65F8GAC1EU",
        "Produktabmessungen": "\u200e50 x 50 x 28 cm; 7,16 Kilogramm",
        "Volt": "\u200e240 Volt"
    },
    "raw_specifications_text": "Marke: \u200eLenovo\nHersteller: \u200eLENOVO\nModell/Serie: \u200eC32q-20\nProduktabmessungen: \u200e50 x 50 x 28 cm; 7,16 Kilogramm\nModellnummer: \u200e65F8GAC1EU\nFarbe: \u200eBlack\nDisplay-Gr\u00f6\u00dfe: \u200e31,5 Zoll\nBildschirmaufl\u00f6sung: \u200e2560 x 1440 pixels\nL\u00f6sung: \u200e2560 x 1440 Pixels\nAnzahl HDMI Schnittstellen: \u200e1\nVolt: \u200e240 Volt\nBatterien enthalten: \u200eNein\nArtikelgewicht: \u200e7,16 Kilograms\nGarantierte Software-Updates bis: \u200eunbekannt\nASIN: B07XWK94CG\nDurchschnittliche Kundenbewertung: 4,4  4,4 von 5 Sternen    \n    1.243 Sternebewertungen   \n\n\n 4,4 von 5 Sternen\nAmazon Bestseller-Rang: Nr. 5,071 in Computer & Zubeh\u00f6r (Siehe Top 100 in Computer & Zubeh\u00f6r)  Nr. 109 in Monitore\nIm Angebot von Amazon.de seit: 14. September 2019",
    "reference_file": "offer_reference_2057.json",
    "shop_name": "Amazon.at"
}