{
    "html_file": "offer_141_0.html",
    "name": "Dell S2721HGFA, 27\"",
    "offer_link": "https://www.proshop.at/Bildschirm/Dell-Bildschirm-S2721HGFA-1920x1080-FHD-144Hz-VA-Curved/3157257?utm_source=geizhals&utm_medium=cpc&utm_campaign=pricesite",
    "price": 203.63,
    "raw_specifications": {
        "Abmessungen (Breite x Tiefe x H\u00f6he)": "60.84 cm x 19.04 cm x 49.32 cm - mit Standfu\u00df (h\u00f6chste Position)",
        "Abmessungen (Breite x Tiefe x H\u00f6he) - mit Standfu\u00df (h\u00f6chste Position)": "60.84 cm x 19.04 cm x 49.32 cm",
        "Adaptive-Sync Technologie": "NVIDIA G-SYNC, AMD FreeSync Premium",
        "Besonderheiten": "LED-Randlichtsystem, flimmerfreie Technologie, BFR/PVC-frei, ohne Quecksilber, Dell ComfortView, arsenfrei, Low Blue Light-Technologie, an 3 Seiten ohne Blende",
        "Bildschirmtyp": "VA",
        "Details zu Abmessungen & Gewicht": "Mit Standfu\u00df (niedrigste Position) - Breite: 60.84 cm - Tiefe: 19.04 cm - H\u00f6he: 39.3 cm  Mit Standfu\u00df (h\u00f6chste Position) - Breite: 60.84 cm - Tiefe: 19.04 cm - H\u00f6he: 49.32 cm  Ohne Fu\u00df - Breite: 60.84 cm - Tiefe: 9.63 cm - H\u00f6he: 36.41 cm - Gewicht: 4.08 kg",
        "Diagonalabmessung": "68.6 cm (27\")",
        "Display-Typ": "LED-hintergrundbeleuchteter LCD-Monitor / TFT-Aktivmatrix",
        "EAN": "5397184657249",
        "Ein-/Aus-Schalter": "Ja",
        "Eingangsanschl\u00fcsse": "2xHDMI, DisplayPort",
        "Eingangsspannung": "Wechselstrom 100-240 V (50/60 Hz)",
        "Einstellungen der Anzeigeposition": "H\u00f6he, Neigung",
        "Energie Effizienzklasse": "Klasse E",
        "Energierverbrauch Sleep": "0.5 Watt",
        "Enthaltene Kabel": "1 x HDMI-Kabel",
        "Farbraum": "72% NTSC (CIE 1931), 83% NTSC (CIE 1976)",
        "Farbunterst\u00fctzung": "16,7 Millionen Farben",
        "Gaming": "Ja",
        "Ger\u00e4tetyp": "LED-hintergrundbeleuchteter LCD-Monitor - 68.6 cm (27\")",
        "Geschwungener Bildschirm": "Ja (1500R)",
        "Helligkeit": "350 cd/m\u00b2",
        "Hersteller": "Dell",
        "Hintergrundbeleuchtungs-Technologie": "LED-Hintergrundbeleuchtung",
        "Horizontale Bildwiederholrate": "30 - 170 kHz",
        "Horizontaler Betrachtungswinkel": "178",
        "H\u00f6heneinstellung": "100 mm",
        "Kennzeichnung": "RoHS",
        "Kontrast": "3000:1 / 3000:1 (dynamisch)",
        "Leistungsmerkmale": "Slot f\u00fcr Sicherheitsschloss (Kabelschloss getrennt erh\u00e4ltlich)",
        "Modell": "DELL-S2721HGFA",
        "Native Aufl\u00f6sung": "Full HD (1080p) 1920 x 1080 bei 144 Hz",
        "Neigungswinkel": "-5/+21",
        "Pixelpitch": "0.3108 mm",
        "Produktbeschreibung": "Dell 27 Gaming Monitor S2721HGFA - LED-Monitor - gebogen - Full HD (1080p) - 68.6 cm (27\")",
        "Reaktionszeit": "4 ms (Grau-zu-Grau), 1 ms (MPRT)",
        "Schnittstellen": "2 x HDMI  DisplayPort 1.2  Kopfh\u00f6rer",
        "Seitenverh\u00e4ltnis": "16:9",
        "Services im Bundle": "3 Jahre Advanced Exchange-Service",
        "Spannung": "Wechselstrom 100-240 V (50/60 Hz)",
        "Stromverbrauch (Aus-Modus)": "0.3 Watt",
        "Stromverbrauch (max.)": "46 Watt",
        "Stromverbrauch (typisch)": "27 Watt",
        "Stromverbrauch SDR (eingeschaltet)": "18.4 kWh/1.000 h",
        "Stromverbrauch im Standby-Modus": "0.5 Watt",
        "TCO-zertifiziert": "TCO Certified Displays 9",
        "Transportgewicht": "8.86 kg",
        "Umweltschutzstandards": "TCO Certified Displays 9",
        "Vertikale Bildwiederholrate": "48 - 144 Hz",
        "Vertikaler Betrachtungswinkel": "178",
        "Waren-Nr.": "3157257",
        "Zum Hersteller": "www.dell.com/"
    },
    "raw_specifications_text": "Hersteller: Dell\nWaren-Nr.: 3157257\nModell: DELL-S2721HGFA\nEAN: 5397184657249\nZum Hersteller: www.dell.com/\nProduktbeschreibung: Dell 27 Gaming Monitor S2721HGFA - LED-Monitor - gebogen - Full HD (1080p) - 68.6 cm (27\")\nGer\u00e4tetyp: LED-hintergrundbeleuchteter LCD-Monitor - 68.6 cm (27\")\nEnergie Effizienzklasse: Klasse E\nGeschwungener Bildschirm: Ja (1500R)\nAdaptive-Sync Technologie: NVIDIA G-SYNC, AMD FreeSync Premium\nBildschirmtyp: VA\nSeitenverh\u00e4ltnis: 16:9\nNative Aufl\u00f6sung: Full HD (1080p) 1920 x 1080 bei 144 Hz\nPixelpitch: 0.3108 mm\nHelligkeit: 350 cd/m\u00b2\nKontrast: 3000:1 / 3000:1 (dynamisch)\nReaktionszeit: 4 ms (Grau-zu-Grau), 1 ms (MPRT)\nGaming: Ja\nFarbunterst\u00fctzung: 16,7 Millionen Farben\nFarbraum: 72% NTSC (CIE 1931), 83% NTSC (CIE 1976)\nEingangsanschl\u00fcsse: 2xHDMI, DisplayPort\nEinstellungen der Anzeigeposition: H\u00f6he, Neigung\nSpannung: Wechselstrom 100-240 V (50/60 Hz)\nAbmessungen (Breite x Tiefe x H\u00f6he) - mit Standfu\u00df (h\u00f6chste Position): 60.84 cm x 19.04 cm x 49.32 cm\nUmweltschutzstandards: TCO Certified Displays 9\nKennzeichnung: RoHS\nServices im Bundle: 3 Jahre Advanced Exchange-Service\nDisplay-Typ: LED-hintergrundbeleuchteter LCD-Monitor / TFT-Aktivmatrix\nDiagonalabmessung: 68.6 cm (27\")\nVertikale Bildwiederholrate: 48 - 144 Hz\nHorizontale Bildwiederholrate: 30 - 170 kHz\nHorizontaler Betrachtungswinkel: 178\nVertikaler Betrachtungswinkel: 178\nHintergrundbeleuchtungs-Technologie: LED-Hintergrundbeleuchtung\nBesonderheiten: LED-Randlichtsystem, flimmerfreie Technologie, BFR/PVC-frei, ohne Quecksilber, Dell ComfortView, arsenfrei, Low Blue Light-Technologie, an 3 Seiten ohne Blende\nAbmessungen (Breite x Tiefe x H\u00f6he): 60.84 cm x 19.04 cm x 49.32 cm - mit Standfu\u00df (h\u00f6chste Position)\nSchnittstellen: 2 x HDMI  DisplayPort 1.2  Kopfh\u00f6rer\nNeigungswinkel: -5/+21\nH\u00f6heneinstellung: 100 mm\nLeistungsmerkmale: Slot f\u00fcr Sicherheitsschloss (Kabelschloss getrennt erh\u00e4ltlich)\nEnthaltene Kabel: 1 x HDMI-Kabel\nEingangsspannung: Wechselstrom 100-240 V (50/60 Hz)\nStromverbrauch SDR (eingeschaltet): 18.4 kWh/1.000 h\nStromverbrauch (typisch): 27 Watt\nStromverbrauch (max.): 46 Watt\nStromverbrauch im Standby-Modus: 0.5 Watt\nEnergierverbrauch Sleep: 0.5 Watt\nStromverbrauch (Aus-Modus): 0.3 Watt\nEin-/Aus-Schalter: Ja\nDetails zu Abmessungen & Gewicht: Mit Standfu\u00df (niedrigste Position) - Breite: 60.84 cm - Tiefe: 19.04 cm - H\u00f6he: 39.3 cm  Mit Standfu\u00df (h\u00f6chste Position) - Breite: 60.84 cm - Tiefe: 19.04 cm - H\u00f6he: 49.32 cm  Ohne Fu\u00df - Breite: 60.84 cm - Tiefe: 9.63 cm - H\u00f6he: 36.41 cm - Gewicht: 4.08 kg\nTransportgewicht: 8.86 kg\nTCO-zertifiziert: TCO Certified Displays 9",
    "reference_file": "offer_reference_141.json",
    "shop_name": "Proshop.at"
}