{
    "html_file": "offer_1233_19.html",
    "name": "ViewSonic VP3481a, 34\"",
    "offer_link": "https://www.ditech.at/details.php?artnr=330980",
    "price": 811.9,
    "raw_specifications": {
        "AMD FreeSync": "Ja",
        "Abmessungen (BxHxT)": "809x480x299mm (mit Standfu\u00df),  809x366x105mm (ohne Standfu\u00df)",
        "Adaptive Sync": "Ja",
        "Anschl\u00fcsse - DisplayPort 1.2": "1",
        "Anschl\u00fcsse - DisplayPort 1.4 100Hz@3440x1440": "1",
        "Anschl\u00fcsse - HDMI 2.0": "2",
        "Anschl\u00fcsse - HDMI 2.0 100Hz@3440x1440": "2",
        "Anschl\u00fcsse - USB-C 3.0 mit DisplayPort 1.2": "1",
        "Anschl\u00fcsse - USB-C 3.0 mit DisplayPort 1.4 100Hz@3440x1440": "1",
        "Anwendung": "station\u00e4r",
        "Audio": "Lautsprecher (2x 5W),  1x Line-Out",
        "Aufl\u00f6sung": "3440x1440",
        "Beschichtung": "matt (non-glare),  H\u00e4rtegrad 3H",
        "Besonderheiten": "Slim Bezel,  USB-C Power Delivery (90W),  mechanische Tasten,  Hardware-Kalibrierung (14bit LUT),  Picture-in-Picture,  Sicherheitsschloss,  KVM-Switch,  HDCP 2.2,  Werkskalibrierung (Delta-E <2)",
        "Bildwiederholfrequenz": "100Hz",
        "Blickwinkel": "178\u00b0/178\u00b0",
        "Diagonale": "34\"/86.4cm",
        "Energieeffizienzklasse HDR (A bis G)": "G",
        "Energieverbrauch HDR": "50kWh/1000h",
        "Energieverbrauch SDR": "34kWh/1000h",
        "Ergonomie": "130mm (h\u00f6henverstellbar),  N/A (Pivot),  \u00b160\u00b0 (drehbar),  +21\u00b0/-6\u00b0 (neigbar),  keine Angabe (Schr\u00e4glage)",
        "FRC": "nein (8bit nativ)",
        "Farbe": "schwarz",
        "Farbraum - Adobe RGB": "83%",
        "Farbraum - DCI-P3": "88%",
        "Farbraum - REC 709": "100%",
        "Farbraum - sRGB": "100%",
        "Farbtiefe": "8bit (16.7 Mio. Farben)",
        "Form": "gebogen (curved),  1800R/1.8m",
        "Gewicht": "11.20kg (mit Standfu\u00df),  7.30kg (ohne Standfu\u00df)",
        "HDR": "HDR10",
        "Helligkeit": "400cd/m\u00b2",
        "Herstellergarantie": "f\u00fcnf Jahre (Vor-Ort)",
        "Hintergrundbeleuchtung": "White-LED,  flicker-free,  Blaulichtfilter",
        "Kontrast - dynamisch": "20.000.000:1",
        "Kontrast - statisch": "1.000:1",
        "Lautsprecher": "Ja",
        "Leistungsaufnahme": "38.6W (maximal),  33.6W (typisch),  keine Angabe (Energielabel alt A+++ bis G),  0.5W (Standby)",
        "Panel": "VA",
        "Reaktionszeit - GtG": "5ms",
        "Screen-to-Body-Ratio": "89.7% (berechnet)",
        "Seitenverh\u00e4ltnis": "21:9",
        "Signalfrequenz": "15-135kHz (horizontal),  24-100Hz (vertikal)",
        "Stromversorgung": "AC-In (internes Netzteil)",
        "USB-Hub In": "1x USB-B 3.0,  1x USB-C 3.0 mit DisplayPort 1.4",
        "USB-Hub Out": "2x USB-A 3.0",
        "USB-Schreibweise": "Link",
        "VESA": "100x100 (belegt)",
        "Weitere Anschl\u00fcsse": "1x Gb LAN (RJ-45)"
    },
    "raw_specifications_text": "Abmessungen (BxHxT): 809x480x299mm (mit Standfu\u00df),  809x366x105mm (ohne Standfu\u00df)\nAdaptive Sync: Ja\nAMD FreeSync: Ja\nAnschl\u00fcsse - DisplayPort 1.2: 1\nAnschl\u00fcsse - DisplayPort 1.4 100Hz@3440x1440: 1\nAnschl\u00fcsse - HDMI 2.0: 2\nAnschl\u00fcsse - HDMI 2.0 100Hz@3440x1440: 2\nAnschl\u00fcsse - USB-C 3.0 mit DisplayPort 1.2: 1\nAnschl\u00fcsse - USB-C 3.0 mit DisplayPort 1.4 100Hz@3440x1440: 1\nAnwendung: station\u00e4r\nAudio: Lautsprecher (2x 5W),  1x Line-Out\nAufl\u00f6sung: 3440x1440\nBeschichtung: matt (non-glare),  H\u00e4rtegrad 3H\nBesonderheiten: Slim Bezel,  USB-C Power Delivery (90W),  mechanische Tasten,  Hardware-Kalibrierung (14bit LUT),  Picture-in-Picture,  Sicherheitsschloss,  KVM-Switch,  HDCP 2.2,  Werkskalibrierung (Delta-E <2)\nBildwiederholfrequenz: 100Hz\nBlickwinkel: 178\u00b0/178\u00b0\nDiagonale: 34\"/86.4cm\nEnergieeffizienzklasse HDR (A bis G): G\nEnergieverbrauch HDR: 50kWh/1000h\nEnergieverbrauch SDR: 34kWh/1000h\nErgonomie: 130mm (h\u00f6henverstellbar),  N/A (Pivot),  \u00b160\u00b0 (drehbar),  +21\u00b0/-6\u00b0 (neigbar),  keine Angabe (Schr\u00e4glage)\nFarbe: schwarz\nFarbraum - Adobe RGB: 83%\nFarbraum - DCI-P3: 88%\nFarbraum - REC 709: 100%\nFarbraum - sRGB: 100%\nFarbtiefe: 8bit (16.7 Mio. Farben)\nForm: gebogen (curved),  1800R/1.8m\nFRC: nein (8bit nativ)\nGewicht: 11.20kg (mit Standfu\u00df),  7.30kg (ohne Standfu\u00df)\nHDR: HDR10\nHelligkeit: 400cd/m\u00b2\nHerstellergarantie: f\u00fcnf Jahre (Vor-Ort)\nHintergrundbeleuchtung: White-LED,  flicker-free,  Blaulichtfilter\nKontrast - dynamisch: 20.000.000:1\nKontrast - statisch: 1.000:1\nLautsprecher: Ja\nLeistungsaufnahme: 38.6W (maximal),  33.6W (typisch),  keine Angabe (Energielabel alt A+++ bis G),  0.5W (Standby)\nPanel: VA\nReaktionszeit - GtG: 5ms\nScreen-to-Body-Ratio: 89.7% (berechnet)\nSeitenverh\u00e4ltnis: 21:9\nSignalfrequenz: 15-135kHz (horizontal),  24-100Hz (vertikal)\nStromversorgung: AC-In (internes Netzteil)\nUSB-Hub In: 1x USB-B 3.0,  1x USB-C 3.0 mit DisplayPort 1.4\nUSB-Hub Out: 2x USB-A 3.0\nUSB-Schreibweise: Link\nVESA: 100x100 (belegt)\nWeitere Anschl\u00fcsse: 1x Gb LAN (RJ-45)",
    "reference_file": "offer_reference_1233.json",
    "shop_name": "DiTech.at"
}