{
    "html_file": "offer_1214_2.html",
    "name": "LG 27MP400-B, 27\"",
    "offer_link": "https://direkt.jacob.de/produkte/lg-27mp400-b-bildschirmdiagonale-27mp400-b-aeu-artnr-7463207.html?utm_source=geizhals&utm_medium=cpc&utm_campaign=Preisvergleich&ref=103",
    "price": 131.99,
    "raw_specifications": {
        "AC Eingangsfrequenz": "50/60 Hz",
        "AC Eingangsspannung": "100 - 240 V",
        "AMD FreeSync": "Ja",
        "AMD FreeSync-Typ": "FreeSync",
        "Anzahl HDMI-Anschl\u00fcsse": "1",
        "Anzahl VGA (D-Sub) Anschl\u00fcsse": "1",
        "Anzahl der Farben des Displays": "16,7 Millionen Farben",
        "Bildschirmaufl\u00f6sung": "1920 x 1080 Pixel",
        "Bildschirmdiagonale": "5,08 cm (2\" )",
        "Bildschirmdiagonale (cm)": "68,6 cm",
        "Bildschirmform": "Flach",
        "Bildschirmtechnologie": "LED",
        "Blendfreier Bildschirm": "Ja",
        "Blickwinkel, horizontal": "178\u00b0",
        "Blickwinkel, vertikal": "178\u00b0",
        "Breite (ohne Standfu\u00df)": "61,2 cm",
        "Energie Effizienzklasse": "F",
        "Flimmerfreie Technologie": "Ja",
        "Ger\u00e4tebreite (inkl. Fu\u00df)": "612 mm",
        "Ger\u00e4teh\u00f6he (inkl. Fu\u00df)": "454,9 mm",
        "Ger\u00e4tetiefe (inkl. Fu\u00df)": "190 mm",
        "Gewicht (mit St\u00e4nder)": "3,4 kg",
        "Gewicht (ohne St\u00e4nder)": "3,1 kg",
        "HD-Typ": "Full HD",
        "HDMI": "Ja",
        "Helligkeit (typisch)": "250 cd/m\u00b2",
        "H\u00f6he (ohne Standfu\u00df)": "36,2 cm",
        "Kontrastverh\u00e4ltnis": "1000:1",
        "Marktpositionierung": "Haus",
        "Mitgelieferte Kabel": "HDMI",
        "NTSC Abdeckung (typisch)": "72%",
        "Natives Seitenverh\u00e4ltnis": "16:9",
        "Paketgewicht": "5,2 kg",
        "Panel-Montage-Schnittstelle": "75 x 75 mm",
        "Panel-Typ": "IPS",
        "Pixel Abstand": "0,3114 x 0,3114 mm",
        "Produktfarbe": "Schwarz",
        "Reaktionszeit": "5 ms",
        "Stromverbrauch (Standardbetrieb)": "22 W",
        "Stromverbrauch (Standby)": "0,3 W",
        "Stromverbrauch (aus)": "0,3 W",
        "Stromverbrauch (max.)": "26 W",
        "Tiefe (ohne Standfu\u00df)": "5,62 cm",
        "VESA-Halterung": "Ja",
        "Verpackungsbreite": "678 mm",
        "Verpackungsh\u00f6he": "158 mm",
        "Verpackungstiefe": "450 mm",
        "kippbar": "Ja"
    },
    "raw_specifications_text": "Bildschirmdiagonale: 5,08 cm (2\" )\nBildschirmaufl\u00f6sung: 1920 x 1080 Pixel\nEnergie Effizienzklasse: F\nNatives Seitenverh\u00e4ltnis: 16:9\nPanel-Typ: IPS\nHD-Typ: Full HD\nBildschirmtechnologie: LED\nBildschirmform: Flach\nKontrastverh\u00e4ltnis: 1000:1\nAnzahl der Farben des Displays: 16,7 Millionen Farben\nHelligkeit (typisch): 250 cd/m\u00b2\nReaktionszeit: 5 ms\nBlendfreier Bildschirm: Ja\nBlickwinkel, horizontal: 178\u00b0\nBlickwinkel, vertikal: 178\u00b0\nPixel Abstand: 0,3114 x 0,3114 mm\nBildschirmdiagonale (cm): 68,6 cm\nNTSC Abdeckung (typisch): 72%\nAMD FreeSync: Ja\nAMD FreeSync-Typ: FreeSync\nFlimmerfreie Technologie: Ja\nMarktpositionierung: Haus\nProduktfarbe: Schwarz\nHDMI: Ja\nAnzahl VGA (D-Sub) Anschl\u00fcsse: 1\nAnzahl HDMI-Anschl\u00fcsse: 1\nVESA-Halterung: Ja\nPanel-Montage-Schnittstelle: 75 x 75 mm\nkippbar: Ja\nStromverbrauch (Standardbetrieb): 22 W\nStromverbrauch (Standby): 0,3 W\nStromverbrauch (max.): 26 W\nStromverbrauch (aus): 0,3 W\nAC Eingangsspannung: 100 - 240 V\nAC Eingangsfrequenz: 50/60 Hz\nGer\u00e4tebreite (inkl. Fu\u00df): 612 mm\nGer\u00e4tetiefe (inkl. Fu\u00df): 190 mm\nGer\u00e4teh\u00f6he (inkl. Fu\u00df): 454,9 mm\nGewicht (mit St\u00e4nder): 3,4 kg\nBreite (ohne Standfu\u00df): 61,2 cm\nTiefe (ohne Standfu\u00df): 5,62 cm\nH\u00f6he (ohne Standfu\u00df): 36,2 cm\nGewicht (ohne St\u00e4nder): 3,1 kg\nMitgelieferte Kabel: HDMI\nVerpackungsbreite: 678 mm\nVerpackungstiefe: 450 mm\nVerpackungsh\u00f6he: 158 mm\nPaketgewicht: 5,2 kg",
    "reference_file": "offer_reference_1214.json",
    "shop_name": "Jacob Elektronik direkt (AT)"
}