{
    "html_file": "offer_1464_28.html",
    "name": "Samsung S60UA, 24\"",
    "offer_link": "https://direkt.jacob.de/produkte/samsung-serie-6-ls24a600ucuxen-artnr-7014221.html?utm_source=geizhals&utm_medium=cpc&utm_campaign=Preisvergleich&ref=103",
    "price": 204.0,
    "raw_specifications": {
        "Abmessungen (Breite x Tiefe x H\u00f6he)": "54.23 cm x 19.64 cm x 53.08 cm - mit Fu\u00df",
        "Abmessungen (Breite x Tiefe x H\u00f6he) - mit Fu\u00df": "54.23 cm x 19.64 cm x 53.08 cm",
        "Adaptive-Sync Technologie": "AMD FreeSync",
        "Besonderheiten": "Spielmodus, Mega Dynamic Contrast Ratio, Eco Light Sensor, flimmerfreie Technologie, Reihenschaltung m\u00f6glich, Image Size, Eco Saving Plus, Eye Saver Mode, Off Timer Plus, Picture-in-Picture, Picture-by-Picture, Adaptive Picture, Auto Source Switch",
        "Bildschirmtyp": "IPS",
        "Details zu Abmessungen & Gewicht": "Mit Fu\u00df - Breite: 54.23 cm - Tiefe: 19.64 cm - H\u00f6he: 53.08 cm - Gewicht: 5 kg  Ohne Fu\u00df - Breite: 54.23 cm - Tiefe: 4.13 cm - H\u00f6he: 32.71 cm - Gewicht: 2.9 kg",
        "Diagonalabmessung": "61 cm (24\")",
        "Display-Typ": "LED-hintergrundbeleuchteter LCD-Monitor / TFT-Aktivmatrix",
        "ENERGY STAR zertifiziert": "Ja",
        "Eingangsanschl\u00fcsse": "HDMI, DisplayPort, USB-C",
        "Eingangsspannung": "Wechselstrom 120/240 V",
        "Einstellungen der Anzeigeposition": "H\u00f6he, Pivot (Rotation), Drehung, Neigung",
        "Energie Effizienzklasse": "Klasse F",
        "Energieklasse (HDR)": "Klasse G",
        "Energieverbrauch pro Jahr": "26 kWh",
        "Enthaltene Kabel": "1 x HDMI-Kabel  1 x USB-C Kabel",
        "Farbe": "Schwarz",
        "Farbunterst\u00fctzung": "1,07 Mrd. Farben",
        "Ger\u00e4tetyp": "LED-hintergrundbeleuchteter LCD-Monitor - 61 cm (24\")",
        "Gewicht": "5 kg",
        "HDR-Format": "HDR10",
        "HDR-f\u00e4hig": "HDR10",
        "Helligkeit": "300 cd/m\u00b2",
        "Hintergrundbeleuchtungs-Technologie": "LED-Hintergrundbeleuchtung",
        "Horizontaler Betrachtungswinkel": "178",
        "H\u00f6heneinstellung": "120 mm",
        "Integrierte Peripherieger\u00e4te": "USB 3.0-Hub",
        "Kontrast": "1000:1",
        "Leistungsaufnahme im Ein-Zustand": "19 W",
        "Leistungsmerkmale": "USB 3.0-Hub",
        "Max. Betriebstemperatur": "40 \u00b0C",
        "Min Betriebstemperatur": "10 \u00b0C",
        "Native Aufl\u00f6sung": "QHD 2560 x 1440 bei 75 Hz",
        "Neigungswinkel": "-2/+25",
        "Produktbeschreibung": "Samsung S24A600UCU - S60UA Series - LED-Monitor - QHD - 61 cm (24\") - HDR",
        "Reaktionszeit": "5 ms",
        "Rotationswinkel": "-2/+92",
        "Schnittstellen": "DisplayPort (DisplayPort 1.2 Modus)  DisplayPort 1.2 Ausgang  Kopfh\u00f6rer  HDMI  USB 3.0  2 x USB 2.0  USB-C (bis zu 65 W)",
        "Schwenkwinkel": "60",
        "Seitenverh\u00e4ltnis": "16:9",
        "Spannung": "Wechselstrom 120/240 V",
        "Stromverbrauch (Aus-Modus)": "0.3 Watt",
        "Stromverbrauch (typisch)": "19 Watt",
        "Stromverbrauch HDR (eingeschaltet)": "24 kWh/1.000 h",
        "Stromverbrauch SDR (eingeschaltet)": "19 kWh/1.000 h",
        "Stromverbrauch im Standby-Modus": "0.5 Watt",
        "Transportbreite": "61.6 cm",
        "Transportgewicht": "6.4 kg",
        "Transporth\u00f6he": "17.6 cm",
        "Transporttiefe": "41.6 cm",
        "Umweltschutzstandards": "ENERGY STAR-qualifiziert",
        "VESA-Halterung": "75 x 75 mm",
        "Vertikaler Betrachtungswinkel": "178",
        "Zul\u00e4ssige Luftfeuchtigkeit im Betrieb": "10 - 80% (nicht kondensierend)"
    },
    "raw_specifications_text": "Produktbeschreibung: Samsung S24A600UCU - S60UA Series - LED-Monitor - QHD - 61 cm (24\") - HDR\nGer\u00e4tetyp: LED-hintergrundbeleuchteter LCD-Monitor - 61 cm (24\")\nEnergie Effizienzklasse: Klasse F\nEnergieverbrauch pro Jahr: 26 kWh\nLeistungsaufnahme im Ein-Zustand: 19 W\nAdaptive-Sync Technologie: AMD FreeSync\nLeistungsmerkmale: USB 3.0-Hub\nBildschirmtyp: IPS\nSeitenverh\u00e4ltnis: 16:9\nNative Aufl\u00f6sung: QHD 2560 x 1440 bei 75 Hz\nHelligkeit: 300 cd/m\u00b2\nKontrast: 1000:1\nHDR-f\u00e4hig: HDR10\nReaktionszeit: 5 ms\nFarbunterst\u00fctzung: 1,07 Mrd. Farben\nEingangsanschl\u00fcsse: HDMI, DisplayPort, USB-C\nEinstellungen der Anzeigeposition: H\u00f6he, Pivot (Rotation), Drehung, Neigung\nSpannung: Wechselstrom 120/240 V\nFarbe: Schwarz\nAbmessungen (Breite x Tiefe x H\u00f6he) - mit Fu\u00df: 54.23 cm x 19.64 cm x 53.08 cm\nGewicht: 5 kg\nUmweltschutzstandards: ENERGY STAR-qualifiziert\nDisplay-Typ: LED-hintergrundbeleuchteter LCD-Monitor / TFT-Aktivmatrix\nEnergieklasse (HDR): Klasse G\nDiagonalabmessung: 61 cm (24\")\nIntegrierte Peripherieger\u00e4te: USB 3.0-Hub\nHDR-Format: HDR10\nHorizontaler Betrachtungswinkel: 178\nVertikaler Betrachtungswinkel: 178\nHintergrundbeleuchtungs-Technologie: LED-Hintergrundbeleuchtung\nBesonderheiten: Spielmodus, Mega Dynamic Contrast Ratio, Eco Light Sensor, flimmerfreie Technologie, Reihenschaltung m\u00f6glich, Image Size, Eco Saving Plus, Eye Saver Mode, Off Timer Plus, Picture-in-Picture, Picture-by-Picture, Adaptive Picture, Auto Source Switch\nAbmessungen (Breite x Tiefe x H\u00f6he): 54.23 cm x 19.64 cm x 53.08 cm - mit Fu\u00df\nSchnittstellen: DisplayPort (DisplayPort 1.2 Modus)  DisplayPort 1.2 Ausgang  Kopfh\u00f6rer  HDMI  USB 3.0  2 x USB 2.0  USB-C (bis zu 65 W)\nNeigungswinkel: -2/+25\nSchwenkwinkel: 60\nRotationswinkel: -2/+92\nH\u00f6heneinstellung: 120 mm\nVESA-Halterung: 75 x 75 mm\nEnthaltene Kabel: 1 x HDMI-Kabel  1 x USB-C Kabel\nEingangsspannung: Wechselstrom 120/240 V\nStromverbrauch SDR (eingeschaltet): 19 kWh/1.000 h\nStromverbrauch HDR (eingeschaltet): 24 kWh/1.000 h\nStromverbrauch (typisch): 19 Watt\nStromverbrauch im Standby-Modus: 0.5 Watt\nStromverbrauch (Aus-Modus): 0.3 Watt\nDetails zu Abmessungen & Gewicht: Mit Fu\u00df - Breite: 54.23 cm - Tiefe: 19.64 cm - H\u00f6he: 53.08 cm - Gewicht: 5 kg  Ohne Fu\u00df - Breite: 54.23 cm - Tiefe: 4.13 cm - H\u00f6he: 32.71 cm - Gewicht: 2.9 kg\nTransportbreite: 61.6 cm\nTransporttiefe: 41.6 cm\nTransporth\u00f6he: 17.6 cm\nTransportgewicht: 6.4 kg\nENERGY STAR zertifiziert: Ja\nMin Betriebstemperatur: 10 \u00b0C\nMax. Betriebstemperatur: 40 \u00b0C\nZul\u00e4ssige Luftfeuchtigkeit im Betrieb: 10 - 80% (nicht kondensierend)",
    "reference_file": "offer_reference_1464.json",
    "shop_name": "Jacob Elektronik direkt (AT)"
}