{
    "html_file": "offer_954_1.html",
    "name": "Samsung ViewFinity S6 S61B, 27\"",
    "offer_link": "https://www.office-partner.de/productredirect/index/sku/20642289?sPartner=p-geizhals-at&campaign=psm/geizhals-at/",
    "price": 201.98,
    "raw_specifications": {
        "Anschl\u00fcsse": "HDMI, DisplayPort, Kopfh\u00f6reranschluss, Audioausgang (Line-Out)",
        "Artikelnummer": "20642289",
        "Aufl\u00f6sung Kurzname": "Full HD",
        "Bezeichnung des Herstellers": "Samsung S27B610EQU",
        "Bildwiederholungsrate": "75,00 Hz",
        "Breite": "6162,00 mm",
        "Display Features": "FlickerFree",
        "Display Sync": "AMD FreeSync, Adaptive Sync",
        "Displaygr\u00f6\u00dfe": "68,58 cm (27 Zoll)",
        "EEK - Spektrum": "AG",
        "Energieeffizienzklasse": "F",
        "Geh\u00e4usefarbe des Ger\u00e4tes": "Schwarz",
        "Gewicht": "8,58 kg",
        "Gewicht inkl. Verpackung in Kg": "7,40 kg",
        "Helligkeit Bereich": "150 - 300 cd/m\u00b2",
        "Hersteller": "Samsung",
        "H\u00f6he": "5385,00 mm",
        "Inhalt (ml oder g)": "0,00 ml",
        "Kapazit\u00e4t (Seiten)": "0",
        "Kontrastverh\u00e4ltnis (typisch) Bereich": "800:1 bis 1.200:1",
        "LCD-Technologie": "IPS Panel",
        "L\u00e4nge": "1929,00 mm",
        "Produktart": "Monitore",
        "Reaktionszeit": "5,00 ms",
        "Seitenverh\u00e4ltnis": "16:9",
        "Shop Herstellernummer": "LS27B610EQUXEN",
        "Standard-EAN": "8806094045307",
        "Verpackung - Breite in cm": "68,50 cm",
        "Verpackung - H\u00f6he in cm": "21,50 cm",
        "Verpackung - L\u00e4nge in cm": "43,50 cm",
        "max. Aufl\u00f6sung": "2.560 x 1.440 Pixel (16:9)"
    },
    "raw_specifications_text": "Displaygr\u00f6\u00dfe: 68,58 cm (27 Zoll)\nEnergieeffizienzklasse: F\nGeh\u00e4usefarbe des Ger\u00e4tes: Schwarz\nAnschl\u00fcsse: HDMI, DisplayPort, Kopfh\u00f6reranschluss, Audioausgang (Line-Out)\nKontrastverh\u00e4ltnis (typisch) Bereich: 800:1 bis 1.200:1\nDisplay Features: FlickerFree\nHersteller: Samsung\nHelligkeit Bereich: 150 - 300 cd/m\u00b2\nGewicht: 8,58 kg\nProduktart: Monitore\nDisplay Sync: AMD FreeSync, Adaptive Sync\nAufl\u00f6sung Kurzname: Full HD\nInhalt (ml oder g): 0,00 ml\nKapazit\u00e4t (Seiten): 0\nEEK - Spektrum: AG\nVerpackung - Breite in cm: 68,50 cm\nL\u00e4nge: 1929,00 mm\nVerpackung - L\u00e4nge in cm: 43,50 cm\nArtikelnummer: 20642289\nStandard-EAN: 8806094045307\nShop Herstellernummer: LS27B610EQUXEN\nBezeichnung des Herstellers: Samsung S27B610EQU\nBreite: 6162,00 mm\nH\u00f6he: 5385,00 mm\nVerpackung - H\u00f6he in cm: 21,50 cm\nGewicht inkl. Verpackung in Kg: 7,40 kg\nmax. Aufl\u00f6sung: 2.560 x 1.440 Pixel (16:9)\nSeitenverh\u00e4ltnis: 16:9\nLCD-Technologie: IPS Panel\nReaktionszeit: 5,00 ms\nBildwiederholungsrate: 75,00 Hz",
    "reference_file": "offer_reference_954.json",
    "shop_name": "office-partner (AT)"
}