{
    "html_file": "offer_1620_4.html",
    "name": "Philips E-line 288E2UAE, 28\"",
    "offer_link": "https://www.proshop.at/Bildschirm/Philips-28-Bildschirm-E-line-288E2UAE-4K-UHD-USB-Hub-Speakers-Black-4-ms/2963373?utm_source=geizhals&utm_medium=cpc&utm_campaign=pricesite",
    "price": 279.58,
    "raw_specifications": {
        "Abmessungen (Breite x Tiefe x H\u00f6he)": "63.7 cm x 22.4 cm x 49.4 cm - mit Fu\u00df",
        "Abmessungen (Breite x Tiefe x H\u00f6he) - mit Fu\u00df": "63.7 cm x 22.4 cm x 49.4 cm",
        "Ausgangsleistung/Kanal": "3 Watt",
        "Besonderheiten": "Bild f\u00fcr Bild, MultiView, SmartContrast, Spielmodus, integrierte Kabelf\u00fchrung, FPS Mode, SmartImage Game, Mega Infinity Dynamic Contrast Ratio, Low Blue Light Mode, flimmerfreie Technologie, RTS Mode, SmartUniformity, Adaptive-Sync-Technologie, EasySelect Menu Toggle Key, EasyRead, Ultra Wide-Color Technology, sRGB Mode, Rennmodus, Picture-in-Picture, Monitorkalibrierung Delta E<2",
        "Bildschirmbeschichtung": "Blendfrei, 3H Hard Coating, Haze 25 %",
        "Bildschirmtyp": "IPS",
        "Details zu Abmessungen & Gewicht": "Mit Standfu\u00df (h\u00f6chste Position) - Breite: 63.7 cm - Tiefe: 22.4 cm - H\u00f6he: 49.4 cm - Gewicht: 6.09 kg  Ohne Fu\u00df - Breite: 63.7 cm - Tiefe: 4.1 cm - H\u00f6he: 36.7 cm - Gewicht: 4.27 kg",
        "Diagonalabmessung": "71.1 cm (28\")",
        "Display-Typ": "LED-hintergrundbeleuchteter LCD-Monitor / TFT-Aktivmatrix",
        "EAN": "8712581772635",
        "ENERGY STAR zertifiziert": "Ja",
        "ENERGY STAR-Version": "8.0",
        "Eingangsanschl\u00fcsse": "HDMI, DisplayPort",
        "Eingangsspannung": "Wechselstrom 120/230 V (50/60 Hz)",
        "Einstellungen der Anzeigeposition": "H\u00f6he, Neigung",
        "Energie Effizienzklasse": "Klasse F",
        "Enthaltene Kabel": "1 x HDMI-Kabel  1 x DisplayPort-Kabel",
        "Farbe": "Black Texture",
        "Farbraum": "106.9% NTSC (CIE 1976), 119.7% sRGB (CIE 1931)",
        "Farbunterst\u00fctzung": "1,07 Mrd. Farben",
        "Ger\u00e4tetyp": "LED-hintergrundbeleuchteter LCD-Monitor - 71.1 cm (28\")",
        "Gewicht": "6.09 kg",
        "Helligkeit": "300 cd/m\u00b2",
        "Hersteller": "Philips",
        "Hintergrundbeleuchtungs-Technologie": "WLED",
        "Horizontale Bildwiederholrate": "30 - 140 kHz",
        "Horizontaler Betrachtungswinkel": "178",
        "H\u00f6heneinstellung": "100 mm",
        "Integrierte Peripherieger\u00e4te": "USB 3.2 Hub",
        "Kennzeichnung": "Plug and Play, TUV GS, SEMKO, CB, TUV Ergo, DDC/CI, RoHS, Bleifrei, EPA, cETLus, CU-EAC, Ukraine, quecksilberfrei, EAEU RoHS",
        "Kontrast": "1000:1",
        "Leistungsaufnahme im Ein-Zustand": "26.9 W",
        "Leistungsmerkmale": "Slot f\u00fcr Sicherheitsschloss (Kabelschloss getrennt erh\u00e4ltlich)",
        "MTBF": "50,000 Stunde(n)",
        "Modell": "288E2UAE/00",
        "Native Aufl\u00f6sung": "4K 3840 x 2160 bei 60 Hz",
        "Neigungswinkel": "-5/+20",
        "OSD-Sprachen": "Multilingual",
        "Pixelpitch": "0.16 mm",
        "Ppi": "157",
        "Produktbeschreibung": "Philips E-line 288E2UAE - LED-Monitor - 4K - 71.1 cm (28\")",
        "Reaktionszeit": "4 ms (gray-to-gray)",
        "Schlosstyp zur Diebstahlsicherung": "Kensington Slot",
        "Schnittstellen": "DisplayPort  HDMI (HDCP)  USB 3.2 Upstream  USB 3.2 Downstream (Schnellladung)  3 x USB 3.2 Downstream  Audio Line-Out",
        "Seitenverh\u00e4ltnis": "16:9",
        "Spannung": "Wechselstrom 120/230 V (50/60 Hz)",
        "Stromverbrauch (Aus-Modus)": "0.3 Watt",
        "Stromverbrauch (typisch)": "27.6 Watt",
        "Stromverbrauch SDR (eingeschaltet)": "26.9 kWh/1.000 h",
        "Stromverbrauch im Standby-Modus": "0.5 Watt",
        "TCO-zertifiziert": "TCO Certified Displays 8",
        "Transportbreite": "73 cm",
        "Transportgewicht": "7.85 kg",
        "Transporth\u00f6he": "52.2 cm",
        "Transporttiefe": "15.9 cm",
        "Typ": "Lautsprecher - Stereo",
        "Umweltschutzstandards": "TCO Certified Displays 8, ENERGY STAR-qualifiziert",
        "VESA-Halterung": "100 x 100 mm",
        "Vertikale Bildwiederholrate": "40 - 60 Hz",
        "Vertikaler Betrachtungswinkel": "178",
        "Waren-Nr.": "2963373",
        "Zum Hersteller": "www.philips.com"
    },
    "raw_specifications_text": "Hersteller: Philips\nWaren-Nr.: 2963373\nModell: 288E2UAE/00\nEAN: 8712581772635\nZum Hersteller: www.philips.com\nProduktbeschreibung: Philips E-line 288E2UAE - LED-Monitor - 4K - 71.1 cm (28\")\nGer\u00e4tetyp: LED-hintergrundbeleuchteter LCD-Monitor - 71.1 cm (28\")\nEnergie Effizienzklasse: Klasse F\nLeistungsaufnahme im Ein-Zustand: 26.9 W\nLeistungsmerkmale: Slot f\u00fcr Sicherheitsschloss (Kabelschloss getrennt erh\u00e4ltlich)\nBildschirmtyp: IPS\nSeitenverh\u00e4ltnis: 16:9\nNative Aufl\u00f6sung: 4K 3840 x 2160 bei 60 Hz\nPixelpitch: 0.16 mm\nHelligkeit: 300 cd/m\u00b2\nKontrast: 1000:1\nReaktionszeit: 4 ms (gray-to-gray)\nFarbunterst\u00fctzung: 1,07 Mrd. Farben\nFarbraum: 106.9% NTSC (CIE 1976), 119.7% sRGB (CIE 1931)\nEingangsanschl\u00fcsse: HDMI, DisplayPort\nEinstellungen der Anzeigeposition: H\u00f6he, Neigung\nBildschirmbeschichtung: Blendfrei, 3H Hard Coating, Haze 25 %\nSpannung: Wechselstrom 120/230 V (50/60 Hz)\nFarbe: Black Texture\nAbmessungen (Breite x Tiefe x H\u00f6he) - mit Fu\u00df: 63.7 cm x 22.4 cm x 49.4 cm\nGewicht: 6.09 kg\nUmweltschutzstandards: TCO Certified Displays 8, ENERGY STAR-qualifiziert\nKennzeichnung: Plug and Play, TUV GS, SEMKO, CB, TUV Ergo, DDC/CI, RoHS, Bleifrei, EPA, cETLus, CU-EAC, Ukraine, quecksilberfrei, EAEU RoHS\nDisplay-Typ: LED-hintergrundbeleuchteter LCD-Monitor / TFT-Aktivmatrix\nDiagonalabmessung: 71.1 cm (28\")\nIntegrierte Peripherieger\u00e4te: USB 3.2 Hub\nPpi: 157\nVertikale Bildwiederholrate: 40 - 60 Hz\nHorizontale Bildwiederholrate: 30 - 140 kHz\nHorizontaler Betrachtungswinkel: 178\nVertikaler Betrachtungswinkel: 178\nHintergrundbeleuchtungs-Technologie: WLED\nOSD-Sprachen: Multilingual\nBesonderheiten: Bild f\u00fcr Bild, MultiView, SmartContrast, Spielmodus, integrierte Kabelf\u00fchrung, FPS Mode, SmartImage Game, Mega Infinity Dynamic Contrast Ratio, Low Blue Light Mode, flimmerfreie Technologie, RTS Mode, SmartUniformity, Adaptive-Sync-Technologie, EasySelect Menu Toggle Key, EasyRead, Ultra Wide-Color Technology, sRGB Mode, Rennmodus, Picture-in-Picture, Monitorkalibrierung Delta E<2\nAbmessungen (Breite x Tiefe x H\u00f6he): 63.7 cm x 22.4 cm x 49.4 cm - mit Fu\u00df\nTyp: Lautsprecher - Stereo\nAusgangsleistung/Kanal: 3 Watt\nSchnittstellen: DisplayPort  HDMI (HDCP)  USB 3.2 Upstream  USB 3.2 Downstream (Schnellladung)  3 x USB 3.2 Downstream  Audio Line-Out\nNeigungswinkel: -5/+20\nH\u00f6heneinstellung: 100 mm\nVESA-Halterung: 100 x 100 mm\nEnthaltene Kabel: 1 x HDMI-Kabel  1 x DisplayPort-Kabel\nMTBF: 50,000 Stunde(n)\nSchlosstyp zur Diebstahlsicherung: Kensington Slot\nEingangsspannung: Wechselstrom 120/230 V (50/60 Hz)\nStromverbrauch SDR (eingeschaltet): 26.9 kWh/1.000 h\nStromverbrauch (typisch): 27.6 Watt\nStromverbrauch im Standby-Modus: 0.5 Watt\nStromverbrauch (Aus-Modus): 0.3 Watt\nDetails zu Abmessungen & Gewicht: Mit Standfu\u00df (h\u00f6chste Position) - Breite: 63.7 cm - Tiefe: 22.4 cm - H\u00f6he: 49.4 cm - Gewicht: 6.09 kg  Ohne Fu\u00df - Breite: 63.7 cm - Tiefe: 4.1 cm - H\u00f6he: 36.7 cm - Gewicht: 4.27 kg\nTransportbreite: 73 cm\nTransporttiefe: 15.9 cm\nTransporth\u00f6he: 52.2 cm\nTransportgewicht: 7.85 kg\nTCO-zertifiziert: TCO Certified Displays 8\nENERGY STAR zertifiziert: Ja\nENERGY STAR-Version: 8.0",
    "reference_file": "offer_reference_1620.json",
    "shop_name": "Proshop.at"
}