{
    "html_file": "offer_999_6.html",
    "name": "Lenovo ThinkVision P34w-20, 34.14\"",
    "offer_link": "https://www.proshop.at/Bildschirm/Lenovo-Bildschirm-ThinkVision-P34w-20-3440x1440-IPS-Curved/2992699?utm_source=geizhals&utm_medium=cpc&utm_campaign=pricesite",
    "price": 670.58,
    "raw_specifications": {
        "Abmessungen (Breite x Tiefe x H\u00f6he)": "81.73 cm x 24.5 cm x 46.93 cm - mit Standfu\u00df (niedrigste Position)",
        "Abmessungen (Breite x Tiefe x H\u00f6he) - mit Standfu\u00df (niedrigste Position)": "81.73 cm x 24.5 cm x 46.93 cm",
        "Besonderheiten": "Integrierte Kabelf\u00fchrung, Reihenschaltung m\u00f6glich, 8-bit + FRC Farbtiefe",
        "Bildschirmbeschichtung": "Blendfrei",
        "Bildschirmtyp": "IPS",
        "Details zu Abmessungen & Gewicht": "Mit Standfu\u00df (niedrigste Position) - Breite: 81.73 cm - Tiefe: 24.5 cm - H\u00f6he: 46.93 cm - Gewicht: 10.8 kg  Mit Standfu\u00df (h\u00f6chste Position) - Breite: 81.73 cm - Tiefe: 24.5 cm - H\u00f6he: 62.14 cm - Gewicht: 10.8 kg  Ohne Fu\u00df - Breite: 81.73 cm - Tiefe: 7.68 cm - H\u00f6he: 37.27 cm - Gewicht: 7.4 kg",
        "Diagonalabmessung": "86.7 cm (34.14\")",
        "Display-Typ": "LED-hintergrundbeleuchteter LCD-Monitor / TFT-Aktivmatrix",
        "EAN": "0195713586733",
        "ENERGY STAR zertifiziert": "Ja",
        "EPEAT-kompatibel": "EPEAT Gold",
        "Eingangsanschl\u00fcsse": "2xHDMI, 2xDisplayPort, USB-C",
        "Eingangsspannung": "Wechselstrom 100-240 V (50/60 Hz)",
        "Einstellungen der Anzeigeposition": "H\u00f6he, Drehung, Neigung",
        "Energie Effizienzklasse": "Klasse F",
        "Energieklasse (HDR)": "Klasse G",
        "Energierverbrauch Sleep": "0.5 Watt",
        "Enthaltene Kabel": "1 x USB-C Kabel - 1.8 m",
        "Farbe": "Raven Black",
        "Farbraum": "99% sRGB",
        "Farbunterst\u00fctzung": "1,07 Mrd. Farben",
        "Ger\u00e4tetyp": "LED-hintergrundbeleuchteter LCD-Monitor - 86.7 cm (34.14\")",
        "Geschwungener Bildschirm": "Ja (3800R)",
        "Gewicht": "10.8 kg",
        "Helligkeit": "300 cd/m\u00b2",
        "Hersteller": "Lenovo",
        "Hintergrundbeleuchtungs-Technologie": "WLED",
        "Horizontaler Betrachtungswinkel": "178",
        "H\u00f6heneinstellung": "135 mm",
        "Integrierte Peripherieger\u00e4te": "USB 3.2 Gen 1 Hub",
        "Kennzeichnung": "CCC, RoHS 2011/65/EU, TUV Rheinland Low Blue Light Certification, TUV Rheinland Flicker Free Certification, TUV Rheinland Eye Comfort Certification, China Energy standard Tier 1, TUV Hardware Low Blue Light Certification",
        "Kontrast": "1000:1 / 3000000:1 (dynamisch)",
        "Leistungsmerkmale": "Slot f\u00fcr Sicherheitsschloss (Kabelschloss getrennt erh\u00e4ltlich)",
        "Lokalisierung": "Englisch / Europa",
        "Modell": "62CCRAT3EU",
        "Native Aufl\u00f6sung": "UWQHD 3440 x 1440",
        "Neigungswinkel": "-5/+35",
        "Pixelpitch": "0.2325 mm",
        "Ppi": "109",
        "Produktbeschreibung": "Lenovo ThinkVision P34w-20 - LED-Monitor - gebogen - 86.7 cm (34.14\")",
        "Reaktionszeit": "4 ms (extrem), 6 ms (normal)",
        "Schlosstyp zur Diebstahlsicherung": "Kensington Slot",
        "Schnittstellen": "DisplayPort 1.2  2 x HDMI  DisplayPort-Ausgang  USB-C 3.1 Gen 1  USB-C 3,2 Gen 1 Upstream  USB 3.2 Gen 1 Upstream (Typ B)  3 x USB 3.2 Gen 1 Downstream  USB-C 3.2 Gen 1 Downstream  Kopfh\u00f6rer",
        "Schwenkwinkel": "90",
        "Seitenverh\u00e4ltnis": "21:9",
        "Sichtbare Bildfl\u00e4che": "86 cm",
        "Spannung": "Wechselstrom 100-240 V (50/60 Hz)",
        "Stromverbrauch (Aus-Modus)": "0.3 Watt",
        "Stromverbrauch (max.)": "250 Watt",
        "Stromverbrauch (typisch)": "200 Watt",
        "Stromverbrauch HDR (eingeschaltet)": "34.2 kWh/1.000 h",
        "Stromverbrauch SDR (eingeschaltet)": "31.6 kWh/1.000 h",
        "TCO-zertifiziert": "TCO Certified Displays 8, TCO Certified Edge Displays",
        "Transportbreite": "93.7 cm",
        "Transportgewicht": "15.5 kg",
        "Transporth\u00f6he": "47.5 cm",
        "Transporttiefe": "22 cm",
        "USB-Spannungsversorgung": "100 Watt",
        "Umweltschutzstandards": "TCO Certified Displays 8, TCO Certified Edge Displays, ENERGY STAR-qualifiziert EPEAT Gold",
        "VESA-Halterung": "100 x 100 mm",
        "Vertikale Bildwiederholrate": "60 Hz",
        "Vertikaler Betrachtungswinkel": "178",
        "Waren-Nr.": "2992699",
        "Zum Hersteller": "lenovo.com"
    },
    "raw_specifications_text": "Hersteller: Lenovo\nWaren-Nr.: 2992699\nModell: 62CCRAT3EU\nEAN: 0195713586733\nZum Hersteller: lenovo.com\nProduktbeschreibung: Lenovo ThinkVision P34w-20 - LED-Monitor - gebogen - 86.7 cm (34.14\")\nGer\u00e4tetyp: LED-hintergrundbeleuchteter LCD-Monitor - 86.7 cm (34.14\")\nEnergie Effizienzklasse: Klasse F\nGeschwungener Bildschirm: Ja (3800R)\nLeistungsmerkmale: Slot f\u00fcr Sicherheitsschloss (Kabelschloss getrennt erh\u00e4ltlich)\nBildschirmtyp: IPS\nSeitenverh\u00e4ltnis: 21:9\nNative Aufl\u00f6sung: UWQHD 3440 x 1440\nPixelpitch: 0.2325 mm\nHelligkeit: 300 cd/m\u00b2\nKontrast: 1000:1 / 3000000:1 (dynamisch)\nReaktionszeit: 4 ms (extrem), 6 ms (normal)\nFarbunterst\u00fctzung: 1,07 Mrd. Farben\nFarbraum: 99% sRGB\nEingangsanschl\u00fcsse: 2xHDMI, 2xDisplayPort, USB-C\nEinstellungen der Anzeigeposition: H\u00f6he, Drehung, Neigung\nBildschirmbeschichtung: Blendfrei\nSpannung: Wechselstrom 100-240 V (50/60 Hz)\nFarbe: Raven Black\nAbmessungen (Breite x Tiefe x H\u00f6he) - mit Standfu\u00df (niedrigste Position): 81.73 cm x 24.5 cm x 46.93 cm\nGewicht: 10.8 kg\nLokalisierung: Englisch / Europa\nUmweltschutzstandards: TCO Certified Displays 8, TCO Certified Edge Displays, ENERGY STAR-qualifiziert EPEAT Gold\nKennzeichnung: CCC, RoHS 2011/65/EU, TUV Rheinland Low Blue Light Certification, TUV Rheinland Flicker Free Certification, TUV Rheinland Eye Comfort Certification, China Energy standard Tier 1, TUV Hardware Low Blue Light Certification\nDisplay-Typ: LED-hintergrundbeleuchteter LCD-Monitor / TFT-Aktivmatrix\nEnergieklasse (HDR): Klasse G\nDiagonalabmessung: 86.7 cm (34.14\")\nSichtbare Bildfl\u00e4che: 86 cm\nIntegrierte Peripherieger\u00e4te: USB 3.2 Gen 1 Hub\nUSB-Spannungsversorgung: 100 Watt\nPpi: 109\nVertikale Bildwiederholrate: 60 Hz\nHorizontaler Betrachtungswinkel: 178\nVertikaler Betrachtungswinkel: 178\nHintergrundbeleuchtungs-Technologie: WLED\nBesonderheiten: Integrierte Kabelf\u00fchrung, Reihenschaltung m\u00f6glich, 8-bit + FRC Farbtiefe\nAbmessungen (Breite x Tiefe x H\u00f6he): 81.73 cm x 24.5 cm x 46.93 cm - mit Standfu\u00df (niedrigste Position)\nSchnittstellen: DisplayPort 1.2  2 x HDMI  DisplayPort-Ausgang  USB-C 3.1 Gen 1  USB-C 3,2 Gen 1 Upstream  USB 3.2 Gen 1 Upstream (Typ B)  3 x USB 3.2 Gen 1 Downstream  USB-C 3.2 Gen 1 Downstream  Kopfh\u00f6rer\nNeigungswinkel: -5/+35\nSchwenkwinkel: 90\nH\u00f6heneinstellung: 135 mm\nVESA-Halterung: 100 x 100 mm\nEnthaltene Kabel: 1 x USB-C Kabel - 1.8 m\nSchlosstyp zur Diebstahlsicherung: Kensington Slot\nEingangsspannung: Wechselstrom 100-240 V (50/60 Hz)\nStromverbrauch SDR (eingeschaltet): 31.6 kWh/1.000 h\nStromverbrauch HDR (eingeschaltet): 34.2 kWh/1.000 h\nStromverbrauch (typisch): 200 Watt\nStromverbrauch (max.): 250 Watt\nEnergierverbrauch Sleep: 0.5 Watt\nStromverbrauch (Aus-Modus): 0.3 Watt\nDetails zu Abmessungen & Gewicht: Mit Standfu\u00df (niedrigste Position) - Breite: 81.73 cm - Tiefe: 24.5 cm - H\u00f6he: 46.93 cm - Gewicht: 10.8 kg  Mit Standfu\u00df (h\u00f6chste Position) - Breite: 81.73 cm - Tiefe: 24.5 cm - H\u00f6he: 62.14 cm - Gewicht: 10.8 kg  Ohne Fu\u00df - Breite: 81.73 cm - Tiefe: 7.68 cm - H\u00f6he: 37.27 cm - Gewicht: 7.4 kg\nTransportbreite: 93.7 cm\nTransporttiefe: 22 cm\nTransporth\u00f6he: 47.5 cm\nTransportgewicht: 15.5 kg\nTCO-zertifiziert: TCO Certified Displays 8, TCO Certified Edge Displays\nEPEAT-kompatibel: EPEAT Gold\nENERGY STAR zertifiziert: Ja",
    "reference_file": "offer_reference_999.json",
    "shop_name": "Proshop.at"
}