{
    "html_file": "offer_358_8.html",
    "name": "LC-Power LC-M34-UWQHD-165-C, 34\"",
    "offer_link": "https://www.ditech.at/details.php?artnr=368861",
    "price": 397.9,
    "raw_specifications": {
        "Anschl\u00fcsse - DisplayPort 1.4": "2",
        "Anschl\u00fcsse - HDMI 2.0": "2",
        "Anwendung": "station\u00e4r",
        "Audio": "1x Line-Out",
        "Aufl\u00f6sung": "3440x1440",
        "Beschichtung": "matt (non-glare)",
        "Besonderheiten": "Slim Bezel,  mechanische Tasten,  Picture-in-Picture",
        "Bildwiederholfrequenz": "165Hz",
        "Blickwinkel": "178\u00b0/178\u00b0",
        "Diagonale": "34\"/86.4cm",
        "Energieeffizienzklasse HDR (A bis G)": "G",
        "Energieverbrauch HDR": "52kWh/1000h",
        "Energieverbrauch SDR": "32kWh/1000h",
        "Ergonomie": "100mm (h\u00f6henverstellbar),  N/A (Pivot),  N/A (drehbar),  +15\u00b0/-5\u00b0 (neigbar),  keine Angabe (Schr\u00e4glage)",
        "FRC": "unbekannt",
        "Farbe": "schwarz",
        "Farbraum - Adobe RGB": "85%",
        "Farbraum - DCI-P3": "85%",
        "Farbraum - sRGB": "99%",
        "Farbtiefe": "8bit (16.7 Mio. Farben)",
        "Form": "gebogen (curved),  1500R/1.5m",
        "Gewicht": "10.06kg (mit Standfu\u00df),  7.86kg (ohne Standfu\u00df)",
        "HDR": "HDR 400 (Hersteller)",
        "Helligkeit": "350cd/m\u00b2",
        "Herstellergarantie": "drei Jahre",
        "Hintergrundbeleuchtung": "White-LED,  flicker-free,  Blaulichtfilter",
        "Kontrast - dynamisch": "1.000.000:1",
        "Kontrast - statisch": "3.000:1",
        "Leistungsaufnahme": "keine Angabe (maximal),  keine Angabe (typisch),  keine Angabe (Energielabel alt A+++ bis G),  0.5W (Standby)",
        "Panel": "VA",
        "Reaktionszeit - GtG": "4ms",
        "Reaktionszeit - MPRT": "1ms",
        "Screen-to-Body-Ratio": "90.4% (berechnet)",
        "Seitenverh\u00e4ltnis": "21:9",
        "Signalfrequenz": "keine Angabe (horizontal),  keine Angabe (vertikal)",
        "Stromversorgung": "AC-In (internes Netzteil)",
        "USB-Hub In": "N/A",
        "USB-Hub Out": "N/A",
        "USB-Schreibweise": "Link",
        "VESA": "75x75 (belegt)",
        "Weitere Anschl\u00fcsse": "N/A"
    },
    "raw_specifications_text": "Anschl\u00fcsse - DisplayPort 1.4: 2\nAnschl\u00fcsse - HDMI 2.0: 2\nAnwendung: station\u00e4r\nAudio: 1x Line-Out\nAufl\u00f6sung: 3440x1440\nBeschichtung: matt (non-glare)\nBesonderheiten: Slim Bezel,  mechanische Tasten,  Picture-in-Picture\nBildwiederholfrequenz: 165Hz\nBlickwinkel: 178\u00b0/178\u00b0\nDiagonale: 34\"/86.4cm\nEnergieeffizienzklasse HDR (A bis G): G\nEnergieverbrauch HDR: 52kWh/1000h\nEnergieverbrauch SDR: 32kWh/1000h\nErgonomie: 100mm (h\u00f6henverstellbar),  N/A (Pivot),  N/A (drehbar),  +15\u00b0/-5\u00b0 (neigbar),  keine Angabe (Schr\u00e4glage)\nFarbe: schwarz\nFarbraum - Adobe RGB: 85%\nFarbraum - DCI-P3: 85%\nFarbraum - sRGB: 99%\nFarbtiefe: 8bit (16.7 Mio. Farben)\nForm: gebogen (curved),  1500R/1.5m\nFRC: unbekannt\nGewicht: 10.06kg (mit Standfu\u00df),  7.86kg (ohne Standfu\u00df)\nHDR: HDR 400 (Hersteller)\nHelligkeit: 350cd/m\u00b2\nHerstellergarantie: drei Jahre\nHintergrundbeleuchtung: White-LED,  flicker-free,  Blaulichtfilter\nKontrast - dynamisch: 1.000.000:1\nKontrast - statisch: 3.000:1\nLeistungsaufnahme: keine Angabe (maximal),  keine Angabe (typisch),  keine Angabe (Energielabel alt A+++ bis G),  0.5W (Standby)\nPanel: VA\nReaktionszeit - GtG: 4ms\nReaktionszeit - MPRT: 1ms\nScreen-to-Body-Ratio: 90.4% (berechnet)\nSeitenverh\u00e4ltnis: 21:9\nSignalfrequenz: keine Angabe (horizontal),  keine Angabe (vertikal)\nStromversorgung: AC-In (internes Netzteil)\nUSB-Hub In: N/A\nUSB-Hub Out: N/A\nUSB-Schreibweise: Link\nVESA: 75x75 (belegt)\nWeitere Anschl\u00fcsse: N/A",
    "reference_file": "offer_reference_358.json",
    "shop_name": "DiTech.at"
}