{
    "html_file": "offer_128_1.html",
    "name": "Corsair Xeneon 32UHD144-A, 32\"",
    "offer_link": "https://www.e-tec.at/details.php?artnr=372119",
    "price": 907.55,
    "raw_specifications": {
        "AMD FreeSync Premium": "Ja",
        "Abmessungen - Breite": "keine angabe (mit standfu\u00df),  731.93mm",
        "Abmessungen - H\u00f6he": "431mm",
        "Abmessungen - Tiefe": "57.4 (ohne standfu\u00df)mm",
        "Adaptive Sync": "Ja",
        "Anschl\u00fcsse - DisplayPort 1.4 144Hz@3840x2160": "1",
        "Anschl\u00fcsse - HDMI 2.1 144Hz@3840x2160": "2",
        "Anschl\u00fcsse - USB-C 3.0 mit DisplayPort 1.4 144Hz@3840x2160": "1",
        "Anwendung": "station\u00e4r",
        "Audio": "1x Line-Out",
        "Aufl\u00f6sung": "3840x2160",
        "Beschichtung": "matt (non-glare)",
        "Besonderheiten": "Slim Bezel,  USB-C Power Delivery (15W),  Steuerkreuz,  Stativgewinde f\u00fcr Webcam,  Sicherheitsschloss (Kensington)",
        "Bildwiederholfrequenz": "144Hz",
        "Blickwinkel": "178\u00b0/178\u00b0",
        "Diagonale": "32\"/81.3cm",
        "Energieeffizienzklasse HDR (A bis G)": "G",
        "Energieverbrauch HDR": "107kWh/1000h",
        "Energieverbrauch SDR": "34kWh/1000h",
        "Ergonomie": "110mm (h\u00f6henverstellbar),  N/A (Pivot),  \u00b130\u00b0 (drehbar),  +20\u00b0/-5\u00b0 (neigbar),  keine Angabe (Schr\u00e4glage)",
        "FRC": "ja (8bit+2bit)",
        "Farbe": "schwarz",
        "Farbraum - Adobe RGB": "100%",
        "Farbraum - DCI-P3": "98%",
        "Farbraum - sRGB": "100%",
        "Farbtiefe": "10bit (1.07 Mrd. Farben)",
        "Form": "gerade (flat)",
        "Gewicht": "keine Angabe (mit Standfu\u00df),  keine Angabe (ohne Standfu\u00df)",
        "HDR": "VESA DisplayHDR 600,  HDR10",
        "Helligkeit": "350cd/m\u00b2 (typisch),  600cd/m\u00b2 (HDR)",
        "Herstellergarantie": "drei Jahre",
        "Hintergrundbeleuchtung": "Blue-LED,  flicker-free,  Blaulichtfilter",
        "Kontrast - statisch": "1.000:1",
        "Leistungsaufnahme": "keine Angabe (maximal),  43W (typisch),  keine Angabe (Energielabel alt A+++ bis G),  0.5W (Standby)",
        "Panel": "IPS (AHVA),  Quantum-Dot",
        "Reaktionszeit - GtG": "12ms",
        "Reaktionszeit - MPRT": "1ms",
        "Screen-to-Body-Ratio": "89.5% (berechnet)",
        "Seitenverh\u00e4ltnis": "16:9",
        "Signalfrequenz": "keine Angabe (horizontal),  keine Angabe (vertikal)",
        "Stromversorgung": "DC-In (externes Netzteil)",
        "USB-Hub In": "1x USB-C 3.0",
        "USB-Hub Out": "2x USB-A 3.0",
        "USB-Schreibweise": "Link",
        "VESA": "100x100 (belegt)"
    },
    "raw_specifications_text": "Abmessungen - Breite: keine angabe (mit standfu\u00df),  731.93mm\nAbmessungen - H\u00f6he: 431mm\nAbmessungen - Tiefe: 57.4 (ohne standfu\u00df)mm\nAdaptive Sync: Ja\nAMD FreeSync Premium: Ja\nAnschl\u00fcsse - DisplayPort 1.4 144Hz@3840x2160: 1\nAnschl\u00fcsse - HDMI 2.1 144Hz@3840x2160: 2\nAnschl\u00fcsse - USB-C 3.0 mit DisplayPort 1.4 144Hz@3840x2160: 1\nAnwendung: station\u00e4r\nAudio: 1x Line-Out\nAufl\u00f6sung: 3840x2160\nBeschichtung: matt (non-glare)\nBesonderheiten: Slim Bezel,  USB-C Power Delivery (15W),  Steuerkreuz,  Stativgewinde f\u00fcr Webcam,  Sicherheitsschloss (Kensington)\nBildwiederholfrequenz: 144Hz\nBlickwinkel: 178\u00b0/178\u00b0\nDiagonale: 32\"/81.3cm\nEnergieeffizienzklasse HDR (A bis G): G\nEnergieverbrauch HDR: 107kWh/1000h\nEnergieverbrauch SDR: 34kWh/1000h\nErgonomie: 110mm (h\u00f6henverstellbar),  N/A (Pivot),  \u00b130\u00b0 (drehbar),  +20\u00b0/-5\u00b0 (neigbar),  keine Angabe (Schr\u00e4glage)\nFarbe: schwarz\nFarbraum - Adobe RGB: 100%\nFarbraum - DCI-P3: 98%\nFarbraum - sRGB: 100%\nFarbtiefe: 10bit (1.07 Mrd. Farben)\nForm: gerade (flat)\nFRC: ja (8bit+2bit)\nGewicht: keine Angabe (mit Standfu\u00df),  keine Angabe (ohne Standfu\u00df)\nHDR: VESA DisplayHDR 600,  HDR10\nHelligkeit: 350cd/m\u00b2 (typisch),  600cd/m\u00b2 (HDR)\nHerstellergarantie: drei Jahre\nHintergrundbeleuchtung: Blue-LED,  flicker-free,  Blaulichtfilter\nKontrast - statisch: 1.000:1\nLeistungsaufnahme: keine Angabe (maximal),  43W (typisch),  keine Angabe (Energielabel alt A+++ bis G),  0.5W (Standby)\nPanel: IPS (AHVA),  Quantum-Dot\nReaktionszeit - GtG: 12ms\nReaktionszeit - MPRT: 1ms\nScreen-to-Body-Ratio: 89.5% (berechnet)\nSeitenverh\u00e4ltnis: 16:9\nSignalfrequenz: keine Angabe (horizontal),  keine Angabe (vertikal)\nStromversorgung: DC-In (externes Netzteil)\nUSB-Hub In: 1x USB-C 3.0\nUSB-Hub Out: 2x USB-A 3.0\nUSB-Schreibweise: Link\nVESA: 100x100 (belegt)",
    "reference_file": "offer_reference_128.json",
    "shop_name": "e-tec.at"
}