{
    "html_file": "offer_1009_14.html",
    "name": "Dell P2723D, 27\"",
    "offer_link": "https://www.proshop.at/Bildschirm/Dell-Bildschirm-P2723D-2560x1440-QHD-IPS-USB-32-HUB/3053835?utm_source=geizhals&utm_medium=cpc&utm_campaign=pricesite",
    "price": 291.47,
    "raw_specifications": {
        "Abmessungen (Breite x Tiefe x H\u00f6he)": "61.16 cm x 19.01 cm x 53.52 cm - mit Fu\u00df",
        "Abmessungen (Breite x Tiefe x H\u00f6he) - mit Fu\u00df": "61.16 cm x 19.01 cm x 53.52 cm",
        "Besonderheiten": "Arsenfreies Glas",
        "Bildschirmbeschichtung": "Blendfrei",
        "Bildschirmtyp": "IPS",
        "Details zu Abmessungen & Gewicht": "Mit Fu\u00df - Breite: 61.16 cm - Tiefe: 19.01 cm - H\u00f6he: 53.52 cm - Gewicht: 6.76 kg  Ohne Fu\u00df - Gewicht: 4.54 kg",
        "Diagonalabmessung": "68.6 cm (27\")",
        "Display-Typ": "LED-hintergrundbeleuchteter LCD-Monitor / TFT-Aktivmatrix",
        "EAN": "5397184656785",
        "ENERGY STAR zertifiziert": "Ja",
        "Ein-/Aus-Schalter": "Ja",
        "Eingangsanschl\u00fcsse": "HDMI, DisplayPort",
        "Eingangsspannung": "Wechselstrom 100-240 V (50/60 Hz)",
        "Einstellungen der Anzeigeposition": "H\u00f6he, Pivot (Rotation), Drehung, Neigung",
        "Energie Effizienzklasse": "Klasse E",
        "Energierverbrauch Sleep": "0.3 Watt",
        "Enthaltene Kabel": "1 x DisplayPort-Kabel - DisplayPort zu DisplayPort - 1.8 m  1 x USB 3.2 Gen 1 Kabel - USB Typ A auf B",
        "Farbraum": "99% sRGB",
        "Farbunterst\u00fctzung": "16,7 Millionen Farben",
        "Ger\u00e4tetyp": "LED-hintergrundbeleuchteter LCD-Monitor - 68.6 cm (27\")",
        "Gewicht": "6.76 kg",
        "Helligkeit": "350 cd/m\u00b2",
        "Hersteller": "Dell",
        "Hintergrundbeleuchtungs-Technologie": "WLED Edgelight-Hintergrundbeleuchtung",
        "Horizontaler Betrachtungswinkel": "178",
        "H\u00f6heneinstellung": "150 mm",
        "Integrierte Peripherieger\u00e4te": "USB 3.2 Gen 1 Hub",
        "Kennzeichnung": "RoHS, NFPA 99, DisplayPort 1.2, BFR-frei, HDCP 1.4, PVC-free, quecksilberfrei",
        "Kontrast": "1000:1 / 1000:1 (dynamisch)",
        "Leistungsaufnahme im Ein-Zustand": "21 W",
        "Leistungsmerkmale": "Slot f\u00fcr Sicherheitsschloss (Kabelschloss getrennt erh\u00e4ltlich), Unterst\u00fctzung f\u00fcr VESA-Schnittstelle",
        "Modell": "DELL-P2723D",
        "Native Aufl\u00f6sung": "QHD 2560 x 1440 bei 60 Hz",
        "Neigungswinkel": "-5/+21",
        "Pixelpitch": "0.2331 mm",
        "Ppi": "109",
        "Produktbeschreibung": "Dell P2723D - LED-Monitor - QHD - 68.6 cm (27\") - TAA-konform",
        "Reaktionszeit": "5 ms (Fast), 8 ms (normal)",
        "Schnittstellen": "DisplayPort 1.2 (HDCP 1.4)  HDMI (HDCP 1.4)  USB 3.2 Gen 1 Upstream  4 x USB 3.2 Gen 1 Downstream",
        "Schwenkwinkel": "90",
        "Seitenverh\u00e4ltnis": "16:9",
        "Services im Bundle": "3 Jahre erweiterter Austauschservice und beschr\u00e4nkte Hardware-Garantie",
        "Sichtbare Bildfl\u00e4che": "68.47 cm (26.96\")",
        "Spannung": "Wechselstrom 100-240 V (50/60 Hz)",
        "Stromverbrauch (Aus-Modus)": "0.3 Watt",
        "Stromverbrauch (max.)": "55 Watt",
        "Stromverbrauch SDR (eingeschaltet)": "21 kWh/1.000 h",
        "Stromverbrauch im Standby-Modus": "0.3 Watt",
        "TAA-kompatibel": "Ja",
        "TCO-zertifiziert": "TCO Certified Edge Displays, TCO Certified Displays 9",
        "Transportgewicht": "9.2 kg",
        "Umweltschutzstandards": "TCO Certified Edge Displays, TCO Certified Displays 9, ENERGY STAR-qualifiziert",
        "VESA-Halterung": "100 x 100 mm",
        "Vertikaler Betrachtungswinkel": "178",
        "Waren-Nr.": "3053835",
        "Zum Hersteller": "www.dell.com/"
    },
    "raw_specifications_text": "Hersteller: Dell\nWaren-Nr.: 3053835\nModell: DELL-P2723D\nEAN: 5397184656785\nZum Hersteller: www.dell.com/\nProduktbeschreibung: Dell P2723D - LED-Monitor - QHD - 68.6 cm (27\") - TAA-konform\nGer\u00e4tetyp: LED-hintergrundbeleuchteter LCD-Monitor - 68.6 cm (27\")\nEnergie Effizienzklasse: Klasse E\nLeistungsaufnahme im Ein-Zustand: 21 W\nLeistungsmerkmale: Slot f\u00fcr Sicherheitsschloss (Kabelschloss getrennt erh\u00e4ltlich), Unterst\u00fctzung f\u00fcr VESA-Schnittstelle\nBildschirmtyp: IPS\nSeitenverh\u00e4ltnis: 16:9\nNative Aufl\u00f6sung: QHD 2560 x 1440 bei 60 Hz\nPixelpitch: 0.2331 mm\nHelligkeit: 350 cd/m\u00b2\nKontrast: 1000:1 / 1000:1 (dynamisch)\nReaktionszeit: 5 ms (Fast), 8 ms (normal)\nFarbunterst\u00fctzung: 16,7 Millionen Farben\nFarbraum: 99% sRGB\nEingangsanschl\u00fcsse: HDMI, DisplayPort\nEinstellungen der Anzeigeposition: H\u00f6he, Pivot (Rotation), Drehung, Neigung\nBildschirmbeschichtung: Blendfrei\nSpannung: Wechselstrom 100-240 V (50/60 Hz)\nAbmessungen (Breite x Tiefe x H\u00f6he) - mit Fu\u00df: 61.16 cm x 19.01 cm x 53.52 cm\nGewicht: 6.76 kg\nTAA-kompatibel: Ja\nUmweltschutzstandards: TCO Certified Edge Displays, TCO Certified Displays 9, ENERGY STAR-qualifiziert\nKennzeichnung: RoHS, NFPA 99, DisplayPort 1.2, BFR-frei, HDCP 1.4, PVC-free, quecksilberfrei\nServices im Bundle: 3 Jahre erweiterter Austauschservice und beschr\u00e4nkte Hardware-Garantie\nDisplay-Typ: LED-hintergrundbeleuchteter LCD-Monitor / TFT-Aktivmatrix\nDiagonalabmessung: 68.6 cm (27\")\nSichtbare Bildfl\u00e4che: 68.47 cm (26.96\")\nIntegrierte Peripherieger\u00e4te: USB 3.2 Gen 1 Hub\nPpi: 109\nHorizontaler Betrachtungswinkel: 178\nVertikaler Betrachtungswinkel: 178\nHintergrundbeleuchtungs-Technologie: WLED Edgelight-Hintergrundbeleuchtung\nBesonderheiten: Arsenfreies Glas\nAbmessungen (Breite x Tiefe x H\u00f6he): 61.16 cm x 19.01 cm x 53.52 cm - mit Fu\u00df\nSchnittstellen: DisplayPort 1.2 (HDCP 1.4)  HDMI (HDCP 1.4)  USB 3.2 Gen 1 Upstream  4 x USB 3.2 Gen 1 Downstream\nNeigungswinkel: -5/+21\nSchwenkwinkel: 90\nH\u00f6heneinstellung: 150 mm\nVESA-Halterung: 100 x 100 mm\nEnthaltene Kabel: 1 x DisplayPort-Kabel - DisplayPort zu DisplayPort - 1.8 m  1 x USB 3.2 Gen 1 Kabel - USB Typ A auf B\nEingangsspannung: Wechselstrom 100-240 V (50/60 Hz)\nStromverbrauch SDR (eingeschaltet): 21 kWh/1.000 h\nStromverbrauch (max.): 55 Watt\nStromverbrauch im Standby-Modus: 0.3 Watt\nEnergierverbrauch Sleep: 0.3 Watt\nStromverbrauch (Aus-Modus): 0.3 Watt\nEin-/Aus-Schalter: Ja\nDetails zu Abmessungen & Gewicht: Mit Fu\u00df - Breite: 61.16 cm - Tiefe: 19.01 cm - H\u00f6he: 53.52 cm - Gewicht: 6.76 kg  Ohne Fu\u00df - Gewicht: 4.54 kg\nTransportgewicht: 9.2 kg\nTCO-zertifiziert: TCO Certified Edge Displays, TCO Certified Displays 9\nENERGY STAR zertifiziert: Ja",
    "reference_file": "offer_reference_1009.json",
    "shop_name": "Proshop.at"
}