{
    "html_file": "offer_1252_3.html",
    "name": "Lenovo ThinkVision T24m-20, 23.8\"",
    "offer_link": "https://www.proshop.at/Bildschirm/Lenovo-24-Bildschirm-ThinkVision-T24m-20-Black-4-ms/3014485?utm_source=geizhals&utm_medium=cpc&utm_campaign=pricesite",
    "price": 282.12,
    "raw_specifications": {
        "Abmessungen (Breite x Tiefe x H\u00f6he)": "53.98 cm x 20.49 cm x 41.71 cm - mit Standfu\u00df (niedrigste Position)",
        "Abmessungen (Breite x Tiefe x H\u00f6he) - mit Standfu\u00df (niedrigste Position)": "53.98 cm x 20.49 cm x 41.71 cm",
        "Besonderheiten": "Integrierte Kabelf\u00fchrung, NearEdgeless-Design an 3 Seiten, 8-bit (6-bit + FRC) Farbtiefe",
        "Bildschirmbeschichtung": "Blendfrei",
        "Bildschirmtyp": "IPS",
        "Details zu Abmessungen & Gewicht": "Ohne Fu\u00df - Breite: 53.98 cm - Tiefe: 4.44 cm - H\u00f6he: 32.59 cm - Gewicht: 3.6 kg  Mit Standfu\u00df (niedrigste Position) - Breite: 53.98 cm - Tiefe: 20.49 cm - H\u00f6he: 41.71 cm - Gewicht: 6.1 kg  Mit Standfu\u00df (h\u00f6chste Position) - Breite: 53.98 cm - Tiefe: 20.49 cm - H\u00f6he: 56.71 cm - Gewicht: 6.1 kg",
        "Diagonalabmessung": "60.5 cm (24\")",
        "Display-Typ": "LED-hintergrundbeleuchteter LCD-Monitor / TFT-Aktivmatrix",
        "EAN": "0195713896795",
        "ENERGY STAR zertifiziert": "Ja",
        "ENERGY STAR-Version": "8.0",
        "EPEAT-kompatibel": "EPEAT Gold",
        "Eingangsanschl\u00fcsse": "HDMI, DisplayPort, USB-C",
        "Eingangsspannung": "Wechselstrom 100-240 V (50/60 Hz)",
        "Einstellungen der Anzeigeposition": "H\u00f6he, Pivot (Rotation), Drehung, Neigung",
        "Energie Effizienzklasse": "Klasse D",
        "Energierverbrauch Sleep": "0.5 Watt",
        "Enthaltene Kabel": "1 x USB-C Kabel",
        "Erforderliches Betriebssystem": "Microsoft Windows 7 / 10",
        "Ethernet integriert": "Ja",
        "Farbe": "Raven Black",
        "Farbraum": "72% NTSC (CIE 1931)",
        "Farbunterst\u00fctzung": "16,7 Millionen Farben",
        "Ger\u00e4tetyp": "LED-hintergrundbeleuchteter LCD-Monitor - 60.5 cm (24\")",
        "Gewicht": "6.1 kg",
        "Helligkeit": "250 cd/m\u00b2",
        "Hersteller": "Lenovo",
        "Hintergrundbeleuchtungs-Technologie": "WLED",
        "Horizontaler Betrachtungswinkel": "178",
        "H\u00f6heneinstellung": "150 mm",
        "Integrierte Peripherieger\u00e4te": "USB 3.2 Gen 1 Hub",
        "Kennzeichnung": "CCC, RoHS, TUV Rheinland Flicker Free Certification, China Energy standard Tier 1, vom T\u00dcV Rheinland zertifizierter Augenschutz, TUV Eyesafe Display Certification, TUV Hardware Low Blue Light Certification",
        "Kontrast": "1000:1 / 3000000:1 (dynamisch)",
        "Leistungsmerkmale": "Slot f\u00fcr Sicherheitsschloss (Kabelschloss getrennt erh\u00e4ltlich)",
        "Lokalisierung": "EMEA",
        "Mitgelieferte Software": "Lenovo Display Control Center, Lenovo ThinkColour",
        "Modell": "62CDGAT6EU",
        "Native Aufl\u00f6sung": "Full HD (1080p) 1920 x 1080",
        "Neigungswinkel": "-5/+35",
        "Pixelpitch": "0.2745 mm",
        "Ppi": "93",
        "Produktbeschreibung": "Lenovo ThinkVision T24m-20 - LED-Monitor - Full HD (1080p) - 60.5 cm (24\")",
        "Reaktionszeit": "4 ms (extrem), 6 ms (normal)",
        "Rotationswinkel": "180",
        "Schlosstyp zur Diebstahlsicherung": "Kensington Slot",
        "Schnittstellen": "USB-C 3.1 Gen 1  HDMI  DisplayPort 1.2  DisplayPort-Ausgang  Audio Line-Out  Netzwerk (RJ-45)  USB 3.2 Gen 1 Upstream (bis zu 90 W)  4 x USB 3.2 Gen 1 Downstream",
        "Schwenkwinkel": "90",
        "Seitenverh\u00e4ltnis": "16:9",
        "Sichtbare Bildfl\u00e4che": "60.5 cm (23.8\")",
        "Spannung": "Wechselstrom 100-240 V (50/60 Hz)",
        "Stromverbrauch (Aus-Modus)": "0.5 Watt",
        "Stromverbrauch (max.)": "140 Watt",
        "Stromverbrauch (typisch)": "22 Watt",
        "Stromverbrauch SDR (eingeschaltet)": "12.9 kWh/1.000 h",
        "Stromverbrauch im Standby-Modus": "0.3 Watt",
        "TCO-zertifiziert": "TCO Certified Displays 8, TCO Certified Edge Displays",
        "Transportbreite": "60.4 cm",
        "Transportgewicht": "8.9 kg",
        "Transporth\u00f6he": "48 cm",
        "Transporttiefe": "16.1 cm",
        "USB-Spannungsversorgung": "90 Watt",
        "Umweltschutzstandards": "TCO Certified Displays 8, TCO Certified Edge Displays, ENERGY STAR-qualifiziert EPEAT Gold",
        "VESA-Halterung": "100 x 100 mm",
        "Vertikale Bildwiederholrate": "60 Hz",
        "Vertikaler Betrachtungswinkel": "178",
        "Waren-Nr.": "3014485",
        "Zum Hersteller": "lenovo.com"
    },
    "raw_specifications_text": "Hersteller: Lenovo\nWaren-Nr.: 3014485\nModell: 62CDGAT6EU\nEAN: 0195713896795\nZum Hersteller: lenovo.com\nProduktbeschreibung: Lenovo ThinkVision T24m-20 - LED-Monitor - Full HD (1080p) - 60.5 cm (24\")\nGer\u00e4tetyp: LED-hintergrundbeleuchteter LCD-Monitor - 60.5 cm (24\")\nEnergie Effizienzklasse: Klasse D\nLeistungsmerkmale: Slot f\u00fcr Sicherheitsschloss (Kabelschloss getrennt erh\u00e4ltlich)\nBildschirmtyp: IPS\nSeitenverh\u00e4ltnis: 16:9\nNative Aufl\u00f6sung: Full HD (1080p) 1920 x 1080\nPixelpitch: 0.2745 mm\nHelligkeit: 250 cd/m\u00b2\nKontrast: 1000:1 / 3000000:1 (dynamisch)\nReaktionszeit: 4 ms (extrem), 6 ms (normal)\nFarbunterst\u00fctzung: 16,7 Millionen Farben\nFarbraum: 72% NTSC (CIE 1931)\nEingangsanschl\u00fcsse: HDMI, DisplayPort, USB-C\nEthernet integriert: Ja\nEinstellungen der Anzeigeposition: H\u00f6he, Pivot (Rotation), Drehung, Neigung\nBildschirmbeschichtung: Blendfrei\nSpannung: Wechselstrom 100-240 V (50/60 Hz)\nFarbe: Raven Black\nAbmessungen (Breite x Tiefe x H\u00f6he) - mit Standfu\u00df (niedrigste Position): 53.98 cm x 20.49 cm x 41.71 cm\nGewicht: 6.1 kg\nLokalisierung: EMEA\nUmweltschutzstandards: TCO Certified Displays 8, TCO Certified Edge Displays, ENERGY STAR-qualifiziert EPEAT Gold\nKennzeichnung: CCC, RoHS, TUV Rheinland Flicker Free Certification, China Energy standard Tier 1, vom T\u00dcV Rheinland zertifizierter Augenschutz, TUV Eyesafe Display Certification, TUV Hardware Low Blue Light Certification\nDisplay-Typ: LED-hintergrundbeleuchteter LCD-Monitor / TFT-Aktivmatrix\nDiagonalabmessung: 60.5 cm (24\")\nSichtbare Bildfl\u00e4che: 60.5 cm (23.8\")\nIntegrierte Peripherieger\u00e4te: USB 3.2 Gen 1 Hub\nUSB-Spannungsversorgung: 90 Watt\nPpi: 93\nVertikale Bildwiederholrate: 60 Hz\nHorizontaler Betrachtungswinkel: 178\nVertikaler Betrachtungswinkel: 178\nHintergrundbeleuchtungs-Technologie: WLED\nBesonderheiten: Integrierte Kabelf\u00fchrung, NearEdgeless-Design an 3 Seiten, 8-bit (6-bit + FRC) Farbtiefe\nAbmessungen (Breite x Tiefe x H\u00f6he): 53.98 cm x 20.49 cm x 41.71 cm - mit Standfu\u00df (niedrigste Position)\nSchnittstellen: USB-C 3.1 Gen 1  HDMI  DisplayPort 1.2  DisplayPort-Ausgang  Audio Line-Out  Netzwerk (RJ-45)  USB 3.2 Gen 1 Upstream (bis zu 90 W)  4 x USB 3.2 Gen 1 Downstream\nNeigungswinkel: -5/+35\nSchwenkwinkel: 90\nRotationswinkel: 180\nH\u00f6heneinstellung: 150 mm\nVESA-Halterung: 100 x 100 mm\nEnthaltene Kabel: 1 x USB-C Kabel\nSchlosstyp zur Diebstahlsicherung: Kensington Slot\nEingangsspannung: Wechselstrom 100-240 V (50/60 Hz)\nStromverbrauch SDR (eingeschaltet): 12.9 kWh/1.000 h\nStromverbrauch (typisch): 22 Watt\nStromverbrauch (max.): 140 Watt\nStromverbrauch im Standby-Modus: 0.3 Watt\nEnergierverbrauch Sleep: 0.5 Watt\nStromverbrauch (Aus-Modus): 0.5 Watt\nMitgelieferte Software: Lenovo Display Control Center, Lenovo ThinkColour\nErforderliches Betriebssystem: Microsoft Windows 7 / 10\nDetails zu Abmessungen & Gewicht: Ohne Fu\u00df - Breite: 53.98 cm - Tiefe: 4.44 cm - H\u00f6he: 32.59 cm - Gewicht: 3.6 kg  Mit Standfu\u00df (niedrigste Position) - Breite: 53.98 cm - Tiefe: 20.49 cm - H\u00f6he: 41.71 cm - Gewicht: 6.1 kg  Mit Standfu\u00df (h\u00f6chste Position) - Breite: 53.98 cm - Tiefe: 20.49 cm - H\u00f6he: 56.71 cm - Gewicht: 6.1 kg\nTransportbreite: 60.4 cm\nTransporttiefe: 16.1 cm\nTransporth\u00f6he: 48 cm\nTransportgewicht: 8.9 kg\nTCO-zertifiziert: TCO Certified Displays 8, TCO Certified Edge Displays\nEPEAT-kompatibel: EPEAT Gold\nENERGY STAR zertifiziert: Ja\nENERGY STAR-Version: 8.0",
    "reference_file": "offer_reference_1252.json",
    "shop_name": "Proshop.at"
}