{
    "html_file": "offer_466_7.html",
    "name": "iiyama ProLite XUB2492HSU-W5, 23.8\"",
    "offer_link": "https://www.mylemon.at/artikel/iiyama/xub2492hsu_w5/24-white-ete-ips-panel.html",
    "price": 155.76,
    "raw_specifications": {
        "AC Eingangsfrequenz": "50/60 Hz",
        "AC Eingangsspannung": "100 - 240 V",
        "Anzahl DisplayPort Anschl\u00fcsse": "1",
        "Anzahl HDMI-Anschl\u00fcsse": "1",
        "Anzahl OSD-Sprachen": "10",
        "Anzahl VGA (D-Sub) Anschl\u00fcsse": "1",
        "Anzahl der Farben des Displays": "16,7 Millionen Farben",
        "Anzahl der Lautsprecher": "2",
        "Anzahl der vorgeschalteten Steckpl\u00e4tze": "2",
        "Artikelnummer": "M1IYBFBL",
        "Aufl\u00f6sung": "1920x1080",
        "Besonderheiten": "75 Hz, Lautsprecher, USB HUB",
        "Betriebsanleitung": "Ja",
        "Bildschirmdiagonale": "61 cm (24 Zoll)",
        "Bildschirmform": "Flach",
        "Bildschirmtechnologie": "LED",
        "Bildwinkel, horizontal": "178\u00b0",
        "Bildwinkel, vertikal": "178\u00b0",
        "Digital horizontale Frequenz": "30 - 86 kHz",
        "Display-Aufl\u00f6sung": "1920 x 1080 Pixel",
        "Display-Oberfl\u00e4che": "Matt",
        "Displaygr\u00f6\u00dfe": "23,8 Zoll",
        "EAN": "4948570121236",
        "Eingebaute Lautsprecher": "Ja",
        "Energieeffizienzklasse (SDR)": "D",
        "Energieeffizienzskala": "A bis G",
        "Energieverbrauch (SDR) pro 1.000 Stunden": "15 kWh",
        "Ergonomie": "H\u00f6henverstellbar, Pivot (90 Grad drehbar), Schwenkbar, Neigbar",
        "Flimmerfreie Technologie": "Ja",
        "Ger\u00e4tebreite (inkl. Fu\u00df)": "539,5 mm",
        "Ger\u00e4teh\u00f6he (inkl. Fu\u00df)": "493 mm",
        "Ger\u00e4tetiefe (inkl. Fu\u00df)": "209,5 mm",
        "Gewicht (mit St\u00e4nder)": "5,3 kg",
        "HD-Typ": "Full HD",
        "HDCP": "Ja",
        "HDMI": "Ja",
        "Helligkeit": "250 cd/m\u00b2",
        "Helligkeit (typisch)": "250 cd/m\u00b2",
        "Hersteller Artikelnummer": "XUB2492HSU-W5",
        "H\u00f6heneinstellung": "15 cm",
        "H\u00f6henverstellung": "Ja",
        "Integrierte Kamera": "Nein",
        "Integrierter USB-Hub": "Ja",
        "Kontrastverh\u00e4ltnis": "1000:1",
        "Kopfh\u00f6rerausgang": "Ja",
        "Low-Blue-Light-Technologie": "Ja",
        "Maximale Bildwiederholrate": "75 Hz",
        "Men\u00fcsprachen": "Tschechisch, Deutsch, Niederl\u00e4ndisch, Englisch, Estnisch, Franz\u00f6sisch, Italienisch, Japanisch, Polnisch, Russisch",
        "Mitgelieferte Kabel": "AC, DisplayPort, HDMI, USB",
        "Natives Seitenverh\u00e4ltnis": "16:9",
        "Neigungswinkelbereich": "5 - 23\u00b0",
        "On-Screen-Display (OSD)": "Ja",
        "Paketgewicht": "6,7 kg",
        "Panel": "IPS",
        "Panel-Montage-Schnittstelle": "100 x 100 mm",
        "Panel-Typ": "IPS",
        "Pivot": "Ja",
        "Pivot Winkel": "0 - 90\u00b0",
        "Produktfarbe": "Wei\u00df",
        "RGB-Farbraum": "sRGB",
        "RMS-Leistung": "2 W",
        "Rahmenloses Design": "Ja",
        "Reaktionszeit": "4 ms",
        "Schnellstart\u00fcbersicht": "Ja",
        "Schwenkbar": "Ja",
        "Schwenkwinkelbereich": "45 - 90\u00b0",
        "Seitenverh\u00e4ltnis": "16:9",
        "Stromverbrauch (Standardbetrieb)": "15 W",
        "Stromverbrauch (Standby)": "0,5 W",
        "Stromverbrauch (aus)": "0,3 W",
        "St\u00e4nder enthalten": "Ja",
        "Touchscreen": "Nein",
        "Typ der Hintergrundbeleuchtung": "LED",
        "USB-Hub-Version": "2.0 / 3.2 Gen 1 (3.1 Gen 1)",
        "USB-Upstream-Porttyp": "USB Typ-A",
        "VESA Halterung": "100x100 mm",
        "VESA-Halterung": "Ja",
        "Verbessertes Kabelmanagement": "Ja",
        "Verpackungsart": "Box",
        "Verpackungsbreite": "620 mm",
        "Verpackungsh\u00f6he": "415 mm",
        "Verpackungstiefe": "162 mm",
        "Video Anschl\u00fcsse": "1x VGA, 1x HDMI, 1x DisplayPort",
        "Vorderer Rahmen": "Wei\u00df",
        "Zertifizierung": "TCO Certified, CE, T\u00dcV-GS, EAC, VCCI-B, PSE, RoHS support, ErP, WEEE, REACH, ENERGY STAR, UKCA",
        "sRGB Abdeckung (klassisch)": "99%"
    },
    "raw_specifications_text": "Displaygr\u00f6\u00dfe: 23,8 Zoll\nAufl\u00f6sung: 1920x1080\nPanel: IPS\nReaktionszeit: 4 ms\nVideo Anschl\u00fcsse: 1x VGA, 1x HDMI, 1x DisplayPort\nErgonomie: H\u00f6henverstellbar, Pivot (90 Grad drehbar), Schwenkbar, Neigbar\nVESA Halterung: 100x100 mm\nHelligkeit: 250 cd/m\u00b2\nBesonderheiten: 75 Hz, Lautsprecher, USB HUB\nHersteller Artikelnummer: XUB2492HSU-W5\nEAN: 4948570121236\nArtikelnummer: M1IYBFBL\nBildschirmdiagonale: 61 cm (24 Zoll)\nDisplay-Aufl\u00f6sung: 1920 x 1080 Pixel\nNatives Seitenverh\u00e4ltnis: 16:9\nBildschirmtechnologie: LED\nTouchscreen: Nein\nHD-Typ: Full HD\nPanel-Typ: IPS\nBildschirmform: Flach\nKontrastverh\u00e4ltnis: 1000:1\nMaximale Bildwiederholrate: 75 Hz\nAnzahl der Farben des Displays: 16,7 Millionen Farben\nTyp der Hintergrundbeleuchtung: LED\nHelligkeit (typisch): 250 cd/m\u00b2\nDisplay-Oberfl\u00e4che: Matt\nSeitenverh\u00e4ltnis: 16:9\nBildwinkel, horizontal: 178\u00b0\nBildwinkel, vertikal: 178\u00b0\nDigital horizontale Frequenz: 30 - 86 kHz\nRGB-Farbraum: sRGB\nsRGB Abdeckung (klassisch): 99%\nFlimmerfreie Technologie: Ja\nLow-Blue-Light-Technologie: Ja\nEingebaute Lautsprecher: Ja\nIntegrierte Kamera: Nein\nAnzahl der Lautsprecher: 2\nRMS-Leistung: 2 W\nProduktfarbe: Wei\u00df\nRahmenloses Design: Ja\nVorderer Rahmen: Wei\u00df\nZertifizierung: TCO Certified, CE, T\u00dcV-GS, EAC, VCCI-B, PSE, RoHS support, ErP, WEEE, REACH, ENERGY STAR, UKCA\nIntegrierter USB-Hub: Ja\nHDMI: Ja\nKopfh\u00f6rerausgang: Ja\nUSB-Hub-Version: 2.0 / 3.2 Gen 1 (3.1 Gen 1)\nUSB-Upstream-Porttyp: USB Typ-A\nAnzahl der vorgeschalteten Steckpl\u00e4tze: 2\nAnzahl VGA (D-Sub) Anschl\u00fcsse: 1\nAnzahl HDMI-Anschl\u00fcsse: 1\nAnzahl DisplayPort Anschl\u00fcsse: 1\nHDCP: Ja\nVESA-Halterung: Ja\nH\u00f6henverstellung: Ja\nPanel-Montage-Schnittstelle: 100 x 100 mm\nVerbessertes Kabelmanagement: Ja\nH\u00f6heneinstellung: 15 cm\nPivot: Ja\nPivot Winkel: 0 - 90\u00b0\nSchwenkbar: Ja\nSchwenkwinkelbereich: 45 - 90\u00b0\nNeigungswinkelbereich: 5 - 23\u00b0\nOn-Screen-Display (OSD): Ja\nMen\u00fcsprachen: Tschechisch, Deutsch, Niederl\u00e4ndisch, Englisch, Estnisch, Franz\u00f6sisch, Italienisch, Japanisch, Polnisch, Russisch\nAnzahl OSD-Sprachen: 10\nEnergieeffizienzklasse (SDR): D\nEnergieverbrauch (SDR) pro 1.000 Stunden: 15 kWh\nStromverbrauch (Standardbetrieb): 15 W\nStromverbrauch (Standby): 0,5 W\nStromverbrauch (aus): 0,3 W\nAC Eingangsspannung: 100 - 240 V\nAC Eingangsfrequenz: 50/60 Hz\nEnergieeffizienzskala: A bis G\nSt\u00e4nder enthalten: Ja\nMitgelieferte Kabel: AC, DisplayPort, HDMI, USB\nSchnellstart\u00fcbersicht: Ja\nBetriebsanleitung: Ja\nGer\u00e4tebreite (inkl. Fu\u00df): 539,5 mm\nGer\u00e4tetiefe (inkl. Fu\u00df): 209,5 mm\nGer\u00e4teh\u00f6he (inkl. Fu\u00df): 493 mm\nGewicht (mit St\u00e4nder): 5,3 kg\nVerpackungsbreite: 620 mm\nVerpackungstiefe: 162 mm\nVerpackungsh\u00f6he: 415 mm\nPaketgewicht: 6,7 kg\nVerpackungsart: Box",
    "reference_file": "offer_reference_466.json",
    "shop_name": "mylemon.at"
}