{
    "html_file": "offer_1991_4.html",
    "name": "Samsung SR350 (2020), 27\"",
    "offer_link": "https://www.e-tec.at/details.php?artnr=300416",
    "price": 165.9,
    "raw_specifications": {
        "AMD FreeSync": "Ja",
        "Abmessungen (BxHxT)": "612x463x250mm (mit Standfu\u00df),  612x360x51mm (ohne Standfu\u00df)",
        "Adaptive Sync": "Ja",
        "Anschl\u00fcsse - HDMI 1.4": "1",
        "Anschl\u00fcsse - VGA": "1",
        "Anwendung": "station\u00e4r",
        "Audio": "N/A",
        "Aufl\u00f6sung": "1920x1080",
        "Beschichtung": "matt (non-glare)",
        "Besonderheiten": "Slim Bezel,  Steuerkreuz,  Sicherheitsschloss (Kensington)",
        "Bildwiederholfrequenz": "75Hz",
        "Blickwinkel": "178\u00b0/178\u00b0",
        "Diagonale": "27\"/68.6cm",
        "Energieeffizienzklasse alt (A+++ bis D)": "A+",
        "Energieeffizienzklasse alt (A+++ bis G)": "A+",
        "Energieverbrauch SDR": "22kWh/1000h",
        "Ergonomie": "N/A (h\u00f6henverstellbar),  N/A (Pivot),  N/A (drehbar),  +22\u00b0/-2\u00b0 (neigbar),  keine Angabe (Schr\u00e4glage)",
        "FRC": "unbekannt",
        "Farbe": "schwarz",
        "Farbtiefe": "8bit (16.7 Mio. Farben)",
        "Form": "gerade (flat)",
        "Gewicht": "4.50kg (mit Standfu\u00df),  3.50kg (ohne Standfu\u00df)",
        "HDR": "N/A",
        "Helligkeit": "250cd/m\u00b2",
        "Herstellergarantie": "zwei Jahre",
        "Hintergrundbeleuchtung": "White-LED,  flicker-free,  Blaulichtfilter",
        "Jahresverbrauch alt (A+++ bis D)": "32.12kWh",
        "Jahresverbrauch alt (A+++ bis G)": "32.12kWh",
        "Kontrast - statisch": "1.000:1",
        "Leistungsaufnahme": "25W (maximal),  22W (typisch),  22W (Energielabel alt A+++ bis G),  0.3W (Standby)",
        "Panel": "IPS (PLS)",
        "Reaktionszeit - GtG": "5ms",
        "Screen-to-Body-Ratio": "91.3% (berechnet)",
        "Seitenverh\u00e4ltnis": "16:9",
        "Signalfrequenz": "keine Angabe (horizontal),  keine Angabe (vertikal)",
        "Stromversorgung": "DC-In (externes Netzteil)",
        "USB-Hub In": "N/A",
        "USB-Hub Out": "N/A",
        "USB-Schreibweise": "Link",
        "VESA": "75x75 (frei)",
        "Weitere Anschl\u00fcsse": "N/A"
    },
    "raw_specifications_text": "Abmessungen (BxHxT): 612x463x250mm (mit Standfu\u00df),  612x360x51mm (ohne Standfu\u00df)\nAdaptive Sync: Ja\nAMD FreeSync: Ja\nAnschl\u00fcsse - HDMI 1.4: 1\nAnschl\u00fcsse - VGA: 1\nAnwendung: station\u00e4r\nAudio: N/A\nAufl\u00f6sung: 1920x1080\nBeschichtung: matt (non-glare)\nBesonderheiten: Slim Bezel,  Steuerkreuz,  Sicherheitsschloss (Kensington)\nBildwiederholfrequenz: 75Hz\nBlickwinkel: 178\u00b0/178\u00b0\nDiagonale: 27\"/68.6cm\nEnergieeffizienzklasse alt (A+++ bis D): A+\nEnergieeffizienzklasse alt (A+++ bis G): A+\nEnergieverbrauch SDR: 22kWh/1000h\nErgonomie: N/A (h\u00f6henverstellbar),  N/A (Pivot),  N/A (drehbar),  +22\u00b0/-2\u00b0 (neigbar),  keine Angabe (Schr\u00e4glage)\nFarbe: schwarz\nFarbtiefe: 8bit (16.7 Mio. Farben)\nForm: gerade (flat)\nFRC: unbekannt\nGewicht: 4.50kg (mit Standfu\u00df),  3.50kg (ohne Standfu\u00df)\nHDR: N/A\nHelligkeit: 250cd/m\u00b2\nHerstellergarantie: zwei Jahre\nHintergrundbeleuchtung: White-LED,  flicker-free,  Blaulichtfilter\nJahresverbrauch alt (A+++ bis D): 32.12kWh\nJahresverbrauch alt (A+++ bis G): 32.12kWh\nKontrast - statisch: 1.000:1\nLeistungsaufnahme: 25W (maximal),  22W (typisch),  22W (Energielabel alt A+++ bis G),  0.3W (Standby)\nPanel: IPS (PLS)\nReaktionszeit - GtG: 5ms\nScreen-to-Body-Ratio: 91.3% (berechnet)\nSeitenverh\u00e4ltnis: 16:9\nSignalfrequenz: keine Angabe (horizontal),  keine Angabe (vertikal)\nStromversorgung: DC-In (externes Netzteil)\nUSB-Hub In: N/A\nUSB-Hub Out: N/A\nUSB-Schreibweise: Link\nVESA: 75x75 (frei)\nWeitere Anschl\u00fcsse: N/A",
    "reference_file": "offer_reference_1991.json",
    "shop_name": "e-tec.at"
}