{
    "html_file": "offer_1595_6.html",
    "name": "HP E24q G4, 23.8\"",
    "offer_link": "https://www.proshop.at/Bildschirm/HP-24-Bildschirm-E24q-G4-Silver-5-ms/2943171?utm_source=geizhals&utm_medium=cpc&utm_campaign=pricesite",
    "price": 309.7,
    "raw_specifications": {
        "Abmessungen (Breite x Tiefe x H\u00f6he)": "53.94 cm x 20.7 cm x 49.49 cm - mit Fu\u00df",
        "Abmessungen (Breite x Tiefe x H\u00f6he) - mit Fu\u00df": "53.94 cm x 20.7 cm x 49.49 cm",
        "Besonderheiten": "HDCP, Low Blue Light Mode, flimmerfreie Technologie, extrem schmale Blende an drei Seiten, 8-bit Farbtiefe, HP Eye Ease, 72 % NTSC Farbraum",
        "Bildschirmbeschichtung": "Haze 25 %, anti-glare 3H hardness",
        "Bildschirmtyp": "IPS",
        "Details zu Abmessungen & Gewicht": "Mit Fu\u00df - Breite: 53.94 cm - Tiefe: 20.7 cm - H\u00f6he: 49.49 cm - Gewicht: 5.9 kg  Ohne Fu\u00df - Breite: 53.94 cm - Tiefe: 4.7 cm - H\u00f6he: 32.33 cm - Gewicht: 3.4 kg",
        "Diagonalabmessung": "61 cm (24\")",
        "Display-Typ": "LED-hintergrundbeleuchteter LCD-Monitor / TFT-Aktivmatrix",
        "EAN": "194850080371",
        "ENERGY STAR zertifiziert": "Ja",
        "Eingangsanschl\u00fcsse": "HDMI, VGA, DisplayPort",
        "Eingangsspannung": "Wechselstrom 120/230 V (50/60 Hz)",
        "Einstellungen der Anzeigeposition": "H\u00f6he, Pivot (Rotation), Drehung, Neigung",
        "Energie Effizienzklasse": "Klasse E",
        "Energieverbrauch pro Jahr": "22 kWh",
        "Enthaltene Kabel": "1 x HDMI-Kabel - 1.8 m  1 x DisplayPort 1.2-Kabel - 1.8 m  1 x USB 3.2 Kabel - 1.8 m",
        "Farbe": "Schwarz",
        "Farbraum": "72% NTSC",
        "Farbtemperatur": "6500K",
        "Farbunterst\u00fctzung": "16,7 Millionen Farben (8-Bit)",
        "Ger\u00e4tetyp": "LED-hintergrundbeleuchteter LCD-Monitor - 61 cm (24\")",
        "Gewicht": "5.9 kg",
        "Helligkeit": "250 cd/m\u00b2",
        "Hersteller": "HP",
        "Hintergrundbeleuchtungs-Technologie": "LED-Hintergrundbeleuchtung",
        "Horizontale Bildwiederholrate": "30 - 90 kHz",
        "Horizontaler Betrachtungswinkel": "178",
        "H\u00f6heneinstellung": "150 mm",
        "Integrierte Peripherieger\u00e4te": "USB 3.2 Gen 1 Hub",
        "Kennzeichnung": "Plug and Play, TUV GS, VCCI, BSMI, NOM, TUV S, CB, CCC, PSB, FCC, ISO 9241-307, KCC, WEEE, cTUVus, E-Standby, CEC, KC, CECP, CEL, EAC, CEL Grade 1, ISC, BIS, halogenarm, DisplayPort 1.2, HP GSE, Australien-Neuseeland MEPS, Vietnam MEPS",
        "Kontrast": "1000:1 / 5000000:1 (dynamisch)",
        "Lebensdauer der Beleuchtung": "30,000 Stunden",
        "Leistungsaufnahme im Ein-Zustand": "18.5 W",
        "Leistungsmerkmale": "Slot f\u00fcr Sicherheitsschloss (Kabelschloss getrennt erh\u00e4ltlich), abnehmbarer St\u00e4nder, ohne Arsen, quecksilberfrei",
        "Lokalisierung": "Englisch / Europa",
        "Mitgelieferte Software": "HP Display Center",
        "Modell": "9VG12AT#ABB",
        "Native Aufl\u00f6sung": "QHD 2560 x 1440 bei 60 Hz",
        "Neigungswinkel": "-5/+23",
        "OSD-Sprachen": "Chinesisch (tradionell), Chinesisch (vereinfacht), Englisch, Deutsch, Franz\u00f6sisch, Italienisch, Portugiesisch, Spanisch, Holl\u00e4ndisch, Japanisch",
        "Pixelpitch": "0.2058 mm",
        "Ppi": "123",
        "Preistyp": "Sonderaktion",
        "Produktbeschreibung": "HP E24q G4 - E-Series - LED-Monitor - QHD - 61 cm (24\")",
        "Reaktionszeit": "5 ms (grau zu grau mit \u00dcbersteuerung)",
        "Rotationswinkel": "180",
        "Schlosstyp zur Diebstahlsicherung": "Kensington Slot",
        "Schnittstellen": "DisplayPort 1.2  HDMI  VGA  3 x USB 3.2 Gen 1 Downstream  USB 3.2 Gen 1 Downstream (Schnellladung)  USB 3.2 Gen 1 Upstream (Typ B)",
        "Schwenkwinkel": "90",
        "Seitenverh\u00e4ltnis": "16:9",
        "Sichtbare Bildfl\u00e4che": "60.5 cm (23.8\")",
        "Spannung": "Wechselstrom 120/230 V (50/60 Hz)",
        "Stromverbrauch (typisch)": "70 Watt",
        "Stromverbrauch SDR (eingeschaltet)": "18.5 kWh/1.000 h",
        "Stromverbrauch im Standby-Modus": "0.5 Watt",
        "TCO-zertifiziert": "TCO Certified Displays 8, TCO Certified Edge Displays",
        "Transportbreite": "61 cm",
        "Transportgewicht": "8.8 kg",
        "Transporth\u00f6he": "39.5 cm",
        "Transporttiefe": "22.5 cm",
        "Umweltschutzstandards": "TCO Certified Displays 8, TCO Certified Edge Displays, ENERGY STAR-qualifiziert",
        "VESA-Halterung": "100 x 100 mm",
        "Vertikale Bildwiederholrate": "50 - 60 Hz",
        "Vertikaler Betrachtungswinkel": "178",
        "Waren-Nr.": "2943171",
        "Zum Hersteller": "www.hp.com"
    },
    "raw_specifications_text": "Hersteller: HP\nWaren-Nr.: 2943171\nModell: 9VG12AT#ABB\nEAN: 194850080371\nZum Hersteller: www.hp.com\nProduktbeschreibung: HP E24q G4 - E-Series - LED-Monitor - QHD - 61 cm (24\")\nGer\u00e4tetyp: LED-hintergrundbeleuchteter LCD-Monitor - 61 cm (24\")\nEnergie Effizienzklasse: Klasse E\nEnergieverbrauch pro Jahr: 22 kWh\nLeistungsaufnahme im Ein-Zustand: 18.5 W\nLeistungsmerkmale: Slot f\u00fcr Sicherheitsschloss (Kabelschloss getrennt erh\u00e4ltlich), abnehmbarer St\u00e4nder, ohne Arsen, quecksilberfrei\nBildschirmtyp: IPS\nSeitenverh\u00e4ltnis: 16:9\nNative Aufl\u00f6sung: QHD 2560 x 1440 bei 60 Hz\nPixelpitch: 0.2058 mm\nHelligkeit: 250 cd/m\u00b2\nKontrast: 1000:1 / 5000000:1 (dynamisch)\nReaktionszeit: 5 ms (grau zu grau mit \u00dcbersteuerung)\nFarbunterst\u00fctzung: 16,7 Millionen Farben (8-Bit)\nFarbraum: 72% NTSC\nEingangsanschl\u00fcsse: HDMI, VGA, DisplayPort\nEinstellungen der Anzeigeposition: H\u00f6he, Pivot (Rotation), Drehung, Neigung\nBildschirmbeschichtung: Haze 25 %, anti-glare 3H hardness\nSpannung: Wechselstrom 120/230 V (50/60 Hz)\nFarbe: Schwarz\nAbmessungen (Breite x Tiefe x H\u00f6he) - mit Fu\u00df: 53.94 cm x 20.7 cm x 49.49 cm\nGewicht: 5.9 kg\nLokalisierung: Englisch / Europa\nPreistyp: Sonderaktion\nUmweltschutzstandards: TCO Certified Displays 8, TCO Certified Edge Displays, ENERGY STAR-qualifiziert\nKennzeichnung: Plug and Play, TUV GS, VCCI, BSMI, NOM, TUV S, CB, CCC, PSB, FCC, ISO 9241-307, KCC, WEEE, cTUVus, E-Standby, CEC, KC, CECP, CEL, EAC, CEL Grade 1, ISC, BIS, halogenarm, DisplayPort 1.2, HP GSE, Australien-Neuseeland MEPS, Vietnam MEPS\nDisplay-Typ: LED-hintergrundbeleuchteter LCD-Monitor / TFT-Aktivmatrix\nDiagonalabmessung: 61 cm (24\")\nSichtbare Bildfl\u00e4che: 60.5 cm (23.8\")\nIntegrierte Peripherieger\u00e4te: USB 3.2 Gen 1 Hub\nPpi: 123\nVertikale Bildwiederholrate: 50 - 60 Hz\nHorizontale Bildwiederholrate: 30 - 90 kHz\nHorizontaler Betrachtungswinkel: 178\nVertikaler Betrachtungswinkel: 178\nHintergrundbeleuchtungs-Technologie: LED-Hintergrundbeleuchtung\nFarbtemperatur: 6500K\nOSD-Sprachen: Chinesisch (tradionell), Chinesisch (vereinfacht), Englisch, Deutsch, Franz\u00f6sisch, Italienisch, Portugiesisch, Spanisch, Holl\u00e4ndisch, Japanisch\nBesonderheiten: HDCP, Low Blue Light Mode, flimmerfreie Technologie, extrem schmale Blende an drei Seiten, 8-bit Farbtiefe, HP Eye Ease, 72 % NTSC Farbraum\nAbmessungen (Breite x Tiefe x H\u00f6he): 53.94 cm x 20.7 cm x 49.49 cm - mit Fu\u00df\nSchnittstellen: DisplayPort 1.2  HDMI  VGA  3 x USB 3.2 Gen 1 Downstream  USB 3.2 Gen 1 Downstream (Schnellladung)  USB 3.2 Gen 1 Upstream (Typ B)\nNeigungswinkel: -5/+23\nSchwenkwinkel: 90\nRotationswinkel: 180\nH\u00f6heneinstellung: 150 mm\nVESA-Halterung: 100 x 100 mm\nEnthaltene Kabel: 1 x HDMI-Kabel - 1.8 m  1 x DisplayPort 1.2-Kabel - 1.8 m  1 x USB 3.2 Kabel - 1.8 m\nLebensdauer der Beleuchtung: 30,000 Stunden\nSchlosstyp zur Diebstahlsicherung: Kensington Slot\nEingangsspannung: Wechselstrom 120/230 V (50/60 Hz)\nStromverbrauch SDR (eingeschaltet): 18.5 kWh/1.000 h\nStromverbrauch (typisch): 70 Watt\nStromverbrauch im Standby-Modus: 0.5 Watt\nMitgelieferte Software: HP Display Center\nDetails zu Abmessungen & Gewicht: Mit Fu\u00df - Breite: 53.94 cm - Tiefe: 20.7 cm - H\u00f6he: 49.49 cm - Gewicht: 5.9 kg  Ohne Fu\u00df - Breite: 53.94 cm - Tiefe: 4.7 cm - H\u00f6he: 32.33 cm - Gewicht: 3.4 kg\nTransportbreite: 61 cm\nTransporttiefe: 22.5 cm\nTransporth\u00f6he: 39.5 cm\nTransportgewicht: 8.8 kg\nTCO-zertifiziert: TCO Certified Displays 8, TCO Certified Edge Displays\nENERGY STAR zertifiziert: Ja",
    "reference_file": "offer_reference_1595.json",
    "shop_name": "Proshop.at"
}