{
    "html_file": "offer_1628_19.html",
    "name": "Lenovo L24i-30, 23.8\"",
    "offer_link": "https://www.alternate.at/Lenovo/L24i-30-LED-Monitor/html/product/1704348?partner=AtGeizhalsat&campaign=Monitor/Lenovo/1704348",
    "price": 147.9,
    "raw_specifications": {
        "": "Netzteil",
        "Abmessungen": "Breite: 54,04 cm x H\u00f6he: 43,45 cm x Tiefe/L\u00e4nge: 16,5 cm",
        "Anschl\u00fcsse": "1x HDMI-Eingang, (HDMI-Version: 1.3), 1x VGA-Eingang, 1x 3,5-mm-Audio-Ausgang",
        "Bild": "Glaretyp",
        "Bildschirmaufl\u00f6sung": "1.920 x 1.080 Pixel",
        "Bildschirmdiagonale": "60 cm (23,8 Zoll)",
        "EAN": "0195348163682",
        "Energieeffizienzklasse (SDR)": "E (A - G)",
        "Energieverbauch pro 1000 Stunden (SDR)": "16 kWh",
        "Ergonomie": "Neigbar",
        "Farbe": "schwarz",
        "Features": "AMD FreeSync, AMD FreeSync 2, Kensington-Schloss",
        "Gewicht": "3,8 kg",
        "Hersteller-Nr.": "66BDKAC2EU",
        "Leistungsaufnahme im Bereitschafts- und Aus-Zustand": "0,5 Watt",
        "Leistungsaufnahme im Ein-Zustand bei Standard-Dynamikumfang (SDR)": "17,5 Watt",
        "Stromversorgung": "Eco-Off",
        "Typ": "LED-Monitor",
        "Wandhalterung": "VESA kompatibel (100 x 100 mm)",
        "Weitere Informationen": "Die Reaktionszeit von 4 ms (GtG) wird per Extreme Mode erreicht",
        "Zubeh\u00f6r": "Vorhanden"
    },
    "raw_specifications_text": "Energieeffizienzklasse (SDR): E (A - G)\nEnergieverbauch pro 1000 Stunden (SDR): 16 kWh\nLeistungsaufnahme im Ein-Zustand bei Standard-Dynamikumfang (SDR): 17,5 Watt\nLeistungsaufnahme im Bereitschafts- und Aus-Zustand: 0,5 Watt\nBildschirmdiagonale: 60 cm (23,8 Zoll)\nBildschirmaufl\u00f6sung: 1.920 x 1.080 Pixel\nTyp: LED-Monitor\nFarbe: schwarz\nEAN: 0195348163682\nHersteller-Nr.: 66BDKAC2EU\nBild: Glaretyp\n: Netzteil\nAnschl\u00fcsse: 1x HDMI-Eingang, (HDMI-Version: 1.3), 1x VGA-Eingang, 1x 3,5-mm-Audio-Ausgang\nErgonomie: Neigbar\nStromversorgung: Eco-Off\nWandhalterung: VESA kompatibel (100 x 100 mm)\nFeatures: AMD FreeSync, AMD FreeSync 2, Kensington-Schloss\nWeitere Informationen: Die Reaktionszeit von 4 ms (GtG) wird per Extreme Mode erreicht\nZubeh\u00f6r: Vorhanden\nAbmessungen: Breite: 54,04 cm x H\u00f6he: 43,45 cm x Tiefe/L\u00e4nge: 16,5 cm\nGewicht: 3,8 kg",
    "reference_file": "offer_reference_1628.json",
    "shop_name": "Alternate.at"
}