{
    "html_file": "offer_2007_2.html",
    "name": "Acer Vero B7 B227Qbmiprzx, 21.5\"",
    "offer_link": "https://direkt.jacob.de/produkte/acer-b7-b227q-um-wb7ee-006-artnr-6791906.html?utm_source=geizhals&utm_medium=cpc&utm_campaign=Preisvergleich&ref=103",
    "price": 142.76,
    "raw_specifications": {
        "3D": "Nein",
        "AC Eingangsspannung": "120 - 230 V",
        "Anzahl DisplayPort Anschl\u00fcsse": "1",
        "Anzahl VGA (D-Sub) Anschl\u00fcsse": "1",
        "Anzahl der Farben des Displays": "16,78 Millionen Farben",
        "Anzahl der Lautsprecher": "2",
        "Ber\u00fchrungsschutz": "Ja",
        "Bildschirmaufl\u00f6sung": "1920 x 1080 Pixel",
        "Bildschirmdiagonale": "54,6 cm (21.5\" )",
        "Bildschirmform": "Flach",
        "Bildschirmtechnologie": "LED",
        "Blickwinkel, horizontal": "178\u00b0",
        "Blickwinkel, vertikal": "178\u00b0",
        "Breite (ohne Standfu\u00df)": "49 cm",
        "Ein-/Ausschalter": "Ja",
        "Eingebaute Lautsprecher": "Ja",
        "Energieeffizienzklasse (SDR)": "F",
        "Energieeffizienzskala": "A bis G",
        "Energieverbrauch (SDR) pro 1.000 Stunden": "19 kWh",
        "Ger\u00e4tebreite (inkl. Fu\u00df)": "490 mm",
        "Ger\u00e4teh\u00f6he (inkl. Fu\u00df)": "485 mm",
        "Ger\u00e4tetiefe (inkl. Fu\u00df)": "193 mm",
        "Gewicht (mit St\u00e4nder)": "4,78 kg",
        "Gewicht (ohne St\u00e4nder)": "2,83 kg",
        "HD-Typ": "Full HD",
        "HDMI": "Ja",
        "Helligkeit (typisch)": "250 cd/m\u00b2",
        "Horizontaler Scanbereich": "30 - 85 kHz",
        "H\u00f6he (ohne Standfu\u00df)": "29,5 cm",
        "H\u00f6heneinstellung": "12 cm",
        "H\u00f6henverstellung": "Ja",
        "Integrierte Kamera": "Nein",
        "Kontrastverh\u00e4ltnis": "1000:1",
        "Kontrastverh\u00e4ltnis (dynamisch)": "100000000:1",
        "Maximale Bildwiederholrate": "75 Hz",
        "NTSC Abdeckung (typisch)": "72%",
        "Nachhaltigkeitszertifikate": "ENERGY STAR",
        "Natives Seitenverh\u00e4ltnis": "16:9",
        "Neigungswinkelbereich": "5 - 25\u00b0",
        "Panel-Montage-Schnittstelle": "100 x 100 mm",
        "Panel-Typ": "IPS",
        "Produktfarbe": "Schwarz",
        "RMS-Leistung": "4 W",
        "Reaktionszeit": "4 ms",
        "Schwenkbar": "Ja",
        "Schwenkwinkelbereich": "45 - 45\u00b0",
        "Stromverbrauch (Standardbetrieb)": "19 W",
        "Stromverbrauch (Standby)": "0,5 W",
        "Stromverbrauch (aus)": "0,3 W",
        "TV Tuner integriert": "Nein",
        "Tiefe (ohne Standfu\u00df)": "6,5 cm",
        "Unterst\u00fctzte Grafik-Aufl\u00f6sungen": "1920 x 1080 (HD 1080)",
        "VESA-Halterung": "Ja",
        "Vertikaler Scanbereich": "50 - 75 Hz",
        "kippbar": "Ja"
    },
    "raw_specifications_text": "Bildschirmdiagonale: 54,6 cm (21.5\" )\nBildschirmaufl\u00f6sung: 1920 x 1080 Pixel\nNatives Seitenverh\u00e4ltnis: 16:9\nPanel-Typ: IPS\nHD-Typ: Full HD\nBildschirmtechnologie: LED\nBildschirmform: Flach\nKontrastverh\u00e4ltnis: 1000:1\nMaximale Bildwiederholrate: 75 Hz\nAnzahl der Farben des Displays: 16,78 Millionen Farben\nHelligkeit (typisch): 250 cd/m\u00b2\nReaktionszeit: 4 ms\nUnterst\u00fctzte Grafik-Aufl\u00f6sungen: 1920 x 1080 (HD 1080)\nKontrastverh\u00e4ltnis (dynamisch): 100000000:1\nBlickwinkel, horizontal: 178\u00b0\nBlickwinkel, vertikal: 178\u00b0\n3D: Nein\nHorizontaler Scanbereich: 30 - 85 kHz\nVertikaler Scanbereich: 50 - 75 Hz\nNTSC Abdeckung (typisch): 72%\nEingebaute Lautsprecher: Ja\nIntegrierte Kamera: Nein\nAnzahl der Lautsprecher: 2\nRMS-Leistung: 4 W\nProduktfarbe: Schwarz\nHDMI: Ja\nAnzahl VGA (D-Sub) Anschl\u00fcsse: 1\nAnzahl DisplayPort Anschl\u00fcsse: 1\nVESA-Halterung: Ja\nH\u00f6henverstellung: Ja\nPanel-Montage-Schnittstelle: 100 x 100 mm\nBer\u00fchrungsschutz: Ja\nH\u00f6heneinstellung: 12 cm\nSchwenkbar: Ja\nSchwenkwinkelbereich: 45 - 45\u00b0\nkippbar: Ja\nNeigungswinkelbereich: 5 - 25\u00b0\nEnergieeffizienzklasse (SDR): F\nEnergieverbrauch (SDR) pro 1.000 Stunden: 19 kWh\nStromverbrauch (Standardbetrieb): 19 W\nStromverbrauch (Standby): 0,5 W\nStromverbrauch (aus): 0,3 W\nAC Eingangsspannung: 120 - 230 V\nEnergieeffizienzskala: A bis G\nNachhaltigkeitszertifikate: ENERGY STAR\nGer\u00e4tebreite (inkl. Fu\u00df): 490 mm\nGer\u00e4tetiefe (inkl. Fu\u00df): 193 mm\nGer\u00e4teh\u00f6he (inkl. Fu\u00df): 485 mm\nGewicht (mit St\u00e4nder): 4,78 kg\nBreite (ohne Standfu\u00df): 49 cm\nTiefe (ohne Standfu\u00df): 6,5 cm\nH\u00f6he (ohne Standfu\u00df): 29,5 cm\nGewicht (ohne St\u00e4nder): 2,83 kg\nEin-/Ausschalter: Ja\nTV Tuner integriert: Nein",
    "reference_file": "offer_reference_2007.json",
    "shop_name": "Jacob Elektronik direkt (AT)"
}