{
    "html_file": "offer_1202_22.html",
    "name": "HP E24mv G4, 23.8\"",
    "offer_link": "https://www.hiq24.de/shop/artikel/320747/?sPartner=geizhals",
    "price": 239.9,
    "raw_specifications": {
        "Abmessungen (Breite x Tiefe x H\u00f6he)": "53.94 cm x 21.6 cm x 53.07 cm - mit Fu\u00df",
        "Abmessungen (Breite x Tiefe x H\u00f6he) - mit Fu\u00df": "53.94 cm x 21.6 cm x 53.07 cm",
        "Audioeingang": "Mikrofon",
        "Ausgangsleistung/Kanal": "2 Watt",
        "Besonderheiten": "HDCP, On-screen Digital Controls, Low Blue Light Mode, flimmerfreie Technologie, extrem schmale Blende an drei Seiten, kantenbeleuchtete LED-Hintergrundbeleuchtung, 8-bit (6-bit + FRC) Farbtiefe, HP Eye Ease, 72 % NTSC Farbraum",
        "Bildschirmbeschichtung": "Blendfrei, 3H Hard Coating, Haze 25 %",
        "Bildschirmtyp": "IPS",
        "Details zu Abmessungen & Gewicht": "Mit Fu\u00df - Breite: 53.94 cm - Tiefe: 21.6 cm - H\u00f6he: 53.07 cm - Gewicht: 6.5 kg  Ohne Fu\u00df - Breite: 53.94 cm - Tiefe: 4.7 cm - H\u00f6he: 35.56 cm - Gewicht: 3.9 kg",
        "Diagonalabmessung": "60.45 cm (23.8\")",
        "Display-Typ": "LED-hintergrundbeleuchteter LCD-Monitor / TFT-Aktivmatrix",
        "ENERGY STAR zertifiziert": "Ja",
        "Eingangsanschl\u00fcsse": "HDMI, VGA, DisplayPort",
        "Eingangsspannung": "Wechselstrom 120/230 V (50/60 Hz)",
        "Einstellungen der Anzeigeposition": "H\u00f6he, Pivot (Rotation), Drehung, Neigung",
        "Energie Effizienzklasse": "Klasse E",
        "Enthaltene Kabel": "1 x DisplayPort 1.2-Kabel - 1.8 m  1 x HDMI-Kabel - 1.8 m  1 x USB-Kabel Typ A auf Typ B - 1.8 m",
        "Farbe": "Silber, schwarzer Kopf",
        "Farbraum": "72% NTSC",
        "Farbtemperatur": "6500K",
        "Ger\u00e4tetyp": "LED-hintergrundbeleuchteter LCD-Monitor - 60.45 cm (23.8\")",
        "Gewicht": "6.5 kg",
        "Helligkeit": "250 cd/m\u00b2",
        "Hintergrundbeleuchtungs-Technologie": "LED-Hintergrundbeleuchtung",
        "Horizontale Bildwiederholrate": "30 - 80 kHz",
        "Horizontaler Betrachtungswinkel": "178",
        "H\u00f6heneinstellung": "150 mm",
        "Integrierte Peripherieger\u00e4te": "IR-Kamera, USB 3.2 Gen 1 Hub",
        "Kennzeichnung": "TUV GS, VCCI, BSMI, GS, NOM, WHQL, CB, CCC, PSB, FCC, ISO 9241-307, KCC, WEEE, MEPS, KC, CECP, CEL, SEPA, BIS, halogenarm, DisplayPort 1.2, Ukraine, UAE, Australien-Neuseeland MEPS, Vietnam MEPS",
        "Kontrast": "1000:1 / 5000000:1 (dynamisch)",
        "Lebensdauer der Beleuchtung": "30,000 Stunden",
        "Leistungsmerkmale": "IR-Kamera, USB 3.2 Gen 1 Hub",
        "Lokalisierung": "Englisch / Europa",
        "Max. Betriebstemperatur": "35 \u00b0C",
        "Min Betriebstemperatur": "5 \u00b0C",
        "Mitgelieferte Software": "HP Display Center",
        "Native Aufl\u00f6sung": "Full HD (1080p) 1920 x 1080 bei 60 Hz",
        "Neigungswinkel": "-5/+23",
        "OSD-Sprachen": "Chinesisch (tradionell), Chinesisch (vereinfacht), Englisch, Deutsch, Franz\u00f6sisch, Italienisch, Portugiesisch, Spanisch, Holl\u00e4ndisch, Japanisch",
        "Pixelpitch": "0.2745 mm",
        "Ppi": "93",
        "Produktbeschreibung": "HP E24mv G4 Conferencing Monitor - E-Series - LED-Monitor - Full HD (1080p) - 60.45 cm (23.8\")",
        "Reaktionszeit": "5 ms (grau zu grau mit \u00dcbersteuerung)",
        "Rotationswinkel": "180",
        "Schlosstyp zur Diebstahlsicherung": "Kensington Slot",
        "Schnittstellen": "DisplayPort 1.2  HDMI  VGA  4 x USB 3.2 Gen 1 Upstream  USB (Typ B)  Audio Line-Out (Mini-Klinkenstecker)",
        "Schwenkwinkel": "90",
        "Seitenverh\u00e4ltnis": "16:9",
        "Spannung": "Wechselstrom 120/230 V (50/60 Hz)",
        "Stromverbrauch (max.)": "50 Watt",
        "Stromverbrauch (typisch)": "28 Watt",
        "Stromverbrauch SDR (eingeschaltet)": "16 kWh/1.000 h",
        "Stromverbrauch im Standby-Modus": "0.5 Watt",
        "Transportbreite": "59.6 cm",
        "Transportgewicht": "10.4 kg",
        "Transporth\u00f6he": "41.1 cm",
        "Transporttiefe": "22.5 cm",
        "Typ": "Lautsprecher - Stereo",
        "Umweltschutzstandards": "ENERGY STAR-qualifiziert",
        "VESA-Halterung": "100 x 100 mm",
        "Vertikale Bildwiederholrate": "50 - 60 Hz",
        "Vertikaler Betrachtungswinkel": "178",
        "Zul\u00e4ssige Luftfeuchtigkeit im Betrieb": "20 - 80% (nicht kondensierend)"
    },
    "raw_specifications_text": "Display-Typ: LED-hintergrundbeleuchteter LCD-Monitor / TFT-Aktivmatrix\nEnergie Effizienzklasse: Klasse E\nDiagonalabmessung: 60.45 cm (23.8\")\nIntegrierte Peripherieger\u00e4te: IR-Kamera, USB 3.2 Gen 1 Hub\nBildschirmtyp: IPS\nSeitenverh\u00e4ltnis: 16:9\nNative Aufl\u00f6sung: Full HD (1080p) 1920 x 1080 bei 60 Hz\nPixelpitch: 0.2745 mm\nPpi: 93\nHelligkeit: 250 cd/m\u00b2\nKontrast: 1000:1 / 5000000:1 (dynamisch)\nFarbraum: 72% NTSC\nReaktionszeit: 5 ms (grau zu grau mit \u00dcbersteuerung)\nVertikale Bildwiederholrate: 50 - 60 Hz\nHorizontale Bildwiederholrate: 30 - 80 kHz\nHorizontaler Betrachtungswinkel: 178\nVertikaler Betrachtungswinkel: 178\nBildschirmbeschichtung: Blendfrei, 3H Hard Coating, Haze 25 %\nHintergrundbeleuchtungs-Technologie: LED-Hintergrundbeleuchtung\nFarbtemperatur: 6500K\nOSD-Sprachen: Chinesisch (tradionell), Chinesisch (vereinfacht), Englisch, Deutsch, Franz\u00f6sisch, Italienisch, Portugiesisch, Spanisch, Holl\u00e4ndisch, Japanisch\nBesonderheiten: HDCP, On-screen Digital Controls, Low Blue Light Mode, flimmerfreie Technologie, extrem schmale Blende an drei Seiten, kantenbeleuchtete LED-Hintergrundbeleuchtung, 8-bit (6-bit + FRC) Farbtiefe, HP Eye Ease, 72 % NTSC Farbraum\nFarbe: Silber, schwarzer Kopf\nAbmessungen (Breite x Tiefe x H\u00f6he): 53.94 cm x 21.6 cm x 53.07 cm - mit Fu\u00df\nGewicht: 6.5 kg\nTyp: Lautsprecher - Stereo\nAusgangsleistung/Kanal: 2 Watt\nSchnittstellen: DisplayPort 1.2  HDMI  VGA  4 x USB 3.2 Gen 1 Upstream  USB (Typ B)  Audio Line-Out (Mini-Klinkenstecker)\nEinstellungen der Anzeigeposition: H\u00f6he, Pivot (Rotation), Drehung, Neigung\nNeigungswinkel: -5/+23\nSchwenkwinkel: 90\nRotationswinkel: 180\nH\u00f6heneinstellung: 150 mm\nVESA-Halterung: 100 x 100 mm\nLeistungsmerkmale: IR-Kamera, USB 3.2 Gen 1 Hub\nEnthaltene Kabel: 1 x DisplayPort 1.2-Kabel - 1.8 m  1 x HDMI-Kabel - 1.8 m  1 x USB-Kabel Typ A auf Typ B - 1.8 m\nLebensdauer der Beleuchtung: 30,000 Stunden\nKennzeichnung: TUV GS, VCCI, BSMI, GS, NOM, WHQL, CB, CCC, PSB, FCC, ISO 9241-307, KCC, WEEE, MEPS, KC, CECP, CEL, SEPA, BIS, halogenarm, DisplayPort 1.2, Ukraine, UAE, Australien-Neuseeland MEPS, Vietnam MEPS\nLokalisierung: Englisch / Europa\nSchlosstyp zur Diebstahlsicherung: Kensington Slot\nEingangsspannung: Wechselstrom 120/230 V (50/60 Hz)\nStromverbrauch SDR (eingeschaltet): 16 kWh/1.000 h\nStromverbrauch (typisch): 28 Watt\nStromverbrauch (max.): 50 Watt\nStromverbrauch im Standby-Modus: 0.5 Watt\nMitgelieferte Software: HP Display Center\nDetails zu Abmessungen & Gewicht: Mit Fu\u00df - Breite: 53.94 cm - Tiefe: 21.6 cm - H\u00f6he: 53.07 cm - Gewicht: 6.5 kg  Ohne Fu\u00df - Breite: 53.94 cm - Tiefe: 4.7 cm - H\u00f6he: 35.56 cm - Gewicht: 3.9 kg\nTransportbreite: 59.6 cm\nTransporttiefe: 22.5 cm\nTransporth\u00f6he: 41.1 cm\nTransportgewicht: 10.4 kg\nENERGY STAR zertifiziert: Ja\nMin Betriebstemperatur: 5 \u00b0C\nMax. Betriebstemperatur: 35 \u00b0C\nZul\u00e4ssige Luftfeuchtigkeit im Betrieb: 20 - 80% (nicht kondensierend)\nProduktbeschreibung: HP E24mv G4 Conferencing Monitor - E-Series - LED-Monitor - Full HD (1080p) - 60.45 cm (23.8\")\nGer\u00e4tetyp: LED-hintergrundbeleuchteter LCD-Monitor - 60.45 cm (23.8\")\nEingangsanschl\u00fcsse: HDMI, VGA, DisplayPort\nAudioeingang: Mikrofon\nSpannung: Wechselstrom 120/230 V (50/60 Hz)\nAbmessungen (Breite x Tiefe x H\u00f6he) - mit Fu\u00df: 53.94 cm x 21.6 cm x 53.07 cm\nUmweltschutzstandards: ENERGY STAR-qualifiziert",
    "reference_file": "offer_reference_1202.json",
    "shop_name": "HiQ24"
}