{
    "html_file": "offer_1857_4.html",
    "name": "Xiaomi Mi Curved Gaming Monitor, 34\"",
    "offer_link": "https://www.taufnaus.de/product/10602235",
    "price": 465.73,
    "raw_specifications": {
        "Abmessungen (Breite x Tiefe x H\u00f6he)": "81.039 cm x 24.253 cm x 52.061 cm - mit Fu\u00df",
        "Adaptive-Sync Technologie": "AMD FreeSync Premium",
        "Besonderheiten": "Picture-in-Picture, Low Blue Light-Technologie, an 3 Seiten ohne Blende, 8-bit Farbtiefe, Augenschutz-Modus",
        "Diagonalabmessung": "86.4 cm (34\")",
        "Display-Typ": "LED-hintergrundbeleuchteter LCD-Monitor / TFT-Aktivmatrix",
        "Einstellungen der Anzeigeposition": "H\u00f6he, Drehung, Neigung",
        "Energie Effizienzklasse": "Klasse F",
        "Enthaltene Kabel": "1 x DisplayPort-Kabel",
        "Farbe": "Schwarz",
        "Farbraum": "121% sRGB, 85% NTSC (CIE 1931)",
        "Farbunterst\u00fctzung": "16,7 Millionen Farben",
        "Gaming": "Ja",
        "Geschwungener Bildschirm": "Ja (1500R)",
        "Helligkeit": "300 cd/m\u00b2",
        "Hintergrundbeleuchtungs-Technologie": "LED-Hintergrundbeleuchtung",
        "Kontrast": "3000:1",
        "Leistungsaufnahme im Ein-Zustand": "31 W",
        "Native Aufl\u00f6sung": "WQHD 3440 x 1440 bei 144 Hz",
        "Reaktionszeit": "4 ms",
        "Schnittstellen": "2 x HDMI \u00a6 2 x DisplayPort 1.4 \u00a6 Kopfh\u00f6rer",
        "Seitenverh\u00e4ltnis": "21:9",
        "Stromverbrauch SDR (eingeschaltet)": "31 kWh/1.000 h"
    },
    "raw_specifications_text": "Display-Typ: LED-hintergrundbeleuchteter LCD-Monitor / TFT-Aktivmatrix\nEnergie Effizienzklasse: Klasse F\nDiagonalabmessung: 86.4 cm (34\")\nGeschwungener Bildschirm: Ja (1500R)\nAdaptive-Sync Technologie: AMD FreeSync Premium\nSeitenverh\u00e4ltnis: 21:9\nNative Aufl\u00f6sung: WQHD 3440 x 1440 bei 144 Hz\nHelligkeit: 300 cd/m\u00b2\nKontrast: 3000:1\nFarbunterst\u00fctzung: 16,7 Millionen Farben\nFarbraum: 121% sRGB, 85% NTSC (CIE 1931)\nReaktionszeit: 4 ms\nGaming: Ja\nHintergrundbeleuchtungs-Technologie: LED-Hintergrundbeleuchtung\nBesonderheiten: Picture-in-Picture, Low Blue Light-Technologie, an 3 Seiten ohne Blende, 8-bit Farbtiefe, Augenschutz-Modus\nFarbe: Schwarz\nAbmessungen (Breite x Tiefe x H\u00f6he): 81.039 cm x 24.253 cm x 52.061 cm - mit Fu\u00df\nSchnittstellen: 2 x HDMI \u00a6 2 x DisplayPort 1.4 \u00a6 Kopfh\u00f6rer\nEinstellungen der Anzeigeposition: H\u00f6he, Drehung, Neigung\nEnthaltene Kabel: 1 x DisplayPort-Kabel\nLeistungsaufnahme im Ein-Zustand: 31 W\nStromverbrauch SDR (eingeschaltet): 31 kWh/1.000 h",
    "reference_file": "offer_reference_1857.json",
    "shop_name": "TaufNaus"
}