{
    "html_file": "offer_1253_1.html",
    "name": "Acer Predator CG7 CG437KSbmiipuzx, 42.5\"",
    "offer_link": "https://www.alternate.at/Acer/Predator-CG437KS-Gaming-Monitor/html/product/1758180?partner=AtGeizhalsat&campaign=Monitor/Acer/1758180",
    "price": 1069.0,
    "raw_specifications": {
        "": "VESA DisplayHDR Standard",
        "Anschl\u00fcsse": "2x HDMI-Eingang, (HDMI-Version: 2.1), 1x DisplayPort-Eingang, (DisplayPort-Version: 1.4), 1x 3,5-mm-Audio-Ausgang, 2x USB-A-2.0, 3x USB-A-3.2 Gen 1 (5 Gbit/s), 1x USB-B-2.0, 1x USB-C",
        "Bild": "Format",
        "Bildschirmaufl\u00f6sung": "3.840 x 2.160 Pixel",
        "Bildschirmdiagonale": "108 cm (43 Zoll)",
        "EAN": "4710886677406",
        "Energieeffizienzklasse (HDR)": "G (A - G)",
        "Energieeffizienzklasse (SDR)": "G (A - G)",
        "Energieverbauch pro 1000 Stunden (HDR)": "193 kWh",
        "Energieverbauch pro 1000 Stunden (SDR)": "135 kWh",
        "Farbe": "schwarz",
        "Features": "Delta E<2, Lichtsensor, Ann\u00e4herungssensor, 30 Watt USB-C PD",
        "Geeignet f\u00fcr": "Gaming",
        "Hersteller-Nr.": "UM.MC7EE.S01",
        "Lautsprecher": "2 Lautsprecher",
        "Leistungsaufnahme im Bereitschafts- und Aus-Zustand": "0,5 Watt",
        "Leistungsaufnahme im Ein-Zustand bei Standard-Dynamikumfang (SDR)": "135 Watt",
        "Leistungsaufnahme im Ein-Zustand bei hohem Dynamikumfang (HDR)": "193 Watt",
        "Serie": "Predator",
        "Standards": "Video",
        "Stromversorgung": "Eco-Off",
        "Typ": "Gaming-Monitor",
        "Wandhalterung": "VESA kompatibel (200 x 100 mm)"
    },
    "raw_specifications_text": "Energieeffizienzklasse (SDR): G (A - G)\nEnergieverbauch pro 1000 Stunden (SDR): 135 kWh\nEnergieeffizienzklasse (HDR): G (A - G)\nEnergieverbauch pro 1000 Stunden (HDR): 193 kWh\nLeistungsaufnahme im Ein-Zustand bei Standard-Dynamikumfang (SDR): 135 Watt\nLeistungsaufnahme im Ein-Zustand bei hohem Dynamikumfang (HDR): 193 Watt\nLeistungsaufnahme im Bereitschafts- und Aus-Zustand: 0,5 Watt\nBildschirmdiagonale: 108 cm (43 Zoll)\nBildschirmaufl\u00f6sung: 3.840 x 2.160 Pixel\nTyp: Gaming-Monitor\nFarbe: schwarz\nEAN: 4710886677406\nHersteller-Nr.: UM.MC7EE.S01\nSerie: Predator\nGeeignet f\u00fcr: Gaming\nBild: Format\n: VESA DisplayHDR Standard\nAnschl\u00fcsse: 2x HDMI-Eingang, (HDMI-Version: 2.1), 1x DisplayPort-Eingang, (DisplayPort-Version: 1.4), 1x 3,5-mm-Audio-Ausgang, 2x USB-A-2.0, 3x USB-A-3.2 Gen 1 (5 Gbit/s), 1x USB-B-2.0, 1x USB-C\nStromversorgung: Eco-Off\nLautsprecher: 2 Lautsprecher\nStandards: Video\nWandhalterung: VESA kompatibel (200 x 100 mm)\nFeatures: Delta E<2, Lichtsensor, Ann\u00e4herungssensor, 30 Watt USB-C PD",
    "reference_file": "offer_reference_1253.json",
    "shop_name": "Alternate.at"
}