{
    "html_file": "offer_290_21.html",
    "name": "LG 35BN77CP-B, 35\"",
    "offer_link": "https://www.alternate.at/LG/35BN77CP-B-Gaming-Monitor/html/product/1913718?partner=AtGeizhalsat&campaign=Monitor/LG/1913718",
    "price": 427.0,
    "raw_specifications": {
        "": "Neigbar",
        "Abmessungen": "Breite: 83,16 cm x H\u00f6he: 62,28 cm x Tiefe/L\u00e4nge: 25,29 cm",
        "Anschl\u00fcsse": "2x HDMI-Eingang, 1x DisplayPort-Eingang, (DisplayPort-Version: 1.4b), 2x USB-A-3.2 Gen 1 (5 Gbit/s), 1x USB-C 3.2 Gen 2 (10 Gbit/s)",
        "Bild": "Glaretyp",
        "Bildschirmaufl\u00f6sung": "3.440 x 1.440 Pixel",
        "Bildschirmdiagonale": "88,9 cm (35 Zoll)",
        "EAN": "8806087975024",
        "Energieeffizienzklasse (HDR)": "G (A - G)",
        "Energieeffizienzklasse (SDR)": "G (A - G)",
        "Energieverbauch pro 1000 Stunden (HDR)": "44 kWh",
        "Energieverbauch pro 1000 Stunden (SDR)": "34 kWh",
        "Ergonomie": "Typ",
        "Farbe": "schwarz/silber",
        "Geeignet f\u00fcr": "Gaming, Multimedia",
        "Gewicht": "10 kg",
        "Hersteller-Nr.": "35BN77CP-B.AEU",
        "Lautsprecher": "2 Lautsprecher",
        "Leistungsaufnahme im Bereitschafts- und Aus-Zustand": "0,5 Watt",
        "Leistungsaufnahme im Ein-Zustand bei Standard-Dynamikumfang (SDR)": "33,9 Watt",
        "Leistungsaufnahme im Ein-Zustand bei hohem Dynamikumfang (HDR)": "44 Watt",
        "Standards": "Video",
        "Stromversorgung": "Mobil (Externes 12V-Netzteil)",
        "Typ": "Gaming-Monitor",
        "Wandhalterung": "VESA kompatibel (100 x 100 mm)",
        "Weitere Informationen": "Ma\u00dfe ohne Standfu\u00df: 831,6 x 327,7 x 94,1 mm (BxHxT) | Gewicht ohne Standfu\u00df: 6600 Gramm | Flicker Safe, Lesemodus, Super Resolution+, Black Stablilizer, Dynamic Action Sync, Maxx Audio | der USB-C-Anschluss unterst\u00fctzt DisplayPort Alt. Mode mit DisplayPort 1.4 und bis zu 90 Watt Ladeleistung",
        "Zubeh\u00f6r": "Vorhanden"
    },
    "raw_specifications_text": "Energieeffizienzklasse (SDR): G (A - G)\nEnergieverbauch pro 1000 Stunden (SDR): 34 kWh\nEnergieeffizienzklasse (HDR): G (A - G)\nEnergieverbauch pro 1000 Stunden (HDR): 44 kWh\nLeistungsaufnahme im Ein-Zustand bei Standard-Dynamikumfang (SDR): 33,9 Watt\nLeistungsaufnahme im Ein-Zustand bei hohem Dynamikumfang (HDR): 44 Watt\nLeistungsaufnahme im Bereitschafts- und Aus-Zustand: 0,5 Watt\nBildschirmdiagonale: 88,9 cm (35 Zoll)\nBildschirmaufl\u00f6sung: 3.440 x 1.440 Pixel\nTyp: Gaming-Monitor\nFarbe: schwarz/silber\nEAN: 8806087975024\nHersteller-Nr.: 35BN77CP-B.AEU\nGeeignet f\u00fcr: Gaming, Multimedia\nBild: Glaretyp\n: Neigbar\nAnschl\u00fcsse: 2x HDMI-Eingang, 1x DisplayPort-Eingang, (DisplayPort-Version: 1.4b), 2x USB-A-3.2 Gen 1 (5 Gbit/s), 1x USB-C 3.2 Gen 2 (10 Gbit/s)\nErgonomie: Typ\nStromversorgung: Mobil (Externes 12V-Netzteil)\nLautsprecher: 2 Lautsprecher\nStandards: Video\nWandhalterung: VESA kompatibel (100 x 100 mm)\nWeitere Informationen: Ma\u00dfe ohne Standfu\u00df: 831,6 x 327,7 x 94,1 mm (BxHxT) | Gewicht ohne Standfu\u00df: 6600 Gramm | Flicker Safe, Lesemodus, Super Resolution+, Black Stablilizer, Dynamic Action Sync, Maxx Audio | der USB-C-Anschluss unterst\u00fctzt DisplayPort Alt. Mode mit DisplayPort 1.4 und bis zu 90 Watt Ladeleistung\nZubeh\u00f6r: Vorhanden\nAbmessungen: Breite: 83,16 cm x H\u00f6he: 62,28 cm x Tiefe/L\u00e4nge: 25,29 cm\nGewicht: 10 kg",
    "reference_file": "offer_reference_290.json",
    "shop_name": "Alternate.at"
}