{
    "html_file": "offer_884_5.html",
    "name": "Acer Predator XB3 XB273UKFbmiipruzx, 27\"",
    "offer_link": "https://www.proshop.at/Bildschirm/Acer-27-Bildschirm-Predator-XB273U-KFbmiipruzx-Black-1-ms-NVIDIA-G-Sync-Compatible/3193762?utm_source=geizhals&utm_medium=cpc&utm_campaign=pricesite",
    "price": 1217.5,
    "raw_specifications": {
        "Abmessungen (Breite x Tiefe x H\u00f6he)": "61.2 cm x 23.6 cm x 53 cm - mit Fu\u00df",
        "Abmessungen (Breite x Tiefe x H\u00f6he) - mit Fu\u00df": "61.2 cm x 23.6 cm x 53 cm",
        "Adaptive-Sync Technologie": "NVIDIA G-SYNC Compatible",
        "Besonderheiten": "Acer Adaptive Contrast Management (ACM), ComfyView, an 3 Seiten ohne Blende",
        "Bildschirmbeschichtung": "Blendfrei",
        "Bildschirmtyp": "IPS",
        "Details zu Abmessungen & Gewicht": "Mit Fu\u00df - Breite: 61.2 cm - Tiefe: 23.6 cm - H\u00f6he: 53 cm - Gewicht: 5.85 kg  Ohne Fu\u00df - Breite: 61.2 cm - Tiefe: 7.4 cm - H\u00f6he: 36.6 cm - Gewicht: 3.83 kg",
        "Diagonalabmessung": "68.6 cm (27\")",
        "Display-Typ": "LED-hintergrundbeleuchteter LCD-Monitor / TFT-Aktivmatrix",
        "EAN": "4710886913443",
        "Ein-/Aus-Schalter": "Nein",
        "Eingangsanschl\u00fcsse": "2xHDMI, DisplayPort, USB-C",
        "Eingangsspannung": "Wechselstrom 100-240 V (50/60 Hz)",
        "Einstellungen der Anzeigeposition": "H\u00f6he, Pivot (Rotation), Drehung, Neigung",
        "Energie Effizienzklasse": "Klasse G",
        "Energieklasse (HDR)": "Klasse G",
        "Energierverbrauch Sleep": "0.34 Watt",
        "Energieverbrauch pro Jahr": "61 kWh",
        "Enthaltene Kabel": "1 x HDMI-Kabel  1 x DisplayPort-Kabel",
        "Farbe": "Schwarz",
        "Farbraum": "95% DCI-P3",
        "Farbunterst\u00fctzung": "16,7 Millionen Farben",
        "Ger\u00e4tetyp": "LED-hintergrundbeleuchteter LCD-Monitor - 68.6 cm (27\")",
        "Gewicht": "5.85 kg",
        "HDR-Zertifizierung": "DisplayHDR 600",
        "HDR-f\u00e4hig": "DisplayHDR 600",
        "Helligkeit": "600 cd/m\u00b2",
        "Hersteller": "Acer",
        "Hintergrundbeleuchtungs-Technologie": "LED-Hintergrundbeleuchtung",
        "Horizontaler Betrachtungswinkel": "178",
        "H\u00f6heneinstellung": "115 mm",
        "Integrierte Peripherieger\u00e4te": "USB 3.0-Hub",
        "Kennzeichnung": "MPR II",
        "Kontrast": "1000:1 / 100000000:1 (dynamisch)",
        "Leistungsaufnahme im Ein-Zustand": "32.1 W",
        "Leistungsmerkmale": "Slot f\u00fcr Sicherheitsschloss (Kabelschloss getrennt erh\u00e4ltlich), Unterst\u00fctzung f\u00fcr VESA-Schnittstelle",
        "Modell": "UM.HX3EE.F01",
        "Native Aufl\u00f6sung": "WQHD 2560 x 1440 bei 300 Hz",
        "Neigungswinkel": "-5/+20",
        "Pixelpitch": "0.233 mm",
        "Produktbeschreibung": "Acer Predator XB273U KFbmiipruzx - XB3 Series - LED-Monitor - 68.6 cm (27\") - HDR",
        "Reaktionszeit": "1 ms (Gray-to-Gray), 0,5 ms (Grau-zu-Grau min.)",
        "Rotationswinkel": "180",
        "Schlosstyp zur Diebstahlsicherung": "Kensington Slot",
        "Schnittstellen": "DisplayPort  2 x HDMI  Audio Line-Out  USB-C 3.1 Gen 1 Upstream/DisplayPort Alt Mode mit Spannungsversorgung (bis zu 65 W)  4 x USB 3.0 Downstream",
        "Schwenkwinkel": "40",
        "Seitenverh\u00e4ltnis": "16:9",
        "Spannung": "Wechselstrom 100-240 V (50/60 Hz)",
        "Stromverbrauch (Aus-Modus)": "0.29 Watt",
        "Stromverbrauch (typisch)": "30.06 Watt",
        "Stromverbrauch HDR (eingeschaltet)": "33.1 kWh/1.000 h",
        "Stromverbrauch SDR (eingeschaltet)": "32.1 kWh/1.000 h",
        "Stromverbrauch im Standby-Modus": "0.63 Watt",
        "Typ": "Lautsprecher",
        "VESA-Halterung": "100 x 100 mm",
        "Vertikaler Betrachtungswinkel": "178",
        "Waren-Nr.": "3193762",
        "Zum Hersteller": "www.acer.com"
    },
    "raw_specifications_text": "Hersteller: Acer\nWaren-Nr.: 3193762\nModell: UM.HX3EE.F01\nEAN: 4710886913443\nZum Hersteller: www.acer.com\nProduktbeschreibung: Acer Predator XB273U KFbmiipruzx - XB3 Series - LED-Monitor - 68.6 cm (27\") - HDR\nGer\u00e4tetyp: LED-hintergrundbeleuchteter LCD-Monitor - 68.6 cm (27\")\nEnergie Effizienzklasse: Klasse G\nEnergieverbrauch pro Jahr: 61 kWh\nLeistungsaufnahme im Ein-Zustand: 32.1 W\nAdaptive-Sync Technologie: NVIDIA G-SYNC Compatible\nLeistungsmerkmale: Slot f\u00fcr Sicherheitsschloss (Kabelschloss getrennt erh\u00e4ltlich), Unterst\u00fctzung f\u00fcr VESA-Schnittstelle\nBildschirmtyp: IPS\nSeitenverh\u00e4ltnis: 16:9\nNative Aufl\u00f6sung: WQHD 2560 x 1440 bei 300 Hz\nPixelpitch: 0.233 mm\nHelligkeit: 600 cd/m\u00b2\nKontrast: 1000:1 / 100000000:1 (dynamisch)\nHDR-f\u00e4hig: DisplayHDR 600\nReaktionszeit: 1 ms (Gray-to-Gray), 0,5 ms (Grau-zu-Grau min.)\nFarbunterst\u00fctzung: 16,7 Millionen Farben\nFarbraum: 95% DCI-P3\nEingangsanschl\u00fcsse: 2xHDMI, DisplayPort, USB-C\nEinstellungen der Anzeigeposition: H\u00f6he, Pivot (Rotation), Drehung, Neigung\nBildschirmbeschichtung: Blendfrei\nSpannung: Wechselstrom 100-240 V (50/60 Hz)\nFarbe: Schwarz\nAbmessungen (Breite x Tiefe x H\u00f6he) - mit Fu\u00df: 61.2 cm x 23.6 cm x 53 cm\nGewicht: 5.85 kg\nKennzeichnung: MPR II\nDisplay-Typ: LED-hintergrundbeleuchteter LCD-Monitor / TFT-Aktivmatrix\nEnergieklasse (HDR): Klasse G\nDiagonalabmessung: 68.6 cm (27\")\nIntegrierte Peripherieger\u00e4te: USB 3.0-Hub\nHDR-Zertifizierung: DisplayHDR 600\nHorizontaler Betrachtungswinkel: 178\nVertikaler Betrachtungswinkel: 178\nHintergrundbeleuchtungs-Technologie: LED-Hintergrundbeleuchtung\nBesonderheiten: Acer Adaptive Contrast Management (ACM), ComfyView, an 3 Seiten ohne Blende\nAbmessungen (Breite x Tiefe x H\u00f6he): 61.2 cm x 23.6 cm x 53 cm - mit Fu\u00df\nTyp: Lautsprecher\nSchnittstellen: DisplayPort  2 x HDMI  Audio Line-Out  USB-C 3.1 Gen 1 Upstream/DisplayPort Alt Mode mit Spannungsversorgung (bis zu 65 W)  4 x USB 3.0 Downstream\nNeigungswinkel: -5/+20\nSchwenkwinkel: 40\nRotationswinkel: 180\nH\u00f6heneinstellung: 115 mm\nVESA-Halterung: 100 x 100 mm\nEnthaltene Kabel: 1 x HDMI-Kabel  1 x DisplayPort-Kabel\nSchlosstyp zur Diebstahlsicherung: Kensington Slot\nEingangsspannung: Wechselstrom 100-240 V (50/60 Hz)\nStromverbrauch SDR (eingeschaltet): 32.1 kWh/1.000 h\nStromverbrauch HDR (eingeschaltet): 33.1 kWh/1.000 h\nStromverbrauch (typisch): 30.06 Watt\nStromverbrauch im Standby-Modus: 0.63 Watt\nEnergierverbrauch Sleep: 0.34 Watt\nStromverbrauch (Aus-Modus): 0.29 Watt\nEin-/Aus-Schalter: Nein\nDetails zu Abmessungen & Gewicht: Mit Fu\u00df - Breite: 61.2 cm - Tiefe: 23.6 cm - H\u00f6he: 53 cm - Gewicht: 5.85 kg  Ohne Fu\u00df - Breite: 61.2 cm - Tiefe: 7.4 cm - H\u00f6he: 36.6 cm - Gewicht: 3.83 kg",
    "reference_file": "offer_reference_884.json",
    "shop_name": "Proshop.at"
}