{
    "html_file": "offer_1886_2.html",
    "name": "LG UltraWide 34BN770-B, 34\"",
    "offer_link": "https://www.ba-computer.at/lg-34bn770-b-led-monitor-86-72-cm-34-3440-x-1440-uwqhd-75-hz-34bn770-b.html",
    "price": 486.34,
    "raw_specifications": {
        "Abmessungen (Breite x Tiefe x H\u00f6he)": "81.65 cm x 25.29 cm x 61.69 cm - mit Fu\u00df",
        "Adaptive-Sync Technologie": "AMD FreeSync",
        "Ausgangsleistung/Kanal": "7 Watt",
        "Besonderheiten": "SUPER + Resolution, Multiscan Support, On-screen Digital Controls, OSD sperren, Flicker Safe, Reader Mode, Werkskalibrierung, Joystick, MaxxAudio, Intelligente Energiespartechnologie, Dual Controller, Black Stabilizer, DAS Mode (Dynamic Action Sync), FreeSync Technology, My Display Preset, Color Weakness Mode, 6-Achsen-Farbkontrolle, an 3 Seiten ohne Blende, 8-bit Farbtiefe, 99 % sRGB Farbraum",
        "Bildschirmbeschichtung": "Blendfrei, 3H Hard Coating",
        "Bildschirmtyp": "IPS",
        "Details zu Abmessungen & Gewicht": "Mit Fu\u00df - Breite: 81.65 cm - Tiefe: 25.29 cm - H\u00f6he: 61.69 cm - Gewicht: 10.3 kg \u00a6 Ohne Fu\u00df - Breite: 81.66 cm - Tiefe: 4.55 cm - H\u00f6he: 36.53 cm - Gewicht: 6.9 kg",
        "Diagonalabmessung": "86.72 cm (34\")",
        "Display-Typ": "LED-hintergrundbeleuchteter LCD-Monitor / TFT-Aktivmatrix",
        "Einstellungen der Anzeigeposition": "H\u00f6he, Drehung, Neigung",
        "Energie Effizienzklasse": "Klasse G",
        "Energieklasse (HDR)": "Klasse G",
        "Energieverbrauch pro Jahr": "57 kWh",
        "Farbe": "Mattschwarz",
        "Farbraum": "99% sRGB",
        "Farbunterst\u00fctzung": "16,7 Millionen Farben",
        "Gewicht": "10.3 kg",
        "HDR-Format": "HDR10",
        "Helligkeit": "300 cd/m\u00b2",
        "Hintergrundbeleuchtungs-Technologie": "WLED",
        "Horizontaler Betrachtungswinkel": "178",
        "H\u00f6heneinstellung": "150 mm",
        "Integrierte Peripherieger\u00e4te": "USB 3.0-Hub",
        "Kennzeichnung": "Plug and Play, DDC/CI, RoHS, IEC 62087 Edition 2",
        "Kontrast": "1000:1",
        "Leistungsaufnahme im Ein-Zustand": "37.1 W",
        "Leistungsmerkmale": "Slot f\u00fcr Sicherheitsschloss (Kabelschloss getrennt erh\u00e4ltlich), abnehmbarer St\u00e4nder",
        "Native Aufl\u00f6sung": "UWQHD 3440 x 1440 bei 75 Hz",
        "Neigungswinkel": "-5/+35",
        "OSD-Sprachen": "Multilingual",
        "Pixelpitch": "0.2325 mm",
        "Reaktionszeit": "5 ms (Gray-to-Gray)",
        "Schlosstyp zur Diebstahlsicherung": "Kensington Slot",
        "Schnittstellen": "2 x HDMI \u00a6 DisplayPort \u00a6 2 x USB 3.0 Downstream \u00a6 USB 3.0 Upstream \u00a6 Kopfh\u00f6rer (Mini-Klinkenstecker)",
        "Schwenkwinkel": "90",
        "Seitenverh\u00e4ltnis": "21:9",
        "Stromverbrauch (Aus-Modus)": "0.3 Watt",
        "Stromverbrauch (typisch)": "45 Watt",
        "Stromverbrauch HDR (eingeschaltet)": "47.8 kWh/1.000 h",
        "Stromverbrauch SDR (eingeschaltet)": "37.1 kWh/1.000 h",
        "Stromverbrauch im Standby-Modus": "0.5 Watt",
        "Typ": "Lautsprecher - Stereo",
        "VESA-Halterung": "100 x 100 mm",
        "Vertikaler Betrachtungswinkel": "178",
        "Zubeh\u00f6r im Lieferumfang": "Kabelhalter"
    },
    "raw_specifications_text": "Display-Typ: LED-hintergrundbeleuchteter LCD-Monitor / TFT-Aktivmatrix\nEnergie Effizienzklasse: Klasse G\nEnergieklasse (HDR): Klasse G\nEnergieverbrauch pro Jahr: 57 kWh\nDiagonalabmessung: 86.72 cm (34\")\nAdaptive-Sync Technologie: AMD FreeSync\nIntegrierte Peripherieger\u00e4te: USB 3.0-Hub\nBildschirmtyp: IPS\nSeitenverh\u00e4ltnis: 21:9\nNative Aufl\u00f6sung: UWQHD 3440 x 1440 bei 75 Hz\nPixelpitch: 0.2325 mm\nHelligkeit: 300 cd/m\u00b2\nKontrast: 1000:1\nHDR-Format: HDR10\nFarbunterst\u00fctzung: 16,7 Millionen Farben\nFarbraum: 99% sRGB\nReaktionszeit: 5 ms (Gray-to-Gray)\nHorizontaler Betrachtungswinkel: 178\nVertikaler Betrachtungswinkel: 178\nBildschirmbeschichtung: Blendfrei, 3H Hard Coating\nHintergrundbeleuchtungs-Technologie: WLED\nOSD-Sprachen: Multilingual\nBesonderheiten: SUPER + Resolution, Multiscan Support, On-screen Digital Controls, OSD sperren, Flicker Safe, Reader Mode, Werkskalibrierung, Joystick, MaxxAudio, Intelligente Energiespartechnologie, Dual Controller, Black Stabilizer, DAS Mode (Dynamic Action Sync), FreeSync Technology, My Display Preset, Color Weakness Mode, 6-Achsen-Farbkontrolle, an 3 Seiten ohne Blende, 8-bit Farbtiefe, 99 % sRGB Farbraum\nFarbe: Mattschwarz\nAbmessungen (Breite x Tiefe x H\u00f6he): 81.65 cm x 25.29 cm x 61.69 cm - mit Fu\u00df\nGewicht: 10.3 kg\nTyp: Lautsprecher - Stereo\nAusgangsleistung/Kanal: 7 Watt\nSchnittstellen: 2 x HDMI \u00a6 DisplayPort \u00a6 2 x USB 3.0 Downstream \u00a6 USB 3.0 Upstream \u00a6 Kopfh\u00f6rer (Mini-Klinkenstecker)\nEinstellungen der Anzeigeposition: H\u00f6he, Drehung, Neigung\nNeigungswinkel: -5/+35\nSchwenkwinkel: 90\nH\u00f6heneinstellung: 150 mm\nVESA-Halterung: 100 x 100 mm\nLeistungsmerkmale: Slot f\u00fcr Sicherheitsschloss (Kabelschloss getrennt erh\u00e4ltlich), abnehmbarer St\u00e4nder\nZubeh\u00f6r im Lieferumfang: Kabelhalter\nKennzeichnung: Plug and Play, DDC/CI, RoHS, IEC 62087 Edition 2\nSchlosstyp zur Diebstahlsicherung: Kensington Slot\nLeistungsaufnahme im Ein-Zustand: 37.1 W\nStromverbrauch SDR (eingeschaltet): 37.1 kWh/1.000 h\nStromverbrauch HDR (eingeschaltet): 47.8 kWh/1.000 h\nStromverbrauch (typisch): 45 Watt\nStromverbrauch im Standby-Modus: 0.5 Watt\nStromverbrauch (Aus-Modus): 0.3 Watt\nDetails zu Abmessungen & Gewicht: Mit Fu\u00df - Breite: 81.65 cm - Tiefe: 25.29 cm - H\u00f6he: 61.69 cm - Gewicht: 10.3 kg \u00a6 Ohne Fu\u00df - Breite: 81.66 cm - Tiefe: 4.55 cm - H\u00f6he: 36.53 cm - Gewicht: 6.9 kg",
    "reference_file": "offer_reference_1886.json",
    "shop_name": "BA-Computer"
}