{
    "html_file": "offer_1809_9.html",
    "name": "Philips E-line 242E2FA, 23.8\"",
    "offer_link": "https://www.alternate.at/Philips/242E2FA-00-LED-Monitor/html/product/1761258?partner=AtGeizhalsat&campaign=Monitor/Philips/1761258",
    "price": 149.9,
    "raw_specifications": {
        "": "AMD FreeSync",
        "Abmessungen": "Breite: 54 cm x H\u00f6he: 42,8 cm x Tiefe/L\u00e4nge: 18,7 cm",
        "Anschl\u00fcsse": "1x HDMI-Eingang, 1x VGA-Eingang",
        "Bild": "Format",
        "Bildschirmaufl\u00f6sung": "1.920 x 1.080 Pixel",
        "Bildschirmdiagonale": "61 cm (24 Zoll)",
        "EAN": "8712581767600",
        "Energieeffizienzklasse (SDR)": "D (A - G)",
        "Energieverbauch pro 1000 Stunden (SDR)": "15 kWh",
        "Ergonomie": "Neigbar",
        "Farbe": "schwarz",
        "Features": "Mega Infinity DCR, LowBlue Modus",
        "Frequenz": "Vertikal",
        "Gewicht": "3,5 kg",
        "Hersteller-Nr.": "242E2FA/00",
        "Lautsprecher": "2 Lautsprecher",
        "Leistungsaufnahme im Bereitschafts- und Aus-Zustand": "0,5 Watt",
        "Leistungsaufnahme im Ein-Zustand bei Standard-Dynamikumfang (SDR)": "14,5 Watt",
        "Serie": "E-Line",
        "Stromversorgung": "Eco-Off",
        "Typ": "LED-Monitor",
        "Wandhalterung": "VESA kompatibel (100 x 100 mm)",
        "Zubeh\u00f6r": "Vorhanden"
    },
    "raw_specifications_text": "Energieeffizienzklasse (SDR): D (A - G)\nEnergieverbauch pro 1000 Stunden (SDR): 15 kWh\nLeistungsaufnahme im Ein-Zustand bei Standard-Dynamikumfang (SDR): 14,5 Watt\nLeistungsaufnahme im Bereitschafts- und Aus-Zustand: 0,5 Watt\nBildschirmdiagonale: 61 cm (24 Zoll)\nBildschirmaufl\u00f6sung: 1.920 x 1.080 Pixel\nTyp: LED-Monitor\nFarbe: schwarz\nEAN: 8712581767600\nHersteller-Nr.: 242E2FA/00\nSerie: E-Line\nBild: Format\n: AMD FreeSync\nFrequenz: Vertikal\nAnschl\u00fcsse: 1x HDMI-Eingang, 1x VGA-Eingang\nErgonomie: Neigbar\nStromversorgung: Eco-Off\nLautsprecher: 2 Lautsprecher\nWandhalterung: VESA kompatibel (100 x 100 mm)\nFeatures: Mega Infinity DCR, LowBlue Modus\nZubeh\u00f6r: Vorhanden\nAbmessungen: Breite: 54 cm x H\u00f6he: 42,8 cm x Tiefe/L\u00e4nge: 18,7 cm\nGewicht: 3,5 kg",
    "reference_file": "offer_reference_1809.json",
    "shop_name": "Alternate.at"
}