{
    "html_file": "offer_2192_8.html",
    "name": "Philips P-line 499P9H, 48.8\"",
    "offer_link": "https://direkt.jacob.de/produkte/philips-499p9h-499p9h-00-artnr-4803163.html?utm_source=geizhals&utm_medium=cpc&utm_campaign=Preisvergleich&ref=103",
    "price": 1063.85,
    "raw_specifications": {
        "Abmessungen (Breite x Tiefe x H\u00f6he)": "119.4 cm x 30.3 cm x 56.8 cm - mit Fu\u00df",
        "Abmessungen (Breite x Tiefe x H\u00f6he) - mit Fu\u00df": "119.4 cm x 30.3 cm x 56.8 cm",
        "Ausgangsleistung/Kanal": "5 Watt",
        "Besonderheiten": "Sync-on-Green, SmartImage, Low Blue Light Mode, flimmerfreie Technologie, BFR/PVC-frei, ohne Quecksilber, SmartUniformity, Quad & Dual Windows PBP, Adaptive-Sync-Technologie, 121% sRGB-Farbskala, EasyRead, 103% NTSC-Farbskala, sRGB Mode, Picture-by-Picture, kompatibel mit HDR 400, 99.67 % BT.709 Farbumfang, DCI-P3 94.62 % Farbraum, 91% Adobe RGB-Farbskala, Windows 10 Hello",
        "Bildschirmbeschichtung": "Blendfrei, 2H Hard Coating, Haze 25 %",
        "Bildschirmtyp": "VA",
        "Details zu Abmessungen & Gewicht": "Mit Standfu\u00df (h\u00f6chste Position) - Breite: 119.4 cm - Tiefe: 30.3 cm - H\u00f6he: 56.8 cm - Gewicht: 15.3 kg  Ohne Fu\u00df - Breite: 119.4 cm - Tiefe: 15.6 cm - H\u00f6he: 36.9 cm - Gewicht: 11 kg",
        "Diagonalabmessung": "124.5 cm (49\")",
        "Display-Typ": "LED-hintergrundbeleuchteter LCD-Monitor / TFT-Aktivmatrix",
        "ENERGY STAR zertifiziert": "Ja",
        "ENERGY STAR-Version": "7.0",
        "Ein-/Aus-Schalter": "Ja",
        "Eingangsanschl\u00fcsse": "2xHDMI, DisplayPort, USB-C",
        "Einstellungen der Anzeigeposition": "H\u00f6he, Drehelement, neigbar",
        "Energie Effizienzklasse": "G",
        "Energieverbrauch pro Jahr": "114 kWh",
        "Enthaltene Kabel": "HDMI-Kabel  DisplayPort-Kabel  USB-Kabel Typ A auf Typ B  USB-C Kabel  USB-C auf USB-A Kabel",
        "Erforderliche Netzspannung": "Wechselstrom 120/230 V (50/60 Hz)",
        "Farbe": "Textured Black",
        "Farbunterst\u00fctzung": "16,7 Millionen Farben",
        "Ger\u00e4tetyp": "LED-hintergrundbeleuchteter LCD-Monitor - 124.5 cm (49\")",
        "Geschwungener Bildschirm": "Ja (1800R)",
        "Gewicht": "15.3 kg",
        "Helligkeit": "450 cd/m\u00b2",
        "Hintergrundbeleuchtungs-Technologie": "WLED",
        "Horizontale Bildwiederholrate": "30 - 230 kHz",
        "Horizontaler Betrachtungswinkel": "178",
        "H\u00f6heneinstellung": "130 mm",
        "Integrierte Peripherieger\u00e4te": "Mikrofon, KVM-Switch, USB 3.1 Hub, 1080p Webcam",
        "Kontrast": "3000:1 / 80000000:1 (dynamisch)",
        "Leistungsaufnahme im Betrieb": "45 Watt",
        "Leistungsaufnahme im Ein-Zustand": "78 W",
        "Leistungsmerkmale": "Slot f\u00fcr Sicherheitsschloss (Kabelschloss getrennt erh\u00e4ltlich)",
        "MTBF": "70,000 Stunde(n)",
        "Max. Betriebstemperatur": "40 \u00b0C",
        "Min Betriebstemperatur": "0 \u00b0C",
        "Mitgelieferte Software": "Philips SmartControl",
        "Native Aufl\u00f6sung": "Dual Quad HD 5120 x 1440 bei 60 Hz",
        "Neigungswinkel": "-5/+10",
        "OSD-Sprachen": "Ungarisch, Tschechisch, Chinesisch (tradionell), Ukrainisch, Brasilianisches Portugiesisch, Englisch, Deutsch, Franz\u00f6sisch, Italienisch, Polnisch, Finnisch, Russisch, Holl\u00e4ndisch, Griechisch, T\u00fcrkisch, Japanisch, Koreanisch",
        "Pixelpitch": "0.233 mm",
        "Ppi": "109",
        "Produktbeschreibung": "Philips Brilliance P-line 499P9H - LED-Monitor - gebogen - 124.5 cm (49\")",
        "Reaktionszeit": "5 ms (Gray-to-Gray)",
        "Schlosstyp zur Diebstahlsicherung": "Kensington Slot",
        "Schnittstellen": "DisplayPort (HDCP)  2 x HDMI (HDCP)  USB-C 3.1 Gen 2 Upstream (bis zu 65 W)  USB 3.1 Upstream (Typ B)  USB 3.1 Downstream mit Batterieladeger\u00e4t 1.2 (Typ A)  2 x USB 3.1 Downstream (Typ A)  Kopfh\u00f6rer  Netzwerk (RJ-45)",
        "Schwenkwinkel": "40",
        "Seitenverh\u00e4ltnis": "32:9",
        "Sichtbare Bildfl\u00e4che": "124 cm (48.8\")",
        "Stromverbrauch (Aus-Modus)": "0 Watt",
        "Stromverbrauch im Standby-Modus": "0.3 Watt",
        "Transportbreite": "130.8 cm",
        "Transportgewicht": "21.48 kg",
        "Transporth\u00f6he": "55.3 cm",
        "Transporttiefe": "38.4 cm",
        "Typ": "Lautsprecher - Stereo",
        "Umweltschutzstandards": "ENERGY STAR-qualifiziert",
        "VESA-Halterung": "100 x 100 mm",
        "Vertikale Bildwiederholrate": "48 - 70 Hz",
        "Vertikaler Betrachtungswinkel": "178",
        "Zul\u00e4ssige Luftfeuchtigkeit im Betrieb": "20 - 80%"
    },
    "raw_specifications_text": "Produktbeschreibung: Philips Brilliance P-line 499P9H - LED-Monitor - gebogen - 124.5 cm (49\")\nGer\u00e4tetyp: LED-hintergrundbeleuchteter LCD-Monitor - 124.5 cm (49\")\nEnergie Effizienzklasse: G\nEnergieverbrauch pro Jahr: 114 kWh\nLeistungsaufnahme im Ein-Zustand: 78 W\nGeschwungener Bildschirm: Ja (1800R)\nLeistungsmerkmale: Slot f\u00fcr Sicherheitsschloss (Kabelschloss getrennt erh\u00e4ltlich)\nBildschirmtyp: VA\nSeitenverh\u00e4ltnis: 32:9\nNative Aufl\u00f6sung: Dual Quad HD 5120 x 1440 bei 60 Hz\nPixelpitch: 0.233 mm\nHelligkeit: 450 cd/m\u00b2\nKontrast: 3000:1 / 80000000:1 (dynamisch)\nReaktionszeit: 5 ms (Gray-to-Gray)\nFarbunterst\u00fctzung: 16,7 Millionen Farben\nEingangsanschl\u00fcsse: 2xHDMI, DisplayPort, USB-C\nEinstellungen der Anzeigeposition: H\u00f6he, Drehelement, neigbar\nBildschirmbeschichtung: Blendfrei, 2H Hard Coating, Haze 25 %\nFarbe: Textured Black\nAbmessungen (Breite x Tiefe x H\u00f6he) - mit Fu\u00df: 119.4 cm x 30.3 cm x 56.8 cm\nGewicht: 15.3 kg\nUmweltschutzstandards: ENERGY STAR-qualifiziert\nDisplay-Typ: LED-hintergrundbeleuchteter LCD-Monitor / TFT-Aktivmatrix\nDiagonalabmessung: 124.5 cm (49\")\nSichtbare Bildfl\u00e4che: 124 cm (48.8\")\nIntegrierte Peripherieger\u00e4te: Mikrofon, KVM-Switch, USB 3.1 Hub, 1080p Webcam\nPpi: 109\nVertikale Bildwiederholrate: 48 - 70 Hz\nHorizontale Bildwiederholrate: 30 - 230 kHz\nHorizontaler Betrachtungswinkel: 178\nVertikaler Betrachtungswinkel: 178\nHintergrundbeleuchtungs-Technologie: WLED\nOSD-Sprachen: Ungarisch, Tschechisch, Chinesisch (tradionell), Ukrainisch, Brasilianisches Portugiesisch, Englisch, Deutsch, Franz\u00f6sisch, Italienisch, Polnisch, Finnisch, Russisch, Holl\u00e4ndisch, Griechisch, T\u00fcrkisch, Japanisch, Koreanisch\nBesonderheiten: Sync-on-Green, SmartImage, Low Blue Light Mode, flimmerfreie Technologie, BFR/PVC-frei, ohne Quecksilber, SmartUniformity, Quad & Dual Windows PBP, Adaptive-Sync-Technologie, 121% sRGB-Farbskala, EasyRead, 103% NTSC-Farbskala, sRGB Mode, Picture-by-Picture, kompatibel mit HDR 400, 99.67 % BT.709 Farbumfang, DCI-P3 94.62 % Farbraum, 91% Adobe RGB-Farbskala, Windows 10 Hello\nAbmessungen (Breite x Tiefe x H\u00f6he): 119.4 cm x 30.3 cm x 56.8 cm - mit Fu\u00df\nTyp: Lautsprecher - Stereo\nAusgangsleistung/Kanal: 5 Watt\nSchnittstellen: DisplayPort (HDCP)  2 x HDMI (HDCP)  USB-C 3.1 Gen 2 Upstream (bis zu 65 W)  USB 3.1 Upstream (Typ B)  USB 3.1 Downstream mit Batterieladeger\u00e4t 1.2 (Typ A)  2 x USB 3.1 Downstream (Typ A)  Kopfh\u00f6rer  Netzwerk (RJ-45)\nNeigungswinkel: -5/+10\nSchwenkwinkel: 40\nH\u00f6heneinstellung: 130 mm\nVESA-Halterung: 100 x 100 mm\nEnthaltene Kabel: HDMI-Kabel  DisplayPort-Kabel  USB-Kabel Typ A auf Typ B  USB-C Kabel  USB-C auf USB-A Kabel\nMTBF: 70,000 Stunde(n)\nSchlosstyp zur Diebstahlsicherung: Kensington Slot\nErforderliche Netzspannung: Wechselstrom 120/230 V (50/60 Hz)\nLeistungsaufnahme im Betrieb: 45 Watt\nStromverbrauch im Standby-Modus: 0.3 Watt\nStromverbrauch (Aus-Modus): 0 Watt\nEin-/Aus-Schalter: Ja\nMitgelieferte Software: Philips SmartControl\nDetails zu Abmessungen & Gewicht: Mit Standfu\u00df (h\u00f6chste Position) - Breite: 119.4 cm - Tiefe: 30.3 cm - H\u00f6he: 56.8 cm - Gewicht: 15.3 kg  Ohne Fu\u00df - Breite: 119.4 cm - Tiefe: 15.6 cm - H\u00f6he: 36.9 cm - Gewicht: 11 kg\nTransportbreite: 130.8 cm\nTransporttiefe: 38.4 cm\nTransporth\u00f6he: 55.3 cm\nTransportgewicht: 21.48 kg\nENERGY STAR zertifiziert: Ja\nENERGY STAR-Version: 7.0\nMin Betriebstemperatur: 0 \u00b0C\nMax. Betriebstemperatur: 40 \u00b0C\nZul\u00e4ssige Luftfeuchtigkeit im Betrieb: 20 - 80%",
    "reference_file": "offer_reference_2192.json",
    "shop_name": "Jacob Elektronik direkt (AT)"
}