{
    "html_file": "offer_1121_0.html",
    "name": "Samsung S4U, 24\"",
    "offer_link": "https://www.proshop.at/Bildschirm/Samsung-24-Bildschirm-S24A400UJU-1920x1080-75Hz-IPS-USB-C-Black-5-ms-AMD-FreeSync/3023108?utm_source=geizhals&utm_medium=cpc&utm_campaign=pricesite",
    "price": 144.58,
    "raw_specifications": {
        "Abmessungen (Breite x Tiefe x H\u00f6he)": "54.45 cm x 18.29 cm x 51.14 cm - mit Fu\u00df",
        "Abmessungen (Breite x Tiefe x H\u00f6he) - mit Fu\u00df": "54.45 cm x 18.29 cm x 51.14 cm",
        "Adaptive-Sync Technologie": "AMD FreeSync",
        "Besonderheiten": "Spielmodus, Mega Dynamic Contrast Ratio, flimmerfreie Technologie, Image Size, Eco Saving Plus, Eye Saver Mode, Off Timer Plus, 3 Side Borderless Design, Auto Source Switch",
        "Bildschirmtyp": "IPS",
        "Details zu Abmessungen & Gewicht": "Mit Fu\u00df - Breite: 54.45 cm - Tiefe: 18.29 cm - H\u00f6he: 51.14 cm - Gewicht: 5.2 kg  Ohne Fu\u00df - Breite: 54.45 cm - Tiefe: 4.24 cm - H\u00f6he: 32.48 cm - Gewicht: 3.4 kg",
        "Diagonalabmessung": "61 cm (24\")",
        "Display-Typ": "LED-hintergrundbeleuchteter LCD-Monitor / TFT-Aktivmatrix",
        "EAN": "8806092733831",
        "ENERGY STAR zertifiziert": "Ja",
        "Eingangsanschl\u00fcsse": "HDMI, DisplayPort, USB-C",
        "Eingangsspannung": "Wechselstrom 100-240 V",
        "Einstellungen der Anzeigeposition": "H\u00f6he, Pivot (Rotation), Drehung, Neigung",
        "Energie Effizienzklasse": "Klasse E",
        "Energieverbrauch pro Jahr": "22 kWh",
        "Enthaltene Kabel": "1 x HDMI-Kabel  1 x USB-C Kabel",
        "Farbe": "Schwarz",
        "Farbraum": "72%",
        "Farbunterst\u00fctzung": "16,7 Millionen Farben",
        "Ger\u00e4tetyp": "LED-hintergrundbeleuchteter LCD-Monitor - 61 cm (24\")",
        "Gewicht": "5.2 kg",
        "Helligkeit": "250 cd/m\u00b2",
        "Hersteller": "Samsung",
        "Hintergrundbeleuchtungs-Technologie": "LED-Hintergrundbeleuchtung",
        "Horizontaler Betrachtungswinkel": "178",
        "H\u00f6heneinstellung": "135 mm",
        "Integrierte Peripherieger\u00e4te": "USB 3.0/USB-C Hub",
        "Kontrast": "1000:1",
        "Leistungsmerkmale": "Slot f\u00fcr Sicherheitsschloss (Kabelschloss getrennt erh\u00e4ltlich)",
        "Modell": "LS24A400UJUXEN",
        "Native Aufl\u00f6sung": "Full HD (1080p) 1920 x 1080 bei 75 Hz",
        "Neigungswinkel": "-4/+24",
        "Produktbeschreibung": "Samsung S24A400UJU - S4U Series - LED-Monitor - Full HD (1080p) - 61 cm (24\")",
        "Reaktionszeit": "5 ms (Gray-to-Gray)",
        "Rotationswinkel": "-2/+92",
        "Schlosstyp zur Diebstahlsicherung": "Kensington Slot",
        "Schnittstellen": "DisplayPort 1.2  HDMI  Kopfh\u00f6rer  2 x USB 2.0  2 x USB 3.0  USB-C (bis zu 65 W)",
        "Schwenkwinkel": "90",
        "Seitenverh\u00e4ltnis": "16:9",
        "Spannung": "Wechselstrom 100-240 V",
        "Stromverbrauch (Aus-Modus)": "0.3 Watt",
        "Stromverbrauch (max.)": "117 Watt",
        "Stromverbrauch (typisch)": "15 Watt",
        "Stromverbrauch SDR (eingeschaltet)": "15 kWh/1.000 h",
        "Stromverbrauch im Standby-Modus": "0.5 Watt",
        "TCO-zertifiziert": "TCO Certified Displays 8",
        "Transportbreite": "61 cm",
        "Transportgewicht": "6.7 kg",
        "Transporth\u00f6he": "21.5 cm",
        "Transporttiefe": "39 cm",
        "USB-Spannungsversorgung": "65 Watt",
        "Umweltschutzstandards": "TCO Certified Displays 8, ENERGY STAR-qualifiziert",
        "VESA-Halterung": "100 x 100 mm",
        "Vertikaler Betrachtungswinkel": "178",
        "Waren-Nr.": "3023108",
        "Zum Hersteller": "www.samsung.com"
    },
    "raw_specifications_text": "Hersteller: Samsung\nWaren-Nr.: 3023108\nModell: LS24A400UJUXEN\nEAN: 8806092733831\nZum Hersteller: www.samsung.com\nProduktbeschreibung: Samsung S24A400UJU - S4U Series - LED-Monitor - Full HD (1080p) - 61 cm (24\")\nGer\u00e4tetyp: LED-hintergrundbeleuchteter LCD-Monitor - 61 cm (24\")\nEnergie Effizienzklasse: Klasse E\nEnergieverbrauch pro Jahr: 22 kWh\nAdaptive-Sync Technologie: AMD FreeSync\nLeistungsmerkmale: Slot f\u00fcr Sicherheitsschloss (Kabelschloss getrennt erh\u00e4ltlich)\nBildschirmtyp: IPS\nSeitenverh\u00e4ltnis: 16:9\nNative Aufl\u00f6sung: Full HD (1080p) 1920 x 1080 bei 75 Hz\nHelligkeit: 250 cd/m\u00b2\nKontrast: 1000:1\nReaktionszeit: 5 ms (Gray-to-Gray)\nFarbunterst\u00fctzung: 16,7 Millionen Farben\nFarbraum: 72%\nEingangsanschl\u00fcsse: HDMI, DisplayPort, USB-C\nEinstellungen der Anzeigeposition: H\u00f6he, Pivot (Rotation), Drehung, Neigung\nSpannung: Wechselstrom 100-240 V\nFarbe: Schwarz\nAbmessungen (Breite x Tiefe x H\u00f6he) - mit Fu\u00df: 54.45 cm x 18.29 cm x 51.14 cm\nGewicht: 5.2 kg\nUmweltschutzstandards: TCO Certified Displays 8, ENERGY STAR-qualifiziert\nDisplay-Typ: LED-hintergrundbeleuchteter LCD-Monitor / TFT-Aktivmatrix\nDiagonalabmessung: 61 cm (24\")\nIntegrierte Peripherieger\u00e4te: USB 3.0/USB-C Hub\nUSB-Spannungsversorgung: 65 Watt\nHorizontaler Betrachtungswinkel: 178\nVertikaler Betrachtungswinkel: 178\nHintergrundbeleuchtungs-Technologie: LED-Hintergrundbeleuchtung\nBesonderheiten: Spielmodus, Mega Dynamic Contrast Ratio, flimmerfreie Technologie, Image Size, Eco Saving Plus, Eye Saver Mode, Off Timer Plus, 3 Side Borderless Design, Auto Source Switch\nAbmessungen (Breite x Tiefe x H\u00f6he): 54.45 cm x 18.29 cm x 51.14 cm - mit Fu\u00df\nSchnittstellen: DisplayPort 1.2  HDMI  Kopfh\u00f6rer  2 x USB 2.0  2 x USB 3.0  USB-C (bis zu 65 W)\nNeigungswinkel: -4/+24\nSchwenkwinkel: 90\nRotationswinkel: -2/+92\nH\u00f6heneinstellung: 135 mm\nVESA-Halterung: 100 x 100 mm\nEnthaltene Kabel: 1 x HDMI-Kabel  1 x USB-C Kabel\nSchlosstyp zur Diebstahlsicherung: Kensington Slot\nEingangsspannung: Wechselstrom 100-240 V\nStromverbrauch SDR (eingeschaltet): 15 kWh/1.000 h\nStromverbrauch (typisch): 15 Watt\nStromverbrauch (max.): 117 Watt\nStromverbrauch im Standby-Modus: 0.5 Watt\nStromverbrauch (Aus-Modus): 0.3 Watt\nDetails zu Abmessungen & Gewicht: Mit Fu\u00df - Breite: 54.45 cm - Tiefe: 18.29 cm - H\u00f6he: 51.14 cm - Gewicht: 5.2 kg  Ohne Fu\u00df - Breite: 54.45 cm - Tiefe: 4.24 cm - H\u00f6he: 32.48 cm - Gewicht: 3.4 kg\nTransportbreite: 61 cm\nTransporttiefe: 39 cm\nTransporth\u00f6he: 21.5 cm\nTransportgewicht: 6.7 kg\nTCO-zertifiziert: TCO Certified Displays 8\nENERGY STAR zertifiziert: Ja",
    "reference_file": "offer_reference_1121.json",
    "shop_name": "Proshop.at"
}