{
    "html_file": "offer_1168_15.html",
    "name": "BenQ GW2785TC, 27\"",
    "offer_link": "https://syswork.at/sw/index.html?open&mid=Artikel&artid=mon-1276&from=geizhals.at",
    "price": 241.0,
    "raw_specifications": {
        "AC Eingangsspannung": "100 - 240 V",
        "AMD FreeSync": "Nein",
        "Anzahl DisplayPort Anschl\u00fcsse": "1",
        "Anzahl HDMI-Anschl\u00fcsse": "1",
        "Anzahl OSD-Sprachen": "18",
        "Anzahl VGA (D-Sub) Anschl\u00fcsse": "1",
        "Anzahl der Farben des Displays": "16,7 Millionen Farben",
        "Anzahl der Lautsprecher": "2",
        "Anzahl der nachgeschalteten Ports vom Typ USB-C": "1",
        "Audioanschl\u00fcsse": "Ja",
        "Bildschirmdiagonale": "68,6 cm (27 Zoll)",
        "Bildschirmdiagonale (cm)": "68,6 cm",
        "Bildschirmform": "Flach",
        "Bildschirmtechnologie": "LED",
        "Bildwinkel, horizontal": "178\u00b0",
        "Bildwinkel, vertikal": "178\u00b0",
        "Blendfreier Bildschirm": "Ja",
        "Breite (ohne Standfu\u00df)": "61,2 cm",
        "Datenblatt": "Kein Datenblatt verf\u00fcgbar",
        "Display-Aufl\u00f6sung": "1920 x 1080 Pixel",
        "DisplayPorts-Version": "1.2",
        "Eingebaute Lautsprecher": "Ja",
        "Energieeffizienzklasse (SDR)": "F",
        "Energieverbrauch (SDR) pro 1.000 Stunden": "22 kWh",
        "Farbskala": "72%",
        "Flimmerfreie Technologie": "Ja",
        "Fu\u00dffarbe": "Schwarz",
        "Ger\u00e4tebreite (inkl. Fu\u00df)": "612 mm",
        "Ger\u00e4teh\u00f6he (inkl. Fu\u00df)": "430 mm",
        "Ger\u00e4tetiefe (inkl. Fu\u00df)": "239 mm",
        "Gewicht (mit St\u00e4nder)": "6,6 kg",
        "HD-Typ": "Full HD",
        "HDCP": "Ja",
        "HDMI": "Ja",
        "HDMI-Version": "1.4",
        "Helligkeit (typisch)": "250 cd/m\u00b2",
        "Herstellerlink": "BenQ",
        "H\u00f6he (ohne Standfu\u00df)": "37,2 cm",
        "H\u00f6heneinstellung": "14 cm",
        "H\u00f6henverstellung": "Ja",
        "Integrierte Kamera": "Nein",
        "Integrierter USB-Hub": "Ja",
        "Kabelsperre-Slot": "Ja",
        "Kompatible Betriebssysteme": "Windows 10, Windows 8.1, Windows 8, Windows 7",
        "Kontrastverh\u00e4ltnis": "1000:1",
        "Kontrastverh\u00e4ltnis (dynamisch)": "20000000:1",
        "Kopfh\u00f6rerausgang": "Ja",
        "Kopfh\u00f6rerausg\u00e4nge": "1",
        "Low-Blue-Light-Technologie": "Ja",
        "Marktpositionierung": "Haus",
        "Maximale Bildwiederholrate": "75 Hz",
        "Men\u00fcsprachen": "Arabisch, Vereinfachtes Chinesisch, Traditionelles Chinesisch, Tschechisch, Deutsch, Niederl\u00e4ndisch, Englisch, Spanisch, Franz\u00f6sisch, Ungarisch, Italienisch, Japanisch, Koreanisch, Polnisch, Portugiesisch, Rum\u00e4nisch, Russisch, Schwedisch",
        "Mitgelieferte Kabel": "AC, HDMI",
        "NVIDIA G-SYNC": "Nein",
        "Nachhaltigkeitszertifikate": "ENERGY STAR, EPEAT Bronze, TCO",
        "Natives Seitenverh\u00e4ltnis": "16:9",
        "Neigungswinkelbereich": "-5 - 35\u00b0",
        "On-Screen-Display (OSD)": "Ja",
        "Paketgewicht": "8,7 kg",
        "Panel-Montage-Schnittstelle": "100 x 100 mm",
        "Panel-Typ": "IPS",
        "Pivot Winkel": "0 - 90\u00b0",
        "Pixeldichte": "82 ppi",
        "Produktfarbe": "Schwarz",
        "Produktlink": "Link",
        "RGB-Farbraum": "NTSC",
        "RMS-Leistung": "4 W",
        "Reaktionszeit": "5 ms",
        "Schnellstart\u00fcbersicht": "Ja",
        "Schwenkwinkelbereich": "-175 - 175\u00b0",
        "Slot-Typ Kabelsperre": "Kensington",
        "Stromverbrauch (PowerSave)": "18 W",
        "Stromverbrauch (Standardbetrieb)": "32 W",
        "Stromverbrauch (Standby)": "0,3 W",
        "Stromverbrauch (aus)": "0,2 W",
        "St\u00e4nder enthalten": "Ja",
        "Tiefe (ohne Standfu\u00df)": "5,61 cm",
        "Touchscreen": "Nein",
        "Typ der Hintergrundbeleuchtung": "LED",
        "USB-Stromversorgung bis zu": "60 W",
        "VESA-Halterung": "Ja",
        "Warentarifnummer (HS)": "85285210"
    },
    "raw_specifications_text": "Bildschirmdiagonale: 68,6 cm (27 Zoll)\nDisplay-Aufl\u00f6sung: 1920 x 1080 Pixel\nNatives Seitenverh\u00e4ltnis: 16:9\nBildschirmtechnologie: LED\nTouchscreen: Nein\nHD-Typ: Full HD\nPanel-Typ: IPS\nBildschirmform: Flach\nKontrastverh\u00e4ltnis: 1000:1\nMaximale Bildwiederholrate: 75 Hz\nAnzahl der Farben des Displays: 16,7 Millionen Farben\nTyp der Hintergrundbeleuchtung: LED\nHelligkeit (typisch): 250 cd/m\u00b2\nReaktionszeit: 5 ms\nBlendfreier Bildschirm: Ja\nKontrastverh\u00e4ltnis (dynamisch): 20000000:1\nBildwinkel, horizontal: 178\u00b0\nBildwinkel, vertikal: 178\u00b0\nPixeldichte: 82 ppi\nBildschirmdiagonale (cm): 68,6 cm\nRGB-Farbraum: NTSC\nFarbskala: 72%\nNVIDIA G-SYNC: Nein\nAMD FreeSync: Nein\nFlimmerfreie Technologie: Ja\nLow-Blue-Light-Technologie: Ja\nKompatible Betriebssysteme: Windows 10, Windows 8.1, Windows 8, Windows 7\nEingebaute Lautsprecher: Ja\nIntegrierte Kamera: Nein\nAnzahl der Lautsprecher: 2\nRMS-Leistung: 4 W\nMarktpositionierung: Haus\nProduktfarbe: Schwarz\nFu\u00dffarbe: Schwarz\nIntegrierter USB-Hub: Ja\nHDMI: Ja\nKopfh\u00f6rerausgang: Ja\nAnzahl der nachgeschalteten Ports vom Typ USB-C: 1\nUSB-Stromversorgung bis zu: 60 W\nAnzahl VGA (D-Sub) Anschl\u00fcsse: 1\nAnzahl HDMI-Anschl\u00fcsse: 1\nHDMI-Version: 1.4\nAnzahl DisplayPort Anschl\u00fcsse: 1\nDisplayPorts-Version: 1.2\nAudioanschl\u00fcsse: Ja\nKopfh\u00f6rerausg\u00e4nge: 1\nHDCP: Ja\nVESA-Halterung: Ja\nKabelsperre-Slot: Ja\nH\u00f6henverstellung: Ja\nPanel-Montage-Schnittstelle: 100 x 100 mm\nSlot-Typ Kabelsperre: Kensington\nH\u00f6heneinstellung: 14 cm\nPivot Winkel: 0 - 90\u00b0\nSchwenkwinkelbereich: -175 - 175\u00b0\nNeigungswinkelbereich: -5 - 35\u00b0\nOn-Screen-Display (OSD): Ja\nMen\u00fcsprachen: Arabisch, Vereinfachtes Chinesisch, Traditionelles Chinesisch, Tschechisch, Deutsch, Niederl\u00e4ndisch, Englisch, Spanisch, Franz\u00f6sisch, Ungarisch, Italienisch, Japanisch, Koreanisch, Polnisch, Portugiesisch, Rum\u00e4nisch, Russisch, Schwedisch\nAnzahl OSD-Sprachen: 18\nEnergieeffizienzklasse (SDR): F\nEnergieverbrauch (SDR) pro 1.000 Stunden: 22 kWh\nStromverbrauch (Standardbetrieb): 32 W\nStromverbrauch (Standby): 0,3 W\nStromverbrauch (aus): 0,2 W\nStromverbrauch (PowerSave): 18 W\nAC Eingangsspannung: 100 - 240 V\nSt\u00e4nder enthalten: Ja\nMitgelieferte Kabel: AC, HDMI\nSchnellstart\u00fcbersicht: Ja\nGer\u00e4tebreite (inkl. Fu\u00df): 612 mm\nGer\u00e4tetiefe (inkl. Fu\u00df): 239 mm\nGer\u00e4teh\u00f6he (inkl. Fu\u00df): 430 mm\nGewicht (mit St\u00e4nder): 6,6 kg\nBreite (ohne Standfu\u00df): 61,2 cm\nTiefe (ohne Standfu\u00df): 5,61 cm\nH\u00f6he (ohne Standfu\u00df): 37,2 cm\nPaketgewicht: 8,7 kg\nNachhaltigkeitszertifikate: ENERGY STAR, EPEAT Bronze, TCO\nWarentarifnummer (HS): 85285210\nDatenblatt: Kein Datenblatt verf\u00fcgbar\nProduktlink: Link\nHerstellerlink: BenQ",
    "reference_file": "offer_reference_1168.json",
    "shop_name": "Syswork"
}