{
    "html_file": "offer_551_15.html",
    "name": "HP Z32k G3, 31.5\"",
    "offer_link": "https://www.mylemon.at/artikel/hewlett_packard/50u19aa_abb/hp-z32k-g3-4k-usb.html",
    "price": 909.27,
    "raw_specifications": {
        "AC Eingangsfrequenz": "50 - 60 Hz",
        "AC Eingangsspannung": "100 - 240 V",
        "AMD FreeSync": "Nein",
        "Abnehmbarer Standfu\u00df": "Ja",
        "Anzahl DisplayPort Anschl\u00fcsse": "2",
        "Anzahl Ethernet-LAN-Anschl\u00fcsse (RJ-45)": "1",
        "Anzahl HDMI-Anschl\u00fcsse": "1",
        "Anzahl OSD-Sprachen": "11",
        "Anzahl Thunderbolt 4-Ports": "1",
        "Anzahl der Farben des Displays": "1,07 Milliarden Farben",
        "Anzahl der Upstream-Ports USB Typ-B": "1",
        "Anzahl der nachgeschalteten Steckpl\u00e4tze vom Typ USB-A": "4",
        "Anzahl der vorgeschalteten Steckpl\u00e4tze": "2",
        "Artikelnummer": "M1EYL78L",
        "Aufl\u00f6sung": "3840x2160",
        "Betriebstemperatur": "5 - 35 \u00b0C",
        "Bildschirmdiagonale": "80 cm (31.5\")",
        "Bildschirmform": "Flach",
        "Bildschirmtechnologie": "LCD",
        "Bildwinkel, horizontal": "178\u00b0",
        "Bildwinkel, vertikal": "178\u00b0",
        "Blendfreier Bildschirm": "Ja",
        "Breite (ohne Standfu\u00df)": "713,5 mm",
        "Display-Aufl\u00f6sung": "3840 x 2160 Pixel",
        "DisplayPorts-Version": "1.4",
        "Displaygr\u00f6\u00dfe": "31,5 Zoll",
        "Displayrahmen-Technologie": "Micro-Edge",
        "EAN": "196188669341",
        "Eingebaute Lautsprecher": "Nein",
        "Eingebauter Ethernet-Anschluss": "Ja",
        "Energieeffizienzklasse (HDR)": "G",
        "Energieeffizienzklasse (SDR)": "G",
        "Energieeffizienzskala": "A bis G",
        "Energieverbrauch (HDR) pro 1.000 Stunden": "45 kWh",
        "Energieverbrauch (SDR) pro 1.000 Stunden": "33 kWh",
        "Ergonomie": "Pivot (90 Grad drehbar)",
        "Ethernet LAN Datentransferraten": "10,100,1000 Mbit/s",
        "Farbpalette DCI-P3": "98%",
        "Farbtiefe": "10 Bit",
        "Flimmerfreie Technologie": "Ja",
        "Ger\u00e4tebreite (inkl. Fu\u00df)": "713,5 mm",
        "Ger\u00e4teh\u00f6he (inkl. Fu\u00df)": "604,9 mm",
        "Ger\u00e4tetiefe (inkl. Fu\u00df)": "217 mm",
        "Gewicht (mit St\u00e4nder)": "9 kg",
        "HD-Typ": "4K Ultra HD",
        "HDMI": "Ja",
        "HDMI-Version": "2.0",
        "HP-Segment": "Business",
        "Helligkeit": "400 cd/m\u00b2",
        "Helligkeit (typisch)": "400 cd/m\u00b2",
        "Hersteller Artikelnummer": "50U19AA#ABB",
        "Horizontaler Scanbereich": "30 - 135 kHz",
        "H\u00f6he (ohne Standfu\u00df)": "415,9 mm",
        "H\u00f6heneinstellung": "15 cm",
        "H\u00f6henverstellung": "Ja",
        "Integrierte Kamera": "Nein",
        "Integrierter USB-Hub": "Ja",
        "Jahr der Einf\u00fchrung": "2022",
        "Kabelsperre-Slot": "Ja",
        "Kontrastverh\u00e4ltnis": "2000:1",
        "Kontrastverh\u00e4ltnis (dynamisch)": "10000000:1",
        "Kopfh\u00f6rerausgang": "Nein",
        "Low-Blue-Light-Technologie": "Ja",
        "Luftfeuchtigkeit bei Lagerung": "5 - 95%",
        "Marktpositionierung": "Business",
        "Maximale Bildwiederholrate": "60 Hz",
        "Men\u00fcsprachen": "Vereinfachtes Chinesisch, Traditionelles Chinesisch, Deutsch, Niederl\u00e4ndisch, Englisch, Spanisch, Franz\u00f6sisch, Italienisch, Japanisch, Portugiesisch, Russisch",
        "Mitgelieferte Kabel": "AC, DisplayPort, HDMI, Thunderbolt, USB Typ-A auf USB Typ-B",
        "NVIDIA G-SYNC": "Nein",
        "Nachhaltigkeitszertifikate": "ENERGY STAR",
        "Natives Seitenverh\u00e4ltnis": "16:9",
        "Neigungsverstellung": "Ja",
        "Oberfl\u00e4chenh\u00e4rte": "3H",
        "On-Screen-Display (OSD)": "Ja",
        "Paketgewicht": "13,7 kg",
        "Panel": "IPS",
        "Panel-Montage-Schnittstelle": "100 x 100 mm",
        "Panel-Typ": "IPS",
        "Pivot": "Ja",
        "Pivot Winkel": "-90 - 90\u00b0",
        "Pixel Abstand": "0,18 x 0,18 mm",
        "Pixeldichte": "140 ppi",
        "Produktfarbe": "Schwarz, Silber",
        "Reaktionszeit": "5 ms",
        "Relative Luftfeuchtigkeit in Betrieb": "20 - 80%",
        "Schwenkbar": "Ja",
        "Schwenkwinkelbereich": "-45 - 45\u00b0",
        "Stromverbrauch (Standardbetrieb)": "35 W",
        "Stromverbrauch (Standby)": "0,5 W",
        "Stromverbrauch (max.)": "180 W",
        "Tiefe (ohne Standfu\u00df)": "47 mm",
        "Touchscreen": "Nein",
        "Typ der Hintergrundbeleuchtung": "Seiten-LED",
        "USB Power Delivery": "Ja",
        "USB-Hub-Version": "3.2 Gen 1 (3.1 Gen 1)",
        "USB-Stromversorgung bis zu": "100 W",
        "USB-Typ-C DisplayPort-Wechselmodus": "Ja",
        "USB-Upstream-Porttyp": "USB Typ-B, USB Typ-C",
        "Unterst\u00fctzte Grafik-Aufl\u00f6sungen": "640 x 480 (VGA), 720 x 400, 800 x 600 (SVGA), 1024 x 768 (XGA), 1280 x 1024 (SXGA), 1280 x 720 (HD 720), 1280 x 800 (WXGA), 1440 x 900 (WXGA+), 1600 x 900, 1680 x 1050 (WSXGA+), 1920 x 1080 (HD 1080), 1920 x 1200 (WUXGA), 2560 x 1440, 3840 x 2160",
        "VESA-Halterung": "Ja",
        "Vertikaler Scanbereich": "29 - 60 Hz",
        "Video Anschl\u00fcsse": "1x HDMI, 1x DisplayPort",
        "sRGB Abdeckung (klassisch)": "100%"
    },
    "raw_specifications_text": "Displaygr\u00f6\u00dfe: 31,5 Zoll\nAufl\u00f6sung: 3840x2160\nPanel: IPS\nReaktionszeit: 5 ms\nVideo Anschl\u00fcsse: 1x HDMI, 1x DisplayPort\nErgonomie: Pivot (90 Grad drehbar)\nHelligkeit: 400 cd/m\u00b2\nHersteller Artikelnummer: 50U19AA#ABB\nEAN: 196188669341\nArtikelnummer: M1EYL78L\nBildschirmdiagonale: 80 cm (31.5\")\nDisplay-Aufl\u00f6sung: 3840 x 2160 Pixel\nNatives Seitenverh\u00e4ltnis: 16:9\nBildschirmtechnologie: LCD\nTouchscreen: Nein\nHD-Typ: 4K Ultra HD\nPanel-Typ: IPS\nBildschirmform: Flach\nKontrastverh\u00e4ltnis: 2000:1\nMaximale Bildwiederholrate: 60 Hz\nAnzahl der Farben des Displays: 1,07 Milliarden Farben\nTyp der Hintergrundbeleuchtung: Seiten-LED\nHelligkeit (typisch): 400 cd/m\u00b2\nBlendfreier Bildschirm: Ja\nUnterst\u00fctzte Grafik-Aufl\u00f6sungen: 640 x 480 (VGA), 720 x 400, 800 x 600 (SVGA), 1024 x 768 (XGA), 1280 x 1024 (SXGA), 1280 x 720 (HD 720), 1280 x 800 (WXGA), 1440 x 900 (WXGA+), 1600 x 900, 1680 x 1050 (WSXGA+), 1920 x 1080 (HD 1080), 1920 x 1200 (WUXGA), 2560 x 1440, 3840 x 2160\nKontrastverh\u00e4ltnis (dynamisch): 10000000:1\nBildwinkel, horizontal: 178\u00b0\nBildwinkel, vertikal: 178\u00b0\nPixel Abstand: 0,18 x 0,18 mm\nPixeldichte: 140 ppi\nHorizontaler Scanbereich: 30 - 135 kHz\nVertikaler Scanbereich: 29 - 60 Hz\nOberfl\u00e4chenh\u00e4rte: 3H\nFarbtiefe: 10 Bit\nsRGB Abdeckung (klassisch): 100%\nDisplayrahmen-Technologie: Micro-Edge\nNVIDIA G-SYNC: Nein\nAMD FreeSync: Nein\nFlimmerfreie Technologie: Ja\nLow-Blue-Light-Technologie: Ja\nHP-Segment: Business\nEingebaute Lautsprecher: Nein\nIntegrierte Kamera: Nein\nMarktpositionierung: Business\nProduktfarbe: Schwarz, Silber\nAbnehmbarer Standfu\u00df: Ja\nJahr der Einf\u00fchrung: 2022\nIntegrierter USB-Hub: Ja\nHDMI: Ja\nKopfh\u00f6rerausgang: Nein\nUSB-Hub-Version: 3.2 Gen 1 (3.1 Gen 1)\nUSB-Upstream-Porttyp: USB Typ-B, USB Typ-C\nAnzahl der vorgeschalteten Steckpl\u00e4tze: 2\nAnzahl der Upstream-Ports USB Typ-B: 1\nAnzahl der nachgeschalteten Steckpl\u00e4tze vom Typ USB-A: 4\nUSB-Typ-C DisplayPort-Wechselmodus: Ja\nUSB Power Delivery: Ja\nUSB-Stromversorgung bis zu: 100 W\nAnzahl HDMI-Anschl\u00fcsse: 1\nHDMI-Version: 2.0\nAnzahl DisplayPort Anschl\u00fcsse: 2\nDisplayPorts-Version: 1.4\nAnzahl Thunderbolt 4-Ports: 1\nEingebauter Ethernet-Anschluss: Ja\nVESA-Halterung: Ja\nKabelsperre-Slot: Ja\nH\u00f6henverstellung: Ja\nPanel-Montage-Schnittstelle: 100 x 100 mm\nH\u00f6heneinstellung: 15 cm\nPivot: Ja\nPivot Winkel: -90 - 90\u00b0\nSchwenkbar: Ja\nSchwenkwinkelbereich: -45 - 45\u00b0\nOn-Screen-Display (OSD): Ja\nMen\u00fcsprachen: Vereinfachtes Chinesisch, Traditionelles Chinesisch, Deutsch, Niederl\u00e4ndisch, Englisch, Spanisch, Franz\u00f6sisch, Italienisch, Japanisch, Portugiesisch, Russisch\nAnzahl OSD-Sprachen: 11\nNeigungsverstellung: Ja\nEnergieeffizienzklasse (SDR): G\nEnergieeffizienzklasse (HDR): G\nEnergieverbrauch (SDR) pro 1.000 Stunden: 33 kWh\nEnergieverbrauch (HDR) pro 1.000 Stunden: 45 kWh\nStromverbrauch (Standardbetrieb): 35 W\nStromverbrauch (Standby): 0,5 W\nStromverbrauch (max.): 180 W\nAC Eingangsspannung: 100 - 240 V\nAC Eingangsfrequenz: 50 - 60 Hz\nEnergieeffizienzskala: A bis G\nBetriebstemperatur: 5 - 35 \u00b0C\nRelative Luftfeuchtigkeit in Betrieb: 20 - 80%\nLuftfeuchtigkeit bei Lagerung: 5 - 95%\nMitgelieferte Kabel: AC, DisplayPort, HDMI, Thunderbolt, USB Typ-A auf USB Typ-B\nGer\u00e4tebreite (inkl. Fu\u00df): 713,5 mm\nGer\u00e4tetiefe (inkl. Fu\u00df): 217 mm\nGer\u00e4teh\u00f6he (inkl. Fu\u00df): 604,9 mm\nGewicht (mit St\u00e4nder): 9 kg\nBreite (ohne Standfu\u00df): 713,5 mm\nTiefe (ohne Standfu\u00df): 47 mm\nH\u00f6he (ohne Standfu\u00df): 415,9 mm\nPaketgewicht: 13,7 kg\nNachhaltigkeitszertifikate: ENERGY STAR\nFarbpalette DCI-P3: 98%\nEthernet LAN Datentransferraten: 10,100,1000 Mbit/s\nAnzahl Ethernet-LAN-Anschl\u00fcsse (RJ-45): 1",
    "reference_file": "offer_reference_551.json",
    "shop_name": "mylemon.at"
}