{
    "html_file": "offer_1360_0.html",
    "name": "Dell P3222QE, 31.5\"",
    "offer_link": "https://www.taufnaus.de/product/10619667",
    "price": 682.91,
    "raw_specifications": {
        "Abmessungen (Breite x Tiefe x H\u00f6he)": "71.24 cm x 23.317 cm x 46.867 cm - mit Standfu\u00df (niedrigste Position)",
        "Besonderheiten": "Flimmerfreie Technologie, ohne Quecksilber, arsenfreies Glas, an 3 Seiten ohne Blende, Dell ComfortView Plus",
        "Bildschirmbeschichtung": "Blendfrei, 3H Hard Coating",
        "Bildschirmtyp": "IPS",
        "Details zu Abmessungen & Gewicht": "Mit Standfu\u00df (niedrigste Position) - Breite: 71.24 cm - Tiefe: 23.31 cm - H\u00f6he: 46.867 cm - Gewicht: 9.6 kg \u00a6 Ohne Fu\u00df - Breite: 71.24 cm - Tiefe: 5.618 cm - H\u00f6he: 41.7117 cm - Gewicht: 5.3 kg",
        "Diagonalabmessung": "81.3 cm (32\")",
        "Display-Typ": "LED-hintergrundbeleuchteter LCD-Monitor / TFT-Aktivmatrix",
        "ENERGY STAR zertifiziert": "Ja",
        "Eingangsspannung": "Wechselstrom 100-240 V (50/60 Hz)",
        "Einstellungen der Anzeigeposition": "H\u00f6he, Pivot (Rotation), Drehung, Neigung",
        "Energie Effizienzklasse": "Klasse F",
        "Energierverbrauch Sleep": "0.3 Watt",
        "Enthaltene Kabel": "1 x DisplayPort-Kabel - DisplayPort zu DisplayPort - 1.8 m \u00a6 1 x USB-C Kabel - 1 m \u00a6 1 x USB-C auf USB-A Kabel - 1.8 m",
        "Entwickelt f\u00fcr": "Dell 7560 \u00a6 Dell Latitude 5320, 5520 \u00a6 Dell OptiPlex 3090 \u00a6 Dell Vostro 14 5410, 15 5510 \u00a6 Dell XPS 13 9310",
        "Farbraum": "99% sRGB",
        "Farbunterst\u00fctzung": "1,07 Mrd. Farben",
        "Gewicht": "9.6 kg",
        "Helligkeit": "350 cd/m\u00b2",
        "Hintergrundbeleuchtungs-Technologie": "LED-Hintergrundbeleuchtung",
        "Horizontale Bildwiederholrate": "30 - 140 kHz",
        "Horizontaler Betrachtungswinkel": "178",
        "H\u00f6heneinstellung": "150 mm",
        "Integrierte Peripherieger\u00e4te": "USB 3.2 Gen 1/USB-C Hub",
        "Kennzeichnung": "RoHS, NFPA 99, BFR-frei, DisplayPort 1.4, HDCP 2.2, PVC-free",
        "Kontrast": "1000:1",
        "Leistungsaufnahme im Ein-Zustand": "28.3 W",
        "Leistungsmerkmale": "Slot f\u00fcr Sicherheitsschloss (Kabelschloss getrennt erh\u00e4ltlich), Unterst\u00fctzung f\u00fcr VESA-Schnittstelle",
        "Max. Betriebstemperatur": "40 \u00b0C",
        "Min Betriebstemperatur": "0 \u00b0C",
        "Mitgelieferte Software": "Dell Display Manager",
        "Native Aufl\u00f6sung": "4K 3840 x 2160 bei 60 Hz",
        "Neigungswinkel": "-5/+21",
        "Pixelpitch": "0.18159 mm",
        "Ppi": "139.87",
        "Reaktionszeit": "5 ms (Fast), 8 ms (normal)",
        "Rotationswinkel": "180",
        "Schlosstyp zur Diebstahlsicherung": "Kensington Slot",
        "Schnittstellen": "DisplayPort 1.4 (HDCP 2.2) \u00a6 HDMI (HDCP 2.2) \u00a6 USB-C 3.2 Gen 1 Upstream/DisplayPort 1.2 Alt Mode mit Spannungsversorgung \u00a6 4 x USB 3.2 Gen 1 Downstream \u00a6 Netzwerk (RJ-45)",
        "Schwenkwinkel": "60",
        "Seitenverh\u00e4ltnis": "16:9",
        "Services im Bundle": "3 Jahre erweiterter Austauschservice und beschr\u00e4nkte Hardware-Garantie",
        "Sichtbare Bildfl\u00e4che": "80.01 cm (31.5\")",
        "Stromverbrauch (Aus-Modus)": "0.2 Watt",
        "Stromverbrauch (max.)": "145 Watt",
        "Stromverbrauch (typisch)": "28.3 Watt",
        "Stromverbrauch SDR (eingeschaltet)": "28.3 kWh/1.000 h",
        "Stromverbrauch im Standby-Modus": "0.2 Watt",
        "TCO-zertifiziert": "TCO Certified Displays 8",
        "Transportgewicht": "13.4 kg",
        "USB-Spannungsversorgung": "65 Watt",
        "VESA-Halterung": "100 x 100 mm",
        "Vertikale Bildwiederholrate": "24 - 75 Hz",
        "Vertikaler Betrachtungswinkel": "178",
        "Zul\u00e4ssige Luftfeuchtigkeit im Betrieb": "20 - 80% (nicht kondensierend)"
    },
    "raw_specifications_text": "Display-Typ: LED-hintergrundbeleuchteter LCD-Monitor / TFT-Aktivmatrix\nEnergie Effizienzklasse: Klasse F\nDiagonalabmessung: 81.3 cm (32\")\nSichtbare Bildfl\u00e4che: 80.01 cm (31.5\")\nIntegrierte Peripherieger\u00e4te: USB 3.2 Gen 1/USB-C Hub\nUSB-Spannungsversorgung: 65 Watt\nBildschirmtyp: IPS\nSeitenverh\u00e4ltnis: 16:9\nNative Aufl\u00f6sung: 4K 3840 x 2160 bei 60 Hz\nPixelpitch: 0.18159 mm\nPpi: 139.87\nHelligkeit: 350 cd/m\u00b2\nKontrast: 1000:1\nFarbunterst\u00fctzung: 1,07 Mrd. Farben\nFarbraum: 99% sRGB\nReaktionszeit: 5 ms (Fast), 8 ms (normal)\nVertikale Bildwiederholrate: 24 - 75 Hz\nHorizontale Bildwiederholrate: 30 - 140 kHz\nHorizontaler Betrachtungswinkel: 178\nVertikaler Betrachtungswinkel: 178\nBildschirmbeschichtung: Blendfrei, 3H Hard Coating\nHintergrundbeleuchtungs-Technologie: LED-Hintergrundbeleuchtung\nBesonderheiten: Flimmerfreie Technologie, ohne Quecksilber, arsenfreies Glas, an 3 Seiten ohne Blende, Dell ComfortView Plus\nAbmessungen (Breite x Tiefe x H\u00f6he): 71.24 cm x 23.317 cm x 46.867 cm - mit Standfu\u00df (niedrigste Position)\nGewicht: 9.6 kg\nSchnittstellen: DisplayPort 1.4 (HDCP 2.2) \u00a6 HDMI (HDCP 2.2) \u00a6 USB-C 3.2 Gen 1 Upstream/DisplayPort 1.2 Alt Mode mit Spannungsversorgung \u00a6 4 x USB 3.2 Gen 1 Downstream \u00a6 Netzwerk (RJ-45)\nEinstellungen der Anzeigeposition: H\u00f6he, Pivot (Rotation), Drehung, Neigung\nNeigungswinkel: -5/+21\nSchwenkwinkel: 60\nRotationswinkel: 180\nH\u00f6heneinstellung: 150 mm\nVESA-Halterung: 100 x 100 mm\nLeistungsmerkmale: Slot f\u00fcr Sicherheitsschloss (Kabelschloss getrennt erh\u00e4ltlich), Unterst\u00fctzung f\u00fcr VESA-Schnittstelle\nEnthaltene Kabel: 1 x DisplayPort-Kabel - DisplayPort zu DisplayPort - 1.8 m \u00a6 1 x USB-C Kabel - 1 m \u00a6 1 x USB-C auf USB-A Kabel - 1.8 m\nKennzeichnung: RoHS, NFPA 99, BFR-frei, DisplayPort 1.4, HDCP 2.2, PVC-free\nSchlosstyp zur Diebstahlsicherung: Kensington Slot\nEingangsspannung: Wechselstrom 100-240 V (50/60 Hz)\nLeistungsaufnahme im Ein-Zustand: 28.3 W\nStromverbrauch SDR (eingeschaltet): 28.3 kWh/1.000 h\nStromverbrauch (typisch): 28.3 Watt\nStromverbrauch (max.): 145 Watt\nStromverbrauch im Standby-Modus: 0.2 Watt\nEnergierverbrauch Sleep: 0.3 Watt\nStromverbrauch (Aus-Modus): 0.2 Watt\nMitgelieferte Software: Dell Display Manager\nDetails zu Abmessungen & Gewicht: Mit Standfu\u00df (niedrigste Position) - Breite: 71.24 cm - Tiefe: 23.31 cm - H\u00f6he: 46.867 cm - Gewicht: 9.6 kg \u00a6 Ohne Fu\u00df - Breite: 71.24 cm - Tiefe: 5.618 cm - H\u00f6he: 41.7117 cm - Gewicht: 5.3 kg\nTransportgewicht: 13.4 kg\nTCO-zertifiziert: TCO Certified Displays 8\nENERGY STAR zertifiziert: Ja\nServices im Bundle: 3 Jahre erweiterter Austauschservice und beschr\u00e4nkte Hardware-Garantie\nMin Betriebstemperatur: 0 \u00b0C\nMax. Betriebstemperatur: 40 \u00b0C\nZul\u00e4ssige Luftfeuchtigkeit im Betrieb: 20 - 80% (nicht kondensierend)\nEntwickelt f\u00fcr: Dell 7560 \u00a6 Dell Latitude 5320, 5520 \u00a6 Dell OptiPlex 3090 \u00a6 Dell Vostro 14 5410, 15 5510 \u00a6 Dell XPS 13 9310",
    "reference_file": "offer_reference_1360.json",
    "shop_name": "TaufNaus"
}