{
    "html_file": "offer_2332_0.html",
    "name": "LG 24BK450H-B, 23.8\"",
    "offer_link": "https://www.proshop.at/Bildschirm/LG-24-Bildschirm-24BK450H-B-Black-5-ms/2657230?utm_source=geizhals&utm_medium=cpc&utm_campaign=pricesite",
    "price": 96.41,
    "raw_specifications": {
        "Abmessungen (Breite x Tiefe x H\u00f6he)": "55.4 cm x 23.9 cm x 36 cm - mit Fu\u00df",
        "Abmessungen (Breite x Tiefe x H\u00f6he) - mit Fu\u00df": "55.4 cm x 23.9 cm x 36 cm",
        "Besonderheiten": "Dual Smart Solution, Flicker Safe, Reader Mode, Intelligente Energiespartechnologie, Intelligent Auto",
        "Bildschirmbeschichtung": "Blendfrei, 3H Hard Coating",
        "Bildschirmtyp": "AH-IPS",
        "Details zu Abmessungen & Gewicht": "Mit Fu\u00df - Breite: 55.4 cm - Tiefe: 23.9 cm - H\u00f6he: 36 cm - Gewicht: 4.1 kg  Ohne Fu\u00df - Breite: 55.4 cm - Tiefe: 10.6 cm - H\u00f6he: 33.2 cm - Gewicht: 3.9 kg",
        "Diagonalabmessung": "61 cm (24\")",
        "Display-Typ": "LED-hintergrundbeleuchteter LCD-Monitor / TFT-Aktivmatrix",
        "EAN": "8806098068876",
        "ENERGY STAR zertifiziert": "Ja",
        "Eingangsanschl\u00fcsse": "HDMI, VGA",
        "Eingangsspannung": "Wechselstrom 120/230 V (47 - 63 Hz)",
        "Einstellungen der Anzeigeposition": "H\u00f6he, Drehung, Neigung",
        "Energie Effizienzklasse": "Klasse F",
        "Energieverbrauch pro Jahr": "31 kWh",
        "Enthaltene Kabel": "VGA-Kabel",
        "Farbe": "Mattschwarzer Rahmen, Hintere Abdeckung in mattem Schwarz",
        "Farbunterst\u00fctzung": "16,7 Millionen Farben",
        "Ger\u00e4tetyp": "LED-hintergrundbeleuchteter LCD-Monitor - 61 cm (24\")",
        "Gewicht": "4.1 kg",
        "Helligkeit": "250 cd/m\u00b2",
        "Hersteller": "LG",
        "Hintergrundbeleuchtungs-Technologie": "WLED",
        "Horizontale Bildwiederholrate": "30 - 83 kHz",
        "Horizontaler Betrachtungswinkel": "178",
        "H\u00f6heneinstellung": "110 mm",
        "Kennzeichnung": "FCC Klasse B bescheinigt, UL, TUV GS, cUL, VESA FDMI, CB, DDC/CI, RoHS, EPA 6.0",
        "Kontrast": "1000:1 / 5000000:1 (dynamisch)",
        "Lebensdauer der Beleuchtung": "50,000 Stunden",
        "Leistungsaufnahme im Ein-Zustand": "21 W",
        "Leistungsmerkmale": "Slot f\u00fcr Sicherheitsschloss (Kabelschloss getrennt erh\u00e4ltlich), PVC-frei, quecksilberfrei",
        "MTBF": "50,000 Stunde(n)",
        "Modell": "24BK450H-B.AEU",
        "Native Aufl\u00f6sung": "Full HD (1080p) 1920 x 1080 bei 60 Hz",
        "Neigungswinkel": "-5/+20",
        "OSD-Sprachen": "Deutsch, UK English",
        "Pixelpitch": "0.274 mm",
        "Produktbeschreibung": "LG 24BK450H-B - LED-Monitor - Full HD (1080p) - 61 cm (24\")",
        "Reaktionszeit": "5 ms (Gray-to-Gray)",
        "Schnittstellen": "HDMI  VGA  Audio Line-Out",
        "Schwenkwinkel": "356",
        "Seitenverh\u00e4ltnis": "16:9",
        "Sichtbare Bildfl\u00e4che": "60.45 cm (23.8\")",
        "Spannung": "Wechselstrom 120/230 V (47 - 63 Hz)",
        "Stromverbrauch (Aus-Modus)": "0.3 Watt",
        "Stromverbrauch SDR (eingeschaltet)": "20 kWh/1.000 h",
        "Stromverbrauch im Standby-Modus": "0.3 Watt",
        "TCO-zertifiziert": "TCO Certified Displays 9",
        "Transportbreite": "64.6 cm",
        "Transportgewicht": "5.3 kg",
        "Transporth\u00f6he": "41.6 cm",
        "Transporttiefe": "15.6 cm",
        "Umweltschutzstandards": "TCO Certified Displays 9, ENERGY STAR-qualifiziert",
        "VESA-Halterung": "75 x 75 mm",
        "Vertikale Bildwiederholrate": "56 - 75 Hz",
        "Vertikaler Betrachtungswinkel": "178",
        "Waren-Nr.": "2657230",
        "Zum Hersteller": "www.lge.com"
    },
    "raw_specifications_text": "Hersteller: LG\nWaren-Nr.: 2657230\nModell: 24BK450H-B.AEU\nEAN: 8806098068876\nZum Hersteller: www.lge.com\nProduktbeschreibung: LG 24BK450H-B - LED-Monitor - Full HD (1080p) - 61 cm (24\")\nGer\u00e4tetyp: LED-hintergrundbeleuchteter LCD-Monitor - 61 cm (24\")\nEnergie Effizienzklasse: Klasse F\nEnergieverbrauch pro Jahr: 31 kWh\nLeistungsaufnahme im Ein-Zustand: 21 W\nBildschirmtyp: AH-IPS\nSeitenverh\u00e4ltnis: 16:9\nNative Aufl\u00f6sung: Full HD (1080p) 1920 x 1080 bei 60 Hz\nPixelpitch: 0.274 mm\nHelligkeit: 250 cd/m\u00b2\nKontrast: 1000:1 / 5000000:1 (dynamisch)\nReaktionszeit: 5 ms (Gray-to-Gray)\nFarbunterst\u00fctzung: 16,7 Millionen Farben\nEingangsanschl\u00fcsse: HDMI, VGA\nEinstellungen der Anzeigeposition: H\u00f6he, Drehung, Neigung\nBildschirmbeschichtung: Blendfrei, 3H Hard Coating\nSpannung: Wechselstrom 120/230 V (47 - 63 Hz)\nFarbe: Mattschwarzer Rahmen, Hintere Abdeckung in mattem Schwarz\nAbmessungen (Breite x Tiefe x H\u00f6he) - mit Fu\u00df: 55.4 cm x 23.9 cm x 36 cm\nGewicht: 4.1 kg\nUmweltschutzstandards: TCO Certified Displays 9, ENERGY STAR-qualifiziert\nKennzeichnung: FCC Klasse B bescheinigt, UL, TUV GS, cUL, VESA FDMI, CB, DDC/CI, RoHS, EPA 6.0\nDisplay-Typ: LED-hintergrundbeleuchteter LCD-Monitor / TFT-Aktivmatrix\nDiagonalabmessung: 61 cm (24\")\nSichtbare Bildfl\u00e4che: 60.45 cm (23.8\")\nVertikale Bildwiederholrate: 56 - 75 Hz\nHorizontale Bildwiederholrate: 30 - 83 kHz\nHorizontaler Betrachtungswinkel: 178\nVertikaler Betrachtungswinkel: 178\nHintergrundbeleuchtungs-Technologie: WLED\nOSD-Sprachen: Deutsch, UK English\nBesonderheiten: Dual Smart Solution, Flicker Safe, Reader Mode, Intelligente Energiespartechnologie, Intelligent Auto\nAbmessungen (Breite x Tiefe x H\u00f6he): 55.4 cm x 23.9 cm x 36 cm - mit Fu\u00df\nSchnittstellen: HDMI  VGA  Audio Line-Out\nNeigungswinkel: -5/+20\nSchwenkwinkel: 356\nH\u00f6heneinstellung: 110 mm\nVESA-Halterung: 75 x 75 mm\nLeistungsmerkmale: Slot f\u00fcr Sicherheitsschloss (Kabelschloss getrennt erh\u00e4ltlich), PVC-frei, quecksilberfrei\nEnthaltene Kabel: VGA-Kabel\nLebensdauer der Beleuchtung: 50,000 Stunden\nMTBF: 50,000 Stunde(n)\nEingangsspannung: Wechselstrom 120/230 V (47 - 63 Hz)\nStromverbrauch SDR (eingeschaltet): 20 kWh/1.000 h\nStromverbrauch im Standby-Modus: 0.3 Watt\nStromverbrauch (Aus-Modus): 0.3 Watt\nDetails zu Abmessungen & Gewicht: Mit Fu\u00df - Breite: 55.4 cm - Tiefe: 23.9 cm - H\u00f6he: 36 cm - Gewicht: 4.1 kg  Ohne Fu\u00df - Breite: 55.4 cm - Tiefe: 10.6 cm - H\u00f6he: 33.2 cm - Gewicht: 3.9 kg\nTransportbreite: 64.6 cm\nTransporttiefe: 15.6 cm\nTransporth\u00f6he: 41.6 cm\nTransportgewicht: 5.3 kg\nTCO-zertifiziert: TCO Certified Displays 9\nENERGY STAR zertifiziert: Ja",
    "reference_file": "offer_reference_2332.json",
    "shop_name": "Proshop.at"
}