{
    "html_file": "offer_501_28.html",
    "name": "Samsung UR550 / UR552 / UR554 (2023), 28\"",
    "offer_link": "https://www.future-x.at/samsung-u28r550uqp-ur55-series-led-monitor-70-8-cm-28-3840-x-2160-4k-%40-60-hz-ips-300-cd-m%B2-1000%3A1-hdr10-4-ms-2xhdmi-displayport-dunkelblau-grau-p-9160841/?pv=2",
    "price": 230.5,
    "raw_specifications": {
        "Abmessungen (Breite x Tiefe x H\u00f6he)": "63,88 cm x 25,05 cm x 47,93 cm - mit Fu\u00df",
        "Adaptive-Sync Technologie": "AMD FreeSync",
        "Besonderheiten": "MagicBright, Bild f\u00fcr Bild, Spielmodus, Mega Infinity Dynamic Contrast Ratio, Magic Upscale, flimmerfreie Technologie, Image Size, Eco Saving Plus, Eye Saver Mode, Werkstuning, Off Timer Plus, Picture-in-Picture, an 3 Seiten ohne Blende",
        "Bildschirmtyp": "IPS",
        "Details zu Abmessungen & Gewicht": "Mit Fu\u00df - Breite: 63,88 cm - Tiefe: 25,05 cm - H\u00f6he: 47,93 cm - Gewicht: 5,6 kg \u00a6 Ohne Fu\u00df - Breite: 63,88 cm - Tiefe: 6,4 cm - H\u00f6he: 37,4 cm - Gewicht: 5 kg",
        "Diagonalabmessung": "70,8 cm (28\")",
        "Display-Typ": "LED-hintergrundbeleuchteter LCD-Monitor / TFT-Aktivmatrix",
        "Eingangsspannung": "Wechselstrom 100-240 V",
        "Einstellungen der Anzeigeposition": "Neigung",
        "Energie Effizienzklasse": "Klasse F",
        "Energieverbrauch pro Jahr": "39 kWh",
        "Enthaltene Kabel": "1 x HDMI-Kabel - 1.5 m",
        "Farbe": "Dunkelblau/grau",
        "Farbraum": "90% DCI",
        "Farbunterst\u00fctzung": "1 Milliarde Farben",
        "Gewicht": "5,6 kg",
        "HDR-Format": "HDR10",
        "Helligkeit": "300 cd/m\u00b2",
        "Hintergrundbeleuchtungs-Technologie": "LED-Hintergrundbeleuchtung",
        "Horizontaler Betrachtungswinkel": "178",
        "Kennzeichnung": "DisplayPort 1.2, TUV Rheinland Eye Comfort Certification",
        "Kontrast": "1000:1",
        "Leistungsaufnahme im Ein-Zustand": "27 W",
        "Leistungsmerkmale": "Slot f\u00fcr Sicherheitsschloss (Kabelschloss getrennt erh\u00e4ltlich)",
        "Max. Betriebstemperatur": "40 \u00b0C",
        "Min Betriebstemperatur": "10 \u00b0C",
        "Mitgelieferte Software": "Easy Setting Box, Windows 10",
        "Native Aufl\u00f6sung": "4K 3840 x 2160 bei 60 Hz",
        "Neigungswinkel": "-2/+15",
        "Reaktionszeit": "4 ms (gray-to-gray)",
        "Schlosstyp zur Diebstahlsicherung": "Kensington Slot",
        "Schnittstellen": "DisplayPort 1.2 \u00a6 2 x HDMI 2.0 \u00a6 Kopfh\u00f6rer (Mini-Klinkenstecker)",
        "Seitenverh\u00e4ltnis": "16:9",
        "Service und Support": "Begrenzte Garantie - 2 Jahre",
        "Stromverbrauch (Aus-Modus)": "0.3 Watt",
        "Stromverbrauch (max.)": "48 Watt",
        "Stromverbrauch (typisch)": "27 Watt",
        "Stromverbrauch HDR (eingeschaltet)": "40 kWh/1.000 h",
        "Stromverbrauch SDR (eingeschaltet)": "27 kWh/1.000 h",
        "Stromverbrauch im Standby-Modus": "0.5 Watt",
        "Transportbreite": "73,2 cm",
        "Transportgewicht": "7,6 kg",
        "Transporth\u00f6he": "46,5 cm",
        "Transporttiefe": "17,6 cm",
        "VESA-Halterung": "75 x 75 mm",
        "Vertikaler Betrachtungswinkel": "178",
        "Zul\u00e4ssige Luftfeuchtigkeit im Betrieb": "10 - 80% (nicht kondensierend)"
    },
    "raw_specifications_text": "Display-Typ: LED-hintergrundbeleuchteter LCD-Monitor / TFT-Aktivmatrix\nEnergie Effizienzklasse: Klasse F\nEnergieverbrauch pro Jahr: 39 kWh\nDiagonalabmessung: 70,8 cm (28\")\nAdaptive-Sync Technologie: AMD FreeSync\nBildschirmtyp: IPS\nSeitenverh\u00e4ltnis: 16:9\nNative Aufl\u00f6sung: 4K 3840 x 2160 bei 60 Hz\nHelligkeit: 300 cd/m\u00b2\nKontrast: 1000:1\nHDR-Format: HDR10\nFarbunterst\u00fctzung: 1 Milliarde Farben\nFarbraum: 90% DCI\nReaktionszeit: 4 ms (gray-to-gray)\nHorizontaler Betrachtungswinkel: 178\nVertikaler Betrachtungswinkel: 178\nHintergrundbeleuchtungs-Technologie: LED-Hintergrundbeleuchtung\nBesonderheiten: MagicBright, Bild f\u00fcr Bild, Spielmodus, Mega Infinity Dynamic Contrast Ratio, Magic Upscale, flimmerfreie Technologie, Image Size, Eco Saving Plus, Eye Saver Mode, Werkstuning, Off Timer Plus, Picture-in-Picture, an 3 Seiten ohne Blende\nFarbe: Dunkelblau/grau\nAbmessungen (Breite x Tiefe x H\u00f6he): 63,88 cm x 25,05 cm x 47,93 cm - mit Fu\u00df\nGewicht: 5,6 kg\nSchnittstellen: DisplayPort 1.2 \u00a6 2 x HDMI 2.0 \u00a6 Kopfh\u00f6rer (Mini-Klinkenstecker)\nEinstellungen der Anzeigeposition: Neigung\nNeigungswinkel: -2/+15\nVESA-Halterung: 75 x 75 mm\nLeistungsmerkmale: Slot f\u00fcr Sicherheitsschloss (Kabelschloss getrennt erh\u00e4ltlich)\nEnthaltene Kabel: 1 x HDMI-Kabel - 1.5 m\nKennzeichnung: DisplayPort 1.2, TUV Rheinland Eye Comfort Certification\nSchlosstyp zur Diebstahlsicherung: Kensington Slot\nEingangsspannung: Wechselstrom 100-240 V\nLeistungsaufnahme im Ein-Zustand: 27 W\nStromverbrauch SDR (eingeschaltet): 27 kWh/1.000 h\nStromverbrauch HDR (eingeschaltet): 40 kWh/1.000 h\nStromverbrauch (typisch): 27 Watt\nStromverbrauch (max.): 48 Watt\nStromverbrauch im Standby-Modus: 0.5 Watt\nStromverbrauch (Aus-Modus): 0.3 Watt\nMitgelieferte Software: Easy Setting Box, Windows 10\nDetails zu Abmessungen & Gewicht: Mit Fu\u00df - Breite: 63,88 cm - Tiefe: 25,05 cm - H\u00f6he: 47,93 cm - Gewicht: 5,6 kg \u00a6 Ohne Fu\u00df - Breite: 63,88 cm - Tiefe: 6,4 cm - H\u00f6he: 37,4 cm - Gewicht: 5 kg\nTransportbreite: 73,2 cm\nTransporttiefe: 17,6 cm\nTransporth\u00f6he: 46,5 cm\nTransportgewicht: 7,6 kg\nService und Support: Begrenzte Garantie - 2 Jahre\nMin Betriebstemperatur: 10 \u00b0C\nMax. Betriebstemperatur: 40 \u00b0C\nZul\u00e4ssige Luftfeuchtigkeit im Betrieb: 10 - 80% (nicht kondensierend)",
    "reference_file": "offer_reference_501.json",
    "shop_name": "Future-X.at"
}