{
    "html_file": "offer_1489_5.html",
    "name": "Samsung TU87F (2021), 31.5\"",
    "offer_link": "https://direkt.jacob.de/produkte/samsung-f32tu870vr-81-3-cm-32-zoll-3840-x-2160-pixel-artnr-6985054.html?utm_source=geizhals&utm_medium=cpc&utm_campaign=Preisvergleich&ref=103",
    "price": 460.78,
    "raw_specifications": {
        "Abmessungen (Breite x Tiefe x H\u00f6he)": "71.62 cm x 22.6 cm x 61 cm - mit Fu\u00df",
        "Abmessungen (Breite x Tiefe x H\u00f6he) - mit Fu\u00df": "71.62 cm x 22.6 cm x 61 cm",
        "Besonderheiten": "Spielmodus, flimmerfreie Technologie, Reihenschaltung m\u00f6glich, Image Size, Eco Saving Plus, Eye Saver Mode, Off Timer Plus, HDR10-kompatibel, Picture-in-Picture, Picture-by-Picture, 85% Farbskala Adobe RGB (CIE 1931), 87.2% NTSC-Farbskala (CIE 1976), DCI-P3 91.6 % (CIE 1976) Farbumfang, 99.9% sRGB (CIE 1931) Farbskala",
        "Bildschirmtyp": "VA",
        "Details zu Abmessungen & Gewicht": "Mit Fu\u00df - Breite: 71.62 cm - Tiefe: 22.6 cm - H\u00f6he: 61 cm - Gewicht: 8.1 kg  Ohne Fu\u00df - Breite: 71.62 cm - Tiefe: 5.29 cm - H\u00f6he: 42.01 cm - Gewicht: 5.5 kg",
        "Diagonalabmessung": "80 cm (31.5\")",
        "Display-Typ": "LCD-Monitor / TFT-Aktivmatrix",
        "Eingangsanschl\u00fcsse": "2xThunderbolt 3, HDMI, DisplayPort",
        "Einstellungen der Anzeigeposition": "H\u00f6he, Pivot (Rotation), Drehung, Neigung",
        "Energie Effizienzklasse": "Klasse G",
        "Energieklasse (HDR)": "Klasse G",
        "Energierverbrauch Sleep": "0.5 Watt",
        "Enthaltene Kabel": "1 x HDMI-Kabel  1 x Kabel Thunderbolt 3",
        "Erforderliche Netzspannung": "Wechselstrom 120/230 V",
        "Farbe": "Dunkelgrau/blau",
        "Farbunterst\u00fctzung": "1 Milliarde Farben",
        "Ger\u00e4tetyp": "LCD-Monitor - 80 cm (31.5\")",
        "Gewicht": "8.1 kg",
        "Helligkeit": "250 cd/m\u00b2",
        "Hintergrundbeleuchtungs-Technologie": "LED-Hintergrundbeleuchtung",
        "Horizontaler Betrachtungswinkel": "178",
        "H\u00f6heneinstellung": "135 mm",
        "Integrierte Peripherieger\u00e4te": "USB 3.0-Hub",
        "Kontrast": "2500:1 / 100000:1 (dynamisch)",
        "Leistungsaufnahme im Ein-Zustand": "39 W",
        "Leistungsmerkmale": "Slot f\u00fcr Sicherheitsschloss (Kabelschloss getrennt erh\u00e4ltlich)",
        "Max. Betriebstemperatur": "40 \u00b0C",
        "Min Betriebstemperatur": "10 \u00b0C",
        "Native Aufl\u00f6sung": "4K 3840 x 2160 bei 60 Hz",
        "Neigungswinkel": "-7/+13",
        "Produktbeschreibung": "Samsung F32TU870VR - TU87F Series - LCD-Monitor - 4K - 80 cm (31.5\")",
        "Reaktionszeit": "8 ms (Gray-to-Gray)",
        "Rotationswinkel": "-2/+92",
        "Schlosstyp zur Diebstahlsicherung": "Kensington Slot",
        "Schnittstellen": "DisplayPort (DisplayPort 1.2 Modus)  HDMI  Kopfh\u00f6rer  2 x USB 3.0  Thunderbolt 3 (bis zu 92 W)  Thunderbolt 3 (bis zu 15 W)  Netzwerk",
        "Schwenkwinkel": "90",
        "Seitenverh\u00e4ltnis": "16:9",
        "Sichtbare Bildfl\u00e4che": "80 cm (32\")",
        "Stromverbrauch (Aus-Modus)": "0.5 Watt",
        "Stromverbrauch (typisch)": "39 Watt",
        "Stromverbrauch HDR (eingeschaltet)": "59 kWh/1.000 h",
        "Stromverbrauch SDR (eingeschaltet)": "39 kWh/1.000 h",
        "Transportbreite": "81 cm",
        "Transportgewicht": "10.6 kg",
        "Transporth\u00f6he": "19.2 cm",
        "Transporttiefe": "54.4 cm",
        "VESA-Halterung": "100 x 100 mm",
        "Vertikaler Betrachtungswinkel": "178",
        "Zul\u00e4ssige Luftfeuchtigkeit im Betrieb": "10 - 80% (nicht kondensierend)"
    },
    "raw_specifications_text": "Produktbeschreibung: Samsung F32TU870VR - TU87F Series - LCD-Monitor - 4K - 80 cm (31.5\")\nGer\u00e4tetyp: LCD-Monitor - 80 cm (31.5\")\nEnergie Effizienzklasse: Klasse G\nLeistungsaufnahme im Ein-Zustand: 39 W\nLeistungsmerkmale: Slot f\u00fcr Sicherheitsschloss (Kabelschloss getrennt erh\u00e4ltlich)\nBildschirmtyp: VA\nSeitenverh\u00e4ltnis: 16:9\nNative Aufl\u00f6sung: 4K 3840 x 2160 bei 60 Hz\nHelligkeit: 250 cd/m\u00b2\nKontrast: 2500:1 / 100000:1 (dynamisch)\nReaktionszeit: 8 ms (Gray-to-Gray)\nFarbunterst\u00fctzung: 1 Milliarde Farben\nEingangsanschl\u00fcsse: 2xThunderbolt 3, HDMI, DisplayPort\nEinstellungen der Anzeigeposition: H\u00f6he, Pivot (Rotation), Drehung, Neigung\nFarbe: Dunkelgrau/blau\nAbmessungen (Breite x Tiefe x H\u00f6he) - mit Fu\u00df: 71.62 cm x 22.6 cm x 61 cm\nGewicht: 8.1 kg\nDisplay-Typ: LCD-Monitor / TFT-Aktivmatrix\nEnergieklasse (HDR): Klasse G\nDiagonalabmessung: 80 cm (31.5\")\nSichtbare Bildfl\u00e4che: 80 cm (32\")\nIntegrierte Peripherieger\u00e4te: USB 3.0-Hub\nHorizontaler Betrachtungswinkel: 178\nVertikaler Betrachtungswinkel: 178\nHintergrundbeleuchtungs-Technologie: LED-Hintergrundbeleuchtung\nBesonderheiten: Spielmodus, flimmerfreie Technologie, Reihenschaltung m\u00f6glich, Image Size, Eco Saving Plus, Eye Saver Mode, Off Timer Plus, HDR10-kompatibel, Picture-in-Picture, Picture-by-Picture, 85% Farbskala Adobe RGB (CIE 1931), 87.2% NTSC-Farbskala (CIE 1976), DCI-P3 91.6 % (CIE 1976) Farbumfang, 99.9% sRGB (CIE 1931) Farbskala\nAbmessungen (Breite x Tiefe x H\u00f6he): 71.62 cm x 22.6 cm x 61 cm - mit Fu\u00df\nSchnittstellen: DisplayPort (DisplayPort 1.2 Modus)  HDMI  Kopfh\u00f6rer  2 x USB 3.0  Thunderbolt 3 (bis zu 92 W)  Thunderbolt 3 (bis zu 15 W)  Netzwerk\nNeigungswinkel: -7/+13\nSchwenkwinkel: 90\nRotationswinkel: -2/+92\nH\u00f6heneinstellung: 135 mm\nVESA-Halterung: 100 x 100 mm\nEnthaltene Kabel: 1 x HDMI-Kabel  1 x Kabel Thunderbolt 3\nSchlosstyp zur Diebstahlsicherung: Kensington Slot\nErforderliche Netzspannung: Wechselstrom 120/230 V\nStromverbrauch SDR (eingeschaltet): 39 kWh/1.000 h\nStromverbrauch HDR (eingeschaltet): 59 kWh/1.000 h\nStromverbrauch (typisch): 39 Watt\nEnergierverbrauch Sleep: 0.5 Watt\nStromverbrauch (Aus-Modus): 0.5 Watt\nDetails zu Abmessungen & Gewicht: Mit Fu\u00df - Breite: 71.62 cm - Tiefe: 22.6 cm - H\u00f6he: 61 cm - Gewicht: 8.1 kg  Ohne Fu\u00df - Breite: 71.62 cm - Tiefe: 5.29 cm - H\u00f6he: 42.01 cm - Gewicht: 5.5 kg\nTransportbreite: 81 cm\nTransporttiefe: 54.4 cm\nTransporth\u00f6he: 19.2 cm\nTransportgewicht: 10.6 kg\nMin Betriebstemperatur: 10 \u00b0C\nMax. Betriebstemperatur: 40 \u00b0C\nZul\u00e4ssige Luftfeuchtigkeit im Betrieb: 10 - 80% (nicht kondensierend)",
    "reference_file": "offer_reference_1489.json",
    "shop_name": "Jacob Elektronik direkt (AT)"
}