{
    "html_file": "offer_900_37.html",
    "name": "Samsung Odyssey Neo G8 G85NB, 32\"",
    "offer_link": "https://www.proshop.at/Bildschirm/Samsung-32-Bildschirm-Odyssey-G8-3840x2160-4k-UHD-240Hz-VA-With-Quantum-Mini-LED-HDMI-21-Curved-1-ms-AMD-FreeSync-Premium/3139338?utm_source=geizhals&utm_medium=cpc&utm_campaign=pricesite",
    "price": 1198.04,
    "raw_specifications": {
        "Abmessungen (Breite x Tiefe x H\u00f6he)": "71.3 cm x 31.11 cm x 60.64 cm - mit Fu\u00df",
        "Abmessungen (Breite x Tiefe x H\u00f6he) - mit Fu\u00df": "71.3 cm x 31.11 cm x 60.64 cm",
        "Adaptive-Sync Technologie": "AMD FreeSync Premium Pro",
        "Besonderheiten": "Cinema Mode, Eco Light Sensor, Black eQualizer, CustomColor Mode, FPS Mode, flimmerfreie Technologie, RTS Mode, Werkstuning, Off Timer Plus, Sportmodus, Quantum Dot Technology, Super Arena Gaming UX, Refresh Rate Optimizer, RPG Mode, sRGB Mode, Picture-in-Picture, FreeSync Premium Pro Technology, Dynamic Contrast Mode, Low Input Delay Mode, Auto Source Switch+, Adaptive Picture, Ultrawide Game View, ergonomischer St\u00e4nder, CoreSync-Beleuchtungsdesign, Virtual AIM Point",
        "Bildschirmtyp": "VA",
        "Details zu Abmessungen & Gewicht": "Mit Fu\u00df - Breite: 71.3 cm - Tiefe: 31.11 cm - H\u00f6he: 60.64 cm - Gewicht: 8.9 kg  Ohne Fu\u00df - Breite: 71.3 cm - Tiefe: 17.3 cm - H\u00f6he: 43.48 cm - Gewicht: 7 kg",
        "Diagonalabmessung": "80 cm (32\")",
        "Display-Typ": "QLED-Monitor / TFT-Aktivmatrix",
        "EAN": "8806094796582",
        "Eingangsanschl\u00fcsse": "2xHDMI, DisplayPort",
        "Eingangsspannung": "Wechselstrom 100-240 V",
        "Einstellungen der Anzeigeposition": "H\u00f6he, Pivot (Rotation), Drehung, Neigung",
        "Energie Effizienzklasse": "Klasse G",
        "Energieklasse (HDR)": "Klasse G",
        "Energieverbrauch pro Jahr": "48 kWh",
        "Enthaltene Kabel": "1 x DisplayPort-Kabel",
        "Farbe": "Schwarz, wei\u00df",
        "Farbraum": "95% DCI",
        "Farbunterst\u00fctzung": "1 Milliarde Farben",
        "Gaming": "Ja",
        "Ger\u00e4tetyp": "QLED-Monitor - 80 cm (32\")",
        "Geschwungener Bildschirm": "Ja (1000R)",
        "Gewicht": "8.9 kg",
        "HDR-Format": "Quantum HDR 2000",
        "HDR-f\u00e4hig": "Quantum HDR 2000",
        "Helligkeit": "350 cd/m\u00b2",
        "Hersteller": "Samsung",
        "Hintergrundbeleuchtungs-Technologie": "Quantum Mini LED",
        "Horizontaler Betrachtungswinkel": "178",
        "H\u00f6heneinstellung": "120 mm",
        "Integrierte Peripherieger\u00e4te": "USB 3.0-Hub",
        "Kennzeichnung": "HDCP 2.2",
        "Kontrast": "1000000:1",
        "Leistungsaufnahme im Ein-Zustand": "33.2 W",
        "Leistungsmerkmale": "Slot f\u00fcr Sicherheitsschloss (Kabelschloss getrennt erh\u00e4ltlich)",
        "Modell": "LS32BG850NPXEN",
        "Native Aufl\u00f6sung": "4K 3840 x 2160 bei 240 Hz",
        "Neigungswinkel": "-9/+13",
        "Produktbeschreibung": "Samsung Odyssey Neo G8 S32BG850NP - G85NB Series - QLED-Monitor - gebogen - 4K - 80 cm (32\") - HDR",
        "Reaktionszeit": "1 ms (Gray-to-Gray)",
        "Rotationswinkel": "-92/+92",
        "Schlosstyp zur Diebstahlsicherung": "Kensington Slot",
        "Schnittstellen": "2 x HDMI 2.1 (HDCP 2.2)  DisplayPort 1.4  2 x USB 3.0  Kopfh\u00f6rer (Mini-Klinkenstecker)",
        "Schwenkwinkel": "30",
        "Seitenverh\u00e4ltnis": "16:9",
        "Spannung": "Wechselstrom 100-240 V",
        "Stromverbrauch (Aus-Modus)": "0.3 Watt",
        "Stromverbrauch (typisch)": "33.2 Watt",
        "Stromverbrauch HDR (eingeschaltet)": "104 kWh/1.000 h",
        "Stromverbrauch SDR (eingeschaltet)": "33 kWh/1.000 h",
        "Stromverbrauch im Standby-Modus": "0.5 Watt",
        "Transportbreite": "82.7 cm",
        "Transportgewicht": "12.2 kg",
        "Transporth\u00f6he": "53 cm",
        "Transporttiefe": "23.6 cm",
        "VESA-Halterung": "100 x 100 mm",
        "Vertikaler Betrachtungswinkel": "178",
        "Waren-Nr.": "3139338",
        "Zum Hersteller": "www.samsung.com"
    },
    "raw_specifications_text": "Hersteller: Samsung\nWaren-Nr.: 3139338\nModell: LS32BG850NPXEN\nEAN: 8806094796582\nZum Hersteller: www.samsung.com\nProduktbeschreibung: Samsung Odyssey Neo G8 S32BG850NP - G85NB Series - QLED-Monitor - gebogen - 4K - 80 cm (32\") - HDR\nGer\u00e4tetyp: QLED-Monitor - 80 cm (32\")\nEnergie Effizienzklasse: Klasse G\nEnergieverbrauch pro Jahr: 48 kWh\nLeistungsaufnahme im Ein-Zustand: 33.2 W\nGeschwungener Bildschirm: Ja (1000R)\nAdaptive-Sync Technologie: AMD FreeSync Premium Pro\nLeistungsmerkmale: Slot f\u00fcr Sicherheitsschloss (Kabelschloss getrennt erh\u00e4ltlich)\nBildschirmtyp: VA\nSeitenverh\u00e4ltnis: 16:9\nNative Aufl\u00f6sung: 4K 3840 x 2160 bei 240 Hz\nHelligkeit: 350 cd/m\u00b2\nKontrast: 1000000:1\nHDR-f\u00e4hig: Quantum HDR 2000\nReaktionszeit: 1 ms (Gray-to-Gray)\nGaming: Ja\nFarbunterst\u00fctzung: 1 Milliarde Farben\nFarbraum: 95% DCI\nEingangsanschl\u00fcsse: 2xHDMI, DisplayPort\nEinstellungen der Anzeigeposition: H\u00f6he, Pivot (Rotation), Drehung, Neigung\nSpannung: Wechselstrom 100-240 V\nFarbe: Schwarz, wei\u00df\nAbmessungen (Breite x Tiefe x H\u00f6he) - mit Fu\u00df: 71.3 cm x 31.11 cm x 60.64 cm\nGewicht: 8.9 kg\nKennzeichnung: HDCP 2.2\nDisplay-Typ: QLED-Monitor / TFT-Aktivmatrix\nEnergieklasse (HDR): Klasse G\nDiagonalabmessung: 80 cm (32\")\nIntegrierte Peripherieger\u00e4te: USB 3.0-Hub\nHDR-Format: Quantum HDR 2000\nHorizontaler Betrachtungswinkel: 178\nVertikaler Betrachtungswinkel: 178\nHintergrundbeleuchtungs-Technologie: Quantum Mini LED\nBesonderheiten: Cinema Mode, Eco Light Sensor, Black eQualizer, CustomColor Mode, FPS Mode, flimmerfreie Technologie, RTS Mode, Werkstuning, Off Timer Plus, Sportmodus, Quantum Dot Technology, Super Arena Gaming UX, Refresh Rate Optimizer, RPG Mode, sRGB Mode, Picture-in-Picture, FreeSync Premium Pro Technology, Dynamic Contrast Mode, Low Input Delay Mode, Auto Source Switch+, Adaptive Picture, Ultrawide Game View, ergonomischer St\u00e4nder, CoreSync-Beleuchtungsdesign, Virtual AIM Point\nAbmessungen (Breite x Tiefe x H\u00f6he): 71.3 cm x 31.11 cm x 60.64 cm - mit Fu\u00df\nSchnittstellen: 2 x HDMI 2.1 (HDCP 2.2)  DisplayPort 1.4  2 x USB 3.0  Kopfh\u00f6rer (Mini-Klinkenstecker)\nNeigungswinkel: -9/+13\nSchwenkwinkel: 30\nRotationswinkel: -92/+92\nH\u00f6heneinstellung: 120 mm\nVESA-Halterung: 100 x 100 mm\nEnthaltene Kabel: 1 x DisplayPort-Kabel\nSchlosstyp zur Diebstahlsicherung: Kensington Slot\nEingangsspannung: Wechselstrom 100-240 V\nStromverbrauch SDR (eingeschaltet): 33 kWh/1.000 h\nStromverbrauch HDR (eingeschaltet): 104 kWh/1.000 h\nStromverbrauch (typisch): 33.2 Watt\nStromverbrauch im Standby-Modus: 0.5 Watt\nStromverbrauch (Aus-Modus): 0.3 Watt\nDetails zu Abmessungen & Gewicht: Mit Fu\u00df - Breite: 71.3 cm - Tiefe: 31.11 cm - H\u00f6he: 60.64 cm - Gewicht: 8.9 kg  Ohne Fu\u00df - Breite: 71.3 cm - Tiefe: 17.3 cm - H\u00f6he: 43.48 cm - Gewicht: 7 kg\nTransportbreite: 82.7 cm\nTransporttiefe: 23.6 cm\nTransporth\u00f6he: 53 cm\nTransportgewicht: 12.2 kg",
    "reference_file": "offer_reference_900.json",
    "shop_name": "Proshop.at"
}