{
    "html_file": "offer_1387_2.html",
    "name": "MSI MPG Artymis 343CQR, 34\"",
    "offer_link": "https://www.taufnaus.de/product/13105667",
    "price": 999.86,
    "raw_specifications": {
        "Abmessungen (Breite x Tiefe x H\u00f6he)": "79.53 cm x 31.56 cm x 42.25 cm - mit Fu\u00df",
        "Adaptive-Sync Technologie": "AMD FreeSync Premium",
        "Besonderheiten": "Bild f\u00fcr Bild, rahmenlos, Crosshair Display, Picture-in-Picture, MSI Mystic Light, Gaming Mode, 10-bit (8-bit + FRC) Farbtiefe",
        "Bildschirmbeschichtung": "Blendfrei",
        "Bildschirmtyp": "VA",
        "Details zu Abmessungen & Gewicht": "Mit Fu\u00df - Breite: 79.53 cm - Tiefe: 31.56 cm - H\u00f6he: 42.25 cm - Gewicht: 9.17 kg \u00a6 Ohne Fu\u00df - Breite: 79.53 cm - Tiefe: 16.31 cm - H\u00f6he: 36.55 cm",
        "Diagonalabmessung": "86.4 cm (34\")",
        "Display-Typ": "LED-hintergrundbeleuchteter LCD-Monitor / TFT-Aktivmatrix",
        "Eingangsspannung": "Wechselstrom 120/230 V (50/60 Hz)",
        "Einstellungen der Anzeigeposition": "H\u00f6he, Drehung, Neigung",
        "Energie Effizienzklasse": "Klasse G",
        "Energieklasse (HDR)": "Klasse G",
        "Enthaltene Kabel": "1 x USB-Kabel Typ A auf Typ B \u00a6 1 x HDMI-Kabel \u00a6 1 x DisplayPort-Kabel",
        "Farbe": "Schwarz",
        "Farbraum": "100.9% Adobe RGB (CIE 1976), 102.7% NTSC (CIE 1976), 117.8% Rec 709 (CIE 1931), 117.8% Rec 709 (CIE 1976), 117.8% sRGB (CIE 1976), 121.8% sRGB (CIE 1931), 86.2% NTSC (CIE 1931), 89.8% DCI-P3 (CIE 1931), 90.2% Adobe RGB (CIE 1931), 93.8% DCI-P3 (CIE 1976)",
        "Farbunterst\u00fctzung": "1,07 Mrd. Farben",
        "Gaming": "Ja",
        "Geschwungener Bildschirm": "Ja (1000R)",
        "Gewicht": "9.17 kg",
        "HDR-Zertifizierung": "DisplayHDR 400",
        "Helligkeit": "550 cd/m\u00b2",
        "Hintergrundbeleuchtungs-Technologie": "LED-Hintergrundbeleuchtung",
        "Horizontale Bildwiederholrate": "71.52 - 245.85 kHz",
        "Horizontaler Betrachtungswinkel": "178",
        "H\u00f6heneinstellung": "100 mm",
        "Integrierte Peripherieger\u00e4te": "USB 3.2 Gen 1 Hub",
        "Kennzeichnung": "DisplayPort 1.4, HDCP 2.2, CIE1931, CIE1976",
        "Kontrast": "3000:1 / 100000000:1 (dynamisch)",
        "Leistungsaufnahme im Ein-Zustand": "39.9 W",
        "Leistungsmerkmale": "Slot f\u00fcr Sicherheitsschloss (Kabelschloss getrennt erh\u00e4ltlich)",
        "Native Aufl\u00f6sung": "UWQHD 3440 x 1440 (DisplayPort: 165 Hz, HDMI: 100 Hz, USB-C: 165 Hz)",
        "Neigungswinkel": "-5/+20",
        "Pixelpitch": "0.23175 mm",
        "Reaktionszeit": "4 ms (gray-to-gray), 1 ms (MPRT)",
        "Schlosstyp zur Diebstahlsicherung": "Kensington Slot",
        "Schnittstellen": "DisplayPort 1.4 (HDCP 2.2) \u00a6 2 x HDMI (HDCP 2.2) \u00a6 Kopfh\u00f6rer \u00a6 USB-C \u00a6 USB 3.2 Gen 1 Upstream \u00a6 2 x USB 3.2 Gen 1 Downstream",
        "Schwenkwinkel": "60",
        "Seitenverh\u00e4ltnis": "21:9",
        "Stromverbrauch (Aus-Modus)": "0.3 Watt",
        "Stromverbrauch (typisch)": "54 Watt",
        "Stromverbrauch HDR (eingeschaltet)": "70 kWh/1.000 h",
        "Stromverbrauch SDR (eingeschaltet)": "39.9 kWh/1.000 h",
        "Stromverbrauch im Standby-Modus": "0.5 Watt",
        "Transportbreite": "88.2 cm",
        "Transportgewicht": "12.9 kg",
        "Transporth\u00f6he": "49 cm",
        "Transporttiefe": "28 cm",
        "Typ": "5-Wege-Joystick",
        "VESA-Halterung": "100 x 100 mm",
        "Vertikale Bildwiederholrate": "48 - 165 Hz",
        "Vertikaler Betrachtungswinkel": "178"
    },
    "raw_specifications_text": "Display-Typ: LED-hintergrundbeleuchteter LCD-Monitor / TFT-Aktivmatrix\nEnergie Effizienzklasse: Klasse G\nEnergieklasse (HDR): Klasse G\nDiagonalabmessung: 86.4 cm (34\")\nGeschwungener Bildschirm: Ja (1000R)\nAdaptive-Sync Technologie: AMD FreeSync Premium\nIntegrierte Peripherieger\u00e4te: USB 3.2 Gen 1 Hub\nBildschirmtyp: VA\nSeitenverh\u00e4ltnis: 21:9\nNative Aufl\u00f6sung: UWQHD 3440 x 1440 (DisplayPort: 165 Hz, HDMI: 100 Hz, USB-C: 165 Hz)\nPixelpitch: 0.23175 mm\nHelligkeit: 550 cd/m\u00b2\nKontrast: 3000:1 / 100000000:1 (dynamisch)\nHDR-Zertifizierung: DisplayHDR 400\nFarbunterst\u00fctzung: 1,07 Mrd. Farben\nFarbraum: 100.9% Adobe RGB (CIE 1976), 102.7% NTSC (CIE 1976), 117.8% Rec 709 (CIE 1931), 117.8% Rec 709 (CIE 1976), 117.8% sRGB (CIE 1976), 121.8% sRGB (CIE 1931), 86.2% NTSC (CIE 1931), 89.8% DCI-P3 (CIE 1931), 90.2% Adobe RGB (CIE 1931), 93.8% DCI-P3 (CIE 1976)\nReaktionszeit: 4 ms (gray-to-gray), 1 ms (MPRT)\nVertikale Bildwiederholrate: 48 - 165 Hz\nHorizontale Bildwiederholrate: 71.52 - 245.85 kHz\nGaming: Ja\nHorizontaler Betrachtungswinkel: 178\nVertikaler Betrachtungswinkel: 178\nBildschirmbeschichtung: Blendfrei\nHintergrundbeleuchtungs-Technologie: LED-Hintergrundbeleuchtung\nBesonderheiten: Bild f\u00fcr Bild, rahmenlos, Crosshair Display, Picture-in-Picture, MSI Mystic Light, Gaming Mode, 10-bit (8-bit + FRC) Farbtiefe\nFarbe: Schwarz\nAbmessungen (Breite x Tiefe x H\u00f6he): 79.53 cm x 31.56 cm x 42.25 cm - mit Fu\u00df\nGewicht: 9.17 kg\nTyp: 5-Wege-Joystick\nSchnittstellen: DisplayPort 1.4 (HDCP 2.2) \u00a6 2 x HDMI (HDCP 2.2) \u00a6 Kopfh\u00f6rer \u00a6 USB-C \u00a6 USB 3.2 Gen 1 Upstream \u00a6 2 x USB 3.2 Gen 1 Downstream\nEinstellungen der Anzeigeposition: H\u00f6he, Drehung, Neigung\nNeigungswinkel: -5/+20\nSchwenkwinkel: 60\nH\u00f6heneinstellung: 100 mm\nVESA-Halterung: 100 x 100 mm\nLeistungsmerkmale: Slot f\u00fcr Sicherheitsschloss (Kabelschloss getrennt erh\u00e4ltlich)\nEnthaltene Kabel: 1 x USB-Kabel Typ A auf Typ B \u00a6 1 x HDMI-Kabel \u00a6 1 x DisplayPort-Kabel\nKennzeichnung: DisplayPort 1.4, HDCP 2.2, CIE1931, CIE1976\nSchlosstyp zur Diebstahlsicherung: Kensington Slot\nEingangsspannung: Wechselstrom 120/230 V (50/60 Hz)\nLeistungsaufnahme im Ein-Zustand: 39.9 W\nStromverbrauch SDR (eingeschaltet): 39.9 kWh/1.000 h\nStromverbrauch HDR (eingeschaltet): 70 kWh/1.000 h\nStromverbrauch (typisch): 54 Watt\nStromverbrauch im Standby-Modus: 0.5 Watt\nStromverbrauch (Aus-Modus): 0.3 Watt\nDetails zu Abmessungen & Gewicht: Mit Fu\u00df - Breite: 79.53 cm - Tiefe: 31.56 cm - H\u00f6he: 42.25 cm - Gewicht: 9.17 kg \u00a6 Ohne Fu\u00df - Breite: 79.53 cm - Tiefe: 16.31 cm - H\u00f6he: 36.55 cm\nTransportbreite: 88.2 cm\nTransporttiefe: 28 cm\nTransporth\u00f6he: 49 cm\nTransportgewicht: 12.9 kg",
    "reference_file": "offer_reference_1387.json",
    "shop_name": "TaufNaus"
}