{
    "html_file": "offer_1951_4.html",
    "name": "Eizo FlexScan EV2360 schwarz, 22.5\"",
    "offer_link": "https://www.alternate.at/EIZO/EV2360-BK-LED-Monitor/html/product/1634831?partner=AtGeizhalsat&campaign=Monitor/EIZO/1634831",
    "price": 262.0,
    "raw_specifications": {
        "": "Netzteil",
        "Abmessungen": "Breite: 49,9 cm x H\u00f6he: 47,4 cm x Tiefe/L\u00e4nge: 23,3 cm",
        "Anschl\u00fcsse": "1x HDMI-Eingang, 1x DisplayPort-Eingang, 1x VGA-Eingang, 1x 3,5-mm-Audio-Eingang, 1x 3,5-mm-Audio-Ausgang, 2x USB-A-3.2 Gen 1 (5 Gbit/s), 1x USB-B",
        "Bild": "Format",
        "Bildschirmaufl\u00f6sung": "1.920 x 1.200 Pixel",
        "Bildschirmdiagonale": "57,15 cm (22,5 Zoll)",
        "EAN": "4995047055198",
        "Energieeffizienzklasse (SDR)": "C (A - G)",
        "Energieverbauch pro 1000 Stunden (SDR)": "11 kWh",
        "Ergonomie": "Typ",
        "Farbe": "schwarz",
        "Features": "Overdrive Technologie, Flimmerfreie LEDs, DICOM-Tonwertcharakteristik, Auto-EcoView",
        "Geeignet f\u00fcr": "Business, Multimedia",
        "Gewicht": "5,5 kg",
        "Hersteller-Nr.": "EV2360-BK",
        "Lautsprecher": "vorhanden",
        "Leistungsaufnahme im Bereitschafts- und Aus-Zustand": "0,5 Watt",
        "Leistungsaufnahme im Ein-Zustand bei Standard-Dynamikumfang (SDR)": "10,5 Watt",
        "Nachhaltigkeit": "Umweltfreundliche Produktion (TCO)Effizienter Stromverbrauch (TCO)",
        "Standards": "Video",
        "Stromversorgung": "Stromverbrauch",
        "Typ": "LED-Monitor",
        "Wandhalterung": "VESA kompatibel (100 x 100 mm)",
        "Zubeh\u00f6r": "Vorhanden"
    },
    "raw_specifications_text": "Energieeffizienzklasse (SDR): C (A - G)\nEnergieverbauch pro 1000 Stunden (SDR): 11 kWh\nLeistungsaufnahme im Ein-Zustand bei Standard-Dynamikumfang (SDR): 10,5 Watt\nLeistungsaufnahme im Bereitschafts- und Aus-Zustand: 0,5 Watt\nBildschirmdiagonale: 57,15 cm (22,5 Zoll)\nBildschirmaufl\u00f6sung: 1.920 x 1.200 Pixel\nTyp: LED-Monitor\nFarbe: schwarz\nEAN: 4995047055198\nHersteller-Nr.: EV2360-BK\nGeeignet f\u00fcr: Business, Multimedia\nBild: Format\n: Netzteil\nAnschl\u00fcsse: 1x HDMI-Eingang, 1x DisplayPort-Eingang, 1x VGA-Eingang, 1x 3,5-mm-Audio-Eingang, 1x 3,5-mm-Audio-Ausgang, 2x USB-A-3.2 Gen 1 (5 Gbit/s), 1x USB-B\nErgonomie: Typ\nStromversorgung: Stromverbrauch\nLautsprecher: vorhanden\nStandards: Video\nWandhalterung: VESA kompatibel (100 x 100 mm)\nFeatures: Overdrive Technologie, Flimmerfreie LEDs, DICOM-Tonwertcharakteristik, Auto-EcoView\nZubeh\u00f6r: Vorhanden\nNachhaltigkeit: Umweltfreundliche Produktion (TCO)Effizienter Stromverbrauch (TCO)\nAbmessungen: Breite: 49,9 cm x H\u00f6he: 47,4 cm x Tiefe/L\u00e4nge: 23,3 cm\nGewicht: 5,5 kg",
    "reference_file": "offer_reference_1951.json",
    "shop_name": "Alternate.at"
}