{
    "html_file": "offer_495_8.html",
    "name": "HP E32k G5, 31.5\"",
    "offer_link": "https://www.e-tec.at/details.php?artnr=366311",
    "price": 742.25,
    "raw_specifications": {
        "Anschl\u00fcsse - DisplayPort 1.4 60Hz@3840x2160": "1",
        "Anschl\u00fcsse - HDMI 2.0 60Hz@3840x2160": "1",
        "Anschl\u00fcsse - USB-C 3.0 mit DisplayPort 1.4 60Hz@3840x2160": "1",
        "Anwendung": "station\u00e4r",
        "Audio": "Lautsprecher (2x 3W)",
        "Aufl\u00f6sung": "3840x2160",
        "Beschichtung": "matt (non-glare),  H\u00e4rtegrad 3H",
        "Besonderheiten": "Slim Bezel,  EPEAT Gold,  mechanische Tasten mit Steuerkreuz,  Sicherheitsschloss (Kensington),  Lichtsensor,  USB-C Power Delivery (65W)",
        "Bildwiederholfrequenz": "60Hz",
        "Blickwinkel": "178\u00b0/178\u00b0",
        "Diagonale": "31.5\"/80cm",
        "Energieverbrauch SDR": "32kWh/1000h",
        "Ergonomie": "150mm (h\u00f6henverstellbar),  \u00b190\u00b0 (Pivot),  \u00b145\u00b0 (drehbar),  +20\u00b0/-5\u00b0 (neigbar),  keine Angabe (Schr\u00e4glage)",
        "FRC": "ja (8bit+2bit)",
        "Farbe": "schwarz",
        "Farbraum - sRGB": "99%",
        "Farbtiefe": "10bit (1.07 Mrd. Farben)",
        "Form": "gerade (flat)",
        "Gewicht": "8.40kg (mit Standfu\u00df),  5.94kg (ohne Standfu\u00df)",
        "HDR": "N/A",
        "Helligkeit": "350cd/m\u00b2",
        "Herstellergarantie": "drei Jahre",
        "Hintergrundbeleuchtung": "White-LED,  flicker-free,  Blaulichtfilter",
        "Kontrast - dynamisch": "8.000.000:1",
        "Kontrast - statisch": "1.000:1",
        "Lautsprecher": "Ja",
        "Leistungsaufnahme": "210W (maximal),  39W (typisch),  keine Angabe (Energielabel alt A+++ bis G),  0.5W (Standby)",
        "Panel": "IPS",
        "Reaktionszeit - GtG": "5ms",
        "Screen-to-Body-Ratio": "91.0% (berechnet)",
        "Seitenverh\u00e4ltnis": "16:9",
        "Signalfrequenz": "30-135kHz (horizontal),  30-60Hz (vertikal)",
        "Stromversorgung": "AC-In (internes Netzteil)",
        "USB-Hub In": "1x USB-C 3.0 mit DisplayPort 1.4",
        "USB-Hub Out": "2x USB-A 3.0,  1x USB-A 3.0 (USB BC 1.2),  1x USB-C 3.0 (USB PD 15W)",
        "USB-Schreibweise": "Link",
        "VESA": "100x100 (belegt)",
        "Weitere Anschl\u00fcsse": "1x Gb LAN (RJ-45)"
    },
    "raw_specifications_text": "Anschl\u00fcsse - DisplayPort 1.4 60Hz@3840x2160: 1\nAnschl\u00fcsse - HDMI 2.0 60Hz@3840x2160: 1\nAnschl\u00fcsse - USB-C 3.0 mit DisplayPort 1.4 60Hz@3840x2160: 1\nAnwendung: station\u00e4r\nAudio: Lautsprecher (2x 3W)\nAufl\u00f6sung: 3840x2160\nBeschichtung: matt (non-glare),  H\u00e4rtegrad 3H\nBesonderheiten: Slim Bezel,  EPEAT Gold,  mechanische Tasten mit Steuerkreuz,  Sicherheitsschloss (Kensington),  Lichtsensor,  USB-C Power Delivery (65W)\nBildwiederholfrequenz: 60Hz\nBlickwinkel: 178\u00b0/178\u00b0\nDiagonale: 31.5\"/80cm\nEnergieverbrauch SDR: 32kWh/1000h\nErgonomie: 150mm (h\u00f6henverstellbar),  \u00b190\u00b0 (Pivot),  \u00b145\u00b0 (drehbar),  +20\u00b0/-5\u00b0 (neigbar),  keine Angabe (Schr\u00e4glage)\nFarbe: schwarz\nFarbraum - sRGB: 99%\nFarbtiefe: 10bit (1.07 Mrd. Farben)\nForm: gerade (flat)\nFRC: ja (8bit+2bit)\nGewicht: 8.40kg (mit Standfu\u00df),  5.94kg (ohne Standfu\u00df)\nHDR: N/A\nHelligkeit: 350cd/m\u00b2\nHerstellergarantie: drei Jahre\nHintergrundbeleuchtung: White-LED,  flicker-free,  Blaulichtfilter\nKontrast - dynamisch: 8.000.000:1\nKontrast - statisch: 1.000:1\nLautsprecher: Ja\nLeistungsaufnahme: 210W (maximal),  39W (typisch),  keine Angabe (Energielabel alt A+++ bis G),  0.5W (Standby)\nPanel: IPS\nReaktionszeit - GtG: 5ms\nScreen-to-Body-Ratio: 91.0% (berechnet)\nSeitenverh\u00e4ltnis: 16:9\nSignalfrequenz: 30-135kHz (horizontal),  30-60Hz (vertikal)\nStromversorgung: AC-In (internes Netzteil)\nUSB-Hub In: 1x USB-C 3.0 mit DisplayPort 1.4\nUSB-Hub Out: 2x USB-A 3.0,  1x USB-A 3.0 (USB BC 1.2),  1x USB-C 3.0 (USB PD 15W)\nUSB-Schreibweise: Link\nVESA: 100x100 (belegt)\nWeitere Anschl\u00fcsse: 1x Gb LAN (RJ-45)",
    "reference_file": "offer_reference_495.json",
    "shop_name": "e-tec.at"
}