{
    "html_file": "offer_679_13.html",
    "name": "LG UltraGear OLED 27GR95QE-B, 26.5\"",
    "offer_link": "https://www.e-tec.at/details.php?artnr=368889",
    "price": 820.0,
    "raw_specifications": {
        "AMD FreeSync Premium": "Ja",
        "Adaptive Sync": "Ja",
        "Anschl\u00fcsse - DisplayPort 1.4 240Hz@2560x1440": "1",
        "Anschl\u00fcsse - HDMI 2.1 240Hz@2560x1440": "2",
        "Anwendung": "station\u00e4r",
        "Audio": "1x Line-Out,  1x S/PDIF (optisch)",
        "Aufl\u00f6sung": "2560x1440",
        "Beschichtung": "matt (non-glare),  H\u00e4rtegrad 3H",
        "Besonderheiten": "Slim Bezel,  Steuerkreuz,  Sicherheitsschloss (Kensington),  DTS HP:X,  Beleuchtung auf R\u00fcckseite (RGB),  L\u00fcfter",
        "Bildwiederholfrequenz": "240Hz",
        "Blickwinkel": "178\u00b0/178\u00b0",
        "Diagonale": "26.5\"/67.3cm",
        "Ergonomie": "110mm (h\u00f6henverstellbar),  \u00b190\u00b0 (Pivot),  \u00b110\u00b0 (drehbar),  +15\u00b0/-5\u00b0 (neigbar),  keine Angabe (Schr\u00e4glage)",
        "FRC": "ja (8bit+2bit)",
        "Farbe": "schwarz",
        "Farbraum - DCI-P3": "98.5%",
        "Farbtiefe": "10bit (1.07 Mrd. Farben)",
        "Form": "gerade (flat)",
        "Gewicht": "7.35kg (mit Standfu\u00df),  5.03kg (ohne Standfu\u00df)",
        "HDR": "HDR10",
        "Helligkeit": "keine Angabe (typisch),  1.000cd/m\u00b2 (HDR)",
        "Herstellergarantie": "zwei Jahre (Bring-In)",
        "Hintergrundbeleuchtung": "N/A",
        "Kontrast - statisch": "1.500.000:1",
        "Leistungsaufnahme": "94W (maximal),  74W (typisch),  keine Angabe (Energielabel alt A+++ bis G),  0.5W (Standby)",
        "Panel": "OLED (MLA-OLED),  META Technology",
        "Panel-Hersteller": "LG Display (LW270AHQ-ERG1)",
        "Reaktionszeit - GtG": "0.03ms",
        "Screen-to-Body-Ratio": "91.4% (berechnet)",
        "Seitenverh\u00e4ltnis": "16:9",
        "Signalfrequenz": "keine Angabe (horizontal),  48-240Hz (vertikal)",
        "Stromversorgung": "DC-In (externes Netzteil)",
        "USB-Hub In": "1x USB-B 3.0",
        "USB-Hub Out": "2x USB-A 3.0",
        "USB-Schreibweise": "Link",
        "VESA": "100x100 (belegt)",
        "Weitere Anschl\u00fcsse": "N/A"
    },
    "raw_specifications_text": "Adaptive Sync: Ja\nAMD FreeSync Premium: Ja\nAnschl\u00fcsse - DisplayPort 1.4 240Hz@2560x1440: 1\nAnschl\u00fcsse - HDMI 2.1 240Hz@2560x1440: 2\nAnwendung: station\u00e4r\nAudio: 1x Line-Out,  1x S/PDIF (optisch)\nAufl\u00f6sung: 2560x1440\nBeschichtung: matt (non-glare),  H\u00e4rtegrad 3H\nBesonderheiten: Slim Bezel,  Steuerkreuz,  Sicherheitsschloss (Kensington),  DTS HP:X,  Beleuchtung auf R\u00fcckseite (RGB),  L\u00fcfter\nBildwiederholfrequenz: 240Hz\nBlickwinkel: 178\u00b0/178\u00b0\nDiagonale: 26.5\"/67.3cm\nErgonomie: 110mm (h\u00f6henverstellbar),  \u00b190\u00b0 (Pivot),  \u00b110\u00b0 (drehbar),  +15\u00b0/-5\u00b0 (neigbar),  keine Angabe (Schr\u00e4glage)\nFarbe: schwarz\nFarbraum - DCI-P3: 98.5%\nFarbtiefe: 10bit (1.07 Mrd. Farben)\nForm: gerade (flat)\nFRC: ja (8bit+2bit)\nGewicht: 7.35kg (mit Standfu\u00df),  5.03kg (ohne Standfu\u00df)\nHDR: HDR10\nHelligkeit: keine Angabe (typisch),  1.000cd/m\u00b2 (HDR)\nHerstellergarantie: zwei Jahre (Bring-In)\nHintergrundbeleuchtung: N/A\nKontrast - statisch: 1.500.000:1\nLeistungsaufnahme: 94W (maximal),  74W (typisch),  keine Angabe (Energielabel alt A+++ bis G),  0.5W (Standby)\nPanel: OLED (MLA-OLED),  META Technology\nPanel-Hersteller: LG Display (LW270AHQ-ERG1)\nReaktionszeit - GtG: 0.03ms\nScreen-to-Body-Ratio: 91.4% (berechnet)\nSeitenverh\u00e4ltnis: 16:9\nSignalfrequenz: keine Angabe (horizontal),  48-240Hz (vertikal)\nStromversorgung: DC-In (externes Netzteil)\nUSB-Hub In: 1x USB-B 3.0\nUSB-Hub Out: 2x USB-A 3.0\nUSB-Schreibweise: Link\nVESA: 100x100 (belegt)\nWeitere Anschl\u00fcsse: N/A",
    "reference_file": "offer_reference_679.json",
    "shop_name": "e-tec.at"
}