{
    "html_file": "offer_1730_7.html",
    "name": "Philips Gaming-Monitor E-line 242E1GAEZ, 23.8\"",
    "offer_link": "https://direkt.jacob.de/produkte/philips-242e1gaez-00-60-45cm-242e1gaez-00-artnr-6794820.html?utm_source=geizhals&utm_medium=cpc&utm_campaign=Preisvergleich&ref=103",
    "price": 168.06,
    "raw_specifications": {
        "Abmessungen (Breite x Tiefe x H\u00f6he)": "54 cm x 18.7 cm x 49.8 cm - mit Fu\u00df",
        "Abmessungen (Breite x Tiefe x H\u00f6he) - mit Fu\u00df": "54 cm x 18.7 cm x 49.8 cm",
        "Ausgangsleistung/Kanal": "3 Watt",
        "Besonderheiten": "sRGB-Farbmanagement, Bleifrei, SmartImage Game, Mega Dynamic Contrast Ratio, Low Blue Light Mode, flimmerfreie Technologie, ohne Quecksilber, Adaptive-Sync-Technologie, EasyRead, 96.1% NTSC-Farbskala (CIE 1976), 125.9% sRGB (CIE 1931) Farbskala",
        "Bildschirmbeschichtung": "Blendfrei, 3H Hard Coating, Haze 25 %",
        "Bildschirmtyp": "VA",
        "Blendentyp": "Flache Front",
        "Details zu Abmessungen & Gewicht": "Mit Standfu\u00df (h\u00f6chste Position) - Breite: 54 cm - Tiefe: 18.7 cm - H\u00f6he: 49.8 cm - Gewicht: 4.1 kg  Ohne Fu\u00df - Breite: 54 cm - Tiefe: 4.3 cm - H\u00f6he: 32.5 cm - Gewicht: 2.54 kg",
        "Diagonalabmessung": "61 cm (24\")",
        "Display-Typ": "LED-hintergrundbeleuchteter LCD-Monitor / TFT-Aktivmatrix",
        "ENERGY STAR zertifiziert": "Ja",
        "ENERGY STAR-Version": "8.0",
        "Eingangsanschl\u00fcsse": "HDMI, DisplayPort",
        "Einstellungen der Anzeigeposition": "H\u00f6he, Neigung",
        "Energie Effizienzklasse": "F",
        "Enthaltene Kabel": "1 x HDMI-Kabel  1 x DisplayPort-Kabel",
        "Erforderliche Netzspannung": "Wechselstrom 120/230 V (50/60 Hz)",
        "Farbe": "Schwarz/dunkles Chrom strukturiert",
        "Farbunterst\u00fctzung": "16,7 Millionen Farben",
        "Ger\u00e4tetyp": "LED-hintergrundbeleuchteter LCD-Monitor - 61 cm (24\")",
        "Gewicht": "4.1 kg",
        "Helligkeit": "350 cd/m\u00b2",
        "Hintergrundbeleuchtungs-Technologie": "WLED",
        "Horizontale Bildwiederholrate": "30 - 200 kHz",
        "Horizontaler Betrachtungswinkel": "178",
        "H\u00f6heneinstellung": "100 mm",
        "Kennzeichnung": "TUV GS, CB, TUV Ergo, RoHS, EPA, CU-EAC, EAEU RoHS",
        "Kontrast": "3500:1",
        "Leistungsaufnahme im Betrieb": "13.92 Watt",
        "Leistungsmerkmale": "Slot f\u00fcr Sicherheitsschloss (Kabelschloss getrennt erh\u00e4ltlich)",
        "MTBF": "50,000 Stunde(n)",
        "Max. Betriebstemperatur": "40 \u00b0C",
        "Min Betriebstemperatur": "0 \u00b0C",
        "Native Aufl\u00f6sung": "Full HD (1080p) 1920 x 1080 bei 144 Hz",
        "Neigungswinkel": "-5/+20",
        "OSD-Sprachen": "Multilingual",
        "Pixelpitch": "0.2745 mm",
        "Ppi": "93",
        "Produktbeschreibung": "Philips E-line 242E1GAEZ - LED-Monitor - Full HD (1080p) - 61 cm (24\")",
        "Reaktionszeit": "4 ms (Grau-zu-Grau); 1 ms (MPRT)",
        "Schlosstyp zur Diebstahlsicherung": "Kensington Slot",
        "Schnittstellen": "HDMI (HDCP)  DisplayPort  Audio Line-Out",
        "Seitenverh\u00e4ltnis": "16:9",
        "Sichtbare Bildfl\u00e4che": "60.5 cm (23.8\")",
        "Stromverbrauch (Aus-Modus)": "0.3 Watt",
        "Stromverbrauch im Standby-Modus": "0.5 Watt",
        "Transportbreite": "59 cm",
        "Transportgewicht": "6.55 kg",
        "Transporth\u00f6he": "57.1 cm",
        "Transporttiefe": "19.6 cm",
        "Typ": "Lautsprecher - Stereo",
        "Umweltschutzstandards": "ENERGY STAR-qualifiziert",
        "VESA-Halterung": "100 x 100 mm",
        "Vertikale Bildwiederholrate": "48 - 144 Hz",
        "Vertikaler Betrachtungswinkel": "178",
        "Zul\u00e4ssige Luftfeuchtigkeit im Betrieb": "20 - 80%"
    },
    "raw_specifications_text": "Produktbeschreibung: Philips E-line 242E1GAEZ - LED-Monitor - Full HD (1080p) - 61 cm (24\")\nGer\u00e4tetyp: LED-hintergrundbeleuchteter LCD-Monitor - 61 cm (24\")\nEnergie Effizienzklasse: F\nBildschirmtyp: VA\nSeitenverh\u00e4ltnis: 16:9\nNative Aufl\u00f6sung: Full HD (1080p) 1920 x 1080 bei 144 Hz\nPixelpitch: 0.2745 mm\nHelligkeit: 350 cd/m\u00b2\nKontrast: 3500:1\nReaktionszeit: 4 ms (Grau-zu-Grau); 1 ms (MPRT)\nFarbunterst\u00fctzung: 16,7 Millionen Farben\nEingangsanschl\u00fcsse: HDMI, DisplayPort\nEinstellungen der Anzeigeposition: H\u00f6he, Neigung\nBildschirmbeschichtung: Blendfrei, 3H Hard Coating, Haze 25 %\nFarbe: Schwarz/dunkles Chrom strukturiert\nAbmessungen (Breite x Tiefe x H\u00f6he) - mit Fu\u00df: 54 cm x 18.7 cm x 49.8 cm\nGewicht: 4.1 kg\nUmweltschutzstandards: ENERGY STAR-qualifiziert\nKennzeichnung: TUV GS, CB, TUV Ergo, RoHS, EPA, CU-EAC, EAEU RoHS\nDisplay-Typ: LED-hintergrundbeleuchteter LCD-Monitor / TFT-Aktivmatrix\nDiagonalabmessung: 61 cm (24\")\nSichtbare Bildfl\u00e4che: 60.5 cm (23.8\")\nPpi: 93\nVertikale Bildwiederholrate: 48 - 144 Hz\nHorizontale Bildwiederholrate: 30 - 200 kHz\nHorizontaler Betrachtungswinkel: 178\nVertikaler Betrachtungswinkel: 178\nHintergrundbeleuchtungs-Technologie: WLED\nOSD-Sprachen: Multilingual\nBlendentyp: Flache Front\nBesonderheiten: sRGB-Farbmanagement, Bleifrei, SmartImage Game, Mega Dynamic Contrast Ratio, Low Blue Light Mode, flimmerfreie Technologie, ohne Quecksilber, Adaptive-Sync-Technologie, EasyRead, 96.1% NTSC-Farbskala (CIE 1976), 125.9% sRGB (CIE 1931) Farbskala\nAbmessungen (Breite x Tiefe x H\u00f6he): 54 cm x 18.7 cm x 49.8 cm - mit Fu\u00df\nTyp: Lautsprecher - Stereo\nAusgangsleistung/Kanal: 3 Watt\nSchnittstellen: HDMI (HDCP)  DisplayPort  Audio Line-Out\nNeigungswinkel: -5/+20\nH\u00f6heneinstellung: 100 mm\nVESA-Halterung: 100 x 100 mm\nLeistungsmerkmale: Slot f\u00fcr Sicherheitsschloss (Kabelschloss getrennt erh\u00e4ltlich)\nEnthaltene Kabel: 1 x HDMI-Kabel  1 x DisplayPort-Kabel\nMTBF: 50,000 Stunde(n)\nSchlosstyp zur Diebstahlsicherung: Kensington Slot\nErforderliche Netzspannung: Wechselstrom 120/230 V (50/60 Hz)\nLeistungsaufnahme im Betrieb: 13.92 Watt\nStromverbrauch im Standby-Modus: 0.5 Watt\nStromverbrauch (Aus-Modus): 0.3 Watt\nDetails zu Abmessungen & Gewicht: Mit Standfu\u00df (h\u00f6chste Position) - Breite: 54 cm - Tiefe: 18.7 cm - H\u00f6he: 49.8 cm - Gewicht: 4.1 kg  Ohne Fu\u00df - Breite: 54 cm - Tiefe: 4.3 cm - H\u00f6he: 32.5 cm - Gewicht: 2.54 kg\nTransportbreite: 59 cm\nTransporttiefe: 19.6 cm\nTransporth\u00f6he: 57.1 cm\nTransportgewicht: 6.55 kg\nENERGY STAR zertifiziert: Ja\nENERGY STAR-Version: 8.0\nMin Betriebstemperatur: 0 \u00b0C\nMax. Betriebstemperatur: 40 \u00b0C\nZul\u00e4ssige Luftfeuchtigkeit im Betrieb: 20 - 80%",
    "reference_file": "offer_reference_1730.json",
    "shop_name": "Jacob Elektronik direkt (AT)"
}