{
    "html_file": "offer_1863_18.html",
    "name": "LG 24BN650Y-B, 23.8\"",
    "offer_link": "https://www.proshop.at/Bildschirm/LG-24-Bildschirm-24BN650Y-B-Black-5-ms/2862123?utm_source=geizhals&utm_medium=cpc&utm_campaign=pricesite",
    "price": 203.18,
    "raw_specifications": {
        "Abmessungen (Breite x Tiefe x H\u00f6he)": "53.94 cm x 24 cm x 50.56 cm - mit Fu\u00df",
        "Abmessungen (Breite x Tiefe x H\u00f6he) - mit Fu\u00df": "53.94 cm x 24 cm x 50.56 cm",
        "Ausgangsleistung/Kanal": "2 Watt",
        "Besonderheiten": "SUPER + Resolution, Multiscan Support, Flicker Safe, Reader Mode, Intelligente Energiespartechnologie, Color Calibrated, Black Stabilizer, DAS Mode (Dynamic Action Sync), My Display Preset, Mega DFC, One Click Stand, 3 Side Borderless Design, 6-Achsen-Farbkontrolle",
        "Bildschirmbeschichtung": "Blendfrei, 3H Hard Coating, Haze 25 %",
        "Bildschirmtyp": "IPS",
        "Details zu Abmessungen & Gewicht": "Mit Fu\u00df - Breite: 53.94 cm - Tiefe: 24 cm - H\u00f6he: 50.56 cm - Gewicht: 5.7 kg  Ohne Fu\u00df - Breite: 53.94 cm - Tiefe: 5.18 cm - H\u00f6he: 32.64 cm - Gewicht: 3.5 kg",
        "Diagonalabmessung": "61 cm (24\")",
        "Display-Typ": "LED-hintergrundbeleuchteter LCD-Monitor / TFT-Aktivmatrix",
        "EAN": "8806098738298",
        "Eingangsanschl\u00fcsse": "HDMI, DVI-D, DisplayPort",
        "Eingangsspannung": "Wechselstrom 100-240 V (50/60 Hz)",
        "Einstellungen der Anzeigeposition": "H\u00f6he, Pivot (Rotation), Drehung, Neigung",
        "Energie Effizienzklasse": "Klasse F",
        "Enthaltene Kabel": "1 x DisplayPort-Kabel - 1.8 m",
        "Farbe": "Mattschwarz",
        "Farbraum": "72% NTSC (CIE 1931)",
        "Ger\u00e4tetyp": "LED-hintergrundbeleuchteter LCD-Monitor - 61 cm (24\")",
        "Gewicht": "5.7 kg",
        "Helligkeit": "250 cd/m\u00b2",
        "Hersteller": "LG",
        "Hintergrundbeleuchtungs-Technologie": "WLED",
        "Horizontale Bildwiederholrate": "50 - 61 kHz",
        "Horizontaler Betrachtungswinkel": "178",
        "H\u00f6heneinstellung": "130 mm",
        "Integrierte Peripherieger\u00e4te": "USB 3.0-Hub",
        "Kennzeichnung": "Plug and Play, FCC Klasse B bescheinigt, UL, TUV GS, CB, TUV Ergo, DDC/CI, RoHS, REACH, ERP, DIN ISO EN 9241-307, quecksilberfrei",
        "Kontrast": "1000:1",
        "Leistungsaufnahme im Ein-Zustand": "18.7 W",
        "Leistungsmerkmale": "Slot f\u00fcr Sicherheitsschloss (Kabelschloss getrennt erh\u00e4ltlich)",
        "Mitgelieferte Software": "LG On-Screen Control",
        "Modell": "24BN650Y-B.AEU",
        "Native Aufl\u00f6sung": "Full HD (1080p) 1920 x 1080 bei 75 Hz",
        "Neigungswinkel": "-5/+35",
        "OSD-Sprachen": "Deutsch, Franz\u00f6sisch, Italienisch, Portugiesisch, Polnisch, Finnisch, Schwedisch, Russisch, Spanisch, Griechisch, Japanisch, Chinesisch, Koreanisch, UK English",
        "Pixelpitch": "0.2745 mm",
        "Produktbeschreibung": "LG 24BN650Y-B - LED-Monitor - Full HD (1080p) - 61 cm (24\")",
        "Reaktionszeit": "5 ms (Gray-to-Gray)",
        "Rotationswinkel": "355",
        "Schlosstyp zur Diebstahlsicherung": "Kensington Slot",
        "Schnittstellen": "DVI-D  HDMI  DisplayPort 1.2  USB 3.0 Upstream (Typ B)  2 x USB 3.0 Downstream  Audio Line-Out  Audio Line-In",
        "Seitenverh\u00e4ltnis": "16:9",
        "Sichtbare Bildfl\u00e4che": "60.4 cm (23.8\")",
        "Spannung": "Wechselstrom 100-240 V (50/60 Hz)",
        "Stromverbrauch (Aus-Modus)": "0.3 Watt",
        "Stromverbrauch (typisch)": "13.95 Watt",
        "Stromverbrauch SDR (eingeschaltet)": "18.7 kWh/1.000 h",
        "Stromverbrauch im Standby-Modus": "0.3 Watt",
        "TCO-zertifiziert": "TCO Certified Displays 9",
        "Typ": "Lautsprecher - Stereo",
        "Umweltschutzstandards": "TCO Certified Displays 9",
        "VESA-Halterung": "100 mm",
        "Vertikale Bildwiederholrate": "56 - 75 Hz",
        "Vertikaler Betrachtungswinkel": "178",
        "Waren-Nr.": "2862123",
        "Zum Hersteller": "www.lge.com"
    },
    "raw_specifications_text": "Hersteller: LG\nWaren-Nr.: 2862123\nModell: 24BN650Y-B.AEU\nEAN: 8806098738298\nZum Hersteller: www.lge.com\nProduktbeschreibung: LG 24BN650Y-B - LED-Monitor - Full HD (1080p) - 61 cm (24\")\nGer\u00e4tetyp: LED-hintergrundbeleuchteter LCD-Monitor - 61 cm (24\")\nEnergie Effizienzklasse: Klasse F\nLeistungsaufnahme im Ein-Zustand: 18.7 W\nLeistungsmerkmale: Slot f\u00fcr Sicherheitsschloss (Kabelschloss getrennt erh\u00e4ltlich)\nBildschirmtyp: IPS\nSeitenverh\u00e4ltnis: 16:9\nNative Aufl\u00f6sung: Full HD (1080p) 1920 x 1080 bei 75 Hz\nPixelpitch: 0.2745 mm\nHelligkeit: 250 cd/m\u00b2\nKontrast: 1000:1\nReaktionszeit: 5 ms (Gray-to-Gray)\nFarbraum: 72% NTSC (CIE 1931)\nEingangsanschl\u00fcsse: HDMI, DVI-D, DisplayPort\nEinstellungen der Anzeigeposition: H\u00f6he, Pivot (Rotation), Drehung, Neigung\nBildschirmbeschichtung: Blendfrei, 3H Hard Coating, Haze 25 %\nSpannung: Wechselstrom 100-240 V (50/60 Hz)\nFarbe: Mattschwarz\nAbmessungen (Breite x Tiefe x H\u00f6he) - mit Fu\u00df: 53.94 cm x 24 cm x 50.56 cm\nGewicht: 5.7 kg\nUmweltschutzstandards: TCO Certified Displays 9\nKennzeichnung: Plug and Play, FCC Klasse B bescheinigt, UL, TUV GS, CB, TUV Ergo, DDC/CI, RoHS, REACH, ERP, DIN ISO EN 9241-307, quecksilberfrei\nDisplay-Typ: LED-hintergrundbeleuchteter LCD-Monitor / TFT-Aktivmatrix\nDiagonalabmessung: 61 cm (24\")\nSichtbare Bildfl\u00e4che: 60.4 cm (23.8\")\nIntegrierte Peripherieger\u00e4te: USB 3.0-Hub\nVertikale Bildwiederholrate: 56 - 75 Hz\nHorizontale Bildwiederholrate: 50 - 61 kHz\nHorizontaler Betrachtungswinkel: 178\nVertikaler Betrachtungswinkel: 178\nHintergrundbeleuchtungs-Technologie: WLED\nOSD-Sprachen: Deutsch, Franz\u00f6sisch, Italienisch, Portugiesisch, Polnisch, Finnisch, Schwedisch, Russisch, Spanisch, Griechisch, Japanisch, Chinesisch, Koreanisch, UK English\nBesonderheiten: SUPER + Resolution, Multiscan Support, Flicker Safe, Reader Mode, Intelligente Energiespartechnologie, Color Calibrated, Black Stabilizer, DAS Mode (Dynamic Action Sync), My Display Preset, Mega DFC, One Click Stand, 3 Side Borderless Design, 6-Achsen-Farbkontrolle\nAbmessungen (Breite x Tiefe x H\u00f6he): 53.94 cm x 24 cm x 50.56 cm - mit Fu\u00df\nTyp: Lautsprecher - Stereo\nAusgangsleistung/Kanal: 2 Watt\nSchnittstellen: DVI-D  HDMI  DisplayPort 1.2  USB 3.0 Upstream (Typ B)  2 x USB 3.0 Downstream  Audio Line-Out  Audio Line-In\nNeigungswinkel: -5/+35\nRotationswinkel: 355\nH\u00f6heneinstellung: 130 mm\nVESA-Halterung: 100 mm\nEnthaltene Kabel: 1 x DisplayPort-Kabel - 1.8 m\nSchlosstyp zur Diebstahlsicherung: Kensington Slot\nEingangsspannung: Wechselstrom 100-240 V (50/60 Hz)\nStromverbrauch SDR (eingeschaltet): 18.7 kWh/1.000 h\nStromverbrauch (typisch): 13.95 Watt\nStromverbrauch im Standby-Modus: 0.3 Watt\nStromverbrauch (Aus-Modus): 0.3 Watt\nMitgelieferte Software: LG On-Screen Control\nDetails zu Abmessungen & Gewicht: Mit Fu\u00df - Breite: 53.94 cm - Tiefe: 24 cm - H\u00f6he: 50.56 cm - Gewicht: 5.7 kg  Ohne Fu\u00df - Breite: 53.94 cm - Tiefe: 5.18 cm - H\u00f6he: 32.64 cm - Gewicht: 3.5 kg\nTCO-zertifiziert: TCO Certified Displays 9",
    "reference_file": "offer_reference_1863.json",
    "shop_name": "Proshop.at"
}