{
    "html_file": "offer_2206_18.html",
    "name": "BenQ BL2381T, 22.5\"",
    "offer_link": "https://www.1ashop.at/de/produkt/9796/benq-bl2381t-22-5-1920x1200-lautsprecher-vga-dvi-hdmi-dp.html",
    "price": 184.51,
    "raw_specifications": {
        "Abmessungen (Breite x Tiefe x H\u00f6he)": "50.2 cm x 5.7 cm x 34.2 cm - ohne Fu\u00df",
        "Ausgangsleistung/Kanal": "1 Watt",
        "Besonderheiten": "Eco-Mode, AMA-Technologie (Advanced Motion Accelerator), Spielmodus, Low Blue Light Mode, flimmerfreie Technologie, ecoFACTS Label, schmaler Rahmen, Color Weakness Mode, breiter Betrachtungswinkel, Movie Mode, sRGB Mode, Eye-Care Technology, Brightness Intelligence Technology, Photo Mode, 72 % NTSC Farbraum",
        "Bildschirmbeschichtung": "Blendfrei",
        "Bildschirmtyp": "IPS",
        "Details zu Abmessungen & Gewicht": "Ohne Fu\u00df - Breite: 50.2 cm - Tiefe: 5.7 cm - H\u00f6he: 34.2 cm - Gewicht: 3.26 kg  Mit Standfu\u00df (h\u00f6chste Position) - Breite: 50.2 cm - Tiefe: 23 cm - H\u00f6he: 52.8 cm - Gewicht: 5.9 kg  Mit Standfu\u00df (niedrigste Position) - Breite: 50.2 cm - Tiefe: 23 cm - H\u00f6he: 42.8 cm - Gewicht: 5.9 kg",
        "Diagonalabmessung": "57.2 cm (22.5\")",
        "Display-Typ": "LED-hintergrundbeleuchteter LCD-Monitor / TFT-Aktivmatrix",
        "EAN/UPC": "4718755077180",
        "ENERGY STAR zertifiziert": "Ja",
        "ENERGY STAR-Version": "7",
        "Eingangsspannung": "Wechselstrom 120/230 V",
        "Einstellungen der Anzeigeposition": "H\u00f6he, Pivot (Rotation), Drehung, Neigung",
        "Energie Effizienzklasse": "Klasse E",
        "Energierverbrauch Sleep": "0.5 Watt",
        "Energieverbrauch pro Jahr": "27 kWh",
        "Erforderliches Betriebssystem": "Microsoft Windows 7, Windows 8, Windows 8.1, Windows 10",
        "Farbe": "Schwarz",
        "Farbraum": "72% NTSC",
        "Farbtemperatur": "9300K, 6500K, 5700K",
        "Farbunterst\u00fctzung": "16,7 Millionen Farben",
        "Gewicht": "3.26 kg",
        "Gruppe": "TFTs",
        "Helligkeit": "250 cd/m\u00b2",
        "Hersteller": "BenQ",
        "Hersteller Art. Nr.": "9H.LHMLA.TBE",
        "Hintergrundbeleuchtungs-Technologie": "LED-Hintergrundbeleuchtung",
        "Horizontaler Betrachtungswinkel": "178",
        "H\u00f6heneinstellung": "140 mm",
        "Kennzeichnung": "TUV Rheinland, DisplayPort 1.2, HDCP 1.4",
        "Kontrast": "1000:1 / 20000000:1 (dynamisch)",
        "Leistungsaufnahme im Ein-Zustand": "14.6 W",
        "Native Aufl\u00f6sung": "WUXGA 1920 x 1200",
        "Neigungswinkel": "-5/+20",
        "OSD-Sprachen": "Ungarisch, Tschechisch, Chinesisch (vereinfacht), Englisch, Deutsch, Franz\u00f6sisch, Italienisch, Portugiesisch, Polnisch, Schwedisch, Russisch, Spanisch, Holl\u00e4ndisch, Arabisch, Rum\u00e4nisch, Japanisch, Chinesisch, Koreanisch",
        "Pixelpitch": "0.254 mm",
        "Ppi": "101",
        "Reaktionszeit": "5 ms (Gray-to-Gray)",
        "Rotationswinkel": "90",
        "Schnittstellen": "VGA  HDMI  Audio Line-In  Kopfh\u00f6rer  DisplayPort  DVI-D",
        "Schwenkwinkel": "90",
        "Seitenverh\u00e4ltnis": "16:10",
        "Stromverbrauch (typisch)": "52 Watt",
        "Stromverbrauch SDR (eingeschaltet)": "14.6 kWh/1.000 h",
        "Stromverbrauch im Standby-Modus": "0.5 Watt",
        "TCO-zertifiziert": "TCO Certified Displays 7",
        "Transportgewicht": "6.3 kg",
        "Typ": "Lautsprecher - Stereo",
        "VESA-Halterung": "100 x 100 mm",
        "Vertikaler Betrachtungswinkel": "178"
    },
    "raw_specifications_text": "Gruppe: TFTs\nHersteller: BenQ\nHersteller Art. Nr.: 9H.LHMLA.TBE\nEAN/UPC: 4718755077180\nDisplay-Typ: LED-hintergrundbeleuchteter LCD-Monitor / TFT-Aktivmatrix\nEnergieverbrauch pro Jahr: 27 kWh\nDiagonalabmessung: 57.2 cm (22.5\")\nBildschirmtyp: IPS\nEnergie Effizienzklasse: Klasse E\nSeitenverh\u00e4ltnis: 16:10\nNative Aufl\u00f6sung: WUXGA 1920 x 1200\nPixelpitch: 0.254 mm\nPpi: 101\nHelligkeit: 250 cd/m\u00b2\nKontrast: 1000:1 / 20000000:1 (dynamisch)\nFarbunterst\u00fctzung: 16,7 Millionen Farben\nReaktionszeit: 5 ms (Gray-to-Gray)\nHorizontaler Betrachtungswinkel: 178\nVertikaler Betrachtungswinkel: 178\nBildschirmbeschichtung: Blendfrei\nHintergrundbeleuchtungs-Technologie: LED-Hintergrundbeleuchtung\nFarbtemperatur: 9300K, 6500K, 5700K\nFarbraum: 72% NTSC\nOSD-Sprachen: Ungarisch, Tschechisch, Chinesisch (vereinfacht), Englisch, Deutsch, Franz\u00f6sisch, Italienisch, Portugiesisch, Polnisch, Schwedisch, Russisch, Spanisch, Holl\u00e4ndisch, Arabisch, Rum\u00e4nisch, Japanisch, Chinesisch, Koreanisch\nFarbe: Schwarz\nAbmessungen (Breite x Tiefe x H\u00f6he): 50.2 cm x 5.7 cm x 34.2 cm - ohne Fu\u00df\nGewicht: 3.26 kg\nBesonderheiten: Eco-Mode, AMA-Technologie (Advanced Motion Accelerator), Spielmodus, Low Blue Light Mode, flimmerfreie Technologie, ecoFACTS Label, schmaler Rahmen, Color Weakness Mode, breiter Betrachtungswinkel, Movie Mode, sRGB Mode, Eye-Care Technology, Brightness Intelligence Technology, Photo Mode, 72 % NTSC Farbraum\nStromverbrauch im Standby-Modus: 0.5 Watt\nEnergierverbrauch Sleep: 0.5 Watt\nEingangsspannung: Wechselstrom 120/230 V\nLeistungsaufnahme im Ein-Zustand: 14.6 W\nStromverbrauch SDR (eingeschaltet): 14.6 kWh/1.000 h\nStromverbrauch (typisch): 52 Watt\nErforderliches Betriebssystem: Microsoft Windows 7, Windows 8, Windows 8.1, Windows 10\nSchnittstellen: VGA  HDMI  Audio Line-In  Kopfh\u00f6rer  DisplayPort  DVI-D\nTyp: Lautsprecher - Stereo\nAusgangsleistung/Kanal: 1 Watt\nNeigungswinkel: -5/+20\nSchwenkwinkel: 90\nRotationswinkel: 90\nH\u00f6heneinstellung: 140 mm\nEinstellungen der Anzeigeposition: H\u00f6he, Pivot (Rotation), Drehung, Neigung\nVESA-Halterung: 100 x 100 mm\nKennzeichnung: TUV Rheinland, DisplayPort 1.2, HDCP 1.4\nDetails zu Abmessungen & Gewicht: Ohne Fu\u00df - Breite: 50.2 cm - Tiefe: 5.7 cm - H\u00f6he: 34.2 cm - Gewicht: 3.26 kg  Mit Standfu\u00df (h\u00f6chste Position) - Breite: 50.2 cm - Tiefe: 23 cm - H\u00f6he: 52.8 cm - Gewicht: 5.9 kg  Mit Standfu\u00df (niedrigste Position) - Breite: 50.2 cm - Tiefe: 23 cm - H\u00f6he: 42.8 cm - Gewicht: 5.9 kg\nTransportgewicht: 6.3 kg\nENERGY STAR zertifiziert: Ja\nENERGY STAR-Version: 7\nTCO-zertifiziert: TCO Certified Displays 7",
    "reference_file": "offer_reference_2206.json",
    "shop_name": "1ashop.at"
}