{
    "html_file": "offer_2504_9.html",
    "name": "AOC M2470SWH, 23.6\"",
    "offer_link": "https://www.mylemon.at/artikel/aoc/m2470swh/dis-23-6-m2470swh.html",
    "price": 98.74,
    "raw_specifications": {
        "3D": "Nein",
        "AC Eingangsfrequenz": "50 - 60 Hz",
        "AC Eingangsspannung": "100 - 240 V",
        "AMD FreeSync": "Nein",
        "Abnehmbarer Standfu\u00df": "Ja",
        "Anzahl HDMI-Anschl\u00fcsse": "2",
        "Anzahl OSD-Sprachen": "16",
        "Anzahl VGA (D-Sub) Anschl\u00fcsse": "1",
        "Anzahl der Farben des Displays": "16,7 Millionen Farben",
        "Anzahl der Lautsprecher": "2",
        "Artikelnummer": "MDDY9EL",
        "Aufl\u00f6sung": "1920x1080",
        "Au\u00dfenverkleidungstyp": "Texturiert",
        "Besonderheiten": "USB HUB",
        "Bildschirmdiagonale": "59,9 cm (23.6 Zoll)",
        "Bildschirmdiagonale (cm)": "59,944 cm",
        "Bildschirmform": "Flach",
        "Bildschirmtechnologie": "LED",
        "Bildwinkel, horizontal": "178\u00b0",
        "Bildwinkel, vertikal": "178\u00b0",
        "Breite (ohne Standfu\u00df)": "55,1 cm",
        "DVI Anschluss": "Nein",
        "Digital horizontale Frequenz": "30 - 83 kHz",
        "Digital vertikale Frequenz": "50 - 76 Hz",
        "Display-Aufl\u00f6sung": "1920 x 1080 Pixel",
        "Displaygr\u00f6\u00dfe": "23,6 Zoll",
        "EAN": "4038986144995",
        "Eingebaute Lautsprecher": "Ja",
        "Energieeffizienzklasse (SDR)": "F",
        "Energieeffizienzskala": "A bis G",
        "Energieverbrauch (SDR) pro 1.000 Stunden": "20 kWh",
        "Externes Netzteil": "Nein",
        "Ger\u00e4tebreite (inkl. Fu\u00df)": "551,4 mm",
        "Ger\u00e4teh\u00f6he (inkl. Fu\u00df)": "400,4 mm",
        "Ger\u00e4tetiefe (inkl. Fu\u00df)": "221 mm",
        "Gewicht (mit St\u00e4nder)": "3,58 kg",
        "HD-Typ": "Full HD",
        "HDCP": "Ja",
        "HDMI-Kabell\u00e4nge": "1,5 m",
        "HDMI-Version": "1.4",
        "Helligkeit": "250 cd/m\u00b2",
        "Helligkeit (typisch)": "250 cd/m\u00b2",
        "Hersteller Artikelnummer": "M2470SWH",
        "Horizontaler Scanbereich": "30 - 83 kHz",
        "H\u00f6he (ohne Standfu\u00df)": "39,7 cm",
        "H\u00f6henverstellung": "Nein",
        "Integrierte Kamera": "Nein",
        "Integrierter USB-Hub": "Nein",
        "Kabelsperre-Slot": "Ja",
        "Kontrastverh\u00e4ltnis": "3000:1",
        "Kontrastverh\u00e4ltnis (dynamisch)": "50000000:1",
        "Kopfh\u00f6rer-Anschluss": "3,5 mm",
        "Kopfh\u00f6rerausgang": "Ja",
        "Kopfh\u00f6rerausg\u00e4nge": "1",
        "Lichteffekte": "Nein",
        "Marktpositionierung": "Haus",
        "Maximale Bildwiederholrate": "60 Hz",
        "Men\u00fcsprachen": "Vereinfachtes Chinesisch, Traditionelles Chinesisch, Kroatisch, Tschechisch, Deutsch, Niederl\u00e4ndisch, Englisch, Spanisch, Finnisch, Franz\u00f6sisch, Italienisch, Japanisch, Koreanisch, Polnisch, Portugiesisch, Russisch, Schwedisch, T\u00fcrkisch, Ukrainisch",
        "Mitgelieferte Kabel": "AC, HDMI, VGA",
        "Mittlere Betriebsdauer zwischen Ausf\u00e4llen (MTBF)": "50000 h",
        "Mobile High-Definition Link (MHL)": "Nein",
        "NVIDIA G-SYNC": "Nein",
        "Nachhaltigkeitszertifikate": "RoHS, EPEAT Silver, ENERGY STAR",
        "Natives Seitenverh\u00e4ltnis": "16:9",
        "Neigungsverstellung": "Ja",
        "Neigungswinkelbereich": "-5 - 25\u00b0",
        "Oberfl\u00e4chenh\u00e4rte": "3H",
        "On-Screen-Display (OSD)": "Ja",
        "Paketgewicht": "5,21 kg",
        "Panel": "MVA",
        "Panel-Montage-Schnittstelle": "100 x 100 mm",
        "Panel-Typ": "MVA",
        "Pivot": "Ja",
        "Pixel Abstand": "0,2715 x 0,2715 mm",
        "Pixel-Frequenz": "165 MHz",
        "Plug & Play": "Ja",
        "Produktfarbe": "Schwarz",
        "RMS-Leistung": "2 W",
        "Reaktionszeit": "5 ms",
        "Recycelbares Verpackungsmaterial": "100%",
        "Schwenkbar": "Nein",
        "Schwermetallfrei": "Hg (Quecksilber)",
        "Seitenverh\u00e4ltnis": "16:9",
        "Sichtbare Gr\u00f6\u00dfe (horizontal)": "52,1 cm",
        "Sichtbare Gr\u00f6\u00dfe (vertikal)": "29,3 cm",
        "Slot-Typ Kabelsperre": "Kensington",
        "Stromeingang": "Ja",
        "Stromkabell\u00e4nge": "1,2 m",
        "Stromverbrauch (Standardbetrieb)": "17,96 W",
        "Stromverbrauch (Standby)": "0,37 W",
        "Stromverbrauch (aus)": "0,19 W",
        "St\u00e4nder enthalten": "Ja",
        "TV Tuner integriert": "Nein",
        "Tiefe (ohne Standfu\u00df)": "7,82 cm",
        "Touchscreen": "Nein",
        "Typ der Hintergrundbeleuchtung": "W-LED",
        "Typ der L\u00fcnettendicke": "Normal",
        "Unterst\u00fctzte Grafik-Aufl\u00f6sungen": "1920 x 1080 (HD 1080)",
        "Unterst\u00fctzte Video-Modi": "1080p",
        "VESA Halterung": "100x100 mm",
        "VESA-Halterung": "Ja",
        "VGA-Kabell\u00e4nge": "1,2 m",
        "Verpackungsart": "Box",
        "Verpackungsbreite": "620 mm",
        "Verpackungsh\u00f6he": "127 mm",
        "Verpackungstiefe": "435 mm",
        "Vertikaler Scanbereich": "50 - 76 Hz",
        "Video Anschl\u00fcsse": "1x VGA, 2x HDMI",
        "Vorderer Rahmen": "Schwarz",
        "Warentarifnummer (HS)": "85285210",
        "Zertifizierung": "True"
    },
    "raw_specifications_text": "Displaygr\u00f6\u00dfe: 23,6 Zoll\nAufl\u00f6sung: 1920x1080\nPanel: MVA\nReaktionszeit: 5 ms\nVideo Anschl\u00fcsse: 1x VGA, 2x HDMI\nVESA Halterung: 100x100 mm\nHelligkeit: 250 cd/m\u00b2\nBesonderheiten: USB HUB\nHersteller Artikelnummer: M2470SWH\nEAN: 4038986144995\nArtikelnummer: MDDY9EL\nBildschirmdiagonale: 59,9 cm (23.6 Zoll)\nDisplay-Aufl\u00f6sung: 1920 x 1080 Pixel\nNatives Seitenverh\u00e4ltnis: 16:9\nBildschirmtechnologie: LED\nTouchscreen: Nein\nHD-Typ: Full HD\nPanel-Typ: MVA\nBildschirmform: Flach\nKontrastverh\u00e4ltnis: 3000:1\nMaximale Bildwiederholrate: 60 Hz\nAnzahl der Farben des Displays: 16,7 Millionen Farben\nTyp der Hintergrundbeleuchtung: W-LED\nHelligkeit (typisch): 250 cd/m\u00b2\nUnterst\u00fctzte Grafik-Aufl\u00f6sungen: 1920 x 1080 (HD 1080)\nUnterst\u00fctzte Video-Modi: 1080p\nSeitenverh\u00e4ltnis: 16:9\nKontrastverh\u00e4ltnis (dynamisch): 50000000:1\nBildwinkel, horizontal: 178\u00b0\nBildwinkel, vertikal: 178\u00b0\nPixel Abstand: 0,2715 x 0,2715 mm\nHorizontaler Scanbereich: 30 - 83 kHz\nVertikaler Scanbereich: 50 - 76 Hz\nSichtbare Gr\u00f6\u00dfe (horizontal): 52,1 cm\nSichtbare Gr\u00f6\u00dfe (vertikal): 29,3 cm\nDigital horizontale Frequenz: 30 - 83 kHz\nDigital vertikale Frequenz: 50 - 76 Hz\nBildschirmdiagonale (cm): 59,944 cm\nOberfl\u00e4chenh\u00e4rte: 3H\n3D: Nein\nPixel-Frequenz: 165 MHz\nNVIDIA G-SYNC: Nein\nAMD FreeSync: Nein\nEingebaute Lautsprecher: Ja\nIntegrierte Kamera: Nein\nAnzahl der Lautsprecher: 2\nRMS-Leistung: 2 W\nMarktpositionierung: Haus\nProduktfarbe: Schwarz\nVorderer Rahmen: Schwarz\nAbnehmbarer Standfu\u00df: Ja\nSchwermetallfrei: Hg (Quecksilber)\nZertifizierung: True\nIntegrierter USB-Hub: Nein\nKopfh\u00f6rerausgang: Ja\nAnzahl VGA (D-Sub) Anschl\u00fcsse: 1\nDVI Anschluss: Nein\nAnzahl HDMI-Anschl\u00fcsse: 2\nHDMI-Version: 1.4\nKopfh\u00f6rerausg\u00e4nge: 1\nKopfh\u00f6rer-Anschluss: 3,5 mm\nHDCP: Ja\nStromeingang: Ja\nMobile High-Definition Link (MHL): Nein\nVESA-Halterung: Ja\nKabelsperre-Slot: Ja\nH\u00f6henverstellung: Nein\nPanel-Montage-Schnittstelle: 100 x 100 mm\nSlot-Typ Kabelsperre: Kensington\nPivot: Ja\nSchwenkbar: Nein\nNeigungswinkelbereich: -5 - 25\u00b0\nOn-Screen-Display (OSD): Ja\nMen\u00fcsprachen: Vereinfachtes Chinesisch, Traditionelles Chinesisch, Kroatisch, Tschechisch, Deutsch, Niederl\u00e4ndisch, Englisch, Spanisch, Finnisch, Franz\u00f6sisch, Italienisch, Japanisch, Koreanisch, Polnisch, Portugiesisch, Russisch, Schwedisch, T\u00fcrkisch, Ukrainisch\nAnzahl OSD-Sprachen: 16\nPlug & Play: Ja\nNeigungsverstellung: Ja\nEnergieeffizienzklasse (SDR): F\nEnergieverbrauch (SDR) pro 1.000 Stunden: 20 kWh\nStromverbrauch (Standardbetrieb): 17,96 W\nStromverbrauch (Standby): 0,37 W\nStromverbrauch (aus): 0,19 W\nAC Eingangsspannung: 100 - 240 V\nAC Eingangsfrequenz: 50 - 60 Hz\nEnergieeffizienzskala: A bis G\nExternes Netzteil: Nein\nSt\u00e4nder enthalten: Ja\nMitgelieferte Kabel: AC, HDMI, VGA\nHDMI-Kabell\u00e4nge: 1,5 m\nStromkabell\u00e4nge: 1,2 m\nGer\u00e4tebreite (inkl. Fu\u00df): 551,4 mm\nGer\u00e4tetiefe (inkl. Fu\u00df): 221 mm\nGer\u00e4teh\u00f6he (inkl. Fu\u00df): 400,4 mm\nGewicht (mit St\u00e4nder): 3,58 kg\nBreite (ohne Standfu\u00df): 55,1 cm\nTiefe (ohne Standfu\u00df): 7,82 cm\nH\u00f6he (ohne Standfu\u00df): 39,7 cm\nVerpackungsbreite: 620 mm\nVerpackungstiefe: 435 mm\nVerpackungsh\u00f6he: 127 mm\nPaketgewicht: 5,21 kg\nVerpackungsart: Box\nVGA-Kabell\u00e4nge: 1,2 m\nNachhaltigkeitszertifikate: RoHS, EPEAT Silver, ENERGY STAR\nWarentarifnummer (HS): 85285210\nTV Tuner integriert: Nein\nAu\u00dfenverkleidungstyp: Texturiert\nRecycelbares Verpackungsmaterial: 100%\nTyp der L\u00fcnettendicke: Normal\nMittlere Betriebsdauer zwischen Ausf\u00e4llen (MTBF): 50000 h\nLichteffekte: Nein",
    "reference_file": "offer_reference_2504.json",
    "shop_name": "mylemon.at"
}