{
    "html_file": "offer_2357_26.html",
    "name": "BenQ BL2780, 27\"",
    "offer_link": "https://www.electronicshop24.at/product_info.php?products_id=140000000284394289&ano=R284394289&mno=9H.LGXLA.CPE&ean=4718755072260&utm_medium=cpc&utm_campaign=preisvergleich&utm_content=item&utm_source=geizhals&ref=geizhals",
    "price": 153.0,
    "raw_specifications": {
        "Abmessungen (Breite x Tiefe x H\u00f6he)": "61.2 cm x 18.3 cm x 46.3 cm - mit Fu\u00df",
        "Ausgangsleistung/Kanal": "2 Watt",
        "Besonderheiten": "Abdeckung f\u00fcr Kabelf\u00fchrung, HDCP, AMA-Technologie (Advanced Motion Accelerator), Low Blue Light Mode, schmaler Rahmen, Eye-Care Technology, Brightness Intelligence Technology, an 3 Seiten ohne Blende, 72 % NTSC Farbraum",
        "Bildschirmtyp": "IPS",
        "Details zu Abmessungen & Gewicht": "Ohne Fu\u00df - Gewicht: 3.92 kg",
        "Diagonalabmessung": "68.6 cm (27\")",
        "Display-Typ": "LED-hintergrundbeleuchteter LCD-Monitor / TFT-Aktivmatrix",
        "Eingangsspannung": "AC 90 - 264 V",
        "Einstellungen der Anzeigeposition": "Neigung",
        "Energie Effizienzklasse": "Klasse E",
        "Farbe": "Schwarz",
        "Farbraum": "72% NTSC",
        "Farbunterst\u00fctzung": "16,7 Millionen Farben",
        "Gewicht": "4.85 kg",
        "Helligkeit": "250 cd/m\u00b2",
        "Hintergrundbeleuchtungs-Technologie": "LED-Hintergrundbeleuchtung",
        "Horizontaler Betrachtungswinkel": "178",
        "Kennzeichnung": "HDCP 1.4",
        "Kontrast": "1000:1",
        "Leistungsaufnahme im Ein-Zustand": "19.2 W",
        "Native Aufl\u00f6sung": "Full HD (1080p) 1920 x 1080",
        "Neigungswinkel": "-5/+20",
        "OSD-Sprachen": "Ungarisch, Tschechisch, Chinesisch (vereinfacht), Englisch, Deutsch, Franz\u00f6sisch, Italienisch, Portugiesisch, Polnisch, Schwedisch, Russisch, Spanisch, Holl\u00e4ndisch, Arabisch, Rum\u00e4nisch, Japanisch, Chinesisch, Koreanisch",
        "Pixelpitch": "0.311 mm",
        "Reaktionszeit": "5 ms",
        "Schnittstellen": "VGA \u00a6 HDMI \u00a6 DisplayPort \u00a6 Kopfh\u00f6rer",
        "Seitenverh\u00e4ltnis": "16:9",
        "Stromverbrauch (typisch)": "32 Watt",
        "Stromverbrauch SDR (eingeschaltet)": "19.2 kWh/1.000 h",
        "TCO-zertifiziert": "TCO Certified Displays 8",
        "Transportgewicht": "6.5 kg",
        "Typ": "Lautsprecher - Stereo",
        "VESA-Halterung": "100 x 100 mm",
        "Vertikale Bildwiederholrate": "50 - 76 Hz",
        "Vertikaler Betrachtungswinkel": "178"
    },
    "raw_specifications_text": "Display-Typ: LED-hintergrundbeleuchteter LCD-Monitor / TFT-Aktivmatrix\nEnergie Effizienzklasse: Klasse E\nDiagonalabmessung: 68.6 cm (27\")\nBildschirmtyp: IPS\nSeitenverh\u00e4ltnis: 16:9\nNative Aufl\u00f6sung: Full HD (1080p) 1920 x 1080\nPixelpitch: 0.311 mm\nHelligkeit: 250 cd/m\u00b2\nKontrast: 1000:1\nFarbunterst\u00fctzung: 16,7 Millionen Farben\nFarbraum: 72% NTSC\nReaktionszeit: 5 ms\nVertikale Bildwiederholrate: 50 - 76 Hz\nHorizontaler Betrachtungswinkel: 178\nVertikaler Betrachtungswinkel: 178\nHintergrundbeleuchtungs-Technologie: LED-Hintergrundbeleuchtung\nOSD-Sprachen: Ungarisch, Tschechisch, Chinesisch (vereinfacht), Englisch, Deutsch, Franz\u00f6sisch, Italienisch, Portugiesisch, Polnisch, Schwedisch, Russisch, Spanisch, Holl\u00e4ndisch, Arabisch, Rum\u00e4nisch, Japanisch, Chinesisch, Koreanisch\nBesonderheiten: Abdeckung f\u00fcr Kabelf\u00fchrung, HDCP, AMA-Technologie (Advanced Motion Accelerator), Low Blue Light Mode, schmaler Rahmen, Eye-Care Technology, Brightness Intelligence Technology, an 3 Seiten ohne Blende, 72 % NTSC Farbraum\nFarbe: Schwarz\nAbmessungen (Breite x Tiefe x H\u00f6he): 61.2 cm x 18.3 cm x 46.3 cm - mit Fu\u00df\nGewicht: 4.85 kg\nTyp: Lautsprecher - Stereo\nAusgangsleistung/Kanal: 2 Watt\nSchnittstellen: VGA \u00a6 HDMI \u00a6 DisplayPort \u00a6 Kopfh\u00f6rer\nEinstellungen der Anzeigeposition: Neigung\nNeigungswinkel: -5/+20\nVESA-Halterung: 100 x 100 mm\nKennzeichnung: HDCP 1.4\nEingangsspannung: AC 90 - 264 V\nLeistungsaufnahme im Ein-Zustand: 19.2 W\nStromverbrauch SDR (eingeschaltet): 19.2 kWh/1.000 h\nStromverbrauch (typisch): 32 Watt\nDetails zu Abmessungen & Gewicht: Ohne Fu\u00df - Gewicht: 3.92 kg\nTransportgewicht: 6.5 kg\nTCO-zertifiziert: TCO Certified Displays 8",
    "reference_file": "offer_reference_2357.json",
    "shop_name": "ElectronicShop24"
}