{
    "html_file": "offer_2006_0.html",
    "name": "BenQ GL2780E, 27\"",
    "offer_link": "https://www.proshop.at/Bildschirm/BenQ-27-Bildschirm-GL2780E-Speakers-Black-1-ms/2848692?utm_source=geizhals&utm_medium=cpc&utm_campaign=pricesite",
    "price": 197.59,
    "raw_specifications": {
        "Abmessungen (Breite x Tiefe x H\u00f6he)": "63.9 cm x 18.3 cm x 47.3 cm - mit Fu\u00df",
        "Abmessungen (Breite x Tiefe x H\u00f6he) - mit Fu\u00df": "63.9 cm x 18.3 cm x 47.3 cm",
        "Ausgangsleistung/Kanal": "2 Watt",
        "Besonderheiten": "Flimmerfreie Technologie, Color Weakness Mode, Eye-Care Technology, Brightness Intelligence Technology, Low Blue Light-Technologie, ePaper-Modus",
        "Bildschirmtyp": "TN",
        "Details zu Abmessungen & Gewicht": "Ohne Fu\u00df - Breite: 63.9 cm - Tiefe: 5.2 cm - H\u00f6he: 38.2 cm  Mit Fu\u00df - Breite: 63.9 cm - Tiefe: 18.3 cm - H\u00f6he: 47.3 cm - Gewicht: 5.7 kg",
        "Diagonalabmessung": "68.58 cm (27\")",
        "Display-Typ": "LED-hintergrundbeleuchteter LCD-Monitor / TFT-Aktivmatrix",
        "EAN": "4718755081590",
        "Eingangsanschl\u00fcsse": "HDMI, DVI, DisplayPort, VGA",
        "Eingangsspannung": "Wechselstrom 120/230 V (50/60 Hz)",
        "Einstellungen der Anzeigeposition": "Neigung",
        "Energie Effizienzklasse": "Klasse D",
        "Energieverbrauch pro Jahr": "31 kWh",
        "Enthaltene Kabel": "1 x HDMI-Kabel",
        "Farbe": "Schwarz",
        "Farbunterst\u00fctzung": "16,7 Millionen Farben",
        "Ger\u00e4tetyp": "LED-hintergrundbeleuchteter LCD-Monitor - 68.58 cm (27\")",
        "Gewicht": "5.7 kg",
        "Helligkeit": "300 cd/m\u00b2",
        "Hersteller": "BenQ",
        "Hintergrundbeleuchtungs-Technologie": "LED-Hintergrundbeleuchtung",
        "Horizontale Bildwiederholrate": "30 - 83 kHz",
        "Horizontaler Betrachtungswinkel": "170",
        "Kontrast": "1000:1 / 12000000:1 (dynamisch)",
        "Leistungsaufnahme im Ein-Zustand": "15.9 W",
        "Leistungsmerkmale": "Slot f\u00fcr Sicherheitsschloss (Kabelschloss getrennt erh\u00e4ltlich)",
        "Modell": "9H.LJ6LB.FBE",
        "Native Aufl\u00f6sung": "Full HD (1080p) 1920 x 1080",
        "Neigungswinkel": "-5/+20",
        "Pixelpitch": "0.311 mm",
        "Produktbeschreibung": "BenQ GL2780E - LED-Monitor - Full HD (1080p) - 68.58 cm (27\")",
        "Reaktionszeit": "1 ms",
        "Schlosstyp zur Diebstahlsicherung": "Kensington Slot",
        "Schnittstellen": "Audio Line-Out  Audio Line-In  VGA (HD-15)  DVI-D  HDMI  DisplayPort",
        "Seitenverh\u00e4ltnis": "16:9",
        "Spannung": "Wechselstrom 120/230 V (50/60 Hz)",
        "Stromverbrauch (typisch)": "35 Watt",
        "Stromverbrauch SDR (eingeschaltet)": "15.9 kWh/1.000 h",
        "Stromverbrauch im Standby-Modus": "0.5 Watt",
        "Typ": "Lautsprecher - Stereo",
        "Umweltschutzstandards": "ENERGY STAR-qualifiziert EPEAT Bronze",
        "VESA-Halterung": "100 x 100 mm",
        "Vertikale Bildwiederholrate": "50 - 76 Hz",
        "Vertikaler Betrachtungswinkel": "160",
        "Waren-Nr.": "2848692",
        "Zum Hersteller": "benq.com"
    },
    "raw_specifications_text": "Hersteller: BenQ\nWaren-Nr.: 2848692\nModell: 9H.LJ6LB.FBE\nEAN: 4718755081590\nZum Hersteller: benq.com\nProduktbeschreibung: BenQ GL2780E - LED-Monitor - Full HD (1080p) - 68.58 cm (27\")\nGer\u00e4tetyp: LED-hintergrundbeleuchteter LCD-Monitor - 68.58 cm (27\")\nEnergie Effizienzklasse: Klasse D\nEnergieverbrauch pro Jahr: 31 kWh\nLeistungsaufnahme im Ein-Zustand: 15.9 W\nBildschirmtyp: TN\nSeitenverh\u00e4ltnis: 16:9\nNative Aufl\u00f6sung: Full HD (1080p) 1920 x 1080\nPixelpitch: 0.311 mm\nHelligkeit: 300 cd/m\u00b2\nKontrast: 1000:1 / 12000000:1 (dynamisch)\nReaktionszeit: 1 ms\nFarbunterst\u00fctzung: 16,7 Millionen Farben\nEingangsanschl\u00fcsse: HDMI, DVI, DisplayPort, VGA\nEinstellungen der Anzeigeposition: Neigung\nSpannung: Wechselstrom 120/230 V (50/60 Hz)\nFarbe: Schwarz\nAbmessungen (Breite x Tiefe x H\u00f6he) - mit Fu\u00df: 63.9 cm x 18.3 cm x 47.3 cm\nGewicht: 5.7 kg\nUmweltschutzstandards: ENERGY STAR-qualifiziert EPEAT Bronze\nDisplay-Typ: LED-hintergrundbeleuchteter LCD-Monitor / TFT-Aktivmatrix\nDiagonalabmessung: 68.58 cm (27\")\nVertikale Bildwiederholrate: 50 - 76 Hz\nHorizontale Bildwiederholrate: 30 - 83 kHz\nHorizontaler Betrachtungswinkel: 170\nVertikaler Betrachtungswinkel: 160\nHintergrundbeleuchtungs-Technologie: LED-Hintergrundbeleuchtung\nBesonderheiten: Flimmerfreie Technologie, Color Weakness Mode, Eye-Care Technology, Brightness Intelligence Technology, Low Blue Light-Technologie, ePaper-Modus\nAbmessungen (Breite x Tiefe x H\u00f6he): 63.9 cm x 18.3 cm x 47.3 cm - mit Fu\u00df\nTyp: Lautsprecher - Stereo\nAusgangsleistung/Kanal: 2 Watt\nSchnittstellen: Audio Line-Out  Audio Line-In  VGA (HD-15)  DVI-D  HDMI  DisplayPort\nNeigungswinkel: -5/+20\nVESA-Halterung: 100 x 100 mm\nLeistungsmerkmale: Slot f\u00fcr Sicherheitsschloss (Kabelschloss getrennt erh\u00e4ltlich)\nEnthaltene Kabel: 1 x HDMI-Kabel\nSchlosstyp zur Diebstahlsicherung: Kensington Slot\nEingangsspannung: Wechselstrom 120/230 V (50/60 Hz)\nStromverbrauch SDR (eingeschaltet): 15.9 kWh/1.000 h\nStromverbrauch (typisch): 35 Watt\nStromverbrauch im Standby-Modus: 0.5 Watt\nDetails zu Abmessungen & Gewicht: Ohne Fu\u00df - Breite: 63.9 cm - Tiefe: 5.2 cm - H\u00f6he: 38.2 cm  Mit Fu\u00df - Breite: 63.9 cm - Tiefe: 18.3 cm - H\u00f6he: 47.3 cm - Gewicht: 5.7 kg",
    "reference_file": "offer_reference_2006.json",
    "shop_name": "Proshop.at"
}