{
    "html_file": "offer_595_5.html",
    "name": "Lenovo Legion Y32p-30, 31.5\"",
    "offer_link": "https://www.e-tec.at/details.php?artnr=366196",
    "price": 869.95,
    "raw_specifications": {
        "AMD FreeSync Premium": "Ja",
        "Adaptive Sync": "Ja",
        "Anschl\u00fcsse - DisplayPort 1.4 144Hz@3840x2160": "1",
        "Anschl\u00fcsse - HDMI 2.1 144Hz@3840x2160": "2",
        "Anschl\u00fcsse - USB-C 3.0 mit DisplayPort 1.4 144Hz@3840x2160": "1",
        "Anwendung": "station\u00e4r",
        "Audio": "Lautsprecher (2x 5W),  1x Line-Out",
        "Aufl\u00f6sung": "3840x2160",
        "Beschichtung": "matt (non-glare)",
        "Besonderheiten": "Slim Bezel,  USB-C Power Delivery (75W),  mechanische Tasten mit Steuerkreuz,  Lichtsensor,  Sicherheitsschloss (Kensington),  Werkskalibrierung (Delta-E <2),  Beleuchtung auf Frontseite (RGB)",
        "Bildwiederholfrequenz": "144Hz",
        "Blickwinkel": "178\u00b0/178\u00b0",
        "Diagonale": "31.5\"/80cm",
        "Ergonomie": "135mm (h\u00f6henverstellbar),  N/A (Pivot),  \u00b130\u00b0 (drehbar),  +22\u00b0/-5\u00b0 (neigbar),  keine Angabe (Schr\u00e4glage)",
        "FRC": "ja (8bit+2bit)",
        "Farbe": "schwarz",
        "Farbraum - DCI-P3": "90%",
        "Farbraum - sRGB": "99%",
        "Farbtiefe": "10bit (1.07 Mrd. Farben)",
        "Form": "gerade (flat)",
        "Gewicht": "9.60kg (mit Standfu\u00df),  7.40kg (ohne Standfu\u00df)",
        "HDR": "VESA DisplayHDR 400",
        "Helligkeit": "350cd/m\u00b2 (typisch),  400cd/m\u00b2 (HDR)",
        "Herstellergarantie": "drei Jahre",
        "Hintergrundbeleuchtung": "White-LED,  flicker-free,  Blaulichtfilter,  Local Dimming (16 Zonen)",
        "Kontrast - dynamisch": "3.000.000:1",
        "Kontrast - statisch": "1.000:1",
        "Lautsprecher": "Ja",
        "Leistungsaufnahme": "175W (maximal),  62W (typisch),  keine Angabe (Energielabel alt A+++ bis G),  0.5W (Standby)",
        "Panel": "IPS",
        "Reaktionszeit - GtG": "2ms",
        "Reaktionszeit - MPRT": "0.2ms",
        "Screen-to-Body-Ratio": "90.1% (berechnet)",
        "Seitenverh\u00e4ltnis": "16:9",
        "Signalfrequenz": "30-185kHz (horizontal),  48-144Hz (vertikal)",
        "Stromversorgung": "AC-In (internes Netzteil)",
        "USB-Hub In": "1x USB-B 3.0,  1x USB-C 3.0 mit DisplayPort 1.4",
        "USB-Hub Out": "2x USB-A 3.0,  1x USB-C 3.0 (USB PD 15W)",
        "USB-Schreibweise": "Link",
        "VESA": "100x100 (belegt)",
        "Weitere Anschl\u00fcsse": "N/A"
    },
    "raw_specifications_text": "Adaptive Sync: Ja\nAMD FreeSync Premium: Ja\nAnschl\u00fcsse - DisplayPort 1.4 144Hz@3840x2160: 1\nAnschl\u00fcsse - HDMI 2.1 144Hz@3840x2160: 2\nAnschl\u00fcsse - USB-C 3.0 mit DisplayPort 1.4 144Hz@3840x2160: 1\nAnwendung: station\u00e4r\nAudio: Lautsprecher (2x 5W),  1x Line-Out\nAufl\u00f6sung: 3840x2160\nBeschichtung: matt (non-glare)\nBesonderheiten: Slim Bezel,  USB-C Power Delivery (75W),  mechanische Tasten mit Steuerkreuz,  Lichtsensor,  Sicherheitsschloss (Kensington),  Werkskalibrierung (Delta-E <2),  Beleuchtung auf Frontseite (RGB)\nBildwiederholfrequenz: 144Hz\nBlickwinkel: 178\u00b0/178\u00b0\nDiagonale: 31.5\"/80cm\nErgonomie: 135mm (h\u00f6henverstellbar),  N/A (Pivot),  \u00b130\u00b0 (drehbar),  +22\u00b0/-5\u00b0 (neigbar),  keine Angabe (Schr\u00e4glage)\nFarbe: schwarz\nFarbraum - DCI-P3: 90%\nFarbraum - sRGB: 99%\nFarbtiefe: 10bit (1.07 Mrd. Farben)\nForm: gerade (flat)\nFRC: ja (8bit+2bit)\nGewicht: 9.60kg (mit Standfu\u00df),  7.40kg (ohne Standfu\u00df)\nHDR: VESA DisplayHDR 400\nHelligkeit: 350cd/m\u00b2 (typisch),  400cd/m\u00b2 (HDR)\nHerstellergarantie: drei Jahre\nHintergrundbeleuchtung: White-LED,  flicker-free,  Blaulichtfilter,  Local Dimming (16 Zonen)\nKontrast - dynamisch: 3.000.000:1\nKontrast - statisch: 1.000:1\nLautsprecher: Ja\nLeistungsaufnahme: 175W (maximal),  62W (typisch),  keine Angabe (Energielabel alt A+++ bis G),  0.5W (Standby)\nPanel: IPS\nReaktionszeit - GtG: 2ms\nReaktionszeit - MPRT: 0.2ms\nScreen-to-Body-Ratio: 90.1% (berechnet)\nSeitenverh\u00e4ltnis: 16:9\nSignalfrequenz: 30-185kHz (horizontal),  48-144Hz (vertikal)\nStromversorgung: AC-In (internes Netzteil)\nUSB-Hub In: 1x USB-B 3.0,  1x USB-C 3.0 mit DisplayPort 1.4\nUSB-Hub Out: 2x USB-A 3.0,  1x USB-C 3.0 (USB PD 15W)\nUSB-Schreibweise: Link\nVESA: 100x100 (belegt)\nWeitere Anschl\u00fcsse: N/A",
    "reference_file": "offer_reference_595.json",
    "shop_name": "e-tec.at"
}