{
    "html_file": "offer_521_16.html",
    "name": "HP E45c G5, 44.5\"",
    "offer_link": "https://www.electronicshop24.at/product_info.php?products_id=310000000544466901&ano=A-H544466901&mno=6N4C1AA&ean=196786293856&utm_medium=cpc&utm_campaign=preisvergleich&utm_content=item&utm_source=geizhals&ref=geizhals",
    "price": 1234.0,
    "raw_specifications": {
        "Abmessungen (Breite x Tiefe x H\u00f6he)": "108.43 cm x 30.7 cm x 52.18 cm - mit Fu\u00df",
        "Adaptive-Sync Technologie": "AMD FreeSync Premium",
        "Ausgangsleistung/Kanal": "3 Watt",
        "Besonderheiten": "Umgebungslichtsensor, HDCP, flimmerfreie Technologie, 3 Side Borderless Design, Low Blue Light-Technologie, 8-bit Farbtiefe, HP Eye Ease, HP Device Bridge 2.0, FreeSync Premium Technology",
        "Bildschirmbeschichtung": "Blendfrei, 3H Hard Coating, Haze 25 %",
        "Bildschirmtyp": "VA",
        "Details zu Abmessungen & Gewicht": "Mit Fu\u00df - Breite: 108.43 cm - Tiefe: 30.7 cm - H\u00f6he: 52.18 cm - Gewicht: 14.6 kg \u00a6 Ohne Fu\u00df - Breite: 108.43 cm - Tiefe: 14.81 cm - H\u00f6he: 33.56 cm - Gewicht: 10.1 kg",
        "Diagonalabmessung": "113 cm (44.5\")",
        "Display-Typ": "LED-hintergrundbeleuchteter LCD-Monitor / TFT-Aktivmatrix",
        "ENERGY STAR zertifiziert": "Ja",
        "Eingangsspannung": "Wechselstrom 100-240 V (50/60 Hz)",
        "Einstellungen der Anzeigeposition": "H\u00f6he, Drehung, Neigung",
        "Energie Effizienzklasse": "Klasse G",
        "Enthaltene Kabel": "2 x Kabel USB-C auf USB-C - 1 m",
        "Farbe": "Schwarzer Kopf, Schwarz und Silber (St\u00e4nder)",
        "Farbraum": "99% sRGB",
        "Farbtemperatur": "6500K",
        "Farbunterst\u00fctzung": "16,7 Millionen Farben (8-Bit)",
        "Geschwungener Bildschirm": "Ja (1500R)",
        "Gewicht": "14.6 kg",
        "Helligkeit": "400 cd/m\u00b2",
        "Hintergrundbeleuchtungs-Technologie": "Edge-LED-Beleuchtung",
        "Horizontale Bildwiederholrate": "30 - 250 kHz",
        "Horizontaler Betrachtungswinkel": "178",
        "H\u00f6heneinstellung": "150 mm",
        "Integrierte Peripherieger\u00e4te": "USB 3.2 Gen 1 Hub",
        "Kennzeichnung": "CSA, UL, TUV GS, VCCI, BSMI, NOM, WHQL, CB, CCC, PSB, FCC, ISO 9241-307, KCC, PSE Mark, cTUVus, CECP, ISC, halogenarm, NRCS, UAE, TGM, TCO Certified Edge",
        "Kontrast": "3000:1 / 8000000:1 (dynamisch)",
        "Lebensdauer der Beleuchtung": "30,000 Stunden",
        "Leistungsmerkmale": "Slot f\u00fcr Sicherheitsschloss (Kabelschloss getrennt erh\u00e4ltlich), abnehmbarer St\u00e4nder, Unterst\u00fctzung f\u00fcr VESA-Schnittstelle",
        "Max. Betriebstemperatur": "35 \u00b0C",
        "Min Betriebstemperatur": "5 \u00b0C",
        "Mitgelieferte Software": "HP Display Center, HP Display Manager",
        "Native Aufl\u00f6sung": "Dual Quad HD 5120 x 1440 bei 165 Hz",
        "Neigungswinkel": "-5/+20",
        "OSD-Sprachen": "Chinesisch (tradionell), Chinesisch (vereinfacht), Englisch, Deutsch, Franz\u00f6sisch, Italienisch, Portugiesisch, Russisch, Spanisch, Japanisch",
        "Pixelpitch": "0.21 mm",
        "Ppi": "120",
        "Reaktionszeit": "3 ms (grau zu grau mit \u00dcbersteuerung)",
        "Schlosstyp zur Diebstahlsicherung": "Kensington Slot",
        "Schnittstellen": "DisplayPort 1.4 (HDCP) \u00a6 HDMI (HDCP) \u00a6 2 x USB-C 3.2 Gen 1 (bis zu 100 W) \u00a6 USB 3.2 Gen 1 (nur Strom) \u00a6 3 x USB 3.2 Gen 1 \u00a6 LAN (RJ-45)",
        "Schwenkwinkel": "20",
        "Seitenverh\u00e4ltnis": "32:9",
        "Service und Support": "Begrenzte Garantie - Arbeitszeit und Ersatzteile - 3 Jahre",
        "Stromverbrauch (max.)": "275 Watt",
        "Stromverbrauch (typisch)": "55 Watt",
        "Stromverbrauch SDR (eingeschaltet)": "38 kWh/1.000 h",
        "Stromverbrauch im Standby-Modus": "0.5 Watt",
        "TCO-zertifiziert": "TCO Certified Edge Displays, TCO Certified Displays 9",
        "Transportbreite": "126.7 cm",
        "Transportgewicht": "22.47 kg",
        "Transporth\u00f6he": "48.5 cm",
        "Transporttiefe": "28 cm",
        "Typ": "Lautsprecher - Stereo",
        "USB-Spannungsversorgung": "100 Watt",
        "VESA-Halterung": "100 x 100 mm",
        "Vertikale Bildwiederholrate": "48 - 165 Hz",
        "Vertikaler Betrachtungswinkel": "178",
        "Zul\u00e4ssige Luftfeuchtigkeit im Betrieb": "20 - 80% (nicht kondensierend)"
    },
    "raw_specifications_text": "Display-Typ: LED-hintergrundbeleuchteter LCD-Monitor / TFT-Aktivmatrix\nEnergie Effizienzklasse: Klasse G\nDiagonalabmessung: 113 cm (44.5\")\nGeschwungener Bildschirm: Ja (1500R)\nAdaptive-Sync Technologie: AMD FreeSync Premium\nIntegrierte Peripherieger\u00e4te: USB 3.2 Gen 1 Hub\nUSB-Spannungsversorgung: 100 Watt\nBildschirmtyp: VA\nSeitenverh\u00e4ltnis: 32:9\nNative Aufl\u00f6sung: Dual Quad HD 5120 x 1440 bei 165 Hz\nPixelpitch: 0.21 mm\nPpi: 120\nHelligkeit: 400 cd/m\u00b2\nKontrast: 3000:1 / 8000000:1 (dynamisch)\nFarbunterst\u00fctzung: 16,7 Millionen Farben (8-Bit)\nFarbraum: 99% sRGB\nReaktionszeit: 3 ms (grau zu grau mit \u00dcbersteuerung)\nVertikale Bildwiederholrate: 48 - 165 Hz\nHorizontale Bildwiederholrate: 30 - 250 kHz\nHorizontaler Betrachtungswinkel: 178\nVertikaler Betrachtungswinkel: 178\nBildschirmbeschichtung: Blendfrei, 3H Hard Coating, Haze 25 %\nHintergrundbeleuchtungs-Technologie: Edge-LED-Beleuchtung\nFarbtemperatur: 6500K\nOSD-Sprachen: Chinesisch (tradionell), Chinesisch (vereinfacht), Englisch, Deutsch, Franz\u00f6sisch, Italienisch, Portugiesisch, Russisch, Spanisch, Japanisch\nBesonderheiten: Umgebungslichtsensor, HDCP, flimmerfreie Technologie, 3 Side Borderless Design, Low Blue Light-Technologie, 8-bit Farbtiefe, HP Eye Ease, HP Device Bridge 2.0, FreeSync Premium Technology\nFarbe: Schwarzer Kopf, Schwarz und Silber (St\u00e4nder)\nAbmessungen (Breite x Tiefe x H\u00f6he): 108.43 cm x 30.7 cm x 52.18 cm - mit Fu\u00df\nGewicht: 14.6 kg\nTyp: Lautsprecher - Stereo\nAusgangsleistung/Kanal: 3 Watt\nSchnittstellen: DisplayPort 1.4 (HDCP) \u00a6 HDMI (HDCP) \u00a6 2 x USB-C 3.2 Gen 1 (bis zu 100 W) \u00a6 USB 3.2 Gen 1 (nur Strom) \u00a6 3 x USB 3.2 Gen 1 \u00a6 LAN (RJ-45)\nEinstellungen der Anzeigeposition: H\u00f6he, Drehung, Neigung\nNeigungswinkel: -5/+20\nSchwenkwinkel: 20\nH\u00f6heneinstellung: 150 mm\nVESA-Halterung: 100 x 100 mm\nLeistungsmerkmale: Slot f\u00fcr Sicherheitsschloss (Kabelschloss getrennt erh\u00e4ltlich), abnehmbarer St\u00e4nder, Unterst\u00fctzung f\u00fcr VESA-Schnittstelle\nEnthaltene Kabel: 2 x Kabel USB-C auf USB-C - 1 m\nLebensdauer der Beleuchtung: 30,000 Stunden\nKennzeichnung: CSA, UL, TUV GS, VCCI, BSMI, NOM, WHQL, CB, CCC, PSB, FCC, ISO 9241-307, KCC, PSE Mark, cTUVus, CECP, ISC, halogenarm, NRCS, UAE, TGM, TCO Certified Edge\nSchlosstyp zur Diebstahlsicherung: Kensington Slot\nEingangsspannung: Wechselstrom 100-240 V (50/60 Hz)\nStromverbrauch SDR (eingeschaltet): 38 kWh/1.000 h\nStromverbrauch (typisch): 55 Watt\nStromverbrauch (max.): 275 Watt\nStromverbrauch im Standby-Modus: 0.5 Watt\nMitgelieferte Software: HP Display Center, HP Display Manager\nDetails zu Abmessungen & Gewicht: Mit Fu\u00df - Breite: 108.43 cm - Tiefe: 30.7 cm - H\u00f6he: 52.18 cm - Gewicht: 14.6 kg \u00a6 Ohne Fu\u00df - Breite: 108.43 cm - Tiefe: 14.81 cm - H\u00f6he: 33.56 cm - Gewicht: 10.1 kg\nTransportbreite: 126.7 cm\nTransporttiefe: 28 cm\nTransporth\u00f6he: 48.5 cm\nTransportgewicht: 22.47 kg\nTCO-zertifiziert: TCO Certified Edge Displays, TCO Certified Displays 9\nENERGY STAR zertifiziert: Ja\nService und Support: Begrenzte Garantie - Arbeitszeit und Ersatzteile - 3 Jahre\nMin Betriebstemperatur: 5 \u00b0C\nMax. Betriebstemperatur: 35 \u00b0C\nZul\u00e4ssige Luftfeuchtigkeit im Betrieb: 20 - 80% (nicht kondensierend)",
    "reference_file": "offer_reference_521.json",
    "shop_name": "ElectronicShop24"
}