{
    "html_file": "offer_1204_6.html",
    "name": "ViewSonic Elite XG320U, 32\"",
    "offer_link": "https://www.mylemon.at/artikel/viewsonic/xg320u/xg320u-81-28-cm-32.html",
    "price": 1138.99,
    "raw_specifications": {
        "AC Eingangsfrequenz": "50/60 Hz",
        "AC Eingangsspannung": "100 - 240 V",
        "AMD FreeSync": "Ja",
        "AMD FreeSync-Typ": "FreeSync",
        "Adobe RGB-Abdeckung": "99%",
        "Anzahl DisplayPort Anschl\u00fcsse": "1",
        "Anzahl HDMI-Anschl\u00fcsse": "2",
        "Anzahl der Farben des Displays": "1,07 Milliarden Farben",
        "Anzahl der Lautsprecher": "2",
        "Anzahl der Upstream-Ports USB Typ-B": "1",
        "Anzahl der nachgeschalteten Steckpl\u00e4tze vom Typ USB-A": "3",
        "Artikelnummer": "M18YH5VL",
        "Audioausgang": "Ja",
        "Aufl\u00f6sung": "3840x2160",
        "Betriebstemperatur": "0 - 40 \u00b0C",
        "Bildschirmdiagonale": "81,3 cm (32 Zoll)",
        "Bildschirmform": "Flach",
        "Bildschirmtechnologie": "LED",
        "Bildwinkel, horizontal": "178\u00b0",
        "Bildwinkel, vertikal": "178\u00b0",
        "Blendfreier Bildschirm": "Ja",
        "Breite (ohne Standfu\u00df)": "72,6 cm",
        "Display-Aufl\u00f6sung": "3840 x 2160 Pixel",
        "Displaygr\u00f6\u00dfe": "31,5 Zoll",
        "EAN": "0766907011302",
        "Eingebaute Lautsprecher": "Ja",
        "Farbtiefe": "10 Bit",
        "Flimmerfreie Technologie": "Ja",
        "Ger\u00e4tebreite (inkl. Fu\u00df)": "726 mm",
        "Ger\u00e4teh\u00f6he (inkl. Fu\u00df)": "602,3 mm",
        "Ger\u00e4tetiefe (inkl. Fu\u00df)": "265 mm",
        "Gewicht (mit St\u00e4nder)": "10,1 kg",
        "Gewicht (ohne St\u00e4nder)": "7,1 kg",
        "HD-Typ": "4K Ultra HD",
        "HDMI": "Ja",
        "HDMI-Version": "2.0/2.1",
        "Helligkeit": "400 cd/m\u00b2",
        "Helligkeit (typisch)": "400 cd/m\u00b2",
        "Hersteller Artikelnummer": "XG320U",
        "H\u00f6he (ohne Standfu\u00df)": "43,2 cm",
        "H\u00f6heneinstellung": "12 cm",
        "H\u00f6henverstellung": "Ja",
        "Kabelsperre-Slot": "Ja",
        "Kontrastverh\u00e4ltnis": "1000:1",
        "Kontrastverh\u00e4ltnis (dynamisch)": "120000000:1",
        "Marktpositionierung": "Gaming",
        "Maximale Bildwiederholrate": "150 Hz",
        "Mitgelieferte Kabel": "AC, DisplayPort, HDMI, USB Typ-A",
        "NTSC Abdeckung (typisch)": "113%",
        "Natives Seitenverh\u00e4ltnis": "16:9",
        "Neigungsverstellung": "Ja",
        "Neigungswinkelbereich": "-5 - 20\u00b0",
        "Paketgewicht": "14,7 kg",
        "Panel": "IPS",
        "Panel-Montage-Schnittstelle": "100 x 100 mm",
        "Panel-Typ": "IPS",
        "Pixel Abstand": "0,185 x 0,185 mm",
        "Produktfarbe": "Schwarz",
        "RMS-Leistung": "5 W",
        "Reaktionszeit": "1 ms",
        "Relative Luftfeuchtigkeit in Betrieb": "20 - 90%",
        "Schwenkbar": "Ja",
        "Schwenkwinkelbereich": "0 - 50\u00b0",
        "Slot-Typ Kabelsperre": "Kensington",
        "Stromverbrauch (Standardbetrieb)": "46,3 W",
        "Stromverbrauch (Standby)": "0,5 W",
        "Stromverbrauch (max.)": "74 W",
        "Tiefe (ohne Standfu\u00df)": "8,7 cm",
        "Touchscreen": "Nein",
        "VESA-Halterung": "Ja",
        "Verpackungsbreite": "850 mm",
        "Verpackungsh\u00f6he": "527 mm",
        "Verpackungstiefe": "327 mm",
        "Video Anschl\u00fcsse": "2x HDMI, 1x DisplayPort",
        "Warentarifnummer (HS)": "85285210",
        "sRGB Abdeckung (klassisch)": "159%"
    },
    "raw_specifications_text": "Displaygr\u00f6\u00dfe: 31,5 Zoll\nAufl\u00f6sung: 3840x2160\nPanel: IPS\nReaktionszeit: 1 ms\nVideo Anschl\u00fcsse: 2x HDMI, 1x DisplayPort\nHelligkeit: 400 cd/m\u00b2\nHersteller Artikelnummer: XG320U\nEAN: 0766907011302\nArtikelnummer: M18YH5VL\nBildschirmdiagonale: 81,3 cm (32 Zoll)\nDisplay-Aufl\u00f6sung: 3840 x 2160 Pixel\nNatives Seitenverh\u00e4ltnis: 16:9\nBildschirmtechnologie: LED\nTouchscreen: Nein\nHD-Typ: 4K Ultra HD\nPanel-Typ: IPS\nBildschirmform: Flach\nKontrastverh\u00e4ltnis: 1000:1\nMaximale Bildwiederholrate: 150 Hz\nAnzahl der Farben des Displays: 1,07 Milliarden Farben\nHelligkeit (typisch): 400 cd/m\u00b2\nBlendfreier Bildschirm: Ja\nKontrastverh\u00e4ltnis (dynamisch): 120000000:1\nBildwinkel, horizontal: 178\u00b0\nBildwinkel, vertikal: 178\u00b0\nPixel Abstand: 0,185 x 0,185 mm\nFarbtiefe: 10 Bit\nsRGB Abdeckung (klassisch): 159%\nNTSC Abdeckung (typisch): 113%\nAdobe RGB-Abdeckung: 99%\nAMD FreeSync: Ja\nAMD FreeSync-Typ: FreeSync\nFlimmerfreie Technologie: Ja\nEingebaute Lautsprecher: Ja\nAnzahl der Lautsprecher: 2\nRMS-Leistung: 5 W\nMarktpositionierung: Gaming\nProduktfarbe: Schwarz\nHDMI: Ja\nAnzahl der Upstream-Ports USB Typ-B: 1\nAnzahl der nachgeschalteten Steckpl\u00e4tze vom Typ USB-A: 3\nAnzahl HDMI-Anschl\u00fcsse: 2\nHDMI-Version: 2.0/2.1\nAnzahl DisplayPort Anschl\u00fcsse: 1\nAudioausgang: Ja\nVESA-Halterung: Ja\nKabelsperre-Slot: Ja\nH\u00f6henverstellung: Ja\nPanel-Montage-Schnittstelle: 100 x 100 mm\nSlot-Typ Kabelsperre: Kensington\nH\u00f6heneinstellung: 12 cm\nSchwenkbar: Ja\nSchwenkwinkelbereich: 0 - 50\u00b0\nNeigungswinkelbereich: -5 - 20\u00b0\nNeigungsverstellung: Ja\nStromverbrauch (Standardbetrieb): 46,3 W\nStromverbrauch (Standby): 0,5 W\nStromverbrauch (max.): 74 W\nAC Eingangsspannung: 100 - 240 V\nAC Eingangsfrequenz: 50/60 Hz\nBetriebstemperatur: 0 - 40 \u00b0C\nRelative Luftfeuchtigkeit in Betrieb: 20 - 90%\nMitgelieferte Kabel: AC, DisplayPort, HDMI, USB Typ-A\nGer\u00e4tebreite (inkl. Fu\u00df): 726 mm\nGer\u00e4tetiefe (inkl. Fu\u00df): 265 mm\nGer\u00e4teh\u00f6he (inkl. Fu\u00df): 602,3 mm\nGewicht (mit St\u00e4nder): 10,1 kg\nBreite (ohne Standfu\u00df): 72,6 cm\nTiefe (ohne Standfu\u00df): 8,7 cm\nH\u00f6he (ohne Standfu\u00df): 43,2 cm\nGewicht (ohne St\u00e4nder): 7,1 kg\nVerpackungsbreite: 850 mm\nVerpackungstiefe: 327 mm\nVerpackungsh\u00f6he: 527 mm\nPaketgewicht: 14,7 kg\nWarentarifnummer (HS): 85285210",
    "reference_file": "offer_reference_1204.json",
    "shop_name": "mylemon.at"
}