{
    "html_file": "offer_1641_2.html",
    "name": "HP U28, 28\"",
    "offer_link": "https://www.amazon.de/dp/B08QJ5967M?linkCode=xm2&camp=2025&creative=165953&smid=A3JWKAKR8XB7XF&creativeASIN=B08QJ5967M&tag=geizhals1-21",
    "price": 401.76,
    "raw_specifications": {
        "ASIN": "B08QJ5967M",
        "Amazon Bestseller-Rang": "Nr. 19,610 in Computer & Zubeh\u00f6r (Siehe Top 100 in Computer & Zubeh\u00f6r)  Nr. 429 in Monitore",
        "Anzahl HDMI Schnittstellen": "\u200e1",
        "Anzahl USB 3.0 Schnittstellen": "\u200e3",
        "Artikelgewicht": "\u200e6,35 Kilograms",
        "Batterien enthalten": "\u200eNein",
        "Beschreibung Grafikkarte": "\u200e4K UHD HDR",
        "Display-Gr\u00f6\u00dfe": "\u200e28 Zoll",
        "Durchschnittliche Kundenbewertung": "4,6  4,6 von 5 Sternen    \n    156 Sternebewertungen   \n\n\n 4,6 von 5 Sternen",
        "Farbe": "\u200esilber",
        "Garantierte Software-Updates bis": "\u200eunbekannt",
        "Grafik-Coprozessor": "\u200eNVIDIA GeForce RTX 3080",
        "Grafikkartenspeicher": "\u200eGDDR6X",
        "Hersteller": "\u200eHP",
        "Im Angebot von Amazon.de seit": "14. Dezember 2020",
        "Interface Grafikkarte": "\u200ePCI-Express x16",
        "L\u00f6sung": "\u200e3840 x 2160 Pixels",
        "Marke": "\u200eHP",
        "Modell/Serie": "\u200eU28",
        "Modellnummer": "\u200e1Z980AA#ABB",
        "Produktabmessungen": "\u200e7,48 x 25,08 x 20,92 cm; 6,35 Kilogramm",
        "Prozessortyp": "\u200eOthers",
        "Speichergeschwindigkeit": "\u200e1785 Unbekannt",
        "Speichergr\u00f6\u00dfe Grafikkarte": "\u200e10 GB",
        "Volt": "\u200e220 Volt"
    },
    "raw_specifications_text": "Marke: \u200eHP\nHersteller: \u200eHP\nModell/Serie: \u200eU28\nProduktabmessungen: \u200e7,48 x 25,08 x 20,92 cm; 6,35 Kilogramm\nModellnummer: \u200e1Z980AA#ABB\nFarbe: \u200esilber\nDisplay-Gr\u00f6\u00dfe: \u200e28 Zoll\nL\u00f6sung: \u200e3840 x 2160 Pixels\nProzessortyp: \u200eOthers\nSpeichergeschwindigkeit: \u200e1785 Unbekannt\nGrafik-Coprozessor: \u200eNVIDIA GeForce RTX 3080\nBeschreibung Grafikkarte: \u200e4K UHD HDR\nGrafikkartenspeicher: \u200eGDDR6X\nSpeichergr\u00f6\u00dfe Grafikkarte: \u200e10 GB\nInterface Grafikkarte: \u200ePCI-Express x16\nAnzahl USB 3.0 Schnittstellen: \u200e3\nAnzahl HDMI Schnittstellen: \u200e1\nVolt: \u200e220 Volt\nBatterien enthalten: \u200eNein\nArtikelgewicht: \u200e6,35 Kilograms\nGarantierte Software-Updates bis: \u200eunbekannt\nASIN: B08QJ5967M\nDurchschnittliche Kundenbewertung: 4,6  4,6 von 5 Sternen    \n    156 Sternebewertungen   \n\n\n 4,6 von 5 Sternen\nAmazon Bestseller-Rang: Nr. 19,610 in Computer & Zubeh\u00f6r (Siehe Top 100 in Computer & Zubeh\u00f6r)  Nr. 429 in Monitore\nIm Angebot von Amazon.de seit: 14. Dezember 2020",
    "reference_file": "offer_reference_1641.json",
    "shop_name": "Amazon.at"
}