{
    "html_file": "offer_1230_13.html",
    "name": "MSI Optix MEG381CQRDE Plus, 37.5\"",
    "offer_link": "https://www.hiq24.de/shop/artikel/300145/?sPartner=geizhals",
    "price": 2331.5,
    "raw_specifications": {
        "Abmessungen (Breite x Tiefe x H\u00f6he)": "89.65 cm x 32.58 cm x 46.64 cm",
        "Adaptive-Sync Technologie": "NVIDIA G-SYNC ULTIMATE",
        "Besonderheiten": "Rahmenlos, Reduzierung des blauen Lichtanteils, PBP, MSI Anti-Flicker, MSI Mystic Light, PIP-Support, Camera Cradle, Maus-Bungee",
        "Bildschirmbeschichtung": "Blendfrei",
        "Bildschirmtyp": "IPS",
        "Diagonalabmessung": "95.2 cm (37.5\")",
        "Display-Typ": "LED-hintergrundbeleuchteter LCD-Monitor / TFT-Aktivmatrix",
        "Eingangsanschl\u00fcsse": "2xHDMI, DisplayPort",
        "Eingangsspannung": "Wechselstrom 100-240 V (50 - 60 Hz)",
        "Einstellungen der Anzeigeposition": "H\u00f6he, Drehung, Neigung",
        "Energie Effizienzklasse": "Klasse G",
        "Energieklasse (HDR)": "Klasse G",
        "Farbe": "Schwarz",
        "Farbraum": "128.7% sRGB, 96.2% DCI-P3",
        "Farbunterst\u00fctzung": "1,07 Mrd. Farben",
        "Ger\u00e4tetyp": "LED-hintergrundbeleuchteter LCD-Monitor - 95.2 cm (37.5\")",
        "Geschwungener Bildschirm": "Ja",
        "Gewicht": "10.7 kg",
        "HDR-Zertifizierung": "DisplayHDR 600",
        "HDR-f\u00e4hig": "DisplayHDR 600",
        "Helligkeit": "600 cd/m\u00b2",
        "Hintergrundbeleuchtungs-Technologie": "LED-Hintergrundbeleuchtung",
        "Horizontaler Betrachtungswinkel": "178",
        "H\u00f6heneinstellung": "100 mm",
        "Integrierte Peripherieger\u00e4te": "USB 3.2 Gen 1 Hub",
        "Kontrast": "1000:1 / 100000000:1 (dynamisch)",
        "Leistungsmerkmale": "5-Wege-Joystick, USB 3.2 Gen 1 Hub",
        "Native Aufl\u00f6sung": "UWQHD+ 3840 x 1600 (DisplayPort: 175 Hz, HDMI: 85 Hz)",
        "Neigungswinkel": "-5/+15",
        "Pixelpitch": "0.22908 mm",
        "Produktbeschreibung": "MSI Optix MEG381CQR Plus - LED-Monitor - gebogen - 95.2 cm (37.5\")",
        "Reaktionszeit": "1 ms",
        "Schlosstyp zur Diebstahlsicherung": "Kensington Slot",
        "Schnittstellen": "DisplayPort  2 x HDMI  USB 3.2 Gen 1 Upstream (Typ B)  3 x USB 3.2 Gen 1 Downstream  Kopfh\u00f6rer  Mikrofon  Mikrofon-Upstream",
        "Schwenkwinkel": "60",
        "Seitenverh\u00e4ltnis": "21:9",
        "Spannung": "Wechselstrom 100-240 V (50 - 60 Hz)",
        "Stromverbrauch (typisch)": "47 Watt",
        "Stromverbrauch HDR (eingeschaltet)": "106 kWh/1.000 h",
        "Stromverbrauch SDR (eingeschaltet)": "46.8 kWh/1.000 h",
        "Transportbreite": "100 cm",
        "Transportgewicht": "14.8 kg",
        "Transporth\u00f6he": "58.5 cm",
        "Transporttiefe": "28 cm",
        "Typ": "5-Wege-Joystick",
        "VESA-Halterung": "100 x 100 mm",
        "Vertikaler Betrachtungswinkel": "178"
    },
    "raw_specifications_text": "Display-Typ: LED-hintergrundbeleuchteter LCD-Monitor / TFT-Aktivmatrix\nEnergie Effizienzklasse: Klasse G\nEnergieklasse (HDR): Klasse G\nDiagonalabmessung: 95.2 cm (37.5\")\nGeschwungener Bildschirm: Ja\nAdaptive-Sync Technologie: NVIDIA G-SYNC ULTIMATE\nIntegrierte Peripherieger\u00e4te: USB 3.2 Gen 1 Hub\nBildschirmtyp: IPS\nSeitenverh\u00e4ltnis: 21:9\nNative Aufl\u00f6sung: UWQHD+ 3840 x 1600 (DisplayPort: 175 Hz, HDMI: 85 Hz)\nPixelpitch: 0.22908 mm\nHelligkeit: 600 cd/m\u00b2\nKontrast: 1000:1 / 100000000:1 (dynamisch)\nHDR-Zertifizierung: DisplayHDR 600\nFarbunterst\u00fctzung: 1,07 Mrd. Farben\nFarbraum: 128.7% sRGB, 96.2% DCI-P3\nReaktionszeit: 1 ms\nHorizontaler Betrachtungswinkel: 178\nVertikaler Betrachtungswinkel: 178\nBildschirmbeschichtung: Blendfrei\nHintergrundbeleuchtungs-Technologie: LED-Hintergrundbeleuchtung\nBesonderheiten: Rahmenlos, Reduzierung des blauen Lichtanteils, PBP, MSI Anti-Flicker, MSI Mystic Light, PIP-Support, Camera Cradle, Maus-Bungee\nFarbe: Schwarz\nAbmessungen (Breite x Tiefe x H\u00f6he): 89.65 cm x 32.58 cm x 46.64 cm\nGewicht: 10.7 kg\nTyp: 5-Wege-Joystick\nSchnittstellen: DisplayPort  2 x HDMI  USB 3.2 Gen 1 Upstream (Typ B)  3 x USB 3.2 Gen 1 Downstream  Kopfh\u00f6rer  Mikrofon  Mikrofon-Upstream\nEinstellungen der Anzeigeposition: H\u00f6he, Drehung, Neigung\nNeigungswinkel: -5/+15\nSchwenkwinkel: 60\nH\u00f6heneinstellung: 100 mm\nVESA-Halterung: 100 x 100 mm\nLeistungsmerkmale: 5-Wege-Joystick, USB 3.2 Gen 1 Hub\nSchlosstyp zur Diebstahlsicherung: Kensington Slot\nEingangsspannung: Wechselstrom 100-240 V (50 - 60 Hz)\nStromverbrauch SDR (eingeschaltet): 46.8 kWh/1.000 h\nStromverbrauch HDR (eingeschaltet): 106 kWh/1.000 h\nStromverbrauch (typisch): 47 Watt\nTransportbreite: 100 cm\nTransporttiefe: 28 cm\nTransporth\u00f6he: 58.5 cm\nTransportgewicht: 14.8 kg\nProduktbeschreibung: MSI Optix MEG381CQR Plus - LED-Monitor - gebogen - 95.2 cm (37.5\")\nGer\u00e4tetyp: LED-hintergrundbeleuchteter LCD-Monitor - 95.2 cm (37.5\")\nHDR-f\u00e4hig: DisplayHDR 600\nEingangsanschl\u00fcsse: 2xHDMI, DisplayPort\nSpannung: Wechselstrom 100-240 V (50 - 60 Hz)",
    "reference_file": "offer_reference_1230.json",
    "shop_name": "HiQ24"
}