{
    "html_file": "offer_1567_1.html",
    "name": "ASUS TUF Gaming VG249Q1A, 23.8\"",
    "offer_link": "https://www.csv-direct.de/artinfo.php?artnr=A1621519&KATEGORIE=162&pva=geizhals2",
    "price": 176.48,
    "raw_specifications": {
        "AC Eingangsfrequenz": "50 - 60 Hz",
        "AC Eingangsspannung": "100 - 240 V",
        "AMD FreeSync-Typ": "FreeSync Premium",
        "Anzahl DisplayPort Anschl\u00fcsse": "1",
        "Anzahl HDMI-Anschl\u00fcsse": "2",
        "Anzahl der Farben des Displays": "16,7 Millionen Farben",
        "Anzahl der Lautsprecher": "2",
        "Bildschirmdiagonale": "60,5 cm 23.8\"",
        "Bildschirmform": "Flach",
        "Bildschirmtechnologie": "LED",
        "Bildwinkel, horizontal": "178\u00b0",
        "Bildwinkel, vertikal": "178\u00b0",
        "Breite ohne Standfu\u00df": "541 mm",
        "DVI Anschluss": "Nein",
        "Display-Aufl\u00f6sung": "1920 x 1080 Pixel",
        "DisplayPorts-Version": "1.2",
        "Dynamisches Kontrastverh\u00e4ltnis Marketingbezeichnung": "SmartContrast",
        "Energieeffizienzklasse SDR": "F",
        "Energieeffizienzskala": "A bis G",
        "Energieverbrauch SDR pro 1.000 Stunden": "22 kWh",
        "Fu\u00dffarbe": "Schwarz",
        "Ger\u00e4tebreite inkl. Fu\u00df": "541 mm",
        "Ger\u00e4teh\u00f6he inkl. Fu\u00df": "393,3 mm",
        "Ger\u00e4tetiefe inkl. Fu\u00df": "174 mm",
        "Gewicht mit St\u00e4nder": "3,47 kg",
        "Gewicht ohne St\u00e4nder": "2,9 kg",
        "HD-Typ": "Full HD",
        "HDMI-Version": "1.4",
        "Helligkeit typisch": "250 cd/m\u00b2",
        "Horizontaler Scanbereich": "54 - 162 kHz",
        "H\u00f6he ohne Standfu\u00df": "323,3 mm",
        "H\u00f6henverstellung": "Nein",
        "Integrierte Kamera": "Nein",
        "Integrierter USB-Hub": "Nein",
        "Kontrastverh\u00e4ltnis": "1000:1",
        "Kontrastverh\u00e4ltnis dynamisch": "10000000:1",
        "Kopfh\u00f6rer-Anschluss": "3,5 mm",
        "Kopfh\u00f6rerausg\u00e4nge": "1",
        "Marktpositionierung": "Gaming",
        "Maximale Bildwiederholrate": "165 Hz",
        "Mitgelieferte Kabel": "AC, DisplayPort",
        "Natives Seitenverh\u00e4ltnis": "16:9",
        "Neigungswinkelbereich": "-5 - 23\u00b0",
        "Paketgewicht": "5,6 kg",
        "Panel-Montage-Schnittstelle": "100 x 100 mm",
        "Panel-Typ": "IPS",
        "Pixel Abstand": "0,2745 x 0,2745 mm",
        "Produktfarbe": "Schwarz",
        "RMS-Leistung": "4 W",
        "Reaktionszeit": "1 ms",
        "Seitenverh\u00e4ltnis": "16:9",
        "Sichtbare Gr\u00f6\u00dfe horizontal": "52,7 cm",
        "Sichtbare Gr\u00f6\u00dfe vertikal": "29,6 cm",
        "Slot-Typ Kabelsperre": "Kensington",
        "Stromverbrauch PowerSave": "0,5 W",
        "Stromverbrauch Standardbetrieb": "21 W",
        "Stromverbrauch aus": "0,3 W",
        "Tiefe ohne Standfu\u00df": "57,8 mm",
        "Touchscreen": "Nein",
        "Typ der Hintergrundbeleuchtung": "LED",
        "Unterst\u00fctzte Grafik-Aufl\u00f6sungen": "1920 x 1080 HD 1080",
        "Verpackungsart": "Box",
        "Verpackungsbreite": "600 mm",
        "Verpackungsh\u00f6he": "455 mm",
        "Verpackungstiefe": "164 mm",
        "Vertikaler Scanbereich": "48 - 165 Hz",
        "Vorderer Rahmen": "Schwarz",
        "Warentarifnummer HS": "85285210"
    },
    "raw_specifications_text": "Bildschirmdiagonale: 60,5 cm 23.8\"\nDisplay-Aufl\u00f6sung: 1920 x 1080 Pixel\nNatives Seitenverh\u00e4ltnis: 16:9\nBildschirmtechnologie: LED\nTouchscreen: Nein\nHD-Typ: Full HD\nPanel-Typ: IPS\nBildschirmform: Flach\nKontrastverh\u00e4ltnis: 1000:1\nMaximale Bildwiederholrate: 165 Hz\nAnzahl der Farben des Displays: 16,7 Millionen Farben\nTyp der Hintergrundbeleuchtung: LED\nHelligkeit typisch: 250 cd/m\u00b2\nReaktionszeit: 1 ms\nUnterst\u00fctzte Grafik-Aufl\u00f6sungen: 1920 x 1080 HD 1080\nSeitenverh\u00e4ltnis: 16:9\nKontrastverh\u00e4ltnis dynamisch: 10000000:1\nDynamisches Kontrastverh\u00e4ltnis Marketingbezeichnung: SmartContrast\nBildwinkel, horizontal: 178\u00b0\nBildwinkel, vertikal: 178\u00b0\nPixel Abstand: 0,2745 x 0,2745 mm\nHorizontaler Scanbereich: 54 - 162 kHz\nVertikaler Scanbereich: 48 - 165 Hz\nSichtbare Gr\u00f6\u00dfe horizontal: 52,7 cm\nSichtbare Gr\u00f6\u00dfe vertikal: 29,6 cm\nAMD FreeSync-Typ: FreeSync Premium\nIntegrierte Kamera: Nein\nAnzahl der Lautsprecher: 2\nRMS-Leistung: 4 W\nMarktpositionierung: Gaming\nProduktfarbe: Schwarz\nVorderer Rahmen: Schwarz\nFu\u00dffarbe: Schwarz\nIntegrierter USB-Hub: Nein\nDVI Anschluss: Nein\nAnzahl HDMI-Anschl\u00fcsse: 2\nHDMI-Version: 1.4\nAnzahl DisplayPort Anschl\u00fcsse: 1\nDisplayPorts-Version: 1.2\nKopfh\u00f6rerausg\u00e4nge: 1\nKopfh\u00f6rer-Anschluss: 3,5 mm\nH\u00f6henverstellung: Nein\nPanel-Montage-Schnittstelle: 100 x 100 mm\nSlot-Typ Kabelsperre: Kensington\nNeigungswinkelbereich: -5 - 23\u00b0\nEnergieeffizienzklasse SDR: F\nEnergieverbrauch SDR pro 1.000 Stunden: 22 kWh\nStromverbrauch Standardbetrieb: 21 W\nStromverbrauch aus: 0,3 W\nStromverbrauch PowerSave: 0,5 W\nAC Eingangsspannung: 100 - 240 V\nAC Eingangsfrequenz: 50 - 60 Hz\nEnergieeffizienzskala: A bis G\nMitgelieferte Kabel: AC, DisplayPort\nGer\u00e4tebreite inkl. Fu\u00df: 541 mm\nGer\u00e4tetiefe inkl. Fu\u00df: 174 mm\nGer\u00e4teh\u00f6he inkl. Fu\u00df: 393,3 mm\nGewicht mit St\u00e4nder: 3,47 kg\nBreite ohne Standfu\u00df: 541 mm\nTiefe ohne Standfu\u00df: 57,8 mm\nH\u00f6he ohne Standfu\u00df: 323,3 mm\nGewicht ohne St\u00e4nder: 2,9 kg\nVerpackungsbreite: 600 mm\nVerpackungstiefe: 164 mm\nVerpackungsh\u00f6he: 455 mm\nPaketgewicht: 5,6 kg\nVerpackungsart: Box\nWarentarifnummer HS: 85285210",
    "reference_file": "offer_reference_1567.json",
    "shop_name": "CSV-Direct.de"
}