{
    "html_file": "offer_2156_14.html",
    "name": "Acer Vero B7 B247YCbmipruzx, 23.8\"",
    "offer_link": "https://www.1ashop.at/de/produkt/12206/acer-business-vero-b7-b247ycbmipruzx-23-8-fhd-vga-dp-usb-c-hoehenverstellbar-lautsprecher-dock.html",
    "price": 216.49,
    "raw_specifications": {
        "Abmessungen (Breite x Tiefe x H\u00f6he)": "54 cm x 19.3 cm x 45 cm",
        "Ausgangsleistung/Kanal": "2 Watt",
        "Besonderheiten": "ErgoStand, High Frame Rate Control (Hi-FRC), ComfyView, Flimmerfrei-Technologie, Abblend-Technologie, 6-Achsen-Farbanpassung, Adaptive-Sync-Technologie, Acer VisionCare, 6-Bit-Gamma, Acer BluelightShield-Technologie, Acer ColorPlus technology",
        "Bildschirmbeschichtung": "Blendfrei",
        "Bildschirmtyp": "IPS",
        "Diagonalabmessung": "60.5 cm (23.8\")",
        "Display-Typ": "LED-hintergrundbeleuchteter LCD-Monitor / TFT-Aktivmatrix",
        "EAN/UPC": "4710180197372",
        "ENERGY STAR zertifiziert": "Ja",
        "ENERGY STAR-Version": "7",
        "Ein-/Aus-Schalter": "Ja",
        "Eingangsspannung": "Wechselstrom 120/230 V (50/60 Hz)",
        "Einstellungen der Anzeigeposition": "H\u00f6he, Pivot (Rotation), Drehung, Neigung",
        "Energie Effizienzklasse": "Klasse F",
        "Energieverbrauch pro Jahr": "27 kWh",
        "Enthaltene Kabel": "1 x VGA-Kabel  1 x USB-C Kabel  1 x SuperSpeed-USB-Kabel",
        "Entwickelt f\u00fcr": "Acer Chromebook 311 C722, C733-C494  Acer Chromebook 314 C933, C933LT-P3L1, C933LT-P8GR, C933T-C4YG, C933T-P4YF, C933T-P6GY  Acer Chromebook 315 CB315-3HT-P6K1  Acer Chromebook 512 C851-C2D8, C851T  Acer Chromebook 712 C871-C756, C871T-P29D  Acer Chromebook 714 CB714-1W-31CH, CB714-1W-536N, CB714-1W-561E, CB714-1WT-30M2, CB714-1WT-32N5, CB714-1WT-50LX, CB714-1WT-51Z5  Acer Chromebook 715 CB715-1W-58KH, CB715-1WT-37GM, CB715-1WT-54A6, CB715-1WT-56SP, CB715-1WT-P9KU  Acer Chromebook Enterprise Spin 513 R841LT, R841T  Acer Chromebook Spin 13 CP713-1WN-P338  Acer Chromebook Spin 311 R721T-4058  Acer Chromebook Spin 511 R752TN-C8AA  Acer Chromebook Spin 512 R852T, R852TN-P4B7, R852T-P3V7, R853TA  Acer Chromebook Spin 513 R841T  Acer Chromebook Spin 514 CP514-1WH, CP514-1WH-R41A  Acer Chromebook Spin 713 CP713-2W, CP713-2W-38CB, CP713-2W-50T5, CP713-2W-58SV, CP713-2W-71HV  Acer Chromebox CXI3, CXI4  Acer Spin 5 SP513-54N-53K4, SP513-54N-75AN, SP513-55N, SP513-55N-52HF  Acer Spin 5 Pro Series SP513-54N  Acer Swift 3 SF314-42-R0LL, SF314-42-R0V0, SF314-42-R1YN, SF314-42-R2G0, SF314-42-R44F, SF314-42-R5S9, SF314-42-R8KM, SF314-42-R9US, SF314-43, SF314-511, SF314-57-32A2, SF314-57-39Z3, SF314-57-54TC, SF314-59-36B3, SF314-59-551Z, SF314-59-71B4, SF316-51  Acer Swift 3 Pro Series SF316-51  Acer Swift 5 SF514-54T-79JX, SF514-54T-79W0, SF514-55T-51K1, SF514-55T-76Z9  Acer Swift 5 Pro Series SF514-55T, SF514-55TA  Acer Swift 7 Pro Series SF714-52T  Acer TravelMate P6 TMP614-51-G2-55DK, TMP614-51-G2-7411  Acer TravelMate X5 TMX514-51-56RZ, TMX514-51-58CQ, TMX514-51-7792, TMX514-51T-5998, TMX514-51T-723A",
        "Farbe": "Schwarz",
        "Farbraum": "100% sRGB",
        "Farbunterst\u00fctzung": "16,7 Millionen Farben",
        "Gewicht": "5.59 kg",
        "Gruppe": "TFTs",
        "Helligkeit": "250 cd/m\u00b2",
        "Hersteller": "Acer",
        "Hersteller Art. Nr.": "UM.QB7EE.C01",
        "Hintergrundbeleuchtungs-Technologie": "LED-Hintergrundbeleuchtung",
        "Horizontale Bildwiederholrate": "30 - 85 kHz",
        "Horizontaler Betrachtungswinkel": "178",
        "H\u00f6heneinstellung": "120 mm",
        "Integrierte Peripherieger\u00e4te": "USB 3.1 Hub",
        "Kennzeichnung": "ISO 9241-307 Class 2",
        "Kontrast": "1000:1 / 100000000:1 (dynamisch)",
        "Leistungsaufnahme im Ein-Zustand": "21.8 W",
        "Leistungsmerkmale": "Slot f\u00fcr Sicherheitsschloss (Kabelschloss getrennt erh\u00e4ltlich), Unterst\u00fctzung f\u00fcr VESA-Schnittstelle",
        "Native Aufl\u00f6sung": "Full HD (1080p) 1920 x 1080 bei 75 Hz",
        "Neigungswinkel": "-5/+25",
        "Pixelpitch": "0.275 mm",
        "Ppi": "93",
        "Reaktionszeit": "4 ms",
        "Rotationswinkel": "90",
        "Schlosstyp zur Diebstahlsicherung": "Kensington Slot",
        "Schnittstellen": "VGA  DisplayPort  HDMI  Audio Line-Out  4 x USB 3.1 Downstream  USB 3.1 Upstream  USB-C",
        "Schwenkwinkel": "90",
        "Seitenverh\u00e4ltnis": "16:9",
        "Stromverbrauch (Aus-Modus)": "0.27 Watt",
        "Stromverbrauch (typisch)": "15 Watt",
        "Stromverbrauch SDR (eingeschaltet)": "21.8 kWh/1.000 h",
        "Stromverbrauch im Standby-Modus": "0.39 Watt",
        "TCO-zertifiziert": "TCO Certified Displays 8",
        "Transportgewicht": "8.07 kg",
        "Typ": "Lautsprecher - Stereo",
        "VESA-Halterung": "Ja",
        "Vertikale Bildwiederholrate": "47 - 75 Hz",
        "Vertikaler Betrachtungswinkel": "178"
    },
    "raw_specifications_text": "Gruppe: TFTs\nHersteller: Acer\nHersteller Art. Nr.: UM.QB7EE.C01\nEAN/UPC: 4710180197372\nDisplay-Typ: LED-hintergrundbeleuchteter LCD-Monitor / TFT-Aktivmatrix\nEnergieverbrauch pro Jahr: 27 kWh\nDiagonalabmessung: 60.5 cm (23.8\")\nIntegrierte Peripherieger\u00e4te: USB 3.1 Hub\nEnergie Effizienzklasse: Klasse F\nBildschirmtyp: IPS\nSeitenverh\u00e4ltnis: 16:9\nNative Aufl\u00f6sung: Full HD (1080p) 1920 x 1080 bei 75 Hz\nPixelpitch: 0.275 mm\nPpi: 93\nHelligkeit: 250 cd/m\u00b2\nKontrast: 1000:1 / 100000000:1 (dynamisch)\nFarbunterst\u00fctzung: 16,7 Millionen Farben\nReaktionszeit: 4 ms\nVertikale Bildwiederholrate: 47 - 75 Hz\nHorizontale Bildwiederholrate: 30 - 85 kHz\nHorizontaler Betrachtungswinkel: 178\nVertikaler Betrachtungswinkel: 178\nBildschirmbeschichtung: Blendfrei\nHintergrundbeleuchtungs-Technologie: LED-Hintergrundbeleuchtung\nFarbraum: 100% sRGB\nFarbe: Schwarz\nAbmessungen (Breite x Tiefe x H\u00f6he): 54 cm x 19.3 cm x 45 cm\nGewicht: 5.59 kg\nBesonderheiten: ErgoStand, High Frame Rate Control (Hi-FRC), ComfyView, Flimmerfrei-Technologie, Abblend-Technologie, 6-Achsen-Farbanpassung, Adaptive-Sync-Technologie, Acer VisionCare, 6-Bit-Gamma, Acer BluelightShield-Technologie, Acer ColorPlus technology\nEntwickelt f\u00fcr: Acer Chromebook 311 C722, C733-C494  Acer Chromebook 314 C933, C933LT-P3L1, C933LT-P8GR, C933T-C4YG, C933T-P4YF, C933T-P6GY  Acer Chromebook 315 CB315-3HT-P6K1  Acer Chromebook 512 C851-C2D8, C851T  Acer Chromebook 712 C871-C756, C871T-P29D  Acer Chromebook 714 CB714-1W-31CH, CB714-1W-536N, CB714-1W-561E, CB714-1WT-30M2, CB714-1WT-32N5, CB714-1WT-50LX, CB714-1WT-51Z5  Acer Chromebook 715 CB715-1W-58KH, CB715-1WT-37GM, CB715-1WT-54A6, CB715-1WT-56SP, CB715-1WT-P9KU  Acer Chromebook Enterprise Spin 513 R841LT, R841T  Acer Chromebook Spin 13 CP713-1WN-P338  Acer Chromebook Spin 311 R721T-4058  Acer Chromebook Spin 511 R752TN-C8AA  Acer Chromebook Spin 512 R852T, R852TN-P4B7, R852T-P3V7, R853TA  Acer Chromebook Spin 513 R841T  Acer Chromebook Spin 514 CP514-1WH, CP514-1WH-R41A  Acer Chromebook Spin 713 CP713-2W, CP713-2W-38CB, CP713-2W-50T5, CP713-2W-58SV, CP713-2W-71HV  Acer Chromebox CXI3, CXI4  Acer Spin 5 SP513-54N-53K4, SP513-54N-75AN, SP513-55N, SP513-55N-52HF  Acer Spin 5 Pro Series SP513-54N  Acer Swift 3 SF314-42-R0LL, SF314-42-R0V0, SF314-42-R1YN, SF314-42-R2G0, SF314-42-R44F, SF314-42-R5S9, SF314-42-R8KM, SF314-42-R9US, SF314-43, SF314-511, SF314-57-32A2, SF314-57-39Z3, SF314-57-54TC, SF314-59-36B3, SF314-59-551Z, SF314-59-71B4, SF316-51  Acer Swift 3 Pro Series SF316-51  Acer Swift 5 SF514-54T-79JX, SF514-54T-79W0, SF514-55T-51K1, SF514-55T-76Z9  Acer Swift 5 Pro Series SF514-55T, SF514-55TA  Acer Swift 7 Pro Series SF714-52T  Acer TravelMate P6 TMP614-51-G2-55DK, TMP614-51-G2-7411  Acer TravelMate X5 TMX514-51-56RZ, TMX514-51-58CQ, TMX514-51-7792, TMX514-51T-5998, TMX514-51T-723A\nStromverbrauch im Standby-Modus: 0.39 Watt\nStromverbrauch (Aus-Modus): 0.27 Watt\nEin-/Aus-Schalter: Ja\nLeistungsaufnahme im Ein-Zustand: 21.8 W\nEingangsspannung: Wechselstrom 120/230 V (50/60 Hz)\nStromverbrauch SDR (eingeschaltet): 21.8 kWh/1.000 h\nStromverbrauch (typisch): 15 Watt\nSchnittstellen: VGA  DisplayPort  HDMI  Audio Line-Out  4 x USB 3.1 Downstream  USB 3.1 Upstream  USB-C\nTyp: Lautsprecher - Stereo\nAusgangsleistung/Kanal: 2 Watt\nNeigungswinkel: -5/+25\nSchwenkwinkel: 90\nRotationswinkel: 90\nH\u00f6heneinstellung: 120 mm\nEinstellungen der Anzeigeposition: H\u00f6he, Pivot (Rotation), Drehung, Neigung\nVESA-Halterung: Ja\nLeistungsmerkmale: Slot f\u00fcr Sicherheitsschloss (Kabelschloss getrennt erh\u00e4ltlich), Unterst\u00fctzung f\u00fcr VESA-Schnittstelle\nEnthaltene Kabel: 1 x VGA-Kabel  1 x USB-C Kabel  1 x SuperSpeed-USB-Kabel\nKennzeichnung: ISO 9241-307 Class 2\nSchlosstyp zur Diebstahlsicherung: Kensington Slot\nTransportgewicht: 8.07 kg\nENERGY STAR zertifiziert: Ja\nENERGY STAR-Version: 7\nTCO-zertifiziert: TCO Certified Displays 8",
    "reference_file": "offer_reference_2156.json",
    "shop_name": "1ashop.at"
}