{
    "html_file": "offer_1082_11.html",
    "name": "HANNspree HE247HFB, 23.6\"",
    "offer_link": "https://www.hiq24.de/shop/artikel/315514/?sPartner=geizhals",
    "price": 109.9,
    "raw_specifications": {
        "Abmessungen (Breite x Tiefe x H\u00f6he)": "53.88 cm x 14.99 cm x 40.81 cm - mit Fu\u00df",
        "Abmessungen (Breite x Tiefe x H\u00f6he) - mit Fu\u00df": "53.88 cm x 14.99 cm x 40.81 cm",
        "Ausgangsleistung/Kanal": "2 Watt",
        "Besonderheiten": "Flimmerfreie Technologie, Low Blue Light-Technologie",
        "Bildschirmbeschichtung": "Blendfrei, 3H Hard Coating",
        "Details zu Abmessungen & Gewicht": "Mit Fu\u00df - Breite: 53.88 cm - Tiefe: 14.99 cm  Ohne Fu\u00df - Breite: 53.88 cm - Tiefe: 3.75 cm - H\u00f6he: 31.87 cm",
        "Diagonalabmessung": "59.9 cm (23.6\")",
        "Display-Typ": "LED-hintergrundbeleuchteter LCD-Monitor / TFT-Aktivmatrix",
        "Eingangsanschl\u00fcsse": "HDMI, VGA",
        "Eingangsspannung": "Wechselstrom 100-240 V (50 - 60 Hz)",
        "Einstellungen der Anzeigeposition": "Neigung",
        "Energie Effizienzklasse": "Klasse E",
        "Enthaltene Kabel": "1 x HDMI-Kabel - 1.5 m",
        "Farbunterst\u00fctzung": "16,7 Millionen Farben",
        "Ger\u00e4tetyp": "LED-hintergrundbeleuchteter LCD-Monitor - 59.9 cm (23.6\")",
        "Helligkeit": "250 cd/m\u00b2",
        "Hintergrundbeleuchtungs-Technologie": "LED-Hintergrundbeleuchtung",
        "Horizontale Bildwiederholrate": "30 - 83 kHz",
        "Horizontaler Betrachtungswinkel": "178",
        "Kontrast": "3000:1 / 10000000:1 (dynamisch)",
        "Native Aufl\u00f6sung": "Full HD (1080p) 1920 x 1080 bei 60 Hz",
        "Neigungswinkel": "-5/+15",
        "Pixelpitch": "0.2715 mm",
        "Produktbeschreibung": "Hannspree HE247HFB - LED-Monitor - Full HD (1080p) - 59.9 cm (23.6\")",
        "Reaktionszeit": "5 ms (Overdrive)",
        "Schnittstellen": "VGA  HDMI  Audio Line-In",
        "Seitenverh\u00e4ltnis": "16:9",
        "Spannung": "Wechselstrom 100-240 V (50 - 60 Hz)",
        "Stromverbrauch (Aus-Modus)": "0.3 Watt",
        "Stromverbrauch (typisch)": "20 Watt",
        "Stromverbrauch SDR (eingeschaltet)": "18 kWh/1.000 h",
        "Stromverbrauch im Standby-Modus": "0.5 Watt",
        "Transportbreite": "63 cm",
        "Transportgewicht": "4.42 kg",
        "Transporth\u00f6he": "44 cm",
        "Transporttiefe": "10.3 cm",
        "Typ": "Lautsprecher - Stereo",
        "VESA-Halterung": "100 x 100 mm",
        "Vertikale Bildwiederholrate": "56 - 75 Hz",
        "Vertikaler Betrachtungswinkel": "178"
    },
    "raw_specifications_text": "Display-Typ: LED-hintergrundbeleuchteter LCD-Monitor / TFT-Aktivmatrix\nEnergie Effizienzklasse: Klasse E\nDiagonalabmessung: 59.9 cm (23.6\")\nSeitenverh\u00e4ltnis: 16:9\nNative Aufl\u00f6sung: Full HD (1080p) 1920 x 1080 bei 60 Hz\nPixelpitch: 0.2715 mm\nHelligkeit: 250 cd/m\u00b2\nKontrast: 3000:1 / 10000000:1 (dynamisch)\nFarbunterst\u00fctzung: 16,7 Millionen Farben\nReaktionszeit: 5 ms (Overdrive)\nVertikale Bildwiederholrate: 56 - 75 Hz\nHorizontale Bildwiederholrate: 30 - 83 kHz\nHorizontaler Betrachtungswinkel: 178\nVertikaler Betrachtungswinkel: 178\nBildschirmbeschichtung: Blendfrei, 3H Hard Coating\nHintergrundbeleuchtungs-Technologie: LED-Hintergrundbeleuchtung\nBesonderheiten: Flimmerfreie Technologie, Low Blue Light-Technologie\nAbmessungen (Breite x Tiefe x H\u00f6he): 53.88 cm x 14.99 cm x 40.81 cm - mit Fu\u00df\nTyp: Lautsprecher - Stereo\nAusgangsleistung/Kanal: 2 Watt\nSchnittstellen: VGA  HDMI  Audio Line-In\nEinstellungen der Anzeigeposition: Neigung\nNeigungswinkel: -5/+15\nVESA-Halterung: 100 x 100 mm\nEnthaltene Kabel: 1 x HDMI-Kabel - 1.5 m\nEingangsspannung: Wechselstrom 100-240 V (50 - 60 Hz)\nStromverbrauch SDR (eingeschaltet): 18 kWh/1.000 h\nStromverbrauch (typisch): 20 Watt\nStromverbrauch im Standby-Modus: 0.5 Watt\nStromverbrauch (Aus-Modus): 0.3 Watt\nDetails zu Abmessungen & Gewicht: Mit Fu\u00df - Breite: 53.88 cm - Tiefe: 14.99 cm  Ohne Fu\u00df - Breite: 53.88 cm - Tiefe: 3.75 cm - H\u00f6he: 31.87 cm\nTransportbreite: 63 cm\nTransporttiefe: 10.3 cm\nTransporth\u00f6he: 44 cm\nTransportgewicht: 4.42 kg\nProduktbeschreibung: Hannspree HE247HFB - LED-Monitor - Full HD (1080p) - 59.9 cm (23.6\")\nGer\u00e4tetyp: LED-hintergrundbeleuchteter LCD-Monitor - 59.9 cm (23.6\")\nEingangsanschl\u00fcsse: HDMI, VGA\nSpannung: Wechselstrom 100-240 V (50 - 60 Hz)\nAbmessungen (Breite x Tiefe x H\u00f6he) - mit Fu\u00df: 53.88 cm x 14.99 cm x 40.81 cm",
    "reference_file": "offer_reference_1082.json",
    "shop_name": "HiQ24"
}