{
    "html_file": "offer_632_6.html",
    "name": "AG neovo DR-22G, 21.5\"",
    "offer_link": "https://direkt.jacob.de/produkte/neovo-ag-dr-22g-dr2g00a1e0100-artnr-6158649.html?utm_source=geizhals&utm_medium=cpc&utm_campaign=Preisvergleich&ref=103",
    "price": 1036.53,
    "raw_specifications": {
        "Abmessungen (Breite x Tiefe x H\u00f6he)": "51.32 cm x 15.5 cm x 36.85 cm - mit Fu\u00df",
        "Abmessungen (Breite x Tiefe x H\u00f6he) - mit Fu\u00df": "51.32 cm x 15.5 cm x 36.85 cm",
        "Ausgangsleistung/Kanal": "2 Watt",
        "Bildschirmbeschichtung": "NeoV Optical Glass, 9H Hard Coating",
        "Bildschirmtyp": "TN",
        "Details zu Abmessungen & Gewicht": "Ohne Fu\u00df - Breite: 51.32 cm - Tiefe: 5.62 cm - H\u00f6he: 32.43 cm - Gewicht: 6.2 kg",
        "Diagonalabmessung": "54.6 cm (21.5\")",
        "Display-Typ": "LED-hintergrundbeleuchteter LCD-Monitor / TFT-Aktivmatrix",
        "Eingangsanschl\u00fcsse": "DVI-D, VGA, S-Video, HDMI, DisplayPort, 2 x BNC (composite)",
        "Einstellungen der Anzeigeposition": "Neigung",
        "Enthaltene Kabel": "1 x VGA-Kabel  1 x Audiokabel",
        "Farbe": "Wei\u00df",
        "Farbunterst\u00fctzung": "16,7 Millionen Farben",
        "Ger\u00e4tetyp": "LED-hintergrundbeleuchteter LCD-Monitor - 54.6 cm (21.5\")",
        "Gewicht": "6.8 kg",
        "Helligkeit": "250 cd/m\u00b2",
        "Hintergrundbeleuchtungs-Technologie": "LED-Hintergrundbeleuchtung",
        "Horizontale Bildwiederholrate": "24 - 83 kHz",
        "Horizontaler Betrachtungswinkel": "170",
        "Kennzeichnung": "BSMI, FCC, RoHS, WEEE, REACH, EN 60601-1, IEC 60601-1, IP22, MDD",
        "Kontrast": "20000000:1 (dynamisch)",
        "Leistungsmerkmale": "Slot f\u00fcr Sicherheitsschloss (Kabelschloss getrennt erh\u00e4ltlich), wasserfest, staubabweisend",
        "Max. Betriebstemperatur": "40 \u00b0C",
        "Min Betriebstemperatur": "0 \u00b0C",
        "Native Aufl\u00f6sung": "Full HD (1080p) 1920 x 1080",
        "Neigungswinkel": "0/+17",
        "Pixelpitch": "0.248 mm",
        "Produktbeschreibung": "Neovo DR-22G - LED-Monitor - Full HD (1080p) - 54.6 cm (21.5\")",
        "Reaktionszeit": "3 ms",
        "Schlosstyp zur Diebstahlsicherung": "Kensington Slot",
        "Schnittstellen": "VGA  DVI-D  HDMI  DisplayPort  Composite-Videoeingang (BNC x 2)  Composite-Video-Ausgang (BNC x 2)  Audio Line-In (RCA x 2)  Audio Line-Out (RCA x 2)  Audio Line-In (Mini-Klinkenstecker)  USB",
        "Seitenverh\u00e4ltnis": "16:9",
        "Stromverbrauch (typisch)": "21 Watt",
        "Stromverbrauch im Standby-Modus": "0.7 Watt",
        "Transportbreite": "61.4 cm",
        "Transportgewicht": "9.3 kg",
        "Transporth\u00f6he": "47.7 cm",
        "Transporttiefe": "20.4 cm",
        "Typ": "Lautsprecher - Stereo",
        "VESA-Halterung": "100 x 100 mm, 75 x 75 mm",
        "Vertikale Bildwiederholrate": "50 - 75 Hz",
        "Vertikaler Betrachtungswinkel": "160",
        "Zul\u00e4ssige Luftfeuchtigkeit im Betrieb": "10 - 90 % (nicht-kondensierend)"
    },
    "raw_specifications_text": "Produktbeschreibung: Neovo DR-22G - LED-Monitor - Full HD (1080p) - 54.6 cm (21.5\")\nGer\u00e4tetyp: LED-hintergrundbeleuchteter LCD-Monitor - 54.6 cm (21.5\")\nBildschirmtyp: TN\nSeitenverh\u00e4ltnis: 16:9\nNative Aufl\u00f6sung: Full HD (1080p) 1920 x 1080\nPixelpitch: 0.248 mm\nHelligkeit: 250 cd/m\u00b2\nKontrast: 20000000:1 (dynamisch)\nReaktionszeit: 3 ms\nFarbunterst\u00fctzung: 16,7 Millionen Farben\nEingangsanschl\u00fcsse: DVI-D, VGA, S-Video, HDMI, DisplayPort, 2 x BNC (composite)\nEinstellungen der Anzeigeposition: Neigung\nBildschirmbeschichtung: NeoV Optical Glass, 9H Hard Coating\nFarbe: Wei\u00df\nAbmessungen (Breite x Tiefe x H\u00f6he) - mit Fu\u00df: 51.32 cm x 15.5 cm x 36.85 cm\nGewicht: 6.8 kg\nKennzeichnung: BSMI, FCC, RoHS, WEEE, REACH, EN 60601-1, IEC 60601-1, IP22, MDD\nDisplay-Typ: LED-hintergrundbeleuchteter LCD-Monitor / TFT-Aktivmatrix\nDiagonalabmessung: 54.6 cm (21.5\")\nVertikale Bildwiederholrate: 50 - 75 Hz\nHorizontale Bildwiederholrate: 24 - 83 kHz\nHorizontaler Betrachtungswinkel: 170\nVertikaler Betrachtungswinkel: 160\nHintergrundbeleuchtungs-Technologie: LED-Hintergrundbeleuchtung\nAbmessungen (Breite x Tiefe x H\u00f6he): 51.32 cm x 15.5 cm x 36.85 cm - mit Fu\u00df\nTyp: Lautsprecher - Stereo\nAusgangsleistung/Kanal: 2 Watt\nSchnittstellen: VGA  DVI-D  HDMI  DisplayPort  Composite-Videoeingang (BNC x 2)  Composite-Video-Ausgang (BNC x 2)  Audio Line-In (RCA x 2)  Audio Line-Out (RCA x 2)  Audio Line-In (Mini-Klinkenstecker)  USB\nNeigungswinkel: 0/+17\nVESA-Halterung: 100 x 100 mm, 75 x 75 mm\nLeistungsmerkmale: Slot f\u00fcr Sicherheitsschloss (Kabelschloss getrennt erh\u00e4ltlich), wasserfest, staubabweisend\nEnthaltene Kabel: 1 x VGA-Kabel  1 x Audiokabel\nSchlosstyp zur Diebstahlsicherung: Kensington Slot\nStromverbrauch (typisch): 21 Watt\nStromverbrauch im Standby-Modus: 0.7 Watt\nDetails zu Abmessungen & Gewicht: Ohne Fu\u00df - Breite: 51.32 cm - Tiefe: 5.62 cm - H\u00f6he: 32.43 cm - Gewicht: 6.2 kg\nTransportbreite: 61.4 cm\nTransporttiefe: 20.4 cm\nTransporth\u00f6he: 47.7 cm\nTransportgewicht: 9.3 kg\nMin Betriebstemperatur: 0 \u00b0C\nMax. Betriebstemperatur: 40 \u00b0C\nZul\u00e4ssige Luftfeuchtigkeit im Betrieb: 10 - 90 % (nicht-kondensierend)",
    "reference_file": "offer_reference_632.json",
    "shop_name": "Jacob Elektronik direkt (AT)"
}