{
    "html_file": "offer_1304_0.html",
    "name": "Samsung Odyssey Neo G9 G95NA (2021), 49\"",
    "offer_link": "https://syswork.at/sw/index.html?open&mid=Artikel&artid=mon-1019&from=geizhals.at",
    "price": 1414.0,
    "raw_specifications": {
        "AC Eingangsspannung": "100 - 240 V",
        "AMD FreeSync": "Ja",
        "AMD FreeSync-Typ": "FreeSync Premium Pro",
        "Adobe RGB-Abdeckung": "92%",
        "Anzahl DisplayPort Anschl\u00fcsse": "1",
        "Anzahl HDMI-Anschl\u00fcsse": "2",
        "Anzahl der Farben des Displays": "1,07 Milliarden Farben",
        "Anzahl der nachgeschalteten Steckpl\u00e4tze vom Typ USB-A": "2",
        "Betriebstemperatur": "10 - 40 \u00b0C",
        "Bewertung der Bildschirmkr\u00fcmmung": "1000R",
        "Bild-in-Bild": "Ja",
        "Bildschirmaufl\u00f6sung": "5120 x 1440 Pixel",
        "Bildschirmdiagonale": "124,5 cm (49 Zoll)",
        "Bildschirmform": "Gebogen",
        "Bildschirmtechnologie": "QLED",
        "Bildwinkel, horizontal": "178\u00b0",
        "Bildwinkel, vertikal": "178\u00b0",
        "Breite (ohne Standfu\u00df)": "115 cm",
        "Datenblatt": "Kein Datenblatt verf\u00fcgbar",
        "DisplayPorts-Version": "1.4",
        "Dynamisches Kontrastverh\u00e4ltnis Marketingbezeichnung": "Mega DCR",
        "Eingebaute Lautsprecher": "Nein",
        "Energieeffizienzklasse (HDR)": "G",
        "Energieverbrauch (HDR) pro 1.000 Stunden": "95 kWh",
        "Farbskala": "95%",
        "Ger\u00e4tebreite (inkl. Fu\u00df)": "1149,5 mm",
        "Ger\u00e4teh\u00f6he (inkl. Fu\u00df)": "537,2 mm",
        "Ger\u00e4tetiefe (inkl. Fu\u00df)": "418,3 mm",
        "Gewicht (mit St\u00e4nder)": "14,5 kg",
        "Gewicht (ohne St\u00e4nder)": "11,9 kg",
        "HD-Typ": "UltraWide 5K HD",
        "HDMI": "Ja",
        "HDMI-Version": "2.1",
        "Helligkeit (typisch)": "2000 cd/m\u00b2",
        "Herstellerlink": "Samsung",
        "High Dynamic Range Video (HDR) Unterst\u00fctzung": "Ja",
        "H\u00f6he (ohne Standfu\u00df)": "36,4 cm",
        "H\u00f6heneinstellung": "12 cm",
        "H\u00f6henverstellung": "Ja",
        "Integrierte Kamera": "Nein",
        "Integrierter USB-Hub": "Ja",
        "Kontrastverh\u00e4ltnis": "1000000:1",
        "Kopfh\u00f6rerausgang": "Ja",
        "Marktpositionierung": "Gaming",
        "Maximale Bildwiederholrate": "240 Hz",
        "Mitgelieferte Kabel": "AC, DisplayPort, USB",
        "NVIDIA G-SYNC": "Ja",
        "NVIDIA G-SYNC-Typ": "G-SYNC Compatible",
        "Natives Seitenverh\u00e4ltnis": "32:9",
        "PC Audio-Eingang": "Ja",
        "Paketgewicht": "20,4 kg",
        "Panel-Montage-Schnittstelle": "100 x 100 mm",
        "Panel-Typ": "VA",
        "Produktfarbe": "Wei\u00df",
        "Produktlink": "Link",
        "Relative Luftfeuchtigkeit in Betrieb": "10 - 80%",
        "Stromverbrauch (Standardbetrieb)": "55 W",
        "Stromverbrauch (Standby)": "0,5 W",
        "Stromverbrauch (aus)": "0,3 W",
        "St\u00e4nder enthalten": "Ja",
        "Technologie mit hohem Dynamikbereich (HDR)": "High Dynamic Range 10+ (HDR10 Plus)",
        "Tiefe (ohne Standfu\u00df)": "28,7 cm",
        "USB-Hub-Version": "3.2 Gen 1 (3.1 Gen 1)",
        "VESA-Halterung": "Ja",
        "Verpackungsbreite": "1265 mm",
        "Verpackungsh\u00f6he": "481 mm",
        "Verpackungstiefe": "366 mm",
        "Zertifizierung": "Windows 10",
        "sRGB Abdeckung (klassisch)": "125%",
        "\u20ac 182,00 \tinkl. Ustzuzgl. Versandkosten Neomounts by Newstar Select Tischhalterung F\u00fcr Curved MonitoreNeomounts by Newstar Select Tischhalterung F\u00fcr Curved Monitore, Klemme /Bolzen, 18 kg, 25,4 cm (10 Zoll), 124,5 cm (49 Zoll), 100 x 100 mm, Schwarz Versandlager:Graz:  5-9 Werktage ab Bestellung5-9 Werktage ab Bestellung  \u00a0Stk.  In den Warenkorb": "\u20ac 182,00 \tinkl. Ustzuzgl. Versandkosten"
    },
    "raw_specifications_text": "Bildschirmdiagonale: 124,5 cm (49 Zoll)\nBildschirmaufl\u00f6sung: 5120 x 1440 Pixel\nNatives Seitenverh\u00e4ltnis: 32:9\nPanel-Typ: VA\nHD-Typ: UltraWide 5K HD\nBildschirmtechnologie: QLED\nBildschirmform: Gebogen\nKontrastverh\u00e4ltnis: 1000000:1\nMaximale Bildwiederholrate: 240 Hz\nAnzahl der Farben des Displays: 1,07 Milliarden Farben\nHelligkeit (typisch): 2000 cd/m\u00b2\nBewertung der Bildschirmkr\u00fcmmung: 1000R\nDynamisches Kontrastverh\u00e4ltnis Marketingbezeichnung: Mega DCR\nBildwinkel, horizontal: 178\u00b0\nBildwinkel, vertikal: 178\u00b0\nHigh Dynamic Range Video (HDR) Unterst\u00fctzung: Ja\nTechnologie mit hohem Dynamikbereich (HDR): High Dynamic Range 10+ (HDR10 Plus)\nFarbskala: 95%\nsRGB Abdeckung (klassisch): 125%\nAdobe RGB-Abdeckung: 92%\nNVIDIA G-SYNC: Ja\nAMD FreeSync: Ja\nNVIDIA G-SYNC-Typ: G-SYNC Compatible\nAMD FreeSync-Typ: FreeSync Premium Pro\nEingebaute Lautsprecher: Nein\nIntegrierte Kamera: Nein\nMarktpositionierung: Gaming\nProduktfarbe: Wei\u00df\nZertifizierung: Windows 10\nIntegrierter USB-Hub: Ja\nHDMI: Ja\nKopfh\u00f6rerausgang: Ja\nUSB-Hub-Version: 3.2 Gen 1 (3.1 Gen 1)\nAnzahl der nachgeschalteten Steckpl\u00e4tze vom Typ USB-A: 2\nAnzahl HDMI-Anschl\u00fcsse: 2\nHDMI-Version: 2.1\nAnzahl DisplayPort Anschl\u00fcsse: 1\nDisplayPorts-Version: 1.4\nPC Audio-Eingang: Ja\nVESA-Halterung: Ja\nH\u00f6henverstellung: Ja\nPanel-Montage-Schnittstelle: 100 x 100 mm\nH\u00f6heneinstellung: 12 cm\nBild-in-Bild: Ja\nEnergieeffizienzklasse (HDR): G\nEnergieverbrauch (HDR) pro 1.000 Stunden: 95 kWh\nStromverbrauch (Standardbetrieb): 55 W\nStromverbrauch (Standby): 0,5 W\nStromverbrauch (aus): 0,3 W\nAC Eingangsspannung: 100 - 240 V\nBetriebstemperatur: 10 - 40 \u00b0C\nRelative Luftfeuchtigkeit in Betrieb: 10 - 80%\nGer\u00e4tebreite (inkl. Fu\u00df): 1149,5 mm\nGer\u00e4tetiefe (inkl. Fu\u00df): 418,3 mm\nGer\u00e4teh\u00f6he (inkl. Fu\u00df): 537,2 mm\nGewicht (mit St\u00e4nder): 14,5 kg\nBreite (ohne Standfu\u00df): 115 cm\nTiefe (ohne Standfu\u00df): 28,7 cm\nH\u00f6he (ohne Standfu\u00df): 36,4 cm\nGewicht (ohne St\u00e4nder): 11,9 kg\nSt\u00e4nder enthalten: Ja\nMitgelieferte Kabel: AC, DisplayPort, USB\nVerpackungsbreite: 1265 mm\nVerpackungstiefe: 366 mm\nVerpackungsh\u00f6he: 481 mm\nPaketgewicht: 20,4 kg\n\u20ac 182,00 \tinkl. Ustzuzgl. Versandkosten Neomounts by Newstar Select Tischhalterung F\u00fcr Curved MonitoreNeomounts by Newstar Select Tischhalterung F\u00fcr Curved Monitore, Klemme /Bolzen, 18 kg, 25,4 cm (10 Zoll), 124,5 cm (49 Zoll), 100 x 100 mm, Schwarz Versandlager:Graz:  5-9 Werktage ab Bestellung5-9 Werktage ab Bestellung  \u00a0Stk.  In den Warenkorb: \u20ac 182,00 \tinkl. Ustzuzgl. Versandkosten\nDatenblatt: Kein Datenblatt verf\u00fcgbar\nProduktlink: Link\nHerstellerlink: Samsung",
    "reference_file": "offer_reference_1304.json",
    "shop_name": "Syswork"
}