{
    "html_file": "offer_1650_26.html",
    "name": "HP E24i G4, 24\"",
    "offer_link": "https://www.office-partner.de/productredirect/index/sku/15428751Set1?sPartner=p-geizhals-at&campaign=psm/geizhals-at/",
    "price": 181.41,
    "raw_specifications": {
        "Anschl\u00fcsse": "HDMI, DisplayPort, USB, VGA/D-Sub",
        "Artikelnummer": "15428751Set1",
        "Aufl\u00f6sung Kurzname": "Full HD",
        "Bezeichnung des Herstellers": "HP E24i G4",
        "Bildwiederholungsrate": "60,00 Hz",
        "Breite": "425,00 mm",
        "Displaygr\u00f6\u00dfe": "60,96 cm (24 Zoll)",
        "Displayoberfl\u00e4che": "matt",
        "EEK - Spektrum": "AG",
        "Energieeffizienzklasse": "D",
        "Geh\u00e4usefarbe des Ger\u00e4tes": "Schwarz",
        "Gewicht": "9,14 kg",
        "Gewicht inkl. Verpackung in Kg": "10,40 kg",
        "Helligkeit Bereich": "150 - 300 cd/m\u00b2",
        "Hersteller": "HP Inc.",
        "H\u00f6he": "225,00 mm",
        "Inhalt (ml oder g)": "0,00 ml",
        "Kapazit\u00e4t (Seiten)": "0",
        "Kontrastverh\u00e4ltnis (typisch) Bereich": "800:1 bis 1.200:1",
        "LCD-Technologie": "IPS Panel",
        "L\u00e4nge": "610,00 mm",
        "Produktart": "Monitore",
        "Reaktionszeit": "5,00 ms",
        "Seitenverh\u00e4ltnis": "16:10",
        "Shop Herstellernummer": "9VJ40AA#ABB",
        "Standard-EAN": "0194850096761",
        "Verpackung - Breite in cm": "60,50 cm",
        "Verpackung - H\u00f6he in cm": "22,40 cm",
        "Verpackung - L\u00e4nge in cm": "42,00 cm",
        "max. Aufl\u00f6sung": "1.920 x 1.200 Pixel (16:10)"
    },
    "raw_specifications_text": "Energieeffizienzklasse: D\nGeh\u00e4usefarbe des Ger\u00e4tes: Schwarz\nAnschl\u00fcsse: HDMI, DisplayPort, USB, VGA/D-Sub\nHersteller: HP Inc.\nKontrastverh\u00e4ltnis (typisch) Bereich: 800:1 bis 1.200:1\nHelligkeit Bereich: 150 - 300 cd/m\u00b2\nDisplaygr\u00f6\u00dfe: 60,96 cm (24 Zoll)\nGewicht: 9,14 kg\nProduktart: Monitore\nAufl\u00f6sung Kurzname: Full HD\nInhalt (ml oder g): 0,00 ml\nKapazit\u00e4t (Seiten): 0\nEEK - Spektrum: AG\nH\u00f6he: 225,00 mm\nVerpackung - L\u00e4nge in cm: 42,00 cm\nStandard-EAN: 0194850096761\nShop Herstellernummer: 9VJ40AA#ABB\nBezeichnung des Herstellers: HP E24i G4\nBreite: 425,00 mm\nL\u00e4nge: 610,00 mm\nVerpackung - Breite in cm: 60,50 cm\nVerpackung - H\u00f6he in cm: 22,40 cm\nGewicht inkl. Verpackung in Kg: 10,40 kg\nArtikelnummer: 15428751Set1\nmax. Aufl\u00f6sung: 1.920 x 1.200 Pixel (16:10)\nSeitenverh\u00e4ltnis: 16:10\nLCD-Technologie: IPS Panel\nReaktionszeit: 5,00 ms\nDisplayoberfl\u00e4che: matt\nBildwiederholungsrate: 60,00 Hz",
    "reference_file": "offer_reference_1650.json",
    "shop_name": "office-partner (AT)"
}