{
    "html_file": "offer_235_2.html",
    "name": "LG UltraWide 34BQ77QB-B, 34\"",
    "offer_link": "https://www.csv-direct.de/artinfo.php?artnr=AGX1646908&KATEGORIE=162&pva=geizhals2",
    "price": 478.08,
    "raw_specifications": {
        "Anzahl DisplayPort Anschl\u00fcsse": "1",
        "Anzahl HDMI-Anschl\u00fcsse": "2",
        "Anzahl der Farben des Displays": "1,07 Milliarden Farben",
        "Anzahl der Lautsprecher": "2",
        "Anzahl der Upstream-Ports USB Typ-B": "1",
        "Anzahl der nachgeschalteten Ports vom Typ USB-C": "1",
        "Anzahl der nachgeschalteten Steckpl\u00e4tze vom Typ USB-A": "4",
        "Bewertung der Bildschirmkr\u00fcmmung": "3800R",
        "Bildschirmdiagonale": "86,4 cm 34\"",
        "Bildschirmform": "Gebogen",
        "Bildschirmtechnologie": "LED",
        "Bildwinkel, horizontal": "178\u00b0",
        "Bildwinkel, vertikal": "178\u00b0",
        "Breite ohne Standfu\u00df": "816,7 mm",
        "Display-Aufl\u00f6sung": "3440 x 1440 Pixel",
        "DisplayPort Kabell\u00e4nge": "1,8 m",
        "DisplayPorts-Version": "1.4",
        "Farbtiefe": "10 Bit",
        "Ger\u00e4tebreite inkl. Fu\u00df": "816,7 mm",
        "Ger\u00e4teh\u00f6he inkl. Fu\u00df": "617,6 mm",
        "Ger\u00e4tetiefe inkl. Fu\u00df": "252,9 mm",
        "Gewicht mit St\u00e4nder": "10,1 kg",
        "Gewicht ohne St\u00e4nder": "6,7 kg",
        "Gew\u00e4hrleistungsfrist": "3 Jahre",
        "HD-Typ": "UltraWide Quad HD",
        "HDCP-Version": "2.2",
        "HDMI-Kabell\u00e4nge": "1,8 m",
        "HDMI-Version": "2.0",
        "Helligkeit typisch": "300 cd/m\u00b2",
        "H\u00f6he ohne Standfu\u00df": "364,4 mm",
        "H\u00f6heneinstellung": "15 cm",
        "Integrierte Kamera": "Nein",
        "Kabelsperre-Slot": "Nein",
        "Kontrastverh\u00e4ltnis": "1000:1",
        "Kopfh\u00f6rerausg\u00e4nge": "1",
        "Markenspezifische Technologien": "Super+ Resolution",
        "Marktpositionierung": "Business",
        "Mitgelieferte Kabel": "Gleichstrom, DisplayPort, HDMI, USB Typ-A auf USB Typ-C",
        "NVIDIA G-SYNC": "Nein",
        "Nachhaltigkeitszertifikate": "ErP, Eidgen\u00f6ssische Kommunikationskommission FCC, REACH, RoHS",
        "Natives Seitenverh\u00e4ltnis": "21:9",
        "Neigungswinkelbereich": "-5 - 35\u00b0",
        "Paketgewicht": "13 kg",
        "Panel-Montage-Schnittstelle": "100 x 100 mm",
        "Panel-Typ": "IPS",
        "Pixel Abstand": "0,2325 x 0,2325 mm",
        "Produktfarbe": "Schwarz",
        "RMS-Leistung": "10 W",
        "Reaktionszeit": "5 ms",
        "Schwenkwinkelbereich": "-30 - 30\u00b0",
        "Smart-Modi": "Kino, Benutzerdefinierung, lebendig",
        "Stromkabell\u00e4nge": "1,8 m",
        "Technologie mit hohem Dynamikbereich HDR": "HDR Effect, High Dynamic Range 10 HDR10",
        "Tiefe ohne Standfu\u00df": "83,6 mm",
        "Touchscreen": "Nein",
        "Typ der Hintergrundbeleuchtung": "Seiten-LED",
        "USB-Stromversorgung bis zu": "90 W",
        "Verpackungsart": "Box",
        "Verpackungsbreite": "988 mm",
        "Verpackungsh\u00f6he": "571 mm",
        "Verpackungstiefe": "212 mm",
        "sRGB Abdeckung klassisch": "99"
    },
    "raw_specifications_text": "Bildschirmdiagonale: 86,4 cm 34\"\nDisplay-Aufl\u00f6sung: 3440 x 1440 Pixel\nNatives Seitenverh\u00e4ltnis: 21:9\nBildschirmtechnologie: LED\nTouchscreen: Nein\nHD-Typ: UltraWide Quad HD\nPanel-Typ: IPS\nBildschirmform: Gebogen\nKontrastverh\u00e4ltnis: 1000:1\nAnzahl der Farben des Displays: 1,07 Milliarden Farben\nTyp der Hintergrundbeleuchtung: Seiten-LED\nHelligkeit typisch: 300 cd/m\u00b2\nReaktionszeit: 5 ms\nBewertung der Bildschirmkr\u00fcmmung: 3800R\nBildwinkel, horizontal: 178\u00b0\nBildwinkel, vertikal: 178\u00b0\nPixel Abstand: 0,2325 x 0,2325 mm\nTechnologie mit hohem Dynamikbereich HDR: HDR Effect, High Dynamic Range 10 HDR10\nFarbtiefe: 10 Bit\nsRGB Abdeckung klassisch: 99\nNVIDIA G-SYNC: Nein\nMarkenspezifische Technologien: Super+ Resolution\nSmart-Modi: Kino, Benutzerdefinierung, lebendig\nIntegrierte Kamera: Nein\nAnzahl der Lautsprecher: 2\nRMS-Leistung: 10 W\nMarktpositionierung: Business\nProduktfarbe: Schwarz\nAnzahl der Upstream-Ports USB Typ-B: 1\nAnzahl der nachgeschalteten Steckpl\u00e4tze vom Typ USB-A: 4\nAnzahl der nachgeschalteten Ports vom Typ USB-C: 1\nUSB-Stromversorgung bis zu: 90 W\nAnzahl HDMI-Anschl\u00fcsse: 2\nHDMI-Version: 2.0\nAnzahl DisplayPort Anschl\u00fcsse: 1\nDisplayPorts-Version: 1.4\nKopfh\u00f6rerausg\u00e4nge: 1\nHDCP-Version: 2.2\nKabelsperre-Slot: Nein\nPanel-Montage-Schnittstelle: 100 x 100 mm\nH\u00f6heneinstellung: 15 cm\nSchwenkwinkelbereich: -30 - 30\u00b0\nNeigungswinkelbereich: -5 - 35\u00b0\nMitgelieferte Kabel: Gleichstrom, DisplayPort, HDMI, USB Typ-A auf USB Typ-C\nDisplayPort Kabell\u00e4nge: 1,8 m\nHDMI-Kabell\u00e4nge: 1,8 m\nStromkabell\u00e4nge: 1,8 m\nGer\u00e4tebreite inkl. Fu\u00df: 816,7 mm\nGer\u00e4tetiefe inkl. Fu\u00df: 252,9 mm\nGer\u00e4teh\u00f6he inkl. Fu\u00df: 617,6 mm\nGewicht mit St\u00e4nder: 10,1 kg\nBreite ohne Standfu\u00df: 816,7 mm\nTiefe ohne Standfu\u00df: 83,6 mm\nH\u00f6he ohne Standfu\u00df: 364,4 mm\nGewicht ohne St\u00e4nder: 6,7 kg\nVerpackungsbreite: 988 mm\nVerpackungstiefe: 212 mm\nVerpackungsh\u00f6he: 571 mm\nPaketgewicht: 13 kg\nVerpackungsart: Box\nNachhaltigkeitszertifikate: ErP, Eidgen\u00f6ssische Kommunikationskommission FCC, REACH, RoHS\nGew\u00e4hrleistungsfrist: 3 Jahre",
    "reference_file": "offer_reference_235.json",
    "shop_name": "CSV-Direct.de"
}