{
    "html_file": "offer_384_10.html",
    "name": "ASUS ZenScreen MB16AHG, 15.6\"",
    "offer_link": "https://www.csv-direct.de/artinfo.php?artnr=A1621613&KATEGORIE=162&pva=geizhals2",
    "price": 335.53,
    "raw_specifications": {
        "AC Eingangsfrequenz": "50 - 60 Hz",
        "AC Eingangsspannung": "100 - 240 V",
        "AMD FreeSync-Typ": "FreeSync Premium",
        "Anzahl Mini-HDMI-Anschl\u00fcsse": "1",
        "Anzahl der Farben des Displays": "16,7 Millionen Farben",
        "Anzahl der nachgeschalteten Ports vom Typ USB-C": "2",
        "Betriebstemperatur": "0 - 40 \u00b0C",
        "Bildschirmdiagonale": "39,6 cm 15.6\"",
        "Bildschirmform": "Flach",
        "Bildwinkel, horizontal": "178\u00b0",
        "Bildwinkel, vertikal": "178\u00b0",
        "Breite ohne Standfu\u00df": "359,9 mm",
        "Digital horizontale Frequenz": "30 - 180 kHz",
        "Digital vertikale Frequenz": "60 - 144 Hz",
        "Display-Aufl\u00f6sung": "1920 x 1080 Pixel",
        "Energieeffizienzklasse SDR": "E",
        "Energieverbrauch SDR pro 1.000 Stunden": "10 kWh",
        "Farbskala": "100",
        "Gewicht ohne St\u00e4nder": "920 g",
        "HD-Typ": "Full HD",
        "HDCP-Version": "1.4",
        "Helligkeit typisch": "300 cd/m\u00b2",
        "H\u00f6he ohne Standfu\u00df": "226,8 mm",
        "H\u00f6henverstellung": "Nein",
        "Integrierte Kamera": "Nein",
        "Integrierter USB-Hub": "Nein",
        "Kontrastverh\u00e4ltnis": "1200:1",
        "Kopfh\u00f6rerausg\u00e4nge": "1",
        "Markenspezifische Technologien": "SPLENDID",
        "Maximale Bildwiederholrate": "144 Hz",
        "Natives Seitenverh\u00e4ltnis": "16:9",
        "Neigungswinkelbereich": "15 - 35\u00b0",
        "Paketgewicht": "2,78 kg",
        "Panel-Typ": "IPS",
        "Pixel Abstand": "0,179 x 0,179 mm",
        "Produktfarbe": "Schwarz",
        "RGB-Farbraum": "sRGB",
        "Reaktionszeit": "3 ms",
        "Relative Luftfeuchtigkeit in Betrieb": "20 - 90",
        "Sichtbare Gr\u00f6\u00dfe horizontal": "34,4 cm",
        "Sichtbare Gr\u00f6\u00dfe vertikal": "19,4 cm",
        "Stromverbrauch PowerSave": "0,5 W",
        "Stromverbrauch Standardbetrieb": "17 W",
        "Stromverbrauch aus": "0,3 W",
        "Tiefe ohne Standfu\u00df": "11,9 mm",
        "Touchscreen": "Nein",
        "Typ der Hintergrundbeleuchtung": "LED",
        "Verpackungsart": "Box",
        "Verpackungsbreite": "485 mm",
        "Verpackungsh\u00f6he": "305 mm",
        "Verpackungstiefe": "76 mm"
    },
    "raw_specifications_text": "Bildschirmdiagonale: 39,6 cm 15.6\"\nDisplay-Aufl\u00f6sung: 1920 x 1080 Pixel\nNatives Seitenverh\u00e4ltnis: 16:9\nTouchscreen: Nein\nHD-Typ: Full HD\nPanel-Typ: IPS\nBildschirmform: Flach\nKontrastverh\u00e4ltnis: 1200:1\nMaximale Bildwiederholrate: 144 Hz\nAnzahl der Farben des Displays: 16,7 Millionen Farben\nTyp der Hintergrundbeleuchtung: LED\nHelligkeit typisch: 300 cd/m\u00b2\nReaktionszeit: 3 ms\nBildwinkel, horizontal: 178\u00b0\nBildwinkel, vertikal: 178\u00b0\nPixel Abstand: 0,179 x 0,179 mm\nSichtbare Gr\u00f6\u00dfe horizontal: 34,4 cm\nSichtbare Gr\u00f6\u00dfe vertikal: 19,4 cm\nDigital horizontale Frequenz: 30 - 180 kHz\nDigital vertikale Frequenz: 60 - 144 Hz\nRGB-Farbraum: sRGB\nFarbskala: 100\nAMD FreeSync-Typ: FreeSync Premium\nMarkenspezifische Technologien: SPLENDID\nIntegrierte Kamera: Nein\nProduktfarbe: Schwarz\nIntegrierter USB-Hub: Nein\nAnzahl der nachgeschalteten Ports vom Typ USB-C: 2\nAnzahl Mini-HDMI-Anschl\u00fcsse: 1\nKopfh\u00f6rerausg\u00e4nge: 1\nHDCP-Version: 1.4\nH\u00f6henverstellung: Nein\nNeigungswinkelbereich: 15 - 35\u00b0\nEnergieeffizienzklasse SDR: E\nEnergieverbrauch SDR pro 1.000 Stunden: 10 kWh\nStromverbrauch Standardbetrieb: 17 W\nStromverbrauch aus: 0,3 W\nStromverbrauch PowerSave: 0,5 W\nAC Eingangsspannung: 100 - 240 V\nAC Eingangsfrequenz: 50 - 60 Hz\nBetriebstemperatur: 0 - 40 \u00b0C\nRelative Luftfeuchtigkeit in Betrieb: 20 - 90\nBreite ohne Standfu\u00df: 359,9 mm\nTiefe ohne Standfu\u00df: 11,9 mm\nH\u00f6he ohne Standfu\u00df: 226,8 mm\nGewicht ohne St\u00e4nder: 920 g\nVerpackungsbreite: 485 mm\nVerpackungstiefe: 76 mm\nVerpackungsh\u00f6he: 305 mm\nPaketgewicht: 2,78 kg\nVerpackungsart: Box",
    "reference_file": "offer_reference_384.json",
    "shop_name": "CSV-Direct.de"
}