{
    "html_file": "offer_560_0.html",
    "name": "AOC 24P3QW, 23.8\"",
    "offer_link": "https://www.csv-direct.de/artinfo.php?artnr=A1621544&KATEGORIE=162&pva=geizhals2",
    "price": 173.53,
    "raw_specifications": {
        "AC Eingangsfrequenz": "50 - 60 Hz",
        "AC Eingangsspannung": "100 - 240 V",
        "Anzahl DisplayPort Anschl\u00fcsse": "1",
        "Anzahl HDMI-Anschl\u00fcsse": "2",
        "Anzahl der Farben des Displays": "16,7 Millionen Farben",
        "Anzahl der Lautsprecher": "2",
        "Anzahl der nachgeschalteten Steckpl\u00e4tze vom Typ USB-A": "4",
        "Au\u00dfenverkleidungstyp": "Texturiert",
        "Bildschirmdiagonale": "60,5 cm 23.8\"",
        "Bildschirmdiagonale cm": "60,5 cm",
        "Bildschirmform": "Flach",
        "Bildwinkel, horizontal": "178\u00b0",
        "Bildwinkel, vertikal": "178\u00b0",
        "Display-Aufl\u00f6sung": "1920 x 1080 Pixel",
        "DisplayPort Kabell\u00e4nge": "1,8 m",
        "DisplayPorts-Version": "1.2",
        "Energieeffizienzklasse HDR": "E",
        "Energieeffizienzklasse SDR": "E",
        "Energieeffizienzskala": "A bis G",
        "Energieverbrauch HDR pro 1.000 Stunden": "18 kWh",
        "Energieverbrauch SDR pro 1.000 Stunden": "18 kWh",
        "Enth\u00e4lt nicht": "PVC/BFR",
        "Gewicht mit St\u00e4nder": "3,35 kg",
        "HD-Typ": "Full HD",
        "HDCP-Version": "1.4",
        "HDMI-Kabell\u00e4nge": "1,8 m",
        "HDMI-Version": "1.4",
        "Helligkeit typisch": "300 cd/m\u00b2",
        "H\u00f6heneinstellung": "15 cm",
        "Kontrastverh\u00e4ltnis": "1000:1",
        "Kontrastverh\u00e4ltnis dynamisch": "50000000:1",
        "Marktpositionierung": "B\u00fcro",
        "Maximale Bildwiederholrate": "75 Hz",
        "Megapixel ca.": "2 MP",
        "Men\u00fcsprachen": "Vereinfachtes Chinesisch, Traditionelles Chinesisch, Tschechisch, Deutsch, Niederl\u00e4ndisch, Englisch, Spanisch, Finnisch, Franz\u00f6sisch, Italienisch, Japanisch, Koreanisch, Polnisch, Portugiesisch, Russisch, Schwedisch",
        "Mitgelieferte Kabel": "AC",
        "Mittlere Betriebsdauer zwischen Ausf\u00e4llen MTBF": "70000 h",
        "Nach Gebrauch recycelter Kunststoff": "85",
        "Nachhaltigkeitszertifikate": "EPEAT Silver",
        "Natives Seitenverh\u00e4ltnis": "16:9",
        "Neigungswinkelbereich": "-5 - 35\u00b0",
        "Netzteiltyp": "Intern",
        "Oberfl\u00e4chenh\u00e4rte": "3H",
        "Paketgewicht": "8 kg",
        "Panel-Montage-Schnittstelle": "100 x 100 mm",
        "Panel-Typ": "IPS",
        "Pixel Abstand": "0,2745 x 0,2745 mm",
        "Pixeldichte": "93 ppi",
        "Produktfarbe": "Schwarz",
        "RMS-Leistung": "10 W",
        "Reaktionszeit": "4 ms",
        "Recycelbares Verpackungsmaterial": "100",
        "Schwermetallfrei": "Hg Quecksilber",
        "Seitenverh\u00e4ltnis": "16:9",
        "Slot-Typ Kabelsperre": "Kensington",
        "Stromkabell\u00e4nge": "1,8 m",
        "Stromverbrauch Standardbetrieb": "18 W",
        "Stromverbrauch Standby": "0,5 W",
        "Stromverbrauch aus": "0,3 W",
        "Touchscreen": "Nein",
        "Typ der Hintergrundbeleuchtung": "W-LED",
        "USB-Hub-Version": "3.2 Gen 1 3.1 Gen 1",
        "Verpackungsbreite": "613 mm",
        "Verpackungsh\u00f6he": "519 mm",
        "Verpackungstiefe": "162 mm",
        "Vorderer Rahmen": "Schwarz"
    },
    "raw_specifications_text": "Bildschirmdiagonale: 60,5 cm 23.8\"\nDisplay-Aufl\u00f6sung: 1920 x 1080 Pixel\nNatives Seitenverh\u00e4ltnis: 16:9\nTouchscreen: Nein\nHD-Typ: Full HD\nPanel-Typ: IPS\nBildschirmform: Flach\nKontrastverh\u00e4ltnis: 1000:1\nMaximale Bildwiederholrate: 75 Hz\nAnzahl der Farben des Displays: 16,7 Millionen Farben\nTyp der Hintergrundbeleuchtung: W-LED\nHelligkeit typisch: 300 cd/m\u00b2\nReaktionszeit: 4 ms\nSeitenverh\u00e4ltnis: 16:9\nKontrastverh\u00e4ltnis dynamisch: 50000000:1\nBildwinkel, horizontal: 178\u00b0\nBildwinkel, vertikal: 178\u00b0\nPixel Abstand: 0,2745 x 0,2745 mm\nPixeldichte: 93 ppi\nBildschirmdiagonale cm: 60,5 cm\nOberfl\u00e4chenh\u00e4rte: 3H\nAnzahl der Lautsprecher: 2\nRMS-Leistung: 10 W\nMegapixel ca.: 2 MP\nMarktpositionierung: B\u00fcro\nProduktfarbe: Schwarz\nVorderer Rahmen: Schwarz\nSchwermetallfrei: Hg Quecksilber\nUSB-Hub-Version: 3.2 Gen 1 3.1 Gen 1\nAnzahl der nachgeschalteten Steckpl\u00e4tze vom Typ USB-A: 4\nAnzahl HDMI-Anschl\u00fcsse: 2\nHDMI-Version: 1.4\nAnzahl DisplayPort Anschl\u00fcsse: 1\nDisplayPorts-Version: 1.2\nHDCP-Version: 1.4\nPanel-Montage-Schnittstelle: 100 x 100 mm\nSlot-Typ Kabelsperre: Kensington\nH\u00f6heneinstellung: 15 cm\nNeigungswinkelbereich: -5 - 35\u00b0\nMen\u00fcsprachen: Vereinfachtes Chinesisch, Traditionelles Chinesisch, Tschechisch, Deutsch, Niederl\u00e4ndisch, Englisch, Spanisch, Finnisch, Franz\u00f6sisch, Italienisch, Japanisch, Koreanisch, Polnisch, Portugiesisch, Russisch, Schwedisch\nEnergieeffizienzklasse SDR: E\nEnergieeffizienzklasse HDR: E\nEnergieverbrauch SDR pro 1.000 Stunden: 18 kWh\nEnergieverbrauch HDR pro 1.000 Stunden: 18 kWh\nStromverbrauch Standardbetrieb: 18 W\nStromverbrauch Standby: 0,5 W\nStromverbrauch aus: 0,3 W\nAC Eingangsspannung: 100 - 240 V\nAC Eingangsfrequenz: 50 - 60 Hz\nNetzteiltyp: Intern\nEnergieeffizienzskala: A bis G\nMitgelieferte Kabel: AC\nDisplayPort Kabell\u00e4nge: 1,8 m\nHDMI-Kabell\u00e4nge: 1,8 m\nStromkabell\u00e4nge: 1,8 m\nGewicht mit St\u00e4nder: 3,35 kg\nVerpackungsbreite: 613 mm\nVerpackungstiefe: 162 mm\nVerpackungsh\u00f6he: 519 mm\nPaketgewicht: 8 kg\nNachhaltigkeitszertifikate: EPEAT Silver\nEnth\u00e4lt nicht: PVC/BFR\nNach Gebrauch recycelter Kunststoff: 85\nAu\u00dfenverkleidungstyp: Texturiert\nRecycelbares Verpackungsmaterial: 100\nMittlere Betriebsdauer zwischen Ausf\u00e4llen MTBF: 70000 h",
    "reference_file": "offer_reference_560.json",
    "shop_name": "CSV-Direct.de"
}