{
    "html_file": "offer_393_11.html",
    "name": "LG UltraGear 34GN850P-B, 34\"",
    "offer_link": "https://direkt.jacob.de/produkte/lg-34-34gn850p-b-34gn850p-b-artnr-8271399.html?utm_source=geizhals&utm_medium=cpc&utm_campaign=Preisvergleich&ref=103",
    "price": 658.26,
    "raw_specifications": {
        "AC Eingangsspannung": "240 V",
        "AMD FreeSync": "Ja",
        "AMD FreeSync-Typ": "FreeSync",
        "Abnehmbarer Standfu\u00df": "Ja",
        "Anzahl DisplayPort Anschl\u00fcsse": "1",
        "Anzahl HDMI-Anschl\u00fcsse": "2",
        "Anzahl Mini DisplayPorts": "1",
        "Anzahl der Farben des Displays": "1,07 Milliarden Farben",
        "Anzahl der nachgeschalteten Steckpl\u00e4tze vom Typ USB-A": "2",
        "Anzahl der vorgeschalteten Steckpl\u00e4tze": "1",
        "Beleuchteter St\u00e4nder": "Ja",
        "Bewertung der Bildschirmkr\u00fcmmung": "1900R",
        "Bildschirmdiagonale": "86,4 cm (34\" )",
        "Bildschirmdiagonale (cm)": "86,7 cm",
        "Bildschirmform": "Gebogen",
        "Bildschirmtechnologie": "LED",
        "Bildwinkel, horizontal": "178\u00b0",
        "Bildwinkel, vertikal": "178\u00b0",
        "Blendfreier Bildschirm": "Ja",
        "Breite (ohne Standfu\u00df)": "81,9 cm",
        "DVI Anschluss": "Nein",
        "Display-Aufl\u00f6sung": "3440 x 1440 Pixel",
        "DisplayPorts-Version": "1.4",
        "Eingebautes Mikrofon": "Nein",
        "Energieeffizienzklasse (HDR)": "G",
        "Energieeffizienzklasse (SDR)": "G",
        "Energieeffizienzskala": "A bis G",
        "Energieverbrauch (HDR) pro 1.000 Stunden": "63 kWh",
        "Energieverbrauch (SDR) pro 1.000 Stunden": "32 kWh",
        "Farbskala": "98%",
        "Farbtiefe": "10 Bit",
        "Ger\u00e4tebreite (inkl. Fu\u00df)": "819,2 mm",
        "Ger\u00e4teh\u00f6he (inkl. Fu\u00df)": "574,1 mm",
        "Ger\u00e4tetiefe (inkl. Fu\u00df)": "312,2 mm",
        "Gewicht (mit St\u00e4nder)": "7,6 kg",
        "Gewicht (ohne St\u00e4nder)": "5,5 kg",
        "HD-Typ": "Wide Quad HD",
        "HDMI": "Ja",
        "HDMI-Version": "2.0",
        "Helligkeit (peak)": "500 cd/m\u00b2",
        "Helligkeit (typisch)": "400 cd/m\u00b2",
        "High Dynamic Range Video (HDR) Unterst\u00fctzung": "Ja",
        "H\u00f6he (ohne Standfu\u00df)": "36,2 cm",
        "H\u00f6heneinstellung": "11 cm",
        "H\u00f6henverstellung": "Ja",
        "Integrierte Kamera": "Nein",
        "Integrierter USB-Hub": "Ja",
        "Kontrastverh\u00e4ltnis": "1000:1",
        "Kopfh\u00f6rerausgang": "Ja",
        "Marktpositionierung": "Gaming",
        "Maximale Bildwiederholrate": "144 Hz",
        "Mitgelieferte Kabel": "DisplayPort, HDMI, Leistung, USB",
        "NVIDIA G-SYNC": "Ja",
        "NVIDIA G-SYNC-Typ": "G-SYNC Compatible",
        "Nachhaltigkeitszertifikate": "China Compulsory Certification (???), ErP, REACH, RoHS",
        "Natives Seitenverh\u00e4ltnis": "21:9",
        "Neigungswinkelbereich": "5 - 15\u00b0",
        "Netzteil Ausgangsspannung": "19 V",
        "Netzteiltyp": "Extern",
        "On-Screen-Display (OSD)": "Ja",
        "PC Audio-Eingang": "Nein",
        "Paketgewicht": "11,5 kg",
        "Panel-Montage-Schnittstelle": "100 x 100 mm",
        "Panel-Typ": "AH-IPS",
        "Pivot": "Nein",
        "Produktfarbe": "Schwarz",
        "RGB-Farbraum": "DCI-P3",
        "Reaktionszeit": "1 ms",
        "Smart-Modi": "Energiesparend",
        "Stromverbrauch (Standardbetrieb)": "72 W",
        "Stromverbrauch (Standby)": "0,5 W",
        "Stromverbrauch (aus)": "0,3 W",
        "Stromverbrauch (max.)": "80 W",
        "St\u00e4nder enthalten": "Ja",
        "Technologie mit hohem Dynamikbereich (HDR)": "HDR Effect, High Dynamic Range (HDR) 400, High Dynamic Range 10 (HDR10)",
        "Tiefe (ohne Standfu\u00df)": "10,4 cm",
        "Touchscreen": "Nein",
        "Typ der Hintergrundbeleuchtung": "Seiten-LED",
        "VESA-Halterung": "Ja",
        "Verpackungsart": "Box",
        "Verpackungsbreite": "979 mm",
        "Verpackungsh\u00f6he": "521 mm",
        "Verpackungstiefe": "245 mm"
    },
    "raw_specifications_text": "Bildschirmdiagonale: 86,4 cm (34\" )\nDisplay-Aufl\u00f6sung: 3440 x 1440 Pixel\nNatives Seitenverh\u00e4ltnis: 21:9\nBildschirmtechnologie: LED\nTouchscreen: Nein\nHD-Typ: Wide Quad HD\nPanel-Typ: AH-IPS\nBildschirmform: Gebogen\nKontrastverh\u00e4ltnis: 1000:1\nMaximale Bildwiederholrate: 144 Hz\nAnzahl der Farben des Displays: 1,07 Milliarden Farben\nTyp der Hintergrundbeleuchtung: Seiten-LED\nHelligkeit (peak): 500 cd/m\u00b2\nHelligkeit (typisch): 400 cd/m\u00b2\nReaktionszeit: 1 ms\nBlendfreier Bildschirm: Ja\nBewertung der Bildschirmkr\u00fcmmung: 1900R\nBildwinkel, horizontal: 178\u00b0\nBildwinkel, vertikal: 178\u00b0\nBildschirmdiagonale (cm): 86,7 cm\nHigh Dynamic Range Video (HDR) Unterst\u00fctzung: Ja\nTechnologie mit hohem Dynamikbereich (HDR): HDR Effect, High Dynamic Range (HDR) 400, High Dynamic Range 10 (HDR10)\nFarbtiefe: 10 Bit\nRGB-Farbraum: DCI-P3\nFarbskala: 98%\nNVIDIA G-SYNC: Ja\nAMD FreeSync: Ja\nNVIDIA G-SYNC-Typ: G-SYNC Compatible\nAMD FreeSync-Typ: FreeSync\nSmart-Modi: Energiesparend\nIntegrierte Kamera: Nein\nEingebautes Mikrofon: Nein\nMarktpositionierung: Gaming\nProduktfarbe: Schwarz\nAbnehmbarer Standfu\u00df: Ja\nBeleuchteter St\u00e4nder: Ja\nIntegrierter USB-Hub: Ja\nHDMI: Ja\nKopfh\u00f6rerausgang: Ja\nAnzahl der vorgeschalteten Steckpl\u00e4tze: 1\nAnzahl der nachgeschalteten Steckpl\u00e4tze vom Typ USB-A: 2\nDVI Anschluss: Nein\nAnzahl HDMI-Anschl\u00fcsse: 2\nHDMI-Version: 2.0\nAnzahl DisplayPort Anschl\u00fcsse: 1\nDisplayPorts-Version: 1.4\nAnzahl Mini DisplayPorts: 1\nPC Audio-Eingang: Nein\nVESA-Halterung: Ja\nH\u00f6henverstellung: Ja\nPanel-Montage-Schnittstelle: 100 x 100 mm\nH\u00f6heneinstellung: 11 cm\nPivot: Nein\nNeigungswinkelbereich: 5 - 15\u00b0\nOn-Screen-Display (OSD): Ja\nEnergieeffizienzklasse (SDR): G\nEnergieeffizienzklasse (HDR): G\nEnergieverbrauch (SDR) pro 1.000 Stunden: 32 kWh\nEnergieverbrauch (HDR) pro 1.000 Stunden: 63 kWh\nStromverbrauch (Standardbetrieb): 72 W\nStromverbrauch (Standby): 0,5 W\nStromverbrauch (max.): 80 W\nStromverbrauch (aus): 0,3 W\nAC Eingangsspannung: 240 V\nNetzteil Ausgangsspannung: 19 V\nNetzteiltyp: Extern\nEnergieeffizienzskala: A bis G\nSt\u00e4nder enthalten: Ja\nMitgelieferte Kabel: DisplayPort, HDMI, Leistung, USB\nGer\u00e4tebreite (inkl. Fu\u00df): 819,2 mm\nGer\u00e4tetiefe (inkl. Fu\u00df): 312,2 mm\nGer\u00e4teh\u00f6he (inkl. Fu\u00df): 574,1 mm\nGewicht (mit St\u00e4nder): 7,6 kg\nBreite (ohne Standfu\u00df): 81,9 cm\nTiefe (ohne Standfu\u00df): 10,4 cm\nH\u00f6he (ohne Standfu\u00df): 36,2 cm\nGewicht (ohne St\u00e4nder): 5,5 kg\nVerpackungsbreite: 979 mm\nVerpackungstiefe: 245 mm\nVerpackungsh\u00f6he: 521 mm\nPaketgewicht: 11,5 kg\nVerpackungsart: Box\nNachhaltigkeitszertifikate: China Compulsory Certification (???), ErP, REACH, RoHS",
    "reference_file": "offer_reference_393.json",
    "shop_name": "Jacob Elektronik direkt (AT)"
}