{
    "html_file": "offer_1012_34.html",
    "name": "Dell P3223DE, 31.5\"",
    "offer_link": "https://www.proshop.at/Bildschirm/Dell-32-Bildschirm-P3223DE-2560x1440-QHD-IPS-90W-USB-C-HUB-Black-5-ms/3053838?utm_source=geizhals&utm_medium=cpc&utm_campaign=pricesite",
    "price": 416.16,
    "raw_specifications": {
        "Abmessungen (Breite x Tiefe x H\u00f6he)": "71.242 cm x 23.01 cm x 61.715 cm - mit Fu\u00df",
        "Abmessungen (Breite x Tiefe x H\u00f6he) - mit Fu\u00df": "71.242 cm x 23.01 cm x 61.715 cm",
        "Besonderheiten": "LED-Randlichtsystem, ohne Quecksilber, arsenfreies Glas, an 3 Seiten ohne Blende, Dell ComfortView Plus",
        "Bildschirmbeschichtung": "Blendfrei",
        "Bildschirmtyp": "IPS",
        "Details zu Abmessungen & Gewicht": "Mit Fu\u00df - Breite: 71.242 cm - Tiefe: 23.01 cm - H\u00f6he: 61.715 cm - Gewicht: 11.7 kg  Ohne Fu\u00df - Gewicht: 7.06 kg",
        "Diagonalabmessung": "80.001 cm (31.5\")",
        "Display-Typ": "LED-hintergrundbeleuchteter LCD-Monitor / TFT-Aktivmatrix",
        "EAN": "5397184656815",
        "ENERGY STAR zertifiziert": "Ja",
        "Ein-/Aus-Schalter": "Ja",
        "Eingangsanschl\u00fcsse": "HDMI, DisplayPort, USB-C",
        "Eingangsspannung": "Wechselstrom 100-240 V (50/60 Hz)",
        "Einstellungen der Anzeigeposition": "H\u00f6he, Pivot (Rotation), Drehung, Neigung",
        "Energie Effizienzklasse": "Klasse F",
        "Energierverbrauch Sleep": "0.3 Watt",
        "Enthaltene Kabel": "1 x DisplayPort-Kabel - DisplayPort zu DisplayPort - 1.8 m  1 x USB 3.2 Gen 1 Upstream-Kabel - USB Typ A auf C - 1.8 m  1 x Kabel USB-C auf USB-C - 1 m",
        "Ethernet integriert": "Ja",
        "Farbraum": "99% sRGB",
        "Farbunterst\u00fctzung": "1,07 Mrd. Farben",
        "Ger\u00e4tetyp": "LED-hintergrundbeleuchteter LCD-Monitor - 80.001 cm (31.5\")",
        "Gewicht": "11.7 kg",
        "Helligkeit": "350 cd/m\u00b2",
        "Hersteller": "Dell",
        "Hintergrundbeleuchtungs-Technologie": "LED-Hintergrundbeleuchtung",
        "Horizontaler Betrachtungswinkel": "178",
        "H\u00f6heneinstellung": "150 mm",
        "Integrierte Peripherieger\u00e4te": "USB 3.2 Gen 1/USB-C Hub",
        "Kennzeichnung": "RoHS, NFPA 99, BFR-frei, PVC-free",
        "Kontrast": "1000:1 / 1000:1 (dynamisch)",
        "Leistungsaufnahme im Ein-Zustand": "29.9 W",
        "Leistungsmerkmale": "Slot f\u00fcr Sicherheitsschloss (Kabelschloss getrennt erh\u00e4ltlich), Unterst\u00fctzung f\u00fcr VESA-Schnittstelle",
        "Modell": "DELL-P3223DE",
        "Native Aufl\u00f6sung": "QHD 2560 x 1440 bei 60 Hz",
        "Neigungswinkel": "-5/+21",
        "Pixelpitch": "0.2727 mm",
        "Ppi": "93",
        "Produktbeschreibung": "Dell P3223DE - LED-Monitor - QHD - 80.001 cm (31.5\") - TAA-konform",
        "Reaktionszeit": "5 ms (Fast), 8 ms (normal)",
        "Schnittstellen": "HDMI (HDCP 1.4)  DisplayPort 1.4 (HDCP 1.4)  DisplayPort-Ausgang (HDCP 1.4, MST)  USB-C Upstream/DisplayPort 1,4 Alt Mode mit Spannungsversorgung (bis zu 90 W)  4 x USB 3.2 Gen 1 Downstream  LAN (RJ-45)",
        "Schwenkwinkel": "90",
        "Seitenverh\u00e4ltnis": "16:9",
        "Spannung": "Wechselstrom 100-240 V (50/60 Hz)",
        "Stromverbrauch (Aus-Modus)": "0.3 Watt",
        "Stromverbrauch (typisch)": "183 Watt",
        "Stromverbrauch SDR (eingeschaltet)": "29.9 kWh/1.000 h",
        "Stromverbrauch im Standby-Modus": "0.3 Watt",
        "TAA-kompatibel": "Ja",
        "TCO-zertifiziert": "TCO Certified Edge Displays, TCO Certified Displays 9",
        "Transportgewicht": "15.32 kg",
        "USB-Spannungsversorgung": "90 Watt",
        "Umweltschutzstandards": "TCO Certified Edge Displays, TCO Certified Displays 9, ENERGY STAR-qualifiziert",
        "VESA-Halterung": "100 x 100 mm",
        "Vertikaler Betrachtungswinkel": "178",
        "Waren-Nr.": "3053838",
        "Zum Hersteller": "www.dell.com/"
    },
    "raw_specifications_text": "Hersteller: Dell\nWaren-Nr.: 3053838\nModell: DELL-P3223DE\nEAN: 5397184656815\nZum Hersteller: www.dell.com/\nProduktbeschreibung: Dell P3223DE - LED-Monitor - QHD - 80.001 cm (31.5\") - TAA-konform\nGer\u00e4tetyp: LED-hintergrundbeleuchteter LCD-Monitor - 80.001 cm (31.5\")\nEnergie Effizienzklasse: Klasse F\nLeistungsaufnahme im Ein-Zustand: 29.9 W\nLeistungsmerkmale: Slot f\u00fcr Sicherheitsschloss (Kabelschloss getrennt erh\u00e4ltlich), Unterst\u00fctzung f\u00fcr VESA-Schnittstelle\nBildschirmtyp: IPS\nSeitenverh\u00e4ltnis: 16:9\nNative Aufl\u00f6sung: QHD 2560 x 1440 bei 60 Hz\nPixelpitch: 0.2727 mm\nHelligkeit: 350 cd/m\u00b2\nKontrast: 1000:1 / 1000:1 (dynamisch)\nReaktionszeit: 5 ms (Fast), 8 ms (normal)\nFarbunterst\u00fctzung: 1,07 Mrd. Farben\nFarbraum: 99% sRGB\nEingangsanschl\u00fcsse: HDMI, DisplayPort, USB-C\nEthernet integriert: Ja\nEinstellungen der Anzeigeposition: H\u00f6he, Pivot (Rotation), Drehung, Neigung\nBildschirmbeschichtung: Blendfrei\nSpannung: Wechselstrom 100-240 V (50/60 Hz)\nAbmessungen (Breite x Tiefe x H\u00f6he) - mit Fu\u00df: 71.242 cm x 23.01 cm x 61.715 cm\nGewicht: 11.7 kg\nTAA-kompatibel: Ja\nUmweltschutzstandards: TCO Certified Edge Displays, TCO Certified Displays 9, ENERGY STAR-qualifiziert\nKennzeichnung: RoHS, NFPA 99, BFR-frei, PVC-free\nDisplay-Typ: LED-hintergrundbeleuchteter LCD-Monitor / TFT-Aktivmatrix\nDiagonalabmessung: 80.001 cm (31.5\")\nIntegrierte Peripherieger\u00e4te: USB 3.2 Gen 1/USB-C Hub\nUSB-Spannungsversorgung: 90 Watt\nPpi: 93\nHorizontaler Betrachtungswinkel: 178\nVertikaler Betrachtungswinkel: 178\nHintergrundbeleuchtungs-Technologie: LED-Hintergrundbeleuchtung\nBesonderheiten: LED-Randlichtsystem, ohne Quecksilber, arsenfreies Glas, an 3 Seiten ohne Blende, Dell ComfortView Plus\nAbmessungen (Breite x Tiefe x H\u00f6he): 71.242 cm x 23.01 cm x 61.715 cm - mit Fu\u00df\nSchnittstellen: HDMI (HDCP 1.4)  DisplayPort 1.4 (HDCP 1.4)  DisplayPort-Ausgang (HDCP 1.4, MST)  USB-C Upstream/DisplayPort 1,4 Alt Mode mit Spannungsversorgung (bis zu 90 W)  4 x USB 3.2 Gen 1 Downstream  LAN (RJ-45)\nNeigungswinkel: -5/+21\nSchwenkwinkel: 90\nH\u00f6heneinstellung: 150 mm\nVESA-Halterung: 100 x 100 mm\nEnthaltene Kabel: 1 x DisplayPort-Kabel - DisplayPort zu DisplayPort - 1.8 m  1 x USB 3.2 Gen 1 Upstream-Kabel - USB Typ A auf C - 1.8 m  1 x Kabel USB-C auf USB-C - 1 m\nEingangsspannung: Wechselstrom 100-240 V (50/60 Hz)\nStromverbrauch SDR (eingeschaltet): 29.9 kWh/1.000 h\nStromverbrauch (typisch): 183 Watt\nStromverbrauch im Standby-Modus: 0.3 Watt\nEnergierverbrauch Sleep: 0.3 Watt\nStromverbrauch (Aus-Modus): 0.3 Watt\nEin-/Aus-Schalter: Ja\nDetails zu Abmessungen & Gewicht: Mit Fu\u00df - Breite: 71.242 cm - Tiefe: 23.01 cm - H\u00f6he: 61.715 cm - Gewicht: 11.7 kg  Ohne Fu\u00df - Gewicht: 7.06 kg\nTransportgewicht: 15.32 kg\nTCO-zertifiziert: TCO Certified Edge Displays, TCO Certified Displays 9\nENERGY STAR zertifiziert: Ja",
    "reference_file": "offer_reference_1012.json",
    "shop_name": "Proshop.at"
}