{
    "html_file": "offer_1490_6.html",
    "name": "Samsung CRG9 (2021), 49\"",
    "offer_link": "https://www.mylemon.at/artikel/samsung/lc49rg94ssrxzg/y-lcd-c49rg94ssu-49-dark.html",
    "price": 1018.99,
    "raw_specifications": {
        "AMD FreeSync": "Ja",
        "Anzahl DisplayPort Anschl\u00fcsse": "1",
        "Anzahl HDMI-Anschl\u00fcsse": "1",
        "Anzahl der Farben des Displays": "1,07 Milliarden Farben",
        "Artikelnummer": "M14YY91L",
        "Aufl\u00f6sung": "5120x1440",
        "Besonderheiten": "120 Hz, Curved",
        "Bewertung der Bildschirmkr\u00fcmmung": "1800R",
        "Bildschirmdiagonale": "124,5 cm (49 Zoll)",
        "Bildschirmdiagonale (cm)": "124 cm",
        "Bildschirmform": "Gebogen",
        "Bildschirmtechnologie": "LED",
        "Bildwinkel, horizontal": "178\u00b0",
        "Bildwinkel, vertikal": "178\u00b0",
        "Display-Aufl\u00f6sung": "5120 x 1440 Pixel",
        "Displaygr\u00f6\u00dfe": "49 Zoll",
        "EAN": "8806092020702",
        "Energieeffizienzklasse (HDR)": "G",
        "Energieeffizienzklasse (SDR)": "G",
        "Energieeffizienzskala": "A bis G",
        "Energieverbrauch (HDR) pro 1.000 Stunden": "110 kWh",
        "Energieverbrauch (SDR) pro 1.000 Stunden": "55 kWh",
        "Ergonomie": "H\u00f6henverstellbar, Neigbar",
        "Flimmerfreie Technologie": "Ja",
        "HD-Typ": "UltraWide Dual Quad HD",
        "HDMI": "Ja",
        "Helligkeit": "600 cd/m\u00b2",
        "Helligkeit (typisch)": "600 cd/m\u00b2",
        "Hersteller Artikelnummer": "LC49RG94SSRXZG",
        "Integrierter USB-Hub": "Ja",
        "Kontrastverh\u00e4ltnis": "3000:1",
        "Kopfh\u00f6rerausgang": "Ja",
        "Marktpositionierung": "Gaming",
        "Maximale Bildwiederholrate": "120 Hz",
        "Natives Seitenverh\u00e4ltnis": "32:9",
        "On-Screen-Display (OSD)": "Ja",
        "Panel": "VA",
        "Panel-Montage-Schnittstelle": "100 x 100 mm",
        "Panel-Typ": "VA",
        "Produktfarbe": "Blau, Grau",
        "Reaktionszeit": "4 ms",
        "Seitenverh\u00e4ltnis": "32:9",
        "Stromverbrauch (Standardbetrieb)": "55 W",
        "Stromverbrauch (Standby)": "0,5 W",
        "Stromverbrauch (aus)": "0,3 W",
        "Touchscreen": "Nein",
        "Typ der Hintergrundbeleuchtung": "LED",
        "Unterst\u00fctzte Grafik-Aufl\u00f6sungen": "5120 x 1440",
        "VESA Halterung": "100x100 mm",
        "VESA-Halterung": "Ja",
        "Video Anschl\u00fcsse": "1x HDMI, 2x DisplayPort",
        "Warentarifnummer (HS)": "85285210"
    },
    "raw_specifications_text": "Displaygr\u00f6\u00dfe: 49 Zoll\nAufl\u00f6sung: 5120x1440\nPanel: VA\nReaktionszeit: 4 ms\nVideo Anschl\u00fcsse: 1x HDMI, 2x DisplayPort\nErgonomie: H\u00f6henverstellbar, Neigbar\nVESA Halterung: 100x100 mm\nHelligkeit: 600 cd/m\u00b2\nBesonderheiten: 120 Hz, Curved\nHersteller Artikelnummer: LC49RG94SSRXZG\nEAN: 8806092020702\nArtikelnummer: M14YY91L\nBildschirmdiagonale: 124,5 cm (49 Zoll)\nDisplay-Aufl\u00f6sung: 5120 x 1440 Pixel\nNatives Seitenverh\u00e4ltnis: 32:9\nBildschirmtechnologie: LED\nTouchscreen: Nein\nHD-Typ: UltraWide Dual Quad HD\nPanel-Typ: VA\nBildschirmform: Gebogen\nKontrastverh\u00e4ltnis: 3000:1\nMaximale Bildwiederholrate: 120 Hz\nAnzahl der Farben des Displays: 1,07 Milliarden Farben\nTyp der Hintergrundbeleuchtung: LED\nHelligkeit (typisch): 600 cd/m\u00b2\nBewertung der Bildschirmkr\u00fcmmung: 1800R\nUnterst\u00fctzte Grafik-Aufl\u00f6sungen: 5120 x 1440\nSeitenverh\u00e4ltnis: 32:9\nBildwinkel, horizontal: 178\u00b0\nBildwinkel, vertikal: 178\u00b0\nBildschirmdiagonale (cm): 124 cm\nAMD FreeSync: Ja\nFlimmerfreie Technologie: Ja\nMarktpositionierung: Gaming\nProduktfarbe: Blau, Grau\nIntegrierter USB-Hub: Ja\nHDMI: Ja\nKopfh\u00f6rerausgang: Ja\nAnzahl HDMI-Anschl\u00fcsse: 1\nAnzahl DisplayPort Anschl\u00fcsse: 1\nVESA-Halterung: Ja\nPanel-Montage-Schnittstelle: 100 x 100 mm\nOn-Screen-Display (OSD): Ja\nEnergieeffizienzklasse (SDR): G\nEnergieeffizienzklasse (HDR): G\nEnergieverbrauch (SDR) pro 1.000 Stunden: 55 kWh\nEnergieverbrauch (HDR) pro 1.000 Stunden: 110 kWh\nStromverbrauch (Standardbetrieb): 55 W\nStromverbrauch (Standby): 0,5 W\nStromverbrauch (aus): 0,3 W\nEnergieeffizienzskala: A bis G\nWarentarifnummer (HS): 85285210",
    "reference_file": "offer_reference_1490.json",
    "shop_name": "mylemon.at"
}