{
    "html_file": "offer_985_1.html",
    "name": "ASUS VA247HE, 23.8\"",
    "offer_link": "https://www.proshop.at/Bildschirm/ASUS-24-Bildschirm-VA247HE-Black-5-ms-AMD-FreeSync/3061208?utm_source=geizhals&utm_medium=cpc&utm_campaign=pricesite",
    "price": 106.06,
    "raw_specifications": {
        "Abmessungen (Breite x Tiefe x H\u00f6he)": "54.135 cm x 20.594 cm x 40.364 cm - mit Fu\u00df",
        "Abmessungen (Breite x Tiefe x H\u00f6he) - mit Fu\u00df": "54.135 cm x 20.594 cm x 40.364 cm",
        "Adaptive-Sync Technologie": "AMD FreeSync",
        "Besonderheiten": "HDCP, rahmenlos, ASUS Splendid Video Intelligence Technology, Trace Free Technology, ASUS QuickFit Virtual Scale, ASUS GamePlus, flimmerfreie Technologie, Farbtemperatur Auswahl, Low Blue Light-Technologie, ASUS EyeCare+ Technology",
        "Bildschirmbeschichtung": "Blendfrei",
        "Bildschirmtyp": "VA",
        "Details zu Abmessungen & Gewicht": "Mit Fu\u00df - Breite: 54.135 cm - Tiefe: 20.594 cm - H\u00f6he: 40.364 cm - Gewicht: 3.25 kg  Ohne Fu\u00df - Breite: 54.135 cm - Tiefe: 4.944 cm - H\u00f6he: 32.541 cm - Gewicht: 2.87 kg",
        "Diagonalabmessung": "60.5 cm (24\")",
        "Display-Typ": "LED-hintergrundbeleuchteter LCD-Monitor / TFT-Aktivmatrix",
        "EAN": "4711081167464",
        "Eingangsanschl\u00fcsse": "HDMI, DVI, VGA",
        "Eingangsspannung": "Wechselstrom 100-240 V (50/60 Hz)",
        "Einstellungen der Anzeigeposition": "Neigung",
        "Energie Effizienzklasse": "Klasse F",
        "Enthaltene Kabel": "1 x HDMI-Kabel  1 x VGA-Kabel  1 x Netzteil",
        "Entwickelt f\u00fcr": "Komplett Office Micro R9",
        "Farbe": "Schwarz",
        "Farbunterst\u00fctzung": "16,7 Millionen Farben",
        "Ger\u00e4tetyp": "LED-hintergrundbeleuchteter LCD-Monitor - 60.5 cm (24\")",
        "Gewicht": "3.25 kg",
        "Helligkeit": "250 cd/m\u00b2",
        "Hersteller": "ASUS",
        "Hintergrundbeleuchtungs-Technologie": "LED-Hintergrundbeleuchtung",
        "Horizontale Bildwiederholrate": "24 - 84 kHz",
        "Horizontaler Betrachtungswinkel": "178",
        "Kennzeichnung": "TUV Rheinland Low Blue Light Certification, TUV Rheinland Flicker Free Certification, HDCP 1.4",
        "Kontrast": "3000:1 / 100000000:1 (dynamisch)",
        "Leistungsmerkmale": "Slot f\u00fcr Sicherheitsschloss (Kabelschloss getrennt erh\u00e4ltlich)",
        "Modell": "90LM0795-B01170",
        "Native Aufl\u00f6sung": "Full HD (1080p) 1920 x 1080 bei 75 Hz",
        "Neigungswinkel": "-5/+23",
        "Pixelpitch": "0.2745 mm",
        "Produktbeschreibung": "ASUS VA247HE - LED-Monitor - Full HD (1080p) - 60.5 cm (24\")",
        "Reaktionszeit": "5 ms (Gray-to-Gray)",
        "Schlosstyp zur Diebstahlsicherung": "Kensington Slot",
        "Schnittstellen": "HDMI  DVI  VGA",
        "Seitenverh\u00e4ltnis": "16:9",
        "Spannung": "Wechselstrom 100-240 V (50/60 Hz)",
        "Stromverbrauch (Aus-Modus)": "0.3 Watt",
        "Stromverbrauch (typisch)": "17 Watt",
        "Stromverbrauch SDR (eingeschaltet)": "22 kWh/1.000 h",
        "Stromverbrauch im Standby-Modus": "0.5 Watt",
        "Transportbreite": "59.9 cm",
        "Transportgewicht": "5.18 kg",
        "Transporth\u00f6he": "41.5 cm",
        "Transporttiefe": "12.7 cm",
        "VESA-Halterung": "100 x 100 mm",
        "Vertikale Bildwiederholrate": "48 - 75 Hz",
        "Vertikaler Betrachtungswinkel": "178",
        "Waren-Nr.": "3061208",
        "Zum Hersteller": "www.asus.com/index.aspx"
    },
    "raw_specifications_text": "Hersteller: ASUS\nWaren-Nr.: 3061208\nModell: 90LM0795-B01170\nEAN: 4711081167464\nZum Hersteller: www.asus.com/index.aspx\nProduktbeschreibung: ASUS VA247HE - LED-Monitor - Full HD (1080p) - 60.5 cm (24\")\nGer\u00e4tetyp: LED-hintergrundbeleuchteter LCD-Monitor - 60.5 cm (24\")\nEnergie Effizienzklasse: Klasse F\nAdaptive-Sync Technologie: AMD FreeSync\nBildschirmtyp: VA\nSeitenverh\u00e4ltnis: 16:9\nNative Aufl\u00f6sung: Full HD (1080p) 1920 x 1080 bei 75 Hz\nPixelpitch: 0.2745 mm\nHelligkeit: 250 cd/m\u00b2\nKontrast: 3000:1 / 100000000:1 (dynamisch)\nReaktionszeit: 5 ms (Gray-to-Gray)\nFarbunterst\u00fctzung: 16,7 Millionen Farben\nEingangsanschl\u00fcsse: HDMI, DVI, VGA\nEinstellungen der Anzeigeposition: Neigung\nBildschirmbeschichtung: Blendfrei\nSpannung: Wechselstrom 100-240 V (50/60 Hz)\nFarbe: Schwarz\nAbmessungen (Breite x Tiefe x H\u00f6he) - mit Fu\u00df: 54.135 cm x 20.594 cm x 40.364 cm\nGewicht: 3.25 kg\nKennzeichnung: TUV Rheinland Low Blue Light Certification, TUV Rheinland Flicker Free Certification, HDCP 1.4\nEntwickelt f\u00fcr: Komplett Office Micro R9\nDisplay-Typ: LED-hintergrundbeleuchteter LCD-Monitor / TFT-Aktivmatrix\nDiagonalabmessung: 60.5 cm (24\")\nVertikale Bildwiederholrate: 48 - 75 Hz\nHorizontale Bildwiederholrate: 24 - 84 kHz\nHorizontaler Betrachtungswinkel: 178\nVertikaler Betrachtungswinkel: 178\nHintergrundbeleuchtungs-Technologie: LED-Hintergrundbeleuchtung\nBesonderheiten: HDCP, rahmenlos, ASUS Splendid Video Intelligence Technology, Trace Free Technology, ASUS QuickFit Virtual Scale, ASUS GamePlus, flimmerfreie Technologie, Farbtemperatur Auswahl, Low Blue Light-Technologie, ASUS EyeCare+ Technology\nAbmessungen (Breite x Tiefe x H\u00f6he): 54.135 cm x 20.594 cm x 40.364 cm - mit Fu\u00df\nSchnittstellen: HDMI  DVI  VGA\nNeigungswinkel: -5/+23\nVESA-Halterung: 100 x 100 mm\nLeistungsmerkmale: Slot f\u00fcr Sicherheitsschloss (Kabelschloss getrennt erh\u00e4ltlich)\nEnthaltene Kabel: 1 x HDMI-Kabel  1 x VGA-Kabel  1 x Netzteil\nSchlosstyp zur Diebstahlsicherung: Kensington Slot\nEingangsspannung: Wechselstrom 100-240 V (50/60 Hz)\nStromverbrauch SDR (eingeschaltet): 22 kWh/1.000 h\nStromverbrauch (typisch): 17 Watt\nStromverbrauch im Standby-Modus: 0.5 Watt\nStromverbrauch (Aus-Modus): 0.3 Watt\nDetails zu Abmessungen & Gewicht: Mit Fu\u00df - Breite: 54.135 cm - Tiefe: 20.594 cm - H\u00f6he: 40.364 cm - Gewicht: 3.25 kg  Ohne Fu\u00df - Breite: 54.135 cm - Tiefe: 4.944 cm - H\u00f6he: 32.541 cm - Gewicht: 2.87 kg\nTransportbreite: 59.9 cm\nTransporttiefe: 12.7 cm\nTransporth\u00f6he: 41.5 cm\nTransportgewicht: 5.18 kg",
    "reference_file": "offer_reference_985.json",
    "shop_name": "Proshop.at"
}