{
    "html_file": "offer_1235_0.html",
    "name": "ASUS TUF Gaming VG28UQL1A, 28\"",
    "offer_link": "https://www.csv-direct.de/artinfo.php?artnr=A1621528&KATEGORIE=162&pva=geizhals2",
    "price": 622.34,
    "raw_specifications": {
        "AC Eingangsfrequenz": "50 - 60 Hz",
        "AC Eingangsspannung": "100 - 240 V",
        "AMD FreeSync-Typ": "FreeSync Premium",
        "Anzahl DisplayPort Anschl\u00fcsse": "1",
        "Anzahl HDMI-Anschl\u00fcsse": "4",
        "Anzahl der Farben des Displays": "1,073 Milliarden Farben",
        "Anzahl der Lautsprecher": "2",
        "Anzahl der nachgeschalteten Steckpl\u00e4tze vom Typ USB-A": "2",
        "Anzahl der vorgeschalteten Steckpl\u00e4tze": "1",
        "Bildschirmdiagonale": "71,1 cm 28\"",
        "Bildschirmform": "Flach",
        "Bildschirmtechnologie": "LCD",
        "Bildwinkel, horizontal": "178\u00b0",
        "Bildwinkel, vertikal": "178\u00b0",
        "Breite ohne Standfu\u00df": "639,5 mm",
        "Digital horizontale Frequenz": "30 - 340 kHz",
        "Digital vertikale Frequenz": "48 - 144 Hz",
        "Display-Aufl\u00f6sung": "3840 x 2160 Pixel",
        "DisplayPorts-Version": "1.4",
        "Dynamisches Kontrastverh\u00e4ltnis Marketingbezeichnung": "SmartContrast",
        "Energieeffizienzklasse HDR": "G",
        "Energieeffizienzklasse SDR": "G",
        "Energieeffizienzskala": "A bis G",
        "Energieverbrauch HDR pro 1.000 Stunden": "60 kWh",
        "Energieverbrauch SDR pro 1.000 Stunden": "33 kWh",
        "Farbskala": "90",
        "Fu\u00dffarbe": "Schwarz",
        "Ger\u00e4tebreite inkl. Fu\u00df": "639,5 mm",
        "Ger\u00e4teh\u00f6he inkl. Fu\u00df": "539,8 mm",
        "Ger\u00e4tetiefe inkl. Fu\u00df": "213,8 mm",
        "Gewicht mit St\u00e4nder": "6,89 kg",
        "Gewicht ohne St\u00e4nder": "4,67 kg",
        "HD-Typ": "4K Ultra HD",
        "HDMI-Version": "2.0/2.1",
        "Helligkeit peak": "450 cd/m\u00b2",
        "Helligkeit typisch": "300 cd/m\u00b2",
        "H\u00f6he ohne Standfu\u00df": "369,4 mm",
        "H\u00f6heneinstellung": "12 cm",
        "Integrierte Kamera": "Nein",
        "Kontrastverh\u00e4ltnis": "1000:1",
        "Kontrastverh\u00e4ltnis dynamisch": "1000000:1",
        "Kopfh\u00f6rer-Anschluss": "3,5 mm",
        "Kopfh\u00f6rerausg\u00e4nge": "1",
        "Marktpositionierung": "Gaming",
        "Maximale Bildwiederholrate": "144 Hz",
        "Mitgelieferte Kabel": "AC, DisplayPort, HDMI, USB Typ-A",
        "NVIDIA G-SYNC-Typ": "G-SYNC Compatible",
        "Natives Seitenverh\u00e4ltnis": "16:9",
        "Neigungswinkelbereich": "20 - -5\u00b0",
        "Paketgewicht": "10,4 kg",
        "Panel-Montage-Schnittstelle": "100 x 100 mm",
        "Panel-Typ": "IPS",
        "Pivot Winkel": "90 - -90\u00b0",
        "Pixel Abstand": "0,16 x 0,16 mm",
        "Produktfarbe": "Schwarz",
        "RGB-Farbraum": "DCI-P3",
        "RMS-Leistung": "4 W",
        "Reaktionszeit": "1 ms",
        "Schwenkwinkelbereich": "15 - -15\u00b0",
        "Sichtbare Gr\u00f6\u00dfe horizontal": "62,1 cm",
        "Sichtbare Gr\u00f6\u00dfe vertikal": "34,1 cm",
        "Slot-Typ Kabelsperre": "Kensington",
        "Stromverbrauch PowerSave": "0,45 W",
        "Stromverbrauch Standardbetrieb": "33 W",
        "Stromverbrauch Standby": "0,3 W",
        "Stromverbrauch aus": "0,3 W",
        "Technologie mit hohem Dynamikbereich HDR": "High Dynamic Range 10 HDR10",
        "Tiefe ohne Standfu\u00df": "65,7 mm",
        "Touchscreen": "Nein",
        "Typ der Hintergrundbeleuchtung": "LED",
        "USB-Hub-Version": "3.2 Gen 1 3.1 Gen 1",
        "Verpackungsart": "Box",
        "Verpackungsbreite": "716 mm",
        "Verpackungsh\u00f6he": "446 mm",
        "Verpackungstiefe": "224 mm",
        "Warentarifnummer HS": "85285210"
    },
    "raw_specifications_text": "Bildschirmdiagonale: 71,1 cm 28\"\nDisplay-Aufl\u00f6sung: 3840 x 2160 Pixel\nNatives Seitenverh\u00e4ltnis: 16:9\nBildschirmtechnologie: LCD\nTouchscreen: Nein\nHD-Typ: 4K Ultra HD\nPanel-Typ: IPS\nBildschirmform: Flach\nKontrastverh\u00e4ltnis: 1000:1\nMaximale Bildwiederholrate: 144 Hz\nAnzahl der Farben des Displays: 1,073 Milliarden Farben\nTyp der Hintergrundbeleuchtung: LED\nHelligkeit peak: 450 cd/m\u00b2\nHelligkeit typisch: 300 cd/m\u00b2\nReaktionszeit: 1 ms\nKontrastverh\u00e4ltnis dynamisch: 1000000:1\nDynamisches Kontrastverh\u00e4ltnis Marketingbezeichnung: SmartContrast\nBildwinkel, horizontal: 178\u00b0\nBildwinkel, vertikal: 178\u00b0\nPixel Abstand: 0,16 x 0,16 mm\nSichtbare Gr\u00f6\u00dfe horizontal: 62,1 cm\nSichtbare Gr\u00f6\u00dfe vertikal: 34,1 cm\nDigital horizontale Frequenz: 30 - 340 kHz\nDigital vertikale Frequenz: 48 - 144 Hz\nTechnologie mit hohem Dynamikbereich HDR: High Dynamic Range 10 HDR10\nRGB-Farbraum: DCI-P3\nFarbskala: 90\nNVIDIA G-SYNC-Typ: G-SYNC Compatible\nAMD FreeSync-Typ: FreeSync Premium\nIntegrierte Kamera: Nein\nAnzahl der Lautsprecher: 2\nRMS-Leistung: 4 W\nMarktpositionierung: Gaming\nProduktfarbe: Schwarz\nFu\u00dffarbe: Schwarz\nUSB-Hub-Version: 3.2 Gen 1 3.1 Gen 1\nAnzahl der vorgeschalteten Steckpl\u00e4tze: 1\nAnzahl der nachgeschalteten Steckpl\u00e4tze vom Typ USB-A: 2\nAnzahl HDMI-Anschl\u00fcsse: 4\nHDMI-Version: 2.0/2.1\nAnzahl DisplayPort Anschl\u00fcsse: 1\nDisplayPorts-Version: 1.4\nKopfh\u00f6rerausg\u00e4nge: 1\nKopfh\u00f6rer-Anschluss: 3,5 mm\nPanel-Montage-Schnittstelle: 100 x 100 mm\nSlot-Typ Kabelsperre: Kensington\nH\u00f6heneinstellung: 12 cm\nPivot Winkel: 90 - -90\u00b0\nSchwenkwinkelbereich: 15 - -15\u00b0\nNeigungswinkelbereich: 20 - -5\u00b0\nEnergieeffizienzklasse SDR: G\nEnergieeffizienzklasse HDR: G\nEnergieverbrauch SDR pro 1.000 Stunden: 33 kWh\nEnergieverbrauch HDR pro 1.000 Stunden: 60 kWh\nStromverbrauch Standardbetrieb: 33 W\nStromverbrauch Standby: 0,3 W\nStromverbrauch aus: 0,3 W\nStromverbrauch PowerSave: 0,45 W\nAC Eingangsspannung: 100 - 240 V\nAC Eingangsfrequenz: 50 - 60 Hz\nEnergieeffizienzskala: A bis G\nMitgelieferte Kabel: AC, DisplayPort, HDMI, USB Typ-A\nGer\u00e4tebreite inkl. Fu\u00df: 639,5 mm\nGer\u00e4tetiefe inkl. Fu\u00df: 213,8 mm\nGer\u00e4teh\u00f6he inkl. Fu\u00df: 539,8 mm\nGewicht mit St\u00e4nder: 6,89 kg\nBreite ohne Standfu\u00df: 639,5 mm\nTiefe ohne Standfu\u00df: 65,7 mm\nH\u00f6he ohne Standfu\u00df: 369,4 mm\nGewicht ohne St\u00e4nder: 4,67 kg\nVerpackungsbreite: 716 mm\nVerpackungstiefe: 224 mm\nVerpackungsh\u00f6he: 446 mm\nPaketgewicht: 10,4 kg\nVerpackungsart: Box\nWarentarifnummer HS: 85285210",
    "reference_file": "offer_reference_1235.json",
    "shop_name": "CSV-Direct.de"
}