{
    "html_file": "offer_2459_5.html",
    "name": "NEC MultiSync EX241UN-BK schwarz, 24\"",
    "offer_link": "https://www.electronicshop24.at/product_info.php?products_id=20000000389235146&ano=I389235146&mno=60004064&ean=5028695113596&utm_medium=cpc&utm_campaign=preisvergleich&utm_content=item&utm_source=geizhals&ref=geizhals",
    "price": 458.0,
    "raw_specifications": {
        "Abmessungen (Breite x Tiefe x H\u00f6he)": "53.78 cm x 20.43 cm x 36.97 cm - mit Fu\u00df",
        "Ausgangsleistung/Kanal": "1 Watt",
        "Besonderheiten": "Umgebungslichtsensor, Abdeckung f\u00fcr Kabelf\u00fchrung, HDCP, ColorComp, Eco-Mode, ControlSync, 100% sRGB-Farbskala, Digital Uniformity Control (DUC), Carbon Footprint Meter, Carbon Savings Meter, Low Blue Light Mode, flimmerfreie Technologie, NaViSet Administrator 2, DICOM-Simulation",
        "Bildschirmtyp": "IPS",
        "Diagonalabmessung": "60.47 cm (24\")",
        "Display-Typ": "LED-hintergrundbeleuchteter LCD-Monitor / TFT-Aktivmatrix",
        "ENERGY STAR zertifiziert": "Ja",
        "Einstellungen der Anzeigeposition": "H\u00f6he, Pivot (Rotation), Drehung, Neigung",
        "Energie Effizienzklasse": "Klasse A+",
        "Energieverbrauch pro Jahr": "23 kWh",
        "Enthaltene Kabel": "1 x ControlSync-Kabel \u00a6 1 x DisplayPort-Kabel \u00a6 1 x USB-Kabel",
        "Erforderliche Netzspannung": "Wechselstrom 120/230 V (50/60 Hz)",
        "Farbe": "Schwarz",
        "Farbunterst\u00fctzung": "16,8 Millionen Farben",
        "Gewicht": "5.6 kg",
        "Helligkeit": "250 cd/m\u00b2",
        "Hintergrundbeleuchtungs-Technologie": "LED-Hintergrundbeleuchtung",
        "Horizontale Bildwiederholrate": "31.5 - 83 kHz",
        "Horizontaler Betrachtungswinkel": "+89 / -89",
        "H\u00f6heneinstellung": "100 mm",
        "Integrierte Peripherieger\u00e4te": "USB 3.0-Hub",
        "Kennzeichnung": "FCC Klasse B bescheinigt, CSA, UL, TUV GS, GOST, cUL, DDC-2B, MPR III, PCT, TUV Ergo, DDC/CI, GEEA, ERP, ISO 9241-307 Class 1",
        "Kontrast": "1000:1 / 5000:1 (dynamisch)",
        "Leistungsaufnahme im Ein-Zustand": "16 W",
        "Max. Betriebstemperatur": "35 \u00b0C",
        "Min Betriebstemperatur": "5 \u00b0C",
        "Native Aufl\u00f6sung": "Full HD (1080p) 1920 x 1080",
        "Neigungswinkel": "-5/+30",
        "Pixelpitch": "0.2745 mm",
        "Rotationswinkel": "90",
        "Schnittstellen": "DisplayPort \u00a6 DisplayPort-Ausgang \u00a6 DVI-D \u00a6 HDMI \u00a6 VGA \u00a6 3 x USB 3.0 Downstream \u00a6 USB 3.0 Upstream \u00a6 Kopfh\u00f6rer \u00a6 Audio Line-In \u00a6 2 x Management \u00a6 Sensor",
        "Schwenkwinkel": "340",
        "Seitenverh\u00e4ltnis": "16:9",
        "Service & Support": "Begrenzte Garantie - 3 Jahre",
        "Sichtbare Bildfl\u00e4che": "60.47 cm (24\")",
        "Stromverbrauch (typisch)": "45 Watt",
        "TCO-zertifiziert": "TCO Certified Displays 8, TCO Certified Edge Displays",
        "Typ": "Lautsprecher - Stereo",
        "Vertikale Bildwiederholrate": "56 - 75 Hz",
        "Vertikaler Betrachtungswinkel": "+89 / -89",
        "Zul\u00e4ssige Luftfeuchtigkeit im Betrieb": "20 - 80%"
    },
    "raw_specifications_text": "Display-Typ: LED-hintergrundbeleuchteter LCD-Monitor / TFT-Aktivmatrix\nEnergie Effizienzklasse: Klasse A+\nEnergieverbrauch pro Jahr: 23 kWh\nDiagonalabmessung: 60.47 cm (24\")\nSichtbare Bildfl\u00e4che: 60.47 cm (24\")\nIntegrierte Peripherieger\u00e4te: USB 3.0-Hub\nBildschirmtyp: IPS\nSeitenverh\u00e4ltnis: 16:9\nNative Aufl\u00f6sung: Full HD (1080p) 1920 x 1080\nPixelpitch: 0.2745 mm\nHelligkeit: 250 cd/m\u00b2\nKontrast: 1000:1 / 5000:1 (dynamisch)\nFarbunterst\u00fctzung: 16,8 Millionen Farben\nVertikale Bildwiederholrate: 56 - 75 Hz\nHorizontale Bildwiederholrate: 31.5 - 83 kHz\nHorizontaler Betrachtungswinkel: +89 / -89\nVertikaler Betrachtungswinkel: +89 / -89\nHintergrundbeleuchtungs-Technologie: LED-Hintergrundbeleuchtung\nBesonderheiten: Umgebungslichtsensor, Abdeckung f\u00fcr Kabelf\u00fchrung, HDCP, ColorComp, Eco-Mode, ControlSync, 100% sRGB-Farbskala, Digital Uniformity Control (DUC), Carbon Footprint Meter, Carbon Savings Meter, Low Blue Light Mode, flimmerfreie Technologie, NaViSet Administrator 2, DICOM-Simulation\nFarbe: Schwarz\nAbmessungen (Breite x Tiefe x H\u00f6he): 53.78 cm x 20.43 cm x 36.97 cm - mit Fu\u00df\nGewicht: 5.6 kg\nTyp: Lautsprecher - Stereo\nAusgangsleistung/Kanal: 1 Watt\nSchnittstellen: DisplayPort \u00a6 DisplayPort-Ausgang \u00a6 DVI-D \u00a6 HDMI \u00a6 VGA \u00a6 3 x USB 3.0 Downstream \u00a6 USB 3.0 Upstream \u00a6 Kopfh\u00f6rer \u00a6 Audio Line-In \u00a6 2 x Management \u00a6 Sensor\nEinstellungen der Anzeigeposition: H\u00f6he, Pivot (Rotation), Drehung, Neigung\nNeigungswinkel: -5/+30\nSchwenkwinkel: 340\nRotationswinkel: 90\nH\u00f6heneinstellung: 100 mm\nEnthaltene Kabel: 1 x ControlSync-Kabel \u00a6 1 x DisplayPort-Kabel \u00a6 1 x USB-Kabel\nKennzeichnung: FCC Klasse B bescheinigt, CSA, UL, TUV GS, GOST, cUL, DDC-2B, MPR III, PCT, TUV Ergo, DDC/CI, GEEA, ERP, ISO 9241-307 Class 1\nErforderliche Netzspannung: Wechselstrom 120/230 V (50/60 Hz)\nLeistungsaufnahme im Ein-Zustand: 16 W\nStromverbrauch (typisch): 45 Watt\nTCO-zertifiziert: TCO Certified Displays 8, TCO Certified Edge Displays\nENERGY STAR zertifiziert: Ja\nService & Support: Begrenzte Garantie - 3 Jahre\nMin Betriebstemperatur: 5 \u00b0C\nMax. Betriebstemperatur: 35 \u00b0C\nZul\u00e4ssige Luftfeuchtigkeit im Betrieb: 20 - 80%",
    "reference_file": "offer_reference_2459.json",
    "shop_name": "ElectronicShop24"
}