{
    "html_file": "offer_1514_13.html",
    "name": "ViewSonic VG2440V, 23.8\"",
    "offer_link": "https://www.1ashop.at/de/produkt/58196/viewsonic-vg2440v-led-monitor-61-cm-24.html",
    "price": 208.45,
    "raw_specifications": {
        "Abmessungen (Breite x Tiefe x H\u00f6he)": "54.9 cm x 5 cm x 35.2 cm - ohne Fu\u00df",
        "Ausgangsleistung/Kanal": "2 Watt",
        "Bildschirmbeschichtung": "Blendfrei, 3H Hard Coating",
        "Bildschirmtyp": "IPS",
        "Details zu Abmessungen & Gewicht": "Ohne Fu\u00df - Breite: 54.9 cm - Tiefe: 5 cm - H\u00f6he: 35.2 cm - Gewicht: 3.6 kg  Mit Fu\u00df - Gewicht: 6 kg",
        "Diagonalabmessung": "61 cm (24\")",
        "Display-Typ": "LED-hintergrundbeleuchteter LCD-Monitor / TFT-Aktivmatrix",
        "EAN/UPC": "766907009644",
        "ENERGY STAR zertifiziert": "Ja",
        "Eingangsspannung": "Wechselstrom 120/230 V (50/60 Hz)",
        "Energie Effizienzklasse": "Klasse F",
        "Enthaltene Kabel": "1 x HDMI-Kabel  1 x USB Upstream-Kabel  1 x Audiokabel",
        "Farbunterst\u00fctzung": "16,7 Millionen Farben",
        "Gewicht": "3.6 kg",
        "Gruppe": "TFTs",
        "Helligkeit": "250 cd/m\u00b2",
        "Hersteller": "ViewSonic",
        "Hersteller Art. Nr.": "VG2440V",
        "Hintergrundbeleuchtungs-Technologie": "LED-Hintergrundbeleuchtung",
        "Horizontaler Betrachtungswinkel": "178",
        "Integrierte Peripherieger\u00e4te": "USB Hub",
        "Kennzeichnung": "FCC Klasse B bescheinigt, ICES-003, cTUVus, Mexico Energy label, Mexico CoC",
        "Kontrast": "1000:1 / 50000000:1 (dynamisch)",
        "Leistungsaufnahme im Ein-Zustand": "21.8 W",
        "Leistungsmerkmale": "Slot f\u00fcr Sicherheitsschloss (Kabelschloss getrennt erh\u00e4ltlich)",
        "Native Aufl\u00f6sung": "Full HD (1080p) 1920 x 1080",
        "Reaktionszeit": "5 ms (Gray-to-Gray)",
        "Schlosstyp zur Diebstahlsicherung": "Kensington Slot",
        "Schnittstellen": "USB (Typ A)  2 x USB (Typ B)  Audio Line-In  Audio Line-Out  VGA  HDMI  DisplayPort",
        "Seitenverh\u00e4ltnis": "16:9",
        "Service und Support": "Begrenzte Garantie - Arbeitszeit und Ersatzteile - 3 Jahre  Begrenzte Garantie - Leuchtpult - 3 Jahre",
        "Sichtbare Bildfl\u00e4che": "60.5 cm (23.8\")",
        "Stromverbrauch (typisch)": "13.7 Watt",
        "Stromverbrauch SDR (eingeschaltet)": "21.8 kWh/1.000 h",
        "Stromverbrauch im Standby-Modus": "0.5 Watt",
        "TCO-zertifiziert": "TCO Certified Displays 8",
        "Transportbreite": "60.9 cm",
        "Transportgewicht": "8.7 kg",
        "Transporth\u00f6he": "40.5 cm",
        "Transporttiefe": "21 cm",
        "Typ": "Lautsprecher - Stereo",
        "VESA-Halterung": "100 x 100 mm",
        "Vertikaler Betrachtungswinkel": "178"
    },
    "raw_specifications_text": "Gruppe: TFTs\nHersteller: ViewSonic\nHersteller Art. Nr.: VG2440V\nEAN/UPC: 766907009644\nDisplay-Typ: LED-hintergrundbeleuchteter LCD-Monitor / TFT-Aktivmatrix\nEnergie Effizienzklasse: Klasse F\nDiagonalabmessung: 61 cm (24\")\nSichtbare Bildfl\u00e4che: 60.5 cm (23.8\")\nBildschirmtyp: IPS\nIntegrierte Peripherieger\u00e4te: USB Hub\nSeitenverh\u00e4ltnis: 16:9\nNative Aufl\u00f6sung: Full HD (1080p) 1920 x 1080\nHelligkeit: 250 cd/m\u00b2\nKontrast: 1000:1 / 50000000:1 (dynamisch)\nFarbunterst\u00fctzung: 16,7 Millionen Farben\nReaktionszeit: 5 ms (Gray-to-Gray)\nHorizontaler Betrachtungswinkel: 178\nVertikaler Betrachtungswinkel: 178\nBildschirmbeschichtung: Blendfrei, 3H Hard Coating\nHintergrundbeleuchtungs-Technologie: LED-Hintergrundbeleuchtung\nAbmessungen (Breite x Tiefe x H\u00f6he): 54.9 cm x 5 cm x 35.2 cm - ohne Fu\u00df\nGewicht: 3.6 kg\nLeistungsaufnahme im Ein-Zustand: 21.8 W\nEingangsspannung: Wechselstrom 120/230 V (50/60 Hz)\nStromverbrauch SDR (eingeschaltet): 21.8 kWh/1.000 h\nStromverbrauch im Standby-Modus: 0.5 Watt\nStromverbrauch (typisch): 13.7 Watt\nSchnittstellen: USB (Typ A)  2 x USB (Typ B)  Audio Line-In  Audio Line-Out  VGA  HDMI  DisplayPort\nTyp: Lautsprecher - Stereo\nAusgangsleistung/Kanal: 2 Watt\nVESA-Halterung: 100 x 100 mm\nLeistungsmerkmale: Slot f\u00fcr Sicherheitsschloss (Kabelschloss getrennt erh\u00e4ltlich)\nEnthaltene Kabel: 1 x HDMI-Kabel  1 x USB Upstream-Kabel  1 x Audiokabel\nSchlosstyp zur Diebstahlsicherung: Kensington Slot\nKennzeichnung: FCC Klasse B bescheinigt, ICES-003, cTUVus, Mexico Energy label, Mexico CoC\nDetails zu Abmessungen & Gewicht: Ohne Fu\u00df - Breite: 54.9 cm - Tiefe: 5 cm - H\u00f6he: 35.2 cm - Gewicht: 3.6 kg  Mit Fu\u00df - Gewicht: 6 kg\nTransportbreite: 60.9 cm\nTransporttiefe: 21 cm\nTransportgewicht: 8.7 kg\nTransporth\u00f6he: 40.5 cm\nTCO-zertifiziert: TCO Certified Displays 8\nENERGY STAR zertifiziert: Ja\nService und Support: Begrenzte Garantie - Arbeitszeit und Ersatzteile - 3 Jahre  Begrenzte Garantie - Leuchtpult - 3 Jahre",
    "reference_file": "offer_reference_1514.json",
    "shop_name": "1ashop.at"
}