{
    "html_file": "offer_1266_9.html",
    "name": "Samsung S95UA (2021), 49\"",
    "offer_link": "https://direkt.jacob.de/produkte/samsung-ls49a950uiu-124-5-ls49a950uiuxen-artnr-7215923.html?utm_source=geizhals&utm_medium=cpc&utm_campaign=Preisvergleich&ref=103",
    "price": 1128.58,
    "raw_specifications": {
        "AC Eingangsspannung": "100 - 240 V",
        "Adobe RGB-Abdeckung": "92%",
        "Anzahl DisplayPort Anschl\u00fcsse": "1",
        "Anzahl HDMI-Anschl\u00fcsse": "2",
        "Anzahl der Farben des Displays": "1,07 Milliarden Farben",
        "Anzahl der nachgeschalteten Ports vom Typ USB-C": "1",
        "Bewertung der Bildschirmkr\u00fcmmung": "1800R",
        "Bildschirmaufl\u00f6sung": "5120 x 1440 Pixel",
        "Bildschirmdiagonale": "124,5 cm (49\" )",
        "Bildschirmdiagonale (cm)": "124 cm",
        "Bildschirmform": "Gebogen",
        "Bildschirmtechnologie": "OLED",
        "Blickwinkel, horizontal": "178\u00b0",
        "Blickwinkel, vertikal": "178\u00b0",
        "Breite (ohne Standfu\u00df)": "120 cm",
        "DisplayPorts-Version": "1.4",
        "Eingebaute Lautsprecher": "Ja",
        "Energieeffizienzklasse (HDR)": "G",
        "Energieeffizienzklasse (SDR)": "G",
        "Energieeffizienzskala": "A bis G",
        "Energieverbrauch (HDR) pro 1.000 Stunden": "95 kWh",
        "Energieverbrauch (SDR) pro 1.000 Stunden": "55 kWh",
        "Farbskala": "95%",
        "Flimmerfreie Technologie": "Ja",
        "Ger\u00e4tebreite (inkl. Fu\u00df)": "1199,5 mm",
        "Ger\u00e4teh\u00f6he (inkl. Fu\u00df)": "523,1 mm",
        "Ger\u00e4tetiefe (inkl. Fu\u00df)": "349,7 mm",
        "Gewicht (mit St\u00e4nder)": "14,6 kg",
        "Gewicht (ohne St\u00e4nder)": "11,6 kg",
        "HD-Typ": "5K Ultra HD",
        "HDMI": "Ja",
        "HDMI-Version": "2.0",
        "Helligkeit (typisch)": "350 cd/m\u00b2",
        "High Dynamic Range Video Unterst\u00fctzung": "Ja",
        "H\u00f6he (ohne Standfu\u00df)": "36,9 cm",
        "H\u00f6heneinstellung": "12 cm",
        "H\u00f6henverstellung": "Ja",
        "Integrierter USB-Hub": "Ja",
        "Kontrastverh\u00e4ltnis": "3000:1",
        "Kopfh\u00f6rerausgang": "Ja",
        "Marktpositionierung": "Business",
        "Maximale Bildwiederholrate": "120 Hz",
        "Mitgelieferte Kabel": "HDMI, USB Typ-C",
        "Natives Seitenverh\u00e4ltnis": "32:9",
        "Neigungswinkelbereich": "2 - 15\u00b0",
        "Paketgewicht": "20,1 kg",
        "Panel-Montage-Schnittstelle": "100 x 100 mm",
        "Panel-Typ": "VA",
        "Produktfarbe": "Schwarz",
        "Reaktionszeit": "4 ms",
        "Relative Luftfeuchtigkeit in Betrieb": "10 - 80%",
        "Schwenkbar": "Ja",
        "Schwenkwinkelbereich": "15 - 15\u00b0",
        "Smart-Modi": "Kino, Benutzerdefinierung, Dynamisch",
        "Stromverbrauch (Standardbetrieb)": "55 W",
        "Stromverbrauch (Standby)": "0,5 W",
        "Stromverbrauch (aus)": "0,3 W",
        "Technologie mit hohem Dynamikbereich (HDR)": "High Dynamic Range (HDR) 400",
        "Temperaturbereich in Betrieb": "10 - 40 \u00b0C",
        "Tiefe (ohne Standfu\u00df)": "19,4 cm",
        "USB-Hub-Version": "3.2 Gen 1 (3.1 Gen 1)",
        "VESA-Halterung": "Ja",
        "Verpackungsbreite": "1327 mm",
        "Verpackungsh\u00f6he": "318 mm",
        "Verpackungstiefe": "497 mm",
        "kippbar": "Ja",
        "sRGB Abdeckung (klassisch)": "125%"
    },
    "raw_specifications_text": "Bildschirmdiagonale: 124,5 cm (49\" )\nBildschirmaufl\u00f6sung: 5120 x 1440 Pixel\nNatives Seitenverh\u00e4ltnis: 32:9\nPanel-Typ: VA\nHD-Typ: 5K Ultra HD\nBildschirmtechnologie: OLED\nBildschirmform: Gebogen\nKontrastverh\u00e4ltnis: 3000:1\nMaximale Bildwiederholrate: 120 Hz\nAnzahl der Farben des Displays: 1,07 Milliarden Farben\nHelligkeit (typisch): 350 cd/m\u00b2\nReaktionszeit: 4 ms\nBewertung der Bildschirmkr\u00fcmmung: 1800R\nBlickwinkel, horizontal: 178\u00b0\nBlickwinkel, vertikal: 178\u00b0\nBildschirmdiagonale (cm): 124 cm\nHigh Dynamic Range Video Unterst\u00fctzung: Ja\nTechnologie mit hohem Dynamikbereich (HDR): High Dynamic Range (HDR) 400\nFarbskala: 95%\nsRGB Abdeckung (klassisch): 125%\nAdobe RGB-Abdeckung: 92%\nFlimmerfreie Technologie: Ja\nSmart-Modi: Kino, Benutzerdefinierung, Dynamisch\nEingebaute Lautsprecher: Ja\nMarktpositionierung: Business\nProduktfarbe: Schwarz\nIntegrierter USB-Hub: Ja\nHDMI: Ja\nKopfh\u00f6rerausgang: Ja\nUSB-Hub-Version: 3.2 Gen 1 (3.1 Gen 1)\nAnzahl der nachgeschalteten Ports vom Typ USB-C: 1\nAnzahl HDMI-Anschl\u00fcsse: 2\nHDMI-Version: 2.0\nAnzahl DisplayPort Anschl\u00fcsse: 1\nDisplayPorts-Version: 1.4\nVESA-Halterung: Ja\nH\u00f6henverstellung: Ja\nPanel-Montage-Schnittstelle: 100 x 100 mm\nH\u00f6heneinstellung: 12 cm\nSchwenkbar: Ja\nSchwenkwinkelbereich: 15 - 15\u00b0\nkippbar: Ja\nNeigungswinkelbereich: 2 - 15\u00b0\nEnergieeffizienzklasse (SDR): G\nEnergieeffizienzklasse (HDR): G\nEnergieverbrauch (SDR) pro 1.000 Stunden: 55 kWh\nEnergieverbrauch (HDR) pro 1.000 Stunden: 95 kWh\nStromverbrauch (Standardbetrieb): 55 W\nStromverbrauch (Standby): 0,5 W\nStromverbrauch (aus): 0,3 W\nAC Eingangsspannung: 100 - 240 V\nEnergieeffizienzskala: A bis G\nTemperaturbereich in Betrieb: 10 - 40 \u00b0C\nRelative Luftfeuchtigkeit in Betrieb: 10 - 80%\nGer\u00e4tebreite (inkl. Fu\u00df): 1199,5 mm\nGer\u00e4tetiefe (inkl. Fu\u00df): 349,7 mm\nGer\u00e4teh\u00f6he (inkl. Fu\u00df): 523,1 mm\nGewicht (mit St\u00e4nder): 14,6 kg\nBreite (ohne Standfu\u00df): 120 cm\nTiefe (ohne Standfu\u00df): 19,4 cm\nH\u00f6he (ohne Standfu\u00df): 36,9 cm\nGewicht (ohne St\u00e4nder): 11,6 kg\nMitgelieferte Kabel: HDMI, USB Typ-C\nVerpackungsbreite: 1327 mm\nVerpackungstiefe: 497 mm\nVerpackungsh\u00f6he: 318 mm\nPaketgewicht: 20,1 kg",
    "reference_file": "offer_reference_1266.json",
    "shop_name": "Jacob Elektronik direkt (AT)"
}