{
    "html_file": "offer_1260_12.html",
    "name": "AOC U32P2CA, 31.5\"",
    "offer_link": "https://www.alternate.at/AOC/U32P2CA-LED-Monitor/html/product/1823795?partner=AtGeizhalsat&campaign=Monitor/AOC/1823795",
    "price": 507.0,
    "raw_specifications": {
        "": "Adaptive-Sync",
        "Abmessungen": "Breite: 71,48 cm x H\u00f6he: 65,35 cm x Tiefe/L\u00e4nge: 27,51 cm",
        "Anschl\u00fcsse": "2x HDMI-Eingang, (HDMI-Version: 2.0), 1x DisplayPort-Eingang, (DisplayPort-Version: 1.2), 1x 3,5-mm-Audio-Ausgang, 4x USB-A-3.2 Gen 1 (5 Gbit/s), 1x USB-C",
        "Bild": "Glaretyp",
        "Bildschirmaufl\u00f6sung": "3.840 x 2.160 Pixel",
        "Bildschirmdiagonale": "80 cm (32 Zoll)",
        "EAN": "4038986119832",
        "Energieeffizienzklasse (HDR)": "G (A - G)",
        "Energieeffizienzklasse (SDR)": "G (A - G)",
        "Energieverbauch pro 1000 Stunden (HDR)": "55 kWh",
        "Energieverbauch pro 1000 Stunden (SDR)": "39 kWh",
        "Ergonomie": "Typ",
        "Farbe": "schwarz",
        "Features": "Low Blue Light Filter, Flicker Free LED, 65 Watt USB-C Power Delivery",
        "Hersteller-Nr.": "U32P2CA",
        "Lautsprecher": "2 Lautsprecher",
        "Leistungsaufnahme im Bereitschafts- und Aus-Zustand": "0,5 Watt",
        "Leistungsaufnahme im Ein-Zustand bei Standard-Dynamikumfang (SDR)": "39 Watt",
        "Leistungsaufnahme im Ein-Zustand bei hohem Dynamikumfang (HDR)": "55 Watt",
        "Standards": "Video",
        "Stromversorgung": "Eco-Off",
        "Typ": "LED-Monitor",
        "Wandhalterung": "VESA kompatibel (100 x 100 mm)",
        "Zubeh\u00f6r": "Vorhanden"
    },
    "raw_specifications_text": "Energieeffizienzklasse (SDR): G (A - G)\nEnergieverbauch pro 1000 Stunden (SDR): 39 kWh\nEnergieeffizienzklasse (HDR): G (A - G)\nEnergieverbauch pro 1000 Stunden (HDR): 55 kWh\nLeistungsaufnahme im Ein-Zustand bei Standard-Dynamikumfang (SDR): 39 Watt\nLeistungsaufnahme im Ein-Zustand bei hohem Dynamikumfang (HDR): 55 Watt\nLeistungsaufnahme im Bereitschafts- und Aus-Zustand: 0,5 Watt\nBildschirmdiagonale: 80 cm (32 Zoll)\nBildschirmaufl\u00f6sung: 3.840 x 2.160 Pixel\nTyp: LED-Monitor\nFarbe: schwarz\nEAN: 4038986119832\nHersteller-Nr.: U32P2CA\nBild: Glaretyp\n: Adaptive-Sync\nAnschl\u00fcsse: 2x HDMI-Eingang, (HDMI-Version: 2.0), 1x DisplayPort-Eingang, (DisplayPort-Version: 1.2), 1x 3,5-mm-Audio-Ausgang, 4x USB-A-3.2 Gen 1 (5 Gbit/s), 1x USB-C\nErgonomie: Typ\nStromversorgung: Eco-Off\nLautsprecher: 2 Lautsprecher\nStandards: Video\nWandhalterung: VESA kompatibel (100 x 100 mm)\nFeatures: Low Blue Light Filter, Flicker Free LED, 65 Watt USB-C Power Delivery\nZubeh\u00f6r: Vorhanden\nAbmessungen: Breite: 71,48 cm x H\u00f6he: 65,35 cm x Tiefe/L\u00e4nge: 27,51 cm",
    "reference_file": "offer_reference_1260.json",
    "shop_name": "Alternate.at"
}