{
    "html_file": "offer_213_10.html",
    "name": "Samsung ViewFinity S8 S27B800PXP (2023), 27\"",
    "offer_link": "https://www.office-partner.de/productredirect/index/sku/26076091?sPartner=p-geizhals-at&campaign=psm/geizhals-at/",
    "price": 423.43,
    "raw_specifications": {
        "Anschl\u00fcsse": "HDMI, DisplayPort, USB, Kopfh\u00f6reranschluss, Audioausgang (Line-Out)",
        "Artikelnummer": "26076091",
        "Aufl\u00f6sung Kurzname": "Full HD, UHD, 4K",
        "Bezeichnung des Herstellers": "Samsung LS27B800PXPXEN",
        "Bildwiederholungsrate": "60,00",
        "Breite": "6155,00",
        "Display Features": "FlickerFree, Bild an Bild (PbP) Funktion, Bild in Bild (PiP) Funktion",
        "Displaygr\u00f6\u00dfe": "68,58 cm (27 Zoll)",
        "Displayoberfl\u00e4che": "matt",
        "EEK - Spektrum": "AG",
        "Einsatzort": "Innen",
        "Energieeffizienzklasse": "F",
        "Geh\u00e4usefarbe des Ger\u00e4tes": "Schwarz",
        "Gewicht": "8,40",
        "Gewicht inkl. Verpackung in Kg": "8,40",
        "Helligkeit Bereich": "300 - 450 cd/m\u00b2",
        "Hersteller": "Samsung",
        "H\u00f6he": "5519,00",
        "Kapazit\u00e4t (Seiten)": "0",
        "Kontrastverh\u00e4ltnis (typisch) Bereich": "800:1 bis 1.200:1",
        "LCD-Technologie": "IPS Panel",
        "L\u00e4nge": "1964,00",
        "Produktart": "Monitore",
        "Reaktionszeit": "5,00",
        "Seitenverh\u00e4ltnis": "16:9",
        "Shop Herstellernummer": "LS27B800PXPXEN",
        "Standard-EAN": "8806094926347",
        "Verbindungen": "Netzwerk (LAN)",
        "Verpackung - Breite in cm": "68,60",
        "Verpackung - H\u00f6he in cm": "17,10",
        "Verpackung - L\u00e4nge in cm": "45,00",
        "max. Aufl\u00f6sung": "3.840 x 2.160 Pixel (16:9)"
    },
    "raw_specifications_text": "Displaygr\u00f6\u00dfe: 68,58 cm (27 Zoll)\nEnergieeffizienzklasse: F\nGeh\u00e4usefarbe des Ger\u00e4tes: Schwarz\nAnschl\u00fcsse: HDMI, DisplayPort, USB, Kopfh\u00f6reranschluss, Audioausgang (Line-Out)\nKontrastverh\u00e4ltnis (typisch) Bereich: 800:1 bis 1.200:1\nDisplay Features: FlickerFree, Bild an Bild (PbP) Funktion, Bild in Bild (PiP) Funktion\nHersteller: Samsung\nHelligkeit Bereich: 300 - 450 cd/m\u00b2\nVerbindungen: Netzwerk (LAN)\nProduktart: Monitore\nAufl\u00f6sung Kurzname: Full HD, UHD, 4K\nKapazit\u00e4t (Seiten): 0\nEEK - Spektrum: AG\nBreite: 6155,00\nH\u00f6he: 5519,00\nL\u00e4nge: 1964,00\nVerpackung - Breite in cm: 68,60\nVerpackung - H\u00f6he in cm: 17,10\nVerpackung - L\u00e4nge in cm: 45,00\nGewicht inkl. Verpackung in Kg: 8,40\nGewicht: 8,40\nArtikelnummer: 26076091\nStandard-EAN: 8806094926347\nShop Herstellernummer: LS27B800PXPXEN\nBezeichnung des Herstellers: Samsung LS27B800PXPXEN\nmax. Aufl\u00f6sung: 3.840 x 2.160 Pixel (16:9)\nSeitenverh\u00e4ltnis: 16:9\nLCD-Technologie: IPS Panel\nReaktionszeit: 5,00\nDisplayoberfl\u00e4che: matt\nBildwiederholungsrate: 60,00\nEinsatzort: Innen",
    "reference_file": "offer_reference_213.json",
    "shop_name": "office-partner (AT)"
}