{
    "html_file": "offer_752_2.html",
    "name": "Dell G2723H, 27\"",
    "offer_link": "https://www.office-partner.de/productredirect/index/sku/25069536?sPartner=p-geizhals-at&campaign=psm/geizhals-at/",
    "price": 274.79,
    "raw_specifications": {
        "Anschl\u00fcsse": "HDMI, DisplayPort, USB, Kopfh\u00f6reranschluss, Audioausgang (Line-Out)",
        "Artikelnummer": "25069536",
        "Aufl\u00f6sung Kurzname": "Full HD",
        "Bezeichnung des Herstellers": "Dell G2723H",
        "Bildwiederholungsrate": "240,00 Hz",
        "Breite": "6116,00 mm",
        "Display Sync": "AMD FreeSync, Adaptive Sync, NVIDIA G-Sync",
        "Displaygr\u00f6\u00dfe": "68,58 cm (27 Zoll)",
        "Displayoberfl\u00e4che": "matt",
        "EEK - Spektrum": "AG",
        "Energieeffizienzklasse": "E",
        "Geh\u00e4usefarbe des Ger\u00e4tes": "Grau",
        "Gewicht": "9,10 kg",
        "Gewicht inkl. Verpackung in Kg": "8,88 kg",
        "Helligkeit Bereich": "300 - 450 cd/m\u00b2",
        "Hersteller": "Dell",
        "H\u00f6he": "39385,00 mm",
        "Inhalt (ml oder g)": "0,00 ml",
        "Kapazit\u00e4t (Seiten)": "0",
        "Kontrastverh\u00e4ltnis (typisch) Bereich": "800:1 bis 1.200:1",
        "LCD-Technologie": "IPS Panel",
        "L\u00e4nge": "2003,00 mm",
        "Produktart": "Monitore",
        "Reaktionszeit": "1,00 ms",
        "Seitenverh\u00e4ltnis": "16:9",
        "Shop Herstellernummer": "DELL-G2723H",
        "Standard-EAN": "5397184656952",
        "Verpackung - Breite in cm": "13,99 cm",
        "Verpackung - H\u00f6he in cm": "43,99 cm",
        "Verpackung - L\u00e4nge in cm": "81,00 cm",
        "max. Aufl\u00f6sung": "1.920 x 1.080 Pixel (16:9)"
    },
    "raw_specifications_text": "Energieeffizienzklasse: E\nDisplaygr\u00f6\u00dfe: 68,58 cm (27 Zoll)\nGeh\u00e4usefarbe des Ger\u00e4tes: Grau\nAnschl\u00fcsse: HDMI, DisplayPort, USB, Kopfh\u00f6reranschluss, Audioausgang (Line-Out)\nKontrastverh\u00e4ltnis (typisch) Bereich: 800:1 bis 1.200:1\nHersteller: Dell\nHelligkeit Bereich: 300 - 450 cd/m\u00b2\nGewicht: 9,10 kg\nProduktart: Monitore\nDisplay Sync: AMD FreeSync, Adaptive Sync, NVIDIA G-Sync\nAufl\u00f6sung Kurzname: Full HD\nInhalt (ml oder g): 0,00 ml\nKapazit\u00e4t (Seiten): 0\nEEK - Spektrum: AG\nBreite: 6116,00 mm\nArtikelnummer: 25069536\nStandard-EAN: 5397184656952\nShop Herstellernummer: DELL-G2723H\nBezeichnung des Herstellers: Dell G2723H\nH\u00f6he: 39385,00 mm\nL\u00e4nge: 2003,00 mm\nVerpackung - Breite in cm: 13,99 cm\nVerpackung - H\u00f6he in cm: 43,99 cm\nVerpackung - L\u00e4nge in cm: 81,00 cm\nGewicht inkl. Verpackung in Kg: 8,88 kg\nmax. Aufl\u00f6sung: 1.920 x 1.080 Pixel (16:9)\nSeitenverh\u00e4ltnis: 16:9\nLCD-Technologie: IPS Panel\nReaktionszeit: 1,00 ms\nDisplayoberfl\u00e4che: matt\nBildwiederholungsrate: 240,00 Hz",
    "reference_file": "offer_reference_752.json",
    "shop_name": "office-partner (AT)"
}