{
    "html_file": "offer_1702_11.html",
    "name": "HP P22 G4, 21.5\"",
    "offer_link": "https://www.proshop.at/Bildschirm/HP-Bildschirm-P22-G4-FHD/2913123?utm_source=geizhals&utm_medium=cpc&utm_campaign=pricesite",
    "price": 102.73,
    "raw_specifications": {
        "Abmessungen (Breite x Tiefe x H\u00f6he)": "49.73 cm x 21.16 cm x 45.49 cm - mit Fu\u00df",
        "Abmessungen (Breite x Tiefe x H\u00f6he) - mit Fu\u00df": "49.73 cm x 21.16 cm x 45.49 cm",
        "Besonderheiten": "HDCP, Low Blue Light Mode, flimmerfreie Technologie, Color Calibrated, extrem schmale Blende an drei Seiten, 6-bit + A-FRC Color Depth",
        "Bildschirmbeschichtung": "Blendfrei, 3H Hard Coating",
        "Bildschirmtyp": "IPS",
        "Details zu Abmessungen & Gewicht": "Mit Fu\u00df - Breite: 49.73 cm - Tiefe: 21.16 cm - H\u00f6he: 45.49 cm - Gewicht: 4.14 kg  Ohne Fu\u00df - Breite: 49.73 cm - Tiefe: 4.59 cm - H\u00f6he: 30.11 cm - Gewicht: 2.06 kg",
        "Diagonalabmessung": "54.6 cm (21.5\")",
        "Display-Typ": "LED-hintergrundbeleuchteter LCD-Monitor / TFT-Aktivmatrix",
        "EAN": "0195122230784",
        "ENERGY STAR zertifiziert": "Ja",
        "ENERGY STAR-Version": "8.0",
        "EPEAT-kompatibel": "EPEAT Silver",
        "Eingangsanschl\u00fcsse": "HDMI, VGA, DisplayPort",
        "Eingangsspannung": "Wechselstrom 120/230 V (50/60 Hz)",
        "Einstellungen der Anzeigeposition": "Neigung",
        "Energie Effizienzklasse": "Klasse E",
        "Energieverbrauch pro Jahr": "19.3 kWh",
        "Enthaltene Kabel": "1 x HDMI-Kabel - 1.8 m  1 x DisplayPort-Kabel - 1.8 m",
        "Farbe": "Schwarz",
        "Farbtemperatur": "6500K",
        "Ger\u00e4tetyp": "LED-hintergrundbeleuchteter LCD-Monitor - 54.6 cm (21.5\")",
        "Gewicht": "4.14 kg",
        "Helligkeit": "250 cd/m\u00b2",
        "Hersteller": "HP",
        "Hintergrundbeleuchtungs-Technologie": "LED-Hintergrundbeleuchtung",
        "Horizontale Bildwiederholrate": "30 - 86 kHz",
        "Horizontaler Betrachtungswinkel": "178",
        "Kennzeichnung": "Plug and Play, CSA, UL, VCCI, BSMI, NOM, TUV S, CB, CCC, PSB, FCC, ISO 9241-307, KCC, WEEE, ICES, KC, CEL, EAC, ISC, DisplayPort 1.2, Australien-Neuseeland MEPS, Vietnam MEPS",
        "Kontrast": "1000:1 / 8000000:1 (dynamisch)",
        "Lebensdauer der Beleuchtung": "30,000 Stunden",
        "Leistungsaufnahme im Ein-Zustand": "14 W",
        "Leistungsmerkmale": "Slot f\u00fcr Sicherheitsschloss (Kabelschloss getrennt erh\u00e4ltlich), abnehmbarer St\u00e4nder, Unterst\u00fctzung f\u00fcr VESA-Schnittstelle, HDCP Compliant, ohne Arsen, quecksilberfrei",
        "Lokalisierung": "Englisch / Europa",
        "Mitgelieferte Software": "HP Display Assistant",
        "Modell": "1A7E4AA#ABB",
        "Native Aufl\u00f6sung": "Full HD (1080p) 1920 x 1080 bei 60 Hz",
        "Neigungswinkel": "-5/+23",
        "OSD-Sprachen": "Chinesisch (tradionell), Chinesisch (vereinfacht), Englisch, Deutsch, Franz\u00f6sisch, Italienisch, Portugiesisch, Spanisch, Holl\u00e4ndisch, Japanisch",
        "Pixelpitch": "0.24795 mm",
        "Ppi": "102",
        "Produktbeschreibung": "HP P22 G4 - P-Series - LED-Monitor - Full HD (1080p) - 54.6 cm (21.5\")",
        "Reaktionszeit": "5 ms (grau zu grau mit \u00dcbersteuerung)",
        "Schlosstyp zur Diebstahlsicherung": "Kensington Slot",
        "Schnittstellen": "DisplayPort (HDCP)  HDMI (HDCP)  VGA",
        "Seitenverh\u00e4ltnis": "16:9",
        "Spannung": "Wechselstrom 120/230 V (50/60 Hz)",
        "Stromverbrauch (typisch)": "19 Watt",
        "Stromverbrauch SDR (eingeschaltet)": "14 kWh/1.000 h",
        "Stromverbrauch im Standby-Modus": "0.3 Watt",
        "Transportbreite": "56.7 cm",
        "Transportgewicht": "5.65 kg",
        "Transporth\u00f6he": "38.5 cm",
        "Transporttiefe": "18.9 cm",
        "Umweltschutzstandards": "ENERGY STAR-qualifiziert EPEAT Silver",
        "VESA-Halterung": "100 x 100 mm",
        "Vertikale Bildwiederholrate": "48 - 75 Hz",
        "Vertikaler Betrachtungswinkel": "178",
        "Waren-Nr.": "2913123",
        "Zum Hersteller": "www.hp.com"
    },
    "raw_specifications_text": "Hersteller: HP\nWaren-Nr.: 2913123\nModell: 1A7E4AA#ABB\nEAN: 0195122230784\nZum Hersteller: www.hp.com\nProduktbeschreibung: HP P22 G4 - P-Series - LED-Monitor - Full HD (1080p) - 54.6 cm (21.5\")\nGer\u00e4tetyp: LED-hintergrundbeleuchteter LCD-Monitor - 54.6 cm (21.5\")\nEnergie Effizienzklasse: Klasse E\nEnergieverbrauch pro Jahr: 19.3 kWh\nLeistungsaufnahme im Ein-Zustand: 14 W\nBildschirmtyp: IPS\nSeitenverh\u00e4ltnis: 16:9\nNative Aufl\u00f6sung: Full HD (1080p) 1920 x 1080 bei 60 Hz\nPixelpitch: 0.24795 mm\nHelligkeit: 250 cd/m\u00b2\nKontrast: 1000:1 / 8000000:1 (dynamisch)\nReaktionszeit: 5 ms (grau zu grau mit \u00dcbersteuerung)\nEingangsanschl\u00fcsse: HDMI, VGA, DisplayPort\nEinstellungen der Anzeigeposition: Neigung\nBildschirmbeschichtung: Blendfrei, 3H Hard Coating\nSpannung: Wechselstrom 120/230 V (50/60 Hz)\nFarbe: Schwarz\nAbmessungen (Breite x Tiefe x H\u00f6he) - mit Fu\u00df: 49.73 cm x 21.16 cm x 45.49 cm\nGewicht: 4.14 kg\nLokalisierung: Englisch / Europa\nUmweltschutzstandards: ENERGY STAR-qualifiziert EPEAT Silver\nKennzeichnung: Plug and Play, CSA, UL, VCCI, BSMI, NOM, TUV S, CB, CCC, PSB, FCC, ISO 9241-307, KCC, WEEE, ICES, KC, CEL, EAC, ISC, DisplayPort 1.2, Australien-Neuseeland MEPS, Vietnam MEPS\nDisplay-Typ: LED-hintergrundbeleuchteter LCD-Monitor / TFT-Aktivmatrix\nDiagonalabmessung: 54.6 cm (21.5\")\nPpi: 102\nVertikale Bildwiederholrate: 48 - 75 Hz\nHorizontale Bildwiederholrate: 30 - 86 kHz\nHorizontaler Betrachtungswinkel: 178\nVertikaler Betrachtungswinkel: 178\nHintergrundbeleuchtungs-Technologie: LED-Hintergrundbeleuchtung\nFarbtemperatur: 6500K\nOSD-Sprachen: Chinesisch (tradionell), Chinesisch (vereinfacht), Englisch, Deutsch, Franz\u00f6sisch, Italienisch, Portugiesisch, Spanisch, Holl\u00e4ndisch, Japanisch\nBesonderheiten: HDCP, Low Blue Light Mode, flimmerfreie Technologie, Color Calibrated, extrem schmale Blende an drei Seiten, 6-bit + A-FRC Color Depth\nAbmessungen (Breite x Tiefe x H\u00f6he): 49.73 cm x 21.16 cm x 45.49 cm - mit Fu\u00df\nSchnittstellen: DisplayPort (HDCP)  HDMI (HDCP)  VGA\nNeigungswinkel: -5/+23\nVESA-Halterung: 100 x 100 mm\nLeistungsmerkmale: Slot f\u00fcr Sicherheitsschloss (Kabelschloss getrennt erh\u00e4ltlich), abnehmbarer St\u00e4nder, Unterst\u00fctzung f\u00fcr VESA-Schnittstelle, HDCP Compliant, ohne Arsen, quecksilberfrei\nEnthaltene Kabel: 1 x HDMI-Kabel - 1.8 m  1 x DisplayPort-Kabel - 1.8 m\nLebensdauer der Beleuchtung: 30,000 Stunden\nSchlosstyp zur Diebstahlsicherung: Kensington Slot\nEingangsspannung: Wechselstrom 120/230 V (50/60 Hz)\nStromverbrauch SDR (eingeschaltet): 14 kWh/1.000 h\nStromverbrauch (typisch): 19 Watt\nStromverbrauch im Standby-Modus: 0.3 Watt\nMitgelieferte Software: HP Display Assistant\nDetails zu Abmessungen & Gewicht: Mit Fu\u00df - Breite: 49.73 cm - Tiefe: 21.16 cm - H\u00f6he: 45.49 cm - Gewicht: 4.14 kg  Ohne Fu\u00df - Breite: 49.73 cm - Tiefe: 4.59 cm - H\u00f6he: 30.11 cm - Gewicht: 2.06 kg\nTransportbreite: 56.7 cm\nTransporttiefe: 18.9 cm\nTransporth\u00f6he: 38.5 cm\nTransportgewicht: 5.65 kg\nEPEAT-kompatibel: EPEAT Silver\nENERGY STAR zertifiziert: Ja\nENERGY STAR-Version: 8.0",
    "reference_file": "offer_reference_1702.json",
    "shop_name": "Proshop.at"
}