{
    "html_file": "offer_136_17.html",
    "name": "AOC Agon AG405UXC, 40\"",
    "offer_link": "https://www.taufnaus.de/product/13475504",
    "price": 745.75,
    "raw_specifications": {
        "Abmessungen (Breite x Tiefe x H\u00f6he)": "94.41 cm x 31.24 cm x 47.77 cm - mit Standfu\u00df (niedrigste Position)",
        "Adaptive-Sync Technologie": "AMD Adaptive-Sync",
        "Ausgangsleistung/Kanal": "5 Watt",
        "Besonderheiten": "Bild f\u00fcr Bild, Low Blue Light Mode, flimmerfreie Technologie, AOC Shadow Control, breiter Betrachtungswinkel, Niedrige Eingangsverz\u00f6gerung, Picture-in-Picture, an 3 Seiten rahmenlos, AOC G-Menu",
        "Bildschirmbeschichtung": "Blendfrei, 3H Hard Coating",
        "Bildschirmtyp": "IPS",
        "Details zu Abmessungen & Gewicht": "Mit Standfu\u00df (niedrigste Position) - Breite: 94.41 cm - Tiefe: 31.24 cm - H\u00f6he: 47.77 cm - Gewicht: 11.88 kg \u00a6 Mit Standfu\u00df (h\u00f6chste Position) - Breite: 94.41 cm - Tiefe: 31.24 cm - H\u00f6he: 62.77 cm - Gewicht: 11.88 kg \u00a6 Ohne Fu\u00df - Breite: 94.41 cm - Tiefe: 5.45 cm - H\u00f6he: 41.93 cm - Gewicht: 9.53 kg",
        "Diagonalabmessung": "100 cm (40\")",
        "Display-Typ": "LED-hintergrundbeleuchteter LCD-Monitor / TFT-Aktivmatrix",
        "Eingangsspannung": "Wechselstrom 100-240 V (50/60 Hz)",
        "Einstellungen der Anzeigeposition": "H\u00f6he, Drehung, Neigung",
        "Energie Effizienzklasse": "Klasse G",
        "Energieklasse (HDR)": "Klasse G",
        "Enthaltene Kabel": "1 x HDMI-Kabel - 0.8 m \u00a6 1 x DisplayPort-Kabel - 0.8 m",
        "Farbe": "Schwarz",
        "Farbraum": "100% sRGB (CIE 1931), 99.6% sRGB (CIE 1976), 89.5% DCI-P3 (CIE 1931), 93.4% DCI-P3 (CIE 1976), 82.7% Adobe RGB (CIE 1931), 89.5% Adobe RGB (CIE 1976), 79.8% NTSC (CIE 1931), 85.3% NTSC (CIE 1976)",
        "Farbunterst\u00fctzung": "16,7 Millionen Farben",
        "Gaming": "Ja",
        "Gewicht": "11.88 kg",
        "Hintergrundbeleuchtungs-Technologie": "WLED",
        "Horizontaler Betrachtungswinkel": "178",
        "H\u00f6heneinstellung": "150 mm",
        "Integrierte Peripherieger\u00e4te": "KVM-Ports, USB 3.2/USB-C Hub",
        "Kennzeichnung": "CB, EAC",
        "Kontrast": "1200:1 / 80000000:1 (dynamisch)",
        "Leistungsmerkmale": "Slot f\u00fcr Sicherheitsschloss (Kabelschloss getrennt erh\u00e4ltlich), abnehmbarer St\u00e4nder, DisplayPort Alt Mode, strukturierte Oberfl\u00e4che",
        "Native Aufl\u00f6sung": "WQHD 3440 x1440 (DisplayPort: 144 Hz, HDMI: 100 Hz, USB-C: 144 Hz)",
        "Neigungswinkel": "-3.5/+21.5",
        "Pixelpitch": "0.26925 mm",
        "Reaktionszeit": "4 ms (gray-to-gray), 1 ms (MPRT)",
        "Schlosstyp zur Diebstahlsicherung": "Kensington Slot",
        "Schnittstellen": "2 x HDMI 2.0 (HDCP 2.2) \u00a6 DisplayPort 1.4 \u00a6 USB-C 3,2 Upstream (bis zu 90 W) \u00a6 4 x USB 3.2 Gen 1 Downstream \u00a6 Kopfh\u00f6rer (Mini-Klinkenstecker)",
        "Schwenkwinkel": "60",
        "Seitenverh\u00e4ltnis": "16:9",
        "Stromverbrauch (Aus-Modus)": "0.3 Watt",
        "Stromverbrauch (typisch)": "45 Watt",
        "Stromverbrauch HDR (eingeschaltet)": "70 kWh/1.000 h",
        "Stromverbrauch SDR (eingeschaltet)": "41 kWh/1.000 h",
        "Stromverbrauch im Standby-Modus": "0.5 Watt",
        "Transportbreite": "113.3 cm",
        "Transportgewicht": "16.32 kg",
        "Transporth\u00f6he": "55.2 cm",
        "Transporttiefe": "22.5 cm",
        "Typ": "Lautsprecher - Stereo",
        "USB-Spannungsversorgung": "90 Watt",
        "VESA-Halterung": "100 x 100 mm",
        "Vertikale Bildwiederholrate": "48 - 144 Hz",
        "Vertikaler Betrachtungswinkel": "178",
        "Zubeh\u00f6r im Lieferumfang": "Fernbedienung"
    },
    "raw_specifications_text": "Display-Typ: LED-hintergrundbeleuchteter LCD-Monitor / TFT-Aktivmatrix\nEnergie Effizienzklasse: Klasse G\nEnergieklasse (HDR): Klasse G\nDiagonalabmessung: 100 cm (40\")\nAdaptive-Sync Technologie: AMD Adaptive-Sync\nIntegrierte Peripherieger\u00e4te: KVM-Ports, USB 3.2/USB-C Hub\nUSB-Spannungsversorgung: 90 Watt\nBildschirmtyp: IPS\nSeitenverh\u00e4ltnis: 16:9\nNative Aufl\u00f6sung: WQHD 3440 x1440 (DisplayPort: 144 Hz, HDMI: 100 Hz, USB-C: 144 Hz)\nPixelpitch: 0.26925 mm\nKontrast: 1200:1 / 80000000:1 (dynamisch)\nFarbunterst\u00fctzung: 16,7 Millionen Farben\nFarbraum: 100% sRGB (CIE 1931), 99.6% sRGB (CIE 1976), 89.5% DCI-P3 (CIE 1931), 93.4% DCI-P3 (CIE 1976), 82.7% Adobe RGB (CIE 1931), 89.5% Adobe RGB (CIE 1976), 79.8% NTSC (CIE 1931), 85.3% NTSC (CIE 1976)\nReaktionszeit: 4 ms (gray-to-gray), 1 ms (MPRT)\nVertikale Bildwiederholrate: 48 - 144 Hz\nGaming: Ja\nHorizontaler Betrachtungswinkel: 178\nVertikaler Betrachtungswinkel: 178\nBildschirmbeschichtung: Blendfrei, 3H Hard Coating\nHintergrundbeleuchtungs-Technologie: WLED\nBesonderheiten: Bild f\u00fcr Bild, Low Blue Light Mode, flimmerfreie Technologie, AOC Shadow Control, breiter Betrachtungswinkel, Niedrige Eingangsverz\u00f6gerung, Picture-in-Picture, an 3 Seiten rahmenlos, AOC G-Menu\nFarbe: Schwarz\nAbmessungen (Breite x Tiefe x H\u00f6he): 94.41 cm x 31.24 cm x 47.77 cm - mit Standfu\u00df (niedrigste Position)\nGewicht: 11.88 kg\nTyp: Lautsprecher - Stereo\nAusgangsleistung/Kanal: 5 Watt\nSchnittstellen: 2 x HDMI 2.0 (HDCP 2.2) \u00a6 DisplayPort 1.4 \u00a6 USB-C 3,2 Upstream (bis zu 90 W) \u00a6 4 x USB 3.2 Gen 1 Downstream \u00a6 Kopfh\u00f6rer (Mini-Klinkenstecker)\nEinstellungen der Anzeigeposition: H\u00f6he, Drehung, Neigung\nNeigungswinkel: -3.5/+21.5\nSchwenkwinkel: 60\nH\u00f6heneinstellung: 150 mm\nVESA-Halterung: 100 x 100 mm\nLeistungsmerkmale: Slot f\u00fcr Sicherheitsschloss (Kabelschloss getrennt erh\u00e4ltlich), abnehmbarer St\u00e4nder, DisplayPort Alt Mode, strukturierte Oberfl\u00e4che\nZubeh\u00f6r im Lieferumfang: Fernbedienung\nEnthaltene Kabel: 1 x HDMI-Kabel - 0.8 m \u00a6 1 x DisplayPort-Kabel - 0.8 m\nKennzeichnung: CB, EAC\nSchlosstyp zur Diebstahlsicherung: Kensington Slot\nEingangsspannung: Wechselstrom 100-240 V (50/60 Hz)\nStromverbrauch SDR (eingeschaltet): 41 kWh/1.000 h\nStromverbrauch HDR (eingeschaltet): 70 kWh/1.000 h\nStromverbrauch (typisch): 45 Watt\nStromverbrauch im Standby-Modus: 0.5 Watt\nStromverbrauch (Aus-Modus): 0.3 Watt\nDetails zu Abmessungen & Gewicht: Mit Standfu\u00df (niedrigste Position) - Breite: 94.41 cm - Tiefe: 31.24 cm - H\u00f6he: 47.77 cm - Gewicht: 11.88 kg \u00a6 Mit Standfu\u00df (h\u00f6chste Position) - Breite: 94.41 cm - Tiefe: 31.24 cm - H\u00f6he: 62.77 cm - Gewicht: 11.88 kg \u00a6 Ohne Fu\u00df - Breite: 94.41 cm - Tiefe: 5.45 cm - H\u00f6he: 41.93 cm - Gewicht: 9.53 kg\nTransportbreite: 113.3 cm\nTransporttiefe: 22.5 cm\nTransporth\u00f6he: 55.2 cm\nTransportgewicht: 16.32 kg",
    "reference_file": "offer_reference_136.json",
    "shop_name": "TaufNaus"
}