{
    "html_file": "offer_183_9.html",
    "name": "ASUS ProArt PA278CGV, 27\"",
    "offer_link": "https://www.e-tec.at/details.php?artnr=370988",
    "price": 415.15,
    "raw_specifications": {
        "AMD FreeSync Premium": "Ja",
        "Adaptive Sync": "Ja",
        "Anschl\u00fcsse - DisplayPort 1.4 144Hz@2560x1440": "1",
        "Anschl\u00fcsse - HDMI 2.0 144Hz@2560x1440": "2",
        "Anschl\u00fcsse - USB-C 3.0 mit DisplayPort 1.4 144Hz@2560x1440": "1",
        "Anwendung": "station\u00e4r",
        "Audio": "Lautsprecher (2x 2W),  1x Line-Out",
        "Aufl\u00f6sung": "2560x1440",
        "Beschichtung": "matt (non-glare)",
        "Besonderheiten": "Slim Bezel,  USB-C Power Delivery (90W),  mechanische Tasten,  Sicherheitsschloss (Kensington),  Calman Verified,  Werkskalibrierung (Delta-E <2),  EPEAT Silver",
        "Bildwiederholfrequenz": "144Hz",
        "Blickwinkel": "178\u00b0/178\u00b0",
        "Diagonale": "27\"/68.6cm",
        "Energieeffizienzklasse HDR (A bis G)": "G",
        "Energieverbrauch HDR": "36kWh/1000h",
        "Energieverbrauch SDR": "22kWh/1000h",
        "Ergonomie": "150mm (h\u00f6henverstellbar),  \u00b190\u00b0 (Pivot),  \u00b145\u00b0 (drehbar),  +35\u00b0/-5\u00b0 (neigbar),  keine Angabe (Schr\u00e4glage)",
        "FRC": "ja (8bit+2bit)",
        "Farbe": "schwarz",
        "Farbraum - DCI-P3": "95%",
        "Farbraum - sRGB": "100%",
        "Farbtiefe": "10bit (1.07 Mrd. Farben)",
        "Form": "gerade (flat)",
        "Gewicht": "8.40kg (mit Standfu\u00df),  5.50kg (ohne Standfu\u00df)",
        "HDR": "HDR 400 (Hersteller)",
        "Helligkeit": "350cd/m\u00b2",
        "Herstellergarantie": "f\u00fcnf Jahre nach Registrierung (innerhalb von drei Monaten nach Kauf,  Standard: drei Jahre)",
        "Hintergrundbeleuchtung": "White-LED,  Blaulichtfilter",
        "Kontrast - statisch": "1.000:1",
        "Lautsprecher": "Ja",
        "Leistungsaufnahme": "keine Angabe (maximal),  19.5W (typisch),  keine Angabe (Energielabel alt A+++ bis G),  0.5W (Standby)",
        "Panel": "IPS",
        "Reaktionszeit - GtG": "5ms",
        "Screen-to-Body-Ratio": "87.8% (berechnet)",
        "Seitenverh\u00e4ltnis": "16:9",
        "Signalfrequenz": "30-218kHz (horizontal),  24-144Hz (vertikal)",
        "Stromversorgung": "AC-In (internes Netzteil)",
        "USB-Hub In": "1x USB-C 3.0 mit DisplayPort 1.4",
        "USB-Hub Out": "3x USB-A 3.0,  1x USB-A 3.0 (BC 1.2)",
        "USB-Schreibweise": "Link",
        "VESA": "100x100 (belegt)",
        "Weitere Anschl\u00fcsse": "N/A"
    },
    "raw_specifications_text": "Adaptive Sync: Ja\nAMD FreeSync Premium: Ja\nAnschl\u00fcsse - DisplayPort 1.4 144Hz@2560x1440: 1\nAnschl\u00fcsse - HDMI 2.0 144Hz@2560x1440: 2\nAnschl\u00fcsse - USB-C 3.0 mit DisplayPort 1.4 144Hz@2560x1440: 1\nAnwendung: station\u00e4r\nAudio: Lautsprecher (2x 2W),  1x Line-Out\nAufl\u00f6sung: 2560x1440\nBeschichtung: matt (non-glare)\nBesonderheiten: Slim Bezel,  USB-C Power Delivery (90W),  mechanische Tasten,  Sicherheitsschloss (Kensington),  Calman Verified,  Werkskalibrierung (Delta-E <2),  EPEAT Silver\nBildwiederholfrequenz: 144Hz\nBlickwinkel: 178\u00b0/178\u00b0\nDiagonale: 27\"/68.6cm\nEnergieeffizienzklasse HDR (A bis G): G\nEnergieverbrauch HDR: 36kWh/1000h\nEnergieverbrauch SDR: 22kWh/1000h\nErgonomie: 150mm (h\u00f6henverstellbar),  \u00b190\u00b0 (Pivot),  \u00b145\u00b0 (drehbar),  +35\u00b0/-5\u00b0 (neigbar),  keine Angabe (Schr\u00e4glage)\nFarbe: schwarz\nFarbraum - DCI-P3: 95%\nFarbraum - sRGB: 100%\nFarbtiefe: 10bit (1.07 Mrd. Farben)\nForm: gerade (flat)\nFRC: ja (8bit+2bit)\nGewicht: 8.40kg (mit Standfu\u00df),  5.50kg (ohne Standfu\u00df)\nHDR: HDR 400 (Hersteller)\nHelligkeit: 350cd/m\u00b2\nHerstellergarantie: f\u00fcnf Jahre nach Registrierung (innerhalb von drei Monaten nach Kauf,  Standard: drei Jahre)\nHintergrundbeleuchtung: White-LED,  Blaulichtfilter\nKontrast - statisch: 1.000:1\nLautsprecher: Ja\nLeistungsaufnahme: keine Angabe (maximal),  19.5W (typisch),  keine Angabe (Energielabel alt A+++ bis G),  0.5W (Standby)\nPanel: IPS\nReaktionszeit - GtG: 5ms\nScreen-to-Body-Ratio: 87.8% (berechnet)\nSeitenverh\u00e4ltnis: 16:9\nSignalfrequenz: 30-218kHz (horizontal),  24-144Hz (vertikal)\nStromversorgung: AC-In (internes Netzteil)\nUSB-Hub In: 1x USB-C 3.0 mit DisplayPort 1.4\nUSB-Hub Out: 3x USB-A 3.0,  1x USB-A 3.0 (BC 1.2)\nUSB-Schreibweise: Link\nVESA: 100x100 (belegt)\nWeitere Anschl\u00fcsse: N/A",
    "reference_file": "offer_reference_183.json",
    "shop_name": "e-tec.at"
}