{
    "html_file": "offer_1990_22.html",
    "name": "MSI Optix G241, DE-Version, 23.8\"",
    "offer_link": "https://syswork.at/sw/index.html?open&mid=Artikel&artid=mon-1254&from=geizhals.at",
    "price": 253.0,
    "raw_specifications": {
        "AC Eingangsfrequenz": "50/60 Hz",
        "AC Eingangsspannung": "100 - 240 V",
        "AMD FreeSync": "Ja",
        "Anzahl DisplayPort Anschl\u00fcsse": "1",
        "Anzahl HDMI-Anschl\u00fcsse": "2",
        "Anzahl der Farben des Displays": "16,78 Millionen Farben",
        "Audioanschl\u00fcsse": "Nein",
        "Bildschirmdiagonale": "60,5 cm (23.8 Zoll)",
        "Bildschirmform": "Flach",
        "Bildschirmtechnologie": "LED",
        "Bildwinkel, horizontal": "178\u00b0",
        "Bildwinkel, vertikal": "178\u00b0",
        "DVI Anschluss": "Nein",
        "Datenblatt": "Kein Datenblatt verf\u00fcgbar",
        "Digital horizontale Frequenz": "47 - 145 kHz",
        "Display-Aufl\u00f6sung": "1920 x 1080 Pixel",
        "DisplayPorts-Version": "1.2a",
        "Eingebaute Lautsprecher": "Nein",
        "Energieeffizienzklasse (SDR)": "F",
        "Energieverbrauch (SDR) pro 1.000 Stunden": "20 kWh",
        "Ger\u00e4tebreite (inkl. Fu\u00df)": "540,3 mm",
        "Ger\u00e4teh\u00f6he (inkl. Fu\u00df)": "422,6 mm",
        "Ger\u00e4tetiefe (inkl. Fu\u00df)": "219,6 mm",
        "Gewicht (mit St\u00e4nder)": "3,3 kg",
        "HD-Typ": "Full HD",
        "HDMI": "Ja",
        "HDMI-Version": "1.4b",
        "Helligkeit (typisch)": "250 cd/m\u00b2",
        "Herstellerlink": "MSI Technology",
        "Horizontaler Scanbereich": "30 - 100 kHz",
        "H\u00f6henverstellung": "Nein",
        "Integrierte Kamera": "Nein",
        "Integrierter USB-Hub": "Nein",
        "Kabelsperre-Slot": "Ja",
        "Kontrastverh\u00e4ltnis": "1000:1",
        "Kontrastverh\u00e4ltnis (dynamisch)": "100000000:1",
        "Kopfh\u00f6rer-Anschluss": "3,5 mm",
        "Kopfh\u00f6rerausgang": "Ja",
        "Kopfh\u00f6rerausg\u00e4nge": "1",
        "Marktpositionierung": "Gaming",
        "Maximale Bildwiederholrate": "144 Hz",
        "NVIDIA G-SYNC": "Nein",
        "Natives Seitenverh\u00e4ltnis": "16:9",
        "Neigungsverstellung": "Ja",
        "Neigungswinkelbereich": "-5 - 20\u00b0",
        "On-Screen-Display (OSD)": "Ja",
        "Paketgewicht": "5 kg",
        "Panel-Montage-Schnittstelle": "100 x 100 mm",
        "Panel-Typ": "IPS",
        "Pixel Abstand": "0,2745 x 0,2745 mm",
        "Produktfarbe": "Schwarz",
        "Produktlink": "Link",
        "Rahmenloses Design": "Ja",
        "Reaktionszeit": "1 ms",
        "Slot-Typ Kabelsperre": "Kensington",
        "Stromverbrauch (Standardbetrieb)": "25 W",
        "Touchscreen": "Nein",
        "Unterst\u00fctzte Grafik-Aufl\u00f6sungen": "1920 x 1080 (HD 1080)",
        "VESA Adaptive Sync unterst\u00fctzt": "Ja",
        "VESA-Halterung": "Ja",
        "Verpackungsbreite": "606 mm",
        "Verpackungsh\u00f6he": "409 mm",
        "Verpackungstiefe": "172 mm",
        "sRGB Abdeckung (klassisch)": "128%"
    },
    "raw_specifications_text": "Bildschirmdiagonale: 60,5 cm (23.8 Zoll)\nDisplay-Aufl\u00f6sung: 1920 x 1080 Pixel\nNatives Seitenverh\u00e4ltnis: 16:9\nBildschirmtechnologie: LED\nTouchscreen: Nein\nHD-Typ: Full HD\nPanel-Typ: IPS\nBildschirmform: Flach\nKontrastverh\u00e4ltnis: 1000:1\nMaximale Bildwiederholrate: 144 Hz\nAnzahl der Farben des Displays: 16,78 Millionen Farben\nHelligkeit (typisch): 250 cd/m\u00b2\nReaktionszeit: 1 ms\nUnterst\u00fctzte Grafik-Aufl\u00f6sungen: 1920 x 1080 (HD 1080)\nKontrastverh\u00e4ltnis (dynamisch): 100000000:1\nBildwinkel, horizontal: 178\u00b0\nBildwinkel, vertikal: 178\u00b0\nPixel Abstand: 0,2745 x 0,2745 mm\nHorizontaler Scanbereich: 30 - 100 kHz\nDigital horizontale Frequenz: 47 - 145 kHz\nsRGB Abdeckung (klassisch): 128%\nNVIDIA G-SYNC: Nein\nAMD FreeSync: Ja\nVESA Adaptive Sync unterst\u00fctzt: Ja\nEingebaute Lautsprecher: Nein\nIntegrierte Kamera: Nein\nMarktpositionierung: Gaming\nProduktfarbe: Schwarz\nRahmenloses Design: Ja\nIntegrierter USB-Hub: Nein\nHDMI: Ja\nKopfh\u00f6rerausgang: Ja\nDVI Anschluss: Nein\nAnzahl HDMI-Anschl\u00fcsse: 2\nHDMI-Version: 1.4b\nAnzahl DisplayPort Anschl\u00fcsse: 1\nDisplayPorts-Version: 1.2a\nAudioanschl\u00fcsse: Nein\nKopfh\u00f6rerausg\u00e4nge: 1\nKopfh\u00f6rer-Anschluss: 3,5 mm\nVESA-Halterung: Ja\nKabelsperre-Slot: Ja\nH\u00f6henverstellung: Nein\nPanel-Montage-Schnittstelle: 100 x 100 mm\nSlot-Typ Kabelsperre: Kensington\nNeigungswinkelbereich: -5 - 20\u00b0\nOn-Screen-Display (OSD): Ja\nNeigungsverstellung: Ja\nEnergieeffizienzklasse (SDR): F\nEnergieverbrauch (SDR) pro 1.000 Stunden: 20 kWh\nStromverbrauch (Standardbetrieb): 25 W\nAC Eingangsspannung: 100 - 240 V\nAC Eingangsfrequenz: 50/60 Hz\nGer\u00e4tebreite (inkl. Fu\u00df): 540,3 mm\nGer\u00e4tetiefe (inkl. Fu\u00df): 219,6 mm\nGer\u00e4teh\u00f6he (inkl. Fu\u00df): 422,6 mm\nGewicht (mit St\u00e4nder): 3,3 kg\nVerpackungsbreite: 606 mm\nVerpackungstiefe: 172 mm\nVerpackungsh\u00f6he: 409 mm\nPaketgewicht: 5 kg\nDatenblatt: Kein Datenblatt verf\u00fcgbar\nProduktlink: Link\nHerstellerlink: MSI Technology",
    "reference_file": "offer_reference_1990.json",
    "shop_name": "Syswork"
}