{
    "html_file": "offer_1567_13.html",
    "name": "ASUS TUF Gaming VG249Q1A, 23.8\"",
    "offer_link": "https://www.alternate.at/ASUS/TUF-Gaming-VG249Q1A-Gaming-Monitor/html/product/1891690?partner=AtGeizhalsat&campaign=Monitor/ASUS/1891690",
    "price": 197.9,
    "raw_specifications": {
        "": "Adaptive-Sync, AMD FreeSync, Kensington-Schloss, NVIDIA G-Sync kompatibel",
        "Abmessungen": "Breite: 54,104 cm x H\u00f6he: 39,333 cm x Tiefe/L\u00e4nge: 17,398 cm",
        "Anschl\u00fcsse": "1x HDMI-Eingang, (HDMI-Version: 1.4)",
        "Bild": "Glaretyp",
        "Bildschirmaufl\u00f6sung": "1.920 x 1.080 Pixel",
        "Bildschirmdiagonale": "61 cm (24 Zoll)",
        "EAN": "4718017921978",
        "Energieeffizienzklasse (SDR)": "E (A - G)",
        "Energieverbauch pro 1000 Stunden (SDR)": "18 kWh",
        "Ergonomie": "Neigbar",
        "Farbe": "schwarz",
        "Features": "Flicker-Free LED, Trace Free Technologie, SPLENDID Technologie, ASUS GamePlus, ASUS ELMB (Extreme Low Motion Blur), GameFast Input, ASUS Shadow Boost, Dark Boost, Low Blue Light",
        "Frequenz": "Vertikal",
        "Geeignet f\u00fcr": "Gaming",
        "Gewicht": "3,5 kg",
        "Hersteller-Nr.": "90LM06J1-B02170",
        "Lautsprecher": "2 Lautsprecher",
        "Leistungsaufnahme im Bereitschafts- und Aus-Zustand": "0,2 Watt",
        "Leistungsaufnahme im Ein-Zustand bei Standard-Dynamikumfang (SDR)": "18 Watt",
        "Stromversorgung": "Eco-Off",
        "Typ": "Gaming-Monitor",
        "Wandhalterung": "VESA kompatibel (100 x 100 mm)",
        "Zubeh\u00f6r": "Vorhanden"
    },
    "raw_specifications_text": "Energieeffizienzklasse (SDR): E (A - G)\nEnergieverbauch pro 1000 Stunden (SDR): 18 kWh\nLeistungsaufnahme im Ein-Zustand bei Standard-Dynamikumfang (SDR): 18 Watt\nLeistungsaufnahme im Bereitschafts- und Aus-Zustand: 0,2 Watt\nBildschirmdiagonale: 61 cm (24 Zoll)\nBildschirmaufl\u00f6sung: 1.920 x 1.080 Pixel\nTyp: Gaming-Monitor\nFarbe: schwarz\nEAN: 4718017921978\nHersteller-Nr.: 90LM06J1-B02170\nGeeignet f\u00fcr: Gaming\nBild: Glaretyp\n: Adaptive-Sync, AMD FreeSync, Kensington-Schloss, NVIDIA G-Sync kompatibel\nFrequenz: Vertikal\nAnschl\u00fcsse: 1x HDMI-Eingang, (HDMI-Version: 1.4)\nErgonomie: Neigbar\nStromversorgung: Eco-Off\nLautsprecher: 2 Lautsprecher\nWandhalterung: VESA kompatibel (100 x 100 mm)\nFeatures: Flicker-Free LED, Trace Free Technologie, SPLENDID Technologie, ASUS GamePlus, ASUS ELMB (Extreme Low Motion Blur), GameFast Input, ASUS Shadow Boost, Dark Boost, Low Blue Light\nZubeh\u00f6r: Vorhanden\nAbmessungen: Breite: 54,104 cm x H\u00f6he: 39,333 cm x Tiefe/L\u00e4nge: 17,398 cm\nGewicht: 3,5 kg",
    "reference_file": "offer_reference_1567.json",
    "shop_name": "Alternate.at"
}