{
    "html_file": "offer_950_2.html",
    "name": "Eizo ColorEdge CG2700X, 27\"",
    "offer_link": "https://www.csv-direct.de/artinfo.php?artnr=A1621411&KATEGORIE=162&pva=geizhals2",
    "price": 2793.99,
    "raw_specifications": {
        "AC Eingangsfrequenz": "50 - 60 Hz",
        "AC Eingangsspannung": "100 - 240 V",
        "AMD FreeSync": "Nein",
        "Adobe RGB-Abdeckung": "99",
        "Anzahl DisplayPort Anschl\u00fcsse": "1",
        "Anzahl HDMI-Anschl\u00fcsse": "1",
        "Anzahl der Farben des Displays": "1,07 Milliarden Farben",
        "Anzahl der Upstream-Ports USB Typ-B": "1",
        "Anzahl der Upstream-Ports USB Typ-C": "1",
        "Anzahl der nachgeschalteten Steckpl\u00e4tze vom Typ USB-A": "4",
        "Betriebstemperatur": "0 - 35 \u00b0C",
        "Bildschirmdiagonale": "68,6 cm 27\"",
        "Bildschirmdiagonale cm": "68,4 cm",
        "Bildschirmform": "Flach",
        "Bildschirmtechnologie": "LCD",
        "Bildwinkel, horizontal": "178\u00b0",
        "Bildwinkel, vertikal": "178\u00b0",
        "Breite ohne Standfu\u00df": "638 mm",
        "Display-Aufl\u00f6sung": "3840 x 2160 Pixel",
        "Eingebaute Lautsprecher": "Nein",
        "Energieeffizienzklasse HDR": "Nicht verf\u00fcgbar",
        "Energieeffizienzklasse SDR": "G",
        "Energieeffizienzskala": "A bis G",
        "Energieverbrauch SDR pro 1.000 Stunden": "36 kWh",
        "Fu\u00dffarbe": "Schwarz",
        "Ger\u00e4tebreite inkl. Fu\u00df": "638 mm",
        "Ger\u00e4teh\u00f6he inkl. Fu\u00df": "415,9 mm",
        "Ger\u00e4tetiefe inkl. Fu\u00df": "245 mm",
        "Gewicht mit St\u00e4nder": "9,8 kg",
        "Gewicht ohne St\u00e4nder": "6,8 kg",
        "HD-Typ": "4K Ultra HD",
        "Helligkeit typisch": "500 cd/m\u00b2",
        "Horizontaler Scanbereich": "25 - 137 kHz",
        "H\u00f6he ohne Standfu\u00df": "390 mm",
        "H\u00f6heneinstellung": "15,5 cm",
        "Integrierte Kamera": "Nein",
        "Kontrastverh\u00e4ltnis": "1450:1",
        "Marktpositionierung": "Grafikdesign",
        "Maximale Bildwiederholrate": "60 Hz",
        "Men\u00fcsprachen": "Vereinfachtes Chinesisch, Traditionelles Chinesisch, Deutsch, Englisch, Spanisch, Franz\u00f6sisch, Italienisch, Japanisch, Schwedisch",
        "Mitgelieferte Kabel": "AC, HDMI, USB Typ-A auf USB Typ-B, USB Typ-C",
        "NVIDIA G-SYNC": "Nein",
        "Natives Seitenverh\u00e4ltnis": "16:9",
        "Neigungswinkelbereich": "-5 - 35\u00b0",
        "Panel-Montage-Schnittstelle": "100 x 100 mm",
        "Panel-Typ": "IPS",
        "Pivot Winkel": "0 - 90\u00b0",
        "Pixel Abstand": "0,155 x 0,155 mm",
        "Pixeldichte": "164 ppi",
        "Produktfarbe": "Schwarz",
        "RGB-Farbraum": "Adobe RGB",
        "Reaktionszeit": "13 ms",
        "Relative Luftfeuchtigkeit in Betrieb": "20 - 80",
        "Schwenkwinkelbereich": "0 - 344\u00b0",
        "Sichtbare Gr\u00f6\u00dfe horizontal": "59,6 cm",
        "Sichtbare Gr\u00f6\u00dfe vertikal": "33,5 cm",
        "Stromverbrauch Standardbetrieb": "34 W",
        "Stromverbrauch Standby": "0,5 W",
        "Stromverbrauch max.": "225 W",
        "Technologie mit hohem Dynamikbereich HDR": "Hybrid Log-Gamma HLG",
        "Tiefe ohne Standfu\u00df": "86,2 mm",
        "Touchscreen": "Nein",
        "USB-Hub-Version": "2.0 / 3.2 Gen 1 3.1 Gen 1",
        "USB-Stromversorgung bis zu": "94 W",
        "USB-Upstream-Porttyp": "USB Typ-B, USB Typ-C",
        "Vertikaler Scanbereich": "23 - 61 Hz",
        "Zertifizierung": "CB, CE, UKCA, TUV/GS, cTUVus, FCC-B, CAN ICES-3 B, TUV/S, PSE, VCCI-B, RCM, EAC, RoHS, WEEE, TUV/Ergonomics",
        "sRGB Abdeckung klassisch": "100"
    },
    "raw_specifications_text": "Bildschirmdiagonale: 68,6 cm 27\"\nDisplay-Aufl\u00f6sung: 3840 x 2160 Pixel\nNatives Seitenverh\u00e4ltnis: 16:9\nBildschirmtechnologie: LCD\nTouchscreen: Nein\nHD-Typ: 4K Ultra HD\nPanel-Typ: IPS\nBildschirmform: Flach\nKontrastverh\u00e4ltnis: 1450:1\nMaximale Bildwiederholrate: 60 Hz\nAnzahl der Farben des Displays: 1,07 Milliarden Farben\nHelligkeit typisch: 500 cd/m\u00b2\nReaktionszeit: 13 ms\nBildwinkel, horizontal: 178\u00b0\nBildwinkel, vertikal: 178\u00b0\nPixel Abstand: 0,155 x 0,155 mm\nPixeldichte: 164 ppi\nHorizontaler Scanbereich: 25 - 137 kHz\nVertikaler Scanbereich: 23 - 61 Hz\nSichtbare Gr\u00f6\u00dfe horizontal: 59,6 cm\nSichtbare Gr\u00f6\u00dfe vertikal: 33,5 cm\nBildschirmdiagonale cm: 68,4 cm\nTechnologie mit hohem Dynamikbereich HDR: Hybrid Log-Gamma HLG\nRGB-Farbraum: Adobe RGB\nsRGB Abdeckung klassisch: 100\nAdobe RGB-Abdeckung: 99\nNVIDIA G-SYNC: Nein\nAMD FreeSync: Nein\nEingebaute Lautsprecher: Nein\nIntegrierte Kamera: Nein\nMarktpositionierung: Grafikdesign\nProduktfarbe: Schwarz\nFu\u00dffarbe: Schwarz\nZertifizierung: CB, CE, UKCA, TUV/GS, cTUVus, FCC-B, CAN ICES-3 B, TUV/S, PSE, VCCI-B, RCM, EAC, RoHS, WEEE, TUV/Ergonomics\nUSB-Hub-Version: 2.0 / 3.2 Gen 1 3.1 Gen 1\nUSB-Upstream-Porttyp: USB Typ-B, USB Typ-C\nAnzahl der Upstream-Ports USB Typ-B: 1\nAnzahl der Upstream-Ports USB Typ-C: 1\nAnzahl der nachgeschalteten Steckpl\u00e4tze vom Typ USB-A: 4\nUSB-Stromversorgung bis zu: 94 W\nAnzahl HDMI-Anschl\u00fcsse: 1\nAnzahl DisplayPort Anschl\u00fcsse: 1\nPanel-Montage-Schnittstelle: 100 x 100 mm\nH\u00f6heneinstellung: 15,5 cm\nPivot Winkel: 0 - 90\u00b0\nSchwenkwinkelbereich: 0 - 344\u00b0\nNeigungswinkelbereich: -5 - 35\u00b0\nMen\u00fcsprachen: Vereinfachtes Chinesisch, Traditionelles Chinesisch, Deutsch, Englisch, Spanisch, Franz\u00f6sisch, Italienisch, Japanisch, Schwedisch\nEnergieeffizienzklasse SDR: G\nEnergieeffizienzklasse HDR: Nicht verf\u00fcgbar\nEnergieverbrauch SDR pro 1.000 Stunden: 36 kWh\nStromverbrauch Standardbetrieb: 34 W\nStromverbrauch Standby: 0,5 W\nStromverbrauch max.: 225 W\nAC Eingangsspannung: 100 - 240 V\nAC Eingangsfrequenz: 50 - 60 Hz\nEnergieeffizienzskala: A bis G\nBetriebstemperatur: 0 - 35 \u00b0C\nRelative Luftfeuchtigkeit in Betrieb: 20 - 80\nMitgelieferte Kabel: AC, HDMI, USB Typ-A auf USB Typ-B, USB Typ-C\nGer\u00e4tebreite inkl. Fu\u00df: 638 mm\nGer\u00e4tetiefe inkl. Fu\u00df: 245 mm\nGer\u00e4teh\u00f6he inkl. Fu\u00df: 415,9 mm\nGewicht mit St\u00e4nder: 9,8 kg\nBreite ohne Standfu\u00df: 638 mm\nTiefe ohne Standfu\u00df: 86,2 mm\nH\u00f6he ohne Standfu\u00df: 390 mm\nGewicht ohne St\u00e4nder: 6,8 kg",
    "reference_file": "offer_reference_950.json",
    "shop_name": "CSV-Direct.de"
}