{
    "html_file": "offer_795_9.html",
    "name": "ASUS ZenScreen MB166B, 15.6\"",
    "offer_link": "https://www.csv-direct.de/artinfo.php?artnr=A1621525&KATEGORIE=162&pva=geizhals2",
    "price": 172.81,
    "raw_specifications": {
        "AMD FreeSync": "Nein",
        "Anzahl der Farben des Displays": "262000 Farben",
        "Anzahl der vorgeschalteten Steckpl\u00e4tze": "1",
        "Bildschirmdiagonale": "39,6 cm 15.6\"",
        "Bildschirmdiagonale cm": "39,62 cm",
        "Bildschirmform": "Flach",
        "Bildwinkel, horizontal": "178\u00b0",
        "Bildwinkel, vertikal": "178\u00b0",
        "Breite ohne Standfu\u00df": "360,1 mm",
        "Digital vertikale Frequenz": "60 - 60 Hz",
        "Display-Aufl\u00f6sung": "1920 x 1080 Pixel",
        "Eingangsstrom": "3 A",
        "Eingebaute Lautsprecher": "Nein",
        "Energieeffizienzklasse SDR": "B",
        "Energieeffizienzskala": "A bis G",
        "Energieverbrauch SDR pro 1.000 Stunden": "6 kWh",
        "Gewicht ohne St\u00e4nder": "780 g",
        "HD-Typ": "Full HD",
        "HDMI": "Nein",
        "Helligkeit typisch": "250 cd/m\u00b2",
        "H\u00f6he ohne Standfu\u00df": "225,6 mm",
        "H\u00f6henverstellung": "Nein",
        "Integrierte Kamera": "Nein",
        "Kontrastverh\u00e4ltnis": "1000:1",
        "Kopfh\u00f6rerausgang": "Nein",
        "Marktpositionierung": "Haus",
        "Maximale Bildwiederholrate": "60 Hz",
        "Mitgelieferte Kabel": "USB",
        "NVIDIA G-SYNC": "Nein",
        "Natives Seitenverh\u00e4ltnis": "16:9",
        "Netzteil Ausgangsspannung": "5 V",
        "Paketgewicht": "1,65 kg",
        "Panel-Typ": "IPS",
        "Pixel Abstand": "0,179 x 0,179 mm",
        "Produktfarbe": "Schwarz",
        "Reaktionszeit": "25 ms",
        "Sichtbare Gr\u00f6\u00dfe horizontal": "34,4 cm",
        "Sichtbare Gr\u00f6\u00dfe vertikal": "19,4 cm",
        "Stromverbrauch PowerSave": "0,5 W",
        "Stromverbrauch Standardbetrieb": "7 W",
        "Stromverbrauch aus": "0,3 W",
        "Tiefe ohne Standfu\u00df": "11,8 mm",
        "Touchscreen": "Nein",
        "Typ der Hintergrundbeleuchtung": "LED",
        "USB-Hub-Version": "3.2 Gen 1 3.1 Gen 1",
        "Verpackungsart": "Box",
        "Verpackungsbreite": "434 mm",
        "Verpackungsh\u00f6he": "290 mm",
        "Verpackungstiefe": "76 mm"
    },
    "raw_specifications_text": "Bildschirmdiagonale: 39,6 cm 15.6\"\nDisplay-Aufl\u00f6sung: 1920 x 1080 Pixel\nNatives Seitenverh\u00e4ltnis: 16:9\nTouchscreen: Nein\nHD-Typ: Full HD\nPanel-Typ: IPS\nBildschirmform: Flach\nKontrastverh\u00e4ltnis: 1000:1\nMaximale Bildwiederholrate: 60 Hz\nAnzahl der Farben des Displays: 262000 Farben\nTyp der Hintergrundbeleuchtung: LED\nHelligkeit typisch: 250 cd/m\u00b2\nReaktionszeit: 25 ms\nBildwinkel, horizontal: 178\u00b0\nBildwinkel, vertikal: 178\u00b0\nPixel Abstand: 0,179 x 0,179 mm\nSichtbare Gr\u00f6\u00dfe horizontal: 34,4 cm\nSichtbare Gr\u00f6\u00dfe vertikal: 19,4 cm\nDigital vertikale Frequenz: 60 - 60 Hz\nBildschirmdiagonale cm: 39,62 cm\nNVIDIA G-SYNC: Nein\nAMD FreeSync: Nein\nEingebaute Lautsprecher: Nein\nIntegrierte Kamera: Nein\nMarktpositionierung: Haus\nProduktfarbe: Schwarz\nHDMI: Nein\nKopfh\u00f6rerausgang: Nein\nUSB-Hub-Version: 3.2 Gen 1 3.1 Gen 1\nAnzahl der vorgeschalteten Steckpl\u00e4tze: 1\nH\u00f6henverstellung: Nein\nEnergieeffizienzklasse SDR: B\nEnergieverbrauch SDR pro 1.000 Stunden: 6 kWh\nStromverbrauch Standardbetrieb: 7 W\nStromverbrauch aus: 0,3 W\nStromverbrauch PowerSave: 0,5 W\nEingangsstrom: 3 A\nNetzteil Ausgangsspannung: 5 V\nEnergieeffizienzskala: A bis G\nMitgelieferte Kabel: USB\nBreite ohne Standfu\u00df: 360,1 mm\nTiefe ohne Standfu\u00df: 11,8 mm\nH\u00f6he ohne Standfu\u00df: 225,6 mm\nGewicht ohne St\u00e4nder: 780 g\nVerpackungsbreite: 434 mm\nVerpackungstiefe: 76 mm\nVerpackungsh\u00f6he: 290 mm\nPaketgewicht: 1,65 kg\nVerpackungsart: Box",
    "reference_file": "offer_reference_795.json",
    "shop_name": "CSV-Direct.de"
}