{
    "html_file": "offer_1232_2.html",
    "name": "MSI Optix MEG381CQR Plus, 37.5\"",
    "offer_link": "https://www.taufnaus.de/product/10604646",
    "price": 2052.14,
    "raw_specifications": {
        "Abmessungen (Breite x Tiefe x H\u00f6he)": "89.65 cm x 32.58 cm x 46.64 cm",
        "Adaptive-Sync Technologie": "NVIDIA G-SYNC ULTIMATE",
        "Besonderheiten": "Bild f\u00fcr Bild, rahmeloses Blendendesign",
        "Bildschirmbeschichtung": "Blendfrei",
        "Bildschirmtyp": "IPS",
        "Diagonalabmessung": "95.2 cm (37.5\")",
        "Display-Typ": "LED-hintergrundbeleuchteter LCD-Monitor / TFT-Aktivmatrix",
        "Eingangsspannung": "Wechselstrom 100-240 V (50/60 Hz)",
        "Einstellungen der Anzeigeposition": "H\u00f6he, Drehung, Neigung",
        "Energie Effizienzklasse": "Klasse G",
        "Energieklasse (HDR)": "Klasse G",
        "Farbe": "Schwarz",
        "Farbraum": "128.7% sRGB, 96.2% DCI-P3",
        "Farbunterst\u00fctzung": "1,07 Mrd. Farben",
        "Geschwungener Bildschirm": "Ja (2300R)",
        "Gewicht": "10.7 kg",
        "Helligkeit": "600 cd/m\u00b2",
        "Hintergrundbeleuchtungs-Technologie": "LED-Hintergrundbeleuchtung",
        "Horizontaler Betrachtungswinkel": "178",
        "H\u00f6heneinstellung": "100 mm",
        "Integrierte Peripherieger\u00e4te": "USB 3.2 Gen 1 Hub",
        "Kontrast": "1000:1 / 100000000:1 (dynamisch)",
        "Leistungsmerkmale": "Slot f\u00fcr Sicherheitsschloss (Kabelschloss getrennt erh\u00e4ltlich)",
        "Native Aufl\u00f6sung": "UWQHD+ 3840 x 1600 (DisplayPort: 175 Hz, HDMI: 85 Hz)",
        "Neigungswinkel": "-5/+15",
        "Pixelpitch": "0.22908 mm",
        "Reaktionszeit": "1 ms",
        "Schlosstyp zur Diebstahlsicherung": "Kensington Slot",
        "Schnittstellen": "2 x HDMI \u00a6 DisplayPort \u00a6 USB 3.2 Gen 1 Upstream (Typ B) \u00a6 3 x USB 3.2 Gen 1 Downstream \u00a6 Mikrofon \u00a6 Kopfh\u00f6rer \u00a6 Mikrofon-Upstream",
        "Schwenkwinkel": "60",
        "Seitenverh\u00e4ltnis": "21:9",
        "Service und Support": "Begrenzte Garantie - 3 Jahre",
        "Stromverbrauch (typisch)": "47 Watt",
        "Stromverbrauch HDR (eingeschaltet)": "106 kWh/1.000 h",
        "Stromverbrauch SDR (eingeschaltet)": "46.8 kWh/1.000 h",
        "Typ": "5-Wege-Joystick",
        "VESA-Halterung": "100 x 100 mm",
        "Vertikaler Betrachtungswinkel": "178"
    },
    "raw_specifications_text": "Display-Typ: LED-hintergrundbeleuchteter LCD-Monitor / TFT-Aktivmatrix\nEnergie Effizienzklasse: Klasse G\nEnergieklasse (HDR): Klasse G\nDiagonalabmessung: 95.2 cm (37.5\")\nGeschwungener Bildschirm: Ja (2300R)\nAdaptive-Sync Technologie: NVIDIA G-SYNC ULTIMATE\nIntegrierte Peripherieger\u00e4te: USB 3.2 Gen 1 Hub\nBildschirmtyp: IPS\nSeitenverh\u00e4ltnis: 21:9\nNative Aufl\u00f6sung: UWQHD+ 3840 x 1600 (DisplayPort: 175 Hz, HDMI: 85 Hz)\nPixelpitch: 0.22908 mm\nHelligkeit: 600 cd/m\u00b2\nKontrast: 1000:1 / 100000000:1 (dynamisch)\nFarbunterst\u00fctzung: 1,07 Mrd. Farben\nFarbraum: 128.7% sRGB, 96.2% DCI-P3\nReaktionszeit: 1 ms\nHorizontaler Betrachtungswinkel: 178\nVertikaler Betrachtungswinkel: 178\nBildschirmbeschichtung: Blendfrei\nHintergrundbeleuchtungs-Technologie: LED-Hintergrundbeleuchtung\nBesonderheiten: Bild f\u00fcr Bild, rahmeloses Blendendesign\nFarbe: Schwarz\nAbmessungen (Breite x Tiefe x H\u00f6he): 89.65 cm x 32.58 cm x 46.64 cm\nGewicht: 10.7 kg\nTyp: 5-Wege-Joystick\nSchnittstellen: 2 x HDMI \u00a6 DisplayPort \u00a6 USB 3.2 Gen 1 Upstream (Typ B) \u00a6 3 x USB 3.2 Gen 1 Downstream \u00a6 Mikrofon \u00a6 Kopfh\u00f6rer \u00a6 Mikrofon-Upstream\nEinstellungen der Anzeigeposition: H\u00f6he, Drehung, Neigung\nNeigungswinkel: -5/+15\nSchwenkwinkel: 60\nH\u00f6heneinstellung: 100 mm\nVESA-Halterung: 100 x 100 mm\nLeistungsmerkmale: Slot f\u00fcr Sicherheitsschloss (Kabelschloss getrennt erh\u00e4ltlich)\nSchlosstyp zur Diebstahlsicherung: Kensington Slot\nEingangsspannung: Wechselstrom 100-240 V (50/60 Hz)\nStromverbrauch SDR (eingeschaltet): 46.8 kWh/1.000 h\nStromverbrauch HDR (eingeschaltet): 106 kWh/1.000 h\nStromverbrauch (typisch): 47 Watt\nService und Support: Begrenzte Garantie - 3 Jahre",
    "reference_file": "offer_reference_1232.json",
    "shop_name": "TaufNaus"
}