{
    "html_file": "offer_534_5.html",
    "name": "Lenovo D27q-30, 27\"",
    "offer_link": "https://www.alternate.at/Lenovo/D27q-30-LED-Monitor/html/product/1919793?partner=AtGeizhalsat&campaign=Monitor/Lenovo/1919793",
    "price": 202.9,
    "raw_specifications": {
        "": "Kontrast",
        "Abmessungen": "Breite: 61,41 cm x H\u00f6he: 44,44 cm x Tiefe/L\u00e4nge: 23,12 cm",
        "Anschl\u00fcsse": "1x HDMI-Eingang, (HDMI-Version: 1.4), 1x DisplayPort-Eingang, (DisplayPort-Version: 1.4)",
        "Bild": "Glaretyp",
        "Bildschirmaufl\u00f6sung": "2.560 x 1.440 Pixel",
        "Bildschirmdiagonale": "68,6 cm (27 Zoll)",
        "EAN": "0196800351333",
        "Energieeffizienzklasse (SDR)": "F (A - G)",
        "Energieverbauch pro 1000 Stunden (SDR)": "26 kWh",
        "Ergonomie": "Typ",
        "Farbe": "schwarz",
        "Features": "AMD FreeSync",
        "Geeignet f\u00fcr": "Business",
        "Gewicht": "4,7 kg",
        "Hersteller-Nr.": "66FAGAC6EU",
        "Leistungsaufnahme im Bereitschafts- und Aus-Zustand": "0,3 Watt",
        "Leistungsaufnahme im Ein-Zustand bei Standard-Dynamikumfang (SDR)": "25,7 Watt",
        "Standards": "Video",
        "Stromversorgung": "Netzteil",
        "Typ": "LED-Monitor",
        "Weitere Informationen": "Reaktionszeit: 4 ms (Extreme mode) / 6 ms (Typical mode) / 14 ms (Off mode)"
    },
    "raw_specifications_text": "Energieeffizienzklasse (SDR): F (A - G)\nEnergieverbauch pro 1000 Stunden (SDR): 26 kWh\nLeistungsaufnahme im Ein-Zustand bei Standard-Dynamikumfang (SDR): 25,7 Watt\nLeistungsaufnahme im Bereitschafts- und Aus-Zustand: 0,3 Watt\nBildschirmdiagonale: 68,6 cm (27 Zoll)\nBildschirmaufl\u00f6sung: 2.560 x 1.440 Pixel\nTyp: LED-Monitor\nFarbe: schwarz\nEAN: 0196800351333\nHersteller-Nr.: 66FAGAC6EU\nGeeignet f\u00fcr: Business\nBild: Glaretyp\n: Kontrast\nAnschl\u00fcsse: 1x HDMI-Eingang, (HDMI-Version: 1.4), 1x DisplayPort-Eingang, (DisplayPort-Version: 1.4)\nErgonomie: Typ\nStromversorgung: Netzteil\nStandards: Video\nFeatures: AMD FreeSync\nWeitere Informationen: Reaktionszeit: 4 ms (Extreme mode) / 6 ms (Typical mode) / 14 ms (Off mode)\nAbmessungen: Breite: 61,41 cm x H\u00f6he: 44,44 cm x Tiefe/L\u00e4nge: 23,12 cm\nGewicht: 4,7 kg",
    "reference_file": "offer_reference_534.json",
    "shop_name": "Alternate.at"
}