{
    "html_file": "offer_174_0.html",
    "name": "Dell Alienware AW2724DM, 27\"",
    "offer_link": "https://www.proshop.at/Bildschirm/Dell-27-Bildschirm-Alienware-AW2724DM-2560x1440-QHD-165Hz-Fast-IPS-USB-32-HUB-Black-1-ms-AMD-FreeSync-2/3190439?utm_source=geizhals&utm_medium=cpc&utm_campaign=pricesite",
    "price": 441.38,
    "raw_specifications": {
        "Abmessungen (Breite x Tiefe x H\u00f6he)": "61.144 cm x 24.371 cm x 40.868 cm - mit Standfu\u00df (niedrigste Position)",
        "Abmessungen (Breite x Tiefe x H\u00f6he) - mit Standfu\u00df (niedrigste Position)": "61.144 cm x 24.371 cm x 40.868 cm",
        "Adaptive-Sync Technologie": "VESA Adaptive-Sync, AMD FreeSync Premium Pro, NVIDIA G-SYNC Compatible",
        "Besonderheiten": "10-Bit-Gamma, Low Blue Light-Technologie, Dell ComfortView Plus, flimmerfreies Panel",
        "Bildschirmbeschichtung": "Haze 25 %, anti-glare 3H hardness",
        "Bildschirmtyp": "Fast IPS",
        "Details zu Abmessungen & Gewicht": "Mit Standfu\u00df (niedrigste Position) - Breite: 61.144 cm - Tiefe: 24.371 cm - H\u00f6he: 40.868 cm  Mit Standfu\u00df (h\u00f6chste Position) - Breite: 61.144 cm - Tiefe: 24.371 cm - H\u00f6he: 51.868 cm  Ohne Fu\u00df - Breite: 61.144 cm - Tiefe: 6.8 cm - H\u00f6he: 36.494 cm - Gewicht: 4.38 kg",
        "Diagonalabmessung": "68.5 cm (27\")",
        "Display-Typ": "LED-hintergrundbeleuchteter LCD-Monitor / TFT-Aktivmatrix",
        "EAN": "5397184657270",
        "Ein-/Aus-Schalter": "Ja",
        "Eingangsanschl\u00fcsse": "HDMI, 2xDisplayPort",
        "Eingangsspannung": "Wechselstrom 100-240 V (50/60 Hz)",
        "Einstellungen der Anzeigeposition": "H\u00f6he, Pivot (Rotation), Drehung, Neigung",
        "Energie Effizienzklasse": "Klasse F",
        "Enthaltene Kabel": "1 x DisplayPort-Kabel - DisplayPort zu DisplayPort - 1.8 m  1 x Kabel USB-C auf DisplayPort - 1 m  1 x USB 3.2 Gen 1 Upstream-Kabel - 1.8 m",
        "Farbraum": "100% sRGB, 95% DCI-P3",
        "Farbunterst\u00fctzung": "1,07 Mrd. Farben",
        "Gaming": "Ja",
        "Ger\u00e4tetyp": "LED-hintergrundbeleuchteter LCD-Monitor - 68.5 cm (27\")",
        "Helligkeit": "600 cd/m\u00b2",
        "Hersteller": "Dell",
        "Hintergrundbeleuchtungs-Technologie": "WLED Edgelight-Hintergrundbeleuchtung",
        "Horizontaler Betrachtungswinkel": "178",
        "H\u00f6heneinstellung": "110 mm",
        "Integrierte Peripherieger\u00e4te": "USB 3.2 Gen 1 Hub",
        "Kontrast": "1000:1 / 1000:1 (dynamisch)",
        "Leistungsaufnahme im Ein-Zustand": "25.9 W",
        "Leistungsmerkmale": "Integrierte Kabelf\u00fchrung, Unterst\u00fctzung f\u00fcr VESA-Schnittstelle",
        "Modell": "GAME-AW2724DM",
        "Native Aufl\u00f6sung": "QHD 2560 x 1440 (DisplayPort(OC): 180 Hz, DisplayPort: 165 Hz, HDMI: 144 Hz)",
        "Neigungswinkel": "-5/+21",
        "Pixelpitch": "0.2331 mm",
        "Ppi": "108.97",
        "Produktbeschreibung": "Alienware 27 Gaming Monitor AW2724DM - LED-Monitor - QHD - 68.5 cm (27\") - HDR",
        "Reaktionszeit": "1 ms (Grau-zu-Grau extrem)",
        "Rotationswinkel": "180",
        "Schnittstellen": "HDMI 2.1 (HDCP 1.4)  2 x DisplayPort 1.4 (HDCP 1.4)  2 x USB 3.2 Gen 1 Downstream (Typ A)  USB 3.2 Gen 1 Upstream (Typ B)",
        "Schwenkwinkel": "40",
        "Seitenverh\u00e4ltnis": "16:9",
        "Services im Bundle": "3 Jahre Advanced Exchange Service und Premium Panel Exchange",
        "Spannung": "Wechselstrom 100-240 V (50/60 Hz)",
        "Stromverbrauch (Aus-Modus)": "0.3 Watt",
        "Stromverbrauch (typisch)": "72 Watt",
        "Stromverbrauch im Standby-Modus": "0.5 Watt",
        "Transportgewicht": "9.95 kg",
        "VESA-Halterung": "100 mm",
        "Vertikaler Betrachtungswinkel": "178",
        "Waren-Nr.": "3190439",
        "Zubeh\u00f6r im Lieferumfang": "Alienware Sticker",
        "Zum Hersteller": "www.dell.com/"
    },
    "raw_specifications_text": "Hersteller: Dell\nWaren-Nr.: 3190439\nModell: GAME-AW2724DM\nEAN: 5397184657270\nZum Hersteller: www.dell.com/\nProduktbeschreibung: Alienware 27 Gaming Monitor AW2724DM - LED-Monitor - QHD - 68.5 cm (27\") - HDR\nGer\u00e4tetyp: LED-hintergrundbeleuchteter LCD-Monitor - 68.5 cm (27\")\nEnergie Effizienzklasse: Klasse F\nLeistungsaufnahme im Ein-Zustand: 25.9 W\nAdaptive-Sync Technologie: VESA Adaptive-Sync, AMD FreeSync Premium Pro, NVIDIA G-SYNC Compatible\nLeistungsmerkmale: Integrierte Kabelf\u00fchrung, Unterst\u00fctzung f\u00fcr VESA-Schnittstelle\nBildschirmtyp: Fast IPS\nSeitenverh\u00e4ltnis: 16:9\nNative Aufl\u00f6sung: QHD 2560 x 1440 (DisplayPort(OC): 180 Hz, DisplayPort: 165 Hz, HDMI: 144 Hz)\nPixelpitch: 0.2331 mm\nHelligkeit: 600 cd/m\u00b2\nKontrast: 1000:1 / 1000:1 (dynamisch)\nReaktionszeit: 1 ms (Grau-zu-Grau extrem)\nGaming: Ja\nFarbunterst\u00fctzung: 1,07 Mrd. Farben\nFarbraum: 100% sRGB, 95% DCI-P3\nEingangsanschl\u00fcsse: HDMI, 2xDisplayPort\nEinstellungen der Anzeigeposition: H\u00f6he, Pivot (Rotation), Drehung, Neigung\nBildschirmbeschichtung: Haze 25 %, anti-glare 3H hardness\nSpannung: Wechselstrom 100-240 V (50/60 Hz)\nAbmessungen (Breite x Tiefe x H\u00f6he) - mit Standfu\u00df (niedrigste Position): 61.144 cm x 24.371 cm x 40.868 cm\nServices im Bundle: 3 Jahre Advanced Exchange Service und Premium Panel Exchange\nDisplay-Typ: LED-hintergrundbeleuchteter LCD-Monitor / TFT-Aktivmatrix\nDiagonalabmessung: 68.5 cm (27\")\nIntegrierte Peripherieger\u00e4te: USB 3.2 Gen 1 Hub\nPpi: 108.97\nHorizontaler Betrachtungswinkel: 178\nVertikaler Betrachtungswinkel: 178\nHintergrundbeleuchtungs-Technologie: WLED Edgelight-Hintergrundbeleuchtung\nBesonderheiten: 10-Bit-Gamma, Low Blue Light-Technologie, Dell ComfortView Plus, flimmerfreies Panel\nAbmessungen (Breite x Tiefe x H\u00f6he): 61.144 cm x 24.371 cm x 40.868 cm - mit Standfu\u00df (niedrigste Position)\nSchnittstellen: HDMI 2.1 (HDCP 1.4)  2 x DisplayPort 1.4 (HDCP 1.4)  2 x USB 3.2 Gen 1 Downstream (Typ A)  USB 3.2 Gen 1 Upstream (Typ B)\nNeigungswinkel: -5/+21\nSchwenkwinkel: 40\nRotationswinkel: 180\nH\u00f6heneinstellung: 110 mm\nVESA-Halterung: 100 mm\nZubeh\u00f6r im Lieferumfang: Alienware Sticker\nEnthaltene Kabel: 1 x DisplayPort-Kabel - DisplayPort zu DisplayPort - 1.8 m  1 x Kabel USB-C auf DisplayPort - 1 m  1 x USB 3.2 Gen 1 Upstream-Kabel - 1.8 m\nEingangsspannung: Wechselstrom 100-240 V (50/60 Hz)\nStromverbrauch (typisch): 72 Watt\nStromverbrauch im Standby-Modus: 0.5 Watt\nStromverbrauch (Aus-Modus): 0.3 Watt\nEin-/Aus-Schalter: Ja\nDetails zu Abmessungen & Gewicht: Mit Standfu\u00df (niedrigste Position) - Breite: 61.144 cm - Tiefe: 24.371 cm - H\u00f6he: 40.868 cm  Mit Standfu\u00df (h\u00f6chste Position) - Breite: 61.144 cm - Tiefe: 24.371 cm - H\u00f6he: 51.868 cm  Ohne Fu\u00df - Breite: 61.144 cm - Tiefe: 6.8 cm - H\u00f6he: 36.494 cm - Gewicht: 4.38 kg\nTransportgewicht: 9.95 kg",
    "reference_file": "offer_reference_174.json",
    "shop_name": "Proshop.at"
}