{
    "html_file": "offer_2200_1.html",
    "name": "ViewSonic VP2458, 23.8\"",
    "offer_link": "https://direkt.jacob.de/produkte/viewsonic-display-vp2458-vp2458-artnr-4784960.html?utm_source=geizhals&utm_medium=cpc&utm_campaign=Preisvergleich&ref=103",
    "price": 177.43,
    "raw_specifications": {
        "Abmessungen (Breite x Tiefe x H\u00f6he)": "53.9 cm x 21.5 cm x 42.37 cm - mit Fu\u00df",
        "Abmessungen (Breite x Tiefe x H\u00f6he) - mit Fu\u00df": "53.9 cm x 21.5 cm x 42.37 cm",
        "Besonderheiten": "ErgoDesign, SuperClear, rahmenlos, 100% sRGB-Farbskala, flimmerfreie Technologie, Blaulichtfilter-Technologie, Monitorkalibrierung Delta E<2",
        "Bildschirmbeschichtung": "Blendfrei, 3H Hard Coating",
        "Bildschirmtyp": "IPS",
        "Details zu Abmessungen & Gewicht": "Ohne Fu\u00df - Breite: 53.9 cm - Tiefe: 4.8 cm - H\u00f6he: 31.1 cm - Gewicht: 3.1 kg  Mit Fu\u00df - Breite: 53.9 cm - Tiefe: 21.5 cm - H\u00f6he: 42.37 cm - Gewicht: 5.5 kg",
        "Diagonalabmessung": "61 cm (24\")",
        "Display-Typ": "LED-hintergrundbeleuchteter LCD-Monitor / TFT-Aktivmatrix",
        "ENERGY STAR zertifiziert": "Ja",
        "Eingangsanschl\u00fcsse": "HDMI, VGA, DisplayPort",
        "Einstellungen der Anzeigeposition": "H\u00f6he, Pivot (Rotation), Drehelement, neigbar",
        "Enthaltene Kabel": "1 x DisplayPort-Kabel - DisplayPort zu DisplayPort  1 x USB 3.1 Kabel",
        "Erforderliche Netzspannung": "AC 100 - 240 V (50/60 Hz)",
        "Erforderliches Betriebssystem": "Apple MacOS, Linux, Microsoft Windows",
        "Farbunterst\u00fctzung": "16,7 Millionen Farben",
        "Ger\u00e4tetyp": "LED-hintergrundbeleuchteter LCD-Monitor - 61 cm (24\")",
        "Gewicht": "5.5 kg",
        "Helligkeit": "250 cd/m\u00b2",
        "Hintergrundbeleuchtungs-Technologie": "WLED",
        "Horizontale Bildwiederholrate": "55 - 90 kHz",
        "Horizontaler Betrachtungswinkel": "178",
        "H\u00f6heneinstellung": "130 mm",
        "Integrierte Peripherieger\u00e4te": "USB 3.1 Hub",
        "Kennzeichnung": "FCC Klasse B bescheinigt, ICES-003, cTUVus, DisplayPort 1.2, Mexico Energy label, Mexico CoC",
        "Kontrast": "1000:1 / 20000000:1 (dynamisch)",
        "Lebensdauer der Beleuchtung": "30,000 Stunden",
        "Leistungsaufnahme im Betrieb": "19.5 Watt",
        "Leistungsmerkmale": "Slot f\u00fcr Sicherheitsschloss (Kabelschloss getrennt erh\u00e4ltlich)",
        "Max. Betriebstemperatur": "40 \u00b0C",
        "Min Betriebstemperatur": "0 \u00b0C",
        "Native Aufl\u00f6sung": "Full HD (1080p) 1920 x 1080 bei 75 Hz",
        "Neigungswinkel": "-5/+21",
        "Produktbeschreibung": "ViewSonic ColorPro VP2458 - LED-Monitor - Full HD (1080p) - 61 cm (24\")",
        "Reaktionszeit": "14 ms (Gray-to-Gray)",
        "Rotationswinkel": "180",
        "Schlosstyp zur Diebstahlsicherung": "Kensington Slot",
        "Schnittstelle f\u00fcr Flachbildschirmbefestigung": "100 x 100 mm",
        "Schnittstellen": "HDMI  DisplayPort  VGA  2 x USB 3.1 Downstream (Typ A)  USB 3.1 Upstream (Typ B)",
        "Schwenkwinkel": "120",
        "Seitenverh\u00e4ltnis": "16:9",
        "Sichtbare Bildfl\u00e4che": "60.5 cm (23.8\")",
        "Stromverbrauch im Standby-Modus": "0.5 Watt",
        "Transportbreite": "69 cm",
        "Transportgewicht": "8.6 kg",
        "Transporth\u00f6he": "20.5 cm",
        "Transporttiefe": "38 cm",
        "Umweltschutzstandards": "ENERGY STAR-qualifiziert",
        "Vertikale Bildwiederholrate": "48 - 75 Hz",
        "Vertikaler Betrachtungswinkel": "178",
        "Zul\u00e4ssige Luftfeuchtigkeit im Betrieb": "20 - 90% (nicht kondensierend)"
    },
    "raw_specifications_text": "Produktbeschreibung: ViewSonic ColorPro VP2458 - LED-Monitor - Full HD (1080p) - 61 cm (24\")\nGer\u00e4tetyp: LED-hintergrundbeleuchteter LCD-Monitor - 61 cm (24\")\nLeistungsmerkmale: Slot f\u00fcr Sicherheitsschloss (Kabelschloss getrennt erh\u00e4ltlich)\nBildschirmtyp: IPS\nSeitenverh\u00e4ltnis: 16:9\nNative Aufl\u00f6sung: Full HD (1080p) 1920 x 1080 bei 75 Hz\nHelligkeit: 250 cd/m\u00b2\nKontrast: 1000:1 / 20000000:1 (dynamisch)\nReaktionszeit: 14 ms (Gray-to-Gray)\nFarbunterst\u00fctzung: 16,7 Millionen Farben\nEingangsanschl\u00fcsse: HDMI, VGA, DisplayPort\nEinstellungen der Anzeigeposition: H\u00f6he, Pivot (Rotation), Drehelement, neigbar\nBildschirmbeschichtung: Blendfrei, 3H Hard Coating\nAbmessungen (Breite x Tiefe x H\u00f6he) - mit Fu\u00df: 53.9 cm x 21.5 cm x 42.37 cm\nGewicht: 5.5 kg\nUmweltschutzstandards: ENERGY STAR-qualifiziert\nKennzeichnung: FCC Klasse B bescheinigt, ICES-003, cTUVus, DisplayPort 1.2, Mexico Energy label, Mexico CoC\nDisplay-Typ: LED-hintergrundbeleuchteter LCD-Monitor / TFT-Aktivmatrix\nDiagonalabmessung: 61 cm (24\")\nSichtbare Bildfl\u00e4che: 60.5 cm (23.8\")\nIntegrierte Peripherieger\u00e4te: USB 3.1 Hub\nVertikale Bildwiederholrate: 48 - 75 Hz\nHorizontale Bildwiederholrate: 55 - 90 kHz\nHorizontaler Betrachtungswinkel: 178\nVertikaler Betrachtungswinkel: 178\nHintergrundbeleuchtungs-Technologie: WLED\nBesonderheiten: ErgoDesign, SuperClear, rahmenlos, 100% sRGB-Farbskala, flimmerfreie Technologie, Blaulichtfilter-Technologie, Monitorkalibrierung Delta E<2\nAbmessungen (Breite x Tiefe x H\u00f6he): 53.9 cm x 21.5 cm x 42.37 cm - mit Fu\u00df\nSchnittstellen: HDMI  DisplayPort  VGA  2 x USB 3.1 Downstream (Typ A)  USB 3.1 Upstream (Typ B)\nNeigungswinkel: -5/+21\nSchwenkwinkel: 120\nRotationswinkel: 180\nH\u00f6heneinstellung: 130 mm\nSchnittstelle f\u00fcr Flachbildschirmbefestigung: 100 x 100 mm\nEnthaltene Kabel: 1 x DisplayPort-Kabel - DisplayPort zu DisplayPort  1 x USB 3.1 Kabel\nLebensdauer der Beleuchtung: 30,000 Stunden\nSchlosstyp zur Diebstahlsicherung: Kensington Slot\nErforderliche Netzspannung: AC 100 - 240 V (50/60 Hz)\nLeistungsaufnahme im Betrieb: 19.5 Watt\nStromverbrauch im Standby-Modus: 0.5 Watt\nErforderliches Betriebssystem: Apple MacOS, Linux, Microsoft Windows\nDetails zu Abmessungen & Gewicht: Ohne Fu\u00df - Breite: 53.9 cm - Tiefe: 4.8 cm - H\u00f6he: 31.1 cm - Gewicht: 3.1 kg  Mit Fu\u00df - Breite: 53.9 cm - Tiefe: 21.5 cm - H\u00f6he: 42.37 cm - Gewicht: 5.5 kg\nTransportbreite: 69 cm\nTransporttiefe: 38 cm\nTransporth\u00f6he: 20.5 cm\nTransportgewicht: 8.6 kg\nENERGY STAR zertifiziert: Ja\nMin Betriebstemperatur: 0 \u00b0C\nMax. Betriebstemperatur: 40 \u00b0C\nZul\u00e4ssige Luftfeuchtigkeit im Betrieb: 20 - 90% (nicht kondensierend)",
    "reference_file": "offer_reference_2200.json",
    "shop_name": "Jacob Elektronik direkt (AT)"
}