{
    "html_file": "offer_273_12.html",
    "name": "HP E27 G5, 27\"",
    "offer_link": "https://www.mylemon.at/artikel/hewlett_packard/6n4e2aa_abb/hp-e27-g5-ips-fhd.html",
    "price": 182.85,
    "raw_specifications": {
        "AC Eingangsfrequenz": "50 - 60 Hz",
        "AC Eingangsspannung": "100 - 240 V",
        "AMD FreeSync": "Nein",
        "Anzahl DisplayPort Anschl\u00fcsse": "1",
        "Anzahl HDMI-Anschl\u00fcsse": "1",
        "Anzahl der Farben des Displays": "16,7 Millionen Farben",
        "Anzahl der nachgeschalteten Steckpl\u00e4tze vom Typ USB-A": "4",
        "Artikelnummer": "M1GYIBYL",
        "Aufl\u00f6sung": "1920x1080",
        "Besonderheiten": "75 Hz",
        "Betriebstemperatur": "5 - 35 \u00b0C",
        "Bildschirmdiagonale": "68,6 cm (27\")",
        "Bildschirmform": "Flach",
        "Bildschirmtechnologie": "LED",
        "Blendfreier Bildschirm": "Ja",
        "Breite (ohne Standfu\u00df)": "611,7 mm",
        "Display-Aufl\u00f6sung": "1920 x 1080 Pixel",
        "DisplayPorts-Version": "1.2",
        "Displaygr\u00f6\u00dfe": "27 Zoll",
        "EAN": "0196786297373",
        "Eingebaute Lautsprecher": "Nein",
        "Energieeffizienzklasse (HDR)": "Nicht verf\u00fcgbar",
        "Energieeffizienzklasse (SDR)": "D",
        "Farbskala": "99%",
        "Ger\u00e4tebreite (inkl. Fu\u00df)": "612 mm",
        "Ger\u00e4teh\u00f6he (inkl. Fu\u00df)": "546 mm",
        "Ger\u00e4tetiefe (inkl. Fu\u00df)": "227 mm",
        "Gewicht": "6,96 kg",
        "Gewicht (mit St\u00e4nder)": "6,96 kg",
        "Gewicht (ohne St\u00e4nder)": "4,83 kg",
        "HD-Typ": "Full HD",
        "HDMI": "Ja",
        "HDMI-Version": "1.4",
        "Helligkeit": "300 cd/m\u00b2",
        "Helligkeit (peak)": "300 cd/m\u00b2",
        "Hersteller Artikelnummer": "6N4E2AA#ABB",
        "Horizontaler Scanbereich": "30 - 85 kHz",
        "H\u00f6he (ohne Standfu\u00df)": "363,3 mm",
        "H\u00f6heneinstellung": "15 cm",
        "H\u00f6henverstellung": "Ja",
        "Integrierte Kamera": "Nein",
        "Integrierter USB-Hub": "Ja",
        "Kabelsperre-Slot": "Ja",
        "Kontrastverh\u00e4ltnis": "1000:1",
        "Kopfh\u00f6rerausgang": "Nein",
        "Marktpositionierung": "Business",
        "Maximale Bildwiederholrate": "75 Hz",
        "NVIDIA G-SYNC": "Nein",
        "Nachhaltige Technologien und Materialien": "Halogenarm; Das geformte Papierzellstoffpolster im Inneren der Verpackung stammt zu 100\u00a0% aus nachhaltigen Quellen und ist recycelbar; Au\u00dfenkarton und Polster aus Wellpappe stammen zu 100\u00a0% aus nachhaltigen Quellen und sind recycelbar; Enth\u00e4lt recycelten Kunststoff, der andernfalls ins Meer gelangen w\u00fcrde; 85\u00a0% Kunststoff aus geschlossenem ITE-Kreislauf; Mindestens 25\u00a0% aus recyceltem Metall hergestellt",
        "Nachhaltigkeitszertifikate": "ENERGY STAR",
        "Natives Seitenverh\u00e4ltnis": "16:9",
        "Neigungswinkelbereich": "-5 - 20\u00b0",
        "Paketgewicht": "10,9 kg",
        "Panel": "IPS",
        "Panel-Montage-Schnittstelle": "100 x 100 mm",
        "Panel-Typ": "IPS",
        "Pivot": "Ja",
        "Pivot Winkel": "-90 - 90\u00b0",
        "Pixel Abstand": "0,31 x 0,31 mm",
        "Produktfarbe": "Schwarz",
        "RGB-Farbraum": "sRGB",
        "Reaktionszeit": "5 ms",
        "Relative Luftfeuchtigkeit in Betrieb": "20 - 80%",
        "Schwenkbar": "Ja",
        "Schwenkwinkelbereich": "-45 - 45\u00b0",
        "Stromverbrauch (Standardbetrieb)": "30 W",
        "Stromverbrauch (Standby)": "0,5 W",
        "Stromverbrauch (max.)": "50 W",
        "Tiefe (ohne Standfu\u00df)": "4,5 mm",
        "Touchscreen": "Nein",
        "USB-Upstream-Porttyp": "USB Typ-B",
        "Unterst\u00fctzte Grafik-Aufl\u00f6sungen": "640 x 480 (VGA), 720 x 400, 800 x 600 (SVGA), 1024 x 768 (XGA), 1280 x 1024 (SXGA), 1280 x 720 (HD 720), 1280 x 800 (WXGA), 1440 x 900 (WXGA+), 1600 x 900, 1680 x 1050 (WSXGA+), 1920 x 1080 (HD 1080)",
        "Ursprungsland": "China",
        "VESA-Halterung": "Ja",
        "Verpackungsbreite": "612 mm",
        "Verpackungsh\u00f6he": "546 mm",
        "Verpackungstiefe": "227 mm",
        "Vertikaler Scanbereich": "50 - 75 Hz",
        "Video Anschl\u00fcsse": "1x HDMI, 1x DisplayPort"
    },
    "raw_specifications_text": "Displaygr\u00f6\u00dfe: 27 Zoll\nAufl\u00f6sung: 1920x1080\nPanel: IPS\nReaktionszeit: 5 ms\nVideo Anschl\u00fcsse: 1x HDMI, 1x DisplayPort\nHelligkeit: 300 cd/m\u00b2\nBesonderheiten: 75 Hz\nHersteller Artikelnummer: 6N4E2AA#ABB\nEAN: 0196786297373\nArtikelnummer: M1GYIBYL\nBildschirmdiagonale: 68,6 cm (27\")\nDisplay-Aufl\u00f6sung: 1920 x 1080 Pixel\nNatives Seitenverh\u00e4ltnis: 16:9\nBildschirmtechnologie: LED\nTouchscreen: Nein\nHD-Typ: Full HD\nPanel-Typ: IPS\nBildschirmform: Flach\nKontrastverh\u00e4ltnis: 1000:1\nMaximale Bildwiederholrate: 75 Hz\nAnzahl der Farben des Displays: 16,7 Millionen Farben\nHelligkeit (peak): 300 cd/m\u00b2\nBlendfreier Bildschirm: Ja\nUnterst\u00fctzte Grafik-Aufl\u00f6sungen: 640 x 480 (VGA), 720 x 400, 800 x 600 (SVGA), 1024 x 768 (XGA), 1280 x 1024 (SXGA), 1280 x 720 (HD 720), 1280 x 800 (WXGA), 1440 x 900 (WXGA+), 1600 x 900, 1680 x 1050 (WSXGA+), 1920 x 1080 (HD 1080)\nPixel Abstand: 0,31 x 0,31 mm\nHorizontaler Scanbereich: 30 - 85 kHz\nVertikaler Scanbereich: 50 - 75 Hz\nRGB-Farbraum: sRGB\nFarbskala: 99%\nNVIDIA G-SYNC: Nein\nAMD FreeSync: Nein\nEingebaute Lautsprecher: Nein\nIntegrierte Kamera: Nein\nMarktpositionierung: Business\nProduktfarbe: Schwarz\nUrsprungsland: China\nIntegrierter USB-Hub: Ja\nHDMI: Ja\nKopfh\u00f6rerausgang: Nein\nUSB-Upstream-Porttyp: USB Typ-B\nAnzahl der nachgeschalteten Steckpl\u00e4tze vom Typ USB-A: 4\nAnzahl HDMI-Anschl\u00fcsse: 1\nHDMI-Version: 1.4\nAnzahl DisplayPort Anschl\u00fcsse: 1\nDisplayPorts-Version: 1.2\nVESA-Halterung: Ja\nKabelsperre-Slot: Ja\nH\u00f6henverstellung: Ja\nPanel-Montage-Schnittstelle: 100 x 100 mm\nH\u00f6heneinstellung: 15 cm\nPivot: Ja\nPivot Winkel: -90 - 90\u00b0\nSchwenkbar: Ja\nSchwenkwinkelbereich: -45 - 45\u00b0\nNeigungswinkelbereich: -5 - 20\u00b0\nEnergieeffizienzklasse (SDR): D\nEnergieeffizienzklasse (HDR): Nicht verf\u00fcgbar\nStromverbrauch (Standardbetrieb): 30 W\nStromverbrauch (Standby): 0,5 W\nStromverbrauch (max.): 50 W\nAC Eingangsspannung: 100 - 240 V\nAC Eingangsfrequenz: 50 - 60 Hz\nBetriebstemperatur: 5 - 35 \u00b0C\nRelative Luftfeuchtigkeit in Betrieb: 20 - 80%\nGer\u00e4tebreite (inkl. Fu\u00df): 612 mm\nGer\u00e4tetiefe (inkl. Fu\u00df): 227 mm\nGer\u00e4teh\u00f6he (inkl. Fu\u00df): 546 mm\nGewicht (mit St\u00e4nder): 6,96 kg\nBreite (ohne Standfu\u00df): 611,7 mm\nTiefe (ohne Standfu\u00df): 4,5 mm\nH\u00f6he (ohne Standfu\u00df): 363,3 mm\nGewicht (ohne St\u00e4nder): 4,83 kg\nVerpackungsbreite: 612 mm\nVerpackungstiefe: 227 mm\nVerpackungsh\u00f6he: 546 mm\nPaketgewicht: 10,9 kg\nNachhaltigkeitszertifikate: ENERGY STAR\nNachhaltige Technologien und Materialien: Halogenarm; Das geformte Papierzellstoffpolster im Inneren der Verpackung stammt zu 100\u00a0% aus nachhaltigen Quellen und ist recycelbar; Au\u00dfenkarton und Polster aus Wellpappe stammen zu 100\u00a0% aus nachhaltigen Quellen und sind recycelbar; Enth\u00e4lt recycelten Kunststoff, der andernfalls ins Meer gelangen w\u00fcrde; 85\u00a0% Kunststoff aus geschlossenem ITE-Kreislauf; Mindestens 25\u00a0% aus recyceltem Metall hergestellt\nGewicht: 6,96 kg",
    "reference_file": "offer_reference_273.json",
    "shop_name": "mylemon.at"
}