{
    "html_file": "offer_797_12.html",
    "name": "ASUS ROG Swift PG48UQ, 47.5\"",
    "offer_link": "https://www.hiq24.de/shop/artikel/331340/?sPartner=geizhals",
    "price": 1751.9,
    "raw_specifications": {
        "Abmessungen (Breite x Tiefe x H\u00f6he)": "106.8 cm x 26.6 cm x 68.6 cm - mit Fu\u00df",
        "Abmessungen (Breite x Tiefe x H\u00f6he) - mit Fu\u00df": "106.8 cm x 26.6 cm x 68.6 cm",
        "Adaptive-Sync Technologie": "NVIDIA G-SYNC Compatible",
        "Ausgangsleistung/Kanal": "10 Watt",
        "Besonderheiten": "HDCP, Trace Free Technology, ASUS GamePlus, Low Blue Light Mode, flimmerfreie Technologie, ASUS GameVisual Technology, Monitorkalibrierung Delta E<2, Shadow Boost-Technologie, Stativgewinde",
        "Details zu Abmessungen & Gewicht": "Ohne Fu\u00df - Breite: 106.8 cm - Tiefe: 4 cm - H\u00f6he: 61.2 cm - Gewicht: 15 kg",
        "Diagonalabmessung": "120.7 cm (47.53\")",
        "Display-Typ": "OLED-Monitor / OLED",
        "Eingangsanschl\u00fcsse": "4xHDMI, DisplayPort",
        "Eingangsspannung": "Wechselstrom 100-240 V (50/60 Hz)",
        "Einstellungen der Anzeigeposition": "Neigung",
        "Energie Effizienzklasse": "Klasse F",
        "Energieklasse (HDR)": "Klasse G",
        "Enthaltene Kabel": "1 x DisplayPort-Kabel  1 x USB-Kabel  1 x HDMI-Kabel",
        "Farbraum": "133% sRGB, 98% DCI-P3",
        "Farbunterst\u00fctzung": "1,074 Milliarden Farben (10-Bit)",
        "Gaming": "Ja",
        "Ger\u00e4tetyp": "OLED-Monitor - 120.7 cm (47.53\")",
        "Gewicht": "16.2 kg",
        "HDR-Format": "HDR10",
        "HDR-f\u00e4hig": "HDR10",
        "Helligkeit": "450 cd/m\u00b2",
        "Horizontaler Betrachtungswinkel": "178",
        "Integrierte Peripherieger\u00e4te": "USB 3.2 Gen 1 Hub, Tieft\u00f6ner",
        "Kennzeichnung": "TUV Rheinland Low Blue Light (Hardware Solution)",
        "Kontrast": "135000:1 / 1500000:1 (dynamisch)",
        "Leistungsmerkmale": "USB 3.2 Gen 1 Hub, Tieft\u00f6ner",
        "Native Aufl\u00f6sung": "4K 3840 x 2160 bei 138 Hz",
        "Pixelpitch": "0.27405 mm",
        "Produktbeschreibung": "ASUS ROG Swift OLED PG48UQ - OLED-Monitor - 4K - 120.7 cm (47.53\") - HDR",
        "Schlosstyp zur Diebstahlsicherung": "Kensington Slot",
        "Schnittstellen": "DisplayPort  4 x HDMI  Kopfh\u00f6rer",
        "Seitenverh\u00e4ltnis": "16:9",
        "Spannung": "Wechselstrom 100-240 V (50/60 Hz)",
        "Stromverbrauch (Aus-Modus)": "0.3 Watt",
        "Stromverbrauch (typisch)": "300 Watt",
        "Stromverbrauch HDR (eingeschaltet)": "66 kWh/1.000 h",
        "Stromverbrauch SDR (eingeschaltet)": "59 kWh/1.000 h",
        "Stromverbrauch im Standby-Modus": "0.5 Watt",
        "Transportbreite": "123 cm",
        "Transportgewicht": "22.7 kg",
        "Transporth\u00f6he": "88 cm",
        "Transporttiefe": "18 cm",
        "Typ": "Lautsprecher - Stereo",
        "VESA-Halterung": "300 x 300 mm",
        "Vertikaler Betrachtungswinkel": "178",
        "Zubeh\u00f6r im Lieferumfang": "ROG-Tasche"
    },
    "raw_specifications_text": "Display-Typ: OLED-Monitor / OLED\nEnergie Effizienzklasse: Klasse F\nEnergieklasse (HDR): Klasse G\nDiagonalabmessung: 120.7 cm (47.53\")\nAdaptive-Sync Technologie: NVIDIA G-SYNC Compatible\nIntegrierte Peripherieger\u00e4te: USB 3.2 Gen 1 Hub, Tieft\u00f6ner\nSeitenverh\u00e4ltnis: 16:9\nNative Aufl\u00f6sung: 4K 3840 x 2160 bei 138 Hz\nPixelpitch: 0.27405 mm\nHelligkeit: 450 cd/m\u00b2\nKontrast: 135000:1 / 1500000:1 (dynamisch)\nHDR-Format: HDR10\nFarbunterst\u00fctzung: 1,074 Milliarden Farben (10-Bit)\nFarbraum: 133% sRGB, 98% DCI-P3\nGaming: Ja\nHorizontaler Betrachtungswinkel: 178\nVertikaler Betrachtungswinkel: 178\nBesonderheiten: HDCP, Trace Free Technology, ASUS GamePlus, Low Blue Light Mode, flimmerfreie Technologie, ASUS GameVisual Technology, Monitorkalibrierung Delta E<2, Shadow Boost-Technologie, Stativgewinde\nAbmessungen (Breite x Tiefe x H\u00f6he): 106.8 cm x 26.6 cm x 68.6 cm - mit Fu\u00df\nGewicht: 16.2 kg\nTyp: Lautsprecher - Stereo\nAusgangsleistung/Kanal: 10 Watt\nSchnittstellen: DisplayPort  4 x HDMI  Kopfh\u00f6rer\nEinstellungen der Anzeigeposition: Neigung\nVESA-Halterung: 300 x 300 mm\nLeistungsmerkmale: USB 3.2 Gen 1 Hub, Tieft\u00f6ner\nZubeh\u00f6r im Lieferumfang: ROG-Tasche\nEnthaltene Kabel: 1 x DisplayPort-Kabel  1 x USB-Kabel  1 x HDMI-Kabel\nKennzeichnung: TUV Rheinland Low Blue Light (Hardware Solution)\nSchlosstyp zur Diebstahlsicherung: Kensington Slot\nEingangsspannung: Wechselstrom 100-240 V (50/60 Hz)\nStromverbrauch SDR (eingeschaltet): 59 kWh/1.000 h\nStromverbrauch HDR (eingeschaltet): 66 kWh/1.000 h\nStromverbrauch (typisch): 300 Watt\nStromverbrauch im Standby-Modus: 0.5 Watt\nStromverbrauch (Aus-Modus): 0.3 Watt\nDetails zu Abmessungen & Gewicht: Ohne Fu\u00df - Breite: 106.8 cm - Tiefe: 4 cm - H\u00f6he: 61.2 cm - Gewicht: 15 kg\nTransportbreite: 123 cm\nTransporttiefe: 18 cm\nTransporth\u00f6he: 88 cm\nTransportgewicht: 22.7 kg\nProduktbeschreibung: ASUS ROG Swift OLED PG48UQ - OLED-Monitor - 4K - 120.7 cm (47.53\") - HDR\nGer\u00e4tetyp: OLED-Monitor - 120.7 cm (47.53\")\nHDR-f\u00e4hig: HDR10\nEingangsanschl\u00fcsse: 4xHDMI, DisplayPort\nSpannung: Wechselstrom 100-240 V (50/60 Hz)\nAbmessungen (Breite x Tiefe x H\u00f6he) - mit Fu\u00df: 106.8 cm x 26.6 cm x 68.6 cm",
    "reference_file": "offer_reference_797.json",
    "shop_name": "HiQ24"
}