{
    "html_file": "offer_1259_6.html",
    "name": "AOC U27P2CA, 27\"",
    "offer_link": "https://www.alternate.at/AOC/U27P2CA-LED-Monitor/html/product/1800087?partner=AtGeizhalsat&campaign=Monitor/AOC/1800087",
    "price": 355.0,
    "raw_specifications": {
        "": "Adaptive-Sync, Kensington-Schloss",
        "Abmessungen": "Breite: 61,36 cm x H\u00f6he: 54,45 cm x Tiefe/L\u00e4nge: 20,01 cm",
        "Anschl\u00fcsse": "2x HDMI-Eingang, (HDMI-Version: 2.0), 1x DisplayPort-Eingang, (DisplayPort-Version: 1.2), 1x Kopfh\u00f6rer-Ausgang, 4x USB-A-3.2 Gen 1 (5 Gbit/s), 1x USB-C 3.2 Gen 1 (5 Gbit/s)",
        "Bild": "Glaretyp",
        "Bildschirmaufl\u00f6sung": "3.840 x 2.160 Pixel",
        "Bildschirmdiagonale": "69 cm (27 Zoll)",
        "EAN": "4038986189859",
        "Energieeffizienzklasse (HDR)": "G (A - G)",
        "Energieeffizienzklasse (SDR)": "G (A - G)",
        "Energieverbauch pro 1000 Stunden (HDR)": "32 kWh",
        "Energieverbauch pro 1000 Stunden (SDR)": "32 kWh",
        "Ergonomie": "Typ",
        "Farbe": "schwarz",
        "Features": "Low Blue Light, Flicker-Free LED",
        "Gewicht": "7,1 kg",
        "Hersteller-Nr.": "U27P2CA",
        "Lautsprecher": "2 Lautsprecher",
        "Leistungsaufnahme im Bereitschafts- und Aus-Zustand": "0,5 Watt",
        "Leistungsaufnahme im Ein-Zustand bei Standard-Dynamikumfang (SDR)": "32 Watt",
        "Leistungsaufnahme im Ein-Zustand bei hohem Dynamikumfang (HDR)": "32 Watt",
        "Stromversorgung": "Eco-Off",
        "Typ": "LED-Monitor",
        "Wandhalterung": "VESA kompatibel (100 x 100 mm)"
    },
    "raw_specifications_text": "Energieeffizienzklasse (SDR): G (A - G)\nEnergieverbauch pro 1000 Stunden (SDR): 32 kWh\nEnergieeffizienzklasse (HDR): G (A - G)\nEnergieverbauch pro 1000 Stunden (HDR): 32 kWh\nLeistungsaufnahme im Ein-Zustand bei Standard-Dynamikumfang (SDR): 32 Watt\nLeistungsaufnahme im Ein-Zustand bei hohem Dynamikumfang (HDR): 32 Watt\nLeistungsaufnahme im Bereitschafts- und Aus-Zustand: 0,5 Watt\nBildschirmdiagonale: 69 cm (27 Zoll)\nBildschirmaufl\u00f6sung: 3.840 x 2.160 Pixel\nTyp: LED-Monitor\nFarbe: schwarz\nEAN: 4038986189859\nHersteller-Nr.: U27P2CA\nBild: Glaretyp\n: Adaptive-Sync, Kensington-Schloss\nAnschl\u00fcsse: 2x HDMI-Eingang, (HDMI-Version: 2.0), 1x DisplayPort-Eingang, (DisplayPort-Version: 1.2), 1x Kopfh\u00f6rer-Ausgang, 4x USB-A-3.2 Gen 1 (5 Gbit/s), 1x USB-C 3.2 Gen 1 (5 Gbit/s)\nErgonomie: Typ\nStromversorgung: Eco-Off\nLautsprecher: 2 Lautsprecher\nWandhalterung: VESA kompatibel (100 x 100 mm)\nFeatures: Low Blue Light, Flicker-Free LED\nAbmessungen: Breite: 61,36 cm x H\u00f6he: 54,45 cm x Tiefe/L\u00e4nge: 20,01 cm\nGewicht: 7,1 kg",
    "reference_file": "offer_reference_1259.json",
    "shop_name": "Alternate.at"
}