{
    "html_file": "offer_95_20.html",
    "name": "Eizo FlexScan EV2740X schwarz, 27\"",
    "offer_link": "https://www.electronicshop24.at/product_info.php?products_id=20000000857083421&ano=I857083421&mno=EV2740X-BK&ean=4995047065180&utm_medium=cpc&utm_campaign=preisvergleich&utm_content=item&utm_source=geizhals&ref=geizhals",
    "price": 1055.0,
    "raw_specifications": {
        "Abmessungen (Breite x Tiefe x H\u00f6he)": "61.16 cm x 25.01 cm x 56.54 cm",
        "Ausgangsleistung/Kanal": "2 Watt",
        "Besonderheiten": "Bild f\u00fcr Bild, HDCP, Auto EcoView, DICOM-kalibriert, flimmerfreie Technologie, sRGB Color Space, Movie Mode, sRGB Mode, Zero Bright Pixels, Low Blue Light-Technologie, Paper-Modus",
        "Bildschirmtyp": "IPS",
        "Details zu Abmessungen & Gewicht": "Mit Fu\u00df - Breite: 61.16 cm - Tiefe: 25.01 cm - H\u00f6he: 56.54 cm - Gewicht: 8.2 kg \u00a6 Ohne Fu\u00df - Breite: 61.16 cm - Tiefe: 6.05 cm - H\u00f6he: 35.88 cm - Gewicht: 5.5 kg",
        "Diagonalabmessung": "68.5 cm (27\")",
        "Display-Typ": "LED-hintergrundbeleuchteter LCD-Monitor / TFT-Aktivmatrix",
        "ENERGY STAR zertifiziert": "Ja",
        "Eingangsspannung": "Wechselstrom 100-240 V (50/60 Hz)",
        "Einstellungen der Anzeigeposition": "H\u00f6he, Pivot (Rotation), Drehung, Neigung",
        "Energie Effizienzklasse": "Klasse D",
        "Enthaltene Kabel": "1 x USB-C Kabel - 1.5 m",
        "Farbe": "Schwarz",
        "Farbunterst\u00fctzung": "16,7 Millionen Farben",
        "Gewicht": "8.2 kg",
        "Helligkeit": "350 cd/m\u00b2",
        "Hintergrundbeleuchtungs-Technologie": "LED-Hintergrundbeleuchtung",
        "Horizontale Bildwiederholrate": "31 - 134 kHz",
        "Horizontaler Betrachtungswinkel": "178",
        "H\u00f6heneinstellung": "195 mm",
        "Integrierte Peripherieger\u00e4te": "USB 3.2 Gen 1/USB-C Hub",
        "Kennzeichnung": "FCC Klasse B bescheinigt, TUV GS, TUV S, CB, CCC, TUV Ergo, RoHS, WEEE, PSE Mark, cTUVus, VCCI Class B, China RoHS, RCM, CAN ICES-3 Class B, HDCP 1.3, HDCP 1.4, HDCP 2.3, UKCA, TCO Certified 9.0, T\u00dcV-zertifizierte Low-Blue-Light-Technologie, T\u00dcV-zertifizierte Flimmerfrei-Technologie",
        "Kontrast": "2000:1",
        "Leistungsmerkmale": "Unterst\u00fctzung f\u00fcr VESA-Schnittstelle",
        "Max. Betriebstemperatur": "35 \u00b0C",
        "Min Betriebstemperatur": "5 \u00b0C",
        "Mitgelieferte Software": "EIZO Screen InStyle",
        "Native Aufl\u00f6sung": "4K 3840 x 2160",
        "Neigungswinkel": "-5/+35",
        "OSD-Sprachen": "Chinesisch (tradionell), Chinesisch (vereinfacht), Englisch, Deutsch, Franz\u00f6sisch, Italienisch, Schwedisch, Spanisch, Japanisch",
        "Pixelpitch": "0.155 mm",
        "Ppi": "163",
        "Reaktionszeit": "5 ms (Gray-to-Gray)",
        "Rotationswinkel": "90",
        "Schnittstellen": "DisplayPort (HDCP) \u00a6 2 x HDMI (HDCP) \u00a6 USB-C/DisplayPort Alt Mode (bis zu 94 W) \u00a6 USB-C 3.2 Gen 1 Downstream (bis zu 15 W) \u00a6 USB 3.2 Gen 1 Upstream (Typ B) \u00a6 3 x USB 3.2 Gen 1 Downstream (Typ A) \u00a6 LAN (RJ-45) \u00a6 LAN (RJ-45) \u00a6 Kopfh\u00f6rer (Mini-Klinkenstecker) \u00a6 Audio Line-Out (Mini-Klinkenstecker)",
        "Schwenkwinkel": "180",
        "Seitenverh\u00e4ltnis": "16:9",
        "Service und Support": "Begrenzte Garantie - 5 Jahre",
        "Stromverbrauch (max.)": "186 Watt",
        "Stromverbrauch (typisch)": "16 Watt",
        "Stromverbrauch SDR (eingeschaltet)": "18 kWh/1.000 h",
        "Stromverbrauch im Standby-Modus": "0.35 Watt",
        "Typ": "Lautsprecher - Stereo",
        "USB-Spannungsversorgung": "94 Watt",
        "VESA-Halterung": "100 x 100 mm",
        "Vertikale Bildwiederholrate": "29 - 61 Hz",
        "Vertikaler Betrachtungswinkel": "178",
        "Zul\u00e4ssige Luftfeuchtigkeit im Betrieb": "20 - 80% RH (non-condensing)"
    },
    "raw_specifications_text": "Display-Typ: LED-hintergrundbeleuchteter LCD-Monitor / TFT-Aktivmatrix\nEnergie Effizienzklasse: Klasse D\nDiagonalabmessung: 68.5 cm (27\")\nIntegrierte Peripherieger\u00e4te: USB 3.2 Gen 1/USB-C Hub\nUSB-Spannungsversorgung: 94 Watt\nBildschirmtyp: IPS\nSeitenverh\u00e4ltnis: 16:9\nNative Aufl\u00f6sung: 4K 3840 x 2160\nPixelpitch: 0.155 mm\nPpi: 163\nHelligkeit: 350 cd/m\u00b2\nKontrast: 2000:1\nFarbunterst\u00fctzung: 16,7 Millionen Farben\nReaktionszeit: 5 ms (Gray-to-Gray)\nVertikale Bildwiederholrate: 29 - 61 Hz\nHorizontale Bildwiederholrate: 31 - 134 kHz\nHorizontaler Betrachtungswinkel: 178\nVertikaler Betrachtungswinkel: 178\nHintergrundbeleuchtungs-Technologie: LED-Hintergrundbeleuchtung\nOSD-Sprachen: Chinesisch (tradionell), Chinesisch (vereinfacht), Englisch, Deutsch, Franz\u00f6sisch, Italienisch, Schwedisch, Spanisch, Japanisch\nBesonderheiten: Bild f\u00fcr Bild, HDCP, Auto EcoView, DICOM-kalibriert, flimmerfreie Technologie, sRGB Color Space, Movie Mode, sRGB Mode, Zero Bright Pixels, Low Blue Light-Technologie, Paper-Modus\nFarbe: Schwarz\nAbmessungen (Breite x Tiefe x H\u00f6he): 61.16 cm x 25.01 cm x 56.54 cm\nGewicht: 8.2 kg\nTyp: Lautsprecher - Stereo\nAusgangsleistung/Kanal: 2 Watt\nSchnittstellen: DisplayPort (HDCP) \u00a6 2 x HDMI (HDCP) \u00a6 USB-C/DisplayPort Alt Mode (bis zu 94 W) \u00a6 USB-C 3.2 Gen 1 Downstream (bis zu 15 W) \u00a6 USB 3.2 Gen 1 Upstream (Typ B) \u00a6 3 x USB 3.2 Gen 1 Downstream (Typ A) \u00a6 LAN (RJ-45) \u00a6 LAN (RJ-45) \u00a6 Kopfh\u00f6rer (Mini-Klinkenstecker) \u00a6 Audio Line-Out (Mini-Klinkenstecker)\nEinstellungen der Anzeigeposition: H\u00f6he, Pivot (Rotation), Drehung, Neigung\nNeigungswinkel: -5/+35\nSchwenkwinkel: 180\nRotationswinkel: 90\nH\u00f6heneinstellung: 195 mm\nVESA-Halterung: 100 x 100 mm\nLeistungsmerkmale: Unterst\u00fctzung f\u00fcr VESA-Schnittstelle\nEnthaltene Kabel: 1 x USB-C Kabel - 1.5 m\nKennzeichnung: FCC Klasse B bescheinigt, TUV GS, TUV S, CB, CCC, TUV Ergo, RoHS, WEEE, PSE Mark, cTUVus, VCCI Class B, China RoHS, RCM, CAN ICES-3 Class B, HDCP 1.3, HDCP 1.4, HDCP 2.3, UKCA, TCO Certified 9.0, T\u00dcV-zertifizierte Low-Blue-Light-Technologie, T\u00dcV-zertifizierte Flimmerfrei-Technologie\nEingangsspannung: Wechselstrom 100-240 V (50/60 Hz)\nStromverbrauch SDR (eingeschaltet): 18 kWh/1.000 h\nStromverbrauch (typisch): 16 Watt\nStromverbrauch (max.): 186 Watt\nStromverbrauch im Standby-Modus: 0.35 Watt\nMitgelieferte Software: EIZO Screen InStyle\nDetails zu Abmessungen & Gewicht: Mit Fu\u00df - Breite: 61.16 cm - Tiefe: 25.01 cm - H\u00f6he: 56.54 cm - Gewicht: 8.2 kg \u00a6 Ohne Fu\u00df - Breite: 61.16 cm - Tiefe: 6.05 cm - H\u00f6he: 35.88 cm - Gewicht: 5.5 kg\nENERGY STAR zertifiziert: Ja\nService und Support: Begrenzte Garantie - 5 Jahre\nMin Betriebstemperatur: 5 \u00b0C\nMax. Betriebstemperatur: 35 \u00b0C\nZul\u00e4ssige Luftfeuchtigkeit im Betrieb: 20 - 80% RH (non-condensing)",
    "reference_file": "offer_reference_95.json",
    "shop_name": "ElectronicShop24"
}