{
    "html_file": "offer_1918_13.html",
    "name": "ASUS ProArt PA248QV, 24.1\"",
    "offer_link": "https://www.hiq24.de/shop/artikel/277936/?sPartner=geizhals",
    "price": 237.9,
    "raw_specifications": {
        "Abmessungen (Breite x Tiefe x H\u00f6he)": "53.3 cm x 21.1 cm x 50.5 cm - mit Fu\u00df",
        "Abmessungen (Breite x Tiefe x H\u00f6he) - mit Fu\u00df": "53.3 cm x 21.1 cm x 50.5 cm",
        "Ausgangsleistung/Kanal": "2 Watt",
        "Besonderheiten": "HDCP, Trace Free Technology, Low Blue Light Mode, flimmerfreie Technologie, Adaptive-Sync-Technologie, Farbanpassungsmodus, Farbtemperatur Auswahl, Quick Release Stand Design, Monitorkalibrierung Delta E<2",
        "Bildschirmbeschichtung": "Blendfrei",
        "Bildschirmtyp": "IPS",
        "Details zu Abmessungen & Gewicht": "Ohne Fu\u00df - Breite: 53.3 cm - Tiefe: 4.7 cm - H\u00f6he: 36 cm - Gewicht: 3.9 kg",
        "Diagonalabmessung": "61.2 cm (24.1\")",
        "Display-Typ": "LED-hintergrundbeleuchteter LCD-Monitor / TFT-Aktivmatrix",
        "ENERGY STAR zertifiziert": "Ja",
        "Eingangsanschl\u00fcsse": "HDMI, VGA, DisplayPort",
        "Eingangsspannung": "Wechselstrom 120/230 V (50/60 Hz)",
        "Einstellungen der Anzeigeposition": "H\u00f6he, Pivot (Rotation), Drehung, Neigung",
        "Energie Effizienzklasse": "Klasse G",
        "Energieverbrauch pro Jahr": "26 kWh",
        "Farbraum": "100% Rec 709, 100% sRGB",
        "Farbunterst\u00fctzung": "16,7 Millionen Farben",
        "Ger\u00e4tetyp": "LED-hintergrundbeleuchteter LCD-Monitor - 61.2 cm (24.1\")",
        "Gewicht": "6.1 kg",
        "Helligkeit": "350 cd/m\u00b2",
        "Hintergrundbeleuchtungs-Technologie": "LED-Hintergrundbeleuchtung",
        "Horizontale Bildwiederholrate": "30 - 105 kHz",
        "Horizontaler Betrachtungswinkel": "178",
        "H\u00f6heneinstellung": "130 mm",
        "Integrierte Peripherieger\u00e4te": "USB 3.0-Hub",
        "Kennzeichnung": "UL, TUV GS, VCCI, BSMI, cUL, WHQL, CB, CCC, TUV Ergo, PSB, FCC, RoHS, ISO 9241-307, KCC, WEEE, PSE Mark, MEPS, J-MOSS, E-Standby, CEC, KC, ERP, RCM, TUV Rheinland Low Blue Light Certification, CU, TUV Rheinland Flicker Free Certification",
        "Kontrast": "1000:1 / 100000000:1 (dynamisch)",
        "Leistungsaufnahme im Ein-Zustand": "28.2 W",
        "Leistungsmerkmale": "USB 3.0-Hub",
        "Native Aufl\u00f6sung": "WUXGA 1920 x 1200",
        "Neigungswinkel": "-5/+35",
        "Pixelpitch": "0.27 mm",
        "Produktbeschreibung": "ASUS ProArt PA248QV - LED-Monitor - 61.2 cm (24.1\")",
        "Reaktionszeit": "5 ms (Gray-to-Gray)",
        "Rotationswinkel": "180",
        "Schlosstyp zur Diebstahlsicherung": "Kensington Slot",
        "Schnittstellen": "VGA  DisplayPort  HDMI  Audio Line-In  Kopfh\u00f6rer  4 x USB Downstream  USB Upstream (Typ B)",
        "Schwenkwinkel": "180",
        "Seitenverh\u00e4ltnis": "16:10",
        "Spannung": "Wechselstrom 120/230 V (50/60 Hz)",
        "Stromverbrauch (Aus-Modus)": "0 Watt",
        "Stromverbrauch (typisch)": "15 Watt",
        "Stromverbrauch SDR (eingeschaltet)": "28.2 kWh/1.000 h",
        "Stromverbrauch im Standby-Modus": "0.5 Watt",
        "TCO-zertifiziert": "TCO Certified Displays 8",
        "Transportbreite": "64.9 cm",
        "Transportgewicht": "8.3 kg",
        "Transporth\u00f6he": "47.4 cm",
        "Transporttiefe": "19.2 cm",
        "Typ": "Lautsprecher - Stereo",
        "Umweltschutzstandards": "TCO Certified Displays 8, ENERGY STAR-qualifiziert",
        "VESA-Halterung": "100 x 100 mm",
        "Vertikale Bildwiederholrate": "49 - 75 Hz",
        "Vertikaler Betrachtungswinkel": "178"
    },
    "raw_specifications_text": "Display-Typ: LED-hintergrundbeleuchteter LCD-Monitor / TFT-Aktivmatrix\nEnergie Effizienzklasse: Klasse G\nEnergieverbrauch pro Jahr: 26 kWh\nDiagonalabmessung: 61.2 cm (24.1\")\nIntegrierte Peripherieger\u00e4te: USB 3.0-Hub\nBildschirmtyp: IPS\nSeitenverh\u00e4ltnis: 16:10\nNative Aufl\u00f6sung: WUXGA 1920 x 1200\nPixelpitch: 0.27 mm\nHelligkeit: 350 cd/m\u00b2\nKontrast: 1000:1 / 100000000:1 (dynamisch)\nFarbunterst\u00fctzung: 16,7 Millionen Farben\nFarbraum: 100% Rec 709, 100% sRGB\nReaktionszeit: 5 ms (Gray-to-Gray)\nVertikale Bildwiederholrate: 49 - 75 Hz\nHorizontale Bildwiederholrate: 30 - 105 kHz\nHorizontaler Betrachtungswinkel: 178\nVertikaler Betrachtungswinkel: 178\nBildschirmbeschichtung: Blendfrei\nHintergrundbeleuchtungs-Technologie: LED-Hintergrundbeleuchtung\nBesonderheiten: HDCP, Trace Free Technology, Low Blue Light Mode, flimmerfreie Technologie, Adaptive-Sync-Technologie, Farbanpassungsmodus, Farbtemperatur Auswahl, Quick Release Stand Design, Monitorkalibrierung Delta E<2\nAbmessungen (Breite x Tiefe x H\u00f6he): 53.3 cm x 21.1 cm x 50.5 cm - mit Fu\u00df\nGewicht: 6.1 kg\nTyp: Lautsprecher - Stereo\nAusgangsleistung/Kanal: 2 Watt\nSchnittstellen: VGA  DisplayPort  HDMI  Audio Line-In  Kopfh\u00f6rer  4 x USB Downstream  USB Upstream (Typ B)\nEinstellungen der Anzeigeposition: H\u00f6he, Pivot (Rotation), Drehung, Neigung\nNeigungswinkel: -5/+35\nSchwenkwinkel: 180\nRotationswinkel: 180\nH\u00f6heneinstellung: 130 mm\nVESA-Halterung: 100 x 100 mm\nLeistungsmerkmale: USB 3.0-Hub\nKennzeichnung: UL, TUV GS, VCCI, BSMI, cUL, WHQL, CB, CCC, TUV Ergo, PSB, FCC, RoHS, ISO 9241-307, KCC, WEEE, PSE Mark, MEPS, J-MOSS, E-Standby, CEC, KC, ERP, RCM, TUV Rheinland Low Blue Light Certification, CU, TUV Rheinland Flicker Free Certification\nSchlosstyp zur Diebstahlsicherung: Kensington Slot\nEingangsspannung: Wechselstrom 120/230 V (50/60 Hz)\nLeistungsaufnahme im Ein-Zustand: 28.2 W\nStromverbrauch SDR (eingeschaltet): 28.2 kWh/1.000 h\nStromverbrauch (typisch): 15 Watt\nStromverbrauch im Standby-Modus: 0.5 Watt\nStromverbrauch (Aus-Modus): 0 Watt\nDetails zu Abmessungen & Gewicht: Ohne Fu\u00df - Breite: 53.3 cm - Tiefe: 4.7 cm - H\u00f6he: 36 cm - Gewicht: 3.9 kg\nTransportbreite: 64.9 cm\nTransporttiefe: 19.2 cm\nTransporth\u00f6he: 47.4 cm\nTransportgewicht: 8.3 kg\nTCO-zertifiziert: TCO Certified Displays 8\nENERGY STAR zertifiziert: Ja\nProduktbeschreibung: ASUS ProArt PA248QV - LED-Monitor - 61.2 cm (24.1\")\nGer\u00e4tetyp: LED-hintergrundbeleuchteter LCD-Monitor - 61.2 cm (24.1\")\nEingangsanschl\u00fcsse: HDMI, VGA, DisplayPort\nSpannung: Wechselstrom 120/230 V (50/60 Hz)\nAbmessungen (Breite x Tiefe x H\u00f6he) - mit Fu\u00df: 53.3 cm x 21.1 cm x 50.5 cm\nUmweltschutzstandards: TCO Certified Displays 8, ENERGY STAR-qualifiziert",
    "reference_file": "offer_reference_1918.json",
    "shop_name": "HiQ24"
}