{
    "html_file": "offer_510_29.html",
    "name": "HP E22 G5, 21.5\"",
    "offer_link": "https://www.alternate.at/HP/E22-G5-LED-Monitor/html/product/1904956?partner=AtGeizhalsat&campaign=Monitor/HP/1904956",
    "price": 208.9,
    "raw_specifications": {
        "": "H\u00f6henverstellbar",
        "Abmessungen": "Breite: 57,1 cm x H\u00f6he: 36,3 cm x Tiefe/L\u00e4nge: 14 cm",
        "Anschl\u00fcsse": "1x HDMI-Eingang, (HDMI-Version: 1.4), 1x DisplayPort-Eingang, (DisplayPort-Version: 1.2), 4x USB-A-3.2 Gen 1 (5 Gbit/s), 1x USB-B-3.2 (5 Gbit/s)",
        "Bild": "Glaretyp",
        "Bildschirmaufl\u00f6sung": "1.920 x 1.080 Pixel",
        "Bildschirmdiagonale": "54,6 cm (21,5 Zoll)",
        "EAN": "0196786298073",
        "Energieeffizienzklasse (SDR)": "D (A - G)",
        "Energieverbauch pro 1000 Stunden (SDR)": "13 kWh",
        "Ergonomie": "Typ",
        "Farbe": "schwarz/silber",
        "Features": "Kensington-Schloss",
        "Frequenz": "Vertikal",
        "Geeignet f\u00fcr": "Business, Multimedia",
        "Gewicht": "4,9 kg",
        "Hersteller-Nr.": "6N4E8AA#ABB",
        "Leistungsaufnahme im Bereitschafts- und Aus-Zustand": "0,5 Watt",
        "Leistungsaufnahme im Ein-Zustand bei Standard-Dynamikumfang (SDR)": "13 Watt",
        "Stromversorgung": "Stromverbrauch",
        "Typ": "LED-Monitor",
        "Wandhalterung": "VESA kompatibel (100 x 100 mm)",
        "Weitere Informationen": "Ein USB-A-Anschluss hat eine Ladefunktion.",
        "Zubeh\u00f6r": "Vorhanden"
    },
    "raw_specifications_text": "Energieeffizienzklasse (SDR): D (A - G)\nEnergieverbauch pro 1000 Stunden (SDR): 13 kWh\nLeistungsaufnahme im Ein-Zustand bei Standard-Dynamikumfang (SDR): 13 Watt\nLeistungsaufnahme im Bereitschafts- und Aus-Zustand: 0,5 Watt\nBildschirmdiagonale: 54,6 cm (21,5 Zoll)\nBildschirmaufl\u00f6sung: 1.920 x 1.080 Pixel\nTyp: LED-Monitor\nFarbe: schwarz/silber\nEAN: 0196786298073\nHersteller-Nr.: 6N4E8AA#ABB\nGeeignet f\u00fcr: Business, Multimedia\nBild: Glaretyp\n: H\u00f6henverstellbar\nFrequenz: Vertikal\nAnschl\u00fcsse: 1x HDMI-Eingang, (HDMI-Version: 1.4), 1x DisplayPort-Eingang, (DisplayPort-Version: 1.2), 4x USB-A-3.2 Gen 1 (5 Gbit/s), 1x USB-B-3.2 (5 Gbit/s)\nErgonomie: Typ\nStromversorgung: Stromverbrauch\nWandhalterung: VESA kompatibel (100 x 100 mm)\nFeatures: Kensington-Schloss\nWeitere Informationen: Ein USB-A-Anschluss hat eine Ladefunktion.\nZubeh\u00f6r: Vorhanden\nAbmessungen: Breite: 57,1 cm x H\u00f6he: 36,3 cm x Tiefe/L\u00e4nge: 14 cm\nGewicht: 4,9 kg",
    "reference_file": "offer_reference_510.json",
    "shop_name": "Alternate.at"
}