{
    "html_file": "offer_944_6.html",
    "name": "ASUS ProArt PA328QV, 31.5\"",
    "offer_link": "https://www.proshop.at/Bildschirm/ASUS-31-Bildschirm-ProArt-PA328QV-Black-5-ms/3117390?utm_source=geizhals&utm_medium=cpc&utm_campaign=pricesite",
    "price": 480.43,
    "raw_specifications": {
        "Abmessungen (Breite x Tiefe x H\u00f6he)": "71.48 cm x 24.5 cm x 59.56 cm - mit Standfu\u00df (h\u00f6chste Position)",
        "Abmessungen (Breite x Tiefe x H\u00f6he) - mit Standfu\u00df (h\u00f6chste Position)": "71.48 cm x 24.5 cm x 59.56 cm",
        "Ausgangsleistung/Kanal": "2 Watt",
        "Besonderheiten": "Bild in Bild, Bild f\u00fcr Bild, HDCP, ASUS QuickFit Virtual Scale, Low Blue Light Mode, flimmerfreie Technologie, Adaptive-Sync-Technologie, Farbtemperatur Auswahl, 6-Axis Color Adjustments, Zero Bright Dot Warranty, Monitorkalibrierung Delta E<2, CalMAN Verified, ProArt Preset, ProArt Palette, ProArt Widget",
        "Bildschirmbeschichtung": "Blendfrei",
        "Bildschirmtyp": "IPS",
        "Details zu Abmessungen & Gewicht": "Ohne Fu\u00df - Breite: 71.48 cm - Tiefe: 6.733 cm - H\u00f6he: 42.22 cm - Gewicht: 7 kg  Mit Standfu\u00df (niedrigste Position) - Breite: 71.48 cm - Tiefe: 24.5 cm - H\u00f6he: 46.56 cm - Gewicht: 11.5 kg  Mit Standfu\u00df (h\u00f6chste Position) - Breite: 71.48 cm - Tiefe: 24.5 cm - H\u00f6he: 59.56 cm - Gewicht: 11.5 kg",
        "Diagonalabmessung": "80 cm (31.5\")",
        "Display-Typ": "LED-hintergrundbeleuchteter LCD-Monitor / TFT-Aktivmatrix",
        "EAN": "4711081524847",
        "Eingangsanschl\u00fcsse": "2xHDMI, DisplayPort",
        "Eingangsspannung": "Wechselstrom 100-240 V (50/60 Hz)",
        "Einstellungen der Anzeigeposition": "H\u00f6he, Pivot (Rotation), Drehung, Neigung",
        "Energie Effizienzklasse": "Klasse F",
        "Energieklasse (HDR)": "Klasse G",
        "Enthaltene Kabel": "1 x DisplayPort-Kabel  1 x HDMI-Kabel  1 x Stromkabel",
        "Farbraum": "100% Rec 709, 100% sRGB",
        "Farbunterst\u00fctzung": "1,074 Milliarden Farben (10-Bit)",
        "Ger\u00e4tetyp": "LED-hintergrundbeleuchteter LCD-Monitor - 80 cm (31.5\")",
        "Gewicht": "11.5 kg",
        "HDR-Format": "HDR10",
        "HDR-f\u00e4hig": "HDR10",
        "Helligkeit": "400 cd/m\u00b2",
        "Hersteller": "ASUS",
        "Hintergrundbeleuchtungs-Technologie": "LED-Hintergrundbeleuchtung",
        "Horizontale Bildwiederholrate": "27 - 112 kHz",
        "Horizontaler Betrachtungswinkel": "178",
        "H\u00f6heneinstellung": "130 mm",
        "Integrierte Peripherieger\u00e4te": "USB 3.2 Gen 1 Hub",
        "Kennzeichnung": "TUV Rheinland Flicker Free Certification, DisplayPort 1.2, TUV Rheinland Low Blue Light (Software Solution)",
        "Kontrast": "1000:1",
        "Leistungsmerkmale": "Slot f\u00fcr Sicherheitsschloss (Kabelschloss getrennt erh\u00e4ltlich)",
        "Modell": "90LM00X0-B02370",
        "Native Aufl\u00f6sung": "WQHD 2560 x 1440 bei 75 Hz",
        "Neigungswinkel": "-5/+23",
        "Pixelpitch": "0.272 mm",
        "Produktbeschreibung": "ASUS ProArt PA328QV - LED-Monitor - 80 cm (31.5\") - HDR",
        "Reaktionszeit": "5 ms (Gray-to-Gray)",
        "Rotationswinkel": "180",
        "Schlosstyp zur Diebstahlsicherung": "Kensington Slot",
        "Schnittstellen": "USB 3.2 Gen 1 Upstream  DisplayPort  2 x HDMI  4 x USB 3.2 Gen 1 Downstream  Kopfh\u00f6rer",
        "Schwenkwinkel": "60",
        "Seitenverh\u00e4ltnis": "16:9",
        "Spannung": "Wechselstrom 100-240 V (50/60 Hz)",
        "Stromverbrauch (Aus-Modus)": "0 Watt",
        "Stromverbrauch (typisch)": "26.5 Watt",
        "Stromverbrauch HDR (eingeschaltet)": "38.8 kWh/1.000 h",
        "Stromverbrauch SDR (eingeschaltet)": "32.4 kWh/1.000 h",
        "Stromverbrauch im Standby-Modus": "0.5 Watt",
        "TCO-zertifiziert": "TCO Certified Displays 9",
        "Transportbreite": "84.1 cm",
        "Transportgewicht": "14.6 kg",
        "Transporth\u00f6he": "52.5 cm",
        "Transporttiefe": "31.7 cm",
        "Typ": "Lautsprecher - Stereo",
        "Umweltschutzstandards": "TCO Certified Displays 9",
        "VESA-Halterung": "100 x 100 mm",
        "Vertikale Bildwiederholrate": "24 - 75 Hz",
        "Vertikaler Betrachtungswinkel": "178",
        "Waren-Nr.": "3117390",
        "Zum Hersteller": "www.asus.com/"
    },
    "raw_specifications_text": "Hersteller: ASUS\nWaren-Nr.: 3117390\nModell: 90LM00X0-B02370\nEAN: 4711081524847\nZum Hersteller: www.asus.com/\nProduktbeschreibung: ASUS ProArt PA328QV - LED-Monitor - 80 cm (31.5\") - HDR\nGer\u00e4tetyp: LED-hintergrundbeleuchteter LCD-Monitor - 80 cm (31.5\")\nEnergie Effizienzklasse: Klasse F\nLeistungsmerkmale: Slot f\u00fcr Sicherheitsschloss (Kabelschloss getrennt erh\u00e4ltlich)\nBildschirmtyp: IPS\nSeitenverh\u00e4ltnis: 16:9\nNative Aufl\u00f6sung: WQHD 2560 x 1440 bei 75 Hz\nPixelpitch: 0.272 mm\nHelligkeit: 400 cd/m\u00b2\nKontrast: 1000:1\nHDR-f\u00e4hig: HDR10\nReaktionszeit: 5 ms (Gray-to-Gray)\nFarbunterst\u00fctzung: 1,074 Milliarden Farben (10-Bit)\nFarbraum: 100% Rec 709, 100% sRGB\nEingangsanschl\u00fcsse: 2xHDMI, DisplayPort\nEinstellungen der Anzeigeposition: H\u00f6he, Pivot (Rotation), Drehung, Neigung\nBildschirmbeschichtung: Blendfrei\nSpannung: Wechselstrom 100-240 V (50/60 Hz)\nAbmessungen (Breite x Tiefe x H\u00f6he) - mit Standfu\u00df (h\u00f6chste Position): 71.48 cm x 24.5 cm x 59.56 cm\nGewicht: 11.5 kg\nUmweltschutzstandards: TCO Certified Displays 9\nKennzeichnung: TUV Rheinland Flicker Free Certification, DisplayPort 1.2, TUV Rheinland Low Blue Light (Software Solution)\nDisplay-Typ: LED-hintergrundbeleuchteter LCD-Monitor / TFT-Aktivmatrix\nEnergieklasse (HDR): Klasse G\nDiagonalabmessung: 80 cm (31.5\")\nIntegrierte Peripherieger\u00e4te: USB 3.2 Gen 1 Hub\nHDR-Format: HDR10\nVertikale Bildwiederholrate: 24 - 75 Hz\nHorizontale Bildwiederholrate: 27 - 112 kHz\nHorizontaler Betrachtungswinkel: 178\nVertikaler Betrachtungswinkel: 178\nHintergrundbeleuchtungs-Technologie: LED-Hintergrundbeleuchtung\nBesonderheiten: Bild in Bild, Bild f\u00fcr Bild, HDCP, ASUS QuickFit Virtual Scale, Low Blue Light Mode, flimmerfreie Technologie, Adaptive-Sync-Technologie, Farbtemperatur Auswahl, 6-Axis Color Adjustments, Zero Bright Dot Warranty, Monitorkalibrierung Delta E<2, CalMAN Verified, ProArt Preset, ProArt Palette, ProArt Widget\nAbmessungen (Breite x Tiefe x H\u00f6he): 71.48 cm x 24.5 cm x 59.56 cm - mit Standfu\u00df (h\u00f6chste Position)\nTyp: Lautsprecher - Stereo\nAusgangsleistung/Kanal: 2 Watt\nSchnittstellen: USB 3.2 Gen 1 Upstream  DisplayPort  2 x HDMI  4 x USB 3.2 Gen 1 Downstream  Kopfh\u00f6rer\nNeigungswinkel: -5/+23\nSchwenkwinkel: 60\nRotationswinkel: 180\nH\u00f6heneinstellung: 130 mm\nVESA-Halterung: 100 x 100 mm\nEnthaltene Kabel: 1 x DisplayPort-Kabel  1 x HDMI-Kabel  1 x Stromkabel\nSchlosstyp zur Diebstahlsicherung: Kensington Slot\nEingangsspannung: Wechselstrom 100-240 V (50/60 Hz)\nStromverbrauch SDR (eingeschaltet): 32.4 kWh/1.000 h\nStromverbrauch HDR (eingeschaltet): 38.8 kWh/1.000 h\nStromverbrauch (typisch): 26.5 Watt\nStromverbrauch im Standby-Modus: 0.5 Watt\nStromverbrauch (Aus-Modus): 0 Watt\nDetails zu Abmessungen & Gewicht: Ohne Fu\u00df - Breite: 71.48 cm - Tiefe: 6.733 cm - H\u00f6he: 42.22 cm - Gewicht: 7 kg  Mit Standfu\u00df (niedrigste Position) - Breite: 71.48 cm - Tiefe: 24.5 cm - H\u00f6he: 46.56 cm - Gewicht: 11.5 kg  Mit Standfu\u00df (h\u00f6chste Position) - Breite: 71.48 cm - Tiefe: 24.5 cm - H\u00f6he: 59.56 cm - Gewicht: 11.5 kg\nTransportbreite: 84.1 cm\nTransporttiefe: 31.7 cm\nTransporth\u00f6he: 52.5 cm\nTransportgewicht: 14.6 kg\nTCO-zertifiziert: TCO Certified Displays 9",
    "reference_file": "offer_reference_944.json",
    "shop_name": "Proshop.at"
}