{
    "html_file": "offer_1723_16.html",
    "name": "HP E14 G4, 14\"",
    "offer_link": "https://www.electronicshop24.at/product_info.php?products_id=20000000691306911&ano=I691306911&mno=1B065AA%23ABB&ean=194850333811&utm_medium=cpc&utm_campaign=preisvergleich&utm_content=item&utm_source=geizhals&ref=geizhals",
    "price": 259.0,
    "raw_specifications": {
        "Abmessungen (Breite x Tiefe x H\u00f6he)": "32.14 cm x 1.52 cm x 21 cm - mit Fu\u00df",
        "Besonderheiten": "72 % NTSC-Farbskala, On-screen Digital Controls, Low Blue Light Mode, flimmerfreie Technologie, ohne Quecksilber, arsenfreies Glas, extrem schmale Blende an drei Seiten, 8-bit Farbtiefe",
        "Bildschirmbeschichtung": "Anti-glare 3H hardness, Haze 24%",
        "Bildschirmtyp": "IPS",
        "Blendentyp": "Flache Front",
        "Details zu Abmessungen & Gewicht": "Mit Fu\u00df - Breite: 32.14 cm - Tiefe: 1.52 cm - H\u00f6he: 21 cm - Gewicht: 640 g \u00a6 Mit Fu\u00df - Breite: 32.14 cm",
        "Diagonalabmessung": "35.6 cm (14\")",
        "Display-Typ": "LED-hintergrundbeleuchteter LCD-Monitor / TFT-Aktivmatrix",
        "ENERGY STAR zertifiziert": "Ja",
        "ENERGY STAR-Version": "8.0",
        "Einstellungen der Anzeigeposition": "Neigung",
        "Energie Effizienzklasse": "Klasse A+",
        "Energieverbrauch pro Jahr": "26 kWh",
        "Enthaltene Kabel": "1 x USB-C Kabel",
        "Farbe": "Silberner Standfu\u00df",
        "Gewicht": "640 g",
        "Helligkeit": "400 cd/m\u00b2",
        "Hintergrundbeleuchtungs-Technologie": "E-LED",
        "Horizontale Bildwiederholrate": "30 - 80 kHz",
        "Horizontaler Betrachtungswinkel": "178",
        "Kennzeichnung": "UL, TUV, TUV GS, VCCI, BSMI, NOM, WHQL, CB, CCC, FCC, ISO 9241-307, KCC, WEEE, Green Mark, ICES, cTUVus, KC, EAC, ISC, BIS, halogenarm, UAE, Vietnam MEPS",
        "Kontrast": "800:1 / 5000000:1 (dynamisch)",
        "Lebensdauer der Beleuchtung": "15,000 Stunden",
        "Leistungsaufnahme im Betrieb": "6 Watt",
        "Leistungsaufnahme im Ein-Zustand": "18 W",
        "Lokalisierung": "Englisch / Europa",
        "Max. Betriebstemperatur": "35 \u00b0C",
        "Min Betriebstemperatur": "5 \u00b0C",
        "Native Aufl\u00f6sung": "Full HD (1080p) 1920 x 1080 bei 60 Hz",
        "Neigungswinkel": "0/+78",
        "OSD-Sprachen": "Chinesisch (tradionell), Chinesisch (vereinfacht), Englisch, Deutsch, Franz\u00f6sisch, Italienisch, Portugiesisch, Spanisch, Holl\u00e4ndisch, Japanisch",
        "Pixelpitch": "0.1611 mm",
        "Ppi": "157",
        "Reaktionszeit": "5 ms (grau zu grau mit \u00dcbersteuerung)",
        "Schnittstellen": "2 x USB-C (DisplayPort 1.2 Modus)",
        "Seitenverh\u00e4ltnis": "16:9",
        "Service & Support": "Begrenzte Garantie - Arbeitszeit und Ersatzteile - 3 Jahre",
        "Sichtbare Bildfl\u00e4che": "35.56 cm (14\")",
        "Stromverbrauch im Standby-Modus": "0.3 Watt",
        "Transportbreite": "40.5 cm",
        "Transportgewicht": "1.54 kg",
        "Transporth\u00f6he": "28.4 cm",
        "Transporttiefe": "6.1 cm",
        "Vertikale Bildwiederholrate": "59 - 60 Hz",
        "Vertikaler Betrachtungswinkel": "178",
        "Zubeh\u00f6r im Lieferumfang": "H\u00fclle",
        "Zul\u00e4ssige Luftfeuchtigkeit im Betrieb": "20 - 80% (nicht kondensierend)"
    },
    "raw_specifications_text": "Display-Typ: LED-hintergrundbeleuchteter LCD-Monitor / TFT-Aktivmatrix\nEnergie Effizienzklasse: Klasse A+\nEnergieverbrauch pro Jahr: 26 kWh\nDiagonalabmessung: 35.6 cm (14\")\nSichtbare Bildfl\u00e4che: 35.56 cm (14\")\nBildschirmtyp: IPS\nSeitenverh\u00e4ltnis: 16:9\nNative Aufl\u00f6sung: Full HD (1080p) 1920 x 1080 bei 60 Hz\nPixelpitch: 0.1611 mm\nPpi: 157\nHelligkeit: 400 cd/m\u00b2\nKontrast: 800:1 / 5000000:1 (dynamisch)\nReaktionszeit: 5 ms (grau zu grau mit \u00dcbersteuerung)\nVertikale Bildwiederholrate: 59 - 60 Hz\nHorizontale Bildwiederholrate: 30 - 80 kHz\nHorizontaler Betrachtungswinkel: 178\nVertikaler Betrachtungswinkel: 178\nBildschirmbeschichtung: Anti-glare 3H hardness, Haze 24%\nHintergrundbeleuchtungs-Technologie: E-LED\nOSD-Sprachen: Chinesisch (tradionell), Chinesisch (vereinfacht), Englisch, Deutsch, Franz\u00f6sisch, Italienisch, Portugiesisch, Spanisch, Holl\u00e4ndisch, Japanisch\nBlendentyp: Flache Front\nBesonderheiten: 72 % NTSC-Farbskala, On-screen Digital Controls, Low Blue Light Mode, flimmerfreie Technologie, ohne Quecksilber, arsenfreies Glas, extrem schmale Blende an drei Seiten, 8-bit Farbtiefe\nFarbe: Silberner Standfu\u00df\nAbmessungen (Breite x Tiefe x H\u00f6he): 32.14 cm x 1.52 cm x 21 cm - mit Fu\u00df\nGewicht: 640 g\nSchnittstellen: 2 x USB-C (DisplayPort 1.2 Modus)\nEinstellungen der Anzeigeposition: Neigung\nNeigungswinkel: 0/+78\nZubeh\u00f6r im Lieferumfang: H\u00fclle\nEnthaltene Kabel: 1 x USB-C Kabel\nLebensdauer der Beleuchtung: 15,000 Stunden\nKennzeichnung: UL, TUV, TUV GS, VCCI, BSMI, NOM, WHQL, CB, CCC, FCC, ISO 9241-307, KCC, WEEE, Green Mark, ICES, cTUVus, KC, EAC, ISC, BIS, halogenarm, UAE, Vietnam MEPS\nLokalisierung: Englisch / Europa\nLeistungsaufnahme im Ein-Zustand: 18 W\nLeistungsaufnahme im Betrieb: 6 Watt\nStromverbrauch im Standby-Modus: 0.3 Watt\nDetails zu Abmessungen & Gewicht: Mit Fu\u00df - Breite: 32.14 cm - Tiefe: 1.52 cm - H\u00f6he: 21 cm - Gewicht: 640 g \u00a6 Mit Fu\u00df - Breite: 32.14 cm\nTransportbreite: 40.5 cm\nTransporttiefe: 6.1 cm\nTransporth\u00f6he: 28.4 cm\nTransportgewicht: 1.54 kg\nENERGY STAR zertifiziert: Ja\nENERGY STAR-Version: 8.0\nService & Support: Begrenzte Garantie - Arbeitszeit und Ersatzteile - 3 Jahre\nMin Betriebstemperatur: 5 \u00b0C\nMax. Betriebstemperatur: 35 \u00b0C\nZul\u00e4ssige Luftfeuchtigkeit im Betrieb: 20 - 80% (nicht kondensierend)",
    "reference_file": "offer_reference_1723.json",
    "shop_name": "ElectronicShop24"
}