{
    "html_file": "offer_1649_23.html",
    "name": "HP E23 G4, 23\"",
    "offer_link": "https://www.proshop.at/Bildschirm/HP-Bildschirm-E23-G4-FHD-USB-Hub/2912142?utm_source=geizhals&utm_medium=cpc&utm_campaign=pricesite",
    "price": 149.78,
    "raw_specifications": {
        "Abmessungen (Breite x Tiefe x H\u00f6he)": "52.16 cm x 20.7 cm x 48.98 cm - mit Fu\u00df",
        "Abmessungen (Breite x Tiefe x H\u00f6he) - mit Fu\u00df": "52.16 cm x 20.7 cm x 48.98 cm",
        "Besonderheiten": "Low Blue Light Mode, flimmerfreie Technologie, ohne Quecksilber, arsenfrei, extrem schmale Blende an drei Seiten, 6-bit + FRC Color Depth, kantenbeleuchtete LED-Hintergrundbeleuchtung, 72 % NTSC Farbraum",
        "Bildschirmbeschichtung": "Blendfrei, 3H Hard Coating",
        "Bildschirmtyp": "IPS",
        "Details zu Abmessungen & Gewicht": "Mit Fu\u00df - Breite: 52.16 cm - Tiefe: 20.7 cm - H\u00f6he: 48.98 cm - Gewicht: 5.4 kg  Ohne Fu\u00df - Breite: 52.16 cm - Tiefe: 4.7 cm - H\u00f6he: 31.31 cm - Gewicht: 3.12 kg",
        "Diagonalabmessung": "58.42 cm (23\")",
        "Display-Typ": "LED-hintergrundbeleuchteter LCD-Monitor / TFT-Aktivmatrix",
        "EAN": "0194850079580",
        "ENERGY STAR zertifiziert": "Ja",
        "ENERGY STAR-Version": "8.0",
        "Eingangsanschl\u00fcsse": "HDMI, VGA, DisplayPort",
        "Eingangsspannung": "Wechselstrom 120/230 V (50/60 Hz)",
        "Einstellungen der Anzeigeposition": "H\u00f6he, Pivot (Rotation), Drehung, Neigung",
        "Energie Effizienzklasse": "Klasse E",
        "Energieverbrauch pro Jahr": "24 kWh",
        "Enthaltene Kabel": "1 x DisplayPort 1.2-Kabel - 1.8 m  1 x Kabel USB-B auf USB-A - 1.8 m  1 x HDMI-Kabel - 1.8 m  1 x Stromkabel",
        "Farbe": "Schwarz, Silber",
        "Farbraum": "72% NTSC",
        "Farbtemperatur": "6500K",
        "Ger\u00e4tetyp": "LED-hintergrundbeleuchteter LCD-Monitor - 58.42 cm (23\")",
        "Gewicht": "5.4 kg",
        "Helligkeit": "250 cd/m\u00b2",
        "Hersteller": "HP",
        "Hintergrundbeleuchtungs-Technologie": "LED-Hintergrundbeleuchtung",
        "Horizontale Bildwiederholrate": "30 - 80 kHz",
        "Horizontaler Betrachtungswinkel": "178",
        "H\u00f6heneinstellung": "150 mm",
        "Integrierte Peripherieger\u00e4te": "USB 3.2 Gen 1 Hub",
        "Kennzeichnung": "Plug and Play, VCCI, BSMI, NOM, TUV S, WHQL, CB, CCC, PSB, FCC, ISO 9241-307, KCC, WEEE, cTUVus, MEPS, KC, CECP, CEL, EAC, CEL Grade 1, ISC, SEPA, BIS, halogenarm, DisplayPort 1.2, ICE, UAE, HDCP",
        "Kontrast": "1000:1 / 5000000:1 (dynamisch)",
        "Lebensdauer der Beleuchtung": "30,000 Stunden",
        "Leistungsaufnahme im Ein-Zustand": "16 W",
        "Leistungsmerkmale": "Slot f\u00fcr Sicherheitsschloss (Kabelschloss getrennt erh\u00e4ltlich), abnehmbarer St\u00e4nder, Unterst\u00fctzung f\u00fcr VESA-Schnittstelle",
        "Lokalisierung": "Englisch / Europa",
        "Mitgelieferte Software": "HP Display Center",
        "Modell": "9VF96AA#ABB",
        "Native Aufl\u00f6sung": "Full HD (1080p) 1920 x 1080 bei 60 Hz",
        "Neigungswinkel": "-5/+23",
        "OSD-Sprachen": "Chinesisch (tradionell), Chinesisch (vereinfacht), Englisch, Deutsch, Franz\u00f6sisch, Italienisch, Portugiesisch, Spanisch, Holl\u00e4ndisch, Japanisch",
        "Pixelpitch": "0.265 mm",
        "Ppi": "96",
        "Produktbeschreibung": "HP E23 G4 - E-Series - LED-Monitor - Full HD (1080p) - 58.42 cm (23\")",
        "Reaktionszeit": "5 ms (grau zu grau mit \u00dcbersteuerung)",
        "Rotationswinkel": "180",
        "Schlosstyp zur Diebstahlsicherung": "Kensington Slot",
        "Schnittstellen": "DisplayPort 1.2  HDMI  VGA  4 x USB 3.2 Gen 1 Downstream  USB 3.2 Gen 1 Upstream (Typ B)",
        "Schwenkwinkel": "90",
        "Seitenverh\u00e4ltnis": "16:9",
        "Spannung": "Wechselstrom 120/230 V (50/60 Hz)",
        "Stromverbrauch (typisch)": "26 Watt",
        "Stromverbrauch SDR (eingeschaltet)": "16 kWh/1.000 h",
        "Stromverbrauch im Standby-Modus": "0.5 Watt",
        "TCO-zertifiziert": "TCO Certified Displays 8, TCO Certified Edge Displays",
        "Transportbreite": "58.1 cm",
        "Transportgewicht": "8 kg",
        "Transporth\u00f6he": "37.2 cm",
        "Transporttiefe": "22.3 cm",
        "Umweltschutzstandards": "TCO Certified Displays 8, TCO Certified Edge Displays, ENERGY STAR-qualifiziert",
        "VESA-Halterung": "100 x 100 mm",
        "Vertikale Bildwiederholrate": "50 - 60 Hz",
        "Vertikaler Betrachtungswinkel": "178",
        "Waren-Nr.": "2912142",
        "Zum Hersteller": "www.hp.com"
    },
    "raw_specifications_text": "Hersteller: HP\nWaren-Nr.: 2912142\nModell: 9VF96AA#ABB\nEAN: 0194850079580\nZum Hersteller: www.hp.com\nProduktbeschreibung: HP E23 G4 - E-Series - LED-Monitor - Full HD (1080p) - 58.42 cm (23\")\nGer\u00e4tetyp: LED-hintergrundbeleuchteter LCD-Monitor - 58.42 cm (23\")\nEnergie Effizienzklasse: Klasse E\nEnergieverbrauch pro Jahr: 24 kWh\nLeistungsaufnahme im Ein-Zustand: 16 W\nLeistungsmerkmale: Slot f\u00fcr Sicherheitsschloss (Kabelschloss getrennt erh\u00e4ltlich), abnehmbarer St\u00e4nder, Unterst\u00fctzung f\u00fcr VESA-Schnittstelle\nBildschirmtyp: IPS\nSeitenverh\u00e4ltnis: 16:9\nNative Aufl\u00f6sung: Full HD (1080p) 1920 x 1080 bei 60 Hz\nPixelpitch: 0.265 mm\nHelligkeit: 250 cd/m\u00b2\nKontrast: 1000:1 / 5000000:1 (dynamisch)\nReaktionszeit: 5 ms (grau zu grau mit \u00dcbersteuerung)\nFarbraum: 72% NTSC\nEingangsanschl\u00fcsse: HDMI, VGA, DisplayPort\nEinstellungen der Anzeigeposition: H\u00f6he, Pivot (Rotation), Drehung, Neigung\nBildschirmbeschichtung: Blendfrei, 3H Hard Coating\nSpannung: Wechselstrom 120/230 V (50/60 Hz)\nFarbe: Schwarz, Silber\nAbmessungen (Breite x Tiefe x H\u00f6he) - mit Fu\u00df: 52.16 cm x 20.7 cm x 48.98 cm\nGewicht: 5.4 kg\nLokalisierung: Englisch / Europa\nUmweltschutzstandards: TCO Certified Displays 8, TCO Certified Edge Displays, ENERGY STAR-qualifiziert\nKennzeichnung: Plug and Play, VCCI, BSMI, NOM, TUV S, WHQL, CB, CCC, PSB, FCC, ISO 9241-307, KCC, WEEE, cTUVus, MEPS, KC, CECP, CEL, EAC, CEL Grade 1, ISC, SEPA, BIS, halogenarm, DisplayPort 1.2, ICE, UAE, HDCP\nDisplay-Typ: LED-hintergrundbeleuchteter LCD-Monitor / TFT-Aktivmatrix\nDiagonalabmessung: 58.42 cm (23\")\nIntegrierte Peripherieger\u00e4te: USB 3.2 Gen 1 Hub\nPpi: 96\nVertikale Bildwiederholrate: 50 - 60 Hz\nHorizontale Bildwiederholrate: 30 - 80 kHz\nHorizontaler Betrachtungswinkel: 178\nVertikaler Betrachtungswinkel: 178\nHintergrundbeleuchtungs-Technologie: LED-Hintergrundbeleuchtung\nFarbtemperatur: 6500K\nOSD-Sprachen: Chinesisch (tradionell), Chinesisch (vereinfacht), Englisch, Deutsch, Franz\u00f6sisch, Italienisch, Portugiesisch, Spanisch, Holl\u00e4ndisch, Japanisch\nBesonderheiten: Low Blue Light Mode, flimmerfreie Technologie, ohne Quecksilber, arsenfrei, extrem schmale Blende an drei Seiten, 6-bit + FRC Color Depth, kantenbeleuchtete LED-Hintergrundbeleuchtung, 72 % NTSC Farbraum\nAbmessungen (Breite x Tiefe x H\u00f6he): 52.16 cm x 20.7 cm x 48.98 cm - mit Fu\u00df\nSchnittstellen: DisplayPort 1.2  HDMI  VGA  4 x USB 3.2 Gen 1 Downstream  USB 3.2 Gen 1 Upstream (Typ B)\nNeigungswinkel: -5/+23\nSchwenkwinkel: 90\nRotationswinkel: 180\nH\u00f6heneinstellung: 150 mm\nVESA-Halterung: 100 x 100 mm\nEnthaltene Kabel: 1 x DisplayPort 1.2-Kabel - 1.8 m  1 x Kabel USB-B auf USB-A - 1.8 m  1 x HDMI-Kabel - 1.8 m  1 x Stromkabel\nLebensdauer der Beleuchtung: 30,000 Stunden\nSchlosstyp zur Diebstahlsicherung: Kensington Slot\nEingangsspannung: Wechselstrom 120/230 V (50/60 Hz)\nStromverbrauch SDR (eingeschaltet): 16 kWh/1.000 h\nStromverbrauch (typisch): 26 Watt\nStromverbrauch im Standby-Modus: 0.5 Watt\nMitgelieferte Software: HP Display Center\nDetails zu Abmessungen & Gewicht: Mit Fu\u00df - Breite: 52.16 cm - Tiefe: 20.7 cm - H\u00f6he: 48.98 cm - Gewicht: 5.4 kg  Ohne Fu\u00df - Breite: 52.16 cm - Tiefe: 4.7 cm - H\u00f6he: 31.31 cm - Gewicht: 3.12 kg\nTransportbreite: 58.1 cm\nTransporttiefe: 22.3 cm\nTransporth\u00f6he: 37.2 cm\nTransportgewicht: 8 kg\nTCO-zertifiziert: TCO Certified Displays 8, TCO Certified Edge Displays\nENERGY STAR zertifiziert: Ja\nENERGY STAR-Version: 8.0",
    "reference_file": "offer_reference_1649.json",
    "shop_name": "Proshop.at"
}