{
    "html_file": "offer_323_0.html",
    "name": "LG UltraWide 34WN780P-B, 34\"",
    "offer_link": "https://www.proshop.at/Bildschirm/LG-34-Bildschirm-UltraWide-34WN780P-B-LED-monitor-34-HDR-Black-5-ms-AMD-FreeSync/3166406?utm_source=geizhals&utm_medium=cpc&utm_campaign=pricesite",
    "price": 432.2,
    "raw_specifications": {
        "Abmessungen (Breite x Tiefe x H\u00f6he)": "81.65 cm x 40.64 cm x 48.24 cm",
        "Adaptive-Sync Technologie": "AMD FreeSync",
        "Ausgangsleistung/Kanal": "7 Watt",
        "Besonderheiten": "Reader Mode, MaxxAudio, Intelligente Energiespartechnologie, Black Stabilizer, Super Resolution+, HDR Effect",
        "Bildschirmtyp": "IPS",
        "Details zu Abmessungen & Gewicht": "Mit Standfu\u00df (niedrigste Position) - Breite: 81.65 cm - Tiefe: 40.64 cm - H\u00f6he: 48.24 cm - Gewicht: 10.8 kg  Mit Standfu\u00df (h\u00f6chste Position) - Breite: 81.65 cm - Tiefe: 40.64 cm - H\u00f6he: 61.24 cm - Gewicht: 10.8 kg  Ohne Fu\u00df - Breite: 81.65 cm - Tiefe: 4.55 cm - H\u00f6he: 36.53 cm - Gewicht: 6.9 kg",
        "Diagonalabmessung": "87 cm (34\")",
        "Display-Typ": "LED-hintergrundbeleuchteter LCD-Monitor / TFT-Aktivmatrix",
        "EAN": "8806091969248",
        "Eingangsanschl\u00fcsse": "2xHDMI, DisplayPort",
        "Eingangsspannung": "Wechselstrom 100-240 V (50/60 Hz)",
        "Einstellungen der Anzeigeposition": "H\u00f6he, Drehung, Neigung, ausfahren, einfahren",
        "Energie Effizienzklasse": "Klasse G",
        "Energieklasse (HDR)": "Klasse G",
        "Farbraum": "99% sRGB (CIE 1931)",
        "Ger\u00e4tetyp": "LED-hintergrundbeleuchteter LCD-Monitor - 87 cm (34\")",
        "Gewicht": "10.8 kg",
        "HDR-Format": "HDR10",
        "HDR-f\u00e4hig": "HDR10",
        "Helligkeit": "300 cd/m\u00b2",
        "Hersteller": "LG",
        "Hintergrundbeleuchtungs-Technologie": "LED-Hintergrundbeleuchtung",
        "Horizontaler Betrachtungswinkel": "178",
        "H\u00f6heneinstellung": "130 mm",
        "Integrierte Peripherieger\u00e4te": "USB 3.0-Hub",
        "Kontrast": "1000:1",
        "Leistungsmerkmale": "Slot f\u00fcr Sicherheitsschloss (Kabelschloss getrennt erh\u00e4ltlich), C-Klammer",
        "Mitgelieferte Software": "Dual Controller Software, LG On-Screen Control",
        "Modell": "34WN780P-B",
        "Native Aufl\u00f6sung": "UWQHD 3440 x 1440 bei 75 Hz",
        "Neigungswinkel": "-25/+25",
        "Produktbeschreibung": "LG UltraWide 34WN780P-B - LED-Monitor - 87 cm (34\") - HDR",
        "Reaktionszeit": "5 ms (Gray-to-Gray)",
        "Schlosstyp zur Diebstahlsicherung": "Kensington Slot",
        "Schnittstellen": "2 x HDMI  DisplayPort  USB 3.0 Upstream  2 x USB 3.0 Downstream  Kopfh\u00f6rer",
        "Schwenkwinkel": "560",
        "Seitenverh\u00e4ltnis": "21:9",
        "Spannung": "Wechselstrom 100-240 V (50/60 Hz)",
        "Stromverbrauch (Aus-Modus)": "0.3 Watt",
        "Stromverbrauch (max.)": "67 Watt",
        "Stromverbrauch (typisch)": "45 Watt",
        "Stromverbrauch HDR (eingeschaltet)": "49 kWh/1.000 h",
        "Stromverbrauch SDR (eingeschaltet)": "32 kWh/1.000 h",
        "Stromverbrauch im Standby-Modus": "0.5 Watt",
        "Typ": "Lautsprecher - Stereo",
        "VESA-Halterung": "100 x 100 mm",
        "Vertikaler Betrachtungswinkel": "178",
        "Waren-Nr.": "3166406",
        "Zum Hersteller": "www.lge.com"
    },
    "raw_specifications_text": "Hersteller: LG\nWaren-Nr.: 3166406\nModell: 34WN780P-B\nEAN: 8806091969248\nZum Hersteller: www.lge.com\nProduktbeschreibung: LG UltraWide 34WN780P-B - LED-Monitor - 87 cm (34\") - HDR\nGer\u00e4tetyp: LED-hintergrundbeleuchteter LCD-Monitor - 87 cm (34\")\nEnergie Effizienzklasse: Klasse G\nAdaptive-Sync Technologie: AMD FreeSync\nLeistungsmerkmale: Slot f\u00fcr Sicherheitsschloss (Kabelschloss getrennt erh\u00e4ltlich), C-Klammer\nBildschirmtyp: IPS\nSeitenverh\u00e4ltnis: 21:9\nNative Aufl\u00f6sung: UWQHD 3440 x 1440 bei 75 Hz\nHelligkeit: 300 cd/m\u00b2\nKontrast: 1000:1\nHDR-f\u00e4hig: HDR10\nReaktionszeit: 5 ms (Gray-to-Gray)\nFarbraum: 99% sRGB (CIE 1931)\nEingangsanschl\u00fcsse: 2xHDMI, DisplayPort\nEinstellungen der Anzeigeposition: H\u00f6he, Drehung, Neigung, ausfahren, einfahren\nSpannung: Wechselstrom 100-240 V (50/60 Hz)\nAbmessungen (Breite x Tiefe x H\u00f6he): 81.65 cm x 40.64 cm x 48.24 cm\nGewicht: 10.8 kg\nDisplay-Typ: LED-hintergrundbeleuchteter LCD-Monitor / TFT-Aktivmatrix\nEnergieklasse (HDR): Klasse G\nDiagonalabmessung: 87 cm (34\")\nIntegrierte Peripherieger\u00e4te: USB 3.0-Hub\nHDR-Format: HDR10\nHorizontaler Betrachtungswinkel: 178\nVertikaler Betrachtungswinkel: 178\nHintergrundbeleuchtungs-Technologie: LED-Hintergrundbeleuchtung\nBesonderheiten: Reader Mode, MaxxAudio, Intelligente Energiespartechnologie, Black Stabilizer, Super Resolution+, HDR Effect\nTyp: Lautsprecher - Stereo\nAusgangsleistung/Kanal: 7 Watt\nSchnittstellen: 2 x HDMI  DisplayPort  USB 3.0 Upstream  2 x USB 3.0 Downstream  Kopfh\u00f6rer\nNeigungswinkel: -25/+25\nSchwenkwinkel: 560\nH\u00f6heneinstellung: 130 mm\nVESA-Halterung: 100 x 100 mm\nSchlosstyp zur Diebstahlsicherung: Kensington Slot\nEingangsspannung: Wechselstrom 100-240 V (50/60 Hz)\nStromverbrauch SDR (eingeschaltet): 32 kWh/1.000 h\nStromverbrauch HDR (eingeschaltet): 49 kWh/1.000 h\nStromverbrauch (typisch): 45 Watt\nStromverbrauch (max.): 67 Watt\nStromverbrauch im Standby-Modus: 0.5 Watt\nStromverbrauch (Aus-Modus): 0.3 Watt\nMitgelieferte Software: Dual Controller Software, LG On-Screen Control\nDetails zu Abmessungen & Gewicht: Mit Standfu\u00df (niedrigste Position) - Breite: 81.65 cm - Tiefe: 40.64 cm - H\u00f6he: 48.24 cm - Gewicht: 10.8 kg  Mit Standfu\u00df (h\u00f6chste Position) - Breite: 81.65 cm - Tiefe: 40.64 cm - H\u00f6he: 61.24 cm - Gewicht: 10.8 kg  Ohne Fu\u00df - Breite: 81.65 cm - Tiefe: 4.55 cm - H\u00f6he: 36.53 cm - Gewicht: 6.9 kg",
    "reference_file": "offer_reference_323.json",
    "shop_name": "Proshop.at"
}