{
    "html_file": "offer_971_13.html",
    "name": "HP E24m G4, 23.8\"",
    "offer_link": "https://www.e-tec.at/details.php?artnr=346711",
    "price": 295.0,
    "raw_specifications": {
        "Anschl\u00fcsse - DisplayPort 1.2 75Hz@1920x1080": "1",
        "Anschl\u00fcsse - DisplayPort-Out 1.2 Daisy Chain": "1",
        "Anschl\u00fcsse - HDMI 1.4 75Hz@1920x1080": "1",
        "Anschl\u00fcsse - USB-C 3.0 mit DisplayPort 1.2 75Hz@1920x1080": "1",
        "Anwendung": "station\u00e4r",
        "Audio": "Lautsprecher (2x 5W),  1x Line-In/Out (Kombo)",
        "Aufl\u00f6sung": "1920x1080",
        "Beschichtung": "matt (non-glare),  H\u00e4rtegrad 3H",
        "Besonderheiten": "Slim Bezel,  EPEAT Gold,  USB-C Power Delivery (65W),  mechanische Tasten,  Mikrofon,  3D-Webcam (5.0 Megapixel,  neigbar,  versenkbar),  Sicherheitsschloss (Kensington)",
        "Bildwiederholfrequenz": "75Hz",
        "Blickwinkel": "178\u00b0/178\u00b0",
        "Diagonale": "23.8\"/60.5cm",
        "Energieverbrauch SDR": "19kWh/1000h",
        "Ergonomie": "150mm (h\u00f6henverstellbar),  \u00b190\u00b0 (Pivot),  \u00b145\u00b0 (drehbar),  +23\u00b0/-5\u00b0 (neigbar),  keine Angabe (Schr\u00e4glage)",
        "FRC": "ja (6bit+2bit)",
        "Farbe": "schwarz",
        "Farbraum - sRGB": "99%",
        "Farbtiefe": "8bit (16.7 Mio. Farben)",
        "Form": "gerade (flat)",
        "Gewicht": "7.39kg (mit Standfu\u00df),  4.76kg (ohne Standfu\u00df)",
        "HDR": "N/A",
        "Helligkeit": "300cd/m\u00b2",
        "Herstellergarantie": "drei Jahre",
        "Hintergrundbeleuchtung": "White-LED,  flicker-free,  Blaulichtfilter",
        "Kontrast - dynamisch": "10.000.000:1",
        "Kontrast - statisch": "1.000:1",
        "Lautsprecher": "Ja",
        "Leistungsaufnahme": "150W (maximal),  37W (typisch),  keine Angabe (Energielabel alt A+++ bis G),  0.5W (Standby)",
        "Panel": "IPS",
        "Reaktionszeit - GtG": "5ms",
        "Screen-to-Body-Ratio": "keine Angabe (berechnet)",
        "Seitenverh\u00e4ltnis": "16:9",
        "Signalfrequenz": "30-85kHz (horizontal),  50-75Hz (vertikal)",
        "Stromversorgung": "AC-In (internes Netzteil)",
        "USB-Hub In": "1x USB-C 3.0 mit DisplayPort 1.2",
        "USB-Hub Out": "4x USB-A 3.0",
        "USB-Schreibweise": "Link",
        "VESA": "100x100 (belegt)",
        "Weitere Anschl\u00fcsse": "1x Gb LAN (RJ-45)"
    },
    "raw_specifications_text": "Anschl\u00fcsse - DisplayPort 1.2 75Hz@1920x1080: 1\nAnschl\u00fcsse - DisplayPort-Out 1.2 Daisy Chain: 1\nAnschl\u00fcsse - HDMI 1.4 75Hz@1920x1080: 1\nAnschl\u00fcsse - USB-C 3.0 mit DisplayPort 1.2 75Hz@1920x1080: 1\nAnwendung: station\u00e4r\nAudio: Lautsprecher (2x 5W),  1x Line-In/Out (Kombo)\nAufl\u00f6sung: 1920x1080\nBeschichtung: matt (non-glare),  H\u00e4rtegrad 3H\nBesonderheiten: Slim Bezel,  EPEAT Gold,  USB-C Power Delivery (65W),  mechanische Tasten,  Mikrofon,  3D-Webcam (5.0 Megapixel,  neigbar,  versenkbar),  Sicherheitsschloss (Kensington)\nBildwiederholfrequenz: 75Hz\nBlickwinkel: 178\u00b0/178\u00b0\nDiagonale: 23.8\"/60.5cm\nEnergieverbrauch SDR: 19kWh/1000h\nErgonomie: 150mm (h\u00f6henverstellbar),  \u00b190\u00b0 (Pivot),  \u00b145\u00b0 (drehbar),  +23\u00b0/-5\u00b0 (neigbar),  keine Angabe (Schr\u00e4glage)\nFarbe: schwarz\nFarbraum - sRGB: 99%\nFarbtiefe: 8bit (16.7 Mio. Farben)\nForm: gerade (flat)\nFRC: ja (6bit+2bit)\nGewicht: 7.39kg (mit Standfu\u00df),  4.76kg (ohne Standfu\u00df)\nHDR: N/A\nHelligkeit: 300cd/m\u00b2\nHerstellergarantie: drei Jahre\nHintergrundbeleuchtung: White-LED,  flicker-free,  Blaulichtfilter\nKontrast - dynamisch: 10.000.000:1\nKontrast - statisch: 1.000:1\nLautsprecher: Ja\nLeistungsaufnahme: 150W (maximal),  37W (typisch),  keine Angabe (Energielabel alt A+++ bis G),  0.5W (Standby)\nPanel: IPS\nReaktionszeit - GtG: 5ms\nScreen-to-Body-Ratio: keine Angabe (berechnet)\nSeitenverh\u00e4ltnis: 16:9\nSignalfrequenz: 30-85kHz (horizontal),  50-75Hz (vertikal)\nStromversorgung: AC-In (internes Netzteil)\nUSB-Hub In: 1x USB-C 3.0 mit DisplayPort 1.2\nUSB-Hub Out: 4x USB-A 3.0\nUSB-Schreibweise: Link\nVESA: 100x100 (belegt)\nWeitere Anschl\u00fcsse: 1x Gb LAN (RJ-45)",
    "reference_file": "offer_reference_971.json",
    "shop_name": "e-tec.at"
}