{
    "html_file": "offer_1802_17.html",
    "name": "Philips E-line 275E2FAE, 27\"",
    "offer_link": "https://www.electronicshop24.at/product_info.php?products_id=20000001278859912&ano=I1278859912&mno=275E2FAE%2F00&ean=8712581767648&utm_medium=cpc&utm_campaign=preisvergleich&utm_content=item&utm_source=geizhals&ref=geizhals",
    "price": 253.0,
    "raw_specifications": {
        "Abmessungen (Breite x Tiefe x H\u00f6he)": "61.4 cm x 23.4 cm x 47.5 cm - mit Fu\u00df",
        "Ausgangsleistung/Kanal": "3 Watt",
        "Besonderheiten": "SmartContrast, Spielmodus, Smart Frame, integrierte Kabelf\u00fchrung, SmartImage Game, Mega Infinity Dynamic Contrast Ratio, Low Blue Light Mode, flimmerfreie Technologie, RTS Mode, Adaptive-Sync-Technologie, EasySelect Menu Toggle Key, EasyRead, sRGB Mode, Rennmodus, schmale Blende an 4 Seiten",
        "Bildschirmbeschichtung": "Blendfrei, 3H Hard Coating, Haze 25 %",
        "Bildschirmtyp": "IPS",
        "Details zu Abmessungen & Gewicht": "Mit Fu\u00df - Breite: 61.4 cm - Tiefe: 23.4 cm - H\u00f6he: 47.5 cm - Gewicht: 5.23 kg \u00a6 Ohne Fu\u00df - Breite: 61.4 cm - Tiefe: 3.8 cm - H\u00f6he: 35.4 cm - Gewicht: 3.43 kg",
        "Diagonalabmessung": "68.6 cm (27\")",
        "Display-Typ": "LED-hintergrundbeleuchteter LCD-Monitor / TFT-Aktivmatrix",
        "ENERGY STAR zertifiziert": "Ja",
        "ENERGY STAR-Version": "8.0",
        "Eingangsspannung": "Wechselstrom 120/230 V (50/60 Hz)",
        "Einstellungen der Anzeigeposition": "H\u00f6he, Neigung",
        "Energie Effizienzklasse": "Klasse F",
        "Energieverbrauch pro Jahr": "56 kWh",
        "Enthaltene Kabel": "1 x HDMI-Kabel",
        "Farbe": "Textured Black",
        "Farbraum": "101.6% NTSC (CIE 1976), 115.6% sRGB (CIE 1931)",
        "Farbunterst\u00fctzung": "16,7 Millionen Farben",
        "Gewicht": "5.23 kg",
        "Helligkeit": "350 cd/m\u00b2",
        "Hintergrundbeleuchtungs-Technologie": "WLED",
        "Horizontale Bildwiederholrate": "30 - 144 kHz",
        "Horizontaler Betrachtungswinkel": "178",
        "H\u00f6heneinstellung": "100 mm",
        "Kennzeichnung": "Plug and Play, FCC Klasse B bescheinigt, TUV, ICES-003, CB, DDC/CI, RoHS, Bleifrei, ISO 9241-307, TUV Bauart, EPA, CU-EAC, quecksilberfrei, EAEU RoHS",
        "Kontrast": "1000:1",
        "Leistungsaufnahme im Ein-Zustand": "26.1 W",
        "Leistungsmerkmale": "Slot f\u00fcr Sicherheitsschloss (Kabelschloss getrennt erh\u00e4ltlich)",
        "MTBF": "50,000 Stunde(n)",
        "Max. Betriebstemperatur": "40 \u00b0C",
        "Min Betriebstemperatur": "0 \u00b0C",
        "Native Aufl\u00f6sung": "QHD 2560 x 1440 bei 75 Hz",
        "Neigungswinkel": "-5/+20",
        "OSD-Sprachen": "Multilingual",
        "Pixelpitch": "0.2331 mm",
        "Ppi": "109",
        "Reaktionszeit": "4 ms (gray-to-gray), 1 ms (MPRT)",
        "Schlosstyp zur Diebstahlsicherung": "Kensington Slot",
        "Schnittstellen": "2 x HDMI \u00a6 DisplayPort \u00a6 Audio Line-Out",
        "Seitenverh\u00e4ltnis": "16:9",
        "Service und Support": "Begrenzte Garantie - 2 Jahre",
        "Stromverbrauch (Aus-Modus)": "0.3 Watt",
        "Stromverbrauch (typisch)": "18.55 Watt",
        "Stromverbrauch SDR (eingeschaltet)": "26 kWh/1.000 h",
        "Stromverbrauch im Standby-Modus": "0.5 Watt",
        "TCO-zertifiziert": "TCO Certified Displays 8",
        "Transportbreite": "67.8 cm",
        "Transportgewicht": "7.59 kg",
        "Transporth\u00f6he": "50.4 cm",
        "Transporttiefe": "15.3 cm",
        "Typ": "Lautsprecher - Stereo",
        "VESA-Halterung": "100 x 100 mm",
        "Vertikale Bildwiederholrate": "48 - 75 Hz",
        "Vertikaler Betrachtungswinkel": "178",
        "Zul\u00e4ssige Luftfeuchtigkeit im Betrieb": "20 - 80%"
    },
    "raw_specifications_text": "Display-Typ: LED-hintergrundbeleuchteter LCD-Monitor / TFT-Aktivmatrix\nEnergie Effizienzklasse: Klasse F\nEnergieverbrauch pro Jahr: 56 kWh\nDiagonalabmessung: 68.6 cm (27\")\nBildschirmtyp: IPS\nSeitenverh\u00e4ltnis: 16:9\nNative Aufl\u00f6sung: QHD 2560 x 1440 bei 75 Hz\nPixelpitch: 0.2331 mm\nPpi: 109\nHelligkeit: 350 cd/m\u00b2\nKontrast: 1000:1\nFarbunterst\u00fctzung: 16,7 Millionen Farben\nFarbraum: 101.6% NTSC (CIE 1976), 115.6% sRGB (CIE 1931)\nReaktionszeit: 4 ms (gray-to-gray), 1 ms (MPRT)\nVertikale Bildwiederholrate: 48 - 75 Hz\nHorizontale Bildwiederholrate: 30 - 144 kHz\nHorizontaler Betrachtungswinkel: 178\nVertikaler Betrachtungswinkel: 178\nBildschirmbeschichtung: Blendfrei, 3H Hard Coating, Haze 25 %\nHintergrundbeleuchtungs-Technologie: WLED\nOSD-Sprachen: Multilingual\nBesonderheiten: SmartContrast, Spielmodus, Smart Frame, integrierte Kabelf\u00fchrung, SmartImage Game, Mega Infinity Dynamic Contrast Ratio, Low Blue Light Mode, flimmerfreie Technologie, RTS Mode, Adaptive-Sync-Technologie, EasySelect Menu Toggle Key, EasyRead, sRGB Mode, Rennmodus, schmale Blende an 4 Seiten\nFarbe: Textured Black\nAbmessungen (Breite x Tiefe x H\u00f6he): 61.4 cm x 23.4 cm x 47.5 cm - mit Fu\u00df\nGewicht: 5.23 kg\nTyp: Lautsprecher - Stereo\nAusgangsleistung/Kanal: 3 Watt\nSchnittstellen: 2 x HDMI \u00a6 DisplayPort \u00a6 Audio Line-Out\nEinstellungen der Anzeigeposition: H\u00f6he, Neigung\nNeigungswinkel: -5/+20\nH\u00f6heneinstellung: 100 mm\nVESA-Halterung: 100 x 100 mm\nLeistungsmerkmale: Slot f\u00fcr Sicherheitsschloss (Kabelschloss getrennt erh\u00e4ltlich)\nEnthaltene Kabel: 1 x HDMI-Kabel\nMTBF: 50,000 Stunde(n)\nKennzeichnung: Plug and Play, FCC Klasse B bescheinigt, TUV, ICES-003, CB, DDC/CI, RoHS, Bleifrei, ISO 9241-307, TUV Bauart, EPA, CU-EAC, quecksilberfrei, EAEU RoHS\nSchlosstyp zur Diebstahlsicherung: Kensington Slot\nEingangsspannung: Wechselstrom 120/230 V (50/60 Hz)\nLeistungsaufnahme im Ein-Zustand: 26.1 W\nStromverbrauch SDR (eingeschaltet): 26 kWh/1.000 h\nStromverbrauch (typisch): 18.55 Watt\nStromverbrauch im Standby-Modus: 0.5 Watt\nStromverbrauch (Aus-Modus): 0.3 Watt\nDetails zu Abmessungen & Gewicht: Mit Fu\u00df - Breite: 61.4 cm - Tiefe: 23.4 cm - H\u00f6he: 47.5 cm - Gewicht: 5.23 kg \u00a6 Ohne Fu\u00df - Breite: 61.4 cm - Tiefe: 3.8 cm - H\u00f6he: 35.4 cm - Gewicht: 3.43 kg\nTransportbreite: 67.8 cm\nTransporttiefe: 15.3 cm\nTransporth\u00f6he: 50.4 cm\nTransportgewicht: 7.59 kg\nTCO-zertifiziert: TCO Certified Displays 8\nENERGY STAR zertifiziert: Ja\nENERGY STAR-Version: 8.0\nService und Support: Begrenzte Garantie - 2 Jahre\nMin Betriebstemperatur: 0 \u00b0C\nMax. Betriebstemperatur: 40 \u00b0C\nZul\u00e4ssige Luftfeuchtigkeit im Betrieb: 20 - 80%",
    "reference_file": "offer_reference_1802.json",
    "shop_name": "ElectronicShop24"
}