{
    "html_file": "offer_2084_47.html",
    "name": "Eizo ColorEdge CS2740, 27\"",
    "offer_link": "https://ms-it-beratung.at/shop/details.php?art=333346&artname=EIZO+68.0cm+%2827%22%29+++CS2740+++HDMI%2BDP%2BUSB-C+IPS+Lift+4K",
    "price": 1630.0,
    "raw_specifications": {
        "AC Eingangsfrequenz": "50 - 60 Hz",
        "AC Eingangsspannung": "100 - 240 V",
        "Anzahl DisplayPort Anschl\u00fcsse": "1",
        "Anzahl OSD-Sprachen": "8",
        "Anzahl der Farben des Displays": "1,073 Milliarden Farben",
        "Anzahl der nachgeschalteten Steckpl\u00e4tze vom Typ USB-A": "4",
        "Anzahl der vorgeschalteten Steckpl\u00e4tze": "2",
        "Bildschirmdiagonale": "68,6 cm (27\")",
        "Bildschirmform": "Flach",
        "Bildschirmtechnologie": "LED",
        "Bildwinkel, horizontal": "178\u00b0",
        "Bildwinkel, vertikal": "178\u00b0",
        "Breite (ohne Standfu\u00df)": "638 mm",
        "DVI Anschluss": "Nein",
        "Digital horizontale Frequenz": "15 - 135 kHz",
        "Digital vertikale Frequenz": "23 - 61 Hz",
        "Display-Aufl\u00f6sung": "3840 x 2160 Pixel",
        "DisplayPorts-Version": "1.3",
        "Energieeffizienzklasse (SDR)": "G",
        "Energieeffizienzskala": "A bis G",
        "Energieverbrauch (SDR) pro 1.000 Stunden": "38 kWh",
        "Flimmerfreie Technologie": "Ja",
        "Ger\u00e4tebreite (inkl. Fu\u00df)": "638 mm",
        "Ger\u00e4teh\u00f6he (inkl. Fu\u00df)": "559 mm",
        "Ger\u00e4tetiefe (inkl. Fu\u00df)": "265 mm",
        "Gewicht (mit St\u00e4nder)": "10,3 kg",
        "Gewicht (ohne St\u00e4nder)": "6,7 kg",
        "HD-Typ": "4K Ultra HD",
        "HDCP": "Ja",
        "HDMI": "Ja",
        "HDMI-Version": "1.4",
        "Helligkeit (typisch)": "350 cd/m\u00b2",
        "H\u00f6he (ohne Standfu\u00df)": "378,2 mm",
        "H\u00f6heneinstellung": "15,5 cm",
        "H\u00f6henverstellung": "Ja",
        "Integrierter USB-Hub": "Ja",
        "Kontrastverh\u00e4ltnis": "1000:1",
        "Marktpositionierung": "Grafikdesign",
        "Maximale Bildwiederholrate": "60 Hz",
        "Men\u00fcsprachen": "Deutsch, Englisch, Spanisch, Franz\u00f6sisch, Italienisch, Japanisch",
        "Mitgelieferte Kabel": "AC, DisplayPort, USB Typ-C",
        "Nachhaltigkeitszertifikate": "RoHS",
        "Natives Seitenverh\u00e4ltnis": "16:9",
        "Neigungsverstellung": "Ja",
        "Neigungswinkelbereich": "-5 - 35\u00b0",
        "On-Screen-Display (OSD)": "Ja",
        "Panel-Montage-Schnittstelle": "100 x 100 mm",
        "Panel-Typ": "IPS",
        "Pivot": "Ja",
        "Pivot Winkel": "0 - 90\u00b0",
        "Pixel Abstand": "0,155 x 0,155 mm",
        "Pixeldichte": "164 ppi",
        "Produktfarbe": "Schwarz",
        "Reaktionszeit": "10 ms",
        "Schwenkbar": "Ja",
        "Schwenkwinkelbereich": "0 - 344\u00b0",
        "Sichtbare Gr\u00f6\u00dfe (horizontal)": "59,6 cm",
        "Sichtbare Gr\u00f6\u00dfe (vertikal)": "33,5 cm",
        "Stromverbrauch (Standardbetrieb)": "37,8 W",
        "Stromverbrauch (Standby)": "0,5 W",
        "Stromverbrauch (max.)": "168 W",
        "Tiefe (ohne Standfu\u00df)": "75 mm",
        "Touchscreen": "Nein",
        "Typ der Hintergrundbeleuchtung": "LED",
        "USB-Hub-Version": "2.0 / 3.2 Gen 1 (3.1 Gen 1)",
        "USB-Stromversorgung bis zu": "60 W",
        "USB-Typ-C DisplayPort-Wechselmodus": "Ja",
        "Unterst\u00fctzte Grafik-Aufl\u00f6sungen": "640 x 480 (VGA), 720 x 400, 800 x 600 (SVGA), 1024 x 768 (XGA), 1280 x 1024 (SXGA), 1600 x 1200 (UXGA), 1680 x 1050 (WSXGA+), 1920 x 1200 (WUXGA), 2560 x 1440, 2560 x 1600 (WQXGA), 3840 x 2160",
        "Unterst\u00fctzte Video-Modi": "480i, 576p, 720p, 1080i, 1080p",
        "VESA-Halterung": "Ja",
        "Verpackungsart": "Box",
        "Warentarifnummer (HS)": "85285210",
        "Zertifizierung": "CE, CB, T\u00dcV / GS, T\u00dcV ergonomics tested (including ISO 9241-307), cT\u00dcVus, T\u00dcV / S, EAC, PSE, FCC-B, CAN ICES-3 (B), RCM, VCCI-B, CCC, China RoHS, WEEE"
    },
    "raw_specifications_text": "Bildschirmdiagonale: 68,6 cm (27\")\nDisplay-Aufl\u00f6sung: 3840 x 2160 Pixel\nNatives Seitenverh\u00e4ltnis: 16:9\nBildschirmtechnologie: LED\nTouchscreen: Nein\nHD-Typ: 4K Ultra HD\nPanel-Typ: IPS\nTyp der Hintergrundbeleuchtung: LED\nHelligkeit (typisch): 350 cd/m\u00b2\nReaktionszeit: 10 ms\nBildschirmform: Flach\nUnterst\u00fctzte Grafik-Aufl\u00f6sungen: 640 x 480 (VGA), 720 x 400, 800 x 600 (SVGA), 1024 x 768 (XGA), 1280 x 1024 (SXGA), 1600 x 1200 (UXGA), 1680 x 1050 (WSXGA+), 1920 x 1200 (WUXGA), 2560 x 1440, 2560 x 1600 (WQXGA), 3840 x 2160\nUnterst\u00fctzte Video-Modi: 480i, 576p, 720p, 1080i, 1080p\nKontrastverh\u00e4ltnis: 1000:1\nMaximale Bildwiederholrate: 60 Hz\nBildwinkel, horizontal: 178\u00b0\nBildwinkel, vertikal: 178\u00b0\nAnzahl der Farben des Displays: 1,073 Milliarden Farben\nPixel Abstand: 0,155 x 0,155 mm\nPixeldichte: 164 ppi\nSichtbare Gr\u00f6\u00dfe (horizontal): 59,6 cm\nSichtbare Gr\u00f6\u00dfe (vertikal): 33,5 cm\nDigital horizontale Frequenz: 15 - 135 kHz\nDigital vertikale Frequenz: 23 - 61 Hz\nFlimmerfreie Technologie: Ja\nMarktpositionierung: Grafikdesign\nProduktfarbe: Schwarz\nZertifizierung: CE, CB, T\u00dcV / GS, T\u00dcV ergonomics tested (including ISO 9241-307), cT\u00dcVus, T\u00dcV / S, EAC, PSE, FCC-B, CAN ICES-3 (B), RCM, VCCI-B, CCC, China RoHS, WEEE\nIntegrierter USB-Hub: Ja\nUSB-Hub-Version: 2.0 / 3.2 Gen 1 (3.1 Gen 1)\nAnzahl der vorgeschalteten Steckpl\u00e4tze: 2\nAnzahl der nachgeschalteten Steckpl\u00e4tze vom Typ USB-A: 4\nUSB-Typ-C DisplayPort-Wechselmodus: Ja\nUSB-Stromversorgung bis zu: 60 W\nDVI Anschluss: Nein\nHDMI: Ja\nHDMI-Version: 1.4\nAnzahl DisplayPort Anschl\u00fcsse: 1\nDisplayPorts-Version: 1.3\nHDCP: Ja\nVESA-Halterung: Ja\nPanel-Montage-Schnittstelle: 100 x 100 mm\nH\u00f6henverstellung: Ja\nH\u00f6heneinstellung: 15,5 cm\nPivot: Ja\nPivot Winkel: 0 - 90\u00b0\nSchwenkbar: Ja\nSchwenkwinkelbereich: 0 - 344\u00b0\nNeigungswinkelbereich: -5 - 35\u00b0\nOn-Screen-Display (OSD): Ja\nMen\u00fcsprachen: Deutsch, Englisch, Spanisch, Franz\u00f6sisch, Italienisch, Japanisch\nAnzahl OSD-Sprachen: 8\nNeigungsverstellung: Ja\nEnergieeffizienzklasse (SDR): G\nEnergieverbrauch (SDR) pro 1.000 Stunden: 38 kWh\nStromverbrauch (Standardbetrieb): 37,8 W\nStromverbrauch (Standby): 0,5 W\nStromverbrauch (max.): 168 W\nAC Eingangsspannung: 100 - 240 V\nAC Eingangsfrequenz: 50 - 60 Hz\nEnergieeffizienzskala: A bis G\nMitgelieferte Kabel: AC, DisplayPort, USB Typ-C\nGer\u00e4tebreite (inkl. Fu\u00df): 638 mm\nGer\u00e4tetiefe (inkl. Fu\u00df): 265 mm\nGer\u00e4teh\u00f6he (inkl. Fu\u00df): 559 mm\nGewicht (mit St\u00e4nder): 10,3 kg\nBreite (ohne Standfu\u00df): 638 mm\nTiefe (ohne Standfu\u00df): 75 mm\nH\u00f6he (ohne Standfu\u00df): 378,2 mm\nGewicht (ohne St\u00e4nder): 6,7 kg\nVerpackungsart: Box\nNachhaltigkeitszertifikate: RoHS\nWarentarifnummer (HS): 85285210",
    "reference_file": "offer_reference_2084.json",
    "shop_name": "ms-it-beratung"
}