{
    "html_file": "offer_2044_15.html",
    "name": "ASUS TUF Gaming VG289Q, 28\"",
    "offer_link": "https://www.csv-direct.de/artinfo.php?artnr=A1620841&KATEGORIE=162&pva=geizhals2",
    "price": 376.88,
    "raw_specifications": {
        "3D": "Nein",
        "AMD FreeSync-Typ": "FreeSync",
        "Anzahl DisplayPort Anschl\u00fcsse": "1",
        "Anzahl HDMI-Anschl\u00fcsse": "2",
        "Anzahl der Farben des Displays": "1,073 Milliarden Farben",
        "Anzahl der Lautsprecher": "2",
        "Audioanschl\u00fcsse": "Nein",
        "Bildschirmdiagonale": "71,1 cm 28\"",
        "Bildschirmform": "Flach",
        "Bildschirmtechnologie": "LED",
        "Bildwinkel, horizontal": "178\u00b0",
        "Bildwinkel, vertikal": "178\u00b0",
        "Breite ohne Standfu\u00df": "639,5 mm",
        "DVI Anschluss": "Nein",
        "Digital horizontale Frequenz": "24 - 120 kHz",
        "Digital vertikale Frequenz": "40 - 60 Hz",
        "Display-Aufl\u00f6sung": "3840 x 2160 Pixel",
        "DisplayPorts-Version": "1.2",
        "Energieeffizienzklasse HDR": "G",
        "Energieeffizienzklasse SDR": "G",
        "Energieeffizienzskala": "A bis G",
        "Energieverbrauch HDR pro 1.000 Stunden": "44 kWh",
        "Energieverbrauch SDR pro 1.000 Stunden": "34 kWh",
        "Farbpalette DCI-P3": "90",
        "Ger\u00e4tebreite inkl. Fu\u00df": "639,5 mm",
        "Ger\u00e4teh\u00f6he inkl. Fu\u00df": "555,2 mm",
        "Ger\u00e4tetiefe inkl. Fu\u00df": "233,4 mm",
        "Gewicht mit St\u00e4nder": "7,6 kg",
        "Gewicht ohne St\u00e4nder": "6,1 kg",
        "HD-Typ": "4K Ultra HD",
        "HDMI-Version": "2.0",
        "Helligkeit typisch": "350 cd/m\u00b2",
        "H\u00f6he ohne Standfu\u00df": "369,4 mm",
        "H\u00f6heneinstellung": "15 cm",
        "Integrierte Kamera": "Nein",
        "Integrierter USB-Hub": "Nein",
        "Kontrastverh\u00e4ltnis": "1000:1",
        "Marktpositionierung": "Gaming",
        "Maximale Bildwiederholrate": "60 Hz",
        "NVIDIA G-SYNC": "Nein",
        "Nachhaltigkeitszertifikate": "RoHS, ENERGY STAR",
        "Natives Seitenverh\u00e4ltnis": "16:9",
        "Neigungswinkelbereich": "-5 - 20\u00b0",
        "Paketgewicht": "9,6 kg",
        "Panel-Montage-Schnittstelle": "100 x 100 mm",
        "Panel-Typ": "IPS",
        "Pivot Winkel": "-90 - 90\u00b0",
        "Pixel Abstand": "0,16 x 0,16 mm",
        "Produktfarbe": "Schwarz",
        "RMS-Leistung": "4 W",
        "Reaktionszeit": "5 ms",
        "Schwenkwinkelbereich": "-62 - 62\u00b0",
        "Sichtbare Gr\u00f6\u00dfe horizontal": "63,2 cm",
        "Sichtbare Gr\u00f6\u00dfe vertikal": "36 cm",
        "Slot-Typ Kabelsperre": "Kensington",
        "Stromverbrauch Standardbetrieb": "33,9 W",
        "Stromverbrauch Standby": "0,3 W",
        "Stromverbrauch aus": "0,2 W",
        "TV Tuner integriert": "Nein",
        "Technologie mit hohem Dynamikbereich HDR": "High Dynamic Range 10 HDR10",
        "Tiefe ohne Standfu\u00df": "54 mm",
        "Touchscreen": "Nein",
        "Verpackungsbreite": "758 mm",
        "Verpackungsh\u00f6he": "451 mm",
        "Verpackungstiefe": "206 mm",
        "Warentarifnummer HS": "85285210",
        "Zertifizierung": "EAC logo, BSMI, CB, CCC, CE, CEL level 1, FCC, PSB, PSE, TCO7.0, UL/cUL, VCCI, WEEE, WHQL Windows 10, Windows 8, Windows 7, RCM, TUV Flicker-free , TUV Low Blue Light"
    },
    "raw_specifications_text": "Bildschirmdiagonale: 71,1 cm 28\"\nDisplay-Aufl\u00f6sung: 3840 x 2160 Pixel\nNatives Seitenverh\u00e4ltnis: 16:9\nBildschirmtechnologie: LED\nTouchscreen: Nein\nHD-Typ: 4K Ultra HD\nPanel-Typ: IPS\nBildschirmform: Flach\nKontrastverh\u00e4ltnis: 1000:1\nMaximale Bildwiederholrate: 60 Hz\nAnzahl der Farben des Displays: 1,073 Milliarden Farben\nHelligkeit typisch: 350 cd/m\u00b2\nReaktionszeit: 5 ms\nBildwinkel, horizontal: 178\u00b0\nBildwinkel, vertikal: 178\u00b0\nPixel Abstand: 0,16 x 0,16 mm\nSichtbare Gr\u00f6\u00dfe horizontal: 63,2 cm\nSichtbare Gr\u00f6\u00dfe vertikal: 36 cm\nDigital horizontale Frequenz: 24 - 120 kHz\nDigital vertikale Frequenz: 40 - 60 Hz\nTechnologie mit hohem Dynamikbereich HDR: High Dynamic Range 10 HDR10\n3D: Nein\nNVIDIA G-SYNC: Nein\nAMD FreeSync-Typ: FreeSync\nIntegrierte Kamera: Nein\nAnzahl der Lautsprecher: 2\nRMS-Leistung: 4 W\nMarktpositionierung: Gaming\nProduktfarbe: Schwarz\nZertifizierung: EAC logo, BSMI, CB, CCC, CE, CEL level 1, FCC, PSB, PSE, TCO7.0, UL/cUL, VCCI, WEEE, WHQL Windows 10, Windows 8, Windows 7, RCM, TUV Flicker-free , TUV Low Blue Light\nIntegrierter USB-Hub: Nein\nDVI Anschluss: Nein\nAnzahl HDMI-Anschl\u00fcsse: 2\nHDMI-Version: 2.0\nAnzahl DisplayPort Anschl\u00fcsse: 1\nDisplayPorts-Version: 1.2\nAudioanschl\u00fcsse: Nein\nPanel-Montage-Schnittstelle: 100 x 100 mm\nSlot-Typ Kabelsperre: Kensington\nH\u00f6heneinstellung: 15 cm\nPivot Winkel: -90 - 90\u00b0\nSchwenkwinkelbereich: -62 - 62\u00b0\nNeigungswinkelbereich: -5 - 20\u00b0\nEnergieeffizienzklasse SDR: G\nEnergieeffizienzklasse HDR: G\nEnergieverbrauch SDR pro 1.000 Stunden: 34 kWh\nEnergieverbrauch HDR pro 1.000 Stunden: 44 kWh\nStromverbrauch Standardbetrieb: 33,9 W\nStromverbrauch Standby: 0,3 W\nStromverbrauch aus: 0,2 W\nEnergieeffizienzskala: A bis G\nGer\u00e4tebreite inkl. Fu\u00df: 639,5 mm\nGer\u00e4tetiefe inkl. Fu\u00df: 233,4 mm\nGer\u00e4teh\u00f6he inkl. Fu\u00df: 555,2 mm\nGewicht mit St\u00e4nder: 7,6 kg\nBreite ohne Standfu\u00df: 639,5 mm\nTiefe ohne Standfu\u00df: 54 mm\nH\u00f6he ohne Standfu\u00df: 369,4 mm\nGewicht ohne St\u00e4nder: 6,1 kg\nVerpackungsbreite: 758 mm\nVerpackungstiefe: 206 mm\nVerpackungsh\u00f6he: 451 mm\nPaketgewicht: 9,6 kg\nNachhaltigkeitszertifikate: RoHS, ENERGY STAR\nWarentarifnummer HS: 85285210\nFarbpalette DCI-P3: 90\nTV Tuner integriert: Nein",
    "reference_file": "offer_reference_2044.json",
    "shop_name": "CSV-Direct.de"
}