{
    "html_file": "offer_2526_0.html",
    "name": "Philips V-line 223V5LHSB, 21.5\"",
    "offer_link": "https://www.amazon.de/dp/B00DJ3GAIG?linkCode=xm2&camp=2025&creative=165953&smid=AMUN6OW4OKOC5&creativeASIN=B00DJ3GAIG&tag=geizhals1-21",
    "price": 160.7,
    "raw_specifications": {
        "ASIN": "B00DJ3GAIG",
        "Amazon Bestseller-Rang": "Nr. 134,799 in Computer & Zubeh\u00f6r (Siehe Top 100 in Computer & Zubeh\u00f6r)  Nr. 2,340 in Monitore",
        "Anzahl HDMI Schnittstellen": "\u200e2",
        "Artikelgewicht": "\u200e2,6 g",
        "Auslaufartikel (Produktion durch Hersteller eingestellt)": "\u200eNein",
        "Batterien enthalten": "\u200eNein",
        "Bildschirmaufl\u00f6sung": "\u200e1920\u00a0x\u00a01080",
        "Display-Gr\u00f6\u00dfe": "\u200e21,5 Zoll",
        "Durchschnittliche Kundenbewertung": "4,3  4,3 von 5 Sternen    \n    3.047 Sternebewertungen   \n\n\n 4,3 von 5 Sternen",
        "Farbe": "\u200eschwarz",
        "Garantierte Software-Updates bis": "\u200eunbekannt",
        "Gewicht Lithium-Akku": "\u200e5 Gramm",
        "Hersteller": "\u200ePhilips",
        "Im Angebot von Amazon.de seit": "17. September 2013",
        "L\u00f6sung": "\u200e1920\u00a0x\u00a01080",
        "Marke": "\u200ePhilips Monitors",
        "Modell/Serie": "\u200eLCD-Monitor mit SmartControl Lite 223V5LHSB/00",
        "Modellnummer": "\u200e223V5LHSB/00",
        "Produktabmessungen": "\u200e15 x 30 x 25 cm; 2,6 Gramm",
        "Prozessorkerne": "\u200e1",
        "Speicher-Art": "\u200eDDR3 SDRAM",
        "Volt": "\u200e220 Volt",
        "Watt": "\u200e15.85 Watt"
    },
    "raw_specifications_text": "Marke: \u200ePhilips Monitors\nHersteller: \u200ePhilips\nModell/Serie: \u200eLCD-Monitor mit SmartControl Lite 223V5LHSB/00\nProduktabmessungen: \u200e15 x 30 x 25 cm; 2,6 Gramm\nModellnummer: \u200e223V5LHSB/00\nAuslaufartikel (Produktion durch Hersteller eingestellt): \u200eNein\nFarbe: \u200eschwarz\nDisplay-Gr\u00f6\u00dfe: \u200e21,5 Zoll\nBildschirmaufl\u00f6sung: \u200e1920\u00a0x\u00a01080\nL\u00f6sung: \u200e1920\u00a0x\u00a01080\nProzessorkerne: \u200e1\nSpeicher-Art: \u200eDDR3 SDRAM\nAnzahl HDMI Schnittstellen: \u200e2\nVolt: \u200e220 Volt\nWatt: \u200e15.85 Watt\nBatterien enthalten: \u200eNein\nGewicht Lithium-Akku: \u200e5 Gramm\nArtikelgewicht: \u200e2,6 g\nGarantierte Software-Updates bis: \u200eunbekannt\nASIN: B00DJ3GAIG\nDurchschnittliche Kundenbewertung: 4,3  4,3 von 5 Sternen    \n    3.047 Sternebewertungen   \n\n\n 4,3 von 5 Sternen\nAmazon Bestseller-Rang: Nr. 134,799 in Computer & Zubeh\u00f6r (Siehe Top 100 in Computer & Zubeh\u00f6r)  Nr. 2,340 in Monitore\nIm Angebot von Amazon.de seit: 17. September 2013",
    "reference_file": "offer_reference_2526.json",
    "shop_name": "Amazon.at"
}