{
    "html_file": "offer_1461_20.html",
    "name": "Samsung ViewFinity S7 S70A (2021), 26.9\"",
    "offer_link": "https://www.ba-computer.at/samsung-s27a704nwu-s70a-series-led-monitor-68-cm-27-ls27a704nwuxen.html",
    "price": 399.12,
    "raw_specifications": {
        "Abmessungen (Breite x Tiefe x H\u00f6he)": "61.55 cm x 19.35 cm x 45.6 cm - mit Fu\u00df",
        "Besonderheiten": "Bild f\u00fcr Bild, Spielmodus, Cinema Mode, Eco Light Sensor, CustomColor Mode, Mega Infinity Dynamic Contrast Ratio, flimmerfreie Technologie, Image Size, Eco Saving Plus, Eye Saver Mode, Werkstuning, Off Timer Plus, sRGB Mode, Picture-in-Picture, Dynamic Contrast Mode, Adaptive Picture, High Bright-Modus, Auto Source Switch",
        "Bildschirmtyp": "IPS",
        "Details zu Abmessungen & Gewicht": "Mit Fu\u00df - Breite: 61.55 cm - Tiefe: 19.35 cm - H\u00f6he: 45.6 cm - Gewicht: 5.5 kg \u00a6 Ohne Fu\u00df - Breite: 61.55 cm - Tiefe: 4.27 cm - H\u00f6he: 36.82 cm - Gewicht: 4.4 kg",
        "Diagonalabmessung": "68 cm (27\")",
        "Display-Typ": "LED-hintergrundbeleuchteter LCD-Monitor / TFT-Aktivmatrix",
        "ENERGY STAR zertifiziert": "Ja",
        "Eingangsspannung": "Wechselstrom 120/230 V",
        "Einstellungen der Anzeigeposition": "Neigung",
        "Energie Effizienzklasse": "Klasse G",
        "Energieklasse (HDR)": "Klasse G",
        "Enthaltene Kabel": "1 x HDMI-Kabel \u00a6 1 x DisplayPort-Kabel",
        "Farbe": "Schwarz",
        "Farbunterst\u00fctzung": "1,07 Mrd. Farben",
        "Gewicht": "5.5 kg",
        "HDR-Format": "HDR10",
        "Helligkeit": "300 cd/m\u00b2",
        "Hintergrundbeleuchtungs-Technologie": "LED-Hintergrundbeleuchtung",
        "Horizontaler Betrachtungswinkel": "178",
        "Kennzeichnung": "TUV",
        "Kontrast": "1000:1",
        "Leistungsaufnahme im Ein-Zustand": "28 W",
        "Leistungsmerkmale": "Slot f\u00fcr Sicherheitsschloss (Kabelschloss getrennt erh\u00e4ltlich)",
        "Max. Betriebstemperatur": "40 \u00b0C",
        "Min Betriebstemperatur": "10 \u00b0C",
        "Native Aufl\u00f6sung": "4K 3840 x 2160 bei 60 Hz",
        "Neigungswinkel": "-2/+22",
        "Reaktionszeit": "5 ms",
        "Schlosstyp zur Diebstahlsicherung": "Kensington Slot",
        "Schnittstellen": "DisplayPort 1.2 \u00a6 HDMI \u00a6 Kopfh\u00f6rer \u00a6 USB",
        "Seitenverh\u00e4ltnis": "16:9",
        "Stromverbrauch (typisch)": "28 Watt",
        "Stromverbrauch HDR (eingeschaltet)": "35 kWh/1.000 h",
        "Stromverbrauch SDR (eingeschaltet)": "28 kWh/1.000 h",
        "TCO-zertifiziert": "TCO Certified Displays 8",
        "Transportbreite": "73.8 cm",
        "Transportgewicht": "7 kg",
        "Transporth\u00f6he": "12.6 cm",
        "Transporttiefe": "42.8 cm",
        "VESA-Halterung": "100 x 100 mm",
        "Vertikaler Betrachtungswinkel": "178",
        "Zul\u00e4ssige Luftfeuchtigkeit im Betrieb": "10 - 80% (nicht kondensierend)"
    },
    "raw_specifications_text": "Display-Typ: LED-hintergrundbeleuchteter LCD-Monitor / TFT-Aktivmatrix\nEnergie Effizienzklasse: Klasse G\nEnergieklasse (HDR): Klasse G\nDiagonalabmessung: 68 cm (27\")\nBildschirmtyp: IPS\nSeitenverh\u00e4ltnis: 16:9\nNative Aufl\u00f6sung: 4K 3840 x 2160 bei 60 Hz\nHelligkeit: 300 cd/m\u00b2\nKontrast: 1000:1\nHDR-Format: HDR10\nFarbunterst\u00fctzung: 1,07 Mrd. Farben\nReaktionszeit: 5 ms\nHorizontaler Betrachtungswinkel: 178\nVertikaler Betrachtungswinkel: 178\nHintergrundbeleuchtungs-Technologie: LED-Hintergrundbeleuchtung\nBesonderheiten: Bild f\u00fcr Bild, Spielmodus, Cinema Mode, Eco Light Sensor, CustomColor Mode, Mega Infinity Dynamic Contrast Ratio, flimmerfreie Technologie, Image Size, Eco Saving Plus, Eye Saver Mode, Werkstuning, Off Timer Plus, sRGB Mode, Picture-in-Picture, Dynamic Contrast Mode, Adaptive Picture, High Bright-Modus, Auto Source Switch\nFarbe: Schwarz\nAbmessungen (Breite x Tiefe x H\u00f6he): 61.55 cm x 19.35 cm x 45.6 cm - mit Fu\u00df\nGewicht: 5.5 kg\nSchnittstellen: DisplayPort 1.2 \u00a6 HDMI \u00a6 Kopfh\u00f6rer \u00a6 USB\nEinstellungen der Anzeigeposition: Neigung\nNeigungswinkel: -2/+22\nVESA-Halterung: 100 x 100 mm\nLeistungsmerkmale: Slot f\u00fcr Sicherheitsschloss (Kabelschloss getrennt erh\u00e4ltlich)\nEnthaltene Kabel: 1 x HDMI-Kabel \u00a6 1 x DisplayPort-Kabel\nKennzeichnung: TUV\nSchlosstyp zur Diebstahlsicherung: Kensington Slot\nEingangsspannung: Wechselstrom 120/230 V\nLeistungsaufnahme im Ein-Zustand: 28 W\nStromverbrauch SDR (eingeschaltet): 28 kWh/1.000 h\nStromverbrauch HDR (eingeschaltet): 35 kWh/1.000 h\nStromverbrauch (typisch): 28 Watt\nDetails zu Abmessungen & Gewicht: Mit Fu\u00df - Breite: 61.55 cm - Tiefe: 19.35 cm - H\u00f6he: 45.6 cm - Gewicht: 5.5 kg \u00a6 Ohne Fu\u00df - Breite: 61.55 cm - Tiefe: 4.27 cm - H\u00f6he: 36.82 cm - Gewicht: 4.4 kg\nTransportbreite: 73.8 cm\nTransporttiefe: 42.8 cm\nTransporth\u00f6he: 12.6 cm\nTransportgewicht: 7 kg\nTCO-zertifiziert: TCO Certified Displays 8\nENERGY STAR zertifiziert: Ja\nMin Betriebstemperatur: 10 \u00b0C\nMax. Betriebstemperatur: 40 \u00b0C\nZul\u00e4ssige Luftfeuchtigkeit im Betrieb: 10 - 80% (nicht kondensierend)",
    "reference_file": "offer_reference_1461.json",
    "shop_name": "BA-Computer"
}