{
    "html_file": "offer_1378_22.html",
    "name": "MSI Modern MD241PWDE, 23.8\"",
    "offer_link": "https://www.taufnaus.de/product/10602602",
    "price": 270.62,
    "raw_specifications": {
        "Abmessungen (Breite x Tiefe x H\u00f6he)": "54.1 cm x 20 cm x 38 cm - mit Fu\u00df",
        "Besonderheiten": "HDCP, rahmenlos, MSI Anti-Flicker, Low Blue Light-Technologie, Eye-Care+ Technology",
        "Bildschirmbeschichtung": "Blendfrei",
        "Bildschirmtyp": "IPS",
        "Details zu Abmessungen & Gewicht": "Mit Fu\u00df - Breite: 54.1 cm - Tiefe: 20 cm - H\u00f6he: 38 cm - Gewicht: 4.7 kg \u00a6 Ohne Fu\u00df - Breite: 54.1 cm - Tiefe: 4.8 cm - H\u00f6he: 32.2 cm",
        "Diagonalabmessung": "60 cm (23.8\")",
        "Display-Typ": "LED-hintergrundbeleuchteter LCD-Monitor / TFT-Aktivmatrix",
        "Eingangsspannung": "Wechselstrom 100-240 V (50/60 Hz)",
        "Einstellungen der Anzeigeposition": "H\u00f6he, Pivot (Rotation), Drehung, Neigung",
        "Energie Effizienzklasse": "Klasse E",
        "Farbe": "Wei\u00df",
        "Farbraum": "109.71% sRGB (CIE 1931), 110.03% sRGB (CIE 1976), 77.71% NTSC (CIE 1931), 80.87% DCI-P3 (CIE 1931), 81.33% Adobe RGB (CIE 1931), 87.72% DCI-P3 (CIE 1976), 94.21% Adobe RGB (CIE 1976), 95.98% NTSC (CIE 1976)",
        "Farbunterst\u00fctzung": "16,7 Millionen Farben (8-Bit)",
        "Gewicht": "4.7 kg",
        "Helligkeit": "250 cd/m\u00b2",
        "Hintergrundbeleuchtungs-Technologie": "LED-Hintergrundbeleuchtung",
        "Horizontale Bildwiederholrate": "30 - 112 kHz",
        "Horizontaler Betrachtungswinkel": "178",
        "H\u00f6heneinstellung": "110 mm",
        "Kennzeichnung": "TUV Rheinland",
        "Kontrast": "1000:1 / 100000:1 (dynamisch)",
        "Leistungsmerkmale": "Slot f\u00fcr Sicherheitsschloss (Kabelschloss getrennt erh\u00e4ltlich)",
        "Native Aufl\u00f6sung": "Full HD (1080p) 1920 x 1080 bei 75 Hz",
        "Neigungswinkel": "-5/+20",
        "Pixelpitch": "0.2745 mm",
        "Reaktionszeit": "5 ms (Gray-to-Gray), 14 ms (tr - tf)",
        "Rotationswinkel": "180",
        "Schlosstyp zur Diebstahlsicherung": "Kensington Slot",
        "Schnittstellen": "HDMI \u00a6 Kopfh\u00f6rer \u00a6 USB-C",
        "Schwenkwinkel": "60",
        "Seitenverh\u00e4ltnis": "16:9",
        "Service und Support": "Begrenzte Garantie - 3 Jahre",
        "Stromverbrauch SDR (eingeschaltet)": "18 kWh/1.000 h",
        "Transportbreite": "81.4 cm",
        "Transportgewicht": "6.5 kg",
        "Transporth\u00f6he": "41.7 cm",
        "Transporttiefe": "16.7 cm",
        "Typ": "Lautsprecher - Stereo",
        "VESA-Halterung": "75 x 75 mm",
        "Vertikale Bildwiederholrate": "48 - 75 Hz",
        "Vertikaler Betrachtungswinkel": "178"
    },
    "raw_specifications_text": "Display-Typ: LED-hintergrundbeleuchteter LCD-Monitor / TFT-Aktivmatrix\nEnergie Effizienzklasse: Klasse E\nDiagonalabmessung: 60 cm (23.8\")\nBildschirmtyp: IPS\nSeitenverh\u00e4ltnis: 16:9\nNative Aufl\u00f6sung: Full HD (1080p) 1920 x 1080 bei 75 Hz\nPixelpitch: 0.2745 mm\nHelligkeit: 250 cd/m\u00b2\nKontrast: 1000:1 / 100000:1 (dynamisch)\nFarbunterst\u00fctzung: 16,7 Millionen Farben (8-Bit)\nFarbraum: 109.71% sRGB (CIE 1931), 110.03% sRGB (CIE 1976), 77.71% NTSC (CIE 1931), 80.87% DCI-P3 (CIE 1931), 81.33% Adobe RGB (CIE 1931), 87.72% DCI-P3 (CIE 1976), 94.21% Adobe RGB (CIE 1976), 95.98% NTSC (CIE 1976)\nReaktionszeit: 5 ms (Gray-to-Gray), 14 ms (tr - tf)\nVertikale Bildwiederholrate: 48 - 75 Hz\nHorizontale Bildwiederholrate: 30 - 112 kHz\nHorizontaler Betrachtungswinkel: 178\nVertikaler Betrachtungswinkel: 178\nBildschirmbeschichtung: Blendfrei\nHintergrundbeleuchtungs-Technologie: LED-Hintergrundbeleuchtung\nBesonderheiten: HDCP, rahmenlos, MSI Anti-Flicker, Low Blue Light-Technologie, Eye-Care+ Technology\nFarbe: Wei\u00df\nAbmessungen (Breite x Tiefe x H\u00f6he): 54.1 cm x 20 cm x 38 cm - mit Fu\u00df\nGewicht: 4.7 kg\nTyp: Lautsprecher - Stereo\nSchnittstellen: HDMI \u00a6 Kopfh\u00f6rer \u00a6 USB-C\nEinstellungen der Anzeigeposition: H\u00f6he, Pivot (Rotation), Drehung, Neigung\nNeigungswinkel: -5/+20\nSchwenkwinkel: 60\nRotationswinkel: 180\nH\u00f6heneinstellung: 110 mm\nVESA-Halterung: 75 x 75 mm\nLeistungsmerkmale: Slot f\u00fcr Sicherheitsschloss (Kabelschloss getrennt erh\u00e4ltlich)\nKennzeichnung: TUV Rheinland\nSchlosstyp zur Diebstahlsicherung: Kensington Slot\nEingangsspannung: Wechselstrom 100-240 V (50/60 Hz)\nStromverbrauch SDR (eingeschaltet): 18 kWh/1.000 h\nDetails zu Abmessungen & Gewicht: Mit Fu\u00df - Breite: 54.1 cm - Tiefe: 20 cm - H\u00f6he: 38 cm - Gewicht: 4.7 kg \u00a6 Ohne Fu\u00df - Breite: 54.1 cm - Tiefe: 4.8 cm - H\u00f6he: 32.2 cm\nTransportbreite: 81.4 cm\nTransporttiefe: 16.7 cm\nTransporth\u00f6he: 41.7 cm\nTransportgewicht: 6.5 kg\nService und Support: Begrenzte Garantie - 3 Jahre",
    "reference_file": "offer_reference_1378.json",
    "shop_name": "TaufNaus"
}