{
    "html_file": "offer_978_3.html",
    "name": "Samsung Smart Monitor M7 M70B schwarz (2022), 43\"",
    "offer_link": "https://www.mylemon.at/artikel/samsung/ls43bm700uuxen/m70b-3840x2160.html",
    "price": 406.59,
    "raw_specifications": {
        "AC Eingangsspannung": "100 - 240 V",
        "Anzahl HDMI-Anschl\u00fcsse": "2",
        "Anzahl der Farben des Displays": "1 Milliarden Farben",
        "Artikelnummer": "M19Y0QCL",
        "Aufl\u00f6sung": "3840x2160",
        "Besonderheiten": "Lautsprecher",
        "Betriebstemperatur": "10 - 40 \u00b0C",
        "Bildschirmdiagonale": "109,2 cm (43 Zoll)",
        "Bildschirmform": "Flach",
        "Bildwinkel, horizontal": "178\u00b0",
        "Bildwinkel, vertikal": "178\u00b0",
        "Bluetooth": "Ja",
        "Bluetooth-Version": "4.2",
        "Breite (ohne Standfu\u00df)": "96,5 cm",
        "Display-Aufl\u00f6sung": "3840 x 2160 Pixel",
        "Displaygr\u00f6\u00dfe": "43 Zoll",
        "EAN": "8806094139570",
        "Eingebaute Lautsprecher": "Ja",
        "Energieeffizienzklasse (HDR)": "G",
        "Energieeffizienzklasse (SDR)": "G",
        "Energieeffizienzskala": "A bis G",
        "Energieverbrauch (HDR) pro 1.000 Stunden": "125 kWh",
        "Energieverbrauch (SDR) pro 1.000 Stunden": "65 kWh",
        "Ger\u00e4tebreite (inkl. Fu\u00df)": "965,5 mm",
        "Ger\u00e4teh\u00f6he (inkl. Fu\u00df)": "629,3 mm",
        "Ger\u00e4tetiefe (inkl. Fu\u00df)": "247,2 mm",
        "Gewicht (mit St\u00e4nder)": "10,6 kg",
        "Gewicht (ohne St\u00e4nder)": "8,5 kg",
        "HD-Typ": "4K Ultra HD",
        "HDMI": "Ja",
        "HDMI-Version": "2.0",
        "Helligkeit": "300 cd/m\u00b2",
        "Helligkeit (typisch)": "300 cd/m\u00b2",
        "Hersteller Artikelnummer": "LS43BM700UUXEN",
        "H\u00f6he (ohne Standfu\u00df)": "56 cm",
        "Installiertes Betriebssystem": "Windows 10",
        "Integrierte Kamera": "Nein",
        "Integrierter USB-Hub": "Ja",
        "Kontrastverh\u00e4ltnis": "5000:1",
        "Marktpositionierung": "Haus",
        "Maximale Bildwiederholrate": "60 Hz",
        "Mitgelieferte Kabel": "HDMI, USB Typ-C",
        "Natives Seitenverh\u00e4ltnis": "16:9",
        "Paketgewicht": "13,7 kg",
        "Panel": "VA",
        "Panel-Montage-Schnittstelle": "200 x 200 mm",
        "Panel-Typ": "VA",
        "Produktfarbe": "Schwarz",
        "Reaktionszeit": "4 ms",
        "Relative Luftfeuchtigkeit in Betrieb": "10 - 80%",
        "Spiel-Modus": "Ja",
        "Stromverbrauch (Standardbetrieb)": "65 W",
        "Stromverbrauch (Standby)": "0,5 W",
        "Tiefe (ohne Standfu\u00df)": "2,57 cm",
        "Touchscreen": "Nein",
        "Typ Ladeanschluss": "USB Typ-C",
        "USB-Hub-Version": "2.0",
        "USB-Upstream-Porttyp": "USB Typ-C",
        "VESA-Halterung": "Ja",
        "Verpackungsbreite": "1198 mm",
        "Verpackungsh\u00f6he": "677 mm",
        "Verpackungstiefe": "159 mm",
        "Video Anschl\u00fcsse": "2x HDMI",
        "WLAN": "Ja",
        "WLAN-Standards": "Wi-Fi 5 (802.11ac)",
        "Warentarifnummer (HS)": "85285210"
    },
    "raw_specifications_text": "Displaygr\u00f6\u00dfe: 43 Zoll\nAufl\u00f6sung: 3840x2160\nPanel: VA\nReaktionszeit: 4 ms\nVideo Anschl\u00fcsse: 2x HDMI\nHelligkeit: 300 cd/m\u00b2\nBesonderheiten: Lautsprecher\nHersteller Artikelnummer: LS43BM700UUXEN\nEAN: 8806094139570\nArtikelnummer: M19Y0QCL\nBildschirmdiagonale: 109,2 cm (43 Zoll)\nDisplay-Aufl\u00f6sung: 3840 x 2160 Pixel\nNatives Seitenverh\u00e4ltnis: 16:9\nTouchscreen: Nein\nHD-Typ: 4K Ultra HD\nPanel-Typ: VA\nBildschirmform: Flach\nKontrastverh\u00e4ltnis: 5000:1\nMaximale Bildwiederholrate: 60 Hz\nAnzahl der Farben des Displays: 1 Milliarden Farben\nHelligkeit (typisch): 300 cd/m\u00b2\nBildwinkel, horizontal: 178\u00b0\nBildwinkel, vertikal: 178\u00b0\nSpiel-Modus: Ja\nInstalliertes Betriebssystem: Windows 10\nEingebaute Lautsprecher: Ja\nIntegrierte Kamera: Nein\nMarktpositionierung: Haus\nProduktfarbe: Schwarz\nIntegrierter USB-Hub: Ja\nHDMI: Ja\nUSB-Hub-Version: 2.0\nUSB-Upstream-Porttyp: USB Typ-C\nAnzahl HDMI-Anschl\u00fcsse: 2\nHDMI-Version: 2.0\nTyp Ladeanschluss: USB Typ-C\nWLAN: Ja\nWLAN-Standards: Wi-Fi 5 (802.11ac)\nBluetooth: Ja\nBluetooth-Version: 4.2\nVESA-Halterung: Ja\nPanel-Montage-Schnittstelle: 200 x 200 mm\nEnergieeffizienzklasse (SDR): G\nEnergieeffizienzklasse (HDR): G\nEnergieverbrauch (SDR) pro 1.000 Stunden: 65 kWh\nEnergieverbrauch (HDR) pro 1.000 Stunden: 125 kWh\nStromverbrauch (Standardbetrieb): 65 W\nStromverbrauch (Standby): 0,5 W\nAC Eingangsspannung: 100 - 240 V\nEnergieeffizienzskala: A bis G\nBetriebstemperatur: 10 - 40 \u00b0C\nRelative Luftfeuchtigkeit in Betrieb: 10 - 80%\nMitgelieferte Kabel: HDMI, USB Typ-C\nGer\u00e4tebreite (inkl. Fu\u00df): 965,5 mm\nGer\u00e4tetiefe (inkl. Fu\u00df): 247,2 mm\nGer\u00e4teh\u00f6he (inkl. Fu\u00df): 629,3 mm\nGewicht (mit St\u00e4nder): 10,6 kg\nBreite (ohne Standfu\u00df): 96,5 cm\nTiefe (ohne Standfu\u00df): 2,57 cm\nH\u00f6he (ohne Standfu\u00df): 56 cm\nGewicht (ohne St\u00e4nder): 8,5 kg\nVerpackungsbreite: 1198 mm\nVerpackungstiefe: 159 mm\nVerpackungsh\u00f6he: 677 mm\nPaketgewicht: 13,7 kg\nWarentarifnummer (HS): 85285210",
    "reference_file": "offer_reference_978.json",
    "shop_name": "mylemon.at"
}