{
    "html_file": "offer_1238_8.html",
    "name": "HP X32c, 31.5\"",
    "offer_link": "https://www.playox.de/productredirect/index/sku/19358475?sPartner=p-geizhals-at&campaign=psm/geizhals-at/",
    "price": 281.34,
    "raw_specifications": {
        "Anschl\u00fcsse": "DisplayPort, HDMI, Audioausgang (Line-Out)",
        "Artikelnummer": "19358475",
        "Aufl\u00f6sung Kurzname": "Full HD",
        "Bezeichnung des Herstellers": "HP X32c",
        "Bildwiederholungsrate": "165,00 Hz",
        "Breite": "7089,00 mm",
        "Display Features": "3D ready",
        "Display Sync": "AMD FreeSync",
        "Displaygr\u00f6\u00dfe": "81,28 cm (32 Zoll)",
        "Displayoberfl\u00e4che": "matt",
        "EEK - Spektrum": "AG",
        "Einsatzort": "Innen",
        "Energieeffizienzklasse": "F",
        "Geh\u00e4usefarbe des Ger\u00e4tes": "Schwarz",
        "Gewicht": "8,50 kg",
        "Gewicht inkl. Verpackung in Kg": "0,00 kg",
        "Helligkeit Bereich": "300 - 450 cd/m\u00b2",
        "Hersteller": "HP Inc.",
        "H\u00f6he": "5537,00 mm",
        "Inhalt (ml oder g)": "0,00 ml",
        "Kapazit\u00e4t (Seiten)": "0",
        "Kontrastverh\u00e4ltnis (typisch) Bereich": "ab 1.200:1",
        "LCD-Technologie": "VA Panel",
        "L\u00e4nge": "2349,00 mm",
        "Produktart": "Monitore",
        "Reaktionszeit": "1,00 ms",
        "Seitenverh\u00e4ltnis": "16:9",
        "Shop Herstellernummer": "33K31E9#ABB",
        "Standard-EAN": "0196068981150",
        "max. Aufl\u00f6sung": "1.920 x 1.080 Pixel (16:9)"
    },
    "raw_specifications_text": "Geh\u00e4usefarbe des Ger\u00e4tes: Schwarz\nGewicht: 8,50 kg\nProduktart: Monitore\nKontrastverh\u00e4ltnis (typisch) Bereich: ab 1.200:1\nAnschl\u00fcsse: DisplayPort, HDMI, Audioausgang (Line-Out)\nHersteller: HP Inc.\nHelligkeit Bereich: 300 - 450 cd/m\u00b2\nDisplay Features: 3D ready\nDisplaygr\u00f6\u00dfe: 81,28 cm (32 Zoll)\nDisplay Sync: AMD FreeSync\nGewicht inkl. Verpackung in Kg: 0,00 kg\nInhalt (ml oder g): 0,00 ml\nKapazit\u00e4t (Seiten): 0\nAufl\u00f6sung Kurzname: Full HD\nEEK - Spektrum: AG\nArtikelnummer: 19358475\nStandard-EAN: 0196068981150\nShop Herstellernummer: 33K31E9#ABB\nBezeichnung des Herstellers: HP X32c\nBreite: 7089,00 mm\nH\u00f6he: 5537,00 mm\nL\u00e4nge: 2349,00 mm\nmax. Aufl\u00f6sung: 1.920 x 1.080 Pixel (16:9)\nSeitenverh\u00e4ltnis: 16:9\nLCD-Technologie: VA Panel\nReaktionszeit: 1,00 ms\nDisplayoberfl\u00e4che: matt\nBildwiederholungsrate: 165,00 Hz\nEinsatzort: Innen\nEnergieeffizienzklasse: F",
    "reference_file": "offer_reference_1238.json",
    "shop_name": "playox (AT)"
}