{
    "html_file": "offer_1890_8.html",
    "name": "Lenovo ThinkVision P24q-20, 23.8\"",
    "offer_link": "https://direkt.jacob.de/produkte/lenovo-thinkvision-p24q-20-61f5gat1eu-artnr-6271834.html?utm_source=geizhals&utm_medium=cpc&utm_campaign=Preisvergleich&ref=103",
    "price": 261.18,
    "raw_specifications": {
        "Abmessungen (Breite x Tiefe x H\u00f6he)": "53.98 cm x 20.5 cm x 57 cm - mit Fu\u00df",
        "Abmessungen (Breite x Tiefe x H\u00f6he) - mit Fu\u00df": "53.98 cm x 20.5 cm x 57 cm",
        "Besonderheiten": "99% sRGB-Farbskala, integrierte Kabelf\u00fchrung, Werkskalibrierung, Augenkomfort-Modus, NearEdgeless",
        "Bildschirmbeschichtung": "Blendfrei",
        "Bildschirmtyp": "IPS",
        "Details zu Abmessungen & Gewicht": "Mit Standfu\u00df (h\u00f6chste Position) - Breite: 53.98 cm - Tiefe: 20.5 cm - H\u00f6he: 57 cm - Gewicht: 6.18 kg  Mit Standfu\u00df (h\u00f6chste Position) - Breite: 53.98 cm - Tiefe: 20.5 cm - H\u00f6he: 42 cm - Gewicht: 6.18 kg  Ohne Fu\u00df - Breite: 53.98 cm - Tiefe: 4.46 cm - H\u00f6he: 32.57 cm - Gewicht: 3.85 kg",
        "Diagonalabmessung": "60.5 cm (23.8\")",
        "Display-Typ": "LED-hintergrundbeleuchteter LCD-Monitor / TFT-Aktivmatrix",
        "ENERGY STAR zertifiziert": "Ja",
        "ENERGY STAR-Version": "8.0",
        "EPEAT-kompatibel": "EPEAT Silver",
        "Eingangsanschl\u00fcsse": "HDMI, DisplayPort",
        "Einstellungen der Anzeigeposition": "H\u00f6he, Pivot (Rotation), swivel, tilt",
        "Energie-Effizienzklasse": "F",
        "Energierverbrauch Sleep": "0.5 Watt",
        "Enthaltene Kabel": "1 x DisplayPort-Kabel - 1.8 m  1 x USB-Kabel Typ A auf Typ B - 1.8 m",
        "Erforderliche Netzspannung": "Wechselstrom 120/230 V (50/60 Hz)",
        "Erforderliches Betriebssystem": "Microsoft Windows 7, Windows 10",
        "Farbe": "Raven Black",
        "Farbunterst\u00fctzung": "16,7 Millionen Farben",
        "Ger\u00e4tetyp": "LED-hintergrundbeleuchteter LCD-Monitor - 60.5 cm (23.8\")",
        "Gewicht": "6.18 kg",
        "Helligkeit": "300 cd/m\u00b2",
        "Hintergrundbeleuchtungs-Technologie": "WLED",
        "Horizontaler Betrachtungswinkel": "178",
        "H\u00f6heneinstellung": "150 mm",
        "Integrierte Peripherieger\u00e4te": "USB 3.1 Gen.1 Hub",
        "Kennzeichnung": "CCC, TUV Rheinland Eye Comfort Certification, China Energy standard Tier 1, EU RoHS 2002/95/EC",
        "Kontrast": "1000:1 / 3000000:1 (dynamisch)",
        "Leistungsaufnahme im Betrieb": "20 Watt",
        "Leistungsmerkmale": "Slot f\u00fcr Sicherheitsschloss (Kabelschloss getrennt erh\u00e4ltlich)",
        "Lokalisierung": "Englisch / Europa",
        "Native Aufl\u00f6sung": "WQHD 2560 x 1440",
        "Neigungswinkel": "-5/+35",
        "Pixelpitch": "0.2058 mm",
        "Ppi": "123",
        "Produktbeschreibung": "Lenovo ThinkVision P24q-20 - LED-Monitor - 60.5 cm (23.8\")",
        "Reaktionszeit": "6 ms (normal); 4 ms (extrem)",
        "Rotationswinkel": "180",
        "Schlosstyp zur Diebstahlsicherung": "Kensington Slot",
        "Schnittstellen": "HDMI  DisplayPort  DisplayPort-Ausgang  USB 3.1 Gen 1 Downstream mit Battery Charging 1.2  3 x USB 3.1 Gen 1 Downstream  USB 3.1 Gen 1 Upstream (Typ B)  Kopfh\u00f6rer",
        "Schwenkwinkel": "90",
        "Seitenverh\u00e4ltnis": "16:9",
        "Sichtbare Bildfl\u00e4che": "60.5 cm (23.8\")",
        "Stromverbrauch (Aus-Modus)": "0.3 Watt",
        "Stromverbrauch im Standby-Modus": "0.5 Watt",
        "Transportbreite": "62 cm",
        "Transportgewicht": "8.1 kg",
        "Transporth\u00f6he": "42.3 cm",
        "Transporttiefe": "14.9 cm",
        "Umweltschutzstandards": "ENERGY STAR-qualifiziert EPEAT Silver",
        "VESA-Halterung": "100 x 100 mm",
        "Vertikale Bildwiederholrate": "60 Hz",
        "Vertikaler Betrachtungswinkel": "178"
    },
    "raw_specifications_text": "Produktbeschreibung: Lenovo ThinkVision P24q-20 - LED-Monitor - 60.5 cm (23.8\")\nGer\u00e4tetyp: LED-hintergrundbeleuchteter LCD-Monitor - 60.5 cm (23.8\")\nEnergie-Effizienzklasse: F\nLeistungsmerkmale: Slot f\u00fcr Sicherheitsschloss (Kabelschloss getrennt erh\u00e4ltlich)\nBildschirmtyp: IPS\nSeitenverh\u00e4ltnis: 16:9\nNative Aufl\u00f6sung: WQHD 2560 x 1440\nPixelpitch: 0.2058 mm\nHelligkeit: 300 cd/m\u00b2\nKontrast: 1000:1 / 3000000:1 (dynamisch)\nReaktionszeit: 6 ms (normal); 4 ms (extrem)\nFarbunterst\u00fctzung: 16,7 Millionen Farben\nEingangsanschl\u00fcsse: HDMI, DisplayPort\nEinstellungen der Anzeigeposition: H\u00f6he, Pivot (Rotation), swivel, tilt\nBildschirmbeschichtung: Blendfrei\nFarbe: Raven Black\nAbmessungen (Breite x Tiefe x H\u00f6he) - mit Fu\u00df: 53.98 cm x 20.5 cm x 57 cm\nGewicht: 6.18 kg\nLokalisierung: Englisch / Europa\nUmweltschutzstandards: ENERGY STAR-qualifiziert EPEAT Silver\nKennzeichnung: CCC, TUV Rheinland Eye Comfort Certification, China Energy standard Tier 1, EU RoHS 2002/95/EC\nDisplay-Typ: LED-hintergrundbeleuchteter LCD-Monitor / TFT-Aktivmatrix\nDiagonalabmessung: 60.5 cm (23.8\")\nSichtbare Bildfl\u00e4che: 60.5 cm (23.8\")\nIntegrierte Peripherieger\u00e4te: USB 3.1 Gen.1 Hub\nPpi: 123\nVertikale Bildwiederholrate: 60 Hz\nHorizontaler Betrachtungswinkel: 178\nVertikaler Betrachtungswinkel: 178\nHintergrundbeleuchtungs-Technologie: WLED\nBesonderheiten: 99% sRGB-Farbskala, integrierte Kabelf\u00fchrung, Werkskalibrierung, Augenkomfort-Modus, NearEdgeless\nAbmessungen (Breite x Tiefe x H\u00f6he): 53.98 cm x 20.5 cm x 57 cm - mit Fu\u00df\nSchnittstellen: HDMI  DisplayPort  DisplayPort-Ausgang  USB 3.1 Gen 1 Downstream mit Battery Charging 1.2  3 x USB 3.1 Gen 1 Downstream  USB 3.1 Gen 1 Upstream (Typ B)  Kopfh\u00f6rer\nNeigungswinkel: -5/+35\nSchwenkwinkel: 90\nRotationswinkel: 180\nH\u00f6heneinstellung: 150 mm\nVESA-Halterung: 100 x 100 mm\nEnthaltene Kabel: 1 x DisplayPort-Kabel - 1.8 m  1 x USB-Kabel Typ A auf Typ B - 1.8 m\nSchlosstyp zur Diebstahlsicherung: Kensington Slot\nErforderliche Netzspannung: Wechselstrom 120/230 V (50/60 Hz)\nLeistungsaufnahme im Betrieb: 20 Watt\nStromverbrauch im Standby-Modus: 0.5 Watt\nEnergierverbrauch Sleep: 0.5 Watt\nStromverbrauch (Aus-Modus): 0.3 Watt\nErforderliches Betriebssystem: Microsoft Windows 7, Windows 10\nDetails zu Abmessungen & Gewicht: Mit Standfu\u00df (h\u00f6chste Position) - Breite: 53.98 cm - Tiefe: 20.5 cm - H\u00f6he: 57 cm - Gewicht: 6.18 kg  Mit Standfu\u00df (h\u00f6chste Position) - Breite: 53.98 cm - Tiefe: 20.5 cm - H\u00f6he: 42 cm - Gewicht: 6.18 kg  Ohne Fu\u00df - Breite: 53.98 cm - Tiefe: 4.46 cm - H\u00f6he: 32.57 cm - Gewicht: 3.85 kg\nTransportbreite: 62 cm\nTransporttiefe: 14.9 cm\nTransporth\u00f6he: 42.3 cm\nTransportgewicht: 8.1 kg\nEPEAT-kompatibel: EPEAT Silver\nENERGY STAR zertifiziert: Ja\nENERGY STAR-Version: 8.0",
    "reference_file": "offer_reference_1890.json",
    "shop_name": "Jacob Elektronik direkt (AT)"
}