{
    "html_file": "offer_918_7.html",
    "name": "MSI Optix G271CDE, 27\"",
    "offer_link": "https://www.mylemon.at/artikel/msi/9s6_3cc32h_013/optix-g271cde.html",
    "price": 322.31,
    "raw_specifications": {
        "AC Eingangsfrequenz": "50/60 Hz",
        "AC Eingangsspannung": "100 - 240 V",
        "AMD FreeSync": "Ja",
        "AMD FreeSync-Typ": "FreeSync Premium",
        "Anzahl DisplayPort Anschl\u00fcsse": "1",
        "Anzahl HDMI-Anschl\u00fcsse": "2",
        "Anzahl der Farben des Displays": "16,7 Millionen Farben",
        "Artikelnummer": "M1DYLI3L",
        "Aufl\u00f6sung": "1920x1080",
        "Besonderheiten": "165 Hz",
        "Bewertung der Bildschirmkr\u00fcmmung": "1000R",
        "Bildschirmdiagonale": "68,6 cm (27 Zoll)",
        "Bildschirmdiagonale (cm)": "69 cm",
        "Bildschirmform": "Gebogen",
        "Bildwinkel, horizontal": "178\u00b0",
        "Bildwinkel, vertikal": "178\u00b0",
        "Blendfreier Bildschirm": "Ja",
        "Breite (ohne Standfu\u00df)": "60,6 cm",
        "Display-Aufl\u00f6sung": "1920 x 1080 Pixel",
        "DisplayPorts-Version": "1.2a",
        "Displaygr\u00f6\u00dfe": "27 Zoll",
        "EAN": "4719072864439",
        "Eingebaute Lautsprecher": "Nein",
        "Energieverbrauch (SDR) pro 1.000 Stunden": "26 kWh",
        "Ergonomie": "Neigbar",
        "Farbskala": "100%",
        "Farbtiefe": "8 Bit",
        "Ger\u00e4tebreite (inkl. Fu\u00df)": "606,5 mm",
        "Ger\u00e4teh\u00f6he (inkl. Fu\u00df)": "245,6 mm",
        "Ger\u00e4tetiefe (inkl. Fu\u00df)": "482,2 mm",
        "Gewicht (mit St\u00e4nder)": "5,6 kg",
        "Gewicht (ohne St\u00e4nder)": "4,1 kg",
        "HD-Typ": "Full HD",
        "HDCP": "Ja",
        "HDCP-Version": "2.2",
        "HDMI": "Ja",
        "HDMI-Version": "2.0",
        "Helligkeit": "300 cd/m\u00b2",
        "Helligkeit (typisch)": "300 cd/m\u00b2",
        "Hersteller Artikelnummer": "9S6-3CC32H-013",
        "H\u00f6he (ohne Standfu\u00df)": "11,5 cm",
        "Integrierte Kamera": "Nein",
        "Integrierter USB-Hub": "Nein",
        "Kabelsperre-Slot": "Ja",
        "Kontrastverh\u00e4ltnis": "3000:1",
        "Kontrastverh\u00e4ltnis (dynamisch)": "100000000:1",
        "Kopfh\u00f6rerausgang": "Ja",
        "Marktpositionierung": "Gaming",
        "Maximale Bildwiederholrate": "165 Hz",
        "Mitgelieferte Kabel": "AC, DisplayPort",
        "NVIDIA G-SYNC": "Nein",
        "Natives Seitenverh\u00e4ltnis": "16:9",
        "Neigungsverstellung": "Ja",
        "Neigungswinkelbereich": "-5 - 20\u00b0",
        "Paketgewicht": "7,8 kg",
        "Panel": "VA",
        "Panel-Montage-Schnittstelle": "75 x 75 mm",
        "Panel-Typ": "VA",
        "Produktfarbe": "Schwarz",
        "RGB-Farbraum": "NTSC",
        "Rahmenloses Design": "Ja",
        "Reaktionszeit": "4 ms",
        "Reaktionszeit (schnell)": "1 ms",
        "Slot-Typ Kabelsperre": "Kensington",
        "Tiefe (ohne Standfu\u00df)": "36,3 cm",
        "Touchscreen": "Nein",
        "VESA Halterung": "75x75 mm",
        "VESA-Halterung": "Ja",
        "Verpackungsbreite": "790 mm",
        "Verpackungsh\u00f6he": "470 mm",
        "Verpackungstiefe": "198 mm",
        "Video Anschl\u00fcsse": "2x HDMI, 1x DisplayPort"
    },
    "raw_specifications_text": "Displaygr\u00f6\u00dfe: 27 Zoll\nAufl\u00f6sung: 1920x1080\nPanel: VA\nReaktionszeit: 4 ms\nVideo Anschl\u00fcsse: 2x HDMI, 1x DisplayPort\nErgonomie: Neigbar\nVESA Halterung: 75x75 mm\nHelligkeit: 300 cd/m\u00b2\nBesonderheiten: 165 Hz\nHersteller Artikelnummer: 9S6-3CC32H-013\nEAN: 4719072864439\nArtikelnummer: M1DYLI3L\nBildschirmdiagonale: 68,6 cm (27 Zoll)\nDisplay-Aufl\u00f6sung: 1920 x 1080 Pixel\nNatives Seitenverh\u00e4ltnis: 16:9\nTouchscreen: Nein\nHD-Typ: Full HD\nPanel-Typ: VA\nBildschirmform: Gebogen\nKontrastverh\u00e4ltnis: 3000:1\nMaximale Bildwiederholrate: 165 Hz\nAnzahl der Farben des Displays: 16,7 Millionen Farben\nHelligkeit (typisch): 300 cd/m\u00b2\nBlendfreier Bildschirm: Ja\nBewertung der Bildschirmkr\u00fcmmung: 1000R\nKontrastverh\u00e4ltnis (dynamisch): 100000000:1\nBildwinkel, horizontal: 178\u00b0\nBildwinkel, vertikal: 178\u00b0\nReaktionszeit (schnell): 1 ms\nBildschirmdiagonale (cm): 69 cm\nFarbtiefe: 8 Bit\nRGB-Farbraum: NTSC\nFarbskala: 100%\nNVIDIA G-SYNC: Nein\nAMD FreeSync: Ja\nAMD FreeSync-Typ: FreeSync Premium\nEingebaute Lautsprecher: Nein\nIntegrierte Kamera: Nein\nMarktpositionierung: Gaming\nProduktfarbe: Schwarz\nRahmenloses Design: Ja\nIntegrierter USB-Hub: Nein\nHDMI: Ja\nKopfh\u00f6rerausgang: Ja\nAnzahl HDMI-Anschl\u00fcsse: 2\nHDMI-Version: 2.0\nAnzahl DisplayPort Anschl\u00fcsse: 1\nDisplayPorts-Version: 1.2a\nHDCP: Ja\nHDCP-Version: 2.2\nVESA-Halterung: Ja\nKabelsperre-Slot: Ja\nPanel-Montage-Schnittstelle: 75 x 75 mm\nSlot-Typ Kabelsperre: Kensington\nNeigungswinkelbereich: -5 - 20\u00b0\nNeigungsverstellung: Ja\nEnergieverbrauch (SDR) pro 1.000 Stunden: 26 kWh\nAC Eingangsspannung: 100 - 240 V\nAC Eingangsfrequenz: 50/60 Hz\nMitgelieferte Kabel: AC, DisplayPort\nGer\u00e4tebreite (inkl. Fu\u00df): 606,5 mm\nGer\u00e4tetiefe (inkl. Fu\u00df): 482,2 mm\nGer\u00e4teh\u00f6he (inkl. Fu\u00df): 245,6 mm\nGewicht (mit St\u00e4nder): 5,6 kg\nBreite (ohne Standfu\u00df): 60,6 cm\nTiefe (ohne Standfu\u00df): 36,3 cm\nH\u00f6he (ohne Standfu\u00df): 11,5 cm\nGewicht (ohne St\u00e4nder): 4,1 kg\nVerpackungsbreite: 790 mm\nVerpackungstiefe: 198 mm\nVerpackungsh\u00f6he: 470 mm\nPaketgewicht: 7,8 kg",
    "reference_file": "offer_reference_918.json",
    "shop_name": "mylemon.at"
}