{
    "html_file": "offer_1596_4.html",
    "name": "HP Z24f G3, 23.8\"",
    "offer_link": "https://www.hiq24.de/shop/artikel/300270/?sPartner=geizhals",
    "price": 212.9,
    "raw_specifications": {
        "Abmessungen (Breite x Tiefe x H\u00f6he)": "53.84 cm x 19.5 cm x 48.93 cm - mit Fu\u00df",
        "Abmessungen (Breite x Tiefe x H\u00f6he) - mit Fu\u00df": "53.84 cm x 19.5 cm x 48.93 cm",
        "Besonderheiten": "On-screen Digital Controls, Low Blue Light Mode, flimmerfreie Technologie, 4 Side Borderless Design, kantenbeleuchtete LED-Hintergrundbeleuchtung, 8-bit (6-bit + FRC) Farbtiefe",
        "Bildschirmbeschichtung": "Blendfrei, 3H Hard Coating",
        "Bildschirmtyp": "IPS",
        "Details zu Abmessungen & Gewicht": "Mit Fu\u00df - Breite: 53.84 cm - Tiefe: 19.5 cm - H\u00f6he: 48.93 cm - Gewicht: 4.7 kg  Ohne Fu\u00df - Breite: 53.84 cm - Tiefe: 3.85 cm - H\u00f6he: 31.37 cm",
        "Diagonalabmessung": "61 cm (24\")",
        "Display-Typ": "LED-hintergrundbeleuchteter LCD-Monitor / TFT-Aktivmatrix",
        "ENERGY STAR zertifiziert": "Ja",
        "Eingangsanschl\u00fcsse": "HDMI, 2xDisplayPort",
        "Eingangsspannung": "Wechselstrom 120/230 V (50/60 Hz)",
        "Einstellungen der Anzeigeposition": "H\u00f6he, Pivot (Rotation), Drehung, Neigung",
        "Energie Effizienzklasse": "Klasse D",
        "Enthaltene Kabel": "1 x DisplayPort-Kabel  1 x USB-Kabel Typ A auf Typ B",
        "Ger\u00e4tetyp": "LED-hintergrundbeleuchteter LCD-Monitor - 61 cm (24\")",
        "Gewicht": "4.7 kg",
        "Helligkeit": "300 cd/m\u00b2",
        "Hintergrundbeleuchtungs-Technologie": "LED-Hintergrundbeleuchtung",
        "Horizontale Bildwiederholrate": "30 - 75 kHz",
        "Horizontaler Betrachtungswinkel": "178",
        "H\u00f6heneinstellung": "150 mm",
        "Integrierte Peripherieger\u00e4te": "USB 3.2 Gen 1 Hub",
        "Kennzeichnung": "VCCI, BSMI, GS, NOM, TUV S, CB, CCC, PSB, FCC, ISO 9241-307, KCC, WEEE, cTUVus, KC, CECP, CEL, EAC, SEPA, BIS, DisplayPort 1.2, UAE, Ukraine Energy Label",
        "Kontrast": "1000:1 / 10000000:1 (dynamisch)",
        "Leistungsaufnahme im Ein-Zustand": "12.5 W",
        "Leistungsmerkmale": "USB 3.2 Gen 1 Hub",
        "Lokalisierung": "Englisch / Europa",
        "Max. Betriebstemperatur": "35 \u00b0C",
        "Min Betriebstemperatur": "5 \u00b0C",
        "Native Aufl\u00f6sung": "Full HD (1080p) 1920 x 1080 bei 60 Hz",
        "Neigungswinkel": "-5/+20",
        "Pixelpitch": "0.274 mm",
        "Ppi": "93",
        "Produktbeschreibung": "HP Z24f G3 - LED-Monitor - Full HD (1080p) - 61 cm (24\")",
        "Reaktionszeit": "5 ms (grau zu grau mit \u00dcbersteuerung)",
        "Rotationswinkel": "180",
        "Schlosstyp zur Diebstahlsicherung": "Kensington Slot",
        "Schnittstellen": "DisplayPort 1.2 Ausgang  DisplayPort 1.2  HDMI  4 x USB 3.2 Gen 1  USB (Typ B)",
        "Schwenkwinkel": "90",
        "Seitenverh\u00e4ltnis": "16:9",
        "Sichtbare Bildfl\u00e4che": "60.5 cm (23.8\")",
        "Spannung": "Wechselstrom 120/230 V (50/60 Hz)",
        "Stromverbrauch (typisch)": "26 Watt",
        "Stromverbrauch SDR (eingeschaltet)": "12.5 kWh/1.000 h",
        "Stromverbrauch im Standby-Modus": "0.5 Watt",
        "TCO-zertifiziert": "TCO Certified Displays 8, TCO Certified Edge Displays",
        "Transportbreite": "62.5 cm",
        "Transportgewicht": "7.2 kg",
        "Transporth\u00f6he": "14.2 cm",
        "Transporttiefe": "37.3 cm",
        "Umweltschutzstandards": "TCO Certified Displays 8, TCO Certified Edge Displays, ENERGY STAR-qualifiziert",
        "VESA-Halterung": "100 x 100 mm",
        "Vertikale Bildwiederholrate": "50 - 60 Hz",
        "Vertikaler Betrachtungswinkel": "178",
        "Zubeh\u00f6r im Lieferumfang": "VESA-Klammer",
        "Zul\u00e4ssige Luftfeuchtigkeit im Betrieb": "20 - 80% (nicht kondensierend)"
    },
    "raw_specifications_text": "Display-Typ: LED-hintergrundbeleuchteter LCD-Monitor / TFT-Aktivmatrix\nEnergie Effizienzklasse: Klasse D\nDiagonalabmessung: 61 cm (24\")\nSichtbare Bildfl\u00e4che: 60.5 cm (23.8\")\nIntegrierte Peripherieger\u00e4te: USB 3.2 Gen 1 Hub\nBildschirmtyp: IPS\nSeitenverh\u00e4ltnis: 16:9\nNative Aufl\u00f6sung: Full HD (1080p) 1920 x 1080 bei 60 Hz\nPixelpitch: 0.274 mm\nPpi: 93\nHelligkeit: 300 cd/m\u00b2\nKontrast: 1000:1 / 10000000:1 (dynamisch)\nReaktionszeit: 5 ms (grau zu grau mit \u00dcbersteuerung)\nVertikale Bildwiederholrate: 50 - 60 Hz\nHorizontale Bildwiederholrate: 30 - 75 kHz\nHorizontaler Betrachtungswinkel: 178\nVertikaler Betrachtungswinkel: 178\nBildschirmbeschichtung: Blendfrei, 3H Hard Coating\nHintergrundbeleuchtungs-Technologie: LED-Hintergrundbeleuchtung\nBesonderheiten: On-screen Digital Controls, Low Blue Light Mode, flimmerfreie Technologie, 4 Side Borderless Design, kantenbeleuchtete LED-Hintergrundbeleuchtung, 8-bit (6-bit + FRC) Farbtiefe\nAbmessungen (Breite x Tiefe x H\u00f6he): 53.84 cm x 19.5 cm x 48.93 cm - mit Fu\u00df\nGewicht: 4.7 kg\nSchnittstellen: DisplayPort 1.2 Ausgang  DisplayPort 1.2  HDMI  4 x USB 3.2 Gen 1  USB (Typ B)\nEinstellungen der Anzeigeposition: H\u00f6he, Pivot (Rotation), Drehung, Neigung\nNeigungswinkel: -5/+20\nSchwenkwinkel: 90\nRotationswinkel: 180\nH\u00f6heneinstellung: 150 mm\nVESA-Halterung: 100 x 100 mm\nLeistungsmerkmale: USB 3.2 Gen 1 Hub\nZubeh\u00f6r im Lieferumfang: VESA-Klammer\nEnthaltene Kabel: 1 x DisplayPort-Kabel  1 x USB-Kabel Typ A auf Typ B\nKennzeichnung: VCCI, BSMI, GS, NOM, TUV S, CB, CCC, PSB, FCC, ISO 9241-307, KCC, WEEE, cTUVus, KC, CECP, CEL, EAC, SEPA, BIS, DisplayPort 1.2, UAE, Ukraine Energy Label\nLokalisierung: Englisch / Europa\nSchlosstyp zur Diebstahlsicherung: Kensington Slot\nEingangsspannung: Wechselstrom 120/230 V (50/60 Hz)\nLeistungsaufnahme im Ein-Zustand: 12.5 W\nStromverbrauch SDR (eingeschaltet): 12.5 kWh/1.000 h\nStromverbrauch (typisch): 26 Watt\nStromverbrauch im Standby-Modus: 0.5 Watt\nDetails zu Abmessungen & Gewicht: Mit Fu\u00df - Breite: 53.84 cm - Tiefe: 19.5 cm - H\u00f6he: 48.93 cm - Gewicht: 4.7 kg  Ohne Fu\u00df - Breite: 53.84 cm - Tiefe: 3.85 cm - H\u00f6he: 31.37 cm\nTransportbreite: 62.5 cm\nTransporttiefe: 37.3 cm\nTransporth\u00f6he: 14.2 cm\nTransportgewicht: 7.2 kg\nTCO-zertifiziert: TCO Certified Displays 8, TCO Certified Edge Displays\nENERGY STAR zertifiziert: Ja\nMin Betriebstemperatur: 5 \u00b0C\nMax. Betriebstemperatur: 35 \u00b0C\nZul\u00e4ssige Luftfeuchtigkeit im Betrieb: 20 - 80% (nicht kondensierend)\nProduktbeschreibung: HP Z24f G3 - LED-Monitor - Full HD (1080p) - 61 cm (24\")\nGer\u00e4tetyp: LED-hintergrundbeleuchteter LCD-Monitor - 61 cm (24\")\nEingangsanschl\u00fcsse: HDMI, 2xDisplayPort\nSpannung: Wechselstrom 120/230 V (50/60 Hz)\nAbmessungen (Breite x Tiefe x H\u00f6he) - mit Fu\u00df: 53.84 cm x 19.5 cm x 48.93 cm\nUmweltschutzstandards: TCO Certified Displays 8, TCO Certified Edge Displays, ENERGY STAR-qualifiziert",
    "reference_file": "offer_reference_1596.json",
    "shop_name": "HiQ24"
}