{
    "html_file": "offer_1055_21.html",
    "name": "Dell UltraSharp U2723QE, 27\"",
    "offer_link": "https://www.e-tec.at/details.php?artnr=356708",
    "price": 582.7,
    "raw_specifications": {
        "Anschl\u00fcsse - DisplayPort 1.4 60Hz@3840x2160": "1",
        "Anschl\u00fcsse - DisplayPort-Out 1.4 Daisy Chain": "1",
        "Anschl\u00fcsse - HDMI 2.0 60Hz@3840x2160": "1",
        "Anschl\u00fcsse - USB-C 3.1 mit DisplayPort 1.4 60Hz@3840x2160": "1",
        "Anwendung": "station\u00e4r",
        "Audio": "1x Line-Out",
        "Aufl\u00f6sung": "3840x2160",
        "Beschichtung": "matt (non-glare),  H\u00e4rtegrad 3H",
        "Besonderheiten": "Slim Bezel,  EPEAT Gold,  USB-C Power Delivery (90W),  mechanische Tasten mit Steuerkreuz,  Picture-in-Picture,  Sicherheitsschloss (Kensington),  KVM-Switch,  HDCP 2.2,  Werkskalibrierung (Delta-E <2),  TCO 9 zertifiziert",
        "Bildwiederholfrequenz": "60Hz",
        "Blickwinkel": "178\u00b0/178\u00b0",
        "Diagonale": "27\"/68.6cm",
        "Energieeffizienzklasse HDR (A bis G)": "E",
        "Energieverbrauch HDR": "26kWh/1000h",
        "Energieverbrauch SDR": "29kWh/1000h",
        "Ergonomie": "150mm (h\u00f6henverstellbar),  \u00b190\u00b0 (Pivot),  \u00b145\u00b0 (drehbar),  +21\u00b0/-5\u00b0 (neigbar),  keine Angabe (Schr\u00e4glage)",
        "FRC": "unbekannt",
        "Farbe": "schwarz",
        "Farbraum - DCI-P3": "98%",
        "Farbraum - REC 709": "100%",
        "Farbraum - sRGB": "100%",
        "Farbtiefe": "10bit (1.07 Mrd. Farben)",
        "Form": "gerade (flat)",
        "Gewicht": "6.64kg (mit Standfu\u00df),  4.48kg (ohne Standfu\u00df)",
        "HDR": "VESA DisplayHDR 400",
        "Helligkeit": "400cd/m\u00b2",
        "Herstellergarantie": "drei Jahre",
        "Hintergrundbeleuchtung": "White-LED,  flicker-free,  Blaulichtfilter",
        "Kontrast - dynamisch": "2.000:1",
        "Kontrast - statisch": "2.000:1",
        "Leistungsaufnahme": "220W (maximal),  25.9W (typisch),  keine Angabe (Energielabel alt A+++ bis G),  0.3W (Standby)",
        "Panel": "IPS (IPS Black)",
        "Panel-Hersteller": "LG Display",
        "Reaktionszeit - GtG": "5ms",
        "Screen-to-Body-Ratio": "93.1% (berechnet)",
        "Seitenverh\u00e4ltnis": "16:9",
        "Signalfrequenz": "15-140kHz (horizontal),  23-86Hz (vertikal)",
        "Stromversorgung": "AC-In (internes Netzteil)",
        "USB-Hub In": "1x USB-C 3.1 mit DisplayPort 1.4,  1x USB-C 3.1",
        "USB-Hub Out": "4x USB-A 3.1,  1x USB-A 3.1 (USB BC 1.2),  1x USB-C 3.1 (USB PD 15W)",
        "USB-Schreibweise": "Link",
        "VESA": "100x100 (belegt)",
        "Weitere Anschl\u00fcsse": "1x Gb LAN (RJ-45)"
    },
    "raw_specifications_text": "Anschl\u00fcsse - DisplayPort 1.4 60Hz@3840x2160: 1\nAnschl\u00fcsse - DisplayPort-Out 1.4 Daisy Chain: 1\nAnschl\u00fcsse - HDMI 2.0 60Hz@3840x2160: 1\nAnschl\u00fcsse - USB-C 3.1 mit DisplayPort 1.4 60Hz@3840x2160: 1\nAnwendung: station\u00e4r\nAudio: 1x Line-Out\nAufl\u00f6sung: 3840x2160\nBeschichtung: matt (non-glare),  H\u00e4rtegrad 3H\nBesonderheiten: Slim Bezel,  EPEAT Gold,  USB-C Power Delivery (90W),  mechanische Tasten mit Steuerkreuz,  Picture-in-Picture,  Sicherheitsschloss (Kensington),  KVM-Switch,  HDCP 2.2,  Werkskalibrierung (Delta-E <2),  TCO 9 zertifiziert\nBildwiederholfrequenz: 60Hz\nBlickwinkel: 178\u00b0/178\u00b0\nDiagonale: 27\"/68.6cm\nEnergieeffizienzklasse HDR (A bis G): E\nEnergieverbrauch HDR: 26kWh/1000h\nEnergieverbrauch SDR: 29kWh/1000h\nErgonomie: 150mm (h\u00f6henverstellbar),  \u00b190\u00b0 (Pivot),  \u00b145\u00b0 (drehbar),  +21\u00b0/-5\u00b0 (neigbar),  keine Angabe (Schr\u00e4glage)\nFarbe: schwarz\nFarbraum - DCI-P3: 98%\nFarbraum - REC 709: 100%\nFarbraum - sRGB: 100%\nFarbtiefe: 10bit (1.07 Mrd. Farben)\nForm: gerade (flat)\nFRC: unbekannt\nGewicht: 6.64kg (mit Standfu\u00df),  4.48kg (ohne Standfu\u00df)\nHDR: VESA DisplayHDR 400\nHelligkeit: 400cd/m\u00b2\nHerstellergarantie: drei Jahre\nHintergrundbeleuchtung: White-LED,  flicker-free,  Blaulichtfilter\nKontrast - dynamisch: 2.000:1\nKontrast - statisch: 2.000:1\nLeistungsaufnahme: 220W (maximal),  25.9W (typisch),  keine Angabe (Energielabel alt A+++ bis G),  0.3W (Standby)\nPanel: IPS (IPS Black)\nPanel-Hersteller: LG Display\nReaktionszeit - GtG: 5ms\nScreen-to-Body-Ratio: 93.1% (berechnet)\nSeitenverh\u00e4ltnis: 16:9\nSignalfrequenz: 15-140kHz (horizontal),  23-86Hz (vertikal)\nStromversorgung: AC-In (internes Netzteil)\nUSB-Hub In: 1x USB-C 3.1 mit DisplayPort 1.4,  1x USB-C 3.1\nUSB-Hub Out: 4x USB-A 3.1,  1x USB-A 3.1 (USB BC 1.2),  1x USB-C 3.1 (USB PD 15W)\nUSB-Schreibweise: Link\nVESA: 100x100 (belegt)\nWeitere Anschl\u00fcsse: 1x Gb LAN (RJ-45)",
    "reference_file": "offer_reference_1055.json",
    "shop_name": "e-tec.at"
}