{
    "html_file": "offer_1275_14.html",
    "name": "LC-Power LC-M32-QHD-165-C-K, 32\"",
    "offer_link": "https://www.amazon.de/dp/B09BS2Q8RF?linkCode=xm2&camp=2025&creative=165953&smid=A3JWKAKR8XB7XF&creativeASIN=B09BS2Q8RF&tag=geizhals1-21",
    "price": 448.18,
    "raw_specifications": {
        "ASIN": "B09BS2Q8RF",
        "Amazon Bestseller-Rang": "Nr. 156,645 in Computer & Zubeh\u00f6r (Siehe Top 100 in Computer & Zubeh\u00f6r)  Nr. 2,626 in Monitore",
        "Anzahl HDMI Schnittstellen": "\u200e3",
        "Anzahl USB 3.0 Schnittstellen": "\u200e3",
        "Artikelgewicht": "\u200e8,82 Kilograms",
        "Batterien enthalten": "\u200eNein",
        "Bildschirmaufl\u00f6sung": "\u200e2560 x 1440 pixels",
        "Display-Gr\u00f6\u00dfe": "\u200e32 Zoll",
        "Farbe": "\u200eWei\u00df",
        "Garantierte Software-Updates bis": "\u200eunbekannt",
        "Gewicht Lithium-Akku": "\u200e2 Gramm",
        "Hersteller": "\u200eLC Power",
        "Im Angebot von Amazon.de seit": "4. August 2021",
        "Kapazit\u00e4t Lithium-Akku": "\u200e2 Kilowattstunden",
        "L\u00f6sung": "\u200e2560 x 1440",
        "Marke": "\u200eLC-POWER",
        "Modell/Serie": "\u200eMONITOR LC-POWER DE 81,3 CM (32 \") LC-M32-QHD-165-CK CURVO",
        "Modellnummer": "\u200eLC-M32-QHD-165-C-K",
        "Produktabmessungen": "\u200e10 x 48 x 50 cm; 8,82 Kilogramm",
        "Volt": "\u200e220"
    },
    "raw_specifications_text": "Marke: \u200eLC-POWER\nHersteller: \u200eLC Power\nModell/Serie: \u200eMONITOR LC-POWER DE 81,3 CM (32 \") LC-M32-QHD-165-CK CURVO\nProduktabmessungen: \u200e10 x 48 x 50 cm; 8,82 Kilogramm\nModellnummer: \u200eLC-M32-QHD-165-C-K\nFarbe: \u200eWei\u00df\nDisplay-Gr\u00f6\u00dfe: \u200e32 Zoll\nBildschirmaufl\u00f6sung: \u200e2560 x 1440 pixels\nL\u00f6sung: \u200e2560 x 1440\nAnzahl USB 3.0 Schnittstellen: \u200e3\nAnzahl HDMI Schnittstellen: \u200e3\nVolt: \u200e220\nBatterien enthalten: \u200eNein\nKapazit\u00e4t Lithium-Akku: \u200e2 Kilowattstunden\nGewicht Lithium-Akku: \u200e2 Gramm\nArtikelgewicht: \u200e8,82 Kilograms\nGarantierte Software-Updates bis: \u200eunbekannt\nASIN: B09BS2Q8RF\nAmazon Bestseller-Rang: Nr. 156,645 in Computer & Zubeh\u00f6r (Siehe Top 100 in Computer & Zubeh\u00f6r)  Nr. 2,626 in Monitore\nIm Angebot von Amazon.de seit: 4. August 2021",
    "reference_file": "offer_reference_1275.json",
    "shop_name": "Amazon.at"
}