{
    "html_file": "offer_1562_16.html",
    "name": "AOC Q24V4EA, 23.8\"",
    "offer_link": "https://www.proshop.at/Bildschirm/AOC-24-Bildschirm-Q24V4EA-QHD-75Hz-Speakers-Black-4-ms/2993385?utm_source=geizhals&utm_medium=cpc&utm_campaign=pricesite",
    "price": 149.08,
    "raw_specifications": {
        "Abmessungen (Breite x Tiefe x H\u00f6he)": "61 cm x 16 cm x 41.4 cm - mit Fu\u00df",
        "Abmessungen (Breite x Tiefe x H\u00f6he) - mit Fu\u00df": "61 cm x 16 cm x 41.4 cm",
        "Ausgangsleistung/Kanal": "2 Watt",
        "Besonderheiten": "Low Blue Light Mode, flimmerfreie Technologie, ohne Quecksilber, Adaptive-Sync-Technologie, an 3 Seiten rahmenlos",
        "Bildschirmbeschichtung": "Blendfrei, 3H Hard Coating",
        "Bildschirmtyp": "IPS",
        "Details zu Abmessungen & Gewicht": "Mit Fu\u00df - Breite: 61 cm - Tiefe: 16 cm - H\u00f6he: 41.4 cm  Ohne Fu\u00df - Breite: 53.91 cm - Tiefe: 4.45 cm - H\u00f6he: 32.04 cm",
        "Diagonalabmessung": "60.5 cm (24\")",
        "Display-Typ": "LED-hintergrundbeleuchteter LCD-Monitor / TFT-Aktivmatrix",
        "EAN": "4038986149877",
        "Eingangsanschl\u00fcsse": "HDMI, DisplayPort",
        "Eingangsspannung": "Wechselstrom 120/230 V (50/60 Hz)",
        "Einstellungen der Anzeigeposition": "Neigung",
        "Energie Effizienzklasse": "Klasse F",
        "Farbe": "Schwarz",
        "Farbraum": "121% sRGB, 89% Adobe RGB",
        "Farbunterst\u00fctzung": "16,7 Millionen Farben",
        "Ger\u00e4tetyp": "LED-hintergrundbeleuchteter LCD-Monitor - 60.5 cm (24\")",
        "Gewicht": "3.45 kg",
        "Helligkeit": "250 cd/m\u00b2",
        "Hersteller": "AOC",
        "Hintergrundbeleuchtungs-Technologie": "WLED",
        "Horizontaler Betrachtungswinkel": "178",
        "Kennzeichnung": "HF",
        "Kontrast": "1000:1 / 20000000:1 (dynamisch)",
        "Leistungsaufnahme im Ein-Zustand": "22 W",
        "Leistungsmerkmale": "Slot f\u00fcr Sicherheitsschloss (Kabelschloss getrennt erh\u00e4ltlich)",
        "Modell": "Q24V4EA",
        "Native Aufl\u00f6sung": "QHD 2560 x 1440 bei 75 Hz",
        "Neigungswinkel": "-3.5/+21.5",
        "OSD-Sprachen": "Tschechisch, Chinesisch (tradionell), Chinesisch (vereinfacht), Englisch, Deutsch, Franz\u00f6sisch, Italienisch, Portugiesisch, Polnisch, Finnisch, Schwedisch, Russisch, Spanisch, Holl\u00e4ndisch, Japanisch, Koreanisch",
        "Ppi": "123",
        "Produktbeschreibung": "AOC Q24V4EA - LED-Monitor - QHD - 60.5 cm (24\")",
        "Reaktionszeit": "4 ms (gray-to-gray)",
        "Schlosstyp zur Diebstahlsicherung": "Kensington Slot",
        "Schnittstellen": "HDMI  DisplayPort 1.2  Kopfh\u00f6rer",
        "Seitenverh\u00e4ltnis": "16:9",
        "Sichtbare Bildfl\u00e4che": "60.5 cm (23.8\")",
        "Spannung": "Wechselstrom 120/230 V (50/60 Hz)",
        "Stromverbrauch (Aus-Modus)": "0.3 Watt",
        "Stromverbrauch (typisch)": "26 Watt",
        "Stromverbrauch SDR (eingeschaltet)": "22 kWh/1.000 h",
        "Stromverbrauch im Standby-Modus": "0.5 Watt",
        "Transportbreite": "61 cm",
        "Transportgewicht": "5.45 kg",
        "Transporth\u00f6he": "41.4 cm",
        "Transporttiefe": "16 cm",
        "Typ": "Lautsprecher - Stereo",
        "VESA-Halterung": "100 x 100 mm",
        "Vertikaler Betrachtungswinkel": "178",
        "Waren-Nr.": "2993385",
        "Zum Hersteller": "www.aoc.com"
    },
    "raw_specifications_text": "Hersteller: AOC\nWaren-Nr.: 2993385\nModell: Q24V4EA\nEAN: 4038986149877\nZum Hersteller: www.aoc.com\nProduktbeschreibung: AOC Q24V4EA - LED-Monitor - QHD - 60.5 cm (24\")\nGer\u00e4tetyp: LED-hintergrundbeleuchteter LCD-Monitor - 60.5 cm (24\")\nEnergie Effizienzklasse: Klasse F\nLeistungsaufnahme im Ein-Zustand: 22 W\nBildschirmtyp: IPS\nSeitenverh\u00e4ltnis: 16:9\nNative Aufl\u00f6sung: QHD 2560 x 1440 bei 75 Hz\nHelligkeit: 250 cd/m\u00b2\nKontrast: 1000:1 / 20000000:1 (dynamisch)\nReaktionszeit: 4 ms (gray-to-gray)\nFarbunterst\u00fctzung: 16,7 Millionen Farben\nFarbraum: 121% sRGB, 89% Adobe RGB\nEingangsanschl\u00fcsse: HDMI, DisplayPort\nEinstellungen der Anzeigeposition: Neigung\nBildschirmbeschichtung: Blendfrei, 3H Hard Coating\nSpannung: Wechselstrom 120/230 V (50/60 Hz)\nFarbe: Schwarz\nAbmessungen (Breite x Tiefe x H\u00f6he) - mit Fu\u00df: 61 cm x 16 cm x 41.4 cm\nGewicht: 3.45 kg\nKennzeichnung: HF\nDisplay-Typ: LED-hintergrundbeleuchteter LCD-Monitor / TFT-Aktivmatrix\nDiagonalabmessung: 60.5 cm (24\")\nSichtbare Bildfl\u00e4che: 60.5 cm (23.8\")\nPpi: 123\nHorizontaler Betrachtungswinkel: 178\nVertikaler Betrachtungswinkel: 178\nHintergrundbeleuchtungs-Technologie: WLED\nOSD-Sprachen: Tschechisch, Chinesisch (tradionell), Chinesisch (vereinfacht), Englisch, Deutsch, Franz\u00f6sisch, Italienisch, Portugiesisch, Polnisch, Finnisch, Schwedisch, Russisch, Spanisch, Holl\u00e4ndisch, Japanisch, Koreanisch\nBesonderheiten: Low Blue Light Mode, flimmerfreie Technologie, ohne Quecksilber, Adaptive-Sync-Technologie, an 3 Seiten rahmenlos\nAbmessungen (Breite x Tiefe x H\u00f6he): 61 cm x 16 cm x 41.4 cm - mit Fu\u00df\nTyp: Lautsprecher - Stereo\nAusgangsleistung/Kanal: 2 Watt\nSchnittstellen: HDMI  DisplayPort 1.2  Kopfh\u00f6rer\nNeigungswinkel: -3.5/+21.5\nVESA-Halterung: 100 x 100 mm\nLeistungsmerkmale: Slot f\u00fcr Sicherheitsschloss (Kabelschloss getrennt erh\u00e4ltlich)\nSchlosstyp zur Diebstahlsicherung: Kensington Slot\nEingangsspannung: Wechselstrom 120/230 V (50/60 Hz)\nStromverbrauch SDR (eingeschaltet): 22 kWh/1.000 h\nStromverbrauch (typisch): 26 Watt\nStromverbrauch im Standby-Modus: 0.5 Watt\nStromverbrauch (Aus-Modus): 0.3 Watt\nDetails zu Abmessungen & Gewicht: Mit Fu\u00df - Breite: 61 cm - Tiefe: 16 cm - H\u00f6he: 41.4 cm  Ohne Fu\u00df - Breite: 53.91 cm - Tiefe: 4.45 cm - H\u00f6he: 32.04 cm\nTransportbreite: 61 cm\nTransporttiefe: 16 cm\nTransporth\u00f6he: 41.4 cm\nTransportgewicht: 5.45 kg",
    "reference_file": "offer_reference_1562.json",
    "shop_name": "Proshop.at"
}