{
    "html_file": "offer_977_8.html",
    "name": "ViewSonic VA2715-H, 27\"",
    "offer_link": "https://direkt.jacob.de/produkte/viewsonic-va2715-h-68-58cm-va2715-h-artnr-7583613.html?utm_source=geizhals&utm_medium=cpc&utm_campaign=Preisvergleich&ref=103",
    "price": 142.03,
    "raw_specifications": {
        "AC Eingangsspannung": "100 - 240 V",
        "AMD FreeSync": "Ja",
        "AMD FreeSync-Typ": "FreeSync",
        "Anzahl HDMI-Anschl\u00fcsse": "1",
        "Anzahl VGA (D-Sub) Anschl\u00fcsse": "1",
        "Anzahl der Farben des Displays": "16,7 Millionen Farben",
        "Betriebstemperatur": "0 - 40 \u00b0C",
        "Bildschirmaufl\u00f6sung": "1920 x 1080 Pixel",
        "Bildschirmdiagonale": "68,6 cm (27\" )",
        "Bildschirmdiagonale (cm)": "68 cm",
        "Bildschirmform": "Flach",
        "Bildwinkel, horizontal": "178\u00b0",
        "Bildwinkel, vertikal": "178\u00b0",
        "Blendfreier Bildschirm": "Ja",
        "Bluetooth": "Nein",
        "Breite (ohne Standfu\u00df)": "61,3 cm",
        "Digital horizontale Frequenz": "24 - 86 kHz",
        "Digital vertikale Frequenz": "48 - 75 Hz",
        "Eingebaute Lautsprecher": "Nein",
        "Eingebauter Ethernet-Anschluss": "Nein",
        "Flimmerfreie Technologie": "Ja",
        "Fu\u00dffarbe": "Schwarz",
        "Ger\u00e4tebreite (inkl. Fu\u00df)": "613 mm",
        "Ger\u00e4teh\u00f6he (inkl. Fu\u00df)": "456 mm",
        "Ger\u00e4tetiefe (inkl. Fu\u00df)": "205 mm",
        "Gewicht (mit St\u00e4nder)": "3,6 kg",
        "Gewicht (ohne St\u00e4nder)": "3,1 kg",
        "HD-Typ": "Full HD",
        "HDMI": "Ja",
        "HDMI-Version": "1.4",
        "Helligkeit (typisch)": "250 cd/m\u00b2",
        "H\u00f6he (ohne Standfu\u00df)": "36,1 cm",
        "Integrierte Kamera": "Nein",
        "Integrierter USB-Hub": "Nein",
        "Kabelsperre-Slot": "Ja",
        "Kontrastverh\u00e4ltnis": "4000:1",
        "Kontrastverh\u00e4ltnis (dynamisch)": "50000000:1",
        "Kopfh\u00f6rer-Anschluss": "3,5 mm",
        "Kopfh\u00f6rerausgang": "Ja",
        "Kopfh\u00f6rerausg\u00e4nge": "1",
        "Low-Blue-Light-Technologie": "Ja",
        "Marktpositionierung": "Haus",
        "Maximale Bildwiederholrate": "75 Hz",
        "Mitgelieferte Kabel": "AC, Gleichstrom, HDMI",
        "NTSC Abdeckung (typisch)": "72%",
        "Nachhaltigkeitszertifikate": "CE, ErP, REACH, RoHS, WEEE",
        "Natives Seitenverh\u00e4ltnis": "16:9",
        "Neigungswinkelbereich": "5 - 20\u00b0",
        "Netzteiltyp": "Extern",
        "Oberfl\u00e4chenh\u00e4rte": "3H",
        "On-Screen-Display (OSD)": "Ja",
        "Paketgewicht": "5 kg",
        "Panel-Montage-Schnittstelle": "100 x 100 mm",
        "Panel-Typ": "VA",
        "Pixel Abstand": "0,311 x 0,311 mm",
        "Plug & Play": "Ja",
        "Produktfarbe": "Schwarz",
        "Reaktionszeit": "4 ms",
        "Relative Luftfeuchtigkeit in Betrieb": "20 - 90%",
        "Schnellstart\u00fcbersicht": "Ja",
        "Slot-Typ Kabelsperre": "Kensington",
        "Stromverbrauch (Standardbetrieb)": "17 W",
        "Stromverbrauch (Standby)": "0,5 W",
        "Stromverbrauch (max.)": "28 W",
        "St\u00e4nder enthalten": "Ja",
        "Tiefe (ohne Standfu\u00df)": "4 cm",
        "Touchscreen": "Nein",
        "Typ der Hintergrundbeleuchtung": "LED",
        "VESA Adaptive Sync unterst\u00fctzt": "Ja",
        "VESA-Halterung": "Ja",
        "Verpackungsart": "Box",
        "Verpackungsbreite": "688 mm",
        "Verpackungsh\u00f6he": "448 mm",
        "Verpackungstiefe": "128 mm",
        "WLAN": "Nein",
        "Zertifizierung": "cTUVus, FCC-B, ICES003, Energy Star, EPEAT, CEC, NOM, Mexico Energy, CE EMC, CB, EAC, UkrSEPRO, UKCA, BSMI",
        "kippbar": "Ja",
        "sRGB Abdeckung (klassisch)": "104%"
    },
    "raw_specifications_text": "Bildschirmdiagonale: 68,6 cm (27\" )\nBildschirmaufl\u00f6sung: 1920 x 1080 Pixel\nNatives Seitenverh\u00e4ltnis: 16:9\nTouchscreen: Nein\nHD-Typ: Full HD\nPanel-Typ: VA\nBildschirmform: Flach\nKontrastverh\u00e4ltnis: 4000:1\nMaximale Bildwiederholrate: 75 Hz\nAnzahl der Farben des Displays: 16,7 Millionen Farben\nTyp der Hintergrundbeleuchtung: LED\nHelligkeit (typisch): 250 cd/m\u00b2\nReaktionszeit: 4 ms\nBlendfreier Bildschirm: Ja\nKontrastverh\u00e4ltnis (dynamisch): 50000000:1\nBildwinkel, horizontal: 178\u00b0\nBildwinkel, vertikal: 178\u00b0\nPixel Abstand: 0,311 x 0,311 mm\nDigital horizontale Frequenz: 24 - 86 kHz\nDigital vertikale Frequenz: 48 - 75 Hz\nBildschirmdiagonale (cm): 68 cm\nOberfl\u00e4chenh\u00e4rte: 3H\nsRGB Abdeckung (klassisch): 104%\nNTSC Abdeckung (typisch): 72%\nAMD FreeSync: Ja\nAMD FreeSync-Typ: FreeSync\nVESA Adaptive Sync unterst\u00fctzt: Ja\nFlimmerfreie Technologie: Ja\nLow-Blue-Light-Technologie: Ja\nEingebaute Lautsprecher: Nein\nIntegrierte Kamera: Nein\nMarktpositionierung: Haus\nProduktfarbe: Schwarz\nFu\u00dffarbe: Schwarz\nZertifizierung: cTUVus, FCC-B, ICES003, Energy Star, EPEAT, CEC, NOM, Mexico Energy, CE EMC, CB, EAC, UkrSEPRO, UKCA, BSMI\nIntegrierter USB-Hub: Nein\nHDMI: Ja\nKopfh\u00f6rerausgang: Ja\nAnzahl VGA (D-Sub) Anschl\u00fcsse: 1\nAnzahl HDMI-Anschl\u00fcsse: 1\nHDMI-Version: 1.4\nKopfh\u00f6rerausg\u00e4nge: 1\nKopfh\u00f6rer-Anschluss: 3,5 mm\nWLAN: Nein\nBluetooth: Nein\nEingebauter Ethernet-Anschluss: Nein\nVESA-Halterung: Ja\nKabelsperre-Slot: Ja\nPanel-Montage-Schnittstelle: 100 x 100 mm\nSlot-Typ Kabelsperre: Kensington\nkippbar: Ja\nNeigungswinkelbereich: 5 - 20\u00b0\nOn-Screen-Display (OSD): Ja\nPlug & Play: Ja\nStromverbrauch (Standardbetrieb): 17 W\nStromverbrauch (Standby): 0,5 W\nStromverbrauch (max.): 28 W\nAC Eingangsspannung: 100 - 240 V\nNetzteiltyp: Extern\nBetriebstemperatur: 0 - 40 \u00b0C\nRelative Luftfeuchtigkeit in Betrieb: 20 - 90%\nSt\u00e4nder enthalten: Ja\nMitgelieferte Kabel: AC, Gleichstrom, HDMI\nSchnellstart\u00fcbersicht: Ja\nGer\u00e4tebreite (inkl. Fu\u00df): 613 mm\nGer\u00e4tetiefe (inkl. Fu\u00df): 205 mm\nGer\u00e4teh\u00f6he (inkl. Fu\u00df): 456 mm\nGewicht (mit St\u00e4nder): 3,6 kg\nBreite (ohne Standfu\u00df): 61,3 cm\nTiefe (ohne Standfu\u00df): 4 cm\nH\u00f6he (ohne Standfu\u00df): 36,1 cm\nGewicht (ohne St\u00e4nder): 3,1 kg\nVerpackungsbreite: 688 mm\nVerpackungstiefe: 128 mm\nVerpackungsh\u00f6he: 448 mm\nPaketgewicht: 5 kg\nVerpackungsart: Box\nNachhaltigkeitszertifikate: CE, ErP, REACH, RoHS, WEEE",
    "reference_file": "offer_reference_977.json",
    "shop_name": "Jacob Elektronik direkt (AT)"
}