{
    "html_file": "offer_1879_7.html",
    "name": "Lenovo ThinkVision T23i-20, 23\"",
    "offer_link": "https://www.csv-direct.de/artinfo.php?artnr=A1620711&KATEGORIE=162&pva=geizhals2",
    "price": 159.89,
    "raw_specifications": {
        "AC Eingangsfrequenz": "47/63 Hz",
        "AC Eingangsspannung": "100 - 240 V",
        "Anzahl DisplayPort Anschl\u00fcsse": "1",
        "Anzahl HDMI-Anschl\u00fcsse": "1",
        "Anzahl OSD-Sprachen": "8",
        "Anzahl VGA D-Sub Anschl\u00fcsse": "1",
        "Anzahl der Farben des Displays": "16,78 Millionen Farben",
        "Anzahl der nachgeschalteten Steckpl\u00e4tze vom Typ USB-A": "4",
        "Anzahl der vorgeschalteten Steckpl\u00e4tze": "1",
        "Audioanschl\u00fcsse": "Nein",
        "Bildschirmdiagonale": "58,4 cm 23\"",
        "Bildschirmform": "Flach",
        "Bildschirmtechnologie": "LED",
        "Bildwinkel, horizontal": "178\u00b0",
        "Bildwinkel, vertikal": "178\u00b0",
        "Breite ohne Standfu\u00df": "521,8 mm",
        "DVI Anschluss": "Nein",
        "Display-Aufl\u00f6sung": "1920 x 1080 Pixel",
        "DisplayPorts-Version": "1.2",
        "Eingebaute Lautsprecher": "Nein",
        "Energieeffizienzklasse SDR": "C",
        "Energieeffizienzskala": "A bis G",
        "Energieverbrauch SDR pro 1.000 Stunden": "11 kWh",
        "Fu\u00dffarbe": "Schwarz",
        "Ger\u00e4tebreite inkl. Fu\u00df": "521,8 mm",
        "Ger\u00e4teh\u00f6he inkl. Fu\u00df": "554,3 mm",
        "Ger\u00e4tetiefe inkl. Fu\u00df": "200 mm",
        "Gewicht mit St\u00e4nder": "5,59 kg",
        "Gewicht ohne St\u00e4nder": "3,32 kg",
        "HD-Typ": "Full HD",
        "HDMI-Version": "1.4",
        "Helligkeit typisch": "250 cd/m\u00b2",
        "H\u00f6he ohne Standfu\u00df": "316,3 mm",
        "Integrierte Kamera": "Nein",
        "Kontrastverh\u00e4ltnis": "1000:1",
        "Maximale Bildwiederholrate": "60 Hz",
        "NTSC Abdeckung typisch": "75",
        "Nachhaltigkeitszertifikate": "RoHS, EPEAT Silver, ENERGY STAR",
        "Name der Farbe": "Raven Black",
        "Natives Seitenverh\u00e4ltnis": "16:9",
        "Neigungswinkelbereich": "-5 - 35\u00b0",
        "Paketgewicht": "7,5 kg",
        "Panel-Montage-Schnittstelle": "100 x 100 mm",
        "Panel-Typ": "IPS",
        "Pivot Winkel": "-90 - 90\u00b0",
        "Pixel Abstand": "0,2652 x 0,2652 mm",
        "Pixeldichte": "95,78 ppi",
        "Produktfarbe": "Schwarz",
        "Reaktionszeit": "6 ms",
        "Reaktionszeit schnell": "4 ms",
        "Schwenkwinkelbereich": "-45 - 45\u00b0",
        "Seitenverh\u00e4ltnis": "16:9",
        "Sichtbare Gr\u00f6\u00dfe horizontal": "50,9 cm",
        "Sichtbare Gr\u00f6\u00dfe vertikal": "28,6 cm",
        "Slot-Typ Kabelsperre": "Kensington",
        "Stromverbrauch Standardbetrieb": "14,5 W",
        "Stromverbrauch Standby": "0,5 W",
        "Stromverbrauch aus": "0,3 W",
        "Tiefe ohne Standfu\u00df": "44,8 mm",
        "Touchscreen": "Nein",
        "Typ der Hintergrundbeleuchtung": "W-LED",
        "USB-Hub-Version": "3.2 Gen 1 3.1 Gen 1",
        "USB-Upstream-Porttyp": "USB Typ-B",
        "Unterst\u00fctzte Grafik-Aufl\u00f6sungen": "1920 x 1080 HD 1080",
        "Unterst\u00fctzte Video-Modi": "1080p",
        "Verpackungsbreite": "599 mm",
        "Verpackungsh\u00f6he": "387 mm",
        "Verpackungstiefe": "175 mm",
        "Vorderer Rahmen": "Schwarz",
        "Warentarifnummer HS": "85285210",
        "Zertifizierung": "CCC, TCO, TCO Edge, T\u00dcV"
    },
    "raw_specifications_text": "Bildschirmdiagonale: 58,4 cm 23\"\nDisplay-Aufl\u00f6sung: 1920 x 1080 Pixel\nNatives Seitenverh\u00e4ltnis: 16:9\nBildschirmtechnologie: LED\nTouchscreen: Nein\nHD-Typ: Full HD\nPanel-Typ: IPS\nBildschirmform: Flach\nKontrastverh\u00e4ltnis: 1000:1\nMaximale Bildwiederholrate: 60 Hz\nAnzahl der Farben des Displays: 16,78 Millionen Farben\nTyp der Hintergrundbeleuchtung: W-LED\nHelligkeit typisch: 250 cd/m\u00b2\nReaktionszeit: 6 ms\nUnterst\u00fctzte Grafik-Aufl\u00f6sungen: 1920 x 1080 HD 1080\nUnterst\u00fctzte Video-Modi: 1080p\nSeitenverh\u00e4ltnis: 16:9\nBildwinkel, horizontal: 178\u00b0\nBildwinkel, vertikal: 178\u00b0\nReaktionszeit schnell: 4 ms\nPixel Abstand: 0,2652 x 0,2652 mm\nPixeldichte: 95,78 ppi\nSichtbare Gr\u00f6\u00dfe horizontal: 50,9 cm\nSichtbare Gr\u00f6\u00dfe vertikal: 28,6 cm\nNTSC Abdeckung typisch: 75\nEingebaute Lautsprecher: Nein\nIntegrierte Kamera: Nein\nProduktfarbe: Schwarz\nName der Farbe: Raven Black\nVorderer Rahmen: Schwarz\nFu\u00dffarbe: Schwarz\nZertifizierung: CCC, TCO, TCO Edge, T\u00dcV\nUSB-Hub-Version: 3.2 Gen 1 3.1 Gen 1\nUSB-Upstream-Porttyp: USB Typ-B\nAnzahl der vorgeschalteten Steckpl\u00e4tze: 1\nAnzahl der nachgeschalteten Steckpl\u00e4tze vom Typ USB-A: 4\nAnzahl VGA D-Sub Anschl\u00fcsse: 1\nDVI Anschluss: Nein\nAnzahl HDMI-Anschl\u00fcsse: 1\nHDMI-Version: 1.4\nAnzahl DisplayPort Anschl\u00fcsse: 1\nDisplayPorts-Version: 1.2\nAudioanschl\u00fcsse: Nein\nPanel-Montage-Schnittstelle: 100 x 100 mm\nSlot-Typ Kabelsperre: Kensington\nPivot Winkel: -90 - 90\u00b0\nSchwenkwinkelbereich: -45 - 45\u00b0\nNeigungswinkelbereich: -5 - 35\u00b0\nAnzahl OSD-Sprachen: 8\nEnergieeffizienzklasse SDR: C\nEnergieverbrauch SDR pro 1.000 Stunden: 11 kWh\nStromverbrauch Standardbetrieb: 14,5 W\nStromverbrauch Standby: 0,5 W\nStromverbrauch aus: 0,3 W\nAC Eingangsspannung: 100 - 240 V\nAC Eingangsfrequenz: 47/63 Hz\nEnergieeffizienzskala: A bis G\nGer\u00e4tebreite inkl. Fu\u00df: 521,8 mm\nGer\u00e4tetiefe inkl. Fu\u00df: 200 mm\nGer\u00e4teh\u00f6he inkl. Fu\u00df: 554,3 mm\nGewicht mit St\u00e4nder: 5,59 kg\nBreite ohne Standfu\u00df: 521,8 mm\nTiefe ohne Standfu\u00df: 44,8 mm\nH\u00f6he ohne Standfu\u00df: 316,3 mm\nGewicht ohne St\u00e4nder: 3,32 kg\nVerpackungsbreite: 599 mm\nVerpackungstiefe: 175 mm\nVerpackungsh\u00f6he: 387 mm\nPaketgewicht: 7,5 kg\nNachhaltigkeitszertifikate: RoHS, EPEAT Silver, ENERGY STAR\nWarentarifnummer HS: 85285210",
    "reference_file": "offer_reference_1879.json",
    "shop_name": "CSV-Direct.de"
}