{
    "html_file": "offer_2050_16.html",
    "name": "Fujitsu P-Line P27-9 TS QHD, 27\"",
    "offer_link": "https://www.future-x.at/fujitsu-p27-9-ts-lcd-monitor-68-5-cm-27-qhd-ips-5-ms-lautsprecher-mattschwarz-p-8267714/?pv=2",
    "price": 492.7,
    "raw_specifications": {
        "Abmessungen (Breite x Tiefe x H\u00f6he)": "61,27 cm x 27,5 cm x 38,56 cm - mit Fu\u00df",
        "Besonderheiten": "Overdrive-Technologie, Auto Brightness Control, ECO-Taste, DisplayView, 100% sRGB-Farbskala, Low Blue Light Mode, Reihenschaltung m\u00f6glich, Auto Pivot, Workplace Lighting Guide, 24/7 Betriebsmodus",
        "Bildschirmbeschichtung": "Blendfrei, 3H Hard Coating",
        "Bildschirmtyp": "IPS",
        "Details zu Abmessungen & Gewicht": "Mit Fu\u00df - Breite: 61,27 cm - Tiefe: 27,5 cm - H\u00f6he: 38,56 cm - Gewicht: 7,61 kg \u00a6 Ohne Fu\u00df - Breite: 61,27 cm - Tiefe: 6,35 cm - H\u00f6he: 36,36 cm - Gewicht: 3,02 kg",
        "Display-Typ": "LED-hintergrundbeleuchteter LCD-MonitorDiagonalabmessung",
        "ENERGY STAR zertifiziert": "Ja",
        "ENERGY STAR-Version": "8.0",
        "EPEAT-kompatibel": "EPEAT Bronze",
        "Einstellungen der Anzeigeposition": "H\u00f6he, Pivot (Rotation), Drehelement, neigbar",
        "Enthaltene Kabel": "1 x DisplayPort-Kabel - 1.8 m \u00a6 1 x USB-C Kabel - 1 m \u00a6 1 x USB-Kabel Typ A auf Typ B - 1.8 m",
        "Farbe": "Mattschwarz",
        "Farbtemperatur": "5000K, 6500K, 7500K",
        "Farbunterst\u00fctzung": "16,7 Millionen Farben",
        "Gewicht": "7,61 kg",
        "Helligkeit": "350 cd/m\u00b2",
        "Hintergrundbeleuchtungs-Technologie": "LED-Hintergrundbeleuchtung",
        "Horizontale Bildwiederholrate": "30 - 100 kHz",
        "Horizontaler Betrachtungswinkel": "178",
        "H\u00f6heneinstellung": "150 mm",
        "Integrierte Peripherieger\u00e4te": "Pr\u00e4senzsensor, USB 3.1 Gen.1 Hub",
        "Kennzeichnung": "FCC Klasse B bescheinigt, TUV GS, BSMI, cUL, EN 60950, DDC/CI, RoHS, WEEE, S Mark, E-Standby, KC, Directive 2004/108/EEC, EAC, VESA MIS-D 100 C, TUV Rheinland Low Blue Light Certification, TUV Rheinland Flicker Free Certification, ISO 9241-307 Class 1",
        "Kontrast": "10:1",
        "Leistungsmerkmale": "Slot f\u00fcr Sicherheitsschloss (Kabelschloss getrennt erh\u00e4ltlich), Kabelf\u00fchrung, Always On-USB-Port",
        "Max. Betriebstemperatur": "35 \u00b0C",
        "Min Betriebstemperatur": "5 \u00b0C",
        "Native Aufl\u00f6sung": "QHD 2560 x 1440",
        "Neigungswinkel": "-5/+35",
        "OSD-Sprachen": "D\u00e4nisch, Tschechisch, Chinesisch (tradionell), Chinesisch (vereinfacht), Englisch, Deutsch, Franz\u00f6sisch, Italienisch, Norwegisch, Portugiesisch, Polnisch, Finnisch, Schwedisch, Russisch, Spanisch, Holl\u00e4ndisch, T\u00fcrkisch, Arabisch, Japanisch",
        "Pixelpitch": "0.233 mm",
        "Reaktionszeit": "5 ms",
        "Rotationswinkel": "90",
        "Schlosstyp zur Diebstahlsicherung": "Kensington SlotAbmessungen und Gewicht",
        "Schnittstellen": "DisplayPort-Ausgang \u00a6 DisplayPort (DisplayPort 1.2 Modus) \u00a6 HDMI \u00a6 Kopfh\u00f6rer \u00a6 Netzwerk \u00a6 3 x USB 3.1 Gen 1 Downstream (Typ A) \u00a6 USB 3.1 Gen 1 Downstream (Type C) \u00a6 USB-C 3.1 Gen 1 Upstream (bis zu 65 W) \u00a6 USB 3.1 Gen 1 Upstream (Typ B)",
        "Schwenkwinkel": "345",
        "Seitenverh\u00e4ltnis": "16:9",
        "Service & Support": "Begrenzte Garantie - 3 Jahre - Pick-Up & Return",
        "Transportbreite": "73,5 cm",
        "Transportgewicht": "9,87 kg",
        "Transporth\u00f6he": "47 cm",
        "Transporttiefe": "22,8 cm",
        "Typ": "Lautsprecher",
        "VESA-Halterung": "100 x 100 mm",
        "Vertikale Bildwiederholrate": "48 - 76 Hz",
        "Vertikaler Betrachtungswinkel": "178",
        "Zul\u00e4ssige Luftfeuchtigkeit im Betrieb": "10 \u2013 85% (nicht kondensierend)"
    },
    "raw_specifications_text": "Display-Typ: LED-hintergrundbeleuchteter LCD-MonitorDiagonalabmessung\nIntegrierte Peripherieger\u00e4te: Pr\u00e4senzsensor, USB 3.1 Gen.1 Hub\nBildschirmtyp: IPS\nSeitenverh\u00e4ltnis: 16:9\nNative Aufl\u00f6sung: QHD 2560 x 1440\nPixelpitch: 0.233 mm\nHelligkeit: 350 cd/m\u00b2\nKontrast: 10:1\nFarbunterst\u00fctzung: 16,7 Millionen Farben\nReaktionszeit: 5 ms\nVertikale Bildwiederholrate: 48 - 76 Hz\nHorizontale Bildwiederholrate: 30 - 100 kHz\nHorizontaler Betrachtungswinkel: 178\nVertikaler Betrachtungswinkel: 178\nBildschirmbeschichtung: Blendfrei, 3H Hard Coating\nHintergrundbeleuchtungs-Technologie: LED-Hintergrundbeleuchtung\nFarbtemperatur: 5000K, 6500K, 7500K\nOSD-Sprachen: D\u00e4nisch, Tschechisch, Chinesisch (tradionell), Chinesisch (vereinfacht), Englisch, Deutsch, Franz\u00f6sisch, Italienisch, Norwegisch, Portugiesisch, Polnisch, Finnisch, Schwedisch, Russisch, Spanisch, Holl\u00e4ndisch, T\u00fcrkisch, Arabisch, Japanisch\nBesonderheiten: Overdrive-Technologie, Auto Brightness Control, ECO-Taste, DisplayView, 100% sRGB-Farbskala, Low Blue Light Mode, Reihenschaltung m\u00f6glich, Auto Pivot, Workplace Lighting Guide, 24/7 Betriebsmodus\nFarbe: Mattschwarz\nAbmessungen (Breite x Tiefe x H\u00f6he): 61,27 cm x 27,5 cm x 38,56 cm - mit Fu\u00df\nGewicht: 7,61 kg\nTyp: Lautsprecher\nSchnittstellen: DisplayPort-Ausgang \u00a6 DisplayPort (DisplayPort 1.2 Modus) \u00a6 HDMI \u00a6 Kopfh\u00f6rer \u00a6 Netzwerk \u00a6 3 x USB 3.1 Gen 1 Downstream (Typ A) \u00a6 USB 3.1 Gen 1 Downstream (Type C) \u00a6 USB-C 3.1 Gen 1 Upstream (bis zu 65 W) \u00a6 USB 3.1 Gen 1 Upstream (Typ B)\nEinstellungen der Anzeigeposition: H\u00f6he, Pivot (Rotation), Drehelement, neigbar\nNeigungswinkel: -5/+35\nSchwenkwinkel: 345\nRotationswinkel: 90\nH\u00f6heneinstellung: 150 mm\nVESA-Halterung: 100 x 100 mm\nLeistungsmerkmale: Slot f\u00fcr Sicherheitsschloss (Kabelschloss getrennt erh\u00e4ltlich), Kabelf\u00fchrung, Always On-USB-Port\nEnthaltene Kabel: 1 x DisplayPort-Kabel - 1.8 m \u00a6 1 x USB-C Kabel - 1 m \u00a6 1 x USB-Kabel Typ A auf Typ B - 1.8 m\nKennzeichnung: FCC Klasse B bescheinigt, TUV GS, BSMI, cUL, EN 60950, DDC/CI, RoHS, WEEE, S Mark, E-Standby, KC, Directive 2004/108/EEC, EAC, VESA MIS-D 100 C, TUV Rheinland Low Blue Light Certification, TUV Rheinland Flicker Free Certification, ISO 9241-307 Class 1\nSchlosstyp zur Diebstahlsicherung: Kensington SlotAbmessungen und Gewicht\nDetails zu Abmessungen & Gewicht: Mit Fu\u00df - Breite: 61,27 cm - Tiefe: 27,5 cm - H\u00f6he: 38,56 cm - Gewicht: 7,61 kg \u00a6 Ohne Fu\u00df - Breite: 61,27 cm - Tiefe: 6,35 cm - H\u00f6he: 36,36 cm - Gewicht: 3,02 kg\nTransportbreite: 73,5 cm\nTransporttiefe: 22,8 cm\nTransporth\u00f6he: 47 cm\nTransportgewicht: 9,87 kg\nEPEAT-kompatibel: EPEAT Bronze\nENERGY STAR zertifiziert: Ja\nENERGY STAR-Version: 8.0\nService & Support: Begrenzte Garantie - 3 Jahre - Pick-Up & Return\nMin Betriebstemperatur: 5 \u00b0C\nMax. Betriebstemperatur: 35 \u00b0C\nZul\u00e4ssige Luftfeuchtigkeit im Betrieb: 10 \u2013 85% (nicht kondensierend)",
    "reference_file": "offer_reference_2050.json",
    "shop_name": "Future-X.at"
}