{
    "html_file": "offer_183_4.html",
    "name": "ASUS ProArt PA278CGV, 27\"",
    "offer_link": "https://www.amazon.de/dp/B0C7TDHNDP?linkCode=xm2&camp=2025&creative=165953&smid=A3JWKAKR8XB7XF&creativeASIN=B0C7TDHNDP&tag=geizhals1-21",
    "price": 395.76,
    "raw_specifications": {
        "ASIN": "B0C7TDHNDP",
        "Amazon Bestseller-Rang": "Nr. 11,490 in Computer & Zubeh\u00f6r (Siehe Top 100 in Computer & Zubeh\u00f6r)  Nr. 241 in Monitore",
        "Artikelgewicht": "\u200e11,9 Kilograms",
        "Batterien enthalten": "\u200eNein",
        "Bildschirmaufl\u00f6sung": "\u200e2560 x 1440",
        "Display-Gr\u00f6\u00dfe": "\u200e27 Zoll",
        "Durchschnittliche Kundenbewertung": "2,0  2,0 von 5 Sternen    \n    1 Sternebewertung   \n\n\n 2,0 von 5 Sternen",
        "Farbe": "\u200eSchwarz, Silber",
        "Garantierte Software-Updates bis": "\u200eunbekannt",
        "Hersteller": "\u200eASUS",
        "Im Angebot von Amazon.de seit": "15. Juni 2023",
        "L\u00f6sung": "\u200e2560 x 1440 Pixels",
        "Marke": "\u200eASUS",
        "Modell/Serie": "\u200ePA278CGV",
        "Modellnummer": "\u200ePA278CGV",
        "Produktabmessungen": "\u200e22,8 x 61,5 x 52,4 cm; 11,9 Kilogramm",
        "Prozessortyp": "\u200eOthers",
        "Volt": "\u200e240 Volt"
    },
    "raw_specifications_text": "Marke: \u200eASUS\nHersteller: \u200eASUS\nModell/Serie: \u200ePA278CGV\nProduktabmessungen: \u200e22,8 x 61,5 x 52,4 cm; 11,9 Kilogramm\nModellnummer: \u200ePA278CGV\nFarbe: \u200eSchwarz, Silber\nDisplay-Gr\u00f6\u00dfe: \u200e27 Zoll\nBildschirmaufl\u00f6sung: \u200e2560 x 1440\nL\u00f6sung: \u200e2560 x 1440 Pixels\nProzessortyp: \u200eOthers\nVolt: \u200e240 Volt\nBatterien enthalten: \u200eNein\nArtikelgewicht: \u200e11,9 Kilograms\nGarantierte Software-Updates bis: \u200eunbekannt\nASIN: B0C7TDHNDP\nDurchschnittliche Kundenbewertung: 2,0  2,0 von 5 Sternen    \n    1 Sternebewertung   \n\n\n 2,0 von 5 Sternen\nAmazon Bestseller-Rang: Nr. 11,490 in Computer & Zubeh\u00f6r (Siehe Top 100 in Computer & Zubeh\u00f6r)  Nr. 241 in Monitore\nIm Angebot von Amazon.de seit: 15. Juni 2023",
    "reference_file": "offer_reference_183.json",
    "shop_name": "Amazon.at"
}