{
    "html_file": "offer_1725_13.html",
    "name": "iiyama G-Master GB2470HSU-B1 Red Eagle, 23.8\"",
    "offer_link": "https://www.e-tec.at/details.php?artnr=309628",
    "price": 191.0,
    "raw_specifications": {
        "AMD FreeSync Premium": "Ja",
        "Abmessungen (BxHxT)": "539x395x256mm (mit Standfu\u00df),  539x323x45mm (ohne Standfu\u00df)",
        "Adaptive Sync": "Ja",
        "Anschl\u00fcsse - DisplayPort 1.2": "1",
        "Anschl\u00fcsse - HDMI 1.4": "1",
        "Anwendung": "station\u00e4r",
        "Audio": "Lautsprecher (2x 2W),  1x Line-Out",
        "Aufl\u00f6sung": "1920x1080",
        "Beschichtung": "matt (non-glare)",
        "Besonderheiten": "Slim Bezel,  mechanische Tasten,  Sicherheitsschloss (Kensington)",
        "Bildwiederholfrequenz": "165Hz",
        "Blickwinkel": "178\u00b0/178\u00b0",
        "Diagonale": "23.8\"/60.5cm",
        "Energieeffizienzklasse alt (A+++ bis D)": "A",
        "Energieeffizienzklasse alt (A+++ bis G)": "A",
        "Energieverbrauch SDR": "19kWh/1000h",
        "Ergonomie": "130mm (h\u00f6henverstellbar),  90\u00b0 (Pivot),  \u00b145\u00b0 (drehbar),  +18\u00b0/-3\u00b0 (neigbar),  keine Angabe (Schr\u00e4glage)",
        "FRC": "unbekannt",
        "Farbe": "schwarz",
        "Farbraum - sRGB": "99%",
        "Farbtiefe": "8bit (16.7 Mio. Farben)",
        "Form": "gerade (flat)",
        "Gewicht": "4.40kg (mit Standfu\u00df),  keine Angabe (ohne Standfu\u00df)",
        "HDR": "N/A",
        "Helligkeit": "250cd/m\u00b2",
        "Herstellergarantie": "drei Jahre (Abwicklung \u00fcber Hersteller,  Produktregistrierung innerhalb von 60 Tagen nach dem Kauf: Link,  Garantie-Informationen: Link)",
        "Hintergrundbeleuchtung": "White-LED,  flicker-free,  Blaulichtfilter",
        "Jahresverbrauch alt (A+++ bis D)": "27.74kWh",
        "Jahresverbrauch alt (A+++ bis G)": "27.74kWh",
        "Kontrast - dynamisch": "80.000.000:1",
        "Kontrast - statisch": "1.100:1",
        "Lautsprecher": "Ja",
        "Leistungsaufnahme": "keine Angabe (maximal),  20W (typisch),  19W (Energielabel alt A+++ bis G),  0.5W (Standby)",
        "Panel": "IPS",
        "Reaktionszeit - MPRT": "0.8ms",
        "Screen-to-Body-Ratio": "89.7% (berechnet)",
        "Seitenverh\u00e4ltnis": "16:9",
        "Signalfrequenz": "15-225kHz (horizontal),  48-165Hz (vertikal)",
        "Stromversorgung": "AC-In (internes Netzteil)",
        "USB-Hub In": "1x USB-B 2.0",
        "USB-Hub Out": "2x USB-A 2.0",
        "USB-Schreibweise": "Link",
        "VESA": "100x100 (belegt)",
        "VRR (Variable Refresh Rate)": "Adaptive Sync,  AMD FreeSync Premium (48-165Hz via DisplayPort,  48-144Hz via HDMI,  mit LFC-Support,  ohne HDR)",
        "Weitere Anschl\u00fcsse": "N/A"
    },
    "raw_specifications_text": "Abmessungen (BxHxT): 539x395x256mm (mit Standfu\u00df),  539x323x45mm (ohne Standfu\u00df)\nAdaptive Sync: Ja\nAMD FreeSync Premium: Ja\nAnschl\u00fcsse - DisplayPort 1.2: 1\nAnschl\u00fcsse - HDMI 1.4: 1\nAnwendung: station\u00e4r\nAudio: Lautsprecher (2x 2W),  1x Line-Out\nAufl\u00f6sung: 1920x1080\nBeschichtung: matt (non-glare)\nBesonderheiten: Slim Bezel,  mechanische Tasten,  Sicherheitsschloss (Kensington)\nBildwiederholfrequenz: 165Hz\nBlickwinkel: 178\u00b0/178\u00b0\nDiagonale: 23.8\"/60.5cm\nEnergieeffizienzklasse alt (A+++ bis D): A\nEnergieeffizienzklasse alt (A+++ bis G): A\nEnergieverbrauch SDR: 19kWh/1000h\nErgonomie: 130mm (h\u00f6henverstellbar),  90\u00b0 (Pivot),  \u00b145\u00b0 (drehbar),  +18\u00b0/-3\u00b0 (neigbar),  keine Angabe (Schr\u00e4glage)\nFarbe: schwarz\nFarbraum - sRGB: 99%\nFarbtiefe: 8bit (16.7 Mio. Farben)\nForm: gerade (flat)\nFRC: unbekannt\nGewicht: 4.40kg (mit Standfu\u00df),  keine Angabe (ohne Standfu\u00df)\nHDR: N/A\nHelligkeit: 250cd/m\u00b2\nHerstellergarantie: drei Jahre (Abwicklung \u00fcber Hersteller,  Produktregistrierung innerhalb von 60 Tagen nach dem Kauf: Link,  Garantie-Informationen: Link)\nHintergrundbeleuchtung: White-LED,  flicker-free,  Blaulichtfilter\nJahresverbrauch alt (A+++ bis D): 27.74kWh\nJahresverbrauch alt (A+++ bis G): 27.74kWh\nKontrast - dynamisch: 80.000.000:1\nKontrast - statisch: 1.100:1\nLautsprecher: Ja\nLeistungsaufnahme: keine Angabe (maximal),  20W (typisch),  19W (Energielabel alt A+++ bis G),  0.5W (Standby)\nPanel: IPS\nReaktionszeit - MPRT: 0.8ms\nScreen-to-Body-Ratio: 89.7% (berechnet)\nSeitenverh\u00e4ltnis: 16:9\nSignalfrequenz: 15-225kHz (horizontal),  48-165Hz (vertikal)\nStromversorgung: AC-In (internes Netzteil)\nUSB-Hub In: 1x USB-B 2.0\nUSB-Hub Out: 2x USB-A 2.0\nUSB-Schreibweise: Link\nVESA: 100x100 (belegt)\nVRR (Variable Refresh Rate): Adaptive Sync,  AMD FreeSync Premium (48-165Hz via DisplayPort,  48-144Hz via HDMI,  mit LFC-Support,  ohne HDR)\nWeitere Anschl\u00fcsse: N/A",
    "reference_file": "offer_reference_1725.json",
    "shop_name": "e-tec.at"
}