{
    "html_file": "offer_1156_4.html",
    "name": "Acer Nitro XZ0 XZ240QPbmiiphzx, 23.6\"",
    "offer_link": "https://www.taufnaus.de/product/10603406",
    "price": 196.98,
    "raw_specifications": {
        "Abmessungen (Breite x Tiefe x H\u00f6he)": "53.555 cm x 23.365 cm x 38.338 cm",
        "Adaptive-Sync Technologie": "AMD FreeSync Premium",
        "Ausgangsleistung/Kanal": "2 Watt",
        "Besonderheiten": "Acer Adaptive Contrast Management (ACM), ComfyView, Zero Frame, Acer BluelightShield-Technologie, Acer Display Widget",
        "Bildschirmbeschichtung": "Blendfrei",
        "Bildschirmtyp": "VA",
        "Diagonalabmessung": "60 cm (23.6\")",
        "Display-Typ": "LCD-Monitor / TFT-Aktivmatrix",
        "Eingangsspannung": "Wechselstrom 100-240 V (50/60 Hz)",
        "Einstellungen der Anzeigeposition": "H\u00f6he, Drehung, Neigung",
        "Energierverbrauch Sleep": "0.5 Watt",
        "Enthaltene Kabel": "1 x HDMI-Kabel \u00a6 1 x USB-Kabel",
        "Farbe": "Schwarz",
        "Farbunterst\u00fctzung": "16,7 Millionen Farben",
        "Geschwungener Bildschirm": "Ja",
        "Gewicht": "5.05 kg",
        "HDR-Format": "HDR10",
        "Helligkeit": "250 cd/m\u00b2",
        "Horizontale Bildwiederholrate": "31 - 184 kHz",
        "Horizontaler Betrachtungswinkel": "178",
        "H\u00f6heneinstellung": "120 mm",
        "Integrierte Peripherieger\u00e4te": "USB 2.0 Hub",
        "Kennzeichnung": "MPR II, DDC-2B/CI",
        "Kontrast": "100000000:1 (dynamisch)",
        "Leistungsaufnahme im Ein-Zustand": "21 W",
        "Leistungsmerkmale": "Unterst\u00fctzung f\u00fcr VESA-Schnittstelle",
        "Max. Betriebstemperatur": "40 \u00b0C",
        "Min Betriebstemperatur": "0 \u00b0C",
        "Native Aufl\u00f6sung": "Full HD (1080p) 1920 x 1080 bei 165 Hz",
        "Neigungswinkel": "-5/+25",
        "Pixelpitch": "0.271 mm",
        "Reaktionszeit": "1 ms (VRB)",
        "Schnittstellen": "2 x HDMI \u00a6 DisplayPort \u00a6 Audio Line-Out \u00a6 USB 2.0 Upstream \u00a6 2 x USB 2.0 Downstream",
        "Schwenkwinkel": "360",
        "Seitenverh\u00e4ltnis": "16:9",
        "Stromverbrauch (Aus-Modus)": "0.3 Watt",
        "Typ": "Lautsprecher - Stereo",
        "VESA-Halterung": "100 x 100 mm",
        "Vertikale Bildwiederholrate": "48 - 165 Hz",
        "Vertikaler Betrachtungswinkel": "178",
        "Zul\u00e4ssige Luftfeuchtigkeit im Betrieb": "20 - 80%"
    },
    "raw_specifications_text": "Display-Typ: LCD-Monitor / TFT-Aktivmatrix\nDiagonalabmessung: 60 cm (23.6\")\nGeschwungener Bildschirm: Ja\nAdaptive-Sync Technologie: AMD FreeSync Premium\nIntegrierte Peripherieger\u00e4te: USB 2.0 Hub\nBildschirmtyp: VA\nSeitenverh\u00e4ltnis: 16:9\nNative Aufl\u00f6sung: Full HD (1080p) 1920 x 1080 bei 165 Hz\nPixelpitch: 0.271 mm\nHelligkeit: 250 cd/m\u00b2\nKontrast: 100000000:1 (dynamisch)\nHDR-Format: HDR10\nFarbunterst\u00fctzung: 16,7 Millionen Farben\nReaktionszeit: 1 ms (VRB)\nVertikale Bildwiederholrate: 48 - 165 Hz\nHorizontale Bildwiederholrate: 31 - 184 kHz\nHorizontaler Betrachtungswinkel: 178\nVertikaler Betrachtungswinkel: 178\nBildschirmbeschichtung: Blendfrei\nBesonderheiten: Acer Adaptive Contrast Management (ACM), ComfyView, Zero Frame, Acer BluelightShield-Technologie, Acer Display Widget\nFarbe: Schwarz\nAbmessungen (Breite x Tiefe x H\u00f6he): 53.555 cm x 23.365 cm x 38.338 cm\nGewicht: 5.05 kg\nTyp: Lautsprecher - Stereo\nAusgangsleistung/Kanal: 2 Watt\nSchnittstellen: 2 x HDMI \u00a6 DisplayPort \u00a6 Audio Line-Out \u00a6 USB 2.0 Upstream \u00a6 2 x USB 2.0 Downstream\nEinstellungen der Anzeigeposition: H\u00f6he, Drehung, Neigung\nNeigungswinkel: -5/+25\nSchwenkwinkel: 360\nH\u00f6heneinstellung: 120 mm\nVESA-Halterung: 100 x 100 mm\nLeistungsmerkmale: Unterst\u00fctzung f\u00fcr VESA-Schnittstelle\nEnthaltene Kabel: 1 x HDMI-Kabel \u00a6 1 x USB-Kabel\nKennzeichnung: MPR II, DDC-2B/CI\nEingangsspannung: Wechselstrom 100-240 V (50/60 Hz)\nLeistungsaufnahme im Ein-Zustand: 21 W\nEnergierverbrauch Sleep: 0.5 Watt\nStromverbrauch (Aus-Modus): 0.3 Watt\nMin Betriebstemperatur: 0 \u00b0C\nMax. Betriebstemperatur: 40 \u00b0C\nZul\u00e4ssige Luftfeuchtigkeit im Betrieb: 20 - 80%",
    "reference_file": "offer_reference_1156.json",
    "shop_name": "TaufNaus"
}