{
    "html_file": "offer_633_6.html",
    "name": "iiyama ProLite XUB2792HSU-B5, 27\"",
    "offer_link": "https://www.office-partner.de/productredirect/index/sku/25932884?sPartner=p-geizhals-at&campaign=psm/geizhals-at/",
    "price": 161.69,
    "raw_specifications": {
        "Anschl\u00fcsse": "HDMI, DisplayPort, USB, VGA/D-Sub, Kopfh\u00f6reranschluss",
        "Artikelnummer": "25932884",
        "Aufl\u00f6sung Kurzname": "Full HD",
        "Bezeichnung des Herstellers": "Iiyama ProLite XUB2792HSU-B5 68,6 cm (27\")",
        "Breite": "2095,00 mm",
        "Display Features": "FlickerFree",
        "Displaygr\u00f6\u00dfe": "68,58 cm (27 Zoll)",
        "Displayoberfl\u00e4che": "matt",
        "EEK - Spektrum": "AG",
        "Energieeffizienzklasse": "E",
        "Geh\u00e4usefarbe des Ger\u00e4tes": "Schwarz",
        "Gewicht": "6,30 kg",
        "Gewicht inkl. Verpackung in Kg": "7,20 kg",
        "Helligkeit Bereich": "150 - 300 cd/m\u00b2",
        "Hersteller": "Iiyama",
        "H\u00f6he": "3935,00 mm",
        "Kapazit\u00e4t (Seiten)": "0",
        "Kontrastverh\u00e4ltnis (typisch) Bereich": "800:1 bis 1.200:1",
        "LCD-Technologie": "IPS Panel",
        "L\u00e4nge": "612,00 mm",
        "Produktart": "Monitore",
        "Reaktionszeit": "4,00 ms",
        "Seitenverh\u00e4ltnis": "16:9",
        "Shop Herstellernummer": "XUB2792HSU-B5",
        "Standard-EAN": "4948570121298",
        "Verpackung - Breite in cm": "44,00 cm",
        "Verpackung - H\u00f6he in cm": "17,00 cm",
        "Verpackung - L\u00e4nge in cm": "96,30 cm",
        "max. Aufl\u00f6sung": "1.920 x 1.080 Pixel (16:9)"
    },
    "raw_specifications_text": "Energieeffizienzklasse: E\nDisplaygr\u00f6\u00dfe: 68,58 cm (27 Zoll)\nGeh\u00e4usefarbe des Ger\u00e4tes: Schwarz\nAnschl\u00fcsse: HDMI, DisplayPort, USB, VGA/D-Sub, Kopfh\u00f6reranschluss\nKontrastverh\u00e4ltnis (typisch) Bereich: 800:1 bis 1.200:1\nDisplay Features: FlickerFree\nHelligkeit Bereich: 150 - 300 cd/m\u00b2\nHersteller: Iiyama\nGewicht: 6,30 kg\nProduktart: Monitore\nAufl\u00f6sung Kurzname: Full HD\nKapazit\u00e4t (Seiten): 0\nEEK - Spektrum: AG\nVerpackung - H\u00f6he in cm: 17,00 cm\nGewicht inkl. Verpackung in Kg: 7,20 kg\nVerpackung - Breite in cm: 44,00 cm\nL\u00e4nge: 612,00 mm\nArtikelnummer: 25932884\nStandard-EAN: 4948570121298\nShop Herstellernummer: XUB2792HSU-B5\nBezeichnung des Herstellers: Iiyama ProLite XUB2792HSU-B5 68,6 cm (27\")\nBreite: 2095,00 mm\nH\u00f6he: 3935,00 mm\nVerpackung - L\u00e4nge in cm: 96,30 cm\nmax. Aufl\u00f6sung: 1.920 x 1.080 Pixel (16:9)\nSeitenverh\u00e4ltnis: 16:9\nLCD-Technologie: IPS Panel\nReaktionszeit: 4,00 ms\nDisplayoberfl\u00e4che: matt",
    "reference_file": "offer_reference_633.json",
    "shop_name": "office-partner (AT)"
}