{
    "html_file": "offer_927_6.html",
    "name": "LG DualUp 28MQ780-B, 27.6\"",
    "offer_link": "https://www.proshop.at/Bildschirm/LG-28-Bildschirm-DualUp-Ergo-28MQ780-B-SDQHD-2560x2880-USB-96W-Hub-Speakers-Black-5-ms/3102778?utm_source=geizhals&utm_medium=cpc&utm_campaign=pricesite",
    "price": 551.06,
    "raw_specifications": {
        "Abmessungen (Breite x Tiefe x H\u00f6he)": "48.15 cm x 46.13 cm x 84.32 cm - mit Fu\u00df",
        "Abmessungen (Breite x Tiefe x H\u00f6he) - mit Fu\u00df": "48.15 cm x 46.13 cm x 84.32 cm",
        "Ausgangsleistung/Kanal": "7 Watt",
        "Besonderheiten": "Umgebungslichtsensor, Auto Brightness Control, Flicker Safe, Reader Mode, PBP, gro\u00dfe Farbskala, Color Calibrated, Black Stabilizer, DAS Mode (Dynamic Action Sync), Color Weakness Mode, Bluetooth Audio, One Click Stand, Super Resolution+, Rich Bass, nahezu rahmenloses Display an 3 Seiten, IPS Nano Colour-Technologie, 10-bit (8-bit + FRC) Farbtiefe, HDR Effect, Auto Input Switch, ergonomischer St\u00e4nder, Blaulichtfilter, Global Dimming",
        "Bildschirmbeschichtung": "Blendfrei",
        "Bildschirmtyp": "Nano IPS",
        "Details zu Abmessungen & Gewicht": "Mit Fu\u00df - Breite: 48.15 cm - Tiefe: 46.13 cm - H\u00f6he: 84.32 cm - Gewicht: 9 kg  Ohne Fu\u00df - Breite: 48.15 cm - Tiefe: 4.49 cm - H\u00f6he: 54.95 cm - Gewicht: 4.35 kg",
        "Diagonalabmessung": "71.1 cm (28\")",
        "Display-Typ": "LED-hintergrundbeleuchteter LCD-Monitor / TFT-Aktivmatrix",
        "EAN": "8806091661166",
        "ENERGY STAR zertifiziert": "Ja",
        "ENERGY STAR-Version": "8.0",
        "Eingangsanschl\u00fcsse": "2xHDMI, DisplayPort, USB-C",
        "Eingangsspannung": "Wechselstrom 100/240 V (50/60 Hz)",
        "Einstellungen der Anzeigeposition": "H\u00f6he, Pivot (Rotation), Drehung, Neigung, ausfahren, einfahren",
        "Energie Effizienzklasse": "Klasse G",
        "Energieklasse (HDR)": "Klasse G",
        "Energierverbrauch Sleep": "0.5 Watt",
        "Enthaltene Kabel": "1 x HDMI-Kabel  1 x DisplayPort-Kabel  1 x USB-C Kabel - 1 m  1 x USB-C auf USB-A Adapter  1 x USB Upstream-Kabel - 1.8 m  1 x Gleichstrom-Verl\u00e4ngerungskabel - 1.4 m",
        "Farbe": "Charcoal Gray, strukturiert",
        "Farbraum": "98% DCI-P3 (CIE 1976)",
        "Farbunterst\u00fctzung": "1,07 Mrd. Farben",
        "Ger\u00e4tetyp": "LED-hintergrundbeleuchteter LCD-Monitor - 71.1 cm (28\")",
        "Gewicht": "9 kg",
        "HDR-Format": "HDR10",
        "HDR-f\u00e4hig": "HDR10",
        "Helligkeit": "300 cd/m\u00b2",
        "Hersteller": "LG",
        "Hintergrundbeleuchtungs-Technologie": "LED-Hintergrundbeleuchtung",
        "Horizontaler Betrachtungswinkel": "178",
        "H\u00f6heneinstellung": "130 mm",
        "Integrierte Peripherieger\u00e4te": "KVM-Switch, USB 3.0-Hub",
        "Kennzeichnung": "FCC Klasse B bescheinigt, UL, TUV, VCCI, cUL, CB, CCC, RoHS, REACH, CEC, KC, ERP, BIS, EPA 7.0, TUV Rheinland Eyesafe Display",
        "Kontrast": "1000:1",
        "Leistungsmerkmale": "Slot f\u00fcr Sicherheitsschloss (Kabelschloss getrennt erh\u00e4ltlich)",
        "Mitgelieferte Software": "Dual Controller Software, LG On Screen Display",
        "Modell": "28MQ780-B",
        "Native Aufl\u00f6sung": "SDQHD 2560 x 2880 bei 60 Hz",
        "Neigungswinkel": "-25/+25",
        "Pixelpitch": "0.18195 mm",
        "Produktbeschreibung": "LG DualUp Ergo 28MQ780-B - LED-Monitor - 71.1 cm (28\") - HDR",
        "Reaktionszeit": "5 ms (Gray-to-Gray)",
        "Rotationswinkel": "90",
        "Schlosstyp zur Diebstahlsicherung": "Kensington Slot",
        "Schnittstellen": "2 x HDMI  DisplayPort 1.4  USB-C/DisplayPort Alt Mode (bis zu 96 W)  Kopfh\u00f6rer",
        "Schwenkwinkel": "670",
        "Seitenverh\u00e4ltnis": "16:18",
        "Sichtbare Bildfl\u00e4che": "70.1 cm (27.6\")",
        "Spannung": "Wechselstrom 100/240 V (50/60 Hz)",
        "Stromverbrauch (Aus-Modus)": "0.3 Watt",
        "Stromverbrauch HDR (eingeschaltet)": "41 kWh/1.000 h",
        "Stromverbrauch SDR (eingeschaltet)": "30 kWh/1.000 h",
        "Transportbreite": "74.5 cm",
        "Transportgewicht": "12.9 kg",
        "Transporth\u00f6he": "55.7 cm",
        "Transporttiefe": "24.1 cm",
        "Typ": "Lautsprecher - Stereo",
        "USB-Spannungsversorgung": "96 Watt",
        "Umweltschutzstandards": "ENERGY STAR-qualifiziert",
        "VESA-Halterung": "100 x 100 mm",
        "Vertikaler Betrachtungswinkel": "178",
        "Waren-Nr.": "3102778",
        "Zum Hersteller": "www.lge.com"
    },
    "raw_specifications_text": "Hersteller: LG\nWaren-Nr.: 3102778\nModell: 28MQ780-B\nEAN: 8806091661166\nZum Hersteller: www.lge.com\nProduktbeschreibung: LG DualUp Ergo 28MQ780-B - LED-Monitor - 71.1 cm (28\") - HDR\nGer\u00e4tetyp: LED-hintergrundbeleuchteter LCD-Monitor - 71.1 cm (28\")\nEnergie Effizienzklasse: Klasse G\nLeistungsmerkmale: Slot f\u00fcr Sicherheitsschloss (Kabelschloss getrennt erh\u00e4ltlich)\nBildschirmtyp: Nano IPS\nSeitenverh\u00e4ltnis: 16:18\nNative Aufl\u00f6sung: SDQHD 2560 x 2880 bei 60 Hz\nPixelpitch: 0.18195 mm\nHelligkeit: 300 cd/m\u00b2\nKontrast: 1000:1\nHDR-f\u00e4hig: HDR10\nReaktionszeit: 5 ms (Gray-to-Gray)\nFarbunterst\u00fctzung: 1,07 Mrd. Farben\nFarbraum: 98% DCI-P3 (CIE 1976)\nEingangsanschl\u00fcsse: 2xHDMI, DisplayPort, USB-C\nEinstellungen der Anzeigeposition: H\u00f6he, Pivot (Rotation), Drehung, Neigung, ausfahren, einfahren\nBildschirmbeschichtung: Blendfrei\nSpannung: Wechselstrom 100/240 V (50/60 Hz)\nFarbe: Charcoal Gray, strukturiert\nAbmessungen (Breite x Tiefe x H\u00f6he) - mit Fu\u00df: 48.15 cm x 46.13 cm x 84.32 cm\nGewicht: 9 kg\nUmweltschutzstandards: ENERGY STAR-qualifiziert\nKennzeichnung: FCC Klasse B bescheinigt, UL, TUV, VCCI, cUL, CB, CCC, RoHS, REACH, CEC, KC, ERP, BIS, EPA 7.0, TUV Rheinland Eyesafe Display\nDisplay-Typ: LED-hintergrundbeleuchteter LCD-Monitor / TFT-Aktivmatrix\nEnergieklasse (HDR): Klasse G\nDiagonalabmessung: 71.1 cm (28\")\nSichtbare Bildfl\u00e4che: 70.1 cm (27.6\")\nIntegrierte Peripherieger\u00e4te: KVM-Switch, USB 3.0-Hub\nUSB-Spannungsversorgung: 96 Watt\nHDR-Format: HDR10\nHorizontaler Betrachtungswinkel: 178\nVertikaler Betrachtungswinkel: 178\nHintergrundbeleuchtungs-Technologie: LED-Hintergrundbeleuchtung\nBesonderheiten: Umgebungslichtsensor, Auto Brightness Control, Flicker Safe, Reader Mode, PBP, gro\u00dfe Farbskala, Color Calibrated, Black Stabilizer, DAS Mode (Dynamic Action Sync), Color Weakness Mode, Bluetooth Audio, One Click Stand, Super Resolution+, Rich Bass, nahezu rahmenloses Display an 3 Seiten, IPS Nano Colour-Technologie, 10-bit (8-bit + FRC) Farbtiefe, HDR Effect, Auto Input Switch, ergonomischer St\u00e4nder, Blaulichtfilter, Global Dimming\nAbmessungen (Breite x Tiefe x H\u00f6he): 48.15 cm x 46.13 cm x 84.32 cm - mit Fu\u00df\nTyp: Lautsprecher - Stereo\nAusgangsleistung/Kanal: 7 Watt\nSchnittstellen: 2 x HDMI  DisplayPort 1.4  USB-C/DisplayPort Alt Mode (bis zu 96 W)  Kopfh\u00f6rer\nNeigungswinkel: -25/+25\nSchwenkwinkel: 670\nRotationswinkel: 90\nH\u00f6heneinstellung: 130 mm\nVESA-Halterung: 100 x 100 mm\nEnthaltene Kabel: 1 x HDMI-Kabel  1 x DisplayPort-Kabel  1 x USB-C Kabel - 1 m  1 x USB-C auf USB-A Adapter  1 x USB Upstream-Kabel - 1.8 m  1 x Gleichstrom-Verl\u00e4ngerungskabel - 1.4 m\nSchlosstyp zur Diebstahlsicherung: Kensington Slot\nEingangsspannung: Wechselstrom 100/240 V (50/60 Hz)\nStromverbrauch SDR (eingeschaltet): 30 kWh/1.000 h\nStromverbrauch HDR (eingeschaltet): 41 kWh/1.000 h\nEnergierverbrauch Sleep: 0.5 Watt\nStromverbrauch (Aus-Modus): 0.3 Watt\nMitgelieferte Software: Dual Controller Software, LG On Screen Display\nDetails zu Abmessungen & Gewicht: Mit Fu\u00df - Breite: 48.15 cm - Tiefe: 46.13 cm - H\u00f6he: 84.32 cm - Gewicht: 9 kg  Ohne Fu\u00df - Breite: 48.15 cm - Tiefe: 4.49 cm - H\u00f6he: 54.95 cm - Gewicht: 4.35 kg\nTransportbreite: 74.5 cm\nTransporttiefe: 24.1 cm\nTransporth\u00f6he: 55.7 cm\nTransportgewicht: 12.9 kg\nENERGY STAR zertifiziert: Ja\nENERGY STAR-Version: 8.0",
    "reference_file": "offer_reference_927.json",
    "shop_name": "Proshop.at"
}