{
    "html_file": "offer_2426_6.html",
    "name": "Philips S-line 223S7EHMB, 21.5\"",
    "offer_link": "https://www.future-x.at/philips-s-line-223s7ehmb-led-monitor-55-9-cm-22-215-sichtbar-1920-x-1200-ips-5-ms-hdmi-vga-lautsprecher-textured-black-p-526133/?pv=2",
    "price": 205.6,
    "raw_specifications": {
        "Abmessungen (Breite x Tiefe x H\u00f6he)": "49 cm x 20,2 cm x 45,5 cm - mit Fu\u00df",
        "Ausgangsleistung/Kanal": "2 Watt",
        "Besonderheiten": "Sync-on-Green, sRGB-Farbmanagement, SmartContrast, SmartImage, On-screen Digital Controls, Low Blue Light Mode, flimmerfreie Technologie, BFR/PVC-frei, SoftBlue-Technologie, EasyRead, 68% NTSC-Farbskala (CIE 1931)",
        "Bildschirmtyp": "IPS",
        "Details zu Abmessungen & Gewicht": "Mit Fu\u00df - Breite: 49 cm - Tiefe: 20,2 cm - H\u00f6he: 45,5 cm - Gewicht: 4,51 kg \u00a6 Ohne Fu\u00df - Breite: 49 cm - Tiefe: 4,5 cm - H\u00f6he: 29,6 cm - Gewicht: 2,63 kg",
        "Diagonalabmessung": "55,9 cm (22\")",
        "Display-Typ": "LED-hintergrundbeleuchteter LCD-Monitor / TFT-Aktivmatrix",
        "ENERGY STAR zertifiziert": "Ja",
        "Einstellungen der Anzeigeposition": "H\u00f6he, Pivot (Rotation), Drehelement, neigbar",
        "Erforderliches Betriebssystem": "Apple MacOS X, Microsoft Windows 7 / 8 / 8.1 / 10",
        "Farbe": "Textured Black",
        "Farbunterst\u00fctzung": "16,7 Millionen Farben",
        "Gewicht": "4,51 kg",
        "Hintergrundbeleuchtungs-Technologie": "LED-Hintergrundbeleuchtung",
        "Horizontale Bildwiederholrate": "30 - 83 kHz",
        "Horizontaler Betrachtungswinkel": "178",
        "H\u00f6heneinstellung": "130 mm",
        "Kennzeichnung": "Plug and Play, FCC Klasse B bescheinigt, ICES-003, SEMKO, CCC, PSB, DDC/CI, RoHS, ISO 9241-307, WEEE, EPA, TCO Displays, cETLus, CU-EACSoftware / Systemanforderungen",
        "Kontrast": "20000000:1 (dynamisch)",
        "Leistungsmerkmale": "Slot f\u00fcr Sicherheitsschloss (Kabelschloss getrennt erh\u00e4ltlich)",
        "Max. Betriebstemperatur": "40 \u00b0C",
        "Min Betriebstemperatur": "0 \u00b0C",
        "Native Aufl\u00f6sung": "1920 x 1200 bei 60 Hz",
        "Neigungswinkel": "-5/+20",
        "OSD-Sprachen": "Ungarisch, Tschechisch, Chinesisch (tradionell), Chinesisch (vereinfacht), Ukrainisch, Brasilianisches Portugiesisch, Englisch, Deutsch, Franz\u00f6sisch, Italienisch, Portugiesisch, Polnisch, Finnisch, Schwedisch, Russisch, Spanisch, Holl\u00e4ndisch, Griechisch, T\u00fcrkisch, Japanisch, Koreanisch",
        "Pixelpitch": "0.248 mm",
        "Reaktionszeit": "14 ms (grau zu grau); 5 ms (grau zu grau mit \u00dcbersteuerung)",
        "Rotationswinkel": "90",
        "Schnittstelle f\u00fcr Flachbildschirmbefestigung": "100 x 100 mm",
        "Schnittstellen": "VGA \u00a6 HDMI \u00a6 Audio Line-In \u00a6 Kopfh\u00f6rer",
        "Schwenkwinkel": "350",
        "Seitenverh\u00e4ltnis": "Breitbild - 16:10",
        "Sichtbare Bildfl\u00e4che": "54,6 cm (21.5\")",
        "Typ": "Lautsprecher - Stereo",
        "Vertikale Bildwiederholrate": "56 - 76 Hz",
        "Vertikaler Betrachtungswinkel": "178",
        "Zul\u00e4ssige Luftfeuchtigkeit im Betrieb": "20 - 80%"
    },
    "raw_specifications_text": "Display-Typ: LED-hintergrundbeleuchteter LCD-Monitor / TFT-Aktivmatrix\nDiagonalabmessung: 55,9 cm (22\")\nSichtbare Bildfl\u00e4che: 54,6 cm (21.5\")\nBildschirmtyp: IPS\nSeitenverh\u00e4ltnis: Breitbild - 16:10\nNative Aufl\u00f6sung: 1920 x 1200 bei 60 Hz\nPixelpitch: 0.248 mm\nKontrast: 20000000:1 (dynamisch)\nFarbunterst\u00fctzung: 16,7 Millionen Farben\nReaktionszeit: 14 ms (grau zu grau); 5 ms (grau zu grau mit \u00dcbersteuerung)\nVertikale Bildwiederholrate: 56 - 76 Hz\nHorizontale Bildwiederholrate: 30 - 83 kHz\nHorizontaler Betrachtungswinkel: 178\nVertikaler Betrachtungswinkel: 178\nHintergrundbeleuchtungs-Technologie: LED-Hintergrundbeleuchtung\nOSD-Sprachen: Ungarisch, Tschechisch, Chinesisch (tradionell), Chinesisch (vereinfacht), Ukrainisch, Brasilianisches Portugiesisch, Englisch, Deutsch, Franz\u00f6sisch, Italienisch, Portugiesisch, Polnisch, Finnisch, Schwedisch, Russisch, Spanisch, Holl\u00e4ndisch, Griechisch, T\u00fcrkisch, Japanisch, Koreanisch\nBesonderheiten: Sync-on-Green, sRGB-Farbmanagement, SmartContrast, SmartImage, On-screen Digital Controls, Low Blue Light Mode, flimmerfreie Technologie, BFR/PVC-frei, SoftBlue-Technologie, EasyRead, 68% NTSC-Farbskala (CIE 1931)\nFarbe: Textured Black\nAbmessungen (Breite x Tiefe x H\u00f6he): 49 cm x 20,2 cm x 45,5 cm - mit Fu\u00df\nGewicht: 4,51 kg\nTyp: Lautsprecher - Stereo\nAusgangsleistung/Kanal: 2 Watt\nSchnittstellen: VGA \u00a6 HDMI \u00a6 Audio Line-In \u00a6 Kopfh\u00f6rer\nEinstellungen der Anzeigeposition: H\u00f6he, Pivot (Rotation), Drehelement, neigbar\nNeigungswinkel: -5/+20\nSchwenkwinkel: 350\nRotationswinkel: 90\nH\u00f6heneinstellung: 130 mm\nSchnittstelle f\u00fcr Flachbildschirmbefestigung: 100 x 100 mm\nLeistungsmerkmale: Slot f\u00fcr Sicherheitsschloss (Kabelschloss getrennt erh\u00e4ltlich)\nKennzeichnung: Plug and Play, FCC Klasse B bescheinigt, ICES-003, SEMKO, CCC, PSB, DDC/CI, RoHS, ISO 9241-307, WEEE, EPA, TCO Displays, cETLus, CU-EACSoftware / Systemanforderungen\nErforderliches Betriebssystem: Apple MacOS X, Microsoft Windows 7 / 8 / 8.1 / 10\nDetails zu Abmessungen & Gewicht: Mit Fu\u00df - Breite: 49 cm - Tiefe: 20,2 cm - H\u00f6he: 45,5 cm - Gewicht: 4,51 kg \u00a6 Ohne Fu\u00df - Breite: 49 cm - Tiefe: 4,5 cm - H\u00f6he: 29,6 cm - Gewicht: 2,63 kg\nENERGY STAR zertifiziert: Ja\nMin Betriebstemperatur: 0 \u00b0C\nMax. Betriebstemperatur: 40 \u00b0C\nZul\u00e4ssige Luftfeuchtigkeit im Betrieb: 20 - 80%",
    "reference_file": "offer_reference_2426.json",
    "shop_name": "Future-X.at"
}