{
    "html_file": "offer_694_3.html",
    "name": "AOC 24P2QM, 23.8\"",
    "offer_link": "https://direkt.jacob.de/produkte/aoc-p2-24p2qm-24p2qm-artnr-7976382.html?utm_source=geizhals&utm_medium=cpc&utm_campaign=Preisvergleich&ref=103",
    "price": 146.39,
    "raw_specifications": {
        "AC Eingangsfrequenz": "50/60 Hz",
        "AC Eingangsspannung": "100 - 240 V",
        "Abnehmbarer Standfu\u00df": "Ja",
        "Anzahl DVI-D-Anschl\u00fcsse": "1",
        "Anzahl DisplayPort Anschl\u00fcsse": "1",
        "Anzahl HDMI-Anschl\u00fcsse": "1",
        "Anzahl OSD-Sprachen": "19",
        "Anzahl VGA (D-Sub) Anschl\u00fcsse": "1",
        "Anzahl der Farben des Displays": "16,7 Millionen Farben",
        "Anzahl der Upstream-Ports USB Typ-B": "1",
        "Anzahl der nachgeschalteten Steckpl\u00e4tze vom Typ USB-A": "4",
        "Anzahl der vorgeschalteten Steckpl\u00e4tze": "1",
        "Au\u00dfenverkleidungstyp": "Matt",
        "Bildschirmaufl\u00f6sung": "1920 x 1080 Pixel",
        "Bildschirmdiagonale": "60,5 cm (23.8\" )",
        "Bildschirmdiagonale (cm)": "60,4 cm",
        "Bildschirmform": "Flach",
        "Bildschirmtechnologie": "LED",
        "Bildwinkel, horizontal": "178\u00b0",
        "Bildwinkel, vertikal": "178\u00b0",
        "Blendfreier Bildschirm": "Ja",
        "Breite (ohne Standfu\u00df)": "54 cm",
        "DVI Anschluss": "Ja",
        "Dial point": "Nein",
        "DisplayPorts-Version": "1.2",
        "Eingebaute Lautsprecher": "Ja",
        "Eingebautes Mikrofon": "Nein",
        "Energie Effizienzklasse": "E",
        "Flimmerfreie Technologie": "Ja",
        "Fu\u00dffarbe": "Schwarz",
        "Ger\u00e4tebreite (inkl. Fu\u00df)": "384,4 mm",
        "Ger\u00e4teh\u00f6he (inkl. Fu\u00df)": "540,2 mm",
        "Ger\u00e4tetiefe (inkl. Fu\u00df)": "200,1 mm",
        "Gewicht (mit St\u00e4nder)": "4,75 kg",
        "HD-Typ": "Full HD",
        "HDCP": "Ja",
        "HDCP-Version": "1.4",
        "HDMI": "Ja",
        "HDMI-Kabell\u00e4nge": "1,8 m",
        "HDMI-Version": "1.4",
        "H\u00f6he (ohne Standfu\u00df)": "32,6 cm",
        "H\u00f6heneinstellung": "15 cm",
        "H\u00f6henverstellung": "Ja",
        "Integrierte Kamera": "Nein",
        "Integrierter USB-Hub": "Ja",
        "Kabelsperre-Slot": "Ja",
        "Kompatibilit\u00e4t": "VESA-P2",
        "Kontrastverh\u00e4ltnis": "3000:1",
        "Kontrastverh\u00e4ltnis (dynamisch)": "50000000:1",
        "Kopfh\u00f6rer-Anschluss": "3,5 mm",
        "Kopfh\u00f6rerausgang": "Ja",
        "Kopfh\u00f6rerausg\u00e4nge": "1",
        "Lichteffekte": "Nein",
        "Low-Blue-Light-Technologie": "Ja",
        "Marktpositionierung": "Haus",
        "Maximale Bildwiederholrate": "75 Hz",
        "Men\u00fcsprachen": "Vereinfachtes Chinesisch, Traditionelles Chinesisch, Kroatisch, Tschechisch, Deutsch, Niederl\u00e4ndisch, Englisch, Spanisch, Finnisch, Franz\u00f6sisch, Italienisch, Japanisch, Koreanisch, Polnisch, Portugiesisch, Russisch, Schwedisch, Ukrainisch",
        "Mitgelieferte Kabel": "AC, HDMI",
        "Mobile High-Definition Link (MHL)": "Nein",
        "NVIDIA G-SYNC": "Nein",
        "Natives Seitenverh\u00e4ltnis": "16:9",
        "Neigungswinkelbereich": "5 - 35\u00b0",
        "Netzteiltyp": "Intern",
        "Oberfl\u00e4chenh\u00e4rte": "6H",
        "On-Screen-Display (OSD)": "Ja",
        "Paketgewicht": "7,24 kg",
        "Panel-Montage-Schnittstelle": "100 x 100 mm",
        "Panel-Typ": "VA",
        "Pivot": "Ja",
        "Pixel Abstand": "0,2745 x 0,2745 mm",
        "Produktfarbe": "Schwarz",
        "RMS-Leistung": "4 W",
        "Rahmenloses Design": "Ja",
        "Reaktionszeit": "4 ms",
        "Schnellladung": "Ja",
        "Schwenkbar": "Ja",
        "Schwenkwinkelbereich": "0 - 180\u00b0",
        "Slot-Typ Kabelsperre": "Kensington",
        "Stromeingang": "Ja",
        "Stromverbrauch (Standardbetrieb)": "20 W",
        "Stromverbrauch (Standby)": "0,5 W",
        "Stromverbrauch (aus)": "0,5 W",
        "St\u00e4nder enthalten": "Ja",
        "Tiefe (ohne Standfu\u00df)": "5,07 cm",
        "Touchscreen": "Nein",
        "Typ der Hintergrundbeleuchtung": "W-LED",
        "USB-Hub-Version": "3.2 Gen 1 (3.1 Gen 1)",
        "USB-Upstream-Porttyp": "USB Typ-B",
        "VESA Adaptive Sync unterst\u00fctzt": "Ja",
        "VESA-Halterung": "Ja",
        "Verpackungsart": "Box",
        "Verpackungsbreite": "634 mm",
        "Verpackungsh\u00f6he": "513 mm",
        "Verpackungstiefe": "160 mm",
        "Vorderer Rahmen": "Schwarz",
        "Wandmontage": "Ja",
        "kippbar": "Ja"
    },
    "raw_specifications_text": "Bildschirmdiagonale: 60,5 cm (23.8\" )\nBildschirmaufl\u00f6sung: 1920 x 1080 Pixel\nNatives Seitenverh\u00e4ltnis: 16:9\nBildschirmtechnologie: LED\nTouchscreen: Nein\nHD-Typ: Full HD\nPanel-Typ: VA\nBildschirmform: Flach\nKontrastverh\u00e4ltnis: 3000:1\nMaximale Bildwiederholrate: 75 Hz\nAnzahl der Farben des Displays: 16,7 Millionen Farben\nTyp der Hintergrundbeleuchtung: W-LED\nReaktionszeit: 4 ms\nBlendfreier Bildschirm: Ja\nKontrastverh\u00e4ltnis (dynamisch): 50000000:1\nBildwinkel, horizontal: 178\u00b0\nBildwinkel, vertikal: 178\u00b0\nPixel Abstand: 0,2745 x 0,2745 mm\nBildschirmdiagonale (cm): 60,4 cm\nOberfl\u00e4chenh\u00e4rte: 6H\nNVIDIA G-SYNC: Nein\nSchnellladung: Ja\nVESA Adaptive Sync unterst\u00fctzt: Ja\nFlimmerfreie Technologie: Ja\nLow-Blue-Light-Technologie: Ja\nDial point: Nein\nKompatibilit\u00e4t: VESA-P2\nEingebaute Lautsprecher: Ja\nIntegrierte Kamera: Nein\nRMS-Leistung: 4 W\nEingebautes Mikrofon: Nein\nMarktpositionierung: Haus\nProduktfarbe: Schwarz\nRahmenloses Design: Ja\nVorderer Rahmen: Schwarz\nAbnehmbarer Standfu\u00df: Ja\nFu\u00dffarbe: Schwarz\nIntegrierter USB-Hub: Ja\nHDMI: Ja\nKopfh\u00f6rerausgang: Ja\nUSB-Hub-Version: 3.2 Gen 1 (3.1 Gen 1)\nUSB-Upstream-Porttyp: USB Typ-B\nAnzahl der vorgeschalteten Steckpl\u00e4tze: 1\nAnzahl der Upstream-Ports USB Typ-B: 1\nAnzahl der nachgeschalteten Steckpl\u00e4tze vom Typ USB-A: 4\nAnzahl VGA (D-Sub) Anschl\u00fcsse: 1\nDVI Anschluss: Ja\nAnzahl DVI-D-Anschl\u00fcsse: 1\nAnzahl HDMI-Anschl\u00fcsse: 1\nHDMI-Version: 1.4\nAnzahl DisplayPort Anschl\u00fcsse: 1\nDisplayPorts-Version: 1.2\nKopfh\u00f6rerausg\u00e4nge: 1\nKopfh\u00f6rer-Anschluss: 3,5 mm\nHDCP: Ja\nHDCP-Version: 1.4\nStromeingang: Ja\nMobile High-Definition Link (MHL): Nein\nVESA-Halterung: Ja\nKabelsperre-Slot: Ja\nH\u00f6henverstellung: Ja\nPanel-Montage-Schnittstelle: 100 x 100 mm\nWandmontage: Ja\nSlot-Typ Kabelsperre: Kensington\nH\u00f6heneinstellung: 15 cm\nPivot: Ja\nSchwenkbar: Ja\nSchwenkwinkelbereich: 0 - 180\u00b0\nkippbar: Ja\nNeigungswinkelbereich: 5 - 35\u00b0\nOn-Screen-Display (OSD): Ja\nMen\u00fcsprachen: Vereinfachtes Chinesisch, Traditionelles Chinesisch, Kroatisch, Tschechisch, Deutsch, Niederl\u00e4ndisch, Englisch, Spanisch, Finnisch, Franz\u00f6sisch, Italienisch, Japanisch, Koreanisch, Polnisch, Portugiesisch, Russisch, Schwedisch, Ukrainisch\nAnzahl OSD-Sprachen: 19\nEnergie Effizienzklasse: E\nStromverbrauch (Standardbetrieb): 20 W\nStromverbrauch (Standby): 0,5 W\nStromverbrauch (aus): 0,5 W\nAC Eingangsspannung: 100 - 240 V\nAC Eingangsfrequenz: 50/60 Hz\nNetzteiltyp: Intern\nSt\u00e4nder enthalten: Ja\nMitgelieferte Kabel: AC, HDMI\nHDMI-Kabell\u00e4nge: 1,8 m\nGer\u00e4tebreite (inkl. Fu\u00df): 384,4 mm\nGer\u00e4tetiefe (inkl. Fu\u00df): 200,1 mm\nGer\u00e4teh\u00f6he (inkl. Fu\u00df): 540,2 mm\nGewicht (mit St\u00e4nder): 4,75 kg\nBreite (ohne Standfu\u00df): 54 cm\nTiefe (ohne Standfu\u00df): 5,07 cm\nH\u00f6he (ohne Standfu\u00df): 32,6 cm\nVerpackungsbreite: 634 mm\nVerpackungstiefe: 160 mm\nVerpackungsh\u00f6he: 513 mm\nPaketgewicht: 7,24 kg\nVerpackungsart: Box\nAu\u00dfenverkleidungstyp: Matt\nLichteffekte: Nein",
    "reference_file": "offer_reference_694.json",
    "shop_name": "Jacob Elektronik direkt (AT)"
}