{
    "html_file": "offer_1645_2.html",
    "name": "ViewSonic VA2432-MHD, 23.8\"",
    "offer_link": "https://www.amazon.de/dp/B086H4KHKC?linkCode=xm2&camp=2025&creative=165953&smid=A3JWKAKR8XB7XF&creativeASIN=B086H4KHKC&tag=geizhals1-21",
    "price": 125.91,
    "raw_specifications": {
        "ASIN": "B086H4KHKC",
        "Amazon Bestseller-Rang": "Nr. 109,260 in Computer & Zubeh\u00f6r (Siehe Top 100 in Computer & Zubeh\u00f6r)  Nr. 1,940 in Monitore",
        "Anzahl HDMI Schnittstellen": "\u200e1",
        "Anzahl der Lithium-Ionen-Zellen": "\u200e1",
        "Anzahl der Lithium-Metall-Zellen": "\u200e1",
        "Artikelgewicht": "\u200e2,7 Kilograms",
        "Auslaufartikel (Produktion durch Hersteller eingestellt)": "\u200eNein",
        "Batterien": "\u200e1 Lithium-Ionen Batterien erforderlich.",
        "Batterien enthalten": "\u200eNein",
        "Bildschirmaufl\u00f6sung": "\u200e1920x1080",
        "Display-Gr\u00f6\u00dfe": "\u200e24 Zoll",
        "Durchschnittliche Kundenbewertung": "4,4  4,4 von 5 Sternen    \n    146 Sternebewertungen   \n\n\n 4,4 von 5 Sternen",
        "Farbe": "\u200eMehrfarbig",
        "Garantierte Software-Updates bis": "\u200eunbekannt",
        "Hersteller": "\u200eViewSonic Technology GmbH",
        "Im Angebot von Amazon.de seit": "12. August 2020",
        "L\u00f6sung": "\u200e640 x 480",
        "Marke": "\u200eViewSonic",
        "Modell/Serie": "\u200eMonitor ViewSonic VA2432-MHD 23,8 \"IPS 1920x1080 75Hz VGA HDMI DP-Lautsprecher",
        "Modellnummer": "\u200eVA2432-MHD",
        "Produktabmessungen": "\u200e18,5 x 54 x 40,6 cm; 2,7 Kilogramm",
        "Volt": "\u200e12 Volt"
    },
    "raw_specifications_text": "Marke: \u200eViewSonic\nHersteller: \u200eViewSonic Technology GmbH\nModell/Serie: \u200eMonitor ViewSonic VA2432-MHD 23,8 \"IPS 1920x1080 75Hz VGA HDMI DP-Lautsprecher\nProduktabmessungen: \u200e18,5 x 54 x 40,6 cm; 2,7 Kilogramm\nBatterien: \u200e1 Lithium-Ionen Batterien erforderlich.\nModellnummer: \u200eVA2432-MHD\nAuslaufartikel (Produktion durch Hersteller eingestellt): \u200eNein\nFarbe: \u200eMehrfarbig\nDisplay-Gr\u00f6\u00dfe: \u200e24 Zoll\nBildschirmaufl\u00f6sung: \u200e1920x1080\nL\u00f6sung: \u200e640 x 480\nAnzahl HDMI Schnittstellen: \u200e1\nVolt: \u200e12 Volt\nBatterien enthalten: \u200eNein\nAnzahl der Lithium-Ionen-Zellen: \u200e1\nAnzahl der Lithium-Metall-Zellen: \u200e1\nArtikelgewicht: \u200e2,7 Kilograms\nGarantierte Software-Updates bis: \u200eunbekannt\nASIN: B086H4KHKC\nDurchschnittliche Kundenbewertung: 4,4  4,4 von 5 Sternen    \n    146 Sternebewertungen   \n\n\n 4,4 von 5 Sternen\nAmazon Bestseller-Rang: Nr. 109,260 in Computer & Zubeh\u00f6r (Siehe Top 100 in Computer & Zubeh\u00f6r)  Nr. 1,940 in Monitore\nIm Angebot von Amazon.de seit: 12. August 2020",
    "reference_file": "offer_reference_1645.json",
    "shop_name": "Amazon.at"
}