{
    "html_file": "offer_2357_8.html",
    "name": "BenQ BL2780, 27\"",
    "offer_link": "https://www.csv-direct.de/artinfo.php?artnr=A1670609&KATEGORIE=162&pva=geizhals2",
    "price": 139.78,
    "raw_specifications": {
        "3D": "Nein",
        "AC Eingangsfrequenz": "47/63 Hz",
        "AC Eingangsspannung": "90 - 264 V",
        "AMD FreeSync": "Nein",
        "Anzahl DisplayPort Anschl\u00fcsse": "1",
        "Anzahl HDMI-Anschl\u00fcsse": "1",
        "Anzahl OSD-Sprachen": "17",
        "Anzahl VGA D-Sub Anschl\u00fcsse": "1",
        "Anzahl der Farben des Displays": "16,78 Millionen Farben",
        "Anzahl der Lautsprecher": "2",
        "Betriebstemperatur": "5 - 40 \u00b0C",
        "Bildschirmdiagonale": "68,6 cm 27\"",
        "Bildschirmform": "Flach",
        "Bildschirmtechnologie": "LED",
        "Bildwinkel, horizontal": "178\u00b0",
        "Bildwinkel, vertikal": "178\u00b0",
        "Breite ohne Standfu\u00df": "612 mm",
        "DVI Anschluss": "Nein",
        "Display": "LED",
        "Display-Aufl\u00f6sung": "1920 x 1080 Pixel",
        "Energieeffizienzklasse SDR": "E",
        "Energieeffizienzskala": "A bis G",
        "Energieverbrauch SDR pro 1.000 Stunden": "19 kWh",
        "Ger\u00e4tebreite inkl. Fu\u00df": "612 mm",
        "Ger\u00e4teh\u00f6he inkl. Fu\u00df": "463 mm",
        "Ger\u00e4tetiefe inkl. Fu\u00df": "183 mm",
        "Gewicht ohne St\u00e4nder": "6,5 kg",
        "HD-Typ": "Full HD",
        "Helligkeit typisch": "250 cd/m\u00b2",
        "Horizontaler Scanbereich": "30 - 83 kHz",
        "H\u00f6he ohne Standfu\u00df": "381 mm",
        "Integrierte Kamera": "Nein",
        "Integrierter USB-Hub": "Nein",
        "Kontrastverh\u00e4ltnis": "1000:1",
        "Kontrastverh\u00e4ltnis dynamisch": "12000000:1",
        "Kopfh\u00f6rer-Anschluss": "3,5 mm",
        "Kopfh\u00f6rerausg\u00e4nge": "1",
        "Luftfeuchtigkeit bei Lagerung": "10 - 90",
        "Mitgelieferte Kabel": "AC, HDMI, VGA",
        "NVIDIA G-SYNC": "Nein",
        "Nachhaltigkeitszertifikate": "EPEAT Silver, ENERGY STAR",
        "Natives Seitenverh\u00e4ltnis": "16:9",
        "Neigungswinkelbereich": "-5 - 20\u00b0",
        "Panel-Montage-Schnittstelle": "100 x 100 mm",
        "Panel-Typ": "IPS",
        "Pixel Abstand": "0,311 x 0,311 mm",
        "Produktfarbe": "Schwarz",
        "RMS-Leistung": "4 W",
        "Reaktionszeit": "5 ms",
        "Relative Luftfeuchtigkeit in Betrieb": "20 - 90",
        "Seitenverh\u00e4ltnis": "16:9",
        "Slot-Typ Kabelsperre": "Kensington",
        "Stromverbrauch Standardbetrieb": "23 W",
        "Stromverbrauch Standby": "0,5 W",
        "Stromverbrauch durchschnittl.": "23 W",
        "TV Tuner integriert": "Nein",
        "Temperaturbereich bei Lagerung": "-20 - 60 \u00b0C",
        "Thin Client installiert": "Nein",
        "Tiefe ohne Standfu\u00df": "50 mm",
        "Touchscreen": "Nein",
        "Typ der Hintergrundbeleuchtung": "LED",
        "Unterst\u00fctzte Grafik-Aufl\u00f6sungen": "1920 x 1080 HD 1080",
        "Unterst\u00fctzte Video-Modi": "1080p",
        "Vertikaler Scanbereich": "50 - 76 Hz",
        "Zertifizierung": "CE, T\u00dcV, TCO 7.0"
    },
    "raw_specifications_text": "Bildschirmdiagonale: 68,6 cm 27\"\nDisplay-Aufl\u00f6sung: 1920 x 1080 Pixel\nNatives Seitenverh\u00e4ltnis: 16:9\nBildschirmtechnologie: LED\nTouchscreen: Nein\nHD-Typ: Full HD\nPanel-Typ: IPS\nBildschirmform: Flach\nKontrastverh\u00e4ltnis: 1000:1\nAnzahl der Farben des Displays: 16,78 Millionen Farben\nTyp der Hintergrundbeleuchtung: LED\nHelligkeit typisch: 250 cd/m\u00b2\nReaktionszeit: 5 ms\nUnterst\u00fctzte Grafik-Aufl\u00f6sungen: 1920 x 1080 HD 1080\nUnterst\u00fctzte Video-Modi: 1080p\nSeitenverh\u00e4ltnis: 16:9\nKontrastverh\u00e4ltnis dynamisch: 12000000:1\nBildwinkel, horizontal: 178\u00b0\nBildwinkel, vertikal: 178\u00b0\nPixel Abstand: 0,311 x 0,311 mm\nHorizontaler Scanbereich: 30 - 83 kHz\nVertikaler Scanbereich: 50 - 76 Hz\n3D: Nein\nNVIDIA G-SYNC: Nein\nAMD FreeSync: Nein\nIntegrierte Kamera: Nein\nAnzahl der Lautsprecher: 2\nRMS-Leistung: 4 W\nProduktfarbe: Schwarz\nZertifizierung: CE, T\u00dcV, TCO 7.0\nIntegrierter USB-Hub: Nein\nAnzahl VGA D-Sub Anschl\u00fcsse: 1\nDVI Anschluss: Nein\nAnzahl HDMI-Anschl\u00fcsse: 1\nAnzahl DisplayPort Anschl\u00fcsse: 1\nKopfh\u00f6rerausg\u00e4nge: 1\nKopfh\u00f6rer-Anschluss: 3,5 mm\nPanel-Montage-Schnittstelle: 100 x 100 mm\nSlot-Typ Kabelsperre: Kensington\nNeigungswinkelbereich: -5 - 20\u00b0\nAnzahl OSD-Sprachen: 17\nEnergieeffizienzklasse SDR: E\nEnergieverbrauch SDR pro 1.000 Stunden: 19 kWh\nStromverbrauch Standardbetrieb: 23 W\nStromverbrauch Standby: 0,5 W\nStromverbrauch durchschnittl.: 23 W\nAC Eingangsspannung: 90 - 264 V\nAC Eingangsfrequenz: 47/63 Hz\nEnergieeffizienzskala: A bis G\nBetriebstemperatur: 5 - 40 \u00b0C\nTemperaturbereich bei Lagerung: -20 - 60 \u00b0C\nRelative Luftfeuchtigkeit in Betrieb: 20 - 90\nLuftfeuchtigkeit bei Lagerung: 10 - 90\nMitgelieferte Kabel: AC, HDMI, VGA\nGer\u00e4tebreite inkl. Fu\u00df: 612 mm\nGer\u00e4tetiefe inkl. Fu\u00df: 183 mm\nGer\u00e4teh\u00f6he inkl. Fu\u00df: 463 mm\nBreite ohne Standfu\u00df: 612 mm\nTiefe ohne Standfu\u00df: 50 mm\nH\u00f6he ohne Standfu\u00df: 381 mm\nGewicht ohne St\u00e4nder: 6,5 kg\nNachhaltigkeitszertifikate: EPEAT Silver, ENERGY STAR\nThin Client installiert: Nein\nDisplay: LED\nTV Tuner integriert: Nein",
    "reference_file": "offer_reference_2357.json",
    "shop_name": "CSV-Direct.de"
}