{
    "html_file": "offer_1039_17.html",
    "name": "ASUS VP349CGL, 34\"",
    "offer_link": "https://www.e-tec.at/details.php?artnr=345821",
    "price": 526.0,
    "raw_specifications": {
        "AMD FreeSync": "Ja",
        "Adaptive Sync": "Ja",
        "Anschl\u00fcsse - DisplayPort 1.2": "1",
        "Anschl\u00fcsse - HDMI 2.0": "1",
        "Anschl\u00fcsse - USB-C mit DisplayPort 1.2": "1",
        "Anwendung": "station\u00e4r",
        "Audio": "Lautsprecher (2x 2W),  1x Line-Out",
        "Aufl\u00f6sung": "3440x1440",
        "Beschichtung": "matt (non-glare)",
        "Besonderheiten": "Slim Bezel,  USB-C Power Delivery (15W),  mechanische Tasten mit Steuerkreuz,  Picture-in-Picture,  Sicherheitsschloss (Kensington),  HDCP 2.2",
        "Bildwiederholfrequenz": "100Hz",
        "Blickwinkel": "178\u00b0/178\u00b0",
        "Diagonale": "34\"/86.4cm",
        "Energieeffizienzklasse HDR (A bis G)": "G",
        "Energieverbrauch HDR": "35kWh/1000h",
        "Energieverbrauch SDR": "40kWh/1000h",
        "Ergonomie": "130mm (h\u00f6henverstellbar),  N/A (Pivot),  \u00b1180\u00b0 (drehbar),  +35\u00b0/-5\u00b0 (neigbar),  keine Angabe (Schr\u00e4glage)",
        "FRC": "unbekannt",
        "Farbe": "schwarz",
        "Farbtiefe": "8bit (16.7 Mio. Farben)",
        "Form": "gerade (flat)",
        "Gewicht": "9.27kg (mit Standfu\u00df),  6.37kg (ohne Standfu\u00df)",
        "HDR": "HDR10",
        "Helligkeit": "300cd/m\u00b2",
        "Herstellergarantie": "drei Jahre",
        "Hintergrundbeleuchtung": "White-LED,  flicker-free,  Blaulichtfilter",
        "Kontrast - dynamisch": "100.000.000:1",
        "Kontrast - statisch": "1.000:1",
        "Lautsprecher": "Ja",
        "Leistungsaufnahme": "keine Angabe (maximal),  34W (typisch),  keine Angabe (Energielabel alt A+++ bis G),  0.5W (Standby)",
        "Panel": "IPS",
        "Reaktionszeit - MPRT": "1ms",
        "Screen-to-Body-Ratio": "88.2% (berechnet)",
        "Seitenverh\u00e4ltnis": "21:9",
        "Signalfrequenz": "24-160kHz (horizontal),  48-100Hz (vertikal)",
        "Stromversorgung": "AC-In (internes Netzteil)",
        "USB-Hub In": "N/A",
        "USB-Hub Out": "N/A",
        "USB-Schreibweise": "Link",
        "VESA": "100x100 (belegt)",
        "Weitere Anschl\u00fcsse": "N/A"
    },
    "raw_specifications_text": "Adaptive Sync: Ja\nAMD FreeSync: Ja\nAnschl\u00fcsse - DisplayPort 1.2: 1\nAnschl\u00fcsse - HDMI 2.0: 1\nAnschl\u00fcsse - USB-C mit DisplayPort 1.2: 1\nAnwendung: station\u00e4r\nAudio: Lautsprecher (2x 2W),  1x Line-Out\nAufl\u00f6sung: 3440x1440\nBeschichtung: matt (non-glare)\nBesonderheiten: Slim Bezel,  USB-C Power Delivery (15W),  mechanische Tasten mit Steuerkreuz,  Picture-in-Picture,  Sicherheitsschloss (Kensington),  HDCP 2.2\nBildwiederholfrequenz: 100Hz\nBlickwinkel: 178\u00b0/178\u00b0\nDiagonale: 34\"/86.4cm\nEnergieeffizienzklasse HDR (A bis G): G\nEnergieverbrauch HDR: 35kWh/1000h\nEnergieverbrauch SDR: 40kWh/1000h\nErgonomie: 130mm (h\u00f6henverstellbar),  N/A (Pivot),  \u00b1180\u00b0 (drehbar),  +35\u00b0/-5\u00b0 (neigbar),  keine Angabe (Schr\u00e4glage)\nFarbe: schwarz\nFarbtiefe: 8bit (16.7 Mio. Farben)\nForm: gerade (flat)\nFRC: unbekannt\nGewicht: 9.27kg (mit Standfu\u00df),  6.37kg (ohne Standfu\u00df)\nHDR: HDR10\nHelligkeit: 300cd/m\u00b2\nHerstellergarantie: drei Jahre\nHintergrundbeleuchtung: White-LED,  flicker-free,  Blaulichtfilter\nKontrast - dynamisch: 100.000.000:1\nKontrast - statisch: 1.000:1\nLautsprecher: Ja\nLeistungsaufnahme: keine Angabe (maximal),  34W (typisch),  keine Angabe (Energielabel alt A+++ bis G),  0.5W (Standby)\nPanel: IPS\nReaktionszeit - MPRT: 1ms\nScreen-to-Body-Ratio: 88.2% (berechnet)\nSeitenverh\u00e4ltnis: 21:9\nSignalfrequenz: 24-160kHz (horizontal),  48-100Hz (vertikal)\nStromversorgung: AC-In (internes Netzteil)\nUSB-Hub In: N/A\nUSB-Hub Out: N/A\nUSB-Schreibweise: Link\nVESA: 100x100 (belegt)\nWeitere Anschl\u00fcsse: N/A",
    "reference_file": "offer_reference_1039.json",
    "shop_name": "e-tec.at"
}