{
    "html_file": "offer_1914_2.html",
    "name": "LG UltraFine 32UN880-B, 31.5\"",
    "offer_link": "https://www.amazon.de/dp/B0B66K2R8F?linkCode=xm2&camp=2025&creative=165953&smid=A3JWKAKR8XB7XF&creativeASIN=B0B66K2R8F&tag=geizhals1-21",
    "price": 603.93,
    "raw_specifications": {
        "ASIN": "B0B66K2R8F",
        "Amazon Bestseller-Rang": "Nr. 22,094 in Computer & Zubeh\u00f6r (Siehe Top 100 in Computer & Zubeh\u00f6r)  Nr. 482 in Monitore",
        "Anzahl HDMI Schnittstellen": "\u200e2",
        "Anzahl der Lithium-Ionen-Zellen": "\u200e7",
        "Anzahl der Lithium-Metall-Zellen": "\u200e7",
        "Artikelgewicht": "\u200e10,3 Kilograms",
        "Batterien": "\u200e1 A Batterien erforderlich.",
        "Batterien enthalten": "\u200eNein",
        "Bildschirmaufl\u00f6sung": "\u200e3840 x 2160",
        "Display-Gr\u00f6\u00dfe": "\u200e31,5 Zoll",
        "Durchschnittliche Kundenbewertung": "4,5  4,5 von 5 Sternen    \n    87 Sternebewertungen   \n\n\n 4,5 von 5 Sternen",
        "Farbe": "\u200eSchwarz",
        "Garantierte Software-Updates bis": "\u200eunbekannt",
        "Hersteller": "\u200eLG Electronics",
        "Im Angebot von Amazon.de seit": "7. Juli 2022",
        "Kapazit\u00e4t Lithium-Akku": "\u200e2,6 Britische W\u00e4rmeeinheiten (BTU)",
        "L\u00f6sung": "\u200e3840 x 2160 Pixels",
        "Marke": "\u200eLG Electronics",
        "Modell/Serie": "\u200e32UN880-B.BEU",
        "Modellnummer": "\u200e32UN880-B.BEU",
        "Produktabmessungen": "\u200e9,94 x 11,07 x 6,31 cm; 10,3 Kilogramm",
        "Volt": "\u200e220 Volt"
    },
    "raw_specifications_text": "Marke: \u200eLG Electronics\nHersteller: \u200eLG Electronics\nModell/Serie: \u200e32UN880-B.BEU\nProduktabmessungen: \u200e9,94 x 11,07 x 6,31 cm; 10,3 Kilogramm\nBatterien: \u200e1 A Batterien erforderlich.\nModellnummer: \u200e32UN880-B.BEU\nFarbe: \u200eSchwarz\nDisplay-Gr\u00f6\u00dfe: \u200e31,5 Zoll\nBildschirmaufl\u00f6sung: \u200e3840 x 2160\nL\u00f6sung: \u200e3840 x 2160 Pixels\nAnzahl HDMI Schnittstellen: \u200e2\nVolt: \u200e220 Volt\nBatterien enthalten: \u200eNein\nKapazit\u00e4t Lithium-Akku: \u200e2,6 Britische W\u00e4rmeeinheiten (BTU)\nAnzahl der Lithium-Ionen-Zellen: \u200e7\nAnzahl der Lithium-Metall-Zellen: \u200e7\nArtikelgewicht: \u200e10,3 Kilograms\nGarantierte Software-Updates bis: \u200eunbekannt\nASIN: B0B66K2R8F\nDurchschnittliche Kundenbewertung: 4,5  4,5 von 5 Sternen    \n    87 Sternebewertungen   \n\n\n 4,5 von 5 Sternen\nAmazon Bestseller-Rang: Nr. 22,094 in Computer & Zubeh\u00f6r (Siehe Top 100 in Computer & Zubeh\u00f6r)  Nr. 482 in Monitore\nIm Angebot von Amazon.de seit: 7. Juli 2022",
    "reference_file": "offer_reference_1914.json",
    "shop_name": "Amazon.at"
}