{
    "html_file": "offer_227_4.html",
    "name": "Lenovo ThinkVision P32p-30, 31.5\"",
    "offer_link": "https://www.taufnaus.de/product/13218255",
    "price": 811.96,
    "raw_specifications": {
        "Abmessungen (Breite x Tiefe x H\u00f6he)": "71.42 cm x 23.46 cm x 59.95 cm - mit Standfu\u00df (h\u00f6chste Position)",
        "Besonderheiten": "Bild in Bild, Bild f\u00fcr Bild, Werkskalibrierung, Monitorkalibrierung Delta E<2, NearEdgeless-Design an 3 Seiten, 10-bit (8-bit + FRC) Farbtiefe, 2 mm Blende (Seite), Smart Power Technology, Natural Low Blue Light Technology, Modularer Kamera-Support, modularer Soundbar-Support",
        "Bildschirmbeschichtung": "Blendfrei",
        "Bildschirmtyp": "IPS",
        "Details zu Abmessungen & Gewicht": "Mit Standfu\u00df (h\u00f6chste Position) - Breite: 71.42 cm - Tiefe: 23.46 cm - H\u00f6he: 59.95 cm - Gewicht: 10.1 kg \u00a6 Mit Standfu\u00df (niedrigste Position) - Breite: 71.42 cm - Tiefe: 23.46 cm - H\u00f6he: 44.45 cm - Gewicht: 10.1 kg \u00a6 Ohne Fu\u00df - Breite: 71.42 cm - Tiefe: 5.95 cm - H\u00f6he: 42.09 cm - Gewicht: 7.2 kg",
        "Diagonalabmessung": "80 cm (31.5\")",
        "Display-Typ": "LED-hintergrundbeleuchteter LCD-Monitor / TFT-Aktivmatrix",
        "ENERGY STAR zertifiziert": "Ja",
        "EPEAT-kompatibel": "EPEAT Gold",
        "Eingangsspannung": "Wechselstrom 100-240 V (50/60 Hz)",
        "Einstellungen der Anzeigeposition": "H\u00f6he, Pivot (Rotation), Drehung, Neigung",
        "Energierverbrauch Sleep": "0.5 Watt",
        "Enthaltene Kabel": "1 x Adapter USB-A auf USB-B - 1.8 m \u00a6 1 x HDMI-Kabel - 1.8 m \u00a6 1 x DisplayPort-Kabel - 1.8 m \u00a6 1 x Kabel Thunderbolt 4 - 1 m",
        "Erforderliches Betriebssystem": "Windows 10, Windows 11",
        "Farbe": "Raven Black",
        "Farbraum": "100% sRGB, 95% DCI-P3",
        "Farbunterst\u00fctzung": "1,07 Mrd. Farben",
        "Gewicht": "10.1 kg",
        "Helligkeit": "350 cd/m\u00b2",
        "Hintergrundbeleuchtungs-Technologie": "WLED",
        "Horizontaler Betrachtungswinkel": "178",
        "H\u00f6heneinstellung": "155 mm",
        "Integrierte Peripherieger\u00e4te": "KVM-Switch, Gigabit Ethernet-Netzwerkadapter",
        "Kennzeichnung": "RoHS, VOC, TUV Rheinland Eye Comfort Certification, TUV Eyesafe Display Certification, TUV Rheinland Low Blue Light (Hardware Solution), TCO Certified 9.0, TCO Certified Edge",
        "Kontrast": "1000:1 / 3000000:1 (dynamisch)",
        "Leistungsmerkmale": "Slot f\u00fcr Sicherheitsschloss (Kabelschloss getrennt erh\u00e4ltlich), integrierte Kabelf\u00fchrung",
        "Lokalisierung": "Englisch / Europa",
        "Mitgelieferte Software": "Lenovo Display Control Center",
        "Native Aufl\u00f6sung": "4K 3840 x 2160",
        "Neigungswinkel": "-5/+23.5",
        "Pixelpitch": "0.182 mm",
        "Ppi": "140",
        "Reaktionszeit": "4 ms (extrem), 6 ms (normal)",
        "Rotationswinkel": "90",
        "Schlosstyp zur Diebstahlsicherung": "Kensington Slot",
        "Schnittstellen": "HDMI \u00a6 DisplayPort 1.4 \u00a6 USB-B 3.2 Gen 1 Upstream \u00a6 USB 3.2 Gen 1 Downstream \u00a6 LAN \u00a6 Audio Line-Out \u00a6 Thunderbolt 4 Upstream \u00a6 Thunderbolt 4 Downstream",
        "Schwenkwinkel": "45",
        "Seitenverh\u00e4ltnis": "16:9",
        "Service und Support": "Begrenzte Garantie - 3 Jahre",
        "Stromverbrauch (Aus-Modus)": "0.3 Watt",
        "Stromverbrauch (max.)": "193.7 Watt",
        "Stromverbrauch (typisch)": "29.5 Watt",
        "TCO-zertifiziert": "TCO Certified Edge Displays, TCO Certified Displays 9",
        "Transportgewicht": "14.4 kg",
        "VESA-Halterung": "100 x 100 mm",
        "Vertikale Bildwiederholrate": "60 Hz",
        "Vertikaler Betrachtungswinkel": "178"
    },
    "raw_specifications_text": "Display-Typ: LED-hintergrundbeleuchteter LCD-Monitor / TFT-Aktivmatrix\nDiagonalabmessung: 80 cm (31.5\")\nIntegrierte Peripherieger\u00e4te: KVM-Switch, Gigabit Ethernet-Netzwerkadapter\nBildschirmtyp: IPS\nSeitenverh\u00e4ltnis: 16:9\nNative Aufl\u00f6sung: 4K 3840 x 2160\nPixelpitch: 0.182 mm\nPpi: 140\nHelligkeit: 350 cd/m\u00b2\nKontrast: 1000:1 / 3000000:1 (dynamisch)\nFarbunterst\u00fctzung: 1,07 Mrd. Farben\nFarbraum: 100% sRGB, 95% DCI-P3\nReaktionszeit: 4 ms (extrem), 6 ms (normal)\nVertikale Bildwiederholrate: 60 Hz\nHorizontaler Betrachtungswinkel: 178\nVertikaler Betrachtungswinkel: 178\nBildschirmbeschichtung: Blendfrei\nHintergrundbeleuchtungs-Technologie: WLED\nBesonderheiten: Bild in Bild, Bild f\u00fcr Bild, Werkskalibrierung, Monitorkalibrierung Delta E<2, NearEdgeless-Design an 3 Seiten, 10-bit (8-bit + FRC) Farbtiefe, 2 mm Blende (Seite), Smart Power Technology, Natural Low Blue Light Technology, Modularer Kamera-Support, modularer Soundbar-Support\nFarbe: Raven Black\nAbmessungen (Breite x Tiefe x H\u00f6he): 71.42 cm x 23.46 cm x 59.95 cm - mit Standfu\u00df (h\u00f6chste Position)\nGewicht: 10.1 kg\nSchnittstellen: HDMI \u00a6 DisplayPort 1.4 \u00a6 USB-B 3.2 Gen 1 Upstream \u00a6 USB 3.2 Gen 1 Downstream \u00a6 LAN \u00a6 Audio Line-Out \u00a6 Thunderbolt 4 Upstream \u00a6 Thunderbolt 4 Downstream\nEinstellungen der Anzeigeposition: H\u00f6he, Pivot (Rotation), Drehung, Neigung\nNeigungswinkel: -5/+23.5\nSchwenkwinkel: 45\nRotationswinkel: 90\nH\u00f6heneinstellung: 155 mm\nVESA-Halterung: 100 x 100 mm\nLeistungsmerkmale: Slot f\u00fcr Sicherheitsschloss (Kabelschloss getrennt erh\u00e4ltlich), integrierte Kabelf\u00fchrung\nEnthaltene Kabel: 1 x Adapter USB-A auf USB-B - 1.8 m \u00a6 1 x HDMI-Kabel - 1.8 m \u00a6 1 x DisplayPort-Kabel - 1.8 m \u00a6 1 x Kabel Thunderbolt 4 - 1 m\nKennzeichnung: RoHS, VOC, TUV Rheinland Eye Comfort Certification, TUV Eyesafe Display Certification, TUV Rheinland Low Blue Light (Hardware Solution), TCO Certified 9.0, TCO Certified Edge\nLokalisierung: Englisch / Europa\nSchlosstyp zur Diebstahlsicherung: Kensington Slot\nEingangsspannung: Wechselstrom 100-240 V (50/60 Hz)\nStromverbrauch (typisch): 29.5 Watt\nStromverbrauch (max.): 193.7 Watt\nEnergierverbrauch Sleep: 0.5 Watt\nStromverbrauch (Aus-Modus): 0.3 Watt\nMitgelieferte Software: Lenovo Display Control Center\nErforderliches Betriebssystem: Windows 10, Windows 11\nDetails zu Abmessungen & Gewicht: Mit Standfu\u00df (h\u00f6chste Position) - Breite: 71.42 cm - Tiefe: 23.46 cm - H\u00f6he: 59.95 cm - Gewicht: 10.1 kg \u00a6 Mit Standfu\u00df (niedrigste Position) - Breite: 71.42 cm - Tiefe: 23.46 cm - H\u00f6he: 44.45 cm - Gewicht: 10.1 kg \u00a6 Ohne Fu\u00df - Breite: 71.42 cm - Tiefe: 5.95 cm - H\u00f6he: 42.09 cm - Gewicht: 7.2 kg\nTransportgewicht: 14.4 kg\nTCO-zertifiziert: TCO Certified Edge Displays, TCO Certified Displays 9\nEPEAT-kompatibel: EPEAT Gold\nENERGY STAR zertifiziert: Ja\nService und Support: Begrenzte Garantie - 3 Jahre",
    "reference_file": "offer_reference_227.json",
    "shop_name": "TaufNaus"
}