{
    "html_file": "offer_2393_11.html",
    "name": "ASUS VZ239HE, 23\"",
    "offer_link": "https://direkt.jacob.de/produkte/asus-vz239he-23zoll-90lm0330-b01670-artnr-3688530.html?utm_source=geizhals&utm_medium=cpc&utm_campaign=Preisvergleich&ref=103",
    "price": 155.74,
    "raw_specifications": {
        "Abmessungen (Breite x Tiefe x H\u00f6he)": "53.1 cm x 21.1 cm x 38.7 cm - mit Fu\u00df",
        "Abmessungen (Breite x Tiefe x H\u00f6he) - mit Fu\u00df": "53.1 cm x 21.1 cm x 38.7 cm",
        "Besonderheiten": "Ultra Slim Design, HDCP, rahmenlos, Skin-Tone Selection, ASUS Smart Contrast Ratio (ASCR), ASUS Splendid Video Preset Mode, 72% NTSC-Farbskala, ASUS QuickFit Virtual Scale, ASUS GamePlus, ASUS VividPixel Technology, Low Blue Light Mode, flimmerfreie Technologie, ASUS EyeCare Technology, Blaulichtfilter-Technologie, Farbtemperatur Auswahl",
        "Bildschirmbeschichtung": "Blendfrei",
        "Bildschirmtyp": "IPS",
        "Diagonalabmessung": "58.4 cm (23\")",
        "Display-Typ": "LED-hintergrundbeleuchteter LCD-Monitor / TFT-Aktivmatrix",
        "ENERGY STAR zertifiziert": "Ja",
        "Eingangsanschl\u00fcsse": "HDMI, VGA",
        "Einstellungen der Anzeigeposition": "Neigbar",
        "Energie Effizienzklasse": "E",
        "Erforderliche Netzspannung": "Wechselstrom 120/230 V (50/60 Hz)",
        "Farbe": "Schwarz",
        "Farbunterst\u00fctzung": "16,7 Millionen Farben",
        "Ger\u00e4tetyp": "LED-hintergrundbeleuchteter LCD-Monitor - 58.4 cm (23\")",
        "Gewicht": "2.7 kg",
        "Helligkeit": "250 cd/m\u00b2",
        "Hintergrundbeleuchtungs-Technologie": "LED-Hintergrundbeleuchtung",
        "Horizontale Bildwiederholrate": "54 - 85.5 kHz",
        "Horizontaler Betrachtungswinkel": "178",
        "Kennzeichnung": "UL, VCCI, C-Tick, BSMI, cUL, WHQL, CB, CCC, FCC, RoHS, WEEE, ErP Ready, CEL level 1, TUV Rheinland Low Blue Light Certification, CU, TUV Rheinland Flicker Free Certification",
        "Kontrast": "80000000:1 (dynamisch)",
        "Leistungsaufnahme im Betrieb": "21 Watt",
        "Leistungsmerkmale": "Slot f\u00fcr Sicherheitsschloss (Kabelschloss getrennt erh\u00e4ltlich)",
        "Native Aufl\u00f6sung": "Full HD (1080p) 1920 x 1080",
        "Neigungswinkel": "-5/+22",
        "Pixelpitch": "0.2652 mm",
        "Produktbeschreibung": "ASUS VZ239HE - LED-Monitor - Full HD (1080p) - 58.4 cm (23\")",
        "Reaktionszeit": "5 ms (Gray-to-Gray)",
        "Schnittstellen": "VGA  HDMI",
        "Seitenverh\u00e4ltnis": "Breitbild - 16:9",
        "Stromverbrauch (Aus-Modus)": "0.5 Watt",
        "Umweltschutzstandards": "ENERGY STAR-qualifiziert",
        "Vertikale Bildwiederholrate": "48 - 76 Hz",
        "Vertikaler Betrachtungswinkel": "178"
    },
    "raw_specifications_text": "Produktbeschreibung: ASUS VZ239HE - LED-Monitor - Full HD (1080p) - 58.4 cm (23\")\nEnergie Effizienzklasse: E\nGer\u00e4tetyp: LED-hintergrundbeleuchteter LCD-Monitor - 58.4 cm (23\")\nBildschirmtyp: IPS\nSeitenverh\u00e4ltnis: Breitbild - 16:9\nNative Aufl\u00f6sung: Full HD (1080p) 1920 x 1080\nPixelpitch: 0.2652 mm\nHelligkeit: 250 cd/m\u00b2\nKontrast: 80000000:1 (dynamisch)\nReaktionszeit: 5 ms (Gray-to-Gray)\nFarbunterst\u00fctzung: 16,7 Millionen Farben\nEingangsanschl\u00fcsse: HDMI, VGA\nEinstellungen der Anzeigeposition: Neigbar\nBildschirmbeschichtung: Blendfrei\nFarbe: Schwarz\nAbmessungen (Breite x Tiefe x H\u00f6he) - mit Fu\u00df: 53.1 cm x 21.1 cm x 38.7 cm\nGewicht: 2.7 kg\nUmweltschutzstandards: ENERGY STAR-qualifiziert\nKennzeichnung: UL, VCCI, C-Tick, BSMI, cUL, WHQL, CB, CCC, FCC, RoHS, WEEE, ErP Ready, CEL level 1, TUV Rheinland Low Blue Light Certification, CU, TUV Rheinland Flicker Free Certification\nDisplay-Typ: LED-hintergrundbeleuchteter LCD-Monitor / TFT-Aktivmatrix\nDiagonalabmessung: 58.4 cm (23\")\nVertikale Bildwiederholrate: 48 - 76 Hz\nHorizontale Bildwiederholrate: 54 - 85.5 kHz\nHorizontaler Betrachtungswinkel: 178\nVertikaler Betrachtungswinkel: 178\nHintergrundbeleuchtungs-Technologie: LED-Hintergrundbeleuchtung\nBesonderheiten: Ultra Slim Design, HDCP, rahmenlos, Skin-Tone Selection, ASUS Smart Contrast Ratio (ASCR), ASUS Splendid Video Preset Mode, 72% NTSC-Farbskala, ASUS QuickFit Virtual Scale, ASUS GamePlus, ASUS VividPixel Technology, Low Blue Light Mode, flimmerfreie Technologie, ASUS EyeCare Technology, Blaulichtfilter-Technologie, Farbtemperatur Auswahl\nAbmessungen (Breite x Tiefe x H\u00f6he): 53.1 cm x 21.1 cm x 38.7 cm - mit Fu\u00df\nSchnittstellen: VGA  HDMI\nNeigungswinkel: -5/+22\nLeistungsmerkmale: Slot f\u00fcr Sicherheitsschloss (Kabelschloss getrennt erh\u00e4ltlich)\nErforderliche Netzspannung: Wechselstrom 120/230 V (50/60 Hz)\nLeistungsaufnahme im Betrieb: 21 Watt\nStromverbrauch (Aus-Modus): 0.5 Watt\nENERGY STAR zertifiziert: Ja",
    "reference_file": "offer_reference_2393.json",
    "shop_name": "Jacob Elektronik direkt (AT)"
}