{
    "html_file": "offer_471_62.html",
    "name": "Samsung Odyssey Neo G9 G95NA (2023), 49\"",
    "offer_link": "https://www.mylemon.at/artikel/samsung/ls49ag954npxen/dis-49-s49ag954np-va.html",
    "price": 1867.59,
    "raw_specifications": {
        "AMD FreeSync": "Ja",
        "AMD FreeSync-Typ": "FreeSync Premium Pro",
        "Anzahl DisplayPort Anschl\u00fcsse": "1",
        "Anzahl HDMI-Anschl\u00fcsse": "2",
        "Anzahl der Farben des Displays": "1,07 Milliarden Farben",
        "Anzahl der nachgeschalteten Steckpl\u00e4tze vom Typ USB-A": "2",
        "Artikelnummer": "M1FYK26L",
        "Aufl\u00f6sung": "5120x1440",
        "Besonderheiten": "240 Hz, USB HUB",
        "Bewertung der Bildschirmkr\u00fcmmung": "1000R",
        "Bild-in-Bild": "Ja",
        "Bildschirmdiagonale": "124,5 cm (49 Zoll)",
        "Bildschirmdiagonale (cm)": "124 cm",
        "Bildschirmform": "Gebogen",
        "Bildschirmtechnologie": "LCD",
        "Bildwinkel, horizontal": "178\u00b0",
        "Bildwinkel, vertikal": "178\u00b0",
        "Breite (ohne Standfu\u00df)": "115 cm",
        "Display-Aufl\u00f6sung": "5120 x 1440 Pixel",
        "DisplayPort Kabell\u00e4nge": "1,5 m",
        "Displaygr\u00f6\u00dfe": "49 Zoll",
        "EAN": "8806094786552",
        "Eingebaute Lautsprecher": "Nein",
        "Energieeffizienzklasse (HDR)": "G",
        "Energieeffizienzklasse (SDR)": "G",
        "Energieeffizienzskala": "A bis G",
        "Energieverbrauch (HDR) pro 1.000 Stunden": "101 kWh",
        "Energieverbrauch (SDR) pro 1.000 Stunden": "45 kWh",
        "Ergonomie": "H\u00f6henverstellbar, Schwenkbar",
        "Flimmerfreie Technologie": "Ja",
        "Geringe Eingabeverz\u00f6gerung": "Ja",
        "Ger\u00e4tebreite (inkl. Fu\u00df)": "1149,5 mm",
        "Ger\u00e4teh\u00f6he (inkl. Fu\u00df)": "537,2 mm",
        "Ger\u00e4tetiefe (inkl. Fu\u00df)": "418,3 mm",
        "Gewicht (mit St\u00e4nder)": "14,5 kg",
        "Gewicht (ohne St\u00e4nder)": "11,9 kg",
        "HDMI": "Ja",
        "Helligkeit": "2000 cd/m\u00b2",
        "Helligkeit (typisch)": "420 cd/m\u00b2",
        "Hersteller Artikelnummer": "LS49AG954NPXEN",
        "High Dynamic Range Video (HDR) Unterst\u00fctzung": "Ja",
        "H\u00f6he (ohne Standfu\u00df)": "36,4 cm",
        "H\u00f6heneinstellung": "12 cm",
        "H\u00f6henverstellung": "Ja",
        "Integrierte Kamera": "Nein",
        "Integrierter USB-Hub": "Ja",
        "Kontrastverh\u00e4ltnis": "1000000:1",
        "Kopfh\u00f6rer-Anschluss": "3,5 mm",
        "Kopfh\u00f6rerausgang": "Ja",
        "Low-Blue-Light-Technologie": "Ja",
        "Markenspezifische Technologien": "Black Equalizer, Augenpflege+",
        "Marktpositionierung": "Gaming",
        "Maximale Bildwiederholrate": "240 Hz",
        "Mitgelieferte Kabel": "DisplayPort, HDMI, Leistung",
        "NVIDIA G-SYNC": "Ja",
        "Nachhaltigkeitskonformit\u00e4t": "Ja",
        "Nachhaltigkeitszertifikate": "CE",
        "Natives Seitenverh\u00e4ltnis": "32:9",
        "Neigungsverstellung": "Ja",
        "Neigungswinkelbereich": "-3 - 13\u00b0",
        "Netzteiltyp": "Intern",
        "On-Screen-Display (OSD)": "Ja",
        "Paketgewicht": "20,4 kg",
        "Panel": "VA",
        "Panel-Montage-Schnittstelle": "100 x 100 mm",
        "Panel-Typ": "VA",
        "Produktfarbe": "Schwarz, Wei\u00df",
        "Reaktionszeit": "1 ms",
        "Schwenkbar": "Ja",
        "Schwenkwinkelbereich": "-15 - 15\u00b0",
        "Stromkabell\u00e4nge": "1,5 m",
        "Stromverbrauch (Standardbetrieb)": "45 W",
        "Stromverbrauch (Standby)": "0,5 W",
        "Stromverbrauch (aus)": "0,3 W",
        "St\u00e4nder enthalten": "Ja",
        "Technologie mit hohem Dynamikbereich (HDR)": "Quantum HDR 2000",
        "Tiefe (ohne Standfu\u00df)": "28,7 cm",
        "Touchscreen": "Nein",
        "USB-Hub-Version": "3.2 Gen 1 (3.1 Gen 1)",
        "VESA Halterung": "100x100 mm",
        "VESA-Halterung": "Ja",
        "Verpackungsart": "Box",
        "Verpackungsbreite": "1265 mm",
        "Verpackungsh\u00f6he": "366 mm",
        "Verpackungstiefe": "481 mm",
        "Video Anschl\u00fcsse": "2x HDMI, 1x DisplayPort",
        "Wandmontage": "Ja"
    },
    "raw_specifications_text": "Displaygr\u00f6\u00dfe: 49 Zoll\nAufl\u00f6sung: 5120x1440\nPanel: VA\nReaktionszeit: 1 ms\nVideo Anschl\u00fcsse: 2x HDMI, 1x DisplayPort\nErgonomie: H\u00f6henverstellbar, Schwenkbar\nVESA Halterung: 100x100 mm\nHelligkeit: 2000 cd/m\u00b2\nBesonderheiten: 240 Hz, USB HUB\nHersteller Artikelnummer: LS49AG954NPXEN\nEAN: 8806094786552\nArtikelnummer: M1FYK26L\nBildschirmdiagonale: 124,5 cm (49 Zoll)\nDisplay-Aufl\u00f6sung: 5120 x 1440 Pixel\nNatives Seitenverh\u00e4ltnis: 32:9\nBildschirmtechnologie: LCD\nTouchscreen: Nein\nPanel-Typ: VA\nBildschirmform: Gebogen\nKontrastverh\u00e4ltnis: 1000000:1\nMaximale Bildwiederholrate: 240 Hz\nAnzahl der Farben des Displays: 1,07 Milliarden Farben\nHelligkeit (typisch): 420 cd/m\u00b2\nBewertung der Bildschirmkr\u00fcmmung: 1000R\nBildwinkel, horizontal: 178\u00b0\nBildwinkel, vertikal: 178\u00b0\nBildschirmdiagonale (cm): 124 cm\nHigh Dynamic Range Video (HDR) Unterst\u00fctzung: Ja\nTechnologie mit hohem Dynamikbereich (HDR): Quantum HDR 2000\nNVIDIA G-SYNC: Ja\nAMD FreeSync: Ja\nAMD FreeSync-Typ: FreeSync Premium Pro\nMarkenspezifische Technologien: Black Equalizer, Augenpflege+\nFlimmerfreie Technologie: Ja\nLow-Blue-Light-Technologie: Ja\nGeringe Eingabeverz\u00f6gerung: Ja\nEingebaute Lautsprecher: Nein\nIntegrierte Kamera: Nein\nMarktpositionierung: Gaming\nProduktfarbe: Schwarz, Wei\u00df\nIntegrierter USB-Hub: Ja\nHDMI: Ja\nKopfh\u00f6rerausgang: Ja\nUSB-Hub-Version: 3.2 Gen 1 (3.1 Gen 1)\nAnzahl der nachgeschalteten Steckpl\u00e4tze vom Typ USB-A: 2\nAnzahl HDMI-Anschl\u00fcsse: 2\nAnzahl DisplayPort Anschl\u00fcsse: 1\nKopfh\u00f6rer-Anschluss: 3,5 mm\nVESA-Halterung: Ja\nH\u00f6henverstellung: Ja\nPanel-Montage-Schnittstelle: 100 x 100 mm\nWandmontage: Ja\nH\u00f6heneinstellung: 12 cm\nSchwenkbar: Ja\nSchwenkwinkelbereich: -15 - 15\u00b0\nNeigungswinkelbereich: -3 - 13\u00b0\nBild-in-Bild: Ja\nOn-Screen-Display (OSD): Ja\nNeigungsverstellung: Ja\nEnergieeffizienzklasse (SDR): G\nEnergieeffizienzklasse (HDR): G\nEnergieverbrauch (SDR) pro 1.000 Stunden: 45 kWh\nEnergieverbrauch (HDR) pro 1.000 Stunden: 101 kWh\nStromverbrauch (Standardbetrieb): 45 W\nStromverbrauch (Standby): 0,5 W\nStromverbrauch (aus): 0,3 W\nNetzteiltyp: Intern\nEnergieeffizienzskala: A bis G\nSt\u00e4nder enthalten: Ja\nMitgelieferte Kabel: DisplayPort, HDMI, Leistung\nDisplayPort Kabell\u00e4nge: 1,5 m\nStromkabell\u00e4nge: 1,5 m\nGer\u00e4tebreite (inkl. Fu\u00df): 1149,5 mm\nGer\u00e4tetiefe (inkl. Fu\u00df): 418,3 mm\nGer\u00e4teh\u00f6he (inkl. Fu\u00df): 537,2 mm\nGewicht (mit St\u00e4nder): 14,5 kg\nBreite (ohne Standfu\u00df): 115 cm\nTiefe (ohne Standfu\u00df): 28,7 cm\nH\u00f6he (ohne Standfu\u00df): 36,4 cm\nGewicht (ohne St\u00e4nder): 11,9 kg\nVerpackungsbreite: 1265 mm\nVerpackungstiefe: 481 mm\nVerpackungsh\u00f6he: 366 mm\nPaketgewicht: 20,4 kg\nVerpackungsart: Box\nNachhaltigkeitskonformit\u00e4t: Ja\nNachhaltigkeitszertifikate: CE",
    "reference_file": "offer_reference_471.json",
    "shop_name": "mylemon.at"
}