{
    "html_file": "offer_1708_6.html",
    "name": "Philips P-line 326P1H, 31.5\"",
    "offer_link": "https://www.proshop.at/Bildschirm/Philips-32-Bildschirm-P-line-326P1H-Black-4-ms/2914455?utm_source=geizhals&utm_medium=cpc&utm_campaign=pricesite",
    "price": 443.86,
    "raw_specifications": {
        "Abmessungen (Breite x Tiefe x H\u00f6he)": "71.4 cm x 28 cm x 64.9 cm - mit Fu\u00df",
        "Abmessungen (Breite x Tiefe x H\u00f6he) - mit Fu\u00df": "71.4 cm x 28 cm x 64.9 cm",
        "Ausgangsleistung/Kanal": "5 Watt",
        "Besonderheiten": "Bleifrei, PowerSensor, SmartImage, Low Blue Light Mode, flimmerfreie Technologie, BFR/PVC-frei, ohne Quecksilber, Adaptive-Sync-Technologie, LightSensor, EasyRead, Monitorkalibrierung Delta E<2, SmartControl",
        "Bildschirmbeschichtung": "Blendfrei, 3H Hard Coating, Haze 25 %",
        "Bildschirmtyp": "IPS",
        "Details zu Abmessungen & Gewicht": "Mit Standfu\u00df (h\u00f6chste Position) - Breite: 71.4 cm - Tiefe: 28 cm - H\u00f6he: 64.9 cm - Gewicht: 12.22 kg  Ohne Fu\u00df - Breite: 71.4 cm - Tiefe: 6.2 cm - H\u00f6he: 42.2 cm - Gewicht: 8.21 kg",
        "Diagonalabmessung": "81.3 cm (32\")",
        "Display-Typ": "LED-hintergrundbeleuchteter LCD-Monitor / TFT-Aktivmatrix",
        "EAN": "8712581768096",
        "ENERGY STAR zertifiziert": "Ja",
        "ENERGY STAR-Version": "8.0",
        "Ein-/Aus-Schalter": "Ja",
        "Eingangsanschl\u00fcsse": "2xHDMI, DisplayPort, USB-C",
        "Eingangsspannung": "Wechselstrom 120/230 V (50/60 Hz)",
        "Einstellungen der Anzeigeposition": "H\u00f6he, Pivot (Rotation), Drehung, Neigung",
        "Energie Effizienzklasse": "Klasse G",
        "Energieverbrauch pro Jahr": "58 kWh",
        "Enthaltene Kabel": "1 x HDMI-Kabel  1 x DisplayPort-Kabel  1 x Kabel USB-C auf USB-C / USB-A",
        "Ethernet integriert": "Ja",
        "Farbe": "Black Texture",
        "Farbraum": "101.7% sRGB, 88% Adobe RGB, 89% NTSC",
        "Farbunterst\u00fctzung": "1,07 Mrd. Farben",
        "Ger\u00e4tetyp": "LED-hintergrundbeleuchteter LCD-Monitor - 81.3 cm (32\")",
        "Gewicht": "12.22 kg",
        "Helligkeit": "350 cd/m\u00b2",
        "Hersteller": "Philips",
        "Hintergrundbeleuchtungs-Technologie": "WLED",
        "Horizontale Bildwiederholrate": "30 - 114 kHz",
        "Horizontaler Betrachtungswinkel": "178",
        "H\u00f6heneinstellung": "180 mm",
        "Integrierte Peripherieger\u00e4te": "USB Hub, 2,0-Megapixel-Kamera, Gigabit Ethernet-Netzwerkadapter",
        "Kennzeichnung": "Plug and Play, FCC Klasse B bescheinigt, TUV, TUV GS, ICES-003, SEMKO, CB, CCC, TUV Ergo, DDC/CI, RoHS, CECP, CEL, EPA, CU-EAC, EAEU RoHS",
        "Kontrast": "1000:1 / 50000000:1 (dynamisch)",
        "Leistungsaufnahme im Ein-Zustand": "38.9 W",
        "Leistungsmerkmale": "Slot f\u00fcr Sicherheitsschloss (Kabelschloss getrennt erh\u00e4ltlich)",
        "MTBF": "70,000 Stunde(n)",
        "Modell": "326P1H/00",
        "Native Aufl\u00f6sung": "QHD 2560 x 1440 bei 75 Hz",
        "Neigungswinkel": "-5/+25",
        "OSD-Sprachen": "Multilingual",
        "Pixelpitch": "0.2727 mm",
        "Ppi": "93",
        "Produktbeschreibung": "Philips P-line 326P1H - LED-Monitor - 81.3 cm (32\")",
        "Reaktionszeit": "4 ms (gray-to-gray)",
        "Rotationswinkel": "180",
        "Schlosstyp zur Diebstahlsicherung": "Kensington Slot",
        "Schnittstellen": "DisplayPort 1.4 (HDCP 2.2)  2 x HDMI (HDCP 2.2)  USB-C 3,2 Gen 1 Upstream (Stromversorgung bis zu 90 W, HDCP 2.2)  DisplayPort-Ausgang  USB 3.2 Downstream (Schnellladung)  3 x USB 3.2 Downstream  Audio Line-Out  Netzwerk (RJ-45)",
        "Schwenkwinkel": "360",
        "Seitenverh\u00e4ltnis": "16:9",
        "Sichtbare Bildfl\u00e4che": "80 cm (31.5\")",
        "Spannung": "Wechselstrom 120/230 V (50/60 Hz)",
        "Stromverbrauch (Aus-Modus)": "0 Watt",
        "Stromverbrauch (typisch)": "39 Watt",
        "Stromverbrauch SDR (eingeschaltet)": "38.9 kWh/1.000 h",
        "Stromverbrauch im Standby-Modus": "0.3 Watt",
        "TCO-zertifiziert": "TCO Certified Displays 8, TCO Certified Edge Displays",
        "Transportbreite": "93 cm",
        "Transportgewicht": "15.53 kg",
        "Transporth\u00f6he": "56.3 cm",
        "Transporttiefe": "18.6 cm",
        "Typ": "Lautsprecher - Stereo",
        "USB-Spannungsversorgung": "90 Watt",
        "Umweltschutzstandards": "TCO Certified Displays 8, TCO Certified Edge Displays, ENERGY STAR-qualifiziert",
        "VESA-Halterung": "100 x 100 mm",
        "Vertikale Bildwiederholrate": "48 - 75 Hz",
        "Vertikaler Betrachtungswinkel": "178",
        "Waren-Nr.": "2914455",
        "Zum Hersteller": "www.philips.com"
    },
    "raw_specifications_text": "Hersteller: Philips\nWaren-Nr.: 2914455\nModell: 326P1H/00\nEAN: 8712581768096\nZum Hersteller: www.philips.com\nProduktbeschreibung: Philips P-line 326P1H - LED-Monitor - 81.3 cm (32\")\nGer\u00e4tetyp: LED-hintergrundbeleuchteter LCD-Monitor - 81.3 cm (32\")\nEnergie Effizienzklasse: Klasse G\nEnergieverbrauch pro Jahr: 58 kWh\nLeistungsaufnahme im Ein-Zustand: 38.9 W\nLeistungsmerkmale: Slot f\u00fcr Sicherheitsschloss (Kabelschloss getrennt erh\u00e4ltlich)\nBildschirmtyp: IPS\nSeitenverh\u00e4ltnis: 16:9\nNative Aufl\u00f6sung: QHD 2560 x 1440 bei 75 Hz\nPixelpitch: 0.2727 mm\nHelligkeit: 350 cd/m\u00b2\nKontrast: 1000:1 / 50000000:1 (dynamisch)\nReaktionszeit: 4 ms (gray-to-gray)\nFarbunterst\u00fctzung: 1,07 Mrd. Farben\nFarbraum: 101.7% sRGB, 88% Adobe RGB, 89% NTSC\nEingangsanschl\u00fcsse: 2xHDMI, DisplayPort, USB-C\nEthernet integriert: Ja\nEinstellungen der Anzeigeposition: H\u00f6he, Pivot (Rotation), Drehung, Neigung\nBildschirmbeschichtung: Blendfrei, 3H Hard Coating, Haze 25 %\nSpannung: Wechselstrom 120/230 V (50/60 Hz)\nFarbe: Black Texture\nAbmessungen (Breite x Tiefe x H\u00f6he) - mit Fu\u00df: 71.4 cm x 28 cm x 64.9 cm\nGewicht: 12.22 kg\nUmweltschutzstandards: TCO Certified Displays 8, TCO Certified Edge Displays, ENERGY STAR-qualifiziert\nKennzeichnung: Plug and Play, FCC Klasse B bescheinigt, TUV, TUV GS, ICES-003, SEMKO, CB, CCC, TUV Ergo, DDC/CI, RoHS, CECP, CEL, EPA, CU-EAC, EAEU RoHS\nDisplay-Typ: LED-hintergrundbeleuchteter LCD-Monitor / TFT-Aktivmatrix\nDiagonalabmessung: 81.3 cm (32\")\nSichtbare Bildfl\u00e4che: 80 cm (31.5\")\nIntegrierte Peripherieger\u00e4te: USB Hub, 2,0-Megapixel-Kamera, Gigabit Ethernet-Netzwerkadapter\nUSB-Spannungsversorgung: 90 Watt\nPpi: 93\nVertikale Bildwiederholrate: 48 - 75 Hz\nHorizontale Bildwiederholrate: 30 - 114 kHz\nHorizontaler Betrachtungswinkel: 178\nVertikaler Betrachtungswinkel: 178\nHintergrundbeleuchtungs-Technologie: WLED\nOSD-Sprachen: Multilingual\nBesonderheiten: Bleifrei, PowerSensor, SmartImage, Low Blue Light Mode, flimmerfreie Technologie, BFR/PVC-frei, ohne Quecksilber, Adaptive-Sync-Technologie, LightSensor, EasyRead, Monitorkalibrierung Delta E<2, SmartControl\nAbmessungen (Breite x Tiefe x H\u00f6he): 71.4 cm x 28 cm x 64.9 cm - mit Fu\u00df\nTyp: Lautsprecher - Stereo\nAusgangsleistung/Kanal: 5 Watt\nSchnittstellen: DisplayPort 1.4 (HDCP 2.2)  2 x HDMI (HDCP 2.2)  USB-C 3,2 Gen 1 Upstream (Stromversorgung bis zu 90 W, HDCP 2.2)  DisplayPort-Ausgang  USB 3.2 Downstream (Schnellladung)  3 x USB 3.2 Downstream  Audio Line-Out  Netzwerk (RJ-45)\nNeigungswinkel: -5/+25\nSchwenkwinkel: 360\nRotationswinkel: 180\nH\u00f6heneinstellung: 180 mm\nVESA-Halterung: 100 x 100 mm\nEnthaltene Kabel: 1 x HDMI-Kabel  1 x DisplayPort-Kabel  1 x Kabel USB-C auf USB-C / USB-A\nMTBF: 70,000 Stunde(n)\nSchlosstyp zur Diebstahlsicherung: Kensington Slot\nEingangsspannung: Wechselstrom 120/230 V (50/60 Hz)\nStromverbrauch SDR (eingeschaltet): 38.9 kWh/1.000 h\nStromverbrauch (typisch): 39 Watt\nStromverbrauch im Standby-Modus: 0.3 Watt\nStromverbrauch (Aus-Modus): 0 Watt\nEin-/Aus-Schalter: Ja\nDetails zu Abmessungen & Gewicht: Mit Standfu\u00df (h\u00f6chste Position) - Breite: 71.4 cm - Tiefe: 28 cm - H\u00f6he: 64.9 cm - Gewicht: 12.22 kg  Ohne Fu\u00df - Breite: 71.4 cm - Tiefe: 6.2 cm - H\u00f6he: 42.2 cm - Gewicht: 8.21 kg\nTransportbreite: 93 cm\nTransporttiefe: 18.6 cm\nTransporth\u00f6he: 56.3 cm\nTransportgewicht: 15.53 kg\nTCO-zertifiziert: TCO Certified Displays 8, TCO Certified Edge Displays\nENERGY STAR zertifiziert: Ja\nENERGY STAR-Version: 8.0",
    "reference_file": "offer_reference_1708.json",
    "shop_name": "Proshop.at"
}