{
    "html_file": "offer_2301_24.html",
    "name": "ASUS VA249HE, 23.8\"",
    "offer_link": "https://direkt.jacob.de/produkte/asus-59-9cm-essential-90lm02w1-b02370-artnr-4295683.html?utm_source=geizhals&utm_medium=cpc&utm_campaign=Preisvergleich&ref=103",
    "price": 117.84,
    "raw_specifications": {
        "Abmessungen (Breite x Tiefe x H\u00f6he)": "55.24 cm x 20.5 cm x 39.69 cm - mit Fu\u00df",
        "Abmessungen (Breite x Tiefe x H\u00f6he) - mit Fu\u00df": "55.24 cm x 20.5 cm x 39.69 cm",
        "Besonderheiten": "Skin-Tone Selection, Trace Free Technology, ASUS Smart Contrast Ratio (ASCR), ASUS Splendid Video Preset Mode, ASUS GamePlus, ASUS VividPixel Technology, Low Blue Light Mode, flimmerfreie Technologie, ASUS SplendidPlus Video Intelligence Technology, ASUS EyeCare Technology, Farbtemperatur Auswahl",
        "Bildschirmbeschichtung": "Blendfrei",
        "Bildschirmtyp": "VA",
        "Details zu Abmessungen & Gewicht": "Ohne Fu\u00df - Breite: 55.24 cm - Tiefe: 5.66 cm - H\u00f6he: 33.4 cm  Mit Fu\u00df - Breite: 55.24 cm - Tiefe: 20.5 cm - H\u00f6he: 39.69 cm - Gewicht: 3.7 kg",
        "Diagonalabmessung": "60.5 cm (23.8\")",
        "Display-Typ": "LED-hintergrundbeleuchteter LCD-Monitor / TFT-Aktivmatrix",
        "Eingangsanschl\u00fcsse": "HDMI, VGA",
        "Einstellungen der Anzeigeposition": "Neigbar",
        "Energie Effizienzklasse": "F",
        "Energieverbrauch pro Jahr": "37 kWh",
        "Erforderliche Netzspannung": "Wechselstrom 120/230 V (50/60 Hz)",
        "Farbe": "Schwarz",
        "Farbunterst\u00fctzung": "16,7 Millionen Farben",
        "Ger\u00e4tetyp": "LED-hintergrundbeleuchteter LCD-Monitor - 60.5 cm (23.8\")",
        "Gewicht": "3.7 kg",
        "Helligkeit": "250 cd/m\u00b2",
        "Hintergrundbeleuchtungs-Technologie": "LED-Hintergrundbeleuchtung",
        "Horizontale Bildwiederholrate": "30 - 83 kHz",
        "Horizontaler Betrachtungswinkel": "178",
        "Kennzeichnung": "BSMI, WHQL, CB, CCC, RoHS, WEEE, TUV Rheinland Low Blue Light Certification, CEL level 0, TUV Rheinland Flicker Free Certification",
        "Kontrast": "3000:1 / 100000000:1 (dynamisch)",
        "Leistungsaufnahme im Betrieb": "22.97 Watt",
        "Leistungsaufnahme im Ein-Zustand": "25 W",
        "Leistungsmerkmale": "Slot f\u00fcr Sicherheitsschloss (Kabelschloss getrennt erh\u00e4ltlich)",
        "Native Aufl\u00f6sung": "Full HD (1080p) 1920 x 1080",
        "Neigungswinkel": "-5/+20",
        "Produktbeschreibung": "ASUS VA249HE - LED-Monitor - Full HD (1080p) - 60.5 cm (23.8\")",
        "Reaktionszeit": "5 ms (Gray-to-Gray)",
        "Schlosstyp zur Diebstahlsicherung": "Kensington Slot",
        "Schnittstellen": "VGA  HDMI",
        "Seitenverh\u00e4ltnis": "16:9",
        "Stromverbrauch (Aus-Modus)": "0.5 Watt",
        "Stromverbrauch im Standby-Modus": "0.5 Watt",
        "Transportbreite": "62.8 cm",
        "Transportgewicht": "5.2 kg",
        "Transporth\u00f6he": "14.7 cm",
        "Transporttiefe": "46 cm",
        "Vertikale Bildwiederholrate": "49 - 76 Hz",
        "Vertikaler Betrachtungswinkel": "178"
    },
    "raw_specifications_text": "Produktbeschreibung: ASUS VA249HE - LED-Monitor - Full HD (1080p) - 60.5 cm (23.8\")\nGer\u00e4tetyp: LED-hintergrundbeleuchteter LCD-Monitor - 60.5 cm (23.8\")\nEnergie Effizienzklasse: F\nEnergieverbrauch pro Jahr: 37 kWh\nLeistungsaufnahme im Ein-Zustand: 25 W\nBildschirmtyp: VA\nSeitenverh\u00e4ltnis: 16:9\nNative Aufl\u00f6sung: Full HD (1080p) 1920 x 1080\nHelligkeit: 250 cd/m\u00b2\nKontrast: 3000:1 / 100000000:1 (dynamisch)\nReaktionszeit: 5 ms (Gray-to-Gray)\nFarbunterst\u00fctzung: 16,7 Millionen Farben\nEingangsanschl\u00fcsse: HDMI, VGA\nEinstellungen der Anzeigeposition: Neigbar\nBildschirmbeschichtung: Blendfrei\nFarbe: Schwarz\nAbmessungen (Breite x Tiefe x H\u00f6he) - mit Fu\u00df: 55.24 cm x 20.5 cm x 39.69 cm\nGewicht: 3.7 kg\nKennzeichnung: BSMI, WHQL, CB, CCC, RoHS, WEEE, TUV Rheinland Low Blue Light Certification, CEL level 0, TUV Rheinland Flicker Free Certification\nDisplay-Typ: LED-hintergrundbeleuchteter LCD-Monitor / TFT-Aktivmatrix\nDiagonalabmessung: 60.5 cm (23.8\")\nVertikale Bildwiederholrate: 49 - 76 Hz\nHorizontale Bildwiederholrate: 30 - 83 kHz\nHorizontaler Betrachtungswinkel: 178\nVertikaler Betrachtungswinkel: 178\nHintergrundbeleuchtungs-Technologie: LED-Hintergrundbeleuchtung\nBesonderheiten: Skin-Tone Selection, Trace Free Technology, ASUS Smart Contrast Ratio (ASCR), ASUS Splendid Video Preset Mode, ASUS GamePlus, ASUS VividPixel Technology, Low Blue Light Mode, flimmerfreie Technologie, ASUS SplendidPlus Video Intelligence Technology, ASUS EyeCare Technology, Farbtemperatur Auswahl\nAbmessungen (Breite x Tiefe x H\u00f6he): 55.24 cm x 20.5 cm x 39.69 cm - mit Fu\u00df\nSchnittstellen: VGA  HDMI\nNeigungswinkel: -5/+20\nLeistungsmerkmale: Slot f\u00fcr Sicherheitsschloss (Kabelschloss getrennt erh\u00e4ltlich)\nSchlosstyp zur Diebstahlsicherung: Kensington Slot\nErforderliche Netzspannung: Wechselstrom 120/230 V (50/60 Hz)\nLeistungsaufnahme im Betrieb: 22.97 Watt\nStromverbrauch im Standby-Modus: 0.5 Watt\nStromverbrauch (Aus-Modus): 0.5 Watt\nDetails zu Abmessungen & Gewicht: Ohne Fu\u00df - Breite: 55.24 cm - Tiefe: 5.66 cm - H\u00f6he: 33.4 cm  Mit Fu\u00df - Breite: 55.24 cm - Tiefe: 20.5 cm - H\u00f6he: 39.69 cm - Gewicht: 3.7 kg\nTransportbreite: 62.8 cm\nTransporttiefe: 46 cm\nTransporth\u00f6he: 14.7 cm\nTransportgewicht: 5.2 kg",
    "reference_file": "offer_reference_2301.json",
    "shop_name": "Jacob Elektronik direkt (AT)"
}