{
    "html_file": "offer_2206_4.html",
    "name": "BenQ BL2381T, 22.5\"",
    "offer_link": "https://www.proshop.at/Bildschirm/BenQ-22-Bildschirm-BL2381T-Black-5-ms/2717435?utm_source=geizhals&utm_medium=cpc&utm_campaign=pricesite",
    "price": 176.68,
    "raw_specifications": {
        "Abmessungen (Breite x Tiefe x H\u00f6he)": "50.2 cm x 5.7 cm x 34.2 cm - ohne Fu\u00df",
        "Abmessungen (Breite x Tiefe x H\u00f6he) - ohne Fu\u00df": "50.2 cm x 5.7 cm x 34.2 cm",
        "Ausgangsleistung/Kanal": "1 Watt",
        "Besonderheiten": "Eco-Mode, AMA-Technologie (Advanced Motion Accelerator), Spielmodus, Low Blue Light Mode, flimmerfreie Technologie, ecoFACTS Label, schmaler Rahmen, Color Weakness Mode, breiter Betrachtungswinkel, Movie Mode, sRGB Mode, Eye-Care Technology, Brightness Intelligence Technology, Photo Mode, 72 % NTSC Farbraum",
        "Bildschirmbeschichtung": "Blendfrei",
        "Bildschirmtyp": "IPS",
        "Details zu Abmessungen & Gewicht": "Ohne Fu\u00df - Breite: 50.2 cm - Tiefe: 5.7 cm - H\u00f6he: 34.2 cm - Gewicht: 3.26 kg  Mit Standfu\u00df (h\u00f6chste Position) - Breite: 50.2 cm - Tiefe: 23 cm - H\u00f6he: 52.8 cm - Gewicht: 5.9 kg  Mit Standfu\u00df (niedrigste Position) - Breite: 50.2 cm - Tiefe: 23 cm - H\u00f6he: 42.8 cm - Gewicht: 5.9 kg",
        "Diagonalabmessung": "57.2 cm (22.5\")",
        "Display-Typ": "LED-hintergrundbeleuchteter LCD-Monitor / TFT-Aktivmatrix",
        "EAN": "4718755077180",
        "Eingangsanschl\u00fcsse": "HDMI, DVI-D, VGA, DisplayPort",
        "Eingangsspannung": "Wechselstrom 120/230 V",
        "Einstellungen der Anzeigeposition": "H\u00f6he, Pivot (Rotation), Drehung, Neigung",
        "Energie Effizienzklasse": "Klasse E",
        "Energierverbrauch Sleep": "0.5 Watt",
        "Energieverbrauch pro Jahr": "27 kWh",
        "Erforderliches Betriebssystem": "Microsoft Windows 7, Windows 8, Windows 8.1, Windows 10",
        "Farbe": "Schwarz",
        "Farbraum": "72% NTSC",
        "Farbtemperatur": "9300K, 6500K, 5700K",
        "Farbunterst\u00fctzung": "16,7 Millionen Farben",
        "Ger\u00e4tetyp": "LED-hintergrundbeleuchteter LCD-Monitor - 57.2 cm (22.5\")",
        "Gewicht": "3.26 kg",
        "Helligkeit": "250 cd/m\u00b2",
        "Hersteller": "BenQ",
        "Hintergrundbeleuchtungs-Technologie": "LED-Hintergrundbeleuchtung",
        "Horizontaler Betrachtungswinkel": "178",
        "H\u00f6heneinstellung": "140 mm",
        "Kennzeichnung": "TUV Rheinland, DisplayPort 1.2, HDCP 1.4",
        "Kontrast": "1000:1 / 20000000:1 (dynamisch)",
        "Leistungsaufnahme im Ein-Zustand": "14.6 W",
        "Modell": "9H.LHMLA.TBE",
        "Native Aufl\u00f6sung": "WUXGA 1920 x 1200",
        "Neigungswinkel": "-5/+20",
        "OSD-Sprachen": "Ungarisch, Tschechisch, Chinesisch (vereinfacht), Englisch, Deutsch, Franz\u00f6sisch, Italienisch, Portugiesisch, Polnisch, Schwedisch, Russisch, Spanisch, Holl\u00e4ndisch, Arabisch, Rum\u00e4nisch, Japanisch, Chinesisch, Koreanisch",
        "Pixelpitch": "0.254 mm",
        "Ppi": "101",
        "Produktbeschreibung": "BenQ BL2381T - LED-Monitor - 57.2 cm (22.5\")",
        "Reaktionszeit": "5 ms (Gray-to-Gray)",
        "Rotationswinkel": "90",
        "Schnittstellen": "VGA  HDMI  Audio Line-In  Kopfh\u00f6rer  DisplayPort  DVI-D",
        "Schwenkwinkel": "90",
        "Seitenverh\u00e4ltnis": "16:10",
        "Spannung": "Wechselstrom 120/230 V",
        "Stromverbrauch (typisch)": "52 Watt",
        "Stromverbrauch SDR (eingeschaltet)": "14.6 kWh/1.000 h",
        "Stromverbrauch im Standby-Modus": "0.5 Watt",
        "Transportgewicht": "6.3 kg",
        "Typ": "Lautsprecher - Stereo",
        "Umweltschutzstandards": "TCO Certified Displays 7, ENERGY STAR-qualifiziert",
        "VESA-Halterung": "100 x 100 mm",
        "Vertikaler Betrachtungswinkel": "178",
        "Waren-Nr.": "2717435",
        "Zum Hersteller": "benq.com"
    },
    "raw_specifications_text": "Hersteller: BenQ\nWaren-Nr.: 2717435\nModell: 9H.LHMLA.TBE\nEAN: 4718755077180\nZum Hersteller: benq.com\nProduktbeschreibung: BenQ BL2381T - LED-Monitor - 57.2 cm (22.5\")\nGer\u00e4tetyp: LED-hintergrundbeleuchteter LCD-Monitor - 57.2 cm (22.5\")\nEnergie Effizienzklasse: Klasse E\nEnergieverbrauch pro Jahr: 27 kWh\nLeistungsaufnahme im Ein-Zustand: 14.6 W\nBildschirmtyp: IPS\nSeitenverh\u00e4ltnis: 16:10\nNative Aufl\u00f6sung: WUXGA 1920 x 1200\nPixelpitch: 0.254 mm\nHelligkeit: 250 cd/m\u00b2\nKontrast: 1000:1 / 20000000:1 (dynamisch)\nReaktionszeit: 5 ms (Gray-to-Gray)\nFarbunterst\u00fctzung: 16,7 Millionen Farben\nFarbraum: 72% NTSC\nEingangsanschl\u00fcsse: HDMI, DVI-D, VGA, DisplayPort\nEinstellungen der Anzeigeposition: H\u00f6he, Pivot (Rotation), Drehung, Neigung\nBildschirmbeschichtung: Blendfrei\nSpannung: Wechselstrom 120/230 V\nFarbe: Schwarz\nAbmessungen (Breite x Tiefe x H\u00f6he) - ohne Fu\u00df: 50.2 cm x 5.7 cm x 34.2 cm\nGewicht: 3.26 kg\nUmweltschutzstandards: TCO Certified Displays 7, ENERGY STAR-qualifiziert\nKennzeichnung: TUV Rheinland, DisplayPort 1.2, HDCP 1.4\nDisplay-Typ: LED-hintergrundbeleuchteter LCD-Monitor / TFT-Aktivmatrix\nDiagonalabmessung: 57.2 cm (22.5\")\nPpi: 101\nHorizontaler Betrachtungswinkel: 178\nVertikaler Betrachtungswinkel: 178\nHintergrundbeleuchtungs-Technologie: LED-Hintergrundbeleuchtung\nFarbtemperatur: 9300K, 6500K, 5700K\nOSD-Sprachen: Ungarisch, Tschechisch, Chinesisch (vereinfacht), Englisch, Deutsch, Franz\u00f6sisch, Italienisch, Portugiesisch, Polnisch, Schwedisch, Russisch, Spanisch, Holl\u00e4ndisch, Arabisch, Rum\u00e4nisch, Japanisch, Chinesisch, Koreanisch\nBesonderheiten: Eco-Mode, AMA-Technologie (Advanced Motion Accelerator), Spielmodus, Low Blue Light Mode, flimmerfreie Technologie, ecoFACTS Label, schmaler Rahmen, Color Weakness Mode, breiter Betrachtungswinkel, Movie Mode, sRGB Mode, Eye-Care Technology, Brightness Intelligence Technology, Photo Mode, 72 % NTSC Farbraum\nAbmessungen (Breite x Tiefe x H\u00f6he): 50.2 cm x 5.7 cm x 34.2 cm - ohne Fu\u00df\nTyp: Lautsprecher - Stereo\nAusgangsleistung/Kanal: 1 Watt\nSchnittstellen: VGA  HDMI  Audio Line-In  Kopfh\u00f6rer  DisplayPort  DVI-D\nNeigungswinkel: -5/+20\nSchwenkwinkel: 90\nRotationswinkel: 90\nH\u00f6heneinstellung: 140 mm\nVESA-Halterung: 100 x 100 mm\nEingangsspannung: Wechselstrom 120/230 V\nStromverbrauch SDR (eingeschaltet): 14.6 kWh/1.000 h\nStromverbrauch (typisch): 52 Watt\nStromverbrauch im Standby-Modus: 0.5 Watt\nEnergierverbrauch Sleep: 0.5 Watt\nErforderliches Betriebssystem: Microsoft Windows 7, Windows 8, Windows 8.1, Windows 10\nDetails zu Abmessungen & Gewicht: Ohne Fu\u00df - Breite: 50.2 cm - Tiefe: 5.7 cm - H\u00f6he: 34.2 cm - Gewicht: 3.26 kg  Mit Standfu\u00df (h\u00f6chste Position) - Breite: 50.2 cm - Tiefe: 23 cm - H\u00f6he: 52.8 cm - Gewicht: 5.9 kg  Mit Standfu\u00df (niedrigste Position) - Breite: 50.2 cm - Tiefe: 23 cm - H\u00f6he: 42.8 cm - Gewicht: 5.9 kg\nTransportgewicht: 6.3 kg",
    "reference_file": "offer_reference_2206.json",
    "shop_name": "Proshop.at"
}