{
    "html_file": "offer_2008_30.html",
    "name": "LG 43UN700-B, 42.5\"",
    "offer_link": "https://www.electronicshop24.at/product_info.php?products_id=250000001683012988&ano=A-C1683012988&mno=43UN700-B.AEU&ean=8806098699773&utm_medium=cpc&utm_campaign=preisvergleich&utm_content=item&utm_source=geizhals&ref=geizhals",
    "price": 825.0,
    "raw_specifications": {
        "Abmessungen (Breite x Tiefe x H\u00f6he)": "96.7 cm x 27.5 cm x 64.76 cm - mit Fu\u00df",
        "Besonderheiten": "Bild f\u00fcr Bild, Mega Dynamic Contrast Ratio, Multiscan Support, Black Stabilizer, DAS Mode (Dynamic Action Sync), Picture-in-Picture, 8-bit + FRC Farbtiefe",
        "Bildschirmbeschichtung": "Anti-glare 3H hardness",
        "Bildschirmtyp": "AH-IPS",
        "Details zu Abmessungen & Gewicht": "Mit Fu\u00df - Breite: 96.7 cm - Tiefe: 27.5 cm - H\u00f6he: 64.76 cm - Gewicht: 17.5 kg \u00a6 Ohne Fu\u00df - Breite: 96.7 cm - Tiefe: 7.06 cm - H\u00f6he: 57.52 cm - Gewicht: 13.8 kg",
        "Diagonalabmessung": "109.2 cm (43\")",
        "Display-Typ": "LED-hintergrundbeleuchteter LCD-Monitor / TFT-Aktivmatrix",
        "Eingangsspannung": "Wechselstrom 120/230 V (50/60 Hz)",
        "Einstellungen der Anzeigeposition": "Neigung",
        "Energie Effizienzklasse": "Klasse G",
        "Energieklasse (HDR)": "Klasse G",
        "Energieverbrauch pro Jahr": "99 kWh",
        "Enthaltene Kabel": "DisplayPort-Kabel - 1.8 m \u00a6 HDMI-Kabel \u00a6 Kabel USB 3.0 Typ C auf Typ A",
        "Farbe": "Mattschwarz",
        "Farbunterst\u00fctzung": "1,073 Milliarden Farben (8-Bit)",
        "Gewicht": "17.5 kg",
        "HDR-Format": "HDR10",
        "Helligkeit": "400 cd/m\u00b2",
        "Hintergrundbeleuchtungs-Technologie": "WLED",
        "Horizontale Bildwiederholrate": "30 - 135 kHz",
        "Horizontaler Betrachtungswinkel": "178",
        "Kennzeichnung": "TUV, VESA DDCCi",
        "Kontrast": "1000:1",
        "Lebensdauer der Beleuchtung": "50,000 Stunden",
        "Leistungsaufnahme im Ein-Zustand": "56.5 W",
        "Native Aufl\u00f6sung": "4K 3840 x 2160 bei 60 Hz",
        "Neigungswinkel": "-5/+10",
        "Pixelpitch": "0.2451 mm",
        "Reaktionszeit": "5 ms (Gray-to-Gray)",
        "Schnittstellen": "4 x HDMI \u00a6 DisplayPort 1.4 \u00a6 USB-C \u00a6 2 x USB 3.1 \u00a6 RS-232C \u00a6 Kopfh\u00f6rer",
        "Service und Support": "Begrenzte Garantie - 2 Jahre - Pick-Up & Return",
        "Sichtbare Bildfl\u00e4che": "107.98 cm (42.51\")",
        "Stromverbrauch (Aus-Modus)": "0.3 Watt",
        "Stromverbrauch (typisch)": "200 Watt",
        "Stromverbrauch HDR (eingeschaltet)": "81.4 kWh/1.000 h",
        "Stromverbrauch SDR (eingeschaltet)": "56.5 kWh/1.000 h",
        "Stromverbrauch im Standby-Modus": "0.5 Watt",
        "Transportbreite": "106.5 cm",
        "Transportgewicht": "21.5 kg",
        "Transporth\u00f6he": "65.8 cm",
        "Transporttiefe": "28.5 cm",
        "VESA-Halterung": "200 x 200 mm",
        "Vertikale Bildwiederholrate": "56 - 61 Hz",
        "Vertikaler Betrachtungswinkel": "178"
    },
    "raw_specifications_text": "Display-Typ: LED-hintergrundbeleuchteter LCD-Monitor / TFT-Aktivmatrix\nEnergie Effizienzklasse: Klasse G\nEnergieklasse (HDR): Klasse G\nEnergieverbrauch pro Jahr: 99 kWh\nDiagonalabmessung: 109.2 cm (43\")\nSichtbare Bildfl\u00e4che: 107.98 cm (42.51\")\nBildschirmtyp: AH-IPS\nNative Aufl\u00f6sung: 4K 3840 x 2160 bei 60 Hz\nPixelpitch: 0.2451 mm\nHelligkeit: 400 cd/m\u00b2\nKontrast: 1000:1\nHDR-Format: HDR10\nFarbunterst\u00fctzung: 1,073 Milliarden Farben (8-Bit)\nReaktionszeit: 5 ms (Gray-to-Gray)\nVertikale Bildwiederholrate: 56 - 61 Hz\nHorizontale Bildwiederholrate: 30 - 135 kHz\nHorizontaler Betrachtungswinkel: 178\nVertikaler Betrachtungswinkel: 178\nBildschirmbeschichtung: Anti-glare 3H hardness\nHintergrundbeleuchtungs-Technologie: WLED\nBesonderheiten: Bild f\u00fcr Bild, Mega Dynamic Contrast Ratio, Multiscan Support, Black Stabilizer, DAS Mode (Dynamic Action Sync), Picture-in-Picture, 8-bit + FRC Farbtiefe\nFarbe: Mattschwarz\nAbmessungen (Breite x Tiefe x H\u00f6he): 96.7 cm x 27.5 cm x 64.76 cm - mit Fu\u00df\nGewicht: 17.5 kg\nSchnittstellen: 4 x HDMI \u00a6 DisplayPort 1.4 \u00a6 USB-C \u00a6 2 x USB 3.1 \u00a6 RS-232C \u00a6 Kopfh\u00f6rer\nEinstellungen der Anzeigeposition: Neigung\nNeigungswinkel: -5/+10\nVESA-Halterung: 200 x 200 mm\nEnthaltene Kabel: DisplayPort-Kabel - 1.8 m \u00a6 HDMI-Kabel \u00a6 Kabel USB 3.0 Typ C auf Typ A\nLebensdauer der Beleuchtung: 50,000 Stunden\nKennzeichnung: TUV, VESA DDCCi\nEingangsspannung: Wechselstrom 120/230 V (50/60 Hz)\nLeistungsaufnahme im Ein-Zustand: 56.5 W\nStromverbrauch SDR (eingeschaltet): 56.5 kWh/1.000 h\nStromverbrauch HDR (eingeschaltet): 81.4 kWh/1.000 h\nStromverbrauch (typisch): 200 Watt\nStromverbrauch im Standby-Modus: 0.5 Watt\nStromverbrauch (Aus-Modus): 0.3 Watt\nDetails zu Abmessungen & Gewicht: Mit Fu\u00df - Breite: 96.7 cm - Tiefe: 27.5 cm - H\u00f6he: 64.76 cm - Gewicht: 17.5 kg \u00a6 Ohne Fu\u00df - Breite: 96.7 cm - Tiefe: 7.06 cm - H\u00f6he: 57.52 cm - Gewicht: 13.8 kg\nTransportbreite: 106.5 cm\nTransporttiefe: 28.5 cm\nTransporth\u00f6he: 65.8 cm\nTransportgewicht: 21.5 kg\nService und Support: Begrenzte Garantie - 2 Jahre - Pick-Up & Return",
    "reference_file": "offer_reference_2008.json",
    "shop_name": "ElectronicShop24"
}