{
    "html_file": "offer_1012_31.html",
    "name": "Dell P3223DE, 31.5\"",
    "offer_link": "https://technikladen.at/P-Dell-32-USB-C-Hub-Monitor-P3223DE-801cm-315-801-cm?tl=gzhls",
    "price": 404.98,
    "raw_specifications": {
        "AC Eingangsfrequenz": "50/60 Hz",
        "AC Eingangsspannung": "100 - 240 V",
        "AMD FreeSync": "Nein",
        "Abnehmbarer Standfu\u00df": "Ja",
        "Anzahl DisplayPort Anschl\u00fcsse": "2",
        "Anzahl Ethernet-LAN-Anschl\u00fcsse (RJ-45)": "1",
        "Anzahl HDMI-Anschl\u00fcsse": "1",
        "Anzahl der Farben des Displays": "1,07 Milliarden Farben",
        "Anzahl der Upstream-Ports USB Typ-C": "1",
        "Anzahl der nachgeschalteten Steckpl\u00e4tze vom Typ USB-A": "4",
        "Betriebstemperatur": "0 - 40 \u00b0C",
        "Bezel Weite (bottom)": "1,74 cm",
        "Bezel Weite (side)": "7,55 mm",
        "Bezel Weite (top)": "7,57 mm",
        "Bildschirmaufl\u00f6sung": "2560 x 1440 Pixel",
        "Bildschirmdiagonale": "80 cm",
        "Bildschirmdiagonale (cm)": "80 cm",
        "Bildschirmform": "Flach",
        "Bildschirmtechnologie": "LCD",
        "Bildwinkel, horizontal": "178 \u00b0",
        "Bildwinkel, vertikal": "178 \u00b0",
        "Blendfreier Bildschirm": "Ja",
        "Breite (ohne Standfu\u00df)": "71,2 cm",
        "DisplayPort Kabell\u00e4nge": "1,8 m",
        "DisplayPorts-Version": "1.4",
        "Eingangsstrom": "2,3 A",
        "Eingebaute Lautsprecher": "Nein",
        "Energieeffizienzklasse (SDR)": "F",
        "Energieeffizienzskala": "A bis G",
        "Energieverbrauch (SDR) pro 1.000 Stunden": "30 kWh",
        "Enth\u00e4lt nicht": "PVC/BFR",
        "Fu\u00dffarbe": "Silber",
        "Ger\u00e4tebreite (inkl. Fu\u00df)": "712,4 mm",
        "Ger\u00e4teh\u00f6he (inkl. Fu\u00df)": "617,1 mm",
        "Ger\u00e4tetiefe (inkl. Fu\u00df)": "230,1 mm",
        "Gewicht (mit St\u00e4nder)": "11,3 kg",
        "Gewicht (ohne St\u00e4nder)": "7,06 kg",
        "Gleichstrom-Anschluss (DC)": "Ja",
        "HD-Typ": "Quad HD",
        "HDCP": "Ja",
        "HDMI": "Ja",
        "HDMI-Version": "1.4",
        "Helligkeit (typisch)": "350 cd/m\u00b2",
        "Horizontaler Scanbereich": "30 - 90 kHz",
        "H\u00f6he (ohne Standfu\u00df)": "41,7 cm",
        "H\u00f6he bei Betrieb": "0 - 5000 m",
        "H\u00f6he bei Lagerung": "5000 - 12192 m",
        "H\u00f6heneinstellung": "15 cm",
        "H\u00f6henverstellung": "Ja",
        "Integrierte Kamera": "Nein",
        "Integrierter USB-Hub": "Ja",
        "Kabelsperre-Slot": "Ja",
        "Kontrastverh\u00e4ltnis": "1000:1",
        "Kopfh\u00f6rerausgang": "Nein",
        "LED-Anzeigen": "Ja",
        "Low-Blue-Light-Technologie": "Ja",
        "Luftfeuchtigkeit bei Lagerung": "5 - 90 %",
        "Marktpositionierung": "Haus",
        "Maximale Bildwiederholrate": "60 Hz",
        "Mitgelieferte Kabel": "AC, DisplayPort, USB Type-A to USB Type-C, USB Type-C to USB Type-C",
        "NVIDIA G-SYNC": "Nein",
        "Nachhaltigkeitszertifikate": "ENERGY STAR, RoHS, TCO",
        "Natives Seitenverh\u00e4ltnis": "16:9",
        "Neigungswinkelbereich": "-5 - 21 \u00b0",
        "Netzteiltyp": "Intern",
        "On-Screen-Display (OSD)": "Ja",
        "Paketgewicht": "15,3 kg",
        "Panel-Montage-Schnittstelle": "100 x 100 mm",
        "Panel-Typ": "IPS",
        "Pixel Abstand": "0,273 x 0,273 mm",
        "Pixeldichte": "93,24 ppi",
        "Plug & Play": "Ja",
        "Produktfarbe": "Black, Silver",
        "Reaktionszeit": "5 ms",
        "Reaktionszeit (schnell)": "8 ms",
        "Relative Luftfeuchtigkeit in Betrieb": "20 - 80 %",
        "Schnellstart\u00fcbersicht": "Ja",
        "Schwenkbar": "Ja",
        "Schwenkwinkelbereich": "-30 - 30 \u00b0",
        "Schwermetallfrei": "Hg (Quecksilber)",
        "Sichtbare Gr\u00f6\u00dfe (diagonal)": "80 cm",
        "Sichtbare Gr\u00f6\u00dfe (horizontal)": "69,8 cm",
        "Sichtbare Gr\u00f6\u00dfe (vertikal)": "39,3 cm",
        "Stromverbrauch (Standardbetrieb)": "29,9 W",
        "Stromverbrauch (Standby)": "0,3 W",
        "Stromverbrauch (aus)": "0,3 W",
        "Stromverbrauch (max.)": "183 W",
        "St\u00e4nder enthalten": "Ja",
        "Temperaturbereich bei Lagerung": "-20 - 60 \u00b0C",
        "Tiefe (ohne Standfu\u00df)": "5,41 cm",
        "Typ Ladeanschluss": "DC-Anschluss",
        "Typ der Hintergrundbeleuchtung": "LED",
        "USB-Hub-Version": "3.2 Gen 1 (3.1 Gen 1)",
        "USB-Stromversorgung bis zu": "90 W",
        "USB-Upstream-Porttyp": "USB Typ-C",
        "Unterst\u00fctzte Video-Modi": "480p,576p,720p,1080i,1080p",
        "VESA-Halterung": "Ja",
        "Vertikaler Scanbereich": "56 - 76 Hz",
        "Vorderer Rahmen": "Schwarz",
        "Warentarifnummer (HS)": "85285210",
        "kippbar": "Ja",
        "sRGB Abdeckung (klassisch)": "99 %"
    },
    "raw_specifications_text": "NVIDIA G-SYNC: Nein\nAMD FreeSync: Nein\nLow-Blue-Light-Technologie: Ja\nBildschirmdiagonale: 80 cm\nBildschirmaufl\u00f6sung: 2560 x 1440 Pixel\nNatives Seitenverh\u00e4ltnis: 16:9\nPanel-Typ: IPS\nHelligkeit (typisch): 350 cd/m\u00b2\nReaktionszeit: 5 ms\nHD-Typ: Quad HD\nBildschirmtechnologie: LCD\nTyp der Hintergrundbeleuchtung: LED\nBlendfreier Bildschirm: Ja\nBildschirmform: Flach\nUnterst\u00fctzte Video-Modi: 480p,576p,720p,1080i,1080p\nKontrastverh\u00e4ltnis: 1000:1\nMaximale Bildwiederholrate: 60 Hz\nBildwinkel, horizontal: 178 \u00b0\nBildwinkel, vertikal: 178 \u00b0\nAnzahl der Farben des Displays: 1,07 Milliarden Farben\nReaktionszeit (schnell): 8 ms\nPixel Abstand: 0,273 x 0,273 mm\nPixeldichte: 93,24 ppi\nHorizontaler Scanbereich: 30 - 90 kHz\nVertikaler Scanbereich: 56 - 76 Hz\nSichtbare Gr\u00f6\u00dfe (horizontal): 69,8 cm\nSichtbare Gr\u00f6\u00dfe (vertikal): 39,3 cm\nSichtbare Gr\u00f6\u00dfe (diagonal): 80 cm\nBildschirmdiagonale (cm): 80 cm\nsRGB Abdeckung (klassisch): 99 %\nIntegrierter USB-Hub: Ja\nUSB-Hub-Version: 3.2 Gen 1 (3.1 Gen 1)\nUSB-Upstream-Porttyp: USB Typ-C\nAnzahl der Upstream-Ports USB Typ-C: 1\nAnzahl der nachgeschalteten Steckpl\u00e4tze vom Typ USB-A: 4\nUSB-Stromversorgung bis zu: 90 W\nHDMI: Ja\nAnzahl HDMI-Anschl\u00fcsse: 1\nHDMI-Version: 1.4\nAnzahl DisplayPort Anschl\u00fcsse: 2\nDisplayPorts-Version: 1.4\nKopfh\u00f6rerausgang: Nein\nHDCP: Ja\nTyp Ladeanschluss: DC-Anschluss\nGleichstrom-Anschluss (DC): Ja\nVESA-Halterung: Ja\nPanel-Montage-Schnittstelle: 100 x 100 mm\nKabelsperre-Slot: Ja\nH\u00f6henverstellung: Ja\nH\u00f6heneinstellung: 15 cm\nSchwenkbar: Ja\nSchwenkwinkelbereich: -30 - 30 \u00b0\nkippbar: Ja\nNeigungswinkelbereich: -5 - 21 \u00b0\nOn-Screen-Display (OSD): Ja\nPlug & Play: Ja\nLED-Anzeigen: Ja\nEingebaute Lautsprecher: Nein\nIntegrierte Kamera: Nein\nMarktpositionierung: Haus\nProduktfarbe: Black, Silver\nVorderer Rahmen: Schwarz\nAbnehmbarer Standfu\u00df: Ja\nFu\u00dffarbe: Silber\nSchwermetallfrei: Hg (Quecksilber)\nSt\u00e4nder enthalten: Ja\nMitgelieferte Kabel: AC, DisplayPort, USB Type-A to USB Type-C, USB Type-C to USB Type-C\nDisplayPort Kabell\u00e4nge: 1,8 m\nSchnellstart\u00fcbersicht: Ja\nPaketgewicht: 15,3 kg\nEnergieeffizienzklasse (SDR): F\nEnergieverbrauch (SDR) pro 1.000 Stunden: 30 kWh\nStromverbrauch (Standardbetrieb): 29,9 W\nStromverbrauch (Standby): 0,3 W\nStromverbrauch (max.): 183 W\nStromverbrauch (aus): 0,3 W\nAC Eingangsspannung: 100 - 240 V\nAC Eingangsfrequenz: 50/60 Hz\nEingangsstrom: 2,3 A\nNetzteiltyp: Intern\nEnergieeffizienzskala: A bis G\nBetriebstemperatur: 0 - 40 \u00b0C\nTemperaturbereich bei Lagerung: -20 - 60 \u00b0C\nRelative Luftfeuchtigkeit in Betrieb: 20 - 80 %\nLuftfeuchtigkeit bei Lagerung: 5 - 90 %\nH\u00f6he bei Betrieb: 0 - 5000 m\nH\u00f6he bei Lagerung: 5000 - 12192 m\nGer\u00e4tebreite (inkl. Fu\u00df): 712,4 mm\nGer\u00e4tetiefe (inkl. Fu\u00df): 230,1 mm\nGer\u00e4teh\u00f6he (inkl. Fu\u00df): 617,1 mm\nGewicht (mit St\u00e4nder): 11,3 kg\nBreite (ohne Standfu\u00df): 71,2 cm\nTiefe (ohne Standfu\u00df): 5,41 cm\nH\u00f6he (ohne Standfu\u00df): 41,7 cm\nGewicht (ohne St\u00e4nder): 7,06 kg\nBezel Weite (side): 7,55 mm\nBezel Weite (top): 7,57 mm\nBezel Weite (bottom): 1,74 cm\nNachhaltigkeitszertifikate: ENERGY STAR, RoHS, TCO\nEnth\u00e4lt nicht: PVC/BFR\nWarentarifnummer (HS): 85285210\nAnzahl Ethernet-LAN-Anschl\u00fcsse (RJ-45): 1",
    "reference_file": "offer_reference_1012.json",
    "shop_name": "TechnikLaden"
}