{
    "html_file": "offer_1189_32.html",
    "name": "iiyama ProLite X4373UHSU-B1, 42.5\"",
    "offer_link": "https://www.electronicshop24.at/product_info.php?products_id=130000001356128757&ano=J1356128757&mno=X4373UHSU-B1&ean=4948570118519&utm_medium=cpc&utm_campaign=preisvergleich&utm_content=item&utm_source=geizhals&ref=geizhals",
    "price": 592.0,
    "raw_specifications": {
        "Abmessungen (Breite x Tiefe x H\u00f6he)": "97.75 cm x 25.1 cm x 62.15 cm",
        "Ausgangsleistung/Kanal": "7 Watt",
        "Besonderheiten": "Bild f\u00fcr Bild, HDCP, flimmerfreie Technologie, Blue Light Reducer Function, 8-bit + Hi-FRC Farbtiefe",
        "Bildschirmbeschichtung": "Matt",
        "Bildschirmtyp": "VA",
        "Diagonalabmessung": "109.2 cm (43\")",
        "Display-Typ": "LED-hintergrundbeleuchteter LCD-Monitor / TFT-Aktivmatrix",
        "EU-\u00d6ko-Label": "Ja",
        "Eingangsspannung": "Wechselstrom 100-240 V (50/60 Hz)",
        "Einstellungen der Anzeigeposition": "Neigung",
        "Energie Effizienzklasse": "Klasse G",
        "Energieklasse (HDR)": "Klasse G",
        "Enthaltene Kabel": "1 x USB-Kabel \u00a6 1 x HDMI-Kabel \u00a6 1 x DisplayPort-Kabel",
        "Farbe": "Mattschwarz",
        "Farbraum": "85% NTSC",
        "Farbunterst\u00fctzung": "1,07 Mrd. Farben",
        "Gewicht": "14.5 kg",
        "Helligkeit": "400 cd/m\u00b2",
        "Hintergrundbeleuchtungs-Technologie": "LED-Hintergrundbeleuchtung",
        "Horizontale Bildwiederholrate": "30 - 135 kHz",
        "Horizontaler Betrachtungswinkel": "178",
        "Integrierte Peripherieger\u00e4te": "USB 3.0-Hub",
        "Kennzeichnung": "VCCI, DDC-2B, DDC/CI, RoHS, WEEE, PSE Mark, REACH, TUV Bauart, ERP, EAC, REACH SvHC, UKCA",
        "Kontrast": "4000:1 / 80000000:1 (dynamisch)",
        "Leistungsmerkmale": "Slot f\u00fcr Sicherheitsschloss (Kabelschloss getrennt erh\u00e4ltlich), Kopfh\u00f6rerhaken",
        "Max. Betriebstemperatur": "35 \u00b0C",
        "Min Betriebstemperatur": "5 \u00b0C",
        "Native Aufl\u00f6sung": "4K 3840 x 2160 bei 60 Hz",
        "Neigungswinkel": "-2/+10",
        "OSD-Sprachen": "Englisch, Deutsch, Franz\u00f6sisch, Italienisch, Portugiesisch, Polnisch, Russisch, Spanisch, Holl\u00e4ndisch, Japanisch",
        "Pixelpitch": "0.245 mm",
        "Reaktionszeit": "3 ms (grau-zu-grau)",
        "Schlosstyp zur Diebstahlsicherung": "Kensington Slot",
        "Schnittstellen": "2 x HDMI \u00a6 DisplayPort \u00a6 Mini DisplayPort \u00a6 DisplayPort-Ausgang \u00a6 2 x USB 3.0 Downstream (Typ A) \u00a6 2 x USB 2.0 Downstream (Typ A) \u00a6 Kopfh\u00f6rer \u00a6 USB 3.0 Upstream (Typ B)",
        "Seitenverh\u00e4ltnis": "16:9",
        "Service und Support": "Begrenzte Garantie - 3 Jahre - Vor-Ort",
        "Sichtbare Bildfl\u00e4che": "108 cm (42.5\")",
        "Stromverbrauch (Aus-Modus)": "0.5 Watt",
        "Stromverbrauch (typisch)": "92 Watt",
        "Stromverbrauch HDR (eingeschaltet)": "102 kWh/1.000 h",
        "Stromverbrauch SDR (eingeschaltet)": "54 kWh/1.000 h",
        "Stromverbrauch im Standby-Modus": "0.5 Watt",
        "Transportbreite": "107.1 cm",
        "Transportgewicht": "19 kg",
        "Transporth\u00f6he": "76 cm",
        "Transporttiefe": "24 cm",
        "Typ": "Lautsprecher - Stereo",
        "VESA-Halterung": "200 x 100 mm",
        "Vertikale Bildwiederholrate": "24 - 75 Hz",
        "Vertikaler Betrachtungswinkel": "178",
        "Zubeh\u00f6r im Lieferumfang": "Fernbedienung, Kabelhalter, Batterien",
        "Zul\u00e4ssige Luftfeuchtigkeit im Betrieb": "10 - 80% (nicht kondensierend)"
    },
    "raw_specifications_text": "Display-Typ: LED-hintergrundbeleuchteter LCD-Monitor / TFT-Aktivmatrix\nEnergie Effizienzklasse: Klasse G\nEnergieklasse (HDR): Klasse G\nDiagonalabmessung: 109.2 cm (43\")\nSichtbare Bildfl\u00e4che: 108 cm (42.5\")\nIntegrierte Peripherieger\u00e4te: USB 3.0-Hub\nBildschirmtyp: VA\nSeitenverh\u00e4ltnis: 16:9\nNative Aufl\u00f6sung: 4K 3840 x 2160 bei 60 Hz\nPixelpitch: 0.245 mm\nHelligkeit: 400 cd/m\u00b2\nKontrast: 4000:1 / 80000000:1 (dynamisch)\nFarbunterst\u00fctzung: 1,07 Mrd. Farben\nFarbraum: 85% NTSC\nReaktionszeit: 3 ms (grau-zu-grau)\nVertikale Bildwiederholrate: 24 - 75 Hz\nHorizontale Bildwiederholrate: 30 - 135 kHz\nHorizontaler Betrachtungswinkel: 178\nVertikaler Betrachtungswinkel: 178\nBildschirmbeschichtung: Matt\nHintergrundbeleuchtungs-Technologie: LED-Hintergrundbeleuchtung\nOSD-Sprachen: Englisch, Deutsch, Franz\u00f6sisch, Italienisch, Portugiesisch, Polnisch, Russisch, Spanisch, Holl\u00e4ndisch, Japanisch\nBesonderheiten: Bild f\u00fcr Bild, HDCP, flimmerfreie Technologie, Blue Light Reducer Function, 8-bit + Hi-FRC Farbtiefe\nFarbe: Mattschwarz\nAbmessungen (Breite x Tiefe x H\u00f6he): 97.75 cm x 25.1 cm x 62.15 cm\nGewicht: 14.5 kg\nTyp: Lautsprecher - Stereo\nAusgangsleistung/Kanal: 7 Watt\nSchnittstellen: 2 x HDMI \u00a6 DisplayPort \u00a6 Mini DisplayPort \u00a6 DisplayPort-Ausgang \u00a6 2 x USB 3.0 Downstream (Typ A) \u00a6 2 x USB 2.0 Downstream (Typ A) \u00a6 Kopfh\u00f6rer \u00a6 USB 3.0 Upstream (Typ B)\nEinstellungen der Anzeigeposition: Neigung\nNeigungswinkel: -2/+10\nVESA-Halterung: 200 x 100 mm\nLeistungsmerkmale: Slot f\u00fcr Sicherheitsschloss (Kabelschloss getrennt erh\u00e4ltlich), Kopfh\u00f6rerhaken\nZubeh\u00f6r im Lieferumfang: Fernbedienung, Kabelhalter, Batterien\nEnthaltene Kabel: 1 x USB-Kabel \u00a6 1 x HDMI-Kabel \u00a6 1 x DisplayPort-Kabel\nKennzeichnung: VCCI, DDC-2B, DDC/CI, RoHS, WEEE, PSE Mark, REACH, TUV Bauart, ERP, EAC, REACH SvHC, UKCA\nSchlosstyp zur Diebstahlsicherung: Kensington Slot\nEingangsspannung: Wechselstrom 100-240 V (50/60 Hz)\nStromverbrauch SDR (eingeschaltet): 54 kWh/1.000 h\nStromverbrauch HDR (eingeschaltet): 102 kWh/1.000 h\nStromverbrauch (typisch): 92 Watt\nStromverbrauch im Standby-Modus: 0.5 Watt\nStromverbrauch (Aus-Modus): 0.5 Watt\nTransportbreite: 107.1 cm\nTransporttiefe: 24 cm\nTransporth\u00f6he: 76 cm\nTransportgewicht: 19 kg\nEU-\u00d6ko-Label: Ja\nService und Support: Begrenzte Garantie - 3 Jahre - Vor-Ort\nMin Betriebstemperatur: 5 \u00b0C\nMax. Betriebstemperatur: 35 \u00b0C\nZul\u00e4ssige Luftfeuchtigkeit im Betrieb: 10 - 80% (nicht kondensierend)",
    "reference_file": "offer_reference_1189.json",
    "shop_name": "ElectronicShop24"
}