{
    "html_file": "offer_837_23.html",
    "name": "LG UltraGear 48GQ900-B, 47.5\"",
    "offer_link": "https://www.hiq24.de/shop/artikel/331339/?sPartner=geizhals",
    "price": 1171.9,
    "raw_specifications": {
        "Abmessungen (Breite x Tiefe x H\u00f6he)": "107.06 cm x 18.48 cm x 65.97 cm - mit Fu\u00df",
        "Abmessungen (Breite x Tiefe x H\u00f6he) - mit Fu\u00df": "107.06 cm x 18.48 cm x 65.97 cm",
        "Adaptive-Sync Technologie": "AMD FreeSync Premium Pro, NVIDIA G-SYNC Compatible",
        "Ausgangsleistung/Kanal": "20 Watt",
        "Besonderheiten": "Crosshair Display, Flicker Safe, Reader Mode, Werkskalibrierung, Intelligente Energiespartechnologie, Black Stabilizer, DAS Mode (Dynamic Action Sync), Hardware Calibration Ready, Overclock Refresh Rate, 3 Side Borderless Design, FPS-Counter, Hexagon Lighting, benutzerdefinierter Schl\u00fcssel",
        "Bildschirmbeschichtung": "Blendfrei",
        "Details zu Abmessungen & Gewicht": "Mit Fu\u00df - Breite: 107.06 cm - Tiefe: 18.48 cm - H\u00f6he: 65.97 cm - Gewicht: 16.8 kg  Ohne Fu\u00df - Breite: 107.06 cm - Tiefe: 4.66 cm - H\u00f6he: 62.39 cm - Gewicht: 15.5 kg",
        "Diagonalabmessung": "121 cm (48\")",
        "Display-Typ": "OLED-Monitor / OLED",
        "Eingangsanschl\u00fcsse": "3xHDMI, DisplayPort",
        "Eingangsspannung": "Wechselstrom 100-240 V (50/60 Hz)",
        "Energie Effizienzklasse": "Klasse F",
        "Energieklasse (HDR)": "Klasse G",
        "Energierverbrauch Sleep": "0.5 Watt",
        "Enthaltene Kabel": "1 x HDMI-Kabel",
        "Farbraum": "99% DCI-P3 (CIE 1976)",
        "Farbunterst\u00fctzung": "1,07 Mrd. Farben",
        "Gaming": "Ja",
        "Ger\u00e4tetyp": "OLED-Monitor - 121 cm (48\")",
        "Gewicht": "16.8 kg",
        "HDR-Format": "HDR10",
        "HDR-f\u00e4hig": "HDR10",
        "Helligkeit": "330 cd/m\u00b2",
        "Horizontaler Betrachtungswinkel": "178",
        "Integrierte Peripherieger\u00e4te": "USB 3.0-Hub",
        "Kontrast": "1200000:1 / 1500000:1 (dynamisch)",
        "Leistungsmerkmale": "USB 3.0-Hub",
        "Mitgelieferte Software": "True Color Pro, LG On-Screen Control, LG UltraGear Control Center, LG Calibration Studio",
        "Native Aufl\u00f6sung": "4K 3840 x 2160 bei 138 Hz",
        "Produktbeschreibung": "LG UltraGear 48GQ900-B - OLED-Monitor - 4K - 121 cm (48\") - HDR",
        "Reaktionszeit": "0,1 ms (Gray-to-Gray)",
        "Schlosstyp zur Diebstahlsicherung": "Kensington Slot",
        "Schnittstellen": "DisplayPort 1.4  3 x HDMI  Kombinierter Kopfh\u00f6rer-/-Mikrofonstecker  2 x USB 3.0 Downstream  USB 3.0 Upstream  Digitaler Audioausgang (optisch)",
        "Seitenverh\u00e4ltnis": "16:9",
        "Sichtbare Bildfl\u00e4che": "120.7193 cm (47.53\")",
        "Spannung": "Wechselstrom 100-240 V (50/60 Hz)",
        "Stromverbrauch (Aus-Modus)": "0.3 Watt",
        "Stromverbrauch (max.)": "253 Watt",
        "Stromverbrauch (typisch)": "175 Watt",
        "Stromverbrauch HDR (eingeschaltet)": "69 kWh/1.000 h",
        "Stromverbrauch SDR (eingeschaltet)": "60 kWh/1.000 h",
        "Transportbreite": "128.5 cm",
        "Transportgewicht": "19.3 kg",
        "Transporth\u00f6he": "77.1 cm",
        "Transporttiefe": "17.3 cm",
        "Typ": "Lautsprecher - Stereo",
        "VESA-Halterung": "300 x 200 mm",
        "Vertikaler Betrachtungswinkel": "178",
        "Zubeh\u00f6r im Lieferumfang": "Fernbedienung"
    },
    "raw_specifications_text": "Display-Typ: OLED-Monitor / OLED\nEnergie Effizienzklasse: Klasse F\nEnergieklasse (HDR): Klasse G\nDiagonalabmessung: 121 cm (48\")\nSichtbare Bildfl\u00e4che: 120.7193 cm (47.53\")\nAdaptive-Sync Technologie: AMD FreeSync Premium Pro, NVIDIA G-SYNC Compatible\nIntegrierte Peripherieger\u00e4te: USB 3.0-Hub\nSeitenverh\u00e4ltnis: 16:9\nNative Aufl\u00f6sung: 4K 3840 x 2160 bei 138 Hz\nHelligkeit: 330 cd/m\u00b2\nKontrast: 1200000:1 / 1500000:1 (dynamisch)\nHDR-Format: HDR10\nFarbunterst\u00fctzung: 1,07 Mrd. Farben\nFarbraum: 99% DCI-P3 (CIE 1976)\nReaktionszeit: 0,1 ms (Gray-to-Gray)\nGaming: Ja\nHorizontaler Betrachtungswinkel: 178\nVertikaler Betrachtungswinkel: 178\nBildschirmbeschichtung: Blendfrei\nBesonderheiten: Crosshair Display, Flicker Safe, Reader Mode, Werkskalibrierung, Intelligente Energiespartechnologie, Black Stabilizer, DAS Mode (Dynamic Action Sync), Hardware Calibration Ready, Overclock Refresh Rate, 3 Side Borderless Design, FPS-Counter, Hexagon Lighting, benutzerdefinierter Schl\u00fcssel\nAbmessungen (Breite x Tiefe x H\u00f6he): 107.06 cm x 18.48 cm x 65.97 cm - mit Fu\u00df\nGewicht: 16.8 kg\nTyp: Lautsprecher - Stereo\nAusgangsleistung/Kanal: 20 Watt\nSchnittstellen: DisplayPort 1.4  3 x HDMI  Kombinierter Kopfh\u00f6rer-/-Mikrofonstecker  2 x USB 3.0 Downstream  USB 3.0 Upstream  Digitaler Audioausgang (optisch)\nVESA-Halterung: 300 x 200 mm\nLeistungsmerkmale: USB 3.0-Hub\nZubeh\u00f6r im Lieferumfang: Fernbedienung\nEnthaltene Kabel: 1 x HDMI-Kabel\nSchlosstyp zur Diebstahlsicherung: Kensington Slot\nEingangsspannung: Wechselstrom 100-240 V (50/60 Hz)\nStromverbrauch SDR (eingeschaltet): 60 kWh/1.000 h\nStromverbrauch HDR (eingeschaltet): 69 kWh/1.000 h\nStromverbrauch (typisch): 175 Watt\nStromverbrauch (max.): 253 Watt\nEnergierverbrauch Sleep: 0.5 Watt\nStromverbrauch (Aus-Modus): 0.3 Watt\nMitgelieferte Software: True Color Pro, LG On-Screen Control, LG UltraGear Control Center, LG Calibration Studio\nDetails zu Abmessungen & Gewicht: Mit Fu\u00df - Breite: 107.06 cm - Tiefe: 18.48 cm - H\u00f6he: 65.97 cm - Gewicht: 16.8 kg  Ohne Fu\u00df - Breite: 107.06 cm - Tiefe: 4.66 cm - H\u00f6he: 62.39 cm - Gewicht: 15.5 kg\nTransportbreite: 128.5 cm\nTransporttiefe: 17.3 cm\nTransporth\u00f6he: 77.1 cm\nTransportgewicht: 19.3 kg\nProduktbeschreibung: LG UltraGear 48GQ900-B - OLED-Monitor - 4K - 121 cm (48\") - HDR\nGer\u00e4tetyp: OLED-Monitor - 121 cm (48\")\nHDR-f\u00e4hig: HDR10\nEingangsanschl\u00fcsse: 3xHDMI, DisplayPort\nSpannung: Wechselstrom 100-240 V (50/60 Hz)\nAbmessungen (Breite x Tiefe x H\u00f6he) - mit Fu\u00df: 107.06 cm x 18.48 cm x 65.97 cm",
    "reference_file": "offer_reference_837.json",
    "shop_name": "HiQ24"
}