{
    "html_file": "offer_896_1.html",
    "name": "LC-Power LC-M24-FHD-75, 23.8\"",
    "offer_link": "https://www.ba-computer.at/lc-power-lc-m24-fhd-165-lcd-monitor-60-5-cm-23-8-lc-m24-fhd-75.html",
    "price": 98.59,
    "raw_specifications": {
        "Abmessungen (Breite x Tiefe x H\u00f6he)": "54.3 cm x 16.1 cm x 40.3 cm - mit Fu\u00df",
        "Adaptive-Sync Technologie": "AMD Adaptive-Sync",
        "Besonderheiten": "Overdrive-Technologie, FPS Mode, flimmerfreie Technologie, RTS Mode, Adaptive-Sync-Technologie, an 3 Seiten ohne Blende, GamePlus, Tiefer blauer Strahl",
        "Bildschirmbeschichtung": "Blendfrei",
        "Bildschirmtyp": "VA",
        "Details zu Abmessungen & Gewicht": "Ohne Fu\u00df - Breite: 54.3 cm - Tiefe: 3.7 cm - H\u00f6he: 33.5 cm \u00a6 Mit Fu\u00df - Breite: 54.3 cm - Tiefe: 16.1 cm - H\u00f6he: 40.3 cm",
        "Diagonalabmessung": "60.5 cm (23.8\")",
        "Display-Typ": "LCD-Monitor / TFT-Aktivmatrix",
        "Einstellungen der Anzeigeposition": "Neigung",
        "Energie Effizienzklasse": "Klasse E",
        "Farbe": "Schwarz",
        "Farbraum": "84% Adobe RGB, 96% sRGB, 85% DCI-P3, 83% NTSC",
        "Farbunterst\u00fctzung": "16,7 Millionen Farben",
        "Gewicht": "3.3 kg",
        "Helligkeit": "250 cd/m\u00b2",
        "Horizontaler Betrachtungswinkel": "178",
        "Kontrast": "3000:1 / 1000000:1 (dynamisch)",
        "Leistungsaufnahme im Ein-Zustand": "18 W",
        "Native Aufl\u00f6sung": "Full HD (1080p) 1920 x 1080 bei 75 Hz",
        "Neigungswinkel": "-5/+15",
        "Pixelpitch": "0.2475 mm",
        "Reaktionszeit": "8 ms",
        "Schnittstellen": "HDMI \u00a6 VGA \u00a6 Audio Line-Out",
        "Seitenverh\u00e4ltnis": "16:9",
        "Service und Support": "Begrenzte Garantie - 3 Jahre",
        "Stromverbrauch SDR (eingeschaltet)": "18 kWh/1.000 h",
        "Stromverbrauch im Standby-Modus": "0.5 Watt",
        "Transportbreite": "62 cm",
        "Transportgewicht": "4.5 kg",
        "Transporth\u00f6he": "11 cm",
        "Transporttiefe": "41 cm",
        "VESA-Halterung": "75 x 75 mm",
        "Vertikaler Betrachtungswinkel": "178"
    },
    "raw_specifications_text": "Display-Typ: LCD-Monitor / TFT-Aktivmatrix\nEnergie Effizienzklasse: Klasse E\nDiagonalabmessung: 60.5 cm (23.8\")\nAdaptive-Sync Technologie: AMD Adaptive-Sync\nBildschirmtyp: VA\nSeitenverh\u00e4ltnis: 16:9\nNative Aufl\u00f6sung: Full HD (1080p) 1920 x 1080 bei 75 Hz\nPixelpitch: 0.2475 mm\nHelligkeit: 250 cd/m\u00b2\nKontrast: 3000:1 / 1000000:1 (dynamisch)\nFarbunterst\u00fctzung: 16,7 Millionen Farben\nFarbraum: 84% Adobe RGB, 96% sRGB, 85% DCI-P3, 83% NTSC\nReaktionszeit: 8 ms\nHorizontaler Betrachtungswinkel: 178\nVertikaler Betrachtungswinkel: 178\nBildschirmbeschichtung: Blendfrei\nBesonderheiten: Overdrive-Technologie, FPS Mode, flimmerfreie Technologie, RTS Mode, Adaptive-Sync-Technologie, an 3 Seiten ohne Blende, GamePlus, Tiefer blauer Strahl\nFarbe: Schwarz\nAbmessungen (Breite x Tiefe x H\u00f6he): 54.3 cm x 16.1 cm x 40.3 cm - mit Fu\u00df\nGewicht: 3.3 kg\nSchnittstellen: HDMI \u00a6 VGA \u00a6 Audio Line-Out\nEinstellungen der Anzeigeposition: Neigung\nNeigungswinkel: -5/+15\nVESA-Halterung: 75 x 75 mm\nLeistungsaufnahme im Ein-Zustand: 18 W\nStromverbrauch SDR (eingeschaltet): 18 kWh/1.000 h\nStromverbrauch im Standby-Modus: 0.5 Watt\nDetails zu Abmessungen & Gewicht: Ohne Fu\u00df - Breite: 54.3 cm - Tiefe: 3.7 cm - H\u00f6he: 33.5 cm \u00a6 Mit Fu\u00df - Breite: 54.3 cm - Tiefe: 16.1 cm - H\u00f6he: 40.3 cm\nTransportbreite: 62 cm\nTransporttiefe: 41 cm\nTransporth\u00f6he: 11 cm\nTransportgewicht: 4.5 kg\nService und Support: Begrenzte Garantie - 3 Jahre",
    "reference_file": "offer_reference_896.json",
    "shop_name": "BA-Computer"
}