{
    "html_file": "offer_1565_17.html",
    "name": "ViewSonic VP2768A, 27\"",
    "offer_link": "https://www.proshop.at/Bildschirm/ViewSonic-27-Bildschirm-VP2768a-QHD-Black-5-ms/3021305?utm_source=geizhals&utm_medium=cpc&utm_campaign=pricesite",
    "price": 487.76,
    "raw_specifications": {
        "Abmessungen (Breite x Tiefe x H\u00f6he)": "61.3 cm x 21.5 cm x 41.3 cm - mit Fu\u00df",
        "Abmessungen (Breite x Tiefe x H\u00f6he) - mit Fu\u00df": "61.3 cm x 21.5 cm x 41.3 cm",
        "Besonderheiten": "SuperClear, flimmerfreie Technologie, SMPTE-C-Farbskala, EBU-Farbskala, TMDS-Technologie (Transition Minimized Differential Signaling), Blaulichtfilter-Technologie, Farbkalibrierung, Farbanpassungsmodus, Smart Color, ViewMode, Eye-Care Technology, 4 Side Borderless Design, Rec 709-Farbraum, Monitorkalibrierung Delta E<2, Uniformity Compensation, Color Blind-Modus, Pantone-zertifiziert",
        "Bildschirmbeschichtung": "Blendfrei, 3H Hard Coating",
        "Bildschirmtyp": "IPS",
        "Daisy-Chaining": "Ja",
        "Details zu Abmessungen & Gewicht": "Mit Fu\u00df - Breite: 61.3 cm - Tiefe: 21.5 cm - H\u00f6he: 41.3 cm - Gewicht: 7 kg  Ohne Fu\u00df - Breite: 61.3 cm - Tiefe: 5 cm - H\u00f6he: 35.3 cm - Gewicht: 4.7 kg",
        "Diagonalabmessung": "68.6 cm (27\")",
        "Display-Typ": "LED-hintergrundbeleuchteter LCD-Monitor / TFT-Aktivmatrix",
        "EAN": "766907008968",
        "ENERGY STAR zertifiziert": "Ja",
        "ENERGY STAR-Version": "8.0",
        "EPEAT-kompatibel": "EPEAT Silver",
        "Eingangsanschl\u00fcsse": "2xHDMI, DisplayPort, USB-C",
        "Eingangsspannung": "Wechselstrom 120/230 V (50/60 Hz)",
        "Einstellungen der Anzeigeposition": "H\u00f6he, Pivot (Rotation), Drehung, Neigung",
        "Energie Effizienzklasse": "Klasse G",
        "Energieklasse (HDR)": "Klasse G",
        "Enthaltene Kabel": "DisplayPort 1.2-Kabel  USB-C Kabel  USB-Kabel Typ A auf Typ B",
        "Erforderliches Betriebssystem": "Apple MacOS, Windows 10",
        "Ethernet integriert": "Ja",
        "Farbraum": "100% sRGB",
        "Farbunterst\u00fctzung": "16,7 Millionen Farben (8-Bit)",
        "Ger\u00e4tetyp": "LED-hintergrundbeleuchteter LCD-Monitor - 68.6 cm (27\")",
        "Gewicht": "7 kg",
        "Helligkeit": "350 cd/m\u00b2",
        "Hersteller": "ViewSonic",
        "Hintergrundbeleuchtungs-Technologie": "LED-Hintergrundbeleuchtung",
        "Horizontale Bildwiederholrate": "15 - 90 kHz",
        "Horizontaler Betrachtungswinkel": "178",
        "H\u00f6heneinstellung": "130 mm",
        "Integrierte Peripherieger\u00e4te": "USB 3.2 Gen 1 Hub",
        "Kennzeichnung": "FCC Klasse B bescheinigt, TUV, ICES-003, CB, CCC, RoHS, WEEE, cTUVus, REACH, CEC, UkrSEPRO, ERP, CECP, EAC, China Energy Label, China RoHS, CE/EMC, Mexico Energy label, Mexico CoC",
        "Kontrast": "1000:1 / 20000000:1 (dynamisch)",
        "Lebensdauer der Beleuchtung": "30,000 Stunden",
        "Leistungsaufnahme im Ein-Zustand": "30.6 W",
        "Leistungsmerkmale": "Slot f\u00fcr Sicherheitsschloss (Kabelschloss getrennt erh\u00e4ltlich), abnehmbarer St\u00e4nder, Unterst\u00fctzung f\u00fcr VESA-Schnittstelle",
        "Modell": "VP2768a",
        "Native Aufl\u00f6sung": "QHD 2560 x 1440 bei 60 Hz",
        "Neigungswinkel": "-5/+21",
        "Produktbeschreibung": "ViewSonic VP2768a - LED-Monitor - 68.6 cm (27\")",
        "Reaktionszeit": "5 ms (Gray-to-Gray)",
        "Rotationswinkel": "180",
        "Schlosstyp zur Diebstahlsicherung": "Kensington Slot",
        "Schnittstellen": "2 x HDMI  DisplayPort 1.2  DisplayPort-Ausgang  USB-C 3.2 Gen 1/DisplayPort Alt Mode  Netzwerk (RJ-45)  Audio Line-Out  3 x USB 3.2 Gen 1",
        "Schwenkwinkel": "120",
        "Seitenverh\u00e4ltnis": "16:9",
        "Spannung": "Wechselstrom 120/230 V (50/60 Hz)",
        "Stromverbrauch (typisch)": "20.29 Watt",
        "Stromverbrauch HDR (eingeschaltet)": "33.9 kWh/1.000 h",
        "Stromverbrauch SDR (eingeschaltet)": "30.6 kWh/1.000 h",
        "Stromverbrauch im Standby-Modus": "0.5 Watt",
        "Transportbreite": "74 cm",
        "Transportgewicht": "10.1 kg",
        "Transporth\u00f6he": "22 cm",
        "Transporttiefe": "41.7 cm",
        "Umweltschutzstandards": "ENERGY STAR-qualifiziert EPEAT Silver",
        "VESA-Halterung": "100 x 100 mm",
        "Vertikale Bildwiederholrate": "24 - 61 Hz",
        "Vertikaler Betrachtungswinkel": "178",
        "Waren-Nr.": "3021305",
        "Zubeh\u00f6r im Lieferumfang": "Kabelf\u00fchrungsabdeckung",
        "Zum Hersteller": "www.viewsonic.com"
    },
    "raw_specifications_text": "Hersteller: ViewSonic\nWaren-Nr.: 3021305\nModell: VP2768a\nEAN: 766907008968\nZum Hersteller: www.viewsonic.com\nProduktbeschreibung: ViewSonic VP2768a - LED-Monitor - 68.6 cm (27\")\nGer\u00e4tetyp: LED-hintergrundbeleuchteter LCD-Monitor - 68.6 cm (27\")\nEnergie Effizienzklasse: Klasse G\nLeistungsaufnahme im Ein-Zustand: 30.6 W\nDaisy-Chaining: Ja\nLeistungsmerkmale: Slot f\u00fcr Sicherheitsschloss (Kabelschloss getrennt erh\u00e4ltlich), abnehmbarer St\u00e4nder, Unterst\u00fctzung f\u00fcr VESA-Schnittstelle\nBildschirmtyp: IPS\nSeitenverh\u00e4ltnis: 16:9\nNative Aufl\u00f6sung: QHD 2560 x 1440 bei 60 Hz\nHelligkeit: 350 cd/m\u00b2\nKontrast: 1000:1 / 20000000:1 (dynamisch)\nReaktionszeit: 5 ms (Gray-to-Gray)\nFarbunterst\u00fctzung: 16,7 Millionen Farben (8-Bit)\nFarbraum: 100% sRGB\nEingangsanschl\u00fcsse: 2xHDMI, DisplayPort, USB-C\nEthernet integriert: Ja\nEinstellungen der Anzeigeposition: H\u00f6he, Pivot (Rotation), Drehung, Neigung\nBildschirmbeschichtung: Blendfrei, 3H Hard Coating\nSpannung: Wechselstrom 120/230 V (50/60 Hz)\nAbmessungen (Breite x Tiefe x H\u00f6he) - mit Fu\u00df: 61.3 cm x 21.5 cm x 41.3 cm\nGewicht: 7 kg\nUmweltschutzstandards: ENERGY STAR-qualifiziert EPEAT Silver\nKennzeichnung: FCC Klasse B bescheinigt, TUV, ICES-003, CB, CCC, RoHS, WEEE, cTUVus, REACH, CEC, UkrSEPRO, ERP, CECP, EAC, China Energy Label, China RoHS, CE/EMC, Mexico Energy label, Mexico CoC\nDisplay-Typ: LED-hintergrundbeleuchteter LCD-Monitor / TFT-Aktivmatrix\nEnergieklasse (HDR): Klasse G\nDiagonalabmessung: 68.6 cm (27\")\nIntegrierte Peripherieger\u00e4te: USB 3.2 Gen 1 Hub\nVertikale Bildwiederholrate: 24 - 61 Hz\nHorizontale Bildwiederholrate: 15 - 90 kHz\nHorizontaler Betrachtungswinkel: 178\nVertikaler Betrachtungswinkel: 178\nHintergrundbeleuchtungs-Technologie: LED-Hintergrundbeleuchtung\nBesonderheiten: SuperClear, flimmerfreie Technologie, SMPTE-C-Farbskala, EBU-Farbskala, TMDS-Technologie (Transition Minimized Differential Signaling), Blaulichtfilter-Technologie, Farbkalibrierung, Farbanpassungsmodus, Smart Color, ViewMode, Eye-Care Technology, 4 Side Borderless Design, Rec 709-Farbraum, Monitorkalibrierung Delta E<2, Uniformity Compensation, Color Blind-Modus, Pantone-zertifiziert\nAbmessungen (Breite x Tiefe x H\u00f6he): 61.3 cm x 21.5 cm x 41.3 cm - mit Fu\u00df\nSchnittstellen: 2 x HDMI  DisplayPort 1.2  DisplayPort-Ausgang  USB-C 3.2 Gen 1/DisplayPort Alt Mode  Netzwerk (RJ-45)  Audio Line-Out  3 x USB 3.2 Gen 1\nNeigungswinkel: -5/+21\nSchwenkwinkel: 120\nRotationswinkel: 180\nH\u00f6heneinstellung: 130 mm\nVESA-Halterung: 100 x 100 mm\nZubeh\u00f6r im Lieferumfang: Kabelf\u00fchrungsabdeckung\nEnthaltene Kabel: DisplayPort 1.2-Kabel  USB-C Kabel  USB-Kabel Typ A auf Typ B\nLebensdauer der Beleuchtung: 30,000 Stunden\nSchlosstyp zur Diebstahlsicherung: Kensington Slot\nEingangsspannung: Wechselstrom 120/230 V (50/60 Hz)\nStromverbrauch SDR (eingeschaltet): 30.6 kWh/1.000 h\nStromverbrauch HDR (eingeschaltet): 33.9 kWh/1.000 h\nStromverbrauch (typisch): 20.29 Watt\nStromverbrauch im Standby-Modus: 0.5 Watt\nErforderliches Betriebssystem: Apple MacOS, Windows 10\nDetails zu Abmessungen & Gewicht: Mit Fu\u00df - Breite: 61.3 cm - Tiefe: 21.5 cm - H\u00f6he: 41.3 cm - Gewicht: 7 kg  Ohne Fu\u00df - Breite: 61.3 cm - Tiefe: 5 cm - H\u00f6he: 35.3 cm - Gewicht: 4.7 kg\nTransportbreite: 74 cm\nTransporttiefe: 41.7 cm\nTransporth\u00f6he: 22 cm\nTransportgewicht: 10.1 kg\nEPEAT-kompatibel: EPEAT Silver\nENERGY STAR zertifiziert: Ja\nENERGY STAR-Version: 8.0",
    "reference_file": "offer_reference_1565.json",
    "shop_name": "Proshop.at"
}