{
    "html_file": "offer_362_34.html",
    "name": "LG 24BN65YP-B, 23.8\"",
    "offer_link": "https://ms-it-beratung.at/shop/details.php?art=425491&artname=LG+24%22+24BN65YP-B+DVI+DP+HDMI+USB+IPS+16%3A9+black",
    "price": 167.0,
    "raw_specifications": {
        "Abnehmbarer Standfu\u00df": "Ja",
        "Anzahl DisplayPort Anschl\u00fcsse": "1",
        "Anzahl HDMI-Anschl\u00fcsse": "1",
        "Anzahl der Farben des Displays": "16,7 Millionen Farben",
        "Anzahl der Lautsprecher": "2",
        "Anzahl der nachgeschalteten Steckpl\u00e4tze vom Typ USB-A": "2",
        "Anzahl der vorgeschalteten Steckpl\u00e4tze": "1",
        "Audioanschl\u00fcsse": "Ja",
        "Bildschirmdiagonale": "61 cm (24\")",
        "Bildschirmdiagonale (cm)": "60 cm",
        "Bildschirmform": "Flach",
        "Bildschirmtechnologie": "LED",
        "Bildwinkel, horizontal": "178\u00b0",
        "Bildwinkel, vertikal": "178\u00b0",
        "Blendfreier Bildschirm": "Ja",
        "Breite (ohne Standfu\u00df)": "539,4 mm",
        "DVI Anschluss": "Ja",
        "Display-Aufl\u00f6sung": "1920 x 1080 Pixel",
        "DisplayPort Kabell\u00e4nge": "1,8 m",
        "DisplayPorts-Version": "1.2",
        "Eingebaute Lautsprecher": "Ja",
        "Energieeffizienzklasse (SDR)": "E",
        "Energieeffizienzskala": "A bis G",
        "Energieverbrauch (SDR) pro 1.000 Stunden": "18 kWh",
        "Farbskala": "72%",
        "Farbtiefe": "8 Bit",
        "Flimmerfreie Technologie": "Ja",
        "Fu\u00dffarbe": "Schwarz",
        "Ger\u00e4tebreite (inkl. Fu\u00df)": "539,4 mm",
        "Ger\u00e4teh\u00f6he (inkl. Fu\u00df)": "505,6 mm",
        "Ger\u00e4tetiefe (inkl. Fu\u00df)": "240 mm",
        "Gewicht (mit St\u00e4nder)": "5,7 kg",
        "Gewicht (ohne St\u00e4nder)": "3,5 kg",
        "HD-Typ": "Full HD",
        "HDCP": "Ja",
        "HDCP-Version": "1.4",
        "HDMI": "Ja",
        "Helligkeit (typisch)": "250 cd/m\u00b2",
        "H\u00f6he (ohne Standfu\u00df)": "326,4 mm",
        "H\u00f6heneinstellung": "13 cm",
        "H\u00f6henverstellung": "Ja",
        "Integrierte Kamera": "Nein",
        "Integrierter USB-Hub": "Ja",
        "Kontrastverh\u00e4ltnis": "1000:1",
        "Kontrastverh\u00e4ltnis (dynamisch)": "5000000:1",
        "Kopfh\u00f6rerausgang": "Ja",
        "Marktpositionierung": "Business",
        "Mitgelieferte Kabel": "AC, DisplayPort",
        "Natives Seitenverh\u00e4ltnis": "16:9",
        "Neigungswinkelbereich": "-5 - 35\u00b0",
        "Netzteiltyp": "Intern",
        "Paketgewicht": "7,6 kg",
        "Panel-Montage-Schnittstelle": "100 x 100 mm",
        "Panel-Typ": "IPS",
        "Pivot": "Ja",
        "Pivot Winkel": "-90 - 90\u00b0",
        "Pixel Abstand": "0,27 x 0,27 mm",
        "Produktfarbe": "Schwarz",
        "RGB-Farbraum": "NTSC",
        "RMS-Leistung": "4 W",
        "Reaktionszeit": "5 ms",
        "Schwenkbar": "Ja",
        "Schwenkwinkelbereich": "0 - 335\u00b0",
        "St\u00e4nder enthalten": "Ja",
        "Tiefe (ohne Standfu\u00df)": "51,8 mm",
        "Touchscreen": "Nein",
        "Tr\u00fcbungsrate": "25%",
        "VESA-Halterung": "Ja",
        "Verpackungsart": "Box",
        "Verpackungsbreite": "613 mm",
        "Verpackungsh\u00f6he": "190 mm",
        "Verpackungstiefe": "497 mm",
        "Vorderer Rahmen": "Schwarz"
    },
    "raw_specifications_text": "Bildschirmdiagonale: 61 cm (24\")\nDisplay-Aufl\u00f6sung: 1920 x 1080 Pixel\nNatives Seitenverh\u00e4ltnis: 16:9\nBildschirmtechnologie: LED\nTouchscreen: Nein\nHD-Typ: Full HD\nPanel-Typ: IPS\nHelligkeit (typisch): 250 cd/m\u00b2\nReaktionszeit: 5 ms\nBlendfreier Bildschirm: Ja\nBildschirmform: Flach\nKontrastverh\u00e4ltnis: 1000:1\nKontrastverh\u00e4ltnis (dynamisch): 5000000:1\nBildwinkel, horizontal: 178\u00b0\nBildwinkel, vertikal: 178\u00b0\nAnzahl der Farben des Displays: 16,7 Millionen Farben\nPixel Abstand: 0,27 x 0,27 mm\nBildschirmdiagonale (cm): 60 cm\nTr\u00fcbungsrate: 25%\nFarbtiefe: 8 Bit\nRGB-Farbraum: NTSC\nFarbskala: 72%\nFlimmerfreie Technologie: Ja\nEingebaute Lautsprecher: Ja\nIntegrierte Kamera: Nein\nAnzahl der Lautsprecher: 2\nRMS-Leistung: 4 W\nMarktpositionierung: Business\nProduktfarbe: Schwarz\nVorderer Rahmen: Schwarz\nAbnehmbarer Standfu\u00df: Ja\nFu\u00dffarbe: Schwarz\nIntegrierter USB-Hub: Ja\nAnzahl der vorgeschalteten Steckpl\u00e4tze: 1\nAnzahl der nachgeschalteten Steckpl\u00e4tze vom Typ USB-A: 2\nDVI Anschluss: Ja\nHDMI: Ja\nAnzahl HDMI-Anschl\u00fcsse: 1\nAnzahl DisplayPort Anschl\u00fcsse: 1\nDisplayPorts-Version: 1.2\nAudioanschl\u00fcsse: Ja\nKopfh\u00f6rerausgang: Ja\nHDCP: Ja\nHDCP-Version: 1.4\nVESA-Halterung: Ja\nPanel-Montage-Schnittstelle: 100 x 100 mm\nH\u00f6henverstellung: Ja\nH\u00f6heneinstellung: 13 cm\nPivot: Ja\nPivot Winkel: -90 - 90\u00b0\nSchwenkbar: Ja\nSchwenkwinkelbereich: 0 - 335\u00b0\nNeigungswinkelbereich: -5 - 35\u00b0\nEnergieeffizienzklasse (SDR): E\nEnergieverbrauch (SDR) pro 1.000 Stunden: 18 kWh\nNetzteiltyp: Intern\nEnergieeffizienzskala: A bis G\nSt\u00e4nder enthalten: Ja\nMitgelieferte Kabel: AC, DisplayPort\nDisplayPort Kabell\u00e4nge: 1,8 m\nGer\u00e4tebreite (inkl. Fu\u00df): 539,4 mm\nGer\u00e4tetiefe (inkl. Fu\u00df): 240 mm\nGer\u00e4teh\u00f6he (inkl. Fu\u00df): 505,6 mm\nGewicht (mit St\u00e4nder): 5,7 kg\nBreite (ohne Standfu\u00df): 539,4 mm\nTiefe (ohne Standfu\u00df): 51,8 mm\nH\u00f6he (ohne Standfu\u00df): 326,4 mm\nGewicht (ohne St\u00e4nder): 3,5 kg\nVerpackungsbreite: 613 mm\nVerpackungstiefe: 497 mm\nVerpackungsh\u00f6he: 190 mm\nPaketgewicht: 7,6 kg\nVerpackungsart: Box",
    "reference_file": "offer_reference_362.json",
    "shop_name": "ms-it-beratung"
}