{
    "html_file": "offer_703_12.html",
    "name": "HP P27h G5, 27\"",
    "offer_link": "https://www.proshop.at/Bildschirm/HP-27-Bildschirm-P27h-G5-Black-5-ms/3116293?utm_source=geizhals&utm_medium=cpc&utm_campaign=pricesite",
    "price": 186.68,
    "raw_specifications": {
        "Abmessungen (Breite x Tiefe x H\u00f6he)": "61.1 cm x 20.23 cm x 50.97 cm - mit Fu\u00df",
        "Abmessungen (Breite x Tiefe x H\u00f6he) - mit Fu\u00df": "61.1 cm x 20.23 cm x 50.97 cm",
        "Ausgangsleistung/Kanal": "2 Watt",
        "Besonderheiten": "Low Blue Light Mode, flimmerfreie Technologie, Color Calibrated, extrem schmale Blende an drei Seiten, 8-bit (6-bit + FRC) Farbtiefe",
        "Bildschirmbeschichtung": "Blendfrei, 3H Hard Coating, Haze 25 %",
        "Bildschirmtyp": "IPS",
        "Details zu Abmessungen & Gewicht": "Mit Fu\u00df - Breite: 61.1 cm - Tiefe: 20.23 cm - H\u00f6he: 50.97 cm - Gewicht: 5.75 kg  Ohne Fu\u00df - Breite: 61.1 cm - Tiefe: 5.71 cm - H\u00f6he: 36.56 cm - Gewicht: 4.49 kg",
        "Diagonalabmessung": "68.6 cm (27\")",
        "Display-Typ": "LED-hintergrundbeleuchteter LCD-Monitor / TFT-Aktivmatrix",
        "ENERGY STAR zertifiziert": "Ja",
        "EPEAT-kompatibel": "EPEAT Gold",
        "Eingangsanschl\u00fcsse": "HDMI, VGA, DisplayPort",
        "Eingangsspannung": "Wechselstrom 100-240 V (50/60 Hz)",
        "Einstellungen der Anzeigeposition": "H\u00f6he, Neigung",
        "Enthaltene Kabel": "1 x HDMI-Kabel - 1.8 m",
        "Farbe": "Schwarz",
        "Farbraum": "72% NTSC",
        "Farbtemperatur": "6500K",
        "Farbunterst\u00fctzung": "16,7 Millionen Farben (8-Bit)",
        "Ger\u00e4tetyp": "LED-hintergrundbeleuchteter LCD-Monitor - 68.6 cm (27\")",
        "Gewicht": "5.75 kg",
        "Helligkeit": "250 cd/m\u00b2",
        "Hersteller": "HP",
        "Hintergrundbeleuchtungs-Technologie": "Edge-LED-Beleuchtung",
        "Horizontale Bildwiederholrate": "30 - 86 kHz",
        "Horizontaler Betrachtungswinkel": "178",
        "H\u00f6heneinstellung": "100 mm",
        "Kennzeichnung": "CSA, UL, VCCI, BSMI, NOM, TUV S, CB, CCC, PSB, FCC, ISO 9241-307, KCC, WEEE, ICES, KC, CEL, EAC, ISC, halogenarm, DisplayPort 1.2, Australien-Neuseeland MEPS, Vietnam MEPS",
        "Kontrast": "1000:1 / 8000000:1 (dynamisch)",
        "Lebensdauer der Beleuchtung": "30,000 Stunden",
        "Leistungsmerkmale": "Slot f\u00fcr Sicherheitsschloss (Kabelschloss getrennt erh\u00e4ltlich), abnehmbarer St\u00e4nder, Unterst\u00fctzung f\u00fcr VESA-Schnittstelle, HDCP Compliant, ohne Arsen, quecksilberfrei",
        "Lokalisierung": "Englisch / Europa",
        "Mitgelieferte Software": "HP Display Center, HP Display Manager",
        "Modell": "64W41AA#ABB",
        "Native Aufl\u00f6sung": "Full HD (1080p) 1920 x 1080 bei 75 Hz",
        "Neigungswinkel": "-5/+20",
        "OSD-Sprachen": "Chinesisch (tradionell), Chinesisch (vereinfacht), Englisch, Deutsch, Franz\u00f6sisch, Italienisch, Portugiesisch, Spanisch, Holl\u00e4ndisch, Japanisch",
        "Pixelpitch": "0.311 mm",
        "Ppi": "82",
        "Produktbeschreibung": "HP P27h G5 - P-Series - LED-Monitor - Full HD (1080p) - 68.6 cm (27\")",
        "Reaktionszeit": "5 ms (grau zu grau mit \u00dcbersteuerung)",
        "Schlosstyp zur Diebstahlsicherung": "Kensington Slot",
        "Schnittstellen": "DisplayPort (HDCP)  HDMI (HDCP)  VGA",
        "Seitenverh\u00e4ltnis": "16:9",
        "Spannung": "Wechselstrom 100-240 V (50/60 Hz)",
        "Stromverbrauch (max.)": "35 Watt",
        "Stromverbrauch (typisch)": "21 Watt",
        "Stromverbrauch im Standby-Modus": "0.5 Watt",
        "Transportbreite": "68.5 cm",
        "Transportgewicht": "8.03 kg",
        "Transporth\u00f6he": "42.5 cm",
        "Transporttiefe": "14.1 cm",
        "Typ": "Lautsprecher - Stereo",
        "Umweltschutzstandards": "ENERGY STAR-qualifiziert EPEAT Gold",
        "VESA-Halterung": "100 x 100 mm",
        "Vertikale Bildwiederholrate": "48 - 75 Hz",
        "Vertikaler Betrachtungswinkel": "178",
        "Waren-Nr.": "3116293",
        "Zum Hersteller": "www.hp.com"
    },
    "raw_specifications_text": "Hersteller: HP\nWaren-Nr.: 3116293\nModell: 64W41AA#ABB\nZum Hersteller: www.hp.com\nProduktbeschreibung: HP P27h G5 - P-Series - LED-Monitor - Full HD (1080p) - 68.6 cm (27\")\nGer\u00e4tetyp: LED-hintergrundbeleuchteter LCD-Monitor - 68.6 cm (27\")\nBildschirmtyp: IPS\nSeitenverh\u00e4ltnis: 16:9\nNative Aufl\u00f6sung: Full HD (1080p) 1920 x 1080 bei 75 Hz\nPixelpitch: 0.311 mm\nHelligkeit: 250 cd/m\u00b2\nKontrast: 1000:1 / 8000000:1 (dynamisch)\nReaktionszeit: 5 ms (grau zu grau mit \u00dcbersteuerung)\nFarbunterst\u00fctzung: 16,7 Millionen Farben (8-Bit)\nFarbraum: 72% NTSC\nEingangsanschl\u00fcsse: HDMI, VGA, DisplayPort\nEinstellungen der Anzeigeposition: H\u00f6he, Neigung\nBildschirmbeschichtung: Blendfrei, 3H Hard Coating, Haze 25 %\nSpannung: Wechselstrom 100-240 V (50/60 Hz)\nFarbe: Schwarz\nAbmessungen (Breite x Tiefe x H\u00f6he) - mit Fu\u00df: 61.1 cm x 20.23 cm x 50.97 cm\nGewicht: 5.75 kg\nLokalisierung: Englisch / Europa\nUmweltschutzstandards: ENERGY STAR-qualifiziert EPEAT Gold\nKennzeichnung: CSA, UL, VCCI, BSMI, NOM, TUV S, CB, CCC, PSB, FCC, ISO 9241-307, KCC, WEEE, ICES, KC, CEL, EAC, ISC, halogenarm, DisplayPort 1.2, Australien-Neuseeland MEPS, Vietnam MEPS\nDisplay-Typ: LED-hintergrundbeleuchteter LCD-Monitor / TFT-Aktivmatrix\nDiagonalabmessung: 68.6 cm (27\")\nPpi: 82\nVertikale Bildwiederholrate: 48 - 75 Hz\nHorizontale Bildwiederholrate: 30 - 86 kHz\nHorizontaler Betrachtungswinkel: 178\nVertikaler Betrachtungswinkel: 178\nHintergrundbeleuchtungs-Technologie: Edge-LED-Beleuchtung\nFarbtemperatur: 6500K\nOSD-Sprachen: Chinesisch (tradionell), Chinesisch (vereinfacht), Englisch, Deutsch, Franz\u00f6sisch, Italienisch, Portugiesisch, Spanisch, Holl\u00e4ndisch, Japanisch\nBesonderheiten: Low Blue Light Mode, flimmerfreie Technologie, Color Calibrated, extrem schmale Blende an drei Seiten, 8-bit (6-bit + FRC) Farbtiefe\nAbmessungen (Breite x Tiefe x H\u00f6he): 61.1 cm x 20.23 cm x 50.97 cm - mit Fu\u00df\nTyp: Lautsprecher - Stereo\nAusgangsleistung/Kanal: 2 Watt\nSchnittstellen: DisplayPort (HDCP)  HDMI (HDCP)  VGA\nNeigungswinkel: -5/+20\nH\u00f6heneinstellung: 100 mm\nVESA-Halterung: 100 x 100 mm\nLeistungsmerkmale: Slot f\u00fcr Sicherheitsschloss (Kabelschloss getrennt erh\u00e4ltlich), abnehmbarer St\u00e4nder, Unterst\u00fctzung f\u00fcr VESA-Schnittstelle, HDCP Compliant, ohne Arsen, quecksilberfrei\nEnthaltene Kabel: 1 x HDMI-Kabel - 1.8 m\nLebensdauer der Beleuchtung: 30,000 Stunden\nSchlosstyp zur Diebstahlsicherung: Kensington Slot\nEingangsspannung: Wechselstrom 100-240 V (50/60 Hz)\nStromverbrauch (typisch): 21 Watt\nStromverbrauch (max.): 35 Watt\nStromverbrauch im Standby-Modus: 0.5 Watt\nMitgelieferte Software: HP Display Center, HP Display Manager\nDetails zu Abmessungen & Gewicht: Mit Fu\u00df - Breite: 61.1 cm - Tiefe: 20.23 cm - H\u00f6he: 50.97 cm - Gewicht: 5.75 kg  Ohne Fu\u00df - Breite: 61.1 cm - Tiefe: 5.71 cm - H\u00f6he: 36.56 cm - Gewicht: 4.49 kg\nTransportbreite: 68.5 cm\nTransporttiefe: 14.1 cm\nTransporth\u00f6he: 42.5 cm\nTransportgewicht: 8.03 kg\nEPEAT-kompatibel: EPEAT Gold\nENERGY STAR zertifiziert: Ja",
    "reference_file": "offer_reference_703.json",
    "shop_name": "Proshop.at"
}