{
    "html_file": "offer_732_32.html",
    "name": "iiyama ProLite XUB2494HSU-B2, 23.8\"",
    "offer_link": "https://www.proshop.at/Bildschirm/iiyama-24-Bildschirm-ProLite-XUB2494HSU-B2-LED-monitor-Full-HD-1080p-24-Black-4-ms/3126593?utm_source=geizhals&utm_medium=cpc&utm_campaign=pricesite",
    "price": 148.54,
    "raw_specifications": {
        "Abmessungen (Breite x Tiefe x H\u00f6he)": "54 cm x 20.95 cm x 37.35 cm",
        "Ausgangsleistung/Kanal": "2 Watt",
        "Besonderheiten": "HDCP, Eco-Mode, Advanced Contrast Ratio (ACR), flimmerfreie Technologie, i-Style Color, 3 Side Borderless Design, Blue Light Reducer Function",
        "Bildschirmbeschichtung": "Matt",
        "Bildschirmtyp": "VA",
        "Diagonalabmessung": "61 cm (24\")",
        "Display-Typ": "LED-hintergrundbeleuchteter LCD-Monitor / TFT-Aktivmatrix",
        "EAN": "4948570120826",
        "Eingangsanschl\u00fcsse": "HDMI, DisplayPort",
        "Eingangsspannung": "Wechselstrom 100-240 V (50/60 Hz)",
        "Einstellungen der Anzeigeposition": "H\u00f6he, Pivot (Rotation), Drehung, Neigung",
        "Energie Effizienzklasse": "Klasse E",
        "Enthaltene Kabel": "1 x USB-Kabel  1 x HDMI-Kabel  1 x Stromkabel",
        "Farbe": "Mattschwarz",
        "Farbraum": "72% NTSC, 96% sRGB",
        "Farbunterst\u00fctzung": "16,7 Millionen Farben",
        "Ger\u00e4tetyp": "LED-hintergrundbeleuchteter LCD-Monitor - 61 cm (24\")",
        "Gewicht": "4.8 kg",
        "Helligkeit": "250 cd/m\u00b2",
        "Hersteller": "iiyama",
        "Hintergrundbeleuchtungs-Technologie": "LED-Hintergrundbeleuchtung",
        "Horizontale Bildwiederholrate": "30 - 85 kHz",
        "Horizontaler Betrachtungswinkel": "178",
        "H\u00f6heneinstellung": "150 mm",
        "Integrierte Peripherieger\u00e4te": "USB 3.0-Hub",
        "Kennzeichnung": "DDC-2B, DDC/CI, RoHS, WEEE, PSE Mark, REACH, TUV Bauart, ERP, VCCI Class B, EAC, REACH SvHC, UKCA",
        "Kontrast": "3000:1 / 80000000:1 (dynamisch)",
        "Leistungsmerkmale": "Slot f\u00fcr Sicherheitsschloss (Kabelschloss getrennt erh\u00e4ltlich)",
        "Modell": "XUB2494HSU-B2",
        "Native Aufl\u00f6sung": "Full HD (1080p) 1920 x 1080 bei 75 Hz",
        "Neigungswinkel": "-5/+23",
        "OSD-Sprachen": "Tschechisch, Englisch, Deutsch, Franz\u00f6sisch, Italienisch, Polnisch, Russisch, Spanisch, Holl\u00e4ndisch, Japanisch",
        "Pixelpitch": "0.275 mm",
        "Produktbeschreibung": "iiyama ProLite XUB2494HSU-B2 - LED-Monitor - Full HD (1080p) - 61 cm (24\")",
        "Reaktionszeit": "4 ms (gray-to-gray)",
        "Rotationswinkel": "90",
        "Schlosstyp zur Diebstahlsicherung": "Kensington Slot",
        "Schnittstellen": "HDMI  DisplayPort  2 x USB 3.0  Kopfh\u00f6rer",
        "Schwenkwinkel": "90",
        "Seitenverh\u00e4ltnis": "16:9",
        "Sichtbare Bildfl\u00e4che": "60.5 cm (23.8\")",
        "Spannung": "Wechselstrom 100-240 V (50/60 Hz)",
        "Stromverbrauch (Aus-Modus)": "0.3 Watt",
        "Stromverbrauch (typisch)": "19 Watt",
        "Stromverbrauch SDR (eingeschaltet)": "16 kWh/1.000 h",
        "Stromverbrauch im Standby-Modus": "0.5 Watt",
        "Transportbreite": "68.5 cm",
        "Transportgewicht": "5.7 kg",
        "Transporth\u00f6he": "12.5 cm",
        "Transporttiefe": "40.3 cm",
        "Typ": "Lautsprecher - Stereo",
        "VESA-Halterung": "100 x 100 mm",
        "Vertikaler Betrachtungswinkel": "178",
        "Waren-Nr.": "3126593",
        "Zum Hersteller": "www.iiyama.com"
    },
    "raw_specifications_text": "Hersteller: iiyama\nWaren-Nr.: 3126593\nModell: XUB2494HSU-B2\nEAN: 4948570120826\nZum Hersteller: www.iiyama.com\nProduktbeschreibung: iiyama ProLite XUB2494HSU-B2 - LED-Monitor - Full HD (1080p) - 61 cm (24\")\nGer\u00e4tetyp: LED-hintergrundbeleuchteter LCD-Monitor - 61 cm (24\")\nEnergie Effizienzklasse: Klasse E\nLeistungsmerkmale: Slot f\u00fcr Sicherheitsschloss (Kabelschloss getrennt erh\u00e4ltlich)\nBildschirmtyp: VA\nSeitenverh\u00e4ltnis: 16:9\nNative Aufl\u00f6sung: Full HD (1080p) 1920 x 1080 bei 75 Hz\nPixelpitch: 0.275 mm\nHelligkeit: 250 cd/m\u00b2\nKontrast: 3000:1 / 80000000:1 (dynamisch)\nReaktionszeit: 4 ms (gray-to-gray)\nFarbunterst\u00fctzung: 16,7 Millionen Farben\nFarbraum: 72% NTSC, 96% sRGB\nEingangsanschl\u00fcsse: HDMI, DisplayPort\nEinstellungen der Anzeigeposition: H\u00f6he, Pivot (Rotation), Drehung, Neigung\nBildschirmbeschichtung: Matt\nSpannung: Wechselstrom 100-240 V (50/60 Hz)\nFarbe: Mattschwarz\nAbmessungen (Breite x Tiefe x H\u00f6he): 54 cm x 20.95 cm x 37.35 cm\nGewicht: 4.8 kg\nKennzeichnung: DDC-2B, DDC/CI, RoHS, WEEE, PSE Mark, REACH, TUV Bauart, ERP, VCCI Class B, EAC, REACH SvHC, UKCA\nDisplay-Typ: LED-hintergrundbeleuchteter LCD-Monitor / TFT-Aktivmatrix\nDiagonalabmessung: 61 cm (24\")\nSichtbare Bildfl\u00e4che: 60.5 cm (23.8\")\nIntegrierte Peripherieger\u00e4te: USB 3.0-Hub\nHorizontale Bildwiederholrate: 30 - 85 kHz\nHorizontaler Betrachtungswinkel: 178\nVertikaler Betrachtungswinkel: 178\nHintergrundbeleuchtungs-Technologie: LED-Hintergrundbeleuchtung\nOSD-Sprachen: Tschechisch, Englisch, Deutsch, Franz\u00f6sisch, Italienisch, Polnisch, Russisch, Spanisch, Holl\u00e4ndisch, Japanisch\nBesonderheiten: HDCP, Eco-Mode, Advanced Contrast Ratio (ACR), flimmerfreie Technologie, i-Style Color, 3 Side Borderless Design, Blue Light Reducer Function\nTyp: Lautsprecher - Stereo\nAusgangsleistung/Kanal: 2 Watt\nSchnittstellen: HDMI  DisplayPort  2 x USB 3.0  Kopfh\u00f6rer\nNeigungswinkel: -5/+23\nSchwenkwinkel: 90\nRotationswinkel: 90\nH\u00f6heneinstellung: 150 mm\nVESA-Halterung: 100 x 100 mm\nEnthaltene Kabel: 1 x USB-Kabel  1 x HDMI-Kabel  1 x Stromkabel\nSchlosstyp zur Diebstahlsicherung: Kensington Slot\nEingangsspannung: Wechselstrom 100-240 V (50/60 Hz)\nStromverbrauch SDR (eingeschaltet): 16 kWh/1.000 h\nStromverbrauch (typisch): 19 Watt\nStromverbrauch im Standby-Modus: 0.5 Watt\nStromverbrauch (Aus-Modus): 0.3 Watt\nTransportbreite: 68.5 cm\nTransporttiefe: 40.3 cm\nTransporth\u00f6he: 12.5 cm\nTransportgewicht: 5.7 kg",
    "reference_file": "offer_reference_732.json",
    "shop_name": "Proshop.at"
}