{
    "html_file": "offer_2481_1.html",
    "name": "Eizo DuraVision FDF2304W-IP, 23\"",
    "offer_link": "https://www.proshop.at/Bildschirm/EIZO-23-Bildschirm-DuraVision-FDF2304W-IP-Black-8-ms/3166252?utm_source=geizhals&utm_medium=cpc&utm_campaign=pricesite",
    "price": 2307.86,
    "raw_specifications": {
        "Abmessungen (Breite x Tiefe x H\u00f6he)": "56.35 cm x 15.7 cm x 41.15 cm - mit Fu\u00df",
        "Abmessungen (Breite x Tiefe x H\u00f6he) - mit Fu\u00df": "56.35 cm x 15.7 cm x 41.15 cm",
        "Besonderheiten": "Smart Resolution, Smart Insight",
        "Bildschirmtyp": "IPS",
        "Details zu Abmessungen & Gewicht": "Mit Fu\u00df - Breite: 56.35 cm - Tiefe: 15.7 cm - H\u00f6he: 41.15 cm - Gewicht: 7.9 kg  Ohne Fu\u00df - Breite: 56.35 cm - Tiefe: 6.3 cm - H\u00f6he: 32.5 cm - Gewicht: 5.5 kg",
        "Diagonalabmessung": "58.4 cm (23\")",
        "Display-Typ": "LED-hintergrundbeleuchteter LCD-Monitor / TFT-Aktivmatrix",
        "EAN": "4995047045069",
        "Eingangsanschl\u00fcsse": "HDMI",
        "Eingangsspannung": "Wechselstrom 120/230 V (50/60 Hz)",
        "Enthaltene Kabel": "1 x HDMI-Kabel",
        "Ethernet integriert": "Ja",
        "Farbe": "Schwarz",
        "Farbunterst\u00fctzung": "16,7 Millionen Farben",
        "Ger\u00e4tetyp": "LED-hintergrundbeleuchteter LCD-Monitor - 58.4 cm (23\")",
        "Gewicht": "7.9 kg",
        "Helligkeit": "300 cd/m\u00b2",
        "Hersteller": "EIZO",
        "Hintergrundbeleuchtungs-Technologie": "LED-Hintergrundbeleuchtung",
        "Horizontale Bildwiederholrate": "31 - 68 kHz",
        "Horizontaler Betrachtungswinkel": "178",
        "Integrierte Peripherieger\u00e4te": "USB 2.0 Hub",
        "Kennzeichnung": "FCC Klasse B bescheinigt, C-Tick, TUV S, CB, ICES-003 Class B, RoHS, WEEE, cTUVus, VCCI Class B",
        "Kontrast": "1000:1",
        "Leistungsmerkmale": "Slot f\u00fcr Sicherheitsschloss (Kabelschloss getrennt erh\u00e4ltlich), Ger\u00e4uschreduzierung",
        "Modell": "DVFDF2304W-IP",
        "Native Aufl\u00f6sung": "Full HD (1080p) 1920 x 1080",
        "Neigungswinkel": "30",
        "Pixelpitch": "0.2652 mm",
        "Produktbeschreibung": "EIZO DuraVision FDF2304W-IP - LED-Monitor - Full HD (1080p) - 58.4 cm (23\")",
        "Reaktionszeit": "8 ms (Gray-to-Gray)",
        "Schnittstellen": "HDMI  2 x USB 2.0  Netzwerk (RJ-45)",
        "Seitenverh\u00e4ltnis": "16:9",
        "Spannung": "Wechselstrom 120/230 V (50/60 Hz)",
        "Spannungsversorgung": "Intern",
        "Steuerelemente und Einstellungen": "Helligkeit, Farbraum",
        "Stromverbrauch (typisch)": "61 Watt",
        "Stromverbrauch im Standby-Modus": "3 Watt",
        "VESA-Halterung": "100 x 100 mm",
        "Vertikale Bildwiederholrate": "49 - 61 Hz",
        "Vertikaler Betrachtungswinkel": "178",
        "Waren-Nr.": "3166252",
        "Zubeh\u00f6r im Lieferumfang": "Fernbedienung, Aufstellung",
        "Zum Hersteller": "www.eizo.com"
    },
    "raw_specifications_text": "Hersteller: EIZO\nWaren-Nr.: 3166252\nModell: DVFDF2304W-IP\nEAN: 4995047045069\nZum Hersteller: www.eizo.com\nProduktbeschreibung: EIZO DuraVision FDF2304W-IP - LED-Monitor - Full HD (1080p) - 58.4 cm (23\")\nGer\u00e4tetyp: LED-hintergrundbeleuchteter LCD-Monitor - 58.4 cm (23\")\nLeistungsmerkmale: Slot f\u00fcr Sicherheitsschloss (Kabelschloss getrennt erh\u00e4ltlich), Ger\u00e4uschreduzierung\nBildschirmtyp: IPS\nSeitenverh\u00e4ltnis: 16:9\nNative Aufl\u00f6sung: Full HD (1080p) 1920 x 1080\nPixelpitch: 0.2652 mm\nHelligkeit: 300 cd/m\u00b2\nKontrast: 1000:1\nReaktionszeit: 8 ms (Gray-to-Gray)\nFarbunterst\u00fctzung: 16,7 Millionen Farben\nEingangsanschl\u00fcsse: HDMI\nEthernet integriert: Ja\nSpannung: Wechselstrom 120/230 V (50/60 Hz)\nFarbe: Schwarz\nAbmessungen (Breite x Tiefe x H\u00f6he) - mit Fu\u00df: 56.35 cm x 15.7 cm x 41.15 cm\nGewicht: 7.9 kg\nKennzeichnung: FCC Klasse B bescheinigt, C-Tick, TUV S, CB, ICES-003 Class B, RoHS, WEEE, cTUVus, VCCI Class B\nDisplay-Typ: LED-hintergrundbeleuchteter LCD-Monitor / TFT-Aktivmatrix\nDiagonalabmessung: 58.4 cm (23\")\nIntegrierte Peripherieger\u00e4te: USB 2.0 Hub\nVertikale Bildwiederholrate: 49 - 61 Hz\nHorizontale Bildwiederholrate: 31 - 68 kHz\nHorizontaler Betrachtungswinkel: 178\nVertikaler Betrachtungswinkel: 178\nHintergrundbeleuchtungs-Technologie: LED-Hintergrundbeleuchtung\nSteuerelemente und Einstellungen: Helligkeit, Farbraum\nBesonderheiten: Smart Resolution, Smart Insight\nAbmessungen (Breite x Tiefe x H\u00f6he): 56.35 cm x 15.7 cm x 41.15 cm - mit Fu\u00df\nSchnittstellen: HDMI  2 x USB 2.0  Netzwerk (RJ-45)\nNeigungswinkel: 30\nVESA-Halterung: 100 x 100 mm\nZubeh\u00f6r im Lieferumfang: Fernbedienung, Aufstellung\nEnthaltene Kabel: 1 x HDMI-Kabel\nSpannungsversorgung: Intern\nEingangsspannung: Wechselstrom 120/230 V (50/60 Hz)\nStromverbrauch (typisch): 61 Watt\nStromverbrauch im Standby-Modus: 3 Watt\nDetails zu Abmessungen & Gewicht: Mit Fu\u00df - Breite: 56.35 cm - Tiefe: 15.7 cm - H\u00f6he: 41.15 cm - Gewicht: 7.9 kg  Ohne Fu\u00df - Breite: 56.35 cm - Tiefe: 6.3 cm - H\u00f6he: 32.5 cm - Gewicht: 5.5 kg",
    "reference_file": "offer_reference_2481.json",
    "shop_name": "Proshop.at"
}