{
    "html_file": "offer_495_6.html",
    "name": "HP E32k G5, 31.5\"",
    "offer_link": "https://www.alternate.at/HP/E32k-G5-LED-Monitor/html/product/1904970?partner=AtGeizhalsat&campaign=Monitor/HP/1904970",
    "price": 708.0,
    "raw_specifications": {
        "": "Ausgangsleistung",
        "Abmessungen": "Breite: 714 mm x H\u00f6he: 603,4 mm x Tiefe/L\u00e4nge: 22,7 mm",
        "Anschl\u00fcsse": "1x HDMI-Eingang, (HDMI-Version: 2.0), 1x DisplayPort-Eingang, (DisplayPort-Version: 1.4), 3x USB-A-3.2 Gen 1 (5 Gbit/s), 1x USB-C 3.2 Gen 1 (5 Gbit/s), 1x RJ 45",
        "Bild": "Glaretyp",
        "Bildschirmaufl\u00f6sung": "3.840 x 2.160 Pixel",
        "Bildschirmdiagonale": "80 cm (31,5 Zoll)",
        "EAN": "0196786296673",
        "Energieeffizienzklasse (SDR)": "F (A - G)",
        "Energieverbauch pro 1000 Stunden (SDR)": "32 kWh",
        "Ergonomie": "Typ",
        "Farbe": "schwarz/silber",
        "Features": "Kensington-Schloss",
        "Frequenz": "Vertikal",
        "Geeignet f\u00fcr": "Business",
        "Gewicht": "8,4 kg",
        "Hersteller-Nr.": "6N4D6AA#ABB",
        "Lautsprecher": "2 Lautsprecher",
        "Leistungsaufnahme im Bereitschafts- und Aus-Zustand": "0,5 Watt",
        "Leistungsaufnahme im Ein-Zustand bei Standard-Dynamikumfang (SDR)": "32,4 Watt",
        "Stromversorgung": "Stromverbrauch",
        "Typ": "LED-Monitor",
        "Wandhalterung": "VESA kompatibel (100 x 100 mm)",
        "Weitere Informationen": "Ein USB-A-Anschluss hat eine Ladefunktion. Der USB-C-Port unterst\u00fctzt Leistungsabgabe bis bis zu 65 Watt und DisplayPort 1.4",
        "Zubeh\u00f6r": "Vorhanden"
    },
    "raw_specifications_text": "Energieeffizienzklasse (SDR): F (A - G)\nEnergieverbauch pro 1000 Stunden (SDR): 32 kWh\nLeistungsaufnahme im Ein-Zustand bei Standard-Dynamikumfang (SDR): 32,4 Watt\nLeistungsaufnahme im Bereitschafts- und Aus-Zustand: 0,5 Watt\nBildschirmdiagonale: 80 cm (31,5 Zoll)\nBildschirmaufl\u00f6sung: 3.840 x 2.160 Pixel\nTyp: LED-Monitor\nFarbe: schwarz/silber\nEAN: 0196786296673\nHersteller-Nr.: 6N4D6AA#ABB\nGeeignet f\u00fcr: Business\nBild: Glaretyp\n: Ausgangsleistung\nFrequenz: Vertikal\nAnschl\u00fcsse: 1x HDMI-Eingang, (HDMI-Version: 2.0), 1x DisplayPort-Eingang, (DisplayPort-Version: 1.4), 3x USB-A-3.2 Gen 1 (5 Gbit/s), 1x USB-C 3.2 Gen 1 (5 Gbit/s), 1x RJ 45\nErgonomie: Typ\nStromversorgung: Stromverbrauch\nLautsprecher: 2 Lautsprecher\nWandhalterung: VESA kompatibel (100 x 100 mm)\nFeatures: Kensington-Schloss\nWeitere Informationen: Ein USB-A-Anschluss hat eine Ladefunktion. Der USB-C-Port unterst\u00fctzt Leistungsabgabe bis bis zu 65 Watt und DisplayPort 1.4\nZubeh\u00f6r: Vorhanden\nAbmessungen: Breite: 714 mm x H\u00f6he: 603,4 mm x Tiefe/L\u00e4nge: 22,7 mm\nGewicht: 8,4 kg",
    "reference_file": "offer_reference_495.json",
    "shop_name": "Alternate.at"
}