{
    "html_file": "offer_2442_37.html",
    "name": "Eizo FlexScan EV2456 schwarz, 24.1\"",
    "offer_link": "https://www.e-tec.at/details.php?artnr=236502",
    "price": 439.0,
    "raw_specifications": {
        "Abmessungen (BxHxT)": "531x351x190mm (mit Standfu\u00df),  531x342x46mm (ohne Standfu\u00df)",
        "Anschl\u00fcsse - DVI": "1",
        "Anschl\u00fcsse - DisplayPort": "1",
        "Anschl\u00fcsse - HDMI 1.4": "1",
        "Anschl\u00fcsse - VGA": "1",
        "Anschl\u00fcsse - VGA (60Hz@1920x1200)": "1",
        "Anschl\u00fcsse - VGA 60Hz@1920x1200": "1",
        "Anwendung": "station\u00e4r",
        "Audio": "Lautsprecher (2x 1W),  1x Line-In,  1x Line-Out",
        "Aufl\u00f6sung": "1920x1200",
        "Beschichtung": "matt (non-glare)",
        "Besonderheiten": "Slim Bezel,  EPEAT Gold,  Lichtsensor,  DICOM,  Sicherheitsschloss (Kensington)",
        "Bildwiederholfrequenz": "60Hz",
        "Blickwinkel": "178\u00b0/178\u00b0",
        "Diagonale": "24.1\"/61.2cm",
        "Energieeffizienzklasse alt (A+++ bis D)": "A++",
        "Energieeffizienzklasse alt (A+++ bis G)": "A++",
        "Energieverbrauch SDR": "14kWh/1000h",
        "Ergonomie": "158mm (h\u00f6henverstellbar),  90\u00b0 (Pivot),  \u00b1172\u00b0 (drehbar),  +35\u00b0/-5\u00b0 (neigbar),  keine Angabe (Schr\u00e4glage)",
        "FRC": "unbekannt",
        "Farbe": "schwarz",
        "Farbtiefe": "8bit (16.7 Mio. Farben)",
        "Form": "gerade (flat)",
        "Gewicht": "5.70kg (mit Standfu\u00df),  3.70kg (ohne Standfu\u00df)",
        "HDR": "N/A",
        "Helligkeit": "350cd/m\u00b2",
        "Herstellergarantie": "f\u00fcnf Jahre (Vor-Ort)",
        "Hintergrundbeleuchtung": "White-LED,  flicker-free,  Blaulichtfilter",
        "Jahresverbrauch alt (A+++ bis D)": "18.98kWh",
        "Jahresverbrauch alt (A+++ bis G)": "18.98kWh",
        "Kontrast - statisch": "1.000:1",
        "Lautsprecher": "Ja",
        "Leistungsaufnahme": "44W (maximal),  13W (typisch),  13W (Energielabel alt A+++ bis G),  0.5W (Standby)",
        "Panel": "IPS",
        "Reaktionszeit - GtG": "5ms",
        "Screen-to-Body-Ratio": "92.7% (berechnet)",
        "Seitenverh\u00e4ltnis": "16:10",
        "Signalfrequenz": "31-76kHz (horizontal),  59-61Hz (vertikal)",
        "Stromversorgung": "AC-In (internes Netzteil)",
        "USB-Hub In": "1x USB-B 3.0",
        "USB-Hub Out": "2x USB-A 3.0",
        "USB-Schreibweise": "Link",
        "VESA": "100x100 (belegt)",
        "VRR (Variable Refresh Rate)": "N/A",
        "Weitere Anschl\u00fcsse": "N/A"
    },
    "raw_specifications_text": "Abmessungen (BxHxT): 531x351x190mm (mit Standfu\u00df),  531x342x46mm (ohne Standfu\u00df)\nAnschl\u00fcsse - DisplayPort: 1\nAnschl\u00fcsse - DVI: 1\nAnschl\u00fcsse - HDMI 1.4: 1\nAnschl\u00fcsse - VGA: 1\nAnschl\u00fcsse - VGA (60Hz@1920x1200): 1\nAnschl\u00fcsse - VGA 60Hz@1920x1200: 1\nAnwendung: station\u00e4r\nAudio: Lautsprecher (2x 1W),  1x Line-In,  1x Line-Out\nAufl\u00f6sung: 1920x1200\nBeschichtung: matt (non-glare)\nBesonderheiten: Slim Bezel,  EPEAT Gold,  Lichtsensor,  DICOM,  Sicherheitsschloss (Kensington)\nBildwiederholfrequenz: 60Hz\nBlickwinkel: 178\u00b0/178\u00b0\nDiagonale: 24.1\"/61.2cm\nEnergieeffizienzklasse alt (A+++ bis D): A++\nEnergieeffizienzklasse alt (A+++ bis G): A++\nEnergieverbrauch SDR: 14kWh/1000h\nErgonomie: 158mm (h\u00f6henverstellbar),  90\u00b0 (Pivot),  \u00b1172\u00b0 (drehbar),  +35\u00b0/-5\u00b0 (neigbar),  keine Angabe (Schr\u00e4glage)\nFarbe: schwarz\nFarbtiefe: 8bit (16.7 Mio. Farben)\nForm: gerade (flat)\nFRC: unbekannt\nGewicht: 5.70kg (mit Standfu\u00df),  3.70kg (ohne Standfu\u00df)\nHDR: N/A\nHelligkeit: 350cd/m\u00b2\nHerstellergarantie: f\u00fcnf Jahre (Vor-Ort)\nHintergrundbeleuchtung: White-LED,  flicker-free,  Blaulichtfilter\nJahresverbrauch alt (A+++ bis D): 18.98kWh\nJahresverbrauch alt (A+++ bis G): 18.98kWh\nKontrast - statisch: 1.000:1\nLautsprecher: Ja\nLeistungsaufnahme: 44W (maximal),  13W (typisch),  13W (Energielabel alt A+++ bis G),  0.5W (Standby)\nPanel: IPS\nReaktionszeit - GtG: 5ms\nScreen-to-Body-Ratio: 92.7% (berechnet)\nSeitenverh\u00e4ltnis: 16:10\nSignalfrequenz: 31-76kHz (horizontal),  59-61Hz (vertikal)\nStromversorgung: AC-In (internes Netzteil)\nUSB-Hub In: 1x USB-B 3.0\nUSB-Hub Out: 2x USB-A 3.0\nUSB-Schreibweise: Link\nVESA: 100x100 (belegt)\nVRR (Variable Refresh Rate): N/A\nWeitere Anschl\u00fcsse: N/A",
    "reference_file": "offer_reference_2442.json",
    "shop_name": "e-tec.at"
}