{
    "html_file": "offer_1026_8.html",
    "name": "Dell E2223HV, 21.5\"",
    "offer_link": "https://www.ba-computer.at/dell-e2223hv-led-monitor-55-9-cm-22-21-45-sichtbar-dell-e2223hv.html",
    "price": 101.78,
    "raw_specifications": {
        "Abmessungen (Breite x Tiefe x H\u00f6he)": "50.426 cm x 17.1 cm x 38.417 cm - mit Fu\u00df",
        "Besonderheiten": "Breiter Betrachtungswinkel",
        "Bildschirmbeschichtung": "Blendfrei",
        "Bildschirmtyp": "VA",
        "Details zu Abmessungen & Gewicht": "Mit Fu\u00df - Breite: 50.42 cm - Tiefe: 17.1 cm - H\u00f6he: 38.417 cm - Gewicht: 2.9 kg \u00a6 Ohne Fu\u00df - Breite: 50.426 cm - Tiefe: 4.964 cm - H\u00f6he: 29.538 cm - Gewicht: 2.26 kg",
        "Diagonalabmessung": "55.9 cm (22\")",
        "Display-Typ": "LED-hintergrundbeleuchteter LCD-Monitor / TFT-Aktivmatrix",
        "ENERGY STAR zertifiziert": "Ja",
        "Ein-/Aus-Schalter": "Ja",
        "Eingangsspannung": "Wechselstrom 100-240 V (50/60 Hz)",
        "Einstellungen der Anzeigeposition": "Neigung",
        "Energie Effizienzklasse": "Klasse D",
        "Energierverbrauch Sleep": "0.3 Watt",
        "Enthaltene Kabel": "1 x VGA-Kabel - VGA-zu-VGA",
        "Farbraum": "72% (CIE 1931), 83% (CIE 1976)",
        "Farbunterst\u00fctzung": "16,7 Millionen Farben",
        "Gewicht": "2.9 kg",
        "Helligkeit": "250 cd/m\u00b2",
        "Hintergrundbeleuchtungs-Technologie": "LED-Hintergrundbeleuchtung",
        "Horizontale Bildwiederholrate": "30 - 83 kHz",
        "Horizontaler Betrachtungswinkel": "178",
        "Kontrast": "3000:1",
        "Leistungsmerkmale": "Slot f\u00fcr Sicherheitsschloss (Kabelschloss getrennt erh\u00e4ltlich), Unterst\u00fctzung f\u00fcr VESA-Schnittstelle",
        "Max. Betriebstemperatur": "40 \u00b0C",
        "Min Betriebstemperatur": "0 \u00b0C",
        "Native Aufl\u00f6sung": "Full HD (1080p) 1920 x 1080 bei 60 Hz",
        "Neigungswinkel": "-5/+21",
        "Ppi": "103",
        "Reaktionszeit": "12 ms (normal), 8 ms (schnell)",
        "Schlosstyp zur Diebstahlsicherung": "Kensington Slot",
        "Schnittstellen": "VGA",
        "Seitenverh\u00e4ltnis": "16:9",
        "Services im Bundle": "3 Jahre erweiterte Basisaustauschgew\u00e4hrleistung",
        "Sichtbare Bildfl\u00e4che": "54.48 cm (21.45\")",
        "Stromverbrauch (Aus-Modus)": "0.3 Watt",
        "Stromverbrauch (max.)": "19 Watt",
        "Stromverbrauch SDR (eingeschaltet)": "12.1 kWh/1.000 h",
        "Stromverbrauch im Standby-Modus": "0.3 Watt",
        "TCO-zertifiziert": "TCO Certified Displays 9",
        "Transportgewicht": "4.01 kg",
        "VESA-Halterung": "100 x 100 mm",
        "Vertikale Bildwiederholrate": "50 - 75 Hz",
        "Vertikaler Betrachtungswinkel": "178",
        "Zubeh\u00f6r im Lieferumfang": "VESA-Schraubenabdeckung",
        "Zul\u00e4ssige Luftfeuchtigkeit im Betrieb": "10 - 80% (nicht kondensierend)"
    },
    "raw_specifications_text": "Display-Typ: LED-hintergrundbeleuchteter LCD-Monitor / TFT-Aktivmatrix\nEnergie Effizienzklasse: Klasse D\nDiagonalabmessung: 55.9 cm (22\")\nSichtbare Bildfl\u00e4che: 54.48 cm (21.45\")\nBildschirmtyp: VA\nSeitenverh\u00e4ltnis: 16:9\nNative Aufl\u00f6sung: Full HD (1080p) 1920 x 1080 bei 60 Hz\nPpi: 103\nHelligkeit: 250 cd/m\u00b2\nKontrast: 3000:1\nFarbunterst\u00fctzung: 16,7 Millionen Farben\nFarbraum: 72% (CIE 1931), 83% (CIE 1976)\nReaktionszeit: 12 ms (normal), 8 ms (schnell)\nVertikale Bildwiederholrate: 50 - 75 Hz\nHorizontale Bildwiederholrate: 30 - 83 kHz\nHorizontaler Betrachtungswinkel: 178\nVertikaler Betrachtungswinkel: 178\nBildschirmbeschichtung: Blendfrei\nHintergrundbeleuchtungs-Technologie: LED-Hintergrundbeleuchtung\nBesonderheiten: Breiter Betrachtungswinkel\nAbmessungen (Breite x Tiefe x H\u00f6he): 50.426 cm x 17.1 cm x 38.417 cm - mit Fu\u00df\nGewicht: 2.9 kg\nSchnittstellen: VGA\nEinstellungen der Anzeigeposition: Neigung\nNeigungswinkel: -5/+21\nVESA-Halterung: 100 x 100 mm\nLeistungsmerkmale: Slot f\u00fcr Sicherheitsschloss (Kabelschloss getrennt erh\u00e4ltlich), Unterst\u00fctzung f\u00fcr VESA-Schnittstelle\nZubeh\u00f6r im Lieferumfang: VESA-Schraubenabdeckung\nEnthaltene Kabel: 1 x VGA-Kabel - VGA-zu-VGA\nSchlosstyp zur Diebstahlsicherung: Kensington Slot\nEingangsspannung: Wechselstrom 100-240 V (50/60 Hz)\nStromverbrauch SDR (eingeschaltet): 12.1 kWh/1.000 h\nStromverbrauch (max.): 19 Watt\nStromverbrauch im Standby-Modus: 0.3 Watt\nEnergierverbrauch Sleep: 0.3 Watt\nStromverbrauch (Aus-Modus): 0.3 Watt\nEin-/Aus-Schalter: Ja\nDetails zu Abmessungen & Gewicht: Mit Fu\u00df - Breite: 50.42 cm - Tiefe: 17.1 cm - H\u00f6he: 38.417 cm - Gewicht: 2.9 kg \u00a6 Ohne Fu\u00df - Breite: 50.426 cm - Tiefe: 4.964 cm - H\u00f6he: 29.538 cm - Gewicht: 2.26 kg\nTransportgewicht: 4.01 kg\nTCO-zertifiziert: TCO Certified Displays 9\nENERGY STAR zertifiziert: Ja\nServices im Bundle: 3 Jahre erweiterte Basisaustauschgew\u00e4hrleistung\nMin Betriebstemperatur: 0 \u00b0C\nMax. Betriebstemperatur: 40 \u00b0C\nZul\u00e4ssige Luftfeuchtigkeit im Betrieb: 10 - 80% (nicht kondensierend)",
    "reference_file": "offer_reference_1026.json",
    "shop_name": "BA-Computer"
}