{
    "html_file": "offer_2087_17.html",
    "name": "Philips B-line 346B1C, 34\"",
    "offer_link": "https://www.hiq24.de/shop/artikel/277084/?sPartner=geizhals",
    "price": 468.9,
    "raw_specifications": {
        "Abmessungen (Breite x Tiefe x H\u00f6he)": "80.7 cm x 25 cm x 60.1 cm - mit Fu\u00df",
        "Abmessungen (Breite x Tiefe x H\u00f6he) - mit Fu\u00df": "80.7 cm x 25 cm x 60.1 cm",
        "Ausgangsleistung/Kanal": "5 Watt",
        "Besonderheiten": "Bild f\u00fcr Bild, Sync-on-Green, Bleifrei, SmartImage, Low Blue Light Mode, flimmerfreie Technologie, BFR/PVC-frei, ohne Quecksilber, Adaptive-Sync-Technologie, EasyRead, sRGB Mode, Picture-in-Picture, Monitorkalibrierung Delta E<2",
        "Bildschirmbeschichtung": "Blendfrei, 2H Hard Coating, Haze 25 %",
        "Bildschirmtyp": "VA",
        "Details zu Abmessungen & Gewicht": "Mit Fu\u00df - Breite: 80.7 cm - Tiefe: 25 cm - H\u00f6he: 60.1 cm - Gewicht: 11.49 kg  Ohne Fu\u00df - Breite: 80.7 cm - Tiefe: 11 cm - H\u00f6he: 36.7 cm - Gewicht: 7.79 kg",
        "Diagonalabmessung": "86.36 cm (34\")",
        "Display-Typ": "LED-hintergrundbeleuchteter LCD-Monitor / TFT-Aktivmatrix",
        "ENERGY STAR zertifiziert": "Ja",
        "ENERGY STAR-Version": "7.0",
        "Ein-/Aus-Schalter": "Ja",
        "Eingangsanschl\u00fcsse": "HDMI, DisplayPort, USB-C",
        "Eingangsspannung": "Wechselstrom 120/230 V (50/60 Hz)",
        "Einstellungen der Anzeigeposition": "H\u00f6he, Drehung, Neigung",
        "Energie Effizienzklasse": "Klasse G",
        "Energieverbrauch pro Jahr": "79 kWh",
        "Enthaltene Kabel": "1 x HDMI-Kabel  1 x DisplayPort-Kabel  1 x USB-C auf USB-A Kabel",
        "Ethernet integriert": "Ja",
        "Farbe": "Black Texture",
        "Farbraum": "100% NTSC, 119% NTSC, 90% Adobe RGB",
        "Farbunterst\u00fctzung": "16,7 Millionen Farben",
        "Ger\u00e4tetyp": "LED-hintergrundbeleuchteter LCD-Monitor - 86.36 cm (34\")",
        "Geschwungener Bildschirm": "Ja",
        "Gewicht": "11.49 kg",
        "Helligkeit": "300 cd/m\u00b2",
        "Hintergrundbeleuchtungs-Technologie": "WLED",
        "Horizontale Bildwiederholrate": "30 - 160 kHz",
        "Horizontaler Betrachtungswinkel": "178",
        "H\u00f6heneinstellung": "180 mm",
        "Integrierte Peripherieger\u00e4te": "KVM-Switch, Gigabit Ethernet-Netzwerkadapter, USB 3.2 Gen 1 Hub",
        "Kennzeichnung": "Plug and Play, FCC Klasse B bescheinigt, SEMKO, DDC/CI, RoHS, ISO 9241-307, TUV Bauart, EPA, cETLus, CU-EAC, DisplayPort 1.2, HDCP 2.2",
        "Kontrast": "3000:1 / 80000000:1 (dynamisch)",
        "Leistungsaufnahme im Ein-Zustand": "35.1 W",
        "Leistungsmerkmale": "KVM-Switch, Gigabit Ethernet-Netzwerkadapter, USB 3.2 Gen 1 Hub, USB PD 90 Watt",
        "MTBF": "70,000 Stunde(n)",
        "Max. Betriebstemperatur": "40 \u00b0C",
        "Min Betriebstemperatur": "0 \u00b0C",
        "Mitgelieferte Software": "Philips SmartControl",
        "Native Aufl\u00f6sung": "UWQHD 3440 x 1440 bei 100 Hz",
        "Neigungswinkel": "-5/+30",
        "OSD-Sprachen": "Multilingual",
        "Pixelpitch": "0.232 mm",
        "Ppi": "110",
        "Produktbeschreibung": "Philips B Line 346B1C - LED-Monitor - gebogen - 86.36 cm (34\")",
        "Reaktionszeit": "5 ms (Gray-to-Gray)",
        "Schlosstyp zur Diebstahlsicherung": "Kensington Slot",
        "Schnittstellen": "DisplayPort (HDCP)  HDMI (HDCP)  USB-C (bis zu 90 W)  USB Upstream  USB 3.2 Downstream (Schnellladung)  3 x USB 3.2 Downstream  Kopfh\u00f6rer  Netzwerk (RJ-45)",
        "Schwenkwinkel": "360",
        "Seitenverh\u00e4ltnis": "21:9",
        "Spannung": "Wechselstrom 120/230 V (50/60 Hz)",
        "Stromverbrauch (Aus-Modus)": "0 Watt",
        "Stromverbrauch (typisch)": "46.8 Watt",
        "Stromverbrauch SDR (eingeschaltet)": "35 kWh/1.000 h",
        "Stromverbrauch im Standby-Modus": "0.3 Watt",
        "TCO-zertifiziert": "TCO Certified Displays 8",
        "Transportbreite": "93 cm",
        "Transportgewicht": "15.32 kg",
        "Transporth\u00f6he": "52.5 cm",
        "Transporttiefe": "28.2 cm",
        "Typ": "Lautsprecher - Stereo",
        "USB-Spannungsversorgung": "90 Watt",
        "Umweltschutzstandards": "TCO Certified Displays 8, ENERGY STAR-qualifiziert",
        "VESA-Halterung": "100 x 100 mm",
        "Vertikale Bildwiederholrate": "48 - 100 Hz",
        "Vertikaler Betrachtungswinkel": "178",
        "Zul\u00e4ssige Luftfeuchtigkeit im Betrieb": "20 - 80%"
    },
    "raw_specifications_text": "Display-Typ: LED-hintergrundbeleuchteter LCD-Monitor / TFT-Aktivmatrix\nEnergie Effizienzklasse: Klasse G\nEnergieverbrauch pro Jahr: 79 kWh\nDiagonalabmessung: 86.36 cm (34\")\nGeschwungener Bildschirm: Ja\nIntegrierte Peripherieger\u00e4te: KVM-Switch, Gigabit Ethernet-Netzwerkadapter, USB 3.2 Gen 1 Hub\nUSB-Spannungsversorgung: 90 Watt\nBildschirmtyp: VA\nSeitenverh\u00e4ltnis: 21:9\nNative Aufl\u00f6sung: UWQHD 3440 x 1440 bei 100 Hz\nPixelpitch: 0.232 mm\nPpi: 110\nHelligkeit: 300 cd/m\u00b2\nKontrast: 3000:1 / 80000000:1 (dynamisch)\nFarbunterst\u00fctzung: 16,7 Millionen Farben\nFarbraum: 100% NTSC, 119% NTSC, 90% Adobe RGB\nReaktionszeit: 5 ms (Gray-to-Gray)\nVertikale Bildwiederholrate: 48 - 100 Hz\nHorizontale Bildwiederholrate: 30 - 160 kHz\nHorizontaler Betrachtungswinkel: 178\nVertikaler Betrachtungswinkel: 178\nBildschirmbeschichtung: Blendfrei, 2H Hard Coating, Haze 25 %\nHintergrundbeleuchtungs-Technologie: WLED\nOSD-Sprachen: Multilingual\nBesonderheiten: Bild f\u00fcr Bild, Sync-on-Green, Bleifrei, SmartImage, Low Blue Light Mode, flimmerfreie Technologie, BFR/PVC-frei, ohne Quecksilber, Adaptive-Sync-Technologie, EasyRead, sRGB Mode, Picture-in-Picture, Monitorkalibrierung Delta E<2\nFarbe: Black Texture\nAbmessungen (Breite x Tiefe x H\u00f6he): 80.7 cm x 25 cm x 60.1 cm - mit Fu\u00df\nGewicht: 11.49 kg\nTyp: Lautsprecher - Stereo\nAusgangsleistung/Kanal: 5 Watt\nSchnittstellen: DisplayPort (HDCP)  HDMI (HDCP)  USB-C (bis zu 90 W)  USB Upstream  USB 3.2 Downstream (Schnellladung)  3 x USB 3.2 Downstream  Kopfh\u00f6rer  Netzwerk (RJ-45)\nEinstellungen der Anzeigeposition: H\u00f6he, Drehung, Neigung\nNeigungswinkel: -5/+30\nSchwenkwinkel: 360\nH\u00f6heneinstellung: 180 mm\nVESA-Halterung: 100 x 100 mm\nLeistungsmerkmale: KVM-Switch, Gigabit Ethernet-Netzwerkadapter, USB 3.2 Gen 1 Hub, USB PD 90 Watt\nEnthaltene Kabel: 1 x HDMI-Kabel  1 x DisplayPort-Kabel  1 x USB-C auf USB-A Kabel\nMTBF: 70,000 Stunde(n)\nKennzeichnung: Plug and Play, FCC Klasse B bescheinigt, SEMKO, DDC/CI, RoHS, ISO 9241-307, TUV Bauart, EPA, cETLus, CU-EAC, DisplayPort 1.2, HDCP 2.2\nSchlosstyp zur Diebstahlsicherung: Kensington Slot\nEingangsspannung: Wechselstrom 120/230 V (50/60 Hz)\nLeistungsaufnahme im Ein-Zustand: 35.1 W\nStromverbrauch SDR (eingeschaltet): 35 kWh/1.000 h\nStromverbrauch (typisch): 46.8 Watt\nStromverbrauch im Standby-Modus: 0.3 Watt\nStromverbrauch (Aus-Modus): 0 Watt\nEin-/Aus-Schalter: Ja\nMitgelieferte Software: Philips SmartControl\nDetails zu Abmessungen & Gewicht: Mit Fu\u00df - Breite: 80.7 cm - Tiefe: 25 cm - H\u00f6he: 60.1 cm - Gewicht: 11.49 kg  Ohne Fu\u00df - Breite: 80.7 cm - Tiefe: 11 cm - H\u00f6he: 36.7 cm - Gewicht: 7.79 kg\nTransportbreite: 93 cm\nTransporttiefe: 28.2 cm\nTransporth\u00f6he: 52.5 cm\nTransportgewicht: 15.32 kg\nTCO-zertifiziert: TCO Certified Displays 8\nENERGY STAR zertifiziert: Ja\nENERGY STAR-Version: 7.0\nMin Betriebstemperatur: 0 \u00b0C\nMax. Betriebstemperatur: 40 \u00b0C\nZul\u00e4ssige Luftfeuchtigkeit im Betrieb: 20 - 80%\nProduktbeschreibung: Philips B Line 346B1C - LED-Monitor - gebogen - 86.36 cm (34\")\nGer\u00e4tetyp: LED-hintergrundbeleuchteter LCD-Monitor - 86.36 cm (34\")\nEingangsanschl\u00fcsse: HDMI, DisplayPort, USB-C\nEthernet integriert: Ja\nSpannung: Wechselstrom 120/230 V (50/60 Hz)\nAbmessungen (Breite x Tiefe x H\u00f6he) - mit Fu\u00df: 80.7 cm x 25 cm x 60.1 cm\nUmweltschutzstandards: TCO Certified Displays 8, ENERGY STAR-qualifiziert",
    "reference_file": "offer_reference_2087.json",
    "shop_name": "HiQ24"
}