{
    "html_file": "offer_181_18.html",
    "name": "ASUS ROG Swift PG38UQ, 38\"",
    "offer_link": "https://www.proshop.at/Bildschirm/ASUS-38-Bildschirm-ROG-Swift-PG38UQ-3840x2160-144Hz-Fast-IPS-HDR600-Black-1-ms-AMD-FreeSync-2/3189317?utm_source=geizhals&utm_medium=cpc&utm_campaign=pricesite",
    "price": 1563.2,
    "raw_specifications": {
        "Abmessungen (Breite x Tiefe x H\u00f6he)": "86.1 cm x 25.54 cm x 58.39 cm - mit Fu\u00df",
        "Abmessungen (Breite x Tiefe x H\u00f6he) - mit Fu\u00df": "86.1 cm x 25.54 cm x 58.39 cm",
        "Adaptive-Sync Technologie": "AMD FreeSync Premium Pro, NVIDIA G-SYNC Compatible",
        "Ausgangsleistung/Kanal": "5 Watt",
        "Besonderheiten": "Bild f\u00fcr Bild, HDCP, Trace Free Technology, ASUS GamePlus, flimmerfreie Technologie, Adaptive-Sync-Technologie, ASUS GameVisual Technology, ASUS Extreme Low Motion Blur technology, Ultra Low Blue Light technology, Picture-in-Picture, Low Blue Light-Technologie, Shadow Boost-Technologie, ELMB SYNC, Display Widget, Delta E\u22642-Farbgenauigkeit, Variable Refresh Rate (VRR)",
        "Bildschirmbeschichtung": "Blendfrei",
        "Bildschirmtyp": "Fast IPS",
        "Details zu Abmessungen & Gewicht": "Ohne Fu\u00df - Breite: 86.1 cm - Tiefe: 4.78 cm - H\u00f6he: 52.22 cm - Gewicht: 9.04 kg",
        "Diagonalabmessung": "96.5 cm (38\")",
        "Display-Typ": "LED-hintergrundbeleuchteter LCD-Monitor / TFT-Aktivmatrix",
        "EAN": "4711387043455",
        "Eingangsanschl\u00fcsse": "2xHDMI, DisplayPort",
        "Eingangsspannung": "Wechselstrom 100-240 V (50/60 Hz)",
        "Einstellungen der Anzeigeposition": "Neigung",
        "Energie Effizienzklasse": "Klasse G",
        "Energieklasse (HDR)": "Klasse G",
        "Farbraum": "98% DCI-P3",
        "Farbunterst\u00fctzung": "16,7 Millionen Farben",
        "Gaming": "Ja",
        "Ger\u00e4tetyp": "LED-hintergrundbeleuchteter LCD-Monitor - 96.5 cm (38\")",
        "Gewicht": "10.23 kg",
        "HDR-Zertifizierung": "DisplayHDR 600",
        "HDR-f\u00e4hig": "DisplayHDR 600",
        "Helligkeit": "350 cd/m\u00b2",
        "Hersteller": "ASUS",
        "Horizontale Bildwiederholrate": "30 - 350 kHz",
        "Horizontaler Betrachtungswinkel": "178",
        "Integrierte Peripherieger\u00e4te": "USB 3.0-Hub",
        "Kennzeichnung": "TUV Rheinland Low Blue Light Certification, TUV Rheinland Flicker Free Certification",
        "Kontrast": "1000:1",
        "Leistungsmerkmale": "Slot f\u00fcr Sicherheitsschloss (Kabelschloss getrennt erh\u00e4ltlich)",
        "Modell": "90LM08M0-B01170",
        "Native Aufl\u00f6sung": "4K 3840 x 2160 bei 144 Hz",
        "Neigungswinkel": "-5/+5",
        "Pixelpitch": "0.219 mm",
        "Produktbeschreibung": "ASUS ROG Swift PG38UQ - LED-Monitor - 4K - 96.5 cm (38\") - HDR",
        "Reaktionszeit": "1 ms (Gray-to-Gray)",
        "Schlosstyp zur Diebstahlsicherung": "Kensington Slot",
        "Schnittstellen": "DisplayPort  USB 3.0 Upstream  4 x USB 3.0 Downstream  HDMI  Kopfh\u00f6rer",
        "Seitenverh\u00e4ltnis": "16:9",
        "Spannung": "Wechselstrom 100-240 V (50/60 Hz)",
        "Stromverbrauch (Aus-Modus)": "0.3 Watt",
        "Stromverbrauch (typisch)": "50 Watt",
        "Stromverbrauch HDR (eingeschaltet)": "85 kWh/1.000 h",
        "Stromverbrauch SDR (eingeschaltet)": "48 kWh/1.000 h",
        "Stromverbrauch im Standby-Modus": "0.5 Watt",
        "Typ": "Lautsprecher - Stereo",
        "VESA-Halterung": "100 x 100 mm",
        "Vertikale Bildwiederholrate": "48 - 144 Hz",
        "Vertikaler Betrachtungswinkel": "178",
        "Waren-Nr.": "3189317",
        "Zum Hersteller": "www.asus.com/"
    },
    "raw_specifications_text": "Hersteller: ASUS\nWaren-Nr.: 3189317\nModell: 90LM08M0-B01170\nEAN: 4711387043455\nZum Hersteller: www.asus.com/\nProduktbeschreibung: ASUS ROG Swift PG38UQ - LED-Monitor - 4K - 96.5 cm (38\") - HDR\nGer\u00e4tetyp: LED-hintergrundbeleuchteter LCD-Monitor - 96.5 cm (38\")\nEnergie Effizienzklasse: Klasse G\nAdaptive-Sync Technologie: AMD FreeSync Premium Pro, NVIDIA G-SYNC Compatible\nLeistungsmerkmale: Slot f\u00fcr Sicherheitsschloss (Kabelschloss getrennt erh\u00e4ltlich)\nBildschirmtyp: Fast IPS\nSeitenverh\u00e4ltnis: 16:9\nNative Aufl\u00f6sung: 4K 3840 x 2160 bei 144 Hz\nPixelpitch: 0.219 mm\nHelligkeit: 350 cd/m\u00b2\nKontrast: 1000:1\nHDR-f\u00e4hig: DisplayHDR 600\nReaktionszeit: 1 ms (Gray-to-Gray)\nGaming: Ja\nFarbunterst\u00fctzung: 16,7 Millionen Farben\nFarbraum: 98% DCI-P3\nEingangsanschl\u00fcsse: 2xHDMI, DisplayPort\nEinstellungen der Anzeigeposition: Neigung\nBildschirmbeschichtung: Blendfrei\nSpannung: Wechselstrom 100-240 V (50/60 Hz)\nAbmessungen (Breite x Tiefe x H\u00f6he) - mit Fu\u00df: 86.1 cm x 25.54 cm x 58.39 cm\nGewicht: 10.23 kg\nKennzeichnung: TUV Rheinland Low Blue Light Certification, TUV Rheinland Flicker Free Certification\nDisplay-Typ: LED-hintergrundbeleuchteter LCD-Monitor / TFT-Aktivmatrix\nEnergieklasse (HDR): Klasse G\nDiagonalabmessung: 96.5 cm (38\")\nIntegrierte Peripherieger\u00e4te: USB 3.0-Hub\nHDR-Zertifizierung: DisplayHDR 600\nVertikale Bildwiederholrate: 48 - 144 Hz\nHorizontale Bildwiederholrate: 30 - 350 kHz\nHorizontaler Betrachtungswinkel: 178\nVertikaler Betrachtungswinkel: 178\nBesonderheiten: Bild f\u00fcr Bild, HDCP, Trace Free Technology, ASUS GamePlus, flimmerfreie Technologie, Adaptive-Sync-Technologie, ASUS GameVisual Technology, ASUS Extreme Low Motion Blur technology, Ultra Low Blue Light technology, Picture-in-Picture, Low Blue Light-Technologie, Shadow Boost-Technologie, ELMB SYNC, Display Widget, Delta E\u22642-Farbgenauigkeit, Variable Refresh Rate (VRR)\nAbmessungen (Breite x Tiefe x H\u00f6he): 86.1 cm x 25.54 cm x 58.39 cm - mit Fu\u00df\nTyp: Lautsprecher - Stereo\nAusgangsleistung/Kanal: 5 Watt\nSchnittstellen: DisplayPort  USB 3.0 Upstream  4 x USB 3.0 Downstream  HDMI  Kopfh\u00f6rer\nNeigungswinkel: -5/+5\nVESA-Halterung: 100 x 100 mm\nSchlosstyp zur Diebstahlsicherung: Kensington Slot\nEingangsspannung: Wechselstrom 100-240 V (50/60 Hz)\nStromverbrauch SDR (eingeschaltet): 48 kWh/1.000 h\nStromverbrauch HDR (eingeschaltet): 85 kWh/1.000 h\nStromverbrauch (typisch): 50 Watt\nStromverbrauch im Standby-Modus: 0.5 Watt\nStromverbrauch (Aus-Modus): 0.3 Watt\nDetails zu Abmessungen & Gewicht: Ohne Fu\u00df - Breite: 86.1 cm - Tiefe: 4.78 cm - H\u00f6he: 52.22 cm - Gewicht: 9.04 kg",
    "reference_file": "offer_reference_181.json",
    "shop_name": "Proshop.at"
}