{
    "html_file": "offer_270_42.html",
    "name": "HP E27u G5, 27\"",
    "offer_link": "https://www.alternate.at/HP/E27u-G5-LED-Monitor/html/product/1904965?partner=AtGeizhalsat&campaign=Monitor/HP/1904965",
    "price": 403.0,
    "raw_specifications": {
        "": "Netzteil",
        "Abmessungen": "Breite: 61,34 cm x H\u00f6he: 54,47 cm x Tiefe/L\u00e4nge: 16 cm",
        "Anschl\u00fcsse": "1x HDMI-Eingang, (HDMI-Version: 1.4), 1x DisplayPort-Eingang, 1x DisplayPort-Ausgang, (DisplayPort-Version: 1.2), 3x USB-A-3.2 Gen 1 (5 Gbit/s), 2x USB-C 3.2 Gen 1 (5 Gbit/s), 1x RJ 45",
        "Bild": "Glaretyp",
        "Bildschirmaufl\u00f6sung": "2.560 x 1.440 Pixel",
        "Bildschirmdiagonale": "68,6 cm (27 Zoll)",
        "EAN": "0196786295973",
        "Energieeffizienzklasse (SDR)": "F (A - G)",
        "Energieverbauch pro 1000 Stunden (SDR)": "23 kWh",
        "Ergonomie": "Typ",
        "Farbe": "schwarz/silber",
        "Features": "Kensington-Schloss",
        "Frequenz": "Vertikal",
        "Geeignet f\u00fcr": "Business",
        "Gewicht": "7,2 kg",
        "Hersteller-Nr.": "6N4D3AA#ABB",
        "Leistungsaufnahme im Bereitschafts- und Aus-Zustand": "0,3 Watt",
        "Leistungsaufnahme im Ein-Zustand bei Standard-Dynamikumfang (SDR)": "22,7 Watt",
        "Standards": "Video",
        "Stromversorgung": "Eco-Off",
        "Typ": "LED-Monitor",
        "Wandhalterung": "VESA kompatibel (100 x 100 mm)",
        "Weitere Informationen": "ein USB-C-Anschluss unterst\u00fctzt Alt Mode mit DisplayPort 1.2 und Power Delivery mit bis zu 65 Watt | der zweite USB-Anschluss unterst\u00fctzt Power Delivery mit bis zu 15 Watt | ein USB-A-Anschluss hat eine Ladefunktion | flimmerfreies Display, Low Blue Light",
        "Zubeh\u00f6r": "Vorhanden"
    },
    "raw_specifications_text": "Energieeffizienzklasse (SDR): F (A - G)\nEnergieverbauch pro 1000 Stunden (SDR): 23 kWh\nLeistungsaufnahme im Ein-Zustand bei Standard-Dynamikumfang (SDR): 22,7 Watt\nLeistungsaufnahme im Bereitschafts- und Aus-Zustand: 0,3 Watt\nBildschirmdiagonale: 68,6 cm (27 Zoll)\nBildschirmaufl\u00f6sung: 2.560 x 1.440 Pixel\nTyp: LED-Monitor\nFarbe: schwarz/silber\nEAN: 0196786295973\nHersteller-Nr.: 6N4D3AA#ABB\nGeeignet f\u00fcr: Business\nBild: Glaretyp\n: Netzteil\nFrequenz: Vertikal\nAnschl\u00fcsse: 1x HDMI-Eingang, (HDMI-Version: 1.4), 1x DisplayPort-Eingang, 1x DisplayPort-Ausgang, (DisplayPort-Version: 1.2), 3x USB-A-3.2 Gen 1 (5 Gbit/s), 2x USB-C 3.2 Gen 1 (5 Gbit/s), 1x RJ 45\nErgonomie: Typ\nStromversorgung: Eco-Off\nStandards: Video\nWandhalterung: VESA kompatibel (100 x 100 mm)\nFeatures: Kensington-Schloss\nWeitere Informationen: ein USB-C-Anschluss unterst\u00fctzt Alt Mode mit DisplayPort 1.2 und Power Delivery mit bis zu 65 Watt | der zweite USB-Anschluss unterst\u00fctzt Power Delivery mit bis zu 15 Watt | ein USB-A-Anschluss hat eine Ladefunktion | flimmerfreies Display, Low Blue Light\nZubeh\u00f6r: Vorhanden\nAbmessungen: Breite: 61,34 cm x H\u00f6he: 54,47 cm x Tiefe/L\u00e4nge: 16 cm\nGewicht: 7,2 kg",
    "reference_file": "offer_reference_270.json",
    "shop_name": "Alternate.at"
}