{
    "html_file": "offer_1237_1.html",
    "name": "HP M32f, 31.5\"",
    "offer_link": "https://www.amazon.de/dp/B09DCHS9WY?linkCode=xm2&camp=2025&creative=165953&smid=A3JWKAKR8XB7XF&creativeASIN=B09DCHS9WY&tag=geizhals1-21",
    "price": 190.59,
    "raw_specifications": {
        "ASIN": "B09DCHS9WY",
        "Amazon Bestseller-Rang": "Nr. 7,108 in Computer & Zubeh\u00f6r (Siehe Top 100 in Computer & Zubeh\u00f6r)  Nr. 157 in Monitore",
        "Anzahl HDMI Schnittstellen": "\u200e3",
        "Anzahl USB 3.0 Schnittstellen": "\u200e3",
        "Artikelgewicht": "\u200e5,1 Kilograms",
        "Batterien enthalten": "\u200eNein",
        "Display-Gr\u00f6\u00dfe": "\u200e31,5 Zoll",
        "Durchschnittliche Kundenbewertung": "4,5  4,5 von 5 Sternen    \n    526 Sternebewertungen   \n\n\n 4,5 von 5 Sternen",
        "Farbe": "\u200eBlack",
        "Garantierte Software-Updates bis": "\u200eunbekannt",
        "Hersteller": "\u200ehp",
        "Im Angebot von Amazon.de seit": "23. August 2021",
        "L\u00f6sung": "\u200eFHD",
        "Marke": "\u200eHP",
        "Modell/Serie": "\u200eHP M32f 80 cm (31.5\") 1920 x 1080 pixels Full HD Black, Silver",
        "Modellnummer": "\u200e2H5M7E9#ABB",
        "Produktabmessungen": "\u200e10 x 48 x 50 cm; 5,1 Kilogramm",
        "Volt": "\u200e220"
    },
    "raw_specifications_text": "Marke: \u200eHP\nHersteller: \u200ehp\nModell/Serie: \u200eHP M32f 80 cm (31.5\") 1920 x 1080 pixels Full HD Black, Silver\nProduktabmessungen: \u200e10 x 48 x 50 cm; 5,1 Kilogramm\nModellnummer: \u200e2H5M7E9#ABB\nFarbe: \u200eBlack\nDisplay-Gr\u00f6\u00dfe: \u200e31,5 Zoll\nL\u00f6sung: \u200eFHD\nAnzahl USB 3.0 Schnittstellen: \u200e3\nAnzahl HDMI Schnittstellen: \u200e3\nVolt: \u200e220\nBatterien enthalten: \u200eNein\nArtikelgewicht: \u200e5,1 Kilograms\nGarantierte Software-Updates bis: \u200eunbekannt\nASIN: B09DCHS9WY\nDurchschnittliche Kundenbewertung: 4,5  4,5 von 5 Sternen    \n    526 Sternebewertungen   \n\n\n 4,5 von 5 Sternen\nAmazon Bestseller-Rang: Nr. 7,108 in Computer & Zubeh\u00f6r (Siehe Top 100 in Computer & Zubeh\u00f6r)  Nr. 157 in Monitore\nIm Angebot von Amazon.de seit: 23. August 2021",
    "reference_file": "offer_reference_1237.json",
    "shop_name": "Amazon.at"
}