{
    "html_file": "offer_1786_0.html",
    "name": "iiyama G-Master G2466HSU-B1 Red Eagle, 23.6\"",
    "offer_link": "https://www.mylemon.at/artikel/iiyama/g2466hsu_b1/iiya-24-l-g-master.html",
    "price": 183.91,
    "raw_specifications": {
        "AC Eingangsfrequenz": "50 - 60 Hz",
        "AC Eingangsspannung": "100 - 240 V",
        "AMD FreeSync": "Ja",
        "Anzahl DisplayPort Anschl\u00fcsse": "1",
        "Anzahl HDMI-Anschl\u00fcsse": "2",
        "Anzahl der Farben des Displays": "16,7 Millionen Farben",
        "Anzahl der Lautsprecher": "2",
        "Anzahl der nachgeschalteten Steckpl\u00e4tze vom Typ USB-A": "2",
        "Artikelnummer": "M14Y1BJL",
        "Aufl\u00f6sung": "1920x1080",
        "Besonderheiten": "165 Hz, AMD FreeSync, Curved",
        "Bildschirmdiagonale": "59,9 cm (23.6 Zoll)",
        "Bildschirmform": "Gebogen",
        "Bildschirmtechnologie": "LED",
        "Bildwinkel, horizontal": "178\u00b0",
        "Bildwinkel, vertikal": "178\u00b0",
        "Display-Aufl\u00f6sung": "1920 x 1080 Pixel",
        "DisplayPorts-Version": "1.4",
        "Displaygr\u00f6\u00dfe": "23,6 Zoll",
        "EAN": "4948570117703",
        "Eingebaute Lautsprecher": "Ja",
        "Energieeffizienzklasse (HDR)": "G",
        "Energieeffizienzklasse (SDR)": "F",
        "Energieeffizienzklasse (alt)": "A",
        "Energieeffizienzskala": "A bis G",
        "Energieverbrauch (HDR) pro 1.000 Stunden": "28 kWh",
        "Energieverbrauch (SDR) pro 1.000 Stunden": "22 kWh",
        "Ergonomie": "Neigbar",
        "Flimmerfreie Technologie": "Ja",
        "Ger\u00e4tebreite (inkl. Fu\u00df)": "535,5 mm",
        "Ger\u00e4teh\u00f6he (inkl. Fu\u00df)": "394,5 mm",
        "Ger\u00e4tetiefe (inkl. Fu\u00df)": "202 mm",
        "Gewicht (mit St\u00e4nder)": "3,7 kg",
        "HD-Typ": "Full HD",
        "HDCP": "Ja",
        "HDMI": "Ja",
        "HDMI-Version": "2.0",
        "Helligkeit": "250 cd/m\u00b2",
        "Helligkeit (typisch)": "250 cd/m\u00b2",
        "Hersteller Artikelnummer": "G2466HSU-B1",
        "Integrierte Kamera": "Nein",
        "Integrierter USB-Hub": "Ja",
        "J\u00e4hrlicher Energieverbrauch": "31 kWh",
        "Kabelsperre-Slot": "Ja",
        "Kontrastverh\u00e4ltnis": "3000:1",
        "Kontrastverh\u00e4ltnis (dynamisch)": "80000000:1",
        "Kopfh\u00f6rerausgang": "Ja",
        "Kopfh\u00f6rerausg\u00e4nge": "1",
        "LED-Anzeigen": "Ja",
        "Low-Blue-Light-Technologie": "Ja",
        "Marktpositionierung": "Gaming",
        "Maximale Bildwiederholrate": "165 Hz",
        "Men\u00fcsprachen": "Deutsch, Niederl\u00e4ndisch, Englisch, Spanisch, Franz\u00f6sisch, Italienisch, Japanisch, Polnisch",
        "Mitgelieferte Kabel": "AC, DisplayPort, USB",
        "Nachhaltigkeitszertifikate": "RoHS",
        "Natives Seitenverh\u00e4ltnis": "16:9",
        "Neigungsverstellung": "Ja",
        "Neigungswinkelbereich": "22 - 5\u00b0",
        "On-Screen-Display (OSD)": "Ja",
        "Paketgewicht": "4,8 kg",
        "Panel": "VA",
        "Panel-Montage-Schnittstelle": "100 x 100 mm",
        "Panel-Typ": "VA",
        "Pixel Abstand": "0,271 x 0,271 mm",
        "Plug & Play": "Ja",
        "Produktfarbe": "Schwarz",
        "RMS-Leistung": "4 W",
        "Reaktionszeit": "1 ms",
        "Slot-Typ Kabelsperre": "Kensington",
        "Stromverbrauch (Standardbetrieb)": "65 W",
        "Stromverbrauch (Standby)": "0,5 W",
        "Stromverbrauch (aus)": "0,3 W",
        "St\u00e4nder enthalten": "Ja",
        "Touchscreen": "Nein",
        "USB-Hub-Version": "2.0",
        "Unterst\u00fctzte Grafik-Aufl\u00f6sungen": "1920 x 1080 (HD 1080)",
        "VESA Halterung": "100x100 mm",
        "VESA-Halterung": "Ja",
        "Verpackungsart": "Box",
        "Verpackungsbreite": "612 mm",
        "Verpackungsh\u00f6he": "408 mm",
        "Verpackungstiefe": "190 mm",
        "Video Anschl\u00fcsse": "2x HDMI, 1x DisplayPort",
        "Warentarifnummer (HS)": "85285210",
        "Zertifizierung": "CE, T\u00dcV-Bauart, EAC,WEEE"
    },
    "raw_specifications_text": "Displaygr\u00f6\u00dfe: 23,6 Zoll\nAufl\u00f6sung: 1920x1080\nPanel: VA\nReaktionszeit: 1 ms\nVideo Anschl\u00fcsse: 2x HDMI, 1x DisplayPort\nErgonomie: Neigbar\nVESA Halterung: 100x100 mm\nHelligkeit: 250 cd/m\u00b2\nBesonderheiten: 165 Hz, AMD FreeSync, Curved\nHersteller Artikelnummer: G2466HSU-B1\nEAN: 4948570117703\nArtikelnummer: M14Y1BJL\nBildschirmdiagonale: 59,9 cm (23.6 Zoll)\nDisplay-Aufl\u00f6sung: 1920 x 1080 Pixel\nNatives Seitenverh\u00e4ltnis: 16:9\nBildschirmtechnologie: LED\nTouchscreen: Nein\nHD-Typ: Full HD\nPanel-Typ: VA\nBildschirmform: Gebogen\nKontrastverh\u00e4ltnis: 3000:1\nMaximale Bildwiederholrate: 165 Hz\nAnzahl der Farben des Displays: 16,7 Millionen Farben\nHelligkeit (typisch): 250 cd/m\u00b2\nUnterst\u00fctzte Grafik-Aufl\u00f6sungen: 1920 x 1080 (HD 1080)\nKontrastverh\u00e4ltnis (dynamisch): 80000000:1\nBildwinkel, horizontal: 178\u00b0\nBildwinkel, vertikal: 178\u00b0\nPixel Abstand: 0,271 x 0,271 mm\nAMD FreeSync: Ja\nFlimmerfreie Technologie: Ja\nLow-Blue-Light-Technologie: Ja\nEingebaute Lautsprecher: Ja\nIntegrierte Kamera: Nein\nAnzahl der Lautsprecher: 2\nRMS-Leistung: 4 W\nMarktpositionierung: Gaming\nProduktfarbe: Schwarz\nZertifizierung: CE, T\u00dcV-Bauart, EAC,WEEE\nIntegrierter USB-Hub: Ja\nHDMI: Ja\nKopfh\u00f6rerausgang: Ja\nUSB-Hub-Version: 2.0\nAnzahl der nachgeschalteten Steckpl\u00e4tze vom Typ USB-A: 2\nAnzahl HDMI-Anschl\u00fcsse: 2\nHDMI-Version: 2.0\nAnzahl DisplayPort Anschl\u00fcsse: 1\nDisplayPorts-Version: 1.4\nKopfh\u00f6rerausg\u00e4nge: 1\nHDCP: Ja\nVESA-Halterung: Ja\nKabelsperre-Slot: Ja\nPanel-Montage-Schnittstelle: 100 x 100 mm\nSlot-Typ Kabelsperre: Kensington\nNeigungswinkelbereich: 22 - 5\u00b0\nOn-Screen-Display (OSD): Ja\nMen\u00fcsprachen: Deutsch, Niederl\u00e4ndisch, Englisch, Spanisch, Franz\u00f6sisch, Italienisch, Japanisch, Polnisch\nPlug & Play: Ja\nLED-Anzeigen: Ja\nNeigungsverstellung: Ja\nEnergieeffizienzklasse (SDR): F\nEnergieeffizienzklasse (HDR): G\nEnergieverbrauch (SDR) pro 1.000 Stunden: 22 kWh\nEnergieverbrauch (HDR) pro 1.000 Stunden: 28 kWh\nStromverbrauch (Standardbetrieb): 65 W\nStromverbrauch (Standby): 0,5 W\nStromverbrauch (aus): 0,3 W\nAC Eingangsspannung: 100 - 240 V\nAC Eingangsfrequenz: 50 - 60 Hz\nEnergieeffizienzskala: A bis G\nJ\u00e4hrlicher Energieverbrauch: 31 kWh\nSt\u00e4nder enthalten: Ja\nMitgelieferte Kabel: AC, DisplayPort, USB\nGer\u00e4tebreite (inkl. Fu\u00df): 535,5 mm\nGer\u00e4tetiefe (inkl. Fu\u00df): 202 mm\nGer\u00e4teh\u00f6he (inkl. Fu\u00df): 394,5 mm\nGewicht (mit St\u00e4nder): 3,7 kg\nVerpackungsbreite: 612 mm\nVerpackungstiefe: 190 mm\nVerpackungsh\u00f6he: 408 mm\nPaketgewicht: 4,8 kg\nVerpackungsart: Box\nNachhaltigkeitszertifikate: RoHS\nWarentarifnummer (HS): 85285210\nEnergieeffizienzklasse (alt): A",
    "reference_file": "offer_reference_1786.json",
    "shop_name": "mylemon.at"
}