{
    "html_file": "offer_464_7.html",
    "name": "Lenovo D27-40, 27\"",
    "offer_link": "https://www.alternate.at/Lenovo/D27-40-LED-Monitor/html/product/1919820?partner=AtGeizhalsat&campaign=Monitor/Lenovo/1919820",
    "price": 141.9,
    "raw_specifications": {
        "": "Kontrast",
        "Abmessungen": "Breite: 61,41 cm x H\u00f6he: 45,44 cm x Tiefe/L\u00e4nge: 20,95 cm",
        "Anschl\u00fcsse": "1x HDMI-Eingang, (HDMI-Version: 1.4), 1x VGA-Eingang",
        "Bild": "Glaretyp",
        "Bildschirmaufl\u00f6sung": "1.920 x 1.080 Pixel",
        "Bildschirmdiagonale": "68,6 cm (27 Zoll)",
        "EAN": "0196802375603",
        "Energieeffizienzklasse (SDR)": "E (A - G)",
        "Energieverbauch pro 1000 Stunden (SDR)": "20 kWh",
        "Ergonomie": "Typ",
        "Farbe": "schwarz",
        "Features": "AMD FreeSync",
        "Geeignet f\u00fcr": "Business",
        "Gewicht": "4,8 kg",
        "Hersteller-Nr.": "67A3KAC6EU",
        "Leistungsaufnahme im Bereitschafts- und Aus-Zustand": "0,2 Watt",
        "Leistungsaufnahme im Ein-Zustand bei Standard-Dynamikumfang (SDR)": "20 Watt",
        "Standards": "Video",
        "Stromversorgung": "Netzteil",
        "Typ": "LED-Monitor",
        "Weitere Informationen": "Reaktionszeit: 4 ms (Level 4) / 5 ms (Level 3) / 6 ms (Level 2) / 7 ms (Level 1) / 19 ms (Off)"
    },
    "raw_specifications_text": "Energieeffizienzklasse (SDR): E (A - G)\nEnergieverbauch pro 1000 Stunden (SDR): 20 kWh\nLeistungsaufnahme im Ein-Zustand bei Standard-Dynamikumfang (SDR): 20 Watt\nLeistungsaufnahme im Bereitschafts- und Aus-Zustand: 0,2 Watt\nBildschirmdiagonale: 68,6 cm (27 Zoll)\nBildschirmaufl\u00f6sung: 1.920 x 1.080 Pixel\nTyp: LED-Monitor\nFarbe: schwarz\nEAN: 0196802375603\nHersteller-Nr.: 67A3KAC6EU\nGeeignet f\u00fcr: Business\nBild: Glaretyp\n: Kontrast\nAnschl\u00fcsse: 1x HDMI-Eingang, (HDMI-Version: 1.4), 1x VGA-Eingang\nErgonomie: Typ\nStromversorgung: Netzteil\nStandards: Video\nFeatures: AMD FreeSync\nWeitere Informationen: Reaktionszeit: 4 ms (Level 4) / 5 ms (Level 3) / 6 ms (Level 2) / 7 ms (Level 1) / 19 ms (Off)\nAbmessungen: Breite: 61,41 cm x H\u00f6he: 45,44 cm x Tiefe/L\u00e4nge: 20,95 cm\nGewicht: 4,8 kg",
    "reference_file": "offer_reference_464.json",
    "shop_name": "Alternate.at"
}