{
    "html_file": "offer_780_4.html",
    "name": "ASUS BE24ECSNK, 23.8\"",
    "offer_link": "https://syswork.at/sw/index.html?open&mid=Artikel&artid=mon-1540&from=geizhals.at",
    "price": 249.0,
    "raw_specifications": {
        "AMD FreeSync": "Nein",
        "Anzahl HDMI-Anschl\u00fcsse": "1",
        "Anzahl RJ-45-Anschl\u00fcsse": "1",
        "Anzahl der Farben des Displays": "16,7 Millionen Farben",
        "Anzahl der Lautsprecher": "2",
        "Anzahl der Upstream-Ports USB Typ-C": "1",
        "Anzahl der nachgeschalteten Steckpl\u00e4tze vom Typ USB-A": "4",
        "Anzahl der vorgeschalteten Steckpl\u00e4tze": "1",
        "Bildschirmdiagonale": "60,5 cm (23.8 Zoll)",
        "Bildschirmform": "Flach",
        "Bildwinkel, horizontal": "178\u00b0",
        "Bildwinkel, vertikal": "178\u00b0",
        "Breite (ohne Standfu\u00df)": "54 cm",
        "Datenblatt": "Kein Datenblatt verf\u00fcgbar",
        "Display-Aufl\u00f6sung": "1920 x 1080 Pixel",
        "Display-Oberfl\u00e4che": "Matt",
        "Dynamisches Kontrastverh\u00e4ltnis Marketingbezeichnung": "ASUS Smart Contrast Ratio (ASCR)",
        "Eingebaute Lautsprecher": "Ja",
        "Energieeffizienzklasse (SDR)": "E",
        "Energieeffizienzskala": "A bis G",
        "Energieverbrauch (SDR) pro 1.000 Stunden": "18 kWh",
        "Flimmerfreie Technologie": "Ja",
        "Ger\u00e4tebreite (inkl. Fu\u00df)": "539,7 mm",
        "Ger\u00e4teh\u00f6he (inkl. Fu\u00df)": "538,9 mm",
        "Ger\u00e4tetiefe (inkl. Fu\u00df)": "211,4 mm",
        "Gewicht (mit St\u00e4nder)": "6,5 kg",
        "Gewicht (ohne St\u00e4nder)": "4,3 kg",
        "HD-Typ": "Full HD",
        "HDCP": "Ja",
        "HDCP-Version": "1.4",
        "HDMI": "Ja",
        "HDMI-Version": "1.4",
        "Helligkeit (typisch)": "300 cd/m\u00b2",
        "Herstellerlink": "ASUS",
        "H\u00f6he (ohne Standfu\u00df)": "39 cm",
        "H\u00f6heneinstellung": "15 cm",
        "H\u00f6henverstellung": "Ja",
        "Integrierte Kamera": "Ja",
        "Integrierter USB-Hub": "Ja",
        "Kabelsperre-Slot": "Ja",
        "Kontrastverh\u00e4ltnis": "1000:1",
        "Kontrastverh\u00e4ltnis (dynamisch)": "100000000:1",
        "Kopfh\u00f6rerausgang": "Ja",
        "Kopfh\u00f6rerausg\u00e4nge": "1",
        "Low-Blue-Light-Technologie": "Ja",
        "Marktpositionierung": "Business",
        "Maximale Bildwiederholrate": "60 Hz",
        "Megapixel (ca.)": "2 MP",
        "NVIDIA G-SYNC": "Nein",
        "Nachhaltigkeitszertifikate": "TCO",
        "Natives Seitenverh\u00e4ltnis": "16:9",
        "Neigungsverstellung": "Ja",
        "Neigungswinkelbereich": "35 - -5\u00b0",
        "Paketgewicht": "8,9 kg",
        "Panel-Montage-Schnittstelle": "100 x 100 mm",
        "Panel-Typ": "IPS",
        "Pivot": "Ja",
        "Pivot Winkel": "90 - -90\u00b0",
        "Pixel Abstand": "0,2745 x 0,2745 mm",
        "Produktfarbe": "Schwarz",
        "Produktlink": "Link",
        "RMS-Leistung": "2 W",
        "Reaktionszeit": "5 ms",
        "Schwenkbar": "Ja",
        "Schwenkwinkelbereich": "180 - -180\u00b0",
        "Sichtbare Gr\u00f6\u00dfe (horizontal)": "52,7 cm",
        "Sichtbare Gr\u00f6\u00dfe (vertikal)": "29,6 cm",
        "Slot-Typ Kabelsperre": "Kensington",
        "Stromverbrauch (PowerSave)": "0,5 W",
        "Stromverbrauch (Standardbetrieb)": "17,7 W",
        "Stromverbrauch (aus)": "0,5 W",
        "St\u00e4nder enthalten": "Ja",
        "Tiefe (ohne Standfu\u00df)": "6,1 cm",
        "Touchscreen": "Nein",
        "Typ der Hintergrundbeleuchtung": "LED",
        "USB Power Delivery": "Ja",
        "USB-Hub-Version": "3.2 Gen 1 (3.1 Gen 1)",
        "USB-Stromversorgung bis zu": "80 W",
        "USB-Upstream-Porttyp": "USB Typ-C",
        "VESA-Halterung": "Ja",
        "Verpackungsart": "Box",
        "Verpackungsbreite": "722 mm",
        "Verpackungsh\u00f6he": "182 mm",
        "Verpackungstiefe": "481 mm"
    },
    "raw_specifications_text": "Bildschirmdiagonale: 60,5 cm (23.8 Zoll)\nDisplay-Aufl\u00f6sung: 1920 x 1080 Pixel\nNatives Seitenverh\u00e4ltnis: 16:9\nTouchscreen: Nein\nHD-Typ: Full HD\nPanel-Typ: IPS\nBildschirmform: Flach\nKontrastverh\u00e4ltnis: 1000:1\nMaximale Bildwiederholrate: 60 Hz\nAnzahl der Farben des Displays: 16,7 Millionen Farben\nTyp der Hintergrundbeleuchtung: LED\nHelligkeit (typisch): 300 cd/m\u00b2\nReaktionszeit: 5 ms\nDisplay-Oberfl\u00e4che: Matt\nKontrastverh\u00e4ltnis (dynamisch): 100000000:1\nDynamisches Kontrastverh\u00e4ltnis Marketingbezeichnung: ASUS Smart Contrast Ratio (ASCR)\nBildwinkel, horizontal: 178\u00b0\nBildwinkel, vertikal: 178\u00b0\nPixel Abstand: 0,2745 x 0,2745 mm\nSichtbare Gr\u00f6\u00dfe (horizontal): 52,7 cm\nSichtbare Gr\u00f6\u00dfe (vertikal): 29,6 cm\nNVIDIA G-SYNC: Nein\nAMD FreeSync: Nein\nFlimmerfreie Technologie: Ja\nLow-Blue-Light-Technologie: Ja\nEingebaute Lautsprecher: Ja\nIntegrierte Kamera: Ja\nAnzahl der Lautsprecher: 2\nRMS-Leistung: 2 W\nMegapixel (ca.): 2 MP\nMarktpositionierung: Business\nProduktfarbe: Schwarz\nIntegrierter USB-Hub: Ja\nHDMI: Ja\nKopfh\u00f6rerausgang: Ja\nUSB-Hub-Version: 3.2 Gen 1 (3.1 Gen 1)\nUSB-Upstream-Porttyp: USB Typ-C\nAnzahl der vorgeschalteten Steckpl\u00e4tze: 1\nAnzahl der Upstream-Ports USB Typ-C: 1\nAnzahl der nachgeschalteten Steckpl\u00e4tze vom Typ USB-A: 4\nUSB Power Delivery: Ja\nUSB-Stromversorgung bis zu: 80 W\nAnzahl HDMI-Anschl\u00fcsse: 1\nHDMI-Version: 1.4\nKopfh\u00f6rerausg\u00e4nge: 1\nHDCP: Ja\nHDCP-Version: 1.4\nVESA-Halterung: Ja\nKabelsperre-Slot: Ja\nH\u00f6henverstellung: Ja\nPanel-Montage-Schnittstelle: 100 x 100 mm\nSlot-Typ Kabelsperre: Kensington\nH\u00f6heneinstellung: 15 cm\nPivot: Ja\nPivot Winkel: 90 - -90\u00b0\nSchwenkbar: Ja\nSchwenkwinkelbereich: 180 - -180\u00b0\nNeigungswinkelbereich: 35 - -5\u00b0\nNeigungsverstellung: Ja\nEnergieeffizienzklasse (SDR): E\nEnergieverbrauch (SDR) pro 1.000 Stunden: 18 kWh\nStromverbrauch (Standardbetrieb): 17,7 W\nStromverbrauch (aus): 0,5 W\nStromverbrauch (PowerSave): 0,5 W\nEnergieeffizienzskala: A bis G\nSt\u00e4nder enthalten: Ja\nGer\u00e4tebreite (inkl. Fu\u00df): 539,7 mm\nGer\u00e4tetiefe (inkl. Fu\u00df): 211,4 mm\nGer\u00e4teh\u00f6he (inkl. Fu\u00df): 538,9 mm\nGewicht (mit St\u00e4nder): 6,5 kg\nBreite (ohne Standfu\u00df): 54 cm\nTiefe (ohne Standfu\u00df): 6,1 cm\nH\u00f6he (ohne Standfu\u00df): 39 cm\nGewicht (ohne St\u00e4nder): 4,3 kg\nVerpackungsbreite: 722 mm\nVerpackungstiefe: 481 mm\nVerpackungsh\u00f6he: 182 mm\nPaketgewicht: 8,9 kg\nVerpackungsart: Box\nNachhaltigkeitszertifikate: TCO\nAnzahl RJ-45-Anschl\u00fcsse: 1\nDatenblatt: Kein Datenblatt verf\u00fcgbar\nProduktlink: Link\nHerstellerlink: ASUS",
    "reference_file": "offer_reference_780.json",
    "shop_name": "Syswork"
}