{
    "html_file": "offer_759_7.html",
    "name": "Philips 5000 27E1N5500LA, 27\"",
    "offer_link": "https://www.amazon.de/dp/B0BGJ84G29?linkCode=xm2&camp=2025&creative=165953&smid=A3JWKAKR8XB7XF&creativeASIN=B0BGJ84G29&tag=geizhals1-21",
    "price": 208.12,
    "raw_specifications": {
        "ASIN": "B0BGJ84G29",
        "Amazon Bestseller-Rang": "Nr. 72,627 in Computer & Zubeh\u00f6r (Siehe Top 100 in Computer & Zubeh\u00f6r)  Nr. 1,372 in Monitore",
        "Anzahl HDMI Schnittstellen": "\u200e2",
        "Artikelgewicht": "\u200e4,34 Kilograms",
        "Batterien enthalten": "\u200eNein",
        "Bildschirmaufl\u00f6sung": "\u200e840 x 2160",
        "Display-Gr\u00f6\u00dfe": "\u200e27 Zoll",
        "Durchschnittliche Kundenbewertung": "4,3  4,3 von 5 Sternen    \n    5 Sternebewertungen   \n\n\n 4,3 von 5 Sternen",
        "Farbe": "\u200eschwarz",
        "Garantierte Software-Updates bis": "\u200eunbekannt",
        "Hersteller": "\u200ePhilips",
        "Im Angebot von Amazon.de seit": "26. September 2022",
        "L\u00f6sung": "\u200e2560 x 1440 Pixels",
        "Marke": "\u200ePhilips",
        "Modellnummer": "\u200e27E1N5500LA/00",
        "Produktabmessungen": "\u200e14,1 x 69 x 45,3 cm; 4,34 Kilogramm",
        "Prozessortyp": "\u200eOthers"
    },
    "raw_specifications_text": "Marke: \u200ePhilips\nHersteller: \u200ePhilips\nProduktabmessungen: \u200e14,1 x 69 x 45,3 cm; 4,34 Kilogramm\nModellnummer: \u200e27E1N5500LA/00\nFarbe: \u200eschwarz\nDisplay-Gr\u00f6\u00dfe: \u200e27 Zoll\nBildschirmaufl\u00f6sung: \u200e840 x 2160\nL\u00f6sung: \u200e2560 x 1440 Pixels\nProzessortyp: \u200eOthers\nAnzahl HDMI Schnittstellen: \u200e2\nBatterien enthalten: \u200eNein\nArtikelgewicht: \u200e4,34 Kilograms\nGarantierte Software-Updates bis: \u200eunbekannt\nASIN: B0BGJ84G29\nDurchschnittliche Kundenbewertung: 4,3  4,3 von 5 Sternen    \n    5 Sternebewertungen   \n\n\n 4,3 von 5 Sternen\nAmazon Bestseller-Rang: Nr. 72,627 in Computer & Zubeh\u00f6r (Siehe Top 100 in Computer & Zubeh\u00f6r)  Nr. 1,372 in Monitore\nIm Angebot von Amazon.de seit: 26. September 2022",
    "reference_file": "offer_reference_759.json",
    "shop_name": "Amazon.at"
}