{
    "html_file": "offer_727_19.html",
    "name": "iiyama G-Master G2770QSU-B1 Red Eagle, 27\"",
    "offer_link": "https://www.proshop.at/Bildschirm/iiyama-27-Bildschirm-G-MASTER-Red-Eagle-G2770QSU-B1-LED-monitor-27-HDR-Black-1-ms-AMD-FreeSync-2/3123116?utm_source=geizhals&utm_medium=cpc&utm_campaign=pricesite",
    "price": 302.66,
    "raw_specifications": {
        "Abmessungen (Breite x Tiefe x H\u00f6he)": "61.4 cm x 23.9 cm x 44.2 cm",
        "Adaptive-Sync Technologie": "AMD FreeSync Premium Pro",
        "Ausgangsleistung/Kanal": "2 Watt",
        "Besonderheiten": "HDCP, Advanced Contrast Ratio (ACR), X-Res Technology, flimmerfreie Technologie, i-Style Color, Black Tuner, Blue Light Reducer Function",
        "Bildschirmbeschichtung": "Matt",
        "Bildschirmtyp": "Fast IPS",
        "Diagonalabmessung": "68.5 cm (27\")",
        "Display-Typ": "LED-hintergrundbeleuchteter LCD-Monitor / TFT-Aktivmatrix",
        "EAN": "4948570121069",
        "Eingangsanschl\u00fcsse": "HDMI, DisplayPort",
        "Eingangsspannung": "Wechselstrom 100-240 V (50/60 Hz)",
        "Einstellungen der Anzeigeposition": "Neigung",
        "Energie Effizienzklasse": "Klasse G",
        "Energieklasse (HDR)": "Klasse G",
        "Enthaltene Kabel": "1 x USB-Kabel  1 x HDMI-Kabel  1 x DisplayPort-Kabel",
        "Farbe": "Mattschwarz",
        "Farbunterst\u00fctzung": "16,7 Millionen Farben (8-Bit)",
        "Ger\u00e4tetyp": "LED-hintergrundbeleuchteter LCD-Monitor - 68.5 cm (27\")",
        "Gewicht": "4.4 kg",
        "HDR-Format": "HDR400",
        "HDR-f\u00e4hig": "HDR400",
        "Helligkeit": "400 cd/m\u00b2",
        "Hersteller": "iiyama",
        "Hintergrundbeleuchtungs-Technologie": "LED-Hintergrundbeleuchtung",
        "Horizontale Bildwiederholrate": "30 - 242 kHz",
        "Horizontaler Betrachtungswinkel": "+89 / -89",
        "Integrierte Peripherieger\u00e4te": "USB 3.0-Hub",
        "Kennzeichnung": "VCCI, RoHS, WEEE, PSE Mark, REACH, TUV Bauart, ERP, EAC, UKCA",
        "Kontrast": "1000:1 / 80000000:1 (dynamisch)",
        "Leistungsaufnahme im Ein-Zustand": "32 W",
        "Leistungsmerkmale": "Slot f\u00fcr Sicherheitsschloss (Kabelschloss getrennt erh\u00e4ltlich), integrierte Kabelf\u00fchrung, Unterst\u00fctzung f\u00fcr VESA-Schnittstelle",
        "Modell": "G2770QSU-B1",
        "Native Aufl\u00f6sung": "WQHD 2560 x 1440 (DisplayPort: 165 Hz, HDMI: 144 Hz)",
        "Neigungswinkel": "-3.5/+21.5",
        "OSD-Sprachen": "Tschechisch, Englisch, Deutsch, Franz\u00f6sisch, Italienisch, Polnisch, Russisch, Spanisch, Holl\u00e4ndisch, Japanisch",
        "Pixelpitch": "0.233 mm",
        "Produktbeschreibung": "iiyama G-MASTER Red Eagle G2770QSU-B1 - LED-Monitor - 68.5 cm (27\") - HDR",
        "Reaktionszeit": "0.5 ms (MPRT)",
        "Schlosstyp zur Diebstahlsicherung": "Kensington Slot",
        "Schnittstellen": "DisplayPort 1.4  HDMI 2.0  2 x USB 3.0",
        "Seitenverh\u00e4ltnis": "16:9",
        "Spannung": "Wechselstrom 100-240 V (50/60 Hz)",
        "Stromverbrauch (Aus-Modus)": "0.3 Watt",
        "Stromverbrauch (typisch)": "35 Watt",
        "Stromverbrauch HDR (eingeschaltet)": "39 kWh/1.000 h",
        "Stromverbrauch SDR (eingeschaltet)": "32 kWh/1.000 h",
        "Stromverbrauch im Standby-Modus": "0.5 Watt",
        "Typ": "Lautsprecher - Stereo",
        "VESA-Halterung": "100 x 100 mm",
        "Vertikaler Betrachtungswinkel": "+89 / -89",
        "Waren-Nr.": "3123116",
        "Zum Hersteller": "www.iiyama.com"
    },
    "raw_specifications_text": "Hersteller: iiyama\nWaren-Nr.: 3123116\nModell: G2770QSU-B1\nEAN: 4948570121069\nZum Hersteller: www.iiyama.com\nProduktbeschreibung: iiyama G-MASTER Red Eagle G2770QSU-B1 - LED-Monitor - 68.5 cm (27\") - HDR\nGer\u00e4tetyp: LED-hintergrundbeleuchteter LCD-Monitor - 68.5 cm (27\")\nEnergie Effizienzklasse: Klasse G\nLeistungsaufnahme im Ein-Zustand: 32 W\nAdaptive-Sync Technologie: AMD FreeSync Premium Pro\nLeistungsmerkmale: Slot f\u00fcr Sicherheitsschloss (Kabelschloss getrennt erh\u00e4ltlich), integrierte Kabelf\u00fchrung, Unterst\u00fctzung f\u00fcr VESA-Schnittstelle\nBildschirmtyp: Fast IPS\nSeitenverh\u00e4ltnis: 16:9\nNative Aufl\u00f6sung: WQHD 2560 x 1440 (DisplayPort: 165 Hz, HDMI: 144 Hz)\nPixelpitch: 0.233 mm\nHelligkeit: 400 cd/m\u00b2\nKontrast: 1000:1 / 80000000:1 (dynamisch)\nHDR-f\u00e4hig: HDR400\nReaktionszeit: 0.5 ms (MPRT)\nFarbunterst\u00fctzung: 16,7 Millionen Farben (8-Bit)\nEingangsanschl\u00fcsse: HDMI, DisplayPort\nEinstellungen der Anzeigeposition: Neigung\nBildschirmbeschichtung: Matt\nSpannung: Wechselstrom 100-240 V (50/60 Hz)\nFarbe: Mattschwarz\nAbmessungen (Breite x Tiefe x H\u00f6he): 61.4 cm x 23.9 cm x 44.2 cm\nGewicht: 4.4 kg\nKennzeichnung: VCCI, RoHS, WEEE, PSE Mark, REACH, TUV Bauart, ERP, EAC, UKCA\nDisplay-Typ: LED-hintergrundbeleuchteter LCD-Monitor / TFT-Aktivmatrix\nEnergieklasse (HDR): Klasse G\nDiagonalabmessung: 68.5 cm (27\")\nIntegrierte Peripherieger\u00e4te: USB 3.0-Hub\nHDR-Format: HDR400\nHorizontale Bildwiederholrate: 30 - 242 kHz\nHorizontaler Betrachtungswinkel: +89 / -89\nVertikaler Betrachtungswinkel: +89 / -89\nHintergrundbeleuchtungs-Technologie: LED-Hintergrundbeleuchtung\nOSD-Sprachen: Tschechisch, Englisch, Deutsch, Franz\u00f6sisch, Italienisch, Polnisch, Russisch, Spanisch, Holl\u00e4ndisch, Japanisch\nBesonderheiten: HDCP, Advanced Contrast Ratio (ACR), X-Res Technology, flimmerfreie Technologie, i-Style Color, Black Tuner, Blue Light Reducer Function\nTyp: Lautsprecher - Stereo\nAusgangsleistung/Kanal: 2 Watt\nSchnittstellen: DisplayPort 1.4  HDMI 2.0  2 x USB 3.0\nNeigungswinkel: -3.5/+21.5\nVESA-Halterung: 100 x 100 mm\nEnthaltene Kabel: 1 x USB-Kabel  1 x HDMI-Kabel  1 x DisplayPort-Kabel\nSchlosstyp zur Diebstahlsicherung: Kensington Slot\nEingangsspannung: Wechselstrom 100-240 V (50/60 Hz)\nStromverbrauch SDR (eingeschaltet): 32 kWh/1.000 h\nStromverbrauch HDR (eingeschaltet): 39 kWh/1.000 h\nStromverbrauch (typisch): 35 Watt\nStromverbrauch im Standby-Modus: 0.5 Watt\nStromverbrauch (Aus-Modus): 0.3 Watt",
    "reference_file": "offer_reference_727.json",
    "shop_name": "Proshop.at"
}