{
    "html_file": "offer_1597_30.html",
    "name": "LG 24BL650C-B, 23.8\"",
    "offer_link": "https://restposten.bauguru.at/monitore/126323-monitor-lg-24bl650c-b-ips-full-hd-23-8-8806098567621.html",
    "price": 189.3,
    "raw_specifications": {
        "Aufl\u00f6sung": "Full HD",
        "Bildschirm": "23,8\"",
        "Diagonale des Bildschirms (cm)": "60,5 cm",
        "Dreh": "-180\u00ba / 180\u00ba",
        "Empfohlene verwendung": "Unternehmen & Business",
        "Energieklassifizierung": "E",
        "Energieverbrauch": "0.5 kWh",
        "Enthalten": "Kopfh\u00f6rerausgang",
        "Farbe": "Schwarz",
        "Finish": "Mattierend",
        "Gaming": "Kein",
        "Glanz": "250 ANSI",
        "Kompatibel": "VESA 100 x 100 mm",
        "Kontrastverh\u00e4ltnis": "1000:1",
        "Kopfh\u00f6rer": "3,5 mm",
        "Leistung": "2,4 W",
        "L\u00e4nge des Kabels": "1,5 m",
        "Maximale Anpassung": "130 mm",
        "Montage": "VESA",
        "Nicht erhalten": "AMD FreeSync",
        "Ports": "1",
        "Seitenverh\u00e4ltnis": "16:9",
        "Steckbares Produkt": "Ja",
        "Steckertyp": "EU-Stecker",
        "Touchscreen": "Kein",
        "Verbindung": "DisplayPort 1.2",
        "Winkel": "178\u00ba"
    },
    "raw_specifications_text": "Gaming: Kein\nTouchscreen: Kein\nAufl\u00f6sung: Full HD\nPorts: 1\nBildschirm: 23,8\"\nSteckbares Produkt: Ja\nSteckertyp: EU-Stecker\nEnergieklassifizierung: E\nDiagonale des Bildschirms (cm): 60,5 cm\nFarbe: Schwarz\nSeitenverh\u00e4ltnis: 16:9\nKontrastverh\u00e4ltnis: 1000:1\nFinish: Mattierend\nKopfh\u00f6rer: 3,5 mm\nVerbindung: DisplayPort 1.2\nL\u00e4nge des Kabels: 1,5 m\nGlanz: 250 ANSI\nEnthalten: Kopfh\u00f6rerausgang\nLeistung: 2,4 W\nWinkel: 178\u00ba\nEnergieverbrauch: 0.5 kWh\nNicht erhalten: AMD FreeSync\nMontage: VESA\nMaximale Anpassung: 130 mm\nEmpfohlene verwendung: Unternehmen & Business\nKompatibel: VESA 100 x 100 mm\nDreh: -180\u00ba / 180\u00ba",
    "reference_file": "offer_reference_1597.json",
    "shop_name": "bauguru"
}