{
    "html_file": "offer_979_7.html",
    "name": "Samsung Smart Monitor M7 M70B wei\u00df (2022), 32\"",
    "offer_link": "https://www.hiq24.de/shop/artikel/319805/?sPartner=geizhals",
    "price": 305.9,
    "raw_specifications": {
        "Abmessungen (Breite x Tiefe x H\u00f6he)": "71.61 cm x 19.35 cm x 51.7 cm - mit Fu\u00df",
        "Abmessungen (Breite x Tiefe x H\u00f6he) - mit Fu\u00df": "71.61 cm x 19.35 cm x 51.7 cm",
        "Besonderheiten": "Spielmodus, ConnectShare, Smart Hub, flimmerfreie Technologie, Werkskalibrierung, Eye Saver Mode, DLNA, Auto Source Switch+, Adaptive Picture, Ultrawide Game View, Tizen Platform, Tap View, Remote Access, Sound Mirroring, SmartThings App Support, Adaptive Sound, Game Bar 2.0",
        "Bildschirmtyp": "VA",
        "Details zu Abmessungen & Gewicht": "Mit Fu\u00df - Breite: 71.61 cm - Tiefe: 19.35 cm - H\u00f6he: 51.7 cm - Gewicht: 6.8 kg  Ohne Fu\u00df - Breite: 71.61 cm - Tiefe: 4.18 cm - H\u00f6he: 42.45 cm - Gewicht: 5.7 kg",
        "Diagonalabmessung": "80 cm (32\")",
        "Display-Typ": "LED-hintergrundbeleuchteter LCD-Monitor / TFT-Aktivmatrix - Smart Monitor",
        "Eingangsanschl\u00fcsse": "2xHDMI, USB-C",
        "Eingangsspannung": "Wechselstrom 100-240 V (50/60 Hz)",
        "Einstellungen der Anzeigeposition": "Neigung",
        "Energie Effizienzklasse": "Klasse G",
        "Energieklasse (HDR)": "Klasse G",
        "Energieverbrauch pro Jahr": "58 kWh",
        "Enthaltene Kabel": "1 x HDMI-Kabel",
        "Farbe": "Wei\u00df",
        "Farbunterst\u00fctzung": "1,07 Mrd. Farben",
        "Ger\u00e4tetyp": "LED-hintergrundbeleuchteter LCD-Monitor - 80 cm (32\") - Smart Monitor",
        "Gewicht": "6.8 kg",
        "HDR-Format": "HDR10",
        "HDR-f\u00e4hig": "HDR10",
        "Helligkeit": "300 cd/m\u00b2",
        "Hintergrundbeleuchtungs-Technologie": "LED-Hintergrundbeleuchtung",
        "Horizontaler Betrachtungswinkel": "178",
        "Integrierte Peripherieger\u00e4te": "Wi-Fi, USB 2.0 Hub, Bluetooth 4.2 Adapter",
        "Kennzeichnung": "CEC",
        "Kontrast": "3000:1",
        "Leistungsmerkmale": "Wi-Fi, USB 2.0 Hub, Bluetooth 4.2 Adapter",
        "Max. Betriebstemperatur": "40 \u00b0C",
        "Min Betriebstemperatur": "10 \u00b0C",
        "Native Aufl\u00f6sung": "4K 3840 x 2160 bei 60 Hz",
        "Neigungswinkel": "-2/+22",
        "Pixelpitch": "0.1845 mm",
        "Produktbeschreibung": "Samsung S32BM701UU - M70B Series - LED-Monitor - 4K - 80 cm (32\") - HDR",
        "Reaktionszeit": "4 ms (gray-to-gray)",
        "Schlosstyp zur Diebstahlsicherung": "Kensington Slot",
        "Schnittstellen": "2 x HDMI  3 x USB 2.0  USB-C (bis zu 65 W)",
        "Seitenverh\u00e4ltnis": "16:9",
        "Spannung": "Wechselstrom 100-240 V (50/60 Hz)",
        "Stromverbrauch (max.)": "150 Watt",
        "Stromverbrauch (typisch)": "40 Watt",
        "Stromverbrauch HDR (eingeschaltet)": "57 kWh/1.000 h",
        "Stromverbrauch SDR (eingeschaltet)": "40 kWh/1.000 h",
        "Stromverbrauch im Standby-Modus": "0.5 Watt",
        "Transportbreite": "84.2 cm",
        "Transportgewicht": "8.7 kg",
        "Transporth\u00f6he": "13.3 cm",
        "Transporttiefe": "48.7 cm",
        "Typ": "Lautsprecher",
        "VESA-Halterung": "100 x 100 mm",
        "Vertikaler Betrachtungswinkel": "178",
        "Zubeh\u00f6r im Lieferumfang": "Fernbedienung",
        "Zul\u00e4ssige Luftfeuchtigkeit im Betrieb": "10 - 80% (nicht kondensierend)"
    },
    "raw_specifications_text": "Display-Typ: LED-hintergrundbeleuchteter LCD-Monitor / TFT-Aktivmatrix - Smart Monitor\nEnergie Effizienzklasse: Klasse G\nEnergieklasse (HDR): Klasse G\nEnergieverbrauch pro Jahr: 58 kWh\nDiagonalabmessung: 80 cm (32\")\nIntegrierte Peripherieger\u00e4te: Wi-Fi, USB 2.0 Hub, Bluetooth 4.2 Adapter\nBildschirmtyp: VA\nSeitenverh\u00e4ltnis: 16:9\nNative Aufl\u00f6sung: 4K 3840 x 2160 bei 60 Hz\nPixelpitch: 0.1845 mm\nHelligkeit: 300 cd/m\u00b2\nKontrast: 3000:1\nHDR-Format: HDR10\nFarbunterst\u00fctzung: 1,07 Mrd. Farben\nReaktionszeit: 4 ms (gray-to-gray)\nHorizontaler Betrachtungswinkel: 178\nVertikaler Betrachtungswinkel: 178\nHintergrundbeleuchtungs-Technologie: LED-Hintergrundbeleuchtung\nBesonderheiten: Spielmodus, ConnectShare, Smart Hub, flimmerfreie Technologie, Werkskalibrierung, Eye Saver Mode, DLNA, Auto Source Switch+, Adaptive Picture, Ultrawide Game View, Tizen Platform, Tap View, Remote Access, Sound Mirroring, SmartThings App Support, Adaptive Sound, Game Bar 2.0\nFarbe: Wei\u00df\nAbmessungen (Breite x Tiefe x H\u00f6he): 71.61 cm x 19.35 cm x 51.7 cm - mit Fu\u00df\nGewicht: 6.8 kg\nTyp: Lautsprecher\nSchnittstellen: 2 x HDMI  3 x USB 2.0  USB-C (bis zu 65 W)\nEinstellungen der Anzeigeposition: Neigung\nNeigungswinkel: -2/+22\nVESA-Halterung: 100 x 100 mm\nLeistungsmerkmale: Wi-Fi, USB 2.0 Hub, Bluetooth 4.2 Adapter\nZubeh\u00f6r im Lieferumfang: Fernbedienung\nEnthaltene Kabel: 1 x HDMI-Kabel\nKennzeichnung: CEC\nSchlosstyp zur Diebstahlsicherung: Kensington Slot\nEingangsspannung: Wechselstrom 100-240 V (50/60 Hz)\nStromverbrauch SDR (eingeschaltet): 40 kWh/1.000 h\nStromverbrauch HDR (eingeschaltet): 57 kWh/1.000 h\nStromverbrauch (typisch): 40 Watt\nStromverbrauch (max.): 150 Watt\nStromverbrauch im Standby-Modus: 0.5 Watt\nDetails zu Abmessungen & Gewicht: Mit Fu\u00df - Breite: 71.61 cm - Tiefe: 19.35 cm - H\u00f6he: 51.7 cm - Gewicht: 6.8 kg  Ohne Fu\u00df - Breite: 71.61 cm - Tiefe: 4.18 cm - H\u00f6he: 42.45 cm - Gewicht: 5.7 kg\nTransportbreite: 84.2 cm\nTransporttiefe: 48.7 cm\nTransporth\u00f6he: 13.3 cm\nTransportgewicht: 8.7 kg\nMin Betriebstemperatur: 10 \u00b0C\nMax. Betriebstemperatur: 40 \u00b0C\nZul\u00e4ssige Luftfeuchtigkeit im Betrieb: 10 - 80% (nicht kondensierend)\nProduktbeschreibung: Samsung S32BM701UU - M70B Series - LED-Monitor - 4K - 80 cm (32\") - HDR\nGer\u00e4tetyp: LED-hintergrundbeleuchteter LCD-Monitor - 80 cm (32\") - Smart Monitor\nHDR-f\u00e4hig: HDR10\nEingangsanschl\u00fcsse: 2xHDMI, USB-C\nSpannung: Wechselstrom 100-240 V (50/60 Hz)\nAbmessungen (Breite x Tiefe x H\u00f6he) - mit Fu\u00df: 71.61 cm x 19.35 cm x 51.7 cm",
    "reference_file": "offer_reference_979.json",
    "shop_name": "HiQ24"
}