{
    "html_file": "offer_2004_2.html",
    "name": "Acer Nitro XV0 XV240YPbmiiprx, 23.8\"",
    "offer_link": "https://www.amazon.de/dp/B082QFPRWM?linkCode=xm2&camp=2025&creative=165953&smid=A3JWKAKR8XB7XF&creativeASIN=B082QFPRWM&tag=geizhals1-21",
    "price": 179.75,
    "raw_specifications": {
        "ASIN": "B082QFPRWM",
        "Amazon Bestseller-Rang": "Nr. 22,109 in Computer & Zubeh\u00f6r (Siehe Top 100 in Computer & Zubeh\u00f6r)  Nr. 484 in Monitore",
        "Anzahl HDMI Schnittstellen": "\u200e2",
        "Artikelgewicht": "\u200e4,93 Kilograms",
        "Batterien enthalten": "\u200eNein",
        "Bildschirmaufl\u00f6sung": "\u200e1920x1080",
        "Display-Gr\u00f6\u00dfe": "\u200e23,8 Zoll",
        "Durchschnittliche Kundenbewertung": "4,5  4,5 von 5 Sternen    \n    662 Sternebewertungen   \n\n\n 4,5 von 5 Sternen",
        "Farbe": "\u200eSchwarz",
        "Garantierte Software-Updates bis": "\u200eunbekannt",
        "Hardware Plattform": "\u200eWindows, Apple, Microsoft, Linux",
        "Hersteller": "\u200eAcer",
        "Im Angebot von Amazon.de seit": "31. Dezember 2019",
        "L\u00f6sung": "\u200e1920 x 1080 Pixels",
        "Marke": "\u200eAcer",
        "Modell/Serie": "\u200eNitro XV240YPbmiiprx",
        "Modellnummer": "\u200eUM.QX0EE.P01",
        "Produktabmessungen": "\u200e23,4 x 54 x 49,9 cm; 4,93 Kilogramm"
    },
    "raw_specifications_text": "Marke: \u200eAcer\nHersteller: \u200eAcer\nModell/Serie: \u200eNitro XV240YPbmiiprx\nProduktabmessungen: \u200e23,4 x 54 x 49,9 cm; 4,93 Kilogramm\nModellnummer: \u200eUM.QX0EE.P01\nFarbe: \u200eSchwarz\nDisplay-Gr\u00f6\u00dfe: \u200e23,8 Zoll\nBildschirmaufl\u00f6sung: \u200e1920x1080\nL\u00f6sung: \u200e1920 x 1080 Pixels\nAnzahl HDMI Schnittstellen: \u200e2\nHardware Plattform: \u200eWindows, Apple, Microsoft, Linux\nBatterien enthalten: \u200eNein\nArtikelgewicht: \u200e4,93 Kilograms\nGarantierte Software-Updates bis: \u200eunbekannt\nASIN: B082QFPRWM\nDurchschnittliche Kundenbewertung: 4,5  4,5 von 5 Sternen    \n    662 Sternebewertungen   \n\n\n 4,5 von 5 Sternen\nAmazon Bestseller-Rang: Nr. 22,109 in Computer & Zubeh\u00f6r (Siehe Top 100 in Computer & Zubeh\u00f6r)  Nr. 484 in Monitore\nIm Angebot von Amazon.de seit: 31. Dezember 2019",
    "reference_file": "offer_reference_2004.json",
    "shop_name": "Amazon.at"
}