{
    "html_file": "offer_2361_12.html",
    "name": "Philips V-line 273V7QJAB, 27\"",
    "offer_link": "https://direkt.jacob.de/produkte/philips-v-line-273v7qjab-00-artnr-3787351.html?utm_source=geizhals&utm_medium=cpc&utm_campaign=Preisvergleich&ref=103",
    "price": 128.51,
    "raw_specifications": {
        "Ausgangsleistung/Kanal": "2 Watt",
        "Besonderheiten": "Sync-on-Green, sRGB-Farbmanagement, SmartResponse, SmartContrast, SmartImage, Low Blue Light Mode, flimmerfreie Technologie, Ultra-schmale Kante, ohne Quecksilber, breiter Betrachtungswinkel, EasyRead",
        "Bildschirmtyp": "IPS",
        "Details zu Abmessungen & Gewicht": "Mit Fu\u00df - Breite: 61.2 cm - Tiefe: 22.7 cm - H\u00f6he: 45.3 cm - Gewicht: 4.5 kg  Ohne Fu\u00df - Breite: 61.2 cm - Tiefe: 4.5 cm - H\u00f6he: 36.7 cm - Gewicht: 4.04 kg",
        "Diagonalabmessung": "68.6 cm (27\")",
        "Display-Typ": "LED-hintergrundbeleuchteter LCD-Monitor / TFT-Aktivmatrix",
        "ENERGY STAR zertifiziert": "Ja",
        "Eingangsanschl\u00fcsse": "HDMI, VGA, DisplayPort",
        "Eingangsspannung": "Wechselstrom 120/230 V (50/60 Hz)",
        "Einstellungen der Anzeigeposition": "Neigung",
        "Energie Effizienzklasse": "Klasse E",
        "Energieverbrauch pro Jahr": "33 kWh",
        "Enthaltene Kabel": "1 x VGA-Kabel  1 x Audiokabel",
        "Entwickelt f\u00fcr": "Exone go Business 1570 II, 1790  exone go Expert 1775, 1785 II  exone go Workstation 1575",
        "Farbe": "Schwarz, Textured Black",
        "Farbunterst\u00fctzung": "16,7 Millionen Farben",
        "Ger\u00e4tetyp": "LED-hintergrundbeleuchteter LCD-Monitor - 68.6 cm (27\")",
        "Helligkeit": "250 cd/m\u00b2",
        "Hintergrundbeleuchtungs-Technologie": "WLED",
        "Horizontale Bildwiederholrate": "30 - 83 kHz",
        "Horizontaler Betrachtungswinkel": "178",
        "Kennzeichnung": "Plug and Play, FCC Klasse B bescheinigt, TUV, BSMI, ICES-003, SEMKO, DDC/CI, RoHS, Bleifrei, ISO 9241-307, WEEE, cETLus, RCM, CU",
        "Kontrast": "1000:1 / 10000000:1 (dynamisch)",
        "Leistungsaufnahme im Ein-Zustand": "21 W",
        "Leistungsmerkmale": "Slot f\u00fcr Sicherheitsschloss (Kabelschloss getrennt erh\u00e4ltlich)",
        "MTBF": "50,000 Stunde(n)",
        "Max. Betriebstemperatur": "40 \u00b0C",
        "Min Betriebstemperatur": "0 \u00b0C",
        "Native Aufl\u00f6sung": "Full HD (1080p) 1920 x 1080 bei 60 Hz",
        "Neigungswinkel": "-5/+20",
        "OSD-Sprachen": "Ungarisch, Tschechisch, Chinesisch (tradionell), Chinesisch (vereinfacht), Ukrainisch, Brasilianisches Portugiesisch, Englisch, Deutsch, Franz\u00f6sisch, Italienisch, Portugiesisch, Polnisch, Finnisch, Schwedisch, Russisch, Spanisch, Holl\u00e4ndisch, Griechisch, T\u00fcrkisch, Japanisch, Koreanisch",
        "Pixelpitch": "0.311 mm",
        "Ppi": "82",
        "Produktbeschreibung": "Philips V-line 273V7QJAB - LED-Monitor - Full HD (1080p) - 68.6 cm (27\")",
        "Reaktionszeit": "5 ms (Gray-to-Gray)",
        "Schnittstellen": "VGA  HDMI (HDCP)  DisplayPort  Kopfh\u00f6rer  Audio Line-In",
        "Seitenverh\u00e4ltnis": "16:9",
        "Spannung": "Wechselstrom 120/230 V (50/60 Hz)",
        "Stromverbrauch (Aus-Modus)": "0.5 Watt",
        "Stromverbrauch (typisch)": "15.4 Watt",
        "Stromverbrauch SDR (eingeschaltet)": "21 kWh/1.000 h",
        "Stromverbrauch im Standby-Modus": "0.5 Watt",
        "Typ": "Lautsprecher - Stereo",
        "Umweltschutzstandards": "ENERGY STAR-qualifiziert",
        "VESA-Halterung": "100 x 100 mm",
        "Vertikale Bildwiederholrate": "56 - 76 Hz",
        "Vertikaler Betrachtungswinkel": "178",
        "Zul\u00e4ssige Luftfeuchtigkeit im Betrieb": "20 - 80%"
    },
    "raw_specifications_text": "Produktbeschreibung: Philips V-line 273V7QJAB - LED-Monitor - Full HD (1080p) - 68.6 cm (27\")\nGer\u00e4tetyp: LED-hintergrundbeleuchteter LCD-Monitor - 68.6 cm (27\")\nEnergie Effizienzklasse: Klasse E\nEnergieverbrauch pro Jahr: 33 kWh\nLeistungsaufnahme im Ein-Zustand: 21 W\nBildschirmtyp: IPS\nSeitenverh\u00e4ltnis: 16:9\nNative Aufl\u00f6sung: Full HD (1080p) 1920 x 1080 bei 60 Hz\nPixelpitch: 0.311 mm\nHelligkeit: 250 cd/m\u00b2\nKontrast: 1000:1 / 10000000:1 (dynamisch)\nReaktionszeit: 5 ms (Gray-to-Gray)\nFarbunterst\u00fctzung: 16,7 Millionen Farben\nEingangsanschl\u00fcsse: HDMI, VGA, DisplayPort\nEinstellungen der Anzeigeposition: Neigung\nSpannung: Wechselstrom 120/230 V (50/60 Hz)\nFarbe: Schwarz, Textured Black\nUmweltschutzstandards: ENERGY STAR-qualifiziert\nKennzeichnung: Plug and Play, FCC Klasse B bescheinigt, TUV, BSMI, ICES-003, SEMKO, DDC/CI, RoHS, Bleifrei, ISO 9241-307, WEEE, cETLus, RCM, CU\nEntwickelt f\u00fcr: Exone go Business 1570 II, 1790  exone go Expert 1775, 1785 II  exone go Workstation 1575\nDisplay-Typ: LED-hintergrundbeleuchteter LCD-Monitor / TFT-Aktivmatrix\nDiagonalabmessung: 68.6 cm (27\")\nPpi: 82\nVertikale Bildwiederholrate: 56 - 76 Hz\nHorizontale Bildwiederholrate: 30 - 83 kHz\nHorizontaler Betrachtungswinkel: 178\nVertikaler Betrachtungswinkel: 178\nHintergrundbeleuchtungs-Technologie: WLED\nOSD-Sprachen: Ungarisch, Tschechisch, Chinesisch (tradionell), Chinesisch (vereinfacht), Ukrainisch, Brasilianisches Portugiesisch, Englisch, Deutsch, Franz\u00f6sisch, Italienisch, Portugiesisch, Polnisch, Finnisch, Schwedisch, Russisch, Spanisch, Holl\u00e4ndisch, Griechisch, T\u00fcrkisch, Japanisch, Koreanisch\nBesonderheiten: Sync-on-Green, sRGB-Farbmanagement, SmartResponse, SmartContrast, SmartImage, Low Blue Light Mode, flimmerfreie Technologie, Ultra-schmale Kante, ohne Quecksilber, breiter Betrachtungswinkel, EasyRead\nTyp: Lautsprecher - Stereo\nAusgangsleistung/Kanal: 2 Watt\nSchnittstellen: VGA  HDMI (HDCP)  DisplayPort  Kopfh\u00f6rer  Audio Line-In\nNeigungswinkel: -5/+20\nVESA-Halterung: 100 x 100 mm\nLeistungsmerkmale: Slot f\u00fcr Sicherheitsschloss (Kabelschloss getrennt erh\u00e4ltlich)\nEnthaltene Kabel: 1 x VGA-Kabel  1 x Audiokabel\nMTBF: 50,000 Stunde(n)\nEingangsspannung: Wechselstrom 120/230 V (50/60 Hz)\nStromverbrauch SDR (eingeschaltet): 21 kWh/1.000 h\nStromverbrauch (typisch): 15.4 Watt\nStromverbrauch im Standby-Modus: 0.5 Watt\nStromverbrauch (Aus-Modus): 0.5 Watt\nDetails zu Abmessungen & Gewicht: Mit Fu\u00df - Breite: 61.2 cm - Tiefe: 22.7 cm - H\u00f6he: 45.3 cm - Gewicht: 4.5 kg  Ohne Fu\u00df - Breite: 61.2 cm - Tiefe: 4.5 cm - H\u00f6he: 36.7 cm - Gewicht: 4.04 kg\nENERGY STAR zertifiziert: Ja\nMin Betriebstemperatur: 0 \u00b0C\nMax. Betriebstemperatur: 40 \u00b0C\nZul\u00e4ssige Luftfeuchtigkeit im Betrieb: 20 - 80%",
    "reference_file": "offer_reference_2361.json",
    "shop_name": "Jacob Elektronik direkt (AT)"
}