{
    "html_file": "offer_944_13.html",
    "name": "ASUS ProArt PA328QV, 31.5\"",
    "offer_link": "https://www.ditech.at/details.php?artnr=347192",
    "price": 496.9,
    "raw_specifications": {
        "Anschl\u00fcsse - DisplayPort 1.2": "1",
        "Anschl\u00fcsse - HDMI 2.0": "2",
        "Anwendung": "station\u00e4r",
        "Audio": "Lautsprecher (2x 2W),  1x Line-Out",
        "Aufl\u00f6sung": "2560x1440",
        "Beschichtung": "matt (non-glare)",
        "Besonderheiten": "Slim Bezel,  mechanische Tasten mit Steuerkreuz,  Picture-in-Picture,  Sicherheitsschloss (Kensington),  HDCP 2.2,  Calman Verified,  Werkskalibrierung (Delta-E <2)",
        "Bildwiederholfrequenz": "75Hz",
        "Blickwinkel": "178\u00b0/178\u00b0",
        "Diagonale": "31.5\"/80cm",
        "Energieeffizienzklasse HDR (A bis G)": "G",
        "Energieverbrauch HDR": "39kWh/1000h",
        "Energieverbrauch SDR": "32kWh/1000h",
        "Ergonomie": "130mm (h\u00f6henverstellbar),  \u00b190\u00b0 (Pivot),  \u00b130\u00b0 (drehbar),  +23\u00b0/-5\u00b0 (neigbar),  keine Angabe (Schr\u00e4glage)",
        "FRC": "unbekannt",
        "Farbe": "schwarz",
        "Farbraum - REC 709": "100%",
        "Farbraum - sRGB": "100%",
        "Farbtiefe": "10bit (1.07 Mrd. Farben)",
        "Form": "gerade (flat)",
        "Gewicht": "11.50kg (mit Standfu\u00df),  7.00kg (ohne Standfu\u00df)",
        "HDR": "HDR10",
        "Helligkeit": "350cd/m\u00b2 (typisch),  400cd/m\u00b2 (HDR)",
        "Herstellergarantie": "f\u00fcnf Jahre nach Registrierung (innerhalb von drei Monaten nach Kauf,  Standard: drei Jahre)",
        "Hintergrundbeleuchtung": "White-LED,  flicker-free,  Blaulichtfilter",
        "Kontrast - statisch": "1.000:1",
        "Lautsprecher": "Ja",
        "Leistungsaufnahme": "keine Angabe (maximal),  26.5W (typisch),  keine Angabe (Energielabel alt A+++ bis G),  0.5W (Standby)",
        "Panel": "IPS",
        "Reaktionszeit - GtG": "5ms",
        "Screen-to-Body-Ratio": "90.6% (berechnet)",
        "Seitenverh\u00e4ltnis": "16:9",
        "Signalfrequenz": "112kHz (horizontal),  48-75Hz (vertikal)",
        "Stromversorgung": "AC-In (internes Netzteil)",
        "USB-Hub In": "1x USB-B 3.0",
        "USB-Hub Out": "4x USB-A 3.0",
        "USB-Schreibweise": "Link",
        "VESA": "100x100 (belegt)",
        "Weitere Anschl\u00fcsse": "N/A"
    },
    "raw_specifications_text": "Anschl\u00fcsse - DisplayPort 1.2: 1\nAnschl\u00fcsse - HDMI 2.0: 2\nAnwendung: station\u00e4r\nAudio: Lautsprecher (2x 2W),  1x Line-Out\nAufl\u00f6sung: 2560x1440\nBeschichtung: matt (non-glare)\nBesonderheiten: Slim Bezel,  mechanische Tasten mit Steuerkreuz,  Picture-in-Picture,  Sicherheitsschloss (Kensington),  HDCP 2.2,  Calman Verified,  Werkskalibrierung (Delta-E <2)\nBildwiederholfrequenz: 75Hz\nBlickwinkel: 178\u00b0/178\u00b0\nDiagonale: 31.5\"/80cm\nEnergieeffizienzklasse HDR (A bis G): G\nEnergieverbrauch HDR: 39kWh/1000h\nEnergieverbrauch SDR: 32kWh/1000h\nErgonomie: 130mm (h\u00f6henverstellbar),  \u00b190\u00b0 (Pivot),  \u00b130\u00b0 (drehbar),  +23\u00b0/-5\u00b0 (neigbar),  keine Angabe (Schr\u00e4glage)\nFarbe: schwarz\nFarbraum - REC 709: 100%\nFarbraum - sRGB: 100%\nFarbtiefe: 10bit (1.07 Mrd. Farben)\nForm: gerade (flat)\nFRC: unbekannt\nGewicht: 11.50kg (mit Standfu\u00df),  7.00kg (ohne Standfu\u00df)\nHDR: HDR10\nHelligkeit: 350cd/m\u00b2 (typisch),  400cd/m\u00b2 (HDR)\nHerstellergarantie: f\u00fcnf Jahre nach Registrierung (innerhalb von drei Monaten nach Kauf,  Standard: drei Jahre)\nHintergrundbeleuchtung: White-LED,  flicker-free,  Blaulichtfilter\nKontrast - statisch: 1.000:1\nLautsprecher: Ja\nLeistungsaufnahme: keine Angabe (maximal),  26.5W (typisch),  keine Angabe (Energielabel alt A+++ bis G),  0.5W (Standby)\nPanel: IPS\nReaktionszeit - GtG: 5ms\nScreen-to-Body-Ratio: 90.6% (berechnet)\nSeitenverh\u00e4ltnis: 16:9\nSignalfrequenz: 112kHz (horizontal),  48-75Hz (vertikal)\nStromversorgung: AC-In (internes Netzteil)\nUSB-Hub In: 1x USB-B 3.0\nUSB-Hub Out: 4x USB-A 3.0\nUSB-Schreibweise: Link\nVESA: 100x100 (belegt)\nWeitere Anschl\u00fcsse: N/A",
    "reference_file": "offer_reference_944.json",
    "shop_name": "DiTech.at"
}