{
    "html_file": "offer_300_6.html",
    "name": "ASUS VY249HGE, 23.8\"",
    "offer_link": "https://www.alternate.at/ASUS/VY249HGE-Gaming-Monitor/html/product/1915349?partner=AtGeizhalsat&campaign=Monitor/ASUS/1915349",
    "price": 171.9,
    "raw_specifications": {
        "": "Kensington-Schloss",
        "Abmessungen": "Breite: 54,12 cm x H\u00f6he: 39,51 cm x Tiefe/L\u00e4nge: 18,48 cm",
        "Anschl\u00fcsse": "1x HDMI-Eingang, 1x Kopfh\u00f6rer-Ausgang",
        "Bild": "Format",
        "Bildschirmaufl\u00f6sung": "1.920 x 1.080 Pixel",
        "Bildschirmdiagonale": "60 cm (24 Zoll)",
        "EAN": "4711387078389",
        "Energieeffizienzklasse (SDR)": "D (A - G)",
        "Energieverbauch pro 1000 Stunden (SDR)": "15 kWh",
        "Ergonomie": "Neigbar",
        "Farbe": "schwarz",
        "Features": "Ultra-Low Blue Light, Flicker-free, Eye Care+, Pausenerinnerung",
        "Frequenz": "Vertikal",
        "Geeignet f\u00fcr": "Gaming",
        "Gewicht": "4 kg",
        "Hersteller-Nr.": "90LM06A5-B02370",
        "Leistungsaufnahme im Ein-Zustand bei Standard-Dynamikumfang (SDR)": "15 Watt",
        "Typ": "Gaming-Monitor",
        "Wandhalterung": "VESA kompatibel (100 x 100 mm)",
        "Zubeh\u00f6r": "Vorhanden"
    },
    "raw_specifications_text": "Energieeffizienzklasse (SDR): D (A - G)\nEnergieverbauch pro 1000 Stunden (SDR): 15 kWh\nLeistungsaufnahme im Ein-Zustand bei Standard-Dynamikumfang (SDR): 15 Watt\nBildschirmdiagonale: 60 cm (24 Zoll)\nBildschirmaufl\u00f6sung: 1.920 x 1.080 Pixel\nTyp: Gaming-Monitor\nFarbe: schwarz\nEAN: 4711387078389\nHersteller-Nr.: 90LM06A5-B02370\nGeeignet f\u00fcr: Gaming\nBild: Format\n: Kensington-Schloss\nFrequenz: Vertikal\nAnschl\u00fcsse: 1x HDMI-Eingang, 1x Kopfh\u00f6rer-Ausgang\nErgonomie: Neigbar\nWandhalterung: VESA kompatibel (100 x 100 mm)\nFeatures: Ultra-Low Blue Light, Flicker-free, Eye Care+, Pausenerinnerung\nZubeh\u00f6r: Vorhanden\nAbmessungen: Breite: 54,12 cm x H\u00f6he: 39,51 cm x Tiefe/L\u00e4nge: 18,48 cm\nGewicht: 4 kg",
    "reference_file": "offer_reference_300.json",
    "shop_name": "Alternate.at"
}