{
    "html_file": "offer_1290_0.html",
    "name": "ViewSonic VG2456, 23.8\"",
    "offer_link": "https://direkt.jacob.de/produkte/viewsonic-vg2456-monitor-vg2456-artnr-6944940.html?utm_source=geizhals&utm_medium=cpc&utm_campaign=Preisvergleich&ref=103",
    "price": 247.06,
    "raw_specifications": {
        "Abmessungen (Breite x Tiefe x H\u00f6he)": "53.9 cm x 20.2 cm x 40.62 cm - mit Fu\u00df",
        "Abmessungen (Breite x Tiefe x H\u00f6he) - mit Fu\u00df": "53.9 cm x 20.2 cm x 40.62 cm",
        "Ausgangsleistung/Kanal": "2 Watt",
        "Besonderheiten": "Traggriff, SuperClear, integrierte Kabelf\u00fchrung, flimmerfreie Technologie, TMDS-Technologie (Transition Minimized Differential Signaling), Blaulichtfilter-Technologie, rahmeloses Blendendesign, Composite Sync, ViewMode",
        "Bildschirmtyp": "IPS",
        "Details zu Abmessungen & Gewicht": "Mit Fu\u00df - Breite: 53.9 cm - Tiefe: 20.2 cm - H\u00f6he: 40.62 cm - Gewicht: 6.4 kg  Ohne Fu\u00df - Breite: 53.9 cm - Tiefe: 5.2 cm - H\u00f6he: 32 cm - Gewicht: 4 kg",
        "Diagonalabmessung": "61 cm (24\")",
        "Display-Typ": "LED-hintergrundbeleuchteter LCD-Monitor / TFT-Aktivmatrix",
        "ENERGY STAR zertifiziert": "Ja",
        "Eingangsanschl\u00fcsse": "HDMI, DisplayPort, USB-C",
        "Eingangsspannung": "Wechselstrom 120/230 V (50/60 Hz)",
        "Einstellungen der Anzeigeposition": "H\u00f6he, Pivot (Rotation), Drehung, Neigung",
        "Energie Effizienzklasse": "D",
        "Farbunterst\u00fctzung": "16,7 Millionen Farben",
        "Ger\u00e4tetyp": "LED-hintergrundbeleuchteter LCD-Monitor - 61 cm (24\")",
        "Gewicht": "6.4 kg",
        "Helligkeit": "250 cd/m\u00b2",
        "Hintergrundbeleuchtungs-Technologie": "LED-Hintergrundbeleuchtung",
        "Horizontale Bildwiederholrate": "15 - 82 kHz",
        "Horizontaler Betrachtungswinkel": "178",
        "H\u00f6heneinstellung": "130 mm",
        "Integrierte Peripherieger\u00e4te": "USB 3.1 Hub",
        "Kennzeichnung": "FCC Klasse B bescheinigt, ICES-003, cTUVus, DisplayPort 1.2, Mexico Energy label, Mexico CoC",
        "Kontrast": "1000:1 / 50000000:1 (dynamisch)",
        "Leistungsmerkmale": "Slot f\u00fcr Sicherheitsschloss (Kabelschloss getrennt erh\u00e4ltlich)",
        "Max. Betriebstemperatur": "40 \u00b0C",
        "Min Betriebstemperatur": "0 \u00b0C",
        "Native Aufl\u00f6sung": "Full HD (1080p) 1920 x 1080",
        "Neigungswinkel": "-5/+40",
        "Produktbeschreibung": "ViewSonic VG2456 - LED-Monitor - Full HD (1080p) - 61 cm (24\") - mit integriertem Gigabit Ethernet",
        "Reaktionszeit": "15 ms (Grau-zu-Grau typisch); 5 ms (Grau-zu-Grau mit Overdrive)",
        "Rotationswinkel": "180",
        "Schlosstyp zur Diebstahlsicherung": "Kensington Slot",
        "Schnittstellen": "HDMI  DisplayPort  DisplayPort-Ausgang  USB-C 3.2 Gen 1  2 x USB 3.2 Gen 1 (Typ A)  USB 3.2 Gen 1 (Typ B)  Netzwerk (RJ-45)",
        "Schwenkwinkel": "120",
        "Seitenverh\u00e4ltnis": "16:9",
        "Sichtbare Bildfl\u00e4che": "60.5 cm (23.8\")",
        "Spannung": "Wechselstrom 120/230 V (50/60 Hz)",
        "Transportbreite": "59.5 cm",
        "Transportgewicht": "9.4 kg",
        "Transporth\u00f6he": "39.6 cm",
        "Transporttiefe": "21 cm",
        "Typ": "Lautsprecher - Stereo",
        "Umweltschutzstandards": "ENERGY STAR-qualifiziert",
        "VESA-Halterung": "100 x 100 mm",
        "Vertikale Bildwiederholrate": "24 - 75 Hz",
        "Vertikaler Betrachtungswinkel": "178",
        "Zul\u00e4ssige Luftfeuchtigkeit im Betrieb": "20 - 90% (nicht kondensierend)"
    },
    "raw_specifications_text": "Produktbeschreibung: ViewSonic VG2456 - LED-Monitor - Full HD (1080p) - 61 cm (24\") - mit integriertem Gigabit Ethernet\nGer\u00e4tetyp: LED-hintergrundbeleuchteter LCD-Monitor - 61 cm (24\")\nLeistungsmerkmale: Slot f\u00fcr Sicherheitsschloss (Kabelschloss getrennt erh\u00e4ltlich)\nBildschirmtyp: IPS\nSeitenverh\u00e4ltnis: 16:9\nNative Aufl\u00f6sung: Full HD (1080p) 1920 x 1080\nHelligkeit: 250 cd/m\u00b2\nEnergie Effizienzklasse: D\nKontrast: 1000:1 / 50000000:1 (dynamisch)\nReaktionszeit: 15 ms (Grau-zu-Grau typisch); 5 ms (Grau-zu-Grau mit Overdrive)\nFarbunterst\u00fctzung: 16,7 Millionen Farben\nEingangsanschl\u00fcsse: HDMI, DisplayPort, USB-C\nEinstellungen der Anzeigeposition: H\u00f6he, Pivot (Rotation), Drehung, Neigung\nSpannung: Wechselstrom 120/230 V (50/60 Hz)\nAbmessungen (Breite x Tiefe x H\u00f6he) - mit Fu\u00df: 53.9 cm x 20.2 cm x 40.62 cm\nGewicht: 6.4 kg\nUmweltschutzstandards: ENERGY STAR-qualifiziert\nKennzeichnung: FCC Klasse B bescheinigt, ICES-003, cTUVus, DisplayPort 1.2, Mexico Energy label, Mexico CoC\nDisplay-Typ: LED-hintergrundbeleuchteter LCD-Monitor / TFT-Aktivmatrix\nDiagonalabmessung: 61 cm (24\")\nSichtbare Bildfl\u00e4che: 60.5 cm (23.8\")\nIntegrierte Peripherieger\u00e4te: USB 3.1 Hub\nVertikale Bildwiederholrate: 24 - 75 Hz\nHorizontale Bildwiederholrate: 15 - 82 kHz\nHorizontaler Betrachtungswinkel: 178\nVertikaler Betrachtungswinkel: 178\nHintergrundbeleuchtungs-Technologie: LED-Hintergrundbeleuchtung\nBesonderheiten: Traggriff, SuperClear, integrierte Kabelf\u00fchrung, flimmerfreie Technologie, TMDS-Technologie (Transition Minimized Differential Signaling), Blaulichtfilter-Technologie, rahmeloses Blendendesign, Composite Sync, ViewMode\nAbmessungen (Breite x Tiefe x H\u00f6he): 53.9 cm x 20.2 cm x 40.62 cm - mit Fu\u00df\nTyp: Lautsprecher - Stereo\nAusgangsleistung/Kanal: 2 Watt\nSchnittstellen: HDMI  DisplayPort  DisplayPort-Ausgang  USB-C 3.2 Gen 1  2 x USB 3.2 Gen 1 (Typ A)  USB 3.2 Gen 1 (Typ B)  Netzwerk (RJ-45)\nNeigungswinkel: -5/+40\nSchwenkwinkel: 120\nRotationswinkel: 180\nH\u00f6heneinstellung: 130 mm\nVESA-Halterung: 100 x 100 mm\nSchlosstyp zur Diebstahlsicherung: Kensington Slot\nEingangsspannung: Wechselstrom 120/230 V (50/60 Hz)\nDetails zu Abmessungen & Gewicht: Mit Fu\u00df - Breite: 53.9 cm - Tiefe: 20.2 cm - H\u00f6he: 40.62 cm - Gewicht: 6.4 kg  Ohne Fu\u00df - Breite: 53.9 cm - Tiefe: 5.2 cm - H\u00f6he: 32 cm - Gewicht: 4 kg\nTransportbreite: 59.5 cm\nTransporttiefe: 21 cm\nTransporth\u00f6he: 39.6 cm\nTransportgewicht: 9.4 kg\nENERGY STAR zertifiziert: Ja\nMin Betriebstemperatur: 0 \u00b0C\nMax. Betriebstemperatur: 40 \u00b0C\nZul\u00e4ssige Luftfeuchtigkeit im Betrieb: 20 - 90% (nicht kondensierend)",
    "reference_file": "offer_reference_1290.json",
    "shop_name": "Jacob Elektronik direkt (AT)"
}