{
    "html_file": "offer_1891_0.html",
    "name": "Lenovo ThinkVision T24v-20, 23.8\"",
    "offer_link": "https://www.taufnaus.de/product/10605688",
    "price": 271.27,
    "raw_specifications": {
        "Abmessungen (Breite x Tiefe x H\u00f6he)": "53.98 cm x 20.5 cm x 43.4 cm - mit Fu\u00df",
        "Ausgangsleistung/Kanal": "3 Watt",
        "Besonderheiten": "Augenkomfort-Modus, NearEdgeless-Design an 3 Seiten",
        "Bildschirmbeschichtung": "Blendfrei",
        "Bildschirmtyp": "IPS",
        "Details zu Abmessungen & Gewicht": "Mit Standfu\u00df (niedrigste Position) - Breite: 53.98 cm - Tiefe: 20.5 cm - H\u00f6he: 43.4 cm - Gewicht: 5.94 kg \u00a6 Mit Standfu\u00df (h\u00f6chste Position) - Breite: 53.98 cm - Tiefe: 20.5 cm - H\u00f6he: 58.4 cm - Gewicht: 5.94 kg \u00a6 Ohne Fu\u00df - Breite: 53.98 cm - Tiefe: 4.835 cm - H\u00f6he: 34.43 cm - Gewicht: 3.48 kg",
        "Diagonalabmessung": "61 cm (24\")",
        "Display-Typ": "LED-hintergrundbeleuchteter LCD-Monitor / TFT-Aktivmatrix",
        "ENERGY STAR zertifiziert": "Ja",
        "ENERGY STAR-Version": "8.0",
        "EPEAT-kompatibel": "EPEAT Silver",
        "Eingangsspannung": "Wechselstrom 120/230 V (50/60 Hz)",
        "Einstellungen der Anzeigeposition": "H\u00f6he, Pivot (Rotation), Drehung, Neigung",
        "Energie Effizienzklasse": "Klasse C",
        "Energierverbrauch Sleep": "0.5 Watt",
        "Enthaltene Kabel": "1 x DisplayPort-Kabel - 1.8 m \u00a6 1 x USB-Kabel Typ A auf Typ B - 1.8 m",
        "Entwickelt f\u00fcr": "Lenovo ThinkPad P15 Gen 2 20YQ",
        "Farbe": "Raven Black",
        "Farbraum": "72% NTSC (CIE 1931)",
        "Farbunterst\u00fctzung": "16,7 Millionen Farben",
        "Gewicht": "5.94 kg",
        "Helligkeit": "250 cd/m\u00b2",
        "Hintergrundbeleuchtungs-Technologie": "WLED",
        "Horizontaler Betrachtungswinkel": "178",
        "H\u00f6heneinstellung": "150 mm",
        "Integrierte Peripherieger\u00e4te": "Mikrofon, USB 3.2 Gen 1 Hub",
        "Kennzeichnung": "CCC, TUV Rheinland Eye Comfort Certification, China Energy standard Tier 1, EU RoHS 2002/95/EC",
        "Kontrast": "1000:1 / 3000000:1 (dynamisch)",
        "Leistungsaufnahme im Ein-Zustand": "11.6 W",
        "Leistungsmerkmale": "Slot f\u00fcr Sicherheitsschloss (Kabelschloss getrennt erh\u00e4ltlich), integrierte Kabelf\u00fchrung, abnehmbarer St\u00e4nder",
        "Lokalisierung": "Englisch / Europa",
        "Native Aufl\u00f6sung": "Full HD (1080p) 1920 x 1080 bei 60 Hz",
        "Neigungswinkel": "-5/+35",
        "Pixelpitch": "0.2745 mm",
        "Ppi": "93",
        "Reaktionszeit": "14 ms, 6 ms, 4 ms (extremer Modus)",
        "Rotationswinkel": "180",
        "Schlosstyp zur Diebstahlsicherung": "Kensington Slot",
        "Schnittstellen": "VGA \u00a6 HDMI \u00a6 DisplayPort 1.2 \u00a6 USB 3.2 Gen 1 Downstream \u00a6 USB 3.2 Gen 1 Downstream (BC 1.2) \u00a6 USB 3.2 Gen 1 Upstream \u00a6 Kombinierter Kopfh\u00f6rer-/-Mikrofonstecker",
        "Schwenkwinkel": "90",
        "Seitenverh\u00e4ltnis": "16:9",
        "Service und Support": "Begrenzte Garantie - 3 Jahre",
        "Sichtbare Bildfl\u00e4che": "60.5 cm (23.8\")",
        "Stromverbrauch (Aus-Modus)": "0.3 Watt",
        "Stromverbrauch (typisch)": "13 Watt",
        "Stromverbrauch SDR (eingeschaltet)": "11.6 kWh/1.000 h",
        "TCO-zertifiziert": "TCO Certified Displays 8, TCO Certified Edge Displays",
        "Transportbreite": "64.4 cm",
        "Transportgewicht": "7.86 kg",
        "Transporth\u00f6he": "41.8 cm",
        "Transporttiefe": "18.7 cm",
        "Typ": "Mikrofon",
        "Vertikaler Betrachtungswinkel": "178"
    },
    "raw_specifications_text": "Display-Typ: LED-hintergrundbeleuchteter LCD-Monitor / TFT-Aktivmatrix\nEnergie Effizienzklasse: Klasse C\nDiagonalabmessung: 61 cm (24\")\nSichtbare Bildfl\u00e4che: 60.5 cm (23.8\")\nIntegrierte Peripherieger\u00e4te: Mikrofon, USB 3.2 Gen 1 Hub\nBildschirmtyp: IPS\nSeitenverh\u00e4ltnis: 16:9\nNative Aufl\u00f6sung: Full HD (1080p) 1920 x 1080 bei 60 Hz\nPixelpitch: 0.2745 mm\nPpi: 93\nHelligkeit: 250 cd/m\u00b2\nKontrast: 1000:1 / 3000000:1 (dynamisch)\nFarbunterst\u00fctzung: 16,7 Millionen Farben\nFarbraum: 72% NTSC (CIE 1931)\nReaktionszeit: 14 ms, 6 ms, 4 ms (extremer Modus)\nHorizontaler Betrachtungswinkel: 178\nVertikaler Betrachtungswinkel: 178\nBildschirmbeschichtung: Blendfrei\nHintergrundbeleuchtungs-Technologie: WLED\nBesonderheiten: Augenkomfort-Modus, NearEdgeless-Design an 3 Seiten\nFarbe: Raven Black\nAbmessungen (Breite x Tiefe x H\u00f6he): 53.98 cm x 20.5 cm x 43.4 cm - mit Fu\u00df\nGewicht: 5.94 kg\nTyp: Mikrofon\nAusgangsleistung/Kanal: 3 Watt\nSchnittstellen: VGA \u00a6 HDMI \u00a6 DisplayPort 1.2 \u00a6 USB 3.2 Gen 1 Downstream \u00a6 USB 3.2 Gen 1 Downstream (BC 1.2) \u00a6 USB 3.2 Gen 1 Upstream \u00a6 Kombinierter Kopfh\u00f6rer-/-Mikrofonstecker\nEinstellungen der Anzeigeposition: H\u00f6he, Pivot (Rotation), Drehung, Neigung\nNeigungswinkel: -5/+35\nSchwenkwinkel: 90\nRotationswinkel: 180\nH\u00f6heneinstellung: 150 mm\nLeistungsmerkmale: Slot f\u00fcr Sicherheitsschloss (Kabelschloss getrennt erh\u00e4ltlich), integrierte Kabelf\u00fchrung, abnehmbarer St\u00e4nder\nEnthaltene Kabel: 1 x DisplayPort-Kabel - 1.8 m \u00a6 1 x USB-Kabel Typ A auf Typ B - 1.8 m\nKennzeichnung: CCC, TUV Rheinland Eye Comfort Certification, China Energy standard Tier 1, EU RoHS 2002/95/EC\nLokalisierung: Englisch / Europa\nSchlosstyp zur Diebstahlsicherung: Kensington Slot\nEingangsspannung: Wechselstrom 120/230 V (50/60 Hz)\nLeistungsaufnahme im Ein-Zustand: 11.6 W\nStromverbrauch SDR (eingeschaltet): 11.6 kWh/1.000 h\nStromverbrauch (typisch): 13 Watt\nEnergierverbrauch Sleep: 0.5 Watt\nStromverbrauch (Aus-Modus): 0.3 Watt\nDetails zu Abmessungen & Gewicht: Mit Standfu\u00df (niedrigste Position) - Breite: 53.98 cm - Tiefe: 20.5 cm - H\u00f6he: 43.4 cm - Gewicht: 5.94 kg \u00a6 Mit Standfu\u00df (h\u00f6chste Position) - Breite: 53.98 cm - Tiefe: 20.5 cm - H\u00f6he: 58.4 cm - Gewicht: 5.94 kg \u00a6 Ohne Fu\u00df - Breite: 53.98 cm - Tiefe: 4.835 cm - H\u00f6he: 34.43 cm - Gewicht: 3.48 kg\nTransportbreite: 64.4 cm\nTransporttiefe: 18.7 cm\nTransporth\u00f6he: 41.8 cm\nTransportgewicht: 7.86 kg\nTCO-zertifiziert: TCO Certified Displays 8, TCO Certified Edge Displays\nEPEAT-kompatibel: EPEAT Silver\nENERGY STAR zertifiziert: Ja\nENERGY STAR-Version: 8.0\nService und Support: Begrenzte Garantie - 3 Jahre\nEntwickelt f\u00fcr: Lenovo ThinkPad P15 Gen 2 20YQ",
    "reference_file": "offer_reference_1891.json",
    "shop_name": "TaufNaus"
}