{
    "html_file": "offer_213_2.html",
    "name": "Samsung ViewFinity S8 S27B800PXP (2023), 27\"",
    "offer_link": "https://www.mylemon.at/artikel/samsung/ls27b800pxpxen/dis-27-s27b800pxp-ips.html",
    "price": 410.26,
    "raw_specifications": {
        "AC Eingangsspannung": "100 - 240 V",
        "Anzahl DisplayPort Anschl\u00fcsse": "1",
        "Anzahl HDMI-Anschl\u00fcsse": "2",
        "Anzahl der Farben des Displays": "1,07 Milliarden Farben",
        "Anzahl der Upstream-Ports USB Typ-C": "1",
        "Artikelnummer": "M1FYK2BL",
        "Aufl\u00f6sung": "3840x2160",
        "Besonderheiten": "60 Hz, USB HUB",
        "Betriebstemperatur": "10 - 40 \u00b0C",
        "Bild-in-Bild": "Ja",
        "Bildschirmdiagonale": "68,6 cm (27 Zoll)",
        "Bildschirmdiagonale (cm)": "68 cm",
        "Bildschirmform": "Flach",
        "Bildschirmtechnologie": "LED",
        "Bildwinkel, horizontal": "178\u00b0",
        "Bildwinkel, vertikal": "178\u00b0",
        "Breite (ohne Standfu\u00df)": "61,5 cm",
        "DVI Anschluss": "Nein",
        "Display-Aufl\u00f6sung": "3840 x 2160 Pixel",
        "Display-Oberfl\u00e4che": "Matt",
        "DisplayPorts-Version": "1.4",
        "Displaygr\u00f6\u00dfe": "27 Zoll",
        "EAN": "8806094926347",
        "Eingebaute Lautsprecher": "Nein",
        "Energieeffizienzklasse (HDR)": "F",
        "Energieverbrauch (HDR) pro 1.000 Stunden": "26 kWh",
        "Ergonomie": "H\u00f6henverstellbar, Pivot (90 Grad drehbar), Schwenkbar, Neigbar",
        "Farbskala": "98%",
        "Flimmerfreie Technologie": "Ja",
        "Ger\u00e4tebreite (inkl. Fu\u00df)": "615,5 mm",
        "Ger\u00e4teh\u00f6he (inkl. Fu\u00df)": "551,9 mm",
        "Ger\u00e4tetiefe (inkl. Fu\u00df)": "196,4 mm",
        "Gewicht (mit St\u00e4nder)": "6,7 kg",
        "Gewicht (ohne St\u00e4nder)": "4,7 kg",
        "HD-Typ": "4K Ultra HD",
        "HDCP": "Ja",
        "HDCP-Version": "2.2",
        "HDMI": "Ja",
        "Helligkeit": "350 cd/m\u00b2",
        "Helligkeit (typisch)": "350 cd/m\u00b2",
        "Hersteller Artikelnummer": "LS27B800PXPXEN",
        "High Dynamic Range Video (HDR) Unterst\u00fctzung": "Ja",
        "H\u00f6he (ohne Standfu\u00df)": "36,8 cm",
        "H\u00f6heneinstellung": "12 cm",
        "H\u00f6henverstellung": "Ja",
        "Integrierter USB-Hub": "Ja",
        "Kontrastverh\u00e4ltnis": "1000:1",
        "Kopfh\u00f6rerausgang": "Ja",
        "Marktpositionierung": "Haus",
        "Maximale Bildwiederholrate": "60 Hz",
        "Mitgelieferte Kabel": "HDMI, USB Typ-C",
        "Nachhaltigkeitszertifikate": "TCO",
        "Natives Seitenverh\u00e4ltnis": "16:9",
        "Neigungsverstellung": "Ja",
        "Paketgewicht": "8,4 kg",
        "Panel": "IPS",
        "Panel-Montage-Schnittstelle": "100 x 100 mm",
        "Panel-Typ": "IPS",
        "Pivot Winkel": "-2 - 90\u00b0",
        "Produktfarbe": "Schwarz",
        "RGB-Farbraum": "DCI-P3",
        "Reaktionszeit": "5 ms",
        "Relative Luftfeuchtigkeit in Betrieb": "10 - 80%",
        "Schwenkbar": "Ja",
        "Schwenkwinkelbereich": "-30 - 30\u00b0",
        "Spiel-Modus": "Ja",
        "Stromverbrauch (Standardbetrieb)": "26,1 W",
        "Stromverbrauch (aus)": "0,3 W",
        "Stromverbrauch (max.)": "170 W",
        "Technologie mit hohem Dynamikbereich (HDR)": "DisplayHDR 400",
        "Tiefe (ohne Standfu\u00df)": "4,27 cm",
        "Touchscreen": "Nein",
        "Unterst\u00fctzte Grafik-Aufl\u00f6sungen": "3840 x 2160",
        "VESA Halterung": "100x100 mm",
        "VESA-Halterung": "Ja",
        "Verpackungsbreite": "686 mm",
        "Verpackungsh\u00f6he": "171 mm",
        "Verpackungstiefe": "450 mm",
        "Video Anschl\u00fcsse": "1x HDMI, 1x DisplayPort, USB-C DisplayPort"
    },
    "raw_specifications_text": "Displaygr\u00f6\u00dfe: 27 Zoll\nAufl\u00f6sung: 3840x2160\nPanel: IPS\nReaktionszeit: 5 ms\nVideo Anschl\u00fcsse: 1x HDMI, 1x DisplayPort, USB-C DisplayPort\nErgonomie: H\u00f6henverstellbar, Pivot (90 Grad drehbar), Schwenkbar, Neigbar\nVESA Halterung: 100x100 mm\nHelligkeit: 350 cd/m\u00b2\nBesonderheiten: 60 Hz, USB HUB\nHersteller Artikelnummer: LS27B800PXPXEN\nEAN: 8806094926347\nArtikelnummer: M1FYK2BL\nBildschirmdiagonale: 68,6 cm (27 Zoll)\nDisplay-Aufl\u00f6sung: 3840 x 2160 Pixel\nNatives Seitenverh\u00e4ltnis: 16:9\nBildschirmtechnologie: LED\nTouchscreen: Nein\nHD-Typ: 4K Ultra HD\nPanel-Typ: IPS\nBildschirmform: Flach\nKontrastverh\u00e4ltnis: 1000:1\nMaximale Bildwiederholrate: 60 Hz\nAnzahl der Farben des Displays: 1,07 Milliarden Farben\nHelligkeit (typisch): 350 cd/m\u00b2\nDisplay-Oberfl\u00e4che: Matt\nUnterst\u00fctzte Grafik-Aufl\u00f6sungen: 3840 x 2160\nBildwinkel, horizontal: 178\u00b0\nBildwinkel, vertikal: 178\u00b0\nBildschirmdiagonale (cm): 68 cm\nHigh Dynamic Range Video (HDR) Unterst\u00fctzung: Ja\nTechnologie mit hohem Dynamikbereich (HDR): DisplayHDR 400\nRGB-Farbraum: DCI-P3\nFarbskala: 98%\nFlimmerfreie Technologie: Ja\nSpiel-Modus: Ja\nEingebaute Lautsprecher: Nein\nMarktpositionierung: Haus\nProduktfarbe: Schwarz\nIntegrierter USB-Hub: Ja\nHDMI: Ja\nKopfh\u00f6rerausgang: Ja\nAnzahl der Upstream-Ports USB Typ-C: 1\nDVI Anschluss: Nein\nAnzahl HDMI-Anschl\u00fcsse: 2\nAnzahl DisplayPort Anschl\u00fcsse: 1\nDisplayPorts-Version: 1.4\nHDCP: Ja\nHDCP-Version: 2.2\nVESA-Halterung: Ja\nH\u00f6henverstellung: Ja\nPanel-Montage-Schnittstelle: 100 x 100 mm\nH\u00f6heneinstellung: 12 cm\nPivot Winkel: -2 - 90\u00b0\nSchwenkbar: Ja\nSchwenkwinkelbereich: -30 - 30\u00b0\nBild-in-Bild: Ja\nNeigungsverstellung: Ja\nEnergieeffizienzklasse (HDR): F\nEnergieverbrauch (HDR) pro 1.000 Stunden: 26 kWh\nStromverbrauch (Standardbetrieb): 26,1 W\nStromverbrauch (max.): 170 W\nStromverbrauch (aus): 0,3 W\nAC Eingangsspannung: 100 - 240 V\nBetriebstemperatur: 10 - 40 \u00b0C\nRelative Luftfeuchtigkeit in Betrieb: 10 - 80%\nMitgelieferte Kabel: HDMI, USB Typ-C\nGer\u00e4tebreite (inkl. Fu\u00df): 615,5 mm\nGer\u00e4tetiefe (inkl. Fu\u00df): 196,4 mm\nGer\u00e4teh\u00f6he (inkl. Fu\u00df): 551,9 mm\nGewicht (mit St\u00e4nder): 6,7 kg\nBreite (ohne Standfu\u00df): 61,5 cm\nTiefe (ohne Standfu\u00df): 4,27 cm\nH\u00f6he (ohne Standfu\u00df): 36,8 cm\nGewicht (ohne St\u00e4nder): 4,7 kg\nVerpackungsbreite: 686 mm\nVerpackungstiefe: 450 mm\nVerpackungsh\u00f6he: 171 mm\nPaketgewicht: 8,4 kg\nNachhaltigkeitszertifikate: TCO",
    "reference_file": "offer_reference_213.json",
    "shop_name": "mylemon.at"
}