{
    "html_file": "offer_903_3.html",
    "name": "HP M27, 27\"",
    "offer_link": "https://www.alternate.at/HP/M27-Webcam-LED-Monitor/html/product/1819981?partner=AtGeizhalsat&campaign=Monitor/HP/1819981",
    "price": 294.0,
    "raw_specifications": {
        "": "AMD FreeSync, Kensington-Schloss",
        "Abmessungen": "Breite: 61,2 cm x H\u00f6he: 41,3 cm x Tiefe/L\u00e4nge: 48,2 cm",
        "Anschl\u00fcsse": "1x HDMI-Eingang, (HDMI-Version: 1.4), 1x DisplayPort-Eingang, (DisplayPort-Version: 1.2), 1x 3,5-mm-Audio-Ausgang, 2x USB-A-3.2 Gen 1 (5 Gbit/s), 1x USB-C 3.2 Gen 1 (5 Gbit/s)",
        "Bild": "Glaretyp",
        "Bildschirmaufl\u00f6sung": "1.920 x 1.080 Pixel",
        "Bildschirmdiagonale": "69 cm (27 Zoll)",
        "EAN": "0196068981402",
        "Energieeffizienzklasse (SDR)": "E (A - G)",
        "Energieverbauch pro 1000 Stunden (SDR)": "20 kWh",
        "Ergonomie": "Drehbar",
        "Farbe": "schwarz",
        "Features": "Flimmerfreie LEDs, Integrierte Webcam + Mikrofon, HP EyeSafe Funktion",
        "Frequenz": "Vertikal",
        "Gewicht": "7,3 kg",
        "Hersteller-Nr.": "459J9E9#ABB",
        "Lautsprecher": "2 Lautsprecher",
        "Leistungsaufnahme im Bereitschafts- und Aus-Zustand": "0,5 Watt",
        "Leistungsaufnahme im Ein-Zustand bei Standard-Dynamikumfang (SDR)": "20 Watt",
        "Stromversorgung": "Eco-Off",
        "Typ": "LED-Monitor",
        "Wandhalterung": "VESA kompatibel (100 x 100 mm)",
        "Zubeh\u00f6r": "Vorhanden"
    },
    "raw_specifications_text": "Energieeffizienzklasse (SDR): E (A - G)\nEnergieverbauch pro 1000 Stunden (SDR): 20 kWh\nLeistungsaufnahme im Ein-Zustand bei Standard-Dynamikumfang (SDR): 20 Watt\nLeistungsaufnahme im Bereitschafts- und Aus-Zustand: 0,5 Watt\nBildschirmdiagonale: 69 cm (27 Zoll)\nBildschirmaufl\u00f6sung: 1.920 x 1.080 Pixel\nTyp: LED-Monitor\nFarbe: schwarz\nEAN: 0196068981402\nHersteller-Nr.: 459J9E9#ABB\nBild: Glaretyp\n: AMD FreeSync, Kensington-Schloss\nFrequenz: Vertikal\nAnschl\u00fcsse: 1x HDMI-Eingang, (HDMI-Version: 1.4), 1x DisplayPort-Eingang, (DisplayPort-Version: 1.2), 1x 3,5-mm-Audio-Ausgang, 2x USB-A-3.2 Gen 1 (5 Gbit/s), 1x USB-C 3.2 Gen 1 (5 Gbit/s)\nErgonomie: Drehbar\nStromversorgung: Eco-Off\nLautsprecher: 2 Lautsprecher\nWandhalterung: VESA kompatibel (100 x 100 mm)\nFeatures: Flimmerfreie LEDs, Integrierte Webcam + Mikrofon, HP EyeSafe Funktion\nZubeh\u00f6r: Vorhanden\nAbmessungen: Breite: 61,2 cm x H\u00f6he: 41,3 cm x Tiefe/L\u00e4nge: 48,2 cm\nGewicht: 7,3 kg",
    "reference_file": "offer_reference_903.json",
    "shop_name": "Alternate.at"
}