{
    "html_file": "offer_1157_10.html",
    "name": "ViewSonic VG2740V, 27\"",
    "offer_link": "https://direkt.jacob.de/produkte/viewsonic-vg2740v-68-6cm-vg2740v-artnr-7177931.html?utm_source=geizhals&utm_medium=cpc&utm_campaign=Preisvergleich&ref=103",
    "price": 222.52,
    "raw_specifications": {
        "AC Eingangsfrequenz": "50/60 Hz",
        "AC Eingangsspannung": "100 - 240 V",
        "Anzahl DisplayPort Anschl\u00fcsse": "1",
        "Anzahl HDMI-Anschl\u00fcsse": "1",
        "Anzahl VGA (D-Sub) Anschl\u00fcsse": "1",
        "Anzahl der Farben des Displays": "16,7 Millionen Farben",
        "Anzahl der Lautsprecher": "2",
        "Anzahl der Upstream-Ports USB Typ-B": "1",
        "Anzahl der nachgeschalteten Steckpl\u00e4tze vom Typ USB-A": "3",
        "Audioanschl\u00fcsse": "Ja",
        "Audioausgang": "Ja",
        "Bildschirmaufl\u00f6sung": "1920 x 1080 Pixel",
        "Bildschirmdiagonale": "68,6 cm (27\" )",
        "Bildschirmform": "Flach",
        "Bildschirmtechnologie": "LED",
        "Blendfreier Bildschirm": "Ja",
        "Blickwinkel, horizontal": "178\u00b0",
        "Blickwinkel, vertikal": "178\u00b0",
        "Breite (ohne Standfu\u00df)": "62,1 cm",
        "Eingebaute Lautsprecher": "Ja",
        "Eingebautes Mikrofon": "Ja",
        "Energie Effizienzklasse": "D",
        "Farbintensit\u00e4t": "8 Bit",
        "Farbskala": "76%",
        "Flimmerfreie Technologie": "Ja",
        "Ger\u00e4tebreite (inkl. Fu\u00df)": "621 mm",
        "Ger\u00e4teh\u00f6he (inkl. Fu\u00df)": "425,6 mm",
        "Ger\u00e4tetiefe (inkl. Fu\u00df)": "206 mm",
        "Gewicht (mit St\u00e4nder)": "7,2 kg",
        "Gewicht (ohne St\u00e4nder)": "4,8 kg",
        "HD-Typ": "Full HD",
        "HDMI": "Ja",
        "HDMI-Version": "1.4",
        "Helligkeit (typisch)": "300 cd/m\u00b2",
        "Horizontaler Scanbereich": "15 - 82 kHz",
        "H\u00f6he (ohne Standfu\u00df)": "38,9 cm",
        "H\u00f6heneinstellung": "13 cm",
        "H\u00f6henverstellung": "Ja",
        "Integrierte Kamera": "Ja",
        "Integrierter USB-Hub": "Ja",
        "Kabelsperre-Slot": "Ja",
        "Kamerabildpunkte": "2 MP",
        "Kontrastverh\u00e4ltnis": "1000:1",
        "Kontrastverh\u00e4ltnis (dynamisch)": "80000000:1",
        "Kopfh\u00f6rerausgang": "Ja",
        "Kopfh\u00f6rerausg\u00e4nge": "1",
        "Low-Blue-Light-Technologie": "Ja",
        "Maximale Bildwiederholrate": "60 Hz",
        "Mitgelieferte Kabel": "AC, Audio (3,5 mm), HDMI, USB Typ-A auf USB Typ-B",
        "NTSC Abdeckung (typisch)": "72%",
        "Nachhaltigkeitszertifikate": "CE, ENERGY STAR, EPEAT Silver, ErP, REACH, RoHS, WEEE",
        "Natives Seitenverh\u00e4ltnis": "16:9",
        "Neigungswinkelbereich": "5 - 40\u00b0",
        "Paketgewicht": "10,2 kg",
        "Panel-Montage-Schnittstelle": "100 x 100 mm",
        "Panel-Typ": "IPS",
        "Pivot": "Ja",
        "Pivot Winkel": "0 - 90\u00b0",
        "Pixel Abstand": "0,311 x 0,311 mm",
        "RGB-Farbraum": "Adobe RGB",
        "RMS-Leistung": "4 W",
        "Reaktionszeit": "5 ms",
        "Relative Luftfeuchtigkeit in Betrieb": "20 - 90%",
        "Schnellstart\u00fcbersicht": "Ja",
        "Slot-Typ Kabelsperre": "Kensington",
        "Stromeingang": "Ja",
        "Stromverbrauch (Standardbetrieb)": "26,14 W",
        "Stromverbrauch (Standby)": "0,5 W",
        "Stromverbrauch (max.)": "32,5 W",
        "St\u00e4nder enthalten": "Ja",
        "Temperaturbereich in Betrieb": "0 - 40 \u00b0C",
        "Tiefe (ohne Standfu\u00df)": "5,5 cm",
        "USB-Hub-Version": "3.2 Gen 2 (3.1 Gen 2)",
        "USB-Upstream-Porttyp": "USB Typ-B",
        "VESA-Halterung": "Ja",
        "Vertikaler Scanbereich": "50 - 75 Hz",
        "kippbar": "Ja",
        "sRGB Abdeckung (klassisch)": "102%"
    },
    "raw_specifications_text": "Bildschirmdiagonale: 68,6 cm (27\" )\nBildschirmaufl\u00f6sung: 1920 x 1080 Pixel\nNatives Seitenverh\u00e4ltnis: 16:9\nPanel-Typ: IPS\nEnergie Effizienzklasse: D\nHD-Typ: Full HD\nBildschirmtechnologie: LED\nBildschirmform: Flach\nKontrastverh\u00e4ltnis: 1000:1\nMaximale Bildwiederholrate: 60 Hz\nAnzahl der Farben des Displays: 16,7 Millionen Farben\nHelligkeit (typisch): 300 cd/m\u00b2\nReaktionszeit: 5 ms\nBlendfreier Bildschirm: Ja\nKontrastverh\u00e4ltnis (dynamisch): 80000000:1\nBlickwinkel, horizontal: 178\u00b0\nBlickwinkel, vertikal: 178\u00b0\nPixel Abstand: 0,311 x 0,311 mm\nHorizontaler Scanbereich: 15 - 82 kHz\nVertikaler Scanbereich: 50 - 75 Hz\nFarbintensit\u00e4t: 8 Bit\nRGB-Farbraum: Adobe RGB\nFarbskala: 76%\nsRGB Abdeckung (klassisch): 102%\nNTSC Abdeckung (typisch): 72%\nFlimmerfreie Technologie: Ja\nLow-Blue-Light-Technologie: Ja\nEingebaute Lautsprecher: Ja\nIntegrierte Kamera: Ja\nAnzahl der Lautsprecher: 2\nRMS-Leistung: 4 W\nKamerabildpunkte: 2 MP\nEingebautes Mikrofon: Ja\nIntegrierter USB-Hub: Ja\nHDMI: Ja\nKopfh\u00f6rerausgang: Ja\nUSB-Hub-Version: 3.2 Gen 2 (3.1 Gen 2)\nUSB-Upstream-Porttyp: USB Typ-B\nAnzahl der Upstream-Ports USB Typ-B: 1\nAnzahl der nachgeschalteten Steckpl\u00e4tze vom Typ USB-A: 3\nAnzahl VGA (D-Sub) Anschl\u00fcsse: 1\nAnzahl HDMI-Anschl\u00fcsse: 1\nHDMI-Version: 1.4\nAnzahl DisplayPort Anschl\u00fcsse: 1\nAudioanschl\u00fcsse: Ja\nAudioausgang: Ja\nKopfh\u00f6rerausg\u00e4nge: 1\nStromeingang: Ja\nVESA-Halterung: Ja\nKabelsperre-Slot: Ja\nH\u00f6henverstellung: Ja\nPanel-Montage-Schnittstelle: 100 x 100 mm\nSlot-Typ Kabelsperre: Kensington\nH\u00f6heneinstellung: 13 cm\nPivot: Ja\nPivot Winkel: 0 - 90\u00b0\nkippbar: Ja\nNeigungswinkelbereich: 5 - 40\u00b0\nStromverbrauch (Standardbetrieb): 26,14 W\nStromverbrauch (Standby): 0,5 W\nStromverbrauch (max.): 32,5 W\nAC Eingangsspannung: 100 - 240 V\nAC Eingangsfrequenz: 50/60 Hz\nTemperaturbereich in Betrieb: 0 - 40 \u00b0C\nRelative Luftfeuchtigkeit in Betrieb: 20 - 90%\nNachhaltigkeitszertifikate: CE, ENERGY STAR, EPEAT Silver, ErP, REACH, RoHS, WEEE\nGer\u00e4tebreite (inkl. Fu\u00df): 621 mm\nGer\u00e4tetiefe (inkl. Fu\u00df): 206 mm\nGer\u00e4teh\u00f6he (inkl. Fu\u00df): 425,6 mm\nGewicht (mit St\u00e4nder): 7,2 kg\nBreite (ohne Standfu\u00df): 62,1 cm\nTiefe (ohne Standfu\u00df): 5,5 cm\nH\u00f6he (ohne Standfu\u00df): 38,9 cm\nGewicht (ohne St\u00e4nder): 4,8 kg\nSt\u00e4nder enthalten: Ja\nMitgelieferte Kabel: AC, Audio (3,5 mm), HDMI, USB Typ-A auf USB Typ-B\nSchnellstart\u00fcbersicht: Ja\nPaketgewicht: 10,2 kg",
    "reference_file": "offer_reference_1157.json",
    "shop_name": "Jacob Elektronik direkt (AT)"
}