{
    "html_file": "offer_1136_19.html",
    "name": "ASUS TUF Gaming VG27AQZ, 27\"",
    "offer_link": "https://www.hiq24.de/shop/artikel/312770/?sPartner=geizhals",
    "price": 352.9,
    "raw_specifications": {
        "Abmessungen (Breite x Tiefe x H\u00f6he)": "62 cm x 21.1 cm x 37.7 cm - mit Fu\u00df",
        "Abmessungen (Breite x Tiefe x H\u00f6he) - mit Fu\u00df": "62 cm x 21.1 cm x 37.7 cm",
        "Adaptive-Sync Technologie": "NVIDIA G-SYNC Compatible",
        "Ausgangsleistung/Kanal": "2 Watt",
        "Besonderheiten": "HDCP, Trace Free Technology, ASUS GamePlus, ASUS GameVisual Technology, Dark Boost-Technologie, Low Blue Light-Technologie, Shadow Boost-Technologie, ASUS Extreme Low Motion Blur Sync, ELMB SYNC, HDR-Modus optische Aufwertung",
        "Bildschirmbeschichtung": "Blendfrei",
        "Bildschirmtyp": "IPS",
        "Details zu Abmessungen & Gewicht": "Mit Fu\u00df - Breite: 62 cm - Tiefe: 21.1 cm - H\u00f6he: 37.7 cm - Gewicht: 5.8 kg  Ohne Fu\u00df - Breite: 62 cm - Tiefe: 6.6 cm - H\u00f6he: 36.3 cm - Gewicht: 3.5 kg",
        "Diagonalabmessung": "68.6 cm (27\")",
        "Display-Typ": "LED-hintergrundbeleuchteter LCD-Monitor / TFT-Aktivmatrix",
        "Eingangsanschl\u00fcsse": "2xHDMI, DisplayPort",
        "Eingangsspannung": "Wechselstrom 100-240 V (50/60 Hz)",
        "Einstellungen der Anzeigeposition": "H\u00f6he, Pivot (Rotation), Drehung, Neigung",
        "Energie Effizienzklasse": "Klasse G",
        "Energieklasse (HDR)": "Klasse G",
        "Farbraum": "100% sRGB",
        "Farbunterst\u00fctzung": "16,7 Millionen Farben",
        "Gaming": "Ja",
        "Ger\u00e4tetyp": "LED-hintergrundbeleuchteter LCD-Monitor - 68.6 cm (27\")",
        "Gewicht": "5.8 kg",
        "HDR-Format": "HDR10",
        "HDR-f\u00e4hig": "HDR10",
        "Helligkeit": "350 cd/m\u00b2",
        "Hintergrundbeleuchtungs-Technologie": "LED-Hintergrundbeleuchtung",
        "Horizontale Bildwiederholrate": "30 - 243 kHz",
        "Horizontaler Betrachtungswinkel": "178",
        "H\u00f6heneinstellung": "130 mm",
        "Integrierte Peripherieger\u00e4te": "Stereo-Lautsprecher",
        "Kennzeichnung": "TUV Rheinland Low Blue Light Certification, TUV Rheinland Flicker Free Certification, DisplayPort 1.2",
        "Kontrast": "1000:1",
        "Leistungsmerkmale": "Stereo-Lautsprecher",
        "Native Aufl\u00f6sung": "WQHD 2560 x 1440 (DisplayPort: 165 Hz, HDMI: 144 Hz)",
        "Neigungswinkel": "-5/+33",
        "Pixelpitch": "0.233 mm",
        "Produktbeschreibung": "ASUS TUF Gaming VG27AQZ - LED-Monitor - 68.6 cm (27\") - HDR",
        "Reaktionszeit": "1 ms (MPRT)",
        "Rotationswinkel": "90",
        "Schnittstellen": "2 x HDMI  DisplayPort",
        "Schwenkwinkel": "180",
        "Seitenverh\u00e4ltnis": "16:9",
        "Spannung": "Wechselstrom 100-240 V (50/60 Hz)",
        "Stromverbrauch (Aus-Modus)": "0.5 Watt",
        "Stromverbrauch (typisch)": "27 Watt",
        "Stromverbrauch HDR (eingeschaltet)": "40.2 kWh/1.000 h",
        "Stromverbrauch SDR (eingeschaltet)": "32.1 kWh/1.000 h",
        "Stromverbrauch im Standby-Modus": "0.5 Watt",
        "Transportbreite": "70.4 cm",
        "Transportgewicht": "8 kg",
        "Transporth\u00f6he": "46.4 cm",
        "Transporttiefe": "21 cm",
        "Typ": "Lautsprecher - Stereo",
        "VESA-Halterung": "100 x 100 mm",
        "Vertikale Bildwiederholrate": "48 - 155 Hz",
        "Vertikaler Betrachtungswinkel": "178"
    },
    "raw_specifications_text": "Display-Typ: LED-hintergrundbeleuchteter LCD-Monitor / TFT-Aktivmatrix\nEnergie Effizienzklasse: Klasse G\nEnergieklasse (HDR): Klasse G\nDiagonalabmessung: 68.6 cm (27\")\nAdaptive-Sync Technologie: NVIDIA G-SYNC Compatible\nIntegrierte Peripherieger\u00e4te: Stereo-Lautsprecher\nBildschirmtyp: IPS\nSeitenverh\u00e4ltnis: 16:9\nNative Aufl\u00f6sung: WQHD 2560 x 1440 (DisplayPort: 165 Hz, HDMI: 144 Hz)\nPixelpitch: 0.233 mm\nHelligkeit: 350 cd/m\u00b2\nKontrast: 1000:1\nHDR-Format: HDR10\nFarbunterst\u00fctzung: 16,7 Millionen Farben\nFarbraum: 100% sRGB\nReaktionszeit: 1 ms (MPRT)\nVertikale Bildwiederholrate: 48 - 155 Hz\nHorizontale Bildwiederholrate: 30 - 243 kHz\nGaming: Ja\nHorizontaler Betrachtungswinkel: 178\nVertikaler Betrachtungswinkel: 178\nBildschirmbeschichtung: Blendfrei\nHintergrundbeleuchtungs-Technologie: LED-Hintergrundbeleuchtung\nBesonderheiten: HDCP, Trace Free Technology, ASUS GamePlus, ASUS GameVisual Technology, Dark Boost-Technologie, Low Blue Light-Technologie, Shadow Boost-Technologie, ASUS Extreme Low Motion Blur Sync, ELMB SYNC, HDR-Modus optische Aufwertung\nAbmessungen (Breite x Tiefe x H\u00f6he): 62 cm x 21.1 cm x 37.7 cm - mit Fu\u00df\nGewicht: 5.8 kg\nTyp: Lautsprecher - Stereo\nAusgangsleistung/Kanal: 2 Watt\nSchnittstellen: 2 x HDMI  DisplayPort\nEinstellungen der Anzeigeposition: H\u00f6he, Pivot (Rotation), Drehung, Neigung\nNeigungswinkel: -5/+33\nSchwenkwinkel: 180\nRotationswinkel: 90\nH\u00f6heneinstellung: 130 mm\nVESA-Halterung: 100 x 100 mm\nKennzeichnung: TUV Rheinland Low Blue Light Certification, TUV Rheinland Flicker Free Certification, DisplayPort 1.2\nEingangsspannung: Wechselstrom 100-240 V (50/60 Hz)\nStromverbrauch SDR (eingeschaltet): 32.1 kWh/1.000 h\nStromverbrauch HDR (eingeschaltet): 40.2 kWh/1.000 h\nStromverbrauch (typisch): 27 Watt\nStromverbrauch im Standby-Modus: 0.5 Watt\nStromverbrauch (Aus-Modus): 0.5 Watt\nDetails zu Abmessungen & Gewicht: Mit Fu\u00df - Breite: 62 cm - Tiefe: 21.1 cm - H\u00f6he: 37.7 cm - Gewicht: 5.8 kg  Ohne Fu\u00df - Breite: 62 cm - Tiefe: 6.6 cm - H\u00f6he: 36.3 cm - Gewicht: 3.5 kg\nTransportbreite: 70.4 cm\nTransporttiefe: 21 cm\nTransporth\u00f6he: 46.4 cm\nTransportgewicht: 8 kg\nProduktbeschreibung: ASUS TUF Gaming VG27AQZ - LED-Monitor - 68.6 cm (27\") - HDR\nGer\u00e4tetyp: LED-hintergrundbeleuchteter LCD-Monitor - 68.6 cm (27\")\nLeistungsmerkmale: Stereo-Lautsprecher\nHDR-f\u00e4hig: HDR10\nEingangsanschl\u00fcsse: 2xHDMI, DisplayPort\nSpannung: Wechselstrom 100-240 V (50/60 Hz)\nAbmessungen (Breite x Tiefe x H\u00f6he) - mit Fu\u00df: 62 cm x 21.1 cm x 37.7 cm",
    "reference_file": "offer_reference_1136.json",
    "shop_name": "HiQ24"
}