{
    "html_file": "offer_1746_11.html",
    "name": "ASUS ROG Strix XG32VC, 31.5\"",
    "offer_link": "https://www.alternate.at/ASUS/ROG-Strix-XG32VC-Gaming-Monitor/html/product/1680121?partner=AtGeizhalsat&campaign=Monitor/ASUS/1680121",
    "price": 527.0,
    "raw_specifications": {
        "": "VESA DisplayHDR Standard",
        "Abmessungen": "Breite: 71,3 cm x H\u00f6he: 55,2 cm x Tiefe/L\u00e4nge: 27,9 cm",
        "Anschl\u00fcsse": "1x HDMI-Eingang, (HDMI-Version: 2.0), 1x DisplayPort-Eingang, (DisplayPort-Version: 1.2), 1x Kopfh\u00f6rer-Ausgang, 1x USB-C 3.2 Gen 1 (5 Gbit/s)",
        "Beleuchtung": "Ja, RGB",
        "Bild": "Glaretyp",
        "Bildschirmaufl\u00f6sung": "2.560 x 1.440 Pixel",
        "Bildschirmdiagonale": "80 cm (32 Zoll)",
        "EAN": "4718017790536",
        "Energieeffizienzklasse (HDR)": "G (A - G)",
        "Energieeffizienzklasse (SDR)": "G (A - G)",
        "Energieverbauch pro 1000 Stunden (HDR)": "55 kWh",
        "Energieverbauch pro 1000 Stunden (SDR)": "41 kWh",
        "Ergonomie": "Typ",
        "Farbe": "schwarz",
        "Features": "ASUS Extreme Low Motion Blur (ELMB), KVM-Switch, Flicker-Free LED, Blue Light Filter, ASUS AuraSync",
        "Frequenz": "Vertikal",
        "Geeignet f\u00fcr": "Gaming",
        "Gewicht": "9,3 kg",
        "Hersteller-Nr.": "90LM03S0-B04170",
        "Leistungsaufnahme im Bereitschafts- und Aus-Zustand": "0,24 Watt",
        "Leistungsaufnahme im Ein-Zustand bei Standard-Dynamikumfang (SDR)": "40,8 Watt",
        "Leistungsaufnahme im Ein-Zustand bei hohem Dynamikumfang (HDR)": "55 Watt",
        "Serie": "ROG Strix",
        "Stromversorgung": "Eco-Off",
        "Typ": "Gaming-Monitor",
        "Weitere Informationen": "Die max. Bildwiederholrate von 170 Hz wird durch \u00dcbertaktung erreicht"
    },
    "raw_specifications_text": "Energieeffizienzklasse (SDR): G (A - G)\nEnergieverbauch pro 1000 Stunden (SDR): 41 kWh\nEnergieeffizienzklasse (HDR): G (A - G)\nEnergieverbauch pro 1000 Stunden (HDR): 55 kWh\nLeistungsaufnahme im Ein-Zustand bei Standard-Dynamikumfang (SDR): 40,8 Watt\nLeistungsaufnahme im Ein-Zustand bei hohem Dynamikumfang (HDR): 55 Watt\nLeistungsaufnahme im Bereitschafts- und Aus-Zustand: 0,24 Watt\nBildschirmdiagonale: 80 cm (32 Zoll)\nBildschirmaufl\u00f6sung: 2.560 x 1.440 Pixel\nTyp: Gaming-Monitor\nFarbe: schwarz\nEAN: 4718017790536\nHersteller-Nr.: 90LM03S0-B04170\nSerie: ROG Strix\nGeeignet f\u00fcr: Gaming\nBild: Glaretyp\n: VESA DisplayHDR Standard\nFrequenz: Vertikal\nBeleuchtung: Ja, RGB\nAnschl\u00fcsse: 1x HDMI-Eingang, (HDMI-Version: 2.0), 1x DisplayPort-Eingang, (DisplayPort-Version: 1.2), 1x Kopfh\u00f6rer-Ausgang, 1x USB-C 3.2 Gen 1 (5 Gbit/s)\nErgonomie: Typ\nStromversorgung: Eco-Off\nFeatures: ASUS Extreme Low Motion Blur (ELMB), KVM-Switch, Flicker-Free LED, Blue Light Filter, ASUS AuraSync\nWeitere Informationen: Die max. Bildwiederholrate von 170 Hz wird durch \u00dcbertaktung erreicht\nAbmessungen: Breite: 71,3 cm x H\u00f6he: 55,2 cm x Tiefe/L\u00e4nge: 27,9 cm\nGewicht: 9,3 kg",
    "reference_file": "offer_reference_1746.json",
    "shop_name": "Alternate.at"
}