{
    "html_file": "offer_1931_17.html",
    "name": "AOC Q24P2Q, 23.8\"",
    "offer_link": "https://www.alternate.at/AOC/Q24P2Q-LED-Monitor/html/product/1650398?partner=AtGeizhalsat&campaign=Monitor/AOC/1650398",
    "price": 204.9,
    "raw_specifications": {
        "": "Ausgangsleistung",
        "Abmessungen": "Breite: 54,02 cm x H\u00f6he: 51,3 cm x Tiefe/L\u00e4nge: 20,01 cm",
        "Anschl\u00fcsse": "1x HDMI-Eingang, (HDMI-Version: 1.4), 1x DisplayPort-Eingang, (DisplayPort-Version: 1.2), 1x 3,5-mm-Audio-Eingang, 1x 3,5-mm-Audio-Ausgang, 4x USB-A-3.2 Gen 1 (5 Gbit/s)",
        "Bild": "Glaretyp",
        "Bildschirmaufl\u00f6sung": "2.560 x 1.440 Pixel",
        "Bildschirmdiagonale": "60 cm (24 Zoll)",
        "EAN": "4038986147316",
        "Energieeffizienzklasse (SDR)": "E (A - G)",
        "Energieverbauch pro 1000 Stunden (SDR)": "18 kWh",
        "Ergonomie": "Typ",
        "Farbe": "schwarz",
        "Features": "Flicker-Free LED",
        "Frequenz": "Vertikal",
        "Gewicht": "4,7 kg",
        "Hersteller-Nr.": "Q24P2Q",
        "Lautsprecher": "2 Lautsprecher",
        "Leistungsaufnahme im Bereitschafts- und Aus-Zustand": "0,5 Watt",
        "Leistungsaufnahme im Ein-Zustand bei Standard-Dynamikumfang (SDR)": "18,4 Watt",
        "Standards": "Video",
        "Stromversorgung": "Eco-Off",
        "Typ": "LED-Monitor",
        "Wandhalterung": "VESA kompatibel (100 x 100 mm)",
        "Zubeh\u00f6r": "Vorhanden"
    },
    "raw_specifications_text": "Energieeffizienzklasse (SDR): E (A - G)\nEnergieverbauch pro 1000 Stunden (SDR): 18 kWh\nLeistungsaufnahme im Ein-Zustand bei Standard-Dynamikumfang (SDR): 18,4 Watt\nLeistungsaufnahme im Bereitschafts- und Aus-Zustand: 0,5 Watt\nBildschirmdiagonale: 60 cm (24 Zoll)\nBildschirmaufl\u00f6sung: 2.560 x 1.440 Pixel\nTyp: LED-Monitor\nFarbe: schwarz\nEAN: 4038986147316\nHersteller-Nr.: Q24P2Q\nBild: Glaretyp\n: Ausgangsleistung\nFrequenz: Vertikal\nAnschl\u00fcsse: 1x HDMI-Eingang, (HDMI-Version: 1.4), 1x DisplayPort-Eingang, (DisplayPort-Version: 1.2), 1x 3,5-mm-Audio-Eingang, 1x 3,5-mm-Audio-Ausgang, 4x USB-A-3.2 Gen 1 (5 Gbit/s)\nErgonomie: Typ\nStromversorgung: Eco-Off\nLautsprecher: 2 Lautsprecher\nStandards: Video\nWandhalterung: VESA kompatibel (100 x 100 mm)\nFeatures: Flicker-Free LED\nZubeh\u00f6r: Vorhanden\nAbmessungen: Breite: 54,02 cm x H\u00f6he: 51,3 cm x Tiefe/L\u00e4nge: 20,01 cm\nGewicht: 4,7 kg",
    "reference_file": "offer_reference_1931.json",
    "shop_name": "Alternate.at"
}