{
    "html_file": "offer_683_12.html",
    "name": "AOC U34G3XM/EU, 34\"",
    "offer_link": "https://www.csv-direct.de/artinfo.php?artnr=A1621403&KATEGORIE=162&pva=geizhals2",
    "price": 315.74,
    "raw_specifications": {
        "AMD FreeSync Bildwiederholratenbereich": "48 - 144 Hz",
        "AMD FreeSync-Typ": "FreeSync Premium",
        "Anzahl DisplayPort Anschl\u00fcsse": "1",
        "Anzahl HDMI-Anschl\u00fcsse": "2",
        "Anzahl OSD-Sprachen": "19",
        "Anzahl der Farben des Displays": "16,7 Millionen Farben",
        "Au\u00dfenverkleidungstyp": "Matt",
        "Bildschirmdiagonale": "86,4 cm 34\"",
        "Bildschirmdiagonale cm": "86,4 cm",
        "Bildschirmform": "Flach",
        "Bildschirmtechnologie": "LED",
        "Bildwinkel, horizontal": "178\u00b0",
        "Bildwinkel, vertikal": "178\u00b0",
        "Breite ohne Standfu\u00df": "817,4 mm",
        "Display-Aufl\u00f6sung": "3440 x 1440 Pixel",
        "DisplayPort Kabell\u00e4nge": "1,8 m",
        "DisplayPorts-Version": "1.4",
        "Farbpalette DCI-P3": "93",
        "Fu\u00dffarbe": "Schwarz",
        "Ger\u00e4tebreite inkl. Fu\u00df": "529,4 mm",
        "Ger\u00e4teh\u00f6he inkl. Fu\u00df": "817,4 mm",
        "Ger\u00e4tetiefe inkl. Fu\u00df": "339,6 mm",
        "Gewicht mit St\u00e4nder": "7,78 kg",
        "HD-Typ": "UltraWide Quad HD",
        "HDMI-Kabell\u00e4nge": "1,8 m",
        "HDMI-Version": "2.0",
        "Helligkeit typisch": "300 cd/m\u00b2",
        "H\u00f6he ohne Standfu\u00df": "370,7 mm",
        "H\u00f6heneinstellung": "13 cm",
        "Integrierte Kamera": "Nein",
        "Integrierter USB-Hub": "Nein",
        "Kontrastverh\u00e4ltnis": "3000:1",
        "Kopfh\u00f6rer-Anschluss": "3,5 mm",
        "Kopfh\u00f6rerausg\u00e4nge": "1",
        "Marktpositionierung": "Gaming",
        "Maximale Bildwiederholrate": "144 Hz",
        "Men\u00fcsprachen": "Vereinfachtes Chinesisch, Traditionelles Chinesisch, Kroatisch, Tschechisch, Deutsch, Niederl\u00e4ndisch, Englisch, Spanisch, Finnisch, Franz\u00f6sisch, Italienisch, Japanisch, Koreanisch, Polnisch, Portugiesisch, Russisch, Schwedisch, T\u00fcrkisch, Ukrainisch",
        "Mitgelieferte Kabel": "AC",
        "Natives Seitenverh\u00e4ltnis": "21:9",
        "Neigungswinkelbereich": "-5 - 23\u00b0",
        "Netzteiltyp": "Intern",
        "Paketgewicht": "11,1 kg",
        "Panel-Montage-Schnittstelle": "100 x 100 mm",
        "Panel-Typ": "VA",
        "Pixeldichte": "110 ppi",
        "Produktfarbe": "Schwarz, Rot",
        "Reaktionszeit": "1 ms",
        "Schwenkwinkelbereich": "-24 - 24\u00b0",
        "Slot-Typ Kabelsperre": "Kensington",
        "Stromverbrauch Standardbetrieb": "35 W",
        "Stromverbrauch Standby": "0,5 W",
        "Stromverbrauch aus": "0,3 W",
        "Technologie mit hohem Dynamikbereich HDR": "High Dynamic Range 10 HDR10",
        "Tiefe ohne Standfu\u00df": "55,7 mm",
        "Touchscreen": "Nein",
        "Typ der Hintergrundbeleuchtung": "W-LED",
        "USB-Stromversorgung bis zu": "90 W",
        "Verpackungsart": "Box",
        "Verpackungsbreite": "900 mm",
        "Verpackungsh\u00f6he": "528 mm",
        "Verpackungstiefe": "224 mm",
        "Vorderer Rahmen": "Schwarz/Rot",
        "Zertifizierung": "ISO 9241-307",
        "sRGB Abdeckung klassisch": "100"
    },
    "raw_specifications_text": "Bildschirmdiagonale: 86,4 cm 34\"\nDisplay-Aufl\u00f6sung: 3440 x 1440 Pixel\nNatives Seitenverh\u00e4ltnis: 21:9\nBildschirmtechnologie: LED\nTouchscreen: Nein\nHD-Typ: UltraWide Quad HD\nPanel-Typ: VA\nBildschirmform: Flach\nKontrastverh\u00e4ltnis: 3000:1\nMaximale Bildwiederholrate: 144 Hz\nAnzahl der Farben des Displays: 16,7 Millionen Farben\nTyp der Hintergrundbeleuchtung: W-LED\nHelligkeit typisch: 300 cd/m\u00b2\nReaktionszeit: 1 ms\nBildwinkel, horizontal: 178\u00b0\nBildwinkel, vertikal: 178\u00b0\nPixeldichte: 110 ppi\nBildschirmdiagonale cm: 86,4 cm\nTechnologie mit hohem Dynamikbereich HDR: High Dynamic Range 10 HDR10\nsRGB Abdeckung klassisch: 100\nAMD FreeSync-Typ: FreeSync Premium\nAMD FreeSync Bildwiederholratenbereich: 48 - 144 Hz\nIntegrierte Kamera: Nein\nMarktpositionierung: Gaming\nProduktfarbe: Schwarz, Rot\nVorderer Rahmen: Schwarz/Rot\nFu\u00dffarbe: Schwarz\nZertifizierung: ISO 9241-307\nIntegrierter USB-Hub: Nein\nUSB-Stromversorgung bis zu: 90 W\nAnzahl HDMI-Anschl\u00fcsse: 2\nHDMI-Version: 2.0\nAnzahl DisplayPort Anschl\u00fcsse: 1\nDisplayPorts-Version: 1.4\nKopfh\u00f6rerausg\u00e4nge: 1\nKopfh\u00f6rer-Anschluss: 3,5 mm\nPanel-Montage-Schnittstelle: 100 x 100 mm\nSlot-Typ Kabelsperre: Kensington\nH\u00f6heneinstellung: 13 cm\nSchwenkwinkelbereich: -24 - 24\u00b0\nNeigungswinkelbereich: -5 - 23\u00b0\nMen\u00fcsprachen: Vereinfachtes Chinesisch, Traditionelles Chinesisch, Kroatisch, Tschechisch, Deutsch, Niederl\u00e4ndisch, Englisch, Spanisch, Finnisch, Franz\u00f6sisch, Italienisch, Japanisch, Koreanisch, Polnisch, Portugiesisch, Russisch, Schwedisch, T\u00fcrkisch, Ukrainisch\nAnzahl OSD-Sprachen: 19\nStromverbrauch Standardbetrieb: 35 W\nStromverbrauch Standby: 0,5 W\nStromverbrauch aus: 0,3 W\nNetzteiltyp: Intern\nMitgelieferte Kabel: AC\nDisplayPort Kabell\u00e4nge: 1,8 m\nHDMI-Kabell\u00e4nge: 1,8 m\nGer\u00e4tebreite inkl. Fu\u00df: 529,4 mm\nGer\u00e4tetiefe inkl. Fu\u00df: 339,6 mm\nGer\u00e4teh\u00f6he inkl. Fu\u00df: 817,4 mm\nGewicht mit St\u00e4nder: 7,78 kg\nBreite ohne Standfu\u00df: 817,4 mm\nTiefe ohne Standfu\u00df: 55,7 mm\nH\u00f6he ohne Standfu\u00df: 370,7 mm\nVerpackungsbreite: 900 mm\nVerpackungstiefe: 224 mm\nVerpackungsh\u00f6he: 528 mm\nPaketgewicht: 11,1 kg\nVerpackungsart: Box\nFarbpalette DCI-P3: 93\nAu\u00dfenverkleidungstyp: Matt",
    "reference_file": "offer_reference_683.json",
    "shop_name": "CSV-Direct.de"
}