{
    "html_file": "offer_996_6.html",
    "name": "ASUS ZenScreen MB165B, 15.6\"",
    "offer_link": "https://www.mylemon.at/artikel/asus/90lm0703_b01170/15-6-l-mb165b.html",
    "price": 141.89,
    "raw_specifications": {
        "Anzahl der Farben des Displays": "260000 colours",
        "Artikelnummer": "M18YN8KL",
        "Aufl\u00f6sung": "1366x768",
        "Bildschirmdiagonale": "39,6 cm (15.6 Zoll)",
        "Bildschirmdiagonale (cm)": "39,62 cm",
        "Bildschirmform": "Flach",
        "Bildschirmtechnologie": "LCD",
        "Bildwinkel, horizontal": "90\u00b0",
        "Bildwinkel, vertikal": "65\u00b0",
        "Blendfreier Bildschirm": "Ja",
        "Display-Aufl\u00f6sung": "1366 x 768 Pixel",
        "Displaygr\u00f6\u00dfe": "15,6 Zoll",
        "EAN": "4711081160151",
        "Eingebaute Lautsprecher": "Nein",
        "Energieeffizienzklasse (SDR)": "B",
        "Energieverbrauch (SDR) pro 1.000 Stunden": "6 kWh",
        "Ergonomie": "Pivot (90 Grad drehbar)",
        "Ger\u00e4tebreite (inkl. Fu\u00df)": "360,1 mm",
        "Ger\u00e4teh\u00f6he (inkl. Fu\u00df)": "225,6 mm",
        "Ger\u00e4tetiefe (inkl. Fu\u00df)": "11,8 mm",
        "Gewicht (mit St\u00e4nder)": "780 g",
        "HD-Typ": "WXGA",
        "HDCP": "Ja",
        "HDMI": "Nein",
        "Helligkeit": "220 cd/m\u00b2",
        "Helligkeit (typisch)": "220 cd/m\u00b2",
        "Hersteller Artikelnummer": "90LM0703-B01170",
        "Integrierte Kamera": "Nein",
        "Integrierter USB-Hub": "Nein",
        "Kontrastverh\u00e4ltnis": "500:1",
        "Kopfh\u00f6rerausgang": "Nein",
        "LED-Anzeigen": "Ja",
        "Maximale Bildwiederholrate": "60 Hz",
        "Mitgelieferte Kabel": "USB",
        "Natives Seitenverh\u00e4ltnis": "16:9",
        "Paketgewicht": "1,65 kg",
        "Panel-Typ": "TN",
        "Pixel Abstand": "0,252 x 0,252 mm",
        "Produktfarbe": "Schwarz",
        "Reaktionszeit": "10 ms",
        "Schnellstart\u00fcbersicht": "Ja",
        "Sichtbare Gr\u00f6\u00dfe (horizontal)": "34,4 cm",
        "Sichtbare Gr\u00f6\u00dfe (vertikal)": "19,4 cm",
        "Stromverbrauch (Standardbetrieb)": "7 W",
        "Stromverbrauch (Standby)": "0,5 W",
        "Stromverbrauch (aus)": "0,3 W",
        "Touchscreen": "Nein",
        "Typ der Hintergrundbeleuchtung": "LED",
        "USB-Version": "2.0/3.2 Gen 1 (3.1 Gen 1)",
        "Ursprungsland": "China",
        "Verpackungsbreite": "297 mm",
        "Verpackungsh\u00f6he": "57 mm",
        "Verpackungstiefe": "435 mm",
        "Video Anschl\u00fcsse": "1x USB",
        "Warentarifnummer (HS)": "85285210"
    },
    "raw_specifications_text": "Displaygr\u00f6\u00dfe: 15,6 Zoll\nAufl\u00f6sung: 1366x768\nVideo Anschl\u00fcsse: 1x USB\nErgonomie: Pivot (90 Grad drehbar)\nHelligkeit: 220 cd/m\u00b2\nHersteller Artikelnummer: 90LM0703-B01170\nEAN: 4711081160151\nArtikelnummer: M18YN8KL\nBildschirmdiagonale: 39,6 cm (15.6 Zoll)\nDisplay-Aufl\u00f6sung: 1366 x 768 Pixel\nNatives Seitenverh\u00e4ltnis: 16:9\nBildschirmtechnologie: LCD\nTouchscreen: Nein\nHD-Typ: WXGA\nPanel-Typ: TN\nBildschirmform: Flach\nKontrastverh\u00e4ltnis: 500:1\nMaximale Bildwiederholrate: 60 Hz\nAnzahl der Farben des Displays: 260000 colours\nTyp der Hintergrundbeleuchtung: LED\nHelligkeit (typisch): 220 cd/m\u00b2\nReaktionszeit: 10 ms\nBlendfreier Bildschirm: Ja\nBildwinkel, horizontal: 90\u00b0\nBildwinkel, vertikal: 65\u00b0\nPixel Abstand: 0,252 x 0,252 mm\nSichtbare Gr\u00f6\u00dfe (horizontal): 34,4 cm\nSichtbare Gr\u00f6\u00dfe (vertikal): 19,4 cm\nBildschirmdiagonale (cm): 39,62 cm\nEingebaute Lautsprecher: Nein\nIntegrierte Kamera: Nein\nProduktfarbe: Schwarz\nUrsprungsland: China\nIntegrierter USB-Hub: Nein\nHDMI: Nein\nKopfh\u00f6rerausgang: Nein\nUSB-Version: 2.0/3.2 Gen 1 (3.1 Gen 1)\nHDCP: Ja\nLED-Anzeigen: Ja\nEnergieeffizienzklasse (SDR): B\nEnergieverbrauch (SDR) pro 1.000 Stunden: 6 kWh\nStromverbrauch (Standardbetrieb): 7 W\nStromverbrauch (Standby): 0,5 W\nStromverbrauch (aus): 0,3 W\nMitgelieferte Kabel: USB\nSchnellstart\u00fcbersicht: Ja\nGer\u00e4tebreite (inkl. Fu\u00df): 360,1 mm\nGer\u00e4tetiefe (inkl. Fu\u00df): 11,8 mm\nGer\u00e4teh\u00f6he (inkl. Fu\u00df): 225,6 mm\nGewicht (mit St\u00e4nder): 780 g\nVerpackungsbreite: 297 mm\nVerpackungstiefe: 435 mm\nVerpackungsh\u00f6he: 57 mm\nPaketgewicht: 1,65 kg\nWarentarifnummer (HS): 85285210",
    "reference_file": "offer_reference_996.json",
    "shop_name": "mylemon.at"
}