{
    "html_file": "offer_1701_16.html",
    "name": "Philips B-line 325B1L, 31.5\"",
    "offer_link": "https://www.alternate.at/Philips/325B1L-00-LED-Monitor/html/product/1686979?partner=AtGeizhalsat&campaign=Monitor/Philips/1686979",
    "price": 290.0,
    "raw_specifications": {
        "": "Adaptive-Sync",
        "Abmessungen": "Breite: 73 cm x H\u00f6he: 62 cm x Tiefe/L\u00e4nge: 25 cm",
        "Anschl\u00fcsse": "1x HDMI-Eingang, (HDMI-Version: 1.4), 1x DisplayPort-Eingang, (DisplayPort-Version: 1.2), 1x 3,5-mm-Audio-Ausgang, 4x USB-A-3.2 Gen 1 (5 Gbit/s), 1x USB-B",
        "Bild": "Format",
        "Bildschirmaufl\u00f6sung": "2.560 x 1.440 Pixel",
        "Bildschirmdiagonale": "80 cm (31,5 Zoll)",
        "EAN": "8712581768119",
        "Energieeffizienzklasse (SDR)": "G (A - G)",
        "Energieverbauch pro 1000 Stunden (SDR)": "38 kWh",
        "Farbe": "schwarz",
        "Features": "Flimmerfreie LEDs, SmartImage Funktion, EasyRead Modus, LowBlue Modus, PowerSensor. LightSensor",
        "Frequenz": "Vertikal",
        "Geeignet f\u00fcr": "Business",
        "Gewicht": "10,7 kg",
        "Hersteller-Nr.": "325B1L/00",
        "Lautsprecher": "2 Lautsprecher",
        "Leistungsaufnahme im Bereitschafts- und Aus-Zustand": "0,5 Watt",
        "Leistungsaufnahme im Ein-Zustand bei Standard-Dynamikumfang (SDR)": "38 Watt",
        "Serie": "B-Line",
        "Standards": "Video",
        "Stromversorgung": "Eco-Off",
        "Typ": "LED-Monitor",
        "Wandhalterung": "VESA kompatibel (100 x 100 mm)",
        "Zubeh\u00f6r": "Vorhanden"
    },
    "raw_specifications_text": "Energieeffizienzklasse (SDR): G (A - G)\nEnergieverbauch pro 1000 Stunden (SDR): 38 kWh\nLeistungsaufnahme im Ein-Zustand bei Standard-Dynamikumfang (SDR): 38 Watt\nLeistungsaufnahme im Bereitschafts- und Aus-Zustand: 0,5 Watt\nBildschirmdiagonale: 80 cm (31,5 Zoll)\nBildschirmaufl\u00f6sung: 2.560 x 1.440 Pixel\nTyp: LED-Monitor\nFarbe: schwarz\nEAN: 8712581768119\nHersteller-Nr.: 325B1L/00\nSerie: B-Line\nGeeignet f\u00fcr: Business\nBild: Format\n: Adaptive-Sync\nFrequenz: Vertikal\nAnschl\u00fcsse: 1x HDMI-Eingang, (HDMI-Version: 1.4), 1x DisplayPort-Eingang, (DisplayPort-Version: 1.2), 1x 3,5-mm-Audio-Ausgang, 4x USB-A-3.2 Gen 1 (5 Gbit/s), 1x USB-B\nStromversorgung: Eco-Off\nLautsprecher: 2 Lautsprecher\nStandards: Video\nWandhalterung: VESA kompatibel (100 x 100 mm)\nFeatures: Flimmerfreie LEDs, SmartImage Funktion, EasyRead Modus, LowBlue Modus, PowerSensor. LightSensor\nZubeh\u00f6r: Vorhanden\nAbmessungen: Breite: 73 cm x H\u00f6he: 62 cm x Tiefe/L\u00e4nge: 25 cm\nGewicht: 10,7 kg",
    "reference_file": "offer_reference_1701.json",
    "shop_name": "Alternate.at"
}