{
    "html_file": "offer_939_16.html",
    "name": "ASUS ROG Strix XG309CM, 29.5\"",
    "offer_link": "https://www.ditech.at/details.php?artnr=347347",
    "price": 579.9,
    "raw_specifications": {
        "AMD FreeSync Premium": "Ja",
        "Adaptive Sync": "Ja",
        "Anschl\u00fcsse - DisplayPort 1.2 220Hz@2560x1080": "1",
        "Anschl\u00fcsse - HDMI 2.0 200Hz@2560x1080": "1",
        "Anschl\u00fcsse - USB-C 3.0 mit DisplayPort 1.2 220Hz@2560x1080": "1",
        "Anwendung": "station\u00e4r",
        "Audio": "Lautsprecher (2x 2W),  1x Line-Out",
        "Aufl\u00f6sung": "2560x1080",
        "Beschichtung": "matt (non-glare)",
        "Besonderheiten": "Slim Bezel,  USB-C Power Delivery (15W),  mechanische Tasten mit Steuerkreuz,  Sicherheitsschloss (Kensington),  Beleuchtung im Standfu\u00df (RGB),  KVM-Switch,  HDCP 2.2,  Werkskalibrierung (Delta-E <2)",
        "Bildwiederholfrequenz": "220Hz",
        "Blickwinkel": "178\u00b0/178\u00b0",
        "Diagonale": "29.5\"/74.9cm",
        "Energieeffizienzklasse HDR (A bis G)": "G",
        "Energieverbrauch HDR": "50kWh/1000h",
        "Energieverbrauch SDR": "32kWh/1000h",
        "Ergonomie": "110mm (h\u00f6henverstellbar),  N/A (Pivot),  \u00b125\u00b0 (drehbar),  +20\u00b0/-5\u00b0 (neigbar),  keine Angabe (Schr\u00e4glage)",
        "FRC": "unbekannt",
        "Farbe": "schwarz",
        "Farbraum - sRGB": "110%",
        "Farbtiefe": "8bit (16.7 Mio. Farben)",
        "Form": "gerade (flat)",
        "Gewicht": "7.50kg (mit Standfu\u00df),  4.56kg (ohne Standfu\u00df)",
        "HDR": "HDR10",
        "Helligkeit": "300cd/m\u00b2",
        "Herstellergarantie": "drei Jahre",
        "Hintergrundbeleuchtung": "White-LED,  flicker-free,  Blaulichtfilter",
        "Kontrast - statisch": "1.000:1",
        "Lautsprecher": "Ja",
        "Leistungsaufnahme": "keine Angabe (maximal),  28W (typisch),  keine Angabe (Energielabel alt A+++ bis G),  0.5W (Standby)",
        "Panel": "IPS",
        "Reaktionszeit - GtG": "1ms",
        "Screen-to-Body-Ratio": "88.6% (berechnet)",
        "Seitenverh\u00e4ltnis": "21:9",
        "Signalfrequenz": "30-250kHz (horizontal),  48-220Hz (vertikal)",
        "Stromversorgung": "DC-In (externes Netzteil)",
        "USB-Hub In": "1x USB-B 3.0,  1x USB-C 3.0 mit DisplayPort 1.4",
        "USB-Hub Out": "2x USB-A 3.0",
        "USB-Schreibweise": "Link",
        "Unsch\u00e4rfereduktionsfunktion": "ASUS Extreme Low Motion Blur Sync (ELMB SYNC)",
        "VESA": "100x100 (belegt)",
        "Weitere Anschl\u00fcsse": "N/A"
    },
    "raw_specifications_text": "Adaptive Sync: Ja\nAMD FreeSync Premium: Ja\nAnschl\u00fcsse - DisplayPort 1.2 220Hz@2560x1080: 1\nAnschl\u00fcsse - HDMI 2.0 200Hz@2560x1080: 1\nAnschl\u00fcsse - USB-C 3.0 mit DisplayPort 1.2 220Hz@2560x1080: 1\nAnwendung: station\u00e4r\nAudio: Lautsprecher (2x 2W),  1x Line-Out\nAufl\u00f6sung: 2560x1080\nBeschichtung: matt (non-glare)\nBesonderheiten: Slim Bezel,  USB-C Power Delivery (15W),  mechanische Tasten mit Steuerkreuz,  Sicherheitsschloss (Kensington),  Beleuchtung im Standfu\u00df (RGB),  KVM-Switch,  HDCP 2.2,  Werkskalibrierung (Delta-E <2)\nBildwiederholfrequenz: 220Hz\nBlickwinkel: 178\u00b0/178\u00b0\nDiagonale: 29.5\"/74.9cm\nEnergieeffizienzklasse HDR (A bis G): G\nEnergieverbrauch HDR: 50kWh/1000h\nEnergieverbrauch SDR: 32kWh/1000h\nErgonomie: 110mm (h\u00f6henverstellbar),  N/A (Pivot),  \u00b125\u00b0 (drehbar),  +20\u00b0/-5\u00b0 (neigbar),  keine Angabe (Schr\u00e4glage)\nFarbe: schwarz\nFarbraum - sRGB: 110%\nFarbtiefe: 8bit (16.7 Mio. Farben)\nForm: gerade (flat)\nFRC: unbekannt\nGewicht: 7.50kg (mit Standfu\u00df),  4.56kg (ohne Standfu\u00df)\nHDR: HDR10\nHelligkeit: 300cd/m\u00b2\nHerstellergarantie: drei Jahre\nHintergrundbeleuchtung: White-LED,  flicker-free,  Blaulichtfilter\nKontrast - statisch: 1.000:1\nLautsprecher: Ja\nLeistungsaufnahme: keine Angabe (maximal),  28W (typisch),  keine Angabe (Energielabel alt A+++ bis G),  0.5W (Standby)\nPanel: IPS\nReaktionszeit - GtG: 1ms\nScreen-to-Body-Ratio: 88.6% (berechnet)\nSeitenverh\u00e4ltnis: 21:9\nSignalfrequenz: 30-250kHz (horizontal),  48-220Hz (vertikal)\nStromversorgung: DC-In (externes Netzteil)\nUnsch\u00e4rfereduktionsfunktion: ASUS Extreme Low Motion Blur Sync (ELMB SYNC)\nUSB-Hub In: 1x USB-B 3.0,  1x USB-C 3.0 mit DisplayPort 1.4\nUSB-Hub Out: 2x USB-A 3.0\nUSB-Schreibweise: Link\nVESA: 100x100 (belegt)\nWeitere Anschl\u00fcsse: N/A",
    "reference_file": "offer_reference_939.json",
    "shop_name": "DiTech.at"
}