{
    "html_file": "offer_840_20.html",
    "name": "ASUS TUF Gaming VG248Q1B, 24\"",
    "offer_link": "https://www.csv-direct.de/artinfo.php?artnr=AGX1570898&KATEGORIE=162&pva=geizhals2",
    "price": 171.69,
    "raw_specifications": {
        "AMD FreeSync-Typ": "FreeSync Premium",
        "Anzahl DisplayPort Anschl\u00fcsse": "1",
        "Anzahl HDMI-Anschl\u00fcsse": "2",
        "Anzahl der Farben des Displays": "16,7 Millionen Farben",
        "Bildschirmdiagonale": "61 cm 24\"",
        "Bildschirmform": "Flach",
        "Bildschirmtechnologie": "LED",
        "Bildwinkel, horizontal": "170\u00b0",
        "Bildwinkel, vertikal": "160\u00b0",
        "Breite ohne Standfu\u00df": "571,2 mm",
        "Digital horizontale Frequenz": "200 - 200 kHz",
        "Digital vertikale Frequenz": "48 - 165 Hz",
        "Display-Aufl\u00f6sung": "1920 x 1080 Pixel",
        "DisplayPorts-Version": "1.2",
        "Dynamisches Kontrastverh\u00e4ltnis Marketingbezeichnung": "ASUS Smart Contrast Ratio ASCR",
        "Energieeffizienzklasse SDR": "E",
        "Energieeffizienzskala": "A bis G",
        "Energieverbrauch SDR pro 1.000 Stunden": "18 kWh",
        "Ger\u00e4tebreite inkl. Fu\u00df": "571,2 mm",
        "Ger\u00e4teh\u00f6he inkl. Fu\u00df": "407,1 mm",
        "Ger\u00e4tetiefe inkl. Fu\u00df": "174 mm",
        "Gewicht mit St\u00e4nder": "3,8 kg",
        "Gewicht ohne St\u00e4nder": "3,32 kg",
        "HD-Typ": "Full HD",
        "HDCP-Version": "1.4",
        "HDMI-Version": "1.4",
        "Helligkeit typisch": "350 cd/m\u00b2",
        "Horizontaler Scanbereich": "30 - 180 kHz",
        "H\u00f6he ohne Standfu\u00df": "341,5 mm",
        "H\u00f6henverstellung": "Nein",
        "Kontrastverh\u00e4ltnis": "1000:1",
        "Kontrastverh\u00e4ltnis dynamisch": "100000000:1",
        "Kopfh\u00f6rerausg\u00e4nge": "1",
        "Marktpositionierung": "Gaming",
        "Maximale Bildwiederholrate": "165 Hz",
        "Natives Seitenverh\u00e4ltnis": "16:9",
        "Neigungswinkelbereich": "-5 - 15\u00b0",
        "Paketgewicht": "5,4 kg",
        "Panel-Montage-Schnittstelle": "100 x 100 mm",
        "Panel-Typ": "TN",
        "Pixel Abstand": "0,2768 x 0,2768 mm",
        "Produktfarbe": "Schwarz",
        "Reaktionszeit schnell": "0,5 ms",
        "Sichtbare Gr\u00f6\u00dfe horizontal": "29,9 cm",
        "Sichtbare Gr\u00f6\u00dfe vertikal": "53,1 cm",
        "Slot-Typ Kabelsperre": "Kensington",
        "Stromverbrauch PowerSave": "0,5 W",
        "Stromverbrauch Standardbetrieb": "16 W",
        "Stromverbrauch aus": "0,3 W",
        "Tiefe ohne Standfu\u00df": "51,7 mm",
        "Touchscreen": "Nein",
        "Typ der Hintergrundbeleuchtung": "LED",
        "Verpackungsart": "Box",
        "Verpackungsbreite": "637 mm",
        "Verpackungsh\u00f6he": "164 mm",
        "Verpackungstiefe": "412 mm",
        "Vertikaler Scanbereich": "48 - 144 Hz",
        "Zertifizierung": "T\u00dcV Flicker-freeT\u00dcV Low Blue LightAMD FreeSync Premium"
    },
    "raw_specifications_text": "Bildschirmdiagonale: 61 cm 24\"\nDisplay-Aufl\u00f6sung: 1920 x 1080 Pixel\nNatives Seitenverh\u00e4ltnis: 16:9\nBildschirmtechnologie: LED\nTouchscreen: Nein\nHD-Typ: Full HD\nPanel-Typ: TN\nBildschirmform: Flach\nKontrastverh\u00e4ltnis: 1000:1\nMaximale Bildwiederholrate: 165 Hz\nAnzahl der Farben des Displays: 16,7 Millionen Farben\nTyp der Hintergrundbeleuchtung: LED\nHelligkeit typisch: 350 cd/m\u00b2\nKontrastverh\u00e4ltnis dynamisch: 100000000:1\nDynamisches Kontrastverh\u00e4ltnis Marketingbezeichnung: ASUS Smart Contrast Ratio ASCR\nBildwinkel, horizontal: 170\u00b0\nBildwinkel, vertikal: 160\u00b0\nReaktionszeit schnell: 0,5 ms\nPixel Abstand: 0,2768 x 0,2768 mm\nHorizontaler Scanbereich: 30 - 180 kHz\nVertikaler Scanbereich: 48 - 144 Hz\nSichtbare Gr\u00f6\u00dfe horizontal: 29,9 cm\nSichtbare Gr\u00f6\u00dfe vertikal: 53,1 cm\nDigital horizontale Frequenz: 200 - 200 kHz\nDigital vertikale Frequenz: 48 - 165 Hz\nAMD FreeSync-Typ: FreeSync Premium\nMarktpositionierung: Gaming\nProduktfarbe: Schwarz\nZertifizierung: T\u00dcV Flicker-freeT\u00dcV Low Blue LightAMD FreeSync Premium\nAnzahl HDMI-Anschl\u00fcsse: 2\nHDMI-Version: 1.4\nAnzahl DisplayPort Anschl\u00fcsse: 1\nDisplayPorts-Version: 1.2\nKopfh\u00f6rerausg\u00e4nge: 1\nHDCP-Version: 1.4\nH\u00f6henverstellung: Nein\nPanel-Montage-Schnittstelle: 100 x 100 mm\nSlot-Typ Kabelsperre: Kensington\nNeigungswinkelbereich: -5 - 15\u00b0\nEnergieeffizienzklasse SDR: E\nEnergieverbrauch SDR pro 1.000 Stunden: 18 kWh\nStromverbrauch Standardbetrieb: 16 W\nStromverbrauch aus: 0,3 W\nStromverbrauch PowerSave: 0,5 W\nEnergieeffizienzskala: A bis G\nGer\u00e4tebreite inkl. Fu\u00df: 571,2 mm\nGer\u00e4tetiefe inkl. Fu\u00df: 174 mm\nGer\u00e4teh\u00f6he inkl. Fu\u00df: 407,1 mm\nGewicht mit St\u00e4nder: 3,8 kg\nBreite ohne Standfu\u00df: 571,2 mm\nTiefe ohne Standfu\u00df: 51,7 mm\nH\u00f6he ohne Standfu\u00df: 341,5 mm\nGewicht ohne St\u00e4nder: 3,32 kg\nVerpackungsbreite: 637 mm\nVerpackungstiefe: 412 mm\nVerpackungsh\u00f6he: 164 mm\nPaketgewicht: 5,4 kg\nVerpackungsart: Box",
    "reference_file": "offer_reference_840.json",
    "shop_name": "CSV-Direct.de"
}