{
    "html_file": "offer_411_33.html",
    "name": "LG 32UP55NP-W, 31.5\"",
    "offer_link": "https://www.alternate.at/LG/32UP55NP-W-Gaming-Monitor/html/product/1913721?partner=AtGeizhalsat&campaign=Monitor/LG/1913721",
    "price": 393.0,
    "raw_specifications": {
        "": "H\u00f6henverstellbar",
        "Abmessungen": "Breite: 71,47 cm x H\u00f6he: 48,56 cm x Tiefe/L\u00e4nge: 23,93 cm",
        "Anschl\u00fcsse": "2x HDMI-Eingang, 1x DisplayPort-Eingang, (DisplayPort-Version: 1.4), 1x 3,5-mm-Audio-Ausgang, 2x USB-A-3.2 Gen 1 (5 Gbit/s), 1x USB-C 3.2 Gen 2 (10 Gbit/s)",
        "Bild": "Glaretyp",
        "Bildschirmaufl\u00f6sung": "3.840 x 2.160 Pixel",
        "Bildschirmdiagonale": "80 cm (31,5 Zoll)",
        "EAN": "8806087975031",
        "Energieeffizienzklasse (HDR)": "G (A - G)",
        "Energieeffizienzklasse (SDR)": "G (A - G)",
        "Energieverbauch pro 1000 Stunden (HDR)": "52 kWh",
        "Energieverbauch pro 1000 Stunden (SDR)": "33 kWh",
        "Ergonomie": "Typ",
        "Farbe": "schwarz/silber",
        "Features": "AMD FreeSync",
        "Frequenz": "Vertikal",
        "Geeignet f\u00fcr": "Gaming, Multimedia",
        "Gewicht": "8,4 kg",
        "Hersteller-Nr.": "32UP55NP-W.AEU",
        "Leistungsaufnahme im Bereitschafts- und Aus-Zustand": "0,5 Watt",
        "Leistungsaufnahme im Ein-Zustand bei Standard-Dynamikumfang (SDR)": "32,7 Watt",
        "Leistungsaufnahme im Ein-Zustand bei hohem Dynamikumfang (HDR)": "51.9 Watt",
        "Standards": "Video",
        "Stromversorgung": "Mobil (Externes 12V-Netzteil)",
        "Typ": "Gaming-Monitor",
        "Wandhalterung": "VESA kompatibel (100 x 100 mm)",
        "Weitere Informationen": "Ma\u00dfe ohne Standfu\u00df: 714,3 x 420,0 x 45,7 (BxHxT) | Gewicht ohne Standfu\u00df: 6700 Gramm | der USB-C-Anschluss unterst\u00fctzt DisplayPort Alt. Mode  mit DisplayPort-Version 1.4 und bis zu 90 Watt Ladeleistung | HDR10, MAXXAudio, Dynamic Action Sync, Black Stabilizer,",
        "Zubeh\u00f6r": "Vorhanden"
    },
    "raw_specifications_text": "Energieeffizienzklasse (SDR): G (A - G)\nEnergieverbauch pro 1000 Stunden (SDR): 33 kWh\nEnergieeffizienzklasse (HDR): G (A - G)\nEnergieverbauch pro 1000 Stunden (HDR): 52 kWh\nLeistungsaufnahme im Ein-Zustand bei Standard-Dynamikumfang (SDR): 32,7 Watt\nLeistungsaufnahme im Ein-Zustand bei hohem Dynamikumfang (HDR): 51.9 Watt\nLeistungsaufnahme im Bereitschafts- und Aus-Zustand: 0,5 Watt\nBildschirmdiagonale: 80 cm (31,5 Zoll)\nBildschirmaufl\u00f6sung: 3.840 x 2.160 Pixel\nTyp: Gaming-Monitor\nFarbe: schwarz/silber\nEAN: 8806087975031\nHersteller-Nr.: 32UP55NP-W.AEU\nGeeignet f\u00fcr: Gaming, Multimedia\nBild: Glaretyp\n: H\u00f6henverstellbar\nFrequenz: Vertikal\nAnschl\u00fcsse: 2x HDMI-Eingang, 1x DisplayPort-Eingang, (DisplayPort-Version: 1.4), 1x 3,5-mm-Audio-Ausgang, 2x USB-A-3.2 Gen 1 (5 Gbit/s), 1x USB-C 3.2 Gen 2 (10 Gbit/s)\nErgonomie: Typ\nStromversorgung: Mobil (Externes 12V-Netzteil)\nStandards: Video\nWandhalterung: VESA kompatibel (100 x 100 mm)\nFeatures: AMD FreeSync\nWeitere Informationen: Ma\u00dfe ohne Standfu\u00df: 714,3 x 420,0 x 45,7 (BxHxT) | Gewicht ohne Standfu\u00df: 6700 Gramm | der USB-C-Anschluss unterst\u00fctzt DisplayPort Alt. Mode  mit DisplayPort-Version 1.4 und bis zu 90 Watt Ladeleistung | HDR10, MAXXAudio, Dynamic Action Sync, Black Stabilizer,\nZubeh\u00f6r: Vorhanden\nAbmessungen: Breite: 71,47 cm x H\u00f6he: 48,56 cm x Tiefe/L\u00e4nge: 23,93 cm\nGewicht: 8,4 kg",
    "reference_file": "offer_reference_411.json",
    "shop_name": "Alternate.at"
}