{
    "html_file": "offer_931_2.html",
    "name": "ViewSonic VX2718-PC-MHDJ, 27\"",
    "offer_link": "https://restposten.bauguru.at/monitore/131797-monitor-viewsonic-vx2718-pc-mhdj-27-lcd-va-amd-freesync-flicker-free-0766907015256.html",
    "price": 229.4,
    "raw_specifications": {
        "Arbeitsbereich f\u00fcr Temperatur": "0\u00ba / 40\u00ba",
        "Art": "Gaming",
        "Aufl\u00f6sung": "Full HD",
        "Aufl\u00f6sung (px)": "1920 x 1080 px",
        "Betriebssystem": "Microsoft Windows 10",
        "Bildschirm": "27\"",
        "Design": "W\u00f6lbung",
        "Diagonale des Bildschirms (cm)": "68,6 cm",
        "Empfohlene verwendung": "Gaming",
        "Energieklassifizierung": "F",
        "Enthalten": "Netzadapter",
        "Farbe": "Schwarz",
        "Geschwindigkeit": "165 Hz",
        "Glanz": "250 ANSI",
        "Kontrastverh\u00e4ltnis": "4000:1",
        "Maximale Anpassung": "130 mm",
        "Montage": "VESA",
        "Neigungswinkel": "-5\u00ba / 20\u00ba",
        "Ports": "Audio-Ausgang",
        "Pr\u00e4zision (relative Feuchte)": "20 % - 90 %",
        "Seitenverh\u00e4ltnis": "16:9",
        "Spannung": "100 - 240 V",
        "Steckbares Produkt": "Ja",
        "Steckertyp": "EU-Stecker",
        "Touchscreen": "Kein",
        "Verbindung": "DisplayPort 1.2",
        "Winkel": "178\u00ba"
    },
    "raw_specifications_text": "Art: Gaming\nBildschirm: 27\"\nAufl\u00f6sung (px): 1920 x 1080 px\nSteckbares Produkt: Ja\nSteckertyp: EU-Stecker\nEnergieklassifizierung: F\nDiagonale des Bildschirms (cm): 68,6 cm\nFarbe: Schwarz\nSeitenverh\u00e4ltnis: 16:9\nAufl\u00f6sung: Full HD\nBetriebssystem: Microsoft Windows 10\nKontrastverh\u00e4ltnis: 4000:1\nPorts: Audio-Ausgang\nVerbindung: DisplayPort 1.2\nDesign: W\u00f6lbung\nEnthalten: Netzadapter\nGlanz: 250 ANSI\nSpannung: 100 - 240 V\nEmpfohlene verwendung: Gaming\nTouchscreen: Kein\nWinkel: 178\u00ba\nNeigungswinkel: -5\u00ba / 20\u00ba\nMontage: VESA\nGeschwindigkeit: 165 Hz\nArbeitsbereich f\u00fcr Temperatur: 0\u00ba / 40\u00ba\nMaximale Anpassung: 130 mm\nPr\u00e4zision (relative Feuchte): 20 % - 90 %",
    "reference_file": "offer_reference_931.json",
    "shop_name": "bauguru"
}