{
    "html_file": "offer_1028_30.html",
    "name": "ASUS ZenScreen MB166C, 15.6\"",
    "offer_link": "https://technikladen.at/P-ASUS-Dis-156-Asus-MB166C-Black?tl=gzhls",
    "price": 210.99,
    "raw_specifications": {
        "AC Eingangsfrequenz": "50/60 Hz",
        "AC Eingangsspannung": "100 - 240 V",
        "AMD FreeSync": "Nein",
        "Anzahl der Farben des Displays": "262000 Farben",
        "Betriebstemperatur": "0 - 40 \u00b0C",
        "Bildschirmdiagonale": "39,6 cm",
        "Bildschirmdiagonale (cm)": "39,6 cm",
        "Bildschirmform": "Flach",
        "Bildschirmtechnologie": "LED",
        "Bildwinkel, horizontal": "178 \u00b0",
        "Bildwinkel, vertikal": "178 \u00b0",
        "Blendfreier Bildschirm": "Ja",
        "Breite (ohne Standfu\u00df)": "36 cm",
        "Digital horizontale Frequenz": "24 - 83 kHz",
        "Display-Aufl\u00f6sung": "1920 x 1080 Pixel",
        "Eingebaute Lautsprecher": "Nein",
        "Energieeffizienzklasse (SDR)": "B",
        "Energieeffizienzskala": "A bis G",
        "Energieverbrauch (SDR) pro 1.000 Stunden": "6 kWh",
        "Flimmerfreie Technologie": "Ja",
        "Gewicht (ohne St\u00e4nder)": "780 g",
        "HD-Typ": "Full HD",
        "HDCP": "Ja",
        "HDMI": "Nein",
        "Helligkeit (typisch)": "250 cd/m\u00b2",
        "H\u00f6he (ohne Standfu\u00df)": "22,6 cm",
        "H\u00f6henverstellung": "Nein",
        "Integrierte Kamera": "Nein",
        "Integrierter USB-Hub": "Ja",
        "Kontrastverh\u00e4ltnis": "800:1",
        "Kontrastverh\u00e4ltnis (dynamisch)": "100000000:1",
        "Kopfh\u00f6rerausgang": "Nein",
        "Low-Blue-Light-Technologie": "Ja",
        "Marktpositionierung": "Haus",
        "Maximale Bildwiederholrate": "60 Hz",
        "Mitgelieferte Kabel": "USB Typ-C",
        "NVIDIA G-SYNC": "Nein",
        "Natives Seitenverh\u00e4ltnis": "16:9",
        "Paketgewicht": "1,7 kg",
        "Panel-Typ": "IPS",
        "Pixel Abstand": "0,179 x 0,179 mm",
        "Produktfarbe": "Schwarz",
        "Reaktionszeit": "5 ms",
        "Schnellstart\u00fcbersicht": "Ja",
        "Sichtbare Gr\u00f6\u00dfe (horizontal)": "34,4 cm",
        "Sichtbare Gr\u00f6\u00dfe (vertikal)": "19,4 cm",
        "Stromverbrauch (PowerSave)": "0,5 W",
        "Stromverbrauch (Standardbetrieb)": "8 W",
        "Stromverbrauch (aus)": "0,3 W",
        "Tiefe (ohne Standfu\u00df)": "1,18 cm",
        "Touchscreen": "Nein",
        "USB-Upstream-Porttyp": "USB Typ-C",
        "Verpackungsart": "Box",
        "Verpackungsbreite": "434 mm",
        "Verpackungsh\u00f6he": "290 mm",
        "Verpackungstiefe": "76 mm",
        "Warentarifnummer (HS)": "85285210"
    },
    "raw_specifications_text": "Bildschirmdiagonale: 39,6 cm\nDisplay-Aufl\u00f6sung: 1920 x 1080 Pixel\nNatives Seitenverh\u00e4ltnis: 16:9\nBildschirmtechnologie: LED\nTouchscreen: Nein\nHD-Typ: Full HD\nPanel-Typ: IPS\nHelligkeit (typisch): 250 cd/m\u00b2\nReaktionszeit: 5 ms\nBlendfreier Bildschirm: Ja\nBildschirmform: Flach\nKontrastverh\u00e4ltnis: 800:1\nKontrastverh\u00e4ltnis (dynamisch): 100000000:1\nMaximale Bildwiederholrate: 60 Hz\nBildwinkel, horizontal: 178 \u00b0\nBildwinkel, vertikal: 178 \u00b0\nAnzahl der Farben des Displays: 262000 Farben\nPixel Abstand: 0,179 x 0,179 mm\nSichtbare Gr\u00f6\u00dfe (horizontal): 34,4 cm\nSichtbare Gr\u00f6\u00dfe (vertikal): 19,4 cm\nDigital horizontale Frequenz: 24 - 83 kHz\nBildschirmdiagonale (cm): 39,6 cm\nNVIDIA G-SYNC: Nein\nAMD FreeSync: Nein\nFlimmerfreie Technologie: Ja\nLow-Blue-Light-Technologie: Ja\nIntegrierter USB-Hub: Ja\nUSB-Upstream-Porttyp: USB Typ-C\nHDMI: Nein\nKopfh\u00f6rerausgang: Nein\nHDCP: Ja\nMarktpositionierung: Haus\nProduktfarbe: Schwarz\nEingebaute Lautsprecher: Nein\nIntegrierte Kamera: Nein\nMitgelieferte Kabel: USB Typ-C\nSchnellstart\u00fcbersicht: Ja\nBreite (ohne Standfu\u00df): 36 cm\nTiefe (ohne Standfu\u00df): 1,18 cm\nH\u00f6he (ohne Standfu\u00df): 22,6 cm\nGewicht (ohne St\u00e4nder): 780 g\nVerpackungsbreite: 434 mm\nVerpackungstiefe: 76 mm\nVerpackungsh\u00f6he: 290 mm\nPaketgewicht: 1,7 kg\nVerpackungsart: Box\nH\u00f6henverstellung: Nein\nEnergieeffizienzklasse (SDR): B\nEnergieverbrauch (SDR) pro 1.000 Stunden: 6 kWh\nStromverbrauch (Standardbetrieb): 8 W\nStromverbrauch (aus): 0,3 W\nStromverbrauch (PowerSave): 0,5 W\nAC Eingangsspannung: 100 - 240 V\nAC Eingangsfrequenz: 50/60 Hz\nEnergieeffizienzskala: A bis G\nBetriebstemperatur: 0 - 40 \u00b0C\nWarentarifnummer (HS): 85285210",
    "reference_file": "offer_reference_1028.json",
    "shop_name": "TechnikLaden"
}