{
    "html_file": "offer_663_14.html",
    "name": "iiyama ProLite XUB2294HSU-B2, 21.5\"",
    "offer_link": "https://www.alternate.at/iiyama/ProLite-XUB2294HSU-B2-LED-Monitor/html/product/1878968?partner=AtGeizhalsat&campaign=Monitor/iiyama/1878968",
    "price": 123.9,
    "raw_specifications": {
        "": "Ausgangsleistung",
        "Abmessungen": "Breite: 49,35 cm x H\u00f6he: 32,65 cm x Tiefe/L\u00e4nge: 22,15 cm",
        "Anschl\u00fcsse": "1x HDMI-Eingang, 1x DisplayPort-Eingang, 1x Kopfh\u00f6rer-Ausgang, 2x USB-A-3.2 Gen 1 (5 Gbit/s)",
        "Bild": "Glaretyp",
        "Bildschirmaufl\u00f6sung": "1.920 x 1.080 Pixel",
        "Bildschirmdiagonale": "54,5 cm (21,5 Zoll)",
        "EAN": "4948570120789",
        "Energieeffizienzklasse (SDR)": "D (A - G)",
        "Energieverbauch pro 1000 Stunden (SDR)": "12 kWh",
        "Ergonomie": "Typ",
        "Farbe": "schwarz",
        "Features": "AMD FreeSync, Kensington-Schloss",
        "Frequenz": "Horizontal",
        "Geeignet f\u00fcr": "Business",
        "Gewicht": "4,2 kg",
        "Hersteller-Nr.": "XUB2294HSU-B2",
        "Lautsprecher": "2 Lautsprecher",
        "Leistungsaufnahme im Bereitschafts- und Aus-Zustand": "0,5 Watt",
        "Leistungsaufnahme im Ein-Zustand bei Standard-Dynamikumfang (SDR)": "12,1 Watt",
        "Stromversorgung": "Netzteil",
        "Typ": "LED-Monitor",
        "Wandhalterung": "VESA kompatibel (100 x 100 mm)",
        "Weitere Informationen": "Blaulicht-Reduktion | flimmerfreie LEDs | Kabelmanagement | 96% sRGB, 72% NTSC | maximale H\u00f6he mit komplett ausgezogenem Fu\u00df: 476,5 mm",
        "Zubeh\u00f6r": "Vorhanden"
    },
    "raw_specifications_text": "Energieeffizienzklasse (SDR): D (A - G)\nEnergieverbauch pro 1000 Stunden (SDR): 12 kWh\nLeistungsaufnahme im Ein-Zustand bei Standard-Dynamikumfang (SDR): 12,1 Watt\nLeistungsaufnahme im Bereitschafts- und Aus-Zustand: 0,5 Watt\nBildschirmdiagonale: 54,5 cm (21,5 Zoll)\nBildschirmaufl\u00f6sung: 1.920 x 1.080 Pixel\nTyp: LED-Monitor\nFarbe: schwarz\nEAN: 4948570120789\nHersteller-Nr.: XUB2294HSU-B2\nGeeignet f\u00fcr: Business\nBild: Glaretyp\n: Ausgangsleistung\nFrequenz: Horizontal\nAnschl\u00fcsse: 1x HDMI-Eingang, 1x DisplayPort-Eingang, 1x Kopfh\u00f6rer-Ausgang, 2x USB-A-3.2 Gen 1 (5 Gbit/s)\nErgonomie: Typ\nStromversorgung: Netzteil\nLautsprecher: 2 Lautsprecher\nWandhalterung: VESA kompatibel (100 x 100 mm)\nFeatures: AMD FreeSync, Kensington-Schloss\nWeitere Informationen: Blaulicht-Reduktion | flimmerfreie LEDs | Kabelmanagement | 96% sRGB, 72% NTSC | maximale H\u00f6he mit komplett ausgezogenem Fu\u00df: 476,5 mm\nZubeh\u00f6r: Vorhanden\nAbmessungen: Breite: 49,35 cm x H\u00f6he: 32,65 cm x Tiefe/L\u00e4nge: 22,15 cm\nGewicht: 4,2 kg",
    "reference_file": "offer_reference_663.json",
    "shop_name": "Alternate.at"
}