{
    "html_file": "offer_2525_2.html",
    "name": "Eizo FlexScan S2133 schwarz, 21.3\"",
    "offer_link": "https://www.csv-direct.de/artinfo.php?artnr=A1650322&KATEGORIE=162&pva=geizhals2",
    "price": 761.18,
    "raw_specifications": {
        "AC Eingangsfrequenz": "50 - 60 Hz",
        "AC Eingangsspannung": "100 - 240 V",
        "AMD FreeSync": "Nein",
        "Anzahl": "1",
        "Anzahl DVI-D-Anschl\u00fcsse": "1",
        "Anzahl DisplayPort Anschl\u00fcsse": "1",
        "Anzahl OSD-Sprachen": "6",
        "Anzahl VGA D-Sub Anschl\u00fcsse": "1",
        "Anzahl der Farben des Displays": "16,78 Millionen Farben",
        "Anzahl der nachgeschalteten Steckpl\u00e4tze vom Typ USB-A": "2",
        "Anzahl der vorgeschalteten Steckpl\u00e4tze": "1",
        "Bildschirmdiagonale": "54,1 cm 21.3\"",
        "Bildschirmform": "Flach",
        "Bildschirmformateinstellungen": "4:3",
        "Bildschirmtechnologie": "LED",
        "Bildwinkel, horizontal": "178\u00b0",
        "Bildwinkel, vertikal": "178\u00b0",
        "Breite ohne Standfu\u00df": "465 mm",
        "Digital horizontale Frequenz": "24 - 80 kHz",
        "Digital vertikale Frequenz": "49 - 76 Hz",
        "Display": "LCD",
        "Display-Aufl\u00f6sung": "1600 x 1200 Pixel",
        "Eingebaute Lautsprecher": "Nein",
        "Energieeffizienzklasse SDR": "E",
        "Energieeffizienzskala": "A bis G",
        "Energieverbrauch SDR pro 1.000 Stunden": "17 kWh",
        "Fu\u00dffarbe": "Schwarz",
        "Ger\u00e4tebreite inkl. Fu\u00df": "465 mm",
        "Ger\u00e4teh\u00f6he inkl. Fu\u00df": "535 mm",
        "Ger\u00e4tetiefe inkl. Fu\u00df": "209 mm",
        "Gewicht mit St\u00e4nder": "8,6 kg",
        "Gewicht ohne St\u00e4nder": "5,6 kg",
        "HD-Typ": "UXGA",
        "Helligkeit typisch": "420 cd/m\u00b2",
        "H\u00f6he ohne Standfu\u00df": "361 mm",
        "H\u00f6heneinstellung": "8,2 cm",
        "Integrierte Kamera": "Nein",
        "Integrierter Kartenleser": "Nein",
        "Kabelsperre-Slot": "Nein",
        "Kontrastverh\u00e4ltnis": "1500:1",
        "Men\u00fcsprachen": "Deutsch, Englisch, Spanisch, Franz\u00f6sisch, Italienisch, Schwedisch",
        "Mitgelieferte Kabel": "DVI, USB",
        "NVIDIA G-SYNC": "Nein",
        "Nachhaltigkeitszertifikate": "ENERGY STAR",
        "Natives Seitenverh\u00e4ltnis": "4:3",
        "Panel-Montage-Schnittstelle": "100 x 100 mm",
        "Panel-Typ": "IPS",
        "Pivot Winkel": "0 - 90\u00b0",
        "Pixel Abstand": "0,270 x 0,270 mm",
        "Produktfarbe": "Schwarz",
        "Reaktionszeit": "20 ms",
        "Schwenkwinkelbereich": "0 - 40\u00b0",
        "Seitenverh\u00e4ltnis": "4:3",
        "Sichtbare Gr\u00f6\u00dfe horizontal": "54 cm",
        "Sichtbare Gr\u00f6\u00dfe vertikal": "54 cm",
        "Stromverbrauch Standardbetrieb": "17,4 W",
        "Stromverbrauch Standby": "0,3 W",
        "Stromverbrauch aus": "0,1 W",
        "Stromverbrauch max.": "45 W",
        "TV Tuner integriert": "Nein",
        "Tiefe ohne Standfu\u00df": "64 mm",
        "Touchscreen": "Nein",
        "USB-Upstream-Porttyp": "USB Typ-B",
        "Unterst\u00fctzte Grafik-Aufl\u00f6sungen": "720 x 400, 1024 x 768 XGA, 1280 x 1024 SXGA, 1600 x 1200 UXGA, 640 x 480 VGA, 800 x 600 SVGA",
        "Warentarifnummer HS": "85285210",
        "Zertifizierung": "CE, T\u00dcV GS, T\u00dcV,  ISO 9241-307, TCO 6.0"
    },
    "raw_specifications_text": "Bildschirmdiagonale: 54,1 cm 21.3\"\nDisplay-Aufl\u00f6sung: 1600 x 1200 Pixel\nNatives Seitenverh\u00e4ltnis: 4:3\nBildschirmtechnologie: LED\nTouchscreen: Nein\nHD-Typ: UXGA\nPanel-Typ: IPS\nBildschirmform: Flach\nKontrastverh\u00e4ltnis: 1500:1\nAnzahl der Farben des Displays: 16,78 Millionen Farben\nHelligkeit typisch: 420 cd/m\u00b2\nReaktionszeit: 20 ms\nUnterst\u00fctzte Grafik-Aufl\u00f6sungen: 720 x 400, 1024 x 768 XGA, 1280 x 1024 SXGA, 1600 x 1200 UXGA, 640 x 480 VGA, 800 x 600 SVGA\nSeitenverh\u00e4ltnis: 4:3\nBildwinkel, horizontal: 178\u00b0\nBildwinkel, vertikal: 178\u00b0\nPixel Abstand: 0,270 x 0,270 mm\nSichtbare Gr\u00f6\u00dfe horizontal: 54 cm\nSichtbare Gr\u00f6\u00dfe vertikal: 54 cm\nDigital horizontale Frequenz: 24 - 80 kHz\nDigital vertikale Frequenz: 49 - 76 Hz\nNVIDIA G-SYNC: Nein\nAMD FreeSync: Nein\nEingebaute Lautsprecher: Nein\nIntegrierte Kamera: Nein\nProduktfarbe: Schwarz\nFu\u00dffarbe: Schwarz\nZertifizierung: CE, T\u00dcV GS, T\u00dcV,  ISO 9241-307, TCO 6.0\nUSB-Upstream-Porttyp: USB Typ-B\nAnzahl der vorgeschalteten Steckpl\u00e4tze: 1\nAnzahl der nachgeschalteten Steckpl\u00e4tze vom Typ USB-A: 2\nAnzahl VGA D-Sub Anschl\u00fcsse: 1\nAnzahl DVI-D-Anschl\u00fcsse: 1\nAnzahl DisplayPort Anschl\u00fcsse: 1\nIntegrierter Kartenleser: Nein\nKabelsperre-Slot: Nein\nPanel-Montage-Schnittstelle: 100 x 100 mm\nH\u00f6heneinstellung: 8,2 cm\nPivot Winkel: 0 - 90\u00b0\nSchwenkwinkelbereich: 0 - 40\u00b0\nMen\u00fcsprachen: Deutsch, Englisch, Spanisch, Franz\u00f6sisch, Italienisch, Schwedisch\nAnzahl OSD-Sprachen: 6\nEnergieeffizienzklasse SDR: E\nEnergieverbrauch SDR pro 1.000 Stunden: 17 kWh\nStromverbrauch Standardbetrieb: 17,4 W\nStromverbrauch Standby: 0,3 W\nStromverbrauch max.: 45 W\nStromverbrauch aus: 0,1 W\nAC Eingangsspannung: 100 - 240 V\nAC Eingangsfrequenz: 50 - 60 Hz\nEnergieeffizienzskala: A bis G\nMitgelieferte Kabel: DVI, USB\nGer\u00e4tebreite inkl. Fu\u00df: 465 mm\nGer\u00e4tetiefe inkl. Fu\u00df: 209 mm\nGer\u00e4teh\u00f6he inkl. Fu\u00df: 535 mm\nGewicht mit St\u00e4nder: 8,6 kg\nBreite ohne Standfu\u00df: 465 mm\nTiefe ohne Standfu\u00df: 64 mm\nH\u00f6he ohne Standfu\u00df: 361 mm\nGewicht ohne St\u00e4nder: 5,6 kg\nNachhaltigkeitszertifikate: ENERGY STAR\nWarentarifnummer HS: 85285210\nDisplay: LCD\nBildschirmformateinstellungen: 4:3\nTV Tuner integriert: Nein\nAnzahl: 1",
    "reference_file": "offer_reference_2525.json",
    "shop_name": "CSV-Direct.de"
}