{
    "html_file": "offer_1189_41.html",
    "name": "iiyama ProLite X4373UHSU-B1, 42.5\"",
    "offer_link": "https://www.mylemon.at/artikel/iiyama/x4373uhsu_b1/x4373uhsu-b1-108cm-black-43.html",
    "price": 662.48,
    "raw_specifications": {
        "AC Eingangsfrequenz": "50 - 60 Hz",
        "AC Eingangsspannung": "100 - 240 V",
        "AMD FreeSync": "Nein",
        "Anzahl DisplayPort Anschl\u00fcsse": "1",
        "Anzahl HDMI-Anschl\u00fcsse": "2",
        "Anzahl Mini DisplayPorts": "1",
        "Anzahl OSD-Sprachen": "10",
        "Anzahl der Farben des Displays": "1,07 Milliarden Farben",
        "Anzahl der Lautsprecher": "2",
        "Anzahl der nachgeschalteten Steckpl\u00e4tze vom Typ USB-A": "4",
        "Anzahl der vorgeschalteten Steckpl\u00e4tze": "1",
        "Artikelnummer": "M17YU6GL",
        "Aufl\u00f6sung": "3840x2160",
        "Betriebstemperatur": "5 - 35 \u00b0C",
        "Bildschirmdiagonale": "108 cm (42.5\")",
        "Bildschirmdiagonale (cm)": "108 cm",
        "Bildschirmform": "Flach",
        "Bildwinkel, horizontal": "178\u00b0",
        "Bildwinkel, vertikal": "178\u00b0",
        "Display-Aufl\u00f6sung": "3840 x 2160 Pixel",
        "Display-Oberfl\u00e4che": "Matt",
        "Displaygr\u00f6\u00dfe": "42,5 Zoll",
        "EAN": "4948570118519",
        "Eingangsstrom": "1.5 A",
        "Eingebaute Lautsprecher": "Ja",
        "Energieeffizienzklasse (HDR)": "G",
        "Energieeffizienzklasse (SDR)": "G",
        "Energieverbrauch (HDR) pro 1.000 Stunden": "102 kWh",
        "Energieverbrauch (SDR) pro 1.000 Stunden": "54 kWh",
        "Ergonomie": "H\u00f6henverstellbar, Schwenkbar, Neigbar",
        "Fernbedienung enthalten": "Ja",
        "Fernbedienungsbatterien im Lieferumfang enthalten": "Ja",
        "Flimmerfreie Technologie": "Ja",
        "Fu\u00dffarbe": "Schwarz",
        "Ger\u00e4tebreite (inkl. Fu\u00df)": "977,5 mm",
        "Ger\u00e4teh\u00f6he (inkl. Fu\u00df)": "621,5 mm",
        "Ger\u00e4tetiefe (inkl. Fu\u00df)": "251 mm",
        "Gewicht (mit St\u00e4nder)": "14,5 kg",
        "HD-Typ": "4K Ultra HD",
        "HDCP": "Ja",
        "HDMI": "Ja",
        "Helligkeit": "400 cd/m\u00b2",
        "Helligkeit (typisch)": "400 cd/m\u00b2",
        "Hersteller Artikelnummer": "X4373UHSU-B1",
        "High Dynamic Range Video (HDR) Unterst\u00fctzung": "Ja",
        "Horizontaler Scanbereich": "30 - 135 kHz",
        "H\u00f6henverstellung": "Nein",
        "Integrierte Kamera": "Nein",
        "Integrierter USB-Hub": "Ja",
        "Kabelsperre-Slot": "Nein",
        "Kontrastverh\u00e4ltnis": "4000:1",
        "Kontrastverh\u00e4ltnis (dynamisch)": "80000000:1",
        "Kopfh\u00f6rerausgang": "Ja",
        "Kopfh\u00f6rerausg\u00e4nge": "1",
        "Low-Blue-Light-Technologie": "Ja",
        "Luftfeuchtigkeit bei Lagerung": "5 - 85%",
        "Marktpositionierung": "Business",
        "Maximale Bildwiederholrate": "60 Hz",
        "Men\u00fcsprachen": "Deutsch, Niederl\u00e4ndisch, Englisch, Spanisch, Franz\u00f6sisch, Italienisch, Japanisch, Polnisch, Portugiesisch, Russisch",
        "Mitgelieferte Kabel": "AC, DisplayPort, HDMI, USB",
        "NVIDIA G-SYNC": "Nein",
        "Nachhaltigkeitszertifikate": "CE, ErP, REACH, RoHS, WEEE",
        "Natives Seitenverh\u00e4ltnis": "16:9",
        "Neigungsverstellung": "Ja",
        "Neigungswinkelbereich": "-2 - 10\u00b0",
        "On-Screen-Display (OSD)": "Ja",
        "Paketgewicht": "19 kg",
        "Panel": "VA",
        "Panel-Montage-Schnittstelle": "200 x 100 mm",
        "Panel-Typ": "VA",
        "Pixel Abstand": "0,245 x 0,245 mm",
        "Produktfarbe": "Schwarz",
        "RMS-Leistung": "14 W",
        "Reaktionszeit": "3 ms",
        "Relative Luftfeuchtigkeit in Betrieb": "10 - 80%",
        "Schnellstart\u00fcbersicht": "Ja",
        "Sichtbare Gr\u00f6\u00dfe (horizontal)": "94,1 cm",
        "Sichtbare Gr\u00f6\u00dfe (vertikal)": "52,9 cm",
        "Stromverbrauch (Standardbetrieb)": "92 W",
        "Stromverbrauch (Standby)": "0,5 W",
        "Stromverbrauch (aus)": "0,5 W",
        "St\u00e4nder enthalten": "Ja",
        "Temperaturbereich bei Lagerung": "-20 - 60 \u00b0C",
        "Touchscreen": "Nein",
        "USB-Hub-Version": "3.2 Gen 1 (3.1 Gen 1)",
        "USB-Upstream-Porttyp": "USB Typ-B",
        "VESA Halterung": "200x100 mm",
        "VESA-Halterung": "Ja",
        "Verpackungsbreite": "1071 mm",
        "Verpackungsh\u00f6he": "760 mm",
        "Verpackungstiefe": "240 mm",
        "Video Anschl\u00fcsse": "2x HDMI, 1x DisplayPort, 1x mini DisplayPort",
        "Warentarifnummer (HS)": "85285210"
    },
    "raw_specifications_text": "Displaygr\u00f6\u00dfe: 42,5 Zoll\nAufl\u00f6sung: 3840x2160\nPanel: VA\nVideo Anschl\u00fcsse: 2x HDMI, 1x DisplayPort, 1x mini DisplayPort\nErgonomie: H\u00f6henverstellbar, Schwenkbar, Neigbar\nVESA Halterung: 200x100 mm\nHelligkeit: 400 cd/m\u00b2\nHersteller Artikelnummer: X4373UHSU-B1\nEAN: 4948570118519\nArtikelnummer: M17YU6GL\nBildschirmdiagonale: 108 cm (42.5\")\nDisplay-Aufl\u00f6sung: 3840 x 2160 Pixel\nNatives Seitenverh\u00e4ltnis: 16:9\nTouchscreen: Nein\nHD-Typ: 4K Ultra HD\nPanel-Typ: VA\nBildschirmform: Flach\nKontrastverh\u00e4ltnis: 4000:1\nMaximale Bildwiederholrate: 60 Hz\nAnzahl der Farben des Displays: 1,07 Milliarden Farben\nHelligkeit (typisch): 400 cd/m\u00b2\nReaktionszeit: 3 ms\nDisplay-Oberfl\u00e4che: Matt\nKontrastverh\u00e4ltnis (dynamisch): 80000000:1\nBildwinkel, horizontal: 178\u00b0\nBildwinkel, vertikal: 178\u00b0\nPixel Abstand: 0,245 x 0,245 mm\nHorizontaler Scanbereich: 30 - 135 kHz\nSichtbare Gr\u00f6\u00dfe (horizontal): 94,1 cm\nSichtbare Gr\u00f6\u00dfe (vertikal): 52,9 cm\nBildschirmdiagonale (cm): 108 cm\nHigh Dynamic Range Video (HDR) Unterst\u00fctzung: Ja\nNVIDIA G-SYNC: Nein\nAMD FreeSync: Nein\nFlimmerfreie Technologie: Ja\nLow-Blue-Light-Technologie: Ja\nEingebaute Lautsprecher: Ja\nIntegrierte Kamera: Nein\nAnzahl der Lautsprecher: 2\nRMS-Leistung: 14 W\nMarktpositionierung: Business\nProduktfarbe: Schwarz\nFu\u00dffarbe: Schwarz\nIntegrierter USB-Hub: Ja\nHDMI: Ja\nKopfh\u00f6rerausgang: Ja\nUSB-Hub-Version: 3.2 Gen 1 (3.1 Gen 1)\nUSB-Upstream-Porttyp: USB Typ-B\nAnzahl der vorgeschalteten Steckpl\u00e4tze: 1\nAnzahl der nachgeschalteten Steckpl\u00e4tze vom Typ USB-A: 4\nAnzahl HDMI-Anschl\u00fcsse: 2\nAnzahl DisplayPort Anschl\u00fcsse: 1\nAnzahl Mini DisplayPorts: 1\nKopfh\u00f6rerausg\u00e4nge: 1\nHDCP: Ja\nVESA-Halterung: Ja\nKabelsperre-Slot: Nein\nH\u00f6henverstellung: Nein\nPanel-Montage-Schnittstelle: 200 x 100 mm\nNeigungswinkelbereich: -2 - 10\u00b0\nOn-Screen-Display (OSD): Ja\nMen\u00fcsprachen: Deutsch, Niederl\u00e4ndisch, Englisch, Spanisch, Franz\u00f6sisch, Italienisch, Japanisch, Polnisch, Portugiesisch, Russisch\nAnzahl OSD-Sprachen: 10\nNeigungsverstellung: Ja\nEnergieeffizienzklasse (SDR): G\nEnergieeffizienzklasse (HDR): G\nEnergieverbrauch (SDR) pro 1.000 Stunden: 54 kWh\nEnergieverbrauch (HDR) pro 1.000 Stunden: 102 kWh\nStromverbrauch (Standardbetrieb): 92 W\nStromverbrauch (Standby): 0,5 W\nStromverbrauch (aus): 0,5 W\nAC Eingangsspannung: 100 - 240 V\nAC Eingangsfrequenz: 50 - 60 Hz\nEingangsstrom: 1.5 A\nBetriebstemperatur: 5 - 35 \u00b0C\nTemperaturbereich bei Lagerung: -20 - 60 \u00b0C\nRelative Luftfeuchtigkeit in Betrieb: 10 - 80%\nLuftfeuchtigkeit bei Lagerung: 5 - 85%\nSt\u00e4nder enthalten: Ja\nMitgelieferte Kabel: AC, DisplayPort, HDMI, USB\nFernbedienung enthalten: Ja\nFernbedienungsbatterien im Lieferumfang enthalten: Ja\nSchnellstart\u00fcbersicht: Ja\nGer\u00e4tebreite (inkl. Fu\u00df): 977,5 mm\nGer\u00e4tetiefe (inkl. Fu\u00df): 251 mm\nGer\u00e4teh\u00f6he (inkl. Fu\u00df): 621,5 mm\nGewicht (mit St\u00e4nder): 14,5 kg\nVerpackungsbreite: 1071 mm\nVerpackungstiefe: 240 mm\nVerpackungsh\u00f6he: 760 mm\nPaketgewicht: 19 kg\nNachhaltigkeitszertifikate: CE, ErP, REACH, RoHS, WEEE\nWarentarifnummer (HS): 85285210",
    "reference_file": "offer_reference_1189.json",
    "shop_name": "mylemon.at"
}