{
    "html_file": "offer_1663_2.html",
    "name": "Dell UltraSharp U3421WE, 34.14\"",
    "offer_link": "https://www.playox.de/productredirect/index/sku/15449107?sPartner=p-geizhals-at&campaign=psm/geizhals-at/",
    "price": 765.77,
    "raw_specifications": {
        "Anschl\u00fcsse": "USB, DisplayPort, HDMI, Audioausgang (Line-Out)",
        "Artikelnummer": "15449107",
        "Aufl\u00f6sung Kurzname": "Full HD, UHD",
        "Bezeichnung des Herstellers": "DELL-U3421WE",
        "Bildwiederholungsrate": "60,00 Hz",
        "Breite": "-1,00 mm",
        "Display Features": "FlickerFree, 3D ready, Bild an Bild (PbP) Funktion, Bild in Bild (PiP) Funktion",
        "Displaygr\u00f6\u00dfe": "86,36 cm (34 Zoll)",
        "EEK - Spektrum": "AG",
        "Einsatzort": "Innen",
        "Energieeffizienzklasse": "F",
        "Geh\u00e4usefarbe des Ger\u00e4tes": "Silber",
        "Gewicht": "7,52 kg",
        "Gewicht inkl. Verpackung in Kg": "16,50 kg",
        "Helligkeit Bereich": "300 - 450 cd/m\u00b2",
        "Hersteller": "Dell",
        "H\u00f6he": "-1,00 mm",
        "Inhalt (ml oder g)": "0,00 ml",
        "Kapazit\u00e4t (Seiten)": "0",
        "Kontrastverh\u00e4ltnis (typisch) Bereich": "800:1 bis 1.200:1",
        "LCD-Technologie": "IPS Panel",
        "L\u00e4nge": "-1,00 mm",
        "Produktart": "Monitore",
        "Reaktionszeit": "8,00 ms",
        "Seitenverh\u00e4ltnis": "21:9",
        "Shop Herstellernummer": "DELL-U3421WE",
        "Standard-EAN": "5397184409558",
        "Verpackung - Breite in cm": "22,48 cm",
        "Verpackung - H\u00f6he in cm": "46,48 cm",
        "Verpackung - L\u00e4nge in cm": "95,00 cm",
        "max. Aufl\u00f6sung": "3.440 x 1.440 Pixel (21:9)"
    },
    "raw_specifications_text": "Displaygr\u00f6\u00dfe: 86,36 cm (34 Zoll)\nGeh\u00e4usefarbe des Ger\u00e4tes: Silber\nAnschl\u00fcsse: USB, DisplayPort, HDMI, Audioausgang (Line-Out)\nProduktart: Monitore\nDisplay Features: FlickerFree, 3D ready, Bild an Bild (PbP) Funktion, Bild in Bild (PiP) Funktion\nKontrastverh\u00e4ltnis (typisch) Bereich: 800:1 bis 1.200:1\nHersteller: Dell\nHelligkeit Bereich: 300 - 450 cd/m\u00b2\nGewicht: 7,52 kg\nInhalt (ml oder g): 0,00 ml\nKapazit\u00e4t (Seiten): 0\nAufl\u00f6sung Kurzname: Full HD, UHD\nBreite: -1,00 mm\nH\u00f6he: -1,00 mm\nL\u00e4nge: -1,00 mm\nEEK - Spektrum: AG\nVerpackung - L\u00e4nge in cm: 95,00 cm\nVerpackung - H\u00f6he in cm: 46,48 cm\nArtikelnummer: 15449107\nStandard-EAN: 5397184409558\nShop Herstellernummer: DELL-U3421WE\nBezeichnung des Herstellers: DELL-U3421WE\nVerpackung - Breite in cm: 22,48 cm\nGewicht inkl. Verpackung in Kg: 16,50 kg\nmax. Aufl\u00f6sung: 3.440 x 1.440 Pixel (21:9)\nSeitenverh\u00e4ltnis: 21:9\nLCD-Technologie: IPS Panel\nReaktionszeit: 8,00 ms\nBildwiederholungsrate: 60,00 Hz\nEinsatzort: Innen\nEnergieeffizienzklasse: F",
    "reference_file": "offer_reference_1663.json",
    "shop_name": "playox (AT)"
}