{
    "html_file": "offer_983_16.html",
    "name": "Samsung Smart Monitor M5 M50B schwarz, 32\"",
    "offer_link": "https://www.e-tec.at/details.php?artnr=342162",
    "price": 238.0,
    "raw_specifications": {
        "Abmessungen (BxHxT)": "716.1x517x193.5mm (mit Standfu\u00df),  716.1x424.5x41.8mm (ohne Standfu\u00df)",
        "Anschl\u00fcsse - HDMI 1.4": "2",
        "Anwendung": "station\u00e4r",
        "Audio": "Lautsprecher (2x 5W),  1x Line-Out",
        "Aufl\u00f6sung": "1920x1080",
        "Beschichtung": "matt (non-glare)",
        "Besonderheiten": "Slim Bezel,  Steuerkreuz,  Lichtsensor,  Sicherheitsschloss (Kensington),  Wi-Fi 5 (WLAN 802.11a/b/g/n/ac),  Bluetooth 4.2,  DLNA,  Fernbedienung,  Betriebssystem (Tizen)",
        "Bildwiederholfrequenz": "60Hz",
        "Blickwinkel": "178\u00b0/178\u00b0",
        "Diagonale": "32\"/81.3cm",
        "Energieeffizienzklasse HDR (A bis G)": "G",
        "Energieverbrauch HDR": "39kWh/1000h",
        "Energieverbrauch SDR": "27kWh/1000h",
        "Ergonomie": "N/A (h\u00f6henverstellbar),  N/A (Pivot),  N/A (drehbar),  +22\u00b0/-2\u00b0 (neigbar),  keine Angabe (Schr\u00e4glage)",
        "FRC": "unbekannt",
        "Farbe": "schwarz",
        "Farbtiefe": "10bit (1.07 Mrd. Farben)",
        "Form": "gerade (flat)",
        "Gewicht": "6.20kg (mit Standfu\u00df),  5.10kg (ohne Standfu\u00df)",
        "HDR": "HDR10",
        "Helligkeit": "250cd/m\u00b2",
        "Herstellergarantie": "zwei Jahre",
        "Hintergrundbeleuchtung": "White-LED,  flicker-free,  Blaulichtfilter",
        "Kontrast - statisch": "3.000:1",
        "Lautsprecher": "Ja",
        "Leistungsaufnahme": "50W (maximal),  27W (typisch),  keine Angabe (Energielabel alt A+++ bis G),  0.5W (Standby)",
        "Panel": "VA",
        "Reaktionszeit - GtG": "4ms",
        "Screen-to-Body-Ratio": "92.9% (berechnet)",
        "Seitenverh\u00e4ltnis": "16:9",
        "Signalfrequenz": "keine Angabe (horizontal),  keine Angabe (vertikal)",
        "Stromversorgung": "AC-In (internes Netzteil)",
        "USB-Hub In": "N/A",
        "USB-Hub Out": "N/A",
        "USB-Schreibweise": "Link",
        "VESA": "100x100 (frei)",
        "Weitere Anschl\u00fcsse": "2x USB-A 2.0"
    },
    "raw_specifications_text": "Abmessungen (BxHxT): 716.1x517x193.5mm (mit Standfu\u00df),  716.1x424.5x41.8mm (ohne Standfu\u00df)\nAnschl\u00fcsse - HDMI 1.4: 2\nAnwendung: station\u00e4r\nAudio: Lautsprecher (2x 5W),  1x Line-Out\nAufl\u00f6sung: 1920x1080\nBeschichtung: matt (non-glare)\nBesonderheiten: Slim Bezel,  Steuerkreuz,  Lichtsensor,  Sicherheitsschloss (Kensington),  Wi-Fi 5 (WLAN 802.11a/b/g/n/ac),  Bluetooth 4.2,  DLNA,  Fernbedienung,  Betriebssystem (Tizen)\nBildwiederholfrequenz: 60Hz\nBlickwinkel: 178\u00b0/178\u00b0\nDiagonale: 32\"/81.3cm\nEnergieeffizienzklasse HDR (A bis G): G\nEnergieverbrauch HDR: 39kWh/1000h\nEnergieverbrauch SDR: 27kWh/1000h\nErgonomie: N/A (h\u00f6henverstellbar),  N/A (Pivot),  N/A (drehbar),  +22\u00b0/-2\u00b0 (neigbar),  keine Angabe (Schr\u00e4glage)\nFarbe: schwarz\nFarbtiefe: 10bit (1.07 Mrd. Farben)\nForm: gerade (flat)\nFRC: unbekannt\nGewicht: 6.20kg (mit Standfu\u00df),  5.10kg (ohne Standfu\u00df)\nHDR: HDR10\nHelligkeit: 250cd/m\u00b2\nHerstellergarantie: zwei Jahre\nHintergrundbeleuchtung: White-LED,  flicker-free,  Blaulichtfilter\nKontrast - statisch: 3.000:1\nLautsprecher: Ja\nLeistungsaufnahme: 50W (maximal),  27W (typisch),  keine Angabe (Energielabel alt A+++ bis G),  0.5W (Standby)\nPanel: VA\nReaktionszeit - GtG: 4ms\nScreen-to-Body-Ratio: 92.9% (berechnet)\nSeitenverh\u00e4ltnis: 16:9\nSignalfrequenz: keine Angabe (horizontal),  keine Angabe (vertikal)\nStromversorgung: AC-In (internes Netzteil)\nUSB-Hub In: N/A\nUSB-Hub Out: N/A\nUSB-Schreibweise: Link\nVESA: 100x100 (frei)\nWeitere Anschl\u00fcsse: 2x USB-A 2.0",
    "reference_file": "offer_reference_983.json",
    "shop_name": "e-tec.at"
}