{
    "html_file": "offer_255_3.html",
    "name": "LG UltraGear 27GR75Q-B, 27\"",
    "offer_link": "https://www.mylemon.at/artikel/lg/27gr75q_b_aeu/27gr75q-b-aeu.html",
    "price": 240.89,
    "raw_specifications": {
        "AC Eingangsfrequenz": "50 - 60 Hz",
        "AC Eingangsspannung": "100 - 240 V",
        "AMD FreeSync": "Ja",
        "AMD FreeSync-Typ": "FreeSync Premium",
        "Anzahl DisplayPort Anschl\u00fcsse": "1",
        "Anzahl HDMI-Anschl\u00fcsse": "2",
        "Anzahl der Farben des Displays": "16,78 Millionen Farben",
        "Artikelnummer": "M1KY14ML",
        "Aufl\u00f6sung": "2560x1440",
        "Besonderheiten": "165 Hz",
        "Bildschirmdiagonale": "68,6 cm (27 Zoll)",
        "Bildschirmform": "Flach",
        "Bildschirmtechnologie": "LED",
        "Bildwinkel, horizontal": "178\u00b0",
        "Bildwinkel, vertikal": "178\u00b0",
        "Blendfreier Bildschirm": "Ja",
        "Breite (ohne Standfu\u00df)": "61,4 cm",
        "Digitales Signalformatsystem": "Nicht unterst\u00fctzt",
        "Display-Aufl\u00f6sung": "2560 x 1440 Pixel",
        "DisplayPorts-Version": "1.4",
        "Displaygr\u00f6\u00dfe": "27 Zoll",
        "EAN": "8806084255068",
        "Energieeffizienzklasse (HDR)": "G",
        "Energieeffizienzklasse (SDR)": "F",
        "Energieverbrauch (HDR) pro 1.000 Stunden": "37 kWh",
        "Energieverbrauch (SDR) pro 1.000 Stunden": "26 kWh",
        "Ergonomie": "H\u00f6henverstellbar, Pivot (90 Grad drehbar), Neigbar",
        "FPS-Z\u00e4hler": "Ja",
        "Farbtiefe": "8 Bit",
        "Flimmerfreie Technologie": "Ja",
        "Ger\u00e4tebreite (inkl. Fu\u00df)": "613,5 mm",
        "Ger\u00e4teh\u00f6he (inkl. Fu\u00df)": "569,8 mm",
        "Ger\u00e4tetiefe (inkl. Fu\u00df)": "291,2 mm",
        "Gewicht (mit St\u00e4nder)": "6,19 kg",
        "Gewicht (ohne St\u00e4nder)": "4,05 kg",
        "HD-Typ": "Quad HD",
        "HDCP": "Ja",
        "HDCP-Version": "2.2",
        "HDMI": "Ja",
        "HDMI-Version": "2.0",
        "Helligkeit": "300 cd/m\u00b2",
        "Helligkeit (typisch)": "300 cd/m\u00b2",
        "Hersteller Artikelnummer": "27GR75Q-B.AEU",
        "High Dynamic Range Video (HDR) Unterst\u00fctzung": "Ja",
        "H\u00f6he (ohne Standfu\u00df)": "37,2 cm",
        "H\u00f6heneinstellung": "11 cm",
        "H\u00f6henverstellung": "Ja",
        "Integrierte Kamera": "Nein",
        "Integrierter USB-Hub": "Nein",
        "Kontrastverh\u00e4ltnis": "1000:1",
        "Kontrastverh\u00e4ltnis (dynamisch)": "5000000:1",
        "Kopfh\u00f6rerausgang": "Ja",
        "Kopfh\u00f6rerausg\u00e4nge": "1",
        "Markenspezifische Technologien": "Crosshair",
        "Marktpositionierung": "Gaming",
        "Maximale Bildwiederholrate": "165 Hz",
        "NVIDIA G-SYNC": "Ja",
        "NVIDIA G-SYNC-Typ": "G-SYNC Compatible",
        "Natives Seitenverh\u00e4ltnis": "16:9",
        "Neigungsverstellung": "Ja",
        "Neigungswinkelbereich": "-5 - 15\u00b0",
        "Netzteiltyp": "Extern",
        "Paketgewicht": "8,55 kg",
        "Panel": "IPS",
        "Panel-Montage-Schnittstelle": "100 x 100 mm",
        "Panel-Typ": "IPS",
        "Pivot": "Ja",
        "Pixel Abstand": "0,23 x 0,23 mm",
        "Produktfarbe": "Schwarz",
        "Reaktionszeit": "1 ms",
        "Stromverbrauch (Standardbetrieb)": "45 W",
        "Stromverbrauch (Standby)": "0,5 W",
        "Stromverbrauch (aus)": "0,3 W",
        "Stromverbrauch (max.)": "48 W",
        "St\u00e4nder enthalten": "Ja",
        "Technologie mit hohem Dynamikbereich (HDR)": "HDR Effect, High Dynamic Range 10 (HDR10)",
        "Tiefe (ohne Standfu\u00df)": "5,13 cm",
        "Touchscreen": "Nein",
        "VESA Halterung": "100x100 mm",
        "VESA-Halterung": "Ja",
        "Verpackungsbreite": "691 mm",
        "Verpackungsh\u00f6he": "513 mm",
        "Verpackungstiefe": "185 mm",
        "Video Anschl\u00fcsse": "1x DisplayPort",
        "Wandmontage": "Ja",
        "Zertifizierung": "UL(cUL), TUV-Type, FCC-B, CE, CB, ErP",
        "sRGB Abdeckung (klassisch)": "99%"
    },
    "raw_specifications_text": "Displaygr\u00f6\u00dfe: 27 Zoll\nAufl\u00f6sung: 2560x1440\nPanel: IPS\nReaktionszeit: 1 ms\nVideo Anschl\u00fcsse: 1x DisplayPort\nErgonomie: H\u00f6henverstellbar, Pivot (90 Grad drehbar), Neigbar\nVESA Halterung: 100x100 mm\nHelligkeit: 300 cd/m\u00b2\nBesonderheiten: 165 Hz\nHersteller Artikelnummer: 27GR75Q-B.AEU\nEAN: 8806084255068\nArtikelnummer: M1KY14ML\nBildschirmdiagonale: 68,6 cm (27 Zoll)\nDisplay-Aufl\u00f6sung: 2560 x 1440 Pixel\nNatives Seitenverh\u00e4ltnis: 16:9\nBildschirmtechnologie: LED\nTouchscreen: Nein\nHD-Typ: Quad HD\nPanel-Typ: IPS\nBildschirmform: Flach\nKontrastverh\u00e4ltnis: 1000:1\nMaximale Bildwiederholrate: 165 Hz\nAnzahl der Farben des Displays: 16,78 Millionen Farben\nHelligkeit (typisch): 300 cd/m\u00b2\nBlendfreier Bildschirm: Ja\nKontrastverh\u00e4ltnis (dynamisch): 5000000:1\nBildwinkel, horizontal: 178\u00b0\nBildwinkel, vertikal: 178\u00b0\nPixel Abstand: 0,23 x 0,23 mm\nHigh Dynamic Range Video (HDR) Unterst\u00fctzung: Ja\nTechnologie mit hohem Dynamikbereich (HDR): HDR Effect, High Dynamic Range 10 (HDR10)\nFarbtiefe: 8 Bit\nsRGB Abdeckung (klassisch): 99%\nNVIDIA G-SYNC: Ja\nAMD FreeSync: Ja\nNVIDIA G-SYNC-Typ: G-SYNC Compatible\nAMD FreeSync-Typ: FreeSync Premium\nMarkenspezifische Technologien: Crosshair\nFlimmerfreie Technologie: Ja\nFPS-Z\u00e4hler: Ja\nIntegrierte Kamera: Nein\nMarktpositionierung: Gaming\nProduktfarbe: Schwarz\nZertifizierung: UL(cUL), TUV-Type, FCC-B, CE, CB, ErP\nIntegrierter USB-Hub: Nein\nHDMI: Ja\nKopfh\u00f6rerausgang: Ja\nAnzahl HDMI-Anschl\u00fcsse: 2\nHDMI-Version: 2.0\nAnzahl DisplayPort Anschl\u00fcsse: 1\nDisplayPorts-Version: 1.4\nKopfh\u00f6rerausg\u00e4nge: 1\nHDCP: Ja\nHDCP-Version: 2.2\nVESA-Halterung: Ja\nH\u00f6henverstellung: Ja\nPanel-Montage-Schnittstelle: 100 x 100 mm\nWandmontage: Ja\nH\u00f6heneinstellung: 11 cm\nPivot: Ja\nNeigungswinkelbereich: -5 - 15\u00b0\nNeigungsverstellung: Ja\nEnergieeffizienzklasse (SDR): F\nEnergieeffizienzklasse (HDR): G\nEnergieverbrauch (SDR) pro 1.000 Stunden: 26 kWh\nEnergieverbrauch (HDR) pro 1.000 Stunden: 37 kWh\nStromverbrauch (Standardbetrieb): 45 W\nStromverbrauch (Standby): 0,5 W\nStromverbrauch (max.): 48 W\nStromverbrauch (aus): 0,3 W\nAC Eingangsspannung: 100 - 240 V\nAC Eingangsfrequenz: 50 - 60 Hz\nNetzteiltyp: Extern\nSt\u00e4nder enthalten: Ja\nGer\u00e4tebreite (inkl. Fu\u00df): 613,5 mm\nGer\u00e4tetiefe (inkl. Fu\u00df): 291,2 mm\nGer\u00e4teh\u00f6he (inkl. Fu\u00df): 569,8 mm\nGewicht (mit St\u00e4nder): 6,19 kg\nBreite (ohne Standfu\u00df): 61,4 cm\nTiefe (ohne Standfu\u00df): 5,13 cm\nH\u00f6he (ohne Standfu\u00df): 37,2 cm\nGewicht (ohne St\u00e4nder): 4,05 kg\nVerpackungsbreite: 691 mm\nVerpackungstiefe: 185 mm\nVerpackungsh\u00f6he: 513 mm\nPaketgewicht: 8,55 kg\nDigitales Signalformatsystem: Nicht unterst\u00fctzt",
    "reference_file": "offer_reference_255.json",
    "shop_name": "mylemon.at"
}