{
    "html_file": "offer_1137_3.html",
    "name": "iiyama ProLite B1980D-W1, 19\"",
    "offer_link": "https://www.amazon.de/dp/B09JCQY22M?linkCode=xm2&camp=2025&creative=165953&smid=A3JWKAKR8XB7XF&creativeASIN=B09JCQY22M&tag=geizhals1-21",
    "price": 175.46,
    "raw_specifications": {
        "ASIN": "B09JCQY22M",
        "Amazon Bestseller-Rang": "Nr. 195,731 in Computer & Zubeh\u00f6r (Siehe Top 100 in Computer & Zubeh\u00f6r)  Nr. 3,066 in Monitore",
        "Artikelgewicht": "\u200e6,42 Kilograms",
        "Batterien enthalten": "\u200eNein",
        "Bildschirmaufl\u00f6sung": "\u200e1280 x 1024 (1.3 megapixel)",
        "Display-Gr\u00f6\u00dfe": "\u200e19 Zoll",
        "Durchschnittliche Kundenbewertung": "5,0  5,0 von 5 Sternen    \n    4 Sternebewertungen   \n\n\n 5,0 von 5 Sternen",
        "Farbe": "\u200eweiss",
        "Garantierte Software-Updates bis": "\u200eunbekannt",
        "Hersteller": "\u200eIIYAMA",
        "Im Angebot von Amazon.de seit": "14. Oktober 2021",
        "L\u00f6sung": "\u200e1280 x 1024",
        "Marke": "\u200eiiyama",
        "Modell/Serie": "\u200eProLite B1980D-W1",
        "Modellnummer": "\u200eB1980D-W1",
        "Produktabmessungen": "\u200e41,1 x 21 x 42,15 cm; 6,42 Kilogramm",
        "Volt": "\u200e12 Volt"
    },
    "raw_specifications_text": "Marke: \u200eiiyama\nHersteller: \u200eIIYAMA\nModell/Serie: \u200eProLite B1980D-W1\nProduktabmessungen: \u200e41,1 x 21 x 42,15 cm; 6,42 Kilogramm\nModellnummer: \u200eB1980D-W1\nFarbe: \u200eweiss\nDisplay-Gr\u00f6\u00dfe: \u200e19 Zoll\nBildschirmaufl\u00f6sung: \u200e1280 x 1024 (1.3 megapixel)\nL\u00f6sung: \u200e1280 x 1024\nVolt: \u200e12 Volt\nBatterien enthalten: \u200eNein\nArtikelgewicht: \u200e6,42 Kilograms\nGarantierte Software-Updates bis: \u200eunbekannt\nASIN: B09JCQY22M\nDurchschnittliche Kundenbewertung: 5,0  5,0 von 5 Sternen    \n    4 Sternebewertungen   \n\n\n 5,0 von 5 Sternen\nAmazon Bestseller-Rang: Nr. 195,731 in Computer & Zubeh\u00f6r (Siehe Top 100 in Computer & Zubeh\u00f6r)  Nr. 3,066 in Monitore\nIm Angebot von Amazon.de seit: 14. Oktober 2021",
    "reference_file": "offer_reference_1137.json",
    "shop_name": "Amazon.at"
}