{
    "html_file": "offer_1133_0.html",
    "name": "LG 24QP550-B, 23.8\"",
    "offer_link": "https://www.proshop.at/Bildschirm/LG-24-Bildschirm-24QP550-QHD-75Hz-Black-5-ms-AMD-FreeSync/3000526?utm_source=geizhals&utm_medium=cpc&utm_campaign=pricesite",
    "price": 193.82,
    "raw_specifications": {
        "Abmessungen (Breite x Tiefe x H\u00f6he)": "54.01 cm x 24 cm x 37.6 cm - mit Fu\u00df",
        "Abmessungen (Breite x Tiefe x H\u00f6he) - mit Fu\u00df": "54.01 cm x 24 cm x 37.6 cm",
        "Adaptive-Sync Technologie": "AMD FreeSync",
        "Besonderheiten": "Flicker Safe, Reader Mode, Intelligente Energiespartechnologie, Black Stabilizer, DAS Mode (Dynamic Action Sync), Color Weakness Mode, Super Resolution+, 3 Side Borderless Design",
        "Bildschirmbeschichtung": "Blendfrei",
        "Bildschirmtyp": "IPS",
        "Diagonalabmessung": "60 cm (24\")",
        "Display-Typ": "LED-hintergrundbeleuchteter LCD-Monitor / TFT-Aktivmatrix",
        "EAN": "8806091285928",
        "Eingangsanschl\u00fcsse": "2xHDMI, DisplayPort",
        "Eingangsspannung": "Wechselstrom 120/230 V (50/60 Hz)",
        "Einstellungen der Anzeigeposition": "H\u00f6he, Pivot (Rotation), Drehung, Neigung",
        "Energie Effizienzklasse": "Klasse F",
        "Energieklasse (HDR)": "Klasse F",
        "Farbraum": "99% sRGB (CIE 1931)",
        "Farbunterst\u00fctzung": "16,7 Millionen Farben",
        "Ger\u00e4tetyp": "LED-hintergrundbeleuchteter LCD-Monitor - 60 cm (24\")",
        "Gewicht": "5.5 kg",
        "HDR-Format": "HDR10",
        "HDR-f\u00e4hig": "HDR10",
        "Helligkeit": "300 cd/m\u00b2",
        "Hersteller": "LG",
        "Hintergrundbeleuchtungs-Technologie": "LED-Hintergrundbeleuchtung",
        "Horizontaler Betrachtungswinkel": "178",
        "Kontrast": "1000:1",
        "Leistungsaufnahme im Ein-Zustand": "19.6 W",
        "Leistungsmerkmale": "Slot f\u00fcr Sicherheitsschloss (Kabelschloss getrennt erh\u00e4ltlich)",
        "Mitgelieferte Software": "Dual Controller Software, LG On-Screen Control",
        "Modell": "24QP550-B",
        "Native Aufl\u00f6sung": "QHD 2560 x 1440 bei 75 Hz",
        "Produktbeschreibung": "LG 24QP550-B - LED-Monitor - QHD - 60 cm (24\") - HDR",
        "Reaktionszeit": "5 ms (Gray-to-Gray)",
        "Schlosstyp zur Diebstahlsicherung": "Kensington Slot",
        "Schnittstellen": "2 x HDMI  DisplayPort 1.4  Kopfh\u00f6rer",
        "Seitenverh\u00e4ltnis": "16:9",
        "Sichtbare Bildfl\u00e4che": "60.45 cm (23.8\")",
        "Spannung": "Wechselstrom 120/230 V (50/60 Hz)",
        "Stromverbrauch (Aus-Modus)": "0.3 Watt",
        "Stromverbrauch (max.)": "22 Watt",
        "Stromverbrauch (typisch)": "19 Watt",
        "Stromverbrauch HDR (eingeschaltet)": "19.6 kWh/1.000 h",
        "Stromverbrauch SDR (eingeschaltet)": "19.6 kWh/1.000 h",
        "Stromverbrauch im Standby-Modus": "0.5 Watt",
        "VESA-Halterung": "100 x 100 mm",
        "Vertikaler Betrachtungswinkel": "178",
        "Waren-Nr.": "3000526",
        "Zum Hersteller": "www.lge.com"
    },
    "raw_specifications_text": "Hersteller: LG\nWaren-Nr.: 3000526\nModell: 24QP550-B\nEAN: 8806091285928\nZum Hersteller: www.lge.com\nProduktbeschreibung: LG 24QP550-B - LED-Monitor - QHD - 60 cm (24\") - HDR\nGer\u00e4tetyp: LED-hintergrundbeleuchteter LCD-Monitor - 60 cm (24\")\nEnergie Effizienzklasse: Klasse F\nLeistungsaufnahme im Ein-Zustand: 19.6 W\nAdaptive-Sync Technologie: AMD FreeSync\nBildschirmtyp: IPS\nSeitenverh\u00e4ltnis: 16:9\nNative Aufl\u00f6sung: QHD 2560 x 1440 bei 75 Hz\nHelligkeit: 300 cd/m\u00b2\nKontrast: 1000:1\nHDR-f\u00e4hig: HDR10\nReaktionszeit: 5 ms (Gray-to-Gray)\nFarbunterst\u00fctzung: 16,7 Millionen Farben\nFarbraum: 99% sRGB (CIE 1931)\nEingangsanschl\u00fcsse: 2xHDMI, DisplayPort\nEinstellungen der Anzeigeposition: H\u00f6he, Pivot (Rotation), Drehung, Neigung\nBildschirmbeschichtung: Blendfrei\nSpannung: Wechselstrom 120/230 V (50/60 Hz)\nAbmessungen (Breite x Tiefe x H\u00f6he) - mit Fu\u00df: 54.01 cm x 24 cm x 37.6 cm\nGewicht: 5.5 kg\nDisplay-Typ: LED-hintergrundbeleuchteter LCD-Monitor / TFT-Aktivmatrix\nEnergieklasse (HDR): Klasse F\nDiagonalabmessung: 60 cm (24\")\nSichtbare Bildfl\u00e4che: 60.45 cm (23.8\")\nHDR-Format: HDR10\nHorizontaler Betrachtungswinkel: 178\nVertikaler Betrachtungswinkel: 178\nHintergrundbeleuchtungs-Technologie: LED-Hintergrundbeleuchtung\nBesonderheiten: Flicker Safe, Reader Mode, Intelligente Energiespartechnologie, Black Stabilizer, DAS Mode (Dynamic Action Sync), Color Weakness Mode, Super Resolution+, 3 Side Borderless Design\nAbmessungen (Breite x Tiefe x H\u00f6he): 54.01 cm x 24 cm x 37.6 cm - mit Fu\u00df\nSchnittstellen: 2 x HDMI  DisplayPort 1.4  Kopfh\u00f6rer\nVESA-Halterung: 100 x 100 mm\nLeistungsmerkmale: Slot f\u00fcr Sicherheitsschloss (Kabelschloss getrennt erh\u00e4ltlich)\nSchlosstyp zur Diebstahlsicherung: Kensington Slot\nEingangsspannung: Wechselstrom 120/230 V (50/60 Hz)\nStromverbrauch SDR (eingeschaltet): 19.6 kWh/1.000 h\nStromverbrauch HDR (eingeschaltet): 19.6 kWh/1.000 h\nStromverbrauch (typisch): 19 Watt\nStromverbrauch (max.): 22 Watt\nStromverbrauch im Standby-Modus: 0.5 Watt\nStromverbrauch (Aus-Modus): 0.3 Watt\nMitgelieferte Software: Dual Controller Software, LG On-Screen Control",
    "reference_file": "offer_reference_1133.json",
    "shop_name": "Proshop.at"
}