{
    "html_file": "offer_1473_9.html",
    "name": "LG UltraWide 34WN780-B, 34\"",
    "offer_link": "https://www.mylemon.at/artikel/lg/34wn780_b/34wn780-b-34-ips-3440x1440.html",
    "price": 652.08,
    "raw_specifications": {
        "AC Eingangsfrequenz": "50/60 Hz",
        "AC Eingangsspannung": "100 - 240 V",
        "AMD FreeSync": "Ja",
        "Anzahl DisplayPort Anschl\u00fcsse": "1",
        "Anzahl HDMI-Anschl\u00fcsse": "2",
        "Anzahl der Farben des Displays": "16,7 Millionen Farben",
        "Anzahl der Lautsprecher": "2",
        "Anzahl der nachgeschalteten Steckpl\u00e4tze vom Typ USB-A": "2",
        "Anzahl der vorgeschalteten Steckpl\u00e4tze": "2",
        "Artikelnummer": "M15Y94UL",
        "Aufl\u00f6sung": "3440x1440",
        "Bildschirmdiagonale": "86,4 cm (34 Zoll)",
        "Bildschirmform": "Flach",
        "Bildschirmtechnologie": "LED",
        "Bildwinkel, horizontal": "178\u00b0",
        "Bildwinkel, vertikal": "178\u00b0",
        "Breite (ohne Standfu\u00df)": "81,7 cm",
        "DVI Anschluss": "Nein",
        "Display-Aufl\u00f6sung": "3440 x 1440 Pixel",
        "Displaygr\u00f6\u00dfe": "34 Zoll",
        "EAN": "8806091090997",
        "Eingebaute Lautsprecher": "Ja",
        "Energieeffizienzklasse (HDR)": "G",
        "Energieeffizienzklasse (SDR)": "G",
        "Energieeffizienzskala": "A bis G",
        "Energieverbrauch (HDR) pro 1.000 Stunden": "49 kWh",
        "Energieverbrauch (SDR) pro 1.000 Stunden": "37 kWh",
        "Flimmerfreie Technologie": "Ja",
        "Ger\u00e4tebreite (inkl. Fu\u00df)": "816,5 mm",
        "Ger\u00e4teh\u00f6he (inkl. Fu\u00df)": "612,4 mm",
        "Ger\u00e4tetiefe (inkl. Fu\u00df)": "406,4 mm",
        "Gewicht (mit St\u00e4nder)": "10,8 kg",
        "Gewicht (ohne St\u00e4nder)": "6,9 kg",
        "HD-Typ": "UltraWide Quad HD",
        "HDMI": "Ja",
        "Helligkeit (typisch)": "300 cd/m\u00b2",
        "Hersteller Artikelnummer": "34WN780-B",
        "High Dynamic Range Video (HDR) Unterst\u00fctzung": "Ja",
        "H\u00f6he (ohne Standfu\u00df)": "36,5 cm",
        "H\u00f6heneinstellung": "13 cm",
        "H\u00f6henverstellung": "Ja",
        "Integrierte Kamera": "Nein",
        "Integrierter USB-Hub": "Nein",
        "Kontrastverh\u00e4ltnis": "1000:1",
        "Kopfh\u00f6rerausgang": "Ja",
        "Marktpositionierung": "Business",
        "Maximale Bildwiederholrate": "75 Hz",
        "Natives Seitenverh\u00e4ltnis": "21:9",
        "On-Screen-Display (OSD)": "Ja",
        "Panel": "IPS",
        "Panel-Montage-Schnittstelle": "100 x 100 mm",
        "Panel-Typ": "IPS",
        "Pixel Abstand": "0,2325 x 0,2325 mm",
        "Produktfarbe": "Schwarz",
        "RMS-Leistung": "14 W",
        "Reaktionszeit": "5 ms",
        "Technologie mit hohem Dynamikbereich (HDR)": "High Dynamic Range 10 (HDR10)",
        "Tiefe (ohne Standfu\u00df)": "4,55 cm",
        "Touchscreen": "Nein",
        "VESA Halterung": "100x100 mm",
        "VESA-Halterung": "Ja",
        "Verpackungsbreite": "940 mm",
        "Verpackungsh\u00f6he": "516 mm",
        "Verpackungstiefe": "268 mm",
        "Video Anschl\u00fcsse": "2x HDMI, 1x DisplayPort",
        "Warentarifnummer (HS)": "85285210",
        "sRGB Abdeckung (klassisch)": "99%"
    },
    "raw_specifications_text": "Displaygr\u00f6\u00dfe: 34 Zoll\nAufl\u00f6sung: 3440x1440\nPanel: IPS\nReaktionszeit: 5 ms\nVideo Anschl\u00fcsse: 2x HDMI, 1x DisplayPort\nVESA Halterung: 100x100 mm\nHersteller Artikelnummer: 34WN780-B\nEAN: 8806091090997\nArtikelnummer: M15Y94UL\nBildschirmdiagonale: 86,4 cm (34 Zoll)\nDisplay-Aufl\u00f6sung: 3440 x 1440 Pixel\nNatives Seitenverh\u00e4ltnis: 21:9\nBildschirmtechnologie: LED\nTouchscreen: Nein\nHD-Typ: UltraWide Quad HD\nPanel-Typ: IPS\nBildschirmform: Flach\nKontrastverh\u00e4ltnis: 1000:1\nMaximale Bildwiederholrate: 75 Hz\nAnzahl der Farben des Displays: 16,7 Millionen Farben\nHelligkeit (typisch): 300 cd/m\u00b2\nBildwinkel, horizontal: 178\u00b0\nBildwinkel, vertikal: 178\u00b0\nPixel Abstand: 0,2325 x 0,2325 mm\nHigh Dynamic Range Video (HDR) Unterst\u00fctzung: Ja\nTechnologie mit hohem Dynamikbereich (HDR): High Dynamic Range 10 (HDR10)\nsRGB Abdeckung (klassisch): 99%\nAMD FreeSync: Ja\nFlimmerfreie Technologie: Ja\nEingebaute Lautsprecher: Ja\nIntegrierte Kamera: Nein\nAnzahl der Lautsprecher: 2\nRMS-Leistung: 14 W\nMarktpositionierung: Business\nProduktfarbe: Schwarz\nIntegrierter USB-Hub: Nein\nHDMI: Ja\nKopfh\u00f6rerausgang: Ja\nAnzahl der vorgeschalteten Steckpl\u00e4tze: 2\nAnzahl der nachgeschalteten Steckpl\u00e4tze vom Typ USB-A: 2\nDVI Anschluss: Nein\nAnzahl HDMI-Anschl\u00fcsse: 2\nAnzahl DisplayPort Anschl\u00fcsse: 1\nVESA-Halterung: Ja\nH\u00f6henverstellung: Ja\nPanel-Montage-Schnittstelle: 100 x 100 mm\nH\u00f6heneinstellung: 13 cm\nOn-Screen-Display (OSD): Ja\nEnergieeffizienzklasse (SDR): G\nEnergieeffizienzklasse (HDR): G\nEnergieverbrauch (SDR) pro 1.000 Stunden: 37 kWh\nEnergieverbrauch (HDR) pro 1.000 Stunden: 49 kWh\nAC Eingangsspannung: 100 - 240 V\nAC Eingangsfrequenz: 50/60 Hz\nEnergieeffizienzskala: A bis G\nGer\u00e4tebreite (inkl. Fu\u00df): 816,5 mm\nGer\u00e4tetiefe (inkl. Fu\u00df): 406,4 mm\nGer\u00e4teh\u00f6he (inkl. Fu\u00df): 612,4 mm\nGewicht (mit St\u00e4nder): 10,8 kg\nBreite (ohne Standfu\u00df): 81,7 cm\nTiefe (ohne Standfu\u00df): 4,55 cm\nH\u00f6he (ohne Standfu\u00df): 36,5 cm\nGewicht (ohne St\u00e4nder): 6,9 kg\nVerpackungsbreite: 940 mm\nVerpackungstiefe: 268 mm\nVerpackungsh\u00f6he: 516 mm\nWarentarifnummer (HS): 85285210",
    "reference_file": "offer_reference_1473.json",
    "shop_name": "mylemon.at"
}