{
    "html_file": "offer_1883_1.html",
    "name": "Philips P-line 498P9, 48.8\"",
    "offer_link": "https://www.amazon.de/dp/B08DP5G1LL?linkCode=xm2&camp=2025&creative=165953&smid=A3JWKAKR8XB7XF&creativeASIN=B08DP5G1LL&tag=geizhals1-21",
    "price": 827.9,
    "raw_specifications": {
        "ASIN": "B08DP5G1LL",
        "Amazon Bestseller-Rang": "Nr. 173,470 in Computer & Zubeh\u00f6r (Siehe Top 100 in Computer & Zubeh\u00f6r)  Nr. 2,823 in Monitore",
        "Anzahl HDMI Schnittstellen": "\u200e2",
        "Artikelgewicht": "\u200e15,2 Kilograms",
        "Batterien enthalten": "\u200eNein",
        "Bildschirmaufl\u00f6sung": "\u200e1440 x 5120",
        "Display-Gr\u00f6\u00dfe": "\u200e49",
        "Durchschnittliche Kundenbewertung": "4,5  4,5 von 5 Sternen    \n    1.795 Sternebewertungen   \n\n\n 4,5 von 5 Sternen",
        "Farbe": "\u200eschwarz",
        "Garantierte Software-Updates bis": "\u200eunbekannt",
        "Hersteller": "\u200ePhilips",
        "Im Angebot von Amazon.de seit": "22. Juli 2020",
        "L\u00f6sung": "\u200e5120x1440",
        "Marke": "\u200ePhilips",
        "Modellnummer": "\u200e498P9/00",
        "Produktabmessungen": "\u200e119,4 x 30,3 x 56,8 cm; 15,2 Kilogramm",
        "Prozessortyp": "\u200eOthers",
        "Speicher-Art": "\u200eDIMM",
        "Volt": "\u200e240 Volt"
    },
    "raw_specifications_text": "Marke: \u200ePhilips\nHersteller: \u200ePhilips\nProduktabmessungen: \u200e119,4 x 30,3 x 56,8 cm; 15,2 Kilogramm\nModellnummer: \u200e498P9/00\nFarbe: \u200eschwarz\nDisplay-Gr\u00f6\u00dfe: \u200e49\nBildschirmaufl\u00f6sung: \u200e1440 x 5120\nL\u00f6sung: \u200e5120x1440\nProzessortyp: \u200eOthers\nSpeicher-Art: \u200eDIMM\nAnzahl HDMI Schnittstellen: \u200e2\nVolt: \u200e240 Volt\nBatterien enthalten: \u200eNein\nArtikelgewicht: \u200e15,2 Kilograms\nGarantierte Software-Updates bis: \u200eunbekannt\nASIN: B08DP5G1LL\nDurchschnittliche Kundenbewertung: 4,5  4,5 von 5 Sternen    \n    1.795 Sternebewertungen   \n\n\n 4,5 von 5 Sternen\nAmazon Bestseller-Rang: Nr. 173,470 in Computer & Zubeh\u00f6r (Siehe Top 100 in Computer & Zubeh\u00f6r)  Nr. 2,823 in Monitore\nIm Angebot von Amazon.de seit: 22. Juli 2020",
    "reference_file": "offer_reference_1883.json",
    "shop_name": "Amazon.at"
}