{
    "html_file": "offer_1602_17.html",
    "name": "Philips B-line 276B1JH, 27\"",
    "offer_link": "https://syswork.at/sw/index.html?open&mid=Artikel&artid=mon-1170&from=geizhals.at",
    "price": 562.0,
    "raw_specifications": {
        "AC Eingangsfrequenz": "50/60 Hz",
        "AC Eingangsspannung": "100 - 240 V",
        "AMD FreeSync": "Nein",
        "Anzahl DisplayPort Anschl\u00fcsse": "1",
        "Anzahl Ethernet-LAN-Anschl\u00fcsse (RJ-45)": "1",
        "Anzahl HDMI-Anschl\u00fcsse": "1",
        "Anzahl OSD-Sprachen": "21",
        "Anzahl der Farben des Displays": "16,7 Millionen Farben",
        "Anzahl der Lautsprecher": "2",
        "Anzahl der Upstream-Ports USB Typ-C": "1",
        "Anzahl der nachgeschalteten Ports vom Typ USB-C": "1",
        "Anzahl der nachgeschalteten Steckpl\u00e4tze vom Typ USB-A": "4",
        "Anzahl der vorgeschalteten Steckpl\u00e4tze": "1",
        "Audioanschl\u00fcsse": "Nein",
        "Audioausgang": "Ja",
        "Au\u00dfenverkleidungstyp": "Texturiert",
        "Beh\u00f6rdliche Zulassung": "UKRAINIAN; CB; TUV/GS; TUV Ergo; SEMKO; CU-EAC; EAEU RoHS; FCC Class B; ICES-003; CE Mark; TUV Eye Comfort certified",
        "Betriebsanleitung": "Ja",
        "Betriebstemperatur": "0 - 40 \u00b0C",
        "Bild-Verbesserung": "SmartImage",
        "Bildschirmdiagonale": "68,6 cm (27 Zoll)",
        "Bildschirmdiagonale (cm)": "68,6 cm",
        "Bildschirmform": "Flach",
        "Bildschirmtechnologie": "LCD",
        "Bildwinkel, horizontal": "178\u00b0",
        "Bildwinkel, vertikal": "178\u00b0",
        "Blendfreier Bildschirm": "Ja",
        "Breite (ohne Standfu\u00df)": "61,3 cm",
        "DDC/CI": "Ja",
        "DVI Anschluss": "Nein",
        "Datenblatt": "Kein Datenblatt verf\u00fcgbar",
        "Digital horizontale Frequenz": "30 - 114 kHz",
        "Digital vertikale Frequenz": "48 - 75 Hz",
        "Display-Aufl\u00f6sung": "2560 x 1440 Pixel",
        "Display-Oberfl\u00e4che": "Matt",
        "DisplayPorts ausgang": "Ja",
        "DisplayPorts-Version": "1.4",
        "Dynamisches Kontrastverh\u00e4ltnis Marketingbezeichnung": "SmartContrast",
        "ECO-Modus": "Ja",
        "Einfach zu lesen Modus": "Ja",
        "Eingebaute Lautsprecher": "Ja",
        "Eingebauter Ethernet-Anschluss": "Ja",
        "Eingebautes Mikrofon": "Ja",
        "Energieeffizienzklasse (SDR)": "E",
        "Energieeffizienzskala": "A bis G",
        "Energieverbrauch (SDR) pro 1.000 Stunden": "20 kWh",
        "Enth\u00e4lt nicht": "Quecksilber, PVC/BFR",
        "Ethernet LAN Datentransferraten": "10,100,1000 Mbit/s",
        "Flimmerfreie Technologie": "Ja",
        "Fu\u00dffarbe": "Schwarz",
        "Ger\u00e4tebreite (inkl. Fu\u00df)": "613 mm",
        "Ger\u00e4teh\u00f6he (inkl. Fu\u00df)": "537 mm",
        "Ger\u00e4tetiefe (inkl. Fu\u00df)": "225 mm",
        "Gewicht (mit St\u00e4nder)": "7,38 kg",
        "Gewicht (ohne St\u00e4nder)": "5,59 kg",
        "Gleichstrom-Anschluss (DC)": "Ja",
        "HBR3-Unterst\u00fctzung": "Ja",
        "HD-Typ": "Quad HD",
        "HDCP": "Ja",
        "HDCP-Version": "1.4",
        "HDMI": "Ja",
        "HDMI-Version": "1.4",
        "Helligkeit (typisch)": "350 cd/m\u00b2",
        "Herstellerlink": "Philips",
        "Horizontaler Scanbereich": "30 - 114 kHz",
        "H\u00f6he (ohne Standfu\u00df)": "36,6 cm",
        "H\u00f6he bei Betrieb": "0 - 3658 m",
        "H\u00f6he bei Lagerung": "0 - 12192 m",
        "H\u00f6heneinstellung": "15 cm",
        "H\u00f6henverstellung": "Ja",
        "Integrierte Kamera": "Ja",
        "Integrierter USB-Hub": "Ja",
        "Kabelsperre-Slot": "Ja",
        "Komponentenvideo-Synchronisation": "Separate sync",
        "Kontrastverh\u00e4ltnis": "1000:1",
        "Kontrastverh\u00e4ltnis (dynamisch)": "50000000:1",
        "Kopfh\u00f6rerausgang": "Nein",
        "LED-Anzeigen": "T\u00e4tigkeit, Stand-by",
        "Lichtsensor": "Ja",
        "Low-Blue-Light-Technologie": "Ja",
        "LowBlue-Modus": "Ja",
        "Maximale Bildwiederholrate": "75 Hz",
        "Megapixel (ca.)": "2 MP",
        "Men\u00fcsprachen": "Vereinfachtes Chinesisch, Traditionelles Chinesisch, Tschechisch, Deutsch, Niederl\u00e4ndisch, Englisch, Spanisch, Finnisch, Franz\u00f6sisch, Griechisch, Ungarisch, Italienisch, Japanisch, Koreanisch, Polnisch, Portugiesisch, Russisch, Schwedisch, T\u00fcrkisch, Ukrainisch",
        "Mitgelieferte Kabel": "HDMI, DisplayPort, USB Typ-C, Gleichstrom, AC",
        "Mitgelieferte Software": "SmartControl",
        "Mittlere Betriebsdauer zwischen Ausf\u00e4llen (MTBF)": "70000 h",
        "NTSC Abdeckung (typisch)": "104%",
        "NVIDIA G-SYNC": "Nein",
        "Nach Gebrauch recycelter Kunststoff": "85%",
        "Nachhaltigkeitszertifikate": "ENERGY STAR, TCO, RoHS",
        "Natives Seitenverh\u00e4ltnis": "16:9",
        "Neigungsverstellung": "Ja",
        "Neigungswinkelbereich": "-5 - 30\u00b0",
        "Netzteil Ausgangsspannung": "19 V",
        "Netzteiltyp": "Intern",
        "Oberfl\u00e4chenh\u00e4rte": "3H",
        "On-Screen-Display (OSD)": "Ja",
        "Paketgewicht": "11,1 kg",
        "Panel-Montage-Schnittstelle": "100 x 100 mm",
        "Panel-Typ": "IPS",
        "Pivot": "Ja",
        "Pivot Winkel": "-90 - 90\u00b0",
        "Pixel Abstand": "0,2331 x 0,2331 mm",
        "Pixeldichte": "109 ppi",
        "Plug & Play": "Ja",
        "Produktfarbe": "Schwarz",
        "Produktlink": "Link",
        "RMS-Leistung": "3 W",
        "Reaktionszeit": "4 ms",
        "Recycelbares Verpackungsmaterial": "100%",
        "Relative Luftfeuchtigkeit in Betrieb": "20 - 80%",
        "Schwenkwinkelbereich": "-180 - 180\u00b0",
        "Schwermetallfrei": "Hg (Quecksilber), Pb (Blei)",
        "Seitenverh\u00e4ltnis": "16:9",
        "Sichtbare Gr\u00f6\u00dfe (horizontal)": "59,7 cm",
        "Sichtbare Gr\u00f6\u00dfe (vertikal)": "33,6 cm",
        "Slot-Typ Kabelsperre": "Kensington",
        "Stromverbrauch (PowerSave)": "17,6 W",
        "Stromverbrauch (Standardbetrieb)": "17,7 W",
        "Stromverbrauch (Standby)": "0,3 W",
        "St\u00e4nder enthalten": "Ja",
        "Temperaturbereich bei Lagerung": "-20 - 60 \u00b0C",
        "Tiefe (ohne Standfu\u00df)": "5,4 cm",
        "Touchscreen": "Nein",
        "Tr\u00fcbungsrate": "25%",
        "Typ der Hintergrundbeleuchtung": "W-LED",
        "USB Power Delivery": "Ja",
        "USB-Hub-Version": "3.2 Gen 1 (3.1 Gen 1)",
        "USB-Stromversorgung Revision": "3.0",
        "USB-Stromversorgung bis zu": "100 W",
        "USB-Typ-C DisplayPort-Wechselmodus": "Ja",
        "USB-Upstream-Porttyp": "USB Typ-C",
        "Unterst\u00fctzt Mac-Betriebssysteme": "Mac OS X 10.0 Cheetah, Mac OS X 10.1 Puma, Mac OS X 10.10 Yosemite, Mac OS X 10.11 El Capitan, Mac OS X 10.12 Sierra, Mac OS X 10.13 High Sierra, Mac OS X 10.14 Mojave, Mac OS X 10.15 Catalina, Mac OS X 10.15.3 Catalina, Mac OS X 10.2 Jaguar, Mac OS X 10.3 Panther, Mac OS X 10.4 Tiger, Mac OS X 10.5 Leopard, Mac OS X 10.6 Snow Leopard, Mac OS X 10.7 Lion, Mac OS X 10.8 Mountain Lion, Mac OS X 10.9 Mavericks, Mac OS X 11.0 Big Sur",
        "Unterst\u00fctzt Windows-Betriebssysteme": "Windows 10, Windows 7, Windows 8, Windows 8.1",
        "VESA-Halterung": "Ja",
        "Verpackungsbreite": "730 mm",
        "Verpackungsh\u00f6he": "471 mm",
        "Verpackungstiefe": "193 mm",
        "Vertikaler Scanbereich": "48 - 75 Hz",
        "Vorderer Rahmen": "Schwarz",
        "Wake-On-LAN": "Ja",
        "Warentarifnummer (HS)": "85285210",
        "Zertifizierung": "UKRAINIAN, CB, TUV/GS, TUV Ergo, SEMKO, CU-EAC, EAEU RoHS, FCC Class B, ICES-003, CE Mark, TUV Eye Comfort certified",
        "sRGB": "Ja",
        "sRGB Abdeckung (klassisch)": "107%"
    },
    "raw_specifications_text": "Bildschirmdiagonale: 68,6 cm (27 Zoll)\nDisplay-Aufl\u00f6sung: 2560 x 1440 Pixel\nNatives Seitenverh\u00e4ltnis: 16:9\nBildschirmtechnologie: LCD\nTouchscreen: Nein\nHD-Typ: Quad HD\nPanel-Typ: IPS\nBildschirmform: Flach\nKontrastverh\u00e4ltnis: 1000:1\nMaximale Bildwiederholrate: 75 Hz\nAnzahl der Farben des Displays: 16,7 Millionen Farben\nTyp der Hintergrundbeleuchtung: W-LED\nHelligkeit (typisch): 350 cd/m\u00b2\nReaktionszeit: 4 ms\nDisplay-Oberfl\u00e4che: Matt\nBlendfreier Bildschirm: Ja\nSeitenverh\u00e4ltnis: 16:9\nKontrastverh\u00e4ltnis (dynamisch): 50000000:1\nDynamisches Kontrastverh\u00e4ltnis Marketingbezeichnung: SmartContrast\nBildwinkel, horizontal: 178\u00b0\nBildwinkel, vertikal: 178\u00b0\nPixel Abstand: 0,2331 x 0,2331 mm\nPixeldichte: 109 ppi\nHorizontaler Scanbereich: 30 - 114 kHz\nVertikaler Scanbereich: 48 - 75 Hz\nSichtbare Gr\u00f6\u00dfe (horizontal): 59,7 cm\nSichtbare Gr\u00f6\u00dfe (vertikal): 33,6 cm\nDigital horizontale Frequenz: 30 - 114 kHz\nDigital vertikale Frequenz: 48 - 75 Hz\nBildschirmdiagonale (cm): 68,6 cm\nDDC/CI: Ja\nTr\u00fcbungsrate: 25%\nOberfl\u00e4chenh\u00e4rte: 3H\nsRGB Abdeckung (klassisch): 107%\nNTSC Abdeckung (typisch): 104%\nsRGB: Ja\nNVIDIA G-SYNC: Nein\nAMD FreeSync: Nein\nKomponentenvideo-Synchronisation: Separate sync\nFlimmerfreie Technologie: Ja\nLow-Blue-Light-Technologie: Ja\nHBR3-Unterst\u00fctzung: Ja\nUnterst\u00fctzt Windows-Betriebssysteme: Windows 10, Windows 7, Windows 8, Windows 8.1\nUnterst\u00fctzt Mac-Betriebssysteme: Mac OS X 10.0 Cheetah, Mac OS X 10.1 Puma, Mac OS X 10.10 Yosemite, Mac OS X 10.11 El Capitan, Mac OS X 10.12 Sierra, Mac OS X 10.13 High Sierra, Mac OS X 10.14 Mojave, Mac OS X 10.15 Catalina, Mac OS X 10.15.3 Catalina, Mac OS X 10.2 Jaguar, Mac OS X 10.3 Panther, Mac OS X 10.4 Tiger, Mac OS X 10.5 Leopard, Mac OS X 10.6 Snow Leopard, Mac OS X 10.7 Lion, Mac OS X 10.8 Mountain Lion, Mac OS X 10.9 Mavericks, Mac OS X 11.0 Big Sur\nEingebaute Lautsprecher: Ja\nIntegrierte Kamera: Ja\nAnzahl der Lautsprecher: 2\nRMS-Leistung: 3 W\nMegapixel (ca.): 2 MP\nEingebautes Mikrofon: Ja\nProduktfarbe: Schwarz\nVorderer Rahmen: Schwarz\nFu\u00dffarbe: Schwarz\nSchwermetallfrei: Hg (Quecksilber), Pb (Blei)\nZertifizierung: UKRAINIAN, CB, TUV/GS, TUV Ergo, SEMKO, CU-EAC, EAEU RoHS, FCC Class B, ICES-003, CE Mark, TUV Eye Comfort certified\nIntegrierter USB-Hub: Ja\nHDMI: Ja\nKopfh\u00f6rerausgang: Nein\nUSB-Hub-Version: 3.2 Gen 1 (3.1 Gen 1)\nUSB-Upstream-Porttyp: USB Typ-C\nAnzahl der vorgeschalteten Steckpl\u00e4tze: 1\nAnzahl der Upstream-Ports USB Typ-C: 1\nAnzahl der nachgeschalteten Steckpl\u00e4tze vom Typ USB-A: 4\nAnzahl der nachgeschalteten Ports vom Typ USB-C: 1\nUSB-Typ-C DisplayPort-Wechselmodus: Ja\nUSB Power Delivery: Ja\nUSB-Stromversorgung bis zu: 100 W\nDVI Anschluss: Nein\nAnzahl HDMI-Anschl\u00fcsse: 1\nHDMI-Version: 1.4\nAnzahl DisplayPort Anschl\u00fcsse: 1\nDisplayPorts-Version: 1.4\nAudioanschl\u00fcsse: Nein\nAudioausgang: Ja\nHDCP: Ja\nHDCP-Version: 1.4\nGleichstrom-Anschluss (DC): Ja\nDisplayPorts ausgang: Ja\nEingebauter Ethernet-Anschluss: Ja\nVESA-Halterung: Ja\nKabelsperre-Slot: Ja\nH\u00f6henverstellung: Ja\nPanel-Montage-Schnittstelle: 100 x 100 mm\nSlot-Typ Kabelsperre: Kensington\nH\u00f6heneinstellung: 15 cm\nPivot: Ja\nPivot Winkel: -90 - 90\u00b0\nSchwenkwinkelbereich: -180 - 180\u00b0\nNeigungswinkelbereich: -5 - 30\u00b0\nOn-Screen-Display (OSD): Ja\nMen\u00fcsprachen: Vereinfachtes Chinesisch, Traditionelles Chinesisch, Tschechisch, Deutsch, Niederl\u00e4ndisch, Englisch, Spanisch, Finnisch, Franz\u00f6sisch, Griechisch, Ungarisch, Italienisch, Japanisch, Koreanisch, Polnisch, Portugiesisch, Russisch, Schwedisch, T\u00fcrkisch, Ukrainisch\nAnzahl OSD-Sprachen: 21\nPlug & Play: Ja\nLED-Anzeigen: T\u00e4tigkeit, Stand-by\nNeigungsverstellung: Ja\nEnergieeffizienzklasse (SDR): E\nEnergieverbrauch (SDR) pro 1.000 Stunden: 20 kWh\nStromverbrauch (Standardbetrieb): 17,7 W\nStromverbrauch (Standby): 0,3 W\nStromverbrauch (PowerSave): 17,6 W\nAC Eingangsspannung: 100 - 240 V\nAC Eingangsfrequenz: 50/60 Hz\nNetzteil Ausgangsspannung: 19 V\nNetzteiltyp: Intern\nEnergieeffizienzskala: A bis G\nBetriebstemperatur: 0 - 40 \u00b0C\nTemperaturbereich bei Lagerung: -20 - 60 \u00b0C\nRelative Luftfeuchtigkeit in Betrieb: 20 - 80%\nH\u00f6he bei Betrieb: 0 - 3658 m\nH\u00f6he bei Lagerung: 0 - 12192 m\nSt\u00e4nder enthalten: Ja\nMitgelieferte Kabel: HDMI, DisplayPort, USB Typ-C, Gleichstrom, AC\nBetriebsanleitung: Ja\nMitgelieferte Software: SmartControl\nGer\u00e4tebreite (inkl. Fu\u00df): 613 mm\nGer\u00e4tetiefe (inkl. Fu\u00df): 225 mm\nGer\u00e4teh\u00f6he (inkl. Fu\u00df): 537 mm\nGewicht (mit St\u00e4nder): 7,38 kg\nBreite (ohne Standfu\u00df): 61,3 cm\nTiefe (ohne Standfu\u00df): 5,4 cm\nH\u00f6he (ohne Standfu\u00df): 36,6 cm\nGewicht (ohne St\u00e4nder): 5,59 kg\nVerpackungsbreite: 730 mm\nVerpackungstiefe: 193 mm\nVerpackungsh\u00f6he: 471 mm\nPaketgewicht: 11,1 kg\nNachhaltigkeitszertifikate: ENERGY STAR, TCO, RoHS\nEnth\u00e4lt nicht: Quecksilber, PVC/BFR\nNach Gebrauch recycelter Kunststoff: 85%\nWarentarifnummer (HS): 85285210\nUSB-Stromversorgung Revision: 3.0\nAu\u00dfenverkleidungstyp: Texturiert\nRecycelbares Verpackungsmaterial: 100%\nECO-Modus: Ja\nLichtsensor: Ja\nEinfach zu lesen Modus: Ja\nLowBlue-Modus: Ja\nMittlere Betriebsdauer zwischen Ausf\u00e4llen (MTBF): 70000 h\nEthernet LAN Datentransferraten: 10,100,1000 Mbit/s\nAnzahl Ethernet-LAN-Anschl\u00fcsse (RJ-45): 1\nBild-Verbesserung: SmartImage\nBeh\u00f6rdliche Zulassung: UKRAINIAN; CB; TUV/GS; TUV Ergo; SEMKO; CU-EAC; EAEU RoHS; FCC Class B; ICES-003; CE Mark; TUV Eye Comfort certified\nWake-On-LAN: Ja\nDatenblatt: Kein Datenblatt verf\u00fcgbar\nProduktlink: Link\nHerstellerlink: Philips",
    "reference_file": "offer_reference_1602.json",
    "shop_name": "Syswork"
}