{
    "html_file": "offer_1907_21.html",
    "name": "ASUS BE24EQSB, 23.8\"",
    "offer_link": "https://www.taufnaus.de/product/10608348",
    "price": 256.43,
    "raw_specifications": {
        "Abmessungen (Breite x Tiefe x H\u00f6he)": "54 cm x 21.1 cm x 46.2 cm - mit Standfu\u00df (h\u00f6chste Position)",
        "Ausgangsleistung/Kanal": "2 Watt",
        "Besonderheiten": "HDCP, rahmenlos, ASUS Splendid Video Intelligence Technology, Trace Free Technology, ASUS Smart Contrast Ratio (ASCR), ASUS QuickFit Virtual Scale, Low Blue Light Mode, flimmerfreie Technologie, Farbtemperatur Auswahl",
        "Bildschirmbeschichtung": "Blendfrei",
        "Bildschirmtyp": "IPS",
        "Details zu Abmessungen & Gewicht": "Mit Standfu\u00df (h\u00f6chste Position) - Breite: 54 cm - Tiefe: 21.1 cm - H\u00f6he: 46.2 cm - Gewicht: 7.8 kg \u00a6 Ohne Fu\u00df - Breite: 54 cm - Tiefe: 4.7 cm - H\u00f6he: 33 cm - Gewicht: 5 kg \u00a6 Mit Standfu\u00df (niedrigste Position) - Breite: 54 cm - Tiefe: 21.1 cm - H\u00f6he: 33.2 cm - Gewicht: 7.8 kg",
        "Diagonalabmessung": "60.5 cm (23.8\")",
        "Display-Typ": "LED-hintergrundbeleuchteter LCD-Monitor / TFT-Aktivmatrix",
        "ENERGY STAR zertifiziert": "Ja",
        "Eingangsspannung": "Wechselstrom 100-240 V (50/60 Hz)",
        "Einstellungen der Anzeigeposition": "H\u00f6he, Pivot (Rotation), Drehung, Neigung",
        "Energie Effizienzklasse": "Klasse D",
        "Enthaltene Kabel": "1 x USB-Kabel \u00a6 1 x DisplayPort-Kabel \u00a6 1 x HDMI-Kabel",
        "Farbunterst\u00fctzung": "16,7 Millionen Farben",
        "Gewicht": "7.8 kg",
        "Helligkeit": "300 cd/m\u00b2",
        "Hintergrundbeleuchtungs-Technologie": "LED-Hintergrundbeleuchtung",
        "Horizontale Bildwiederholrate": "30 - 83 kHz",
        "Horizontaler Betrachtungswinkel": "178",
        "H\u00f6heneinstellung": "130 mm",
        "Integrierte Peripherieger\u00e4te": "USB 3.2 Gen 1 Hub",
        "Kennzeichnung": "TUV Rheinland Low Blue Light Certification, TUV Rheinland Flicker Free Certification, DisplayPort 1.2",
        "Kontrast": "1000:1 / 100000000:1 (dynamisch)",
        "Leistungsaufnahme im Ein-Zustand": "14.1 W",
        "Leistungsmerkmale": "Slot f\u00fcr Sicherheitsschloss (Kabelschloss getrennt erh\u00e4ltlich)",
        "Native Aufl\u00f6sung": "Full HD (1080p) 1920 x 1080 bei 60 Hz",
        "Neigungswinkel": "-5/+35",
        "Pixelpitch": "0.2745 mm",
        "Reaktionszeit": "5 ms (Gray-to-Gray)",
        "Rotationswinkel": "180",
        "Schlosstyp zur Diebstahlsicherung": "Kensington Slot",
        "Schnittstellen": "Audio Line-In \u00a6 Kopfh\u00f6rer \u00a6 DisplayPort 1.2 \u00a6 VGA \u00a6 HDMI \u00a6 4 x USB 3.2 Gen 1 Downstream \u00a6 USB 3.2 Gen 1 Upstream (Typ B)",
        "Schwenkwinkel": "360",
        "Seitenverh\u00e4ltnis": "16:9",
        "Stromverbrauch (Aus-Modus)": "0 Watt",
        "Stromverbrauch (typisch)": "15 Watt",
        "Stromverbrauch SDR (eingeschaltet)": "14.1 kWh/1.000 h",
        "Stromverbrauch im Standby-Modus": "0.5 Watt",
        "TCO-zertifiziert": "TCO Certified Displays 8",
        "Transportbreite": "64.9 cm",
        "Transportgewicht": "10.5 kg",
        "Transporth\u00f6he": "47.4 cm",
        "Transporttiefe": "19.2 cm",
        "Typ": "Lautsprecher - Stereo",
        "VESA-Halterung": "100 x 100 mm",
        "Vertikale Bildwiederholrate": "47 - 76 Hz",
        "Vertikaler Betrachtungswinkel": "178",
        "Zubeh\u00f6r im Lieferumfang": "MiniPC kit"
    },
    "raw_specifications_text": "Display-Typ: LED-hintergrundbeleuchteter LCD-Monitor / TFT-Aktivmatrix\nEnergie Effizienzklasse: Klasse D\nDiagonalabmessung: 60.5 cm (23.8\")\nIntegrierte Peripherieger\u00e4te: USB 3.2 Gen 1 Hub\nBildschirmtyp: IPS\nSeitenverh\u00e4ltnis: 16:9\nNative Aufl\u00f6sung: Full HD (1080p) 1920 x 1080 bei 60 Hz\nPixelpitch: 0.2745 mm\nHelligkeit: 300 cd/m\u00b2\nKontrast: 1000:1 / 100000000:1 (dynamisch)\nFarbunterst\u00fctzung: 16,7 Millionen Farben\nReaktionszeit: 5 ms (Gray-to-Gray)\nVertikale Bildwiederholrate: 47 - 76 Hz\nHorizontale Bildwiederholrate: 30 - 83 kHz\nHorizontaler Betrachtungswinkel: 178\nVertikaler Betrachtungswinkel: 178\nBildschirmbeschichtung: Blendfrei\nHintergrundbeleuchtungs-Technologie: LED-Hintergrundbeleuchtung\nBesonderheiten: HDCP, rahmenlos, ASUS Splendid Video Intelligence Technology, Trace Free Technology, ASUS Smart Contrast Ratio (ASCR), ASUS QuickFit Virtual Scale, Low Blue Light Mode, flimmerfreie Technologie, Farbtemperatur Auswahl\nAbmessungen (Breite x Tiefe x H\u00f6he): 54 cm x 21.1 cm x 46.2 cm - mit Standfu\u00df (h\u00f6chste Position)\nGewicht: 7.8 kg\nTyp: Lautsprecher - Stereo\nAusgangsleistung/Kanal: 2 Watt\nSchnittstellen: Audio Line-In \u00a6 Kopfh\u00f6rer \u00a6 DisplayPort 1.2 \u00a6 VGA \u00a6 HDMI \u00a6 4 x USB 3.2 Gen 1 Downstream \u00a6 USB 3.2 Gen 1 Upstream (Typ B)\nEinstellungen der Anzeigeposition: H\u00f6he, Pivot (Rotation), Drehung, Neigung\nNeigungswinkel: -5/+35\nSchwenkwinkel: 360\nRotationswinkel: 180\nH\u00f6heneinstellung: 130 mm\nVESA-Halterung: 100 x 100 mm\nLeistungsmerkmale: Slot f\u00fcr Sicherheitsschloss (Kabelschloss getrennt erh\u00e4ltlich)\nZubeh\u00f6r im Lieferumfang: MiniPC kit\nEnthaltene Kabel: 1 x USB-Kabel \u00a6 1 x DisplayPort-Kabel \u00a6 1 x HDMI-Kabel\nKennzeichnung: TUV Rheinland Low Blue Light Certification, TUV Rheinland Flicker Free Certification, DisplayPort 1.2\nSchlosstyp zur Diebstahlsicherung: Kensington Slot\nEingangsspannung: Wechselstrom 100-240 V (50/60 Hz)\nLeistungsaufnahme im Ein-Zustand: 14.1 W\nStromverbrauch SDR (eingeschaltet): 14.1 kWh/1.000 h\nStromverbrauch (typisch): 15 Watt\nStromverbrauch im Standby-Modus: 0.5 Watt\nStromverbrauch (Aus-Modus): 0 Watt\nDetails zu Abmessungen & Gewicht: Mit Standfu\u00df (h\u00f6chste Position) - Breite: 54 cm - Tiefe: 21.1 cm - H\u00f6he: 46.2 cm - Gewicht: 7.8 kg \u00a6 Ohne Fu\u00df - Breite: 54 cm - Tiefe: 4.7 cm - H\u00f6he: 33 cm - Gewicht: 5 kg \u00a6 Mit Standfu\u00df (niedrigste Position) - Breite: 54 cm - Tiefe: 21.1 cm - H\u00f6he: 33.2 cm - Gewicht: 7.8 kg\nTransportbreite: 64.9 cm\nTransporttiefe: 19.2 cm\nTransporth\u00f6he: 47.4 cm\nTransportgewicht: 10.5 kg\nTCO-zertifiziert: TCO Certified Displays 8\nENERGY STAR zertifiziert: Ja",
    "reference_file": "offer_reference_1907.json",
    "shop_name": "TaufNaus"
}