{
    "html_file": "offer_510_26.html",
    "name": "HP E22 G5, 21.5\"",
    "offer_link": "https://ms-it-beratung.at/shop/details.php?art=422645&artname=HP+E22+G5+IPS+FHD+1920x1080+HDMI%2FDP+250cd",
    "price": 187.0,
    "raw_specifications": {
        "AC Eingangsfrequenz": "50 - 60 Hz",
        "AC Eingangsspannung": "100 - 240 V",
        "AMD FreeSync": "Nein",
        "Abnehmbarer Standfu\u00df": "Ja",
        "Anzahl DisplayPort Anschl\u00fcsse": "1",
        "Anzahl HDMI-Anschl\u00fcsse": "1",
        "Anzahl OSD-Sprachen": "11",
        "Anzahl der Farben des Displays": "16,7 Millionen Farben",
        "Anzahl der Upstream-Ports USB Typ-B": "1",
        "Anzahl der nachgeschalteten Steckpl\u00e4tze vom Typ USB-A": "4",
        "Betriebstemperatur": "5 - 35 \u00b0C",
        "Bildschirmdiagonale": "54,6 cm (21.5\")",
        "Bildschirmdiagonale (cm)": "54,62 cm",
        "Bildschirmform": "Flach",
        "Bildschirmtechnologie": "LED",
        "Bildwinkel, horizontal": "178\u00b0",
        "Bildwinkel, vertikal": "178\u00b0",
        "Blendfreier Bildschirm": "Ja",
        "Breite (ohne Standfu\u00df)": "488,7 mm",
        "Display-Aufl\u00f6sung": "1920 x 1080 Pixel",
        "DisplayPorts-Version": "1.2",
        "Eingebaute Lautsprecher": "Nein",
        "Energieeffizienzklasse (SDR)": "D",
        "Energieverbrauch (SDR) pro 1.000 Stunden": "13 kWh",
        "Farbskala": "99%",
        "Farbtiefe": "8 Bit",
        "Flimmerfreie Technologie": "Ja",
        "Ger\u00e4tebreite (inkl. Fu\u00df)": "488,7 mm",
        "Ger\u00e4teh\u00f6he (inkl. Fu\u00df)": "492,9 mm",
        "Ger\u00e4tetiefe (inkl. Fu\u00df)": "211 mm",
        "Gewicht": "4,9 kg",
        "Gewicht (mit St\u00e4nder)": "4,9 kg",
        "Gewicht (ohne St\u00e4nder)": "2,9 kg",
        "HD-Typ": "Full HD",
        "HDCP": "Ja",
        "HDMI": "Ja",
        "HDMI-Version": "1.4",
        "HP-Segment": "Business",
        "Helligkeit (typisch)": "250 cd/m\u00b2",
        "Horizontaler Scanbereich": "30 - 86 kHz",
        "H\u00f6he (ohne Standfu\u00df)": "293,9 mm",
        "H\u00f6heneinstellung": "15 cm",
        "H\u00f6henverstellung": "Ja",
        "Integrierte Kamera": "Nein",
        "Integrierter USB-Hub": "Ja",
        "Kabelsperre-Slot": "Ja",
        "Kontrastverh\u00e4ltnis": "1000:1",
        "Kontrastverh\u00e4ltnis (dynamisch)": "8000000:1",
        "Kopfh\u00f6rerausgang": "Nein",
        "Low-Blue-Light-Technologie": "Ja",
        "Marktpositionierung": "Business",
        "Maximale Bildwiederholrate": "75 Hz",
        "Men\u00fcsprachen": "Englisch, Spanisch, Franz\u00f6sisch, Italienisch, Japanisch, Portugiesisch, Russisch",
        "NVIDIA G-SYNC": "Nein",
        "Nachhaltige Technologien und Materialien": "Halogenarm; Das geformte Papierzellstoffpolster im Inneren der Verpackung stammt zu 100\u00a0% aus nachhaltigen Quellen und ist recycelbar; Au\u00dfenkarton und Polster aus Wellpappe stammen zu 100\u00a0% aus nachhaltigen Quellen und sind recycelbar; Enth\u00e4lt recycelten Kunststoff, der andernfalls ins Meer gelangen w\u00fcrde; 80\u00a0% Kunststoff aus geschlossenem ITE-Kreislauf; Mindestens 25\u00a0% aus recyceltem Metall hergestellt",
        "Nachhaltigkeitszertifikate": "ENERGY STAR",
        "Natives Seitenverh\u00e4ltnis": "16:9",
        "Neigungswinkelbereich": "-5 - 23\u00b0",
        "Oberfl\u00e4chenh\u00e4rte": "3H",
        "Paketgewicht": "6,8 kg",
        "Panel-Montage-Schnittstelle": "100 x 100 mm",
        "Panel-Typ": "IPS",
        "Pivot": "Ja",
        "Pivot Winkel": "-90 - 90\u00b0",
        "Pixel Abstand": "0,25 x 0,25 mm",
        "Pixeldichte": "102 ppi",
        "Produktfarbe": "Schwarz, Silber",
        "RGB-Farbraum": "sRGB",
        "Reaktionszeit": "5 ms",
        "Relative Luftfeuchtigkeit in Betrieb": "20 - 80%",
        "Schwenkbar": "Ja",
        "Schwenkwinkelbereich": "-45 - 45\u00b0",
        "Stromverbrauch (Standardbetrieb)": "20 W",
        "Stromverbrauch (Standby)": "0,5 W",
        "Stromverbrauch (max.)": "50 W",
        "Tiefe (ohne Standfu\u00df)": "46 mm",
        "Touchscreen": "Nein",
        "Typ der Hintergrundbeleuchtung": "Seiten-LED",
        "Unterst\u00fctzte Grafik-Aufl\u00f6sungen": "640 x 480 (VGA), 720 x 400, 800 x 600 (SVGA), 1024 x 768 (XGA), 1280 x 1024 (SXGA), 1280 x 720 (HD 720), 1280 x 800 (WXGA), 1440 x 900 (WXGA+), 1600 x 900, 1680 x 1050 (WSXGA+), 1920 x 1080 (HD 1080)",
        "Ursprungsland": "China",
        "VESA-Halterung": "Ja",
        "Verpackungsbreite": "488,7 mm",
        "Verpackungsh\u00f6he": "493 mm",
        "Verpackungstiefe": "211 mm",
        "Vertikaler Scanbereich": "50 - 75 Hz"
    },
    "raw_specifications_text": "Bildschirmdiagonale: 54,6 cm (21.5\")\nDisplay-Aufl\u00f6sung: 1920 x 1080 Pixel\nNatives Seitenverh\u00e4ltnis: 16:9\nBildschirmtechnologie: LED\nTouchscreen: Nein\nHD-Typ: Full HD\nPanel-Typ: IPS\nTyp der Hintergrundbeleuchtung: Seiten-LED\nHelligkeit (typisch): 250 cd/m\u00b2\nReaktionszeit: 5 ms\nBlendfreier Bildschirm: Ja\nBildschirmform: Flach\nUnterst\u00fctzte Grafik-Aufl\u00f6sungen: 640 x 480 (VGA), 720 x 400, 800 x 600 (SVGA), 1024 x 768 (XGA), 1280 x 1024 (SXGA), 1280 x 720 (HD 720), 1280 x 800 (WXGA), 1440 x 900 (WXGA+), 1600 x 900, 1680 x 1050 (WSXGA+), 1920 x 1080 (HD 1080)\nKontrastverh\u00e4ltnis: 1000:1\nKontrastverh\u00e4ltnis (dynamisch): 8000000:1\nMaximale Bildwiederholrate: 75 Hz\nBildwinkel, horizontal: 178\u00b0\nBildwinkel, vertikal: 178\u00b0\nAnzahl der Farben des Displays: 16,7 Millionen Farben\nPixel Abstand: 0,25 x 0,25 mm\nPixeldichte: 102 ppi\nHorizontaler Scanbereich: 30 - 86 kHz\nVertikaler Scanbereich: 50 - 75 Hz\nBildschirmdiagonale (cm): 54,62 cm\nOberfl\u00e4chenh\u00e4rte: 3H\nFarbtiefe: 8 Bit\nRGB-Farbraum: sRGB\nFarbskala: 99%\nNVIDIA G-SYNC: Nein\nAMD FreeSync: Nein\nFlimmerfreie Technologie: Ja\nLow-Blue-Light-Technologie: Ja\nHP-Segment: Business\nEingebaute Lautsprecher: Nein\nIntegrierte Kamera: Nein\nMarktpositionierung: Business\nProduktfarbe: Schwarz, Silber\nAbnehmbarer Standfu\u00df: Ja\nUrsprungsland: China\nIntegrierter USB-Hub: Ja\nAnzahl der Upstream-Ports USB Typ-B: 1\nAnzahl der nachgeschalteten Steckpl\u00e4tze vom Typ USB-A: 4\nHDMI: Ja\nAnzahl HDMI-Anschl\u00fcsse: 1\nHDMI-Version: 1.4\nAnzahl DisplayPort Anschl\u00fcsse: 1\nDisplayPorts-Version: 1.2\nKopfh\u00f6rerausgang: Nein\nHDCP: Ja\nVESA-Halterung: Ja\nPanel-Montage-Schnittstelle: 100 x 100 mm\nKabelsperre-Slot: Ja\nH\u00f6henverstellung: Ja\nH\u00f6heneinstellung: 15 cm\nPivot: Ja\nPivot Winkel: -90 - 90\u00b0\nSchwenkbar: Ja\nSchwenkwinkelbereich: -45 - 45\u00b0\nNeigungswinkelbereich: -5 - 23\u00b0\nMen\u00fcsprachen: Englisch, Spanisch, Franz\u00f6sisch, Italienisch, Japanisch, Portugiesisch, Russisch\nAnzahl OSD-Sprachen: 11\nEnergieeffizienzklasse (SDR): D\nEnergieverbrauch (SDR) pro 1.000 Stunden: 13 kWh\nStromverbrauch (Standardbetrieb): 20 W\nStromverbrauch (Standby): 0,5 W\nStromverbrauch (max.): 50 W\nAC Eingangsspannung: 100 - 240 V\nAC Eingangsfrequenz: 50 - 60 Hz\nBetriebstemperatur: 5 - 35 \u00b0C\nRelative Luftfeuchtigkeit in Betrieb: 20 - 80%\nGer\u00e4tebreite (inkl. Fu\u00df): 488,7 mm\nGer\u00e4tetiefe (inkl. Fu\u00df): 211 mm\nGer\u00e4teh\u00f6he (inkl. Fu\u00df): 492,9 mm\nGewicht (mit St\u00e4nder): 4,9 kg\nBreite (ohne Standfu\u00df): 488,7 mm\nTiefe (ohne Standfu\u00df): 46 mm\nH\u00f6he (ohne Standfu\u00df): 293,9 mm\nGewicht (ohne St\u00e4nder): 2,9 kg\nVerpackungsbreite: 488,7 mm\nVerpackungstiefe: 211 mm\nVerpackungsh\u00f6he: 493 mm\nPaketgewicht: 6,8 kg\nNachhaltigkeitszertifikate: ENERGY STAR\nNachhaltige Technologien und Materialien: Halogenarm; Das geformte Papierzellstoffpolster im Inneren der Verpackung stammt zu 100\u00a0% aus nachhaltigen Quellen und ist recycelbar; Au\u00dfenkarton und Polster aus Wellpappe stammen zu 100\u00a0% aus nachhaltigen Quellen und sind recycelbar; Enth\u00e4lt recycelten Kunststoff, der andernfalls ins Meer gelangen w\u00fcrde; 80\u00a0% Kunststoff aus geschlossenem ITE-Kreislauf; Mindestens 25\u00a0% aus recyceltem Metall hergestellt\nGewicht: 4,9 kg",
    "reference_file": "offer_reference_510.json",
    "shop_name": "ms-it-beratung"
}