{
    "html_file": "offer_987_12.html",
    "name": "ASUS ZenScreen Go MB16AWP, 15.6\"",
    "offer_link": "https://direkt.jacob.de/produkte/asus-zenscreen-mb16awp-90lm07i1-b01370-artnr-7639426.html?utm_source=geizhals&utm_medium=cpc&utm_campaign=Preisvergleich&ref=103",
    "price": 513.52,
    "raw_specifications": {
        "AMD FreeSync": "Nein",
        "AirPlay": "Ja",
        "Akku-/Batteriekapazit\u00e4t": "7800 mAh",
        "Anzahl Mini-HDMI-Anschl\u00fcsse": "1",
        "Anzahl der Farben": "16,78 Millionen Farben",
        "Anzahl der Lautsprecher": "2",
        "Anzahl der nachgeschalteten Ports vom Typ USB-C": "1",
        "Bildschirmaufl\u00f6sung": "1920 x 1080 Pixel",
        "Bildschirmdiagonale": "39,6 cm (15.6\" )",
        "Bildschirmform": "Flach",
        "Bildschirmtechnologie": "LED",
        "Bildwinkel, horizontal": "178\u00b0",
        "Bildwinkel, vertikal": "178\u00b0",
        "Blendfreier Bildschirm": "Ja",
        "Eingangsstrom": "3 A",
        "Eingebaute Lautsprecher": "Ja",
        "Fernbedienung": "Ja",
        "Flimmerfreie Technologie": "Ja",
        "Ger\u00e4tebreite (inkl. Fu\u00df)": "357,9 mm",
        "Ger\u00e4teh\u00f6he (inkl. Fu\u00df)": "224,8 mm",
        "Ger\u00e4tetiefe (inkl. Fu\u00df)": "22,5 mm",
        "Gewicht (mit St\u00e4nder)": "1,09 kg",
        "HD-Typ": "Full HD",
        "HDCP": "Ja",
        "HDMI": "Nein",
        "Helligkeit (typisch)": "250 cd/m\u00b2",
        "H\u00f6henverstellung": "Nein",
        "Integrierter USB-Hub": "Nein",
        "Kabelsperre-Slot": "Ja",
        "Kontrastverh\u00e4ltnis": "1200:1",
        "Kopfh\u00f6rerausgang": "Ja",
        "Kopfh\u00f6rerausg\u00e4nge": "1",
        "Low-Blue-Light-Technologie": "Ja",
        "Maximale Bildwiederholrate": "60 Hz",
        "NVIDIA G-SYNC": "Nein",
        "Natives Seitenverh\u00e4ltnis": "16:9",
        "Neigungswinkelbereich": "15 - 75\u00b0",
        "Paketgewicht": "2,3 kg",
        "Panel-Typ": "IPS",
        "Pixel Abstand": "0,179 x 0,179 mm",
        "Produktfarbe": "Schwarz",
        "RMS-Leistung": "2 W",
        "Reaktionszeit": "5 ms",
        "Seitenverh\u00e4ltnis": "16:9",
        "Sichtbare Gr\u00f6\u00dfe (horizontal)": "34,4 cm",
        "Sichtbare Gr\u00f6\u00dfe (vertikal)": "19,4 cm",
        "Slot-Typ Kabelsperre": "Kensington",
        "Stromverbrauch (Standardbetrieb)": "7,6 W",
        "Stromverbrauch (aus)": "0,3 W",
        "Unterst\u00fctzte Grafik-Aufl\u00f6sungen": "1920 x 1080 (HD 1080)",
        "VESA-Halterung": "Nein",
        "Verpackungsart": "Box",
        "Verpackungsbreite": "446 mm",
        "Verpackungsh\u00f6he": "291 mm",
        "Verpackungstiefe": "139 mm",
        "WLAN": "Ja",
        "kippbar": "Ja",
        "sRGB Abdeckung (klassisch)": "100%"
    },
    "raw_specifications_text": "Bildschirmdiagonale: 39,6 cm (15.6\" )\nBildschirmaufl\u00f6sung: 1920 x 1080 Pixel\nNatives Seitenverh\u00e4ltnis: 16:9\nPanel-Typ: IPS\nHD-Typ: Full HD\nBildschirmtechnologie: LED\nBildschirmform: Flach\nKontrastverh\u00e4ltnis: 1200:1\nMaximale Bildwiederholrate: 60 Hz\nHelligkeit (typisch): 250 cd/m\u00b2\nReaktionszeit: 5 ms\nBlendfreier Bildschirm: Ja\nUnterst\u00fctzte Grafik-Aufl\u00f6sungen: 1920 x 1080 (HD 1080)\nSeitenverh\u00e4ltnis: 16:9\nBildwinkel, horizontal: 178\u00b0\nBildwinkel, vertikal: 178\u00b0\nPixel Abstand: 0,179 x 0,179 mm\nSichtbare Gr\u00f6\u00dfe (horizontal): 34,4 cm\nSichtbare Gr\u00f6\u00dfe (vertikal): 19,4 cm\nsRGB Abdeckung (klassisch): 100%\nNVIDIA G-SYNC: Nein\nAMD FreeSync: Nein\nFlimmerfreie Technologie: Ja\nLow-Blue-Light-Technologie: Ja\nAirPlay: Ja\nEingebaute Lautsprecher: Ja\nAnzahl der Lautsprecher: 2\nRMS-Leistung: 2 W\nProduktfarbe: Schwarz\nIntegrierter USB-Hub: Nein\nHDMI: Nein\nKopfh\u00f6rerausgang: Ja\nAnzahl der nachgeschalteten Ports vom Typ USB-C: 1\nAnzahl Mini-HDMI-Anschl\u00fcsse: 1\nKopfh\u00f6rerausg\u00e4nge: 1\nHDCP: Ja\nVESA-Halterung: Nein\nKabelsperre-Slot: Ja\nH\u00f6henverstellung: Nein\nSlot-Typ Kabelsperre: Kensington\nkippbar: Ja\nNeigungswinkelbereich: 15 - 75\u00b0\nStromverbrauch (Standardbetrieb): 7,6 W\nStromverbrauch (aus): 0,3 W\nEingangsstrom: 3 A\nWLAN: Ja\nFernbedienung: Ja\nAkku-/Batteriekapazit\u00e4t: 7800 mAh\nGer\u00e4tebreite (inkl. Fu\u00df): 357,9 mm\nGer\u00e4tetiefe (inkl. Fu\u00df): 22,5 mm\nGer\u00e4teh\u00f6he (inkl. Fu\u00df): 224,8 mm\nGewicht (mit St\u00e4nder): 1,09 kg\nVerpackungsbreite: 446 mm\nVerpackungstiefe: 139 mm\nVerpackungsh\u00f6he: 291 mm\nPaketgewicht: 2,3 kg\nVerpackungsart: Box\nAnzahl der Farben: 16,78 Millionen Farben",
    "reference_file": "offer_reference_987.json",
    "shop_name": "Jacob Elektronik direkt (AT)"
}