{
    "html_file": "offer_2274_7.html",
    "name": "Dell P2419H, 23.8\"",
    "offer_link": "https://www.e-tec.at/details.php?artnr=266940",
    "price": 378.65,
    "raw_specifications": {
        "Abmessungen (BxHxT)": "538x356x166mm (mit Standfu\u00df),  538x322x43mm (ohne Standfu\u00df)",
        "Anschl\u00fcsse - DisplayPort 1.2": "1",
        "Anschl\u00fcsse - HDMI 1.4": "1",
        "Anschl\u00fcsse - VGA": "1",
        "Anschl\u00fcsse - VGA (60Hz@1920x1080)": "1",
        "Anschl\u00fcsse - VGA 60Hz@1920x1080": "1",
        "Anwendung": "station\u00e4r",
        "Audio": "N/A",
        "Aufl\u00f6sung": "1920x1080",
        "Beschichtung": "matt (non-glare),  H\u00e4rtegrad 3H",
        "Besonderheiten": "Slim Bezel,  EPEAT Gold,  mechanische Tasten,  Sicherheitsschloss (Kensington)",
        "Bildwiederholfrequenz": "60Hz",
        "Blickwinkel": "178\u00b0/178\u00b0",
        "Diagonale": "23.8\"/60.5cm",
        "Energieeffizienzklasse alt (A+++ bis D)": "A",
        "Energieeffizienzklasse alt (A+++ bis G)": "A",
        "Ergonomie": "130mm (h\u00f6henverstellbar),  90\u00b0 (Pivot),  \u00b145\u00b0 (drehbar),  +21\u00b0/-5\u00b0 (neigbar),  keine Angabe (Schr\u00e4glage)",
        "FRC": "unbekannt",
        "Farbe": "schwarz",
        "Farbtiefe": "8bit (16.7 Mio. Farben)",
        "Form": "gerade (flat)",
        "Gewicht": "5.25kg (mit Standfu\u00df),  3.26kg (ohne Standfu\u00df)",
        "HDR": "N/A",
        "Helligkeit": "250cd/m\u00b2",
        "Herstellergarantie": "drei Jahre",
        "Hintergrundbeleuchtung": "White-LED,  flicker-free,  Blaulichtfilter",
        "Jahresverbrauch alt (A+++ bis D)": "29.20kWh",
        "Jahresverbrauch alt (A+++ bis G)": "29.20kWh",
        "Kontrast - statisch": "1.000:1",
        "Leistungsaufnahme": "42W (maximal),  18W (typisch),  20W (Energielabel alt A+++ bis G),  0.3W (Standby)",
        "Panel": "IPS",
        "Reaktionszeit - GtG": "5ms",
        "Screen-to-Body-Ratio": "90.1% (berechnet)",
        "Seitenverh\u00e4ltnis": "16:9",
        "Signalfrequenz": "30-83kHz (horizontal),  56-76Hz (vertikal)",
        "Stromversorgung": "AC-In (internes Netzteil)",
        "USB-Hub In": "1x USB-B 3.0",
        "USB-Hub Out": "2x USB-A 3.0,  2x USB-A 2.0",
        "USB-Schreibweise": "Link",
        "VESA": "100x100 (belegt)",
        "VRR (Variable Refresh Rate)": "N/A",
        "Weitere Anschl\u00fcsse": "N/A"
    },
    "raw_specifications_text": "Abmessungen (BxHxT): 538x356x166mm (mit Standfu\u00df),  538x322x43mm (ohne Standfu\u00df)\nAnschl\u00fcsse - DisplayPort 1.2: 1\nAnschl\u00fcsse - HDMI 1.4: 1\nAnschl\u00fcsse - VGA: 1\nAnschl\u00fcsse - VGA (60Hz@1920x1080): 1\nAnschl\u00fcsse - VGA 60Hz@1920x1080: 1\nAnwendung: station\u00e4r\nAudio: N/A\nAufl\u00f6sung: 1920x1080\nBeschichtung: matt (non-glare),  H\u00e4rtegrad 3H\nBesonderheiten: Slim Bezel,  EPEAT Gold,  mechanische Tasten,  Sicherheitsschloss (Kensington)\nBildwiederholfrequenz: 60Hz\nBlickwinkel: 178\u00b0/178\u00b0\nDiagonale: 23.8\"/60.5cm\nEnergieeffizienzklasse alt (A+++ bis D): A\nEnergieeffizienzklasse alt (A+++ bis G): A\nErgonomie: 130mm (h\u00f6henverstellbar),  90\u00b0 (Pivot),  \u00b145\u00b0 (drehbar),  +21\u00b0/-5\u00b0 (neigbar),  keine Angabe (Schr\u00e4glage)\nFarbe: schwarz\nFarbtiefe: 8bit (16.7 Mio. Farben)\nForm: gerade (flat)\nFRC: unbekannt\nGewicht: 5.25kg (mit Standfu\u00df),  3.26kg (ohne Standfu\u00df)\nHDR: N/A\nHelligkeit: 250cd/m\u00b2\nHerstellergarantie: drei Jahre\nHintergrundbeleuchtung: White-LED,  flicker-free,  Blaulichtfilter\nJahresverbrauch alt (A+++ bis D): 29.20kWh\nJahresverbrauch alt (A+++ bis G): 29.20kWh\nKontrast - statisch: 1.000:1\nLeistungsaufnahme: 42W (maximal),  18W (typisch),  20W (Energielabel alt A+++ bis G),  0.3W (Standby)\nPanel: IPS\nReaktionszeit - GtG: 5ms\nScreen-to-Body-Ratio: 90.1% (berechnet)\nSeitenverh\u00e4ltnis: 16:9\nSignalfrequenz: 30-83kHz (horizontal),  56-76Hz (vertikal)\nStromversorgung: AC-In (internes Netzteil)\nUSB-Hub In: 1x USB-B 3.0\nUSB-Hub Out: 2x USB-A 3.0,  2x USB-A 2.0\nUSB-Schreibweise: Link\nVESA: 100x100 (belegt)\nVRR (Variable Refresh Rate): N/A\nWeitere Anschl\u00fcsse: N/A",
    "reference_file": "offer_reference_2274.json",
    "shop_name": "e-tec.at"
}