{
    "html_file": "offer_388_16.html",
    "name": "ASUS ROG Strix XG27AQMR, 27\"",
    "offer_link": "https://www.cyberport.at/?DEEP=6135-0HG&APID=294&STOREID=7",
    "price": 808.9,
    "raw_specifications": {
        "Aufl\u00f6sung": "2.560x1.440 WQHD",
        "Betrachtungswinkel h/v": "178\u00b0/178\u00b0",
        "Bildformat": "16:9",
        "Breite in mm": "615mm",
        "Displaygr\u00f6\u00dfe in Zoll": "27 Zoll",
        "Displaygr\u00f6\u00dfe in cm": "68,6 cm",
        "Displayport": "1x DP 1.4 (300Hz@2560x1440)",
        "Farbraumabdeckung": "120% sRGB",
        "Farbtiefe": "10 Bit / 1,07 Mrd Farben",
        "Gewicht in kg": "7,3 kg",
        "HDMI": "2x HDMI 2.0 (144Hz@2560x1440)",
        "Helligkeit": "600 cd/m\u00b2",
        "H\u00f6he in mm": "399 mm",
        "H\u00f6henverstellbar": "100mm",
        "Jahresverbrauch": "26 kWh",
        "Kontrast dynamisch": "k.A.",
        "Kontrast typisch": "1.000:1",
        "Lautsprecher": "kein",
        "Leistungsaufnahme": "26 Watt",
        "Oberfl\u00e4che": "matt",
        "Reaktionszeit": "1 ms",
        "Technologie": "IPS",
        "Tiefe in mm": "265mm",
        "USB-C": "kein",
        "Wandmontage": "VESA100x100"
    },
    "raw_specifications_text": "Jahresverbrauch: 26 kWh\nLeistungsaufnahme: 26 Watt\nDisplaygr\u00f6\u00dfe in cm: 68,6 cm\nDisplaygr\u00f6\u00dfe in Zoll: 27 Zoll\nTechnologie: IPS\nAufl\u00f6sung: 2.560x1.440 WQHD\nBildformat: 16:9\nOberfl\u00e4che: matt\nFarbraumabdeckung: 120% sRGB\nFarbtiefe: 10 Bit / 1,07 Mrd Farben\nHelligkeit: 600 cd/m\u00b2\nKontrast typisch: 1.000:1\nKontrast dynamisch: k.A.\nReaktionszeit: 1 ms\nBetrachtungswinkel h/v: 178\u00b0/178\u00b0\nBreite in mm: 615mm\nH\u00f6he in mm: 399 mm\nTiefe in mm: 265mm\nHDMI: 2x HDMI 2.0 (144Hz@2560x1440)\nDisplayport: 1x DP 1.4 (300Hz@2560x1440)\nUSB-C: kein\nH\u00f6henverstellbar: 100mm\nWandmontage: VESA100x100\nLautsprecher: kein\nGewicht in kg: 7,3 kg",
    "reference_file": "offer_reference_388.json",
    "shop_name": "Cyberport Stores \u00d6sterreich"
}