{
    "html_file": "offer_940_35.html",
    "name": "HP Z34c G3, 34\"",
    "offer_link": "https://www.mylemon.at/artikel/hewlett_packard/30a19aa_abb/hp-z34c-g3-86-3cm.html",
    "price": 1316.28,
    "raw_specifications": {
        "AC Eingangsfrequenz": "47/63 Hz",
        "AC Eingangsspannung": "90 - 265 V",
        "AMD FreeSync": "Nein",
        "Anzahl DisplayPort Anschl\u00fcsse": "1",
        "Anzahl HDMI-Anschl\u00fcsse": "1",
        "Anzahl der Farben des Displays": "16,78 Millionen Farben",
        "Anzahl der Lautsprecher": "2",
        "Anzahl der Upstream-Ports USB Typ-B": "1",
        "Anzahl der nachgeschalteten Ports vom Typ USB-C": "1",
        "Anzahl der nachgeschalteten Steckpl\u00e4tze vom Typ USB-A": "4",
        "Artikelnummer": "M18YQSKL",
        "Aufl\u00f6sung": "3440x1440",
        "Besonderheiten": "Lautsprecher, USB HUB",
        "Bewertung der Bildschirmkr\u00fcmmung": "1900R",
        "Bild-in-Bild": "Ja",
        "Bildschirmdiagonale": "86,4 cm (34 Zoll)",
        "Bildschirmdiagonale (cm)": "86,36 cm",
        "Bildschirmform": "Gebogen",
        "Bildschirmtechnologie": "LED",
        "Bildwinkel, horizontal": "178\u00b0",
        "Bildwinkel, vertikal": "178\u00b0",
        "Blendfreier Bildschirm": "Ja",
        "Breite (ohne Standfu\u00df)": "81,4 cm",
        "DVI Anschluss": "Nein",
        "Display-Aufl\u00f6sung": "3440 x 1440 Pixel",
        "Display-Oberfl\u00e4che": "Matt",
        "DisplayPorts-Version": "1.4",
        "Displaygr\u00f6\u00dfe": "34 Zoll",
        "EAN": "0195697267130",
        "Eingebaute Lautsprecher": "Ja",
        "Energieeffizienzklasse (HDR)": "Nicht verf\u00fcgbar",
        "Energieeffizienzklasse (SDR)": "G",
        "Energieeffizienzskala": "A bis G",
        "Energieverbrauch (SDR) pro 1.000 Stunden": "40 kWh",
        "Farbskala": "85%",
        "Ger\u00e4tebreite (inkl. Fu\u00df)": "813,8 mm",
        "Ger\u00e4teh\u00f6he (inkl. Fu\u00df)": "585,2 mm",
        "Ger\u00e4tetiefe (inkl. Fu\u00df)": "272,5 mm",
        "Gewicht (mit St\u00e4nder)": "11,1 kg",
        "Gewicht (ohne St\u00e4nder)": "11,1 kg",
        "HD-Typ": "UltraWide Quad HD",
        "HDCP": "Ja",
        "HDMI": "Ja",
        "HDMI-Version": "2.0",
        "Helligkeit": "350 cd/m\u00b2",
        "Helligkeit (typisch)": "350 cd/m\u00b2",
        "Hersteller Artikelnummer": "30A19AA#ABB",
        "Horizontaler Scanbereich": "88 - 90 kHz",
        "H\u00f6he (ohne Standfu\u00df)": "38,9 cm",
        "H\u00f6heneinstellung": "15 cm",
        "H\u00f6henverstellung": "Nein",
        "Integrierte Kamera": "Ja",
        "Integrierter USB-Hub": "Ja",
        "Kabelsperre-Slot": "Ja",
        "Kontrastverh\u00e4ltnis": "1000:1",
        "Kontrastverh\u00e4ltnis (dynamisch)": "10000000:1",
        "Kopfh\u00f6rerausgang": "Nein",
        "Marktpositionierung": "Business",
        "Maximale Bildwiederholrate": "60 Hz",
        "Megapixel (ca.)": "5 MP",
        "NVIDIA G-SYNC": "Nein",
        "Nachhaltige Technologien und Materialien": "80\u00a0% recycelter Haushaltskunststoff; Halogenarm; Das geformte Papierzellstoffpolster im Inneren der Verpackung stammt zu 100\u00a0% aus nachhaltigen Quellen und ist recycelbar; Au\u00dfenkarton und Polster aus Wellpappe stammen zu 100\u00a0% aus nachhaltigen Quellen und sind recycelbar; Enth\u00e4lt Kunststoff, der andernfalls ins Meer gelangen w\u00fcrde; Polster aus recyceltem Kunststoff",
        "Nachhaltigkeitszertifikate": "EPEAT Silver, ENERGY STAR",
        "Natives Seitenverh\u00e4ltnis": "21:9",
        "Neigungsverstellung": "Ja",
        "Neigungswinkelbereich": "-5 - 10\u00b0",
        "Paketgewicht": "16,6 kg",
        "Panel": "VA",
        "Panel-Montage-Schnittstelle": "100 x 100 mm",
        "Panel-Typ": "VA",
        "Pivot": "Nein",
        "Pixel Abstand": "0,2325 x 0,2325 mm",
        "Plug & Play": "Ja",
        "Produktfarbe": "Schwarz, Silber",
        "RGB-Farbraum": "DCI-P3",
        "RMS-Leistung": "5 W",
        "Reaktionszeit": "8 ms",
        "Schwenkbar": "Ja",
        "Schwenkwinkelbereich": "-30 - 30\u00b0",
        "Seitenverh\u00e4ltnis": "21:9",
        "Sichtbare Gr\u00f6\u00dfe (diagonal)": "33,5 cm",
        "Sichtbare Gr\u00f6\u00dfe (vertikal)": "80 cm",
        "Stromverbrauch (Standardbetrieb)": "60 W",
        "Stromverbrauch (Standby)": "0,5 W",
        "Stromverbrauch (max.)": "250 W",
        "Tiefe (ohne Standfu\u00df)": "10,5 cm",
        "Touchscreen": "Nein",
        "USB-Upstream-Porttyp": "USB Typ-B",
        "Unterst\u00fctzte Grafik-Aufl\u00f6sungen": "720 x 400, 1600 x 900, 2560 x 1440, 1024 x 768 (XGA), 1280 x 1024 (SXGA), 1280 x 720 (HD 720), 1366  768, 1440 x 900 (WXGA+), 1680 x 1050 (WSXGA+), 1920 x 1080 (HD 1080), 640 x 480 (VGA), 800 x 600 (SVGA)",
        "Ursprungsland": "China",
        "VESA Halterung": "100x100 mm",
        "VESA-Halterung": "Ja",
        "Verpackungsbreite": "952 mm",
        "Verpackungsh\u00f6he": "504 mm",
        "Verpackungstiefe": "226 mm",
        "Vertikaler Scanbereich": "59 - 61 Hz",
        "Video Anschl\u00fcsse": "2x HDMI, 1x DisplayPort",
        "Warentarifnummer (HS)": "85285210",
        "sRGB Abdeckung (klassisch)": "99%"
    },
    "raw_specifications_text": "Displaygr\u00f6\u00dfe: 34 Zoll\nAufl\u00f6sung: 3440x1440\nPanel: VA\nReaktionszeit: 8 ms\nVideo Anschl\u00fcsse: 2x HDMI, 1x DisplayPort\nVESA Halterung: 100x100 mm\nHelligkeit: 350 cd/m\u00b2\nBesonderheiten: Lautsprecher, USB HUB\nHersteller Artikelnummer: 30A19AA#ABB\nEAN: 0195697267130\nArtikelnummer: M18YQSKL\nBildschirmdiagonale: 86,4 cm (34 Zoll)\nDisplay-Aufl\u00f6sung: 3440 x 1440 Pixel\nNatives Seitenverh\u00e4ltnis: 21:9\nBildschirmtechnologie: LED\nTouchscreen: Nein\nHD-Typ: UltraWide Quad HD\nPanel-Typ: VA\nBildschirmform: Gebogen\nKontrastverh\u00e4ltnis: 1000:1\nMaximale Bildwiederholrate: 60 Hz\nAnzahl der Farben des Displays: 16,78 Millionen Farben\nHelligkeit (typisch): 350 cd/m\u00b2\nDisplay-Oberfl\u00e4che: Matt\nBlendfreier Bildschirm: Ja\nBewertung der Bildschirmkr\u00fcmmung: 1900R\nUnterst\u00fctzte Grafik-Aufl\u00f6sungen: 720 x 400, 1600 x 900, 2560 x 1440, 1024 x 768 (XGA), 1280 x 1024 (SXGA), 1280 x 720 (HD 720), 1366  768, 1440 x 900 (WXGA+), 1680 x 1050 (WSXGA+), 1920 x 1080 (HD 1080), 640 x 480 (VGA), 800 x 600 (SVGA)\nSeitenverh\u00e4ltnis: 21:9\nKontrastverh\u00e4ltnis (dynamisch): 10000000:1\nBildwinkel, horizontal: 178\u00b0\nBildwinkel, vertikal: 178\u00b0\nPixel Abstand: 0,2325 x 0,2325 mm\nHorizontaler Scanbereich: 88 - 90 kHz\nVertikaler Scanbereich: 59 - 61 Hz\nSichtbare Gr\u00f6\u00dfe (vertikal): 80 cm\nSichtbare Gr\u00f6\u00dfe (diagonal): 33,5 cm\nBildschirmdiagonale (cm): 86,36 cm\nRGB-Farbraum: DCI-P3\nFarbskala: 85%\nsRGB Abdeckung (klassisch): 99%\nNVIDIA G-SYNC: Nein\nAMD FreeSync: Nein\nEingebaute Lautsprecher: Ja\nIntegrierte Kamera: Ja\nAnzahl der Lautsprecher: 2\nRMS-Leistung: 5 W\nMegapixel (ca.): 5 MP\nMarktpositionierung: Business\nProduktfarbe: Schwarz, Silber\nUrsprungsland: China\nIntegrierter USB-Hub: Ja\nHDMI: Ja\nKopfh\u00f6rerausgang: Nein\nUSB-Upstream-Porttyp: USB Typ-B\nAnzahl der Upstream-Ports USB Typ-B: 1\nAnzahl der nachgeschalteten Steckpl\u00e4tze vom Typ USB-A: 4\nAnzahl der nachgeschalteten Ports vom Typ USB-C: 1\nDVI Anschluss: Nein\nAnzahl HDMI-Anschl\u00fcsse: 1\nHDMI-Version: 2.0\nAnzahl DisplayPort Anschl\u00fcsse: 1\nDisplayPorts-Version: 1.4\nHDCP: Ja\nVESA-Halterung: Ja\nKabelsperre-Slot: Ja\nH\u00f6henverstellung: Nein\nPanel-Montage-Schnittstelle: 100 x 100 mm\nH\u00f6heneinstellung: 15 cm\nPivot: Nein\nSchwenkbar: Ja\nSchwenkwinkelbereich: -30 - 30\u00b0\nNeigungswinkelbereich: -5 - 10\u00b0\nBild-in-Bild: Ja\nPlug & Play: Ja\nNeigungsverstellung: Ja\nEnergieeffizienzklasse (SDR): G\nEnergieeffizienzklasse (HDR): Nicht verf\u00fcgbar\nEnergieverbrauch (SDR) pro 1.000 Stunden: 40 kWh\nStromverbrauch (Standardbetrieb): 60 W\nStromverbrauch (Standby): 0,5 W\nStromverbrauch (max.): 250 W\nAC Eingangsspannung: 90 - 265 V\nAC Eingangsfrequenz: 47/63 Hz\nEnergieeffizienzskala: A bis G\nGer\u00e4tebreite (inkl. Fu\u00df): 813,8 mm\nGer\u00e4tetiefe (inkl. Fu\u00df): 272,5 mm\nGer\u00e4teh\u00f6he (inkl. Fu\u00df): 585,2 mm\nGewicht (mit St\u00e4nder): 11,1 kg\nBreite (ohne Standfu\u00df): 81,4 cm\nTiefe (ohne Standfu\u00df): 10,5 cm\nH\u00f6he (ohne Standfu\u00df): 38,9 cm\nGewicht (ohne St\u00e4nder): 11,1 kg\nVerpackungsbreite: 952 mm\nVerpackungstiefe: 226 mm\nVerpackungsh\u00f6he: 504 mm\nPaketgewicht: 16,6 kg\nNachhaltigkeitszertifikate: EPEAT Silver, ENERGY STAR\nNachhaltige Technologien und Materialien: 80\u00a0% recycelter Haushaltskunststoff; Halogenarm; Das geformte Papierzellstoffpolster im Inneren der Verpackung stammt zu 100\u00a0% aus nachhaltigen Quellen und ist recycelbar; Au\u00dfenkarton und Polster aus Wellpappe stammen zu 100\u00a0% aus nachhaltigen Quellen und sind recycelbar; Enth\u00e4lt Kunststoff, der andernfalls ins Meer gelangen w\u00fcrde; Polster aus recyceltem Kunststoff\nWarentarifnummer (HS): 85285210",
    "reference_file": "offer_reference_940.json",
    "shop_name": "mylemon.at"
}