{
    "html_file": "offer_743_0.html",
    "name": "Philips 5000 Series 27B1U5601H, 27\"",
    "offer_link": "https://www.csv-direct.de/artinfo.php?artnr=AGX1618551&KATEGORIE=162&pva=geizhals2",
    "price": 479.94,
    "raw_specifications": {
        "AC Eingangsfrequenz": "50 - 60 Hz",
        "AC Eingangsspannung": "100 - 240 V",
        "AMD FreeSync": "Nein",
        "Anzahl DisplayPort Anschl\u00fcsse": "1",
        "Anzahl HDMI-Anschl\u00fcsse": "1",
        "Anzahl der Farben des Displays": "16,7 Millionen Farben",
        "Anzahl der Lautsprecher": "2",
        "Anzahl der nachgeschalteten Ports vom Typ USB-C": "1",
        "Anzahl der nachgeschalteten Steckpl\u00e4tze vom Typ USB-A": "4",
        "Anzahl der vorgeschalteten Steckpl\u00e4tze": "1",
        "Au\u00dfenverkleidungstyp": "Texturiert",
        "Beh\u00f6rdliche Zulassung": "CB; CE Mark; FCC Class B; ICES-003; CU-EAC; EAEU RoHS; TUV Ergo; TUV/GS; TUV Eye Comfort certified",
        "Betriebstemperatur": "0 - 40 \u00b0C",
        "Bild-Verbesserung": "SmartImage",
        "Bildschirmdiagonale": "68,6 cm 27\"",
        "Bildschirmdiagonale cm": "68,5 cm",
        "Bildschirmform": "Flach",
        "Bildschirmtechnologie": "LCD",
        "Bildwinkel, horizontal": "178\u00b0",
        "Bildwinkel, vertikal": "178\u00b0",
        "Breite ohne Standfu\u00df": "613 mm",
        "Display-Aufl\u00f6sung": "2560 x 1440 Pixel",
        "DisplayPorts-Version": "1.4",
        "Dynamisches Kontrastverh\u00e4ltnis Marketingbezeichnung": "SmartContrast",
        "Energieeffizienzklasse SDR": "F",
        "Energieeffizienzskala": "A bis G",
        "Energieverbrauch SDR pro 1.000 Stunden": "26 kWh",
        "Enth\u00e4lt nicht": "Quecksilber, PVC/BFR",
        "Ethernet LAN Datentransferraten": "10,100,1000 Mbit/s",
        "Farbtiefe": "8 Bit",
        "Fu\u00dffarbe": "Schwarz",
        "Ger\u00e4tebreite inkl. Fu\u00df": "613 mm",
        "Ger\u00e4teh\u00f6he inkl. Fu\u00df": "537 mm",
        "Ger\u00e4tetiefe inkl. Fu\u00df": "225 mm",
        "Gewicht mit St\u00e4nder": "7,3 kg",
        "Gewicht ohne St\u00e4nder": "5,54 kg",
        "HD-Typ": "Quad HD",
        "HDCP-Version": "1.4/2.2",
        "HDMI-Version": "1.4",
        "Helligkeit typisch": "350 cd/m\u00b2",
        "Horizontaler Scanbereich": "30 - 114 kHz",
        "H\u00f6he bei Betrieb": "0 - 3658 m",
        "H\u00f6he bei Lagerung": "3658 - 12192 m",
        "H\u00f6he ohne Standfu\u00df": "366 mm",
        "H\u00f6heneinstellung": "15 cm",
        "Kompatible Betriebssysteme": "Mac OS XWindows 11 / 10 / 8.1 / 8 / 7",
        "Komponentenvideo-Synchronisation": "Separate sync",
        "Kontrastverh\u00e4ltnis": "1000:1",
        "Kontrastverh\u00e4ltnis dynamisch": "50000000:1",
        "LED-Anzeigen": "T\u00e4tigkeit, Stand-by",
        "Marktpositionierung": "Business",
        "Maximale Bildwiederholrate": "75 Hz",
        "Megapixel ca.": "5 MP",
        "Men\u00fcsprachen": "Vereinfachtes Chinesisch, Traditionelles Chinesisch, Tschechisch, Deutsch, Niederl\u00e4ndisch, Englisch, Spanisch, Finnisch, Franz\u00f6sisch, Griechisch, Ungarisch, Italienisch, Japanisch, Koreanisch, Polnisch, Portugiesisch, Russisch, Schwedisch, T\u00fcrkisch, Ukrainisch",
        "Mitgelieferte Kabel": "HDMI, DisplayPort, USB Typ-C, AC",
        "Mitgelieferte Software": "SmartControl",
        "Mittlere Betriebsdauer zwischen Ausf\u00e4llen MTBF": "70000 h",
        "NTSC Abdeckung typisch": "89",
        "NVIDIA G-SYNC": "Nein",
        "Nach Gebrauch recycelter Kunststoff": "85",
        "Nachhaltigkeitszertifikate": "ENERGY STAR, TCO, RoHS",
        "Natives Seitenverh\u00e4ltnis": "16:9",
        "Neigungswinkelbereich": "-5 - 30\u00b0",
        "Netzteiltyp": "Intern",
        "Oberfl\u00e4chenh\u00e4rte": "3H",
        "Paketgewicht": "10,9 kg",
        "Panel-Montage-Schnittstelle": "100 x 100 mm",
        "Panel-Typ": "IPS",
        "Pivot Winkel": "-90 - 90\u00b0",
        "Pixel Abstand": "0,2331 x 0,2331 mm",
        "Pixeldichte": "109 ppi",
        "Produktfarbe": "Schwarz",
        "RGB-Farbraum": "sRGB",
        "RMS-Leistung": "5 W",
        "Reaktionszeit": "4 ms",
        "Recycelbares Verpackungsmaterial": "100",
        "Relative Luftfeuchtigkeit in Betrieb": "20 - 80",
        "Schwenkwinkelbereich": "-180 - 180\u00b0",
        "Sichtbare Gr\u00f6\u00dfe horizontal": "59,7 cm",
        "Sichtbare Gr\u00f6\u00dfe vertikal": "33,6 cm",
        "Slot-Typ Kabelsperre": "Kensington",
        "Stromverbrauch Standardbetrieb": "21,5 W",
        "Stromverbrauch Standby": "0,4 W",
        "Temperaturbereich bei Lagerung": "-20 - 60 \u00b0C",
        "Tiefe ohne Standfu\u00df": "55 mm",
        "Touchscreen": "Nein",
        "Tr\u00fcbungsrate": "25",
        "Typ der Hintergrundbeleuchtung": "W-LED",
        "USB-Hub-Version": "3.2 Gen 2 3.1 Gen 2",
        "USB-Stromversorgung bis zu": "100 W",
        "USB-Upstream-Porttyp": "USB Typ-C",
        "Verpackungsbreite": "730 mm",
        "Verpackungsh\u00f6he": "471 mm",
        "Verpackungstiefe": "193 mm",
        "Vertikaler Scanbereich": "48 - 75 Hz",
        "Vorderer Rahmen": "Schwarz",
        "sRGB Abdeckung klassisch": "101"
    },
    "raw_specifications_text": "Bildschirmdiagonale: 68,6 cm 27\"\nDisplay-Aufl\u00f6sung: 2560 x 1440 Pixel\nNatives Seitenverh\u00e4ltnis: 16:9\nBildschirmtechnologie: LCD\nTouchscreen: Nein\nHD-Typ: Quad HD\nPanel-Typ: IPS\nBildschirmform: Flach\nKontrastverh\u00e4ltnis: 1000:1\nMaximale Bildwiederholrate: 75 Hz\nAnzahl der Farben des Displays: 16,7 Millionen Farben\nTyp der Hintergrundbeleuchtung: W-LED\nHelligkeit typisch: 350 cd/m\u00b2\nReaktionszeit: 4 ms\nKontrastverh\u00e4ltnis dynamisch: 50000000:1\nDynamisches Kontrastverh\u00e4ltnis Marketingbezeichnung: SmartContrast\nBildwinkel, horizontal: 178\u00b0\nBildwinkel, vertikal: 178\u00b0\nPixel Abstand: 0,2331 x 0,2331 mm\nPixeldichte: 109 ppi\nHorizontaler Scanbereich: 30 - 114 kHz\nVertikaler Scanbereich: 48 - 75 Hz\nSichtbare Gr\u00f6\u00dfe horizontal: 59,7 cm\nSichtbare Gr\u00f6\u00dfe vertikal: 33,6 cm\nBildschirmdiagonale cm: 68,5 cm\nTr\u00fcbungsrate: 25\nOberfl\u00e4chenh\u00e4rte: 3H\nFarbtiefe: 8 Bit\nRGB-Farbraum: sRGB\nsRGB Abdeckung klassisch: 101\nNTSC Abdeckung typisch: 89\nNVIDIA G-SYNC: Nein\nAMD FreeSync: Nein\nKomponentenvideo-Synchronisation: Separate sync\nKompatible Betriebssysteme: Mac OS XWindows 11 / 10 / 8.1 / 8 / 7\nAnzahl der Lautsprecher: 2\nRMS-Leistung: 5 W\nMegapixel ca.: 5 MP\nMarktpositionierung: Business\nProduktfarbe: Schwarz\nVorderer Rahmen: Schwarz\nFu\u00dffarbe: Schwarz\nUSB-Hub-Version: 3.2 Gen 2 3.1 Gen 2\nUSB-Upstream-Porttyp: USB Typ-C\nAnzahl der vorgeschalteten Steckpl\u00e4tze: 1\nAnzahl der nachgeschalteten Steckpl\u00e4tze vom Typ USB-A: 4\nAnzahl der nachgeschalteten Ports vom Typ USB-C: 1\nUSB-Stromversorgung bis zu: 100 W\nAnzahl HDMI-Anschl\u00fcsse: 1\nHDMI-Version: 1.4\nAnzahl DisplayPort Anschl\u00fcsse: 1\nDisplayPorts-Version: 1.4\nHDCP-Version: 1.4/2.2\nPanel-Montage-Schnittstelle: 100 x 100 mm\nSlot-Typ Kabelsperre: Kensington\nH\u00f6heneinstellung: 15 cm\nPivot Winkel: -90 - 90\u00b0\nSchwenkwinkelbereich: -180 - 180\u00b0\nNeigungswinkelbereich: -5 - 30\u00b0\nMen\u00fcsprachen: Vereinfachtes Chinesisch, Traditionelles Chinesisch, Tschechisch, Deutsch, Niederl\u00e4ndisch, Englisch, Spanisch, Finnisch, Franz\u00f6sisch, Griechisch, Ungarisch, Italienisch, Japanisch, Koreanisch, Polnisch, Portugiesisch, Russisch, Schwedisch, T\u00fcrkisch, Ukrainisch\nLED-Anzeigen: T\u00e4tigkeit, Stand-by\nEnergieeffizienzklasse SDR: F\nEnergieverbrauch SDR pro 1.000 Stunden: 26 kWh\nStromverbrauch Standardbetrieb: 21,5 W\nStromverbrauch Standby: 0,4 W\nAC Eingangsspannung: 100 - 240 V\nAC Eingangsfrequenz: 50 - 60 Hz\nNetzteiltyp: Intern\nEnergieeffizienzskala: A bis G\nBetriebstemperatur: 0 - 40 \u00b0C\nTemperaturbereich bei Lagerung: -20 - 60 \u00b0C\nRelative Luftfeuchtigkeit in Betrieb: 20 - 80\nH\u00f6he bei Betrieb: 0 - 3658 m\nH\u00f6he bei Lagerung: 3658 - 12192 m\nMitgelieferte Kabel: HDMI, DisplayPort, USB Typ-C, AC\nMitgelieferte Software: SmartControl\nGer\u00e4tebreite inkl. Fu\u00df: 613 mm\nGer\u00e4tetiefe inkl. Fu\u00df: 225 mm\nGer\u00e4teh\u00f6he inkl. Fu\u00df: 537 mm\nGewicht mit St\u00e4nder: 7,3 kg\nBreite ohne Standfu\u00df: 613 mm\nTiefe ohne Standfu\u00df: 55 mm\nH\u00f6he ohne Standfu\u00df: 366 mm\nGewicht ohne St\u00e4nder: 5,54 kg\nVerpackungsbreite: 730 mm\nVerpackungstiefe: 193 mm\nVerpackungsh\u00f6he: 471 mm\nPaketgewicht: 10,9 kg\nNachhaltigkeitszertifikate: ENERGY STAR, TCO, RoHS\nEnth\u00e4lt nicht: Quecksilber, PVC/BFR\nNach Gebrauch recycelter Kunststoff: 85\nAu\u00dfenverkleidungstyp: Texturiert\nRecycelbares Verpackungsmaterial: 100\nMittlere Betriebsdauer zwischen Ausf\u00e4llen MTBF: 70000 h\nEthernet LAN Datentransferraten: 10,100,1000 Mbit/s\nBild-Verbesserung: SmartImage\nBeh\u00f6rdliche Zulassung: CB; CE Mark; FCC Class B; ICES-003; CU-EAC; EAEU RoHS; TUV Ergo; TUV/GS; TUV Eye Comfort certified",
    "reference_file": "offer_reference_743.json",
    "shop_name": "CSV-Direct.de"
}