{
    "html_file": "offer_1486_5.html",
    "name": "Samsung Odyssey G5 G55T (2021), 34\"",
    "offer_link": "https://direkt.jacob.de/produkte/samsung-odyssey-curved-lc34g55twwrxen-artnr-6975275.html?utm_source=geizhals&utm_medium=cpc&utm_campaign=Preisvergleich&ref=103",
    "price": 454.78,
    "raw_specifications": {
        "Abmessungen (Breite x Tiefe x H\u00f6he)": "80.66 cm x 27.26 cm x 47.53 cm - mit Fu\u00df",
        "Abmessungen (Breite x Tiefe x H\u00f6he) - mit Fu\u00df": "80.66 cm x 27.26 cm x 47.53 cm",
        "Adaptive-Sync Technologie": "AMD FreeSync Premium",
        "Besonderheiten": "Flimmerfreie Technologie, ohne Quecksilber, Eye Saver Mode, Off Timer Plus, HDR (High Dynamic Range), HDR10-kompatibel, Picture-by-Picture",
        "Bildschirmtyp": "VA",
        "Details zu Abmessungen & Gewicht": "Mit Fu\u00df - Breite: 80.66 cm - Tiefe: 27.26 cm - H\u00f6he: 47.53 cm - Gewicht: 5.6 kg  Ohne Fu\u00df - Breite: 80.66 cm - Tiefe: 15.27 cm - H\u00f6he: 38.09 cm",
        "Diagonalabmessung": "86 cm (34\")",
        "Display-Typ": "LED-hintergrundbeleuchteter LCD-Monitor / TFT-Aktivmatrix",
        "Eingangsanschl\u00fcsse": "HDMI, DisplayPort",
        "Einstellungen der Anzeigeposition": "Neigung",
        "Energie Effizienzklasse": "Klasse G",
        "Energieklasse (HDR)": "Klasse G",
        "Energieverbrauch pro Jahr": "54 kWh",
        "Enthaltene Kabel": "1 x DisplayPort-Kabel",
        "Farbe": "Schwarz",
        "Farbunterst\u00fctzung": "16,7 Millionen Farben",
        "Ger\u00e4tetyp": "LED-hintergrundbeleuchteter LCD-Monitor - 86 cm (34\")",
        "Geschwungener Bildschirm": "Ja (1000R)",
        "Gewicht": "5.6 kg",
        "Helligkeit": "250 cd/m\u00b2",
        "Hintergrundbeleuchtungs-Technologie": "LED-Hintergrundbeleuchtung",
        "Horizontaler Betrachtungswinkel": "178",
        "Kennzeichnung": "EMC, ISO 9241-307 Class 2",
        "Kontrast": "2500:1",
        "Leistungsaufnahme im Ein-Zustand": "37 W",
        "Leistungsmerkmale": "Slot f\u00fcr Sicherheitsschloss (Kabelschloss getrennt erh\u00e4ltlich)",
        "Native Aufl\u00f6sung": "Ultra WQHD 3440 x 1440 bei 165 Hz",
        "Neigungswinkel": "-2/+18",
        "Pixelpitch": "0.2316 mm",
        "Produktbeschreibung": "Samsung Odyssey G5 C34G55TWWR - G55T Series - LED-Monitor - gebogen - 86 cm (34\")",
        "Reaktionszeit": "1 ms (MPRT)",
        "Schlosstyp zur Diebstahlsicherung": "Kensington Slot",
        "Schnittstellen": "DisplayPort  HDMI  Kopfh\u00f6rer",
        "Seitenverh\u00e4ltnis": "21:9",
        "Stromverbrauch (Aus-Modus)": "0.3 Watt",
        "Stromverbrauch (typisch)": "37 Watt",
        "Stromverbrauch HDR (eingeschaltet)": "55 kWh/1.000 h",
        "Stromverbrauch SDR (eingeschaltet)": "37 kWh/1.000 h",
        "Stromverbrauch im Standby-Modus": "0.5 Watt",
        "Transportbreite": "90.1 cm",
        "Transportgewicht": "7.9 kg",
        "Transporth\u00f6he": "44.1 cm",
        "Transporttiefe": "21.6 cm",
        "VESA-Halterung": "75 x 75 mm",
        "Vertikaler Betrachtungswinkel": "178"
    },
    "raw_specifications_text": "Produktbeschreibung: Samsung Odyssey G5 C34G55TWWR - G55T Series - LED-Monitor - gebogen - 86 cm (34\")\nGer\u00e4tetyp: LED-hintergrundbeleuchteter LCD-Monitor - 86 cm (34\")\nEnergie Effizienzklasse: Klasse G\nEnergieverbrauch pro Jahr: 54 kWh\nLeistungsaufnahme im Ein-Zustand: 37 W\nGeschwungener Bildschirm: Ja (1000R)\nAdaptive-Sync Technologie: AMD FreeSync Premium\nBildschirmtyp: VA\nSeitenverh\u00e4ltnis: 21:9\nNative Aufl\u00f6sung: Ultra WQHD 3440 x 1440 bei 165 Hz\nPixelpitch: 0.2316 mm\nHelligkeit: 250 cd/m\u00b2\nKontrast: 2500:1\nReaktionszeit: 1 ms (MPRT)\nFarbunterst\u00fctzung: 16,7 Millionen Farben\nEingangsanschl\u00fcsse: HDMI, DisplayPort\nEinstellungen der Anzeigeposition: Neigung\nFarbe: Schwarz\nAbmessungen (Breite x Tiefe x H\u00f6he) - mit Fu\u00df: 80.66 cm x 27.26 cm x 47.53 cm\nGewicht: 5.6 kg\nKennzeichnung: EMC, ISO 9241-307 Class 2\nDisplay-Typ: LED-hintergrundbeleuchteter LCD-Monitor / TFT-Aktivmatrix\nEnergieklasse (HDR): Klasse G\nDiagonalabmessung: 86 cm (34\")\nHorizontaler Betrachtungswinkel: 178\nVertikaler Betrachtungswinkel: 178\nHintergrundbeleuchtungs-Technologie: LED-Hintergrundbeleuchtung\nBesonderheiten: Flimmerfreie Technologie, ohne Quecksilber, Eye Saver Mode, Off Timer Plus, HDR (High Dynamic Range), HDR10-kompatibel, Picture-by-Picture\nAbmessungen (Breite x Tiefe x H\u00f6he): 80.66 cm x 27.26 cm x 47.53 cm - mit Fu\u00df\nSchnittstellen: DisplayPort  HDMI  Kopfh\u00f6rer\nNeigungswinkel: -2/+18\nVESA-Halterung: 75 x 75 mm\nLeistungsmerkmale: Slot f\u00fcr Sicherheitsschloss (Kabelschloss getrennt erh\u00e4ltlich)\nEnthaltene Kabel: 1 x DisplayPort-Kabel\nSchlosstyp zur Diebstahlsicherung: Kensington Slot\nStromverbrauch SDR (eingeschaltet): 37 kWh/1.000 h\nStromverbrauch HDR (eingeschaltet): 55 kWh/1.000 h\nStromverbrauch (typisch): 37 Watt\nStromverbrauch im Standby-Modus: 0.5 Watt\nStromverbrauch (Aus-Modus): 0.3 Watt\nDetails zu Abmessungen & Gewicht: Mit Fu\u00df - Breite: 80.66 cm - Tiefe: 27.26 cm - H\u00f6he: 47.53 cm - Gewicht: 5.6 kg  Ohne Fu\u00df - Breite: 80.66 cm - Tiefe: 15.27 cm - H\u00f6he: 38.09 cm\nTransportbreite: 90.1 cm\nTransporttiefe: 21.6 cm\nTransporth\u00f6he: 44.1 cm\nTransportgewicht: 7.9 kg",
    "reference_file": "offer_reference_1486.json",
    "shop_name": "Jacob Elektronik direkt (AT)"
}