{
    "html_file": "offer_1707_4.html",
    "name": "LG 32UN500-W, 31.5\"",
    "offer_link": "https://www.mylemon.at/artikel/lg/32un500_w/80cm-31-5-3840x2160-32un500.html",
    "price": 403.9,
    "raw_specifications": {
        "AC Eingangsfrequenz": "50/60 Hz",
        "AC Eingangsspannung": "100 - 240 V",
        "AMD FreeSync": "Ja",
        "Anzahl DisplayPort Anschl\u00fcsse": "1",
        "Anzahl HDMI-Anschl\u00fcsse": "2",
        "Anzahl der Farben des Displays": "1,07 Milliarden Farben",
        "Anzahl der Lautsprecher": "2",
        "Artikelnummer": "M14YJW5L",
        "Audioanschl\u00fcsse": "Ja",
        "Aufl\u00f6sung": "3840x2160",
        "Bildschirmdiagonale": "80 cm (31.5 Zoll)",
        "Bildschirmform": "Flach",
        "Bildwinkel, horizontal": "178\u00b0",
        "Bildwinkel, vertikal": "178\u00b0",
        "Breite (ohne Standfu\u00df)": "71,4 cm",
        "DVI Anschluss": "Nein",
        "Display-Aufl\u00f6sung": "3840 x 2160 Pixel",
        "Displaygr\u00f6\u00dfe": "31,5 Zoll",
        "EAN": "8806098790418",
        "Eingebaute Lautsprecher": "Ja",
        "Energieeffizienzklasse (HDR)": "G",
        "Energieeffizienzklasse (SDR)": "G",
        "Energieeffizienzskala": "A bis G",
        "Energieverbrauch (HDR) pro 1.000 Stunden": "52 kWh",
        "Energieverbrauch (SDR) pro 1.000 Stunden": "35 kWh",
        "Farbskala": "90%",
        "Flimmerfreie Technologie": "Ja",
        "Ger\u00e4tebreite (inkl. Fu\u00df)": "713,7 mm",
        "Ger\u00e4teh\u00f6he (inkl. Fu\u00df)": "513,1 mm",
        "Ger\u00e4tetiefe (inkl. Fu\u00df)": "208,3 mm",
        "Gewicht (mit St\u00e4nder)": "10,7 kg",
        "Gewicht (ohne St\u00e4nder)": "6,71 kg",
        "HD-Typ": "4K Ultra HD",
        "HDMI": "Ja",
        "Helligkeit (typisch)": "350 cd/m\u00b2",
        "Hersteller Artikelnummer": "32UN500-W",
        "H\u00f6he (ohne Standfu\u00df)": "41,9 cm",
        "H\u00f6henverstellung": "Nein",
        "Integrierte Kamera": "Nein",
        "Integrierter USB-Hub": "Nein",
        "Kontrastverh\u00e4ltnis": "3000:1",
        "Kopfh\u00f6rerausgang": "Ja",
        "Marktpositionierung": "Gaming",
        "Maximale Bildwiederholrate": "60 Hz",
        "Natives Seitenverh\u00e4ltnis": "16:9",
        "Neigungsverstellung": "Ja",
        "Neigungswinkelbereich": "-5 - 15\u00b0",
        "On-Screen-Display (OSD)": "Ja",
        "Panel": "VA",
        "Panel-Montage-Schnittstelle": "100 x 100 mm",
        "Panel-Typ": "VA",
        "Pixel Abstand": "0,18159 x 0,18159 mm",
        "Produktfarbe": "Schwarz, Wei\u00df",
        "RMS-Leistung": "10 W",
        "Reaktionszeit": "4 ms",
        "Stromverbrauch (Standby)": "0,5 W",
        "Stromverbrauch (aus)": "0,3 W",
        "Tiefe (ohne Standfu\u00df)": "4,57 cm",
        "Touchscreen": "Nein",
        "Unterst\u00fctzte Grafik-Aufl\u00f6sungen": "1920 x 1080 (HD 1080), 3840 x 2160",
        "VESA-Halterung": "Ja",
        "Video Anschl\u00fcsse": "2x HDMI, 1x DisplayPort",
        "Warentarifnummer (HS)": "85285210"
    },
    "raw_specifications_text": "Displaygr\u00f6\u00dfe: 31,5 Zoll\nAufl\u00f6sung: 3840x2160\nPanel: VA\nReaktionszeit: 4 ms\nVideo Anschl\u00fcsse: 2x HDMI, 1x DisplayPort\nHersteller Artikelnummer: 32UN500-W\nEAN: 8806098790418\nArtikelnummer: M14YJW5L\nBildschirmdiagonale: 80 cm (31.5 Zoll)\nDisplay-Aufl\u00f6sung: 3840 x 2160 Pixel\nNatives Seitenverh\u00e4ltnis: 16:9\nTouchscreen: Nein\nHD-Typ: 4K Ultra HD\nPanel-Typ: VA\nBildschirmform: Flach\nKontrastverh\u00e4ltnis: 3000:1\nMaximale Bildwiederholrate: 60 Hz\nAnzahl der Farben des Displays: 1,07 Milliarden Farben\nHelligkeit (typisch): 350 cd/m\u00b2\nUnterst\u00fctzte Grafik-Aufl\u00f6sungen: 1920 x 1080 (HD 1080), 3840 x 2160\nBildwinkel, horizontal: 178\u00b0\nBildwinkel, vertikal: 178\u00b0\nPixel Abstand: 0,18159 x 0,18159 mm\nFarbskala: 90%\nAMD FreeSync: Ja\nFlimmerfreie Technologie: Ja\nEingebaute Lautsprecher: Ja\nIntegrierte Kamera: Nein\nAnzahl der Lautsprecher: 2\nRMS-Leistung: 10 W\nMarktpositionierung: Gaming\nProduktfarbe: Schwarz, Wei\u00df\nIntegrierter USB-Hub: Nein\nHDMI: Ja\nKopfh\u00f6rerausgang: Ja\nDVI Anschluss: Nein\nAnzahl HDMI-Anschl\u00fcsse: 2\nAnzahl DisplayPort Anschl\u00fcsse: 1\nAudioanschl\u00fcsse: Ja\nVESA-Halterung: Ja\nH\u00f6henverstellung: Nein\nPanel-Montage-Schnittstelle: 100 x 100 mm\nNeigungswinkelbereich: -5 - 15\u00b0\nOn-Screen-Display (OSD): Ja\nNeigungsverstellung: Ja\nEnergieeffizienzklasse (SDR): G\nEnergieeffizienzklasse (HDR): G\nEnergieverbrauch (SDR) pro 1.000 Stunden: 35 kWh\nEnergieverbrauch (HDR) pro 1.000 Stunden: 52 kWh\nStromverbrauch (Standby): 0,5 W\nStromverbrauch (aus): 0,3 W\nAC Eingangsspannung: 100 - 240 V\nAC Eingangsfrequenz: 50/60 Hz\nEnergieeffizienzskala: A bis G\nGer\u00e4tebreite (inkl. Fu\u00df): 713,7 mm\nGer\u00e4tetiefe (inkl. Fu\u00df): 208,3 mm\nGer\u00e4teh\u00f6he (inkl. Fu\u00df): 513,1 mm\nGewicht (mit St\u00e4nder): 10,7 kg\nBreite (ohne Standfu\u00df): 71,4 cm\nTiefe (ohne Standfu\u00df): 4,57 cm\nH\u00f6he (ohne Standfu\u00df): 41,9 cm\nGewicht (ohne St\u00e4nder): 6,71 kg\nWarentarifnummer (HS): 85285210",
    "reference_file": "offer_reference_1707.json",
    "shop_name": "mylemon.at"
}