{
    "html_file": "offer_1718_13.html",
    "name": "AOC Porsche Design Agon PD27, 27\"",
    "offer_link": "https://ms-it-beratung.at/shop/details.php?art=353989&artname=AOC+68%2C6cm+%2827%22%29++PD27+++++16%3A09+2xHDMI%2B2xDP%2BUSB+black",
    "price": 606.0,
    "raw_specifications": {
        "AC Eingangsfrequenz": "50 - 60 Hz",
        "AC Eingangsspannung": "100 - 240 V",
        "AMD FreeSync": "Ja",
        "AMD FreeSync Bildwiederholratenbereich": "48 - 240 Hz",
        "AMD FreeSync-Typ": "FreeSync Premium Pro",
        "Abnehmbarer Standfu\u00df": "Nein",
        "Adobe RGB-Abdeckung": "89%",
        "Anzahl DisplayPort Anschl\u00fcsse": "2",
        "Anzahl HDMI-Anschl\u00fcsse": "2",
        "Anzahl OSD-Sprachen": "16",
        "Anzahl der Farben des Displays": "16,7 Millionen Farben",
        "Anzahl der Lautsprecher": "2",
        "Anzahl der nachgeschalteten Steckpl\u00e4tze vom Typ USB-A": "4",
        "Audioanschl\u00fcsse": "Ja",
        "Au\u00dfenverkleidungstyp": "Texturiert",
        "Bewertung der Bildschirmkr\u00fcmmung": "1000R",
        "Bildschirmdiagonale": "68,6 cm (27\")",
        "Bildschirmdiagonale (cm)": "68,58 cm",
        "Bildschirmform": "Gebogen",
        "Bildschirmtechnologie": "LED",
        "Bildwinkel, horizontal": "178\u00b0",
        "Bildwinkel, vertikal": "178\u00b0",
        "DVI Anschluss": "Nein",
        "Display-Aufl\u00f6sung": "2560 x 1440 Pixel",
        "Display-Oberfl\u00e4che": "Matt",
        "DisplayPort Kabell\u00e4nge": "1,8 m",
        "DisplayPorts-Version": "1.4",
        "Eingebaute Lautsprecher": "Ja",
        "Eingebautes Mikrofon": "Ja",
        "Energieeffizienzklasse (HDR)": "G",
        "Energieeffizienzklasse (SDR)": "G",
        "Energieeffizienzskala": "A bis G",
        "Energieverbrauch (HDR) pro 1.000 Stunden": "68 kWh",
        "Energieverbrauch (SDR) pro 1.000 Stunden": "32 kWh",
        "Externes Netzteil": "Ja",
        "Farbtiefe": "8 Bit",
        "Flimmerfreie Technologie": "Ja",
        "Ger\u00e4tebreite (inkl. Fu\u00df)": "605,5 mm",
        "Ger\u00e4teh\u00f6he (inkl. Fu\u00df)": "439,9 mm",
        "Ger\u00e4tetiefe (inkl. Fu\u00df)": "322 mm",
        "Gewicht (mit St\u00e4nder)": "8,9 kg",
        "HD-Typ": "2K Ultra HD",
        "HDMI": "Ja",
        "HDMI-Kabell\u00e4nge": "1,8 m",
        "HDMI-Version": "2.0",
        "Helligkeit (typisch)": "550 cd/m\u00b2",
        "High Dynamic Range Video (HDR) Unterst\u00fctzung": "Ja",
        "Horizontaler Scanbereich": "30 - 230 kHz",
        "H\u00f6heneinstellung": "15 cm",
        "H\u00f6henverstellung": "Ja",
        "Integrierte Kamera": "Nein",
        "Integrierter USB-Hub": "Ja",
        "Kabelsperre-Slot": "Ja",
        "Kontrastverh\u00e4ltnis": "2500:1",
        "Kontrastverh\u00e4ltnis (dynamisch)": "80000000:1",
        "Kopfh\u00f6rer-Anschluss": "3,5 mm",
        "Kopfh\u00f6rerausgang": "Ja",
        "Kopfh\u00f6rerausg\u00e4nge": "1",
        "Lichteffekte": "Ja",
        "Low-Blue-Light-Technologie": "Ja",
        "Marktpositionierung": "Gaming",
        "Maximale Bildwiederholrate": "240 Hz",
        "Men\u00fcsprachen": "Vereinfachtes Chinesisch, Traditionelles Chinesisch, Kroatisch, Tschechisch, Deutsch, Niederl\u00e4ndisch, Englisch, Spanisch, Finnisch, Franz\u00f6sisch, Italienisch, Japanisch, Koreanisch, Polnisch, Portugiesisch, Russisch, Schwedisch, T\u00fcrkisch, Ukrainisch",
        "Mikrofon-Eingang": "Ja",
        "Mitgelieferte Kabel": "AC, DisplayPort, HDMI",
        "NTSC Abdeckung (typisch)": "85%",
        "NVIDIA G-SYNC": "Nein",
        "Nachhaltigkeitszertifikate": "RoHS",
        "Natives Seitenverh\u00e4ltnis": "16:9",
        "Neigungsverstellung": "Ja",
        "Neigungswinkelbereich": "-5 - 23\u00b0",
        "Oberfl\u00e4chenh\u00e4rte": "3H",
        "On-Screen-Display (OSD)": "Ja",
        "Paketgewicht": "14,9 kg",
        "Panel-Typ": "VA",
        "Pivot": "Ja",
        "Plug & Play": "Ja",
        "Produktfarbe": "Schwarz",
        "RGB-Farbraum": "sRGB",
        "RMS-Leistung": "5 W",
        "Rahmenloses Design": "Ja",
        "Reaktionszeit": "0,5 ms",
        "Recycelbares Verpackungsmaterial": "100%",
        "Schnellladung": "Ja",
        "Schwenkbar": "Ja",
        "Schwenkwinkelbereich": "-17 - 17\u00b0",
        "Schwermetallfrei": "Hg (Quecksilber)",
        "Seitenverh\u00e4ltnis": "4:3, 16:9",
        "Slot-Typ Kabelsperre": "Kensington",
        "Stromadapter enthalten": "Ja",
        "Stromverbrauch (Standardbetrieb)": "52 W",
        "Stromverbrauch (Standby)": "0,5 W",
        "Stromverbrauch (aus)": "0,3 W",
        "St\u00e4nder enthalten": "Ja",
        "Technologie mit hohem Dynamikbereich (HDR)": "DisplayHDR 400",
        "Touchscreen": "Nein",
        "Typ der Hintergrundbeleuchtung": "W-LED",
        "USB-Hub-Version": "3.2 Gen 1 (3.1 Gen 1)",
        "Unterst\u00fctzte Grafik-Aufl\u00f6sungen": "1920 x 1080 (HD 1080), 2560 x 1440",
        "Unterst\u00fctzte Video-Modi": "1080p, 1440p",
        "VESA-Halterung": "Ja",
        "Verpackungsart": "Box",
        "Verpackungsbreite": "690 mm",
        "Verpackungsh\u00f6he": "678 mm",
        "Verpackungstiefe": "376 mm",
        "Vorderer Rahmen": "Schwarz",
        "Warentarifnummer (HS)": "85285210",
        "Zertifizierung": "True",
        "sRGB Abdeckung (klassisch)": "119%"
    },
    "raw_specifications_text": "Bildschirmdiagonale: 68,6 cm (27\")\nDisplay-Aufl\u00f6sung: 2560 x 1440 Pixel\nNatives Seitenverh\u00e4ltnis: 16:9\nBildschirmtechnologie: LED\nTouchscreen: Nein\nHD-Typ: 2K Ultra HD\nPanel-Typ: VA\nTyp der Hintergrundbeleuchtung: W-LED\nHelligkeit (typisch): 550 cd/m\u00b2\nReaktionszeit: 0,5 ms\nDisplay-Oberfl\u00e4che: Matt\nBildschirmform: Gebogen\nBewertung der Bildschirmkr\u00fcmmung: 1000R\nUnterst\u00fctzte Grafik-Aufl\u00f6sungen: 1920 x 1080 (HD 1080), 2560 x 1440\nUnterst\u00fctzte Video-Modi: 1080p, 1440p\nSeitenverh\u00e4ltnis: 4:3, 16:9\nKontrastverh\u00e4ltnis: 2500:1\nKontrastverh\u00e4ltnis (dynamisch): 80000000:1\nMaximale Bildwiederholrate: 240 Hz\nBildwinkel, horizontal: 178\u00b0\nBildwinkel, vertikal: 178\u00b0\nAnzahl der Farben des Displays: 16,7 Millionen Farben\nHorizontaler Scanbereich: 30 - 230 kHz\nBildschirmdiagonale (cm): 68,58 cm\nHigh Dynamic Range Video (HDR) Unterst\u00fctzung: Ja\nTechnologie mit hohem Dynamikbereich (HDR): DisplayHDR 400\nOberfl\u00e4chenh\u00e4rte: 3H\nFarbtiefe: 8 Bit\nRGB-Farbraum: sRGB\nsRGB Abdeckung (klassisch): 119%\nNTSC Abdeckung (typisch): 85%\nAdobe RGB-Abdeckung: 89%\nNVIDIA G-SYNC: Nein\nAMD FreeSync: Ja\nAMD FreeSync-Typ: FreeSync Premium Pro\nAMD FreeSync Bildwiederholratenbereich: 48 - 240 Hz\nSchnellladung: Ja\nFlimmerfreie Technologie: Ja\nLow-Blue-Light-Technologie: Ja\nEingebaute Lautsprecher: Ja\nIntegrierte Kamera: Nein\nAnzahl der Lautsprecher: 2\nRMS-Leistung: 5 W\nEingebautes Mikrofon: Ja\nMarktpositionierung: Gaming\nProduktfarbe: Schwarz\nRahmenloses Design: Ja\nVorderer Rahmen: Schwarz\nAbnehmbarer Standfu\u00df: Nein\nSchwermetallfrei: Hg (Quecksilber)\nZertifizierung: True\nIntegrierter USB-Hub: Ja\nUSB-Hub-Version: 3.2 Gen 1 (3.1 Gen 1)\nAnzahl der nachgeschalteten Steckpl\u00e4tze vom Typ USB-A: 4\nDVI Anschluss: Nein\nHDMI: Ja\nAnzahl HDMI-Anschl\u00fcsse: 2\nHDMI-Version: 2.0\nAnzahl DisplayPort Anschl\u00fcsse: 2\nDisplayPorts-Version: 1.4\nAudioanschl\u00fcsse: Ja\nKopfh\u00f6rerausgang: Ja\nKopfh\u00f6rerausg\u00e4nge: 1\nKopfh\u00f6rer-Anschluss: 3,5 mm\nMikrofon-Eingang: Ja\nVESA-Halterung: Ja\nKabelsperre-Slot: Ja\nSlot-Typ Kabelsperre: Kensington\nH\u00f6henverstellung: Ja\nH\u00f6heneinstellung: 15 cm\nPivot: Ja\nSchwenkbar: Ja\nSchwenkwinkelbereich: -17 - 17\u00b0\nNeigungswinkelbereich: -5 - 23\u00b0\nOn-Screen-Display (OSD): Ja\nMen\u00fcsprachen: Vereinfachtes Chinesisch, Traditionelles Chinesisch, Kroatisch, Tschechisch, Deutsch, Niederl\u00e4ndisch, Englisch, Spanisch, Finnisch, Franz\u00f6sisch, Italienisch, Japanisch, Koreanisch, Polnisch, Portugiesisch, Russisch, Schwedisch, T\u00fcrkisch, Ukrainisch\nAnzahl OSD-Sprachen: 16\nPlug & Play: Ja\nNeigungsverstellung: Ja\nEnergieeffizienzklasse (SDR): G\nEnergieeffizienzklasse (HDR): G\nEnergieverbrauch (SDR) pro 1.000 Stunden: 32 kWh\nEnergieverbrauch (HDR) pro 1.000 Stunden: 68 kWh\nStromverbrauch (Standardbetrieb): 52 W\nStromverbrauch (Standby): 0,5 W\nStromverbrauch (aus): 0,3 W\nAC Eingangsspannung: 100 - 240 V\nAC Eingangsfrequenz: 50 - 60 Hz\nEnergieeffizienzskala: A bis G\nExternes Netzteil: Ja\nSt\u00e4nder enthalten: Ja\nMitgelieferte Kabel: AC, DisplayPort, HDMI\nStromadapter enthalten: Ja\nDisplayPort Kabell\u00e4nge: 1,8 m\nHDMI-Kabell\u00e4nge: 1,8 m\nGer\u00e4tebreite (inkl. Fu\u00df): 605,5 mm\nGer\u00e4tetiefe (inkl. Fu\u00df): 322 mm\nGer\u00e4teh\u00f6he (inkl. Fu\u00df): 439,9 mm\nGewicht (mit St\u00e4nder): 8,9 kg\nVerpackungsbreite: 690 mm\nVerpackungstiefe: 376 mm\nVerpackungsh\u00f6he: 678 mm\nPaketgewicht: 14,9 kg\nVerpackungsart: Box\nNachhaltigkeitszertifikate: RoHS\nWarentarifnummer (HS): 85285210\nAu\u00dfenverkleidungstyp: Texturiert\nRecycelbares Verpackungsmaterial: 100%\nLichteffekte: Ja",
    "reference_file": "offer_reference_1718.json",
    "shop_name": "ms-it-beratung"
}