{
    "html_file": "offer_2025_4.html",
    "name": "Dell E2720H, 27\"",
    "offer_link": "https://www.mylemon.at/artikel/dell/dell_e2720h/monitor-e2720h-68-58cm-27.html",
    "price": 192.36,
    "raw_specifications": {
        "3D": "Nein",
        "AC Eingangsfrequenz": "50 - 60 Hz",
        "AC Eingangsspannung": "100 - 240 V",
        "AMD FreeSync": "Nein",
        "Anzahl DisplayPort Anschl\u00fcsse": "1",
        "Anzahl VGA (D-Sub) Anschl\u00fcsse": "1",
        "Anzahl der Farben des Displays": "16,78 Millionen Farben",
        "Artikelnummer": "M10YHJ2L",
        "Audioanschl\u00fcsse": "Nein",
        "Aufl\u00f6sung": "1920x1080",
        "Betriebsanleitung": "Ja",
        "Betriebstemperatur": "0 - 40 \u00b0C",
        "Bildschirmdiagonale": "68,6 cm (27 Zoll)",
        "Bildschirmform": "Flach",
        "Bildschirmtechnologie": "LCD",
        "Bildwinkel, horizontal": "178\u00b0",
        "Bildwinkel, vertikal": "178\u00b0",
        "Breite (ohne Standfu\u00df)": "62,1 cm",
        "DDC/CI": "Ja",
        "DVI Anschluss": "Nein",
        "Dell ComfortView-Technologie": "Ja",
        "Dell Display Manager (DDM)-kompatibel": "Ja",
        "Display-Aufl\u00f6sung": "1920 x 1080 Pixel",
        "DisplayPorts-Version": "1.2",
        "Displaygr\u00f6\u00dfe": "27 Zoll",
        "EAN": "5397184200711",
        "Ein-/Ausschalter": "Ja",
        "Eingangsstrom": "1 A",
        "Eingebaute Lautsprecher": "Nein",
        "Energieeffizienzklasse (SDR)": "E",
        "Energieeffizienzskala": "A bis G",
        "Energieverbrauch (SDR) pro 1.000 Stunden": "18 kWh",
        "Enth\u00e4lt nicht": "PVC",
        "Ergonomie": "Neigbar",
        "Farbskala": "83%",
        "Flimmerfreie Technologie": "Ja",
        "Fu\u00dffarbe": "Schwarz",
        "Ger\u00e4tebreite (inkl. Fu\u00df)": "621,5 mm",
        "Ger\u00e4teh\u00f6he (inkl. Fu\u00df)": "458,1 mm",
        "Ger\u00e4tetiefe (inkl. Fu\u00df)": "175 mm",
        "Gewicht (mit St\u00e4nder)": "4,55 kg",
        "Gewicht (ohne St\u00e4nder)": "4,5 kg",
        "HD-Typ": "Full HD",
        "HDCP": "Ja",
        "HDMI": "Nein",
        "Helligkeit": "300 cd/m\u00b2",
        "Helligkeit (typisch)": "300 cd/m\u00b2",
        "Hersteller Artikelnummer": "DELL-E2720H",
        "Horizontaler Scanbereich": "30 - 84 kHz",
        "H\u00f6he (ohne Standfu\u00df)": "36,6 cm",
        "H\u00f6he bei Betrieb": "0 - 5000 m",
        "H\u00f6he bei Lagerung": "0 - 12192 m",
        "H\u00f6henverstellung": "Nein",
        "Integrierte Kamera": "Nein",
        "Integrierter USB-Hub": "Nein",
        "Kabelsperre-Slot": "Ja",
        "Kontrastverh\u00e4ltnis": "1000:1",
        "Kopfh\u00f6rerausgang": "Nein",
        "LED-Anzeigen": "Leistung",
        "Luftfeuchtigkeit bei Lagerung": "5 - 90%",
        "Marktpositionierung": "Haus",
        "Maximale Bildwiederholrate": "60 Hz",
        "Mitgelieferte Kabel": "AC, DisplayPort",
        "NVIDIA G-SYNC": "Nein",
        "Nachhaltigkeitszertifikate": "RoHS, ENERGY STAR",
        "Natives Seitenverh\u00e4ltnis": "16:9",
        "Neigungsverstellung": "Ja",
        "Neigungswinkelbereich": "-5 - 21\u00b0",
        "On-Screen-Display (OSD)": "Ja",
        "Panel": "IPS",
        "Panel-Montage-Schnittstelle": "100 x 100 mm",
        "Panel-Typ": "IPS",
        "Pixel Abstand": "0,3114 x 0,3114 mm",
        "Pixeldichte": "81 ppi",
        "Plug & Play": "Ja",
        "Produktfarbe": "Schwarz",
        "Rahmenbreite (Seite)": "1,18 cm",
        "Rahmenbreite (oben)": "1,18 cm",
        "Rahmenbreite (unten)": "1,82 cm",
        "Reaktionszeit": "8 ms",
        "Reaktionszeit (schnell)": "5 ms",
        "Relative Luftfeuchtigkeit in Betrieb": "10 - 80%",
        "Sichtbare Gr\u00f6\u00dfe (diagonal)": "68,6 cm",
        "Sichtbare Gr\u00f6\u00dfe (horizontal)": "59,8 cm",
        "Sichtbare Gr\u00f6\u00dfe (vertikal)": "33,6 cm",
        "Stromeingang": "Ja",
        "Stromverbrauch (PowerSave)": "13,22 W",
        "Stromverbrauch (Standardbetrieb)": "17,9 W",
        "Stromverbrauch (Standby)": "0,2 W",
        "Stromverbrauch (aus)": "0,2 W",
        "Stromverbrauch (max.)": "26 W",
        "St\u00e4nder enthalten": "Ja",
        "Sync-On-Green (SOG)": "Ja",
        "TV Tuner integriert": "Nein",
        "Temperaturbereich bei Lagerung": "-20 - 60 \u00b0C",
        "Tiefe (ohne Standfu\u00df)": "5,23 cm",
        "Touchscreen": "Nein",
        "Typ der Hintergrundbeleuchtung": "LED",
        "Unterst\u00fctzte Grafik-Aufl\u00f6sungen": "640 x 480 (VGA), 720 x 400, 800 x 600 (SVGA), 1024 x 768 (XGA), 1152 x 864 (XGA+), 1280 x 1024 (SXGA), 1600 x 900, 1920 x 1080 (HD 1080)",
        "VESA Halterung": "100x100 mm",
        "VESA-Halterung": "Ja",
        "Verpackungsbreite": "125 mm",
        "Verpackungsh\u00f6he": "450,1 mm",
        "Verpackungstiefe": "800,1 mm",
        "Vertikaler Scanbereich": "48 - 75 Hz",
        "Video Anschl\u00fcsse": "1x VGA, 1x DisplayPort",
        "Vorderer Rahmen": "Schwarz",
        "Warentarifnummer (HS)": "85285210",
        "Zertifizierung": "TCO"
    },
    "raw_specifications_text": "Displaygr\u00f6\u00dfe: 27 Zoll\nAufl\u00f6sung: 1920x1080\nPanel: IPS\nReaktionszeit: 8 ms\nVideo Anschl\u00fcsse: 1x VGA, 1x DisplayPort\nErgonomie: Neigbar\nVESA Halterung: 100x100 mm\nHelligkeit: 300 cd/m\u00b2\nHersteller Artikelnummer: DELL-E2720H\nEAN: 5397184200711\nArtikelnummer: M10YHJ2L\nBildschirmdiagonale: 68,6 cm (27 Zoll)\nDisplay-Aufl\u00f6sung: 1920 x 1080 Pixel\nNatives Seitenverh\u00e4ltnis: 16:9\nBildschirmtechnologie: LCD\nTouchscreen: Nein\nHD-Typ: Full HD\nPanel-Typ: IPS\nBildschirmform: Flach\nKontrastverh\u00e4ltnis: 1000:1\nMaximale Bildwiederholrate: 60 Hz\nAnzahl der Farben des Displays: 16,78 Millionen Farben\nTyp der Hintergrundbeleuchtung: LED\nHelligkeit (typisch): 300 cd/m\u00b2\nUnterst\u00fctzte Grafik-Aufl\u00f6sungen: 640 x 480 (VGA), 720 x 400, 800 x 600 (SVGA), 1024 x 768 (XGA), 1152 x 864 (XGA+), 1280 x 1024 (SXGA), 1600 x 900, 1920 x 1080 (HD 1080)\nBildwinkel, horizontal: 178\u00b0\nBildwinkel, vertikal: 178\u00b0\nReaktionszeit (schnell): 5 ms\nPixel Abstand: 0,3114 x 0,3114 mm\nPixeldichte: 81 ppi\nHorizontaler Scanbereich: 30 - 84 kHz\nVertikaler Scanbereich: 48 - 75 Hz\nSichtbare Gr\u00f6\u00dfe (horizontal): 59,8 cm\nSichtbare Gr\u00f6\u00dfe (vertikal): 33,6 cm\nSichtbare Gr\u00f6\u00dfe (diagonal): 68,6 cm\nSync-On-Green (SOG): Ja\nDDC/CI: Ja\nFarbskala: 83%\nDell ComfortView-Technologie: Ja\n3D: Nein\nNVIDIA G-SYNC: Nein\nAMD FreeSync: Nein\nFlimmerfreie Technologie: Ja\nEingebaute Lautsprecher: Nein\nIntegrierte Kamera: Nein\nMarktpositionierung: Haus\nProduktfarbe: Schwarz\nVorderer Rahmen: Schwarz\nFu\u00dffarbe: Schwarz\nZertifizierung: TCO\nIntegrierter USB-Hub: Nein\nHDMI: Nein\nKopfh\u00f6rerausgang: Nein\nAnzahl VGA (D-Sub) Anschl\u00fcsse: 1\nDVI Anschluss: Nein\nAnzahl DisplayPort Anschl\u00fcsse: 1\nDisplayPorts-Version: 1.2\nAudioanschl\u00fcsse: Nein\nHDCP: Ja\nStromeingang: Ja\nVESA-Halterung: Ja\nKabelsperre-Slot: Ja\nH\u00f6henverstellung: Nein\nPanel-Montage-Schnittstelle: 100 x 100 mm\nNeigungswinkelbereich: -5 - 21\u00b0\nOn-Screen-Display (OSD): Ja\nPlug & Play: Ja\nLED-Anzeigen: Leistung\nNeigungsverstellung: Ja\nEnergieeffizienzklasse (SDR): E\nEnergieverbrauch (SDR) pro 1.000 Stunden: 18 kWh\nStromverbrauch (Standardbetrieb): 17,9 W\nStromverbrauch (Standby): 0,2 W\nStromverbrauch (max.): 26 W\nStromverbrauch (aus): 0,2 W\nStromverbrauch (PowerSave): 13,22 W\nAC Eingangsspannung: 100 - 240 V\nAC Eingangsfrequenz: 50 - 60 Hz\nEingangsstrom: 1 A\nEnergieeffizienzskala: A bis G\nBetriebstemperatur: 0 - 40 \u00b0C\nTemperaturbereich bei Lagerung: -20 - 60 \u00b0C\nRelative Luftfeuchtigkeit in Betrieb: 10 - 80%\nLuftfeuchtigkeit bei Lagerung: 5 - 90%\nH\u00f6he bei Betrieb: 0 - 5000 m\nH\u00f6he bei Lagerung: 0 - 12192 m\nSt\u00e4nder enthalten: Ja\nMitgelieferte Kabel: AC, DisplayPort\nBetriebsanleitung: Ja\nGer\u00e4tebreite (inkl. Fu\u00df): 621,5 mm\nGer\u00e4tetiefe (inkl. Fu\u00df): 175 mm\nGer\u00e4teh\u00f6he (inkl. Fu\u00df): 458,1 mm\nGewicht (mit St\u00e4nder): 4,55 kg\nBreite (ohne Standfu\u00df): 62,1 cm\nTiefe (ohne Standfu\u00df): 5,23 cm\nH\u00f6he (ohne Standfu\u00df): 36,6 cm\nGewicht (ohne St\u00e4nder): 4,5 kg\nRahmenbreite (Seite): 1,18 cm\nRahmenbreite (oben): 1,18 cm\nRahmenbreite (unten): 1,82 cm\nVerpackungsbreite: 125 mm\nVerpackungstiefe: 800,1 mm\nVerpackungsh\u00f6he: 450,1 mm\nNachhaltigkeitszertifikate: RoHS, ENERGY STAR\nEnth\u00e4lt nicht: PVC\nWarentarifnummer (HS): 85285210\nDell Display Manager (DDM)-kompatibel: Ja\nEin-/Ausschalter: Ja\nTV Tuner integriert: Nein",
    "reference_file": "offer_reference_2025.json",
    "shop_name": "mylemon.at"
}