{
    "html_file": "offer_291_1.html",
    "name": "LG 32UL950P-W, 31.5\"",
    "offer_link": "https://www.proshop.at/Bildschirm/LG-32-Bildschirm-UltraFine-32UL950P-W-LED-monitor-4K-32-HDR-White-5-ms-AMD-FreeSync/3186741?utm_source=geizhals&utm_medium=cpc&utm_campaign=pricesite",
    "price": 814.22,
    "raw_specifications": {
        "Abmessungen (Breite x Tiefe x H\u00f6he)": "71.82 cm x 23.12 cm x 48.8 cm - mit Fu\u00df",
        "Abmessungen (Breite x Tiefe x H\u00f6he) - mit Fu\u00df": "71.82 cm x 23.12 cm x 48.8 cm",
        "Adaptive-Sync Technologie": "AMD FreeSync",
        "Ausgangsleistung/Kanal": "5 Watt",
        "Besonderheiten": "Flicker Safe, Intelligente Energiespartechnologie, Black Stabilizer, DAS Mode (Dynamic Action Sync), 8-Bit-Gamma, Mega DFC, HW-Kalibrierung",
        "Bildschirmbeschichtung": "Blendfrei, 3H Hard Coating",
        "Bildschirmtyp": "Nano IPS",
        "Daisy-Chaining": "Ja",
        "Details zu Abmessungen & Gewicht": "Mit Fu\u00df - Breite: 71.82 cm - Tiefe: 23.12 cm - H\u00f6he: 48.8 cm - Gewicht: 7.3 kg  Ohne Fu\u00df - Breite: 71.82 cm - Tiefe: 4.51 cm - H\u00f6he: 41.43 cm - Gewicht: 5.9 kg",
        "Diagonalabmessung": "81 cm (32\")",
        "Display-Typ": "LED-hintergrundbeleuchteter LCD-Monitor / TFT-Aktivmatrix",
        "EAN": "8806087975451",
        "Eingangsanschl\u00fcsse": "2xThunderbolt 3, HDMI, DisplayPort",
        "Einstellungen der Anzeigeposition": "H\u00f6he, Pivot (Rotation), Neigung",
        "Energie Effizienzklasse": "Klasse G",
        "Energieklasse (HDR)": "Klasse G",
        "Enthaltene Kabel": "1 x DisplayPort-Kabel  1 x HDMI-Kabel  1 x Kabel Thunderbolt 3",
        "Farbe": "Schwarz, wei\u00df (hinten)",
        "Farbraum": "135% sRGB, 98% DCI-P3",
        "Ger\u00e4tetyp": "LED-hintergrundbeleuchteter LCD-Monitor - 81 cm (32\")",
        "Gewicht": "7.3 kg",
        "HDR-Format": "HDR10",
        "HDR-Zertifizierung": "DisplayHDR 600",
        "HDR-f\u00e4hig": "HDR10 / DisplayHDR 600",
        "Helligkeit": "450 cd/m\u00b2",
        "Hersteller": "LG",
        "Hintergrundbeleuchtungs-Technologie": "LED-Hintergrundbeleuchtung",
        "Horizontale Bildwiederholrate": "30 - 135 kHz",
        "Horizontaler Betrachtungswinkel": "178",
        "H\u00f6heneinstellung": "110 mm",
        "Integrierte Peripherieger\u00e4te": "USB 3.0-Hub",
        "Kennzeichnung": "Plug and Play, DDC/CI, HDCP 2.2",
        "Kontrast": "1300:1",
        "Leistungsmerkmale": "Abnehmbarer St\u00e4nder",
        "Mitgelieferte Software": "LG On-Screen Control",
        "Modell": "32UL950P-W",
        "Native Aufl\u00f6sung": "4K 3840 x 2160 bei 60 Hz",
        "Neigungswinkel": "-5/+15",
        "OSD-Sprachen": "Multilingual",
        "Pixelpitch": "0.181 mm",
        "Produktbeschreibung": "LG UltraFine 32UL950P-W - LED-Monitor - 4K - 81 cm (32\") - HDR",
        "Reaktionszeit": "5 ms (Gray-to-Gray)",
        "Schnittstellen": "DisplayPort  2 x Thunderbolt 3  HDMI 2.0  2 x USB 3.0  Kopfh\u00f6rer",
        "Seitenverh\u00e4ltnis": "16:9",
        "Stromverbrauch (Aus-Modus)": "0.3 Watt",
        "Stromverbrauch (typisch)": "39 Watt",
        "Stromverbrauch HDR (eingeschaltet)": "69 kWh/1.000 h",
        "Stromverbrauch SDR (eingeschaltet)": "33 kWh/1.000 h",
        "Stromverbrauch im Standby-Modus": "0.5 Watt",
        "Typ": "Lautsprecher - Stereo",
        "USB-Spannungsversorgung": "60 Watt",
        "VESA-Halterung": "100 x 100 mm",
        "Vertikale Bildwiederholrate": "56 - 61 Hz",
        "Vertikaler Betrachtungswinkel": "178",
        "Waren-Nr.": "3186741",
        "Zum Hersteller": "www.lge.com"
    },
    "raw_specifications_text": "Hersteller: LG\nWaren-Nr.: 3186741\nModell: 32UL950P-W\nEAN: 8806087975451\nZum Hersteller: www.lge.com\nProduktbeschreibung: LG UltraFine 32UL950P-W - LED-Monitor - 4K - 81 cm (32\") - HDR\nGer\u00e4tetyp: LED-hintergrundbeleuchteter LCD-Monitor - 81 cm (32\")\nEnergie Effizienzklasse: Klasse G\nAdaptive-Sync Technologie: AMD FreeSync\nDaisy-Chaining: Ja\nLeistungsmerkmale: Abnehmbarer St\u00e4nder\nBildschirmtyp: Nano IPS\nSeitenverh\u00e4ltnis: 16:9\nNative Aufl\u00f6sung: 4K 3840 x 2160 bei 60 Hz\nPixelpitch: 0.181 mm\nHelligkeit: 450 cd/m\u00b2\nKontrast: 1300:1\nHDR-f\u00e4hig: HDR10 / DisplayHDR 600\nReaktionszeit: 5 ms (Gray-to-Gray)\nFarbraum: 135% sRGB, 98% DCI-P3\nEingangsanschl\u00fcsse: 2xThunderbolt 3, HDMI, DisplayPort\nEinstellungen der Anzeigeposition: H\u00f6he, Pivot (Rotation), Neigung\nBildschirmbeschichtung: Blendfrei, 3H Hard Coating\nFarbe: Schwarz, wei\u00df (hinten)\nAbmessungen (Breite x Tiefe x H\u00f6he) - mit Fu\u00df: 71.82 cm x 23.12 cm x 48.8 cm\nGewicht: 7.3 kg\nKennzeichnung: Plug and Play, DDC/CI, HDCP 2.2\nDisplay-Typ: LED-hintergrundbeleuchteter LCD-Monitor / TFT-Aktivmatrix\nEnergieklasse (HDR): Klasse G\nDiagonalabmessung: 81 cm (32\")\nIntegrierte Peripherieger\u00e4te: USB 3.0-Hub\nUSB-Spannungsversorgung: 60 Watt\nHDR-Format: HDR10\nHDR-Zertifizierung: DisplayHDR 600\nVertikale Bildwiederholrate: 56 - 61 Hz\nHorizontale Bildwiederholrate: 30 - 135 kHz\nHorizontaler Betrachtungswinkel: 178\nVertikaler Betrachtungswinkel: 178\nHintergrundbeleuchtungs-Technologie: LED-Hintergrundbeleuchtung\nOSD-Sprachen: Multilingual\nBesonderheiten: Flicker Safe, Intelligente Energiespartechnologie, Black Stabilizer, DAS Mode (Dynamic Action Sync), 8-Bit-Gamma, Mega DFC, HW-Kalibrierung\nAbmessungen (Breite x Tiefe x H\u00f6he): 71.82 cm x 23.12 cm x 48.8 cm - mit Fu\u00df\nTyp: Lautsprecher - Stereo\nAusgangsleistung/Kanal: 5 Watt\nSchnittstellen: DisplayPort  2 x Thunderbolt 3  HDMI 2.0  2 x USB 3.0  Kopfh\u00f6rer\nNeigungswinkel: -5/+15\nH\u00f6heneinstellung: 110 mm\nVESA-Halterung: 100 x 100 mm\nEnthaltene Kabel: 1 x DisplayPort-Kabel  1 x HDMI-Kabel  1 x Kabel Thunderbolt 3\nStromverbrauch SDR (eingeschaltet): 33 kWh/1.000 h\nStromverbrauch HDR (eingeschaltet): 69 kWh/1.000 h\nStromverbrauch (typisch): 39 Watt\nStromverbrauch im Standby-Modus: 0.5 Watt\nStromverbrauch (Aus-Modus): 0.3 Watt\nMitgelieferte Software: LG On-Screen Control\nDetails zu Abmessungen & Gewicht: Mit Fu\u00df - Breite: 71.82 cm - Tiefe: 23.12 cm - H\u00f6he: 48.8 cm - Gewicht: 7.3 kg  Ohne Fu\u00df - Breite: 71.82 cm - Tiefe: 4.51 cm - H\u00f6he: 41.43 cm - Gewicht: 5.9 kg",
    "reference_file": "offer_reference_291.json",
    "shop_name": "Proshop.at"
}