{
    "html_file": "offer_1909_22.html",
    "name": "LG 34BN670-B, 34\"",
    "offer_link": "https://www.ditech.at/details.php?artnr=304308",
    "price": 412.9,
    "raw_specifications": {
        "AMD FreeSync": "Ja",
        "Abmessungen (BxHxT)": "816x617x253mm (mit Standfu\u00df),  816x365x45mm (ohne Standfu\u00df)",
        "Adaptive Sync": "Ja",
        "Anschl\u00fcsse - DisplayPort 1.4": "1",
        "Anschl\u00fcsse - HDMI 2.0": "2",
        "Anwendung": "station\u00e4r",
        "Audio": "Lautsprecher (2x 7W),  1x Line-Out",
        "Aufl\u00f6sung": "2560x1080",
        "Beschichtung": "matt (non-glare),  H\u00e4rtegrad 3H",
        "Besonderheiten": "Slim Bezel,  Steuerkreuz,  Sicherheitsschloss (Kensington),  TCO 9 zertifiziert",
        "Bildwiederholfrequenz": "75Hz",
        "Blickwinkel": "178\u00b0/178\u00b0",
        "Diagonale": "34\"/86.4cm",
        "Energieeffizienzklasse HDR (A bis G)": "G",
        "Energieeffizienzklasse alt (A+++ bis D)": "A",
        "Energieeffizienzklasse alt (A+++ bis G)": "A",
        "Energieverbrauch HDR": "36kWh/1000h",
        "Energieverbrauch SDR": "35kWh/1000h",
        "Ergonomie": "150mm (h\u00f6henverstellbar),  N/A (Pivot),  \u00b145\u00b0 (drehbar),  +35\u00b0/-5\u00b0 (neigbar),  keine Angabe (Schr\u00e4glage)",
        "FRC": "nein (8bit nativ)",
        "Farbe": "schwarz",
        "Farbraum - sRGB": "99%",
        "Farbtiefe": "8bit (16.7 Mio. Farben)",
        "Form": "gerade (flat)",
        "Gewicht": "9.40kg (mit Standfu\u00df),  6.00kg (ohne Standfu\u00df)",
        "HDR": "VESA DisplayHDR 400,  HDR10",
        "Helligkeit": "400cd/m\u00b2",
        "Herstellergarantie": "drei Jahre (Bring-In)",
        "Hintergrundbeleuchtung": "White-LED,  flicker-free,  Blaulichtfilter",
        "Jahresverbrauch alt (A+++ bis D)": "46.72kWh",
        "Jahresverbrauch alt (A+++ bis G)": "46.72kWh",
        "Kontrast - statisch": "1.000:1",
        "Lautsprecher": "Ja",
        "Leistungsaufnahme": "42W (maximal),  33W (typisch),  32W (Energielabel alt A+++ bis G),  0.5W (Standby)",
        "Panel": "IPS (AH-IPS)",
        "Panel-Hersteller": "LG Display",
        "Reaktionszeit - GtG": "5ms",
        "Screen-to-Body-Ratio": "89.5% (berechnet)",
        "Seitenverh\u00e4ltnis": "21:9",
        "Signalfrequenz": "keine Angabe (horizontal),  48-75Hz (vertikal)",
        "Stromversorgung": "DC-In (externes Netzteil)",
        "USB-Hub In": "N/A",
        "USB-Hub Out": "N/A",
        "USB-Schreibweise": "Link",
        "VESA": "100x100 (belegt)",
        "VRR (Variable Refresh Rate)": "Adaptive Sync,  AMD FreeSync",
        "Weitere Anschl\u00fcsse": "N/A"
    },
    "raw_specifications_text": "Abmessungen (BxHxT): 816x617x253mm (mit Standfu\u00df),  816x365x45mm (ohne Standfu\u00df)\nAdaptive Sync: Ja\nAMD FreeSync: Ja\nAnschl\u00fcsse - DisplayPort 1.4: 1\nAnschl\u00fcsse - HDMI 2.0: 2\nAnwendung: station\u00e4r\nAudio: Lautsprecher (2x 7W),  1x Line-Out\nAufl\u00f6sung: 2560x1080\nBeschichtung: matt (non-glare),  H\u00e4rtegrad 3H\nBesonderheiten: Slim Bezel,  Steuerkreuz,  Sicherheitsschloss (Kensington),  TCO 9 zertifiziert\nBildwiederholfrequenz: 75Hz\nBlickwinkel: 178\u00b0/178\u00b0\nDiagonale: 34\"/86.4cm\nEnergieeffizienzklasse alt (A+++ bis D): A\nEnergieeffizienzklasse alt (A+++ bis G): A\nEnergieeffizienzklasse HDR (A bis G): G\nEnergieverbrauch HDR: 36kWh/1000h\nEnergieverbrauch SDR: 35kWh/1000h\nErgonomie: 150mm (h\u00f6henverstellbar),  N/A (Pivot),  \u00b145\u00b0 (drehbar),  +35\u00b0/-5\u00b0 (neigbar),  keine Angabe (Schr\u00e4glage)\nFarbe: schwarz\nFarbraum - sRGB: 99%\nFarbtiefe: 8bit (16.7 Mio. Farben)\nForm: gerade (flat)\nFRC: nein (8bit nativ)\nGewicht: 9.40kg (mit Standfu\u00df),  6.00kg (ohne Standfu\u00df)\nHDR: VESA DisplayHDR 400,  HDR10\nHelligkeit: 400cd/m\u00b2\nHerstellergarantie: drei Jahre (Bring-In)\nHintergrundbeleuchtung: White-LED,  flicker-free,  Blaulichtfilter\nJahresverbrauch alt (A+++ bis D): 46.72kWh\nJahresverbrauch alt (A+++ bis G): 46.72kWh\nKontrast - statisch: 1.000:1\nLautsprecher: Ja\nLeistungsaufnahme: 42W (maximal),  33W (typisch),  32W (Energielabel alt A+++ bis G),  0.5W (Standby)\nPanel: IPS (AH-IPS)\nPanel-Hersteller: LG Display\nReaktionszeit - GtG: 5ms\nScreen-to-Body-Ratio: 89.5% (berechnet)\nSeitenverh\u00e4ltnis: 21:9\nSignalfrequenz: keine Angabe (horizontal),  48-75Hz (vertikal)\nStromversorgung: DC-In (externes Netzteil)\nUSB-Hub In: N/A\nUSB-Hub Out: N/A\nUSB-Schreibweise: Link\nVESA: 100x100 (belegt)\nVRR (Variable Refresh Rate): Adaptive Sync,  AMD FreeSync\nWeitere Anschl\u00fcsse: N/A",
    "reference_file": "offer_reference_1909.json",
    "shop_name": "DiTech.at"
}