{
    "html_file": "offer_1923_9.html",
    "name": "AOC 27P2C, 27\"",
    "offer_link": "https://www.amazon.de/dp/B086X4CX7Z?linkCode=xm2&camp=2025&creative=165953&smid=A3JWKAKR8XB7XF&creativeASIN=B086X4CX7Z&tag=geizhals1-21",
    "price": 181.19,
    "raw_specifications": {
        "ASIN": "B086X4CX7Z",
        "Amazon Bestseller-Rang": "Nr. 8,554 in Computer & Zubeh\u00f6r (Siehe Top 100 in Computer & Zubeh\u00f6r)  Nr. 194 in Monitore  Nr. 403 in Pr\u00e4sentationszubeh\u00f6r",
        "Anzahl HDMI Schnittstellen": "\u200e1",
        "Anzahl USB 3.0 Schnittstellen": "\u200e3",
        "Anzahl der Lithium-Ionen-Zellen": "\u200e7",
        "Anzahl der Lithium-Metall-Zellen": "\u200e7",
        "Artikelgewicht": "\u200e7 Kilograms",
        "Batterien": "\u200e1 A Batterien erforderlich.",
        "Batterien enthalten": "\u200eNein",
        "Bildschirmaufl\u00f6sung": "\u200e1920x1080",
        "Display-Gr\u00f6\u00dfe": "\u200e27 Zoll",
        "Durchschnittliche Kundenbewertung": "4,5  4,5 von 5 Sternen    \n    409 Sternebewertungen   \n\n\n 4,5 von 5 Sternen",
        "Farbe": "\u200eschwarz",
        "Garantierte Software-Updates bis": "\u200eunbekannt",
        "Gewicht Lithium-Akku": "\u200e1 Gramm",
        "Hersteller": "\u200eAOC International",
        "Im Angebot von Amazon.de seit": "7. Juni 2020",
        "Kapazit\u00e4t Lithium-Akku": "\u200e2,6 Britische W\u00e4rmeeinheiten (BTU)",
        "L\u00f6sung": "\u200e1920 x 1080 Pixels",
        "Marke": "\u200eAOC",
        "Modell/Serie": "\u200eAOC 27P2C - 27 Inch Widescreen FHD Monitor, USB-C Dock, Ergonomic Stand, USB Hub, Speakers, KVM (1920x1080 @ 75Hz, 4ms, IPS, 250cd/m\u00b2, HDMI//DP/USB-C/ USB 3.2)",
        "Modellnummer": "\u200e27P2C",
        "Produktabmessungen": "\u200e19,95 x 61,49 x 53,5 cm; 7 Kilogramm",
        "Prozessortyp": "\u200eOthers",
        "Volt": "\u200e220"
    },
    "raw_specifications_text": "Marke: \u200eAOC\nHersteller: \u200eAOC International\nModell/Serie: \u200eAOC 27P2C - 27 Inch Widescreen FHD Monitor, USB-C Dock, Ergonomic Stand, USB Hub, Speakers, KVM (1920x1080 @ 75Hz, 4ms, IPS, 250cd/m\u00b2, HDMI//DP/USB-C/ USB 3.2)\nProduktabmessungen: \u200e19,95 x 61,49 x 53,5 cm; 7 Kilogramm\nBatterien: \u200e1 A Batterien erforderlich.\nModellnummer: \u200e27P2C\nFarbe: \u200eschwarz\nDisplay-Gr\u00f6\u00dfe: \u200e27 Zoll\nBildschirmaufl\u00f6sung: \u200e1920x1080\nL\u00f6sung: \u200e1920 x 1080 Pixels\nProzessortyp: \u200eOthers\nAnzahl USB 3.0 Schnittstellen: \u200e3\nAnzahl HDMI Schnittstellen: \u200e1\nVolt: \u200e220\nBatterien enthalten: \u200eNein\nKapazit\u00e4t Lithium-Akku: \u200e2,6 Britische W\u00e4rmeeinheiten (BTU)\nGewicht Lithium-Akku: \u200e1 Gramm\nAnzahl der Lithium-Ionen-Zellen: \u200e7\nAnzahl der Lithium-Metall-Zellen: \u200e7\nArtikelgewicht: \u200e7 Kilograms\nGarantierte Software-Updates bis: \u200eunbekannt\nASIN: B086X4CX7Z\nDurchschnittliche Kundenbewertung: 4,5  4,5 von 5 Sternen    \n    409 Sternebewertungen   \n\n\n 4,5 von 5 Sternen\nAmazon Bestseller-Rang: Nr. 8,554 in Computer & Zubeh\u00f6r (Siehe Top 100 in Computer & Zubeh\u00f6r)  Nr. 194 in Monitore  Nr. 403 in Pr\u00e4sentationszubeh\u00f6r\nIm Angebot von Amazon.de seit: 7. Juni 2020",
    "reference_file": "offer_reference_1923.json",
    "shop_name": "Amazon.at"
}