{
    "html_file": "offer_2088_21.html",
    "name": "Philips B-line 345B1C, 34\"",
    "offer_link": "https://www.cyberport.at/?DEEP=6108-1FV&APID=294&STOREID=7",
    "price": 441.9,
    "raw_specifications": {
        "Aufl\u00f6sung": "3.440x1.440 Ultra Wide QHD",
        "Betrachtungswinkel h/v": "178\u00b0/178\u00b0",
        "Bildformat": "21:9",
        "Breite in mm": "810mm",
        "DVI": "kein",
        "Displaygr\u00f6\u00dfe in Zoll": "34 Zoll",
        "Displaygr\u00f6\u00dfe in cm": "86,36 cm",
        "Displayport": "1x DP",
        "Farbraumabdeckung": "100%+ Adobe RGB",
        "Farbtiefe": "8 Bit / 16,7 Mio Farben",
        "Gewicht in kg": "11,3 kg",
        "HDMI": "2x HDMI",
        "Helligkeit": "300 cd/m\u00b2",
        "H\u00f6he in mm": "600mm",
        "H\u00f6henverstellbar": "180mm",
        "Jahresverbrauch": "79 kWh",
        "Kontrast dynamisch": "80.000.000:1",
        "Kontrast typisch": "3.000:1",
        "Lautsprecher": "2x",
        "Leistung": "5W",
        "Leistungsaufnahme": "54 Watt",
        "Oberfl\u00e4che": "matt",
        "Reaktionszeit": "5 ms",
        "Technologie": "VA/PVA/MVA/AMVA",
        "Tiefe in mm": "250mm",
        "USB-C": "kein",
        "Wandmontage": "VESA100x100"
    },
    "raw_specifications_text": "Jahresverbrauch: 79 kWh\nLeistungsaufnahme: 54 Watt\nDisplaygr\u00f6\u00dfe in cm: 86,36 cm\nDisplaygr\u00f6\u00dfe in Zoll: 34 Zoll\nTechnologie: VA/PVA/MVA/AMVA\nAufl\u00f6sung: 3.440x1.440 Ultra Wide QHD\nBildformat: 21:9\nOberfl\u00e4che: matt\nFarbraumabdeckung: 100%+ Adobe RGB\nFarbtiefe: 8 Bit / 16,7 Mio Farben\nHelligkeit: 300 cd/m\u00b2\nKontrast typisch: 3.000:1\nKontrast dynamisch: 80.000.000:1\nReaktionszeit: 5 ms\nBetrachtungswinkel h/v: 178\u00b0/178\u00b0\nHDMI: 2x HDMI\nDVI: kein\nDisplayport: 1x DP\nUSB-C: kein\nLautsprecher: 2x\nLeistung: 5W\nH\u00f6henverstellbar: 180mm\nWandmontage: VESA100x100\nBreite in mm: 810mm\nH\u00f6he in mm: 600mm\nTiefe in mm: 250mm\nGewicht in kg: 11,3 kg",
    "reference_file": "offer_reference_2088.json",
    "shop_name": "Cyberport Stores \u00d6sterreich"
}