{
    "html_file": "offer_1903_0.html",
    "name": "ASUS BE24EQK, 23.8\"",
    "offer_link": "https://www.csv-direct.de/artinfo.php?artnr=A1621248&KATEGORIE=162&pva=geizhals2",
    "price": 182.61,
    "raw_specifications": {
        "AC Eingangsfrequenz": "50 - 60 Hz",
        "AC Eingangsspannung": "100 - 240 V",
        "AMD FreeSync": "Nein",
        "Anzahl DisplayPort Anschl\u00fcsse": "1",
        "Anzahl HDMI-Anschl\u00fcsse": "1",
        "Anzahl OSD-Sprachen": "21",
        "Anzahl VGA D-Sub Anschl\u00fcsse": "1",
        "Anzahl der Farben des Displays": "16,78 Millionen Farben",
        "Anzahl der Lautsprecher": "2",
        "Anzahl der vorgeschalteten Steckpl\u00e4tze": "1",
        "Betriebstemperatur": "0 - 40 \u00b0C",
        "Bildschirmdiagonale": "60,5 cm 23.8\"",
        "Bildschirmform": "Flach",
        "Bildschirmtechnologie": "LED",
        "Bildwinkel, horizontal": "178\u00b0",
        "Bildwinkel, vertikal": "178\u00b0",
        "Breite ohne Standfu\u00df": "540 mm",
        "DVI Anschluss": "Nein",
        "Digital horizontale Frequenz": "30 - 83 kHz",
        "Digital vertikale Frequenz": "50 - 76 Hz",
        "Display-Aufl\u00f6sung": "1920 x 1080 Pixel",
        "Display-Oberfl\u00e4che": "Matt",
        "DisplayPorts-Version": "1.2",
        "Dynamisches Kontrastverh\u00e4ltnis Marketingbezeichnung": "SmartContrast",
        "Energieeffizienzklasse SDR": "F",
        "Energieeffizienzskala": "A bis G",
        "Energieverbrauch SDR pro 1.000 Stunden": "22 kWh",
        "Fu\u00dffarbe": "Schwarz",
        "Ger\u00e4tebreite inkl. Fu\u00df": "540 mm",
        "Ger\u00e4teh\u00f6he inkl. Fu\u00df": "426 mm",
        "Ger\u00e4tetiefe inkl. Fu\u00df": "195 mm",
        "Gewicht mit St\u00e4nder": "4,6 kg",
        "Gewicht ohne St\u00e4nder": "3,9 kg",
        "HD-Typ": "Full HD",
        "HDMI-Version": "1.4",
        "Helligkeit typisch": "300 cd/m\u00b2",
        "H\u00f6he ohne Standfu\u00df": "355 mm",
        "H\u00f6henverstellung": "Nein",
        "Kontrastverh\u00e4ltnis": "1000:1",
        "Kontrastverh\u00e4ltnis dynamisch": "100000000:1",
        "Kopfh\u00f6rer-Anschluss": "3,5 mm",
        "Kopfh\u00f6rerausg\u00e4nge": "1",
        "Marktpositionierung": "Business",
        "Maximale Bildwiederholrate": "75 Hz",
        "Megapixel ca.": "2 MP",
        "Men\u00fcsprachen": "Vereinfachtes Chinesisch, Traditionelles Chinesisch, Kroatisch, Tschechisch, Deutsch, Niederl\u00e4ndisch, Englisch, Spanisch, Franz\u00f6sisch, Ungarisch, Indonesisch, Italienisch, Japanisch, Koreanisch, Polnisch, Portugiesisch, Rum\u00e4nisch, Russisch, Thail\u00e4ndisch, T\u00fcrkisch",
        "Mitgelieferte Kabel": "AC, USB",
        "NTSC Abdeckung typisch": "72",
        "NVIDIA G-SYNC": "Nein",
        "Nachhaltigkeitszertifikate": "RoHS, ENERGY STAR",
        "Natives Seitenverh\u00e4ltnis": "16:9",
        "Neigungswinkelbereich": "-5 - 20\u00b0",
        "Paketgewicht": "6,4 kg",
        "Panel-Montage-Schnittstelle": "100 x 100 mm",
        "Panel-Typ": "IPS",
        "Pixel Abstand": "0,2745 x 0,2745 mm",
        "Produktfarbe": "Schwarz",
        "RMS-Leistung": "4 W",
        "Reaktionszeit": "5 ms",
        "Sichtbare Gr\u00f6\u00dfe diagonal": "60,5 cm",
        "Sichtbare Gr\u00f6\u00dfe horizontal": "52,7 cm",
        "Sichtbare Gr\u00f6\u00dfe vertikal": "29,6 cm",
        "Slot-Typ Kabelsperre": "Kensington",
        "Stromverbrauch Standardbetrieb": "21,7 W",
        "Stromverbrauch Standby": "0,5 W",
        "Stromverbrauch aus": "0,3 W",
        "Temperaturbereich bei Lagerung": "-20 - 60 \u00b0C",
        "Tiefe ohne Standfu\u00df": "53 mm",
        "Touchscreen": "Nein",
        "Unterst\u00fctzte Grafik-Aufl\u00f6sungen": "720 x 480, 720 x 576, 1280 x 1024 SXGA, 1280 x 720 HD 720, 1280 x 768 WXGA, 1280 x 800 WXGA, 1280 x 960, 1360 x 768 WXGA, 1366  768, 1440 x 900 WXGA+, 1680 x 1050 WSXGA+, 1920 x 1080 HD 1080",
        "Unterst\u00fctzte Video-Modi": "480p, 576p, 720p, 1080p",
        "Verpackungsbreite": "610 mm",
        "Verpackungsh\u00f6he": "494 mm",
        "Verpackungstiefe": "168 mm",
        "Warentarifnummer HS": "85285210",
        "Zertifizierung": "Energy Star, BSMI, CB, CCC, CE, CEL level , C-Tick, CU, ErP, FCC, ISO-9241-307, J-MOSS, KCC, PSE, RoHS, TCO8.0, UL/cUL, VCCI, WEEE, WHQL Windows 10, Windows 8.1, Windows 7, MEPS, TUV Flicker-free , KC , eStandby, TUV Low Blue Light, ICES-3, EU"
    },
    "raw_specifications_text": "Bildschirmdiagonale: 60,5 cm 23.8\"\nDisplay-Aufl\u00f6sung: 1920 x 1080 Pixel\nNatives Seitenverh\u00e4ltnis: 16:9\nBildschirmtechnologie: LED\nTouchscreen: Nein\nHD-Typ: Full HD\nPanel-Typ: IPS\nBildschirmform: Flach\nKontrastverh\u00e4ltnis: 1000:1\nMaximale Bildwiederholrate: 75 Hz\nAnzahl der Farben des Displays: 16,78 Millionen Farben\nHelligkeit typisch: 300 cd/m\u00b2\nReaktionszeit: 5 ms\nDisplay-Oberfl\u00e4che: Matt\nUnterst\u00fctzte Grafik-Aufl\u00f6sungen: 720 x 480, 720 x 576, 1280 x 1024 SXGA, 1280 x 720 HD 720, 1280 x 768 WXGA, 1280 x 800 WXGA, 1280 x 960, 1360 x 768 WXGA, 1366  768, 1440 x 900 WXGA+, 1680 x 1050 WSXGA+, 1920 x 1080 HD 1080\nUnterst\u00fctzte Video-Modi: 480p, 576p, 720p, 1080p\nKontrastverh\u00e4ltnis dynamisch: 100000000:1\nDynamisches Kontrastverh\u00e4ltnis Marketingbezeichnung: SmartContrast\nBildwinkel, horizontal: 178\u00b0\nBildwinkel, vertikal: 178\u00b0\nPixel Abstand: 0,2745 x 0,2745 mm\nSichtbare Gr\u00f6\u00dfe horizontal: 52,7 cm\nSichtbare Gr\u00f6\u00dfe vertikal: 29,6 cm\nSichtbare Gr\u00f6\u00dfe diagonal: 60,5 cm\nDigital horizontale Frequenz: 30 - 83 kHz\nDigital vertikale Frequenz: 50 - 76 Hz\nNTSC Abdeckung typisch: 72\nNVIDIA G-SYNC: Nein\nAMD FreeSync: Nein\nAnzahl der Lautsprecher: 2\nRMS-Leistung: 4 W\nMegapixel ca.: 2 MP\nMarktpositionierung: Business\nProduktfarbe: Schwarz\nFu\u00dffarbe: Schwarz\nZertifizierung: Energy Star, BSMI, CB, CCC, CE, CEL level , C-Tick, CU, ErP, FCC, ISO-9241-307, J-MOSS, KCC, PSE, RoHS, TCO8.0, UL/cUL, VCCI, WEEE, WHQL Windows 10, Windows 8.1, Windows 7, MEPS, TUV Flicker-free , KC , eStandby, TUV Low Blue Light, ICES-3, EU\nAnzahl der vorgeschalteten Steckpl\u00e4tze: 1\nAnzahl VGA D-Sub Anschl\u00fcsse: 1\nDVI Anschluss: Nein\nAnzahl HDMI-Anschl\u00fcsse: 1\nHDMI-Version: 1.4\nAnzahl DisplayPort Anschl\u00fcsse: 1\nDisplayPorts-Version: 1.2\nKopfh\u00f6rerausg\u00e4nge: 1\nKopfh\u00f6rer-Anschluss: 3,5 mm\nH\u00f6henverstellung: Nein\nPanel-Montage-Schnittstelle: 100 x 100 mm\nSlot-Typ Kabelsperre: Kensington\nNeigungswinkelbereich: -5 - 20\u00b0\nMen\u00fcsprachen: Vereinfachtes Chinesisch, Traditionelles Chinesisch, Kroatisch, Tschechisch, Deutsch, Niederl\u00e4ndisch, Englisch, Spanisch, Franz\u00f6sisch, Ungarisch, Indonesisch, Italienisch, Japanisch, Koreanisch, Polnisch, Portugiesisch, Rum\u00e4nisch, Russisch, Thail\u00e4ndisch, T\u00fcrkisch\nAnzahl OSD-Sprachen: 21\nEnergieeffizienzklasse SDR: F\nEnergieverbrauch SDR pro 1.000 Stunden: 22 kWh\nStromverbrauch Standardbetrieb: 21,7 W\nStromverbrauch Standby: 0,5 W\nStromverbrauch aus: 0,3 W\nAC Eingangsspannung: 100 - 240 V\nAC Eingangsfrequenz: 50 - 60 Hz\nEnergieeffizienzskala: A bis G\nBetriebstemperatur: 0 - 40 \u00b0C\nTemperaturbereich bei Lagerung: -20 - 60 \u00b0C\nMitgelieferte Kabel: AC, USB\nGer\u00e4tebreite inkl. Fu\u00df: 540 mm\nGer\u00e4tetiefe inkl. Fu\u00df: 195 mm\nGer\u00e4teh\u00f6he inkl. Fu\u00df: 426 mm\nGewicht mit St\u00e4nder: 4,6 kg\nBreite ohne Standfu\u00df: 540 mm\nTiefe ohne Standfu\u00df: 53 mm\nH\u00f6he ohne Standfu\u00df: 355 mm\nGewicht ohne St\u00e4nder: 3,9 kg\nVerpackungsbreite: 610 mm\nVerpackungstiefe: 168 mm\nVerpackungsh\u00f6he: 494 mm\nPaketgewicht: 6,4 kg\nNachhaltigkeitszertifikate: RoHS, ENERGY STAR\nWarentarifnummer HS: 85285210",
    "reference_file": "offer_reference_1903.json",
    "shop_name": "CSV-Direct.de"
}