{
    "html_file": "offer_460_9.html",
    "name": "Samsung CJ791 (2023), 34\"",
    "offer_link": "https://www.e-tec.at/details.php?artnr=366651",
    "price": 539.0,
    "raw_specifications": {
        "AMD FreeSync": "Ja",
        "Adaptive Sync": "Ja",
        "Anschl\u00fcsse - DisplayPort 1.2": "1",
        "Anschl\u00fcsse - HDMI 2.0": "1",
        "Anschl\u00fcsse - Thunderbolt 3 shared": "2",
        "Anwendung": "station\u00e4r",
        "Audio": "Lautsprecher (2x 7W),  1x Line-Out",
        "Aufl\u00f6sung": "3440x1440",
        "Beschichtung": "matt (non-glare)",
        "Besonderheiten": "Slim Bezel,  USB-C Power Delivery (85W),  Steuerkreuz,  Picture-in-Picture,  Sicherheitsschloss (Kensington)",
        "Bildwiederholfrequenz": "100Hz",
        "Blickwinkel": "178\u00b0/178\u00b0",
        "Diagonale": "34\"/86.4cm",
        "Energieverbrauch SDR": "32kWh/1000h",
        "Ergonomie": "100mm (h\u00f6henverstellbar),  N/A (Pivot),  N/A (drehbar),  +14\u00b0/-2\u00b0 (neigbar),  keine Angabe (Schr\u00e4glage)",
        "FRC": "unbekannt",
        "Farbe": "schwarz",
        "Farbraum - Adobe RGB": "92%",
        "Farbraum - sRGB": "125%",
        "Farbtiefe": "8bit (16.7 Mio. Farben)",
        "Form": "gebogen (curved),  1500R/1.5m",
        "Gewicht": "7.70kg (mit Standfu\u00df),  6.30kg (ohne Standfu\u00df)",
        "HDR": "N/A",
        "Helligkeit": "300cd/m\u00b2",
        "Herstellergarantie": "zwei Jahre",
        "Hintergrundbeleuchtung": "Blue-LED,  flicker-free,  Blaulichtfilter",
        "Kontrast - statisch": "3.000:1",
        "Lautsprecher": "Ja",
        "Leistungsaufnahme": "keine Angabe (maximal),  32W (typisch),  keine Angabe (Energielabel alt A+++ bis G),  0.3W (Standby)",
        "Panel": "VA (SVA),  Quantum-Dot (QLED)",
        "Panel-Hersteller": "Samsung",
        "Reaktionszeit - GtG": "4ms",
        "Screen-to-Body-Ratio": "90.5% (berechnet)",
        "Seitenverh\u00e4ltnis": "21:9",
        "Signalfrequenz": "keine Angabe (horizontal),  keine Angabe (vertikal)",
        "Stromversorgung": "DC-In (externes Netzteil)",
        "USB-Hub In": "1x Thunderbolt 3 (shared)",
        "USB-Hub Out": "2x USB-A 3.0",
        "USB-Schreibweise": "Link",
        "VESA": "100x100 (via Adapter,  inkludiert)",
        "Weitere Anschl\u00fcsse": "N/A"
    },
    "raw_specifications_text": "Adaptive Sync: Ja\nAMD FreeSync: Ja\nAnschl\u00fcsse - DisplayPort 1.2: 1\nAnschl\u00fcsse - HDMI 2.0: 1\nAnschl\u00fcsse - Thunderbolt 3 shared: 2\nAnwendung: station\u00e4r\nAudio: Lautsprecher (2x 7W),  1x Line-Out\nAufl\u00f6sung: 3440x1440\nBeschichtung: matt (non-glare)\nBesonderheiten: Slim Bezel,  USB-C Power Delivery (85W),  Steuerkreuz,  Picture-in-Picture,  Sicherheitsschloss (Kensington)\nBildwiederholfrequenz: 100Hz\nBlickwinkel: 178\u00b0/178\u00b0\nDiagonale: 34\"/86.4cm\nEnergieverbrauch SDR: 32kWh/1000h\nErgonomie: 100mm (h\u00f6henverstellbar),  N/A (Pivot),  N/A (drehbar),  +14\u00b0/-2\u00b0 (neigbar),  keine Angabe (Schr\u00e4glage)\nFarbe: schwarz\nFarbraum - Adobe RGB: 92%\nFarbraum - sRGB: 125%\nFarbtiefe: 8bit (16.7 Mio. Farben)\nForm: gebogen (curved),  1500R/1.5m\nFRC: unbekannt\nGewicht: 7.70kg (mit Standfu\u00df),  6.30kg (ohne Standfu\u00df)\nHDR: N/A\nHelligkeit: 300cd/m\u00b2\nHerstellergarantie: zwei Jahre\nHintergrundbeleuchtung: Blue-LED,  flicker-free,  Blaulichtfilter\nKontrast - statisch: 3.000:1\nLautsprecher: Ja\nLeistungsaufnahme: keine Angabe (maximal),  32W (typisch),  keine Angabe (Energielabel alt A+++ bis G),  0.3W (Standby)\nPanel: VA (SVA),  Quantum-Dot (QLED)\nPanel-Hersteller: Samsung\nReaktionszeit - GtG: 4ms\nScreen-to-Body-Ratio: 90.5% (berechnet)\nSeitenverh\u00e4ltnis: 21:9\nSignalfrequenz: keine Angabe (horizontal),  keine Angabe (vertikal)\nStromversorgung: DC-In (externes Netzteil)\nUSB-Hub In: 1x Thunderbolt 3 (shared)\nUSB-Hub Out: 2x USB-A 3.0\nUSB-Schreibweise: Link\nVESA: 100x100 (via Adapter,  inkludiert)\nWeitere Anschl\u00fcsse: N/A",
    "reference_file": "offer_reference_460.json",
    "shop_name": "e-tec.at"
}