{
    "html_file": "offer_1477_4.html",
    "name": "AOC 24B2XHM2, 23.8\"",
    "offer_link": "https://www.mylemon.at/artikel/aoc/24b2xhm2/39-6cm-15-6-24b2xhm2.html",
    "price": 89.13,
    "raw_specifications": {
        "AC Eingangsfrequenz": "50 - 60 Hz",
        "AC Eingangsspannung": "100 - 240 V",
        "AMD FreeSync": "Nein",
        "Abnehmbarer Standfu\u00df": "Nein",
        "Adobe RGB-Abdeckung": "77%",
        "Anzahl HDMI-Anschl\u00fcsse": "1",
        "Anzahl OSD-Sprachen": "16",
        "Anzahl VGA (D-Sub) Anschl\u00fcsse": "1",
        "Anzahl der Farben des Displays": "16,7 Millionen Farben",
        "Artikelnummer": "M15Y21VL",
        "Audioanschl\u00fcsse": "Nein",
        "Aufl\u00f6sung": "1920x1080",
        "Au\u00dfenverkleidungstyp": "Texturiert",
        "Besonderheiten": "75 Hz",
        "Bildschirmdiagonale": "60,5 cm (23.8 Zoll)",
        "Bildschirmdiagonale (cm)": "60,452 cm",
        "Bildschirmform": "Flach",
        "Bildschirmtechnologie": "LCD",
        "Bildwinkel, horizontal": "178\u00b0",
        "Bildwinkel, vertikal": "178\u00b0",
        "Blendfreier Bildschirm": "Ja",
        "Breite (ohne Standfu\u00df)": "53,9 cm",
        "DVI Anschluss": "Nein",
        "Digital horizontale Frequenz": "32 - 83 kHz",
        "Display-Aufl\u00f6sung": "1920 x 1080 Pixel",
        "Display-Oberfl\u00e4che": "Matt",
        "Displaygr\u00f6\u00dfe": "23,8 Zoll",
        "EAN": "4038986149594",
        "Eingebaute Lautsprecher": "Nein",
        "Eingebautes Mikrofon": "Nein",
        "Energieeffizienzklasse (SDR)": "E",
        "Energieeffizienzskala": "A bis G",
        "Energieverbrauch (SDR) pro 1.000 Stunden": "18 kWh",
        "Externes Netzteil": "Ja",
        "Farbtiefe": "8 Bit",
        "Flimmerfreie Technologie": "Ja",
        "Fu\u00dffarbe": "Schwarz",
        "Ger\u00e4tebreite (inkl. Fu\u00df)": "539,5 mm",
        "Ger\u00e4teh\u00f6he (inkl. Fu\u00df)": "418,4 mm",
        "Ger\u00e4tetiefe (inkl. Fu\u00df)": "170,9 mm",
        "Gewicht (mit St\u00e4nder)": "2,7 kg",
        "HD-Typ": "Full HD",
        "HDMI": "Ja",
        "HDMI-Kabell\u00e4nge": "1,8 m",
        "HDMI-Version": "1.4",
        "Helligkeit": "250 cd/m\u00b2",
        "Helligkeit (typisch)": "250 cd/m\u00b2",
        "Hersteller Artikelnummer": "24B2XHM2",
        "Horizontaler Scanbereich": "30 - 83 kHz",
        "H\u00f6he (ohne Standfu\u00df)": "32,1 cm",
        "H\u00f6henverstellung": "Nein",
        "Integrierte Kamera": "Nein",
        "Integrierter USB-Hub": "Nein",
        "Kabelsperre-Slot": "Ja",
        "Kontrastverh\u00e4ltnis": "3000:1",
        "Kontrastverh\u00e4ltnis (dynamisch)": "20000000:1",
        "Kopfh\u00f6rer-Anschluss": "3,5 mm",
        "Kopfh\u00f6rerausgang": "Ja",
        "Kopfh\u00f6rerausg\u00e4nge": "1",
        "Lichteffekte": "Nein",
        "Low-Blue-Light-Technologie": "Ja",
        "Marktpositionierung": "Haus",
        "Maximale Bildwiederholrate": "75 Hz",
        "Men\u00fcsprachen": "Vereinfachtes Chinesisch, Traditionelles Chinesisch, Kroatisch, Tschechisch, Deutsch, Niederl\u00e4ndisch, Englisch, Spanisch, Finnisch, Franz\u00f6sisch, Italienisch, Japanisch, Koreanisch, Polnisch, Portugiesisch, Russisch, Schwedisch, T\u00fcrkisch, Ukrainisch",
        "Mitgelieferte Kabel": "AC",
        "Mittlere Betriebsdauer zwischen Ausf\u00e4llen (MTBF)": "50000 h",
        "NVIDIA G-SYNC": "Nein",
        "Nachhaltigkeitszertifikate": "REACH, RoHS, Nein, ENERGY STAR",
        "Natives Seitenverh\u00e4ltnis": "16:9",
        "Neigungsverstellung": "Ja",
        "Neigungswinkelbereich": "-5 - 21,5\u00b0",
        "Oberfl\u00e4chenh\u00e4rte": "3H",
        "On-Screen-Display (OSD)": "Ja",
        "Paketgewicht": "4,5 kg",
        "Panel": "VA",
        "Panel-Montage-Schnittstelle": "100 x 100 mm",
        "Panel-Typ": "VA",
        "Pivot": "Ja",
        "Pixel Abstand": "0,2745 x 0,2745 mm",
        "Produktfarbe": "Schwarz",
        "Rahmenloses Design": "Ja",
        "Reaktionszeit": "4 ms",
        "Recycelbares Verpackungsmaterial": "100%",
        "Schnellladung": "Nein",
        "Schwermetallfrei": "Hg (Quecksilber)",
        "Seitenverh\u00e4ltnis": "4:3, 16:9",
        "Sichtbare Gr\u00f6\u00dfe (horizontal)": "52,7 cm",
        "Sichtbare Gr\u00f6\u00dfe (vertikal)": "29,6 cm",
        "Slot-Typ Kabelsperre": "Kensington",
        "Stromkabell\u00e4nge": "1,8 m",
        "Stromverbrauch (Standardbetrieb)": "20 W",
        "Stromverbrauch (Standby)": "0,3 W",
        "Stromverbrauch (aus)": "0,3 W",
        "St\u00e4nder enthalten": "Ja",
        "Tiefe (ohne Standfu\u00df)": "3,76 cm",
        "Touchscreen": "Nein",
        "Typ der Hintergrundbeleuchtung": "W-LED",
        "Unterst\u00fctzte Video-Modi": "720p, 1080p",
        "VESA-Halterung": "Ja",
        "Verpackungsart": "Box",
        "Verpackungsbreite": "614 mm",
        "Verpackungsh\u00f6he": "492 mm",
        "Verpackungstiefe": "131 mm",
        "Vertikaler Scanbereich": "50 - 76 Hz",
        "Video Anschl\u00fcsse": "1x VGA, 1x HDMI",
        "Vorderer Rahmen": "Schwarz",
        "Warentarifnummer (HS)": "85285210",
        "Zertifizierung": "True",
        "sRGB Abdeckung (klassisch)": "101%"
    },
    "raw_specifications_text": "Displaygr\u00f6\u00dfe: 23,8 Zoll\nAufl\u00f6sung: 1920x1080\nPanel: VA\nVideo Anschl\u00fcsse: 1x VGA, 1x HDMI\nHelligkeit: 250 cd/m\u00b2\nBesonderheiten: 75 Hz\nHersteller Artikelnummer: 24B2XHM2\nEAN: 4038986149594\nArtikelnummer: M15Y21VL\nBildschirmdiagonale: 60,5 cm (23.8 Zoll)\nDisplay-Aufl\u00f6sung: 1920 x 1080 Pixel\nNatives Seitenverh\u00e4ltnis: 16:9\nBildschirmtechnologie: LCD\nTouchscreen: Nein\nHD-Typ: Full HD\nPanel-Typ: VA\nBildschirmform: Flach\nKontrastverh\u00e4ltnis: 3000:1\nMaximale Bildwiederholrate: 75 Hz\nAnzahl der Farben des Displays: 16,7 Millionen Farben\nTyp der Hintergrundbeleuchtung: W-LED\nHelligkeit (typisch): 250 cd/m\u00b2\nReaktionszeit: 4 ms\nDisplay-Oberfl\u00e4che: Matt\nBlendfreier Bildschirm: Ja\nUnterst\u00fctzte Video-Modi: 720p, 1080p\nSeitenverh\u00e4ltnis: 4:3, 16:9\nKontrastverh\u00e4ltnis (dynamisch): 20000000:1\nBildwinkel, horizontal: 178\u00b0\nBildwinkel, vertikal: 178\u00b0\nPixel Abstand: 0,2745 x 0,2745 mm\nHorizontaler Scanbereich: 30 - 83 kHz\nVertikaler Scanbereich: 50 - 76 Hz\nSichtbare Gr\u00f6\u00dfe (horizontal): 52,7 cm\nSichtbare Gr\u00f6\u00dfe (vertikal): 29,6 cm\nDigital horizontale Frequenz: 32 - 83 kHz\nBildschirmdiagonale (cm): 60,452 cm\nOberfl\u00e4chenh\u00e4rte: 3H\nFarbtiefe: 8 Bit\nsRGB Abdeckung (klassisch): 101%\nAdobe RGB-Abdeckung: 77%\nNVIDIA G-SYNC: Nein\nAMD FreeSync: Nein\nSchnellladung: Nein\nFlimmerfreie Technologie: Ja\nLow-Blue-Light-Technologie: Ja\nEingebaute Lautsprecher: Nein\nIntegrierte Kamera: Nein\nEingebautes Mikrofon: Nein\nMarktpositionierung: Haus\nProduktfarbe: Schwarz\nRahmenloses Design: Ja\nVorderer Rahmen: Schwarz\nAbnehmbarer Standfu\u00df: Nein\nFu\u00dffarbe: Schwarz\nSchwermetallfrei: Hg (Quecksilber)\nZertifizierung: True\nIntegrierter USB-Hub: Nein\nHDMI: Ja\nKopfh\u00f6rerausgang: Ja\nAnzahl VGA (D-Sub) Anschl\u00fcsse: 1\nDVI Anschluss: Nein\nAnzahl HDMI-Anschl\u00fcsse: 1\nHDMI-Version: 1.4\nAudioanschl\u00fcsse: Nein\nKopfh\u00f6rerausg\u00e4nge: 1\nKopfh\u00f6rer-Anschluss: 3,5 mm\nVESA-Halterung: Ja\nKabelsperre-Slot: Ja\nH\u00f6henverstellung: Nein\nPanel-Montage-Schnittstelle: 100 x 100 mm\nSlot-Typ Kabelsperre: Kensington\nPivot: Ja\nNeigungswinkelbereich: -5 - 21,5\u00b0\nOn-Screen-Display (OSD): Ja\nMen\u00fcsprachen: Vereinfachtes Chinesisch, Traditionelles Chinesisch, Kroatisch, Tschechisch, Deutsch, Niederl\u00e4ndisch, Englisch, Spanisch, Finnisch, Franz\u00f6sisch, Italienisch, Japanisch, Koreanisch, Polnisch, Portugiesisch, Russisch, Schwedisch, T\u00fcrkisch, Ukrainisch\nAnzahl OSD-Sprachen: 16\nNeigungsverstellung: Ja\nEnergieeffizienzklasse (SDR): E\nEnergieverbrauch (SDR) pro 1.000 Stunden: 18 kWh\nStromverbrauch (Standardbetrieb): 20 W\nStromverbrauch (Standby): 0,3 W\nStromverbrauch (aus): 0,3 W\nAC Eingangsspannung: 100 - 240 V\nAC Eingangsfrequenz: 50 - 60 Hz\nEnergieeffizienzskala: A bis G\nExternes Netzteil: Ja\nSt\u00e4nder enthalten: Ja\nMitgelieferte Kabel: AC\nHDMI-Kabell\u00e4nge: 1,8 m\nStromkabell\u00e4nge: 1,8 m\nGer\u00e4tebreite (inkl. Fu\u00df): 539,5 mm\nGer\u00e4tetiefe (inkl. Fu\u00df): 170,9 mm\nGer\u00e4teh\u00f6he (inkl. Fu\u00df): 418,4 mm\nGewicht (mit St\u00e4nder): 2,7 kg\nBreite (ohne Standfu\u00df): 53,9 cm\nTiefe (ohne Standfu\u00df): 3,76 cm\nH\u00f6he (ohne Standfu\u00df): 32,1 cm\nVerpackungsbreite: 614 mm\nVerpackungstiefe: 131 mm\nVerpackungsh\u00f6he: 492 mm\nPaketgewicht: 4,5 kg\nVerpackungsart: Box\nNachhaltigkeitszertifikate: REACH, RoHS, Nein, ENERGY STAR\nWarentarifnummer (HS): 85285210\nAu\u00dfenverkleidungstyp: Texturiert\nRecycelbares Verpackungsmaterial: 100%\nMittlere Betriebsdauer zwischen Ausf\u00e4llen (MTBF): 50000 h\nLichteffekte: Nein",
    "reference_file": "offer_reference_1477.json",
    "shop_name": "mylemon.at"
}