{
    "html_file": "offer_1296_10.html",
    "name": "Xiaomi Mi Desktop Monitor 27, 27\"",
    "offer_link": "https://www.taufnaus.de/product/10618329",
    "price": 149.27,
    "raw_specifications": {
        "Abmessungen (Breite x Tiefe x H\u00f6he)": "61.32 cm x 20.53 cm x 47.6 cm",
        "Besonderheiten": "Low Blue Light Mode, schmale Blende, Augenschutz-Modus",
        "Bildschirmtyp": "IPS",
        "Diagonalabmessung": "68.598 cm (27\")",
        "Display-Typ": "LED-hintergrundbeleuchteter LCD-Monitor / TFT-Aktivmatrix",
        "Einstellungen der Anzeigeposition": "Neigung",
        "Energie Effizienzklasse": "Klasse E",
        "Farbraum": "100% sRGB",
        "Farbunterst\u00fctzung": "16,7 Millionen Farben",
        "Gewicht": "4.3 kg",
        "Helligkeit": "300 cd/m\u00b2",
        "Hintergrundbeleuchtungs-Technologie": "LED-Hintergrundbeleuchtung",
        "Horizontaler Betrachtungswinkel": "178",
        "Kennzeichnung": "TUV Rheinland Low Blue Light Certification",
        "Kontrast": "1000:1 / 1000000:1 (dynamisch)",
        "Max. Betriebstemperatur": "45 \u00b0C",
        "Min Betriebstemperatur": "0 \u00b0C",
        "Native Aufl\u00f6sung": "Full HD (1080p) 1920 x 1080 bei 75 Hz",
        "Pixelpitch": "0.3114 mm",
        "Reaktionszeit": "6 ms (Gray-to-Gray)",
        "Schnittstellen": "HDMI \u00a6 VGA \u00a6 Audio Line-In",
        "Seitenverh\u00e4ltnis": "16:9",
        "Stromverbrauch (typisch)": "24 Watt",
        "Stromverbrauch SDR (eingeschaltet)": "19.7 kWh/1.000 h",
        "Vertikaler Betrachtungswinkel": "178",
        "Zul\u00e4ssige Luftfeuchtigkeit im Betrieb": "20 - 80% RH"
    },
    "raw_specifications_text": "Display-Typ: LED-hintergrundbeleuchteter LCD-Monitor / TFT-Aktivmatrix\nEnergie Effizienzklasse: Klasse E\nDiagonalabmessung: 68.598 cm (27\")\nBildschirmtyp: IPS\nSeitenverh\u00e4ltnis: 16:9\nNative Aufl\u00f6sung: Full HD (1080p) 1920 x 1080 bei 75 Hz\nPixelpitch: 0.3114 mm\nHelligkeit: 300 cd/m\u00b2\nKontrast: 1000:1 / 1000000:1 (dynamisch)\nFarbunterst\u00fctzung: 16,7 Millionen Farben\nFarbraum: 100% sRGB\nReaktionszeit: 6 ms (Gray-to-Gray)\nHorizontaler Betrachtungswinkel: 178\nVertikaler Betrachtungswinkel: 178\nHintergrundbeleuchtungs-Technologie: LED-Hintergrundbeleuchtung\nBesonderheiten: Low Blue Light Mode, schmale Blende, Augenschutz-Modus\nAbmessungen (Breite x Tiefe x H\u00f6he): 61.32 cm x 20.53 cm x 47.6 cm\nGewicht: 4.3 kg\nSchnittstellen: HDMI \u00a6 VGA \u00a6 Audio Line-In\nEinstellungen der Anzeigeposition: Neigung\nKennzeichnung: TUV Rheinland Low Blue Light Certification\nStromverbrauch SDR (eingeschaltet): 19.7 kWh/1.000 h\nStromverbrauch (typisch): 24 Watt\nMin Betriebstemperatur: 0 \u00b0C\nMax. Betriebstemperatur: 45 \u00b0C\nZul\u00e4ssige Luftfeuchtigkeit im Betrieb: 20 - 80% RH",
    "reference_file": "offer_reference_1296.json",
    "shop_name": "TaufNaus"
}