{
    "html_file": "offer_1931_28.html",
    "name": "AOC Q24P2Q, 23.8\"",
    "offer_link": "https://www.taufnaus.de/product/10606533",
    "price": 232.44,
    "raw_specifications": {
        "Abmessungen (Breite x Tiefe x H\u00f6he)": "54.02 cm x 20.01 cm x 51.3 cm - mit Fu\u00df",
        "Ausgangsleistung/Kanal": "2 Watt",
        "Besonderheiten": "Rahmenlos, flimmerfreie Technologie, USB 3.0 Fast Charge",
        "Bildschirmbeschichtung": "Blendfrei, 3H Hard Coating",
        "Bildschirmtyp": "IPS",
        "Diagonalabmessung": "60.5 cm (23.8\")",
        "Display-Typ": "LED-hintergrundbeleuchteter LCD-Monitor / TFT-Aktivmatrix",
        "Eingangsspannung": "Wechselstrom 120/230 V (50/60 Hz)",
        "Einstellungen der Anzeigeposition": "H\u00f6he, Pivot (Rotation), Drehung, Neigung",
        "Energie Effizienzklasse": "Klasse E",
        "Enthaltene Kabel": "1 x HDMI-Kabel - 1.8 m \u00a6 1 x DisplayPort-Kabel - 1.8 m \u00a6 1 x VGA-Kabel - 1.8 m \u00a6 1 x DVI-Kabel - 1.8 m \u00a6 1 x Audiokabel - 1.8 m \u00a6 1 x USB-Kabel - 1.8 m",
        "Farbe": "Schwarz",
        "Farbraum": "116% sRGB, 86% Adobe RGB",
        "Farbunterst\u00fctzung": "16,7 Millionen Farben",
        "Gewicht": "4.74 kg",
        "Helligkeit": "250 cd/m\u00b2",
        "Hintergrundbeleuchtungs-Technologie": "WLED",
        "Horizontaler Betrachtungswinkel": "178",
        "H\u00f6heneinstellung": "150 mm",
        "Integrierte Peripherieger\u00e4te": "USB 3.2 Gen 1 Hub",
        "Kennzeichnung": "RoHS, Bleifrei, quecksilberfrei",
        "Kontrast": "1000:1 / 50000000:1 (dynamisch)",
        "Leistungsaufnahme im Ein-Zustand": "18.4 W",
        "Native Aufl\u00f6sung": "QHD 2560 x 1440 bei 75 Hz",
        "Neigungswinkel": "-5/+35",
        "OSD-Sprachen": "Tschechisch, Chinesisch (tradionell), Chinesisch (vereinfacht), Englisch, Deutsch, Franz\u00f6sisch, Italienisch, Portugiesisch, Polnisch, Finnisch, Schwedisch, Russisch, Spanisch, Holl\u00e4ndisch, Japanisch, Koreanisch",
        "Pixelpitch": "0.2058 mm",
        "Reaktionszeit": "4 ms (gray-to-gray)",
        "Schnittstellen": "HDMI \u00a6 DisplayPort 1.2 \u00a6 VGA (HD-15) \u00a6 4 x USB 3.2 Gen 1 \u00a6 Audio Line-In \u00a6 Kopfh\u00f6rer",
        "Schwenkwinkel": "180",
        "Seitenverh\u00e4ltnis": "16:9",
        "Service und Support": "Begrenzte Garantie - 3 Jahre",
        "Stromverbrauch (Aus-Modus)": "0.3 Watt",
        "Stromverbrauch SDR (eingeschaltet)": "18.4 kWh/1.000 h",
        "Stromverbrauch im Standby-Modus": "0.5 Watt",
        "TCO-zertifiziert": "TCO Certified Displays 8",
        "Typ": "Lautsprecher - Stereo",
        "VESA-Halterung": "100 x 100 mm",
        "Vertikaler Betrachtungswinkel": "178"
    },
    "raw_specifications_text": "Display-Typ: LED-hintergrundbeleuchteter LCD-Monitor / TFT-Aktivmatrix\nEnergie Effizienzklasse: Klasse E\nDiagonalabmessung: 60.5 cm (23.8\")\nIntegrierte Peripherieger\u00e4te: USB 3.2 Gen 1 Hub\nBildschirmtyp: IPS\nSeitenverh\u00e4ltnis: 16:9\nNative Aufl\u00f6sung: QHD 2560 x 1440 bei 75 Hz\nPixelpitch: 0.2058 mm\nHelligkeit: 250 cd/m\u00b2\nKontrast: 1000:1 / 50000000:1 (dynamisch)\nFarbunterst\u00fctzung: 16,7 Millionen Farben\nFarbraum: 116% sRGB, 86% Adobe RGB\nReaktionszeit: 4 ms (gray-to-gray)\nHorizontaler Betrachtungswinkel: 178\nVertikaler Betrachtungswinkel: 178\nBildschirmbeschichtung: Blendfrei, 3H Hard Coating\nHintergrundbeleuchtungs-Technologie: WLED\nOSD-Sprachen: Tschechisch, Chinesisch (tradionell), Chinesisch (vereinfacht), Englisch, Deutsch, Franz\u00f6sisch, Italienisch, Portugiesisch, Polnisch, Finnisch, Schwedisch, Russisch, Spanisch, Holl\u00e4ndisch, Japanisch, Koreanisch\nBesonderheiten: Rahmenlos, flimmerfreie Technologie, USB 3.0 Fast Charge\nFarbe: Schwarz\nAbmessungen (Breite x Tiefe x H\u00f6he): 54.02 cm x 20.01 cm x 51.3 cm - mit Fu\u00df\nGewicht: 4.74 kg\nTyp: Lautsprecher - Stereo\nAusgangsleistung/Kanal: 2 Watt\nSchnittstellen: HDMI \u00a6 DisplayPort 1.2 \u00a6 VGA (HD-15) \u00a6 4 x USB 3.2 Gen 1 \u00a6 Audio Line-In \u00a6 Kopfh\u00f6rer\nEinstellungen der Anzeigeposition: H\u00f6he, Pivot (Rotation), Drehung, Neigung\nNeigungswinkel: -5/+35\nSchwenkwinkel: 180\nH\u00f6heneinstellung: 150 mm\nVESA-Halterung: 100 x 100 mm\nEnthaltene Kabel: 1 x HDMI-Kabel - 1.8 m \u00a6 1 x DisplayPort-Kabel - 1.8 m \u00a6 1 x VGA-Kabel - 1.8 m \u00a6 1 x DVI-Kabel - 1.8 m \u00a6 1 x Audiokabel - 1.8 m \u00a6 1 x USB-Kabel - 1.8 m\nKennzeichnung: RoHS, Bleifrei, quecksilberfrei\nEingangsspannung: Wechselstrom 120/230 V (50/60 Hz)\nLeistungsaufnahme im Ein-Zustand: 18.4 W\nStromverbrauch SDR (eingeschaltet): 18.4 kWh/1.000 h\nStromverbrauch im Standby-Modus: 0.5 Watt\nStromverbrauch (Aus-Modus): 0.3 Watt\nTCO-zertifiziert: TCO Certified Displays 8\nService und Support: Begrenzte Garantie - 3 Jahre",
    "reference_file": "offer_reference_1931.json",
    "shop_name": "TaufNaus"
}