{
    "html_file": "offer_482_5.html",
    "name": "Samsung Odyssey G3 G3A (2023), 24\"",
    "offer_link": "https://www.mylemon.at/artikel/samsung/ls24ag300nrxen/lcd-monitor-odyssey-g30a-24.html",
    "price": 137.46,
    "raw_specifications": {
        "AC Eingangsspannung": "100 - 240 V",
        "AMD FreeSync": "Ja",
        "Anzahl DisplayPort Anschl\u00fcsse": "1",
        "Anzahl HDMI-Anschl\u00fcsse": "1",
        "Anzahl der Farben des Displays": "16,7 Millionen Farben",
        "Artikelnummer": "M1JY33GL",
        "Audioanschl\u00fcsse": "Nein",
        "Auf Ansicht tippen": "Nein",
        "Aufl\u00f6sung": "1920x1080",
        "Besonderheiten": "144 Hz",
        "Betriebstemperatur": "10 - 40 \u00b0C",
        "Bildschirmdiagonale": "61 cm (24 Zoll)",
        "Bildschirmdiagonale (cm)": "61 cm",
        "Bildschirmform": "Flach",
        "Bildschirmtechnologie": "LED",
        "Bildwinkel, horizontal": "178\u00b0",
        "Bildwinkel, vertikal": "178\u00b0",
        "Bluetooth": "Nein",
        "Breite (ohne Standfu\u00df)": "54,4 cm",
        "ConnectShare (USB)": "Nein",
        "DVI Anschluss": "Nein",
        "Display-Aufl\u00f6sung": "1920 x 1080 Pixel",
        "DisplayPorts-Version": "1.2",
        "Displaygr\u00f6\u00dfe": "24 Zoll",
        "Dynamisches Kontrastverh\u00e4ltnis Marketingbezeichnung": "Mega-Kontrast",
        "EAN": "8806094665772",
        "Eingebaute Lautsprecher": "Nein",
        "Eingebauter Ethernet-Anschluss": "Nein",
        "Energieeffizienzklasse (HDR)": "Nicht verf\u00fcgbar",
        "Energieeffizienzklasse (SDR)": "E",
        "Energieverbrauch (SDR) pro 1.000 Stunden": "17 kWh",
        "Ergonomie": "H\u00f6henverstellbar, Pivot (90 Grad drehbar), Schwenkbar, Neigbar",
        "Flimmerfreie Technologie": "Ja",
        "Funktioniert mit Samsung Bixby": "Nein",
        "Ger\u00e4tebreite (inkl. Fu\u00df)": "544 mm",
        "Ger\u00e4teh\u00f6he (inkl. Fu\u00df)": "498,4 mm",
        "Ger\u00e4tetiefe (inkl. Fu\u00df)": "234,1 mm",
        "Gewicht (mit St\u00e4nder)": "4,1 kg",
        "Gewicht (ohne St\u00e4nder)": "2,6 kg",
        "HD-Typ": "Full HD",
        "HDMI": "Ja",
        "HDMI-Version": "1.4",
        "Helligkeit": "250 cd/m\u00b2",
        "Helligkeit (peak)": "250 cd/m\u00b2",
        "Hersteller Artikelnummer": "LS24AG300NRXEN",
        "H\u00f6he (ohne Standfu\u00df)": "33,3 cm",
        "H\u00f6heneinstellung": "12 cm",
        "H\u00f6henverstellung": "Ja",
        "Installiertes Betriebssystem": "Windows 10",
        "Integrierte Kamera": "Nein",
        "Integrierter Kalibrierungssensor": "Nein",
        "Integrierter USB-Hub": "Nein",
        "Kontrastverh\u00e4ltnis": "3000:1",
        "Kopfh\u00f6rerausgang": "Ja",
        "Marktpositionierung": "Gaming",
        "Maximale Bildwiederholrate": "144 Hz",
        "Mitgelieferte Kabel": "AC, DisplayPort, HDMI",
        "NVIDIA G-SYNC": "Nein",
        "Natives Seitenverh\u00e4ltnis": "16:9",
        "Neigungsverstellung": "Ja",
        "Neigungswinkelbereich": "-5 - 20\u00b0",
        "Paketgewicht": "6,3 kg",
        "Panel": "VA",
        "Panel-Montage-Schnittstelle": "100 x 100 mm",
        "Panel-Typ": "VA",
        "Pivot": "Ja",
        "Pivot Winkel": "-15 - 15\u00b0",
        "Produktfarbe": "Schwarz",
        "Reaktionszeit": "1 ms",
        "Relative Luftfeuchtigkeit in Betrieb": "10 - 80%",
        "Schwenkbar": "Ja",
        "Schwenkwinkelbereich": "-2 - 92\u00b0",
        "Stromverbrauch (Standardbetrieb)": "17 W",
        "Stromverbrauch (Standby)": "0,3 W",
        "Stromverbrauch (aus)": "0,3 W",
        "Stromverbrauch (max.)": "24 W",
        "TV Plus": "Nein",
        "Tiefe (ohne Standfu\u00df)": "9,19 cm",
        "Ton-Spiegelung": "Nein",
        "Unterst\u00fctzung der SmartThings-App": "Nein",
        "VESA Halterung": "100x100 mm",
        "VESA-Halterung": "Ja",
        "Verpackungsbreite": "636 mm",
        "Verpackungsh\u00f6he": "213 mm",
        "Verpackungstiefe": "454 mm",
        "Video Anschl\u00fcsse": "1x DisplayPort",
        "Wandmontage": "Ja"
    },
    "raw_specifications_text": "Displaygr\u00f6\u00dfe: 24 Zoll\nAufl\u00f6sung: 1920x1080\nPanel: VA\nReaktionszeit: 1 ms\nVideo Anschl\u00fcsse: 1x DisplayPort\nErgonomie: H\u00f6henverstellbar, Pivot (90 Grad drehbar), Schwenkbar, Neigbar\nVESA Halterung: 100x100 mm\nHelligkeit: 250 cd/m\u00b2\nBesonderheiten: 144 Hz\nHersteller Artikelnummer: LS24AG300NRXEN\nEAN: 8806094665772\nArtikelnummer: M1JY33GL\nBildschirmdiagonale: 61 cm (24 Zoll)\nDisplay-Aufl\u00f6sung: 1920 x 1080 Pixel\nNatives Seitenverh\u00e4ltnis: 16:9\nBildschirmtechnologie: LED\nHD-Typ: Full HD\nPanel-Typ: VA\nBildschirmform: Flach\nKontrastverh\u00e4ltnis: 3000:1\nMaximale Bildwiederholrate: 144 Hz\nAnzahl der Farben des Displays: 16,7 Millionen Farben\nHelligkeit (peak): 250 cd/m\u00b2\nDynamisches Kontrastverh\u00e4ltnis Marketingbezeichnung: Mega-Kontrast\nBildwinkel, horizontal: 178\u00b0\nBildwinkel, vertikal: 178\u00b0\nBildschirmdiagonale (cm): 61 cm\nIntegrierter Kalibrierungssensor: Nein\nNVIDIA G-SYNC: Nein\nAMD FreeSync: Ja\nConnectShare (USB): Nein\nFlimmerfreie Technologie: Ja\nTon-Spiegelung: Nein\nTV Plus: Nein\nUnterst\u00fctzung der SmartThings-App: Nein\nFunktioniert mit Samsung Bixby: Nein\nAuf Ansicht tippen: Nein\nInstalliertes Betriebssystem: Windows 10\nEingebaute Lautsprecher: Nein\nIntegrierte Kamera: Nein\nMarktpositionierung: Gaming\nProduktfarbe: Schwarz\nIntegrierter USB-Hub: Nein\nHDMI: Ja\nKopfh\u00f6rerausgang: Ja\nDVI Anschluss: Nein\nAnzahl HDMI-Anschl\u00fcsse: 1\nHDMI-Version: 1.4\nAnzahl DisplayPort Anschl\u00fcsse: 1\nDisplayPorts-Version: 1.2\nAudioanschl\u00fcsse: Nein\nBluetooth: Nein\nEingebauter Ethernet-Anschluss: Nein\nVESA-Halterung: Ja\nH\u00f6henverstellung: Ja\nPanel-Montage-Schnittstelle: 100 x 100 mm\nWandmontage: Ja\nH\u00f6heneinstellung: 12 cm\nPivot: Ja\nPivot Winkel: -15 - 15\u00b0\nSchwenkbar: Ja\nSchwenkwinkelbereich: -2 - 92\u00b0\nNeigungswinkelbereich: -5 - 20\u00b0\nNeigungsverstellung: Ja\nEnergieeffizienzklasse (SDR): E\nEnergieeffizienzklasse (HDR): Nicht verf\u00fcgbar\nEnergieverbrauch (SDR) pro 1.000 Stunden: 17 kWh\nStromverbrauch (Standardbetrieb): 17 W\nStromverbrauch (Standby): 0,3 W\nStromverbrauch (max.): 24 W\nStromverbrauch (aus): 0,3 W\nAC Eingangsspannung: 100 - 240 V\nBetriebstemperatur: 10 - 40 \u00b0C\nRelative Luftfeuchtigkeit in Betrieb: 10 - 80%\nMitgelieferte Kabel: AC, DisplayPort, HDMI\nGer\u00e4tebreite (inkl. Fu\u00df): 544 mm\nGer\u00e4tetiefe (inkl. Fu\u00df): 234,1 mm\nGer\u00e4teh\u00f6he (inkl. Fu\u00df): 498,4 mm\nGewicht (mit St\u00e4nder): 4,1 kg\nBreite (ohne Standfu\u00df): 54,4 cm\nTiefe (ohne Standfu\u00df): 9,19 cm\nH\u00f6he (ohne Standfu\u00df): 33,3 cm\nGewicht (ohne St\u00e4nder): 2,6 kg\nVerpackungsbreite: 636 mm\nVerpackungstiefe: 454 mm\nVerpackungsh\u00f6he: 213 mm\nPaketgewicht: 6,3 kg",
    "reference_file": "offer_reference_482.json",
    "shop_name": "mylemon.at"
}