{
    "html_file": "offer_840_22.html",
    "name": "ASUS TUF Gaming VG248Q1B, 24\"",
    "offer_link": "https://syswork.at/sw/index.html?open&mid=Artikel&artid=mon-1575&from=geizhals.at",
    "price": 172.0,
    "raw_specifications": {
        "AMD FreeSync": "Ja",
        "AMD FreeSync-Typ": "FreeSync Premium",
        "Anzahl DisplayPort Anschl\u00fcsse": "1",
        "Anzahl HDMI-Anschl\u00fcsse": "2",
        "Anzahl der Farben des Displays": "16,7 Millionen Farben",
        "Bildschirmdiagonale": "61 cm (24 Zoll)",
        "Bildschirmform": "Flach",
        "Bildschirmtechnologie": "LED",
        "Bildwinkel, horizontal": "170\u00b0",
        "Bildwinkel, vertikal": "160\u00b0",
        "Blendfreier Bildschirm": "Ja",
        "Breite (ohne Standfu\u00df)": "57,1 cm",
        "Datenblatt": "Kein Datenblatt verf\u00fcgbar",
        "Digital horizontale Frequenz": "200 - 200 kHz",
        "Digital vertikale Frequenz": "48 - 165 Hz",
        "Display-Aufl\u00f6sung": "1920 x 1080 Pixel",
        "DisplayPorts-Version": "1.2",
        "Dynamisches Kontrastverh\u00e4ltnis Marketingbezeichnung": "ASUS Smart Contrast Ratio (ASCR)",
        "Energieeffizienzklasse (SDR)": "E",
        "Energieeffizienzskala": "A bis G",
        "Energieverbrauch (SDR) pro 1.000 Stunden": "18 kWh",
        "Flimmerfreie Technologie": "Ja",
        "Ger\u00e4tebreite (inkl. Fu\u00df)": "571,2 mm",
        "Ger\u00e4teh\u00f6he (inkl. Fu\u00df)": "174 mm",
        "Ger\u00e4tetiefe (inkl. Fu\u00df)": "407,1 mm",
        "Gewicht (mit St\u00e4nder)": "3,8 kg",
        "Gewicht (ohne St\u00e4nder)": "3,32 kg",
        "HD-Typ": "Full HD",
        "HDCP": "Ja",
        "HDCP-Version": "1.4",
        "HDMI": "Ja",
        "HDMI-Version": "1.4",
        "Helligkeit (typisch)": "350 cd/m\u00b2",
        "Herstellerlink": "ASUS",
        "Horizontaler Scanbereich": "30 - 180 kHz",
        "H\u00f6he (ohne Standfu\u00df)": "5,17 cm",
        "H\u00f6henverstellung": "Nein",
        "Kabelsperre-Slot": "Ja",
        "Kontrastverh\u00e4ltnis": "1000:1",
        "Kontrastverh\u00e4ltnis (dynamisch)": "100000000:1",
        "Kopfh\u00f6rerausgang": "Ja",
        "Kopfh\u00f6rerausg\u00e4nge": "1",
        "Low-Blue-Light-Technologie": "Ja",
        "Marktpositionierung": "Gaming",
        "Maximale Bildwiederholrate": "165 Hz",
        "Natives Seitenverh\u00e4ltnis": "16:9",
        "Neigungsverstellung": "Ja",
        "Neigungswinkelbereich": "-5 - 15\u00b0",
        "Paketgewicht": "5,4 kg",
        "Panel-Montage-Schnittstelle": "100 x 100 mm",
        "Panel-Typ": "TN",
        "Pixel Abstand": "0,2768 x 0,2768 mm",
        "Produktfarbe": "Schwarz",
        "Produktlink": "Link",
        "Reaktionszeit (schnell)": "0,5 ms",
        "Sichtbare Gr\u00f6\u00dfe (horizontal)": "29,9 cm",
        "Sichtbare Gr\u00f6\u00dfe (vertikal)": "53,1 cm",
        "Slot-Typ Kabelsperre": "Kensington",
        "Spiel-Modus": "Ja",
        "Stromverbrauch (PowerSave)": "0,5 W",
        "Stromverbrauch (Standardbetrieb)": "16 W",
        "Stromverbrauch (aus)": "0,3 W",
        "Tiefe (ohne Standfu\u00df)": "34,1 cm",
        "Touchscreen": "Nein",
        "Typ der Hintergrundbeleuchtung": "LED",
        "VESA-Halterung": "Ja",
        "Verpackungsart": "Box",
        "Verpackungsbreite": "637 mm",
        "Verpackungsh\u00f6he": "164 mm",
        "Verpackungstiefe": "412 mm",
        "Vertikaler Scanbereich": "48 - 144 Hz",
        "Zertifizierung": "T\u00dcV Flicker-free\\nT\u00dcV Low Blue Light\\nAMD FreeSync Premium"
    },
    "raw_specifications_text": "Bildschirmdiagonale: 61 cm (24 Zoll)\nDisplay-Aufl\u00f6sung: 1920 x 1080 Pixel\nNatives Seitenverh\u00e4ltnis: 16:9\nBildschirmtechnologie: LED\nTouchscreen: Nein\nHD-Typ: Full HD\nPanel-Typ: TN\nBildschirmform: Flach\nKontrastverh\u00e4ltnis: 1000:1\nMaximale Bildwiederholrate: 165 Hz\nAnzahl der Farben des Displays: 16,7 Millionen Farben\nTyp der Hintergrundbeleuchtung: LED\nHelligkeit (typisch): 350 cd/m\u00b2\nBlendfreier Bildschirm: Ja\nKontrastverh\u00e4ltnis (dynamisch): 100000000:1\nDynamisches Kontrastverh\u00e4ltnis Marketingbezeichnung: ASUS Smart Contrast Ratio (ASCR)\nBildwinkel, horizontal: 170\u00b0\nBildwinkel, vertikal: 160\u00b0\nReaktionszeit (schnell): 0,5 ms\nPixel Abstand: 0,2768 x 0,2768 mm\nHorizontaler Scanbereich: 30 - 180 kHz\nVertikaler Scanbereich: 48 - 144 Hz\nSichtbare Gr\u00f6\u00dfe (horizontal): 29,9 cm\nSichtbare Gr\u00f6\u00dfe (vertikal): 53,1 cm\nDigital horizontale Frequenz: 200 - 200 kHz\nDigital vertikale Frequenz: 48 - 165 Hz\nAMD FreeSync: Ja\nAMD FreeSync-Typ: FreeSync Premium\nFlimmerfreie Technologie: Ja\nLow-Blue-Light-Technologie: Ja\nSpiel-Modus: Ja\nMarktpositionierung: Gaming\nProduktfarbe: Schwarz\nZertifizierung: T\u00dcV Flicker-free\\nT\u00dcV Low Blue Light\\nAMD FreeSync Premium\nHDMI: Ja\nKopfh\u00f6rerausgang: Ja\nAnzahl HDMI-Anschl\u00fcsse: 2\nHDMI-Version: 1.4\nAnzahl DisplayPort Anschl\u00fcsse: 1\nDisplayPorts-Version: 1.2\nKopfh\u00f6rerausg\u00e4nge: 1\nHDCP: Ja\nHDCP-Version: 1.4\nVESA-Halterung: Ja\nKabelsperre-Slot: Ja\nH\u00f6henverstellung: Nein\nPanel-Montage-Schnittstelle: 100 x 100 mm\nSlot-Typ Kabelsperre: Kensington\nNeigungswinkelbereich: -5 - 15\u00b0\nNeigungsverstellung: Ja\nEnergieeffizienzklasse (SDR): E\nEnergieverbrauch (SDR) pro 1.000 Stunden: 18 kWh\nStromverbrauch (Standardbetrieb): 16 W\nStromverbrauch (aus): 0,3 W\nStromverbrauch (PowerSave): 0,5 W\nEnergieeffizienzskala: A bis G\nGer\u00e4tebreite (inkl. Fu\u00df): 571,2 mm\nGer\u00e4tetiefe (inkl. Fu\u00df): 407,1 mm\nGer\u00e4teh\u00f6he (inkl. Fu\u00df): 174 mm\nGewicht (mit St\u00e4nder): 3,8 kg\nBreite (ohne Standfu\u00df): 57,1 cm\nTiefe (ohne Standfu\u00df): 34,1 cm\nH\u00f6he (ohne Standfu\u00df): 5,17 cm\nGewicht (ohne St\u00e4nder): 3,32 kg\nVerpackungsbreite: 637 mm\nVerpackungstiefe: 412 mm\nVerpackungsh\u00f6he: 164 mm\nPaketgewicht: 5,4 kg\nVerpackungsart: Box\nDatenblatt: Kein Datenblatt verf\u00fcgbar\nProduktlink: Link\nHerstellerlink: ASUS",
    "reference_file": "offer_reference_840.json",
    "shop_name": "Syswork"
}