{
    "html_file": "offer_1888_11.html",
    "name": "ASUS ProArt PA32UCX-PK, 32\"",
    "offer_link": "https://www.e-tec.at/details.php?artnr=304417",
    "price": 2881.6,
    "raw_specifications": {
        "Abmessungen (BxHxT)": "727x600x229mm (mit Standfu\u00df),  727x426x69mm (ohne Standfu\u00df)",
        "Adaptive Sync": "Ja",
        "Anschl\u00fcsse - DisplayPort 1.2": "1",
        "Anschl\u00fcsse - HDMI 2.0b": "3",
        "Anschl\u00fcsse - Thunderbolt 3": "2",
        "Anwendung": "station\u00e4r",
        "Audio": "Lautsprecher (2x 3W),  1x Line-Out",
        "Aufl\u00f6sung": "3840x2160",
        "Beschichtung": "matt (non-glare)",
        "Besonderheiten": "Slim Bezel,  Blendschutzhaube,  USB-C Power Delivery (60W),  mechanische Tasten mit Steuerkreuz,  Hardware-Kalibrierung (14bit LUT),  Colorimeter (X-Rite i1),  Lichtsensor,  Picture-in-Picture,  HDCP 2.2,  DICOM,  ASUS Off-Axis Contrast Optimization,  Calman Ready,  Werkskalibrierung (Delta-E <1),  L\u00fcfter",
        "Bildwiederholfrequenz": "60Hz",
        "Blickwinkel": "178\u00b0/178\u00b0",
        "Diagonale": "32\"/81.3cm",
        "Energieeffizienzklasse HDR (A bis G)": "G",
        "Energieeffizienzklasse alt (A+++ bis D)": "C",
        "Energieeffizienzklasse alt (A+++ bis G)": "C",
        "Energieverbrauch HDR": "97kWh/1000h",
        "Energieverbrauch SDR": "80kWh/1000h",
        "Ergonomie": "130mm (h\u00f6henverstellbar),  90\u00b0 (Pivot),  \u00b160\u00b0 (drehbar),  +23\u00b0/-5\u00b0 (neigbar),  keine Angabe (Schr\u00e4glage)",
        "FRC": "nein (10bit nativ)",
        "Farbe": "schwarz",
        "Farbraum - Adobe RGB": "99.5%",
        "Farbraum - DCI-P3": "99%",
        "Farbraum - REC 709": "89%",
        "Farbraum - sRGB": "100%",
        "Farbtiefe": "10bit (1.07 Mrd. Farben)",
        "Form": "gerade (flat)",
        "Gewicht": "14.64kg (mit Standfu\u00df),  9.70kg (ohne Standfu\u00df)",
        "HDR": "VESA DisplayHDR 1000,  HDR10,  Dolby Vision,  Ultra HD Premium",
        "Helligkeit": "600cd/m\u00b2 (typisch),  1.200cd/m\u00b2 (HDR)",
        "Herstellergarantie": "f\u00fcnf Jahre nach Registrierung (innerhalb von drei Monaten nach Kauf,  Standard: drei Jahre)",
        "Hintergrundbeleuchtung": "Mini LED,  flicker-free,  Blaulichtfilter,  Full Array Local Dimming (1152 Zonen)",
        "Jahresverbrauch alt (A+++ bis D)": "91.98kWh",
        "Jahresverbrauch alt (A+++ bis G)": "91.98kWh",
        "Kontrast - dynamisch": "100.000.000:1",
        "Kontrast - statisch": "1.000:1",
        "Lautsprecher": "Ja",
        "Leistungsaufnahme": "keine Angabe (maximal),  58.67W (typisch),  63W (Energielabel alt A+++ bis G),  0.3W (Standby)",
        "Panel": "IPS (AmLED),  Quantum-Dot",
        "Panel-Hersteller": "AU Optronics (M320QAN02.5)",
        "Reaktionszeit - GtG": "5ms",
        "Screen-to-Body-Ratio": "91.1% (berechnet)",
        "Seitenverh\u00e4ltnis": "16:9",
        "Signalfrequenz": "109-142kHz (horizontal),  29-65Hz (vertikal)",
        "Stromversorgung": "AC-In (internes Netzteil)",
        "USB-Hub In": "1x USB-B 3.0",
        "USB-Hub Out": "3x USB-A 3.0",
        "USB-Schreibweise": "Link",
        "VESA": "100x100 (belegt)",
        "VRR (Variable Refresh Rate)": "Adaptive Sync (40-60Hz)",
        "Weitere Anschl\u00fcsse": "N/A"
    },
    "raw_specifications_text": "Abmessungen (BxHxT): 727x600x229mm (mit Standfu\u00df),  727x426x69mm (ohne Standfu\u00df)\nAdaptive Sync: Ja\nAnschl\u00fcsse - DisplayPort 1.2: 1\nAnschl\u00fcsse - HDMI 2.0b: 3\nAnschl\u00fcsse - Thunderbolt 3: 2\nAnwendung: station\u00e4r\nAudio: Lautsprecher (2x 3W),  1x Line-Out\nAufl\u00f6sung: 3840x2160\nBeschichtung: matt (non-glare)\nBesonderheiten: Slim Bezel,  Blendschutzhaube,  USB-C Power Delivery (60W),  mechanische Tasten mit Steuerkreuz,  Hardware-Kalibrierung (14bit LUT),  Colorimeter (X-Rite i1),  Lichtsensor,  Picture-in-Picture,  HDCP 2.2,  DICOM,  ASUS Off-Axis Contrast Optimization,  Calman Ready,  Werkskalibrierung (Delta-E <1),  L\u00fcfter\nBildwiederholfrequenz: 60Hz\nBlickwinkel: 178\u00b0/178\u00b0\nDiagonale: 32\"/81.3cm\nEnergieeffizienzklasse alt (A+++ bis D): C\nEnergieeffizienzklasse alt (A+++ bis G): C\nEnergieeffizienzklasse HDR (A bis G): G\nEnergieverbrauch HDR: 97kWh/1000h\nEnergieverbrauch SDR: 80kWh/1000h\nErgonomie: 130mm (h\u00f6henverstellbar),  90\u00b0 (Pivot),  \u00b160\u00b0 (drehbar),  +23\u00b0/-5\u00b0 (neigbar),  keine Angabe (Schr\u00e4glage)\nFarbe: schwarz\nFarbraum - Adobe RGB: 99.5%\nFarbraum - DCI-P3: 99%\nFarbraum - REC 709: 89%\nFarbraum - sRGB: 100%\nFarbtiefe: 10bit (1.07 Mrd. Farben)\nForm: gerade (flat)\nFRC: nein (10bit nativ)\nGewicht: 14.64kg (mit Standfu\u00df),  9.70kg (ohne Standfu\u00df)\nHDR: VESA DisplayHDR 1000,  HDR10,  Dolby Vision,  Ultra HD Premium\nHelligkeit: 600cd/m\u00b2 (typisch),  1.200cd/m\u00b2 (HDR)\nHerstellergarantie: f\u00fcnf Jahre nach Registrierung (innerhalb von drei Monaten nach Kauf,  Standard: drei Jahre)\nHintergrundbeleuchtung: Mini LED,  flicker-free,  Blaulichtfilter,  Full Array Local Dimming (1152 Zonen)\nJahresverbrauch alt (A+++ bis D): 91.98kWh\nJahresverbrauch alt (A+++ bis G): 91.98kWh\nKontrast - dynamisch: 100.000.000:1\nKontrast - statisch: 1.000:1\nLautsprecher: Ja\nLeistungsaufnahme: keine Angabe (maximal),  58.67W (typisch),  63W (Energielabel alt A+++ bis G),  0.3W (Standby)\nPanel: IPS (AmLED),  Quantum-Dot\nPanel-Hersteller: AU Optronics (M320QAN02.5)\nReaktionszeit - GtG: 5ms\nScreen-to-Body-Ratio: 91.1% (berechnet)\nSeitenverh\u00e4ltnis: 16:9\nSignalfrequenz: 109-142kHz (horizontal),  29-65Hz (vertikal)\nStromversorgung: AC-In (internes Netzteil)\nUSB-Hub In: 1x USB-B 3.0\nUSB-Hub Out: 3x USB-A 3.0\nUSB-Schreibweise: Link\nVESA: 100x100 (belegt)\nVRR (Variable Refresh Rate): Adaptive Sync (40-60Hz)\nWeitere Anschl\u00fcsse: N/A",
    "reference_file": "offer_reference_1888.json",
    "shop_name": "e-tec.at"
}