{
    "html_file": "offer_1723_14.html",
    "name": "HP E14 G4, 14\"",
    "offer_link": "https://www.mylemon.at/artikel/hewlett_packard/1b065aa_abb/e14-14in-ips-usb-c.html",
    "price": 258.99,
    "raw_specifications": {
        "Anzahl der vorgeschalteten Steckpl\u00e4tze": "2",
        "Artikelnummer": "M14YAZJL",
        "Audioanschl\u00fcsse": "Nein",
        "Aufl\u00f6sung": "1920x1080",
        "Betriebstemperatur": "5 - 35 \u00b0C",
        "Bildschirmdiagonale": "35,6 cm (14 Zoll)",
        "Bildschirmform": "Flach",
        "Bildschirmtechnologie": "LED",
        "Bildwinkel, horizontal": "178\u00b0",
        "Bildwinkel, vertikal": "178\u00b0",
        "Blendfreier Bildschirm": "Ja",
        "Breite (ohne Standfu\u00df)": "32,1 cm",
        "DVI Anschluss": "Nein",
        "Display-Aufl\u00f6sung": "1920 x 1080 Pixel",
        "Displaygr\u00f6\u00dfe": "14 Zoll",
        "EAN": "195122635008",
        "Eingebaute Lautsprecher": "Nein",
        "Energieeffizienzklasse (SDR)": "B",
        "Energieverbrauch (SDR) pro 1.000 Stunden": "5 kWh",
        "Farbskala": "72%",
        "Flimmerfreie Technologie": "Ja",
        "Ger\u00e4tebreite (inkl. Fu\u00df)": "321,4 mm",
        "Ger\u00e4teh\u00f6he (inkl. Fu\u00df)": "210 mm",
        "Ger\u00e4tetiefe (inkl. Fu\u00df)": "15,2 mm",
        "Gewicht (mit St\u00e4nder)": "640 g",
        "Gewicht (ohne St\u00e4nder)": "640 g",
        "HD-Typ": "Full HD",
        "HDMI": "Nein",
        "HP-Segment": "Business",
        "Helligkeit": "400 cd/m\u00b2",
        "Helligkeit (typisch)": "400 cd/m\u00b2",
        "Hersteller Artikelnummer": "1B065AA#ABB",
        "Horizontaler Scanbereich": "30 - 80 kHz",
        "H\u00f6he (ohne Standfu\u00df)": "21 cm",
        "H\u00f6henverstellung": "Nein",
        "Integrierte Kamera": "Nein",
        "Integrierter USB-Hub": "Ja",
        "Kontrastverh\u00e4ltnis": "800:1",
        "Kopfh\u00f6rerausgang": "Nein",
        "Luftfeuchtigkeit bei Lagerung": "5 - 95%",
        "Marktpositionierung": "Business",
        "Maximale Bildwiederholrate": "60 Hz",
        "Mitgelieferte Kabel": "USB Typ-C",
        "NTSC Abdeckung (typisch)": "72%",
        "Nachhaltige Technologien und Materialien": "Arsenfreies Bildschirmglas; Halogenarm; Quecksilberfreie Hintergrundbeleuchtung",
        "Natives Seitenverh\u00e4ltnis": "16:9",
        "Neigungsverstellung": "Ja",
        "Neigungswinkelbereich": "0 - 78\u00b0",
        "Oberfl\u00e4chenh\u00e4rte": "3H",
        "Paketgewicht": "1,54 kg",
        "Panel": "IPS",
        "Panel-Typ": "IPS",
        "Pivot": "Nein",
        "Pixel Abstand": "0,161 x 0,161 mm",
        "Pixeldichte": "157 ppi",
        "Produktfarbe": "Wei\u00df",
        "RGB-Farbraum": "NTSC",
        "Reaktionszeit": "5 ms",
        "Relative Luftfeuchtigkeit in Betrieb": "20 - 80%",
        "Schwenkbar": "Nein",
        "Stromverbrauch (Standardbetrieb)": "6 W",
        "Stromverbrauch (Standby)": "0,3 W",
        "Tiefe (ohne Standfu\u00df)": "1,52 cm",
        "Touchscreen": "Nein",
        "USB-Upstream-Porttyp": "USB Typ-C",
        "Unterst\u00fctzte Grafik-Aufl\u00f6sungen": "640 x 480 (VGA), 720 x 400, 800 x 600 (SVGA), 1024 x 768 (XGA), 1280 x 1024 (SXGA), 1280 x 720 (HD 720), 1440 x 900 (WXGA+), 1600 x 900, 1680 x 1050 (WSXGA+), 1920 x 1080 (HD 1080)",
        "VESA-Halterung": "Nein",
        "Verpackungsbreite": "405 mm",
        "Verpackungsh\u00f6he": "284 mm",
        "Verpackungstiefe": "61 mm",
        "Vertikaler Scanbereich": "59 - 60 Hz",
        "Video Anschl\u00fcsse": "USB-C DisplayPort",
        "Warentarifnummer (HS)": "85285210",
        "Zertifizierung": "BIS; BSMI; CB; CCC; CE; cTUVus; EAC; ENERGY STAR\u00ae; FCC; ICES; ISE for Cambodia; ISO 9241-307; KC/KCC; NOM; SEPA; Taiwan Green Mark; TUV/GS; VCCI; Vietnam MEPS; WEEE; ISC; WW application; UAE"
    },
    "raw_specifications_text": "Displaygr\u00f6\u00dfe: 14 Zoll\nAufl\u00f6sung: 1920x1080\nPanel: IPS\nReaktionszeit: 5 ms\nVideo Anschl\u00fcsse: USB-C DisplayPort\nHelligkeit: 400 cd/m\u00b2\nHersteller Artikelnummer: 1B065AA#ABB\nEAN: 195122635008\nArtikelnummer: M14YAZJL\nBildschirmdiagonale: 35,6 cm (14 Zoll)\nDisplay-Aufl\u00f6sung: 1920 x 1080 Pixel\nNatives Seitenverh\u00e4ltnis: 16:9\nBildschirmtechnologie: LED\nTouchscreen: Nein\nHD-Typ: Full HD\nPanel-Typ: IPS\nBildschirmform: Flach\nKontrastverh\u00e4ltnis: 800:1\nMaximale Bildwiederholrate: 60 Hz\nHelligkeit (typisch): 400 cd/m\u00b2\nBlendfreier Bildschirm: Ja\nUnterst\u00fctzte Grafik-Aufl\u00f6sungen: 640 x 480 (VGA), 720 x 400, 800 x 600 (SVGA), 1024 x 768 (XGA), 1280 x 1024 (SXGA), 1280 x 720 (HD 720), 1440 x 900 (WXGA+), 1600 x 900, 1680 x 1050 (WSXGA+), 1920 x 1080 (HD 1080)\nBildwinkel, horizontal: 178\u00b0\nBildwinkel, vertikal: 178\u00b0\nPixel Abstand: 0,161 x 0,161 mm\nPixeldichte: 157 ppi\nHorizontaler Scanbereich: 30 - 80 kHz\nVertikaler Scanbereich: 59 - 60 Hz\nOberfl\u00e4chenh\u00e4rte: 3H\nRGB-Farbraum: NTSC\nFarbskala: 72%\nNTSC Abdeckung (typisch): 72%\nFlimmerfreie Technologie: Ja\nHP-Segment: Business\nEingebaute Lautsprecher: Nein\nIntegrierte Kamera: Nein\nMarktpositionierung: Business\nProduktfarbe: Wei\u00df\nZertifizierung: BIS; BSMI; CB; CCC; CE; cTUVus; EAC; ENERGY STAR\u00ae; FCC; ICES; ISE for Cambodia; ISO 9241-307; KC/KCC; NOM; SEPA; Taiwan Green Mark; TUV/GS; VCCI; Vietnam MEPS; WEEE; ISC; WW application; UAE\nIntegrierter USB-Hub: Ja\nHDMI: Nein\nKopfh\u00f6rerausgang: Nein\nUSB-Upstream-Porttyp: USB Typ-C\nAnzahl der vorgeschalteten Steckpl\u00e4tze: 2\nDVI Anschluss: Nein\nAudioanschl\u00fcsse: Nein\nVESA-Halterung: Nein\nH\u00f6henverstellung: Nein\nPivot: Nein\nSchwenkbar: Nein\nNeigungswinkelbereich: 0 - 78\u00b0\nNeigungsverstellung: Ja\nEnergieeffizienzklasse (SDR): B\nEnergieverbrauch (SDR) pro 1.000 Stunden: 5 kWh\nStromverbrauch (Standardbetrieb): 6 W\nStromverbrauch (Standby): 0,3 W\nBetriebstemperatur: 5 - 35 \u00b0C\nRelative Luftfeuchtigkeit in Betrieb: 20 - 80%\nLuftfeuchtigkeit bei Lagerung: 5 - 95%\nMitgelieferte Kabel: USB Typ-C\nGer\u00e4tebreite (inkl. Fu\u00df): 321,4 mm\nGer\u00e4tetiefe (inkl. Fu\u00df): 15,2 mm\nGer\u00e4teh\u00f6he (inkl. Fu\u00df): 210 mm\nGewicht (mit St\u00e4nder): 640 g\nBreite (ohne Standfu\u00df): 32,1 cm\nTiefe (ohne Standfu\u00df): 1,52 cm\nH\u00f6he (ohne Standfu\u00df): 21 cm\nGewicht (ohne St\u00e4nder): 640 g\nVerpackungsbreite: 405 mm\nVerpackungstiefe: 61 mm\nVerpackungsh\u00f6he: 284 mm\nPaketgewicht: 1,54 kg\nNachhaltige Technologien und Materialien: Arsenfreies Bildschirmglas; Halogenarm; Quecksilberfreie Hintergrundbeleuchtung\nWarentarifnummer (HS): 85285210",
    "reference_file": "offer_reference_1723.json",
    "shop_name": "mylemon.at"
}