{
    "html_file": "offer_843_4.html",
    "name": "ASUS ROG Strix XG32UQ, 32\"",
    "offer_link": "https://www.proshop.at/Bildschirm/ASUS-32-Bildschirm-XG32UQ-Black-1-ms-AMD-FreeSync-2/3121158?utm_source=geizhals&utm_medium=cpc&utm_campaign=pricesite",
    "price": 1025.51,
    "raw_specifications": {
        "Abmessungen (Breite x Tiefe x H\u00f6he)": "72.818 cm x 27.993 cm x 53.987 cm - mit Fu\u00df",
        "Abmessungen (Breite x Tiefe x H\u00f6he) - mit Fu\u00df": "72.818 cm x 27.993 cm x 53.987 cm",
        "Adaptive-Sync Technologie": "AMD FreeSync Premium Pro",
        "Besonderheiten": "HDCP, Trace Free Technology, flimmerfreie Technologie, kompatibel mit NVIDIA G-SYNC, PBP, ASUS GameVisual Technology, verz\u00f6gerungsfreie Technologie, Ultra-Low Blue Light Technology, Monitorkalibrierung Delta E<2, Shadow Boost-Technologie, HDR 600, GamePlus, Display Widget",
        "Bildschirmtyp": "IPS",
        "Details zu Abmessungen & Gewicht": "Mit Fu\u00df - Breite: 72.818 cm - Tiefe: 27.993 cm - H\u00f6he: 53.987 cm - Gewicht: 8.9 kg  Ohne Fu\u00df - Breite: 72.818 cm - Tiefe: 8.712 cm - H\u00f6he: 42.852 cm - Gewicht: 5.77 kg",
        "Diagonalabmessung": "81.3 cm (32\")",
        "Display-Typ": "LED-hintergrundbeleuchteter LCD-Monitor / TFT-Aktivmatrix",
        "EAN": "4711081848028",
        "Eingangsanschl\u00fcsse": "2xHDMI, DisplayPort",
        "Eingangsspannung": "Wechselstrom 100-240 V (50/60 Hz)",
        "Einstellungen der Anzeigeposition": "H\u00f6he, Drehung, Neigung",
        "Energie Effizienzklasse": "Klasse F",
        "Energieklasse (HDR)": "Klasse G",
        "Enthaltene Kabel": "1 x USB-Kabel  1 x DisplayPort-Kabel  1 x HDMI-Kabel",
        "Farbraum": "130% sRGB, 96% DCI-P3",
        "Gaming": "Ja",
        "Ger\u00e4tetyp": "LED-hintergrundbeleuchteter LCD-Monitor - 81.3 cm (32\")",
        "Gewicht": "8.9 kg",
        "Helligkeit": "600 cd/m\u00b2",
        "Hersteller": "ASUS",
        "Hintergrundbeleuchtungs-Technologie": "LED-Hintergrundbeleuchtung",
        "Horizontale Bildwiederholrate": "30 - 350 kHz",
        "Horizontaler Betrachtungswinkel": "178",
        "H\u00f6heneinstellung": "80 mm",
        "Integrierte Peripherieger\u00e4te": "USB 3.2 Gen 1 Hub",
        "Kennzeichnung": "TUV Rheinland Low Blue Light Certification, TUV Rheinland Flicker Free Certification, DisplayPort 1.4",
        "Kontrast": "1000:1 / 1000000:1 (dynamisch)",
        "Leistungsmerkmale": "Slot f\u00fcr Sicherheitsschloss (Kabelschloss getrennt erh\u00e4ltlich)",
        "Modell": "90LM08B0-B01170",
        "Native Aufl\u00f6sung": "4K 3840 x 2160 bei 160 Hz",
        "Neigungswinkel": "-5/+20",
        "Pixelpitch": "0.1845 mm",
        "Produktbeschreibung": "ASUS XG32UQ - LED-Monitor - 4K - 81.3 cm (32\")",
        "Reaktionszeit": "1 ms (Gray-to-Gray)",
        "Schlosstyp zur Diebstahlsicherung": "Kensington Slot",
        "Schnittstellen": "DisplayPort  2 x HDMI  2 x USB 3.2 Gen 1  Kopfh\u00f6rer",
        "Schwenkwinkel": "40",
        "Seitenverh\u00e4ltnis": "16:9",
        "Spannung": "Wechselstrom 100-240 V (50/60 Hz)",
        "Stromverbrauch (Aus-Modus)": "0.3 Watt",
        "Stromverbrauch (typisch)": "35 Watt",
        "Stromverbrauch HDR (eingeschaltet)": "117 kWh/1.000 h",
        "Stromverbrauch SDR (eingeschaltet)": "33 kWh/1.000 h",
        "Transportbreite": "90 cm",
        "Transportgewicht": "13.2 kg",
        "Transporth\u00f6he": "52.6 cm",
        "Transporttiefe": "22.6 cm",
        "VESA-Halterung": "100 x 100 mm",
        "Vertikale Bildwiederholrate": "47 - 160 Hz",
        "Vertikaler Betrachtungswinkel": "178",
        "Waren-Nr.": "3121158",
        "Zubeh\u00f6r im Lieferumfang": "ROG-Tasche, Netzteil, ROG-Sticker",
        "Zum Hersteller": "www.asus.com/"
    },
    "raw_specifications_text": "Hersteller: ASUS\nWaren-Nr.: 3121158\nModell: 90LM08B0-B01170\nEAN: 4711081848028\nZum Hersteller: www.asus.com/\nProduktbeschreibung: ASUS XG32UQ - LED-Monitor - 4K - 81.3 cm (32\")\nGer\u00e4tetyp: LED-hintergrundbeleuchteter LCD-Monitor - 81.3 cm (32\")\nEnergie Effizienzklasse: Klasse F\nAdaptive-Sync Technologie: AMD FreeSync Premium Pro\nLeistungsmerkmale: Slot f\u00fcr Sicherheitsschloss (Kabelschloss getrennt erh\u00e4ltlich)\nBildschirmtyp: IPS\nSeitenverh\u00e4ltnis: 16:9\nNative Aufl\u00f6sung: 4K 3840 x 2160 bei 160 Hz\nPixelpitch: 0.1845 mm\nHelligkeit: 600 cd/m\u00b2\nKontrast: 1000:1 / 1000000:1 (dynamisch)\nReaktionszeit: 1 ms (Gray-to-Gray)\nGaming: Ja\nFarbraum: 130% sRGB, 96% DCI-P3\nEingangsanschl\u00fcsse: 2xHDMI, DisplayPort\nEinstellungen der Anzeigeposition: H\u00f6he, Drehung, Neigung\nSpannung: Wechselstrom 100-240 V (50/60 Hz)\nAbmessungen (Breite x Tiefe x H\u00f6he) - mit Fu\u00df: 72.818 cm x 27.993 cm x 53.987 cm\nGewicht: 8.9 kg\nKennzeichnung: TUV Rheinland Low Blue Light Certification, TUV Rheinland Flicker Free Certification, DisplayPort 1.4\nDisplay-Typ: LED-hintergrundbeleuchteter LCD-Monitor / TFT-Aktivmatrix\nEnergieklasse (HDR): Klasse G\nDiagonalabmessung: 81.3 cm (32\")\nIntegrierte Peripherieger\u00e4te: USB 3.2 Gen 1 Hub\nVertikale Bildwiederholrate: 47 - 160 Hz\nHorizontale Bildwiederholrate: 30 - 350 kHz\nHorizontaler Betrachtungswinkel: 178\nVertikaler Betrachtungswinkel: 178\nHintergrundbeleuchtungs-Technologie: LED-Hintergrundbeleuchtung\nBesonderheiten: HDCP, Trace Free Technology, flimmerfreie Technologie, kompatibel mit NVIDIA G-SYNC, PBP, ASUS GameVisual Technology, verz\u00f6gerungsfreie Technologie, Ultra-Low Blue Light Technology, Monitorkalibrierung Delta E<2, Shadow Boost-Technologie, HDR 600, GamePlus, Display Widget\nAbmessungen (Breite x Tiefe x H\u00f6he): 72.818 cm x 27.993 cm x 53.987 cm - mit Fu\u00df\nSchnittstellen: DisplayPort  2 x HDMI  2 x USB 3.2 Gen 1  Kopfh\u00f6rer\nNeigungswinkel: -5/+20\nSchwenkwinkel: 40\nH\u00f6heneinstellung: 80 mm\nVESA-Halterung: 100 x 100 mm\nZubeh\u00f6r im Lieferumfang: ROG-Tasche, Netzteil, ROG-Sticker\nEnthaltene Kabel: 1 x USB-Kabel  1 x DisplayPort-Kabel  1 x HDMI-Kabel\nSchlosstyp zur Diebstahlsicherung: Kensington Slot\nEingangsspannung: Wechselstrom 100-240 V (50/60 Hz)\nStromverbrauch SDR (eingeschaltet): 33 kWh/1.000 h\nStromverbrauch HDR (eingeschaltet): 117 kWh/1.000 h\nStromverbrauch (typisch): 35 Watt\nStromverbrauch (Aus-Modus): 0.3 Watt\nDetails zu Abmessungen & Gewicht: Mit Fu\u00df - Breite: 72.818 cm - Tiefe: 27.993 cm - H\u00f6he: 53.987 cm - Gewicht: 8.9 kg  Ohne Fu\u00df - Breite: 72.818 cm - Tiefe: 8.712 cm - H\u00f6he: 42.852 cm - Gewicht: 5.77 kg\nTransportbreite: 90 cm\nTransporttiefe: 22.6 cm\nTransporth\u00f6he: 52.6 cm\nTransportgewicht: 13.2 kg",
    "reference_file": "offer_reference_843.json",
    "shop_name": "Proshop.at"
}