{
    "html_file": "offer_2052_3.html",
    "name": "Fujitsu B-Line B27-9 TS QHD, 27\"",
    "offer_link": "https://www.amazon.de/dp/B0845RDVQ7?linkCode=xm2&camp=2025&creative=165953&smid=A3JWKAKR8XB7XF&creativeASIN=B0845RDVQ7&tag=geizhals1-21",
    "price": 311.79,
    "raw_specifications": {
        "ASIN": "B0845RDVQ7",
        "Amazon Bestseller-Rang": "Nr. 59,360 in Computer & Zubeh\u00f6r (Siehe Top 100 in Computer & Zubeh\u00f6r)  Nr. 1,148 in Monitore",
        "Anzahl USB 2.0 Schnittstellen": "\u200e1",
        "Artikelgewicht": "\u200e7,6 Kilograms",
        "Batterien enthalten": "\u200eNein",
        "Display-Gr\u00f6\u00dfe": "\u200e27 Zoll",
        "Durchschnittliche Kundenbewertung": "4,0  4,0 von 5 Sternen    \n    1 Sternebewertung   \n\n\n 4,0 von 5 Sternen",
        "Farbe": "\u200eSchwarz",
        "Garantierte Software-Updates bis": "\u200eunbekannt",
        "Hersteller": "\u200eFTS - DISPLAY",
        "Im Angebot von Amazon.de seit": "23. Januar 2020",
        "Marke": "\u200eFujitsu",
        "Modellnummer": "\u200eS26361-K1694-V160",
        "Produktabmessungen": "\u200e10 x 48 x 50 cm; 7,6 Kilogramm",
        "Volt": "\u200e3.6",
        "Watt": "\u200e45.5 Watt"
    },
    "raw_specifications_text": "Marke: \u200eFujitsu\nHersteller: \u200eFTS - DISPLAY\nProduktabmessungen: \u200e10 x 48 x 50 cm; 7,6 Kilogramm\nModellnummer: \u200eS26361-K1694-V160\nFarbe: \u200eSchwarz\nDisplay-Gr\u00f6\u00dfe: \u200e27 Zoll\nAnzahl USB 2.0 Schnittstellen: \u200e1\nVolt: \u200e3.6\nWatt: \u200e45.5 Watt\nBatterien enthalten: \u200eNein\nArtikelgewicht: \u200e7,6 Kilograms\nGarantierte Software-Updates bis: \u200eunbekannt\nASIN: B0845RDVQ7\nDurchschnittliche Kundenbewertung: 4,0  4,0 von 5 Sternen    \n    1 Sternebewertung   \n\n\n 4,0 von 5 Sternen\nAmazon Bestseller-Rang: Nr. 59,360 in Computer & Zubeh\u00f6r (Siehe Top 100 in Computer & Zubeh\u00f6r)  Nr. 1,148 in Monitore\nIm Angebot von Amazon.de seit: 23. Januar 2020",
    "reference_file": "offer_reference_2052.json",
    "shop_name": "Amazon.at"
}