{
    "html_file": "offer_1075_11.html",
    "name": "BenQ Zowie XL2746K, 27\"",
    "offer_link": "https://www.future-x.at/benq-zowie-xl2746k-led-monitor-68-6-cm-27-1920-x-1080-full-hd-1080p-%40-240-hz-tn-320-cd-m%B2-1000%3A1-3xhdmi-displayport-p-9011121/?pv=2",
    "price": 656.29,
    "raw_specifications": {
        "Abmessungen (Breite x Tiefe x H\u00f6he)": "62,86 cm x 21,79 cm x 56,22 cm - mit Standfu\u00df (h\u00f6chste Position)",
        "Besonderheiten": "Black eQualizer, K Locker, Color Vibrance, DyAc Technology, Fast Liquid Crystal, XL Setting to Share",
        "Bildschirmtyp": "TN",
        "Details zu Abmessungen & Gewicht": "Mit Standfu\u00df (h\u00f6chste Position) - Breite: 62,86 cm - Tiefe: 21,79 cm - H\u00f6he: 56,22 cm - Gewicht: 8,8 kg \u00a6 Mit Standfu\u00df (niedrigste Position) - Breite: 62,86 cm - Tiefe: 21,79 cm - H\u00f6he: 40,72 cm - Gewicht: 8,8 kg \u00a6 Mit Wandhalterung - Breite: 62,86 cm - Tiefe: 6,45 cm - H\u00f6he: 36,9 cm",
        "Diagonalabmessung": "68,6 cm (27\")",
        "Display-Typ": "LED-hintergrundbeleuchteter LCD-Monitor / TFT-Aktivmatrix",
        "Eingangsspannung": "Wechselstrom 100-240 V",
        "Einstellungen der Anzeigeposition": "H\u00f6he, Pivot (Rotation), Drehung, Neigung",
        "Energie Effizienzklasse": "Klasse F",
        "Enthaltene Kabel": "1 x DisplayPort 1.2-Kabel - 1.8 m",
        "Gewicht": "8,8 kg",
        "Helligkeit": "320 cd/m\u00b2",
        "Hintergrundbeleuchtungs-Technologie": "LED-Hintergrundbeleuchtung",
        "H\u00f6heneinstellung": "155 mm",
        "Kontrast": "1000:1",
        "Native Aufl\u00f6sung": "Full HD (1080p) 1920 x 1080 bei 240 Hz",
        "Neigungswinkel": "-5/+23",
        "Pixelpitch": "0.311 mm",
        "Rotationswinkel": "90",
        "Schnittstellen": "3 x HDMI \u00a6 DisplayPort 1.2 \u00a6 Kopfh\u00f6rer",
        "Schwenkwinkel": "90",
        "Seitenverh\u00e4ltnis": "16:9",
        "Stromverbrauch (typisch)": "40 Watt",
        "Stromverbrauch SDR (eingeschaltet)": "22.8 kWh/1.000 h",
        "Transportgewicht": "12,7 kg",
        "VESA-Halterung": "100 x 100 mm",
        "Zubeh\u00f6r im Lieferumfang": "S Switch, Schutz, dust cover"
    },
    "raw_specifications_text": "Display-Typ: LED-hintergrundbeleuchteter LCD-Monitor / TFT-Aktivmatrix\nEnergie Effizienzklasse: Klasse F\nDiagonalabmessung: 68,6 cm (27\")\nBildschirmtyp: TN\nSeitenverh\u00e4ltnis: 16:9\nNative Aufl\u00f6sung: Full HD (1080p) 1920 x 1080 bei 240 Hz\nPixelpitch: 0.311 mm\nHelligkeit: 320 cd/m\u00b2\nKontrast: 1000:1\nHintergrundbeleuchtungs-Technologie: LED-Hintergrundbeleuchtung\nBesonderheiten: Black eQualizer, K Locker, Color Vibrance, DyAc Technology, Fast Liquid Crystal, XL Setting to Share\nAbmessungen (Breite x Tiefe x H\u00f6he): 62,86 cm x 21,79 cm x 56,22 cm - mit Standfu\u00df (h\u00f6chste Position)\nGewicht: 8,8 kg\nSchnittstellen: 3 x HDMI \u00a6 DisplayPort 1.2 \u00a6 Kopfh\u00f6rer\nEinstellungen der Anzeigeposition: H\u00f6he, Pivot (Rotation), Drehung, Neigung\nNeigungswinkel: -5/+23\nSchwenkwinkel: 90\nRotationswinkel: 90\nH\u00f6heneinstellung: 155 mm\nVESA-Halterung: 100 x 100 mm\nZubeh\u00f6r im Lieferumfang: S Switch, Schutz, dust cover\nEnthaltene Kabel: 1 x DisplayPort 1.2-Kabel - 1.8 m\nEingangsspannung: Wechselstrom 100-240 V\nStromverbrauch SDR (eingeschaltet): 22.8 kWh/1.000 h\nStromverbrauch (typisch): 40 Watt\nDetails zu Abmessungen & Gewicht: Mit Standfu\u00df (h\u00f6chste Position) - Breite: 62,86 cm - Tiefe: 21,79 cm - H\u00f6he: 56,22 cm - Gewicht: 8,8 kg \u00a6 Mit Standfu\u00df (niedrigste Position) - Breite: 62,86 cm - Tiefe: 21,79 cm - H\u00f6he: 40,72 cm - Gewicht: 8,8 kg \u00a6 Mit Wandhalterung - Breite: 62,86 cm - Tiefe: 6,45 cm - H\u00f6he: 36,9 cm\nTransportgewicht: 12,7 kg",
    "reference_file": "offer_reference_1075.json",
    "shop_name": "Future-X.at"
}