{
    "html_file": "offer_2504_4.html",
    "name": "AOC M2470SWH, 23.6\"",
    "offer_link": "https://www.proshop.at/Bildschirm/AOC-24-Bildschirm-Value-M2470SWH-Speakers-Black-5-ms/2492745?utm_source=geizhals&utm_medium=cpc&utm_campaign=pricesite",
    "price": 96.98,
    "raw_specifications": {
        "Abmessungen (Breite x Tiefe x H\u00f6he)": "55.14 cm x 22.1 cm x 40.04 cm - mit Fu\u00df",
        "Abmessungen (Breite x Tiefe x H\u00f6he) - mit Fu\u00df": "55.14 cm x 22.1 cm x 40.04 cm",
        "Besonderheiten": "HDCP, i-Menu, e-Saver-Technologie, Screen+, i-Care",
        "Bildschirmtyp": "MVA",
        "Diagonalabmessung": "59.9 cm (23.6\")",
        "Display-Typ": "LED-hintergrundbeleuchteter LCD-Monitor / TFT-Aktivmatrix",
        "EAN": "4038986144995",
        "ENERGY STAR zertifiziert": "Ja",
        "Eingangsanschl\u00fcsse": "2xHDMI, VGA",
        "Eingangsspannung": "AC 100/230 V (50/60 Hz)",
        "Energie Effizienzklasse": "Klasse F",
        "Energierverbrauch Sleep": "0.19 Watt",
        "Enthaltene Kabel": "1 x VGA-Kabel  1 x HDMI-Kabel  1 x Stromkabel",
        "Farbe": "Schwarz",
        "Ger\u00e4tetyp": "LED-hintergrundbeleuchteter LCD-Monitor - 59.9 cm (23.6\")",
        "Gewicht": "3.58 kg",
        "Helligkeit": "250 cd/m\u00b2",
        "Hersteller": "AOC",
        "Hintergrundbeleuchtungs-Technologie": "WLED",
        "Horizontale Bildwiederholrate": "30 - 83 kHz",
        "Horizontaler Betrachtungswinkel": "178",
        "Kennzeichnung": "Plug and Play, TUV GS, FCC, RoHS, TUV Bauart, EAC",
        "Kontrast": "1000:1 / 50000000:1 (dynamisch)",
        "Lautsprecher": "Integriert",
        "Leistungsaufnahme im Ein-Zustand": "19.8 W",
        "Leistungsmerkmale": "Unterst\u00fctzung f\u00fcr VESA-Schnittstelle",
        "Modell": "M2470SWH",
        "Native Aufl\u00f6sung": "Full HD (1080p) 1920 x 1080 bei 60 Hz",
        "Neigungswinkel": "-5/+25",
        "OSD-Sprachen": "Tschechisch, Chinesisch (tradionell), Chinesisch (vereinfacht), Englisch, Deutsch, Franz\u00f6sisch, Italienisch, Portugiesisch, Finnisch, Schwedisch, Russisch, Spanisch, Holl\u00e4ndisch, Japanisch, Koreanisch",
        "Pixelpitch": "0.2715 mm",
        "Produktbeschreibung": "AOC M2470SWH - LED-Monitor - Full HD (1080p) - 59.9 cm (23.6\")",
        "Schnittstellen": "VGA  2 x HDMI  Kopfh\u00f6rer",
        "Seitenverh\u00e4ltnis": "16:9",
        "Spannung": "AC 100/230 V (50/60 Hz)",
        "Spannungsversorgung": "Intern",
        "Steuerelemente und Einstellungen": "Neigbar",
        "Stromverbrauch (Aus-Modus)": "0.3 Watt",
        "Stromverbrauch (typisch)": "17.96 Watt",
        "Stromverbrauch SDR (eingeschaltet)": "19.8 kWh/1.000 h",
        "Stromverbrauch im Standby-Modus": "0.3 Watt",
        "Typ": "Lautsprecher - Stereo - integriert",
        "Umweltschutzstandards": "ENERGY STAR-qualifiziert",
        "VESA-Halterung": "100 x 100 mm",
        "Vertikale Bildwiederholrate": "50 - 76 Hz",
        "Vertikaler Betrachtungswinkel": "178",
        "Videobandbreite": "165 MHz",
        "Waren-Nr.": "2492745",
        "Zum Hersteller": "www.aoc.com"
    },
    "raw_specifications_text": "Hersteller: AOC\nWaren-Nr.: 2492745\nModell: M2470SWH\nEAN: 4038986144995\nZum Hersteller: www.aoc.com\nProduktbeschreibung: AOC M2470SWH - LED-Monitor - Full HD (1080p) - 59.9 cm (23.6\")\nGer\u00e4tetyp: LED-hintergrundbeleuchteter LCD-Monitor - 59.9 cm (23.6\")\nEnergie Effizienzklasse: Klasse F\nLeistungsaufnahme im Ein-Zustand: 19.8 W\nBildschirmtyp: MVA\nSeitenverh\u00e4ltnis: 16:9\nNative Aufl\u00f6sung: Full HD (1080p) 1920 x 1080 bei 60 Hz\nPixelpitch: 0.2715 mm\nHelligkeit: 250 cd/m\u00b2\nKontrast: 1000:1 / 50000000:1 (dynamisch)\nEingangsanschl\u00fcsse: 2xHDMI, VGA\nLautsprecher: Integriert\nSpannung: AC 100/230 V (50/60 Hz)\nFarbe: Schwarz\nAbmessungen (Breite x Tiefe x H\u00f6he) - mit Fu\u00df: 55.14 cm x 22.1 cm x 40.04 cm\nGewicht: 3.58 kg\nUmweltschutzstandards: ENERGY STAR-qualifiziert\nKennzeichnung: Plug and Play, TUV GS, FCC, RoHS, TUV Bauart, EAC\nDisplay-Typ: LED-hintergrundbeleuchteter LCD-Monitor / TFT-Aktivmatrix\nDiagonalabmessung: 59.9 cm (23.6\")\nVertikale Bildwiederholrate: 50 - 76 Hz\nHorizontale Bildwiederholrate: 30 - 83 kHz\nVideobandbreite: 165 MHz\nHorizontaler Betrachtungswinkel: 178\nVertikaler Betrachtungswinkel: 178\nHintergrundbeleuchtungs-Technologie: WLED\nSteuerelemente und Einstellungen: Neigbar\nOSD-Sprachen: Tschechisch, Chinesisch (tradionell), Chinesisch (vereinfacht), Englisch, Deutsch, Franz\u00f6sisch, Italienisch, Portugiesisch, Finnisch, Schwedisch, Russisch, Spanisch, Holl\u00e4ndisch, Japanisch, Koreanisch\nBesonderheiten: HDCP, i-Menu, e-Saver-Technologie, Screen+, i-Care\nAbmessungen (Breite x Tiefe x H\u00f6he): 55.14 cm x 22.1 cm x 40.04 cm - mit Fu\u00df\nTyp: Lautsprecher - Stereo - integriert\nSchnittstellen: VGA  2 x HDMI  Kopfh\u00f6rer\nNeigungswinkel: -5/+25\nVESA-Halterung: 100 x 100 mm\nLeistungsmerkmale: Unterst\u00fctzung f\u00fcr VESA-Schnittstelle\nEnthaltene Kabel: 1 x VGA-Kabel  1 x HDMI-Kabel  1 x Stromkabel\nSpannungsversorgung: Intern\nEingangsspannung: AC 100/230 V (50/60 Hz)\nStromverbrauch SDR (eingeschaltet): 19.8 kWh/1.000 h\nStromverbrauch (typisch): 17.96 Watt\nStromverbrauch im Standby-Modus: 0.3 Watt\nEnergierverbrauch Sleep: 0.19 Watt\nStromverbrauch (Aus-Modus): 0.3 Watt\nENERGY STAR zertifiziert: Ja",
    "reference_file": "offer_reference_2504.json",
    "shop_name": "Proshop.at"
}