{
    "html_file": "offer_1546_40.html",
    "name": "HP Z27u G3, 27\"",
    "offer_link": "https://www.alternate.at/HP/Z27u-G3-LED-Monitor/html/product/1832415?partner=AtGeizhalsat&campaign=Monitor/HP/1832415",
    "price": 521.0,
    "raw_specifications": {
        "": "Kensington-Schloss",
        "Abmessungen": "Breite: 612,3 mm x H\u00f6he: 356,1 mm x Tiefe/L\u00e4nge: 38,9 mm",
        "Anschl\u00fcsse": "1x HDMI-Eingang, (HDMI-Version: 2.0), 1x DisplayPort-Eingang, 1x DisplayPort-Ausgang, (DisplayPort-Version: 1.4), 4x USB-A-3.2 Gen 1 (5 Gbit/s), 1x USB-C 3.2 Gen 1 (5 Gbit/s), 1x RJ 45",
        "Bild": "Format",
        "Bildschirmaufl\u00f6sung": "2.560 x 1.440 Pixel",
        "Bildschirmdiagonale": "69 cm (27 Zoll)",
        "EAN": "0195122252458",
        "Energieeffizienzklasse (SDR)": "F (A - G)",
        "Energieverbauch pro 1000 Stunden (SDR)": "24 kWh",
        "Ergonomie": "Typ",
        "Farbe": "schwarz/silber",
        "Features": "100 Watt USB-C PD Funktion, Flimmerfreie LEDs",
        "Frequenz": "Vertikal",
        "Gewicht": "6,2 kg",
        "Hersteller-Nr.": "1B9X2AA#ABB",
        "Leistungsaufnahme im Bereitschafts- und Aus-Zustand": "0,2 Watt",
        "Leistungsaufnahme im Ein-Zustand bei Standard-Dynamikumfang (SDR)": "23,7 Watt",
        "Standards": "Video",
        "Stromversorgung": "Eco-Off",
        "Typ": "LED-Monitor",
        "Wandhalterung": "VESA kompatibel (100 x 100 mm)",
        "Zubeh\u00f6r": "Vorhanden"
    },
    "raw_specifications_text": "Energieeffizienzklasse (SDR): F (A - G)\nEnergieverbauch pro 1000 Stunden (SDR): 24 kWh\nLeistungsaufnahme im Ein-Zustand bei Standard-Dynamikumfang (SDR): 23,7 Watt\nLeistungsaufnahme im Bereitschafts- und Aus-Zustand: 0,2 Watt\nBildschirmdiagonale: 69 cm (27 Zoll)\nBildschirmaufl\u00f6sung: 2.560 x 1.440 Pixel\nTyp: LED-Monitor\nFarbe: schwarz/silber\nEAN: 0195122252458\nHersteller-Nr.: 1B9X2AA#ABB\nBild: Format\n: Kensington-Schloss\nFrequenz: Vertikal\nAnschl\u00fcsse: 1x HDMI-Eingang, (HDMI-Version: 2.0), 1x DisplayPort-Eingang, 1x DisplayPort-Ausgang, (DisplayPort-Version: 1.4), 4x USB-A-3.2 Gen 1 (5 Gbit/s), 1x USB-C 3.2 Gen 1 (5 Gbit/s), 1x RJ 45\nErgonomie: Typ\nStromversorgung: Eco-Off\nStandards: Video\nWandhalterung: VESA kompatibel (100 x 100 mm)\nFeatures: 100 Watt USB-C PD Funktion, Flimmerfreie LEDs\nZubeh\u00f6r: Vorhanden\nAbmessungen: Breite: 612,3 mm x H\u00f6he: 356,1 mm x Tiefe/L\u00e4nge: 38,9 mm\nGewicht: 6,2 kg",
    "reference_file": "offer_reference_1546.json",
    "shop_name": "Alternate.at"
}