{
    "html_file": "offer_1978_10.html",
    "name": "Lenovo ThinkVision T24h-20, 23.8\"",
    "offer_link": "https://www.proshop.at/Bildschirm/Lenovo-Bildschirm-ThinkVision-T24h-20-2560x1440-60Hz-IPS-USB-C/2860005?utm_source=geizhals&utm_medium=cpc&utm_campaign=pricesite",
    "price": 244.42,
    "raw_specifications": {
        "Abmessungen (Breite x Tiefe x H\u00f6he)": "57 cm x 20.5 cm x 53.98 cm - mit Fu\u00df",
        "Abmessungen (Breite x Tiefe x H\u00f6he) - mit Fu\u00df": "57 cm x 20.5 cm x 53.98 cm",
        "Besonderheiten": "Augenkomfort-Modus",
        "Bildschirmbeschichtung": "Blendfrei",
        "Bildschirmtyp": "IPS",
        "Details zu Abmessungen & Gewicht": "Mit Fu\u00df - Breite: 57 cm - Tiefe: 20.5 cm - H\u00f6he: 53.98 cm - Gewicht: 6.18 kg  Ohne Fu\u00df - Breite: 53.98 cm - Tiefe: 4.46 cm - H\u00f6he: 32.57 cm - Gewicht: 3.85 kg",
        "Diagonalabmessung": "61 cm (24\")",
        "Display-Typ": "LED-hintergrundbeleuchteter LCD-Monitor",
        "EAN": "0194552419042",
        "ENERGY STAR zertifiziert": "Ja",
        "ENERGY STAR-Version": "8.0",
        "EPEAT-kompatibel": "EPEAT Silver",
        "Eingangsanschl\u00fcsse": "HDMI, DisplayPort, USB-C",
        "Eingangsspannung": "Wechselstrom 120/230 V (50/60 Hz)",
        "Einstellungen der Anzeigeposition": "H\u00f6he, Pivot (Rotation), Drehung, Neigung",
        "Energie Effizienzklasse": "Klasse F",
        "Energierverbrauch Sleep": "0.5 Watt",
        "Energieverbrauch pro Jahr": "53.37 kWh",
        "Enthaltene Kabel": "1 x Kabel USB-C auf USB-C - 1.8 m",
        "Entwickelt f\u00fcr": "ThinkPad P15 Gen 2 20YQ",
        "Farbe": "Raven Black",
        "Farbraum": "99%",
        "Farbunterst\u00fctzung": "16,7 Millionen Farben",
        "Ger\u00e4tetyp": "LED-hintergrundbeleuchteter LCD-Monitor - 61 cm (24\")",
        "Gewicht": "6.18 kg",
        "Helligkeit": "300 cd/m\u00b2",
        "Hersteller": "Lenovo",
        "Hintergrundbeleuchtungs-Technologie": "WLED",
        "Horizontaler Betrachtungswinkel": "178",
        "H\u00f6heneinstellung": "150 mm",
        "Integrierte Peripherieger\u00e4te": "USB 3.0-Hub",
        "Kennzeichnung": "CCC, DisplayPort 1.2, TUV Rheinland Eye Comfort Certification, China Energy standard Tier 1, EU RoHS 2002/95/EC",
        "Kontrast": "1000:1 / 3000000:1 (dynamisch)",
        "Leistungsaufnahme im Ein-Zustand": "20 W",
        "Leistungsmerkmale": "Slot f\u00fcr Sicherheitsschloss (Kabelschloss getrennt erh\u00e4ltlich), integrierte Kabelf\u00fchrung",
        "Lokalisierung": "Englisch / Europa",
        "Modell": "61F0GAT1EU",
        "Native Aufl\u00f6sung": "QHD 2560 x 1440 bei 60 Hz",
        "Neigungswinkel": "-5/+35",
        "Pixelpitch": "0.2058 mm",
        "Produktbeschreibung": "Lenovo ThinkVision T24h-20 - LED-Monitor - 61 cm (24\")",
        "Reaktionszeit": "14 ms, 6 ms, 4 ms (extremer Modus)",
        "Rotationswinkel": "180",
        "Schlosstyp zur Diebstahlsicherung": "Kensington Slot",
        "Schnittstellen": "USB-C 3.1 Gen 1 Upstream/DisplayPort Alt Mode  HDMI  DisplayPort  4 x USB 3.1 Gen 1 Downstream  Audio Line-Out",
        "Schwenkwinkel": "90",
        "Seitenverh\u00e4ltnis": "16:9",
        "Spannung": "Wechselstrom 120/230 V (50/60 Hz)",
        "Stromverbrauch (Aus-Modus)": "0.3 Watt",
        "Stromverbrauch (typisch)": "23 Watt",
        "Stromverbrauch SDR (eingeschaltet)": "20 kWh/1.000 h",
        "TCO-zertifiziert": "TCO Certified Displays 8, TCO Certified Edge Displays",
        "Transportbreite": "62 cm",
        "Transportgewicht": "8.1 kg",
        "Transporth\u00f6he": "42.3 cm",
        "Transporttiefe": "14.9 cm",
        "Umweltschutzstandards": "TCO Certified Displays 8, TCO Certified Edge Displays, ENERGY STAR-qualifiziert EPEAT Silver",
        "VESA-Halterung": "100 x 100 mm",
        "Vertikaler Betrachtungswinkel": "178",
        "Waren-Nr.": "2860005",
        "Zum Hersteller": "lenovo.com"
    },
    "raw_specifications_text": "Hersteller: Lenovo\nWaren-Nr.: 2860005\nModell: 61F0GAT1EU\nEAN: 0194552419042\nZum Hersteller: lenovo.com\nProduktbeschreibung: Lenovo ThinkVision T24h-20 - LED-Monitor - 61 cm (24\")\nGer\u00e4tetyp: LED-hintergrundbeleuchteter LCD-Monitor - 61 cm (24\")\nEnergie Effizienzklasse: Klasse F\nEnergieverbrauch pro Jahr: 53.37 kWh\nLeistungsaufnahme im Ein-Zustand: 20 W\nLeistungsmerkmale: Slot f\u00fcr Sicherheitsschloss (Kabelschloss getrennt erh\u00e4ltlich), integrierte Kabelf\u00fchrung\nBildschirmtyp: IPS\nSeitenverh\u00e4ltnis: 16:9\nNative Aufl\u00f6sung: QHD 2560 x 1440 bei 60 Hz\nPixelpitch: 0.2058 mm\nHelligkeit: 300 cd/m\u00b2\nKontrast: 1000:1 / 3000000:1 (dynamisch)\nReaktionszeit: 14 ms, 6 ms, 4 ms (extremer Modus)\nFarbunterst\u00fctzung: 16,7 Millionen Farben\nFarbraum: 99%\nEingangsanschl\u00fcsse: HDMI, DisplayPort, USB-C\nEinstellungen der Anzeigeposition: H\u00f6he, Pivot (Rotation), Drehung, Neigung\nBildschirmbeschichtung: Blendfrei\nSpannung: Wechselstrom 120/230 V (50/60 Hz)\nFarbe: Raven Black\nAbmessungen (Breite x Tiefe x H\u00f6he) - mit Fu\u00df: 57 cm x 20.5 cm x 53.98 cm\nGewicht: 6.18 kg\nLokalisierung: Englisch / Europa\nUmweltschutzstandards: TCO Certified Displays 8, TCO Certified Edge Displays, ENERGY STAR-qualifiziert EPEAT Silver\nKennzeichnung: CCC, DisplayPort 1.2, TUV Rheinland Eye Comfort Certification, China Energy standard Tier 1, EU RoHS 2002/95/EC\nEntwickelt f\u00fcr: ThinkPad P15 Gen 2 20YQ\nDisplay-Typ: LED-hintergrundbeleuchteter LCD-Monitor\nDiagonalabmessung: 61 cm (24\")\nIntegrierte Peripherieger\u00e4te: USB 3.0-Hub\nHorizontaler Betrachtungswinkel: 178\nVertikaler Betrachtungswinkel: 178\nHintergrundbeleuchtungs-Technologie: WLED\nBesonderheiten: Augenkomfort-Modus\nAbmessungen (Breite x Tiefe x H\u00f6he): 57 cm x 20.5 cm x 53.98 cm - mit Fu\u00df\nSchnittstellen: USB-C 3.1 Gen 1 Upstream/DisplayPort Alt Mode  HDMI  DisplayPort  4 x USB 3.1 Gen 1 Downstream  Audio Line-Out\nNeigungswinkel: -5/+35\nSchwenkwinkel: 90\nRotationswinkel: 180\nH\u00f6heneinstellung: 150 mm\nVESA-Halterung: 100 x 100 mm\nEnthaltene Kabel: 1 x Kabel USB-C auf USB-C - 1.8 m\nSchlosstyp zur Diebstahlsicherung: Kensington Slot\nEingangsspannung: Wechselstrom 120/230 V (50/60 Hz)\nStromverbrauch SDR (eingeschaltet): 20 kWh/1.000 h\nStromverbrauch (typisch): 23 Watt\nEnergierverbrauch Sleep: 0.5 Watt\nStromverbrauch (Aus-Modus): 0.3 Watt\nDetails zu Abmessungen & Gewicht: Mit Fu\u00df - Breite: 57 cm - Tiefe: 20.5 cm - H\u00f6he: 53.98 cm - Gewicht: 6.18 kg  Ohne Fu\u00df - Breite: 53.98 cm - Tiefe: 4.46 cm - H\u00f6he: 32.57 cm - Gewicht: 3.85 kg\nTransportbreite: 62 cm\nTransporttiefe: 14.9 cm\nTransporth\u00f6he: 42.3 cm\nTransportgewicht: 8.1 kg\nTCO-zertifiziert: TCO Certified Displays 8, TCO Certified Edge Displays\nEPEAT-kompatibel: EPEAT Silver\nENERGY STAR zertifiziert: Ja\nENERGY STAR-Version: 8.0",
    "reference_file": "offer_reference_1978.json",
    "shop_name": "Proshop.at"
}