{
    "html_file": "offer_1270_22.html",
    "name": "GIGABYTE AORUS FO48U, 47.53\"",
    "offer_link": "https://www.taufnaus.de/product/10607929",
    "price": 1140.1,
    "raw_specifications": {
        "Abmessungen (Breite x Tiefe x H\u00f6he)": "106.85 cm x 25.11 cm x 67.51 cm - mit Fu\u00df",
        "Adaptive-Sync Technologie": "AMD FreeSync Premium",
        "Ausgangsleistung/Kanal": "15 Watt",
        "Besonderheiten": "Bild in Bild, Bild f\u00fcr Bild, Black eQualizer, flimmerfreie Technologie, Crosshair Display, mit Game-Timer, 6-Achsen-Farbkontrolle, 10-bit Farbtiefe, AORUS Aim Stabilizer, FPS-Counter, High Bit Rate 3 (HBR3), AORUS Dashboard, AORUS OSD Sidekick, Space Audio",
        "Bildschirmbeschichtung": "Entspiegelt",
        "Details zu Abmessungen & Gewicht": "Mit Fu\u00df - Breite: 106.85 cm - Tiefe: 25.11 cm - H\u00f6he: 67.51 cm - Gewicht: 15 kg \u00a6 Ohne Fu\u00df - Breite: 106.85 cm - Tiefe: 4.31 cm - H\u00f6he: 61.18 cm - Gewicht: 14.7 kg",
        "Diagonalabmessung": "120.7 cm (47.53\")",
        "Display-Typ": "OLED-Monitor / OLED",
        "Eingangsspannung": "Wechselstrom 100-240 V",
        "Energie Effizienzklasse": "Klasse G",
        "Energieklasse (HDR)": "Klasse G",
        "Enthaltene Kabel": "1 x DisplayPort-Kabel \u00a6 1 x USB-Kabel \u00a6 1 x HDMI-Kabel \u00a6 1 x Stromkabel",
        "Farbraum": "130% sRGB, 98% DCI-P3",
        "Gewicht": "15 kg",
        "HDR-Format": "HDR10, HLG",
        "Helligkeit": "900 cd/m\u00b2",
        "Horizontaler Betrachtungswinkel": "178",
        "Integrierte Peripherieger\u00e4te": "USB 3.0-Hub",
        "Kennzeichnung": "DisplayPort 1.4",
        "Kontrast": "135000:1",
        "Leistungsmerkmale": "Slot f\u00fcr Sicherheitsschloss (Kabelschloss getrennt erh\u00e4ltlich)",
        "Native Aufl\u00f6sung": "4K 3840 x 2160 bei 120 Hz",
        "Pixelpitch": "0.274 mm",
        "Reaktionszeit": "1 ms (Gray-to-Gray)",
        "Schlosstyp zur Diebstahlsicherung": "Kensington Slot",
        "Schnittstellen": "2 x HDMI \u00a6 DisplayPort 1.4 \u00a6 2 x USB 3.0 Downstream \u00a6 Kopfh\u00f6rer \u00a6 USB 3.0 Upstream \u00a6 Audio Line-Out \u00a6 USB-C (KVM-Option)",
        "Service und Support": "Begrenzte Garantie - 3 Jahre",
        "Stromverbrauch (Aus-Modus)": "0.3 Watt",
        "Stromverbrauch (typisch)": "325 Watt",
        "Stromverbrauch HDR (eingeschaltet)": "85 kWh/1.000 h",
        "Stromverbrauch SDR (eingeschaltet)": "85 kWh/1.000 h",
        "Stromverbrauch im Standby-Modus": "0.5 Watt",
        "Transportbreite": "1.18 m",
        "Transportgewicht": "20.8 kg",
        "Transporth\u00f6he": "76 cm",
        "Transporttiefe": "16 cm",
        "Typ": "Lautsprecher mit Subwoofer - Stereo mit Subwoofer",
        "VESA-Halterung": "300 x 300 mm",
        "Vertikaler Betrachtungswinkel": "178"
    },
    "raw_specifications_text": "Display-Typ: OLED-Monitor / OLED\nEnergie Effizienzklasse: Klasse G\nEnergieklasse (HDR): Klasse G\nDiagonalabmessung: 120.7 cm (47.53\")\nAdaptive-Sync Technologie: AMD FreeSync Premium\nIntegrierte Peripherieger\u00e4te: USB 3.0-Hub\nNative Aufl\u00f6sung: 4K 3840 x 2160 bei 120 Hz\nPixelpitch: 0.274 mm\nHelligkeit: 900 cd/m\u00b2\nKontrast: 135000:1\nHDR-Format: HDR10, HLG\nFarbraum: 130% sRGB, 98% DCI-P3\nReaktionszeit: 1 ms (Gray-to-Gray)\nHorizontaler Betrachtungswinkel: 178\nVertikaler Betrachtungswinkel: 178\nBildschirmbeschichtung: Entspiegelt\nBesonderheiten: Bild in Bild, Bild f\u00fcr Bild, Black eQualizer, flimmerfreie Technologie, Crosshair Display, mit Game-Timer, 6-Achsen-Farbkontrolle, 10-bit Farbtiefe, AORUS Aim Stabilizer, FPS-Counter, High Bit Rate 3 (HBR3), AORUS Dashboard, AORUS OSD Sidekick, Space Audio\nAbmessungen (Breite x Tiefe x H\u00f6he): 106.85 cm x 25.11 cm x 67.51 cm - mit Fu\u00df\nGewicht: 15 kg\nTyp: Lautsprecher mit Subwoofer - Stereo mit Subwoofer\nAusgangsleistung/Kanal: 15 Watt\nSchnittstellen: 2 x HDMI \u00a6 DisplayPort 1.4 \u00a6 2 x USB 3.0 Downstream \u00a6 Kopfh\u00f6rer \u00a6 USB 3.0 Upstream \u00a6 Audio Line-Out \u00a6 USB-C (KVM-Option)\nVESA-Halterung: 300 x 300 mm\nLeistungsmerkmale: Slot f\u00fcr Sicherheitsschloss (Kabelschloss getrennt erh\u00e4ltlich)\nEnthaltene Kabel: 1 x DisplayPort-Kabel \u00a6 1 x USB-Kabel \u00a6 1 x HDMI-Kabel \u00a6 1 x Stromkabel\nKennzeichnung: DisplayPort 1.4\nSchlosstyp zur Diebstahlsicherung: Kensington Slot\nEingangsspannung: Wechselstrom 100-240 V\nStromverbrauch SDR (eingeschaltet): 85 kWh/1.000 h\nStromverbrauch HDR (eingeschaltet): 85 kWh/1.000 h\nStromverbrauch (typisch): 325 Watt\nStromverbrauch im Standby-Modus: 0.5 Watt\nStromverbrauch (Aus-Modus): 0.3 Watt\nDetails zu Abmessungen & Gewicht: Mit Fu\u00df - Breite: 106.85 cm - Tiefe: 25.11 cm - H\u00f6he: 67.51 cm - Gewicht: 15 kg \u00a6 Ohne Fu\u00df - Breite: 106.85 cm - Tiefe: 4.31 cm - H\u00f6he: 61.18 cm - Gewicht: 14.7 kg\nTransportbreite: 1.18 m\nTransporttiefe: 16 cm\nTransporth\u00f6he: 76 cm\nTransportgewicht: 20.8 kg\nService und Support: Begrenzte Garantie - 3 Jahre",
    "reference_file": "offer_reference_1270.json",
    "shop_name": "TaufNaus"
}