{
    "html_file": "offer_623_1.html",
    "name": "Acer CB2 CBA322QUsmiiprzx, 31.5\"",
    "offer_link": "https://www.mylemon.at/artikel/acer/um_jb2ee_001/cba322qu-monitor-80-cm-31.html",
    "price": 297.99,
    "raw_specifications": {
        "Anzahl HDMI-Anschl\u00fcsse": "1",
        "Artikelnummer": "M1IY9WYL",
        "Aufl\u00f6sung": "2560x1440",
        "Besonderheiten": "75 Hz, Lautsprecher, USB HUB",
        "Bildschirmdiagonale": "80 cm (31.5\")",
        "Bildschirmform": "Flach",
        "Bildschirmtechnologie": "LCD",
        "Bildwinkel, horizontal": "178\u00b0",
        "Bildwinkel, vertikal": "178\u00b0",
        "Display-Aufl\u00f6sung": "2560 x 1440 Pixel",
        "Displaygr\u00f6\u00dfe": "31,5 Zoll",
        "EAN": "4710886598534",
        "Ergonomie": "H\u00f6henverstellbar, Pivot (90 Grad drehbar), Schwenkbar, Neigbar",
        "Fu\u00dffarbe": "Silber",
        "HD-Typ": "Quad HD",
        "HDMI": "Ja",
        "Helligkeit": "300 cd/m\u00b2",
        "Helligkeit (typisch)": "300 cd/m\u00b2",
        "Hersteller Artikelnummer": "UM.JB2EE.001",
        "H\u00f6heneinstellung": "15 cm",
        "H\u00f6henverstellung": "Ja",
        "Kabelsperre-Slot": "Ja",
        "Marktpositionierung": "Business",
        "Maximale Bildwiederholrate": "75 Hz",
        "Mitgelieferte Kabel": "AC, HDMI",
        "Natives Seitenverh\u00e4ltnis": "16:9",
        "Panel": "IPS",
        "Panel-Montage-Schnittstelle": "100 x 100 mm",
        "Produktfarbe": "Schwarz",
        "Reaktionszeit": "1 ms",
        "St\u00e4nder enthalten": "Ja",
        "Touchscreen": "Nein",
        "Typ der Hintergrundbeleuchtung": "LED",
        "VESA Halterung": "100x100 mm",
        "VESA-Halterung": "Ja",
        "Video Anschl\u00fcsse": "2x HDMI, 1x DisplayPort",
        "Warentarifnummer (HS)": "85285210"
    },
    "raw_specifications_text": "Displaygr\u00f6\u00dfe: 31,5 Zoll\nAufl\u00f6sung: 2560x1440\nPanel: IPS\nReaktionszeit: 1 ms\nVideo Anschl\u00fcsse: 2x HDMI, 1x DisplayPort\nErgonomie: H\u00f6henverstellbar, Pivot (90 Grad drehbar), Schwenkbar, Neigbar\nVESA Halterung: 100x100 mm\nHelligkeit: 300 cd/m\u00b2\nBesonderheiten: 75 Hz, Lautsprecher, USB HUB\nHersteller Artikelnummer: UM.JB2EE.001\nEAN: 4710886598534\nArtikelnummer: M1IY9WYL\nBildschirmdiagonale: 80 cm (31.5\")\nDisplay-Aufl\u00f6sung: 2560 x 1440 Pixel\nNatives Seitenverh\u00e4ltnis: 16:9\nBildschirmtechnologie: LCD\nTouchscreen: Nein\nHD-Typ: Quad HD\nBildschirmform: Flach\nMaximale Bildwiederholrate: 75 Hz\nTyp der Hintergrundbeleuchtung: LED\nHelligkeit (typisch): 300 cd/m\u00b2\nBildwinkel, horizontal: 178\u00b0\nBildwinkel, vertikal: 178\u00b0\nMarktpositionierung: Business\nProduktfarbe: Schwarz\nFu\u00dffarbe: Silber\nHDMI: Ja\nAnzahl HDMI-Anschl\u00fcsse: 1\nVESA-Halterung: Ja\nKabelsperre-Slot: Ja\nH\u00f6henverstellung: Ja\nPanel-Montage-Schnittstelle: 100 x 100 mm\nH\u00f6heneinstellung: 15 cm\nSt\u00e4nder enthalten: Ja\nMitgelieferte Kabel: AC, HDMI\nWarentarifnummer (HS): 85285210",
    "reference_file": "offer_reference_623.json",
    "shop_name": "mylemon.at"
}