{
    "html_file": "offer_2143_14.html",
    "name": "HP Omen X 25f, 24.5\"",
    "offer_link": "https://www.proshop.at/Bildschirm/HP-24-Bildschirm-OMEN-X-by-25f-Black-3-ms-AMD-FreeSync/2793459?utm_source=geizhals&utm_medium=cpc&utm_campaign=pricesite",
    "price": 270.83,
    "raw_specifications": {
        "Abmessungen (Breite x Tiefe x H\u00f6he)": "55.75 cm x 27.25 cm x 48.96 cm - mit Fu\u00df",
        "Abmessungen (Breite x Tiefe x H\u00f6he) - mit Fu\u00df": "55.75 cm x 27.25 cm x 48.96 cm",
        "Adaptive-Sync Technologie": "AMD FreeSync, NVIDIA G-SYNC",
        "Besonderheiten": "HDCP, Low Blue Light Mode, ohne Quecksilber, arsenfreies Glas, extrem schmale Blende an drei Seiten",
        "Bildschirmbeschichtung": "Blendfrei",
        "Bildschirmtyp": "TN",
        "Diagonalabmessung": "62.2 cm (24.5\")",
        "Display-Typ": "LED-hintergrundbeleuchteter LCD-Monitor / TFT-Aktivmatrix",
        "EAN": "193015261815",
        "ENERGY STAR zertifiziert": "Ja",
        "Eingangsanschl\u00fcsse": "2xHDMI, DisplayPort",
        "Eingangsspannung": "Wechselstrom 120/230 V (50/60 Hz)",
        "Einstellungen der Anzeigeposition": "H\u00f6he, Neigung",
        "Energie Effizienzklasse": "Klasse F",
        "Enthaltene Kabel": "1 x DisplayPort-Kabel  1 x SuperSpeed-Kabel USB 3.0 Typ-A auf Micro-USB Typ-B",
        "Entwickelt f\u00fcr": "Victus by HP Laptop 15, 16; Desktop M01; ENVY TE01; ENVY x360 Laptop; Laptop 14, 14s, 15, 15s, 17; Pavilion TP01; Pavilion Gaming TG01; Pavilion Laptop 15; Pavilion Plus Laptop 14; Pavilion x360 Laptop",
        "Erforderliches Betriebssystem": "Microsoft Windows 7 / 8 / 8.1 / 10",
        "Farbe": "Schwarz",
        "Farbraum": "100% sRGB",
        "Farbunterst\u00fctzung": "16,7 Millionen Farben",
        "Ger\u00e4tetyp": "LED-hintergrundbeleuchteter LCD-Monitor - 62.2 cm (24.5\")",
        "Gewicht": "6.16 kg",
        "Helligkeit": "400 cd/m\u00b2",
        "Hersteller": "HP",
        "Hintergrundbeleuchtungs-Technologie": "LED-Hintergrundbeleuchtung",
        "Horizontale Bildwiederholrate": "30 - 255 kHz",
        "Horizontaler Betrachtungswinkel": "170",
        "H\u00f6heneinstellung": "130 mm",
        "Integrierte Peripherieger\u00e4te": "USB 3.0-Hub",
        "Kennzeichnung": "TUV, TUV GS, VCCI, C-Tick, BSMI, WHQL, CB, CCC, PSB, FCC, ISO 9241-307, KCC, WEEE, ICES, cTUVus, MEPS, E-Standby, CEL, ISC, CE/EMC",
        "Kontrast": "1000:1 / 12000000:1 (dynamisch)",
        "Lebensdauer der Beleuchtung": "30,000 Stunden",
        "Leistungsaufnahme im Ein-Zustand": "22.5 W",
        "Leistungsmerkmale": "Slot f\u00fcr Sicherheitsschloss (Kabelschloss getrennt erh\u00e4ltlich), abnehmbarer St\u00e4nder",
        "Modell": "4WH47AA#ABB",
        "Native Aufl\u00f6sung": "Full HD (1080p) 1920 x 1080 bei 240 Hz",
        "Neigungswinkel": "-5/+23",
        "OSD-Sprachen": "Chinesisch (tradionell), Chinesisch (vereinfacht), Englisch, Deutsch, Franz\u00f6sisch, Italienisch, Portugiesisch, Spanisch, Holl\u00e4ndisch, Japanisch",
        "Ppi": "89.7",
        "Produktbeschreibung": "OMEN X by HP 25f - LED-Monitor - Full HD (1080p) - 62.2 cm (24.5\")",
        "Reaktionszeit": "1 ms (Overdrive)",
        "Schlosstyp zur Diebstahlsicherung": "Kensington Slot",
        "Schnittstellen": "DisplayPort (HDCP)  2 x HDMI (HDCP)  Audio Line-Out  2 x USB 3.0",
        "Seitenverh\u00e4ltnis": "16:9",
        "Spannung": "Wechselstrom 120/230 V (50/60 Hz)",
        "Stromverbrauch SDR (eingeschaltet)": "22.5 kWh/1.000 h",
        "Stromverbrauch im Standby-Modus": "0.5 Watt",
        "Transportbreite": "66 cm",
        "Transportgewicht": "9.26 kg",
        "Transporth\u00f6he": "47.3 cm",
        "Transporttiefe": "33.2 cm",
        "Umweltschutzstandards": "ENERGY STAR-qualifiziert",
        "Vertikale Bildwiederholrate": "48 - 240 Hz",
        "Vertikaler Betrachtungswinkel": "160",
        "Waren-Nr.": "2793459",
        "Zubeh\u00f6r im Lieferumfang": "VESA-Klammer",
        "Zum Hersteller": "www.hp.com"
    },
    "raw_specifications_text": "Hersteller: HP\nWaren-Nr.: 2793459\nModell: 4WH47AA#ABB\nEAN: 193015261815\nZum Hersteller: www.hp.com\nProduktbeschreibung: OMEN X by HP 25f - LED-Monitor - Full HD (1080p) - 62.2 cm (24.5\")\nGer\u00e4tetyp: LED-hintergrundbeleuchteter LCD-Monitor - 62.2 cm (24.5\")\nEnergie Effizienzklasse: Klasse F\nLeistungsaufnahme im Ein-Zustand: 22.5 W\nAdaptive-Sync Technologie: AMD FreeSync, NVIDIA G-SYNC\nLeistungsmerkmale: Slot f\u00fcr Sicherheitsschloss (Kabelschloss getrennt erh\u00e4ltlich), abnehmbarer St\u00e4nder\nBildschirmtyp: TN\nSeitenverh\u00e4ltnis: 16:9\nNative Aufl\u00f6sung: Full HD (1080p) 1920 x 1080 bei 240 Hz\nHelligkeit: 400 cd/m\u00b2\nKontrast: 1000:1 / 12000000:1 (dynamisch)\nReaktionszeit: 1 ms (Overdrive)\nFarbunterst\u00fctzung: 16,7 Millionen Farben\nFarbraum: 100% sRGB\nEingangsanschl\u00fcsse: 2xHDMI, DisplayPort\nEinstellungen der Anzeigeposition: H\u00f6he, Neigung\nBildschirmbeschichtung: Blendfrei\nSpannung: Wechselstrom 120/230 V (50/60 Hz)\nFarbe: Schwarz\nAbmessungen (Breite x Tiefe x H\u00f6he) - mit Fu\u00df: 55.75 cm x 27.25 cm x 48.96 cm\nGewicht: 6.16 kg\nUmweltschutzstandards: ENERGY STAR-qualifiziert\nKennzeichnung: TUV, TUV GS, VCCI, C-Tick, BSMI, WHQL, CB, CCC, PSB, FCC, ISO 9241-307, KCC, WEEE, ICES, cTUVus, MEPS, E-Standby, CEL, ISC, CE/EMC\nEntwickelt f\u00fcr: Victus by HP Laptop 15, 16; Desktop M01; ENVY TE01; ENVY x360 Laptop; Laptop 14, 14s, 15, 15s, 17; Pavilion TP01; Pavilion Gaming TG01; Pavilion Laptop 15; Pavilion Plus Laptop 14; Pavilion x360 Laptop\nDisplay-Typ: LED-hintergrundbeleuchteter LCD-Monitor / TFT-Aktivmatrix\nDiagonalabmessung: 62.2 cm (24.5\")\nIntegrierte Peripherieger\u00e4te: USB 3.0-Hub\nPpi: 89.7\nVertikale Bildwiederholrate: 48 - 240 Hz\nHorizontale Bildwiederholrate: 30 - 255 kHz\nHorizontaler Betrachtungswinkel: 170\nVertikaler Betrachtungswinkel: 160\nHintergrundbeleuchtungs-Technologie: LED-Hintergrundbeleuchtung\nOSD-Sprachen: Chinesisch (tradionell), Chinesisch (vereinfacht), Englisch, Deutsch, Franz\u00f6sisch, Italienisch, Portugiesisch, Spanisch, Holl\u00e4ndisch, Japanisch\nBesonderheiten: HDCP, Low Blue Light Mode, ohne Quecksilber, arsenfreies Glas, extrem schmale Blende an drei Seiten\nAbmessungen (Breite x Tiefe x H\u00f6he): 55.75 cm x 27.25 cm x 48.96 cm - mit Fu\u00df\nSchnittstellen: DisplayPort (HDCP)  2 x HDMI (HDCP)  Audio Line-Out  2 x USB 3.0\nNeigungswinkel: -5/+23\nH\u00f6heneinstellung: 130 mm\nZubeh\u00f6r im Lieferumfang: VESA-Klammer\nEnthaltene Kabel: 1 x DisplayPort-Kabel  1 x SuperSpeed-Kabel USB 3.0 Typ-A auf Micro-USB Typ-B\nLebensdauer der Beleuchtung: 30,000 Stunden\nSchlosstyp zur Diebstahlsicherung: Kensington Slot\nEingangsspannung: Wechselstrom 120/230 V (50/60 Hz)\nStromverbrauch SDR (eingeschaltet): 22.5 kWh/1.000 h\nStromverbrauch im Standby-Modus: 0.5 Watt\nErforderliches Betriebssystem: Microsoft Windows 7 / 8 / 8.1 / 10\nTransportbreite: 66 cm\nTransporttiefe: 33.2 cm\nTransporth\u00f6he: 47.3 cm\nTransportgewicht: 9.26 kg\nENERGY STAR zertifiziert: Ja",
    "reference_file": "offer_reference_2143.json",
    "shop_name": "Proshop.at"
}