{
    "html_file": "offer_2459_8.html",
    "name": "NEC MultiSync EX241UN-BK schwarz, 24\"",
    "offer_link": "https://www.e-tec.at/details.php?artnr=256846",
    "price": 466.8,
    "raw_specifications": {
        "Abmessungen (BxHxT)": "538x370x204mm (mit Standfu\u00df),  538x310x44mm (ohne Standfu\u00df)",
        "Anschl\u00fcsse - DVI": "1",
        "Anschl\u00fcsse - DisplayPort 1.2": "1",
        "Anschl\u00fcsse - DisplayPort-Out 1.2": "1",
        "Anschl\u00fcsse - DisplayPort-Out 1.2 (Daisy Chain)": "1",
        "Anschl\u00fcsse - DisplayPort-Out 1.2 Daisy Chain": "1",
        "Anschl\u00fcsse - HDMI 1.4": "1",
        "Anschl\u00fcsse - VGA": "1",
        "Anschl\u00fcsse - VGA (60Hz@1920x1080)": "1",
        "Anschl\u00fcsse - VGA 60Hz@1920x1080": "1",
        "Anwendung": "station\u00e4r",
        "Audio": "Lautsprecher (2x 1W),  1x Line-In,  1x Line-Out",
        "Aufl\u00f6sung": "1920x1080",
        "Beschichtung": "matt (non-glare)",
        "Besonderheiten": "Slim Bezel,  EPEAT Gold,  mechanische Tasten mit Steuerkreuz,  DICOM,  Hardware-Kalibrierung,  Sicherheitsschloss (Kensington)",
        "Bildwiederholfrequenz": "60Hz",
        "Blickwinkel": "178\u00b0/178\u00b0",
        "Diagonale": "24\"/61cm",
        "Energieverbrauch SDR": "15kWh/1000h",
        "Ergonomie": "100mm (h\u00f6henverstellbar),  90\u00b0 (Pivot),  \u00b1170\u00b0 (drehbar),  +30\u00b0/-5\u00b0 (neigbar),  keine Angabe (Schr\u00e4glage)",
        "FRC": "unbekannt",
        "Farbe": "schwarz",
        "Farbraum - sRGB": "100%",
        "Farbtiefe": "8bit (16.7 Mio. Farben)",
        "Form": "gerade (flat)",
        "Gewicht": "5.70kg (mit Standfu\u00df),  3.80kg (ohne Standfu\u00df)",
        "HDR": "N/A",
        "Helligkeit": "250cd/m\u00b2",
        "Herstellergarantie": "drei Jahre",
        "Hintergrundbeleuchtung": "White-LED,  flicker-free,  Blaulichtfilter",
        "Kontrast - dynamisch": "5.000:1",
        "Kontrast - statisch": "1.000:1",
        "Lautsprecher": "Ja",
        "Leistungsaufnahme": "45W (maximal),  16W (typisch),  keine Angabe (Energielabel alt A+++ bis G),  1W (Standby)",
        "Panel": "IPS (AH-IPS)",
        "Panel-Hersteller": "LG Display",
        "Reaktionszeit - GtG": "6ms",
        "Screen-to-Body-Ratio": "95.2% (berechnet)",
        "Seitenverh\u00e4ltnis": "16:9",
        "Signalfrequenz": "31-83kHz (horizontal),  56-75Hz (vertikal)",
        "Stromversorgung": "AC-In (internes Netzteil)",
        "USB-Hub In": "1x USB-B 3.0",
        "USB-Hub Out": "3x USB-A 3.0",
        "USB-Schreibweise": "Link",
        "VESA": "100x100 (belegt)",
        "Weitere Anschl\u00fcsse": "N/A"
    },
    "raw_specifications_text": "Abmessungen (BxHxT): 538x370x204mm (mit Standfu\u00df),  538x310x44mm (ohne Standfu\u00df)\nAnschl\u00fcsse - DisplayPort 1.2: 1\nAnschl\u00fcsse - DisplayPort-Out 1.2: 1\nAnschl\u00fcsse - DisplayPort-Out 1.2 (Daisy Chain): 1\nAnschl\u00fcsse - DisplayPort-Out 1.2 Daisy Chain: 1\nAnschl\u00fcsse - DVI: 1\nAnschl\u00fcsse - HDMI 1.4: 1\nAnschl\u00fcsse - VGA: 1\nAnschl\u00fcsse - VGA (60Hz@1920x1080): 1\nAnschl\u00fcsse - VGA 60Hz@1920x1080: 1\nAnwendung: station\u00e4r\nAudio: Lautsprecher (2x 1W),  1x Line-In,  1x Line-Out\nAufl\u00f6sung: 1920x1080\nBeschichtung: matt (non-glare)\nBesonderheiten: Slim Bezel,  EPEAT Gold,  mechanische Tasten mit Steuerkreuz,  DICOM,  Hardware-Kalibrierung,  Sicherheitsschloss (Kensington)\nBildwiederholfrequenz: 60Hz\nBlickwinkel: 178\u00b0/178\u00b0\nDiagonale: 24\"/61cm\nEnergieverbrauch SDR: 15kWh/1000h\nErgonomie: 100mm (h\u00f6henverstellbar),  90\u00b0 (Pivot),  \u00b1170\u00b0 (drehbar),  +30\u00b0/-5\u00b0 (neigbar),  keine Angabe (Schr\u00e4glage)\nFarbe: schwarz\nFarbraum - sRGB: 100%\nFarbtiefe: 8bit (16.7 Mio. Farben)\nForm: gerade (flat)\nFRC: unbekannt\nGewicht: 5.70kg (mit Standfu\u00df),  3.80kg (ohne Standfu\u00df)\nHDR: N/A\nHelligkeit: 250cd/m\u00b2\nHerstellergarantie: drei Jahre\nHintergrundbeleuchtung: White-LED,  flicker-free,  Blaulichtfilter\nKontrast - dynamisch: 5.000:1\nKontrast - statisch: 1.000:1\nLautsprecher: Ja\nLeistungsaufnahme: 45W (maximal),  16W (typisch),  keine Angabe (Energielabel alt A+++ bis G),  1W (Standby)\nPanel: IPS (AH-IPS)\nPanel-Hersteller: LG Display\nReaktionszeit - GtG: 6ms\nScreen-to-Body-Ratio: 95.2% (berechnet)\nSeitenverh\u00e4ltnis: 16:9\nSignalfrequenz: 31-83kHz (horizontal),  56-75Hz (vertikal)\nStromversorgung: AC-In (internes Netzteil)\nUSB-Hub In: 1x USB-B 3.0\nUSB-Hub Out: 3x USB-A 3.0\nUSB-Schreibweise: Link\nVESA: 100x100 (belegt)\nWeitere Anschl\u00fcsse: N/A",
    "reference_file": "offer_reference_2459.json",
    "shop_name": "e-tec.at"
}