{
    "html_file": "offer_1718_18.html",
    "name": "AOC Porsche Design Agon PD27, 27\"",
    "offer_link": "https://www.proshop.at/Bildschirm/AOC-27-Bildschirm-Gaming-PD27-Black-1-ms-AMD-FreeSync-2/2964394?utm_source=geizhals&utm_medium=cpc&utm_campaign=pricesite",
    "price": 617.81,
    "raw_specifications": {
        "Abmessungen (Breite x Tiefe x H\u00f6he)": "60.55 cm x 32.2 cm x 43.99 cm - mit Fu\u00df",
        "Abmessungen (Breite x Tiefe x H\u00f6he) - mit Fu\u00df": "60.55 cm x 32.2 cm x 43.99 cm",
        "Adaptive-Sync Technologie": "AMD FreeSync Premium Pro",
        "Ausgangsleistung/Kanal": "5 Watt",
        "Besonderheiten": "Flimmerfreie Technologie, DTS Sound, grenzenlos",
        "Bildschirmtyp": "VA",
        "Details zu Abmessungen & Gewicht": "Mit Standfu\u00df (niedrigste Position) - Breite: 60.55 cm - Tiefe: 32.2 cm - H\u00f6he: 43.99 cm - Gewicht: 8.9 kg  Mit Standfu\u00df (h\u00f6chste Position) - Breite: 60.55 cm - Tiefe: 32.2 cm - H\u00f6he: 58.99 cm - Gewicht: 8.9 kg",
        "Diagonalabmessung": "69 cm (27\")",
        "Display-Typ": "LED-hintergrundbeleuchteter LCD-Monitor / TFT-Aktivmatrix",
        "EAN": "4046901932893",
        "Eingangsanschl\u00fcsse": "2xHDMI, 2xDisplayPort",
        "Eingangsspannung": "Wechselstrom 120/230 V (50/60 Hz)",
        "Einstellungen der Anzeigeposition": "H\u00f6he, Drehung, Neigung",
        "Energie Effizienzklasse": "Klasse G",
        "Energieklasse (HDR)": "Klasse G",
        "Enthaltene Kabel": "1 x HDMI-Kabel - 1.8 m  1 x DisplayPort-Kabel - 1.8 m  1 x USB-Kabel",
        "Farbe": "Schwarz",
        "Farbraum": "119% sRGB, 89% Adobe RGB",
        "Farbunterst\u00fctzung": "16,7 Millionen Farben",
        "Gaming": "Ja",
        "Ger\u00e4tetyp": "LED-hintergrundbeleuchteter LCD-Monitor - 69 cm (27\")",
        "Geschwungener Bildschirm": "Ja (1000R)",
        "Gewicht": "8.9 kg",
        "HDR-Zertifizierung": "DisplayHDR 400",
        "HDR-f\u00e4hig": "DisplayHDR 400",
        "Helligkeit": "550 cd/m\u00b2",
        "Hersteller": "AOC",
        "Hintergrundbeleuchtungs-Technologie": "WLED",
        "Horizontaler Betrachtungswinkel": "178",
        "H\u00f6heneinstellung": "150 mm",
        "Integrierte Peripherieger\u00e4te": "USB 3.2 Gen 1 Hub",
        "Kennzeichnung": "FCC, RoHS, TUV Bauart, EAC, ISO 9241-307 Class 1",
        "Kontrast": "2500:1 / 80000000:1 (dynamisch)",
        "Leistungsaufnahme im Ein-Zustand": "32 W",
        "Leistungsmerkmale": "Slot f\u00fcr Sicherheitsschloss (Kabelschloss getrennt erh\u00e4ltlich)",
        "Modell": "PD27",
        "Native Aufl\u00f6sung": "QHD 2560 x 1440 (DisplayPort: 240 Hz, HDMI: 144 Hz)",
        "Neigungswinkel": "-4/+21.5",
        "OSD-Sprachen": "Multilingual",
        "Produktbeschreibung": "AOC Gaming PD27 - Porsche Design - AGON Series - LED-Monitor - gebogen - QHD - 69 cm (27\") - HDR",
        "Reaktionszeit": "0.5 ms (MPRT)",
        "Schlosstyp zur Diebstahlsicherung": "Kensington Slot",
        "Schnittstellen": "2 x HDMI  2 x DisplayPort 1.4  2 x USB 3.2 Gen 1  Kopfh\u00f6rer  Mikrofon",
        "Schwenkwinkel": "30",
        "Seitenverh\u00e4ltnis": "16:9",
        "Spannung": "Wechselstrom 120/230 V (50/60 Hz)",
        "Stromverbrauch (Aus-Modus)": "0.3 Watt",
        "Stromverbrauch (typisch)": "52 Watt",
        "Stromverbrauch HDR (eingeschaltet)": "68 kWh/1.000 h",
        "Stromverbrauch SDR (eingeschaltet)": "32 kWh/1.000 h",
        "Stromverbrauch im Standby-Modus": "0.5 Watt",
        "Transportbreite": "69 cm",
        "Transportgewicht": "14.9 kg",
        "Transporth\u00f6he": "67.8 cm",
        "Transporttiefe": "37.6 cm",
        "Typ": "Lautsprecher - Stereo",
        "Vertikaler Betrachtungswinkel": "178",
        "Waren-Nr.": "2964394",
        "Zum Hersteller": "www.aoc.com"
    },
    "raw_specifications_text": "Hersteller: AOC\nWaren-Nr.: 2964394\nModell: PD27\nEAN: 4046901932893\nZum Hersteller: www.aoc.com\nProduktbeschreibung: AOC Gaming PD27 - Porsche Design - AGON Series - LED-Monitor - gebogen - QHD - 69 cm (27\") - HDR\nGer\u00e4tetyp: LED-hintergrundbeleuchteter LCD-Monitor - 69 cm (27\")\nEnergie Effizienzklasse: Klasse G\nLeistungsaufnahme im Ein-Zustand: 32 W\nGeschwungener Bildschirm: Ja (1000R)\nAdaptive-Sync Technologie: AMD FreeSync Premium Pro\nLeistungsmerkmale: Slot f\u00fcr Sicherheitsschloss (Kabelschloss getrennt erh\u00e4ltlich)\nBildschirmtyp: VA\nSeitenverh\u00e4ltnis: 16:9\nNative Aufl\u00f6sung: QHD 2560 x 1440 (DisplayPort: 240 Hz, HDMI: 144 Hz)\nHelligkeit: 550 cd/m\u00b2\nKontrast: 2500:1 / 80000000:1 (dynamisch)\nHDR-f\u00e4hig: DisplayHDR 400\nReaktionszeit: 0.5 ms (MPRT)\nGaming: Ja\nFarbunterst\u00fctzung: 16,7 Millionen Farben\nFarbraum: 119% sRGB, 89% Adobe RGB\nEingangsanschl\u00fcsse: 2xHDMI, 2xDisplayPort\nEinstellungen der Anzeigeposition: H\u00f6he, Drehung, Neigung\nSpannung: Wechselstrom 120/230 V (50/60 Hz)\nFarbe: Schwarz\nAbmessungen (Breite x Tiefe x H\u00f6he) - mit Fu\u00df: 60.55 cm x 32.2 cm x 43.99 cm\nGewicht: 8.9 kg\nKennzeichnung: FCC, RoHS, TUV Bauart, EAC, ISO 9241-307 Class 1\nDisplay-Typ: LED-hintergrundbeleuchteter LCD-Monitor / TFT-Aktivmatrix\nEnergieklasse (HDR): Klasse G\nDiagonalabmessung: 69 cm (27\")\nIntegrierte Peripherieger\u00e4te: USB 3.2 Gen 1 Hub\nHDR-Zertifizierung: DisplayHDR 400\nHorizontaler Betrachtungswinkel: 178\nVertikaler Betrachtungswinkel: 178\nHintergrundbeleuchtungs-Technologie: WLED\nOSD-Sprachen: Multilingual\nBesonderheiten: Flimmerfreie Technologie, DTS Sound, grenzenlos\nAbmessungen (Breite x Tiefe x H\u00f6he): 60.55 cm x 32.2 cm x 43.99 cm - mit Fu\u00df\nTyp: Lautsprecher - Stereo\nAusgangsleistung/Kanal: 5 Watt\nSchnittstellen: 2 x HDMI  2 x DisplayPort 1.4  2 x USB 3.2 Gen 1  Kopfh\u00f6rer  Mikrofon\nNeigungswinkel: -4/+21.5\nSchwenkwinkel: 30\nH\u00f6heneinstellung: 150 mm\nEnthaltene Kabel: 1 x HDMI-Kabel - 1.8 m  1 x DisplayPort-Kabel - 1.8 m  1 x USB-Kabel\nSchlosstyp zur Diebstahlsicherung: Kensington Slot\nEingangsspannung: Wechselstrom 120/230 V (50/60 Hz)\nStromverbrauch SDR (eingeschaltet): 32 kWh/1.000 h\nStromverbrauch HDR (eingeschaltet): 68 kWh/1.000 h\nStromverbrauch (typisch): 52 Watt\nStromverbrauch im Standby-Modus: 0.5 Watt\nStromverbrauch (Aus-Modus): 0.3 Watt\nDetails zu Abmessungen & Gewicht: Mit Standfu\u00df (niedrigste Position) - Breite: 60.55 cm - Tiefe: 32.2 cm - H\u00f6he: 43.99 cm - Gewicht: 8.9 kg  Mit Standfu\u00df (h\u00f6chste Position) - Breite: 60.55 cm - Tiefe: 32.2 cm - H\u00f6he: 58.99 cm - Gewicht: 8.9 kg\nTransportbreite: 69 cm\nTransporttiefe: 37.6 cm\nTransporth\u00f6he: 67.8 cm\nTransportgewicht: 14.9 kg",
    "reference_file": "offer_reference_1718.json",
    "shop_name": "Proshop.at"
}