{
    "html_file": "offer_516_7.html",
    "name": "Samsung Odyssey Neo G7 G70C, 43\"",
    "offer_link": "https://www.amazon.de/dp/B0BQWH7J9S?linkCode=xm2&camp=2025&creative=165953&smid=A3JWKAKR8XB7XF&creativeASIN=B0BQWH7J9S&tag=geizhals1-21",
    "price": 761.96,
    "raw_specifications": {
        "ASIN": "B0BQWH7J9S",
        "Amazon Bestseller-Rang": "Nr. 79,767 in Computer & Zubeh\u00f6r (Siehe Top 100 in Computer & Zubeh\u00f6r)  Nr. 1,464 in Monitore  Nr. 10,665 in Komponenten & Ersatzteile",
        "Artikelgewicht": "\u200e11,7 Kilograms",
        "Batterien enthalten": "\u200eNein",
        "Display-Gr\u00f6\u00dfe": "\u200e43 Zoll",
        "Durchschnittliche Kundenbewertung": "3,0  3,0 von 5 Sternen    \n    11 Sternebewertungen   \n\n\n 3,0 von 5 Sternen",
        "Farbe": "\u200eSchwarz",
        "Garantierte Software-Updates bis": "\u200eunbekannt",
        "Hersteller": "\u200eSamsung",
        "Im Angebot von Amazon.de seit": "2. Februar 2023",
        "L\u00f6sung": "\u200e3840 x 2160 Pixels",
        "Marke": "\u200eSamsung",
        "Modellnummer": "\u200eLS43CG700NUXEN",
        "Produktabmessungen": "\u200e50 x 50 x 28 cm; 11,7 Kilogramm",
        "Volt": "\u200e240 Volt"
    },
    "raw_specifications_text": "Marke: \u200eSamsung\nHersteller: \u200eSamsung\nProduktabmessungen: \u200e50 x 50 x 28 cm; 11,7 Kilogramm\nModellnummer: \u200eLS43CG700NUXEN\nFarbe: \u200eSchwarz\nDisplay-Gr\u00f6\u00dfe: \u200e43 Zoll\nL\u00f6sung: \u200e3840 x 2160 Pixels\nVolt: \u200e240 Volt\nBatterien enthalten: \u200eNein\nArtikelgewicht: \u200e11,7 Kilograms\nGarantierte Software-Updates bis: \u200eunbekannt\nASIN: B0BQWH7J9S\nDurchschnittliche Kundenbewertung: 3,0  3,0 von 5 Sternen    \n    11 Sternebewertungen   \n\n\n 3,0 von 5 Sternen\nAmazon Bestseller-Rang: Nr. 79,767 in Computer & Zubeh\u00f6r (Siehe Top 100 in Computer & Zubeh\u00f6r)  Nr. 1,464 in Monitore  Nr. 10,665 in Komponenten & Ersatzteile\nIm Angebot von Amazon.de seit: 2. Februar 2023",
    "reference_file": "offer_reference_516.json",
    "shop_name": "Amazon.at"
}