{
    "html_file": "offer_1352_15.html",
    "name": "GIGABYTE AORUS FI32U, 31.5\"",
    "offer_link": "https://www.hiq24.de/shop/artikel/305923/?sPartner=geizhals",
    "price": 938.9,
    "raw_specifications": {
        "Abmessungen (Breite x Tiefe x H\u00f6he)": "71.76 cm x 7.13 cm x 42.43 cm - mit Fu\u00df",
        "Abmessungen (Breite x Tiefe x H\u00f6he) - mit Fu\u00df": "71.76 cm x 7.13 cm x 42.43 cm",
        "Besonderheiten": "Bild in Bild, Bild f\u00fcr Bild, Black eQualizer, flimmerfreie Technologie, Crosshair Display, mit Game-Timer, 6-Achsen-Farbkontrolle, AORUS Aim Stabilizer, Gigabyte RGB Fusion 2.0, FPS-Counter, High Bit Rate 3 (HBR3), ANC 2.0, AORUS Dashboard, AORUS OSD Sidekick, 10-bit (8-bit + FRC) Farbtiefe",
        "Bildschirmbeschichtung": "Blendfrei",
        "Bildschirmtyp": "SS IPS",
        "Details zu Abmessungen & Gewicht": "Mit Fu\u00df - Breite: 71.76 cm - Tiefe: 7.13 cm - H\u00f6he: 42.43 cm - Gewicht: 10.9 kg  Ohne Fu\u00df - Breite: 71.58 cm - Tiefe: 6.82 cm - H\u00f6he: 42.38 cm - Gewicht: 7.7 kg",
        "Diagonalabmessung": "80 cm (31.5\")",
        "Display-Typ": "LED-hintergrundbeleuchteter LCD-Monitor / TFT-Aktivmatrix",
        "Eingangsanschl\u00fcsse": "2xHDMI, DisplayPort, USB-C",
        "Eingangsspannung": "Wechselstrom 100-240 V (50/60 Hz)",
        "Einstellungen der Anzeigeposition": "H\u00f6he, Pivot (Rotation), Drehung, Neigung",
        "Energie Effizienzklasse": "Klasse G",
        "Energieklasse (HDR)": "Klasse G",
        "Enthaltene Kabel": "1 x HDMI-Kabel  1 x DisplayPort-Kabel  1 x USB-Kabel  1 x USB-C Kabel",
        "Farbraum": "123% sRGB, 95% DCI-P3",
        "Ger\u00e4tetyp": "LED-hintergrundbeleuchteter LCD-Monitor - 80 cm (31.5\")",
        "Gewicht": "10.9 kg",
        "HDR-Zertifizierung": "DisplayHDR 400",
        "HDR-f\u00e4hig": "DisplayHDR 400",
        "Helligkeit": "350 cd/m\u00b2",
        "Hintergrundbeleuchtungs-Technologie": "Edge-LED-Beleuchtung",
        "Horizontaler Betrachtungswinkel": "178",
        "H\u00f6heneinstellung": "130 mm",
        "Integrierte Peripherieger\u00e4te": "USB 3.0-Hub",
        "Kennzeichnung": "DisplayPort 1.4, TUV Eyesafe Display Certification",
        "Kontrast": "1000:1",
        "Leistungsaufnahme im Ein-Zustand": "40 W",
        "Leistungsmerkmale": "USB 3.0-Hub",
        "Native Aufl\u00f6sung": "4K 3840 x 2160 bei 144 Hz",
        "Neigungswinkel": "-5/+20",
        "Pixelpitch": "0.181 mm",
        "Produktbeschreibung": "Gigabyte AORUS FI32U - LED-Monitor - 4K - 80 cm (31.5\") - HDR",
        "Reaktionszeit": "1 ms (Gray-to-Gray), 1 ms (MPRT)",
        "Rotationswinkel": "90",
        "Schlosstyp zur Diebstahlsicherung": "Kensington Slot",
        "Schnittstellen": "2 x HDMI  DisplayPort  2 x USB 3.0 Downstream  Kopfh\u00f6rer  USB 3.0 Upstream  Mikrofon  USB-C (KVM-Option)",
        "Schwenkwinkel": "40",
        "Seitenverh\u00e4ltnis": "16:9",
        "Spannung": "Wechselstrom 100-240 V (50/60 Hz)",
        "Stromverbrauch (Aus-Modus)": "0.3 Watt",
        "Stromverbrauch (typisch)": "120 Watt",
        "Stromverbrauch HDR (eingeschaltet)": "51 kWh/1.000 h",
        "Stromverbrauch SDR (eingeschaltet)": "40 kWh/1.000 h",
        "Stromverbrauch im Standby-Modus": "0.5 Watt",
        "Transportbreite": "1 m",
        "Transportgewicht": "15.4 kg",
        "Transporth\u00f6he": "58.5 cm",
        "Transporttiefe": "19.8 cm",
        "VESA-Halterung": "100 x 100 mm",
        "Vertikaler Betrachtungswinkel": "178"
    },
    "raw_specifications_text": "Display-Typ: LED-hintergrundbeleuchteter LCD-Monitor / TFT-Aktivmatrix\nEnergie Effizienzklasse: Klasse G\nEnergieklasse (HDR): Klasse G\nDiagonalabmessung: 80 cm (31.5\")\nIntegrierte Peripherieger\u00e4te: USB 3.0-Hub\nBildschirmtyp: SS IPS\nSeitenverh\u00e4ltnis: 16:9\nNative Aufl\u00f6sung: 4K 3840 x 2160 bei 144 Hz\nPixelpitch: 0.181 mm\nHelligkeit: 350 cd/m\u00b2\nKontrast: 1000:1\nHDR-Zertifizierung: DisplayHDR 400\nFarbraum: 123% sRGB, 95% DCI-P3\nReaktionszeit: 1 ms (Gray-to-Gray), 1 ms (MPRT)\nHorizontaler Betrachtungswinkel: 178\nVertikaler Betrachtungswinkel: 178\nBildschirmbeschichtung: Blendfrei\nHintergrundbeleuchtungs-Technologie: Edge-LED-Beleuchtung\nBesonderheiten: Bild in Bild, Bild f\u00fcr Bild, Black eQualizer, flimmerfreie Technologie, Crosshair Display, mit Game-Timer, 6-Achsen-Farbkontrolle, AORUS Aim Stabilizer, Gigabyte RGB Fusion 2.0, FPS-Counter, High Bit Rate 3 (HBR3), ANC 2.0, AORUS Dashboard, AORUS OSD Sidekick, 10-bit (8-bit + FRC) Farbtiefe\nAbmessungen (Breite x Tiefe x H\u00f6he): 71.76 cm x 7.13 cm x 42.43 cm - mit Fu\u00df\nGewicht: 10.9 kg\nSchnittstellen: 2 x HDMI  DisplayPort  2 x USB 3.0 Downstream  Kopfh\u00f6rer  USB 3.0 Upstream  Mikrofon  USB-C (KVM-Option)\nEinstellungen der Anzeigeposition: H\u00f6he, Pivot (Rotation), Drehung, Neigung\nNeigungswinkel: -5/+20\nSchwenkwinkel: 40\nRotationswinkel: 90\nH\u00f6heneinstellung: 130 mm\nVESA-Halterung: 100 x 100 mm\nLeistungsmerkmale: USB 3.0-Hub\nEnthaltene Kabel: 1 x HDMI-Kabel  1 x DisplayPort-Kabel  1 x USB-Kabel  1 x USB-C Kabel\nKennzeichnung: DisplayPort 1.4, TUV Eyesafe Display Certification\nSchlosstyp zur Diebstahlsicherung: Kensington Slot\nEingangsspannung: Wechselstrom 100-240 V (50/60 Hz)\nLeistungsaufnahme im Ein-Zustand: 40 W\nStromverbrauch SDR (eingeschaltet): 40 kWh/1.000 h\nStromverbrauch HDR (eingeschaltet): 51 kWh/1.000 h\nStromverbrauch (typisch): 120 Watt\nStromverbrauch im Standby-Modus: 0.5 Watt\nStromverbrauch (Aus-Modus): 0.3 Watt\nDetails zu Abmessungen & Gewicht: Mit Fu\u00df - Breite: 71.76 cm - Tiefe: 7.13 cm - H\u00f6he: 42.43 cm - Gewicht: 10.9 kg  Ohne Fu\u00df - Breite: 71.58 cm - Tiefe: 6.82 cm - H\u00f6he: 42.38 cm - Gewicht: 7.7 kg\nTransportbreite: 1 m\nTransporttiefe: 19.8 cm\nTransporth\u00f6he: 58.5 cm\nTransportgewicht: 15.4 kg\nProduktbeschreibung: Gigabyte AORUS FI32U - LED-Monitor - 4K - 80 cm (31.5\") - HDR\nGer\u00e4tetyp: LED-hintergrundbeleuchteter LCD-Monitor - 80 cm (31.5\")\nHDR-f\u00e4hig: DisplayHDR 400\nEingangsanschl\u00fcsse: 2xHDMI, DisplayPort, USB-C\nSpannung: Wechselstrom 100-240 V (50/60 Hz)\nAbmessungen (Breite x Tiefe x H\u00f6he) - mit Fu\u00df: 71.76 cm x 7.13 cm x 42.43 cm",
    "reference_file": "offer_reference_1352.json",
    "shop_name": "HiQ24"
}