{
    "html_file": "offer_393_8.html",
    "name": "LG UltraGear 34GN850P-B, 34\"",
    "offer_link": "https://www.amazon.de/dp/B0BZ8WTQ6Q?linkCode=xm2&camp=2025&creative=165953&smid=A3JWKAKR8XB7XF&creativeASIN=B0BZ8WTQ6Q&tag=geizhals1-21",
    "price": 651.33,
    "raw_specifications": {
        "ASIN": "B0BZ8WTQ6Q",
        "Amazon Bestseller-Rang": "Nr. 14,153 in Computer & Zubeh\u00f6r (Siehe Top 100 in Computer & Zubeh\u00f6r)  Nr. 300 in Monitore",
        "Artikelgewicht": "\u200e7,6 Kilograms",
        "Batterien enthalten": "\u200eNein",
        "Display-Gr\u00f6\u00dfe": "\u200e34 Zoll",
        "Durchschnittliche Kundenbewertung": "4,8  4,8 von 5 Sternen    \n    19 Sternebewertungen   \n\n\n 4,8 von 5 Sternen",
        "Farbe": "\u200eSchwarz",
        "Garantierte Software-Updates bis": "\u200eunbekannt",
        "Hersteller": "\u200eLG Electronics",
        "Im Angebot von Amazon.de seit": "22. M\u00e4rz 2023",
        "L\u00f6sung": "\u200e3440 x 1440 Pixels",
        "Marke": "\u200eLG Electronics",
        "Modell/Serie": "\u200e34GN850P-B.AEU",
        "Modellnummer": "\u200e34GN850P-B.AEU",
        "Produktabmessungen": "\u200e30,99 x 81,99 x 46,99 cm; 7,6 Kilogramm",
        "Speicher-Art": "\u200eDIMM"
    },
    "raw_specifications_text": "Marke: \u200eLG Electronics\nHersteller: \u200eLG Electronics\nModell/Serie: \u200e34GN850P-B.AEU\nProduktabmessungen: \u200e30,99 x 81,99 x 46,99 cm; 7,6 Kilogramm\nModellnummer: \u200e34GN850P-B.AEU\nFarbe: \u200eSchwarz\nDisplay-Gr\u00f6\u00dfe: \u200e34 Zoll\nL\u00f6sung: \u200e3440 x 1440 Pixels\nSpeicher-Art: \u200eDIMM\nBatterien enthalten: \u200eNein\nArtikelgewicht: \u200e7,6 Kilograms\nGarantierte Software-Updates bis: \u200eunbekannt\nASIN: B0BZ8WTQ6Q\nDurchschnittliche Kundenbewertung: 4,8  4,8 von 5 Sternen    \n    19 Sternebewertungen   \n\n\n 4,8 von 5 Sternen\nAmazon Bestseller-Rang: Nr. 14,153 in Computer & Zubeh\u00f6r (Siehe Top 100 in Computer & Zubeh\u00f6r)  Nr. 300 in Monitore\nIm Angebot von Amazon.de seit: 22. M\u00e4rz 2023",
    "reference_file": "offer_reference_393.json",
    "shop_name": "Amazon.at"
}