{
    "html_file": "offer_694_1.html",
    "name": "AOC 24P2QM, 23.8\"",
    "offer_link": "https://www.ba-computer.at/aoc-pro-line-24p2qm-p2-series-led-monitor-61-cm-24-24p2qm.html",
    "price": 145.14,
    "raw_specifications": {
        "Abmessungen (Breite x Tiefe x H\u00f6he)": "54.02 cm x 20.1 cm x 51.3 cm - mit Fu\u00df",
        "Ausgangsleistung/Kanal": "2 Watt",
        "Besonderheiten": "Low Blue Light Mode, Adaptive-Sync-Technologie, USB 3.0 Fast Charge, an 3 Seiten rahmenlos, AOC Flicker-Free Technology",
        "Bildschirmbeschichtung": "Blendfrei, 6H Hard Coating",
        "Bildschirmtyp": "VA",
        "Details zu Abmessungen & Gewicht": "Mit Standfu\u00df (niedrigste Position) - Breite: 54.02 cm - Tiefe: 20.1 cm - H\u00f6he: 38.44 cm - Gewicht: 4.75 kg \u00a6 Mit Standfu\u00df (h\u00f6chste Position) - Breite: 54.02 cm - Tiefe: 20.1 cm - H\u00f6he: 51.3 cm - Gewicht: 4.75 kg \u00a6 Ohne Fu\u00df - Breite: 54.02 cm - Tiefe: 5.07 cm - H\u00f6he: 32.64 cm",
        "Diagonalabmessung": "61 cm (24\")",
        "Display-Typ": "LED-hintergrundbeleuchteter LCD-Monitor / TFT-Aktivmatrix",
        "Eingangsspannung": "Wechselstrom 100-240 V (50/60 Hz)",
        "Einstellungen der Anzeigeposition": "H\u00f6he, Pivot (Rotation), Drehung, Neigung",
        "Enthaltene Kabel": "1 x HDMI-Kabel - 1.8 m",
        "Farbe": "Schwarz",
        "Farbraum": "90% NTSC (CIE 1931), 94% Adobe RGB (CIE 1931), 113% NTSC (CIE 1976), 127% sRGB (CIE 1931), 94% DCI-P3 (CIE 1931), 129% sRGB (CIE 1976), 103% DCI-P3 (CIE 1976), 111% Adobe RGB (CIE 1976)",
        "Farbunterst\u00fctzung": "16,7 Millionen Farben",
        "Gewicht": "4.75 kg",
        "Helligkeit": "300 cd/m\u00b2",
        "Hintergrundbeleuchtungs-Technologie": "WLED",
        "Horizontaler Betrachtungswinkel": "178",
        "H\u00f6heneinstellung": "150 mm",
        "Integrierte Peripherieger\u00e4te": "USB 3.2 Gen 1 Hub",
        "Kennzeichnung": "DisplayPort 1.2, HDCP 1.4",
        "Kontrast": "3000:1 / 50000000:1 (dynamisch)",
        "Native Aufl\u00f6sung": "Full HD (1080p) 1920 x 1080 bei 75 Hz",
        "Neigungswinkel": "-5/+35",
        "OSD-Sprachen": "Tschechisch, Kroatisch, Chinesisch (tradionell), Chinesisch (vereinfacht), Ukrainisch, Englisch, Deutsch, Franz\u00f6sisch, Italienisch, Portugiesisch, Polnisch, Finnisch, Schwedisch, Russisch, Spanisch, Holl\u00e4ndisch, T\u00fcrkisch, Japanisch, Koreanisch",
        "Pixelpitch": "0.2745 mm",
        "Ppi": "93",
        "Reaktionszeit": "4 ms (gray-to-gray)",
        "Schnittstellen": "VGA (HD-15) \u00a6 DVI \u00a6 HDMI 1.4 \u00a6 DisplayPort 1.2 \u00a6 4 x USB 3.2 Gen 1 \u00a6 Kopfh\u00f6rer (Mini-Klinkenstecker)",
        "Schwenkwinkel": "180",
        "Seitenverh\u00e4ltnis": "16:9",
        "Service und Support": "Begrenzte Garantie - 3 Jahre",
        "Sichtbare Bildfl\u00e4che": "60.4 cm (23.8\")",
        "Stromverbrauch (Aus-Modus)": "0.5 Watt",
        "Stromverbrauch (typisch)": "20 Watt",
        "Stromverbrauch im Standby-Modus": "0.5 Watt",
        "TCO-zertifiziert": "TCO Certified Displays 9",
        "Transportbreite": "51.3 cm",
        "Transportgewicht": "7.24 kg",
        "Transporth\u00f6he": "16 cm",
        "Transporttiefe": "63.4 cm",
        "Typ": "Lautsprecher - Stereo",
        "VESA-Halterung": "100 x 100 mm",
        "Vertikaler Betrachtungswinkel": "178"
    },
    "raw_specifications_text": "Display-Typ: LED-hintergrundbeleuchteter LCD-Monitor / TFT-Aktivmatrix\nDiagonalabmessung: 61 cm (24\")\nSichtbare Bildfl\u00e4che: 60.4 cm (23.8\")\nIntegrierte Peripherieger\u00e4te: USB 3.2 Gen 1 Hub\nBildschirmtyp: VA\nSeitenverh\u00e4ltnis: 16:9\nNative Aufl\u00f6sung: Full HD (1080p) 1920 x 1080 bei 75 Hz\nPixelpitch: 0.2745 mm\nPpi: 93\nHelligkeit: 300 cd/m\u00b2\nKontrast: 3000:1 / 50000000:1 (dynamisch)\nFarbunterst\u00fctzung: 16,7 Millionen Farben\nFarbraum: 90% NTSC (CIE 1931), 94% Adobe RGB (CIE 1931), 113% NTSC (CIE 1976), 127% sRGB (CIE 1931), 94% DCI-P3 (CIE 1931), 129% sRGB (CIE 1976), 103% DCI-P3 (CIE 1976), 111% Adobe RGB (CIE 1976)\nReaktionszeit: 4 ms (gray-to-gray)\nHorizontaler Betrachtungswinkel: 178\nVertikaler Betrachtungswinkel: 178\nBildschirmbeschichtung: Blendfrei, 6H Hard Coating\nHintergrundbeleuchtungs-Technologie: WLED\nOSD-Sprachen: Tschechisch, Kroatisch, Chinesisch (tradionell), Chinesisch (vereinfacht), Ukrainisch, Englisch, Deutsch, Franz\u00f6sisch, Italienisch, Portugiesisch, Polnisch, Finnisch, Schwedisch, Russisch, Spanisch, Holl\u00e4ndisch, T\u00fcrkisch, Japanisch, Koreanisch\nBesonderheiten: Low Blue Light Mode, Adaptive-Sync-Technologie, USB 3.0 Fast Charge, an 3 Seiten rahmenlos, AOC Flicker-Free Technology\nFarbe: Schwarz\nAbmessungen (Breite x Tiefe x H\u00f6he): 54.02 cm x 20.1 cm x 51.3 cm - mit Fu\u00df\nGewicht: 4.75 kg\nTyp: Lautsprecher - Stereo\nAusgangsleistung/Kanal: 2 Watt\nSchnittstellen: VGA (HD-15) \u00a6 DVI \u00a6 HDMI 1.4 \u00a6 DisplayPort 1.2 \u00a6 4 x USB 3.2 Gen 1 \u00a6 Kopfh\u00f6rer (Mini-Klinkenstecker)\nEinstellungen der Anzeigeposition: H\u00f6he, Pivot (Rotation), Drehung, Neigung\nNeigungswinkel: -5/+35\nSchwenkwinkel: 180\nH\u00f6heneinstellung: 150 mm\nVESA-Halterung: 100 x 100 mm\nEnthaltene Kabel: 1 x HDMI-Kabel - 1.8 m\nKennzeichnung: DisplayPort 1.2, HDCP 1.4\nEingangsspannung: Wechselstrom 100-240 V (50/60 Hz)\nStromverbrauch (typisch): 20 Watt\nStromverbrauch im Standby-Modus: 0.5 Watt\nStromverbrauch (Aus-Modus): 0.5 Watt\nDetails zu Abmessungen & Gewicht: Mit Standfu\u00df (niedrigste Position) - Breite: 54.02 cm - Tiefe: 20.1 cm - H\u00f6he: 38.44 cm - Gewicht: 4.75 kg \u00a6 Mit Standfu\u00df (h\u00f6chste Position) - Breite: 54.02 cm - Tiefe: 20.1 cm - H\u00f6he: 51.3 cm - Gewicht: 4.75 kg \u00a6 Ohne Fu\u00df - Breite: 54.02 cm - Tiefe: 5.07 cm - H\u00f6he: 32.64 cm\nTransportbreite: 51.3 cm\nTransporttiefe: 63.4 cm\nTransporth\u00f6he: 16 cm\nTransportgewicht: 7.24 kg\nTCO-zertifiziert: TCO Certified Displays 9\nService und Support: Begrenzte Garantie - 3 Jahre",
    "reference_file": "offer_reference_694.json",
    "shop_name": "BA-Computer"
}