{
    "html_file": "offer_284_0.html",
    "name": "LG 24BN55YP-B, 23.8\"",
    "offer_link": "https://www.csv-direct.de/artinfo.php?artnr=AGX1644390&KATEGORIE=162&pva=geizhals2",
    "price": 141.03,
    "raw_specifications": {
        "AC Eingangsfrequenz": "50 - 60 Hz",
        "AC Eingangsspannung": "100 - 240 V",
        "AMD FreeSync": "Nein",
        "Anzahl DisplayPort Anschl\u00fcsse": "1",
        "Anzahl HDMI-Anschl\u00fcsse": "1",
        "Anzahl OSD-Sprachen": "18",
        "Anzahl der Farben des Displays": "16,7 Millionen Farben",
        "Anzahl der Lautsprecher": "2",
        "Bildschirmdiagonale": "60,5 cm 23.8\"",
        "Bildschirmdiagonale cm": "60,4 cm",
        "Bildschirmform": "Flach",
        "Bildschirmtechnologie": "LED",
        "Bildwinkel, horizontal": "178\u00b0",
        "Bildwinkel, vertikal": "178\u00b0",
        "Breite ohne Standfu\u00df": "553,8 mm",
        "Display-Aufl\u00f6sung": "1920 x 1080 Pixel",
        "DisplayPort Kabell\u00e4nge": "1,8 m",
        "DisplayPorts-Version": "1.2",
        "Eingebautes Mikrofon": "Nein",
        "Energieeffizienzklasse SDR": "E",
        "Energieverbrauch SDR pro 1.000 Stunden": "18 kWh",
        "Farbskala": "72",
        "Farbtiefe": "8 Bit",
        "Fu\u00dffarbe": "Schwarz",
        "Ger\u00e4tebreite inkl. Fu\u00df": "553,8 mm",
        "Ger\u00e4teh\u00f6he inkl. Fu\u00df": "382,9 mm",
        "Ger\u00e4tetiefe inkl. Fu\u00df": "240 mm",
        "Gewicht mit St\u00e4nder": "5,7 kg",
        "Gewicht ohne St\u00e4nder": "3,6 kg",
        "HD-Typ": "Full HD",
        "HDMI-Version": "1.4",
        "Helligkeit typisch": "200 cd/m\u00b2",
        "H\u00f6he ohne Standfu\u00df": "333,1 mm",
        "H\u00f6heneinstellung": "13 cm",
        "Integrierte Kamera": "Nein",
        "Kontrastverh\u00e4ltnis": "1000:1",
        "Markenspezifische Technologien": "Crosshair",
        "Marktpositionierung": "Business",
        "Maximale Bildwiederholrate": "60 Hz",
        "Mitgelieferte Kabel": "DisplayPort, Leistung",
        "NVIDIA G-SYNC": "Nein",
        "Nachhaltigkeitszertifikate": "REACH, RoHS",
        "Natives Seitenverh\u00e4ltnis": "16:9",
        "Neigungswinkelbereich": "-5 - 35\u00b0",
        "Netzteiltyp": "Intern",
        "Oberfl\u00e4chenh\u00e4rte": "3H",
        "Panel-Montage-Schnittstelle": "100 x 100 mm",
        "Panel-Typ": "IPS",
        "Pivot Winkel": "0 - 355\u00b0",
        "Pixel Abstand": "0,2745 x 0,2745 mm",
        "Produktfarbe": "Schwarz",
        "RGB-Farbraum": "NTSC",
        "RMS-Leistung": "2,4 W",
        "Reaktionszeit": "5 ms",
        "Stromkabell\u00e4nge": "1,8 m",
        "Stromverbrauch Standby": "0,5 W",
        "Stromverbrauch aus": "0,3 W",
        "Tiefe ohne Standfu\u00df": "58,4 mm",
        "Touchscreen": "Nein",
        "Tr\u00fcbungsrate": "25",
        "Typ der Hintergrundbeleuchtung": "Seiten-LED"
    },
    "raw_specifications_text": "Bildschirmdiagonale: 60,5 cm 23.8\"\nDisplay-Aufl\u00f6sung: 1920 x 1080 Pixel\nNatives Seitenverh\u00e4ltnis: 16:9\nBildschirmtechnologie: LED\nTouchscreen: Nein\nHD-Typ: Full HD\nPanel-Typ: IPS\nBildschirmform: Flach\nKontrastverh\u00e4ltnis: 1000:1\nMaximale Bildwiederholrate: 60 Hz\nAnzahl der Farben des Displays: 16,7 Millionen Farben\nTyp der Hintergrundbeleuchtung: Seiten-LED\nHelligkeit typisch: 200 cd/m\u00b2\nReaktionszeit: 5 ms\nBildwinkel, horizontal: 178\u00b0\nBildwinkel, vertikal: 178\u00b0\nPixel Abstand: 0,2745 x 0,2745 mm\nBildschirmdiagonale cm: 60,4 cm\nTr\u00fcbungsrate: 25\nOberfl\u00e4chenh\u00e4rte: 3H\nFarbtiefe: 8 Bit\nRGB-Farbraum: NTSC\nFarbskala: 72\nNVIDIA G-SYNC: Nein\nAMD FreeSync: Nein\nMarkenspezifische Technologien: Crosshair\nIntegrierte Kamera: Nein\nAnzahl der Lautsprecher: 2\nRMS-Leistung: 2,4 W\nEingebautes Mikrofon: Nein\nMarktpositionierung: Business\nProduktfarbe: Schwarz\nFu\u00dffarbe: Schwarz\nAnzahl HDMI-Anschl\u00fcsse: 1\nHDMI-Version: 1.4\nAnzahl DisplayPort Anschl\u00fcsse: 1\nDisplayPorts-Version: 1.2\nPanel-Montage-Schnittstelle: 100 x 100 mm\nH\u00f6heneinstellung: 13 cm\nPivot Winkel: 0 - 355\u00b0\nNeigungswinkelbereich: -5 - 35\u00b0\nAnzahl OSD-Sprachen: 18\nEnergieeffizienzklasse SDR: E\nEnergieverbrauch SDR pro 1.000 Stunden: 18 kWh\nStromverbrauch Standby: 0,5 W\nStromverbrauch aus: 0,3 W\nAC Eingangsspannung: 100 - 240 V\nAC Eingangsfrequenz: 50 - 60 Hz\nNetzteiltyp: Intern\nMitgelieferte Kabel: DisplayPort, Leistung\nDisplayPort Kabell\u00e4nge: 1,8 m\nStromkabell\u00e4nge: 1,8 m\nGer\u00e4tebreite inkl. Fu\u00df: 553,8 mm\nGer\u00e4tetiefe inkl. Fu\u00df: 240 mm\nGer\u00e4teh\u00f6he inkl. Fu\u00df: 382,9 mm\nGewicht mit St\u00e4nder: 5,7 kg\nBreite ohne Standfu\u00df: 553,8 mm\nTiefe ohne Standfu\u00df: 58,4 mm\nH\u00f6he ohne Standfu\u00df: 333,1 mm\nGewicht ohne St\u00e4nder: 3,6 kg\nNachhaltigkeitszertifikate: REACH, RoHS",
    "reference_file": "offer_reference_284.json",
    "shop_name": "CSV-Direct.de"
}