{
    "html_file": "offer_574_12.html",
    "name": "Acer Vero V7 V247Ybipv, 23.8\"",
    "offer_link": "https://direkt.jacob.de/produkte/acer-60-5cm-23-8-um-qv7ee-034-artnr-8014411.html?utm_source=geizhals&utm_medium=cpc&utm_campaign=Preisvergleich&ref=103",
    "price": 119.86,
    "raw_specifications": {
        "AMD FreeSync": "Nein",
        "Anzahl DisplayPort Anschl\u00fcsse": "1",
        "Anzahl VGA (D-Sub) Anschl\u00fcsse": "1",
        "Anzahl der Farben des Displays": "16,7 Millionen Farben",
        "Bildschirmdiagonale": "60,5 cm (23.8\" )",
        "Bildschirmdiagonale (cm)": "60,5 cm",
        "Bildschirmform": "Flach",
        "Bildwinkel, horizontal": "178\u00b0",
        "Bildwinkel, vertikal": "178\u00b0",
        "Breite (ohne Standfu\u00df)": "54 cm",
        "Display-Aufl\u00f6sung": "1920 x 1080 Pixel",
        "Gewicht (mit St\u00e4nder)": "4,4 kg",
        "Gewicht (ohne St\u00e4nder)": "3,57 kg",
        "HD-Typ": "Full HD",
        "HDMI": "Ja",
        "Helligkeit (typisch)": "250 cd/m\u00b2",
        "Integrierte Kamera": "Nein",
        "Kontrastverh\u00e4ltnis": "1000:1",
        "Kontrastverh\u00e4ltnis (dynamisch)": "100000000:1",
        "NVIDIA G-SYNC": "Nein",
        "Natives Seitenverh\u00e4ltnis": "16:9",
        "Panel-Montage-Schnittstelle": "100 x 100 mm",
        "Panel-Typ": "IPS",
        "Pixel Abstand": "0,27 x 0,27 mm",
        "Produktfarbe": "Schwarz",
        "Reaktionszeit": "4 ms",
        "Seitenverh\u00e4ltnis": "16:9",
        "Stromverbrauch (Standardbetrieb)": "16 W",
        "Stromverbrauch (Standby)": "0,5 W",
        "Stromverbrauch (aus)": "0,45 W",
        "Stromverbrauch (max.)": "24 W",
        "St\u00e4nder enthalten": "Ja",
        "Tiefe (ohne Standfu\u00df)": "6,5 cm",
        "Touchscreen": "Nein",
        "Typ der Hintergrundbeleuchtung": "LED",
        "VESA-Halterung": "Ja"
    },
    "raw_specifications_text": "Bildschirmdiagonale: 60,5 cm (23.8\" )\nDisplay-Aufl\u00f6sung: 1920 x 1080 Pixel\nNatives Seitenverh\u00e4ltnis: 16:9\nTouchscreen: Nein\nHD-Typ: Full HD\nPanel-Typ: IPS\nBildschirmform: Flach\nKontrastverh\u00e4ltnis: 1000:1\nAnzahl der Farben des Displays: 16,7 Millionen Farben\nTyp der Hintergrundbeleuchtung: LED\nHelligkeit (typisch): 250 cd/m\u00b2\nReaktionszeit: 4 ms\nSeitenverh\u00e4ltnis: 16:9\nKontrastverh\u00e4ltnis (dynamisch): 100000000:1\nBildwinkel, horizontal: 178\u00b0\nBildwinkel, vertikal: 178\u00b0\nPixel Abstand: 0,27 x 0,27 mm\nBildschirmdiagonale (cm): 60,5 cm\nNVIDIA G-SYNC: Nein\nAMD FreeSync: Nein\nIntegrierte Kamera: Nein\nProduktfarbe: Schwarz\nHDMI: Ja\nAnzahl VGA (D-Sub) Anschl\u00fcsse: 1\nAnzahl DisplayPort Anschl\u00fcsse: 1\nVESA-Halterung: Ja\nPanel-Montage-Schnittstelle: 100 x 100 mm\nStromverbrauch (Standardbetrieb): 16 W\nStromverbrauch (Standby): 0,5 W\nStromverbrauch (max.): 24 W\nStromverbrauch (aus): 0,45 W\nSt\u00e4nder enthalten: Ja\nGewicht (mit St\u00e4nder): 4,4 kg\nBreite (ohne Standfu\u00df): 54 cm\nTiefe (ohne Standfu\u00df): 6,5 cm\nGewicht (ohne St\u00e4nder): 3,57 kg",
    "reference_file": "offer_reference_574.json",
    "shop_name": "Jacob Elektronik direkt (AT)"
}