{
    "html_file": "offer_189_4.html",
    "name": "Dell UltraSharp U3224KBA, 31.5\"",
    "offer_link": "https://www.office-partner.de/productredirect/index/sku/27422749?sPartner=p-geizhals-at&campaign=psm/geizhals-at/",
    "price": 2668.23,
    "raw_specifications": {
        "Anschl\u00fcsse": "HDMI, USB, Thunderbolt, Mini DisplayPort",
        "Artikelnummer": "27422749",
        "Aufl\u00f6sung Kurzname": "UHD",
        "Bezeichnung des Herstellers": "Dell UltraSharp U3224KBA",
        "Bildwiederholungsrate": "60,00",
        "Breite": "71742,00",
        "Display Features": "FlickerFree, Bild an Bild (PbP) Funktion, Bild in Bild (PiP) Funktion",
        "Displaygr\u00f6\u00dfe": "81,28 cm (32 Zoll)",
        "Displayoberfl\u00e4che": "matt",
        "EEK - Spektrum": "AG",
        "Einsatzort": "Innen",
        "Energieeffizienzklasse": "G",
        "Geh\u00e4usefarbe des Ger\u00e4tes": "Schwarz",
        "Gewicht": "13,00",
        "Gewicht inkl. Verpackung in Kg": "17,70",
        "Helligkeit Bereich": "300 - 450 cd/m\u00b2",
        "Hersteller": "Dell",
        "H\u00f6he": "6826,00",
        "Kontrastverh\u00e4ltnis (typisch) Bereich": "ab 1.200:1",
        "LCD-Technologie": "IPS Panel",
        "L\u00e4nge": "237,00",
        "Produktart": "Monitore",
        "Reaktionszeit": "8,00",
        "Seitenverh\u00e4ltnis": "16:9",
        "Shop Herstellernummer": "DELL-U3224KBA",
        "Standard-EAN": "5397184657140",
        "Verbindungen": "Netzwerk (LAN)"
    },
    "raw_specifications_text": "Energieeffizienzklasse: G\nGeh\u00e4usefarbe des Ger\u00e4tes: Schwarz\nAnschl\u00fcsse: HDMI, USB, Thunderbolt, Mini DisplayPort\nDisplay Features: FlickerFree, Bild an Bild (PbP) Funktion, Bild in Bild (PiP) Funktion\nHersteller: Dell\nKontrastverh\u00e4ltnis (typisch) Bereich: ab 1.200:1\nHelligkeit Bereich: 300 - 450 cd/m\u00b2\nVerbindungen: Netzwerk (LAN)\nDisplaygr\u00f6\u00dfe: 81,28 cm (32 Zoll)\nProduktart: Monitore\nEEK - Spektrum: AG\nAufl\u00f6sung Kurzname: UHD\nGewicht: 13,00\nL\u00e4nge: 237,00\nArtikelnummer: 27422749\nStandard-EAN: 5397184657140\nShop Herstellernummer: DELL-U3224KBA\nBezeichnung des Herstellers: Dell UltraSharp U3224KBA\nBreite: 71742,00\nH\u00f6he: 6826,00\nGewicht inkl. Verpackung in Kg: 17,70\nSeitenverh\u00e4ltnis: 16:9\nLCD-Technologie: IPS Panel\nReaktionszeit: 8,00\nDisplayoberfl\u00e4che: matt\nBildwiederholungsrate: 60,00\nEinsatzort: Innen",
    "reference_file": "offer_reference_189.json",
    "shop_name": "office-partner (AT)"
}