{
    "html_file": "offer_1412_10.html",
    "name": "Dell S3422DW, 34\"",
    "offer_link": "https://direkt.jacob.de/produkte/dell-s3422dw-86-4cm-210-axkz-artnr-7217590.html?utm_source=geizhals&utm_medium=cpc&utm_campaign=Preisvergleich&ref=103",
    "price": 447.56,
    "raw_specifications": {
        "AC Eingangsfrequenz": "50/60 Hz",
        "AC Eingangsspannung": "100 - 240 V",
        "AMD FreeSync": "Ja",
        "Abnehmbarer Standfu\u00df": "Ja",
        "Anzahl DisplayPort Anschl\u00fcsse": "1",
        "Anzahl HDMI-Anschl\u00fcsse": "2",
        "Anzahl der Farben des Displays": "16,7 Millionen Farben",
        "Anzahl der Lautsprecher": "2",
        "Anzahl der nachgeschalteten Steckpl\u00e4tze vom Typ USB-A": "2",
        "Anzahl der vorgeschalteten Steckpl\u00e4tze": "1",
        "Audioausgang": "Ja",
        "Bezel Weite (bottom)": "2,21 cm",
        "Bezel Weite (side)": "8,65 mm",
        "Bezel Weite (top)": "8,64 mm",
        "Bildschirmaufl\u00f6sung": "3440 x 1440 Pixel",
        "Bildschirmdiagonale": "86,4 cm (34\" )",
        "Bildschirmdiagonale (cm)": "86,42 cm",
        "Bildschirmform": "Gebogen",
        "Bildschirmtechnologie": "LCD",
        "Blendfreier Bildschirm": "Ja",
        "Blickwinkel, horizontal": "178\u00b0",
        "Blickwinkel, vertikal": "178\u00b0",
        "Breite (ohne Standfu\u00df)": "80,8 cm",
        "DisplayPorts-Version": "1.2",
        "Eingebaute Lautsprecher": "Ja",
        "Energieeffizienzklasse (SDR)": "G",
        "Energieverbrauch (SDR) pro 1.000 Stunden": "32 kWh",
        "Enth\u00e4lt nicht": "PVC/BFR",
        "Farbskala": "89,2%",
        "Flimmerfreie Technologie": "Ja",
        "Fu\u00dffarbe": "Silber",
        "Ger\u00e4tebreite (inkl. Fu\u00df)": "808,2 mm",
        "Ger\u00e4teh\u00f6he (inkl. Fu\u00df)": "489,4 mm",
        "Ger\u00e4tetiefe (inkl. Fu\u00df)": "210 mm",
        "Gewicht (mit St\u00e4nder)": "9,8 kg",
        "Gewicht (ohne St\u00e4nder)": "6,7 kg",
        "HD-Typ": "Wide Quad HD",
        "HDCP": "Ja",
        "HDMI": "Ja",
        "HDMI-Version": "2.2",
        "Helligkeit (typisch)": "300 cd/m\u00b2",
        "Horizontaler Scanbereich": "30 - 160 kHz",
        "H\u00f6he (ohne Standfu\u00df)": "36,5 cm",
        "H\u00f6he bei Betrieb": "0 - 5000 m",
        "H\u00f6he bei Lagerung": "0 - 12192 m",
        "H\u00f6heneinstellung": "10 cm",
        "H\u00f6henverstellung": "Ja",
        "Integrierte Kamera": "Nein",
        "Integrierter USB-Hub": "Ja",
        "Kabelsperre-Slot": "Ja",
        "Kontrastverh\u00e4ltnis": "3000:1",
        "Luftfeuchtigkeit bei Lagerung": "10 - 90%",
        "Marktpositionierung": "Haus",
        "Maximale Bildwiederholrate": "100 Hz",
        "Mitgelieferte Kabel": "AC, HDMI, USB",
        "NVIDIA G-SYNC": "Nein",
        "Nachhaltigkeitszertifikate": "RoHS",
        "Natives Seitenverh\u00e4ltnis": "21:9",
        "Neigungswinkelbereich": "5 - 21\u00b0",
        "On-Screen-Display (OSD)": "Ja",
        "Paketgewicht": "14,9 kg",
        "Panel-Montage-Schnittstelle": "100 x 100 mm",
        "Panel-Typ": "VA",
        "Pixel Abstand": "0,23175 x 0,23175 mm",
        "Pixeldichte": "109 ppi",
        "Plug & Play": "Ja",
        "Produktfarbe": "Schwarz, Silber",
        "RGB-Farbraum": "DCI-P3",
        "RMS-Leistung": "10 W",
        "Reaktionszeit": "4 ms",
        "Relative Luftfeuchtigkeit in Betrieb": "10 - 80%",
        "Schnellstart\u00fcbersicht": "Ja",
        "Schwermetallfrei": "Hg (Quecksilber)",
        "Sichtbare Gr\u00f6\u00dfe (diagonal)": "86,4 cm",
        "Sichtbare Gr\u00f6\u00dfe (horizontal)": "79,7 cm",
        "Sichtbare Gr\u00f6\u00dfe (vertikal)": "33,4 cm",
        "Stromverbrauch (Standby)": "0,3 W",
        "Stromverbrauch (aus)": "0,3 W",
        "Stromverbrauch (max.)": "92 W",
        "St\u00e4nder enthalten": "Ja",
        "Temperaturbereich bei Lagerung": "20 - 60 \u00b0C",
        "Temperaturbereich in Betrieb": "0 - 40 \u00b0C",
        "Tiefe (ohne Standfu\u00df)": "6,4 cm",
        "Typ der Hintergrundbeleuchtung": "LED",
        "USB-Hub-Version": "2.0 / 3.2 Gen 1 (3.1 Gen 1)",
        "USB-Upstream-Porttyp": "USB Typ-B",
        "Unterst\u00fctzte Video-Modi": "480i,480p,576p,720p,1080i,1080p",
        "VESA-Halterung": "Ja",
        "Verpackungsbreite": "468,1 mm",
        "Verpackungsh\u00f6he": "225 mm",
        "Verpackungstiefe": "950 mm",
        "Vertikaler Scanbereich": "48 - 100 Hz",
        "Vorderer Rahmen": "Schwarz",
        "kippbar": "Ja",
        "sRGB Abdeckung (klassisch)": "99,7%"
    },
    "raw_specifications_text": "Bildschirmdiagonale: 86,4 cm (34\" )\nBildschirmaufl\u00f6sung: 3440 x 1440 Pixel\nNatives Seitenverh\u00e4ltnis: 21:9\nPanel-Typ: VA\nHD-Typ: Wide Quad HD\nBildschirmtechnologie: LCD\nBildschirmform: Gebogen\nKontrastverh\u00e4ltnis: 3000:1\nMaximale Bildwiederholrate: 100 Hz\nAnzahl der Farben des Displays: 16,7 Millionen Farben\nHelligkeit (typisch): 300 cd/m\u00b2\nReaktionszeit: 4 ms\nTyp der Hintergrundbeleuchtung: LED\nBlendfreier Bildschirm: Ja\nUnterst\u00fctzte Video-Modi: 480i,480p,576p,720p,1080i,1080p\nBlickwinkel, horizontal: 178\u00b0\nBlickwinkel, vertikal: 178\u00b0\nPixel Abstand: 0,23175 x 0,23175 mm\nPixeldichte: 109 ppi\nHorizontaler Scanbereich: 30 - 160 kHz\nVertikaler Scanbereich: 48 - 100 Hz\nSichtbare Gr\u00f6\u00dfe (horizontal): 79,7 cm\nSichtbare Gr\u00f6\u00dfe (vertikal): 33,4 cm\nSichtbare Gr\u00f6\u00dfe (diagonal): 86,4 cm\nBildschirmdiagonale (cm): 86,42 cm\nRGB-Farbraum: DCI-P3\nFarbskala: 89,2%\nsRGB Abdeckung (klassisch): 99,7%\nNVIDIA G-SYNC: Nein\nAMD FreeSync: Ja\nFlimmerfreie Technologie: Ja\nEingebaute Lautsprecher: Ja\nIntegrierte Kamera: Nein\nAnzahl der Lautsprecher: 2\nRMS-Leistung: 10 W\nMarktpositionierung: Haus\nProduktfarbe: Schwarz, Silber\nVorderer Rahmen: Schwarz\nAbnehmbarer Standfu\u00df: Ja\nFu\u00dffarbe: Silber\nSchwermetallfrei: Hg (Quecksilber)\nIntegrierter USB-Hub: Ja\nHDMI: Ja\nUSB-Hub-Version: 2.0 / 3.2 Gen 1 (3.1 Gen 1)\nUSB-Upstream-Porttyp: USB Typ-B\nAnzahl der vorgeschalteten Steckpl\u00e4tze: 1\nAnzahl der nachgeschalteten Steckpl\u00e4tze vom Typ USB-A: 2\nAnzahl HDMI-Anschl\u00fcsse: 2\nHDMI-Version: 2.2\nAnzahl DisplayPort Anschl\u00fcsse: 1\nDisplayPorts-Version: 1.2\nAudioausgang: Ja\nHDCP: Ja\nVESA-Halterung: Ja\nKabelsperre-Slot: Ja\nH\u00f6henverstellung: Ja\nPanel-Montage-Schnittstelle: 100 x 100 mm\nH\u00f6heneinstellung: 10 cm\nkippbar: Ja\nNeigungswinkelbereich: 5 - 21\u00b0\nOn-Screen-Display (OSD): Ja\nPlug & Play: Ja\nEnergieeffizienzklasse (SDR): G\nEnergieverbrauch (SDR) pro 1.000 Stunden: 32 kWh\nStromverbrauch (Standby): 0,3 W\nStromverbrauch (max.): 92 W\nStromverbrauch (aus): 0,3 W\nAC Eingangsspannung: 100 - 240 V\nAC Eingangsfrequenz: 50/60 Hz\nTemperaturbereich in Betrieb: 0 - 40 \u00b0C\nTemperaturbereich bei Lagerung: 20 - 60 \u00b0C\nRelative Luftfeuchtigkeit in Betrieb: 10 - 80%\nLuftfeuchtigkeit bei Lagerung: 10 - 90%\nH\u00f6he bei Betrieb: 0 - 5000 m\nH\u00f6he bei Lagerung: 0 - 12192 m\nNachhaltigkeitszertifikate: RoHS\nEnth\u00e4lt nicht: PVC/BFR\nGer\u00e4tebreite (inkl. Fu\u00df): 808,2 mm\nGer\u00e4tetiefe (inkl. Fu\u00df): 210 mm\nGer\u00e4teh\u00f6he (inkl. Fu\u00df): 489,4 mm\nGewicht (mit St\u00e4nder): 9,8 kg\nBreite (ohne Standfu\u00df): 80,8 cm\nTiefe (ohne Standfu\u00df): 6,4 cm\nH\u00f6he (ohne Standfu\u00df): 36,5 cm\nGewicht (ohne St\u00e4nder): 6,7 kg\nBezel Weite (side): 8,65 mm\nBezel Weite (top): 8,64 mm\nBezel Weite (bottom): 2,21 cm\nSt\u00e4nder enthalten: Ja\nMitgelieferte Kabel: AC, HDMI, USB\nSchnellstart\u00fcbersicht: Ja\nVerpackungsbreite: 468,1 mm\nVerpackungstiefe: 950 mm\nVerpackungsh\u00f6he: 225 mm\nPaketgewicht: 14,9 kg",
    "reference_file": "offer_reference_1412.json",
    "shop_name": "Jacob Elektronik direkt (AT)"
}