{
    "html_file": "offer_1301_20.html",
    "name": "HP M24f, 23.8\"",
    "offer_link": "https://www.mylemon.at/artikel/hewlett_packard/2d9k0e9_abb/hp-m24f-fhd-monitor-60.html",
    "price": 173.95,
    "raw_specifications": {
        "AMD FreeSync": "Ja",
        "AMD FreeSync-Typ": "FreeSync",
        "Anzahl HDMI-Anschl\u00fcsse": "1",
        "Anzahl VGA (D-Sub) Anschl\u00fcsse": "1",
        "Artikelnummer": "M1AY3PIL",
        "Aufl\u00f6sung": "1920x1080",
        "Besonderheiten": "75 Hz",
        "Betriebstemperatur": "5 - 35 \u00b0C",
        "Bildschirmdiagonale": "60,5 cm (23.8 Zoll)",
        "Bildschirmdiagonale (cm)": "60,45 cm",
        "Bildschirmform": "Flach",
        "Bildwinkel, horizontal": "178\u00b0",
        "Bildwinkel, vertikal": "178\u00b0",
        "Blendfreier Bildschirm": "Ja",
        "Breite (ohne Standfu\u00df)": "53,6 cm",
        "Digital horizontale Frequenz": "30 - 86 kHz",
        "Digital vertikale Frequenz": "48 - 75 Hz",
        "Display-Aufl\u00f6sung": "1920 x 1080 Pixel",
        "Displaygr\u00f6\u00dfe": "23,8 Zoll",
        "EAN": "196068980825",
        "Eingebaute Lautsprecher": "Nein",
        "Eingebautes Mikrofon": "Nein",
        "Ergonomie": "Neigbar",
        "Farbskala": "99%",
        "Flimmerfreie Technologie": "Ja",
        "Ger\u00e4tebreite (inkl. Fu\u00df)": "535,8 mm",
        "Ger\u00e4teh\u00f6he (inkl. Fu\u00df)": "396,8 mm",
        "Ger\u00e4tetiefe (inkl. Fu\u00df)": "177,2 mm",
        "Gewicht (mit St\u00e4nder)": "2,5 kg",
        "HD-Typ": "Full HD",
        "HDMI": "Ja",
        "HDMI-Version": "1.4",
        "HP-Segment": "Haus",
        "Helligkeit": "300 cd/m\u00b2",
        "Helligkeit (typisch)": "300 cd/m\u00b2",
        "Hersteller Artikelnummer": "2D9K0E9#ABB",
        "H\u00f6he (ohne Standfu\u00df)": "31,6 cm",
        "H\u00f6henverstellung": "Nein",
        "Integrierte Kamera": "Nein",
        "Integrierter USB-Hub": "Nein",
        "Kontrastverh\u00e4ltnis": "1000:1",
        "Kontrastverh\u00e4ltnis (dynamisch)": "10000000:1",
        "Kopfh\u00f6rerausgang": "Nein",
        "Low-Blue-Light-Technologie": "Ja",
        "Marktpositionierung": "Haus",
        "Maximale Bildwiederholrate": "75 Hz",
        "Mitgelieferte Kabel": "AC, HDMI, VGA",
        "NVIDIA G-SYNC": "Nein",
        "Nachhaltigkeitszertifikate": "ENERGY STAR",
        "Natives Seitenverh\u00e4ltnis": "16:9",
        "Neigungsverstellung": "Ja",
        "Neigungswinkelbereich": "-5 - 25\u00b0",
        "Oberfl\u00e4chenh\u00e4rte": "3H",
        "Paketgewicht": "4,7 kg",
        "Panel": "IPS",
        "Panel-Typ": "IPS",
        "Pivot": "Nein",
        "Pixel Abstand": "0,275 x 0,275 mm",
        "Pixeldichte": "93 ppi",
        "Produktfarbe": "Schwarz, Silber",
        "RGB-Farbraum": "sRGB",
        "Reaktionszeit": "5 ms",
        "Relative Luftfeuchtigkeit in Betrieb": "5 - 95%",
        "Schwenkbar": "Nein",
        "Seitenverh\u00e4ltnis": "16:9",
        "Stromverbrauch (Standardbetrieb)": "14,3 W",
        "Stromverbrauch (Standby)": "0,5 W",
        "Stromverbrauch (max.)": "20 W",
        "Tiefe (ohne Standfu\u00df)": "3,4 cm",
        "Touchscreen": "Nein",
        "Unterst\u00fctzte Grafik-Aufl\u00f6sungen": "640 x 480 (VGA), 720 x 400, 800 x 600 (SVGA), 1024 x 768 (XGA), 1280 x 1024 (SXGA), 1280 x 720 (HD 720), 1280 x 800 (WXGA), 1400 x 900, 1600 x 900, 1680 x 1050 (WSXGA+), 1920 x 1080 (HD 1080)",
        "VESA-Halterung": "Nein",
        "Verpackungsbreite": "610 mm",
        "Verpackungsh\u00f6he": "399 mm",
        "Verpackungstiefe": "121 mm",
        "Video Anschl\u00fcsse": "1x VGA, 1x HDMI",
        "Zertifizierung": "Australian-New Zealand MEPS; BIS; BSMI; CB; CCC; CE; CECP; CEL; cTUVus; EAC; ENERGY STAR\u00ae; EUP Lot-5; EUP Lot-6; FCC; ICES; ISO 9241-307; KC/KCC; NOM; VCCI; Vietnam MEPS; WEEE; Low blue light; EUP Lot-26; California Energy Commission (CEC); South Africa Energy; eStandby; WW application; UAE; Ukraine certificates; NRCS of South Africa"
    },
    "raw_specifications_text": "Displaygr\u00f6\u00dfe: 23,8 Zoll\nAufl\u00f6sung: 1920x1080\nPanel: IPS\nReaktionszeit: 5 ms\nVideo Anschl\u00fcsse: 1x VGA, 1x HDMI\nErgonomie: Neigbar\nHelligkeit: 300 cd/m\u00b2\nBesonderheiten: 75 Hz\nHersteller Artikelnummer: 2D9K0E9#ABB\nEAN: 196068980825\nArtikelnummer: M1AY3PIL\nBildschirmdiagonale: 60,5 cm (23.8 Zoll)\nDisplay-Aufl\u00f6sung: 1920 x 1080 Pixel\nNatives Seitenverh\u00e4ltnis: 16:9\nTouchscreen: Nein\nHD-Typ: Full HD\nPanel-Typ: IPS\nBildschirmform: Flach\nKontrastverh\u00e4ltnis: 1000:1\nMaximale Bildwiederholrate: 75 Hz\nHelligkeit (typisch): 300 cd/m\u00b2\nBlendfreier Bildschirm: Ja\nUnterst\u00fctzte Grafik-Aufl\u00f6sungen: 640 x 480 (VGA), 720 x 400, 800 x 600 (SVGA), 1024 x 768 (XGA), 1280 x 1024 (SXGA), 1280 x 720 (HD 720), 1280 x 800 (WXGA), 1400 x 900, 1600 x 900, 1680 x 1050 (WSXGA+), 1920 x 1080 (HD 1080)\nSeitenverh\u00e4ltnis: 16:9\nKontrastverh\u00e4ltnis (dynamisch): 10000000:1\nBildwinkel, horizontal: 178\u00b0\nBildwinkel, vertikal: 178\u00b0\nPixel Abstand: 0,275 x 0,275 mm\nPixeldichte: 93 ppi\nDigital horizontale Frequenz: 30 - 86 kHz\nDigital vertikale Frequenz: 48 - 75 Hz\nBildschirmdiagonale (cm): 60,45 cm\nOberfl\u00e4chenh\u00e4rte: 3H\nRGB-Farbraum: sRGB\nFarbskala: 99%\nNVIDIA G-SYNC: Nein\nAMD FreeSync: Ja\nAMD FreeSync-Typ: FreeSync\nFlimmerfreie Technologie: Ja\nLow-Blue-Light-Technologie: Ja\nHP-Segment: Haus\nEingebaute Lautsprecher: Nein\nIntegrierte Kamera: Nein\nEingebautes Mikrofon: Nein\nMarktpositionierung: Haus\nProduktfarbe: Schwarz, Silber\nZertifizierung: Australian-New Zealand MEPS; BIS; BSMI; CB; CCC; CE; CECP; CEL; cTUVus; EAC; ENERGY STAR\u00ae; EUP Lot-5; EUP Lot-6; FCC; ICES; ISO 9241-307; KC/KCC; NOM; VCCI; Vietnam MEPS; WEEE; Low blue light; EUP Lot-26; California Energy Commission (CEC); South Africa Energy; eStandby; WW application; UAE; Ukraine certificates; NRCS of South Africa\nIntegrierter USB-Hub: Nein\nHDMI: Ja\nKopfh\u00f6rerausgang: Nein\nAnzahl VGA (D-Sub) Anschl\u00fcsse: 1\nAnzahl HDMI-Anschl\u00fcsse: 1\nHDMI-Version: 1.4\nVESA-Halterung: Nein\nH\u00f6henverstellung: Nein\nPivot: Nein\nSchwenkbar: Nein\nNeigungswinkelbereich: -5 - 25\u00b0\nNeigungsverstellung: Ja\nStromverbrauch (Standardbetrieb): 14,3 W\nStromverbrauch (Standby): 0,5 W\nStromverbrauch (max.): 20 W\nBetriebstemperatur: 5 - 35 \u00b0C\nRelative Luftfeuchtigkeit in Betrieb: 5 - 95%\nMitgelieferte Kabel: AC, HDMI, VGA\nGer\u00e4tebreite (inkl. Fu\u00df): 535,8 mm\nGer\u00e4tetiefe (inkl. Fu\u00df): 177,2 mm\nGer\u00e4teh\u00f6he (inkl. Fu\u00df): 396,8 mm\nGewicht (mit St\u00e4nder): 2,5 kg\nBreite (ohne Standfu\u00df): 53,6 cm\nTiefe (ohne Standfu\u00df): 3,4 cm\nH\u00f6he (ohne Standfu\u00df): 31,6 cm\nVerpackungsbreite: 610 mm\nVerpackungstiefe: 121 mm\nVerpackungsh\u00f6he: 399 mm\nPaketgewicht: 4,7 kg\nNachhaltigkeitszertifikate: ENERGY STAR",
    "reference_file": "offer_reference_1301.json",
    "shop_name": "mylemon.at"
}