{
    "html_file": "offer_1605_8.html",
    "name": "Acer KA3 K273bmix, 27\"",
    "offer_link": "https://direkt.jacob.de/produkte/acer-k273bmix-68-6cm-um-hx3ee-005-artnr-6971260.html?utm_source=geizhals&utm_medium=cpc&utm_campaign=Preisvergleich&ref=103",
    "price": 138.94,
    "raw_specifications": {
        "Adaptive-Sync Technologie": "AMD FreeSync",
        "Ausgangsleistung/Kanal": "2 Watt",
        "Besonderheiten": "Acer Adaptive Contrast Management (ACM), 72 % NTSC-Farbskala, High Frame Rate Control (Hi-FRC), ComfyView, Flimmerfrei-Technologie, 6-Bit-Gamma,  Acer BluelightShield-Technologie, an 3 Seiten ohne Blende",
        "Bildschirmbeschichtung": "Blendfrei",
        "Bildschirmtyp": "IPS",
        "Blendentyp": "Flache Front",
        "Diagonalabmessung": "68.6 cm (27\")",
        "Display-Typ": "LED-hintergrundbeleuchteter LCD-Monitor / TFT-Aktivmatrix",
        "ENERGY STAR zertifiziert": "Ja",
        "Eingangsanschl\u00fcsse": "HDMI, VGA",
        "Einstellungen der Anzeigeposition": "Neigung",
        "Energie Effizienzklasse": "F",
        "Energieverbrauch pro Jahr": "23 kWh",
        "Enthaltene Kabel": "1 x HDMI-Kabel",
        "Erforderliche Netzspannung": "Wechselstrom 120/230 V (50/60 Hz)",
        "Farbe": "Schwarz",
        "Farbunterst\u00fctzung": "16,7 Millionen Farben",
        "Ger\u00e4tetyp": "LED-hintergrundbeleuchteter LCD-Monitor - 68.6 cm (27\")",
        "Helligkeit": "250 cd/m\u00b2",
        "Hintergrundbeleuchtungs-Technologie": "LED-Hintergrundbeleuchtung",
        "Horizontaler Betrachtungswinkel": "178",
        "Kennzeichnung": "MPR II",
        "Kontrast": "1000:1 / 100000000:1 (dynamisch)",
        "Leistungsaufnahme im Betrieb": "16 Watt",
        "Leistungsaufnahme im Ein-Zustand": "16 W",
        "Leistungsmerkmale": "Slot f\u00fcr Sicherheitsschloss (Kabelschloss getrennt erh\u00e4ltlich), Unterst\u00fctzung f\u00fcr VESA-Schnittstelle",
        "Native Aufl\u00f6sung": "Full HD (1080p) 1920 x 1080 bei 75 Hz",
        "Neigungswinkel": "-5/+15",
        "Produktbeschreibung": "Acer K273 bmix - K3 series - LED-Monitor - Full HD (1080p) - 68.6 cm (27\")",
        "Reaktionszeit": "1 ms (VRB)",
        "Schlosstyp zur Diebstahlsicherung": "Kensington Slot",
        "Schnittstellen": "HDMI  VGA  Audio Line-Out",
        "Seitenverh\u00e4ltnis": "16:9",
        "Sichtbare Bildfl\u00e4che": "68.6 cm (27\")",
        "Stromverbrauch (Aus-Modus)": "0.45 Watt",
        "Stromverbrauch im Standby-Modus": "0.5 Watt",
        "Typ": "Lautsprecher - Stereo",
        "Umweltschutzstandards": "ENERGY STAR-qualifiziert",
        "VESA-Halterung": "100 x 100 mm",
        "Vertikaler Betrachtungswinkel": "178"
    },
    "raw_specifications_text": "Produktbeschreibung: Acer K273 bmix - K3 series - LED-Monitor - Full HD (1080p) - 68.6 cm (27\")\nGer\u00e4tetyp: LED-hintergrundbeleuchteter LCD-Monitor - 68.6 cm (27\")\nEnergie Effizienzklasse: F\nEnergieverbrauch pro Jahr: 23 kWh\nLeistungsaufnahme im Ein-Zustand: 16 W\nAdaptive-Sync Technologie: AMD FreeSync\nBildschirmtyp: IPS\nSeitenverh\u00e4ltnis: 16:9\nNative Aufl\u00f6sung: Full HD (1080p) 1920 x 1080 bei 75 Hz\nHelligkeit: 250 cd/m\u00b2\nKontrast: 1000:1 / 100000000:1 (dynamisch)\nReaktionszeit: 1 ms (VRB)\nFarbunterst\u00fctzung: 16,7 Millionen Farben\nEingangsanschl\u00fcsse: HDMI, VGA\nEinstellungen der Anzeigeposition: Neigung\nBildschirmbeschichtung: Blendfrei\nFarbe: Schwarz\nUmweltschutzstandards: ENERGY STAR-qualifiziert\nKennzeichnung: MPR II\nDisplay-Typ: LED-hintergrundbeleuchteter LCD-Monitor / TFT-Aktivmatrix\nDiagonalabmessung: 68.6 cm (27\")\nSichtbare Bildfl\u00e4che: 68.6 cm (27\")\nHorizontaler Betrachtungswinkel: 178\nVertikaler Betrachtungswinkel: 178\nHintergrundbeleuchtungs-Technologie: LED-Hintergrundbeleuchtung\nBlendentyp: Flache Front\nBesonderheiten: Acer Adaptive Contrast Management (ACM), 72 % NTSC-Farbskala, High Frame Rate Control (Hi-FRC), ComfyView, Flimmerfrei-Technologie, 6-Bit-Gamma,  Acer BluelightShield-Technologie, an 3 Seiten ohne Blende\nTyp: Lautsprecher - Stereo\nAusgangsleistung/Kanal: 2 Watt\nSchnittstellen: HDMI  VGA  Audio Line-Out\nNeigungswinkel: -5/+15\nVESA-Halterung: 100 x 100 mm\nLeistungsmerkmale: Slot f\u00fcr Sicherheitsschloss (Kabelschloss getrennt erh\u00e4ltlich), Unterst\u00fctzung f\u00fcr VESA-Schnittstelle\nEnthaltene Kabel: 1 x HDMI-Kabel\nSchlosstyp zur Diebstahlsicherung: Kensington Slot\nErforderliche Netzspannung: Wechselstrom 120/230 V (50/60 Hz)\nLeistungsaufnahme im Betrieb: 16 Watt\nStromverbrauch im Standby-Modus: 0.5 Watt\nStromverbrauch (Aus-Modus): 0.45 Watt\nENERGY STAR zertifiziert: Ja",
    "reference_file": "offer_reference_1605.json",
    "shop_name": "Jacob Elektronik direkt (AT)"
}