{
    "html_file": "offer_1112_8.html",
    "name": "ASUS BE27ACSBK, 27\"",
    "offer_link": "https://direkt.jacob.de/produkte/asus-be27acsbk-68-6-90lm03i1-b01370-artnr-7521050.html?utm_source=geizhals&utm_medium=cpc&utm_campaign=Preisvergleich&ref=103",
    "price": 483.02,
    "raw_specifications": {
        "AC Eingangsfrequenz": "50/60 Hz",
        "AC Eingangsspannung": "100 - 240 V",
        "AMD FreeSync": "Nein",
        "Abnehmbarer Standfu\u00df": "Ja",
        "Anzahl DisplayPort Anschl\u00fcsse": "2",
        "Anzahl HDMI-Anschl\u00fcsse": "1",
        "Anzahl der Farben des Displays": "16,7 Millionen Farben",
        "Anzahl der Lautsprecher": "2",
        "Anzahl der Upstream-Ports USB Typ-C": "1",
        "Anzahl der nachgeschalteten Steckpl\u00e4tze vom Typ USB-A": "4",
        "Bildschirmaufl\u00f6sung": "2560 x 1440 Pixel",
        "Bildschirmdiagonale": "68,6 cm (27\" )",
        "Bildschirmform": "Flach",
        "Bildschirmtechnologie": "LED",
        "Blendfreier Bildschirm": "Ja",
        "Blickwinkel, horizontal": "178\u00b0",
        "Blickwinkel, vertikal": "178\u00b0",
        "Breite (ohne Standfu\u00df)": "61,2 cm",
        "ConnectShare (USB)": "Ja",
        "DisplayPorts-Version": "1.2",
        "Eingebaute Lautsprecher": "Ja",
        "Eingebautes Mikrofon": "Ja",
        "Energie Effizienzklasse": "F",
        "Energieeffizienzklasse (SDR)": "F",
        "Energieverbrauch (SDR) pro 1.000 Stunden": "26 kWh",
        "Farbskala": "100%",
        "Flimmerfreie Technologie": "Ja",
        "Ger\u00e4tebreite (inkl. Fu\u00df)": "612,4 mm",
        "Ger\u00e4teh\u00f6he (inkl. Fu\u00df)": "547,8 mm",
        "Ger\u00e4tetiefe (inkl. Fu\u00df)": "259 mm",
        "Gewicht (mit St\u00e4nder)": "8,6 kg",
        "Gewicht (ohne St\u00e4nder)": "5,8 kg",
        "HD-Typ": "Quad HD",
        "HDCP": "Ja",
        "HDMI": "Ja",
        "HDMI-Version": "1.4",
        "Helligkeit (typisch)": "350 cd/m\u00b2",
        "H\u00f6he (ohne Standfu\u00df)": "42,7 cm",
        "H\u00f6heneinstellung": "15 cm",
        "H\u00f6henverstellung": "Ja",
        "Integrierte Kamera": "Ja",
        "Integrierter USB-Hub": "Ja",
        "Kabelsperre-Slot": "Ja",
        "Kamerabildpunkte": "2 MP",
        "Kontrastverh\u00e4ltnis": "1000:1",
        "Kopfh\u00f6rer-Konnektivit\u00e4t": "3,5 mm",
        "Kopfh\u00f6rerausgang": "Ja",
        "Kopfh\u00f6rerausg\u00e4nge": "1",
        "Low-Blue-Light-Technologie": "Ja",
        "Marktpositionierung": "Business",
        "Maximale Bildwiederholrate": "60 Hz",
        "Mitgelieferte Kabel": "AC, HDMI, USB Typ-C",
        "NVIDIA G-SYNC": "Nein",
        "Natives Seitenverh\u00e4ltnis": "16:9",
        "Neigungswinkelbereich": "35 - -5\u00b0",
        "Paketgewicht": "11,2 kg",
        "Panel-Montage-Schnittstelle": "100 x 100 mm",
        "Panel-Typ": "IPS",
        "Pivot": "Ja",
        "Pivot Winkel": "90 - -90\u00b0",
        "Produktfarbe": "Schwarz",
        "RGB-Farbraum": "sRGB",
        "RMS-Leistung": "4 W",
        "Reaktionszeit": "5 ms",
        "Relative Luftfeuchtigkeit in Betrieb": "10 - 80%",
        "Schnellstart\u00fcbersicht": "Ja",
        "Schwenkbar": "Ja",
        "Schwenkwinkelbereich": "180 - -180\u00b0",
        "Sichtbare Gr\u00f6\u00dfe (horizontal)": "59,7 cm",
        "Sichtbare Gr\u00f6\u00dfe (vertikal)": "33,6 cm",
        "Slot-Typ Kabelsperre": "Kensington",
        "Stromeingang": "Ja",
        "Stromverbrauch (Standardbetrieb)": "21,3 W",
        "Stromverbrauch (Standby)": "0,5 W",
        "St\u00e4nder enthalten": "Ja",
        "Temperaturbereich in Betrieb": "0 - 40 \u00b0C",
        "Tiefe (ohne Standfu\u00df)": "5,61 cm",
        "USB-Hub-Version": "3.2 Gen 1 (3.1 Gen 1)",
        "USB-Stromversorgung bis zu": "80 W",
        "VESA-Halterung": "Ja",
        "Verpackungsart": "Box",
        "Verpackungsbreite": "713 mm",
        "Verpackungsh\u00f6he": "502 mm",
        "Verpackungstiefe": "228 mm",
        "kippbar": "Ja",
        "sRGB Abdeckung (klassisch)": "100%"
    },
    "raw_specifications_text": "Energie Effizienzklasse: F\nBildschirmdiagonale: 68,6 cm (27\" )\nBildschirmaufl\u00f6sung: 2560 x 1440 Pixel\nNatives Seitenverh\u00e4ltnis: 16:9\nPanel-Typ: IPS\nHD-Typ: Quad HD\nBildschirmtechnologie: LED\nBildschirmform: Flach\nKontrastverh\u00e4ltnis: 1000:1\nMaximale Bildwiederholrate: 60 Hz\nAnzahl der Farben des Displays: 16,7 Millionen Farben\nHelligkeit (typisch): 350 cd/m\u00b2\nReaktionszeit: 5 ms\nBlendfreier Bildschirm: Ja\nBlickwinkel, horizontal: 178\u00b0\nBlickwinkel, vertikal: 178\u00b0\nSichtbare Gr\u00f6\u00dfe (horizontal): 59,7 cm\nSichtbare Gr\u00f6\u00dfe (vertikal): 33,6 cm\nRGB-Farbraum: sRGB\nFarbskala: 100%\nsRGB Abdeckung (klassisch): 100%\nNVIDIA G-SYNC: Nein\nAMD FreeSync: Nein\nConnectShare (USB): Ja\nFlimmerfreie Technologie: Ja\nLow-Blue-Light-Technologie: Ja\nEingebaute Lautsprecher: Ja\nIntegrierte Kamera: Ja\nAnzahl der Lautsprecher: 2\nRMS-Leistung: 4 W\nKamerabildpunkte: 2 MP\nEingebautes Mikrofon: Ja\nMarktpositionierung: Business\nProduktfarbe: Schwarz\nAbnehmbarer Standfu\u00df: Ja\nIntegrierter USB-Hub: Ja\nHDMI: Ja\nKopfh\u00f6rerausgang: Ja\nUSB-Hub-Version: 3.2 Gen 1 (3.1 Gen 1)\nAnzahl der Upstream-Ports USB Typ-C: 1\nAnzahl der nachgeschalteten Steckpl\u00e4tze vom Typ USB-A: 4\nUSB-Stromversorgung bis zu: 80 W\nAnzahl HDMI-Anschl\u00fcsse: 1\nHDMI-Version: 1.4\nAnzahl DisplayPort Anschl\u00fcsse: 2\nDisplayPorts-Version: 1.2\nKopfh\u00f6rerausg\u00e4nge: 1\nKopfh\u00f6rer-Konnektivit\u00e4t: 3,5 mm\nHDCP: Ja\nStromeingang: Ja\nVESA-Halterung: Ja\nKabelsperre-Slot: Ja\nH\u00f6henverstellung: Ja\nPanel-Montage-Schnittstelle: 100 x 100 mm\nSlot-Typ Kabelsperre: Kensington\nH\u00f6heneinstellung: 15 cm\nPivot: Ja\nPivot Winkel: 90 - -90\u00b0\nSchwenkbar: Ja\nSchwenkwinkelbereich: 180 - -180\u00b0\nkippbar: Ja\nNeigungswinkelbereich: 35 - -5\u00b0\nEnergieeffizienzklasse (SDR): F\nEnergieverbrauch (SDR) pro 1.000 Stunden: 26 kWh\nStromverbrauch (Standardbetrieb): 21,3 W\nStromverbrauch (Standby): 0,5 W\nAC Eingangsspannung: 100 - 240 V\nAC Eingangsfrequenz: 50/60 Hz\nTemperaturbereich in Betrieb: 0 - 40 \u00b0C\nRelative Luftfeuchtigkeit in Betrieb: 10 - 80%\nGer\u00e4tebreite (inkl. Fu\u00df): 612,4 mm\nGer\u00e4tetiefe (inkl. Fu\u00df): 259 mm\nGer\u00e4teh\u00f6he (inkl. Fu\u00df): 547,8 mm\nGewicht (mit St\u00e4nder): 8,6 kg\nBreite (ohne Standfu\u00df): 61,2 cm\nTiefe (ohne Standfu\u00df): 5,61 cm\nH\u00f6he (ohne Standfu\u00df): 42,7 cm\nGewicht (ohne St\u00e4nder): 5,8 kg\nSt\u00e4nder enthalten: Ja\nMitgelieferte Kabel: AC, HDMI, USB Typ-C\nSchnellstart\u00fcbersicht: Ja\nVerpackungsbreite: 713 mm\nVerpackungstiefe: 228 mm\nVerpackungsh\u00f6he: 502 mm\nPaketgewicht: 11,2 kg\nVerpackungsart: Box",
    "reference_file": "offer_reference_1112.json",
    "shop_name": "Jacob Elektronik direkt (AT)"
}