{
    "html_file": "offer_885_6.html",
    "name": "ASUS TUF Gaming VG32AQL1A, 31.5\"",
    "offer_link": "https://www.office-partner.de/productredirect/index/sku/24044578?sPartner=p-geizhals-at&campaign=psm/geizhals-at/",
    "price": 541.4,
    "raw_specifications": {
        "Anschl\u00fcsse": "HDMI, DisplayPort, USB, Kopfh\u00f6reranschluss, Audioausgang (Line-Out)",
        "Artikelnummer": "24044578",
        "Aufl\u00f6sung Kurzname": "Full HD",
        "Bezeichnung des Herstellers": "ASUS VG32AQL1A TUF Gaming",
        "Breite": "716,00 mm",
        "Display Features": "FlickerFree",
        "Display Sync": "AMD FreeSync, NVIDIA G-Sync",
        "Displaygr\u00f6\u00dfe": "81,28 cm (32 Zoll)",
        "EEK - Spektrum": "AG",
        "Einsatzort": "Innen",
        "Energieeffizienzklasse": "G",
        "Geh\u00e4usefarbe des Ger\u00e4tes": "Schwarz",
        "Gewicht": "8,60 kg",
        "Gewicht inkl. Verpackung in Kg": "12,40 kg",
        "Helligkeit Bereich": "300 - 450 cd/m\u00b2",
        "Hersteller": "ASUS",
        "H\u00f6he": "565,00 mm",
        "Kapazit\u00e4t (Seiten)": "0",
        "Kontrastverh\u00e4ltnis (typisch) Bereich": "800:1 bis 1.200:1",
        "LCD-Technologie": "IPS Panel",
        "L\u00e4nge": "240,00 mm",
        "Produktart": "Monitore",
        "Reaktionszeit": "1,00 ms",
        "Seitenverh\u00e4ltnis": "16:9",
        "Shop Herstellernummer": "90LM07L0-B01370",
        "Standard-EAN": "4711081214960",
        "Verpackung - Breite in cm": "81,80 cm",
        "Verpackung - H\u00f6he in cm": "64,50 cm",
        "Verpackung - L\u00e4nge in cm": "26,00 cm",
        "max. Aufl\u00f6sung": "2.560 x 1.440 Pixel (16:9)"
    },
    "raw_specifications_text": "Energieeffizienzklasse: G\nGeh\u00e4usefarbe des Ger\u00e4tes: Schwarz\nAnschl\u00fcsse: HDMI, DisplayPort, USB, Kopfh\u00f6reranschluss, Audioausgang (Line-Out)\nKontrastverh\u00e4ltnis (typisch) Bereich: 800:1 bis 1.200:1\nDisplay Features: FlickerFree\nHelligkeit Bereich: 300 - 450 cd/m\u00b2\nDisplaygr\u00f6\u00dfe: 81,28 cm (32 Zoll)\nHersteller: ASUS\nGewicht: 8,60 kg\nProduktart: Monitore\nDisplay Sync: AMD FreeSync, NVIDIA G-Sync\nAufl\u00f6sung Kurzname: Full HD\nKapazit\u00e4t (Seiten): 0\nEEK - Spektrum: AG\nVerpackung - L\u00e4nge in cm: 26,00 cm\nL\u00e4nge: 240,00 mm\nBreite: 716,00 mm\nArtikelnummer: 24044578\nStandard-EAN: 4711081214960\nShop Herstellernummer: 90LM07L0-B01370\nBezeichnung des Herstellers: ASUS VG32AQL1A TUF Gaming\nH\u00f6he: 565,00 mm\nVerpackung - Breite in cm: 81,80 cm\nVerpackung - H\u00f6he in cm: 64,50 cm\nGewicht inkl. Verpackung in Kg: 12,40 kg\nmax. Aufl\u00f6sung: 2.560 x 1.440 Pixel (16:9)\nSeitenverh\u00e4ltnis: 16:9\nLCD-Technologie: IPS Panel\nReaktionszeit: 1,00 ms\nEinsatzort: Innen",
    "reference_file": "offer_reference_885.json",
    "shop_name": "office-partner (AT)"
}