{
    "html_file": "offer_1309_0.html",
    "name": "LG 24MP400-B, 23.8\"",
    "offer_link": "https://direkt.jacob.de/produkte/lg-24mp400-b-computerbildschirm-24mp400-b-artnr-7402885.html?utm_source=geizhals&utm_medium=cpc&utm_campaign=Preisvergleich&ref=103",
    "price": 96.66,
    "raw_specifications": {
        "AC Eingangsfrequenz": "50/60 Hz",
        "AC Eingangsspannung": "100 - 240 V",
        "AMD FreeSync": "Ja",
        "AMD FreeSync-Typ": "FreeSync",
        "Anzahl HDMI-Anschl\u00fcsse": "1",
        "Anzahl VGA (D-Sub) Anschl\u00fcsse": "1",
        "Anzahl der Farben des Displays": "16,7 Millionen Farben",
        "Bildschirmaufl\u00f6sung": "1920 x 1080 Pixel",
        "Bildschirmdiagonale": "61 cm (24\" )",
        "Bildschirmform": "Flach",
        "Bildschirmtechnologie": "LED",
        "Blendfreier Bildschirm": "Ja",
        "Blickwinkel, horizontal": "178\u00b0",
        "Blickwinkel, vertikal": "178\u00b0",
        "Breite (ohne Standfu\u00df)": "54 cm",
        "Energie Effizienzklasse": "F",
        "Flimmerfreie Technologie": "Ja",
        "Ger\u00e4tebreite (inkl. Fu\u00df)": "539,9 mm",
        "Ger\u00e4teh\u00f6he (inkl. Fu\u00df)": "414,4 mm",
        "Ger\u00e4tetiefe (inkl. Fu\u00df)": "190 mm",
        "Gewicht (mit St\u00e4nder)": "2,6 kg",
        "Gewicht (ohne St\u00e4nder)": "2,3 kg",
        "HD-Typ": "Full HD",
        "HDMI": "Ja",
        "Helligkeit (typisch)": "200 cd/m\u00b2",
        "H\u00f6he (ohne Standfu\u00df)": "32,1 cm",
        "Kontrastverh\u00e4ltnis": "1000:1",
        "Marktpositionierung": "Haus",
        "Maximale Bildwiederholrate": "75 Hz",
        "Mitgelieferte Kabel": "HDMI",
        "NTSC Abdeckung (typisch)": "72%",
        "Natives Seitenverh\u00e4ltnis": "16:9",
        "Paketgewicht": "3,9 kg",
        "Panel-Montage-Schnittstelle": "75 x 75 mm",
        "Panel-Typ": "IPS",
        "Pixel Abstand": "0,2745 x 0,2746 mm",
        "Produktfarbe": "Schwarz",
        "Reaktionszeit": "5 ms",
        "Stromverbrauch (Standardbetrieb)": "19 W",
        "Stromverbrauch (Standby)": "0,3 W",
        "Stromverbrauch (aus)": "0,3 W",
        "Stromverbrauch (max.)": "22 W",
        "Tiefe (ohne Standfu\u00df)": "5,62 cm",
        "VESA-Halterung": "Ja",
        "Verpackungsbreite": "615 mm",
        "Verpackungsh\u00f6he": "148 mm",
        "Verpackungstiefe": "410 mm",
        "kippbar": "Ja"
    },
    "raw_specifications_text": "Bildschirmdiagonale: 61 cm (24\" )\nBildschirmaufl\u00f6sung: 1920 x 1080 Pixel\nNatives Seitenverh\u00e4ltnis: 16:9\nEnergie Effizienzklasse: F\nPanel-Typ: IPS\nHD-Typ: Full HD\nBildschirmtechnologie: LED\nBildschirmform: Flach\nKontrastverh\u00e4ltnis: 1000:1\nMaximale Bildwiederholrate: 75 Hz\nAnzahl der Farben des Displays: 16,7 Millionen Farben\nHelligkeit (typisch): 200 cd/m\u00b2\nReaktionszeit: 5 ms\nBlendfreier Bildschirm: Ja\nBlickwinkel, horizontal: 178\u00b0\nBlickwinkel, vertikal: 178\u00b0\nPixel Abstand: 0,2745 x 0,2746 mm\nNTSC Abdeckung (typisch): 72%\nAMD FreeSync: Ja\nAMD FreeSync-Typ: FreeSync\nFlimmerfreie Technologie: Ja\nMarktpositionierung: Haus\nProduktfarbe: Schwarz\nHDMI: Ja\nAnzahl VGA (D-Sub) Anschl\u00fcsse: 1\nAnzahl HDMI-Anschl\u00fcsse: 1\nVESA-Halterung: Ja\nPanel-Montage-Schnittstelle: 75 x 75 mm\nkippbar: Ja\nStromverbrauch (Standardbetrieb): 19 W\nStromverbrauch (Standby): 0,3 W\nStromverbrauch (max.): 22 W\nStromverbrauch (aus): 0,3 W\nAC Eingangsspannung: 100 - 240 V\nAC Eingangsfrequenz: 50/60 Hz\nGer\u00e4tebreite (inkl. Fu\u00df): 539,9 mm\nGer\u00e4tetiefe (inkl. Fu\u00df): 190 mm\nGer\u00e4teh\u00f6he (inkl. Fu\u00df): 414,4 mm\nGewicht (mit St\u00e4nder): 2,6 kg\nBreite (ohne Standfu\u00df): 54 cm\nTiefe (ohne Standfu\u00df): 5,62 cm\nH\u00f6he (ohne Standfu\u00df): 32,1 cm\nGewicht (ohne St\u00e4nder): 2,3 kg\nMitgelieferte Kabel: HDMI\nVerpackungsbreite: 615 mm\nVerpackungstiefe: 410 mm\nVerpackungsh\u00f6he: 148 mm\nPaketgewicht: 3,9 kg",
    "reference_file": "offer_reference_1309.json",
    "shop_name": "Jacob Elektronik direkt (AT)"
}