{
    "html_file": "offer_509_10.html",
    "name": "HP P22v G5, 21.5\"",
    "offer_link": "https://www.csv-direct.de/artinfo.php?artnr=AGX1610927&KATEGORIE=162&pva=geizhals2",
    "price": 153.74,
    "raw_specifications": {
        "AC Eingangsfrequenz": "50 - 60 Hz",
        "AC Eingangsspannung": "100 - 240 V",
        "AMD FreeSync": "Nein",
        "Anzahl HDMI-Anschl\u00fcsse": "1",
        "Anzahl VGA D-Sub Anschl\u00fcsse": "1",
        "Anzahl der Farben des Displays": "16,7 Millionen Farben",
        "Betriebstemperatur": "5 - 35 \u00b0C",
        "Bildschirmdiagonale": "54,5 cm 21.4\"",
        "Bildschirmdiagonale cm": "54,5 cm",
        "Bildschirmform": "Flach",
        "Bildschirmtechnologie": "LCD",
        "Bildwinkel, horizontal": "178\u00b0",
        "Bildwinkel, vertikal": "178\u00b0",
        "Breite": "504,2 mm",
        "Display-Aufl\u00f6sung": "1920 x 1080 Pixel",
        "Eingebaute Lautsprecher": "Nein",
        "Energieeffizienzklasse SDR": "E",
        "Energieverbrauch SDR pro 1.000 Stunden": "15 kWh",
        "Farbskala": "72",
        "Farbtiefe": "8 Bit",
        "Ger\u00e4tebreite inkl. Fu\u00df": "50,4 mm",
        "Ger\u00e4teh\u00f6he inkl. Fu\u00df": "18,1 mm",
        "Ger\u00e4tetiefe inkl. Fu\u00df": "38,7 mm",
        "Gewicht": "2,8 kg",
        "Gewicht mit St\u00e4nder": "2,8 kg",
        "HD-Typ": "Full HD",
        "HDMI-Version": "1.4",
        "Helligkeit typisch": "200 cd/m\u00b2",
        "Horizontaler Scanbereich": "54 - 88,1 kHz",
        "H\u00f6he": "303 mm",
        "H\u00f6he ohne Standfu\u00df": "30,3 mm",
        "H\u00f6henverstellung": "Nein",
        "Integrierte Kamera": "Nein",
        "Integrierter USB-Hub": "Nein",
        "Kontrastverh\u00e4ltnis": "3000:1",
        "Kontrastverh\u00e4ltnis dynamisch": "8000000:1",
        "Kopfh\u00f6rerausgang": "Nein",
        "Marktpositionierung": "Business",
        "Maximale Bildwiederholrate": "75 Hz",
        "NVIDIA G-SYNC": "Nein",
        "Nachhaltige Technologien und Materialien": "Das geformte Papierzellstoffpolster im Inneren der Verpackung stammt zu 100  aus nachhaltigen Quellen und ist recycelbar; 85  recycelter Haushaltskunststoff; 100  Kunststoff aus geschlossenem IT-Ger\u00e4te-Kreislauf; Halogenarm",
        "Natives Seitenverh\u00e4ltnis": "16:9",
        "Neigungswinkelbereich": "-5 - 23\u00b0",
        "Oberfl\u00e4chenh\u00e4rte": "3H",
        "Paketgewicht": "4,3 kg",
        "Panel-Montage-Schnittstelle": "100 x 100 mm",
        "Panel-Typ": "VA",
        "Pixel Abstand": "0,25 x 0,24 mm",
        "Pixeldichte": "103 ppi",
        "Produktfarbe": "Schwarz",
        "RGB-Farbraum": "NTSC",
        "Reaktionszeit": "5 ms",
        "Relative Luftfeuchtigkeit in Betrieb": "20 - 80",
        "Stromverbrauch Standardbetrieb": "11 W",
        "Stromverbrauch Standby": "0,5 W",
        "Stromverbrauch max.": "21 W",
        "Tiefe": "50,8 mm",
        "Tiefe ohne Standfu\u00df": "5,08 mm",
        "Touchscreen": "Nein",
        "Unterst\u00fctzte Grafik-Aufl\u00f6sungen": "640 x 480 VGA, 720 x 400, 800 x 600 SVGA, 1024 x 768 XGA, 1280 x 720 HD 720, 1280 x 800 WXGA, 1440 x 900 WXGA+, 1600 x 900, 1680 x 1050 WSXGA+, 1920 x 1080 HD 1080",
        "Verpackungsbreite": "504,2 mm",
        "Verpackungsh\u00f6he": "386,9 mm",
        "Verpackungstiefe": "180,5 mm",
        "Vertikaler Scanbereich": "48 - 75 Hz"
    },
    "raw_specifications_text": "Bildschirmdiagonale: 54,5 cm 21.4\"\nDisplay-Aufl\u00f6sung: 1920 x 1080 Pixel\nNatives Seitenverh\u00e4ltnis: 16:9\nBildschirmtechnologie: LCD\nTouchscreen: Nein\nHD-Typ: Full HD\nPanel-Typ: VA\nBildschirmform: Flach\nKontrastverh\u00e4ltnis: 3000:1\nMaximale Bildwiederholrate: 75 Hz\nAnzahl der Farben des Displays: 16,7 Millionen Farben\nHelligkeit typisch: 200 cd/m\u00b2\nReaktionszeit: 5 ms\nUnterst\u00fctzte Grafik-Aufl\u00f6sungen: 640 x 480 VGA, 720 x 400, 800 x 600 SVGA, 1024 x 768 XGA, 1280 x 720 HD 720, 1280 x 800 WXGA, 1440 x 900 WXGA+, 1600 x 900, 1680 x 1050 WSXGA+, 1920 x 1080 HD 1080\nKontrastverh\u00e4ltnis dynamisch: 8000000:1\nBildwinkel, horizontal: 178\u00b0\nBildwinkel, vertikal: 178\u00b0\nPixel Abstand: 0,25 x 0,24 mm\nPixeldichte: 103 ppi\nHorizontaler Scanbereich: 54 - 88,1 kHz\nVertikaler Scanbereich: 48 - 75 Hz\nBildschirmdiagonale cm: 54,5 cm\nOberfl\u00e4chenh\u00e4rte: 3H\nFarbtiefe: 8 Bit\nRGB-Farbraum: NTSC\nFarbskala: 72\nNVIDIA G-SYNC: Nein\nAMD FreeSync: Nein\nEingebaute Lautsprecher: Nein\nIntegrierte Kamera: Nein\nMarktpositionierung: Business\nProduktfarbe: Schwarz\nIntegrierter USB-Hub: Nein\nKopfh\u00f6rerausgang: Nein\nAnzahl VGA D-Sub Anschl\u00fcsse: 1\nAnzahl HDMI-Anschl\u00fcsse: 1\nHDMI-Version: 1.4\nH\u00f6henverstellung: Nein\nPanel-Montage-Schnittstelle: 100 x 100 mm\nNeigungswinkelbereich: -5 - 23\u00b0\nEnergieeffizienzklasse SDR: E\nEnergieverbrauch SDR pro 1.000 Stunden: 15 kWh\nStromverbrauch Standardbetrieb: 11 W\nStromverbrauch Standby: 0,5 W\nStromverbrauch max.: 21 W\nAC Eingangsspannung: 100 - 240 V\nAC Eingangsfrequenz: 50 - 60 Hz\nBetriebstemperatur: 5 - 35 \u00b0C\nRelative Luftfeuchtigkeit in Betrieb: 20 - 80\nGer\u00e4tebreite inkl. Fu\u00df: 50,4 mm\nGer\u00e4tetiefe inkl. Fu\u00df: 38,7 mm\nGer\u00e4teh\u00f6he inkl. Fu\u00df: 18,1 mm\nGewicht mit St\u00e4nder: 2,8 kg\nTiefe ohne Standfu\u00df: 5,08 mm\nH\u00f6he ohne Standfu\u00df: 30,3 mm\nVerpackungsbreite: 504,2 mm\nVerpackungstiefe: 180,5 mm\nVerpackungsh\u00f6he: 386,9 mm\nPaketgewicht: 4,3 kg\nNachhaltige Technologien und Materialien: Das geformte Papierzellstoffpolster im Inneren der Verpackung stammt zu 100  aus nachhaltigen Quellen und ist recycelbar; 85  recycelter Haushaltskunststoff; 100  Kunststoff aus geschlossenem IT-Ger\u00e4te-Kreislauf; Halogenarm\nGewicht: 2,8 kg\nH\u00f6he: 303 mm\nBreite: 504,2 mm\nTiefe: 50,8 mm",
    "reference_file": "offer_reference_509.json",
    "shop_name": "CSV-Direct.de"
}