{
    "html_file": "offer_1631_1.html",
    "name": "Lenovo Qreator 27, 27\"",
    "offer_link": "https://direkt.jacob.de/produkte/lenovo-qreator-27-s60g5u7-artnr-6995272.html?utm_source=geizhals&utm_medium=cpc&utm_campaign=Preisvergleich&ref=103",
    "price": 507.22,
    "raw_specifications": {
        "AC Eingangsfrequenz": "50/60 Hz",
        "AC Eingangsspannung": "100 - 240 V",
        "AMD FreeSync": "Ja",
        "Anzahl DisplayPort Anschl\u00fcsse": "1",
        "Anzahl HDMI-Anschl\u00fcsse": "2",
        "Anzahl OSD-Sprachen": "8",
        "Anzahl der Farben des Displays": "1,073 Milliarden Farben",
        "Anzahl der Upstream-Ports USB Typ-C": "1",
        "Anzahl der nachgeschalteten Ports vom Typ USB-C": "1",
        "Anzahl der nachgeschalteten Steckpl\u00e4tze vom Typ USB-A": "2",
        "Anzahl der vorgeschalteten Steckpl\u00e4tze": "1",
        "Audioanschl\u00fcsse": "Ja",
        "Audioausgang": "Ja",
        "Bezel Weite (bottom)": "2 mm",
        "Bezel Weite (side)": "2 mm",
        "Bezel Weite (top)": "2 mm",
        "Bildschirmaufl\u00f6sung": "3840 x 2160 Pixel",
        "Bildschirmdiagonale": "68,6 cm (27\" )",
        "Bildschirmform": "Flach",
        "Bildschirmtechnologie": "LED",
        "Blickwinkel, horizontal": "178\u00b0",
        "Blickwinkel, vertikal": "178\u00b0",
        "Breite (ohne Standfu\u00df)": "60,9 cm",
        "DC-Anschluss": "Ja",
        "DVI Anschluss": "Nein",
        "DisplayPort Kabell\u00e4nge": "1,8 m",
        "DisplayPorts-Version": "1.4",
        "Eingebaute Lautsprecher": "Ja",
        "Energie Effizienzklasse": "G",
        "Farbintensit\u00e4t": "10 Bit",
        "Farbskala": "98%",
        "Fu\u00dffarbe": "Grau",
        "Ger\u00e4tebreite (inkl. Fu\u00df)": "608,6 mm",
        "Ger\u00e4teh\u00f6he (inkl. Fu\u00df)": "476,4 mm",
        "Ger\u00e4tetiefe (inkl. Fu\u00df)": "182 mm",
        "Gewicht (mit St\u00e4nder)": "6,2 kg",
        "Gewicht (ohne St\u00e4nder)": "4,81 kg",
        "HD-Typ": "4K Ultra HD",
        "HDMI": "Ja",
        "HDMI-Kabell\u00e4nge": "1,8 m",
        "HDMI-Version": "2.0",
        "Helligkeit (typisch)": "320 cd/m\u00b2",
        "High Dynamic Range Video Unterst\u00fctzung": "Ja",
        "H\u00f6he (ohne Standfu\u00df)": "35,1 cm",
        "H\u00f6henverstellung": "Nein",
        "Integrierte Kamera": "Nein",
        "Integrierter USB-Hub": "Ja",
        "Kabelsperre-Slot": "Ja",
        "Kontrastverh\u00e4ltnis": "1300:1",
        "Kontrastverh\u00e4ltnis (dynamisch)": "3000000:1",
        "Kopfh\u00f6rerausgang": "Nein",
        "Maximale Bildwiederholrate": "60 Hz",
        "Mitgelieferte Kabel": "AC, Gleichstrom, DisplayPort, HDMI, USB Typ-C",
        "NVIDIA G-SYNC": "Nein",
        "Name der Farbe": "Iron Grey",
        "Natives Seitenverh\u00e4ltnis": "16:9",
        "Neigungswinkelbereich": "5 - 22\u00b0",
        "On-Screen-Display (OSD)": "Ja",
        "Paketgewicht": "8,84 kg",
        "Panel-Typ": "IPS",
        "Pixel Abstand": "0,1554 x 0,1554 mm",
        "Pixeldichte": "164 ppi",
        "Plug & Play": "Ja",
        "Produktfarbe": "Grau",
        "RGB-Farbraum": "DCI-P3",
        "Rahmenloses Design": "Ja",
        "Reaktionszeit": "8 ms",
        "Reaktionszeit (schnell)": "4 ms",
        "Schnellstart\u00fcbersicht": "Ja",
        "Seitenverh\u00e4ltnis": "16:9",
        "Sichtbare Gr\u00f6\u00dfe (horizontal)": "59,7 cm",
        "Sichtbare Gr\u00f6\u00dfe (vertikal)": "33,6 cm",
        "Slot-Typ Kabelsperre": "Kensington",
        "Stromadapter enthalten": "Ja",
        "Stromverbrauch (Standby)": "0,5 W",
        "Stromverbrauch (aus)": "0,3 W",
        "Stromverbrauch (in Betrieb)": "40 W",
        "Stromverbrauch (max.)": "180 W",
        "St\u00e4nder enthalten": "Ja",
        "Technologie mit hohem Dynamikbereich (HDR)": "High Dynamic Range (HDR) 400",
        "Tiefe (ohne Standfu\u00df)": "4,4 cm",
        "Typ der Hintergrundbeleuchtung": "W-LED",
        "USB-Hub-Version": "3.2 Gen 2 (3.1 Gen 2)",
        "USB-Stromversorgung bis zu": "96 W",
        "USB-Typ-C DisplayPort-Wechselmodus": "Ja",
        "USB-Upstream-Porttyp": "USB Typ-C",
        "VESA-Halterung": "Nein",
        "Verpackungsart": "Box",
        "Verpackungsbreite": "695 mm",
        "Verpackungsh\u00f6he": "423 mm",
        "Verpackungstiefe": "139 mm",
        "Vorderer Rahmen": "Grau",
        "Zertifizierung": "???, RoHS, Volatile Organic Compound, Windows,",
        "kippbar": "Ja",
        "sRGB Abdeckung (klassisch)": "99%"
    },
    "raw_specifications_text": "Energie Effizienzklasse: G\nBildschirmdiagonale: 68,6 cm (27\" )\nBildschirmaufl\u00f6sung: 3840 x 2160 Pixel\nNatives Seitenverh\u00e4ltnis: 16:9\nPanel-Typ: IPS\nHelligkeit (typisch): 320 cd/m\u00b2\nReaktionszeit: 8 ms\nHD-Typ: 4K Ultra HD\nBildschirmtechnologie: LED\nBildschirmform: Flach\nKontrastverh\u00e4ltnis: 1300:1\nMaximale Bildwiederholrate: 60 Hz\nBlickwinkel, horizontal: 178\u00b0\nBlickwinkel, vertikal: 178\u00b0\nAnzahl der Farben des Displays: 1,073 Milliarden Farben\nTyp der Hintergrundbeleuchtung: W-LED\nSeitenverh\u00e4ltnis: 16:9\nKontrastverh\u00e4ltnis (dynamisch): 3000000:1\nReaktionszeit (schnell): 4 ms\nPixel Abstand: 0,1554 x 0,1554 mm\nPixeldichte: 164 ppi\nSichtbare Gr\u00f6\u00dfe (horizontal): 59,7 cm\nSichtbare Gr\u00f6\u00dfe (vertikal): 33,6 cm\nHigh Dynamic Range Video Unterst\u00fctzung: Ja\nTechnologie mit hohem Dynamikbereich (HDR): High Dynamic Range (HDR) 400\nFarbintensit\u00e4t: 10 Bit\nRGB-Farbraum: DCI-P3\nFarbskala: 98%\nsRGB Abdeckung (klassisch): 99%\nNVIDIA G-SYNC: Nein\nAMD FreeSync: Ja\nEingebaute Lautsprecher: Ja\nIntegrierte Kamera: Nein\nProduktfarbe: Grau\nName der Farbe: Iron Grey\nRahmenloses Design: Ja\nVorderer Rahmen: Grau\nFu\u00dffarbe: Grau\nZertifizierung: ???, RoHS, Volatile Organic Compound, Windows,\nIntegrierter USB-Hub: Ja\nDVI Anschluss: Nein\nHDMI: Ja\nAnzahl DisplayPort Anschl\u00fcsse: 1\nAudioanschl\u00fcsse: Ja\nKopfh\u00f6rerausgang: Nein\nUSB-Hub-Version: 3.2 Gen 2 (3.1 Gen 2)\nUSB-Upstream-Porttyp: USB Typ-C\nAnzahl der vorgeschalteten Steckpl\u00e4tze: 1\nAnzahl der Upstream-Ports USB Typ-C: 1\nAnzahl der nachgeschalteten Steckpl\u00e4tze vom Typ USB-A: 2\nAnzahl der nachgeschalteten Ports vom Typ USB-C: 1\nUSB-Typ-C DisplayPort-Wechselmodus: Ja\nUSB-Stromversorgung bis zu: 96 W\nAnzahl HDMI-Anschl\u00fcsse: 2\nHDMI-Version: 2.0\nDisplayPorts-Version: 1.4\nAudioausgang: Ja\nDC-Anschluss: Ja\nVESA-Halterung: Nein\nKabelsperre-Slot: Ja\nH\u00f6henverstellung: Nein\nSlot-Typ Kabelsperre: Kensington\nkippbar: Ja\nNeigungswinkelbereich: 5 - 22\u00b0\nOn-Screen-Display (OSD): Ja\nAnzahl OSD-Sprachen: 8\nPlug & Play: Ja\nStromverbrauch (in Betrieb): 40 W\nStromverbrauch (Standby): 0,5 W\nStromverbrauch (max.): 180 W\nStromverbrauch (aus): 0,3 W\nAC Eingangsspannung: 100 - 240 V\nAC Eingangsfrequenz: 50/60 Hz\nGer\u00e4tebreite (inkl. Fu\u00df): 608,6 mm\nGer\u00e4tetiefe (inkl. Fu\u00df): 182 mm\nGer\u00e4teh\u00f6he (inkl. Fu\u00df): 476,4 mm\nGewicht (mit St\u00e4nder): 6,2 kg\nBreite (ohne Standfu\u00df): 60,9 cm\nTiefe (ohne Standfu\u00df): 4,4 cm\nH\u00f6he (ohne Standfu\u00df): 35,1 cm\nGewicht (ohne St\u00e4nder): 4,81 kg\nBezel Weite (side): 2 mm\nBezel Weite (top): 2 mm\nBezel Weite (bottom): 2 mm\nSt\u00e4nder enthalten: Ja\nMitgelieferte Kabel: AC, Gleichstrom, DisplayPort, HDMI, USB Typ-C\nDisplayPort Kabell\u00e4nge: 1,8 m\nHDMI-Kabell\u00e4nge: 1,8 m\nSchnellstart\u00fcbersicht: Ja\nStromadapter enthalten: Ja\nVerpackungsbreite: 695 mm\nVerpackungstiefe: 139 mm\nVerpackungsh\u00f6he: 423 mm\nPaketgewicht: 8,84 kg\nVerpackungsart: Box",
    "reference_file": "offer_reference_1631.json",
    "shop_name": "Jacob Elektronik direkt (AT)"
}