{
    "html_file": "offer_2317_29.html",
    "name": "BenQ PhotoVue SW240, 24.1\"",
    "offer_link": "https://www.future-x.at/benq-sw240-241zoll-full-hd-ips-grau-flach-computerbildschirm-1920-x-1200-led-1000%3A1-250-cd-m2-hdmi-dvi-dl-usb-30-speicher-kartenleser-vesa-100x100-p-2367463/?pv=2",
    "price": 535.79,
    "raw_specifications": {
        "3D": "Nein",
        "AMD FreeSync": "Nein",
        "Anzahl DisplayPort Anschl\u00fcsse": "1",
        "Anzahl HDMI Anschl\u00fcsse": "1",
        "Anzahl der Farben des Displays": "1,073 Milliarden Farben",
        "Anzahl der nachgeschalteten Steckpl\u00e4tze vom Typ USB-A": "2",
        "Anzahl der vorgeschalteten Steckpl\u00e4tze": "1",
        "Anzeige": "LED",
        "Bildschirmaufl\u00f6sung": "1920 x 1080 Pixel",
        "Bildschirmdiagonale": "61,2 cm (24.1 Zoll)",
        "Bildschirmdiagonale (cm)": "61,21 cm",
        "Bildschirmtechnologie": "IPS",
        "Blickwinkel, horizontal": "178\u00b0",
        "Blickwinkel, vertikal": "178\u00b0",
        "DVI Anschluss": "Ja",
        "Ein-/Ausschalter": "Ja",
        "Form des Bildschirms": "Flach",
        "Ger\u00e4tebreite (inkl. Fu\u00df)": "543,5 mm",
        "Ger\u00e4teh\u00f6he (inkl. Fu\u00df)": "428,5 mm",
        "Ger\u00e4tetiefe (inkl. Fu\u00df)": "230,7 mm",
        "Gewicht": "6,7 kg",
        "HD-Typ": "Full HD",
        "Helligkeit": "250 cd/m\u00b2",
        "Horizontaler Scanbereich": "30 - 83 kHz",
        "H\u00f6heneinstellung": "14 cm",
        "H\u00f6henverstellung": "Ja",
        "Integrierte Kamera": "Nein",
        "Integrierter Kartenleser": "Ja",
        "Integrierter USB-Hub": "Ja",
        "Kabelsperre-Slot": "Ja",
        "Kompatible Speicherkarten": "SD,SDHC,SDXC",
        "Kontrastverh\u00e4ltnis": "1000:1",
        "Kontrastverh\u00e4ltnis (dynamisch)": "20000000:1",
        "Kopfh\u00f6rer-Konnektivit\u00e4t": "3,5 mm",
        "Kopfh\u00f6rerausg\u00e4nge": "1",
        "Luftfeuchtigkeit (au\u00dfer Betrieb)": "10 - 90%",
        "Luftfeuchtigkeit in Betrieb": "20 - 90%",
        "Marktpositionierung": "Home & Office",
        "Mitgelieferte Kabel": "AC, DVI, USB",
        "NVIDIA G-SYNC": "Nein",
        "Native Seitenverh\u00e4ltnis": "16:10",
        "Neigungsverstellung": "Ja",
        "Neigungswinkelbereich": "-5 - 20\u00b0",
        "On-Screen-Display (OSD)": "Ja",
        "Pivot": "JaBetriebsbedingungen",
        "Produktfarbe": "Grau",
        "Reaktionszeit": "5 ms",
        "Schnellstart\u00fcbersicht": "Ja",
        "Schwenkbar": "Ja",
        "Schwenkwinkelbereich": "-45 - 45\u00b0",
        "Slot-Typ Kabelsperre": "Kensington",
        "Temperaturbereich bei Lagerung": "-20 - 60 \u00b0C",
        "Temperaturbereich in Betrieb": "5 - 40 \u00b0C",
        "Thin Client installiert": "Nein",
        "USB-Hub-Version": "USB 3.0 (3.1 Gen 1)",
        "Unterst\u00fctzte Grafik-Aufl\u00f6sungen": "1920 x 1080 (HD 1080)",
        "VESA Montageadapter": "100 x 100 mm",
        "VESA-Halterung": "Ja",
        "Vertikaler Scanbereich": "50 - 76 Hz",
        "Zertifizierung": "CE"
    },
    "raw_specifications_text": "Bildschirmdiagonale: 61,2 cm (24.1 Zoll)\nHelligkeit: 250 cd/m\u00b2\nBildschirmaufl\u00f6sung: 1920 x 1080 Pixel\nReaktionszeit: 5 ms\nAnzeige: LED\nHD-Typ: Full HD\nBildschirmtechnologie: IPS\nUnterst\u00fctzte Grafik-Aufl\u00f6sungen: 1920 x 1080 (HD 1080)\nKontrastverh\u00e4ltnis: 1000:1\nBlickwinkel, horizontal: 178\u00b0\nBlickwinkel, vertikal: 178\u00b0\nAnzahl der Farben des Displays: 1,073 Milliarden Farben\nNative Seitenverh\u00e4ltnis: 16:10\n3D: Nein\nKontrastverh\u00e4ltnis (dynamisch): 20000000:1\nBildschirmdiagonale (cm): 61,21 cm\nHorizontaler Scanbereich: 30 - 83 kHz\nVertikaler Scanbereich: 50 - 76 Hz\nForm des Bildschirms: Flach\nIntegrierte Kamera: Nein\nMarktpositionierung: Home & Office\nProduktfarbe: Grau\nNVIDIA G-SYNC: Nein\nAMD FreeSync: Nein\nIntegrierter Kartenleser: Ja\nKompatible Speicherkarten: SD,SDHC,SDXC\nThin Client installiert: Nein\nIntegrierter USB-Hub: Ja\nDVI Anschluss: Ja\nAnzahl HDMI Anschl\u00fcsse: 1\nUSB-Hub-Version: USB 3.0 (3.1 Gen 1)\nAnzahl der vorgeschalteten Steckpl\u00e4tze: 1\nAnzahl der nachgeschalteten Steckpl\u00e4tze vom Typ USB-A: 2\nAnzahl DisplayPort Anschl\u00fcsse: 1\nKopfh\u00f6rerausg\u00e4nge: 1\nKopfh\u00f6rer-Konnektivit\u00e4t: 3,5 mm\nKabelsperre-Slot: Ja\nVESA-Halterung: Ja\nH\u00f6henverstellung: Ja\nEin-/Ausschalter: Ja\nSlot-Typ Kabelsperre: Kensington\nVESA Montageadapter: 100 x 100 mm\nSchwenkbar: Ja\nSchwenkwinkelbereich: -45 - 45\u00b0\nNeigungsverstellung: Ja\nNeigungswinkelbereich: -5 - 20\u00b0\nH\u00f6heneinstellung: 14 cm\nOn-Screen-Display (OSD): Ja\nPivot: JaBetriebsbedingungen\nTemperaturbereich in Betrieb: 5 - 40 \u00b0C\nTemperaturbereich bei Lagerung: -20 - 60 \u00b0C\nLuftfeuchtigkeit in Betrieb: 20 - 90%\nLuftfeuchtigkeit (au\u00dfer Betrieb): 10 - 90%\nZertifizierung: CE\nGewicht: 6,7 kg\nGer\u00e4tebreite (inkl. Fu\u00df): 543,5 mm\nGer\u00e4tetiefe (inkl. Fu\u00df): 230,7 mm\nGer\u00e4teh\u00f6he (inkl. Fu\u00df): 428,5 mm\nMitgelieferte Kabel: AC, DVI, USB\nSchnellstart\u00fcbersicht: Ja",
    "reference_file": "offer_reference_2317.json",
    "shop_name": "Future-X.at"
}