{
    "html_file": "offer_1290_2.html",
    "name": "ViewSonic VG2456, 23.8\"",
    "offer_link": "https://www.playox.de/productredirect/index/sku/15469918?sPartner=p-geizhals-at&campaign=psm/geizhals-at/",
    "price": 252.0,
    "raw_specifications": {
        "Anschl\u00fcsse": "USB, DisplayPort, HDMI",
        "Artikelnummer": "15469918",
        "Aufl\u00f6sung Kurzname": "Full HD",
        "Bezeichnung des Herstellers": "ViewSonic VG2456 (24\") 60,62cm LED-Monitor",
        "Bildwiederholungsrate": "60,00",
        "Breite": "-1,00",
        "Displaygr\u00f6\u00dfe": "60,96 cm (24 Zoll)",
        "EEK - Spektrum": "AG",
        "Einsatzort": "Innen",
        "Energieeffizienzklasse": "D",
        "Geh\u00e4usefarbe des Ger\u00e4tes": "Schwarz",
        "Gewicht": "6,40",
        "Gewicht inkl. Verpackung in Kg": "9,40",
        "Helligkeit Bereich": "150 - 300 cd/m\u00b2",
        "Hersteller": "Viewsonic",
        "H\u00f6he": "-1,00",
        "Inhalt (ml oder g)": "0,00",
        "Kapazit\u00e4t (Seiten)": "0",
        "Kontrastverh\u00e4ltnis (typisch) Bereich": "800:1 bis 1.200:1",
        "LCD-Technologie": "IPS Panel",
        "L\u00e4nge": "-1,00",
        "Produktart": "Monitore",
        "Reaktionszeit": "5,00",
        "Seitenverh\u00e4ltnis": "16:9",
        "Shop Herstellernummer": "VG2456",
        "Standard-EAN": "0766907006155",
        "Verpackung - Breite in cm": "21,00",
        "Verpackung - H\u00f6he in cm": "39,60",
        "Verpackung - L\u00e4nge in cm": "59,50",
        "max. Aufl\u00f6sung": "1.920 x 1.080 Pixel (16:9)"
    },
    "raw_specifications_text": "Geh\u00e4usefarbe des Ger\u00e4tes: Schwarz\nAnschl\u00fcsse: USB, DisplayPort, HDMI\nProduktart: Monitore\nDisplaygr\u00f6\u00dfe: 60,96 cm (24 Zoll)\nHelligkeit Bereich: 150 - 300 cd/m\u00b2\nKontrastverh\u00e4ltnis (typisch) Bereich: 800:1 bis 1.200:1\nHersteller: Viewsonic\nKapazit\u00e4t (Seiten): 0\nAufl\u00f6sung Kurzname: Full HD\nEEK - Spektrum: AG\nBreite: -1,00\nH\u00f6he: -1,00\nL\u00e4nge: -1,00\nInhalt (ml oder g): 0,00\nVerpackung - Breite in cm: 21,00\nGewicht: 6,40\nGewicht inkl. Verpackung in Kg: 9,40\nVerpackung - L\u00e4nge in cm: 59,50\nArtikelnummer: 15469918\nStandard-EAN: 0766907006155\nShop Herstellernummer: VG2456\nBezeichnung des Herstellers: ViewSonic VG2456 (24\") 60,62cm LED-Monitor\nVerpackung - H\u00f6he in cm: 39,60\nmax. Aufl\u00f6sung: 1.920 x 1.080 Pixel (16:9)\nSeitenverh\u00e4ltnis: 16:9\nLCD-Technologie: IPS Panel\nReaktionszeit: 5,00\nBildwiederholungsrate: 60,00\nEinsatzort: Innen\nEnergieeffizienzklasse: D",
    "reference_file": "offer_reference_1290.json",
    "shop_name": "playox (AT)"
}