{
    "html_file": "offer_2359_20.html",
    "name": "Philips B-line 241B7QUPBEB, 23.8\"",
    "offer_link": "https://www.ba-computer.at/philips-b-line-241b7qupbeb-led-monitor-61-cm-24-241b7qupbeb-00.html",
    "price": 304.49,
    "raw_specifications": {
        "Abmessungen (Breite x Tiefe x H\u00f6he)": "54.1 cm x 25.7 cm x 52.7 cm - mit Fu\u00df",
        "Ausgangsleistung/Kanal": "2 Watt",
        "Besonderheiten": "Sync-on-Green, sRGB-Farbmanagement, PowerSensor, SmartResponse, SmartContrast, SmartImage, Smart ErgoBase, Low Blue Light Mode, flimmerfreie Technologie, BFR/PVC-frei, Ultra-schmale Kante, ohne Quecksilber, USB 3.0 Quick Charge, breiter Betrachtungswinkel, EasyRead",
        "Bildschirmtyp": "IPS",
        "Details zu Abmessungen & Gewicht": "Mit Fu\u00df - Breite: 54.1 cm - Tiefe: 25.7 cm - H\u00f6he: 52.7 cm - Gewicht: 5.72 kg \u00a6 Ohne Fu\u00df - Breite: 54.1 cm - Tiefe: 5.7 cm - H\u00f6he: 33.2 cm - Gewicht: 3.29 kg",
        "Diagonalabmessung": "61 cm (24\")",
        "Display-Typ": "LED-hintergrundbeleuchteter LCD-Monitor / TFT-Aktivmatrix",
        "ENERGY STAR zertifiziert": "Ja",
        "Ein-/Aus-Schalter": "Ja",
        "Einstellungen der Anzeigeposition": "H\u00f6he, Pivot (Rotation), Drehung, Neigung",
        "Energie Effizienzklasse": "Klasse E",
        "Energieverbrauch pro Jahr": "35 kWh",
        "Enthaltene Kabel": "1 x VGA-Kabel \u00a6 1 x HDMI-Kabel \u00a6 1 x DisplayPort-Kabel \u00a6 1 x USB-C Kabel \u00a6 1 x USB-C auf USB-A Kabel \u00a6 1 x Audiokabel",
        "Erforderliche Netzspannung": "Wechselstrom 120/230 V (50/60 Hz)",
        "Erforderliches Betriebssystem": "Apple MacOS X, Microsoft Windows 7 / 8 / 8.1 / 10",
        "Farbe": "Textured Black",
        "Farbunterst\u00fctzung": "16,7 Millionen Farben",
        "Gewicht": "5.72 kg",
        "Helligkeit": "250 cd/m\u00b2",
        "Hintergrundbeleuchtungs-Technologie": "WLED",
        "Horizontale Bildwiederholrate": "30 - 83 kHz",
        "Horizontaler Betrachtungswinkel": "178",
        "H\u00f6heneinstellung": "150 mm",
        "Integrierte Peripherieger\u00e4te": "USB 3.0/USB-C Hub",
        "Kennzeichnung": "Plug and Play, FCC Klasse B bescheinigt, TUV GS, VCCI, ICES-003, SEMKO, TUV Ergo, DDC/CI, RoHS, Bleifrei, WEEE, EPA, cETLus, RCM, CU-EAC",
        "Kontrast": "1000:1 / 20000000:1 (dynamisch)",
        "Leistungsaufnahme im Ein-Zustand": "18 W",
        "Leistungsmerkmale": "Slot f\u00fcr Sicherheitsschloss (Kabelschloss getrennt erh\u00e4ltlich)",
        "MTBF": "70,000 Stunde(n)",
        "Max. Betriebstemperatur": "40 \u00b0C",
        "Min Betriebstemperatur": "0 \u00b0C",
        "Mitgelieferte Software": "Philips SmartControl",
        "Native Aufl\u00f6sung": "Full HD (1080p) 1920 x 1080 bei 60 Hz",
        "Neigungswinkel": "-5/+30",
        "OSD-Sprachen": "Ungarisch, Tschechisch, Chinesisch (tradionell), Chinesisch (vereinfacht), Ukrainisch, Brasilianisches Portugiesisch, Englisch, Deutsch, Franz\u00f6sisch, Italienisch, Portugiesisch, Polnisch, Finnisch, Schwedisch, Russisch, Spanisch, Holl\u00e4ndisch, Griechisch, T\u00fcrkisch, Japanisch, Koreanisch",
        "Pixelpitch": "0.275 mm",
        "Ppi": "93",
        "Reaktionszeit": "5 ms (Gray-to-Gray)",
        "Rotationswinkel": "90",
        "Schnittstellen": "VGA \u00a6 DisplayPort \u00a6 HDMI \u00a6 USB-C Upstream \u00a6 DisplayPort-Ausgang \u00a6 Audio Line-In \u00a6 Kopfh\u00f6rer \u00a6 Netzwerk \u00a6 2 x USB 3.0 Downstream",
        "Schwenkwinkel": "350",
        "Seitenverh\u00e4ltnis": "16:9",
        "Sichtbare Bildfl\u00e4che": "60.5 cm (23.8\")",
        "Stromverbrauch (Aus-Modus)": "0.3 Watt",
        "Stromverbrauch (typisch)": "15.4 Watt",
        "Stromverbrauch SDR (eingeschaltet)": "18 kWh/1.000 h",
        "Stromverbrauch im Standby-Modus": "0.7 Watt",
        "TCO-zertifiziert": "TCO Certified Displays 8, TCO Certified Edge Displays",
        "Transportbreite": "60.3 cm",
        "Transportgewicht": "8.94 kg",
        "Transporth\u00f6he": "49.2 cm",
        "Transporttiefe": "22.4 cm",
        "Typ": "Lautsprecher - Stereo",
        "VESA-Halterung": "100 x 100 mm",
        "Vertikale Bildwiederholrate": "56 - 76 Hz",
        "Vertikaler Betrachtungswinkel": "178",
        "Zul\u00e4ssige Luftfeuchtigkeit im Betrieb": "20 - 80%"
    },
    "raw_specifications_text": "Display-Typ: LED-hintergrundbeleuchteter LCD-Monitor / TFT-Aktivmatrix\nEnergie Effizienzklasse: Klasse E\nEnergieverbrauch pro Jahr: 35 kWh\nDiagonalabmessung: 61 cm (24\")\nSichtbare Bildfl\u00e4che: 60.5 cm (23.8\")\nIntegrierte Peripherieger\u00e4te: USB 3.0/USB-C Hub\nBildschirmtyp: IPS\nSeitenverh\u00e4ltnis: 16:9\nNative Aufl\u00f6sung: Full HD (1080p) 1920 x 1080 bei 60 Hz\nPixelpitch: 0.275 mm\nPpi: 93\nHelligkeit: 250 cd/m\u00b2\nKontrast: 1000:1 / 20000000:1 (dynamisch)\nFarbunterst\u00fctzung: 16,7 Millionen Farben\nReaktionszeit: 5 ms (Gray-to-Gray)\nVertikale Bildwiederholrate: 56 - 76 Hz\nHorizontale Bildwiederholrate: 30 - 83 kHz\nHorizontaler Betrachtungswinkel: 178\nVertikaler Betrachtungswinkel: 178\nHintergrundbeleuchtungs-Technologie: WLED\nOSD-Sprachen: Ungarisch, Tschechisch, Chinesisch (tradionell), Chinesisch (vereinfacht), Ukrainisch, Brasilianisches Portugiesisch, Englisch, Deutsch, Franz\u00f6sisch, Italienisch, Portugiesisch, Polnisch, Finnisch, Schwedisch, Russisch, Spanisch, Holl\u00e4ndisch, Griechisch, T\u00fcrkisch, Japanisch, Koreanisch\nBesonderheiten: Sync-on-Green, sRGB-Farbmanagement, PowerSensor, SmartResponse, SmartContrast, SmartImage, Smart ErgoBase, Low Blue Light Mode, flimmerfreie Technologie, BFR/PVC-frei, Ultra-schmale Kante, ohne Quecksilber, USB 3.0 Quick Charge, breiter Betrachtungswinkel, EasyRead\nFarbe: Textured Black\nAbmessungen (Breite x Tiefe x H\u00f6he): 54.1 cm x 25.7 cm x 52.7 cm - mit Fu\u00df\nGewicht: 5.72 kg\nTyp: Lautsprecher - Stereo\nAusgangsleistung/Kanal: 2 Watt\nSchnittstellen: VGA \u00a6 DisplayPort \u00a6 HDMI \u00a6 USB-C Upstream \u00a6 DisplayPort-Ausgang \u00a6 Audio Line-In \u00a6 Kopfh\u00f6rer \u00a6 Netzwerk \u00a6 2 x USB 3.0 Downstream\nEinstellungen der Anzeigeposition: H\u00f6he, Pivot (Rotation), Drehung, Neigung\nNeigungswinkel: -5/+30\nSchwenkwinkel: 350\nRotationswinkel: 90\nH\u00f6heneinstellung: 150 mm\nVESA-Halterung: 100 x 100 mm\nLeistungsmerkmale: Slot f\u00fcr Sicherheitsschloss (Kabelschloss getrennt erh\u00e4ltlich)\nEnthaltene Kabel: 1 x VGA-Kabel \u00a6 1 x HDMI-Kabel \u00a6 1 x DisplayPort-Kabel \u00a6 1 x USB-C Kabel \u00a6 1 x USB-C auf USB-A Kabel \u00a6 1 x Audiokabel\nMTBF: 70,000 Stunde(n)\nKennzeichnung: Plug and Play, FCC Klasse B bescheinigt, TUV GS, VCCI, ICES-003, SEMKO, TUV Ergo, DDC/CI, RoHS, Bleifrei, WEEE, EPA, cETLus, RCM, CU-EAC\nErforderliche Netzspannung: Wechselstrom 120/230 V (50/60 Hz)\nLeistungsaufnahme im Ein-Zustand: 18 W\nStromverbrauch SDR (eingeschaltet): 18 kWh/1.000 h\nStromverbrauch (typisch): 15.4 Watt\nStromverbrauch im Standby-Modus: 0.7 Watt\nStromverbrauch (Aus-Modus): 0.3 Watt\nEin-/Aus-Schalter: Ja\nMitgelieferte Software: Philips SmartControl\nErforderliches Betriebssystem: Apple MacOS X, Microsoft Windows 7 / 8 / 8.1 / 10\nDetails zu Abmessungen & Gewicht: Mit Fu\u00df - Breite: 54.1 cm - Tiefe: 25.7 cm - H\u00f6he: 52.7 cm - Gewicht: 5.72 kg \u00a6 Ohne Fu\u00df - Breite: 54.1 cm - Tiefe: 5.7 cm - H\u00f6he: 33.2 cm - Gewicht: 3.29 kg\nTransportbreite: 60.3 cm\nTransporttiefe: 22.4 cm\nTransporth\u00f6he: 49.2 cm\nTransportgewicht: 8.94 kg\nTCO-zertifiziert: TCO Certified Displays 8, TCO Certified Edge Displays\nENERGY STAR zertifiziert: Ja\nMin Betriebstemperatur: 0 \u00b0C\nMax. Betriebstemperatur: 40 \u00b0C\nZul\u00e4ssige Luftfeuchtigkeit im Betrieb: 20 - 80%",
    "reference_file": "offer_reference_2359.json",
    "shop_name": "BA-Computer"
}