{
    "html_file": "offer_1605_3.html",
    "name": "Acer KA3 K273bmix, 27\"",
    "offer_link": "https://www.csv-direct.de/artinfo.php?artnr=A1621123&KATEGORIE=162&pva=geizhals2",
    "price": 136.46,
    "raw_specifications": {
        "AC Eingangsspannung": "120 - 230 V",
        "AMD FreeSync-Typ": "FreeSync",
        "Anzahl HDMI-Anschl\u00fcsse": "1",
        "Anzahl VGA D-Sub Anschl\u00fcsse": "1",
        "Anzahl der Farben des Displays": "16,7 Millionen Farben",
        "Anzahl der Lautsprecher": "2",
        "Audioanschl\u00fcsse": "Nein",
        "Bildschirmdiagonale": "68,6 cm 27\"",
        "Bildschirmdiagonale cm": "68,6 cm",
        "Bildschirmform": "Flach",
        "Bildschirmtechnologie": "LCD",
        "Bildwinkel, horizontal": "178\u00b0",
        "Bildwinkel, vertikal": "178\u00b0",
        "DVI Anschluss": "Nein",
        "Display-Aufl\u00f6sung": "1920 x 1080 Pixel",
        "Energieeffizienzklasse SDR": "F",
        "Energieeffizienzskala": "A bis G",
        "Energieverbrauch SDR pro 1.000 Stunden": "26 kWh",
        "Farbtiefe": "6 Bit",
        "Fu\u00dffarbe": "Schwarz",
        "HD-Typ": "Full HD",
        "Helligkeit typisch": "250 cd/m\u00b2",
        "H\u00f6henverstellung": "Nein",
        "Integrierte Kamera": "Nein",
        "Integrierter USB-Hub": "Nein",
        "Kabelsperre-Slot": "Nein",
        "Kontrastverh\u00e4ltnis": "1000:1",
        "Kontrastverh\u00e4ltnis dynamisch": "100000000:1",
        "Kopfh\u00f6rerausg\u00e4nge": "1",
        "Marktpositionierung": "Haus",
        "Maximale Bildwiederholrate": "75 Hz",
        "Mitgelieferte Kabel": "AC, HDMI",
        "NVIDIA G-SYNC": "Nein",
        "Natives Seitenverh\u00e4ltnis": "16:9",
        "Neigungswinkelbereich": "-5 - 15\u00b0",
        "Panel-Montage-Schnittstelle": "100 x 100 mm",
        "Panel-Typ": "IPS",
        "Produktfarbe": "Schwarz",
        "RMS-Leistung": "4 W",
        "Reaktionszeit": "1 ms",
        "Stromverbrauch Standardbetrieb": "16 W",
        "Stromverbrauch Standby": "0,5 W",
        "Stromverbrauch aus": "0,45 W",
        "Touchscreen": "Nein",
        "Typ der Hintergrundbeleuchtung": "LED",
        "Warentarifnummer HS": "85285210"
    },
    "raw_specifications_text": "Bildschirmdiagonale: 68,6 cm 27\"\nDisplay-Aufl\u00f6sung: 1920 x 1080 Pixel\nNatives Seitenverh\u00e4ltnis: 16:9\nBildschirmtechnologie: LCD\nTouchscreen: Nein\nHD-Typ: Full HD\nPanel-Typ: IPS\nBildschirmform: Flach\nKontrastverh\u00e4ltnis: 1000:1\nMaximale Bildwiederholrate: 75 Hz\nAnzahl der Farben des Displays: 16,7 Millionen Farben\nTyp der Hintergrundbeleuchtung: LED\nHelligkeit typisch: 250 cd/m\u00b2\nReaktionszeit: 1 ms\nKontrastverh\u00e4ltnis dynamisch: 100000000:1\nBildwinkel, horizontal: 178\u00b0\nBildwinkel, vertikal: 178\u00b0\nBildschirmdiagonale cm: 68,6 cm\nFarbtiefe: 6 Bit\nNVIDIA G-SYNC: Nein\nAMD FreeSync-Typ: FreeSync\nIntegrierte Kamera: Nein\nAnzahl der Lautsprecher: 2\nRMS-Leistung: 4 W\nMarktpositionierung: Haus\nProduktfarbe: Schwarz\nFu\u00dffarbe: Schwarz\nIntegrierter USB-Hub: Nein\nAnzahl VGA D-Sub Anschl\u00fcsse: 1\nDVI Anschluss: Nein\nAnzahl HDMI-Anschl\u00fcsse: 1\nAudioanschl\u00fcsse: Nein\nKopfh\u00f6rerausg\u00e4nge: 1\nKabelsperre-Slot: Nein\nH\u00f6henverstellung: Nein\nPanel-Montage-Schnittstelle: 100 x 100 mm\nNeigungswinkelbereich: -5 - 15\u00b0\nEnergieeffizienzklasse SDR: F\nEnergieverbrauch SDR pro 1.000 Stunden: 26 kWh\nStromverbrauch Standardbetrieb: 16 W\nStromverbrauch Standby: 0,5 W\nStromverbrauch aus: 0,45 W\nAC Eingangsspannung: 120 - 230 V\nEnergieeffizienzskala: A bis G\nMitgelieferte Kabel: AC, HDMI\nWarentarifnummer HS: 85285210",
    "reference_file": "offer_reference_1605.json",
    "shop_name": "CSV-Direct.de"
}