{
    "html_file": "offer_191_8.html",
    "name": "ViewSonic Omni VX2428J, 23.8\"",
    "offer_link": "https://www.taufnaus.de/product/13033898",
    "price": 279.98,
    "raw_specifications": {
        "Abmessungen (Breite x Tiefe x H\u00f6he)": "54.2 cm x 20.7 cm x 41.7 cm - mit Standfu\u00df (niedrigste Position)",
        "Adaptive-Sync Technologie": "VESA Adaptive-Sync, AMD FreeSync Premium",
        "Besonderheiten": "Flimmerfreie Technologie, Blaulichtfilter-Technologie",
        "Bildschirmbeschichtung": "Blendfrei, 3H Hard Coating",
        "Bildschirmtyp": "IPS",
        "Details zu Abmessungen & Gewicht": "Mit Standfu\u00df (h\u00f6chste Position) - Breite: 54.2 cm - Tiefe: 20.7 cm - H\u00f6he: 54.7 cm - Gewicht: 3.8 kg \u00a6 Ohne Fu\u00df - Breite: 54.2 cm - Tiefe: 4.4 cm - H\u00f6he: 32.3 cm - Gewicht: 2.8 kg",
        "Diagonalabmessung": "61 cm (24\")",
        "Display-Typ": "LED-hintergrundbeleuchteter LCD-Monitor / TFT-Aktivmatrix",
        "Eingangsspannung": "Wechselstrom 100-240 V",
        "Einstellungen der Anzeigeposition": "Neigung",
        "Enthaltene Kabel": "DisplayPort-Kabel",
        "Erforderliches Betriebssystem": "Apple MacOS, Windows 10, Windows 11",
        "Farbraum": "104% sRGB, 72% NTSC",
        "Farbunterst\u00fctzung": "16,7 Millionen Farben",
        "Gaming": "Ja",
        "Gewicht": "3.8 kg",
        "HDR-Format": "HDR10",
        "Helligkeit": "250 cd/m\u00b2",
        "Hintergrundbeleuchtungs-Technologie": "LED-Hintergrundbeleuchtung",
        "Horizontaler Betrachtungswinkel": "178",
        "Kennzeichnung": "RoHS, WEEE, REACH, UkrSEPRO, LVD, ERP, EAC, BIS, CE/EMC, UKCA",
        "Kontrast": "80000000:1 (dynamisch)",
        "Lebensdauer der Beleuchtung": "30,000 Stunden",
        "Leistungsmerkmale": "Slot f\u00fcr Sicherheitsschloss (Kabelschloss getrennt erh\u00e4ltlich)",
        "Max. Betriebstemperatur": "40 \u00b0C",
        "Min Betriebstemperatur": "0 \u00b0C",
        "Native Aufl\u00f6sung": "Full HD (1080p) 1920 x 1080 (DisplayPort: 165 Hz, HDMI: 144 Hz)",
        "Neigungswinkel": "-5/+20",
        "Pixelpitch": "0.275 mm",
        "Schlosstyp zur Diebstahlsicherung": "Kensington Slot",
        "Schnittstellen": "DisplayPort 1.4 \u00a6 2 x HDMI 1.4 \u00a6 Audio Line-Out",
        "Seitenverh\u00e4ltnis": "16:9",
        "Sichtbare Bildfl\u00e4che": "60.5 cm (23.8\")",
        "Stromverbrauch (max.)": "25 Watt",
        "Stromverbrauch (typisch)": "24 Watt",
        "Stromverbrauch im Standby-Modus": "0.3 Watt",
        "Transportbreite": "61 cm",
        "Transportgewicht": "5.5 kg",
        "Transporth\u00f6he": "40.2 cm",
        "Transporttiefe": "18 cm",
        "VESA-Halterung": "100 x 100 mm",
        "Vertikaler Betrachtungswinkel": "178",
        "Zul\u00e4ssige Luftfeuchtigkeit im Betrieb": "20 - 90% (nicht kondensierend)"
    },
    "raw_specifications_text": "Display-Typ: LED-hintergrundbeleuchteter LCD-Monitor / TFT-Aktivmatrix\nDiagonalabmessung: 61 cm (24\")\nSichtbare Bildfl\u00e4che: 60.5 cm (23.8\")\nAdaptive-Sync Technologie: VESA Adaptive-Sync, AMD FreeSync Premium\nBildschirmtyp: IPS\nSeitenverh\u00e4ltnis: 16:9\nNative Aufl\u00f6sung: Full HD (1080p) 1920 x 1080 (DisplayPort: 165 Hz, HDMI: 144 Hz)\nPixelpitch: 0.275 mm\nHelligkeit: 250 cd/m\u00b2\nKontrast: 80000000:1 (dynamisch)\nHDR-Format: HDR10\nFarbunterst\u00fctzung: 16,7 Millionen Farben\nFarbraum: 104% sRGB, 72% NTSC\nGaming: Ja\nHorizontaler Betrachtungswinkel: 178\nVertikaler Betrachtungswinkel: 178\nBildschirmbeschichtung: Blendfrei, 3H Hard Coating\nHintergrundbeleuchtungs-Technologie: LED-Hintergrundbeleuchtung\nBesonderheiten: Flimmerfreie Technologie, Blaulichtfilter-Technologie\nAbmessungen (Breite x Tiefe x H\u00f6he): 54.2 cm x 20.7 cm x 41.7 cm - mit Standfu\u00df (niedrigste Position)\nGewicht: 3.8 kg\nSchnittstellen: DisplayPort 1.4 \u00a6 2 x HDMI 1.4 \u00a6 Audio Line-Out\nEinstellungen der Anzeigeposition: Neigung\nNeigungswinkel: -5/+20\nVESA-Halterung: 100 x 100 mm\nLeistungsmerkmale: Slot f\u00fcr Sicherheitsschloss (Kabelschloss getrennt erh\u00e4ltlich)\nEnthaltene Kabel: DisplayPort-Kabel\nLebensdauer der Beleuchtung: 30,000 Stunden\nKennzeichnung: RoHS, WEEE, REACH, UkrSEPRO, LVD, ERP, EAC, BIS, CE/EMC, UKCA\nSchlosstyp zur Diebstahlsicherung: Kensington Slot\nEingangsspannung: Wechselstrom 100-240 V\nStromverbrauch (typisch): 24 Watt\nStromverbrauch (max.): 25 Watt\nStromverbrauch im Standby-Modus: 0.3 Watt\nErforderliches Betriebssystem: Apple MacOS, Windows 10, Windows 11\nDetails zu Abmessungen & Gewicht: Mit Standfu\u00df (h\u00f6chste Position) - Breite: 54.2 cm - Tiefe: 20.7 cm - H\u00f6he: 54.7 cm - Gewicht: 3.8 kg \u00a6 Ohne Fu\u00df - Breite: 54.2 cm - Tiefe: 4.4 cm - H\u00f6he: 32.3 cm - Gewicht: 2.8 kg\nTransportbreite: 61 cm\nTransporttiefe: 18 cm\nTransporth\u00f6he: 40.2 cm\nTransportgewicht: 5.5 kg\nMin Betriebstemperatur: 0 \u00b0C\nMax. Betriebstemperatur: 40 \u00b0C\nZul\u00e4ssige Luftfeuchtigkeit im Betrieb: 20 - 90% (nicht kondensierend)",
    "reference_file": "offer_reference_191.json",
    "shop_name": "TaufNaus"
}