{
    "html_file": "offer_689_1.html",
    "name": "ViewSonic VA3209-MH, 31.5\"",
    "offer_link": "https://direkt.jacob.de/produkte/viewsonic-va-va3209-mh-va3209-mh-artnr-8003030.html?utm_source=geizhals&utm_medium=cpc&utm_campaign=Preisvergleich&ref=103",
    "price": 178.88,
    "raw_specifications": {
        "AC Eingangsspannung": "100 - 240 V",
        "Anzahl HDMI-Anschl\u00fcsse": "1",
        "Anzahl VGA (D-Sub) Anschl\u00fcsse": "1",
        "Anzahl der Farben des Displays": "16,7 Millionen Farben",
        "Anzahl der Lautsprecher": "2",
        "Bildschirmaufl\u00f6sung": "1920 x 1080 Pixel",
        "Bildschirmdiagonale": "81,3 cm (32\" )",
        "Bildschirmdiagonale (cm)": "81 cm",
        "Bildschirmform": "Flach",
        "Bildwinkel, horizontal": "178\u00b0",
        "Bildwinkel, vertikal": "178\u00b0",
        "Blendfreier Bildschirm": "Ja",
        "Bluetooth": "Nein",
        "Breite (ohne Standfu\u00df)": "71,4 cm",
        "Digital horizontale Frequenz": "24 - 86 kHz",
        "Digital vertikale Frequenz": "48 - 75 Hz",
        "Eingebaute Lautsprecher": "Ja",
        "Energie Effizienzklasse": "F",
        "Fernbedienung": "Nein",
        "Flimmerfreie Technologie": "Ja",
        "Fu\u00dffarbe": "Schwarz",
        "Ger\u00e4tebreite (inkl. Fu\u00df)": "714 mm",
        "Ger\u00e4teh\u00f6he (inkl. Fu\u00df)": "520 mm",
        "Ger\u00e4tetiefe (inkl. Fu\u00df)": "231 mm",
        "Gewicht (mit St\u00e4nder)": "7,3 kg",
        "Gewicht (ohne St\u00e4nder)": "6,1 kg",
        "HD-Typ": "Full HD",
        "HDMI": "Ja",
        "HDMI-Version": "1.4",
        "Helligkeit (typisch)": "250 cd/m\u00b2",
        "H\u00f6he (ohne Standfu\u00df)": "42,8 cm",
        "Integrierte Kamera": "Nein",
        "Integrierter USB-Hub": "Nein",
        "Kabelsperre-Slot": "Ja",
        "Kontrastverh\u00e4ltnis": "1200:1",
        "Kontrastverh\u00e4ltnis (dynamisch)": "50000000:1",
        "Kopfh\u00f6rer-Anschluss": "3,5 mm",
        "Kopfh\u00f6rerausgang": "Ja",
        "Kopfh\u00f6rerausg\u00e4nge": "1",
        "Low-Blue-Light-Technologie": "Ja",
        "Marktpositionierung": "Haus",
        "Maximale Bildwiederholrate": "75 Hz",
        "Mitgelieferte Kabel": "AC, Gleichstrom, HDMI",
        "NTSC Abdeckung (typisch)": "72%",
        "Nachhaltigkeitszertifikate": "CE, ErP, REACH, RoHS, WEEE",
        "Natives Seitenverh\u00e4ltnis": "16:9",
        "Neigungswinkelbereich": "5 - 20\u00b0",
        "Netzteiltyp": "Extern",
        "Oberfl\u00e4chenh\u00e4rte": "2H",
        "On-Screen-Display (OSD)": "Ja",
        "Paketgewicht": "9,2 kg",
        "Panel-Montage-Schnittstelle": "100 x 100 mm",
        "Panel-Typ": "IPS",
        "Pixel Abstand": "0,364 x 0,364 mm",
        "Plug & Play": "Ja",
        "Produktfarbe": "Schwarz",
        "RMS-Leistung": "5 W",
        "Reaktionszeit": "4 ms",
        "Schnellstart\u00fcbersicht": "Ja",
        "Slot-Typ Kabelsperre": "Kensington",
        "Stromverbrauch (Standardbetrieb)": "32 W",
        "Stromverbrauch (Standby)": "0,5 W",
        "Stromverbrauch (max.)": "35 W",
        "St\u00e4nder enthalten": "Ja",
        "Tiefe (ohne Standfu\u00df)": "5,9 cm",
        "Touchscreen": "Nein",
        "Typ der Hintergrundbeleuchtung": "LED",
        "VESA Adaptive Sync unterst\u00fctzt": "Ja",
        "VESA-Halterung": "Ja",
        "Verpackungsart": "Box",
        "Verpackungsbreite": "770 mm",
        "Verpackungsh\u00f6he": "510 mm",
        "Verpackungstiefe": "125 mm",
        "WLAN": "Nein",
        "Zertifizierung": "CE EMC, CB, EAC, UkrSEPRO, UKCA, BSMI, BIS",
        "kippbar": "Ja",
        "sRGB Abdeckung (klassisch)": "104%"
    },
    "raw_specifications_text": "Bildschirmdiagonale: 81,3 cm (32\" )\nBildschirmaufl\u00f6sung: 1920 x 1080 Pixel\nNatives Seitenverh\u00e4ltnis: 16:9\nTouchscreen: Nein\nHD-Typ: Full HD\nPanel-Typ: IPS\nBildschirmform: Flach\nKontrastverh\u00e4ltnis: 1200:1\nMaximale Bildwiederholrate: 75 Hz\nAnzahl der Farben des Displays: 16,7 Millionen Farben\nTyp der Hintergrundbeleuchtung: LED\nHelligkeit (typisch): 250 cd/m\u00b2\nReaktionszeit: 4 ms\nBlendfreier Bildschirm: Ja\nKontrastverh\u00e4ltnis (dynamisch): 50000000:1\nBildwinkel, horizontal: 178\u00b0\nBildwinkel, vertikal: 178\u00b0\nPixel Abstand: 0,364 x 0,364 mm\nDigital horizontale Frequenz: 24 - 86 kHz\nDigital vertikale Frequenz: 48 - 75 Hz\nBildschirmdiagonale (cm): 81 cm\nOberfl\u00e4chenh\u00e4rte: 2H\nsRGB Abdeckung (klassisch): 104%\nNTSC Abdeckung (typisch): 72%\nVESA Adaptive Sync unterst\u00fctzt: Ja\nFlimmerfreie Technologie: Ja\nLow-Blue-Light-Technologie: Ja\nEingebaute Lautsprecher: Ja\nIntegrierte Kamera: Nein\nAnzahl der Lautsprecher: 2\nRMS-Leistung: 5 W\nMarktpositionierung: Haus\nProduktfarbe: Schwarz\nFu\u00dffarbe: Schwarz\nZertifizierung: CE EMC, CB, EAC, UkrSEPRO, UKCA, BSMI, BIS\nIntegrierter USB-Hub: Nein\nHDMI: Ja\nKopfh\u00f6rerausgang: Ja\nAnzahl VGA (D-Sub) Anschl\u00fcsse: 1\nAnzahl HDMI-Anschl\u00fcsse: 1\nHDMI-Version: 1.4\nKopfh\u00f6rerausg\u00e4nge: 1\nKopfh\u00f6rer-Anschluss: 3,5 mm\nWLAN: Nein\nBluetooth: Nein\nFernbedienung: Nein\nVESA-Halterung: Ja\nKabelsperre-Slot: Ja\nPanel-Montage-Schnittstelle: 100 x 100 mm\nSlot-Typ Kabelsperre: Kensington\nkippbar: Ja\nNeigungswinkelbereich: 5 - 20\u00b0\nOn-Screen-Display (OSD): Ja\nPlug & Play: Ja\nEnergie Effizienzklasse: F\nStromverbrauch (Standardbetrieb): 32 W\nStromverbrauch (Standby): 0,5 W\nStromverbrauch (max.): 35 W\nAC Eingangsspannung: 100 - 240 V\nNetzteiltyp: Extern\nSt\u00e4nder enthalten: Ja\nMitgelieferte Kabel: AC, Gleichstrom, HDMI\nSchnellstart\u00fcbersicht: Ja\nGer\u00e4tebreite (inkl. Fu\u00df): 714 mm\nGer\u00e4tetiefe (inkl. Fu\u00df): 231 mm\nGer\u00e4teh\u00f6he (inkl. Fu\u00df): 520 mm\nGewicht (mit St\u00e4nder): 7,3 kg\nBreite (ohne Standfu\u00df): 71,4 cm\nTiefe (ohne Standfu\u00df): 5,9 cm\nH\u00f6he (ohne Standfu\u00df): 42,8 cm\nGewicht (ohne St\u00e4nder): 6,1 kg\nVerpackungsbreite: 770 mm\nVerpackungstiefe: 125 mm\nVerpackungsh\u00f6he: 510 mm\nPaketgewicht: 9,2 kg\nVerpackungsart: Box\nNachhaltigkeitszertifikate: CE, ErP, REACH, RoHS, WEEE",
    "reference_file": "offer_reference_689.json",
    "shop_name": "Jacob Elektronik direkt (AT)"
}