{
    "html_file": "offer_439_8.html",
    "name": "MSI PRO MP273QPDE, 27\"",
    "offer_link": "https://www.proshop.at/Bildschirm/MSI-27-Bildschirm-PRO-MP273QPDE-LED-monitor-27-Black-4-ms/3166938?utm_source=geizhals&utm_medium=cpc&utm_campaign=pricesite",
    "price": 284.76,
    "raw_specifications": {
        "Abmessungen (Breite x Tiefe x H\u00f6he)": "61.35 cm x 20.08 cm x 41.34 cm - mit Fu\u00df",
        "Abmessungen (Breite x Tiefe x H\u00f6he) - mit Fu\u00df": "61.35 cm x 20.08 cm x 41.34 cm",
        "Besonderheiten": "Rahmenlos, 8-bit Farbtiefe, Antiflimmer, Less Blue Light Technology",
        "Bildschirmbeschichtung": "Blendfrei",
        "Bildschirmtyp": "IPS",
        "Details zu Abmessungen & Gewicht": "Ohne Fu\u00df - Breite: 61.35 cm - Tiefe: 48.5 cm - H\u00f6he: 36.25 cm - Gewicht: 3.4 kg",
        "Diagonalabmessung": "68.6 cm (27\")",
        "Display-Typ": "LED-hintergrundbeleuchteter LCD-Monitor / TFT-Aktivmatrix",
        "EAN": "4711377015325",
        "Eingangsanschl\u00fcsse": "2xHDMI, DisplayPort",
        "Eingangsspannung": "Wechselstrom 100-240 V (50/60 Hz)",
        "Enthaltene Kabel": "1 x HDMI-Kabel",
        "Farbe": "Schwarz",
        "Ger\u00e4tetyp": "LED-hintergrundbeleuchteter LCD-Monitor - 68.6 cm (27\")",
        "Gewicht": "5.67 kg",
        "Helligkeit": "350 cd/m\u00b2",
        "Hersteller": "MSI",
        "Hintergrundbeleuchtungs-Technologie": "LED-Hintergrundbeleuchtung",
        "Horizontale Bildwiederholrate": "69.7 - 112.7 kHz",
        "Horizontaler Betrachtungswinkel": "178",
        "H\u00f6heneinstellung": "110 mm",
        "Kennzeichnung": "DisplayPort 1.2a",
        "Kontrast": "1000:1 / 100000000:1 (dynamisch)",
        "Leistungsmerkmale": "Slot f\u00fcr Sicherheitsschloss (Kabelschloss getrennt erh\u00e4ltlich)",
        "Modell": "9S6-3PB69H-002",
        "Native Aufl\u00f6sung": "WQHD 2560 x 1440 bei 75 Hz",
        "Neigungswinkel": "-5/+20",
        "Produktbeschreibung": "MSI PRO MP273QPDE - LED-Monitor - 68.6 cm (27\")",
        "Reaktionszeit": "4 ms (gray-to-gray), 1 ms (MPRT)",
        "Rotationswinkel": "180",
        "Schlosstyp zur Diebstahlsicherung": "Kensington Slot",
        "Schnittstellen": "DisplayPort 1.2a  2 x HDMI  Kopfh\u00f6rer",
        "Schwenkwinkel": "60",
        "Seitenverh\u00e4ltnis": "16:9",
        "Spannung": "Wechselstrom 100-240 V (50/60 Hz)",
        "Transportgewicht": "7.6 kg",
        "Typ": "Lautsprecher - Stereo",
        "VESA-Halterung": "75 x 75 mm",
        "Vertikale Bildwiederholrate": "48 - 75 Hz",
        "Vertikaler Betrachtungswinkel": "178",
        "Waren-Nr.": "3166938",
        "Zum Hersteller": "www.msi.com/"
    },
    "raw_specifications_text": "Hersteller: MSI\nWaren-Nr.: 3166938\nModell: 9S6-3PB69H-002\nEAN: 4711377015325\nZum Hersteller: www.msi.com/\nProduktbeschreibung: MSI PRO MP273QPDE - LED-Monitor - 68.6 cm (27\")\nGer\u00e4tetyp: LED-hintergrundbeleuchteter LCD-Monitor - 68.6 cm (27\")\nBildschirmtyp: IPS\nSeitenverh\u00e4ltnis: 16:9\nNative Aufl\u00f6sung: WQHD 2560 x 1440 bei 75 Hz\nHelligkeit: 350 cd/m\u00b2\nKontrast: 1000:1 / 100000000:1 (dynamisch)\nReaktionszeit: 4 ms (gray-to-gray), 1 ms (MPRT)\nEingangsanschl\u00fcsse: 2xHDMI, DisplayPort\nBildschirmbeschichtung: Blendfrei\nSpannung: Wechselstrom 100-240 V (50/60 Hz)\nFarbe: Schwarz\nAbmessungen (Breite x Tiefe x H\u00f6he) - mit Fu\u00df: 61.35 cm x 20.08 cm x 41.34 cm\nGewicht: 5.67 kg\nKennzeichnung: DisplayPort 1.2a\nDisplay-Typ: LED-hintergrundbeleuchteter LCD-Monitor / TFT-Aktivmatrix\nDiagonalabmessung: 68.6 cm (27\")\nVertikale Bildwiederholrate: 48 - 75 Hz\nHorizontale Bildwiederholrate: 69.7 - 112.7 kHz\nHorizontaler Betrachtungswinkel: 178\nVertikaler Betrachtungswinkel: 178\nHintergrundbeleuchtungs-Technologie: LED-Hintergrundbeleuchtung\nBesonderheiten: Rahmenlos, 8-bit Farbtiefe, Antiflimmer, Less Blue Light Technology\nAbmessungen (Breite x Tiefe x H\u00f6he): 61.35 cm x 20.08 cm x 41.34 cm - mit Fu\u00df\nTyp: Lautsprecher - Stereo\nSchnittstellen: DisplayPort 1.2a  2 x HDMI  Kopfh\u00f6rer\nNeigungswinkel: -5/+20\nSchwenkwinkel: 60\nRotationswinkel: 180\nH\u00f6heneinstellung: 110 mm\nVESA-Halterung: 75 x 75 mm\nLeistungsmerkmale: Slot f\u00fcr Sicherheitsschloss (Kabelschloss getrennt erh\u00e4ltlich)\nEnthaltene Kabel: 1 x HDMI-Kabel\nSchlosstyp zur Diebstahlsicherung: Kensington Slot\nEingangsspannung: Wechselstrom 100-240 V (50/60 Hz)\nDetails zu Abmessungen & Gewicht: Ohne Fu\u00df - Breite: 61.35 cm - Tiefe: 48.5 cm - H\u00f6he: 36.25 cm - Gewicht: 3.4 kg\nTransportgewicht: 7.6 kg",
    "reference_file": "offer_reference_439.json",
    "shop_name": "Proshop.at"
}