{
    "html_file": "offer_1682_17.html",
    "name": "Lenovo ThinkCentre Tiny-in-One 22 Gen 4, 21.5\"",
    "offer_link": "https://www.hiq24.de/shop/artikel/296989/?sPartner=geizhals",
    "price": 251.9,
    "raw_specifications": {
        "Abmessungen (Breite x Tiefe x H\u00f6he)": "48.93 cm x 22.04 cm x 41.82 cm - mit Standfu\u00df (niedrigste Position)",
        "Abmessungen (Breite x Tiefe x H\u00f6he) - mit Standfu\u00df (niedrigste Position)": "48.93 cm x 22.04 cm x 41.82 cm",
        "Ausgangsleistung/Kanal": "2 Watt",
        "Bildschirmbeschichtung": "Blendfrei",
        "Details zu Abmessungen & Gewicht": "Mit Standfu\u00df (niedrigste Position) - Breite: 48.93 cm - Tiefe: 22.04 cm - H\u00f6he: 41.82 cm - Gewicht: 6.58 kg  Mit Standfu\u00df (h\u00f6chste Position) - Breite: 48.93 cm - Tiefe: 22.04 cm - H\u00f6he: 56.82 cm - Gewicht: 6.58 kg  Ohne Fu\u00df - Breite: 48.93 cm - Tiefe: 6.53 cm - H\u00f6he: 33.9 cm - Gewicht: 3.41 kg",
        "Diagonalabmessung": "55 cm (22\")",
        "Display-Typ": "LED-hintergrundbeleuchteter LCD-Monitor / TFT-Aktivmatrix",
        "ENERGY STAR zertifiziert": "Ja",
        "ENERGY STAR-Version": "8.0",
        "EPEAT-kompatibel": "EPEAT Silver",
        "Eingangsanschl\u00fcsse": "DisplayPort",
        "Eingangsspannung": "Wechselstrom 120/230 V (50/60 Hz)",
        "Einstellungen der Anzeigeposition": "H\u00f6he, Pivot (Rotation), Drehung, Neigung",
        "Energie Effizienzklasse": "Klasse E",
        "Farbe": "Schwarz",
        "Farbraum": "72% NTSC (CIE 1931)",
        "Ger\u00e4tetyp": "LED-hintergrundbeleuchteter LCD-Monitor - 55 cm (22\")",
        "Gewicht": "6.58 kg",
        "Helligkeit": "250 cd/m\u00b2",
        "Hintergrundbeleuchtungs-Technologie": "WLED",
        "Horizontaler Betrachtungswinkel": "+89 / -89",
        "H\u00f6heneinstellung": "150 mm",
        "Integrierte Peripherieger\u00e4te": "USB 3.1 Gen.1 Hub, 720p Kamera mit Doppel-Mikrofon und Think Shutter",
        "Kennzeichnung": "UL, VESA FPMPMI, RoHS, WEEE, GREENGUARD, Energy-Related Products (ErP) Lot 5, TUV Rheinland Eye Comfort Certification",
        "Kontrast": "1000:1",
        "Leistungsmerkmale": "USB 3.1 Gen.1 Hub, 720p Kamera mit Doppel-Mikrofon und Think Shutter",
        "Lokalisierung": "Russland, Gemeinschaft unabh\u00e4ngiger Staaten",
        "Montagekit": "Optional",
        "Native Aufl\u00f6sung": "Full HD (1080p) 1920 x 1080",
        "Neigungswinkel": "-5/+30",
        "Pixelpitch": "0.24795 mm",
        "Ppi": "102.4",
        "Produktbeschreibung": "Lenovo ThinkCentre Tiny-in-One 22 Gen 4 - LED-Monitor - Full HD (1080p) - 55 cm (22\")",
        "Reaktionszeit": "6 ms, 4 ms (Overdrive), 14 ms (Standard)",
        "Rotationswinkel": "-5/+90",
        "Schlosstyp zur Diebstahlsicherung": "Kensington Slot",
        "Schnittstellen": "DisplayPort/USB 3.1 Gen 1/Spannungsversorgung (unverlierbares 3-in-1-Kabel)  USB 3.1 Gen 1 Upstream  DisplayPort  USB 3.1 Gen 1 Downstream",
        "Schwenkwinkel": "90",
        "Seitenverh\u00e4ltnis": "16:9",
        "Sichtbare Bildfl\u00e4che": "54.61 cm (21.5\")",
        "Spannung": "Wechselstrom 120/230 V (50/60 Hz)",
        "Stromverbrauch (typisch)": "14 Watt",
        "Stromverbrauch SDR (eingeschaltet)": "14 kWh/1.000 h",
        "Stromverbrauch im Standby-Modus": "0.5 Watt",
        "TCO-zertifiziert": "TCO Certified Displays 8, TCO Certified Edge Displays",
        "Typ": "Lautsprecher - Stereo",
        "Umweltschutzstandards": "TCO Certified Displays 8, TCO Certified Edge Displays, ENERGY STAR-qualifiziert EPEAT Silver",
        "VESA-Halterung": "100 x 100 mm",
        "Vertikaler Betrachtungswinkel": "+89 / -89"
    },
    "raw_specifications_text": "Display-Typ: LED-hintergrundbeleuchteter LCD-Monitor / TFT-Aktivmatrix\nEnergie Effizienzklasse: Klasse E\nDiagonalabmessung: 55 cm (22\")\nSichtbare Bildfl\u00e4che: 54.61 cm (21.5\")\nIntegrierte Peripherieger\u00e4te: USB 3.1 Gen.1 Hub, 720p Kamera mit Doppel-Mikrofon und Think Shutter\nSeitenverh\u00e4ltnis: 16:9\nNative Aufl\u00f6sung: Full HD (1080p) 1920 x 1080\nPixelpitch: 0.24795 mm\nPpi: 102.4\nHelligkeit: 250 cd/m\u00b2\nKontrast: 1000:1\nFarbraum: 72% NTSC (CIE 1931)\nReaktionszeit: 6 ms, 4 ms (Overdrive), 14 ms (Standard)\nHorizontaler Betrachtungswinkel: +89 / -89\nVertikaler Betrachtungswinkel: +89 / -89\nBildschirmbeschichtung: Blendfrei\nHintergrundbeleuchtungs-Technologie: WLED\nFarbe: Schwarz\nAbmessungen (Breite x Tiefe x H\u00f6he): 48.93 cm x 22.04 cm x 41.82 cm - mit Standfu\u00df (niedrigste Position)\nGewicht: 6.58 kg\nTyp: Lautsprecher - Stereo\nAusgangsleistung/Kanal: 2 Watt\nSchnittstellen: DisplayPort/USB 3.1 Gen 1/Spannungsversorgung (unverlierbares 3-in-1-Kabel)  USB 3.1 Gen 1 Upstream  DisplayPort  USB 3.1 Gen 1 Downstream\nEinstellungen der Anzeigeposition: H\u00f6he, Pivot (Rotation), Drehung, Neigung\nNeigungswinkel: -5/+30\nSchwenkwinkel: 90\nRotationswinkel: -5/+90\nH\u00f6heneinstellung: 150 mm\nVESA-Halterung: 100 x 100 mm\nLeistungsmerkmale: USB 3.1 Gen.1 Hub, 720p Kamera mit Doppel-Mikrofon und Think Shutter\nMontagekit: Optional\nKennzeichnung: UL, VESA FPMPMI, RoHS, WEEE, GREENGUARD, Energy-Related Products (ErP) Lot 5, TUV Rheinland Eye Comfort Certification\nLokalisierung: Russland, Gemeinschaft unabh\u00e4ngiger Staaten\nSchlosstyp zur Diebstahlsicherung: Kensington Slot\nEingangsspannung: Wechselstrom 120/230 V (50/60 Hz)\nStromverbrauch SDR (eingeschaltet): 14 kWh/1.000 h\nStromverbrauch (typisch): 14 Watt\nStromverbrauch im Standby-Modus: 0.5 Watt\nDetails zu Abmessungen & Gewicht: Mit Standfu\u00df (niedrigste Position) - Breite: 48.93 cm - Tiefe: 22.04 cm - H\u00f6he: 41.82 cm - Gewicht: 6.58 kg  Mit Standfu\u00df (h\u00f6chste Position) - Breite: 48.93 cm - Tiefe: 22.04 cm - H\u00f6he: 56.82 cm - Gewicht: 6.58 kg  Ohne Fu\u00df - Breite: 48.93 cm - Tiefe: 6.53 cm - H\u00f6he: 33.9 cm - Gewicht: 3.41 kg\nTCO-zertifiziert: TCO Certified Displays 8, TCO Certified Edge Displays\nEPEAT-kompatibel: EPEAT Silver\nENERGY STAR zertifiziert: Ja\nENERGY STAR-Version: 8.0\nProduktbeschreibung: Lenovo ThinkCentre Tiny-in-One 22 Gen 4 - LED-Monitor - Full HD (1080p) - 55 cm (22\")\nGer\u00e4tetyp: LED-hintergrundbeleuchteter LCD-Monitor - 55 cm (22\")\nEingangsanschl\u00fcsse: DisplayPort\nSpannung: Wechselstrom 120/230 V (50/60 Hz)\nAbmessungen (Breite x Tiefe x H\u00f6he) - mit Standfu\u00df (niedrigste Position): 48.93 cm x 22.04 cm x 41.82 cm\nUmweltschutzstandards: TCO Certified Displays 8, TCO Certified Edge Displays, ENERGY STAR-qualifiziert EPEAT Silver",
    "reference_file": "offer_reference_1682.json",
    "shop_name": "HiQ24"
}