{
    "html_file": "offer_1274_3.html",
    "name": "ViewSonic VP2768a-4K, 27\"",
    "offer_link": "https://www.office-partner.de/productredirect/index/sku/19299447?sPartner=p-geizhals-at&campaign=psm/geizhals-at/",
    "price": 584.77,
    "raw_specifications": {
        "Anschl\u00fcsse": "HDMI, DisplayPort, USB",
        "Artikelnummer": "19299447",
        "Aufl\u00f6sung Kurzname": "UHD, 4K",
        "Bezeichnung des Herstellers": "ViewSonic ColorPro VP2768A-4K (27\") 68,6cm LED-Monitor",
        "Bildwiederholungsrate": "60,00",
        "Breite": "420,00",
        "Display Features": "FlickerFree",
        "Displaygr\u00f6\u00dfe": "68,58 cm (27 Zoll)",
        "EEK - Spektrum": "AG",
        "Einsatzort": "Innen",
        "Energieeffizienzklasse": "G",
        "Geh\u00e4usefarbe des Ger\u00e4tes": "Schwarz",
        "Gewicht": "6,70",
        "Gewicht inkl. Verpackung in Kg": "9,90",
        "Helligkeit Bereich": "300 - 450 cd/m\u00b2",
        "Hersteller": "Viewsonic",
        "H\u00f6he": "220,00",
        "Inhalt (ml oder g)": "0,00",
        "Kapazit\u00e4t (Seiten)": "0",
        "Kontrastverh\u00e4ltnis (typisch) Bereich": "ab 1.200:1",
        "LCD-Technologie": "IPS Panel",
        "L\u00e4nge": "740,00",
        "Produktart": "Monitore",
        "Reaktionszeit": "6,00",
        "Seitenverh\u00e4ltnis": "16:9",
        "Shop Herstellernummer": "VP2768A-4K",
        "Standard-EAN": "0766907012354",
        "Verbindungen": "Netzwerk (LAN)",
        "Verpackung - Breite in cm": "12,00",
        "Verpackung - H\u00f6he in cm": "22,00",
        "Verpackung - L\u00e4nge in cm": "74,00",
        "max. Aufl\u00f6sung": "3.840 x 2.160 Pixel (16:9)"
    },
    "raw_specifications_text": "Displaygr\u00f6\u00dfe: 68,58 cm (27 Zoll)\nEnergieeffizienzklasse: G\nGeh\u00e4usefarbe des Ger\u00e4tes: Schwarz\nAnschl\u00fcsse: HDMI, DisplayPort, USB\nDisplay Features: FlickerFree\nHersteller: Viewsonic\nKontrastverh\u00e4ltnis (typisch) Bereich: ab 1.200:1\nHelligkeit Bereich: 300 - 450 cd/m\u00b2\nVerbindungen: Netzwerk (LAN)\nProduktart: Monitore\nKapazit\u00e4t (Seiten): 0\nEEK - Spektrum: AG\nAufl\u00f6sung Kurzname: UHD, 4K\nInhalt (ml oder g): 0,00\nVerpackung - L\u00e4nge in cm: 74,00\nGewicht: 6,70\nH\u00f6he: 220,00\nL\u00e4nge: 740,00\nGewicht inkl. Verpackung in Kg: 9,90\nBreite: 420,00\nVerpackung - H\u00f6he in cm: 22,00\nVerpackung - Breite in cm: 12,00\nArtikelnummer: 19299447\nStandard-EAN: 0766907012354\nShop Herstellernummer: VP2768A-4K\nBezeichnung des Herstellers: ViewSonic ColorPro VP2768A-4K (27\") 68,6cm LED-Monitor\nmax. Aufl\u00f6sung: 3.840 x 2.160 Pixel (16:9)\nSeitenverh\u00e4ltnis: 16:9\nLCD-Technologie: IPS Panel\nReaktionszeit: 6,00\nBildwiederholungsrate: 60,00\nEinsatzort: Innen",
    "reference_file": "offer_reference_1274.json",
    "shop_name": "office-partner (AT)"
}