{
    "html_file": "offer_1523_17.html",
    "name": "ViewSonic VG2439Smh-2, 23.6\"",
    "offer_link": "https://www.csv-direct.de/artinfo.php?artnr=A1660504&KATEGORIE=162&pva=geizhals2",
    "price": 146.83,
    "raw_specifications": {
        "Anzahl DisplayPort Anschl\u00fcsse": "1",
        "Anzahl HDMI-Anschl\u00fcsse": "1",
        "Anzahl VGA D-Sub Anschl\u00fcsse": "1",
        "Anzahl der Farben des Displays": "16,78 Millionen Farben",
        "Anzahl der Lautsprecher": "2",
        "Anzahl der nachgeschalteten Steckpl\u00e4tze vom Typ USB-A": "2",
        "Betriebstemperatur": "0 - 40 \u00b0C",
        "Bildschirmdiagonale": "61 cm 24\"",
        "Bildschirmtechnologie": "LCD",
        "Bildwinkel, horizontal": "178\u00b0",
        "Bildwinkel, vertikal": "178\u00b0",
        "Breite ohne Standfu\u00df": "560,3 mm",
        "Digital horizontale Frequenz": "24 - 82 kHz",
        "Digital vertikale Frequenz": "50 - 75 Hz",
        "Display": "LED",
        "Display-Aufl\u00f6sung": "1920 x 1080 Pixel",
        "Energieeffizienzklasse SDR": "F",
        "Energieverbrauch SDR pro 1.000 Stunden": "21,5 kWh",
        "Ger\u00e4tebreite inkl. Fu\u00df": "560,3 mm",
        "Ger\u00e4teh\u00f6he inkl. Fu\u00df": "435,2 mm",
        "Ger\u00e4tetiefe inkl. Fu\u00df": "239,6 mm",
        "Gewicht mit St\u00e4nder": "5,2 kg",
        "Gewicht ohne St\u00e4nder": "3,7 kg",
        "HD-Typ": "Full HD",
        "Helligkeit typisch": "250 cd/m\u00b2",
        "H\u00f6he ohne Standfu\u00df": "331,7 mm",
        "Integrierte Kamera": "Nein",
        "Kabelsperre-Slot": "Nein",
        "Kontrastverh\u00e4ltnis": "3000:1",
        "Kontrastverh\u00e4ltnis dynamisch": "20000000:1",
        "Mitgelieferte Kabel": "AC, Audio 3,5 mm, DisplayPort, USB, VGA",
        "Nachhaltigkeitszertifikate": "EPEAT Gold, ENERGY STAR",
        "Neigungswinkelbereich": "-5 - 20\u00b0",
        "Paketgewicht": "6,9 kg",
        "Panel-Montage-Schnittstelle": "100 x 100 mm",
        "Panel-Typ": "TFT",
        "Produktfarbe": "Schwarz",
        "RMS-Leistung": "4 W",
        "Reaktionszeit": "6,5 ms",
        "Relative Luftfeuchtigkeit in Betrieb": "10 - 90",
        "Sichtbare Gr\u00f6\u00dfe diagonal": "59,9 cm",
        "Sichtbare Gr\u00f6\u00dfe horizontal": "52,1 cm",
        "Sichtbare Gr\u00f6\u00dfe vertikal": "29,2 cm",
        "Stromverbrauch Standardbetrieb": "21,5 W",
        "Stromverbrauch max.": "36 W",
        "TV Tuner integriert": "Nein",
        "Tiefe ohne Standfu\u00df": "58,2 mm",
        "Touchscreen": "Nein",
        "Typ der Hintergrundbeleuchtung": "W-LED",
        "USB-Hub-Version": "2.0",
        "Unterst\u00fctzte Grafik-Aufl\u00f6sungen": "1920 x 1080 HD 1080",
        "Unterst\u00fctzte Video-Modi": "1080i, 1080p",
        "Verpackungsbreite": "634 mm",
        "Verpackungsh\u00f6he": "508 mm",
        "Verpackungstiefe": "190 mm",
        "Zertifizierung": "WEEE, RoHS, CE, CB, WHQL, UL/cUL, FCC-B"
    },
    "raw_specifications_text": "Bildschirmdiagonale: 61 cm 24\"\nDisplay-Aufl\u00f6sung: 1920 x 1080 Pixel\nBildschirmtechnologie: LCD\nTouchscreen: Nein\nHD-Typ: Full HD\nPanel-Typ: TFT\nKontrastverh\u00e4ltnis: 3000:1\nAnzahl der Farben des Displays: 16,78 Millionen Farben\nTyp der Hintergrundbeleuchtung: W-LED\nHelligkeit typisch: 250 cd/m\u00b2\nReaktionszeit: 6,5 ms\nUnterst\u00fctzte Grafik-Aufl\u00f6sungen: 1920 x 1080 HD 1080\nUnterst\u00fctzte Video-Modi: 1080i, 1080p\nKontrastverh\u00e4ltnis dynamisch: 20000000:1\nBildwinkel, horizontal: 178\u00b0\nBildwinkel, vertikal: 178\u00b0\nSichtbare Gr\u00f6\u00dfe horizontal: 52,1 cm\nSichtbare Gr\u00f6\u00dfe vertikal: 29,2 cm\nSichtbare Gr\u00f6\u00dfe diagonal: 59,9 cm\nDigital horizontale Frequenz: 24 - 82 kHz\nDigital vertikale Frequenz: 50 - 75 Hz\nIntegrierte Kamera: Nein\nAnzahl der Lautsprecher: 2\nRMS-Leistung: 4 W\nProduktfarbe: Schwarz\nZertifizierung: WEEE, RoHS, CE, CB, WHQL, UL/cUL, FCC-B\nUSB-Hub-Version: 2.0\nAnzahl der nachgeschalteten Steckpl\u00e4tze vom Typ USB-A: 2\nAnzahl VGA D-Sub Anschl\u00fcsse: 1\nAnzahl HDMI-Anschl\u00fcsse: 1\nAnzahl DisplayPort Anschl\u00fcsse: 1\nKabelsperre-Slot: Nein\nPanel-Montage-Schnittstelle: 100 x 100 mm\nNeigungswinkelbereich: -5 - 20\u00b0\nEnergieeffizienzklasse SDR: F\nEnergieverbrauch SDR pro 1.000 Stunden: 21,5 kWh\nStromverbrauch Standardbetrieb: 21,5 W\nStromverbrauch max.: 36 W\nBetriebstemperatur: 0 - 40 \u00b0C\nRelative Luftfeuchtigkeit in Betrieb: 10 - 90\nMitgelieferte Kabel: AC, Audio 3,5 mm, DisplayPort, USB, VGA\nGer\u00e4tebreite inkl. Fu\u00df: 560,3 mm\nGer\u00e4tetiefe inkl. Fu\u00df: 239,6 mm\nGer\u00e4teh\u00f6he inkl. Fu\u00df: 435,2 mm\nGewicht mit St\u00e4nder: 5,2 kg\nBreite ohne Standfu\u00df: 560,3 mm\nTiefe ohne Standfu\u00df: 58,2 mm\nH\u00f6he ohne Standfu\u00df: 331,7 mm\nGewicht ohne St\u00e4nder: 3,7 kg\nVerpackungsbreite: 634 mm\nVerpackungstiefe: 190 mm\nVerpackungsh\u00f6he: 508 mm\nPaketgewicht: 6,9 kg\nNachhaltigkeitszertifikate: EPEAT Gold, ENERGY STAR\nDisplay: LED\nTV Tuner integriert: Nein",
    "reference_file": "offer_reference_1523.json",
    "shop_name": "CSV-Direct.de"
}