{
    "html_file": "offer_1054_13.html",
    "name": "ViewSonic VP3256-4K, 31.5\"",
    "offer_link": "https://www.mylemon.at/artikel/viewsonic/vp3256_4k/vp3256-4k-81-28cm-32zoll.html",
    "price": 755.13,
    "raw_specifications": {
        "AC Eingangsspannung": "100 - 240 V",
        "Anzahl DisplayPort Anschl\u00fcsse": "1",
        "Anzahl HDMI-Anschl\u00fcsse": "2",
        "Anzahl der Farben des Displays": "1,07 Milliarden Farben",
        "Anzahl der Lautsprecher": "2",
        "Anzahl der Upstream-Ports USB Typ-B": "1",
        "Anzahl der nachgeschalteten Steckpl\u00e4tze vom Typ USB-A": "2",
        "Artikelnummer": "M18YW8ZL",
        "Aufl\u00f6sung": "3840x2160",
        "Besonderheiten": "Lautsprecher",
        "Betriebstemperatur": "0 - 40 \u00b0C",
        "Bildschirmdiagonale": "81,3 cm (32 Zoll)",
        "Bildschirmform": "Flach",
        "Bildschirmtechnologie": "LED",
        "Bildwinkel, horizontal": "178\u00b0",
        "Bildwinkel, vertikal": "178\u00b0",
        "Blendfreier Bildschirm": "Ja",
        "Breite (ohne Standfu\u00df)": "71,5 cm",
        "Display-Aufl\u00f6sung": "3840 x 2160 Pixel",
        "Displaygr\u00f6\u00dfe": "31,5 Zoll",
        "EAN": "0766907014532",
        "Eingebaute Lautsprecher": "Ja",
        "Ergonomie": "H\u00f6henverstellbar, Pivot (90 Grad drehbar), Schwenkbar, Neigbar",
        "Farbtiefe": "10 Bit",
        "Flimmerfreie Technologie": "Ja",
        "Ger\u00e4tebreite (inkl. Fu\u00df)": "715 mm",
        "Ger\u00e4teh\u00f6he (inkl. Fu\u00df)": "513,8 mm",
        "Ger\u00e4tetiefe (inkl. Fu\u00df)": "265 mm",
        "Gewicht (mit St\u00e4nder)": "10,9 kg",
        "Gewicht (ohne St\u00e4nder)": "7,2 kg",
        "HD-Typ": "4K Ultra HD",
        "HDMI": "Ja",
        "HDMI-Version": "2.0",
        "Helligkeit": "350 cd/m\u00b2",
        "Helligkeit (typisch)": "350 cd/m\u00b2",
        "Hersteller Artikelnummer": "VP3256-4K",
        "Horizontaler Scanbereich": "15 - 136 kHz",
        "H\u00f6he (ohne Standfu\u00df)": "42,3 cm",
        "H\u00f6heneinstellung": "13 cm",
        "H\u00f6henverstellung": "Ja",
        "Integrierter USB-Hub": "Nein",
        "Kabelsperre-Slot": "Ja",
        "Kontrastverh\u00e4ltnis": "1000:1",
        "Kontrastverh\u00e4ltnis (dynamisch)": "20000000:1",
        "Marktpositionierung": "Business",
        "Maximale Bildwiederholrate": "60 Hz",
        "Mitgelieferte Kabel": "DisplayPort, HDMI, USB Typ-A, USB Typ-C",
        "NTSC Abdeckung (typisch)": "91%",
        "Natives Seitenverh\u00e4ltnis": "16:9",
        "Neigungsverstellung": "Ja",
        "Neigungswinkelbereich": "-5 - 21\u00b0",
        "Paketgewicht": "15,3 kg",
        "Panel": "IPS",
        "Panel-Montage-Schnittstelle": "100 x 100 mm",
        "Panel-Typ": "IPS",
        "Pivot": "Ja",
        "Pivot Winkel": "90 - 90\u00b0",
        "Pixel Abstand": "0,182 x 0,182 mm",
        "Produktfarbe": "Schwarz",
        "RGB-Farbraum": "Adobe RGB",
        "RMS-Leistung": "3 W",
        "Reaktionszeit": "5 ms",
        "Relative Luftfeuchtigkeit in Betrieb": "20 - 90%",
        "Schwenkbar": "Ja",
        "Schwenkwinkelbereich": "120 - 120\u00b0",
        "Slot-Typ Kabelsperre": "Kensington",
        "Stromverbrauch (Standardbetrieb)": "46 W",
        "Stromverbrauch (Standby)": "0,5 W",
        "Stromverbrauch (max.)": "50 W",
        "Tiefe (ohne Standfu\u00df)": "6,6 cm",
        "Touchscreen": "Nein",
        "USB-Typ-C DisplayPort-Wechselmodus": "Ja",
        "VESA Adaptive Sync unterst\u00fctzt": "Ja",
        "VESA Halterung": "100x100 mm",
        "VESA-Halterung": "Ja",
        "Verpackungsbreite": "840 mm",
        "Verpackungsh\u00f6he": "520 mm",
        "Verpackungstiefe": "326 mm",
        "Vertikaler Scanbereich": "24 - 75 Hz",
        "Video Anschl\u00fcsse": "2x HDMI, 1x DisplayPort, USB-C DisplayPort",
        "Warentarifnummer (HS)": "85285210",
        "sRGB Abdeckung (klassisch)": "128%"
    },
    "raw_specifications_text": "Displaygr\u00f6\u00dfe: 31,5 Zoll\nAufl\u00f6sung: 3840x2160\nPanel: IPS\nReaktionszeit: 5 ms\nVideo Anschl\u00fcsse: 2x HDMI, 1x DisplayPort, USB-C DisplayPort\nErgonomie: H\u00f6henverstellbar, Pivot (90 Grad drehbar), Schwenkbar, Neigbar\nVESA Halterung: 100x100 mm\nHelligkeit: 350 cd/m\u00b2\nBesonderheiten: Lautsprecher\nHersteller Artikelnummer: VP3256-4K\nEAN: 0766907014532\nArtikelnummer: M18YW8ZL\nBildschirmdiagonale: 81,3 cm (32 Zoll)\nDisplay-Aufl\u00f6sung: 3840 x 2160 Pixel\nNatives Seitenverh\u00e4ltnis: 16:9\nBildschirmtechnologie: LED\nTouchscreen: Nein\nHD-Typ: 4K Ultra HD\nPanel-Typ: IPS\nBildschirmform: Flach\nKontrastverh\u00e4ltnis: 1000:1\nMaximale Bildwiederholrate: 60 Hz\nAnzahl der Farben des Displays: 1,07 Milliarden Farben\nHelligkeit (typisch): 350 cd/m\u00b2\nBlendfreier Bildschirm: Ja\nKontrastverh\u00e4ltnis (dynamisch): 20000000:1\nBildwinkel, horizontal: 178\u00b0\nBildwinkel, vertikal: 178\u00b0\nPixel Abstand: 0,182 x 0,182 mm\nHorizontaler Scanbereich: 15 - 136 kHz\nVertikaler Scanbereich: 24 - 75 Hz\nFarbtiefe: 10 Bit\nRGB-Farbraum: Adobe RGB\nsRGB Abdeckung (klassisch): 128%\nNTSC Abdeckung (typisch): 91%\nVESA Adaptive Sync unterst\u00fctzt: Ja\nFlimmerfreie Technologie: Ja\nEingebaute Lautsprecher: Ja\nAnzahl der Lautsprecher: 2\nRMS-Leistung: 3 W\nMarktpositionierung: Business\nProduktfarbe: Schwarz\nIntegrierter USB-Hub: Nein\nHDMI: Ja\nAnzahl der Upstream-Ports USB Typ-B: 1\nAnzahl der nachgeschalteten Steckpl\u00e4tze vom Typ USB-A: 2\nUSB-Typ-C DisplayPort-Wechselmodus: Ja\nAnzahl HDMI-Anschl\u00fcsse: 2\nHDMI-Version: 2.0\nAnzahl DisplayPort Anschl\u00fcsse: 1\nVESA-Halterung: Ja\nKabelsperre-Slot: Ja\nH\u00f6henverstellung: Ja\nPanel-Montage-Schnittstelle: 100 x 100 mm\nSlot-Typ Kabelsperre: Kensington\nH\u00f6heneinstellung: 13 cm\nPivot: Ja\nPivot Winkel: 90 - 90\u00b0\nSchwenkbar: Ja\nSchwenkwinkelbereich: 120 - 120\u00b0\nNeigungswinkelbereich: -5 - 21\u00b0\nNeigungsverstellung: Ja\nStromverbrauch (Standardbetrieb): 46 W\nStromverbrauch (Standby): 0,5 W\nStromverbrauch (max.): 50 W\nAC Eingangsspannung: 100 - 240 V\nBetriebstemperatur: 0 - 40 \u00b0C\nRelative Luftfeuchtigkeit in Betrieb: 20 - 90%\nMitgelieferte Kabel: DisplayPort, HDMI, USB Typ-A, USB Typ-C\nGer\u00e4tebreite (inkl. Fu\u00df): 715 mm\nGer\u00e4tetiefe (inkl. Fu\u00df): 265 mm\nGer\u00e4teh\u00f6he (inkl. Fu\u00df): 513,8 mm\nGewicht (mit St\u00e4nder): 10,9 kg\nBreite (ohne Standfu\u00df): 71,5 cm\nTiefe (ohne Standfu\u00df): 6,6 cm\nH\u00f6he (ohne Standfu\u00df): 42,3 cm\nGewicht (ohne St\u00e4nder): 7,2 kg\nVerpackungsbreite: 840 mm\nVerpackungstiefe: 326 mm\nVerpackungsh\u00f6he: 520 mm\nPaketgewicht: 15,3 kg\nWarentarifnummer (HS): 85285210",
    "reference_file": "offer_reference_1054.json",
    "shop_name": "mylemon.at"
}