{
    "html_file": "offer_1455_46.html",
    "name": "Dell UltraSharp U2422H, 23.8\"",
    "offer_link": "https://syswork.at/sw/index.html?open&mid=Artikel&artid=mon-1043&from=geizhals.at",
    "price": 260.0,
    "raw_specifications": {
        "AC Eingangsfrequenz": "50/60 Hz",
        "AC Eingangsspannung": "100 - 240 V",
        "AMD FreeSync": "Nein",
        "Anzahl DisplayPort Anschl\u00fcsse": "2",
        "Anzahl HDMI-Anschl\u00fcsse": "1",
        "Anzahl der Farben des Displays": "16,78 Millionen Farben",
        "Anzahl der Upstream-Ports USB Typ-C": "1",
        "Anzahl der nachgeschalteten Ports vom Typ USB-C": "1",
        "Anzahl der nachgeschalteten Steckpl\u00e4tze vom Typ USB-A": "3",
        "Anzahl der vorgeschalteten Steckpl\u00e4tze": "1",
        "Audioausgang": "Ja",
        "Bezel Weite (bottom)": "8,95 mm",
        "Bezel Weite (side)": "5,3 mm",
        "Bezel Weite (top)": "5,3 mm",
        "Bildschirmaufl\u00f6sung": "1920 x 1080 Pixel",
        "Bildschirmdiagonale": "61 cm (24 Zoll)",
        "Bildschirmform": "Flach",
        "Bildschirmtechnologie": "LCD",
        "Blendfreier Bildschirm": "Ja",
        "Breite (ohne Standfu\u00df)": "53,8 cm",
        "Datenblatt": "Kein Datenblatt verf\u00fcgbar",
        "DisplayPorts-Version": "1.4",
        "Eingangsstrom": "1.2 A",
        "Eingebaute Lautsprecher": "Nein",
        "Energieeffizienzklasse (SDR)": "C",
        "Energieeffizienzskala": "A bis G",
        "Energieverbrauch (SDR) pro 1.000 Stunden": "12 kWh",
        "Farbskala": "100%",
        "Fu\u00dffarbe": "Silber",
        "Ger\u00e4tebreite (inkl. Fu\u00df)": "537,6 mm",
        "Ger\u00e4teh\u00f6he (inkl. Fu\u00df)": "496 mm",
        "Ger\u00e4tetiefe (inkl. Fu\u00df)": "179,6 mm",
        "Gewicht (mit St\u00e4nder)": "5,27 kg",
        "Gewicht (ohne St\u00e4nder)": "3,52 kg",
        "HD-Typ": "Full HD",
        "HDMI": "Ja",
        "HDMI-Version": "1.4",
        "Helligkeit (typisch)": "250 cd/m\u00b2",
        "Herstellerlink": "Dell",
        "Horizontaler Scanbereich": "30 - 83 kHz",
        "H\u00f6he (ohne Standfu\u00df)": "31,1 cm",
        "H\u00f6heneinstellung": "15 cm",
        "H\u00f6henverstellung": "Ja",
        "Integrierte Kamera": "Nein",
        "Integrierter USB-Hub": "Ja",
        "Kabelsperre-Slot": "Ja",
        "Kontrastverh\u00e4ltnis": "1000:1",
        "Luftfeuchtigkeit bei Lagerung": "5 - 90%",
        "Marktpositionierung": "Business",
        "Maximale Bildwiederholrate": "60 Hz",
        "NVIDIA G-SYNC": "Nein",
        "Natives Seitenverh\u00e4ltnis": "16:9",
        "Neigungswinkelbereich": "-5 - 21\u00b0",
        "Paketgewicht": "7,82 kg",
        "Panel-Montage-Schnittstelle": "100 x 100 mm",
        "Panel-Typ": "IPS",
        "Pivot": "Ja",
        "Pivot Winkel": "-90 - 90\u00b0",
        "Pixel Abstand": "0,2745 x 0,2745 mm",
        "Pixeldichte": "92,53 ppi",
        "Produktfarbe": "Schwarz, Silber",
        "Produktlink": "Link",
        "RGB-Farbraum": "sRGB",
        "Reaktionszeit": "8 ms",
        "Reaktionszeit (schnell)": "5 ms",
        "Relative Luftfeuchtigkeit in Betrieb": "10 - 80%",
        "Schwenkbar": "Ja",
        "Schwenkwinkelbereich": "-45 - 45\u00b0",
        "Sichtbare Gr\u00f6\u00dfe (diagonal)": "60,5 cm",
        "Sichtbare Gr\u00f6\u00dfe (horizontal)": "52,7 cm",
        "Sichtbare Gr\u00f6\u00dfe (vertikal)": "29,6 cm",
        "Stromverbrauch (PowerSave)": "11,06 W",
        "Stromverbrauch (Standardbetrieb)": "11,6 W",
        "Stromverbrauch (Standby)": "0,3 W",
        "Stromverbrauch (aus)": "0,3 W",
        "Stromverbrauch (max.)": "63 W",
        "Temperaturbereich bei Lagerung": "-20 - 60 \u00b0C",
        "Temperaturbereich in Betrieb": "0 - 40 \u00b0C",
        "Tiefe (ohne Standfu\u00df)": "4,85 cm",
        "Typ der Hintergrundbeleuchtung": "W-LED",
        "Unterst\u00fctzte Grafik-Aufl\u00f6sungen": "640 x 480 (VGA),720 x 400,800 x 600 (SVGA),1024 x 768 (XGA),1152 x 864 (XGA+),1280 x 1024 (SXGA),1600 x 900,1920 x 1080 (HD 1080)",
        "Unterst\u00fctzte Video-Modi": "480i,480p,576i,576p,720p,1080i,1080p",
        "VESA-Halterung": "Ja",
        "Vertikaler Scanbereich": "56 - 76 Hz",
        "kippbar": "Ja"
    },
    "raw_specifications_text": "Bildschirmdiagonale: 61 cm (24 Zoll)\nBildschirmaufl\u00f6sung: 1920 x 1080 Pixel\nNatives Seitenverh\u00e4ltnis: 16:9\nPanel-Typ: IPS\nHD-Typ: Full HD\nBildschirmtechnologie: LCD\nBildschirmform: Flach\nKontrastverh\u00e4ltnis: 1000:1\nMaximale Bildwiederholrate: 60 Hz\nAnzahl der Farben des Displays: 16,78 Millionen Farben\nHelligkeit (typisch): 250 cd/m\u00b2\nReaktionszeit: 8 ms\nTyp der Hintergrundbeleuchtung: W-LED\nBlendfreier Bildschirm: Ja\nUnterst\u00fctzte Grafik-Aufl\u00f6sungen: 640 x 480 (VGA),720 x 400,800 x 600 (SVGA),1024 x 768 (XGA),1152 x 864 (XGA+),1280 x 1024 (SXGA),1600 x 900,1920 x 1080 (HD 1080)\nUnterst\u00fctzte Video-Modi: 480i,480p,576i,576p,720p,1080i,1080p\nReaktionszeit (schnell): 5 ms\nPixel Abstand: 0,2745 x 0,2745 mm\nPixeldichte: 92,53 ppi\nHorizontaler Scanbereich: 30 - 83 kHz\nVertikaler Scanbereich: 56 - 76 Hz\nSichtbare Gr\u00f6\u00dfe (horizontal): 52,7 cm\nSichtbare Gr\u00f6\u00dfe (vertikal): 29,6 cm\nSichtbare Gr\u00f6\u00dfe (diagonal): 60,5 cm\nRGB-Farbraum: sRGB\nFarbskala: 100%\nNVIDIA G-SYNC: Nein\nAMD FreeSync: Nein\nEingebaute Lautsprecher: Nein\nIntegrierte Kamera: Nein\nMarktpositionierung: Business\nProduktfarbe: Schwarz, Silber\nFu\u00dffarbe: Silber\nIntegrierter USB-Hub: Ja\nHDMI: Ja\nAnzahl der vorgeschalteten Steckpl\u00e4tze: 1\nAnzahl der Upstream-Ports USB Typ-C: 1\nAnzahl der nachgeschalteten Steckpl\u00e4tze vom Typ USB-A: 3\nAnzahl der nachgeschalteten Ports vom Typ USB-C: 1\nAnzahl HDMI-Anschl\u00fcsse: 1\nHDMI-Version: 1.4\nAnzahl DisplayPort Anschl\u00fcsse: 2\nDisplayPorts-Version: 1.4\nAudioausgang: Ja\nVESA-Halterung: Ja\nKabelsperre-Slot: Ja\nH\u00f6henverstellung: Ja\nPanel-Montage-Schnittstelle: 100 x 100 mm\nH\u00f6heneinstellung: 15 cm\nPivot: Ja\nPivot Winkel: -90 - 90\u00b0\nSchwenkbar: Ja\nSchwenkwinkelbereich: -45 - 45\u00b0\nkippbar: Ja\nNeigungswinkelbereich: -5 - 21\u00b0\nEnergieeffizienzklasse (SDR): C\nEnergieverbrauch (SDR) pro 1.000 Stunden: 12 kWh\nStromverbrauch (Standardbetrieb): 11,6 W\nStromverbrauch (Standby): 0,3 W\nStromverbrauch (max.): 63 W\nStromverbrauch (aus): 0,3 W\nStromverbrauch (PowerSave): 11,06 W\nAC Eingangsspannung: 100 - 240 V\nAC Eingangsfrequenz: 50/60 Hz\nEingangsstrom: 1.2 A\nEnergieeffizienzskala: A bis G\nTemperaturbereich in Betrieb: 0 - 40 \u00b0C\nTemperaturbereich bei Lagerung: -20 - 60 \u00b0C\nRelative Luftfeuchtigkeit in Betrieb: 10 - 80%\nLuftfeuchtigkeit bei Lagerung: 5 - 90%\nGer\u00e4tebreite (inkl. Fu\u00df): 537,6 mm\nGer\u00e4tetiefe (inkl. Fu\u00df): 179,6 mm\nGer\u00e4teh\u00f6he (inkl. Fu\u00df): 496 mm\nGewicht (mit St\u00e4nder): 5,27 kg\nBreite (ohne Standfu\u00df): 53,8 cm\nTiefe (ohne Standfu\u00df): 4,85 cm\nH\u00f6he (ohne Standfu\u00df): 31,1 cm\nGewicht (ohne St\u00e4nder): 3,52 kg\nBezel Weite (side): 5,3 mm\nBezel Weite (top): 5,3 mm\nBezel Weite (bottom): 8,95 mm\nPaketgewicht: 7,82 kg\nDatenblatt: Kein Datenblatt verf\u00fcgbar\nProduktlink: Link\nHerstellerlink: Dell",
    "reference_file": "offer_reference_1455.json",
    "shop_name": "Syswork"
}