{
    "html_file": "offer_886_9.html",
    "name": "ASUS ProArt PA32UCR-K, 32\"",
    "offer_link": "https://www.amazon.de/dp/B09WHVLB3J?linkCode=xm2&camp=2025&creative=165953&smid=A3JWKAKR8XB7XF&creativeASIN=B09WHVLB3J&tag=geizhals1-21",
    "price": 1394.31,
    "raw_specifications": {
        "ASIN": "B09WHVLB3J",
        "Amazon Bestseller-Rang": "Nr. 104,496 in Computer & Zubeh\u00f6r (Siehe Top 100 in Computer & Zubeh\u00f6r)  Nr. 1,862 in Monitore",
        "Anzahl HDMI Schnittstellen": "\u200e3",
        "Anzahl der Lithium-Ionen-Zellen": "\u200e1",
        "Anzahl der Lithium-Metall-Zellen": "\u200e1",
        "Artikelgewicht": "\u200e12,3 Kilograms",
        "Batterien": "\u200e1 Lithium-Ionen Batterien erforderlich.",
        "Batterien enthalten": "\u200eNein",
        "Bildschirmaufl\u00f6sung": "\u200e3820 x 2160",
        "Display-Gr\u00f6\u00dfe": "\u200e32 Zoll",
        "Durchschnittliche Kundenbewertung": "3,6  3,6 von 5 Sternen    \n    12 Sternebewertungen   \n\n\n 3,6 von 5 Sternen",
        "Farbe": "\u200eschwarz",
        "Garantierte Software-Updates bis": "\u200eunbekannt",
        "Grafik-Coprozessor": "\u200eNVIDIA GeForce RTX 3080",
        "Grafikkartenspeicher": "\u200eGDDR6X",
        "Hersteller": "\u200eAsus",
        "Im Angebot von Amazon.de seit": "29. M\u00e4rz 2022",
        "Interface Grafikkarte": "\u200ePCI-Express x16",
        "L\u00f6sung": "\u200e3840 x 2160 Pixels",
        "Marke": "\u200eASUS",
        "Modell/Serie": "\u200ePA32UCR-K",
        "Modellnummer": "\u200ePA32UCR-K",
        "Produktabmessungen": "\u200e50 x 50 x 28 cm; 12,3 Kilogramm",
        "Prozessortyp": "\u200eOthers",
        "Speichergeschwindigkeit": "\u200e1785 Unbekannt",
        "Speichergr\u00f6\u00dfe Grafikkarte": "\u200e10 GB",
        "Volt": "\u200e1 Volt"
    },
    "raw_specifications_text": "Marke: \u200eASUS\nHersteller: \u200eAsus\nModell/Serie: \u200ePA32UCR-K\nProduktabmessungen: \u200e50 x 50 x 28 cm; 12,3 Kilogramm\nBatterien: \u200e1 Lithium-Ionen Batterien erforderlich.\nModellnummer: \u200ePA32UCR-K\nFarbe: \u200eschwarz\nDisplay-Gr\u00f6\u00dfe: \u200e32 Zoll\nBildschirmaufl\u00f6sung: \u200e3820 x 2160\nL\u00f6sung: \u200e3840 x 2160 Pixels\nProzessortyp: \u200eOthers\nSpeichergeschwindigkeit: \u200e1785 Unbekannt\nGrafik-Coprozessor: \u200eNVIDIA GeForce RTX 3080\nGrafikkartenspeicher: \u200eGDDR6X\nSpeichergr\u00f6\u00dfe Grafikkarte: \u200e10 GB\nInterface Grafikkarte: \u200ePCI-Express x16\nAnzahl HDMI Schnittstellen: \u200e3\nVolt: \u200e1 Volt\nBatterien enthalten: \u200eNein\nAnzahl der Lithium-Ionen-Zellen: \u200e1\nAnzahl der Lithium-Metall-Zellen: \u200e1\nArtikelgewicht: \u200e12,3 Kilograms\nGarantierte Software-Updates bis: \u200eunbekannt\nASIN: B09WHVLB3J\nDurchschnittliche Kundenbewertung: 3,6  3,6 von 5 Sternen    \n    12 Sternebewertungen   \n\n\n 3,6 von 5 Sternen\nAmazon Bestseller-Rang: Nr. 104,496 in Computer & Zubeh\u00f6r (Siehe Top 100 in Computer & Zubeh\u00f6r)  Nr. 1,862 in Monitore\nIm Angebot von Amazon.de seit: 29. M\u00e4rz 2022",
    "reference_file": "offer_reference_886.json",
    "shop_name": "Amazon.at"
}