{
    "html_file": "offer_753_3.html",
    "name": "Dell Alienware AW2523HF, 24.5\"",
    "offer_link": "https://www.amazon.de/dp/B0BF5SJFN8?linkCode=xm2&camp=2025&creative=165953&smid=A3JWKAKR8XB7XF&creativeASIN=B0BF5SJFN8&tag=geizhals1-21",
    "price": 371.24,
    "raw_specifications": {
        "ASIN": "B0BF5SJFN8",
        "Amazon Bestseller-Rang": "Nr. 14,344 in Computer & Zubeh\u00f6r (Siehe Top 100 in Computer & Zubeh\u00f6r)  Nr. 308 in Monitore",
        "Artikelgewicht": "\u200e5,77 Kilograms",
        "Batterien enthalten": "\u200eNein",
        "Bildschirmaufl\u00f6sung": "\u200e1920x1080",
        "Display-Gr\u00f6\u00dfe": "\u200e24,5 Zoll",
        "Durchschnittliche Kundenbewertung": "4,5  4,5 von 5 Sternen    \n    157 Sternebewertungen   \n\n\n 4,5 von 5 Sternen",
        "Farbe": "\u200eDark Side of the Moon",
        "Garantierte Software-Updates bis": "\u200eunbekannt",
        "Hersteller": "\u200eAlienware",
        "Im Angebot von Amazon.de seit": "28. September 2022",
        "L\u00f6sung": "\u200e1920 x 1080 Pixels",
        "Marke": "\u200eAlienware",
        "Modell/Serie": "\u200eAlienware 25 Gaming Monitor - AW2523HF",
        "Modellnummer": "\u200eAW2523HF",
        "Produktabmessungen": "\u200e55,63 x 24,38 x 50,04 cm; 5,77 Kilogramm",
        "Volt": "\u200e240 Volt (Wechselstrom)"
    },
    "raw_specifications_text": "Marke: \u200eAlienware\nHersteller: \u200eAlienware\nModell/Serie: \u200eAlienware 25 Gaming Monitor - AW2523HF\nProduktabmessungen: \u200e55,63 x 24,38 x 50,04 cm; 5,77 Kilogramm\nModellnummer: \u200eAW2523HF\nFarbe: \u200eDark Side of the Moon\nDisplay-Gr\u00f6\u00dfe: \u200e24,5 Zoll\nBildschirmaufl\u00f6sung: \u200e1920x1080\nL\u00f6sung: \u200e1920 x 1080 Pixels\nVolt: \u200e240 Volt (Wechselstrom)\nBatterien enthalten: \u200eNein\nArtikelgewicht: \u200e5,77 Kilograms\nGarantierte Software-Updates bis: \u200eunbekannt\nASIN: B0BF5SJFN8\nDurchschnittliche Kundenbewertung: 4,5  4,5 von 5 Sternen    \n    157 Sternebewertungen   \n\n\n 4,5 von 5 Sternen\nAmazon Bestseller-Rang: Nr. 14,344 in Computer & Zubeh\u00f6r (Siehe Top 100 in Computer & Zubeh\u00f6r)  Nr. 308 in Monitore\nIm Angebot von Amazon.de seit: 28. September 2022",
    "reference_file": "offer_reference_753.json",
    "shop_name": "Amazon.at"
}