{
    "html_file": "offer_1344_3.html",
    "name": "ASUS VP32UQ, 31.5\"",
    "offer_link": "https://www.e-tec.at/details.php?artnr=321497",
    "price": 487.4,
    "raw_specifications": {
        "Abmessungen (BxHxT)": "714.6x485.7x201.8mm (mit Standfu\u00df),  714.6x423.7x50.4mm (ohne Standfu\u00df)",
        "Adaptive Sync": "Ja",
        "Anschl\u00fcsse - DisplayPort 1.2": "1",
        "Anschl\u00fcsse - HDMI 2.0": "1",
        "Anwendung": "station\u00e4r",
        "Audio": "Lautsprecher (2x 2W),  1x Line-Out",
        "Aufl\u00f6sung": "3840x2160",
        "Beschichtung": "matt (non-glare)",
        "Besonderheiten": "Slim Bezel,  Steuerkreuz,  Sicherheitsschloss (Kensington),  HDCP 2.2",
        "Bildwiederholfrequenz": "60Hz",
        "Blickwinkel": "178\u00b0/178\u00b0",
        "Diagonale": "31.5\"/80cm",
        "Energieeffizienzklasse HDR (A bis G)": "G",
        "Energieverbrauch HDR": "52kWh/1000h",
        "Energieverbrauch SDR": "39kWh/1000h",
        "Ergonomie": "N/A (h\u00f6henverstellbar),  N/A (Pivot),  N/A (drehbar),  +8\u00b0/-5\u00b0 (neigbar),  keine Angabe (Schr\u00e4glage)",
        "FRC": "ja (8bit+2bit)",
        "Farbe": "schwarz",
        "Farbraum - sRGB": "100%",
        "Farbtiefe": "10bit (1.07 Mrd. Farben)",
        "Form": "gerade (flat)",
        "Gewicht": "7.82kg (mit Standfu\u00df),  6.20kg (ohne Standfu\u00df)",
        "HDR": "HDR10",
        "Helligkeit": "350cd/m\u00b2",
        "Herstellergarantie": "drei Jahre",
        "Hintergrundbeleuchtung": "White-LED,  flicker-free,  Blaulichtfilter",
        "Kontrast - dynamisch": "100.000.000:1",
        "Kontrast - statisch": "1.000:1",
        "Lautsprecher": "Ja",
        "Leistungsaufnahme": "keine Angabe (maximal),  32W (typisch),  keine Angabe (Energielabel alt A+++ bis G),  0.3W (Standby)",
        "Panel": "IPS",
        "Reaktionszeit - GtG": "4ms",
        "Screen-to-Body-Ratio": "90.3% (berechnet)",
        "Seitenverh\u00e4ltnis": "16:9",
        "Signalfrequenz": "31-133kHz (horizontal),  48-60Hz (vertikal)",
        "Stromversorgung": "AC-In (internes Netzteil)",
        "USB-Hub In": "N/A",
        "USB-Hub Out": "N/A",
        "USB-Schreibweise": "Link",
        "VESA": "100x100 (frei)",
        "VRR (Variable Refresh Rate)": "Adaptive Sync",
        "Weitere Anschl\u00fcsse": "N/A"
    },
    "raw_specifications_text": "Abmessungen (BxHxT): 714.6x485.7x201.8mm (mit Standfu\u00df),  714.6x423.7x50.4mm (ohne Standfu\u00df)\nAdaptive Sync: Ja\nAnschl\u00fcsse - DisplayPort 1.2: 1\nAnschl\u00fcsse - HDMI 2.0: 1\nAnwendung: station\u00e4r\nAudio: Lautsprecher (2x 2W),  1x Line-Out\nAufl\u00f6sung: 3840x2160\nBeschichtung: matt (non-glare)\nBesonderheiten: Slim Bezel,  Steuerkreuz,  Sicherheitsschloss (Kensington),  HDCP 2.2\nBildwiederholfrequenz: 60Hz\nBlickwinkel: 178\u00b0/178\u00b0\nDiagonale: 31.5\"/80cm\nEnergieeffizienzklasse HDR (A bis G): G\nEnergieverbrauch HDR: 52kWh/1000h\nEnergieverbrauch SDR: 39kWh/1000h\nErgonomie: N/A (h\u00f6henverstellbar),  N/A (Pivot),  N/A (drehbar),  +8\u00b0/-5\u00b0 (neigbar),  keine Angabe (Schr\u00e4glage)\nFarbe: schwarz\nFarbraum - sRGB: 100%\nFarbtiefe: 10bit (1.07 Mrd. Farben)\nForm: gerade (flat)\nFRC: ja (8bit+2bit)\nGewicht: 7.82kg (mit Standfu\u00df),  6.20kg (ohne Standfu\u00df)\nHDR: HDR10\nHelligkeit: 350cd/m\u00b2\nHerstellergarantie: drei Jahre\nHintergrundbeleuchtung: White-LED,  flicker-free,  Blaulichtfilter\nKontrast - dynamisch: 100.000.000:1\nKontrast - statisch: 1.000:1\nLautsprecher: Ja\nLeistungsaufnahme: keine Angabe (maximal),  32W (typisch),  keine Angabe (Energielabel alt A+++ bis G),  0.3W (Standby)\nPanel: IPS\nReaktionszeit - GtG: 4ms\nScreen-to-Body-Ratio: 90.3% (berechnet)\nSeitenverh\u00e4ltnis: 16:9\nSignalfrequenz: 31-133kHz (horizontal),  48-60Hz (vertikal)\nStromversorgung: AC-In (internes Netzteil)\nUSB-Hub In: N/A\nUSB-Hub Out: N/A\nUSB-Schreibweise: Link\nVESA: 100x100 (frei)\nVRR (Variable Refresh Rate): Adaptive Sync\nWeitere Anschl\u00fcsse: N/A",
    "reference_file": "offer_reference_1344.json",
    "shop_name": "e-tec.at"
}