{
    "html_file": "offer_960_5.html",
    "name": "iiyama G-Master G2450HSU-B1 Black Hawk, 23.8\"",
    "offer_link": "https://www.proshop.at/Bildschirm/iiyama-24-Bildschirm-G-MASTER-Black-Hawk-FHD-75Hz-USB-Hub-Speakers-Black-1-ms-AMD-FreeSync/3070689?utm_source=geizhals&utm_medium=cpc&utm_campaign=pricesite",
    "price": 148.58,
    "raw_specifications": {
        "Abmessungen (Breite x Tiefe x H\u00f6he)": "53.9 cm x 20.2 cm x 39.3 cm",
        "Adaptive-Sync Technologie": "AMD FreeSync",
        "Ausgangsleistung/Kanal": "2 Watt",
        "Besonderheiten": "HDCP, flimmerfreie Technologie, Black Tuner, Blue Light Reducer Function",
        "Bildschirmbeschichtung": "Matt",
        "Bildschirmtyp": "VA",
        "Diagonalabmessung": "61 cm (24\")",
        "Display-Typ": "LED-hintergrundbeleuchteter LCD-Monitor / TFT-Aktivmatrix",
        "EAN": "4948570119202",
        "Eingangsanschl\u00fcsse": "HDMI, DisplayPort",
        "Eingangsspannung": "Wechselstrom 120/230 V (50/60 Hz)",
        "Einstellungen der Anzeigeposition": "Neigung",
        "Energie Effizienzklasse": "Klasse E",
        "Enthaltene Kabel": "1 x USB-Kabel  1 x HDMI-Kabel",
        "Farbe": "Mattschwarz",
        "Farbunterst\u00fctzung": "16,7 Millionen Farben",
        "Ger\u00e4tetyp": "LED-hintergrundbeleuchteter LCD-Monitor - 61 cm (24\")",
        "Gewicht": "3.7 kg",
        "Helligkeit": "250 cd/m\u00b2",
        "Hersteller": "iiyama",
        "Hintergrundbeleuchtungs-Technologie": "LED-Hintergrundbeleuchtung",
        "Horizontale Bildwiederholrate": "31 - 85 kHz",
        "Horizontaler Betrachtungswinkel": "+89 / -89",
        "Integrierte Peripherieger\u00e4te": "USB 2.0 Hub",
        "Kennzeichnung": "RoHS, WEEE, REACH, ERP, EAC, T\u00dcV safety certification",
        "Kontrast": "3000:1 / 80000000:1 (dynamisch)",
        "Leistungsaufnahme im Ein-Zustand": "19 W",
        "Leistungsmerkmale": "Slot f\u00fcr Sicherheitsschloss (Kabelschloss getrennt erh\u00e4ltlich), integrierte Kabelf\u00fchrung",
        "Modell": "G2450HSU-B1",
        "Native Aufl\u00f6sung": "Full HD (1080p) 1920 x 1080 bei 75 Hz",
        "Neigungswinkel": "-4/+22",
        "OSD-Sprachen": "Tschechisch, Englisch, Deutsch, Franz\u00f6sisch, Italienisch, Polnisch, Russisch, Spanisch, Holl\u00e4ndisch, Japanisch",
        "Pixelpitch": "0.274 mm",
        "Produktbeschreibung": "iiyama G-MASTER Black Hawk G2450HSU-B1 - LED-Monitor - Full HD (1080p) - 61 cm (24\")",
        "Reaktionszeit": "1 ms (MPRT)",
        "Schlosstyp zur Diebstahlsicherung": "Kensington Slot",
        "Schnittstellen": "DisplayPort 1.2  HDMI  Kopfh\u00f6rer (Mini-Klinkenstecker)  2 x USB 2.0 (Typ A)  USB 2.0 (Typ B)",
        "Seitenverh\u00e4ltnis": "16:9",
        "Sichtbare Bildfl\u00e4che": "60.5 cm (23.8\")",
        "Spannung": "Wechselstrom 120/230 V (50/60 Hz)",
        "Stromverbrauch (Aus-Modus)": "0.3 Watt",
        "Stromverbrauch (typisch)": "18 Watt",
        "Stromverbrauch SDR (eingeschaltet)": "19 kWh/1.000 h",
        "Stromverbrauch im Standby-Modus": "0.5 Watt",
        "Transportbreite": "60.6 cm",
        "Transportgewicht": "5.1 kg",
        "Transporth\u00f6he": "40 cm",
        "Transporttiefe": "13.7 cm",
        "Typ": "Lautsprecher - Stereo",
        "Umweltschutzstandards": "ENERGY STAR-qualifiziert",
        "VESA-Halterung": "100 x 100 mm",
        "Vertikaler Betrachtungswinkel": "+89 / -89",
        "Waren-Nr.": "3070689",
        "Zum Hersteller": "www.iiyama.com"
    },
    "raw_specifications_text": "Hersteller: iiyama\nWaren-Nr.: 3070689\nModell: G2450HSU-B1\nEAN: 4948570119202\nZum Hersteller: www.iiyama.com\nProduktbeschreibung: iiyama G-MASTER Black Hawk G2450HSU-B1 - LED-Monitor - Full HD (1080p) - 61 cm (24\")\nGer\u00e4tetyp: LED-hintergrundbeleuchteter LCD-Monitor - 61 cm (24\")\nEnergie Effizienzklasse: Klasse E\nLeistungsaufnahme im Ein-Zustand: 19 W\nAdaptive-Sync Technologie: AMD FreeSync\nLeistungsmerkmale: Slot f\u00fcr Sicherheitsschloss (Kabelschloss getrennt erh\u00e4ltlich), integrierte Kabelf\u00fchrung\nBildschirmtyp: VA\nSeitenverh\u00e4ltnis: 16:9\nNative Aufl\u00f6sung: Full HD (1080p) 1920 x 1080 bei 75 Hz\nPixelpitch: 0.274 mm\nHelligkeit: 250 cd/m\u00b2\nKontrast: 3000:1 / 80000000:1 (dynamisch)\nReaktionszeit: 1 ms (MPRT)\nFarbunterst\u00fctzung: 16,7 Millionen Farben\nEingangsanschl\u00fcsse: HDMI, DisplayPort\nEinstellungen der Anzeigeposition: Neigung\nBildschirmbeschichtung: Matt\nSpannung: Wechselstrom 120/230 V (50/60 Hz)\nFarbe: Mattschwarz\nAbmessungen (Breite x Tiefe x H\u00f6he): 53.9 cm x 20.2 cm x 39.3 cm\nGewicht: 3.7 kg\nUmweltschutzstandards: ENERGY STAR-qualifiziert\nKennzeichnung: RoHS, WEEE, REACH, ERP, EAC, T\u00dcV safety certification\nDisplay-Typ: LED-hintergrundbeleuchteter LCD-Monitor / TFT-Aktivmatrix\nDiagonalabmessung: 61 cm (24\")\nSichtbare Bildfl\u00e4che: 60.5 cm (23.8\")\nIntegrierte Peripherieger\u00e4te: USB 2.0 Hub\nHorizontale Bildwiederholrate: 31 - 85 kHz\nHorizontaler Betrachtungswinkel: +89 / -89\nVertikaler Betrachtungswinkel: +89 / -89\nHintergrundbeleuchtungs-Technologie: LED-Hintergrundbeleuchtung\nOSD-Sprachen: Tschechisch, Englisch, Deutsch, Franz\u00f6sisch, Italienisch, Polnisch, Russisch, Spanisch, Holl\u00e4ndisch, Japanisch\nBesonderheiten: HDCP, flimmerfreie Technologie, Black Tuner, Blue Light Reducer Function\nTyp: Lautsprecher - Stereo\nAusgangsleistung/Kanal: 2 Watt\nSchnittstellen: DisplayPort 1.2  HDMI  Kopfh\u00f6rer (Mini-Klinkenstecker)  2 x USB 2.0 (Typ A)  USB 2.0 (Typ B)\nNeigungswinkel: -4/+22\nVESA-Halterung: 100 x 100 mm\nEnthaltene Kabel: 1 x USB-Kabel  1 x HDMI-Kabel\nSchlosstyp zur Diebstahlsicherung: Kensington Slot\nEingangsspannung: Wechselstrom 120/230 V (50/60 Hz)\nStromverbrauch SDR (eingeschaltet): 19 kWh/1.000 h\nStromverbrauch (typisch): 18 Watt\nStromverbrauch im Standby-Modus: 0.5 Watt\nStromverbrauch (Aus-Modus): 0.3 Watt\nTransportbreite: 60.6 cm\nTransporttiefe: 13.7 cm\nTransporth\u00f6he: 40 cm\nTransportgewicht: 5.1 kg",
    "reference_file": "offer_reference_960.json",
    "shop_name": "Proshop.at"
}