{
    "html_file": "offer_1160_34.html",
    "name": "BenQ Mobiuz EX3410R, 34\"",
    "offer_link": "https://technikladen.at/P-9HLKKLATBE-BenQ-34-L-MOBIUZ-EX3410R-9HLKKLATBE-Displays-Projektoren?tl=gzhls",
    "price": 603.54,
    "raw_specifications": {
        "AC Eingangsspannung": "100 - 240 V",
        "AMD FreeSync": "Ja",
        "AMD FreeSync-Typ": "FreeSync Premium Pro",
        "Anzahl DisplayPort Anschl\u00fcsse": "1",
        "Anzahl HDMI-Anschl\u00fcsse": "2",
        "Anzahl der Farben des Displays": "16,7 Millionen Farben",
        "Anzahl der Lautsprecher": "2",
        "Anzahl der nachgeschalteten Steckpl\u00e4tze vom Typ USB-A": "2",
        "Anzahl der vorgeschalteten Steckpl\u00e4tze": "1",
        "Bewertung der Bildschirmkr\u00fcmmung": "1000R",
        "Bild-in-Bild": "Ja",
        "Bildschirmaufl\u00f6sung": "3440 x 1440 Pixel",
        "Bildschirmdiagonale": "86,4 cm",
        "Bildschirmform": "Geschwungen",
        "Bildschirmtechnologie": "LED",
        "Blendfreier Bildschirm": "Ja",
        "Blickwinkel, horizontal": "178 \u00b0",
        "Blickwinkel, vertikal": "178 \u00b0",
        "Breite (ohne Standfu\u00df)": "79,6 cm",
        "DisplayPorts-Version": "1.4",
        "Eingebaute Lautsprecher": "Ja",
        "Farbskala": "90 %",
        "Fernbedienung enthalten": "Ja",
        "Flimmerfreie Technologie": "Ja",
        "Fu\u00dffarbe": "Schwarz/Rot",
        "Ger\u00e4tebreite (inkl. Fu\u00df)": "795,7 mm",
        "Ger\u00e4teh\u00f6he (inkl. Fu\u00df)": "530,8 mm",
        "Ger\u00e4tetiefe (inkl. Fu\u00df)": "269,7 mm",
        "Gewicht (mit St\u00e4nder)": "9,85 kg",
        "Gewicht (ohne St\u00e4nder)": "6,94 kg",
        "HD-Typ": "Wide Quad HD",
        "HDCP": "Ja",
        "HDMI": "Ja",
        "HDMI-Version": "2.0",
        "Helligkeit (typisch)": "350 cd/m\u00b2",
        "High Dynamic Range Video Unterst\u00fctzung": "Ja",
        "H\u00f6he (ohne Standfu\u00df)": "38 cm",
        "H\u00f6heneinstellung": "10 cm",
        "H\u00f6henverstellung": "Ja",
        "Integrierte Kamera": "Nein",
        "Integrierter USB-Hub": "Ja",
        "Kontrastverh\u00e4ltnis": "3000:1",
        "Kopfh\u00f6rerausgang": "Ja",
        "Kopfh\u00f6rerausg\u00e4nge": "1",
        "Low-Blue-Light-Technologie": "Ja",
        "Marktpositionierung": "Gaming",
        "Maximale Bildwiederholrate": "144 Hz",
        "Mitgelieferte Kabel": "AC, DisplayPort, HDMI",
        "NVIDIA G-SYNC": "Nein",
        "Natives Seitenverh\u00e4ltnis": "21:9",
        "Neigungswinkelbereich": "-5 - 15 \u00b0",
        "Panel-Montage-Schnittstelle": "100 x 100 mm",
        "Panel-Typ": "VA",
        "Pixeldichte": "110 ppi",
        "Produktfarbe": "Schwarz",
        "RGB-Farbraum": "DCI-P3",
        "RMS-Leistung": "9 W",
        "Reaktionszeit": "1 ms",
        "Schnellstart\u00fcbersicht": "Ja",
        "Schwenkbar": "Ja",
        "Schwenkwinkelbereich": "-15 - 15 \u00b0",
        "Stromverbrauch (Standardbetrieb)": "30,3 W",
        "Stromverbrauch (Standby)": "0,5 W",
        "Stromverbrauch (max.)": "88 W",
        "Technologie mit hohem Dynamikbereich (HDR)": "DisplayHDR 400,High Dynamic Range 10 (HDR10)",
        "Tiefe (ohne Standfu\u00df)": "15 cm",
        "USB-Hub-Version": "3.2 Gen 1 (3.1 Gen 1)",
        "USB-Upstream-Porttyp": "USB Typ-B",
        "VESA-Halterung": "Ja",
        "kippbar": "Ja"
    },
    "raw_specifications_text": "NVIDIA G-SYNC: Nein\nAMD FreeSync: Ja\nAMD FreeSync-Typ: FreeSync Premium Pro\nFlimmerfreie Technologie: Ja\nLow-Blue-Light-Technologie: Ja\nBildschirmdiagonale: 86,4 cm\nBildschirmaufl\u00f6sung: 3440 x 1440 Pixel\nNatives Seitenverh\u00e4ltnis: 21:9\nPanel-Typ: VA\nHelligkeit (typisch): 350 cd/m\u00b2\nReaktionszeit: 1 ms\nHD-Typ: Wide Quad HD\nBildschirmtechnologie: LED\nBlendfreier Bildschirm: Ja\nBildschirmform: Geschwungen\nBewertung der Bildschirmkr\u00fcmmung: 1000R\nKontrastverh\u00e4ltnis: 3000:1\nMaximale Bildwiederholrate: 144 Hz\nBlickwinkel, horizontal: 178 \u00b0\nBlickwinkel, vertikal: 178 \u00b0\nAnzahl der Farben des Displays: 16,7 Millionen Farben\nPixeldichte: 110 ppi\nHigh Dynamic Range Video Unterst\u00fctzung: Ja\nTechnologie mit hohem Dynamikbereich (HDR): DisplayHDR 400,High Dynamic Range 10 (HDR10)\nRGB-Farbraum: DCI-P3\nFarbskala: 90 %\nIntegrierter USB-Hub: Ja\nUSB-Hub-Version: 3.2 Gen 1 (3.1 Gen 1)\nUSB-Upstream-Porttyp: USB Typ-B\nAnzahl der vorgeschalteten Steckpl\u00e4tze: 1\nAnzahl der nachgeschalteten Steckpl\u00e4tze vom Typ USB-A: 2\nHDMI: Ja\nAnzahl HDMI-Anschl\u00fcsse: 2\nHDMI-Version: 2.0\nAnzahl DisplayPort Anschl\u00fcsse: 1\nDisplayPorts-Version: 1.4\nKopfh\u00f6rerausgang: Ja\nKopfh\u00f6rerausg\u00e4nge: 1\nHDCP: Ja\nVESA-Halterung: Ja\nPanel-Montage-Schnittstelle: 100 x 100 mm\nH\u00f6henverstellung: Ja\nH\u00f6heneinstellung: 10 cm\nSchwenkbar: Ja\nSchwenkwinkelbereich: -15 - 15 \u00b0\nkippbar: Ja\nNeigungswinkelbereich: -5 - 15 \u00b0\nBild-in-Bild: Ja\nEingebaute Lautsprecher: Ja\nIntegrierte Kamera: Nein\nAnzahl der Lautsprecher: 2\nRMS-Leistung: 9 W\nMarktpositionierung: Gaming\nProduktfarbe: Schwarz\nFu\u00dffarbe: Schwarz/Rot\nMitgelieferte Kabel: AC, DisplayPort, HDMI\nSchnellstart\u00fcbersicht: Ja\nFernbedienung enthalten: Ja\nStromverbrauch (Standardbetrieb): 30,3 W\nStromverbrauch (Standby): 0,5 W\nStromverbrauch (max.): 88 W\nAC Eingangsspannung: 100 - 240 V\nGer\u00e4tebreite (inkl. Fu\u00df): 795,7 mm\nGer\u00e4tetiefe (inkl. Fu\u00df): 269,7 mm\nGer\u00e4teh\u00f6he (inkl. Fu\u00df): 530,8 mm\nGewicht (mit St\u00e4nder): 9,85 kg\nBreite (ohne Standfu\u00df): 79,6 cm\nTiefe (ohne Standfu\u00df): 15 cm\nH\u00f6he (ohne Standfu\u00df): 38 cm\nGewicht (ohne St\u00e4nder): 6,94 kg",
    "reference_file": "offer_reference_1160.json",
    "shop_name": "TechnikLaden"
}