{
    "html_file": "offer_592_1.html",
    "name": "Philips 5000 Series 40B1U5601H, 39.53\"",
    "offer_link": "https://www.proshop.at/Bildschirm/Philips-40-Bildschirm-40B1U5601H-5000-Series-LED-monitor-40-HDR-Black-4-ms/3143061?utm_source=geizhals&utm_medium=cpc&utm_campaign=pricesite",
    "price": 647.96,
    "raw_specifications": {
        "Abmessungen (Breite x Tiefe x H\u00f6he)": "94.4 cm x 28 cm x 62.8 cm - mit Standfu\u00df (h\u00f6chste Position)",
        "Abmessungen (Breite x Tiefe x H\u00f6he) - mit Standfu\u00df (h\u00f6chste Position)": "94.4 cm x 28 cm x 62.8 cm",
        "Audioeingang": "Mikrofon",
        "Ausgangsleistung/Kanal": "5 Watt",
        "Besonderheiten": "Bild in Bild, Bild f\u00fcr Bild, PowerSensor, MultiView, SmartImage, flimmerfreie Technologie, sRGB Color Space, LightSensor, EasyRead, Monitorkalibrierung Delta E<2, an 3 Seiten ohne Blende, High Bit Rate 3 (HBR3), LowBlue Mode, MultiClient KVM, Kopfh\u00f6rer-Haken, SmartUniformity 93 - 105 %",
        "Bildschirmbeschichtung": "Blendfrei, 3H Hard Coating, Haze 25 %",
        "Bildschirmtyp": "IPS",
        "Daisy-Chaining": "Ja",
        "Details zu Abmessungen & Gewicht": "Mit Standfu\u00df (h\u00f6chste Position) - Breite: 94.4 cm - Tiefe: 28 cm - H\u00f6he: 62.8 cm - Gewicht: 14.12 kg  Ohne Fu\u00df - Breite: 94.4 cm - Tiefe: 5.4 cm - H\u00f6he: 41.9 cm - Gewicht: 9.9 kg",
        "Diagonalabmessung": "101.6 cm (40\")",
        "Display-Typ": "LED-hintergrundbeleuchteter LCD-Monitor / TFT-Aktivmatrix",
        "EAN": "8712581797492",
        "ENERGY STAR zertifiziert": "Ja",
        "ENERGY STAR-Version": "8.0",
        "Ein-/Aus-Schalter": "Ja",
        "Eingangsanschl\u00fcsse": "HDMI, DisplayPort, 2xUSB-C",
        "Eingangsspannung": "Wechselstrom 100-240 V (50/60 Hz)",
        "Einstellungen der Anzeigeposition": "H\u00f6he, Drehung, Neigung",
        "Energie Effizienzklasse": "Klasse G",
        "Energieklasse (HDR)": "Klasse G",
        "Enthaltene Kabel": "HDMI-Kabel  DisplayPort-Kabel  Kabel USB-C auf USB-C / USB-A",
        "Ethernet integriert": "Ja",
        "Farbe": "Schwarz",
        "Farbraum": "102% NTSC (CIE 1976), 121% sRGB (CIE 1931)",
        "Farbunterst\u00fctzung": "16,7 Millionen Farben (8-Bit)",
        "Ger\u00e4tetyp": "LED-hintergrundbeleuchteter LCD-Monitor - 101.6 cm (40\")",
        "Gewicht": "14.12 kg",
        "HDR-Format": "HDR10",
        "HDR-f\u00e4hig": "HDR10",
        "Helligkeit": "300 cd/m\u00b2",
        "Hersteller": "Philips",
        "Hintergrundbeleuchtungs-Technologie": "WLED",
        "Horizontale Bildwiederholrate": "30 - 190 kHz",
        "Horizontaler Betrachtungswinkel": "178",
        "H\u00f6heneinstellung": "150 mm",
        "Integrierte Peripherieger\u00e4te": "KVM-Switch, Gigabit Ethernet-Netzwerkadapter, USB 3.2 Gen 2 hub, Webcam",
        "Integrierte Webcam": "5 Megapixel",
        "Kennzeichnung": "Plug and Play, FCC Klasse B bescheinigt, TUV GS, ICES-003, SEMKO, CB, TUV Ergo, DDC/CI, cETLus, CU-EAC, BFR-frei, HDCP 2.2, HDCP 1.4, USB Power Delivery 3.0, PVC-free, quecksilberfrei, EAEU RoHS",
        "Kontrast": "1200:1 / 50000000:1 (dynamisch)",
        "Leistungsaufnahme im Ein-Zustand": "40.2 W",
        "Leistungsmerkmale": "Slot f\u00fcr Sicherheitsschloss (Kabelschloss getrennt erh\u00e4ltlich), strukturierte Oberfl\u00e4che",
        "MTBF": "70,000 Stunde(n)",
        "Mikrofonfunktionen": "Ger\u00e4uschunterdr\u00fcckung",
        "Mitgelieferte Software": "Philips SmartControl",
        "Modell": "40B1U5601H/00",
        "Native Aufl\u00f6sung": "UWQHD 3440 x 1440 (DisplayPort: 120 Hz, HDMI: 100 Hz, USB-C: 120 Hz)",
        "Neigungswinkel": "-5/+30",
        "OSD-Sprachen": "Multilingual",
        "Pixelpitch": "0.26925 mm",
        "Ppi": "94",
        "Produktbeschreibung": "Philips 40B1U5601H - 5000 Series - LED-Monitor - 101.6 cm (40\") - HDR",
        "Reaktionszeit": "4 ms (gray-to-gray)",
        "Schlosstyp zur Diebstahlsicherung": "Kensington Slot",
        "Schnittstellen": "DisplayPort 1.4 (HDCP 1.4, HDCP 2.2)  HDMI 2.0 (HDCP 1.4, HDCP 2.2)  2 x USB-C Upstream (HDCP 1,4, HDCP 2,2, DisplayPort Alt Mode, Spannung bis 100 W)  USB-C 3.2 Gen 2 Downstream (Daten, bis zu 15 W)  3 x USB 3.2 Gen 2 Downstream  USB 3.2 Gen 2 Downstream (BC 1.2)  Audio Line-In/-Out (Mini-Klinkenstecker)  LAN (RJ-45)  DisplayPort-Ausgang (HDCP 1.4, HDCP 2.2)",
        "Schwenkwinkel": "360",
        "Seitenverh\u00e4ltnis": "21:9",
        "Sensoraufl\u00f6sung": "5 Megapixel",
        "Sichtbare Bildfl\u00e4che": "100.4 cm (39.53\")",
        "Spannung": "Wechselstrom 100-240 V (50/60 Hz)",
        "Stromverbrauch HDR (eingeschaltet)": "60 kWh/1.000 h",
        "Stromverbrauch SDR (eingeschaltet)": "41 kWh/1.000 h",
        "Stromverbrauch im Standby-Modus": "0.4 Watt",
        "TCO-zertifiziert": "TCO Certified Edge Displays, TCO Certified Displays 9",
        "Transportbreite": "107 cm",
        "Transportgewicht": "17.83 kg",
        "Transporth\u00f6he": "50.7 cm",
        "Transporttiefe": "22.6 cm",
        "Typ": "Lautsprecher - Stereo",
        "USB-Spannungsversorgung": "100 Watt",
        "Umweltschutzstandards": "TCO Certified Edge Displays, TCO Certified Displays 9, ENERGY STAR-qualifiziert",
        "VESA-Halterung": "100 x 100 mm",
        "Vertikale Bildwiederholrate": "48 - 120 Hz",
        "Vertikaler Betrachtungswinkel": "178",
        "Waren-Nr.": "3143061",
        "Zum Hersteller": "www.philips.com"
    },
    "raw_specifications_text": "Hersteller: Philips\nWaren-Nr.: 3143061\nModell: 40B1U5601H/00\nEAN: 8712581797492\nZum Hersteller: www.philips.com\nProduktbeschreibung: Philips 40B1U5601H - 5000 Series - LED-Monitor - 101.6 cm (40\") - HDR\nGer\u00e4tetyp: LED-hintergrundbeleuchteter LCD-Monitor - 101.6 cm (40\")\nEnergie Effizienzklasse: Klasse G\nLeistungsaufnahme im Ein-Zustand: 40.2 W\nDaisy-Chaining: Ja\nLeistungsmerkmale: Slot f\u00fcr Sicherheitsschloss (Kabelschloss getrennt erh\u00e4ltlich), strukturierte Oberfl\u00e4che\nBildschirmtyp: IPS\nSeitenverh\u00e4ltnis: 21:9\nNative Aufl\u00f6sung: UWQHD 3440 x 1440 (DisplayPort: 120 Hz, HDMI: 100 Hz, USB-C: 120 Hz)\nPixelpitch: 0.26925 mm\nHelligkeit: 300 cd/m\u00b2\nKontrast: 1200:1 / 50000000:1 (dynamisch)\nHDR-f\u00e4hig: HDR10\nReaktionszeit: 4 ms (gray-to-gray)\nFarbunterst\u00fctzung: 16,7 Millionen Farben (8-Bit)\nFarbraum: 102% NTSC (CIE 1976), 121% sRGB (CIE 1931)\nEingangsanschl\u00fcsse: HDMI, DisplayPort, 2xUSB-C\nEthernet integriert: Ja\nAudioeingang: Mikrofon\nIntegrierte Webcam: 5 Megapixel\nEinstellungen der Anzeigeposition: H\u00f6he, Drehung, Neigung\nBildschirmbeschichtung: Blendfrei, 3H Hard Coating, Haze 25 %\nSpannung: Wechselstrom 100-240 V (50/60 Hz)\nFarbe: Schwarz\nAbmessungen (Breite x Tiefe x H\u00f6he) - mit Standfu\u00df (h\u00f6chste Position): 94.4 cm x 28 cm x 62.8 cm\nGewicht: 14.12 kg\nUmweltschutzstandards: TCO Certified Edge Displays, TCO Certified Displays 9, ENERGY STAR-qualifiziert\nKennzeichnung: Plug and Play, FCC Klasse B bescheinigt, TUV GS, ICES-003, SEMKO, CB, TUV Ergo, DDC/CI, cETLus, CU-EAC, BFR-frei, HDCP 2.2, HDCP 1.4, USB Power Delivery 3.0, PVC-free, quecksilberfrei, EAEU RoHS\nDisplay-Typ: LED-hintergrundbeleuchteter LCD-Monitor / TFT-Aktivmatrix\nEnergieklasse (HDR): Klasse G\nDiagonalabmessung: 101.6 cm (40\")\nSichtbare Bildfl\u00e4che: 100.4 cm (39.53\")\nIntegrierte Peripherieger\u00e4te: KVM-Switch, Gigabit Ethernet-Netzwerkadapter, USB 3.2 Gen 2 hub, Webcam\nUSB-Spannungsversorgung: 100 Watt\nPpi: 94\nHDR-Format: HDR10\nVertikale Bildwiederholrate: 48 - 120 Hz\nHorizontale Bildwiederholrate: 30 - 190 kHz\nHorizontaler Betrachtungswinkel: 178\nVertikaler Betrachtungswinkel: 178\nHintergrundbeleuchtungs-Technologie: WLED\nOSD-Sprachen: Multilingual\nBesonderheiten: Bild in Bild, Bild f\u00fcr Bild, PowerSensor, MultiView, SmartImage, flimmerfreie Technologie, sRGB Color Space, LightSensor, EasyRead, Monitorkalibrierung Delta E<2, an 3 Seiten ohne Blende, High Bit Rate 3 (HBR3), LowBlue Mode, MultiClient KVM, Kopfh\u00f6rer-Haken, SmartUniformity 93 - 105 %\nAbmessungen (Breite x Tiefe x H\u00f6he): 94.4 cm x 28 cm x 62.8 cm - mit Standfu\u00df (h\u00f6chste Position)\nSensoraufl\u00f6sung: 5 Megapixel\nTyp: Lautsprecher - Stereo\nMikrofonfunktionen: Ger\u00e4uschunterdr\u00fcckung\nAusgangsleistung/Kanal: 5 Watt\nSchnittstellen: DisplayPort 1.4 (HDCP 1.4, HDCP 2.2)  HDMI 2.0 (HDCP 1.4, HDCP 2.2)  2 x USB-C Upstream (HDCP 1,4, HDCP 2,2, DisplayPort Alt Mode, Spannung bis 100 W)  USB-C 3.2 Gen 2 Downstream (Daten, bis zu 15 W)  3 x USB 3.2 Gen 2 Downstream  USB 3.2 Gen 2 Downstream (BC 1.2)  Audio Line-In/-Out (Mini-Klinkenstecker)  LAN (RJ-45)  DisplayPort-Ausgang (HDCP 1.4, HDCP 2.2)\nNeigungswinkel: -5/+30\nSchwenkwinkel: 360\nH\u00f6heneinstellung: 150 mm\nVESA-Halterung: 100 x 100 mm\nEnthaltene Kabel: HDMI-Kabel  DisplayPort-Kabel  Kabel USB-C auf USB-C / USB-A\nMTBF: 70,000 Stunde(n)\nSchlosstyp zur Diebstahlsicherung: Kensington Slot\nEingangsspannung: Wechselstrom 100-240 V (50/60 Hz)\nStromverbrauch SDR (eingeschaltet): 41 kWh/1.000 h\nStromverbrauch HDR (eingeschaltet): 60 kWh/1.000 h\nStromverbrauch im Standby-Modus: 0.4 Watt\nEin-/Aus-Schalter: Ja\nMitgelieferte Software: Philips SmartControl\nDetails zu Abmessungen & Gewicht: Mit Standfu\u00df (h\u00f6chste Position) - Breite: 94.4 cm - Tiefe: 28 cm - H\u00f6he: 62.8 cm - Gewicht: 14.12 kg  Ohne Fu\u00df - Breite: 94.4 cm - Tiefe: 5.4 cm - H\u00f6he: 41.9 cm - Gewicht: 9.9 kg\nTransportbreite: 107 cm\nTransporttiefe: 22.6 cm\nTransporth\u00f6he: 50.7 cm\nTransportgewicht: 17.83 kg\nTCO-zertifiziert: TCO Certified Edge Displays, TCO Certified Displays 9\nENERGY STAR zertifiziert: Ja\nENERGY STAR-Version: 8.0",
    "reference_file": "offer_reference_592.json",
    "shop_name": "Proshop.at"
}