{
    "html_file": "offer_327_0.html",
    "name": "iiyama ProLite XUB2792UHSU-B5, 27\"",
    "offer_link": "https://direkt.jacob.de/produkte/iiyama-prolite-xub2792uhsu-b5-xub2792uhsu-b5-artnr-8362328.html?utm_source=geizhals&utm_medium=cpc&utm_campaign=Preisvergleich&ref=103",
    "price": 315.61,
    "raw_specifications": {
        "AC Eingangsfrequenz": "50/60 Hz",
        "AC Eingangsspannung": "100 - 240 V",
        "AMD FreeSync": "Nein",
        "Anzahl DisplayPort Anschl\u00fcsse": "1",
        "Anzahl HDMI-Anschl\u00fcsse": "1",
        "Anzahl OSD-Sprachen": "10",
        "Anzahl der Farben des Displays": "1,07 Milliarden Farben",
        "Anzahl der Lautsprecher": "2",
        "Anzahl der nachgeschalteten Steckpl\u00e4tze vom Typ USB-A": "2",
        "Betriebsanleitung": "Ja",
        "Bildschirmdiagonale": "68,6 cm (27\" )",
        "Bildschirmdiagonale (cm)": "68,45 cm",
        "Bildschirmform": "Flach",
        "Bildschirmtechnologie": "LED",
        "Bildwinkel, horizontal": "178\u00b0",
        "Bildwinkel, vertikal": "178\u00b0",
        "Breite (ohne Standfu\u00df)": "61,4 cm",
        "DVI Anschluss": "Ja",
        "Display-Aufl\u00f6sung": "3840 x 2160 Pixel",
        "Display-Oberfl\u00e4che": "Matt",
        "Eingebaute Lautsprecher": "Ja",
        "Energie Effizienzklasse": "F",
        "Energieeffizienzklasse (SDR)": "F",
        "Energieeffizienzskala": "A bis G",
        "Energieverbrauch (SDR) pro 1.000 Stunden": "26 kWh",
        "Flimmerfreie Technologie": "Ja",
        "Ger\u00e4tebreite (inkl. Fu\u00df)": "613,5 mm",
        "Ger\u00e4teh\u00f6he (inkl. Fu\u00df)": "544 mm",
        "Ger\u00e4tetiefe (inkl. Fu\u00df)": "209,5 mm",
        "Gewicht (mit St\u00e4nder)": "6,7 kg",
        "HD-Typ": "4K Ultra HD",
        "HDCP": "Ja",
        "HDMI": "Ja",
        "Helligkeit (typisch)": "350 cd/m\u00b2",
        "Horizontaler Scanbereich": "31 - 90 kHz",
        "H\u00f6he (ohne Standfu\u00df)": "39,4 cm",
        "H\u00f6heneinstellung": "15 cm",
        "H\u00f6henverstellung": "Ja",
        "Integrierte Kamera": "Nein",
        "Integrierter USB-Hub": "Ja",
        "Kabelsperre-Slot": "Ja",
        "Kontrastverh\u00e4ltnis": "1000:1",
        "Kontrastverh\u00e4ltnis (dynamisch)": "80000000:1",
        "Kopfh\u00f6rerausgang": "Ja",
        "Low-Blue-Light-Technologie": "Ja",
        "Maximale Bildwiederholrate": "60 Hz",
        "Men\u00fcsprachen": "Tschechisch, Deutsch, Niederl\u00e4ndisch, Englisch, Spanisch, Franz\u00f6sisch, Italienisch, Japanisch, Polnisch, Russisch",
        "Mitgelieferte Kabel": "DisplayPort, HDMI, Leistung, USB",
        "NTSC Abdeckung (typisch)": "72%",
        "NVIDIA G-SYNC": "Nein",
        "Nachhaltigkeitskonformit\u00e4t": "Ja",
        "Nachhaltigkeitszertifikate": "CE, EAC, ENERGY STAR, ErP, PSE, REACH, RoHS, TCO, TUV, UKCA, WEEE",
        "Natives Seitenverh\u00e4ltnis": "16:9",
        "Neigungsverstellung": "Ja",
        "Neigungswinkelbereich": "5 - 23\u00b0",
        "On-Screen-Display (OSD)": "Ja",
        "Panel-Montage-Schnittstelle": "100 x 100 mm",
        "Panel-Typ": "IPS",
        "Pivot": "Ja",
        "Pivot Winkel": "90 - 90\u00b0",
        "Produktfarbe": "Schwarz",
        "RMS-Leistung": "2 W",
        "Reaktionszeit": "4 ms",
        "Schnellstart\u00fcbersicht": "Ja",
        "Schwenkbar": "Ja",
        "Schwenkwinkelbereich": "45 - 45\u00b0",
        "Seitenverh\u00e4ltnis": "16:9",
        "Sichtbare Gr\u00f6\u00dfe (horizontal)": "59,7 cm",
        "Sichtbare Gr\u00f6\u00dfe (vertikal)": "33,6 cm",
        "Slot-Typ Kabelsperre": "Kensington",
        "Stromverbrauch (Standardbetrieb)": "25 W",
        "Stromverbrauch (Standby)": "0,5 W",
        "Stromverbrauch (aus)": "0,3 W",
        "Tiefe (ohne Standfu\u00df)": "20,9 cm",
        "Touchscreen": "Nein",
        "USB-Upstream-Porttyp": "USB Typ-A",
        "Unterst\u00fctzte Grafik-Aufl\u00f6sungen": "3840 x 2160",
        "VESA-Halterung": "Ja",
        "Verbessertes Kabelmanagement": "Ja",
        "Verpackungsart": "Box",
        "sRGB Abdeckung (klassisch)": "100%"
    },
    "raw_specifications_text": "Bildschirmdiagonale: 68,6 cm (27\" )\nDisplay-Aufl\u00f6sung: 3840 x 2160 Pixel\nNatives Seitenverh\u00e4ltnis: 16:9\nBildschirmtechnologie: LED\nTouchscreen: Nein\nHD-Typ: 4K Ultra HD\nEnergie Effizienzklasse: F\nPanel-Typ: IPS\nBildschirmform: Flach\nKontrastverh\u00e4ltnis: 1000:1\nMaximale Bildwiederholrate: 60 Hz\nAnzahl der Farben des Displays: 1,07 Milliarden Farben\nHelligkeit (typisch): 350 cd/m\u00b2\nReaktionszeit: 4 ms\nDisplay-Oberfl\u00e4che: Matt\nUnterst\u00fctzte Grafik-Aufl\u00f6sungen: 3840 x 2160\nSeitenverh\u00e4ltnis: 16:9\nKontrastverh\u00e4ltnis (dynamisch): 80000000:1\nBildwinkel, horizontal: 178\u00b0\nBildwinkel, vertikal: 178\u00b0\nHorizontaler Scanbereich: 31 - 90 kHz\nSichtbare Gr\u00f6\u00dfe (horizontal): 59,7 cm\nSichtbare Gr\u00f6\u00dfe (vertikal): 33,6 cm\nBildschirmdiagonale (cm): 68,45 cm\nsRGB Abdeckung (klassisch): 100%\nNTSC Abdeckung (typisch): 72%\nNVIDIA G-SYNC: Nein\nAMD FreeSync: Nein\nFlimmerfreie Technologie: Ja\nLow-Blue-Light-Technologie: Ja\nEingebaute Lautsprecher: Ja\nIntegrierte Kamera: Nein\nAnzahl der Lautsprecher: 2\nRMS-Leistung: 2 W\nProduktfarbe: Schwarz\nIntegrierter USB-Hub: Ja\nHDMI: Ja\nKopfh\u00f6rerausgang: Ja\nUSB-Upstream-Porttyp: USB Typ-A\nAnzahl der nachgeschalteten Steckpl\u00e4tze vom Typ USB-A: 2\nDVI Anschluss: Ja\nAnzahl HDMI-Anschl\u00fcsse: 1\nAnzahl DisplayPort Anschl\u00fcsse: 1\nHDCP: Ja\nVESA-Halterung: Ja\nKabelsperre-Slot: Ja\nH\u00f6henverstellung: Ja\nPanel-Montage-Schnittstelle: 100 x 100 mm\nVerbessertes Kabelmanagement: Ja\nSlot-Typ Kabelsperre: Kensington\nH\u00f6heneinstellung: 15 cm\nPivot: Ja\nPivot Winkel: 90 - 90\u00b0\nSchwenkbar: Ja\nSchwenkwinkelbereich: 45 - 45\u00b0\nNeigungswinkelbereich: 5 - 23\u00b0\nOn-Screen-Display (OSD): Ja\nMen\u00fcsprachen: Tschechisch, Deutsch, Niederl\u00e4ndisch, Englisch, Spanisch, Franz\u00f6sisch, Italienisch, Japanisch, Polnisch, Russisch\nAnzahl OSD-Sprachen: 10\nNeigungsverstellung: Ja\nEnergieeffizienzklasse (SDR): F\nEnergieverbrauch (SDR) pro 1.000 Stunden: 26 kWh\nStromverbrauch (Standardbetrieb): 25 W\nStromverbrauch (Standby): 0,5 W\nStromverbrauch (aus): 0,3 W\nAC Eingangsspannung: 100 - 240 V\nAC Eingangsfrequenz: 50/60 Hz\nEnergieeffizienzskala: A bis G\nMitgelieferte Kabel: DisplayPort, HDMI, Leistung, USB\nSchnellstart\u00fcbersicht: Ja\nBetriebsanleitung: Ja\nGer\u00e4tebreite (inkl. Fu\u00df): 613,5 mm\nGer\u00e4tetiefe (inkl. Fu\u00df): 209,5 mm\nGer\u00e4teh\u00f6he (inkl. Fu\u00df): 544 mm\nGewicht (mit St\u00e4nder): 6,7 kg\nBreite (ohne Standfu\u00df): 61,4 cm\nTiefe (ohne Standfu\u00df): 20,9 cm\nH\u00f6he (ohne Standfu\u00df): 39,4 cm\nVerpackungsart: Box\nNachhaltigkeitskonformit\u00e4t: Ja\nNachhaltigkeitszertifikate: CE, EAC, ENERGY STAR, ErP, PSE, REACH, RoHS, TCO, TUV, UKCA, WEEE",
    "reference_file": "offer_reference_327.json",
    "shop_name": "Jacob Elektronik direkt (AT)"
}