{
    "html_file": "offer_793_18.html",
    "name": "AOC Porsche Design Agon PD27S, 27\"",
    "offer_link": "https://www.hiq24.de/shop/artikel/328225/?sPartner=geizhals",
    "price": 550.9,
    "raw_specifications": {
        "Abmessungen (Breite x Tiefe x H\u00f6he)": "61.39 cm x 28.18 cm x 55.54 cm - mit Fu\u00df",
        "Abmessungen (Breite x Tiefe x H\u00f6he) - mit Fu\u00df": "61.39 cm x 28.18 cm x 55.54 cm",
        "Adaptive-Sync Technologie": "AMD Adaptive-Sync",
        "Ausgangsleistung/Kanal": "5 Watt",
        "Besonderheiten": "Mega Infinity Dynamic Contrast Ratio, Low Blue Light Mode, Crosshair Display, Niedrige Eingangsverz\u00f6gerung, Game Color Mode, Dial Point, an 3 Seiten rahmenlos, Shadow Control",
        "Bildschirmtyp": "IPS",
        "Details zu Abmessungen & Gewicht": "Mit Standfu\u00df (niedrigste Position) - Breite: 61.39 cm - Tiefe: 28.18 cm - H\u00f6he: 40.54 cm - Gewicht: 7.65 kg  Mit Standfu\u00df (h\u00f6chste Position) - Breite: 61.39 cm - Tiefe: 28.18 cm - H\u00f6he: 55.54 cm - Gewicht: 7.65 kg  Ohne Fu\u00df - Breite: 61.39 cm - Tiefe: 6.3 cm - H\u00f6he: 36.92 cm",
        "Diagonalabmessung": "68.6 cm (27\")",
        "Display-Typ": "LED-hintergrundbeleuchteter LCD-Monitor / TFT-Aktivmatrix",
        "Eingangsanschl\u00fcsse": "2xHDMI, 2xDisplayPort",
        "Einstellungen der Anzeigeposition": "H\u00f6he, Pivot (Rotation), Drehung, Neigung",
        "Enthaltene Kabel": "1 x HDMI-Kabel - 1.8 m  1 x DisplayPort-Kabel - 1.8 m  1 x USB-Kabel - 1.8 m",
        "Farbe": "Schwarz",
        "Farbraum": "126% sRGB (CIE 1931)",
        "Farbunterst\u00fctzung": "1,07 Mrd. Farben",
        "Gaming": "Ja",
        "Ger\u00e4tetyp": "LED-hintergrundbeleuchteter LCD-Monitor - 68.6 cm (27\")",
        "Gewicht": "7.65 kg",
        "HDR-Zertifizierung": "DisplayHDR 400",
        "HDR-f\u00e4hig": "DisplayHDR 400",
        "Helligkeit": "350 cd/m\u00b2",
        "Hintergrundbeleuchtungs-Technologie": "WLED",
        "Horizontaler Betrachtungswinkel": "178",
        "H\u00f6heneinstellung": "150 mm",
        "Integrierte Peripherieger\u00e4te": "USB 3.1 Gen 2 Hub",
        "Kontrast": "1000:1",
        "Leistungsaufnahme im Ein-Zustand": "36 W",
        "Leistungsmerkmale": "USB 3.1 Gen 2 Hub",
        "Native Aufl\u00f6sung": "QHD 2560 x 1440 (DisplayPort: 170 Hz, HDMI: 144 Hz)",
        "Neigungswinkel": "-3/+21",
        "OSD-Sprachen": "Multilingual",
        "Produktbeschreibung": "AOC Gaming PD27S - Porsche Design - PDS Series - LED-Monitor - QHD - 68.6 cm (27\") - HDR",
        "Reaktionszeit": "1 ms (Gray-to-Gray), 1 ms (MPRT)",
        "Schlosstyp zur Diebstahlsicherung": "Kensington Slot",
        "Schnittstellen": "2 x HDMI  2 x DisplayPort 1.4  4 x USB 3.1  Kopfh\u00f6rer",
        "Schwenkwinkel": "40",
        "Seitenverh\u00e4ltnis": "16:9",
        "Stromverbrauch (Aus-Modus)": "0.3 Watt",
        "Stromverbrauch im Standby-Modus": "0.3 Watt",
        "Transportbreite": "69.1 cm",
        "Transportgewicht": "12.19 kg",
        "Transporth\u00f6he": "57 cm",
        "Transporttiefe": "37.8 cm",
        "Typ": "Lautsprecher - Stereo",
        "Vertikaler Betrachtungswinkel": "178"
    },
    "raw_specifications_text": "Display-Typ: LED-hintergrundbeleuchteter LCD-Monitor / TFT-Aktivmatrix\nDiagonalabmessung: 68.6 cm (27\")\nAdaptive-Sync Technologie: AMD Adaptive-Sync\nIntegrierte Peripherieger\u00e4te: USB 3.1 Gen 2 Hub\nBildschirmtyp: IPS\nSeitenverh\u00e4ltnis: 16:9\nNative Aufl\u00f6sung: QHD 2560 x 1440 (DisplayPort: 170 Hz, HDMI: 144 Hz)\nHelligkeit: 350 cd/m\u00b2\nKontrast: 1000:1\nHDR-Zertifizierung: DisplayHDR 400\nFarbunterst\u00fctzung: 1,07 Mrd. Farben\nFarbraum: 126% sRGB (CIE 1931)\nReaktionszeit: 1 ms (Gray-to-Gray), 1 ms (MPRT)\nGaming: Ja\nHorizontaler Betrachtungswinkel: 178\nVertikaler Betrachtungswinkel: 178\nHintergrundbeleuchtungs-Technologie: WLED\nOSD-Sprachen: Multilingual\nBesonderheiten: Mega Infinity Dynamic Contrast Ratio, Low Blue Light Mode, Crosshair Display, Niedrige Eingangsverz\u00f6gerung, Game Color Mode, Dial Point, an 3 Seiten rahmenlos, Shadow Control\nFarbe: Schwarz\nAbmessungen (Breite x Tiefe x H\u00f6he): 61.39 cm x 28.18 cm x 55.54 cm - mit Fu\u00df\nGewicht: 7.65 kg\nTyp: Lautsprecher - Stereo\nAusgangsleistung/Kanal: 5 Watt\nSchnittstellen: 2 x HDMI  2 x DisplayPort 1.4  4 x USB 3.1  Kopfh\u00f6rer\nEinstellungen der Anzeigeposition: H\u00f6he, Pivot (Rotation), Drehung, Neigung\nNeigungswinkel: -3/+21\nSchwenkwinkel: 40\nH\u00f6heneinstellung: 150 mm\nLeistungsmerkmale: USB 3.1 Gen 2 Hub\nEnthaltene Kabel: 1 x HDMI-Kabel - 1.8 m  1 x DisplayPort-Kabel - 1.8 m  1 x USB-Kabel - 1.8 m\nSchlosstyp zur Diebstahlsicherung: Kensington Slot\nLeistungsaufnahme im Ein-Zustand: 36 W\nStromverbrauch im Standby-Modus: 0.3 Watt\nStromverbrauch (Aus-Modus): 0.3 Watt\nDetails zu Abmessungen & Gewicht: Mit Standfu\u00df (niedrigste Position) - Breite: 61.39 cm - Tiefe: 28.18 cm - H\u00f6he: 40.54 cm - Gewicht: 7.65 kg  Mit Standfu\u00df (h\u00f6chste Position) - Breite: 61.39 cm - Tiefe: 28.18 cm - H\u00f6he: 55.54 cm - Gewicht: 7.65 kg  Ohne Fu\u00df - Breite: 61.39 cm - Tiefe: 6.3 cm - H\u00f6he: 36.92 cm\nTransportbreite: 69.1 cm\nTransporttiefe: 37.8 cm\nTransporth\u00f6he: 57 cm\nTransportgewicht: 12.19 kg\nProduktbeschreibung: AOC Gaming PD27S - Porsche Design - PDS Series - LED-Monitor - QHD - 68.6 cm (27\") - HDR\nGer\u00e4tetyp: LED-hintergrundbeleuchteter LCD-Monitor - 68.6 cm (27\")\nHDR-f\u00e4hig: DisplayHDR 400\nEingangsanschl\u00fcsse: 2xHDMI, 2xDisplayPort\nAbmessungen (Breite x Tiefe x H\u00f6he) - mit Fu\u00df: 61.39 cm x 28.18 cm x 55.54 cm",
    "reference_file": "offer_reference_793.json",
    "shop_name": "HiQ24"
}