{
    "html_file": "offer_1933_8.html",
    "name": "Acer Nitro ED0 ED320QRPbiipx, 31.5\"",
    "offer_link": "https://www.proshop.at/Bildschirm/Acer-31-Bildschirm-ED320QR-Pbiipx-165Hz-Black-5-ms-AMD-FreeSync/2858384?utm_source=geizhals&utm_medium=cpc&utm_campaign=pricesite",
    "price": 234.14,
    "raw_specifications": {
        "Abmessungen (Breite x Tiefe x H\u00f6he)": "71.3 cm x 51.25 cm x 19.86 cm",
        "Adaptive-Sync Technologie": "AMD FreeSync",
        "Besonderheiten": "ComfyView, Flimmerfrei-Technologie, Abblend-Technologie, Blaulichtfilter-Technologie, Acer VisionCare, 0.363 mm Pixelabstand, 72 % NTSC Farbraum",
        "Bildschirmbeschichtung": "Blendfrei",
        "Bildschirmtyp": "VA",
        "Diagonalabmessung": "80 cm (31.5\")",
        "Display-Typ": "LED-hintergrundbeleuchteter LCD-Monitor / TFT-Aktivmatrix",
        "EAN": "4710180718010",
        "Eingangsanschl\u00fcsse": "2xHDMI, DisplayPort",
        "Eingangsspannung": "Wechselstrom 120/230 V (50/60 Hz)",
        "Einstellungen der Anzeigeposition": "Neigung",
        "Energie Effizienzklasse": "Klasse F",
        "Energieverbrauch pro Jahr": "50 kWh",
        "Enthaltene Kabel": "1 x VGA-Kabel  1 x DisplayPort-Kabel",
        "Farbe": "Schwarz",
        "Farbraum": "72% NTSC",
        "Farbunterst\u00fctzung": "16,7 Millionen Farben (8-Bit)",
        "Ger\u00e4tetyp": "LED-hintergrundbeleuchteter LCD-Monitor - 80 cm (31.5\")",
        "Geschwungener Bildschirm": "Ja (1800R)",
        "Helligkeit": "300 cd/m\u00b2",
        "Hersteller": "Acer",
        "Hintergrundbeleuchtungs-Technologie": "LED-Hintergrundbeleuchtung",
        "Horizontale Bildwiederholrate": "53.28 - 183.15 kHz",
        "Horizontaler Betrachtungswinkel": "178",
        "Integrierte Peripherieger\u00e4te": "USB 3.0-Hub",
        "Kennzeichnung": "MPR II, TUV GS, ISO 9241-307 Class 2",
        "Kontrast": "4000:1 / 100000000:1 (dynamisch)",
        "Leistungsaufnahme im Ein-Zustand": "31.1 W",
        "Leistungsmerkmale": "Unterst\u00fctzung f\u00fcr VESA-Schnittstelle",
        "Modell": "UM.JE0EE.P01",
        "Native Aufl\u00f6sung": "Full HD (1080p) 1920 x 1080 (DisplayPort: 165 Hz, HDMI: 144 Hz)",
        "Neigungswinkel": "-5/+20",
        "Ppi": "70",
        "Produktbeschreibung": "Acer ED320QR Pbiipx - LED-Monitor - gebogen - Full HD (1080p) - 80 cm (31.5\")",
        "Reaktionszeit": "5 ms (Gray-to-Gray)",
        "Schnittstellen": "2 x HDMI  DisplayPort  Audio Line-Out",
        "Seitenverh\u00e4ltnis": "16:9",
        "Spannung": "Wechselstrom 120/230 V (50/60 Hz)",
        "Stromverbrauch SDR (eingeschaltet)": "31.1 kWh/1.000 h",
        "Stromverbrauch im Standby-Modus": "0.5 Watt",
        "Vertikale Bildwiederholrate": "48 - 165 Hz",
        "Vertikaler Betrachtungswinkel": "178",
        "Waren-Nr.": "2858384",
        "Zum Hersteller": "www.acer.com"
    },
    "raw_specifications_text": "Hersteller: Acer\nWaren-Nr.: 2858384\nModell: UM.JE0EE.P01\nEAN: 4710180718010\nZum Hersteller: www.acer.com\nProduktbeschreibung: Acer ED320QR Pbiipx - LED-Monitor - gebogen - Full HD (1080p) - 80 cm (31.5\")\nGer\u00e4tetyp: LED-hintergrundbeleuchteter LCD-Monitor - 80 cm (31.5\")\nEnergie Effizienzklasse: Klasse F\nEnergieverbrauch pro Jahr: 50 kWh\nLeistungsaufnahme im Ein-Zustand: 31.1 W\nGeschwungener Bildschirm: Ja (1800R)\nAdaptive-Sync Technologie: AMD FreeSync\nLeistungsmerkmale: Unterst\u00fctzung f\u00fcr VESA-Schnittstelle\nBildschirmtyp: VA\nSeitenverh\u00e4ltnis: 16:9\nNative Aufl\u00f6sung: Full HD (1080p) 1920 x 1080 (DisplayPort: 165 Hz, HDMI: 144 Hz)\nHelligkeit: 300 cd/m\u00b2\nKontrast: 4000:1 / 100000000:1 (dynamisch)\nReaktionszeit: 5 ms (Gray-to-Gray)\nFarbunterst\u00fctzung: 16,7 Millionen Farben (8-Bit)\nFarbraum: 72% NTSC\nEingangsanschl\u00fcsse: 2xHDMI, DisplayPort\nEinstellungen der Anzeigeposition: Neigung\nBildschirmbeschichtung: Blendfrei\nSpannung: Wechselstrom 120/230 V (50/60 Hz)\nFarbe: Schwarz\nAbmessungen (Breite x Tiefe x H\u00f6he): 71.3 cm x 51.25 cm x 19.86 cm\nKennzeichnung: MPR II, TUV GS, ISO 9241-307 Class 2\nDisplay-Typ: LED-hintergrundbeleuchteter LCD-Monitor / TFT-Aktivmatrix\nDiagonalabmessung: 80 cm (31.5\")\nIntegrierte Peripherieger\u00e4te: USB 3.0-Hub\nPpi: 70\nVertikale Bildwiederholrate: 48 - 165 Hz\nHorizontale Bildwiederholrate: 53.28 - 183.15 kHz\nHorizontaler Betrachtungswinkel: 178\nVertikaler Betrachtungswinkel: 178\nHintergrundbeleuchtungs-Technologie: LED-Hintergrundbeleuchtung\nBesonderheiten: ComfyView, Flimmerfrei-Technologie, Abblend-Technologie, Blaulichtfilter-Technologie, Acer VisionCare, 0.363 mm Pixelabstand, 72 % NTSC Farbraum\nSchnittstellen: 2 x HDMI  DisplayPort  Audio Line-Out\nNeigungswinkel: -5/+20\nEnthaltene Kabel: 1 x VGA-Kabel  1 x DisplayPort-Kabel\nEingangsspannung: Wechselstrom 120/230 V (50/60 Hz)\nStromverbrauch SDR (eingeschaltet): 31.1 kWh/1.000 h\nStromverbrauch im Standby-Modus: 0.5 Watt",
    "reference_file": "offer_reference_1933.json",
    "shop_name": "Proshop.at"
}