{
    "html_file": "offer_1707_3.html",
    "name": "LG 32UN500-W, 31.5\"",
    "offer_link": "https://direkt.jacob.de/produkte/lg-32un500-w-computerbildschirm-32un500-w-artnr-6922705.html?utm_source=geizhals&utm_medium=cpc&utm_campaign=Preisvergleich&ref=103",
    "price": 401.45,
    "raw_specifications": {
        "AC Eingangsfrequenz": "50/60 Hz",
        "AC Eingangsspannung": "100 - 240 V",
        "AMD FreeSync": "Ja",
        "Anzahl DisplayPort Anschl\u00fcsse": "1",
        "Anzahl HDMI-Anschl\u00fcsse": "2",
        "Anzahl der Farben des Displays": "1,07 Milliarden Farben",
        "Anzahl der Lautsprecher": "2",
        "Audioanschl\u00fcsse": "Ja",
        "Bildschirmaufl\u00f6sung": "3840 x 2160 Pixel",
        "Bildschirmdiagonale": "80 cm (31.5\" )",
        "Bildschirmform": "Flach",
        "Blickwinkel, horizontal": "178\u00b0",
        "Blickwinkel, vertikal": "178\u00b0",
        "Breite": "713,7 mm",
        "DVI Anschluss": "Nein",
        "Eingebaute Lautsprecher": "Ja",
        "Energie Effizienzklasse": "G",
        "Farbskala": "90%",
        "Flimmerfreie Technologie": "Ja",
        "Ger\u00e4tebreite (inkl. Fu\u00df)": "713,7 mm",
        "Ger\u00e4teh\u00f6he (inkl. Fu\u00df)": "513,1 mm",
        "Ger\u00e4tetiefe (inkl. Fu\u00df)": "208,3 mm",
        "Gewicht": "6,71 kg",
        "Gewicht (mit St\u00e4nder)": "10,7 kg",
        "HD-Typ": "4K Ultra HD",
        "HDMI": "Ja",
        "Helligkeit (typisch)": "350 cd/m\u00b2",
        "H\u00f6he": "419,1 mm",
        "Integrierte Kamera": "Nein",
        "Integrierter USB-Hub": "Nein",
        "Kontrastverh\u00e4ltnis": "3000:1",
        "Kopfh\u00f6rerausgang": "Ja",
        "Marktpositionierung": "Gaming",
        "Natives Seitenverh\u00e4ltnis": "16:9",
        "Neigungsverstellung": "Ja",
        "Neigungswinkelbereich": "5 - 15\u00b0",
        "On-Screen-Display (OSD)": "Ja",
        "Panel-Montage-Schnittstelle": "100 x 100 mm",
        "Panel-Typ": "VA",
        "Pixel Abstand": "0,18159 x 0,18159 mm",
        "Produktfarbe": "Schwarz, Wei\u00df",
        "RMS-Leistung": "10 W",
        "Reaktionszeit": "4 ms",
        "Stromverbrauch (aus)": "0,3 W",
        "Stromverbrauch (in Betrieb)": "45 W",
        "Tiefe": "45,7 mm",
        "Unterst\u00fctzte Grafik-Aufl\u00f6sungen": "1920 x 1080 (HD 1080),3840 x 2160",
        "VESA-Halterung": "Ja"
    },
    "raw_specifications_text": "Bildschirmdiagonale: 80 cm (31.5\" )\nBildschirmaufl\u00f6sung: 3840 x 2160 Pixel\nEnergie Effizienzklasse: G\nNatives Seitenverh\u00e4ltnis: 16:9\nPanel-Typ: VA\nHelligkeit (typisch): 350 cd/m\u00b2\nReaktionszeit: 4 ms\nHD-Typ: 4K Ultra HD\nBildschirmform: Flach\nKontrastverh\u00e4ltnis: 3000:1\nBlickwinkel, horizontal: 178\u00b0\nBlickwinkel, vertikal: 178\u00b0\nAnzahl der Farben des Displays: 1,07 Milliarden Farben\nUnterst\u00fctzte Grafik-Aufl\u00f6sungen: 1920 x 1080 (HD 1080),3840 x 2160\nPixel Abstand: 0,18159 x 0,18159 mm\nFarbskala: 90%\nAMD FreeSync: Ja\nFlimmerfreie Technologie: Ja\nEingebaute Lautsprecher: Ja\nIntegrierte Kamera: Nein\nAnzahl der Lautsprecher: 2\nRMS-Leistung: 10 W\nMarktpositionierung: Gaming\nProduktfarbe: Schwarz, Wei\u00df\nIntegrierter USB-Hub: Nein\nDVI Anschluss: Nein\nHDMI: Ja\nAnzahl DisplayPort Anschl\u00fcsse: 1\nAudioanschl\u00fcsse: Ja\nKopfh\u00f6rerausgang: Ja\nAnzahl HDMI-Anschl\u00fcsse: 2\nVESA-Halterung: Ja\nPanel-Montage-Schnittstelle: 100 x 100 mm\nNeigungsverstellung: Ja\nNeigungswinkelbereich: 5 - 15\u00b0\nOn-Screen-Display (OSD): Ja\nStromverbrauch (in Betrieb): 45 W\nStromverbrauch (aus): 0,3 W\nAC Eingangsspannung: 100 - 240 V\nAC Eingangsfrequenz: 50/60 Hz\nBreite: 713,7 mm\nTiefe: 45,7 mm\nH\u00f6he: 419,1 mm\nGewicht: 6,71 kg\nGer\u00e4tebreite (inkl. Fu\u00df): 713,7 mm\nGer\u00e4tetiefe (inkl. Fu\u00df): 208,3 mm\nGer\u00e4teh\u00f6he (inkl. Fu\u00df): 513,1 mm\nGewicht (mit St\u00e4nder): 10,7 kg",
    "reference_file": "offer_reference_1707.json",
    "shop_name": "Jacob Elektronik direkt (AT)"
}