{
    "html_file": "offer_779_3.html",
    "name": "ASUS ProArt PA248CNV, 24.1\"",
    "offer_link": "https://www.mylemon.at/artikel/asus/90lm05k1_b03370/61-13cm-profess-pa248cnv-hdmi.html",
    "price": 366.22,
    "raw_specifications": {
        "AC Eingangsfrequenz": "50/60 Hz",
        "AC Eingangsspannung": "100 - 240 V",
        "Anzahl DisplayPort Anschl\u00fcsse": "2",
        "Anzahl HDMI-Anschl\u00fcsse": "1",
        "Anzahl RJ-45-Anschl\u00fcsse": "1",
        "Anzahl der Farben des Displays": "16,7 Millionen Farben",
        "Anzahl der Lautsprecher": "2",
        "Anzahl der Upstream-Ports USB Typ-C": "1",
        "Anzahl der nachgeschalteten Steckpl\u00e4tze vom Typ USB-A": "4",
        "Anzahl der vorgeschalteten Steckpl\u00e4tze": "1",
        "Artikelnummer": "M1EY5AFL",
        "Aufl\u00f6sung": "1920x1200",
        "Besonderheiten": "75 Hz, Lautsprecher",
        "Bildschirmdiagonale": "61,2 cm (24.1 Zoll)",
        "Bildschirmform": "Flach",
        "Bildwinkel, horizontal": "178\u00b0",
        "Bildwinkel, vertikal": "178\u00b0",
        "Breite (ohne Standfu\u00df)": "53,3 cm",
        "Digital horizontale Frequenz": "30 - 95 kHz",
        "Digital vertikale Frequenz": "24 - 75 Hz",
        "Display-Aufl\u00f6sung": "1920 x 1200 Pixel",
        "DisplayPorts-Version": "1.2",
        "Displaygr\u00f6\u00dfe": "24,1 Zoll",
        "Dynamisches Kontrastverh\u00e4ltnis Marketingbezeichnung": "ASUS Smart Contrast Ratio (ASCR)",
        "EAN": "4711081782230",
        "Eingebaute Lautsprecher": "Ja",
        "Eingebauter Ethernet-Anschluss": "Ja",
        "Energieeffizienzklasse (HDR)": "G",
        "Energieeffizienzklasse (SDR)": "E",
        "Energieeffizienzskala": "A bis G",
        "Energieverbrauch (HDR) pro 1.000 Stunden": "22 kWh",
        "Energieverbrauch (SDR) pro 1.000 Stunden": "19 kWh",
        "Ergonomie": "H\u00f6henverstellbar, Pivot (90 Grad drehbar), Schwenkbar, Neigbar",
        "Flimmerfreie Technologie": "Ja",
        "Fu\u00dffarbe": "Silber",
        "Ger\u00e4tebreite (inkl. Fu\u00df)": "533 mm",
        "Ger\u00e4teh\u00f6he (inkl. Fu\u00df)": "489 mm",
        "Ger\u00e4tetiefe (inkl. Fu\u00df)": "211 mm",
        "Gewicht (mit St\u00e4nder)": "6,5 kg",
        "Gewicht (ohne St\u00e4nder)": "4,4 kg",
        "HD-Typ": "Full HD+",
        "HDCP": "Ja",
        "HDCP-Version": "1.4",
        "HDMI": "Ja",
        "HDMI-Version": "1.4",
        "Helligkeit": "300 cd/m\u00b2",
        "Helligkeit (typisch)": "300 cd/m\u00b2",
        "Hersteller Artikelnummer": "90LM05K1-B03370",
        "High Dynamic Range Video (HDR) Unterst\u00fctzung": "Ja",
        "H\u00f6he (ohne Standfu\u00df)": "35,9 cm",
        "H\u00f6heneinstellung": "13 cm",
        "H\u00f6henverstellung": "Ja",
        "Integrierte Kamera": "Nein",
        "Integrierter USB-Hub": "Ja",
        "Kabelsperre-Slot": "Ja",
        "Kontrastverh\u00e4ltnis": "1000:1",
        "Kontrastverh\u00e4ltnis (dynamisch)": "10000000:1",
        "Kopfh\u00f6rer-Anschluss": "3,5 mm",
        "Kopfh\u00f6rerausgang": "Ja",
        "Kopfh\u00f6rerausg\u00e4nge": "1",
        "Low-Blue-Light-Technologie": "Ja",
        "Marktpositionierung": "Grafikdesign",
        "Maximale Bildwiederholrate": "75 Hz",
        "Mitgelieferte Kabel": "AC",
        "Natives Seitenverh\u00e4ltnis": "16:10",
        "Neigungsverstellung": "Ja",
        "Neigungswinkelbereich": "35 - -5\u00b0",
        "Paketgewicht": "8,5 kg",
        "Panel": "IPS",
        "Panel-Montage-Schnittstelle": "100 x 100 mm",
        "Panel-Typ": "IPS",
        "Pivot": "Ja",
        "Pivot Winkel": "90 - -90\u00b0",
        "Pixel Abstand": "0,27 x 0,27 mm",
        "Pixeldichte": "94 ppi",
        "Produktfarbe": "Schwarz",
        "RMS-Leistung": "4 W",
        "Reaktionszeit": "5 ms",
        "Schnellstart\u00fcbersicht": "Ja",
        "Schwenkbar": "Ja",
        "Schwenkwinkelbereich": "90 - -90\u00b0",
        "Sichtbare Gr\u00f6\u00dfe (horizontal)": "51,8 cm",
        "Sichtbare Gr\u00f6\u00dfe (vertikal)": "32,4 cm",
        "Slot-Typ Kabelsperre": "Kensington",
        "Stromverbrauch (PowerSave)": "0,5 W",
        "Stromverbrauch (Standardbetrieb)": "21 W",
        "Technologie mit hohem Dynamikbereich (HDR)": "High Dynamic Range 10 (HDR10)",
        "Tiefe (ohne Standfu\u00df)": "5,8 cm",
        "Touchscreen": "Nein",
        "Typ der Hintergrundbeleuchtung": "LED",
        "USB Power Delivery": "Ja",
        "USB-Hub-Version": "3.2 Gen 1 (3.1 Gen 1)",
        "USB-Stromversorgung bis zu": "90 W",
        "USB-Upstream-Porttyp": "USB Typ-C",
        "VESA Halterung": "100x100 mm",
        "VESA-Halterung": "Ja",
        "Verpackungsbreite": "735 mm",
        "Verpackungsh\u00f6he": "442 mm",
        "Verpackungstiefe": "177 mm",
        "Video Anschl\u00fcsse": "1x HDMI, 1x DisplayPort, USB-C DisplayPort",
        "sRGB Abdeckung (klassisch)": "100%"
    },
    "raw_specifications_text": "Displaygr\u00f6\u00dfe: 24,1 Zoll\nAufl\u00f6sung: 1920x1200\nPanel: IPS\nReaktionszeit: 5 ms\nVideo Anschl\u00fcsse: 1x HDMI, 1x DisplayPort, USB-C DisplayPort\nErgonomie: H\u00f6henverstellbar, Pivot (90 Grad drehbar), Schwenkbar, Neigbar\nVESA Halterung: 100x100 mm\nHelligkeit: 300 cd/m\u00b2\nBesonderheiten: 75 Hz, Lautsprecher\nHersteller Artikelnummer: 90LM05K1-B03370\nEAN: 4711081782230\nArtikelnummer: M1EY5AFL\nBildschirmdiagonale: 61,2 cm (24.1 Zoll)\nDisplay-Aufl\u00f6sung: 1920 x 1200 Pixel\nNatives Seitenverh\u00e4ltnis: 16:10\nTouchscreen: Nein\nHD-Typ: Full HD+\nPanel-Typ: IPS\nBildschirmform: Flach\nKontrastverh\u00e4ltnis: 1000:1\nMaximale Bildwiederholrate: 75 Hz\nAnzahl der Farben des Displays: 16,7 Millionen Farben\nTyp der Hintergrundbeleuchtung: LED\nHelligkeit (typisch): 300 cd/m\u00b2\nKontrastverh\u00e4ltnis (dynamisch): 10000000:1\nDynamisches Kontrastverh\u00e4ltnis Marketingbezeichnung: ASUS Smart Contrast Ratio (ASCR)\nBildwinkel, horizontal: 178\u00b0\nBildwinkel, vertikal: 178\u00b0\nPixel Abstand: 0,27 x 0,27 mm\nPixeldichte: 94 ppi\nSichtbare Gr\u00f6\u00dfe (horizontal): 51,8 cm\nSichtbare Gr\u00f6\u00dfe (vertikal): 32,4 cm\nDigital horizontale Frequenz: 30 - 95 kHz\nDigital vertikale Frequenz: 24 - 75 Hz\nHigh Dynamic Range Video (HDR) Unterst\u00fctzung: Ja\nTechnologie mit hohem Dynamikbereich (HDR): High Dynamic Range 10 (HDR10)\nsRGB Abdeckung (klassisch): 100%\nFlimmerfreie Technologie: Ja\nLow-Blue-Light-Technologie: Ja\nEingebaute Lautsprecher: Ja\nIntegrierte Kamera: Nein\nAnzahl der Lautsprecher: 2\nRMS-Leistung: 4 W\nMarktpositionierung: Grafikdesign\nProduktfarbe: Schwarz\nFu\u00dffarbe: Silber\nIntegrierter USB-Hub: Ja\nHDMI: Ja\nKopfh\u00f6rerausgang: Ja\nUSB-Hub-Version: 3.2 Gen 1 (3.1 Gen 1)\nUSB-Upstream-Porttyp: USB Typ-C\nAnzahl der vorgeschalteten Steckpl\u00e4tze: 1\nAnzahl der Upstream-Ports USB Typ-C: 1\nAnzahl der nachgeschalteten Steckpl\u00e4tze vom Typ USB-A: 4\nUSB Power Delivery: Ja\nUSB-Stromversorgung bis zu: 90 W\nAnzahl HDMI-Anschl\u00fcsse: 1\nHDMI-Version: 1.4\nAnzahl DisplayPort Anschl\u00fcsse: 2\nDisplayPorts-Version: 1.2\nKopfh\u00f6rerausg\u00e4nge: 1\nKopfh\u00f6rer-Anschluss: 3,5 mm\nHDCP: Ja\nHDCP-Version: 1.4\nEingebauter Ethernet-Anschluss: Ja\nVESA-Halterung: Ja\nKabelsperre-Slot: Ja\nH\u00f6henverstellung: Ja\nPanel-Montage-Schnittstelle: 100 x 100 mm\nSlot-Typ Kabelsperre: Kensington\nH\u00f6heneinstellung: 13 cm\nPivot: Ja\nPivot Winkel: 90 - -90\u00b0\nSchwenkbar: Ja\nSchwenkwinkelbereich: 90 - -90\u00b0\nNeigungswinkelbereich: 35 - -5\u00b0\nNeigungsverstellung: Ja\nEnergieeffizienzklasse (SDR): E\nEnergieeffizienzklasse (HDR): G\nEnergieverbrauch (SDR) pro 1.000 Stunden: 19 kWh\nEnergieverbrauch (HDR) pro 1.000 Stunden: 22 kWh\nStromverbrauch (Standardbetrieb): 21 W\nStromverbrauch (PowerSave): 0,5 W\nAC Eingangsspannung: 100 - 240 V\nAC Eingangsfrequenz: 50/60 Hz\nEnergieeffizienzskala: A bis G\nMitgelieferte Kabel: AC\nSchnellstart\u00fcbersicht: Ja\nGer\u00e4tebreite (inkl. Fu\u00df): 533 mm\nGer\u00e4tetiefe (inkl. Fu\u00df): 211 mm\nGer\u00e4teh\u00f6he (inkl. Fu\u00df): 489 mm\nGewicht (mit St\u00e4nder): 6,5 kg\nBreite (ohne Standfu\u00df): 53,3 cm\nTiefe (ohne Standfu\u00df): 5,8 cm\nH\u00f6he (ohne Standfu\u00df): 35,9 cm\nGewicht (ohne St\u00e4nder): 4,4 kg\nVerpackungsbreite: 735 mm\nVerpackungstiefe: 177 mm\nVerpackungsh\u00f6he: 442 mm\nPaketgewicht: 8,5 kg\nAnzahl RJ-45-Anschl\u00fcsse: 1",
    "reference_file": "offer_reference_779.json",
    "shop_name": "mylemon.at"
}