{
    "html_file": "offer_1337_0.html",
    "name": "Samsung F37T, 24\"",
    "offer_link": "https://www.mylemon.at/artikel/samsung/lf24t370fwrxen/t37f-f24t370fwr-1920x1080.html",
    "price": 108.64,
    "raw_specifications": {
        "AC Eingangsspannung": "100 - 240 V",
        "AMD FreeSync": "Ja",
        "AMD FreeSync-Typ": "FreeSync",
        "Anzahl DisplayPort Anschl\u00fcsse": "1",
        "Anzahl HDMI-Anschl\u00fcsse": "1",
        "Anzahl der Farben des Displays": "16,7 Millionen Farben",
        "Artikelnummer": "M15YBOKL",
        "Aufl\u00f6sung": "1920x1080",
        "Betriebstemperatur": "10 - 40 \u00b0C",
        "Bildschirmdiagonale": "61 cm (24 Zoll)",
        "Bildschirmform": "Flach",
        "Bildschirmtechnologie": "LCD",
        "Bildwinkel, horizontal": "178\u00b0",
        "Bildwinkel, vertikal": "178\u00b0",
        "Breite (ohne Standfu\u00df)": "53,9 cm",
        "Display-Aufl\u00f6sung": "1920 x 1080 Pixel",
        "DisplayPorts-Version": "1.2",
        "Displaygr\u00f6\u00dfe": "24 Zoll",
        "Dynamisches Kontrastverh\u00e4ltnis Marketingbezeichnung": "Mega-Kontrast",
        "EAN": "8806092014534",
        "Energieeffizienzklasse (SDR)": "E",
        "Energieverbrauch (SDR) pro 1.000 Stunden": "18 kWh",
        "Flimmerfreie Technologie": "Ja",
        "Ger\u00e4tebreite (inkl. Fu\u00df)": "539,2 mm",
        "Ger\u00e4teh\u00f6he (inkl. Fu\u00df)": "425,3 mm",
        "Ger\u00e4tetiefe (inkl. Fu\u00df)": "232 mm",
        "Gewicht (mit St\u00e4nder)": "2,9 kg",
        "Gewicht (ohne St\u00e4nder)": "2,6 kg",
        "HD-Typ": "Full HD",
        "HDMI": "Ja",
        "HDMI-Version": "1.4",
        "Helligkeit (typisch)": "250 cd/m\u00b2",
        "Hersteller Artikelnummer": "LF24T370FWRXEN",
        "H\u00f6he (ohne Standfu\u00df)": "32,3 cm",
        "Kontrastverh\u00e4ltnis": "1000:1",
        "Marktpositionierung": "Business",
        "Maximale Bildwiederholrate": "75 Hz",
        "Mitgelieferte Kabel": "AC, HDMI",
        "NTSC Abdeckung (typisch)": "72%",
        "Natives Seitenverh\u00e4ltnis": "16:9",
        "Neigungsverstellung": "Ja",
        "Neigungswinkelbereich": "-2 - 20\u00b0",
        "Paketgewicht": "4,2 kg",
        "Panel": "IPS",
        "Panel-Montage-Schnittstelle": "100 x 100 mm",
        "Panel-Typ": "IPS",
        "Produktfarbe": "Schwarz",
        "Reaktionszeit": "5 ms",
        "Relative Luftfeuchtigkeit in Betrieb": "10 - 80%",
        "Spiel-Modus": "Ja",
        "Stromverbrauch (Standardbetrieb)": "18 W",
        "Stromverbrauch (Standby)": "0,5 W",
        "Stromverbrauch (aus)": "0,3 W",
        "Tiefe (ohne Standfu\u00df)": "3,94 cm",
        "Touchscreen": "Nein",
        "VESA-Halterung": "Ja",
        "Verpackungsbreite": "675 mm",
        "Verpackungsh\u00f6he": "125 mm",
        "Verpackungstiefe": "387 mm",
        "Video Anschl\u00fcsse": "1x HDMI, 1x DisplayPort",
        "Warentarifnummer (HS)": "85285210"
    },
    "raw_specifications_text": "Displaygr\u00f6\u00dfe: 24 Zoll\nAufl\u00f6sung: 1920x1080\nPanel: IPS\nReaktionszeit: 5 ms\nVideo Anschl\u00fcsse: 1x HDMI, 1x DisplayPort\nHersteller Artikelnummer: LF24T370FWRXEN\nEAN: 8806092014534\nArtikelnummer: M15YBOKL\nBildschirmdiagonale: 61 cm (24 Zoll)\nDisplay-Aufl\u00f6sung: 1920 x 1080 Pixel\nNatives Seitenverh\u00e4ltnis: 16:9\nBildschirmtechnologie: LCD\nTouchscreen: Nein\nHD-Typ: Full HD\nPanel-Typ: IPS\nBildschirmform: Flach\nKontrastverh\u00e4ltnis: 1000:1\nMaximale Bildwiederholrate: 75 Hz\nAnzahl der Farben des Displays: 16,7 Millionen Farben\nHelligkeit (typisch): 250 cd/m\u00b2\nDynamisches Kontrastverh\u00e4ltnis Marketingbezeichnung: Mega-Kontrast\nBildwinkel, horizontal: 178\u00b0\nBildwinkel, vertikal: 178\u00b0\nNTSC Abdeckung (typisch): 72%\nAMD FreeSync: Ja\nAMD FreeSync-Typ: FreeSync\nFlimmerfreie Technologie: Ja\nSpiel-Modus: Ja\nMarktpositionierung: Business\nProduktfarbe: Schwarz\nHDMI: Ja\nAnzahl HDMI-Anschl\u00fcsse: 1\nHDMI-Version: 1.4\nAnzahl DisplayPort Anschl\u00fcsse: 1\nDisplayPorts-Version: 1.2\nVESA-Halterung: Ja\nPanel-Montage-Schnittstelle: 100 x 100 mm\nNeigungswinkelbereich: -2 - 20\u00b0\nNeigungsverstellung: Ja\nEnergieeffizienzklasse (SDR): E\nEnergieverbrauch (SDR) pro 1.000 Stunden: 18 kWh\nStromverbrauch (Standardbetrieb): 18 W\nStromverbrauch (Standby): 0,5 W\nStromverbrauch (aus): 0,3 W\nAC Eingangsspannung: 100 - 240 V\nBetriebstemperatur: 10 - 40 \u00b0C\nRelative Luftfeuchtigkeit in Betrieb: 10 - 80%\nMitgelieferte Kabel: AC, HDMI\nGer\u00e4tebreite (inkl. Fu\u00df): 539,2 mm\nGer\u00e4tetiefe (inkl. Fu\u00df): 232 mm\nGer\u00e4teh\u00f6he (inkl. Fu\u00df): 425,3 mm\nGewicht (mit St\u00e4nder): 2,9 kg\nBreite (ohne Standfu\u00df): 53,9 cm\nTiefe (ohne Standfu\u00df): 3,94 cm\nH\u00f6he (ohne Standfu\u00df): 32,3 cm\nGewicht (ohne St\u00e4nder): 2,6 kg\nVerpackungsbreite: 675 mm\nVerpackungstiefe: 387 mm\nVerpackungsh\u00f6he: 125 mm\nPaketgewicht: 4,2 kg\nWarentarifnummer (HS): 85285210",
    "reference_file": "offer_reference_1337.json",
    "shop_name": "mylemon.at"
}